aiter/configs/ci/a8w8_blockscale_tuned_gemm_smoke.csv
gfx,cu_num,M,N,K,libtype,kernelId,splitK,us,kernelName,tflops,bw,errRatio
gfx950,256,1,2048,3072,ck,8,2,4.8294,a8w8_blockscale_1x128x128_256x16x64x256_16x16_16x16_1x1_16x16x1_16x16x1_1x16x1x16_4_1x1_intrawave_v1,2.61,1304.22,0.0
gfx950,256,21015,3072,3072,ck,0,0,309.4021,a8w8_blockscale_1x128x128_256x128x128x128_16x16_32x32_2x2_8x32x1_8x32x1_1x32x1x8_8_1x1_intrawave_v3,1281.97,656.46,0.0
gfx950,256,33024,8192,3072,ck,0,0,1085.8203,a8w8_blockscale_1x128x128_256x128x128x128_16x16_32x32_2x2_8x32x1_8x32x1_1x32x1x8_8_1x1_intrawave_v3,1530.78,614.91,0.0
gfx950,256,8,2048,3072,cktile,20,3,8.9575,a8w8_blockscale_cktile_32x128x128_1x4x1_16x16x64_intrawave_0x1x0_4,11.24,708.77,0.0001
