op_tests/moe_benchmarking_profiling/results/profiling/kernels_with_counters.csv
config_idx,token,model_dim,inter_dim,expert,topk,act_type,dtype,q_dtype_a,q_dtype_w,q_type,use_g1u1,doweight_stage1,kernel_type,stage,block_m,kernel_name,time_us,quant_time_us,error,tflops,bandwidth_gb,FETCH_SIZE,WRITE_SIZE,MfmaUtil,SQ_BUSY_CU_CYCLES,SQ_INSTS_VALU_MFMA_MOPS_BF16,SQ_INSTS_VALU_MFMA_MOPS_I8,SQ_INSTS_VALU_MFMA_MOPS_F8,SQ_VALU_MFMA_BUSY_CYCLES,TCC_HIT,TCC_MISS,TCC_TAG_STALL_sum,TCP_PENDING_STALL_CYCLES_sum,GRBM_GUI_ACTIVE,LDSBankConflict,OccupancyPercent,MemUnitStalled,SQ_INSTS_LDS,SQ_INSTS_MFMA,SQ_INSTS_VALU,SQ_LDS_BANK_CONFLICT,SQ_LDS_IDX_ACTIVE,SQ_WAIT_ANY,SQ_WAVES_sum,SQ_WAVE_CYCLES,MFMA_FLOPS
0,1,7168,256,256,8,ActivationType.Silu,torch.bfloat16,torch.float8_e4m3fnuz,torch.float8_e4m3fnuz,QuantType.per_1x128,1,0,asm,stage1,16,_ZN5aiter59fmoe_stage1_bf16_pertokenFp8_blockscale_g1u1_16x128_4tg_pf3E,40.3084,24.53533333333335,22.07%,2.19,34963.13,28855.125,2.25,0.705586814,2330089.0,0.0,0.0,1835008.0,917504.0,11014.0,230892.0,27986.0,650969.0,827357.0,0.0,1.465922,0.00397833898,8640.0,57344.0,154896.0,0.0,61056.0,2929077.0,2048.0,3780562.0,939524096.0
0,1,7168,256,256,8,ActivationType.Silu,torch.bfloat16,torch.float8_e4m3fnuz,torch.float8_e4m3fnuz,QuantType.per_1x128,1,0,ck,stage2,16,moe_ck2stages_gemm2_256x16x128x256_1x4_MulABScaleExpertWeightA8W8blkscale_v1_Nswizzle0_Quant4_MulRoutedWeight1_F8_F8_B16,10.0729,24.53533333333335,15.97%,8.74,139910.81,14424.25,112.0,1.018144,4430877.0,0.0,0.0,917504.0,458752.0,12065.0,117218.0,749749.0,2277363.0,268432.0,2.936773,7.395611,0.0122073768,16576.0,28672.0,215488.0,315392.0,439040.0,4770223.0,1792.0,6353959.0,469762048.0
1,1,7168,256,257,9,ActivationType.Silu,torch.bfloat16,torch.float8_e4m3fnuz,torch.float8_e4m3fnuz,QuantType.per_1x128,1,0,asm,stage1,16,_ZN5aiter59fmoe_stage1_bf16_pertokenFp8_blockscale_g1u1_16x128_4tg_pf3E,39.9041,23.30211111111106,27.58%,2.48,35455.32,32442.75,2.75,0.815723722,2598667.0,0.0,0.0,2064384.0,1032192.0,11494.0,259608.0,27142.0,737087.0,809367.0,0.0,1.381242,0.00392061301,9720.0,64512.0,171778.0,0.0,68688.0,2617385.0,2056.0,3480750.0,1056964608.0
1,1,7168,256,257,9,ActivationType.Silu,torch.bfloat16,torch.float8_e4m3fnuz,torch.float8_e4m3fnuz,QuantType.per_1x128,1,0,ck,stage2,16,moe_ck2stages_gemm2_256x16x128x256_1x4_MulABScaleExpertWeightA8W8blkscale_v1_Nswizzle0_Quant4_MulRoutedWeight1_F8_F8_B16,10.661,23.30211111111106,18.04%,9.29,132709.19,16224.0,126.0,1.14817,4738447.0,0.0,0.0,1032192.0,516096.0,12441.0,131840.0,888872.0,2540572.0,268283.0,3.33112,8.674841,0.0123972544,18648.0,32256.0,242424.0,354816.0,493920.0,5305241.0,2016.0,7392042.0,528482304.0
2,2,7168,256,256,8,ActivationType.Silu,torch.bfloat16,torch.float8_e4m3fnuz,torch.float8_e4m3fnuz,QuantType.per_1x128,1,0,asm,stage1,16,_ZN5aiter59fmoe_stage1_bf16_pertokenFp8_blockscale_g1u1_16x128_4tg_pf3E,40.671,23.773999999999944,28.71%,4.33,34651.94,57612.125,4.75,1.389321,3730881.0,0.0,0.0,3670016.0,1835008.0,17002.0,460944.0,27316.0,1332837.0,849694.0,0.0,1.624381,0.0039325023,17280.0,114688.0,289392.0,0.0,122112.0,3082258.0,2056.0,4332231.0,1879048192.0
2,2,7168,256,256,8,ActivationType.Silu,torch.bfloat16,torch.float8_e4m3fnuz,torch.float8_e4m3fnuz,QuantType.per_1x128,1,0,ck,stage2,16,moe_ck2stages_gemm2_256x16x128x256_1x4_MulABScaleExpertWeightA8W8blkscale_v1_Nswizzle0_Quant4_MulRoutedWeight1_F8_F8_B16,14.435,23.773999999999944,15.14%,12.2,97632.78,28817.875,224.0,1.778914,7036790.0,0.0,0.0,1835008.0,917504.0,15071.0,234161.0,1584677.0,4404248.0,339992.0,4.542851,17.455805,0.0490558292,33152.0,57344.0,430976.0,630784.0,878080.0,11487365.0,3584.0,19390187.0,939524096.0
3,2,7168,256,257,9,ActivationType.Silu,torch.bfloat16,torch.float8_e4m3fnuz,torch.float8_e4m3fnuz,QuantType.per_1x128,1,0,asm,stage1,16,_ZN5aiter59fmoe_stage1_bf16_pertokenFp8_blockscale_g1u1_16x128_4tg_pf3E,40.8983,23.72555555555564,36.00%,4.85,34593.96,61197.125,5.3125,1.487148,3855832.0,0.0,0.0,3899392.0,1949696.0,17674.0,489666.0,27555.0,1439749.0,835735.0,0.0,1.804009,0.00403259741,18360.0,121856.0,306274.0,0.0,129744.0,3353292.0,2064.0,4691877.0,1996488704.0
3,2,7168,256,257,9,ActivationType.Silu,torch.bfloat16,torch.float8_e4m3fnuz,torch.float8_e4m3fnuz,QuantType.per_1x128,1,0,ck,stage2,16,moe_ck2stages_gemm2_256x16x128x256_1x4_MulABScaleExpertWeightA8W8blkscale_v1_Nswizzle0_Quant4_MulRoutedWeight1_F8_F8_B16,15.4579,23.72555555555564,17.42%,12.82,91528.23,30623.5,252.0,1.809916,7263721.0,0.0,0.0,1949696.0,974848.0,15575.0,249047.0,1643569.0,4576574.0,359630.0,4.695001,18.7442,0.10721245,35224.0,60928.0,458920.0,670208.0,932960.0,12219573.0,4032.0,21405768.0,998244352.0
4,4,2304,1536,8,2,ActivationType.Gelu,torch.bfloat16,torch.float8_e4m3fnuz,torch.float8_e4m3fnuz,QuantType.per_Token,1,0,asm,asm_1stage,32,_ZN5aiter45fmoe_bf16_pertokenFp8_g1u1_vs_gelu_1tg_32x128E,35.3891,0.0,0.00%,4.8,2400.8,62970.5,432.0,4.217469,3854569.0,0.0,0.0,7962624.0,3981312.0,38694.0,510704.0,25955.0,1420355.0,561200.0,0.0,2.186782,0.0101050231,93600.0,248832.0,916992.0,0.0,381312.0,1661238.0,432.0,3848554.0,4076863488.0
5,4,2304,1536,8,2,ActivationType.Gelu,torch.bfloat16,torch.float8_e4m3fnuz,torch.float8_e4m3fnuz,QuantType.per_Token,1,1,asm,asm_1stage,32,_ZN5aiter50fmoe_bf16_pertokenFp8_g1u1_vs_tkw1_gelu_1tg_32x128E,36.8311,0.0,0.00%,4.61,2306.81,62968.0,432.0,4.265268,4105025.0,0.0,0.0,7962624.0,3981312.0,37427.0,510688.0,25656.0,1574321.0,575099.0,0.0,2.285758,0.00850311358,93600.0,248832.0,839520.0,0.0,381312.0,1554635.0,432.0,4106406.0,4076863488.0
6,4,7168,256,256,8,ActivationType.Silu,torch.bfloat16,torch.float8_e4m3fnuz,torch.float8_e4m3fnuz,QuantType.per_1x128,1,0,asm,asm_1stage,32,_ZN5aiter47fmoe_bf16_blockscaleFp8_g1u1_vs_silu_1tg_32x128E,85.0389,0.0,0.00%,4.14,16573.26,172524.75,896.0,4.528381,12189489.0,0.0,0.0,22020096.0,11010048.0,45763.0,1394568.0,27064.0,7001825.0,1590106.0,0.0,2.545646,0.00926987957,268544.0,688128.0,2260048.0,0.0,1020928.0,6767400.0,2056.0,12522435.0,11274289152.0
7,4,7168,256,257,9,ActivationType.Silu,torch.bfloat16,torch.float8_e4m3fnuz,torch.float8_e4m3fnuz,QuantType.per_1x128,1,0,asm,asm_1stage,32,_ZN5aiter47fmoe_bf16_blockscaleFp8_g1u1_vs_silu_1tg_32x128E,86.705,0.0,0.00%,4.57,16318.29,183254.5,1008.0,4.642892,13225015.0,0.0,0.0,23396352.0,11698176.0,48176.0,1482200.0,27345.0,7733994.0,1624778.0,0.0,2.60802,0.0220544186,285328.0,731136.0,2400096.0,0.0,1084736.0,6920458.0,2064.0,13022589.0,11978932224.0
8,8,7168,256,256,8,ActivationType.Silu,torch.bfloat16,torch.float8_e4m3fnuz,torch.float8_e4m3fnuz,QuantType.per_1x128,1,0,asm,asm_1stage,32,_ZN5aiter47fmoe_bf16_blockscaleFp8_g1u1_vs_silu_1tg_32x128E,109.3836,0.0,0.00%,6.44,12885.46,317941.125,1792.0,6.983608,25666154.0,0.0,0.0,40599552.0,20299776.0,74174.0,2572234.0,117331.0,17276350.0,1984371.0,0.0,4.34868,0.103624397,495128.0,1268736.0,4149696.0,0.0,1882336.0,15917480.0,2064.0,26369962.0,20786970624.0
9,8,7168,256,257,9,ActivationType.Silu,torch.bfloat16,torch.float8_e4m3fnuz,torch.float8_e4m3fnuz,QuantType.per_1x128,1,0,asm,asm_1stage,32,_ZN5aiter47fmoe_bf16_blockscaleFp8_g1u1_vs_silu_1tg_32x128E,114.7458,0.0,0.00%,6.91,12331.29,355626.9375,2016.0,7.107418,30620867.0,0.0,0.0,45416448.0,22708224.0,82722.0,2877257.0,223275.0,21500391.0,1995158.0,0.0,4.939113,0.0955403265,553872.0,1419264.0,4639664.0,0.0,2105664.0,18580372.0,2072.0,30252871.0,23253221376.0
10,16,2048,192,128,8,ActivationType.Silu,torch.bfloat16,torch.bfloat16,torch.bfloat16,QuantType.No,1,0,ck,stage1,32,moe_ck2stages_gemm1_256x32x64x128_1x4_TypeCast_v1_Nswizzle0_Quant0_MulRoutedWeight0_silu_B16_B16_B16,37.5078,0.0,0.00%,8.05,8054.88,128123.75,48.0,4.519635,30130780.0,8159232.0,0.0,0.0,8159232.0,26842.0,1025410.0,8089646.0,25710400.0,865978.0,0.0947408372,8.083098,0.00367108854,165336.0,509952.0,953172.0,31872.0,1338624.0,18936479.0,1536.0,21754041.0,4177526784.0
10,16,2048,192,128,8,ActivationType.Silu,torch.bfloat16,torch.bfloat16,torch.bfloat16,QuantType.No,1,0,ck,stage2,32,moe_ck2stages_gemm2_256x32x64x64_1x4_TypeCastExpertWeight_v1_Nswizzle0_Quant0_MulRoutedWeight1_B16_B16_B16,24.3077,0.0,0.00%,12.42,12429.02,64449.625,512.0,5.635063,9323925.0,4079616.0,0.0,0.0,4079616.0,33605.0,523887.0,762290.0,5867816.0,502483.0,0.833295423,52.765639,0.127837099,225760.0,254976.0,1345312.0,169984.0,1752960.0,60496870.0,16384.0,86109335.0,2088763392.0
11,16,2048,192,128,8,ActivationType.Silu,torch.bfloat16,torch.bfloat16,torch.bfloat16,QuantType.No,1,1,ck,stage1,32,moe_ck2stages_gemm1_256x32x64x128_1x4_TypeCastExpertWeight_v1_Nswizzle0_Quant0_MulRoutedWeight1_silu_B16_B16_B16,37.7238,0.0,0.00%,8.01,8008.76,128155.875,48.0,5.56981,23817842.0,8159232.0,0.0,0.0,8159232.0,27037.0,1025675.0,3334692.0,19453707.0,865919.0,0.0953881825,8.22527,0.00369617236,165336.0,509952.0,968112.0,31872.0,1338624.0,19151873.0,1536.0,21986439.0,4177526784.0
11,16,2048,192,128,8,ActivationType.Silu,torch.bfloat16,torch.bfloat16,torch.bfloat16,QuantType.No,1,1,ck,stage2,32,moe_ck2stages_gemm2_256x32x64x64_1x4_TypeCast_v1_Nswizzle0_Quant0_MulRoutedWeight0_B16_B16_B16,23.7307,0.0,0.00%,12.73,12731.23,64350.1875,512.0,5.119009,12923798.0,4079616.0,0.0,0.0,4079616.0,31506.0,522978.0,1313874.0,9759266.0,515304.0,0.831152575,51.980425,0.134104422,225760.0,254976.0,1228448.0,169984.0,1752960.0,57622802.0,16384.0,85046628.0,2088763392.0
12,16,2048,192,128,8,ActivationType.Gelu,torch.bfloat16,torch.bfloat16,torch.bfloat16,QuantType.No,1,0,ck,stage1,32,moe_ck2stages_gemm1_256x32x64x128_1x4_TypeCast_v1_Nswizzle0_Quant0_MulRoutedWeight0_gelu_B16_B16_B16,37.2151,0.0,0.00%,8.11,8118.24,128132.4375,48.0,5.628256,23777990.0,8159232.0,0.0,0.0,8159232.0,29476.0,1025490.0,5368933.0,19568907.0,1108466.0,0.0732659473,8.505094,0.00283896351,165336.0,509952.0,869409.0,31872.0,1338624.0,26904140.0,1536.0,29598948.0,4177526784.0
12,16,2048,192,128,8,ActivationType.Gelu,torch.bfloat16,torch.bfloat16,torch.bfloat16,QuantType.No,1,0,ck,stage2,32,moe_ck2stages_gemm2_256x32x64x64_1x4_TypeCastExpertWeight_v1_Nswizzle0_Quant0_MulRoutedWeight1_B16_B16_B16,24.3182,0.0,0.00%,12.42,12423.66,64459.5,512.0,5.036853,12624277.0,4079616.0,0.0,0.0,4079616.0,33738.0,523768.0,1572638.0,9135781.0,375694.0,1.141395,45.814388,0.0711256609,225760.0,254976.0,1345312.0,169984.0,1752960.0,36625855.0,16384.0,54583834.0,2088763392.0
13,16,2048,192,128,8,ActivationType.Gelu,torch.bfloat16,torch.bfloat16,torch.bfloat16,QuantType.No,1,1,ck,stage1,32,moe_ck2stages_gemm1_256x32x64x128_1x4_TypeCastExpertWeight_v1_Nswizzle0_Quant0_MulRoutedWeight1_gelu_B16_B16_B16,37.4938,0.0,0.00%,8.05,8057.89,128164.875,48.0,4.59173,30163813.0,8159232.0,0.0,0.0,8159232.0,29710.0,1025739.0,5734824.0,25653414.0,855152.0,0.0949716968,8.166386,0.00368003406,165336.0,509952.0,895404.0,31872.0,1338624.0,19191158.0,1536.0,21924768.0,4177526784.0
13,16,2048,192,128,8,ActivationType.Gelu,torch.bfloat16,torch.bfloat16,torch.bfloat16,QuantType.No,1,1,ck,stage2,32,moe_ck2stages_gemm2_256x32x64x64_1x4_TypeCast_v1_Nswizzle0_Quant0_MulRoutedWeight0_B16_B16_B16,24.0152,0.0,0.00%,12.57,12580.41,64352.8125,512.0,4.999549,12933215.0,4079616.0,0.0,0.0,4079616.0,31385.0,523031.0,1262274.0,9778380.0,512373.0,0.82463152,52.181345,0.150841727,225760.0,254976.0,1228448.0,169984.0,1752960.0,60023712.0,16384.0,86050494.0,2088763392.0
14,16,4096,192,128,8,ActivationType.Silu,torch.bfloat16,torch.bfloat16,torch.bfloat16,QuantType.No,1,0,ck,stage1,32,moe_ck2stages_gemm1_256x32x64x128_1x4_TypeCast_v1_Nswizzle0_Quant0_MulRoutedWeight0_silu_B16_B16_B16,68.3851,0.0,0.00%,8.83,8835.87,262265.75,48.0,4.870524,66176086.0,16711680.0,0.0,0.0,16711680.0,34993.0,2098542.0,19203113.0,59000191.0,1801145.0,0.0469179398,9.397995,0.00177523455,332520.0,1044480.0,1588140.0,32640.0,2676480.0,47360722.0,1536.0,52304182.0,8556380160.0
14,16,4096,192,128,8,ActivationType.Silu,torch.bfloat16,torch.bfloat16,torch.bfloat16,QuantType.No,1,0,ck,stage2,32,moe_ck2stages_gemm2_256x32x64x64_1x4_TypeCastExpertWeight_v1_Nswizzle0_Quant0_MulRoutedWeight1_B16_B16_B16,43.021,0.0,0.06%,14.04,14045.28,131271.875,1024.0,8.02005,19327237.0,8355840.0,0.0,0.0,8355840.0,59262.0,1066552.0,4145878.0,13525062.0,986783.0,0.908751494,71.740621,0.169731841,462400.0,522240.0,2752064.0,348160.0,3590400.0,161266170.0,32768.0,219881584.0,4278190080.0
15,16,4096,192,128,8,ActivationType.Silu,torch.bfloat16,torch.bfloat16,torch.bfloat16,QuantType.No,1,1,ck,stage1,32,moe_ck2stages_gemm1_256x32x64x128_1x4_TypeCastExpertWeight_v1_Nswizzle0_Quant0_MulRoutedWeight1_silu_B16_B16_B16,68.5664,0.0,0.00%,8.81,8812.51,262298.125,48.0,4.826021,66062135.0,16711680.0,0.0,0.0,16711680.0,35523.0,2098813.0,15489695.0,58912888.0,2267264.0,0.0376054404,9.641391,0.00142287742,332520.0,1044480.0,1603440.0,32640.0,2676480.0,61979249.0,1536.0,66946699.0,8556380160.0
15,16,4096,192,128,8,ActivationType.Silu,torch.bfloat16,torch.bfloat16,torch.bfloat16,QuantType.No,1,1,ck,stage2,32,moe_ck2stages_gemm2_256x32x64x64_1x4_TypeCast_v1_Nswizzle0_Quant0_MulRoutedWeight0_B16_B16_B16,42.0674,0.0,0.00%,14.36,14363.66,131172.25,1024.0,8.646323,17759040.0,8355840.0,0.0,0.0,8355840.0,54016.0,1065801.0,3783419.0,12644679.0,958848.0,0.941526285,71.460524,0.278102623,462400.0,522240.0,2512704.0,348160.0,3590400.0,156971850.0,32768.0,211398845.0,4278190080.0
16,16,4096,192,128,8,ActivationType.Gelu,torch.bfloat16,torch.bfloat16,torch.bfloat16,QuantType.No,1,0,ck,stage1,32,moe_ck2stages_gemm1_256x32x64x128_1x4_TypeCast_v1_Nswizzle0_Quant0_MulRoutedWeight0_gelu_B16_B16_B16,68.26,0.0,0.00%,8.85,8852.06,262275.5,48.0,4.781509,66483341.0,16711680.0,0.0,0.0,16711680.0,38025.0,2098628.0,16650000.0,59461395.0,1666191.0,0.0507522529,9.318191,0.00192031349,332520.0,1044480.0,1513469.0,32640.0,2676480.0,43108362.0,1536.0,47942032.0,8556380160.0
16,16,4096,192,128,8,ActivationType.Gelu,torch.bfloat16,torch.bfloat16,torch.bfloat16,QuantType.No,1,0,ck,stage2,32,moe_ck2stages_gemm2_256x32x64x64_1x4_TypeCastExpertWeight_v1_Nswizzle0_Quant0_MulRoutedWeight1_B16_B16_B16,43.0789,0.0,0.11%,14.02,14026.4,131265.375,1024.0,8.09564,17448084.0,8355840.0,0.0,0.0,8355840.0,59566.0,1066535.0,3313889.0,11630024.0,971938.0,0.928210431,72.357418,0.144518333,462400.0,522240.0,2752064.0,348160.0,3590400.0,159847898.0,32768.0,217122823.0,4278190080.0
17,16,4096,192,128,8,ActivationType.Gelu,torch.bfloat16,torch.bfloat16,torch.bfloat16,QuantType.No,1,1,ck,stage1,32,moe_ck2stages_gemm1_256x32x64x128_1x4_TypeCastExpertWeight_v1_Nswizzle0_Quant0_MulRoutedWeight1_gelu_B16_B16_B16,68.4295,0.0,0.00%,8.83,8830.14,262307.375,48.0,6.530771,47753763.0,16711680.0,0.0,0.0,16711680.0,38251.0,2098885.0,9866044.0,40758919.0,2268111.0,0.0375805633,9.56623,0.00142193614,332520.0,1044480.0,1528980.0,32640.0,2676480.0,61613802.0,1536.0,66468773.0,8556380160.0
17,16,4096,192,128,8,ActivationType.Gelu,torch.bfloat16,torch.bfloat16,torch.bfloat16,QuantType.No,1,1,ck,stage2,32,moe_ck2stages_gemm2_256x32x64x64_1x4_TypeCast_v1_Nswizzle0_Quant0_MulRoutedWeight0_B16_B16_B16,41.8242,0.0,0.00%,14.44,14447.18,131177.3125,1024.0,5.341131,30929148.0,8355840.0,0.0,0.0,8355840.0,53881.0,1065795.0,6696183.0,25744204.0,659592.0,1.350323,64.881188,0.159466597,462400.0,522240.0,2512704.0,348160.0,3590400.0,94109983.0,32768.0,133828901.0,4278190080.0
18,16,4096,384,128,8,ActivationType.Gelu,torch.bfloat16,torch.bfloat16,torch.bfloat16,QuantType.No,1,0,ck,stage1,32,moe_ck2stages_gemm1_256x32x64x128_1x4_TypeCast_v1_Nswizzle0_Quant0_MulRoutedWeight0_gelu_B16_B16_B16,127.9362,0.0,0.00%,9.44,9443.94,506318.125,96.0,8.029813,82358845.0,32243712.0,0.0,0.0,32243712.0,53954.0,4051297.0,9948699.0,70571369.0,2666896.0,0.0617255974,17.447678,0.00906927961,641568.0,2015232.0,2922173.0,62976.0,5164032.0,70380053.0,3072.0,142408985.0,16508780544.0
18,16,4096,384,128,8,ActivationType.Gelu,torch.bfloat16,torch.bfloat16,torch.bfloat16,QuantType.No,1,0,ck,stage2,32,moe_ck2stages_gemm2_256x32x64x128_1x4_TypeCastExpertWeight_v1_Nswizzle0_Quant0_MulRoutedWeight1_B16_B16_B16,71.8811,0.0,0.50%,16.8,16808.61,253123.875,1024.0,7.550991,46192557.0,16121856.0,0.0,0.0,16121856.0,89573.0,2041390.0,8660755.0,36958150.0,1373048.0,0.636840649,49.101285,0.200356077,760960.0,1007616.0,4108160.0,335872.0,5982720.0,144476429.0,32768.0,207169524.0,8254390272.0
19,16,4096,384,128,8,ActivationType.Gelu,torch.bfloat16,torch.bfloat16,torch.bfloat16,QuantType.No,1,1,ck,stage1,32,moe_ck2stages_gemm1_256x32x64x128_1x4_TypeCastExpertWeight_v1_Nswizzle0_Quant0_MulRoutedWeight1_gelu_B16_B16_B16,133.5561,0.0,0.00%,9.04,9046.55,506386.8125,96.0,8.099026,82253399.0,32243712.0,0.0,0.0,32243712.0,54502.0,4051744.0,12562014.0,70057235.0,2860179.0,0.0574533706,17.494109,0.0110849717,641568.0,2015232.0,2950032.0,62976.0,5164032.0,76531163.0,3072.0,153405653.0,16508780544.0
19,16,4096,384,128,8,ActivationType.Gelu,torch.bfloat16,torch.bfloat16,torch.bfloat16,QuantType.No,1,1,ck,stage2,32,moe_ck2stages_gemm2_256x32x64x128_1x4_TypeCast_v1_Nswizzle0_Quant0_MulRoutedWeight0_B16_B16_B16,71.8063,0.0,0.00%,16.82,16826.12,253028.125,1024.0,7.415836,47633542.0,16121856.0,0.0,0.0,16121856.0,84736.0,2040641.0,8434683.0,39059128.0,1470484.0,0.591093334,47.781966,0.231689538,760960.0,1007616.0,3877248.0,335872.0,5982720.0,148272274.0,32768.0,217205961.0,8254390272.0
20,16,4096,384,128,8,ActivationType.Silu,torch.bfloat16,torch.bfloat16,torch.bfloat16,QuantType.No,1,0,ck,stage1,32,moe_ck2stages_gemm1_256x32x64x128_1x4_TypeCast_v1_Nswizzle0_Quant0_MulRoutedWeight0_silu_B16_B16_B16,128.3618,0.0,0.00%,9.41,9412.63,506318.6875,96.0,8.064345,82848976.0,32243712.0,0.0,0.0,32243712.0,50823.0,4051400.0,10694515.0,70939269.0,2631249.0,0.0626422421,17.408873,0.00652970971,641568.0,2015232.0,3064176.0,62976.0,5164032.0,69288096.0,3072.0,140013023.0,16508780544.0
20,16,4096,384,128,8,ActivationType.Silu,torch.bfloat16,torch.bfloat16,torch.bfloat16,QuantType.No,1,0,ck,stage2,32,moe_ck2stages_gemm2_256x32x64x128_1x4_TypeCastExpertWeight_v1_Nswizzle0_Quant0_MulRoutedWeight1_B16_B16_B16,71.6661,0.0,0.34%,16.86,16859.04,253127.875,1024.0,7.17232,49282586.0,16121856.0,0.0,0.0,16121856.0,89514.0,2041413.0,9642113.0,40077876.0,1409591.0,0.616809831,49.191819,0.205324444,760960.0,1007616.0,4108160.0,335872.0,5982720.0,148677098.0,32768.0,214291718.0,8254390272.0
21,16,4096,384,128,8,ActivationType.Silu,torch.bfloat16,torch.bfloat16,torch.bfloat16,QuantType.No,1,1,ck,stage1,32,moe_ck2stages_gemm1_256x32x64x128_1x4_TypeCastExpertWeight_v1_Nswizzle0_Quant0_MulRoutedWeight1_silu_B16_B16_B16,132.9472,0.0,0.00%,9.09,9087.98,506364.9375,96.0,7.951388,84037370.0,32243712.0,0.0,0.0,32243712.0,51208.0,4051811.0,10283701.0,72005500.0,2681150.0,0.0610077438,17.3402,0.00863249499,641568.0,2015232.0,3093696.0,62976.0,5164032.0,71263751.0,3072.0,143197095.0,16508780544.0
21,16,4096,384,128,8,ActivationType.Silu,torch.bfloat16,torch.bfloat16,torch.bfloat16,QuantType.No,1,1,ck,stage2,32,moe_ck2stages_gemm2_256x32x64x128_1x4_TypeCast_v1_Nswizzle0_Quant0_MulRoutedWeight0_B16_B16_B16,71.8737,0.0,0.00%,16.81,16810.35,253028.0,1024.0,6.673229,50999494.0,16121856.0,0.0,0.0,16121856.0,84732.0,2040637.0,8259733.0,42466060.0,1533814.0,0.566025475,46.196296,0.311886825,760960.0,1007616.0,3877248.0,335872.0,5982720.0,149781049.0,32768.0,219298149.0,8254390272.0
22,16,4096,384,128,8,ActivationType.Silu,torch.bfloat16,torch.float8_e4m3fnuz,torch.float8_e4m3fnuz,QuantType.per_Tensor,1,0,ck,stage1,16,moe_ck2stages_gemm1_256x16x128x256_1x4_MulABScale_v1_Nswizzle0_Quant1_MulRoutedWeight0_silu_F8_F8_B16,67.43,33.92877777777774,0.00%,17.91,8960.05,252556.375,96.0,3.552756,38764223.0,0.0,0.0,16121856.0,8060928.0,29126.0,2021254.0,4881813.0,32556701.0,1441440.0,2.610414,8.724494,0.00248255024,143664.0,503808.0,930864.0,1448448.0,2109696.0,23563875.0,1536.0,38727888.0,8254390272.0
22,16,4096,384,128,8,ActivationType.Silu,torch.bfloat16,torch.float8_e4m3fnuz,torch.float8_e4m3fnuz,QuantType.per_Tensor,1,0,ck,stage2,16,moe_ck2stages_gemm2_128x16x128x128_1x2_MulABScaleExpertWeight_v1_Nswizzle0_Quant1_MulRoutedWeight1_F8_F8_B16,42.7522,33.92877777777774,0.37%,28.25,14132.05,126578.875,4096.0,3.820251,18462976.0,0.0,0.0,8060928.0,4030464.0,36388.0,1078235.0,3873706.0,14703938.0,681552.0,3.571793,31.993937,0.353031537,133824.0,251904.0,1266176.0,953376.0,1656608.0,33387441.0,8192.0,68318082.0,4127195136.0
23,16,4096,384,128,8,ActivationType.Silu,torch.bfloat16,torch.float8_e4m3fnuz,torch.float8_e4m3fnuz,QuantType.per_Tensor,1,1,ck,stage1,16,moe_ck2stages_gemm1_256x16x128x256_1x4_MulABScale_v1_Nswizzle0_Quant1_MulRoutedWeight1_silu_F8_F8_B16,67.2327,34.7302222222222,0.00%,17.97,8986.35,252588.25,96.0,3.736319,38024120.0,0.0,0.0,16121856.0,8060928.0,29415.0,2021500.0,7569861.0,31732597.0,1448742.0,2.605346,8.808155,0.00222141416,143664.0,503808.0,947592.0,1448448.0,2109696.0,23815481.0,1536.0,39175304.0,8254390272.0
23,16,4096,384,128,8,ActivationType.Silu,torch.bfloat16,torch.float8_e4m3fnuz,torch.float8_e4m3fnuz,QuantType.per_Tensor,1,1,ck,stage2,16,moe_ck2stages_gemm2_128x16x128x128_1x2_MulABScaleExpertWeight_v1_Nswizzle0_Quant1_MulRoutedWeight0_F8_F8_B16,42.6345,34.7302222222222,0.00%,28.33,14171.07,126537.0,4096.0,3.97249,17900788.0,0.0,0.0,8060928.0,4030464.0,34100.0,1077899.0,2782271.0,14416664.0,681410.0,3.606045,31.875864,0.39206231,133824.0,251904.0,1203200.0,953376.0,1656608.0,33590715.0,8192.0,67419422.0,4127195136.0
24,16,4096,384,128,8,ActivationType.Silu,torch.bfloat16,torch.float8_e4m3fnuz,torch.float8_e4m3fnuz,QuantType.per_Token,1,0,asm,asm_1stage,32,_ZN5aiter45fmoe_bf16_pertokenFp8_g1u1_vs_silu_1tg_32x192E,112.4304,0.0,0.00%,10.74,5373.78,381553.5,2304.0,7.733921,37179349.0,0.0,0.0,48365568.0,24182784.0,109467.0,3089199.0,4713716.0,29006049.0,1960508.0,0.0,5.998724,0.0730597552,395568.0,1511424.0,4044304.0,0.0,1553408.0,24972361.0,1056.0,36099206.0,24763170816.0
25,16,4096,384,128,8,ActivationType.Silu,torch.bfloat16,torch.float8_e4m3fnuz,torch.float8_e4m3fnuz,QuantType.per_Token,1,1,asm,asm_1stage,32,_ZN5aiter50fmoe_bf16_pertokenFp8_g1u1_vs_tkw1_silu_1tg_32x192E,115.0153,0.0,0.00%,10.5,5253.01,381617.875,2048.0,7.709426,35983050.0,0.0,0.0,48365568.0,24182784.0,105697.0,3086238.0,4915867.0,27064043.0,2064522.0,0.0,5.888817,0.0927049042,364080.0,1511424.0,3718928.0,0.0,1469440.0,23441115.0,1056.0,37458011.0,24763170816.0
26,16,4096,384,128,8,ActivationType.Gelu,torch.bfloat16,torch.float8_e4m3fnuz,torch.float8_e4m3fnuz,QuantType.per_Tensor,1,0,ck,stage1,16,moe_ck2stages_gemm1_256x16x128x256_1x4_MulABScale_v1_Nswizzle0_Quant1_MulRoutedWeight0_gelu_F8_F8_B16,67.3296,33.75077777777775,0.00%,17.94,8973.41,252563.875,96.0,3.616958,38690753.0,0.0,0.0,16121856.0,8060928.0,31353.0,2021315.0,4868926.0,32470150.0,1467669.0,2.547959,8.407173,0.00217248313,143664.0,503808.0,859686.0,1448448.0,2109696.0,23106322.0,1536.0,38234070.0,8254390272.0
26,16,4096,384,128,8,ActivationType.Gelu,torch.bfloat16,torch.float8_e4m3fnuz,torch.float8_e4m3fnuz,QuantType.per_Tensor,1,0,ck,stage2,16,moe_ck2stages_gemm2_128x16x128x128_1x2_MulABScaleExpertWeight_v1_Nswizzle0_Quant1_MulRoutedWeight1_F8_F8_B16,42.6147,33.75077777777775,0.48%,28.35,14177.65,126586.625,4096.0,3.962659,17623508.0,0.0,0.0,8060928.0,4030464.0,36474.0,1078181.0,3713245.0,13935011.0,681971.0,3.580315,32.335111,0.384519882,133824.0,251904.0,1266176.0,953376.0,1656608.0,35105888.0,8192.0,68882250.0,4127195136.0
27,16,4096,384,128,8,ActivationType.Gelu,torch.bfloat16,torch.float8_e4m3fnuz,torch.float8_e4m3fnuz,QuantType.per_Tensor,1,1,ck,stage1,16,moe_ck2stages_gemm1_256x16x128x256_1x4_MulABScale_v1_Nswizzle0_Quant1_MulRoutedWeight1_gelu_F8_F8_B16,67.2416,32.958333333333336,0.00%,17.96,8985.16,252591.625,96.0,3.711177,37872654.0,0.0,0.0,16121856.0,8060928.0,30532.0,2021535.0,5587392.0,31733194.0,1421058.0,2.649977,8.835028,0.00225946752,143664.0,503808.0,854112.0,1448448.0,2109696.0,23436806.0,1536.0,38633032.0,8254390272.0
27,16,4096,384,128,8,ActivationType.Gelu,torch.bfloat16,torch.float8_e4m3fnuz,torch.float8_e4m3fnuz,QuantType.per_Tensor,1,1,ck,stage2,16,moe_ck2stages_gemm2_128x16x128x128_1x2_MulABScaleExpertWeight_v1_Nswizzle0_Quant1_MulRoutedWeight0_F8_F8_B16,42.5711,32.958333333333336,0.00%,28.38,14192.17,126539.375,4096.0,3.76125,18971639.0,0.0,0.0,8060928.0,4030464.0,34077.0,1077872.0,3571108.0,15285184.0,678517.0,3.603435,31.281723,0.394830578,133824.0,251904.0,1203200.0,953376.0,1656608.0,33135415.0,8192.0,66210704.0,4127195136.0
28,16,4096,384,128,8,ActivationType.Gelu,torch.bfloat16,torch.float8_e4m3fnuz,torch.float8_e4m3fnuz,QuantType.per_Token,1,0,asm,asm_1stage,32,_ZN5aiter45fmoe_bf16_pertokenFp8_g1u1_vs_gelu_1tg_32x192E,112.6642,0.0,0.00%,10.72,5362.63,381687.75,2304.0,8.041551,35966433.0,0.0,0.0,48365568.0,24182784.0,108061.0,3090765.0,4850830.0,27794930.0,1983400.0,0.0,5.842478,0.0781543532,395568.0,1511424.0,4091536.0,0.0,1553408.0,24242061.0,1056.0,35548692.0,24763170816.0
29,16,4096,384,128,8,ActivationType.Gelu,torch.bfloat16,torch.float8_e4m3fnuz,torch.float8_e4m3fnuz,QuantType.per_Token,1,1,asm,asm_1stage,32,_ZN5aiter50fmoe_bf16_pertokenFp8_g1u1_vs_tkw1_gelu_1tg_32x192E,115.0268,0.0,0.00%,10.5,5252.48,381541.625,2048.0,7.66926,37103614.0,0.0,0.0,48365568.0,24182784.0,107647.0,3084766.0,3969114.0,28200673.0,2039855.0,0.0,5.900757,0.0784636223,364080.0,1511424.0,3766160.0,0.0,1469440.0,23054557.0,1056.0,37082059.0,24763170816.0
30,16,4096,384,128,8,ActivationType.Silu,torch.bfloat16,torch.float8_e4m3fnuz,torch.float8_e4m3fnuz,QuantType.per_1x128,1,0,asm,asm_1stage,32,_ZN5aiter47fmoe_bf16_blockscaleFp8_g1u1_vs_silu_1tg_32x128E,117.3106,0.0,0.00%,10.3,5150.23,379077.4375,3072.0,8.464674,49295314.0,0.0,0.0,48365568.0,24182784.0,132793.0,3081612.0,4329550.0,39546003.0,1884083.0,0.0,8.564945,0.0634300792,607128.0,1511424.0,5081472.0,0.0,2318304.0,36549610.0,1584.0,49340935.0,24763170816.0
31,16,4096,384,128,8,ActivationType.Gelu,torch.bfloat16,torch.float8_e4m3fnuz,torch.float8_e4m3fnuz,QuantType.per_1x128,1,0,asm,asm_1stage,32,_ZN5aiter47fmoe_bf16_blockscaleFp8_g1u1_vs_gelu_1tg_32x128E,117.9595,0.0,0.09%,10.24,5121.9,379034.625,3072.0,8.228817,49284750.0,0.0,0.0,48365568.0,24182784.0,132908.0,3081832.0,5695108.0,39492098.0,1918726.0,0.0,8.47977,0.130608664,607128.0,1511424.0,5128704.0,0.0,2318304.0,37194967.0,1584.0,50038750.0,24763170816.0
32,16,4096,384,128,8,ActivationType.Silu,torch.bfloat16,torch.float8_e4m3fnuz,torch.float8_e4m3fnuz,QuantType.per_1x128,1,1,ck,stage1,16,moe_ck2stages_gemm1_128x16x128x128_1x2_MulABScaleExpertWeightA8W8blkscale_v1_Nswizzle0_Quant4_MulRoutedWeight1_silu_F8_F8_B16,72.6023,27.868333333333325,0.01%,16.64,8321.73,252688.125,96.0,3.743028,18882964.0,0.0,0.0,16121856.0,8060928.0,54650.0,2022296.0,5516313.0,30258820.0,1445674.0,1.536955,4.358803,0.00370962297,81672.0,503808.0,1199496.0,858048.0,1267392.0,16513841.0,768.0,19467381.0,8254390272.0
32,16,4096,384,128,8,ActivationType.Silu,torch.bfloat16,torch.float8_e4m3fnuz,torch.float8_e4m3fnuz,QuantType.per_1x128,1,1,ck,stage2,16,moe_ck2stages_gemm2_128x16x128x128_1x2_MulABScaleExpertWeightA8W8blkscale_v1_Nswizzle0_Quant4_MulRoutedWeight0_F8_F8_B16,42.3167,27.868333333333325,16.70%,28.55,14277.49,126842.25,1024.0,4.337477,15706575.0,0.0,0.0,8060928.0,4030464.0,52053.0,1031059.0,2922849.0,11022503.0,614890.0,7.000558,29.497186,0.109379554,112832.0,251904.0,1251136.0,1679360.0,2382592.0,25893124.0,8192.0,56608508.0,4127195136.0
33,16,4096,384,128,8,ActivationType.Gelu,torch.bfloat16,torch.float8_e4m3fnuz,torch.float8_e4m3fnuz,QuantType.per_1x128,1,1,ck,stage1,16,moe_ck2stages_gemm1_128x16x128x128_1x2_MulABScaleExpertWeightA8W8blkscale_v1_Nswizzle0_Quant4_MulRoutedWeight1_gelu_F8_F8_B16,72.1515,27.624333333333272,0.02%,16.74,8373.72,252704.25,96.0,3.699145,18897560.0,0.0,0.0,16121856.0,8060928.0,60409.0,2022416.0,5888066.0,30117602.0,1441980.0,1.533657,4.370372,0.00337903923,81672.0,503808.0,1122744.0,858048.0,1267392.0,16681526.0,768.0,19561034.0,8254390272.0
33,16,4096,384,128,8,ActivationType.Gelu,torch.bfloat16,torch.float8_e4m3fnuz,torch.float8_e4m3fnuz,QuantType.per_1x128,1,1,ck,stage2,16,moe_ck2stages_gemm2_128x16x128x128_1x2_MulABScaleExpertWeightA8W8blkscale_v1_Nswizzle0_Quant4_MulRoutedWeight0_F8_F8_B16,41.4639,27.624333333333272,16.61%,29.13,14571.14,126840.25,1024.0,4.277305,16275446.0,0.0,0.0,8060928.0,4030464.0,52640.0,1031182.0,2853097.0,11537125.0,634405.0,6.769285,30.312378,0.111701508,112832.0,251904.0,1251136.0,1679360.0,2382592.0,26504064.0,8192.0,60160438.0,4127195136.0
34,16,5120,1024,128,1,ActivationType.Silu,torch.bfloat16,torch.float8_e4m3fnuz,torch.float8_e4m3fnuz,QuantType.per_Token,1,1,asm,asm_1stage,32,_ZN5aiter50fmoe_bf16_pertokenFp8_g1u1_vs_tkw1_silu_1tg_32x128E,93.6399,0.0,0.02%,5.38,21502.71,249288.0,1280.0,6.718995,22222291.0,0.0,0.0,31457280.0,15728640.0,62120.0,2014816.0,165242.0,14156946.0,1535016.0,0.0,4.718952,0.0235638727,346624.0,983040.0,3033408.0,0.0,1398784.0,12681221.0,4128.0,22327628.0,16106127360.0
35,16,7168,256,256,8,ActivationType.Gelu,torch.bfloat16,torch.bfloat16,torch.bfloat16,QuantType.No,1,0,ck,stage1,32,moe_ck2stages_gemm1_256x32x64x128_1x4_TypeCast_v1_Nswizzle0_Quant0_MulRoutedWeight0_gelu_B16_B16_B16,195.2231,0.0,0.00%,7.22,14440.05,763923.6875,64.0,8.719652,113257636.0,48627712.0,0.0,0.0,48627712.0,48821.0,6111909.0,16229473.0,96211892.0,3499121.0,0.0404593134,14.758798,0.0036119062,959936.0,3039232.0,4059873.0,54272.0,7706624.0,92453098.0,2048.0,158379256.0,24897388544.0
35,16,7168,256,256,8,ActivationType.Gelu,torch.bfloat16,torch.bfloat16,torch.bfloat16,QuantType.No,1,0,ck,stage2,32,moe_ck2stages_gemm2_256x32x64x128_1x4_TypeCastExpertWeight_v1_Nswizzle0_Quant0_MulRoutedWeight1_B16_B16_B16,105.3374,0.0,1.68%,13.38,26761.92,380709.75,1792.0,8.604641,63770362.0,24313856.0,0.0,0.0,24313856.0,106353.0,3074389.0,8518634.0,50429421.0,1889640.0,1.051675,60.605448,0.210493318,1246560.0,1519616.0,6846112.0,759808.0,9735040.0,267198631.0,57344.0,350286998.0,12448694272.0
36,16,7168,256,256,8,ActivationType.Gelu,torch.bfloat16,torch.bfloat16,torch.bfloat16,QuantType.No,1,1,ck,stage1,32,moe_ck2stages_gemm1_256x32x64x128_1x4_TypeCastExpertWeight_v1_Nswizzle0_Quant0_MulRoutedWeight1_gelu_B16_B16_B16,196.3577,0.0,0.00%,7.18,14356.61,763974.75,64.0,8.809919,112528479.0,48627712.0,0.0,0.0,48627712.0,49287.0,6112382.0,11756476.0,95346404.0,3562302.0,0.0397489209,14.868036,0.00461303394,959936.0,3039232.0,4068704.0,54272.0,7706624.0,95135450.0,2048.0,162403014.0,24897388544.0
36,16,7168,256,256,8,ActivationType.Gelu,torch.bfloat16,torch.bfloat16,torch.bfloat16,QuantType.No,1,1,ck,stage2,32,moe_ck2stages_gemm2_256x32x64x128_1x4_TypeCast_v1_Nswizzle0_Quant0_MulRoutedWeight0_B16_B16_B16,105.2818,0.0,0.00%,13.39,26776.05,380597.75,1792.0,8.070256,66053317.0,24313856.0,0.0,0.0,24313856.0,96540.0,3073498.0,7240888.0,54266101.0,1971330.0,1.00198,58.140009,0.284834612,1246560.0,1519616.0,6323744.0,759808.0,9735040.0,273461794.0,57344.0,352703678.0,12448694272.0
37,16,7168,256,256,8,ActivationType.Gelu,torch.bfloat16,torch.float8_e4m3fnuz,torch.float8_e4m3fnuz,QuantType.per_Tensor,1,0,ck,stage1,16,moe_ck2stages_gemm1_256x16x128x256_1x4_MulABScale_v1_Nswizzle0_Quant1_MulRoutedWeight0_gelu_F8_F8_B16,97.0222,29.971666666666653,0.00%,14.53,14528.95,380921.875,64.0,4.101141,45832121.0,0.0,0.0,24313856.0,12156928.0,27213.0,3048015.0,5730828.0,37721706.0,1927340.0,3.001267,7.710802,0.00166575776,215392.0,759808.0,1117658.0,2225152.0,3202048.0,27487086.0,1024.0,45734575.0,12448694272.0
37,16,7168,256,256,8,ActivationType.Gelu,torch.bfloat16,torch.float8_e4m3fnuz,torch.float8_e4m3fnuz,QuantType.per_Tensor,1,0,ck,stage2,16,moe_ck2stages_gemm2_256x16x128x256_1x4_MulABScaleExpertWeight_v1_Nswizzle0_Quant1_MulRoutedWeight1_F8_F8_B16,58.923,29.971666666666653,1.74%,23.92,23923.26,190378.625,3584.0,4.161487,29660078.0,0.0,0.0,12156928.0,6078464.0,49266.0,1580423.0,4684283.0,23910065.0,913323.0,1.379106,68.432531,0.517364338,267120.0,379904.0,2739072.0,487200.0,2125536.0,122752105.0,28672.0,193402553.0,6224347136.0
38,16,7168,256,256,8,ActivationType.Gelu,torch.bfloat16,torch.float8_e4m3fnuz,torch.float8_e4m3fnuz,QuantType.per_Tensor,1,1,ck,stage1,16,moe_ck2stages_gemm1_256x16x128x256_1x4_MulABScale_v1_Nswizzle0_Quant1_MulRoutedWeight1_gelu_F8_F8_B16,97.2841,29.74888888888889,0.00%,14.49,14489.83,380950.75,64.0,3.98609,46396388.0,0.0,0.0,24313856.0,12156928.0,26805.0,3048130.0,6435475.0,38387064.0,1932146.0,2.995665,7.655596,0.00166264902,215392.0,759808.0,1097312.0,2225152.0,3202048.0,27210504.0,1024.0,45492036.0,12448694272.0
38,16,7168,256,256,8,ActivationType.Gelu,torch.bfloat16,torch.float8_e4m3fnuz,torch.float8_e4m3fnuz,QuantType.per_Tensor,1,1,ck,stage2,16,moe_ck2stages_gemm2_256x16x128x256_1x4_MulABScaleExpertWeight_v1_Nswizzle0_Quant1_MulRoutedWeight0_F8_F8_B16,58.7294,29.74888888888889,0.00%,24.0,24002.12,190325.0,3584.0,4.032117,29694648.0,0.0,0.0,12156928.0,6078464.0,43521.0,1579979.0,4278974.0,24224472.0,1026643.0,1.230522,67.872055,0.498454776,267120.0,379904.0,2549120.0,487200.0,2125536.0,141125723.0,28672.0,214980445.0,6224347136.0
39,16,7168,256,256,8,ActivationType.Gelu,torch.bfloat16,torch.float8_e4m3fnuz,torch.float8_e4m3fnuz,QuantType.per_Token,1,0,asm,asm_1stage,32,_ZN5aiter45fmoe_bf16_pertokenFp8_g1u1_vs_gelu_1tg_32x128E,162.1654,0.0,0.00%,8.69,8692.55,577051.25,3584.0,8.993338,64331435.0,0.0,0.0,72941568.0,36470784.0,104621.0,4673788.0,5352497.0,49867279.0,2651644.0,0.0,7.722487,0.0742384404,791184.0,2279424.0,7606160.0,0.0,3185088.0,44779094.0,2080.0,62929603.0,37346082816.0
40,16,7168,256,256,8,ActivationType.Gelu,torch.bfloat16,torch.float8_e4m3fnuz,torch.float8_e4m3fnuz,QuantType.per_Token,1,1,asm,asm_1stage,32,_ZN5aiter50fmoe_bf16_pertokenFp8_g1u1_vs_tkw1_gelu_1tg_32x128E,167.4095,0.0,0.00%,8.42,8420.25,577048.75,3584.0,8.743432,65229924.0,0.0,0.0,72941568.0,36470784.0,104535.0,4673826.0,5216311.0,49452013.0,2751018.0,0.0,7.745262,0.107118122,791184.0,2279424.0,6862464.0,0.0,3185088.0,43130994.0,2080.0,65409852.0,37346082816.0
41,16,7168,256,256,8,ActivationType.Silu,torch.bfloat16,torch.bfloat16,torch.bfloat16,QuantType.No,1,0,ck,stage1,32,moe_ck2stages_gemm1_256x32x64x128_1x4_TypeCast_v1_Nswizzle0_Quant0_MulRoutedWeight0_silu_B16_B16_B16,197.3954,0.0,0.00%,7.14,14281.14,763909.3125,64.0,8.895163,110675952.0,48627712.0,0.0,0.0,48627712.0,45862.0,6111822.0,12387649.0,93630040.0,3496532.0,0.0406526037,14.79131,0.00473214225,959936.0,3039232.0,4167072.0,54272.0,7706624.0,92160619.0,2048.0,157973439.0,24897388544.0
41,16,7168,256,256,8,ActivationType.Silu,torch.bfloat16,torch.bfloat16,torch.bfloat16,QuantType.No,1,0,ck,stage2,32,moe_ck2stages_gemm2_256x32x64x128_1x4_TypeCastExpertWeight_v1_Nswizzle0_Quant0_MulRoutedWeight1_B16_B16_B16,105.0992,0.0,1.40%,13.41,26822.57,380706.8125,1792.0,8.194919,66557720.0,24313856.0,0.0,0.0,24313856.0,106326.0,3074382.0,9954697.0,53297897.0,1930682.0,1.02421,61.118807,0.192625672,1246560.0,1519616.0,6846112.0,759808.0,9735040.0,277671458.0,57344.0,362726994.0,12448694272.0
42,16,7168,256,256,8,ActivationType.Silu,torch.bfloat16,torch.bfloat16,torch.bfloat16,QuantType.No,1,1,ck,stage1,32,moe_ck2stages_gemm1_256x32x64x128_1x4_TypeCastExpertWeight_v1_Nswizzle0_Quant0_MulRoutedWeight1_silu_B16_B16_B16,195.5189,0.0,0.00%,7.21,14418.2,763957.875,64.0,9.096675,110901223.0,48627712.0,0.0,0.0,48627712.0,46063.0,6112346.0,13949815.0,93703777.0,3585195.0,0.0395549047,14.698479,0.00313650745,959936.0,3039232.0,4192512.0,54272.0,7706624.0,93966859.0,2048.0,161338441.0,24897388544.0
42,16,7168,256,256,8,ActivationType.Silu,torch.bfloat16,torch.bfloat16,torch.bfloat16,QuantType.No,1,1,ck,stage2,32,moe_ck2stages_gemm2_256x32x64x128_1x4_TypeCast_v1_Nswizzle0_Quant0_MulRoutedWeight0_B16_B16_B16,105.2941,0.0,0.00%,13.38,26772.92,380594.875,1792.0,8.364862,65683265.0,24313856.0,0.0,0.0,24313856.0,96136.0,3073491.0,7596144.0,53909838.0,1825197.0,1.077927,58.607399,0.304739658,1246560.0,1519616.0,6323744.0,759808.0,9735040.0,255498060.0,57344.0,330488865.0,12448694272.0
43,16,7168,256,256,8,ActivationType.Silu,torch.bfloat16,torch.float8_e4m3fnuz,torch.float8_e4m3fnuz,QuantType.per_Tensor,1,0,ck,stage1,16,moe_ck2stages_gemm1_256x16x128x256_1x4_MulABScale_v1_Nswizzle0_Quant1_MulRoutedWeight0_silu_F8_F8_B16,97.5577,30.274777777777757,0.00%,14.45,14449.19,380916.0,64.0,4.037768,46408023.0,0.0,0.0,24313856.0,12156928.0,25204.0,3047927.0,8118801.0,38268534.0,1971990.0,2.942154,7.497112,0.0018967333,215392.0,759808.0,1163456.0,2225152.0,3202048.0,26898063.0,1024.0,45360548.0,12448694272.0
43,16,7168,256,256,8,ActivationType.Silu,torch.bfloat16,torch.float8_e4m3fnuz,torch.float8_e4m3fnuz,QuantType.per_Tensor,1,0,ck,stage2,16,moe_ck2stages_gemm2_256x16x128x256_1x4_MulABScaleExpertWeight_v1_Nswizzle0_Quant1_MulRoutedWeight1_F8_F8_B16,58.2884,30.274777777777757,1.38%,24.18,24183.72,190378.125,3584.0,4.316848,28154742.0,0.0,0.0,12156928.0,6078464.0,49375.0,1580423.0,3626009.0,22336692.0,968729.0,1.298382,68.625476,0.470675387,267120.0,379904.0,2739072.0,487200.0,2125536.0,132427895.0,28672.0,206006169.0,6224347136.0
44,16,7168,256,256,8,ActivationType.Silu,torch.bfloat16,torch.float8_e4m3fnuz,torch.float8_e4m3fnuz,QuantType.per_Tensor,1,1,ck,stage1,16,moe_ck2stages_gemm1_256x16x128x256_1x4_MulABScale_v1_Nswizzle0_Quant1_MulRoutedWeight1_silu_F8_F8_B16,97.4882,30.39433333333339,0.00%,14.46,14459.5,380940.0,64.0,4.13211,45877516.0,0.0,0.0,24313856.0,12156928.0,25937.0,3047971.0,7301718.0,37739300.0,1938554.0,2.980418,7.671498,0.00165418647,215392.0,759808.0,1177872.0,2225152.0,3202048.0,27343240.0,1024.0,45819745.0,12448694272.0
44,16,7168,256,256,8,ActivationType.Silu,torch.bfloat16,torch.float8_e4m3fnuz,torch.float8_e4m3fnuz,QuantType.per_Tensor,1,1,ck,stage2,16,moe_ck2stages_gemm2_256x16x128x256_1x4_MulABScaleExpertWeight_v1_Nswizzle0_Quant1_MulRoutedWeight0_F8_F8_B16,57.9521,30.39433333333339,0.00%,24.32,24324.06,190324.0,3584.0,3.938091,31234866.0,0.0,0.0,12156928.0,6078464.0,43733.0,1579982.0,4732551.0,25893496.0,992349.0,1.257055,66.534434,0.498932278,267120.0,379904.0,2549120.0,487200.0,2125536.0,134765759.0,28672.0,206295409.0,6224347136.0
45,16,7168,256,256,8,ActivationType.Silu,torch.bfloat16,torch.float8_e4m3fnuz,torch.float8_e4m3fnuz,QuantType.per_Token,1,0,asm,asm_1stage,32,_ZN5aiter45fmoe_bf16_pertokenFp8_g1u1_vs_silu_1tg_32x128E,166.8267,0.0,0.00%,8.45,8449.67,577048.75,3584.0,9.267933,62709357.0,0.0,0.0,72941568.0,36470784.0,104757.0,4673728.0,4945331.0,48309347.0,2767773.0,0.0,7.675079,0.117529656,791184.0,2279424.0,7565456.0,0.0,3185088.0,47700059.0,2080.0,65805129.0,37346082816.0
46,16,7168,256,256,8,ActivationType.Silu,torch.bfloat16,torch.float8_e4m3fnuz,torch.float8_e4m3fnuz,QuantType.per_Token,1,1,asm,asm_1stage,32,_ZN5aiter50fmoe_bf16_pertokenFp8_g1u1_vs_tkw1_silu_1tg_32x128E,166.2902,0.0,0.00%,8.47,8476.93,577047.375,3584.0,8.973507,65160933.0,0.0,0.0,72941568.0,36470784.0,105444.0,4673742.0,5300795.0,49422974.0,2740768.0,0.0,7.868143,0.118880044,791184.0,2279424.0,6821760.0,0.0,3185088.0,43714510.0,2080.0,65828958.0,37346082816.0
47,16,7168,256,256,8,ActivationType.Gelu,torch.bfloat16,torch.float8_e4m3fnuz,torch.float8_e4m3fnuz,QuantType.per_1x128,1,0,asm,asm_1stage,32,_ZN5aiter47fmoe_bf16_blockscaleFp8_g1u1_vs_gelu_1tg_32x128E,164.563,0.0,1.93%,8.56,8565.9,571179.5,3584.0,9.363356,61155241.0,0.0,0.0,72941568.0,36470784.0,127368.0,4626760.0,4946765.0,47063743.0,2465579.0,0.0,7.912797,0.0851498638,889552.0,2279424.0,7479808.0,0.0,3381824.0,41139807.0,2080.0,59819537.0,37346082816.0
48,16,7168,256,256,8,ActivationType.Gelu,torch.bfloat16,torch.float8_e4m3fnuz,torch.float8_e4m3fnuz,QuantType.per_1x128,1,1,ck,stage1,16,moe_ck2stages_gemm1_256x16x128x256_1x4_MulABScaleExpertWeightA8W8blkscale_v1_Nswizzle0_Quant4_MulRoutedWeight1_gelu_F8_F8_B16,101.3965,27.463888888888945,0.04%,13.9,13902.16,381240.625,64.0,4.03433,46625564.0,0.0,0.0,24313856.0,12156928.0,39880.0,3050455.0,7821628.0,37333338.0,1991914.0,3.010562,7.553059,0.00209552624,213696.0,759808.0,1570496.0,2306560.0,3283456.0,28285741.0,1024.0,46294574.0,12448694272.0
48,16,7168,256,256,8,ActivationType.Gelu,torch.bfloat16,torch.float8_e4m3fnuz,torch.float8_e4m3fnuz,QuantType.per_1x128,1,1,ck,stage2,16,moe_ck2stages_gemm2_256x16x128x256_1x4_MulABScaleExpertWeightA8W8blkscale_v1_Nswizzle0_Quant4_MulRoutedWeight0_F8_F8_B16,58.3523,27.463888888888945,16.57%,24.15,24157.23,190723.125,1792.0,4.327311,27994653.0,0.0,0.0,12156928.0,6078464.0,50487.0,1554481.0,4077744.0,21231481.0,959797.0,11.249295,66.702423,0.303475274,219632.0,379904.0,2686992.0,4178944.0,5817280.0,94356067.0,28672.0,198231576.0,6224347136.0
49,16,7168,256,256,8,ActivationType.Silu,torch.bfloat16,torch.float8_e4m3fnuz,torch.float8_e4m3fnuz,QuantType.per_1x128,1,0,asm,asm_1stage,32,_ZN5aiter47fmoe_bf16_blockscaleFp8_g1u1_vs_silu_1tg_32x128E,159.7283,0.0,0.00%,8.82,8825.18,571179.25,3584.0,9.48248,60494326.0,0.0,0.0,72941568.0,36470784.0,126836.0,4626836.0,4116982.0,46155605.0,2683022.0,0.0,7.666918,0.0960598055,889552.0,2279424.0,7439104.0,0.0,3381824.0,44562677.0,2080.0,63200245.0,37346082816.0
50,16,7168,256,256,8,ActivationType.Silu,torch.bfloat16,torch.float8_e4m3fnuz,torch.float8_e4m3fnuz,QuantType.per_1x128,1,1,ck,stage1,16,moe_ck2stages_gemm1_256x16x128x256_1x4_MulABScaleExpertWeightA8W8blkscale_v1_Nswizzle0_Quant4_MulRoutedWeight1_silu_F8_F8_B16,101.2092,27.91877777777785,0.01%,13.92,13927.89,381235.625,64.0,4.023808,46661804.0,0.0,0.0,24313856.0,12156928.0,37381.0,3050381.0,8019624.0,37138422.0,1965681.0,3.063672,7.736041,0.00220820412,213696.0,759808.0,1632400.0,2306560.0,3283456.0,28598535.0,1024.0,46594127.0,12448694272.0
50,16,7168,256,256,8,ActivationType.Silu,torch.bfloat16,torch.float8_e4m3fnuz,torch.float8_e4m3fnuz,QuantType.per_1x128,1,1,ck,stage2,16,moe_ck2stages_gemm2_256x16x128x256_1x4_MulABScaleExpertWeightA8W8blkscale_v1_Nswizzle0_Quant4_MulRoutedWeight0_F8_F8_B16,58.3291,27.91877777777785,16.56%,24.16,24166.84,190720.125,1792.0,4.250265,28613235.0,0.0,0.0,12156928.0,6078464.0,50451.0,1554514.0,4882110.0,21925142.0,939348.0,11.412357,63.747049,0.306654878,219632.0,379904.0,2686992.0,4178944.0,5817280.0,89125696.0,28672.0,186741687.0,6224347136.0
51,16,7168,256,257,9,ActivationType.Silu,torch.bfloat16,torch.float8_e4m3fnuz,torch.float8_e4m3fnuz,QuantType.per_Token,1,0,asm,asm_1stage,32,_ZN5aiter45fmoe_bf16_pertokenFp8_g1u1_vs_silu_1tg_32x256E,178.3177,0.0,0.00%,8.89,7936.03,633445.0625,2160.0,8.480071,42086566.0,0.0,0.0,80510976.0,40255488.0,100233.0,5102066.0,1226653.0,29736629.0,3049206.0,0.0,4.436796,0.0710964017,464724.0,2515968.0,5546920.0,0.0,1836432.0,11978227.0,1048.0,41295614.0,41221619712.0
52,16,7168,256,257,9,ActivationType.Silu,torch.bfloat16,torch.float8_e4m3fnuz,torch.float8_e4m3fnuz,QuantType.per_1x128,1,0,asm,asm_1stage,32,_ZN5aiter47fmoe_bf16_blockscaleFp8_g1u1_vs_silu_1tg_32x128E,180.0796,0.0,0.00%,8.8,7858.39,630364.0625,4032.0,9.671719,71904761.0,0.0,0.0,80510976.0,40255488.0,139357.0,5107415.0,7109316.0,56486603.0,2817374.0,0.0,8.513022,0.102577687,981864.0,2515968.0,8209088.0,0.0,3732768.0,52920757.0,2096.0,73467596.0,41221619712.0
53,16,7168,512,256,8,ActivationType.Gelu,torch.bfloat16,torch.bfloat16,torch.bfloat16,QuantType.No,1,0,ck,stage1,32,moe_ck2stages_gemm1_256x32x64x128_1x4_TypeCast_v1_Nswizzle0_Quant0_MulRoutedWeight0_gelu_B16_B16_B16,391.937,0.0,0.00%,7.19,14383.95,1511890.25,128.0,10.829796,200463538.0,96337920.0,0.0,0.0,96337920.0,87441.0,12096911.0,18695186.0,168456919.0,5784702.0,0.0487653301,28.060303,0.0101340452,1901760.0,6021120.0,8044532.0,107520.0,15267840.0,164963709.0,4096.0,494948976.0,49325015040.0
53,16,7168,512,256,8,ActivationType.Gelu,torch.bfloat16,torch.bfloat16,torch.bfloat16,QuantType.No,1,0,ck,stage2,32,moe_ck2stages_gemm2_256x32x64x64_1x4_TypeCastExpertWeight_v1_Nswizzle0_Quant0_MulRoutedWeight1_B16_B16_B16,213.5814,0.0,3.29%,13.2,26395.57,754031.125,1792.0,9.003955,123578534.0,48168960.0,0.0,0.0,48168960.0,158645.0,6060999.0,11419948.0,101928320.0,3418544.0,0.575699391,85.519228,0.202287995,2175600.0,3010560.0,8336272.0,752640.0,17169600.0,658089608.0,57344.0,894427793.0,24662507520.0
54,16,7168,512,256,8,ActivationType.Gelu,torch.bfloat16,torch.bfloat16,torch.bfloat16,QuantType.No,1,1,ck,stage1,32,moe_ck2stages_gemm1_256x32x64x64_1x4_TypeCastExpertWeight_v1_Nswizzle0_Quant0_MulRoutedWeight1_gelu_B16_B16_B16,394.2708,0.0,0.00%,7.15,14298.81,1508976.0625,128.0,11.141979,194880104.0,96337920.0,0.0,0.0,96337920.0,106669.0,12072643.0,17047302.0,162752015.0,5712111.0,0.0491462197,31.544885,0.000742541238,1901760.0,6021120.0,7848960.0,107520.0,15267840.0,430930535.0,4096.0,552100423.0,49325015040.0
54,16,7168,512,256,8,ActivationType.Gelu,torch.bfloat16,torch.bfloat16,torch.bfloat16,QuantType.No,1,1,ck,stage2,32,moe_ck2stages_gemm2_256x32x64x128_1x4_TypeCast_v1_Nswizzle0_Quant0_MulRoutedWeight0_B16_B16_B16,208.1048,0.0,0.00%,13.54,27090.21,753900.25,1792.0,9.53485,116739569.0,48168960.0,0.0,0.0,48168960.0,152096.0,6059910.0,9038798.0,95784638.0,3328596.0,0.589902065,51.502551,0.24441112,2175600.0,3010560.0,9512272.0,752640.0,17169600.0,362486651.0,57344.0,525685636.0,24662507520.0
55,16,7168,512,256,8,ActivationType.Gelu,torch.bfloat16,torch.float8_e4m3fnuz,torch.float8_e4m3fnuz,QuantType.per_Tensor,1,0,ck,stage1,16,moe_ck2stages_gemm1_128x16x64x128_1x2_MulABScale_v1_Nswizzle0_Quant1_MulRoutedWeight0_gelu_F8_F8_B16,198.7739,37.80133333333335,0.00%,14.18,14181.52,754362.375,128.0,6.710798,76082699.0,0.0,0.0,48168960.0,24084480.0,65959.0,6035958.0,6515868.0,63333833.0,2981671.0,3.914469,15.41795,0.00159885108,477120.0,1505280.0,2277115.0,4488960.0,6800640.0,125641228.0,2048.0,141445628.0,24662507520.0
55,16,7168,512,256,8,ActivationType.Gelu,torch.bfloat16,torch.float8_e4m3fnuz,torch.float8_e4m3fnuz,QuantType.per_Tensor,1,0,ck,stage2,16,moe_ck2stages_gemm2_256x16x128x256_1x4_MulABScaleExpertWeight_v1_Nswizzle0_Quant1_MulRoutedWeight1_F8_F8_B16,107.3711,37.80133333333335,3.22%,26.25,26253.96,377027.25,3584.0,5.117356,51851057.0,0.0,0.0,24084480.0,12042240.0,68137.0,3073614.0,4215701.0,42599271.0,1576627.0,0.76543025,65.820462,0.454202937,382200.0,752640.0,3138688.0,482496.0,3046176.0,177845765.0,28672.0,331924272.0,12331253760.0
56,16,7168,512,256,8,ActivationType.Gelu,torch.bfloat16,torch.float8_e4m3fnuz,torch.float8_e4m3fnuz,QuantType.per_Tensor,1,1,ck,stage1,16,moe_ck2stages_gemm1_256x16x128x256_1x4_MulABScale_v1_Nswizzle0_Quant1_MulRoutedWeight1_gelu_F8_F8_B16,198.6554,38.189222222222206,0.00%,14.19,14189.98,754875.3125,128.0,6.574318,71231852.0,0.0,0.0,48168960.0,24084480.0,37967.0,6040092.0,4480731.0,56237045.0,2356145.0,4.878764,13.561221,0.00806409558,426720.0,1505280.0,2173920.0,4408320.0,6343680.0,35991501.0,2048.0,98028437.0,24662507520.0
56,16,7168,512,256,8,ActivationType.Gelu,torch.bfloat16,torch.float8_e4m3fnuz,torch.float8_e4m3fnuz,QuantType.per_Tensor,1,1,ck,stage2,16,moe_ck2stages_gemm2_256x16x128x256_1x4_MulABScaleExpertWeight_v1_Nswizzle0_Quant1_MulRoutedWeight0_F8_F8_B16,108.895,38.189222222222206,0.00%,25.88,25886.55,376976.75,3584.0,4.199813,64491817.0,0.0,0.0,24084480.0,12042240.0,61651.0,3073200.0,7736369.0,55465840.0,1300646.0,0.966165002,65.492192,0.432490078,382200.0,752640.0,2950528.0,482496.0,3046176.0,140499205.0,28672.0,261650715.0,12331253760.0
57,16,7168,512,256,8,ActivationType.Gelu,torch.bfloat16,torch.float8_e4m3fnuz,torch.float8_e4m3fnuz,QuantType.per_Token,1,0,asm,asm_1stage,32,_ZN5aiter48fmoe_bf16_pertokenFp8_g1u1_vs_gelu_1tg_ps_32x512E,323.9433,0.0,0.00%,8.7,8701.88,1135199.625,1792.0,12.51969,47669540.0,0.0,0.0,144506880.0,72253440.0,144360.0,9108703.0,213068.0,24581869.0,4994545.0,0.0,4.039361,0.0271765057,406980.0,4515840.0,7550748.0,0.0,1627920.0,3570444.0,1216.0,61778952.0,73987522560.0
58,16,7168,512,256,8,ActivationType.Gelu,torch.bfloat16,torch.float8_e4m3fnuz,torch.float8_e4m3fnuz,QuantType.per_Token,1,1,asm,asm_1stage,32,_ZN5aiter50fmoe_bf16_pertokenFp8_g1u1_vs_tkw1_gelu_1tg_32x512E,323.8492,0.0,0.00%,8.7,8704.41,1135062.5,1792.0,12.645154,46646861.0,0.0,0.0,144506880.0,72253440.0,146300.0,9106450.0,282716.0,24249762.0,4187025.0,0.0,4.018228,0.0238261439,406980.0,4515840.0,7171400.0,0.0,1627920.0,3079275.0,1040.0,51448393.0,73987522560.0
59,16,7168,512,256,8,ActivationType.Silu,torch.bfloat16,torch.bfloat16,torch.bfloat16,QuantType.No,1,1,ck,stage1,32,moe_ck2stages_gemm1_256x32x64x128_1x4_TypeCastExpertWeight_v1_Nswizzle0_Quant0_MulRoutedWeight1_silu_B16_B16_B16,394.1746,0.0,0.00%,7.15,14302.3,1512041.25,128.0,11.154953,196508052.0,96337920.0,0.0,0.0,96337920.0,85359.0,12097147.0,17410024.0,164381779.0,5857445.0,0.0480875227,28.033774,0.0145096676,1901760.0,6021120.0,8305920.0,107520.0,15267840.0,167265082.0,4096.0,501450897.0,49325015040.0
59,16,7168,512,256,8,ActivationType.Silu,torch.bfloat16,torch.bfloat16,torch.bfloat16,QuantType.No,1,1,ck,stage2,32,moe_ck2stages_gemm2_256x32x64x64_1x4_TypeCast_v1_Nswizzle0_Quant0_MulRoutedWeight0_B16_B16_B16,210.9855,0.0,0.00%,13.36,26720.34,753929.25,1792.0,9.281027,121477331.0,48168960.0,0.0,0.0,48168960.0,147522.0,6060149.0,14641372.0,101234428.0,3384640.0,0.581303601,83.647103,0.176852182,2175600.0,3010560.0,7818832.0,752640.0,17169600.0,619012843.0,57344.0,866413432.0,24662507520.0
60,16,7168,512,256,8,ActivationType.Silu,torch.bfloat16,torch.float8_e4m3fnuz,torch.float8_e4m3fnuz,QuantType.per_Tensor,1,0,ck,stage1,16,moe_ck2stages_gemm1_256x16x128x256_1x4_MulABScale_v1_Nswizzle0_Quant1_MulRoutedWeight0_silu_F8_F8_B16,198.6065,36.89722222222222,0.00%,14.19,14193.47,754829.0,128.0,6.51275,72536784.0,0.0,0.0,48168960.0,24084480.0,36315.0,6039740.0,4764184.0,57584541.0,2395519.0,4.801848,13.651037,0.00936499343,426720.0,1505280.0,2304960.0,4408320.0,6343680.0,36387205.0,2048.0,100258298.0,24662507520.0
60,16,7168,512,256,8,ActivationType.Silu,torch.bfloat16,torch.float8_e4m3fnuz,torch.float8_e4m3fnuz,QuantType.per_Tensor,1,0,ck,stage2,16,moe_ck2stages_gemm2_256x16x128x256_1x4_MulABScaleExpertWeight_v1_Nswizzle0_Quant1_MulRoutedWeight1_F8_F8_B16,106.9685,36.89722222222222,2.72%,26.35,26352.77,377029.875,3584.0,4.263622,62616378.0,0.0,0.0,24084480.0,12042240.0,68258.0,3073613.0,6377608.0,53248492.0,1519697.0,0.787577606,64.463206,0.416451639,382200.0,752640.0,3138688.0,482496.0,3046176.0,167854163.0,28672.0,315938280.0,12331253760.0
61,16,7168,512,256,8,ActivationType.Silu,torch.bfloat16,torch.float8_e4m3fnuz,torch.float8_e4m3fnuz,QuantType.per_Tensor,1,1,ck,stage1,16,moe_ck2stages_gemm1_256x16x128x256_1x4_MulABScale_v1_Nswizzle0_Quant1_MulRoutedWeight1_silu_F8_F8_B16,198.1298,37.28055555555556,0.00%,14.23,14227.62,754879.75,128.0,6.767734,69556565.0,0.0,0.0,48168960.0,24084480.0,36744.0,6040043.0,6290071.0,54419524.0,2652624.0,4.350659,13.699168,0.00898195957,426720.0,1505280.0,2333520.0,4408320.0,6343680.0,40476611.0,2048.0,111045819.0,24662507520.0
61,16,7168,512,256,8,ActivationType.Silu,torch.bfloat16,torch.float8_e4m3fnuz,torch.float8_e4m3fnuz,QuantType.per_Tensor,1,1,ck,stage2,16,moe_ck2stages_gemm2_256x16x128x256_1x4_MulABScaleExpertWeight_v1_Nswizzle0_Quant1_MulRoutedWeight0_F8_F8_B16,107.4317,37.28055555555556,0.00%,26.24,26239.15,376978.375,3584.0,5.201648,51340051.0,0.0,0.0,24084480.0,12042240.0,61661.0,3073210.0,6233659.0,42493437.0,1315534.0,0.958017936,67.79398,0.430295586,382200.0,752640.0,2950528.0,482496.0,3046176.0,147619009.0,28672.0,273149994.0,12331253760.0
62,16,7168,512,256,8,ActivationType.Silu,torch.bfloat16,torch.float8_e4m3fnuz,torch.float8_e4m3fnuz,QuantType.per_Token,1,0,asm,asm_1stage,32,_ZN5aiter45fmoe_bf16_pertokenFp8_g1u1_vs_silu_1tg_32x256E,325.7172,0.0,0.00%,8.65,8654.49,1139834.625,3840.0,13.881764,81596552.0,0.0,0.0,144506880.0,72253440.0,148834.0,9177273.0,9622638.0,60171535.0,3645752.0,0.0,7.960567,0.0712000497,834120.0,4515840.0,9958000.0,0.0,3296160.0,26351438.0,2080.0,88864020.0,73987522560.0
63,16,7168,512,256,8,ActivationType.Silu,torch.bfloat16,torch.float8_e4m3fnuz,torch.float8_e4m3fnuz,QuantType.per_Token,1,1,asm,asm_1stage,32,_ZN5aiter53fmoe_bf16_pertokenFp8_g1u1_vs_tkw1_silu_1tg_ps_32x512E,325.7908,0.0,0.00%,8.65,8652.54,1134792.375,1792.0,11.907987,48924080.0,0.0,0.0,144506880.0,72253440.0,145399.0,9108951.0,380030.0,26297690.0,4555975.0,0.0,4.12514,0.0200041293,406980.0,4515840.0,7147548.0,0.0,1627920.0,3546962.0,1216.0,57580018.0,73987522560.0
64,16,7168,512,256,8,ActivationType.Silu,torch.bfloat16,torch.bfloat16,torch.bfloat16,QuantType.No,1,0,ck,stage1,32,moe_ck2stages_gemm1_256x32x64x128_1x4_TypeCast_v1_Nswizzle0_Quant0_MulRoutedWeight0_silu_B16_B16_B16,393.8771,0.0,0.00%,7.16,14313.1,1511899.125,128.0,11.402304,191464449.0,96337920.0,0.0,0.0,96337920.0,85467.0,12095869.0,13616223.0,159340679.0,5687106.0,0.049539281,28.359959,0.0128335857,1901760.0,6021120.0,8255520.0,107520.0,15267840.0,162227128.0,4096.0,492419392.0,49325015040.0
64,16,7168,512,256,8,ActivationType.Silu,torch.bfloat16,torch.bfloat16,torch.bfloat16,QuantType.No,1,0,ck,stage2,32,moe_ck2stages_gemm2_256x32x64x64_1x4_TypeCastExpertWeight_v1_Nswizzle0_Quant0_MulRoutedWeight1_B16_B16_B16,212.7974,0.0,2.77%,13.25,26492.82,754033.0625,1792.0,9.425295,119016249.0,48168960.0,0.0,0.0,48168960.0,159007.0,6060960.0,10558113.0,97312576.0,3317563.0,0.592015121,84.711678,0.16057773,2175600.0,3010560.0,8336272.0,752640.0,17169600.0,629231987.0,57344.0,861564441.0,24662507520.0
65,16,7168,512,256,8,ActivationType.Gelu,torch.bfloat16,torch.float8_e4m3fnuz,torch.float8_e4m3fnuz,QuantType.per_1x128,1,0,asm,stage1,16,_ZN5aiter59fmoe_stage1_bf16_pertokenFp8_blockscale_g1u1_16x512_2tg_pf2E,194.3748,28.310222222222187,14.65%,14.5,14502.48,753743.0,67.78125,4.360262,44602821.0,0.0,0.0,48168960.0,24084480.0,151607.0,6030578.0,42030.0,29367645.0,3609562.0,0.0,4.008618,0.00100419727,83160.0,1505280.0,3540765.0,0.0,453600.0,28016436.0,1056.0,44293712.0,24662507520.0
65,16,7168,512,256,8,ActivationType.Gelu,torch.bfloat16,torch.float8_e4m3fnuz,torch.float8_e4m3fnuz,QuantType.per_1x128,1,0,ck,stage2,16,moe_ck2stages_gemm2_256x16x128x256_1x4_MulABScaleExpertWeightA8W8blkscale_v1_Nswizzle0_Quant4_MulRoutedWeight1_F8_F8_B16,102.6166,28.310222222222187,15.47%,27.47,27470.37,377786.25,1792.0,4.402597,60347722.0,0.0,0.0,24084480.0,12042240.0,68137.0,3050998.0,4990090.0,49211208.0,1714000.0,6.245713,47.717454,0.192658094,335160.0,752640.0,3533096.0,4139520.0,6703200.0,132464345.0,28672.0,253008537.0,12331253760.0
66,16,7168,512,256,8,ActivationType.Silu,torch.bfloat16,torch.float8_e4m3fnuz,torch.float8_e4m3fnuz,QuantType.per_1x128,1,0,asm,asm_1stage,32,_ZN5aiter49fmoe_bf16_blockscaleFp8_g1u1_novs_silu_1tg_32x256E,328.4431,0.0,0.00%,8.58,8582.66,1134578.125,3840.0,13.033386,88492602.0,0.0,0.0,144506880.0,72253440.0,179611.0,9137911.0,9225289.0,64315834.0,3749557.0,0.0,7.956394,0.08729823,945840.0,4515840.0,11533000.0,0.0,3548160.0,21437289.0,2080.0,91369696.0,73987522560.0
67,16,7168,512,256,8,ActivationType.Gelu,torch.bfloat16,torch.float8_e4m3fnuz,torch.float8_e4m3fnuz,QuantType.per_1x128,1,1,ck,stage1,16,moe_ck2stages_gemm1_256x16x128x256_1x4_MulABScaleExpertWeightA8W8blkscale_v1_Nswizzle0_Quant4_MulRoutedWeight1_gelu_F8_F8_B16,195.5374,28.21622222222216,0.02%,14.41,14416.25,756148.5,128.0,6.120882,78978780.0,0.0,0.0,48168960.0,24084480.0,62629.0,6050259.0,8529774.0,61528515.0,2349675.0,5.07731,14.062801,0.0063966371,423360.0,1505280.0,3111360.0,4569600.0,6504960.0,43307994.0,2048.0,101252634.0,24662507520.0
67,16,7168,512,256,8,ActivationType.Gelu,torch.bfloat16,torch.float8_e4m3fnuz,torch.float8_e4m3fnuz,QuantType.per_1x128,1,1,ck,stage2,16,moe_ck2stages_gemm2_256x16x128x256_1x4_MulABScaleExpertWeightA8W8blkscale_v1_Nswizzle0_Quant4_MulRoutedWeight0_F8_F8_B16,107.024,28.21622222222216,16.63%,26.34,26339.1,377726.625,1792.0,4.322598,62747967.0,0.0,0.0,24084480.0,12042240.0,62459.0,3050546.0,6969374.0,51704252.0,1677716.0,6.419708,47.87813,0.217914643,335160.0,752640.0,3344936.0,4139520.0,6703200.0,128962663.0,28672.0,246980060.0,12331253760.0
68,16,7168,512,256,8,ActivationType.Silu,torch.bfloat16,torch.float8_e4m3fnuz,torch.float8_e4m3fnuz,QuantType.per_1x128,1,1,ck,stage1,16,moe_ck2stages_gemm1_256x16x128x256_1x4_MulABScaleExpertWeightA8W8blkscale_v1_Nswizzle0_Quant4_MulRoutedWeight1_silu_F8_F8_B16,195.9822,27.954111111111096,0.00%,14.38,14383.53,756116.875,128.0,5.956034,80857172.0,0.0,0.0,48168960.0,24084480.0,59217.0,6050034.0,6724223.0,63339896.0,2365027.0,5.045085,13.71086,0.0235781772,423360.0,1505280.0,3234000.0,4569600.0,6504960.0,42239502.0,2048.0,99349201.0,24662507520.0
68,16,7168,512,256,8,ActivationType.Silu,torch.bfloat16,torch.float8_e4m3fnuz,torch.float8_e4m3fnuz,QuantType.per_1x128,1,1,ck,stage2,16,moe_ck2stages_gemm2_256x16x128x256_1x4_MulABScaleExpertWeightA8W8blkscale_v1_Nswizzle0_Quant4_MulRoutedWeight0_F8_F8_B16,106.3682,27.954111111111096,16.83%,26.5,26501.5,377726.5,1792.0,5.049875,52258132.0,0.0,0.0,24084480.0,12042240.0,62489.0,3050555.0,5049535.0,41370965.0,1625011.0,6.635953,47.90509,0.193943776,335160.0,752640.0,3344936.0,4139520.0,6703200.0,125719446.0,28672.0,239066297.0,12331253760.0
69,16,7168,2048,33,10,ActivationType.Silu,torch.bfloat16,torch.float8_e4m3fnuz,torch.float8_e4m3fnuz,QuantType.per_1x128,1,0,asm,asm_1stage,32,_ZN5aiter47fmoe_bf16_blockscaleFp8_g1u1_vs_silu_1tg_32x128E,416.331,0.0,0.00%,33.85,3491.62,1422912.625,35840.0,12.512476,153103981.0,0.0,0.0,181665792.0,90832896.0,369990.0,11956028.0,12726630.0,118591882.0,4768311.0,0.0,10.587066,0.142283341,2215488.0,5677056.0,18500096.0,0.0,8422656.0,107875205.0,2432.0,154512477.0,93012885504.0
70,16,7168,2048,33,10,ActivationType.Silu,torch.bfloat16,torch.float8_e4m3fnuz,torch.float8_e4m3fnuz,QuantType.per_Token,1,0,asm,asm_1stage,32,_ZN5aiter48fmoe_bf16_pertokenFp8_g1u1_vs_silu_1tg_ps_32x512E,394.6449,0.0,0.00%,35.71,3683.49,1433506.0,8960.0,10.549954,88444410.0,0.0,0.0,181665792.0,90832896.0,152961.0,11611656.0,10724474.0,61475280.0,5470331.0,0.0,5.193955,0.0345048481,511632.0,5677056.0,9375984.0,0.0,2046528.0,4898603.0,1216.0,86762081.0,93012885504.0
71,32,2048,192,128,8,ActivationType.Silu,torch.bfloat16,torch.bfloat16,torch.bfloat16,QuantType.No,1,0,ck,stage1,32,moe_ck2stages_gemm1_256x32x64x64_1x4_TypeCast_v1_Nswizzle0_Quant0_MulRoutedWeight0_silu_B16_B16_B16,49.0513,0.0,0.00%,12.31,6161.96,173166.125,96.0,4.823052,47986806.0,11010048.0,0.0,0.0,11010048.0,31578.0,1386145.0,9952998.0,42638243.0,1481930.0,0.0753806682,11.70462,0.0021646002,223104.0,688128.0,1228416.0,43008.0,1806336.0,49877921.0,1632.0,53424020.0,5637144576.0
71,32,2048,192,128,8,ActivationType.Silu,torch.bfloat16,torch.bfloat16,torch.bfloat16,QuantType.No,1,0,ck,stage2,32,moe_ck2stages_gemm2_256x32x64x64_1x4_TypeCastExpertWeight_v1_Nswizzle0_Quant0_MulRoutedWeight1_B16_B16_B16,32.8944,0.0,0.00%,18.36,9188.56,87211.1875,1024.0,7.577467,11182282.0,5505024.0,0.0,0.0,5505024.0,50018.0,714112.0,1228887.0,7193278.0,643420.0,0.891032494,56.539359,0.149828767,304640.0,344064.0,1854656.0,229376.0,2365440.0,84058024.0,17408.0,116438150.0,2818572288.0
72,32,2048,192,128,8,ActivationType.Silu,torch.bfloat16,torch.bfloat16,torch.bfloat16,QuantType.No,1,1,ck,stage1,32,moe_ck2stages_gemm1_256x32x64x64_1x4_TypeCastExpertWeight_v1_Nswizzle0_Quant0_MulRoutedWeight1_silu_B16_B16_B16,49.4104,0.0,0.00%,12.22,6117.17,173212.125,96.0,6.005224,38104220.0,11010048.0,0.0,0.0,11010048.0,33475.0,1386500.0,5986705.0,32765192.0,1484749.0,0.0754369407,11.77701,0.00216621609,223104.0,688128.0,1248576.0,43008.0,1806336.0,50133709.0,1632.0,53714335.0,5637144576.0
72,32,2048,192,128,8,ActivationType.Silu,torch.bfloat16,torch.bfloat16,torch.bfloat16,QuantType.No,1,1,ck,stage2,32,moe_ck2stages_gemm2_256x32x64x64_1x4_TypeCast_v1_Nswizzle0_Quant0_MulRoutedWeight0_B16_B16_B16,32.3432,0.0,0.00%,18.67,9345.15,87095.6875,1024.0,5.38505,17149142.0,5505024.0,0.0,0.0,5505024.0,46983.0,713142.0,1597617.0,13459208.0,623803.0,0.940407204,56.894392,0.229290263,304640.0,344064.0,1696960.0,229376.0,2365440.0,80656466.0,17408.0,111017508.0,2818572288.0
73,32,2048,192,128,8,ActivationType.Gelu,torch.bfloat16,torch.bfloat16,torch.bfloat16,QuantType.No,1,0,ck,stage1,32,moe_ck2stages_gemm1_256x32x64x64_1x4_TypeCast_v1_Nswizzle0_Quant0_MulRoutedWeight0_gelu_B16_B16_B16,48.3862,0.0,0.00%,12.48,6246.66,173171.375,96.0,4.820613,47783122.0,11010048.0,0.0,0.0,11010048.0,33964.0,1386170.0,9831407.0,42534074.0,1469644.0,0.0754353317,11.905241,0.00216616989,223104.0,688128.0,1116269.0,43008.0,1806336.0,50936964.0,1632.0,54300349.0,5637144576.0
73,32,2048,192,128,8,ActivationType.Gelu,torch.bfloat16,torch.bfloat16,torch.bfloat16,QuantType.No,1,0,ck,stage2,32,moe_ck2stages_gemm2_256x32x64x64_1x4_TypeCastExpertWeight_v1_Nswizzle0_Quant0_MulRoutedWeight1_B16_B16_B16,33.2402,0.0,0.00%,18.17,9092.97,87212.125,1024.0,7.219311,12339675.0,5505024.0,0.0,0.0,5505024.0,50011.0,714156.0,1298187.0,8346260.0,596482.0,0.968061271,55.578561,0.196059249,304640.0,344064.0,1854656.0,229376.0,2365440.0,75385334.0,17408.0,105351910.0,2818572288.0
74,32,2048,192,128,8,ActivationType.Gelu,torch.bfloat16,torch.bfloat16,torch.bfloat16,QuantType.No,1,1,ck,stage1,32,moe_ck2stages_gemm1_256x32x64x64_1x4_TypeCastExpertWeight_v1_Nswizzle0_Quant0_MulRoutedWeight1_gelu_B16_B16_B16,48.7945,0.0,0.00%,12.38,6194.39,173222.6875,96.0,6.011643,38304352.0,11010048.0,0.0,0.0,11010048.0,36767.0,1386572.0,6448453.0,32869484.0,1551977.0,0.0711724173,11.525863,0.0020437578,223104.0,688128.0,1150464.0,43008.0,1806336.0,52311599.0,1632.0,55718701.0,5637144576.0
74,32,2048,192,128,8,ActivationType.Gelu,torch.bfloat16,torch.bfloat16,torch.bfloat16,QuantType.No,1,1,ck,stage2,32,moe_ck2stages_gemm2_256x32x64x64_1x4_TypeCast_v1_Nswizzle0_Quant0_MulRoutedWeight0_B16_B16_B16,32.2356,0.0,0.00%,18.74,9376.34,87090.0,1024.0,5.486533,17135100.0,5505024.0,0.0,0.0,5505024.0,46883.0,713180.0,1726587.0,13473918.0,608796.0,0.958981083,56.394224,0.191281139,304640.0,344064.0,1696960.0,229376.0,2365440.0,80521912.0,17408.0,107910213.0,2818572288.0
75,32,4096,192,128,8,ActivationType.Silu,torch.bfloat16,torch.bfloat16,torch.bfloat16,QuantType.No,1,0,ck,stage1,32,moe_ck2stages_gemm1_256x32x64x64_1x4_TypeCast_v1_Nswizzle0_Quant0_MulRoutedWeight0_silu_B16_B16_B16,90.9098,0.0,0.00%,13.29,6649.49,346374.875,96.0,6.48135,75062079.0,22020096.0,0.0,0.0,22020096.0,46928.0,2771497.0,10945893.0,66405390.0,2255314.0,0.0498485535,12.343485,0.00143143051,438144.0,1376256.0,2024064.0,43008.0,3526656.0,78963438.0,1632.0,85197030.0,11274289152.0
75,32,4096,192,128,8,ActivationType.Silu,torch.bfloat16,torch.bfloat16,torch.bfloat16,QuantType.No,1,0,ck,stage2,32,moe_ck2stages_gemm2_256x32x64x64_1x4_TypeCastExpertWeight_v1_Nswizzle0_Quant0_MulRoutedWeight1_B16_B16_B16,54.4749,0.0,0.07%,22.17,11096.93,173278.625,2048.0,8.370063,25678423.0,11010048.0,0.0,0.0,11010048.0,93809.0,1418925.0,5107935.0,18605297.0,1285408.0,0.922550425,76.258295,0.236017032,609280.0,688128.0,3713408.0,458752.0,4730880.0,234314912.0,34816.0,303364626.0,5637144576.0
76,32,4096,192,128,8,ActivationType.Silu,torch.bfloat16,torch.bfloat16,torch.bfloat16,QuantType.No,1,1,ck,stage1,32,moe_ck2stages_gemm1_256x32x64x64_1x4_TypeCastExpertWeight_v1_Nswizzle0_Quant0_MulRoutedWeight1_silu_B16_B16_B16,91.1703,0.0,0.00%,13.25,6630.49,346487.125,96.0,5.017673,98273685.0,22020096.0,0.0,0.0,22020096.0,48636.0,2772044.0,16545711.0,89388330.0,2099569.0,0.053586081,12.137634,0.0015505924,438144.0,1376256.0,2044224.0,43008.0,3526656.0,71665722.0,1632.0,77932980.0,11274289152.0
76,32,4096,192,128,8,ActivationType.Silu,torch.bfloat16,torch.bfloat16,torch.bfloat16,QuantType.No,1,1,ck,stage2,32,moe_ck2stages_gemm2_256x32x64x64_1x4_TypeCast_v1_Nswizzle0_Quant0_MulRoutedWeight0_B16_B16_B16,53.5878,0.0,0.00%,22.54,11280.63,173142.6875,2048.0,8.243787,25837084.0,11010048.0,0.0,0.0,11010048.0,86660.0,1418074.0,4542961.0,19551938.0,1262230.0,0.935457907,73.443158,0.324651928,609280.0,688128.0,3398016.0,458752.0,4730880.0,226653473.0,34816.0,288134359.0,5637144576.0
77,32,4096,192,128,8,ActivationType.Gelu,torch.bfloat16,torch.bfloat16,torch.bfloat16,QuantType.No,1,0,ck,stage1,32,moe_ck2stages_gemm1_256x32x64x64_1x4_TypeCast_v1_Nswizzle0_Quant0_MulRoutedWeight0_gelu_B16_B16_B16,90.878,0.0,0.00%,13.29,6651.82,346334.5,96.0,5.084081,96933024.0,22020096.0,0.0,0.0,22020096.0,49142.0,2771699.0,18219893.0,88271815.0,2092653.0,0.0536352444,12.2727,0.00154016757,438144.0,1376256.0,1933974.0,43008.0,3526656.0,72646354.0,1632.0,78727974.0,11274289152.0
77,32,4096,192,128,8,ActivationType.Gelu,torch.bfloat16,torch.bfloat16,torch.bfloat16,QuantType.No,1,0,ck,stage2,32,moe_ck2stages_gemm2_256x32x64x64_1x4_TypeCastExpertWeight_v1_Nswizzle0_Quant0_MulRoutedWeight1_B16_B16_B16,54.5566,0.0,0.11%,22.14,11080.31,173277.5,2048.0,8.262292,26227219.0,11010048.0,0.0,0.0,11010048.0,93720.0,1419046.0,5205061.0,19086982.0,1324481.0,0.895070246,75.234524,0.235084907,609280.0,688128.0,3713408.0,458752.0,4730880.0,236891977.0,34816.0,308480712.0,5637144576.0
78,32,4096,192,128,8,ActivationType.Gelu,torch.bfloat16,torch.bfloat16,torch.bfloat16,QuantType.No,1,1,ck,stage1,32,moe_ck2stages_gemm1_256x32x64x64_1x4_TypeCastExpertWeight_v1_Nswizzle0_Quant0_MulRoutedWeight1_gelu_B16_B16_B16,90.9629,0.0,0.00%,13.28,6645.61,346413.75,96.0,6.417086,75777796.0,22020096.0,0.0,0.0,22020096.0,52144.0,2771900.0,10346276.0,66970360.0,2129236.0,0.0526725334,12.227902,0.00151252276,438144.0,1376256.0,1946112.0,43008.0,3526656.0,73791233.0,1632.0,79874281.0,11274289152.0
78,32,4096,192,128,8,ActivationType.Gelu,torch.bfloat16,torch.bfloat16,torch.bfloat16,QuantType.No,1,1,ck,stage2,32,moe_ck2stages_gemm2_256x32x64x64_1x4_TypeCast_v1_Nswizzle0_Quant0_MulRoutedWeight0_B16_B16_B16,53.2864,0.0,0.00%,22.67,11344.43,173152.8125,2048.0,8.261312,26588182.0,11010048.0,0.0,0.0,11010048.0,86757.0,1417970.0,5398676.0,20368234.0,1274954.0,0.925509584,74.613303,0.313418041,609280.0,688128.0,3398016.0,458752.0,4730880.0,232798845.0,34816.0,295871616.0,5637144576.0
79,32,4096,384,128,8,ActivationType.Gelu,torch.bfloat16,torch.bfloat16,torch.bfloat16,QuantType.No,1,0,ck,stage1,32,moe_ck2stages_gemm1_256x32x64x64_1x4_TypeCast_v1_Nswizzle0_Quant0_MulRoutedWeight0_gelu_B16_B16_B16,183.304,0.0,0.00%,13.18,6592.78,679607.6875,192.0,8.678405,107199759.0,43253760.0,0.0,0.0,43253760.0,86400.0,5438273.0,10530173.0,92019941.0,3240189.0,0.0682645484,23.115102,0.00118986207,860640.0,2703360.0,3800913.0,84480.0,6927360.0,202535045.0,3264.0,228846612.0,22145925120.0
79,32,4096,384,128,8,ActivationType.Gelu,torch.bfloat16,torch.bfloat16,torch.bfloat16,QuantType.No,1,0,ck,stage2,32,moe_ck2stages_gemm2_256x32x64x128_1x4_TypeCastExpertWeight_v1_Nswizzle0_Quant0_MulRoutedWeight1_B16_B16_B16,96.3838,0.0,0.50%,25.07,12538.25,340207.6875,2048.0,7.448264,64125149.0,21626880.0,0.0,0.0,21626880.0,153635.0,2754442.0,8603449.0,52236184.0,1747649.0,0.674195987,49.935268,0.255335869,1020800.0,1351680.0,5596288.0,450560.0,8025600.0,193279338.0,34816.0,266970851.0,11072962560.0
80,32,4096,384,128,8,ActivationType.Gelu,torch.bfloat16,torch.bfloat16,torch.bfloat16,QuantType.No,1,1,ck,stage1,32,moe_ck2stages_gemm1_256x32x64x128_1x4_TypeCastExpertWeight_v1_Nswizzle0_Quant0_MulRoutedWeight1_gelu_B16_B16_B16,180.4889,0.0,0.00%,13.39,6695.61,680962.375,192.0,8.607883,106707996.0,43253760.0,0.0,0.0,43253760.0,84771.0,5449243.0,9323486.0,91361180.0,3231596.0,0.0678783728,22.802733,0.00932765186,860640.0,2703360.0,3957360.0,84480.0,6927360.0,87013125.0,3264.0,227038430.0,22145925120.0
80,32,4096,384,128,8,ActivationType.Gelu,torch.bfloat16,torch.bfloat16,torch.bfloat16,QuantType.No,1,1,ck,stage2,32,moe_ck2stages_gemm2_256x32x64x128_1x4_TypeCast_v1_Nswizzle0_Quant0_MulRoutedWeight0_B16_B16_B16,96.1625,0.0,0.00%,25.12,12567.1,340069.75,2048.0,7.282387,64716418.0,21626880.0,0.0,0.0,21626880.0,147215.0,2753367.0,8937881.0,53638812.0,1822072.0,0.64472156,48.195857,0.386378614,1020800.0,1351680.0,5286528.0,450560.0,8025600.0,189166938.0,34816.0,269451209.0,11072962560.0
81,32,4096,384,128,8,ActivationType.Silu,torch.bfloat16,torch.bfloat16,torch.bfloat16,QuantType.No,1,0,ck,stage1,32,moe_ck2stages_gemm1_256x32x64x128_1x4_TypeCast_v1_Nswizzle0_Quant0_MulRoutedWeight0_silu_B16_B16_B16,179.3059,0.0,0.00%,13.47,6739.79,680833.4375,192.0,8.699928,105816479.0,43253760.0,0.0,0.0,43253760.0,81384.0,5448378.0,11642029.0,90487601.0,3369573.0,0.0655432211,22.675546,0.0129720958,860640.0,2703360.0,4110480.0,84480.0,6927360.0,87736305.0,3264.0,233815804.0,22145925120.0
81,32,4096,384,128,8,ActivationType.Silu,torch.bfloat16,torch.bfloat16,torch.bfloat16,QuantType.No,1,0,ck,stage2,32,moe_ck2stages_gemm2_256x32x64x128_1x4_TypeCastExpertWeight_v1_Nswizzle0_Quant0_MulRoutedWeight1_B16_B16_B16,96.46,0.0,0.40%,25.05,12528.34,340204.375,2048.0,7.850342,61581984.0,21626880.0,0.0,0.0,21626880.0,153593.0,2754449.0,8053423.0,49504233.0,1838712.0,0.639789887,49.454537,0.26619596,1020800.0,1351680.0,5596288.0,450560.0,8025600.0,200952317.0,34816.0,278619426.0,11072962560.0
82,32,4096,384,128,8,ActivationType.Silu,torch.bfloat16,torch.bfloat16,torch.bfloat16,QuantType.No,1,1,ck,stage1,32,moe_ck2stages_gemm1_256x32x64x64_1x4_TypeCastExpertWeight_v1_Nswizzle0_Quant0_MulRoutedWeight1_silu_B16_B16_B16,179.7425,0.0,0.00%,13.44,6723.42,679675.1875,192.0,8.653134,106354393.0,43253760.0,0.0,0.0,43253760.0,85823.0,5438949.0,11226949.0,90982721.0,3277908.0,0.0675063795,23.531439,0.00116146452,860640.0,2703360.0,4015440.0,84480.0,6927360.0,208836438.0,3264.0,235584958.0,22145925120.0
82,32,4096,384,128,8,ActivationType.Silu,torch.bfloat16,torch.bfloat16,torch.bfloat16,QuantType.No,1,1,ck,stage2,32,moe_ck2stages_gemm2_256x32x64x128_1x4_TypeCast_v1_Nswizzle0_Quant0_MulRoutedWeight0_B16_B16_B16,96.2862,0.0,0.00%,25.09,12550.96,340079.5,2048.0,7.809117,61731374.0,21626880.0,0.0,0.0,21626880.0,147214.0,2753430.0,10397369.0,50725673.0,1891633.0,0.622817044,49.102168,0.319226219,1020800.0,1351680.0,5286528.0,450560.0,8025600.0,201301802.0,34816.0,284172989.0,11072962560.0
83,32,4096,384,128,8,ActivationType.Silu,torch.bfloat16,torch.float8_e4m3fnuz,torch.float8_e4m3fnuz,QuantType.per_Tensor,1,0,ck,stage1,16,moe_ck2stages_gemm1_128x16x64x128_1x2_MulABScale_v1_Nswizzle0_Quant1_MulRoutedWeight0_silu_F8_F8_B16,93.0593,44.838555555555565,0.00%,25.96,6494.49,339601.25,192.0,3.712751,51505406.0,0.0,0.0,21626880.0,10813440.0,58879.0,2718497.0,6868853.0,52268395.0,1897001.0,2.740739,11.179462,0.00216715599,216480.0,675840.0,1273800.0,2006400.0,3062400.0,59619807.0,1728.0,65472785.0,11072962560.0
83,32,4096,384,128,8,ActivationType.Silu,torch.bfloat16,torch.float8_e4m3fnuz,torch.float8_e4m3fnuz,QuantType.per_Tensor,1,0,ck,stage2,16,moe_ck2stages_gemm2_128x16x128x128_1x2_MulABScaleExpertWeight_v1_Nswizzle0_Quant1_MulRoutedWeight1_F8_F8_B16,55.2053,44.838555555555565,0.38%,43.76,10947.73,170110.125,8192.0,4.097232,25738204.0,0.0,0.0,10813440.0,5406720.0,52922.0,1492007.0,4663764.0,21264169.0,872123.0,3.771012,33.441534,0.471920533,179520.0,337920.0,1764864.0,1282464.0,2225824.0,48823256.0,9216.0,90983658.0,5536481280.0
84,32,4096,384,128,8,ActivationType.Silu,torch.bfloat16,torch.float8_e4m3fnuz,torch.float8_e4m3fnuz,QuantType.per_Tensor,1,1,ck,stage1,16,moe_ck2stages_gemm1_128x16x64x128_1x2_MulABScale_v1_Nswizzle0_Quant1_MulRoutedWeight1_silu_F8_F8_B16,92.3156,44.46877777777775,0.00%,26.17,6546.81,339673.25,192.0,3.736149,50500877.0,0.0,0.0,21626880.0,10813440.0,58531.0,2719005.0,9773456.0,51813015.0,1864638.0,2.813779,11.423312,0.00195845413,216480.0,675840.0,1296240.0,2006400.0,3062400.0,59348591.0,1728.0,65164273.0,11072962560.0
84,32,4096,384,128,8,ActivationType.Silu,torch.bfloat16,torch.float8_e4m3fnuz,torch.float8_e4m3fnuz,QuantType.per_Tensor,1,1,ck,stage2,16,moe_ck2stages_gemm2_128x16x128x128_1x2_MulABScaleExpertWeight_v1_Nswizzle0_Quant1_MulRoutedWeight0_F8_F8_B16,54.9597,44.46877777777775,0.00%,43.96,10996.66,170055.875,8192.0,3.839684,27335438.0,0.0,0.0,10813440.0,5406720.0,49815.0,1491566.0,4992287.0,22835158.0,960005.0,3.421187,32.892265,0.528651599,179520.0,337920.0,1680384.0,1282464.0,2225824.0,54561827.0,9216.0,98639787.0,5536481280.0
85,32,4096,384,128,8,ActivationType.Silu,torch.bfloat16,torch.float8_e4m3fnuz,torch.float8_e4m3fnuz,QuantType.per_Token,1,0,asm,asm_1stage,32,_ZN5aiter45fmoe_bf16_pertokenFp8_g1u1_vs_silu_1tg_32x192E,146.1061,0.0,0.00%,16.54,4136.53,513751.375,4608.0,8.873996,59375779.0,0.0,0.0,64880640.0,32440320.0,135303.0,4182378.0,7856035.0,48751525.0,2461823.0,0.0,8.038592,0.12258686,530640.0,2027520.0,5422000.0,0.0,2083840.0,44098921.0,1088.0,60780889.0,33218887680.0
86,32,4096,384,128,8,ActivationType.Silu,torch.bfloat16,torch.float8_e4m3fnuz,torch.float8_e4m3fnuz,QuantType.per_Token,1,1,asm,asm_1stage,32,_ZN5aiter50fmoe_bf16_pertokenFp8_g1u1_vs_tkw1_silu_1tg_32x192E,148.3047,0.0,0.00%,16.29,4075.21,513483.5,4096.0,8.880022,60202545.0,0.0,0.0,64880640.0,32440320.0,130932.0,4174888.0,7715950.0,48640967.0,2421800.0,0.0,8.07446,0.0994864321,488400.0,2027520.0,4985520.0,0.0,1971200.0,39508295.0,1088.0,60165286.0,33218887680.0
87,32,4096,384,128,8,ActivationType.Gelu,torch.bfloat16,torch.float8_e4m3fnuz,torch.float8_e4m3fnuz,QuantType.per_Tensor,1,0,ck,stage1,16,moe_ck2stages_gemm1_128x16x64x128_1x2_MulABScale_v1_Nswizzle0_Quant1_MulRoutedWeight0_gelu_F8_F8_B16,92.8197,44.726999999999975,0.00%,26.03,6511.26,339617.375,192.0,3.767138,49688304.0,0.0,0.0,21626880.0,10813440.0,60197.0,2718595.0,8389129.0,50613028.0,1907297.0,2.755971,11.332632,0.00216615166,216480.0,675840.0,1194051.0,2006400.0,3062400.0,60186147.0,1728.0,66002988.0,11072962560.0
87,32,4096,384,128,8,ActivationType.Gelu,torch.bfloat16,torch.float8_e4m3fnuz,torch.float8_e4m3fnuz,QuantType.per_Tensor,1,0,ck,stage2,16,moe_ck2stages_gemm2_128x16x128x128_1x2_MulABScaleExpertWeight_v1_Nswizzle0_Quant1_MulRoutedWeight1_F8_F8_B16,55.1595,44.726999999999975,0.51%,43.8,10956.83,170106.125,8192.0,3.899764,26533319.0,0.0,0.0,10813440.0,5406720.0,52902.0,1491966.0,4517868.0,21922613.0,916049.0,3.603174,33.594557,0.63535074,179520.0,337920.0,1764864.0,1282464.0,2225824.0,51350713.0,9216.0,95657474.0,5536481280.0
88,32,4096,384,128,8,ActivationType.Gelu,torch.bfloat16,torch.float8_e4m3fnuz,torch.float8_e4m3fnuz,QuantType.per_Tensor,1,1,ck,stage1,16,moe_ck2stages_gemm1_128x16x64x128_1x2_MulABScale_v1_Nswizzle0_Quant1_MulRoutedWeight1_gelu_F8_F8_B16,92.2189,44.79844444444444,0.00%,26.2,6553.68,339672.5,192.0,3.770733,49285819.0,0.0,0.0,21626880.0,10813440.0,62441.0,2719148.0,8414518.0,51135983.0,1879716.0,2.783354,11.365246,0.00214813768,216480.0,675840.0,1170840.0,2006400.0,3062400.0,59923347.0,1728.0,65541732.0,11072962560.0
88,32,4096,384,128,8,ActivationType.Gelu,torch.bfloat16,torch.float8_e4m3fnuz,torch.float8_e4m3fnuz,QuantType.per_Tensor,1,1,ck,stage2,16,moe_ck2stages_gemm2_128x16x128x128_1x2_MulABScaleExpertWeight_v1_Nswizzle0_Quant1_MulRoutedWeight0_F8_F8_B16,55.2368,44.79844444444444,0.00%,43.74,10941.49,170048.5,8192.0,3.865488,27143454.0,0.0,0.0,10813440.0,5406720.0,49934.0,1491575.0,5270827.0,22735122.0,891015.0,3.718527,33.832924,0.546776525,179520.0,337920.0,1680384.0,1282464.0,2225824.0,51254356.0,9216.0,93347734.0,5536481280.0
89,32,4096,384,128,8,ActivationType.Gelu,torch.bfloat16,torch.float8_e4m3fnuz,torch.float8_e4m3fnuz,QuantType.per_Token,1,0,asm,asm_1stage,32,_ZN5aiter45fmoe_bf16_pertokenFp8_g1u1_vs_gelu_1tg_32x192E,146.4346,0.0,0.00%,16.5,4127.26,513630.125,4608.0,8.983696,58920465.0,0.0,0.0,64880640.0,32440320.0,133315.0,4181959.0,6992103.0,48229009.0,2369645.0,0.0,8.174102,0.105630697,530640.0,2027520.0,5485360.0,0.0,2083840.0,43182873.0,1088.0,59717365.0,33218887680.0
90,32,4096,384,128,8,ActivationType.Gelu,torch.bfloat16,torch.float8_e4m3fnuz,torch.float8_e4m3fnuz,QuantType.per_Token,1,1,asm,asm_1stage,32,_ZN5aiter50fmoe_bf16_pertokenFp8_g1u1_vs_tkw1_gelu_1tg_32x192E,147.1652,0.0,0.00%,16.42,4106.77,513564.875,4096.0,8.921806,58701384.0,0.0,0.0,64880640.0,32440320.0,129896.0,4174826.0,7578759.0,47256750.0,2368139.0,0.0,8.168881,0.0906914322,488400.0,2027520.0,5048880.0,0.0,1971200.0,38582633.0,1088.0,59193680.0,33218887680.0
91,32,4096,384,128,8,ActivationType.Silu,torch.bfloat16,torch.float8_e4m3fnuz,torch.float8_e4m3fnuz,QuantType.per_1x128,1,0,asm,stage1,16,_ZN5aiter59fmoe_stage1_bf16_pertokenFp8_blockscale_g1u1_16x128_4tg_pf2E,88.2477,29.035333333333355,43.59%,27.38,6848.6,339328.75,112.40625,4.096288,57219853.0,0.0,0.0,21626880.0,10813440.0,90521.0,2715662.0,4517773.0,47647452.0,1673700.0,0.0,11.898254,0.00205019587,114840.0,675840.0,1796970.0,0.0,752400.0,55520354.0,1728.0,61307878.0,11072962560.0
91,32,4096,384,128,8,ActivationType.Silu,torch.bfloat16,torch.float8_e4m3fnuz,torch.float8_e4m3fnuz,QuantType.per_1x128,1,0,ck,stage2,16,moe_ck2stages_gemm2_128x16x128x128_1x2_MulABScaleExpertWeightA8W8blkscale_v1_Nswizzle0_Quant4_MulRoutedWeight1_F8_F8_B16,53.9558,29.035333333333355,15.24%,44.78,11201.26,170531.25,2048.0,4.113493,24420681.0,0.0,0.0,10813440.0,5406720.0,88887.0,1397181.0,4016838.0,18862945.0,816694.0,7.094332,32.99077,0.244059757,151360.0,337920.0,1822144.0,2252800.0,3196160.0,41337362.0,9216.0,83809563.0,5536481280.0
92,32,4096,384,128,8,ActivationType.Gelu,torch.bfloat16,torch.float8_e4m3fnuz,torch.float8_e4m3fnuz,QuantType.per_1x128,1,0,asm,stage1,16,_ZN5aiter59fmoe_stage1_bf16_pertokenFp8_blockscale_g1u1_16x128_4tg_pf2E,88.4925,28.60799999999986,43.79%,27.3,6829.65,339334.75,112.40625,4.199193,55732181.0,0.0,0.0,21626880.0,10813440.0,90882.0,2715618.0,5759204.0,46264567.0,1791765.0,0.0,11.745842,0.00191990647,114840.0,675840.0,1810170.0,0.0,752400.0,58787489.0,1728.0,64629750.0,11072962560.0
92,32,4096,384,128,8,ActivationType.Gelu,torch.bfloat16,torch.float8_e4m3fnuz,torch.float8_e4m3fnuz,QuantType.per_1x128,1,0,ck,stage2,16,moe_ck2stages_gemm2_128x16x128x128_1x2_MulABScaleExpertWeightA8W8blkscale_v1_Nswizzle0_Quant4_MulRoutedWeight1_F8_F8_B16,54.1113,28.60799999999986,15.14%,44.65,11169.07,170534.25,2048.0,4.283995,24601926.0,0.0,0.0,10813440.0,5406720.0,89412.0,1397201.0,3670712.0,19002354.0,827416.0,7.09311,33.661049,0.232083034,151360.0,337920.0,1822144.0,2252800.0,3196160.0,40945971.0,9216.0,85527071.0,5536481280.0
93,32,4096,384,128,8,ActivationType.Silu,torch.bfloat16,torch.float8_e4m3fnuz,torch.float8_e4m3fnuz,QuantType.per_1x128,1,1,ck,stage1,16,moe_ck2stages_gemm1_128x16x128x128_1x2_MulABScaleExpertWeightA8W8blkscale_v1_Nswizzle0_Quant4_MulRoutedWeight1_silu_F8_F8_B16,98.6904,28.278777777777723,0.01%,24.48,6123.93,339672.0,192.0,3.722589,32054555.0,0.0,0.0,21626880.0,10813440.0,81412.0,2718747.0,6307103.0,51639005.0,1870356.0,1.599674,5.731991,0.00270656504,109560.0,675840.0,1609080.0,1151040.0,1700160.0,27635010.0,864.0,32995483.0,11072962560.0
93,32,4096,384,128,8,ActivationType.Silu,torch.bfloat16,torch.float8_e4m3fnuz,torch.float8_e4m3fnuz,QuantType.per_1x128,1,1,ck,stage2,16,moe_ck2stages_gemm2_128x16x128x128_1x2_MulABScaleExpertWeightA8W8blkscale_v1_Nswizzle0_Quant4_MulRoutedWeight0_F8_F8_B16,54.1949,28.278777777777723,16.61%,44.58,11151.84,170472.75,2048.0,4.130613,24948587.0,0.0,0.0,10813440.0,5406720.0,83899.0,1396603.0,3877742.0,19203538.0,870129.0,6.566879,32.825071,0.285785178,151360.0,337920.0,1723584.0,2252800.0,3196160.0,45176316.0,9216.0,90086407.0,5536481280.0
94,32,4096,384,128,8,ActivationType.Gelu,torch.bfloat16,torch.float8_e4m3fnuz,torch.float8_e4m3fnuz,QuantType.per_1x128,1,1,ck,stage1,16,moe_ck2stages_gemm1_128x16x128x128_1x2_MulABScaleExpertWeightA8W8blkscale_v1_Nswizzle0_Quant4_MulRoutedWeight1_gelu_F8_F8_B16,98.9867,28.287555555555528,0.01%,24.41,6105.6,339686.625,192.0,3.803862,31041970.0,0.0,0.0,21626880.0,10813440.0,87563.0,2719056.0,6824061.0,49795760.0,1872114.0,1.588726,5.623734,0.00298962757,109560.0,675840.0,1506120.0,1151040.0,1700160.0,27365933.0,864.0,32595385.0,11072962560.0
94,32,4096,384,128,8,ActivationType.Gelu,torch.bfloat16,torch.float8_e4m3fnuz,torch.float8_e4m3fnuz,QuantType.per_1x128,1,1,ck,stage2,16,moe_ck2stages_gemm2_128x16x128x128_1x2_MulABScaleExpertWeightA8W8blkscale_v1_Nswizzle0_Quant4_MulRoutedWeight0_F8_F8_B16,54.1038,28.287555555555528,16.59%,44.65,11170.62,170469.625,2048.0,4.219477,24913200.0,0.0,0.0,10813440.0,5406720.0,84058.0,1396455.0,3916910.0,19172553.0,851773.0,6.842086,32.911523,0.263542398,151360.0,337920.0,1723584.0,2252800.0,3196160.0,43419756.0,9216.0,86690615.0,5536481280.0
95,32,7168,256,256,8,ActivationType.Gelu,torch.bfloat16,torch.bfloat16,torch.bfloat16,QuantType.No,1,0,ck,stage1,32,moe_ck2stages_gemm1_256x32x64x128_1x4_TypeCast_v1_Nswizzle0_Quant0_MulRoutedWeight0_gelu_B16_B16_B16,321.6457,0.0,0.00%,8.76,8765.82,1204967.5,128.0,10.179004,161020418.0,76611584.0,0.0,0.0,76611584.0,77374.0,9640672.0,18967871.0,135140213.0,5127992.0,0.0436522384,23.183768,0.00764848439,1512352.0,4788224.0,6411929.0,85504.0,12141568.0,135215999.0,4096.0,363290409.0,39225131008.0
95,32,7168,256,256,8,ActivationType.Gelu,torch.bfloat16,torch.bfloat16,torch.bfloat16,QuantType.No,1,0,ck,stage2,32,moe_ck2stages_gemm2_256x32x64x64_1x4_TypeCastExpertWeight_v1_Nswizzle0_Quant0_MulRoutedWeight1_B16_B16_B16,172.1965,0.0,1.60%,16.37,16373.68,600044.75,3584.0,9.58313,91130186.0,38305792.0,0.0,0.0,38305792.0,178393.0,4857747.0,10076553.0,71764414.0,2633740.0,1.180428,78.148855,0.27514869,1963920.0,2394112.0,10218320.0,1197056.0,15337280.0,526354315.0,114688.0,633997431.0,19612565504.0
96,32,7168,256,256,8,ActivationType.Gelu,torch.bfloat16,torch.bfloat16,torch.bfloat16,QuantType.No,1,1,ck,stage1,32,moe_ck2stages_gemm1_256x32x64x64_1x4_TypeCastExpertWeight_v1_Nswizzle0_Quant0_MulRoutedWeight1_gelu_B16_B16_B16,320.2929,0.0,0.00%,8.8,8802.85,1203213.0,128.0,10.20527,164104361.0,76611584.0,0.0,0.0,76611584.0,87773.0,9626386.0,16382621.0,138101144.0,4848748.0,0.0462054429,24.236879,0.000231016406,1512352.0,4788224.0,6241792.0,85504.0,12141568.0,316305203.0,4096.0,358806231.0,39225131008.0
96,32,7168,256,256,8,ActivationType.Gelu,torch.bfloat16,torch.bfloat16,torch.bfloat16,QuantType.No,1,1,ck,stage2,32,moe_ck2stages_gemm2_256x32x64x128_1x4_TypeCast_v1_Nswizzle0_Quant0_MulRoutedWeight0_B16_B16_B16,170.2024,0.0,0.00%,16.56,16565.51,599796.9375,3584.0,10.439767,84299534.0,38305792.0,0.0,0.0,38305792.0,168136.0,4855774.0,11298839.0,65972020.0,2457570.0,1.267583,60.661881,0.361747332,1963920.0,2394112.0,10068688.0,1197056.0,15337280.0,352922756.0,114688.0,458293620.0,19612565504.0
97,32,7168,256,256,8,ActivationType.Gelu,torch.bfloat16,torch.float8_e4m3fnuz,torch.float8_e4m3fnuz,QuantType.per_Tensor,1,0,ck,stage1,16,moe_ck2stages_gemm1_128x16x64x128_1x2_MulABScale_v1_Nswizzle0_Quant1_MulRoutedWeight0_gelu_F8_F8_B16,156.6576,37.56077777777778,0.00%,17.99,9000.36,601549.3125,128.0,4.544775,78794542.0,0.0,0.0,38305792.0,19152896.0,57014.0,4813423.0,7383596.0,77299773.0,2803014.0,3.32325,11.844867,0.000716355692,379424.0,1197056.0,1825694.0,3569792.0,5408128.0,93761049.0,2048.0,101788822.0,19612565504.0
97,32,7168,256,256,8,ActivationType.Gelu,torch.bfloat16,torch.float8_e4m3fnuz,torch.float8_e4m3fnuz,QuantType.per_Tensor,1,0,ck,stage2,16,moe_ck2stages_gemm2_256x16x128x256_1x4_MulABScaleExpertWeight_v1_Nswizzle0_Quant1_MulRoutedWeight1_F8_F8_B16,88.7339,37.56077777777778,1.55%,31.76,15889.92,300016.0,7168.0,4.662878,43334364.0,0.0,0.0,19152896.0,9576448.0,77178.0,2514859.0,5209203.0,34818776.0,1344754.0,1.482422,71.48665,0.527625697,420840.0,598528.0,4382784.0,769216.0,3350368.0,200955827.0,57344.0,296750531.0,9806282752.0
98,32,7168,256,256,8,ActivationType.Gelu,torch.bfloat16,torch.float8_e4m3fnuz,torch.float8_e4m3fnuz,QuantType.per_Tensor,1,1,ck,stage1,16,moe_ck2stages_gemm1_128x16x64x128_1x2_MulABScale_v1_Nswizzle0_Quant1_MulRoutedWeight1_gelu_F8_F8_B16,159.7756,37.70788888888895,0.00%,17.64,8824.72,601647.75,128.0,4.283817,81770493.0,0.0,0.0,38305792.0,19152896.0,59059.0,4814232.0,10310333.0,81914019.0,2817187.0,3.310284,11.758837,0.000634276291,379424.0,1197056.0,1778216.0,3569792.0,5408128.0,93463535.0,2048.0,101445311.0,19612565504.0
98,32,7168,256,256,8,ActivationType.Gelu,torch.bfloat16,torch.float8_e4m3fnuz,torch.float8_e4m3fnuz,QuantType.per_Tensor,1,1,ck,stage2,16,moe_ck2stages_gemm2_256x16x128x256_1x4_MulABScaleExpertWeight_v1_Nswizzle0_Quant1_MulRoutedWeight0_F8_F8_B16,88.1775,37.70788888888895,0.00%,31.96,15990.18,299929.0,7168.0,4.218827,47212807.0,0.0,0.0,19152896.0,9576448.0,68375.0,2514149.0,6895832.0,39457411.0,1427995.0,1.400844,71.847031,0.615249297,420840.0,598528.0,4083520.0,769216.0,3350368.0,219748559.0,57344.0,315614880.0,9806282752.0
99,32,7168,256,256,8,ActivationType.Gelu,torch.bfloat16,torch.float8_e4m3fnuz,torch.float8_e4m3fnuz,QuantType.per_Token,1,0,asm,asm_1stage,32,_ZN5aiter48fmoe_bf16_pertokenFp8_g1u1_vs_gelu_1tg_ps_32x256E,250.9128,0.0,0.00%,11.23,5619.38,904660.625,3584.0,9.736842,75279908.0,0.0,0.0,114917376.0,57458688.0,136396.0,7293678.0,10741695.0,56212925.0,3858206.0,0.0,6.373507,0.0668754885,631260.0,3591168.0,8017588.0,0.0,2535728.0,20573380.0,1216.0,75161749.0,58837696512.0
100,32,7168,256,256,8,ActivationType.Gelu,torch.bfloat16,torch.float8_e4m3fnuz,torch.float8_e4m3fnuz,QuantType.per_Token,1,1,asm,asm_1stage,32,_ZN5aiter53fmoe_bf16_pertokenFp8_g1u1_vs_tkw1_gelu_1tg_ps_32x256E,257.751,0.0,0.00%,10.94,5470.3,904583.875,3584.0,9.229164,78000998.0,0.0,0.0,114917376.0,57458688.0,136398.0,7293779.0,9747595.0,59269205.0,3945010.0,0.0,6.337393,0.0777464973,631260.0,3591168.0,7461812.0,0.0,2535728.0,20483682.0,1216.0,76508622.0,58837696512.0
101,32,7168,256,256,8,ActivationType.Silu,torch.bfloat16,torch.bfloat16,torch.bfloat16,QuantType.No,1,0,ck,stage1,32,moe_ck2stages_gemm1_256x32x64x64_1x4_TypeCast_v1_Nswizzle0_Quant0_MulRoutedWeight0_silu_B16_B16_B16,321.8833,0.0,0.00%,8.76,8759.35,1203188.5,128.0,10.144716,165928241.0,76611584.0,0.0,0.0,76611584.0,82474.0,9625861.0,20006987.0,140104897.0,4987879.0,0.0448000392,24.107131,0.000343450899,1512352.0,4788224.0,6396768.0,85504.0,12141568.0,324214417.0,4096.0,368081137.0,39225131008.0
101,32,7168,256,256,8,ActivationType.Silu,torch.bfloat16,torch.bfloat16,torch.bfloat16,QuantType.No,1,0,ck,stage2,32,moe_ck2stages_gemm2_256x32x64x64_1x4_TypeCastExpertWeight_v1_Nswizzle0_Quant0_MulRoutedWeight1_B16_B16_B16,165.2619,0.0,1.30%,17.06,17060.74,600045.375,3584.0,9.829006,88678595.0,38305792.0,0.0,0.0,38305792.0,177724.0,4857782.0,11897890.0,69188822.0,2483685.0,1.25937,82.691054,0.248014287,1963920.0,2394112.0,10218320.0,1197056.0,15337280.0,515198941.0,114688.0,628795903.0,19612565504.0
102,32,7168,256,256,8,ActivationType.Silu,torch.bfloat16,torch.bfloat16,torch.bfloat16,QuantType.No,1,1,ck,stage1,32,moe_ck2stages_gemm1_256x32x64x64_1x4_TypeCastExpertWeight_v1_Nswizzle0_Quant0_MulRoutedWeight1_silu_B16_B16_B16,320.0205,0.0,0.00%,8.81,8810.34,1203215.1875,128.0,9.957367,168237481.0,76611584.0,0.0,0.0,76611584.0,84768.0,9626293.0,18261234.0,142333344.0,5244219.0,0.0426457405,24.225071,0.000307982606,1512352.0,4788224.0,6436848.0,85504.0,12141568.0,343417914.0,4096.0,388566921.0,39225131008.0
102,32,7168,256,256,8,ActivationType.Silu,torch.bfloat16,torch.bfloat16,torch.bfloat16,QuantType.No,1,1,ck,stage2,32,moe_ck2stages_gemm2_256x32x64x128_1x4_TypeCast_v1_Nswizzle0_Quant0_MulRoutedWeight0_B16_B16_B16,168.5977,0.0,0.00%,16.72,16723.18,599800.3125,3584.0,9.689154,90373440.0,38305792.0,0.0,0.0,38305792.0,167949.0,4855811.0,7360971.0,72119561.0,2451416.0,1.276819,60.961124,0.328147394,1963920.0,2394112.0,10068688.0,1197056.0,15337280.0,352447975.0,114688.0,457223025.0,19612565504.0
103,32,7168,256,256,8,ActivationType.Silu,torch.bfloat16,torch.float8_e4m3fnuz,torch.float8_e4m3fnuz,QuantType.per_Tensor,1,0,ck,stage1,16,moe_ck2stages_gemm1_128x16x64x128_1x2_MulABScale_v1_Nswizzle0_Quant1_MulRoutedWeight0_silu_F8_F8_B16,160.029,36.82222222222229,0.00%,17.61,8810.74,601533.5625,128.0,4.421048,80273948.0,0.0,0.0,38305792.0,19152896.0,55729.0,4813350.0,11383166.0,77984877.0,2828746.0,3.302381,11.8626,0.00062397352,379424.0,1197056.0,1882424.0,3569792.0,5408128.0,94462625.0,2048.0,102585424.0,19612565504.0
103,32,7168,256,256,8,ActivationType.Silu,torch.bfloat16,torch.float8_e4m3fnuz,torch.float8_e4m3fnuz,QuantType.per_Tensor,1,0,ck,stage2,16,moe_ck2stages_gemm2_256x16x128x256_1x4_MulABScaleExpertWeight_v1_Nswizzle0_Quant1_MulRoutedWeight1_F8_F8_B16,89.0968,36.82222222222229,1.26%,31.63,15825.2,300013.5,7168.0,4.752472,42954273.0,0.0,0.0,19152896.0,9576448.0,77499.0,2514844.0,6251359.0,34531814.0,1268777.0,1.571273,72.203636,0.609626885,420840.0,598528.0,4382784.0,769216.0,3350368.0,192966951.0,57344.0,282777996.0,9806282752.0
104,32,7168,256,256,8,ActivationType.Silu,torch.bfloat16,torch.float8_e4m3fnuz,torch.float8_e4m3fnuz,QuantType.per_Tensor,1,1,ck,stage1,16,moe_ck2stages_gemm1_128x16x64x128_1x2_MulABScale_v1_Nswizzle0_Quant1_MulRoutedWeight1_silu_F8_F8_B16,158.1881,36.942,0.00%,17.82,8913.28,601609.0625,128.0,4.442346,77079404.0,0.0,0.0,38305792.0,19152896.0,55125.0,4814003.0,10135192.0,78025372.0,2898955.0,3.217585,11.647733,0.000676453261,379424.0,1197056.0,1905136.0,3569792.0,5408128.0,95249726.0,2048.0,103381846.0,19612565504.0
104,32,7168,256,256,8,ActivationType.Silu,torch.bfloat16,torch.float8_e4m3fnuz,torch.float8_e4m3fnuz,QuantType.per_Tensor,1,1,ck,stage2,16,moe_ck2stages_gemm2_256x16x128x256_1x4_MulABScaleExpertWeight_v1_Nswizzle0_Quant1_MulRoutedWeight0_F8_F8_B16,88.7036,36.942,0.00%,31.78,15895.34,299929.375,7168.0,4.45954,46280558.0,0.0,0.0,19152896.0,9576448.0,68338.0,2514184.0,5367445.0,38369564.0,1466669.0,1.355858,70.762803,0.548873117,420840.0,598528.0,4083520.0,769216.0,3350368.0,224711901.0,57344.0,321165666.0,9806282752.0
105,32,7168,256,256,8,ActivationType.Silu,torch.bfloat16,torch.float8_e4m3fnuz,torch.float8_e4m3fnuz,QuantType.per_Token,1,0,asm,asm_1stage,32,_ZN5aiter45fmoe_bf16_pertokenFp8_g1u1_vs_silu_1tg_32x256E,251.7593,0.0,0.00%,11.2,5600.49,904815.9375,3840.0,9.908554,73804559.0,0.0,0.0,114917376.0,57458688.0,135589.0,7298672.0,11355722.0,56769423.0,3807272.0,0.0,6.349388,0.103284903,663324.0,3591168.0,7913000.0,0.0,2621232.0,22859252.0,1056.0,74098908.0,58837696512.0
106,32,7168,256,256,8,ActivationType.Silu,torch.bfloat16,torch.float8_e4m3fnuz,torch.float8_e4m3fnuz,QuantType.per_Token,1,1,asm,asm_1stage,32,_ZN5aiter50fmoe_bf16_pertokenFp8_g1u1_vs_tkw1_silu_1tg_32x256E,258.8454,0.0,0.00%,10.89,5447.17,904586.25,3584.0,9.699227,74636392.0,0.0,0.0,114917376.0,57458688.0,132717.0,7294717.0,11560244.0,56233482.0,3809972.0,0.0,6.385497,0.0909723323,631260.0,3591168.0,7335848.0,0.0,2535728.0,19505275.0,1056.0,74449177.0,58837696512.0
107,32,7168,256,256,8,ActivationType.Gelu,torch.bfloat16,torch.float8_e4m3fnuz,torch.float8_e4m3fnuz,QuantType.per_1x128,1,0,asm,asm_1stage,32,_ZN5aiter50fmoe_bf16_blockscaleFp8_g1u1_vs_gelu_1tg_ps_32x256E,261.507,0.0,1.78%,10.78,5391.73,900058.9375,3840.0,10.313631,71295012.0,0.0,0.0,114917376.0,57458688.0,174506.0,7261080.0,9841255.0,53089368.0,3699612.0,0.0,6.373003,0.117752031,752168.0,3591168.0,9291464.0,0.0,2821632.0,21551892.0,1216.0,72315750.0,58837696512.0
108,32,7168,256,256,8,ActivationType.Gelu,torch.bfloat16,torch.float8_e4m3fnuz,torch.float8_e4m3fnuz,QuantType.per_1x128,1,1,ck,stage1,16,moe_ck2stages_gemm1_128x16x128x128_1x2_MulABScaleExpertWeightA8W8blkscale_v1_Nswizzle0_Quant4_MulRoutedWeight1_gelu_F8_F8_B16,165.2117,27.5564444444444,0.02%,17.06,8534.35,601124.375,128.0,4.426515,49604551.0,0.0,0.0,38305792.0,19152896.0,94259.0,4809983.0,9972256.0,79230979.0,2836054.0,1.783689,6.101904,0.0018219276,191048.0,1197056.0,2398120.0,1934528.0,2875072.0,44395155.0,1024.0,52943324.0,19612565504.0
108,32,7168,256,256,8,ActivationType.Gelu,torch.bfloat16,torch.float8_e4m3fnuz,torch.float8_e4m3fnuz,QuantType.per_1x128,1,1,ck,stage2,16,moe_ck2stages_gemm2_256x16x128x256_1x4_MulABScaleExpertWeightA8W8blkscale_v1_Nswizzle0_Quant4_MulRoutedWeight0_F8_F8_B16,88.9229,27.5564444444444,16.54%,31.7,15856.14,300555.0,3584.0,4.478891,44425373.0,0.0,0.0,19152896.0,9576448.0,86948.0,2461834.0,5355657.0,34886181.0,1325064.0,12.904747,72.51073,0.386547067,346024.0,598528.0,4286184.0,6583808.0,9164960.0,151412130.0,57344.0,295951072.0,9806282752.0
109,32,7168,256,256,8,ActivationType.Silu,torch.bfloat16,torch.float8_e4m3fnuz,torch.float8_e4m3fnuz,QuantType.per_1x128,1,1,ck,stage1,16,moe_ck2stages_gemm1_128x16x128x128_1x2_MulABScaleExpertWeightA8W8blkscale_v1_Nswizzle0_Quant4_MulRoutedWeight1_silu_F8_F8_B16,166.903,28.028888888888964,0.02%,16.89,8447.87,601108.125,128.0,4.288564,51487272.0,0.0,0.0,38305792.0,19152896.0,87895.0,4809900.0,9930153.0,82360850.0,2954647.0,1.711569,5.989595,0.00137843668,191048.0,1197056.0,2502328.0,1934528.0,2875072.0,45279604.0,1024.0,54158679.0,19612565504.0
109,32,7168,256,256,8,ActivationType.Silu,torch.bfloat16,torch.float8_e4m3fnuz,torch.float8_e4m3fnuz,QuantType.per_1x128,1,1,ck,stage2,16,moe_ck2stages_gemm2_256x16x128x256_1x4_MulABScaleExpertWeightA8W8blkscale_v1_Nswizzle0_Quant4_MulRoutedWeight0_F8_F8_B16,89.2387,28.028888888888964,16.56%,31.58,15800.03,300555.25,3584.0,4.464267,44430362.0,0.0,0.0,19152896.0,9576448.0,86636.0,2461780.0,5344181.0,35128198.0,1341286.0,12.747365,71.786863,0.390459458,346024.0,598528.0,4286184.0,6583808.0,9164960.0,152013308.0,57344.0,296614039.0,9806282752.0
110,32,7168,256,256,8,ActivationType.Silu,torch.bfloat16,torch.float8_e4m3fnuz,torch.float8_e4m3fnuz,QuantType.per_1x128,1,0,asm,asm_1stage,32,_ZN5aiter49fmoe_bf16_blockscaleFp8_g1u1_novs_silu_1tg_32x256E,261.7065,0.0,0.00%,10.77,5387.62,900063.8125,3840.0,10.422577,70300210.0,0.0,0.0,114917376.0,57458688.0,169210.0,7263107.0,10161400.0,51474358.0,3602455.0,0.0,6.372002,0.0836881564,752168.0,3591168.0,9165500.0,0.0,2821632.0,16259235.0,1056.0,70133925.0,58837696512.0
111,32,7168,256,257,9,ActivationType.Silu,torch.bfloat16,torch.float8_e4m3fnuz,torch.float8_e4m3fnuz,QuantType.per_Token,1,0,asm,asm_1stage,32,_ZN5aiter45fmoe_bf16_pertokenFp8_g1u1_vs_silu_1tg_32x256E,274.3117,0.0,0.00%,11.56,5160.11,975271.125,4320.0,10.043805,84254420.0,0.0,0.0,123863040.0,61931520.0,144502.0,7871547.0,11840846.0,65881656.0,3992808.0,0.0,6.856278,0.0981712553,714960.0,3870720.0,8528240.0,0.0,2825280.0,26416683.0,1064.0,83693988.0,63417876480.0
112,32,7168,256,257,9,ActivationType.Silu,torch.bfloat16,torch.float8_e4m3fnuz,torch.float8_e4m3fnuz,QuantType.per_1x128,1,0,asm,asm_1stage,32,_ZN5aiter49fmoe_bf16_blockscaleFp8_g1u1_novs_silu_1tg_32x256E,281.3313,0.0,0.00%,11.27,5031.36,970524.0,4320.0,10.333607,80300188.0,0.0,0.0,123863040.0,61931520.0,180223.0,7833679.0,10904997.0,60111680.0,3776331.0,0.0,6.8328,0.0918047346,810720.0,3870720.0,9878240.0,0.0,3041280.0,18926037.0,1064.0,78913733.0,63417876480.0
113,32,7168,512,256,8,ActivationType.Gelu,torch.bfloat16,torch.bfloat16,torch.bfloat16,QuantType.No,1,0,ck,stage1,32,moe_ck2stages_gemm1_256x32x64x128_1x4_TypeCast_v1_Nswizzle0_Quant0_MulRoutedWeight0_gelu_B16_B16_B16,610.6909,0.0,0.00%,9.23,9232.27,2309718.3125,256.0,11.428775,293680436.0,146800640.0,0.0,0.0,146800640.0,129637.0,18481166.0,23053794.0,245902570.0,8227035.0,0.0522005169,30.334443,0.0128486105,2897920.0,9175040.0,12293979.0,163840.0,23265280.0,245193657.0,8192.0,761677537.0,75161927680.0
113,32,7168,512,256,8,ActivationType.Gelu,torch.bfloat16,torch.bfloat16,torch.bfloat16,QuantType.No,1,0,ck,stage2,32,moe_ck2stages_gemm2_256x32x64x128_1x4_TypeCastExpertWeight_v1_Nswizzle0_Quant0_MulRoutedWeight1_B16_B16_B16,320.4969,0.0,3.29%,17.59,17591.63,1149431.125,3584.0,11.211761,155347318.0,73400320.0,0.0,0.0,73400320.0,292349.0,9252897.0,14170207.0,121741707.0,4272299.0,0.702635294,53.786641,0.181199318,3315200.0,4587520.0,15398208.0,1146880.0,26163200.0,514750286.0,114688.0,702348123.0,37580963840.0
114,32,7168,512,256,8,ActivationType.Gelu,torch.bfloat16,torch.bfloat16,torch.bfloat16,QuantType.No,1,1,ck,stage1,32,moe_ck2stages_gemm1_256x32x64x128_1x4_TypeCastExpertWeight_v1_Nswizzle0_Quant0_MulRoutedWeight1_gelu_B16_B16_B16,611.9243,0.0,0.00%,9.21,9213.66,2309960.5,256.0,11.519222,291180006.0,146800640.0,0.0,0.0,146800640.0,130653.0,18482473.0,28190298.0,243171790.0,8326159.0,0.051614165,30.526893,0.00999882684,2897920.0,9175040.0,12282880.0,163840.0,23265280.0,254083999.0,8192.0,775217604.0,75161927680.0
114,32,7168,512,256,8,ActivationType.Gelu,torch.bfloat16,torch.bfloat16,torch.bfloat16,QuantType.No,1,1,ck,stage2,32,moe_ck2stages_gemm2_256x32x64x128_1x4_TypeCast_v1_Nswizzle0_Quant0_MulRoutedWeight0_B16_B16_B16,321.3085,0.0,0.01%,17.54,17547.19,1149266.375,3584.0,10.293973,166181038.0,73400320.0,0.0,0.0,73400320.0,275298.0,9251526.0,13413310.0,134907289.0,4465471.0,0.670030153,52.234358,0.212240966,3315200.0,4587520.0,14609728.0,1146880.0,26163200.0,501637727.0,114688.0,715269779.0,37580963840.0
115,32,7168,512,256,8,ActivationType.Gelu,torch.bfloat16,torch.float8_e4m3fnuz,torch.float8_e4m3fnuz,QuantType.per_Tensor,1,0,asm,stage1,16,_ZN5aiter48fmoe_stage1_bf16_pertokenFp8_g1u1_16x512_2tg_pf2E,304.8995,32.058333333333366,0.00%,18.49,9246.52,1148985.125,256.0,7.33178,62591632.0,0.0,0.0,73400320.0,36700160.0,118927.0,9194225.0,8308136.0,42020958.0,3337990.0,0.0,6.314226,0.000134021748,88320.0,2293760.0,2691200.0,0.0,624640.0,42386524.0,1088.0,64451194.0,37580963840.0
115,32,7168,512,256,8,ActivationType.Gelu,torch.bfloat16,torch.float8_e4m3fnuz,torch.float8_e4m3fnuz,QuantType.per_Tensor,1,0,ck,stage2,16,moe_ck2stages_gemm2_256x16x128x256_1x4_MulABScaleExpertWeight_v1_Nswizzle0_Quant1_MulRoutedWeight1_F8_F8_B16,160.2403,32.058333333333366,3.25%,35.18,17593.95,574736.5,7168.0,4.844113,85162968.0,0.0,0.0,36700160.0,18350080.0,111700.0,4712623.0,8424574.0,71796453.0,2479188.0,0.777479933,71.493144,0.492963787,582512.0,1146880.0,4859904.0,737072.0,4644080.0,300328575.0,57344.0,542219468.0,18790481920.0
116,32,7168,512,256,8,ActivationType.Gelu,torch.bfloat16,torch.float8_e4m3fnuz,torch.float8_e4m3fnuz,QuantType.per_Tensor,1,1,asm,stage1,16,_ZN5aiter57fmoe_stage1_bf16_pertokenFp8_doweight_g1u1_16x512_2tg_pf2E,307.8214,30.798666666666616,0.00%,18.31,9158.75,1149035.0,256.0,7.233066,63746911.0,0.0,0.0,73400320.0,36700160.0,119713.0,9194203.0,7411438.0,43254884.0,3644884.0,0.0,6.280799,0.000231828972,88320.0,2293760.0,2693120.0,0.0,624640.0,46464907.0,1088.0,70006712.0,37580963840.0
116,32,7168,512,256,8,ActivationType.Gelu,torch.bfloat16,torch.float8_e4m3fnuz,torch.float8_e4m3fnuz,QuantType.per_Tensor,1,1,ck,stage2,16,moe_ck2stages_gemm2_256x16x128x256_1x4_MulABScaleExpertWeight_v1_Nswizzle0_Quant1_MulRoutedWeight0_F8_F8_B16,166.65,30.798666666666616,0.01%,33.83,16917.25,574660.125,7168.0,5.003938,81618806.0,0.0,0.0,36700160.0,18350080.0,101310.0,4712078.0,7542922.0,68711500.0,2651844.0,0.726940428,70.234266,0.554163469,582512.0,1146880.0,4573184.0,737072.0,4644080.0,317394704.0,57344.0,569705129.0,18790481920.0
117,32,7168,512,256,8,ActivationType.Gelu,torch.bfloat16,torch.float8_e4m3fnuz,torch.float8_e4m3fnuz,QuantType.per_Token,1,0,asm,asm_1stage,32,_ZN5aiter48fmoe_bf16_pertokenFp8_g1u1_vs_gelu_1tg_ps_32x512E,495.2367,0.0,0.00%,11.38,5692.75,1744306.875,3584.0,12.600587,108845289.0,0.0,0.0,220200960.0,110100480.0,98406.0,14010813.0,17834583.0,76869183.0,6575100.0,0.0,6.35378,0.0586424117,620160.0,6881280.0,11475328.0,0.0,2480640.0,5776222.0,1216.0,127329114.0,112742891520.0
118,32,7168,512,256,8,ActivationType.Gelu,torch.bfloat16,torch.float8_e4m3fnuz,torch.float8_e4m3fnuz,QuantType.per_Token,1,1,asm,stage1,16,_ZN5aiter57fmoe_stage1_bf16_pertokenFp8_doweight_g1u1_16x128_4tg_pf2E,308.7247,26.840666666666586,0.02%,18.26,9131.96,1150442.875,256.0,6.9544,117001470.0,0.0,0.0,73400320.0,36700160.0,144026.0,9205781.0,11109978.0,95760155.0,3923312.0,0.0,23.578728,0.00408649119,307200.0,2293760.0,2918400.0,0.0,2375680.0,264535633.0,4352.0,282841486.0,37580963840.0
118,32,7168,512,256,8,ActivationType.Gelu,torch.bfloat16,torch.float8_e4m3fnuz,torch.float8_e4m3fnuz,QuantType.per_Token,1,1,ck,stage2,16,moe_ck2stages_gemm2_256x16x128x256_1x4_MulABScaleExpertWeight_v1_Nswizzle0_Quant2_MulRoutedWeight0_F8_F8_B16,167.1221,26.840666666666586,0.01%,33.73,16869.46,579108.0,7168.0,4.595726,92107995.0,0.0,0.0,36700160.0,18350080.0,115756.0,4747600.0,9801510.0,78217904.0,2621483.0,0.73287538,61.905593,0.350263805,582512.0,1146880.0,6312320.0,737072.0,4644080.0,333980844.0,57344.0,498080636.0,18790481920.0
119,32,7168,512,256,8,ActivationType.Silu,torch.bfloat16,torch.bfloat16,torch.bfloat16,QuantType.No,1,1,ck,stage1,32,moe_ck2stages_gemm1_256x32x64x128_1x4_TypeCastExpertWeight_v1_Nswizzle0_Quant0_MulRoutedWeight1_silu_B16_B16_B16,613.5439,0.0,0.00%,9.19,9189.34,2309839.625,256.0,11.692916,287516139.0,146800640.0,0.0,0.0,146800640.0,126749.0,18482670.0,28779112.0,239347917.0,8278800.0,0.0518822753,30.382314,0.0193524623,2897920.0,9175040.0,12656640.0,163840.0,23265280.0,249411426.0,8192.0,767558976.0,75161927680.0
119,32,7168,512,256,8,ActivationType.Silu,torch.bfloat16,torch.bfloat16,torch.bfloat16,QuantType.No,1,1,ck,stage2,32,moe_ck2stages_gemm2_256x32x64x128_1x4_TypeCast_v1_Nswizzle0_Quant0_MulRoutedWeight0_B16_B16_B16,324.4307,0.0,0.01%,17.38,17378.32,1149266.25,3584.0,10.619167,162882546.0,73400320.0,0.0,0.0,73400320.0,275254.0,9251546.0,13802469.0,131568618.0,4548303.0,0.658260922,51.307741,0.217068036,3315200.0,4587520.0,14609728.0,1146880.0,26163200.0,502758643.0,114688.0,715142819.0,37580963840.0
120,32,7168,512,256,8,ActivationType.Silu,torch.bfloat16,torch.float8_e4m3fnuz,torch.float8_e4m3fnuz,QuantType.per_Tensor,1,0,asm,stage1,16,_ZN5aiter44fmoe_stage1_bf16_pertokenFp8_g1u1_16x512_pf3E,306.4578,31.33255555555556,0.00%,18.39,9199.51,1149142.0,256.0,6.807976,67394632.0,0.0,0.0,73400320.0,36700160.0,210432.0,9195090.0,9528127.0,46616448.0,3393830.0,0.0,6.290935,0.000131620512,88320.0,2293760.0,2669440.0,0.0,624640.0,3294000.0,1088.0,65384935.0,37580963840.0
120,32,7168,512,256,8,ActivationType.Silu,torch.bfloat16,torch.float8_e4m3fnuz,torch.float8_e4m3fnuz,QuantType.per_Tensor,1,0,ck,stage2,16,moe_ck2stages_gemm2_256x16x128x256_1x4_MulABScaleExpertWeight_v1_Nswizzle0_Quant1_MulRoutedWeight1_F8_F8_B16,160.5651,31.33255555555556,2.79%,35.11,17558.36,574740.5,7168.0,4.691175,86479010.0,0.0,0.0,36700160.0,18350080.0,111448.0,4712654.0,7913361.0,72983893.0,2156538.0,0.859200874,66.204109,0.517913463,582512.0,1146880.0,4859904.0,737072.0,4644080.0,252401909.0,57344.0,454349582.0,18790481920.0
121,32,7168,512,256,8,ActivationType.Silu,torch.bfloat16,torch.float8_e4m3fnuz,torch.float8_e4m3fnuz,QuantType.per_Tensor,1,1,asm,stage1,16,_ZN5aiter57fmoe_stage1_bf16_pertokenFp8_doweight_g1u1_16x512_2tg_pf2E,306.4482,30.75899999999996,0.00%,18.4,9199.79,1149013.25,256.0,7.126408,64072013.0,0.0,0.0,73400320.0,36700160.0,117182.0,9194372.0,7371491.0,43583039.0,3456261.0,0.0,6.235988,0.000215377617,88320.0,2293760.0,2671360.0,0.0,624640.0,43524382.0,1088.0,66014529.0,37580963840.0
121,32,7168,512,256,8,ActivationType.Silu,torch.bfloat16,torch.float8_e4m3fnuz,torch.float8_e4m3fnuz,QuantType.per_Tensor,1,1,ck,stage2,16,moe_ck2stages_gemm2_256x16x128x256_1x4_MulABScaleExpertWeight_v1_Nswizzle0_Quant1_MulRoutedWeight0_F8_F8_B16,160.2215,30.75899999999996,0.01%,35.18,17596.02,574660.5625,7168.0,4.769551,86153909.0,0.0,0.0,36700160.0,18350080.0,101015.0,4712058.0,7641386.0,73320289.0,2346708.0,0.818962337,71.463621,0.550119488,582512.0,1146880.0,4573184.0,737072.0,4644080.0,287660918.0,57344.0,514542188.0,18790481920.0
122,32,7168,512,256,8,ActivationType.Silu,torch.bfloat16,torch.float8_e4m3fnuz,torch.float8_e4m3fnuz,QuantType.per_Token,1,0,asm,asm_1stage,32,_ZN5aiter45fmoe_bf16_pertokenFp8_g1u1_vs_silu_1tg_32x512E,485.1628,0.0,0.00%,11.62,5810.96,1744111.4375,3840.0,14.553596,95003513.0,0.0,0.0,220200960.0,110100480.0,99677.0,14012904.0,14138931.0,64303393.0,6604403.0,0.0,6.321969,0.0684797127,650880.0,6881280.0,11311680.0,0.0,2562560.0,5624381.0,1056.0,127541083.0,112742891520.0
123,32,7168,512,256,8,ActivationType.Silu,torch.bfloat16,torch.float8_e4m3fnuz,torch.float8_e4m3fnuz,QuantType.per_Token,1,1,asm,stage1,16,_ZN5aiter57fmoe_stage1_bf16_pertokenFp8_doweight_g1u1_16x128_4tg_pf2E,308.2689,26.573777777777774,0.00%,18.29,9145.46,1150474.625,256.0,6.57631,122995410.0,0.0,0.0,73400320.0,36700160.0,144006.0,9205837.0,10673950.0,101694614.0,3473013.0,0.0,23.485314,0.00233411462,307200.0,2293760.0,2892800.0,0.0,2375680.0,231571207.0,4352.0,249290302.0,37580963840.0
123,32,7168,512,256,8,ActivationType.Silu,torch.bfloat16,torch.float8_e4m3fnuz,torch.float8_e4m3fnuz,QuantType.per_Token,1,1,ck,stage2,16,moe_ck2stages_gemm2_256x16x128x256_1x4_MulABScaleExpertWeight_v1_Nswizzle0_Quant2_MulRoutedWeight0_F8_F8_B16,167.5208,26.573777777777774,0.01%,33.65,16829.32,579106.1875,7168.0,4.630644,90315374.0,0.0,0.0,36700160.0,18350080.0,115754.0,4747601.0,8914864.0,76461729.0,2599798.0,0.737873626,61.317415,0.344749536,582512.0,1146880.0,6312320.0,737072.0,4644080.0,324627284.0,57344.0,490006396.0,18790481920.0
124,32,7168,512,256,8,ActivationType.Silu,torch.bfloat16,torch.bfloat16,torch.bfloat16,QuantType.No,1,0,ck,stage1,32,moe_ck2stages_gemm1_256x32x64x128_1x4_TypeCast_v1_Nswizzle0_Quant0_MulRoutedWeight0_silu_B16_B16_B16,611.5421,0.0,0.00%,9.22,9219.42,2309750.125,256.0,11.696428,288346831.0,146800640.0,0.0,0.0,146800640.0,128820.0,18478880.0,21636235.0,240384186.0,8356522.0,0.0514194066,30.351168,0.0116426479,2897920.0,9175040.0,12579840.0,163840.0,23265280.0,248347639.0,8192.0,773674474.0,75161927680.0
124,32,7168,512,256,8,ActivationType.Silu,torch.bfloat16,torch.bfloat16,torch.bfloat16,QuantType.No,1,0,ck,stage2,32,moe_ck2stages_gemm2_256x32x64x128_1x4_TypeCastExpertWeight_v1_Nswizzle0_Quant0_MulRoutedWeight1_B16_B16_B16,323.408,0.0,2.83%,17.43,17433.28,1149436.875,3584.0,11.199363,154764716.0,73400320.0,0.0,0.0,73400320.0,292443.0,9252904.0,13499171.0,121195435.0,4540237.0,0.658437847,51.991308,0.171628558,3315200.0,4587520.0,15398208.0,1146880.0,26163200.0,537885889.0,114688.0,724475870.0,37580963840.0
125,32,7168,512,256,8,ActivationType.Gelu,torch.bfloat16,torch.float8_e4m3fnuz,torch.float8_e4m3fnuz,QuantType.per_1x128,1,0,asm,stage1,16,_ZN5aiter59fmoe_stage1_bf16_pertokenFp8_blockscale_g1u1_16x512_2tg_pf2E,302.1986,29.622888888888856,15.08%,18.65,9329.16,1148990.375,135.53125,4.951366,93639009.0,0.0,0.0,73400320.0,36700160.0,232478.0,9193339.0,15154280.0,70923695.0,5001894.0,0.0,6.294926,0.000313190012,126720.0,2293760.0,5390240.0,0.0,691200.0,62790937.0,1088.0,96235845.0,37580963840.0
125,32,7168,512,256,8,ActivationType.Gelu,torch.bfloat16,torch.float8_e4m3fnuz,torch.float8_e4m3fnuz,QuantType.per_1x128,1,0,ck,stage2,16,moe_ck2stages_gemm2_256x16x128x256_1x4_MulABScaleExpertWeightA8W8blkscale_v1_Nswizzle0_Quant4_MulRoutedWeight1_F8_F8_B16,158.246,29.622888888888856,15.49%,35.62,17815.68,575945.625,3584.0,4.754689,88003838.0,0.0,0.0,36700160.0,18350080.0,114904.0,4664973.0,8242859.0,72033094.0,2135242.0,7.672061,49.62079,0.244056313,510832.0,1146880.0,5443088.0,6307840.0,10214848.0,174416094.0,57344.0,326379040.0,18790481920.0
126,32,7168,512,256,8,ActivationType.Silu,torch.bfloat16,torch.float8_e4m3fnuz,torch.float8_e4m3fnuz,QuantType.per_1x128,1,0,asm,stage1,16,_ZN5aiter59fmoe_stage1_bf16_pertokenFp8_blockscale_g1u1_16x512_2tg_pf2E,300.7088,29.71200000000003,14.87%,18.75,9375.38,1149051.875,135.5625,4.946732,94115376.0,0.0,0.0,73400320.0,36700160.0,229691.0,9193570.0,13534383.0,71433014.0,4995500.0,0.0,6.301295,0.000134349319,126720.0,2293760.0,5368480.0,0.0,691200.0,62636102.0,1088.0,96243571.0,37580963840.0
126,32,7168,512,256,8,ActivationType.Silu,torch.bfloat16,torch.float8_e4m3fnuz,torch.float8_e4m3fnuz,QuantType.per_1x128,1,0,ck,stage2,16,moe_ck2stages_gemm2_128x16x128x128_1x2_MulABScaleExpertWeightA8W8blkscale_v1_Nswizzle0_Quant4_MulRoutedWeight1_F8_F8_B16,162.7322,29.71200000000003,15.50%,34.64,17324.54,576711.1875,3584.0,4.637474,90771840.0,0.0,0.0,36700160.0,18350080.0,174475.0,4670974.0,11239413.0,76331878.0,2033292.0,8.444754,39.409402,0.281336009,474880.0,1146880.0,5084576.0,6594560.0,9425920.0,129995443.0,28672.0,246200335.0,18790481920.0
127,32,7168,512,256,8,ActivationType.Gelu,torch.bfloat16,torch.float8_e4m3fnuz,torch.float8_e4m3fnuz,QuantType.per_1x128,1,1,ck,stage1,16,moe_ck2stages_gemm1_256x16x128x256_1x4_MulABScaleExpertWeightA8W8blkscale_v1_Nswizzle0_Quant4_MulRoutedWeight1_gelu_F8_F8_B16,311.7751,28.986333333333285,0.02%,18.08,9042.61,1153716.75,256.0,6.64089,120114395.0,0.0,0.0,73400320.0,36700160.0,100750.0,9231820.0,10845390.0,94869059.0,3857533.0,4.720671,20.581293,0.0219620496,645120.0,2293760.0,4741120.0,6963200.0,9912320.0,76523241.0,4096.0,242866583.0,37580963840.0
127,32,7168,512,256,8,ActivationType.Gelu,torch.bfloat16,torch.float8_e4m3fnuz,torch.float8_e4m3fnuz,QuantType.per_1x128,1,1,ck,stage2,16,moe_ck2stages_gemm2_256x16x128x256_1x4_MulABScaleExpertWeightA8W8blkscale_v1_Nswizzle0_Quant4_MulRoutedWeight0_F8_F8_B16,158.8247,28.986333333333285,16.73%,35.49,17750.77,575862.25,3584.0,5.295776,76104822.0,0.0,0.0,36700160.0,18350080.0,107553.0,4664283.0,6581210.0,60495722.0,2034381.0,8.115154,50.33826,0.239403101,510832.0,1146880.0,5156368.0,6307840.0,10214848.0,169046847.0,57344.0,313020023.0,18790481920.0
128,32,7168,512,256,8,ActivationType.Silu,torch.bfloat16,torch.float8_e4m3fnuz,torch.float8_e4m3fnuz,QuantType.per_1x128,1,1,ck,stage1,16,moe_ck2stages_gemm1_256x16x128x256_1x4_MulABScaleExpertWeightA8W8blkscale_v1_Nswizzle0_Quant4_MulRoutedWeight1_silu_F8_F8_B16,311.0183,29.40477777777778,0.02%,18.12,9064.61,1153681.1875,256.0,6.643404,119454795.0,0.0,0.0,73400320.0,36700160.0,97357.0,9231330.0,8762495.0,93985776.0,3704559.0,4.905713,20.085841,0.0149921826,645120.0,2293760.0,4928000.0,6963200.0,9912320.0,70975369.0,4096.0,228079774.0,37580963840.0
128,32,7168,512,256,8,ActivationType.Silu,torch.bfloat16,torch.float8_e4m3fnuz,torch.float8_e4m3fnuz,QuantType.per_1x128,1,1,ck,stage2,16,moe_ck2stages_gemm2_256x16x128x256_1x4_MulABScaleExpertWeightA8W8blkscale_v1_Nswizzle0_Quant4_MulRoutedWeight0_F8_F8_B16,158.9413,29.40477777777778,16.78%,35.47,17737.75,575862.0,3584.0,5.225161,76875655.0,0.0,0.0,36700160.0,18350080.0,107070.0,4664289.0,8304081.0,61214315.0,2112304.0,7.512808,48.031578,0.228908841,510832.0,1146880.0,5156368.0,6307840.0,10214848.0,175091633.0,57344.0,322622927.0,18790481920.0
129,32,7168,2048,33,10,ActivationType.Silu,torch.bfloat16,torch.float8_e4m3fnuz,torch.float8_e4m3fnuz,QuantType.per_1x128,1,0,asm,asm_1stage,32,_ZN5aiter47fmoe_bf16_blockscaleFp8_g1u1_vs_silu_1tg_32x128E,423.9941,0.0,0.00%,66.48,3429.33,1424683.875,71680.0,12.637819,149752863.0,0.0,0.0,181665792.0,90832896.0,517177.0,12546470.0,11533870.0,114669522.0,4643644.0,0.0,10.428484,0.130675693,2215488.0,5677056.0,18503296.0,0.0,8422656.0,99857040.0,2752.0,148456131.0,93012885504.0
130,32,7168,2048,33,10,ActivationType.Silu,torch.bfloat16,torch.float8_e4m3fnuz,torch.float8_e4m3fnuz,QuantType.per_Token,1,0,asm,asm_1stage,32,_ZN5aiter45fmoe_bf16_pertokenFp8_g1u1_vs_silu_1tg_32x512E,400.6129,0.0,0.00%,70.36,3629.47,1434128.3125,19200.0,10.502178,86903102.0,0.0,0.0,181665792.0,90832896.0,180217.0,11781732.0,10802114.0,61546673.0,5682277.0,0.0,5.052977,0.0723902373,536976.0,5677056.0,9330304.0,0.0,2114112.0,4476408.0,688.0,87680136.0,93012885504.0
131,56,6144,4096,8,2,ActivationType.Silu,torch.bfloat16,torch.float8_e4m3fnuz,torch.float8_e4m3fnuz,QuantType.per_1x128,1,0,asm,asm_1stage,32,_ZN5aiter47fmoe_bf16_blockscaleFp8_g1u1_vs_silu_1tg_32x256E,169.382,0.0,0.52%,99.84,3571.88,593476.625,23296.0,9.937917,36358560.0,0.0,0.0,75497472.0,37748736.0,198853.0,5120168.0,2077277.0,24089860.0,2559322.0,0.0,4.827144,0.180896592,502784.0,2359296.0,6066176.0,0.0,1884160.0,10783767.0,768.0,37889608.0,38654705664.0
132,64,2048,192,128,8,ActivationType.Silu,torch.bfloat16,torch.bfloat16,torch.bfloat16,QuantType.No,1,0,ck,stage1,32,moe_ck2stages_gemm1_256x32x64x64_1x4_TypeCast_v1_Nswizzle0_Quant0_MulRoutedWeight0_silu_B16_B16_B16,57.8879,0.0,0.00%,20.87,5225.86,197468.0,192.0,4.811489,53491117.0,12484608.0,0.0,0.0,12484608.0,46442.0,1581405.0,9463410.0,47859967.0,1403483.0,0.0905407762,12.620121,0.0020282931,252984.0,780288.0,1392936.0,48768.0,2048256.0,50240991.0,1728.0,54380630.0,6392119296.0
132,64,2048,192,128,8,ActivationType.Silu,torch.bfloat16,torch.bfloat16,torch.bfloat16,QuantType.No,1,0,ck,stage2,32,moe_ck2stages_gemm2_256x32x64x64_1x4_TypeCastExpertWeight_v1_Nswizzle0_Quant0_MulRoutedWeight1_B16_B16_B16,35.4541,0.0,0.00%,34.07,8532.56,99680.5,2048.0,8.391182,11682174.0,6242304.0,0.0,0.0,6242304.0,77301.0,830115.0,1053438.0,7349231.0,715400.0,0.941407026,60.181583,0.325693474,345440.0,390144.0,2178464.0,260096.0,2682240.0,98708642.0,18432.0,133017821.0,3196059648.0
133,64,2048,192,128,8,ActivationType.Silu,torch.bfloat16,torch.bfloat16,torch.bfloat16,QuantType.No,1,1,ck,stage1,32,moe_ck2stages_gemm1_256x32x64x64_1x4_TypeCastExpertWeight_v1_Nswizzle0_Quant0_MulRoutedWeight1_silu_B16_B16_B16,58.0802,0.0,0.00%,20.8,5208.56,197468.5,192.0,4.85045,52740441.0,12484608.0,0.0,0.0,12484608.0,48570.0,1581582.0,13259776.0,46757100.0,1656588.0,0.0769837523,13.285476,0.00190454596,252984.0,780288.0,1415796.0,48768.0,2048256.0,63175320.0,1728.0,67329125.0,6392119296.0
133,64,2048,192,128,8,ActivationType.Silu,torch.bfloat16,torch.bfloat16,torch.bfloat16,QuantType.No,1,1,ck,stage2,32,moe_ck2stages_gemm2_256x32x64x64_1x4_TypeCast_v1_Nswizzle0_Quant0_MulRoutedWeight0_B16_B16_B16,34.8953,0.0,0.00%,34.62,8669.2,99513.375,2048.0,5.872599,19031345.0,6242304.0,0.0,0.0,6242304.0,73967.0,828889.0,2001783.0,15000218.0,668862.0,0.975596875,59.685875,0.295331707,345440.0,390144.0,1999648.0,260096.0,2682240.0,92014429.0,18432.0,127298951.0,3196059648.0
134,64,2048,192,128,8,ActivationType.Gelu,torch.bfloat16,torch.bfloat16,torch.bfloat16,QuantType.No,1,0,ck,stage1,32,moe_ck2stages_gemm1_256x32x64x64_1x4_TypeCast_v1_Nswizzle0_Quant0_MulRoutedWeight0_gelu_B16_B16_B16,56.5524,0.0,0.00%,21.36,5349.27,197530.125,192.0,6.025133,41892054.0,12484608.0,0.0,0.0,12484608.0,48851.0,1581416.0,6590936.0,36265267.0,1624006.0,0.078188951,13.19957,0.00198005566,252984.0,780288.0,1267858.0,48768.0,2048256.0,61979205.0,1728.0,65862671.0,6392119296.0
134,64,2048,192,128,8,ActivationType.Gelu,torch.bfloat16,torch.bfloat16,torch.bfloat16,QuantType.No,1,0,ck,stage2,32,moe_ck2stages_gemm2_256x32x64x64_1x4_TypeCastExpertWeight_v1_Nswizzle0_Quant0_MulRoutedWeight1_B16_B16_B16,35.5556,0.0,0.00%,33.97,8508.2,99679.5625,2048.0,5.718474,19816237.0,6242304.0,0.0,0.0,6242304.0,77129.0,830207.0,1956728.0,15359860.0,697420.0,0.962936768,61.0665,0.165551035,345440.0,390144.0,2178464.0,260096.0,2682240.0,97782237.0,18432.0,131955933.0,3196059648.0
135,64,2048,192,128,8,ActivationType.Gelu,torch.bfloat16,torch.bfloat16,torch.bfloat16,QuantType.No,1,1,ck,stage1,32,moe_ck2stages_gemm1_256x32x64x64_1x4_TypeCastExpertWeight_v1_Nswizzle0_Quant0_MulRoutedWeight1_gelu_B16_B16_B16,57.1364,0.0,0.00%,21.14,5294.6,197518.375,192.0,6.586781,37503417.0,12484608.0,0.0,0.0,12484608.0,51614.0,1581894.0,5055132.0,31661991.0,1679378.0,0.075521758,13.142307,0.00138289308,252984.0,780288.0,1304544.0,48768.0,2048256.0,63956526.0,1728.0,67892913.0,6392119296.0
135,64,2048,192,128,8,ActivationType.Gelu,torch.bfloat16,torch.bfloat16,torch.bfloat16,QuantType.No,1,1,ck,stage2,32,moe_ck2stages_gemm2_256x32x64x64_1x4_TypeCast_v1_Nswizzle0_Quant0_MulRoutedWeight0_B16_B16_B16,34.8223,0.0,0.00%,34.69,8687.37,99527.6875,2048.0,8.689462,11203581.0,6242304.0,0.0,0.0,6242304.0,73874.0,828916.0,1074638.0,7410144.0,671460.0,0.99730612,59.303494,0.253966126,345440.0,390144.0,1999648.0,260096.0,2682240.0,91051838.0,18432.0,123730127.0,3196059648.0
136,64,4096,192,128,8,ActivationType.Silu,torch.bfloat16,torch.bfloat16,torch.bfloat16,QuantType.No,1,0,ck,stage1,32,moe_ck2stages_gemm1_256x32x64x64_1x4_TypeCast_v1_Nswizzle0_Quant0_MulRoutedWeight0_silu_B16_B16_B16,102.3455,0.0,0.00%,23.61,5911.63,389456.8125,192.0,6.997402,76290468.0,24576000.0,0.0,0.0,24576000.0,71622.0,3116759.0,10410696.0,66814855.0,2392185.0,0.0521798752,13.45603,0.00117730843,489000.0,1536000.0,2259000.0,48000.0,3936000.0,91910576.0,1728.0,99025066.0,12582912000.0
136,64,4096,192,128,8,ActivationType.Silu,torch.bfloat16,torch.bfloat16,torch.bfloat16,QuantType.No,1,0,ck,stage2,32,moe_ck2stages_gemm2_256x32x64x64_1x4_TypeCastExpertWeight_v1_Nswizzle0_Quant0_MulRoutedWeight1_B16_B16_B16,60.0445,0.0,0.08%,40.24,10076.33,194203.75,4096.0,9.265868,26444866.0,12288000.0,0.0,0.0,12288000.0,153424.0,1619310.0,4615348.0,18598345.0,894158.0,1.483481,70.826663,0.270878659,680064.0,768000.0,4291072.0,512000.0,5280256.0,143800760.0,36864.0,195557652.0,6291456000.0
137,64,4096,192,128,8,ActivationType.Silu,torch.bfloat16,torch.bfloat16,torch.bfloat16,QuantType.No,1,1,ck,stage1,32,moe_ck2stages_gemm1_256x32x64x64_1x4_TypeCastExpertWeight_v1_Nswizzle0_Quant0_MulRoutedWeight1_silu_B16_B16_B16,102.825,0.0,0.00%,23.5,5884.06,389600.0,192.0,7.474473,69862899.0,24576000.0,0.0,0.0,24576000.0,74240.0,3116447.0,8924580.0,60330991.0,2184428.0,0.0571846183,13.323624,0.00133549911,489000.0,1536000.0,2281500.0,48000.0,3936000.0,82315112.0,1728.0,89469369.0,12582912000.0
137,64,4096,192,128,8,ActivationType.Silu,torch.bfloat16,torch.bfloat16,torch.bfloat16,QuantType.No,1,1,ck,stage2,32,moe_ck2stages_gemm2_256x32x64x64_1x4_TypeCast_v1_Nswizzle0_Quant0_MulRoutedWeight0_B16_B16_B16,58.9165,0.0,0.00%,41.01,10269.25,194065.125,4096.0,9.713517,25498189.0,12288000.0,0.0,0.0,12288000.0,144372.0,1618208.0,4379826.0,18670456.0,911609.0,1.452281,71.039736,0.284583297,680064.0,768000.0,3939072.0,512000.0,5280256.0,148223809.0,36864.0,200359789.0,6291456000.0
138,64,4096,192,128,8,ActivationType.Gelu,torch.bfloat16,torch.bfloat16,torch.bfloat16,QuantType.No,1,0,ck,stage1,32,moe_ck2stages_gemm1_256x32x64x64_1x4_TypeCast_v1_Nswizzle0_Quant0_MulRoutedWeight0_gelu_B16_B16_B16,101.9636,0.0,0.00%,23.69,5933.77,389587.5,192.0,6.72306,79022649.0,24576000.0,0.0,0.0,24576000.0,74892.0,3115896.0,11077415.0,69769834.0,2379700.0,0.0526475487,13.635225,0.00113576118,489000.0,1536000.0,2178167.0,48000.0,3936000.0,92509954.0,1728.0,99452426.0,12582912000.0
138,64,4096,192,128,8,ActivationType.Gelu,torch.bfloat16,torch.bfloat16,torch.bfloat16,QuantType.No,1,0,ck,stage2,32,moe_ck2stages_gemm2_256x32x64x64_1x4_TypeCastExpertWeight_v1_Nswizzle0_Quant0_MulRoutedWeight1_B16_B16_B16,60.0931,0.0,0.13%,40.2,10068.18,194213.5625,4096.0,5.374625,48844607.0,12288000.0,0.0,0.0,12288000.0,151238.0,1619230.0,11308865.0,40947080.0,1475476.0,0.894842825,75.736339,0.388522578,680064.0,768000.0,4291072.0,512000.0,5280256.0,272373132.0,36864.0,346670984.0,6291456000.0
139,64,4096,192,128,8,ActivationType.Gelu,torch.bfloat16,torch.bfloat16,torch.bfloat16,QuantType.No,1,1,ck,stage1,32,moe_ck2stages_gemm1_256x32x64x64_1x4_TypeCastExpertWeight_v1_Nswizzle0_Quant0_MulRoutedWeight1_gelu_B16_B16_B16,103.148,0.0,0.00%,23.42,5865.63,389684.125,192.0,7.173951,74348255.0,24576000.0,0.0,0.0,24576000.0,77208.0,3116814.0,10797702.0,64712066.0,3024537.0,0.0414012216,13.797983,0.00102424897,489000.0,1536000.0,2172000.0,48000.0,3936000.0,121116979.0,1728.0,127977515.0,12582912000.0
139,64,4096,192,128,8,ActivationType.Gelu,torch.bfloat16,torch.bfloat16,torch.bfloat16,QuantType.No,1,1,ck,stage2,32,moe_ck2stages_gemm2_256x32x64x64_1x4_TypeCast_v1_Nswizzle0_Quant0_MulRoutedWeight0_B16_B16_B16,58.7821,0.0,0.00%,41.1,10292.73,194066.5625,4096.0,7.962919,30985581.0,12288000.0,0.0,0.0,12288000.0,145027.0,1618090.0,5575747.0,24112044.0,1430317.0,0.923538248,73.508826,0.415255806,680064.0,768000.0,3939072.0,512000.0,5280256.0,260657676.0,36864.0,326020229.0,6291456000.0
140,64,4096,384,128,8,ActivationType.Gelu,torch.bfloat16,torch.bfloat16,torch.bfloat16,QuantType.No,1,0,ck,stage1,32,moe_ck2stages_gemm1_256x32x64x128_1x4_TypeCast_v1_Nswizzle0_Quant0_MulRoutedWeight0_gelu_B16_B16_B16,203.378,0.0,0.00%,23.76,5944.64,773819.8125,384.0,9.267498,112210465.0,48758784.0,0.0,0.0,48758784.0,129430.0,6193322.0,9199888.0,95188772.0,3390174.0,0.0734886852,25.149069,0.0343602354,970176.0,3047424.0,4473523.0,95232.0,7809024.0,89812530.0,3456.0,260719983.0,24964497408.0
140,64,4096,384,128,8,ActivationType.Gelu,torch.bfloat16,torch.bfloat16,torch.bfloat16,QuantType.No,1,0,ck,stage2,32,moe_ck2stages_gemm2_256x32x64x128_1x4_TypeCastExpertWeight_v1_Nswizzle0_Quant0_MulRoutedWeight1_B16_B16_B16,109.6485,0.0,0.52%,44.07,11026.22,385210.625,4096.0,8.233205,63249688.0,24379392.0,0.0,0.0,24379392.0,272038.0,3147221.0,8553190.0,49934105.0,1792434.0,0.737261088,49.549639,0.325291575,1150912.0,1523712.0,6450880.0,507904.0,9047808.0,192344955.0,36864.0,273080569.0,12482248704.0
141,64,4096,384,128,8,ActivationType.Gelu,torch.bfloat16,torch.bfloat16,torch.bfloat16,QuantType.No,1,1,ck,stage1,32,moe_ck2stages_gemm1_256x32x64x64_1x4_TypeCastExpertWeight_v1_Nswizzle0_Quant0_MulRoutedWeight1_gelu_B16_B16_B16,201.0137,0.0,0.00%,24.04,6014.56,769744.8125,384.0,9.3848,110404290.0,48758784.0,0.0,0.0,48758784.0,153486.0,6161219.0,12402806.0,93218256.0,3298714.0,0.0754630958,27.079986,0.00095604655,970176.0,3047424.0,4309248.0,95232.0,7809024.0,219076707.0,3456.0,273392570.0,24964497408.0
141,64,4096,384,128,8,ActivationType.Gelu,torch.bfloat16,torch.bfloat16,torch.bfloat16,QuantType.No,1,1,ck,stage2,32,moe_ck2stages_gemm2_256x32x64x128_1x4_TypeCast_v1_Nswizzle0_Quant0_MulRoutedWeight0_B16_B16_B16,109.8226,0.0,0.00%,44.0,11008.74,385046.75,4096.0,8.565722,63405108.0,24379392.0,0.0,0.0,24379392.0,264927.0,3146036.0,6673278.0,51079712.0,1952712.0,0.676195404,46.783872,0.46236477,1150912.0,1523712.0,6101696.0,507904.0,9047808.0,194597958.0,36864.0,281122474.0,12482248704.0
142,64,4096,384,128,8,ActivationType.Silu,torch.bfloat16,torch.bfloat16,torch.bfloat16,QuantType.No,1,0,ck,stage1,32,moe_ck2stages_gemm1_256x32x64x128_1x4_TypeCast_v1_Nswizzle0_Quant0_MulRoutedWeight0_silu_B16_B16_B16,203.8343,0.0,0.00%,23.7,5931.33,773854.0625,384.0,8.986059,115703140.0,48758784.0,0.0,0.0,48758784.0,126393.0,6193187.0,13371219.0,98608035.0,3446445.0,0.0723160854,25.174649,0.0140095709,970176.0,3047424.0,4633632.0,95232.0,7809024.0,91316662.0,3456.0,265217028.0,24964497408.0
142,64,4096,384,128,8,ActivationType.Silu,torch.bfloat16,torch.bfloat16,torch.bfloat16,QuantType.No,1,0,ck,stage2,32,moe_ck2stages_gemm2_256x32x64x128_1x4_TypeCastExpertWeight_v1_Nswizzle0_Quant0_MulRoutedWeight1_B16_B16_B16,109.7968,0.0,0.38%,44.01,11011.32,385200.75,4096.0,8.908458,61042586.0,24379392.0,0.0,0.0,24379392.0,271965.0,3147257.0,7100219.0,47724711.0,2995773.0,0.441577996,50.793136,0.315947481,1150912.0,1523712.0,6450880.0,507904.0,9047808.0,352292620.0,36864.0,467379028.0,12482248704.0
143,64,4096,384,128,8,ActivationType.Silu,torch.bfloat16,torch.bfloat16,torch.bfloat16,QuantType.No,1,1,ck,stage1,32,moe_ck2stages_gemm1_256x32x64x128_1x4_TypeCastExpertWeight_v1_Nswizzle0_Quant0_MulRoutedWeight1_silu_B16_B16_B16,204.8142,0.0,0.00%,23.59,5902.95,773903.875,384.0,9.29838,113351110.0,48758784.0,0.0,0.0,48758784.0,126585.0,6194101.0,11876596.0,96227690.0,3577435.0,0.0696451433,25.654429,0.0242608365,970176.0,3047424.0,4678272.0,95232.0,7809024.0,95819425.0,3456.0,280636668.0,24964497408.0
143,64,4096,384,128,8,ActivationType.Silu,torch.bfloat16,torch.bfloat16,torch.bfloat16,QuantType.No,1,1,ck,stage2,32,moe_ck2stages_gemm2_256x32x64x128_1x4_TypeCast_v1_Nswizzle0_Quant0_MulRoutedWeight0_B16_B16_B16,114.2772,0.0,0.00%,42.28,10579.61,385052.625,4096.0,8.927221,60820308.0,24379392.0,0.0,0.0,24379392.0,264841.0,3146011.0,8662238.0,48520330.0,1997177.0,0.661332231,47.575735,0.387520187,1150912.0,1523712.0,6101696.0,507904.0,9047808.0,205767230.0,36864.0,292305801.0,12482248704.0
144,64,4096,384,128,8,ActivationType.Silu,torch.bfloat16,torch.float8_e4m3fnuz,torch.float8_e4m3fnuz,QuantType.per_Tensor,1,0,ck,stage1,16,moe_ck2stages_gemm1_128x16x64x128_1x2_MulABScale_v1_Nswizzle0_Quant1_MulRoutedWeight0_silu_F8_F8_B16,102.2524,32.111777777777704,0.00%,47.25,5914.45,384459.5,384.0,3.871614,58134584.0,0.0,0.0,24379392.0,12189696.0,95633.0,3078762.0,7916871.0,55993979.0,1999657.0,2.952732,12.962508,0.00141385879,244032.0,761856.0,1435920.0,2261760.0,3452160.0,69518814.0,1920.0,79433086.0,12482248704.0
144,64,4096,384,128,8,ActivationType.Silu,torch.bfloat16,torch.float8_e4m3fnuz,torch.float8_e4m3fnuz,QuantType.per_Tensor,1,0,ck,stage2,16,moe_ck2stages_gemm2_128x16x128x128_1x2_MulABScaleExpertWeight_v1_Nswizzle0_Quant1_MulRoutedWeight1_F8_F8_B16,61.9241,32.111777777777704,0.37%,78.03,9766.25,192621.625,16384.0,3.909437,29548096.0,0.0,0.0,12189696.0,6094848.0,80084.0,1803106.0,5234536.0,24539576.0,963038.0,3.89691,33.682827,0.495706841,202464.0,380928.0,2057216.0,1455936.0,2519744.0,55309681.0,10240.0,100674725.0,6241124352.0
145,64,4096,384,128,8,ActivationType.Silu,torch.bfloat16,torch.float8_e4m3fnuz,torch.float8_e4m3fnuz,QuantType.per_Tensor,1,1,ck,stage1,16,moe_ck2stages_gemm1_128x16x64x128_1x2_MulABScale_v1_Nswizzle0_Quant1_MulRoutedWeight1_silu_F8_F8_B16,102.6083,32.579111111111075,0.00%,47.09,5893.93,384533.5625,384.0,4.094692,55984690.0,0.0,0.0,24379392.0,12189696.0,94910.0,3079576.0,8759001.0,52846766.0,1979146.0,2.966022,12.86394,0.00166938419,244032.0,761856.0,1461216.0,2261760.0,3452160.0,68690212.0,1920.0,78475865.0,12482248704.0
145,64,4096,384,128,8,ActivationType.Silu,torch.bfloat16,torch.float8_e4m3fnuz,torch.float8_e4m3fnuz,QuantType.per_Tensor,1,1,ck,stage2,16,moe_ck2stages_gemm2_128x16x128x128_1x2_MulABScaleExpertWeight_v1_Nswizzle0_Quant1_MulRoutedWeight0_F8_F8_B16,61.8739,32.579111111111075,0.00%,78.09,9774.17,192546.25,16384.0,3.926095,29919412.0,0.0,0.0,12189696.0,6094848.0,76796.0,1802615.0,4056468.0,25086032.0,1011137.0,3.71944,32.794839,0.569942452,202464.0,380928.0,1961984.0,1455936.0,2519744.0,57084059.0,10240.0,102697569.0,6241124352.0
146,64,4096,384,128,8,ActivationType.Silu,torch.bfloat16,torch.float8_e4m3fnuz,torch.float8_e4m3fnuz,QuantType.per_Token,1,0,asm,asm_1stage,32,_ZN5aiter45fmoe_bf16_pertokenFp8_g1u1_vs_silu_1tg_32x384E,164.9576,0.0,0.00%,29.29,3666.19,579593.6875,4608.0,8.489828,39635960.0,0.0,0.0,73138176.0,36569088.0,110746.0,4712247.0,3557787.0,28720266.0,2777880.0,0.0,4.594805,0.0518179886,308016.0,2285568.0,4366592.0,0.0,1204288.0,2546527.0,576.0,39174231.0,37446746112.0
147,64,4096,384,128,8,ActivationType.Silu,torch.bfloat16,torch.float8_e4m3fnuz,torch.float8_e4m3fnuz,QuantType.per_Token,1,1,asm,asm_1stage,32,_ZN5aiter50fmoe_bf16_pertokenFp8_g1u1_vs_tkw1_silu_1tg_32x192E,168.5294,0.0,0.00%,28.67,3588.49,581402.125,8192.0,9.196351,73018831.0,0.0,0.0,73138176.0,36569088.0,144246.0,4778716.0,7139440.0,60284969.0,2647364.0,0.0,9.215506,0.0835714691,550560.0,2285568.0,5619296.0,0.0,2222080.0,49237075.0,1152.0,75056593.0,37446746112.0
148,64,4096,384,128,8,ActivationType.Gelu,torch.bfloat16,torch.float8_e4m3fnuz,torch.float8_e4m3fnuz,QuantType.per_Tensor,1,0,ck,stage1,32,moe_ck2stages_gemm1_256x32x64x128_1x4_MulABScale_v1_Nswizzle0_Quant1_MulRoutedWeight0_gelu_F8_F8_B16,103.4599,31.969111111111104,0.00%,46.7,5845.42,384527.9375,384.0,9.187192,54447630.0,0.0,0.0,48758784.0,24379392.0,91854.0,3079401.0,6120241.0,44963055.0,1689142.0,10.390556,26.017021,0.00172876143,770784.0,1523712.0,2622267.0,6737664.0,10642176.0,103118862.0,3456.0,134964049.0,24964497408.0
148,64,4096,384,128,8,ActivationType.Gelu,torch.bfloat16,torch.float8_e4m3fnuz,torch.float8_e4m3fnuz,QuantType.per_Tensor,1,0,ck,stage2,32,moe_ck2stages_gemm2_256x32x64x128_1x4_MulABScaleExpertWeight_v1_Nswizzle0_Quant1_MulRoutedWeight1_F8_F8_B16,57.926,31.969111111111104,0.51%,83.41,10440.32,192692.375,4096.0,11.576346,19241664.0,0.0,0.0,24379392.0,12189696.0,157109.0,1607129.0,2999015.0,10969168.0,682596.0,18.866231,65.073924,0.166277087,865216.0,761856.0,4863680.0,5079040.0,9809664.0,89211863.0,36864.0,140150117.0,12482248704.0
149,64,4096,384,128,8,ActivationType.Gelu,torch.bfloat16,torch.float8_e4m3fnuz,torch.float8_e4m3fnuz,QuantType.per_Tensor,1,1,ck,stage1,16,moe_ck2stages_gemm1_128x16x64x128_1x2_MulABScale_v1_Nswizzle0_Quant1_MulRoutedWeight1_gelu_F8_F8_B16,102.3868,31.812666666666644,0.00%,47.19,5906.68,384508.1875,384.0,4.115048,56531142.0,0.0,0.0,24379392.0,12189696.0,99090.0,3079538.0,8329428.0,53393631.0,1972707.0,2.99039,13.073337,0.00168309907,244032.0,761856.0,1319856.0,2261760.0,3452160.0,69565164.0,1920.0,79103405.0,12482248704.0
149,64,4096,384,128,8,ActivationType.Gelu,torch.bfloat16,torch.float8_e4m3fnuz,torch.float8_e4m3fnuz,QuantType.per_Tensor,1,1,ck,stage2,16,moe_ck2stages_gemm2_128x16x128x128_1x2_MulABScaleExpertWeight_v1_Nswizzle0_Quant1_MulRoutedWeight0_F8_F8_B16,61.7948,31.812666666666644,0.00%,78.19,9786.68,192542.0,16384.0,3.772125,29813105.0,0.0,0.0,12189696.0,6094848.0,76785.0,1802514.0,4456184.0,24926881.0,1011088.0,3.70279,33.475806,0.586526418,202464.0,380928.0,1961984.0,1455936.0,2519744.0,59827433.0,10240.0,105301411.0,6241124352.0
150,64,4096,384,128,8,ActivationType.Gelu,torch.bfloat16,torch.float8_e4m3fnuz,torch.float8_e4m3fnuz,QuantType.per_Token,1,0,asm,asm_1stage,32,_ZN5aiter45fmoe_bf16_pertokenFp8_g1u1_vs_gelu_1tg_32x384E,165.6301,0.0,0.00%,29.17,3651.31,579341.875,4608.0,8.70992,38432061.0,0.0,0.0,73138176.0,36569088.0,110252.0,4712742.0,3249489.0,27619287.0,2818290.0,0.0,4.617108,0.0866899435,308016.0,2285568.0,4438016.0,0.0,1204288.0,2751196.0,576.0,39878547.0,37446746112.0
151,64,4096,384,128,8,ActivationType.Gelu,torch.bfloat16,torch.float8_e4m3fnuz,torch.float8_e4m3fnuz,QuantType.per_Token,1,1,asm,asm_1stage,32,_ZN5aiter50fmoe_bf16_pertokenFp8_g1u1_vs_tkw1_gelu_1tg_32x192E,168.9562,0.0,0.00%,28.6,3579.43,581129.25,8192.0,9.064136,72568160.0,0.0,0.0,73138176.0,36569088.0,146158.0,4779873.0,7373704.0,59777202.0,2644368.0,0.0,9.071027,0.0965405973,550560.0,2285568.0,5690720.0,0.0,2222080.0,47487760.0,1152.0,73495345.0,37446746112.0
152,64,4096,384,128,8,ActivationType.Silu,torch.bfloat16,torch.float8_e4m3fnuz,torch.float8_e4m3fnuz,QuantType.per_1x128,1,0,asm,stage1,16,_ZN5aiter59fmoe_stage1_bf16_pertokenFp8_blockscale_g1u1_16x128_4tg_pf2E,98.9259,31.238666666666763,44.08%,48.84,6113.33,383532.875,226.21875,4.313527,62365622.0,0.0,0.0,24379392.0,12189696.0,131934.0,3070069.0,7685826.0,51865358.0,1864212.0,0.0,13.475689,0.00165669996,129456.0,761856.0,2025396.0,0.0,848160.0,70704805.0,1920.0,77273524.0,12482248704.0
152,64,4096,384,128,8,ActivationType.Silu,torch.bfloat16,torch.float8_e4m3fnuz,torch.float8_e4m3fnuz,QuantType.per_1x128,1,0,ck,stage2,16,moe_ck2stages_gemm2_128x16x128x128_1x2_MulABScaleExpertWeightA8W8blkscale_v1_Nswizzle0_Quant4_MulRoutedWeight1_F8_F8_B16,58.3148,31.238666666666763,15.32%,82.86,10370.72,193115.875,4096.0,4.299632,26474890.0,0.0,0.0,12189696.0,6094848.0,145649.0,1610446.0,4084168.0,20595846.0,842592.0,7.81295,34.401706,0.309311314,170720.0,380928.0,2170464.0,2539520.0,3603328.0,44207674.0,10240.0,89455400.0,6241124352.0
153,64,4096,384,128,8,ActivationType.Gelu,torch.bfloat16,torch.float8_e4m3fnuz,torch.float8_e4m3fnuz,QuantType.per_1x128,1,0,asm,stage1,16,_ZN5aiter59fmoe_stage1_bf16_pertokenFp8_blockscale_g1u1_16x128_4tg_pf2E,98.8312,32.43611111111114,44.34%,48.89,6119.18,383514.375,227.0625,4.273002,62426921.0,0.0,0.0,24379392.0,12189696.0,132928.0,3069990.0,5970143.0,51897711.0,1848687.0,0.0,13.539139,0.00160987147,129456.0,761856.0,2040276.0,0.0,848160.0,70798487.0,1920.0,77339045.0,12482248704.0
153,64,4096,384,128,8,ActivationType.Gelu,torch.bfloat16,torch.float8_e4m3fnuz,torch.float8_e4m3fnuz,QuantType.per_1x128,1,0,ck,stage2,16,moe_ck2stages_gemm2_128x16x128x128_1x2_MulABScaleExpertWeightA8W8blkscale_v1_Nswizzle0_Quant4_MulRoutedWeight1_F8_F8_B16,60.3712,32.43611111111114,15.18%,80.04,10017.46,193115.0,4096.0,4.51396,25120224.0,0.0,0.0,12189696.0,6094848.0,144651.0,1610405.0,3785340.0,19217740.0,866785.0,7.602345,34.339668,0.342722487,170720.0,380928.0,2170464.0,2539520.0,3603328.0,43885027.0,10240.0,91767768.0,6241124352.0
154,64,4096,384,128,8,ActivationType.Silu,torch.bfloat16,torch.float8_e4m3fnuz,torch.float8_e4m3fnuz,QuantType.per_1x128,1,1,ck,stage1,16,moe_ck2stages_gemm1_128x16x128x128_1x2_MulABScaleExpertWeightA8W8blkscale_v1_Nswizzle0_Quant4_MulRoutedWeight1_silu_F8_F8_B16,108.4603,30.526222222222348,0.01%,44.55,5575.92,384462.125,384.0,4.004786,37057518.0,0.0,0.0,24379392.0,12189696.0,126729.0,3078941.0,5555522.0,54040494.0,1992777.0,1.689551,6.432093,0.00366156818,123504.0,761856.0,1813872.0,1297536.0,1916544.0,31095303.0,960.0,39517591.0,12482248704.0
154,64,4096,384,128,8,ActivationType.Silu,torch.bfloat16,torch.float8_e4m3fnuz,torch.float8_e4m3fnuz,QuantType.per_1x128,1,1,ck,stage2,16,moe_ck2stages_gemm2_128x16x128x128_1x2_MulABScaleExpertWeightA8W8blkscale_v1_Nswizzle0_Quant4_MulRoutedWeight0_F8_F8_B16,60.1401,30.526222222222348,16.58%,80.34,10055.96,193039.625,4096.0,4.479427,26652206.0,0.0,0.0,12189696.0,6094848.0,139498.0,1609772.0,4241324.0,20567751.0,909929.0,7.223434,33.338118,0.331936842,170720.0,380928.0,2059360.0,2539520.0,3603328.0,46553412.0,10240.0,93764626.0,6241124352.0
155,64,4096,384,128,8,ActivationType.Gelu,torch.bfloat16,torch.float8_e4m3fnuz,torch.float8_e4m3fnuz,QuantType.per_1x128,1,1,ck,stage1,16,moe_ck2stages_gemm1_128x16x128x128_1x2_MulABScaleExpertWeightA8W8blkscale_v1_Nswizzle0_Quant4_MulRoutedWeight1_gelu_F8_F8_B16,107.5917,31.50533333333325,0.01%,44.91,5620.94,384485.5625,384.0,3.939503,36665103.0,0.0,0.0,24379392.0,12189696.0,133355.0,3078857.0,6051770.0,54734106.0,1942162.0,1.743985,6.527919,0.00351139377,123504.0,761856.0,1697808.0,1297536.0,1916544.0,30733900.0,960.0,38854517.0,12482248704.0
155,64,4096,384,128,8,ActivationType.Gelu,torch.bfloat16,torch.float8_e4m3fnuz,torch.float8_e4m3fnuz,QuantType.per_1x128,1,1,ck,stage2,16,moe_ck2stages_gemm2_128x16x128x128_1x2_MulABScaleExpertWeightA8W8blkscale_v1_Nswizzle0_Quant4_MulRoutedWeight0_F8_F8_B16,60.2388,31.50533333333325,16.56%,80.21,10039.48,193032.375,4096.0,4.344466,26074099.0,0.0,0.0,12189696.0,6094848.0,138674.0,1609769.0,3760985.0,19992624.0,880298.0,7.430517,33.435962,0.333030536,170720.0,380928.0,2059360.0,2539520.0,3603328.0,45728933.0,10240.0,91418991.0,6241124352.0
156,64,7168,256,256,8,ActivationType.Gelu,torch.bfloat16,torch.bfloat16,torch.bfloat16,QuantType.No,1,0,ck,stage1,32,moe_ck2stages_gemm1_256x32x64x64_1x4_TypeCast_v1_Nswizzle0_Quant0_MulRoutedWeight0_gelu_B16_B16_B16,429.5641,0.0,0.00%,13.12,6565.74,1636062.0,256.0,11.43973,215899146.0,104136704.0,0.0,0.0,104136704.0,178683.0,13091007.0,17273020.0,181617972.0,5901767.0,0.0516177701,35.758191,0.000843834004,2055712.0,6508544.0,8533120.0,116224.0,16503808.0,470104073.0,4352.0,644113055.0,53317992448.0
156,64,7168,256,256,8,ActivationType.Gelu,torch.bfloat16,torch.bfloat16,torch.bfloat16,QuantType.No,1,0,ck,stage2,32,moe_ck2stages_gemm2_256x32x64x64_1x4_TypeCastExpertWeight_v1_Nswizzle0_Quant0_MulRoutedWeight1_B16_B16_B16,234.7867,0.0,1.62%,24.01,12012.64,816288.125,7168.0,10.859536,111779654.0,52068352.0,0.0,0.0,52068352.0,303575.0,6645023.0,13520544.0,85623535.0,3128304.0,1.356709,82.378785,0.293715068,2669520.0,3254272.0,14171920.0,1627136.0,20847680.0,661383318.0,121856.0,790391889.0,26658996224.0
157,64,7168,256,256,8,ActivationType.Gelu,torch.bfloat16,torch.bfloat16,torch.bfloat16,QuantType.No,1,1,ck,stage1,32,moe_ck2stages_gemm1_256x32x64x128_1x4_TypeCastExpertWeight_v1_Nswizzle0_Quant0_MulRoutedWeight1_gelu_B16_B16_B16,429.2572,0.0,0.00%,13.13,6570.44,1645306.25,256.0,10.962263,226687036.0,104136704.0,0.0,0.0,104136704.0,112192.0,13165777.0,22345570.0,192206895.0,6316875.0,0.0482285342,30.577606,0.0117396877,2055712.0,6508544.0,8713168.0,116224.0,16503808.0,197329130.0,4352.0,589501927.0,53317992448.0
157,64,7168,256,256,8,ActivationType.Gelu,torch.bfloat16,torch.bfloat16,torch.bfloat16,QuantType.No,1,1,ck,stage2,32,moe_ck2stages_gemm2_256x32x64x128_1x4_TypeCast_v1_Nswizzle0_Quant0_MulRoutedWeight0_B16_B16_B16,234.1065,0.0,0.00%,24.08,12047.54,815914.8125,7168.0,11.213133,107084791.0,52068352.0,0.0,0.0,52068352.0,291954.0,6642068.0,9400386.0,82914842.0,2932818.0,1.449743,60.219752,0.386936684,2669520.0,3254272.0,13968528.0,1627136.0,20847680.0,412176704.0,121856.0,540706853.0,26658996224.0
158,64,7168,256,256,8,ActivationType.Gelu,torch.bfloat16,torch.float8_e4m3fnuz,torch.float8_e4m3fnuz,QuantType.per_Tensor,1,0,asm,stage1,16,_ZN5aiter48fmoe_stage1_bf16_pertokenFp8_g1u1_16x128_4tg_pf2E,213.7705,31.3864444444444,0.06%,26.37,6598.96,817590.25,256.0,4.991591,120925941.0,0.0,0.0,52068352.0,26034176.0,99886.0,6542546.0,12335781.0,105074210.0,3565271.0,0.0,17.259677,0.00101630317,217920.0,1627136.0,2056960.0,0.0,1685248.0,178502874.0,2304.0,188441190.0,26658996224.0
158,64,7168,256,256,8,ActivationType.Gelu,torch.bfloat16,torch.float8_e4m3fnuz,torch.float8_e4m3fnuz,QuantType.per_Tensor,1,0,ck,stage2,16,moe_ck2stages_gemm2_256x16x128x256_1x4_MulABScaleExpertWeight_v1_Nswizzle0_Quant1_MulRoutedWeight1_F8_F8_B16,118.3533,31.3864444444444,1.59%,47.63,11919.08,408108.875,14336.0,5.452224,52352351.0,0.0,0.0,26034176.0,13017088.0,117377.0,3494285.0,5504460.0,41400489.0,1656714.0,1.650312,73.496137,0.684021375,572712.0,813568.0,6104896.0,1052912.0,4564112.0,259082534.0,64512.0,375128894.0,13329498112.0
159,64,7168,256,256,8,ActivationType.Gelu,torch.bfloat16,torch.float8_e4m3fnuz,torch.float8_e4m3fnuz,QuantType.per_Tensor,1,1,asm,stage1,16,_ZN5aiter57fmoe_stage1_bf16_pertokenFp8_doweight_g1u1_16x128_4tg_pf2E,213.4348,31.30600000000005,0.00%,26.41,6609.34,817624.875,256.0,4.985106,121927049.0,0.0,0.0,52068352.0,26034176.0,100075.0,6543061.0,11546856.0,106213497.0,3395090.0,0.0,17.391212,0.000944365316,217920.0,1627136.0,2062408.0,0.0,1685248.0,170668119.0,2304.0,180548187.0,26658996224.0
159,64,7168,256,256,8,ActivationType.Gelu,torch.bfloat16,torch.float8_e4m3fnuz,torch.float8_e4m3fnuz,QuantType.per_Tensor,1,1,ck,stage2,16,moe_ck2stages_gemm2_256x16x128x256_1x4_MulABScaleExpertWeight_v1_Nswizzle0_Quant1_MulRoutedWeight0_F8_F8_B16,118.733,31.30600000000005,0.00%,47.48,11880.96,407992.375,14336.0,5.128805,55602126.0,0.0,0.0,26034176.0,13017088.0,105364.0,3493347.0,6020629.0,45388802.0,1826860.0,1.491935,70.814534,0.689249946,572712.0,813568.0,5698112.0,1052912.0,4564112.0,281956151.0,64512.0,399810925.0,13329498112.0
160,64,7168,256,256,8,ActivationType.Gelu,torch.bfloat16,torch.float8_e4m3fnuz,torch.float8_e4m3fnuz,QuantType.per_Token,1,0,asm,asm_1stage,32,_ZN5aiter45fmoe_bf16_pertokenFp8_g1u1_vs_gelu_1tg_32x256E,345.5462,0.0,0.00%,16.31,4082.41,1233087.75,7680.0,10.789014,125729978.0,0.0,0.0,156205056.0,78102528.0,160159.0,9990246.0,15306697.0,102764011.0,4651873.0,0.0,8.795888,0.106087929,901644.0,4881408.0,10839688.0,0.0,3562992.0,39134183.0,1088.0,124853137.0,79976988672.0
161,64,7168,256,256,8,ActivationType.Gelu,torch.bfloat16,torch.float8_e4m3fnuz,torch.float8_e4m3fnuz,QuantType.per_Token,1,1,asm,asm_1stage,32,_ZN5aiter53fmoe_bf16_pertokenFp8_g1u1_vs_tkw1_gelu_1tg_ps_32x256E,347.8732,0.0,0.00%,16.2,4055.11,1232846.875,7168.0,10.644894,126974344.0,0.0,0.0,156205056.0,78102528.0,162671.0,9977432.0,16611538.0,101937265.0,4628094.0,0.0,8.682736,0.0867152141,858060.0,4881408.0,10121732.0,0.0,3446768.0,32135737.0,1216.0,122754147.0,79976988672.0
162,64,7168,256,256,8,ActivationType.Silu,torch.bfloat16,torch.bfloat16,torch.bfloat16,QuantType.No,1,0,ck,stage1,32,moe_ck2stages_gemm1_256x32x64x64_1x4_TypeCast_v1_Nswizzle0_Quant0_MulRoutedWeight0_silu_B16_B16_B16,430.8532,0.0,0.00%,13.08,6546.1,1636214.5,256.0,11.342308,218732869.0,104136704.0,0.0,0.0,104136704.0,177154.0,13090381.0,18814269.0,184182200.0,5802908.0,0.0524465288,35.743592,0.000788791749,2055712.0,6508544.0,8695008.0,116224.0,16503808.0,461910931.0,4352.0,633675994.0,53317992448.0
162,64,7168,256,256,8,ActivationType.Silu,torch.bfloat16,torch.bfloat16,torch.bfloat16,QuantType.No,1,0,ck,stage2,32,moe_ck2stages_gemm2_256x32x64x64_1x4_TypeCastExpertWeight_v1_Nswizzle0_Quant0_MulRoutedWeight1_B16_B16_B16,232.8963,0.0,1.30%,24.2,12110.14,816286.125,7168.0,10.912146,109485966.0,52068352.0,0.0,0.0,52068352.0,303286.0,6645054.0,13554943.0,83407114.0,3033666.0,1.398309,83.149919,0.26230119,2669520.0,3254272.0,14171920.0,1627136.0,20847680.0,638091769.0,121856.0,774055976.0,26658996224.0
163,64,7168,256,256,8,ActivationType.Silu,torch.bfloat16,torch.bfloat16,torch.bfloat16,QuantType.No,1,1,ck,stage1,32,moe_ck2stages_gemm1_256x32x64x64_1x4_TypeCastExpertWeight_v1_Nswizzle0_Quant0_MulRoutedWeight1_silu_B16_B16_B16,431.5715,0.0,0.00%,13.06,6535.2,1636211.125,256.0,11.379686,218411457.0,104136704.0,0.0,0.0,104136704.0,178712.0,13091516.0,20570276.0,183756454.0,5873711.0,0.051814207,35.574131,0.00072845896,2055712.0,6508544.0,8749488.0,116224.0,16503808.0,465073561.0,4352.0,638368209.0,53317992448.0
163,64,7168,256,256,8,ActivationType.Silu,torch.bfloat16,torch.bfloat16,torch.bfloat16,QuantType.No,1,1,ck,stage2,32,moe_ck2stages_gemm2_256x32x64x128_1x4_TypeCast_v1_Nswizzle0_Quant0_MulRoutedWeight0_B16_B16_B16,223.2042,0.0,0.00%,25.26,12636.0,815915.6875,7168.0,10.86174,112780353.0,52068352.0,0.0,0.0,52068352.0,291755.0,6642096.0,11536802.0,88570739.0,3435509.0,1.233541,60.743727,0.4200929,2669520.0,3254272.0,13968528.0,1627136.0,20847680.0,498336856.0,121856.0,641005359.0,26658996224.0
164,64,7168,256,256,8,ActivationType.Silu,torch.bfloat16,torch.float8_e4m3fnuz,torch.float8_e4m3fnuz,QuantType.per_Tensor,1,0,asm,stage1,16,_ZN5aiter48fmoe_stage1_bf16_pertokenFp8_g1u1_16x128_4tg_pf2E,213.2261,29.930444444444472,0.00%,26.44,6615.81,817567.375,256.0,4.84313,123734534.0,0.0,0.0,52068352.0,26034176.0,99832.0,6542619.0,12167613.0,107981106.0,3387135.0,0.0,17.308307,0.000916306204,217920.0,1627136.0,2038800.0,0.0,1685248.0,169548001.0,2304.0,179447564.0,26658996224.0
164,64,7168,256,256,8,ActivationType.Silu,torch.bfloat16,torch.float8_e4m3fnuz,torch.float8_e4m3fnuz,QuantType.per_Tensor,1,0,ck,stage2,16,moe_ck2stages_gemm2_256x16x128x256_1x4_MulABScaleExpertWeight_v1_Nswizzle0_Quant1_MulRoutedWeight1_F8_F8_B16,121.7975,29.930444444444472,1.24%,46.28,11582.03,408109.625,14336.0,5.256232,52710753.0,0.0,0.0,26034176.0,13017088.0,117950.0,3494278.0,4629580.0,41705449.0,1542438.0,1.775275,73.808215,0.67073663,572712.0,813568.0,6104896.0,1052912.0,4564112.0,240186800.0,64512.0,350203989.0,13329498112.0
165,64,7168,256,256,8,ActivationType.Silu,torch.bfloat16,torch.float8_e4m3fnuz,torch.float8_e4m3fnuz,QuantType.per_Tensor,1,1,ck,stage1,16,moe_ck2stages_gemm1_256x16x128x256_1x4_MulABScale_v1_Nswizzle0_Quant1_MulRoutedWeight1_silu_F8_F8_B16,212.0557,31.09277777777776,0.00%,26.58,6652.32,819163.125,256.0,4.981812,103852300.0,0.0,0.0,52068352.0,26034176.0,41855.0,6555500.0,8680505.0,87866525.0,3449016.0,3.6103,14.810725,0.00782378223,461264.0,1627136.0,2522424.0,4765184.0,6857216.0,50584746.0,2304.0,156387744.0,26658996224.0
165,64,7168,256,256,8,ActivationType.Silu,torch.bfloat16,torch.float8_e4m3fnuz,torch.float8_e4m3fnuz,QuantType.per_Tensor,1,1,ck,stage2,16,moe_ck2stages_gemm2_256x16x128x256_1x4_MulABScaleExpertWeight_v1_Nswizzle0_Quant1_MulRoutedWeight0_F8_F8_B16,121.9475,31.09277777777776,0.00%,46.23,11567.78,407993.625,14336.0,5.240972,54683181.0,0.0,0.0,26034176.0,13017088.0,105322.0,3493351.0,6284305.0,44619657.0,1613811.0,1.697874,74.036913,0.690023996,572712.0,813568.0,5698112.0,1052912.0,4564112.0,259497706.0,64512.0,367303451.0,13329498112.0
166,64,7168,256,256,8,ActivationType.Silu,torch.bfloat16,torch.float8_e4m3fnuz,torch.float8_e4m3fnuz,QuantType.per_Token,1,0,asm,asm_1stage,32,_ZN5aiter45fmoe_bf16_pertokenFp8_g1u1_vs_silu_1tg_32x256E,346.2396,0.0,0.00%,16.28,4074.24,1233250.3125,7680.0,10.732693,127041341.0,0.0,0.0,156205056.0,78102528.0,160057.0,9990079.0,15425882.0,103982732.0,4691400.0,0.0,8.696473,0.096829806,901644.0,4881408.0,10752520.0,0.0,3562992.0,38946037.0,1088.0,124657902.0,79976988672.0
167,64,7168,256,256,8,ActivationType.Silu,torch.bfloat16,torch.float8_e4m3fnuz,torch.float8_e4m3fnuz,QuantType.per_Token,1,1,asm,asm_1stage,32,_ZN5aiter50fmoe_bf16_pertokenFp8_g1u1_vs_tkw1_silu_1tg_32x256E,348.7617,0.0,0.00%,16.16,4044.77,1233234.1875,7168.0,10.96493,123622735.0,0.0,0.0,156205056.0,78102528.0,158346.0,9979998.0,14056242.0,99145035.0,4630284.0,0.0,8.657529,0.0910325994,858060.0,4881408.0,9968008.0,0.0,3446768.0,31394628.0,1088.0,122606434.0,79976988672.0
168,64,7168,256,256,8,ActivationType.Gelu,torch.bfloat16,torch.float8_e4m3fnuz,torch.float8_e4m3fnuz,QuantType.per_1x128,1,0,asm,asm_1stage,32,_ZN5aiter47fmoe_bf16_blockscaleFp8_g1u1_vs_gelu_1tg_32x128E,355.8495,0.0,2.00%,15.84,3964.21,1226306.5,14336.0,11.36723,133202073.0,0.0,0.0,156205056.0,78102528.0,260151.0,10040376.0,10396297.0,104482050.0,4420087.0,0.0,9.678452,0.0543892306,1904984.0,4881408.0,15995296.0,0.0,7242208.0,90953366.0,2176.0,130845129.0,79976988672.0
169,64,7168,256,256,8,ActivationType.Gelu,torch.bfloat16,torch.float8_e4m3fnuz,torch.float8_e4m3fnuz,QuantType.per_1x128,1,1,ck,stage1,16,moe_ck2stages_gemm1_256x16x128x256_1x4_MulABScaleExpertWeightA8W8blkscale_v1_Nswizzle0_Quant4_MulRoutedWeight1_gelu_F8_F8_B16,209.1378,28.714222222222304,0.02%,26.95,6745.13,820955.75,256.0,4.868006,107320101.0,0.0,0.0,52068352.0,26034176.0,84011.0,6569567.0,10575506.0,88790248.0,3458993.0,3.744851,15.27619,0.00993922381,457632.0,1627136.0,3363232.0,4939520.0,7031552.0,63276127.0,2304.0,161196369.0,26658996224.0
169,64,7168,256,256,8,ActivationType.Gelu,torch.bfloat16,torch.float8_e4m3fnuz,torch.float8_e4m3fnuz,QuantType.per_1x128,1,1,ck,stage2,16,moe_ck2stages_gemm2_256x16x128x256_1x4_MulABScaleExpertWeightA8W8blkscale_v1_Nswizzle0_Quant4_MulRoutedWeight0_F8_F8_B16,118.871,28.714222222222304,16.67%,47.42,11867.17,408865.875,7168.0,5.008277,56556074.0,0.0,0.0,26034176.0,13017088.0,143336.0,3385661.0,4790689.0,44375504.0,1717248.0,13.403168,69.394796,0.482557584,471016.0,813568.0,5981640.0,8949248.0,12460448.0,200424819.0,64512.0,370677286.0,13329498112.0
170,64,7168,256,256,8,ActivationType.Silu,torch.bfloat16,torch.float8_e4m3fnuz,torch.float8_e4m3fnuz,QuantType.per_1x128,1,1,ck,stage1,16,moe_ck2stages_gemm1_256x16x128x256_1x4_MulABScaleExpertWeightA8W8blkscale_v1_Nswizzle0_Quant4_MulRoutedWeight1_silu_F8_F8_B16,209.1384,29.342000000000034,0.02%,26.95,6745.11,820930.25,256.0,4.903034,108164934.0,0.0,0.0,52068352.0,26034176.0,80464.0,6569444.0,11076720.0,89474868.0,3464352.0,3.710261,15.041052,0.0112103591,457632.0,1627136.0,3495800.0,4939520.0,7031552.0,62916960.0,2304.0,160194819.0,26658996224.0
170,64,7168,256,256,8,ActivationType.Silu,torch.bfloat16,torch.float8_e4m3fnuz,torch.float8_e4m3fnuz,QuantType.per_1x128,1,1,ck,stage2,16,moe_ck2stages_gemm2_256x16x128x256_1x4_MulABScaleExpertWeightA8W8blkscale_v1_Nswizzle0_Quant4_MulRoutedWeight0_F8_F8_B16,120.1361,29.342000000000034,16.65%,46.92,11742.2,408866.0,7168.0,5.211705,55170247.0,0.0,0.0,26034176.0,13017088.0,144568.0,3385636.0,4975472.0,42988794.0,1717836.0,13.505549,70.887466,0.559346499,471016.0,813568.0,5981640.0,8949248.0,12460448.0,203370713.0,64512.0,375780059.0,13329498112.0
171,64,7168,256,256,8,ActivationType.Silu,torch.bfloat16,torch.float8_e4m3fnuz,torch.float8_e4m3fnuz,QuantType.per_1x128,1,0,asm,asm_1stage,32,_ZN5aiter47fmoe_bf16_blockscaleFp8_g1u1_vs_silu_1tg_32x128E,356.4175,0.0,0.00%,15.82,3957.89,1226421.25,14336.0,11.272388,132791358.0,0.0,0.0,156205056.0,78102528.0,258746.0,10040503.0,10410481.0,103813633.0,4535668.0,0.0,9.523738,0.0452068286,1904984.0,4881408.0,15908128.0,0.0,7242208.0,92505870.0,2176.0,132282437.0,79976988672.0
172,64,7168,256,257,9,ActivationType.Silu,torch.bfloat16,torch.float8_e4m3fnuz,torch.float8_e4m3fnuz,QuantType.per_Token,1,0,asm,asm_1stage,32,_ZN5aiter45fmoe_bf16_pertokenFp8_g1u1_vs_silu_1tg_32x256E,352.6816,0.0,0.00%,17.98,4015.43,1245687.0,8640.0,10.631115,129939629.0,0.0,0.0,157581312.0,78790656.0,156976.0,10100639.0,15070018.0,106922934.0,4816077.0,0.0,8.736649,0.137281577,909588.0,4924416.0,10847280.0,0.0,3594384.0,40336145.0,1100.0,128989086.0,80681631744.0
173,64,7168,256,257,9,ActivationType.Silu,torch.bfloat16,torch.float8_e4m3fnuz,torch.float8_e4m3fnuz,QuantType.per_1x128,1,0,asm,asm_1stage,32,_ZN5aiter47fmoe_bf16_blockscaleFp8_g1u1_vs_silu_1tg_32x128E,360.0101,0.0,0.00%,17.62,3933.69,1237526.625,16128.0,11.578114,133732281.0,0.0,0.0,157581312.0,78790656.0,267085.0,10157743.0,11531290.0,104630155.0,4471204.0,0.0,9.657037,0.0704500439,1921768.0,4924416.0,16048336.0,0.0,7306016.0,91823949.0,2200.0,131972751.0,80681631744.0
174,64,7168,512,256,8,ActivationType.Gelu,torch.bfloat16,torch.bfloat16,torch.bfloat16,QuantType.No,1,0,ck,stage1,32,moe_ck2stages_gemm1_256x32x64x128_1x4_TypeCast_v1_Nswizzle0_Quant0_MulRoutedWeight0_gelu_B16_B16_B16,858.2452,0.0,0.00%,13.14,6570.36,3219340.9375,512.0,12.37377,391386450.0,203685888.0,0.0,0.0,203685888.0,197281.0,25759738.0,31146975.0,325247531.0,10611844.0,0.0561097685,32.646016,0.0105024401,4020864.0,12730368.0,17147296.0,227328.0,32280576.0,332824768.0,8704.0,1058119295.0,104287174656.0
174,64,7168,512,256,8,ActivationType.Gelu,torch.bfloat16,torch.bfloat16,torch.bfloat16,QuantType.No,1,0,ck,stage2,32,moe_ck2stages_gemm2_256x32x64x128_1x4_TypeCastExpertWeight_v1_Nswizzle0_Quant0_MulRoutedWeight1_B16_B16_B16,449.4735,0.0,3.37%,25.08,12545.74,1596089.6875,7168.0,12.699343,188834727.0,101842944.0,0.0,0.0,101842944.0,530511.0,12883486.0,16061005.0,142687759.0,5501250.0,0.755527151,53.006728,0.230859871,4599840.0,6365184.0,21644448.0,1591296.0,36301440.0,662634232.0,121856.0,893144809.0,52143587328.0
175,64,7168,512,256,8,ActivationType.Gelu,torch.bfloat16,torch.bfloat16,torch.bfloat16,QuantType.No,1,1,ck,stage1,32,moe_ck2stages_gemm1_256x32x64x128_1x4_TypeCastExpertWeight_v1_Nswizzle0_Quant0_MulRoutedWeight1_gelu_B16_B16_B16,857.7965,0.0,0.00%,13.14,6573.8,3219717.5625,512.0,12.688425,382631700.0,203685888.0,0.0,0.0,203685888.0,202333.0,25757826.0,28330121.0,316551855.0,10434001.0,0.0571123325,32.750957,0.0180006049,4020864.0,12730368.0,17042496.0,227328.0,32280576.0,337374191.0,8704.0,1042886438.0,104287174656.0
175,64,7168,512,256,8,ActivationType.Gelu,torch.bfloat16,torch.bfloat16,torch.bfloat16,QuantType.No,1,1,ck,stage2,32,moe_ck2stages_gemm2_256x32x64x64_1x4_TypeCast_v1_Nswizzle0_Quant0_MulRoutedWeight0_B16_B16_B16,448.853,0.0,0.00%,25.12,12563.09,1595980.0,7168.0,11.629341,208767883.0,101842944.0,0.0,0.0,101842944.0,498527.0,12882943.0,23148721.0,167147962.0,5780973.0,0.720967426,82.636892,0.284634016,4599840.0,6365184.0,16970016.0,1591296.0,36301440.0,1099805357.0,121856.0,1459147821.0,52143587328.0
176,64,7168,512,256,8,ActivationType.Gelu,torch.bfloat16,torch.float8_e4m3fnuz,torch.float8_e4m3fnuz,QuantType.per_Tensor,1,0,asm,stage1,16,_ZN5aiter48fmoe_stage1_bf16_pertokenFp8_g1u1_16x512_2tg_pf2E,420.4049,32.4943333333333,0.00%,26.82,6707.7,1596247.5625,512.0,7.00387,125431493.0,0.0,0.0,101842944.0,50921472.0,154556.0,12774366.0,12420334.0,97181690.0,5024552.0,0.0,8.658119,0.00068704566,122544.0,3182592.0,3730464.0,0.0,866688.0,91185565.0,1152.0,133127060.0,52143587328.0
176,64,7168,512,256,8,ActivationType.Gelu,torch.bfloat16,torch.float8_e4m3fnuz,torch.float8_e4m3fnuz,QuantType.per_Tensor,1,0,ck,stage2,16,moe_ck2stages_gemm2_256x16x128x256_1x4_MulABScaleExpertWeight_v1_Nswizzle0_Quant1_MulRoutedWeight1_F8_F8_B16,229.6735,32.4943333333333,3.34%,49.09,12278.08,798058.5,14336.0,5.259152,110449667.0,0.0,0.0,50921472.0,25460736.0,182032.0,6613921.0,9754367.0,92341654.0,3284514.0,0.800155012,69.794029,0.6017188,808640.0,1591296.0,6863360.0,1030064.0,6452656.0,413072554.0,64512.0,718783891.0,26071793664.0
177,64,7168,512,256,8,ActivationType.Gelu,torch.bfloat16,torch.float8_e4m3fnuz,torch.float8_e4m3fnuz,QuantType.per_Tensor,1,1,asm,stage1,16,_ZN5aiter53fmoe_stage1_bf16_pertokenFp8_doweight_g1u1_16x512_pf3E,419.6457,31.430777777777863,0.00%,26.87,6719.83,1597902.9375,512.0,6.711975,130607881.0,0.0,0.0,101842944.0,50921472.0,272812.0,12783576.0,10092872.0,102339331.0,4544912.0,0.0,8.705768,0.000732488923,122544.0,3182592.0,3733128.0,0.0,866688.0,5004802.0,1152.0,121038742.0,52143587328.0
177,64,7168,512,256,8,ActivationType.Gelu,torch.bfloat16,torch.float8_e4m3fnuz,torch.float8_e4m3fnuz,QuantType.per_Tensor,1,1,ck,stage2,16,moe_ck2stages_gemm2_256x16x128x256_1x4_MulABScaleExpertWeight_v1_Nswizzle0_Quant1_MulRoutedWeight0_F8_F8_B16,225.2442,31.430777777777863,0.00%,50.05,12519.52,797949.125,14336.0,4.710771,125962741.0,0.0,0.0,50921472.0,25460736.0,167691.0,6613132.0,12944984.0,108516343.0,3438865.0,0.783682403,71.672814,0.629018595,808640.0,1591296.0,6465536.0,1030064.0,6452656.0,434883167.0,64512.0,753648014.0,26071793664.0
178,64,7168,512,256,8,ActivationType.Gelu,torch.bfloat16,torch.float8_e4m3fnuz,torch.float8_e4m3fnuz,QuantType.per_Token,1,0,asm,asm_1stage,32,_ZN5aiter48fmoe_bf16_pertokenFp8_g1u1_vs_gelu_1tg_ps_32x512E,666.0564,0.0,0.00%,16.93,4233.8,2425313.6875,7168.0,14.433602,184066408.0,0.0,0.0,305528832.0,152764416.0,95572.0,19517114.0,20474176.0,139873987.0,9136061.0,0.0,8.730551,0.0453246266,860472.0,9547776.0,15899400.0,0.0,3441888.0,8546210.0,1216.0,244198556.0,156430761984.0
179,64,7168,512,256,8,ActivationType.Gelu,torch.bfloat16,torch.float8_e4m3fnuz,torch.float8_e4m3fnuz,QuantType.per_Token,1,1,asm,asm_1stage,32,_ZN5aiter50fmoe_bf16_pertokenFp8_g1u1_vs_tkw1_gelu_1tg_32x512E,657.4226,0.0,0.00%,17.15,4289.4,2425299.625,7168.0,14.155115,189257535.0,0.0,0.0,305528832.0,152764416.0,97069.0,19517383.0,19415882.0,145610899.0,9084426.0,0.0,8.765016,0.0520001017,860472.0,9547776.0,15151280.0,0.0,3441888.0,8439561.0,1088.0,243038585.0,156430761984.0
180,64,7168,512,256,8,ActivationType.Silu,torch.bfloat16,torch.bfloat16,torch.bfloat16,QuantType.No,1,1,ck,stage1,32,moe_ck2stages_gemm1_256x32x64x128_1x4_TypeCastExpertWeight_v1_Nswizzle0_Quant0_MulRoutedWeight1_silu_B16_B16_B16,858.3284,0.0,0.00%,13.14,6569.72,3219513.9375,512.0,12.678619,383524282.0,203685888.0,0.0,0.0,203685888.0,193719.0,25762444.0,27670017.0,317446300.0,10471746.0,0.0568317613,32.789489,0.0117419507,4020864.0,12730368.0,17561088.0,227328.0,32280576.0,335152111.0,8704.0,1049268059.0,104287174656.0
180,64,7168,512,256,8,ActivationType.Silu,torch.bfloat16,torch.bfloat16,torch.bfloat16,QuantType.No,1,1,ck,stage2,32,moe_ck2stages_gemm2_256x32x64x128_1x4_TypeCast_v1_Nswizzle0_Quant0_MulRoutedWeight0_B16_B16_B16,448.0509,0.0,0.00%,25.16,12585.58,1595855.25,7168.0,12.392234,195174830.0,101842944.0,0.0,0.0,101842944.0,506961.0,12881683.0,16802499.0,152170327.0,5459985.0,0.763004881,50.955073,0.274915238,4599840.0,6365184.0,20550432.0,1591296.0,36301440.0,598997796.0,121856.0,850160780.0,52143587328.0
181,64,7168,512,256,8,ActivationType.Silu,torch.bfloat16,torch.float8_e4m3fnuz,torch.float8_e4m3fnuz,QuantType.per_Tensor,1,0,ck,stage1,16,moe_ck2stages_gemm1_256x16x128x256_1x4_MulABScale_v1_Nswizzle0_Quant1_MulRoutedWeight0_silu_F8_F8_B16,421.222,32.68133333333329,0.00%,26.77,6694.68,1600324.5,512.0,6.962947,171731961.0,0.0,0.0,101842944.0,50921472.0,79107.0,12807287.0,12395096.0,142268273.0,4920700.0,4.958078,26.326354,0.0135840562,902208.0,3182592.0,4873344.0,9320448.0,13412352.0,83940937.0,4608.0,395916957.0,52143587328.0
181,64,7168,512,256,8,ActivationType.Silu,torch.bfloat16,torch.float8_e4m3fnuz,torch.float8_e4m3fnuz,QuantType.per_Tensor,1,0,ck,stage2,16,moe_ck2stages_gemm2_256x16x128x256_1x4_MulABScaleExpertWeight_v1_Nswizzle0_Quant1_MulRoutedWeight1_F8_F8_B16,224.2761,32.68133333333329,2.87%,50.27,12573.56,798058.75,14336.0,4.756941,125066071.0,0.0,0.0,50921472.0,25460736.0,182254.0,6613924.0,11455519.0,106799316.0,3380401.0,0.790326877,71.800317,0.627274159,808640.0,1591296.0,6863360.0,1030064.0,6452656.0,423186188.0,64512.0,748641343.0,26071793664.0
182,64,7168,512,256,8,ActivationType.Silu,torch.bfloat16,torch.float8_e4m3fnuz,torch.float8_e4m3fnuz,QuantType.per_Tensor,1,1,ck,stage1,16,moe_ck2stages_gemm1_256x16x128x256_1x4_MulABScale_v1_Nswizzle0_Quant1_MulRoutedWeight1_silu_F8_F8_B16,420.6856,32.24111111111115,0.00%,26.8,6703.22,1600510.25,512.0,7.346691,162310685.0,0.0,0.0,101842944.0,50921472.0,79305.0,12808350.0,12393452.0,132613128.0,4737741.0,5.147895,26.573361,0.0142825121,902208.0,3182592.0,4933728.0,9320448.0,13412352.0,80292325.0,4608.0,384896184.0,52143587328.0
182,64,7168,512,256,8,ActivationType.Silu,torch.bfloat16,torch.float8_e4m3fnuz,torch.float8_e4m3fnuz,QuantType.per_Tensor,1,1,ck,stage2,16,moe_ck2stages_gemm2_256x16x128x256_1x4_MulABScaleExpertWeight_v1_Nswizzle0_Quant1_MulRoutedWeight0_F8_F8_B16,220.2999,32.24111111111115,0.00%,51.18,12800.5,797958.375,14336.0,5.34961,109182026.0,0.0,0.0,50921472.0,25460736.0,167782.0,6613136.0,9411361.0,91919740.0,2761257.0,0.962339475,69.47593,0.662104477,808640.0,1591296.0,6465536.0,1030064.0,6452656.0,341574447.0,64512.0,594922326.0,26071793664.0
183,64,7168,512,256,8,ActivationType.Silu,torch.bfloat16,torch.float8_e4m3fnuz,torch.float8_e4m3fnuz,QuantType.per_Token,1,0,asm,asm_1stage,32,_ZN5aiter45fmoe_bf16_pertokenFp8_g1u1_vs_silu_1tg_32x512E,664.038,0.0,0.00%,16.98,4246.67,2425309.75,7680.0,12.864313,207140323.0,0.0,0.0,305528832.0,152764416.0,95886.0,19525465.0,25041314.0,165159526.0,9374695.0,0.0,8.751601,0.0628234965,903096.0,9547776.0,15691184.0,0.0,3555552.0,8495826.0,1088.0,251042453.0,156430761984.0
184,64,7168,512,256,8,ActivationType.Silu,torch.bfloat16,torch.float8_e4m3fnuz,torch.float8_e4m3fnuz,QuantType.per_Token,1,1,asm,asm_1stage,32,_ZN5aiter53fmoe_bf16_pertokenFp8_g1u1_vs_tkw1_silu_1tg_ps_32x512E,664.8533,0.0,0.00%,16.96,4241.46,2425315.0625,7168.0,14.223097,188604199.0,0.0,0.0,305528832.0,152764416.0,96491.0,19517241.0,19271137.0,144360350.0,8041531.0,0.0,8.736381,0.0523687731,860472.0,9547776.0,15046920.0,0.0,3441888.0,7992282.0,1216.0,214700134.0,156430761984.0
185,64,7168,512,256,8,ActivationType.Silu,torch.bfloat16,torch.bfloat16,torch.bfloat16,QuantType.No,1,0,ck,stage1,32,moe_ck2stages_gemm1_256x32x64x128_1x4_TypeCast_v1_Nswizzle0_Quant0_MulRoutedWeight0_silu_B16_B16_B16,857.7476,0.0,0.00%,13.14,6574.17,3219733.1875,512.0,12.532647,386885647.0,203685888.0,0.0,0.0,203685888.0,194802.0,25759028.0,29579587.0,321043594.0,10488124.0,0.0567770035,32.76119,0.0113272779,4020864.0,12730368.0,17454528.0,227328.0,32280576.0,329496626.0,8704.0,1049373559.0,104287174656.0
185,64,7168,512,256,8,ActivationType.Silu,torch.bfloat16,torch.bfloat16,torch.bfloat16,QuantType.No,1,0,ck,stage2,32,moe_ck2stages_gemm2_256x32x64x128_1x4_TypeCastExpertWeight_v1_Nswizzle0_Quant0_MulRoutedWeight1_B16_B16_B16,450.7521,0.0,2.83%,25.01,12510.16,1596095.4375,7168.0,12.277983,196328586.0,101842944.0,0.0,0.0,101842944.0,530322.0,12883529.0,14884470.0,150187607.0,5342796.0,0.780217544,53.695736,0.194825169,4599840.0,6365184.0,21644448.0,1591296.0,36301440.0,647178965.0,121856.0,876122924.0,52143587328.0
186,64,7168,512,256,8,ActivationType.Gelu,torch.bfloat16,torch.float8_e4m3fnuz,torch.float8_e4m3fnuz,QuantType.per_1x128,1,0,asm,stage1,16,_ZN5aiter59fmoe_stage1_bf16_pertokenFp8_blockscale_g1u1_16x512_2tg_pf2E,416.6384,32.409111111111166,15.04%,27.06,6768.34,1598437.375,271.6875,5.117027,174022224.0,0.0,0.0,101842944.0,50921472.0,296799.0,12790225.0,13961090.0,142866372.0,6477427.0,0.0,8.68453,0.000172587942,175824.0,3182592.0,7475382.0,0.0,959040.0,114413086.0,1152.0,172092511.0,52143587328.0
186,64,7168,512,256,8,ActivationType.Gelu,torch.bfloat16,torch.float8_e4m3fnuz,torch.float8_e4m3fnuz,QuantType.per_1x128,1,0,ck,stage2,16,moe_ck2stages_gemm2_256x16x128x256_1x4_MulABScaleExpertWeightA8W8blkscale_v1_Nswizzle0_Quant4_MulRoutedWeight1_F8_F8_B16,228.291,32.409111111111166,15.60%,49.39,12352.43,799866.8125,7168.0,5.707647,101790348.0,0.0,0.0,50921472.0,25460736.0,197090.0,6513680.0,9686668.0,80266078.0,2840086.0,7.753162,47.642326,0.305219602,709184.0,1591296.0,7699888.0,8752128.0,14174720.0,236486212.0,64512.0,430246885.0,26071793664.0
187,64,7168,512,256,8,ActivationType.Silu,torch.bfloat16,torch.float8_e4m3fnuz,torch.float8_e4m3fnuz,QuantType.per_1x128,1,0,asm,stage1,16,_ZN5aiter55fmoe_stage1_bf16_pertokenFp8_blockscale_g1u1_16x512_pf3E,415.8564,33.922222222222324,14.79%,27.11,6781.06,1599535.4375,271.53125,4.92524,180632731.0,0.0,0.0,101842944.0,50921472.0,433536.0,12797017.0,16382740.0,149113768.0,6402026.0,0.0,8.758974,0.000136300138,175824.0,3182592.0,7196550.0,0.0,959040.0,5924195.0,1152.0,170937992.0,52143587328.0
187,64,7168,512,256,8,ActivationType.Silu,torch.bfloat16,torch.float8_e4m3fnuz,torch.float8_e4m3fnuz,QuantType.per_1x128,1,0,ck,stage2,16,moe_ck2stages_gemm2_256x16x128x256_1x4_MulABScaleExpertWeightA8W8blkscale_v1_Nswizzle0_Quant4_MulRoutedWeight1_F8_F8_B16,225.1206,33.922222222222324,15.61%,50.08,12526.39,799865.3125,7168.0,4.905468,122768487.0,0.0,0.0,50921472.0,25460736.0,197089.0,6513690.0,10487875.0,101109814.0,2908504.0,7.58697,48.335473,0.348821696,709184.0,1591296.0,7699888.0,8752128.0,14174720.0,245953231.0,64512.0,446068208.0,26071793664.0
188,64,7168,512,256,8,ActivationType.Gelu,torch.bfloat16,torch.float8_e4m3fnuz,torch.float8_e4m3fnuz,QuantType.per_1x128,1,1,ck,stage1,16,moe_ck2stages_gemm1_256x16x128x256_1x4_MulABScaleExpertWeightA8W8blkscale_v1_Nswizzle0_Quant4_MulRoutedWeight1_gelu_F8_F8_B16,428.2715,32.53322222222235,0.01%,26.33,6584.49,1605188.875,512.0,7.246636,163758275.0,0.0,0.0,101842944.0,50921472.0,160081.0,12845589.0,12717910.0,129363443.0,4891470.0,5.172916,27.504512,0.0184740891,895104.0,3182592.0,6578304.0,9661440.0,13753344.0,103959799.0,4608.0,410960749.0,52143587328.0
188,64,7168,512,256,8,ActivationType.Gelu,torch.bfloat16,torch.float8_e4m3fnuz,torch.float8_e4m3fnuz,QuantType.per_1x128,1,1,ck,stage2,16,moe_ck2stages_gemm2_256x16x128x256_1x4_MulABScaleExpertWeightA8W8blkscale_v1_Nswizzle0_Quant4_MulRoutedWeight0_F8_F8_B16,228.1536,32.53322222222235,16.73%,49.42,12359.87,799749.5,7168.0,4.840755,123239567.0,0.0,0.0,50921472.0,25460736.0,185471.0,6512771.0,11027517.0,102253692.0,3367693.0,6.775703,48.767909,0.37601583,709184.0,1591296.0,7302064.0,8752128.0,14174720.0,278943140.0,64512.0,503945314.0,26071793664.0
189,64,7168,512,256,8,ActivationType.Silu,torch.bfloat16,torch.float8_e4m3fnuz,torch.float8_e4m3fnuz,QuantType.per_1x128,1,1,ck,stage1,16,moe_ck2stages_gemm1_256x16x128x256_1x4_MulABScaleExpertWeightA8W8blkscale_v1_Nswizzle0_Quant4_MulRoutedWeight1_silu_F8_F8_B16,425.0146,31.9462222222222,0.01%,26.53,6634.95,1605173.5,512.0,7.041664,169565035.0,0.0,0.0,101842944.0,50921472.0,156668.0,12843954.0,14393131.0,134998069.0,4868772.0,5.173059,27.095514,0.0306926592,895104.0,3182592.0,6837600.0,9661440.0,13753344.0,103283690.0,4608.0,404838472.0,52143587328.0
189,64,7168,512,256,8,ActivationType.Silu,torch.bfloat16,torch.float8_e4m3fnuz,torch.float8_e4m3fnuz,QuantType.per_1x128,1,1,ck,stage2,16,moe_ck2stages_gemm2_128x16x128x128_1x2_MulABScaleExpertWeightA8W8blkscale_v1_Nswizzle0_Quant4_MulRoutedWeight0_F8_F8_B16,223.4573,31.9462222222222,16.73%,50.45,12619.63,800833.625,7168.0,4.625447,126253386.0,0.0,0.0,50921472.0,25460736.0,284053.0,6521710.0,13302498.0,107391717.0,3401987.0,7.038023,38.676674,0.370361926,658896.0,1591296.0,6853840.0,9149952.0,13078464.0,225974325.0,32256.0,402260380.0,26071793664.0
190,64,7168,2048,33,10,ActivationType.Silu,torch.bfloat16,torch.float8_e4m3fnuz,torch.float8_e4m3fnuz,QuantType.per_1x128,1,0,asm,asm_1stage,32,_ZN5aiter50fmoe_bf16_blockscaleFp8_g1u1_vs_silu_1tg_ps_32x256E,449.4438,0.0,0.00%,125.42,3236.67,1435516.125,76800.0,13.372498,135771490.0,0.0,0.0,181665792.0,90832896.0,448054.0,12716606.0,12168695.0,106636616.0,4490882.0,0.0,9.987002,0.228753665,1189056.0,5677056.0,14553024.0,0.0,4460544.0,41366095.0,1216.0,137197338.0,93012885504.0
191,64,7168,2048,33,10,ActivationType.Silu,torch.bfloat16,torch.float8_e4m3fnuz,torch.float8_e4m3fnuz,QuantType.per_Token,1,0,asm,asm_1stage,32,_ZN5aiter45fmoe_bf16_pertokenFp8_g1u1_vs_silu_1tg_32x512E,407.2594,0.0,0.00%,138.42,3571.93,1435853.25,38400.0,12.504349,73348827.0,0.0,0.0,181665792.0,90832896.0,242419.0,12101449.0,7619839.0,47499260.0,4953054.0,0.0,5.023722,0.0745198789,536976.0,5677056.0,9331904.0,0.0,2114112.0,4282291.0,848.0,76125016.0,93012885504.0
192,128,2048,192,128,8,ActivationType.Silu,torch.bfloat16,torch.bfloat16,torch.bfloat16,QuantType.No,1,0,ck,stage1,32,moe_ck2stages_gemm1_256x32x64x64_1x4_TypeCast_v1_Nswizzle0_Quant0_MulRoutedWeight0_silu_B16_B16_B16,57.8739,0.0,0.00%,41.74,5236.19,201443.625,384.0,4.853059,52752364.0,12582912.0,0.0,0.0,12582912.0,76952.0,1614909.0,11181870.0,46876179.0,1674271.0,0.0759127132,12.904611,0.000660251565,254976.0,786432.0,1403904.0,49152.0,2064384.0,62698489.0,1920.0,66843869.0,6442450944.0
192,128,2048,192,128,8,ActivationType.Silu,torch.bfloat16,torch.bfloat16,torch.bfloat16,QuantType.No,1,0,ck,stage2,32,moe_ck2stages_gemm2_256x32x64x64_1x4_TypeCastExpertWeight_v1_Nswizzle0_Quant0_MulRoutedWeight1_B16_B16_B16,36.4905,0.0,0.00%,66.21,8304.59,102213.75,4096.0,5.529851,20781627.0,6291456.0,0.0,0.0,6291456.0,128533.0,883235.0,2593541.0,16191952.0,496718.0,1.356077,55.946528,0.172101307,349728.0,393216.0,2307936.0,262144.0,2709632.0,60589604.0,20480.0,86520437.0,3221225472.0
193,128,2048,192,128,8,ActivationType.Silu,torch.bfloat16,torch.bfloat16,torch.bfloat16,QuantType.No,1,1,ck,stage1,32,moe_ck2stages_gemm1_256x32x64x64_1x4_TypeCastExpertWeight_v1_Nswizzle0_Quant0_MulRoutedWeight1_silu_B16_B16_B16,59.1309,0.0,0.00%,40.86,5124.87,201494.25,384.0,4.854698,52825644.0,12582912.0,0.0,0.0,12582912.0,78483.0,1615682.0,9608369.0,46765949.0,1702542.0,0.0740092054,12.845284,0.000514956629,254976.0,786432.0,1426944.0,49152.0,2064384.0,64074113.0,1920.0,68247880.0,6442450944.0
193,128,2048,192,128,8,ActivationType.Silu,torch.bfloat16,torch.bfloat16,torch.bfloat16,QuantType.No,1,1,ck,stage2,32,moe_ck2stages_gemm2_256x32x64x64_1x4_TypeCast_v1_Nswizzle0_Quant0_MulRoutedWeight0_B16_B16_B16,35.4275,0.0,0.00%,68.19,8553.76,102048.75,4096.0,5.544072,20675162.0,6291456.0,0.0,0.0,6291456.0,125271.0,881961.0,1620870.0,16653816.0,691078.0,0.963750533,59.310024,0.366338363,349728.0,393216.0,2127712.0,262144.0,2709632.0,97141167.0,20480.0,129060511.0,3221225472.0
194,128,2048,192,128,8,ActivationType.Gelu,torch.bfloat16,torch.bfloat16,torch.bfloat16,QuantType.No,1,0,ck,stage1,32,moe_ck2stages_gemm1_256x32x64x64_1x4_TypeCast_v1_Nswizzle0_Quant0_MulRoutedWeight0_gelu_B16_B16_B16,57.985,0.0,0.00%,41.66,5226.15,201441.0,384.0,4.731954,53175773.0,12582912.0,0.0,0.0,12582912.0,79174.0,1615096.0,12652352.0,47411355.0,1695727.0,0.075432114,13.122169,0.000524857239,254976.0,786432.0,1281486.0,49152.0,2064384.0,64492727.0,1920.0,68403847.0,6442450944.0
194,128,2048,192,128,8,ActivationType.Gelu,torch.bfloat16,torch.bfloat16,torch.bfloat16,QuantType.No,1,0,ck,stage2,32,moe_ck2stages_gemm2_256x32x64x64_1x4_TypeCastExpertWeight_v1_Nswizzle0_Quant0_MulRoutedWeight1_B16_B16_B16,36.2657,0.0,0.00%,66.62,8356.06,102199.5,4096.0,8.627903,12228089.0,6291456.0,0.0,0.0,6291456.0,128532.0,883399.0,1302469.0,7858069.0,724066.0,0.934101489,62.472652,0.37091074,349728.0,393216.0,2307936.0,262144.0,2709632.0,102002572.0,20480.0,140257402.0,3221225472.0
195,128,2048,192,128,8,ActivationType.Gelu,torch.bfloat16,torch.bfloat16,torch.bfloat16,QuantType.No,1,1,ck,stage1,32,moe_ck2stages_gemm1_256x32x64x64_1x4_TypeCastExpertWeight_v1_Nswizzle0_Quant0_MulRoutedWeight1_gelu_B16_B16_B16,58.3161,0.0,0.00%,41.43,5196.48,201447.75,384.0,6.417552,38658304.0,12582912.0,0.0,0.0,12582912.0,82910.0,1614609.0,6387813.0,32703284.0,1383718.0,0.0916483638,12.949191,0.000637690032,254976.0,786432.0,1314816.0,49152.0,2064384.0,51597544.0,1920.0,55558319.0,6442450944.0
195,128,2048,192,128,8,ActivationType.Gelu,torch.bfloat16,torch.bfloat16,torch.bfloat16,QuantType.No,1,1,ck,stage2,32,moe_ck2stages_gemm2_256x32x64x64_1x4_TypeCast_v1_Nswizzle0_Quant0_MulRoutedWeight0_B16_B16_B16,35.5635,0.0,0.00%,67.93,8521.05,102052.1875,4096.0,5.87562,19222355.0,6291456.0,0.0,0.0,6291456.0,125122.0,882060.0,1783748.0,15151429.0,689159.0,0.958299019,59.440349,0.396181543,349728.0,393216.0,2127712.0,262144.0,2709632.0,96352532.0,20480.0,130079906.0,3221225472.0
196,128,4096,192,128,8,ActivationType.Silu,torch.bfloat16,torch.bfloat16,torch.bfloat16,QuantType.No,1,0,ck,stage1,32,moe_ck2stages_gemm1_256x32x64x128_1x4_TypeCast_v1_Nswizzle0_Quant0_MulRoutedWeight0_silu_B16_B16_B16,107.7664,0.0,0.00%,44.84,5623.99,407192.4375,384.0,6.578567,75230511.0,25165824.0,0.0,0.0,25165824.0,109121.0,3260071.0,11553041.0,65521136.0,3147845.0,0.0408802399,13.01781,0.00696100195,500736.0,1572864.0,2391552.0,49152.0,4030464.0,83681960.0,1920.0,125214798.0,12884901888.0
196,128,4096,192,128,8,ActivationType.Silu,torch.bfloat16,torch.bfloat16,torch.bfloat16,QuantType.No,1,0,ck,stage2,32,moe_ck2stages_gemm2_256x32x64x64_1x4_TypeCastExpertWeight_v1_Nswizzle0_Quant0_MulRoutedWeight1_B16_B16_B16,61.8782,0.0,0.08%,78.09,9794.68,200713.0625,8192.0,10.06849,24839444.0,12582912.0,0.0,0.0,12582912.0,267610.0,1736802.0,4810367.0,16755293.0,1479190.0,0.922262876,77.29796,0.474214572,700352.0,786432.0,4632128.0,524288.0,5422848.0,280837261.0,40960.0,351538755.0,6442450944.0
197,128,4096,192,128,8,ActivationType.Silu,torch.bfloat16,torch.bfloat16,torch.bfloat16,QuantType.No,1,1,ck,stage1,32,moe_ck2stages_gemm1_256x32x64x128_1x4_TypeCastExpertWeight_v1_Nswizzle0_Quant0_MulRoutedWeight1_silu_B16_B16_B16,107.7484,0.0,0.00%,44.84,5624.93,407256.0625,384.0,6.959281,70974504.0,25165824.0,0.0,0.0,25165824.0,109166.0,3260722.0,10140211.0,61264140.0,2492680.0,0.0512369077,12.769064,0.00544663172,500736.0,1572864.0,2414592.0,49152.0,4030464.0,64515822.0,1920.0,97995773.0,12884901888.0
197,128,4096,192,128,8,ActivationType.Silu,torch.bfloat16,torch.bfloat16,torch.bfloat16,QuantType.No,1,1,ck,stage2,32,moe_ck2stages_gemm2_256x32x64x64_1x4_TypeCast_v1_Nswizzle0_Quant0_MulRoutedWeight0_B16_B16_B16,60.7984,0.0,0.00%,79.47,9968.63,200569.125,8192.0,5.372405,50411416.0,12582912.0,0.0,0.0,12582912.0,258131.0,1735647.0,8133822.0,43172614.0,807001.0,1.669537,68.601582,0.445244434,700352.0,786432.0,4271680.0,524288.0,5422848.0,124373575.0,40960.0,172344735.0,6442450944.0
198,128,4096,192,128,8,ActivationType.Gelu,torch.bfloat16,torch.bfloat16,torch.bfloat16,QuantType.No,1,0,ck,stage1,32,moe_ck2stages_gemm1_256x32x64x64_1x4_TypeCast_v1_Nswizzle0_Quant0_MulRoutedWeight0_gelu_B16_B16_B16,106.9357,0.0,0.00%,45.18,5667.68,405144.3125,384.0,7.449357,72194201.0,25165824.0,0.0,0.0,25165824.0,122298.0,3241797.0,9331174.0,62613232.0,2221576.0,0.0578164249,13.56584,0.00172089497,500736.0,1572864.0,2261017.0,49152.0,4030464.0,85100569.0,1920.0,92262801.0,12884901888.0
198,128,4096,192,128,8,ActivationType.Gelu,torch.bfloat16,torch.bfloat16,torch.bfloat16,QuantType.No,1,0,ck,stage2,32,moe_ck2stages_gemm2_256x32x64x64_1x4_TypeCastExpertWeight_v1_Nswizzle0_Quant0_MulRoutedWeight1_B16_B16_B16,61.8443,0.0,0.12%,78.13,9800.05,200714.875,8192.0,5.510651,49840196.0,12582912.0,0.0,0.0,12582912.0,266368.0,1736740.0,8762939.0,41686949.0,883737.0,1.512622,72.101578,0.294777707,700352.0,786432.0,4632128.0,524288.0,5422848.0,143491254.0,40960.0,199928238.0,6442450944.0
199,128,4096,192,128,8,ActivationType.Gelu,torch.bfloat16,torch.bfloat16,torch.bfloat16,QuantType.No,1,1,ck,stage1,32,moe_ck2stages_gemm1_256x32x64x64_1x4_TypeCastExpertWeight_v1_Nswizzle0_Quant0_MulRoutedWeight1_gelu_B16_B16_B16,106.7835,0.0,0.00%,45.25,5675.75,405115.1875,384.0,6.980218,77748679.0,25165824.0,0.0,0.0,25165824.0,125713.0,3241664.0,11593727.0,68034719.0,2214574.0,0.0576231465,13.58823,0.00173741665,500736.0,1572864.0,2224128.0,49152.0,4030464.0,85617204.0,1920.0,92725055.0,12884901888.0
199,128,4096,192,128,8,ActivationType.Gelu,torch.bfloat16,torch.bfloat16,torch.bfloat16,QuantType.No,1,1,ck,stage2,32,moe_ck2stages_gemm2_256x32x64x64_1x4_TypeCast_v1_Nswizzle0_Quant0_MulRoutedWeight0_B16_B16_B16,60.7756,0.0,0.00%,79.5,9972.37,200560.625,8192.0,5.387902,50895962.0,12582912.0,0.0,0.0,12582912.0,258699.0,1735579.0,9427602.0,43777029.0,962970.0,1.403372,71.012363,0.421330314,700352.0,786432.0,4271680.0,524288.0,5422848.0,161824971.0,40960.0,212237024.0,6442450944.0
200,128,4096,384,128,8,ActivationType.Gelu,torch.bfloat16,torch.bfloat16,torch.bfloat16,QuantType.No,1,0,ck,stage1,32,moe_ck2stages_gemm1_256x32x64x128_1x4_TypeCast_v1_Nswizzle0_Quant0_MulRoutedWeight0_gelu_B16_B16_B16,213.3882,0.0,0.00%,45.29,5670.68,811218.625,768.0,9.117638,117456315.0,50331648.0,0.0,0.0,50331648.0,226996.0,6495202.0,11862555.0,99919336.0,3393412.0,0.0756925517,25.433907,0.0243438285,1001472.0,3145728.0,4678177.0,98304.0,8060928.0,86308113.0,3840.0,264253723.0,25769803776.0
200,128,4096,384,128,8,ActivationType.Gelu,torch.bfloat16,torch.bfloat16,torch.bfloat16,QuantType.No,1,0,ck,stage2,32,moe_ck2stages_gemm2_256x32x64x64_1x4_TypeCastExpertWeight_v1_Nswizzle0_Quant0_MulRoutedWeight1_B16_B16_B16,119.4523,0.0,0.52%,80.9,10130.04,399818.5625,8192.0,8.707842,65211656.0,25165824.0,0.0,0.0,25165824.0,381544.0,3329628.0,9469439.0,52988080.0,1886984.0,0.721977754,78.541555,0.451973513,1191168.0,1572864.0,5633920.0,524288.0,9352192.0,337451534.0,40960.0,456284360.0,12884901888.0
201,128,4096,384,128,8,ActivationType.Gelu,torch.bfloat16,torch.bfloat16,torch.bfloat16,QuantType.No,1,1,ck,stage1,32,moe_ck2stages_gemm1_256x32x64x64_1x4_TypeCastExpertWeight_v1_Nswizzle0_Quant0_MulRoutedWeight1_gelu_B16_B16_B16,212.9981,0.0,0.00%,45.37,5681.07,802254.9375,768.0,10.079523,107923525.0,50331648.0,0.0,0.0,50331648.0,291592.0,6423496.0,8810040.0,90219347.0,3384131.0,0.0760500044,27.553641,0.00122734916,1001472.0,3145728.0,4448256.0,98304.0,8060928.0,212678615.0,3840.0,284931809.0,25769803776.0
201,128,4096,384,128,8,ActivationType.Gelu,torch.bfloat16,torch.bfloat16,torch.bfloat16,QuantType.No,1,1,ck,stage2,32,moe_ck2stages_gemm2_256x32x64x128_1x4_TypeCast_v1_Nswizzle0_Quant0_MulRoutedWeight0_B16_B16_B16,118.5751,0.0,0.00%,81.5,10204.98,401229.125,8192.0,9.227892,60886053.0,25165824.0,0.0,0.0,25165824.0,495492.0,3341142.0,8844669.0,47972215.0,1824120.0,0.7482717,47.948741,0.503659179,1191168.0,1572864.0,6518656.0,524288.0,9352192.0,183603866.0,40960.0,268768142.0,12884901888.0
202,128,4096,384,128,8,ActivationType.Silu,torch.bfloat16,torch.bfloat16,torch.bfloat16,QuantType.No,1,0,ck,stage1,32,moe_ck2stages_gemm1_256x32x64x64_1x4_TypeCast_v1_Nswizzle0_Quant0_MulRoutedWeight0_silu_B16_B16_B16,213.8838,0.0,0.00%,45.18,5657.54,802122.5625,768.0,10.239557,106168780.0,50331648.0,0.0,0.0,50331648.0,287056.0,6421910.0,13023148.0,88723451.0,3294975.0,0.0779067728,27.478483,0.00163375663,1001472.0,3145728.0,4626432.0,98304.0,8060928.0,205595980.0,3840.0,277382278.0,25769803776.0
202,128,4096,384,128,8,ActivationType.Silu,torch.bfloat16,torch.bfloat16,torch.bfloat16,QuantType.No,1,0,ck,stage2,32,moe_ck2stages_gemm2_256x32x64x128_1x4_TypeCastExpertWeight_v1_Nswizzle0_Quant0_MulRoutedWeight1_B16_B16_B16,119.1808,0.0,0.37%,81.08,10153.12,401405.0625,8192.0,5.410864,108500796.0,25165824.0,0.0,0.0,25165824.0,503023.0,3342409.0,10911146.0,94603384.0,1663939.0,0.820999014,49.053067,0.404398639,1191168.0,1572864.0,6879104.0,524288.0,9352192.0,175100717.0,40960.0,250601368.0,12884901888.0
203,128,4096,384,128,8,ActivationType.Silu,torch.bfloat16,torch.bfloat16,torch.bfloat16,QuantType.No,1,1,ck,stage1,32,moe_ck2stages_gemm1_256x32x64x64_1x4_TypeCastExpertWeight_v1_Nswizzle0_Quant0_MulRoutedWeight1_silu_B16_B16_B16,214.82,0.0,0.00%,44.98,5632.89,802223.875,768.0,10.030864,108815157.0,50331648.0,0.0,0.0,50331648.0,286188.0,6425740.0,10974514.0,91281455.0,3323606.0,0.0771767867,27.972731,0.00136486657,1001472.0,3145728.0,4672512.0,98304.0,8060928.0,211496666.0,3840.0,285042325.0,25769803776.0
203,128,4096,384,128,8,ActivationType.Silu,torch.bfloat16,torch.bfloat16,torch.bfloat16,QuantType.No,1,1,ck,stage2,32,moe_ck2stages_gemm2_256x32x64x128_1x4_TypeCast_v1_Nswizzle0_Quant0_MulRoutedWeight0_B16_B16_B16,119.2088,0.0,0.00%,81.07,10150.73,401251.25,8192.0,9.643793,57948856.0,25165824.0,0.0,0.0,25165824.0,495405.0,3341160.0,7579027.0,45263074.0,1661618.0,0.820647417,48.283254,0.469058552,1191168.0,1572864.0,6518656.0,524288.0,9352192.0,167114949.0,40960.0,246774242.0,12884901888.0
204,128,4096,384,128,8,ActivationType.Silu,torch.bfloat16,torch.float8_e4m3fnuz,torch.float8_e4m3fnuz,QuantType.per_Tensor,1,0,ck,stage1,32,moe_ck2stages_gemm1_256x32x64x256_1x4_MulABScale_v1_Nswizzle0_Quant1_MulRoutedWeight0_silu_F8_F8_B16,111.4872,32.31200000000002,0.00%,86.68,5431.59,404003.5,768.0,9.236912,55921544.0,0.0,0.0,50331648.0,25165824.0,138815.0,3237233.0,7417437.0,46189338.0,1755499.0,3.417687,25.113772,0.0384110718,602112.0,1572864.0,2998272.0,2310144.0,6340608.0,44170901.0,3840.0,135802807.0,25769803776.0
204,128,4096,384,128,8,ActivationType.Silu,torch.bfloat16,torch.float8_e4m3fnuz,torch.float8_e4m3fnuz,QuantType.per_Tensor,1,0,ck,stage2,32,moe_ck2stages_gemm2_256x32x64x128_1x4_MulABScaleExpertWeight_v1_Nswizzle0_Quant1_MulRoutedWeight1_F8_F8_B16,62.7881,32.31200000000002,0.37%,153.91,9644.39,200719.5625,8192.0,11.485293,20663965.0,0.0,0.0,25165824.0,12582912.0,274181.0,1736890.0,3296596.0,12267903.0,700183.0,18.976394,65.480764,0.228453066,896256.0,786432.0,5240704.0,5242880.0,10138624.0,92884791.0,40960.0,144730466.0,12884901888.0
205,128,4096,384,128,8,ActivationType.Silu,torch.bfloat16,torch.float8_e4m3fnuz,torch.float8_e4m3fnuz,QuantType.per_Tensor,1,1,ck,stage1,32,moe_ck2stages_gemm1_256x32x64x256_1x4_MulABScale_v1_Nswizzle0_Quant1_MulRoutedWeight1_silu_F8_F8_B16,111.6797,33.40322222222218,0.00%,86.53,5422.23,404064.0,768.0,9.485988,54806036.0,0.0,0.0,50331648.0,25165824.0,141641.0,3238405.0,6278467.0,45053775.0,1749374.0,3.440012,25.564322,0.0300327064,602112.0,1572864.0,3062784.0,2310144.0,6340608.0,44465893.0,3840.0,137342010.0,25769803776.0
205,128,4096,384,128,8,ActivationType.Silu,torch.bfloat16,torch.float8_e4m3fnuz,torch.float8_e4m3fnuz,QuantType.per_Tensor,1,1,ck,stage2,32,moe_ck2stages_gemm2_256x32x64x128_1x4_MulABScaleExpertWeight_v1_Nswizzle0_Quant1_MulRoutedWeight0_F8_F8_B16,62.5219,33.40322222222218,0.00%,154.56,9685.45,200587.5,8192.0,10.767843,21645187.0,0.0,0.0,25165824.0,12582912.0,264466.0,1735889.0,3834632.0,14226748.0,700977.0,19.185169,64.882528,0.226933944,896256.0,786432.0,4487040.0,5242880.0,10138624.0,96974299.0,40960.0,141847615.0,12884901888.0
206,128,4096,384,128,8,ActivationType.Silu,torch.bfloat16,torch.float8_e4m3fnuz,torch.float8_e4m3fnuz,QuantType.per_Token,1,0,asm,asm_1stage,32,_ZN5aiter45fmoe_bf16_pertokenFp8_g1u1_vs_silu_1tg_32x384E,169.414,0.0,0.00%,57.04,3574.4,603428.75,9216.0,8.495978,42217694.0,0.0,0.0,75497472.0,37748736.0,91713.0,4975563.0,4213670.0,30970269.0,2883999.0,0.0,4.838665,0.0990871905,317952.0,2359296.0,4507904.0,0.0,1243136.0,2844736.0,640.0,42764875.0,38654705664.0
207,128,4096,384,128,8,ActivationType.Silu,torch.bfloat16,torch.float8_e4m3fnuz,torch.float8_e4m3fnuz,QuantType.per_Token,1,1,asm,asm_1stage,32,_ZN5aiter50fmoe_bf16_pertokenFp8_g1u1_vs_tkw1_silu_1tg_32x384E,170.0984,0.0,0.00%,56.81,3560.01,603486.25,8192.0,8.467174,42672139.0,0.0,0.0,75497472.0,37748736.0,87735.0,4959651.0,4269492.0,30989130.0,2950713.0,0.0,4.819052,0.0939018853,293376.0,2359296.0,4278528.0,0.0,1177600.0,2603212.0,640.0,43621242.0,38654705664.0
208,128,4096,384,128,8,ActivationType.Gelu,torch.bfloat16,torch.float8_e4m3fnuz,torch.float8_e4m3fnuz,QuantType.per_Tensor,1,0,ck,stage1,32,moe_ck2stages_gemm1_256x32x64x128_1x4_MulABScale_v1_Nswizzle0_Quant1_MulRoutedWeight0_gelu_F8_F8_B16,110.0652,33.2513333333333,0.00%,87.8,5501.76,400213.0,768.0,9.252067,54812384.0,0.0,0.0,50331648.0,25165824.0,166480.0,3207838.0,6657053.0,45125883.0,1832748.0,9.855608,26.044908,0.00218084304,795648.0,1572864.0,2767094.0,6955008.0,10985472.0,105154351.0,3840.0,147037130.0,25769803776.0
208,128,4096,384,128,8,ActivationType.Gelu,torch.bfloat16,torch.float8_e4m3fnuz,torch.float8_e4m3fnuz,QuantType.per_Tensor,1,0,ck,stage2,32,moe_ck2stages_gemm2_256x32x64x128_1x4_MulABScaleExpertWeight_v1_Nswizzle0_Quant1_MulRoutedWeight1_F8_F8_B16,62.6045,33.2513333333333,0.51%,154.36,9672.67,200716.125,8192.0,11.750973,19984483.0,0.0,0.0,25165824.0,12582912.0,274476.0,1736818.0,3373856.0,11637780.0,717206.0,18.724218,65.740517,0.252966658,896256.0,786432.0,5240704.0,5242880.0,10138624.0,94746030.0,40960.0,147261534.0,12884901888.0
209,128,4096,384,128,8,ActivationType.Gelu,torch.bfloat16,torch.float8_e4m3fnuz,torch.float8_e4m3fnuz,QuantType.per_Tensor,1,1,ck,stage1,32,moe_ck2stages_gemm1_256x32x64x128_1x4_MulABScale_v1_Nswizzle0_Quant1_MulRoutedWeight1_gelu_F8_F8_B16,111.0748,33.96799999999999,0.00%,87.0,5451.76,400312.875,768.0,9.428596,54379368.0,0.0,0.0,50331648.0,25165824.0,168190.0,3208779.0,7275146.0,44640683.0,1732622.0,10.481514,26.227327,0.00226207547,795648.0,1572864.0,2688000.0,6955008.0,10985472.0,99328603.0,3840.0,139225124.0,25769803776.0
209,128,4096,384,128,8,ActivationType.Gelu,torch.bfloat16,torch.float8_e4m3fnuz,torch.float8_e4m3fnuz,QuantType.per_Tensor,1,1,ck,stage2,32,moe_ck2stages_gemm2_256x32x64x128_1x4_MulABScaleExpertWeight_v1_Nswizzle0_Quant1_MulRoutedWeight0_F8_F8_B16,62.5452,33.96799999999999,0.00%,154.51,9681.84,200591.375,8192.0,11.032699,21092599.0,0.0,0.0,25165824.0,12582912.0,264888.0,1735926.0,3923520.0,13680494.0,737682.0,18.148668,64.354764,0.313032738,896256.0,786432.0,4487040.0,5242880.0,10138624.0,101288305.0,40960.0,148729070.0,12884901888.0
210,128,4096,384,128,8,ActivationType.Gelu,torch.bfloat16,torch.float8_e4m3fnuz,torch.float8_e4m3fnuz,QuantType.per_Token,1,0,asm,asm_1stage,32,_ZN5aiter45fmoe_bf16_pertokenFp8_g1u1_vs_gelu_1tg_32x384E,168.7507,0.0,0.00%,57.27,3588.45,603689.0,9216.0,8.376313,42885206.0,0.0,0.0,75497472.0,37748736.0,93628.0,4975284.0,4287531.0,31643140.0,2884485.0,0.0,4.756066,0.0770652243,317952.0,2359296.0,4581632.0,0.0,1243136.0,2867365.0,640.0,42062845.0,38654705664.0
211,128,4096,384,128,8,ActivationType.Gelu,torch.bfloat16,torch.float8_e4m3fnuz,torch.float8_e4m3fnuz,QuantType.per_Token,1,1,asm,asm_1stage,32,_ZN5aiter50fmoe_bf16_pertokenFp8_g1u1_vs_tkw1_gelu_1tg_32x384E,170.2626,0.0,0.00%,56.76,3556.58,603483.5,8192.0,8.496001,42613396.0,0.0,0.0,75497472.0,37748736.0,90783.0,4958611.0,3763529.0,30944672.0,2901852.0,0.0,4.801849,0.0876111325,293376.0,2359296.0,4352256.0,0.0,1177600.0,2625723.0,640.0,42558491.0,38654705664.0
212,128,4096,384,128,8,ActivationType.Silu,torch.bfloat16,torch.float8_e4m3fnuz,torch.float8_e4m3fnuz,QuantType.per_1x128,1,0,asm,asm_1stage,32,_ZN5aiter47fmoe_bf16_blockscaleFp8_g1u1_vs_silu_1tg_32x128E,201.0722,0.0,0.00%,48.06,3011.62,598508.5625,24576.0,8.345979,82436283.0,0.0,0.0,75497472.0,37748736.0,233553.0,5199285.0,7153962.0,67250677.0,2859662.0,0.0,8.924613,0.105128828,947712.0,2359296.0,7926528.0,0.0,3618816.0,57795389.0,1920.0,78460386.0,38654705664.0
213,128,4096,384,128,8,ActivationType.Gelu,torch.bfloat16,torch.float8_e4m3fnuz,torch.float8_e4m3fnuz,QuantType.per_1x128,1,0,asm,asm_1stage,32,_ZN5aiter47fmoe_bf16_blockscaleFp8_g1u1_vs_gelu_1tg_32x128E,201.1254,0.0,0.13%,48.05,3010.82,598092.8125,24576.0,8.238139,83594384.0,0.0,0.0,75497472.0,37748736.0,253941.0,5180176.0,7434010.0,68371738.0,2777447.0,0.0,8.75966,0.0813389263,947712.0,2359296.0,8000256.0,0.0,3618816.0,54130394.0,1920.0,74668957.0,38654705664.0
214,128,4096,384,128,8,ActivationType.Silu,torch.bfloat16,torch.float8_e4m3fnuz,torch.float8_e4m3fnuz,QuantType.per_1x128,1,1,ck,stage1,16,moe_ck2stages_gemm1_128x16x128x128_1x2_MulABScaleExpertWeightA8W8blkscale_v1_Nswizzle0_Quant4_MulRoutedWeight1_silu_F8_F8_B16,111.8605,36.77511111111115,0.01%,86.39,5413.46,400118.8125,768.0,3.975821,38425198.0,0.0,0.0,25165824.0,12582912.0,218109.0,3207066.0,5345120.0,54178095.0,2034621.0,1.718475,6.630248,0.00494863174,127488.0,786432.0,1872384.0,1339392.0,1978368.0,31343024.0,1152.0,41341315.0,12884901888.0
214,128,4096,384,128,8,ActivationType.Silu,torch.bfloat16,torch.float8_e4m3fnuz,torch.float8_e4m3fnuz,QuantType.per_1x128,1,1,ck,stage2,16,moe_ck2stages_gemm2_128x16x128x128_1x2_MulABScaleExpertWeightA8W8blkscale_v1_Nswizzle0_Quant4_MulRoutedWeight0_F8_F8_B16,61.9218,36.77511111111115,16.58%,156.06,9779.31,201248.875,8192.0,4.565819,25074178.0,0.0,0.0,12582912.0,6291456.0,247787.0,1741325.0,4350350.0,19038804.0,837334.0,8.058725,33.769913,0.441630687,177792.0,393216.0,2383808.0,2621440.0,3725824.0,44353183.0,12288.0,87880704.0,6442450944.0
215,128,4096,384,128,8,ActivationType.Gelu,torch.bfloat16,torch.float8_e4m3fnuz,torch.float8_e4m3fnuz,QuantType.per_1x128,1,1,ck,stage1,16,moe_ck2stages_gemm1_128x16x128x128_1x2_MulABScaleExpertWeightA8W8blkscale_v1_Nswizzle0_Quant4_MulRoutedWeight1_gelu_F8_F8_B16,111.2975,36.6592222222221,0.01%,86.83,5440.85,400072.8125,768.0,4.002425,37984530.0,0.0,0.0,25165824.0,12582912.0,224574.0,3207322.0,5237375.0,55396176.0,2038812.0,1.718951,6.746789,0.00490123404,127488.0,786432.0,1752576.0,1339392.0,1978368.0,32027603.0,1152.0,42056328.0,12884901888.0
215,128,4096,384,128,8,ActivationType.Gelu,torch.bfloat16,torch.float8_e4m3fnuz,torch.float8_e4m3fnuz,QuantType.per_1x128,1,1,ck,stage2,16,moe_ck2stages_gemm2_128x16x128x128_1x2_MulABScaleExpertWeightA8W8blkscale_v1_Nswizzle0_Quant4_MulRoutedWeight0_F8_F8_B16,62.8045,36.6592222222221,16.69%,153.87,9641.87,201228.75,8192.0,4.709363,25295847.0,0.0,0.0,12582912.0,6291456.0,248290.0,1741112.0,3822257.0,18975917.0,857495.0,7.856662,33.636618,0.440408725,177792.0,393216.0,2383808.0,2621440.0,3725824.0,44926265.0,12288.0,89785077.0,6442450944.0
216,128,7168,256,256,8,ActivationType.Gelu,torch.bfloat16,torch.bfloat16,torch.bfloat16,QuantType.No,1,0,ck,stage1,32,moe_ck2stages_gemm1_256x32x64x64_1x4_TypeCast_v1_Nswizzle0_Quant0_MulRoutedWeight0_gelu_B16_B16_B16,495.685,0.0,0.00%,22.74,5693.62,1850751.0625,512.0,11.690376,218656729.0,116523008.0,0.0,0.0,116523008.0,242579.0,14809081.0,17800836.0,180344560.0,6637121.0,0.0513127134,35.234389,0.0140227314,2300224.0,7282688.0,9640870.0,130048.0,18466816.0,434630346.0,4608.0,714390102.0,59659780096.0
216,128,7168,256,256,8,ActivationType.Gelu,torch.bfloat16,torch.bfloat16,torch.bfloat16,QuantType.No,1,0,ck,stage2,32,moe_ck2stages_gemm2_256x32x64x128_1x4_TypeCastExpertWeight_v1_Nswizzle0_Quant0_MulRoutedWeight1_B16_B16_B16,265.6012,0.0,1.63%,42.45,10625.86,915031.875,14336.0,11.265055,119994050.0,58261504.0,0.0,0.0,58261504.0,534651.0,7549722.0,10417959.0,89368711.0,3046055.0,1.558322,61.983559,0.345083744,2987600.0,3641344.0,17412080.0,1820672.0,23329600.0,441803356.0,129024.0,579349956.0,29829890048.0
217,128,7168,256,256,8,ActivationType.Gelu,torch.bfloat16,torch.bfloat16,torch.bfloat16,QuantType.No,1,1,ck,stage1,32,moe_ck2stages_gemm1_256x32x64x128_1x4_TypeCastExpertWeight_v1_Nswizzle0_Quant0_MulRoutedWeight1_gelu_B16_B16_B16,490.5081,0.0,0.00%,22.98,5753.71,1861339.375,512.0,11.574628,225643447.0,116523008.0,0.0,0.0,116523008.0,170255.0,14890181.0,17745967.0,187208411.0,6662873.0,0.05107562,29.721281,0.0132564971,2300224.0,7282688.0,9749536.0,130048.0,18466816.0,192140354.0,4608.0,605407153.0,59659780096.0
217,128,7168,256,256,8,ActivationType.Gelu,torch.bfloat16,torch.bfloat16,torch.bfloat16,QuantType.No,1,1,ck,stage2,32,moe_ck2stages_gemm2_256x32x64x64_1x4_TypeCast_v1_Nswizzle0_Quant0_MulRoutedWeight0_B16_B16_B16,267.1771,0.0,0.00%,42.2,10563.19,914911.0,14336.0,11.123668,121177832.0,58261504.0,0.0,0.0,58261504.0,489146.0,7548658.0,15692198.0,95631455.0,3083252.0,1.543757,80.885235,0.440710602,2987600.0,3641344.0,15136240.0,1820672.0,23329600.0,631756258.0,129024.0,763153566.0,29829890048.0
218,128,7168,256,256,8,ActivationType.Gelu,torch.bfloat16,torch.float8_e4m3fnuz,torch.float8_e4m3fnuz,QuantType.per_Tensor,1,0,asm,stage1,16,_ZN5aiter48fmoe_stage1_bf16_pertokenFp8_g1u1_16x128_4tg_pf2E,238.4482,32.21888888888887,0.05%,47.28,5921.78,918094.0,512.0,5.118225,128881333.0,0.0,0.0,58261504.0,29130752.0,145012.0,7348447.0,10423138.0,111612926.0,3688870.0,0.0,19.467297,0.00715456006,243840.0,1820672.0,2301440.0,0.0,1885696.0,208481675.0,2560.0,219614406.0,29829890048.0
218,128,7168,256,256,8,ActivationType.Gelu,torch.bfloat16,torch.float8_e4m3fnuz,torch.float8_e4m3fnuz,QuantType.per_Tensor,1,0,ck,stage2,16,moe_ck2stages_gemm2_256x16x128x256_1x4_MulABScaleExpertWeight_v1_Nswizzle0_Quant1_MulRoutedWeight1_F8_F8_B16,137.0519,32.21888888888887,1.64%,82.26,10302.95,457546.125,28672.0,5.826664,55102108.0,0.0,0.0,29130752.0,14565376.0,174363.0,4119144.0,5519160.0,42648295.0,1588284.0,1.962422,72.498981,0.733935454,645624.0,910336.0,7185024.0,1202656.0,5150656.0,243777576.0,71680.0,355443781.0,14914945024.0
219,128,7168,256,256,8,ActivationType.Gelu,torch.bfloat16,torch.float8_e4m3fnuz,torch.float8_e4m3fnuz,QuantType.per_Tensor,1,1,asm,stage1,16,_ZN5aiter57fmoe_stage1_bf16_pertokenFp8_doweight_g1u1_16x128_4tg_pf2E,238.4333,32.38777777777777,0.00%,47.28,5922.15,918114.25,512.0,5.123118,130281533.0,0.0,0.0,58261504.0,29130752.0,144720.0,7349402.0,11680568.0,113082556.0,3685416.0,0.0,19.436134,0.00654920148,243840.0,1820672.0,2307536.0,0.0,1885696.0,208027987.0,2560.0,219230709.0,29829890048.0
219,128,7168,256,256,8,ActivationType.Gelu,torch.bfloat16,torch.float8_e4m3fnuz,torch.float8_e4m3fnuz,QuantType.per_Tensor,1,1,ck,stage2,16,moe_ck2stages_gemm2_256x16x128x256_1x4_MulABScaleExpertWeight_v1_Nswizzle0_Quant1_MulRoutedWeight0_F8_F8_B16,136.1928,32.38777777777777,0.00%,82.78,10367.94,457416.5,28672.0,5.626403,57493047.0,0.0,0.0,29130752.0,14565376.0,160166.0,4118127.0,6666824.0,46086816.0,1629766.0,1.91376,73.1825,0.769477527,645624.0,910336.0,6729856.0,1202656.0,5150656.0,257514769.0,71680.0,367918146.0,14914945024.0
220,128,7168,256,256,8,ActivationType.Gelu,torch.bfloat16,torch.float8_e4m3fnuz,torch.float8_e4m3fnuz,QuantType.per_Token,1,0,asm,asm_1stage,32,_ZN5aiter45fmoe_bf16_pertokenFp8_g1u1_vs_gelu_1tg_32x256E,387.5989,0.0,0.00%,29.09,3643.04,1386275.125,15360.0,11.223686,152961615.0,0.0,0.0,174784512.0,87392256.0,157186.0,11334810.0,18113854.0,127442063.0,4847007.0,0.0,9.834023,0.131225411,1008888.0,5462016.0,12128336.0,0.0,3986784.0,43945092.0,1152.0,145956907.0,89489670144.0
221,128,7168,256,256,8,ActivationType.Gelu,torch.bfloat16,torch.float8_e4m3fnuz,torch.float8_e4m3fnuz,QuantType.per_Token,1,1,asm,asm_1stage,32,_ZN5aiter50fmoe_bf16_pertokenFp8_g1u1_vs_tkw1_gelu_1tg_32x256E,390.4291,0.0,0.00%,28.88,3616.63,1386337.25,14336.0,11.450267,148470743.0,0.0,0.0,174784512.0,87392256.0,154222.0,11318691.0,15386090.0,121411911.0,4825341.0,0.0,9.767375,0.0885200465,960120.0,5462016.0,11250512.0,0.0,3856736.0,35027025.0,1152.0,144262680.0,89489670144.0
222,128,7168,256,256,8,ActivationType.Silu,torch.bfloat16,torch.bfloat16,torch.bfloat16,QuantType.No,1,0,ck,stage1,32,moe_ck2stages_gemm1_256x32x64x128_1x4_TypeCast_v1_Nswizzle0_Quant0_MulRoutedWeight0_silu_B16_B16_B16,486.3547,0.0,0.00%,23.18,5802.85,1860800.0625,512.0,11.453383,229034522.0,116523008.0,0.0,0.0,116523008.0,162829.0,14892661.0,19592146.0,190726618.0,6586535.0,0.0517433228,29.29619,0.00889398043,2300224.0,7282688.0,9985248.0,130048.0,18466816.0,185408969.0,4608.0,589047733.0,59659780096.0
222,128,7168,256,256,8,ActivationType.Silu,torch.bfloat16,torch.bfloat16,torch.bfloat16,QuantType.No,1,0,ck,stage2,32,moe_ck2stages_gemm2_256x32x64x64_1x4_TypeCastExpertWeight_v1_Nswizzle0_Quant0_MulRoutedWeight1_B16_B16_B16,265.7743,0.0,1.32%,42.42,10618.94,915198.0,14336.0,12.392575,108542125.0,58261504.0,0.0,0.0,58261504.0,515956.0,7551020.0,13843574.0,79209570.0,3011733.0,1.574649,82.295906,0.349652418,2987600.0,3641344.0,16387952.0,1820672.0,23329600.0,622280475.0,129024.0,761230339.0,29829890048.0
223,128,7168,256,256,8,ActivationType.Silu,torch.bfloat16,torch.bfloat16,torch.bfloat16,QuantType.No,1,1,ck,stage1,32,moe_ck2stages_gemm1_256x32x64x128_1x4_TypeCastExpertWeight_v1_Nswizzle0_Quant0_MulRoutedWeight1_silu_B16_B16_B16,489.9208,0.0,0.00%,23.01,5760.61,1861203.5,512.0,11.377663,230398107.0,116523008.0,0.0,0.0,116523008.0,164371.0,14892530.0,14938913.0,191917750.0,6610558.0,0.0514392614,29.487144,0.0102771331,2300224.0,7282688.0,10046208.0,130048.0,18466816.0,188478138.0,4608.0,596391786.0,59659780096.0
223,128,7168,256,256,8,ActivationType.Silu,torch.bfloat16,torch.bfloat16,torch.bfloat16,QuantType.No,1,1,ck,stage2,32,moe_ck2stages_gemm2_256x32x64x128_1x4_TypeCast_v1_Nswizzle0_Quant0_MulRoutedWeight0_B16_B16_B16,265.7915,0.0,0.00%,42.42,10618.26,914756.8125,14336.0,11.732629,115189107.0,58261504.0,0.0,0.0,58261504.0,509690.0,7547526.0,11156563.0,88101256.0,3238578.0,1.46585,61.31521,0.561857824,2987600.0,3641344.0,16160368.0,1820672.0,23329600.0,464068532.0,129024.0,609256806.0,29829890048.0
224,128,7168,256,256,8,ActivationType.Silu,torch.bfloat16,torch.float8_e4m3fnuz,torch.float8_e4m3fnuz,QuantType.per_Tensor,1,0,asm,stage1,16,_ZN5aiter47fmoe_stage1_bf16_pertokenFp8_g1u1_16x64_6tg_pf2E,241.7324,31.71977777777778,0.00%,46.64,5841.33,922282.75,512.0,5.181648,123056850.0,0.0,0.0,58261504.0,29130752.0,228774.0,7381812.0,11070989.0,105171986.0,3667217.0,0.0,36.826434,0.00635312495,475488.0,1820672.0,2501792.0,0.0,3738880.0,397066849.0,5120.0,413667551.0,29829890048.0
224,128,7168,256,256,8,ActivationType.Silu,torch.bfloat16,torch.float8_e4m3fnuz,torch.float8_e4m3fnuz,QuantType.per_Tensor,1,0,ck,stage2,16,moe_ck2stages_gemm2_256x16x128x256_1x4_MulABScaleExpertWeight_v1_Nswizzle0_Quant1_MulRoutedWeight1_F8_F8_B16,138.5693,31.71977777777778,1.28%,81.36,10190.13,457545.625,28672.0,5.913303,53135284.0,0.0,0.0,29130752.0,14565376.0,174201.0,4119145.0,5970064.0,40835055.0,1670636.0,1.861854,73.149051,0.739356746,645624.0,910336.0,7185024.0,1202656.0,5150656.0,259087881.0,71680.0,378002273.0,14914945024.0
225,128,7168,256,256,8,ActivationType.Silu,torch.bfloat16,torch.float8_e4m3fnuz,torch.float8_e4m3fnuz,QuantType.per_Tensor,1,1,ck,stage1,16,moe_ck2stages_gemm1_256x16x128x256_1x4_MulABScale_v1_Nswizzle0_Quant1_MulRoutedWeight1_silu_F8_F8_B16,244.21,31.81811111111111,0.00%,46.17,5782.07,920881.625,512.0,5.143643,114974231.0,0.0,0.0,58261504.0,29130752.0,66272.0,7371117.0,12857383.0,97271794.0,3686403.0,3.777447,16.628447,0.00893110971,516128.0,1820672.0,2822448.0,5331968.0,7672832.0,53714354.0,2560.0,187771980.0,29829890048.0
225,128,7168,256,256,8,ActivationType.Silu,torch.bfloat16,torch.float8_e4m3fnuz,torch.float8_e4m3fnuz,QuantType.per_Tensor,1,1,ck,stage2,16,moe_ck2stages_gemm2_256x16x128x256_1x4_MulABScaleExpertWeight_v1_Nswizzle0_Quant1_MulRoutedWeight0_F8_F8_B16,134.7285,31.81811111111111,0.00%,83.68,10480.62,457415.875,28672.0,5.588132,57757021.0,0.0,0.0,29130752.0,14565376.0,160554.0,4118122.0,5186659.0,46371991.0,1668956.0,1.873032,74.172672,0.777588133,645624.0,910336.0,6729856.0,1202656.0,5150656.0,263831702.0,71680.0,381004579.0,14914945024.0
226,128,7168,256,256,8,ActivationType.Silu,torch.bfloat16,torch.float8_e4m3fnuz,torch.float8_e4m3fnuz,QuantType.per_Token,1,0,asm,asm_1stage,32,_ZN5aiter48fmoe_bf16_pertokenFp8_g1u1_vs_silu_1tg_ps_32x256E,390.5501,0.0,0.00%,28.87,3615.51,1385804.625,14336.0,11.902544,144269685.0,0.0,0.0,174784512.0,87392256.0,148997.0,11319678.0,15569605.0,116692897.0,4923956.0,0.0,9.817971,0.0779047794,960120.0,5462016.0,12066472.0,0.0,3856736.0,36834580.0,1216.0,147643642.0,89489670144.0
227,128,7168,256,256,8,ActivationType.Silu,torch.bfloat16,torch.float8_e4m3fnuz,torch.float8_e4m3fnuz,QuantType.per_Token,1,1,asm,asm_1stage,32,_ZN5aiter53fmoe_bf16_pertokenFp8_g1u1_vs_tkw1_silu_1tg_ps_32x256E,388.5663,0.0,0.00%,29.02,3633.97,1385996.875,14336.0,11.560315,147899506.0,0.0,0.0,174784512.0,87392256.0,150624.0,11318569.0,16824106.0,120437461.0,4912807.0,0.0,9.684927,0.0771885088,960120.0,5462016.0,11221160.0,0.0,3856736.0,35941057.0,1216.0,145640327.0,89489670144.0
228,128,7168,256,256,8,ActivationType.Gelu,torch.bfloat16,torch.float8_e4m3fnuz,torch.float8_e4m3fnuz,QuantType.per_1x128,1,0,asm,asm_1stage,32,_ZN5aiter47fmoe_bf16_blockscaleFp8_g1u1_vs_gelu_1tg_32x128E,398.6642,0.0,2.07%,28.28,3541.92,1376526.0625,28672.0,12.432363,143394657.0,0.0,0.0,174784512.0,87392256.0,336506.0,11470937.0,11642329.0,110554333.0,4325000.0,0.0,10.227171,0.0617560629,2131568.0,5462016.0,17896512.0,0.0,8103616.0,90983582.0,2304.0,135677635.0,89489670144.0
229,128,7168,256,256,8,ActivationType.Gelu,torch.bfloat16,torch.float8_e4m3fnuz,torch.float8_e4m3fnuz,QuantType.per_1x128,1,1,ck,stage1,16,moe_ck2stages_gemm1_256x16x128x256_1x4_MulABScaleExpertWeightA8W8blkscale_v1_Nswizzle0_Quant4_MulRoutedWeight1_gelu_F8_F8_B16,244.3945,31.49188888888891,0.01%,46.13,5777.7,923582.875,512.25,4.842985,124808900.0,0.0,0.0,58261504.0,29130752.0,140410.0,7393147.0,12169267.0,104232494.0,3774028.0,3.835948,16.918455,0.0261886426,512064.0,1820672.0,3763264.0,5527040.0,7867904.0,70231019.0,2560.0,195016133.0,29829890048.0
229,128,7168,256,256,8,ActivationType.Gelu,torch.bfloat16,torch.float8_e4m3fnuz,torch.float8_e4m3fnuz,QuantType.per_1x128,1,1,ck,stage2,16,moe_ck2stages_gemm2_128x16x128x128_1x2_MulABScaleExpertWeightA8W8blkscale_v1_Nswizzle0_Quant4_MulRoutedWeight0_F8_F8_B16,136.8132,31.49188888888891,16.65%,82.41,10320.92,458523.625,14336.0,4.761265,66308649.0,0.0,0.0,29130752.0,14565376.0,218313.0,3897551.0,9899241.0,54189273.0,1918200.0,11.079622,36.705893,0.700538241,412776.0,910336.0,5510456.0,8193024.0,11323424.0,140544600.0,35840.0,217142620.0,14914945024.0
230,128,7168,256,256,8,ActivationType.Silu,torch.bfloat16,torch.float8_e4m3fnuz,torch.float8_e4m3fnuz,QuantType.per_1x128,1,1,ck,stage1,16,moe_ck2stages_gemm1_256x16x128x256_1x4_MulABScaleExpertWeightA8W8blkscale_v1_Nswizzle0_Quant4_MulRoutedWeight1_silu_F8_F8_B16,244.5479,33.40622222222225,0.02%,46.1,5774.08,923614.6875,512.0,5.026893,121804434.0,0.0,0.0,58261504.0,29130752.0,136502.0,7393127.0,13250533.0,101090667.0,3606030.0,4.012583,16.960153,0.0129937917,512064.0,1820672.0,3911600.0,5527040.0,7867904.0,66401792.0,2560.0,186890988.0,29829890048.0
230,128,7168,256,256,8,ActivationType.Silu,torch.bfloat16,torch.float8_e4m3fnuz,torch.float8_e4m3fnuz,QuantType.per_1x128,1,1,ck,stage2,16,moe_ck2stages_gemm2_128x16x128x128_1x2_MulABScaleExpertWeightA8W8blkscale_v1_Nswizzle0_Quant4_MulRoutedWeight0_F8_F8_B16,137.9778,33.40622222222225,16.68%,81.71,10233.81,458521.875,14336.0,5.061164,63408882.0,0.0,0.0,29130752.0,14565376.0,218191.0,3897597.0,8638921.0,51317526.0,1918193.0,11.13943,36.478344,0.684712635,412776.0,910336.0,5510456.0,8193024.0,11323424.0,137188496.0,35840.0,214637877.0,14914945024.0
231,128,7168,256,256,8,ActivationType.Silu,torch.bfloat16,torch.float8_e4m3fnuz,torch.float8_e4m3fnuz,QuantType.per_1x128,1,0,asm,asm_1stage,32,_ZN5aiter47fmoe_bf16_blockscaleFp8_g1u1_vs_silu_1tg_32x128E,397.3418,0.0,0.00%,28.37,3553.71,1376564.25,28672.0,13.453028,134032911.0,0.0,0.0,174784512.0,87392256.0,335597.0,11470567.0,10931961.0,100950650.0,4362773.0,0.0,10.361248,0.0440113622,2131568.0,5462016.0,17798976.0,0.0,8103616.0,93914923.0,2304.0,138520485.0,89489670144.0
232,128,7168,256,257,9,ActivationType.Silu,torch.bfloat16,torch.float8_e4m3fnuz,torch.float8_e4m3fnuz,QuantType.per_Token,1,0,asm,asm_1stage,32,_ZN5aiter45fmoe_bf16_pertokenFp8_g1u1_vs_silu_1tg_32x256E,392.2254,0.0,0.00%,32.34,3614.1,1392735.5,17280.0,11.730286,148274474.0,0.0,0.0,175472640.0,87736320.0,153748.0,11418913.0,19722380.0,122708935.0,4938193.0,0.0,9.935735,0.156734877,1012860.0,5483520.0,12078320.0,0.0,4002480.0,45164364.0,1172.0,149659853.0,89841991680.0
233,128,7168,256,257,9,ActivationType.Silu,torch.bfloat16,torch.float8_e4m3fnuz,torch.float8_e4m3fnuz,QuantType.per_1x128,1,0,asm,asm_1stage,32,_ZN5aiter47fmoe_bf16_blockscaleFp8_g1u1_vs_silu_1tg_32x128E,400.7741,0.0,0.00%,31.65,3537.01,1382804.5625,32256.0,13.333699,136768887.0,0.0,0.0,175472640.0,87736320.0,347735.0,11578281.0,9943424.0,104002385.0,4377608.0,0.0,10.314471,0.0454946853,2139960.0,5483520.0,17869360.0,0.0,8135520.0,93643040.0,2344.0,138551085.0,89841991680.0
234,128,7168,512,256,8,ActivationType.Gelu,torch.bfloat16,torch.bfloat16,torch.bfloat16,QuantType.No,1,0,ck,stage1,32,moe_ck2stages_gemm1_256x32x64x128_1x4_TypeCast_v1_Nswizzle0_Quant0_MulRoutedWeight0_gelu_B16_B16_B16,970.3182,0.0,0.00%,23.24,5813.37,3652735.8125,1024.0,13.034644,410560034.0,228458496.0,0.0,0.0,228458496.0,291750.0,29229660.0,32096681.0,336801958.0,11508137.0,0.0580205025,32.320115,0.0163471655,4509888.0,14278656.0,19412674.0,254976.0,36206592.0,351018647.0,9216.0,1136267806.0,116970749952.0
234,128,7168,512,256,8,ActivationType.Gelu,torch.bfloat16,torch.bfloat16,torch.bfloat16,QuantType.No,1,0,ck,stage2,32,moe_ck2stages_gemm2_256x32x64x128_1x4_TypeCastExpertWeight_v1_Nswizzle0_Quant0_MulRoutedWeight1_B16_B16_B16,514.7343,0.0,3.35%,43.81,10958.69,1793806.875,14336.0,12.341544,216848748.0,114229248.0,0.0,0.0,114229248.0,967362.0,14579958.0,18768306.0,165042223.0,5879241.0,0.791486244,52.068794,0.264053356,5159840.0,7139328.0,24794336.0,1784832.0,40718720.0,696089873.0,129024.0,939337107.0,58485374976.0
235,128,7168,512,256,8,ActivationType.Gelu,torch.bfloat16,torch.bfloat16,torch.bfloat16,QuantType.No,1,1,ck,stage1,32,moe_ck2stages_gemm1_256x32x64x128_1x4_TypeCastExpertWeight_v1_Nswizzle0_Quant0_MulRoutedWeight1_gelu_B16_B16_B16,970.0338,0.0,0.00%,23.25,5815.07,3653252.75,1024.0,13.244508,406179219.0,228458496.0,0.0,0.0,228458496.0,295176.0,29229892.0,32447677.0,332180420.0,11343105.0,0.0588925321,32.715774,0.0151424642,4509888.0,14278656.0,19115232.0,254976.0,36206592.0,360518127.0,9216.0,1133147040.0,116970749952.0
235,128,7168,512,256,8,ActivationType.Gelu,torch.bfloat16,torch.bfloat16,torch.bfloat16,QuantType.No,1,1,ck,stage2,32,moe_ck2stages_gemm2_256x32x64x128_1x4_TypeCast_v1_Nswizzle0_Quant0_MulRoutedWeight0_B16_B16_B16,513.706,0.0,0.00%,43.89,10980.63,1793530.25,14336.0,12.305444,220922435.0,114229248.0,0.0,0.0,114229248.0,941535.0,14577784.0,19767104.0,172743137.0,6023615.0,0.775000778,50.869531,0.381417906,5159840.0,7139328.0,23567264.0,1784832.0,40718720.0,661021898.0,129024.0,937222971.0,58485374976.0
236,128,7168,512,256,8,ActivationType.Gelu,torch.bfloat16,torch.float8_e4m3fnuz,torch.float8_e4m3fnuz,QuantType.per_Tensor,1,0,asm,stage1,16,_ZN5aiter44fmoe_stage1_bf16_pertokenFp8_g1u1_16x512_pf3E,477.5428,34.230333333333334,0.00%,47.22,5908.0,1797019.25,1024.0,7.366087,149608090.0,0.0,0.0,114229248.0,57114624.0,289488.0,14386495.0,13556707.0,117881674.0,5149431.0,0.0,9.6659,8.70776733e-05,137448.0,3569664.0,4184048.0,0.0,972096.0,5769760.0,1280.0,151852378.0,58485374976.0
236,128,7168,512,256,8,ActivationType.Gelu,torch.bfloat16,torch.float8_e4m3fnuz,torch.float8_e4m3fnuz,QuantType.per_Tensor,1,0,ck,stage2,16,moe_ck2stages_gemm2_256x16x128x256_1x4_MulABScaleExpertWeight_v1_Nswizzle0_Quant1_MulRoutedWeight1_F8_F8_B16,264.6061,34.230333333333334,3.32%,85.22,10662.36,896933.25,28672.0,4.77072,139781283.0,0.0,0.0,57114624.0,28557312.0,291570.0,7634230.0,12519217.0,119289246.0,3092111.0,0.996179644,72.613722,0.693810164,911680.0,1784832.0,8050560.0,1180368.0,7281232.0,391153715.0,71680.0,688316922.0,29242687488.0
237,128,7168,512,256,8,ActivationType.Gelu,torch.bfloat16,torch.float8_e4m3fnuz,torch.float8_e4m3fnuz,QuantType.per_Tensor,1,1,asm,stage1,16,_ZN5aiter57fmoe_stage1_bf16_pertokenFp8_doweight_g1u1_16x256_2tg_pf3E,478.6453,36.60744444444445,0.07%,47.11,5894.4,1797398.0,1024.0,7.140476,164870068.0,0.0,0.0,114229248.0,57114624.0,334383.0,14387380.0,13477037.0,133233243.0,5002104.0,0.0,15.849536,0.00601671444,250992.0,3569664.0,4298440.0,0.0,1880448.0,60852984.0,2560.0,242445931.0,58485374976.0
237,128,7168,512,256,8,ActivationType.Gelu,torch.bfloat16,torch.float8_e4m3fnuz,torch.float8_e4m3fnuz,QuantType.per_Tensor,1,1,ck,stage2,16,moe_ck2stages_gemm2_256x16x128x256_1x4_MulABScaleExpertWeight_v1_Nswizzle0_Quant1_MulRoutedWeight0_F8_F8_B16,260.3153,36.60744444444445,0.00%,86.62,10838.11,896815.25,28672.0,5.123174,128125088.0,0.0,0.0,57114624.0,28557312.0,273832.0,7633247.0,12160766.0,108716372.0,2997756.0,1.008043,69.992251,0.716505682,911680.0,1784832.0,7604352.0,1180368.0,7281232.0,382518812.0,71680.0,655659544.0,29242687488.0
238,128,7168,512,256,8,ActivationType.Gelu,torch.bfloat16,torch.float8_e4m3fnuz,torch.float8_e4m3fnuz,QuantType.per_Token,1,0,asm,asm_1stage,32,_ZN5aiter48fmoe_bf16_pertokenFp8_g1u1_vs_gelu_1tg_ps_32x512E,754.5648,0.0,0.00%,29.88,3739.01,2723213.1875,14336.0,12.733939,261938485.0,0.0,0.0,342687744.0,171343872.0,108511.0,22015228.0,18983793.0,212863881.0,9079164.0,0.0,9.759217,0.0545243442,965124.0,10708992.0,17826012.0,0.0,3860496.0,9112500.0,1216.0,271109936.0,175456124928.0
239,128,7168,512,256,8,ActivationType.Gelu,torch.bfloat16,torch.float8_e4m3fnuz,torch.float8_e4m3fnuz,QuantType.per_Token,1,1,asm,asm_1stage,32,_ZN5aiter50fmoe_bf16_pertokenFp8_g1u1_vs_tkw1_gelu_1tg_32x512E,753.1522,0.0,0.00%,29.94,3746.02,2723240.5625,14336.0,14.296752,232239547.0,0.0,0.0,342687744.0,171343872.0,113475.0,22015535.0,22214854.0,183785930.0,9005958.0,0.0,9.605142,0.0657357621,965124.0,10708992.0,16993320.0,0.0,3860496.0,8886423.0,1152.0,266096242.0,175456124928.0
240,128,7168,512,256,8,ActivationType.Silu,torch.bfloat16,torch.bfloat16,torch.bfloat16,QuantType.No,1,1,ck,stage1,32,moe_ck2stages_gemm1_256x32x64x128_1x4_TypeCastExpertWeight_v1_Nswizzle0_Quant0_MulRoutedWeight1_silu_B16_B16_B16,970.347,0.0,0.00%,23.24,5813.19,3653212.9375,1024.0,13.278863,405123383.0,228458496.0,0.0,0.0,228458496.0,286019.0,29234831.0,33218183.0,331172299.0,11517616.0,0.0579990777,32.654485,0.0119392672,4509888.0,14278656.0,19696896.0,254976.0,36206592.0,358095658.0,9216.0,1148447232.0,116970749952.0
240,128,7168,512,256,8,ActivationType.Silu,torch.bfloat16,torch.bfloat16,torch.bfloat16,QuantType.No,1,1,ck,stage2,32,moe_ck2stages_gemm2_256x32x64x128_1x4_TypeCast_v1_Nswizzle0_Quant0_MulRoutedWeight0_B16_B16_B16,512.6071,0.0,0.00%,43.99,11004.17,1793531.0,14336.0,12.669194,216338129.0,114229248.0,0.0,0.0,114229248.0,941405.0,14577659.0,16380928.0,168085050.0,5710157.0,0.817557433,51.571283,0.373498365,5159840.0,7139328.0,23567264.0,1784832.0,40718720.0,633407170.0,129024.0,900693433.0,58485374976.0
241,128,7168,512,256,8,ActivationType.Silu,torch.bfloat16,torch.float8_e4m3fnuz,torch.float8_e4m3fnuz,QuantType.per_Tensor,1,0,asm,stage1,16,_ZN5aiter48fmoe_stage1_bf16_pertokenFp8_g1u1_16x512_2tg_pf2E,475.4989,36.55866666666665,0.00%,47.42,5933.4,1793628.625,1024.0,6.778307,162823192.0,0.0,0.0,114229248.0,57114624.0,176253.0,14357762.0,12075090.0,131505254.0,4902366.0,0.0,9.652185,9.11469938e-05,137448.0,3569664.0,4150184.0,0.0,972096.0,100042801.0,1280.0,144866968.0,58485374976.0
241,128,7168,512,256,8,ActivationType.Silu,torch.bfloat16,torch.float8_e4m3fnuz,torch.float8_e4m3fnuz,QuantType.per_Tensor,1,0,ck,stage2,16,moe_ck2stages_gemm2_256x16x128x256_1x4_MulABScaleExpertWeight_v1_Nswizzle0_Quant1_MulRoutedWeight1_F8_F8_B16,262.7453,36.55866666666665,2.82%,85.82,10737.87,896923.125,28672.0,4.829049,139549886.0,0.0,0.0,57114624.0,28557312.0,291798.0,7634153.0,13124793.0,119024273.0,3464035.0,0.872597748,71.543584,0.726349757,911680.0,1784832.0,8050560.0,1180368.0,7281232.0,441020762.0,71680.0,774219344.0,29242687488.0
242,128,7168,512,256,8,ActivationType.Silu,torch.bfloat16,torch.float8_e4m3fnuz,torch.float8_e4m3fnuz,QuantType.per_Tensor,1,1,asm,stage1,16,_ZN5aiter57fmoe_stage1_bf16_pertokenFp8_doweight_g1u1_16x256_2tg_pf3E,476.5689,35.52144444444447,0.04%,47.31,5920.08,1797292.125,1024.0,7.150237,164290569.0,0.0,0.0,114229248.0,57114624.0,333160.0,14387643.0,13311654.0,132768441.0,5584739.0,0.0,15.820704,0.0185030931,250992.0,3569664.0,4262584.0,0.0,1880448.0,67575804.0,2560.0,269871474.0,58485374976.0
242,128,7168,512,256,8,ActivationType.Silu,torch.bfloat16,torch.float8_e4m3fnuz,torch.float8_e4m3fnuz,QuantType.per_Tensor,1,1,ck,stage2,16,moe_ck2stages_gemm2_256x16x128x256_1x4_MulABScaleExpertWeight_v1_Nswizzle0_Quant1_MulRoutedWeight0_F8_F8_B16,259.4096,35.52144444444447,0.01%,86.92,10875.95,896814.125,28672.0,5.26245,125768123.0,0.0,0.0,57114624.0,28557312.0,273929.0,7633331.0,11684302.0,106184923.0,3370920.0,0.895584681,71.676759,0.754998581,911680.0,1784832.0,7604352.0,1180368.0,7281232.0,440212332.0,71680.0,755751668.0,29242687488.0
243,128,7168,512,256,8,ActivationType.Silu,torch.bfloat16,torch.float8_e4m3fnuz,torch.float8_e4m3fnuz,QuantType.per_Token,1,0,asm,asm_1stage,32,_ZN5aiter45fmoe_bf16_pertokenFp8_g1u1_vs_silu_1tg_32x512E,753.3052,0.0,0.00%,29.93,3745.26,2723237.125,15360.0,13.36332,246669018.0,0.0,0.0,342687744.0,171343872.0,106845.0,22031538.0,23041809.0,199611011.0,9157856.0,0.0,9.471525,0.0816396101,1012932.0,10708992.0,17598888.0,0.0,3987984.0,9588883.0,1152.0,265892653.0,175456124928.0
244,128,7168,512,256,8,ActivationType.Silu,torch.bfloat16,torch.float8_e4m3fnuz,torch.float8_e4m3fnuz,QuantType.per_Token,1,1,asm,asm_1stage,32,_ZN5aiter53fmoe_bf16_pertokenFp8_g1u1_vs_tkw1_silu_1tg_ps_32x512E,755.0254,0.0,0.00%,29.86,3736.73,2723217.5625,14336.0,13.792111,241169649.0,0.0,0.0,342687744.0,171343872.0,106964.0,22015080.0,23225723.0,192300617.0,9039671.0,0.0,9.652095,0.0718142577,965124.0,10708992.0,16869852.0,0.0,3860496.0,9247086.0,1216.0,267665323.0,175456124928.0
245,128,7168,512,256,8,ActivationType.Silu,torch.bfloat16,torch.bfloat16,torch.bfloat16,QuantType.No,1,0,ck,stage1,32,moe_ck2stages_gemm1_256x32x64x128_1x4_TypeCast_v1_Nswizzle0_Quant0_MulRoutedWeight0_silu_B16_B16_B16,969.1939,0.0,0.00%,23.27,5820.11,3652931.6875,1024.0,13.041357,413144085.0,228458496.0,0.0,0.0,228458496.0,287364.0,29230915.0,33116354.0,339429659.0,11328496.0,0.0588441076,32.437722,0.013235747,4509888.0,14278656.0,19577376.0,254976.0,36206592.0,346000681.0,9216.0,1124440951.0,116970749952.0
245,128,7168,512,256,8,ActivationType.Silu,torch.bfloat16,torch.bfloat16,torch.bfloat16,QuantType.No,1,0,ck,stage2,32,moe_ck2stages_gemm2_256x32x64x128_1x4_TypeCastExpertWeight_v1_Nswizzle0_Quant0_MulRoutedWeight1_B16_B16_B16,513.3346,0.0,2.84%,43.93,10988.57,1793812.25,14336.0,12.907367,212335981.0,114229248.0,0.0,0.0,114229248.0,967416.0,14579949.0,18911113.0,160566743.0,6063875.0,0.770053565,51.136928,0.301402743,5159840.0,7139328.0,24794336.0,1784832.0,40718720.0,704386110.0,129024.0,948202360.0,58485374976.0
246,128,7168,512,256,8,ActivationType.Gelu,torch.bfloat16,torch.float8_e4m3fnuz,torch.float8_e4m3fnuz,QuantType.per_1x128,1,0,asm,stage1,16,_ZN5aiter59fmoe_stage1_bf16_pertokenFp8_blockscale_g1u1_16x512_2tg_pf2E,474.6361,33.09,15.09%,47.51,5944.19,1798038.375,544.75,5.516619,198465593.0,0.0,0.0,114229248.0,57114624.0,333505.0,14387078.0,17889306.0,163514769.0,6822196.0,0.0,9.618603,0.000197130021,197208.0,3569664.0,8384429.0,0.0,1075680.0,134324032.0,1280.0,200247257.0,58485374976.0
246,128,7168,512,256,8,ActivationType.Gelu,torch.bfloat16,torch.float8_e4m3fnuz,torch.float8_e4m3fnuz,QuantType.per_1x128,1,0,ck,stage2,16,moe_ck2stages_gemm2_256x16x128x256_1x4_MulABScaleExpertWeightA8W8blkscale_v1_Nswizzle0_Quant4_MulRoutedWeight1_F8_F8_B16,259.7601,33.09,15.61%,86.81,10861.27,899259.1875,14336.0,5.498098,117746841.0,0.0,0.0,57114624.0,28557312.0,337391.0,7423481.0,9707047.0,93735256.0,3322114.0,7.728406,51.469478,0.459610078,800128.0,1784832.0,9056656.0,9816576.0,15917440.0,291628628.0,71680.0,523009809.0,29242687488.0
247,128,7168,512,256,8,ActivationType.Silu,torch.bfloat16,torch.float8_e4m3fnuz,torch.float8_e4m3fnuz,QuantType.per_1x128,1,0,asm,stage1,16,_ZN5aiter59fmoe_stage1_bf16_pertokenFp8_blockscale_g1u1_16x512_2tg_pf2E,473.7315,31.59400000000002,14.90%,47.6,5955.54,1797737.5,544.75,5.446615,201049136.0,0.0,0.0,114229248.0,57114624.0,330182.0,14388625.0,16614813.0,166229890.0,6929077.0,0.0,9.60302,0.000168893279,197208.0,3569664.0,8350565.0,0.0,1075680.0,136366042.0,1280.0,203098589.0,58485374976.0
247,128,7168,512,256,8,ActivationType.Silu,torch.bfloat16,torch.float8_e4m3fnuz,torch.float8_e4m3fnuz,QuantType.per_1x128,1,0,ck,stage2,16,moe_ck2stages_gemm2_256x16x128x256_1x4_MulABScaleExpertWeightA8W8blkscale_v1_Nswizzle0_Quant4_MulRoutedWeight1_F8_F8_B16,262.4004,31.59400000000002,15.58%,85.93,10751.98,899260.1875,14336.0,4.783742,141282332.0,0.0,0.0,57114624.0,28557312.0,338687.0,7423538.0,11350798.0,117068358.0,3848958.0,6.563246,50.556643,0.473993553,800128.0,1784832.0,9056656.0,9816576.0,15917440.0,338272084.0,71680.0,604936164.0,29242687488.0
248,128,7168,512,256,8,ActivationType.Gelu,torch.bfloat16,torch.float8_e4m3fnuz,torch.float8_e4m3fnuz,QuantType.per_1x128,1,1,ck,stage1,16,moe_ck2stages_gemm1_256x16x128x256_1x4_MulABScaleExpertWeightA8W8blkscale_v1_Nswizzle0_Quant4_MulRoutedWeight1_gelu_F8_F8_B16,485.0449,31.176222222222204,0.01%,46.49,5816.63,1811739.4375,1024.0,6.780724,188506818.0,0.0,0.0,114229248.0,57114624.0,263530.0,14502642.0,15801253.0,149881826.0,5248039.0,5.401497,27.448244,0.0205844448,1003968.0,3569664.0,7378368.0,10836480.0,15426048.0,107454833.0,5120.0,440533202.0,58485374976.0
248,128,7168,512,256,8,ActivationType.Gelu,torch.bfloat16,torch.float8_e4m3fnuz,torch.float8_e4m3fnuz,QuantType.per_1x128,1,1,ck,stage2,16,moe_ck2stages_gemm2_256x16x128x256_1x4_MulABScaleExpertWeightA8W8blkscale_v1_Nswizzle0_Quant4_MulRoutedWeight0_F8_F8_B16,259.2012,31.176222222222204,16.70%,86.99,10884.69,899123.75,14336.0,4.719353,142473134.0,0.0,0.0,57114624.0,28557312.0,325412.0,7422386.0,13392191.0,118598943.0,3217163.0,7.828324,49.366245,0.459680929,800128.0,1784832.0,8610448.0,9816576.0,15917440.0,279438551.0,71680.0,495234962.0,29242687488.0
249,128,7168,512,256,8,ActivationType.Silu,torch.bfloat16,torch.float8_e4m3fnuz,torch.float8_e4m3fnuz,QuantType.per_1x128,1,1,ck,stage1,16,moe_ck2stages_gemm1_256x16x128x256_1x4_MulABScaleExpertWeightA8W8blkscale_v1_Nswizzle0_Quant4_MulRoutedWeight1_silu_F8_F8_B16,488.3539,31.768777777777828,0.01%,46.17,5777.21,1811611.0,1024.0,6.988673,184887980.0,0.0,0.0,114229248.0,57114624.0,262242.0,14501250.0,14897650.0,146118003.0,5238846.0,5.412019,27.283151,0.0234190793,1003968.0,3569664.0,7669200.0,10836480.0,15426048.0,105605643.0,5120.0,437032221.0,58485374976.0
249,128,7168,512,256,8,ActivationType.Silu,torch.bfloat16,torch.float8_e4m3fnuz,torch.float8_e4m3fnuz,QuantType.per_1x128,1,1,ck,stage2,16,moe_ck2stages_gemm2_256x16x128x256_1x4_MulABScaleExpertWeightA8W8blkscale_v1_Nswizzle0_Quant4_MulRoutedWeight0_F8_F8_B16,258.4962,31.768777777777828,16.66%,87.23,10914.38,899122.0,14336.0,5.177377,125266637.0,0.0,0.0,57114624.0,28557312.0,326137.0,7422410.0,10094013.0,101440689.0,3143781.0,7.968219,49.875872,0.45413101,800128.0,1784832.0,8610448.0,9816576.0,15917440.0,277112838.0,71680.0,491563057.0,29242687488.0
250,128,7168,2048,33,10,ActivationType.Silu,torch.bfloat16,torch.float8_e4m3fnuz,torch.float8_e4m3fnuz,QuantType.per_1x128,1,0,asm,asm_1stage,32,_ZN5aiter52fmoe_bf16_blockscaleFp8_g1u1_novs_silu_1tg_ps_32x256E,525.1657,0.0,0.00%,214.68,2772.61,1436192.5,153600.0,32.059859,112375191.0,0.0,0.0,357826560.0,178913280.0,11974158.0,13945069.0,3400118.0,53247663.0,3583414.0,0.0,10.094943,0.07276599,2342080.0,11182080.0,28608448.0,0.0,8785920.0,18556131.0,1216.0,111646207.0,183207198720.0
251,128,7168,2048,33,10,ActivationType.Silu,torch.bfloat16,torch.float8_e4m3fnuz,torch.float8_e4m3fnuz,QuantType.per_Token,1,0,asm,asm_1stage,32,_ZN5aiter48fmoe_bf16_pertokenFp8_g1u1_vs_silu_1tg_ps_32x256E,485.3033,0.0,0.02%,232.31,3000.35,1441930.5,143360.0,31.303816,115517475.0,0.0,0.0,357826560.0,178913280.0,11893543.0,13829864.0,3345324.0,54125779.0,3730831.0,0.0,10.071251,0.00906847371,1965600.0,11182080.0,24641888.0,0.0,7895680.0,23483214.0,1216.0,115971039.0,183207198720.0
252,256,2048,192,128,8,ActivationType.Silu,torch.bfloat16,torch.bfloat16,torch.bfloat16,QuantType.No,1,0,ck,stage1,32,moe_ck2stages_gemm1_256x32x64x64_1x4_TypeCast_v1_Nswizzle0_Quant0_MulRoutedWeight0_silu_B16_B16_B16,60.3818,0.0,0.00%,80.02,5036.07,207303.9375,768.0,6.035738,40744807.0,12582912.0,0.0,0.0,12582912.0,129969.0,1665163.0,8510687.0,35051710.0,1357995.0,0.0937457373,12.310875,0.00264537227,254976.0,786432.0,1403904.0,49152.0,2064384.0,47466214.0,2304.0,51637902.0,6442450944.0
252,256,2048,192,128,8,ActivationType.Silu,torch.bfloat16,torch.bfloat16,torch.bfloat16,QuantType.No,1,0,ck,stage2,32,moe_ck2stages_gemm2_256x32x64x64_1x4_TypeCastExpertWeight_v1_Nswizzle0_Quant0_MulRoutedWeight1_B16_B16_B16,37.3211,0.0,0.00%,129.47,8147.86,105735.6875,8192.0,7.75929,13713928.0,6291456.0,0.0,0.0,6291456.0,230868.0,977535.0,994024.0,9121994.0,526472.0,1.278547,56.49094,0.330871451,353984.0,393216.0,2587008.0,262144.0,2726656.0,65248808.0,24576.0,92659965.0,3221225472.0
253,256,2048,192,128,8,ActivationType.Silu,torch.bfloat16,torch.bfloat16,torch.bfloat16,QuantType.No,1,1,ck,stage1,32,moe_ck2stages_gemm1_256x32x64x64_1x4_TypeCastExpertWeight_v1_Nswizzle0_Quant0_MulRoutedWeight1_silu_B16_B16_B16,60.5769,0.0,0.00%,79.76,5019.85,207384.25,768.0,4.846672,51571727.0,12582912.0,0.0,0.0,12582912.0,132003.0,1665440.0,13524451.0,45626088.0,1802725.0,0.0698519489,12.318065,0.00206562923,254976.0,786432.0,1426944.0,49152.0,2064384.0,65113043.0,2304.0,69341806.0,6442450944.0
253,256,2048,192,128,8,ActivationType.Silu,torch.bfloat16,torch.bfloat16,torch.bfloat16,QuantType.No,1,1,ck,stage2,32,moe_ck2stages_gemm2_256x32x64x64_1x4_TypeCast_v1_Nswizzle0_Quant0_MulRoutedWeight0_B16_B16_B16,36.3881,0.0,0.00%,132.79,8356.77,105607.25,8192.0,5.283852,22298972.0,6291456.0,0.0,0.0,6291456.0,227446.0,976077.0,1442458.0,18105478.0,764814.0,0.860809373,61.919907,0.630178438,353984.0,393216.0,2406784.0,262144.0,2726656.0,106037438.0,24576.0,150852745.0,3221225472.0
254,256,2048,192,128,8,ActivationType.Gelu,torch.bfloat16,torch.bfloat16,torch.bfloat16,QuantType.No,1,0,ck,stage1,32,moe_ck2stages_gemm1_256x32x64x64_1x4_TypeCast_v1_Nswizzle0_Quant0_MulRoutedWeight0_gelu_B16_B16_B16,60.0135,0.0,0.00%,80.51,5066.98,207384.625,768.0,5.938984,40869651.0,12582912.0,0.0,0.0,12582912.0,132441.0,1665150.0,8139448.0,35275328.0,1718534.0,0.0745834362,12.841525,0.00219113122,254976.0,786432.0,1289697.0,49152.0,2064384.0,63765814.0,2304.0,67702605.0,6442450944.0
254,256,2048,192,128,8,ActivationType.Gelu,torch.bfloat16,torch.bfloat16,torch.bfloat16,QuantType.No,1,0,ck,stage2,32,moe_ck2stages_gemm2_256x32x64x64_1x4_TypeCastExpertWeight_v1_Nswizzle0_Quant0_MulRoutedWeight1_B16_B16_B16,37.3748,0.0,0.00%,129.28,8136.15,105787.9375,8192.0,5.346369,22102758.0,6291456.0,0.0,0.0,6291456.0,231200.0,976969.0,1648920.0,17357812.0,540491.0,1.21417,55.985501,0.367408935,353984.0,393216.0,2587008.0,262144.0,2726656.0,66097872.0,24576.0,96699878.0,3221225472.0
255,256,2048,192,128,8,ActivationType.Gelu,torch.bfloat16,torch.bfloat16,torch.bfloat16,QuantType.No,1,1,ck,stage1,32,moe_ck2stages_gemm1_256x32x64x64_1x4_TypeCastExpertWeight_v1_Nswizzle0_Quant0_MulRoutedWeight1_gelu_B16_B16_B16,60.0667,0.0,0.00%,80.44,5062.49,207423.8125,768.0,6.476962,36673223.0,12582912.0,0.0,0.0,12582912.0,135896.0,1665010.0,6558120.0,30797821.0,1367982.0,0.0929711172,12.680203,0.00280320629,254976.0,786432.0,1314816.0,49152.0,2064384.0,49658535.0,2304.0,53630191.0,6442450944.0
255,256,2048,192,128,8,ActivationType.Gelu,torch.bfloat16,torch.bfloat16,torch.bfloat16,QuantType.No,1,1,ck,stage2,32,moe_ck2stages_gemm2_256x32x64x64_1x4_TypeCast_v1_Nswizzle0_Quant0_MulRoutedWeight0_B16_B16_B16,36.5103,0.0,0.00%,132.34,8328.8,105616.125,8192.0,7.63314,12600545.0,6291456.0,0.0,0.0,6291456.0,227576.0,975961.0,891871.0,8610518.0,462110.0,1.445044,53.515389,0.296768693,353984.0,393216.0,2406784.0,262144.0,2726656.0,50336626.0,24576.0,77665369.0,3221225472.0
256,256,4096,192,128,8,ActivationType.Silu,torch.bfloat16,torch.bfloat16,torch.bfloat16,QuantType.No,1,0,ck,stage1,32,moe_ck2stages_gemm1_256x32x64x128_1x4_TypeCast_v1_Nswizzle0_Quant0_MulRoutedWeight0_silu_B16_B16_B16,110.6202,0.0,0.00%,87.36,5497.86,421850.3125,768.0,7.090854,69246019.0,25165824.0,0.0,0.0,25165824.0,191417.0,3380530.0,10126180.0,59523826.0,2440822.0,0.0524754508,12.834989,0.00980765236,500736.0,1572864.0,2391552.0,49152.0,4030464.0,61796715.0,2304.0,96176837.0,12884901888.0
256,256,4096,192,128,8,ActivationType.Silu,torch.bfloat16,torch.bfloat16,torch.bfloat16,QuantType.No,1,0,ck,stage2,32,moe_ck2stages_gemm2_256x32x64x64_1x4_TypeCastExpertWeight_v1_Nswizzle0_Quant0_MulRoutedWeight1_B16_B16_B16,63.7093,0.0,0.08%,151.68,9546.08,204451.5,16384.0,10.925647,22101173.0,12582912.0,0.0,0.0,12582912.0,499890.0,1897887.0,3614945.0,13870270.0,1528097.0,0.886909798,78.223338,0.745597288,708416.0,786432.0,5171392.0,524288.0,5455104.0,283567209.0,49152.0,369927650.0,6442450944.0
257,256,4096,192,128,8,ActivationType.Silu,torch.bfloat16,torch.bfloat16,torch.bfloat16,QuantType.No,1,1,ck,stage1,32,moe_ck2stages_gemm1_256x32x64x64_1x4_TypeCastExpertWeight_v1_Nswizzle0_Quant0_MulRoutedWeight1_silu_B16_B16_B16,111.2407,0.0,0.00%,86.87,5467.19,418202.75,768.0,5.016891,102494116.0,25165824.0,0.0,0.0,25165824.0,214297.0,3351056.0,18941039.0,92523782.0,3189482.0,0.0402536979,13.505877,0.00122148418,500736.0,1572864.0,2336256.0,49152.0,4030464.0,124602857.0,2304.0,131931405.0,12884901888.0
257,256,4096,192,128,8,ActivationType.Silu,torch.bfloat16,torch.bfloat16,torch.bfloat16,QuantType.No,1,1,ck,stage2,32,moe_ck2stages_gemm2_256x32x64x64_1x4_TypeCast_v1_Nswizzle0_Quant0_MulRoutedWeight0_B16_B16_B16,62.5401,0.0,0.00%,154.52,9724.55,204318.0,16384.0,10.815676,22200086.0,12582912.0,0.0,0.0,12582912.0,492324.0,1896680.0,2985201.0,15021727.0,838281.0,1.593267,71.306448,0.572861333,708416.0,786432.0,4810944.0,524288.0,5455104.0,133657336.0,49152.0,187715536.0,6442450944.0
258,256,4096,192,128,8,ActivationType.Gelu,torch.bfloat16,torch.bfloat16,torch.bfloat16,QuantType.No,1,0,ck,stage1,32,moe_ck2stages_gemm1_256x32x64x128_1x4_TypeCast_v1_Nswizzle0_Quant0_MulRoutedWeight0_gelu_B16_B16_B16,110.6338,0.0,0.00%,87.35,5497.18,421840.0625,768.0,6.7989,70649295.0,25165824.0,0.0,0.0,25165824.0,194384.0,3380754.0,8742792.0,60856871.0,2492546.0,0.051411722,12.616956,0.0151138037,500736.0,1572864.0,2389401.0,49152.0,4030464.0,61805879.0,2304.0,96499177.0,12884901888.0
258,256,4096,192,128,8,ActivationType.Gelu,torch.bfloat16,torch.bfloat16,torch.bfloat16,QuantType.No,1,0,ck,stage2,32,moe_ck2stages_gemm2_256x32x64x64_1x4_TypeCastExpertWeight_v1_Nswizzle0_Quant0_MulRoutedWeight1_B16_B16_B16,63.8578,0.0,0.12%,151.33,9523.88,204439.375,16384.0,10.608548,23179682.0,12582912.0,0.0,0.0,12582912.0,498742.0,1897954.0,3730734.0,14952416.0,1500045.0,0.909174651,78.768959,0.756028193,708416.0,786432.0,5171392.0,524288.0,5455104.0,280561330.0,49152.0,363385581.0,6442450944.0
259,256,4096,192,128,8,ActivationType.Gelu,torch.bfloat16,torch.bfloat16,torch.bfloat16,QuantType.No,1,1,ck,stage1,32,moe_ck2stages_gemm1_256x32x64x128_1x4_TypeCastExpertWeight_v1_Nswizzle0_Quant0_MulRoutedWeight1_gelu_B16_B16_B16,110.4472,0.0,0.00%,87.5,5506.47,421810.3125,768.0,5.15671,97504079.0,25165824.0,0.0,0.0,25165824.0,194282.0,3381558.0,17320043.0,87498232.0,3155090.0,0.0407131696,13.033333,0.0176343389,500736.0,1572864.0,2302464.0,49152.0,4030464.0,82280463.0,2304.0,125878555.0,12884901888.0
259,256,4096,192,128,8,ActivationType.Gelu,torch.bfloat16,torch.bfloat16,torch.bfloat16,QuantType.No,1,1,ck,stage2,32,moe_ck2stages_gemm2_256x32x64x64_1x4_TypeCast_v1_Nswizzle0_Quant0_MulRoutedWeight0_B16_B16_B16,62.5176,0.0,0.00%,154.58,9728.05,204281.9375,16384.0,10.35307,23974079.0,12582912.0,0.0,0.0,12582912.0,491938.0,1896678.0,2876458.0,16768452.0,1529168.0,0.889843085,77.614272,0.872909712,708416.0,786432.0,4810944.0,524288.0,5455104.0,277883857.0,49152.0,365837369.0,6442450944.0
260,256,4096,384,128,8,ActivationType.Gelu,torch.bfloat16,torch.bfloat16,torch.bfloat16,QuantType.No,1,0,ck,stage1,32,moe_ck2stages_gemm1_256x32x64x128_1x4_TypeCast_v1_Nswizzle0_Quant0_MulRoutedWeight0_gelu_B16_B16_B16,219.3778,0.0,0.00%,88.1,5525.42,837006.375,1536.0,9.381177,112165089.0,50331648.0,0.0,0.0,50331648.0,420273.0,6707409.0,12000821.0,94553464.0,5376760.0,0.047767306,25.091834,0.0347783345,1001472.0,3145728.0,4778181.0,98304.0,8060928.0,127876133.0,4608.0,413107271.0,25769803776.0
260,256,4096,384,128,8,ActivationType.Gelu,torch.bfloat16,torch.bfloat16,torch.bfloat16,QuantType.No,1,0,ck,stage2,32,moe_ck2stages_gemm2_256x32x64x64_1x4_TypeCastExpertWeight_v1_Nswizzle0_Quant0_MulRoutedWeight1_B16_B16_B16,119.4378,0.0,0.52%,161.82,10148.83,405977.6875,16384.0,9.717557,56891682.0,25165824.0,0.0,0.0,25165824.0,727541.0,3510027.0,6377862.0,44496596.0,1649046.0,0.822306468,80.889487,0.525122061,1199296.0,1572864.0,6186176.0,524288.0,9384704.0,287999940.0,49152.0,412589603.0,12884901888.0
261,256,4096,384,128,8,ActivationType.Gelu,torch.bfloat16,torch.bfloat16,torch.bfloat16,QuantType.No,1,1,ck,stage1,32,moe_ck2stages_gemm1_256x32x64x64_1x4_TypeCastExpertWeight_v1_Nswizzle0_Quant0_MulRoutedWeight1_gelu_B16_B16_B16,217.2916,0.0,0.00%,88.95,5578.47,827166.0,1536.0,10.325744,103761960.0,50331648.0,0.0,0.0,50331648.0,489856.0,6626928.0,12682173.0,85971077.0,3157875.0,0.0812369167,27.436096,0.00177424784,1001472.0,3145728.0,4448256.0,98304.0,8060928.0,179953722.0,4608.0,265601218.0,25769803776.0
261,256,4096,384,128,8,ActivationType.Gelu,torch.bfloat16,torch.bfloat16,torch.bfloat16,QuantType.No,1,1,ck,stage2,32,moe_ck2stages_gemm2_256x32x64x128_1x4_TypeCast_v1_Nswizzle0_Quant0_MulRoutedWeight0_B16_B16_B16,121.0421,0.0,0.00%,159.67,10014.32,409072.625,16384.0,9.999797,54942968.0,25165824.0,0.0,0.0,25165824.0,955730.0,3534770.0,5476875.0,42051028.0,1555180.0,0.870393037,49.278695,0.592230272,1199296.0,1572864.0,7070912.0,524288.0,9384704.0,148481130.0,49152.0,237467233.0,12884901888.0
262,256,4096,384,128,8,ActivationType.Silu,torch.bfloat16,torch.bfloat16,torch.bfloat16,QuantType.No,1,0,ck,stage1,32,moe_ck2stages_gemm1_256x32x64x64_1x4_TypeCast_v1_Nswizzle0_Quant0_MulRoutedWeight0_silu_B16_B16_B16,219.3142,0.0,0.00%,88.13,5527.02,827646.8125,1536.0,9.818475,107688210.0,50331648.0,0.0,0.0,50331648.0,483536.0,6627342.0,9497548.0,90149375.0,3186662.0,0.0806487499,27.059253,0.00431777314,1001472.0,3145728.0,4626432.0,98304.0,8060928.0,176876107.0,4608.0,263863512.0,25769803776.0
262,256,4096,384,128,8,ActivationType.Silu,torch.bfloat16,torch.bfloat16,torch.bfloat16,QuantType.No,1,0,ck,stage2,32,moe_ck2stages_gemm2_256x32x64x128_1x4_TypeCastExpertWeight_v1_Nswizzle0_Quant0_MulRoutedWeight1_B16_B16_B16,120.4716,0.0,0.36%,160.43,10061.74,409243.0,16384.0,10.318794,53440989.0,25165824.0,0.0,0.0,25165824.0,963397.0,3536156.0,6487427.0,39541948.0,1508738.0,0.906265116,50.430357,0.48334612,1199296.0,1572864.0,7431360.0,524288.0,9384704.0,153106979.0,49152.0,233397758.0,12884901888.0
263,256,4096,384,128,8,ActivationType.Silu,torch.bfloat16,torch.bfloat16,torch.bfloat16,QuantType.No,1,1,ck,stage1,32,moe_ck2stages_gemm1_256x32x64x64_1x4_TypeCastExpertWeight_v1_Nswizzle0_Quant0_MulRoutedWeight1_silu_B16_B16_B16,218.3652,0.0,0.00%,88.51,5551.04,827279.5,1536.0,10.226478,104329926.0,50331648.0,0.0,0.0,50331648.0,482216.0,6631280.0,10251938.0,86646258.0,3355275.0,0.0766488389,26.911458,0.00790355383,1001472.0,3145728.0,4672512.0,98304.0,8060928.0,185321686.0,4608.0,276116798.0,25769803776.0
263,256,4096,384,128,8,ActivationType.Silu,torch.bfloat16,torch.bfloat16,torch.bfloat16,QuantType.No,1,1,ck,stage2,32,moe_ck2stages_gemm2_256x32x64x64_1x4_TypeCast_v1_Nswizzle0_Quant0_MulRoutedWeight0_B16_B16_B16,116.1157,0.0,0.00%,166.45,10439.19,405850.8125,16384.0,9.457637,58970879.0,25165824.0,0.0,0.0,25165824.0,719287.0,3509094.0,7092868.0,47689811.0,3184037.0,0.430776657,82.550657,0.704556155,1199296.0,1572864.0,5825728.0,524288.0,9384704.0,545149761.0,49152.0,803763489.0,12884901888.0
264,256,4096,384,128,8,ActivationType.Silu,torch.bfloat16,torch.float8_e4m3fnuz,torch.float8_e4m3fnuz,QuantType.per_Tensor,1,0,ck,stage1,32,moe_ck2stages_gemm1_256x32x64x128_1x4_MulABScale_v1_Nswizzle0_Quant1_MulRoutedWeight0_silu_F8_F8_B16,113.3048,39.086777777777726,0.00%,170.58,5358.34,409336.6875,1536.0,9.642669,51446354.0,0.0,0.0,50331648.0,25165824.0,294630.0,3285011.0,5792067.0,41666022.0,1587034.0,11.355919,25.797333,0.00440520981,795648.0,1572864.0,2912256.0,6955008.0,10985472.0,82600062.0,4608.0,126397983.0,25769803776.0
264,256,4096,384,128,8,ActivationType.Silu,torch.bfloat16,torch.float8_e4m3fnuz,torch.float8_e4m3fnuz,QuantType.per_Tensor,1,0,ck,stage2,32,moe_ck2stages_gemm2_256x32x64x128_1x4_MulABScaleExpertWeight_v1_Nswizzle0_Quant1_MulRoutedWeight1_F8_F8_B16,64.657,39.086777777777726,0.36%,298.92,9389.94,204464.75,16384.0,11.922378,19225518.0,0.0,0.0,25165824.0,12582912.0,506389.0,1897947.0,3037958.0,10594775.0,675964.0,19.512939,64.430077,0.287700545,904384.0,786432.0,5792960.0,5242880.0,10171136.0,86358707.0,49152.0,138492379.0,12884901888.0
265,256,4096,384,128,8,ActivationType.Silu,torch.bfloat16,torch.float8_e4m3fnuz,torch.float8_e4m3fnuz,QuantType.per_Tensor,1,1,ck,stage1,32,moe_ck2stages_gemm1_256x32x64x128_1x4_MulABScale_v1_Nswizzle0_Quant1_MulRoutedWeight1_silu_F8_F8_B16,114.9982,40.635888888888935,0.00%,168.07,5279.43,409291.125,1536.0,10.267498,48735811.0,0.0,0.0,50331648.0,25165824.0,292873.0,3288028.0,6573643.0,38935408.0,1602446.0,11.255247,25.161061,0.00828647401,795648.0,1572864.0,2976768.0,6955008.0,10985472.0,81142885.0,4608.0,124383147.0,25769803776.0
265,256,4096,384,128,8,ActivationType.Silu,torch.bfloat16,torch.float8_e4m3fnuz,torch.float8_e4m3fnuz,QuantType.per_Tensor,1,1,ck,stage2,32,moe_ck2stages_gemm2_256x32x64x128_1x4_MulABScaleExpertWeight_v1_Nswizzle0_Quant1_MulRoutedWeight0_F8_F8_B16,64.3656,40.635888888888935,0.00%,300.27,9432.45,204336.8125,16384.0,11.863602,19636365.0,0.0,0.0,25165824.0,12582912.0,497480.0,1896748.0,3206072.0,12028930.0,683964.0,19.441888,65.937286,0.371306661,904384.0,786432.0,5039296.0,5242880.0,10171136.0,94586405.0,49152.0,142250084.0,12884901888.0
266,256,4096,384,128,8,ActivationType.Silu,torch.bfloat16,torch.float8_e4m3fnuz,torch.float8_e4m3fnuz,QuantType.per_Token,1,0,asm,asm_1stage,32,_ZN5aiter45fmoe_bf16_pertokenFp8_g1u1_vs_silu_1tg_32x384E,172.2368,0.0,0.00%,112.21,3524.95,606366.5,18432.0,8.960056,40782541.0,0.0,0.0,75497472.0,37748736.0,103319.0,5146967.0,3735308.0,29275505.0,2622060.0,0.0,4.830498,0.0731208619,317952.0,2359296.0,4509184.0,0.0,1243136.0,2841078.0,768.0,38840132.0,38654705664.0
267,256,4096,384,128,8,ActivationType.Silu,torch.bfloat16,torch.float8_e4m3fnuz,torch.float8_e4m3fnuz,QuantType.per_Token,1,1,asm,asm_1stage,32,_ZN5aiter50fmoe_bf16_pertokenFp8_g1u1_vs_tkw1_silu_1tg_32x384E,177.5762,0.0,0.00%,108.84,3418.96,606151.1875,16384.0,8.623901,41170744.0,0.0,0.0,75497472.0,37748736.0,100985.0,5113034.0,3591767.0,29402234.0,2737717.0,0.0,4.825044,0.0697360822,293376.0,2359296.0,4279808.0,0.0,1177600.0,2592862.0,768.0,40432179.0,38654705664.0
268,256,4096,384,128,8,ActivationType.Gelu,torch.bfloat16,torch.float8_e4m3fnuz,torch.float8_e4m3fnuz,QuantType.per_Tensor,1,0,ck,stage1,32,moe_ck2stages_gemm1_256x32x64x256_1x4_MulABScale_v1_Nswizzle0_Quant1_MulRoutedWeight0_gelu_F8_F8_B16,114.9832,41.38811111111113,0.00%,168.09,5280.12,415186.75,1536.0,10.024645,49705432.0,0.0,0.0,50331648.0,25165824.0,257230.0,3332729.0,5010659.0,39897079.0,1621876.0,3.709259,23.750058,0.0641107776,602112.0,1572864.0,2952608.0,2310144.0,6340608.0,37891221.0,4608.0,118333199.0,25769803776.0
268,256,4096,384,128,8,ActivationType.Gelu,torch.bfloat16,torch.float8_e4m3fnuz,torch.float8_e4m3fnuz,QuantType.per_Tensor,1,0,ck,stage2,32,moe_ck2stages_gemm2_256x32x64x128_1x4_MulABScaleExpertWeight_v1_Nswizzle0_Quant1_MulRoutedWeight1_F8_F8_B16,64.4025,41.38811111111113,0.49%,300.1,9427.05,204473.5,16384.0,10.317765,19977258.0,0.0,0.0,25165824.0,12582912.0,507373.0,1897880.0,3007120.0,11281712.0,660280.0,20.269037,66.030463,0.277436624,904384.0,786432.0,5792960.0,5242880.0,10171136.0,85217499.0,49152.0,136637884.0,12884901888.0
269,256,4096,384,128,8,ActivationType.Gelu,torch.bfloat16,torch.float8_e4m3fnuz,torch.float8_e4m3fnuz,QuantType.per_Tensor,1,1,ck,stage1,32,moe_ck2stages_gemm1_256x32x64x128_1x4_MulABScale_v1_Nswizzle0_Quant1_MulRoutedWeight1_gelu_F8_F8_B16,114.6761,41.000333333333295,0.00%,168.54,5294.26,409556.6875,1536.0,10.160531,50063103.0,0.0,0.0,50331648.0,25165824.0,295865.0,3288284.0,5901461.0,40218412.0,1609248.0,11.251815,25.141517,0.0105432056,795648.0,1572864.0,2688000.0,6955008.0,10985472.0,81022239.0,4608.0,124324440.0,25769803776.0
269,256,4096,384,128,8,ActivationType.Gelu,torch.bfloat16,torch.float8_e4m3fnuz,torch.float8_e4m3fnuz,QuantType.per_Tensor,1,1,ck,stage2,32,moe_ck2stages_gemm2_256x32x64x128_1x4_MulABScaleExpertWeight_v1_Nswizzle0_Quant1_MulRoutedWeight0_F8_F8_B16,64.1884,41.000333333333295,0.00%,301.1,9458.49,204327.125,16384.0,11.815243,20169916.0,0.0,0.0,25165824.0,12582912.0,497892.0,1896839.0,3531781.0,12601618.0,698733.0,19.099545,65.092786,0.349783215,904384.0,786432.0,5039296.0,5242880.0,10171136.0,93868993.0,49152.0,142945258.0,12884901888.0
270,256,4096,384,128,8,ActivationType.Gelu,torch.bfloat16,torch.float8_e4m3fnuz,torch.float8_e4m3fnuz,QuantType.per_Token,1,0,asm,asm_1stage,32,_ZN5aiter45fmoe_bf16_pertokenFp8_g1u1_vs_gelu_1tg_32x384E,171.5362,0.0,0.00%,112.67,3539.34,606179.625,18432.0,8.947582,40539185.0,0.0,0.0,75497472.0,37748736.0,109015.0,5143361.0,3633147.0,29042244.0,2713848.0,0.0,4.750369,0.101750848,317952.0,2359296.0,4582912.0,0.0,1243136.0,2927045.0,768.0,39572600.0,38654705664.0
271,256,4096,384,128,8,ActivationType.Gelu,torch.bfloat16,torch.float8_e4m3fnuz,torch.float8_e4m3fnuz,QuantType.per_Token,1,1,asm,asm_1stage,32,_ZN5aiter50fmoe_bf16_pertokenFp8_g1u1_vs_tkw1_gelu_1tg_32x384E,175.8066,0.0,0.00%,109.94,3453.37,606217.4375,16384.0,8.780649,41749075.0,0.0,0.0,75497472.0,37748736.0,104956.0,5111633.0,3878641.0,29981112.0,2769908.0,0.0,4.848484,0.0535435858,293376.0,2359296.0,4353536.0,0.0,1177600.0,2602283.0,768.0,41064652.0,38654705664.0
272,256,4096,384,128,8,ActivationType.Silu,torch.bfloat16,torch.float8_e4m3fnuz,torch.float8_e4m3fnuz,QuantType.per_1x128,1,0,asm,asm_1stage,32,_ZN5aiter49fmoe_bf16_blockscaleFp8_g1u1_novs_silu_1tg_32x128E,205.3019,0.0,0.00%,94.14,2957.23,604384.0,49152.0,8.846432,73268230.0,0.0,0.0,75497472.0,37748736.0,353563.0,5622512.0,6111335.0,57442078.0,2600062.0,0.0,8.487332,0.0420800514,947712.0,2359296.0,7930368.0,0.0,3618816.0,43052246.0,2304.0,67845323.0,38654705664.0
273,256,4096,384,128,8,ActivationType.Gelu,torch.bfloat16,torch.float8_e4m3fnuz,torch.float8_e4m3fnuz,QuantType.per_1x128,1,0,asm,asm_1stage,32,_ZN5aiter47fmoe_bf16_blockscaleFp8_g1u1_vs_gelu_1tg_32x128E,205.91,0.0,0.16%,93.86,2948.5,604113.1875,49152.0,8.475565,78528887.0,0.0,0.0,75497472.0,37748736.0,360565.0,5616786.0,6081137.0,63004705.0,2634119.0,0.0,8.643612,0.0379567582,947712.0,2359296.0,8004096.0,0.0,3618816.0,48299106.0,2304.0,69954561.0,38654705664.0
274,256,4096,384,128,8,ActivationType.Silu,torch.bfloat16,torch.float8_e4m3fnuz,torch.float8_e4m3fnuz,QuantType.per_1x128,1,1,ck,stage1,32,moe_ck2stages_gemm1_256x32x128x128_1x4_MulABScaleExpertWeightA8W8blkscale_v1_Nswizzle0_Quant4_MulRoutedWeight1_silu_F8_F8_B16,120.0572,40.95911111111111,0.01%,160.98,5056.97,407350.8125,1536.0,8.95122,49759424.0,0.0,0.0,50331648.0,25165824.0,393878.0,3270649.0,4411901.0,36021957.0,1636560.0,6.082942,12.09649,0.0208374666,400896.0,1572864.0,3993600.0,3821568.0,5885952.0,40299498.0,2304.0,60796315.0,25769803776.0
274,256,4096,384,128,8,ActivationType.Silu,torch.bfloat16,torch.float8_e4m3fnuz,torch.float8_e4m3fnuz,QuantType.per_1x128,1,1,ck,stage2,32,moe_ck2stages_gemm2_256x32x128x128_1x4_MulABScaleExpertWeightA8W8blkscale_v1_Nswizzle0_Quant4_MulRoutedWeight0_F8_F8_B16,67.4052,40.95911111111111,16.66%,286.73,9007.1,204998.25,16384.0,11.060175,21708006.0,0.0,0.0,25165824.0,12582912.0,377278.0,1902190.0,2994234.0,12673377.0,728038.0,21.098094,32.550667,0.208566034,484960.0,786432.0,4681824.0,6029312.0,9017728.0,41628245.0,24576.0,74417388.0,12884901888.0
275,256,4096,384,128,8,ActivationType.Gelu,torch.bfloat16,torch.float8_e4m3fnuz,torch.float8_e4m3fnuz,QuantType.per_1x128,1,1,ck,stage1,32,moe_ck2stages_gemm1_256x32x128x128_1x4_MulABScaleExpertWeightA8W8blkscale_v1_Nswizzle0_Quant4_MulRoutedWeight1_gelu_F8_F8_B16,119.8958,40.53177777777783,0.01%,161.2,5063.78,407340.0625,1536.0,9.534892,48137661.0,0.0,0.0,50331648.0,25165824.0,398507.0,3271006.0,5429229.0,34446446.0,1836735.0,5.421409,11.924169,0.0278031146,400896.0,1572864.0,3764736.0,3821568.0,5885952.0,45802395.0,2304.0,67243062.0,25769803776.0
275,256,4096,384,128,8,ActivationType.Gelu,torch.bfloat16,torch.float8_e4m3fnuz,torch.float8_e4m3fnuz,QuantType.per_1x128,1,1,ck,stage2,32,moe_ck2stages_gemm2_256x32x128x128_1x4_MulABScaleExpertWeightA8W8blkscale_v1_Nswizzle0_Quant4_MulRoutedWeight0_F8_F8_B16,67.4479,40.53177777777783,16.68%,286.55,9001.4,205000.125,16384.0,10.888971,21396654.0,0.0,0.0,25165824.0,12582912.0,375219.0,1902193.0,2648436.0,12300637.0,721516.0,21.737942,33.80683,0.279043545,484960.0,786432.0,4681824.0,6029312.0,9017728.0,42817226.0,24576.0,75014251.0,12884901888.0
276,256,7168,256,256,8,ActivationType.Gelu,torch.bfloat16,torch.bfloat16,torch.bfloat16,QuantType.No,1,0,ck,stage1,32,moe_ck2stages_gemm1_256x32x64x128_1x4_TypeCast_v1_Nswizzle0_Quant0_MulRoutedWeight0_gelu_B16_B16_B16,512.2023,0.0,0.00%,44.02,5517.18,1917531.4375,1024.0,12.085655,217553988.0,117440512.0,0.0,0.0,117440512.0,292396.0,15347952.0,19210374.0,178734460.0,6572986.0,0.0522089743,29.325267,0.0170964156,2318336.0,7340032.0,10063426.0,131072.0,18612224.0,179313209.0,5120.0,588974826.0,60129542144.0
276,256,7168,256,256,8,ActivationType.Gelu,torch.bfloat16,torch.bfloat16,torch.bfloat16,QuantType.No,1,0,ck,stage2,32,moe_ck2stages_gemm2_256x32x64x128_1x4_TypeCastExpertWeight_v1_Nswizzle0_Quant0_MulRoutedWeight1_B16_B16_B16,271.4467,0.0,1.67%,83.07,10410.56,926299.125,28672.0,13.496505,99624981.0,58720256.0,0.0,0.0,58720256.0,950459.0,7869270.0,9565412.0,68307381.0,2814832.0,1.697066,61.89357,0.426887555,3022544.0,3670016.0,18333840.0,1835008.0,23558976.0,397706675.0,143360.0,535395423.0,30064771072.0
277,256,7168,256,256,8,ActivationType.Gelu,torch.bfloat16,torch.bfloat16,torch.bfloat16,QuantType.No,1,1,ck,stage1,32,moe_ck2stages_gemm1_256x32x64x128_1x4_TypeCastExpertWeight_v1_Nswizzle0_Quant0_MulRoutedWeight1_gelu_B16_B16_B16,498.7442,0.0,0.00%,45.21,5666.06,1917686.9375,1024.0,11.469975,227500030.0,117440512.0,0.0,0.0,117440512.0,290543.0,15351572.0,18721322.0,188745596.0,6440067.0,0.0532800845,29.472511,0.0218186076,2318336.0,7340032.0,9826327.0,131072.0,18612224.0,180896369.0,5120.0,580032251.0,60129542144.0
277,256,7168,256,256,8,ActivationType.Gelu,torch.bfloat16,torch.bfloat16,torch.bfloat16,QuantType.No,1,1,ck,stage2,32,moe_ck2stages_gemm2_256x32x64x128_1x4_TypeCast_v1_Nswizzle0_Quant0_MulRoutedWeight0_B16_B16_B16,268.7106,0.0,0.00%,83.91,10516.56,926018.9375,28672.0,13.257874,102627043.0,58720256.0,0.0,0.0,58720256.0,928218.0,7867006.0,9704187.0,75062352.0,2876278.0,1.662877,59.754032,0.669433785,3022544.0,3670016.0,17072272.0,1835008.0,23558976.0,386586454.0,143360.0,527515253.0,30064771072.0
278,256,7168,256,256,8,ActivationType.Gelu,torch.bfloat16,torch.float8_e4m3fnuz,torch.float8_e4m3fnuz,QuantType.per_Tensor,1,0,asm,stage1,16,_ZN5aiter48fmoe_stage1_bf16_pertokenFp8_g1u1_16x128_4tg_pf3E,243.4804,36.06466666666664,0.42%,92.61,5810.7,942751.9375,1024.0,5.076986,121160189.0,0.0,0.0,58949632.0,29474816.0,181824.0,7550570.0,11785856.0,103805618.0,3770804.0,0.0,18.139489,0.0182963918,246720.0,1842176.0,2333440.0,0.0,1907968.0,104425752.0,3072.0,209242095.0,30182211584.0
278,256,7168,256,256,8,ActivationType.Gelu,torch.bfloat16,torch.float8_e4m3fnuz,torch.float8_e4m3fnuz,QuantType.per_Tensor,1,0,ck,stage2,16,moe_ck2stages_gemm2_256x16x128x256_1x4_MulABScaleExpertWeight_v1_Nswizzle0_Quant1_MulRoutedWeight1_F8_F8_B16,147.2075,36.06466666666664,1.65%,153.18,9610.86,463188.0,57344.0,6.468433,49984752.0,0.0,0.0,29474816.0,14737408.0,290363.0,4623049.0,4991589.0,37134496.0,1514491.0,2.181096,77.101817,0.906339004,667520.0,921088.0,8175552.0,1273440.0,5325152.0,233694149.0,86016.0,360129188.0,15091105792.0
279,256,7168,256,256,8,ActivationType.Gelu,torch.bfloat16,torch.float8_e4m3fnuz,torch.float8_e4m3fnuz,QuantType.per_Tensor,1,1,ck,stage1,16,moe_ck2stages_gemm1_256x16x128x256_1x4_MulABScale_v1_Nswizzle0_Quant1_MulRoutedWeight1_gelu_F8_F8_B16,247.2308,36.21122222222223,0.00%,91.2,5722.55,942671.8125,1024.0,5.352828,113924921.0,0.0,0.0,58949632.0,29474816.0,106267.0,7549528.0,11120025.0,96186214.0,3672758.0,3.846051,16.718052,0.0166672265,522224.0,1842176.0,2660487.0,5394944.0,7763456.0,50848757.0,3072.0,187606354.0,30182211584.0
279,256,7168,256,256,8,ActivationType.Gelu,torch.bfloat16,torch.float8_e4m3fnuz,torch.float8_e4m3fnuz,QuantType.per_Tensor,1,1,ck,stage2,16,moe_ck2stages_gemm2_256x16x128x256_1x4_MulABScaleExpertWeight_v1_Nswizzle0_Quant1_MulRoutedWeight0_F8_F8_B16,146.92,36.21122222222223,0.00%,153.48,9629.67,463056.75,57344.0,5.75949,56593756.0,0.0,0.0,29474816.0,14737408.0,275419.0,4622018.0,3973927.0,44771277.0,1584282.0,2.079161,77.519613,0.942139269,667520.0,921088.0,7715008.0,1273440.0,5325152.0,251959770.0,86016.0,379832409.0,15091105792.0
280,256,7168,256,256,8,ActivationType.Gelu,torch.bfloat16,torch.float8_e4m3fnuz,torch.float8_e4m3fnuz,QuantType.per_Token,1,0,asm,asm_1stage,32,_ZN5aiter45fmoe_bf16_pertokenFp8_g1u1_vs_gelu_1tg_32x256E,396.3362,0.0,0.00%,56.89,3569.67,1403292.5,30720.0,12.125105,144104924.0,0.0,0.0,176160768.0,88080384.0,168517.0,11718623.0,14650099.0,117950106.0,4614478.0,0.0,9.871433,0.158885459,1016832.0,5505024.0,12225024.0,0.0,4018176.0,44565761.0,1280.0,139572346.0,90194313216.0
281,256,7168,256,256,8,ActivationType.Gelu,torch.bfloat16,torch.float8_e4m3fnuz,torch.float8_e4m3fnuz,QuantType.per_Token,1,1,asm,asm_1stage,32,_ZN5aiter53fmoe_bf16_pertokenFp8_g1u1_vs_tkw1_gelu_1tg_ps_32x256E,393.2068,0.0,0.00%,57.35,3598.08,1403290.375,28672.0,11.976905,145630605.0,0.0,0.0,176160768.0,88080384.0,163889.0,11684600.0,17722213.0,117865970.0,4652012.0,0.0,9.970572,0.0855313611,967680.0,5505024.0,11407360.0,0.0,3887104.0,34440067.0,1216.0,141654244.0,90194313216.0
282,256,7168,256,256,8,ActivationType.Silu,torch.bfloat16,torch.bfloat16,torch.bfloat16,QuantType.No,1,0,ck,stage1,32,moe_ck2stages_gemm1_256x32x64x128_1x4_TypeCast_v1_Nswizzle0_Quant0_MulRoutedWeight0_silu_B16_B16_B16,510.0698,0.0,0.00%,44.21,5540.25,1918029.9375,1024.0,11.610386,223639611.0,117440512.0,0.0,0.0,117440512.0,285369.0,15351778.0,18972193.0,184946170.0,6659272.0,0.0515255286,28.759852,0.0157783959,2318336.0,7340032.0,10063872.0,131072.0,18612224.0,178406510.0,5120.0,585280573.0,60129542144.0
282,256,7168,256,256,8,ActivationType.Silu,torch.bfloat16,torch.bfloat16,torch.bfloat16,QuantType.No,1,0,ck,stage2,32,moe_ck2stages_gemm2_256x32x64x64_1x4_TypeCastExpertWeight_v1_Nswizzle0_Quant0_MulRoutedWeight1_B16_B16_B16,271.217,0.0,1.33%,83.14,10419.38,926480.1875,28672.0,12.077222,112626577.0,58720256.0,0.0,0.0,58720256.0,925810.0,7871279.0,11420922.0,82636144.0,3008882.0,1.591983,79.853745,0.475743612,3022544.0,3670016.0,17301648.0,1835008.0,23558976.0,598332857.0,143360.0,736350880.0,30064771072.0
283,256,7168,256,256,8,ActivationType.Silu,torch.bfloat16,torch.bfloat16,torch.bfloat16,QuantType.No,1,1,ck,stage1,32,moe_ck2stages_gemm1_256x32x64x128_1x4_TypeCastExpertWeight_v1_Nswizzle0_Quant0_MulRoutedWeight1_silu_B16_B16_B16,510.6146,0.0,0.00%,44.16,5534.34,1917573.25,1024.0,11.4497,229649379.0,117440512.0,0.0,0.0,117440512.0,285437.0,15353153.0,21565403.0,190758055.0,6437388.0,0.0531988953,29.222136,0.0194525914,2318336.0,7340032.0,10125312.0,131072.0,18612224.0,175536088.0,5120.0,575982463.0,60129542144.0
283,256,7168,256,256,8,ActivationType.Silu,torch.bfloat16,torch.bfloat16,torch.bfloat16,QuantType.No,1,1,ck,stage2,32,moe_ck2stages_gemm2_256x32x64x128_1x4_TypeCast_v1_Nswizzle0_Quant0_MulRoutedWeight0_B16_B16_B16,269.6976,0.0,0.00%,83.61,10478.08,926017.4375,28672.0,13.224942,103642552.0,58720256.0,0.0,0.0,58720256.0,929685.0,7866989.0,10671804.0,75973660.0,2841684.0,1.682535,61.004988,0.620763149,3022544.0,3670016.0,17072272.0,1835008.0,23558976.0,388768882.0,143360.0,532266702.0,30064771072.0
284,256,7168,256,256,8,ActivationType.Silu,torch.bfloat16,torch.float8_e4m3fnuz,torch.float8_e4m3fnuz,QuantType.per_Tensor,1,0,asm,stage1,16,_ZN5aiter48fmoe_stage1_bf16_pertokenFp8_g1u1_16x128_4tg_pf3E,243.5237,34.511111111111155,0.85%,92.59,5809.67,942802.1875,1024.0,5.156631,119412432.0,0.0,0.0,58949632.0,29474816.0,182177.0,7550289.0,10305774.0,102006271.0,3712728.0,0.0,18.102428,0.0257455637,246720.0,1842176.0,2312880.0,0.0,1907968.0,102887827.0,3072.0,205521518.0,30182211584.0
284,256,7168,256,256,8,ActivationType.Silu,torch.bfloat16,torch.float8_e4m3fnuz,torch.float8_e4m3fnuz,QuantType.per_Tensor,1,0,ck,stage2,16,moe_ck2stages_gemm2_256x16x128x256_1x4_MulABScaleExpertWeight_v1_Nswizzle0_Quant1_MulRoutedWeight1_F8_F8_B16,136.5034,34.511111111111155,1.32%,165.19,10364.51,463192.5,57344.0,6.501432,49268975.0,0.0,0.0,29474816.0,14737408.0,289764.0,4623111.0,4011589.0,36412153.0,1546080.0,2.121362,75.770806,0.838265642,667520.0,921088.0,8175552.0,1273440.0,5325152.0,236122889.0,86016.0,363877840.0,15091105792.0
285,256,7168,256,256,8,ActivationType.Silu,torch.bfloat16,torch.float8_e4m3fnuz,torch.float8_e4m3fnuz,QuantType.per_Tensor,1,1,ck,stage1,16,moe_ck2stages_gemm1_256x16x128x256_1x4_MulABScale_v1_Nswizzle0_Quant1_MulRoutedWeight1_silu_F8_F8_B16,247.4836,35.50844444444439,0.00%,91.11,5716.71,942600.75,1024.0,5.364105,113819988.0,0.0,0.0,58949632.0,29474816.0,105351.0,7549166.0,11438886.0,95924372.0,3442264.0,4.075464,16.867256,0.0247733369,522224.0,1842176.0,2855784.0,5394944.0,7763456.0,48188825.0,3072.0,178625850.0,30182211584.0
285,256,7168,256,256,8,ActivationType.Silu,torch.bfloat16,torch.float8_e4m3fnuz,torch.float8_e4m3fnuz,QuantType.per_Tensor,1,1,ck,stage2,16,moe_ck2stages_gemm2_256x16x128x256_1x4_MulABScaleExpertWeight_v1_Nswizzle0_Quant1_MulRoutedWeight0_F8_F8_B16,143.0964,35.50844444444439,0.00%,157.58,9886.98,463054.25,57344.0,5.971089,54219003.0,0.0,0.0,29474816.0,14737408.0,275905.0,4621979.0,4601967.0,42330778.0,1618656.0,2.027908,75.06743,0.905147895,667520.0,921088.0,7715008.0,1273440.0,5325152.0,251268003.0,86016.0,377113304.0,15091105792.0
286,256,7168,256,256,8,ActivationType.Silu,torch.bfloat16,torch.float8_e4m3fnuz,torch.float8_e4m3fnuz,QuantType.per_Token,1,0,asm,asm_1stage,32,_ZN5aiter45fmoe_bf16_pertokenFp8_g1u1_vs_silu_1tg_32x256E,395.9336,0.0,0.00%,56.95,3573.3,1403320.6875,30720.0,12.494248,140141900.0,0.0,0.0,176160768.0,88080384.0,164780.0,11718800.0,17122897.0,114207555.0,4678552.0,0.0,9.933761,0.184595814,1016832.0,5505024.0,12126720.0,0.0,4018176.0,45072571.0,1280.0,142035772.0,90194313216.0
287,256,7168,256,256,8,ActivationType.Silu,torch.bfloat16,torch.float8_e4m3fnuz,torch.float8_e4m3fnuz,QuantType.per_Token,1,1,asm,asm_1stage,32,_ZN5aiter50fmoe_bf16_pertokenFp8_g1u1_vs_tkw1_silu_1tg_32x256E,394.7082,0.0,0.00%,57.13,3584.4,1403416.75,28672.0,12.440045,139570402.0,0.0,0.0,176160768.0,88080384.0,159297.0,11685916.0,18531304.0,112459984.0,4681276.0,0.0,9.887528,0.104199519,967680.0,5505024.0,11241984.0,0.0,3887104.0,34060204.0,1280.0,141817418.0,90194313216.0
288,256,7168,256,256,8,ActivationType.Gelu,torch.bfloat16,torch.float8_e4m3fnuz,torch.float8_e4m3fnuz,QuantType.per_1x128,1,0,asm,asm_1stage,32,_ZN5aiter47fmoe_bf16_blockscaleFp8_g1u1_vs_gelu_1tg_32x128E,411.4435,0.0,2.11%,54.8,3438.6,1397366.125,57344.0,13.013328,137466486.0,0.0,0.0,176160768.0,88080384.0,453345.0,12096074.0,10264645.0,104168791.0,4320386.0,0.0,10.228146,0.0244968159,2148352.0,5505024.0,18039808.0,0.0,8167424.0,89383213.0,2560.0,134957264.0,90194313216.0
289,256,7168,256,256,8,ActivationType.Gelu,torch.bfloat16,torch.float8_e4m3fnuz,torch.float8_e4m3fnuz,QuantType.per_1x128,1,1,ck,stage1,16,moe_ck2stages_gemm1_256x16x128x256_1x4_MulABScaleExpertWeightA8W8blkscale_v1_Nswizzle0_Quant4_MulRoutedWeight1_gelu_F8_F8_B16,251.8251,32.062222222222175,0.01%,89.54,5618.15,946310.4375,1024.75,5.270643,118432804.0,0.0,0.0,58949632.0,29474816.0,245302.0,7578996.0,10019552.0,97242032.0,3814783.0,3.839271,16.917647,0.0542238515,518112.0,1842176.0,3807735.0,5592320.0,7960832.0,68276617.0,3072.0,197139296.0,30182211584.0
289,256,7168,256,256,8,ActivationType.Gelu,torch.bfloat16,torch.float8_e4m3fnuz,torch.float8_e4m3fnuz,QuantType.per_1x128,1,1,ck,stage2,16,moe_ck2stages_gemm2_256x16x128x256_1x4_MulABScaleExpertWeightA8W8blkscale_v1_Nswizzle0_Quant4_MulRoutedWeight0_F8_F8_B16,142.5451,32.062222222222175,16.63%,158.19,9925.22,464317.625,28672.0,6.138516,52349250.0,0.0,0.0,29474816.0,14737408.0,434299.0,4173245.0,6037758.0,38368078.0,1517885.0,17.40037,75.762663,0.778782349,552384.0,921088.0,8147664.0,10131968.0,14183680.0,188131645.0,86016.0,352923479.0,15091105792.0
290,256,7168,256,256,8,ActivationType.Silu,torch.bfloat16,torch.float8_e4m3fnuz,torch.float8_e4m3fnuz,QuantType.per_1x128,1,1,ck,stage1,16,moe_ck2stages_gemm1_256x16x128x256_1x4_MulABScaleExpertWeightA8W8blkscale_v1_Nswizzle0_Quant4_MulRoutedWeight1_silu_F8_F8_B16,251.7734,32.904000000000025,0.01%,89.56,5619.3,946324.5,1024.0,5.373452,115525532.0,0.0,0.0,58949632.0,29474816.0,242462.0,7578427.0,10738242.0,94320556.0,3543770.0,4.133096,17.115458,0.0163592348,518112.0,1842176.0,3957800.0,5592320.0,7960832.0,63221031.0,3072.0,185265713.0,30182211584.0
290,256,7168,256,256,8,ActivationType.Silu,torch.bfloat16,torch.float8_e4m3fnuz,torch.float8_e4m3fnuz,QuantType.per_1x128,1,1,ck,stage2,16,moe_ck2stages_gemm2_128x16x128x128_1x2_MulABScaleExpertWeightA8W8blkscale_v1_Nswizzle0_Quant4_MulRoutedWeight0_F8_F8_B16,138.9036,32.904000000000025,16.67%,162.33,10185.42,464417.0,28672.0,5.717187,56429685.0,0.0,0.0,29474816.0,14737408.0,387247.0,4174069.0,8812217.0,43905291.0,1723877.0,12.516204,37.037149,0.833280741,423304.0,921088.0,6497736.0,8289792.0,11479776.0,121643849.0,43008.0,196244976.0,15091105792.0
291,256,7168,256,256,8,ActivationType.Silu,torch.bfloat16,torch.float8_e4m3fnuz,torch.float8_e4m3fnuz,QuantType.per_1x128,1,0,asm,asm_1stage,32,_ZN5aiter47fmoe_bf16_blockscaleFp8_g1u1_vs_silu_1tg_32x128E,416.9224,0.0,0.00%,54.08,3393.42,1397394.0,57344.0,13.506899,133200969.0,0.0,0.0,176160768.0,88080384.0,452024.0,12096115.0,9579839.0,99626982.0,4332890.0,0.0,10.202453,0.0386567219,2148352.0,5505024.0,17941504.0,0.0,8167424.0,89813074.0,2560.0,135312995.0,90194313216.0
292,256,7168,256,257,9,ActivationType.Silu,torch.bfloat16,torch.float8_e4m3fnuz,torch.float8_e4m3fnuz,QuantType.per_Token,1,0,asm,asm_1stage,32,_ZN5aiter45fmoe_bf16_pertokenFp8_g1u1_vs_silu_1tg_32x256E,402.9877,0.0,0.00%,62.95,3524.42,1409668.9375,34560.0,11.961763,145956567.0,0.0,0.0,176848896.0,88424448.0,172852.0,11831300.0,15853788.0,119942863.0,4716397.0,0.0,9.769462,0.17692417,1020804.0,5526528.0,12174400.0,0.0,4033872.0,44732168.0,1316.0,140925859.0,90546634752.0
293,256,7168,256,257,9,ActivationType.Silu,torch.bfloat16,torch.float8_e4m3fnuz,torch.float8_e4m3fnuz,QuantType.per_1x128,1,0,asm,asm_1stage,32,_ZN5aiter47fmoe_bf16_blockscaleFp8_g1u1_vs_silu_1tg_32x128E,417.4347,0.0,0.00%,60.77,3402.44,1404318.3125,64512.0,12.972823,139120890.0,0.0,0.0,176848896.0,88424448.0,477430.0,12267573.0,9843680.0,105556923.0,4357356.0,0.0,10.148301,0.0326392624,2156744.0,5526528.0,18012208.0,0.0,8199328.0,89560407.0,2632.0,135377168.0,90546634752.0
294,256,7168,512,256,8,ActivationType.Gelu,torch.bfloat16,torch.bfloat16,torch.bfloat16,QuantType.No,1,0,ck,stage1,32,moe_ck2stages_gemm1_256x32x64x128_1x4_TypeCast_v1_Nswizzle0_Quant0_MulRoutedWeight0_gelu_B16_B16_B16,1007.652,0.0,0.00%,44.75,5601.62,3839181.625,2048.0,13.829265,401267807.0,234881024.0,0.0,0.0,234881024.0,524169.0,30734168.0,29676004.0,325566428.0,11053193.0,0.062039562,32.826758,0.0193308009,4636672.0,14680064.0,20121723.0,262144.0,37224448.0,331253458.0,10240.0,1109658071.0,120259084288.0
294,256,7168,512,256,8,ActivationType.Gelu,torch.bfloat16,torch.bfloat16,torch.bfloat16,QuantType.No,1,0,ck,stage2,32,moe_ck2stages_gemm2_256x32x64x128_1x4_TypeCastExpertWeight_v1_Nswizzle0_Quant0_MulRoutedWeight1_B16_B16_B16,543.382,0.0,3.36%,82.99,10387.69,1852208.25,28672.0,13.488908,209098847.0,117440512.0,0.0,0.0,117440512.0,1819751.0,15276426.0,18100070.0,155865455.0,5989284.0,0.801827099,51.939638,0.372605462,5316864.0,7340032.0,26239584.0,1835008.0,41911296.0,697008407.0,143360.0,950924729.0,60129542144.0
295,256,7168,512,256,8,ActivationType.Gelu,torch.bfloat16,torch.bfloat16,torch.bfloat16,QuantType.No,1,1,ck,stage1,32,moe_ck2stages_gemm1_256x32x64x128_1x4_TypeCastExpertWeight_v1_Nswizzle0_Quant0_MulRoutedWeight1_gelu_B16_B16_B16,1007.7155,0.0,0.00%,44.75,5601.27,3839199.4375,2048.0,13.949178,400317578.0,234881024.0,0.0,0.0,234881024.0,539083.0,30722906.0,31019888.0,324358794.0,11237758.0,0.061052882,32.788309,0.01866272,4636672.0,14680064.0,19652608.0,262144.0,37224448.0,348594306.0,10240.0,1126270617.0,120259084288.0
295,256,7168,512,256,8,ActivationType.Gelu,torch.bfloat16,torch.bfloat16,torch.bfloat16,QuantType.No,1,1,ck,stage2,32,moe_ck2stages_gemm2_256x32x64x128_1x4_TypeCast_v1_Nswizzle0_Quant0_MulRoutedWeight0_B16_B16_B16,540.2325,0.0,0.00%,83.48,10448.25,1851914.375,28672.0,13.190767,212287597.0,117440512.0,0.0,0.0,117440512.0,1794266.0,15274206.0,17128408.0,162557120.0,6046068.0,0.794009427,51.368658,0.47915058,5316864.0,7340032.0,24978016.0,1835008.0,41911296.0,652182203.0,143360.0,949730766.0,60129542144.0
296,256,7168,512,256,8,ActivationType.Gelu,torch.bfloat16,torch.float8_e4m3fnuz,torch.float8_e4m3fnuz,QuantType.per_Tensor,1,0,asm,stage1,16,_ZN5aiter48fmoe_stage1_bf16_pertokenFp8_g1u1_16x512_2tg_pf2E,488.2971,42.5586666666666,0.00%,92.36,5783.52,1850681.625,2048.0,6.786911,174754657.0,0.0,0.0,117440512.0,58720256.0,192762.0,14824598.0,13715882.0,142559094.0,5286250.0,0.0,10.136588,0.00120554006,141312.0,3670016.0,4303872.0,0.0,999424.0,113733748.0,1536.0,163592614.0,60129542144.0
296,256,7168,512,256,8,ActivationType.Gelu,torch.bfloat16,torch.float8_e4m3fnuz,torch.float8_e4m3fnuz,QuantType.per_Tensor,1,0,ck,stage2,16,moe_ck2stages_gemm2_256x16x128x256_1x4_MulABScaleExpertWeight_v1_Nswizzle0_Quant1_MulRoutedWeight1_F8_F8_B16,277.6458,42.5586666666666,3.32%,162.43,10171.51,926149.25,57344.0,5.771542,118503143.0,0.0,0.0,58720256.0,29360128.0,492787.0,8326730.0,10101896.0,97457257.0,3471600.0,0.95391993,74.961579,0.787518425,951384.0,1835008.0,9153536.0,1268960.0,7597632.0,437609722.0,86016.0,797746158.0,30064771072.0
297,256,7168,512,256,8,ActivationType.Gelu,torch.bfloat16,torch.float8_e4m3fnuz,torch.float8_e4m3fnuz,QuantType.per_Tensor,1,1,asm,stage1,16,_ZN5aiter53fmoe_stage1_bf16_pertokenFp8_doweight_g1u1_16x512_pf3E,488.9697,43.194444444444414,0.00%,92.23,5775.57,1858569.125,2048.0,6.674096,176684955.0,0.0,0.0,117440512.0,58720256.0,280195.0,14881604.0,13656258.0,144054485.0,5139591.0,0.0,10.175152,0.00127863563,141312.0,3670016.0,4306944.0,0.0,999424.0,6018626.0,1536.0,159665701.0,60129542144.0
297,256,7168,512,256,8,ActivationType.Gelu,torch.bfloat16,torch.float8_e4m3fnuz,torch.float8_e4m3fnuz,QuantType.per_Tensor,1,1,ck,stage2,16,moe_ck2stages_gemm2_256x16x128x256_1x4_MulABScaleExpertWeight_v1_Nswizzle0_Quant1_MulRoutedWeight0_F8_F8_B16,275.0488,43.194444444444414,0.00%,163.96,10267.55,926076.875,57344.0,5.657259,117950485.0,0.0,0.0,58720256.0,29360128.0,475124.0,8326066.0,9847641.0,97748727.0,3241027.0,1.017743,74.230733,0.798080979,951384.0,1835008.0,8694784.0,1268960.0,7597632.0,411743505.0,86016.0,740429451.0,30064771072.0
298,256,7168,512,256,8,ActivationType.Gelu,torch.bfloat16,torch.float8_e4m3fnuz,torch.float8_e4m3fnuz,QuantType.per_Token,1,0,asm,asm_1stage,32,_ZN5aiter45fmoe_bf16_pertokenFp8_g1u1_vs_gelu_1tg_32x512E,777.8757,0.0,0.00%,57.97,3630.5,2803743.0625,30720.0,15.084367,236494294.0,0.0,0.0,352321536.0,176160768.0,141899.0,22921450.0,18569202.0,187926336.0,10390690.0,0.0,10.207854,0.0841078003,1041408.0,11010048.0,18291200.0,0.0,4100096.0,12083417.0,1280.0,326145751.0,180388626432.0
299,256,7168,512,256,8,ActivationType.Gelu,torch.bfloat16,torch.float8_e4m3fnuz,torch.float8_e4m3fnuz,QuantType.per_Token,1,1,asm,asm_1stage,32,_ZN5aiter50fmoe_bf16_pertokenFp8_g1u1_vs_tkw1_gelu_1tg_32x512E,795.0458,0.0,0.00%,56.72,3552.09,2803738.0,28672.0,11.0428,327226455.0,0.0,0.0,352321536.0,176160768.0,140820.0,22888736.0,31905666.0,277470312.0,9127218.0,0.0,10.208681,0.0806276792,992256.0,11010048.0,17472000.0,0.0,3969024.0,9724797.0,1280.0,285179727.0,180388626432.0
300,256,7168,512,256,8,ActivationType.Silu,torch.bfloat16,torch.bfloat16,torch.bfloat16,QuantType.No,1,1,ck,stage1,32,moe_ck2stages_gemm1_256x32x64x128_1x4_TypeCastExpertWeight_v1_Nswizzle0_Quant0_MulRoutedWeight1_silu_B16_B16_B16,1009.3589,0.0,0.00%,44.68,5592.15,3839664.4375,2048.0,13.996209,397082972.0,234881024.0,0.0,0.0,234881024.0,530872.0,30726894.0,33041770.0,321073736.0,11037262.0,0.0621557845,32.543099,0.0167090618,4636672.0,14680064.0,20250624.0,262144.0,37224448.0,334754811.0,10240.0,1098012459.0,120259084288.0
300,256,7168,512,256,8,ActivationType.Silu,torch.bfloat16,torch.bfloat16,torch.bfloat16,QuantType.No,1,1,ck,stage2,32,moe_ck2stages_gemm2_256x32x64x64_1x4_TypeCast_v1_Nswizzle0_Quant0_MulRoutedWeight0_B16_B16_B16,548.3061,0.0,0.00%,82.25,10294.4,1853418.5,28672.0,12.567486,224381013.0,117440512.0,0.0,0.0,117440512.0,1779868.0,15281518.0,20883894.0,176387006.0,6154426.0,0.781298485,76.903215,0.519233594,5316864.0,7340032.0,20849248.0,1835008.0,41911296.0,1055549537.0,143360.0,1444958787.0,60129542144.0
301,256,7168,512,256,8,ActivationType.Silu,torch.bfloat16,torch.float8_e4m3fnuz,torch.float8_e4m3fnuz,QuantType.per_Tensor,1,0,asm,stage1,16,_ZN5aiter48fmoe_stage1_bf16_pertokenFp8_g1u1_16x512_2tg_pf2E,490.0513,43.16322222222222,0.00%,92.03,5762.82,1850755.75,2048.0,7.483362,159099663.0,0.0,0.0,117440512.0,58720256.0,193248.0,14821248.0,9004116.0,126714312.0,5260757.0,0.0,10.132389,0.00121019041,141312.0,3670016.0,4269056.0,0.0,999424.0,113117879.0,1536.0,162896486.0,60129542144.0
