scripts/results/best_kernels_with_reference.csv
config_idx,token,model_dim,inter_dim,expert,topk,act_type,q_type,dtype,q_dtype_a,q_dtype_w,use_g1u1,doweight_stage1,approach,block_m,stage1_kernel_name,stage1_kernel_type,stage1_time_us,quant_time_us,stage2_kernel_name,stage2_kernel_type,stage2_time_us,total_time_us,theoretical_time_us,slowdown_factor
0,1,7168,256,256,8,ActivationType.Silu,QuantType.per_1x128,torch.bfloat16,torch.float8_e4m3fnuz,torch.float8_e4m3fnuz,1,0,2-stage,16,moe_ck2stages_gemm1_256x16x128x256_1x4_MulABScaleExpertWeightA8W8blkscale_v1_Nswizzle0_Quant4_MulRoutedWeight0_silu_F8_F8_B16,ck,35.831,23.94755555555562,moe_ck2stages_gemm2_256x16x128x256_1x4_MulABScaleExpertWeightA8W8blkscale_v1_Nswizzle0_Quant4_MulRoutedWeight1_F8_F8_B16,ck,8.9814,68.75995555555562,11.887247373588222,5.784346316232174
1,1,7168,256,257,9,ActivationType.Silu,QuantType.per_1x128,torch.bfloat16,torch.float8_e4m3fnuz,torch.float8_e4m3fnuz,1,0,2-stage,16,moe_ck2stages_gemm1_256x16x128x256_1x4_MulABScaleExpertWeightA8W8blkscale_v1_Nswizzle0_Quant4_MulRoutedWeight0_silu_F8_F8_B16,ck,34.7527,24.353111111111087,moe_ck2stages_gemm2_256x16x128x256_1x4_MulABScaleExpertWeightA8W8blkscale_v1_Nswizzle0_Quant4_MulRoutedWeight1_F8_F8_B16,ck,9.4023,68.50811111111108,13.372187257550902,5.123179162214203
2,2,7168,256,256,8,ActivationType.Silu,QuantType.per_1x128,torch.bfloat16,torch.float8_e4m3fnuz,torch.float8_e4m3fnuz,1,0,2-stage,16,moe_ck2stages_gemm1_256x16x128x256_1x4_MulABScaleExpertWeightA8W8blkscale_v1_Nswizzle0_Quant4_MulRoutedWeight0_silu_F8_F8_B16,ck,37.1006,21.614666666666785,moe_ck2stages_gemm2_256x16x128x256_1x4_MulABScaleExpertWeightA8W8blkscale_v1_Nswizzle0_Quant4_MulRoutedWeight1_F8_F8_B16,ck,14.114,72.82926666666678,11.90382304906324,6.118140900321768
3,2,7168,256,257,9,ActivationType.Silu,QuantType.per_1x128,torch.bfloat16,torch.float8_e4m3fnuz,torch.float8_e4m3fnuz,1,0,2-stage,16,moe_ck2stages_gemm1_256x16x128x256_1x4_MulABScaleExpertWeightA8W8blkscale_v1_Nswizzle0_Quant4_MulRoutedWeight0_silu_F8_F8_B16,ck,36.7983,22.430222222222174,moe_ck2stages_gemm2_256x16x128x256_1x4_MulABScaleExpertWeightA8W8blkscale_v1_Nswizzle0_Quant4_MulRoutedWeight1_F8_F8_B16,ck,15.2012,74.42972222222217,13.389868854724446,5.558659538025317
4,4,2304,1536,8,2,ActivationType.Gelu,QuantType.per_Token,torch.bfloat16,torch.float8_e4m3fnuz,torch.float8_e4m3fnuz,1,0,1-stage,32,_ZN5aiter45fmoe_bf16_pertokenFp8_g1u1_vs_gelu_1tg_32x192E,asm,34.4808,0.0,,,0.0,34.4808,5.754853781523533,5.9916031421517015
5,4,2304,1536,8,2,ActivationType.Gelu,QuantType.per_Token,torch.bfloat16,torch.float8_e4m3fnuz,torch.float8_e4m3fnuz,1,1,1-stage,32,_ZN5aiter50fmoe_bf16_pertokenFp8_g1u1_vs_tkw1_gelu_1tg_32x128E,asm,34.7698,0.0,,,0.0,34.7698,5.754853781523533,6.041821620495644
6,4,7168,256,256,8,ActivationType.Silu,QuantType.per_1x128,torch.bfloat16,torch.float8_e4m3fnuz,torch.float8_e4m3fnuz,1,0,2-stage,16,moe_ck2stages_gemm1_256x16x128x256_1x4_MulABScaleExpertWeightA8W8blkscale_v1_Nswizzle0_Quant4_MulRoutedWeight0_silu_F8_F8_B16,ck,40.9899,22.790888888888844,moe_ck2stages_gemm2_256x16x128x256_1x4_MulABScaleExpertWeightA8W8blkscale_v1_Nswizzle0_Quant4_MulRoutedWeight1_F8_F8_B16,ck,22.0268,85.80758888888884,11.93697440001327,7.188386773183786
7,4,7168,256,257,9,ActivationType.Silu,QuantType.per_1x128,torch.bfloat16,torch.float8_e4m3fnuz,torch.float8_e4m3fnuz,1,0,2-stage,16,moe_ck2stages_gemm1_256x16x128x256_1x4_MulABScaleExpertWeightA8W8blkscale_v1_Nswizzle0_Quant4_MulRoutedWeight0_silu_F8_F8_B16,ck,41.668,24.12488888888883,moe_ck2stages_gemm2_256x16x128x256_1x4_MulABScaleExpertWeightA8W8blkscale_v1_Nswizzle0_Quant4_MulRoutedWeight1_F8_F8_B16,ck,22.3393,88.13218888888883,13.425232049071532,6.564667825982488
8,8,7168,256,256,8,ActivationType.Silu,QuantType.per_1x128,torch.bfloat16,torch.float8_e4m3fnuz,torch.float8_e4m3fnuz,1,0,1-stage,32,_ZN5aiter47fmoe_bf16_blockscaleFp8_g1u1_vs_silu_1tg_32x256E,asm,113.3105,0.0,,,0.0,113.3105,12.003277101913332,9.439963689744214
9,8,7168,256,257,9,ActivationType.Silu,QuantType.per_1x128,torch.bfloat16,torch.float8_e4m3fnuz,torch.float8_e4m3fnuz,1,0,1-stage,32,_ZN5aiter47fmoe_bf16_blockscaleFp8_g1u1_vs_silu_1tg_32x256E,asm,120.5133,0.0,,,0.0,120.5133,13.495958437765706,8.929584405266686
10,16,2048,192,128,8,ActivationType.Silu,QuantType.No,torch.bfloat16,torch.bfloat16,torch.bfloat16,1,0,2-stage,32,moe_ck2stages_gemm1_256x32x64x128_1x4_TypeCast_v1_Nswizzle0_Quant0_MulRoutedWeight0_silu_B16_B16_B16,ck,36.3967,0.0,moe_ck2stages_gemm2_256x32x64x64_1x4_TypeCastExpertWeight_v1_Nswizzle0_Quant0_MulRoutedWeight1_B16_B16_B16,ck,23.4721,59.86880000000001,5.162557186919345,11.596733524171485
11,16,2048,192,128,8,ActivationType.Silu,QuantType.No,torch.bfloat16,torch.bfloat16,torch.bfloat16,1,1,2-stage,32,moe_ck2stages_gemm1_256x32x64x64_1x4_TypeCastExpertWeight_v1_Nswizzle0_Quant0_MulRoutedWeight1_silu_B16_B16_B16,ck,36.5808,0.0,moe_ck2stages_gemm2_256x32x64x64_1x4_TypeCast_v1_Nswizzle0_Quant0_MulRoutedWeight0_B16_B16_B16,ck,22.9748,59.5556,5.162557186919345,11.536065915337323
12,16,2048,192,128,8,ActivationType.Gelu,QuantType.No,torch.bfloat16,torch.bfloat16,torch.bfloat16,1,0,2-stage,32,moe_ck2stages_gemm1_256x32x64x128_1x4_TypeCast_v1_Nswizzle0_Quant0_MulRoutedWeight0_gelu_B16_B16_B16,ck,36.0875,0.0,moe_ck2stages_gemm2_256x32x64x64_1x4_TypeCastExpertWeight_v1_Nswizzle0_Quant0_MulRoutedWeight1_B16_B16_B16,ck,23.5049,59.5924,5.162557186919345,11.543194165672883
13,16,2048,192,128,8,ActivationType.Gelu,QuantType.No,torch.bfloat16,torch.bfloat16,torch.bfloat16,1,1,2-stage,32,moe_ck2stages_gemm1_256x32x64x64_1x4_TypeCastExpertWeight_v1_Nswizzle0_Quant0_MulRoutedWeight1_gelu_B16_B16_B16,ck,36.4283,0.0,moe_ck2stages_gemm2_256x32x64x64_1x4_TypeCast_v1_Nswizzle0_Quant0_MulRoutedWeight0_B16_B16_B16,ck,22.7363,59.1646,5.162557186919345,11.460328255522011
14,16,4096,192,128,8,ActivationType.Silu,QuantType.No,torch.bfloat16,torch.bfloat16,torch.bfloat16,1,0,2-stage,32,moe_ck2stages_gemm1_256x32x64x128_1x4_TypeCast_v1_Nswizzle0_Quant0_MulRoutedWeight0_silu_B16_B16_B16,ck,67.2355,0.0,moe_ck2stages_gemm2_256x32x64x64_1x4_TypeCastExpertWeight_v1_Nswizzle0_Quant0_MulRoutedWeight1_B16_B16_B16,ck,42.6288,109.8643,10.311865856318475,10.654163032258797
15,16,4096,192,128,8,ActivationType.Silu,QuantType.No,torch.bfloat16,torch.bfloat16,torch.bfloat16,1,1,2-stage,32,moe_ck2stages_gemm1_256x32x64x128_1x4_TypeCastExpertWeight_v1_Nswizzle0_Quant0_MulRoutedWeight1_silu_B16_B16_B16,ck,67.3825,0.0,moe_ck2stages_gemm2_256x32x64x64_1x4_TypeCast_v1_Nswizzle0_Quant0_MulRoutedWeight0_B16_B16_B16,ck,41.181,108.5635,10.311865856318475,10.528017093383637
16,16,4096,192,128,8,ActivationType.Gelu,QuantType.No,torch.bfloat16,torch.bfloat16,torch.bfloat16,1,0,2-stage,32,moe_ck2stages_gemm1_256x32x64x128_1x4_TypeCast_v1_Nswizzle0_Quant0_MulRoutedWeight0_gelu_B16_B16_B16,ck,67.213,0.0,moe_ck2stages_gemm2_256x32x64x64_1x4_TypeCastExpertWeight_v1_Nswizzle0_Quant0_MulRoutedWeight1_B16_B16_B16,ck,42.5635,109.7765,10.311865856318475,10.645648569287365
17,16,4096,192,128,8,ActivationType.Gelu,QuantType.No,torch.bfloat16,torch.bfloat16,torch.bfloat16,1,1,2-stage,32,moe_ck2stages_gemm1_256x32x64x128_1x4_TypeCastExpertWeight_v1_Nswizzle0_Quant0_MulRoutedWeight1_gelu_B16_B16_B16,ck,67.0844,0.0,moe_ck2stages_gemm2_256x32x64x64_1x4_TypeCast_v1_Nswizzle0_Quant0_MulRoutedWeight0_B16_B16_B16,ck,40.6917,107.7761,10.311865856318475,10.451658458489494
18,16,4096,384,128,8,ActivationType.Gelu,QuantType.No,torch.bfloat16,torch.bfloat16,torch.bfloat16,1,0,2-stage,32,moe_ck2stages_gemm1_256x32x64x128_1x4_TypeCast_v1_Nswizzle0_Quant0_MulRoutedWeight0_gelu_B16_B16_B16,ck,132.7853,0.0,moe_ck2stages_gemm2_256x32x64x128_1x4_TypeCastExpertWeight_v1_Nswizzle0_Quant0_MulRoutedWeight1_B16_B16_B16,ck,71.6405,204.4258,20.55307295252913,9.94624017888501
19,16,4096,384,128,8,ActivationType.Gelu,QuantType.No,torch.bfloat16,torch.bfloat16,torch.bfloat16,1,1,2-stage,32,moe_ck2stages_gemm1_256x32x64x128_1x4_TypeCastExpertWeight_v1_Nswizzle0_Quant0_MulRoutedWeight1_gelu_B16_B16_B16,ck,133.6881,0.0,moe_ck2stages_gemm2_256x32x64x128_1x4_TypeCast_v1_Nswizzle0_Quant0_MulRoutedWeight0_B16_B16_B16,ck,71.5024,205.1905,20.55307295252913,9.9834462940857
20,16,4096,384,128,8,ActivationType.Silu,QuantType.No,torch.bfloat16,torch.bfloat16,torch.bfloat16,1,0,2-stage,32,moe_ck2stages_gemm1_256x32x64x128_1x4_TypeCast_v1_Nswizzle0_Quant0_MulRoutedWeight0_silu_B16_B16_B16,ck,135.0934,0.0,moe_ck2stages_gemm2_256x32x64x128_1x4_TypeCastExpertWeight_v1_Nswizzle0_Quant0_MulRoutedWeight1_B16_B16_B16,ck,71.333,206.4264,20.55307295252913,10.043578421425224
21,16,4096,384,128,8,ActivationType.Silu,QuantType.No,torch.bfloat16,torch.bfloat16,torch.bfloat16,1,1,2-stage,32,moe_ck2stages_gemm1_256x32x64x128_1x4_TypeCastExpertWeight_v1_Nswizzle0_Quant0_MulRoutedWeight1_silu_B16_B16_B16,ck,133.0256,0.0,moe_ck2stages_gemm2_256x32x64x128_1x4_TypeCast_v1_Nswizzle0_Quant0_MulRoutedWeight0_B16_B16_B16,ck,71.6331,204.6587,20.55307295252913,9.957571817737163
22,16,4096,384,128,8,ActivationType.Silu,QuantType.per_Tensor,torch.bfloat16,torch.float8_e4m3fnuz,torch.float8_e4m3fnuz,1,0,2-stage,32,_ZN5aiter47fmoe_stage1_bf16_pertokenFp8_g1u1_32x64_4tg_pf2E,asm,72.6771,30.10133333333336,moe_ck2stages_gemm2_256x32x64x128_1x4_MulABScaleExpertWeight_v1_Nswizzle0_Quant1_MulRoutedWeight1_F8_F8_B16,ck,41.7749,144.55333333333334,10.378211497003525,13.92853993918604
23,16,4096,384,128,8,ActivationType.Silu,QuantType.per_Tensor,torch.bfloat16,torch.float8_e4m3fnuz,torch.float8_e4m3fnuz,1,1,2-stage,32,_ZN5aiter56fmoe_stage1_bf16_pertokenFp8_doweight_g1u1_32x64_4tg_pf2E,asm,72.5907,30.09677777777781,moe_ck2stages_gemm2_256x32x64x128_1x4_MulABScaleExpertWeight_v1_Nswizzle0_Quant1_MulRoutedWeight0_F8_F8_B16,ck,41.7576,144.4450777777778,10.378211497003525,13.918108897615266
24,16,4096,384,128,8,ActivationType.Silu,QuantType.per_Token,torch.bfloat16,torch.float8_e4m3fnuz,torch.float8_e4m3fnuz,1,0,1-stage,32,_ZN5aiter45fmoe_bf16_pertokenFp8_g1u1_vs_silu_1tg_32x192E,asm,112.5431,0.0,,,0.0,112.5431,10.378211497003525,10.844170985770939
25,16,4096,384,128,8,ActivationType.Silu,QuantType.per_Token,torch.bfloat16,torch.float8_e4m3fnuz,torch.float8_e4m3fnuz,1,1,1-stage,32,_ZN5aiter53fmoe_bf16_pertokenFp8_g1u1_vs_tkw1_silu_1tg_ps_32x192E,asm,116.2859,0.0,,,0.0,116.2859,10.378211497003525,11.204811159762444
26,16,4096,384,128,8,ActivationType.Gelu,QuantType.per_Tensor,torch.bfloat16,torch.float8_e4m3fnuz,torch.float8_e4m3fnuz,1,0,2-stage,32,_ZN5aiter47fmoe_stage1_bf16_pertokenFp8_g1u1_32x64_4tg_pf2E,asm,71.8798,28.52977777777778,moe_ck2stages_gemm2_256x32x64x128_1x4_MulABScaleExpertWeight_v1_Nswizzle0_Quant1_MulRoutedWeight1_F8_F8_B16,ck,41.3146,141.72417777777778,10.378211497003525,13.655934629844213
27,16,4096,384,128,8,ActivationType.Gelu,QuantType.per_Tensor,torch.bfloat16,torch.float8_e4m3fnuz,torch.float8_e4m3fnuz,1,1,2-stage,32,_ZN5aiter56fmoe_stage1_bf16_pertokenFp8_doweight_g1u1_32x64_4tg_pf2E,asm,73.0637,30.60833333333334,moe_ck2stages_gemm2_256x32x64x128_1x4_MulABScaleExpertWeight_v1_Nswizzle0_Quant1_MulRoutedWeight0_F8_F8_B16,ck,41.94,145.61203333333333,10.378211497003525,14.030551735756736
28,16,4096,384,128,8,ActivationType.Gelu,QuantType.per_Token,torch.bfloat16,torch.float8_e4m3fnuz,torch.float8_e4m3fnuz,1,0,1-stage,32,_ZN5aiter45fmoe_bf16_pertokenFp8_g1u1_vs_gelu_1tg_32x192E,asm,112.4285,0.0,,,0.0,112.4285,10.378211497003525,10.833128620712847
29,16,4096,384,128,8,ActivationType.Gelu,QuantType.per_Token,torch.bfloat16,torch.float8_e4m3fnuz,torch.float8_e4m3fnuz,1,1,1-stage,32,_ZN5aiter53fmoe_bf16_pertokenFp8_g1u1_vs_tkw1_gelu_1tg_ps_32x192E,asm,115.938,0.0,,,0.0,115.938,10.378211497003525,11.171289006152408
30,16,4096,384,128,8,ActivationType.Silu,QuantType.per_Tensor,torch.bfloat16,torch.float8_e4m3fnuz,torch.float8_e4m3fnuz,1,0,2-stage,32,_ZN5aiter47fmoe_stage1_bf16_pertokenFp8_g1u1_32x64_4tg_pf2E,asm,72.6554,30.70222222222221,moe_ck2stages_gemm2_256x32x64x128_1x4_MulABScaleExpertWeight_v1_Nswizzle0_Quant1_MulRoutedWeight1_F8_F8_B16,ck,41.9219,145.2795222222222,10.378211497003525,13.998512389554636
31,16,4096,384,128,8,ActivationType.Silu,QuantType.per_Tensor,torch.bfloat16,torch.float8_e4m3fnuz,torch.float8_e4m3fnuz,1,1,2-stage,32,_ZN5aiter56fmoe_stage1_bf16_pertokenFp8_doweight_g1u1_32x64_4tg_pf2E,asm,72.7426,31.15999999999997,moe_ck2stages_gemm2_256x32x64x128_1x4_MulABScaleExpertWeight_v1_Nswizzle0_Quant1_MulRoutedWeight0_F8_F8_B16,ck,41.7996,145.70219999999995,10.378211497003525,14.039239809486267
32,16,4096,384,128,8,ActivationType.Silu,QuantType.per_Token,torch.bfloat16,torch.float8_e4m3fnuz,torch.float8_e4m3fnuz,1,0,1-stage,32,_ZN5aiter45fmoe_bf16_pertokenFp8_g1u1_vs_silu_1tg_32x192E,asm,112.5919,0.0,,,0.0,112.5919,10.378211497003525,10.84887314471365
33,16,4096,384,128,8,ActivationType.Silu,QuantType.per_Token,torch.bfloat16,torch.float8_e4m3fnuz,torch.float8_e4m3fnuz,1,1,1-stage,32,_ZN5aiter50fmoe_bf16_pertokenFp8_g1u1_vs_tkw1_silu_1tg_32x192E,asm,115.6286,0.0,,,0.0,115.6286,10.378211497003525,11.14147654760988
34,16,4096,384,128,8,ActivationType.Gelu,QuantType.per_Tensor,torch.bfloat16,torch.float8_e4m3fnuz,torch.float8_e4m3fnuz,1,0,2-stage,32,_ZN5aiter47fmoe_stage1_bf16_pertokenFp8_g1u1_32x64_4tg_pf2E,asm,71.9227,28.297999999999902,moe_ck2stages_gemm2_256x32x64x128_1x4_MulABScaleExpertWeight_v1_Nswizzle0_Quant1_MulRoutedWeight1_F8_F8_B16,ck,41.5762,141.7968999999999,10.378211497003525,13.662941831638387
35,16,4096,384,128,8,ActivationType.Gelu,QuantType.per_Tensor,torch.bfloat16,torch.float8_e4m3fnuz,torch.float8_e4m3fnuz,1,1,2-stage,32,_ZN5aiter56fmoe_stage1_bf16_pertokenFp8_doweight_g1u1_32x64_4tg_pf2E,asm,71.8818,28.69044444444445,moe_ck2stages_gemm2_256x32x64x128_1x4_MulABScaleExpertWeight_v1_Nswizzle0_Quant1_MulRoutedWeight0_F8_F8_B16,ck,41.4687,142.04094444444445,10.378211497003525,13.686456908828228
36,16,4096,384,128,8,ActivationType.Gelu,QuantType.per_Token,torch.bfloat16,torch.float8_e4m3fnuz,torch.float8_e4m3fnuz,1,0,1-stage,32,_ZN5aiter45fmoe_bf16_pertokenFp8_g1u1_vs_gelu_1tg_32x192E,asm,113.0966,0.0,,,0.0,113.0966,10.378211497003525,10.897503874598634
37,16,4096,384,128,8,ActivationType.Gelu,QuantType.per_Token,torch.bfloat16,torch.float8_e4m3fnuz,torch.float8_e4m3fnuz,1,1,1-stage,32,_ZN5aiter50fmoe_bf16_pertokenFp8_g1u1_vs_tkw1_gelu_1tg_32x192E,asm,114.3657,0.0,,,0.0,114.3657,10.378211497003525,11.019788913823978
38,16,4096,384,128,8,ActivationType.Silu,QuantType.per_1x128,torch.bfloat16,torch.float8_e4m3fnuz,torch.float8_e4m3fnuz,1,0,2-stage,64,_ZN5aiter59fmoe_stage1_bf16_pertokenFp8_blockscale_g1u1_64x128_2tg_pf3E,asm,72.6068,24.73999999999992,moe_ck2stages_gemm2_256x64x128x128_1x4_MulABScaleExpertWeightA8W8blkscale_v3_Nswizzle0_Quant4_MulRoutedWeight1_F8_F8_B16,ck,75.8477,173.19449999999992,10.378211497003525,16.688280061550675
39,16,4096,384,128,8,ActivationType.Gelu,QuantType.per_1x128,torch.bfloat16,torch.float8_e4m3fnuz,torch.float8_e4m3fnuz,1,0,2-stage,64,_ZN5aiter59fmoe_stage1_bf16_pertokenFp8_blockscale_g1u1_64x128_2tg_pf2E,asm,69.8031,24.619555555555458,moe_ck2stages_gemm2_256x64x128x128_1x4_MulABScaleExpertWeightA8W8blkscale_v3_Nswizzle0_Quant4_MulRoutedWeight1_F8_F8_B16,ck,76.9618,171.38445555555546,10.378211497003525,16.51387193304346
40,16,4096,384,128,8,ActivationType.Silu,QuantType.per_1x128,torch.bfloat16,torch.float8_e4m3fnuz,torch.float8_e4m3fnuz,1,1,2-stage,64,moe_ck2stages_gemm1_256x64x128x128_1x4_MulABScaleExpertWeightA8W8blkscale_v3_Nswizzle0_Quant4_MulRoutedWeight1_silu_F8_F8_B16,ck,76.3644,24.81611111111107,moe_ck2stages_gemm2_256x64x128x128_1x4_MulABScaleExpertWeightA8W8blkscale_v3_Nswizzle0_Quant4_MulRoutedWeight0_F8_F8_B16,ck,74.1916,175.37211111111105,10.378211497003525,16.898105339416702
41,16,4096,384,128,8,ActivationType.Gelu,QuantType.per_1x128,torch.bfloat16,torch.float8_e4m3fnuz,torch.float8_e4m3fnuz,1,1,2-stage,64,moe_ck2stages_gemm1_256x64x128x128_1x4_MulABScaleExpertWeightA8W8blkscale_v3_Nswizzle0_Quant4_MulRoutedWeight1_gelu_F8_F8_B16,ck,76.1121,25.078888888888983,moe_ck2stages_gemm2_256x64x128x128_1x4_MulABScaleExpertWeightA8W8blkscale_v3_Nswizzle0_Quant4_MulRoutedWeight0_F8_F8_B16,ck,73.685,174.87598888888897,10.378211497003525,16.850301127451534
42,16,4096,384,128,8,ActivationType.Gelu,QuantType.per_1x128,torch.bfloat16,torch.float8_e4m3fnuz,torch.float8_e4m3fnuz,1,0,2-stage,64,_ZN5aiter59fmoe_stage1_bf16_pertokenFp8_blockscale_g1u1_64x128_2tg_pf3E,asm,72.1792,25.510333333333392,moe_ck2stages_gemm2_256x64x128x128_1x4_MulABScaleExpertWeightA8W8blkscale_v3_Nswizzle0_Quant4_MulRoutedWeight1_F8_F8_B16,ck,75.5406,173.23013333333338,10.378211497003525,16.691713536898884
43,16,4096,384,128,8,ActivationType.Silu,QuantType.per_1x128,torch.bfloat16,torch.float8_e4m3fnuz,torch.float8_e4m3fnuz,1,1,2-stage,64,moe_ck2stages_gemm1_256x64x128x128_1x4_MulABScaleExpertWeightA8W8blkscale_v3_Nswizzle0_Quant4_MulRoutedWeight1_silu_F8_F8_B16,ck,76.1099,25.17211111111116,moe_ck2stages_gemm2_256x64x128x128_1x4_MulABScaleExpertWeightA8W8blkscale_v3_Nswizzle0_Quant4_MulRoutedWeight0_F8_F8_B16,ck,73.256,174.53801111111116,10.378211497003525,16.817735036668417
44,16,4096,384,128,8,ActivationType.Gelu,QuantType.per_1x128,torch.bfloat16,torch.float8_e4m3fnuz,torch.float8_e4m3fnuz,1,1,2-stage,64,moe_ck2stages_gemm1_256x64x128x128_1x4_MulABScaleExpertWeightA8W8blkscale_v3_Nswizzle0_Quant4_MulRoutedWeight1_gelu_F8_F8_B16,ck,76.2076,24.606000000000044,moe_ck2stages_gemm2_256x64x128x128_1x4_MulABScaleExpertWeightA8W8blkscale_v3_Nswizzle0_Quant4_MulRoutedWeight0_F8_F8_B16,ck,73.202,174.01560000000003,10.378211497003525,16.76739773999047
45,16,5120,1024,128,1,ActivationType.Silu,QuantType.per_Token,torch.bfloat16,torch.float8_e4m3fnuz,torch.float8_e4m3fnuz,1,1,1-stage,32,_ZN5aiter50fmoe_bf16_pertokenFp8_g1u1_vs_tkw1_silu_1tg_32x128E,asm,91.3748,0.0,,,0.0,91.3748,4.380929004254614,20.85740259914274
46,16,7168,256,256,8,ActivationType.Gelu,QuantType.No,torch.bfloat16,torch.bfloat16,torch.bfloat16,1,0,2-stage,32,moe_ck2stages_gemm1_256x32x64x128_1x4_TypeCast_v1_Nswizzle0_Quant0_MulRoutedWeight0_gelu_B16_B16_B16,ck,197.9067,0.0,moe_ck2stages_gemm2_256x32x64x128_1x4_TypeCastExpertWeight_v1_Nswizzle0_Quant0_MulRoutedWeight1_B16_B16_B16,ck,109.9357,307.8424,24.006554203826663,12.823264737882694
47,16,7168,256,256,8,ActivationType.Gelu,QuantType.No,torch.bfloat16,torch.bfloat16,torch.bfloat16,1,1,2-stage,32,moe_ck2stages_gemm1_256x32x64x128_1x4_TypeCastExpertWeight_v1_Nswizzle0_Quant0_MulRoutedWeight1_gelu_B16_B16_B16,ck,198.377,0.0,moe_ck2stages_gemm2_256x32x64x128_1x4_TypeCast_v1_Nswizzle0_Quant0_MulRoutedWeight0_B16_B16_B16,ck,105.5749,303.9519,24.006554203826663,12.661204828452634
48,16,7168,256,256,8,ActivationType.Gelu,QuantType.per_Tensor,torch.bfloat16,torch.float8_e4m3fnuz,torch.float8_e4m3fnuz,1,0,2-stage,32,_ZN5aiter48fmoe_stage1_bf16_pertokenFp8_g1u1_32x128_3tg_pf3E,asm,105.4552,27.58644444444439,moe_ck2stages_gemm2_256x32x64x256_1x4_MulABScaleExpertWeight_v1_Nswizzle0_Quant1_MulRoutedWeight1_F8_F8_B16,ck,58.9635,192.0051444444444,12.135882505713456,15.821275820200981
49,16,7168,256,256,8,ActivationType.Gelu,QuantType.per_Tensor,torch.bfloat16,torch.float8_e4m3fnuz,torch.float8_e4m3fnuz,1,1,2-stage,32,_ZN5aiter57fmoe_stage1_bf16_pertokenFp8_doweight_g1u1_32x128_3tg_pf3E,asm,105.9332,25.792333333333342,moe_ck2stages_gemm2_256x32x64x256_1x4_MulABScaleExpertWeight_v1_Nswizzle0_Quant1_MulRoutedWeight0_F8_F8_B16,ck,58.1094,189.8349333333333,12.135882505713456,15.642449837822744
50,16,7168,256,256,8,ActivationType.Gelu,QuantType.per_Token,torch.bfloat16,torch.float8_e4m3fnuz,torch.float8_e4m3fnuz,1,0,1-stage,32,_ZN5aiter45fmoe_bf16_pertokenFp8_g1u1_vs_gelu_1tg_32x256E,asm,167.8377,0.0,,,0.0,167.8377,12.135882505713456,13.829871863128508
51,16,7168,256,256,8,ActivationType.Gelu,QuantType.per_Token,torch.bfloat16,torch.float8_e4m3fnuz,torch.float8_e4m3fnuz,1,1,1-stage,32,_ZN5aiter50fmoe_bf16_pertokenFp8_g1u1_vs_tkw1_gelu_1tg_32x128E,asm,168.6649,0.0,,,0.0,168.6649,12.135882505713456,13.898033366802471
52,16,7168,256,256,8,ActivationType.Silu,QuantType.No,torch.bfloat16,torch.bfloat16,torch.bfloat16,1,0,2-stage,32,moe_ck2stages_gemm1_256x32x64x128_1x4_TypeCast_v1_Nswizzle0_Quant0_MulRoutedWeight0_silu_B16_B16_B16,ck,199.3677,0.0,moe_ck2stages_gemm2_256x32x64x64_1x4_TypeCastExpertWeight_v1_Nswizzle0_Quant0_MulRoutedWeight1_B16_B16_B16,ck,106.6281,305.99580000000003,24.006554203826663,12.746344077619606
53,16,7168,256,256,8,ActivationType.Silu,QuantType.No,torch.bfloat16,torch.bfloat16,torch.bfloat16,1,1,2-stage,32,moe_ck2stages_gemm1_256x32x64x128_1x4_TypeCastExpertWeight_v1_Nswizzle0_Quant0_MulRoutedWeight1_silu_B16_B16_B16,ck,201.466,0.0,moe_ck2stages_gemm2_256x32x64x128_1x4_TypeCast_v1_Nswizzle0_Quant0_MulRoutedWeight0_B16_B16_B16,ck,105.6531,307.1191,24.006554203826663,12.793135465940589
54,16,7168,256,256,8,ActivationType.Silu,QuantType.per_Tensor,torch.bfloat16,torch.float8_e4m3fnuz,torch.float8_e4m3fnuz,1,0,2-stage,32,_ZN5aiter48fmoe_stage1_bf16_pertokenFp8_g1u1_32x128_3tg_pf3E,asm,104.8755,26.602111111111167,moe_ck2stages_gemm2_256x32x64x256_1x4_MulABScaleExpertWeight_v1_Nswizzle0_Quant1_MulRoutedWeight1_F8_F8_B16,ck,59.3258,190.8034111111112,12.135882505713456,15.722252668586961
55,16,7168,256,256,8,ActivationType.Silu,QuantType.per_Tensor,torch.bfloat16,torch.float8_e4m3fnuz,torch.float8_e4m3fnuz,1,1,2-stage,32,_ZN5aiter56fmoe_stage1_bf16_pertokenFp8_doweight_g1u1_32x64_4tg_pf2E,asm,105.1878,27.65688888888887,moe_ck2stages_gemm2_256x32x64x256_1x4_MulABScaleExpertWeight_v1_Nswizzle0_Quant1_MulRoutedWeight0_F8_F8_B16,ck,58.3062,191.1508888888889,12.135882505713456,15.75088493143345
56,16,7168,256,256,8,ActivationType.Silu,QuantType.per_Token,torch.bfloat16,torch.float8_e4m3fnuz,torch.float8_e4m3fnuz,1,0,1-stage,32,_ZN5aiter45fmoe_bf16_pertokenFp8_g1u1_vs_silu_1tg_32x256E,asm,168.6587,0.0,,,0.0,168.6587,12.135882505713456,13.897522485126
57,16,7168,256,256,8,ActivationType.Silu,QuantType.per_Token,torch.bfloat16,torch.float8_e4m3fnuz,torch.float8_e4m3fnuz,1,1,1-stage,32,_ZN5aiter50fmoe_bf16_pertokenFp8_g1u1_vs_tkw1_silu_1tg_32x128E,asm,169.4447,0.0,,,0.0,169.4447,12.135882505713456,13.96228909765953
58,16,7168,256,256,8,ActivationType.Silu,QuantType.per_Tensor,torch.bfloat16,torch.float8_e4m3fnuz,torch.float8_e4m3fnuz,1,0,2-stage,32,_ZN5aiter47fmoe_stage1_bf16_pertokenFp8_g1u1_32x64_4tg_pf2E,asm,105.2904,27.007666666666665,moe_ck2stages_gemm2_256x32x64x256_1x4_MulABScaleExpertWeight_v1_Nswizzle0_Quant1_MulRoutedWeight1_F8_F8_B16,ck,59.199,191.49706666666668,12.135882505713456,15.779410073928428
59,16,7168,256,256,8,ActivationType.Silu,QuantType.per_Tensor,torch.bfloat16,torch.float8_e4m3fnuz,torch.float8_e4m3fnuz,1,1,2-stage,32,_ZN5aiter57fmoe_stage1_bf16_pertokenFp8_doweight_g1u1_32x128_3tg_pf2E,asm,105.5689,27.31922222222225,moe_ck2stages_gemm2_256x32x64x256_1x4_MulABScaleExpertWeight_v1_Nswizzle0_Quant1_MulRoutedWeight0_F8_F8_B16,ck,58.6024,191.49052222222224,12.135882505713456,15.778870809936596
60,16,7168,256,256,8,ActivationType.Silu,QuantType.per_Token,torch.bfloat16,torch.float8_e4m3fnuz,torch.float8_e4m3fnuz,1,0,1-stage,32,_ZN5aiter45fmoe_bf16_pertokenFp8_g1u1_vs_silu_1tg_32x256E,asm,167.7977,0.0,,,0.0,167.7977,12.135882505713456,13.82657585231255
61,16,7168,256,256,8,ActivationType.Silu,QuantType.per_Token,torch.bfloat16,torch.float8_e4m3fnuz,torch.float8_e4m3fnuz,1,1,1-stage,32,_ZN5aiter53fmoe_bf16_pertokenFp8_g1u1_vs_tkw1_silu_1tg_ps_32x128E,asm,167.6459,0.0,,,0.0,167.6459,12.135882505713456,13.814067491266
62,16,7168,256,256,8,ActivationType.Gelu,QuantType.per_Tensor,torch.bfloat16,torch.float8_e4m3fnuz,torch.float8_e4m3fnuz,1,0,2-stage,32,_ZN5aiter48fmoe_stage1_bf16_pertokenFp8_g1u1_32x128_3tg_pf3E,asm,105.9611,26.388333333333208,moe_ck2stages_gemm2_256x32x64x256_1x4_MulABScaleExpertWeight_v1_Nswizzle0_Quant1_MulRoutedWeight1_F8_F8_B16,ck,59.3619,191.7113333333332,12.135882505713456,15.797065705199218
63,16,7168,256,256,8,ActivationType.Gelu,QuantType.per_Tensor,torch.bfloat16,torch.float8_e4m3fnuz,torch.float8_e4m3fnuz,1,1,2-stage,32,_ZN5aiter57fmoe_stage1_bf16_pertokenFp8_doweight_g1u1_32x128_3tg_pf3E,asm,104.9406,26.620555555555534,moe_ck2stages_gemm2_256x32x64x256_1x4_MulABScaleExpertWeight_v1_Nswizzle0_Quant1_MulRoutedWeight0_F8_F8_B16,ck,58.4894,190.05055555555555,12.135882505713456,15.660217167237866
64,16,7168,256,256,8,ActivationType.Gelu,QuantType.per_Token,torch.bfloat16,torch.float8_e4m3fnuz,torch.float8_e4m3fnuz,1,0,1-stage,32,_ZN5aiter45fmoe_bf16_pertokenFp8_g1u1_vs_gelu_1tg_32x256E,asm,167.0437,0.0,,,0.0,167.0437,12.135882505713456,13.764446048431784
65,16,7168,256,256,8,ActivationType.Gelu,QuantType.per_Token,torch.bfloat16,torch.float8_e4m3fnuz,torch.float8_e4m3fnuz,1,1,1-stage,32,_ZN5aiter53fmoe_bf16_pertokenFp8_g1u1_vs_tkw1_gelu_1tg_ps_32x128E,asm,169.5637,0.0,,,0.0,169.5637,12.135882505713456,13.972094729837
66,16,7168,256,256,8,ActivationType.Gelu,QuantType.per_1x128,torch.bfloat16,torch.float8_e4m3fnuz,torch.float8_e4m3fnuz,1,0,1-stage,32,_ZN5aiter47fmoe_bf16_blockscaleFp8_g1u1_vs_gelu_1tg_32x256E,asm,168.2768,0.0,,,0.0,168.2768,12.135882505713456,13.866053821860662
67,16,7168,256,256,8,ActivationType.Gelu,QuantType.per_1x128,torch.bfloat16,torch.float8_e4m3fnuz,torch.float8_e4m3fnuz,1,1,2-stage,16,moe_ck2stages_gemm1_256x16x128x256_1x4_MulABScaleExpertWeightA8W8blkscale_v1_Nswizzle0_Quant4_MulRoutedWeight1_gelu_F8_F8_B16,ck,99.8676,24.139666666666656,moe_ck2stages_gemm2_256x16x128x256_1x4_MulABScaleExpertWeightA8W8blkscale_v1_Nswizzle0_Quant4_MulRoutedWeight0_F8_F8_B16,ck,61.2669,185.27416666666664,12.135882505713456,15.266641431263146
68,16,7168,256,256,8,ActivationType.Silu,QuantType.per_1x128,torch.bfloat16,torch.float8_e4m3fnuz,torch.float8_e4m3fnuz,1,0,1-stage,32,_ZN5aiter47fmoe_bf16_blockscaleFp8_g1u1_vs_silu_1tg_32x256E,asm,166.0367,0.0,,,0.0,166.0367,12.135882505713456,13.681468976140097
69,16,7168,256,256,8,ActivationType.Gelu,QuantType.per_1x128,torch.bfloat16,torch.float8_e4m3fnuz,torch.float8_e4m3fnuz,1,0,1-stage,32,_ZN5aiter47fmoe_bf16_blockscaleFp8_g1u1_vs_gelu_1tg_32x256E,asm,166.7443,0.0,,,0.0,166.7443,12.135882505713456,13.739775407474356
70,16,7168,256,256,8,ActivationType.Silu,QuantType.per_1x128,torch.bfloat16,torch.float8_e4m3fnuz,torch.float8_e4m3fnuz,1,1,2-stage,16,moe_ck2stages_gemm1_256x16x128x256_1x4_MulABScaleExpertWeightA8W8blkscale_v1_Nswizzle0_Quant4_MulRoutedWeight1_silu_F8_F8_B16,ck,99.8291,24.12155555555556,moe_ck2stages_gemm2_256x16x128x256_1x4_MulABScaleExpertWeightA8W8blkscale_v1_Nswizzle0_Quant4_MulRoutedWeight0_F8_F8_B16,ck,60.2134,184.1640555555556,12.135882505713456,15.175167975534778
71,16,7168,256,256,8,ActivationType.Gelu,QuantType.per_1x128,torch.bfloat16,torch.float8_e4m3fnuz,torch.float8_e4m3fnuz,1,1,2-stage,16,moe_ck2stages_gemm1_256x16x128x256_1x4_MulABScaleExpertWeightA8W8blkscale_v1_Nswizzle0_Quant4_MulRoutedWeight1_gelu_F8_F8_B16,ck,99.9263,23.974222222222245,moe_ck2stages_gemm2_256x16x128x256_1x4_MulABScaleExpertWeightA8W8blkscale_v1_Nswizzle0_Quant4_MulRoutedWeight0_F8_F8_B16,ck,60.1214,184.02192222222223,12.135882505713456,15.163456150435414
72,16,7168,256,257,9,ActivationType.Silu,QuantType.per_Token,torch.bfloat16,torch.float8_e4m3fnuz,torch.float8_e4m3fnuz,1,0,1-stage,32,_ZN5aiter45fmoe_bf16_pertokenFp8_g1u1_vs_silu_1tg_32x256E,asm,182.2546,0.0,,,0.0,182.2546,13.637411215154053,13.364310654318068
73,16,7168,256,256,8,ActivationType.Silu,QuantType.per_1x128,torch.bfloat16,torch.float8_e4m3fnuz,torch.float8_e4m3fnuz,1,0,1-stage,32,_ZN5aiter47fmoe_bf16_blockscaleFp8_g1u1_vs_silu_1tg_32x256E,asm,166.3786,0.0,,,0.0,166.3786,12.135882505713456,13.70964162858948
74,16,7168,256,257,9,ActivationType.Silu,QuantType.per_1x128,torch.bfloat16,torch.float8_e4m3fnuz,torch.float8_e4m3fnuz,1,0,1-stage,32,_ZN5aiter47fmoe_bf16_blockscaleFp8_g1u1_vs_silu_1tg_32x256E,asm,185.2316,0.0,,,0.0,185.2316,13.637411215154053,13.582607217575754
75,16,7168,512,256,8,ActivationType.Gelu,QuantType.No,torch.bfloat16,torch.bfloat16,torch.bfloat16,1,0,2-stage,32,moe_ck2stages_gemm1_256x32x64x128_1x4_TypeCast_v1_Nswizzle0_Quant0_MulRoutedWeight0_gelu_B16_B16_B16,ck,406.3787,0.0,moe_ck2stages_gemm2_256x32x64x128_1x4_TypeCastExpertWeight_v1_Nswizzle0_Quant0_MulRoutedWeight1_B16_B16_B16,ck,214.5348,620.9135,47.889455577464645,12.965557710206742
76,16,7168,512,256,8,ActivationType.Gelu,QuantType.No,torch.bfloat16,torch.bfloat16,torch.bfloat16,1,1,2-stage,32,moe_ck2stages_gemm1_256x32x64x64_1x4_TypeCastExpertWeight_v1_Nswizzle0_Quant0_MulRoutedWeight1_gelu_B16_B16_B16,ck,395.2864,0.0,moe_ck2stages_gemm2_256x32x64x128_1x4_TypeCast_v1_Nswizzle0_Quant0_MulRoutedWeight0_B16_B16_B16,ck,215.9942,611.2806,47.889455577464645,12.764409046396647
77,16,7168,512,256,8,ActivationType.Gelu,QuantType.per_Tensor,torch.bfloat16,torch.float8_e4m3fnuz,torch.float8_e4m3fnuz,1,0,2-stage,32,_ZN5aiter48fmoe_stage1_bf16_pertokenFp8_g1u1_32x128_3tg_pf2E,asm,210.5743,34.65911111111112,moe_ck2stages_gemm2_256x32x64x128_1x4_MulABScaleExpertWeight_v1_Nswizzle0_Quant1_MulRoutedWeight1_F8_F8_B16,ck,110.4914,355.7248111111111,24.148112181238233,14.730957370137194
78,16,7168,512,256,8,ActivationType.Gelu,QuantType.per_Tensor,torch.bfloat16,torch.float8_e4m3fnuz,torch.float8_e4m3fnuz,1,1,2-stage,32,_ZN5aiter57fmoe_stage1_bf16_pertokenFp8_doweight_g1u1_32x256_2tg_pf3E,asm,209.404,34.77455555555554,moe_ck2stages_gemm2_256x32x64x128_1x4_MulABScaleExpertWeight_v1_Nswizzle0_Quant1_MulRoutedWeight0_F8_F8_B16,ck,111.0302,355.2087555555555,24.148112181238233,14.709586939534486
79,16,7168,512,256,8,ActivationType.Gelu,QuantType.per_Token,torch.bfloat16,torch.float8_e4m3fnuz,torch.float8_e4m3fnuz,1,0,1-stage,32,_ZN5aiter45fmoe_bf16_pertokenFp8_g1u1_vs_gelu_1tg_32x256E,asm,340.3793,0.0,,,0.0,340.3793,24.148112181238233,14.095482804012157
80,16,7168,512,256,8,ActivationType.Gelu,QuantType.per_Token,torch.bfloat16,torch.float8_e4m3fnuz,torch.float8_e4m3fnuz,1,1,1-stage,32,_ZN5aiter53fmoe_bf16_pertokenFp8_g1u1_vs_tkw1_gelu_1tg_ps_32x256E,asm,336.3261,0.0,,,0.0,336.3261,24.148112181238233,13.92763531475173
81,16,7168,512,256,8,ActivationType.Silu,QuantType.No,torch.bfloat16,torch.bfloat16,torch.bfloat16,1,1,2-stage,32,moe_ck2stages_gemm1_256x32x64x64_1x4_TypeCastExpertWeight_v1_Nswizzle0_Quant0_MulRoutedWeight1_silu_B16_B16_B16,ck,397.5005,0.0,moe_ck2stages_gemm2_256x32x64x128_1x4_TypeCast_v1_Nswizzle0_Quant0_MulRoutedWeight0_B16_B16_B16,ck,216.8415,614.342,47.889455577464645,12.828335436101534
82,16,7168,512,256,8,ActivationType.Silu,QuantType.per_Tensor,torch.bfloat16,torch.float8_e4m3fnuz,torch.float8_e4m3fnuz,1,0,2-stage,32,_ZN5aiter44fmoe_stage1_bf16_pertokenFp8_g1u1_32x512_pf3E,asm,207.2074,33.93800000000004,moe_ck2stages_gemm2_256x32x64x256_1x4_MulABScaleExpertWeight_v1_Nswizzle0_Quant1_MulRoutedWeight1_F8_F8_B16,ck,112.8423,353.9877,24.148112181238233,14.659021680172133
83,16,7168,512,256,8,ActivationType.Silu,QuantType.per_Tensor,torch.bfloat16,torch.float8_e4m3fnuz,torch.float8_e4m3fnuz,1,1,2-stage,32,_ZN5aiter53fmoe_stage1_bf16_pertokenFp8_doweight_g1u1_32x512_pf2E,asm,207.7677,34.00000000000001,moe_ck2stages_gemm2_256x32x64x128_1x4_MulABScaleExpertWeight_v1_Nswizzle0_Quant1_MulRoutedWeight0_F8_F8_B16,ck,109.8439,351.6116,24.148112181238233,14.560624754475965
84,16,7168,512,256,8,ActivationType.Silu,QuantType.per_Token,torch.bfloat16,torch.float8_e4m3fnuz,torch.float8_e4m3fnuz,1,0,1-stage,32,_ZN5aiter45fmoe_bf16_pertokenFp8_g1u1_vs_silu_1tg_32x256E,asm,332.0225,0.0,,,0.0,332.0225,24.148112181238233,13.749418484893546
85,16,7168,512,256,8,ActivationType.Silu,QuantType.per_Token,torch.bfloat16,torch.float8_e4m3fnuz,torch.float8_e4m3fnuz,1,1,1-stage,32,_ZN5aiter50fmoe_bf16_pertokenFp8_g1u1_vs_tkw1_silu_1tg_32x256E,asm,337.3372,0.0,,,0.0,337.3372,24.148112181238233,13.969506082636663
86,16,7168,512,256,8,ActivationType.Silu,QuantType.No,torch.bfloat16,torch.bfloat16,torch.bfloat16,1,0,2-stage,32,moe_ck2stages_gemm1_256x32x64x128_1x4_TypeCast_v1_Nswizzle0_Quant0_MulRoutedWeight0_silu_B16_B16_B16,ck,407.1457,0.0,moe_ck2stages_gemm2_256x32x64x64_1x4_TypeCastExpertWeight_v1_Nswizzle0_Quant0_MulRoutedWeight1_B16_B16_B16,ck,213.2441,620.3897999999999,47.889455577464645,12.954622108753663
87,16,7168,512,256,8,ActivationType.Silu,QuantType.per_Tensor,torch.bfloat16,torch.float8_e4m3fnuz,torch.float8_e4m3fnuz,1,0,2-stage,32,_ZN5aiter47fmoe_stage1_bf16_pertokenFp8_g1u1_32x64_4tg_pf3E,asm,210.3108,33.91577777777774,moe_ck2stages_gemm2_256x32x64x256_1x4_MulABScaleExpertWeight_v1_Nswizzle0_Quant1_MulRoutedWeight1_F8_F8_B16,ck,111.609,355.83557777777776,24.148112181238233,14.735544340159336
88,16,7168,512,256,8,ActivationType.Silu,QuantType.per_Tensor,torch.bfloat16,torch.float8_e4m3fnuz,torch.float8_e4m3fnuz,1,1,2-stage,32,_ZN5aiter57fmoe_stage1_bf16_pertokenFp8_doweight_g1u1_32x256_2tg_pf2E,asm,208.7594,34.124555555555474,moe_ck2stages_gemm2_256x32x64x128_1x4_MulABScaleExpertWeight_v1_Nswizzle0_Quant1_MulRoutedWeight0_F8_F8_B16,ck,106.1372,349.0211555555555,24.148112181238233,14.453351588565416
89,16,7168,512,256,8,ActivationType.Silu,QuantType.per_Token,torch.bfloat16,torch.float8_e4m3fnuz,torch.float8_e4m3fnuz,1,0,1-stage,32,_ZN5aiter45fmoe_bf16_pertokenFp8_g1u1_vs_silu_1tg_32x256E,asm,329.3813,0.0,,,0.0,329.3813,24.148112181238233,13.640043475361662
90,16,7168,512,256,8,ActivationType.Silu,QuantType.per_Token,torch.bfloat16,torch.float8_e4m3fnuz,torch.float8_e4m3fnuz,1,1,1-stage,32,_ZN5aiter53fmoe_bf16_pertokenFp8_g1u1_vs_tkw1_silu_1tg_ps_32x256E,asm,337.8284,0.0,,,0.0,337.8284,24.148112181238233,13.989847217227782
91,16,7168,512,256,8,ActivationType.Gelu,QuantType.per_Tensor,torch.bfloat16,torch.float8_e4m3fnuz,torch.float8_e4m3fnuz,1,0,2-stage,32,_ZN5aiter47fmoe_stage1_bf16_pertokenFp8_g1u1_32x64_4tg_pf2E,asm,211.3646,34.151555555555504,moe_ck2stages_gemm2_256x32x64x128_1x4_MulABScaleExpertWeight_v1_Nswizzle0_Quant1_MulRoutedWeight1_F8_F8_B16,ck,113.6467,359.1628555555555,24.148112181238233,14.873330588326713
92,16,7168,512,256,8,ActivationType.Gelu,QuantType.per_Tensor,torch.bfloat16,torch.float8_e4m3fnuz,torch.float8_e4m3fnuz,1,1,2-stage,32,_ZN5aiter57fmoe_stage1_bf16_pertokenFp8_doweight_g1u1_32x256_2tg_pf2E,asm,205.1536,33.879777777777754,moe_ck2stages_gemm2_256x32x64x256_1x4_MulABScaleExpertWeight_v1_Nswizzle0_Quant1_MulRoutedWeight0_F8_F8_B16,ck,109.8733,348.90667777777776,24.148112181238233,14.448610937332784
93,16,7168,512,256,8,ActivationType.Gelu,QuantType.per_Token,torch.bfloat16,torch.float8_e4m3fnuz,torch.float8_e4m3fnuz,1,0,1-stage,32,_ZN5aiter45fmoe_bf16_pertokenFp8_g1u1_vs_gelu_1tg_32x256E,asm,336.9887,0.0,,,0.0,336.9887,24.148112181238233,13.955074312675334
94,16,7168,512,256,8,ActivationType.Gelu,QuantType.per_Token,torch.bfloat16,torch.float8_e4m3fnuz,torch.float8_e4m3fnuz,1,1,1-stage,32,_ZN5aiter50fmoe_bf16_pertokenFp8_g1u1_vs_tkw1_gelu_1tg_32x256E,asm,335.7765,0.0,,,0.0,335.7765,24.148112181238233,13.904875771650591
95,16,7168,512,256,8,ActivationType.Gelu,QuantType.per_1x128,torch.bfloat16,torch.float8_e4m3fnuz,torch.float8_e4m3fnuz,1,0,1-stage,32,_ZN5aiter47fmoe_bf16_blockscaleFp8_g1u1_vs_gelu_1tg_32x256E,asm,321.7199,0.0,,,0.0,321.7199,24.148112181238233,13.322776438398312
96,16,7168,512,256,8,ActivationType.Silu,QuantType.per_1x128,torch.bfloat16,torch.float8_e4m3fnuz,torch.float8_e4m3fnuz,1,0,1-stage,32,_ZN5aiter47fmoe_bf16_blockscaleFp8_g1u1_vs_silu_1tg_32x256E,asm,319.6849,0.0,,,0.0,319.6849,24.148112181238233,13.238504840489261
97,16,7168,512,256,8,ActivationType.Gelu,QuantType.per_1x128,torch.bfloat16,torch.float8_e4m3fnuz,torch.float8_e4m3fnuz,1,1,2-stage,16,moe_ck2stages_gemm1_256x16x128x256_1x4_MulABScaleExpertWeightA8W8blkscale_v1_Nswizzle0_Quant4_MulRoutedWeight1_gelu_F8_F8_B16,ck,204.1555,25.00244444444436,moe_ck2stages_gemm2_256x16x128x256_1x4_MulABScaleExpertWeightA8W8blkscale_v1_Nswizzle0_Quant4_MulRoutedWeight0_F8_F8_B16,ck,111.1507,340.3086444444443,24.148112181238233,14.092556879408802
98,16,7168,512,256,8,ActivationType.Silu,QuantType.per_1x128,torch.bfloat16,torch.float8_e4m3fnuz,torch.float8_e4m3fnuz,1,1,2-stage,16,moe_ck2stages_gemm1_256x16x128x256_1x4_MulABScaleExpertWeightA8W8blkscale_v1_Nswizzle0_Quant4_MulRoutedWeight1_silu_F8_F8_B16,ck,203.7396,24.76666666666658,moe_ck2stages_gemm2_256x16x128x256_1x4_MulABScaleExpertWeightA8W8blkscale_v1_Nswizzle0_Quant4_MulRoutedWeight0_F8_F8_B16,ck,111.0261,339.5323666666666,24.148112181238233,14.060410359136261
99,16,7168,512,256,8,ActivationType.Silu,QuantType.per_1x128,torch.bfloat16,torch.float8_e4m3fnuz,torch.float8_e4m3fnuz,1,0,1-stage,32,_ZN5aiter47fmoe_bf16_blockscaleFp8_g1u1_vs_silu_1tg_32x256E,asm,319.2735,0.0,,,0.0,319.2735,24.148112181238233,13.221468312047106
100,16,7168,512,256,8,ActivationType.Gelu,QuantType.per_1x128,torch.bfloat16,torch.float8_e4m3fnuz,torch.float8_e4m3fnuz,1,0,1-stage,32,_ZN5aiter47fmoe_bf16_blockscaleFp8_g1u1_vs_gelu_1tg_32x256E,asm,317.8979,0.0,,,0.0,317.8979,24.148112181238233,13.164503196526862
101,16,7168,512,256,8,ActivationType.Silu,QuantType.per_1x128,torch.bfloat16,torch.float8_e4m3fnuz,torch.float8_e4m3fnuz,1,1,2-stage,16,moe_ck2stages_gemm1_256x16x128x256_1x4_MulABScaleExpertWeightA8W8blkscale_v1_Nswizzle0_Quant4_MulRoutedWeight1_silu_F8_F8_B16,ck,203.8602,25.638888888888875,moe_ck2stages_gemm2_256x16x128x256_1x4_MulABScaleExpertWeightA8W8blkscale_v1_Nswizzle0_Quant4_MulRoutedWeight0_F8_F8_B16,ck,111.4674,340.9664888888889,24.148112181238233,14.119798944523756
102,16,7168,512,256,8,ActivationType.Gelu,QuantType.per_1x128,torch.bfloat16,torch.float8_e4m3fnuz,torch.float8_e4m3fnuz,1,1,2-stage,16,moe_ck2stages_gemm1_256x16x128x256_1x4_MulABScaleExpertWeightA8W8blkscale_v1_Nswizzle0_Quant4_MulRoutedWeight1_gelu_F8_F8_B16,ck,205.2138,24.736222222222214,moe_ck2stages_gemm2_256x16x128x256_1x4_MulABScaleExpertWeightA8W8blkscale_v1_Nswizzle0_Quant4_MulRoutedWeight0_F8_F8_B16,ck,110.824,340.7740222222222,24.148112181238233,14.111828687253865
103,16,7168,2048,33,10,ActivationType.Silu,QuantType.per_1x128,torch.bfloat16,torch.float8_e4m3fnuz,torch.float8_e4m3fnuz,1,0,1-stage,32,_ZN5aiter47fmoe_bf16_blockscaleFp8_g1u1_vs_silu_1tg_32x256E,asm,409.4545,0.0,,,0.0,409.4545,120.24594958543645,3.4051417233732
104,16,7168,2048,33,10,ActivationType.Silu,QuantType.per_Token,torch.bfloat16,torch.float8_e4m3fnuz,torch.float8_e4m3fnuz,1,0,1-stage,32,_ZN5aiter45fmoe_bf16_pertokenFp8_g1u1_vs_silu_1tg_32x512E,asm,402.0579,0.0,,,0.0,402.0579,120.24594958543645,3.343629464328295
105,32,2048,192,128,8,ActivationType.Silu,QuantType.No,torch.bfloat16,torch.bfloat16,torch.bfloat16,1,0,2-stage,32,moe_ck2stages_gemm1_256x32x64x64_1x4_TypeCast_v1_Nswizzle0_Quant0_MulRoutedWeight0_silu_B16_B16_B16,ck,47.8214,0.0,moe_ck2stages_gemm2_256x32x64x64_1x4_TypeCastExpertWeight_v1_Nswizzle0_Quant0_MulRoutedWeight1_B16_B16_B16,ck,30.3033,78.12469999999999,5.237683646075886,14.915887495139504
106,32,2048,192,128,8,ActivationType.Silu,QuantType.No,torch.bfloat16,torch.bfloat16,torch.bfloat16,1,1,2-stage,32,moe_ck2stages_gemm1_256x32x64x64_1x4_TypeCastExpertWeight_v1_Nswizzle0_Quant0_MulRoutedWeight1_silu_B16_B16_B16,ck,47.629,0.0,moe_ck2stages_gemm2_256x32x64x64_1x4_TypeCast_v1_Nswizzle0_Quant0_MulRoutedWeight0_B16_B16_B16,ck,28.3278,75.9568,5.237683646075886,14.50198315373771
107,32,2048,192,128,8,ActivationType.Gelu,QuantType.No,torch.bfloat16,torch.bfloat16,torch.bfloat16,1,0,2-stage,32,moe_ck2stages_gemm1_256x32x64x64_1x4_TypeCast_v1_Nswizzle0_Quant0_MulRoutedWeight0_gelu_B16_B16_B16,ck,46.9889,0.0,moe_ck2stages_gemm2_256x32x64x64_1x4_TypeCastExpertWeight_v1_Nswizzle0_Quant0_MulRoutedWeight1_B16_B16_B16,ck,30.8678,77.8567,5.237683646075886,14.864719838192377
108,32,2048,192,128,8,ActivationType.Gelu,QuantType.No,torch.bfloat16,torch.bfloat16,torch.bfloat16,1,1,2-stage,32,moe_ck2stages_gemm1_256x32x64x64_1x4_TypeCastExpertWeight_v1_Nswizzle0_Quant0_MulRoutedWeight1_gelu_B16_B16_B16,ck,47.3828,0.0,moe_ck2stages_gemm2_256x32x64x64_1x4_TypeCast_v1_Nswizzle0_Quant0_MulRoutedWeight0_B16_B16_B16,ck,30.2374,77.62020000000001,5.237683646075886,14.819566290177468
109,32,4096,192,128,8,ActivationType.Silu,QuantType.No,torch.bfloat16,torch.bfloat16,torch.bfloat16,1,0,2-stage,32,moe_ck2stages_gemm1_256x32x64x64_1x4_TypeCast_v1_Nswizzle0_Quant0_MulRoutedWeight0_silu_B16_B16_B16,ck,90.785,0.0,moe_ck2stages_gemm2_256x32x64x64_1x4_TypeCastExpertWeight_v1_Nswizzle0_Quant0_MulRoutedWeight1_B16_B16_B16,ck,53.1576,143.9426,10.448870257111341,13.77590078717217
110,32,4096,192,128,8,ActivationType.Silu,QuantType.No,torch.bfloat16,torch.bfloat16,torch.bfloat16,1,1,2-stage,32,moe_ck2stages_gemm1_256x32x64x64_1x4_TypeCastExpertWeight_v1_Nswizzle0_Quant0_MulRoutedWeight1_silu_B16_B16_B16,ck,90.3081,0.0,moe_ck2stages_gemm2_256x32x64x64_1x4_TypeCast_v1_Nswizzle0_Quant0_MulRoutedWeight0_B16_B16_B16,ck,52.4987,142.8068,10.448870257111341,13.667200040387895
111,32,4096,192,128,8,ActivationType.Gelu,QuantType.No,torch.bfloat16,torch.bfloat16,torch.bfloat16,1,0,2-stage,32,moe_ck2stages_gemm1_256x32x64x64_1x4_TypeCast_v1_Nswizzle0_Quant0_MulRoutedWeight0_gelu_B16_B16_B16,ck,89.9535,0.0,moe_ck2stages_gemm2_256x32x64x64_1x4_TypeCastExpertWeight_v1_Nswizzle0_Quant0_MulRoutedWeight1_B16_B16_B16,ck,53.0327,142.9862,10.448870257111341,13.68436936066708
112,32,4096,192,128,8,ActivationType.Gelu,QuantType.No,torch.bfloat16,torch.bfloat16,torch.bfloat16,1,1,2-stage,32,moe_ck2stages_gemm1_256x32x64x64_1x4_TypeCastExpertWeight_v1_Nswizzle0_Quant0_MulRoutedWeight1_gelu_B16_B16_B16,ck,89.2786,0.0,moe_ck2stages_gemm2_256x32x64x64_1x4_TypeCast_v1_Nswizzle0_Quant0_MulRoutedWeight0_B16_B16_B16,ck,52.1348,141.4134,10.448870257111341,13.533845910638636
113,32,4096,384,128,8,ActivationType.Gelu,QuantType.No,torch.bfloat16,torch.bfloat16,torch.bfloat16,1,0,2-stage,32,moe_ck2stages_gemm1_256x32x64x128_1x4_TypeCast_v1_Nswizzle0_Quant0_MulRoutedWeight0_gelu_B16_B16_B16,ck,184.6714,0.0,moe_ck2stages_gemm2_256x32x64x128_1x4_TypeCastExpertWeight_v1_Nswizzle0_Quant0_MulRoutedWeight1_B16_B16_B16,ck,94.2614,278.9328,20.75642299400705,13.438384835409048
114,32,4096,384,128,8,ActivationType.Gelu,QuantType.No,torch.bfloat16,torch.bfloat16,torch.bfloat16,1,1,2-stage,32,moe_ck2stages_gemm1_256x32x64x128_1x4_TypeCastExpertWeight_v1_Nswizzle0_Quant0_MulRoutedWeight1_gelu_B16_B16_B16,ck,185.8454,0.0,moe_ck2stages_gemm2_256x32x64x128_1x4_TypeCast_v1_Nswizzle0_Quant0_MulRoutedWeight0_B16_B16_B16,ck,94.9217,280.7671,20.75642299400705,13.526757480374398
115,32,4096,384,128,8,ActivationType.Silu,QuantType.No,torch.bfloat16,torch.bfloat16,torch.bfloat16,1,0,2-stage,32,moe_ck2stages_gemm1_256x32x64x128_1x4_TypeCast_v1_Nswizzle0_Quant0_MulRoutedWeight0_silu_B16_B16_B16,ck,179.7759,0.0,moe_ck2stages_gemm2_256x32x64x128_1x4_TypeCastExpertWeight_v1_Nswizzle0_Quant0_MulRoutedWeight1_B16_B16_B16,ck,94.6501,274.426,20.75642299400705,13.221256864886321
116,32,4096,384,128,8,ActivationType.Silu,QuantType.No,torch.bfloat16,torch.bfloat16,torch.bfloat16,1,1,2-stage,32,moe_ck2stages_gemm1_256x32x64x128_1x4_TypeCastExpertWeight_v1_Nswizzle0_Quant0_MulRoutedWeight1_silu_B16_B16_B16,ck,185.1745,0.0,moe_ck2stages_gemm2_256x32x64x128_1x4_TypeCast_v1_Nswizzle0_Quant0_MulRoutedWeight0_B16_B16_B16,ck,94.5031,279.6776,20.75642299400705,13.474267704062044
117,32,4096,384,128,8,ActivationType.Silu,QuantType.per_Tensor,torch.bfloat16,torch.float8_e4m3fnuz,torch.float8_e4m3fnuz,1,0,2-stage,32,_ZN5aiter47fmoe_stage1_bf16_pertokenFp8_g1u1_32x64_4tg_pf2E,asm,94.9492,41.73666666666665,moe_ck2stages_gemm2_256x32x64x128_1x4_MulABScaleExpertWeight_v1_Nswizzle0_Quant1_MulRoutedWeight1_F8_F8_B16,ck,53.2131,189.89896666666664,10.581561538481441,17.946213890650302
118,32,4096,384,128,8,ActivationType.Silu,QuantType.per_Tensor,torch.bfloat16,torch.float8_e4m3fnuz,torch.float8_e4m3fnuz,1,1,2-stage,32,_ZN5aiter57fmoe_stage1_bf16_pertokenFp8_doweight_g1u1_32x128_3tg_pf2E,asm,95.645,41.70511111111111,moe_ck2stages_gemm2_256x32x64x128_1x4_MulABScaleExpertWeight_v1_Nswizzle0_Quant1_MulRoutedWeight0_F8_F8_B16,ck,53.077,190.42711111111112,10.581561538481441,17.996125658636892
119,32,4096,384,128,8,ActivationType.Silu,QuantType.per_Token,torch.bfloat16,torch.float8_e4m3fnuz,torch.float8_e4m3fnuz,1,0,1-stage,32,_ZN5aiter45fmoe_bf16_pertokenFp8_g1u1_vs_silu_1tg_32x192E,asm,146.0904,0.0,,,0.0,146.0904,10.581561538481441,13.806128657733574
120,32,4096,384,128,8,ActivationType.Silu,QuantType.per_Token,torch.bfloat16,torch.float8_e4m3fnuz,torch.float8_e4m3fnuz,1,1,1-stage,32,_ZN5aiter53fmoe_bf16_pertokenFp8_g1u1_vs_tkw1_silu_1tg_ps_32x192E,asm,148.8934,0.0,,,0.0,148.8934,10.581561538481441,14.071023398439516
121,32,4096,384,128,8,ActivationType.Gelu,QuantType.per_Tensor,torch.bfloat16,torch.float8_e4m3fnuz,torch.float8_e4m3fnuz,1,0,2-stage,32,_ZN5aiter48fmoe_stage1_bf16_pertokenFp8_g1u1_32x128_3tg_pf2E,asm,95.2252,41.97144444444442,moe_ck2stages_gemm2_256x32x64x128_1x4_MulABScaleExpertWeight_v1_Nswizzle0_Quant1_MulRoutedWeight1_F8_F8_B16,ck,53.4508,190.64744444444443,10.581561538481441,18.016948042226687
122,32,4096,384,128,8,ActivationType.Gelu,QuantType.per_Tensor,torch.bfloat16,torch.float8_e4m3fnuz,torch.float8_e4m3fnuz,1,1,2-stage,32,_ZN5aiter56fmoe_stage1_bf16_pertokenFp8_doweight_g1u1_32x64_4tg_pf2E,asm,95.6519,41.74533333333336,moe_ck2stages_gemm2_256x32x64x128_1x4_MulABScaleExpertWeight_v1_Nswizzle0_Quant1_MulRoutedWeight0_F8_F8_B16,ck,52.8742,190.27143333333336,10.581561538481441,17.981413484331462
123,32,4096,384,128,8,ActivationType.Gelu,QuantType.per_Token,torch.bfloat16,torch.float8_e4m3fnuz,torch.float8_e4m3fnuz,1,0,1-stage,32,_ZN5aiter45fmoe_bf16_pertokenFp8_g1u1_vs_gelu_1tg_32x192E,asm,146.4413,0.0,,,0.0,146.4413,10.581561538481441,13.839290114927195
124,32,4096,384,128,8,ActivationType.Gelu,QuantType.per_Token,torch.bfloat16,torch.float8_e4m3fnuz,torch.float8_e4m3fnuz,1,1,1-stage,32,_ZN5aiter53fmoe_bf16_pertokenFp8_g1u1_vs_tkw1_gelu_1tg_ps_32x192E,asm,149.2464,0.0,,,0.0,149.2464,10.581561538481441,14.10438331405464
125,32,4096,384,128,8,ActivationType.Silu,QuantType.per_Tensor,torch.bfloat16,torch.float8_e4m3fnuz,torch.float8_e4m3fnuz,1,0,2-stage,32,_ZN5aiter48fmoe_stage1_bf16_pertokenFp8_g1u1_32x128_3tg_pf2E,asm,95.2922,41.70911111111111,moe_ck2stages_gemm2_256x32x64x128_1x4_MulABScaleExpertWeight_v1_Nswizzle0_Quant1_MulRoutedWeight1_F8_F8_B16,ck,53.062,190.0633111111111,10.581561538481441,17.96174509971116
126,32,4096,384,128,8,ActivationType.Silu,QuantType.per_Tensor,torch.bfloat16,torch.float8_e4m3fnuz,torch.float8_e4m3fnuz,1,1,2-stage,32,_ZN5aiter57fmoe_stage1_bf16_pertokenFp8_doweight_g1u1_32x128_3tg_pf2E,asm,95.312,41.69644444444444,moe_ck2stages_gemm2_256x32x64x128_1x4_MulABScaleExpertWeight_v1_Nswizzle0_Quant1_MulRoutedWeight0_F8_F8_B16,ck,52.5979,189.60634444444443,10.581561538481441,17.91855991716463
127,32,4096,384,128,8,ActivationType.Silu,QuantType.per_Token,torch.bfloat16,torch.float8_e4m3fnuz,torch.float8_e4m3fnuz,1,0,1-stage,32,_ZN5aiter45fmoe_bf16_pertokenFp8_g1u1_vs_silu_1tg_32x192E,asm,145.885,0.0,,,0.0,145.885,10.581561538481441,13.786717534030041
128,32,4096,384,128,8,ActivationType.Silu,QuantType.per_Token,torch.bfloat16,torch.float8_e4m3fnuz,torch.float8_e4m3fnuz,1,1,1-stage,32,_ZN5aiter50fmoe_bf16_pertokenFp8_g1u1_vs_tkw1_silu_1tg_32x192E,asm,147.4672,0.0,,,0.0,147.4672,10.581561538481441,13.936241779033589
129,32,4096,384,128,8,ActivationType.Gelu,QuantType.per_Tensor,torch.bfloat16,torch.float8_e4m3fnuz,torch.float8_e4m3fnuz,1,0,2-stage,32,_ZN5aiter48fmoe_stage1_bf16_pertokenFp8_g1u1_32x128_3tg_pf2E,asm,94.964,40.24522222222218,moe_ck2stages_gemm2_256x32x64x128_1x4_MulABScaleExpertWeight_v1_Nswizzle0_Quant1_MulRoutedWeight1_F8_F8_B16,ck,52.8897,188.0989222222222,10.581561538481441,17.776102472038
130,32,4096,384,128,8,ActivationType.Gelu,QuantType.per_Tensor,torch.bfloat16,torch.float8_e4m3fnuz,torch.float8_e4m3fnuz,1,1,2-stage,32,_ZN5aiter57fmoe_stage1_bf16_pertokenFp8_doweight_g1u1_32x128_3tg_pf2E,asm,95.3982,41.424222222222205,moe_ck2stages_gemm2_256x32x64x128_1x4_MulABScaleExpertWeight_v1_Nswizzle0_Quant1_MulRoutedWeight0_F8_F8_B16,ck,52.5732,189.3956222222222,10.581561538481441,17.8986458221177
131,32,4096,384,128,8,ActivationType.Gelu,QuantType.per_Token,torch.bfloat16,torch.float8_e4m3fnuz,torch.float8_e4m3fnuz,1,0,1-stage,32,_ZN5aiter45fmoe_bf16_pertokenFp8_g1u1_vs_gelu_1tg_32x384E,asm,148.5739,0.0,,,0.0,148.5739,10.581561538481441,14.040829367167468
132,32,4096,384,128,8,ActivationType.Gelu,QuantType.per_Token,torch.bfloat16,torch.float8_e4m3fnuz,torch.float8_e4m3fnuz,1,1,1-stage,32,_ZN5aiter53fmoe_bf16_pertokenFp8_g1u1_vs_tkw1_gelu_1tg_ps_32x192E,asm,148.4921,0.0,,,0.0,148.4921,10.581561538481441,14.033098939129742
133,32,4096,384,128,8,ActivationType.Silu,QuantType.per_1x128,torch.bfloat16,torch.float8_e4m3fnuz,torch.float8_e4m3fnuz,1,0,2-stage,64,_ZN5aiter59fmoe_stage1_bf16_pertokenFp8_blockscale_g1u1_64x128_2tg_pf2E,asm,101.6392,25.714777777777783,moe_ck2stages_gemm2_256x64x128x128_1x4_MulABScaleExpertWeightA8W8blkscale_v3_Nswizzle0_Quant4_MulRoutedWeight1_F8_F8_B16,ck,100.7923,228.14627777777775,10.581561538481441,21.560738171591165
134,32,4096,384,128,8,ActivationType.Gelu,QuantType.per_1x128,torch.bfloat16,torch.float8_e4m3fnuz,torch.float8_e4m3fnuz,1,0,2-stage,64,_ZN5aiter59fmoe_stage1_bf16_pertokenFp8_blockscale_g1u1_64x128_2tg_pf2E,asm,100.4384,25.54155555555553,moe_ck2stages_gemm2_256x64x128x128_1x4_MulABScaleExpertWeightA8W8blkscale_v3_Nswizzle0_Quant4_MulRoutedWeight1_F8_F8_B16,ck,99.7793,225.75925555555557,10.581561538481441,21.335154999056428
135,32,4096,384,128,8,ActivationType.Silu,QuantType.per_1x128,torch.bfloat16,torch.float8_e4m3fnuz,torch.float8_e4m3fnuz,1,1,2-stage,64,moe_ck2stages_gemm1_256x64x128x128_1x4_MulABScaleExpertWeightA8W8blkscale_v3_Nswizzle0_Quant4_MulRoutedWeight1_silu_F8_F8_B16,ck,124.7005,24.931333333333384,moe_ck2stages_gemm2_256x64x128x128_1x4_MulABScaleExpertWeightA8W8blkscale_v3_Nswizzle0_Quant4_MulRoutedWeight0_F8_F8_B16,ck,97.5316,247.1634333333334,10.581561538481441,23.35793563497092
136,32,4096,384,128,8,ActivationType.Gelu,QuantType.per_1x128,torch.bfloat16,torch.float8_e4m3fnuz,torch.float8_e4m3fnuz,1,1,2-stage,64,moe_ck2stages_gemm1_256x64x128x128_1x4_MulABScaleExpertWeightA8W8blkscale_v3_Nswizzle0_Quant4_MulRoutedWeight1_gelu_F8_F8_B16,ck,126.7987,25.32766666666667,moe_ck2stages_gemm2_256x64x128x128_1x4_MulABScaleExpertWeightA8W8blkscale_v3_Nswizzle0_Quant4_MulRoutedWeight0_F8_F8_B16,ck,99.6582,251.78456666666665,10.581561538481441,23.794651266829963
137,32,4096,384,128,8,ActivationType.Gelu,QuantType.per_1x128,torch.bfloat16,torch.float8_e4m3fnuz,torch.float8_e4m3fnuz,1,0,2-stage,64,_ZN5aiter59fmoe_stage1_bf16_pertokenFp8_blockscale_g1u1_64x128_2tg_pf2E,asm,100.4888,25.469555555555537,moe_ck2stages_gemm2_256x64x128x128_1x4_MulABScaleExpertWeightA8W8blkscale_v3_Nswizzle0_Quant4_MulRoutedWeight1_F8_F8_B16,ck,99.9913,225.94965555555552,10.581561538481441,21.35314856260634
138,32,4096,384,128,8,ActivationType.Silu,QuantType.per_1x128,torch.bfloat16,torch.float8_e4m3fnuz,torch.float8_e4m3fnuz,1,1,2-stage,64,moe_ck2stages_gemm1_256x64x128x128_1x4_MulABScaleExpertWeightA8W8blkscale_v3_Nswizzle0_Quant4_MulRoutedWeight1_silu_F8_F8_B16,ck,126.2777,25.01155555555556,moe_ck2stages_gemm2_256x64x128x128_1x4_MulABScaleExpertWeightA8W8blkscale_v3_Nswizzle0_Quant4_MulRoutedWeight0_F8_F8_B16,ck,98.7551,250.04435555555557,10.581561538481441,23.63019433816376
139,32,4096,384,128,8,ActivationType.Gelu,QuantType.per_1x128,torch.bfloat16,torch.float8_e4m3fnuz,torch.float8_e4m3fnuz,1,1,2-stage,64,moe_ck2stages_gemm1_256x64x128x128_1x4_MulABScaleExpertWeightA8W8blkscale_v3_Nswizzle0_Quant4_MulRoutedWeight1_gelu_F8_F8_B16,ck,126.2259,24.77144444444441,moe_ck2stages_gemm2_256x64x128x128_1x4_MulABScaleExpertWeightA8W8blkscale_v3_Nswizzle0_Quant4_MulRoutedWeight0_F8_F8_B16,ck,99.148,250.1453444444444,10.581561538481441,23.63973819315355
140,32,7168,256,256,8,ActivationType.Gelu,QuantType.No,torch.bfloat16,torch.bfloat16,torch.bfloat16,1,0,2-stage,32,moe_ck2stages_gemm1_256x32x64x64_1x4_TypeCast_v1_Nswizzle0_Quant0_MulRoutedWeight0_gelu_B16_B16_B16,ck,323.1671,0.0,moe_ck2stages_gemm2_256x32x64x64_1x4_TypeCastExpertWeight_v1_Nswizzle0_Quant0_MulRoutedWeight1_B16_B16_B16,ck,171.5942,494.7613,24.27176501142691,20.38423245145424
141,32,7168,256,256,8,ActivationType.Gelu,QuantType.No,torch.bfloat16,torch.bfloat16,torch.bfloat16,1,1,2-stage,32,moe_ck2stages_gemm1_256x32x64x64_1x4_TypeCastExpertWeight_v1_Nswizzle0_Quant0_MulRoutedWeight1_gelu_B16_B16_B16,ck,324.3909,0.0,moe_ck2stages_gemm2_256x32x64x64_1x4_TypeCast_v1_Nswizzle0_Quant0_MulRoutedWeight0_B16_B16_B16,ck,169.5159,493.9068,24.27176501142691,20.34902693592631
142,32,7168,256,256,8,ActivationType.Gelu,QuantType.per_Tensor,torch.bfloat16,torch.float8_e4m3fnuz,torch.float8_e4m3fnuz,1,0,2-stage,32,_ZN5aiter48fmoe_stage1_bf16_pertokenFp8_g1u1_32x128_3tg_pf2E,asm,163.8355,33.8846666666667,moe_ck2stages_gemm2_256x32x64x128_1x4_MulABScaleExpertWeight_v1_Nswizzle0_Quant1_MulRoutedWeight1_F8_F8_B16,ck,89.4431,287.1632666666667,12.401093313313707,23.1562862573069
143,32,7168,256,256,8,ActivationType.Gelu,QuantType.per_Tensor,torch.bfloat16,torch.float8_e4m3fnuz,torch.float8_e4m3fnuz,1,1,2-stage,32,_ZN5aiter57fmoe_stage1_bf16_pertokenFp8_doweight_g1u1_32x256_2tg_pf2E,asm,166.0871,35.228777777777765,moe_ck2stages_gemm2_256x32x64x128_1x4_MulABScaleExpertWeight_v1_Nswizzle0_Quant1_MulRoutedWeight0_F8_F8_B16,ck,88.6399,289.95577777777777,12.401093313313707,23.381468911816327
144,32,7168,256,256,8,ActivationType.Gelu,QuantType.per_Token,torch.bfloat16,torch.float8_e4m3fnuz,torch.float8_e4m3fnuz,1,0,1-stage,32,_ZN5aiter45fmoe_bf16_pertokenFp8_g1u1_vs_gelu_1tg_32x256E,asm,256.6471,0.0,,,0.0,256.6471,12.401093313313707,20.69552204114664
145,32,7168,256,256,8,ActivationType.Gelu,QuantType.per_Token,torch.bfloat16,torch.float8_e4m3fnuz,torch.float8_e4m3fnuz,1,1,1-stage,32,_ZN5aiter53fmoe_bf16_pertokenFp8_g1u1_vs_tkw1_gelu_1tg_ps_32x256E,asm,259.4469,0.0,,,0.0,259.4469,12.401093313313707,20.92129245745293
146,32,7168,256,256,8,ActivationType.Silu,QuantType.No,torch.bfloat16,torch.bfloat16,torch.bfloat16,1,0,2-stage,32,moe_ck2stages_gemm1_256x32x64x64_1x4_TypeCast_v1_Nswizzle0_Quant0_MulRoutedWeight0_silu_B16_B16_B16,ck,324.0284,0.0,moe_ck2stages_gemm2_256x32x64x128_1x4_TypeCastExpertWeight_v1_Nswizzle0_Quant0_MulRoutedWeight1_B16_B16_B16,ck,171.4111,495.4395,24.27176501142691,20.412174383146503
147,32,7168,256,256,8,ActivationType.Silu,QuantType.No,torch.bfloat16,torch.bfloat16,torch.bfloat16,1,1,2-stage,32,moe_ck2stages_gemm1_256x32x64x64_1x4_TypeCastExpertWeight_v1_Nswizzle0_Quant0_MulRoutedWeight1_silu_B16_B16_B16,ck,322.8899,0.0,moe_ck2stages_gemm2_256x32x64x128_1x4_TypeCast_v1_Nswizzle0_Quant0_MulRoutedWeight0_B16_B16_B16,ck,170.523,493.4129,24.27176501142691,20.328678189151304
148,32,7168,256,256,8,ActivationType.Silu,QuantType.per_Tensor,torch.bfloat16,torch.float8_e4m3fnuz,torch.float8_e4m3fnuz,1,0,2-stage,32,_ZN5aiter48fmoe_stage1_bf16_pertokenFp8_g1u1_32x256_2tg_pf3E,asm,167.201,33.55944444444448,moe_ck2stages_gemm2_256x32x64x256_1x4_MulABScaleExpertWeight_v1_Nswizzle0_Quant1_MulRoutedWeight1_F8_F8_B16,ck,89.8965,290.6569444444445,12.401093313313707,23.438009625522106
149,32,7168,256,256,8,ActivationType.Silu,QuantType.per_Tensor,torch.bfloat16,torch.float8_e4m3fnuz,torch.float8_e4m3fnuz,1,1,2-stage,32,_ZN5aiter57fmoe_stage1_bf16_pertokenFp8_doweight_g1u1_32x256_2tg_pf3E,asm,166.3494,34.23155555555559,moe_ck2stages_gemm2_256x32x64x256_1x4_MulABScaleExpertWeight_v1_Nswizzle0_Quant1_MulRoutedWeight0_F8_F8_B16,ck,89.6065,290.1874555555556,12.401093313313707,23.400150956368726
150,32,7168,256,256,8,ActivationType.Silu,QuantType.per_Token,torch.bfloat16,torch.float8_e4m3fnuz,torch.float8_e4m3fnuz,1,0,1-stage,32,_ZN5aiter45fmoe_bf16_pertokenFp8_g1u1_vs_silu_1tg_32x256E,asm,257.5597,0.0,,,0.0,257.5597,12.401093313313707,20.76911232685316
151,32,7168,256,256,8,ActivationType.Silu,QuantType.per_Token,torch.bfloat16,torch.float8_e4m3fnuz,torch.float8_e4m3fnuz,1,1,1-stage,32,_ZN5aiter50fmoe_bf16_pertokenFp8_g1u1_vs_tkw1_silu_1tg_32x256E,asm,258.3364,0.0,,,0.0,258.3364,12.401093313313707,20.83174390137459
152,32,7168,256,256,8,ActivationType.Silu,QuantType.per_Tensor,torch.bfloat16,torch.float8_e4m3fnuz,torch.float8_e4m3fnuz,1,0,2-stage,32,_ZN5aiter48fmoe_stage1_bf16_pertokenFp8_g1u1_32x256_2tg_pf3E,asm,167.1989,33.87522222222217,moe_ck2stages_gemm2_256x32x64x256_1x4_MulABScaleExpertWeight_v1_Nswizzle0_Quant1_MulRoutedWeight1_F8_F8_B16,ck,87.8607,288.9348222222222,12.401093313313707,23.29914104525157
153,32,7168,256,256,8,ActivationType.Silu,QuantType.per_Tensor,torch.bfloat16,torch.float8_e4m3fnuz,torch.float8_e4m3fnuz,1,1,2-stage,32,_ZN5aiter57fmoe_stage1_bf16_pertokenFp8_doweight_g1u1_32x128_3tg_pf2E,asm,161.87,34.53844444444448,moe_ck2stages_gemm2_256x32x64x128_1x4_MulABScaleExpertWeight_v1_Nswizzle0_Quant1_MulRoutedWeight0_F8_F8_B16,ck,88.3775,284.78594444444445,12.401093313313707,22.964583625759893
154,32,7168,256,256,8,ActivationType.Silu,QuantType.per_Token,torch.bfloat16,torch.float8_e4m3fnuz,torch.float8_e4m3fnuz,1,0,1-stage,32,_ZN5aiter45fmoe_bf16_pertokenFp8_g1u1_vs_silu_1tg_32x256E,asm,257.3854,0.0,,,0.0,257.3854,12.401093313313707,20.755057114494353
155,32,7168,256,256,8,ActivationType.Silu,QuantType.per_Token,torch.bfloat16,torch.float8_e4m3fnuz,torch.float8_e4m3fnuz,1,1,1-stage,32,_ZN5aiter53fmoe_bf16_pertokenFp8_g1u1_vs_tkw1_silu_1tg_ps_32x256E,asm,257.9435,0.0,,,0.0,257.9435,12.401093313313707,20.800061210980008
156,32,7168,256,256,8,ActivationType.Gelu,QuantType.per_Tensor,torch.bfloat16,torch.float8_e4m3fnuz,torch.float8_e4m3fnuz,1,0,2-stage,32,_ZN5aiter48fmoe_stage1_bf16_pertokenFp8_g1u1_32x256_2tg_pf2E,asm,166.37,33.58211111111114,moe_ck2stages_gemm2_256x32x64x256_1x4_MulABScaleExpertWeight_v1_Nswizzle0_Quant1_MulRoutedWeight1_F8_F8_B16,ck,88.0134,287.96551111111114,12.401093313313707,23.220977686052393
157,32,7168,256,256,8,ActivationType.Gelu,QuantType.per_Tensor,torch.bfloat16,torch.float8_e4m3fnuz,torch.float8_e4m3fnuz,1,1,2-stage,32,_ZN5aiter57fmoe_stage1_bf16_pertokenFp8_doweight_g1u1_32x256_2tg_pf3E,asm,162.4804,34.56122222222228,moe_ck2stages_gemm2_256x32x64x256_1x4_MulABScaleExpertWeight_v1_Nswizzle0_Quant1_MulRoutedWeight0_F8_F8_B16,ck,87.5283,284.5699222222223,12.401093313313707,22.947164014701066
158,32,7168,256,256,8,ActivationType.Gelu,QuantType.per_Token,torch.bfloat16,torch.float8_e4m3fnuz,torch.float8_e4m3fnuz,1,0,1-stage,32,_ZN5aiter45fmoe_bf16_pertokenFp8_g1u1_vs_gelu_1tg_32x256E,asm,254.967,0.0,,,0.0,254.967,12.401093313313707,20.560042050991555
159,32,7168,256,256,8,ActivationType.Gelu,QuantType.per_Token,torch.bfloat16,torch.float8_e4m3fnuz,torch.float8_e4m3fnuz,1,1,1-stage,32,_ZN5aiter50fmoe_bf16_pertokenFp8_g1u1_vs_tkw1_gelu_1tg_32x256E,asm,258.1604,0.0,,,0.0,258.1604,12.401093313313707,20.8175516043284
160,32,7168,256,256,8,ActivationType.Gelu,QuantType.per_1x128,torch.bfloat16,torch.float8_e4m3fnuz,torch.float8_e4m3fnuz,1,0,1-stage,32,_ZN5aiter47fmoe_bf16_blockscaleFp8_g1u1_vs_gelu_1tg_32x256E,asm,256.3651,0.0,,,0.0,256.3651,12.401093313313707,20.672782110652182
161,32,7168,256,256,8,ActivationType.Gelu,QuantType.per_1x128,torch.bfloat16,torch.float8_e4m3fnuz,torch.float8_e4m3fnuz,1,1,2-stage,16,moe_ck2stages_gemm1_256x16x128x256_1x4_MulABScaleExpertWeightA8W8blkscale_v1_Nswizzle0_Quant4_MulRoutedWeight1_gelu_F8_F8_B16,ck,172.3008,24.859666666666644,moe_ck2stages_gemm2_256x16x128x256_1x4_MulABScaleExpertWeightA8W8blkscale_v1_Nswizzle0_Quant4_MulRoutedWeight0_F8_F8_B16,ck,89.4454,286.60586666666666,12.401093313313707,23.11133860745722
162,32,7168,256,256,8,ActivationType.Silu,QuantType.per_1x128,torch.bfloat16,torch.float8_e4m3fnuz,torch.float8_e4m3fnuz,1,1,2-stage,16,moe_ck2stages_gemm1_256x16x128x256_1x4_MulABScaleExpertWeightA8W8blkscale_v1_Nswizzle0_Quant4_MulRoutedWeight1_silu_F8_F8_B16,ck,172.4141,25.029666666666653,moe_ck2stages_gemm2_256x16x128x256_1x4_MulABScaleExpertWeightA8W8blkscale_v1_Nswizzle0_Quant4_MulRoutedWeight0_F8_F8_B16,ck,90.5262,287.96996666666666,12.401093313313707,23.221336973370292
163,32,7168,256,256,8,ActivationType.Silu,QuantType.per_1x128,torch.bfloat16,torch.float8_e4m3fnuz,torch.float8_e4m3fnuz,1,0,1-stage,32,_ZN5aiter47fmoe_bf16_blockscaleFp8_g1u1_vs_silu_1tg_32x256E,asm,256.4296,0.0,,,0.0,256.4296,12.401093313313707,20.677983264967402
164,32,7168,256,256,8,ActivationType.Gelu,QuantType.per_1x128,torch.bfloat16,torch.float8_e4m3fnuz,torch.float8_e4m3fnuz,1,0,1-stage,32,_ZN5aiter47fmoe_bf16_blockscaleFp8_g1u1_vs_gelu_1tg_32x256E,asm,252.144,0.0,,,0.0,252.144,12.401093313313707,20.332400831892812
165,32,7168,256,256,8,ActivationType.Silu,QuantType.per_1x128,torch.bfloat16,torch.float8_e4m3fnuz,torch.float8_e4m3fnuz,1,1,2-stage,16,moe_ck2stages_gemm1_256x16x128x256_1x4_MulABScaleExpertWeightA8W8blkscale_v1_Nswizzle0_Quant4_MulRoutedWeight1_silu_F8_F8_B16,ck,171.1821,28.296888888888923,moe_ck2stages_gemm2_256x16x128x256_1x4_MulABScaleExpertWeightA8W8blkscale_v1_Nswizzle0_Quant4_MulRoutedWeight0_F8_F8_B16,ck,90.436,289.91498888888896,12.401093313313707,23.37817977529761
166,32,7168,256,256,8,ActivationType.Gelu,QuantType.per_1x128,torch.bfloat16,torch.float8_e4m3fnuz,torch.float8_e4m3fnuz,1,1,2-stage,16,moe_ck2stages_gemm1_256x16x128x256_1x4_MulABScaleExpertWeightA8W8blkscale_v1_Nswizzle0_Quant4_MulRoutedWeight1_gelu_F8_F8_B16,ck,172.9701,27.980777777777785,moe_ck2stages_gemm2_256x16x128x256_1x4_MulABScaleExpertWeightA8W8blkscale_v1_Nswizzle0_Quant4_MulRoutedWeight0_F8_F8_B16,ck,89.5196,290.4704777777778,12.401093313313707,23.42297331687128
167,32,7168,256,257,9,ActivationType.Silu,QuantType.per_Token,torch.bfloat16,torch.float8_e4m3fnuz,torch.float8_e4m3fnuz,1,0,1-stage,32,_ZN5aiter45fmoe_bf16_pertokenFp8_g1u1_vs_silu_1tg_32x256E,asm,279.9971,0.0,,,0.0,279.9971,13.92031676993075,20.11427646566357
168,32,7168,256,256,8,ActivationType.Silu,QuantType.per_1x128,torch.bfloat16,torch.float8_e4m3fnuz,torch.float8_e4m3fnuz,1,0,1-stage,32,_ZN5aiter47fmoe_bf16_blockscaleFp8_g1u1_vs_silu_1tg_32x256E,asm,252.9588,0.0,,,0.0,252.9588,12.401093313313707,20.398104716172533
169,32,7168,256,257,9,ActivationType.Silu,QuantType.per_1x128,torch.bfloat16,torch.float8_e4m3fnuz,torch.float8_e4m3fnuz,1,0,1-stage,32,_ZN5aiter47fmoe_bf16_blockscaleFp8_g1u1_vs_silu_1tg_32x256E,asm,277.3059,0.0,,,0.0,277.3059,13.92031676993075,19.92094753181249
170,32,7168,512,256,8,ActivationType.Gelu,QuantType.No,torch.bfloat16,torch.bfloat16,torch.bfloat16,1,0,2-stage,32,moe_ck2stages_gemm1_256x32x64x128_1x4_TypeCast_v1_Nswizzle0_Quant0_MulRoutedWeight0_gelu_B16_B16_B16,ck,617.2251,0.0,moe_ck2stages_gemm2_256x32x64x128_1x4_TypeCastExpertWeight_v1_Nswizzle0_Quant0_MulRoutedWeight1_B16_B16_B16,ck,324.0366,941.2617,48.296224362476465,19.489343368449916
171,32,7168,512,256,8,ActivationType.Gelu,QuantType.No,torch.bfloat16,torch.bfloat16,torch.bfloat16,1,1,2-stage,32,moe_ck2stages_gemm1_256x32x64x128_1x4_TypeCastExpertWeight_v1_Nswizzle0_Quant0_MulRoutedWeight1_gelu_B16_B16_B16,ck,631.6279,0.0,moe_ck2stages_gemm2_256x32x64x128_1x4_TypeCast_v1_Nswizzle0_Quant0_MulRoutedWeight0_B16_B16_B16,ck,321.9307,953.5586,48.296224362476465,19.743957474672968
172,32,7168,512,256,8,ActivationType.Gelu,QuantType.per_Tensor,torch.bfloat16,torch.float8_e4m3fnuz,torch.float8_e4m3fnuz,1,0,2-stage,32,_ZN5aiter44fmoe_stage1_bf16_pertokenFp8_g1u1_32x512_pf2E,asm,313.5592,30.923444444444428,moe_ck2stages_gemm2_256x32x64x256_1x4_MulABScaleExpertWeight_v1_Nswizzle0_Quant1_MulRoutedWeight1_F8_F8_B16,ck,170.6876,515.1702444444444,24.554880966250053,20.980360082076164
173,32,7168,512,256,8,ActivationType.Gelu,QuantType.per_Tensor,torch.bfloat16,torch.float8_e4m3fnuz,torch.float8_e4m3fnuz,1,1,2-stage,32,_ZN5aiter53fmoe_stage1_bf16_pertokenFp8_doweight_g1u1_32x512_pf2E,asm,317.8973,31.087777777777774,moe_ck2stages_gemm2_256x32x64x256_1x4_MulABScaleExpertWeight_v1_Nswizzle0_Quant1_MulRoutedWeight0_F8_F8_B16,ck,168.685,517.6700777777778,24.554880966250053,21.08216604630663
174,32,7168,512,256,8,ActivationType.Gelu,QuantType.per_Token,torch.bfloat16,torch.float8_e4m3fnuz,torch.float8_e4m3fnuz,1,0,1-stage,32,_ZN5aiter45fmoe_bf16_pertokenFp8_g1u1_vs_gelu_1tg_32x512E,asm,486.11,0.0,,,0.0,486.11,24.554880966250053,19.79687870074156
175,32,7168,512,256,8,ActivationType.Gelu,QuantType.per_Token,torch.bfloat16,torch.float8_e4m3fnuz,torch.float8_e4m3fnuz,1,1,1-stage,32,_ZN5aiter50fmoe_bf16_pertokenFp8_g1u1_vs_tkw1_gelu_1tg_32x512E,asm,480.8141,0.0,,,0.0,480.8141,24.554880966250053,19.581202639950263
176,32,7168,512,256,8,ActivationType.Silu,QuantType.No,torch.bfloat16,torch.bfloat16,torch.bfloat16,1,1,2-stage,32,moe_ck2stages_gemm1_256x32x64x128_1x4_TypeCastExpertWeight_v1_Nswizzle0_Quant0_MulRoutedWeight1_silu_B16_B16_B16,ck,631.3016,0.0,moe_ck2stages_gemm2_256x32x64x64_1x4_TypeCast_v1_Nswizzle0_Quant0_MulRoutedWeight0_B16_B16_B16,ck,325.4259,956.7275,48.296224362476465,19.809571299393852
177,32,7168,512,256,8,ActivationType.Silu,QuantType.per_Tensor,torch.bfloat16,torch.float8_e4m3fnuz,torch.float8_e4m3fnuz,1,0,2-stage,32,_ZN5aiter44fmoe_stage1_bf16_pertokenFp8_g1u1_32x512_pf3E,asm,313.6053,31.724666666666646,moe_ck2stages_gemm2_256x32x64x128_1x4_MulABScaleExpertWeight_v1_Nswizzle0_Quant1_MulRoutedWeight1_F8_F8_B16,ck,170.4925,515.8224666666666,24.554880966250053,21.006921897754225
178,32,7168,512,256,8,ActivationType.Silu,QuantType.per_Tensor,torch.bfloat16,torch.float8_e4m3fnuz,torch.float8_e4m3fnuz,1,1,2-stage,32,_ZN5aiter53fmoe_stage1_bf16_pertokenFp8_doweight_g1u1_32x512_pf2E,asm,316.5757,31.35933333333334,moe_ck2stages_gemm2_256x32x64x256_1x4_MulABScaleExpertWeight_v1_Nswizzle0_Quant1_MulRoutedWeight0_F8_F8_B16,ck,169.5171,517.4521333333333,24.554880966250053,21.073290236859865
179,32,7168,512,256,8,ActivationType.Silu,QuantType.per_Token,torch.bfloat16,torch.float8_e4m3fnuz,torch.float8_e4m3fnuz,1,0,1-stage,32,_ZN5aiter45fmoe_bf16_pertokenFp8_g1u1_vs_silu_1tg_32x512E,asm,484.8223,0.0,,,0.0,484.8223,24.554880966250053,19.744436988571586
180,32,7168,512,256,8,ActivationType.Silu,QuantType.per_Token,torch.bfloat16,torch.float8_e4m3fnuz,torch.float8_e4m3fnuz,1,1,1-stage,32,_ZN5aiter50fmoe_bf16_pertokenFp8_g1u1_vs_tkw1_silu_1tg_32x512E,asm,479.2781,0.0,,,0.0,479.2781,24.554880966250053,19.518648885276754
181,32,7168,512,256,8,ActivationType.Silu,QuantType.No,torch.bfloat16,torch.bfloat16,torch.bfloat16,1,0,2-stage,32,moe_ck2stages_gemm1_256x32x64x128_1x4_TypeCast_v1_Nswizzle0_Quant0_MulRoutedWeight0_silu_B16_B16_B16,ck,631.2209,0.0,moe_ck2stages_gemm2_256x32x64x128_1x4_TypeCastExpertWeight_v1_Nswizzle0_Quant0_MulRoutedWeight1_B16_B16_B16,ck,323.0051,954.226,48.296224362476465,19.75777636028587
182,32,7168,512,256,8,ActivationType.Silu,QuantType.per_Token,torch.bfloat16,torch.float8_e4m3fnuz,torch.float8_e4m3fnuz,1,0,1-stage,32,_ZN5aiter45fmoe_bf16_pertokenFp8_g1u1_vs_silu_1tg_32x512E,asm,490.7311,0.0,,,0.0,490.7311,24.554880966250053,19.98507346358124
183,32,7168,512,256,8,ActivationType.Silu,QuantType.per_Tensor,torch.bfloat16,torch.float8_e4m3fnuz,torch.float8_e4m3fnuz,1,0,2-stage,32,_ZN5aiter44fmoe_stage1_bf16_pertokenFp8_g1u1_32x512_pf2E,asm,315.8062,31.395444444444447,moe_ck2stages_gemm2_256x32x64x128_1x4_MulABScaleExpertWeight_v1_Nswizzle0_Quant1_MulRoutedWeight1_F8_F8_B16,ck,169.9021,517.1037444444444,24.554880966250053,21.059102064277482
184,32,7168,512,256,8,ActivationType.Silu,QuantType.per_Token,torch.bfloat16,torch.float8_e4m3fnuz,torch.float8_e4m3fnuz,1,1,1-stage,32,_ZN5aiter50fmoe_bf16_pertokenFp8_g1u1_vs_tkw1_silu_1tg_32x512E,asm,480.0264,0.0,,,0.0,480.0264,24.554880966250053,19.54912347812974
185,32,7168,512,256,8,ActivationType.Silu,QuantType.per_Tensor,torch.bfloat16,torch.float8_e4m3fnuz,torch.float8_e4m3fnuz,1,1,2-stage,32,_ZN5aiter53fmoe_stage1_bf16_pertokenFp8_doweight_g1u1_32x512_pf3E,asm,315.1108,31.69366666666665,moe_ck2stages_gemm2_256x32x64x256_1x4_MulABScaleExpertWeight_v1_Nswizzle0_Quant1_MulRoutedWeight0_F8_F8_B16,ck,168.1946,514.9990666666666,24.554880966250053,20.973388849838752
186,32,7168,512,256,8,ActivationType.Gelu,QuantType.per_Tensor,torch.bfloat16,torch.float8_e4m3fnuz,torch.float8_e4m3fnuz,1,0,2-stage,32,_ZN5aiter44fmoe_stage1_bf16_pertokenFp8_g1u1_32x512_pf3E,asm,317.1658,30.687777777777804,moe_ck2stages_gemm2_256x32x64x256_1x4_MulABScaleExpertWeight_v1_Nswizzle0_Quant1_MulRoutedWeight1_F8_F8_B16,ck,166.1131,513.9666777777778,24.554880966250053,20.93134470837833
187,32,7168,512,256,8,ActivationType.Gelu,QuantType.per_Tensor,torch.bfloat16,torch.float8_e4m3fnuz,torch.float8_e4m3fnuz,1,1,2-stage,32,_ZN5aiter53fmoe_stage1_bf16_pertokenFp8_doweight_g1u1_32x512_pf2E,asm,317.3172,32.107222222222184,moe_ck2stages_gemm2_256x32x64x128_1x4_MulABScaleExpertWeight_v1_Nswizzle0_Quant1_MulRoutedWeight0_F8_F8_B16,ck,167.3222,516.7466222222222,24.554880966250053,21.04455822581567
188,32,7168,512,256,8,ActivationType.Gelu,QuantType.per_Token,torch.bfloat16,torch.float8_e4m3fnuz,torch.float8_e4m3fnuz,1,0,1-stage,32,_ZN5aiter48fmoe_bf16_pertokenFp8_g1u1_vs_gelu_1tg_ps_32x512E,asm,486.7093,0.0,,,0.0,486.7093,24.554880966250053,19.82128525359041
189,32,7168,512,256,8,ActivationType.Gelu,QuantType.per_Token,torch.bfloat16,torch.float8_e4m3fnuz,torch.float8_e4m3fnuz,1,1,1-stage,32,_ZN5aiter53fmoe_bf16_pertokenFp8_g1u1_vs_tkw1_gelu_1tg_ps_32x512E,asm,482.7742,0.0,,,0.0,482.7742,24.554880966250053,19.661027909830175
190,32,7168,512,256,8,ActivationType.Gelu,QuantType.per_1x128,torch.bfloat16,torch.float8_e4m3fnuz,torch.float8_e4m3fnuz,1,0,2-stage,16,_ZN5aiter59fmoe_stage1_bf16_pertokenFp8_blockscale_g1u1_16x512_2tg_pf2E,asm,306.3293,29.600333333333385,moe_ck2stages_gemm2_256x16x128x256_1x4_MulABScaleExpertWeightA8W8blkscale_v1_Nswizzle0_Quant4_MulRoutedWeight1_F8_F8_B16,ck,168.1683,504.0979333333333,24.554880966250053,20.529439097106632
191,32,7168,512,256,8,ActivationType.Silu,QuantType.per_1x128,torch.bfloat16,torch.float8_e4m3fnuz,torch.float8_e4m3fnuz,1,0,2-stage,16,_ZN5aiter55fmoe_stage1_bf16_pertokenFp8_blockscale_g1u1_16x512_pf3E,asm,305.8233,29.64077777777772,moe_ck2stages_gemm2_256x16x128x256_1x4_MulABScaleExpertWeightA8W8blkscale_v1_Nswizzle0_Quant4_MulRoutedWeight1_F8_F8_B16,ck,171.0611,506.52517777777774,24.554880966250053,20.628288871527474
192,32,7168,512,256,8,ActivationType.Gelu,QuantType.per_1x128,torch.bfloat16,torch.float8_e4m3fnuz,torch.float8_e4m3fnuz,1,1,2-stage,16,moe_ck2stages_gemm1_256x16x128x256_1x4_MulABScaleExpertWeightA8W8blkscale_v1_Nswizzle0_Quant4_MulRoutedWeight1_gelu_F8_F8_B16,ck,318.3301,28.901222222222284,moe_ck2stages_gemm2_256x16x128x256_1x4_MulABScaleExpertWeightA8W8blkscale_v1_Nswizzle0_Quant4_MulRoutedWeight0_F8_F8_B16,ck,170.9518,518.1831222222222,24.554880966250053,21.103059832969638
193,32,7168,512,256,8,ActivationType.Silu,QuantType.per_1x128,torch.bfloat16,torch.float8_e4m3fnuz,torch.float8_e4m3fnuz,1,1,2-stage,16,moe_ck2stages_gemm1_256x16x128x256_1x4_MulABScaleExpertWeightA8W8blkscale_v1_Nswizzle0_Quant4_MulRoutedWeight1_silu_F8_F8_B16,ck,322.8489,28.438666666666748,moe_ck2stages_gemm2_256x16x128x256_1x4_MulABScaleExpertWeightA8W8blkscale_v1_Nswizzle0_Quant4_MulRoutedWeight0_F8_F8_B16,ck,164.1025,515.3900666666667,24.554880966250053,20.989312364212022
194,32,7168,512,256,8,ActivationType.Silu,QuantType.per_1x128,torch.bfloat16,torch.float8_e4m3fnuz,torch.float8_e4m3fnuz,1,0,2-stage,16,_ZN5aiter55fmoe_stage1_bf16_pertokenFp8_blockscale_g1u1_16x512_pf3E,asm,304.8535,29.699111111111083,moe_ck2stages_gemm2_256x16x128x256_1x4_MulABScaleExpertWeightA8W8blkscale_v1_Nswizzle0_Quant4_MulRoutedWeight1_F8_F8_B16,ck,162.5858,497.1384111111111,24.554880966250053,20.24601185379041
195,32,7168,512,256,8,ActivationType.Gelu,QuantType.per_1x128,torch.bfloat16,torch.float8_e4m3fnuz,torch.float8_e4m3fnuz,1,0,2-stage,16,_ZN5aiter59fmoe_stage1_bf16_pertokenFp8_blockscale_g1u1_16x512_2tg_pf2E,asm,305.2365,28.79888888888888,moe_ck2stages_gemm2_256x16x128x256_1x4_MulABScaleExpertWeightA8W8blkscale_v1_Nswizzle0_Quant4_MulRoutedWeight1_F8_F8_B16,ck,170.495,504.53038888888887,24.554880966250053,20.54705089315443
196,32,7168,512,256,8,ActivationType.Silu,QuantType.per_1x128,torch.bfloat16,torch.float8_e4m3fnuz,torch.float8_e4m3fnuz,1,1,2-stage,16,moe_ck2stages_gemm1_256x16x128x256_1x4_MulABScaleExpertWeightA8W8blkscale_v1_Nswizzle0_Quant4_MulRoutedWeight1_silu_F8_F8_B16,ck,321.6299,29.61333333333328,moe_ck2stages_gemm2_256x16x128x256_1x4_MulABScaleExpertWeightA8W8blkscale_v1_Nswizzle0_Quant4_MulRoutedWeight0_F8_F8_B16,ck,163.9705,515.2137333333333,24.554880966250053,20.982131171455446
197,32,7168,512,256,8,ActivationType.Gelu,QuantType.per_1x128,torch.bfloat16,torch.float8_e4m3fnuz,torch.float8_e4m3fnuz,1,1,2-stage,16,moe_ck2stages_gemm1_256x16x128x256_1x4_MulABScaleExpertWeightA8W8blkscale_v1_Nswizzle0_Quant4_MulRoutedWeight1_gelu_F8_F8_B16,ck,324.8375,29.43688888888889,moe_ck2stages_gemm2_256x16x128x256_1x4_MulABScaleExpertWeightA8W8blkscale_v1_Nswizzle0_Quant4_MulRoutedWeight0_F8_F8_B16,ck,168.0229,522.2972888888889,24.554880966250053,21.270609684761695
198,32,7168,2048,33,10,ActivationType.Silu,QuantType.per_1x128,torch.bfloat16,torch.float8_e4m3fnuz,torch.float8_e4m3fnuz,1,0,1-stage,32,_ZN5aiter47fmoe_bf16_blockscaleFp8_g1u1_vs_silu_1tg_32x256E,asm,415.7331,0.0,,,0.0,415.7331,121.78518218974082,3.4136591375483554
199,32,7168,2048,33,10,ActivationType.Silu,QuantType.per_Token,torch.bfloat16,torch.float8_e4m3fnuz,torch.float8_e4m3fnuz,1,0,1-stage,32,_ZN5aiter45fmoe_bf16_pertokenFp8_g1u1_vs_silu_1tg_32x512E,asm,406.4962,0.0,,,0.0,406.4962,121.78518218974082,3.3378132929725437
200,56,6144,4096,8,2,ActivationType.Silu,QuantType.per_1x128,torch.bfloat16,torch.float8_e4m3fnuz,torch.float8_e4m3fnuz,1,0,1-stage,32,_ZN5aiter47fmoe_bf16_blockscaleFp8_g1u1_vs_silu_1tg_32x256E,asm,172.9916,0.0,,,0.0,172.9916,42.804429421661204,4.041441559607789
201,64,2048,192,128,8,ActivationType.Silu,QuantType.No,torch.bfloat16,torch.bfloat16,torch.bfloat16,1,0,2-stage,32,moe_ck2stages_gemm1_256x32x64x64_1x4_TypeCast_v1_Nswizzle0_Quant0_MulRoutedWeight0_silu_B16_B16_B16,ck,56.2807,0.0,moe_ck2stages_gemm2_256x32x64x64_1x4_TypeCastExpertWeight_v1_Nswizzle0_Quant0_MulRoutedWeight1_B16_B16_B16,ck,33.9111,90.1918,5.387936564388969,16.739580899321222
202,64,2048,192,128,8,ActivationType.Silu,QuantType.No,torch.bfloat16,torch.bfloat16,torch.bfloat16,1,1,2-stage,32,moe_ck2stages_gemm1_256x32x64x64_1x4_TypeCastExpertWeight_v1_Nswizzle0_Quant0_MulRoutedWeight1_silu_B16_B16_B16,ck,57.0092,0.0,moe_ck2stages_gemm2_256x32x64x64_1x4_TypeCast_v1_Nswizzle0_Quant0_MulRoutedWeight0_B16_B16_B16,ck,34.3704,91.3796,5.387936564388969,16.960036353056637
203,64,2048,192,128,8,ActivationType.Gelu,QuantType.No,torch.bfloat16,torch.bfloat16,torch.bfloat16,1,0,2-stage,32,moe_ck2stages_gemm1_256x32x64x64_1x4_TypeCast_v1_Nswizzle0_Quant0_MulRoutedWeight0_gelu_B16_B16_B16,ck,55.8696,0.0,moe_ck2stages_gemm2_256x32x64x64_1x4_TypeCastExpertWeight_v1_Nswizzle0_Quant0_MulRoutedWeight1_B16_B16_B16,ck,34.0743,89.9439,5.387936564388969,16.693570706543813
204,64,2048,192,128,8,ActivationType.Gelu,QuantType.No,torch.bfloat16,torch.bfloat16,torch.bfloat16,1,1,2-stage,32,moe_ck2stages_gemm1_256x32x64x64_1x4_TypeCastExpertWeight_v1_Nswizzle0_Quant0_MulRoutedWeight1_gelu_B16_B16_B16,ck,55.7653,0.0,moe_ck2stages_gemm2_256x32x64x64_1x4_TypeCast_v1_Nswizzle0_Quant0_MulRoutedWeight0_B16_B16_B16,ck,33.5041,89.2694,5.387936564388969,16.568383635029637
205,64,4096,192,128,8,ActivationType.Silu,QuantType.No,torch.bfloat16,torch.bfloat16,torch.bfloat16,1,0,2-stage,32,moe_ck2stages_gemm1_256x32x64x128_1x4_TypeCast_v1_Nswizzle0_Quant0_MulRoutedWeight0_silu_B16_B16_B16,ck,105.0844,0.0,moe_ck2stages_gemm2_256x32x64x64_1x4_TypeCastExpertWeight_v1_Nswizzle0_Quant0_MulRoutedWeight1_B16_B16_B16,ck,58.7509,163.83530000000002,10.722879058697075,15.279040181574842
206,64,4096,192,128,8,ActivationType.Silu,QuantType.No,torch.bfloat16,torch.bfloat16,torch.bfloat16,1,1,2-stage,32,moe_ck2stages_gemm1_256x32x64x128_1x4_TypeCastExpertWeight_v1_Nswizzle0_Quant0_MulRoutedWeight1_silu_B16_B16_B16,ck,105.5645,0.0,moe_ck2stages_gemm2_256x32x64x64_1x4_TypeCast_v1_Nswizzle0_Quant0_MulRoutedWeight0_B16_B16_B16,ck,59.5446,165.1091,10.722879058697075,15.397832904408626
207,64,4096,192,128,8,ActivationType.Gelu,QuantType.No,torch.bfloat16,torch.bfloat16,torch.bfloat16,1,0,2-stage,32,moe_ck2stages_gemm1_256x32x64x128_1x4_TypeCast_v1_Nswizzle0_Quant0_MulRoutedWeight0_gelu_B16_B16_B16,ck,105.2917,0.0,moe_ck2stages_gemm2_256x32x64x64_1x4_TypeCastExpertWeight_v1_Nswizzle0_Quant0_MulRoutedWeight1_B16_B16_B16,ck,59.6473,164.93900000000002,10.722879058697075,15.381969627478162
208,64,4096,192,128,8,ActivationType.Gelu,QuantType.No,torch.bfloat16,torch.bfloat16,torch.bfloat16,1,1,2-stage,32,moe_ck2stages_gemm1_256x32x64x64_1x4_TypeCastExpertWeight_v1_Nswizzle0_Quant0_MulRoutedWeight1_gelu_B16_B16_B16,ck,102.4505,0.0,moe_ck2stages_gemm2_256x32x64x64_1x4_TypeCast_v1_Nswizzle0_Quant0_MulRoutedWeight0_B16_B16_B16,ck,57.8809,160.3314,10.722879058697075,14.952271598172972
209,64,4096,384,128,8,ActivationType.Gelu,QuantType.No,torch.bfloat16,torch.bfloat16,torch.bfloat16,1,0,2-stage,32,moe_ck2stages_gemm1_256x32x64x64_1x4_TypeCast_v1_Nswizzle0_Quant0_MulRoutedWeight0_gelu_B16_B16_B16,ck,204.9669,0.0,moe_ck2stages_gemm2_256x32x64x64_1x4_TypeCastExpertWeight_v1_Nswizzle0_Quant0_MulRoutedWeight1_B16_B16_B16,ck,114.0731,319.04,21.163123076962883,15.075279713668111
210,64,4096,384,128,8,ActivationType.Gelu,QuantType.No,torch.bfloat16,torch.bfloat16,torch.bfloat16,1,1,2-stage,32,moe_ck2stages_gemm1_256x32x64x64_1x4_TypeCastExpertWeight_v1_Nswizzle0_Quant0_MulRoutedWeight1_gelu_B16_B16_B16,ck,205.1844,0.0,moe_ck2stages_gemm2_256x32x64x64_1x4_TypeCast_v1_Nswizzle0_Quant0_MulRoutedWeight0_B16_B16_B16,ck,111.061,316.2454,21.163123076962883,14.943229260158153
211,64,4096,384,128,8,ActivationType.Silu,QuantType.No,torch.bfloat16,torch.bfloat16,torch.bfloat16,1,0,2-stage,32,moe_ck2stages_gemm1_256x32x64x64_1x4_TypeCast_v1_Nswizzle0_Quant0_MulRoutedWeight0_silu_B16_B16_B16,ck,207.1461,0.0,moe_ck2stages_gemm2_256x32x64x64_1x4_TypeCastExpertWeight_v1_Nswizzle0_Quant0_MulRoutedWeight1_B16_B16_B16,ck,110.0683,317.2144,21.163123076962883,14.98901645311999
212,64,4096,384,128,8,ActivationType.Silu,QuantType.No,torch.bfloat16,torch.bfloat16,torch.bfloat16,1,1,2-stage,32,moe_ck2stages_gemm1_256x32x64x64_1x4_TypeCastExpertWeight_v1_Nswizzle0_Quant0_MulRoutedWeight1_silu_B16_B16_B16,ck,205.0746,0.0,moe_ck2stages_gemm2_256x32x64x64_1x4_TypeCast_v1_Nswizzle0_Quant0_MulRoutedWeight0_B16_B16_B16,ck,110.8108,315.8854,21.163123076962883,14.926218538314746
213,64,4096,384,128,8,ActivationType.Silu,QuantType.per_Tensor,torch.bfloat16,torch.float8_e4m3fnuz,torch.float8_e4m3fnuz,1,0,2-stage,32,_ZN5aiter48fmoe_stage1_bf16_pertokenFp8_g1u1_32x128_3tg_pf2E,asm,105.9542,26.95844444444436,moe_ck2stages_gemm2_256x32x64x128_1x4_MulABScaleExpertWeight_v1_Nswizzle0_Quant1_MulRoutedWeight1_F8_F8_B16,ck,59.3419,192.2545444444444,10.98826162143728,17.496356663857558
214,64,4096,384,128,8,ActivationType.Silu,QuantType.per_Tensor,torch.bfloat16,torch.float8_e4m3fnuz,torch.float8_e4m3fnuz,1,1,2-stage,32,_ZN5aiter57fmoe_stage1_bf16_pertokenFp8_doweight_g1u1_32x128_3tg_pf2E,asm,106.9967,27.304111111111165,moe_ck2stages_gemm2_256x32x64x128_1x4_MulABScaleExpertWeight_v1_Nswizzle0_Quant1_MulRoutedWeight0_F8_F8_B16,ck,58.9761,193.2769111111112,10.98826162143728,17.589398375266416
215,64,4096,384,128,8,ActivationType.Silu,QuantType.per_Token,torch.bfloat16,torch.float8_e4m3fnuz,torch.float8_e4m3fnuz,1,0,1-stage,32,_ZN5aiter45fmoe_bf16_pertokenFp8_g1u1_vs_silu_1tg_32x384E,asm,165.6284,0.0,,,0.0,165.6284,10.98826162143728,15.073212279262748
216,64,4096,384,128,8,ActivationType.Silu,QuantType.per_Token,torch.bfloat16,torch.float8_e4m3fnuz,torch.float8_e4m3fnuz,1,1,1-stage,32,_ZN5aiter50fmoe_bf16_pertokenFp8_g1u1_vs_tkw1_silu_1tg_32x192E,asm,168.5841,0.0,,,0.0,168.5841,10.98826162143728,15.342199322148009
217,64,4096,384,128,8,ActivationType.Gelu,QuantType.per_Tensor,torch.bfloat16,torch.float8_e4m3fnuz,torch.float8_e4m3fnuz,1,0,2-stage,32,_ZN5aiter48fmoe_stage1_bf16_pertokenFp8_g1u1_32x128_3tg_pf2E,asm,106.8757,26.992888888888874,moe_ck2stages_gemm2_256x32x64x128_1x4_MulABScaleExpertWeight_v1_Nswizzle0_Quant1_MulRoutedWeight1_F8_F8_B16,ck,59.3033,193.17188888888887,10.98826162143728,17.579840701282986
218,64,4096,384,128,8,ActivationType.Gelu,QuantType.per_Tensor,torch.bfloat16,torch.float8_e4m3fnuz,torch.float8_e4m3fnuz,1,1,2-stage,32,_ZN5aiter57fmoe_stage1_bf16_pertokenFp8_doweight_g1u1_32x128_3tg_pf2E,asm,109.3654,26.97088888888887,moe_ck2stages_gemm2_256x32x64x128_1x4_MulABScaleExpertWeight_v1_Nswizzle0_Quant1_MulRoutedWeight0_F8_F8_B16,ck,58.7246,195.06088888888888,10.98826162143728,17.751751424296234
219,64,4096,384,128,8,ActivationType.Gelu,QuantType.per_Token,torch.bfloat16,torch.float8_e4m3fnuz,torch.float8_e4m3fnuz,1,0,1-stage,32,_ZN5aiter45fmoe_bf16_pertokenFp8_g1u1_vs_gelu_1tg_32x384E,asm,165.4205,0.0,,,0.0,165.4205,10.98826162143728,15.054292089048639
220,64,4096,384,128,8,ActivationType.Gelu,QuantType.per_Token,torch.bfloat16,torch.float8_e4m3fnuz,torch.float8_e4m3fnuz,1,1,1-stage,32,_ZN5aiter53fmoe_bf16_pertokenFp8_g1u1_vs_tkw1_gelu_1tg_ps_32x192E,asm,168.1257,0.0,,,0.0,168.1257,10.98826162143728,15.30048207734691
221,64,4096,384,128,8,ActivationType.Silu,QuantType.per_Tensor,torch.bfloat16,torch.float8_e4m3fnuz,torch.float8_e4m3fnuz,1,0,2-stage,32,_ZN5aiter48fmoe_stage1_bf16_pertokenFp8_g1u1_32x128_3tg_pf2E,asm,105.3419,27.44288888888893,moe_ck2stages_gemm2_256x32x64x128_1x4_MulABScaleExpertWeight_v1_Nswizzle0_Quant1_MulRoutedWeight1_F8_F8_B16,ck,59.1233,191.90808888888893,10.98826162143728,17.46482705822098
222,64,4096,384,128,8,ActivationType.Silu,QuantType.per_Tensor,torch.bfloat16,torch.float8_e4m3fnuz,torch.float8_e4m3fnuz,1,1,2-stage,32,_ZN5aiter57fmoe_stage1_bf16_pertokenFp8_doweight_g1u1_32x128_3tg_pf2E,asm,105.8491,27.415888888888983,moe_ck2stages_gemm2_256x32x64x128_1x4_MulABScaleExpertWeight_v1_Nswizzle0_Quant1_MulRoutedWeight0_F8_F8_B16,ck,58.4008,191.66578888888895,10.98826162143728,17.44277625452267
223,64,4096,384,128,8,ActivationType.Silu,QuantType.per_Token,torch.bfloat16,torch.float8_e4m3fnuz,torch.float8_e4m3fnuz,1,0,1-stage,32,_ZN5aiter45fmoe_bf16_pertokenFp8_g1u1_vs_silu_1tg_32x384E,asm,165.2034,0.0,,,0.0,165.2034,10.98826162143728,15.034534641739915
224,64,4096,384,128,8,ActivationType.Silu,QuantType.per_Token,torch.bfloat16,torch.float8_e4m3fnuz,torch.float8_e4m3fnuz,1,1,1-stage,32,_ZN5aiter53fmoe_bf16_pertokenFp8_g1u1_vs_tkw1_silu_1tg_ps_32x384E,asm,168.669,0.0,,,0.0,168.669,10.98826162143728,15.349925749031982
225,64,4096,384,128,8,ActivationType.Gelu,QuantType.per_Tensor,torch.bfloat16,torch.float8_e4m3fnuz,torch.float8_e4m3fnuz,1,0,2-stage,32,_ZN5aiter48fmoe_stage1_bf16_pertokenFp8_g1u1_32x128_3tg_pf2E,asm,106.5143,28.5113333333334,moe_ck2stages_gemm2_256x32x64x128_1x4_MulABScaleExpertWeight_v1_Nswizzle0_Quant1_MulRoutedWeight1_F8_F8_B16,ck,58.9119,193.93753333333345,10.98826162143728,17.649519097267923
226,64,4096,384,128,8,ActivationType.Gelu,QuantType.per_Tensor,torch.bfloat16,torch.float8_e4m3fnuz,torch.float8_e4m3fnuz,1,1,2-stage,32,_ZN5aiter57fmoe_stage1_bf16_pertokenFp8_doweight_g1u1_32x128_3tg_pf2E,asm,106.2363,27.69244444444446,moe_ck2stages_gemm2_256x32x64x128_1x4_MulABScaleExpertWeight_v1_Nswizzle0_Quant1_MulRoutedWeight0_F8_F8_B16,ck,58.6908,192.61954444444447,10.98826162143728,17.52957392902423
227,64,4096,384,128,8,ActivationType.Gelu,QuantType.per_Token,torch.bfloat16,torch.float8_e4m3fnuz,torch.float8_e4m3fnuz,1,0,1-stage,32,_ZN5aiter45fmoe_bf16_pertokenFp8_g1u1_vs_gelu_1tg_32x384E,asm,165.4936,0.0,,,0.0,165.4936,10.98826162143728,15.060944642702564
228,64,4096,384,128,8,ActivationType.Gelu,QuantType.per_Token,torch.bfloat16,torch.float8_e4m3fnuz,torch.float8_e4m3fnuz,1,1,1-stage,32,_ZN5aiter50fmoe_bf16_pertokenFp8_g1u1_vs_tkw1_gelu_1tg_32x192E,asm,168.1537,0.0,,,0.0,168.1537,10.98826162143728,15.30303025111312
229,64,4096,384,128,8,ActivationType.Silu,QuantType.per_1x128,torch.bfloat16,torch.float8_e4m3fnuz,torch.float8_e4m3fnuz,1,0,2-stage,64,_ZN5aiter59fmoe_stage1_bf16_pertokenFp8_blockscale_g1u1_64x128_2tg_pf2E,asm,112.9647,28.639333333333337,moe_ck2stages_gemm2_256x64x128x128_1x4_MulABScaleExpertWeightA8W8blkscale_v3_Nswizzle0_Quant4_MulRoutedWeight1_F8_F8_B16,ck,118.5934,260.1974333333333,10.98826162143728,23.679581201971704
230,64,4096,384,128,8,ActivationType.Gelu,QuantType.per_1x128,torch.bfloat16,torch.float8_e4m3fnuz,torch.float8_e4m3fnuz,1,0,2-stage,64,_ZN5aiter59fmoe_stage1_bf16_pertokenFp8_blockscale_g1u1_64x128_2tg_pf2E,asm,112.8182,29.27555555555544,moe_ck2stages_gemm2_256x64x128x128_1x4_MulABScaleExpertWeightA8W8blkscale_v3_Nswizzle0_Quant4_MulRoutedWeight1_F8_F8_B16,ck,117.903,259.99675555555547,10.98826162143728,23.661318278800458
231,64,4096,384,128,8,ActivationType.Silu,QuantType.per_1x128,torch.bfloat16,torch.float8_e4m3fnuz,torch.float8_e4m3fnuz,1,1,2-stage,64,moe_ck2stages_gemm1_256x64x128x128_1x4_MulABScaleExpertWeightA8W8blkscale_v3_Nswizzle0_Quant4_MulRoutedWeight1_silu_F8_F8_B16,ck,129.5056,28.916000000000004,moe_ck2stages_gemm2_256x64x128x128_1x4_MulABScaleExpertWeightA8W8blkscale_v3_Nswizzle0_Quant4_MulRoutedWeight0_F8_F8_B16,ck,116.3669,274.7885,10.98826162143728,25.007458819865384
232,64,4096,384,128,8,ActivationType.Gelu,QuantType.per_1x128,torch.bfloat16,torch.float8_e4m3fnuz,torch.float8_e4m3fnuz,1,1,2-stage,64,moe_ck2stages_gemm1_256x64x128x128_1x4_MulABScaleExpertWeightA8W8blkscale_v3_Nswizzle0_Quant4_MulRoutedWeight1_gelu_F8_F8_B16,ck,133.022,28.950777777777667,moe_ck2stages_gemm2_256x64x128x128_1x4_MulABScaleExpertWeightA8W8blkscale_v3_Nswizzle0_Quant4_MulRoutedWeight0_F8_F8_B16,ck,117.3011,279.27387777777767,10.98826162143728,25.415656033610915
233,64,4096,384,128,8,ActivationType.Gelu,QuantType.per_1x128,torch.bfloat16,torch.float8_e4m3fnuz,torch.float8_e4m3fnuz,1,0,2-stage,64,_ZN5aiter59fmoe_stage1_bf16_pertokenFp8_blockscale_g1u1_64x128_2tg_pf2E,asm,113.1868,28.434333333333257,moe_ck2stages_gemm2_256x64x128x128_1x4_MulABScaleExpertWeightA8W8blkscale_v3_Nswizzle0_Quant4_MulRoutedWeight1_F8_F8_B16,ck,118.6785,260.29963333333325,10.98826162143728,23.688882036218363
234,64,4096,384,128,8,ActivationType.Silu,QuantType.per_1x128,torch.bfloat16,torch.float8_e4m3fnuz,torch.float8_e4m3fnuz,1,1,2-stage,64,moe_ck2stages_gemm1_256x64x128x128_1x4_MulABScaleExpertWeightA8W8blkscale_v3_Nswizzle0_Quant4_MulRoutedWeight1_silu_F8_F8_B16,ck,133.2535,29.16411111111112,moe_ck2stages_gemm2_256x64x128x128_1x4_MulABScaleExpertWeightA8W8blkscale_v3_Nswizzle0_Quant4_MulRoutedWeight0_F8_F8_B16,ck,116.6613,279.0789111111111,10.98826162143728,25.39791285699359
235,64,4096,384,128,8,ActivationType.Gelu,QuantType.per_1x128,torch.bfloat16,torch.float8_e4m3fnuz,torch.float8_e4m3fnuz,1,1,2-stage,64,moe_ck2stages_gemm1_256x64x128x128_1x4_MulABScaleExpertWeightA8W8blkscale_v3_Nswizzle0_Quant4_MulRoutedWeight1_gelu_F8_F8_B16,ck,132.9832,28.14888888888888,moe_ck2stages_gemm2_256x64x128x128_1x4_MulABScaleExpertWeightA8W8blkscale_v3_Nswizzle0_Quant4_MulRoutedWeight0_F8_F8_B16,ck,119.4624,280.5944888888889,10.98826162143728,25.535839840350175
236,64,7168,256,256,8,ActivationType.Gelu,QuantType.No,torch.bfloat16,torch.bfloat16,torch.bfloat16,1,0,2-stage,32,moe_ck2stages_gemm1_256x32x64x64_1x4_TypeCast_v1_Nswizzle0_Quant0_MulRoutedWeight0_gelu_B16_B16_B16,ck,431.2926,0.0,moe_ck2stages_gemm2_256x32x64x128_1x4_TypeCastExpertWeight_v1_Nswizzle0_Quant0_MulRoutedWeight1_B16_B16_B16,ck,232.7208,664.0134,24.802186626627414,26.77237333933779
237,64,7168,256,256,8,ActivationType.Gelu,QuantType.No,torch.bfloat16,torch.bfloat16,torch.bfloat16,1,1,2-stage,32,moe_ck2stages_gemm1_256x32x64x64_1x4_TypeCastExpertWeight_v1_Nswizzle0_Quant0_MulRoutedWeight1_gelu_B16_B16_B16,ck,440.2898,0.0,moe_ck2stages_gemm2_256x32x64x64_1x4_TypeCast_v1_Nswizzle0_Quant0_MulRoutedWeight0_B16_B16_B16,ck,232.7484,673.0382,24.802186626627414,27.13624448246962
238,64,7168,256,256,8,ActivationType.Gelu,QuantType.per_Tensor,torch.bfloat16,torch.float8_e4m3fnuz,torch.float8_e4m3fnuz,1,0,2-stage,32,_ZN5aiter48fmoe_stage1_bf16_pertokenFp8_g1u1_32x128_3tg_pf2E,asm,223.9028,26.833111111111112,moe_ck2stages_gemm2_256x32x64x256_1x4_MulABScaleExpertWeight_v1_Nswizzle0_Quant1_MulRoutedWeight1_F8_F8_B16,ck,123.2942,374.0301111111111,12.931514928514204,28.923920606267757
239,64,7168,256,256,8,ActivationType.Gelu,QuantType.per_Tensor,torch.bfloat16,torch.float8_e4m3fnuz,torch.float8_e4m3fnuz,1,1,2-stage,32,_ZN5aiter57fmoe_stage1_bf16_pertokenFp8_doweight_g1u1_32x256_2tg_pf3E,asm,225.5699,27.460333333333296,moe_ck2stages_gemm2_256x32x64x256_1x4_MulABScaleExpertWeight_v1_Nswizzle0_Quant1_MulRoutedWeight0_F8_F8_B16,ck,123.3209,376.3511333333333,12.931514928514204,29.10340632275595
240,64,7168,256,256,8,ActivationType.Gelu,QuantType.per_Token,torch.bfloat16,torch.float8_e4m3fnuz,torch.float8_e4m3fnuz,1,0,1-stage,32,_ZN5aiter45fmoe_bf16_pertokenFp8_g1u1_vs_gelu_1tg_32x256E,asm,350.2032,0.0,,,0.0,350.2032,12.931514928514204,27.081374605831847
241,64,7168,256,256,8,ActivationType.Gelu,QuantType.per_Token,torch.bfloat16,torch.float8_e4m3fnuz,torch.float8_e4m3fnuz,1,1,1-stage,32,_ZN5aiter50fmoe_bf16_pertokenFp8_g1u1_vs_tkw1_gelu_1tg_32x256E,asm,352.6236,0.0,,,0.0,352.6236,12.931514928514204,27.268545251605374
242,64,7168,256,256,8,ActivationType.Silu,QuantType.No,torch.bfloat16,torch.bfloat16,torch.bfloat16,1,0,2-stage,32,moe_ck2stages_gemm1_256x32x64x64_1x4_TypeCast_v1_Nswizzle0_Quant0_MulRoutedWeight0_silu_B16_B16_B16,ck,440.1412,0.0,moe_ck2stages_gemm2_256x32x64x64_1x4_TypeCastExpertWeight_v1_Nswizzle0_Quant0_MulRoutedWeight1_B16_B16_B16,ck,235.0294,675.1706,24.802186626627414,27.222220772870998
243,64,7168,256,256,8,ActivationType.Silu,QuantType.No,torch.bfloat16,torch.bfloat16,torch.bfloat16,1,1,2-stage,32,moe_ck2stages_gemm1_256x32x64x64_1x4_TypeCastExpertWeight_v1_Nswizzle0_Quant0_MulRoutedWeight1_silu_B16_B16_B16,ck,441.5433,0.0,moe_ck2stages_gemm2_256x32x64x64_1x4_TypeCast_v1_Nswizzle0_Quant0_MulRoutedWeight0_B16_B16_B16,ck,236.5833,678.1266,24.802186626627414,27.341403812838387
244,64,7168,256,256,8,ActivationType.Silu,QuantType.per_Tensor,torch.bfloat16,torch.float8_e4m3fnuz,torch.float8_e4m3fnuz,1,0,2-stage,32,_ZN5aiter48fmoe_stage1_bf16_pertokenFp8_g1u1_32x256_2tg_pf3E,asm,221.7788,27.469222222222168,moe_ck2stages_gemm2_256x32x64x128_1x4_MulABScaleExpertWeight_v1_Nswizzle0_Quant1_MulRoutedWeight1_F8_F8_B16,ck,126.8604,376.10842222222215,12.931514928514204,29.084637360847555
245,64,7168,256,256,8,ActivationType.Silu,QuantType.per_Tensor,torch.bfloat16,torch.float8_e4m3fnuz,torch.float8_e4m3fnuz,1,1,2-stage,32,_ZN5aiter57fmoe_stage1_bf16_pertokenFp8_doweight_g1u1_32x256_2tg_pf2E,asm,224.7751,27.15344444444445,moe_ck2stages_gemm2_256x32x64x128_1x4_MulABScaleExpertWeight_v1_Nswizzle0_Quant1_MulRoutedWeight0_F8_F8_B16,ck,124.4007,376.3292444444445,12.931514928514204,29.10171364490577
246,64,7168,256,256,8,ActivationType.Silu,QuantType.per_Token,torch.bfloat16,torch.float8_e4m3fnuz,torch.float8_e4m3fnuz,1,0,1-stage,32,_ZN5aiter45fmoe_bf16_pertokenFp8_g1u1_vs_silu_1tg_32x256E,asm,351.6245,0.0,,,0.0,351.6245,12.931514928514204,27.191284388858584
247,64,7168,256,256,8,ActivationType.Silu,QuantType.per_Token,torch.bfloat16,torch.float8_e4m3fnuz,torch.float8_e4m3fnuz,1,1,1-stage,32,_ZN5aiter50fmoe_bf16_pertokenFp8_g1u1_vs_tkw1_silu_1tg_32x256E,asm,351.8256,0.0,,,0.0,351.8256,12.931514928514204,27.20683554439695
248,64,7168,256,256,8,ActivationType.Silu,QuantType.per_Tensor,torch.bfloat16,torch.float8_e4m3fnuz,torch.float8_e4m3fnuz,1,0,2-stage,32,_ZN5aiter48fmoe_stage1_bf16_pertokenFp8_g1u1_32x128_3tg_pf2E,asm,225.6949,26.86388888888888,moe_ck2stages_gemm2_256x32x64x256_1x4_MulABScaleExpertWeight_v1_Nswizzle0_Quant1_MulRoutedWeight1_F8_F8_B16,ck,126.5492,379.1079888888889,12.931514928514204,29.316595231464298
249,64,7168,256,256,8,ActivationType.Silu,QuantType.per_Tensor,torch.bfloat16,torch.float8_e4m3fnuz,torch.float8_e4m3fnuz,1,1,2-stage,32,_ZN5aiter57fmoe_stage1_bf16_pertokenFp8_doweight_g1u1_32x256_2tg_pf2E,asm,226.3174,26.508444444444365,moe_ck2stages_gemm2_256x32x64x128_1x4_MulABScaleExpertWeight_v1_Nswizzle0_Quant1_MulRoutedWeight0_F8_F8_B16,ck,125.4813,378.3071444444444,12.931514928514204,29.25466556205808
250,64,7168,256,256,8,ActivationType.Silu,QuantType.per_Token,torch.bfloat16,torch.float8_e4m3fnuz,torch.float8_e4m3fnuz,1,0,1-stage,32,_ZN5aiter45fmoe_bf16_pertokenFp8_g1u1_vs_silu_1tg_32x256E,asm,351.6153,0.0,,,0.0,351.6153,12.931514928514204,27.190572948625103
251,64,7168,256,256,8,ActivationType.Silu,QuantType.per_Token,torch.bfloat16,torch.float8_e4m3fnuz,torch.float8_e4m3fnuz,1,1,1-stage,32,_ZN5aiter50fmoe_bf16_pertokenFp8_g1u1_vs_tkw1_silu_1tg_32x256E,asm,350.4063,0.0,,,0.0,350.4063,12.931514928514204,27.09708042229053
252,64,7168,256,256,8,ActivationType.Gelu,QuantType.per_Tensor,torch.bfloat16,torch.float8_e4m3fnuz,torch.float8_e4m3fnuz,1,0,2-stage,32,_ZN5aiter48fmoe_stage1_bf16_pertokenFp8_g1u1_32x256_2tg_pf2E,asm,225.5157,27.38400000000001,moe_ck2stages_gemm2_256x32x64x256_1x4_MulABScaleExpertWeight_v1_Nswizzle0_Quant1_MulRoutedWeight1_F8_F8_B16,ck,125.1289,378.0286,12.931514928514204,29.233125591993918
253,64,7168,256,256,8,ActivationType.Gelu,QuantType.per_Tensor,torch.bfloat16,torch.float8_e4m3fnuz,torch.float8_e4m3fnuz,1,1,2-stage,32,_ZN5aiter57fmoe_stage1_bf16_pertokenFp8_doweight_g1u1_32x256_2tg_pf2E,asm,226.309,26.694666666666578,moe_ck2stages_gemm2_256x32x64x256_1x4_MulABScaleExpertWeight_v1_Nswizzle0_Quant1_MulRoutedWeight0_F8_F8_B16,ck,123.8299,376.83356666666657,12.931514928514204,29.14071311441959
254,64,7168,256,256,8,ActivationType.Gelu,QuantType.per_Token,torch.bfloat16,torch.float8_e4m3fnuz,torch.float8_e4m3fnuz,1,0,1-stage,32,_ZN5aiter45fmoe_bf16_pertokenFp8_g1u1_vs_gelu_1tg_32x256E,asm,350.2204,0.0,,,0.0,350.2204,12.931514928514204,27.082704689746613
255,64,7168,256,256,8,ActivationType.Gelu,QuantType.per_Token,torch.bfloat16,torch.float8_e4m3fnuz,torch.float8_e4m3fnuz,1,1,1-stage,32,_ZN5aiter53fmoe_bf16_pertokenFp8_g1u1_vs_tkw1_gelu_1tg_ps_32x256E,asm,350.0978,0.0,,,0.0,350.0978,12.931514928514204,27.073223975330883
256,64,7168,256,256,8,ActivationType.Gelu,QuantType.per_1x128,torch.bfloat16,torch.float8_e4m3fnuz,torch.float8_e4m3fnuz,1,0,1-stage,32,_ZN5aiter47fmoe_bf16_blockscaleFp8_g1u1_vs_gelu_1tg_32x256E,asm,346.4777,0.0,,,0.0,346.4777,12.931514928514204,26.793279976502287
257,64,7168,256,256,8,ActivationType.Gelu,QuantType.per_1x128,torch.bfloat16,torch.float8_e4m3fnuz,torch.float8_e4m3fnuz,1,1,2-stage,16,moe_ck2stages_gemm1_256x16x128x256_1x4_MulABScaleExpertWeightA8W8blkscale_v1_Nswizzle0_Quant4_MulRoutedWeight1_gelu_F8_F8_B16,ck,218.661,26.515333333333345,moe_ck2stages_gemm2_256x16x128x256_1x4_MulABScaleExpertWeightA8W8blkscale_v1_Nswizzle0_Quant4_MulRoutedWeight0_F8_F8_B16,ck,120.6501,365.8264333333333,12.931514928514204,28.289526428700164
258,64,7168,256,256,8,ActivationType.Silu,QuantType.per_1x128,torch.bfloat16,torch.float8_e4m3fnuz,torch.float8_e4m3fnuz,1,1,2-stage,16,moe_ck2stages_gemm1_256x16x128x256_1x4_MulABScaleExpertWeightA8W8blkscale_v1_Nswizzle0_Quant4_MulRoutedWeight1_silu_F8_F8_B16,ck,220.6348,26.239888888888952,moe_ck2stages_gemm2_256x16x128x256_1x4_MulABScaleExpertWeightA8W8blkscale_v1_Nswizzle0_Quant4_MulRoutedWeight0_F8_F8_B16,ck,125.4922,372.366888888889,12.931514928514204,28.795302866473428
259,64,7168,256,256,8,ActivationType.Silu,QuantType.per_1x128,torch.bfloat16,torch.float8_e4m3fnuz,torch.float8_e4m3fnuz,1,0,1-stage,32,_ZN5aiter47fmoe_bf16_blockscaleFp8_g1u1_vs_silu_1tg_32x256E,asm,347.611,0.0,,,0.0,347.611,12.931514928514204,26.88091858700267
260,64,7168,256,256,8,ActivationType.Gelu,QuantType.per_1x128,torch.bfloat16,torch.float8_e4m3fnuz,torch.float8_e4m3fnuz,1,0,1-stage,32,_ZN5aiter47fmoe_bf16_blockscaleFp8_g1u1_vs_gelu_1tg_32x256E,asm,347.0689,0.0,,,0.0,347.0689,12.931514928514204,26.838997744549427
261,64,7168,256,256,8,ActivationType.Silu,QuantType.per_1x128,torch.bfloat16,torch.float8_e4m3fnuz,torch.float8_e4m3fnuz,1,1,2-stage,16,moe_ck2stages_gemm1_256x16x128x256_1x4_MulABScaleExpertWeightA8W8blkscale_v1_Nswizzle0_Quant4_MulRoutedWeight1_silu_F8_F8_B16,ck,219.2859,25.896888888888853,moe_ck2stages_gemm2_256x16x128x256_1x4_MulABScaleExpertWeightA8W8blkscale_v1_Nswizzle0_Quant4_MulRoutedWeight0_F8_F8_B16,ck,120.8836,366.06638888888887,12.931514928514204,28.30808230222945
262,64,7168,256,256,8,ActivationType.Gelu,QuantType.per_1x128,torch.bfloat16,torch.float8_e4m3fnuz,torch.float8_e4m3fnuz,1,1,2-stage,16,moe_ck2stages_gemm1_256x16x128x256_1x4_MulABScaleExpertWeightA8W8blkscale_v1_Nswizzle0_Quant4_MulRoutedWeight1_gelu_F8_F8_B16,ck,220.0647,25.91466666666675,moe_ck2stages_gemm2_256x16x128x256_1x4_MulABScaleExpertWeightA8W8blkscale_v1_Nswizzle0_Quant4_MulRoutedWeight0_F8_F8_B16,ck,126.0029,371.9822666666668,12.931514928514204,28.765559853040866
263,64,7168,256,257,9,ActivationType.Silu,QuantType.per_Token,torch.bfloat16,torch.float8_e4m3fnuz,torch.float8_e4m3fnuz,1,0,1-stage,32,_ZN5aiter45fmoe_bf16_pertokenFp8_g1u1_vs_silu_1tg_32x256E,asm,353.3932,0.0,,,0.0,353.3932,14.486127879484139,24.395283745940848
264,64,7168,256,256,8,ActivationType.Silu,QuantType.per_1x128,torch.bfloat16,torch.float8_e4m3fnuz,torch.float8_e4m3fnuz,1,0,1-stage,32,_ZN5aiter47fmoe_bf16_blockscaleFp8_g1u1_vs_silu_1tg_32x256E,asm,348.481,0.0,,,0.0,348.481,12.931514928514204,26.948196087342684
265,64,7168,256,257,9,ActivationType.Silu,QuantType.per_1x128,torch.bfloat16,torch.float8_e4m3fnuz,torch.float8_e4m3fnuz,1,0,1-stage,32,_ZN5aiter47fmoe_bf16_blockscaleFp8_g1u1_vs_silu_1tg_32x256E,asm,350.0718,0.0,,,0.0,350.0718,14.486127879484139,24.16600232390509
266,64,7168,512,256,8,ActivationType.Gelu,QuantType.No,torch.bfloat16,torch.bfloat16,torch.bfloat16,1,0,2-stage,32,moe_ck2stages_gemm1_256x32x64x64_1x4_TypeCast_v1_Nswizzle0_Quant0_MulRoutedWeight0_gelu_B16_B16_B16,ck,857.849,0.0,moe_ck2stages_gemm2_256x32x64x128_1x4_TypeCastExpertWeight_v1_Nswizzle0_Quant0_MulRoutedWeight1_B16_B16_B16,ck,452.475,1310.324,49.109761932500106,26.68153842409175
267,64,7168,512,256,8,ActivationType.Gelu,QuantType.No,torch.bfloat16,torch.bfloat16,torch.bfloat16,1,1,2-stage,32,moe_ck2stages_gemm1_256x32x64x128_1x4_TypeCastExpertWeight_v1_Nswizzle0_Quant0_MulRoutedWeight1_gelu_B16_B16_B16,ck,858.4786,0.0,moe_ck2stages_gemm2_256x32x64x128_1x4_TypeCast_v1_Nswizzle0_Quant0_MulRoutedWeight0_B16_B16_B16,ck,451.0762,1309.5548,49.109761932500106,26.665875550362955
268,64,7168,512,256,8,ActivationType.Gelu,QuantType.per_Tensor,torch.bfloat16,torch.float8_e4m3fnuz,torch.float8_e4m3fnuz,1,0,2-stage,32,_ZN5aiter44fmoe_stage1_bf16_pertokenFp8_g1u1_32x512_pf2E,asm,432.0985,27.62911111111112,moe_ck2stages_gemm2_256x32x64x128_1x4_MulABScaleExpertWeight_v1_Nswizzle0_Quant1_MulRoutedWeight1_F8_F8_B16,ck,242.5229,702.2505111111111,25.36841853627369,27.6820768352974
269,64,7168,512,256,8,ActivationType.Gelu,QuantType.per_Tensor,torch.bfloat16,torch.float8_e4m3fnuz,torch.float8_e4m3fnuz,1,1,2-stage,32,_ZN5aiter53fmoe_stage1_bf16_pertokenFp8_doweight_g1u1_32x512_pf2E,asm,430.3351,27.549777777777724,moe_ck2stages_gemm2_256x32x64x256_1x4_MulABScaleExpertWeight_v1_Nswizzle0_Quant1_MulRoutedWeight0_F8_F8_B16,ck,232.1828,690.0676777777777,25.36841853627369,27.201840618920198
270,64,7168,512,256,8,ActivationType.Gelu,QuantType.per_Token,torch.bfloat16,torch.float8_e4m3fnuz,torch.float8_e4m3fnuz,1,0,1-stage,32,_ZN5aiter45fmoe_bf16_pertokenFp8_g1u1_vs_gelu_1tg_32x512E,asm,672.6801,0.0,,,0.0,672.6801,25.36841853627369,26.51643810741103
271,64,7168,512,256,8,ActivationType.Gelu,QuantType.per_Token,torch.bfloat16,torch.float8_e4m3fnuz,torch.float8_e4m3fnuz,1,1,1-stage,32,_ZN5aiter50fmoe_bf16_pertokenFp8_g1u1_vs_tkw1_gelu_1tg_32x512E,asm,677.6064,0.0,,,0.0,677.6064,25.36841853627369,26.71062837563591
272,64,7168,512,256,8,ActivationType.Silu,QuantType.No,torch.bfloat16,torch.bfloat16,torch.bfloat16,1,1,2-stage,32,moe_ck2stages_gemm1_256x32x64x128_1x4_TypeCastExpertWeight_v1_Nswizzle0_Quant0_MulRoutedWeight1_silu_B16_B16_B16,ck,857.5469,0.0,moe_ck2stages_gemm2_256x32x64x128_1x4_TypeCast_v1_Nswizzle0_Quant0_MulRoutedWeight0_B16_B16_B16,ck,450.9035,1308.4504000000002,49.109761932500106,26.64338714975703
273,64,7168,512,256,8,ActivationType.Silu,QuantType.per_Tensor,torch.bfloat16,torch.float8_e4m3fnuz,torch.float8_e4m3fnuz,1,0,2-stage,32,_ZN5aiter44fmoe_stage1_bf16_pertokenFp8_g1u1_32x512_pf2E,asm,434.0137,26.69933333333338,moe_ck2stages_gemm2_256x32x64x256_1x4_MulABScaleExpertWeight_v1_Nswizzle0_Quant1_MulRoutedWeight1_F8_F8_B16,ck,225.4118,686.1248333333333,25.36841853627369,27.04641727478045
274,64,7168,512,256,8,ActivationType.Silu,QuantType.per_Tensor,torch.bfloat16,torch.float8_e4m3fnuz,torch.float8_e4m3fnuz,1,1,2-stage,32,_ZN5aiter53fmoe_stage1_bf16_pertokenFp8_doweight_g1u1_32x512_pf3E,asm,432.1806,27.184888888888903,moe_ck2stages_gemm2_256x32x64x256_1x4_MulABScaleExpertWeight_v1_Nswizzle0_Quant1_MulRoutedWeight0_F8_F8_B16,ck,221.7692,681.134688888889,25.36841853627369,26.84971031658717
275,64,7168,512,256,8,ActivationType.Silu,QuantType.per_Token,torch.bfloat16,torch.float8_e4m3fnuz,torch.float8_e4m3fnuz,1,0,1-stage,32,_ZN5aiter48fmoe_bf16_pertokenFp8_g1u1_vs_silu_1tg_ps_32x256E,asm,677.052,0.0,,,0.0,677.052,25.36841853627369,26.688774431559448
276,64,7168,512,256,8,ActivationType.Silu,QuantType.per_Token,torch.bfloat16,torch.float8_e4m3fnuz,torch.float8_e4m3fnuz,1,1,1-stage,32,_ZN5aiter50fmoe_bf16_pertokenFp8_g1u1_vs_tkw1_silu_1tg_32x512E,asm,675.7076,0.0,,,0.0,675.7076,25.36841853627369,26.635779405555848
277,64,7168,512,256,8,ActivationType.Silu,QuantType.No,torch.bfloat16,torch.bfloat16,torch.bfloat16,1,0,2-stage,64,moe_ck2stages_gemm1_256x64x64x128_1x4_TypeCast_v1_Nswizzle0_Quant0_MulRoutedWeight0_silu_B16_B16_B16,ck,857.6262,0.0,moe_ck2stages_gemm2_256x64x64x64_1x4_TypeCastExpertWeight_v1_Nswizzle0_Quant0_MulRoutedWeight1_B16_B16_B16,ck,443.581,1301.2072,49.109761932500106,26.495897125065895
278,64,7168,512,256,8,ActivationType.Silu,QuantType.per_Token,torch.bfloat16,torch.float8_e4m3fnuz,torch.float8_e4m3fnuz,1,0,1-stage,32,_ZN5aiter45fmoe_bf16_pertokenFp8_g1u1_vs_silu_1tg_32x512E,asm,675.9405,0.0,,,0.0,675.9405,25.36841853627369,26.644960111860698
279,64,7168,512,256,8,ActivationType.Silu,QuantType.per_Tensor,torch.bfloat16,torch.float8_e4m3fnuz,torch.float8_e4m3fnuz,1,0,2-stage,32,_ZN5aiter44fmoe_stage1_bf16_pertokenFp8_g1u1_32x512_pf2E,asm,433.6075,27.88366666666673,moe_ck2stages_gemm2_256x32x64x128_1x4_MulABScaleExpertWeight_v1_Nswizzle0_Quant1_MulRoutedWeight1_F8_F8_B16,ck,235.0286,696.5197666666668,25.36841853627369,27.45617609827471
280,64,7168,512,256,8,ActivationType.Silu,QuantType.per_Token,torch.bfloat16,torch.float8_e4m3fnuz,torch.float8_e4m3fnuz,1,1,1-stage,32,_ZN5aiter53fmoe_bf16_pertokenFp8_g1u1_vs_tkw1_silu_1tg_ps_32x512E,asm,667.8686,0.0,,,0.0,667.8686,25.36841853627369,26.326773150838346
281,64,7168,512,256,8,ActivationType.Silu,QuantType.per_Tensor,torch.bfloat16,torch.float8_e4m3fnuz,torch.float8_e4m3fnuz,1,1,2-stage,32,_ZN5aiter53fmoe_stage1_bf16_pertokenFp8_doweight_g1u1_32x512_pf2E,asm,434.8292,27.22433333333335,moe_ck2stages_gemm2_256x32x64x256_1x4_MulABScaleExpertWeight_v1_Nswizzle0_Quant1_MulRoutedWeight0_F8_F8_B16,ck,221.6338,683.6873333333333,25.36841853627369,26.950333240353366
282,64,7168,512,256,8,ActivationType.Gelu,QuantType.per_Tensor,torch.bfloat16,torch.float8_e4m3fnuz,torch.float8_e4m3fnuz,1,0,2-stage,32,_ZN5aiter44fmoe_stage1_bf16_pertokenFp8_g1u1_32x512_pf3E,asm,431.2071,27.20711111111113,moe_ck2stages_gemm2_256x32x64x256_1x4_MulABScaleExpertWeight_v1_Nswizzle0_Quant1_MulRoutedWeight1_F8_F8_B16,ck,234.1937,692.6079111111112,25.36841853627369,27.301974307967516
283,64,7168,512,256,8,ActivationType.Gelu,QuantType.per_Tensor,torch.bfloat16,torch.float8_e4m3fnuz,torch.float8_e4m3fnuz,1,1,2-stage,32,_ZN5aiter53fmoe_stage1_bf16_pertokenFp8_doweight_g1u1_32x512_pf2E,asm,431.3794,27.999333333333343,moe_ck2stages_gemm2_256x32x64x256_1x4_MulABScaleExpertWeight_v1_Nswizzle0_Quant1_MulRoutedWeight0_F8_F8_B16,ck,235.0626,694.4413333333333,25.36841853627369,27.3742461454729
284,64,7168,512,256,8,ActivationType.Gelu,QuantType.per_Token,torch.bfloat16,torch.float8_e4m3fnuz,torch.float8_e4m3fnuz,1,0,1-stage,32,_ZN5aiter45fmoe_bf16_pertokenFp8_g1u1_vs_gelu_1tg_32x512E,asm,666.4638,0.0,,,0.0,666.4638,25.36841853627369,26.271397211735508
285,64,7168,512,256,8,ActivationType.Gelu,QuantType.per_Token,torch.bfloat16,torch.float8_e4m3fnuz,torch.float8_e4m3fnuz,1,1,1-stage,32,_ZN5aiter53fmoe_bf16_pertokenFp8_g1u1_vs_tkw1_gelu_1tg_ps_32x512E,asm,669.5553,0.0,,,0.0,669.5553,25.36841853627369,26.393261331707336
286,64,7168,512,256,8,ActivationType.Gelu,QuantType.per_1x128,torch.bfloat16,torch.float8_e4m3fnuz,torch.float8_e4m3fnuz,1,0,1-stage,32,_ZN5aiter47fmoe_bf16_blockscaleFp8_g1u1_vs_gelu_1tg_32x256E,asm,680.568,0.0,,,0.0,680.568,25.36841853627369,26.82737195568073
287,64,7168,512,256,8,ActivationType.Silu,QuantType.per_1x128,torch.bfloat16,torch.float8_e4m3fnuz,torch.float8_e4m3fnuz,1,0,1-stage,32,_ZN5aiter47fmoe_bf16_blockscaleFp8_g1u1_vs_silu_1tg_32x256E,asm,681.9003,0.0,,,0.0,681.9003,25.36841853627369,26.87989001068266
288,64,7168,512,256,8,ActivationType.Gelu,QuantType.per_1x128,torch.bfloat16,torch.float8_e4m3fnuz,torch.float8_e4m3fnuz,1,1,2-stage,16,moe_ck2stages_gemm1_256x16x128x256_1x4_MulABScaleExpertWeightA8W8blkscale_v1_Nswizzle0_Quant4_MulRoutedWeight1_gelu_F8_F8_B16,ck,428.6484,29.61333333333329,moe_ck2stages_gemm2_256x16x128x256_1x4_MulABScaleExpertWeightA8W8blkscale_v1_Nswizzle0_Quant4_MulRoutedWeight0_F8_F8_B16,ck,235.2682,693.5299333333332,25.36841853627369,27.338319585892652
289,64,7168,512,256,8,ActivationType.Silu,QuantType.per_1x128,torch.bfloat16,torch.float8_e4m3fnuz,torch.float8_e4m3fnuz,1,1,2-stage,16,moe_ck2stages_gemm1_256x16x128x256_1x4_MulABScaleExpertWeightA8W8blkscale_v1_Nswizzle0_Quant4_MulRoutedWeight1_silu_F8_F8_B16,ck,428.7998,30.46422222222226,moe_ck2stages_gemm2_256x16x128x256_1x4_MulABScaleExpertWeightA8W8blkscale_v1_Nswizzle0_Quant4_MulRoutedWeight0_F8_F8_B16,ck,236.7904,696.0544222222222,25.36841853627369,27.43783264325093
290,64,7168,512,256,8,ActivationType.Silu,QuantType.per_1x128,torch.bfloat16,torch.float8_e4m3fnuz,torch.float8_e4m3fnuz,1,0,1-stage,32,_ZN5aiter47fmoe_bf16_blockscaleFp8_g1u1_vs_silu_1tg_32x256E,asm,681.9622,0.0,,,0.0,681.9622,25.36841853627369,26.88233005241847
291,64,7168,512,256,8,ActivationType.Gelu,QuantType.per_1x128,torch.bfloat16,torch.float8_e4m3fnuz,torch.float8_e4m3fnuz,1,0,1-stage,32,_ZN5aiter47fmoe_bf16_blockscaleFp8_g1u1_vs_gelu_1tg_32x256E,asm,674.4545,0.0,,,0.0,674.4545,25.36841853627369,26.586383342564844
292,64,7168,512,256,8,ActivationType.Silu,QuantType.per_1x128,torch.bfloat16,torch.float8_e4m3fnuz,torch.float8_e4m3fnuz,1,1,2-stage,16,moe_ck2stages_gemm1_256x16x128x256_1x4_MulABScaleExpertWeightA8W8blkscale_v1_Nswizzle0_Quant4_MulRoutedWeight1_silu_F8_F8_B16,ck,428.6901,28.741444444444465,moe_ck2stages_gemm2_256x16x128x256_1x4_MulABScaleExpertWeightA8W8blkscale_v1_Nswizzle0_Quant4_MulRoutedWeight0_F8_F8_B16,ck,234.9216,692.3531444444445,25.36841853627369,27.29193163753844
293,64,7168,512,256,8,ActivationType.Gelu,QuantType.per_1x128,torch.bfloat16,torch.float8_e4m3fnuz,torch.float8_e4m3fnuz,1,1,2-stage,16,moe_ck2stages_gemm1_256x16x128x256_1x4_MulABScaleExpertWeightA8W8blkscale_v1_Nswizzle0_Quant4_MulRoutedWeight1_gelu_F8_F8_B16,ck,426.8817,30.27733333333324,moe_ck2stages_gemm2_256x16x128x256_1x4_MulABScaleExpertWeightA8W8blkscale_v1_Nswizzle0_Quant4_MulRoutedWeight0_F8_F8_B16,ck,237.3665,694.5255333333332,25.36841853627369,27.37756523293905
294,64,7168,2048,33,10,ActivationType.Silu,QuantType.per_1x128,torch.bfloat16,torch.float8_e4m3fnuz,torch.float8_e4m3fnuz,1,0,1-stage,32,_ZN5aiter47fmoe_bf16_blockscaleFp8_g1u1_vs_silu_1tg_32x256E,asm,443.7898,0.0,,,0.0,443.7898,124.86364739834957,3.5541953903059373
295,64,7168,2048,33,10,ActivationType.Silu,QuantType.per_Token,torch.bfloat16,torch.float8_e4m3fnuz,torch.float8_e4m3fnuz,1,0,1-stage,32,_ZN5aiter48fmoe_bf16_pertokenFp8_g1u1_vs_silu_1tg_ps_32x512E,asm,415.2793,0.0,,,0.0,415.2793,124.86364739834957,3.3258623198403305
296,128,2048,192,128,8,ActivationType.Silu,QuantType.No,torch.bfloat16,torch.bfloat16,torch.bfloat16,1,0,2-stage,32,moe_ck2stages_gemm1_256x32x64x64_1x4_TypeCast_v1_Nswizzle0_Quant0_MulRoutedWeight0_silu_B16_B16_B16,ck,56.9152,0.0,moe_ck2stages_gemm2_256x32x64x64_1x4_TypeCastExpertWeight_v1_Nswizzle0_Quant0_MulRoutedWeight1_B16_B16_B16,ck,34.8631,91.7783,5.688442401015136,16.134170574289655
297,128,2048,192,128,8,ActivationType.Silu,QuantType.No,torch.bfloat16,torch.bfloat16,torch.bfloat16,1,1,2-stage,32,moe_ck2stages_gemm1_256x32x64x64_1x4_TypeCastExpertWeight_v1_Nswizzle0_Quant0_MulRoutedWeight1_silu_B16_B16_B16,ck,56.9624,0.0,moe_ck2stages_gemm2_256x32x64x64_1x4_TypeCast_v1_Nswizzle0_Quant0_MulRoutedWeight0_B16_B16_B16,ck,33.9122,90.8746,5.688442401015136,15.975304590195533
298,128,2048,192,128,8,ActivationType.Gelu,QuantType.No,torch.bfloat16,torch.bfloat16,torch.bfloat16,1,0,2-stage,32,moe_ck2stages_gemm1_256x32x64x64_1x4_TypeCast_v1_Nswizzle0_Quant0_MulRoutedWeight0_gelu_B16_B16_B16,ck,58.4402,0.0,moe_ck2stages_gemm2_256x32x64x64_1x4_TypeCastExpertWeight_v1_Nswizzle0_Quant0_MulRoutedWeight1_B16_B16_B16,ck,35.5545,93.9947,5.688442401015136,16.52380271675531
299,128,2048,192,128,8,ActivationType.Gelu,QuantType.No,torch.bfloat16,torch.bfloat16,torch.bfloat16,1,1,2-stage,32,moe_ck2stages_gemm1_256x32x64x64_1x4_TypeCastExpertWeight_v1_Nswizzle0_Quant0_MulRoutedWeight1_gelu_B16_B16_B16,ck,57.0904,0.0,moe_ck2stages_gemm2_256x32x64x64_1x4_TypeCast_v1_Nswizzle0_Quant0_MulRoutedWeight0_B16_B16_B16,ck,34.9713,92.0617,5.688442401015136,16.183990890647156
300,128,4096,192,128,8,ActivationType.Silu,QuantType.No,torch.bfloat16,torch.bfloat16,torch.bfloat16,1,0,2-stage,32,moe_ck2stages_gemm1_256x32x64x128_1x4_TypeCast_v1_Nswizzle0_Quant0_MulRoutedWeight0_silu_B16_B16_B16,ck,107.6027,0.0,moe_ck2stages_gemm2_256x32x64x64_1x4_TypeCastExpertWeight_v1_Nswizzle0_Quant0_MulRoutedWeight1_B16_B16_B16,ck,60.5912,168.1939,11.270896661868546,14.922849977768848
301,128,4096,192,128,8,ActivationType.Silu,QuantType.No,torch.bfloat16,torch.bfloat16,torch.bfloat16,1,1,2-stage,32,moe_ck2stages_gemm1_256x32x64x128_1x4_TypeCastExpertWeight_v1_Nswizzle0_Quant0_MulRoutedWeight1_silu_B16_B16_B16,ck,107.4769,0.0,moe_ck2stages_gemm2_256x32x64x64_1x4_TypeCast_v1_Nswizzle0_Quant0_MulRoutedWeight0_B16_B16_B16,ck,59.0364,166.51330000000002,11.270896661868546,14.773740279541752
302,128,4096,192,128,8,ActivationType.Gelu,QuantType.No,torch.bfloat16,torch.bfloat16,torch.bfloat16,1,0,2-stage,32,moe_ck2stages_gemm1_256x32x64x64_1x4_TypeCast_v1_Nswizzle0_Quant0_MulRoutedWeight0_gelu_B16_B16_B16,ck,105.8584,0.0,moe_ck2stages_gemm2_256x32x64x64_1x4_TypeCastExpertWeight_v1_Nswizzle0_Quant0_MulRoutedWeight1_B16_B16_B16,ck,60.5964,166.4548,11.270896661868546,14.768549920535275
303,128,4096,192,128,8,ActivationType.Gelu,QuantType.No,torch.bfloat16,torch.bfloat16,torch.bfloat16,1,1,2-stage,32,moe_ck2stages_gemm1_256x32x64x128_1x4_TypeCastExpertWeight_v1_Nswizzle0_Quant0_MulRoutedWeight1_gelu_B16_B16_B16,ck,107.582,0.0,moe_ck2stages_gemm2_256x32x64x64_1x4_TypeCast_v1_Nswizzle0_Quant0_MulRoutedWeight0_B16_B16_B16,ck,59.3587,166.9407,11.270896661868546,14.811660953718985
304,128,4096,384,128,8,ActivationType.Gelu,QuantType.No,torch.bfloat16,torch.bfloat16,torch.bfloat16,1,0,2-stage,32,moe_ck2stages_gemm1_256x32x64x64_1x4_TypeCast_v1_Nswizzle0_Quant0_MulRoutedWeight0_gelu_B16_B16_B16,ck,214.5422,0.0,moe_ck2stages_gemm2_256x32x64x128_1x4_TypeCastExpertWeight_v1_Nswizzle0_Quant0_MulRoutedWeight1_B16_B16_B16,ck,119.0819,333.6241,21.97652324287456,15.180931774918983
305,128,4096,384,128,8,ActivationType.Gelu,QuantType.No,torch.bfloat16,torch.bfloat16,torch.bfloat16,1,1,2-stage,32,moe_ck2stages_gemm1_256x32x64x128_1x4_TypeCastExpertWeight_v1_Nswizzle0_Quant0_MulRoutedWeight1_gelu_B16_B16_B16,ck,217.5656,0.0,moe_ck2stages_gemm2_256x32x64x64_1x4_TypeCast_v1_Nswizzle0_Quant0_MulRoutedWeight0_B16_B16_B16,ck,119.0842,336.6498,21.97652324287456,15.318610513569377
306,128,4096,384,128,8,ActivationType.Silu,QuantType.No,torch.bfloat16,torch.bfloat16,torch.bfloat16,1,0,2-stage,32,moe_ck2stages_gemm1_256x32x64x64_1x4_TypeCast_v1_Nswizzle0_Quant0_MulRoutedWeight0_silu_B16_B16_B16,ck,212.2621,0.0,moe_ck2stages_gemm2_256x32x64x64_1x4_TypeCastExpertWeight_v1_Nswizzle0_Quant0_MulRoutedWeight1_B16_B16_B16,ck,117.3514,329.6135,21.97652324287456,14.99843703015537
307,128,4096,384,128,8,ActivationType.Silu,QuantType.No,torch.bfloat16,torch.bfloat16,torch.bfloat16,1,1,2-stage,32,moe_ck2stages_gemm1_256x32x64x64_1x4_TypeCastExpertWeight_v1_Nswizzle0_Quant0_MulRoutedWeight1_silu_B16_B16_B16,ck,213.8681,0.0,moe_ck2stages_gemm2_256x32x64x128_1x4_TypeCast_v1_Nswizzle0_Quant0_MulRoutedWeight0_B16_B16_B16,ck,119.3858,333.2539,21.97652324287456,15.164086526200215
308,128,4096,384,128,8,ActivationType.Silu,QuantType.per_Tensor,torch.bfloat16,torch.float8_e4m3fnuz,torch.float8_e4m3fnuz,1,0,2-stage,32,_ZN5aiter48fmoe_stage1_bf16_pertokenFp8_g1u1_32x128_3tg_pf2E,asm,109.8868,32.38822222222229,moe_ck2stages_gemm2_256x32x64x128_1x4_MulABScaleExpertWeight_v1_Nswizzle0_Quant1_MulRoutedWeight1_F8_F8_B16,ck,61.3461,203.62112222222228,11.801661787348953,17.253597492558068
309,128,4096,384,128,8,ActivationType.Silu,QuantType.per_Tensor,torch.bfloat16,torch.float8_e4m3fnuz,torch.float8_e4m3fnuz,1,1,2-stage,32,_ZN5aiter57fmoe_stage1_bf16_pertokenFp8_doweight_g1u1_32x128_3tg_pf2E,asm,109.9796,33.25611111111117,moe_ck2stages_gemm2_256x32x64x128_1x4_MulABScaleExpertWeight_v1_Nswizzle0_Quant1_MulRoutedWeight0_F8_F8_B16,ck,61.2035,204.4392111111112,11.801661787348953,17.322917297144055
310,128,4096,384,128,8,ActivationType.Silu,QuantType.per_Token,torch.bfloat16,torch.float8_e4m3fnuz,torch.float8_e4m3fnuz,1,0,1-stage,32,_ZN5aiter45fmoe_bf16_pertokenFp8_g1u1_vs_silu_1tg_32x384E,asm,167.1379,0.0,,,0.0,167.1379,11.801661787348953,14.162234354077754
311,128,4096,384,128,8,ActivationType.Silu,QuantType.per_Token,torch.bfloat16,torch.float8_e4m3fnuz,torch.float8_e4m3fnuz,1,1,1-stage,32,_ZN5aiter50fmoe_bf16_pertokenFp8_g1u1_vs_tkw1_silu_1tg_32x384E,asm,168.0918,0.0,,,0.0,168.0918,11.801661787348953,14.243061954223231
312,128,4096,384,128,8,ActivationType.Gelu,QuantType.per_Tensor,torch.bfloat16,torch.float8_e4m3fnuz,torch.float8_e4m3fnuz,1,0,2-stage,32,_ZN5aiter48fmoe_stage1_bf16_pertokenFp8_g1u1_32x128_3tg_pf2E,asm,108.6245,32.46355555555559,moe_ck2stages_gemm2_256x32x64x128_1x4_MulABScaleExpertWeight_v1_Nswizzle0_Quant1_MulRoutedWeight1_F8_F8_B16,ck,60.9863,202.0743555555556,11.801661787348953,17.122534029247777
313,128,4096,384,128,8,ActivationType.Gelu,QuantType.per_Tensor,torch.bfloat16,torch.float8_e4m3fnuz,torch.float8_e4m3fnuz,1,1,2-stage,32,_ZN5aiter57fmoe_stage1_bf16_pertokenFp8_doweight_g1u1_32x128_3tg_pf2E,asm,110.2489,33.23388888888891,moe_ck2stages_gemm2_256x32x64x128_1x4_MulABScaleExpertWeight_v1_Nswizzle0_Quant1_MulRoutedWeight0_F8_F8_B16,ck,61.4266,204.9093888888889,11.801661787348953,17.36275726089236
314,128,4096,384,128,8,ActivationType.Gelu,QuantType.per_Token,torch.bfloat16,torch.float8_e4m3fnuz,torch.float8_e4m3fnuz,1,0,1-stage,32,_ZN5aiter45fmoe_bf16_pertokenFp8_g1u1_vs_gelu_1tg_32x384E,asm,172.2478,0.0,,,0.0,172.2478,11.801661787348953,14.59521575043311
315,128,4096,384,128,8,ActivationType.Gelu,QuantType.per_Token,torch.bfloat16,torch.float8_e4m3fnuz,torch.float8_e4m3fnuz,1,1,1-stage,32,_ZN5aiter50fmoe_bf16_pertokenFp8_g1u1_vs_tkw1_gelu_1tg_32x384E,asm,174.0861,0.0,,,0.0,174.0861,11.801661787348953,14.750981949560302
316,128,4096,384,128,8,ActivationType.Silu,QuantType.per_Tensor,torch.bfloat16,torch.float8_e4m3fnuz,torch.float8_e4m3fnuz,1,0,2-stage,32,_ZN5aiter48fmoe_stage1_bf16_pertokenFp8_g1u1_32x128_3tg_pf2E,asm,109.3326,32.547777777777824,moe_ck2stages_gemm2_256x32x64x128_1x4_MulABScaleExpertWeight_v1_Nswizzle0_Quant1_MulRoutedWeight1_F8_F8_B16,ck,61.4247,203.30507777777785,11.801661787348953,17.226817836426658
317,128,4096,384,128,8,ActivationType.Silu,QuantType.per_Tensor,torch.bfloat16,torch.float8_e4m3fnuz,torch.float8_e4m3fnuz,1,1,2-stage,32,_ZN5aiter57fmoe_stage1_bf16_pertokenFp8_doweight_g1u1_32x128_3tg_pf2E,asm,109.9785,33.16188888888891,moe_ck2stages_gemm2_256x32x64x128_1x4_MulABScaleExpertWeight_v1_Nswizzle0_Quant1_MulRoutedWeight0_F8_F8_B16,ck,61.2204,204.3607888888889,11.801661787348953,17.316272281922014
318,128,4096,384,128,8,ActivationType.Silu,QuantType.per_Token,torch.bfloat16,torch.float8_e4m3fnuz,torch.float8_e4m3fnuz,1,0,1-stage,32,_ZN5aiter45fmoe_bf16_pertokenFp8_g1u1_vs_silu_1tg_32x384E,asm,172.5192,0.0,,,0.0,172.5192,11.801661787348953,14.618212511812168
319,128,4096,384,128,8,ActivationType.Silu,QuantType.per_Token,torch.bfloat16,torch.float8_e4m3fnuz,torch.float8_e4m3fnuz,1,1,1-stage,32,_ZN5aiter50fmoe_bf16_pertokenFp8_g1u1_vs_tkw1_silu_1tg_32x384E,asm,171.6722,0.0,,,0.0,171.6722,11.801661787348953,14.54644295806102
320,128,4096,384,128,8,ActivationType.Gelu,QuantType.per_Tensor,torch.bfloat16,torch.float8_e4m3fnuz,torch.float8_e4m3fnuz,1,0,2-stage,32,_ZN5aiter48fmoe_stage1_bf16_pertokenFp8_g1u1_32x128_3tg_pf2E,asm,109.5663,33.62911111111103,moe_ck2stages_gemm2_256x32x64x128_1x4_MulABScaleExpertWeight_v1_Nswizzle0_Quant1_MulRoutedWeight1_F8_F8_B16,ck,61.3958,204.59121111111105,11.801661787348953,17.33579683925759
321,128,4096,384,128,8,ActivationType.Gelu,QuantType.per_Tensor,torch.bfloat16,torch.float8_e4m3fnuz,torch.float8_e4m3fnuz,1,1,2-stage,32,_ZN5aiter57fmoe_stage1_bf16_pertokenFp8_doweight_g1u1_32x128_3tg_pf2E,asm,110.1459,33.593666666666685,moe_ck2stages_gemm2_256x32x64x128_1x4_MulABScaleExpertWeight_v1_Nswizzle0_Quant1_MulRoutedWeight0_F8_F8_B16,ck,61.2196,204.9591666666667,11.801661787348953,17.366975122637147
322,128,4096,384,128,8,ActivationType.Gelu,QuantType.per_Token,torch.bfloat16,torch.float8_e4m3fnuz,torch.float8_e4m3fnuz,1,0,1-stage,32,_ZN5aiter45fmoe_bf16_pertokenFp8_g1u1_vs_gelu_1tg_32x384E,asm,166.5177,0.0,,,0.0,166.5177,11.801661787348953,14.109682432901293
323,128,4096,384,128,8,ActivationType.Gelu,QuantType.per_Token,torch.bfloat16,torch.float8_e4m3fnuz,torch.float8_e4m3fnuz,1,1,1-stage,32,_ZN5aiter50fmoe_bf16_pertokenFp8_g1u1_vs_tkw1_gelu_1tg_32x384E,asm,170.3712,0.0,,,0.0,170.3712,11.801661787348953,14.436204245628618
324,128,4096,384,128,8,ActivationType.Silu,QuantType.per_1x128,torch.bfloat16,torch.float8_e4m3fnuz,torch.float8_e4m3fnuz,1,0,2-stage,64,_ZN5aiter59fmoe_stage1_bf16_pertokenFp8_blockscale_g1u1_64x128_2tg_pf2E,asm,115.4338,36.5711111111111,moe_ck2stages_gemm2_256x64x128x128_1x4_MulABScaleExpertWeightA8W8blkscale_v3_Nswizzle0_Quant4_MulRoutedWeight1_F8_F8_B16,ck,132.0358,284.04071111111114,11.801661787348953,24.067857241561924
325,128,4096,384,128,8,ActivationType.Gelu,QuantType.per_1x128,torch.bfloat16,torch.float8_e4m3fnuz,torch.float8_e4m3fnuz,1,0,2-stage,64,_ZN5aiter59fmoe_stage1_bf16_pertokenFp8_blockscale_g1u1_64x128_2tg_pf2E,asm,114.4323,35.190777777777846,moe_ck2stages_gemm2_256x64x128x128_1x4_MulABScaleExpertWeightA8W8blkscale_v3_Nswizzle0_Quant4_MulRoutedWeight1_F8_F8_B16,ck,132.0973,281.7203777777778,11.801661787348953,23.87124651206104
326,128,4096,384,128,8,ActivationType.Silu,QuantType.per_1x128,torch.bfloat16,torch.float8_e4m3fnuz,torch.float8_e4m3fnuz,1,1,2-stage,64,moe_ck2stages_gemm1_256x64x128x128_1x4_MulABScaleExpertWeightA8W8blkscale_v3_Nswizzle0_Quant4_MulRoutedWeight1_silu_F8_F8_B16,ck,141.8503,36.41499999999999,moe_ck2stages_gemm2_256x64x128x128_1x4_MulABScaleExpertWeightA8W8blkscale_v3_Nswizzle0_Quant4_MulRoutedWeight0_F8_F8_B16,ck,130.6394,308.9047,11.801661787348953,26.1746782415962
327,128,4096,384,128,8,ActivationType.Gelu,QuantType.per_1x128,torch.bfloat16,torch.float8_e4m3fnuz,torch.float8_e4m3fnuz,1,1,2-stage,64,moe_ck2stages_gemm1_256x64x128x128_1x4_MulABScaleExpertWeightA8W8blkscale_v3_Nswizzle0_Quant4_MulRoutedWeight1_gelu_F8_F8_B16,ck,134.7679,35.48888888888887,moe_ck2stages_gemm2_256x64x128x128_1x4_MulABScaleExpertWeightA8W8blkscale_v3_Nswizzle0_Quant4_MulRoutedWeight0_F8_F8_B16,ck,131.1396,301.39638888888885,11.801661787348953,25.538470286614825
328,128,4096,384,128,8,ActivationType.Gelu,QuantType.per_1x128,torch.bfloat16,torch.float8_e4m3fnuz,torch.float8_e4m3fnuz,1,0,2-stage,64,_ZN5aiter59fmoe_stage1_bf16_pertokenFp8_blockscale_g1u1_64x128_2tg_pf2E,asm,115.499,36.44599999999996,moe_ck2stages_gemm2_256x64x128x128_1x4_MulABScaleExpertWeightA8W8blkscale_v3_Nswizzle0_Quant4_MulRoutedWeight1_F8_F8_B16,ck,130.958,282.903,11.801661787348953,23.97145462203162
329,128,4096,384,128,8,ActivationType.Silu,QuantType.per_1x128,torch.bfloat16,torch.float8_e4m3fnuz,torch.float8_e4m3fnuz,1,1,2-stage,64,moe_ck2stages_gemm1_256x64x128x128_1x4_MulABScaleExpertWeightA8W8blkscale_v3_Nswizzle0_Quant4_MulRoutedWeight1_silu_F8_F8_B16,ck,136.9643,36.18855555555557,moe_ck2stages_gemm2_256x64x128x128_1x4_MulABScaleExpertWeightA8W8blkscale_v3_Nswizzle0_Quant4_MulRoutedWeight0_F8_F8_B16,ck,129.8089,302.9617555555556,11.801661787348953,25.67110979915744
330,128,4096,384,128,8,ActivationType.Gelu,QuantType.per_1x128,torch.bfloat16,torch.float8_e4m3fnuz,torch.float8_e4m3fnuz,1,1,2-stage,64,moe_ck2stages_gemm1_256x64x128x128_1x4_MulABScaleExpertWeightA8W8blkscale_v3_Nswizzle0_Quant4_MulRoutedWeight1_gelu_F8_F8_B16,ck,134.2172,36.19244444444444,moe_ck2stages_gemm2_256x64x128x128_1x4_MulABScaleExpertWeightA8W8blkscale_v3_Nswizzle0_Quant4_MulRoutedWeight0_F8_F8_B16,ck,129.9484,300.35804444444443,11.801661787348953,25.45048738529516
331,128,7168,256,256,8,ActivationType.Gelu,QuantType.No,torch.bfloat16,torch.bfloat16,torch.bfloat16,1,0,2-stage,32,moe_ck2stages_gemm1_256x32x64x64_1x4_TypeCast_v1_Nswizzle0_Quant0_MulRoutedWeight0_gelu_B16_B16_B16,ck,497.1733,0.0,moe_ck2stages_gemm2_256x32x64x64_1x4_TypeCastExpertWeight_v1_Nswizzle0_Quant0_MulRoutedWeight1_B16_B16_B16,ck,262.7727,759.9459999999999,25.86302985702841,29.383486938730837
332,128,7168,256,256,8,ActivationType.Gelu,QuantType.No,torch.bfloat16,torch.bfloat16,torch.bfloat16,1,1,2-stage,32,moe_ck2stages_gemm1_256x32x64x64_1x4_TypeCastExpertWeight_v1_Nswizzle0_Quant0_MulRoutedWeight1_gelu_B16_B16_B16,ck,497.4489,0.0,moe_ck2stages_gemm2_256x32x64x128_1x4_TypeCast_v1_Nswizzle0_Quant0_MulRoutedWeight0_B16_B16_B16,ck,262.5215,759.9703999999999,25.86302985702841,29.384430370344802
333,128,7168,256,256,8,ActivationType.Gelu,QuantType.per_Tensor,torch.bfloat16,torch.float8_e4m3fnuz,torch.float8_e4m3fnuz,1,0,2-stage,32,_ZN5aiter48fmoe_stage1_bf16_pertokenFp8_g1u1_32x256_2tg_pf2E,asm,252.4455,31.029999999999973,moe_ck2stages_gemm2_256x32x64x256_1x4_MulABScaleExpertWeight_v1_Nswizzle0_Quant1_MulRoutedWeight1_F8_F8_B16,ck,138.6172,422.0927,13.992358158915199,30.16594452530252
334,128,7168,256,256,8,ActivationType.Gelu,QuantType.per_Tensor,torch.bfloat16,torch.float8_e4m3fnuz,torch.float8_e4m3fnuz,1,1,2-stage,32,_ZN5aiter57fmoe_stage1_bf16_pertokenFp8_doweight_g1u1_32x256_2tg_pf2E,asm,249.6646,31.140888888888966,moe_ck2stages_gemm2_256x32x64x256_1x4_MulABScaleExpertWeight_v1_Nswizzle0_Quant1_MulRoutedWeight0_F8_F8_B16,ck,138.3744,419.17988888888897,13.992358158915199,29.957772959221277
335,128,7168,256,256,8,ActivationType.Gelu,QuantType.per_Token,torch.bfloat16,torch.float8_e4m3fnuz,torch.float8_e4m3fnuz,1,0,1-stage,32,_ZN5aiter45fmoe_bf16_pertokenFp8_g1u1_vs_gelu_1tg_32x256E,asm,393.4932,0.0,,,0.0,393.4932,13.992358158915199,28.122007422264755
336,128,7168,256,256,8,ActivationType.Gelu,QuantType.per_Token,torch.bfloat16,torch.float8_e4m3fnuz,torch.float8_e4m3fnuz,1,1,1-stage,32,_ZN5aiter50fmoe_bf16_pertokenFp8_g1u1_vs_tkw1_gelu_1tg_32x256E,asm,385.7084,0.0,,,0.0,385.7084,13.992358158915199,27.565646592189808
337,128,7168,256,256,8,ActivationType.Silu,QuantType.No,torch.bfloat16,torch.bfloat16,torch.bfloat16,1,0,2-stage,32,moe_ck2stages_gemm1_256x32x64x128_1x4_TypeCast_v1_Nswizzle0_Quant0_MulRoutedWeight0_silu_B16_B16_B16,ck,503.022,0.0,moe_ck2stages_gemm2_256x32x64x128_1x4_TypeCastExpertWeight_v1_Nswizzle0_Quant0_MulRoutedWeight1_B16_B16_B16,ck,266.1773,769.1993,25.86302985702841,29.74126791223443
338,128,7168,256,256,8,ActivationType.Silu,QuantType.No,torch.bfloat16,torch.bfloat16,torch.bfloat16,1,1,2-stage,32,moe_ck2stages_gemm1_256x32x64x128_1x4_TypeCastExpertWeight_v1_Nswizzle0_Quant0_MulRoutedWeight1_silu_B16_B16_B16,ck,502.6616,0.0,moe_ck2stages_gemm2_256x32x64x64_1x4_TypeCast_v1_Nswizzle0_Quant0_MulRoutedWeight0_B16_B16_B16,ck,265.0921,767.7537,25.86302985702841,29.685373455630106
339,128,7168,256,256,8,ActivationType.Silu,QuantType.per_Tensor,torch.bfloat16,torch.float8_e4m3fnuz,torch.float8_e4m3fnuz,1,0,2-stage,32,_ZN5aiter48fmoe_stage1_bf16_pertokenFp8_g1u1_32x256_2tg_pf2E,asm,252.8589,30.16211111111109,moe_ck2stages_gemm2_256x32x64x128_1x4_MulABScaleExpertWeight_v1_Nswizzle0_Quant1_MulRoutedWeight1_F8_F8_B16,ck,136.1133,419.1343111111111,13.992358158915199,29.954515625663902
340,128,7168,256,256,8,ActivationType.Silu,QuantType.per_Tensor,torch.bfloat16,torch.float8_e4m3fnuz,torch.float8_e4m3fnuz,1,1,2-stage,32,_ZN5aiter57fmoe_stage1_bf16_pertokenFp8_doweight_g1u1_32x256_2tg_pf2E,asm,253.334,31.03466666666672,moe_ck2stages_gemm2_256x32x64x128_1x4_MulABScaleExpertWeight_v1_Nswizzle0_Quant1_MulRoutedWeight0_F8_F8_B16,ck,138.2114,422.5800666666668,13.992358158915199,30.200775442373946
341,128,7168,256,256,8,ActivationType.Silu,QuantType.per_Token,torch.bfloat16,torch.float8_e4m3fnuz,torch.float8_e4m3fnuz,1,0,1-stage,32,_ZN5aiter45fmoe_bf16_pertokenFp8_g1u1_vs_silu_1tg_32x256E,asm,384.1249,0.0,,,0.0,384.1249,13.992358158915199,27.45247767655631
342,128,7168,256,256,8,ActivationType.Silu,QuantType.per_Token,torch.bfloat16,torch.float8_e4m3fnuz,torch.float8_e4m3fnuz,1,1,1-stage,32,_ZN5aiter53fmoe_bf16_pertokenFp8_g1u1_vs_tkw1_silu_1tg_ps_32x256E,asm,395.132,0.0,,,0.0,395.132,13.992358158915199,28.239128495166668
343,128,7168,256,256,8,ActivationType.Silu,QuantType.per_Tensor,torch.bfloat16,torch.float8_e4m3fnuz,torch.float8_e4m3fnuz,1,0,2-stage,32,_ZN5aiter48fmoe_stage1_bf16_pertokenFp8_g1u1_32x256_2tg_pf2E,asm,252.5973,30.17044444444444,moe_ck2stages_gemm2_256x32x64x128_1x4_MulABScaleExpertWeight_v1_Nswizzle0_Quant1_MulRoutedWeight1_F8_F8_B16,ck,133.8777,416.6454444444444,13.992358158915199,29.77664234380534
344,128,7168,256,256,8,ActivationType.Silu,QuantType.per_Tensor,torch.bfloat16,torch.float8_e4m3fnuz,torch.float8_e4m3fnuz,1,1,2-stage,32,_ZN5aiter57fmoe_stage1_bf16_pertokenFp8_doweight_g1u1_32x256_2tg_pf3E,asm,249.3016,32.16522222222221,moe_ck2stages_gemm2_256x32x64x256_1x4_MulABScaleExpertWeight_v1_Nswizzle0_Quant1_MulRoutedWeight0_F8_F8_B16,ck,138.7718,420.2386222222223,13.992358158915199,30.033438070227515
345,128,7168,256,256,8,ActivationType.Silu,QuantType.per_Token,torch.bfloat16,torch.float8_e4m3fnuz,torch.float8_e4m3fnuz,1,0,1-stage,32,_ZN5aiter45fmoe_bf16_pertokenFp8_g1u1_vs_silu_1tg_32x256E,asm,393.4107,0.0,,,0.0,393.4107,13.992358158915199,28.116111346773902
346,128,7168,256,256,8,ActivationType.Silu,QuantType.per_Token,torch.bfloat16,torch.float8_e4m3fnuz,torch.float8_e4m3fnuz,1,1,1-stage,32,_ZN5aiter50fmoe_bf16_pertokenFp8_g1u1_vs_tkw1_silu_1tg_32x256E,asm,385.7409,0.0,,,0.0,385.7409,13.992358158915199,27.567969288595297
347,128,7168,256,256,8,ActivationType.Gelu,QuantType.per_Tensor,torch.bfloat16,torch.float8_e4m3fnuz,torch.float8_e4m3fnuz,1,0,2-stage,32,_ZN5aiter48fmoe_stage1_bf16_pertokenFp8_g1u1_32x256_2tg_pf2E,asm,253.3489,30.638555555555627,moe_ck2stages_gemm2_256x32x64x128_1x4_MulABScaleExpertWeight_v1_Nswizzle0_Quant1_MulRoutedWeight1_F8_F8_B16,ck,136.9274,420.9148555555556,13.992358158915199,30.08176683123071
348,128,7168,256,256,8,ActivationType.Gelu,QuantType.per_Tensor,torch.bfloat16,torch.float8_e4m3fnuz,torch.float8_e4m3fnuz,1,1,2-stage,32,_ZN5aiter57fmoe_stage1_bf16_pertokenFp8_doweight_g1u1_32x256_2tg_pf2E,asm,251.6219,31.822888888888883,moe_ck2stages_gemm2_256x32x64x256_1x4_MulABScaleExpertWeight_v1_Nswizzle0_Quant1_MulRoutedWeight0_F8_F8_B16,ck,138.6992,422.1439888888889,13.992358158915199,30.169610018159865
349,128,7168,256,256,8,ActivationType.Gelu,QuantType.per_Token,torch.bfloat16,torch.float8_e4m3fnuz,torch.float8_e4m3fnuz,1,0,1-stage,32,_ZN5aiter45fmoe_bf16_pertokenFp8_g1u1_vs_gelu_1tg_32x256E,asm,393.2238,0.0,,,0.0,393.2238,13.992358158915199,28.102754055752808
350,128,7168,256,256,8,ActivationType.Gelu,QuantType.per_Token,torch.bfloat16,torch.float8_e4m3fnuz,torch.float8_e4m3fnuz,1,1,1-stage,32,_ZN5aiter53fmoe_bf16_pertokenFp8_g1u1_vs_tkw1_gelu_1tg_ps_32x256E,asm,386.8597,0.0,,,0.0,386.8597,13.992358158915199,27.647927219009414
351,128,7168,256,256,8,ActivationType.Gelu,QuantType.per_1x128,torch.bfloat16,torch.float8_e4m3fnuz,torch.float8_e4m3fnuz,1,0,1-stage,32,_ZN5aiter47fmoe_bf16_blockscaleFp8_g1u1_vs_gelu_1tg_32x256E,asm,388.3251,0.0,,,0.0,388.3251,13.992358158915199,27.752655813243287
352,128,7168,256,256,8,ActivationType.Gelu,QuantType.per_1x128,torch.bfloat16,torch.float8_e4m3fnuz,torch.float8_e4m3fnuz,1,1,2-stage,16,moe_ck2stages_gemm1_256x16x128x256_1x4_MulABScaleExpertWeightA8W8blkscale_v1_Nswizzle0_Quant4_MulRoutedWeight1_gelu_F8_F8_B16,ck,245.4281,31.88411111111111,moe_ck2stages_gemm2_256x16x128x256_1x4_MulABScaleExpertWeightA8W8blkscale_v1_Nswizzle0_Quant4_MulRoutedWeight0_F8_F8_B16,ck,144.0078,421.3200111111111,13.992358158915199,30.110722319001535
353,128,7168,256,256,8,ActivationType.Silu,QuantType.per_1x128,torch.bfloat16,torch.float8_e4m3fnuz,torch.float8_e4m3fnuz,1,1,2-stage,16,moe_ck2stages_gemm1_256x16x128x256_1x4_MulABScaleExpertWeightA8W8blkscale_v1_Nswizzle0_Quant4_MulRoutedWeight1_silu_F8_F8_B16,ck,246.8137,33.20588888888891,moe_ck2stages_gemm2_256x16x128x256_1x4_MulABScaleExpertWeightA8W8blkscale_v1_Nswizzle0_Quant4_MulRoutedWeight0_F8_F8_B16,ck,144.8993,424.9188888888889,13.992358158915199,30.367925410639437
354,128,7168,256,256,8,ActivationType.Silu,QuantType.per_1x128,torch.bfloat16,torch.float8_e4m3fnuz,torch.float8_e4m3fnuz,1,0,1-stage,32,_ZN5aiter47fmoe_bf16_blockscaleFp8_g1u1_vs_silu_1tg_32x256E,asm,388.7614,0.0,,,0.0,388.7614,13.992358158915199,27.783837119142177
355,128,7168,256,256,8,ActivationType.Gelu,QuantType.per_1x128,torch.bfloat16,torch.float8_e4m3fnuz,torch.float8_e4m3fnuz,1,0,1-stage,32,_ZN5aiter47fmoe_bf16_blockscaleFp8_g1u1_vs_gelu_1tg_32x256E,asm,395.6698,0.0,,,0.0,395.6698,13.992358158915199,28.277563760608853
356,128,7168,256,256,8,ActivationType.Silu,QuantType.per_1x128,torch.bfloat16,torch.float8_e4m3fnuz,torch.float8_e4m3fnuz,1,1,2-stage,16,moe_ck2stages_gemm1_256x16x128x256_1x4_MulABScaleExpertWeightA8W8blkscale_v1_Nswizzle0_Quant4_MulRoutedWeight1_silu_F8_F8_B16,ck,245.793,31.66133333333332,moe_ck2stages_gemm2_256x16x128x256_1x4_MulABScaleExpertWeightA8W8blkscale_v1_Nswizzle0_Quant4_MulRoutedWeight0_F8_F8_B16,ck,147.5752,425.02953333333335,13.992358158915199,30.375832901513228
357,128,7168,256,256,8,ActivationType.Gelu,QuantType.per_1x128,torch.bfloat16,torch.float8_e4m3fnuz,torch.float8_e4m3fnuz,1,1,2-stage,16,moe_ck2stages_gemm1_256x16x128x256_1x4_MulABScaleExpertWeightA8W8blkscale_v1_Nswizzle0_Quant4_MulRoutedWeight1_gelu_F8_F8_B16,ck,247.9502,33.44588888888881,moe_ck2stages_gemm2_256x16x128x256_1x4_MulABScaleExpertWeightA8W8blkscale_v1_Nswizzle0_Quant4_MulRoutedWeight0_F8_F8_B16,ck,144.9177,426.3137888888888,13.992358158915199,30.46761554036293
358,128,7168,256,257,9,ActivationType.Silu,QuantType.per_Token,torch.bfloat16,torch.float8_e4m3fnuz,torch.float8_e4m3fnuz,1,0,1-stage,32,_ZN5aiter45fmoe_bf16_pertokenFp8_g1u1_vs_silu_1tg_32x256E,asm,391.1397,0.0,,,0.0,391.1397,15.617750098590918,25.044561318425107
359,128,7168,256,256,8,ActivationType.Silu,QuantType.per_1x128,torch.bfloat16,torch.float8_e4m3fnuz,torch.float8_e4m3fnuz,1,0,1-stage,32,_ZN5aiter47fmoe_bf16_blockscaleFp8_g1u1_vs_silu_1tg_32x256E,asm,396.4676,0.0,,,0.0,396.4676,13.992358158915199,28.33458059729493
360,128,7168,256,257,9,ActivationType.Silu,QuantType.per_1x128,torch.bfloat16,torch.float8_e4m3fnuz,torch.float8_e4m3fnuz,1,0,1-stage,32,_ZN5aiter47fmoe_bf16_blockscaleFp8_g1u1_vs_silu_1tg_32x256E,asm,396.4844,0.0,,,0.0,396.4844,15.617750098590918,25.38678090615447
361,128,7168,512,256,8,ActivationType.Gelu,QuantType.No,torch.bfloat16,torch.bfloat16,torch.bfloat16,1,0,2-stage,32,moe_ck2stages_gemm1_256x32x64x128_1x4_TypeCast_v1_Nswizzle0_Quant0_MulRoutedWeight0_gelu_B16_B16_B16,ck,968.5591,0.0,moe_ck2stages_gemm2_256x32x64x128_1x4_TypeCastExpertWeight_v1_Nswizzle0_Quant0_MulRoutedWeight1_B16_B16_B16,ck,516.4282,1484.9872999999998,50.73683707254738,29.26842479117593
362,128,7168,512,256,8,ActivationType.Gelu,QuantType.No,torch.bfloat16,torch.bfloat16,torch.bfloat16,1,1,2-stage,32,moe_ck2stages_gemm1_256x32x64x128_1x4_TypeCastExpertWeight_v1_Nswizzle0_Quant0_MulRoutedWeight1_gelu_B16_B16_B16,ck,967.7524,0.0,moe_ck2stages_gemm2_256x32x64x128_1x4_TypeCast_v1_Nswizzle0_Quant0_MulRoutedWeight0_B16_B16_B16,ck,511.8093,1479.5617,50.73683707254738,29.16148868098361
363,128,7168,512,256,8,ActivationType.Gelu,QuantType.per_Tensor,torch.bfloat16,torch.float8_e4m3fnuz,torch.float8_e4m3fnuz,1,0,2-stage,32,_ZN5aiter47fmoe_stage1_bf16_pertokenFp8_g1u1_32x64_4tg_pf2E,asm,497.8544,35.17855555555551,moe_ck2stages_gemm2_256x32x64x128_1x4_MulABScaleExpertWeight_v1_Nswizzle0_Quant1_MulRoutedWeight1_F8_F8_B16,ck,262.5543,795.5872555555555,26.995493676320965,29.47111340487924
364,128,7168,512,256,8,ActivationType.Gelu,QuantType.per_Tensor,torch.bfloat16,torch.float8_e4m3fnuz,torch.float8_e4m3fnuz,1,1,2-stage,32,_ZN5aiter53fmoe_stage1_bf16_pertokenFp8_doweight_g1u1_32x512_pf2E,asm,486.9549,34.81388888888889,moe_ck2stages_gemm2_256x32x64x256_1x4_MulABScaleExpertWeight_v1_Nswizzle0_Quant1_MulRoutedWeight0_F8_F8_B16,ck,261.3694,783.1381888888889,26.995493676320965,29.00995989474409
365,128,7168,512,256,8,ActivationType.Gelu,QuantType.per_Token,torch.bfloat16,torch.float8_e4m3fnuz,torch.float8_e4m3fnuz,1,0,1-stage,32,_ZN5aiter45fmoe_bf16_pertokenFp8_g1u1_vs_gelu_1tg_32x256E,asm,764.8061,0.0,,,0.0,764.8061,26.995493676320965,28.330880300620244
366,128,7168,512,256,8,ActivationType.Gelu,QuantType.per_Token,torch.bfloat16,torch.float8_e4m3fnuz,torch.float8_e4m3fnuz,1,1,1-stage,32,_ZN5aiter50fmoe_bf16_pertokenFp8_g1u1_vs_tkw1_gelu_1tg_32x256E,asm,765.9266,0.0,,,0.0,765.9266,26.995493676320965,28.372387228162854
367,128,7168,512,256,8,ActivationType.Silu,QuantType.No,torch.bfloat16,torch.bfloat16,torch.bfloat16,1,1,2-stage,32,moe_ck2stages_gemm1_256x32x64x128_1x4_TypeCastExpertWeight_v1_Nswizzle0_Quant0_MulRoutedWeight1_silu_B16_B16_B16,ck,969.3728,0.0,moe_ck2stages_gemm2_256x32x64x128_1x4_TypeCast_v1_Nswizzle0_Quant0_MulRoutedWeight0_B16_B16_B16,ck,506.1244,1475.4972,50.73683707254738,29.081379233203325
368,128,7168,512,256,8,ActivationType.Silu,QuantType.per_Tensor,torch.bfloat16,torch.float8_e4m3fnuz,torch.float8_e4m3fnuz,1,0,2-stage,32,_ZN5aiter47fmoe_stage1_bf16_pertokenFp8_g1u1_32x64_4tg_pf2E,asm,496.6895,34.83633333333336,moe_ck2stages_gemm2_256x32x64x256_1x4_MulABScaleExpertWeight_v1_Nswizzle0_Quant1_MulRoutedWeight1_F8_F8_B16,ck,262.3452,793.8710333333333,26.995493676320965,29.407539008248456
369,128,7168,512,256,8,ActivationType.Silu,QuantType.per_Tensor,torch.bfloat16,torch.float8_e4m3fnuz,torch.float8_e4m3fnuz,1,1,2-stage,32,_ZN5aiter56fmoe_stage1_bf16_pertokenFp8_doweight_g1u1_32x64_4tg_pf2E,asm,498.6625,34.71622222222226,moe_ck2stages_gemm2_256x32x64x256_1x4_MulABScaleExpertWeight_v1_Nswizzle0_Quant1_MulRoutedWeight0_F8_F8_B16,ck,261.7443,795.1230222222223,26.995493676320965,29.453916707574887
370,128,7168,512,256,8,ActivationType.Silu,QuantType.per_Token,torch.bfloat16,torch.float8_e4m3fnuz,torch.float8_e4m3fnuz,1,0,1-stage,32,_ZN5aiter45fmoe_bf16_pertokenFp8_g1u1_vs_silu_1tg_32x512E,asm,766.5461,0.0,,,0.0,766.5461,26.995493676320965,28.395335502694444
371,128,7168,512,256,8,ActivationType.Silu,QuantType.per_Token,torch.bfloat16,torch.float8_e4m3fnuz,torch.float8_e4m3fnuz,1,1,1-stage,32,_ZN5aiter53fmoe_bf16_pertokenFp8_g1u1_vs_tkw1_silu_1tg_ps_32x512E,asm,758.2397,0.0,,,0.0,758.2397,26.995493676320965,28.087639703551268
372,128,7168,512,256,8,ActivationType.Silu,QuantType.No,torch.bfloat16,torch.bfloat16,torch.bfloat16,1,0,2-stage,32,moe_ck2stages_gemm1_256x32x64x128_1x4_TypeCast_v1_Nswizzle0_Quant0_MulRoutedWeight0_silu_B16_B16_B16,ck,968.5722,0.0,moe_ck2stages_gemm2_256x32x64x128_1x4_TypeCastExpertWeight_v1_Nswizzle0_Quant0_MulRoutedWeight1_B16_B16_B16,ck,507.7064,1476.2786,50.73683707254738,29.096780272075392
373,128,7168,512,256,8,ActivationType.Silu,QuantType.per_Token,torch.bfloat16,torch.float8_e4m3fnuz,torch.float8_e4m3fnuz,1,0,1-stage,32,_ZN5aiter45fmoe_bf16_pertokenFp8_g1u1_vs_silu_1tg_32x256E,asm,765.5155,0.0,,,0.0,765.5155,26.995493676320965,28.357158760592334
374,128,7168,512,256,8,ActivationType.Silu,QuantType.per_Tensor,torch.bfloat16,torch.float8_e4m3fnuz,torch.float8_e4m3fnuz,1,0,2-stage,32,_ZN5aiter47fmoe_stage1_bf16_pertokenFp8_g1u1_32x64_4tg_pf2E,asm,498.131,34.57333333333339,moe_ck2stages_gemm2_256x32x64x256_1x4_MulABScaleExpertWeight_v1_Nswizzle0_Quant1_MulRoutedWeight1_F8_F8_B16,ck,262.0772,794.7815333333333,26.995493676320965,29.44126685967866
375,128,7168,512,256,8,ActivationType.Silu,QuantType.per_Tensor,torch.bfloat16,torch.float8_e4m3fnuz,torch.float8_e4m3fnuz,1,1,2-stage,32,_ZN5aiter56fmoe_stage1_bf16_pertokenFp8_doweight_g1u1_32x64_4tg_pf2E,asm,498.7658,33.443111111111186,moe_ck2stages_gemm2_256x32x64x128_1x4_MulABScaleExpertWeight_v1_Nswizzle0_Quant1_MulRoutedWeight0_F8_F8_B16,ck,260.466,792.6749111111112,26.995493676320965,29.36323079012273
376,128,7168,512,256,8,ActivationType.Silu,QuantType.per_Token,torch.bfloat16,torch.float8_e4m3fnuz,torch.float8_e4m3fnuz,1,1,1-stage,32,_ZN5aiter50fmoe_bf16_pertokenFp8_g1u1_vs_tkw1_silu_1tg_32x512E,asm,766.1894,0.0,,,0.0,766.1894,26.995493676320965,28.382122186269232
377,128,7168,512,256,8,ActivationType.Gelu,QuantType.per_Tensor,torch.bfloat16,torch.float8_e4m3fnuz,torch.float8_e4m3fnuz,1,0,2-stage,32,_ZN5aiter47fmoe_stage1_bf16_pertokenFp8_g1u1_32x64_4tg_pf2E,asm,497.7054,33.74999999999992,moe_ck2stages_gemm2_256x32x64x128_1x4_MulABScaleExpertWeight_v1_Nswizzle0_Quant1_MulRoutedWeight1_F8_F8_B16,ck,262.6853,794.1406999999999,26.995493676320965,29.417528329795967
378,128,7168,512,256,8,ActivationType.Gelu,QuantType.per_Tensor,torch.bfloat16,torch.float8_e4m3fnuz,torch.float8_e4m3fnuz,1,1,2-stage,32,_ZN5aiter56fmoe_stage1_bf16_pertokenFp8_doweight_g1u1_32x64_4tg_pf2E,asm,498.3556,33.73133333333336,moe_ck2stages_gemm2_256x32x64x256_1x4_MulABScaleExpertWeight_v1_Nswizzle0_Quant1_MulRoutedWeight0_F8_F8_B16,ck,258.5969,790.6838333333334,26.995493676320965,29.289474858793927
379,128,7168,512,256,8,ActivationType.Gelu,QuantType.per_Token,torch.bfloat16,torch.float8_e4m3fnuz,torch.float8_e4m3fnuz,1,0,1-stage,32,_ZN5aiter45fmoe_bf16_pertokenFp8_g1u1_vs_gelu_1tg_32x256E,asm,766.4855,0.0,,,0.0,766.4855,26.995493676320965,28.39309068358772
380,128,7168,512,256,8,ActivationType.Gelu,QuantType.per_Token,torch.bfloat16,torch.float8_e4m3fnuz,torch.float8_e4m3fnuz,1,1,1-stage,32,_ZN5aiter50fmoe_bf16_pertokenFp8_g1u1_vs_tkw1_gelu_1tg_32x256E,asm,766.1278,0.0,,,0.0,766.1278,26.995493676320965,28.379840323942926
381,128,7168,512,256,8,ActivationType.Gelu,QuantType.per_1x128,torch.bfloat16,torch.float8_e4m3fnuz,torch.float8_e4m3fnuz,1,0,1-stage,32,_ZN5aiter47fmoe_bf16_blockscaleFp8_g1u1_vs_gelu_1tg_32x256E,asm,765.2892,0.0,,,0.0,765.2892,26.995493676320965,28.34877588000073
382,128,7168,512,256,8,ActivationType.Silu,QuantType.per_1x128,torch.bfloat16,torch.float8_e4m3fnuz,torch.float8_e4m3fnuz,1,0,1-stage,32,_ZN5aiter47fmoe_bf16_blockscaleFp8_g1u1_vs_silu_1tg_32x256E,asm,763.6492,0.0,,,0.0,763.6492,26.995493676320965,28.28802499988482
383,128,7168,512,256,8,ActivationType.Gelu,QuantType.per_1x128,torch.bfloat16,torch.float8_e4m3fnuz,torch.float8_e4m3fnuz,1,1,2-stage,16,moe_ck2stages_gemm1_256x16x128x256_1x4_MulABScaleExpertWeightA8W8blkscale_v1_Nswizzle0_Quant4_MulRoutedWeight1_gelu_F8_F8_B16,ck,489.4925,30.954444444444466,moe_ck2stages_gemm2_256x16x128x256_1x4_MulABScaleExpertWeightA8W8blkscale_v1_Nswizzle0_Quant4_MulRoutedWeight0_F8_F8_B16,ck,271.1003,791.5472444444445,26.995493676320965,29.32145838617311
384,128,7168,512,256,8,ActivationType.Silu,QuantType.per_1x128,torch.bfloat16,torch.float8_e4m3fnuz,torch.float8_e4m3fnuz,1,1,2-stage,16,moe_ck2stages_gemm1_256x16x128x256_1x4_MulABScaleExpertWeightA8W8blkscale_v1_Nswizzle0_Quant4_MulRoutedWeight1_silu_F8_F8_B16,ck,487.0432,31.354555555555503,moe_ck2stages_gemm2_256x16x128x256_1x4_MulABScaleExpertWeightA8W8blkscale_v1_Nswizzle0_Quant4_MulRoutedWeight0_F8_F8_B16,ck,268.8782,787.2759555555555,26.995493676320965,29.16323609396011
385,128,7168,512,256,8,ActivationType.Silu,QuantType.per_1x128,torch.bfloat16,torch.float8_e4m3fnuz,torch.float8_e4m3fnuz,1,0,1-stage,32,_ZN5aiter47fmoe_bf16_blockscaleFp8_g1u1_vs_silu_1tg_32x256E,asm,767.0078,0.0,,,0.0,767.0078,26.995493676320965,28.41243835717585
386,128,7168,512,256,8,ActivationType.Gelu,QuantType.per_1x128,torch.bfloat16,torch.float8_e4m3fnuz,torch.float8_e4m3fnuz,1,0,1-stage,32,_ZN5aiter47fmoe_bf16_blockscaleFp8_g1u1_vs_gelu_1tg_32x256E,asm,765.3442,0.0,,,0.0,765.3442,26.995493676320965,28.35081325707779
387,128,7168,512,256,8,ActivationType.Silu,QuantType.per_1x128,torch.bfloat16,torch.float8_e4m3fnuz,torch.float8_e4m3fnuz,1,1,2-stage,16,moe_ck2stages_gemm1_256x16x128x256_1x4_MulABScaleExpertWeightA8W8blkscale_v1_Nswizzle0_Quant4_MulRoutedWeight1_silu_F8_F8_B16,ck,487.5397,31.607555555555493,moe_ck2stages_gemm2_256x16x128x256_1x4_MulABScaleExpertWeightA8W8blkscale_v1_Nswizzle0_Quant4_MulRoutedWeight0_F8_F8_B16,ck,268.6739,787.8211555555555,26.995493676320965,29.183432057276693
388,128,7168,512,256,8,ActivationType.Gelu,QuantType.per_1x128,torch.bfloat16,torch.float8_e4m3fnuz,torch.float8_e4m3fnuz,1,1,2-stage,16,moe_ck2stages_gemm1_256x16x128x256_1x4_MulABScaleExpertWeightA8W8blkscale_v1_Nswizzle0_Quant4_MulRoutedWeight1_gelu_F8_F8_B16,ck,491.81,31.091777777777697,moe_ck2stages_gemm2_256x16x128x256_1x4_MulABScaleExpertWeightA8W8blkscale_v1_Nswizzle0_Quant4_MulRoutedWeight0_F8_F8_B16,ck,270.4942,793.3959777777777,26.995493676320965,29.389941420989945
389,128,7168,2048,33,10,ActivationType.Silu,QuantType.per_1x128,torch.bfloat16,torch.float8_e4m3fnuz,torch.float8_e4m3fnuz,1,0,1-stage,32,_ZN5aiter47fmoe_bf16_blockscaleFp8_g1u1_vs_silu_1tg_32x256E,asm,511.1607,0.0,,,0.0,511.1607,133.8047503753846,3.8201984500995394
390,128,7168,2048,33,10,ActivationType.Silu,QuantType.per_Token,torch.bfloat16,torch.float8_e4m3fnuz,torch.float8_e4m3fnuz,1,0,1-stage,32,_ZN5aiter48fmoe_bf16_pertokenFp8_g1u1_vs_silu_1tg_ps_32x256E,asm,484.0815,0.0,,,0.0,484.0815,133.8047503753846,3.6178199850298745
391,256,2048,192,128,8,ActivationType.Silu,QuantType.No,torch.bfloat16,torch.bfloat16,torch.bfloat16,1,0,2-stage,32,moe_ck2stages_gemm1_256x32x64x64_1x4_TypeCast_v1_Nswizzle0_Quant0_MulRoutedWeight0_silu_B16_B16_B16,ck,60.1458,0.0,moe_ck2stages_gemm2_256x32x64x64_1x4_TypeCastExpertWeight_v1_Nswizzle0_Quant0_MulRoutedWeight1_B16_B16_B16,ck,35.9843,96.1301,6.289454074267468,15.284331337008174
392,256,2048,192,128,8,ActivationType.Silu,QuantType.No,torch.bfloat16,torch.bfloat16,torch.bfloat16,1,1,2-stage,32,moe_ck2stages_gemm1_256x32x64x128_1x4_TypeCastExpertWeight_v1_Nswizzle0_Quant0_MulRoutedWeight1_silu_B16_B16_B16,ck,59.9824,0.0,moe_ck2stages_gemm2_256x32x64x64_1x4_TypeCast_v1_Nswizzle0_Quant0_MulRoutedWeight0_B16_B16_B16,ck,35.3443,95.3267,6.289454074267468,15.156593700241414
393,256,2048,192,128,8,ActivationType.Gelu,QuantType.No,torch.bfloat16,torch.bfloat16,torch.bfloat16,1,0,2-stage,32,moe_ck2stages_gemm1_256x32x64x64_1x4_TypeCast_v1_Nswizzle0_Quant0_MulRoutedWeight0_gelu_B16_B16_B16,ck,59.6288,0.0,moe_ck2stages_gemm2_256x32x64x64_1x4_TypeCastExpertWeight_v1_Nswizzle0_Quant0_MulRoutedWeight1_B16_B16_B16,ck,36.167,95.7958,6.289454074267468,15.231178870028927
394,256,2048,192,128,8,ActivationType.Gelu,QuantType.No,torch.bfloat16,torch.bfloat16,torch.bfloat16,1,1,2-stage,32,moe_ck2stages_gemm1_256x32x64x64_1x4_TypeCastExpertWeight_v1_Nswizzle0_Quant0_MulRoutedWeight1_gelu_B16_B16_B16,ck,58.7669,0.0,moe_ck2stages_gemm2_256x32x64x64_1x4_TypeCast_v1_Nswizzle0_Quant0_MulRoutedWeight0_B16_B16_B16,ck,35.2382,94.0051,6.289454074267468,14.94646417478591
395,256,4096,192,128,8,ActivationType.Silu,QuantType.No,torch.bfloat16,torch.bfloat16,torch.bfloat16,1,0,2-stage,32,moe_ck2stages_gemm1_256x32x64x128_1x4_TypeCast_v1_Nswizzle0_Quant0_MulRoutedWeight0_silu_B16_B16_B16,ck,109.9596,0.0,moe_ck2stages_gemm2_256x32x64x64_1x4_TypeCastExpertWeight_v1_Nswizzle0_Quant0_MulRoutedWeight1_B16_B16_B16,ck,62.8346,172.7942,12.366931868211486,13.972277185755177
396,256,4096,192,128,8,ActivationType.Silu,QuantType.No,torch.bfloat16,torch.bfloat16,torch.bfloat16,1,1,2-stage,32,moe_ck2stages_gemm1_256x32x64x128_1x4_TypeCastExpertWeight_v1_Nswizzle0_Quant0_MulRoutedWeight1_silu_B16_B16_B16,ck,109.8908,0.0,moe_ck2stages_gemm2_256x32x64x64_1x4_TypeCast_v1_Nswizzle0_Quant0_MulRoutedWeight0_B16_B16_B16,ck,61.7812,171.672,12.366931868211486,13.881535196395266
397,256,4096,192,128,8,ActivationType.Gelu,QuantType.No,torch.bfloat16,torch.bfloat16,torch.bfloat16,1,0,2-stage,32,moe_ck2stages_gemm1_256x32x64x128_1x4_TypeCast_v1_Nswizzle0_Quant0_MulRoutedWeight0_gelu_B16_B16_B16,ck,110.1213,0.0,moe_ck2stages_gemm2_256x32x64x64_1x4_TypeCastExpertWeight_v1_Nswizzle0_Quant0_MulRoutedWeight1_B16_B16_B16,ck,62.8382,172.9595,12.366931868211486,13.985643475936243
398,256,4096,192,128,8,ActivationType.Gelu,QuantType.No,torch.bfloat16,torch.bfloat16,torch.bfloat16,1,1,2-stage,32,moe_ck2stages_gemm1_256x32x64x128_1x4_TypeCastExpertWeight_v1_Nswizzle0_Quant0_MulRoutedWeight1_gelu_B16_B16_B16,ck,112.7828,0.0,moe_ck2stages_gemm2_256x32x64x64_1x4_TypeCast_v1_Nswizzle0_Quant0_MulRoutedWeight0_B16_B16_B16,ck,61.5009,174.2837,12.366931868211486,14.09271934682414
399,256,4096,384,128,8,ActivationType.Gelu,QuantType.No,torch.bfloat16,torch.bfloat16,torch.bfloat16,1,0,2-stage,32,moe_ck2stages_gemm1_256x32x64x128_1x4_TypeCast_v1_Nswizzle0_Quant0_MulRoutedWeight0_gelu_B16_B16_B16,ck,220.1759,0.0,moe_ck2stages_gemm2_256x32x64x128_1x4_TypeCastExpertWeight_v1_Nswizzle0_Quant0_MulRoutedWeight1_B16_B16_B16,ck,121.5613,341.73720000000003,23.603323574697907,14.47835085251861
400,256,4096,384,128,8,ActivationType.Gelu,QuantType.No,torch.bfloat16,torch.bfloat16,torch.bfloat16,1,1,2-stage,32,moe_ck2stages_gemm1_256x32x64x128_1x4_TypeCastExpertWeight_v1_Nswizzle0_Quant0_MulRoutedWeight1_gelu_B16_B16_B16,ck,219.7661,0.0,moe_ck2stages_gemm2_256x32x64x64_1x4_TypeCast_v1_Nswizzle0_Quant0_MulRoutedWeight0_B16_B16_B16,ck,120.4039,340.17,23.603323574697907,14.411953423570086
401,256,4096,384,128,8,ActivationType.Silu,QuantType.No,torch.bfloat16,torch.bfloat16,torch.bfloat16,1,0,2-stage,32,moe_ck2stages_gemm1_256x32x64x128_1x4_TypeCast_v1_Nswizzle0_Quant0_MulRoutedWeight0_silu_B16_B16_B16,ck,218.8062,0.0,moe_ck2stages_gemm2_256x32x64x128_1x4_TypeCastExpertWeight_v1_Nswizzle0_Quant0_MulRoutedWeight1_B16_B16_B16,ck,120.677,339.4832,23.603323574697907,14.382855826453033
402,256,4096,384,128,8,ActivationType.Silu,QuantType.No,torch.bfloat16,torch.bfloat16,torch.bfloat16,1,1,2-stage,32,moe_ck2stages_gemm1_256x32x64x128_1x4_TypeCastExpertWeight_v1_Nswizzle0_Quant0_MulRoutedWeight1_silu_B16_B16_B16,ck,220.2656,0.0,moe_ck2stages_gemm2_256x32x64x128_1x4_TypeCast_v1_Nswizzle0_Quant0_MulRoutedWeight0_B16_B16_B16,ck,121.7509,342.0165,23.603323574697907,14.49018393183543
403,256,4096,384,128,8,ActivationType.Silu,QuantType.per_Tensor,torch.bfloat16,torch.float8_e4m3fnuz,torch.float8_e4m3fnuz,1,0,2-stage,32,_ZN5aiter48fmoe_stage1_bf16_pertokenFp8_g1u1_32x128_3tg_pf2E,asm,111.4497,38.414777777777736,moe_ck2stages_gemm2_256x32x64x128_1x4_MulABScaleExpertWeight_v1_Nswizzle0_Quant1_MulRoutedWeight1_F8_F8_B16,ck,63.3214,213.18587777777776,22.93795720720879,9.294021950253665
404,256,4096,384,128,8,ActivationType.Silu,QuantType.per_Tensor,torch.bfloat16,torch.float8_e4m3fnuz,torch.float8_e4m3fnuz,1,1,2-stage,32,_ZN5aiter57fmoe_stage1_bf16_pertokenFp8_doweight_g1u1_32x128_3tg_pf2E,asm,112.2816,38.97577777777778,moe_ck2stages_gemm2_256x32x64x128_1x4_MulABScaleExpertWeight_v1_Nswizzle0_Quant1_MulRoutedWeight0_F8_F8_B16,ck,63.766,215.02337777777777,22.93795720720879,9.374129345319453
405,256,4096,384,128,8,ActivationType.Silu,QuantType.per_Token,torch.bfloat16,torch.float8_e4m3fnuz,torch.float8_e4m3fnuz,1,0,1-stage,32,_ZN5aiter45fmoe_bf16_pertokenFp8_g1u1_vs_silu_1tg_32x384E,asm,174.8492,0.0,,,0.0,174.8492,22.93795720720879,7.622701464673129
406,256,4096,384,128,8,ActivationType.Silu,QuantType.per_Token,torch.bfloat16,torch.float8_e4m3fnuz,torch.float8_e4m3fnuz,1,1,1-stage,32,_ZN5aiter53fmoe_bf16_pertokenFp8_g1u1_vs_tkw1_silu_1tg_ps_32x384E,asm,177.3734,0.0,,,0.0,177.3734,22.93795720720879,7.73274613766636
407,256,4096,384,128,8,ActivationType.Gelu,QuantType.per_Tensor,torch.bfloat16,torch.float8_e4m3fnuz,torch.float8_e4m3fnuz,1,0,2-stage,32,_ZN5aiter48fmoe_stage1_bf16_pertokenFp8_g1u1_32x128_3tg_pf2E,asm,112.1148,36.94144444444439,moe_ck2stages_gemm2_256x32x64x128_1x4_MulABScaleExpertWeight_v1_Nswizzle0_Quant1_MulRoutedWeight1_F8_F8_B16,ck,63.8296,212.8858444444444,22.93795720720879,9.2809417386802
408,256,4096,384,128,8,ActivationType.Gelu,QuantType.per_Tensor,torch.bfloat16,torch.float8_e4m3fnuz,torch.float8_e4m3fnuz,1,1,2-stage,32,_ZN5aiter57fmoe_stage1_bf16_pertokenFp8_doweight_g1u1_32x128_3tg_pf2E,asm,112.5266,35.873444444444445,moe_ck2stages_gemm2_256x32x64x128_1x4_MulABScaleExpertWeight_v1_Nswizzle0_Quant1_MulRoutedWeight0_F8_F8_B16,ck,63.7918,212.19184444444448,22.93795720720879,9.250686210965561
409,256,4096,384,128,8,ActivationType.Gelu,QuantType.per_Token,torch.bfloat16,torch.float8_e4m3fnuz,torch.float8_e4m3fnuz,1,0,1-stage,32,_ZN5aiter45fmoe_bf16_pertokenFp8_g1u1_vs_gelu_1tg_32x384E,asm,176.3936,0.0,,,0.0,176.3936,22.93795720720879,7.6900309128035245
410,256,4096,384,128,8,ActivationType.Gelu,QuantType.per_Token,torch.bfloat16,torch.float8_e4m3fnuz,torch.float8_e4m3fnuz,1,1,1-stage,32,_ZN5aiter50fmoe_bf16_pertokenFp8_g1u1_vs_tkw1_gelu_1tg_32x384E,asm,178.4683,0.0,,,0.0,178.4683,22.93795720720879,7.780479246160254
411,256,4096,384,128,8,ActivationType.Silu,QuantType.per_Tensor,torch.bfloat16,torch.float8_e4m3fnuz,torch.float8_e4m3fnuz,1,0,2-stage,32,_ZN5aiter48fmoe_stage1_bf16_pertokenFp8_g1u1_32x128_3tg_pf2E,asm,111.9763,37.38222222222224,moe_ck2stages_gemm2_256x32x64x128_1x4_MulABScaleExpertWeight_v1_Nswizzle0_Quant1_MulRoutedWeight1_F8_F8_B16,ck,63.9226,213.28112222222225,22.93795720720879,9.29817421383948
412,256,4096,384,128,8,ActivationType.Silu,QuantType.per_Tensor,torch.bfloat16,torch.float8_e4m3fnuz,torch.float8_e4m3fnuz,1,1,2-stage,32,_ZN5aiter57fmoe_stage1_bf16_pertokenFp8_doweight_g1u1_32x128_3tg_pf2E,asm,112.9946,37.26566666666664,moe_ck2stages_gemm2_256x32x64x128_1x4_MulABScaleExpertWeight_v1_Nswizzle0_Quant1_MulRoutedWeight0_F8_F8_B16,ck,63.5911,213.85136666666665,22.93795720720879,9.323034511523932
413,256,4096,384,128,8,ActivationType.Silu,QuantType.per_Token,torch.bfloat16,torch.float8_e4m3fnuz,torch.float8_e4m3fnuz,1,0,1-stage,32,_ZN5aiter45fmoe_bf16_pertokenFp8_g1u1_vs_silu_1tg_32x384E,asm,177.94,0.0,,,0.0,177.94,22.93795720720879,7.757447552656441
414,256,4096,384,128,8,ActivationType.Silu,QuantType.per_Token,torch.bfloat16,torch.float8_e4m3fnuz,torch.float8_e4m3fnuz,1,1,1-stage,32,_ZN5aiter50fmoe_bf16_pertokenFp8_g1u1_vs_tkw1_silu_1tg_32x384E,asm,175.7662,0.0,,,0.0,175.7662,22.93795720720879,7.6626788694488175
415,256,4096,384,128,8,ActivationType.Gelu,QuantType.per_Tensor,torch.bfloat16,torch.float8_e4m3fnuz,torch.float8_e4m3fnuz,1,0,2-stage,32,_ZN5aiter48fmoe_stage1_bf16_pertokenFp8_g1u1_32x128_3tg_pf2E,asm,112.9174,39.34033333333335,moe_ck2stages_gemm2_256x32x64x128_1x4_MulABScaleExpertWeight_v1_Nswizzle0_Quant1_MulRoutedWeight1_F8_F8_B16,ck,63.8783,216.13603333333336,22.93795720720879,9.422636522549949
416,256,4096,384,128,8,ActivationType.Gelu,QuantType.per_Tensor,torch.bfloat16,torch.float8_e4m3fnuz,torch.float8_e4m3fnuz,1,1,2-stage,32,_ZN5aiter57fmoe_stage1_bf16_pertokenFp8_doweight_g1u1_32x128_3tg_pf2E,asm,111.3567,38.83288888888895,moe_ck2stages_gemm2_256x32x64x128_1x4_MulABScaleExpertWeight_v1_Nswizzle0_Quant1_MulRoutedWeight0_F8_F8_B16,ck,63.1908,213.38038888888892,22.93795720720879,9.302501829667253
417,256,4096,384,128,8,ActivationType.Gelu,QuantType.per_Token,torch.bfloat16,torch.float8_e4m3fnuz,torch.float8_e4m3fnuz,1,0,1-stage,32,_ZN5aiter45fmoe_bf16_pertokenFp8_g1u1_vs_gelu_1tg_32x384E,asm,174.3824,0.0,,,0.0,174.3824,22.93795720720879,7.602350916636825
418,256,4096,384,128,8,ActivationType.Gelu,QuantType.per_Token,torch.bfloat16,torch.float8_e4m3fnuz,torch.float8_e4m3fnuz,1,1,1-stage,32,_ZN5aiter50fmoe_bf16_pertokenFp8_g1u1_vs_tkw1_gelu_1tg_32x384E,asm,178.169,0.0,,,0.0,178.169,22.93795720720879,7.767431004885049
419,256,4096,384,128,8,ActivationType.Silu,QuantType.per_1x128,torch.bfloat16,torch.float8_e4m3fnuz,torch.float8_e4m3fnuz,1,0,2-stage,64,_ZN5aiter59fmoe_stage1_bf16_pertokenFp8_blockscale_g1u1_64x128_2tg_pf2E,asm,120.4805,38.61355555555552,moe_ck2stages_gemm2_256x64x128x128_1x4_MulABScaleExpertWeightA8W8blkscale_v3_Nswizzle0_Quant4_MulRoutedWeight1_F8_F8_B16,ck,165.091,324.18505555555555,22.93795720720879,14.133126704660205
420,256,4096,384,128,8,ActivationType.Gelu,QuantType.per_1x128,torch.bfloat16,torch.float8_e4m3fnuz,torch.float8_e4m3fnuz,1,0,2-stage,64,_ZN5aiter59fmoe_stage1_bf16_pertokenFp8_blockscale_g1u1_64x128_2tg_pf2E,asm,118.6398,38.33311111111114,moe_ck2stages_gemm2_256x64x128x128_1x4_MulABScaleExpertWeightA8W8blkscale_v3_Nswizzle0_Quant4_MulRoutedWeight1_F8_F8_B16,ck,164.124,321.0969111111111,22.93795720720879,13.998496387908462
421,256,4096,384,128,8,ActivationType.Silu,QuantType.per_1x128,torch.bfloat16,torch.float8_e4m3fnuz,torch.float8_e4m3fnuz,1,1,2-stage,64,moe_ck2stages_gemm1_256x64x128x128_1x4_MulABScaleExpertWeightA8W8blkscale_v3_Nswizzle0_Quant4_MulRoutedWeight1_silu_F8_F8_B16,ck,141.4857,39.735777777777805,moe_ck2stages_gemm2_256x64x128x128_1x4_MulABScaleExpertWeightA8W8blkscale_v3_Nswizzle0_Quant4_MulRoutedWeight0_F8_F8_B16,ck,165.2183,346.4397777777778,22.93795720720879,15.103340487046554
422,256,4096,384,128,8,ActivationType.Gelu,QuantType.per_1x128,torch.bfloat16,torch.float8_e4m3fnuz,torch.float8_e4m3fnuz,1,1,2-stage,64,moe_ck2stages_gemm1_256x64x128x128_1x4_MulABScaleExpertWeightA8W8blkscale_v3_Nswizzle0_Quant4_MulRoutedWeight1_gelu_F8_F8_B16,ck,143.7618,39.41922222222218,moe_ck2stages_gemm2_256x64x128x128_1x4_MulABScaleExpertWeightA8W8blkscale_v3_Nswizzle0_Quant4_MulRoutedWeight0_F8_F8_B16,ck,164.3217,347.50272222222213,22.93795720720879,15.149680465573947
423,256,4096,384,128,8,ActivationType.Gelu,QuantType.per_1x128,torch.bfloat16,torch.float8_e4m3fnuz,torch.float8_e4m3fnuz,1,0,2-stage,64,_ZN5aiter59fmoe_stage1_bf16_pertokenFp8_blockscale_g1u1_64x128_2tg_pf2E,asm,119.9779,41.10200000000006,moe_ck2stages_gemm2_256x64x128x128_1x4_MulABScaleExpertWeightA8W8blkscale_v3_Nswizzle0_Quant4_MulRoutedWeight1_F8_F8_B16,ck,165.5215,326.60140000000007,22.93795720720879,14.238469321817286
424,256,4096,384,128,8,ActivationType.Silu,QuantType.per_1x128,torch.bfloat16,torch.float8_e4m3fnuz,torch.float8_e4m3fnuz,1,1,2-stage,64,moe_ck2stages_gemm1_256x64x128x128_1x4_MulABScaleExpertWeightA8W8blkscale_v3_Nswizzle0_Quant4_MulRoutedWeight1_silu_F8_F8_B16,ck,138.5167,40.99533333333337,moe_ck2stages_gemm2_256x64x128x128_1x4_MulABScaleExpertWeightA8W8blkscale_v3_Nswizzle0_Quant4_MulRoutedWeight0_F8_F8_B16,ck,164.7525,344.26453333333336,22.93795720720879,15.008508832039333
425,256,4096,384,128,8,ActivationType.Gelu,QuantType.per_1x128,torch.bfloat16,torch.float8_e4m3fnuz,torch.float8_e4m3fnuz,1,1,2-stage,64,moe_ck2stages_gemm1_256x64x128x128_1x4_MulABScaleExpertWeightA8W8blkscale_v3_Nswizzle0_Quant4_MulRoutedWeight1_gelu_F8_F8_B16,ck,141.1108,39.78888888888889,moe_ck2stages_gemm2_256x64x128x128_1x4_MulABScaleExpertWeightA8W8blkscale_v3_Nswizzle0_Quant4_MulRoutedWeight0_F8_F8_B16,ck,162.4721,343.3717888888889,22.93795720720879,14.969588869098434
426,256,7168,256,256,8,ActivationType.Gelu,QuantType.No,torch.bfloat16,torch.bfloat16,torch.bfloat16,1,0,2-stage,32,moe_ck2stages_gemm1_256x32x64x128_1x4_TypeCast_v1_Nswizzle0_Quant0_MulRoutedWeight0_gelu_B16_B16_B16,ck,510.9829,0.0,moe_ck2stages_gemm2_256x32x64x128_1x4_TypeCastExpertWeight_v1_Nswizzle0_Quant0_MulRoutedWeight1_B16_B16_B16,ck,269.3469,780.3298,27.984716317830397,27.884141870068365
427,256,7168,256,256,8,ActivationType.Gelu,QuantType.No,torch.bfloat16,torch.bfloat16,torch.bfloat16,1,1,2-stage,32,moe_ck2stages_gemm1_256x32x64x128_1x4_TypeCastExpertWeight_v1_Nswizzle0_Quant0_MulRoutedWeight1_gelu_B16_B16_B16,ck,510.0699,0.0,moe_ck2stages_gemm2_256x32x64x128_1x4_TypeCast_v1_Nswizzle0_Quant0_MulRoutedWeight0_B16_B16_B16,ck,269.0635,779.1333999999999,27.984716317830397,27.84138996269106
428,256,7168,256,256,8,ActivationType.Gelu,QuantType.per_Tensor,torch.bfloat16,torch.float8_e4m3fnuz,torch.float8_e4m3fnuz,1,0,2-stage,32,_ZN5aiter48fmoe_stage1_bf16_pertokenFp8_g1u1_32x256_2tg_pf3E,asm,257.3472,30.229111111111123,moe_ck2stages_gemm2_256x32x64x128_1x4_MulABScaleExpertWeight_v1_Nswizzle0_Quant1_MulRoutedWeight1_F8_F8_B16,ck,144.8192,432.3955111111111,26.760950075076924,16.15770403883421
429,256,7168,256,256,8,ActivationType.Gelu,QuantType.per_Tensor,torch.bfloat16,torch.float8_e4m3fnuz,torch.float8_e4m3fnuz,1,1,2-stage,32,_ZN5aiter57fmoe_stage1_bf16_pertokenFp8_doweight_g1u1_32x256_2tg_pf3E,asm,258.1343,33.167555555555595,moe_ck2stages_gemm2_256x32x64x256_1x4_MulABScaleExpertWeight_v1_Nswizzle0_Quant1_MulRoutedWeight0_F8_F8_B16,ck,144.1692,435.4710555555556,26.760950075076924,16.272630617891238
430,256,7168,256,256,8,ActivationType.Gelu,QuantType.per_Token,torch.bfloat16,torch.float8_e4m3fnuz,torch.float8_e4m3fnuz,1,0,1-stage,32,_ZN5aiter45fmoe_bf16_pertokenFp8_g1u1_vs_gelu_1tg_32x256E,asm,411.1419,0.0,,,0.0,411.1419,26.760950075076924,15.363501626308318
431,256,7168,256,256,8,ActivationType.Gelu,QuantType.per_Token,torch.bfloat16,torch.float8_e4m3fnuz,torch.float8_e4m3fnuz,1,1,1-stage,32,_ZN5aiter50fmoe_bf16_pertokenFp8_g1u1_vs_tkw1_gelu_1tg_32x256E,asm,409.4581,0.0,,,0.0,409.4581,26.760950075076924,15.300581588145391
432,256,7168,256,256,8,ActivationType.Silu,QuantType.No,torch.bfloat16,torch.bfloat16,torch.bfloat16,1,0,2-stage,32,moe_ck2stages_gemm1_256x32x64x128_1x4_TypeCast_v1_Nswizzle0_Quant0_MulRoutedWeight0_silu_B16_B16_B16,ck,511.3365,0.0,moe_ck2stages_gemm2_256x32x64x128_1x4_TypeCastExpertWeight_v1_Nswizzle0_Quant0_MulRoutedWeight1_B16_B16_B16,ck,270.39,781.7265,27.984716317830397,27.934051255753655
433,256,7168,256,256,8,ActivationType.Silu,QuantType.No,torch.bfloat16,torch.bfloat16,torch.bfloat16,1,1,2-stage,32,moe_ck2stages_gemm1_256x32x64x128_1x4_TypeCastExpertWeight_v1_Nswizzle0_Quant0_MulRoutedWeight1_silu_B16_B16_B16,ck,511.4817,0.0,moe_ck2stages_gemm2_256x32x64x64_1x4_TypeCast_v1_Nswizzle0_Quant0_MulRoutedWeight0_B16_B16_B16,ck,270.5346,782.0163,27.984716317830397,27.94440690834304
434,256,7168,256,256,8,ActivationType.Silu,QuantType.per_Tensor,torch.bfloat16,torch.float8_e4m3fnuz,torch.float8_e4m3fnuz,1,0,2-stage,32,_ZN5aiter48fmoe_stage1_bf16_pertokenFp8_g1u1_32x256_2tg_pf2E,asm,256.0092,33.504888888888935,moe_ck2stages_gemm2_256x32x64x128_1x4_MulABScaleExpertWeight_v1_Nswizzle0_Quant1_MulRoutedWeight1_F8_F8_B16,ck,142.8101,432.324188888889,26.760950075076924,16.155038878515835
435,256,7168,256,256,8,ActivationType.Silu,QuantType.per_Tensor,torch.bfloat16,torch.float8_e4m3fnuz,torch.float8_e4m3fnuz,1,1,2-stage,32,_ZN5aiter57fmoe_stage1_bf16_pertokenFp8_doweight_g1u1_32x256_2tg_pf2E,asm,255.755,34.63122222222226,moe_ck2stages_gemm2_256x32x64x128_1x4_MulABScaleExpertWeight_v1_Nswizzle0_Quant1_MulRoutedWeight0_F8_F8_B16,ck,141.251,431.6372222222223,26.760950075076924,16.129368389809738
436,256,7168,256,256,8,ActivationType.Silu,QuantType.per_Token,torch.bfloat16,torch.float8_e4m3fnuz,torch.float8_e4m3fnuz,1,0,1-stage,32,_ZN5aiter45fmoe_bf16_pertokenFp8_g1u1_vs_silu_1tg_32x256E,asm,400.1888,0.0,,,0.0,400.1888,26.760950075076924,14.954207488048224
437,256,7168,256,256,8,ActivationType.Silu,QuantType.per_Token,torch.bfloat16,torch.float8_e4m3fnuz,torch.float8_e4m3fnuz,1,1,1-stage,32,_ZN5aiter50fmoe_bf16_pertokenFp8_g1u1_vs_tkw1_silu_1tg_32x256E,asm,400.8357,0.0,,,0.0,400.8357,26.760950075076924,14.978380770319037
438,256,7168,256,256,8,ActivationType.Silu,QuantType.per_Tensor,torch.bfloat16,torch.float8_e4m3fnuz,torch.float8_e4m3fnuz,1,0,2-stage,32,_ZN5aiter48fmoe_stage1_bf16_pertokenFp8_g1u1_32x256_2tg_pf3E,asm,257.5523,31.052888888888862,moe_ck2stages_gemm2_256x32x64x256_1x4_MulABScaleExpertWeight_v1_Nswizzle0_Quant1_MulRoutedWeight1_F8_F8_B16,ck,141.2334,429.8385888888888,26.760950075076924,16.06215727330276
439,256,7168,256,256,8,ActivationType.Silu,QuantType.per_Tensor,torch.bfloat16,torch.float8_e4m3fnuz,torch.float8_e4m3fnuz,1,1,2-stage,32,_ZN5aiter57fmoe_stage1_bf16_pertokenFp8_doweight_g1u1_32x256_2tg_pf2E,asm,255.7327,32.75733333333335,moe_ck2stages_gemm2_256x32x64x128_1x4_MulABScaleExpertWeight_v1_Nswizzle0_Quant1_MulRoutedWeight0_F8_F8_B16,ck,143.6865,432.1765333333334,26.760950075076924,16.149521303274998
440,256,7168,256,256,8,ActivationType.Silu,QuantType.per_Token,torch.bfloat16,torch.float8_e4m3fnuz,torch.float8_e4m3fnuz,1,0,1-stage,32,_ZN5aiter45fmoe_bf16_pertokenFp8_g1u1_vs_silu_1tg_32x256E,asm,400.7032,0.0,,,0.0,400.7032,26.760950075076924,14.973429526075904
441,256,7168,256,256,8,ActivationType.Silu,QuantType.per_Token,torch.bfloat16,torch.float8_e4m3fnuz,torch.float8_e4m3fnuz,1,1,1-stage,32,_ZN5aiter53fmoe_bf16_pertokenFp8_g1u1_vs_tkw1_silu_1tg_ps_32x256E,asm,400.1988,0.0,,,0.0,400.1988,26.760950075076924,14.954581166859025
442,256,7168,256,256,8,ActivationType.Gelu,QuantType.per_Tensor,torch.bfloat16,torch.float8_e4m3fnuz,torch.float8_e4m3fnuz,1,0,2-stage,32,_ZN5aiter48fmoe_stage1_bf16_pertokenFp8_g1u1_32x256_2tg_pf3E,asm,257.0355,30.509666666666654,moe_ck2stages_gemm2_256x32x64x256_1x4_MulABScaleExpertWeight_v1_Nswizzle0_Quant1_MulRoutedWeight1_F8_F8_B16,ck,143.0771,430.6222666666666,26.760950075076924,16.091441651307992
443,256,7168,256,256,8,ActivationType.Gelu,QuantType.per_Tensor,torch.bfloat16,torch.float8_e4m3fnuz,torch.float8_e4m3fnuz,1,1,2-stage,32,_ZN5aiter57fmoe_stage1_bf16_pertokenFp8_doweight_g1u1_32x256_2tg_pf3E,asm,257.2507,30.68744444444448,moe_ck2stages_gemm2_256x32x64x128_1x4_MulABScaleExpertWeight_v1_Nswizzle0_Quant1_MulRoutedWeight0_F8_F8_B16,ck,142.3571,430.2952444444445,26.760950075076924,16.0792215237974
444,256,7168,256,256,8,ActivationType.Gelu,QuantType.per_Token,torch.bfloat16,torch.float8_e4m3fnuz,torch.float8_e4m3fnuz,1,0,1-stage,32,_ZN5aiter45fmoe_bf16_pertokenFp8_g1u1_vs_gelu_1tg_32x256E,asm,401.7303,0.0,,,0.0,401.7303,26.760950075076924,15.01181007673343
445,256,7168,256,256,8,ActivationType.Gelu,QuantType.per_Token,torch.bfloat16,torch.float8_e4m3fnuz,torch.float8_e4m3fnuz,1,1,1-stage,32,_ZN5aiter53fmoe_bf16_pertokenFp8_g1u1_vs_tkw1_gelu_1tg_ps_32x256E,asm,402.2847,0.0,,,0.0,402.2847,26.760950075076924,15.03252683000432
446,256,7168,256,256,8,ActivationType.Gelu,QuantType.per_1x128,torch.bfloat16,torch.float8_e4m3fnuz,torch.float8_e4m3fnuz,1,0,1-stage,32,_ZN5aiter47fmoe_bf16_blockscaleFp8_g1u1_vs_gelu_1tg_32x256E,asm,407.4106,0.0,,,0.0,407.4106,26.760950075076924,15.224070851633577
447,256,7168,256,256,8,ActivationType.Gelu,QuantType.per_1x128,torch.bfloat16,torch.float8_e4m3fnuz,torch.float8_e4m3fnuz,1,1,2-stage,16,moe_ck2stages_gemm1_256x16x128x256_1x4_MulABScaleExpertWeightA8W8blkscale_v1_Nswizzle0_Quant4_MulRoutedWeight1_gelu_F8_F8_B16,ck,254.6177,31.42077777777782,moe_ck2stages_gemm2_256x16x128x256_1x4_MulABScaleExpertWeightA8W8blkscale_v1_Nswizzle0_Quant4_MulRoutedWeight0_F8_F8_B16,ck,163.8483,449.8867777777778,26.760950075076924,16.811315611577164
448,256,7168,256,256,8,ActivationType.Silu,QuantType.per_1x128,torch.bfloat16,torch.float8_e4m3fnuz,torch.float8_e4m3fnuz,1,1,2-stage,16,moe_ck2stages_gemm1_256x16x128x256_1x4_MulABScaleExpertWeightA8W8blkscale_v1_Nswizzle0_Quant4_MulRoutedWeight1_silu_F8_F8_B16,ck,251.3464,33.08577777777775,moe_ck2stages_gemm2_256x16x128x256_1x4_MulABScaleExpertWeightA8W8blkscale_v1_Nswizzle0_Quant4_MulRoutedWeight0_F8_F8_B16,ck,162.7764,447.2085777777777,26.760950075076924,16.711236952468035
449,256,7168,256,256,8,ActivationType.Silu,QuantType.per_1x128,torch.bfloat16,torch.float8_e4m3fnuz,torch.float8_e4m3fnuz,1,0,1-stage,32,_ZN5aiter47fmoe_bf16_blockscaleFp8_g1u1_vs_silu_1tg_32x256E,asm,399.2334,0.0,,,0.0,399.2334,26.760950075076924,14.918506214464152
450,256,7168,256,256,8,ActivationType.Gelu,QuantType.per_1x128,torch.bfloat16,torch.float8_e4m3fnuz,torch.float8_e4m3fnuz,1,0,1-stage,32,_ZN5aiter50fmoe_bf16_blockscaleFp8_g1u1_vs_gelu_1tg_ps_32x256E,asm,406.3126,0.0,,,0.0,406.3126,26.760950075076924,15.183040918207462
451,256,7168,256,256,8,ActivationType.Silu,QuantType.per_1x128,torch.bfloat16,torch.float8_e4m3fnuz,torch.float8_e4m3fnuz,1,1,2-stage,16,moe_ck2stages_gemm1_256x16x128x256_1x4_MulABScaleExpertWeightA8W8blkscale_v1_Nswizzle0_Quant4_MulRoutedWeight1_silu_F8_F8_B16,ck,252.9352,29.618444444444474,moe_ck2stages_gemm2_256x16x128x256_1x4_MulABScaleExpertWeightA8W8blkscale_v1_Nswizzle0_Quant4_MulRoutedWeight0_F8_F8_B16,ck,161.966,444.5196444444445,26.760950075076924,16.610757211435317
452,256,7168,256,256,8,ActivationType.Gelu,QuantType.per_1x128,torch.bfloat16,torch.float8_e4m3fnuz,torch.float8_e4m3fnuz,1,1,2-stage,16,moe_ck2stages_gemm1_256x16x128x256_1x4_MulABScaleExpertWeightA8W8blkscale_v1_Nswizzle0_Quant4_MulRoutedWeight1_gelu_F8_F8_B16,ck,251.8909,28.460888888888853,moe_ck2stages_gemm2_256x16x128x256_1x4_MulABScaleExpertWeightA8W8blkscale_v1_Nswizzle0_Quant4_MulRoutedWeight0_F8_F8_B16,ck,162.7174,443.0691888888889,26.760950075076924,16.556556760723126
453,256,7168,256,257,9,ActivationType.Silu,QuantType.per_Token,torch.bfloat16,torch.float8_e4m3fnuz,torch.float8_e4m3fnuz,1,0,1-stage,32,_ZN5aiter45fmoe_bf16_pertokenFp8_g1u1_vs_silu_1tg_32x256E,asm,406.8969,0.0,,,0.0,406.8969,30.10606883446154,13.515444418775692
454,256,7168,256,256,8,ActivationType.Silu,QuantType.per_1x128,torch.bfloat16,torch.float8_e4m3fnuz,torch.float8_e4m3fnuz,1,0,1-stage,32,_ZN5aiter47fmoe_bf16_blockscaleFp8_g1u1_vs_silu_1tg_32x256E,asm,405.8271,0.0,,,0.0,405.8271,26.760950075076924,15.164898811942999
455,256,7168,256,257,9,ActivationType.Silu,QuantType.per_1x128,torch.bfloat16,torch.float8_e4m3fnuz,torch.float8_e4m3fnuz,1,0,1-stage,32,_ZN5aiter47fmoe_bf16_blockscaleFp8_g1u1_vs_silu_1tg_32x256E,asm,414.0447,0.0,,,0.0,414.0447,30.10606883446154,13.752864988007172
456,256,7168,512,256,8,ActivationType.Gelu,QuantType.No,torch.bfloat16,torch.bfloat16,torch.bfloat16,1,0,2-stage,32,moe_ck2stages_gemm1_256x32x64x128_1x4_TypeCast_v1_Nswizzle0_Quant0_MulRoutedWeight0_gelu_B16_B16_B16,ck,1002.6937,0.0,moe_ck2stages_gemm2_256x32x64x128_1x4_TypeCastExpertWeight_v1_Nswizzle0_Quant0_MulRoutedWeight1_B16_B16_B16,ck,542.8174,1545.5111000000002,53.99098735264193,28.625353522533313
457,256,7168,512,256,8,ActivationType.Gelu,QuantType.No,torch.bfloat16,torch.bfloat16,torch.bfloat16,1,1,2-stage,32,moe_ck2stages_gemm1_256x32x64x128_1x4_TypeCastExpertWeight_v1_Nswizzle0_Quant0_MulRoutedWeight1_gelu_B16_B16_B16,ck,1002.2536,0.0,moe_ck2stages_gemm2_256x32x64x128_1x4_TypeCast_v1_Nswizzle0_Quant0_MulRoutedWeight0_B16_B16_B16,ck,537.8272,1540.0808,53.99098735264193,28.52477562488287
458,256,7168,512,256,8,ActivationType.Gelu,QuantType.per_Tensor,torch.bfloat16,torch.float8_e4m3fnuz,torch.float8_e4m3fnuz,1,0,2-stage,32,_ZN5aiter44fmoe_stage1_bf16_pertokenFp8_g1u1_32x512_pf2E,asm,510.4776,40.0934444444444,moe_ck2stages_gemm2_256x32x64x256_1x4_MulABScaleExpertWeight_v1_Nswizzle0_Quant1_MulRoutedWeight1_F8_F8_B16,ck,270.1186,820.6896444444444,53.52190015015385,15.333716518696606
459,256,7168,512,256,8,ActivationType.Gelu,QuantType.per_Tensor,torch.bfloat16,torch.float8_e4m3fnuz,torch.float8_e4m3fnuz,1,1,2-stage,32,_ZN5aiter53fmoe_stage1_bf16_pertokenFp8_doweight_g1u1_32x512_pf2E,asm,510.2735,39.68788888888877,moe_ck2stages_gemm2_256x32x64x128_1x4_MulABScaleExpertWeight_v1_Nswizzle0_Quant1_MulRoutedWeight0_F8_F8_B16,ck,273.3808,823.3421888888888,53.52190015015385,15.383276501376645
460,256,7168,512,256,8,ActivationType.Gelu,QuantType.per_Token,torch.bfloat16,torch.float8_e4m3fnuz,torch.float8_e4m3fnuz,1,0,1-stage,32,_ZN5aiter45fmoe_bf16_pertokenFp8_g1u1_vs_gelu_1tg_32x512E,asm,790.3305,0.0,,,0.0,790.3305,53.52190015015385,14.766488069047531
461,256,7168,512,256,8,ActivationType.Gelu,QuantType.per_Token,torch.bfloat16,torch.float8_e4m3fnuz,torch.float8_e4m3fnuz,1,1,1-stage,32,_ZN5aiter50fmoe_bf16_pertokenFp8_g1u1_vs_tkw1_gelu_1tg_32x512E,asm,791.556,0.0,,,0.0,791.556,53.52190015015385,14.789385238179454
462,256,7168,512,256,8,ActivationType.Silu,QuantType.No,torch.bfloat16,torch.bfloat16,torch.bfloat16,1,1,2-stage,32,moe_ck2stages_gemm1_256x32x64x128_1x4_TypeCastExpertWeight_v1_Nswizzle0_Quant0_MulRoutedWeight1_silu_B16_B16_B16,ck,1004.8815,0.0,moe_ck2stages_gemm2_256x32x64x128_1x4_TypeCast_v1_Nswizzle0_Quant0_MulRoutedWeight0_B16_B16_B16,ck,541.5084,1546.3899,53.99098735264193,28.64163031321802
463,256,7168,512,256,8,ActivationType.Silu,QuantType.per_Tensor,torch.bfloat16,torch.float8_e4m3fnuz,torch.float8_e4m3fnuz,1,0,2-stage,32,_ZN5aiter44fmoe_stage1_bf16_pertokenFp8_g1u1_32x512_pf2E,asm,510.0681,41.26766666666671,moe_ck2stages_gemm2_256x32x64x256_1x4_MulABScaleExpertWeight_v1_Nswizzle0_Quant1_MulRoutedWeight1_F8_F8_B16,ck,274.4011,825.7368666666666,53.52190015015385,15.428018518589406
464,256,7168,512,256,8,ActivationType.Silu,QuantType.per_Tensor,torch.bfloat16,torch.float8_e4m3fnuz,torch.float8_e4m3fnuz,1,1,2-stage,32,_ZN5aiter53fmoe_stage1_bf16_pertokenFp8_doweight_g1u1_32x512_pf2E,asm,509.4962,38.80655555555552,moe_ck2stages_gemm2_256x32x64x128_1x4_MulABScaleExpertWeight_v1_Nswizzle0_Quant1_MulRoutedWeight0_F8_F8_B16,ck,273.3706,821.6733555555554,53.52190015015385,15.352096118605266
465,256,7168,512,256,8,ActivationType.Silu,QuantType.per_Token,torch.bfloat16,torch.float8_e4m3fnuz,torch.float8_e4m3fnuz,1,0,1-stage,32,_ZN5aiter45fmoe_bf16_pertokenFp8_g1u1_vs_silu_1tg_32x512E,asm,791.232,0.0,,,0.0,791.232,53.52190015015385,14.783331641444452
466,256,7168,512,256,8,ActivationType.Silu,QuantType.per_Token,torch.bfloat16,torch.float8_e4m3fnuz,torch.float8_e4m3fnuz,1,1,1-stage,32,_ZN5aiter50fmoe_bf16_pertokenFp8_g1u1_vs_tkw1_silu_1tg_32x512E,asm,789.8129,0.0,,,0.0,789.8129,53.52190015015385,14.756817261423961
467,256,7168,512,256,8,ActivationType.Silu,QuantType.No,torch.bfloat16,torch.bfloat16,torch.bfloat16,1,0,2-stage,32,moe_ck2stages_gemm1_256x32x64x128_1x4_TypeCast_v1_Nswizzle0_Quant0_MulRoutedWeight0_silu_B16_B16_B16,ck,1003.7912,0.0,moe_ck2stages_gemm2_256x32x64x128_1x4_TypeCastExpertWeight_v1_Nswizzle0_Quant0_MulRoutedWeight1_B16_B16_B16,ck,542.0291,1545.8203,53.99098735264193,28.631080404280823
468,256,7168,512,256,8,ActivationType.Silu,QuantType.per_Token,torch.bfloat16,torch.float8_e4m3fnuz,torch.float8_e4m3fnuz,1,0,1-stage,32,_ZN5aiter45fmoe_bf16_pertokenFp8_g1u1_vs_silu_1tg_32x512E,asm,789.3431,0.0,,,0.0,789.3431,53.52190015015385,14.74803954615821
469,256,7168,512,256,8,ActivationType.Silu,QuantType.per_Tensor,torch.bfloat16,torch.float8_e4m3fnuz,torch.float8_e4m3fnuz,1,0,2-stage,32,_ZN5aiter44fmoe_stage1_bf16_pertokenFp8_g1u1_32x512_pf2E,asm,510.3772,40.25744444444442,moe_ck2stages_gemm2_256x32x64x256_1x4_MulABScaleExpertWeight_v1_Nswizzle0_Quant1_MulRoutedWeight1_F8_F8_B16,ck,274.8749,825.5095444444445,53.52190015015385,15.423771243705957
470,256,7168,512,256,8,ActivationType.Silu,QuantType.per_Tensor,torch.bfloat16,torch.float8_e4m3fnuz,torch.float8_e4m3fnuz,1,1,2-stage,32,_ZN5aiter53fmoe_stage1_bf16_pertokenFp8_doweight_g1u1_32x512_pf3E,asm,509.1118,41.27644444444442,moe_ck2stages_gemm2_256x32x64x256_1x4_MulABScaleExpertWeight_v1_Nswizzle0_Quant1_MulRoutedWeight0_F8_F8_B16,ck,270.1204,820.5086444444445,53.52190015015385,15.330334725458846
471,256,7168,512,256,8,ActivationType.Silu,QuantType.per_Token,torch.bfloat16,torch.float8_e4m3fnuz,torch.float8_e4m3fnuz,1,1,1-stage,32,_ZN5aiter50fmoe_bf16_pertokenFp8_g1u1_vs_tkw1_silu_1tg_32x512E,asm,789.0602,0.0,,,0.0,789.0602,53.52190015015385,14.742753859379409
472,256,7168,512,256,8,ActivationType.Gelu,QuantType.per_Tensor,torch.bfloat16,torch.float8_e4m3fnuz,torch.float8_e4m3fnuz,1,0,2-stage,32,_ZN5aiter44fmoe_stage1_bf16_pertokenFp8_g1u1_32x512_pf3E,asm,509.8885,39.719000000000015,moe_ck2stages_gemm2_256x32x64x128_1x4_MulABScaleExpertWeight_v1_Nswizzle0_Quant1_MulRoutedWeight1_F8_F8_B16,ck,273.2601,822.8676,53.52190015015385,15.374409310795643
473,256,7168,512,256,8,ActivationType.Gelu,QuantType.per_Tensor,torch.bfloat16,torch.float8_e4m3fnuz,torch.float8_e4m3fnuz,1,1,2-stage,32,_ZN5aiter53fmoe_stage1_bf16_pertokenFp8_doweight_g1u1_32x512_pf2E,asm,509.7508,39.31377777777786,moe_ck2stages_gemm2_256x32x64x256_1x4_MulABScaleExpertWeight_v1_Nswizzle0_Quant1_MulRoutedWeight0_F8_F8_B16,ck,272.6578,821.7223777777779,53.52190015015385,15.353012046890413
474,256,7168,512,256,8,ActivationType.Gelu,QuantType.per_Token,torch.bfloat16,torch.float8_e4m3fnuz,torch.float8_e4m3fnuz,1,0,1-stage,32,_ZN5aiter45fmoe_bf16_pertokenFp8_g1u1_vs_gelu_1tg_32x512E,asm,790.0766,0.0,,,0.0,790.0766,53.52190015015385,14.761744216544392
475,256,7168,512,256,8,ActivationType.Gelu,QuantType.per_Token,torch.bfloat16,torch.float8_e4m3fnuz,torch.float8_e4m3fnuz,1,1,1-stage,32,_ZN5aiter50fmoe_bf16_pertokenFp8_g1u1_vs_tkw1_gelu_1tg_32x512E,asm,789.1393,0.0,,,0.0,789.1393,53.52190015015385,14.744231759076134
476,256,7168,512,256,8,ActivationType.Gelu,QuantType.per_1x128,torch.bfloat16,torch.float8_e4m3fnuz,torch.float8_e4m3fnuz,1,0,1-stage,32,_ZN5aiter47fmoe_bf16_blockscaleFp8_g1u1_vs_gelu_1tg_32x256E,asm,798.8362,0.0,,,0.0,798.8362,53.52190015015385,14.925408062099674
477,256,7168,512,256,8,ActivationType.Silu,QuantType.per_1x128,torch.bfloat16,torch.float8_e4m3fnuz,torch.float8_e4m3fnuz,1,0,1-stage,32,_ZN5aiter47fmoe_bf16_blockscaleFp8_g1u1_vs_silu_1tg_32x256E,asm,795.9588,0.0,,,0.0,795.9588,53.52190015015385,14.871646891589517
478,256,7168,512,256,8,ActivationType.Gelu,QuantType.per_1x128,torch.bfloat16,torch.float8_e4m3fnuz,torch.float8_e4m3fnuz,1,1,2-stage,16,moe_ck2stages_gemm1_256x16x128x256_1x4_MulABScaleExpertWeightA8W8blkscale_v1_Nswizzle0_Quant4_MulRoutedWeight1_gelu_F8_F8_B16,ck,505.0633,39.13455555555554,moe_ck2stages_gemm2_256x16x128x256_1x4_MulABScaleExpertWeightA8W8blkscale_v1_Nswizzle0_Quant4_MulRoutedWeight0_F8_F8_B16,ck,295.6536,839.8514555555555,53.52190015015385,15.691734658137719
479,256,7168,512,256,8,ActivationType.Silu,QuantType.per_1x128,torch.bfloat16,torch.float8_e4m3fnuz,torch.float8_e4m3fnuz,1,1,2-stage,16,moe_ck2stages_gemm1_256x16x128x256_1x4_MulABScaleExpertWeightA8W8blkscale_v1_Nswizzle0_Quant4_MulRoutedWeight1_silu_F8_F8_B16,ck,505.0064,39.54888888888876,moe_ck2stages_gemm2_256x16x128x256_1x4_MulABScaleExpertWeightA8W8blkscale_v1_Nswizzle0_Quant4_MulRoutedWeight0_F8_F8_B16,ck,295.8779,840.4331888888887,53.52190015015385,15.702603729147926
480,256,7168,512,256,8,ActivationType.Silu,QuantType.per_1x128,torch.bfloat16,torch.float8_e4m3fnuz,torch.float8_e4m3fnuz,1,0,1-stage,32,_ZN5aiter47fmoe_bf16_blockscaleFp8_g1u1_vs_silu_1tg_32x256E,asm,799.2164,0.0,,,0.0,799.2164,53.52190015015385,14.93251169629303
481,256,7168,512,256,8,ActivationType.Gelu,QuantType.per_1x128,torch.bfloat16,torch.float8_e4m3fnuz,torch.float8_e4m3fnuz,1,0,1-stage,32,_ZN5aiter47fmoe_bf16_blockscaleFp8_g1u1_vs_gelu_1tg_32x256E,asm,795.3016,0.0,,,0.0,795.3016,53.52190015015385,14.859367805866547
482,256,7168,512,256,8,ActivationType.Silu,QuantType.per_1x128,torch.bfloat16,torch.float8_e4m3fnuz,torch.float8_e4m3fnuz,1,1,2-stage,16,moe_ck2stages_gemm1_256x16x128x256_1x4_MulABScaleExpertWeightA8W8blkscale_v1_Nswizzle0_Quant4_MulRoutedWeight1_silu_F8_F8_B16,ck,518.3011,39.30344444444435,moe_ck2stages_gemm2_256x16x128x256_1x4_MulABScaleExpertWeightA8W8blkscale_v1_Nswizzle0_Quant4_MulRoutedWeight0_F8_F8_B16,ck,296.8086,854.4131444444445,53.52190015015385,15.963804387501524
483,256,7168,512,256,8,ActivationType.Gelu,QuantType.per_1x128,torch.bfloat16,torch.float8_e4m3fnuz,torch.float8_e4m3fnuz,1,1,2-stage,16,moe_ck2stages_gemm1_256x16x128x256_1x4_MulABScaleExpertWeightA8W8blkscale_v1_Nswizzle0_Quant4_MulRoutedWeight1_gelu_F8_F8_B16,ck,505.4342,40.21211111111114,moe_ck2stages_gemm2_256x16x128x256_1x4_MulABScaleExpertWeightA8W8blkscale_v1_Nswizzle0_Quant4_MulRoutedWeight0_F8_F8_B16,ck,295.6664,841.3127111111112,53.52190015015385,15.719036670051649
484,256,7168,2048,33,10,ActivationType.Silu,QuantType.per_1x128,torch.bfloat16,torch.float8_e4m3fnuz,torch.float8_e4m3fnuz,1,0,1-stage,32,_ZN5aiter47fmoe_bf16_blockscaleFp8_g1u1_vs_silu_1tg_32x256E,asm,663.6376,0.0,,,0.0,663.6376,267.6095007507692,2.4798730917182974
485,256,7168,2048,33,10,ActivationType.Silu,QuantType.per_Token,torch.bfloat16,torch.float8_e4m3fnuz,torch.float8_e4m3fnuz,1,0,1-stage,32,_ZN5aiter48fmoe_bf16_pertokenFp8_g1u1_vs_silu_1tg_ps_32x256E,asm,627.3696,0.0,,,0.0,627.3696,267.6095007507692,2.344347260616444
486,512,2048,192,128,8,ActivationType.Silu,QuantType.No,torch.bfloat16,torch.bfloat16,torch.bfloat16,1,0,2-stage,32,moe_ck2stages_gemm1_256x32x64x64_1x4_TypeCast_v1_Nswizzle0_Quant0_MulRoutedWeight0_silu_B16_B16_B16,ck,66.3998,0.0,moe_ck2stages_gemm2_256x32x64x64_1x4_TypeCastExpertWeight_v1_Nswizzle0_Quant0_MulRoutedWeight1_B16_B16_B16,ck,40.7003,107.1001,11.468978603604395,9.338242201126898
487,512,2048,192,128,8,ActivationType.Silu,QuantType.No,torch.bfloat16,torch.bfloat16,torch.bfloat16,1,1,2-stage,32,moe_ck2stages_gemm1_256x32x64x64_1x4_TypeCastExpertWeight_v1_Nswizzle0_Quant0_MulRoutedWeight1_silu_B16_B16_B16,ck,66.4082,0.0,moe_ck2stages_gemm2_256x32x64x64_1x4_TypeCast_v1_Nswizzle0_Quant0_MulRoutedWeight0_B16_B16_B16,ck,38.7934,105.20159999999998,11.468978603604395,9.172708715921566
488,512,2048,192,128,8,ActivationType.Gelu,QuantType.No,torch.bfloat16,torch.bfloat16,torch.bfloat16,1,0,2-stage,32,moe_ck2stages_gemm1_256x32x64x64_1x4_TypeCast_v1_Nswizzle0_Quant0_MulRoutedWeight0_gelu_B16_B16_B16,ck,65.7084,0.0,moe_ck2stages_gemm2_256x32x64x64_1x4_TypeCastExpertWeight_v1_Nswizzle0_Quant0_MulRoutedWeight1_B16_B16_B16,ck,40.6018,106.3102,11.468978603604395,9.269369459507887
489,512,2048,192,128,8,ActivationType.Gelu,QuantType.No,torch.bfloat16,torch.bfloat16,torch.bfloat16,1,1,2-stage,32,moe_ck2stages_gemm1_256x32x64x64_1x4_TypeCastExpertWeight_v1_Nswizzle0_Quant0_MulRoutedWeight1_gelu_B16_B16_B16,ck,65.8083,0.0,moe_ck2stages_gemm2_256x32x64x64_1x4_TypeCast_v1_Nswizzle0_Quant0_MulRoutedWeight0_B16_B16_B16,ck,38.3995,104.2078,11.468978603604395,9.086057582080612
490,512,4096,192,128,8,ActivationType.Silu,QuantType.No,torch.bfloat16,torch.bfloat16,torch.bfloat16,1,0,2-stage,64,moe_ck2stages_gemm1_256x64x64x64_1x4_TypeCast_v1_Nswizzle0_Quant0_MulRoutedWeight0_silu_B16_B16_B16,ck,125.2912,0.0,moe_ck2stages_gemm2_256x64x64x64_1x4_TypeCastExpertWeight_v1_Nswizzle0_Quant0_MulRoutedWeight1_B16_B16_B16,ck,79.4844,204.7756,22.93795720720879,8.927368647093145
491,512,4096,192,128,8,ActivationType.Silu,QuantType.No,torch.bfloat16,torch.bfloat16,torch.bfloat16,1,1,2-stage,64,moe_ck2stages_gemm1_256x64x64x64_1x4_TypeCastExpertWeight_v1_Nswizzle0_Quant0_MulRoutedWeight1_silu_B16_B16_B16,ck,126.6879,0.0,moe_ck2stages_gemm2_256x64x64x64_1x4_TypeCast_v1_Nswizzle0_Quant0_MulRoutedWeight0_B16_B16_B16,ck,76.5412,203.2291,22.93795720720879,8.859947647654103
492,512,4096,192,128,8,ActivationType.Gelu,QuantType.No,torch.bfloat16,torch.bfloat16,torch.bfloat16,1,0,2-stage,64,moe_ck2stages_gemm1_256x64x64x64_1x4_TypeCast_v1_Nswizzle0_Quant0_MulRoutedWeight0_gelu_B16_B16_B16,ck,124.9846,0.0,moe_ck2stages_gemm2_256x64x64x64_1x4_TypeCastExpertWeight_v1_Nswizzle0_Quant0_MulRoutedWeight1_B16_B16_B16,ck,80.5647,205.5493,22.93795720720879,8.961098764950233
493,512,4096,192,128,8,ActivationType.Gelu,QuantType.No,torch.bfloat16,torch.bfloat16,torch.bfloat16,1,1,2-stage,64,moe_ck2stages_gemm1_256x64x64x64_1x4_TypeCastExpertWeight_v1_Nswizzle0_Quant0_MulRoutedWeight1_gelu_B16_B16_B16,ck,125.6074,0.0,moe_ck2stages_gemm2_256x64x64x64_1x4_TypeCast_v1_Nswizzle0_Quant0_MulRoutedWeight0_B16_B16_B16,ck,75.7023,201.3097,22.93795720720879,8.776269751551098
494,512,4096,384,128,8,ActivationType.Gelu,QuantType.No,torch.bfloat16,torch.bfloat16,torch.bfloat16,1,0,2-stage,64,moe_ck2stages_gemm1_256x64x64x128_1x4_TypeCast_v1_Nswizzle0_Quant0_MulRoutedWeight0_gelu_B16_B16_B16,ck,241.4567,0.0,moe_ck2stages_gemm2_256x64x64x64_1x4_TypeCastExpertWeight_v1_Nswizzle0_Quant0_MulRoutedWeight1_B16_B16_B16,ck,133.6841,375.1408,45.87591441441758,8.177293134937562
495,512,4096,384,128,8,ActivationType.Silu,QuantType.No,torch.bfloat16,torch.bfloat16,torch.bfloat16,1,0,2-stage,64,moe_ck2stages_gemm1_256x64x64x128_1x4_TypeCast_v1_Nswizzle0_Quant0_MulRoutedWeight0_silu_B16_B16_B16,ck,242.0459,0.0,moe_ck2stages_gemm2_256x64x64x64_1x4_TypeCastExpertWeight_v1_Nswizzle0_Quant0_MulRoutedWeight1_B16_B16_B16,ck,136.1176,378.1635,45.87591441441758,8.243181739853304
496,512,4096,384,128,8,ActivationType.Silu,QuantType.No,torch.bfloat16,torch.bfloat16,torch.bfloat16,1,1,2-stage,64,moe_ck2stages_gemm1_256x64x64x128_1x4_TypeCastExpertWeight_v1_Nswizzle0_Quant0_MulRoutedWeight1_silu_B16_B16_B16,ck,242.2063,0.0,moe_ck2stages_gemm2_256x64x64x64_1x4_TypeCast_v1_Nswizzle0_Quant0_MulRoutedWeight0_B16_B16_B16,ck,130.7036,372.9099,45.87591441441758,8.128664131494768
497,512,4096,384,128,8,ActivationType.Silu,QuantType.per_Tensor,torch.bfloat16,torch.float8_e4m3fnuz,torch.float8_e4m3fnuz,1,0,2-stage,64,_ZN5aiter48fmoe_stage1_bf16_pertokenFp8_g1u1_64x128_2tg_pf2E,asm,120.6702,49.99166666666666,moe_ck2stages_gemm2_256x64x128x128_1x4_MulABScaleExpertWeight_v3_Nswizzle0_Quant1_MulRoutedWeight1_F8_F8_B16,ck,99.7138,270.37566666666663,45.87591441441758,5.89363002607954
498,512,4096,384,128,8,ActivationType.Silu,QuantType.per_Tensor,torch.bfloat16,torch.float8_e4m3fnuz,torch.float8_e4m3fnuz,1,1,2-stage,64,_ZN5aiter57fmoe_stage1_bf16_pertokenFp8_doweight_g1u1_64x128_2tg_pf2E,asm,118.6719,54.8611111111111,moe_ck2stages_gemm2_256x64x128x128_1x4_MulABScaleExpertWeight_v3_Nswizzle0_Quant1_MulRoutedWeight0_F8_F8_B16,ck,95.0825,268.61551111111106,45.87591441441758,5.855262277381273
499,512,4096,384,128,8,ActivationType.Silu,QuantType.per_Token,torch.bfloat16,torch.float8_e4m3fnuz,torch.float8_e4m3fnuz,1,0,1-stage,32,_ZN5aiter48fmoe_bf16_pertokenFp8_g1u1_vs_silu_1tg_ps_32x384E,asm,222.2271,0.0,,,0.0,222.2271,45.87591441441758,4.84409090993857
500,512,4096,384,128,8,ActivationType.Silu,QuantType.per_Token,torch.bfloat16,torch.float8_e4m3fnuz,torch.float8_e4m3fnuz,1,1,1-stage,32,_ZN5aiter50fmoe_bf16_pertokenFp8_g1u1_vs_tkw1_silu_1tg_32x384E,asm,220.0198,0.0,,,0.0,220.0198,45.87591441441758,4.795976337658648
501,512,4096,384,128,8,ActivationType.Gelu,QuantType.per_Tensor,torch.bfloat16,torch.float8_e4m3fnuz,torch.float8_e4m3fnuz,1,0,2-stage,32,_ZN5aiter48fmoe_stage1_bf16_pertokenFp8_g1u1_32x128_3tg_pf3E,asm,140.4016,48.879666666666665,moe_ck2stages_gemm2_256x32x64x128_1x4_MulABScaleExpertWeight_v1_Nswizzle0_Quant1_MulRoutedWeight1_F8_F8_B16,ck,76.3743,265.6555666666667,45.87591441441758,5.790741613712188
502,512,4096,384,128,8,ActivationType.Gelu,QuantType.per_Tensor,torch.bfloat16,torch.float8_e4m3fnuz,torch.float8_e4m3fnuz,1,1,2-stage,32,_ZN5aiter56fmoe_stage1_bf16_pertokenFp8_doweight_g1u1_32x64_4tg_pf2E,asm,141.1166,50.99777777777774,moe_ck2stages_gemm2_256x32x64x128_1x4_MulABScaleExpertWeight_v1_Nswizzle0_Quant1_MulRoutedWeight0_F8_F8_B16,ck,73.2704,265.38477777777774,45.87591441441758,5.784838976296773
503,512,4096,384,128,8,ActivationType.Gelu,QuantType.per_Token,torch.bfloat16,torch.float8_e4m3fnuz,torch.float8_e4m3fnuz,1,0,1-stage,32,_ZN5aiter45fmoe_bf16_pertokenFp8_g1u1_vs_gelu_1tg_32x384E,asm,218.7936,0.0,,,0.0,218.7936,45.87591441441758,4.769247715119962
504,512,4096,384,128,8,ActivationType.Gelu,QuantType.per_Token,torch.bfloat16,torch.float8_e4m3fnuz,torch.float8_e4m3fnuz,1,1,1-stage,32,_ZN5aiter50fmoe_bf16_pertokenFp8_g1u1_vs_tkw1_gelu_1tg_32x384E,asm,222.2704,0.0,,,0.0,222.2704,45.87591441441758,4.845034760334855
505,512,4096,384,128,8,ActivationType.Silu,QuantType.per_Tensor,torch.bfloat16,torch.float8_e4m3fnuz,torch.float8_e4m3fnuz,1,0,2-stage,64,_ZN5aiter48fmoe_stage1_bf16_pertokenFp8_g1u1_64x128_2tg_pf2E,asm,118.7457,47.645666666666735,moe_ck2stages_gemm2_256x64x128x128_1x4_MulABScaleExpertWeight_v3_Nswizzle0_Quant1_MulRoutedWeight1_F8_F8_B16,ck,98.8211,265.2124666666667,45.87591441441758,5.781082950649972
506,512,4096,384,128,8,ActivationType.Silu,QuantType.per_Tensor,torch.bfloat16,torch.float8_e4m3fnuz,torch.float8_e4m3fnuz,1,1,2-stage,32,_ZN5aiter57fmoe_stage1_bf16_pertokenFp8_doweight_g1u1_32x128_3tg_pf2E,asm,139.5062,45.949888888888864,moe_ck2stages_gemm2_256x32x64x128_1x4_MulABScaleExpertWeight_v1_Nswizzle0_Quant1_MulRoutedWeight0_F8_F8_B16,ck,73.6067,259.06278888888886,45.87591441441758,5.647032701052217
507,512,4096,384,128,8,ActivationType.Silu,QuantType.per_Token,torch.bfloat16,torch.float8_e4m3fnuz,torch.float8_e4m3fnuz,1,0,1-stage,32,_ZN5aiter45fmoe_bf16_pertokenFp8_g1u1_vs_silu_1tg_32x384E,asm,223.3312,0.0,,,0.0,223.3312,45.87591441441758,4.868158005147314
508,512,4096,384,128,8,ActivationType.Silu,QuantType.per_Token,torch.bfloat16,torch.float8_e4m3fnuz,torch.float8_e4m3fnuz,1,1,1-stage,32,_ZN5aiter50fmoe_bf16_pertokenFp8_g1u1_vs_tkw1_silu_1tg_32x384E,asm,221.0345,0.0,,,0.0,221.0345,45.87591441441758,4.818094697869058
509,512,4096,384,128,8,ActivationType.Gelu,QuantType.No,torch.bfloat16,torch.bfloat16,torch.bfloat16,1,1,2-stage,64,moe_ck2stages_gemm1_256x64x64x128_1x4_TypeCastExpertWeight_v1_Nswizzle0_Quant0_MulRoutedWeight1_gelu_B16_B16_B16,ck,241.1569,0.0,moe_ck2stages_gemm2_256x64x64x64_1x4_TypeCast_v1_Nswizzle0_Quant0_MulRoutedWeight0_B16_B16_B16,ck,133.158,374.3149,45.87591441441758,8.159290224030125
510,512,4096,384,128,8,ActivationType.Gelu,QuantType.per_Tensor,torch.bfloat16,torch.float8_e4m3fnuz,torch.float8_e4m3fnuz,1,0,2-stage,64,_ZN5aiter48fmoe_stage1_bf16_pertokenFp8_g1u1_64x128_2tg_pf2E,asm,120.8184,52.03955555555553,moe_ck2stages_gemm2_256x64x128x128_1x4_MulABScaleExpertWeight_v3_Nswizzle0_Quant1_MulRoutedWeight1_F8_F8_B16,ck,98.0942,270.9521555555555,45.87591441441758,5.90619629088859
511,512,4096,384,128,8,ActivationType.Gelu,QuantType.per_Tensor,torch.bfloat16,torch.float8_e4m3fnuz,torch.float8_e4m3fnuz,1,1,2-stage,32,_ZN5aiter56fmoe_stage1_bf16_pertokenFp8_doweight_g1u1_32x64_4tg_pf2E,asm,141.6941,46.37300000000003,moe_ck2stages_gemm2_256x32x64x128_1x4_MulABScaleExpertWeight_v1_Nswizzle0_Quant1_MulRoutedWeight0_F8_F8_B16,ck,73.4269,261.494,45.87591441441758,5.700028072199459
512,512,4096,384,128,8,ActivationType.Gelu,QuantType.per_Token,torch.bfloat16,torch.float8_e4m3fnuz,torch.float8_e4m3fnuz,1,0,1-stage,32,_ZN5aiter48fmoe_bf16_pertokenFp8_g1u1_vs_gelu_1tg_ps_32x384E,asm,220.1733,0.0,,,0.0,220.1733,45.87591441441758,4.799322320010376
513,512,4096,384,128,8,ActivationType.Gelu,QuantType.per_Token,torch.bfloat16,torch.float8_e4m3fnuz,torch.float8_e4m3fnuz,1,1,1-stage,32,_ZN5aiter50fmoe_bf16_pertokenFp8_g1u1_vs_tkw1_gelu_1tg_32x384E,asm,220.2442,0.0,,,0.0,220.2442,45.87591441441758,4.800867793292053
514,512,4096,384,128,8,ActivationType.Silu,QuantType.per_1x128,torch.bfloat16,torch.float8_e4m3fnuz,torch.float8_e4m3fnuz,1,0,2-stage,64,_ZN5aiter59fmoe_stage1_bf16_pertokenFp8_blockscale_g1u1_64x128_2tg_pf2E,asm,129.0944,49.457111111111054,moe_ck2stages_gemm2_256x64x128x128_1x4_MulABScaleExpertWeightA8W8blkscale_v3_Nswizzle0_Quant4_MulRoutedWeight1_F8_F8_B16,ck,242.8002,421.3517111111111,45.87591441441758,9.184595369693415
515,512,4096,384,128,8,ActivationType.Gelu,QuantType.per_1x128,torch.bfloat16,torch.float8_e4m3fnuz,torch.float8_e4m3fnuz,1,0,2-stage,64,_ZN5aiter59fmoe_stage1_bf16_pertokenFp8_blockscale_g1u1_64x128_2tg_pf2E,asm,129.7541,49.9199999999999,moe_ck2stages_gemm2_256x64x128x128_1x4_MulABScaleExpertWeightA8W8blkscale_v3_Nswizzle0_Quant4_MulRoutedWeight1_F8_F8_B16,ck,243.0364,422.7104999999999,45.87591441441758,9.214214155634426
516,512,4096,384,128,8,ActivationType.Silu,QuantType.per_1x128,torch.bfloat16,torch.float8_e4m3fnuz,torch.float8_e4m3fnuz,1,1,2-stage,64,moe_ck2stages_gemm1_256x64x128x128_1x4_MulABScaleExpertWeightA8W8blkscale_v3_Nswizzle0_Quant4_MulRoutedWeight1_silu_F8_F8_B16,ck,158.7827,50.03044444444441,moe_ck2stages_gemm2_256x64x128x128_1x4_MulABScaleExpertWeightA8W8blkscale_v3_Nswizzle0_Quant4_MulRoutedWeight0_F8_F8_B16,ck,242.364,451.1771444444444,45.87591441441758,9.834728096507465
517,512,4096,384,128,8,ActivationType.Gelu,QuantType.per_1x128,torch.bfloat16,torch.float8_e4m3fnuz,torch.float8_e4m3fnuz,1,1,2-stage,64,moe_ck2stages_gemm1_256x64x128x128_1x4_MulABScaleExpertWeightA8W8blkscale_v3_Nswizzle0_Quant4_MulRoutedWeight1_gelu_F8_F8_B16,ck,157.9069,49.24300000000004,moe_ck2stages_gemm2_256x64x128x128_1x4_MulABScaleExpertWeightA8W8blkscale_v3_Nswizzle0_Quant4_MulRoutedWeight0_F8_F8_B16,ck,242.7781,449.92800000000005,45.87591441441758,9.807499332560434
518,512,4096,384,128,8,ActivationType.Gelu,QuantType.per_1x128,torch.bfloat16,torch.float8_e4m3fnuz,torch.float8_e4m3fnuz,1,0,2-stage,64,_ZN5aiter59fmoe_stage1_bf16_pertokenFp8_blockscale_g1u1_64x128_2tg_pf2E,asm,129.9839,51.472777777777736,moe_ck2stages_gemm2_256x64x128x128_1x4_MulABScaleExpertWeightA8W8blkscale_v3_Nswizzle0_Quant4_MulRoutedWeight1_F8_F8_B16,ck,242.3825,423.83917777777776,45.87591441441758,9.238816995538215
519,512,4096,384,128,8,ActivationType.Silu,QuantType.per_1x128,torch.bfloat16,torch.float8_e4m3fnuz,torch.float8_e4m3fnuz,1,1,2-stage,64,moe_ck2stages_gemm1_256x64x128x128_1x4_MulABScaleExpertWeightA8W8blkscale_v3_Nswizzle0_Quant4_MulRoutedWeight1_silu_F8_F8_B16,ck,158.9518,50.07544444444445,moe_ck2stages_gemm2_256x64x128x128_1x4_MulABScaleExpertWeightA8W8blkscale_v3_Nswizzle0_Quant4_MulRoutedWeight0_F8_F8_B16,ck,241.9139,450.9411444444445,45.87591441441758,9.829583784878754
520,512,4096,384,128,8,ActivationType.Gelu,QuantType.per_1x128,torch.bfloat16,torch.float8_e4m3fnuz,torch.float8_e4m3fnuz,1,1,2-stage,64,moe_ck2stages_gemm1_256x64x128x128_1x4_MulABScaleExpertWeightA8W8blkscale_v3_Nswizzle0_Quant4_MulRoutedWeight1_gelu_F8_F8_B16,ck,159.169,50.841000000000015,moe_ck2stages_gemm2_256x64x128x128_1x4_MulABScaleExpertWeightA8W8blkscale_v3_Nswizzle0_Quant4_MulRoutedWeight0_F8_F8_B16,ck,242.4477,452.4577000000001,45.87591441441758,9.862641557675516
521,512,6144,4096,8,2,ActivationType.Silu,QuantType.per_Token,torch.bfloat16,torch.float8_e4m3fnuz,torch.float8_e4m3fnuz,1,0,1-stage,32,_ZN5aiter45fmoe_bf16_pertokenFp8_g1u1_vs_silu_1tg_32x512E,asm,300.4864,0.0,,,0.0,300.4864,183.50365765767032,1.6374954256255931
522,512,6144,4096,8,2,ActivationType.Silu,QuantType.per_Tensor,torch.bfloat16,torch.int8,torch.int8,1,0,2-stage,64,_ZN5aiter49fmoe_stage1_bf16_pertokenInt8_g1u1_64x128_2tg_pf3E,asm,195.0967,72.937,moe_ck2stages_gemm2_256x64x128x128_1x4_MulABScaleExpertWeight_v3_Nswizzle0_Quant1_MulRoutedWeight1_I8_I8_B16,ck,112.5542,380.5879,183.50365765767032,2.0740071607182577
523,512,6144,4096,8,2,ActivationType.Silu,QuantType.No,torch.bfloat16,torch.bfloat16,torch.bfloat16,1,0,2-stage,64,moe_ck2stages_gemm1_256x64x128x64_1x4_TypeCast_v3_Nswizzle0_Quant0_MulRoutedWeight0_silu_B16_B16_B16,ck,367.7682,0.0,moe_ck2stages_gemm2_256x64x128x64_1x4_TypeCastExpertWeight_v3_Nswizzle0_Quant0_MulRoutedWeight1_B16_B16_B16,ck,204.761,572.5292,183.50365765767032,3.1199879463332794
524,512,7168,256,256,8,ActivationType.Gelu,QuantType.No,torch.bfloat16,torch.bfloat16,torch.bfloat16,1,0,2-stage,32,moe_ck2stages_gemm1_256x32x64x128_1x4_TypeCast_v1_Nswizzle0_Quant0_MulRoutedWeight0_gelu_B16_B16_B16,ck,525.8423,0.0,moe_ck2stages_gemm2_256x32x64x64_1x4_TypeCastExpertWeight_v1_Nswizzle0_Quant0_MulRoutedWeight1_B16_B16_B16,ck,288.1769,814.0192,53.52190015015385,15.209086331320396
525,512,7168,256,256,8,ActivationType.Gelu,QuantType.No,torch.bfloat16,torch.bfloat16,torch.bfloat16,1,1,2-stage,64,moe_ck2stages_gemm1_256x64x128x128_1x4_TypeCastExpertWeight_v3_Nswizzle0_Quant0_MulRoutedWeight1_gelu_B16_B16_B16,ck,517.0102,0.0,moe_ck2stages_gemm2_256x64x64x128_1x4_TypeCast_v1_Nswizzle0_Quant0_MulRoutedWeight0_B16_B16_B16,ck,291.5519,808.5621000000001,53.52190015015385,15.10712619939888
526,512,7168,256,256,8,ActivationType.Gelu,QuantType.per_Tensor,torch.bfloat16,torch.float8_e4m3fnuz,torch.float8_e4m3fnuz,1,0,2-stage,32,_ZN5aiter48fmoe_stage1_bf16_pertokenFp8_g1u1_32x256_2tg_pf2E,asm,258.7469,40.079444444444434,moe_ck2stages_gemm2_256x32x64x128_1x4_MulABScaleExpertWeight_v1_Nswizzle0_Quant1_MulRoutedWeight1_F8_F8_B16,ck,160.6285,459.45484444444446,53.52190015015385,8.584426994472539
527,512,7168,256,256,8,ActivationType.Gelu,QuantType.per_Tensor,torch.bfloat16,torch.float8_e4m3fnuz,torch.float8_e4m3fnuz,1,1,2-stage,32,_ZN5aiter57fmoe_stage1_bf16_pertokenFp8_doweight_g1u1_32x256_2tg_pf2E,asm,258.8258,41.63311111111113,moe_ck2stages_gemm2_256x32x64x256_1x4_MulABScaleExpertWeight_v1_Nswizzle0_Quant1_MulRoutedWeight0_F8_F8_B16,ck,158.6454,459.1043111111112,53.52190015015385,8.577877650515207
528,512,7168,256,256,8,ActivationType.Gelu,QuantType.per_Token,torch.bfloat16,torch.float8_e4m3fnuz,torch.float8_e4m3fnuz,1,0,1-stage,32,_ZN5aiter45fmoe_bf16_pertokenFp8_g1u1_vs_gelu_1tg_32x256E,asm,416.6697,0.0,,,0.0,416.6697,53.52190015015385,7.785031899671863
529,512,7168,256,256,8,ActivationType.Gelu,QuantType.per_Token,torch.bfloat16,torch.float8_e4m3fnuz,torch.float8_e4m3fnuz,1,1,1-stage,32,_ZN5aiter50fmoe_bf16_pertokenFp8_g1u1_vs_tkw1_gelu_1tg_32x256E,asm,416.1533,0.0,,,0.0,416.1533,53.52190015015385,7.775383512776942
530,512,7168,256,256,8,ActivationType.Silu,QuantType.No,torch.bfloat16,torch.bfloat16,torch.bfloat16,1,0,2-stage,32,moe_ck2stages_gemm1_256x32x64x128_1x4_TypeCast_v1_Nswizzle0_Quant0_MulRoutedWeight0_silu_B16_B16_B16,ck,525.4134,0.0,moe_ck2stages_gemm2_256x32x64x64_1x4_TypeCastExpertWeight_v1_Nswizzle0_Quant0_MulRoutedWeight1_B16_B16_B16,ck,289.2017,814.6151,53.52190015015385,15.220220091488258
531,512,7168,256,256,8,ActivationType.Silu,QuantType.No,torch.bfloat16,torch.bfloat16,torch.bfloat16,1,1,2-stage,64,moe_ck2stages_gemm1_256x64x128x128_1x4_TypeCastExpertWeight_v3_Nswizzle0_Quant0_MulRoutedWeight1_silu_B16_B16_B16,ck,520.3624,0.0,moe_ck2stages_gemm2_256x64x64x128_1x4_TypeCast_v1_Nswizzle0_Quant0_MulRoutedWeight0_B16_B16_B16,ck,290.6889,811.0513,53.52190015015385,15.153634264191359
532,512,7168,256,256,8,ActivationType.Silu,QuantType.per_Tensor,torch.bfloat16,torch.float8_e4m3fnuz,torch.float8_e4m3fnuz,1,0,2-stage,32,_ZN5aiter48fmoe_stage1_bf16_pertokenFp8_g1u1_32x256_2tg_pf2E,asm,258.2762,39.53266666666672,moe_ck2stages_gemm2_256x32x64x256_1x4_MulABScaleExpertWeight_v1_Nswizzle0_Quant1_MulRoutedWeight1_F8_F8_B16,ck,160.0318,457.8406666666667,53.52190015015385,8.554267792851347
533,512,7168,256,256,8,ActivationType.Silu,QuantType.per_Tensor,torch.bfloat16,torch.float8_e4m3fnuz,torch.float8_e4m3fnuz,1,1,2-stage,32,_ZN5aiter57fmoe_stage1_bf16_pertokenFp8_doweight_g1u1_32x256_2tg_pf2E,asm,259.4842,39.62966666666668,moe_ck2stages_gemm2_256x32x64x256_1x4_MulABScaleExpertWeight_v1_Nswizzle0_Quant1_MulRoutedWeight0_F8_F8_B16,ck,159.6295,458.7433666666667,53.52190015015385,8.571133785976917
534,512,7168,256,256,8,ActivationType.Silu,QuantType.per_Token,torch.bfloat16,torch.float8_e4m3fnuz,torch.float8_e4m3fnuz,1,0,1-stage,32,_ZN5aiter48fmoe_bf16_pertokenFp8_g1u1_vs_silu_1tg_ps_32x256E,asm,428.1454,0.0,,,0.0,428.1454,53.52190015015385,7.99944319612818
535,512,7168,256,256,8,ActivationType.Silu,QuantType.per_Token,torch.bfloat16,torch.float8_e4m3fnuz,torch.float8_e4m3fnuz,1,1,1-stage,32,_ZN5aiter53fmoe_bf16_pertokenFp8_g1u1_vs_tkw1_silu_1tg_ps_32x256E,asm,416.5075,0.0,,,0.0,416.5075,53.52190015015385,7.782001364516255
536,512,7168,256,256,8,ActivationType.Silu,QuantType.per_Tensor,torch.bfloat16,torch.float8_e4m3fnuz,torch.float8_e4m3fnuz,1,0,2-stage,32,_ZN5aiter48fmoe_stage1_bf16_pertokenFp8_g1u1_32x256_2tg_pf2E,asm,259.7612,39.55866666666666,moe_ck2stages_gemm2_256x32x64x256_1x4_MulABScaleExpertWeight_v1_Nswizzle0_Quant1_MulRoutedWeight1_F8_F8_B16,ck,160.4565,459.77636666666666,53.52190015015385,8.590434296554866
537,512,7168,256,256,8,ActivationType.Silu,QuantType.per_Tensor,torch.bfloat16,torch.float8_e4m3fnuz,torch.float8_e4m3fnuz,1,1,2-stage,32,_ZN5aiter57fmoe_stage1_bf16_pertokenFp8_doweight_g1u1_32x256_2tg_pf2E,asm,258.4544,40.03900000000007,moe_ck2stages_gemm2_256x32x64x256_1x4_MulABScaleExpertWeight_v1_Nswizzle0_Quant1_MulRoutedWeight0_F8_F8_B16,ck,160.2486,458.7420000000001,53.52190015015385,8.571108251258181
538,512,7168,256,256,8,ActivationType.Silu,QuantType.per_Token,torch.bfloat16,torch.float8_e4m3fnuz,torch.float8_e4m3fnuz,1,0,1-stage,32,_ZN5aiter48fmoe_bf16_pertokenFp8_g1u1_vs_silu_1tg_ps_32x256E,asm,418.0309,0.0,,,0.0,418.0309,53.52190015015385,7.8104644795350815
539,512,7168,256,256,8,ActivationType.Silu,QuantType.per_Token,torch.bfloat16,torch.float8_e4m3fnuz,torch.float8_e4m3fnuz,1,1,1-stage,32,_ZN5aiter53fmoe_bf16_pertokenFp8_g1u1_vs_tkw1_silu_1tg_ps_32x256E,asm,416.9734,0.0,,,0.0,416.9734,53.52190015015385,7.7907062124139
540,512,7168,256,256,8,ActivationType.Gelu,QuantType.per_Tensor,torch.bfloat16,torch.float8_e4m3fnuz,torch.float8_e4m3fnuz,1,0,2-stage,32,_ZN5aiter48fmoe_stage1_bf16_pertokenFp8_g1u1_32x256_2tg_pf2E,asm,259.4653,41.293666666666645,moe_ck2stages_gemm2_256x32x64x128_1x4_MulABScaleExpertWeight_v1_Nswizzle0_Quant1_MulRoutedWeight1_F8_F8_B16,ck,159.0691,459.8280666666666,53.52190015015385,8.591400256280789
541,512,7168,256,256,8,ActivationType.Gelu,QuantType.per_Tensor,torch.bfloat16,torch.float8_e4m3fnuz,torch.float8_e4m3fnuz,1,1,2-stage,32,_ZN5aiter57fmoe_stage1_bf16_pertokenFp8_doweight_g1u1_32x256_2tg_pf3E,asm,260.4999,41.73933333333332,moe_ck2stages_gemm2_256x32x64x256_1x4_MulABScaleExpertWeight_v1_Nswizzle0_Quant1_MulRoutedWeight0_F8_F8_B16,ck,156.2688,458.5080333333333,53.52190015015385,8.566736831969807
542,512,7168,256,256,8,ActivationType.Gelu,QuantType.per_Token,torch.bfloat16,torch.float8_e4m3fnuz,torch.float8_e4m3fnuz,1,0,1-stage,32,_ZN5aiter45fmoe_bf16_pertokenFp8_g1u1_vs_gelu_1tg_32x256E,asm,418.3606,0.0,,,0.0,418.3606,53.52190015015385,7.816624574731161
543,512,7168,256,256,8,ActivationType.Gelu,QuantType.per_Token,torch.bfloat16,torch.float8_e4m3fnuz,torch.float8_e4m3fnuz,1,1,1-stage,32,_ZN5aiter50fmoe_bf16_pertokenFp8_g1u1_vs_tkw1_gelu_1tg_32x256E,asm,425.894,0.0,,,0.0,425.894,53.52190015015385,7.957378172396142
544,512,7168,256,256,8,ActivationType.Gelu,QuantType.per_1x128,torch.bfloat16,torch.float8_e4m3fnuz,torch.float8_e4m3fnuz,1,0,1-stage,32,_ZN5aiter47fmoe_bf16_blockscaleFp8_g1u1_vs_gelu_1tg_32x256E,asm,425.1522,0.0,,,0.0,425.1522,53.52190015015385,7.943518425303477
545,512,7168,256,256,8,ActivationType.Gelu,QuantType.per_1x128,torch.bfloat16,torch.float8_e4m3fnuz,torch.float8_e4m3fnuz,1,1,2-stage,16,moe_ck2stages_gemm1_256x16x128x256_1x4_MulABScaleExpertWeightA8W8blkscale_v1_Nswizzle0_Quant4_MulRoutedWeight1_gelu_F8_F8_B16,ck,313.6248,39.4421111111111,moe_ck2stages_gemm2_256x16x128x256_1x4_MulABScaleExpertWeightA8W8blkscale_v1_Nswizzle0_Quant4_MulRoutedWeight0_F8_F8_B16,ck,218.8902,571.9571111111111,53.52190015015385,10.686412655501861
546,512,7168,256,256,8,ActivationType.Silu,QuantType.per_1x128,torch.bfloat16,torch.float8_e4m3fnuz,torch.float8_e4m3fnuz,1,1,2-stage,16,moe_ck2stages_gemm1_256x16x128x256_1x4_MulABScaleExpertWeightA8W8blkscale_v1_Nswizzle0_Quant4_MulRoutedWeight1_silu_F8_F8_B16,ck,313.628,39.56633333333328,moe_ck2stages_gemm2_256x16x128x256_1x4_MulABScaleExpertWeightA8W8blkscale_v1_Nswizzle0_Quant4_MulRoutedWeight0_F8_F8_B16,ck,215.9822,569.1765333333333,53.52190015015385,10.634460505634667
547,512,7168,256,256,8,ActivationType.Silu,QuantType.per_1x128,torch.bfloat16,torch.float8_e4m3fnuz,torch.float8_e4m3fnuz,1,0,1-stage,32,_ZN5aiter47fmoe_bf16_blockscaleFp8_g1u1_vs_silu_1tg_32x256E,asm,424.9608,0.0,,,0.0,424.9608,53.52190015015385,7.939942319084097
548,512,7168,256,256,8,ActivationType.Gelu,QuantType.per_1x128,torch.bfloat16,torch.float8_e4m3fnuz,torch.float8_e4m3fnuz,1,0,1-stage,32,_ZN5aiter47fmoe_bf16_blockscaleFp8_g1u1_vs_gelu_1tg_32x256E,asm,425.0224,0.0,,,0.0,425.0224,53.52190015015385,7.941093249821368
549,512,7168,256,256,8,ActivationType.Silu,QuantType.per_1x128,torch.bfloat16,torch.float8_e4m3fnuz,torch.float8_e4m3fnuz,1,1,2-stage,16,moe_ck2stages_gemm1_256x16x128x256_1x4_MulABScaleExpertWeightA8W8blkscale_v1_Nswizzle0_Quant4_MulRoutedWeight1_silu_F8_F8_B16,ck,313.8166,40.22066666666677,moe_ck2stages_gemm2_256x16x128x256_1x4_MulABScaleExpertWeightA8W8blkscale_v1_Nswizzle0_Quant4_MulRoutedWeight0_F8_F8_B16,ck,217.3567,571.3939666666668,53.52190015015385,10.675890898186362
550,512,7168,256,256,8,ActivationType.Gelu,QuantType.per_1x128,torch.bfloat16,torch.float8_e4m3fnuz,torch.float8_e4m3fnuz,1,1,2-stage,16,moe_ck2stages_gemm1_256x16x128x256_1x4_MulABScaleExpertWeightA8W8blkscale_v1_Nswizzle0_Quant4_MulRoutedWeight1_gelu_F8_F8_B16,ck,310.9228,39.758,moe_ck2stages_gemm2_256x16x128x256_1x4_MulABScaleExpertWeightA8W8blkscale_v1_Nswizzle0_Quant4_MulRoutedWeight0_F8_F8_B16,ck,215.834,566.5147999999999,53.52190015015385,10.584728838300999
551,512,7168,256,257,9,ActivationType.Silu,QuantType.per_Token,torch.bfloat16,torch.float8_e4m3fnuz,torch.float8_e4m3fnuz,1,0,1-stage,32,_ZN5aiter48fmoe_bf16_pertokenFp8_g1u1_vs_silu_1tg_ps_32x256E,asm,426.9222,0.0,,,0.0,426.9222,60.21213766892308,7.090301333386221
552,512,7168,256,256,8,ActivationType.Silu,QuantType.per_1x128,torch.bfloat16,torch.float8_e4m3fnuz,torch.float8_e4m3fnuz,1,0,1-stage,32,_ZN5aiter47fmoe_bf16_blockscaleFp8_g1u1_vs_silu_1tg_32x256E,asm,424.8002,0.0,,,0.0,424.8002,53.52190015015385,7.936941678233353
553,512,7168,256,257,9,ActivationType.Silu,QuantType.per_1x128,torch.bfloat16,torch.float8_e4m3fnuz,torch.float8_e4m3fnuz,1,0,1-stage,32,_ZN5aiter47fmoe_bf16_blockscaleFp8_g1u1_vs_silu_1tg_32x256E,asm,433.7485,0.0,,,0.0,433.7485,60.21213766892308,7.2036721629942715
554,512,7168,512,256,8,ActivationType.Gelu,QuantType.No,torch.bfloat16,torch.bfloat16,torch.bfloat16,1,0,2-stage,64,moe_ck2stages_gemm1_256x64x64x128_1x4_TypeCast_v1_Nswizzle0_Quant0_MulRoutedWeight0_gelu_B16_B16_B16,ck,1026.2894,0.0,moe_ck2stages_gemm2_256x64x64x64_1x4_TypeCastExpertWeight_v1_Nswizzle0_Quant0_MulRoutedWeight1_B16_B16_B16,ck,566.7986,1593.0879999999995,107.0438003003077,14.882580733593594
555,512,7168,512,256,8,ActivationType.Gelu,QuantType.No,torch.bfloat16,torch.bfloat16,torch.bfloat16,1,1,2-stage,64,moe_ck2stages_gemm1_256x64x64x128_1x4_TypeCastExpertWeight_v1_Nswizzle0_Quant0_MulRoutedWeight1_gelu_B16_B16_B16,ck,1027.541,0.0,moe_ck2stages_gemm2_256x64x64x64_1x4_TypeCast_v1_Nswizzle0_Quant0_MulRoutedWeight0_B16_B16_B16,ck,566.2181,1593.7591,107.0438003003077,14.888850129841838
556,512,7168,512,256,8,ActivationType.Gelu,QuantType.per_Tensor,torch.bfloat16,torch.float8_e4m3fnuz,torch.float8_e4m3fnuz,1,0,2-stage,32,_ZN5aiter44fmoe_stage1_bf16_pertokenFp8_g1u1_32x512_pf2E,asm,513.0501,59.57033333333339,moe_ck2stages_gemm2_256x32x64x128_1x4_MulABScaleExpertWeight_v1_Nswizzle0_Quant1_MulRoutedWeight1_F8_F8_B16,ck,288.9584,861.5788333333334,107.0438003003077,8.04884384631528
557,512,7168,512,256,8,ActivationType.Gelu,QuantType.per_Tensor,torch.bfloat16,torch.float8_e4m3fnuz,torch.float8_e4m3fnuz,1,1,2-stage,32,_ZN5aiter53fmoe_stage1_bf16_pertokenFp8_doweight_g1u1_32x512_pf3E,asm,513.2672,59.031666666666624,moe_ck2stages_gemm2_256x32x64x128_1x4_MulABScaleExpertWeight_v1_Nswizzle0_Quant1_MulRoutedWeight0_F8_F8_B16,ck,289.4363,861.7351666666666,107.0438003003077,8.0503043076675
558,512,7168,512,256,8,ActivationType.Gelu,QuantType.per_Token,torch.bfloat16,torch.float8_e4m3fnuz,torch.float8_e4m3fnuz,1,0,1-stage,32,_ZN5aiter48fmoe_bf16_pertokenFp8_g1u1_vs_gelu_1tg_ps_32x512E,asm,808.6673,0.0,,,0.0,808.6673,107.0438003003077,7.55454587497185
559,512,7168,512,256,8,ActivationType.Gelu,QuantType.per_Token,torch.bfloat16,torch.float8_e4m3fnuz,torch.float8_e4m3fnuz,1,1,1-stage,32,_ZN5aiter50fmoe_bf16_pertokenFp8_g1u1_vs_tkw1_gelu_1tg_32x512E,asm,808.2756,0.0,,,0.0,808.2756,107.0438003003077,7.550886625217068
560,512,7168,512,256,8,ActivationType.Silu,QuantType.No,torch.bfloat16,torch.bfloat16,torch.bfloat16,1,1,2-stage,64,moe_ck2stages_gemm1_256x64x64x128_1x4_TypeCastExpertWeight_v1_Nswizzle0_Quant0_MulRoutedWeight1_silu_B16_B16_B16,ck,1027.4419,0.0,moe_ck2stages_gemm2_256x64x64x64_1x4_TypeCast_v1_Nswizzle0_Quant0_MulRoutedWeight0_B16_B16_B16,ck,565.5974,1593.0393,107.0438003003077,14.882125779641447
561,512,7168,512,256,8,ActivationType.Silu,QuantType.per_Tensor,torch.bfloat16,torch.float8_e4m3fnuz,torch.float8_e4m3fnuz,1,0,2-stage,32,_ZN5aiter44fmoe_stage1_bf16_pertokenFp8_g1u1_32x512_pf3E,asm,512.3297,58.849222222222274,moe_ck2stages_gemm2_256x32x64x128_1x4_MulABScaleExpertWeight_v1_Nswizzle0_Quant1_MulRoutedWeight1_F8_F8_B16,ck,289.4602,860.6391222222222,107.0438003003077,8.040065093052833
562,512,7168,512,256,8,ActivationType.Silu,QuantType.per_Tensor,torch.bfloat16,torch.float8_e4m3fnuz,torch.float8_e4m3fnuz,1,1,2-stage,32,_ZN5aiter53fmoe_stage1_bf16_pertokenFp8_doweight_g1u1_32x512_pf2E,asm,512.2455,58.41333333333333,moe_ck2stages_gemm2_256x32x64x128_1x4_MulABScaleExpertWeight_v1_Nswizzle0_Quant1_MulRoutedWeight0_F8_F8_B16,ck,288.8556,859.5144333333333,107.0438003003077,8.029558282889763
563,512,7168,512,256,8,ActivationType.Silu,QuantType.per_Token,torch.bfloat16,torch.float8_e4m3fnuz,torch.float8_e4m3fnuz,1,0,1-stage,32,_ZN5aiter48fmoe_bf16_pertokenFp8_g1u1_vs_silu_1tg_ps_32x512E,asm,810.019,0.0,,,0.0,810.019,107.0438003003077,7.567173416185894
564,512,7168,512,256,8,ActivationType.Silu,QuantType.per_Token,torch.bfloat16,torch.float8_e4m3fnuz,torch.float8_e4m3fnuz,1,1,1-stage,32,_ZN5aiter50fmoe_bf16_pertokenFp8_g1u1_vs_tkw1_silu_1tg_32x512E,asm,807.6037,0.0,,,0.0,807.6037,107.0438003003077,7.544609755392612
565,512,7168,512,256,8,ActivationType.Silu,QuantType.No,torch.bfloat16,torch.bfloat16,torch.bfloat16,1,0,2-stage,32,moe_ck2stages_gemm1_256x32x64x128_1x4_TypeCast_v1_Nswizzle0_Quant0_MulRoutedWeight0_silu_B16_B16_B16,ck,1030.052,0.0,moe_ck2stages_gemm2_256x32x64x128_1x4_TypeCastExpertWeight_v1_Nswizzle0_Quant0_MulRoutedWeight1_B16_B16_B16,ck,568.2032,1598.2552,107.0438003003077,14.930852562373067
566,512,7168,512,256,8,ActivationType.Silu,QuantType.per_Tensor,torch.bfloat16,torch.float8_e4m3fnuz,torch.float8_e4m3fnuz,1,1,2-stage,32,_ZN5aiter53fmoe_stage1_bf16_pertokenFp8_doweight_g1u1_32x512_pf2E,asm,512.9634,58.06166666666664,moe_ck2stages_gemm2_256x32x64x128_1x4_MulABScaleExpertWeight_v1_Nswizzle0_Quant1_MulRoutedWeight0_F8_F8_B16,ck,288.4624,859.4874666666666,107.0438003003077,8.02930636109148
567,512,7168,512,256,8,ActivationType.Silu,QuantType.per_Token,torch.bfloat16,torch.float8_e4m3fnuz,torch.float8_e4m3fnuz,1,0,1-stage,32,_ZN5aiter45fmoe_bf16_pertokenFp8_g1u1_vs_silu_1tg_32x512E,asm,809.3914,0.0,,,0.0,809.3914,107.0438003003077,7.561310395644402
568,512,7168,512,256,8,ActivationType.Silu,QuantType.per_Token,torch.bfloat16,torch.float8_e4m3fnuz,torch.float8_e4m3fnuz,1,1,1-stage,32,_ZN5aiter50fmoe_bf16_pertokenFp8_g1u1_vs_tkw1_silu_1tg_32x512E,asm,808.1097,0.0,,,0.0,808.1097,107.0438003003077,7.549336792349263
569,512,7168,512,256,8,ActivationType.Silu,QuantType.per_Tensor,torch.bfloat16,torch.float8_e4m3fnuz,torch.float8_e4m3fnuz,1,0,2-stage,32,_ZN5aiter44fmoe_stage1_bf16_pertokenFp8_g1u1_32x512_pf2E,asm,512.4718,55.18611111111117,moe_ck2stages_gemm2_256x32x64x128_1x4_MulABScaleExpertWeight_v1_Nswizzle0_Quant1_MulRoutedWeight1_F8_F8_B16,ck,289.589,857.2469111111111,107.0438003003077,8.008375157703057
570,512,7168,512,256,8,ActivationType.Gelu,QuantType.per_Tensor,torch.bfloat16,torch.float8_e4m3fnuz,torch.float8_e4m3fnuz,1,0,2-stage,32,_ZN5aiter44fmoe_stage1_bf16_pertokenFp8_g1u1_32x512_pf2E,asm,514.2338,55.44855555555562,moe_ck2stages_gemm2_256x32x64x128_1x4_MulABScaleExpertWeight_v1_Nswizzle0_Quant1_MulRoutedWeight1_F8_F8_B16,ck,289.4485,859.1308555555556,107.0438003003077,8.025974910693506
571,512,7168,512,256,8,ActivationType.Gelu,QuantType.per_Tensor,torch.bfloat16,torch.float8_e4m3fnuz,torch.float8_e4m3fnuz,1,1,2-stage,32,_ZN5aiter53fmoe_stage1_bf16_pertokenFp8_doweight_g1u1_32x512_pf2E,asm,512.8267,49.57800000000004,moe_ck2stages_gemm2_256x32x64x128_1x4_MulABScaleExpertWeight_v1_Nswizzle0_Quant1_MulRoutedWeight0_F8_F8_B16,ck,289.6743,852.0790000000001,107.0438003003077,7.96009668574473
572,512,7168,512,256,8,ActivationType.Gelu,QuantType.per_Token,torch.bfloat16,torch.float8_e4m3fnuz,torch.float8_e4m3fnuz,1,0,1-stage,32,_ZN5aiter48fmoe_bf16_pertokenFp8_g1u1_vs_gelu_1tg_ps_32x512E,asm,809.3011,0.0,,,0.0,809.3011,107.0438003003077,7.560466815729016
573,512,7168,512,256,8,ActivationType.Gelu,QuantType.per_Token,torch.bfloat16,torch.float8_e4m3fnuz,torch.float8_e4m3fnuz,1,1,1-stage,32,_ZN5aiter50fmoe_bf16_pertokenFp8_g1u1_vs_tkw1_gelu_1tg_32x512E,asm,807.8038,0.0,,,0.0,807.8038,107.0438003003077,7.546479083643652
574,512,7168,512,256,8,ActivationType.Gelu,QuantType.per_1x128,torch.bfloat16,torch.float8_e4m3fnuz,torch.float8_e4m3fnuz,1,0,1-stage,32,_ZN5aiter47fmoe_bf16_blockscaleFp8_g1u1_vs_gelu_1tg_32x256E,asm,825.1772,0.0,,,0.0,825.1772,107.0438003003077,7.708780869933558
575,512,7168,512,256,8,ActivationType.Silu,QuantType.per_1x128,torch.bfloat16,torch.float8_e4m3fnuz,torch.float8_e4m3fnuz,1,0,1-stage,32,_ZN5aiter47fmoe_bf16_blockscaleFp8_g1u1_vs_silu_1tg_32x256E,asm,826.7431,0.0,,,0.0,826.7431,107.0438003003077,7.7234094611794495
576,512,7168,512,256,8,ActivationType.Gelu,QuantType.per_1x128,torch.bfloat16,torch.float8_e4m3fnuz,torch.float8_e4m3fnuz,1,1,2-stage,16,moe_ck2stages_gemm1_256x16x128x256_1x4_MulABScaleExpertWeightA8W8blkscale_v1_Nswizzle0_Quant4_MulRoutedWeight1_gelu_F8_F8_B16,ck,642.5803,58.87522222222219,moe_ck2stages_gemm2_256x16x128x256_1x4_MulABScaleExpertWeightA8W8blkscale_v1_Nswizzle0_Quant4_MulRoutedWeight0_F8_F8_B16,ck,346.2892,1047.7447222222222,107.0438003003077,9.788000045615071
577,512,7168,512,256,8,ActivationType.Silu,QuantType.per_1x128,torch.bfloat16,torch.float8_e4m3fnuz,torch.float8_e4m3fnuz,1,1,2-stage,16,moe_ck2stages_gemm1_256x16x128x256_1x4_MulABScaleExpertWeightA8W8blkscale_v1_Nswizzle0_Quant4_MulRoutedWeight1_silu_F8_F8_B16,ck,643.4621,60.95788888888886,moe_ck2stages_gemm2_256x16x128x256_1x4_MulABScaleExpertWeightA8W8blkscale_v1_Nswizzle0_Quant4_MulRoutedWeight0_F8_F8_B16,ck,346.8855,1051.3054888888887,107.0438003003077,9.821264621953699
578,512,7168,512,256,8,ActivationType.Silu,QuantType.per_1x128,torch.bfloat16,torch.float8_e4m3fnuz,torch.float8_e4m3fnuz,1,0,1-stage,32,_ZN5aiter47fmoe_bf16_blockscaleFp8_g1u1_vs_silu_1tg_32x256E,asm,821.961,0.0,,,0.0,821.961,107.0438003003077,7.678735225150983
579,512,7168,512,256,8,ActivationType.Gelu,QuantType.per_1x128,torch.bfloat16,torch.float8_e4m3fnuz,torch.float8_e4m3fnuz,1,0,1-stage,32,_ZN5aiter47fmoe_bf16_blockscaleFp8_g1u1_vs_gelu_1tg_32x256E,asm,827.0318,0.0,,,0.0,827.0318,107.0438003003077,7.726106487996416
580,512,7168,512,256,8,ActivationType.Silu,QuantType.per_1x128,torch.bfloat16,torch.float8_e4m3fnuz,torch.float8_e4m3fnuz,1,1,2-stage,16,moe_ck2stages_gemm1_256x16x128x256_1x4_MulABScaleExpertWeightA8W8blkscale_v1_Nswizzle0_Quant4_MulRoutedWeight1_silu_F8_F8_B16,ck,642.5491,59.8495555555555,moe_ck2stages_gemm2_256x16x128x256_1x4_MulABScaleExpertWeightA8W8blkscale_v1_Nswizzle0_Quant4_MulRoutedWeight0_F8_F8_B16,ck,347.1742,1049.5728555555554,107.0438003003077,9.80507841286478
581,512,7168,512,256,8,ActivationType.Gelu,QuantType.per_1x128,torch.bfloat16,torch.float8_e4m3fnuz,torch.float8_e4m3fnuz,1,1,2-stage,16,moe_ck2stages_gemm1_256x16x128x256_1x4_MulABScaleExpertWeightA8W8blkscale_v1_Nswizzle0_Quant4_MulRoutedWeight1_gelu_F8_F8_B16,ck,643.9483,60.14377777777776,moe_ck2stages_gemm2_256x16x128x256_1x4_MulABScaleExpertWeightA8W8blkscale_v1_Nswizzle0_Quant4_MulRoutedWeight0_F8_F8_B16,ck,346.558,1050.6500777777778,107.0438003003077,9.815141790839032
582,512,7168,2048,33,10,ActivationType.Silu,QuantType.per_1x128,torch.bfloat16,torch.float8_e4m3fnuz,torch.float8_e4m3fnuz,1,0,1-stage,32,_ZN5aiter47fmoe_bf16_blockscaleFp8_g1u1_vs_silu_1tg_32x256E,asm,1027.9995,0.0,,,0.0,1027.9995,535.2190015015384,1.920708153327858
583,512,7168,2048,33,10,ActivationType.Silu,QuantType.per_Token,torch.bfloat16,torch.float8_e4m3fnuz,torch.float8_e4m3fnuz,1,0,2-stage,64,_ZN5aiter44fmoe_stage1_bf16_pertokenFp8_g1u1_64x256_pf3E,asm,452.0878,105.20188888888886,moe_ck2stages_gemm2_256x64x128x256_1x4_MulABScaleExpertWeight_v3_Nswizzle0_Quant2_MulRoutedWeight1_F8_F8_B16,ck,313.9778,871.2674888888889,535.2190015015384,1.6278709956944317
584,1024,2048,192,128,8,ActivationType.Silu,QuantType.No,torch.bfloat16,torch.bfloat16,torch.bfloat16,1,0,2-stage,64,moe_ck2stages_gemm1_256x64x64x64_1x4_TypeCast_v1_Nswizzle0_Quant0_MulRoutedWeight0_silu_B16_B16_B16,ck,77.7287,0.0,moe_ck2stages_gemm2_256x64x64x64_1x4_TypeCastExpertWeight_v1_Nswizzle0_Quant0_MulRoutedWeight1_B16_B16_B16,ck,60.2452,137.9739,22.93795720720879,6.015091001941466
585,1024,2048,192,128,8,ActivationType.Silu,QuantType.No,torch.bfloat16,torch.bfloat16,torch.bfloat16,1,1,2-stage,64,moe_ck2stages_gemm1_256x64x64x64_1x4_TypeCastExpertWeight_v1_Nswizzle0_Quant0_MulRoutedWeight1_silu_B16_B16_B16,ck,77.8287,0.0,moe_ck2stages_gemm2_256x64x64x64_1x4_TypeCast_v1_Nswizzle0_Quant0_MulRoutedWeight0_B16_B16_B16,ck,56.6568,134.4855,22.93795720720879,5.863011199521062
586,1024,2048,192,128,8,ActivationType.Gelu,QuantType.No,torch.bfloat16,torch.bfloat16,torch.bfloat16,1,0,2-stage,64,moe_ck2stages_gemm1_256x64x64x64_1x4_TypeCast_v1_Nswizzle0_Quant0_MulRoutedWeight0_gelu_B16_B16_B16,ck,76.8541,0.0,moe_ck2stages_gemm2_256x64x64x64_1x4_TypeCastExpertWeight_v1_Nswizzle0_Quant0_MulRoutedWeight1_B16_B16_B16,ck,60.2773,137.1314,22.93795720720879,5.9783614888296706
587,1024,2048,192,128,8,ActivationType.Gelu,QuantType.No,torch.bfloat16,torch.bfloat16,torch.bfloat16,1,1,2-stage,64,moe_ck2stages_gemm1_256x64x64x64_1x4_TypeCastExpertWeight_v1_Nswizzle0_Quant0_MulRoutedWeight1_gelu_B16_B16_B16,ck,77.5872,0.0,moe_ck2stages_gemm2_256x64x64x64_1x4_TypeCast_v1_Nswizzle0_Quant0_MulRoutedWeight0_B16_B16_B16,ck,56.9615,134.5487,22.93795720720879,5.865766457952713
588,1024,4096,192,128,8,ActivationType.Silu,QuantType.No,torch.bfloat16,torch.bfloat16,torch.bfloat16,1,0,2-stage,64,moe_ck2stages_gemm1_256x64x64x128_1x4_TypeCast_v1_Nswizzle0_Quant0_MulRoutedWeight0_silu_B16_B16_B16,ck,165.2301,0.0,moe_ck2stages_gemm2_256x64x64x64_1x4_TypeCastExpertWeight_v1_Nswizzle0_Quant0_MulRoutedWeight1_B16_B16_B16,ck,109.863,275.0931,45.87591441441758,5.99646031063188
589,1024,4096,192,128,8,ActivationType.Silu,QuantType.No,torch.bfloat16,torch.bfloat16,torch.bfloat16,1,1,2-stage,64,moe_ck2stages_gemm1_256x64x64x64_1x4_TypeCastExpertWeight_v1_Nswizzle0_Quant0_MulRoutedWeight1_silu_B16_B16_B16,ck,165.3294,0.0,moe_ck2stages_gemm2_256x64x64x64_1x4_TypeCast_v1_Nswizzle0_Quant0_MulRoutedWeight0_B16_B16_B16,ck,98.9732,264.3026,45.87591441441758,5.761249740167287
590,1024,4096,192,128,8,ActivationType.Gelu,QuantType.No,torch.bfloat16,torch.bfloat16,torch.bfloat16,1,0,2-stage,64,moe_ck2stages_gemm1_256x64x64x128_1x4_TypeCast_v1_Nswizzle0_Quant0_MulRoutedWeight0_gelu_B16_B16_B16,ck,162.3662,0.0,moe_ck2stages_gemm2_256x64x64x64_1x4_TypeCastExpertWeight_v1_Nswizzle0_Quant0_MulRoutedWeight1_B16_B16_B16,ck,109.9681,272.3343,45.87591441441758,5.936324179609433
591,1024,4096,192,128,8,ActivationType.Gelu,QuantType.No,torch.bfloat16,torch.bfloat16,torch.bfloat16,1,1,2-stage,64,moe_ck2stages_gemm1_256x64x64x64_1x4_TypeCastExpertWeight_v1_Nswizzle0_Quant0_MulRoutedWeight1_gelu_B16_B16_B16,ck,163.1834,0.0,moe_ck2stages_gemm2_256x64x64x64_1x4_TypeCast_v1_Nswizzle0_Quant0_MulRoutedWeight0_B16_B16_B16,ck,99.5838,262.7672,45.87591441441758,5.7277811974777615
592,1024,4096,384,128,8,ActivationType.Gelu,QuantType.No,torch.bfloat16,torch.bfloat16,torch.bfloat16,1,0,2-stage,64,moe_ck2stages_gemm1_256x64x128x128_1x4_TypeCast_v3_Nswizzle0_Quant0_MulRoutedWeight0_gelu_B16_B16_B16,ck,309.3037,0.0,moe_ck2stages_gemm2_256x64x64x64_1x4_TypeCastExpertWeight_v1_Nswizzle0_Quant0_MulRoutedWeight1_B16_B16_B16,ck,172.3608,481.6645,91.75182882883516,5.249644679002035
593,1024,4096,384,128,8,ActivationType.Silu,QuantType.No,torch.bfloat16,torch.bfloat16,torch.bfloat16,1,0,2-stage,64,moe_ck2stages_gemm1_256x64x128x128_1x4_TypeCast_v3_Nswizzle0_Quant0_MulRoutedWeight0_silu_B16_B16_B16,ck,317.3144,0.0,moe_ck2stages_gemm2_256x64x64x64_1x4_TypeCastExpertWeight_v1_Nswizzle0_Quant0_MulRoutedWeight1_B16_B16_B16,ck,171.4115,488.7259,91.75182882883516,5.326606632677892
594,1024,4096,384,128,8,ActivationType.Silu,QuantType.No,torch.bfloat16,torch.bfloat16,torch.bfloat16,1,1,2-stage,128,moe_ck2stages_gemm1_256x128x64x64_1x4_TypeCastExpertWeight_v1_Nswizzle0_Quant0_MulRoutedWeight1_silu_B16_B16_B16,ck,286.5464,0.0,moe_ck2stages_gemm2_256x128x128x64_1x4_TypeCast_v3_Nswizzle0_Quant0_MulRoutedWeight0_B16_B16_B16,ck,191.6768,478.2232,91.75182882883516,5.212138069663274
595,1024,4096,384,128,8,ActivationType.Silu,QuantType.per_Tensor,torch.bfloat16,torch.float8_e4m3fnuz,torch.float8_e4m3fnuz,1,0,2-stage,64,_ZN5aiter48fmoe_stage1_bf16_pertokenFp8_g1u1_64x128_2tg_pf2E,asm,158.1831,66.7186666666667,moe_ck2stages_gemm2_256x64x128x128_1x4_MulABScaleExpertWeight_v3_Nswizzle0_Quant1_MulRoutedWeight1_F8_F8_B16,ck,135.583,360.4847666666667,91.75182882883516,3.9289109685122257
596,1024,4096,384,128,8,ActivationType.Silu,QuantType.per_Tensor,torch.bfloat16,torch.float8_e4m3fnuz,torch.float8_e4m3fnuz,1,1,2-stage,64,_ZN5aiter57fmoe_stage1_bf16_pertokenFp8_doweight_g1u1_64x128_2tg_pf2E,asm,160.5261,67.35544444444446,moe_ck2stages_gemm2_256x64x128x128_1x4_MulABScaleExpertWeight_v3_Nswizzle0_Quant1_MulRoutedWeight0_F8_F8_B16,ck,132.231,360.11254444444444,91.75182882883516,3.924854131422726
597,1024,4096,384,128,8,ActivationType.Silu,QuantType.per_Token,torch.bfloat16,torch.float8_e4m3fnuz,torch.float8_e4m3fnuz,1,0,2-stage,64,_ZN5aiter48fmoe_stage1_bf16_pertokenFp8_g1u1_64x128_2tg_pf2E,asm,155.0718,59.454222222222285,moe_ck2stages_gemm2_256x64x128x128_1x4_MulABScaleExpertWeight_v3_Nswizzle0_Quant2_MulRoutedWeight1_F8_F8_B16,ck,154.78,369.3060222222223,91.75182882883516,4.025053526847622
598,1024,4096,384,128,8,ActivationType.Silu,QuantType.per_Token,torch.bfloat16,torch.float8_e4m3fnuz,torch.float8_e4m3fnuz,1,1,2-stage,64,_ZN5aiter57fmoe_stage1_bf16_pertokenFp8_doweight_g1u1_64x128_2tg_pf2E,asm,154.7894,61.00255555555551,moe_ck2stages_gemm2_256x64x128x128_1x4_MulABScaleExpertWeight_v3_Nswizzle0_Quant2_MulRoutedWeight0_F8_F8_B16,ck,152.6088,368.4007555555555,91.75182882883516,4.015187056846729
599,1024,4096,384,128,8,ActivationType.Gelu,QuantType.No,torch.bfloat16,torch.bfloat16,torch.bfloat16,1,1,2-stage,128,moe_ck2stages_gemm1_256x128x64x64_1x4_TypeCastExpertWeight_v1_Nswizzle0_Quant0_MulRoutedWeight1_gelu_B16_B16_B16,ck,287.2794,0.0,moe_ck2stages_gemm2_256x128x128x64_1x4_TypeCast_v3_Nswizzle0_Quant0_MulRoutedWeight0_B16_B16_B16,ck,191.8992,479.1786,91.75182882883516,5.222550941125295
600,1024,4096,384,128,8,ActivationType.Gelu,QuantType.per_Tensor,torch.bfloat16,torch.float8_e4m3fnuz,torch.float8_e4m3fnuz,1,0,2-stage,64,_ZN5aiter48fmoe_stage1_bf16_pertokenFp8_g1u1_64x128_2tg_pf2E,asm,165.6916,64.48922222222222,moe_ck2stages_gemm2_256x64x128x128_1x4_MulABScaleExpertWeight_v3_Nswizzle0_Quant1_MulRoutedWeight1_F8_F8_B16,ck,134.0587,364.2395222222222,91.75182882883516,3.9698339190788032
601,1024,4096,384,128,8,ActivationType.Gelu,QuantType.per_Tensor,torch.bfloat16,torch.float8_e4m3fnuz,torch.float8_e4m3fnuz,1,1,2-stage,64,_ZN5aiter57fmoe_stage1_bf16_pertokenFp8_doweight_g1u1_64x128_2tg_pf2E,asm,161.5328,66.33611111111111,moe_ck2stages_gemm2_256x64x128x128_1x4_MulABScaleExpertWeight_v3_Nswizzle0_Quant1_MulRoutedWeight0_F8_F8_B16,ck,130.737,358.60591111111114,91.75182882883516,3.9084333869801933
602,1024,4096,384,128,8,ActivationType.Gelu,QuantType.per_Token,torch.bfloat16,torch.float8_e4m3fnuz,torch.float8_e4m3fnuz,1,0,2-stage,64,_ZN5aiter48fmoe_stage1_bf16_pertokenFp8_g1u1_64x128_2tg_pf2E,asm,156.8126,61.26055555555556,moe_ck2stages_gemm2_256x64x128x128_1x4_MulABScaleExpertWeight_v3_Nswizzle0_Quant2_MulRoutedWeight1_F8_F8_B16,ck,155.3824,373.4555555555555,91.75182882883516,4.070279146721361
603,1024,4096,384,128,8,ActivationType.Gelu,QuantType.per_Token,torch.bfloat16,torch.float8_e4m3fnuz,torch.float8_e4m3fnuz,1,1,2-stage,64,_ZN5aiter57fmoe_stage1_bf16_pertokenFp8_doweight_g1u1_64x128_2tg_pf2E,asm,156.3248,61.68866666666666,moe_ck2stages_gemm2_256x64x128x128_1x4_MulABScaleExpertWeight_v3_Nswizzle0_Quant2_MulRoutedWeight0_F8_F8_B16,ck,153.5204,371.53386666666665,91.75182882883516,4.049334726174999
604,1024,4096,384,128,8,ActivationType.Silu,QuantType.per_Tensor,torch.bfloat16,torch.float8_e4m3fnuz,torch.float8_e4m3fnuz,1,0,2-stage,64,_ZN5aiter48fmoe_stage1_bf16_pertokenFp8_g1u1_64x128_2tg_pf3E,asm,163.6057,64.56899999999999,moe_ck2stages_gemm2_256x64x128x128_1x4_MulABScaleExpertWeight_v3_Nswizzle0_Quant1_MulRoutedWeight1_F8_F8_B16,ck,134.6265,362.8012,91.75182882883516,3.9541576950669044
605,1024,4096,384,128,8,ActivationType.Silu,QuantType.per_Tensor,torch.bfloat16,torch.float8_e4m3fnuz,torch.float8_e4m3fnuz,1,1,2-stage,128,_ZN5aiter53fmoe_stage1_bf16_pertokenFp8_doweight_g1u1_128x64_pf3E,asm,166.8875,67.05300000000001,moe_ck2stages_gemm2_256x128x64x128_1x4_MulABScaleExpertWeight_v1_Nswizzle0_Quant1_MulRoutedWeight0_F8_F8_B16,ck,126.0664,360.0069,91.75182882883516,3.9237027162869955
606,1024,4096,384,128,8,ActivationType.Silu,QuantType.per_Token,torch.bfloat16,torch.float8_e4m3fnuz,torch.float8_e4m3fnuz,1,0,2-stage,64,_ZN5aiter48fmoe_stage1_bf16_pertokenFp8_g1u1_64x128_2tg_pf2E,asm,162.2836,59.3291111111112,moe_ck2stages_gemm2_256x64x128x128_1x4_MulABScaleExpertWeight_v3_Nswizzle0_Quant2_MulRoutedWeight1_F8_F8_B16,ck,152.664,374.2767111111112,91.75182882883516,4.079228892639642
607,1024,4096,384,128,8,ActivationType.Silu,QuantType.per_Token,torch.bfloat16,torch.float8_e4m3fnuz,torch.float8_e4m3fnuz,1,1,2-stage,64,_ZN5aiter57fmoe_stage1_bf16_pertokenFp8_doweight_g1u1_64x128_2tg_pf3E,asm,156.675,60.96755555555559,moe_ck2stages_gemm2_256x64x128x128_1x4_MulABScaleExpertWeight_v3_Nswizzle0_Quant2_MulRoutedWeight0_F8_F8_B16,ck,153.7926,371.4351555555556,91.75182882883516,4.048258877198788
608,1024,4096,384,128,8,ActivationType.Gelu,QuantType.per_Tensor,torch.bfloat16,torch.float8_e4m3fnuz,torch.float8_e4m3fnuz,1,0,2-stage,64,moe_ck2stages_gemm1_256x64x128x128_1x4_MulABScale_v3_Nswizzle0_Quant1_MulRoutedWeight0_gelu_F8_F8_B16,ck,164.3934,66.01166666666667,moe_ck2stages_gemm2_256x64x128x128_1x4_MulABScaleExpertWeight_v3_Nswizzle0_Quant1_MulRoutedWeight1_F8_F8_B16,ck,134.322,364.7270666666667,91.75182882883516,3.9751476490683606
609,1024,4096,384,128,8,ActivationType.Gelu,QuantType.per_Tensor,torch.bfloat16,torch.float8_e4m3fnuz,torch.float8_e4m3fnuz,1,1,2-stage,128,_ZN5aiter54fmoe_stage1_bf16_pertokenFp8_doweight_g1u1_128x128_pf3E,asm,169.1139,65.17877777777773,moe_ck2stages_gemm2_256x128x64x128_1x4_MulABScaleExpertWeight_v1_Nswizzle0_Quant1_MulRoutedWeight0_F8_F8_B16,ck,127.464,361.7566777777777,91.75182882883516,3.942773483596081
610,1024,4096,384,128,8,ActivationType.Gelu,QuantType.per_Token,torch.bfloat16,torch.float8_e4m3fnuz,torch.float8_e4m3fnuz,1,0,2-stage,64,_ZN5aiter48fmoe_stage1_bf16_pertokenFp8_g1u1_64x128_2tg_pf2E,asm,162.1651,60.92233333333338,moe_ck2stages_gemm2_256x64x128x128_1x4_MulABScaleExpertWeight_v3_Nswizzle0_Quant2_MulRoutedWeight1_F8_F8_B16,ck,156.1984,379.28583333333336,91.75182882883516,4.133823141998603
611,1024,4096,384,128,8,ActivationType.Gelu,QuantType.per_Token,torch.bfloat16,torch.float8_e4m3fnuz,torch.float8_e4m3fnuz,1,1,2-stage,64,_ZN5aiter57fmoe_stage1_bf16_pertokenFp8_doweight_g1u1_64x128_2tg_pf3E,asm,157.8347,60.28611111111122,moe_ck2stages_gemm2_256x64x128x128_1x4_MulABScaleExpertWeight_v3_Nswizzle0_Quant2_MulRoutedWeight0_F8_F8_B16,ck,153.8137,371.9345111111112,91.75182882883516,4.053701336078677
612,1024,4096,384,128,8,ActivationType.Silu,QuantType.per_1x128,torch.bfloat16,torch.float8_e4m3fnuz,torch.float8_e4m3fnuz,1,0,2-stage,64,_ZN5aiter59fmoe_stage1_bf16_pertokenFp8_blockscale_g1u1_64x128_2tg_pf3E,asm,171.7414,72.89622222222225,moe_ck2stages_gemm2_256x64x128x128_1x4_MulABScaleExpertWeightA8W8blkscale_v3_Nswizzle0_Quant4_MulRoutedWeight1_F8_F8_B16,ck,414.7839,659.4215222222223,91.75182882883516,7.187012298712717
613,1024,4096,384,128,8,ActivationType.Gelu,QuantType.per_1x128,torch.bfloat16,torch.float8_e4m3fnuz,torch.float8_e4m3fnuz,1,0,2-stage,64,_ZN5aiter59fmoe_stage1_bf16_pertokenFp8_blockscale_g1u1_64x128_2tg_pf3E,asm,168.9145,72.03199999999998,moe_ck2stages_gemm2_256x64x128x128_1x4_MulABScaleExpertWeightA8W8blkscale_v3_Nswizzle0_Quant4_MulRoutedWeight1_F8_F8_B16,ck,414.1851,655.1315999999999,91.75182882883516,7.140256585208354
614,1024,4096,384,128,8,ActivationType.Silu,QuantType.per_1x128,torch.bfloat16,torch.float8_e4m3fnuz,torch.float8_e4m3fnuz,1,1,2-stage,64,moe_ck2stages_gemm1_256x64x128x128_1x4_MulABScaleExpertWeightA8W8blkscale_v3_Nswizzle0_Quant4_MulRoutedWeight1_silu_F8_F8_B16,ck,187.6453,73.2345555555556,moe_ck2stages_gemm2_256x64x128x128_1x4_MulABScaleExpertWeightA8W8blkscale_v3_Nswizzle0_Quant4_MulRoutedWeight0_F8_F8_B16,ck,412.1274,673.0072555555556,91.75182882883516,7.335082735092549
615,1024,4096,384,128,8,ActivationType.Gelu,QuantType.per_1x128,torch.bfloat16,torch.float8_e4m3fnuz,torch.float8_e4m3fnuz,1,1,2-stage,64,moe_ck2stages_gemm1_256x64x128x128_1x4_MulABScaleExpertWeightA8W8blkscale_v3_Nswizzle0_Quant4_MulRoutedWeight1_gelu_F8_F8_B16,ck,186.5515,73.02988888888909,moe_ck2stages_gemm2_256x64x128x128_1x4_MulABScaleExpertWeightA8W8blkscale_v3_Nswizzle0_Quant4_MulRoutedWeight0_F8_F8_B16,ck,411.8446,671.4259888888892,91.75182882883516,7.317848564538671
616,1024,4096,384,128,8,ActivationType.Gelu,QuantType.per_1x128,torch.bfloat16,torch.float8_e4m3fnuz,torch.float8_e4m3fnuz,1,0,2-stage,64,_ZN5aiter59fmoe_stage1_bf16_pertokenFp8_blockscale_g1u1_64x128_2tg_pf2E,asm,165.9988,73.39499999999991,moe_ck2stages_gemm2_256x64x128x128_1x4_MulABScaleExpertWeightA8W8blkscale_v3_Nswizzle0_Quant4_MulRoutedWeight1_F8_F8_B16,ck,414.057,653.4507999999998,91.75182882883516,7.121937604306778
617,1024,4096,384,128,8,ActivationType.Silu,QuantType.per_1x128,torch.bfloat16,torch.float8_e4m3fnuz,torch.float8_e4m3fnuz,1,1,2-stage,64,moe_ck2stages_gemm1_256x64x128x128_1x4_MulABScaleExpertWeightA8W8blkscale_v3_Nswizzle0_Quant4_MulRoutedWeight1_silu_F8_F8_B16,ck,189.6281,71.97966666666665,moe_ck2stages_gemm2_256x64x128x128_1x4_MulABScaleExpertWeightA8W8blkscale_v3_Nswizzle0_Quant4_MulRoutedWeight0_F8_F8_B16,ck,411.9711,673.5788666666666,91.75182882883516,7.341312704766259
618,1024,4096,384,128,8,ActivationType.Gelu,QuantType.per_1x128,torch.bfloat16,torch.float8_e4m3fnuz,torch.float8_e4m3fnuz,1,1,2-stage,64,moe_ck2stages_gemm1_256x64x128x128_1x4_MulABScaleExpertWeightA8W8blkscale_v3_Nswizzle0_Quant4_MulRoutedWeight1_gelu_F8_F8_B16,ck,192.1889,71.71622222222216,moe_ck2stages_gemm2_256x64x128x128_1x4_MulABScaleExpertWeightA8W8blkscale_v3_Nswizzle0_Quant4_MulRoutedWeight0_F8_F8_B16,ck,411.5066,675.4117222222221,91.75182882883516,7.361288933893797
619,1024,7168,256,256,8,ActivationType.Gelu,QuantType.No,torch.bfloat16,torch.bfloat16,torch.bfloat16,1,0,2-stage,64,moe_ck2stages_gemm1_256x64x128x128_1x4_TypeCast_v3_Nswizzle0_Quant0_MulRoutedWeight0_gelu_B16_B16_B16,ck,534.6118,0.0,moe_ck2stages_gemm2_256x64x64x64_1x4_TypeCastExpertWeight_v1_Nswizzle0_Quant0_MulRoutedWeight1_B16_B16_B16,ck,334.4249,869.0367,107.0438003003077,8.118515014993372
620,1024,7168,256,256,8,ActivationType.Gelu,QuantType.No,torch.bfloat16,torch.bfloat16,torch.bfloat16,1,1,2-stage,64,moe_ck2stages_gemm1_256x64x128x128_1x4_TypeCastExpertWeight_v3_Nswizzle0_Quant0_MulRoutedWeight1_gelu_B16_B16_B16,ck,531.0804,0.0,moe_ck2stages_gemm2_256x64x64x64_1x4_TypeCast_v1_Nswizzle0_Quant0_MulRoutedWeight0_B16_B16_B16,ck,325.3061,856.3865000000001,107.0438003003077,8.000337222683026
621,1024,7168,256,256,8,ActivationType.Gelu,QuantType.per_Tensor,torch.bfloat16,torch.float8_e4m3fnuz,torch.float8_e4m3fnuz,1,0,2-stage,64,_ZN5aiter44fmoe_stage1_bf16_pertokenFp8_g1u1_64x256_pf2E,asm,276.1291,56.40600000000001,moe_ck2stages_gemm2_256x64x64x256_1x4_MulABScaleExpertWeight_v1_Nswizzle0_Quant1_MulRoutedWeight1_F8_F8_B16,ck,225.5523,558.0874,107.0438003003077,5.213635898896573
622,1024,7168,256,256,8,ActivationType.Gelu,QuantType.per_Tensor,torch.bfloat16,torch.float8_e4m3fnuz,torch.float8_e4m3fnuz,1,1,2-stage,64,_ZN5aiter53fmoe_stage1_bf16_pertokenFp8_doweight_g1u1_64x256_pf2E,asm,278.4258,60.06911111111117,moe_ck2stages_gemm2_256x64x64x256_1x4_MulABScaleExpertWeight_v1_Nswizzle0_Quant1_MulRoutedWeight0_F8_F8_B16,ck,215.7055,554.2004111111112,107.0438003003077,5.17732376425651
623,1024,7168,256,256,8,ActivationType.Gelu,QuantType.per_Token,torch.bfloat16,torch.float8_e4m3fnuz,torch.float8_e4m3fnuz,1,0,1-stage,32,_ZN5aiter45fmoe_bf16_pertokenFp8_g1u1_vs_gelu_1tg_32x256E,asm,556.8182,0.0,,,0.0,556.8182,107.0438003003077,5.201779070229811
624,1024,7168,256,256,8,ActivationType.Gelu,QuantType.per_Token,torch.bfloat16,torch.float8_e4m3fnuz,torch.float8_e4m3fnuz,1,1,1-stage,32,_ZN5aiter50fmoe_bf16_pertokenFp8_g1u1_vs_tkw1_gelu_1tg_32x256E,asm,555.564,0.0,,,0.0,555.564,107.0438003003077,5.190062371117097
625,1024,7168,256,256,8,ActivationType.Silu,QuantType.No,torch.bfloat16,torch.bfloat16,torch.bfloat16,1,0,2-stage,64,moe_ck2stages_gemm1_256x64x128x128_1x4_TypeCast_v3_Nswizzle0_Quant0_MulRoutedWeight0_silu_B16_B16_B16,ck,531.4438,0.0,moe_ck2stages_gemm2_256x64x64x64_1x4_TypeCastExpertWeight_v1_Nswizzle0_Quant0_MulRoutedWeight1_B16_B16_B16,ck,329.8305,861.2743,107.0438003003077,8.045998904969037
626,1024,7168,256,256,8,ActivationType.Silu,QuantType.No,torch.bfloat16,torch.bfloat16,torch.bfloat16,1,1,2-stage,64,moe_ck2stages_gemm1_256x64x128x128_1x4_TypeCastExpertWeight_v3_Nswizzle0_Quant0_MulRoutedWeight1_silu_B16_B16_B16,ck,533.671,0.0,moe_ck2stages_gemm2_256x64x64x64_1x4_TypeCast_v1_Nswizzle0_Quant0_MulRoutedWeight0_B16_B16_B16,ck,327.3332,861.0042000000001,107.0438003003077,8.043475638799094
627,1024,7168,256,256,8,ActivationType.Silu,QuantType.per_Tensor,torch.bfloat16,torch.float8_e4m3fnuz,torch.float8_e4m3fnuz,1,0,2-stage,64,_ZN5aiter44fmoe_stage1_bf16_pertokenFp8_g1u1_64x256_pf2E,asm,277.155,58.28433333333336,moe_ck2stages_gemm2_256x64x64x256_1x4_MulABScaleExpertWeight_v1_Nswizzle0_Quant1_MulRoutedWeight1_F8_F8_B16,ck,226.981,562.4203333333332,107.0438003003077,5.254114033278736
628,1024,7168,256,256,8,ActivationType.Silu,QuantType.per_Tensor,torch.bfloat16,torch.float8_e4m3fnuz,torch.float8_e4m3fnuz,1,1,2-stage,64,_ZN5aiter53fmoe_stage1_bf16_pertokenFp8_doweight_g1u1_64x256_pf2E,asm,275.9019,55.26644444444446,moe_ck2stages_gemm2_256x64x64x256_1x4_MulABScaleExpertWeight_v1_Nswizzle0_Quant1_MulRoutedWeight0_F8_F8_B16,ck,218.9625,550.1308444444445,107.0438003003077,5.139305993444472
629,1024,7168,256,256,8,ActivationType.Silu,QuantType.per_Token,torch.bfloat16,torch.float8_e4m3fnuz,torch.float8_e4m3fnuz,1,0,1-stage,32,_ZN5aiter45fmoe_bf16_pertokenFp8_g1u1_vs_silu_1tg_32x256E,asm,554.1924,0.0,,,0.0,554.1924,107.0438003003077,5.17724892469468
630,1024,7168,256,256,8,ActivationType.Silu,QuantType.per_Token,torch.bfloat16,torch.float8_e4m3fnuz,torch.float8_e4m3fnuz,1,1,1-stage,32,_ZN5aiter50fmoe_bf16_pertokenFp8_g1u1_vs_tkw1_silu_1tg_32x256E,asm,558.103,0.0,,,0.0,558.103,107.0438003003077,5.213781633632786
631,1024,7168,256,256,8,ActivationType.Silu,QuantType.per_Tensor,torch.bfloat16,torch.float8_e4m3fnuz,torch.float8_e4m3fnuz,1,0,2-stage,64,_ZN5aiter44fmoe_stage1_bf16_pertokenFp8_g1u1_64x256_pf2E,asm,278.0303,60.87022222222218,moe_ck2stages_gemm2_256x64x64x256_1x4_MulABScaleExpertWeight_v1_Nswizzle0_Quant1_MulRoutedWeight1_F8_F8_B16,ck,224.8731,563.7736222222222,107.0438003003077,5.266756417845543
632,1024,7168,256,256,8,ActivationType.Silu,QuantType.per_Tensor,torch.bfloat16,torch.float8_e4m3fnuz,torch.float8_e4m3fnuz,1,1,2-stage,64,_ZN5aiter53fmoe_stage1_bf16_pertokenFp8_doweight_g1u1_64x256_pf2E,asm,277.0042,57.56744444444444,moe_ck2stages_gemm2_256x64x64x256_1x4_MulABScaleExpertWeight_v1_Nswizzle0_Quant1_MulRoutedWeight0_F8_F8_B16,ck,216.6602,551.2318444444445,107.0438003003077,5.149591502711811
633,1024,7168,256,256,8,ActivationType.Silu,QuantType.per_Token,torch.bfloat16,torch.float8_e4m3fnuz,torch.float8_e4m3fnuz,1,0,1-stage,32,_ZN5aiter48fmoe_bf16_pertokenFp8_g1u1_vs_silu_1tg_ps_32x256E,asm,556.8311,0.0,,,0.0,556.8311,107.0438003003077,5.201899581646294
634,1024,7168,256,256,8,ActivationType.Silu,QuantType.per_Token,torch.bfloat16,torch.float8_e4m3fnuz,torch.float8_e4m3fnuz,1,1,1-stage,32,_ZN5aiter50fmoe_bf16_pertokenFp8_g1u1_vs_tkw1_silu_1tg_32x256E,asm,554.9086,0.0,,,0.0,554.9086,107.0438003003077,5.183939643802098
635,1024,7168,256,256,8,ActivationType.Gelu,QuantType.per_Tensor,torch.bfloat16,torch.float8_e4m3fnuz,torch.float8_e4m3fnuz,1,0,2-stage,64,_ZN5aiter44fmoe_stage1_bf16_pertokenFp8_g1u1_64x256_pf2E,asm,277.0395,58.95599999999998,moe_ck2stages_gemm2_256x64x64x256_1x4_MulABScaleExpertWeight_v1_Nswizzle0_Quant1_MulRoutedWeight1_F8_F8_B16,ck,228.5593,564.5547999999999,107.0438003003077,5.274054157421175
636,1024,7168,256,256,8,ActivationType.Gelu,QuantType.per_Tensor,torch.bfloat16,torch.float8_e4m3fnuz,torch.float8_e4m3fnuz,1,1,2-stage,64,moe_ck2stages_gemm1_256x64x128x128_1x4_MulABScale_v3_Nswizzle0_Quant1_MulRoutedWeight1_gelu_F8_F8_B16,ck,277.824,58.497777777777856,moe_ck2stages_gemm2_256x64x64x256_1x4_MulABScaleExpertWeight_v1_Nswizzle0_Quant1_MulRoutedWeight0_F8_F8_B16,ck,218.9013,555.2230777777779,107.0438003003077,5.186877485852695
637,1024,7168,256,256,8,ActivationType.Gelu,QuantType.per_Token,torch.bfloat16,torch.float8_e4m3fnuz,torch.float8_e4m3fnuz,1,0,1-stage,32,_ZN5aiter45fmoe_bf16_pertokenFp8_g1u1_vs_gelu_1tg_32x256E,asm,556.3844,0.0,,,0.0,556.3844,107.0438003003077,5.197726523526657
638,1024,7168,256,256,8,ActivationType.Gelu,QuantType.per_Token,torch.bfloat16,torch.float8_e4m3fnuz,torch.float8_e4m3fnuz,1,1,1-stage,32,_ZN5aiter50fmoe_bf16_pertokenFp8_g1u1_vs_tkw1_gelu_1tg_32x256E,asm,557.1708,0.0,,,0.0,557.1708,107.0438003003077,5.205073048947034
639,1024,7168,256,256,8,ActivationType.Gelu,QuantType.per_1x128,torch.bfloat16,torch.float8_e4m3fnuz,torch.float8_e4m3fnuz,1,0,1-stage,32,_ZN5aiter47fmoe_bf16_blockscaleFp8_g1u1_vs_gelu_1tg_32x256E,asm,557.6848,0.0,,,0.0,557.6848,107.0438003003077,5.209874821665846
640,1024,7168,256,256,8,ActivationType.Gelu,QuantType.per_1x128,torch.bfloat16,torch.float8_e4m3fnuz,torch.float8_e4m3fnuz,1,1,2-stage,16,moe_ck2stages_gemm1_256x16x128x256_1x4_MulABScaleExpertWeightA8W8blkscale_v1_Nswizzle0_Quant4_MulRoutedWeight1_gelu_F8_F8_B16,ck,524.1262,60.74066666666671,moe_ck2stages_gemm2_256x16x128x256_1x4_MulABScaleExpertWeightA8W8blkscale_v1_Nswizzle0_Quant4_MulRoutedWeight0_F8_F8_B16,ck,364.955,949.8218666666668,107.0438003003077,8.87320764025543
641,1024,7168,256,256,8,ActivationType.Silu,QuantType.per_1x128,torch.bfloat16,torch.float8_e4m3fnuz,torch.float8_e4m3fnuz,1,1,2-stage,16,moe_ck2stages_gemm1_256x16x128x256_1x4_MulABScaleExpertWeightA8W8blkscale_v1_Nswizzle0_Quant4_MulRoutedWeight1_silu_F8_F8_B16,ck,523.6795,61.16300000000008,moe_ck2stages_gemm2_256x16x128x256_1x4_MulABScaleExpertWeightA8W8blkscale_v1_Nswizzle0_Quant4_MulRoutedWeight0_F8_F8_B16,ck,364.9948,949.8373,107.0438003003077,8.873351817996598
642,1024,7168,256,256,8,ActivationType.Silu,QuantType.per_1x128,torch.bfloat16,torch.float8_e4m3fnuz,torch.float8_e4m3fnuz,1,0,1-stage,32,_ZN5aiter47fmoe_bf16_blockscaleFp8_g1u1_vs_silu_1tg_32x256E,asm,559.3657,0.0,,,0.0,559.3657,107.0438003003077,5.225577739492794
643,1024,7168,256,256,8,ActivationType.Gelu,QuantType.per_1x128,torch.bfloat16,torch.float8_e4m3fnuz,torch.float8_e4m3fnuz,1,0,1-stage,32,_ZN5aiter47fmoe_bf16_blockscaleFp8_g1u1_vs_gelu_1tg_32x256E,asm,562.5592,0.0,,,0.0,562.5592,107.0438003003077,5.25541132155024
644,1024,7168,256,256,8,ActivationType.Silu,QuantType.per_1x128,torch.bfloat16,torch.float8_e4m3fnuz,torch.float8_e4m3fnuz,1,1,2-stage,16,moe_ck2stages_gemm1_256x16x128x256_1x4_MulABScaleExpertWeightA8W8blkscale_v1_Nswizzle0_Quant4_MulRoutedWeight1_silu_F8_F8_B16,ck,522.3182,60.455000000000005,moe_ck2stages_gemm2_256x16x128x256_1x4_MulABScaleExpertWeightA8W8blkscale_v1_Nswizzle0_Quant4_MulRoutedWeight0_F8_F8_B16,ck,364.8622,947.6354,107.0438003003077,8.852781733658947
645,1024,7168,256,256,8,ActivationType.Gelu,QuantType.per_1x128,torch.bfloat16,torch.float8_e4m3fnuz,torch.float8_e4m3fnuz,1,1,2-stage,16,moe_ck2stages_gemm1_256x16x128x256_1x4_MulABScaleExpertWeightA8W8blkscale_v1_Nswizzle0_Quant4_MulRoutedWeight1_gelu_F8_F8_B16,ck,525.5472,59.95711111111114,moe_ck2stages_gemm2_256x16x128x256_1x4_MulABScaleExpertWeightA8W8blkscale_v1_Nswizzle0_Quant4_MulRoutedWeight0_F8_F8_B16,ck,364.4139,949.9182111111112,107.0438003003077,8.874107687191115
646,1024,7168,256,257,9,ActivationType.Silu,QuantType.per_Token,torch.bfloat16,torch.float8_e4m3fnuz,torch.float8_e4m3fnuz,1,0,1-stage,32,_ZN5aiter45fmoe_bf16_pertokenFp8_g1u1_vs_silu_1tg_32x256E,asm,600.4508,0.0,,,0.0,600.4508,120.42427533784615,4.986127575320308
647,1024,7168,256,256,8,ActivationType.Silu,QuantType.per_1x128,torch.bfloat16,torch.float8_e4m3fnuz,torch.float8_e4m3fnuz,1,0,1-stage,32,_ZN5aiter47fmoe_bf16_blockscaleFp8_g1u1_vs_silu_1tg_32x256E,asm,557.6724,0.0,,,0.0,557.6724,107.0438003003077,5.209758981234498
648,1024,7168,256,257,9,ActivationType.Silu,QuantType.per_1x128,torch.bfloat16,torch.float8_e4m3fnuz,torch.float8_e4m3fnuz,1,0,1-stage,32,_ZN5aiter47fmoe_bf16_blockscaleFp8_g1u1_vs_silu_1tg_32x256E,asm,601.3562,0.0,,,0.0,601.3562,120.42427533784615,4.993645992993654
649,1024,7168,512,256,8,ActivationType.Gelu,QuantType.No,torch.bfloat16,torch.bfloat16,torch.bfloat16,1,0,2-stage,64,moe_ck2stages_gemm1_256x64x128x128_1x4_TypeCast_v3_Nswizzle0_Quant0_MulRoutedWeight0_gelu_B16_B16_B16,ck,1067.8952,0.0,moe_ck2stages_gemm2_256x64x64x128_1x4_TypeCastExpertWeight_v1_Nswizzle0_Quant0_MulRoutedWeight1_B16_B16_B16,ck,599.8132,1667.7084,214.0876006006154,7.789841145966892
650,1024,7168,512,256,8,ActivationType.Gelu,QuantType.No,torch.bfloat16,torch.bfloat16,torch.bfloat16,1,1,2-stage,64,moe_ck2stages_gemm1_256x64x128x128_1x4_TypeCastExpertWeight_v3_Nswizzle0_Quant0_MulRoutedWeight1_gelu_B16_B16_B16,ck,1057.8914,0.0,moe_ck2stages_gemm2_256x64x64x128_1x4_TypeCast_v1_Nswizzle0_Quant0_MulRoutedWeight0_B16_B16_B16,ck,600.6833,1658.5747,214.0876006006154,7.747177769039055
651,1024,7168,512,256,8,ActivationType.Gelu,QuantType.per_Tensor,torch.bfloat16,torch.float8_e4m3fnuz,torch.float8_e4m3fnuz,1,0,2-stage,64,_ZN5aiter44fmoe_stage1_bf16_pertokenFp8_g1u1_64x256_pf2E,asm,540.8704,65.9578888888889,moe_ck2stages_gemm2_256x64x64x256_1x4_MulABScaleExpertWeight_v1_Nswizzle0_Quant1_MulRoutedWeight1_F8_F8_B16,ck,352.0663,958.8945888888888,214.0876006006154,4.478982370761983
652,1024,7168,512,256,8,ActivationType.Gelu,QuantType.per_Tensor,torch.bfloat16,torch.float8_e4m3fnuz,torch.float8_e4m3fnuz,1,1,2-stage,64,_ZN5aiter53fmoe_stage1_bf16_pertokenFp8_doweight_g1u1_64x256_pf2E,asm,539.7867,67.10588888888896,moe_ck2stages_gemm2_256x64x64x256_1x4_MulABScaleExpertWeight_v1_Nswizzle0_Quant1_MulRoutedWeight0_F8_F8_B16,ck,347.7043,954.5968888888888,214.0876006006154,4.4589078779471585
653,1024,7168,512,256,8,ActivationType.Gelu,QuantType.per_Token,torch.bfloat16,torch.float8_e4m3fnuz,torch.float8_e4m3fnuz,1,0,2-stage,64,_ZN5aiter44fmoe_stage1_bf16_pertokenFp8_g1u1_64x256_pf3E,asm,528.448,61.11788888888887,moe_ck2stages_gemm2_256x64x64x256_1x4_MulABScaleExpertWeight_v1_Nswizzle0_Quant2_MulRoutedWeight1_F8_F8_B16,ck,387.4909,977.0567888888888,214.0876006006154,4.563817736981449
654,1024,7168,512,256,8,ActivationType.Gelu,QuantType.per_Token,torch.bfloat16,torch.float8_e4m3fnuz,torch.float8_e4m3fnuz,1,1,2-stage,64,_ZN5aiter53fmoe_stage1_bf16_pertokenFp8_doweight_g1u1_64x256_pf2E,asm,526.6466,63.67333333333337,moe_ck2stages_gemm2_256x64x64x256_1x4_MulABScaleExpertWeight_v1_Nswizzle0_Quant2_MulRoutedWeight0_F8_F8_B16,ck,380.1912,970.5111333333334,214.0876006006154,4.533243077182415
655,1024,7168,512,256,8,ActivationType.Silu,QuantType.No,torch.bfloat16,torch.bfloat16,torch.bfloat16,1,1,2-stage,64,moe_ck2stages_gemm1_256x64x128x128_1x4_TypeCastExpertWeight_v3_Nswizzle0_Quant0_MulRoutedWeight1_silu_B16_B16_B16,ck,1062.8255,0.0,moe_ck2stages_gemm2_256x64x64x128_1x4_TypeCast_v1_Nswizzle0_Quant0_MulRoutedWeight0_B16_B16_B16,ck,596.6288,1659.4543,214.0876006006154,7.75128636756383
656,1024,7168,512,256,8,ActivationType.Silu,QuantType.per_Tensor,torch.bfloat16,torch.float8_e4m3fnuz,torch.float8_e4m3fnuz,1,0,2-stage,64,_ZN5aiter44fmoe_stage1_bf16_pertokenFp8_g1u1_64x256_pf3E,asm,538.5785,68.21455555555556,moe_ck2stages_gemm2_256x64x64x256_1x4_MulABScaleExpertWeight_v1_Nswizzle0_Quant1_MulRoutedWeight1_F8_F8_B16,ck,352.658,959.4510555555556,214.0876006006154,4.481581618290124
657,1024,7168,512,256,8,ActivationType.Silu,QuantType.per_Tensor,torch.bfloat16,torch.float8_e4m3fnuz,torch.float8_e4m3fnuz,1,1,2-stage,64,_ZN5aiter53fmoe_stage1_bf16_pertokenFp8_doweight_g1u1_64x256_pf2E,asm,538.0778,68.99366666666668,moe_ck2stages_gemm2_256x64x64x256_1x4_MulABScaleExpertWeight_v1_Nswizzle0_Quant1_MulRoutedWeight0_F8_F8_B16,ck,347.0777,954.1491666666668,214.0876006006154,4.456816574102537
658,1024,7168,512,256,8,ActivationType.Silu,QuantType.per_Token,torch.bfloat16,torch.float8_e4m3fnuz,torch.float8_e4m3fnuz,1,0,2-stage,64,_ZN5aiter44fmoe_stage1_bf16_pertokenFp8_g1u1_64x256_pf2E,asm,526.0323,63.00544444444432,moe_ck2stages_gemm2_256x64x64x256_1x4_MulABScaleExpertWeight_v1_Nswizzle0_Quant2_MulRoutedWeight1_F8_F8_B16,ck,386.7647,975.8024444444444,214.0876006006154,4.55795871272724
659,1024,7168,512,256,8,ActivationType.Silu,QuantType.per_Token,torch.bfloat16,torch.float8_e4m3fnuz,torch.float8_e4m3fnuz,1,1,2-stage,64,_ZN5aiter53fmoe_stage1_bf16_pertokenFp8_doweight_g1u1_64x256_pf3E,asm,527.5732,59.80077777777792,moe_ck2stages_gemm2_256x64x64x256_1x4_MulABScaleExpertWeight_v1_Nswizzle0_Quant2_MulRoutedWeight0_F8_F8_B16,ck,379.1275,966.501477777778,214.0876006006154,4.514514035685819
660,1024,7168,512,256,8,ActivationType.Silu,QuantType.No,torch.bfloat16,torch.bfloat16,torch.bfloat16,1,0,2-stage,64,moe_ck2stages_gemm1_256x64x128x128_1x4_TypeCast_v3_Nswizzle0_Quant0_MulRoutedWeight0_silu_B16_B16_B16,ck,1060.7793,0.0,moe_ck2stages_gemm2_256x64x64x128_1x4_TypeCastExpertWeight_v1_Nswizzle0_Quant0_MulRoutedWeight1_B16_B16_B16,ck,613.1449,1673.9242,214.0876006006154,7.818875055369219
661,1024,7168,512,256,8,ActivationType.Silu,QuantType.per_Tensor,torch.bfloat16,torch.float8_e4m3fnuz,torch.float8_e4m3fnuz,1,0,2-stage,64,_ZN5aiter44fmoe_stage1_bf16_pertokenFp8_g1u1_64x256_pf2E,asm,538.7296,64.12388888888897,moe_ck2stages_gemm2_256x64x64x256_1x4_MulABScaleExpertWeight_v1_Nswizzle0_Quant1_MulRoutedWeight1_F8_F8_B16,ck,346.9247,949.778188888889,214.0876006006154,4.436399801876984
662,1024,7168,512,256,8,ActivationType.Silu,QuantType.per_Tensor,torch.bfloat16,torch.float8_e4m3fnuz,torch.float8_e4m3fnuz,1,1,2-stage,64,_ZN5aiter53fmoe_stage1_bf16_pertokenFp8_doweight_g1u1_64x256_pf2E,asm,537.0568,66.02933333333333,moe_ck2stages_gemm2_256x64x64x256_1x4_MulABScaleExpertWeight_v1_Nswizzle0_Quant1_MulRoutedWeight0_F8_F8_B16,ck,343.4796,946.5657333333332,214.0876006006154,4.421394469730035
663,1024,7168,512,256,8,ActivationType.Silu,QuantType.per_Token,torch.bfloat16,torch.float8_e4m3fnuz,torch.float8_e4m3fnuz,1,0,2-stage,64,_ZN5aiter44fmoe_stage1_bf16_pertokenFp8_g1u1_64x256_pf2E,asm,524.8539,63.55766666666671,moe_ck2stages_gemm2_256x64x64x256_1x4_MulABScaleExpertWeight_v1_Nswizzle0_Quant2_MulRoutedWeight1_F8_F8_B16,ck,388.2994,976.7109666666666,214.0876006006154,4.562202406522085
664,1024,7168,512,256,8,ActivationType.Silu,QuantType.per_Token,torch.bfloat16,torch.float8_e4m3fnuz,torch.float8_e4m3fnuz,1,1,2-stage,64,_ZN5aiter53fmoe_stage1_bf16_pertokenFp8_doweight_g1u1_64x256_pf3E,asm,545.9063,62.20422222222224,moe_ck2stages_gemm2_256x64x64x256_1x4_MulABScaleExpertWeight_v1_Nswizzle0_Quant2_MulRoutedWeight0_F8_F8_B16,ck,375.3424,983.4529222222222,214.0876006006154,4.593693980703128
665,1024,7168,512,256,8,ActivationType.Gelu,QuantType.per_Tensor,torch.bfloat16,torch.float8_e4m3fnuz,torch.float8_e4m3fnuz,1,0,2-stage,64,_ZN5aiter48fmoe_stage1_bf16_pertokenFp8_g1u1_64x128_2tg_pf2E,asm,539.1033,68.79766666666667,moe_ck2stages_gemm2_256x64x64x256_1x4_MulABScaleExpertWeight_v1_Nswizzle0_Quant1_MulRoutedWeight1_F8_F8_B16,ck,352.7257,960.6266666666668,214.0876006006154,4.4870728803147015
666,1024,7168,512,256,8,ActivationType.Gelu,QuantType.per_Tensor,torch.bfloat16,torch.float8_e4m3fnuz,torch.float8_e4m3fnuz,1,1,2-stage,64,_ZN5aiter53fmoe_stage1_bf16_pertokenFp8_doweight_g1u1_64x256_pf2E,asm,538.3878,69.72333333333336,moe_ck2stages_gemm2_256x64x64x256_1x4_MulABScaleExpertWeight_v1_Nswizzle0_Quant1_MulRoutedWeight0_F8_F8_B16,ck,344.3204,952.4315333333334,214.0876006006154,4.448793534335102
667,1024,7168,512,256,8,ActivationType.Gelu,QuantType.per_Token,torch.bfloat16,torch.float8_e4m3fnuz,torch.float8_e4m3fnuz,1,0,2-stage,64,_ZN5aiter44fmoe_stage1_bf16_pertokenFp8_g1u1_64x256_pf2E,asm,526.4424,63.0015555555556,moe_ck2stages_gemm2_256x64x64x256_1x4_MulABScaleExpertWeight_v1_Nswizzle0_Quant2_MulRoutedWeight1_F8_F8_B16,ck,383.5976,973.0415555555556,214.0876006006154,4.5450626417677675
668,1024,7168,512,256,8,ActivationType.Gelu,QuantType.per_Token,torch.bfloat16,torch.float8_e4m3fnuz,torch.float8_e4m3fnuz,1,1,2-stage,64,_ZN5aiter53fmoe_stage1_bf16_pertokenFp8_doweight_g1u1_64x256_pf2E,asm,532.661,62.302333333333486,moe_ck2stages_gemm2_256x64x64x256_1x4_MulABScaleExpertWeight_v1_Nswizzle0_Quant2_MulRoutedWeight0_F8_F8_B16,ck,373.513,968.4763333333336,214.0876006006154,4.523738556629653
669,1024,7168,512,256,8,ActivationType.Gelu,QuantType.per_1x128,torch.bfloat16,torch.float8_e4m3fnuz,torch.float8_e4m3fnuz,1,0,1-stage,32,_ZN5aiter47fmoe_bf16_blockscaleFp8_g1u1_vs_gelu_1tg_32x256E,asm,1047.0227,0.0,,,0.0,1047.0227,214.0876006006154,4.890627467740373
670,1024,7168,512,256,8,ActivationType.Silu,QuantType.per_1x128,torch.bfloat16,torch.float8_e4m3fnuz,torch.float8_e4m3fnuz,1,0,1-stage,32,_ZN5aiter47fmoe_bf16_blockscaleFp8_g1u1_vs_silu_1tg_32x256E,asm,1051.0736,0.0,,,0.0,1051.0736,214.0876006006154,4.909549161423871
671,1024,7168,512,256,8,ActivationType.Gelu,QuantType.per_1x128,torch.bfloat16,torch.float8_e4m3fnuz,torch.float8_e4m3fnuz,1,1,2-stage,16,moe_ck2stages_gemm1_256x16x128x256_1x4_MulABScaleExpertWeightA8W8blkscale_v1_Nswizzle0_Quant4_MulRoutedWeight1_gelu_F8_F8_B16,ck,920.778,78.36211111111113,moe_ck2stages_gemm2_256x16x128x256_1x4_MulABScaleExpertWeightA8W8blkscale_v1_Nswizzle0_Quant4_MulRoutedWeight0_F8_F8_B16,ck,452.5669,1451.7070111111111,214.0876006006154,6.780901869320769
672,1024,7168,512,256,8,ActivationType.Silu,QuantType.per_1x128,torch.bfloat16,torch.float8_e4m3fnuz,torch.float8_e4m3fnuz,1,1,2-stage,16,moe_ck2stages_gemm1_256x16x128x256_1x4_MulABScaleExpertWeightA8W8blkscale_v1_Nswizzle0_Quant4_MulRoutedWeight1_silu_F8_F8_B16,ck,921.4925,78.36233333333341,moe_ck2stages_gemm2_256x16x128x256_1x4_MulABScaleExpertWeightA8W8blkscale_v1_Nswizzle0_Quant4_MulRoutedWeight0_F8_F8_B16,ck,452.7598,1452.6146333333334,214.0876006006154,6.7851413592289935
673,1024,7168,512,256,8,ActivationType.Silu,QuantType.per_1x128,torch.bfloat16,torch.float8_e4m3fnuz,torch.float8_e4m3fnuz,1,0,1-stage,32,_ZN5aiter47fmoe_bf16_blockscaleFp8_g1u1_vs_silu_1tg_32x256E,asm,1048.8196,0.0,,,0.0,1048.8196,214.0876006006154,4.899020760929511
674,1024,7168,512,256,8,ActivationType.Gelu,QuantType.per_1x128,torch.bfloat16,torch.float8_e4m3fnuz,torch.float8_e4m3fnuz,1,0,1-stage,32,_ZN5aiter47fmoe_bf16_blockscaleFp8_g1u1_vs_gelu_1tg_32x256E,asm,1050.8184,0.0,,,0.0,1050.8184,214.0876006006154,4.908357126017412
675,1024,7168,512,256,8,ActivationType.Silu,QuantType.per_1x128,torch.bfloat16,torch.float8_e4m3fnuz,torch.float8_e4m3fnuz,1,1,2-stage,16,moe_ck2stages_gemm1_256x16x128x256_1x4_MulABScaleExpertWeightA8W8blkscale_v1_Nswizzle0_Quant4_MulRoutedWeight1_silu_F8_F8_B16,ck,921.7124,78.8871111111112,moe_ck2stages_gemm2_256x16x128x256_1x4_MulABScaleExpertWeightA8W8blkscale_v1_Nswizzle0_Quant4_MulRoutedWeight0_F8_F8_B16,ck,452.1095,1452.709011111111,214.0876006006154,6.785582196426071
676,1024,7168,512,256,8,ActivationType.Gelu,QuantType.per_1x128,torch.bfloat16,torch.float8_e4m3fnuz,torch.float8_e4m3fnuz,1,1,2-stage,16,moe_ck2stages_gemm1_256x16x128x256_1x4_MulABScaleExpertWeightA8W8blkscale_v1_Nswizzle0_Quant4_MulRoutedWeight1_gelu_F8_F8_B16,ck,927.0695,78.47777777777765,moe_ck2stages_gemm2_256x16x128x256_1x4_MulABScaleExpertWeightA8W8blkscale_v1_Nswizzle0_Quant4_MulRoutedWeight0_F8_F8_B16,ck,452.679,1458.2262777777776,214.0876006006154,6.811353267012073
677,1024,7168,2048,33,10,ActivationType.Silu,QuantType.per_1x128,torch.bfloat16,torch.float8_e4m3fnuz,torch.float8_e4m3fnuz,1,0,1-stage,32,_ZN5aiter47fmoe_bf16_blockscaleFp8_g1u1_vs_silu_1tg_32x256E,asm,1798.8401,0.0,,,0.0,1798.8401,1070.4380030030768,1.6804710734796562
678,1024,7168,2048,33,10,ActivationType.Silu,QuantType.per_Token,torch.bfloat16,torch.float8_e4m3fnuz,torch.float8_e4m3fnuz,1,0,2-stage,64,_ZN5aiter44fmoe_stage1_bf16_pertokenFp8_g1u1_64x256_pf3E,asm,683.8323,178.08822222222236,moe_ck2stages_gemm2_256x64x128x256_1x4_MulABScaleExpertWeight_v3_Nswizzle0_Quant2_MulRoutedWeight1_F8_F8_B16,ck,505.2223,1367.1428222222223,1070.4380030030768,1.2771807600129577
