scripts/results/kernels_with_counters_filtered.csv
config_idx,token,model_dim,inter_dim,expert,topk,act_type,dtype,q_dtype_a,q_dtype_w,q_type,use_g1u1,doweight_stage1,kernel_type,stage,block_m,kernel_name,time_us,quant_time_us,error,tflops,bandwidth_gb,FETCH_SIZE,WRITE_SIZE,MfmaUtil,SQ_BUSY_CU_CYCLES,SQ_INSTS_VALU_MFMA_MOPS_BF16,SQ_INSTS_VALU_MFMA_MOPS_I8,SQ_INSTS_VALU_MFMA_MOPS_F8,SQ_VALU_MFMA_BUSY_CYCLES,TCC_HIT,TCC_MISS,TCC_TAG_STALL_sum,TCP_PENDING_STALL_CYCLES_sum,GRBM_GUI_ACTIVE,LDSBankConflict,OccupancyPercent,MemUnitStalled,SQ_INSTS_LDS,SQ_INSTS_MFMA,SQ_INSTS_VALU,SQ_LDS_BANK_CONFLICT,SQ_LDS_IDX_ACTIVE,SQ_WAIT_ANY,SQ_WAVES_sum,SQ_WAVE_CYCLES,MFMA_FLOPS
0,1,7168,256,256,8,ActivationType.Silu,torch.bfloat16,torch.float8_e4m3fnuz,torch.float8_e4m3fnuz,QuantType.per_1x128,1,0,ck,stage1,16,moe_ck2stages_gemm1_256x16x128x256_1x4_MulABScaleExpertWeightA8W8blkscale_v1_Nswizzle0_Quant4_MulRoutedWeight0_silu_F8_F8_B16,50.0494,39.51311111111109,0.00%,1.76,28158.33,28805.0,4.0,0.858440544,1074300.0,0.0,0.0,1835008.0,917504.0,2937.0,230504.0,25982.0,372683.0,687516.0,0.647758624,0.505511176,0.00491363318,16128.0,57344.0,122368.0,174080.0,247808.0,545907.0,64.0,1086817.0,939524096.0
0,1,7168,256,256,8,ActivationType.Silu,torch.bfloat16,torch.float8_e4m3fnuz,torch.float8_e4m3fnuz,QuantType.per_1x128,1,0,ck,stage2,16,moe_ck2stages_gemm2_256x16x128x256_1x4_MulABScaleExpertWeightA8W8blkscale_v1_Nswizzle0_Quant4_MulRoutedWeight1_F8_F8_B16,12.9077,39.51311111111109,15.40%,6.82,109183.48,14424.25,112.0,1.064422,4046554.0,0.0,0.0,917504.0,458752.0,12062.0,117219.0,617487.0,1929671.0,253014.0,3.137679,7.476993,0.0129479812,16576.0,28672.0,215488.0,315392.0,439040.0,4432976.0,1792.0,6012555.0,469762048.0
1,1,7168,256,257,9,ActivationType.Silu,torch.bfloat16,torch.float8_e4m3fnuz,torch.float8_e4m3fnuz,QuantType.per_1x128,1,0,ck,stage1,16,moe_ck2stages_gemm1_256x16x128x256_1x4_MulABScaleExpertWeightA8W8blkscale_v1_Nswizzle0_Quant4_MulRoutedWeight0_silu_F8_F8_B16,49.2078,38.844666666666726,0.04%,2.01,28751.8,32391.25,4.5,0.953465921,1224937.0,0.0,0.0,2064384.0,1032192.0,3419.0,259198.0,25962.0,435165.0,682520.0,0.740829511,0.575500434,0.00521084892,18144.0,64512.0,137664.0,195840.0,278784.0,604214.0,72.0,1217079.0,1056964608.0
1,1,7168,256,257,9,ActivationType.Silu,torch.bfloat16,torch.float8_e4m3fnuz,torch.float8_e4m3fnuz,QuantType.per_1x128,1,0,ck,stage2,16,moe_ck2stages_gemm2_256x16x128x256_1x4_MulABScaleExpertWeightA8W8blkscale_v1_Nswizzle0_Quant4_MulRoutedWeight1_F8_F8_B16,12.4864,38.844666666666726,17.34%,7.94,113308.29,16224.0,126.0,1.223221,4303931.0,0.0,0.0,1032192.0,516096.0,12449.0,131840.0,730822.0,2165724.0,275659.0,3.213452,8.261216,0.0117872581,18648.0,32256.0,242424.0,354816.0,493920.0,5279938.0,2016.0,7297353.0,528482304.0
2,2,7168,256,256,8,ActivationType.Silu,torch.bfloat16,torch.float8_e4m3fnuz,torch.float8_e4m3fnuz,QuantType.per_1x128,1,0,ck,stage1,16,moe_ck2stages_gemm1_256x16x128x256_1x4_MulABScaleExpertWeightA8W8blkscale_v1_Nswizzle0_Quant4_MulRoutedWeight0_silu_F8_F8_B16,49.6578,38.42233333333333,0.00%,3.55,28380.82,57551.0,8.0,1.56858,2321851.0,0.0,0.0,3670016.0,1835008.0,6346.0,460504.0,26040.0,935287.0,750716.0,1.206849,1.001623,0.00480784429,32256.0,114688.0,244736.0,348160.0,495616.0,1184480.0,128.0,2311641.0,1879048192.0
2,2,7168,256,256,8,ActivationType.Silu,torch.bfloat16,torch.float8_e4m3fnuz,torch.float8_e4m3fnuz,QuantType.per_1x128,1,0,ck,stage2,16,moe_ck2stages_gemm2_256x16x128x256_1x4_MulABScaleExpertWeightA8W8blkscale_v1_Nswizzle0_Quant4_MulRoutedWeight1_F8_F8_B16,15.3936,38.42233333333333,14.96%,11.44,91552.93,28818.75,224.0,1.828224,6422409.0,0.0,0.0,1835008.0,917504.0,15082.0,234157.0,1422441.0,3888179.0,310624.0,5.08055,18.154912,0.0117069856,33152.0,57344.0,430976.0,630784.0,878080.0,10914046.0,3584.0,18032423.0,939524096.0
3,2,7168,256,257,9,ActivationType.Silu,torch.bfloat16,torch.float8_e4m3fnuz,torch.float8_e4m3fnuz,QuantType.per_1x128,1,0,ck,stage1,16,moe_ck2stages_gemm1_256x16x128x256_1x4_MulABScaleExpertWeightA8W8blkscale_v1_Nswizzle0_Quant4_MulRoutedWeight0_silu_F8_F8_B16,50.0516,38.48466666666664,0.02%,3.96,28267.51,61139.125,9.0,1.577622,2518017.0,0.0,0.0,3899392.0,1949696.0,6958.0,489233.0,25448.0,1021899.0,797797.0,1.198293,1.00585,0.00449294915,34272.0,121856.0,260032.0,369920.0,526592.0,1279493.0,144.0,2484096.0,1996488704.0
3,2,7168,256,257,9,ActivationType.Silu,torch.bfloat16,torch.float8_e4m3fnuz,torch.float8_e4m3fnuz,QuantType.per_1x128,1,0,ck,stage2,16,moe_ck2stages_gemm2_256x16x128x256_1x4_MulABScaleExpertWeightA8W8blkscale_v1_Nswizzle0_Quant4_MulRoutedWeight1_F8_F8_B16,16.7668,38.48466666666664,17.41%,11.82,84383.08,30622.25,252.0,1.936014,6568649.0,0.0,0.0,1949696.0,974848.0,15563.0,249045.0,1417684.0,4036112.0,329386.0,5.103432,18.172466,0.0541100488,35224.0,60928.0,458920.0,670208.0,932960.0,11149937.0,4032.0,19091987.0,998244352.0
4,4,2304,1536,8,2,ActivationType.Gelu,torch.bfloat16,torch.float8_e4m3fnuz,torch.float8_e4m3fnuz,QuantType.per_Token,1,0,asm,asm_1stage,32,_ZN5aiter45fmoe_bf16_pertokenFp8_g1u1_vs_gelu_1tg_32x128E,48.7403,0.0,0.00%,3.49,1743.16,62970.5,432.0,4.416469,3875076.0,0.0,0.0,7962624.0,3981312.0,37532.0,510704.0,25817.0,1438449.0,562087.0,0.0,2.185925,0.0100429649,93600.0,248832.0,916992.0,0.0,381312.0,1666207.0,432.0,3854276.0,4076863488.0
5,4,2304,1536,8,2,ActivationType.Gelu,torch.bfloat16,torch.float8_e4m3fnuz,torch.float8_e4m3fnuz,QuantType.per_Token,1,1,asm,asm_1stage,32,_ZN5aiter50fmoe_bf16_pertokenFp8_g1u1_vs_tkw1_gelu_1tg_32x128E,52.5164,0.0,0.00%,3.23,1617.82,62968.0,432.0,4.537411,4114193.0,0.0,0.0,7962624.0,3981312.0,37597.0,510688.0,24629.0,1535723.0,590201.0,0.0,2.240016,0.00826143284,93600.0,248832.0,839520.0,0.0,381312.0,1586618.0,432.0,4141956.0,4076863488.0
6,4,7168,256,256,8,ActivationType.Silu,torch.bfloat16,torch.float8_e4m3fnuz,torch.float8_e4m3fnuz,QuantType.per_1x128,1,0,ck,stage1,16,moe_ck2stages_gemm1_256x16x128x256_1x4_MulABScaleExpertWeightA8W8blkscale_v1_Nswizzle0_Quant4_MulRoutedWeight0_silu_F8_F8_B16,51.5942,37.478555555555445,0.00%,6.83,27316.48,115051.375,16.0,2.236014,5606037.0,0.0,0.0,7340032.0,3670016.0,11587.0,920642.0,25293.0,2815724.0,1058006.0,1.692511,1.707856,0.00334822253,64512.0,229376.0,489472.0,696320.0,991232.0,3070320.0,256.0,5621064.0,3758096384.0
6,4,7168,256,256,8,ActivationType.Silu,torch.bfloat16,torch.float8_e4m3fnuz,torch.float8_e4m3fnuz,QuantType.per_1x128,1,0,ck,stage2,16,moe_ck2stages_gemm2_256x16x128x256_1x4_MulABScaleExpertWeightA8W8blkscale_v1_Nswizzle0_Quant4_MulRoutedWeight1_F8_F8_B16,23.0552,37.478555555555445,15.30%,15.28,61130.34,57609.125,448.0,2.609554,11306992.0,0.0,0.0,3670016.0,1835008.0,20911.0,468072.0,2796002.0,8059662.0,454988.0,7.061367,37.285111,0.216047151,66304.0,114688.0,861952.0,1261568.0,1756160.0,24595419.0,7168.0,53290196.0,1879048192.0
7,4,7168,256,257,9,ActivationType.Silu,torch.bfloat16,torch.float8_e4m3fnuz,torch.float8_e4m3fnuz,QuantType.per_1x128,1,0,ck,stage1,16,moe_ck2stages_gemm1_256x16x128x256_1x4_MulABScaleExpertWeightA8W8blkscale_v1_Nswizzle0_Quant4_MulRoutedWeight0_silu_F8_F8_B16,52.1115,37.58499999999996,0.01%,7.61,27150.96,122207.75,18.0,2.46038,6102843.0,0.0,0.0,7798784.0,3899392.0,12401.0,977820.0,25907.0,3126477.0,1021506.0,1.863165,1.864325,0.00368432335,68544.0,243712.0,520064.0,739840.0,1053184.0,3196492.0,288.0,5922405.0,3992977408.0
7,4,7168,256,257,9,ActivationType.Silu,torch.bfloat16,torch.float8_e4m3fnuz,torch.float8_e4m3fnuz,QuantType.per_1x128,1,0,ck,stage2,16,moe_ck2stages_gemm2_256x16x128x256_1x4_MulABScaleExpertWeightA8W8blkscale_v1_Nswizzle0_Quant4_MulRoutedWeight1_F8_F8_B16,24.6847,37.58499999999996,17.17%,16.06,57317.98,61216.875,504.0,2.671257,11489304.0,0.0,0.0,3899392.0,1949696.0,22256.0,497819.0,2704841.0,8202798.0,459530.0,7.515234,41.105496,0.276435547,70448.0,121856.0,917840.0,1340416.0,1865920.0,26625134.0,8064.0,58652558.0,1996488704.0
8,8,7168,256,256,8,ActivationType.Silu,torch.bfloat16,torch.float8_e4m3fnuz,torch.float8_e4m3fnuz,QuantType.per_1x128,1,0,asm,asm_1stage,32,_ZN5aiter47fmoe_bf16_blockscaleFp8_g1u1_vs_silu_1tg_32x128E,127.1133,0.0,0.00%,5.54,11088.2,318096.5625,1792.0,6.041967,25349568.0,0.0,0.0,40599552.0,20299776.0,74151.0,2573369.0,76007.0,16888912.0,2142444.0,0.0,3.813064,0.0342508148,495128.0,1268736.0,4149696.0,0.0,1882336.0,14640079.0,2064.0,25095043.0,20786970624.0
9,8,7168,256,257,9,ActivationType.Silu,torch.bfloat16,torch.float8_e4m3fnuz,torch.float8_e4m3fnuz,QuantType.per_1x128,1,0,asm,asm_1stage,32,_ZN5aiter47fmoe_bf16_blockscaleFp8_g1u1_vs_silu_1tg_32x128E,129.3283,0.0,0.00%,6.13,10940.86,355748.9375,2016.0,6.464033,29550592.0,0.0,0.0,45416448.0,22708224.0,81543.0,2878437.0,197431.0,20423100.0,2321494.0,0.0,4.139277,0.0571840852,553872.0,1419264.0,4639664.0,0.0,2105664.0,17717609.0,2072.0,29387784.0,23253221376.0
10,16,2048,192,128,8,ActivationType.Silu,torch.bfloat16,torch.bfloat16,torch.bfloat16,QuantType.No,1,0,ck,stage1,32,moe_ck2stages_gemm1_256x32x64x64_1x4_TypeCast_v1_Nswizzle0_Quant0_MulRoutedWeight0_silu_B16_B16_B16,38.0866,0.0,0.00%,7.93,7932.47,128107.5,48.0,6.492148,20217947.0,8159232.0,0.0,0.0,8159232.0,22238.0,1025274.0,853222.0,16107669.0,905340.0,0.0907715996,7.559228,0.00351728556,165336.0,509952.0,910344.0,31872.0,1338624.0,18658218.0,1536.0,21233753.0,4177526784.0
10,16,2048,192,128,8,ActivationType.Silu,torch.bfloat16,torch.bfloat16,torch.bfloat16,QuantType.No,1,0,ck,stage2,32,moe_ck2stages_gemm2_256x32x64x64_1x4_TypeCastExpertWeight_v1_Nswizzle0_Quant0_MulRoutedWeight1_B16_B16_B16,25.4401,0.0,0.00%,11.87,11875.78,64449.0,512.0,5.992904,9736350.0,4079616.0,0.0,0.0,4079616.0,33670.0,523826.0,888163.0,6492417.0,421297.0,1.021312,47.807973,0.0539393414,225760.0,254976.0,1345312.0,169984.0,1752960.0,43661247.0,16384.0,63656110.0,2088763392.0
11,16,2048,192,128,8,ActivationType.Silu,torch.bfloat16,torch.bfloat16,torch.bfloat16,QuantType.No,1,1,ck,stage1,32,moe_ck2stages_gemm1_256x32x64x128_1x4_TypeCastExpertWeight_v1_Nswizzle0_Quant0_MulRoutedWeight1_silu_B16_B16_B16,38.3789,0.0,0.00%,7.87,7872.06,128155.875,48.0,6.293575,20740684.0,8159232.0,0.0,0.0,8159232.0,27208.0,1025675.0,5048664.0,16546216.0,842817.0,0.0976756433,8.204915,0.00378480859,165336.0,509952.0,968112.0,31872.0,1338624.0,18587295.0,1536.0,21418404.0,4177526784.0
11,16,2048,192,128,8,ActivationType.Silu,torch.bfloat16,torch.bfloat16,torch.bfloat16,QuantType.No,1,1,ck,stage2,32,moe_ck2stages_gemm2_256x32x64x64_1x4_TypeCast_v1_Nswizzle0_Quant0_MulRoutedWeight0_B16_B16_B16,24.1249,0.0,0.00%,12.52,12523.2,64348.1875,512.0,6.325077,9633873.0,4079616.0,0.0,0.0,4079616.0,31395.0,523032.0,897766.0,6691638.0,389745.0,1.105754,49.326351,0.0857137913,225760.0,254976.0,1228448.0,169984.0,1752960.0,39768113.0,16384.0,60662225.0,2088763392.0
12,16,2048,192,128,8,ActivationType.Gelu,torch.bfloat16,torch.bfloat16,torch.bfloat16,QuantType.No,1,0,ck,stage1,32,moe_ck2stages_gemm1_256x32x64x128_1x4_TypeCast_v1_Nswizzle0_Quant0_MulRoutedWeight0_gelu_B16_B16_B16,37.6747,0.0,0.00%,8.02,8019.2,128132.4375,48.0,4.760107,29855181.0,8159232.0,0.0,0.0,8159232.0,29782.0,1025490.0,7525269.0,25600436.0,826227.0,0.100389817,8.146811,0.00388997941,165336.0,509952.0,869409.0,31872.0,1338624.0,17994898.0,1536.0,20691753.0,4177526784.0
12,16,2048,192,128,8,ActivationType.Gelu,torch.bfloat16,torch.bfloat16,torch.bfloat16,QuantType.No,1,0,ck,stage2,32,moe_ck2stages_gemm2_256x32x64x64_1x4_TypeCastExpertWeight_v1_Nswizzle0_Quant0_MulRoutedWeight1_B16_B16_B16,24.7421,0.0,0.00%,12.21,12210.81,64451.25,512.0,6.314007,9028184.0,4079616.0,0.0,0.0,4079616.0,33790.0,523799.0,886457.0,5637393.0,417785.0,1.021592,50.444594,0.0691412102,225760.0,254976.0,1345312.0,169984.0,1752960.0,44705376.0,16384.0,67148357.0,2088763392.0
13,16,2048,192,128,8,ActivationType.Gelu,torch.bfloat16,torch.bfloat16,torch.bfloat16,QuantType.No,1,1,ck,stage1,32,moe_ck2stages_gemm1_256x32x64x128_1x4_TypeCastExpertWeight_v1_Nswizzle0_Quant0_MulRoutedWeight1_gelu_B16_B16_B16,38.2007,0.0,0.00%,7.91,7908.78,128164.875,48.0,6.195999,21228628.0,8159232.0,0.0,0.0,8159232.0,30023.0,1025739.0,4933931.0,17027595.0,840078.0,0.0980767697,8.210179,0.00380035174,165336.0,509952.0,895404.0,31872.0,1338624.0,18617343.0,1536.0,21344490.0,4177526784.0
13,16,2048,192,128,8,ActivationType.Gelu,torch.bfloat16,torch.bfloat16,torch.bfloat16,QuantType.No,1,1,ck,stage2,32,moe_ck2stages_gemm2_256x32x64x64_1x4_TypeCast_v1_Nswizzle0_Quant0_MulRoutedWeight0_B16_B16_B16,24.3004,0.0,0.00%,12.43,12432.76,64349.25,512.0,6.493656,9478680.0,4079616.0,0.0,0.0,4079616.0,31354.0,523019.0,834200.0,6551643.0,405562.0,1.057369,47.956454,0.103296018,225760.0,254976.0,1228448.0,169984.0,1752960.0,42499519.0,16384.0,61676327.0,2088763392.0
14,16,4096,192,128,8,ActivationType.Silu,torch.bfloat16,torch.bfloat16,torch.bfloat16,QuantType.No,1,0,ck,stage1,32,moe_ck2stages_gemm1_256x32x64x128_1x4_TypeCast_v1_Nswizzle0_Quant0_MulRoutedWeight0_silu_B16_B16_B16,69.2424,0.0,0.00%,8.72,8726.47,262265.5,48.0,6.602304,47405695.0,16711680.0,0.0,0.0,16711680.0,34911.0,2098542.0,12634586.0,40477586.0,1694812.0,0.0503115742,9.388153,0.00190363952,332520.0,1044480.0,1588140.0,32640.0,2676480.0,43778507.0,1536.0,48725063.0,8556380160.0
14,16,4096,192,128,8,ActivationType.Silu,torch.bfloat16,torch.bfloat16,torch.bfloat16,QuantType.No,1,0,ck,stage2,32,moe_ck2stages_gemm2_256x32x64x64_1x4_TypeCastExpertWeight_v1_Nswizzle0_Quant0_MulRoutedWeight1_B16_B16_B16,44.9196,0.0,0.07%,13.45,13451.63,131263.9375,1024.0,8.521515,17861958.0,8355840.0,0.0,0.0,8355840.0,59416.0,1066518.0,3593425.0,12126522.0,614278.0,1.457523,65.82418,0.179205483,462400.0,522240.0,2752064.0,348160.0,3590400.0,86004405.0,32768.0,125787923.0,4278190080.0
15,16,4096,192,128,8,ActivationType.Silu,torch.bfloat16,torch.bfloat16,torch.bfloat16,QuantType.No,1,1,ck,stage1,32,moe_ck2stages_gemm1_256x32x64x128_1x4_TypeCastExpertWeight_v1_Nswizzle0_Quant0_MulRoutedWeight1_silu_B16_B16_B16,69.3914,0.0,0.00%,8.7,8707.73,262298.125,48.0,6.590589,47850074.0,16711680.0,0.0,0.0,16711680.0,35434.0,2098817.0,10268053.0,40811791.0,1708370.0,0.0499808774,9.436969,0.00189112695,332520.0,1044480.0,1603440.0,32640.0,2676480.0,44342796.0,1536.0,49302481.0,8556380160.0
15,16,4096,192,128,8,ActivationType.Silu,torch.bfloat16,torch.bfloat16,torch.bfloat16,QuantType.No,1,1,ck,stage2,32,moe_ck2stages_gemm2_256x32x64x64_1x4_TypeCast_v1_Nswizzle0_Quant0_MulRoutedWeight0_B16_B16_B16,43.4616,0.0,0.00%,13.9,13902.89,131170.75,1024.0,8.544083,17746126.0,8355840.0,0.0,0.0,8355840.0,54050.0,1065748.0,3865424.0,12776894.0,623474.0,1.440728,64.794493,0.211263398,462400.0,522240.0,2512704.0,348160.0,3590400.0,86712249.0,32768.0,125263659.0,4278190080.0
16,16,4096,192,128,8,ActivationType.Gelu,torch.bfloat16,torch.bfloat16,torch.bfloat16,QuantType.No,1,0,ck,stage1,32,moe_ck2stages_gemm1_256x32x64x128_1x4_TypeCast_v1_Nswizzle0_Quant0_MulRoutedWeight0_gelu_B16_B16_B16,68.6082,0.0,0.00%,8.8,8807.14,262274.75,48.0,6.664577,47353686.0,16711680.0,0.0,0.0,16711680.0,38014.0,2098642.0,9389793.0,40517450.0,1674586.0,0.0503850007,9.386834,0.00190641776,332520.0,1044480.0,1513469.0,32640.0,2676480.0,43814025.0,1536.0,48647216.0,8556380160.0
16,16,4096,192,128,8,ActivationType.Gelu,torch.bfloat16,torch.bfloat16,torch.bfloat16,QuantType.No,1,0,ck,stage2,32,moe_ck2stages_gemm2_256x32x64x64_1x4_TypeCastExpertWeight_v1_Nswizzle0_Quant0_MulRoutedWeight1_B16_B16_B16,44.2613,0.0,0.12%,13.65,13651.7,131262.0625,1024.0,8.389592,17957825.0,8355840.0,0.0,0.0,8355840.0,59416.0,1066566.0,3593679.0,12316021.0,642894.0,1.374519,64.422874,0.122193085,462400.0,522240.0,2752064.0,348160.0,3590400.0,89314472.0,32768.0,130544368.0,4278190080.0
17,16,4096,192,128,8,ActivationType.Gelu,torch.bfloat16,torch.bfloat16,torch.bfloat16,QuantType.No,1,1,ck,stage1,32,moe_ck2stages_gemm1_256x32x64x128_1x4_TypeCastExpertWeight_v1_Nswizzle0_Quant0_MulRoutedWeight1_gelu_B16_B16_B16,68.9623,0.0,0.00%,8.76,8761.92,262307.125,48.0,6.436835,47955696.0,16711680.0,0.0,0.0,16711680.0,38258.0,2098878.0,10072765.0,41010370.0,1660698.0,0.0509945053,9.354414,0.0019294796,332520.0,1044480.0,1528980.0,32640.0,2676480.0,43048845.0,1536.0,47899759.0,8556380160.0
17,16,4096,192,128,8,ActivationType.Gelu,torch.bfloat16,torch.bfloat16,torch.bfloat16,QuantType.No,1,1,ck,stage2,32,moe_ck2stages_gemm2_256x32x64x64_1x4_TypeCast_v1_Nswizzle0_Quant0_MulRoutedWeight0_B16_B16_B16,43.2235,0.0,0.00%,13.97,13979.48,131167.6875,1024.0,8.793482,17553310.0,8355840.0,0.0,0.0,8355840.0,54223.0,1065778.0,3972334.0,12567219.0,613053.0,1.456577,63.295028,0.294070421,462400.0,522240.0,2512704.0,348160.0,3590400.0,86055753.0,32768.0,121033299.0,4278190080.0
18,16,4096,384,128,8,ActivationType.Gelu,torch.bfloat16,torch.bfloat16,torch.bfloat16,QuantType.No,1,0,ck,stage1,32,moe_ck2stages_gemm1_256x32x64x128_1x4_TypeCast_v1_Nswizzle0_Quant0_MulRoutedWeight0_gelu_B16_B16_B16,128.2915,0.0,0.00%,9.42,9417.78,506329.625,96.0,7.658841,87192104.0,32243712.0,0.0,0.0,32243712.0,53822.0,4051437.0,13594908.0,75408640.0,2724568.0,0.0604662259,17.22708,0.00989671659,641568.0,2015232.0,2922173.0,62976.0,5164032.0,71325216.0,3072.0,143536999.0,16508780544.0
18,16,4096,384,128,8,ActivationType.Gelu,torch.bfloat16,torch.bfloat16,torch.bfloat16,QuantType.No,1,0,ck,stage2,32,moe_ck2stages_gemm2_256x32x64x128_1x4_TypeCastExpertWeight_v1_Nswizzle0_Quant0_MulRoutedWeight1_B16_B16_B16,73.4262,0.0,0.49%,16.45,16454.91,253127.25,1024.0,6.74397,52824237.0,16121856.0,0.0,0.0,16121856.0,89583.0,2041400.0,8792674.0,43655339.0,1496272.0,0.584297397,48.83274,0.206681774,760960.0,1007616.0,4108160.0,335872.0,5982720.0,158908210.0,32768.0,224564411.0,8254390272.0
19,16,4096,384,128,8,ActivationType.Gelu,torch.bfloat16,torch.bfloat16,torch.bfloat16,QuantType.No,1,1,ck,stage1,32,moe_ck2stages_gemm1_256x32x64x128_1x4_TypeCastExpertWeight_v1_Nswizzle0_Quant0_MulRoutedWeight1_gelu_B16_B16_B16,128.76,0.0,0.00%,9.38,9383.52,506366.875,96.0,7.548497,87893387.0,32243712.0,0.0,0.0,32243712.0,54310.0,4051931.0,14220748.0,75803715.0,2727584.0,0.0604656965,17.290912,0.00659471285,641568.0,2015232.0,2950032.0,62976.0,5164032.0,72262557.0,3072.0,144070112.0,16508780544.0
19,16,4096,384,128,8,ActivationType.Gelu,torch.bfloat16,torch.bfloat16,torch.bfloat16,QuantType.No,1,1,ck,stage2,32,moe_ck2stages_gemm2_256x32x64x128_1x4_TypeCast_v1_Nswizzle0_Quant0_MulRoutedWeight0_B16_B16_B16,73.3232,0.0,0.00%,16.47,16478.03,253032.0,1024.0,6.833018,52038604.0,16121856.0,0.0,0.0,16121856.0,84764.0,2040649.0,10140146.0,43484692.0,1548564.0,0.562435212,45.897766,0.254754657,760960.0,1007616.0,3877248.0,335872.0,5982720.0,151127804.0,32768.0,219271828.0,8254390272.0
20,16,4096,384,128,8,ActivationType.Silu,torch.bfloat16,torch.bfloat16,torch.bfloat16,QuantType.No,1,0,ck,stage1,32,moe_ck2stages_gemm1_256x32x64x128_1x4_TypeCast_v1_Nswizzle0_Quant0_MulRoutedWeight0_silu_B16_B16_B16,128.3911,0.0,0.00%,9.41,9410.48,506329.9375,96.0,7.531666,86978422.0,32243712.0,0.0,0.0,32243712.0,50782.0,4051431.0,11608830.0,75051382.0,2781862.0,0.0591372808,17.172101,0.00818048815,641568.0,2015232.0,3064176.0,62976.0,5164032.0,72010951.0,3072.0,146294215.0,16508780544.0
20,16,4096,384,128,8,ActivationType.Silu,torch.bfloat16,torch.bfloat16,torch.bfloat16,QuantType.No,1,0,ck,stage2,32,moe_ck2stages_gemm2_256x32x64x128_1x4_TypeCastExpertWeight_v1_Nswizzle0_Quant0_MulRoutedWeight1_B16_B16_B16,74.1794,0.0,0.33%,16.28,16287.83,253125.375,1024.0,6.726042,51477210.0,16121856.0,0.0,0.0,16121856.0,89604.0,2041402.0,8104061.0,42307789.0,1591340.0,0.550535469,47.398274,0.209641353,760960.0,1007616.0,4108160.0,335872.0,5982720.0,164726242.0,32768.0,231334823.0,8254390272.0
21,16,4096,384,128,8,ActivationType.Silu,torch.bfloat16,torch.bfloat16,torch.bfloat16,QuantType.No,1,1,ck,stage1,32,moe_ck2stages_gemm1_256x32x64x128_1x4_TypeCastExpertWeight_v1_Nswizzle0_Quant0_MulRoutedWeight1_silu_B16_B16_B16,128.9967,0.0,0.00%,9.36,9366.3,506360.75,96.0,7.79978,85696226.0,32243712.0,0.0,0.0,32243712.0,51268.0,4051753.0,11714241.0,73702469.0,2801641.0,0.0587566958,17.414238,0.00889010378,641568.0,2015232.0,3093696.0,62976.0,5164032.0,74803864.0,3072.0,149318004.0,16508780544.0
21,16,4096,384,128,8,ActivationType.Silu,torch.bfloat16,torch.bfloat16,torch.bfloat16,QuantType.No,1,1,ck,stage2,32,moe_ck2stages_gemm2_256x32x64x128_1x4_TypeCast_v1_Nswizzle0_Quant0_MulRoutedWeight0_B16_B16_B16,73.3413,0.0,0.00%,16.47,16473.96,253031.5,1024.0,6.759236,52100337.0,16121856.0,0.0,0.0,16121856.0,84780.0,2040666.0,8803102.0,43597294.0,1496892.0,0.58476437,48.224775,0.26073368,760960.0,1007616.0,3877248.0,335872.0,5982720.0,154148909.0,32768.0,221591498.0,8254390272.0
22,16,4096,384,128,8,ActivationType.Silu,torch.bfloat16,torch.float8_e4m3fnuz,torch.float8_e4m3fnuz,QuantType.per_Tensor,1,0,ck,stage1,16,moe_ck2stages_gemm1_256x16x128x256_1x4_MulABScale_v1_Nswizzle0_Quant1_MulRoutedWeight0_silu_F8_F8_B16,68.277,45.88400000000009,0.00%,17.69,8848.9,252557.875,96.0,3.781332,37043979.0,0.0,0.0,16121856.0,8060928.0,29205.0,2021264.0,7182257.0,30792715.0,1388317.0,2.726823,8.913636,0.0026469107,143664.0,503808.0,930864.0,1448448.0,2109696.0,22980963.0,1536.0,37878338.0,8254390272.0
22,16,4096,384,128,8,ActivationType.Silu,torch.bfloat16,torch.float8_e4m3fnuz,torch.float8_e4m3fnuz,QuantType.per_Tensor,1,0,ck,stage2,16,moe_ck2stages_gemm2_128x16x128x128_1x2_MulABScaleExpertWeight_v1_Nswizzle0_Quant1_MulRoutedWeight1_F8_F8_B16,44.8712,45.88400000000009,0.36%,26.92,13464.68,126577.0,4096.0,3.72381,18952065.0,0.0,0.0,8060928.0,4030464.0,36489.0,1078229.0,3171417.0,15279195.0,685672.0,3.605092,32.56651,0.355352853,133824.0,251904.0,1266176.0,953376.0,1656608.0,34252871.0,8192.0,68898396.0,4127195136.0
23,16,4096,384,128,8,ActivationType.Silu,torch.bfloat16,torch.float8_e4m3fnuz,torch.float8_e4m3fnuz,QuantType.per_Tensor,1,1,ck,stage1,16,moe_ck2stages_gemm1_256x16x128x256_1x4_MulABScale_v1_Nswizzle0_Quant1_MulRoutedWeight1_silu_F8_F8_B16,68.0935,44.62499999999993,0.00%,17.74,8872.75,252588.125,96.0,3.764732,37015425.0,0.0,0.0,16121856.0,8060928.0,29673.0,2021508.0,6504749.0,30726647.0,1374780.0,2.754632,8.874303,0.00234870034,143664.0,503808.0,947592.0,1448448.0,2109696.0,22671789.0,1536.0,37330480.0,8254390272.0
23,16,4096,384,128,8,ActivationType.Silu,torch.bfloat16,torch.float8_e4m3fnuz,torch.float8_e4m3fnuz,QuantType.per_Tensor,1,1,ck,stage2,16,moe_ck2stages_gemm2_128x16x128x128_1x2_MulABScaleExpertWeight_v1_Nswizzle0_Quant1_MulRoutedWeight0_F8_F8_B16,44.5499,44.62499999999993,0.00%,27.11,13561.79,126544.0,4096.0,3.539459,19779355.0,0.0,0.0,8060928.0,4030464.0,34094.0,1077847.0,3765674.0,16088351.0,692991.0,3.50889,32.375457,0.329541767,133824.0,251904.0,1203200.0,953376.0,1656608.0,35380719.0,8192.0,70372080.0,4127195136.0
24,16,4096,384,128,8,ActivationType.Silu,torch.bfloat16,torch.float8_e4m3fnuz,torch.float8_e4m3fnuz,QuantType.per_Token,1,0,asm,asm_1stage,32,_ZN5aiter45fmoe_bf16_pertokenFp8_g1u1_vs_silu_1tg_32x192E,115.1334,0.0,0.00%,10.49,5247.62,381507.4375,2304.0,8.061174,36064205.0,0.0,0.0,48365568.0,24182784.0,108618.0,3089408.0,5752314.0,27873394.0,2025613.0,0.0,5.959781,0.122921542,395568.0,1511424.0,4044304.0,0.0,1553408.0,25851634.0,1056.0,36977134.0,24763170816.0
25,16,4096,384,128,8,ActivationType.Silu,torch.bfloat16,torch.float8_e4m3fnuz,torch.float8_e4m3fnuz,QuantType.per_Token,1,1,asm,asm_1stage,32,_ZN5aiter50fmoe_bf16_pertokenFp8_g1u1_vs_tkw1_silu_1tg_32x192E,121.4569,0.0,0.00%,9.95,4974.41,381517.125,2048.0,7.826662,35946445.0,0.0,0.0,48365568.0,24182784.0,105739.0,3085576.0,5099619.0,27114726.0,1967288.0,0.0,5.939529,0.0581662839,364080.0,1511424.0,3718928.0,0.0,1469440.0,22327958.0,1056.0,35791801.0,24763170816.0
26,16,4096,384,128,8,ActivationType.Gelu,torch.bfloat16,torch.float8_e4m3fnuz,torch.float8_e4m3fnuz,QuantType.per_Tensor,1,0,ck,stage1,32,moe_ck2stages_gemm1_256x32x64x256_1x4_MulABScale_v1_Nswizzle0_Quant1_MulRoutedWeight0_gelu_F8_F8_B16,68.5446,43.74777777777784,0.00%,17.62,8814.35,252983.3125,96.0,7.415089,40884063.0,0.0,0.0,32243712.0,16121856.0,41247.0,2024838.0,5860619.0,33969900.0,1423950.0,2.685317,15.807076,0.0171686249,385728.0,1007616.0,1753158.0,1479936.0,4061952.0,34531223.0,3072.0,69692967.0,16508780544.0
26,16,4096,384,128,8,ActivationType.Gelu,torch.bfloat16,torch.float8_e4m3fnuz,torch.float8_e4m3fnuz,QuantType.per_Tensor,1,0,ck,stage2,32,moe_ck2stages_gemm2_256x32x64x128_1x4_MulABScaleExpertWeight_v1_Nswizzle0_Quant1_MulRoutedWeight1_F8_F8_B16,43.821,43.74777777777784,0.44%,27.57,13787.37,126659.625,1024.0,8.891612,16255574.0,0.0,0.0,16121856.0,8060928.0,60316.0,1029686.0,3319378.0,10566702.0,611828.0,14.026891,61.471734,0.0958535409,572032.0,503808.0,3058560.0,3358720.0,6486528.0,73726731.0,32768.0,117754584.0,8254390272.0
27,16,4096,384,128,8,ActivationType.Gelu,torch.bfloat16,torch.float8_e4m3fnuz,torch.float8_e4m3fnuz,QuantType.per_Tensor,1,1,ck,stage1,16,moe_ck2stages_gemm1_256x16x128x256_1x4_MulABScale_v1_Nswizzle0_Quant1_MulRoutedWeight1_gelu_F8_F8_B16,67.8754,46.83233333333333,0.00%,17.8,8901.26,252591.25,96.0,3.818601,36734399.0,0.0,0.0,16121856.0,8060928.0,30903.0,2021548.0,8189624.0,30541606.0,1377902.0,2.712911,8.706682,0.00231312775,143664.0,503808.0,854112.0,1448448.0,2109696.0,22782635.0,1536.0,37188616.0,8254390272.0
27,16,4096,384,128,8,ActivationType.Gelu,torch.bfloat16,torch.float8_e4m3fnuz,torch.float8_e4m3fnuz,QuantType.per_Tensor,1,1,ck,stage2,16,moe_ck2stages_gemm2_128x16x128x128_1x2_MulABScaleExpertWeight_v1_Nswizzle0_Quant1_MulRoutedWeight0_F8_F8_B16,44.4982,46.83233333333333,0.00%,27.15,13577.55,126534.5,4096.0,3.765651,19377065.0,0.0,0.0,8060928.0,4030464.0,34151.0,1077949.0,4170950.0,15791207.0,693895.0,3.471601,31.874481,0.376960735,133824.0,251904.0,1203200.0,953376.0,1656608.0,35464540.0,8192.0,70027326.0,4127195136.0
28,16,4096,384,128,8,ActivationType.Gelu,torch.bfloat16,torch.float8_e4m3fnuz,torch.float8_e4m3fnuz,QuantType.per_Token,1,0,asm,asm_1stage,32,_ZN5aiter45fmoe_bf16_pertokenFp8_g1u1_vs_gelu_1tg_32x192E,114.9343,0.0,0.00%,10.51,5256.71,381587.625,2304.0,7.945487,36225787.0,0.0,0.0,48365568.0,24182784.0,109416.0,3088672.0,5389651.0,28073182.0,1983756.0,0.0,5.919378,0.108288559,395568.0,1511424.0,4091536.0,0.0,1553408.0,25101570.0,1056.0,36064248.0,24763170816.0
29,16,4096,384,128,8,ActivationType.Gelu,torch.bfloat16,torch.float8_e4m3fnuz,torch.float8_e4m3fnuz,QuantType.per_Token,1,1,asm,asm_1stage,32,_ZN5aiter50fmoe_bf16_pertokenFp8_g1u1_vs_tkw1_gelu_1tg_32x192E,121.5835,0.0,0.00%,9.94,4969.23,381514.75,2048.0,7.72773,37401417.0,0.0,0.0,48365568.0,24182784.0,108642.0,3085083.0,4570773.0,28554394.0,2051053.0,0.0,5.838475,0.101612313,364080.0,1511424.0,3766160.0,0.0,1469440.0,22871505.0,1056.0,36856079.0,24763170816.0
30,16,4096,384,128,8,ActivationType.Silu,torch.bfloat16,torch.float8_e4m3fnuz,torch.float8_e4m3fnuz,QuantType.per_Tensor,1,0,ck,stage1,32,moe_ck2stages_gemm1_256x32x64x256_1x4_MulABScale_v1_Nswizzle0_Quant1_MulRoutedWeight0_silu_F8_F8_B16,68.7755,46.22233333333337,0.00%,17.56,8784.76,252972.125,96.0,7.538711,40419498.0,0.0,0.0,32243712.0,16121856.0,36547.0,2024587.0,4386699.0,33494402.0,1403069.0,2.73257,15.983549,0.0344152564,385728.0,1007616.0,1920768.0,1479936.0,4061952.0,34664237.0,3072.0,69252394.0,16508780544.0
30,16,4096,384,128,8,ActivationType.Silu,torch.bfloat16,torch.float8_e4m3fnuz,torch.float8_e4m3fnuz,QuantType.per_Tensor,1,0,ck,stage2,32,moe_ck2stages_gemm2_256x32x64x128_1x4_MulABScaleExpertWeight_v1_Nswizzle0_Quant1_MulRoutedWeight1_F8_F8_B16,43.9208,46.22233333333337,0.34%,27.5,13756.04,126657.75,1024.0,8.702057,16266315.0,0.0,0.0,16121856.0,8060928.0,60185.0,1029709.0,3265033.0,10438979.0,589072.0,14.672538,64.069644,0.0737881806,572032.0,503808.0,3058560.0,3358720.0,6486528.0,71290747.0,32768.0,117330483.0,8254390272.0
34,16,4096,384,128,8,ActivationType.Gelu,torch.bfloat16,torch.float8_e4m3fnuz,torch.float8_e4m3fnuz,QuantType.per_Tensor,1,0,ck,stage1,16,moe_ck2stages_gemm1_256x16x128x256_1x4_MulABScale_v1_Nswizzle0_Quant1_MulRoutedWeight0_gelu_F8_F8_B16,68.4994,43.9213333333332,0.00%,17.63,8820.17,252564.625,96.0,3.892094,36578484.0,0.0,0.0,16121856.0,8060928.0,31249.0,2021318.0,3672164.0,30305281.0,1420823.0,2.641837,8.800096,0.00225252699,143664.0,503808.0,859686.0,1448448.0,2109696.0,23480711.0,1536.0,38598849.0,8254390272.0
34,16,4096,384,128,8,ActivationType.Gelu,torch.bfloat16,torch.float8_e4m3fnuz,torch.float8_e4m3fnuz,QuantType.per_Tensor,1,0,ck,stage2,16,moe_ck2stages_gemm2_128x16x128x128_1x2_MulABScaleExpertWeight_v1_Nswizzle0_Quant1_MulRoutedWeight1_F8_F8_B16,44.833,43.9213333333332,0.47%,26.94,13476.15,126584.0,4096.0,3.7501,19120605.0,0.0,0.0,8060928.0,4030464.0,36342.0,1078248.0,4114908.0,15482354.0,674276.0,3.605838,31.970063,0.344108229,133824.0,251904.0,1266176.0,953376.0,1656608.0,33968008.0,8192.0,67622546.0,4127195136.0
38,16,4096,384,128,8,ActivationType.Silu,torch.bfloat16,torch.float8_e4m3fnuz,torch.float8_e4m3fnuz,QuantType.per_1x128,1,0,asm,asm_1stage,32,_ZN5aiter47fmoe_bf16_blockscaleFp8_g1u1_vs_silu_1tg_32x128E,121.0922,0.0,0.00%,9.98,4989.39,379242.625,3072.0,7.744673,52381161.0,0.0,0.0,48365568.0,24182784.0,129471.0,3083556.0,5282647.0,42561271.0,2086704.0,0.0,8.534762,0.20716444,607128.0,1511424.0,5081472.0,0.0,2318304.0,41925406.0,1584.0,54715074.0,24763170816.0
39,16,4096,384,128,8,ActivationType.Gelu,torch.bfloat16,torch.float8_e4m3fnuz,torch.float8_e4m3fnuz,QuantType.per_1x128,1,0,asm,asm_1stage,32,_ZN5aiter47fmoe_bf16_blockscaleFp8_g1u1_vs_gelu_1tg_32x128E,120.1633,0.0,0.10%,10.05,5027.96,379132.4375,3072.0,8.065391,49815951.0,0.0,0.0,48365568.0,24182784.0,130761.0,3084547.0,5709532.0,39984641.0,2025850.0,0.0,8.848419,0.124224687,607128.0,1511424.0,5128704.0,0.0,2318304.0,41851270.0,1584.0,54713392.0,24763170816.0
40,16,4096,384,128,8,ActivationType.Silu,torch.bfloat16,torch.float8_e4m3fnuz,torch.float8_e4m3fnuz,QuantType.per_1x128,1,1,ck,stage1,16,moe_ck2stages_gemm1_128x16x128x128_1x2_MulABScaleExpertWeightA8W8blkscale_v1_Nswizzle0_Quant4_MulRoutedWeight1_silu_F8_F8_B16,75.0515,42.17844444444456,0.01%,16.1,8050.16,252690.25,96.0,3.806978,18459278.0,0.0,0.0,16121856.0,8060928.0,54861.0,2022323.0,5024242.0,29532786.0,1392700.0,1.607608,4.397563,0.00339958308,81672.0,503808.0,1199496.0,858048.0,1267392.0,15821261.0,768.0,18777308.0,8254390272.0
40,16,4096,384,128,8,ActivationType.Silu,torch.bfloat16,torch.float8_e4m3fnuz,torch.float8_e4m3fnuz,QuantType.per_1x128,1,1,ck,stage2,16,moe_ck2stages_gemm2_128x16x128x128_1x2_MulABScaleExpertWeightA8W8blkscale_v1_Nswizzle0_Quant4_MulRoutedWeight0_F8_F8_B16,44.6484,42.17844444444456,16.80%,27.05,13531.87,126841.75,1024.0,3.847658,17888501.0,0.0,0.0,8060928.0,4030464.0,52440.0,1031115.0,2489117.0,13129750.0,649438.0,6.66491,30.851844,0.112429873,112832.0,251904.0,1251136.0,1679360.0,2382592.0,27924790.0,8192.0,62190012.0,4127195136.0
41,16,4096,384,128,8,ActivationType.Gelu,torch.bfloat16,torch.float8_e4m3fnuz,torch.float8_e4m3fnuz,QuantType.per_1x128,1,1,ck,stage1,16,moe_ck2stages_gemm1_256x16x128x256_1x4_MulABScaleExpertWeightA8W8blkscale_v1_Nswizzle0_Quant4_MulRoutedWeight1_gelu_F8_F8_B16,74.7595,38.916111111111086,0.02%,16.16,8081.6,252913.5,96.0,3.681007,37644113.0,0.0,0.0,16121856.0,8060928.0,41977.0,2024069.0,6633168.0,30629139.0,1428067.0,2.818475,8.859717,0.00327988338,141696.0,503808.0,1172928.0,1542912.0,2204160.0,25150353.0,1536.0,38800456.0,8254390272.0
41,16,4096,384,128,8,ActivationType.Gelu,torch.bfloat16,torch.float8_e4m3fnuz,torch.float8_e4m3fnuz,QuantType.per_1x128,1,1,ck,stage2,16,moe_ck2stages_gemm2_128x16x128x128_1x2_MulABScaleExpertWeightA8W8blkscale_v1_Nswizzle0_Quant4_MulRoutedWeight0_F8_F8_B16,44.3282,38.916111111111086,16.58%,27.25,13629.62,126843.0,1024.0,4.075655,16968486.0,0.0,0.0,8060928.0,4030464.0,52276.0,1031241.0,3453053.0,12224626.0,615481.0,7.093052,32.773182,0.118568796,112832.0,251904.0,1251136.0,1679360.0,2382592.0,28040398.0,8192.0,62075365.0,4127195136.0
45,16,5120,1024,128,1,ActivationType.Silu,torch.bfloat16,torch.float8_e4m3fnuz,torch.float8_e4m3fnuz,QuantType.per_Token,1,1,asm,asm_1stage,32,_ZN5aiter50fmoe_bf16_pertokenFp8_g1u1_vs_tkw1_silu_1tg_32x128E,116.5117,0.0,0.02%,4.32,17281.63,249288.0,1280.0,6.918118,21607745.0,0.0,0.0,31457280.0,15728640.0,61328.0,2014816.0,154244.0,13613177.0,1476955.0,0.0,4.797497,0.0148003603,346624.0,983040.0,3033408.0,0.0,1398784.0,11987552.0,4128.0,21629701.0,16106127360.0
46,16,7168,256,256,8,ActivationType.Gelu,torch.bfloat16,torch.bfloat16,torch.bfloat16,QuantType.No,1,0,ck,stage1,32,moe_ck2stages_gemm1_256x32x64x128_1x4_TypeCast_v1_Nswizzle0_Quant0_MulRoutedWeight0_gelu_B16_B16_B16,187.8782,0.0,0.00%,7.5,15004.57,763915.6875,64.0,8.46261,114024152.0,48627712.0,0.0,0.0,48627712.0,48805.0,6111916.0,12059767.0,97063207.0,3703319.0,0.038480475,14.759862,0.00287618011,959936.0,3039232.0,4059873.0,54272.0,7706624.0,97445578.0,2048.0,166535828.0,24897388544.0
46,16,7168,256,256,8,ActivationType.Gelu,torch.bfloat16,torch.bfloat16,torch.bfloat16,QuantType.No,1,0,ck,stage2,32,moe_ck2stages_gemm2_256x32x64x128_1x4_TypeCastExpertWeight_v1_Nswizzle0_Quant0_MulRoutedWeight1_B16_B16_B16,105.1116,0.0,1.67%,13.41,26819.41,380708.6875,1792.0,7.794754,71029015.0,24313856.0,0.0,0.0,24313856.0,106266.0,3074370.0,10702978.0,57805183.0,2021698.0,0.978996557,60.911248,0.219056871,1246560.0,1519616.0,6846112.0,759808.0,9735040.0,294407112.0,57344.0,378190123.0,12448694272.0
47,16,7168,256,256,8,ActivationType.Gelu,torch.bfloat16,torch.bfloat16,torch.bfloat16,QuantType.No,1,1,ck,stage1,32,moe_ck2stages_gemm1_256x32x64x128_1x4_TypeCastExpertWeight_v1_Nswizzle0_Quant0_MulRoutedWeight1_gelu_B16_B16_B16,188.1739,0.0,0.00%,7.49,14980.99,763978.75,64.0,8.558199,115259114.0,48627712.0,0.0,0.0,48627712.0,49280.0,6112340.0,15100579.0,97988577.0,3723220.0,0.0382012569,14.72536,0.00389846811,959936.0,3039232.0,4068704.0,54272.0,7706624.0,98224266.0,2048.0,167360935.0,24897388544.0
47,16,7168,256,256,8,ActivationType.Gelu,torch.bfloat16,torch.bfloat16,torch.bfloat16,QuantType.No,1,1,ck,stage2,32,moe_ck2stages_gemm2_256x32x64x128_1x4_TypeCast_v1_Nswizzle0_Quant0_MulRoutedWeight0_B16_B16_B16,105.5593,0.0,0.00%,13.35,26705.66,380597.1875,1792.0,7.644585,72204744.0,24313856.0,0.0,0.0,24313856.0,96274.0,3073505.0,12565172.0,60494749.0,2099267.0,0.916523379,57.586574,0.316624251,1246560.0,1519616.0,6323744.0,759808.0,9735040.0,299313664.0,57344.0,381919243.0,12448694272.0
48,16,7168,256,256,8,ActivationType.Gelu,torch.bfloat16,torch.float8_e4m3fnuz,torch.float8_e4m3fnuz,QuantType.per_Tensor,1,0,ck,stage1,16,moe_ck2stages_gemm1_256x16x128x256_1x4_MulABScale_v1_Nswizzle0_Quant1_MulRoutedWeight0_gelu_F8_F8_B16,98.093,39.61255555555549,0.00%,14.37,14370.34,380933.8125,64.0,4.004484,46020458.0,0.0,0.0,24313856.0,12156928.0,27413.0,3047953.0,5997671.0,37940300.0,1935862.0,2.991429,7.705425,0.00166029793,215392.0,759808.0,1117658.0,2225152.0,3202048.0,27499792.0,1024.0,45852975.0,12448694272.0
48,16,7168,256,256,8,ActivationType.Gelu,torch.bfloat16,torch.float8_e4m3fnuz,torch.float8_e4m3fnuz,QuantType.per_Tensor,1,0,ck,stage2,16,moe_ck2stages_gemm2_256x16x128x256_1x4_MulABScaleExpertWeight_v1_Nswizzle0_Quant1_MulRoutedWeight1_F8_F8_B16,60.7044,39.61255555555549,1.73%,23.22,23221.22,190378.0,3584.0,3.674569,33249685.0,0.0,0.0,12156928.0,6078464.0,49312.0,1580427.0,4728850.0,27505744.0,1030587.0,1.23021,70.057723,0.523396061,267120.0,379904.0,2739072.0,487200.0,2125536.0,147555835.0,28672.0,221959635.0,6224347136.0
49,16,7168,256,256,8,ActivationType.Gelu,torch.bfloat16,torch.float8_e4m3fnuz,torch.float8_e4m3fnuz,QuantType.per_Tensor,1,1,ck,stage1,16,moe_ck2stages_gemm1_256x16x128x256_1x4_MulABScale_v1_Nswizzle0_Quant1_MulRoutedWeight1_gelu_F8_F8_B16,98.1475,40.27144444444438,0.00%,14.36,14362.36,380956.4375,64.0,4.104239,45999270.0,0.0,0.0,24313856.0,12156928.0,26979.0,3048222.0,6809614.0,37951765.0,1944675.0,2.995334,7.778473,0.00166246532,215392.0,759808.0,1097312.0,2225152.0,3202048.0,27758010.0,1024.0,46227317.0,12448694272.0
49,16,7168,256,256,8,ActivationType.Gelu,torch.bfloat16,torch.float8_e4m3fnuz,torch.float8_e4m3fnuz,QuantType.per_Tensor,1,1,ck,stage2,16,moe_ck2stages_gemm2_256x16x128x256_1x4_MulABScaleExpertWeight_v1_Nswizzle0_Quant1_MulRoutedWeight0_F8_F8_B16,60.6584,40.27144444444438,0.00%,23.23,23238.83,190323.0,3584.0,3.720267,33447359.0,0.0,0.0,12156928.0,6078464.0,43624.0,1579982.0,4816421.0,28116230.0,1078874.0,1.155141,66.497081,0.564481689,267120.0,379904.0,2549120.0,487200.0,2125536.0,151697124.0,28672.0,224369962.0,6224347136.0
50,16,7168,256,256,8,ActivationType.Gelu,torch.bfloat16,torch.float8_e4m3fnuz,torch.float8_e4m3fnuz,QuantType.per_Token,1,0,asm,asm_1stage,32,_ZN5aiter45fmoe_bf16_pertokenFp8_g1u1_vs_gelu_1tg_32x128E,163.2399,0.0,0.00%,8.63,8635.33,577049.625,3584.0,9.031794,63827629.0,0.0,0.0,72941568.0,36470784.0,104371.0,4673761.0,6547275.0,49479241.0,2797127.0,0.0,7.866409,0.121285471,791184.0,2279424.0,7606160.0,0.0,3185088.0,49173254.0,2080.0,67289270.0,37346082816.0
51,16,7168,256,256,8,ActivationType.Gelu,torch.bfloat16,torch.float8_e4m3fnuz,torch.float8_e4m3fnuz,QuantType.per_Token,1,1,asm,asm_1stage,32,_ZN5aiter50fmoe_bf16_pertokenFp8_g1u1_vs_tkw1_gelu_1tg_32x128E,171.5463,0.0,0.00%,8.22,8217.2,577051.5,3584.0,8.167404,69864389.0,0.0,0.0,72941568.0,36470784.0,105100.0,4673803.0,6355525.0,54629351.0,2955880.0,0.0,7.845685,0.249636025,791184.0,2279424.0,6862464.0,0.0,3185088.0,47658462.0,2080.0,70902185.0,37346082816.0
52,16,7168,256,256,8,ActivationType.Silu,torch.bfloat16,torch.bfloat16,torch.bfloat16,QuantType.No,1,0,ck,stage1,32,moe_ck2stages_gemm1_256x32x64x128_1x4_TypeCast_v1_Nswizzle0_Quant0_MulRoutedWeight0_silu_B16_B16_B16,188.5785,0.0,0.00%,7.47,14948.85,763909.9375,64.0,8.638115,114191707.0,48627712.0,0.0,0.0,48627712.0,45855.0,6111843.0,13355622.0,97212324.0,3722916.0,0.0381033346,14.528839,0.00482224266,959936.0,3039232.0,4167072.0,54272.0,7706624.0,96303782.0,2048.0,165551738.0,24897388544.0
52,16,7168,256,256,8,ActivationType.Silu,torch.bfloat16,torch.bfloat16,torch.bfloat16,QuantType.No,1,0,ck,stage2,32,moe_ck2stages_gemm2_256x32x64x128_1x4_TypeCastExpertWeight_v1_Nswizzle0_Quant0_MulRoutedWeight1_B16_B16_B16,104.9217,0.0,1.42%,13.43,26867.95,380708.5625,1792.0,7.938756,69512395.0,24313856.0,0.0,0.0,24313856.0,106157.0,3074393.0,10555182.0,56312524.0,2063142.0,0.962354136,61.566098,0.208570774,1246560.0,1519616.0,6846112.0,759808.0,9735040.0,304038087.0,57344.0,388866526.0,12448694272.0
53,16,7168,256,256,8,ActivationType.Silu,torch.bfloat16,torch.bfloat16,torch.bfloat16,QuantType.No,1,1,ck,stage1,32,moe_ck2stages_gemm1_256x32x64x128_1x4_TypeCastExpertWeight_v1_Nswizzle0_Quant0_MulRoutedWeight1_silu_B16_B16_B16,188.7136,0.0,0.00%,7.47,14938.14,763959.25,64.0,8.534983,116196348.0,48627712.0,0.0,0.0,48627712.0,46201.0,6112224.0,14338704.0,99052561.0,3727127.0,0.0380494113,14.615504,0.0049752662,959936.0,3039232.0,4192512.0,54272.0,7706624.0,96926334.0,2048.0,166775276.0,24897388544.0
53,16,7168,256,256,8,ActivationType.Silu,torch.bfloat16,torch.bfloat16,torch.bfloat16,QuantType.No,1,1,ck,stage2,32,moe_ck2stages_gemm2_256x32x64x128_1x4_TypeCast_v1_Nswizzle0_Quant0_MulRoutedWeight0_B16_B16_B16,105.3058,0.0,0.00%,13.38,26769.95,380598.1875,1792.0,7.574446,71804002.0,24313856.0,0.0,0.0,24313856.0,96336.0,3073481.0,9517118.0,60051058.0,2066555.0,0.958754846,60.050919,0.347552543,1246560.0,1519616.0,6323744.0,759808.0,9735040.0,297864434.0,57344.0,380720215.0,12448694272.0
54,16,7168,256,256,8,ActivationType.Silu,torch.bfloat16,torch.float8_e4m3fnuz,torch.float8_e4m3fnuz,QuantType.per_Tensor,1,0,ck,stage1,16,moe_ck2stages_gemm1_256x16x128x256_1x4_MulABScale_v1_Nswizzle0_Quant1_MulRoutedWeight0_silu_F8_F8_B16,98.1852,39.72388888888893,0.00%,14.35,14356.85,380923.75,64.0,4.130897,45735015.0,0.0,0.0,24313856.0,12156928.0,25649.0,3047943.0,8119653.0,37512668.0,1938114.0,2.999778,7.703332,0.00178019623,215392.0,759808.0,1163456.0,2225152.0,3202048.0,27445099.0,1024.0,45712936.0,12448694272.0
54,16,7168,256,256,8,ActivationType.Silu,torch.bfloat16,torch.float8_e4m3fnuz,torch.float8_e4m3fnuz,QuantType.per_Tensor,1,0,ck,stage2,16,moe_ck2stages_gemm2_256x16x128x256_1x4_MulABScaleExpertWeight_v1_Nswizzle0_Quant1_MulRoutedWeight1_F8_F8_B16,60.025,39.72388888888893,1.41%,23.48,23484.05,190380.125,3584.0,3.856842,32823565.0,0.0,0.0,12156928.0,6078464.0,49402.0,1580407.0,5140887.0,27194291.0,1061409.0,1.170505,67.9893,0.483227187,267120.0,379904.0,2739072.0,487200.0,2125536.0,150390976.0,28672.0,226393883.0,6224347136.0
55,16,7168,256,256,8,ActivationType.Silu,torch.bfloat16,torch.float8_e4m3fnuz,torch.float8_e4m3fnuz,QuantType.per_Tensor,1,1,ck,stage1,32,moe_ck2stages_gemm1_256x32x64x256_1x4_MulABScale_v1_Nswizzle0_Quant1_MulRoutedWeight1_silu_F8_F8_B16,98.591,38.90044444444436,0.00%,14.29,14297.76,381810.625,64.0,8.138449,56735012.0,0.0,0.0,48627712.0,24313856.0,36923.0,3054946.0,7206188.0,47287720.0,1943653.0,3.020553,13.953841,0.0103580179,576640.0,1519616.0,2433760.0,2252288.0,6105600.0,47712228.0,2048.0,83237923.0,24897388544.0
55,16,7168,256,256,8,ActivationType.Silu,torch.bfloat16,torch.float8_e4m3fnuz,torch.float8_e4m3fnuz,QuantType.per_Tensor,1,1,ck,stage2,32,moe_ck2stages_gemm2_256x32x64x256_1x4_MulABScaleExpertWeight_v1_Nswizzle0_Quant1_MulRoutedWeight0_F8_F8_B16,59.6448,38.90044444444436,0.00%,23.63,23633.75,190359.6875,1792.0,10.34571,23400596.0,0.0,0.0,24313856.0,12156928.0,70519.0,1551593.0,4399724.0,15597212.0,800928.0,2.405621,65.801068,0.215959075,771680.0,759808.0,5184032.0,759808.0,5936000.0,120957023.0,57344.0,166264497.0,12448694272.0
56,16,7168,256,256,8,ActivationType.Silu,torch.bfloat16,torch.float8_e4m3fnuz,torch.float8_e4m3fnuz,QuantType.per_Token,1,0,asm,asm_1stage,32,_ZN5aiter45fmoe_bf16_pertokenFp8_g1u1_vs_silu_1tg_32x128E,163.0706,0.0,0.00%,8.64,8644.29,577047.5,3584.0,7.823321,70003232.0,0.0,0.0,72941568.0,36470784.0,104932.0,4673822.0,5515547.0,56075261.0,2862910.0,0.0,7.872462,0.130037281,791184.0,2279424.0,7565456.0,0.0,3185088.0,50681540.0,2080.0,68790193.0,37346082816.0
57,16,7168,256,256,8,ActivationType.Silu,torch.bfloat16,torch.float8_e4m3fnuz,torch.float8_e4m3fnuz,QuantType.per_Token,1,1,asm,asm_1stage,32,_ZN5aiter50fmoe_bf16_pertokenFp8_g1u1_vs_tkw1_silu_1tg_32x128E,171.6293,0.0,0.00%,8.21,8213.23,577044.75,3584.0,8.097,71222309.0,0.0,0.0,72941568.0,36470784.0,102773.0,4673783.0,5897578.0,55944881.0,2656099.0,0.0,7.936646,0.0376008395,791184.0,2279424.0,6821760.0,0.0,3185088.0,43295031.0,2080.0,64840952.0,37346082816.0
63,16,7168,256,256,8,ActivationType.Gelu,torch.bfloat16,torch.float8_e4m3fnuz,torch.float8_e4m3fnuz,QuantType.per_Tensor,1,1,ck,stage1,32,moe_ck2stages_gemm1_256x32x64x256_1x4_MulABScale_v1_Nswizzle0_Quant1_MulRoutedWeight1_gelu_F8_F8_B16,98.3853,41.22411111111108,0.00%,14.32,14327.65,381817.75,64.0,8.308622,56709444.0,0.0,0.0,48627712.0,24313856.0,38636.0,3055007.0,9802229.0,47180725.0,1887176.0,3.123682,14.199347,0.0069039518,576640.0,1519616.0,2274336.0,2252288.0,6105600.0,47327666.0,2048.0,81905957.0,24897388544.0
63,16,7168,256,256,8,ActivationType.Gelu,torch.bfloat16,torch.float8_e4m3fnuz,torch.float8_e4m3fnuz,QuantType.per_Tensor,1,1,ck,stage2,32,moe_ck2stages_gemm2_256x32x64x256_1x4_MulABScaleExpertWeight_v1_Nswizzle0_Quant1_MulRoutedWeight0_F8_F8_B16,59.7775,41.22411111111108,0.00%,23.58,23581.28,190359.0625,1792.0,9.717701,24340932.0,0.0,0.0,24313856.0,12156928.0,70394.0,1551579.0,5108216.0,16666697.0,802454.0,2.430299,66.35735,0.254000068,771680.0,759808.0,5184032.0,759808.0,5936000.0,121667906.0,57344.0,165967525.0,12448694272.0
66,16,7168,256,256,8,ActivationType.Gelu,torch.bfloat16,torch.float8_e4m3fnuz,torch.float8_e4m3fnuz,QuantType.per_1x128,1,0,asm,asm_1stage,32,_ZN5aiter47fmoe_bf16_blockscaleFp8_g1u1_vs_gelu_1tg_32x128E,161.3583,0.0,1.92%,8.73,8736.03,571177.625,3584.0,9.49566,61772301.0,0.0,0.0,72941568.0,36470784.0,126807.0,4626753.0,6773380.0,47568741.0,2716034.0,0.0,8.03631,0.164921125,889552.0,2279424.0,7479808.0,0.0,3381824.0,48060438.0,2080.0,66741656.0,37346082816.0
67,16,7168,256,256,8,ActivationType.Gelu,torch.bfloat16,torch.float8_e4m3fnuz,torch.float8_e4m3fnuz,QuantType.per_1x128,1,1,ck,stage1,16,moe_ck2stages_gemm1_256x16x128x256_1x4_MulABScaleExpertWeightA8W8blkscale_v1_Nswizzle0_Quant4_MulRoutedWeight1_gelu_F8_F8_B16,103.8777,41.337777777777696,0.04%,13.57,13570.09,381244.625,64.0,4.01705,47166468.0,0.0,0.0,24313856.0,12156928.0,40539.0,3050407.0,7578564.0,37785948.0,1926332.0,3.122991,7.824815,0.0021737833,213696.0,759808.0,1570496.0,2306560.0,3283456.0,28246682.0,1024.0,46233643.0,12448694272.0
67,16,7168,256,256,8,ActivationType.Gelu,torch.bfloat16,torch.float8_e4m3fnuz,torch.float8_e4m3fnuz,QuantType.per_1x128,1,1,ck,stage2,16,moe_ck2stages_gemm2_256x16x128x256_1x4_MulABScaleExpertWeightA8W8blkscale_v1_Nswizzle0_Quant4_MulRoutedWeight0_F8_F8_B16,61.0933,41.337777777777696,16.55%,23.07,23073.4,190724.125,1792.0,3.634758,33815651.0,0.0,0.0,12156928.0,6078464.0,50424.0,1554518.0,4800417.0,27253668.0,1053892.0,10.257224,67.16387,0.31952331,219632.0,379904.0,2686992.0,4178944.0,5817280.0,105209814.0,28672.0,218908395.0,6224347136.0
68,16,7168,256,256,8,ActivationType.Silu,torch.bfloat16,torch.float8_e4m3fnuz,torch.float8_e4m3fnuz,QuantType.per_1x128,1,0,asm,asm_1stage,32,_ZN5aiter47fmoe_bf16_blockscaleFp8_g1u1_vs_silu_1tg_32x128E,160.6804,0.0,0.00%,8.77,8772.88,571176.125,3584.0,9.41234,61546035.0,0.0,0.0,72941568.0,36470784.0,126136.0,4626708.0,6159025.0,47545869.0,2894002.0,0.0,7.818112,0.180437845,889552.0,2279424.0,7439104.0,0.0,3381824.0,50666736.0,2080.0,69300565.0,37346082816.0
70,16,7168,256,256,8,ActivationType.Silu,torch.bfloat16,torch.float8_e4m3fnuz,torch.float8_e4m3fnuz,QuantType.per_1x128,1,1,ck,stage1,16,moe_ck2stages_gemm1_256x16x128x256_1x4_MulABScaleExpertWeightA8W8blkscale_v1_Nswizzle0_Quant4_MulRoutedWeight1_silu_F8_F8_B16,103.704,38.177555555555536,0.01%,13.59,13592.82,381236.25,64.0,4.014727,46533942.0,0.0,0.0,24313856.0,12156928.0,37547.0,3050429.0,7203732.0,37208768.0,1985383.0,3.035554,7.71747,0.00216293259,213696.0,759808.0,1632400.0,2306560.0,3283456.0,28718790.0,1024.0,46912834.0,12448694272.0
70,16,7168,256,256,8,ActivationType.Silu,torch.bfloat16,torch.float8_e4m3fnuz,torch.float8_e4m3fnuz,QuantType.per_1x128,1,1,ck,stage2,16,moe_ck2stages_gemm2_256x16x128x256_1x4_MulABScaleExpertWeightA8W8blkscale_v1_Nswizzle0_Quant4_MulRoutedWeight0_F8_F8_B16,60.8883,38.177555555555536,16.50%,23.15,23151.08,190725.5,1792.0,3.819095,33503767.0,0.0,0.0,12156928.0,6078464.0,50438.0,1554525.0,5118552.0,26640916.0,1038577.0,10.442277,67.428906,0.339222367,219632.0,379904.0,2686992.0,4178944.0,5817280.0,104143985.0,28672.0,215877536.0,6224347136.0
72,16,7168,256,257,9,ActivationType.Silu,torch.bfloat16,torch.float8_e4m3fnuz,torch.float8_e4m3fnuz,QuantType.per_Token,1,0,asm,asm_1stage,32,_ZN5aiter45fmoe_bf16_pertokenFp8_g1u1_vs_silu_1tg_32x128E,177.0166,0.0,0.00%,8.96,7994.36,636869.125,4032.0,9.772618,71959848.0,0.0,0.0,80510976.0,40255488.0,114683.0,5159472.0,9547067.0,56579891.0,2770816.0,0.0,8.530821,0.0513827813,873288.0,2515968.0,8348552.0,0.0,3515616.0,52356492.0,2096.0,72325756.0,41221619712.0
74,16,7168,256,257,9,ActivationType.Silu,torch.bfloat16,torch.float8_e4m3fnuz,torch.float8_e4m3fnuz,QuantType.per_1x128,1,0,asm,asm_1stage,32,_ZN5aiter47fmoe_bf16_blockscaleFp8_g1u1_vs_silu_1tg_32x128E,176.3703,0.0,0.00%,8.99,8023.66,630414.875,4032.0,9.7981,72109325.0,0.0,0.0,80510976.0,40255488.0,139960.0,5107639.0,8238958.0,56906019.0,3082077.0,0.0,8.554706,0.180816064,981864.0,2515968.0,8209088.0,0.0,3732768.0,59849598.0,2096.0,80406712.0,41221619712.0
75,16,7168,512,256,8,ActivationType.Gelu,torch.bfloat16,torch.bfloat16,torch.bfloat16,QuantType.No,1,0,ck,stage1,32,moe_ck2stages_gemm1_256x32x64x64_1x4_TypeCast_v1_Nswizzle0_Quant0_MulRoutedWeight0_gelu_B16_B16_B16,368.0529,0.0,0.00%,7.66,15317.37,1508810.125,128.0,9.629722,226360227.0,96337920.0,0.0,0.0,96337920.0,104277.0,12071265.0,24210566.0,194600178.0,6539518.0,0.0430168622,31.675214,0.00199921187,1901760.0,6021120.0,7832852.0,107520.0,15267840.0,494699731.0,4096.0,633373763.0,49325015040.0
75,16,7168,512,256,8,ActivationType.Gelu,torch.bfloat16,torch.bfloat16,torch.bfloat16,QuantType.No,1,0,ck,stage2,32,moe_ck2stages_gemm2_256x32x64x128_1x4_TypeCastExpertWeight_v1_Nswizzle0_Quant0_MulRoutedWeight1_B16_B16_B16,201.1043,0.0,3.28%,14.02,28033.23,754008.625,1792.0,8.90782,126365067.0,48168960.0,0.0,0.0,48168960.0,163413.0,6060791.0,10649546.0,104096099.0,3440041.0,0.573460483,53.340375,0.154690859,2175600.0,3010560.0,10029712.0,752640.0,17169600.0,413928490.0,57344.0,560053929.0,24662507520.0
76,16,7168,512,256,8,ActivationType.Gelu,torch.bfloat16,torch.bfloat16,torch.bfloat16,QuantType.No,1,1,ck,stage1,32,moe_ck2stages_gemm1_256x32x64x64_1x4_TypeCastExpertWeight_v1_Nswizzle0_Quant0_MulRoutedWeight1_gelu_B16_B16_B16,368.2609,0.0,0.00%,7.65,15308.72,1508948.0,128.0,9.552544,228290915.0,96337920.0,0.0,0.0,96337920.0,106814.0,12072648.0,19547988.0,196205179.0,6535102.0,0.0430917566,31.827824,0.000666295064,1901760.0,6021120.0,7848960.0,107520.0,15267840.0,497491834.0,4096.0,635319222.0,49325015040.0
76,16,7168,512,256,8,ActivationType.Gelu,torch.bfloat16,torch.bfloat16,torch.bfloat16,QuantType.No,1,1,ck,stage2,32,moe_ck2stages_gemm2_256x32x64x128_1x4_TypeCast_v1_Nswizzle0_Quant0_MulRoutedWeight0_B16_B16_B16,201.7036,0.0,0.00%,13.97,27949.94,753896.875,1792.0,9.072731,124448570.0,48168960.0,0.0,0.0,48168960.0,152121.0,6059915.0,7562930.0,103659075.0,3401747.0,0.580711849,51.712026,0.23836044,2175600.0,3010560.0,9512272.0,752640.0,17169600.0,375934975.0,57344.0,536176959.0,24662507520.0
77,16,7168,512,256,8,ActivationType.Gelu,torch.bfloat16,torch.float8_e4m3fnuz,torch.float8_e4m3fnuz,QuantType.per_Tensor,1,0,ck,stage1,32,moe_ck2stages_gemm1_256x32x64x256_1x4_MulABScale_v1_Nswizzle0_Quant1_MulRoutedWeight0_gelu_F8_F8_B16,190.1711,50.58433333333333,0.00%,14.82,14823.05,755802.625,128.0,12.230235,86904141.0,0.0,0.0,96337920.0,48168960.0,59878.0,6047494.0,7713890.0,70161476.0,3153977.0,3.700642,27.902202,0.0169159118,1142400.0,3010560.0,4496395.0,4462080.0,12096000.0,92523102.0,4096.0,269146480.0,49325015040.0
77,16,7168,512,256,8,ActivationType.Gelu,torch.bfloat16,torch.float8_e4m3fnuz,torch.float8_e4m3fnuz,QuantType.per_Tensor,1,0,ck,stage2,32,moe_ck2stages_gemm2_256x32x64x256_1x4_MulABScaleExpertWeight_v1_Nswizzle0_Quant1_MulRoutedWeight1_F8_F8_B16,105.1522,50.58433333333333,3.22%,26.8,26807.96,377118.5625,1792.0,11.837953,44399677.0,0.0,0.0,48168960.0,24084480.0,115384.0,3045652.0,6848639.0,30768103.0,1501874.0,1.294903,57.415384,0.193797563,1234800.0,1505280.0,7442512.0,752640.0,9643200.0,195015252.0,57344.0,266973637.0,24662507520.0
78,16,7168,512,256,8,ActivationType.Gelu,torch.bfloat16,torch.float8_e4m3fnuz,torch.float8_e4m3fnuz,QuantType.per_Tensor,1,1,ck,stage1,16,moe_ck2stages_gemm1_256x16x128x256_1x4_MulABScale_v1_Nswizzle0_Quant1_MulRoutedWeight1_gelu_F8_F8_B16,188.7335,51.11833333333337,0.00%,14.93,14935.96,754884.125,128.0,6.383369,74978950.0,0.0,0.0,48168960.0,24084480.0,37964.0,6040101.0,6890146.0,60210239.0,3388496.0,3.395141,13.747449,0.0164184102,426720.0,1505280.0,2173920.0,4408320.0,6343680.0,52272464.0,2048.0,142799756.0,24662507520.0
78,16,7168,512,256,8,ActivationType.Gelu,torch.bfloat16,torch.float8_e4m3fnuz,torch.float8_e4m3fnuz,QuantType.per_Tensor,1,1,ck,stage2,16,moe_ck2stages_gemm2_256x16x128x256_1x4_MulABScaleExpertWeight_v1_Nswizzle0_Quant1_MulRoutedWeight0_F8_F8_B16,108.2015,51.11833333333337,0.00%,26.05,26052.47,376977.125,3584.0,4.185683,63812628.0,0.0,0.0,24084480.0,12042240.0,61816.0,3073245.0,8298993.0,55153615.0,1915439.0,0.658028389,68.894682,0.455355329,382200.0,752640.0,2950528.0,482496.0,3046176.0,218708903.0,28672.0,404133426.0,12331253760.0
79,16,7168,512,256,8,ActivationType.Gelu,torch.bfloat16,torch.float8_e4m3fnuz,torch.float8_e4m3fnuz,QuantType.per_Token,1,0,asm,asm_1stage,32,_ZN5aiter45fmoe_bf16_pertokenFp8_g1u1_vs_gelu_1tg_32x256E,309.0998,0.0,0.00%,9.12,9119.76,1139641.8125,3840.0,9.193767,124556162.0,0.0,0.0,144506880.0,72253440.0,148758.0,9179759.0,16144680.0,103169945.0,4983919.0,0.0,7.921611,0.0673821724,834120.0,4515840.0,10038640.0,0.0,3296160.0,37370179.0,2080.0,120502882.0,73987522560.0
80,16,7168,512,256,8,ActivationType.Gelu,torch.bfloat16,torch.float8_e4m3fnuz,torch.float8_e4m3fnuz,QuantType.per_Token,1,1,asm,stage1,16,_ZN5aiter57fmoe_stage1_bf16_pertokenFp8_doweight_g1u1_16x128_4tg_pf2E,188.6041,39.53077777777786,0.00%,14.94,14946.21,754234.9375,128.0,6.33865,87168733.0,0.0,0.0,48168960.0,24084480.0,80902.0,6034890.0,9962369.0,72282616.0,2795587.0,0.0,16.081345,0.00194176479,201600.0,1505280.0,1928880.0,0.0,1559040.0,127644170.0,4224.0,137842599.0,24662507520.0
80,16,7168,512,256,8,ActivationType.Gelu,torch.bfloat16,torch.float8_e4m3fnuz,torch.float8_e4m3fnuz,QuantType.per_Token,1,1,ck,stage2,16,moe_ck2stages_gemm2_256x16x128x256_1x4_MulABScaleExpertWeight_v1_Nswizzle0_Quant2_MulRoutedWeight0_F8_F8_B16,110.5124,39.53077777777786,0.00%,25.5,25507.69,379894.5,3584.0,4.047789,66552147.0,0.0,0.0,24084480.0,12042240.0,67658.0,3096564.0,6174856.0,57078967.0,1955597.0,0.644408131,60.028233,0.328033837,382200.0,752640.0,4039840.0,482496.0,3046176.0,231348937.0,28672.0,359565694.0,12331253760.0
81,16,7168,512,256,8,ActivationType.Silu,torch.bfloat16,torch.bfloat16,torch.bfloat16,QuantType.No,1,1,ck,stage1,32,moe_ck2stages_gemm1_256x32x64x128_1x4_TypeCastExpertWeight_v1_Nswizzle0_Quant0_MulRoutedWeight1_silu_B16_B16_B16,367.7972,0.0,0.00%,7.66,15328.02,1512039.625,128.0,9.553085,227877868.0,96337920.0,0.0,0.0,96337920.0,85277.0,12097221.0,25650046.0,195733836.0,6536839.0,0.0431340619,28.099281,0.00898285293,1901760.0,6021120.0,8305920.0,107520.0,15267840.0,190822110.0,4096.0,560343182.0,49325015040.0
81,16,7168,512,256,8,ActivationType.Silu,torch.bfloat16,torch.bfloat16,torch.bfloat16,QuantType.No,1,1,ck,stage2,32,moe_ck2stages_gemm2_256x32x64x128_1x4_TypeCast_v1_Nswizzle0_Quant0_MulRoutedWeight0_B16_B16_B16,201.9527,0.0,0.00%,13.96,27915.46,753894.5,1792.0,9.142122,124217994.0,48168960.0,0.0,0.0,48168960.0,152063.0,6059891.0,10373840.0,103393942.0,3427296.0,0.574575756,51.42748,0.187257769,2175600.0,3010560.0,9512272.0,752640.0,17169600.0,377094958.0,57344.0,538921154.0,24662507520.0
82,16,7168,512,256,8,ActivationType.Silu,torch.bfloat16,torch.float8_e4m3fnuz,torch.float8_e4m3fnuz,QuantType.per_Tensor,1,0,ck,stage1,16,moe_ck2stages_gemm1_256x16x128x256_1x4_MulABScale_v1_Nswizzle0_Quant1_MulRoutedWeight0_silu_F8_F8_B16,188.5806,50.495444444444416,0.00%,14.95,14948.07,754826.75,128.0,4.580226,104944829.0,0.0,0.0,48168960.0,24084480.0,36371.0,6039685.0,9216415.0,89920480.0,3434749.0,3.352604,13.892605,0.00928401664,426720.0,1505280.0,2304960.0,4408320.0,6343680.0,53000913.0,2048.0,146138451.0,24662507520.0
82,16,7168,512,256,8,ActivationType.Silu,torch.bfloat16,torch.float8_e4m3fnuz,torch.float8_e4m3fnuz,QuantType.per_Tensor,1,0,ck,stage2,16,moe_ck2stages_gemm2_256x16x128x256_1x4_MulABScaleExpertWeight_v1_Nswizzle0_Quant1_MulRoutedWeight1_F8_F8_B16,107.8421,50.495444444444416,2.75%,26.14,26139.29,377028.25,3584.0,4.134188,64835628.0,0.0,0.0,24084480.0,12042240.0,68363.0,3073631.0,7530070.0,55676153.0,1868628.0,0.6769794,68.659223,0.442344112,382200.0,752640.0,3138688.0,482496.0,3046176.0,207730049.0,28672.0,391477794.0,12331253760.0
83,16,7168,512,256,8,ActivationType.Silu,torch.bfloat16,torch.float8_e4m3fnuz,torch.float8_e4m3fnuz,QuantType.per_Tensor,1,1,ck,stage1,32,moe_ck2stages_gemm1_256x32x64x256_1x4_MulABScale_v1_Nswizzle0_Quant1_MulRoutedWeight1_silu_F8_F8_B16,190.4242,51.46155555555552,0.00%,14.8,14803.35,755912.75,128.0,12.27275,85936928.0,0.0,0.0,96337920.0,48168960.0,58210.0,6048242.0,7422315.0,68994478.0,3313464.0,3.46891,27.900012,0.0107828146,1142400.0,3010560.0,4821600.0,4462080.0,12096000.0,96828900.0,4096.0,287103639.0,49325015040.0
83,16,7168,512,256,8,ActivationType.Silu,torch.bfloat16,torch.float8_e4m3fnuz,torch.float8_e4m3fnuz,QuantType.per_Tensor,1,1,ck,stage2,32,moe_ck2stages_gemm2_256x32x64x256_1x4_MulABScaleExpertWeight_v1_Nswizzle0_Quant1_MulRoutedWeight0_F8_F8_B16,105.4846,51.46155555555552,0.00%,26.72,26723.49,377014.0625,1792.0,10.703571,48167642.0,0.0,0.0,48168960.0,24084480.0,105520.0,3044832.0,5886847.0,36086738.0,1652410.0,1.187087,58.086772,0.260401683,1234800.0,1505280.0,6360592.0,752640.0,9643200.0,221705358.0,57344.0,294626518.0,24662507520.0
84,16,7168,512,256,8,ActivationType.Silu,torch.bfloat16,torch.float8_e4m3fnuz,torch.float8_e4m3fnuz,QuantType.per_Token,1,0,asm,asm_1stage,32,_ZN5aiter48fmoe_bf16_pertokenFp8_g1u1_vs_silu_1tg_ps_32x256E,314.1554,0.0,0.00%,8.97,8973.0,1139765.6875,3584.0,9.046913,126163165.0,0.0,0.0,144506880.0,72253440.0,145333.0,9173957.0,12814670.0,102819987.0,5208250.0,0.0,7.826945,0.0769714307,793800.0,4515840.0,9986328.0,0.0,3188640.0,33345292.0,1216.0,124647550.0,73987522560.0
85,16,7168,512,256,8,ActivationType.Silu,torch.bfloat16,torch.float8_e4m3fnuz,torch.float8_e4m3fnuz,QuantType.per_Token,1,1,asm,asm_1stage,32,_ZN5aiter50fmoe_bf16_pertokenFp8_g1u1_vs_tkw1_silu_1tg_32x256E,313.126,0.0,0.00%,9.0,9002.5,1139809.5,3584.0,9.232695,125294550.0,0.0,0.0,144506880.0,72253440.0,144199.0,9172843.0,13753238.0,102548559.0,5143336.0,0.0,8.024736,0.0922688573,793800.0,4515840.0,9232240.0,0.0,3188640.0,33033340.0,2080.0,125983047.0,73987522560.0
86,16,7168,512,256,8,ActivationType.Silu,torch.bfloat16,torch.bfloat16,torch.bfloat16,QuantType.No,1,0,ck,stage1,32,moe_ck2stages_gemm1_256x32x64x128_1x4_TypeCast_v1_Nswizzle0_Quant0_MulRoutedWeight0_silu_B16_B16_B16,367.5577,0.0,0.00%,7.67,15338.01,1511954.375,128.0,9.593213,228494616.0,96337920.0,0.0,0.0,96337920.0,84872.0,12096428.0,18127330.0,196462099.0,6546298.0,0.0430743856,28.035117,0.0078743358,1901760.0,6021120.0,8255520.0,107520.0,15267840.0,189513271.0,4096.0,559838204.0,49325015040.0
86,16,7168,512,256,8,ActivationType.Silu,torch.bfloat16,torch.bfloat16,torch.bfloat16,QuantType.No,1,0,ck,stage2,32,moe_ck2stages_gemm2_256x32x64x128_1x4_TypeCastExpertWeight_v1_Nswizzle0_Quant0_MulRoutedWeight1_B16_B16_B16,201.8856,0.0,2.76%,13.96,27924.74,754008.625,1792.0,8.964588,125539662.0,48168960.0,0.0,0.0,48168960.0,163393.0,6060794.0,9368338.0,103248289.0,3391104.0,0.580906694,51.882721,0.160717596,2175600.0,3010560.0,10029712.0,752640.0,17169600.0,396758791.0,57344.0,537766380.0,24662507520.0
87,16,7168,512,256,8,ActivationType.Silu,torch.bfloat16,torch.float8_e4m3fnuz,torch.float8_e4m3fnuz,QuantType.per_Tensor,1,0,ck,stage1,32,moe_ck2stages_gemm1_256x32x64x256_1x4_MulABScale_v1_Nswizzle0_Quant1_MulRoutedWeight0_silu_F8_F8_B16,190.3946,50.28200000000001,0.00%,14.8,14805.65,755782.875,128.0,10.092107,105794280.0,0.0,0.0,96337920.0,48168960.0,55116.0,6047306.0,14464825.0,88862893.0,3388375.0,3.436569,27.624058,0.0302835459,1142400.0,3010560.0,4751040.0,4462080.0,12096000.0,99240868.0,4096.0,286939123.0,49325015040.0
87,16,7168,512,256,8,ActivationType.Silu,torch.bfloat16,torch.float8_e4m3fnuz,torch.float8_e4m3fnuz,QuantType.per_Tensor,1,0,ck,stage2,32,moe_ck2stages_gemm2_256x32x64x256_1x4_MulABScaleExpertWeight_v1_Nswizzle0_Quant1_MulRoutedWeight1_F8_F8_B16,105.2415,50.28200000000001,2.69%,26.78,26785.22,377116.75,1792.0,10.964038,48222150.0,0.0,0.0,48168960.0,24084480.0,115311.0,3045624.0,6796529.0,34730148.0,1427374.0,1.378157,57.212966,0.207179437,1234800.0,1505280.0,7442512.0,752640.0,9643200.0,180782829.0,57344.0,249961524.0,24662507520.0
88,16,7168,512,256,8,ActivationType.Silu,torch.bfloat16,torch.float8_e4m3fnuz,torch.float8_e4m3fnuz,QuantType.per_Tensor,1,1,ck,stage1,16,moe_ck2stages_gemm1_256x16x128x256_1x4_MulABScale_v1_Nswizzle0_Quant1_MulRoutedWeight1_silu_F8_F8_B16,189.0619,51.00744444444442,0.00%,14.91,14910.02,754885.125,128.0,4.768504,98026267.0,0.0,0.0,48168960.0,24084480.0,36698.0,6040112.0,10187429.0,83034481.0,3336847.0,3.463368,13.8021,0.0096952338,426720.0,1505280.0,2333520.0,4408320.0,6343680.0,50917548.0,2048.0,140543133.0,24662507520.0
88,16,7168,512,256,8,ActivationType.Silu,torch.bfloat16,torch.float8_e4m3fnuz,torch.float8_e4m3fnuz,QuantType.per_Tensor,1,1,ck,stage2,16,moe_ck2stages_gemm2_256x16x128x256_1x4_MulABScaleExpertWeight_v1_Nswizzle0_Quant1_MulRoutedWeight0_F8_F8_B16,108.2599,51.00744444444442,0.00%,26.04,26038.42,376976.75,3584.0,4.676617,58340274.0,0.0,0.0,24084480.0,12042240.0,61528.0,3073214.0,5603897.0,49538498.0,1890762.0,0.664344091,68.574807,0.425651198,382200.0,752640.0,2950528.0,482496.0,3046176.0,214535441.0,28672.0,398432928.0,12331253760.0
90,16,7168,512,256,8,ActivationType.Silu,torch.bfloat16,torch.float8_e4m3fnuz,torch.float8_e4m3fnuz,QuantType.per_Token,1,1,asm,stage1,16,_ZN5aiter57fmoe_stage1_bf16_pertokenFp8_doweight_g1u1_16x128_4tg_pf2E,188.399,39.27733333333343,0.02%,14.96,14962.48,754271.125,128.0,6.976954,79442124.0,0.0,0.0,48168960.0,24084480.0,80586.0,6035014.0,9871513.0,64536492.0,2353789.0,0.0,15.98996,0.00264730798,201600.0,1505280.0,1912080.0,0.0,1559040.0,105598973.0,4224.0,115679673.0,24662507520.0
90,16,7168,512,256,8,ActivationType.Silu,torch.bfloat16,torch.float8_e4m3fnuz,torch.float8_e4m3fnuz,QuantType.per_Token,1,1,ck,stage2,16,moe_ck2stages_gemm2_256x16x128x256_1x4_MulABScaleExpertWeight_v1_Nswizzle0_Quant2_MulRoutedWeight0_F8_F8_B16,110.1601,39.27733333333343,0.00%,25.59,25589.27,379891.375,3584.0,4.170225,64651074.0,0.0,0.0,24084480.0,12042240.0,67721.0,3096548.0,7926124.0,55237079.0,1900955.0,0.660616637,60.129076,0.337338296,382200.0,752640.0,4039840.0,482496.0,3046176.0,225751283.0,28672.0,351332827.0,12331253760.0
93,16,7168,512,256,8,ActivationType.Gelu,torch.bfloat16,torch.float8_e4m3fnuz,torch.float8_e4m3fnuz,QuantType.per_Token,1,0,asm,asm_1stage,32,_ZN5aiter48fmoe_bf16_pertokenFp8_g1u1_vs_gelu_1tg_ps_32x256E,313.2238,0.0,0.00%,9.0,8999.69,1139439.625,3584.0,9.356872,122715991.0,0.0,0.0,144506880.0,72253440.0,146158.0,9175550.0,15158358.0,99501627.0,4866855.0,0.0,7.958913,0.0494711067,793800.0,4515840.0,10066968.0,0.0,3188640.0,32058031.0,1216.0,118136129.0,73987522560.0
94,16,7168,512,256,8,ActivationType.Gelu,torch.bfloat16,torch.float8_e4m3fnuz,torch.float8_e4m3fnuz,QuantType.per_Token,1,1,asm,asm_1stage,32,_ZN5aiter53fmoe_bf16_pertokenFp8_g1u1_vs_tkw1_gelu_1tg_ps_32x512E,324.8761,0.0,0.00%,8.68,8676.9,1135478.25,1792.0,9.283862,63220685.0,0.0,0.0,144506880.0,72253440.0,142692.0,9112716.0,1530235.0,41337982.0,5100532.0,0.0,4.065171,0.013333191,406980.0,4515840.0,7228188.0,0.0,1627920.0,3646388.0,1216.0,63652722.0,73987522560.0
95,16,7168,512,256,8,ActivationType.Gelu,torch.bfloat16,torch.float8_e4m3fnuz,torch.float8_e4m3fnuz,QuantType.per_1x128,1,0,asm,asm_1stage,32,_ZN5aiter47fmoe_bf16_blockscaleFp8_g1u1_vs_gelu_1tg_32x256E,317.4735,0.0,9.77%,8.88,8879.22,1134120.125,3840.0,12.377787,93101069.0,0.0,0.0,144506880.0,72253440.0,180257.0,9137265.0,12541404.0,70400804.0,3727165.0,0.0,7.88083,0.113303646,945840.0,4515840.0,11613640.0,0.0,3548160.0,27524261.0,2080.0,90694931.0,73987522560.0
96,16,7168,512,256,8,ActivationType.Silu,torch.bfloat16,torch.float8_e4m3fnuz,torch.float8_e4m3fnuz,QuantType.per_1x128,1,0,asm,asm_1stage,32,_ZN5aiter50fmoe_bf16_blockscaleFp8_g1u1_vs_silu_1tg_ps_32x256E,318.3491,0.0,0.00%,8.85,8854.8,1134040.0625,3840.0,10.284472,112511095.0,0.0,0.0,144506880.0,72253440.0,182299.0,9136230.0,12164044.0,89773210.0,4415580.0,0.0,7.988884,0.10984267,945840.0,4515840.0,11588208.0,0.0,3548160.0,34707490.0,1216.0,108969101.0,73987522560.0
97,16,7168,512,256,8,ActivationType.Gelu,torch.bfloat16,torch.float8_e4m3fnuz,torch.float8_e4m3fnuz,QuantType.per_1x128,1,1,ck,stage1,16,moe_ck2stages_gemm1_256x16x128x256_1x4_MulABScaleExpertWeightA8W8blkscale_v1_Nswizzle0_Quant4_MulRoutedWeight1_gelu_F8_F8_B16,197.5431,42.96199999999999,0.02%,14.27,14269.88,756160.375,128.0,4.927876,95258967.0,0.0,0.0,48168960.0,24084480.0,62568.0,6050284.0,6835791.0,78034524.0,3329782.0,3.558924,13.960438,0.00715468685,423360.0,1505280.0,3111360.0,4569600.0,6504960.0,61369546.0,2048.0,143399780.0,24662507520.0
97,16,7168,512,256,8,ActivationType.Gelu,torch.bfloat16,torch.float8_e4m3fnuz,torch.float8_e4m3fnuz,QuantType.per_1x128,1,1,ck,stage2,16,moe_ck2stages_gemm2_256x16x128x256_1x4_MulABScaleExpertWeightA8W8blkscale_v1_Nswizzle0_Quant4_MulRoutedWeight0_F8_F8_B16,107.3377,42.96199999999999,16.61%,26.26,26262.13,377729.6875,1792.0,4.569205,58569888.0,0.0,0.0,24084480.0,12042240.0,62481.0,3050565.0,6993993.0,47743777.0,1954378.0,5.534874,47.778272,0.226062316,335160.0,752640.0,3344936.0,4139520.0,6703200.0,147802782.0,28672.0,285866101.0,12331253760.0
98,16,7168,512,256,8,ActivationType.Silu,torch.bfloat16,torch.float8_e4m3fnuz,torch.float8_e4m3fnuz,QuantType.per_1x128,1,1,ck,stage1,16,moe_ck2stages_gemm1_256x16x128x256_1x4_MulABScaleExpertWeightA8W8blkscale_v1_Nswizzle0_Quant4_MulRoutedWeight1_silu_F8_F8_B16,197.1368,42.36577777777763,0.00%,14.3,14299.29,756128.625,128.0,4.518555,105861771.0,0.0,0.0,48168960.0,24084480.0,58963.0,6050164.0,9867153.0,88404682.0,3496114.0,3.423621,13.857475,0.0110535696,423360.0,1505280.0,3234000.0,4569600.0,6504960.0,62899151.0,2048.0,147967591.0,24662507520.0
98,16,7168,512,256,8,ActivationType.Silu,torch.bfloat16,torch.float8_e4m3fnuz,torch.float8_e4m3fnuz,QuantType.per_1x128,1,1,ck,stage2,16,moe_ck2stages_gemm2_256x16x128x256_1x4_MulABScaleExpertWeightA8W8blkscale_v1_Nswizzle0_Quant4_MulRoutedWeight0_F8_F8_B16,107.2264,42.36577777777763,16.71%,26.29,26289.39,377727.75,1792.0,4.190412,64146119.0,0.0,0.0,24084480.0,12042240.0,62496.0,3050542.0,7616235.0,53277091.0,1908936.0,5.667662,48.851777,0.194207717,335160.0,752640.0,3344936.0,4139520.0,6703200.0,148483754.0,28672.0,285441009.0,12331253760.0
100,16,7168,512,256,8,ActivationType.Gelu,torch.bfloat16,torch.float8_e4m3fnuz,torch.float8_e4m3fnuz,QuantType.per_1x128,1,0,asm,asm_1stage,32,_ZN5aiter50fmoe_bf16_blockscaleFp8_g1u1_vs_gelu_1tg_ps_32x256E,319.2976,0.0,9.74%,8.83,8828.49,1133871.875,3840.0,11.140182,104580752.0,0.0,0.0,144506880.0,72253440.0,186629.0,9135412.0,10715818.0,81788759.0,3746454.0,0.0,8.049881,0.0938884286,945840.0,4515840.0,11668848.0,0.0,3548160.0,28452619.0,1216.0,92633571.0,73987522560.0
103,16,7168,2048,33,10,ActivationType.Silu,torch.bfloat16,torch.float8_e4m3fnuz,torch.float8_e4m3fnuz,QuantType.per_1x128,1,0,asm,asm_1stage,32,_ZN5aiter47fmoe_bf16_blockscaleFp8_g1u1_vs_silu_1tg_32x128E,387.8532,0.0,0.00%,36.34,3747.99,1422960.4375,35840.0,9.773005,194930038.0,0.0,0.0,181665792.0,90832896.0,369041.0,11956981.0,18788640.0,160770060.0,6085078.0,0.0,10.538681,0.227462763,2215488.0,5677056.0,18500096.0,0.0,8422656.0,148274580.0,2432.0,195714826.0,93012885504.0
104,16,7168,2048,33,10,ActivationType.Silu,torch.bfloat16,torch.float8_e4m3fnuz,torch.float8_e4m3fnuz,QuantType.per_Token,1,0,asm,asm_1stage,32,_ZN5aiter45fmoe_bf16_pertokenFp8_g1u1_vs_silu_1tg_32x512E,374.6276,0.0,0.00%,37.62,3880.31,1434228.0625,9600.0,9.21223,99982803.0,0.0,0.0,181665792.0,90832896.0,145135.0,11626311.0,11969591.0,74892841.0,6333713.0,0.0,5.181225,0.0436767889,536976.0,5677056.0,9329504.0,0.0,2114112.0,4446191.0,608.0,100235608.0,93012885504.0
105,32,2048,192,128,8,ActivationType.Silu,torch.bfloat16,torch.bfloat16,torch.bfloat16,QuantType.No,1,0,ck,stage1,32,moe_ck2stages_gemm1_256x32x64x64_1x4_TypeCast_v1_Nswizzle0_Quant0_MulRoutedWeight0_silu_B16_B16_B16,50.0451,0.0,0.00%,12.07,6039.59,173168.875,96.0,6.564999,34276435.0,11010048.0,0.0,0.0,11010048.0,31581.0,1386138.0,5463121.0,29121116.0,1068147.0,0.104426349,11.339125,0.00302173063,223104.0,688128.0,1228416.0,43008.0,1806336.0,33791390.0,1632.0,37360155.0,5637144576.0
105,32,2048,192,128,8,ActivationType.Silu,torch.bfloat16,torch.bfloat16,torch.bfloat16,QuantType.No,1,0,ck,stage2,32,moe_ck2stages_gemm2_256x32x64x64_1x4_TypeCastExpertWeight_v1_Nswizzle0_Quant0_MulRoutedWeight1_B16_B16_B16,33.2572,0.0,0.00%,18.16,9088.32,87215.375,1024.0,7.503618,11884448.0,5505024.0,0.0,0.0,5505024.0,50198.0,714041.0,1162359.0,7839414.0,475933.0,1.225238,50.89417,0.0936251664,304640.0,344064.0,1854656.0,229376.0,2365440.0,52115254.0,17408.0,76222888.0,2818572288.0
106,32,2048,192,128,8,ActivationType.Silu,torch.bfloat16,torch.bfloat16,torch.bfloat16,QuantType.No,1,1,ck,stage1,32,moe_ck2stages_gemm1_256x32x64x64_1x4_TypeCastExpertWeight_v1_Nswizzle0_Quant0_MulRoutedWeight1_silu_B16_B16_B16,50.3861,0.0,0.00%,11.99,5998.72,173213.25,96.0,6.645174,33866664.0,11010048.0,0.0,0.0,11010048.0,33434.0,1386548.0,4479936.0,28586757.0,1472147.0,0.0757938048,11.734903,0.00217646366,223104.0,688128.0,1248576.0,43008.0,1806336.0,49692318.0,1632.0,53270288.0,5637144576.0
106,32,2048,192,128,8,ActivationType.Silu,torch.bfloat16,torch.bfloat16,torch.bfloat16,QuantType.No,1,1,ck,stage2,32,moe_ck2stages_gemm2_256x32x64x64_1x4_TypeCast_v1_Nswizzle0_Quant0_MulRoutedWeight0_B16_B16_B16,32.2285,0.0,0.00%,18.74,9378.41,87089.375,1024.0,7.640128,11764270.0,5505024.0,0.0,0.0,5505024.0,47002.0,713160.0,1187833.0,8228175.0,455850.0,1.277408,50.314883,0.139407368,304640.0,344064.0,1696960.0,229376.0,2365440.0,49532646.0,17408.0,72277805.0,2818572288.0
107,32,2048,192,128,8,ActivationType.Gelu,torch.bfloat16,torch.bfloat16,torch.bfloat16,QuantType.No,1,0,ck,stage1,32,moe_ck2stages_gemm1_256x32x64x64_1x4_TypeCast_v1_Nswizzle0_Quant0_MulRoutedWeight0_gelu_B16_B16_B16,49.164,0.0,0.00%,12.29,6147.83,173172.75,96.0,4.804319,48265247.0,11010048.0,0.0,0.0,11010048.0,33928.0,1386210.0,7630400.0,43008232.0,1088800.0,0.102702473,11.371243,0.00294916189,223104.0,688128.0,1116269.0,43008.0,1806336.0,34721858.0,1632.0,38094849.0,5637144576.0
107,32,2048,192,128,8,ActivationType.Gelu,torch.bfloat16,torch.bfloat16,torch.bfloat16,QuantType.No,1,0,ck,stage2,32,moe_ck2stages_gemm2_256x32x64x64_1x4_TypeCastExpertWeight_v1_Nswizzle0_Quant0_MulRoutedWeight1_B16_B16_B16,32.4931,0.0,0.00%,18.59,9302.04,87215.5,1024.0,7.458127,12350899.0,5505024.0,0.0,0.0,5505024.0,50116.0,714071.0,1156363.0,8389571.0,474424.0,1.232705,50.506754,0.142595452,304640.0,344064.0,1854656.0,229376.0,2365440.0,51718215.0,17408.0,75184499.0,2818572288.0
108,32,2048,192,128,8,ActivationType.Gelu,torch.bfloat16,torch.bfloat16,torch.bfloat16,QuantType.No,1,1,ck,stage1,32,moe_ck2stages_gemm1_256x32x64x64_1x4_TypeCastExpertWeight_v1_Nswizzle0_Quant0_MulRoutedWeight1_gelu_B16_B16_B16,49.5337,0.0,0.00%,12.19,6101.95,173222.0625,96.0,6.52695,34511110.0,11010048.0,0.0,0.0,11010048.0,36769.0,1386571.0,6479455.0,29106168.0,1211083.0,0.0926560115,11.434387,0.00266067183,223104.0,688128.0,1150464.0,43008.0,1806336.0,39040969.0,1632.0,42459858.0,5637144576.0
108,32,2048,192,128,8,ActivationType.Gelu,torch.bfloat16,torch.bfloat16,torch.bfloat16,QuantType.No,1,1,ck,stage2,32,moe_ck2stages_gemm2_256x32x64x64_1x4_TypeCast_v1_Nswizzle0_Quant0_MulRoutedWeight0_B16_B16_B16,31.7498,0.0,0.00%,19.02,9519.81,87091.75,1024.0,7.966001,11219476.0,5505024.0,0.0,0.0,5505024.0,46954.0,713200.0,1224082.0,7737514.0,465034.0,1.2781,52.051376,0.12164394,304640.0,344064.0,1696960.0,229376.0,2365440.0,53322029.0,17408.0,74731785.0,2818572288.0
109,32,4096,192,128,8,ActivationType.Silu,torch.bfloat16,torch.bfloat16,torch.bfloat16,QuantType.No,1,0,ck,stage1,32,moe_ck2stages_gemm1_256x32x64x64_1x4_TypeCast_v1_Nswizzle0_Quant0_MulRoutedWeight0_silu_B16_B16_B16,91.6801,0.0,0.00%,13.18,6593.62,346314.875,96.0,6.951677,69333434.0,22020096.0,0.0,0.0,22020096.0,47401.0,2771032.0,12382238.0,60719860.0,2064605.0,0.0543989373,12.181079,0.00156209746,438144.0,1376256.0,2024064.0,43008.0,3526656.0,70822561.0,1632.0,77043247.0,11274289152.0
109,32,4096,192,128,8,ActivationType.Silu,torch.bfloat16,torch.bfloat16,torch.bfloat16,QuantType.No,1,0,ck,stage2,32,moe_ck2stages_gemm2_256x32x64x64_1x4_TypeCastExpertWeight_v1_Nswizzle0_Quant0_MulRoutedWeight1_B16_B16_B16,55.8644,0.0,0.06%,21.62,10820.92,173278.875,2048.0,8.472033,25163735.0,11010048.0,0.0,0.0,11010048.0,93703.0,1419000.0,5441827.0,18062416.0,850446.0,1.383893,69.554828,0.217056876,609280.0,688128.0,3713408.0,458752.0,4730880.0,134941924.0,34816.0,184455931.0,5637144576.0
110,32,4096,192,128,8,ActivationType.Silu,torch.bfloat16,torch.bfloat16,torch.bfloat16,QuantType.No,1,1,ck,stage1,32,moe_ck2stages_gemm1_256x32x64x64_1x4_TypeCastExpertWeight_v1_Nswizzle0_Quant0_MulRoutedWeight1_silu_B16_B16_B16,92.3092,0.0,0.00%,13.09,6548.69,346413.125,96.0,7.1789,67970729.0,22020096.0,0.0,0.0,22020096.0,49081.0,2771602.0,9156017.0,59185434.0,2016668.0,0.0554353105,12.223533,0.00160410258,438144.0,1376256.0,2044224.0,43008.0,3526656.0,69619972.0,1632.0,75866405.0,11274289152.0
110,32,4096,192,128,8,ActivationType.Silu,torch.bfloat16,torch.bfloat16,torch.bfloat16,QuantType.No,1,1,ck,stage2,32,moe_ck2stages_gemm2_256x32x64x64_1x4_TypeCast_v1_Nswizzle0_Quant0_MulRoutedWeight0_B16_B16_B16,54.9354,0.0,0.00%,21.99,11003.91,173159.375,2048.0,8.169332,26427895.0,11010048.0,0.0,0.0,11010048.0,86626.0,1418017.0,5316375.0,20237776.0,919721.0,1.305861,73.189105,0.309552397,609280.0,688128.0,3398016.0,458752.0,4730880.0,154792177.0,34816.0,205692065.0,5637144576.0
111,32,4096,192,128,8,ActivationType.Gelu,torch.bfloat16,torch.bfloat16,torch.bfloat16,QuantType.No,1,0,ck,stage1,32,moe_ck2stages_gemm1_256x32x64x64_1x4_TypeCast_v1_Nswizzle0_Quant0_MulRoutedWeight0_gelu_B16_B16_B16,91.5821,0.0,0.00%,13.19,6600.68,346320.625,96.0,7.180579,67453464.0,22020096.0,0.0,0.0,22020096.0,49732.0,2771111.0,10267818.0,58960851.0,1996062.0,0.0560833773,12.305785,0.00161046714,438144.0,1376256.0,1933974.0,43008.0,3526656.0,69408681.0,1632.0,75494344.0,11274289152.0
111,32,4096,192,128,8,ActivationType.Gelu,torch.bfloat16,torch.bfloat16,torch.bfloat16,QuantType.No,1,0,ck,stage2,32,moe_ck2stages_gemm2_256x32x64x64_1x4_TypeCastExpertWeight_v1_Nswizzle0_Quant0_MulRoutedWeight1_B16_B16_B16,55.9674,0.0,0.11%,21.58,10801.0,173266.9375,2048.0,8.435881,26068090.0,11010048.0,0.0,0.0,11010048.0,93589.0,1419035.0,5513920.0,18997050.0,910260.0,1.297217,71.46561,0.244025617,609280.0,688128.0,3713408.0,458752.0,4730880.0,150177452.0,34816.0,202186615.0,5637144576.0
112,32,4096,192,128,8,ActivationType.Gelu,torch.bfloat16,torch.bfloat16,torch.bfloat16,QuantType.No,1,1,ck,stage1,32,moe_ck2stages_gemm1_256x32x64x64_1x4_TypeCastExpertWeight_v1_Nswizzle0_Quant0_MulRoutedWeight1_gelu_B16_B16_B16,90.957,0.0,0.00%,13.28,6646.04,346339.875,96.0,7.02454,69174471.0,22020096.0,0.0,0.0,22020096.0,52003.0,2772041.0,9516954.0,60339043.0,2037285.0,0.0551879212,12.101588,0.0015847536,438144.0,1376256.0,1946112.0,43008.0,3526656.0,69378365.0,1632.0,75446232.0,11274289152.0
112,32,4096,192,128,8,ActivationType.Gelu,torch.bfloat16,torch.bfloat16,torch.bfloat16,QuantType.No,1,1,ck,stage2,32,moe_ck2stages_gemm2_256x32x64x64_1x4_TypeCast_v1_Nswizzle0_Quant0_MulRoutedWeight0_B16_B16_B16,54.7948,0.0,0.00%,22.05,11032.14,173146.6875,2048.0,8.359167,26733619.0,11010048.0,0.0,0.0,11010048.0,86498.0,1418034.0,5707320.0,20520695.0,906961.0,1.313556,69.040161,0.272831925,609280.0,688128.0,3398016.0,458752.0,4730880.0,148317749.0,34816.0,192895073.0,5637144576.0
113,32,4096,384,128,8,ActivationType.Gelu,torch.bfloat16,torch.bfloat16,torch.bfloat16,QuantType.No,1,0,ck,stage1,32,moe_ck2stages_gemm1_256x32x64x64_1x4_TypeCast_v1_Nswizzle0_Quant0_MulRoutedWeight0_gelu_B16_B16_B16,179.6928,0.0,0.00%,13.44,6725.28,679600.625,192.0,8.441817,112187378.0,43253760.0,0.0,0.0,43253760.0,86264.0,5438291.0,13822002.0,97128675.0,3388262.0,0.065029716,23.656248,0.00114079118,860640.0,2703360.0,3800913.0,84480.0,6927360.0,219181773.0,3264.0,245854352.0,22145925120.0
113,32,4096,384,128,8,ActivationType.Gelu,torch.bfloat16,torch.bfloat16,torch.bfloat16,QuantType.No,1,0,ck,stage2,32,moe_ck2stages_gemm2_256x32x64x128_1x4_TypeCastExpertWeight_v1_Nswizzle0_Quant0_MulRoutedWeight1_B16_B16_B16,96.4728,0.0,0.50%,25.04,12526.68,340207.75,2048.0,7.745149,62140902.0,21626880.0,0.0,0.0,21626880.0,153562.0,2754483.0,11075024.0,50161788.0,1862732.0,0.625830904,47.975552,0.254951504,1020800.0,1351680.0,5596288.0,450560.0,8025600.0,201008605.0,34816.0,276315721.0,11072962560.0
114,32,4096,384,128,8,ActivationType.Gelu,torch.bfloat16,torch.bfloat16,torch.bfloat16,QuantType.No,1,1,ck,stage1,32,moe_ck2stages_gemm1_256x32x64x64_1x4_TypeCastExpertWeight_v1_Nswizzle0_Quant0_MulRoutedWeight1_gelu_B16_B16_B16,179.9599,0.0,0.00%,13.42,6715.3,679706.375,192.0,8.240919,111591859.0,43253760.0,0.0,0.0,43253760.0,88933.0,5439153.0,10541311.0,96103247.0,3339138.0,0.0661825895,23.74968,0.001168458,860640.0,2703360.0,3822720.0,84480.0,6927360.0,215919388.0,3264.0,242525773.0,22145925120.0
114,32,4096,384,128,8,ActivationType.Gelu,torch.bfloat16,torch.bfloat16,torch.bfloat16,QuantType.No,1,1,ck,stage2,32,moe_ck2stages_gemm2_256x32x64x128_1x4_TypeCast_v1_Nswizzle0_Quant0_MulRoutedWeight0_B16_B16_B16,96.4333,0.0,0.00%,25.05,12531.81,340069.875,2048.0,7.690725,63602984.0,21626880.0,0.0,0.0,21626880.0,147228.0,2753393.0,9288836.0,52601260.0,1905508.0,0.617984173,49.581056,0.333388581,1020800.0,1351680.0,5286528.0,450560.0,8025600.0,206214379.0,34816.0,289188512.0,11072962560.0
115,32,4096,384,128,8,ActivationType.Silu,torch.bfloat16,torch.bfloat16,torch.bfloat16,QuantType.No,1,0,ck,stage1,32,moe_ck2stages_gemm1_256x32x64x64_1x4_TypeCast_v1_Nswizzle0_Quant0_MulRoutedWeight0_silu_B16_B16_B16,180.3365,0.0,0.00%,13.4,6701.27,679582.0,192.0,8.436572,110520174.0,43253760.0,0.0,0.0,43253760.0,83932.0,5438259.0,7532096.0,95302185.0,3520302.0,0.0628253487,23.759951,0.0011091857,860640.0,2703360.0,3975840.0,84480.0,6927360.0,227427696.0,3264.0,255596274.0,22145925120.0
115,32,4096,384,128,8,ActivationType.Silu,torch.bfloat16,torch.bfloat16,torch.bfloat16,QuantType.No,1,0,ck,stage2,32,moe_ck2stages_gemm2_256x32x64x128_1x4_TypeCastExpertWeight_v1_Nswizzle0_Quant0_MulRoutedWeight1_B16_B16_B16,96.6424,0.0,0.38%,25.0,12504.7,340204.75,2048.0,7.695284,63472622.0,21626880.0,0.0,0.0,21626880.0,153525.0,2754477.0,9301237.0,51575655.0,1901121.0,0.620127725,49.662063,0.240520397,1020800.0,1351680.0,5596288.0,450560.0,8025600.0,211612372.0,34816.0,288659748.0,11072962560.0
116,32,4096,384,128,8,ActivationType.Silu,torch.bfloat16,torch.bfloat16,torch.bfloat16,QuantType.No,1,1,ck,stage1,32,moe_ck2stages_gemm1_256x32x64x64_1x4_TypeCastExpertWeight_v1_Nswizzle0_Quant0_MulRoutedWeight1_silu_B16_B16_B16,180.8169,0.0,0.00%,13.36,6683.47,679675.625,192.0,8.36031,111577948.0,43253760.0,0.0,0.0,43253760.0,85511.0,5438956.0,12666481.0,96196197.0,3407214.0,0.0649529583,23.795331,0.00113214052,860640.0,2703360.0,4015440.0,84480.0,6927360.0,219845912.0,3264.0,247592051.0,22145925120.0
116,32,4096,384,128,8,ActivationType.Silu,torch.bfloat16,torch.bfloat16,torch.bfloat16,QuantType.No,1,1,ck,stage2,32,moe_ck2stages_gemm2_256x32x64x128_1x4_TypeCast_v1_Nswizzle0_Quant0_MulRoutedWeight0_B16_B16_B16,96.3993,0.0,0.00%,25.06,12536.23,340070.25,2048.0,7.817939,62416602.0,21626880.0,0.0,0.0,21626880.0,147144.0,2753413.0,10485718.0,51434345.0,1845044.0,0.636285107,48.47677,0.316966183,1020800.0,1351680.0,5286528.0,450560.0,8025600.0,194126531.0,34816.0,274615176.0,11072962560.0
117,32,4096,384,128,8,ActivationType.Silu,torch.bfloat16,torch.float8_e4m3fnuz,torch.float8_e4m3fnuz,QuantType.per_Tensor,1,0,ck,stage1,16,moe_ck2stages_gemm1_128x16x64x128_1x2_MulABScale_v1_Nswizzle0_Quant1_MulRoutedWeight0_silu_F8_F8_B16,94.0263,61.0176666666665,0.00%,25.69,6427.7,339659.625,192.0,3.833527,48206401.0,0.0,0.0,21626880.0,10813440.0,58532.0,2718891.0,8605245.0,50164541.0,1796568.0,2.924923,11.388781,0.00220200136,216480.0,675840.0,1273800.0,2006400.0,3062400.0,56871105.0,1728.0,62498611.0,11072962560.0
117,32,4096,384,128,8,ActivationType.Silu,torch.bfloat16,torch.float8_e4m3fnuz,torch.float8_e4m3fnuz,QuantType.per_Tensor,1,0,ck,stage2,16,moe_ck2stages_gemm2_128x16x128x128_1x2_MulABScaleExpertWeight_v1_Nswizzle0_Quant1_MulRoutedWeight1_F8_F8_B16,57.5907,61.0176666666665,0.39%,41.95,10494.28,170110.125,8192.0,3.768831,27685415.0,0.0,0.0,10813440.0,5406720.0,52892.0,1492013.0,4468661.0,23117451.0,917786.0,3.606069,33.561765,0.666046227,179520.0,337920.0,1764864.0,1282464.0,2225824.0,53963949.0,9216.0,95487379.0,5536481280.0
118,32,4096,384,128,8,ActivationType.Silu,torch.bfloat16,torch.float8_e4m3fnuz,torch.float8_e4m3fnuz,QuantType.per_Tensor,1,1,ck,stage1,16,moe_ck2stages_gemm1_128x16x64x128_1x2_MulABScale_v1_Nswizzle0_Quant1_MulRoutedWeight1_silu_F8_F8_B16,93.7309,60.795555555555616,0.00%,25.78,6447.96,339715.625,192.0,3.812735,48673362.0,0.0,0.0,21626880.0,10813440.0,58303.0,2719137.0,6934655.0,50342355.0,1808023.0,2.883368,11.348536,0.00217071722,216480.0,675840.0,1296240.0,2006400.0,3062400.0,57460233.0,1728.0,63175300.0,11072962560.0
118,32,4096,384,128,8,ActivationType.Silu,torch.bfloat16,torch.float8_e4m3fnuz,torch.float8_e4m3fnuz,QuantType.per_Tensor,1,1,ck,stage2,16,moe_ck2stages_gemm2_128x16x128x128_1x2_MulABScaleExpertWeight_v1_Nswizzle0_Quant1_MulRoutedWeight0_F8_F8_B16,57.4736,60.795555555555616,0.00%,42.04,10515.66,170057.125,8192.0,3.726098,27957485.0,0.0,0.0,10813440.0,5406720.0,49970.0,1491575.0,4327896.0,23536127.0,957360.0,3.475472,32.807586,0.587062233,179520.0,337920.0,1680384.0,1282464.0,2225824.0,54882172.0,9216.0,96849128.0,5536481280.0
119,32,4096,384,128,8,ActivationType.Silu,torch.bfloat16,torch.float8_e4m3fnuz,torch.float8_e4m3fnuz,QuantType.per_Token,1,0,asm,asm_1stage,32,_ZN5aiter45fmoe_bf16_pertokenFp8_g1u1_vs_silu_1tg_32x192E,147.6609,0.0,0.00%,16.36,4092.98,514081.25,4608.0,8.752418,60290058.0,0.0,0.0,64880640.0,32440320.0,132082.0,4184548.0,8469515.0,49679305.0,2400786.0,0.0,8.147257,0.0961624419,530640.0,2027520.0,5422000.0,0.0,2083840.0,43300330.0,1088.0,59844217.0,33218887680.0
120,32,4096,384,128,8,ActivationType.Silu,torch.bfloat16,torch.float8_e4m3fnuz,torch.float8_e4m3fnuz,QuantType.per_Token,1,1,asm,asm_1stage,32,_ZN5aiter50fmoe_bf16_pertokenFp8_g1u1_vs_tkw1_silu_1tg_32x192E,149.9322,0.0,0.00%,16.11,4030.98,513976.125,4096.0,8.780071,59941403.0,0.0,0.0,64880640.0,32440320.0,128586.0,4177289.0,7404352.0,48574797.0,2459627.0,0.0,8.037751,0.104190577,488400.0,2027520.0,4985520.0,0.0,1971200.0,39761722.0,1088.0,60465090.0,33218887680.0
121,32,4096,384,128,8,ActivationType.Gelu,torch.bfloat16,torch.float8_e4m3fnuz,torch.float8_e4m3fnuz,QuantType.per_Tensor,1,0,ck,stage1,16,moe_ck2stages_gemm1_128x16x64x128_1x2_MulABScale_v1_Nswizzle0_Quant1_MulRoutedWeight0_gelu_F8_F8_B16,94.0213,59.86544444444444,0.00%,25.7,6428.04,339655.5,192.0,3.921225,48136186.0,0.0,0.0,21626880.0,10813440.0,59863.0,2718868.0,8578520.0,49131291.0,1855656.0,2.818995,11.275287,0.00221568728,216480.0,675840.0,1194051.0,2006400.0,3062400.0,58479184.0,1728.0,64200859.0,11072962560.0
121,32,4096,384,128,8,ActivationType.Gelu,torch.bfloat16,torch.float8_e4m3fnuz,torch.float8_e4m3fnuz,QuantType.per_Tensor,1,0,ck,stage2,16,moe_ck2stages_gemm2_128x16x128x128_1x2_MulABScaleExpertWeight_v1_Nswizzle0_Quant1_MulRoutedWeight1_F8_F8_B16,57.4395,59.86544444444444,0.52%,42.06,10521.91,170109.125,8192.0,3.817104,27795630.0,0.0,0.0,10813440.0,5406720.0,52930.0,1491980.0,4616800.0,23306435.0,939366.0,3.516757,33.308109,0.576555961,179520.0,337920.0,1764864.0,1282464.0,2225824.0,54249928.0,9216.0,97172363.0,5536481280.0
122,32,4096,384,128,8,ActivationType.Gelu,torch.bfloat16,torch.float8_e4m3fnuz,torch.float8_e4m3fnuz,QuantType.per_Tensor,1,1,ck,stage1,16,moe_ck2stages_gemm1_128x16x64x128_1x2_MulABScale_v1_Nswizzle0_Quant1_MulRoutedWeight1_gelu_F8_F8_B16,93.4152,59.980555555555576,0.00%,25.86,6469.75,339726.0,192.0,4.026001,47810131.0,0.0,0.0,21626880.0,10813440.0,62235.0,2719415.0,8751058.0,48382814.0,1796790.0,2.898233,11.331184,0.00220935339,216480.0,675840.0,1170840.0,2006400.0,3062400.0,57102701.0,1728.0,62755179.0,11072962560.0
122,32,4096,384,128,8,ActivationType.Gelu,torch.bfloat16,torch.float8_e4m3fnuz,torch.float8_e4m3fnuz,QuantType.per_Tensor,1,1,ck,stage2,16,moe_ck2stages_gemm2_128x16x128x128_1x2_MulABScaleExpertWeight_v1_Nswizzle0_Quant1_MulRoutedWeight0_F8_F8_B16,57.5557,59.980555555555576,0.00%,41.98,10500.66,170057.25,8192.0,3.783487,28288270.0,0.0,0.0,10813440.0,5406720.0,49948.0,1491568.0,5406858.0,23860126.0,944944.0,3.534821,33.91141,0.692346768,179520.0,337920.0,1680384.0,1282464.0,2225824.0,57023040.0,9216.0,98426864.0,5536481280.0
123,32,4096,384,128,8,ActivationType.Gelu,torch.bfloat16,torch.float8_e4m3fnuz,torch.float8_e4m3fnuz,QuantType.per_Token,1,0,asm,asm_1stage,32,_ZN5aiter45fmoe_bf16_pertokenFp8_g1u1_vs_gelu_1tg_32x192E,147.9006,0.0,0.00%,16.33,4086.35,513999.125,4608.0,8.028957,65244679.0,0.0,0.0,64880640.0,32440320.0,132718.0,4184510.0,8561800.0,54676897.0,2394998.0,0.0,8.192626,0.152405344,530640.0,2027520.0,5485360.0,0.0,2083840.0,43302873.0,1088.0,59969856.0,33218887680.0
124,32,4096,384,128,8,ActivationType.Gelu,torch.bfloat16,torch.float8_e4m3fnuz,torch.float8_e4m3fnuz,QuantType.per_Token,1,1,asm,asm_1stage,32,_ZN5aiter50fmoe_bf16_pertokenFp8_g1u1_vs_tkw1_gelu_1tg_32x192E,148.9693,0.0,0.00%,16.22,4057.03,513817.4375,4096.0,8.788459,60582185.0,0.0,0.0,64880640.0,32440320.0,128565.0,4176173.0,8626028.0,49180293.0,2465001.0,0.0,8.066067,0.123293127,488400.0,2027520.0,5048880.0,0.0,1971200.0,39893588.0,1088.0,61012173.0,33218887680.0
133,32,4096,384,128,8,ActivationType.Silu,torch.bfloat16,torch.float8_e4m3fnuz,torch.float8_e4m3fnuz,QuantType.per_1x128,1,0,asm,stage1,16,_ZN5aiter59fmoe_stage1_bf16_pertokenFp8_blockscale_g1u1_16x128_4tg_pf2E,89.1036,43.03822222222215,43.59%,27.11,6782.81,339326.625,112.46875,3.874599,58828781.0,0.0,0.0,21626880.0,10813440.0,90067.0,2715630.0,4556738.0,49151197.0,1757296.0,0.0,11.832546,0.00199598778,114840.0,675840.0,1796970.0,0.0,752400.0,58152913.0,1728.0,63976763.0,11072962560.0
133,32,4096,384,128,8,ActivationType.Silu,torch.bfloat16,torch.float8_e4m3fnuz,torch.float8_e4m3fnuz,QuantType.per_1x128,1,0,ck,stage2,16,moe_ck2stages_gemm2_128x16x128x128_1x2_MulABScaleExpertWeightA8W8blkscale_v1_Nswizzle0_Quant4_MulRoutedWeight1_F8_F8_B16,56.5131,43.03822222222215,15.28%,42.75,10694.39,170528.375,2048.0,4.004932,27053972.0,0.0,0.0,10813440.0,5406720.0,89530.0,1397023.0,4627077.0,21532477.0,883511.0,6.55735,33.843314,0.260566449,151360.0,337920.0,1822144.0,2252800.0,3196160.0,46804115.0,9216.0,93015895.0,5536481280.0
134,32,4096,384,128,8,ActivationType.Gelu,torch.bfloat16,torch.float8_e4m3fnuz,torch.float8_e4m3fnuz,QuantType.per_1x128,1,0,asm,stage1,16,_ZN5aiter59fmoe_stage1_bf16_pertokenFp8_blockscale_g1u1_16x128_4tg_pf2E,89.2547,44.20422222222224,43.78%,27.07,6771.33,339331.375,112.4375,4.076347,57630772.0,0.0,0.0,21626880.0,10813440.0,90522.0,2715603.0,5115929.0,48179563.0,1683811.0,0.0,11.73348,0.00203561119,114840.0,675840.0,1810170.0,0.0,752400.0,55091742.0,1728.0,60892021.0,11072962560.0
134,32,4096,384,128,8,ActivationType.Gelu,torch.bfloat16,torch.float8_e4m3fnuz,torch.float8_e4m3fnuz,QuantType.per_1x128,1,0,ck,stage2,16,moe_ck2stages_gemm2_128x16x128x128_1x2_MulABScaleExpertWeightA8W8blkscale_v1_Nswizzle0_Quant4_MulRoutedWeight1_F8_F8_B16,56.4745,44.20422222222224,15.16%,42.78,10701.7,170525.875,2048.0,3.992633,26707484.0,0.0,0.0,10813440.0,5406720.0,90108.0,1397059.0,4254634.0,21246520.0,865708.0,6.756189,33.940698,0.345876829,151360.0,337920.0,1822144.0,2252800.0,3196160.0,46059588.0,9216.0,90538142.0,5536481280.0
135,32,4096,384,128,8,ActivationType.Silu,torch.bfloat16,torch.float8_e4m3fnuz,torch.float8_e4m3fnuz,QuantType.per_1x128,1,1,ck,stage1,16,moe_ck2stages_gemm1_128x16x128x128_1x2_MulABScaleExpertWeightA8W8blkscale_v1_Nswizzle0_Quant4_MulRoutedWeight1_silu_F8_F8_B16,104.5135,43.86588888888892,0.01%,23.12,5782.73,339643.0,192.0,3.81658,31280976.0,0.0,0.0,21626880.0,10813440.0,81138.0,2719028.0,6500122.0,50252028.0,1836445.0,1.636201,5.73703,0.00276836683,109560.0,675840.0,1609080.0,1151040.0,1700160.0,26983327.0,864.0,32287243.0,11072962560.0
135,32,4096,384,128,8,ActivationType.Silu,torch.bfloat16,torch.float8_e4m3fnuz,torch.float8_e4m3fnuz,QuantType.per_1x128,1,1,ck,stage2,16,moe_ck2stages_gemm2_128x16x128x128_1x2_MulABScaleExpertWeightA8W8blkscale_v1_Nswizzle0_Quant4_MulRoutedWeight0_F8_F8_B16,56.4536,43.86588888888892,16.56%,42.79,10705.66,170474.75,2048.0,3.886945,27150017.0,0.0,0.0,10813440.0,5406720.0,84238.0,1396574.0,4392695.0,21464352.0,893385.0,6.54779,32.947944,0.310108813,151360.0,337920.0,1723584.0,2252800.0,3196160.0,46519971.0,9216.0,90687249.0,5536481280.0
136,32,4096,384,128,8,ActivationType.Gelu,torch.bfloat16,torch.float8_e4m3fnuz,torch.float8_e4m3fnuz,QuantType.per_1x128,1,1,ck,stage1,16,moe_ck2stages_gemm1_128x16x128x128_1x2_MulABScaleExpertWeightA8W8blkscale_v1_Nswizzle0_Quant4_MulRoutedWeight1_gelu_F8_F8_B16,103.21,44.00822222222229,0.01%,23.41,5855.76,339732.25,192.0,3.823883,31770410.0,0.0,0.0,21626880.0,10813440.0,87819.0,2718783.0,8160842.0,51060700.0,1856130.0,1.615109,5.753511,0.00305260396,109560.0,675840.0,1506120.0,1151040.0,1700160.0,27584781.0,864.0,32802849.0,11072962560.0
136,32,4096,384,128,8,ActivationType.Gelu,torch.bfloat16,torch.float8_e4m3fnuz,torch.float8_e4m3fnuz,QuantType.per_1x128,1,1,ck,stage2,16,moe_ck2stages_gemm2_128x16x128x128_1x2_MulABScaleExpertWeightA8W8blkscale_v1_Nswizzle0_Quant4_MulRoutedWeight0_F8_F8_B16,56.5238,44.00822222222229,16.57%,42.74,10692.36,170473.625,2048.0,3.909949,27405223.0,0.0,0.0,10813440.0,5406720.0,84031.0,1396544.0,4600380.0,21826261.0,924362.0,6.310644,33.243913,0.419428974,151360.0,337920.0,1723584.0,2252800.0,3196160.0,48689032.0,9216.0,94940404.0,5536481280.0
140,32,7168,256,256,8,ActivationType.Gelu,torch.bfloat16,torch.bfloat16,torch.bfloat16,QuantType.No,1,0,ck,stage1,32,moe_ck2stages_gemm1_256x32x64x64_1x4_TypeCast_v1_Nswizzle0_Quant0_MulRoutedWeight0_gelu_B16_B16_B16,304.8746,0.0,0.00%,9.25,9248.03,1203123.875,128.0,9.080053,185037624.0,76611584.0,0.0,0.0,76611584.0,84936.0,9625818.0,18498596.0,159496980.0,5535902.0,0.0405405672,24.651491,0.000301787881,1512352.0,4788224.0,6243593.0,85504.0,12141568.0,369154388.0,4096.0,415939143.0,39225131008.0
140,32,7168,256,256,8,ActivationType.Gelu,torch.bfloat16,torch.bfloat16,torch.bfloat16,QuantType.No,1,0,ck,stage2,32,moe_ck2stages_gemm2_256x32x64x64_1x4_TypeCastExpertWeight_v1_Nswizzle0_Quant0_MulRoutedWeight1_B16_B16_B16,164.3189,0.0,1.60%,17.15,17158.65,600047.125,3584.0,8.864116,99129732.0,38305792.0,0.0,0.0,38305792.0,178190.0,4857779.0,10707150.0,79780734.0,2734068.0,1.142779,83.028833,0.230050556,1963920.0,2394112.0,10218320.0,1197056.0,15337280.0,582290014.0,114688.0,695778856.0,19612565504.0
141,32,7168,256,256,8,ActivationType.Gelu,torch.bfloat16,torch.bfloat16,torch.bfloat16,QuantType.No,1,1,ck,stage1,32,moe_ck2stages_gemm1_256x32x64x64_1x4_TypeCastExpertWeight_v1_Nswizzle0_Quant0_MulRoutedWeight1_gelu_B16_B16_B16,305.1672,0.0,0.00%,9.24,9239.16,1203184.8125,128.0,9.098214,185740649.0,76611584.0,0.0,0.0,76611584.0,87815.0,9626454.0,16404661.0,159893490.0,5427534.0,0.041264953,24.666972,0.000261332477,1512352.0,4788224.0,6241792.0,85504.0,12141568.0,362567567.0,4096.0,408894154.0,39225131008.0
141,32,7168,256,256,8,ActivationType.Gelu,torch.bfloat16,torch.bfloat16,torch.bfloat16,QuantType.No,1,1,ck,stage2,32,moe_ck2stages_gemm2_256x32x64x128_1x4_TypeCast_v1_Nswizzle0_Quant0_MulRoutedWeight0_B16_B16_B16,164.0115,0.0,0.00%,17.19,17190.81,599794.0625,3584.0,9.504943,93630380.0,38305792.0,0.0,0.0,38305792.0,168098.0,4855784.0,13034619.0,75478560.0,2600941.0,1.197516,60.822755,0.323751372,1963920.0,2394112.0,10068688.0,1197056.0,15337280.0,379324658.0,114688.0,486395114.0,19612565504.0
142,32,7168,256,256,8,ActivationType.Gelu,torch.bfloat16,torch.float8_e4m3fnuz,torch.float8_e4m3fnuz,QuantType.per_Tensor,1,0,ck,stage1,16,moe_ck2stages_gemm1_128x16x64x128_1x2_MulABScale_v1_Nswizzle0_Quant1_MulRoutedWeight0_gelu_F8_F8_B16,157.5527,51.781999999999954,0.00%,17.89,8949.22,601551.5,128.0,4.578809,80781676.0,0.0,0.0,38305792.0,19152896.0,56825.0,4813532.0,10881047.0,77992504.0,2878298.0,3.241754,11.796802,0.000698788628,379424.0,1197056.0,1825694.0,3569792.0,5408128.0,95817749.0,2048.0,103924295.0,19612565504.0
142,32,7168,256,256,8,ActivationType.Gelu,torch.bfloat16,torch.float8_e4m3fnuz,torch.float8_e4m3fnuz,QuantType.per_Tensor,1,0,ck,stage2,16,moe_ck2stages_gemm2_256x16x128x256_1x4_MulABScaleExpertWeight_v1_Nswizzle0_Quant1_MulRoutedWeight1_F8_F8_B16,90.0756,51.781999999999954,1.54%,31.29,15653.23,300014.875,7168.0,4.142576,50538553.0,0.0,0.0,19152896.0,9576448.0,77613.0,2514841.0,6078767.0,42196357.0,1470574.0,1.366763,74.269089,0.651562129,420840.0,598528.0,4382784.0,769216.0,3350368.0,233827868.0,57344.0,334389908.0,9806282752.0
143,32,7168,256,256,8,ActivationType.Gelu,torch.bfloat16,torch.float8_e4m3fnuz,torch.float8_e4m3fnuz,QuantType.per_Tensor,1,1,ck,stage1,16,moe_ck2stages_gemm1_128x16x64x128_1x2_MulABScale_v1_Nswizzle0_Quant1_MulRoutedWeight1_gelu_F8_F8_B16,157.178,50.8206666666666,0.00%,17.93,8970.56,601642.1875,128.0,4.446698,79376873.0,0.0,0.0,38305792.0,19152896.0,59054.0,4814223.0,10452468.0,78932763.0,2802186.0,3.320957,11.779998,0.000556781063,379424.0,1197056.0,1778216.0,3569792.0,5408128.0,93278066.0,2048.0,101301276.0,19612565504.0
143,32,7168,256,256,8,ActivationType.Gelu,torch.bfloat16,torch.float8_e4m3fnuz,torch.float8_e4m3fnuz,QuantType.per_Tensor,1,1,ck,stage2,16,moe_ck2stages_gemm2_256x16x128x256_1x4_MulABScaleExpertWeight_v1_Nswizzle0_Quant1_MulRoutedWeight0_F8_F8_B16,89.8867,50.8206666666666,0.00%,31.36,15686.13,299929.25,7168.0,4.093567,50212683.0,0.0,0.0,19152896.0,9576448.0,68483.0,2514164.0,7452417.0,42461052.0,1473350.0,1.359493,73.566512,0.619603674,420840.0,598528.0,4083520.0,769216.0,3350368.0,236414415.0,57344.0,332997862.0,9806282752.0
144,32,7168,256,256,8,ActivationType.Gelu,torch.bfloat16,torch.float8_e4m3fnuz,torch.float8_e4m3fnuz,QuantType.per_Token,1,0,asm,asm_1stage,32,_ZN5aiter45fmoe_bf16_pertokenFp8_g1u1_vs_gelu_1tg_32x256E,245.417,0.0,0.00%,11.48,5745.22,904642.0625,3840.0,9.362584,78776537.0,0.0,0.0,114917376.0,57458688.0,137165.0,7298803.0,12221233.0,61632414.0,4208942.0,0.0,6.31795,0.119871031,663324.0,3591168.0,7977128.0,0.0,2621232.0,25975770.0,1056.0,81223045.0,58837696512.0
145,32,7168,256,256,8,ActivationType.Gelu,torch.bfloat16,torch.float8_e4m3fnuz,torch.float8_e4m3fnuz,QuantType.per_Token,1,1,asm,asm_1stage,32,_ZN5aiter50fmoe_bf16_pertokenFp8_g1u1_vs_tkw1_gelu_1tg_32x256E,252.4091,0.0,0.00%,11.17,5586.07,904615.5625,3584.0,8.944759,81674767.0,0.0,0.0,114917376.0,57458688.0,135209.0,7293990.0,12002288.0,63581775.0,4246530.0,0.0,6.369669,0.0913539022,631260.0,3591168.0,7399976.0,0.0,2535728.0,21817985.0,1056.0,82565508.0,58837696512.0
146,32,7168,256,256,8,ActivationType.Silu,torch.bfloat16,torch.bfloat16,torch.bfloat16,QuantType.No,1,0,ck,stage1,32,moe_ck2stages_gemm1_256x32x64x64_1x4_TypeCast_v1_Nswizzle0_Quant0_MulRoutedWeight0_silu_B16_B16_B16,305.5652,0.0,0.00%,9.22,9227.13,1203062.5,128.0,9.188362,184815807.0,76611584.0,0.0,0.0,76611584.0,82267.0,9626102.0,16199489.0,159230629.0,5451323.0,0.0411047201,24.483108,0.00034252331,1512352.0,4788224.0,6396768.0,85504.0,12141568.0,360660486.0,4096.0,407428369.0,39225131008.0
146,32,7168,256,256,8,ActivationType.Silu,torch.bfloat16,torch.bfloat16,torch.bfloat16,QuantType.No,1,0,ck,stage2,32,moe_ck2stages_gemm2_256x32x64x64_1x4_TypeCastExpertWeight_v1_Nswizzle0_Quant0_MulRoutedWeight1_B16_B16_B16,163.9276,0.0,1.30%,17.19,17199.6,600044.25,3584.0,8.92302,98711762.0,38305792.0,0.0,0.0,38305792.0,177321.0,4857762.0,12704919.0,79365710.0,2756536.0,1.135758,82.82477,0.26652108,1963920.0,2394112.0,10218320.0,1197056.0,15337280.0,578775504.0,114688.0,698359271.0,19612565504.0
147,32,7168,256,256,8,ActivationType.Silu,torch.bfloat16,torch.bfloat16,torch.bfloat16,QuantType.No,1,1,ck,stage1,32,moe_ck2stages_gemm1_256x32x64x64_1x4_TypeCastExpertWeight_v1_Nswizzle0_Quant0_MulRoutedWeight1_silu_B16_B16_B16,306.0803,0.0,0.00%,9.21,9211.6,1203161.125,128.0,9.166305,184078438.0,76611584.0,0.0,0.0,76611584.0,84607.0,9626336.0,18569308.0,158188228.0,5454917.0,0.0409553855,24.532369,0.000359480455,1512352.0,4788224.0,6436848.0,85504.0,12141568.0,362441453.0,4096.0,409736724.0,39225131008.0
147,32,7168,256,256,8,ActivationType.Silu,torch.bfloat16,torch.bfloat16,torch.bfloat16,QuantType.No,1,1,ck,stage2,32,moe_ck2stages_gemm2_256x32x64x64_1x4_TypeCast_v1_Nswizzle0_Quant0_MulRoutedWeight0_B16_B16_B16,163.7645,0.0,0.00%,17.21,17216.73,599857.625,3584.0,8.611124,100195568.0,38305792.0,0.0,0.0,38305792.0,161003.0,4856250.0,14397630.0,83135946.0,2691402.0,1.166296,82.015841,0.30546275,1963920.0,2394112.0,9395344.0,1197056.0,15337280.0,562102447.0,114688.0,673431364.0,19612565504.0
148,32,7168,256,256,8,ActivationType.Silu,torch.bfloat16,torch.float8_e4m3fnuz,torch.float8_e4m3fnuz,QuantType.per_Tensor,1,0,ck,stage1,16,moe_ck2stages_gemm1_128x16x64x128_1x2_MulABScale_v1_Nswizzle0_Quant1_MulRoutedWeight0_silu_F8_F8_B16,158.0951,50.71822222222228,0.00%,17.83,8918.52,601537.25,128.0,4.479515,78802886.0,0.0,0.0,38305792.0,19152896.0,55709.0,4813401.0,11034192.0,78559691.0,2860730.0,3.264728,11.742534,0.000625547354,379424.0,1197056.0,1882424.0,3569792.0,5408128.0,94535386.0,2048.0,102718279.0,19612565504.0
148,32,7168,256,256,8,ActivationType.Silu,torch.bfloat16,torch.float8_e4m3fnuz,torch.float8_e4m3fnuz,QuantType.per_Tensor,1,0,ck,stage2,16,moe_ck2stages_gemm2_256x16x128x256_1x4_MulABScaleExpertWeight_v1_Nswizzle0_Quant1_MulRoutedWeight1_F8_F8_B16,90.0573,50.71822222222228,1.28%,31.3,15656.41,300015.5,7168.0,4.036994,51574607.0,0.0,0.0,19152896.0,9576448.0,77570.0,2514837.0,5454053.0,43238440.0,1517749.0,1.321045,73.762181,0.567002673,420840.0,598528.0,4382784.0,769216.0,3350368.0,240591298.0,57344.0,343601091.0,9806282752.0
149,32,7168,256,256,8,ActivationType.Silu,torch.bfloat16,torch.float8_e4m3fnuz,torch.float8_e4m3fnuz,QuantType.per_Tensor,1,1,ck,stage1,16,moe_ck2stages_gemm1_128x16x64x128_1x2_MulABScale_v1_Nswizzle0_Quant1_MulRoutedWeight1_silu_F8_F8_B16,158.1299,51.10111111111112,0.00%,17.82,8916.56,601619.375,128.0,4.45097,80348322.0,0.0,0.0,38305792.0,19152896.0,55067.0,4814028.0,10433776.0,79711195.0,2839769.0,3.293655,11.915741,0.00062232488,379424.0,1197056.0,1905136.0,3569792.0,5408128.0,95119688.0,2048.0,103317964.0,19612565504.0
149,32,7168,256,256,8,ActivationType.Silu,torch.bfloat16,torch.float8_e4m3fnuz,torch.float8_e4m3fnuz,QuantType.per_Tensor,1,1,ck,stage2,16,moe_ck2stages_gemm2_256x16x128x256_1x4_MulABScaleExpertWeight_v1_Nswizzle0_Quant1_MulRoutedWeight0_F8_F8_B16,89.787,51.10111111111112,0.00%,31.39,15703.55,299928.875,7168.0,4.151923,50808006.0,0.0,0.0,19152896.0,9576448.0,68397.0,2514153.0,6127362.0,43070834.0,1538958.0,1.301871,71.025293,0.583694562,420840.0,598528.0,4083520.0,769216.0,3350368.0,237718587.0,57344.0,335724853.0,9806282752.0
150,32,7168,256,256,8,ActivationType.Silu,torch.bfloat16,torch.float8_e4m3fnuz,torch.float8_e4m3fnuz,QuantType.per_Token,1,0,asm,asm_1stage,32,_ZN5aiter45fmoe_bf16_pertokenFp8_g1u1_vs_silu_1tg_32x256E,245.3649,0.0,0.00%,11.49,5746.44,904736.6875,3840.0,9.32445,78295412.0,0.0,0.0,114917376.0,57458688.0,135601.0,7298170.0,14132604.0,61250228.0,4258564.0,0.0,6.349123,0.101921678,663324.0,3591168.0,7913000.0,0.0,2621232.0,26458332.0,1056.0,82557671.0,58837696512.0
151,32,7168,256,256,8,ActivationType.Silu,torch.bfloat16,torch.float8_e4m3fnuz,torch.float8_e4m3fnuz,QuantType.per_Token,1,1,asm,asm_1stage,32,_ZN5aiter50fmoe_bf16_pertokenFp8_g1u1_vs_tkw1_silu_1tg_32x256E,252.326,0.0,0.00%,11.17,5587.91,904531.75,3584.0,8.709924,83505386.0,0.0,0.0,114917376.0,57458688.0,132804.0,7293912.0,10441280.0,65277847.0,4017291.0,0.0,6.42342,0.062957388,631260.0,3591168.0,7335848.0,0.0,2535728.0,21096507.0,1056.0,78875035.0,58837696512.0
160,32,7168,256,256,8,ActivationType.Gelu,torch.bfloat16,torch.float8_e4m3fnuz,torch.float8_e4m3fnuz,QuantType.per_1x128,1,0,asm,asm_1stage,32,_ZN5aiter52fmoe_bf16_blockscaleFp8_g1u1_novs_gelu_1tg_ps_32x256E,253.9104,0.0,1.78%,11.1,5553.04,899880.875,3840.0,9.089463,81059492.0,0.0,0.0,114917376.0,57458688.0,171536.0,7262477.0,10391884.0,61637921.0,4136211.0,0.0,6.372351,0.126047366,752168.0,3591168.0,9291464.0,0.0,2821632.0,19157891.0,1216.0,80494000.0,58837696512.0
161,32,7168,256,256,8,ActivationType.Gelu,torch.bfloat16,torch.float8_e4m3fnuz,torch.float8_e4m3fnuz,QuantType.per_1x128,1,1,ck,stage1,16,moe_ck2stages_gemm1_128x16x128x128_1x2_MulABScaleExpertWeightA8W8blkscale_v1_Nswizzle0_Quant4_MulRoutedWeight1_gelu_F8_F8_B16,166.883,40.51888888888889,0.02%,16.89,8448.88,601114.25,128.0,4.311243,51751519.0,0.0,0.0,38305792.0,19152896.0,94384.0,4809872.0,9216000.0,83474842.0,2918323.0,1.733681,6.088251,0.00171976483,191048.0,1197056.0,2398120.0,1934528.0,2875072.0,45661131.0,1024.0,54348613.0,19612565504.0
161,32,7168,256,256,8,ActivationType.Gelu,torch.bfloat16,torch.float8_e4m3fnuz,torch.float8_e4m3fnuz,QuantType.per_1x128,1,1,ck,stage2,16,moe_ck2stages_gemm2_256x16x128x256_1x4_MulABScaleExpertWeightA8W8blkscale_v1_Nswizzle0_Quant4_MulRoutedWeight0_F8_F8_B16,90.092,40.51888888888889,16.55%,31.29,15650.38,300556.5,3584.0,4.036932,52381111.0,0.0,0.0,19152896.0,9576448.0,86244.0,2461834.0,7616072.0,43051000.0,1569184.0,10.928187,72.418528,0.417364692,346024.0,598528.0,4286184.0,6583808.0,9164960.0,180854884.0,57344.0,349034779.0,9806282752.0
162,32,7168,256,256,8,ActivationType.Silu,torch.bfloat16,torch.float8_e4m3fnuz,torch.float8_e4m3fnuz,QuantType.per_1x128,1,1,ck,stage1,16,moe_ck2stages_gemm1_128x16x128x128_1x2_MulABScaleExpertWeightA8W8blkscale_v1_Nswizzle0_Quant4_MulRoutedWeight1_silu_F8_F8_B16,169.7731,38.85855555555561,0.02%,16.6,8305.05,601094.0,128.0,4.250993,52099847.0,0.0,0.0,38305792.0,19152896.0,88004.0,4809822.0,10799829.0,84159472.0,2924948.0,1.73032,6.095407,0.00151249833,191048.0,1197056.0,2502328.0,1934528.0,2875072.0,45734479.0,1024.0,54518186.0,19612565504.0
162,32,7168,256,256,8,ActivationType.Silu,torch.bfloat16,torch.float8_e4m3fnuz,torch.float8_e4m3fnuz,QuantType.per_1x128,1,1,ck,stage2,16,moe_ck2stages_gemm2_256x16x128x256_1x4_MulABScaleExpertWeightA8W8blkscale_v1_Nswizzle0_Quant4_MulRoutedWeight0_F8_F8_B16,90.1951,38.85855555555561,16.56%,31.25,15632.49,300554.5,3584.0,3.990013,52097322.0,0.0,0.0,19152896.0,9576448.0,87084.0,2461841.0,9554929.0,42757482.0,1591498.0,10.773793,72.013868,0.385009054,346024.0,598528.0,4286184.0,6583808.0,9164960.0,182962281.0,57344.0,352058354.0,9806282752.0
163,32,7168,256,256,8,ActivationType.Silu,torch.bfloat16,torch.float8_e4m3fnuz,torch.float8_e4m3fnuz,QuantType.per_1x128,1,0,asm,asm_1stage,32,_ZN5aiter49fmoe_bf16_blockscaleFp8_g1u1_novs_silu_1tg_32x256E,251.4802,0.0,0.00%,11.21,5606.7,900214.1875,3840.0,9.126189,80326533.0,0.0,0.0,114917376.0,57458688.0,170686.0,7261327.0,9863133.0,61582949.0,4196922.0,0.0,6.278978,0.139263855,752168.0,3591168.0,9165500.0,0.0,2821632.0,18824797.0,1056.0,80460129.0,58837696512.0
167,32,7168,256,257,9,ActivationType.Silu,torch.bfloat16,torch.float8_e4m3fnuz,torch.float8_e4m3fnuz,QuantType.per_Token,1,0,asm,asm_1stage,32,_ZN5aiter45fmoe_bf16_pertokenFp8_g1u1_vs_silu_1tg_32x256E,263.151,0.0,0.00%,12.05,5378.96,975418.25,4320.0,9.388773,90642851.0,0.0,0.0,123863040.0,61931520.0,141604.0,7873051.0,16785104.0,72364841.0,4333432.0,0.0,6.921061,0.0859905039,714960.0,3870720.0,8528240.0,0.0,2825280.0,29269595.0,1064.0,91497511.0,63417876480.0
168,32,7168,256,256,8,ActivationType.Silu,torch.bfloat16,torch.float8_e4m3fnuz,torch.float8_e4m3fnuz,QuantType.per_1x128,1,0,asm,asm_1stage,32,_ZN5aiter50fmoe_bf16_blockscaleFp8_g1u1_vs_silu_1tg_ps_32x256E,248.6165,0.0,0.00%,11.34,5671.28,900032.1875,3840.0,9.1047,80379024.0,0.0,0.0,114917376.0,57458688.0,171152.0,7262392.0,10100197.0,62300392.0,4184297.0,0.0,6.396074,0.111277324,752168.0,3591168.0,9227336.0,0.0,2821632.0,26136989.0,1216.0,81693066.0,58837696512.0
169,32,7168,256,257,9,ActivationType.Silu,torch.bfloat16,torch.float8_e4m3fnuz,torch.float8_e4m3fnuz,QuantType.per_1x128,1,0,asm,asm_1stage,32,_ZN5aiter47fmoe_bf16_blockscaleFp8_g1u1_vs_silu_1tg_32x256E,289.5488,0.0,0.00%,10.95,4888.57,970706.8125,4320.0,9.514656,88990012.0,0.0,0.0,123863040.0,61931520.0,178860.0,7832811.0,11706096.0,70045719.0,4282784.0,0.0,6.793286,0.0952410837,810720.0,3870720.0,9878240.0,0.0,3041280.0,27164633.0,1064.0,88848099.0,63417876480.0
170,32,7168,512,256,8,ActivationType.Gelu,torch.bfloat16,torch.bfloat16,torch.bfloat16,QuantType.No,1,0,ck,stage1,32,moe_ck2stages_gemm1_256x32x64x64_1x4_TypeCast_v1_Nswizzle0_Quant0_MulRoutedWeight0_gelu_B16_B16_B16,590.4401,0.0,0.00%,9.55,9548.91,2308978.375,256.0,9.707492,354546981.0,146800640.0,0.0,0.0,146800640.0,133116.0,18471654.0,29856575.0,306785489.0,9804846.0,0.0438282261,43.894905,0.0101220357,2897920.0,9175040.0,11971419.0,163840.0,23265280.0,660793941.0,8192.0,1312714086.0,75161927680.0
170,32,7168,512,256,8,ActivationType.Gelu,torch.bfloat16,torch.bfloat16,torch.bfloat16,QuantType.No,1,0,ck,stage2,32,moe_ck2stages_gemm2_256x32x64x128_1x4_TypeCastExpertWeight_v1_Nswizzle0_Quant0_MulRoutedWeight1_B16_B16_B16,303.5205,0.0,3.29%,18.57,18575.56,1149439.5,3584.0,10.072925,173012366.0,73400320.0,0.0,0.0,73400320.0,292480.0,9252943.0,15380490.0,139496139.0,4678432.0,0.640104989,52.978947,0.180068318,3315200.0,4587520.0,15398208.0,1146880.0,26163200.0,570725285.0,114688.0,759381617.0,37580963840.0
171,32,7168,512,256,8,ActivationType.Gelu,torch.bfloat16,torch.bfloat16,torch.bfloat16,QuantType.No,1,1,ck,stage1,32,moe_ck2stages_gemm1_256x32x64x64_1x4_TypeCastExpertWeight_v1_Nswizzle0_Quant0_MulRoutedWeight1_gelu_B16_B16_B16,575.3588,0.0,0.00%,9.8,9799.21,2308985.25,256.0,9.714577,354319385.0,146800640.0,0.0,0.0,146800640.0,135711.0,18473514.0,32307343.0,306298471.0,9838604.0,0.0436570319,44.179445,0.00781437955,2897920.0,9175040.0,11960320.0,163840.0,23265280.0,671532542.0,8192.0,1326404472.0,75161927680.0
171,32,7168,512,256,8,ActivationType.Gelu,torch.bfloat16,torch.bfloat16,torch.bfloat16,QuantType.No,1,1,ck,stage2,32,moe_ck2stages_gemm2_256x32x64x128_1x4_TypeCast_v1_Nswizzle0_Quant0_MulRoutedWeight0_B16_B16_B16,303.1425,0.0,0.01%,18.6,18598.72,1149263.25,3584.0,9.957753,176595998.0,73400320.0,0.0,0.0,73400320.0,275441.0,9251604.0,11694867.0,145379421.0,4849630.0,0.617383267,52.244305,0.248632313,3315200.0,4587520.0,14609728.0,1146880.0,26163200.0,553102603.0,114688.0,776411691.0,37580963840.0
172,32,7168,512,256,8,ActivationType.Gelu,torch.bfloat16,torch.float8_e4m3fnuz,torch.float8_e4m3fnuz,QuantType.per_Tensor,1,0,ck,stage1,32,moe_ck2stages_gemm1_256x32x64x256_1x4_MulABScale_v1_Nswizzle0_Quant1_MulRoutedWeight0_gelu_F8_F8_B16,293.0834,42.945333333333366,0.00%,19.23,9619.31,1154566.5,256.0,10.15867,163681912.0,0.0,0.0,146800640.0,73400320.0,84837.0,9238640.0,14097305.0,138832754.0,4710420.0,3.779064,30.417632,0.0192722625,1740800.0,4587520.0,6887397.0,6799360.0,18432000.0,151031456.0,8192.0,437823583.0,75161927680.0
172,32,7168,512,256,8,ActivationType.Gelu,torch.bfloat16,torch.float8_e4m3fnuz,torch.float8_e4m3fnuz,QuantType.per_Tensor,1,0,ck,stage2,32,moe_ck2stages_gemm2_256x32x64x256_1x4_MulABScaleExpertWeight_v1_Nswizzle0_Quant1_MulRoutedWeight1_F8_F8_B16,159.8187,42.945333333333366,3.25%,35.27,17640.37,574871.125,3584.0,11.650802,70433053.0,0.0,0.0,73400320.0,36700160.0,196637.0,4656371.0,7077438.0,49876911.0,2012932.0,1.478072,58.405919,0.221421505,1881600.0,2293760.0,11455808.0,1146880.0,14694400.0,265834528.0,114688.0,362551052.0,37580963840.0
173,32,7168,512,256,8,ActivationType.Gelu,torch.bfloat16,torch.float8_e4m3fnuz,torch.float8_e4m3fnuz,QuantType.per_Tensor,1,1,ck,stage1,32,moe_ck2stages_gemm1_256x32x64x256_1x4_MulABScale_v1_Nswizzle0_Quant1_MulRoutedWeight1_gelu_F8_F8_B16,293.145,40.31077777777781,0.00%,19.23,9617.29,1154683.375,256.0,9.942221,166987923.0,0.0,0.0,146800640.0,73400320.0,85347.0,9240016.0,17100848.0,142019639.0,4756880.0,3.734098,30.191751,0.0279644393,1740800.0,4587520.0,6865920.0,6799360.0,18432000.0,153203155.0,8192.0,439805407.0,75161927680.0
173,32,7168,512,256,8,ActivationType.Gelu,torch.bfloat16,torch.float8_e4m3fnuz,torch.float8_e4m3fnuz,QuantType.per_Tensor,1,1,ck,stage2,32,moe_ck2stages_gemm2_256x32x64x256_1x4_MulABScaleExpertWeight_v1_Nswizzle0_Quant1_MulRoutedWeight0_F8_F8_B16,159.8982,40.31077777777781,0.00%,35.25,17631.6,574715.4375,3584.0,11.534322,72704362.0,0.0,0.0,73400320.0,36700160.0,181114.0,4655119.0,7667447.0,54272110.0,2063837.0,1.447138,60.235676,0.253024596,1881600.0,2293760.0,9807168.0,1146880.0,14694400.0,290610472.0,114688.0,381901816.0,37580963840.0
174,32,7168,512,256,8,ActivationType.Gelu,torch.bfloat16,torch.float8_e4m3fnuz,torch.float8_e4m3fnuz,QuantType.per_Token,1,0,asm,asm_1stage,32,_ZN5aiter45fmoe_bf16_pertokenFp8_g1u1_vs_gelu_1tg_32x512E,443.3207,0.0,0.00%,12.72,6359.42,1744258.3125,3840.0,9.778956,143485082.0,0.0,0.0,220200960.0,110100480.0,100531.0,14016309.0,24716996.0,112826162.0,7466707.0,0.0,6.387814,0.065245018,650880.0,6881280.0,11434560.0,0.0,2562560.0,6080642.0,1056.0,145623523.0,112742891520.0
175,32,7168,512,256,8,ActivationType.Gelu,torch.bfloat16,torch.float8_e4m3fnuz,torch.float8_e4m3fnuz,QuantType.per_Token,1,1,asm,asm_1stage,32,_ZN5aiter53fmoe_bf16_pertokenFp8_g1u1_vs_tkw1_gelu_1tg_ps_32x512E,443.1704,0.0,0.00%,12.72,6361.57,1744180.125,3584.0,9.734055,144893995.0,0.0,0.0,220200960.0,110100480.0,100765.0,14011666.0,23902574.0,112705707.0,7576439.0,0.0,6.295266,0.0576366875,620160.0,6881280.0,10983808.0,0.0,2480640.0,6160009.0,1216.0,146047214.0,112742891520.0
176,32,7168,512,256,8,ActivationType.Silu,torch.bfloat16,torch.bfloat16,torch.bfloat16,QuantType.No,1,1,ck,stage1,32,moe_ck2stages_gemm1_256x32x64x128_1x4_TypeCastExpertWeight_v1_Nswizzle0_Quant0_MulRoutedWeight1_silu_B16_B16_B16,590.8172,0.0,0.00%,9.54,9542.82,2309801.0625,256.0,9.801875,348170858.0,146800640.0,0.0,0.0,146800640.0,127644.0,18481858.0,27926734.0,300156035.0,9923564.0,0.0432654881,30.521966,0.0114496157,2897920.0,9175040.0,12656640.0,163840.0,23265280.0,305695017.0,8192.0,924657332.0,75161927680.0
176,32,7168,512,256,8,ActivationType.Silu,torch.bfloat16,torch.bfloat16,torch.bfloat16,QuantType.No,1,1,ck,stage2,32,moe_ck2stages_gemm2_256x32x64x128_1x4_TypeCast_v1_Nswizzle0_Quant0_MulRoutedWeight0_B16_B16_B16,302.7906,0.0,0.01%,18.62,18620.33,1149265.6875,3584.0,10.450214,168147693.0,73400320.0,0.0,0.0,73400320.0,275418.0,9251584.0,14985846.0,136845536.0,4764199.0,0.630234073,52.281177,0.222474474,3315200.0,4587520.0,14609728.0,1146880.0,26163200.0,537847841.0,114688.0,761117038.0,37580963840.0
177,32,7168,512,256,8,ActivationType.Silu,torch.bfloat16,torch.float8_e4m3fnuz,torch.float8_e4m3fnuz,QuantType.per_Tensor,1,0,ck,stage1,32,moe_ck2stages_gemm1_256x32x64x256_1x4_MulABScale_v1_Nswizzle0_Quant1_MulRoutedWeight0_silu_F8_F8_B16,293.2586,42.36677777777772,0.00%,19.22,9613.56,1154564.5625,256.0,10.22087,163045456.0,0.0,0.0,146800640.0,73400320.0,79833.0,9238645.0,14749440.0,138071941.0,4803690.0,3.697376,29.986163,0.0408987327,1740800.0,4587520.0,7239680.0,6799360.0,18432000.0,151250324.0,8192.0,441148979.0,75161927680.0
177,32,7168,512,256,8,ActivationType.Silu,torch.bfloat16,torch.float8_e4m3fnuz,torch.float8_e4m3fnuz,QuantType.per_Tensor,1,0,ck,stage2,32,moe_ck2stages_gemm2_256x32x64x128_1x4_MulABScaleExpertWeight_v1_Nswizzle0_Quant1_MulRoutedWeight1_F8_F8_B16,159.5154,42.36677777777772,2.81%,35.34,17673.91,574957.125,3584.0,11.505609,71939826.0,0.0,0.0,73400320.0,36700160.0,188824.0,4657003.0,9196843.0,52568082.0,2139141.0,20.366258,80.466701,0.207269162,2526720.0,2293760.0,11240768.0,16629760.0,30177280.0,404639710.0,114688.0,525630947.0,37580963840.0
178,32,7168,512,256,8,ActivationType.Silu,torch.bfloat16,torch.float8_e4m3fnuz,torch.float8_e4m3fnuz,QuantType.per_Tensor,1,1,ck,stage1,32,moe_ck2stages_gemm1_256x32x64x128_1x4_MulABScale_v1_Nswizzle0_Quant1_MulRoutedWeight1_silu_F8_F8_B16,296.8834,43.19477777777772,0.00%,18.99,9496.19,1153584.0,256.0,10.400786,160782343.0,0.0,0.0,146800640.0,73400320.0,89226.0,9230786.0,16497891.0,135771900.0,4549881.0,11.771036,43.343557,0.0160577945,2309120.0,4587520.0,7234560.0,20439040.0,32071680.0,300063060.0,8192.0,602088532.0,75161927680.0
178,32,7168,512,256,8,ActivationType.Silu,torch.bfloat16,torch.float8_e4m3fnuz,torch.float8_e4m3fnuz,QuantType.per_Tensor,1,1,ck,stage2,32,moe_ck2stages_gemm2_256x32x64x256_1x4_MulABScaleExpertWeight_v1_Nswizzle0_Quant1_MulRoutedWeight0_F8_F8_B16,159.4766,43.19477777777772,0.01%,35.35,17678.21,574714.375,3584.0,11.642128,71097545.0,0.0,0.0,73400320.0,36700160.0,181027.0,4655095.0,7500109.0,52769257.0,2158824.0,1.384005,60.279945,0.271196825,1881600.0,2293760.0,9807168.0,1146880.0,14694400.0,304994379.0,114688.0,399616260.0,37580963840.0
179,32,7168,512,256,8,ActivationType.Silu,torch.bfloat16,torch.float8_e4m3fnuz,torch.float8_e4m3fnuz,QuantType.per_Token,1,0,asm,asm_1stage,32,_ZN5aiter45fmoe_bf16_pertokenFp8_g1u1_vs_silu_1tg_32x512E,443.3121,0.0,0.00%,12.72,6359.54,1744371.6875,3840.0,9.844633,141831216.0,0.0,0.0,220200960.0,110100480.0,95372.0,14016579.0,27235937.0,111142671.0,7333479.0,0.0,6.355458,0.0516953253,650880.0,6881280.0,11311680.0,0.0,2562560.0,5905246.0,1056.0,142805927.0,112742891520.0
180,32,7168,512,256,8,ActivationType.Silu,torch.bfloat16,torch.float8_e4m3fnuz,torch.float8_e4m3fnuz,QuantType.per_Token,1,1,asm,asm_1stage,32,_ZN5aiter50fmoe_bf16_pertokenFp8_g1u1_vs_tkw1_silu_1tg_32x512E,446.0328,0.0,0.00%,12.64,6320.75,1744465.8125,3584.0,9.877507,142129097.0,0.0,0.0,220200960.0,110100480.0,96765.0,14008858.0,28196737.0,110597632.0,7225433.0,0.0,6.389968,0.0369065833,620160.0,6881280.0,10799680.0,0.0,2480640.0,5866818.0,1056.0,140783466.0,112742891520.0
181,32,7168,512,256,8,ActivationType.Silu,torch.bfloat16,torch.bfloat16,torch.bfloat16,QuantType.No,1,0,ck,stage1,32,moe_ck2stages_gemm1_256x32x64x64_1x4_TypeCast_v1_Nswizzle0_Quant0_MulRoutedWeight0_silu_B16_B16_B16,590.2894,0.0,0.00%,9.55,9551.35,2308839.75,256.0,9.98912,343709073.0,146800640.0,0.0,0.0,146800640.0,128915.0,18473413.0,29425006.0,295818095.0,9614436.0,0.0447485012,43.766065,0.0085338702,2897920.0,9175040.0,12257280.0,163840.0,23265280.0,645477275.0,8192.0,1281943644.0,75161927680.0
181,32,7168,512,256,8,ActivationType.Silu,torch.bfloat16,torch.bfloat16,torch.bfloat16,QuantType.No,1,0,ck,stage2,32,moe_ck2stages_gemm2_256x32x64x128_1x4_TypeCastExpertWeight_v1_Nswizzle0_Quant0_MulRoutedWeight1_B16_B16_B16,303.1639,0.0,2.83%,18.59,18597.41,1149435.875,3584.0,10.438611,167946069.0,73400320.0,0.0,0.0,73400320.0,292210.0,9252925.0,14473738.0,134345360.0,4690653.0,0.640137572,53.061641,0.195677377,3315200.0,4587520.0,15398208.0,1146880.0,26163200.0,570756423.0,114688.0,760528204.0,37580963840.0
185,32,7168,512,256,8,ActivationType.Silu,torch.bfloat16,torch.float8_e4m3fnuz,torch.float8_e4m3fnuz,QuantType.per_Tensor,1,1,asm,stage1,16,_ZN5aiter57fmoe_stage1_bf16_pertokenFp8_doweight_g1u1_16x512_2tg_pf2E,297.2501,41.196444444444445,0.00%,18.96,9484.47,1149005.625,256.0,6.80922,67731723.0,0.0,0.0,73400320.0,36700160.0,117226.0,9194100.0,11711686.0,47621171.0,3351265.0,0.0,6.23687,0.000266063747,88320.0,2293760.0,2671360.0,0.0,624640.0,42099172.0,1088.0,64135291.0,37580963840.0
185,32,7168,512,256,8,ActivationType.Silu,torch.bfloat16,torch.float8_e4m3fnuz,torch.float8_e4m3fnuz,QuantType.per_Tensor,1,1,ck,stage2,16,moe_ck2stages_gemm2_256x16x128x256_1x4_MulABScaleExpertWeight_v1_Nswizzle0_Quant1_MulRoutedWeight0_F8_F8_B16,161.3499,41.196444444444445,0.01%,34.94,17472.96,574662.125,7168.0,4.508457,94353567.0,0.0,0.0,36700160.0,18350080.0,101171.0,4712002.0,8509199.0,81574754.0,2679956.0,0.719542899,71.978215,0.557445817,582512.0,1146880.0,4573184.0,737072.0,4644080.0,332339545.0,57344.0,589853665.0,18790481920.0
187,32,7168,512,256,8,ActivationType.Gelu,torch.bfloat16,torch.float8_e4m3fnuz,torch.float8_e4m3fnuz,QuantType.per_Tensor,1,1,asm,stage1,16,_ZN5aiter57fmoe_stage1_bf16_pertokenFp8_doweight_g1u1_16x512_2tg_pf2E,297.1961,42.63822222222219,0.00%,18.97,9486.2,1149003.375,256.0,5.813887,78962780.0,0.0,0.0,73400320.0,36700160.0,118871.0,9194186.0,8792736.0,58651908.0,3572424.0,0.0,6.261588,0.000208701576,88320.0,2293760.0,2693120.0,0.0,624640.0,45169553.0,1088.0,68405905.0,37580963840.0
187,32,7168,512,256,8,ActivationType.Gelu,torch.bfloat16,torch.float8_e4m3fnuz,torch.float8_e4m3fnuz,QuantType.per_Tensor,1,1,ck,stage2,16,moe_ck2stages_gemm2_256x16x128x256_1x4_MulABScaleExpertWeight_v1_Nswizzle0_Quant1_MulRoutedWeight0_F8_F8_B16,161.3662,42.63822222222219,0.00%,34.93,17471.2,574655.75,7168.0,4.356727,98695100.0,0.0,0.0,36700160.0,18350080.0,101227.0,4712008.0,10171693.0,85970797.0,2693389.0,0.715352191,71.539353,0.564350465,582512.0,1146880.0,4573184.0,737072.0,4644080.0,330812961.0,57344.0,589691679.0,18790481920.0
189,32,7168,512,256,8,ActivationType.Gelu,torch.bfloat16,torch.float8_e4m3fnuz,torch.float8_e4m3fnuz,QuantType.per_Token,1,1,asm,asm_1stage,32,_ZN5aiter50fmoe_bf16_pertokenFp8_g1u1_vs_tkw1_gelu_1tg_32x512E,442.6104,0.0,0.00%,12.74,6369.62,1743823.25,3584.0,9.830674,142630474.0,0.0,0.0,220200960.0,110100480.0,100487.0,14010580.0,23125727.0,111006767.0,7415573.0,0.0,6.334736,0.042542593,620160.0,6881280.0,10922560.0,0.0,2480640.0,5963971.0,1056.0,143234923.0,112742891520.0
190,32,7168,512,256,8,ActivationType.Gelu,torch.bfloat16,torch.float8_e4m3fnuz,torch.float8_e4m3fnuz,QuantType.per_1x128,1,0,asm,stage1,16,_ZN5aiter59fmoe_stage1_bf16_pertokenFp8_blockscale_g1u1_16x512_2tg_pf2E,287.7,42.28611111111101,15.08%,19.59,9799.31,1149249.875,136.15625,4.818237,94726328.0,0.0,0.0,73400320.0,36700160.0,230295.0,9195088.0,12352737.0,72073861.0,5001134.0,0.0,6.21546,0.000224593575,126720.0,2293760.0,5390240.0,0.0,691200.0,61493326.0,1088.0,94645960.0,37580963840.0
190,32,7168,512,256,8,ActivationType.Gelu,torch.bfloat16,torch.float8_e4m3fnuz,torch.float8_e4m3fnuz,QuantType.per_1x128,1,0,ck,stage2,16,moe_ck2stages_gemm2_256x16x128x256_1x4_MulABScaleExpertWeightA8W8blkscale_v1_Nswizzle0_Quant4_MulRoutedWeight1_F8_F8_B16,159.6578,42.28611111111101,15.45%,35.31,17658.14,575948.5625,3584.0,4.379562,97402629.0,0.0,0.0,36700160.0,18350080.0,114663.0,4664987.0,9135594.0,81707908.0,2739758.0,6.023681,50.690956,0.277450176,510832.0,1146880.0,5443088.0,6307840.0,10214848.0,227483537.0,57344.0,424657851.0,18790481920.0
191,32,7168,512,256,8,ActivationType.Silu,torch.bfloat16,torch.float8_e4m3fnuz,torch.float8_e4m3fnuz,QuantType.per_1x128,1,0,asm,stage1,16,_ZN5aiter59fmoe_stage1_bf16_pertokenFp8_blockscale_g1u1_16x512_2tg_pf2E,285.7005,41.3957777777777,14.87%,19.73,9867.89,1148996.0,135.5,4.75942,96866598.0,0.0,0.0,73400320.0,36700160.0,228209.0,9193567.0,10163731.0,74298721.0,5052714.0,0.0,6.321991,0.000221805644,126720.0,2293760.0,5368480.0,0.0,691200.0,63606052.0,1088.0,97478175.0,37580963840.0
191,32,7168,512,256,8,ActivationType.Silu,torch.bfloat16,torch.float8_e4m3fnuz,torch.float8_e4m3fnuz,QuantType.per_1x128,1,0,ck,stage2,16,moe_ck2stages_gemm2_256x16x128x256_1x4_MulABScaleExpertWeightA8W8blkscale_v1_Nswizzle0_Quant4_MulRoutedWeight1_F8_F8_B16,159.8793,41.3957777777777,15.55%,35.26,17633.68,575947.6875,3584.0,4.330559,95524768.0,0.0,0.0,36700160.0,18350080.0,114893.0,4664966.0,10359944.0,79928441.0,2604042.0,6.346666,50.551363,0.277845749,510832.0,1146880.0,5443088.0,6307840.0,10214848.0,214312856.0,57344.0,401936882.0,18790481920.0
192,32,7168,512,256,8,ActivationType.Gelu,torch.bfloat16,torch.float8_e4m3fnuz,torch.float8_e4m3fnuz,QuantType.per_1x128,1,1,ck,stage1,16,moe_ck2stages_gemm1_256x16x128x256_1x4_MulABScaleExpertWeightA8W8blkscale_v1_Nswizzle0_Quant4_MulRoutedWeight1_gelu_F8_F8_B16,312.9543,41.32899999999983,0.02%,18.01,9008.54,1153698.3125,256.0,5.128506,156324786.0,0.0,0.0,73400320.0,36700160.0,100510.0,9231626.0,15280959.0,130942744.0,5333097.0,3.418145,20.614404,0.0144193175,645120.0,2293760.0,4741120.0,6963200.0,9912320.0,104616494.0,4096.0,335953488.0,37580963840.0
192,32,7168,512,256,8,ActivationType.Gelu,torch.bfloat16,torch.float8_e4m3fnuz,torch.float8_e4m3fnuz,QuantType.per_1x128,1,1,ck,stage2,16,moe_ck2stages_gemm2_256x16x128x256_1x4_MulABScaleExpertWeightA8W8blkscale_v1_Nswizzle0_Quant4_MulRoutedWeight0_F8_F8_B16,160.2478,41.32899999999983,16.79%,35.18,17593.13,575863.4375,3584.0,4.340811,97267400.0,0.0,0.0,36700160.0,18350080.0,107145.0,4664291.0,9873949.0,81876910.0,2717024.0,6.066973,50.694835,0.262677372,510832.0,1146880.0,5156368.0,6307840.0,10214848.0,228404262.0,57344.0,421659878.0,18790481920.0
193,32,7168,512,256,8,ActivationType.Silu,torch.bfloat16,torch.float8_e4m3fnuz,torch.float8_e4m3fnuz,QuantType.per_1x128,1,1,ck,stage1,16,moe_ck2stages_gemm1_256x16x128x256_1x4_MulABScaleExpertWeightA8W8blkscale_v1_Nswizzle0_Quant4_MulRoutedWeight1_silu_F8_F8_B16,313.4626,41.49366666666676,0.02%,17.98,8993.93,1153680.25,256.125,4.614925,175478962.0,0.0,0.0,73400320.0,36700160.0,96543.0,9231615.0,17458908.0,150069171.0,5291197.0,3.445281,20.733813,0.0170297294,645120.0,2293760.0,4928000.0,6963200.0,9912320.0,103844581.0,4096.0,335238090.0,37580963840.0
193,32,7168,512,256,8,ActivationType.Silu,torch.bfloat16,torch.float8_e4m3fnuz,torch.float8_e4m3fnuz,QuantType.per_1x128,1,1,ck,stage2,16,moe_ck2stages_gemm2_256x16x128x256_1x4_MulABScaleExpertWeightA8W8blkscale_v1_Nswizzle0_Quant4_MulRoutedWeight0_F8_F8_B16,160.7055,41.49366666666676,16.79%,35.08,17543.02,575865.125,3584.0,4.345248,97555511.0,0.0,0.0,36700160.0,18350080.0,106900.0,4664291.0,10161554.0,82080687.0,2626845.0,6.252987,50.452696,0.261888133,510832.0,1146880.0,5156368.0,6307840.0,10214848.0,219273776.0,57344.0,407162264.0,18790481920.0
198,32,7168,2048,33,10,ActivationType.Silu,torch.bfloat16,torch.float8_e4m3fnuz,torch.float8_e4m3fnuz,QuantType.per_1x128,1,0,asm,asm_1stage,32,_ZN5aiter47fmoe_bf16_blockscaleFp8_g1u1_vs_silu_1tg_32x256E,395.1949,0.0,0.00%,71.32,3679.23,1433869.625,38400.0,9.627533,193039176.0,0.0,0.0,181665792.0,90832896.0,289912.0,12091251.0,17555698.0,165109048.0,5683343.0,0.0,10.126902,0.294762573,1189056.0,5677056.0,14486240.0,0.0,4460544.0,59090553.0,1376.0,176354013.0,93012885504.0
199,32,7168,2048,33,10,ActivationType.Silu,torch.bfloat16,torch.float8_e4m3fnuz,torch.float8_e4m3fnuz,QuantType.per_Token,1,0,asm,asm_1stage,32,_ZN5aiter45fmoe_bf16_pertokenFp8_g1u1_vs_silu_1tg_32x512E,378.5822,0.0,0.00%,74.45,3840.68,1435010.9375,19200.0,9.262905,100394820.0,0.0,0.0,181665792.0,90832896.0,176448.0,11785104.0,11423376.0,75154233.0,6414086.0,0.0,5.123897,0.067068113,536976.0,5677056.0,9330304.0,0.0,2114112.0,4639604.0,688.0,100355731.0,93012885504.0
200,56,6144,4096,8,2,ActivationType.Silu,torch.bfloat16,torch.float8_e4m3fnuz,torch.float8_e4m3fnuz,QuantType.per_1x128,1,0,asm,asm_1stage,32,_ZN5aiter47fmoe_bf16_blockscaleFp8_g1u1_vs_silu_1tg_32x256E,169.7414,0.0,0.50%,99.63,3564.32,593954.375,23296.0,8.709185,41533999.0,0.0,0.0,75497472.0,37748736.0,198136.0,5122536.0,2245971.0,29345296.0,2820226.0,0.0,4.826294,0.156011028,502784.0,2359296.0,6066176.0,0.0,1884160.0,12352927.0,768.0,41595758.0,38654705664.0
201,64,2048,192,128,8,ActivationType.Silu,torch.bfloat16,torch.bfloat16,torch.bfloat16,QuantType.No,1,0,ck,stage1,32,moe_ck2stages_gemm1_256x32x64x64_1x4_TypeCast_v1_Nswizzle0_Quant0_MulRoutedWeight0_silu_B16_B16_B16,57.8263,0.0,0.00%,20.89,5231.43,197403.25,192.0,6.801195,36777222.0,12484608.0,0.0,0.0,12484608.0,46624.0,1581224.0,6366959.0,31188086.0,1221704.0,0.103720955,12.65931,0.00232355527,252984.0,780288.0,1392936.0,48768.0,2048256.0,43467830.0,1728.0,47617705.0,6392119296.0
201,64,2048,192,128,8,ActivationType.Silu,torch.bfloat16,torch.bfloat16,torch.bfloat16,QuantType.No,1,0,ck,stage2,32,moe_ck2stages_gemm2_256x32x64x64_1x4_TypeCastExpertWeight_v1_Nswizzle0_Quant0_MulRoutedWeight1_B16_B16_B16,36.7808,0.0,0.00%,32.84,8224.79,99669.8125,2048.0,7.820172,13951025.0,6242304.0,0.0,0.0,6242304.0,77088.0,830338.0,1393144.0,9488833.0,538156.0,1.236386,56.180086,0.114387645,345440.0,390144.0,2178464.0,260096.0,2682240.0,68743195.0,18432.0,94547938.0,3196059648.0
202,64,2048,192,128,8,ActivationType.Silu,torch.bfloat16,torch.bfloat16,torch.bfloat16,QuantType.No,1,1,ck,stage1,32,moe_ck2stages_gemm1_256x32x64x64_1x4_TypeCastExpertWeight_v1_Nswizzle0_Quant0_MulRoutedWeight1_silu_B16_B16_B16,59.6034,0.0,0.00%,20.27,5075.45,197501.125,192.0,6.616026,37467658.0,12484608.0,0.0,0.0,12484608.0,48297.0,1581847.0,5772538.0,31758412.0,1177601.0,0.107816368,12.571776,0.00258332157,252984.0,780288.0,1415796.0,48768.0,2048256.0,41312691.0,1728.0,45492194.0,6392119296.0
202,64,2048,192,128,8,ActivationType.Silu,torch.bfloat16,torch.bfloat16,torch.bfloat16,QuantType.No,1,1,ck,stage2,32,moe_ck2stages_gemm2_256x32x64x64_1x4_TypeCast_v1_Nswizzle0_Quant0_MulRoutedWeight0_B16_B16_B16,37.1828,0.0,0.00%,32.49,8135.86,99516.125,2048.0,8.323022,12714467.0,6242304.0,0.0,0.0,6242304.0,73901.0,828908.0,1341367.0,8930130.0,487804.0,1.368029,53.806845,0.199269279,345440.0,390144.0,1999648.0,260096.0,2682240.0,56313102.0,18432.0,81840057.0,3196059648.0
203,64,2048,192,128,8,ActivationType.Gelu,torch.bfloat16,torch.bfloat16,torch.bfloat16,QuantType.No,1,0,ck,stage1,32,moe_ck2stages_gemm1_256x32x64x64_1x4_TypeCast_v1_Nswizzle0_Quant0_MulRoutedWeight0_gelu_B16_B16_B16,57.2371,0.0,0.00%,21.1,5285.28,197476.25,192.0,6.569207,37498053.0,12484608.0,0.0,0.0,12484608.0,48916.0,1581350.0,7423523.0,31974451.0,1177878.0,0.108090243,12.689283,0.00197926072,252984.0,780288.0,1267858.0,48768.0,2048256.0,41887577.0,1728.0,45801060.0,6392119296.0
203,64,2048,192,128,8,ActivationType.Gelu,torch.bfloat16,torch.bfloat16,torch.bfloat16,QuantType.No,1,0,ck,stage2,32,moe_ck2stages_gemm2_256x32x64x64_1x4_TypeCastExpertWeight_v1_Nswizzle0_Quant0_MulRoutedWeight1_B16_B16_B16,36.9747,0.0,0.00%,32.67,8181.65,99665.625,2048.0,7.555559,14123224.0,6242304.0,0.0,0.0,6242304.0,77258.0,830077.0,1311994.0,9899710.0,533858.0,1.226144,54.952669,0.124770701,345440.0,390144.0,2178464.0,260096.0,2682240.0,67979464.0,18432.0,93254732.0,3196059648.0
204,64,2048,192,128,8,ActivationType.Gelu,torch.bfloat16,torch.bfloat16,torch.bfloat16,QuantType.No,1,1,ck,stage1,32,moe_ck2stages_gemm1_256x32x64x64_1x4_TypeCastExpertWeight_v1_Nswizzle0_Quant0_MulRoutedWeight1_gelu_B16_B16_B16,57.9738,0.0,0.00%,20.84,5218.12,197508.9375,192.0,6.774985,37349311.0,12484608.0,0.0,0.0,12484608.0,52042.0,1581465.0,6618789.0,31418922.0,1180991.0,0.107203943,12.640962,0.00206744809,252984.0,780288.0,1304544.0,48768.0,2048256.0,42051694.0,1728.0,46003864.0,6392119296.0
204,64,2048,192,128,8,ActivationType.Gelu,torch.bfloat16,torch.bfloat16,torch.bfloat16,QuantType.No,1,1,ck,stage2,32,moe_ck2stages_gemm2_256x32x64x64_1x4_TypeCast_v1_Nswizzle0_Quant0_MulRoutedWeight0_B16_B16_B16,36.4843,0.0,0.00%,33.11,8291.63,99521.8125,2048.0,8.226852,13340172.0,6242304.0,0.0,0.0,6242304.0,73867.0,828966.0,1498579.0,9477971.0,499618.0,1.325842,53.814807,0.266199578,345440.0,390144.0,1999648.0,260096.0,2682240.0,60797022.0,18432.0,84456631.0,3196059648.0
205,64,4096,192,128,8,ActivationType.Silu,torch.bfloat16,torch.bfloat16,torch.bfloat16,QuantType.No,1,0,ck,stage1,32,moe_ck2stages_gemm1_256x32x64x64_1x4_TypeCast_v1_Nswizzle0_Quant0_MulRoutedWeight0_silu_B16_B16_B16,103.2754,0.0,0.00%,23.39,5858.4,389305.875,192.0,7.281315,73216107.0,24576000.0,0.0,0.0,24576000.0,72352.0,3116027.0,10456352.0,63774124.0,2198476.0,0.0570348603,13.479263,0.00132071348,489000.0,1536000.0,2259000.0,48000.0,3936000.0,83675883.0,1728.0,90752165.0,12582912000.0
205,64,4096,192,128,8,ActivationType.Silu,torch.bfloat16,torch.bfloat16,torch.bfloat16,QuantType.No,1,0,ck,stage2,32,moe_ck2stages_gemm2_256x32x64x64_1x4_TypeCastExpertWeight_v1_Nswizzle0_Quant0_MulRoutedWeight1_B16_B16_B16,61.2162,0.0,0.08%,39.47,9883.47,194209.0,4096.0,9.136105,26764646.0,12288000.0,0.0,0.0,12288000.0,153670.0,1619214.0,4807358.0,18868980.0,864134.0,1.526147,71.643164,0.231124895,680064.0,768000.0,4291072.0,512000.0,5280256.0,142236279.0,36864.0,192281816.0,6291456000.0
206,64,4096,192,128,8,ActivationType.Silu,torch.bfloat16,torch.bfloat16,torch.bfloat16,QuantType.No,1,1,ck,stage1,32,moe_ck2stages_gemm1_256x32x64x64_1x4_TypeCastExpertWeight_v1_Nswizzle0_Quant0_MulRoutedWeight1_silu_B16_B16_B16,103.4443,0.0,0.00%,23.35,5848.83,389372.125,192.0,7.380899,71780627.0,24576000.0,0.0,0.0,24576000.0,74167.0,3116507.0,9984166.0,62248403.0,2238423.0,0.0560156724,13.458764,0.00139689083,489000.0,1536000.0,2281500.0,48000.0,3936000.0,85139130.0,1728.0,92262845.0,12582912000.0
206,64,4096,192,128,8,ActivationType.Silu,torch.bfloat16,torch.bfloat16,torch.bfloat16,QuantType.No,1,1,ck,stage2,32,moe_ck2stages_gemm2_256x32x64x64_1x4_TypeCast_v1_Nswizzle0_Quant0_MulRoutedWeight0_B16_B16_B16,60.5101,0.0,0.00%,39.93,9998.8,194066.6875,4096.0,9.150831,27047325.0,12288000.0,0.0,0.0,12288000.0,144302.0,1618127.0,5490026.0,20276998.0,913533.0,1.452469,69.390158,0.344530206,680064.0,768000.0,3939072.0,512000.0,5280256.0,148263145.0,36864.0,195682022.0,6291456000.0
207,64,4096,192,128,8,ActivationType.Gelu,torch.bfloat16,torch.bfloat16,torch.bfloat16,QuantType.No,1,0,ck,stage1,32,moe_ck2stages_gemm1_256x32x64x64_1x4_TypeCast_v1_Nswizzle0_Quant0_MulRoutedWeight0_gelu_B16_B16_B16,102.5206,0.0,0.00%,23.57,5901.53,389516.0625,192.0,7.235721,72661240.0,24576000.0,0.0,0.0,24576000.0,74776.0,3116019.0,9881228.0,63384034.0,2226310.0,0.0564343109,13.476643,0.00141849992,489000.0,1536000.0,2178167.0,48000.0,3936000.0,84766053.0,1728.0,91700082.0,12582912000.0
207,64,4096,192,128,8,ActivationType.Gelu,torch.bfloat16,torch.bfloat16,torch.bfloat16,QuantType.No,1,0,ck,stage2,32,moe_ck2stages_gemm2_256x32x64x64_1x4_TypeCastExpertWeight_v1_Nswizzle0_Quant0_MulRoutedWeight1_B16_B16_B16,61.2123,0.0,0.13%,39.47,9884.1,194205.5,4096.0,8.624151,29382376.0,12288000.0,0.0,0.0,12288000.0,153381.0,1619219.0,5846197.0,21480118.0,913420.0,1.43882,71.185435,0.273669429,680064.0,768000.0,4291072.0,512000.0,5280256.0,150636681.0,36864.0,202649103.0,6291456000.0
208,64,4096,192,128,8,ActivationType.Gelu,torch.bfloat16,torch.bfloat16,torch.bfloat16,QuantType.No,1,1,ck,stage1,32,moe_ck2stages_gemm1_256x32x64x64_1x4_TypeCastExpertWeight_v1_Nswizzle0_Quant0_MulRoutedWeight1_gelu_B16_B16_B16,102.3688,0.0,0.00%,23.6,5910.28,389496.1875,192.0,7.45509,72393818.0,24576000.0,0.0,0.0,24576000.0,77400.0,3116629.0,10813442.0,62739508.0,2231866.0,0.0553017309,13.254294,0.00128058071,489000.0,1536000.0,2172000.0,48000.0,3936000.0,85144032.0,1728.0,92034172.0,12582912000.0
208,64,4096,192,128,8,ActivationType.Gelu,torch.bfloat16,torch.bfloat16,torch.bfloat16,QuantType.No,1,1,ck,stage2,32,moe_ck2stages_gemm2_256x32x64x64_1x4_TypeCast_v1_Nswizzle0_Quant0_MulRoutedWeight0_B16_B16_B16,60.7588,0.0,0.00%,39.76,9957.87,194067.25,4096.0,8.72957,28433973.0,12288000.0,0.0,0.0,12288000.0,145147.0,1618109.0,5465893.0,21670593.0,1348725.0,0.994761338,73.127435,0.538847839,680064.0,768000.0,3939072.0,512000.0,5280256.0,242615213.0,36864.0,301107374.0,6291456000.0
209,64,4096,384,128,8,ActivationType.Gelu,torch.bfloat16,torch.bfloat16,torch.bfloat16,QuantType.No,1,0,ck,stage1,32,moe_ck2stages_gemm1_256x32x64x64_1x4_TypeCast_v1_Nswizzle0_Quant0_MulRoutedWeight0_gelu_B16_B16_B16,193.9054,0.0,0.00%,24.92,6235.04,769619.0,384.0,8.84247,119779547.0,48758784.0,0.0,0.0,48758784.0,151088.0,6160004.0,15108187.0,103053997.0,3656362.0,0.0680753802,26.881383,0.00100506116,970176.0,3047424.0,4321747.0,95232.0,7809024.0,242886223.0,3456.0,300839205.0,24964497408.0
209,64,4096,384,128,8,ActivationType.Gelu,torch.bfloat16,torch.bfloat16,torch.bfloat16,QuantType.No,1,0,ck,stage2,32,moe_ck2stages_gemm2_256x32x64x128_1x4_TypeCastExpertWeight_v1_Nswizzle0_Quant0_MulRoutedWeight1_B16_B16_B16,109.9553,0.0,0.52%,43.94,10995.45,385212.75,4096.0,8.305443,66206216.0,24379392.0,0.0,0.0,24379392.0,271943.0,3147261.0,8554421.0,52954067.0,1868620.0,0.703734823,49.503782,0.301219409,1150912.0,1523712.0,6450880.0,507904.0,9047808.0,207703313.0,36864.0,285825490.0,12482248704.0
210,64,4096,384,128,8,ActivationType.Gelu,torch.bfloat16,torch.bfloat16,torch.bfloat16,QuantType.No,1,1,ck,stage1,32,moe_ck2stages_gemm1_256x32x64x64_1x4_TypeCastExpertWeight_v1_Nswizzle0_Quant0_MulRoutedWeight1_gelu_B16_B16_B16,193.8849,0.0,0.00%,24.92,6235.7,769738.0,384.0,9.039235,117284223.0,48758784.0,0.0,0.0,48758784.0,153868.0,6160981.0,13928389.0,100086949.0,3603358.0,0.0691745461,26.971469,0.000972984969,970176.0,3047424.0,4309248.0,95232.0,7809024.0,239606835.0,3456.0,297051102.0,24964497408.0
210,64,4096,384,128,8,ActivationType.Gelu,torch.bfloat16,torch.bfloat16,torch.bfloat16,QuantType.No,1,1,ck,stage2,32,moe_ck2stages_gemm2_256x32x64x128_1x4_TypeCast_v1_Nswizzle0_Quant0_MulRoutedWeight0_B16_B16_B16,110.5413,0.0,0.00%,43.71,10937.16,385053.25,4096.0,7.938909,69376253.0,24379392.0,0.0,0.0,24379392.0,264804.0,3145984.0,9492469.0,57138208.0,2096942.0,0.632201111,48.272182,0.450492956,1150912.0,1523712.0,6101696.0,507904.0,9047808.0,221018590.0,36864.0,310251078.0,12482248704.0
211,64,4096,384,128,8,ActivationType.Silu,torch.bfloat16,torch.bfloat16,torch.bfloat16,QuantType.No,1,0,ck,stage1,32,moe_ck2stages_gemm1_256x32x64x64_1x4_TypeCast_v1_Nswizzle0_Quant0_MulRoutedWeight0_silu_B16_B16_B16,194.5733,0.0,0.00%,24.83,6213.64,769616.375,384.0,8.843075,120057542.0,48758784.0,0.0,0.0,48758784.0,148800.0,6160199.0,14658555.0,103227920.0,3624022.0,0.0687488688,26.918766,0.00096699754,970176.0,3047424.0,4481856.0,95232.0,7809024.0,239891154.0,3456.0,298306335.0,24964497408.0
211,64,4096,384,128,8,ActivationType.Silu,torch.bfloat16,torch.bfloat16,torch.bfloat16,QuantType.No,1,0,ck,stage2,32,moe_ck2stages_gemm2_256x32x64x128_1x4_TypeCastExpertWeight_v1_Nswizzle0_Quant0_MulRoutedWeight1_B16_B16_B16,110.2342,0.0,0.39%,43.83,10967.63,385204.75,4096.0,7.976115,68042615.0,24379392.0,0.0,0.0,24379392.0,271941.0,3147215.0,8226767.0,54869235.0,2083386.0,0.634096637,49.143884,0.321071473,1150912.0,1523712.0,6450880.0,507904.0,9047808.0,230277664.0,36864.0,314909418.0,12482248704.0
212,64,4096,384,128,8,ActivationType.Silu,torch.bfloat16,torch.bfloat16,torch.bfloat16,QuantType.No,1,1,ck,stage1,32,moe_ck2stages_gemm1_256x32x64x64_1x4_TypeCastExpertWeight_v1_Nswizzle0_Quant0_MulRoutedWeight1_silu_B16_B16_B16,194.6331,0.0,0.00%,24.83,6211.73,769735.75,384.0,8.707839,121810065.0,48758784.0,0.0,0.0,48758784.0,150399.0,6161143.0,15373401.0,104657329.0,3599872.0,0.0691269207,27.038833,0.00107575286,970176.0,3047424.0,4526496.0,95232.0,7809024.0,239781512.0,3456.0,297998191.0,24964497408.0
212,64,4096,384,128,8,ActivationType.Silu,torch.bfloat16,torch.bfloat16,torch.bfloat16,QuantType.No,1,1,ck,stage2,32,moe_ck2stages_gemm2_256x32x64x128_1x4_TypeCast_v1_Nswizzle0_Quant0_MulRoutedWeight0_B16_B16_B16,110.2985,0.0,0.00%,43.81,10961.24,385054.25,4096.0,7.935578,70191351.0,24379392.0,0.0,0.0,24379392.0,264863.0,3146028.0,9980742.0,57827790.0,1853903.0,0.716421036,49.530332,0.393576387,1150912.0,1523712.0,6101696.0,507904.0,9047808.0,197750449.0,36864.0,280914739.0,12482248704.0
213,64,4096,384,128,8,ActivationType.Silu,torch.bfloat16,torch.float8_e4m3fnuz,torch.float8_e4m3fnuz,QuantType.per_Tensor,1,0,ck,stage1,32,moe_ck2stages_gemm1_256x32x64x128_1x4_MulABScale_v1_Nswizzle0_Quant1_MulRoutedWeight0_silu_F8_F8_B16,104.2115,43.98311111111107,0.00%,46.37,5803.26,384511.125,384.0,8.247837,62253507.0,0.0,0.0,48758784.0,24379392.0,90422.0,3079034.0,8138411.0,52791090.0,1910487.0,9.23289,26.014469,0.00174444278,770784.0,1523712.0,2821248.0,6737664.0,10642176.0,116611094.0,3456.0,151871618.0,24964497408.0
213,64,4096,384,128,8,ActivationType.Silu,torch.bfloat16,torch.float8_e4m3fnuz,torch.float8_e4m3fnuz,QuantType.per_Tensor,1,0,ck,stage2,32,moe_ck2stages_gemm2_256x32x64x128_1x4_MulABScaleExpertWeight_v1_Nswizzle0_Quant1_MulRoutedWeight1_F8_F8_B16,61.6859,43.98311111111107,0.38%,78.33,9803.96,192696.875,4096.0,10.496556,22046694.0,0.0,0.0,24379392.0,12189696.0,156927.0,1607036.0,3617828.0,13896286.0,772376.0,16.134902,60.928324,0.161971984,865216.0,761856.0,4863680.0,5079040.0,9809664.0,100777686.0,36864.0,153435028.0,12482248704.0
214,64,4096,384,128,8,ActivationType.Silu,torch.bfloat16,torch.float8_e4m3fnuz,torch.float8_e4m3fnuz,QuantType.per_Tensor,1,1,ck,stage1,32,moe_ck2stages_gemm1_256x32x64x256_1x4_MulABScale_v1_Nswizzle0_Quant1_MulRoutedWeight1_silu_F8_F8_B16,104.4204,43.9602222222222,0.00%,46.27,5791.65,386132.0,384.0,8.446704,59977650.0,0.0,0.0,48758784.0,24379392.0,84323.0,3092789.0,6572849.0,50409225.0,1921294.0,3.045026,24.710484,0.0148390352,583296.0,1523712.0,2967072.0,2237952.0,6142464.0,53305065.0,3456.0,145288444.0,24964497408.0
214,64,4096,384,128,8,ActivationType.Silu,torch.bfloat16,torch.float8_e4m3fnuz,torch.float8_e4m3fnuz,QuantType.per_Tensor,1,1,ck,stage2,32,moe_ck2stages_gemm2_256x32x64x128_1x4_MulABScaleExpertWeight_v1_Nswizzle0_Quant1_MulRoutedWeight0_F8_F8_B16,61.5368,43.9602222222222,0.00%,78.52,9827.72,192568.75,4096.0,9.891284,23228642.0,0.0,0.0,24379392.0,12189696.0,148677.0,1606153.0,4560199.0,16149948.0,771777.0,16.893535,66.913539,0.168134088,865216.0,761856.0,4133568.0,5079040.0,9809664.0,114281307.0,36864.0,160940401.0,12482248704.0
215,64,4096,384,128,8,ActivationType.Silu,torch.bfloat16,torch.float8_e4m3fnuz,torch.float8_e4m3fnuz,QuantType.per_Token,1,0,asm,asm_1stage,32,_ZN5aiter45fmoe_bf16_pertokenFp8_g1u1_vs_silu_1tg_32x192E,167.1818,0.0,0.00%,28.9,3617.42,581171.75,9216.0,9.008691,74341273.0,0.0,0.0,73138176.0,36569088.0,148240.0,4795096.0,9020773.0,62477827.0,2717543.0,0.0,9.223703,0.161911186,598176.0,2285568.0,6111328.0,0.0,2349056.0,55825497.0,1152.0,76784447.0,37446746112.0
216,64,4096,384,128,8,ActivationType.Silu,torch.bfloat16,torch.float8_e4m3fnuz,torch.float8_e4m3fnuz,QuantType.per_Token,1,1,asm,asm_1stage,32,_ZN5aiter50fmoe_bf16_pertokenFp8_g1u1_vs_tkw1_silu_1tg_32x192E,168.1519,0.0,0.00%,28.73,3596.55,581219.25,8192.0,8.499234,78713039.0,0.0,0.0,73138176.0,36569088.0,147389.0,4776213.0,7095829.0,65961981.0,2689534.0,0.0,9.17459,0.139005897,550560.0,2285568.0,5619296.0,0.0,2222080.0,49470897.0,1152.0,75482421.0,37446746112.0
217,64,4096,384,128,8,ActivationType.Gelu,torch.bfloat16,torch.float8_e4m3fnuz,torch.float8_e4m3fnuz,QuantType.per_Tensor,1,0,ck,stage1,32,moe_ck2stages_gemm1_256x32x64x128_1x4_MulABScale_v1_Nswizzle0_Quant1_MulRoutedWeight0_gelu_F8_F8_B16,103.9357,44.35177777777782,0.00%,46.49,5818.66,384493.125,384.0,8.403792,61770891.0,0.0,0.0,48758784.0,24379392.0,92126.0,3079088.0,8258838.0,52269616.0,1953614.0,9.039742,26.090701,0.00182266281,770784.0,1523712.0,2622267.0,6737664.0,10642176.0,120366448.0,3456.0,155571145.0,24964497408.0
217,64,4096,384,128,8,ActivationType.Gelu,torch.bfloat16,torch.float8_e4m3fnuz,torch.float8_e4m3fnuz,QuantType.per_Tensor,1,0,ck,stage2,32,moe_ck2stages_gemm2_256x32x64x128_1x4_MulABScaleExpertWeight_v1_Nswizzle0_Quant1_MulRoutedWeight1_F8_F8_B16,62.2464,44.35177777777782,0.50%,77.62,9715.68,192700.375,4096.0,10.488319,22284381.0,0.0,0.0,24379392.0,12189696.0,157488.0,1607107.0,4276093.0,14091075.0,771003.0,16.978515,67.38007,0.16863053,865216.0,761856.0,4863680.0,5079040.0,9809664.0,106845980.0,36864.0,161251352.0,12482248704.0
218,64,4096,384,128,8,ActivationType.Gelu,torch.bfloat16,torch.float8_e4m3fnuz,torch.float8_e4m3fnuz,QuantType.per_Tensor,1,1,ck,stage1,32,moe_ck2stages_gemm1_256x32x64x256_1x4_MulABScale_v1_Nswizzle0_Quant1_MulRoutedWeight1_gelu_F8_F8_B16,104.1741,44.351999999999975,0.00%,46.38,5805.34,386198.5,384.0,8.383621,60195445.0,0.0,0.0,48758784.0,24379392.0,85853.0,3093065.0,8658383.0,50741096.0,1966606.0,2.977028,24.301125,0.0337417048,583296.0,1523712.0,2687328.0,2237952.0,6142464.0,53007282.0,3456.0,146145086.0,24964497408.0
218,64,4096,384,128,8,ActivationType.Gelu,torch.bfloat16,torch.float8_e4m3fnuz,torch.float8_e4m3fnuz,QuantType.per_Tensor,1,1,ck,stage2,32,moe_ck2stages_gemm2_256x32x64x128_1x4_MulABScaleExpertWeight_v1_Nswizzle0_Quant1_MulRoutedWeight0_F8_F8_B16,61.6063,44.351999999999975,0.00%,78.43,9816.63,192573.375,4096.0,10.145559,23575370.0,0.0,0.0,24379392.0,12189696.0,149161.0,1606190.0,5296605.0,16467927.0,798024.0,16.374636,66.60204,0.173260595,865216.0,761856.0,4133568.0,5079040.0,9809664.0,117528785.0,36864.0,165267516.0,12482248704.0
219,64,4096,384,128,8,ActivationType.Gelu,torch.bfloat16,torch.float8_e4m3fnuz,torch.float8_e4m3fnuz,QuantType.per_Token,1,0,asm,asm_1stage,32,_ZN5aiter45fmoe_bf16_pertokenFp8_g1u1_vs_gelu_1tg_32x192E,166.6375,0.0,0.00%,29.0,3629.23,580915.4375,9216.0,8.765236,77665083.0,0.0,0.0,73138176.0,36569088.0,147407.0,4796997.0,8192027.0,65841493.0,2637669.0,0.0,9.239439,0.12078965,598176.0,2285568.0,6182752.0,0.0,2349056.0,53710942.0,1152.0,74736946.0,37446746112.0
220,64,4096,384,128,8,ActivationType.Gelu,torch.bfloat16,torch.float8_e4m3fnuz,torch.float8_e4m3fnuz,QuantType.per_Token,1,1,asm,asm_1stage,32,_ZN5aiter50fmoe_bf16_pertokenFp8_g1u1_vs_tkw1_gelu_1tg_32x192E,167.6865,0.0,0.00%,28.81,3606.53,581088.875,8192.0,8.79739,77496255.0,0.0,0.0,73138176.0,36569088.0,147369.0,4777003.0,9357666.0,64727517.0,2710539.0,0.0,9.129008,0.120133531,550560.0,2285568.0,5690720.0,0.0,2222080.0,49543008.0,1152.0,75817856.0,37446746112.0
229,64,4096,384,128,8,ActivationType.Silu,torch.bfloat16,torch.float8_e4m3fnuz,torch.float8_e4m3fnuz,QuantType.per_1x128,1,0,asm,asm_1stage,32,_ZN5aiter47fmoe_bf16_blockscaleFp8_g1u1_vs_silu_1tg_32x128E,206.2611,0.0,0.00%,23.43,2932.04,579210.625,12288.0,8.25379,81241285.0,0.0,0.0,73138176.0,36569088.0,184204.0,4826006.0,7063250.0,66701562.0,3015863.0,0.0,9.093643,0.127698041,918096.0,2285568.0,7677504.0,0.0,3505728.0,64582167.0,1728.0,84039367.0,37446746112.0
230,64,4096,384,128,8,ActivationType.Gelu,torch.bfloat16,torch.float8_e4m3fnuz,torch.float8_e4m3fnuz,QuantType.per_1x128,1,0,asm,asm_1stage,32,_ZN5aiter47fmoe_bf16_blockscaleFp8_g1u1_vs_gelu_1tg_32x128E,206.0914,0.0,0.16%,23.45,2934.46,577507.625,12288.0,7.660807,89177528.0,0.0,0.0,73138176.0,36569088.0,184732.0,4826752.0,7117835.0,74716081.0,2960885.0,0.0,9.251739,0.0974806248,918096.0,2285568.0,7748928.0,0.0,3505728.0,64167983.0,1728.0,83700181.0,37446746112.0
231,64,4096,384,128,8,ActivationType.Silu,torch.bfloat16,torch.float8_e4m3fnuz,torch.float8_e4m3fnuz,QuantType.per_1x128,1,1,ck,stage1,16,moe_ck2stages_gemm1_128x16x128x128_1x2_MulABScaleExpertWeightA8W8blkscale_v1_Nswizzle0_Quant4_MulRoutedWeight1_silu_F8_F8_B16,113.4777,44.60499999999984,0.01%,42.58,5329.38,384502.0625,384.0,3.991662,36846380.0,0.0,0.0,24379392.0,12189696.0,126943.0,3078762.0,6347101.0,54620265.0,2018766.0,1.680643,6.483799,0.00318697999,123504.0,761856.0,1813872.0,1297536.0,1916544.0,31544051.0,960.0,40046407.0,12482248704.0
231,64,4096,384,128,8,ActivationType.Silu,torch.bfloat16,torch.float8_e4m3fnuz,torch.float8_e4m3fnuz,QuantType.per_1x128,1,1,ck,stage2,16,moe_ck2stages_gemm2_128x16x128x128_1x2_MulABScaleExpertWeightA8W8blkscale_v1_Nswizzle0_Quant4_MulRoutedWeight0_F8_F8_B16,63.3656,44.60499999999984,16.58%,76.25,9544.08,193037.625,4096.0,3.990232,29869022.0,0.0,0.0,12189696.0,6094848.0,138938.0,1609816.0,4591711.0,23838241.0,979439.0,6.701766,32.902985,0.491956414,170720.0,380928.0,2059360.0,2539520.0,3603328.0,52326239.0,10240.0,99744204.0,6241124352.0
232,64,4096,384,128,8,ActivationType.Gelu,torch.bfloat16,torch.float8_e4m3fnuz,torch.float8_e4m3fnuz,QuantType.per_1x128,1,1,ck,stage1,16,moe_ck2stages_gemm1_128x16x128x128_1x2_MulABScaleExpertWeightA8W8blkscale_v1_Nswizzle0_Quant4_MulRoutedWeight1_gelu_F8_F8_B16,111.9085,44.87222222222226,0.01%,43.18,5404.11,384512.5625,384.0,4.121833,35740941.0,0.0,0.0,24379392.0,12189696.0,133067.0,3079150.0,6313494.0,52482226.0,1959062.0,1.722859,6.537683,0.00356977073,123504.0,761856.0,1697808.0,1297536.0,1916544.0,31233257.0,960.0,39389783.0,12482248704.0
232,64,4096,384,128,8,ActivationType.Gelu,torch.bfloat16,torch.float8_e4m3fnuz,torch.float8_e4m3fnuz,QuantType.per_1x128,1,1,ck,stage2,16,moe_ck2stages_gemm2_128x16x128x128_1x2_MulABScaleExpertWeightA8W8blkscale_v1_Nswizzle0_Quant4_MulRoutedWeight0_F8_F8_B16,63.5311,44.87222222222226,16.57%,76.05,9519.22,193028.25,4096.0,4.166322,27866843.0,0.0,0.0,12189696.0,6094848.0,138642.0,1609919.0,3826179.0,21902394.0,984105.0,6.69881,33.030219,0.472894815,170720.0,380928.0,2059360.0,2539520.0,3603328.0,51605083.0,10240.0,100174091.0,6241124352.0
236,64,7168,256,256,8,ActivationType.Gelu,torch.bfloat16,torch.bfloat16,torch.bfloat16,QuantType.No,1,0,ck,stage1,32,moe_ck2stages_gemm1_256x32x64x64_1x4_TypeCast_v1_Nswizzle0_Quant0_MulRoutedWeight0_gelu_B16_B16_B16,400.0565,0.0,0.00%,14.09,7050.02,1636092.0,256.0,9.473448,263642060.0,104136704.0,0.0,0.0,104136704.0,178812.0,13090883.0,24566243.0,229331237.0,7161976.0,0.0424431254,35.862829,0.00223419467,2055712.0,6508544.0,8533120.0,116224.0,16503808.0,574910085.0,4352.0,785638929.0,53317992448.0
236,64,7168,256,256,8,ActivationType.Gelu,torch.bfloat16,torch.bfloat16,torch.bfloat16,QuantType.No,1,0,ck,stage2,32,moe_ck2stages_gemm2_256x32x64x64_1x4_TypeCastExpertWeight_v1_Nswizzle0_Quant0_MulRoutedWeight1_B16_B16_B16,222.0949,0.0,1.62%,25.38,12699.11,816292.75,7168.0,10.250636,118026326.0,52068352.0,0.0,0.0,52068352.0,301520.0,6645046.0,12349880.0,91951102.0,3255033.0,1.305332,83.33415,0.302064357,2669520.0,3254272.0,14171920.0,1627136.0,20847680.0,699472701.0,121856.0,831028627.0,26658996224.0
237,64,7168,256,256,8,ActivationType.Gelu,torch.bfloat16,torch.bfloat16,torch.bfloat16,QuantType.No,1,1,ck,stage1,32,moe_ck2stages_gemm1_256x32x64x64_1x4_TypeCastExpertWeight_v1_Nswizzle0_Quant0_MulRoutedWeight1_gelu_B16_B16_B16,400.6156,0.0,0.00%,14.07,7040.18,1636376.5,256.0,9.5131,263850842.0,104136704.0,0.0,0.0,104136704.0,180369.0,13093204.0,21621348.0,229255264.0,7344517.0,0.0414590409,35.702763,0.000559153416,2055712.0,6508544.0,8484352.0,116224.0,16503808.0,585362559.0,4352.0,800697328.0,53317992448.0
237,64,7168,256,256,8,ActivationType.Gelu,torch.bfloat16,torch.bfloat16,torch.bfloat16,QuantType.No,1,1,ck,stage2,32,moe_ck2stages_gemm2_256x32x64x128_1x4_TypeCast_v1_Nswizzle0_Quant0_MulRoutedWeight0_B16_B16_B16,221.3134,0.0,0.00%,25.47,12743.95,815913.6875,7168.0,9.939293,122478122.0,52068352.0,0.0,0.0,52068352.0,291560.0,6642104.0,14843421.0,98328907.0,3376767.0,1.26198,62.125821,0.461460428,2669520.0,3254272.0,13968528.0,1627136.0,20847680.0,500539893.0,121856.0,640816494.0,26658996224.0
238,64,7168,256,256,8,ActivationType.Gelu,torch.bfloat16,torch.float8_e4m3fnuz,torch.float8_e4m3fnuz,QuantType.per_Tensor,1,0,ck,stage1,32,moe_ck2stages_gemm1_256x32x64x256_1x4_MulABScale_v1_Nswizzle0_Quant1_MulRoutedWeight0_gelu_F8_F8_B16,203.8837,43.67099999999997,0.00%,27.65,6918.96,822309.5,256.0,10.205439,119294523.0,0.0,0.0,104136704.0,52068352.0,74083.0,6580622.0,12096685.0,101176949.0,3308449.0,3.807022,29.914721,0.018370929,1234880.0,3254272.0,4926337.0,4823296.0,13075200.0,102488590.0,4352.0,303203013.0,53317992448.0
238,64,7168,256,256,8,ActivationType.Gelu,torch.bfloat16,torch.float8_e4m3fnuz,torch.float8_e4m3fnuz,QuantType.per_Tensor,1,0,ck,stage2,32,moe_ck2stages_gemm2_256x32x64x256_1x4_MulABScaleExpertWeight_v1_Nswizzle0_Quant1_MulRoutedWeight1_F8_F8_B16,119.0881,43.67099999999997,1.59%,47.34,11845.54,408315.3125,7168.0,15.763974,34244573.0,0.0,0.0,52068352.0,26034176.0,209530.0,3381240.0,2859295.0,15663563.0,1065362.0,3.908389,71.850222,0.258129057,1652560.0,1627136.0,13866832.0,1627136.0,12712000.0,156118709.0,121856.0,239300831.0,26658996224.0
239,64,7168,256,256,8,ActivationType.Gelu,torch.bfloat16,torch.float8_e4m3fnuz,torch.float8_e4m3fnuz,QuantType.per_Tensor,1,1,ck,stage1,32,moe_ck2stages_gemm1_256x32x64x256_1x4_MulABScale_v1_Nswizzle0_Quant1_MulRoutedWeight1_gelu_F8_F8_B16,203.6749,42.93733333333327,0.00%,27.68,6926.05,822545.9375,256.0,10.399967,116957559.0,0.0,0.0,104136704.0,52068352.0,73657.0,6582141.0,13643025.0,98789835.0,3351775.0,3.754101,30.174056,0.0202228761,1234880.0,3254272.0,4870512.0,4823296.0,13075200.0,106074674.0,4352.0,310142795.0,53317992448.0
239,64,7168,256,256,8,ActivationType.Gelu,torch.bfloat16,torch.float8_e4m3fnuz,torch.float8_e4m3fnuz,QuantType.per_Tensor,1,1,ck,stage2,32,moe_ck2stages_gemm2_256x32x64x256_1x4_MulABScaleExpertWeight_v1_Nswizzle0_Quant1_MulRoutedWeight0_F8_F8_B16,117.8438,42.93733333333327,0.00%,47.84,11970.61,408089.1875,7168.0,13.789835,39329930.0,0.0,0.0,52068352.0,26034176.0,183934.0,3379424.0,6112567.0,23957451.0,1156092.0,3.655077,73.306992,0.268052862,1652560.0,1627136.0,11527824.0,1627136.0,12712000.0,184351650.0,121856.0,261073480.0,26658996224.0
240,64,7168,256,256,8,ActivationType.Gelu,torch.bfloat16,torch.float8_e4m3fnuz,torch.float8_e4m3fnuz,QuantType.per_Token,1,0,asm,asm_1stage,32,_ZN5aiter45fmoe_bf16_pertokenFp8_g1u1_vs_gelu_1tg_32x256E,329.8612,0.0,0.00%,17.09,4276.53,1233563.0625,7680.0,9.258482,149559716.0,0.0,0.0,156205056.0,78102528.0,159726.0,9990673.0,17308541.0,126719878.0,5461690.0,0.0,8.874059,0.13597259,901644.0,4881408.0,10839688.0,0.0,3562992.0,48278501.0,1088.0,148002419.0,79976988672.0
241,64,7168,256,256,8,ActivationType.Gelu,torch.bfloat16,torch.float8_e4m3fnuz,torch.float8_e4m3fnuz,QuantType.per_Token,1,1,asm,asm_1stage,32,_ZN5aiter50fmoe_bf16_pertokenFp8_g1u1_vs_tkw1_gelu_1tg_32x256E,333.3662,0.0,0.00%,16.91,4231.57,1233149.75,7168.0,9.187089,148409538.0,0.0,0.0,156205056.0,78102528.0,156541.0,9983507.0,17789030.0,124218608.0,5385120.0,0.0,8.717281,0.0666980743,858060.0,4881408.0,10055176.0,0.0,3446768.0,36810137.0,1088.0,143045432.0,79976988672.0
242,64,7168,256,256,8,ActivationType.Silu,torch.bfloat16,torch.bfloat16,torch.bfloat16,QuantType.No,1,0,ck,stage1,32,moe_ck2stages_gemm1_256x32x64x128_1x4_TypeCast_v1_Nswizzle0_Quant0_MulRoutedWeight0_silu_B16_B16_B16,401.9105,0.0,0.00%,14.03,7017.5,1645240.625,256.0,9.417888,263993560.0,104136704.0,0.0,0.0,104136704.0,108240.0,13165055.0,25370317.0,229559982.0,7318188.0,0.0416621667,30.271858,0.00887790863,2055712.0,6508544.0,8923824.0,116224.0,16503808.0,225460674.0,4352.0,675589716.0,53317992448.0
242,64,7168,256,256,8,ActivationType.Silu,torch.bfloat16,torch.bfloat16,torch.bfloat16,QuantType.No,1,0,ck,stage2,32,moe_ck2stages_gemm2_256x32x64x64_1x4_TypeCastExpertWeight_v1_Nswizzle0_Quant0_MulRoutedWeight1_B16_B16_B16,221.4446,0.0,1.30%,25.46,12736.4,816286.25,7168.0,10.819556,112836067.0,52068352.0,0.0,0.0,52068352.0,302218.0,6645036.0,15996516.0,86740671.0,3128185.0,1.359469,82.401976,0.270612043,2669520.0,3254272.0,14171920.0,1627136.0,20847680.0,651505720.0,121856.0,789009179.0,26658996224.0
243,64,7168,256,256,8,ActivationType.Silu,torch.bfloat16,torch.bfloat16,torch.bfloat16,QuantType.No,1,1,ck,stage1,32,moe_ck2stages_gemm1_256x32x64x64_1x4_TypeCastExpertWeight_v1_Nswizzle0_Quant0_MulRoutedWeight1_silu_B16_B16_B16,400.5584,0.0,0.00%,14.07,7041.19,1636244.125,256.0,9.755943,256711508.0,104136704.0,0.0,0.0,104136704.0,178745.0,13091364.0,22602996.0,222194405.0,7243257.0,0.0419305219,35.855292,0.000613495082,2055712.0,6508544.0,8749488.0,116224.0,16503808.0,581197500.0,4352.0,795076277.0,53317992448.0
243,64,7168,256,256,8,ActivationType.Silu,torch.bfloat16,torch.bfloat16,torch.bfloat16,QuantType.No,1,1,ck,stage2,32,moe_ck2stages_gemm2_256x32x64x64_1x4_TypeCast_v1_Nswizzle0_Quant0_MulRoutedWeight0_B16_B16_B16,220.8412,0.0,0.00%,25.53,12771.2,816027.5,7168.0,10.486564,116355129.0,52068352.0,0.0,0.0,52068352.0,279004.0,6642963.0,12562449.0,93508364.0,3757327.0,1.131499,79.845326,0.353103239,2669520.0,3254272.0,13053264.0,1627136.0,20847680.0,774967812.0,121856.0,918563324.0,26658996224.0
244,64,7168,256,256,8,ActivationType.Silu,torch.bfloat16,torch.float8_e4m3fnuz,torch.float8_e4m3fnuz,QuantType.per_Tensor,1,0,ck,stage1,16,moe_ck2stages_gemm1_256x16x128x256_1x4_MulABScale_v1_Nswizzle0_Quant1_MulRoutedWeight0_silu_F8_F8_B16,202.8922,40.93388888888887,0.00%,27.78,6952.77,819119.5,256.0,4.63878,110930915.0,0.0,0.0,52068352.0,26034176.0,41561.0,6555015.0,13044936.0,94919203.0,3640522.0,3.418969,14.690571,0.0106468253,461264.0,1627136.0,2491552.0,4765184.0,6857216.0,53554278.0,2304.0,163799725.0,26658996224.0
244,64,7168,256,256,8,ActivationType.Silu,torch.bfloat16,torch.float8_e4m3fnuz,torch.float8_e4m3fnuz,QuantType.per_Tensor,1,0,ck,stage2,16,moe_ck2stages_gemm2_256x16x128x256_1x4_MulABScaleExpertWeight_v1_Nswizzle0_Quant1_MulRoutedWeight1_F8_F8_B16,119.1331,40.93388888888887,1.23%,47.32,11841.06,408107.625,14336.0,4.443798,66548659.0,0.0,0.0,26034176.0,13017088.0,117752.0,3494295.0,6755228.0,55558016.0,1769229.0,1.556879,75.617863,0.67381083,572712.0,813568.0,6104896.0,1052912.0,4564112.0,289534744.0,64512.0,409120851.0,13329498112.0
245,64,7168,256,256,8,ActivationType.Silu,torch.bfloat16,torch.float8_e4m3fnuz,torch.float8_e4m3fnuz,QuantType.per_Tensor,1,1,ck,stage1,32,moe_ck2stages_gemm1_256x32x64x256_1x4_MulABScale_v1_Nswizzle0_Quant1_MulRoutedWeight1_silu_F8_F8_B16,203.5616,39.85644444444435,0.00%,27.69,6929.9,822489.1875,256.0,10.47192,116071517.0,0.0,0.0,104136704.0,52068352.0,71905.0,6582065.0,11347902.0,97849976.0,3264080.0,3.878722,30.592028,0.01560762,1234880.0,3254272.0,5211920.0,4823296.0,13075200.0,102796171.0,4352.0,304336148.0,53317992448.0
245,64,7168,256,256,8,ActivationType.Silu,torch.bfloat16,torch.float8_e4m3fnuz,torch.float8_e4m3fnuz,QuantType.per_Tensor,1,1,ck,stage2,32,moe_ck2stages_gemm2_256x32x64x256_1x4_MulABScaleExpertWeight_v1_Nswizzle0_Quant1_MulRoutedWeight0_F8_F8_B16,118.003,39.85644444444435,0.00%,47.77,11954.46,408085.5625,7168.0,14.745774,37663665.0,0.0,0.0,52068352.0,26034176.0,184028.0,3379421.0,5157096.0,22324750.0,1163917.0,3.647405,71.705691,0.286996749,1652560.0,1627136.0,11527824.0,1627136.0,12712000.0,180438454.0,121856.0,255907769.0,26658996224.0
246,64,7168,256,256,8,ActivationType.Silu,torch.bfloat16,torch.float8_e4m3fnuz,torch.float8_e4m3fnuz,QuantType.per_Token,1,0,asm,asm_1stage,32,_ZN5aiter45fmoe_bf16_pertokenFp8_g1u1_vs_silu_1tg_32x256E,329.3172,0.0,0.00%,17.12,4283.6,1233710.125,7680.0,9.535149,145762757.0,0.0,0.0,156205056.0,78102528.0,159195.0,9991020.0,16757851.0,122836384.0,5261712.0,0.0,8.771174,0.0837318047,901644.0,4881408.0,10752520.0,0.0,3562992.0,43084064.0,1088.0,141327984.0,79976988672.0
247,64,7168,256,256,8,ActivationType.Silu,torch.bfloat16,torch.float8_e4m3fnuz,torch.float8_e4m3fnuz,QuantType.per_Token,1,1,asm,asm_1stage,32,_ZN5aiter50fmoe_bf16_pertokenFp8_g1u1_vs_tkw1_silu_1tg_32x256E,333.6764,0.0,0.00%,16.89,4227.64,1233441.3125,7168.0,9.312094,148077563.0,0.0,0.0,156205056.0,78102528.0,157579.0,9980747.0,15177335.0,123834546.0,5603723.0,0.0,8.709423,0.0883479625,858060.0,4881408.0,9968008.0,0.0,3446768.0,37809663.0,1088.0,148794087.0,79976988672.0
248,64,7168,256,256,8,ActivationType.Silu,torch.bfloat16,torch.float8_e4m3fnuz,torch.float8_e4m3fnuz,QuantType.per_Tensor,1,0,ck,stage1,32,moe_ck2stages_gemm1_256x32x64x256_1x4_MulABScale_v1_Nswizzle0_Quant1_MulRoutedWeight0_silu_F8_F8_B16,203.5088,40.75999999999996,0.00%,27.7,6931.7,822309.25,256.0,10.451523,115824028.0,0.0,0.0,104136704.0,52068352.0,69126.0,6580616.0,11890310.0,97664047.0,3332202.0,3.784501,30.436181,0.0187914889,1234880.0,3254272.0,5135648.0,4823296.0,13075200.0,103247913.0,4352.0,310324034.0,53317992448.0
248,64,7168,256,256,8,ActivationType.Silu,torch.bfloat16,torch.float8_e4m3fnuz,torch.float8_e4m3fnuz,QuantType.per_Tensor,1,0,ck,stage2,32,moe_ck2stages_gemm2_256x32x64x256_1x4_MulABScaleExpertWeight_v1_Nswizzle0_Quant1_MulRoutedWeight1_F8_F8_B16,118.721,40.75999999999996,1.25%,47.48,11882.16,408316.8125,7168.0,15.28608,35651649.0,0.0,0.0,52068352.0,26034176.0,209640.0,3381234.0,3648076.0,17078439.0,1075397.0,3.873542,71.475988,0.249924916,1652560.0,1627136.0,13866832.0,1627136.0,12712000.0,156909700.0,121856.0,240196008.0,26658996224.0
249,64,7168,256,256,8,ActivationType.Silu,torch.bfloat16,torch.float8_e4m3fnuz,torch.float8_e4m3fnuz,QuantType.per_Tensor,1,1,ck,stage1,16,moe_ck2stages_gemm1_256x16x128x256_1x4_MulABScale_v1_Nswizzle0_Quant1_MulRoutedWeight1_silu_F8_F8_B16,203.0886,42.50500000000002,0.00%,27.76,6946.04,819165.125,256.0,4.674257,111855017.0,0.0,0.0,52068352.0,26034176.0,41905.0,6555429.0,11482088.0,95803450.0,3648766.0,3.408131,14.731976,0.00894161695,461264.0,1627136.0,2522424.0,4765184.0,6857216.0,54376008.0,2304.0,164783765.0,26658996224.0
249,64,7168,256,256,8,ActivationType.Silu,torch.bfloat16,torch.float8_e4m3fnuz,torch.float8_e4m3fnuz,QuantType.per_Tensor,1,1,ck,stage2,16,moe_ck2stages_gemm2_256x16x128x256_1x4_MulABScaleExpertWeight_v1_Nswizzle0_Quant1_MulRoutedWeight0_F8_F8_B16,119.4068,42.50500000000002,0.00%,47.21,11813.92,407994.25,14336.0,4.457565,64881589.0,0.0,0.0,26034176.0,13017088.0,105483.0,3493353.0,8593578.0,54680258.0,2038774.0,1.349456,76.23985,0.781892263,572712.0,813568.0,5698112.0,1052912.0,4564112.0,343847956.0,64512.0,475888800.0,13329498112.0
252,64,7168,256,256,8,ActivationType.Gelu,torch.bfloat16,torch.float8_e4m3fnuz,torch.float8_e4m3fnuz,QuantType.per_Tensor,1,0,ck,stage1,16,moe_ck2stages_gemm1_256x16x128x256_1x4_MulABScale_v1_Nswizzle0_Quant1_MulRoutedWeight0_gelu_F8_F8_B16,203.2922,42.39333333333333,0.00%,27.73,6939.09,819132.1875,256.0,4.641988,111890178.0,0.0,0.0,52068352.0,26034176.0,43919.0,6555123.0,13379400.0,95794106.0,3661228.0,3.410259,14.804111,0.0125505558,461264.0,1627136.0,2460209.0,4765184.0,6857216.0,54192070.0,2304.0,165487294.0,26658996224.0
252,64,7168,256,256,8,ActivationType.Gelu,torch.bfloat16,torch.float8_e4m3fnuz,torch.float8_e4m3fnuz,QuantType.per_Tensor,1,0,ck,stage2,16,moe_ck2stages_gemm2_256x16x128x256_1x4_MulABScaleExpertWeight_v1_Nswizzle0_Quant1_MulRoutedWeight1_F8_F8_B16,119.4149,42.39333333333333,1.59%,47.21,11813.12,408108.25,14336.0,4.735608,62003743.0,0.0,0.0,26034176.0,13017088.0,117548.0,3494293.0,6903489.0,50934553.0,1810874.0,1.513085,74.810247,0.64654278,572712.0,813568.0,6104896.0,1052912.0,4564112.0,295868208.0,64512.0,416466370.0,13329498112.0
256,64,7168,256,256,8,ActivationType.Gelu,torch.bfloat16,torch.float8_e4m3fnuz,torch.float8_e4m3fnuz,QuantType.per_1x128,1,0,asm,asm_1stage,32,_ZN5aiter50fmoe_bf16_blockscaleFp8_g1u1_vs_gelu_1tg_ps_32x256E,335.6816,0.0,1.99%,16.79,4202.38,1228676.0,7680.0,9.718187,142701521.0,0.0,0.0,156205056.0,78102528.0,202292.0,9952269.0,16153041.0,118539426.0,5308896.0,0.0,8.751809,0.151687163,1022408.0,4881408.0,12608744.0,0.0,3835392.0,46960116.0,1216.0,142041013.0,79976988672.0
257,64,7168,256,256,8,ActivationType.Gelu,torch.bfloat16,torch.float8_e4m3fnuz,torch.float8_e4m3fnuz,QuantType.per_1x128,1,1,ck,stage1,16,moe_ck2stages_gemm1_256x16x128x256_1x4_MulABScaleExpertWeightA8W8blkscale_v1_Nswizzle0_Quant4_MulRoutedWeight1_gelu_F8_F8_B16,210.5608,45.566555555555546,0.02%,26.77,6699.55,820962.75,256.0,4.588288,115287941.0,0.0,0.0,52068352.0,26034176.0,83975.0,6569566.0,12563638.0,96695879.0,3713316.0,3.479833,15.232838,0.0119062024,457632.0,1627136.0,3363232.0,4939520.0,7031552.0,68574161.0,2304.0,172980479.0,26658996224.0
257,64,7168,256,256,8,ActivationType.Gelu,torch.bfloat16,torch.float8_e4m3fnuz,torch.float8_e4m3fnuz,QuantType.per_1x128,1,1,ck,stage2,16,moe_ck2stages_gemm2_256x16x128x256_1x4_MulABScaleExpertWeightA8W8blkscale_v1_Nswizzle0_Quant4_MulRoutedWeight0_F8_F8_B16,120.1015,45.566555555555546,16.67%,46.94,11745.59,408868.875,7168.0,4.215949,69849522.0,0.0,0.0,26034176.0,13017088.0,144931.0,3385661.0,7671390.0,57618182.0,1984344.0,11.726591,74.304323,0.587197109,471016.0,813568.0,5981640.0,8949248.0,12460448.0,251770944.0,64512.0,453647840.0,13329498112.0
258,64,7168,256,256,8,ActivationType.Silu,torch.bfloat16,torch.float8_e4m3fnuz,torch.float8_e4m3fnuz,QuantType.per_1x128,1,1,ck,stage1,16,moe_ck2stages_gemm1_256x16x128x256_1x4_MulABScaleExpertWeightA8W8blkscale_v1_Nswizzle0_Quant4_MulRoutedWeight1_silu_F8_F8_B16,210.0873,45.23755555555517,0.02%,26.83,6714.65,820923.125,256.0,4.551282,116185278.0,0.0,0.0,52068352.0,26034176.0,80514.0,6569489.0,11776276.0,97547188.0,3709854.0,3.481616,15.149681,0.00947493208,457632.0,1627136.0,3495800.0,4939520.0,7031552.0,67618818.0,2304.0,171948110.0,26658996224.0
258,64,7168,256,256,8,ActivationType.Silu,torch.bfloat16,torch.float8_e4m3fnuz,torch.float8_e4m3fnuz,QuantType.per_1x128,1,1,ck,stage2,16,moe_ck2stages_gemm2_256x16x128x256_1x4_MulABScaleExpertWeightA8W8blkscale_v1_Nswizzle0_Quant4_MulRoutedWeight0_F8_F8_B16,119.9115,45.23755555555517,16.66%,47.01,11764.2,408863.125,7168.0,4.237058,68696466.0,0.0,0.0,26034176.0,13017088.0,146138.0,3385654.0,8775160.0,56560870.0,1992400.0,11.74868,74.777,0.571952811,471016.0,813568.0,5981640.0,8949248.0,12460448.0,252309712.0,64512.0,455675294.0,13329498112.0
259,64,7168,256,256,8,ActivationType.Silu,torch.bfloat16,torch.float8_e4m3fnuz,torch.float8_e4m3fnuz,QuantType.per_1x128,1,0,asm,asm_1stage,32,_ZN5aiter49fmoe_bf16_blockscaleFp8_g1u1_novs_silu_1tg_32x256E,340.1375,0.0,0.00%,16.57,4147.33,1228504.4375,7680.0,10.257266,134210334.0,0.0,0.0,156205056.0,78102528.0,198636.0,9953190.0,18383402.0,109004424.0,5059291.0,0.0,8.731857,0.0754429635,1022408.0,4881408.0,12455020.0,0.0,3835392.0,32845391.0,1088.0,134856516.0,79976988672.0
263,64,7168,256,257,9,ActivationType.Silu,torch.bfloat16,torch.float8_e4m3fnuz,torch.float8_e4m3fnuz,QuantType.per_Token,1,0,asm,asm_1stage,32,_ZN5aiter45fmoe_bf16_pertokenFp8_g1u1_vs_silu_1tg_32x256E,331.4299,0.0,0.00%,19.13,4272.9,1245365.6875,8640.0,9.493946,147316747.0,0.0,0.0,157581312.0,78790656.0,153699.0,10101831.0,20788499.0,124326620.0,5315368.0,0.0,8.832241,0.0946309906,909588.0,4924416.0,10847280.0,0.0,3594384.0,43154637.0,1100.0,143356510.0,80681631744.0
264,64,7168,256,256,8,ActivationType.Silu,torch.bfloat16,torch.float8_e4m3fnuz,torch.float8_e4m3fnuz,QuantType.per_1x128,1,0,asm,asm_1stage,32,_ZN5aiter52fmoe_bf16_blockscaleFp8_g1u1_novs_silu_1tg_ps_32x256E,332.674,0.0,0.00%,16.94,4240.37,1228369.8125,7680.0,9.550462,143460255.0,0.0,0.0,156205056.0,78102528.0,201203.0,9951444.0,16651620.0,117645099.0,5393097.0,0.0,8.74839,0.1281843,1022408.0,4881408.0,12521576.0,0.0,3835392.0,33018119.0,1216.0,144221425.0,79976988672.0
265,64,7168,256,257,9,ActivationType.Silu,torch.bfloat16,torch.float8_e4m3fnuz,torch.float8_e4m3fnuz,QuantType.per_1x128,1,0,asm,asm_1stage,32,_ZN5aiter52fmoe_bf16_blockscaleFp8_g1u1_novs_silu_1tg_ps_32x256E,333.6812,0.0,0.00%,19.01,4244.07,1239868.9375,8640.0,9.590698,145300561.0,0.0,0.0,157581312.0,78790656.0,200226.0,10059871.0,15186479.0,119478372.0,5380718.0,0.0,8.898657,0.123987888,1031416.0,4924416.0,12631384.0,0.0,3869184.0,33857031.0,1216.0,146176439.0,80681631744.0
266,64,7168,512,256,8,ActivationType.Gelu,torch.bfloat16,torch.bfloat16,torch.bfloat16,QuantType.No,1,0,ck,stage1,32,moe_ck2stages_gemm1_256x32x64x128_1x4_TypeCast_v1_Nswizzle0_Quant0_MulRoutedWeight0_gelu_B16_B16_B16,811.8968,0.0,0.00%,13.89,6945.44,3219604.375,512.0,9.989822,487492509.0,203685888.0,0.0,0.0,203685888.0,197523.0,25759484.0,39135359.0,421600002.0,13179924.0,0.0451264484,32.644607,0.0131970167,4020864.0,12730368.0,17147296.0,227328.0,32280576.0,420113816.0,8704.0,1315598008.0,104287174656.0
266,64,7168,512,256,8,ActivationType.Gelu,torch.bfloat16,torch.bfloat16,torch.bfloat16,QuantType.No,1,0,ck,stage2,32,moe_ck2stages_gemm2_256x32x64x128_1x4_TypeCastExpertWeight_v1_Nswizzle0_Quant0_MulRoutedWeight1_B16_B16_B16,417.5076,0.0,3.36%,27.0,13506.29,1596096.5,7168.0,10.80675,227093799.0,101842944.0,0.0,0.0,101842944.0,530768.0,12883496.0,23417908.0,180929479.0,6258830.0,0.665164624,53.360825,0.210305076,4599840.0,6365184.0,21644448.0,1591296.0,36301440.0,775136819.0,121856.0,1021255360.0,52143587328.0
267,64,7168,512,256,8,ActivationType.Gelu,torch.bfloat16,torch.bfloat16,torch.bfloat16,QuantType.No,1,1,ck,stage1,32,moe_ck2stages_gemm1_256x32x64x128_1x4_TypeCastExpertWeight_v1_Nswizzle0_Quant0_MulRoutedWeight1_gelu_B16_B16_B16,813.1755,0.0,0.00%,13.86,6934.52,3219764.125,512.0,10.256204,476466307.0,203685888.0,0.0,0.0,203685888.0,199124.0,25761024.0,39022799.0,410539787.0,13063986.0,0.0456222061,32.806585,0.0116337348,4020864.0,12730368.0,17042496.0,227328.0,32280576.0,429373698.0,8704.0,1307758812.0,104287174656.0
267,64,7168,512,256,8,ActivationType.Gelu,torch.bfloat16,torch.bfloat16,torch.bfloat16,QuantType.No,1,1,ck,stage2,32,moe_ck2stages_gemm2_256x32x64x128_1x4_TypeCast_v1_Nswizzle0_Quant0_MulRoutedWeight0_B16_B16_B16,417.4804,0.0,0.00%,27.01,13507.17,1595857.375,7168.0,11.558212,212464062.0,101842944.0,0.0,0.0,101842944.0,507359.0,12881626.0,17924350.0,169580550.0,5947176.0,0.700325419,51.998844,0.282735149,4599840.0,6365184.0,20550432.0,1591296.0,36301440.0,679168537.0,121856.0,945224030.0,52143587328.0
268,64,7168,512,256,8,ActivationType.Gelu,torch.bfloat16,torch.float8_e4m3fnuz,torch.float8_e4m3fnuz,QuantType.per_Tensor,1,0,ck,stage1,16,moe_ck2stages_gemm1_256x16x128x256_1x4_MulABScale_v1_Nswizzle0_Quant1_MulRoutedWeight0_gelu_F8_F8_B16,392.8714,41.24955555555551,0.00%,28.7,7177.79,1600375.3125,512.0,3.964826,246509898.0,0.0,0.0,101842944.0,50921472.0,81511.0,12807521.0,21881444.0,217115408.0,6864459.0,3.561217,26.731634,0.0223342885,902208.0,3182592.0,4821856.0,9320448.0,13412352.0,118155073.0,4608.0,559698184.0,52143587328.0
268,64,7168,512,256,8,ActivationType.Gelu,torch.bfloat16,torch.float8_e4m3fnuz,torch.float8_e4m3fnuz,QuantType.per_Tensor,1,0,ck,stage2,16,moe_ck2stages_gemm2_256x16x128x256_1x4_MulABScaleExpertWeight_v1_Nswizzle0_Quant1_MulRoutedWeight1_F8_F8_B16,221.4628,41.24955555555551,3.33%,50.91,12733.28,798053.125,14336.0,4.407141,135539693.0,0.0,0.0,50921472.0,25460736.0,182386.0,6613935.0,11979153.0,117522520.0,3794931.0,0.708281355,72.275555,0.608377944,808640.0,1591296.0,6863360.0,1030064.0,6452656.0,476854892.0,64512.0,840891224.0,26071793664.0
269,64,7168,512,256,8,ActivationType.Gelu,torch.bfloat16,torch.float8_e4m3fnuz,torch.float8_e4m3fnuz,QuantType.per_Tensor,1,1,ck,stage1,16,moe_ck2stages_gemm1_128x16x64x128_1x2_MulABScale_v1_Nswizzle0_Quant1_MulRoutedWeight1_gelu_F8_F8_B16,397.8685,41.40133333333329,0.00%,28.34,7087.64,1608179.9375,512.0,4.768164,243111126.0,0.0,0.0,101842944.0,50921472.0,138877.0,12868712.0,19918085.0,219676387.0,6987614.0,3.552826,29.451914,0.0303309671,1008768.0,3182592.0,4727712.0,9490944.0,14378496.0,276793790.0,4608.0,629417734.0,52143587328.0
269,64,7168,512,256,8,ActivationType.Gelu,torch.bfloat16,torch.float8_e4m3fnuz,torch.float8_e4m3fnuz,QuantType.per_Tensor,1,1,ck,stage2,16,moe_ck2stages_gemm2_256x16x128x256_1x4_MulABScaleExpertWeight_v1_Nswizzle0_Quant1_MulRoutedWeight0_F8_F8_B16,223.122,41.40133333333329,0.00%,50.53,12638.59,797954.875,14336.0,4.636838,128406103.0,0.0,0.0,50921472.0,25460736.0,167763.0,6613024.0,14535350.0,111163969.0,3791434.0,0.711522219,72.445476,0.648362658,808640.0,1591296.0,6465536.0,1030064.0,6452656.0,485186422.0,64512.0,839029059.0,26071793664.0
270,64,7168,512,256,8,ActivationType.Gelu,torch.bfloat16,torch.float8_e4m3fnuz,torch.float8_e4m3fnuz,QuantType.per_Token,1,0,asm,asm_1stage,32,_ZN5aiter45fmoe_bf16_pertokenFp8_g1u1_vs_gelu_1tg_32x512E,636.9871,0.0,0.00%,17.7,4427.01,2425406.5625,7680.0,9.807925,274006885.0,0.0,0.0,305528832.0,152764416.0,98488.0,19526097.0,32377457.0,232049801.0,10264504.0,0.0,8.722813,0.0604439441,903096.0,9547776.0,15861680.0,0.0,3555552.0,9244237.0,1088.0,272943304.0,156430761984.0
271,64,7168,512,256,8,ActivationType.Gelu,torch.bfloat16,torch.float8_e4m3fnuz,torch.float8_e4m3fnuz,QuantType.per_Token,1,1,asm,asm_1stage,32,_ZN5aiter50fmoe_bf16_pertokenFp8_g1u1_vs_tkw1_gelu_1tg_32x512E,635.4737,0.0,0.00%,17.74,4437.55,2425382.875,7168.0,9.746345,274230510.0,0.0,0.0,305528832.0,152764416.0,98038.0,19517753.0,29036343.0,230913977.0,10213188.0,0.0,8.765062,0.0564884836,860472.0,9547776.0,15151280.0,0.0,3441888.0,9397035.0,1088.0,273057100.0,156430761984.0
272,64,7168,512,256,8,ActivationType.Silu,torch.bfloat16,torch.bfloat16,torch.bfloat16,QuantType.No,1,1,ck,stage1,32,moe_ck2stages_gemm1_256x32x64x128_1x4_TypeCastExpertWeight_v1_Nswizzle0_Quant0_MulRoutedWeight1_silu_B16_B16_B16,813.0873,0.0,0.00%,13.87,6935.27,3219785.75,512.0,10.132636,481080654.0,203685888.0,0.0,0.0,203685888.0,194747.0,25761446.0,40795989.0,414983529.0,13080120.0,0.0455844946,32.756145,0.0109478545,4020864.0,12730368.0,17561088.0,227328.0,32280576.0,421656284.0,8704.0,1306828385.0,104287174656.0
272,64,7168,512,256,8,ActivationType.Silu,torch.bfloat16,torch.bfloat16,torch.bfloat16,QuantType.No,1,1,ck,stage2,32,moe_ck2stages_gemm2_256x32x64x128_1x4_TypeCast_v1_Nswizzle0_Quant0_MulRoutedWeight0_B16_B16_B16,418.1995,0.0,0.00%,26.96,13483.95,1595848.875,7168.0,11.218294,219121962.0,101842944.0,0.0,0.0,101842944.0,507293.0,12881626.0,18730150.0,176196868.0,6100201.0,0.682083405,51.795063,0.277211043,4599840.0,6365184.0,20550432.0,1591296.0,36301440.0,698177847.0,121856.0,966700268.0,52143587328.0
273,64,7168,512,256,8,ActivationType.Silu,torch.bfloat16,torch.float8_e4m3fnuz,torch.float8_e4m3fnuz,QuantType.per_Tensor,1,0,asm,stage1,32,_ZN5aiter44fmoe_stage1_bf16_pertokenFp8_g1u1_32x512_pf3E,405.7212,43.67988888888888,0.00%,27.79,6950.46,1598015.4375,512.0,10.278956,172394718.0,0.0,0.0,203685888.0,101842944.0,297419.0,12789423.0,15618458.0,143103438.0,5896039.0,0.0,8.756288,0.000916357892,245088.0,6365184.0,7327112.0,0.0,1733376.0,3669130.0,1088.0,157589846.0,104287174656.0
273,64,7168,512,256,8,ActivationType.Silu,torch.bfloat16,torch.float8_e4m3fnuz,torch.float8_e4m3fnuz,QuantType.per_Tensor,1,0,ck,stage2,32,moe_ck2stages_gemm2_256x32x64x256_1x4_MulABScaleExpertWeight_v1_Nswizzle0_Quant1_MulRoutedWeight1_F8_F8_B16,217.405,43.67988888888888,2.86%,51.86,12970.95,798237.4375,7168.0,14.691139,78536302.0,0.0,0.0,101842944.0,50921472.0,334546.0,6500666.0,8897045.0,50835528.0,2299844.0,1.793297,60.4314,0.271438433,2610720.0,3182592.0,16174368.0,1591296.0,20388480.0,312463833.0,121856.0,428994174.0,52143587328.0
274,64,7168,512,256,8,ActivationType.Silu,torch.bfloat16,torch.float8_e4m3fnuz,torch.float8_e4m3fnuz,QuantType.per_Tensor,1,1,ck,stage1,16,moe_ck2stages_gemm1_128x16x64x128_1x2_MulABScale_v1_Nswizzle0_Quant1_MulRoutedWeight1_silu_F8_F8_B16,398.1099,43.87977777777762,0.00%,28.32,7083.34,1608176.0625,512.0,4.868149,238026429.0,0.0,0.0,101842944.0,50921472.0,133112.0,12870777.0,21865085.0,215297697.0,6959758.0,3.576088,29.622534,0.0288722456,1008768.0,3182592.0,5065152.0,9490944.0,14378496.0,272997202.0,4608.0,628946139.0,52143587328.0
274,64,7168,512,256,8,ActivationType.Silu,torch.bfloat16,torch.float8_e4m3fnuz,torch.float8_e4m3fnuz,QuantType.per_Tensor,1,1,ck,stage2,16,moe_ck2stages_gemm2_256x16x128x256_1x4_MulABScaleExpertWeight_v1_Nswizzle0_Quant1_MulRoutedWeight0_F8_F8_B16,222.0997,43.87977777777762,0.00%,50.76,12696.77,797956.125,14336.0,4.468989,133452289.0,0.0,0.0,50921472.0,25460736.0,167272.0,6613088.0,13245856.0,116190519.0,3769023.0,0.713633686,71.771054,0.629442613,808640.0,1591296.0,6465536.0,1030064.0,6452656.0,482145527.0,64512.0,828758849.0,26071793664.0
275,64,7168,512,256,8,ActivationType.Silu,torch.bfloat16,torch.float8_e4m3fnuz,torch.float8_e4m3fnuz,QuantType.per_Token,1,0,asm,asm_1stage,32,_ZN5aiter48fmoe_bf16_pertokenFp8_g1u1_vs_silu_1tg_ps_32x512E,637.9854,0.0,0.00%,17.67,4420.08,2425366.625,7168.0,9.695438,277443111.0,0.0,0.0,305528832.0,152764416.0,93160.0,19517730.0,31667338.0,233529332.0,10345484.0,0.0,8.755777,0.0669569852,860472.0,9547776.0,15728904.0,0.0,3441888.0,9301402.0,1216.0,276702334.0,156430761984.0
276,64,7168,512,256,8,ActivationType.Silu,torch.bfloat16,torch.float8_e4m3fnuz,torch.float8_e4m3fnuz,QuantType.per_Token,1,1,asm,asm_1stage,32,_ZN5aiter53fmoe_bf16_pertokenFp8_g1u1_vs_tkw1_silu_1tg_ps_32x256E,637.4736,0.0,0.00%,17.69,4423.63,2420789.375,14336.0,10.33182,295404342.0,0.0,0.0,305528832.0,152764416.0,194086.0,19595656.0,35712783.0,248498891.0,9939606.0,0.0,9.86246,0.0825251777,1678320.0,9547776.0,19571280.0,0.0,6741696.0,66304155.0,1216.0,299155102.0,156430761984.0
277,64,7168,512,256,8,ActivationType.Silu,torch.bfloat16,torch.bfloat16,torch.bfloat16,QuantType.No,1,0,ck,stage1,32,moe_ck2stages_gemm1_256x32x64x128_1x4_TypeCast_v1_Nswizzle0_Quant0_MulRoutedWeight0_silu_B16_B16_B16,813.8379,0.0,0.00%,13.85,6928.87,3219304.8125,512.0,10.29718,475138847.0,203685888.0,0.0,0.0,203685888.0,195736.0,25758145.0,32833237.0,409313954.0,13086952.0,0.0454912075,32.636852,0.012767587,4020864.0,12730368.0,17454528.0,227328.0,32280576.0,416399686.0,8704.0,1304739205.0,104287174656.0
277,64,7168,512,256,8,ActivationType.Silu,torch.bfloat16,torch.bfloat16,torch.bfloat16,QuantType.No,1,0,ck,stage2,32,moe_ck2stages_gemm2_256x32x64x128_1x4_TypeCastExpertWeight_v1_Nswizzle0_Quant0_MulRoutedWeight1_B16_B16_B16,418.506,0.0,2.84%,26.94,13474.07,1596094.5,7168.0,10.921532,223095112.0,101842944.0,0.0,0.0,101842944.0,530832.0,12883523.0,19188279.0,177049752.0,5656247.0,0.733818616,53.316125,0.211018229,4599840.0,6365184.0,21644448.0,1591296.0,36301440.0,695720603.0,121856.0,924934143.0,52143587328.0
279,64,7168,512,256,8,ActivationType.Silu,torch.bfloat16,torch.float8_e4m3fnuz,torch.float8_e4m3fnuz,QuantType.per_Tensor,1,0,ck,stage1,16,moe_ck2stages_gemm1_256x16x128x256_1x4_MulABScale_v1_Nswizzle0_Quant1_MulRoutedWeight0_silu_F8_F8_B16,392.7214,42.731222222222215,0.00%,28.71,7180.53,1600412.625,512.0,4.909597,245540208.0,0.0,0.0,101842944.0,50921472.0,79030.0,12807398.0,19421588.0,216292562.0,6777487.0,3.601743,26.797686,0.0190384699,902208.0,3182592.0,4873344.0,9320448.0,13412352.0,114312996.0,4608.0,554767937.0,52143587328.0
279,64,7168,512,256,8,ActivationType.Silu,torch.bfloat16,torch.float8_e4m3fnuz,torch.float8_e4m3fnuz,QuantType.per_Tensor,1,0,ck,stage2,16,moe_ck2stages_gemm2_256x16x128x256_1x4_MulABScaleExpertWeight_v1_Nswizzle0_Quant1_MulRoutedWeight1_F8_F8_B16,221.5747,42.731222222222215,2.86%,50.88,12726.85,798054.625,14336.0,4.457183,135303249.0,0.0,0.0,50921472.0,25460736.0,182323.0,6613886.0,12264257.0,117354717.0,3740163.0,0.720514006,73.033167,0.629205022,808640.0,1591296.0,6863360.0,1030064.0,6452656.0,475320007.0,64512.0,835279654.0,26071793664.0
280,64,7168,512,256,8,ActivationType.Silu,torch.bfloat16,torch.float8_e4m3fnuz,torch.float8_e4m3fnuz,QuantType.per_Token,1,1,asm,asm_1stage,32,_ZN5aiter50fmoe_bf16_pertokenFp8_g1u1_vs_tkw1_silu_1tg_32x512E,636.2398,0.0,0.00%,17.72,4432.21,2425352.875,7168.0,9.705767,277308797.0,0.0,0.0,305528832.0,152764416.0,92202.0,19517802.0,33487992.0,233936163.0,10298283.0,0.0,8.797956,0.0592230584,860472.0,9547776.0,14980784.0,0.0,3441888.0,9231344.0,1088.0,276656919.0,156430761984.0
281,64,7168,512,256,8,ActivationType.Silu,torch.bfloat16,torch.float8_e4m3fnuz,torch.float8_e4m3fnuz,QuantType.per_Tensor,1,1,asm,stage1,32,_ZN5aiter53fmoe_stage1_bf16_pertokenFp8_doweight_g1u1_32x512_pf2E,405.7236,43.82200000000002,0.00%,27.79,6950.42,1596072.375,512.0,15.257534,115555213.0,0.0,0.0,203685888.0,101842944.0,176193.0,12772957.0,9961618.0,86449393.0,4923678.0,0.0,8.707768,0.000802690416,245088.0,6365184.0,7330664.0,0.0,1733376.0,48697683.0,1088.0,131089976.0,104287174656.0
281,64,7168,512,256,8,ActivationType.Silu,torch.bfloat16,torch.float8_e4m3fnuz,torch.float8_e4m3fnuz,QuantType.per_Tensor,1,1,ck,stage2,32,moe_ck2stages_gemm2_256x32x64x256_1x4_MulABScaleExpertWeight_v1_Nswizzle0_Quant1_MulRoutedWeight0_F8_F8_B16,217.2825,43.82200000000002,0.00%,51.89,12978.26,798013.5,7168.0,11.863252,100346510.0,0.0,0.0,101842944.0,50921472.0,312051.0,6498802.0,9444671.0,75764113.0,2768924.0,1.502926,61.30257,0.284210813,2610720.0,3182592.0,13886880.0,1591296.0,20388480.0,400603299.0,121856.0,519256582.0,52143587328.0
285,64,7168,512,256,8,ActivationType.Gelu,torch.bfloat16,torch.float8_e4m3fnuz,torch.float8_e4m3fnuz,QuantType.per_Token,1,1,asm,asm_1stage,32,_ZN5aiter53fmoe_bf16_pertokenFp8_g1u1_vs_tkw1_gelu_1tg_ps_32x256E,636.9254,0.0,0.00%,17.7,4427.44,2420805.0625,14336.0,9.833128,309363638.0,0.0,0.0,305528832.0,152764416.0,197403.0,19594914.0,30142523.0,262338237.0,10160069.0,0.0,9.981101,0.0865493156,1678320.0,9547776.0,19741776.0,0.0,6741696.0,67816912.0,1216.0,309440334.0,156430761984.0
286,64,7168,512,256,8,ActivationType.Gelu,torch.bfloat16,torch.float8_e4m3fnuz,torch.float8_e4m3fnuz,QuantType.per_1x128,1,0,asm,asm_1stage,32,_ZN5aiter47fmoe_bf16_blockscaleFp8_g1u1_vs_gelu_1tg_32x128E,653.526,0.0,10.05%,17.25,4314.98,2398914.875,28672.0,12.599717,280657579.0,0.0,0.0,305528832.0,152764416.0,454494.0,19652299.0,26782153.0,224523559.0,8700883.0,0.0,11.536469,0.093710338,3726048.0,9547776.0,31286912.0,0.0,14165376.0,228587633.0,4352.0,306611668.0,156430761984.0
287,64,7168,512,256,8,ActivationType.Silu,torch.bfloat16,torch.float8_e4m3fnuz,torch.float8_e4m3fnuz,QuantType.per_1x128,1,0,asm,asm_1stage,32,_ZN5aiter47fmoe_bf16_blockscaleFp8_g1u1_vs_silu_1tg_32x128E,654.4429,0.0,0.00%,17.23,4308.93,2398757.9375,28672.0,11.230549,316178321.0,0.0,0.0,305528832.0,152764416.0,451859.0,19653681.0,34535220.0,260243647.0,9229680.0,0.0,11.607264,0.098055409,3726048.0,9547776.0,31116416.0,0.0,14165376.0,249534454.0,4352.0,327498325.0,156430761984.0
288,64,7168,512,256,8,ActivationType.Gelu,torch.bfloat16,torch.float8_e4m3fnuz,torch.float8_e4m3fnuz,QuantType.per_1x128,1,1,ck,stage1,16,moe_ck2stages_gemm1_256x16x128x256_1x4_MulABScaleExpertWeightA8W8blkscale_v1_Nswizzle0_Quant4_MulRoutedWeight1_gelu_F8_F8_B16,401.932,48.824222222222296,0.01%,28.05,7015.98,1605234.25,512.0,4.941058,243225040.0,0.0,0.0,101842944.0,50921472.0,159026.0,12846108.0,20565369.0,209067100.0,6824902.0,3.704647,27.318678,0.0291383018,895104.0,3182592.0,6578304.0,9661440.0,13753344.0,145383415.0,4608.0,569960461.0,52143587328.0
288,64,7168,512,256,8,ActivationType.Gelu,torch.bfloat16,torch.float8_e4m3fnuz,torch.float8_e4m3fnuz,QuantType.per_1x128,1,1,ck,stage2,16,moe_ck2stages_gemm2_256x16x128x256_1x4_MulABScaleExpertWeightA8W8blkscale_v1_Nswizzle0_Quant4_MulRoutedWeight0_F8_F8_B16,221.1246,48.824222222222296,16.71%,50.99,12752.76,799743.625,7168.0,4.530871,133126085.0,0.0,0.0,50921472.0,25460736.0,186278.0,6512746.0,11020730.0,112158003.0,3680440.0,6.230541,51.199176,0.362818318,709184.0,1591296.0,7302064.0,8752128.0,14174720.0,318920248.0,64512.0,575361627.0,26071793664.0
289,64,7168,512,256,8,ActivationType.Silu,torch.bfloat16,torch.float8_e4m3fnuz,torch.float8_e4m3fnuz,QuantType.per_1x128,1,1,ck,stage1,16,moe_ck2stages_gemm1_256x16x128x256_1x4_MulABScaleExpertWeightA8W8blkscale_v1_Nswizzle0_Quant4_MulRoutedWeight1_silu_F8_F8_B16,402.1164,48.91777777777772,0.01%,28.04,7012.77,1605115.9375,512.0,5.587749,210439346.0,0.0,0.0,101842944.0,50921472.0,156629.0,12845070.0,14527202.0,176010535.0,6599523.0,3.828853,27.276484,0.0149616103,895104.0,3182592.0,6837600.0,9661440.0,13753344.0,139102690.0,4608.0,550619402.0,52143587328.0
289,64,7168,512,256,8,ActivationType.Silu,torch.bfloat16,torch.float8_e4m3fnuz,torch.float8_e4m3fnuz,QuantType.per_1x128,1,1,ck,stage2,16,moe_ck2stages_gemm2_256x16x128x256_1x4_MulABScaleExpertWeightA8W8blkscale_v1_Nswizzle0_Quant4_MulRoutedWeight0_F8_F8_B16,220.9156,48.91777777777772,16.72%,51.03,12764.82,799748.75,7168.0,4.356986,135069045.0,0.0,0.0,50921472.0,25460736.0,185377.0,6512718.0,13821759.0,114076772.0,3514821.0,6.497704,50.828951,0.314314015,709184.0,1591296.0,7302064.0,8752128.0,14174720.0,303383311.0,64512.0,547715337.0,26071793664.0
294,64,7168,2048,33,10,ActivationType.Silu,torch.bfloat16,torch.float8_e4m3fnuz,torch.float8_e4m3fnuz,QuantType.per_1x128,1,0,asm,asm_1stage,32,_ZN5aiter49fmoe_bf16_blockscaleFp8_g1u1_novs_silu_1tg_32x256E,411.5193,0.0,0.00%,136.98,3534.96,1435959.625,76800.0,10.738303,171507939.0,0.0,0.0,181665792.0,90832896.0,443463.0,12716430.0,15691894.0,142418951.0,5473617.0,0.0,10.200604,0.241890662,1189056.0,5677056.0,14489440.0,0.0,4460544.0,33769033.0,1696.0,171176033.0,93012885504.0
295,64,7168,2048,33,10,ActivationType.Silu,torch.bfloat16,torch.float8_e4m3fnuz,torch.float8_e4m3fnuz,QuantType.per_Token,1,0,asm,asm_1stage,32,_ZN5aiter48fmoe_bf16_pertokenFp8_g1u1_vs_silu_1tg_ps_32x512E,386.1241,0.0,0.00%,145.99,3767.45,1436571.5,35840.0,9.94993,94640722.0,0.0,0.0,181665792.0,90832896.0,238805.0,12063294.0,11697422.0,67793433.0,6279291.0,0.0,5.124999,0.0658743893,511632.0,5677056.0,9375984.0,0.0,2046528.0,4788676.0,1216.0,98063235.0,93012885504.0
296,128,2048,192,128,8,ActivationType.Silu,torch.bfloat16,torch.bfloat16,torch.bfloat16,QuantType.No,1,0,ck,stage1,32,moe_ck2stages_gemm1_256x32x64x64_1x4_TypeCast_v1_Nswizzle0_Quant0_MulRoutedWeight0_silu_B16_B16_B16,60.0561,0.0,0.00%,40.23,5045.92,201443.0,384.0,6.298835,39458821.0,12582912.0,0.0,0.0,12582912.0,77416.0,1614445.0,6963152.0,33838009.0,1251066.0,0.101165811,12.35893,0.000860337503,254976.0,786432.0,1403904.0,49152.0,2064384.0,43858177.0,1920.0,48037267.0,6442450944.0
296,128,2048,192,128,8,ActivationType.Silu,torch.bfloat16,torch.bfloat16,torch.bfloat16,QuantType.No,1,0,ck,stage2,32,moe_ck2stages_gemm2_256x32x64x64_1x4_TypeCastExpertWeight_v1_Nswizzle0_Quant0_MulRoutedWeight1_B16_B16_B16,37.9278,0.0,0.00%,63.7,7989.88,102207.3125,4096.0,7.336464,14487563.0,6291456.0,0.0,0.0,6291456.0,128777.0,883094.0,1156483.0,10130809.0,504585.0,1.301648,56.186145,0.183071564,349728.0,393216.0,2307936.0,262144.0,2709632.0,63465026.0,20480.0,90524384.0,3221225472.0
297,128,2048,192,128,8,ActivationType.Silu,torch.bfloat16,torch.bfloat16,torch.bfloat16,QuantType.No,1,1,ck,stage1,32,moe_ck2stages_gemm1_256x32x64x64_1x4_TypeCastExpertWeight_v1_Nswizzle0_Quant0_MulRoutedWeight1_silu_B16_B16_B16,60.615,0.0,0.00%,39.86,4999.4,201447.125,384.0,6.795328,36879296.0,12582912.0,0.0,0.0,12582912.0,79594.0,1614577.0,5528774.0,30997018.0,1230236.0,0.103516983,12.679856,0.000780294639,254976.0,786432.0,1426944.0,49152.0,2064384.0,43965237.0,1920.0,48165260.0,6442450944.0
297,128,2048,192,128,8,ActivationType.Silu,torch.bfloat16,torch.bfloat16,torch.bfloat16,QuantType.No,1,1,ck,stage2,32,moe_ck2stages_gemm2_256x32x64x64_1x4_TypeCast_v1_Nswizzle0_Quant0_MulRoutedWeight0_B16_B16_B16,37.1702,0.0,0.00%,65.0,8152.73,102052.9375,4096.0,7.969647,13421101.0,6291456.0,0.0,0.0,6291456.0,125422.0,881890.0,1462431.0,9625843.0,498036.0,1.320201,52.705427,0.271177488,349728.0,393216.0,2127712.0,262144.0,2709632.0,59242193.0,20480.0,83723069.0,3221225472.0
298,128,2048,192,128,8,ActivationType.Gelu,torch.bfloat16,torch.bfloat16,torch.bfloat16,QuantType.No,1,0,ck,stage1,32,moe_ck2stages_gemm1_256x32x64x64_1x4_TypeCast_v1_Nswizzle0_Quant0_MulRoutedWeight0_gelu_B16_B16_B16,59.9191,0.0,0.00%,40.32,5057.46,201316.625,384.0,6.823333,36552911.0,12582912.0,0.0,0.0,12582912.0,79326.0,1614959.0,5587483.0,30964306.0,1222679.0,0.104596491,12.741062,0.000889512806,254976.0,786432.0,1281486.0,49152.0,2064384.0,43952673.0,1920.0,47898255.0,6442450944.0
298,128,2048,192,128,8,ActivationType.Gelu,torch.bfloat16,torch.bfloat16,torch.bfloat16,QuantType.No,1,0,ck,stage2,32,moe_ck2stages_gemm2_256x32x64x64_1x4_TypeCastExpertWeight_v1_Nswizzle0_Quant0_MulRoutedWeight1_B16_B16_B16,37.8509,0.0,0.00%,63.83,8006.11,102221.4375,4096.0,7.497312,14676374.0,6291456.0,0.0,0.0,6291456.0,128546.0,883333.0,1438486.0,10205474.0,530239.0,1.24713,57.584599,0.204283813,349728.0,393216.0,2307936.0,262144.0,2709632.0,69539218.0,20480.0,96833230.0,3221225472.0
299,128,2048,192,128,8,ActivationType.Gelu,torch.bfloat16,torch.bfloat16,torch.bfloat16,QuantType.No,1,1,ck,stage1,32,moe_ck2stages_gemm1_256x32x64x64_1x4_TypeCastExpertWeight_v1_Nswizzle0_Quant0_MulRoutedWeight1_gelu_B16_B16_B16,59.4388,0.0,0.00%,40.65,5098.33,201562.625,384.0,6.84518,37120318.0,12582912.0,0.0,0.0,12582912.0,83345.0,1614172.0,6778626.0,31261595.0,1220117.0,0.104383779,12.799799,0.000726303149,254976.0,786432.0,1314816.0,49152.0,2064384.0,44240473.0,1920.0,48217126.0,6442450944.0
299,128,2048,192,128,8,ActivationType.Gelu,torch.bfloat16,torch.bfloat16,torch.bfloat16,QuantType.No,1,1,ck,stage2,32,moe_ck2stages_gemm2_256x32x64x64_1x4_TypeCast_v1_Nswizzle0_Quant0_MulRoutedWeight0_B16_B16_B16,37.3438,0.0,0.00%,64.69,8114.83,102043.25,4096.0,8.196918,13169142.0,6291456.0,0.0,0.0,6291456.0,125181.0,882120.0,1140523.0,9261755.0,493555.0,1.340561,54.037019,0.280314808,349728.0,393216.0,2127712.0,262144.0,2709632.0,60493011.0,20480.0,84534648.0,3221225472.0
300,128,4096,192,128,8,ActivationType.Silu,torch.bfloat16,torch.bfloat16,torch.bfloat16,QuantType.No,1,0,ck,stage1,32,moe_ck2stages_gemm1_256x32x64x64_1x4_TypeCast_v1_Nswizzle0_Quant0_MulRoutedWeight0_silu_B16_B16_B16,107.145,0.0,0.00%,45.1,5656.6,405089.1875,384.0,6.985307,75611846.0,25165824.0,0.0,0.0,25165824.0,121442.0,3240255.0,12143739.0,66048583.0,2331622.0,0.0549510798,13.547415,0.00172057519,500736.0,1572864.0,2313216.0,49152.0,4030464.0,89662014.0,1920.0,96941866.0,12884901888.0
300,128,4096,192,128,8,ActivationType.Silu,torch.bfloat16,torch.bfloat16,torch.bfloat16,QuantType.No,1,0,ck,stage2,32,moe_ck2stages_gemm2_256x32x64x64_1x4_TypeCastExpertWeight_v1_Nswizzle0_Quant0_MulRoutedWeight1_B16_B16_B16,62.6302,0.0,0.08%,77.15,9677.07,200715.75,8192.0,9.239098,27114827.0,12582912.0,0.0,0.0,12582912.0,267885.0,1736762.0,5086197.0,19116004.0,848703.0,1.581578,71.399351,0.281678436,700352.0,786432.0,4632128.0,524288.0,5422848.0,138988984.0,40960.0,189349250.0,6442450944.0
301,128,4096,192,128,8,ActivationType.Silu,torch.bfloat16,torch.bfloat16,torch.bfloat16,QuantType.No,1,1,ck,stage1,32,moe_ck2stages_gemm1_256x32x64x64_1x4_TypeCastExpertWeight_v1_Nswizzle0_Quant0_MulRoutedWeight1_silu_B16_B16_B16,108.115,0.0,0.00%,44.69,5605.85,404773.0,384.0,7.394447,72515868.0,25165824.0,0.0,0.0,25165824.0,122534.0,3241510.0,10956480.0,62757810.0,2223504.0,0.0579268304,13.605762,0.00170178921,500736.0,1572864.0,2336256.0,49152.0,4030464.0,85053048.0,1920.0,92357947.0,12884901888.0
301,128,4096,192,128,8,ActivationType.Silu,torch.bfloat16,torch.bfloat16,torch.bfloat16,QuantType.No,1,1,ck,stage2,32,moe_ck2stages_gemm2_256x32x64x64_1x4_TypeCast_v1_Nswizzle0_Quant0_MulRoutedWeight0_B16_B16_B16,62.034,0.0,0.00%,77.89,9770.08,200570.1875,8192.0,9.598885,26462954.0,12582912.0,0.0,0.0,12582912.0,259260.0,1735719.0,5304165.0,19452998.0,911900.0,1.494585,71.406835,0.503474028,700352.0,786432.0,4271680.0,524288.0,5422848.0,151182286.0,40960.0,200391389.0,6442450944.0
302,128,4096,192,128,8,ActivationType.Gelu,torch.bfloat16,torch.bfloat16,torch.bfloat16,QuantType.No,1,0,ck,stage1,32,moe_ck2stages_gemm1_256x32x64x64_1x4_TypeCast_v1_Nswizzle0_Quant0_MulRoutedWeight0_gelu_B16_B16_B16,106.993,0.0,0.00%,45.16,5664.64,404764.875,384.0,7.376262,71348739.0,25165824.0,0.0,0.0,25165824.0,122395.0,3241700.0,9721453.0,61795574.0,2239475.0,0.0571534352,13.434567,0.00173430071,500736.0,1572864.0,2261017.0,49152.0,4030464.0,85285391.0,1920.0,92429907.0,12884901888.0
302,128,4096,192,128,8,ActivationType.Gelu,torch.bfloat16,torch.bfloat16,torch.bfloat16,QuantType.No,1,0,ck,stage2,32,moe_ck2stages_gemm2_256x32x64x64_1x4_TypeCastExpertWeight_v1_Nswizzle0_Quant0_MulRoutedWeight1_B16_B16_B16,62.8182,0.0,0.12%,76.92,9648.11,200709.875,8192.0,9.33419,27051675.0,12582912.0,0.0,0.0,12582912.0,268182.0,1736779.0,6056294.0,19047292.0,839703.0,1.625156,71.267287,0.291972136,700352.0,786432.0,4632128.0,524288.0,5422848.0,133899684.0,40960.0,183931085.0,6442450944.0
303,128,4096,192,128,8,ActivationType.Gelu,torch.bfloat16,torch.bfloat16,torch.bfloat16,QuantType.No,1,1,ck,stage1,32,moe_ck2stages_gemm1_256x32x64x64_1x4_TypeCastExpertWeight_v1_Nswizzle0_Quant0_MulRoutedWeight1_gelu_B16_B16_B16,107.037,0.0,0.00%,45.14,5662.31,404819.0,384.0,7.328774,71275755.0,25165824.0,0.0,0.0,25165824.0,124890.0,3242442.0,9391085.0,61632659.0,2254660.0,0.0567930769,13.500016,0.00161359725,500736.0,1572864.0,2224128.0,49152.0,4030464.0,86388306.0,1920.0,93469531.0,12884901888.0
303,128,4096,192,128,8,ActivationType.Gelu,torch.bfloat16,torch.bfloat16,torch.bfloat16,QuantType.No,1,1,ck,stage2,32,moe_ck2stages_gemm2_256x32x64x64_1x4_TypeCast_v1_Nswizzle0_Quant0_MulRoutedWeight0_B16_B16_B16,62.2323,0.0,0.00%,77.64,9738.94,200568.9375,8192.0,9.38124,27776308.0,12582912.0,0.0,0.0,12582912.0,259289.0,1735659.0,5144949.0,20848389.0,869926.0,1.542563,69.745186,0.436901291,700352.0,786432.0,4271680.0,524288.0,5422848.0,143413739.0,40960.0,189640575.0,6442450944.0
304,128,4096,384,128,8,ActivationType.Gelu,torch.bfloat16,torch.bfloat16,torch.bfloat16,QuantType.No,1,0,ck,stage1,32,moe_ck2stages_gemm1_256x32x64x64_1x4_TypeCast_v1_Nswizzle0_Quant0_MulRoutedWeight0_gelu_B16_B16_B16,201.5735,0.0,0.00%,47.94,6003.05,802153.5,768.0,8.888174,122860270.0,50331648.0,0.0,0.0,50331648.0,287904.0,6423606.0,14185523.0,105582645.0,3606790.0,0.0713513107,27.76874,0.00135148255,1001472.0,3145728.0,4521505.0,98304.0,8060928.0,228681332.0,3840.0,306066219.0,25769803776.0
304,128,4096,384,128,8,ActivationType.Gelu,torch.bfloat16,torch.bfloat16,torch.bfloat16,QuantType.No,1,0,ck,stage2,32,moe_ck2stages_gemm2_256x32x64x128_1x4_TypeCastExpertWeight_v1_Nswizzle0_Quant0_MulRoutedWeight1_B16_B16_B16,114.7792,0.0,0.53%,84.19,10542.47,401408.625,8192.0,7.913423,72619289.0,25165824.0,0.0,0.0,25165824.0,502543.0,3342396.0,10426943.0,58919458.0,1886609.0,0.727569853,50.226763,0.416925941,1191168.0,1572864.0,6879104.0,524288.0,9352192.0,208963426.0,40960.0,289547885.0,12884901888.0
305,128,4096,384,128,8,ActivationType.Gelu,torch.bfloat16,torch.bfloat16,torch.bfloat16,QuantType.No,1,1,ck,stage1,32,moe_ck2stages_gemm1_256x32x64x64_1x4_TypeCastExpertWeight_v1_Nswizzle0_Quant0_MulRoutedWeight1_gelu_B16_B16_B16,201.9726,0.0,0.00%,47.85,5991.19,802131.6875,768.0,9.099658,119651634.0,50331648.0,0.0,0.0,50331648.0,290804.0,6424119.0,14875653.0,102110282.0,3551666.0,0.0725832232,27.737996,0.001213486,1001472.0,3145728.0,4448256.0,98304.0,8060928.0,225221237.0,3840.0,300538431.0,25769803776.0
305,128,4096,384,128,8,ActivationType.Gelu,torch.bfloat16,torch.bfloat16,torch.bfloat16,QuantType.No,1,1,ck,stage2,32,moe_ck2stages_gemm2_256x32x64x128_1x4_TypeCast_v1_Nswizzle0_Quant0_MulRoutedWeight0_B16_B16_B16,115.3956,0.0,0.00%,83.74,10486.16,401244.0,8192.0,7.704895,73651224.0,25165824.0,0.0,0.0,25165824.0,495634.0,3341087.0,12651879.0,60974138.0,2087924.0,0.654695484,49.10906,0.563798994,1191168.0,1572864.0,6518656.0,524288.0,9352192.0,220611515.0,40960.0,314616999.0,12884901888.0
306,128,4096,384,128,8,ActivationType.Silu,torch.bfloat16,torch.bfloat16,torch.bfloat16,QuantType.No,1,0,ck,stage1,32,moe_ck2stages_gemm1_256x32x64x64_1x4_TypeCast_v1_Nswizzle0_Quant0_MulRoutedWeight0_silu_B16_B16_B16,201.7189,0.0,0.00%,47.91,5998.73,802051.1875,768.0,8.882108,122180256.0,50331648.0,0.0,0.0,50331648.0,286301.0,6422686.0,11331496.0,104714045.0,3637795.0,0.0705565481,27.73017,0.00136370281,1001472.0,3145728.0,4626432.0,98304.0,8060928.0,230308227.0,3840.0,309083905.0,25769803776.0
306,128,4096,384,128,8,ActivationType.Silu,torch.bfloat16,torch.bfloat16,torch.bfloat16,QuantType.No,1,0,ck,stage2,32,moe_ck2stages_gemm2_256x32x64x128_1x4_TypeCastExpertWeight_v1_Nswizzle0_Quant0_MulRoutedWeight1_B16_B16_B16,114.6398,0.0,0.37%,84.3,10555.29,401408.75,8192.0,7.614688,75185478.0,25165824.0,0.0,0.0,25165824.0,502597.0,3342377.0,9052360.0,61467441.0,2115298.0,0.644115293,49.944409,0.412473576,1191168.0,1572864.0,6879104.0,524288.0,9352192.0,235532917.0,40960.0,325224439.0,12884901888.0
307,128,4096,384,128,8,ActivationType.Silu,torch.bfloat16,torch.bfloat16,torch.bfloat16,QuantType.No,1,1,ck,stage1,32,moe_ck2stages_gemm1_256x32x64x64_1x4_TypeCastExpertWeight_v1_Nswizzle0_Quant0_MulRoutedWeight1_silu_B16_B16_B16,201.9487,0.0,0.00%,47.85,5991.9,802080.5625,768.0,9.112399,119829000.0,50331648.0,0.0,0.0,50331648.0,287399.0,6424326.0,15122145.0,102224013.0,3598414.0,0.0716496361,28.006799,0.00117018118,1001472.0,3145728.0,4672512.0,98304.0,8060928.0,229026577.0,3840.0,307404818.0,25769803776.0
307,128,4096,384,128,8,ActivationType.Silu,torch.bfloat16,torch.bfloat16,torch.bfloat16,QuantType.No,1,1,ck,stage2,32,moe_ck2stages_gemm2_256x32x64x128_1x4_TypeCast_v1_Nswizzle0_Quant0_MulRoutedWeight0_B16_B16_B16,115.0819,0.0,0.00%,83.97,10514.74,401245.5625,8192.0,8.452626,66980735.0,25165824.0,0.0,0.0,25165824.0,495179.0,3341110.0,6905158.0,54206610.0,2139044.0,0.642371127,49.679665,0.552731778,1191168.0,1572864.0,6518656.0,524288.0,9352192.0,227851813.0,40960.0,324378868.0,12884901888.0
308,128,4096,384,128,8,ActivationType.Silu,torch.bfloat16,torch.float8_e4m3fnuz,torch.float8_e4m3fnuz,QuantType.per_Tensor,1,0,ck,stage1,32,moe_ck2stages_gemm1_256x32x64x128_1x4_MulABScale_v1_Nswizzle0_Quant1_MulRoutedWeight0_silu_F8_F8_B16,108.0055,44.5791111111111,0.00%,89.47,5606.68,400379.125,768.0,8.63107,60819205.0,0.0,0.0,50331648.0,25165824.0,163633.0,3208914.0,9498031.0,51129576.0,1924498.0,9.422661,26.653875,0.0020078171,795648.0,1572864.0,2912256.0,6955008.0,10985472.0,112809358.0,3840.0,157389009.0,25769803776.0
308,128,4096,384,128,8,ActivationType.Silu,torch.bfloat16,torch.float8_e4m3fnuz,torch.float8_e4m3fnuz,QuantType.per_Tensor,1,0,ck,stage2,32,moe_ck2stages_gemm2_256x32x64x128_1x4_MulABScaleExpertWeight_v1_Nswizzle0_Quant1_MulRoutedWeight1_F8_F8_B16,63.4421,44.5791111111111,0.37%,152.32,9544.97,200721.375,8192.0,10.894015,21527989.0,0.0,0.0,25165824.0,12582912.0,274241.0,1736847.0,4224415.0,13111714.0,773021.0,17.171106,65.525091,0.216489277,896256.0,786432.0,5240704.0,5242880.0,10138624.0,104821479.0,40960.0,160055006.0,12884901888.0
309,128,4096,384,128,8,ActivationType.Silu,torch.bfloat16,torch.float8_e4m3fnuz,torch.float8_e4m3fnuz,QuantType.per_Tensor,1,1,ck,stage1,32,moe_ck2stages_gemm1_256x32x64x256_1x4_MulABScale_v1_Nswizzle0_Quant1_MulRoutedWeight1_silu_F8_F8_B16,108.4773,44.592222222222205,0.00%,89.08,5582.3,403937.125,768.0,8.455216,60710717.0,0.0,0.0,50331648.0,25165824.0,141225.0,3238805.0,7022780.0,50977247.0,1890928.0,3.179684,25.155136,0.0302704914,602112.0,1572864.0,3062784.0,2310144.0,6340608.0,50780983.0,3840.0,146208220.0,25769803776.0
309,128,4096,384,128,8,ActivationType.Silu,torch.bfloat16,torch.float8_e4m3fnuz,torch.float8_e4m3fnuz,QuantType.per_Tensor,1,1,ck,stage2,32,moe_ck2stages_gemm2_256x32x64x128_1x4_MulABScaleExpertWeight_v1_Nswizzle0_Quant1_MulRoutedWeight0_F8_F8_B16,63.9065,44.592222222222205,0.00%,151.22,9475.6,200588.75,8192.0,10.488758,22641732.0,0.0,0.0,25165824.0,12582912.0,264472.0,1735859.0,4548094.0,15164570.0,775030.0,17.597563,69.0132,0.287583925,896256.0,786432.0,4487040.0,5242880.0,10138624.0,114890093.0,40960.0,164490014.0,12884901888.0
310,128,4096,384,128,8,ActivationType.Silu,torch.bfloat16,torch.float8_e4m3fnuz,torch.float8_e4m3fnuz,QuantType.per_Token,1,0,asm,asm_1stage,32,_ZN5aiter45fmoe_bf16_pertokenFp8_g1u1_vs_silu_1tg_32x384E,170.8444,0.0,0.00%,56.56,3544.47,603433.375,9216.0,8.593701,41740778.0,0.0,0.0,75497472.0,37748736.0,91333.0,4975589.0,5203501.0,30507838.0,2874199.0,0.0,4.742477,0.151137808,317952.0,2359296.0,4507904.0,0.0,1243136.0,2761043.0,640.0,41738166.0,38654705664.0
311,128,4096,384,128,8,ActivationType.Silu,torch.bfloat16,torch.float8_e4m3fnuz,torch.float8_e4m3fnuz,QuantType.per_Token,1,1,asm,asm_1stage,32,_ZN5aiter50fmoe_bf16_pertokenFp8_g1u1_vs_tkw1_silu_1tg_32x192E,173.7307,0.0,0.00%,55.62,3485.58,600118.875,16384.0,9.16726,78967694.0,0.0,0.0,75497472.0,37748736.0,180420.0,5061830.0,10444122.0,65811581.0,2649348.0,0.0,9.745154,0.131878497,568320.0,2359296.0,5801472.0,0.0,2293760.0,49400993.0,1280.0,78989256.0,38654705664.0
312,128,4096,384,128,8,ActivationType.Gelu,torch.bfloat16,torch.float8_e4m3fnuz,torch.float8_e4m3fnuz,QuantType.per_Tensor,1,0,ck,stage1,32,moe_ck2stages_gemm1_256x32x64x128_1x4_MulABScale_v1_Nswizzle0_Quant1_MulRoutedWeight0_gelu_F8_F8_B16,107.6179,45.32677777777781,0.00%,89.8,5626.88,400288.0625,768.0,8.33313,62721182.0,0.0,0.0,50331648.0,25165824.0,165662.0,3208440.0,10267092.0,52946781.0,1931798.0,9.431207,27.043731,0.00189369736,795648.0,1572864.0,2767094.0,6955008.0,10985472.0,114844281.0,3840.0,159546379.0,25769803776.0
312,128,4096,384,128,8,ActivationType.Gelu,torch.bfloat16,torch.float8_e4m3fnuz,torch.float8_e4m3fnuz,QuantType.per_Tensor,1,0,ck,stage2,32,moe_ck2stages_gemm2_256x32x64x128_1x4_MulABScaleExpertWeight_v1_Nswizzle0_Quant1_MulRoutedWeight1_F8_F8_B16,63.0391,45.32677777777781,0.51%,153.3,9605.98,200717.4375,8192.0,10.931071,21910243.0,0.0,0.0,25165824.0,12582912.0,273899.0,1736914.0,3985758.0,13497110.0,754903.0,17.563334,64.328541,0.220702429,896256.0,786432.0,5240704.0,5242880.0,10138624.0,101571763.0,40960.0,153623143.0,12884901888.0
313,128,4096,384,128,8,ActivationType.Gelu,torch.bfloat16,torch.float8_e4m3fnuz,torch.float8_e4m3fnuz,QuantType.per_Tensor,1,1,ck,stage1,32,moe_ck2stages_gemm1_256x32x64x128_1x4_MulABScale_v1_Nswizzle0_Quant1_MulRoutedWeight1_gelu_F8_F8_B16,107.7129,45.87833333333338,0.00%,89.72,5621.91,400391.75,768.0,8.939891,59181077.0,0.0,0.0,50331648.0,25165824.0,167296.0,3209448.0,9974810.0,49450209.0,1966878.0,9.232498,26.38818,0.0019042421,795648.0,1572864.0,2688000.0,6955008.0,10985472.0,114420215.0,3840.0,159029546.0,25769803776.0
313,128,4096,384,128,8,ActivationType.Gelu,torch.bfloat16,torch.float8_e4m3fnuz,torch.float8_e4m3fnuz,QuantType.per_Tensor,1,1,ck,stage2,32,moe_ck2stages_gemm2_256x32x64x128_1x4_MulABScaleExpertWeight_v1_Nswizzle0_Quant1_MulRoutedWeight0_F8_F8_B16,64.0378,45.87833333333338,0.00%,150.91,9456.17,200587.0,8192.0,10.270249,22860877.0,0.0,0.0,25165824.0,12582912.0,264324.0,1735880.0,3931939.0,15420839.0,832952.0,16.215802,70.758331,0.346833717,896256.0,786432.0,4487040.0,5242880.0,10138624.0,130589693.0,40960.0,183020217.0,12884901888.0
314,128,4096,384,128,8,ActivationType.Gelu,torch.bfloat16,torch.float8_e4m3fnuz,torch.float8_e4m3fnuz,QuantType.per_Token,1,0,asm,asm_1stage,32,_ZN5aiter45fmoe_bf16_pertokenFp8_g1u1_vs_gelu_1tg_32x384E,171.5227,0.0,0.00%,56.34,3530.45,603694.75,9216.0,8.339858,42303000.0,0.0,0.0,75497472.0,37748736.0,93437.0,4977067.0,5014493.0,31067353.0,2933402.0,0.0,4.688561,0.0939435555,317952.0,2359296.0,4581632.0,0.0,1243136.0,2740378.0,640.0,41992626.0,38654705664.0
315,128,4096,384,128,8,ActivationType.Gelu,torch.bfloat16,torch.float8_e4m3fnuz,torch.float8_e4m3fnuz,QuantType.per_Token,1,1,asm,asm_1stage,32,_ZN5aiter50fmoe_bf16_pertokenFp8_g1u1_vs_tkw1_gelu_1tg_32x192E,173.1295,0.0,0.00%,55.82,3497.69,599743.75,16384.0,8.974302,81674519.0,0.0,0.0,75497472.0,37748736.0,182633.0,5060745.0,7384332.0,68531413.0,2809176.0,0.0,9.637859,0.170796575,568320.0,2359296.0,5875200.0,0.0,2293760.0,51269107.0,1280.0,82975726.0,38654705664.0
324,128,4096,384,128,8,ActivationType.Silu,torch.bfloat16,torch.float8_e4m3fnuz,torch.float8_e4m3fnuz,QuantType.per_1x128,1,0,asm,asm_1stage,32,_ZN5aiter47fmoe_bf16_blockscaleFp8_g1u1_vs_silu_1tg_32x128E,214.0823,0.0,0.00%,45.14,2828.6,600597.75,24576.0,8.034539,86423991.0,0.0,0.0,75497472.0,37748736.0,254281.0,5178559.0,8659802.0,71208588.0,3121592.0,0.0,9.3783,0.141514965,947712.0,2359296.0,7926528.0,0.0,3618816.0,68235159.0,1920.0,89469726.0,38654705664.0
325,128,4096,384,128,8,ActivationType.Gelu,torch.bfloat16,torch.float8_e4m3fnuz,torch.float8_e4m3fnuz,QuantType.per_1x128,1,0,asm,asm_1stage,32,_ZN5aiter47fmoe_bf16_blockscaleFp8_g1u1_vs_gelu_1tg_32x128E,213.6373,0.0,0.13%,45.23,2834.49,598110.8125,24576.0,7.691922,91425607.0,0.0,0.0,75497472.0,37748736.0,235921.0,5198190.0,7077564.0,76196932.0,3097954.0,0.0,9.359215,0.138912755,947712.0,2359296.0,8000256.0,0.0,3618816.0,67582121.0,1920.0,88748207.0,38654705664.0
326,128,4096,384,128,8,ActivationType.Silu,torch.bfloat16,torch.float8_e4m3fnuz,torch.float8_e4m3fnuz,QuantType.per_1x128,1,1,ck,stage1,16,moe_ck2stages_gemm1_128x16x128x128_1x2_MulABScaleExpertWeightA8W8blkscale_v1_Nswizzle0_Quant4_MulRoutedWeight1_silu_F8_F8_B16,116.1624,55.9110000000002,0.01%,83.19,5212.98,400020.25,768.0,4.072939,37740787.0,0.0,0.0,25165824.0,12582912.0,218504.0,3206782.0,6383705.0,53475092.0,2060491.0,1.699949,6.635042,0.00489528432,127488.0,786432.0,1872384.0,1339392.0,1978368.0,31648134.0,1152.0,41822059.0,12884901888.0
326,128,4096,384,128,8,ActivationType.Silu,torch.bfloat16,torch.float8_e4m3fnuz,torch.float8_e4m3fnuz,QuantType.per_1x128,1,1,ck,stage2,16,moe_ck2stages_gemm2_128x16x128x128_1x2_MulABScaleExpertWeightA8W8blkscale_v1_Nswizzle0_Quant4_MulRoutedWeight0_F8_F8_B16,66.0042,55.9110000000002,16.65%,146.41,9174.46,201237.5,8192.0,4.465412,27433036.0,0.0,0.0,12582912.0,6291456.0,248444.0,1741217.0,3533308.0,21355084.0,947190.0,7.160902,34.375946,0.559863395,177792.0,393216.0,2383808.0,2621440.0,3725824.0,52683766.0,12288.0,100673890.0,6442450944.0
327,128,4096,384,128,8,ActivationType.Gelu,torch.bfloat16,torch.float8_e4m3fnuz,torch.float8_e4m3fnuz,QuantType.per_1x128,1,1,ck,stage1,16,moe_ck2stages_gemm1_128x16x128x128_1x2_MulABScaleExpertWeightA8W8blkscale_v1_Nswizzle0_Quant4_MulRoutedWeight1_gelu_F8_F8_B16,115.9162,55.25600000000002,0.01%,83.37,5224.06,400149.75,768.0,3.94155,39198408.0,0.0,0.0,25165824.0,12582912.0,224747.0,3207120.0,6806897.0,55635325.0,2033105.0,1.711938,6.619836,0.00490552255,127488.0,786432.0,1752576.0,1339392.0,1978368.0,31496727.0,1152.0,41434002.0,12884901888.0
327,128,4096,384,128,8,ActivationType.Gelu,torch.bfloat16,torch.float8_e4m3fnuz,torch.float8_e4m3fnuz,QuantType.per_1x128,1,1,ck,stage2,16,moe_ck2stages_gemm2_128x16x128x128_1x2_MulABScaleExpertWeightA8W8blkscale_v1_Nswizzle0_Quant4_MulRoutedWeight0_F8_F8_B16,65.9035,55.25600000000002,16.64%,146.63,9188.47,201276.25,8192.0,4.208574,29395557.0,0.0,0.0,12582912.0,6291456.0,249003.0,1741118.0,4494091.0,23334296.0,1000652.0,6.784973,33.938904,0.654201287,177792.0,393216.0,2383808.0,2621440.0,3725824.0,56239227.0,12288.0,104900993.0,6442450944.0
331,128,7168,256,256,8,ActivationType.Gelu,torch.bfloat16,torch.bfloat16,torch.bfloat16,QuantType.No,1,0,ck,stage1,32,moe_ck2stages_gemm1_256x32x64x128_1x4_TypeCast_v1_Nswizzle0_Quant0_MulRoutedWeight0_gelu_B16_B16_B16,456.0696,0.0,0.00%,24.72,6188.18,1861010.0,512.0,9.698674,271732201.0,116523008.0,0.0,0.0,116523008.0,167145.0,14891563.0,26461418.0,233440164.0,8080953.0,0.0421736708,29.451516,0.0143040828,2300224.0,7282688.0,9896902.0,130048.0,18466816.0,231830354.0,4608.0,726540642.0,59659780096.0
331,128,7168,256,256,8,ActivationType.Gelu,torch.bfloat16,torch.bfloat16,torch.bfloat16,QuantType.No,1,0,ck,stage2,32,moe_ck2stages_gemm2_256x32x64x64_1x4_TypeCastExpertWeight_v1_Nswizzle0_Quant0_MulRoutedWeight1_B16_B16_B16,251.0031,0.0,1.63%,44.92,11243.85,915196.625,14336.0,11.214719,121319500.0,58261504.0,0.0,0.0,58261504.0,511183.0,7551051.0,16542521.0,92124566.0,3590386.0,1.328232,83.376787,0.369486909,2987600.0,3641344.0,16387952.0,1820672.0,23329600.0,774273890.0,129024.0,914308624.0,29829890048.0
332,128,7168,256,256,8,ActivationType.Gelu,torch.bfloat16,torch.bfloat16,torch.bfloat16,QuantType.No,1,1,ck,stage1,32,moe_ck2stages_gemm1_256x32x64x64_1x4_TypeCastExpertWeight_v1_Nswizzle0_Quant0_MulRoutedWeight1_gelu_B16_B16_B16,464.238,0.0,0.00%,24.29,6079.3,1850540.0,512.0,9.615513,272427724.0,116523008.0,0.0,0.0,116523008.0,246620.0,14809014.0,25757779.0,233962003.0,7908826.0,0.0430337935,36.690129,0.00941827502,2300224.0,7282688.0,9493504.0,130048.0,18466816.0,540590487.0,4608.0,887019713.0,59659780096.0
332,128,7168,256,256,8,ActivationType.Gelu,torch.bfloat16,torch.bfloat16,torch.bfloat16,QuantType.No,1,1,ck,stage2,32,moe_ck2stages_gemm2_256x32x64x64_1x4_TypeCast_v1_Nswizzle0_Quant0_MulRoutedWeight0_B16_B16_B16,250.8082,0.0,0.00%,44.95,11252.59,914900.375,14336.0,10.286138,133930809.0,58261504.0,0.0,0.0,58261504.0,487360.0,7548687.0,17362462.0,108408244.0,3652001.0,1.303904,81.596801,0.468406079,2987600.0,3641344.0,15136240.0,1820672.0,23329600.0,766933041.0,129024.0,911484366.0,29829890048.0
333,128,7168,256,256,8,ActivationType.Gelu,torch.bfloat16,torch.float8_e4m3fnuz,torch.float8_e4m3fnuz,QuantType.per_Tensor,1,0,ck,stage1,32,moe_ck2stages_gemm1_256x32x64x256_1x4_MulABScale_v1_Nswizzle0_Quant1_MulRoutedWeight0_gelu_F8_F8_B16,232.6935,45.32655555555561,0.00%,48.45,6068.23,929615.9375,512.0,10.69099,118919917.0,0.0,0.0,116523008.0,58261504.0,107025.0,7441331.0,11820055.0,98746026.0,3712453.0,3.797879,28.557566,0.029347933,1381760.0,3641344.0,5605065.0,5396992.0,14630400.0,106546889.0,4608.0,324654770.0,59659780096.0
333,128,7168,256,256,8,ActivationType.Gelu,torch.bfloat16,torch.float8_e4m3fnuz,torch.float8_e4m3fnuz,QuantType.per_Tensor,1,0,ck,stage2,32,moe_ck2stages_gemm2_256x32x64x256_1x4_MulABScaleExpertWeight_v1_Nswizzle0_Quant1_MulRoutedWeight1_F8_F8_B16,122.8953,45.32655555555561,1.65%,91.74,11489.77,457775.375,14336.0,16.30262,38112919.0,0.0,0.0,58261504.0,29130752.0,321234.0,3891632.0,2879406.0,17342985.0,1167563.0,3.995259,71.141024,0.3423441,1849680.0,1820672.0,16046576.0,1820672.0,14226240.0,168514108.0,129024.0,259356360.0,29829890048.0
334,128,7168,256,256,8,ActivationType.Gelu,torch.bfloat16,torch.float8_e4m3fnuz,torch.float8_e4m3fnuz,QuantType.per_Tensor,1,1,ck,stage1,16,moe_ck2stages_gemm1_256x16x128x256_1x4_MulABScale_v1_Nswizzle0_Quant1_MulRoutedWeight1_gelu_F8_F8_B16,227.513,44.44511111111104,0.00%,49.55,6206.41,920888.8125,512.0,4.71043,126815718.0,0.0,0.0,58261504.0,29130752.0,67360.0,7371340.0,13206528.0,109208859.0,4131746.0,3.376475,16.266856,0.0359689811,516128.0,1820672.0,2629408.0,5331968.0,7672832.0,60965700.0,2560.0,205502741.0,29829890048.0
334,128,7168,256,256,8,ActivationType.Gelu,torch.bfloat16,torch.float8_e4m3fnuz,torch.float8_e4m3fnuz,QuantType.per_Tensor,1,1,ck,stage2,16,moe_ck2stages_gemm2_256x16x128x256_1x4_MulABScaleExpertWeight_v1_Nswizzle0_Quant1_MulRoutedWeight0_F8_F8_B16,132.7368,44.44511111111104,0.00%,84.94,10637.88,457414.75,28672.0,4.644801,70757508.0,0.0,0.0,29130752.0,14565376.0,160413.0,4118134.0,5664375.0,59465273.0,2057822.0,1.520158,74.298114,0.816388433,645624.0,910336.0,6729856.0,1202656.0,5150656.0,336227312.0,71680.0,470240920.0,14914945024.0
335,128,7168,256,256,8,ActivationType.Gelu,torch.bfloat16,torch.float8_e4m3fnuz,torch.float8_e4m3fnuz,QuantType.per_Token,1,0,asm,asm_1stage,32,_ZN5aiter45fmoe_bf16_pertokenFp8_g1u1_vs_gelu_1tg_32x256E,365.283,0.0,0.00%,30.86,3865.6,1386674.9375,15360.0,9.975298,174354139.0,0.0,0.0,174784512.0,87392256.0,155826.0,11337421.0,19613576.0,148708637.0,5787329.0,0.0,9.926329,0.135303293,1008888.0,5462016.0,12128336.0,0.0,3986784.0,52691636.0,1152.0,175158394.0,89489670144.0
336,128,7168,256,256,8,ActivationType.Gelu,torch.bfloat16,torch.float8_e4m3fnuz,torch.float8_e4m3fnuz,QuantType.per_Token,1,1,asm,asm_1stage,32,_ZN5aiter50fmoe_bf16_pertokenFp8_g1u1_vs_tkw1_gelu_1tg_32x256E,366.6217,0.0,0.00%,30.75,3851.49,1386441.75,14336.0,10.145577,170722322.0,0.0,0.0,174784512.0,87392256.0,148786.0,11323349.0,20842583.0,143689002.0,5680771.0,0.0,9.919392,0.070527863,960120.0,5462016.0,11250512.0,0.0,3856736.0,42639027.0,1152.0,172039787.0,89489670144.0
337,128,7168,256,256,8,ActivationType.Silu,torch.bfloat16,torch.bfloat16,torch.bfloat16,QuantType.No,1,0,ck,stage1,32,moe_ck2stages_gemm1_256x32x64x64_1x4_TypeCast_v1_Nswizzle0_Quant0_MulRoutedWeight0_silu_B16_B16_B16,464.4762,0.0,0.00%,24.27,6076.18,1850631.4375,512.0,9.587479,271882069.0,116523008.0,0.0,0.0,116523008.0,240824.0,14808249.0,27585307.0,233620925.0,7915844.0,0.0430477808,36.620484,0.0181760092,2300224.0,7282688.0,9729216.0,130048.0,18466816.0,537350527.0,4608.0,885048315.0,59659780096.0
337,128,7168,256,256,8,ActivationType.Silu,torch.bfloat16,torch.bfloat16,torch.bfloat16,QuantType.No,1,0,ck,stage2,32,moe_ck2stages_gemm2_256x32x64x64_1x4_TypeCastExpertWeight_v1_Nswizzle0_Quant0_MulRoutedWeight1_B16_B16_B16,250.9162,0.0,1.32%,44.93,11247.75,915201.5,14336.0,10.86117,127052991.0,58261504.0,0.0,0.0,58261504.0,515703.0,7551049.0,14862626.0,97887660.0,3673554.0,1.298594,83.012372,0.382755667,2987600.0,3641344.0,16387952.0,1820672.0,23329600.0,780344162.0,129024.0,931088546.0,29829890048.0
338,128,7168,256,256,8,ActivationType.Silu,torch.bfloat16,torch.bfloat16,torch.bfloat16,QuantType.No,1,1,ck,stage1,32,moe_ck2stages_gemm1_256x32x64x128_1x4_TypeCastExpertWeight_v1_Nswizzle0_Quant0_MulRoutedWeight1_silu_B16_B16_B16,456.8427,0.0,0.00%,24.68,6177.71,1861214.8125,512.0,9.673873,274597243.0,116523008.0,0.0,0.0,116523008.0,162222.0,14894710.0,26209309.0,236103824.0,7984554.0,0.0426634148,29.538649,0.0118211134,2300224.0,7282688.0,10046208.0,130048.0,18466816.0,233647323.0,4608.0,720325313.0,59659780096.0
338,128,7168,256,256,8,ActivationType.Silu,torch.bfloat16,torch.bfloat16,torch.bfloat16,QuantType.No,1,1,ck,stage2,32,moe_ck2stages_gemm2_256x32x64x64_1x4_TypeCast_v1_Nswizzle0_Quant0_MulRoutedWeight0_B16_B16_B16,250.4094,0.0,0.00%,45.02,11270.51,914912.625,14336.0,10.272267,134057221.0,58261504.0,0.0,0.0,58261504.0,488222.0,7548723.0,20543325.0,108585878.0,3517985.0,1.356994,81.527168,0.484029573,2987600.0,3641344.0,15136240.0,1820672.0,23329600.0,728882023.0,129024.0,875076667.0,29829890048.0
339,128,7168,256,256,8,ActivationType.Silu,torch.bfloat16,torch.float8_e4m3fnuz,torch.float8_e4m3fnuz,QuantType.per_Tensor,1,0,ck,stage1,16,moe_ck2stages_gemm1_256x16x128x256_1x4_MulABScale_v1_Nswizzle0_Quant1_MulRoutedWeight0_silu_F8_F8_B16,227.1468,44.868444444444485,0.00%,49.63,6216.41,920845.0,512.0,4.773875,126892633.0,0.0,0.0,58261504.0,29130752.0,65773.0,7370796.0,15041832.0,109211491.0,4027937.0,3.471389,16.61843,0.0152150894,516128.0,1820672.0,2787904.0,5331968.0,7672832.0,60313174.0,2560.0,204203974.0,29829890048.0
339,128,7168,256,256,8,ActivationType.Silu,torch.bfloat16,torch.float8_e4m3fnuz,torch.float8_e4m3fnuz,QuantType.per_Tensor,1,0,ck,stage2,16,moe_ck2stages_gemm2_256x16x128x256_1x4_MulABScaleExpertWeight_v1_Nswizzle0_Quant1_MulRoutedWeight1_F8_F8_B16,133.148,44.868444444444485,1.27%,84.67,10605.03,457543.625,28672.0,5.2608,62542791.0,0.0,0.0,29130752.0,14565376.0,174650.0,4119152.0,5736472.0,50121496.0,1954506.0,1.592449,75.862468,0.793423372,645624.0,910336.0,7185024.0,1202656.0,5150656.0,321139686.0,71680.0,458345351.0,14914945024.0
340,128,7168,256,256,8,ActivationType.Silu,torch.bfloat16,torch.float8_e4m3fnuz,torch.float8_e4m3fnuz,QuantType.per_Tensor,1,1,ck,stage1,16,moe_ck2stages_gemm1_256x16x128x256_1x4_MulABScale_v1_Nswizzle0_Quant1_MulRoutedWeight1_silu_F8_F8_B16,227.9309,44.28122222222217,0.00%,49.46,6195.03,920890.75,512.0,4.715214,127500347.0,0.0,0.0,58261504.0,29130752.0,66153.0,7371251.0,14453686.0,109784877.0,4022022.0,3.472407,16.485569,0.0128128793,516128.0,1820672.0,2822448.0,5331968.0,7672832.0,59786568.0,2560.0,202512065.0,29829890048.0
340,128,7168,256,256,8,ActivationType.Silu,torch.bfloat16,torch.float8_e4m3fnuz,torch.float8_e4m3fnuz,QuantType.per_Tensor,1,1,ck,stage2,16,moe_ck2stages_gemm2_256x16x128x256_1x4_MulABScaleExpertWeight_v1_Nswizzle0_Quant1_MulRoutedWeight0_F8_F8_B16,132.9615,44.28122222222217,0.00%,84.79,10619.91,457416.75,28672.0,4.766988,67835338.0,0.0,0.0,29130752.0,14565376.0,160590.0,4118127.0,6618504.0,56438266.0,1991393.0,1.579719,76.257153,0.827610699,645624.0,910336.0,6729856.0,1202656.0,5150656.0,331764680.0,71680.0,464442810.0,14914945024.0
341,128,7168,256,256,8,ActivationType.Silu,torch.bfloat16,torch.float8_e4m3fnuz,torch.float8_e4m3fnuz,QuantType.per_Token,1,0,asm,asm_1stage,32,_ZN5aiter45fmoe_bf16_pertokenFp8_g1u1_vs_silu_1tg_32x256E,364.6114,0.0,0.00%,30.92,3872.72,1386921.5,15360.0,10.011664,173171231.0,0.0,0.0,174784512.0,87392256.0,149774.0,11339745.0,19119080.0,147606866.0,5711204.0,0.0,9.936568,0.128859596,1008888.0,5462016.0,12030800.0,0.0,3986784.0,50731802.0,1152.0,173177211.0,89489670144.0
342,128,7168,256,256,8,ActivationType.Silu,torch.bfloat16,torch.float8_e4m3fnuz,torch.float8_e4m3fnuz,QuantType.per_Token,1,1,asm,asm_1stage,32,_ZN5aiter50fmoe_bf16_pertokenFp8_g1u1_vs_tkw1_silu_1tg_32x256E,366.8845,0.0,0.00%,30.73,3848.73,1386599.625,14336.0,10.053877,173340705.0,0.0,0.0,174784512.0,87392256.0,147538.0,11322941.0,22408334.0,146416017.0,5641719.0,0.0,9.947799,0.0691067205,960120.0,5462016.0,11152976.0,0.0,3856736.0,42827385.0,1152.0,171726361.0,89489670144.0
347,128,7168,256,256,8,ActivationType.Gelu,torch.bfloat16,torch.float8_e4m3fnuz,torch.float8_e4m3fnuz,QuantType.per_Tensor,1,0,ck,stage1,16,moe_ck2stages_gemm1_256x16x128x256_1x4_MulABScale_v1_Nswizzle0_Quant1_MulRoutedWeight0_gelu_F8_F8_B16,228.1253,40.81733333333338,0.00%,49.42,6189.75,920852.875,512.0,4.647702,128725255.0,0.0,0.0,58261504.0,29130752.0,68206.0,7370917.0,14809809.0,110847210.0,4077129.0,3.427465,16.567229,0.013831757,516128.0,1820672.0,2845609.0,5331968.0,7672832.0,61043764.0,2560.0,206183694.0,29829890048.0
347,128,7168,256,256,8,ActivationType.Gelu,torch.bfloat16,torch.float8_e4m3fnuz,torch.float8_e4m3fnuz,QuantType.per_Tensor,1,0,ck,stage2,16,moe_ck2stages_gemm2_256x16x128x256_1x4_MulABScaleExpertWeight_v1_Nswizzle0_Quant1_MulRoutedWeight1_F8_F8_B16,133.2748,40.81733333333338,1.63%,84.59,10594.94,457543.75,28672.0,5.108893,64524512.0,0.0,0.0,29130752.0,14565376.0,174160.0,4119161.0,8784831.0,52223702.0,2026563.0,1.549251,75.621476,0.816152254,645624.0,910336.0,7185024.0,1202656.0,5150656.0,332302433.0,71680.0,469628868.0,14914945024.0
351,128,7168,256,256,8,ActivationType.Gelu,torch.bfloat16,torch.float8_e4m3fnuz,torch.float8_e4m3fnuz,QuantType.per_1x128,1,0,asm,asm_1stage,32,_ZN5aiter47fmoe_bf16_blockscaleFp8_g1u1_vs_gelu_1tg_32x256E,361.4947,0.0,2.06%,31.19,3906.11,1381879.5625,15360.0,9.838455,175246154.0,0.0,0.0,174784512.0,87392256.0,212377.0,11300175.0,19396543.0,148858677.0,5815855.0,0.0,9.838345,0.168545176,1144016.0,5462016.0,14033336.0,0.0,4291584.0,54438390.0,1152.0,174918225.0,89489670144.0
352,128,7168,256,256,8,ActivationType.Gelu,torch.bfloat16,torch.float8_e4m3fnuz,torch.float8_e4m3fnuz,QuantType.per_1x128,1,1,ck,stage1,16,moe_ck2stages_gemm1_256x16x128x256_1x4_MulABScaleExpertWeightA8W8blkscale_v1_Nswizzle0_Quant4_MulRoutedWeight1_gelu_F8_F8_B16,234.8396,46.11377777777781,0.01%,48.01,6012.78,923663.5,512.0,4.654448,130965604.0,0.0,0.0,58261504.0,29130752.0,140110.0,7393219.0,13005480.0,110391925.0,4112842.0,3.51868,17.045222,0.0164021359,512064.0,1820672.0,3763264.0,5527040.0,7867904.0,76921559.0,2560.0,214193129.0,29829890048.0
352,128,7168,256,256,8,ActivationType.Gelu,torch.bfloat16,torch.float8_e4m3fnuz,torch.float8_e4m3fnuz,QuantType.per_1x128,1,1,ck,stage2,16,moe_ck2stages_gemm2_256x16x128x256_1x4_MulABScaleExpertWeightA8W8blkscale_v1_Nswizzle0_Quant4_MulRoutedWeight0_F8_F8_B16,133.1794,46.11377777777781,16.63%,84.65,10602.53,458472.625,14336.0,4.496691,73359084.0,0.0,0.0,29130752.0,14565376.0,238565.0,3897174.0,8320696.0,59883158.0,2187458.0,11.969183,76.56371,0.718282735,531832.0,910336.0,7114632.0,10013696.0,13961696.0,287634775.0,71680.0,512439809.0,14914945024.0
353,128,7168,256,256,8,ActivationType.Silu,torch.bfloat16,torch.float8_e4m3fnuz,torch.float8_e4m3fnuz,QuantType.per_1x128,1,1,ck,stage1,16,moe_ck2stages_gemm1_256x16x128x256_1x4_MulABScaleExpertWeightA8W8blkscale_v1_Nswizzle0_Quant4_MulRoutedWeight1_silu_F8_F8_B16,234.7441,47.77877777777779,0.02%,48.03,6015.23,923593.75,512.0,4.620274,131941251.0,0.0,0.0,58261504.0,29130752.0,136387.0,7393079.0,14098588.0,111151612.0,4094529.0,3.523753,16.907977,0.0133247538,512064.0,1820672.0,3911600.0,5527040.0,7867904.0,75349825.0,2560.0,212162551.0,29829890048.0
353,128,7168,256,256,8,ActivationType.Silu,torch.bfloat16,torch.float8_e4m3fnuz,torch.float8_e4m3fnuz,QuantType.per_1x128,1,1,ck,stage2,16,moe_ck2stages_gemm2_256x16x128x256_1x4_MulABScaleExpertWeightA8W8blkscale_v1_Nswizzle0_Quant4_MulRoutedWeight0_F8_F8_B16,133.1374,47.77877777777779,16.68%,84.68,10605.88,458463.25,14336.0,4.441501,73971850.0,0.0,0.0,29130752.0,14565376.0,238775.0,3897205.0,8665321.0,60493408.0,2166208.0,12.059099,74.544539,0.715830505,531832.0,910336.0,7114632.0,10013696.0,13961696.0,277548185.0,71680.0,495205407.0,14914945024.0
354,128,7168,256,256,8,ActivationType.Silu,torch.bfloat16,torch.float8_e4m3fnuz,torch.float8_e4m3fnuz,QuantType.per_1x128,1,0,asm,asm_1stage,32,_ZN5aiter49fmoe_bf16_blockscaleFp8_g1u1_novs_silu_1tg_32x256E,363.5269,0.0,0.00%,31.01,3884.28,1381707.125,15360.0,9.963598,172960423.0,0.0,0.0,174784512.0,87392256.0,213410.0,11295178.0,18278884.0,145019877.0,5794471.0,0.0,9.827241,0.117799985,1144016.0,5462016.0,13935800.0,0.0,4291584.0,38486121.0,1152.0,173796372.0,89489670144.0
358,128,7168,256,257,9,ActivationType.Silu,torch.bfloat16,torch.float8_e4m3fnuz,torch.float8_e4m3fnuz,QuantType.per_Token,1,0,asm,asm_1stage,32,_ZN5aiter48fmoe_bf16_pertokenFp8_g1u1_vs_silu_1tg_ps_32x256E,360.3488,0.0,0.00%,35.2,3933.81,1392286.6875,16128.0,10.162137,170565084.0,0.0,0.0,175472640.0,87736320.0,154465.0,11396337.0,19436677.0,143095251.0,5510706.0,0.0,10.018776,0.0579544044,963900.0,5483520.0,12113748.0,0.0,3871920.0,42196543.0,1216.0,168801903.0,89841991680.0
359,128,7168,256,256,8,ActivationType.Silu,torch.bfloat16,torch.float8_e4m3fnuz,torch.float8_e4m3fnuz,QuantType.per_1x128,1,0,asm,asm_1stage,32,_ZN5aiter47fmoe_bf16_blockscaleFp8_g1u1_vs_silu_1tg_32x256E,361.9541,0.0,0.00%,31.15,3901.15,1381808.75,15360.0,10.210614,170035522.0,0.0,0.0,174784512.0,87392256.0,212815.0,11297347.0,17665241.0,143463482.0,5712336.0,0.0,9.904702,0.182529194,1144016.0,5462016.0,13935800.0,0.0,4291584.0,53848915.0,1152.0,172797195.0,89489670144.0
360,128,7168,256,257,9,ActivationType.Silu,torch.bfloat16,torch.float8_e4m3fnuz,torch.float8_e4m3fnuz,QuantType.per_1x128,1,0,asm,asm_1stage,32,_ZN5aiter47fmoe_bf16_blockscaleFp8_g1u1_vs_silu_1tg_32x256E,362.4223,0.0,0.00%,35.0,3911.3,1386681.75,17280.0,10.064203,172674764.0,0.0,0.0,175472640.0,87736320.0,220049.0,11374760.0,17249094.0,146177866.0,5771990.0,0.0,9.944343,0.165688868,1148520.0,5483520.0,13990820.0,0.0,4308480.0,54380501.0,1172.0,175321240.0,89841991680.0
361,128,7168,512,256,8,ActivationType.Gelu,torch.bfloat16,torch.bfloat16,torch.bfloat16,QuantType.No,1,0,ck,stage1,32,moe_ck2stages_gemm1_256x32x64x128_1x4_TypeCast_v1_Nswizzle0_Quant0_MulRoutedWeight0_gelu_B16_B16_B16,921.5587,0.0,0.00%,24.47,6120.95,3653364.625,1024.0,10.51637,512498586.0,228458496.0,0.0,0.0,228458496.0,289639.0,29231790.0,39996460.0,438745137.0,14441682.0,0.0462977677,32.662979,0.0132754549,4509888.0,14278656.0,19412674.0,254976.0,36206592.0,449579048.0,9216.0,1439080294.0,116970749952.0
361,128,7168,512,256,8,ActivationType.Gelu,torch.bfloat16,torch.bfloat16,torch.bfloat16,QuantType.No,1,0,ck,stage2,32,moe_ck2stages_gemm2_256x32x64x128_1x4_TypeCastExpertWeight_v1_Nswizzle0_Quant0_MulRoutedWeight1_B16_B16_B16,482.991,0.0,3.35%,46.69,11678.92,1793798.25,14336.0,10.465697,263174760.0,114229248.0,0.0,0.0,114229248.0,967951.0,14579992.0,21918211.0,211523664.0,7112909.0,0.657301821,52.109342,0.280921519,5159840.0,7139328.0,24794336.0,1784832.0,40718720.0,862920907.0,129024.0,1131978251.0,58485374976.0
362,128,7168,512,256,8,ActivationType.Gelu,torch.bfloat16,torch.bfloat16,torch.bfloat16,QuantType.No,1,1,ck,stage1,32,moe_ck2stages_gemm1_256x32x64x128_1x4_TypeCastExpertWeight_v1_Nswizzle0_Quant0_MulRoutedWeight1_gelu_B16_B16_B16,918.0473,0.0,0.00%,24.56,6144.36,3653697.3125,1024.0,10.390177,519270429.0,228458496.0,0.0,0.0,228458496.0,294359.0,29230623.0,46099108.0,445425681.0,14458993.0,0.0462305253,32.755526,0.0144222899,4509888.0,14278656.0,19115232.0,254976.0,36206592.0,465174314.0,9216.0,1445256874.0,116970749952.0
362,128,7168,512,256,8,ActivationType.Gelu,torch.bfloat16,torch.bfloat16,torch.bfloat16,QuantType.No,1,1,ck,stage2,32,moe_ck2stages_gemm2_256x32x64x128_1x4_TypeCast_v1_Nswizzle0_Quant0_MulRoutedWeight0_B16_B16_B16,478.8019,0.0,0.00%,47.09,11781.1,1793538.0,14336.0,10.193502,269687266.0,114229248.0,0.0,0.0,114229248.0,941299.0,14577679.0,24332985.0,221609503.0,7239002.0,0.644764152,51.197969,0.385639393,5159840.0,7139328.0,23567264.0,1784832.0,40718720.0,820054633.0,129024.0,1133807118.0,58485374976.0
363,128,7168,512,256,8,ActivationType.Gelu,torch.bfloat16,torch.float8_e4m3fnuz,torch.float8_e4m3fnuz,QuantType.per_Tensor,1,0,asm,stage1,32,_ZN5aiter48fmoe_stage1_bf16_pertokenFp8_g1u1_32x256_2tg_pf3E,453.5846,43.77288888888887,0.00%,49.71,6220.06,1797203.3125,1024.0,11.947742,195059803.0,0.0,0.0,228458496.0,114229248.0,354536.0,14386457.0,15987242.0,161817488.0,5147255.0,0.0,15.733237,0.00977672946,501984.0,7139328.0,8427288.0,0.0,3760896.0,44589055.0,2304.0,249009465.0,116970749952.0
363,128,7168,512,256,8,ActivationType.Gelu,torch.bfloat16,torch.float8_e4m3fnuz,torch.float8_e4m3fnuz,QuantType.per_Tensor,1,0,ck,stage2,32,moe_ck2stages_gemm2_256x32x64x256_1x4_MulABScaleExpertWeight_v1_Nswizzle0_Quant1_MulRoutedWeight1_F8_F8_B16,247.8543,43.77288888888887,3.31%,90.98,11383.0,897103.0625,14336.0,12.662158,101812388.0,0.0,0.0,114229248.0,57114624.0,559995.0,7406217.0,7992198.0,70799914.0,3089734.0,1.508597,60.643647,0.406278907,2928800.0,3569664.0,18658976.0,1784832.0,22870400.0,433828422.0,129024.0,573983481.0,58485374976.0
364,128,7168,512,256,8,ActivationType.Gelu,torch.bfloat16,torch.float8_e4m3fnuz,torch.float8_e4m3fnuz,QuantType.per_Tensor,1,1,asm,stage1,32,_ZN5aiter53fmoe_stage1_bf16_pertokenFp8_doweight_g1u1_32x512_pf2E,455.9968,46.284333333333365,0.00%,49.45,6187.16,1793328.4375,1024.0,13.526708,163153363.0,0.0,0.0,228458496.0,114229248.0,198909.0,14354682.0,13065061.0,130483118.0,7264039.0,0.0,9.592879,0.000123231221,274896.0,7139328.0,8287284.0,0.0,1944192.0,97344765.0,1152.0,212982691.0,116970749952.0
364,128,7168,512,256,8,ActivationType.Gelu,torch.bfloat16,torch.float8_e4m3fnuz,torch.float8_e4m3fnuz,QuantType.per_Tensor,1,1,ck,stage2,32,moe_ck2stages_gemm2_256x32x64x256_1x4_MulABScaleExpertWeight_v1_Nswizzle0_Quant1_MulRoutedWeight0_F8_F8_B16,246.8187,46.284333333333365,0.00%,91.36,11430.76,896849.25,14336.0,12.627877,105183622.0,0.0,0.0,114229248.0,57114624.0,532675.0,7404259.0,11632386.0,77655965.0,3026809.0,1.54061,61.10455,0.359000297,2928800.0,3569664.0,16093280.0,1784832.0,22870400.0,435015483.0,129024.0,566328079.0,58485374976.0
365,128,7168,512,256,8,ActivationType.Gelu,torch.bfloat16,torch.float8_e4m3fnuz,torch.float8_e4m3fnuz,QuantType.per_Token,1,0,asm,asm_1stage,32,_ZN5aiter45fmoe_bf16_pertokenFp8_g1u1_vs_gelu_1tg_32x512E,721.1555,0.0,0.00%,31.27,3912.23,2723290.75,15360.0,9.714536,344077150.0,0.0,0.0,342687744.0,171343872.0,113135.0,22032035.0,39563178.0,296992026.0,11431914.0,0.0,9.775381,0.0597675393,1012932.0,10708992.0,17790120.0,0.0,3987984.0,11345638.0,1152.0,340988234.0,175456124928.0
366,128,7168,512,256,8,ActivationType.Gelu,torch.bfloat16,torch.float8_e4m3fnuz,torch.float8_e4m3fnuz,QuantType.per_Token,1,1,asm,asm_1stage,32,_ZN5aiter50fmoe_bf16_pertokenFp8_g1u1_vs_tkw1_gelu_1tg_32x512E,721.2818,0.0,0.00%,31.26,3911.54,2723261.75,14336.0,9.817812,342551688.0,0.0,0.0,342687744.0,171343872.0,111490.0,22015660.0,33284288.0,294022645.0,11439917.0,0.0,9.769263,0.0530199369,965124.0,10708992.0,16993320.0,0.0,3860496.0,11236186.0,1152.0,341278993.0,175456124928.0
367,128,7168,512,256,8,ActivationType.Silu,torch.bfloat16,torch.bfloat16,torch.bfloat16,QuantType.No,1,1,ck,stage1,32,moe_ck2stages_gemm1_256x32x64x128_1x4_TypeCastExpertWeight_v1_Nswizzle0_Quant0_MulRoutedWeight1_silu_B16_B16_B16,923.4029,0.0,0.00%,24.42,6108.73,3653644.125,1024.0,10.650313,508119210.0,228458496.0,0.0,0.0,228458496.0,291378.0,29229482.0,43322057.0,434159307.0,14059299.0,0.0475516992,32.568442,0.0145881831,4509888.0,14278656.0,19696896.0,254976.0,36206592.0,443559993.0,9216.0,1397076661.0,116970749952.0
367,128,7168,512,256,8,ActivationType.Silu,torch.bfloat16,torch.bfloat16,torch.bfloat16,QuantType.No,1,1,ck,stage2,32,moe_ck2stages_gemm2_256x32x64x128_1x4_TypeCast_v1_Nswizzle0_Quant0_MulRoutedWeight0_B16_B16_B16,479.0822,0.0,0.00%,47.07,11774.21,1793552.375,14336.0,11.215416,246681540.0,114229248.0,0.0,0.0,114229248.0,941643.0,14577860.0,19873912.0,198525570.0,6608809.0,0.705787627,52.216207,0.397633493,5159840.0,7139328.0,23567264.0,1784832.0,40718720.0,752391601.0,129024.0,1056376205.0,58485374976.0
368,128,7168,512,256,8,ActivationType.Silu,torch.bfloat16,torch.float8_e4m3fnuz,torch.float8_e4m3fnuz,QuantType.per_Tensor,1,0,ck,stage1,16,moe_ck2stages_gemm1_256x16x128x256_1x4_MulABScale_v1_Nswizzle0_Quant1_MulRoutedWeight0_silu_F8_F8_B16,448.2522,45.0731111111111,0.00%,50.3,6294.06,1804675.3125,1024.125,4.876676,265262358.0,0.0,0.0,114229248.0,57114624.0,119965.0,14446486.0,21464888.0,232703725.0,7679630.0,3.571955,26.974492,0.0290580517,1011936.0,3569664.0,5466048.0,10454016.0,15043584.0,121467546.0,5120.0,631568483.0,58485374976.0
368,128,7168,512,256,8,ActivationType.Silu,torch.bfloat16,torch.float8_e4m3fnuz,torch.float8_e4m3fnuz,QuantType.per_Tensor,1,0,ck,stage2,16,moe_ck2stages_gemm2_256x16x128x256_1x4_MulABScaleExpertWeight_v1_Nswizzle0_Quant1_MulRoutedWeight1_F8_F8_B16,249.6094,45.0731111111111,2.82%,90.34,11302.96,896916.625,28672.0,4.836498,140680401.0,0.0,0.0,57114624.0,28557312.0,291515.0,7634204.0,12346032.0,120538560.0,3740335.0,0.824888088,73.39569,0.697955726,911680.0,1784832.0,8050560.0,1180368.0,7281232.0,476892679.0,71680.0,840200513.0,29242687488.0
369,128,7168,512,256,8,ActivationType.Silu,torch.bfloat16,torch.float8_e4m3fnuz,torch.float8_e4m3fnuz,QuantType.per_Tensor,1,1,asm,stage1,16,_ZN5aiter57fmoe_stage1_bf16_pertokenFp8_doweight_g1u1_16x256_2tg_pf3E,452.5295,45.99455555555557,0.01%,49.83,6234.57,1797458.8125,1024.0,6.75565,174847569.0,0.0,0.0,114229248.0,57114624.0,333339.0,14387597.0,15877578.0,143323465.0,5166532.0,0.0,15.855018,0.00778489943,250992.0,3569664.0,4262584.0,0.0,1880448.0,62849381.0,2560.0,250596028.0,58485374976.0
369,128,7168,512,256,8,ActivationType.Silu,torch.bfloat16,torch.float8_e4m3fnuz,torch.float8_e4m3fnuz,QuantType.per_Tensor,1,1,ck,stage2,16,moe_ck2stages_gemm2_256x16x128x256_1x4_MulABScaleExpertWeight_v1_Nswizzle0_Quant1_MulRoutedWeight0_F8_F8_B16,250.2826,45.99455555555557,0.00%,90.09,11272.56,896810.625,28672.0,4.467213,151549943.0,0.0,0.0,57114624.0,28557312.0,274090.0,7633350.0,15675854.0,132193474.0,4186516.0,0.735275137,72.563233,0.76861414,911680.0,1784832.0,7604352.0,1180368.0,7281232.0,539202605.0,71680.0,931910399.0,29242687488.0
370,128,7168,512,256,8,ActivationType.Silu,torch.bfloat16,torch.float8_e4m3fnuz,torch.float8_e4m3fnuz,QuantType.per_Token,1,0,asm,asm_1stage,32,_ZN5aiter45fmoe_bf16_pertokenFp8_g1u1_vs_silu_1tg_32x512E,722.1991,0.0,0.00%,31.22,3906.57,2723245.8125,15360.0,9.735766,343367398.0,0.0,0.0,342687744.0,171343872.0,107818.0,22031785.0,34634680.0,296289622.0,11570144.0,0.0,9.725892,0.0707762247,1012932.0,10708992.0,17598888.0,0.0,3987984.0,11540452.0,1152.0,343546505.0,175456124928.0
371,128,7168,512,256,8,ActivationType.Silu,torch.bfloat16,torch.float8_e4m3fnuz,torch.float8_e4m3fnuz,QuantType.per_Token,1,1,asm,asm_1stage,32,_ZN5aiter50fmoe_bf16_pertokenFp8_g1u1_vs_tkw1_silu_1tg_32x256E,724.7245,0.0,0.00%,31.11,3892.96,2720275.875,28672.0,10.16301,350681144.0,0.0,0.0,342687744.0,171343872.0,221038.0,22220480.0,38634344.0,298874047.0,11233776.0,0.0,10.341427,0.0921878026,1882440.0,10708992.0,21867312.0,0.0,7561632.0,78818689.0,2304.0,354482365.0,175456124928.0
372,128,7168,512,256,8,ActivationType.Silu,torch.bfloat16,torch.bfloat16,torch.bfloat16,QuantType.No,1,0,ck,stage1,32,moe_ck2stages_gemm1_256x32x64x128_1x4_TypeCast_v1_Nswizzle0_Quant0_MulRoutedWeight0_silu_B16_B16_B16,923.7912,0.0,0.00%,24.41,6106.16,3652765.9375,1024.0,10.594734,508705536.0,228458496.0,0.0,0.0,228458496.0,288085.0,29230199.0,37982998.0,435021624.0,14036646.0,0.0476641144,32.625384,0.0135908789,4509888.0,14278656.0,19577376.0,254976.0,36206592.0,435526158.0,9216.0,1396218532.0,116970749952.0
372,128,7168,512,256,8,ActivationType.Silu,torch.bfloat16,torch.bfloat16,torch.bfloat16,QuantType.No,1,0,ck,stage2,32,moe_ck2stages_gemm2_256x32x64x64_1x4_TypeCastExpertWeight_v1_Nswizzle0_Quant0_MulRoutedWeight1_B16_B16_B16,490.8226,0.0,2.85%,45.94,11492.57,1793974.3125,14336.0,10.318617,263925583.0,114229248.0,0.0,0.0,114229248.0,953274.0,14584056.0,33324114.0,213916616.0,6934927.0,0.675071535,77.205085,0.381413496,5159840.0,7139328.0,20778464.0,1784832.0,40718720.0,1284790301.0,129024.0,1632989686.0,58485374976.0
373,128,7168,512,256,8,ActivationType.Silu,torch.bfloat16,torch.float8_e4m3fnuz,torch.float8_e4m3fnuz,QuantType.per_Token,1,0,asm,asm_1stage,32,_ZN5aiter48fmoe_bf16_pertokenFp8_g1u1_vs_silu_1tg_ps_32x512E,723.3456,0.0,0.00%,31.17,3900.38,2723216.125,14336.0,9.757731,342295071.0,0.0,0.0,342687744.0,171343872.0,108657.0,22015146.0,32732327.0,293178618.0,11423930.0,0.0,9.770525,0.0624128636,965124.0,10708992.0,17634780.0,0.0,3860496.0,10444806.0,1216.0,340531553.0,175456124928.0
375,128,7168,512,256,8,ActivationType.Silu,torch.bfloat16,torch.float8_e4m3fnuz,torch.float8_e4m3fnuz,QuantType.per_Tensor,1,1,asm,stage1,32,_ZN5aiter57fmoe_stage1_bf16_pertokenFp8_doweight_g1u1_32x256_2tg_pf3E,455.0008,49.01655555555555,0.00%,49.56,6200.7,1797303.375,1024.0,13.371956,171022365.0,0.0,0.0,228458496.0,114229248.0,356057.0,14387646.0,14661797.0,137960144.0,5157767.0,0.0,15.769802,0.00919646212,501984.0,7139328.0,8367528.0,0.0,3760896.0,45188646.0,2304.0,250088677.0,116970749952.0
375,128,7168,512,256,8,ActivationType.Silu,torch.bfloat16,torch.float8_e4m3fnuz,torch.float8_e4m3fnuz,QuantType.per_Tensor,1,1,ck,stage2,32,moe_ck2stages_gemm2_256x32x64x256_1x4_MulABScaleExpertWeight_v1_Nswizzle0_Quant1_MulRoutedWeight0_F8_F8_B16,247.5473,49.01655555555555,0.00%,91.09,11397.11,896864.5,14336.0,12.408038,108324048.0,0.0,0.0,114229248.0,57114624.0,532636.0,7404261.0,10276532.0,80862013.0,3086197.0,1.50754,61.265839,0.408481575,2928800.0,3569664.0,16093280.0,1784832.0,22870400.0,448768630.0,129024.0,580279205.0,58485374976.0
376,128,7168,512,256,8,ActivationType.Silu,torch.bfloat16,torch.float8_e4m3fnuz,torch.float8_e4m3fnuz,QuantType.per_Token,1,1,asm,asm_1stage,32,_ZN5aiter53fmoe_bf16_pertokenFp8_g1u1_vs_tkw1_silu_1tg_ps_32x512E,721.8034,0.0,0.00%,31.24,3908.72,2723234.25,14336.0,9.886032,341337462.0,0.0,0.0,342687744.0,171343872.0,108621.0,22015196.0,34754910.0,292266896.0,10584547.0,0.0,9.784905,0.0471386505,965124.0,10708992.0,16869852.0,0.0,3860496.0,10283960.0,1216.0,315738089.0,175456124928.0
377,128,7168,512,256,8,ActivationType.Gelu,torch.bfloat16,torch.float8_e4m3fnuz,torch.float8_e4m3fnuz,QuantType.per_Tensor,1,0,asm,stage1,16,_ZN5aiter48fmoe_stage1_bf16_pertokenFp8_g1u1_16x512_2tg_pf2E,453.1964,44.948444444444526,0.00%,49.75,6225.39,1793582.8125,1024.0,6.793042,161813893.0,0.0,0.0,114229248.0,57114624.0,180961.0,14353521.0,11724535.0,130554520.0,5440761.0,0.0,9.670344,8.22584891e-05,137448.0,3569664.0,4184048.0,0.0,972096.0,111857123.0,1280.0,160822686.0,58485374976.0
377,128,7168,512,256,8,ActivationType.Gelu,torch.bfloat16,torch.float8_e4m3fnuz,torch.float8_e4m3fnuz,QuantType.per_Tensor,1,0,ck,stage2,16,moe_ck2stages_gemm2_256x16x128x256_1x4_MulABScaleExpertWeight_v1_Nswizzle0_Quant1_MulRoutedWeight1_F8_F8_B16,250.1122,44.948444444444526,3.32%,90.15,11280.24,896918.625,28672.0,4.825675,139938848.0,0.0,0.0,57114624.0,28557312.0,291626.0,7634187.0,13221863.0,119711155.0,4200786.0,0.735507737,72.850736,0.715172303,911680.0,1784832.0,8050560.0,1180368.0,7281232.0,530657226.0,71680.0,935306840.0,29242687488.0
378,128,7168,512,256,8,ActivationType.Gelu,torch.bfloat16,torch.float8_e4m3fnuz,torch.float8_e4m3fnuz,QuantType.per_Tensor,1,1,asm,stage1,16,_ZN5aiter57fmoe_stage1_bf16_pertokenFp8_doweight_g1u1_16x256_2tg_pf3E,453.2966,48.2554444444445,0.01%,49.74,6224.01,1797499.625,1024.0,4.971771,239502989.0,0.0,0.0,114229248.0,57114624.0,334048.0,14388086.0,20777633.0,208147549.0,5659308.0,0.0,15.572192,0.0113750432,250992.0,3569664.0,4298440.0,0.0,1880448.0,68143170.0,2560.0,270510192.0,58485374976.0
378,128,7168,512,256,8,ActivationType.Gelu,torch.bfloat16,torch.float8_e4m3fnuz,torch.float8_e4m3fnuz,QuantType.per_Tensor,1,1,ck,stage2,16,moe_ck2stages_gemm2_256x16x128x256_1x4_MulABScaleExpertWeight_v1_Nswizzle0_Quant1_MulRoutedWeight0_F8_F8_B16,250.2276,48.2554444444445,0.00%,90.11,11275.03,896814.0,28672.0,4.741726,142543170.0,0.0,0.0,57114624.0,28557312.0,275128.0,7633318.0,10946790.0,123255630.0,3975253.0,0.779642159,73.306492,0.734794346,911680.0,1784832.0,7604352.0,1180368.0,7281232.0,515397823.0,71680.0,887880532.0,29242687488.0
379,128,7168,512,256,8,ActivationType.Gelu,torch.bfloat16,torch.float8_e4m3fnuz,torch.float8_e4m3fnuz,QuantType.per_Token,1,0,asm,asm_1stage,32,_ZN5aiter48fmoe_bf16_pertokenFp8_g1u1_vs_gelu_1tg_ps_32x512E,723.211,0.0,0.00%,31.18,3901.11,2723223.75,14336.0,10.058074,332050239.0,0.0,0.0,342687744.0,171343872.0,107305.0,22015204.0,30809687.0,282997076.0,10971248.0,0.0,9.73545,0.03920097,965124.0,10708992.0,17826012.0,0.0,3860496.0,10239262.0,1216.0,325677522.0,175456124928.0
381,128,7168,512,256,8,ActivationType.Gelu,torch.bfloat16,torch.float8_e4m3fnuz,torch.float8_e4m3fnuz,QuantType.per_1x128,1,0,asm,asm_1stage,32,_ZN5aiter47fmoe_bf16_blockscaleFp8_g1u1_vs_gelu_1tg_32x128E,752.8597,0.0,10.10%,29.95,3747.48,2702127.625,57344.0,12.315726,305396538.0,0.0,0.0,342687744.0,171343872.0,583926.0,22534620.0,33262101.0,241638520.0,9714449.0,0.0,11.04336,0.0812316927,4179216.0,10708992.0,35089344.0,0.0,15888192.0,239643020.0,4608.0,328065378.0,175456124928.0
382,128,7168,512,256,8,ActivationType.Silu,torch.bfloat16,torch.float8_e4m3fnuz,torch.float8_e4m3fnuz,QuantType.per_1x128,1,0,asm,stage1,16,_ZN5aiter59fmoe_stage1_bf16_pertokenFp8_blockscale_g1u1_16x512_2tg_pf2E,441.5682,47.17733333333335,14.90%,51.06,6389.33,1797902.25,544.5,4.941818,223158771.0,0.0,0.0,114229248.0,57114624.0,325243.0,14389909.0,19782770.0,188314259.0,7604325.0,0.0,9.66116,0.000154046641,197208.0,3569664.0,8350565.0,0.0,1075680.0,151395817.0,1280.0,224020871.0,58485374976.0
382,128,7168,512,256,8,ActivationType.Silu,torch.bfloat16,torch.float8_e4m3fnuz,torch.float8_e4m3fnuz,QuantType.per_1x128,1,0,ck,stage2,16,moe_ck2stages_gemm2_256x16x128x256_1x4_MulABScaleExpertWeightA8W8blkscale_v1_Nswizzle0_Quant4_MulRoutedWeight1_F8_F8_B16,250.1516,47.17733333333335,15.59%,90.14,11278.46,899245.5,14336.0,4.43761,150782892.0,0.0,0.0,57114624.0,28557312.0,338127.0,7423447.0,14991771.0,126911387.0,4201777.0,6.120113,50.879634,0.461026445,800128.0,1784832.0,9056656.0,9816576.0,15917440.0,365551117.0,71680.0,652881795.0,29242687488.0
383,128,7168,512,256,8,ActivationType.Gelu,torch.bfloat16,torch.float8_e4m3fnuz,torch.float8_e4m3fnuz,QuantType.per_1x128,1,1,ck,stage1,16,moe_ck2stages_gemm1_256x16x128x256_1x4_MulABScaleExpertWeightA8W8blkscale_v1_Nswizzle0_Quant4_MulRoutedWeight1_gelu_F8_F8_B16,462.4463,47.79588888888898,0.01%,48.76,6100.87,1811696.6875,1024.0,4.918423,266120465.0,0.0,0.0,114229248.0,57114624.0,264196.0,14501550.0,22286946.0,227717966.0,7549260.0,3.753607,27.762027,0.0220770964,1003968.0,3569664.0,7378368.0,10836480.0,15426048.0,155072891.0,5120.0,641180939.0,58485374976.0
383,128,7168,512,256,8,ActivationType.Gelu,torch.bfloat16,torch.float8_e4m3fnuz,torch.float8_e4m3fnuz,QuantType.per_1x128,1,1,ck,stage2,16,moe_ck2stages_gemm2_256x16x128x256_1x4_MulABScaleExpertWeightA8W8blkscale_v1_Nswizzle0_Quant4_MulRoutedWeight0_F8_F8_B16,251.3081,47.79588888888898,16.70%,89.72,11226.56,899113.625,14336.0,4.399585,153603019.0,0.0,0.0,57114624.0,28557312.0,327123.0,7422327.0,14958117.0,129913008.0,3896406.0,6.545128,50.695263,0.499509744,800128.0,1784832.0,8610448.0,9816576.0,15917440.0,345885193.0,71680.0,608274052.0,29242687488.0
384,128,7168,512,256,8,ActivationType.Silu,torch.bfloat16,torch.float8_e4m3fnuz,torch.float8_e4m3fnuz,QuantType.per_1x128,1,1,ck,stage1,16,moe_ck2stages_gemm1_256x16x128x256_1x4_MulABScaleExpertWeightA8W8blkscale_v1_Nswizzle0_Quant4_MulRoutedWeight1_silu_F8_F8_B16,461.4609,49.27833333333321,0.01%,48.86,6113.9,1811689.5,1024.0,6.186418,208959768.0,0.0,0.0,114229248.0,57114624.0,262364.0,14500360.0,16575442.0,170479444.0,6735526.0,4.177011,26.428143,0.0193968371,1003968.0,3569664.0,7669200.0,10836480.0,15426048.0,133563733.0,5120.0,548503355.0,58485374976.0
384,128,7168,512,256,8,ActivationType.Silu,torch.bfloat16,torch.float8_e4m3fnuz,torch.float8_e4m3fnuz,QuantType.per_1x128,1,1,ck,stage2,16,moe_ck2stages_gemm2_256x16x128x256_1x4_MulABScaleExpertWeightA8W8blkscale_v1_Nswizzle0_Quant4_MulRoutedWeight0_F8_F8_B16,250.6464,49.27833333333321,16.68%,89.96,11256.2,899117.0,14336.0,4.381118,151654235.0,0.0,0.0,57114624.0,28557312.0,326208.0,7422363.0,14936950.0,128263749.0,4177686.0,6.163734,51.269628,0.472919804,800128.0,1784832.0,8610448.0,9816576.0,15917440.0,368641278.0,71680.0,653230312.0,29242687488.0
386,128,7168,512,256,8,ActivationType.Gelu,torch.bfloat16,torch.float8_e4m3fnuz,torch.float8_e4m3fnuz,QuantType.per_1x128,1,0,asm,stage1,16,_ZN5aiter59fmoe_stage1_bf16_pertokenFp8_blockscale_g1u1_16x256_3tg_pf2E,444.5858,47.969666666666704,24.90%,50.72,6345.96,1804606.125,578.5625,4.947216,245791979.0,0.0,0.0,114229248.0,57114624.0,412497.0,14442997.0,22591527.0,208060205.0,7461225.0,0.0,18.302501,0.00872563895,310752.0,3569664.0,8557834.0,0.0,1984032.0,270705305.0,2560.0,416867933.0,58485374976.0
386,128,7168,512,256,8,ActivationType.Gelu,torch.bfloat16,torch.float8_e4m3fnuz,torch.float8_e4m3fnuz,QuantType.per_1x128,1,0,ck,stage2,16,moe_ck2stages_gemm2_256x16x128x256_1x4_MulABScaleExpertWeightA8W8blkscale_v1_Nswizzle0_Quant4_MulRoutedWeight1_F8_F8_B16,251.1942,47.969666666666704,15.60%,89.77,11231.65,899244.125,14336.0,4.394637,152216605.0,0.0,0.0,57114624.0,28557312.0,338836.0,7423396.0,13826814.0,128511557.0,4218204.0,6.089459,51.357749,0.471110473,800128.0,1784832.0,9056656.0,9816576.0,15917440.0,368605330.0,71680.0,662334308.0,29242687488.0
389,128,7168,2048,33,10,ActivationType.Silu,torch.bfloat16,torch.float8_e4m3fnuz,torch.float8_e4m3fnuz,QuantType.per_1x128,1,0,asm,asm_1stage,32,_ZN5aiter52fmoe_bf16_blockscaleFp8_g1u1_novs_silu_1tg_ps_32x256E,479.8174,0.0,0.00%,234.97,3034.65,1440788.1875,153600.0,31.551995,110752221.0,0.0,0.0,357826560.0,178913280.0,11913932.0,14005294.0,3278610.0,51950438.0,3657555.0,0.0,9.878237,0.0517404721,2342080.0,11182080.0,28608448.0,0.0,8785920.0,17834708.0,1216.0,112146565.0,183207198720.0
390,128,7168,2048,33,10,ActivationType.Silu,torch.bfloat16,torch.float8_e4m3fnuz,torch.float8_e4m3fnuz,QuantType.per_Token,1,0,asm,asm_1stage,32,_ZN5aiter48fmoe_bf16_pertokenFp8_g1u1_vs_silu_1tg_ps_32x256E,476.5515,0.0,0.02%,236.58,3055.45,1441941.375,143360.0,30.215824,120134137.0,0.0,0.0,357826560.0,178913280.0,11894208.0,13829285.0,3216420.0,59633255.0,3802657.0,0.0,10.203375,0.0137853371,1965600.0,11182080.0,24641888.0,0.0,7895680.0,24352137.0,1216.0,119817329.0,183207198720.0
391,256,2048,192,128,8,ActivationType.Silu,torch.bfloat16,torch.bfloat16,torch.bfloat16,QuantType.No,1,0,ck,stage1,32,moe_ck2stages_gemm1_256x32x64x64_1x4_TypeCast_v1_Nswizzle0_Quant0_MulRoutedWeight0_silu_B16_B16_B16,61.4415,0.0,0.00%,78.64,4949.21,207221.875,768.0,6.643163,35883060.0,12582912.0,0.0,0.0,12582912.0,130676.0,1664499.0,7629141.0,30323921.0,1225805.0,0.104654716,12.364779,0.00295320824,254976.0,786432.0,1403904.0,49152.0,2064384.0,42295412.0,2304.0,46457810.0,6442450944.0
391,256,2048,192,128,8,ActivationType.Silu,torch.bfloat16,torch.bfloat16,torch.bfloat16,QuantType.No,1,0,ck,stage2,32,moe_ck2stages_gemm2_256x32x64x64_1x4_TypeCastExpertWeight_v1_Nswizzle0_Quant0_MulRoutedWeight1_B16_B16_B16,38.6959,0.0,0.00%,124.87,7858.38,105748.3125,8192.0,7.804234,14244515.0,6291456.0,0.0,0.0,6291456.0,231232.0,977039.0,1133380.0,9814175.0,523854.0,1.269979,56.883275,0.278396539,353984.0,393216.0,2587008.0,262144.0,2726656.0,63297350.0,24576.0,93932945.0,3221225472.0
392,256,2048,192,128,8,ActivationType.Silu,torch.bfloat16,torch.bfloat16,torch.bfloat16,QuantType.No,1,1,ck,stage1,32,moe_ck2stages_gemm1_256x32x64x64_1x4_TypeCastExpertWeight_v1_Nswizzle0_Quant0_MulRoutedWeight1_silu_B16_B16_B16,62.7405,0.0,0.00%,77.01,4846.74,207353.125,768.0,6.644144,36068723.0,12582912.0,0.0,0.0,12582912.0,133746.0,1663794.0,7102981.0,30353301.0,1244838.0,0.1029023,12.362592,0.00308275629,254976.0,786432.0,1426944.0,49152.0,2064384.0,43036549.0,2304.0,47240623.0,6442450944.0
392,256,2048,192,128,8,ActivationType.Silu,torch.bfloat16,torch.bfloat16,torch.bfloat16,QuantType.No,1,1,ck,stage2,32,moe_ck2stages_gemm2_256x32x64x64_1x4_TypeCast_v1_Nswizzle0_Quant0_MulRoutedWeight0_B16_B16_B16,37.9983,0.0,0.00%,127.16,8002.65,105615.875,8192.0,7.593816,13371487.0,6291456.0,0.0,0.0,6291456.0,227634.0,976041.0,913308.0,9439821.0,525701.0,1.284087,55.66496,0.450922506,353984.0,393216.0,2406784.0,262144.0,2726656.0,61128626.0,24576.0,90911194.0,3221225472.0
393,256,2048,192,128,8,ActivationType.Gelu,torch.bfloat16,torch.bfloat16,torch.bfloat16,QuantType.No,1,0,ck,stage1,32,moe_ck2stages_gemm1_256x32x64x64_1x4_TypeCast_v1_Nswizzle0_Quant0_MulRoutedWeight0_gelu_B16_B16_B16,61.7412,0.0,0.00%,78.26,4925.19,207131.25,768.0,6.588683,35981051.0,12582912.0,0.0,0.0,12582912.0,133399.0,1664293.0,5134819.0,30378182.0,1205932.0,0.106575929,12.455432,0.00321340997,254976.0,786432.0,1289697.0,49152.0,2064384.0,42008455.0,2304.0,45954798.0,6442450944.0
393,256,2048,192,128,8,ActivationType.Gelu,torch.bfloat16,torch.bfloat16,torch.bfloat16,QuantType.No,1,0,ck,stage2,32,moe_ck2stages_gemm2_256x32x64x64_1x4_TypeCastExpertWeight_v1_Nswizzle0_Quant0_MulRoutedWeight1_B16_B16_B16,38.489,0.0,0.00%,125.54,7900.62,105743.3125,8192.0,7.620436,14526915.0,6291456.0,0.0,0.0,6291456.0,230750.0,977456.0,923113.0,10015218.0,558872.0,1.181012,57.425666,0.384766829,353984.0,393216.0,2587008.0,262144.0,2726656.0,69906173.0,24576.0,101972180.0,3221225472.0
394,256,2048,192,128,8,ActivationType.Gelu,torch.bfloat16,torch.bfloat16,torch.bfloat16,QuantType.No,1,1,ck,stage1,32,moe_ck2stages_gemm1_256x32x64x64_1x4_TypeCastExpertWeight_v1_Nswizzle0_Quant0_MulRoutedWeight1_gelu_B16_B16_B16,61.6716,0.0,0.00%,78.35,4930.75,207175.25,768.0,6.291826,36750978.0,12582912.0,0.0,0.0,12582912.0,134829.0,1666163.0,6215291.0,30964151.0,1277563.0,0.099217115,12.124755,0.00299153166,254976.0,786432.0,1314816.0,49152.0,2064384.0,44063488.0,2304.0,48052674.0,6442450944.0
394,256,2048,192,128,8,ActivationType.Gelu,torch.bfloat16,torch.bfloat16,torch.bfloat16,QuantType.No,1,1,ck,stage2,32,moe_ck2stages_gemm2_256x32x64x64_1x4_TypeCast_v1_Nswizzle0_Quant0_MulRoutedWeight0_B16_B16_B16,37.7039,0.0,0.00%,128.15,8065.13,105607.8125,8192.0,7.991805,12935019.0,6291456.0,0.0,0.0,6291456.0,227656.0,975989.0,971535.0,8968117.0,553146.0,1.233819,57.605952,0.494482401,353984.0,393216.0,2406784.0,262144.0,2726656.0,69357634.0,24576.0,97914265.0,3221225472.0
395,256,4096,192,128,8,ActivationType.Silu,torch.bfloat16,torch.bfloat16,torch.bfloat16,QuantType.No,1,0,ck,stage1,32,moe_ck2stages_gemm1_256x32x64x64_1x4_TypeCast_v1_Nswizzle0_Quant0_MulRoutedWeight0_silu_B16_B16_B16,111.8584,0.0,0.00%,86.39,5437.0,417906.375,768.0,7.232019,71835794.0,25165824.0,0.0,0.0,25165824.0,213219.0,3349978.0,8076777.0,62135471.0,2269560.0,0.0563601162,13.16416,0.00157950969,500736.0,1572864.0,2313216.0,49152.0,4030464.0,84525976.0,2304.0,91844349.0,12884901888.0
395,256,4096,192,128,8,ActivationType.Silu,torch.bfloat16,torch.bfloat16,torch.bfloat16,QuantType.No,1,0,ck,stage2,32,moe_ck2stages_gemm2_256x32x64x64_1x4_TypeCastExpertWeight_v1_Nswizzle0_Quant0_MulRoutedWeight1_B16_B16_B16,64.8002,0.0,0.08%,149.13,9385.37,204472.75,16384.0,9.306905,26034807.0,12582912.0,0.0,0.0,12582912.0,499476.0,1897882.0,5320799.0,17837829.0,890622.0,1.514815,72.688278,0.470132015,708416.0,786432.0,5171392.0,524288.0,5455104.0,142437518.0,49152.0,201263399.0,6442450944.0
396,256,4096,192,128,8,ActivationType.Silu,torch.bfloat16,torch.bfloat16,torch.bfloat16,QuantType.No,1,1,ck,stage1,32,moe_ck2stages_gemm1_256x32x64x64_1x4_TypeCastExpertWeight_v1_Nswizzle0_Quant0_MulRoutedWeight1_silu_B16_B16_B16,111.4056,0.0,0.00%,86.74,5459.1,418001.1875,768.0,5.162563,102993248.0,25165824.0,0.0,0.0,25165824.0,214001.0,3351353.0,16105818.0,93150139.0,2347523.0,0.0545605575,13.279283,0.00156071256,500736.0,1572864.0,2336256.0,49152.0,4030464.0,88358906.0,2304.0,95703323.0,12884901888.0
396,256,4096,192,128,8,ActivationType.Silu,torch.bfloat16,torch.bfloat16,torch.bfloat16,QuantType.No,1,1,ck,stage2,32,moe_ck2stages_gemm2_256x32x64x64_1x4_TypeCast_v1_Nswizzle0_Quant0_MulRoutedWeight0_B16_B16_B16,63.9112,0.0,0.00%,151.2,9515.92,204300.4375,16384.0,8.003426,31596492.0,12582912.0,0.0,0.0,12582912.0,492515.0,1896544.0,4729129.0,24436622.0,893118.0,1.504848,71.526162,0.615047337,708416.0,786432.0,4810944.0,524288.0,5455104.0,139049943.0,49152.0,199357260.0,6442450944.0
397,256,4096,192,128,8,ActivationType.Gelu,torch.bfloat16,torch.bfloat16,torch.bfloat16,QuantType.No,1,0,ck,stage1,32,moe_ck2stages_gemm1_256x32x64x64_1x4_TypeCast_v1_Nswizzle0_Quant0_MulRoutedWeight0_gelu_B16_B16_B16,112.29,0.0,0.00%,86.06,5416.1,418052.9375,768.0,7.217416,72951630.0,25165824.0,0.0,0.0,25165824.0,214986.0,3350678.0,11617573.0,63323158.0,2372744.0,0.0540518475,13.250493,0.00156705491,500736.0,1572864.0,2311065.0,49152.0,4030464.0,89126745.0,2304.0,96394596.0,12884901888.0
397,256,4096,192,128,8,ActivationType.Gelu,torch.bfloat16,torch.bfloat16,torch.bfloat16,QuantType.No,1,0,ck,stage2,32,moe_ck2stages_gemm2_256x32x64x64_1x4_TypeCastExpertWeight_v1_Nswizzle0_Quant0_MulRoutedWeight1_B16_B16_B16,64.8103,0.0,0.13%,149.11,9383.91,204456.1875,16384.0,9.020118,28157036.0,12582912.0,0.0,0.0,12582912.0,498573.0,1897849.0,5879726.0,19947257.0,823681.0,1.659752,73.625153,0.449491863,708416.0,786432.0,5171392.0,524288.0,5455104.0,129487931.0,49152.0,186055685.0,6442450944.0
398,256,4096,192,128,8,ActivationType.Gelu,torch.bfloat16,torch.bfloat16,torch.bfloat16,QuantType.No,1,1,ck,stage1,32,moe_ck2stages_gemm1_256x32x64x64_1x4_TypeCastExpertWeight_v1_Nswizzle0_Quant0_MulRoutedWeight1_gelu_B16_B16_B16,111.1813,0.0,0.00%,86.92,5470.11,418186.75,768.0,7.07355,72995721.0,25165824.0,0.0,0.0,25165824.0,217901.0,3351060.0,13398924.0,63225768.0,2377436.0,0.0538992284,13.099218,0.00163555296,500736.0,1572864.0,2224128.0,49152.0,4030464.0,88439056.0,2304.0,95563931.0,12884901888.0
398,256,4096,192,128,8,ActivationType.Gelu,torch.bfloat16,torch.bfloat16,torch.bfloat16,QuantType.No,1,1,ck,stage2,32,moe_ck2stages_gemm2_256x32x64x64_1x4_TypeCast_v1_Nswizzle0_Quant0_MulRoutedWeight0_B16_B16_B16,64.1009,0.0,0.00%,150.76,9487.76,204313.5625,16384.0,8.685403,28777156.0,12582912.0,0.0,0.0,12582912.0,491622.0,1896632.0,5001754.0,21637908.0,864902.0,1.573425,71.267688,0.635035581,708416.0,786432.0,4810944.0,524288.0,5455104.0,135528292.0,49152.0,189979360.0,6442450944.0
399,256,4096,384,128,8,ActivationType.Gelu,torch.bfloat16,torch.bfloat16,torch.bfloat16,QuantType.No,1,0,ck,stage1,32,moe_ck2stages_gemm1_256x32x64x64_1x4_TypeCast_v1_Nswizzle0_Quant0_MulRoutedWeight0_gelu_B16_B16_B16,207.3595,0.0,0.00%,93.21,5845.66,826382.0,1536.0,9.321241,116172538.0,50331648.0,0.0,0.0,50331648.0,487982.0,6625185.0,12954499.0,98708215.0,3581451.0,0.0716012482,26.927989,0.00376419322,1001472.0,3145728.0,4621509.0,98304.0,8060928.0,199959468.0,4608.0,295763449.0,25769803776.0
399,256,4096,384,128,8,ActivationType.Gelu,torch.bfloat16,torch.bfloat16,torch.bfloat16,QuantType.No,1,0,ck,stage2,32,moe_ck2stages_gemm2_256x32x64x128_1x4_TypeCastExpertWeight_v1_Nswizzle0_Quant0_MulRoutedWeight1_B16_B16_B16,114.1328,0.0,0.52%,169.34,10620.56,409241.0,16384.0,9.350891,59928517.0,25165824.0,0.0,0.0,25165824.0,963327.0,3536175.0,5974749.0,45986637.0,1736467.0,0.788864606,51.082592,0.522763034,1199296.0,1572864.0,7431360.0,524288.0,9384704.0,182388313.0,49152.0,271600369.0,12884901888.0
400,256,4096,384,128,8,ActivationType.Gelu,torch.bfloat16,torch.bfloat16,torch.bfloat16,QuantType.No,1,1,ck,stage1,32,moe_ck2stages_gemm1_256x32x64x64_1x4_TypeCastExpertWeight_v1_Nswizzle0_Quant0_MulRoutedWeight1_gelu_B16_B16_B16,207.0248,0.0,0.00%,93.36,5855.11,826728.125,1536.0,9.227646,117423870.0,50331648.0,0.0,0.0,50331648.0,490940.0,6625800.0,12446212.0,99671414.0,3562739.0,0.0720996609,27.132835,0.00629177796,1001472.0,3145728.0,4448256.0,98304.0,8060928.0,200650183.0,4608.0,295953262.0,25769803776.0
400,256,4096,384,128,8,ActivationType.Gelu,torch.bfloat16,torch.bfloat16,torch.bfloat16,QuantType.No,1,1,ck,stage2,32,moe_ck2stages_gemm2_256x32x64x128_1x4_TypeCast_v1_Nswizzle0_Quant0_MulRoutedWeight0_B16_B16_B16,114.752,0.0,0.00%,168.43,10563.25,409063.25,16384.0,8.903967,64027375.0,25165824.0,0.0,0.0,25165824.0,956290.0,3534719.0,6991532.0,51215788.0,1805417.0,0.752686937,49.767469,0.656968751,1199296.0,1572864.0,7070912.0,524288.0,9384704.0,176830231.0,49152.0,277326316.0,12884901888.0
401,256,4096,384,128,8,ActivationType.Silu,torch.bfloat16,torch.bfloat16,torch.bfloat16,QuantType.No,1,0,ck,stage1,32,moe_ck2stages_gemm1_256x32x64x64_1x4_TypeCast_v1_Nswizzle0_Quant0_MulRoutedWeight0_silu_B16_B16_B16,206.8302,0.0,0.00%,93.45,5860.62,826831.0625,1536.0,9.44844,114847459.0,50331648.0,0.0,0.0,50331648.0,486184.0,6624895.0,12360057.0,97361748.0,3518002.0,0.0729373388,27.443055,0.00709088284,1001472.0,3145728.0,4626432.0,98304.0,8060928.0,199562019.0,4608.0,295899146.0,25769803776.0
401,256,4096,384,128,8,ActivationType.Silu,torch.bfloat16,torch.bfloat16,torch.bfloat16,QuantType.No,1,0,ck,stage2,32,moe_ck2stages_gemm2_256x32x64x128_1x4_TypeCastExpertWeight_v1_Nswizzle0_Quant0_MulRoutedWeight1_B16_B16_B16,114.7487,0.0,0.37%,168.43,10563.55,409238.75,16384.0,8.968637,61279079.0,25165824.0,0.0,0.0,25165824.0,962552.0,3536178.0,7003354.0,47290837.0,1707108.0,0.803207732,50.971976,0.55785379,1199296.0,1572864.0,7431360.0,524288.0,9384704.0,177966645.0,49152.0,266172692.0,12884901888.0
402,256,4096,384,128,8,ActivationType.Silu,torch.bfloat16,torch.bfloat16,torch.bfloat16,QuantType.No,1,1,ck,stage1,32,moe_ck2stages_gemm1_256x32x64x64_1x4_TypeCastExpertWeight_v1_Nswizzle0_Quant0_MulRoutedWeight1_silu_B16_B16_B16,207.6241,0.0,0.00%,93.09,5838.21,826981.75,1536.0,9.291716,116620085.0,50331648.0,0.0,0.0,50331648.0,484197.0,6629227.0,14148208.0,99036441.0,3565062.0,0.0721548426,27.644488,0.00281010757,1001472.0,3145728.0,4672512.0,98304.0,8060928.0,203994120.0,4608.0,301303542.0,25769803776.0
402,256,4096,384,128,8,ActivationType.Silu,torch.bfloat16,torch.bfloat16,torch.bfloat16,QuantType.No,1,1,ck,stage2,32,moe_ck2stages_gemm2_256x32x64x128_1x4_TypeCast_v1_Nswizzle0_Quant0_MulRoutedWeight0_B16_B16_B16,114.6792,0.0,0.00%,168.53,10569.95,409064.25,16384.0,9.133975,61645319.0,25165824.0,0.0,0.0,25165824.0,955952.0,3534751.0,6955041.0,48815647.0,1792710.0,0.765499269,51.607464,0.684671764,1199296.0,1572864.0,7070912.0,524288.0,9384704.0,179398708.0,49152.0,282766298.0,12884901888.0
403,256,4096,384,128,8,ActivationType.Silu,torch.bfloat16,torch.float8_e4m3fnuz,torch.float8_e4m3fnuz,QuantType.per_Tensor,1,0,ck,stage1,32,moe_ck2stages_gemm1_256x32x64x128_1x4_MulABScale_v1_Nswizzle0_Quant1_MulRoutedWeight0_silu_F8_F8_B16,109.7024,51.24655555555556,0.00%,176.18,5534.3,409314.8125,1536.0,8.828871,58444177.0,0.0,0.0,50331648.0,25165824.0,291365.0,3288367.0,8837710.0,48684337.0,1870216.0,9.671703,26.174395,0.0032762768,795648.0,1572864.0,2912256.0,6955008.0,10985472.0,99249626.0,4608.0,150577937.0,25769803776.0
403,256,4096,384,128,8,ActivationType.Silu,torch.bfloat16,torch.float8_e4m3fnuz,torch.float8_e4m3fnuz,QuantType.per_Tensor,1,0,ck,stage2,32,moe_ck2stages_gemm2_256x32x64x128_1x4_MulABScaleExpertWeight_v1_Nswizzle0_Quant1_MulRoutedWeight1_F8_F8_B16,65.4253,51.24655555555556,0.36%,295.41,9279.67,204469.0,16384.0,11.41208,19683170.0,0.0,0.0,25165824.0,12582912.0,506896.0,1897941.0,3322186.0,11064988.0,733965.0,18.015393,67.541439,0.290168545,904384.0,786432.0,5792960.0,5242880.0,10171136.0,99635804.0,49152.0,157248488.0,12884901888.0
404,256,4096,384,128,8,ActivationType.Silu,torch.bfloat16,torch.float8_e4m3fnuz,torch.float8_e4m3fnuz,QuantType.per_Tensor,1,1,ck,stage1,32,moe_ck2stages_gemm1_256x32x64x128_1x4_MulABScale_v1_Nswizzle0_Quant1_MulRoutedWeight1_silu_F8_F8_B16,109.9652,52.08811111111121,0.00%,175.76,5521.07,409508.125,1536.0,8.400203,62007604.0,0.0,0.0,50331648.0,25165824.0,292531.0,3288428.0,9531920.0,52376723.0,1991222.0,9.082301,26.611122,0.00323789202,795648.0,1572864.0,2976768.0,6955008.0,10985472.0,107875712.0,4608.0,163025270.0,25769803776.0
404,256,4096,384,128,8,ActivationType.Silu,torch.bfloat16,torch.float8_e4m3fnuz,torch.float8_e4m3fnuz,QuantType.per_Tensor,1,1,ck,stage2,32,moe_ck2stages_gemm2_256x32x64x128_1x4_MulABScaleExpertWeight_v1_Nswizzle0_Quant1_MulRoutedWeight0_F8_F8_B16,65.645,52.08811111111121,0.00%,294.42,9248.62,204331.9375,16384.0,11.873539,20341204.0,0.0,0.0,25165824.0,12582912.0,498337.0,1896828.0,3371540.0,12827748.0,722207.0,18.762923,67.813151,0.390705745,904384.0,786432.0,5039296.0,5242880.0,10171136.0,100513912.0,49152.0,151590972.0,12884901888.0
405,256,4096,384,128,8,ActivationType.Silu,torch.bfloat16,torch.float8_e4m3fnuz,torch.float8_e4m3fnuz,QuantType.per_Token,1,0,asm,asm_1stage,32,_ZN5aiter45fmoe_bf16_pertokenFp8_g1u1_vs_silu_1tg_32x384E,175.57,0.0,0.00%,110.08,3458.03,606309.25,18432.0,8.877219,40831929.0,0.0,0.0,75497472.0,37748736.0,106245.0,5144140.0,5949536.0,29384295.0,2736658.0,0.0,4.826693,0.0847583294,317952.0,2359296.0,4509184.0,0.0,1243136.0,2962338.0,768.0,40570079.0,38654705664.0
406,256,4096,384,128,8,ActivationType.Silu,torch.bfloat16,torch.float8_e4m3fnuz,torch.float8_e4m3fnuz,QuantType.per_Token,1,1,asm,asm_1stage,32,_ZN5aiter50fmoe_bf16_pertokenFp8_g1u1_vs_tkw1_silu_1tg_32x192E,176.886,0.0,0.00%,109.26,3432.3,604097.25,32768.0,9.243967,78401242.0,0.0,0.0,75497472.0,37748736.0,219932.0,5355661.0,12024004.0,65391922.0,2620874.0,0.0,9.565941,0.136378452,568320.0,2359296.0,5804032.0,0.0,2293760.0,43714623.0,1536.0,77083925.0,38654705664.0
407,256,4096,384,128,8,ActivationType.Gelu,torch.bfloat16,torch.float8_e4m3fnuz,torch.float8_e4m3fnuz,QuantType.per_Tensor,1,0,ck,stage1,32,moe_ck2stages_gemm1_256x32x64x128_1x4_MulABScale_v1_Nswizzle0_Quant1_MulRoutedWeight0_gelu_F8_F8_B16,109.6257,50.89522222222225,0.00%,176.3,5538.17,409446.6875,1536.0,8.55932,60286723.0,0.0,0.0,50331648.0,25165824.0,294151.0,3287192.0,8212719.0,50509387.0,1947938.0,9.341825,27.014136,0.0206332533,795648.0,1572864.0,2866592.0,6955008.0,10985472.0,107284871.0,4608.0,160896645.0,25769803776.0
407,256,4096,384,128,8,ActivationType.Gelu,torch.bfloat16,torch.float8_e4m3fnuz,torch.float8_e4m3fnuz,QuantType.per_Tensor,1,0,ck,stage2,32,moe_ck2stages_gemm2_256x32x64x128_1x4_MulABScaleExpertWeight_v1_Nswizzle0_Quant1_MulRoutedWeight1_F8_F8_B16,65.5714,50.89522222222225,0.49%,294.75,9259.0,204472.5,16384.0,12.285888,19522333.0,0.0,0.0,25165824.0,12582912.0,506682.0,1897970.0,3268465.0,10949089.0,685698.0,19.501465,65.842221,0.316047763,904384.0,786432.0,5792960.0,5242880.0,10171136.0,88693528.0,49152.0,141611047.0,12884901888.0
408,256,4096,384,128,8,ActivationType.Gelu,torch.bfloat16,torch.float8_e4m3fnuz,torch.float8_e4m3fnuz,QuantType.per_Tensor,1,1,ck,stage1,32,moe_ck2stages_gemm1_256x32x64x128_1x4_MulABScale_v1_Nswizzle0_Quant1_MulRoutedWeight1_gelu_F8_F8_B16,110.2195,51.620888888888935,0.00%,175.35,5508.33,409696.3125,1536.0,8.265998,63832941.0,0.0,0.0,50331648.0,25165824.0,292988.0,3291146.0,6626820.0,53906487.0,2044272.0,8.867599,25.714999,0.00278586351,795648.0,1572864.0,2688000.0,6955008.0,10985472.0,107037347.0,4608.0,161349679.0,25769803776.0
408,256,4096,384,128,8,ActivationType.Gelu,torch.bfloat16,torch.float8_e4m3fnuz,torch.float8_e4m3fnuz,QuantType.per_Tensor,1,1,ck,stage2,32,moe_ck2stages_gemm2_256x32x64x128_1x4_MulABScaleExpertWeight_v1_Nswizzle0_Quant1_MulRoutedWeight0_F8_F8_B16,65.6361,51.620888888888935,0.00%,294.46,9249.87,204320.875,16384.0,11.15376,20472432.0,0.0,0.0,25165824.0,12582912.0,497825.0,1896938.0,3584617.0,12962877.0,707938.0,19.327285,67.665801,0.361343337,904384.0,786432.0,5039296.0,5242880.0,10171136.0,96830360.0,49152.0,146844705.0,12884901888.0
409,256,4096,384,128,8,ActivationType.Gelu,torch.bfloat16,torch.float8_e4m3fnuz,torch.float8_e4m3fnuz,QuantType.per_Token,1,0,asm,asm_1stage,32,_ZN5aiter45fmoe_bf16_pertokenFp8_g1u1_vs_gelu_1tg_32x192E,175.2195,0.0,0.00%,110.3,3464.94,604022.625,36864.0,9.20955,78888365.0,0.0,0.0,75497472.0,37748736.0,223377.0,5420912.0,11315146.0,66122112.0,2700950.0,0.0,9.593147,0.140888657,617472.0,2359296.0,6385664.0,0.0,2424832.0,48829630.0,1536.0,79584179.0,38654705664.0
410,256,4096,384,128,8,ActivationType.Gelu,torch.bfloat16,torch.float8_e4m3fnuz,torch.float8_e4m3fnuz,QuantType.per_Token,1,1,asm,asm_1stage,32,_ZN5aiter50fmoe_bf16_pertokenFp8_g1u1_vs_tkw1_gelu_1tg_32x192E,175.5379,0.0,0.00%,110.1,3458.66,603824.3125,32768.0,9.370027,77862290.0,0.0,0.0,75497472.0,37748736.0,219653.0,5357383.0,10027021.0,64850322.0,2710706.0,0.0,9.631879,0.141084759,568320.0,2359296.0,5877760.0,0.0,2293760.0,45569890.0,1536.0,80110938.0,38654705664.0
419,256,4096,384,128,8,ActivationType.Silu,torch.bfloat16,torch.float8_e4m3fnuz,torch.float8_e4m3fnuz,QuantType.per_1x128,1,0,asm,asm_1stage,32,_ZN5aiter49fmoe_bf16_blockscaleFp8_g1u1_novs_silu_1tg_32x128E,217.9512,0.0,0.00%,88.68,2785.6,607089.8125,49152.0,8.882884,77330257.0,0.0,0.0,75497472.0,37748736.0,337667.0,5638405.0,6568659.0,61679950.0,2875442.0,0.0,8.925742,0.0938093741,947712.0,2359296.0,7930368.0,0.0,3618816.0,52963629.0,2304.0,78719081.0,38654705664.0
420,256,4096,384,128,8,ActivationType.Gelu,torch.bfloat16,torch.float8_e4m3fnuz,torch.float8_e4m3fnuz,QuantType.per_1x128,1,0,asm,asm_1stage,32,_ZN5aiter49fmoe_bf16_blockscaleFp8_g1u1_novs_gelu_1tg_32x128E,217.7168,0.0,0.16%,88.77,2788.6,606685.875,49152.0,8.433292,82695556.0,0.0,0.0,75497472.0,37748736.0,332106.0,5645247.0,7343244.0,66963240.0,2865583.0,0.0,9.084538,0.0849236535,947712.0,2359296.0,8004096.0,0.0,3618816.0,54156369.0,2304.0,79754792.0,38654705664.0
