scripts/results/kernels_with_counters.csv
config_idx,token,model_dim,inter_dim,expert,topk,act_type,dtype,q_dtype_a,q_dtype_w,q_type,use_g1u1,doweight_stage1,kernel_type,stage,block_m,kernel_name,time_us,quant_time_us,error,tflops,bandwidth_gb,TCC_EA0_RDREQ_sum,TCC_HIT,TCC_MISS,TCC_TAG_STALL_sum,TCP_PENDING_STALL_CYCLES_sum,LDSBankConflict,OccupancyPercent,MemUnitStalled,MfmaFlops,MfmaFlopsF16,MfmaUtil,SQ_INSTS_MFMA,SQ_VALU_MFMA_BUSY_CYCLES,GRBM_COUNT,GRBM_GUI_ACTIVE,SQ_BUSY_CU_CYCLES,SQ_WAIT_ANY,SQ_WAIT_INST_ANY,SQ_WAVES_sum,SQ_WAVE_CYCLES,SQ_INSTS,SQ_INSTS_LDS,SQ_INSTS_SALU,SQ_INSTS_SMEM,SQ_INSTS_VALU,SQ_INSTS_VMEM,SQ_ACTIVE_INST_ANY,SQ_ACTIVE_INST_LDS,SQ_ACTIVE_INST_VALU,SQ_ACTIVE_INST_VMEM,SQ_LDS_BANK_CONFLICT,SQ_LDS_IDX_ACTIVE,max_bandwidth,CU_NUM,SIMD_NUM,MfmaFlopsBF16,MfmaFlopsF32,FETCH_SIZE,TCC_EA0_WRREQ_sum,WRITE_SIZE
0,512,6144,4096,8,2,ActivationType.Silu,torch.bfloat16,torch.bfloat16,torch.bfloat16,QuantType.No,1,0,ck,stage1,64,moe_ck2stages_gemm1_256x64x128x64_1x4_TypeCast_v3_Nswizzle0_Quant0_MulRoutedWeight0_silu_B16_B16_B16,360.5105,0.0,0.00%,428.89,3385.59,9149011.0,9963237.0,9213462.0,262902.0,32573641.0,0.55276228,14.347568,0.0225799545,128849018880.0,0.0,53.065179,15728640.0,251658240.0,3051710.0,3051710.0,79583121.0,23057588.0,82755318.0,3072.0,135304666.0,31222784.0,2519040.0,967680.0,34816.0,20377600.0,2475520.0,29381018.0,4641178.0,20869120.0,2467840.0,655360.0,20643840.0,0.0,304.0,1216.0,128849018880.0,0.0,1102590.125,131130.0,8192.375
0,512,6144,4096,8,2,ActivationType.Silu,torch.bfloat16,torch.bfloat16,torch.bfloat16,QuantType.No,1,0,ck,stage2,64,moe_ck2stages_gemm2_256x64x128x64_1x4_TypeCastExpertWeight_v3_Nswizzle0_Quant0_MulRoutedWeight1_B16_B16_B16,197.2454,0.0,2.30%,783.89,6187.94,4901168.0,6139297.0,5293612.0,352217.0,24311721.0,0.451855558,16.379188,0.0764852173,64424509440.0,0.0,47.154149,7864320.0,125829120.0,1724509.0,1724509.0,51243877.0,33373637.0,36182587.0,4608.0,88571434.0,20809104.0,2556144.0,895008.0,52224.0,11164416.0,1551456.0,19021690.0,4892410.0,11164416.0,1474560.0,301440.0,20448576.0,0.0,304.0,1216.0,64424509440.0,0.0,604754.5625,393216.0,24576.0
1,512,6144,4096,8,2,ActivationType.Silu,torch.bfloat16,torch.float8_e4m3fnuz,torch.float8_e4m3fnuz,QuantType.per_Token,1,0,asm,asm_1stage,32,_ZN5aiter45fmoe_bf16_pertokenFp8_g1u1_vs_silu_1tg_32x512E,294.0165,0.0,4.92%,525.88,2086.34,7465132.0,14657912.0,9165350.0,1581465.0,21228893.0,0.0,9.983396,0.0314303028,0.0,0.0,47.692178,10616832.0,169869312.0,2210450.0,2210450.0,70438662.0,5573153.0,38949763.0,1280.0,70438662.0,25612880.0,1024128.0,2626432.0,43648.0,17626880.0,3424640.0,25915748.0,1524580.0,18119936.0,2996352.0,0.0,4022784.0,0.0,304.0,1216.0,0.0,0.0,880557.375,1703936.0,106496.0
2,512,6144,4096,8,2,ActivationType.Silu,torch.bfloat16,torch.int8,torch.int8,QuantType.per_Tensor,1,0,ck,stage1,64,moe_ck2stages_gemm1_256x64x64x128_1x4_MulABScale_v1_Nswizzle0_Quant1_MulRoutedWeight0_silu_I8_I8_B16,191.029,68.63311111111118,0.00%,809.4,3211.12,4692163.0,6416480.0,4756955.0,50103.0,18009020.0,0.522068881,30.057568,0.0256852218,0.0,0.0,50.118613,7864320.0,125829120.0,1597032.0,1597032.0,46910972.0,34271452.0,94800541.0,6144.0,150646979.0,21363712.0,2519040.0,1209344.0,69632.0,12451840.0,1510400.0,21576441.0,5196537.0,12943360.0,1484800.0,327680.0,20316160.0,0.0,304.0,1216.0,0.0,0.0,588372.8125,131072.0,8192.0
2,512,6144,4096,8,2,ActivationType.Silu,torch.bfloat16,torch.int8,torch.int8,QuantType.per_Tensor,1,0,ck,stage2,64,moe_ck2stages_gemm2_256x64x128x128_1x4_MulABScaleExpertWeight_v3_Nswizzle0_Quant1_MulRoutedWeight1_I8_I8_B16,106.0655,68.63311111111118,2.05%,1457.77,5783.38,2148116.0,3388061.0,2540643.0,324014.0,13647319.0,0.754058166,15.847531,0.170105856,0.0,0.0,39.345506,3932160.0,62914560.0,1070898.0,1070898.0,29881633.0,20639845.0,20452171.0,4608.0,51876791.0,11801232.0,1327344.0,757536.0,52224.0,6272256.0,821856.0,10788449.0,2610401.0,6272256.0,737280.0,301440.0,10618176.0,0.0,304.0,1216.0,0.0,0.0,268059.625,393216.0,24576.0
3,4,2304,1536,8,2,ActivationType.Gelu,torch.bfloat16,torch.float8_e4m3fnuz,torch.float8_e4m3fnuz,QuantType.per_Token,1,0,asm,asm_1stage,32,_ZN5aiter45fmoe_bf16_pertokenFp8_g1u1_vs_gelu_1tg_32x128E,33.5695,0.0,0.00%,5.06,2530.94,505200.0,38316.0,510704.0,25730.0,1435125.0,0.0,2.146957,0.00983351936,0.0,0.0,4.402869,248832.0,3981312.0,554605.0,554605.0,3856229.0,1668148.0,725185.0,432.0,3856229.0,1445616.0,93600.0,243936.0,13824.0,916992.0,97344.0,1462908.0,137244.0,950400.0,95040.0,0.0,381312.0,0.0,304.0,1216.0,0.0,0.0,62970.5,6912.0,432.0
