scripts/results/results_activation_comparison.csv
timestamp,config_idx,token,model_dim,inter_dim,expert,topk,act_type,dtype,q_dtype_a,q_dtype_w,q_type,use_g1u1,doweight_stage1,kernel_type,stage,block_m,kernel_name,tile_m,tile_n,tile_k,block_size,waves_m,waves_n,kernel_version,time_us,quant_time_us,error,tflops,bandwidth_gb
2026-01-12 04:43:13,0,256,7168,512,256,8,ActivationType.Silu,torch.bfloat16,torch.bfloat16,torch.bfloat16,QuantType.No,1,1,ck,stage2,32,moe_ck2stages_gemm2_256x32x64x128_1x4_TypeCast_v1_Nswizzle0_Quant0_MulRoutedWeight0_B16_B16_B16,32,64,128.0,256.0,1.0,4.0,1.0,502.5105,0.0,0.00%,89.74,11232.57
2026-01-12 04:43:13,0,256,7168,512,256,8,ActivationType.Silu,torch.bfloat16,torch.bfloat16,torch.bfloat16,QuantType.No,1,1,ck,stage2,32,moe_ck2stages_gemm2_256x32x64x64_1x4_TypeCast_v1_Nswizzle0_Quant0_MulRoutedWeight0_B16_B16_B16,32,64,64.0,256.0,1.0,4.0,1.0,505.9194,0.0,0.00%,89.14,11156.89
2026-01-12 04:43:13,0,256,7168,512,256,8,ActivationType.Silu,torch.bfloat16,torch.bfloat16,torch.bfloat16,QuantType.No,1,1,ck,stage2,64,moe_ck2stages_gemm2_256x64x128x128_1x4_TypeCast_v3_Nswizzle0_Quant0_MulRoutedWeight0_B16_B16_B16,64,128,128.0,256.0,1.0,4.0,3.0,515.9036,0.0,0.00%,87.41,10940.97
2026-01-12 04:43:13,0,256,7168,512,256,8,ActivationType.Silu,torch.bfloat16,torch.bfloat16,torch.bfloat16,QuantType.No,1,1,ck,stage2,64,moe_ck2stages_gemm2_256x64x128x64_1x4_TypeCast_v3_Nswizzle0_Quant0_MulRoutedWeight0_B16_B16_B16,64,128,64.0,256.0,1.0,4.0,3.0,516.977,0.0,0.00%,87.23,10918.25
2026-01-12 04:43:13,0,256,7168,512,256,8,ActivationType.Silu,torch.bfloat16,torch.bfloat16,torch.bfloat16,QuantType.No,1,1,ck,stage2,64,moe_ck2stages_gemm2_256x64x64x64_1x4_TypeCast_v1_Nswizzle0_Quant0_MulRoutedWeight0_B16_B16_B16,64,64,64.0,256.0,1.0,4.0,1.0,522.3958,0.0,0.00%,86.33,10805.0
2026-01-12 04:43:13,0,256,7168,512,256,8,ActivationType.Silu,torch.bfloat16,torch.bfloat16,torch.bfloat16,QuantType.No,1,1,ck,stage2,64,moe_ck2stages_gemm2_256x64x64x128_1x4_TypeCast_v1_Nswizzle0_Quant0_MulRoutedWeight0_B16_B16_B16,64,64,128.0,256.0,1.0,4.0,1.0,526.9758,0.0,0.00%,85.58,10711.09
2026-01-12 04:43:13,0,256,7168,512,256,8,ActivationType.Silu,torch.bfloat16,torch.bfloat16,torch.bfloat16,QuantType.No,1,1,ck,stage2,128,moe_ck2stages_gemm2_256x128x128x64_1x4_TypeCast_v3_Nswizzle0_Quant0_MulRoutedWeight0_B16_B16_B16,128,128,64.0,256.0,1.0,4.0,3.0,565.5105,0.0,0.00%,79.75,9981.22
2026-01-12 04:43:13,0,256,7168,512,256,8,ActivationType.Silu,torch.bfloat16,torch.bfloat16,torch.bfloat16,QuantType.No,1,1,ck,stage2,128,moe_ck2stages_gemm2_256x128x64x64_1x4_TypeCast_v3_Nswizzle0_Quant0_MulRoutedWeight0_B16_B16_B16,128,64,64.0,256.0,1.0,4.0,3.0,643.904,0.0,0.00%,70.04,8766.03
2026-01-12 04:43:13,0,256,7168,512,256,8,ActivationType.Silu,torch.bfloat16,torch.bfloat16,torch.bfloat16,QuantType.No,1,1,ck,stage2,128,moe_ck2stages_gemm2_256x128x64x64_1x4_TypeCast_v1_Nswizzle0_Quant0_MulRoutedWeight0_B16_B16_B16,128,64,64.0,256.0,1.0,4.0,1.0,690.6835,0.0,0.00%,65.29,8172.32
2026-01-12 04:43:13,0,256,7168,512,256,8,ActivationType.Silu,torch.bfloat16,torch.bfloat16,torch.bfloat16,QuantType.No,1,1,ck,stage1,32,moe_ck2stages_gemm1_256x32x64x64_1x4_TypeCastExpertWeight_v1_Nswizzle0_Quant0_MulRoutedWeight1_silu_B16_B16_B16,32,64,64.0,256.0,1.0,4.0,1.0,958.5545,0.0,0.00%,47.05,5888.54
2026-01-12 04:43:13,0,256,7168,512,256,8,ActivationType.Silu,torch.bfloat16,torch.bfloat16,torch.bfloat16,QuantType.No,1,1,ck,stage1,32,moe_ck2stages_gemm1_256x32x64x128_1x4_TypeCastExpertWeight_v1_Nswizzle0_Quant0_MulRoutedWeight1_silu_B16_B16_B16,32,64,128.0,256.0,1.0,4.0,1.0,963.1267,0.0,0.00%,46.82,5860.58
2026-01-12 04:43:13,0,256,7168,512,256,8,ActivationType.Silu,torch.bfloat16,torch.bfloat16,torch.bfloat16,QuantType.No,1,1,ck,stage1,64,moe_ck2stages_gemm1_256x64x128x128_1x4_TypeCastExpertWeight_v3_Nswizzle0_Quant0_MulRoutedWeight1_silu_B16_B16_B16,64,128,128.0,256.0,1.0,4.0,3.0,994.6395,0.0,0.00%,45.34,5674.9
2026-01-12 04:43:13,0,256,7168,512,256,8,ActivationType.Silu,torch.bfloat16,torch.bfloat16,torch.bfloat16,QuantType.No,1,1,ck,stage1,64,moe_ck2stages_gemm1_256x64x128x64_1x4_TypeCastExpertWeight_v3_Nswizzle0_Quant0_MulRoutedWeight1_silu_B16_B16_B16,64,128,64.0,256.0,1.0,4.0,3.0,996.7665,0.0,0.00%,45.24,5662.8
2026-01-12 04:43:13,0,256,7168,512,256,8,ActivationType.Silu,torch.bfloat16,torch.bfloat16,torch.bfloat16,QuantType.No,1,1,ck,stage1,64,moe_ck2stages_gemm1_256x64x64x128_1x4_TypeCastExpertWeight_v1_Nswizzle0_Quant0_MulRoutedWeight1_silu_B16_B16_B16,64,64,128.0,256.0,1.0,4.0,1.0,1000.9365,0.0,0.00%,45.05,5639.2
2026-01-12 04:43:13,0,256,7168,512,256,8,ActivationType.Silu,torch.bfloat16,torch.bfloat16,torch.bfloat16,QuantType.No,1,1,ck,stage1,64,moe_ck2stages_gemm1_256x64x64x64_1x4_TypeCastExpertWeight_v1_Nswizzle0_Quant0_MulRoutedWeight1_silu_B16_B16_B16,64,64,64.0,256.0,1.0,4.0,1.0,1002.2771,0.0,0.00%,44.99,5631.66
2026-01-12 04:43:13,0,256,7168,512,256,8,ActivationType.Silu,torch.bfloat16,torch.bfloat16,torch.bfloat16,QuantType.No,1,1,ck,stage1,128,moe_ck2stages_gemm1_256x128x64x64_1x4_TypeCastExpertWeight_v1_Nswizzle0_Quant0_MulRoutedWeight1_silu_B16_B16_B16,128,64,64.0,256.0,1.0,4.0,1.0,1061.1184,0.0,0.00%,42.5,5319.37
2026-01-12 04:43:13,0,256,7168,512,256,8,ActivationType.Silu,torch.bfloat16,torch.bfloat16,torch.bfloat16,QuantType.No,1,1,ck,stage1,128,moe_ck2stages_gemm1_256x128x128x128_1x4_TypeCastExpertWeight_v3_Nswizzle0_Quant0_MulRoutedWeight1_silu_B16_B16_B16,128,128,128.0,256.0,1.0,4.0,3.0,1127.987,0.0,0.00%,39.98,5004.03
2026-01-12 04:43:13,0,256,7168,512,256,8,ActivationType.Silu,torch.bfloat16,torch.bfloat16,torch.bfloat16,QuantType.No,1,1,ck,stage1,128,moe_ck2stages_gemm1_256x128x128x64_1x4_TypeCastExpertWeight_v3_Nswizzle0_Quant0_MulRoutedWeight1_silu_B16_B16_B16,128,128,64.0,256.0,1.0,4.0,3.0,1137.0451,0.0,0.00%,39.66,4964.17
2026-01-12 04:43:30,1,256,7168,512,256,8,ActivationType.Gelu,torch.bfloat16,torch.bfloat16,torch.bfloat16,QuantType.No,1,1,ck,stage2,32,moe_ck2stages_gemm2_256x32x64x128_1x4_TypeCast_v1_Nswizzle0_Quant0_MulRoutedWeight0_B16_B16_B16,32,64,128.0,256.0,1.0,4.0,1.0,503.7207,0.0,0.00%,89.53,11205.58
2026-01-12 04:43:30,1,256,7168,512,256,8,ActivationType.Gelu,torch.bfloat16,torch.bfloat16,torch.bfloat16,QuantType.No,1,1,ck,stage2,32,moe_ck2stages_gemm2_256x32x64x64_1x4_TypeCast_v1_Nswizzle0_Quant0_MulRoutedWeight0_B16_B16_B16,32,64,64.0,256.0,1.0,4.0,1.0,505.4964,0.0,0.00%,89.21,11166.22
2026-01-12 04:43:30,1,256,7168,512,256,8,ActivationType.Gelu,torch.bfloat16,torch.bfloat16,torch.bfloat16,QuantType.No,1,1,ck,stage2,64,moe_ck2stages_gemm2_256x64x128x64_1x4_TypeCast_v3_Nswizzle0_Quant0_MulRoutedWeight0_B16_B16_B16,64,128,64.0,256.0,1.0,4.0,3.0,516.7075,0.0,0.00%,87.28,10923.95
2026-01-12 04:43:30,1,256,7168,512,256,8,ActivationType.Gelu,torch.bfloat16,torch.bfloat16,torch.bfloat16,QuantType.No,1,1,ck,stage2,64,moe_ck2stages_gemm2_256x64x128x128_1x4_TypeCast_v3_Nswizzle0_Quant0_MulRoutedWeight0_B16_B16_B16,64,128,128.0,256.0,1.0,4.0,3.0,518.4776,0.0,0.00%,86.98,10886.65
2026-01-12 04:43:30,1,256,7168,512,256,8,ActivationType.Gelu,torch.bfloat16,torch.bfloat16,torch.bfloat16,QuantType.No,1,1,ck,stage2,64,moe_ck2stages_gemm2_256x64x64x64_1x4_TypeCast_v1_Nswizzle0_Quant0_MulRoutedWeight0_B16_B16_B16,64,64,64.0,256.0,1.0,4.0,1.0,523.7234,0.0,0.00%,86.11,10777.61
2026-01-12 04:43:30,1,256,7168,512,256,8,ActivationType.Gelu,torch.bfloat16,torch.bfloat16,torch.bfloat16,QuantType.No,1,1,ck,stage2,64,moe_ck2stages_gemm2_256x64x64x128_1x4_TypeCast_v1_Nswizzle0_Quant0_MulRoutedWeight0_B16_B16_B16,64,64,128.0,256.0,1.0,4.0,1.0,526.3349,0.0,0.00%,85.68,10724.13
2026-01-12 04:43:30,1,256,7168,512,256,8,ActivationType.Gelu,torch.bfloat16,torch.bfloat16,torch.bfloat16,QuantType.No,1,1,ck,stage2,128,moe_ck2stages_gemm2_256x128x128x64_1x4_TypeCast_v3_Nswizzle0_Quant0_MulRoutedWeight0_B16_B16_B16,128,128,64.0,256.0,1.0,4.0,3.0,566.6141,0.0,0.00%,79.59,9961.78
2026-01-12 04:43:30,1,256,7168,512,256,8,ActivationType.Gelu,torch.bfloat16,torch.bfloat16,torch.bfloat16,QuantType.No,1,1,ck,stage2,128,moe_ck2stages_gemm2_256x128x64x64_1x4_TypeCast_v3_Nswizzle0_Quant0_MulRoutedWeight0_B16_B16_B16,128,64,64.0,256.0,1.0,4.0,3.0,647.5069,0.0,0.00%,69.65,8717.26
2026-01-12 04:43:30,1,256,7168,512,256,8,ActivationType.Gelu,torch.bfloat16,torch.bfloat16,torch.bfloat16,QuantType.No,1,1,ck,stage2,128,moe_ck2stages_gemm2_256x128x64x64_1x4_TypeCast_v1_Nswizzle0_Quant0_MulRoutedWeight0_B16_B16_B16,128,64,64.0,256.0,1.0,4.0,1.0,690.6216,0.0,0.00%,65.3,8173.05
2026-01-12 04:43:30,1,256,7168,512,256,8,ActivationType.Gelu,torch.bfloat16,torch.bfloat16,torch.bfloat16,QuantType.No,1,1,ck,stage1,32,moe_ck2stages_gemm1_256x32x64x128_1x4_TypeCastExpertWeight_v1_Nswizzle0_Quant0_MulRoutedWeight1_gelu_B16_B16_B16,32,64,128.0,256.0,1.0,4.0,1.0,955.9128,0.0,0.00%,47.18,5904.81
2026-01-12 04:43:30,1,256,7168,512,256,8,ActivationType.Gelu,torch.bfloat16,torch.bfloat16,torch.bfloat16,QuantType.No,1,1,ck,stage1,32,moe_ck2stages_gemm1_256x32x64x64_1x4_TypeCastExpertWeight_v1_Nswizzle0_Quant0_MulRoutedWeight1_gelu_B16_B16_B16,32,64,64.0,256.0,1.0,4.0,1.0,956.0891,0.0,0.00%,47.17,5903.72
2026-01-12 04:43:30,1,256,7168,512,256,8,ActivationType.Gelu,torch.bfloat16,torch.bfloat16,torch.bfloat16,QuantType.No,1,1,ck,stage1,64,moe_ck2stages_gemm1_256x64x128x64_1x4_TypeCastExpertWeight_v3_Nswizzle0_Quant0_MulRoutedWeight1_gelu_B16_B16_B16,64,128,64.0,256.0,1.0,4.0,3.0,984.1271,0.0,0.00%,45.82,5735.52
2026-01-12 04:43:30,1,256,7168,512,256,8,ActivationType.Gelu,torch.bfloat16,torch.bfloat16,torch.bfloat16,QuantType.No,1,1,ck,stage1,64,moe_ck2stages_gemm1_256x64x128x128_1x4_TypeCastExpertWeight_v3_Nswizzle0_Quant0_MulRoutedWeight1_gelu_B16_B16_B16,64,128,128.0,256.0,1.0,4.0,3.0,990.2879,0.0,0.00%,45.54,5699.84
2026-01-12 04:43:30,1,256,7168,512,256,8,ActivationType.Gelu,torch.bfloat16,torch.bfloat16,torch.bfloat16,QuantType.No,1,1,ck,stage1,64,moe_ck2stages_gemm1_256x64x64x128_1x4_TypeCastExpertWeight_v1_Nswizzle0_Quant0_MulRoutedWeight1_gelu_B16_B16_B16,64,64,128.0,256.0,1.0,4.0,1.0,999.0764,0.0,0.00%,45.14,5649.7
2026-01-12 04:43:30,1,256,7168,512,256,8,ActivationType.Gelu,torch.bfloat16,torch.bfloat16,torch.bfloat16,QuantType.No,1,1,ck,stage1,64,moe_ck2stages_gemm1_256x64x64x64_1x4_TypeCastExpertWeight_v1_Nswizzle0_Quant0_MulRoutedWeight1_gelu_B16_B16_B16,64,64,64.0,256.0,1.0,4.0,1.0,1017.5503,0.0,0.00%,44.32,5547.13
2026-01-12 04:43:30,1,256,7168,512,256,8,ActivationType.Gelu,torch.bfloat16,torch.bfloat16,torch.bfloat16,QuantType.No,1,1,ck,stage1,128,moe_ck2stages_gemm1_256x128x64x64_1x4_TypeCastExpertWeight_v1_Nswizzle0_Quant0_MulRoutedWeight1_gelu_B16_B16_B16,128,64,64.0,256.0,1.0,4.0,1.0,1066.8622,0.0,0.00%,42.27,5290.73
2026-01-12 04:43:30,1,256,7168,512,256,8,ActivationType.Gelu,torch.bfloat16,torch.bfloat16,torch.bfloat16,QuantType.No,1,1,ck,stage1,128,moe_ck2stages_gemm1_256x128x128x128_1x4_TypeCastExpertWeight_v3_Nswizzle0_Quant0_MulRoutedWeight1_gelu_B16_B16_B16,128,128,128.0,256.0,1.0,4.0,3.0,1124.3735,0.0,0.00%,40.11,5020.12
2026-01-12 04:43:30,1,256,7168,512,256,8,ActivationType.Gelu,torch.bfloat16,torch.bfloat16,torch.bfloat16,QuantType.No,1,1,ck,stage1,128,moe_ck2stages_gemm1_256x128x128x64_1x4_TypeCastExpertWeight_v3_Nswizzle0_Quant0_MulRoutedWeight1_gelu_B16_B16_B16,128,128,64.0,256.0,1.0,4.0,3.0,1127.0814,0.0,0.00%,40.01,5008.05
2026-01-12 04:43:52,2,16,7168,256,256,8,ActivationType.Silu,torch.bfloat16,torch.float8_e4m3fnuz,torch.float8_e4m3fnuz,QuantType.per_Token,1,1,ck,stage2,32,moe_ck2stages_gemm2_256x32x64x256_1x4_MulABScaleExpertWeight_v1_Nswizzle0_Quant2_MulRoutedWeight0_F8_F8_B16,32,64,256.0,256.0,1.0,4.0,1.0,60.6415,35.378333333333316,0.00%,23.24,23245.31
2026-01-12 04:43:52,2,16,7168,256,256,8,ActivationType.Silu,torch.bfloat16,torch.float8_e4m3fnuz,torch.float8_e4m3fnuz,QuantType.per_Token,1,1,ck,stage2,32,moe_ck2stages_gemm2_256x32x64x128_1x4_MulABScaleExpertWeight_v1_Nswizzle0_Quant2_MulRoutedWeight0_F8_F8_B16,32,64,128.0,256.0,1.0,4.0,1.0,64.2189,35.378333333333316,0.00%,21.95,21950.39
2026-01-12 04:43:52,2,16,7168,256,256,8,ActivationType.Silu,torch.bfloat16,torch.float8_e4m3fnuz,torch.float8_e4m3fnuz,QuantType.per_Token,1,1,ck,stage2,32,moe_ck2stages_gemm2_256x32x64x64_1x4_MulABScaleExpertWeight_v1_Nswizzle0_Quant2_MulRoutedWeight0_F8_F8_B16,32,64,64.0,256.0,1.0,4.0,1.0,73.4574,35.378333333333316,98.07%,19.19,19189.76
2026-01-12 04:43:52,2,16,7168,256,256,8,ActivationType.Silu,torch.bfloat16,torch.float8_e4m3fnuz,torch.float8_e4m3fnuz,QuantType.per_Token,1,1,ck,stage2,64,moe_ck2stages_gemm2_256x64x128x256_1x4_MulABScaleExpertWeight_v3_Nswizzle0_Quant2_MulRoutedWeight0_F8_F8_B16,64,128,256.0,256.0,1.0,4.0,3.0,79.9607,35.378333333333316,0.00%,17.62,17629.04
2026-01-12 04:43:52,2,16,7168,256,256,8,ActivationType.Silu,torch.bfloat16,torch.float8_e4m3fnuz,torch.float8_e4m3fnuz,QuantType.per_Token,1,1,ck,stage2,64,moe_ck2stages_gemm2_256x64x64x256_1x4_MulABScaleExpertWeight_v1_Nswizzle0_Quant2_MulRoutedWeight0_F8_F8_B16,64,64,256.0,256.0,1.0,4.0,1.0,92.2172,35.378333333333316,0.00%,15.28,15285.98
2026-01-12 04:43:52,2,16,7168,256,256,8,ActivationType.Silu,torch.bfloat16,torch.float8_e4m3fnuz,torch.float8_e4m3fnuz,QuantType.per_Token,1,1,asm,stage1,16,_ZN5aiter57fmoe_stage1_bf16_pertokenFp8_doweight_g1u1_16x128_4tg_pf3E,16,128,,,,,3.0,97.5006,35.378333333333316,0.00%,14.45,14457.66
2026-01-12 04:43:52,2,16,7168,256,256,8,ActivationType.Silu,torch.bfloat16,torch.float8_e4m3fnuz,torch.float8_e4m3fnuz,QuantType.per_Token,1,1,asm,stage1,16,_ZN5aiter56fmoe_stage1_bf16_pertokenFp8_doweight_g1u1_16x64_6tg_pf2E,16,64,,,,,2.0,97.7614,35.378333333333316,0.00%,14.42,14419.09
2026-01-12 04:43:52,2,16,7168,256,256,8,ActivationType.Silu,torch.bfloat16,torch.float8_e4m3fnuz,torch.float8_e4m3fnuz,QuantType.per_Token,1,1,asm,stage1,16,_ZN5aiter56fmoe_stage1_bf16_pertokenFp8_doweight_g1u1_16x64_5tg_pf3E,16,64,,,,,3.0,98.2087,35.378333333333316,0.13%,14.35,14353.41
2026-01-12 04:43:52,2,16,7168,256,256,8,ActivationType.Silu,torch.bfloat16,torch.float8_e4m3fnuz,torch.float8_e4m3fnuz,QuantType.per_Token,1,1,asm,stage1,32,_ZN5aiter57fmoe_stage1_bf16_pertokenFp8_doweight_g1u1_32x128_3tg_pf3E,32,128,,,,,3.0,98.5239,35.378333333333316,0.00%,14.3,14307.5
2026-01-12 04:43:52,2,16,7168,256,256,8,ActivationType.Silu,torch.bfloat16,torch.float8_e4m3fnuz,torch.float8_e4m3fnuz,QuantType.per_Token,1,1,asm,stage1,32,_ZN5aiter56fmoe_stage1_bf16_pertokenFp8_doweight_g1u1_32x64_4tg_pf2E,32,64,,,,,2.0,98.9768,35.378333333333316,0.00%,14.24,14242.03
2026-01-12 04:43:52,2,16,7168,256,256,8,ActivationType.Silu,torch.bfloat16,torch.float8_e4m3fnuz,torch.float8_e4m3fnuz,QuantType.per_Token,1,1,asm,stage1,32,_ZN5aiter56fmoe_stage1_bf16_pertokenFp8_doweight_g1u1_32x64_4tg_pf3E,32,64,,,,,3.0,99.1509,35.378333333333316,0.00%,14.21,14217.02
2026-01-12 04:43:52,2,16,7168,256,256,8,ActivationType.Silu,torch.bfloat16,torch.float8_e4m3fnuz,torch.float8_e4m3fnuz,QuantType.per_Token,1,1,asm,stage1,16,_ZN5aiter57fmoe_stage1_bf16_pertokenFp8_doweight_g1u1_16x256_2tg_pf3E,16,256,,,,,3.0,100.1609,35.378333333333316,0.00%,14.07,14073.66
2026-01-12 04:43:52,2,16,7168,256,256,8,ActivationType.Silu,torch.bfloat16,torch.float8_e4m3fnuz,torch.float8_e4m3fnuz,QuantType.per_Token,1,1,asm,stage1,64,_ZN5aiter56fmoe_stage1_bf16_pertokenFp8_doweight_g1u1_64x64_2tg_pf2E,64,64,,,,,2.0,101.4452,35.378333333333316,0.00%,13.89,13895.48
2026-01-12 04:43:52,2,16,7168,256,256,8,ActivationType.Silu,torch.bfloat16,torch.float8_e4m3fnuz,torch.float8_e4m3fnuz,QuantType.per_Token,1,1,asm,stage1,16,_ZN5aiter57fmoe_stage1_bf16_pertokenFp8_doweight_g1u1_16x128_4tg_pf2E,16,128,,,,,2.0,101.6485,35.378333333333316,0.00%,13.86,13867.69
2026-01-12 04:43:52,2,16,7168,256,256,8,ActivationType.Silu,torch.bfloat16,torch.float8_e4m3fnuz,torch.float8_e4m3fnuz,QuantType.per_Token,1,1,asm,stage1,32,_ZN5aiter57fmoe_stage1_bf16_pertokenFp8_doweight_g1u1_32x128_3tg_pf2E,32,128,,,,,2.0,101.7377,35.378333333333316,0.00%,13.85,13855.53
2026-01-12 04:43:52,2,16,7168,256,256,8,ActivationType.Silu,torch.bfloat16,torch.float8_e4m3fnuz,torch.float8_e4m3fnuz,QuantType.per_Token,1,1,asm,stage1,32,_ZN5aiter57fmoe_stage1_bf16_pertokenFp8_doweight_g1u1_32x256_2tg_pf3E,32,256,,,,,3.0,101.9987,35.378333333333316,0.00%,13.82,13820.08
2026-01-12 04:43:52,2,16,7168,256,256,8,ActivationType.Silu,torch.bfloat16,torch.float8_e4m3fnuz,torch.float8_e4m3fnuz,QuantType.per_Token,1,1,asm,stage1,64,_ZN5aiter57fmoe_stage1_bf16_pertokenFp8_doweight_g1u1_64x128_2tg_pf3E,64,128,,,,,3.0,102.1379,35.378333333333316,0.00%,13.8,13801.25
2026-01-12 04:43:52,2,16,7168,256,256,8,ActivationType.Silu,torch.bfloat16,torch.float8_e4m3fnuz,torch.float8_e4m3fnuz,QuantType.per_Token,1,1,asm,stage1,64,_ZN5aiter56fmoe_stage1_bf16_pertokenFp8_doweight_g1u1_64x64_2tg_pf3E,64,64,,,,,3.0,102.5364,35.378333333333316,0.00%,13.74,13747.61
2026-01-12 04:43:52,2,16,7168,256,256,8,ActivationType.Silu,torch.bfloat16,torch.float8_e4m3fnuz,torch.float8_e4m3fnuz,QuantType.per_Token,1,1,asm,stage1,64,_ZN5aiter57fmoe_stage1_bf16_pertokenFp8_doweight_g1u1_64x128_2tg_pf2E,64,128,,,,,2.0,104.0792,35.378333333333316,0.00%,13.54,13543.82
2026-01-12 04:43:52,2,16,7168,256,256,8,ActivationType.Silu,torch.bfloat16,torch.float8_e4m3fnuz,torch.float8_e4m3fnuz,QuantType.per_Token,1,1,ck,stage2,64,moe_ck2stages_gemm2_256x64x128x128_1x4_MulABScaleExpertWeight_v3_Nswizzle0_Quant2_MulRoutedWeight0_F8_F8_B16,64,128,128.0,256.0,1.0,4.0,3.0,106.4234,35.378333333333316,0.00%,13.24,13245.49
2026-01-12 04:43:52,2,16,7168,256,256,8,ActivationType.Silu,torch.bfloat16,torch.float8_e4m3fnuz,torch.float8_e4m3fnuz,QuantType.per_Token,1,1,ck,stage1,64,moe_ck2stages_gemm1_256x64x128x128_1x4_MulABScale_v3_Nswizzle0_Quant2_MulRoutedWeight1_silu_F8_F8_B16,64,128,128.0,256.0,1.0,4.0,3.0,108.6381,35.378333333333316,0.00%,12.97,12975.47
2026-01-12 04:43:52,2,16,7168,256,256,8,ActivationType.Silu,torch.bfloat16,torch.float8_e4m3fnuz,torch.float8_e4m3fnuz,QuantType.per_Token,1,1,ck,stage1,64,moe_ck2stages_gemm1_256x64x128x256_1x4_MulABScale_v3_Nswizzle0_Quant2_MulRoutedWeight1_silu_F8_F8_B16,64,128,256.0,256.0,1.0,4.0,3.0,110.6989,35.378333333333316,0.00%,12.73,12733.91
2026-01-12 04:43:52,2,16,7168,256,256,8,ActivationType.Silu,torch.bfloat16,torch.float8_e4m3fnuz,torch.float8_e4m3fnuz,QuantType.per_Token,1,1,asm,stage1,32,_ZN5aiter57fmoe_stage1_bf16_pertokenFp8_doweight_g1u1_32x256_2tg_pf2E,32,256,,,,,2.0,113.1167,35.378333333333316,0.00%,12.46,12461.73
2026-01-12 04:43:52,2,16,7168,256,256,8,ActivationType.Silu,torch.bfloat16,torch.float8_e4m3fnuz,torch.float8_e4m3fnuz,QuantType.per_Token,1,1,asm,stage1,64,_ZN5aiter53fmoe_stage1_bf16_pertokenFp8_doweight_g1u1_64x256_pf3E,64,256,,,,,3.0,113.1583,35.378333333333316,0.00%,12.45,12457.15
2026-01-12 04:43:52,2,16,7168,256,256,8,ActivationType.Silu,torch.bfloat16,torch.float8_e4m3fnuz,torch.float8_e4m3fnuz,QuantType.per_Token,1,1,asm,stage1,16,_ZN5aiter57fmoe_stage1_bf16_pertokenFp8_doweight_g1u1_16x256_3tg_pf2E,16,256,,,,,2.0,113.5723,35.378333333333316,0.00%,12.41,12411.74
2026-01-12 04:43:52,2,16,7168,256,256,8,ActivationType.Silu,torch.bfloat16,torch.float8_e4m3fnuz,torch.float8_e4m3fnuz,QuantType.per_Token,1,1,asm,stage1,128,_ZN5aiter54fmoe_stage1_bf16_pertokenFp8_doweight_g1u1_128x128_pf3E,128,128,,,,,3.0,117.4676,35.378333333333316,0.00%,12.0,12000.16
2026-01-12 04:43:52,2,16,7168,256,256,8,ActivationType.Silu,torch.bfloat16,torch.float8_e4m3fnuz,torch.float8_e4m3fnuz,QuantType.per_Token,1,1,asm,stage1,128,_ZN5aiter54fmoe_stage1_bf16_pertokenFp8_doweight_g1u1_128x128_pf2E,128,128,,,,,2.0,120.3938,35.378333333333316,0.00%,11.71,11708.5
2026-01-12 04:43:52,2,16,7168,256,256,8,ActivationType.Silu,torch.bfloat16,torch.float8_e4m3fnuz,torch.float8_e4m3fnuz,QuantType.per_Token,1,1,ck,stage2,64,moe_ck2stages_gemm2_256x64x64x64_1x4_MulABScaleExpertWeight_v1_Nswizzle0_Quant2_MulRoutedWeight0_F8_F8_B16,64,64,64.0,256.0,1.0,4.0,1.0,121.8988,35.378333333333316,98.07%,11.56,11563.94
2026-01-12 04:43:52,2,16,7168,256,256,8,ActivationType.Silu,torch.bfloat16,torch.float8_e4m3fnuz,torch.float8_e4m3fnuz,QuantType.per_Token,1,1,ck,stage1,32,moe_ck2stages_gemm1_256x32x64x128_1x4_MulABScale_v1_Nswizzle0_Quant2_MulRoutedWeight1_silu_F8_F8_B16,32,64,128.0,256.0,1.0,4.0,1.0,126.4432,35.378333333333316,16.93%,11.15,11148.33
2026-01-12 04:43:52,2,16,7168,256,256,8,ActivationType.Silu,torch.bfloat16,torch.float8_e4m3fnuz,torch.float8_e4m3fnuz,QuantType.per_Token,1,1,asm,stage1,64,_ZN5aiter53fmoe_stage1_bf16_pertokenFp8_doweight_g1u1_64x256_pf2E,64,256,,,,,2.0,126.8827,35.378333333333316,0.00%,11.11,11109.71
2026-01-12 04:43:52,2,16,7168,256,256,8,ActivationType.Silu,torch.bfloat16,torch.float8_e4m3fnuz,torch.float8_e4m3fnuz,QuantType.per_Token,1,1,ck,stage1,128,moe_ck2stages_gemm1_256x128x128x128_1x4_MulABScale_v3_Nswizzle0_Quant2_MulRoutedWeight1_silu_F8_F8_B16,128,128,128.0,256.0,1.0,4.0,3.0,136.8773,35.378333333333316,0.00%,10.3,10298.5
2026-01-12 04:43:52,2,16,7168,256,256,8,ActivationType.Silu,torch.bfloat16,torch.float8_e4m3fnuz,torch.float8_e4m3fnuz,QuantType.per_Token,1,1,ck,stage2,64,moe_ck2stages_gemm2_256x64x128x64_1x4_MulABScaleExpertWeight_v3_Nswizzle0_Quant2_MulRoutedWeight0_F8_F8_B16,64,128,64.0,256.0,1.0,4.0,3.0,138.1384,35.378333333333316,98.07%,10.2,10204.48
2026-01-12 04:43:52,2,16,7168,256,256,8,ActivationType.Silu,torch.bfloat16,torch.float8_e4m3fnuz,torch.float8_e4m3fnuz,QuantType.per_Token,1,1,ck,stage1,128,moe_ck2stages_gemm1_256x128x128x256_1x4_MulABScale_v3_Nswizzle0_Quant2_MulRoutedWeight1_silu_F8_F8_B16,128,128,256.0,256.0,1.0,4.0,3.0,138.5516,35.378333333333316,0.00%,10.17,10174.04
2026-01-12 04:43:52,2,16,7168,256,256,8,ActivationType.Silu,torch.bfloat16,torch.float8_e4m3fnuz,torch.float8_e4m3fnuz,QuantType.per_Token,1,1,ck,stage2,128,moe_ck2stages_gemm2_256x128x64x128_1x4_MulABScaleExpertWeight_v1_Nswizzle0_Quant2_MulRoutedWeight0_F8_F8_B16,128,64,128.0,256.0,1.0,4.0,1.0,141.8621,35.378333333333316,0.00%,9.93,9936.62
2026-01-12 04:43:52,2,16,7168,256,256,8,ActivationType.Silu,torch.bfloat16,torch.float8_e4m3fnuz,torch.float8_e4m3fnuz,QuantType.per_Token,1,1,asm,stage1,128,_ZN5aiter53fmoe_stage1_bf16_pertokenFp8_doweight_g1u1_128x64_pf3E,128,64,,,,,3.0,144.1662,35.378333333333316,0.00%,9.78,9777.81
2026-01-12 04:43:52,2,16,7168,256,256,8,ActivationType.Silu,torch.bfloat16,torch.float8_e4m3fnuz,torch.float8_e4m3fnuz,QuantType.per_Token,1,1,ck,stage2,128,moe_ck2stages_gemm2_256x128x128x128_1x4_MulABScaleExpertWeight_v3_Nswizzle0_Quant2_MulRoutedWeight0_F8_F8_B16,128,128,128.0,256.0,1.0,4.0,3.0,154.2897,35.378333333333316,0.00%,9.13,9136.26
2026-01-12 04:43:52,2,16,7168,256,256,8,ActivationType.Silu,torch.bfloat16,torch.float8_e4m3fnuz,torch.float8_e4m3fnuz,QuantType.per_Token,1,1,asm,stage1,128,_ZN5aiter53fmoe_stage1_bf16_pertokenFp8_doweight_g1u1_128x64_pf2E,128,64,,,,,2.0,164.9325,35.378333333333316,0.00%,8.54,8546.71
2026-01-12 04:43:52,2,16,7168,256,256,8,ActivationType.Silu,torch.bfloat16,torch.float8_e4m3fnuz,torch.float8_e4m3fnuz,QuantType.per_Token,1,1,asm,asm_1stage,32,_ZN5aiter50fmoe_bf16_pertokenFp8_g1u1_vs_tkw1_silu_1tg_32x128E,32,128,,,,,,170.5573,0.0,0.00%,8.26,8264.85
2026-01-12 04:43:52,2,16,7168,256,256,8,ActivationType.Silu,torch.bfloat16,torch.float8_e4m3fnuz,torch.float8_e4m3fnuz,QuantType.per_Token,1,1,ck,stage1,64,moe_ck2stages_gemm1_256x64x64x128_1x4_MulABScale_v1_Nswizzle0_Quant2_MulRoutedWeight1_silu_F8_F8_B16,64,64,128.0,256.0,1.0,4.0,1.0,170.8443,35.378333333333316,16.93%,8.25,8250.96
2026-01-12 04:43:52,2,16,7168,256,256,8,ActivationType.Silu,torch.bfloat16,torch.float8_e4m3fnuz,torch.float8_e4m3fnuz,QuantType.per_Token,1,1,asm,asm_1stage,32,_ZN5aiter53fmoe_bf16_pertokenFp8_g1u1_vs_tkw1_silu_1tg_ps_32x128E,32,128,,,,,,171.6947,0.0,0.00%,8.21,8210.1
2026-01-12 04:43:52,2,16,7168,256,256,8,ActivationType.Silu,torch.bfloat16,torch.float8_e4m3fnuz,torch.float8_e4m3fnuz,QuantType.per_Token,1,1,asm,asm_1stage,32,_ZN5aiter50fmoe_bf16_pertokenFp8_g1u1_vs_tkw1_silu_1tg_32x256E,32,256,,,,,,185.1236,0.0,0.00%,7.61,7614.54
2026-01-12 04:43:52,2,16,7168,256,256,8,ActivationType.Silu,torch.bfloat16,torch.float8_e4m3fnuz,torch.float8_e4m3fnuz,QuantType.per_Token,1,1,asm,asm_1stage,32,_ZN5aiter53fmoe_bf16_pertokenFp8_g1u1_vs_tkw1_silu_1tg_ps_32x256E,32,256,,,,,,186.2302,0.0,0.00%,7.57,7569.29
2026-01-12 04:43:52,2,16,7168,256,256,8,ActivationType.Silu,torch.bfloat16,torch.float8_e4m3fnuz,torch.float8_e4m3fnuz,QuantType.per_Token,1,1,ck,stage2,128,moe_ck2stages_gemm2_256x128x64x64_1x4_MulABScaleExpertWeight_v3_Nswizzle0_Quant2_MulRoutedWeight0_F8_F8_B16,128,64,64.0,256.0,1.0,4.0,3.0,200.2162,35.378333333333316,98.07%,7.04,7040.54
2026-01-12 04:43:52,2,16,7168,256,256,8,ActivationType.Silu,torch.bfloat16,torch.float8_e4m3fnuz,torch.float8_e4m3fnuz,QuantType.per_Token,1,1,ck,stage2,128,moe_ck2stages_gemm2_256x128x128x64_1x4_MulABScaleExpertWeight_v3_Nswizzle0_Quant2_MulRoutedWeight0_F8_F8_B16,128,128,64.0,256.0,1.0,4.0,3.0,203.9353,35.378333333333316,98.07%,6.91,6912.14
2026-01-12 04:43:52,2,16,7168,256,256,8,ActivationType.Silu,torch.bfloat16,torch.float8_e4m3fnuz,torch.float8_e4m3fnuz,QuantType.per_Token,1,1,ck,stage1,32,moe_ck2stages_gemm1_256x32x64x256_1x4_MulABScale_v1_Nswizzle0_Quant2_MulRoutedWeight1_silu_F8_F8_B16,32,64,256.0,256.0,1.0,4.0,1.0,287.3184,35.378333333333316,16.93%,4.9,4906.16
2026-01-12 04:43:52,2,16,7168,256,256,8,ActivationType.Silu,torch.bfloat16,torch.float8_e4m3fnuz,torch.float8_e4m3fnuz,QuantType.per_Token,1,1,ck,stage1,64,moe_ck2stages_gemm1_256x64x64x256_1x4_MulABScale_v1_Nswizzle0_Quant2_MulRoutedWeight1_silu_F8_F8_B16,64,64,256.0,256.0,1.0,4.0,1.0,1064.994,35.378333333333316,16.93%,1.32,1323.6
2026-01-12 04:43:52,2,16,7168,256,256,8,ActivationType.Silu,torch.bfloat16,torch.float8_e4m3fnuz,torch.float8_e4m3fnuz,QuantType.per_Token,1,1,ck,stage1,128,moe_ck2stages_gemm1_256x128x64x128_1x4_MulABScale_v1_Nswizzle0_Quant2_MulRoutedWeight1_silu_F8_F8_B16,128,64,128.0,256.0,1.0,4.0,1.0,1429.9721,35.378333333333316,16.93%,0.99,985.77
2026-01-12 04:43:52,2,16,7168,256,256,8,ActivationType.Silu,torch.bfloat16,torch.float8_e4m3fnuz,torch.float8_e4m3fnuz,QuantType.per_Token,1,1,asm,stage1,16,_ZN5aiter57fmoe_stage1_bf16_pertokenFp8_doweight_g1u1_16x512_2tg_pf2E,16,512,,,,,2.0,inf,35.378333333333316,failed,0.0,0.0
2026-01-12 04:43:52,2,16,7168,256,256,8,ActivationType.Silu,torch.bfloat16,torch.float8_e4m3fnuz,torch.float8_e4m3fnuz,QuantType.per_Token,1,1,asm,stage1,16,_ZN5aiter53fmoe_stage1_bf16_pertokenFp8_doweight_g1u1_16x512_pf3E,16,512,,,,,3.0,inf,35.378333333333316,failed,0.0,0.0
2026-01-12 04:43:52,2,16,7168,256,256,8,ActivationType.Silu,torch.bfloat16,torch.float8_e4m3fnuz,torch.float8_e4m3fnuz,QuantType.per_Token,1,1,asm,stage1,32,_ZN5aiter53fmoe_stage1_bf16_pertokenFp8_doweight_g1u1_32x512_pf2E,32,512,,,,,2.0,inf,35.378333333333316,failed,0.0,0.0
2026-01-12 04:43:52,2,16,7168,256,256,8,ActivationType.Silu,torch.bfloat16,torch.float8_e4m3fnuz,torch.float8_e4m3fnuz,QuantType.per_Token,1,1,asm,stage1,32,_ZN5aiter53fmoe_stage1_bf16_pertokenFp8_doweight_g1u1_32x512_pf3E,32,512,,,,,3.0,inf,35.378333333333316,failed,0.0,0.0
2026-01-12 04:44:12,3,16,7168,256,256,8,ActivationType.Gelu,torch.bfloat16,torch.float8_e4m3fnuz,torch.float8_e4m3fnuz,QuantType.per_Token,1,1,ck,stage2,32,moe_ck2stages_gemm2_256x32x64x256_1x4_MulABScaleExpertWeight_v1_Nswizzle0_Quant2_MulRoutedWeight0_F8_F8_B16,32,64,256.0,256.0,1.0,4.0,1.0,60.8897,35.80555555555553,0.00%,23.14,23150.55
2026-01-12 04:44:12,3,16,7168,256,256,8,ActivationType.Gelu,torch.bfloat16,torch.float8_e4m3fnuz,torch.float8_e4m3fnuz,QuantType.per_Token,1,1,ck,stage2,32,moe_ck2stages_gemm2_256x32x64x128_1x4_MulABScaleExpertWeight_v1_Nswizzle0_Quant2_MulRoutedWeight0_F8_F8_B16,32,64,128.0,256.0,1.0,4.0,1.0,64.0563,35.80555555555553,0.00%,22.0,22006.11
2026-01-12 04:44:12,3,16,7168,256,256,8,ActivationType.Gelu,torch.bfloat16,torch.float8_e4m3fnuz,torch.float8_e4m3fnuz,QuantType.per_Token,1,1,ck,stage2,32,moe_ck2stages_gemm2_256x32x64x64_1x4_MulABScaleExpertWeight_v1_Nswizzle0_Quant2_MulRoutedWeight0_F8_F8_B16,32,64,64.0,256.0,1.0,4.0,1.0,73.6731,35.80555555555553,98.04%,19.13,19133.58
2026-01-12 04:44:12,3,16,7168,256,256,8,ActivationType.Gelu,torch.bfloat16,torch.float8_e4m3fnuz,torch.float8_e4m3fnuz,QuantType.per_Token,1,1,ck,stage2,64,moe_ck2stages_gemm2_256x64x128x256_1x4_MulABScaleExpertWeight_v3_Nswizzle0_Quant2_MulRoutedWeight0_F8_F8_B16,64,128,256.0,256.0,1.0,4.0,3.0,80.8202,35.80555555555553,0.00%,17.44,17441.56
2026-01-12 04:44:12,3,16,7168,256,256,8,ActivationType.Gelu,torch.bfloat16,torch.float8_e4m3fnuz,torch.float8_e4m3fnuz,QuantType.per_Token,1,1,ck,stage2,64,moe_ck2stages_gemm2_256x64x64x256_1x4_MulABScaleExpertWeight_v1_Nswizzle0_Quant2_MulRoutedWeight0_F8_F8_B16,64,64,256.0,256.0,1.0,4.0,1.0,92.9601,35.80555555555553,0.00%,15.16,15163.82
2026-01-12 04:44:12,3,16,7168,256,256,8,ActivationType.Gelu,torch.bfloat16,torch.float8_e4m3fnuz,torch.float8_e4m3fnuz,QuantType.per_Token,1,1,asm,stage1,16,_ZN5aiter57fmoe_stage1_bf16_pertokenFp8_doweight_g1u1_16x128_4tg_pf3E,16,128,,,,,3.0,97.5006,35.80555555555553,0.00%,14.45,14457.66
2026-01-12 04:44:12,3,16,7168,256,256,8,ActivationType.Gelu,torch.bfloat16,torch.float8_e4m3fnuz,torch.float8_e4m3fnuz,QuantType.per_Token,1,1,asm,stage1,16,_ZN5aiter56fmoe_stage1_bf16_pertokenFp8_doweight_g1u1_16x64_6tg_pf2E,16,64,,,,,2.0,97.8831,35.80555555555553,0.00%,14.4,14401.16
2026-01-12 04:44:12,3,16,7168,256,256,8,ActivationType.Gelu,torch.bfloat16,torch.float8_e4m3fnuz,torch.float8_e4m3fnuz,QuantType.per_Token,1,1,asm,stage1,16,_ZN5aiter56fmoe_stage1_bf16_pertokenFp8_doweight_g1u1_16x64_5tg_pf3E,16,64,,,,,3.0,98.3417,35.80555555555553,0.10%,14.33,14334.0
2026-01-12 04:44:12,3,16,7168,256,256,8,ActivationType.Gelu,torch.bfloat16,torch.float8_e4m3fnuz,torch.float8_e4m3fnuz,QuantType.per_Token,1,1,asm,stage1,32,_ZN5aiter57fmoe_stage1_bf16_pertokenFp8_doweight_g1u1_32x128_3tg_pf3E,32,128,,,,,3.0,98.6399,35.80555555555553,0.00%,14.29,14290.67
2026-01-12 04:44:12,3,16,7168,256,256,8,ActivationType.Gelu,torch.bfloat16,torch.float8_e4m3fnuz,torch.float8_e4m3fnuz,QuantType.per_Token,1,1,asm,stage1,32,_ZN5aiter56fmoe_stage1_bf16_pertokenFp8_doweight_g1u1_32x64_4tg_pf2E,32,64,,,,,2.0,99.179,35.80555555555553,0.00%,14.21,14212.99
2026-01-12 04:44:12,3,16,7168,256,256,8,ActivationType.Gelu,torch.bfloat16,torch.float8_e4m3fnuz,torch.float8_e4m3fnuz,QuantType.per_Token,1,1,asm,stage1,32,_ZN5aiter56fmoe_stage1_bf16_pertokenFp8_doweight_g1u1_32x64_4tg_pf3E,32,64,,,,,3.0,99.1882,35.80555555555553,0.00%,14.21,14211.67
2026-01-12 04:44:12,3,16,7168,256,256,8,ActivationType.Gelu,torch.bfloat16,torch.float8_e4m3fnuz,torch.float8_e4m3fnuz,QuantType.per_Token,1,1,asm,stage1,16,_ZN5aiter57fmoe_stage1_bf16_pertokenFp8_doweight_g1u1_16x256_2tg_pf3E,16,256,,,,,3.0,100.0889,35.80555555555553,0.00%,14.08,14083.78
2026-01-12 04:44:12,3,16,7168,256,256,8,ActivationType.Gelu,torch.bfloat16,torch.float8_e4m3fnuz,torch.float8_e4m3fnuz,QuantType.per_Token,1,1,asm,stage1,16,_ZN5aiter57fmoe_stage1_bf16_pertokenFp8_doweight_g1u1_16x128_4tg_pf2E,16,128,,,,,2.0,101.6833,35.80555555555553,0.00%,13.86,13862.95
2026-01-12 04:44:12,3,16,7168,256,256,8,ActivationType.Gelu,torch.bfloat16,torch.float8_e4m3fnuz,torch.float8_e4m3fnuz,QuantType.per_Token,1,1,asm,stage1,64,_ZN5aiter56fmoe_stage1_bf16_pertokenFp8_doweight_g1u1_64x64_2tg_pf2E,64,64,,,,,2.0,101.7678,35.80555555555553,0.00%,13.85,13851.44
2026-01-12 04:44:12,3,16,7168,256,256,8,ActivationType.Gelu,torch.bfloat16,torch.float8_e4m3fnuz,torch.float8_e4m3fnuz,QuantType.per_Token,1,1,asm,stage1,32,_ZN5aiter57fmoe_stage1_bf16_pertokenFp8_doweight_g1u1_32x128_3tg_pf2E,32,128,,,,,2.0,101.8644,35.80555555555553,0.00%,13.83,13838.3
2026-01-12 04:44:12,3,16,7168,256,256,8,ActivationType.Gelu,torch.bfloat16,torch.float8_e4m3fnuz,torch.float8_e4m3fnuz,QuantType.per_Token,1,1,asm,stage1,32,_ZN5aiter57fmoe_stage1_bf16_pertokenFp8_doweight_g1u1_32x256_2tg_pf3E,32,256,,,,,3.0,102.0816,35.80555555555553,0.00%,13.81,13808.86
2026-01-12 04:44:12,3,16,7168,256,256,8,ActivationType.Gelu,torch.bfloat16,torch.float8_e4m3fnuz,torch.float8_e4m3fnuz,QuantType.per_Token,1,1,asm,stage1,64,_ZN5aiter57fmoe_stage1_bf16_pertokenFp8_doweight_g1u1_64x128_2tg_pf3E,64,128,,,,,3.0,102.1642,35.80555555555553,0.00%,13.79,13797.69
2026-01-12 04:44:12,3,16,7168,256,256,8,ActivationType.Gelu,torch.bfloat16,torch.float8_e4m3fnuz,torch.float8_e4m3fnuz,QuantType.per_Token,1,1,asm,stage1,64,_ZN5aiter56fmoe_stage1_bf16_pertokenFp8_doweight_g1u1_64x64_2tg_pf3E,64,64,,,,,3.0,103.073,35.80555555555553,0.00%,13.67,13676.04
2026-01-12 04:44:12,3,16,7168,256,256,8,ActivationType.Gelu,torch.bfloat16,torch.float8_e4m3fnuz,torch.float8_e4m3fnuz,QuantType.per_Token,1,1,asm,stage1,64,_ZN5aiter57fmoe_stage1_bf16_pertokenFp8_doweight_g1u1_64x128_2tg_pf2E,64,128,,,,,2.0,104.3125,35.80555555555553,0.00%,13.51,13513.53
2026-01-12 04:44:12,3,16,7168,256,256,8,ActivationType.Gelu,torch.bfloat16,torch.float8_e4m3fnuz,torch.float8_e4m3fnuz,QuantType.per_Token,1,1,ck,stage2,64,moe_ck2stages_gemm2_256x64x128x128_1x4_MulABScaleExpertWeight_v3_Nswizzle0_Quant2_MulRoutedWeight0_F8_F8_B16,64,128,128.0,256.0,1.0,4.0,3.0,107.1221,35.80555555555553,0.00%,13.16,13159.1
2026-01-12 04:44:12,3,16,7168,256,256,8,ActivationType.Gelu,torch.bfloat16,torch.float8_e4m3fnuz,torch.float8_e4m3fnuz,QuantType.per_Token,1,1,ck,stage1,64,moe_ck2stages_gemm1_256x64x128x128_1x4_MulABScale_v3_Nswizzle0_Quant2_MulRoutedWeight1_gelu_F8_F8_B16,64,128,128.0,256.0,1.0,4.0,3.0,107.655,35.80555555555553,0.00%,13.09,13093.96
2026-01-12 04:44:12,3,16,7168,256,256,8,ActivationType.Gelu,torch.bfloat16,torch.float8_e4m3fnuz,torch.float8_e4m3fnuz,QuantType.per_Token,1,1,ck,stage1,64,moe_ck2stages_gemm1_256x64x128x256_1x4_MulABScale_v3_Nswizzle0_Quant2_MulRoutedWeight1_gelu_F8_F8_B16,64,128,256.0,256.0,1.0,4.0,3.0,109.5512,35.80555555555553,0.00%,12.86,12867.32
2026-01-12 04:44:12,3,16,7168,256,256,8,ActivationType.Gelu,torch.bfloat16,torch.float8_e4m3fnuz,torch.float8_e4m3fnuz,QuantType.per_Token,1,1,asm,stage1,64,_ZN5aiter53fmoe_stage1_bf16_pertokenFp8_doweight_g1u1_64x256_pf3E,64,256,,,,,3.0,113.3015,35.80555555555553,0.00%,12.44,12441.41
2026-01-12 04:44:12,3,16,7168,256,256,8,ActivationType.Gelu,torch.bfloat16,torch.float8_e4m3fnuz,torch.float8_e4m3fnuz,QuantType.per_Token,1,1,asm,stage1,32,_ZN5aiter57fmoe_stage1_bf16_pertokenFp8_doweight_g1u1_32x256_2tg_pf2E,32,256,,,,,2.0,113.3166,35.80555555555553,0.00%,12.44,12439.75
2026-01-12 04:44:12,3,16,7168,256,256,8,ActivationType.Gelu,torch.bfloat16,torch.float8_e4m3fnuz,torch.float8_e4m3fnuz,QuantType.per_Token,1,1,asm,stage1,16,_ZN5aiter57fmoe_stage1_bf16_pertokenFp8_doweight_g1u1_16x256_3tg_pf2E,16,256,,,,,2.0,113.7862,35.80555555555553,0.00%,12.39,12388.41
2026-01-12 04:44:12,3,16,7168,256,256,8,ActivationType.Gelu,torch.bfloat16,torch.float8_e4m3fnuz,torch.float8_e4m3fnuz,QuantType.per_Token,1,1,asm,stage1,128,_ZN5aiter54fmoe_stage1_bf16_pertokenFp8_doweight_g1u1_128x128_pf3E,128,128,,,,,3.0,117.5642,35.80555555555553,0.00%,11.99,11990.3
2026-01-12 04:44:12,3,16,7168,256,256,8,ActivationType.Gelu,torch.bfloat16,torch.float8_e4m3fnuz,torch.float8_e4m3fnuz,QuantType.per_Token,1,1,asm,stage1,128,_ZN5aiter54fmoe_stage1_bf16_pertokenFp8_doweight_g1u1_128x128_pf2E,128,128,,,,,2.0,120.5109,35.80555555555553,0.00%,11.69,11697.12
2026-01-12 04:44:12,3,16,7168,256,256,8,ActivationType.Gelu,torch.bfloat16,torch.float8_e4m3fnuz,torch.float8_e4m3fnuz,QuantType.per_Token,1,1,ck,stage2,64,moe_ck2stages_gemm2_256x64x64x64_1x4_MulABScaleExpertWeight_v1_Nswizzle0_Quant2_MulRoutedWeight0_F8_F8_B16,64,64,64.0,256.0,1.0,4.0,1.0,122.0836,35.80555555555553,98.04%,11.54,11546.43
2026-01-12 04:44:12,3,16,7168,256,256,8,ActivationType.Gelu,torch.bfloat16,torch.float8_e4m3fnuz,torch.float8_e4m3fnuz,QuantType.per_Token,1,1,ck,stage1,32,moe_ck2stages_gemm1_256x32x64x128_1x4_MulABScale_v1_Nswizzle0_Quant2_MulRoutedWeight1_gelu_F8_F8_B16,32,64,128.0,256.0,1.0,4.0,1.0,125.9318,35.80555555555553,16.87%,11.19,11193.6
2026-01-12 04:44:12,3,16,7168,256,256,8,ActivationType.Gelu,torch.bfloat16,torch.float8_e4m3fnuz,torch.float8_e4m3fnuz,QuantType.per_Token,1,1,asm,stage1,64,_ZN5aiter53fmoe_stage1_bf16_pertokenFp8_doweight_g1u1_64x256_pf2E,64,256,,,,,2.0,127.5812,35.80555555555553,0.00%,11.05,11048.89
2026-01-12 04:44:12,3,16,7168,256,256,8,ActivationType.Gelu,torch.bfloat16,torch.float8_e4m3fnuz,torch.float8_e4m3fnuz,QuantType.per_Token,1,1,ck,stage1,128,moe_ck2stages_gemm1_256x128x128x128_1x4_MulABScale_v3_Nswizzle0_Quant2_MulRoutedWeight1_gelu_F8_F8_B16,128,128,128.0,256.0,1.0,4.0,3.0,135.9593,35.80555555555553,0.00%,10.37,10368.03
2026-01-12 04:44:12,3,16,7168,256,256,8,ActivationType.Gelu,torch.bfloat16,torch.float8_e4m3fnuz,torch.float8_e4m3fnuz,QuantType.per_Token,1,1,ck,stage1,128,moe_ck2stages_gemm1_256x128x128x256_1x4_MulABScale_v3_Nswizzle0_Quant2_MulRoutedWeight1_gelu_F8_F8_B16,128,128,256.0,256.0,1.0,4.0,3.0,136.7977,35.80555555555553,0.00%,10.3,10304.49
2026-01-12 04:44:12,3,16,7168,256,256,8,ActivationType.Gelu,torch.bfloat16,torch.float8_e4m3fnuz,torch.float8_e4m3fnuz,QuantType.per_Token,1,1,ck,stage2,64,moe_ck2stages_gemm2_256x64x128x64_1x4_MulABScaleExpertWeight_v3_Nswizzle0_Quant2_MulRoutedWeight0_F8_F8_B16,64,128,64.0,256.0,1.0,4.0,3.0,138.3519,35.80555555555553,98.05%,10.19,10188.73
2026-01-12 04:44:12,3,16,7168,256,256,8,ActivationType.Gelu,torch.bfloat16,torch.float8_e4m3fnuz,torch.float8_e4m3fnuz,QuantType.per_Token,1,1,ck,stage2,128,moe_ck2stages_gemm2_256x128x64x128_1x4_MulABScaleExpertWeight_v1_Nswizzle0_Quant2_MulRoutedWeight0_F8_F8_B16,128,64,128.0,256.0,1.0,4.0,1.0,142.1061,35.80555555555553,0.00%,9.92,9919.56
2026-01-12 04:44:12,3,16,7168,256,256,8,ActivationType.Gelu,torch.bfloat16,torch.float8_e4m3fnuz,torch.float8_e4m3fnuz,QuantType.per_Token,1,1,asm,stage1,128,_ZN5aiter53fmoe_stage1_bf16_pertokenFp8_doweight_g1u1_128x64_pf3E,128,64,,,,,3.0,144.513,35.80555555555553,0.00%,9.75,9754.35
2026-01-12 04:44:12,3,16,7168,256,256,8,ActivationType.Gelu,torch.bfloat16,torch.float8_e4m3fnuz,torch.float8_e4m3fnuz,QuantType.per_Token,1,1,ck,stage2,128,moe_ck2stages_gemm2_256x128x128x128_1x4_MulABScaleExpertWeight_v3_Nswizzle0_Quant2_MulRoutedWeight0_F8_F8_B16,128,128,128.0,256.0,1.0,4.0,3.0,154.3228,35.80555555555553,0.00%,9.13,9134.3
2026-01-12 04:44:12,3,16,7168,256,256,8,ActivationType.Gelu,torch.bfloat16,torch.float8_e4m3fnuz,torch.float8_e4m3fnuz,QuantType.per_Token,1,1,asm,stage1,128,_ZN5aiter53fmoe_stage1_bf16_pertokenFp8_doweight_g1u1_128x64_pf2E,128,64,,,,,2.0,165.5342,35.80555555555553,0.00%,8.51,8515.64
2026-01-12 04:44:12,3,16,7168,256,256,8,ActivationType.Gelu,torch.bfloat16,torch.float8_e4m3fnuz,torch.float8_e4m3fnuz,QuantType.per_Token,1,1,ck,stage1,64,moe_ck2stages_gemm1_256x64x64x128_1x4_MulABScale_v1_Nswizzle0_Quant2_MulRoutedWeight1_gelu_F8_F8_B16,64,64,128.0,256.0,1.0,4.0,1.0,169.1795,35.80555555555553,16.87%,8.33,8332.16
2026-01-12 04:44:12,3,16,7168,256,256,8,ActivationType.Gelu,torch.bfloat16,torch.float8_e4m3fnuz,torch.float8_e4m3fnuz,QuantType.per_Token,1,1,asm,asm_1stage,32,_ZN5aiter50fmoe_bf16_pertokenFp8_g1u1_vs_tkw1_gelu_1tg_32x128E,32,128,,,,,,171.0492,0.0,0.00%,8.24,8241.08
2026-01-12 04:44:12,3,16,7168,256,256,8,ActivationType.Gelu,torch.bfloat16,torch.float8_e4m3fnuz,torch.float8_e4m3fnuz,QuantType.per_Token,1,1,asm,asm_1stage,32,_ZN5aiter53fmoe_bf16_pertokenFp8_g1u1_vs_tkw1_gelu_1tg_ps_32x128E,32,128,,,,,,171.649,0.0,0.00%,8.21,8212.28
2026-01-12 04:44:12,3,16,7168,256,256,8,ActivationType.Gelu,torch.bfloat16,torch.float8_e4m3fnuz,torch.float8_e4m3fnuz,QuantType.per_Token,1,1,asm,asm_1stage,32,_ZN5aiter50fmoe_bf16_pertokenFp8_g1u1_vs_tkw1_gelu_1tg_32x256E,32,256,,,,,,184.9049,0.0,0.00%,7.62,7623.54
2026-01-12 04:44:12,3,16,7168,256,256,8,ActivationType.Gelu,torch.bfloat16,torch.float8_e4m3fnuz,torch.float8_e4m3fnuz,QuantType.per_Token,1,1,asm,asm_1stage,32,_ZN5aiter53fmoe_bf16_pertokenFp8_g1u1_vs_tkw1_gelu_1tg_ps_32x256E,32,256,,,,,,186.265,0.0,0.00%,7.57,7567.87
2026-01-12 04:44:12,3,16,7168,256,256,8,ActivationType.Gelu,torch.bfloat16,torch.float8_e4m3fnuz,torch.float8_e4m3fnuz,QuantType.per_Token,1,1,ck,stage2,128,moe_ck2stages_gemm2_256x128x64x64_1x4_MulABScaleExpertWeight_v3_Nswizzle0_Quant2_MulRoutedWeight0_F8_F8_B16,128,64,64.0,256.0,1.0,4.0,3.0,200.5136,35.80555555555553,98.04%,7.03,7030.1
2026-01-12 04:44:12,3,16,7168,256,256,8,ActivationType.Gelu,torch.bfloat16,torch.float8_e4m3fnuz,torch.float8_e4m3fnuz,QuantType.per_Token,1,1,ck,stage2,128,moe_ck2stages_gemm2_256x128x128x64_1x4_MulABScaleExpertWeight_v3_Nswizzle0_Quant2_MulRoutedWeight0_F8_F8_B16,128,128,64.0,256.0,1.0,4.0,3.0,204.152,35.80555555555553,98.04%,6.9,6904.81
2026-01-12 04:44:12,3,16,7168,256,256,8,ActivationType.Gelu,torch.bfloat16,torch.float8_e4m3fnuz,torch.float8_e4m3fnuz,QuantType.per_Token,1,1,ck,stage1,32,moe_ck2stages_gemm1_256x32x64x256_1x4_MulABScale_v1_Nswizzle0_Quant2_MulRoutedWeight1_gelu_F8_F8_B16,32,64,256.0,256.0,1.0,4.0,1.0,282.2035,35.80555555555553,16.87%,4.99,4995.08
2026-01-12 04:44:12,3,16,7168,256,256,8,ActivationType.Gelu,torch.bfloat16,torch.float8_e4m3fnuz,torch.float8_e4m3fnuz,QuantType.per_Token,1,1,ck,stage1,64,moe_ck2stages_gemm1_256x64x64x256_1x4_MulABScale_v1_Nswizzle0_Quant2_MulRoutedWeight1_gelu_F8_F8_B16,64,64,256.0,256.0,1.0,4.0,1.0,1057.307,35.80555555555553,16.87%,1.33,1333.23
2026-01-12 04:44:12,3,16,7168,256,256,8,ActivationType.Gelu,torch.bfloat16,torch.float8_e4m3fnuz,torch.float8_e4m3fnuz,QuantType.per_Token,1,1,ck,stage1,128,moe_ck2stages_gemm1_256x128x64x128_1x4_MulABScale_v1_Nswizzle0_Quant2_MulRoutedWeight1_gelu_F8_F8_B16,128,64,128.0,256.0,1.0,4.0,1.0,1422.6975,35.80555555555553,16.87%,0.99,990.82
2026-01-12 04:44:12,3,16,7168,256,256,8,ActivationType.Gelu,torch.bfloat16,torch.float8_e4m3fnuz,torch.float8_e4m3fnuz,QuantType.per_Token,1,1,asm,stage1,16,_ZN5aiter57fmoe_stage1_bf16_pertokenFp8_doweight_g1u1_16x512_2tg_pf2E,16,512,,,,,2.0,inf,35.80555555555553,failed,0.0,0.0
2026-01-12 04:44:12,3,16,7168,256,256,8,ActivationType.Gelu,torch.bfloat16,torch.float8_e4m3fnuz,torch.float8_e4m3fnuz,QuantType.per_Token,1,1,asm,stage1,16,_ZN5aiter53fmoe_stage1_bf16_pertokenFp8_doweight_g1u1_16x512_pf3E,16,512,,,,,3.0,inf,35.80555555555553,failed,0.0,0.0
2026-01-12 04:44:12,3,16,7168,256,256,8,ActivationType.Gelu,torch.bfloat16,torch.float8_e4m3fnuz,torch.float8_e4m3fnuz,QuantType.per_Token,1,1,asm,stage1,32,_ZN5aiter53fmoe_stage1_bf16_pertokenFp8_doweight_g1u1_32x512_pf2E,32,512,,,,,2.0,inf,35.80555555555553,failed,0.0,0.0
2026-01-12 04:44:12,3,16,7168,256,256,8,ActivationType.Gelu,torch.bfloat16,torch.float8_e4m3fnuz,torch.float8_e4m3fnuz,QuantType.per_Token,1,1,asm,stage1,32,_ZN5aiter53fmoe_stage1_bf16_pertokenFp8_doweight_g1u1_32x512_pf3E,32,512,,,,,3.0,inf,35.80555555555553,failed,0.0,0.0
2026-01-12 04:44:27,4,4,7168,256,256,8,ActivationType.Silu,torch.bfloat16,torch.float8_e4m3fnuz,torch.float8_e4m3fnuz,QuantType.per_1x128,1,0,ck,stage2,16,moe_ck2stages_gemm2_256x16x128x256_1x4_MulABScaleExpertWeightA8W8blkscale_v1_Nswizzle0_Quant4_MulRoutedWeight1_F8_F8_B16,16,128,256.0,256.0,1.0,4.0,1.0,23.9181,38.08355555555553,15.22%,14.73,58924.92
2026-01-12 04:44:27,4,4,7168,256,256,8,ActivationType.Silu,torch.bfloat16,torch.float8_e4m3fnuz,torch.float8_e4m3fnuz,QuantType.per_1x128,1,0,ck,stage1,16,moe_ck2stages_gemm1_256x16x128x256_1x4_MulABScaleExpertWeightA8W8blkscale_v1_Nswizzle0_Quant4_MulRoutedWeight0_silu_F8_F8_B16,16,128,256.0,256.0,1.0,4.0,1.0,51.4915,38.08355555555553,0.00%,6.84,27370.97
2026-01-12 04:44:27,4,4,7168,256,256,8,ActivationType.Silu,torch.bfloat16,torch.float8_e4m3fnuz,torch.float8_e4m3fnuz,QuantType.per_1x128,1,0,asm,stage1,16,_ZN5aiter59fmoe_stage1_bf16_pertokenFp8_blockscale_g1u1_16x128_4tg_pf3E,16,128,,,,,3.0,53.4478,38.08355555555553,34.74%,6.59,26369.13
2026-01-12 04:44:27,4,4,7168,256,256,8,ActivationType.Silu,torch.bfloat16,torch.float8_e4m3fnuz,torch.float8_e4m3fnuz,QuantType.per_1x128,1,0,asm,stage1,32,_ZN5aiter59fmoe_stage1_bf16_pertokenFp8_blockscale_g1u1_32x128_3tg_pf3E,32,128,,,,,3.0,55.0814,38.08355555555553,4.06%,6.4,25587.08
2026-01-12 04:44:27,4,4,7168,256,256,8,ActivationType.Silu,torch.bfloat16,torch.float8_e4m3fnuz,torch.float8_e4m3fnuz,QuantType.per_1x128,1,0,ck,stage2,64,moe_ck2stages_gemm2_256x64x128x128_1x4_MulABScaleExpertWeightA8W8blkscale_v3_Nswizzle0_Quant4_MulRoutedWeight1_F8_F8_B16,64,128,128.0,256.0,1.0,4.0,3.0,63.3989,38.08355555555553,15.42%,5.56,22230.23
2026-01-12 04:44:27,4,4,7168,256,256,8,ActivationType.Silu,torch.bfloat16,torch.float8_e4m3fnuz,torch.float8_e4m3fnuz,QuantType.per_1x128,1,0,asm,stage1,16,_ZN5aiter59fmoe_stage1_bf16_pertokenFp8_blockscale_g1u1_16x256_2tg_pf3E,16,256,,,,,3.0,71.007,38.08355555555553,22.53%,4.96,19848.36
2026-01-12 04:44:27,4,4,7168,256,256,8,ActivationType.Silu,torch.bfloat16,torch.float8_e4m3fnuz,torch.float8_e4m3fnuz,QuantType.per_1x128,1,0,asm,stage1,64,_ZN5aiter59fmoe_stage1_bf16_pertokenFp8_blockscale_g1u1_64x128_2tg_pf3E,64,128,,,,,3.0,72.7002,38.08355555555553,4.06%,4.85,19386.08
2026-01-12 04:44:27,4,4,7168,256,256,8,ActivationType.Silu,torch.bfloat16,torch.float8_e4m3fnuz,torch.float8_e4m3fnuz,QuantType.per_1x128,1,0,asm,stage1,32,_ZN5aiter59fmoe_stage1_bf16_pertokenFp8_blockscale_g1u1_32x256_2tg_pf3E,32,256,,,,,3.0,75.3708,38.08355555555553,4.06%,4.67,18699.18
2026-01-12 04:44:27,4,4,7168,256,256,8,ActivationType.Silu,torch.bfloat16,torch.float8_e4m3fnuz,torch.float8_e4m3fnuz,QuantType.per_1x128,1,0,asm,stage1,16,_ZN5aiter59fmoe_stage1_bf16_pertokenFp8_blockscale_g1u1_16x128_4tg_pf2E,16,128,,,,,2.0,88.487,38.08355555555553,35.56%,3.98,15927.45
2026-01-12 04:44:27,4,4,7168,256,256,8,ActivationType.Silu,torch.bfloat16,torch.float8_e4m3fnuz,torch.float8_e4m3fnuz,QuantType.per_1x128,1,0,asm,stage1,32,_ZN5aiter59fmoe_stage1_bf16_pertokenFp8_blockscale_g1u1_32x128_3tg_pf2E,32,128,,,,,2.0,89.5364,38.08355555555553,4.06%,3.93,15740.77
2026-01-12 04:44:27,4,4,7168,256,256,8,ActivationType.Silu,torch.bfloat16,torch.float8_e4m3fnuz,torch.float8_e4m3fnuz,QuantType.per_1x128,1,0,asm,stage1,64,_ZN5aiter59fmoe_stage1_bf16_pertokenFp8_blockscale_g1u1_64x128_2tg_pf2E,64,128,,,,,2.0,92.7133,38.08355555555553,4.06%,3.8,15201.4
2026-01-12 04:44:27,4,4,7168,256,256,8,ActivationType.Silu,torch.bfloat16,torch.float8_e4m3fnuz,torch.float8_e4m3fnuz,QuantType.per_1x128,1,0,ck,stage1,64,moe_ck2stages_gemm1_256x64x128x128_1x4_MulABScaleExpertWeightA8W8blkscale_v3_Nswizzle0_Quant4_MulRoutedWeight0_silu_F8_F8_B16,64,128,128.0,256.0,1.0,4.0,3.0,104.1522,38.08355555555553,0.00%,3.38,13531.85
2026-01-12 04:44:27,4,4,7168,256,256,8,ActivationType.Silu,torch.bfloat16,torch.float8_e4m3fnuz,torch.float8_e4m3fnuz,QuantType.per_1x128,1,0,asm,stage1,32,_ZN5aiter59fmoe_stage1_bf16_pertokenFp8_blockscale_g1u1_32x256_2tg_pf2E,32,256,,,,,2.0,104.761,38.08355555555553,4.06%,3.36,13453.21
2026-01-12 04:44:27,4,4,7168,256,256,8,ActivationType.Silu,torch.bfloat16,torch.float8_e4m3fnuz,torch.float8_e4m3fnuz,QuantType.per_1x128,1,0,asm,stage1,16,_ZN5aiter59fmoe_stage1_bf16_pertokenFp8_blockscale_g1u1_16x256_3tg_pf2E,16,256,,,,,2.0,105.1268,38.08355555555553,22.36%,3.35,13406.4
2026-01-12 04:44:27,4,4,7168,256,256,8,ActivationType.Silu,torch.bfloat16,torch.float8_e4m3fnuz,torch.float8_e4m3fnuz,QuantType.per_1x128,1,0,asm,stage1,64,_ZN5aiter55fmoe_stage1_bf16_pertokenFp8_blockscale_g1u1_64x256_pf3E,64,256,,,,,3.0,128.6974,38.08355555555553,4.06%,2.74,10951.05
2026-01-12 04:44:27,4,4,7168,256,256,8,ActivationType.Silu,torch.bfloat16,torch.float8_e4m3fnuz,torch.float8_e4m3fnuz,QuantType.per_1x128,1,0,asm,stage1,64,_ZN5aiter55fmoe_stage1_bf16_pertokenFp8_blockscale_g1u1_64x256_pf2E,64,256,,,,,2.0,134.3621,38.08355555555553,4.06%,2.62,10489.36
2026-01-12 04:44:27,4,4,7168,256,256,8,ActivationType.Silu,torch.bfloat16,torch.float8_e4m3fnuz,torch.float8_e4m3fnuz,QuantType.per_1x128,1,0,asm,stage1,128,_ZN5aiter56fmoe_stage1_bf16_pertokenFp8_blockscale_g1u1_128x128_pf3E,128,128,,,,,3.0,135.3154,38.08355555555553,4.06%,2.6,10415.46
2026-01-12 04:44:27,4,4,7168,256,256,8,ActivationType.Silu,torch.bfloat16,torch.float8_e4m3fnuz,torch.float8_e4m3fnuz,QuantType.per_1x128,1,0,asm,asm_1stage,32,_ZN5aiter47fmoe_bf16_blockscaleFp8_g1u1_vs_silu_1tg_32x256E,32,256,,,,,,135.9791,0.0,0.00%,2.59,10364.62
2026-01-12 04:44:27,4,4,7168,256,256,8,ActivationType.Silu,torch.bfloat16,torch.float8_e4m3fnuz,torch.float8_e4m3fnuz,QuantType.per_1x128,1,0,asm,asm_1stage,32,_ZN5aiter50fmoe_bf16_blockscaleFp8_g1u1_vs_silu_1tg_ps_32x256E,32,256,,,,,,138.1158,0.0,0.00%,2.55,10204.28
2026-01-12 04:44:27,4,4,7168,256,256,8,ActivationType.Silu,torch.bfloat16,torch.float8_e4m3fnuz,torch.float8_e4m3fnuz,QuantType.per_1x128,1,0,asm,stage1,128,_ZN5aiter56fmoe_stage1_bf16_pertokenFp8_blockscale_g1u1_128x128_pf2E,128,128,,,,,2.0,140.5306,38.08355555555553,4.06%,2.51,10028.93
2026-01-12 04:44:27,4,4,7168,256,256,8,ActivationType.Silu,torch.bfloat16,torch.float8_e4m3fnuz,torch.float8_e4m3fnuz,QuantType.per_1x128,1,0,asm,asm_1stage,32,_ZN5aiter49fmoe_bf16_blockscaleFp8_g1u1_novs_silu_1tg_32x256E,32,256,,,,,,151.1606,0.0,0.00%,2.33,9323.67
2026-01-12 04:44:27,4,4,7168,256,256,8,ActivationType.Silu,torch.bfloat16,torch.float8_e4m3fnuz,torch.float8_e4m3fnuz,QuantType.per_1x128,1,0,asm,asm_1stage,32,_ZN5aiter52fmoe_bf16_blockscaleFp8_g1u1_novs_silu_1tg_ps_32x256E,32,256,,,,,,152.1838,0.0,0.00%,2.32,9260.99
2026-01-12 04:44:27,4,4,7168,256,256,8,ActivationType.Silu,torch.bfloat16,torch.float8_e4m3fnuz,torch.float8_e4m3fnuz,QuantType.per_1x128,1,0,asm,stage1,16,_ZN5aiter59fmoe_stage1_bf16_pertokenFp8_blockscale_g1u1_16x512_2tg_pf2E,16,512,,,,,2.0,inf,38.08355555555553,failed,0.0,0.0
2026-01-12 04:44:27,4,4,7168,256,256,8,ActivationType.Silu,torch.bfloat16,torch.float8_e4m3fnuz,torch.float8_e4m3fnuz,QuantType.per_1x128,1,0,asm,stage1,16,_ZN5aiter55fmoe_stage1_bf16_pertokenFp8_blockscale_g1u1_16x512_pf3E,16,512,,,,,3.0,inf,38.08355555555553,failed,0.0,0.0
2026-01-12 04:44:27,4,4,7168,256,256,8,ActivationType.Silu,torch.bfloat16,torch.float8_e4m3fnuz,torch.float8_e4m3fnuz,QuantType.per_1x128,1,0,asm,stage1,32,_ZN5aiter55fmoe_stage1_bf16_pertokenFp8_blockscale_g1u1_32x512_pf2E,32,512,,,,,2.0,inf,38.08355555555553,failed,0.0,0.0
2026-01-12 04:44:27,4,4,7168,256,256,8,ActivationType.Silu,torch.bfloat16,torch.float8_e4m3fnuz,torch.float8_e4m3fnuz,QuantType.per_1x128,1,0,asm,stage1,32,_ZN5aiter55fmoe_stage1_bf16_pertokenFp8_blockscale_g1u1_32x512_pf3E,32,512,,,,,3.0,inf,38.08355555555553,failed,0.0,0.0
2026-01-12 04:44:41,5,4,7168,256,256,8,ActivationType.Gelu,torch.bfloat16,torch.float8_e4m3fnuz,torch.float8_e4m3fnuz,QuantType.per_1x128,1,0,ck,stage2,16,moe_ck2stages_gemm2_256x16x128x256_1x4_MulABScaleExpertWeightA8W8blkscale_v1_Nswizzle0_Quant4_MulRoutedWeight1_F8_F8_B16,16,128,256.0,256.0,1.0,4.0,1.0,24.1112,38.618222222222116,15.35%,14.61,58453.01
2026-01-12 04:44:41,5,4,7168,256,256,8,ActivationType.Gelu,torch.bfloat16,torch.float8_e4m3fnuz,torch.float8_e4m3fnuz,QuantType.per_1x128,1,0,ck,stage1,16,moe_ck2stages_gemm1_256x16x128x256_1x4_MulABScaleExpertWeightA8W8blkscale_v1_Nswizzle0_Quant4_MulRoutedWeight0_gelu_F8_F8_B16,16,128,256.0,256.0,1.0,4.0,1.0,51.6961,38.618222222222116,0.00%,6.82,27262.64
2026-01-12 04:44:41,5,4,7168,256,256,8,ActivationType.Gelu,torch.bfloat16,torch.float8_e4m3fnuz,torch.float8_e4m3fnuz,QuantType.per_1x128,1,0,asm,stage1,16,_ZN5aiter59fmoe_stage1_bf16_pertokenFp8_blockscale_g1u1_16x128_4tg_pf3E,16,128,,,,,3.0,53.5475,38.618222222222116,35.74%,6.58,26320.04
2026-01-12 04:44:41,5,4,7168,256,256,8,ActivationType.Gelu,torch.bfloat16,torch.float8_e4m3fnuz,torch.float8_e4m3fnuz,QuantType.per_1x128,1,0,asm,stage1,32,_ZN5aiter59fmoe_stage1_bf16_pertokenFp8_blockscale_g1u1_32x128_3tg_pf3E,32,128,,,,,3.0,55.1728,38.618222222222116,4.51%,6.39,25544.69
2026-01-12 04:44:41,5,4,7168,256,256,8,ActivationType.Gelu,torch.bfloat16,torch.float8_e4m3fnuz,torch.float8_e4m3fnuz,QuantType.per_1x128,1,0,ck,stage2,64,moe_ck2stages_gemm2_256x64x128x128_1x4_MulABScaleExpertWeightA8W8blkscale_v3_Nswizzle0_Quant4_MulRoutedWeight1_F8_F8_B16,64,128,128.0,256.0,1.0,4.0,3.0,63.3051,38.618222222222116,15.16%,5.57,22263.17
2026-01-12 04:44:41,5,4,7168,256,256,8,ActivationType.Gelu,torch.bfloat16,torch.float8_e4m3fnuz,torch.float8_e4m3fnuz,QuantType.per_1x128,1,0,asm,stage1,16,_ZN5aiter59fmoe_stage1_bf16_pertokenFp8_blockscale_g1u1_16x256_2tg_pf3E,16,256,,,,,3.0,71.2418,38.618222222222116,22.74%,4.95,19782.94
2026-01-12 04:44:41,5,4,7168,256,256,8,ActivationType.Gelu,torch.bfloat16,torch.float8_e4m3fnuz,torch.float8_e4m3fnuz,QuantType.per_1x128,1,0,asm,stage1,64,_ZN5aiter59fmoe_stage1_bf16_pertokenFp8_blockscale_g1u1_64x128_2tg_pf3E,64,128,,,,,3.0,72.7799,38.618222222222116,4.51%,4.84,19364.85
2026-01-12 04:44:41,5,4,7168,256,256,8,ActivationType.Gelu,torch.bfloat16,torch.float8_e4m3fnuz,torch.float8_e4m3fnuz,QuantType.per_1x128,1,0,asm,stage1,32,_ZN5aiter59fmoe_stage1_bf16_pertokenFp8_blockscale_g1u1_32x256_2tg_pf3E,32,256,,,,,3.0,75.5727,38.618222222222116,4.51%,4.66,18649.22
2026-01-12 04:44:41,5,4,7168,256,256,8,ActivationType.Gelu,torch.bfloat16,torch.float8_e4m3fnuz,torch.float8_e4m3fnuz,QuantType.per_1x128,1,0,asm,stage1,16,_ZN5aiter59fmoe_stage1_bf16_pertokenFp8_blockscale_g1u1_16x128_4tg_pf2E,16,128,,,,,2.0,88.5746,38.618222222222116,36.31%,3.98,15911.7
2026-01-12 04:44:41,5,4,7168,256,256,8,ActivationType.Gelu,torch.bfloat16,torch.float8_e4m3fnuz,torch.float8_e4m3fnuz,QuantType.per_1x128,1,0,asm,stage1,32,_ZN5aiter59fmoe_stage1_bf16_pertokenFp8_blockscale_g1u1_32x128_3tg_pf2E,32,128,,,,,2.0,89.7134,38.618222222222116,4.51%,3.93,15709.72
2026-01-12 04:44:41,5,4,7168,256,256,8,ActivationType.Gelu,torch.bfloat16,torch.float8_e4m3fnuz,torch.float8_e4m3fnuz,QuantType.per_1x128,1,0,asm,stage1,64,_ZN5aiter59fmoe_stage1_bf16_pertokenFp8_blockscale_g1u1_64x128_2tg_pf2E,64,128,,,,,2.0,92.7775,38.618222222222116,4.51%,3.8,15190.88
2026-01-12 04:44:41,5,4,7168,256,256,8,ActivationType.Gelu,torch.bfloat16,torch.float8_e4m3fnuz,torch.float8_e4m3fnuz,QuantType.per_1x128,1,0,ck,stage1,64,moe_ck2stages_gemm1_256x64x128x128_1x4_MulABScaleExpertWeightA8W8blkscale_v3_Nswizzle0_Quant4_MulRoutedWeight0_gelu_F8_F8_B16,64,128,128.0,256.0,1.0,4.0,3.0,103.5479,38.618222222222116,0.00%,3.4,13610.82
2026-01-12 04:44:41,5,4,7168,256,256,8,ActivationType.Gelu,torch.bfloat16,torch.float8_e4m3fnuz,torch.float8_e4m3fnuz,QuantType.per_1x128,1,0,asm,stage1,32,_ZN5aiter59fmoe_stage1_bf16_pertokenFp8_blockscale_g1u1_32x256_2tg_pf2E,32,256,,,,,2.0,104.8104,38.618222222222116,4.51%,3.36,13446.87
2026-01-12 04:44:41,5,4,7168,256,256,8,ActivationType.Gelu,torch.bfloat16,torch.float8_e4m3fnuz,torch.float8_e4m3fnuz,QuantType.per_1x128,1,0,asm,stage1,16,_ZN5aiter59fmoe_stage1_bf16_pertokenFp8_blockscale_g1u1_16x256_3tg_pf2E,16,256,,,,,2.0,105.1532,38.618222222222116,22.56%,3.35,13403.04
2026-01-12 04:44:41,5,4,7168,256,256,8,ActivationType.Gelu,torch.bfloat16,torch.float8_e4m3fnuz,torch.float8_e4m3fnuz,QuantType.per_1x128,1,0,asm,stage1,64,_ZN5aiter55fmoe_stage1_bf16_pertokenFp8_blockscale_g1u1_64x256_pf3E,64,256,,,,,3.0,128.7627,38.618222222222116,4.51%,2.74,10945.5
2026-01-12 04:44:41,5,4,7168,256,256,8,ActivationType.Gelu,torch.bfloat16,torch.float8_e4m3fnuz,torch.float8_e4m3fnuz,QuantType.per_1x128,1,0,asm,stage1,64,_ZN5aiter55fmoe_stage1_bf16_pertokenFp8_blockscale_g1u1_64x256_pf2E,64,256,,,,,2.0,134.6726,38.618222222222116,4.51%,2.62,10465.17
2026-01-12 04:44:41,5,4,7168,256,256,8,ActivationType.Gelu,torch.bfloat16,torch.float8_e4m3fnuz,torch.float8_e4m3fnuz,QuantType.per_1x128,1,0,asm,stage1,128,_ZN5aiter56fmoe_stage1_bf16_pertokenFp8_blockscale_g1u1_128x128_pf3E,128,128,,,,,3.0,135.6612,38.618222222222116,4.51%,2.6,10388.91
2026-01-12 04:44:41,5,4,7168,256,256,8,ActivationType.Gelu,torch.bfloat16,torch.float8_e4m3fnuz,torch.float8_e4m3fnuz,QuantType.per_1x128,1,0,asm,asm_1stage,32,_ZN5aiter47fmoe_bf16_blockscaleFp8_g1u1_vs_gelu_1tg_32x256E,32,256,,,,,,136.3564,0.0,1.72%,2.58,10335.94
2026-01-12 04:44:41,5,4,7168,256,256,8,ActivationType.Gelu,torch.bfloat16,torch.float8_e4m3fnuz,torch.float8_e4m3fnuz,QuantType.per_1x128,1,0,asm,asm_1stage,32,_ZN5aiter50fmoe_bf16_blockscaleFp8_g1u1_vs_gelu_1tg_ps_32x256E,32,256,,,,,,138.107,0.0,1.72%,2.55,10204.93
2026-01-12 04:44:41,5,4,7168,256,256,8,ActivationType.Gelu,torch.bfloat16,torch.float8_e4m3fnuz,torch.float8_e4m3fnuz,QuantType.per_1x128,1,0,asm,stage1,128,_ZN5aiter56fmoe_stage1_bf16_pertokenFp8_blockscale_g1u1_128x128_pf2E,128,128,,,,,2.0,140.7253,38.618222222222116,4.51%,2.5,10015.06
2026-01-12 04:44:41,5,4,7168,256,256,8,ActivationType.Gelu,torch.bfloat16,torch.float8_e4m3fnuz,torch.float8_e4m3fnuz,QuantType.per_1x128,1,0,asm,asm_1stage,32,_ZN5aiter49fmoe_bf16_blockscaleFp8_g1u1_novs_gelu_1tg_32x256E,32,256,,,,,,151.0344,0.0,1.70%,2.33,9331.46
2026-01-12 04:44:41,5,4,7168,256,256,8,ActivationType.Gelu,torch.bfloat16,torch.float8_e4m3fnuz,torch.float8_e4m3fnuz,QuantType.per_1x128,1,0,asm,asm_1stage,32,_ZN5aiter52fmoe_bf16_blockscaleFp8_g1u1_novs_gelu_1tg_ps_32x256E,32,256,,,,,,152.9298,0.0,1.71%,2.3,9215.81
2026-01-12 04:44:41,5,4,7168,256,256,8,ActivationType.Gelu,torch.bfloat16,torch.float8_e4m3fnuz,torch.float8_e4m3fnuz,QuantType.per_1x128,1,0,asm,stage1,16,_ZN5aiter59fmoe_stage1_bf16_pertokenFp8_blockscale_g1u1_16x512_2tg_pf2E,16,512,,,,,2.0,inf,38.618222222222116,failed,0.0,0.0
2026-01-12 04:44:41,5,4,7168,256,256,8,ActivationType.Gelu,torch.bfloat16,torch.float8_e4m3fnuz,torch.float8_e4m3fnuz,QuantType.per_1x128,1,0,asm,stage1,16,_ZN5aiter55fmoe_stage1_bf16_pertokenFp8_blockscale_g1u1_16x512_pf3E,16,512,,,,,3.0,inf,38.618222222222116,failed,0.0,0.0
2026-01-12 04:44:41,5,4,7168,256,256,8,ActivationType.Gelu,torch.bfloat16,torch.float8_e4m3fnuz,torch.float8_e4m3fnuz,QuantType.per_1x128,1,0,asm,stage1,32,_ZN5aiter55fmoe_stage1_bf16_pertokenFp8_blockscale_g1u1_32x512_pf2E,32,512,,,,,2.0,inf,38.618222222222116,failed,0.0,0.0
2026-01-12 04:44:41,5,4,7168,256,256,8,ActivationType.Gelu,torch.bfloat16,torch.float8_e4m3fnuz,torch.float8_e4m3fnuz,QuantType.per_1x128,1,0,asm,stage1,32,_ZN5aiter55fmoe_stage1_bf16_pertokenFp8_blockscale_g1u1_32x512_pf3E,32,512,,,,,3.0,inf,38.618222222222116,failed,0.0,0.0
2026-01-12 04:45:13,6,512,7168,256,256,8,ActivationType.Silu,torch.bfloat16,torch.float8_e4m3fnuz,torch.float8_e4m3fnuz,QuantType.per_Tensor,1,0,ck,stage2,32,moe_ck2stages_gemm2_256x32x64x256_1x4_MulABScaleExpertWeight_v1_Nswizzle0_Quant1_MulRoutedWeight1_F8_F8_B16,32,64,256.0,256.0,1.0,4.0,1.0,143.5682,54.460555555555544,1.29%,314.12,9892.83
2026-01-12 04:45:13,6,512,7168,256,256,8,ActivationType.Silu,torch.bfloat16,torch.float8_e4m3fnuz,torch.float8_e4m3fnuz,QuantType.per_Tensor,1,0,ck,stage2,32,moe_ck2stages_gemm2_256x32x64x128_1x4_MulABScaleExpertWeight_v1_Nswizzle0_Quant1_MulRoutedWeight1_F8_F8_B16,32,64,128.0,256.0,1.0,4.0,1.0,151.2561,54.460555555555544,1.29%,298.15,9390.01
2026-01-12 04:45:13,6,512,7168,256,256,8,ActivationType.Silu,torch.bfloat16,torch.float8_e4m3fnuz,torch.float8_e4m3fnuz,QuantType.per_Tensor,1,0,ck,stage2,64,moe_ck2stages_gemm2_256x64x128x256_1x4_MulABScaleExpertWeight_v3_Nswizzle0_Quant1_MulRoutedWeight1_F8_F8_B16,64,128,256.0,256.0,1.0,4.0,3.0,168.7032,54.460555555555544,1.29%,267.32,8418.9
2026-01-12 04:45:13,6,512,7168,256,256,8,ActivationType.Silu,torch.bfloat16,torch.float8_e4m3fnuz,torch.float8_e4m3fnuz,QuantType.per_Tensor,1,0,ck,stage2,32,moe_ck2stages_gemm2_256x32x64x64_1x4_MulABScaleExpertWeight_v1_Nswizzle0_Quant1_MulRoutedWeight1_F8_F8_B16,32,64,64.0,256.0,1.0,4.0,1.0,172.1601,54.460555555555544,99.41%,261.95,8249.86
2026-01-12 04:45:13,6,512,7168,256,256,8,ActivationType.Silu,torch.bfloat16,torch.float8_e4m3fnuz,torch.float8_e4m3fnuz,QuantType.per_Tensor,1,0,ck,stage2,64,moe_ck2stages_gemm2_256x64x64x256_1x4_MulABScaleExpertWeight_v1_Nswizzle0_Quant1_MulRoutedWeight1_F8_F8_B16,64,64,256.0,256.0,1.0,4.0,1.0,191.2379,54.460555555555544,1.29%,235.82,7426.86
2026-01-12 04:45:13,6,512,7168,256,256,8,ActivationType.Silu,torch.bfloat16,torch.float8_e4m3fnuz,torch.float8_e4m3fnuz,QuantType.per_Tensor,1,0,ck,stage2,64,moe_ck2stages_gemm2_256x64x128x128_1x4_MulABScaleExpertWeight_v3_Nswizzle0_Quant1_MulRoutedWeight1_F8_F8_B16,64,128,128.0,256.0,1.0,4.0,3.0,223.9317,54.460555555555544,1.29%,201.39,6342.54
2026-01-12 04:45:13,6,512,7168,256,256,8,ActivationType.Silu,torch.bfloat16,torch.float8_e4m3fnuz,torch.float8_e4m3fnuz,QuantType.per_Tensor,1,0,asm,stage1,32,_ZN5aiter48fmoe_stage1_bf16_pertokenFp8_g1u1_32x256_2tg_pf2E,32,256,,,,,2.0,241.2918,54.460555555555544,0.00%,186.9,5886.22
2026-01-12 04:45:13,6,512,7168,256,256,8,ActivationType.Silu,torch.bfloat16,torch.float8_e4m3fnuz,torch.float8_e4m3fnuz,QuantType.per_Tensor,1,0,asm,stage1,32,_ZN5aiter48fmoe_stage1_bf16_pertokenFp8_g1u1_32x256_2tg_pf3E,32,256,,,,,3.0,242.4239,54.460555555555544,0.00%,186.03,5858.73
2026-01-12 04:45:13,6,512,7168,256,256,8,ActivationType.Silu,torch.bfloat16,torch.float8_e4m3fnuz,torch.float8_e4m3fnuz,QuantType.per_Tensor,1,0,asm,stage1,32,_ZN5aiter48fmoe_stage1_bf16_pertokenFp8_g1u1_32x128_3tg_pf2E,32,128,,,,,2.0,245.0983,54.460555555555544,0.02%,184.0,5794.8
2026-01-12 04:45:13,6,512,7168,256,256,8,ActivationType.Silu,torch.bfloat16,torch.float8_e4m3fnuz,torch.float8_e4m3fnuz,QuantType.per_Tensor,1,0,asm,stage1,32,_ZN5aiter48fmoe_stage1_bf16_pertokenFp8_g1u1_32x128_3tg_pf3E,32,128,,,,,3.0,247.1987,54.460555555555544,0.13%,182.43,5745.56
2026-01-12 04:45:13,6,512,7168,256,256,8,ActivationType.Silu,torch.bfloat16,torch.float8_e4m3fnuz,torch.float8_e4m3fnuz,QuantType.per_Tensor,1,0,asm,stage1,32,_ZN5aiter47fmoe_stage1_bf16_pertokenFp8_g1u1_32x64_4tg_pf2E,32,64,,,,,2.0,248.5907,54.460555555555544,0.00%,181.41,5713.39
2026-01-12 04:45:13,6,512,7168,256,256,8,ActivationType.Silu,torch.bfloat16,torch.float8_e4m3fnuz,torch.float8_e4m3fnuz,QuantType.per_Tensor,1,0,asm,stage1,32,_ZN5aiter47fmoe_stage1_bf16_pertokenFp8_g1u1_32x64_4tg_pf3E,32,64,,,,,3.0,252.2422,54.460555555555544,5.73%,178.79,5630.68
2026-01-12 04:45:13,6,512,7168,256,256,8,ActivationType.Silu,torch.bfloat16,torch.float8_e4m3fnuz,torch.float8_e4m3fnuz,QuantType.per_Tensor,1,0,asm,stage1,64,_ZN5aiter44fmoe_stage1_bf16_pertokenFp8_g1u1_64x256_pf2E,64,256,,,,,2.0,254.571,54.460555555555544,0.00%,177.15,5579.18
2026-01-12 04:45:13,6,512,7168,256,256,8,ActivationType.Silu,torch.bfloat16,torch.float8_e4m3fnuz,torch.float8_e4m3fnuz,QuantType.per_Tensor,1,0,ck,stage1,64,moe_ck2stages_gemm1_256x64x128x128_1x4_MulABScale_v3_Nswizzle0_Quant1_MulRoutedWeight0_silu_F8_F8_B16,64,128,128.0,256.0,1.0,4.0,3.0,256.5763,54.460555555555544,0.00%,175.77,5535.57
2026-01-12 04:45:13,6,512,7168,256,256,8,ActivationType.Silu,torch.bfloat16,torch.float8_e4m3fnuz,torch.float8_e4m3fnuz,QuantType.per_Tensor,1,0,asm,stage1,64,_ZN5aiter48fmoe_stage1_bf16_pertokenFp8_g1u1_64x128_2tg_pf2E,64,128,,,,,2.0,258.0122,54.460555555555544,0.00%,174.79,5504.76
2026-01-12 04:45:13,6,512,7168,256,256,8,ActivationType.Silu,torch.bfloat16,torch.float8_e4m3fnuz,torch.float8_e4m3fnuz,QuantType.per_Tensor,1,0,asm,stage1,64,_ZN5aiter44fmoe_stage1_bf16_pertokenFp8_g1u1_64x256_pf3E,64,256,,,,,3.0,260.2539,54.460555555555544,0.00%,173.28,5457.35
2026-01-12 04:45:13,6,512,7168,256,256,8,ActivationType.Silu,torch.bfloat16,torch.float8_e4m3fnuz,torch.float8_e4m3fnuz,QuantType.per_Tensor,1,0,asm,stage1,64,_ZN5aiter48fmoe_stage1_bf16_pertokenFp8_g1u1_64x128_2tg_pf3E,64,128,,,,,3.0,260.4555,54.460555555555544,0.00%,173.15,5453.12
2026-01-12 04:45:13,6,512,7168,256,256,8,ActivationType.Silu,torch.bfloat16,torch.float8_e4m3fnuz,torch.float8_e4m3fnuz,QuantType.per_Tensor,1,0,asm,stage1,64,_ZN5aiter47fmoe_stage1_bf16_pertokenFp8_g1u1_64x64_2tg_pf3E,64,64,,,,,3.0,260.4987,54.460555555555544,0.00%,173.12,5452.22
2026-01-12 04:45:13,6,512,7168,256,256,8,ActivationType.Silu,torch.bfloat16,torch.float8_e4m3fnuz,torch.float8_e4m3fnuz,QuantType.per_Tensor,1,0,ck,stage1,64,moe_ck2stages_gemm1_256x64x128x256_1x4_MulABScale_v3_Nswizzle0_Quant1_MulRoutedWeight0_silu_F8_F8_B16,64,128,256.0,256.0,1.0,4.0,3.0,261.5509,54.460555555555544,0.00%,172.42,5430.29
2026-01-12 04:45:13,6,512,7168,256,256,8,ActivationType.Silu,torch.bfloat16,torch.float8_e4m3fnuz,torch.float8_e4m3fnuz,QuantType.per_Tensor,1,0,ck,stage2,64,moe_ck2stages_gemm2_256x64x64x64_1x4_MulABScaleExpertWeight_v1_Nswizzle0_Quant1_MulRoutedWeight1_F8_F8_B16,64,64,64.0,256.0,1.0,4.0,1.0,261.7702,54.460555555555544,99.41%,172.28,5425.74
2026-01-12 04:45:13,6,512,7168,256,256,8,ActivationType.Silu,torch.bfloat16,torch.float8_e4m3fnuz,torch.float8_e4m3fnuz,QuantType.per_Tensor,1,0,ck,stage2,128,moe_ck2stages_gemm2_256x128x64x128_1x4_MulABScaleExpertWeight_v1_Nswizzle0_Quant1_MulRoutedWeight1_F8_F8_B16,128,64,128.0,256.0,1.0,4.0,1.0,282.5064,54.460555555555544,1.29%,159.63,5027.48
2026-01-12 04:45:13,6,512,7168,256,256,8,ActivationType.Silu,torch.bfloat16,torch.float8_e4m3fnuz,torch.float8_e4m3fnuz,QuantType.per_Tensor,1,0,asm,stage1,16,_ZN5aiter48fmoe_stage1_bf16_pertokenFp8_g1u1_16x128_4tg_pf3E,16,128,,,,,3.0,286.0972,54.460555555555544,0.65%,157.63,4964.38
2026-01-12 04:45:13,6,512,7168,256,256,8,ActivationType.Silu,torch.bfloat16,torch.float8_e4m3fnuz,torch.float8_e4m3fnuz,QuantType.per_Tensor,1,0,asm,stage1,16,_ZN5aiter48fmoe_stage1_bf16_pertokenFp8_g1u1_16x128_4tg_pf2E,16,128,,,,,2.0,286.7427,54.460555555555544,0.13%,157.27,4953.21
2026-01-12 04:45:13,6,512,7168,256,256,8,ActivationType.Silu,torch.bfloat16,torch.float8_e4m3fnuz,torch.float8_e4m3fnuz,QuantType.per_Tensor,1,0,asm,stage1,16,_ZN5aiter48fmoe_stage1_bf16_pertokenFp8_g1u1_16x256_3tg_pf2E,16,256,,,,,2.0,287.1394,54.460555555555544,0.01%,157.06,4946.36
2026-01-12 04:45:13,6,512,7168,256,256,8,ActivationType.Silu,torch.bfloat16,torch.float8_e4m3fnuz,torch.float8_e4m3fnuz,QuantType.per_Tensor,1,0,asm,stage1,128,_ZN5aiter45fmoe_stage1_bf16_pertokenFp8_g1u1_128x128_pf3E,128,128,,,,,3.0,287.1584,54.460555555555544,0.00%,157.05,4946.04
2026-01-12 04:45:13,6,512,7168,256,256,8,ActivationType.Silu,torch.bfloat16,torch.float8_e4m3fnuz,torch.float8_e4m3fnuz,QuantType.per_Tensor,1,0,ck,stage2,64,moe_ck2stages_gemm2_256x64x128x64_1x4_MulABScaleExpertWeight_v3_Nswizzle0_Quant1_MulRoutedWeight1_F8_F8_B16,64,128,64.0,256.0,1.0,4.0,3.0,287.8538,54.460555555555544,99.41%,156.67,4934.09
2026-01-12 04:45:13,6,512,7168,256,256,8,ActivationType.Silu,torch.bfloat16,torch.float8_e4m3fnuz,torch.float8_e4m3fnuz,QuantType.per_Tensor,1,0,ck,stage1,32,moe_ck2stages_gemm1_256x32x64x128_1x4_MulABScale_v1_Nswizzle0_Quant1_MulRoutedWeight0_silu_F8_F8_B16,32,64,128.0,256.0,1.0,4.0,1.0,288.8972,54.460555555555544,96.69%,156.1,4916.27
2026-01-12 04:45:13,6,512,7168,256,256,8,ActivationType.Silu,torch.bfloat16,torch.float8_e4m3fnuz,torch.float8_e4m3fnuz,QuantType.per_Tensor,1,0,asm,stage1,16,_ZN5aiter48fmoe_stage1_bf16_pertokenFp8_g1u1_16x256_2tg_pf3E,16,256,,,,,3.0,292.0412,54.460555555555544,0.00%,154.42,4863.34
2026-01-12 04:45:13,6,512,7168,256,256,8,ActivationType.Silu,torch.bfloat16,torch.float8_e4m3fnuz,torch.float8_e4m3fnuz,QuantType.per_Tensor,1,0,asm,stage1,128,_ZN5aiter45fmoe_stage1_bf16_pertokenFp8_g1u1_128x128_pf2E,128,128,,,,,2.0,293.3158,54.460555555555544,0.00%,153.75,4842.21
2026-01-12 04:45:13,6,512,7168,256,256,8,ActivationType.Silu,torch.bfloat16,torch.float8_e4m3fnuz,torch.float8_e4m3fnuz,QuantType.per_Tensor,1,0,asm,stage1,16,_ZN5aiter47fmoe_stage1_bf16_pertokenFp8_g1u1_16x64_6tg_pf2E,16,64,,,,,2.0,293.4452,54.460555555555544,0.00%,153.68,4840.07
2026-01-12 04:45:13,6,512,7168,256,256,8,ActivationType.Silu,torch.bfloat16,torch.float8_e4m3fnuz,torch.float8_e4m3fnuz,QuantType.per_Tensor,1,0,ck,stage1,128,moe_ck2stages_gemm1_256x128x128x128_1x4_MulABScale_v3_Nswizzle0_Quant1_MulRoutedWeight0_silu_F8_F8_B16,128,128,128.0,256.0,1.0,4.0,3.0,294.1974,54.460555555555544,0.00%,153.29,4827.7
2026-01-12 04:45:13,6,512,7168,256,256,8,ActivationType.Silu,torch.bfloat16,torch.float8_e4m3fnuz,torch.float8_e4m3fnuz,QuantType.per_Tensor,1,0,ck,stage1,128,moe_ck2stages_gemm1_256x128x128x256_1x4_MulABScale_v3_Nswizzle0_Quant1_MulRoutedWeight0_silu_F8_F8_B16,128,128,256.0,256.0,1.0,4.0,3.0,297.1052,54.460555555555544,0.00%,151.79,4780.45
2026-01-12 04:45:13,6,512,7168,256,256,8,ActivationType.Silu,torch.bfloat16,torch.float8_e4m3fnuz,torch.float8_e4m3fnuz,QuantType.per_Tensor,1,0,asm,stage1,16,_ZN5aiter47fmoe_stage1_bf16_pertokenFp8_g1u1_16x64_5tg_pf3E,16,64,,,,,3.0,302.5447,54.460555555555544,6.01%,149.06,4694.5
2026-01-12 04:45:13,6,512,7168,256,256,8,ActivationType.Silu,torch.bfloat16,torch.float8_e4m3fnuz,torch.float8_e4m3fnuz,QuantType.per_Tensor,1,0,asm,stage1,64,_ZN5aiter47fmoe_stage1_bf16_pertokenFp8_g1u1_64x64_3tg_pf2E,64,64,,,,,2.0,309.0934,54.460555555555544,0.00%,145.9,4595.04
2026-01-12 04:45:13,6,512,7168,256,256,8,ActivationType.Silu,torch.bfloat16,torch.float8_e4m3fnuz,torch.float8_e4m3fnuz,QuantType.per_Tensor,1,0,ck,stage2,128,moe_ck2stages_gemm2_256x128x128x128_1x4_MulABScaleExpertWeight_v3_Nswizzle0_Quant1_MulRoutedWeight1_F8_F8_B16,128,128,128.0,256.0,1.0,4.0,3.0,309.3473,54.460555555555544,1.29%,145.78,4591.27
2026-01-12 04:45:13,6,512,7168,256,256,8,ActivationType.Silu,torch.bfloat16,torch.float8_e4m3fnuz,torch.float8_e4m3fnuz,QuantType.per_Tensor,1,0,asm,stage1,128,_ZN5aiter44fmoe_stage1_bf16_pertokenFp8_g1u1_128x64_pf3E,128,64,,,,,3.0,316.4653,54.460555555555544,0.00%,142.5,4488.0
2026-01-12 04:45:13,6,512,7168,256,256,8,ActivationType.Silu,torch.bfloat16,torch.float8_e4m3fnuz,torch.float8_e4m3fnuz,QuantType.per_Tensor,1,0,ck,stage1,64,moe_ck2stages_gemm1_256x64x64x128_1x4_MulABScale_v1_Nswizzle0_Quant1_MulRoutedWeight0_silu_F8_F8_B16,64,64,128.0,256.0,1.0,4.0,1.0,334.6563,54.460555555555544,96.69%,134.76,4244.04
2026-01-12 04:45:13,6,512,7168,256,256,8,ActivationType.Silu,torch.bfloat16,torch.float8_e4m3fnuz,torch.float8_e4m3fnuz,QuantType.per_Tensor,1,0,asm,stage1,128,_ZN5aiter44fmoe_stage1_bf16_pertokenFp8_g1u1_128x64_pf2E,128,64,,,,,2.0,346.4898,54.460555555555544,0.00%,130.15,4099.1
2026-01-12 04:45:13,6,512,7168,256,256,8,ActivationType.Silu,torch.bfloat16,torch.float8_e4m3fnuz,torch.float8_e4m3fnuz,QuantType.per_Tensor,1,0,ck,stage2,128,moe_ck2stages_gemm2_256x128x64x64_1x4_MulABScaleExpertWeight_v3_Nswizzle0_Quant1_MulRoutedWeight1_F8_F8_B16,128,64,64.0,256.0,1.0,4.0,3.0,407.412,54.460555555555544,99.41%,110.69,3486.14
2026-01-12 04:45:13,6,512,7168,256,256,8,ActivationType.Silu,torch.bfloat16,torch.float8_e4m3fnuz,torch.float8_e4m3fnuz,QuantType.per_Tensor,1,0,ck,stage2,128,moe_ck2stages_gemm2_256x128x128x64_1x4_MulABScaleExpertWeight_v3_Nswizzle0_Quant1_MulRoutedWeight1_F8_F8_B16,128,128,64.0,256.0,1.0,4.0,3.0,418.572,54.460555555555544,99.41%,107.74,3393.19
2026-01-12 04:45:13,6,512,7168,256,256,8,ActivationType.Silu,torch.bfloat16,torch.float8_e4m3fnuz,torch.float8_e4m3fnuz,QuantType.per_Tensor,1,0,ck,stage1,32,moe_ck2stages_gemm1_256x32x64x256_1x4_MulABScale_v1_Nswizzle0_Quant1_MulRoutedWeight0_silu_F8_F8_B16,32,64,256.0,256.0,1.0,4.0,1.0,545.1658,54.460555555555544,96.69%,82.72,2605.26
2026-01-12 04:45:13,6,512,7168,256,256,8,ActivationType.Silu,torch.bfloat16,torch.float8_e4m3fnuz,torch.float8_e4m3fnuz,QuantType.per_Tensor,1,0,ck,stage1,64,moe_ck2stages_gemm1_256x64x64x256_1x4_MulABScale_v1_Nswizzle0_Quant1_MulRoutedWeight0_silu_F8_F8_B16,64,64,256.0,256.0,1.0,4.0,1.0,2193.3709,54.460555555555544,96.69%,20.56,647.54
2026-01-12 04:45:13,6,512,7168,256,256,8,ActivationType.Silu,torch.bfloat16,torch.float8_e4m3fnuz,torch.float8_e4m3fnuz,QuantType.per_Tensor,1,0,ck,stage1,128,moe_ck2stages_gemm1_256x128x64x128_1x4_MulABScale_v1_Nswizzle0_Quant1_MulRoutedWeight0_silu_F8_F8_B16,128,64,128.0,256.0,1.0,4.0,1.0,2924.2036,54.460555555555544,96.69%,15.42,485.7
2026-01-12 04:45:13,6,512,7168,256,256,8,ActivationType.Silu,torch.bfloat16,torch.float8_e4m3fnuz,torch.float8_e4m3fnuz,QuantType.per_Tensor,1,0,asm,stage1,16,_ZN5aiter48fmoe_stage1_bf16_pertokenFp8_g1u1_16x512_2tg_pf2E,16,512,,,,,2.0,inf,54.460555555555544,failed,0.0,0.0
2026-01-12 04:45:13,6,512,7168,256,256,8,ActivationType.Silu,torch.bfloat16,torch.float8_e4m3fnuz,torch.float8_e4m3fnuz,QuantType.per_Tensor,1,0,asm,stage1,16,_ZN5aiter44fmoe_stage1_bf16_pertokenFp8_g1u1_16x512_pf3E,16,512,,,,,3.0,inf,54.460555555555544,failed,0.0,0.0
2026-01-12 04:45:13,6,512,7168,256,256,8,ActivationType.Silu,torch.bfloat16,torch.float8_e4m3fnuz,torch.float8_e4m3fnuz,QuantType.per_Tensor,1,0,asm,stage1,32,_ZN5aiter44fmoe_stage1_bf16_pertokenFp8_g1u1_32x512_pf2E,32,512,,,,,2.0,inf,54.460555555555544,failed,0.0,0.0
2026-01-12 04:45:13,6,512,7168,256,256,8,ActivationType.Silu,torch.bfloat16,torch.float8_e4m3fnuz,torch.float8_e4m3fnuz,QuantType.per_Tensor,1,0,asm,stage1,32,_ZN5aiter44fmoe_stage1_bf16_pertokenFp8_g1u1_32x512_pf3E,32,512,,,,,3.0,inf,54.460555555555544,failed,0.0,0.0
2026-01-12 04:45:45,7,512,7168,256,256,8,ActivationType.Gelu,torch.bfloat16,torch.float8_e4m3fnuz,torch.float8_e4m3fnuz,QuantType.per_Tensor,1,0,ck,stage2,32,moe_ck2stages_gemm2_256x32x64x128_1x4_MulABScaleExpertWeight_v1_Nswizzle0_Quant1_MulRoutedWeight1_F8_F8_B16,32,64,128.0,256.0,1.0,4.0,1.0,151.7472,53.85088888888883,1.61%,297.19,9359.62
2026-01-12 04:45:45,7,512,7168,256,256,8,ActivationType.Gelu,torch.bfloat16,torch.float8_e4m3fnuz,torch.float8_e4m3fnuz,QuantType.per_Tensor,1,0,ck,stage2,32,moe_ck2stages_gemm2_256x32x64x256_1x4_MulABScaleExpertWeight_v1_Nswizzle0_Quant1_MulRoutedWeight1_F8_F8_B16,32,64,256.0,256.0,1.0,4.0,1.0,151.8052,53.85088888888883,1.62%,297.07,9356.04
2026-01-12 04:45:45,7,512,7168,256,256,8,ActivationType.Gelu,torch.bfloat16,torch.float8_e4m3fnuz,torch.float8_e4m3fnuz,QuantType.per_Tensor,1,0,ck,stage2,64,moe_ck2stages_gemm2_256x64x128x256_1x4_MulABScaleExpertWeight_v3_Nswizzle0_Quant1_MulRoutedWeight1_F8_F8_B16,64,128,256.0,256.0,1.0,4.0,3.0,169.1578,53.85088888888883,1.61%,266.6,8396.28
2026-01-12 04:45:45,7,512,7168,256,256,8,ActivationType.Gelu,torch.bfloat16,torch.float8_e4m3fnuz,torch.float8_e4m3fnuz,QuantType.per_Tensor,1,0,ck,stage2,32,moe_ck2stages_gemm2_256x32x64x64_1x4_MulABScaleExpertWeight_v1_Nswizzle0_Quant1_MulRoutedWeight1_F8_F8_B16,32,64,64.0,256.0,1.0,4.0,1.0,172.6806,53.85088888888883,99.43%,261.16,8224.99
2026-01-12 04:45:45,7,512,7168,256,256,8,ActivationType.Gelu,torch.bfloat16,torch.float8_e4m3fnuz,torch.float8_e4m3fnuz,QuantType.per_Tensor,1,0,ck,stage2,64,moe_ck2stages_gemm2_256x64x64x256_1x4_MulABScaleExpertWeight_v1_Nswizzle0_Quant1_MulRoutedWeight1_F8_F8_B16,64,64,256.0,256.0,1.0,4.0,1.0,191.3214,53.85088888888883,1.62%,235.71,7423.61
2026-01-12 04:45:45,7,512,7168,256,256,8,ActivationType.Gelu,torch.bfloat16,torch.float8_e4m3fnuz,torch.float8_e4m3fnuz,QuantType.per_Tensor,1,0,ck,stage2,64,moe_ck2stages_gemm2_256x64x128x128_1x4_MulABScaleExpertWeight_v3_Nswizzle0_Quant1_MulRoutedWeight1_F8_F8_B16,64,128,128.0,256.0,1.0,4.0,3.0,224.7314,53.85088888888883,1.61%,200.67,6319.97
2026-01-12 04:45:45,7,512,7168,256,256,8,ActivationType.Gelu,torch.bfloat16,torch.float8_e4m3fnuz,torch.float8_e4m3fnuz,QuantType.per_Tensor,1,0,asm,stage1,32,_ZN5aiter48fmoe_stage1_bf16_pertokenFp8_g1u1_32x256_2tg_pf2E,32,256,,,,,2.0,241.1918,53.85088888888883,0.00%,186.98,5888.66
2026-01-12 04:45:45,7,512,7168,256,256,8,ActivationType.Gelu,torch.bfloat16,torch.float8_e4m3fnuz,torch.float8_e4m3fnuz,QuantType.per_Tensor,1,0,asm,stage1,32,_ZN5aiter48fmoe_stage1_bf16_pertokenFp8_g1u1_32x256_2tg_pf3E,32,256,,,,,3.0,242.424,53.85088888888883,0.00%,186.03,5858.73
2026-01-12 04:45:45,7,512,7168,256,256,8,ActivationType.Gelu,torch.bfloat16,torch.float8_e4m3fnuz,torch.float8_e4m3fnuz,QuantType.per_Tensor,1,0,asm,stage1,32,_ZN5aiter48fmoe_stage1_bf16_pertokenFp8_g1u1_32x128_3tg_pf2E,32,128,,,,,2.0,244.9987,53.85088888888883,0.00%,184.07,5797.16
2026-01-12 04:45:45,7,512,7168,256,256,8,ActivationType.Gelu,torch.bfloat16,torch.float8_e4m3fnuz,torch.float8_e4m3fnuz,QuantType.per_Tensor,1,0,asm,stage1,32,_ZN5aiter48fmoe_stage1_bf16_pertokenFp8_g1u1_32x128_3tg_pf3E,32,128,,,,,3.0,247.0536,53.85088888888883,0.25%,182.54,5748.94
2026-01-12 04:45:45,7,512,7168,256,256,8,ActivationType.Gelu,torch.bfloat16,torch.float8_e4m3fnuz,torch.float8_e4m3fnuz,QuantType.per_Tensor,1,0,asm,stage1,32,_ZN5aiter47fmoe_stage1_bf16_pertokenFp8_g1u1_32x64_4tg_pf2E,32,64,,,,,2.0,248.4211,53.85088888888883,0.00%,181.54,5717.29
2026-01-12 04:45:45,7,512,7168,256,256,8,ActivationType.Gelu,torch.bfloat16,torch.float8_e4m3fnuz,torch.float8_e4m3fnuz,QuantType.per_Tensor,1,0,asm,stage1,32,_ZN5aiter47fmoe_stage1_bf16_pertokenFp8_g1u1_32x64_4tg_pf3E,32,64,,,,,3.0,253.001,53.85088888888883,5.13%,178.25,5613.8
2026-01-12 04:45:45,7,512,7168,256,256,8,ActivationType.Gelu,torch.bfloat16,torch.float8_e4m3fnuz,torch.float8_e4m3fnuz,QuantType.per_Tensor,1,0,asm,stage1,64,_ZN5aiter44fmoe_stage1_bf16_pertokenFp8_g1u1_64x256_pf2E,64,256,,,,,2.0,256.0596,53.85088888888883,0.00%,176.12,5546.74
2026-01-12 04:45:45,7,512,7168,256,256,8,ActivationType.Gelu,torch.bfloat16,torch.float8_e4m3fnuz,torch.float8_e4m3fnuz,QuantType.per_Tensor,1,0,asm,stage1,64,_ZN5aiter44fmoe_stage1_bf16_pertokenFp8_g1u1_64x256_pf3E,64,256,,,,,3.0,258.4953,53.85088888888883,0.00%,174.46,5494.48
2026-01-12 04:45:45,7,512,7168,256,256,8,ActivationType.Gelu,torch.bfloat16,torch.float8_e4m3fnuz,torch.float8_e4m3fnuz,QuantType.per_Tensor,1,0,ck,stage1,64,moe_ck2stages_gemm1_256x64x128x128_1x4_MulABScale_v3_Nswizzle0_Quant1_MulRoutedWeight0_gelu_F8_F8_B16,64,128,128.0,256.0,1.0,4.0,3.0,259.2462,53.85088888888883,0.00%,173.95,5478.56
2026-01-12 04:45:45,7,512,7168,256,256,8,ActivationType.Gelu,torch.bfloat16,torch.float8_e4m3fnuz,torch.float8_e4m3fnuz,QuantType.per_Tensor,1,0,asm,stage1,64,_ZN5aiter48fmoe_stage1_bf16_pertokenFp8_g1u1_64x128_2tg_pf3E,64,128,,,,,3.0,260.2874,53.85088888888883,0.00%,173.26,5456.65
2026-01-12 04:45:45,7,512,7168,256,256,8,ActivationType.Gelu,torch.bfloat16,torch.float8_e4m3fnuz,torch.float8_e4m3fnuz,QuantType.per_Tensor,1,0,asm,stage1,64,_ZN5aiter48fmoe_stage1_bf16_pertokenFp8_g1u1_64x128_2tg_pf2E,64,128,,,,,2.0,260.7595,53.85088888888883,0.00%,172.95,5446.77
2026-01-12 04:45:45,7,512,7168,256,256,8,ActivationType.Gelu,torch.bfloat16,torch.float8_e4m3fnuz,torch.float8_e4m3fnuz,QuantType.per_Tensor,1,0,ck,stage1,64,moe_ck2stages_gemm1_256x64x128x256_1x4_MulABScale_v3_Nswizzle0_Quant1_MulRoutedWeight0_gelu_F8_F8_B16,64,128,256.0,256.0,1.0,4.0,3.0,261.4195,53.85088888888883,0.00%,172.51,5433.02
2026-01-12 04:45:45,7,512,7168,256,256,8,ActivationType.Gelu,torch.bfloat16,torch.float8_e4m3fnuz,torch.float8_e4m3fnuz,QuantType.per_Tensor,1,0,ck,stage2,64,moe_ck2stages_gemm2_256x64x64x64_1x4_MulABScaleExpertWeight_v1_Nswizzle0_Quant1_MulRoutedWeight1_F8_F8_B16,64,64,64.0,256.0,1.0,4.0,1.0,261.5315,53.85088888888883,99.43%,172.43,5430.69
2026-01-12 04:45:45,7,512,7168,256,256,8,ActivationType.Gelu,torch.bfloat16,torch.float8_e4m3fnuz,torch.float8_e4m3fnuz,QuantType.per_Tensor,1,0,asm,stage1,64,_ZN5aiter47fmoe_stage1_bf16_pertokenFp8_g1u1_64x64_2tg_pf3E,64,64,,,,,3.0,264.8026,53.85088888888883,0.14%,170.3,5363.6
2026-01-12 04:45:45,7,512,7168,256,256,8,ActivationType.Gelu,torch.bfloat16,torch.float8_e4m3fnuz,torch.float8_e4m3fnuz,QuantType.per_Tensor,1,0,ck,stage2,128,moe_ck2stages_gemm2_256x128x64x128_1x4_MulABScaleExpertWeight_v1_Nswizzle0_Quant1_MulRoutedWeight1_F8_F8_B16,128,64,128.0,256.0,1.0,4.0,1.0,282.4387,53.85088888888883,1.62%,159.67,5028.69
2026-01-12 04:45:45,7,512,7168,256,256,8,ActivationType.Gelu,torch.bfloat16,torch.float8_e4m3fnuz,torch.float8_e4m3fnuz,QuantType.per_Tensor,1,0,asm,stage1,16,_ZN5aiter48fmoe_stage1_bf16_pertokenFp8_g1u1_16x128_4tg_pf3E,16,128,,,,,3.0,286.063,53.85088888888883,0.44%,157.65,4964.98
2026-01-12 04:45:45,7,512,7168,256,256,8,ActivationType.Gelu,torch.bfloat16,torch.float8_e4m3fnuz,torch.float8_e4m3fnuz,QuantType.per_Tensor,1,0,asm,stage1,16,_ZN5aiter48fmoe_stage1_bf16_pertokenFp8_g1u1_16x128_4tg_pf2E,16,128,,,,,2.0,286.8526,53.85088888888883,0.03%,157.21,4951.31
2026-01-12 04:45:45,7,512,7168,256,256,8,ActivationType.Gelu,torch.bfloat16,torch.float8_e4m3fnuz,torch.float8_e4m3fnuz,QuantType.per_Tensor,1,0,asm,stage1,16,_ZN5aiter48fmoe_stage1_bf16_pertokenFp8_g1u1_16x256_3tg_pf2E,16,256,,,,,2.0,286.8858,53.85088888888883,0.01%,157.2,4950.74
2026-01-12 04:45:45,7,512,7168,256,256,8,ActivationType.Gelu,torch.bfloat16,torch.float8_e4m3fnuz,torch.float8_e4m3fnuz,QuantType.per_Tensor,1,0,ck,stage2,64,moe_ck2stages_gemm2_256x64x128x64_1x4_MulABScaleExpertWeight_v3_Nswizzle0_Quant1_MulRoutedWeight1_F8_F8_B16,64,128,64.0,256.0,1.0,4.0,3.0,287.9175,53.85088888888883,99.43%,156.63,4933.0
2026-01-12 04:45:45,7,512,7168,256,256,8,ActivationType.Gelu,torch.bfloat16,torch.float8_e4m3fnuz,torch.float8_e4m3fnuz,QuantType.per_Tensor,1,0,ck,stage1,32,moe_ck2stages_gemm1_256x32x64x128_1x4_MulABScale_v1_Nswizzle0_Quant1_MulRoutedWeight0_gelu_F8_F8_B16,32,64,128.0,256.0,1.0,4.0,1.0,288.4222,53.85088888888883,96.03%,156.36,4924.37
2026-01-12 04:45:45,7,512,7168,256,256,8,ActivationType.Gelu,torch.bfloat16,torch.float8_e4m3fnuz,torch.float8_e4m3fnuz,QuantType.per_Tensor,1,0,asm,stage1,128,_ZN5aiter45fmoe_stage1_bf16_pertokenFp8_g1u1_128x128_pf3E,128,128,,,,,3.0,290.2275,53.85088888888883,0.00%,155.39,4893.73
2026-01-12 04:45:45,7,512,7168,256,256,8,ActivationType.Gelu,torch.bfloat16,torch.float8_e4m3fnuz,torch.float8_e4m3fnuz,QuantType.per_Tensor,1,0,asm,stage1,16,_ZN5aiter48fmoe_stage1_bf16_pertokenFp8_g1u1_16x256_2tg_pf3E,16,256,,,,,3.0,291.9528,53.85088888888883,0.00%,154.47,4864.81
2026-01-12 04:45:45,7,512,7168,256,256,8,ActivationType.Gelu,torch.bfloat16,torch.float8_e4m3fnuz,torch.float8_e4m3fnuz,QuantType.per_Tensor,1,0,asm,stage1,128,_ZN5aiter45fmoe_stage1_bf16_pertokenFp8_g1u1_128x128_pf2E,128,128,,,,,2.0,292.8209,53.85088888888883,0.00%,154.01,4850.39
2026-01-12 04:45:45,7,512,7168,256,256,8,ActivationType.Gelu,torch.bfloat16,torch.float8_e4m3fnuz,torch.float8_e4m3fnuz,QuantType.per_Tensor,1,0,asm,stage1,16,_ZN5aiter47fmoe_stage1_bf16_pertokenFp8_g1u1_16x64_6tg_pf2E,16,64,,,,,2.0,293.7894,53.85088888888883,0.00%,153.5,4834.4
2026-01-12 04:45:45,7,512,7168,256,256,8,ActivationType.Gelu,torch.bfloat16,torch.float8_e4m3fnuz,torch.float8_e4m3fnuz,QuantType.per_Tensor,1,0,ck,stage1,128,moe_ck2stages_gemm1_256x128x128x128_1x4_MulABScale_v3_Nswizzle0_Quant1_MulRoutedWeight0_gelu_F8_F8_B16,128,128,128.0,256.0,1.0,4.0,3.0,295.6896,53.85088888888883,0.00%,152.52,4803.33
2026-01-12 04:45:45,7,512,7168,256,256,8,ActivationType.Gelu,torch.bfloat16,torch.float8_e4m3fnuz,torch.float8_e4m3fnuz,QuantType.per_Tensor,1,0,ck,stage1,128,moe_ck2stages_gemm1_256x128x128x256_1x4_MulABScale_v3_Nswizzle0_Quant1_MulRoutedWeight0_gelu_F8_F8_B16,128,128,256.0,256.0,1.0,4.0,3.0,295.885,53.85088888888883,0.00%,152.41,4800.16
2026-01-12 04:45:45,7,512,7168,256,256,8,ActivationType.Gelu,torch.bfloat16,torch.float8_e4m3fnuz,torch.float8_e4m3fnuz,QuantType.per_Tensor,1,0,asm,stage1,16,_ZN5aiter47fmoe_stage1_bf16_pertokenFp8_g1u1_16x64_5tg_pf3E,16,64,,,,,3.0,302.9565,53.85088888888883,6.12%,148.86,4688.12
2026-01-12 04:45:45,7,512,7168,256,256,8,ActivationType.Gelu,torch.bfloat16,torch.float8_e4m3fnuz,torch.float8_e4m3fnuz,QuantType.per_Tensor,1,0,ck,stage2,128,moe_ck2stages_gemm2_256x128x128x128_1x4_MulABScaleExpertWeight_v3_Nswizzle0_Quant1_MulRoutedWeight1_F8_F8_B16,128,128,128.0,256.0,1.0,4.0,3.0,308.822,53.85088888888883,1.62%,146.03,4599.08
2026-01-12 04:45:45,7,512,7168,256,256,8,ActivationType.Gelu,torch.bfloat16,torch.float8_e4m3fnuz,torch.float8_e4m3fnuz,QuantType.per_Tensor,1,0,asm,stage1,64,_ZN5aiter47fmoe_stage1_bf16_pertokenFp8_g1u1_64x64_3tg_pf2E,64,64,,,,,2.0,309.0274,53.85088888888883,0.00%,145.93,4596.02
2026-01-12 04:45:45,7,512,7168,256,256,8,ActivationType.Gelu,torch.bfloat16,torch.float8_e4m3fnuz,torch.float8_e4m3fnuz,QuantType.per_Tensor,1,0,asm,stage1,128,_ZN5aiter44fmoe_stage1_bf16_pertokenFp8_g1u1_128x64_pf3E,128,64,,,,,3.0,320.3215,53.85088888888883,0.00%,140.79,4433.97
2026-01-12 04:45:45,7,512,7168,256,256,8,ActivationType.Gelu,torch.bfloat16,torch.float8_e4m3fnuz,torch.float8_e4m3fnuz,QuantType.per_Tensor,1,0,ck,stage1,64,moe_ck2stages_gemm1_256x64x64x128_1x4_MulABScale_v1_Nswizzle0_Quant1_MulRoutedWeight0_gelu_F8_F8_B16,64,64,128.0,256.0,1.0,4.0,1.0,333.5402,53.85088888888883,96.03%,135.21,4258.25
2026-01-12 04:45:45,7,512,7168,256,256,8,ActivationType.Gelu,torch.bfloat16,torch.float8_e4m3fnuz,torch.float8_e4m3fnuz,QuantType.per_Tensor,1,0,asm,stage1,128,_ZN5aiter44fmoe_stage1_bf16_pertokenFp8_g1u1_128x64_pf2E,128,64,,,,,2.0,347.1884,53.85088888888883,0.00%,129.89,4090.85
2026-01-12 04:45:45,7,512,7168,256,256,8,ActivationType.Gelu,torch.bfloat16,torch.float8_e4m3fnuz,torch.float8_e4m3fnuz,QuantType.per_Tensor,1,0,ck,stage2,128,moe_ck2stages_gemm2_256x128x64x64_1x4_MulABScaleExpertWeight_v3_Nswizzle0_Quant1_MulRoutedWeight1_F8_F8_B16,128,64,64.0,256.0,1.0,4.0,3.0,407.1676,53.85088888888883,99.43%,110.76,3488.23
2026-01-12 04:45:45,7,512,7168,256,256,8,ActivationType.Gelu,torch.bfloat16,torch.float8_e4m3fnuz,torch.float8_e4m3fnuz,QuantType.per_Tensor,1,0,ck,stage2,128,moe_ck2stages_gemm2_256x128x128x64_1x4_MulABScaleExpertWeight_v3_Nswizzle0_Quant1_MulRoutedWeight1_F8_F8_B16,128,128,64.0,256.0,1.0,4.0,3.0,418.1934,53.85088888888883,99.43%,107.84,3396.27
2026-01-12 04:45:45,7,512,7168,256,256,8,ActivationType.Gelu,torch.bfloat16,torch.float8_e4m3fnuz,torch.float8_e4m3fnuz,QuantType.per_Tensor,1,0,ck,stage1,32,moe_ck2stages_gemm1_256x32x64x256_1x4_MulABScale_v1_Nswizzle0_Quant1_MulRoutedWeight0_gelu_F8_F8_B16,32,64,256.0,256.0,1.0,4.0,1.0,545.3584,53.85088888888883,96.03%,82.69,2604.34
2026-01-12 04:45:45,7,512,7168,256,256,8,ActivationType.Gelu,torch.bfloat16,torch.float8_e4m3fnuz,torch.float8_e4m3fnuz,QuantType.per_Tensor,1,0,ck,stage1,64,moe_ck2stages_gemm1_256x64x64x256_1x4_MulABScale_v1_Nswizzle0_Quant1_MulRoutedWeight0_gelu_F8_F8_B16,64,64,256.0,256.0,1.0,4.0,1.0,2175.8879,53.85088888888883,96.03%,20.73,652.74
2026-01-12 04:45:45,7,512,7168,256,256,8,ActivationType.Gelu,torch.bfloat16,torch.float8_e4m3fnuz,torch.float8_e4m3fnuz,QuantType.per_Tensor,1,0,ck,stage1,128,moe_ck2stages_gemm1_256x128x64x128_1x4_MulABScale_v1_Nswizzle0_Quant1_MulRoutedWeight0_gelu_F8_F8_B16,128,64,128.0,256.0,1.0,4.0,1.0,2930.6339,53.85088888888883,96.03%,15.39,484.64
2026-01-12 04:45:45,7,512,7168,256,256,8,ActivationType.Gelu,torch.bfloat16,torch.float8_e4m3fnuz,torch.float8_e4m3fnuz,QuantType.per_Tensor,1,0,asm,stage1,16,_ZN5aiter48fmoe_stage1_bf16_pertokenFp8_g1u1_16x512_2tg_pf2E,16,512,,,,,2.0,inf,53.85088888888883,failed,0.0,0.0
2026-01-12 04:45:45,7,512,7168,256,256,8,ActivationType.Gelu,torch.bfloat16,torch.float8_e4m3fnuz,torch.float8_e4m3fnuz,QuantType.per_Tensor,1,0,asm,stage1,16,_ZN5aiter44fmoe_stage1_bf16_pertokenFp8_g1u1_16x512_pf3E,16,512,,,,,3.0,inf,53.85088888888883,failed,0.0,0.0
2026-01-12 04:45:45,7,512,7168,256,256,8,ActivationType.Gelu,torch.bfloat16,torch.float8_e4m3fnuz,torch.float8_e4m3fnuz,QuantType.per_Tensor,1,0,asm,stage1,32,_ZN5aiter44fmoe_stage1_bf16_pertokenFp8_g1u1_32x512_pf2E,32,512,,,,,2.0,inf,53.85088888888883,failed,0.0,0.0
2026-01-12 04:45:45,7,512,7168,256,256,8,ActivationType.Gelu,torch.bfloat16,torch.float8_e4m3fnuz,torch.float8_e4m3fnuz,QuantType.per_Tensor,1,0,asm,stage1,32,_ZN5aiter44fmoe_stage1_bf16_pertokenFp8_g1u1_32x512_pf3E,32,512,,,,,3.0,inf,53.85088888888883,failed,0.0,0.0
2026-01-12 04:46:11,8,32,7168,512,256,8,ActivationType.Silu,torch.bfloat16,torch.float8_e4m3fnuz,torch.float8_e4m3fnuz,QuantType.per_Token,1,1,ck,stage2,32,moe_ck2stages_gemm2_256x32x64x256_1x4_MulABScaleExpertWeight_v1_Nswizzle0_Quant2_MulRoutedWeight0_F8_F8_B16,32,64,256.0,256.0,1.0,4.0,1.0,159.3908,36.32999999999999,0.01%,35.37,17687.72
2026-01-12 04:46:11,8,32,7168,512,256,8,ActivationType.Silu,torch.bfloat16,torch.float8_e4m3fnuz,torch.float8_e4m3fnuz,QuantType.per_Token,1,1,ck,stage2,32,moe_ck2stages_gemm2_256x32x64x128_1x4_MulABScaleExpertWeight_v1_Nswizzle0_Quant2_MulRoutedWeight0_F8_F8_B16,32,64,128.0,256.0,1.0,4.0,1.0,161.2119,36.32999999999999,0.01%,34.97,17487.92
2026-01-12 04:46:11,8,32,7168,512,256,8,ActivationType.Silu,torch.bfloat16,torch.float8_e4m3fnuz,torch.float8_e4m3fnuz,QuantType.per_Token,1,1,ck,stage2,32,moe_ck2stages_gemm2_256x32x64x64_1x4_MulABScaleExpertWeight_v1_Nswizzle0_Quant2_MulRoutedWeight0_F8_F8_B16,32,64,64.0,256.0,1.0,4.0,1.0,174.3446,36.32999999999999,98.50%,32.33,16170.62
2026-01-12 04:46:11,8,32,7168,512,256,8,ActivationType.Silu,torch.bfloat16,torch.float8_e4m3fnuz,torch.float8_e4m3fnuz,QuantType.per_Token,1,1,ck,stage2,64,moe_ck2stages_gemm2_256x64x64x256_1x4_MulABScaleExpertWeight_v1_Nswizzle0_Quant2_MulRoutedWeight0_F8_F8_B16,64,64,256.0,256.0,1.0,4.0,1.0,190.9945,36.32999999999999,0.01%,29.51,14760.95
2026-01-12 04:46:11,8,32,7168,512,256,8,ActivationType.Silu,torch.bfloat16,torch.float8_e4m3fnuz,torch.float8_e4m3fnuz,QuantType.per_Token,1,1,ck,stage2,64,moe_ck2stages_gemm2_256x64x128x256_1x4_MulABScaleExpertWeight_v3_Nswizzle0_Quant2_MulRoutedWeight0_F8_F8_B16,64,128,256.0,256.0,1.0,4.0,3.0,203.328,36.32999999999999,0.01%,27.72,13865.58
2026-01-12 04:46:11,8,32,7168,512,256,8,ActivationType.Silu,torch.bfloat16,torch.float8_e4m3fnuz,torch.float8_e4m3fnuz,QuantType.per_Token,1,1,ck,stage2,64,moe_ck2stages_gemm2_256x64x128x128_1x4_MulABScaleExpertWeight_v3_Nswizzle0_Quant2_MulRoutedWeight0_F8_F8_B16,64,128,128.0,256.0,1.0,4.0,3.0,217.2258,36.32999999999999,0.01%,25.95,12978.48
2026-01-12 04:46:11,8,32,7168,512,256,8,ActivationType.Silu,torch.bfloat16,torch.float8_e4m3fnuz,torch.float8_e4m3fnuz,QuantType.per_Token,1,1,ck,stage2,64,moe_ck2stages_gemm2_256x64x64x64_1x4_MulABScaleExpertWeight_v1_Nswizzle0_Quant2_MulRoutedWeight0_F8_F8_B16,64,64,64.0,256.0,1.0,4.0,1.0,272.5328,36.32999999999999,98.50%,20.68,10344.66
2026-01-12 04:46:11,8,32,7168,512,256,8,ActivationType.Silu,torch.bfloat16,torch.float8_e4m3fnuz,torch.float8_e4m3fnuz,QuantType.per_Token,1,1,ck,stage2,128,moe_ck2stages_gemm2_256x128x128x128_1x4_MulABScaleExpertWeight_v3_Nswizzle0_Quant2_MulRoutedWeight0_F8_F8_B16,128,128,128.0,256.0,1.0,4.0,3.0,286.9452,36.32999999999999,0.01%,19.65,9825.08
2026-01-12 04:46:11,8,32,7168,512,256,8,ActivationType.Silu,torch.bfloat16,torch.float8_e4m3fnuz,torch.float8_e4m3fnuz,QuantType.per_Token,1,1,ck,stage2,64,moe_ck2stages_gemm2_256x64x128x64_1x4_MulABScaleExpertWeight_v3_Nswizzle0_Quant2_MulRoutedWeight0_F8_F8_B16,64,128,64.0,256.0,1.0,4.0,3.0,290.3868,36.32999999999999,98.50%,19.41,9708.64
2026-01-12 04:46:11,8,32,7168,512,256,8,ActivationType.Silu,torch.bfloat16,torch.float8_e4m3fnuz,torch.float8_e4m3fnuz,QuantType.per_Token,1,1,asm,stage1,16,_ZN5aiter57fmoe_stage1_bf16_pertokenFp8_doweight_g1u1_16x128_4tg_pf2E,16,128,,,,,2.0,296.1568,36.32999999999999,0.00%,19.03,9519.49
2026-01-12 04:46:11,8,32,7168,512,256,8,ActivationType.Silu,torch.bfloat16,torch.float8_e4m3fnuz,torch.float8_e4m3fnuz,QuantType.per_Token,1,1,asm,stage1,16,_ZN5aiter53fmoe_stage1_bf16_pertokenFp8_doweight_g1u1_16x512_pf3E,16,512,,,,,3.0,296.4878,36.32999999999999,0.00%,19.01,9508.86
2026-01-12 04:46:11,8,32,7168,512,256,8,ActivationType.Silu,torch.bfloat16,torch.float8_e4m3fnuz,torch.float8_e4m3fnuz,QuantType.per_Token,1,1,asm,stage1,32,_ZN5aiter53fmoe_stage1_bf16_pertokenFp8_doweight_g1u1_32x512_pf2E,32,512,,,,,2.0,299.8873,36.32999999999999,0.00%,18.8,9401.07
2026-01-12 04:46:11,8,32,7168,512,256,8,ActivationType.Silu,torch.bfloat16,torch.float8_e4m3fnuz,torch.float8_e4m3fnuz,QuantType.per_Token,1,1,asm,stage1,16,_ZN5aiter57fmoe_stage1_bf16_pertokenFp8_doweight_g1u1_16x128_4tg_pf3E,16,128,,,,,3.0,304.8105,36.32999999999999,0.28%,18.49,9249.22
2026-01-12 04:46:11,8,32,7168,512,256,8,ActivationType.Silu,torch.bfloat16,torch.float8_e4m3fnuz,torch.float8_e4m3fnuz,QuantType.per_Token,1,1,asm,stage1,16,_ZN5aiter57fmoe_stage1_bf16_pertokenFp8_doweight_g1u1_16x512_2tg_pf2E,16,512,,,,,2.0,306.131,36.32999999999999,0.00%,18.41,9209.33
2026-01-12 04:46:11,8,32,7168,512,256,8,ActivationType.Silu,torch.bfloat16,torch.float8_e4m3fnuz,torch.float8_e4m3fnuz,QuantType.per_Token,1,1,asm,stage1,16,_ZN5aiter56fmoe_stage1_bf16_pertokenFp8_doweight_g1u1_16x64_5tg_pf3E,16,64,,,,,3.0,309.7061,36.32999999999999,1.34%,18.2,9103.02
2026-01-12 04:46:11,8,32,7168,512,256,8,ActivationType.Silu,torch.bfloat16,torch.float8_e4m3fnuz,torch.float8_e4m3fnuz,QuantType.per_Token,1,1,asm,stage1,32,_ZN5aiter56fmoe_stage1_bf16_pertokenFp8_doweight_g1u1_32x64_4tg_pf3E,32,64,,,,,3.0,310.6645,36.32999999999999,1.81%,18.15,9074.94
2026-01-12 04:46:11,8,32,7168,512,256,8,ActivationType.Silu,torch.bfloat16,torch.float8_e4m3fnuz,torch.float8_e4m3fnuz,QuantType.per_Token,1,1,asm,stage1,32,_ZN5aiter53fmoe_stage1_bf16_pertokenFp8_doweight_g1u1_32x512_pf3E,32,512,,,,,3.0,312.5524,36.32999999999999,0.00%,18.04,9020.12
2026-01-12 04:46:11,8,32,7168,512,256,8,ActivationType.Silu,torch.bfloat16,torch.float8_e4m3fnuz,torch.float8_e4m3fnuz,QuantType.per_Token,1,1,asm,stage1,16,_ZN5aiter56fmoe_stage1_bf16_pertokenFp8_doweight_g1u1_16x64_6tg_pf2E,16,64,,,,,2.0,316.1366,36.32999999999999,0.00%,17.83,8917.86
2026-01-12 04:46:11,8,32,7168,512,256,8,ActivationType.Silu,torch.bfloat16,torch.float8_e4m3fnuz,torch.float8_e4m3fnuz,QuantType.per_Token,1,1,asm,stage1,32,_ZN5aiter57fmoe_stage1_bf16_pertokenFp8_doweight_g1u1_32x128_3tg_pf2E,32,128,,,,,2.0,319.5487,36.32999999999999,0.00%,17.64,8822.63
2026-01-12 04:46:11,8,32,7168,512,256,8,ActivationType.Silu,torch.bfloat16,torch.float8_e4m3fnuz,torch.float8_e4m3fnuz,QuantType.per_Token,1,1,asm,stage1,32,_ZN5aiter57fmoe_stage1_bf16_pertokenFp8_doweight_g1u1_32x128_3tg_pf3E,32,128,,,,,3.0,327.0991,36.32999999999999,0.28%,17.23,8618.98
2026-01-12 04:46:11,8,32,7168,512,256,8,ActivationType.Silu,torch.bfloat16,torch.float8_e4m3fnuz,torch.float8_e4m3fnuz,QuantType.per_Token,1,1,asm,stage1,16,_ZN5aiter57fmoe_stage1_bf16_pertokenFp8_doweight_g1u1_16x256_3tg_pf2E,16,256,,,,,2.0,335.548,36.32999999999999,0.00%,16.8,8401.96
2026-01-12 04:46:11,8,32,7168,512,256,8,ActivationType.Silu,torch.bfloat16,torch.float8_e4m3fnuz,torch.float8_e4m3fnuz,QuantType.per_Token,1,1,asm,stage1,32,_ZN5aiter57fmoe_stage1_bf16_pertokenFp8_doweight_g1u1_32x256_2tg_pf2E,32,256,,,,,2.0,339.7017,36.32999999999999,0.00%,16.59,8299.22
2026-01-12 04:46:11,8,32,7168,512,256,8,ActivationType.Silu,torch.bfloat16,torch.float8_e4m3fnuz,torch.float8_e4m3fnuz,QuantType.per_Token,1,1,asm,stage1,64,_ZN5aiter57fmoe_stage1_bf16_pertokenFp8_doweight_g1u1_64x128_2tg_pf3E,64,128,,,,,3.0,339.7368,36.32999999999999,0.00%,16.59,8298.37
2026-01-12 04:46:11,8,32,7168,512,256,8,ActivationType.Silu,torch.bfloat16,torch.float8_e4m3fnuz,torch.float8_e4m3fnuz,QuantType.per_Token,1,1,asm,stage1,64,_ZN5aiter56fmoe_stage1_bf16_pertokenFp8_doweight_g1u1_64x64_2tg_pf3E,64,64,,,,,3.0,343.6598,36.32999999999999,0.01%,16.4,8203.64
2026-01-12 04:46:11,8,32,7168,512,256,8,ActivationType.Silu,torch.bfloat16,torch.float8_e4m3fnuz,torch.float8_e4m3fnuz,QuantType.per_Token,1,1,ck,stage1,32,moe_ck2stages_gemm1_256x32x64x128_1x4_MulABScale_v1_Nswizzle0_Quant2_MulRoutedWeight1_silu_F8_F8_B16,32,64,128.0,256.0,1.0,4.0,1.0,345.6024,36.32999999999999,16.68%,16.31,8157.53
2026-01-12 04:46:11,8,32,7168,512,256,8,ActivationType.Silu,torch.bfloat16,torch.float8_e4m3fnuz,torch.float8_e4m3fnuz,QuantType.per_Token,1,1,ck,stage1,64,moe_ck2stages_gemm1_256x64x128x128_1x4_MulABScale_v3_Nswizzle0_Quant2_MulRoutedWeight1_silu_F8_F8_B16,64,128,128.0,256.0,1.0,4.0,3.0,350.2143,36.32999999999999,0.00%,16.1,8050.1
2026-01-12 04:46:11,8,32,7168,512,256,8,ActivationType.Silu,torch.bfloat16,torch.float8_e4m3fnuz,torch.float8_e4m3fnuz,QuantType.per_Token,1,1,asm,stage1,32,_ZN5aiter57fmoe_stage1_bf16_pertokenFp8_doweight_g1u1_32x256_2tg_pf3E,32,256,,,,,3.0,351.6495,36.32999999999999,0.00%,16.03,8017.25
2026-01-12 04:46:11,8,32,7168,512,256,8,ActivationType.Silu,torch.bfloat16,torch.float8_e4m3fnuz,torch.float8_e4m3fnuz,QuantType.per_Token,1,1,asm,stage1,16,_ZN5aiter57fmoe_stage1_bf16_pertokenFp8_doweight_g1u1_16x256_2tg_pf3E,16,256,,,,,3.0,352.4912,36.32999999999999,0.02%,15.99,7998.1
2026-01-12 04:46:11,8,32,7168,512,256,8,ActivationType.Silu,torch.bfloat16,torch.float8_e4m3fnuz,torch.float8_e4m3fnuz,QuantType.per_Token,1,1,asm,stage1,32,_ZN5aiter56fmoe_stage1_bf16_pertokenFp8_doweight_g1u1_32x64_4tg_pf2E,32,64,,,,,2.0,355.4156,36.32999999999999,0.00%,15.86,7932.29
2026-01-12 04:46:11,8,32,7168,512,256,8,ActivationType.Silu,torch.bfloat16,torch.float8_e4m3fnuz,torch.float8_e4m3fnuz,QuantType.per_Token,1,1,ck,stage1,64,moe_ck2stages_gemm1_256x64x128x256_1x4_MulABScale_v3_Nswizzle0_Quant2_MulRoutedWeight1_silu_F8_F8_B16,64,128,256.0,256.0,1.0,4.0,3.0,358.3504,36.32999999999999,0.00%,15.73,7867.33
2026-01-12 04:46:11,8,32,7168,512,256,8,ActivationType.Silu,torch.bfloat16,torch.float8_e4m3fnuz,torch.float8_e4m3fnuz,QuantType.per_Token,1,1,asm,stage1,64,_ZN5aiter56fmoe_stage1_bf16_pertokenFp8_doweight_g1u1_64x64_2tg_pf2E,64,64,,,,,2.0,361.8058,36.32999999999999,0.00%,15.58,7792.19
2026-01-12 04:46:11,8,32,7168,512,256,8,ActivationType.Silu,torch.bfloat16,torch.float8_e4m3fnuz,torch.float8_e4m3fnuz,QuantType.per_Token,1,1,asm,stage1,64,_ZN5aiter57fmoe_stage1_bf16_pertokenFp8_doweight_g1u1_64x128_2tg_pf2E,64,128,,,,,2.0,375.6615,36.32999999999999,0.00%,15.01,7504.79
2026-01-12 04:46:11,8,32,7168,512,256,8,ActivationType.Silu,torch.bfloat16,torch.float8_e4m3fnuz,torch.float8_e4m3fnuz,QuantType.per_Token,1,1,asm,stage1,64,_ZN5aiter53fmoe_stage1_bf16_pertokenFp8_doweight_g1u1_64x256_pf3E,64,256,,,,,3.0,389.6347,36.32999999999999,0.00%,14.47,7235.65
2026-01-12 04:46:11,8,32,7168,512,256,8,ActivationType.Silu,torch.bfloat16,torch.float8_e4m3fnuz,torch.float8_e4m3fnuz,QuantType.per_Token,1,1,asm,stage1,128,_ZN5aiter53fmoe_stage1_bf16_pertokenFp8_doweight_g1u1_128x64_pf3E,128,64,,,,,3.0,390.6075,36.32999999999999,0.00%,14.43,7217.63
2026-01-12 04:46:11,8,32,7168,512,256,8,ActivationType.Silu,torch.bfloat16,torch.float8_e4m3fnuz,torch.float8_e4m3fnuz,QuantType.per_Token,1,1,ck,stage2,128,moe_ck2stages_gemm2_256x128x64x128_1x4_MulABScaleExpertWeight_v1_Nswizzle0_Quant2_MulRoutedWeight0_F8_F8_B16,128,64,128.0,256.0,1.0,4.0,1.0,400.7142,36.32999999999999,0.01%,14.07,7035.59
2026-01-12 04:46:11,8,32,7168,512,256,8,ActivationType.Silu,torch.bfloat16,torch.float8_e4m3fnuz,torch.float8_e4m3fnuz,QuantType.per_Token,1,1,asm,stage1,128,_ZN5aiter54fmoe_stage1_bf16_pertokenFp8_doweight_g1u1_128x128_pf3E,128,128,,,,,3.0,404.4637,36.32999999999999,0.00%,13.94,6970.37
2026-01-12 04:46:11,8,32,7168,512,256,8,ActivationType.Silu,torch.bfloat16,torch.float8_e4m3fnuz,torch.float8_e4m3fnuz,QuantType.per_Token,1,1,asm,stage1,64,_ZN5aiter53fmoe_stage1_bf16_pertokenFp8_doweight_g1u1_64x256_pf2E,64,256,,,,,2.0,413.6646,36.32999999999999,0.00%,13.63,6815.33
2026-01-12 04:46:11,8,32,7168,512,256,8,ActivationType.Silu,torch.bfloat16,torch.float8_e4m3fnuz,torch.float8_e4m3fnuz,QuantType.per_Token,1,1,asm,stage1,128,_ZN5aiter54fmoe_stage1_bf16_pertokenFp8_doweight_g1u1_128x128_pf2E,128,128,,,,,2.0,413.802,36.32999999999999,0.00%,13.62,6813.07
2026-01-12 04:46:11,8,32,7168,512,256,8,ActivationType.Silu,torch.bfloat16,torch.float8_e4m3fnuz,torch.float8_e4m3fnuz,QuantType.per_Token,1,1,ck,stage1,64,moe_ck2stages_gemm1_256x64x64x128_1x4_MulABScale_v1_Nswizzle0_Quant2_MulRoutedWeight1_silu_F8_F8_B16,64,64,128.0,256.0,1.0,4.0,1.0,415.9384,36.32999999999999,16.68%,13.55,6778.07
2026-01-12 04:46:11,8,32,7168,512,256,8,ActivationType.Silu,torch.bfloat16,torch.float8_e4m3fnuz,torch.float8_e4m3fnuz,QuantType.per_Token,1,1,ck,stage2,128,moe_ck2stages_gemm2_256x128x128x64_1x4_MulABScaleExpertWeight_v3_Nswizzle0_Quant2_MulRoutedWeight0_F8_F8_B16,128,128,64.0,256.0,1.0,4.0,3.0,417.2354,36.32999999999999,98.50%,13.51,6757.0
2026-01-12 04:46:11,8,32,7168,512,256,8,ActivationType.Silu,torch.bfloat16,torch.float8_e4m3fnuz,torch.float8_e4m3fnuz,QuantType.per_Token,1,1,asm,stage1,128,_ZN5aiter53fmoe_stage1_bf16_pertokenFp8_doweight_g1u1_128x64_pf2E,128,64,,,,,2.0,436.8632,36.32999999999999,0.00%,12.9,6453.42
2026-01-12 04:46:11,8,32,7168,512,256,8,ActivationType.Silu,torch.bfloat16,torch.float8_e4m3fnuz,torch.float8_e4m3fnuz,QuantType.per_Token,1,1,ck,stage1,128,moe_ck2stages_gemm1_256x128x128x256_1x4_MulABScale_v3_Nswizzle0_Quant2_MulRoutedWeight1_silu_F8_F8_B16,128,128,256.0,256.0,1.0,4.0,3.0,440.9665,36.32999999999999,0.00%,12.78,6393.37
2026-01-12 04:46:11,8,32,7168,512,256,8,ActivationType.Silu,torch.bfloat16,torch.float8_e4m3fnuz,torch.float8_e4m3fnuz,QuantType.per_Token,1,1,ck,stage2,128,moe_ck2stages_gemm2_256x128x64x64_1x4_MulABScaleExpertWeight_v3_Nswizzle0_Quant2_MulRoutedWeight0_F8_F8_B16,128,64,64.0,256.0,1.0,4.0,3.0,442.497,36.32999999999999,98.50%,12.74,6371.25
2026-01-12 04:46:11,8,32,7168,512,256,8,ActivationType.Silu,torch.bfloat16,torch.float8_e4m3fnuz,torch.float8_e4m3fnuz,QuantType.per_Token,1,1,ck,stage1,128,moe_ck2stages_gemm1_256x128x128x128_1x4_MulABScale_v3_Nswizzle0_Quant2_MulRoutedWeight1_silu_F8_F8_B16,128,128,128.0,256.0,1.0,4.0,3.0,442.9348,36.32999999999999,0.00%,12.73,6364.96
2026-01-12 04:46:11,8,32,7168,512,256,8,ActivationType.Silu,torch.bfloat16,torch.float8_e4m3fnuz,torch.float8_e4m3fnuz,QuantType.per_Token,1,1,asm,asm_1stage,32,_ZN5aiter53fmoe_bf16_pertokenFp8_g1u1_vs_tkw1_silu_1tg_ps_32x512E,32,512,,,,,,443.1659,0.0,0.00%,12.72,6361.64
2026-01-12 04:46:11,8,32,7168,512,256,8,ActivationType.Silu,torch.bfloat16,torch.float8_e4m3fnuz,torch.float8_e4m3fnuz,QuantType.per_Token,1,1,asm,asm_1stage,32,_ZN5aiter50fmoe_bf16_pertokenFp8_g1u1_vs_tkw1_silu_1tg_32x512E,32,512,,,,,,456.0734,0.0,0.00%,12.36,6181.59
2026-01-12 04:46:11,8,32,7168,512,256,8,ActivationType.Silu,torch.bfloat16,torch.float8_e4m3fnuz,torch.float8_e4m3fnuz,QuantType.per_Token,1,1,asm,asm_1stage,32,_ZN5aiter50fmoe_bf16_pertokenFp8_g1u1_vs_tkw1_silu_1tg_32x128E,32,128,,,,,,544.5653,0.0,0.00%,10.35,5177.08
2026-01-12 04:46:11,8,32,7168,512,256,8,ActivationType.Silu,torch.bfloat16,torch.float8_e4m3fnuz,torch.float8_e4m3fnuz,QuantType.per_Token,1,1,asm,asm_1stage,32,_ZN5aiter50fmoe_bf16_pertokenFp8_g1u1_vs_tkw1_silu_1tg_32x256E,32,256,,,,,,553.8324,0.0,0.00%,10.18,5090.46
2026-01-12 04:46:11,8,32,7168,512,256,8,ActivationType.Silu,torch.bfloat16,torch.float8_e4m3fnuz,torch.float8_e4m3fnuz,QuantType.per_Token,1,1,asm,asm_1stage,32,_ZN5aiter53fmoe_bf16_pertokenFp8_g1u1_vs_tkw1_silu_1tg_ps_32x128E,32,128,,,,,,556.4485,0.0,0.00%,10.13,5066.53
2026-01-12 04:46:11,8,32,7168,512,256,8,ActivationType.Silu,torch.bfloat16,torch.float8_e4m3fnuz,torch.float8_e4m3fnuz,QuantType.per_Token,1,1,asm,asm_1stage,32,_ZN5aiter53fmoe_bf16_pertokenFp8_g1u1_vs_tkw1_silu_1tg_ps_32x256E,32,256,,,,,,559.8001,0.0,0.00%,10.07,5036.19
2026-01-12 04:46:11,8,32,7168,512,256,8,ActivationType.Silu,torch.bfloat16,torch.float8_e4m3fnuz,torch.float8_e4m3fnuz,QuantType.per_Token,1,1,ck,stage1,32,moe_ck2stages_gemm1_256x32x64x256_1x4_MulABScale_v1_Nswizzle0_Quant2_MulRoutedWeight1_silu_F8_F8_B16,32,64,256.0,256.0,1.0,4.0,1.0,782.0913,36.32999999999999,16.68%,7.21,3604.77
2026-01-12 04:46:11,8,32,7168,512,256,8,ActivationType.Silu,torch.bfloat16,torch.float8_e4m3fnuz,torch.float8_e4m3fnuz,QuantType.per_Token,1,1,ck,stage1,64,moe_ck2stages_gemm1_256x64x64x256_1x4_MulABScale_v1_Nswizzle0_Quant2_MulRoutedWeight1_silu_F8_F8_B16,64,64,256.0,256.0,1.0,4.0,1.0,2919.1761,36.32999999999999,16.68%,1.93,965.77
2026-01-12 04:46:11,8,32,7168,512,256,8,ActivationType.Silu,torch.bfloat16,torch.float8_e4m3fnuz,torch.float8_e4m3fnuz,QuantType.per_Token,1,1,ck,stage1,128,moe_ck2stages_gemm1_256x128x64x128_1x4_MulABScale_v1_Nswizzle0_Quant2_MulRoutedWeight1_silu_F8_F8_B16,128,64,128.0,256.0,1.0,4.0,1.0,3744.19,36.32999999999999,16.68%,1.51,752.97
2026-01-12 04:46:36,9,32,7168,512,256,8,ActivationType.Gelu,torch.bfloat16,torch.float8_e4m3fnuz,torch.float8_e4m3fnuz,QuantType.per_Token,1,1,ck,stage2,32,moe_ck2stages_gemm2_256x32x64x128_1x4_MulABScaleExpertWeight_v1_Nswizzle0_Quant2_MulRoutedWeight0_F8_F8_B16,32,64,128.0,256.0,1.0,4.0,1.0,162.0071,37.19388888888885,0.01%,34.8,17402.08
2026-01-12 04:46:36,9,32,7168,512,256,8,ActivationType.Gelu,torch.bfloat16,torch.float8_e4m3fnuz,torch.float8_e4m3fnuz,QuantType.per_Token,1,1,ck,stage2,32,moe_ck2stages_gemm2_256x32x64x256_1x4_MulABScaleExpertWeight_v1_Nswizzle0_Quant2_MulRoutedWeight0_F8_F8_B16,32,64,256.0,256.0,1.0,4.0,1.0,162.7566,37.19388888888885,0.01%,34.64,17321.94
2026-01-12 04:46:36,9,32,7168,512,256,8,ActivationType.Gelu,torch.bfloat16,torch.float8_e4m3fnuz,torch.float8_e4m3fnuz,QuantType.per_Token,1,1,ck,stage2,32,moe_ck2stages_gemm2_256x32x64x64_1x4_MulABScaleExpertWeight_v1_Nswizzle0_Quant2_MulRoutedWeight0_F8_F8_B16,32,64,64.0,256.0,1.0,4.0,1.0,181.8359,37.19388888888885,98.57%,31.0,15504.42
2026-01-12 04:46:36,9,32,7168,512,256,8,ActivationType.Gelu,torch.bfloat16,torch.float8_e4m3fnuz,torch.float8_e4m3fnuz,QuantType.per_Token,1,1,ck,stage2,64,moe_ck2stages_gemm2_256x64x64x256_1x4_MulABScaleExpertWeight_v1_Nswizzle0_Quant2_MulRoutedWeight0_F8_F8_B16,64,64,256.0,256.0,1.0,4.0,1.0,188.3541,37.19388888888885,0.01%,29.93,14967.87
2026-01-12 04:46:36,9,32,7168,512,256,8,ActivationType.Gelu,torch.bfloat16,torch.float8_e4m3fnuz,torch.float8_e4m3fnuz,QuantType.per_Token,1,1,ck,stage2,64,moe_ck2stages_gemm2_256x64x128x256_1x4_MulABScaleExpertWeight_v3_Nswizzle0_Quant2_MulRoutedWeight0_F8_F8_B16,64,128,256.0,256.0,1.0,4.0,3.0,201.8915,37.19388888888885,0.01%,27.92,13964.24
2026-01-12 04:46:36,9,32,7168,512,256,8,ActivationType.Gelu,torch.bfloat16,torch.float8_e4m3fnuz,torch.float8_e4m3fnuz,QuantType.per_Token,1,1,ck,stage2,64,moe_ck2stages_gemm2_256x64x128x128_1x4_MulABScaleExpertWeight_v3_Nswizzle0_Quant2_MulRoutedWeight0_F8_F8_B16,64,128,128.0,256.0,1.0,4.0,3.0,215.9375,37.19388888888885,0.01%,26.11,13055.91
2026-01-12 04:46:36,9,32,7168,512,256,8,ActivationType.Gelu,torch.bfloat16,torch.float8_e4m3fnuz,torch.float8_e4m3fnuz,QuantType.per_Token,1,1,ck,stage2,64,moe_ck2stages_gemm2_256x64x64x64_1x4_MulABScaleExpertWeight_v1_Nswizzle0_Quant2_MulRoutedWeight0_F8_F8_B16,64,64,64.0,256.0,1.0,4.0,1.0,272.4062,37.19388888888885,98.57%,20.69,10349.47
2026-01-12 04:46:36,9,32,7168,512,256,8,ActivationType.Gelu,torch.bfloat16,torch.float8_e4m3fnuz,torch.float8_e4m3fnuz,QuantType.per_Token,1,1,ck,stage2,128,moe_ck2stages_gemm2_256x128x128x128_1x4_MulABScaleExpertWeight_v3_Nswizzle0_Quant2_MulRoutedWeight0_F8_F8_B16,128,128,128.0,256.0,1.0,4.0,3.0,286.2999,37.19388888888885,0.01%,19.69,9847.23
2026-01-12 04:46:36,9,32,7168,512,256,8,ActivationType.Gelu,torch.bfloat16,torch.float8_e4m3fnuz,torch.float8_e4m3fnuz,QuantType.per_Token,1,1,ck,stage2,64,moe_ck2stages_gemm2_256x64x128x64_1x4_MulABScaleExpertWeight_v3_Nswizzle0_Quant2_MulRoutedWeight0_F8_F8_B16,64,128,64.0,256.0,1.0,4.0,3.0,290.6238,37.19388888888885,98.57%,19.4,9700.72
2026-01-12 04:46:36,9,32,7168,512,256,8,ActivationType.Gelu,torch.bfloat16,torch.float8_e4m3fnuz,torch.float8_e4m3fnuz,QuantType.per_Token,1,1,asm,stage1,16,_ZN5aiter57fmoe_stage1_bf16_pertokenFp8_doweight_g1u1_16x128_4tg_pf2E,16,128,,,,,2.0,295.9328,37.19388888888885,0.00%,19.05,9526.69
2026-01-12 04:46:36,9,32,7168,512,256,8,ActivationType.Gelu,torch.bfloat16,torch.float8_e4m3fnuz,torch.float8_e4m3fnuz,QuantType.per_Token,1,1,asm,stage1,16,_ZN5aiter53fmoe_stage1_bf16_pertokenFp8_doweight_g1u1_16x512_pf3E,16,512,,,,,3.0,296.9351,37.19388888888885,0.00%,18.98,9494.53
2026-01-12 04:46:36,9,32,7168,512,256,8,ActivationType.Gelu,torch.bfloat16,torch.float8_e4m3fnuz,torch.float8_e4m3fnuz,QuantType.per_Token,1,1,asm,stage1,16,_ZN5aiter56fmoe_stage1_bf16_pertokenFp8_doweight_g1u1_16x64_6tg_pf2E,16,64,,,,,2.0,304.4984,37.19388888888885,0.00%,18.51,9258.7
2026-01-12 04:46:36,9,32,7168,512,256,8,ActivationType.Gelu,torch.bfloat16,torch.float8_e4m3fnuz,torch.float8_e4m3fnuz,QuantType.per_Token,1,1,asm,stage1,16,_ZN5aiter57fmoe_stage1_bf16_pertokenFp8_doweight_g1u1_16x128_4tg_pf3E,16,128,,,,,3.0,304.9278,37.19388888888885,0.15%,18.49,9245.67
2026-01-12 04:46:36,9,32,7168,512,256,8,ActivationType.Gelu,torch.bfloat16,torch.float8_e4m3fnuz,torch.float8_e4m3fnuz,QuantType.per_Token,1,1,asm,stage1,16,_ZN5aiter57fmoe_stage1_bf16_pertokenFp8_doweight_g1u1_16x512_2tg_pf2E,16,512,,,,,2.0,306.2187,37.19388888888885,0.00%,18.41,9206.69
2026-01-12 04:46:36,9,32,7168,512,256,8,ActivationType.Gelu,torch.bfloat16,torch.float8_e4m3fnuz,torch.float8_e4m3fnuz,QuantType.per_Token,1,1,asm,stage1,16,_ZN5aiter56fmoe_stage1_bf16_pertokenFp8_doweight_g1u1_16x64_5tg_pf3E,16,64,,,,,3.0,309.5461,37.19388888888885,1.10%,18.21,9107.72
2026-01-12 04:46:36,9,32,7168,512,256,8,ActivationType.Gelu,torch.bfloat16,torch.float8_e4m3fnuz,torch.float8_e4m3fnuz,QuantType.per_Token,1,1,asm,stage1,32,_ZN5aiter53fmoe_stage1_bf16_pertokenFp8_doweight_g1u1_32x512_pf3E,32,512,,,,,3.0,312.9415,37.19388888888885,0.00%,18.01,9008.91
2026-01-12 04:46:36,9,32,7168,512,256,8,ActivationType.Gelu,torch.bfloat16,torch.float8_e4m3fnuz,torch.float8_e4m3fnuz,QuantType.per_Token,1,1,asm,stage1,32,_ZN5aiter56fmoe_stage1_bf16_pertokenFp8_doweight_g1u1_32x64_4tg_pf3E,32,64,,,,,3.0,315.2199,37.19388888888885,1.41%,17.88,8943.79
2026-01-12 04:46:36,9,32,7168,512,256,8,ActivationType.Gelu,torch.bfloat16,torch.float8_e4m3fnuz,torch.float8_e4m3fnuz,QuantType.per_Token,1,1,asm,stage1,32,_ZN5aiter57fmoe_stage1_bf16_pertokenFp8_doweight_g1u1_32x128_3tg_pf3E,32,128,,,,,3.0,317.156,37.19388888888885,0.17%,17.77,8889.19
2026-01-12 04:46:36,9,32,7168,512,256,8,ActivationType.Gelu,torch.bfloat16,torch.float8_e4m3fnuz,torch.float8_e4m3fnuz,QuantType.per_Token,1,1,asm,stage1,32,_ZN5aiter53fmoe_stage1_bf16_pertokenFp8_doweight_g1u1_32x512_pf2E,32,512,,,,,2.0,319.3323,37.19388888888885,0.00%,17.65,8828.61
2026-01-12 04:46:36,9,32,7168,512,256,8,ActivationType.Gelu,torch.bfloat16,torch.float8_e4m3fnuz,torch.float8_e4m3fnuz,QuantType.per_Token,1,1,asm,stage1,32,_ZN5aiter57fmoe_stage1_bf16_pertokenFp8_doweight_g1u1_32x128_3tg_pf2E,32,128,,,,,2.0,329.4247,37.19388888888885,0.00%,17.11,8558.13
2026-01-12 04:46:36,9,32,7168,512,256,8,ActivationType.Gelu,torch.bfloat16,torch.float8_e4m3fnuz,torch.float8_e4m3fnuz,QuantType.per_Token,1,1,asm,stage1,16,_ZN5aiter57fmoe_stage1_bf16_pertokenFp8_doweight_g1u1_16x256_3tg_pf2E,16,256,,,,,2.0,330.7861,37.19388888888885,0.03%,17.04,8522.91
2026-01-12 04:46:36,9,32,7168,512,256,8,ActivationType.Gelu,torch.bfloat16,torch.float8_e4m3fnuz,torch.float8_e4m3fnuz,QuantType.per_Token,1,1,asm,stage1,64,_ZN5aiter57fmoe_stage1_bf16_pertokenFp8_doweight_g1u1_64x128_2tg_pf3E,64,128,,,,,3.0,340.0099,37.19388888888885,0.00%,16.58,8291.7
2026-01-12 04:46:36,9,32,7168,512,256,8,ActivationType.Gelu,torch.bfloat16,torch.float8_e4m3fnuz,torch.float8_e4m3fnuz,QuantType.per_Token,1,1,ck,stage1,64,moe_ck2stages_gemm1_256x64x128x128_1x4_MulABScale_v3_Nswizzle0_Quant2_MulRoutedWeight1_gelu_F8_F8_B16,64,128,128.0,256.0,1.0,4.0,3.0,341.688,37.19388888888885,0.00%,16.5,8250.98
2026-01-12 04:46:36,9,32,7168,512,256,8,ActivationType.Gelu,torch.bfloat16,torch.float8_e4m3fnuz,torch.float8_e4m3fnuz,QuantType.per_Token,1,1,asm,stage1,32,_ZN5aiter57fmoe_stage1_bf16_pertokenFp8_doweight_g1u1_32x256_2tg_pf2E,32,256,,,,,2.0,342.8686,37.19388888888885,0.00%,16.44,8222.57
2026-01-12 04:46:36,9,32,7168,512,256,8,ActivationType.Gelu,torch.bfloat16,torch.float8_e4m3fnuz,torch.float8_e4m3fnuz,QuantType.per_Token,1,1,asm,stage1,64,_ZN5aiter56fmoe_stage1_bf16_pertokenFp8_doweight_g1u1_64x64_2tg_pf3E,64,64,,,,,3.0,343.4128,37.19388888888885,0.00%,16.42,8209.54
2026-01-12 04:46:36,9,32,7168,512,256,8,ActivationType.Gelu,torch.bfloat16,torch.float8_e4m3fnuz,torch.float8_e4m3fnuz,QuantType.per_Token,1,1,asm,stage1,32,_ZN5aiter57fmoe_stage1_bf16_pertokenFp8_doweight_g1u1_32x256_2tg_pf3E,32,256,,,,,3.0,346.4942,37.19388888888885,0.00%,16.27,8136.53
2026-01-12 04:46:36,9,32,7168,512,256,8,ActivationType.Gelu,torch.bfloat16,torch.float8_e4m3fnuz,torch.float8_e4m3fnuz,QuantType.per_Token,1,1,asm,stage1,16,_ZN5aiter57fmoe_stage1_bf16_pertokenFp8_doweight_g1u1_16x256_2tg_pf3E,16,256,,,,,3.0,352.4705,37.19388888888885,0.00%,15.99,7998.57
2026-01-12 04:46:36,9,32,7168,512,256,8,ActivationType.Gelu,torch.bfloat16,torch.float8_e4m3fnuz,torch.float8_e4m3fnuz,QuantType.per_Token,1,1,ck,stage1,32,moe_ck2stages_gemm1_256x32x64x128_1x4_MulABScale_v1_Nswizzle0_Quant2_MulRoutedWeight1_gelu_F8_F8_B16,32,64,128.0,256.0,1.0,4.0,1.0,354.7091,37.19388888888885,16.60%,15.89,7948.09
2026-01-12 04:46:36,9,32,7168,512,256,8,ActivationType.Gelu,torch.bfloat16,torch.float8_e4m3fnuz,torch.float8_e4m3fnuz,QuantType.per_Token,1,1,ck,stage1,64,moe_ck2stages_gemm1_256x64x128x256_1x4_MulABScale_v3_Nswizzle0_Quant2_MulRoutedWeight1_gelu_F8_F8_B16,64,128,256.0,256.0,1.0,4.0,3.0,354.8326,37.19388888888885,0.00%,15.89,7945.33
2026-01-12 04:46:36,9,32,7168,512,256,8,ActivationType.Gelu,torch.bfloat16,torch.float8_e4m3fnuz,torch.float8_e4m3fnuz,QuantType.per_Token,1,1,asm,stage1,32,_ZN5aiter56fmoe_stage1_bf16_pertokenFp8_doweight_g1u1_32x64_4tg_pf2E,32,64,,,,,2.0,355.4227,37.19388888888885,0.00%,15.86,7932.13
2026-01-12 04:46:36,9,32,7168,512,256,8,ActivationType.Gelu,torch.bfloat16,torch.float8_e4m3fnuz,torch.float8_e4m3fnuz,QuantType.per_Token,1,1,asm,stage1,64,_ZN5aiter56fmoe_stage1_bf16_pertokenFp8_doweight_g1u1_64x64_2tg_pf2E,64,64,,,,,2.0,367.9634,37.19388888888885,0.00%,15.32,7661.8
2026-01-12 04:46:36,9,32,7168,512,256,8,ActivationType.Gelu,torch.bfloat16,torch.float8_e4m3fnuz,torch.float8_e4m3fnuz,QuantType.per_Token,1,1,asm,stage1,64,_ZN5aiter57fmoe_stage1_bf16_pertokenFp8_doweight_g1u1_64x128_2tg_pf2E,64,128,,,,,2.0,374.5606,37.19388888888885,0.00%,15.05,7526.85
2026-01-12 04:46:36,9,32,7168,512,256,8,ActivationType.Gelu,torch.bfloat16,torch.float8_e4m3fnuz,torch.float8_e4m3fnuz,QuantType.per_Token,1,1,asm,stage1,64,_ZN5aiter53fmoe_stage1_bf16_pertokenFp8_doweight_g1u1_64x256_pf3E,64,256,,,,,3.0,397.7966,37.19388888888885,0.00%,14.17,7087.19
2026-01-12 04:46:36,9,32,7168,512,256,8,ActivationType.Gelu,torch.bfloat16,torch.float8_e4m3fnuz,torch.float8_e4m3fnuz,QuantType.per_Token,1,1,asm,stage1,128,_ZN5aiter53fmoe_stage1_bf16_pertokenFp8_doweight_g1u1_128x64_pf3E,128,64,,,,,3.0,400.5532,37.19388888888885,0.00%,14.07,7038.42
2026-01-12 04:46:36,9,32,7168,512,256,8,ActivationType.Gelu,torch.bfloat16,torch.float8_e4m3fnuz,torch.float8_e4m3fnuz,QuantType.per_Token,1,1,ck,stage2,128,moe_ck2stages_gemm2_256x128x64x128_1x4_MulABScaleExpertWeight_v1_Nswizzle0_Quant2_MulRoutedWeight0_F8_F8_B16,128,64,128.0,256.0,1.0,4.0,1.0,400.8345,37.19388888888885,0.01%,14.06,7033.48
2026-01-12 04:46:36,9,32,7168,512,256,8,ActivationType.Gelu,torch.bfloat16,torch.float8_e4m3fnuz,torch.float8_e4m3fnuz,QuantType.per_Token,1,1,asm,stage1,64,_ZN5aiter53fmoe_stage1_bf16_pertokenFp8_doweight_g1u1_64x256_pf2E,64,256,,,,,2.0,405.6506,37.19388888888885,0.00%,13.9,6949.97
2026-01-12 04:46:36,9,32,7168,512,256,8,ActivationType.Gelu,torch.bfloat16,torch.float8_e4m3fnuz,torch.float8_e4m3fnuz,QuantType.per_Token,1,1,ck,stage1,64,moe_ck2stages_gemm1_256x64x64x128_1x4_MulABScale_v1_Nswizzle0_Quant2_MulRoutedWeight1_gelu_F8_F8_B16,64,64,128.0,256.0,1.0,4.0,1.0,412.781,37.19388888888885,16.60%,13.66,6829.92
2026-01-12 04:46:36,9,32,7168,512,256,8,ActivationType.Gelu,torch.bfloat16,torch.float8_e4m3fnuz,torch.float8_e4m3fnuz,QuantType.per_Token,1,1,asm,stage1,128,_ZN5aiter54fmoe_stage1_bf16_pertokenFp8_doweight_g1u1_128x128_pf3E,128,128,,,,,3.0,414.6134,37.19388888888885,0.00%,13.6,6799.73
2026-01-12 04:46:36,9,32,7168,512,256,8,ActivationType.Gelu,torch.bfloat16,torch.float8_e4m3fnuz,torch.float8_e4m3fnuz,QuantType.per_Token,1,1,asm,stage1,128,_ZN5aiter54fmoe_stage1_bf16_pertokenFp8_doweight_g1u1_128x128_pf2E,128,128,,,,,2.0,414.8095,37.19388888888885,0.00%,13.59,6796.52
2026-01-12 04:46:36,9,32,7168,512,256,8,ActivationType.Gelu,torch.bfloat16,torch.float8_e4m3fnuz,torch.float8_e4m3fnuz,QuantType.per_Token,1,1,ck,stage2,128,moe_ck2stages_gemm2_256x128x128x64_1x4_MulABScaleExpertWeight_v3_Nswizzle0_Quant2_MulRoutedWeight0_F8_F8_B16,128,128,64.0,256.0,1.0,4.0,3.0,417.398,37.19388888888885,98.57%,13.51,6754.37
2026-01-12 04:46:36,9,32,7168,512,256,8,ActivationType.Gelu,torch.bfloat16,torch.float8_e4m3fnuz,torch.float8_e4m3fnuz,QuantType.per_Token,1,1,asm,stage1,128,_ZN5aiter53fmoe_stage1_bf16_pertokenFp8_doweight_g1u1_128x64_pf2E,128,64,,,,,2.0,437.507,37.19388888888885,0.00%,12.88,6443.92
2026-01-12 04:46:36,9,32,7168,512,256,8,ActivationType.Gelu,torch.bfloat16,torch.float8_e4m3fnuz,torch.float8_e4m3fnuz,QuantType.per_Token,1,1,ck,stage1,128,moe_ck2stages_gemm1_256x128x128x256_1x4_MulABScale_v3_Nswizzle0_Quant2_MulRoutedWeight1_gelu_F8_F8_B16,128,128,256.0,256.0,1.0,4.0,3.0,437.5566,37.19388888888885,0.00%,12.88,6443.19
2026-01-12 04:46:36,9,32,7168,512,256,8,ActivationType.Gelu,torch.bfloat16,torch.float8_e4m3fnuz,torch.float8_e4m3fnuz,QuantType.per_Token,1,1,ck,stage1,128,moe_ck2stages_gemm1_256x128x128x128_1x4_MulABScale_v3_Nswizzle0_Quant2_MulRoutedWeight1_gelu_F8_F8_B16,128,128,128.0,256.0,1.0,4.0,3.0,440.495,37.19388888888885,0.00%,12.8,6400.21
2026-01-12 04:46:36,9,32,7168,512,256,8,ActivationType.Gelu,torch.bfloat16,torch.float8_e4m3fnuz,torch.float8_e4m3fnuz,QuantType.per_Token,1,1,ck,stage2,128,moe_ck2stages_gemm2_256x128x64x64_1x4_MulABScaleExpertWeight_v3_Nswizzle0_Quant2_MulRoutedWeight0_F8_F8_B16,128,64,64.0,256.0,1.0,4.0,3.0,442.6511,37.19388888888885,98.57%,12.73,6369.04
2026-01-12 04:46:36,9,32,7168,512,256,8,ActivationType.Gelu,torch.bfloat16,torch.float8_e4m3fnuz,torch.float8_e4m3fnuz,QuantType.per_Token,1,1,asm,asm_1stage,32,_ZN5aiter53fmoe_bf16_pertokenFp8_g1u1_vs_tkw1_gelu_1tg_ps_32x512E,32,512,,,,,,450.4824,0.0,0.00%,12.51,6258.31
2026-01-12 04:46:36,9,32,7168,512,256,8,ActivationType.Gelu,torch.bfloat16,torch.float8_e4m3fnuz,torch.float8_e4m3fnuz,QuantType.per_Token,1,1,asm,asm_1stage,32,_ZN5aiter50fmoe_bf16_pertokenFp8_g1u1_vs_tkw1_gelu_1tg_32x512E,32,512,,,,,,453.6971,0.0,0.00%,12.42,6213.97
2026-01-12 04:46:36,9,32,7168,512,256,8,ActivationType.Gelu,torch.bfloat16,torch.float8_e4m3fnuz,torch.float8_e4m3fnuz,QuantType.per_Token,1,1,asm,asm_1stage,32,_ZN5aiter50fmoe_bf16_pertokenFp8_g1u1_vs_tkw1_gelu_1tg_32x128E,32,128,,,,,,542.0892,0.0,0.00%,10.4,5200.73
2026-01-12 04:46:36,9,32,7168,512,256,8,ActivationType.Gelu,torch.bfloat16,torch.float8_e4m3fnuz,torch.float8_e4m3fnuz,QuantType.per_Token,1,1,asm,asm_1stage,32,_ZN5aiter50fmoe_bf16_pertokenFp8_g1u1_vs_tkw1_gelu_1tg_32x256E,32,256,,,,,,551.6959,0.0,0.00%,10.22,5110.17
2026-01-12 04:46:36,9,32,7168,512,256,8,ActivationType.Gelu,torch.bfloat16,torch.float8_e4m3fnuz,torch.float8_e4m3fnuz,QuantType.per_Token,1,1,asm,asm_1stage,32,_ZN5aiter53fmoe_bf16_pertokenFp8_g1u1_vs_tkw1_gelu_1tg_ps_32x128E,32,128,,,,,,552.6133,0.0,0.00%,10.2,5101.69
2026-01-12 04:46:36,9,32,7168,512,256,8,ActivationType.Gelu,torch.bfloat16,torch.float8_e4m3fnuz,torch.float8_e4m3fnuz,QuantType.per_Token,1,1,asm,asm_1stage,32,_ZN5aiter53fmoe_bf16_pertokenFp8_g1u1_vs_tkw1_gelu_1tg_ps_32x256E,32,256,,,,,,557.6096,0.0,0.00%,10.11,5055.98
2026-01-12 04:46:36,9,32,7168,512,256,8,ActivationType.Gelu,torch.bfloat16,torch.float8_e4m3fnuz,torch.float8_e4m3fnuz,QuantType.per_Token,1,1,ck,stage1,32,moe_ck2stages_gemm1_256x32x64x256_1x4_MulABScale_v1_Nswizzle0_Quant2_MulRoutedWeight1_gelu_F8_F8_B16,32,64,256.0,256.0,1.0,4.0,1.0,772.4719,37.19388888888885,16.60%,7.3,3649.66
2026-01-12 04:46:36,9,32,7168,512,256,8,ActivationType.Gelu,torch.bfloat16,torch.float8_e4m3fnuz,torch.float8_e4m3fnuz,QuantType.per_Token,1,1,ck,stage1,64,moe_ck2stages_gemm1_256x64x64x256_1x4_MulABScale_v1_Nswizzle0_Quant2_MulRoutedWeight1_gelu_F8_F8_B16,64,64,256.0,256.0,1.0,4.0,1.0,2954.0362,37.19388888888885,16.60%,1.91,954.38
2026-01-12 04:46:36,9,32,7168,512,256,8,ActivationType.Gelu,torch.bfloat16,torch.float8_e4m3fnuz,torch.float8_e4m3fnuz,QuantType.per_Token,1,1,ck,stage1,128,moe_ck2stages_gemm1_256x128x64x128_1x4_MulABScale_v1_Nswizzle0_Quant2_MulRoutedWeight1_gelu_F8_F8_B16,128,64,128.0,256.0,1.0,4.0,1.0,3759.0768,37.19388888888885,16.60%,1.5,749.99
2026-01-12 04:46:48,10,32,7168,256,256,8,ActivationType.Silu,torch.bfloat16,torch.float8_e4m3fnuz,torch.float8_e4m3fnuz,QuantType.per_1x128,1,1,ck,stage2,16,moe_ck2stages_gemm2_256x16x128x256_1x4_MulABScaleExpertWeightA8W8blkscale_v1_Nswizzle0_Quant4_MulRoutedWeight0_F8_F8_B16,16,128,256.0,256.0,1.0,4.0,1.0,87.8298,40.2291111111111,16.55%,32.09,16053.48
2026-01-12 04:46:48,10,32,7168,256,256,8,ActivationType.Silu,torch.bfloat16,torch.float8_e4m3fnuz,torch.float8_e4m3fnuz,QuantType.per_1x128,1,1,ck,stage1,16,moe_ck2stages_gemm1_256x16x128x256_1x4_MulABScaleExpertWeightA8W8blkscale_v1_Nswizzle0_Quant4_MulRoutedWeight1_silu_F8_F8_B16,16,128,256.0,256.0,1.0,4.0,1.0,176.1578,40.2291111111111,0.02%,16.0,8004.04
2026-01-12 04:46:48,10,32,7168,256,256,8,ActivationType.Silu,torch.bfloat16,torch.float8_e4m3fnuz,torch.float8_e4m3fnuz,QuantType.per_1x128,1,1,ck,stage1,64,moe_ck2stages_gemm1_256x64x128x128_1x4_MulABScaleExpertWeightA8W8blkscale_v3_Nswizzle0_Quant4_MulRoutedWeight1_silu_F8_F8_B16,64,128,128.0,256.0,1.0,4.0,3.0,242.7419,40.2291111111111,0.02%,11.61,5808.53
2026-01-12 04:46:48,10,32,7168,256,256,8,ActivationType.Silu,torch.bfloat16,torch.float8_e4m3fnuz,torch.float8_e4m3fnuz,QuantType.per_1x128,1,1,ck,stage2,64,moe_ck2stages_gemm2_256x64x128x128_1x4_MulABScaleExpertWeightA8W8blkscale_v3_Nswizzle0_Quant4_MulRoutedWeight0_F8_F8_B16,64,128,128.0,256.0,1.0,4.0,3.0,294.0887,40.2291111111111,16.58%,9.58,4794.38
2026-01-12 04:47:00,11,32,7168,256,256,8,ActivationType.Gelu,torch.bfloat16,torch.float8_e4m3fnuz,torch.float8_e4m3fnuz,QuantType.per_1x128,1,1,ck,stage2,16,moe_ck2stages_gemm2_256x16x128x256_1x4_MulABScaleExpertWeightA8W8blkscale_v1_Nswizzle0_Quant4_MulRoutedWeight0_F8_F8_B16,16,128,256.0,256.0,1.0,4.0,1.0,90.2583,40.042333333333296,16.58%,31.23,15621.55
2026-01-12 04:47:00,11,32,7168,256,256,8,ActivationType.Gelu,torch.bfloat16,torch.float8_e4m3fnuz,torch.float8_e4m3fnuz,QuantType.per_1x128,1,1,ck,stage1,16,moe_ck2stages_gemm1_256x16x128x256_1x4_MulABScaleExpertWeightA8W8blkscale_v1_Nswizzle0_Quant4_MulRoutedWeight1_gelu_F8_F8_B16,16,128,256.0,256.0,1.0,4.0,1.0,175.9286,40.042333333333296,0.02%,16.02,8014.47
2026-01-12 04:47:00,11,32,7168,256,256,8,ActivationType.Gelu,torch.bfloat16,torch.float8_e4m3fnuz,torch.float8_e4m3fnuz,QuantType.per_1x128,1,1,ck,stage1,64,moe_ck2stages_gemm1_256x64x128x128_1x4_MulABScaleExpertWeightA8W8blkscale_v3_Nswizzle0_Quant4_MulRoutedWeight1_gelu_F8_F8_B16,64,128,128.0,256.0,1.0,4.0,3.0,242.1162,40.042333333333296,0.02%,11.64,5823.54
2026-01-12 04:47:00,11,32,7168,256,256,8,ActivationType.Gelu,torch.bfloat16,torch.float8_e4m3fnuz,torch.float8_e4m3fnuz,QuantType.per_1x128,1,1,ck,stage2,64,moe_ck2stages_gemm2_256x64x128x128_1x4_MulABScaleExpertWeightA8W8blkscale_v3_Nswizzle0_Quant4_MulRoutedWeight0_F8_F8_B16,64,128,128.0,256.0,1.0,4.0,3.0,294.2959,40.042333333333296,16.54%,9.58,4791.01
2026-01-12 04:47:30,12,32,7168,256,256,8,ActivationType.Silu,torch.bfloat16,torch.float8_e4m3fnuz,torch.float8_e4m3fnuz,QuantType.per_Tensor,1,0,ck,stage2,32,moe_ck2stages_gemm2_256x32x64x256_1x4_MulABScaleExpertWeight_v1_Nswizzle0_Quant1_MulRoutedWeight1_F8_F8_B16,32,64,256.0,256.0,1.0,4.0,1.0,89.446,48.07911111111105,1.26%,31.51,15763.41
2026-01-12 04:47:30,12,32,7168,256,256,8,ActivationType.Silu,torch.bfloat16,torch.float8_e4m3fnuz,torch.float8_e4m3fnuz,QuantType.per_Tensor,1,0,ck,stage2,32,moe_ck2stages_gemm2_256x32x64x128_1x4_MulABScaleExpertWeight_v1_Nswizzle0_Quant1_MulRoutedWeight1_F8_F8_B16,32,64,128.0,256.0,1.0,4.0,1.0,90.2832,48.07911111111105,1.28%,31.22,15617.24
2026-01-12 04:47:30,12,32,7168,256,256,8,ActivationType.Silu,torch.bfloat16,torch.float8_e4m3fnuz,torch.float8_e4m3fnuz,QuantType.per_Tensor,1,0,ck,stage2,64,moe_ck2stages_gemm2_256x64x128x256_1x4_MulABScaleExpertWeight_v3_Nswizzle0_Quant1_MulRoutedWeight1_F8_F8_B16,64,128,256.0,256.0,1.0,4.0,3.0,98.7069,48.07911111111105,1.26%,28.55,14284.46
2026-01-12 04:47:30,12,32,7168,256,256,8,ActivationType.Silu,torch.bfloat16,torch.float8_e4m3fnuz,torch.float8_e4m3fnuz,QuantType.per_Tensor,1,0,ck,stage2,32,moe_ck2stages_gemm2_256x32x64x64_1x4_MulABScaleExpertWeight_v1_Nswizzle0_Quant1_MulRoutedWeight1_F8_F8_B16,32,64,64.0,256.0,1.0,4.0,1.0,104.1182,48.07911111111105,99.38%,27.07,13542.05
2026-01-12 04:47:30,12,32,7168,256,256,8,ActivationType.Silu,torch.bfloat16,torch.float8_e4m3fnuz,torch.float8_e4m3fnuz,QuantType.per_Tensor,1,0,ck,stage2,64,moe_ck2stages_gemm2_256x64x64x256_1x4_MulABScaleExpertWeight_v1_Nswizzle0_Quant1_MulRoutedWeight1_F8_F8_B16,64,64,256.0,256.0,1.0,4.0,1.0,123.6646,48.07911111111105,1.27%,22.79,11401.6
2026-01-12 04:47:30,12,32,7168,256,256,8,ActivationType.Silu,torch.bfloat16,torch.float8_e4m3fnuz,torch.float8_e4m3fnuz,QuantType.per_Tensor,1,0,ck,stage2,64,moe_ck2stages_gemm2_256x64x128x128_1x4_MulABScaleExpertWeight_v3_Nswizzle0_Quant1_MulRoutedWeight1_F8_F8_B16,64,128,128.0,256.0,1.0,4.0,3.0,136.184,48.07911111111105,1.26%,20.7,10353.45
2026-01-12 04:47:30,12,32,7168,256,256,8,ActivationType.Silu,torch.bfloat16,torch.float8_e4m3fnuz,torch.float8_e4m3fnuz,QuantType.per_Tensor,1,0,asm,stage1,16,_ZN5aiter48fmoe_stage1_bf16_pertokenFp8_g1u1_16x128_4tg_pf2E,16,128,,,,,2.0,160.8723,48.07911111111105,0.00%,17.52,8764.56
2026-01-12 04:47:30,12,32,7168,256,256,8,ActivationType.Silu,torch.bfloat16,torch.float8_e4m3fnuz,torch.float8_e4m3fnuz,QuantType.per_Tensor,1,0,asm,stage1,16,_ZN5aiter47fmoe_stage1_bf16_pertokenFp8_g1u1_16x64_6tg_pf2E,16,64,,,,,2.0,160.928,48.07911111111105,0.00%,17.51,8761.52
2026-01-12 04:47:30,12,32,7168,256,256,8,ActivationType.Silu,torch.bfloat16,torch.float8_e4m3fnuz,torch.float8_e4m3fnuz,QuantType.per_Tensor,1,0,asm,stage1,16,_ZN5aiter48fmoe_stage1_bf16_pertokenFp8_g1u1_16x256_2tg_pf3E,16,256,,,,,3.0,161.2895,48.07911111111105,0.00%,17.48,8741.89
2026-01-12 04:47:30,12,32,7168,256,256,8,ActivationType.Silu,torch.bfloat16,torch.float8_e4m3fnuz,torch.float8_e4m3fnuz,QuantType.per_Tensor,1,0,asm,stage1,16,_ZN5aiter48fmoe_stage1_bf16_pertokenFp8_g1u1_16x256_3tg_pf2E,16,256,,,,,2.0,161.9083,48.07911111111105,0.00%,17.41,8708.47
2026-01-12 04:47:30,12,32,7168,256,256,8,ActivationType.Silu,torch.bfloat16,torch.float8_e4m3fnuz,torch.float8_e4m3fnuz,QuantType.per_Tensor,1,0,asm,stage1,32,_ZN5aiter47fmoe_stage1_bf16_pertokenFp8_g1u1_32x64_4tg_pf2E,32,64,,,,,2.0,162.3732,48.07911111111105,0.00%,17.36,8683.54
2026-01-12 04:47:30,12,32,7168,256,256,8,ActivationType.Silu,torch.bfloat16,torch.float8_e4m3fnuz,torch.float8_e4m3fnuz,QuantType.per_Tensor,1,0,asm,stage1,32,_ZN5aiter48fmoe_stage1_bf16_pertokenFp8_g1u1_32x128_3tg_pf2E,32,128,,,,,2.0,162.9146,48.07911111111105,0.00%,17.3,8654.68
2026-01-12 04:47:30,12,32,7168,256,256,8,ActivationType.Silu,torch.bfloat16,torch.float8_e4m3fnuz,torch.float8_e4m3fnuz,QuantType.per_Tensor,1,0,asm,stage1,32,_ZN5aiter48fmoe_stage1_bf16_pertokenFp8_g1u1_32x256_2tg_pf3E,32,256,,,,,3.0,163.0248,48.07911111111105,0.00%,17.29,8648.83
2026-01-12 04:47:30,12,32,7168,256,256,8,ActivationType.Silu,torch.bfloat16,torch.float8_e4m3fnuz,torch.float8_e4m3fnuz,QuantType.per_Tensor,1,0,asm,stage1,32,_ZN5aiter48fmoe_stage1_bf16_pertokenFp8_g1u1_32x256_2tg_pf2E,32,256,,,,,2.0,164.2302,48.07911111111105,0.00%,17.16,8585.35
2026-01-12 04:47:30,12,32,7168,256,256,8,ActivationType.Silu,torch.bfloat16,torch.float8_e4m3fnuz,torch.float8_e4m3fnuz,QuantType.per_Tensor,1,0,ck,stage2,64,moe_ck2stages_gemm2_256x64x64x64_1x4_MulABScaleExpertWeight_v1_Nswizzle0_Quant1_MulRoutedWeight1_F8_F8_B16,64,64,64.0,256.0,1.0,4.0,1.0,165.2655,48.07911111111105,99.38%,17.05,8531.57
2026-01-12 04:47:30,12,32,7168,256,256,8,ActivationType.Silu,torch.bfloat16,torch.float8_e4m3fnuz,torch.float8_e4m3fnuz,QuantType.per_Tensor,1,0,asm,stage1,64,_ZN5aiter47fmoe_stage1_bf16_pertokenFp8_g1u1_64x64_3tg_pf2E,64,64,,,,,2.0,165.4517,48.07911111111105,0.00%,17.04,8521.97
2026-01-12 04:47:30,12,32,7168,256,256,8,ActivationType.Silu,torch.bfloat16,torch.float8_e4m3fnuz,torch.float8_e4m3fnuz,QuantType.per_Tensor,1,0,asm,stage1,64,_ZN5aiter48fmoe_stage1_bf16_pertokenFp8_g1u1_64x128_2tg_pf2E,64,128,,,,,2.0,167.1712,48.07911111111105,0.00%,16.86,8434.31
2026-01-12 04:47:30,12,32,7168,256,256,8,ActivationType.Silu,torch.bfloat16,torch.float8_e4m3fnuz,torch.float8_e4m3fnuz,QuantType.per_Tensor,1,0,asm,stage1,16,_ZN5aiter47fmoe_stage1_bf16_pertokenFp8_g1u1_16x64_5tg_pf3E,16,64,,,,,3.0,167.437,48.07911111111105,8.90%,16.83,8420.92
2026-01-12 04:47:30,12,32,7168,256,256,8,ActivationType.Silu,torch.bfloat16,torch.float8_e4m3fnuz,torch.float8_e4m3fnuz,QuantType.per_Tensor,1,0,asm,stage1,64,_ZN5aiter44fmoe_stage1_bf16_pertokenFp8_g1u1_64x256_pf2E,64,256,,,,,2.0,168.6534,48.07911111111105,0.00%,16.71,8360.19
2026-01-12 04:47:30,12,32,7168,256,256,8,ActivationType.Silu,torch.bfloat16,torch.float8_e4m3fnuz,torch.float8_e4m3fnuz,QuantType.per_Tensor,1,0,asm,stage1,32,_ZN5aiter47fmoe_stage1_bf16_pertokenFp8_g1u1_32x64_4tg_pf3E,32,64,,,,,3.0,169.553,48.07911111111105,1.67%,16.62,8315.83
2026-01-12 04:47:30,12,32,7168,256,256,8,ActivationType.Silu,torch.bfloat16,torch.float8_e4m3fnuz,torch.float8_e4m3fnuz,QuantType.per_Tensor,1,0,asm,stage1,64,_ZN5aiter44fmoe_stage1_bf16_pertokenFp8_g1u1_64x256_pf3E,64,256,,,,,3.0,170.3394,48.07911111111105,0.00%,16.55,8277.44
2026-01-12 04:47:30,12,32,7168,256,256,8,ActivationType.Silu,torch.bfloat16,torch.float8_e4m3fnuz,torch.float8_e4m3fnuz,QuantType.per_Tensor,1,0,asm,stage1,16,_ZN5aiter48fmoe_stage1_bf16_pertokenFp8_g1u1_16x128_4tg_pf3E,16,128,,,,,3.0,176.6297,48.07911111111105,0.00%,15.96,7982.66
2026-01-12 04:47:30,12,32,7168,256,256,8,ActivationType.Silu,torch.bfloat16,torch.float8_e4m3fnuz,torch.float8_e4m3fnuz,QuantType.per_Tensor,1,0,ck,stage2,64,moe_ck2stages_gemm2_256x64x128x64_1x4_MulABScaleExpertWeight_v3_Nswizzle0_Quant1_MulRoutedWeight1_F8_F8_B16,64,128,64.0,256.0,1.0,4.0,3.0,178.9568,48.07911111111105,99.38%,15.75,7878.85
2026-01-12 04:47:30,12,32,7168,256,256,8,ActivationType.Silu,torch.bfloat16,torch.float8_e4m3fnuz,torch.float8_e4m3fnuz,QuantType.per_Tensor,1,0,ck,stage2,128,moe_ck2stages_gemm2_256x128x64x128_1x4_MulABScaleExpertWeight_v1_Nswizzle0_Quant1_MulRoutedWeight1_F8_F8_B16,128,64,128.0,256.0,1.0,4.0,1.0,180.2419,48.07911111111105,1.27%,15.64,7822.68
2026-01-12 04:47:30,12,32,7168,256,256,8,ActivationType.Silu,torch.bfloat16,torch.float8_e4m3fnuz,torch.float8_e4m3fnuz,QuantType.per_Tensor,1,0,asm,stage1,32,_ZN5aiter48fmoe_stage1_bf16_pertokenFp8_g1u1_32x128_3tg_pf3E,32,128,,,,,3.0,180.6231,48.07911111111105,0.00%,15.6,7806.17
2026-01-12 04:47:30,12,32,7168,256,256,8,ActivationType.Silu,torch.bfloat16,torch.float8_e4m3fnuz,torch.float8_e4m3fnuz,QuantType.per_Tensor,1,0,ck,stage1,32,moe_ck2stages_gemm1_256x32x64x128_1x4_MulABScale_v1_Nswizzle0_Quant1_MulRoutedWeight0_silu_F8_F8_B16,32,64,128.0,256.0,1.0,4.0,1.0,184.8891,48.07911111111105,96.63%,15.24,7626.05
2026-01-12 04:47:30,12,32,7168,256,256,8,ActivationType.Silu,torch.bfloat16,torch.float8_e4m3fnuz,torch.float8_e4m3fnuz,QuantType.per_Tensor,1,0,ck,stage2,128,moe_ck2stages_gemm2_256x128x128x128_1x4_MulABScaleExpertWeight_v3_Nswizzle0_Quant1_MulRoutedWeight1_F8_F8_B16,128,128,128.0,256.0,1.0,4.0,3.0,195.8879,48.07911111111105,1.27%,14.39,7197.86
2026-01-12 04:47:30,12,32,7168,256,256,8,ActivationType.Silu,torch.bfloat16,torch.float8_e4m3fnuz,torch.float8_e4m3fnuz,QuantType.per_Tensor,1,0,ck,stage1,64,moe_ck2stages_gemm1_256x64x128x128_1x4_MulABScale_v3_Nswizzle0_Quant1_MulRoutedWeight0_silu_F8_F8_B16,64,128,128.0,256.0,1.0,4.0,3.0,196.7825,48.07911111111105,0.00%,14.32,7165.14
2026-01-12 04:47:30,12,32,7168,256,256,8,ActivationType.Silu,torch.bfloat16,torch.float8_e4m3fnuz,torch.float8_e4m3fnuz,QuantType.per_Tensor,1,0,asm,stage1,64,_ZN5aiter48fmoe_stage1_bf16_pertokenFp8_g1u1_64x128_2tg_pf3E,64,128,,,,,3.0,198.529,48.07911111111105,0.00%,14.2,7102.11
2026-01-12 04:47:30,12,32,7168,256,256,8,ActivationType.Silu,torch.bfloat16,torch.float8_e4m3fnuz,torch.float8_e4m3fnuz,QuantType.per_Tensor,1,0,asm,stage1,64,_ZN5aiter47fmoe_stage1_bf16_pertokenFp8_g1u1_64x64_2tg_pf3E,64,64,,,,,3.0,202.5029,48.07911111111105,0.03%,13.92,6962.74
2026-01-12 04:47:30,12,32,7168,256,256,8,ActivationType.Silu,torch.bfloat16,torch.float8_e4m3fnuz,torch.float8_e4m3fnuz,QuantType.per_Tensor,1,0,ck,stage1,64,moe_ck2stages_gemm1_256x64x128x256_1x4_MulABScale_v3_Nswizzle0_Quant1_MulRoutedWeight0_silu_F8_F8_B16,64,128,256.0,256.0,1.0,4.0,3.0,207.7902,48.07911111111105,0.00%,13.56,6785.57
2026-01-12 04:47:30,12,32,7168,256,256,8,ActivationType.Silu,torch.bfloat16,torch.float8_e4m3fnuz,torch.float8_e4m3fnuz,QuantType.per_Tensor,1,0,asm,stage1,128,_ZN5aiter44fmoe_stage1_bf16_pertokenFp8_g1u1_128x64_pf3E,128,64,,,,,3.0,227.2696,48.07911111111105,0.00%,12.4,6203.97
2026-01-12 04:47:30,12,32,7168,256,256,8,ActivationType.Silu,torch.bfloat16,torch.float8_e4m3fnuz,torch.float8_e4m3fnuz,QuantType.per_Tensor,1,0,asm,stage1,128,_ZN5aiter44fmoe_stage1_bf16_pertokenFp8_g1u1_128x64_pf2E,128,64,,,,,2.0,258.3827,48.07911111111105,0.00%,10.91,5456.92
2026-01-12 04:47:30,12,32,7168,256,256,8,ActivationType.Silu,torch.bfloat16,torch.float8_e4m3fnuz,torch.float8_e4m3fnuz,QuantType.per_Tensor,1,0,ck,stage1,64,moe_ck2stages_gemm1_256x64x64x128_1x4_MulABScale_v1_Nswizzle0_Quant1_MulRoutedWeight0_silu_F8_F8_B16,64,64,128.0,256.0,1.0,4.0,1.0,258.8816,48.07911111111105,96.63%,10.89,5446.41
2026-01-12 04:47:30,12,32,7168,256,256,8,ActivationType.Silu,torch.bfloat16,torch.float8_e4m3fnuz,torch.float8_e4m3fnuz,QuantType.per_Tensor,1,0,ck,stage2,128,moe_ck2stages_gemm2_256x128x128x64_1x4_MulABScaleExpertWeight_v3_Nswizzle0_Quant1_MulRoutedWeight1_F8_F8_B16,128,128,64.0,256.0,1.0,4.0,3.0,261.0779,48.07911111111105,99.38%,10.8,5400.59
2026-01-12 04:47:30,12,32,7168,256,256,8,ActivationType.Silu,torch.bfloat16,torch.float8_e4m3fnuz,torch.float8_e4m3fnuz,QuantType.per_Tensor,1,0,asm,stage1,128,_ZN5aiter45fmoe_stage1_bf16_pertokenFp8_g1u1_128x128_pf2E,128,128,,,,,2.0,264.3927,48.07911111111105,0.00%,10.66,5332.88
2026-01-12 04:47:30,12,32,7168,256,256,8,ActivationType.Silu,torch.bfloat16,torch.float8_e4m3fnuz,torch.float8_e4m3fnuz,QuantType.per_Tensor,1,0,asm,stage1,128,_ZN5aiter45fmoe_stage1_bf16_pertokenFp8_g1u1_128x128_pf3E,128,128,,,,,3.0,264.6111,48.07911111111105,0.00%,10.65,5328.48
2026-01-12 04:47:30,12,32,7168,256,256,8,ActivationType.Silu,torch.bfloat16,torch.float8_e4m3fnuz,torch.float8_e4m3fnuz,QuantType.per_Tensor,1,0,ck,stage2,128,moe_ck2stages_gemm2_256x128x64x64_1x4_MulABScaleExpertWeight_v3_Nswizzle0_Quant1_MulRoutedWeight1_F8_F8_B16,128,64,64.0,256.0,1.0,4.0,3.0,264.7319,48.07911111111105,99.38%,10.65,5326.05
2026-01-12 04:47:30,12,32,7168,256,256,8,ActivationType.Silu,torch.bfloat16,torch.float8_e4m3fnuz,torch.float8_e4m3fnuz,QuantType.per_Tensor,1,0,ck,stage1,128,moe_ck2stages_gemm1_256x128x128x256_1x4_MulABScale_v3_Nswizzle0_Quant1_MulRoutedWeight0_silu_F8_F8_B16,128,128,256.0,256.0,1.0,4.0,3.0,275.4955,48.07911111111105,0.00%,10.23,5117.96
2026-01-12 04:47:30,12,32,7168,256,256,8,ActivationType.Silu,torch.bfloat16,torch.float8_e4m3fnuz,torch.float8_e4m3fnuz,QuantType.per_Tensor,1,0,ck,stage1,128,moe_ck2stages_gemm1_256x128x128x128_1x4_MulABScale_v3_Nswizzle0_Quant1_MulRoutedWeight0_silu_F8_F8_B16,128,128,128.0,256.0,1.0,4.0,3.0,275.5597,48.07911111111105,0.00%,10.23,5116.77
2026-01-12 04:47:30,12,32,7168,256,256,8,ActivationType.Silu,torch.bfloat16,torch.float8_e4m3fnuz,torch.float8_e4m3fnuz,QuantType.per_Tensor,1,0,ck,stage1,32,moe_ck2stages_gemm1_256x32x64x256_1x4_MulABScale_v1_Nswizzle0_Quant1_MulRoutedWeight0_silu_F8_F8_B16,32,64,256.0,256.0,1.0,4.0,1.0,461.8342,48.07911111111105,96.63%,6.1,3052.99
2026-01-12 04:47:30,12,32,7168,256,256,8,ActivationType.Silu,torch.bfloat16,torch.float8_e4m3fnuz,torch.float8_e4m3fnuz,QuantType.per_Tensor,1,0,ck,stage1,64,moe_ck2stages_gemm1_256x64x64x256_1x4_MulABScale_v1_Nswizzle0_Quant1_MulRoutedWeight0_silu_F8_F8_B16,64,64,256.0,256.0,1.0,4.0,1.0,1840.8936,48.07911111111105,96.63%,1.53,765.92
2026-01-12 04:47:30,12,32,7168,256,256,8,ActivationType.Silu,torch.bfloat16,torch.float8_e4m3fnuz,torch.float8_e4m3fnuz,QuantType.per_Tensor,1,0,ck,stage1,128,moe_ck2stages_gemm1_256x128x64x128_1x4_MulABScale_v1_Nswizzle0_Quant1_MulRoutedWeight0_silu_F8_F8_B16,128,64,128.0,256.0,1.0,4.0,1.0,2320.2366,48.07911111111105,96.63%,1.21,607.69
2026-01-12 04:47:30,12,32,7168,256,256,8,ActivationType.Silu,torch.bfloat16,torch.float8_e4m3fnuz,torch.float8_e4m3fnuz,QuantType.per_Tensor,1,0,asm,stage1,16,_ZN5aiter48fmoe_stage1_bf16_pertokenFp8_g1u1_16x512_2tg_pf2E,16,512,,,,,2.0,inf,48.07911111111105,failed,0.0,0.0
2026-01-12 04:47:30,12,32,7168,256,256,8,ActivationType.Silu,torch.bfloat16,torch.float8_e4m3fnuz,torch.float8_e4m3fnuz,QuantType.per_Tensor,1,0,asm,stage1,16,_ZN5aiter44fmoe_stage1_bf16_pertokenFp8_g1u1_16x512_pf3E,16,512,,,,,3.0,inf,48.07911111111105,failed,0.0,0.0
2026-01-12 04:47:30,12,32,7168,256,256,8,ActivationType.Silu,torch.bfloat16,torch.float8_e4m3fnuz,torch.float8_e4m3fnuz,QuantType.per_Tensor,1,0,asm,stage1,32,_ZN5aiter44fmoe_stage1_bf16_pertokenFp8_g1u1_32x512_pf2E,32,512,,,,,2.0,inf,48.07911111111105,failed,0.0,0.0
2026-01-12 04:47:30,12,32,7168,256,256,8,ActivationType.Silu,torch.bfloat16,torch.float8_e4m3fnuz,torch.float8_e4m3fnuz,QuantType.per_Tensor,1,0,asm,stage1,32,_ZN5aiter44fmoe_stage1_bf16_pertokenFp8_g1u1_32x512_pf3E,32,512,,,,,3.0,inf,48.07911111111105,failed,0.0,0.0
2026-01-12 04:48:01,13,32,7168,256,256,8,ActivationType.Gelu,torch.bfloat16,torch.float8_e4m3fnuz,torch.float8_e4m3fnuz,QuantType.per_Tensor,1,0,ck,stage2,32,moe_ck2stages_gemm2_256x32x64x256_1x4_MulABScaleExpertWeight_v1_Nswizzle0_Quant1_MulRoutedWeight1_F8_F8_B16,32,64,256.0,256.0,1.0,4.0,1.0,89.6775,48.41677777777768,1.56%,31.43,15722.72
2026-01-12 04:48:01,13,32,7168,256,256,8,ActivationType.Gelu,torch.bfloat16,torch.float8_e4m3fnuz,torch.float8_e4m3fnuz,QuantType.per_Tensor,1,0,ck,stage2,32,moe_ck2stages_gemm2_256x32x64x128_1x4_MulABScaleExpertWeight_v1_Nswizzle0_Quant1_MulRoutedWeight1_F8_F8_B16,32,64,128.0,256.0,1.0,4.0,1.0,90.4582,48.41677777777768,1.56%,31.16,15587.03
2026-01-12 04:48:01,13,32,7168,256,256,8,ActivationType.Gelu,torch.bfloat16,torch.float8_e4m3fnuz,torch.float8_e4m3fnuz,QuantType.per_Tensor,1,0,ck,stage2,64,moe_ck2stages_gemm2_256x64x128x256_1x4_MulABScaleExpertWeight_v3_Nswizzle0_Quant1_MulRoutedWeight1_F8_F8_B16,64,128,256.0,256.0,1.0,4.0,3.0,98.9125,48.41677777777768,1.57%,28.5,14254.76
2026-01-12 04:48:01,13,32,7168,256,256,8,ActivationType.Gelu,torch.bfloat16,torch.float8_e4m3fnuz,torch.float8_e4m3fnuz,QuantType.per_Tensor,1,0,ck,stage2,32,moe_ck2stages_gemm2_256x32x64x64_1x4_MulABScaleExpertWeight_v1_Nswizzle0_Quant1_MulRoutedWeight1_F8_F8_B16,32,64,64.0,256.0,1.0,4.0,1.0,104.4783,48.41677777777768,99.43%,26.98,13495.38
2026-01-12 04:48:01,13,32,7168,256,256,8,ActivationType.Gelu,torch.bfloat16,torch.float8_e4m3fnuz,torch.float8_e4m3fnuz,QuantType.per_Tensor,1,0,ck,stage2,64,moe_ck2stages_gemm2_256x64x64x256_1x4_MulABScaleExpertWeight_v1_Nswizzle0_Quant1_MulRoutedWeight1_F8_F8_B16,64,64,256.0,256.0,1.0,4.0,1.0,123.6207,48.41677777777768,1.56%,22.8,11405.65
2026-01-12 04:48:01,13,32,7168,256,256,8,ActivationType.Gelu,torch.bfloat16,torch.float8_e4m3fnuz,torch.float8_e4m3fnuz,QuantType.per_Tensor,1,0,ck,stage2,64,moe_ck2stages_gemm2_256x64x128x128_1x4_MulABScaleExpertWeight_v3_Nswizzle0_Quant1_MulRoutedWeight1_F8_F8_B16,64,128,128.0,256.0,1.0,4.0,3.0,136.2405,48.41677777777768,1.56%,20.69,10349.16
2026-01-12 04:48:01,13,32,7168,256,256,8,ActivationType.Gelu,torch.bfloat16,torch.float8_e4m3fnuz,torch.float8_e4m3fnuz,QuantType.per_Tensor,1,0,asm,stage1,16,_ZN5aiter47fmoe_stage1_bf16_pertokenFp8_g1u1_16x64_6tg_pf2E,16,64,,,,,2.0,160.8609,48.41677777777768,0.00%,17.52,8765.18
2026-01-12 04:48:01,13,32,7168,256,256,8,ActivationType.Gelu,torch.bfloat16,torch.float8_e4m3fnuz,torch.float8_e4m3fnuz,QuantType.per_Tensor,1,0,asm,stage1,16,_ZN5aiter48fmoe_stage1_bf16_pertokenFp8_g1u1_16x256_2tg_pf3E,16,256,,,,,3.0,161.6075,48.41677777777768,0.00%,17.44,8724.68
2026-01-12 04:48:01,13,32,7168,256,256,8,ActivationType.Gelu,torch.bfloat16,torch.float8_e4m3fnuz,torch.float8_e4m3fnuz,QuantType.per_Tensor,1,0,asm,stage1,16,_ZN5aiter48fmoe_stage1_bf16_pertokenFp8_g1u1_16x128_4tg_pf2E,16,128,,,,,2.0,161.632,48.41677777777768,0.00%,17.44,8723.36
2026-01-12 04:48:01,13,32,7168,256,256,8,ActivationType.Gelu,torch.bfloat16,torch.float8_e4m3fnuz,torch.float8_e4m3fnuz,QuantType.per_Tensor,1,0,asm,stage1,16,_ZN5aiter48fmoe_stage1_bf16_pertokenFp8_g1u1_16x256_3tg_pf2E,16,256,,,,,2.0,161.8894,48.41677777777768,0.00%,17.41,8709.49
2026-01-12 04:48:01,13,32,7168,256,256,8,ActivationType.Gelu,torch.bfloat16,torch.float8_e4m3fnuz,torch.float8_e4m3fnuz,QuantType.per_Tensor,1,0,asm,stage1,32,_ZN5aiter47fmoe_stage1_bf16_pertokenFp8_g1u1_32x64_4tg_pf2E,32,64,,,,,2.0,162.2722,48.41677777777768,0.00%,17.37,8688.95
2026-01-12 04:48:01,13,32,7168,256,256,8,ActivationType.Gelu,torch.bfloat16,torch.float8_e4m3fnuz,torch.float8_e4m3fnuz,QuantType.per_Tensor,1,0,asm,stage1,32,_ZN5aiter48fmoe_stage1_bf16_pertokenFp8_g1u1_32x256_2tg_pf3E,32,256,,,,,3.0,162.9557,48.41677777777768,0.00%,17.3,8652.5
2026-01-12 04:48:01,13,32,7168,256,256,8,ActivationType.Gelu,torch.bfloat16,torch.float8_e4m3fnuz,torch.float8_e4m3fnuz,QuantType.per_Tensor,1,0,asm,stage1,32,_ZN5aiter48fmoe_stage1_bf16_pertokenFp8_g1u1_32x128_3tg_pf2E,32,128,,,,,2.0,163.2731,48.41677777777768,0.00%,17.26,8635.68
2026-01-12 04:48:01,13,32,7168,256,256,8,ActivationType.Gelu,torch.bfloat16,torch.float8_e4m3fnuz,torch.float8_e4m3fnuz,QuantType.per_Tensor,1,0,asm,stage1,32,_ZN5aiter48fmoe_stage1_bf16_pertokenFp8_g1u1_32x256_2tg_pf2E,32,256,,,,,2.0,164.0782,48.41677777777768,0.00%,17.18,8593.31
2026-01-12 04:48:01,13,32,7168,256,256,8,ActivationType.Gelu,torch.bfloat16,torch.float8_e4m3fnuz,torch.float8_e4m3fnuz,QuantType.per_Tensor,1,0,ck,stage2,64,moe_ck2stages_gemm2_256x64x64x64_1x4_MulABScaleExpertWeight_v1_Nswizzle0_Quant1_MulRoutedWeight1_F8_F8_B16,64,64,64.0,256.0,1.0,4.0,1.0,165.3514,48.41677777777768,99.43%,17.05,8527.14
2026-01-12 04:48:01,13,32,7168,256,256,8,ActivationType.Gelu,torch.bfloat16,torch.float8_e4m3fnuz,torch.float8_e4m3fnuz,QuantType.per_Tensor,1,0,asm,stage1,64,_ZN5aiter47fmoe_stage1_bf16_pertokenFp8_g1u1_64x64_3tg_pf2E,64,64,,,,,2.0,165.703,48.41677777777768,0.00%,17.01,8509.04
2026-01-12 04:48:01,13,32,7168,256,256,8,ActivationType.Gelu,torch.bfloat16,torch.float8_e4m3fnuz,torch.float8_e4m3fnuz,QuantType.per_Tensor,1,0,asm,stage1,64,_ZN5aiter48fmoe_stage1_bf16_pertokenFp8_g1u1_64x128_2tg_pf2E,64,128,,,,,2.0,167.7328,48.41677777777768,0.00%,16.8,8406.07
2026-01-12 04:48:01,13,32,7168,256,256,8,ActivationType.Gelu,torch.bfloat16,torch.float8_e4m3fnuz,torch.float8_e4m3fnuz,QuantType.per_Tensor,1,0,asm,stage1,16,_ZN5aiter47fmoe_stage1_bf16_pertokenFp8_g1u1_16x64_5tg_pf3E,16,64,,,,,3.0,168.4247,48.41677777777768,10.52%,16.73,8371.54
2026-01-12 04:48:01,13,32,7168,256,256,8,ActivationType.Gelu,torch.bfloat16,torch.float8_e4m3fnuz,torch.float8_e4m3fnuz,QuantType.per_Tensor,1,0,asm,stage1,64,_ZN5aiter44fmoe_stage1_bf16_pertokenFp8_g1u1_64x256_pf2E,64,256,,,,,2.0,168.7646,48.41677777777768,0.00%,16.7,8354.68
2026-01-12 04:48:01,13,32,7168,256,256,8,ActivationType.Gelu,torch.bfloat16,torch.float8_e4m3fnuz,torch.float8_e4m3fnuz,QuantType.per_Tensor,1,0,asm,stage1,64,_ZN5aiter44fmoe_stage1_bf16_pertokenFp8_g1u1_64x256_pf3E,64,256,,,,,3.0,170.3471,48.41677777777768,0.00%,16.55,8277.07
2026-01-12 04:48:01,13,32,7168,256,256,8,ActivationType.Gelu,torch.bfloat16,torch.float8_e4m3fnuz,torch.float8_e4m3fnuz,QuantType.per_Tensor,1,0,asm,stage1,32,_ZN5aiter47fmoe_stage1_bf16_pertokenFp8_g1u1_32x64_4tg_pf3E,32,64,,,,,3.0,170.399,48.41677777777768,1.19%,16.54,8274.55
2026-01-12 04:48:01,13,32,7168,256,256,8,ActivationType.Gelu,torch.bfloat16,torch.float8_e4m3fnuz,torch.float8_e4m3fnuz,QuantType.per_Tensor,1,0,asm,stage1,16,_ZN5aiter48fmoe_stage1_bf16_pertokenFp8_g1u1_16x128_4tg_pf3E,16,128,,,,,3.0,176.6546,48.41677777777768,0.00%,15.96,7981.53
2026-01-12 04:48:01,13,32,7168,256,256,8,ActivationType.Gelu,torch.bfloat16,torch.float8_e4m3fnuz,torch.float8_e4m3fnuz,QuantType.per_Tensor,1,0,ck,stage2,64,moe_ck2stages_gemm2_256x64x128x64_1x4_MulABScaleExpertWeight_v3_Nswizzle0_Quant1_MulRoutedWeight1_F8_F8_B16,64,128,64.0,256.0,1.0,4.0,3.0,179.1132,48.41677777777768,99.42%,15.74,7871.97
2026-01-12 04:48:01,13,32,7168,256,256,8,ActivationType.Gelu,torch.bfloat16,torch.float8_e4m3fnuz,torch.float8_e4m3fnuz,QuantType.per_Tensor,1,0,ck,stage2,128,moe_ck2stages_gemm2_256x128x64x128_1x4_MulABScaleExpertWeight_v1_Nswizzle0_Quant1_MulRoutedWeight1_F8_F8_B16,128,64,128.0,256.0,1.0,4.0,1.0,180.374,48.41677777777768,1.57%,15.63,7816.95
2026-01-12 04:48:01,13,32,7168,256,256,8,ActivationType.Gelu,torch.bfloat16,torch.float8_e4m3fnuz,torch.float8_e4m3fnuz,QuantType.per_Tensor,1,0,asm,stage1,32,_ZN5aiter48fmoe_stage1_bf16_pertokenFp8_g1u1_32x128_3tg_pf3E,32,128,,,,,3.0,180.5523,48.41677777777768,0.00%,15.61,7809.23
2026-01-12 04:48:01,13,32,7168,256,256,8,ActivationType.Gelu,torch.bfloat16,torch.float8_e4m3fnuz,torch.float8_e4m3fnuz,QuantType.per_Tensor,1,0,ck,stage1,32,moe_ck2stages_gemm1_256x32x64x128_1x4_MulABScale_v1_Nswizzle0_Quant1_MulRoutedWeight0_gelu_F8_F8_B16,32,64,128.0,256.0,1.0,4.0,1.0,184.4069,48.41677777777768,96.04%,15.28,7646.0
2026-01-12 04:48:01,13,32,7168,256,256,8,ActivationType.Gelu,torch.bfloat16,torch.float8_e4m3fnuz,torch.float8_e4m3fnuz,QuantType.per_Tensor,1,0,ck,stage1,64,moe_ck2stages_gemm1_256x64x128x128_1x4_MulABScale_v3_Nswizzle0_Quant1_MulRoutedWeight0_gelu_F8_F8_B16,64,128,128.0,256.0,1.0,4.0,3.0,195.2603,48.41677777777768,0.00%,14.43,7221.0
2026-01-12 04:48:01,13,32,7168,256,256,8,ActivationType.Gelu,torch.bfloat16,torch.float8_e4m3fnuz,torch.float8_e4m3fnuz,QuantType.per_Tensor,1,0,ck,stage2,128,moe_ck2stages_gemm2_256x128x128x128_1x4_MulABScaleExpertWeight_v3_Nswizzle0_Quant1_MulRoutedWeight1_F8_F8_B16,128,128,128.0,256.0,1.0,4.0,3.0,195.9973,48.41677777777768,1.57%,14.38,7193.85
2026-01-12 04:48:01,13,32,7168,256,256,8,ActivationType.Gelu,torch.bfloat16,torch.float8_e4m3fnuz,torch.float8_e4m3fnuz,QuantType.per_Tensor,1,0,asm,stage1,64,_ZN5aiter48fmoe_stage1_bf16_pertokenFp8_g1u1_64x128_2tg_pf3E,64,128,,,,,3.0,199.1994,48.41677777777768,0.00%,14.15,7078.21
2026-01-12 04:48:01,13,32,7168,256,256,8,ActivationType.Gelu,torch.bfloat16,torch.float8_e4m3fnuz,torch.float8_e4m3fnuz,QuantType.per_Tensor,1,0,asm,stage1,64,_ZN5aiter47fmoe_stage1_bf16_pertokenFp8_g1u1_64x64_2tg_pf3E,64,64,,,,,3.0,203.3153,48.41677777777768,0.00%,13.86,6934.91
2026-01-12 04:48:01,13,32,7168,256,256,8,ActivationType.Gelu,torch.bfloat16,torch.float8_e4m3fnuz,torch.float8_e4m3fnuz,QuantType.per_Tensor,1,0,ck,stage1,64,moe_ck2stages_gemm1_256x64x128x256_1x4_MulABScale_v3_Nswizzle0_Quant1_MulRoutedWeight0_gelu_F8_F8_B16,64,128,256.0,256.0,1.0,4.0,3.0,205.7335,48.41677777777768,0.00%,13.7,6853.4
2026-01-12 04:48:01,13,32,7168,256,256,8,ActivationType.Gelu,torch.bfloat16,torch.float8_e4m3fnuz,torch.float8_e4m3fnuz,QuantType.per_Tensor,1,0,asm,stage1,128,_ZN5aiter44fmoe_stage1_bf16_pertokenFp8_g1u1_128x64_pf3E,128,64,,,,,3.0,227.6239,48.41677777777768,0.00%,12.38,6194.32
2026-01-12 04:48:01,13,32,7168,256,256,8,ActivationType.Gelu,torch.bfloat16,torch.float8_e4m3fnuz,torch.float8_e4m3fnuz,QuantType.per_Tensor,1,0,ck,stage1,64,moe_ck2stages_gemm1_256x64x64x128_1x4_MulABScale_v1_Nswizzle0_Quant1_MulRoutedWeight0_gelu_F8_F8_B16,64,64,128.0,256.0,1.0,4.0,1.0,256.9212,48.41677777777768,96.04%,10.97,5487.96
2026-01-12 04:48:01,13,32,7168,256,256,8,ActivationType.Gelu,torch.bfloat16,torch.float8_e4m3fnuz,torch.float8_e4m3fnuz,QuantType.per_Tensor,1,0,asm,stage1,128,_ZN5aiter44fmoe_stage1_bf16_pertokenFp8_g1u1_128x64_pf2E,128,64,,,,,2.0,259.2248,48.41677777777768,0.00%,10.87,5439.2
2026-01-12 04:48:01,13,32,7168,256,256,8,ActivationType.Gelu,torch.bfloat16,torch.float8_e4m3fnuz,torch.float8_e4m3fnuz,QuantType.per_Tensor,1,0,ck,stage2,128,moe_ck2stages_gemm2_256x128x128x64_1x4_MulABScaleExpertWeight_v3_Nswizzle0_Quant1_MulRoutedWeight1_F8_F8_B16,128,128,64.0,256.0,1.0,4.0,3.0,261.4173,48.41677777777768,99.43%,10.78,5393.58
2026-01-12 04:48:01,13,32,7168,256,256,8,ActivationType.Gelu,torch.bfloat16,torch.float8_e4m3fnuz,torch.float8_e4m3fnuz,QuantType.per_Tensor,1,0,asm,stage1,128,_ZN5aiter45fmoe_stage1_bf16_pertokenFp8_g1u1_128x128_pf2E,128,128,,,,,2.0,264.8865,48.41677777777768,0.00%,10.64,5322.94
2026-01-12 04:48:01,13,32,7168,256,256,8,ActivationType.Gelu,torch.bfloat16,torch.float8_e4m3fnuz,torch.float8_e4m3fnuz,QuantType.per_Tensor,1,0,ck,stage2,128,moe_ck2stages_gemm2_256x128x64x64_1x4_MulABScaleExpertWeight_v3_Nswizzle0_Quant1_MulRoutedWeight1_F8_F8_B16,128,64,64.0,256.0,1.0,4.0,3.0,264.9227,48.41677777777768,99.43%,10.64,5322.21
2026-01-12 04:48:01,13,32,7168,256,256,8,ActivationType.Gelu,torch.bfloat16,torch.float8_e4m3fnuz,torch.float8_e4m3fnuz,QuantType.per_Tensor,1,0,asm,stage1,128,_ZN5aiter45fmoe_stage1_bf16_pertokenFp8_g1u1_128x128_pf3E,128,128,,,,,3.0,265.2669,48.41677777777768,0.00%,10.63,5315.3
2026-01-12 04:48:01,13,32,7168,256,256,8,ActivationType.Gelu,torch.bfloat16,torch.float8_e4m3fnuz,torch.float8_e4m3fnuz,QuantType.per_Tensor,1,0,ck,stage1,128,moe_ck2stages_gemm1_256x128x128x128_1x4_MulABScale_v3_Nswizzle0_Quant1_MulRoutedWeight0_gelu_F8_F8_B16,128,128,128.0,256.0,1.0,4.0,3.0,269.6903,48.41677777777768,0.00%,10.45,5228.12
2026-01-12 04:48:01,13,32,7168,256,256,8,ActivationType.Gelu,torch.bfloat16,torch.float8_e4m3fnuz,torch.float8_e4m3fnuz,QuantType.per_Tensor,1,0,ck,stage1,128,moe_ck2stages_gemm1_256x128x128x256_1x4_MulABScale_v3_Nswizzle0_Quant1_MulRoutedWeight0_gelu_F8_F8_B16,128,128,256.0,256.0,1.0,4.0,3.0,270.1159,48.41677777777768,0.00%,10.43,5219.89
2026-01-12 04:48:01,13,32,7168,256,256,8,ActivationType.Gelu,torch.bfloat16,torch.float8_e4m3fnuz,torch.float8_e4m3fnuz,QuantType.per_Tensor,1,0,ck,stage1,32,moe_ck2stages_gemm1_256x32x64x256_1x4_MulABScale_v1_Nswizzle0_Quant1_MulRoutedWeight0_gelu_F8_F8_B16,32,64,256.0,256.0,1.0,4.0,1.0,457.5851,48.41677777777768,96.04%,6.16,3081.34
2026-01-12 04:48:01,13,32,7168,256,256,8,ActivationType.Gelu,torch.bfloat16,torch.float8_e4m3fnuz,torch.float8_e4m3fnuz,QuantType.per_Tensor,1,0,ck,stage1,64,moe_ck2stages_gemm1_256x64x64x256_1x4_MulABScale_v1_Nswizzle0_Quant1_MulRoutedWeight0_gelu_F8_F8_B16,64,64,256.0,256.0,1.0,4.0,1.0,1821.9183,48.41677777777768,96.04%,1.55,773.9
2026-01-12 04:48:01,13,32,7168,256,256,8,ActivationType.Gelu,torch.bfloat16,torch.float8_e4m3fnuz,torch.float8_e4m3fnuz,QuantType.per_Tensor,1,0,ck,stage1,128,moe_ck2stages_gemm1_256x128x64x128_1x4_MulABScale_v1_Nswizzle0_Quant1_MulRoutedWeight0_gelu_F8_F8_B16,128,64,128.0,256.0,1.0,4.0,1.0,2312.8425,48.41677777777768,96.04%,1.22,609.63
2026-01-12 04:48:01,13,32,7168,256,256,8,ActivationType.Gelu,torch.bfloat16,torch.float8_e4m3fnuz,torch.float8_e4m3fnuz,QuantType.per_Tensor,1,0,asm,stage1,16,_ZN5aiter48fmoe_stage1_bf16_pertokenFp8_g1u1_16x512_2tg_pf2E,16,512,,,,,2.0,inf,48.41677777777768,failed,0.0,0.0
2026-01-12 04:48:01,13,32,7168,256,256,8,ActivationType.Gelu,torch.bfloat16,torch.float8_e4m3fnuz,torch.float8_e4m3fnuz,QuantType.per_Tensor,1,0,asm,stage1,16,_ZN5aiter44fmoe_stage1_bf16_pertokenFp8_g1u1_16x512_pf3E,16,512,,,,,3.0,inf,48.41677777777768,failed,0.0,0.0
2026-01-12 04:48:01,13,32,7168,256,256,8,ActivationType.Gelu,torch.bfloat16,torch.float8_e4m3fnuz,torch.float8_e4m3fnuz,QuantType.per_Tensor,1,0,asm,stage1,32,_ZN5aiter44fmoe_stage1_bf16_pertokenFp8_g1u1_32x512_pf2E,32,512,,,,,2.0,inf,48.41677777777768,failed,0.0,0.0
2026-01-12 04:48:01,13,32,7168,256,256,8,ActivationType.Gelu,torch.bfloat16,torch.float8_e4m3fnuz,torch.float8_e4m3fnuz,QuantType.per_Tensor,1,0,asm,stage1,32,_ZN5aiter44fmoe_stage1_bf16_pertokenFp8_g1u1_32x512_pf3E,32,512,,,,,3.0,inf,48.41677777777768,failed,0.0,0.0
2026-01-12 04:48:35,14,16,7168,512,256,8,ActivationType.Silu,torch.bfloat16,torch.float8_e4m3fnuz,torch.float8_e4m3fnuz,QuantType.per_Tensor,1,0,ck,stage2,32,moe_ck2stages_gemm2_256x32x64x256_1x4_MulABScaleExpertWeight_v1_Nswizzle0_Quant1_MulRoutedWeight1_F8_F8_B16,32,64,256.0,256.0,1.0,4.0,1.0,103.557,47.53099999999998,2.68%,27.22,27220.92
2026-01-12 04:48:35,14,16,7168,512,256,8,ActivationType.Silu,torch.bfloat16,torch.float8_e4m3fnuz,torch.float8_e4m3fnuz,QuantType.per_Tensor,1,0,ck,stage2,32,moe_ck2stages_gemm2_256x32x64x128_1x4_MulABScaleExpertWeight_v1_Nswizzle0_Quant1_MulRoutedWeight1_F8_F8_B16,32,64,128.0,256.0,1.0,4.0,1.0,104.6273,47.53099999999998,2.69%,26.94,26942.46
2026-01-12 04:48:35,14,16,7168,512,256,8,ActivationType.Silu,torch.bfloat16,torch.float8_e4m3fnuz,torch.float8_e4m3fnuz,QuantType.per_Tensor,1,0,ck,stage2,64,moe_ck2stages_gemm2_256x64x64x256_1x4_MulABScaleExpertWeight_v1_Nswizzle0_Quant1_MulRoutedWeight1_F8_F8_B16,64,64,256.0,256.0,1.0,4.0,1.0,114.8501,47.53099999999998,2.69%,24.54,24544.31
2026-01-12 04:48:35,14,16,7168,512,256,8,ActivationType.Silu,torch.bfloat16,torch.float8_e4m3fnuz,torch.float8_e4m3fnuz,QuantType.per_Tensor,1,0,ck,stage2,32,moe_ck2stages_gemm2_256x32x64x64_1x4_MulABScaleExpertWeight_v1_Nswizzle0_Quant1_MulRoutedWeight1_F8_F8_B16,32,64,64.0,256.0,1.0,4.0,1.0,116.8541,47.53099999999998,99.50%,24.12,24123.38
2026-01-12 04:48:35,14,16,7168,512,256,8,ActivationType.Silu,torch.bfloat16,torch.float8_e4m3fnuz,torch.float8_e4m3fnuz,QuantType.per_Tensor,1,0,ck,stage2,64,moe_ck2stages_gemm2_256x64x128x256_1x4_MulABScaleExpertWeight_v3_Nswizzle0_Quant1_MulRoutedWeight1_F8_F8_B16,64,128,256.0,256.0,1.0,4.0,3.0,123.6812,47.53099999999998,2.70%,22.79,22791.79
2026-01-12 04:48:35,14,16,7168,512,256,8,ActivationType.Silu,torch.bfloat16,torch.float8_e4m3fnuz,torch.float8_e4m3fnuz,QuantType.per_Tensor,1,0,ck,stage2,64,moe_ck2stages_gemm2_256x64x128x128_1x4_MulABScaleExpertWeight_v3_Nswizzle0_Quant1_MulRoutedWeight1_F8_F8_B16,64,128,128.0,256.0,1.0,4.0,3.0,129.6032,47.53099999999998,2.68%,21.75,21750.36
2026-01-12 04:48:35,14,16,7168,512,256,8,ActivationType.Silu,torch.bfloat16,torch.float8_e4m3fnuz,torch.float8_e4m3fnuz,QuantType.per_Tensor,1,0,ck,stage2,128,moe_ck2stages_gemm2_256x128x128x128_1x4_MulABScaleExpertWeight_v3_Nswizzle0_Quant1_MulRoutedWeight1_F8_F8_B16,128,128,128.0,256.0,1.0,4.0,3.0,171.9,47.53099999999998,2.68%,16.4,16398.58
2026-01-12 04:48:35,14,16,7168,512,256,8,ActivationType.Silu,torch.bfloat16,torch.float8_e4m3fnuz,torch.float8_e4m3fnuz,QuantType.per_Tensor,1,0,ck,stage2,64,moe_ck2stages_gemm2_256x64x64x64_1x4_MulABScaleExpertWeight_v1_Nswizzle0_Quant1_MulRoutedWeight1_F8_F8_B16,64,64,64.0,256.0,1.0,4.0,1.0,175.3218,47.53099999999998,99.49%,16.08,16078.53
2026-01-12 04:48:35,14,16,7168,512,256,8,ActivationType.Silu,torch.bfloat16,torch.float8_e4m3fnuz,torch.float8_e4m3fnuz,QuantType.per_Tensor,1,0,ck,stage2,64,moe_ck2stages_gemm2_256x64x128x64_1x4_MulABScaleExpertWeight_v3_Nswizzle0_Quant1_MulRoutedWeight1_F8_F8_B16,64,128,64.0,256.0,1.0,4.0,3.0,176.0769,47.53099999999998,99.49%,16.01,16009.58
2026-01-12 04:48:35,14,16,7168,512,256,8,ActivationType.Silu,torch.bfloat16,torch.float8_e4m3fnuz,torch.float8_e4m3fnuz,QuantType.per_Tensor,1,0,asm,stage1,16,_ZN5aiter47fmoe_stage1_bf16_pertokenFp8_g1u1_16x64_6tg_pf2E,16,64,,,,,2.0,197.7937,47.53099999999998,0.00%,14.25,14251.8
2026-01-12 04:48:35,14,16,7168,512,256,8,ActivationType.Silu,torch.bfloat16,torch.float8_e4m3fnuz,torch.float8_e4m3fnuz,QuantType.per_Tensor,1,0,asm,stage1,16,_ZN5aiter48fmoe_stage1_bf16_pertokenFp8_g1u1_16x128_4tg_pf2E,16,128,,,,,2.0,198.9069,47.53099999999998,0.00%,14.17,14172.04
2026-01-12 04:48:35,14,16,7168,512,256,8,ActivationType.Silu,torch.bfloat16,torch.float8_e4m3fnuz,torch.float8_e4m3fnuz,QuantType.per_Tensor,1,0,asm,stage1,32,_ZN5aiter47fmoe_stage1_bf16_pertokenFp8_g1u1_32x64_4tg_pf2E,32,64,,,,,2.0,199.4245,47.53099999999998,0.00%,14.13,14135.26
2026-01-12 04:48:35,14,16,7168,512,256,8,ActivationType.Silu,torch.bfloat16,torch.float8_e4m3fnuz,torch.float8_e4m3fnuz,QuantType.per_Tensor,1,0,asm,stage1,16,_ZN5aiter47fmoe_stage1_bf16_pertokenFp8_g1u1_16x64_5tg_pf3E,16,64,,,,,3.0,199.5281,47.53099999999998,9.33%,14.13,14127.92
2026-01-12 04:48:35,14,16,7168,512,256,8,ActivationType.Silu,torch.bfloat16,torch.float8_e4m3fnuz,torch.float8_e4m3fnuz,QuantType.per_Tensor,1,0,asm,stage1,16,_ZN5aiter48fmoe_stage1_bf16_pertokenFp8_g1u1_16x128_4tg_pf3E,16,128,,,,,3.0,199.7486,47.53099999999998,0.00%,14.11,14112.32
2026-01-12 04:48:35,14,16,7168,512,256,8,ActivationType.Silu,torch.bfloat16,torch.float8_e4m3fnuz,torch.float8_e4m3fnuz,QuantType.per_Tensor,1,0,asm,stage1,32,_ZN5aiter48fmoe_stage1_bf16_pertokenFp8_g1u1_32x128_3tg_pf2E,32,128,,,,,2.0,200.2312,47.53099999999998,0.00%,14.08,14078.31
2026-01-12 04:48:35,14,16,7168,512,256,8,ActivationType.Silu,torch.bfloat16,torch.float8_e4m3fnuz,torch.float8_e4m3fnuz,QuantType.per_Tensor,1,0,asm,stage1,32,_ZN5aiter47fmoe_stage1_bf16_pertokenFp8_g1u1_32x64_4tg_pf3E,32,64,,,,,3.0,200.385,47.53099999999998,5.07%,14.07,14067.5
2026-01-12 04:48:35,14,16,7168,512,256,8,ActivationType.Silu,torch.bfloat16,torch.float8_e4m3fnuz,torch.float8_e4m3fnuz,QuantType.per_Tensor,1,0,asm,stage1,16,_ZN5aiter48fmoe_stage1_bf16_pertokenFp8_g1u1_16x256_3tg_pf2E,16,256,,,,,2.0,201.0231,47.53099999999998,0.00%,14.02,14022.85
2026-01-12 04:48:35,14,16,7168,512,256,8,ActivationType.Silu,torch.bfloat16,torch.float8_e4m3fnuz,torch.float8_e4m3fnuz,QuantType.per_Tensor,1,0,asm,stage1,32,_ZN5aiter48fmoe_stage1_bf16_pertokenFp8_g1u1_32x128_3tg_pf3E,32,128,,,,,3.0,201.1366,47.53099999999998,0.00%,14.01,14014.93
2026-01-12 04:48:35,14,16,7168,512,256,8,ActivationType.Silu,torch.bfloat16,torch.float8_e4m3fnuz,torch.float8_e4m3fnuz,QuantType.per_Tensor,1,0,asm,stage1,16,_ZN5aiter48fmoe_stage1_bf16_pertokenFp8_g1u1_16x256_2tg_pf3E,16,256,,,,,3.0,201.5048,47.53099999999998,0.00%,13.99,13989.33
2026-01-12 04:48:35,14,16,7168,512,256,8,ActivationType.Silu,torch.bfloat16,torch.float8_e4m3fnuz,torch.float8_e4m3fnuz,QuantType.per_Tensor,1,0,asm,stage1,32,_ZN5aiter48fmoe_stage1_bf16_pertokenFp8_g1u1_32x256_2tg_pf3E,32,256,,,,,3.0,202.8133,47.53099999999998,0.00%,13.9,13899.07
2026-01-12 04:48:35,14,16,7168,512,256,8,ActivationType.Silu,torch.bfloat16,torch.float8_e4m3fnuz,torch.float8_e4m3fnuz,QuantType.per_Tensor,1,0,asm,stage1,32,_ZN5aiter48fmoe_stage1_bf16_pertokenFp8_g1u1_32x256_2tg_pf2E,32,256,,,,,2.0,203.2222,47.53099999999998,0.00%,13.87,13871.1
2026-01-12 04:48:35,14,16,7168,512,256,8,ActivationType.Silu,torch.bfloat16,torch.float8_e4m3fnuz,torch.float8_e4m3fnuz,QuantType.per_Tensor,1,0,asm,stage1,16,_ZN5aiter48fmoe_stage1_bf16_pertokenFp8_g1u1_16x512_2tg_pf2E,16,512,,,,,2.0,205.2255,47.53099999999998,0.00%,13.73,13735.7
2026-01-12 04:48:35,14,16,7168,512,256,8,ActivationType.Silu,torch.bfloat16,torch.float8_e4m3fnuz,torch.float8_e4m3fnuz,QuantType.per_Tensor,1,0,asm,stage1,16,_ZN5aiter44fmoe_stage1_bf16_pertokenFp8_g1u1_16x512_pf3E,16,512,,,,,3.0,205.7483,47.53099999999998,0.00%,13.7,13700.8
2026-01-12 04:48:35,14,16,7168,512,256,8,ActivationType.Silu,torch.bfloat16,torch.float8_e4m3fnuz,torch.float8_e4m3fnuz,QuantType.per_Tensor,1,0,asm,stage1,64,_ZN5aiter44fmoe_stage1_bf16_pertokenFp8_g1u1_64x256_pf2E,64,256,,,,,2.0,207.6522,47.53099999999998,0.00%,13.57,13575.18
2026-01-12 04:48:35,14,16,7168,512,256,8,ActivationType.Silu,torch.bfloat16,torch.float8_e4m3fnuz,torch.float8_e4m3fnuz,QuantType.per_Tensor,1,0,asm,stage1,64,_ZN5aiter48fmoe_stage1_bf16_pertokenFp8_g1u1_64x128_2tg_pf3E,64,128,,,,,3.0,208.5609,47.53099999999998,0.00%,13.51,13516.03
2026-01-12 04:48:35,14,16,7168,512,256,8,ActivationType.Silu,torch.bfloat16,torch.float8_e4m3fnuz,torch.float8_e4m3fnuz,QuantType.per_Tensor,1,0,ck,stage1,64,moe_ck2stages_gemm1_256x64x128x128_1x4_MulABScale_v3_Nswizzle0_Quant1_MulRoutedWeight0_silu_F8_F8_B16,64,128,128.0,256.0,1.0,4.0,3.0,208.9393,47.53099999999998,0.00%,13.49,13491.56
2026-01-12 04:48:35,14,16,7168,512,256,8,ActivationType.Silu,torch.bfloat16,torch.float8_e4m3fnuz,torch.float8_e4m3fnuz,QuantType.per_Tensor,1,0,asm,stage1,32,_ZN5aiter44fmoe_stage1_bf16_pertokenFp8_g1u1_32x512_pf3E,32,512,,,,,3.0,209.0003,47.53099999999998,0.00%,13.49,13487.62
2026-01-12 04:48:35,14,16,7168,512,256,8,ActivationType.Silu,torch.bfloat16,torch.float8_e4m3fnuz,torch.float8_e4m3fnuz,QuantType.per_Tensor,1,0,asm,stage1,64,_ZN5aiter44fmoe_stage1_bf16_pertokenFp8_g1u1_64x256_pf3E,64,256,,,,,3.0,209.6487,47.53099999999998,0.00%,13.44,13445.9
2026-01-12 04:48:35,14,16,7168,512,256,8,ActivationType.Silu,torch.bfloat16,torch.float8_e4m3fnuz,torch.float8_e4m3fnuz,QuantType.per_Tensor,1,0,asm,stage1,32,_ZN5aiter44fmoe_stage1_bf16_pertokenFp8_g1u1_32x512_pf2E,32,512,,,,,2.0,209.7179,47.53099999999998,0.00%,13.44,13441.47
2026-01-12 04:48:35,14,16,7168,512,256,8,ActivationType.Silu,torch.bfloat16,torch.float8_e4m3fnuz,torch.float8_e4m3fnuz,QuantType.per_Tensor,1,0,asm,stage1,64,_ZN5aiter48fmoe_stage1_bf16_pertokenFp8_g1u1_64x128_2tg_pf2E,64,128,,,,,2.0,210.3216,47.53099999999998,0.00%,13.4,13402.89
2026-01-12 04:48:35,14,16,7168,512,256,8,ActivationType.Silu,torch.bfloat16,torch.float8_e4m3fnuz,torch.float8_e4m3fnuz,QuantType.per_Tensor,1,0,asm,stage1,64,_ZN5aiter47fmoe_stage1_bf16_pertokenFp8_g1u1_64x64_3tg_pf2E,64,64,,,,,2.0,210.516,47.53099999999998,0.00%,13.39,13390.51
2026-01-12 04:48:35,14,16,7168,512,256,8,ActivationType.Silu,torch.bfloat16,torch.float8_e4m3fnuz,torch.float8_e4m3fnuz,QuantType.per_Tensor,1,0,ck,stage1,32,moe_ck2stages_gemm1_256x32x64x128_1x4_MulABScale_v1_Nswizzle0_Quant1_MulRoutedWeight0_silu_F8_F8_B16,32,64,128.0,256.0,1.0,4.0,1.0,212.0167,47.53099999999998,96.82%,13.29,13295.73
2026-01-12 04:48:35,14,16,7168,512,256,8,ActivationType.Silu,torch.bfloat16,torch.float8_e4m3fnuz,torch.float8_e4m3fnuz,QuantType.per_Tensor,1,0,ck,stage1,64,moe_ck2stages_gemm1_256x64x128x256_1x4_MulABScale_v3_Nswizzle0_Quant1_MulRoutedWeight0_silu_F8_F8_B16,64,128,256.0,256.0,1.0,4.0,3.0,212.6451,47.53099999999998,0.00%,13.25,13256.44
2026-01-12 04:48:35,14,16,7168,512,256,8,ActivationType.Silu,torch.bfloat16,torch.float8_e4m3fnuz,torch.float8_e4m3fnuz,QuantType.per_Tensor,1,0,asm,stage1,64,_ZN5aiter47fmoe_stage1_bf16_pertokenFp8_g1u1_64x64_2tg_pf3E,64,64,,,,,3.0,214.4529,47.53099999999998,0.00%,13.14,13144.69
2026-01-12 04:48:35,14,16,7168,512,256,8,ActivationType.Silu,torch.bfloat16,torch.float8_e4m3fnuz,torch.float8_e4m3fnuz,QuantType.per_Tensor,1,0,ck,stage2,128,moe_ck2stages_gemm2_256x128x64x128_1x4_MulABScaleExpertWeight_v1_Nswizzle0_Quant1_MulRoutedWeight1_F8_F8_B16,128,64,128.0,256.0,1.0,4.0,1.0,220.3817,47.53099999999998,2.66%,12.79,12791.06
2026-01-12 04:48:35,14,16,7168,512,256,8,ActivationType.Silu,torch.bfloat16,torch.float8_e4m3fnuz,torch.float8_e4m3fnuz,QuantType.per_Tensor,1,0,asm,stage1,128,_ZN5aiter44fmoe_stage1_bf16_pertokenFp8_g1u1_128x64_pf3E,128,64,,,,,3.0,245.018,47.53099999999998,0.00%,11.5,11504.94
2026-01-12 04:48:35,14,16,7168,512,256,8,ActivationType.Silu,torch.bfloat16,torch.float8_e4m3fnuz,torch.float8_e4m3fnuz,QuantType.per_Tensor,1,0,ck,stage2,128,moe_ck2stages_gemm2_256x128x128x64_1x4_MulABScaleExpertWeight_v3_Nswizzle0_Quant1_MulRoutedWeight1_F8_F8_B16,128,128,64.0,256.0,1.0,4.0,3.0,246.0688,47.53099999999998,99.50%,11.45,11455.81
2026-01-12 04:48:35,14,16,7168,512,256,8,ActivationType.Silu,torch.bfloat16,torch.float8_e4m3fnuz,torch.float8_e4m3fnuz,QuantType.per_Tensor,1,0,ck,stage1,64,moe_ck2stages_gemm1_256x64x64x128_1x4_MulABScale_v1_Nswizzle0_Quant1_MulRoutedWeight0_silu_F8_F8_B16,64,64,128.0,256.0,1.0,4.0,1.0,264.1361,47.53099999999998,96.82%,10.67,10672.21
2026-01-12 04:48:35,14,16,7168,512,256,8,ActivationType.Silu,torch.bfloat16,torch.float8_e4m3fnuz,torch.float8_e4m3fnuz,QuantType.per_Tensor,1,0,asm,stage1,128,_ZN5aiter45fmoe_stage1_bf16_pertokenFp8_g1u1_128x128_pf3E,128,128,,,,,3.0,267.8344,47.53099999999998,0.00%,10.52,10524.85
2026-01-12 04:48:35,14,16,7168,512,256,8,ActivationType.Silu,torch.bfloat16,torch.float8_e4m3fnuz,torch.float8_e4m3fnuz,QuantType.per_Tensor,1,0,asm,stage1,128,_ZN5aiter45fmoe_stage1_bf16_pertokenFp8_g1u1_128x128_pf2E,128,128,,,,,2.0,267.9673,47.53099999999998,0.00%,10.52,10519.63
2026-01-12 04:48:35,14,16,7168,512,256,8,ActivationType.Silu,torch.bfloat16,torch.float8_e4m3fnuz,torch.float8_e4m3fnuz,QuantType.per_Tensor,1,0,asm,stage1,128,_ZN5aiter44fmoe_stage1_bf16_pertokenFp8_g1u1_128x64_pf2E,128,64,,,,,2.0,269.2028,47.53099999999998,0.00%,10.47,10471.35
2026-01-12 04:48:35,14,16,7168,512,256,8,ActivationType.Silu,torch.bfloat16,torch.float8_e4m3fnuz,torch.float8_e4m3fnuz,QuantType.per_Tensor,1,0,ck,stage1,128,moe_ck2stages_gemm1_256x128x128x128_1x4_MulABScale_v3_Nswizzle0_Quant1_MulRoutedWeight0_silu_F8_F8_B16,128,128,128.0,256.0,1.0,4.0,3.0,278.3155,47.53099999999998,0.00%,10.13,10128.49
2026-01-12 04:48:35,14,16,7168,512,256,8,ActivationType.Silu,torch.bfloat16,torch.float8_e4m3fnuz,torch.float8_e4m3fnuz,QuantType.per_Tensor,1,0,ck,stage2,128,moe_ck2stages_gemm2_256x128x64x64_1x4_MulABScaleExpertWeight_v3_Nswizzle0_Quant1_MulRoutedWeight1_F8_F8_B16,128,64,64.0,256.0,1.0,4.0,3.0,280.8475,47.53099999999998,99.49%,10.04,10037.18
2026-01-12 04:48:35,14,16,7168,512,256,8,ActivationType.Silu,torch.bfloat16,torch.float8_e4m3fnuz,torch.float8_e4m3fnuz,QuantType.per_Tensor,1,0,ck,stage1,128,moe_ck2stages_gemm1_256x128x128x256_1x4_MulABScale_v3_Nswizzle0_Quant1_MulRoutedWeight0_silu_F8_F8_B16,128,128,256.0,256.0,1.0,4.0,3.0,281.3742,47.53099999999998,0.00%,10.02,10018.39
2026-01-12 04:48:35,14,16,7168,512,256,8,ActivationType.Silu,torch.bfloat16,torch.float8_e4m3fnuz,torch.float8_e4m3fnuz,QuantType.per_Tensor,1,0,ck,stage1,32,moe_ck2stages_gemm1_256x32x64x256_1x4_MulABScale_v1_Nswizzle0_Quant1_MulRoutedWeight0_silu_F8_F8_B16,32,64,256.0,256.0,1.0,4.0,1.0,501.0854,47.53099999999998,96.82%,5.62,5625.62
2026-01-12 04:48:35,14,16,7168,512,256,8,ActivationType.Silu,torch.bfloat16,torch.float8_e4m3fnuz,torch.float8_e4m3fnuz,QuantType.per_Tensor,1,0,ck,stage1,64,moe_ck2stages_gemm1_256x64x64x256_1x4_MulABScale_v1_Nswizzle0_Quant1_MulRoutedWeight0_silu_F8_F8_B16,64,64,256.0,256.0,1.0,4.0,1.0,2093.2074,47.53099999999998,96.82%,1.35,1346.7
2026-01-12 04:48:35,14,16,7168,512,256,8,ActivationType.Silu,torch.bfloat16,torch.float8_e4m3fnuz,torch.float8_e4m3fnuz,QuantType.per_Tensor,1,0,ck,stage1,128,moe_ck2stages_gemm1_256x128x64x128_1x4_MulABScale_v1_Nswizzle0_Quant1_MulRoutedWeight0_silu_F8_F8_B16,128,64,128.0,256.0,1.0,4.0,1.0,2780.3343,47.53099999999998,96.82%,1.01,1013.88
2026-01-12 04:49:06,15,16,7168,512,256,8,ActivationType.Gelu,torch.bfloat16,torch.float8_e4m3fnuz,torch.float8_e4m3fnuz,QuantType.per_Tensor,1,0,ck,stage2,32,moe_ck2stages_gemm2_256x32x64x256_1x4_MulABScaleExpertWeight_v1_Nswizzle0_Quant1_MulRoutedWeight1_F8_F8_B16,32,64,256.0,256.0,1.0,4.0,1.0,103.828,47.865222222222236,3.22%,27.15,27149.87
2026-01-12 04:49:06,15,16,7168,512,256,8,ActivationType.Gelu,torch.bfloat16,torch.float8_e4m3fnuz,torch.float8_e4m3fnuz,QuantType.per_Tensor,1,0,ck,stage2,32,moe_ck2stages_gemm2_256x32x64x128_1x4_MulABScaleExpertWeight_v1_Nswizzle0_Quant1_MulRoutedWeight1_F8_F8_B16,32,64,128.0,256.0,1.0,4.0,1.0,104.8668,47.865222222222236,3.19%,26.88,26880.92
2026-01-12 04:49:06,15,16,7168,512,256,8,ActivationType.Gelu,torch.bfloat16,torch.float8_e4m3fnuz,torch.float8_e4m3fnuz,QuantType.per_Tensor,1,0,ck,stage2,64,moe_ck2stages_gemm2_256x64x64x256_1x4_MulABScaleExpertWeight_v1_Nswizzle0_Quant1_MulRoutedWeight1_F8_F8_B16,64,64,256.0,256.0,1.0,4.0,1.0,115.8991,47.865222222222236,3.19%,24.32,24322.16
2026-01-12 04:49:06,15,16,7168,512,256,8,ActivationType.Gelu,torch.bfloat16,torch.float8_e4m3fnuz,torch.float8_e4m3fnuz,QuantType.per_Tensor,1,0,ck,stage2,32,moe_ck2stages_gemm2_256x32x64x64_1x4_MulABScaleExpertWeight_v1_Nswizzle0_Quant1_MulRoutedWeight1_F8_F8_B16,32,64,64.0,256.0,1.0,4.0,1.0,121.9644,47.865222222222236,99.49%,23.11,23112.62
2026-01-12 04:49:06,15,16,7168,512,256,8,ActivationType.Gelu,torch.bfloat16,torch.float8_e4m3fnuz,torch.float8_e4m3fnuz,QuantType.per_Tensor,1,0,ck,stage2,64,moe_ck2stages_gemm2_256x64x128x256_1x4_MulABScaleExpertWeight_v3_Nswizzle0_Quant1_MulRoutedWeight1_F8_F8_B16,64,128,256.0,256.0,1.0,4.0,3.0,123.7892,47.865222222222236,3.20%,22.77,22771.91
2026-01-12 04:49:06,15,16,7168,512,256,8,ActivationType.Gelu,torch.bfloat16,torch.float8_e4m3fnuz,torch.float8_e4m3fnuz,QuantType.per_Tensor,1,0,ck,stage2,64,moe_ck2stages_gemm2_256x64x128x128_1x4_MulABScaleExpertWeight_v3_Nswizzle0_Quant1_MulRoutedWeight1_F8_F8_B16,64,128,128.0,256.0,1.0,4.0,3.0,129.966,47.865222222222236,3.19%,21.69,21689.64
2026-01-12 04:49:06,15,16,7168,512,256,8,ActivationType.Gelu,torch.bfloat16,torch.float8_e4m3fnuz,torch.float8_e4m3fnuz,QuantType.per_Tensor,1,0,ck,stage2,128,moe_ck2stages_gemm2_256x128x128x128_1x4_MulABScaleExpertWeight_v3_Nswizzle0_Quant1_MulRoutedWeight1_F8_F8_B16,128,128,128.0,256.0,1.0,4.0,3.0,171.6494,47.865222222222236,3.20%,16.42,16422.52
2026-01-12 04:49:06,15,16,7168,512,256,8,ActivationType.Gelu,torch.bfloat16,torch.float8_e4m3fnuz,torch.float8_e4m3fnuz,QuantType.per_Tensor,1,0,ck,stage2,64,moe_ck2stages_gemm2_256x64x64x64_1x4_MulABScaleExpertWeight_v1_Nswizzle0_Quant1_MulRoutedWeight1_F8_F8_B16,64,64,64.0,256.0,1.0,4.0,1.0,175.2669,47.865222222222236,99.49%,16.08,16083.56
2026-01-12 04:49:06,15,16,7168,512,256,8,ActivationType.Gelu,torch.bfloat16,torch.float8_e4m3fnuz,torch.float8_e4m3fnuz,QuantType.per_Tensor,1,0,ck,stage2,64,moe_ck2stages_gemm2_256x64x128x64_1x4_MulABScaleExpertWeight_v3_Nswizzle0_Quant1_MulRoutedWeight1_F8_F8_B16,64,128,64.0,256.0,1.0,4.0,3.0,175.9112,47.865222222222236,99.49%,16.02,16024.66
2026-01-12 04:49:06,15,16,7168,512,256,8,ActivationType.Gelu,torch.bfloat16,torch.float8_e4m3fnuz,torch.float8_e4m3fnuz,QuantType.per_Tensor,1,0,asm,stage1,16,_ZN5aiter47fmoe_stage1_bf16_pertokenFp8_g1u1_16x64_6tg_pf2E,16,64,,,,,2.0,197.8416,47.865222222222236,0.00%,14.25,14248.35
2026-01-12 04:49:06,15,16,7168,512,256,8,ActivationType.Gelu,torch.bfloat16,torch.float8_e4m3fnuz,torch.float8_e4m3fnuz,QuantType.per_Tensor,1,0,asm,stage1,16,_ZN5aiter48fmoe_stage1_bf16_pertokenFp8_g1u1_16x128_4tg_pf2E,16,128,,,,,2.0,199.0243,47.865222222222236,0.03%,14.16,14163.68
2026-01-12 04:49:06,15,16,7168,512,256,8,ActivationType.Gelu,torch.bfloat16,torch.float8_e4m3fnuz,torch.float8_e4m3fnuz,QuantType.per_Tensor,1,0,asm,stage1,32,_ZN5aiter47fmoe_stage1_bf16_pertokenFp8_g1u1_32x64_4tg_pf2E,32,64,,,,,2.0,199.3616,47.865222222222236,0.00%,14.14,14139.72
2026-01-12 04:49:06,15,16,7168,512,256,8,ActivationType.Gelu,torch.bfloat16,torch.float8_e4m3fnuz,torch.float8_e4m3fnuz,QuantType.per_Tensor,1,0,asm,stage1,16,_ZN5aiter47fmoe_stage1_bf16_pertokenFp8_g1u1_16x64_5tg_pf3E,16,64,,,,,3.0,199.4036,47.865222222222236,8.25%,14.14,14136.74
2026-01-12 04:49:06,15,16,7168,512,256,8,ActivationType.Gelu,torch.bfloat16,torch.float8_e4m3fnuz,torch.float8_e4m3fnuz,QuantType.per_Tensor,1,0,asm,stage1,16,_ZN5aiter48fmoe_stage1_bf16_pertokenFp8_g1u1_16x128_4tg_pf3E,16,128,,,,,3.0,199.6038,47.865222222222236,0.00%,14.12,14122.56
2026-01-12 04:49:06,15,16,7168,512,256,8,ActivationType.Gelu,torch.bfloat16,torch.float8_e4m3fnuz,torch.float8_e4m3fnuz,QuantType.per_Tensor,1,0,asm,stage1,32,_ZN5aiter47fmoe_stage1_bf16_pertokenFp8_g1u1_32x64_4tg_pf3E,32,64,,,,,3.0,200.4426,47.865222222222236,2.74%,14.06,14063.46
2026-01-12 04:49:06,15,16,7168,512,256,8,ActivationType.Gelu,torch.bfloat16,torch.float8_e4m3fnuz,torch.float8_e4m3fnuz,QuantType.per_Tensor,1,0,asm,stage1,32,_ZN5aiter48fmoe_stage1_bf16_pertokenFp8_g1u1_32x128_3tg_pf2E,32,128,,,,,2.0,200.5558,47.865222222222236,0.00%,14.05,14055.52
2026-01-12 04:49:06,15,16,7168,512,256,8,ActivationType.Gelu,torch.bfloat16,torch.float8_e4m3fnuz,torch.float8_e4m3fnuz,QuantType.per_Tensor,1,0,asm,stage1,32,_ZN5aiter48fmoe_stage1_bf16_pertokenFp8_g1u1_32x128_3tg_pf3E,32,128,,,,,3.0,200.9327,47.865222222222236,0.00%,14.03,14029.16
2026-01-12 04:49:06,15,16,7168,512,256,8,ActivationType.Gelu,torch.bfloat16,torch.float8_e4m3fnuz,torch.float8_e4m3fnuz,QuantType.per_Tensor,1,0,asm,stage1,16,_ZN5aiter48fmoe_stage1_bf16_pertokenFp8_g1u1_16x256_3tg_pf2E,16,256,,,,,2.0,201.4381,47.865222222222236,0.00%,13.99,13993.96
2026-01-12 04:49:06,15,16,7168,512,256,8,ActivationType.Gelu,torch.bfloat16,torch.float8_e4m3fnuz,torch.float8_e4m3fnuz,QuantType.per_Tensor,1,0,asm,stage1,16,_ZN5aiter48fmoe_stage1_bf16_pertokenFp8_g1u1_16x256_2tg_pf3E,16,256,,,,,3.0,201.4611,47.865222222222236,0.00%,13.99,13992.36
2026-01-12 04:49:06,15,16,7168,512,256,8,ActivationType.Gelu,torch.bfloat16,torch.float8_e4m3fnuz,torch.float8_e4m3fnuz,QuantType.per_Tensor,1,0,ck,stage1,64,moe_ck2stages_gemm1_256x64x128x128_1x4_MulABScale_v3_Nswizzle0_Quant1_MulRoutedWeight0_gelu_F8_F8_B16,64,128,128.0,256.0,1.0,4.0,3.0,202.17,47.865222222222236,0.00%,13.94,13943.3
2026-01-12 04:49:06,15,16,7168,512,256,8,ActivationType.Gelu,torch.bfloat16,torch.float8_e4m3fnuz,torch.float8_e4m3fnuz,QuantType.per_Tensor,1,0,asm,stage1,32,_ZN5aiter48fmoe_stage1_bf16_pertokenFp8_g1u1_32x256_2tg_pf3E,32,256,,,,,3.0,202.7173,47.865222222222236,0.00%,13.9,13905.65
2026-01-12 04:49:06,15,16,7168,512,256,8,ActivationType.Gelu,torch.bfloat16,torch.float8_e4m3fnuz,torch.float8_e4m3fnuz,QuantType.per_Tensor,1,0,asm,stage1,32,_ZN5aiter48fmoe_stage1_bf16_pertokenFp8_g1u1_32x256_2tg_pf2E,32,256,,,,,2.0,203.1104,47.865222222222236,0.00%,13.88,13878.74
2026-01-12 04:49:06,15,16,7168,512,256,8,ActivationType.Gelu,torch.bfloat16,torch.float8_e4m3fnuz,torch.float8_e4m3fnuz,QuantType.per_Tensor,1,0,asm,stage1,16,_ZN5aiter48fmoe_stage1_bf16_pertokenFp8_g1u1_16x512_2tg_pf2E,16,512,,,,,2.0,205.3024,47.865222222222236,0.00%,13.73,13730.56
2026-01-12 04:49:06,15,16,7168,512,256,8,ActivationType.Gelu,torch.bfloat16,torch.float8_e4m3fnuz,torch.float8_e4m3fnuz,QuantType.per_Tensor,1,0,asm,stage1,64,_ZN5aiter48fmoe_stage1_bf16_pertokenFp8_g1u1_64x128_2tg_pf2E,64,128,,,,,2.0,205.3375,47.865222222222236,0.00%,13.73,13728.21
2026-01-12 04:49:06,15,16,7168,512,256,8,ActivationType.Gelu,torch.bfloat16,torch.float8_e4m3fnuz,torch.float8_e4m3fnuz,QuantType.per_Tensor,1,0,asm,stage1,16,_ZN5aiter44fmoe_stage1_bf16_pertokenFp8_g1u1_16x512_pf3E,16,512,,,,,3.0,205.777,47.865222222222236,0.00%,13.7,13698.89
2026-01-12 04:49:06,15,16,7168,512,256,8,ActivationType.Gelu,torch.bfloat16,torch.float8_e4m3fnuz,torch.float8_e4m3fnuz,QuantType.per_Tensor,1,0,asm,stage1,64,_ZN5aiter48fmoe_stage1_bf16_pertokenFp8_g1u1_64x128_2tg_pf3E,64,128,,,,,3.0,206.6231,47.865222222222236,0.00%,13.64,13642.79
2026-01-12 04:49:06,15,16,7168,512,256,8,ActivationType.Gelu,torch.bfloat16,torch.float8_e4m3fnuz,torch.float8_e4m3fnuz,QuantType.per_Tensor,1,0,asm,stage1,64,_ZN5aiter44fmoe_stage1_bf16_pertokenFp8_g1u1_64x256_pf2E,64,256,,,,,2.0,207.9438,47.865222222222236,0.00%,13.55,13556.15
2026-01-12 04:49:06,15,16,7168,512,256,8,ActivationType.Gelu,torch.bfloat16,torch.float8_e4m3fnuz,torch.float8_e4m3fnuz,QuantType.per_Tensor,1,0,asm,stage1,32,_ZN5aiter44fmoe_stage1_bf16_pertokenFp8_g1u1_32x512_pf3E,32,512,,,,,3.0,208.8572,47.865222222222236,0.00%,13.5,13496.86
2026-01-12 04:49:06,15,16,7168,512,256,8,ActivationType.Gelu,torch.bfloat16,torch.float8_e4m3fnuz,torch.float8_e4m3fnuz,QuantType.per_Tensor,1,0,asm,stage1,64,_ZN5aiter44fmoe_stage1_bf16_pertokenFp8_g1u1_64x256_pf3E,64,256,,,,,3.0,209.494,47.865222222222236,0.00%,13.45,13455.83
2026-01-12 04:49:06,15,16,7168,512,256,8,ActivationType.Gelu,torch.bfloat16,torch.float8_e4m3fnuz,torch.float8_e4m3fnuz,QuantType.per_Tensor,1,0,asm,stage1,32,_ZN5aiter44fmoe_stage1_bf16_pertokenFp8_g1u1_32x512_pf2E,32,512,,,,,2.0,209.7794,47.865222222222236,0.00%,13.44,13437.53
2026-01-12 04:49:06,15,16,7168,512,256,8,ActivationType.Gelu,torch.bfloat16,torch.float8_e4m3fnuz,torch.float8_e4m3fnuz,QuantType.per_Tensor,1,0,asm,stage1,64,_ZN5aiter47fmoe_stage1_bf16_pertokenFp8_g1u1_64x64_3tg_pf2E,64,64,,,,,2.0,210.1904,47.865222222222236,0.00%,13.41,13411.25
2026-01-12 04:49:06,15,16,7168,512,256,8,ActivationType.Gelu,torch.bfloat16,torch.float8_e4m3fnuz,torch.float8_e4m3fnuz,QuantType.per_Tensor,1,0,ck,stage1,64,moe_ck2stages_gemm1_256x64x128x256_1x4_MulABScale_v3_Nswizzle0_Quant1_MulRoutedWeight0_gelu_F8_F8_B16,64,128,256.0,256.0,1.0,4.0,3.0,210.3232,47.865222222222236,0.00%,13.4,13402.78
2026-01-12 04:49:06,15,16,7168,512,256,8,ActivationType.Gelu,torch.bfloat16,torch.float8_e4m3fnuz,torch.float8_e4m3fnuz,QuantType.per_Tensor,1,0,asm,stage1,64,_ZN5aiter47fmoe_stage1_bf16_pertokenFp8_g1u1_64x64_2tg_pf3E,64,64,,,,,3.0,213.5462,47.865222222222236,0.00%,13.2,13200.5
2026-01-12 04:49:06,15,16,7168,512,256,8,ActivationType.Gelu,torch.bfloat16,torch.float8_e4m3fnuz,torch.float8_e4m3fnuz,QuantType.per_Tensor,1,0,ck,stage1,32,moe_ck2stages_gemm1_256x32x64x128_1x4_MulABScale_v1_Nswizzle0_Quant1_MulRoutedWeight0_gelu_F8_F8_B16,32,64,128.0,256.0,1.0,4.0,1.0,214.4355,47.865222222222236,96.08%,13.14,13145.75
2026-01-12 04:49:06,15,16,7168,512,256,8,ActivationType.Gelu,torch.bfloat16,torch.float8_e4m3fnuz,torch.float8_e4m3fnuz,QuantType.per_Tensor,1,0,ck,stage2,128,moe_ck2stages_gemm2_256x128x64x128_1x4_MulABScaleExpertWeight_v1_Nswizzle0_Quant1_MulRoutedWeight1_F8_F8_B16,128,64,128.0,256.0,1.0,4.0,1.0,220.2223,47.865222222222236,3.18%,12.8,12800.32
2026-01-12 04:49:06,15,16,7168,512,256,8,ActivationType.Gelu,torch.bfloat16,torch.float8_e4m3fnuz,torch.float8_e4m3fnuz,QuantType.per_Tensor,1,0,asm,stage1,128,_ZN5aiter44fmoe_stage1_bf16_pertokenFp8_g1u1_128x64_pf3E,128,64,,,,,3.0,239.1364,47.865222222222236,0.00%,11.79,11787.9
2026-01-12 04:49:06,15,16,7168,512,256,8,ActivationType.Gelu,torch.bfloat16,torch.float8_e4m3fnuz,torch.float8_e4m3fnuz,QuantType.per_Tensor,1,0,ck,stage2,128,moe_ck2stages_gemm2_256x128x128x64_1x4_MulABScaleExpertWeight_v3_Nswizzle0_Quant1_MulRoutedWeight1_F8_F8_B16,128,128,64.0,256.0,1.0,4.0,3.0,245.4914,47.865222222222236,99.49%,11.48,11482.75
2026-01-12 04:49:06,15,16,7168,512,256,8,ActivationType.Gelu,torch.bfloat16,torch.float8_e4m3fnuz,torch.float8_e4m3fnuz,QuantType.per_Tensor,1,0,ck,stage1,64,moe_ck2stages_gemm1_256x64x64x128_1x4_MulABScale_v1_Nswizzle0_Quant1_MulRoutedWeight0_gelu_F8_F8_B16,64,64,128.0,256.0,1.0,4.0,1.0,262.2352,47.865222222222236,96.08%,10.75,10749.57
2026-01-12 04:49:06,15,16,7168,512,256,8,ActivationType.Gelu,torch.bfloat16,torch.float8_e4m3fnuz,torch.float8_e4m3fnuz,QuantType.per_Tensor,1,0,asm,stage1,128,_ZN5aiter45fmoe_stage1_bf16_pertokenFp8_g1u1_128x128_pf3E,128,128,,,,,3.0,267.9487,47.865222222222236,0.00%,10.52,10520.36
2026-01-12 04:49:06,15,16,7168,512,256,8,ActivationType.Gelu,torch.bfloat16,torch.float8_e4m3fnuz,torch.float8_e4m3fnuz,QuantType.per_Tensor,1,0,asm,stage1,128,_ZN5aiter45fmoe_stage1_bf16_pertokenFp8_g1u1_128x128_pf2E,128,128,,,,,2.0,267.9887,47.865222222222236,0.00%,10.52,10518.79
2026-01-12 04:49:06,15,16,7168,512,256,8,ActivationType.Gelu,torch.bfloat16,torch.float8_e4m3fnuz,torch.float8_e4m3fnuz,QuantType.per_Tensor,1,0,asm,stage1,128,_ZN5aiter44fmoe_stage1_bf16_pertokenFp8_g1u1_128x64_pf2E,128,64,,,,,2.0,268.5406,47.865222222222236,0.00%,10.5,10497.17
2026-01-12 04:49:06,15,16,7168,512,256,8,ActivationType.Gelu,torch.bfloat16,torch.float8_e4m3fnuz,torch.float8_e4m3fnuz,QuantType.per_Tensor,1,0,ck,stage1,128,moe_ck2stages_gemm1_256x128x128x128_1x4_MulABScale_v3_Nswizzle0_Quant1_MulRoutedWeight0_gelu_F8_F8_B16,128,128,128.0,256.0,1.0,4.0,3.0,272.3469,47.865222222222236,0.00%,10.35,10350.46
2026-01-12 04:49:06,15,16,7168,512,256,8,ActivationType.Gelu,torch.bfloat16,torch.float8_e4m3fnuz,torch.float8_e4m3fnuz,QuantType.per_Tensor,1,0,ck,stage1,128,moe_ck2stages_gemm1_256x128x128x256_1x4_MulABScale_v3_Nswizzle0_Quant1_MulRoutedWeight0_gelu_F8_F8_B16,128,128,256.0,256.0,1.0,4.0,3.0,274.8451,47.865222222222236,0.00%,10.26,10256.38
2026-01-12 04:49:06,15,16,7168,512,256,8,ActivationType.Gelu,torch.bfloat16,torch.float8_e4m3fnuz,torch.float8_e4m3fnuz,QuantType.per_Tensor,1,0,ck,stage2,128,moe_ck2stages_gemm2_256x128x64x64_1x4_MulABScaleExpertWeight_v3_Nswizzle0_Quant1_MulRoutedWeight1_F8_F8_B16,128,64,64.0,256.0,1.0,4.0,3.0,280.8735,47.865222222222236,99.49%,10.04,10036.25
2026-01-12 04:49:06,15,16,7168,512,256,8,ActivationType.Gelu,torch.bfloat16,torch.float8_e4m3fnuz,torch.float8_e4m3fnuz,QuantType.per_Tensor,1,0,ck,stage1,32,moe_ck2stages_gemm1_256x32x64x256_1x4_MulABScale_v1_Nswizzle0_Quant1_MulRoutedWeight0_gelu_F8_F8_B16,32,64,256.0,256.0,1.0,4.0,1.0,501.1538,47.865222222222236,96.08%,5.62,5624.85
2026-01-12 04:49:06,15,16,7168,512,256,8,ActivationType.Gelu,torch.bfloat16,torch.float8_e4m3fnuz,torch.float8_e4m3fnuz,QuantType.per_Tensor,1,0,ck,stage1,64,moe_ck2stages_gemm1_256x64x64x256_1x4_MulABScale_v1_Nswizzle0_Quant1_MulRoutedWeight0_gelu_F8_F8_B16,64,64,256.0,256.0,1.0,4.0,1.0,2049.7576,47.865222222222236,96.08%,1.38,1375.24
2026-01-12 04:49:06,15,16,7168,512,256,8,ActivationType.Gelu,torch.bfloat16,torch.float8_e4m3fnuz,torch.float8_e4m3fnuz,QuantType.per_Tensor,1,0,ck,stage1,128,moe_ck2stages_gemm1_256x128x64x128_1x4_MulABScale_v1_Nswizzle0_Quant1_MulRoutedWeight0_gelu_F8_F8_B16,128,64,128.0,256.0,1.0,4.0,1.0,2764.6648,47.865222222222236,96.08%,1.02,1019.62
2026-01-12 04:49:20,16,512,7168,256,256,8,ActivationType.Silu,torch.bfloat16,torch.bfloat16,torch.bfloat16,QuantType.No,1,1,ck,stage2,32,moe_ck2stages_gemm2_256x32x64x64_1x4_TypeCast_v1_Nswizzle0_Quant0_MulRoutedWeight0_B16_B16_B16,32,64,64.0,256.0,1.0,4.0,1.0,272.8953,0.0,0.00%,165.25,10382.2
2026-01-12 04:49:20,16,512,7168,256,256,8,ActivationType.Silu,torch.bfloat16,torch.bfloat16,torch.bfloat16,QuantType.No,1,1,ck,stage2,32,moe_ck2stages_gemm2_256x32x64x128_1x4_TypeCast_v1_Nswizzle0_Quant0_MulRoutedWeight0_B16_B16_B16,32,64,128.0,256.0,1.0,4.0,1.0,273.5506,0.0,0.00%,164.86,10357.32
2026-01-12 04:49:20,16,512,7168,256,256,8,ActivationType.Silu,torch.bfloat16,torch.bfloat16,torch.bfloat16,QuantType.No,1,1,ck,stage2,64,moe_ck2stages_gemm2_256x64x64x64_1x4_TypeCast_v1_Nswizzle0_Quant0_MulRoutedWeight0_B16_B16_B16,64,64,64.0,256.0,1.0,4.0,1.0,282.3669,0.0,0.00%,159.71,10033.94
2026-01-12 04:49:20,16,512,7168,256,256,8,ActivationType.Silu,torch.bfloat16,torch.bfloat16,torch.bfloat16,QuantType.No,1,1,ck,stage2,64,moe_ck2stages_gemm2_256x64x128x128_1x4_TypeCast_v3_Nswizzle0_Quant0_MulRoutedWeight0_B16_B16_B16,64,128,128.0,256.0,1.0,4.0,3.0,284.8858,0.0,0.00%,158.3,9945.22
2026-01-12 04:49:20,16,512,7168,256,256,8,ActivationType.Silu,torch.bfloat16,torch.bfloat16,torch.bfloat16,QuantType.No,1,1,ck,stage2,64,moe_ck2stages_gemm2_256x64x64x128_1x4_TypeCast_v1_Nswizzle0_Quant0_MulRoutedWeight0_B16_B16_B16,64,64,128.0,256.0,1.0,4.0,1.0,284.9151,0.0,0.00%,158.28,9944.2
2026-01-12 04:49:20,16,512,7168,256,256,8,ActivationType.Silu,torch.bfloat16,torch.bfloat16,torch.bfloat16,QuantType.No,1,1,ck,stage2,64,moe_ck2stages_gemm2_256x64x128x64_1x4_TypeCast_v3_Nswizzle0_Quant0_MulRoutedWeight0_B16_B16_B16,64,128,64.0,256.0,1.0,4.0,3.0,294.6768,0.0,0.00%,153.04,9614.78
2026-01-12 04:49:20,16,512,7168,256,256,8,ActivationType.Silu,torch.bfloat16,torch.bfloat16,torch.bfloat16,QuantType.No,1,1,ck,stage2,128,moe_ck2stages_gemm2_256x128x128x64_1x4_TypeCast_v3_Nswizzle0_Quant0_MulRoutedWeight0_B16_B16_B16,128,128,64.0,256.0,1.0,4.0,3.0,358.1313,0.0,0.00%,125.92,7911.21
2026-01-12 04:49:20,16,512,7168,256,256,8,ActivationType.Silu,torch.bfloat16,torch.bfloat16,torch.bfloat16,QuantType.No,1,1,ck,stage2,128,moe_ck2stages_gemm2_256x128x64x64_1x4_TypeCast_v3_Nswizzle0_Quant0_MulRoutedWeight0_B16_B16_B16,128,64,64.0,256.0,1.0,4.0,3.0,465.9432,0.0,0.00%,96.79,6080.68
2026-01-12 04:49:20,16,512,7168,256,256,8,ActivationType.Silu,torch.bfloat16,torch.bfloat16,torch.bfloat16,QuantType.No,1,1,ck,stage1,32,moe_ck2stages_gemm1_256x32x64x128_1x4_TypeCastExpertWeight_v1_Nswizzle0_Quant0_MulRoutedWeight1_silu_B16_B16_B16,32,64,128.0,256.0,1.0,4.0,1.0,492.1432,0.0,0.00%,91.63,5756.97
2026-01-12 04:49:20,16,512,7168,256,256,8,ActivationType.Silu,torch.bfloat16,torch.bfloat16,torch.bfloat16,QuantType.No,1,1,ck,stage2,128,moe_ck2stages_gemm2_256x128x64x64_1x4_TypeCast_v1_Nswizzle0_Quant0_MulRoutedWeight0_B16_B16_B16,128,64,64.0,256.0,1.0,4.0,1.0,497.5009,0.0,0.00%,90.65,5694.97
2026-01-12 04:49:20,16,512,7168,256,256,8,ActivationType.Silu,torch.bfloat16,torch.bfloat16,torch.bfloat16,QuantType.No,1,1,ck,stage1,32,moe_ck2stages_gemm1_256x32x64x64_1x4_TypeCastExpertWeight_v1_Nswizzle0_Quant0_MulRoutedWeight1_silu_B16_B16_B16,32,64,64.0,256.0,1.0,4.0,1.0,500.2064,0.0,0.00%,90.16,5664.17
2026-01-12 04:49:20,16,512,7168,256,256,8,ActivationType.Silu,torch.bfloat16,torch.bfloat16,torch.bfloat16,QuantType.No,1,1,ck,stage1,64,moe_ck2stages_gemm1_256x64x128x128_1x4_TypeCastExpertWeight_v3_Nswizzle0_Quant0_MulRoutedWeight1_silu_B16_B16_B16,64,128,128.0,256.0,1.0,4.0,3.0,502.1354,0.0,0.00%,89.81,5642.41
2026-01-12 04:49:20,16,512,7168,256,256,8,ActivationType.Silu,torch.bfloat16,torch.bfloat16,torch.bfloat16,QuantType.No,1,1,ck,stage1,64,moe_ck2stages_gemm1_256x64x128x64_1x4_TypeCastExpertWeight_v3_Nswizzle0_Quant0_MulRoutedWeight1_silu_B16_B16_B16,64,128,64.0,256.0,1.0,4.0,3.0,504.6022,0.0,0.00%,89.37,5614.82
2026-01-12 04:49:20,16,512,7168,256,256,8,ActivationType.Silu,torch.bfloat16,torch.bfloat16,torch.bfloat16,QuantType.No,1,1,ck,stage1,64,moe_ck2stages_gemm1_256x64x64x128_1x4_TypeCastExpertWeight_v1_Nswizzle0_Quant0_MulRoutedWeight1_silu_B16_B16_B16,64,64,128.0,256.0,1.0,4.0,1.0,520.9176,0.0,0.00%,86.57,5438.96
2026-01-12 04:49:20,16,512,7168,256,256,8,ActivationType.Silu,torch.bfloat16,torch.bfloat16,torch.bfloat16,QuantType.No,1,1,ck,stage1,64,moe_ck2stages_gemm1_256x64x64x64_1x4_TypeCastExpertWeight_v1_Nswizzle0_Quant0_MulRoutedWeight1_silu_B16_B16_B16,64,64,64.0,256.0,1.0,4.0,1.0,524.0331,0.0,0.00%,86.06,5406.63
2026-01-12 04:49:20,16,512,7168,256,256,8,ActivationType.Silu,torch.bfloat16,torch.bfloat16,torch.bfloat16,QuantType.No,1,1,ck,stage1,128,moe_ck2stages_gemm1_256x128x128x64_1x4_TypeCastExpertWeight_v3_Nswizzle0_Quant0_MulRoutedWeight1_silu_B16_B16_B16,128,128,64.0,256.0,1.0,4.0,3.0,556.3214,0.0,0.00%,81.06,5092.83
2026-01-12 04:49:20,16,512,7168,256,256,8,ActivationType.Silu,torch.bfloat16,torch.bfloat16,torch.bfloat16,QuantType.No,1,1,ck,stage1,128,moe_ck2stages_gemm1_256x128x128x128_1x4_TypeCastExpertWeight_v3_Nswizzle0_Quant0_MulRoutedWeight1_silu_B16_B16_B16,128,128,128.0,256.0,1.0,4.0,3.0,557.2724,0.0,0.00%,80.92,5084.14
2026-01-12 04:49:20,16,512,7168,256,256,8,ActivationType.Silu,torch.bfloat16,torch.bfloat16,torch.bfloat16,QuantType.No,1,1,ck,stage1,128,moe_ck2stages_gemm1_256x128x64x64_1x4_TypeCastExpertWeight_v1_Nswizzle0_Quant0_MulRoutedWeight1_silu_B16_B16_B16,128,64,64.0,256.0,1.0,4.0,1.0,574.9859,0.0,0.00%,78.43,4927.52
2026-01-12 04:49:35,17,512,7168,256,256,8,ActivationType.Gelu,torch.bfloat16,torch.bfloat16,torch.bfloat16,QuantType.No,1,1,ck,stage2,32,moe_ck2stages_gemm2_256x32x64x64_1x4_TypeCast_v1_Nswizzle0_Quant0_MulRoutedWeight0_B16_B16_B16,32,64,64.0,256.0,1.0,4.0,1.0,273.4291,0.0,0.00%,164.93,10361.93
2026-01-12 04:49:35,17,512,7168,256,256,8,ActivationType.Gelu,torch.bfloat16,torch.bfloat16,torch.bfloat16,QuantType.No,1,1,ck,stage2,32,moe_ck2stages_gemm2_256x32x64x128_1x4_TypeCast_v1_Nswizzle0_Quant0_MulRoutedWeight0_B16_B16_B16,32,64,128.0,256.0,1.0,4.0,1.0,278.2183,0.0,0.00%,162.09,10183.56
2026-01-12 04:49:35,17,512,7168,256,256,8,ActivationType.Gelu,torch.bfloat16,torch.bfloat16,torch.bfloat16,QuantType.No,1,1,ck,stage2,64,moe_ck2stages_gemm2_256x64x64x128_1x4_TypeCast_v1_Nswizzle0_Quant0_MulRoutedWeight0_B16_B16_B16,64,64,128.0,256.0,1.0,4.0,1.0,284.3907,0.0,0.00%,158.57,9962.54
2026-01-12 04:49:35,17,512,7168,256,256,8,ActivationType.Gelu,torch.bfloat16,torch.bfloat16,torch.bfloat16,QuantType.No,1,1,ck,stage2,64,moe_ck2stages_gemm2_256x64x64x64_1x4_TypeCast_v1_Nswizzle0_Quant0_MulRoutedWeight0_B16_B16_B16,64,64,64.0,256.0,1.0,4.0,1.0,285.7043,0.0,0.00%,157.85,9916.73
2026-01-12 04:49:35,17,512,7168,256,256,8,ActivationType.Gelu,torch.bfloat16,torch.bfloat16,torch.bfloat16,QuantType.No,1,1,ck,stage2,64,moe_ck2stages_gemm2_256x64x128x128_1x4_TypeCast_v3_Nswizzle0_Quant0_MulRoutedWeight0_B16_B16_B16,64,128,128.0,256.0,1.0,4.0,3.0,288.8249,0.0,0.00%,156.14,9809.58
2026-01-12 04:49:35,17,512,7168,256,256,8,ActivationType.Gelu,torch.bfloat16,torch.bfloat16,torch.bfloat16,QuantType.No,1,1,ck,stage2,64,moe_ck2stages_gemm2_256x64x128x64_1x4_TypeCast_v3_Nswizzle0_Quant0_MulRoutedWeight0_B16_B16_B16,64,128,64.0,256.0,1.0,4.0,3.0,290.1279,0.0,0.00%,155.44,9765.53
2026-01-12 04:49:35,17,512,7168,256,256,8,ActivationType.Gelu,torch.bfloat16,torch.bfloat16,torch.bfloat16,QuantType.No,1,1,ck,stage2,128,moe_ck2stages_gemm2_256x128x128x64_1x4_TypeCast_v3_Nswizzle0_Quant0_MulRoutedWeight0_B16_B16_B16,128,128,64.0,256.0,1.0,4.0,3.0,359.754,0.0,0.00%,125.36,7875.53
2026-01-12 04:49:35,17,512,7168,256,256,8,ActivationType.Gelu,torch.bfloat16,torch.bfloat16,torch.bfloat16,QuantType.No,1,1,ck,stage2,128,moe_ck2stages_gemm2_256x128x64x64_1x4_TypeCast_v3_Nswizzle0_Quant0_MulRoutedWeight0_B16_B16_B16,128,64,64.0,256.0,1.0,4.0,3.0,466.9835,0.0,0.00%,96.57,6067.14
2026-01-12 04:49:35,17,512,7168,256,256,8,ActivationType.Gelu,torch.bfloat16,torch.bfloat16,torch.bfloat16,QuantType.No,1,1,ck,stage1,32,moe_ck2stages_gemm1_256x32x64x128_1x4_TypeCastExpertWeight_v1_Nswizzle0_Quant0_MulRoutedWeight1_gelu_B16_B16_B16,32,64,128.0,256.0,1.0,4.0,1.0,492.3592,0.0,0.00%,91.59,5754.44
2026-01-12 04:49:35,17,512,7168,256,256,8,ActivationType.Gelu,torch.bfloat16,torch.bfloat16,torch.bfloat16,QuantType.No,1,1,ck,stage1,32,moe_ck2stages_gemm1_256x32x64x64_1x4_TypeCastExpertWeight_v1_Nswizzle0_Quant0_MulRoutedWeight1_gelu_B16_B16_B16,32,64,64.0,256.0,1.0,4.0,1.0,496.1964,0.0,0.00%,90.89,5709.94
2026-01-12 04:49:35,17,512,7168,256,256,8,ActivationType.Gelu,torch.bfloat16,torch.bfloat16,torch.bfloat16,QuantType.No,1,1,ck,stage2,128,moe_ck2stages_gemm2_256x128x64x64_1x4_TypeCast_v1_Nswizzle0_Quant0_MulRoutedWeight0_B16_B16_B16,128,64,64.0,256.0,1.0,4.0,1.0,498.6165,0.0,0.00%,90.44,5682.23
2026-01-12 04:49:35,17,512,7168,256,256,8,ActivationType.Gelu,torch.bfloat16,torch.bfloat16,torch.bfloat16,QuantType.No,1,1,ck,stage1,64,moe_ck2stages_gemm1_256x64x128x64_1x4_TypeCastExpertWeight_v3_Nswizzle0_Quant0_MulRoutedWeight1_gelu_B16_B16_B16,64,128,64.0,256.0,1.0,4.0,3.0,499.0624,0.0,0.00%,90.36,5677.15
2026-01-12 04:49:35,17,512,7168,256,256,8,ActivationType.Gelu,torch.bfloat16,torch.bfloat16,torch.bfloat16,QuantType.No,1,1,ck,stage1,64,moe_ck2stages_gemm1_256x64x128x128_1x4_TypeCastExpertWeight_v3_Nswizzle0_Quant0_MulRoutedWeight1_gelu_B16_B16_B16,64,128,128.0,256.0,1.0,4.0,3.0,499.646,0.0,0.00%,90.26,5670.52
2026-01-12 04:49:35,17,512,7168,256,256,8,ActivationType.Gelu,torch.bfloat16,torch.bfloat16,torch.bfloat16,QuantType.No,1,1,ck,stage1,64,moe_ck2stages_gemm1_256x64x64x128_1x4_TypeCastExpertWeight_v1_Nswizzle0_Quant0_MulRoutedWeight1_gelu_B16_B16_B16,64,64,128.0,256.0,1.0,4.0,1.0,517.1587,0.0,0.00%,87.2,5478.5
2026-01-12 04:49:35,17,512,7168,256,256,8,ActivationType.Gelu,torch.bfloat16,torch.bfloat16,torch.bfloat16,QuantType.No,1,1,ck,stage1,64,moe_ck2stages_gemm1_256x64x64x64_1x4_TypeCastExpertWeight_v1_Nswizzle0_Quant0_MulRoutedWeight1_gelu_B16_B16_B16,64,64,64.0,256.0,1.0,4.0,1.0,523.1785,0.0,0.00%,86.2,5415.46
2026-01-12 04:49:35,17,512,7168,256,256,8,ActivationType.Gelu,torch.bfloat16,torch.bfloat16,torch.bfloat16,QuantType.No,1,1,ck,stage1,128,moe_ck2stages_gemm1_256x128x128x128_1x4_TypeCastExpertWeight_v3_Nswizzle0_Quant0_MulRoutedWeight1_gelu_B16_B16_B16,128,128,128.0,256.0,1.0,4.0,3.0,547.5425,0.0,0.00%,82.36,5174.49
2026-01-12 04:49:35,17,512,7168,256,256,8,ActivationType.Gelu,torch.bfloat16,torch.bfloat16,torch.bfloat16,QuantType.No,1,1,ck,stage1,128,moe_ck2stages_gemm1_256x128x128x64_1x4_TypeCastExpertWeight_v3_Nswizzle0_Quant0_MulRoutedWeight1_gelu_B16_B16_B16,128,128,64.0,256.0,1.0,4.0,3.0,554.6648,0.0,0.00%,81.31,5108.04
2026-01-12 04:49:35,17,512,7168,256,256,8,ActivationType.Gelu,torch.bfloat16,torch.bfloat16,torch.bfloat16,QuantType.No,1,1,ck,stage1,128,moe_ck2stages_gemm1_256x128x64x64_1x4_TypeCastExpertWeight_v1_Nswizzle0_Quant0_MulRoutedWeight1_gelu_B16_B16_B16,128,64,64.0,256.0,1.0,4.0,1.0,575.52,0.0,0.00%,78.36,4922.94
2026-01-12 04:50:05,18,16,7168,256,256,8,ActivationType.Silu,torch.bfloat16,torch.float8_e4m3fnuz,torch.float8_e4m3fnuz,QuantType.per_Tensor,1,1,ck,stage2,32,moe_ck2stages_gemm2_256x32x64x256_1x4_MulABScaleExpertWeight_v1_Nswizzle0_Quant1_MulRoutedWeight0_F8_F8_B16,32,64,256.0,256.0,1.0,4.0,1.0,58.9708,37.74366666666668,0.00%,23.9,23903.87
2026-01-12 04:50:05,18,16,7168,256,256,8,ActivationType.Silu,torch.bfloat16,torch.float8_e4m3fnuz,torch.float8_e4m3fnuz,QuantType.per_Tensor,1,1,ck,stage2,32,moe_ck2stages_gemm2_256x32x64x128_1x4_MulABScaleExpertWeight_v1_Nswizzle0_Quant1_MulRoutedWeight0_F8_F8_B16,32,64,128.0,256.0,1.0,4.0,1.0,61.2745,37.74366666666668,0.00%,23.0,23005.17
2026-01-12 04:50:05,18,16,7168,256,256,8,ActivationType.Silu,torch.bfloat16,torch.float8_e4m3fnuz,torch.float8_e4m3fnuz,QuantType.per_Tensor,1,1,ck,stage2,64,moe_ck2stages_gemm2_256x64x128x256_1x4_MulABScaleExpertWeight_v3_Nswizzle0_Quant1_MulRoutedWeight0_F8_F8_B16,64,128,256.0,256.0,1.0,4.0,3.0,67.7393,37.74366666666668,0.00%,20.8,20809.64
2026-01-12 04:50:05,18,16,7168,256,256,8,ActivationType.Silu,torch.bfloat16,torch.float8_e4m3fnuz,torch.float8_e4m3fnuz,QuantType.per_Tensor,1,1,ck,stage2,32,moe_ck2stages_gemm2_256x32x64x64_1x4_MulABScaleExpertWeight_v1_Nswizzle0_Quant1_MulRoutedWeight0_F8_F8_B16,32,64,64.0,256.0,1.0,4.0,1.0,69.8694,37.74366666666668,98.03%,20.17,20175.22
2026-01-12 04:50:05,18,16,7168,256,256,8,ActivationType.Silu,torch.bfloat16,torch.float8_e4m3fnuz,torch.float8_e4m3fnuz,QuantType.per_Tensor,1,1,ck,stage2,64,moe_ck2stages_gemm2_256x64x64x256_1x4_MulABScaleExpertWeight_v1_Nswizzle0_Quant1_MulRoutedWeight0_F8_F8_B16,64,64,256.0,256.0,1.0,4.0,1.0,77.1974,37.74366666666668,0.00%,18.26,18260.07
2026-01-12 04:50:05,18,16,7168,256,256,8,ActivationType.Silu,torch.bfloat16,torch.float8_e4m3fnuz,torch.float8_e4m3fnuz,QuantType.per_Tensor,1,1,ck,stage2,64,moe_ck2stages_gemm2_256x64x128x128_1x4_MulABScaleExpertWeight_v3_Nswizzle0_Quant1_MulRoutedWeight0_F8_F8_B16,64,128,128.0,256.0,1.0,4.0,3.0,86.4763,37.74366666666668,0.00%,16.3,16300.77
2026-01-12 04:50:05,18,16,7168,256,256,8,ActivationType.Silu,torch.bfloat16,torch.float8_e4m3fnuz,torch.float8_e4m3fnuz,QuantType.per_Tensor,1,1,ck,stage2,64,moe_ck2stages_gemm2_256x64x64x64_1x4_MulABScaleExpertWeight_v1_Nswizzle0_Quant1_MulRoutedWeight0_F8_F8_B16,64,64,64.0,256.0,1.0,4.0,1.0,104.7979,37.74366666666668,98.03%,13.45,13450.94
2026-01-12 04:50:05,18,16,7168,256,256,8,ActivationType.Silu,torch.bfloat16,torch.float8_e4m3fnuz,torch.float8_e4m3fnuz,QuantType.per_Tensor,1,1,ck,stage1,64,moe_ck2stages_gemm1_256x64x128x128_1x4_MulABScale_v3_Nswizzle0_Quant1_MulRoutedWeight1_silu_F8_F8_B16,64,128,128.0,256.0,1.0,4.0,3.0,106.5195,37.74366666666668,0.00%,13.23,13233.54
2026-01-12 04:50:05,18,16,7168,256,256,8,ActivationType.Silu,torch.bfloat16,torch.float8_e4m3fnuz,torch.float8_e4m3fnuz,QuantType.per_Tensor,1,1,asm,stage1,16,_ZN5aiter57fmoe_stage1_bf16_pertokenFp8_doweight_g1u1_16x128_4tg_pf3E,16,128,,,,,3.0,108.4359,37.74366666666668,0.00%,13.0,12999.66
2026-01-12 04:50:05,18,16,7168,256,256,8,ActivationType.Silu,torch.bfloat16,torch.float8_e4m3fnuz,torch.float8_e4m3fnuz,QuantType.per_Tensor,1,1,ck,stage2,128,moe_ck2stages_gemm2_256x128x64x128_1x4_MulABScaleExpertWeight_v1_Nswizzle0_Quant1_MulRoutedWeight0_F8_F8_B16,128,64,128.0,256.0,1.0,4.0,1.0,108.4683,37.74366666666668,0.00%,12.99,12995.78
2026-01-12 04:50:05,18,16,7168,256,256,8,ActivationType.Silu,torch.bfloat16,torch.float8_e4m3fnuz,torch.float8_e4m3fnuz,QuantType.per_Tensor,1,1,ck,stage1,64,moe_ck2stages_gemm1_256x64x128x256_1x4_MulABScale_v3_Nswizzle0_Quant1_MulRoutedWeight1_silu_F8_F8_B16,64,128,256.0,256.0,1.0,4.0,3.0,108.4862,37.74366666666668,0.00%,12.99,12993.64
2026-01-12 04:50:05,18,16,7168,256,256,8,ActivationType.Silu,torch.bfloat16,torch.float8_e4m3fnuz,torch.float8_e4m3fnuz,QuantType.per_Tensor,1,1,asm,stage1,16,_ZN5aiter56fmoe_stage1_bf16_pertokenFp8_doweight_g1u1_16x64_5tg_pf3E,16,64,,,,,3.0,108.6584,37.74366666666668,0.00%,12.97,12973.04
2026-01-12 04:50:05,18,16,7168,256,256,8,ActivationType.Silu,torch.bfloat16,torch.float8_e4m3fnuz,torch.float8_e4m3fnuz,QuantType.per_Tensor,1,1,asm,stage1,16,_ZN5aiter56fmoe_stage1_bf16_pertokenFp8_doweight_g1u1_16x64_6tg_pf2E,16,64,,,,,2.0,108.7871,37.74366666666668,0.00%,12.95,12957.7
2026-01-12 04:50:05,18,16,7168,256,256,8,ActivationType.Silu,torch.bfloat16,torch.float8_e4m3fnuz,torch.float8_e4m3fnuz,QuantType.per_Tensor,1,1,asm,stage1,32,_ZN5aiter57fmoe_stage1_bf16_pertokenFp8_doweight_g1u1_32x128_3tg_pf3E,32,128,,,,,3.0,109.161,37.74366666666668,0.00%,12.91,12913.31
2026-01-12 04:50:05,18,16,7168,256,256,8,ActivationType.Silu,torch.bfloat16,torch.float8_e4m3fnuz,torch.float8_e4m3fnuz,QuantType.per_Tensor,1,1,asm,stage1,32,_ZN5aiter56fmoe_stage1_bf16_pertokenFp8_doweight_g1u1_32x64_4tg_pf3E,32,64,,,,,3.0,109.4164,37.74366666666668,0.00%,12.88,12883.17
2026-01-12 04:50:05,18,16,7168,256,256,8,ActivationType.Silu,torch.bfloat16,torch.float8_e4m3fnuz,torch.float8_e4m3fnuz,QuantType.per_Tensor,1,1,asm,stage1,32,_ZN5aiter56fmoe_stage1_bf16_pertokenFp8_doweight_g1u1_32x64_4tg_pf2E,32,64,,,,,2.0,109.9663,37.74366666666668,0.00%,12.82,12818.75
2026-01-12 04:50:05,18,16,7168,256,256,8,ActivationType.Silu,torch.bfloat16,torch.float8_e4m3fnuz,torch.float8_e4m3fnuz,QuantType.per_Tensor,1,1,asm,stage1,16,_ZN5aiter57fmoe_stage1_bf16_pertokenFp8_doweight_g1u1_16x256_2tg_pf3E,16,256,,,,,3.0,110.9955,37.74366666666668,0.00%,12.7,12699.89
2026-01-12 04:50:05,18,16,7168,256,256,8,ActivationType.Silu,torch.bfloat16,torch.float8_e4m3fnuz,torch.float8_e4m3fnuz,QuantType.per_Tensor,1,1,asm,stage1,16,_ZN5aiter57fmoe_stage1_bf16_pertokenFp8_doweight_g1u1_16x128_4tg_pf2E,16,128,,,,,2.0,112.2927,37.74366666666668,0.00%,12.55,12553.18
2026-01-12 04:50:05,18,16,7168,256,256,8,ActivationType.Silu,torch.bfloat16,torch.float8_e4m3fnuz,torch.float8_e4m3fnuz,QuantType.per_Tensor,1,1,asm,stage1,64,_ZN5aiter57fmoe_stage1_bf16_pertokenFp8_doweight_g1u1_64x128_2tg_pf3E,64,128,,,,,3.0,112.5516,37.74366666666668,0.00%,12.52,12524.3
2026-01-12 04:50:05,18,16,7168,256,256,8,ActivationType.Silu,torch.bfloat16,torch.float8_e4m3fnuz,torch.float8_e4m3fnuz,QuantType.per_Tensor,1,1,asm,stage1,32,_ZN5aiter57fmoe_stage1_bf16_pertokenFp8_doweight_g1u1_32x256_2tg_pf3E,32,256,,,,,3.0,112.8463,37.74366666666668,0.00%,12.49,12491.59
2026-01-12 04:50:05,18,16,7168,256,256,8,ActivationType.Silu,torch.bfloat16,torch.float8_e4m3fnuz,torch.float8_e4m3fnuz,QuantType.per_Tensor,1,1,asm,stage1,32,_ZN5aiter57fmoe_stage1_bf16_pertokenFp8_doweight_g1u1_32x128_3tg_pf2E,32,128,,,,,2.0,112.8715,37.74366666666668,0.00%,12.49,12488.81
2026-01-12 04:50:05,18,16,7168,256,256,8,ActivationType.Silu,torch.bfloat16,torch.float8_e4m3fnuz,torch.float8_e4m3fnuz,QuantType.per_Tensor,1,1,asm,stage1,64,_ZN5aiter56fmoe_stage1_bf16_pertokenFp8_doweight_g1u1_64x64_2tg_pf2E,64,64,,,,,2.0,112.8781,37.74366666666668,0.00%,12.49,12488.08
2026-01-12 04:50:05,18,16,7168,256,256,8,ActivationType.Silu,torch.bfloat16,torch.float8_e4m3fnuz,torch.float8_e4m3fnuz,QuantType.per_Tensor,1,1,asm,stage1,64,_ZN5aiter56fmoe_stage1_bf16_pertokenFp8_doweight_g1u1_64x64_2tg_pf3E,64,64,,,,,3.0,113.5561,37.74366666666668,0.00%,12.41,12413.51
2026-01-12 04:50:05,18,16,7168,256,256,8,ActivationType.Silu,torch.bfloat16,torch.float8_e4m3fnuz,torch.float8_e4m3fnuz,QuantType.per_Tensor,1,1,asm,stage1,64,_ZN5aiter57fmoe_stage1_bf16_pertokenFp8_doweight_g1u1_64x128_2tg_pf2E,64,128,,,,,2.0,114.9188,37.74366666666668,0.00%,12.26,12266.32
2026-01-12 04:50:05,18,16,7168,256,256,8,ActivationType.Silu,torch.bfloat16,torch.float8_e4m3fnuz,torch.float8_e4m3fnuz,QuantType.per_Tensor,1,1,ck,stage2,64,moe_ck2stages_gemm2_256x64x128x64_1x4_MulABScaleExpertWeight_v3_Nswizzle0_Quant1_MulRoutedWeight0_F8_F8_B16,64,128,64.0,256.0,1.0,4.0,3.0,116.1536,37.74366666666668,98.03%,12.13,12135.91
2026-01-12 04:50:05,18,16,7168,256,256,8,ActivationType.Silu,torch.bfloat16,torch.float8_e4m3fnuz,torch.float8_e4m3fnuz,QuantType.per_Tensor,1,1,ck,stage2,128,moe_ck2stages_gemm2_256x128x128x128_1x4_MulABScaleExpertWeight_v3_Nswizzle0_Quant1_MulRoutedWeight0_F8_F8_B16,128,128,128.0,256.0,1.0,4.0,3.0,122.0003,37.74366666666668,0.00%,11.55,11554.32
2026-01-12 04:50:05,18,16,7168,256,256,8,ActivationType.Silu,torch.bfloat16,torch.float8_e4m3fnuz,torch.float8_e4m3fnuz,QuantType.per_Tensor,1,1,asm,stage1,32,_ZN5aiter57fmoe_stage1_bf16_pertokenFp8_doweight_g1u1_32x256_2tg_pf2E,32,256,,,,,2.0,124.0291,37.74366666666668,0.00%,11.36,11365.32
2026-01-12 04:50:05,18,16,7168,256,256,8,ActivationType.Silu,torch.bfloat16,torch.float8_e4m3fnuz,torch.float8_e4m3fnuz,QuantType.per_Tensor,1,1,ck,stage1,32,moe_ck2stages_gemm1_256x32x64x128_1x4_MulABScale_v1_Nswizzle0_Quant1_MulRoutedWeight1_silu_F8_F8_B16,32,64,128.0,256.0,1.0,4.0,1.0,125.2208,37.74366666666668,16.86%,11.25,11257.16
2026-01-12 04:50:05,18,16,7168,256,256,8,ActivationType.Silu,torch.bfloat16,torch.float8_e4m3fnuz,torch.float8_e4m3fnuz,QuantType.per_Tensor,1,1,asm,stage1,16,_ZN5aiter57fmoe_stage1_bf16_pertokenFp8_doweight_g1u1_16x256_3tg_pf2E,16,256,,,,,2.0,125.3389,37.74366666666668,0.00%,11.24,11246.55
2026-01-12 04:50:05,18,16,7168,256,256,8,ActivationType.Silu,torch.bfloat16,torch.float8_e4m3fnuz,torch.float8_e4m3fnuz,QuantType.per_Tensor,1,1,asm,stage1,64,_ZN5aiter53fmoe_stage1_bf16_pertokenFp8_doweight_g1u1_64x256_pf3E,64,256,,,,,3.0,125.7804,37.74366666666668,0.00%,11.2,11207.07
2026-01-12 04:50:05,18,16,7168,256,256,8,ActivationType.Silu,torch.bfloat16,torch.float8_e4m3fnuz,torch.float8_e4m3fnuz,QuantType.per_Tensor,1,1,asm,stage1,128,_ZN5aiter54fmoe_stage1_bf16_pertokenFp8_doweight_g1u1_128x128_pf3E,128,128,,,,,3.0,130.0651,37.74366666666668,0.00%,10.84,10837.88
2026-01-12 04:50:05,18,16,7168,256,256,8,ActivationType.Silu,torch.bfloat16,torch.float8_e4m3fnuz,torch.float8_e4m3fnuz,QuantType.per_Tensor,1,1,asm,stage1,128,_ZN5aiter54fmoe_stage1_bf16_pertokenFp8_doweight_g1u1_128x128_pf2E,128,128,,,,,2.0,132.4785,37.74366666666668,0.00%,10.64,10640.45
2026-01-12 04:50:05,18,16,7168,256,256,8,ActivationType.Silu,torch.bfloat16,torch.float8_e4m3fnuz,torch.float8_e4m3fnuz,QuantType.per_Tensor,1,1,ck,stage1,128,moe_ck2stages_gemm1_256x128x128x128_1x4_MulABScale_v3_Nswizzle0_Quant1_MulRoutedWeight1_silu_F8_F8_B16,128,128,128.0,256.0,1.0,4.0,3.0,132.8303,37.74366666666668,0.00%,10.61,10612.26
2026-01-12 04:50:05,18,16,7168,256,256,8,ActivationType.Silu,torch.bfloat16,torch.float8_e4m3fnuz,torch.float8_e4m3fnuz,QuantType.per_Tensor,1,1,ck,stage1,128,moe_ck2stages_gemm1_256x128x128x256_1x4_MulABScale_v3_Nswizzle0_Quant1_MulRoutedWeight1_silu_F8_F8_B16,128,128,256.0,256.0,1.0,4.0,3.0,134.2835,37.74366666666668,0.00%,10.49,10497.42
2026-01-12 04:50:05,18,16,7168,256,256,8,ActivationType.Silu,torch.bfloat16,torch.float8_e4m3fnuz,torch.float8_e4m3fnuz,QuantType.per_Tensor,1,1,asm,stage1,64,_ZN5aiter53fmoe_stage1_bf16_pertokenFp8_doweight_g1u1_64x256_pf2E,64,256,,,,,2.0,138.3833,37.74366666666668,0.00%,10.18,10186.42
2026-01-12 04:50:05,18,16,7168,256,256,8,ActivationType.Silu,torch.bfloat16,torch.float8_e4m3fnuz,torch.float8_e4m3fnuz,QuantType.per_Tensor,1,1,asm,stage1,128,_ZN5aiter53fmoe_stage1_bf16_pertokenFp8_doweight_g1u1_128x64_pf3E,128,64,,,,,3.0,155.0666,37.74366666666668,0.00%,9.09,9090.48
2026-01-12 04:50:05,18,16,7168,256,256,8,ActivationType.Silu,torch.bfloat16,torch.float8_e4m3fnuz,torch.float8_e4m3fnuz,QuantType.per_Tensor,1,1,ck,stage2,128,moe_ck2stages_gemm2_256x128x128x64_1x4_MulABScaleExpertWeight_v3_Nswizzle0_Quant1_MulRoutedWeight0_F8_F8_B16,128,128,64.0,256.0,1.0,4.0,3.0,162.9433,37.74366666666668,98.03%,8.65,8651.05
2026-01-12 04:50:05,18,16,7168,256,256,8,ActivationType.Silu,torch.bfloat16,torch.float8_e4m3fnuz,torch.float8_e4m3fnuz,QuantType.per_Tensor,1,1,ck,stage2,128,moe_ck2stages_gemm2_256x128x64x64_1x4_MulABScaleExpertWeight_v3_Nswizzle0_Quant1_MulRoutedWeight0_F8_F8_B16,128,64,64.0,256.0,1.0,4.0,3.0,165.8509,37.74366666666668,98.03%,8.5,8499.38
2026-01-12 04:50:05,18,16,7168,256,256,8,ActivationType.Silu,torch.bfloat16,torch.float8_e4m3fnuz,torch.float8_e4m3fnuz,QuantType.per_Tensor,1,1,ck,stage1,64,moe_ck2stages_gemm1_256x64x64x128_1x4_MulABScale_v1_Nswizzle0_Quant1_MulRoutedWeight1_silu_F8_F8_B16,64,64,128.0,256.0,1.0,4.0,1.0,168.8752,37.74366666666668,16.86%,8.35,8347.17
2026-01-12 04:50:05,18,16,7168,256,256,8,ActivationType.Silu,torch.bfloat16,torch.float8_e4m3fnuz,torch.float8_e4m3fnuz,QuantType.per_Tensor,1,1,asm,stage1,128,_ZN5aiter53fmoe_stage1_bf16_pertokenFp8_doweight_g1u1_128x64_pf2E,128,64,,,,,2.0,176.2645,37.74366666666668,0.00%,8.0,7997.24
2026-01-12 04:50:05,18,16,7168,256,256,8,ActivationType.Silu,torch.bfloat16,torch.float8_e4m3fnuz,torch.float8_e4m3fnuz,QuantType.per_Tensor,1,1,ck,stage1,32,moe_ck2stages_gemm1_256x32x64x256_1x4_MulABScale_v1_Nswizzle0_Quant1_MulRoutedWeight1_silu_F8_F8_B16,32,64,256.0,256.0,1.0,4.0,1.0,291.9193,37.74366666666668,16.86%,4.83,4828.84
2026-01-12 04:50:05,18,16,7168,256,256,8,ActivationType.Silu,torch.bfloat16,torch.float8_e4m3fnuz,torch.float8_e4m3fnuz,QuantType.per_Tensor,1,1,ck,stage1,64,moe_ck2stages_gemm1_256x64x64x256_1x4_MulABScale_v1_Nswizzle0_Quant1_MulRoutedWeight1_silu_F8_F8_B16,64,64,256.0,256.0,1.0,4.0,1.0,1057.4293,37.74366666666668,16.86%,1.33,1333.07
2026-01-12 04:50:05,18,16,7168,256,256,8,ActivationType.Silu,torch.bfloat16,torch.float8_e4m3fnuz,torch.float8_e4m3fnuz,QuantType.per_Tensor,1,1,ck,stage1,128,moe_ck2stages_gemm1_256x128x64x128_1x4_MulABScale_v1_Nswizzle0_Quant1_MulRoutedWeight1_silu_F8_F8_B16,128,64,128.0,256.0,1.0,4.0,1.0,1438.3839,37.74366666666668,16.86%,0.98,980.01
2026-01-12 04:50:05,18,16,7168,256,256,8,ActivationType.Silu,torch.bfloat16,torch.float8_e4m3fnuz,torch.float8_e4m3fnuz,QuantType.per_Tensor,1,1,asm,stage1,16,_ZN5aiter57fmoe_stage1_bf16_pertokenFp8_doweight_g1u1_16x512_2tg_pf2E,16,512,,,,,2.0,inf,37.74366666666668,failed,0.0,0.0
2026-01-12 04:50:05,18,16,7168,256,256,8,ActivationType.Silu,torch.bfloat16,torch.float8_e4m3fnuz,torch.float8_e4m3fnuz,QuantType.per_Tensor,1,1,asm,stage1,16,_ZN5aiter53fmoe_stage1_bf16_pertokenFp8_doweight_g1u1_16x512_pf3E,16,512,,,,,3.0,inf,37.74366666666668,failed,0.0,0.0
2026-01-12 04:50:05,18,16,7168,256,256,8,ActivationType.Silu,torch.bfloat16,torch.float8_e4m3fnuz,torch.float8_e4m3fnuz,QuantType.per_Tensor,1,1,asm,stage1,32,_ZN5aiter53fmoe_stage1_bf16_pertokenFp8_doweight_g1u1_32x512_pf2E,32,512,,,,,2.0,inf,37.74366666666668,failed,0.0,0.0
2026-01-12 04:50:05,18,16,7168,256,256,8,ActivationType.Silu,torch.bfloat16,torch.float8_e4m3fnuz,torch.float8_e4m3fnuz,QuantType.per_Tensor,1,1,asm,stage1,32,_ZN5aiter53fmoe_stage1_bf16_pertokenFp8_doweight_g1u1_32x512_pf3E,32,512,,,,,3.0,inf,37.74366666666668,failed,0.0,0.0
2026-01-12 04:50:32,19,16,7168,256,256,8,ActivationType.Gelu,torch.bfloat16,torch.float8_e4m3fnuz,torch.float8_e4m3fnuz,QuantType.per_Tensor,1,1,ck,stage2,32,moe_ck2stages_gemm2_256x32x64x256_1x4_MulABScaleExpertWeight_v1_Nswizzle0_Quant1_MulRoutedWeight0_F8_F8_B16,32,64,256.0,256.0,1.0,4.0,1.0,58.9499,37.88555555555553,0.00%,23.91,23912.34
2026-01-12 04:50:32,19,16,7168,256,256,8,ActivationType.Gelu,torch.bfloat16,torch.float8_e4m3fnuz,torch.float8_e4m3fnuz,QuantType.per_Tensor,1,1,ck,stage2,32,moe_ck2stages_gemm2_256x32x64x128_1x4_MulABScaleExpertWeight_v1_Nswizzle0_Quant1_MulRoutedWeight0_F8_F8_B16,32,64,128.0,256.0,1.0,4.0,1.0,60.8795,37.88555555555553,0.00%,23.15,23154.43
2026-01-12 04:50:32,19,16,7168,256,256,8,ActivationType.Gelu,torch.bfloat16,torch.float8_e4m3fnuz,torch.float8_e4m3fnuz,QuantType.per_Tensor,1,1,ck,stage2,64,moe_ck2stages_gemm2_256x64x128x256_1x4_MulABScaleExpertWeight_v3_Nswizzle0_Quant1_MulRoutedWeight0_F8_F8_B16,64,128,256.0,256.0,1.0,4.0,3.0,67.511,37.88555555555553,0.00%,20.87,20880.01
2026-01-12 04:50:32,19,16,7168,256,256,8,ActivationType.Gelu,torch.bfloat16,torch.float8_e4m3fnuz,torch.float8_e4m3fnuz,QuantType.per_Tensor,1,1,ck,stage2,32,moe_ck2stages_gemm2_256x32x64x64_1x4_MulABScaleExpertWeight_v1_Nswizzle0_Quant1_MulRoutedWeight0_F8_F8_B16,32,64,64.0,256.0,1.0,4.0,1.0,69.5212,37.88555555555553,98.07%,20.27,20276.26
2026-01-12 04:50:32,19,16,7168,256,256,8,ActivationType.Gelu,torch.bfloat16,torch.float8_e4m3fnuz,torch.float8_e4m3fnuz,QuantType.per_Tensor,1,1,ck,stage2,64,moe_ck2stages_gemm2_256x64x64x256_1x4_MulABScaleExpertWeight_v1_Nswizzle0_Quant1_MulRoutedWeight0_F8_F8_B16,64,64,256.0,256.0,1.0,4.0,1.0,76.4463,37.88555555555553,0.00%,18.43,18439.48
2026-01-12 04:50:32,19,16,7168,256,256,8,ActivationType.Gelu,torch.bfloat16,torch.float8_e4m3fnuz,torch.float8_e4m3fnuz,QuantType.per_Tensor,1,1,ck,stage2,64,moe_ck2stages_gemm2_256x64x128x128_1x4_MulABScaleExpertWeight_v3_Nswizzle0_Quant1_MulRoutedWeight0_F8_F8_B16,64,128,128.0,256.0,1.0,4.0,3.0,86.6053,37.88555555555553,0.00%,16.27,16276.49
2026-01-12 04:50:32,19,16,7168,256,256,8,ActivationType.Gelu,torch.bfloat16,torch.float8_e4m3fnuz,torch.float8_e4m3fnuz,QuantType.per_Tensor,1,1,ck,stage2,64,moe_ck2stages_gemm2_256x64x64x64_1x4_MulABScaleExpertWeight_v1_Nswizzle0_Quant1_MulRoutedWeight0_F8_F8_B16,64,64,64.0,256.0,1.0,4.0,1.0,104.6099,37.88555555555553,98.07%,13.47,13475.11
2026-01-12 04:50:32,19,16,7168,256,256,8,ActivationType.Gelu,torch.bfloat16,torch.float8_e4m3fnuz,torch.float8_e4m3fnuz,QuantType.per_Tensor,1,1,ck,stage1,64,moe_ck2stages_gemm1_256x64x128x128_1x4_MulABScale_v3_Nswizzle0_Quant1_MulRoutedWeight1_gelu_F8_F8_B16,64,128,128.0,256.0,1.0,4.0,3.0,105.2574,37.88555555555553,0.00%,13.39,13392.22
2026-01-12 04:50:32,19,16,7168,256,256,8,ActivationType.Gelu,torch.bfloat16,torch.float8_e4m3fnuz,torch.float8_e4m3fnuz,QuantType.per_Tensor,1,1,ck,stage1,64,moe_ck2stages_gemm1_256x64x128x256_1x4_MulABScale_v3_Nswizzle0_Quant1_MulRoutedWeight1_gelu_F8_F8_B16,64,128,256.0,256.0,1.0,4.0,3.0,107.1067,37.88555555555553,0.00%,13.16,13160.99
2026-01-12 04:50:32,19,16,7168,256,256,8,ActivationType.Gelu,torch.bfloat16,torch.float8_e4m3fnuz,torch.float8_e4m3fnuz,QuantType.per_Tensor,1,1,asm,stage1,16,_ZN5aiter57fmoe_stage1_bf16_pertokenFp8_doweight_g1u1_16x128_4tg_pf3E,16,128,,,,,3.0,107.8349,37.88555555555553,0.00%,13.07,13072.11
2026-01-12 04:50:32,19,16,7168,256,256,8,ActivationType.Gelu,torch.bfloat16,torch.float8_e4m3fnuz,torch.float8_e4m3fnuz,QuantType.per_Tensor,1,1,ck,stage2,128,moe_ck2stages_gemm2_256x128x64x128_1x4_MulABScaleExpertWeight_v1_Nswizzle0_Quant1_MulRoutedWeight0_F8_F8_B16,128,64,128.0,256.0,1.0,4.0,1.0,107.9844,37.88555555555553,0.00%,13.05,13054.02
2026-01-12 04:50:32,19,16,7168,256,256,8,ActivationType.Gelu,torch.bfloat16,torch.float8_e4m3fnuz,torch.float8_e4m3fnuz,QuantType.per_Tensor,1,1,asm,stage1,16,_ZN5aiter56fmoe_stage1_bf16_pertokenFp8_doweight_g1u1_16x64_5tg_pf3E,16,64,,,,,3.0,108.3362,37.88555555555553,0.06%,13.01,13011.63
2026-01-12 04:50:32,19,16,7168,256,256,8,ActivationType.Gelu,torch.bfloat16,torch.float8_e4m3fnuz,torch.float8_e4m3fnuz,QuantType.per_Tensor,1,1,asm,stage1,16,_ZN5aiter56fmoe_stage1_bf16_pertokenFp8_doweight_g1u1_16x64_6tg_pf2E,16,64,,,,,2.0,108.3719,37.88555555555553,0.00%,13.0,13007.34
2026-01-12 04:50:32,19,16,7168,256,256,8,ActivationType.Gelu,torch.bfloat16,torch.float8_e4m3fnuz,torch.float8_e4m3fnuz,QuantType.per_Tensor,1,1,asm,stage1,32,_ZN5aiter57fmoe_stage1_bf16_pertokenFp8_doweight_g1u1_32x128_3tg_pf3E,32,128,,,,,3.0,109.0818,37.88555555555553,0.00%,12.92,12922.69
2026-01-12 04:50:32,19,16,7168,256,256,8,ActivationType.Gelu,torch.bfloat16,torch.float8_e4m3fnuz,torch.float8_e4m3fnuz,QuantType.per_Tensor,1,1,asm,stage1,32,_ZN5aiter56fmoe_stage1_bf16_pertokenFp8_doweight_g1u1_32x64_4tg_pf3E,32,64,,,,,3.0,109.3428,37.88555555555553,0.00%,12.89,12891.84
2026-01-12 04:50:32,19,16,7168,256,256,8,ActivationType.Gelu,torch.bfloat16,torch.float8_e4m3fnuz,torch.float8_e4m3fnuz,QuantType.per_Tensor,1,1,asm,stage1,32,_ZN5aiter56fmoe_stage1_bf16_pertokenFp8_doweight_g1u1_32x64_4tg_pf2E,32,64,,,,,2.0,109.8941,37.88555555555553,0.00%,12.82,12827.17
2026-01-12 04:50:32,19,16,7168,256,256,8,ActivationType.Gelu,torch.bfloat16,torch.float8_e4m3fnuz,torch.float8_e4m3fnuz,QuantType.per_Tensor,1,1,asm,stage1,16,_ZN5aiter57fmoe_stage1_bf16_pertokenFp8_doweight_g1u1_16x256_2tg_pf3E,16,256,,,,,3.0,110.3938,37.88555555555553,0.00%,12.77,12769.11
2026-01-12 04:50:32,19,16,7168,256,256,8,ActivationType.Gelu,torch.bfloat16,torch.float8_e4m3fnuz,torch.float8_e4m3fnuz,QuantType.per_Tensor,1,1,asm,stage1,16,_ZN5aiter57fmoe_stage1_bf16_pertokenFp8_doweight_g1u1_16x128_4tg_pf2E,16,128,,,,,2.0,111.4093,37.88555555555553,0.00%,12.65,12652.72
2026-01-12 04:50:32,19,16,7168,256,256,8,ActivationType.Gelu,torch.bfloat16,torch.float8_e4m3fnuz,torch.float8_e4m3fnuz,QuantType.per_Tensor,1,1,asm,stage1,64,_ZN5aiter56fmoe_stage1_bf16_pertokenFp8_doweight_g1u1_64x64_2tg_pf2E,64,64,,,,,2.0,112.1345,37.88555555555553,0.00%,12.57,12570.89
2026-01-12 04:50:32,19,16,7168,256,256,8,ActivationType.Gelu,torch.bfloat16,torch.float8_e4m3fnuz,torch.float8_e4m3fnuz,QuantType.per_Tensor,1,1,asm,stage1,32,_ZN5aiter57fmoe_stage1_bf16_pertokenFp8_doweight_g1u1_32x128_3tg_pf2E,32,128,,,,,2.0,112.3613,37.88555555555553,0.00%,12.54,12545.51
2026-01-12 04:50:32,19,16,7168,256,256,8,ActivationType.Gelu,torch.bfloat16,torch.float8_e4m3fnuz,torch.float8_e4m3fnuz,QuantType.per_Tensor,1,1,asm,stage1,32,_ZN5aiter57fmoe_stage1_bf16_pertokenFp8_doweight_g1u1_32x256_2tg_pf3E,32,256,,,,,3.0,112.4223,37.88555555555553,0.00%,12.54,12538.71
2026-01-12 04:50:32,19,16,7168,256,256,8,ActivationType.Gelu,torch.bfloat16,torch.float8_e4m3fnuz,torch.float8_e4m3fnuz,QuantType.per_Tensor,1,1,asm,stage1,64,_ZN5aiter57fmoe_stage1_bf16_pertokenFp8_doweight_g1u1_64x128_2tg_pf3E,64,128,,,,,3.0,112.6612,37.88555555555553,0.00%,12.51,12512.12
2026-01-12 04:50:32,19,16,7168,256,256,8,ActivationType.Gelu,torch.bfloat16,torch.float8_e4m3fnuz,torch.float8_e4m3fnuz,QuantType.per_Tensor,1,1,asm,stage1,64,_ZN5aiter56fmoe_stage1_bf16_pertokenFp8_doweight_g1u1_64x64_2tg_pf3E,64,64,,,,,3.0,113.086,37.88555555555553,0.00%,12.46,12465.12
2026-01-12 04:50:32,19,16,7168,256,256,8,ActivationType.Gelu,torch.bfloat16,torch.float8_e4m3fnuz,torch.float8_e4m3fnuz,QuantType.per_Tensor,1,1,asm,stage1,64,_ZN5aiter57fmoe_stage1_bf16_pertokenFp8_doweight_g1u1_64x128_2tg_pf2E,64,128,,,,,2.0,115.2888,37.88555555555553,0.00%,12.22,12226.95
2026-01-12 04:50:32,19,16,7168,256,256,8,ActivationType.Gelu,torch.bfloat16,torch.float8_e4m3fnuz,torch.float8_e4m3fnuz,QuantType.per_Tensor,1,1,ck,stage2,64,moe_ck2stages_gemm2_256x64x128x64_1x4_MulABScaleExpertWeight_v3_Nswizzle0_Quant1_MulRoutedWeight0_F8_F8_B16,64,128,64.0,256.0,1.0,4.0,3.0,116.1385,37.88555555555553,98.06%,12.13,12137.49
2026-01-12 04:50:32,19,16,7168,256,256,8,ActivationType.Gelu,torch.bfloat16,torch.float8_e4m3fnuz,torch.float8_e4m3fnuz,QuantType.per_Tensor,1,1,ck,stage2,128,moe_ck2stages_gemm2_256x128x128x128_1x4_MulABScaleExpertWeight_v3_Nswizzle0_Quant1_MulRoutedWeight0_F8_F8_B16,128,128,128.0,256.0,1.0,4.0,3.0,121.8636,37.88555555555553,0.00%,11.56,11567.28
2026-01-12 04:50:32,19,16,7168,256,256,8,ActivationType.Gelu,torch.bfloat16,torch.float8_e4m3fnuz,torch.float8_e4m3fnuz,QuantType.per_Tensor,1,1,asm,stage1,32,_ZN5aiter57fmoe_stage1_bf16_pertokenFp8_doweight_g1u1_32x256_2tg_pf2E,32,256,,,,,2.0,124.2646,37.88555555555553,0.00%,11.34,11343.78
2026-01-12 04:50:32,19,16,7168,256,256,8,ActivationType.Gelu,torch.bfloat16,torch.float8_e4m3fnuz,torch.float8_e4m3fnuz,QuantType.per_Tensor,1,1,asm,stage1,16,_ZN5aiter57fmoe_stage1_bf16_pertokenFp8_doweight_g1u1_16x256_3tg_pf2E,16,256,,,,,2.0,124.2816,37.88555555555553,0.00%,11.34,11342.23
2026-01-12 04:50:32,19,16,7168,256,256,8,ActivationType.Gelu,torch.bfloat16,torch.float8_e4m3fnuz,torch.float8_e4m3fnuz,QuantType.per_Tensor,1,1,ck,stage1,32,moe_ck2stages_gemm1_256x32x64x128_1x4_MulABScale_v1_Nswizzle0_Quant1_MulRoutedWeight1_gelu_F8_F8_B16,32,64,128.0,256.0,1.0,4.0,1.0,124.8493,37.88555555555553,16.78%,11.29,11290.65
2026-01-12 04:50:32,19,16,7168,256,256,8,ActivationType.Gelu,torch.bfloat16,torch.float8_e4m3fnuz,torch.float8_e4m3fnuz,QuantType.per_Tensor,1,1,asm,stage1,64,_ZN5aiter53fmoe_stage1_bf16_pertokenFp8_doweight_g1u1_64x256_pf3E,64,256,,,,,3.0,125.6096,37.88555555555553,0.00%,11.22,11222.31
2026-01-12 04:50:32,19,16,7168,256,256,8,ActivationType.Gelu,torch.bfloat16,torch.float8_e4m3fnuz,torch.float8_e4m3fnuz,QuantType.per_Tensor,1,1,asm,stage1,128,_ZN5aiter54fmoe_stage1_bf16_pertokenFp8_doweight_g1u1_128x128_pf3E,128,128,,,,,3.0,129.2299,37.88555555555553,0.00%,10.91,10907.93
2026-01-12 04:50:32,19,16,7168,256,256,8,ActivationType.Gelu,torch.bfloat16,torch.float8_e4m3fnuz,torch.float8_e4m3fnuz,QuantType.per_Tensor,1,1,ck,stage1,128,moe_ck2stages_gemm1_256x128x128x128_1x4_MulABScale_v3_Nswizzle0_Quant1_MulRoutedWeight1_gelu_F8_F8_B16,128,128,128.0,256.0,1.0,4.0,3.0,131.0532,37.88555555555553,0.00%,10.75,10756.17
2026-01-12 04:50:32,19,16,7168,256,256,8,ActivationType.Gelu,torch.bfloat16,torch.float8_e4m3fnuz,torch.float8_e4m3fnuz,QuantType.per_Tensor,1,1,asm,stage1,128,_ZN5aiter54fmoe_stage1_bf16_pertokenFp8_doweight_g1u1_128x128_pf2E,128,128,,,,,2.0,132.3321,37.88555555555553,0.00%,10.65,10652.22
2026-01-12 04:50:32,19,16,7168,256,256,8,ActivationType.Gelu,torch.bfloat16,torch.float8_e4m3fnuz,torch.float8_e4m3fnuz,QuantType.per_Tensor,1,1,ck,stage1,128,moe_ck2stages_gemm1_256x128x128x256_1x4_MulABScale_v3_Nswizzle0_Quant1_MulRoutedWeight1_gelu_F8_F8_B16,128,128,256.0,256.0,1.0,4.0,3.0,132.4024,37.88555555555553,0.00%,10.64,10646.56
2026-01-12 04:50:32,19,16,7168,256,256,8,ActivationType.Gelu,torch.bfloat16,torch.float8_e4m3fnuz,torch.float8_e4m3fnuz,QuantType.per_Tensor,1,1,asm,stage1,64,_ZN5aiter53fmoe_stage1_bf16_pertokenFp8_doweight_g1u1_64x256_pf2E,64,256,,,,,2.0,139.3362,37.88555555555553,0.00%,10.11,10116.76
2026-01-12 04:50:32,19,16,7168,256,256,8,ActivationType.Gelu,torch.bfloat16,torch.float8_e4m3fnuz,torch.float8_e4m3fnuz,QuantType.per_Tensor,1,1,asm,stage1,128,_ZN5aiter53fmoe_stage1_bf16_pertokenFp8_doweight_g1u1_128x64_pf3E,128,64,,,,,3.0,155.8182,37.88555555555553,0.00%,9.04,9046.63
2026-01-12 04:50:32,19,16,7168,256,256,8,ActivationType.Gelu,torch.bfloat16,torch.float8_e4m3fnuz,torch.float8_e4m3fnuz,QuantType.per_Tensor,1,1,ck,stage2,128,moe_ck2stages_gemm2_256x128x128x64_1x4_MulABScaleExpertWeight_v3_Nswizzle0_Quant1_MulRoutedWeight0_F8_F8_B16,128,128,64.0,256.0,1.0,4.0,3.0,162.5567,37.88555555555553,98.06%,8.67,8671.62
2026-01-12 04:50:32,19,16,7168,256,256,8,ActivationType.Gelu,torch.bfloat16,torch.float8_e4m3fnuz,torch.float8_e4m3fnuz,QuantType.per_Tensor,1,1,ck,stage2,128,moe_ck2stages_gemm2_256x128x64x64_1x4_MulABScaleExpertWeight_v3_Nswizzle0_Quant1_MulRoutedWeight0_F8_F8_B16,128,64,64.0,256.0,1.0,4.0,3.0,165.6907,37.88555555555553,98.06%,8.51,8507.6
2026-01-12 04:50:32,19,16,7168,256,256,8,ActivationType.Gelu,torch.bfloat16,torch.float8_e4m3fnuz,torch.float8_e4m3fnuz,QuantType.per_Tensor,1,1,ck,stage1,64,moe_ck2stages_gemm1_256x64x64x128_1x4_MulABScale_v1_Nswizzle0_Quant1_MulRoutedWeight1_gelu_F8_F8_B16,64,64,128.0,256.0,1.0,4.0,1.0,167.9416,37.88555555555553,16.78%,8.39,8393.57
2026-01-12 04:50:32,19,16,7168,256,256,8,ActivationType.Gelu,torch.bfloat16,torch.float8_e4m3fnuz,torch.float8_e4m3fnuz,QuantType.per_Tensor,1,1,asm,stage1,128,_ZN5aiter53fmoe_stage1_bf16_pertokenFp8_doweight_g1u1_128x64_pf2E,128,64,,,,,2.0,176.0746,37.88555555555553,0.00%,8.0,8005.87
2026-01-12 04:50:32,19,16,7168,256,256,8,ActivationType.Gelu,torch.bfloat16,torch.float8_e4m3fnuz,torch.float8_e4m3fnuz,QuantType.per_Tensor,1,1,ck,stage1,32,moe_ck2stages_gemm1_256x32x64x256_1x4_MulABScale_v1_Nswizzle0_Quant1_MulRoutedWeight1_gelu_F8_F8_B16,32,64,256.0,256.0,1.0,4.0,1.0,281.6631,37.88555555555553,16.78%,5.0,5004.67
2026-01-12 04:50:32,19,16,7168,256,256,8,ActivationType.Gelu,torch.bfloat16,torch.float8_e4m3fnuz,torch.float8_e4m3fnuz,QuantType.per_Tensor,1,1,ck,stage1,64,moe_ck2stages_gemm1_256x64x64x256_1x4_MulABScale_v1_Nswizzle0_Quant1_MulRoutedWeight1_gelu_F8_F8_B16,64,64,256.0,256.0,1.0,4.0,1.0,1060.1469,37.88555555555553,16.78%,1.33,1329.66
2026-01-12 04:50:32,19,16,7168,256,256,8,ActivationType.Gelu,torch.bfloat16,torch.float8_e4m3fnuz,torch.float8_e4m3fnuz,QuantType.per_Tensor,1,1,ck,stage1,128,moe_ck2stages_gemm1_256x128x64x128_1x4_MulABScale_v1_Nswizzle0_Quant1_MulRoutedWeight1_gelu_F8_F8_B16,128,64,128.0,256.0,1.0,4.0,1.0,1435.8742,37.88555555555553,16.78%,0.98,981.72
2026-01-12 04:50:32,19,16,7168,256,256,8,ActivationType.Gelu,torch.bfloat16,torch.float8_e4m3fnuz,torch.float8_e4m3fnuz,QuantType.per_Tensor,1,1,asm,stage1,16,_ZN5aiter57fmoe_stage1_bf16_pertokenFp8_doweight_g1u1_16x512_2tg_pf2E,16,512,,,,,2.0,inf,37.88555555555553,failed,0.0,0.0
2026-01-12 04:50:32,19,16,7168,256,256,8,ActivationType.Gelu,torch.bfloat16,torch.float8_e4m3fnuz,torch.float8_e4m3fnuz,QuantType.per_Tensor,1,1,asm,stage1,16,_ZN5aiter53fmoe_stage1_bf16_pertokenFp8_doweight_g1u1_16x512_pf3E,16,512,,,,,3.0,inf,37.88555555555553,failed,0.0,0.0
2026-01-12 04:50:32,19,16,7168,256,256,8,ActivationType.Gelu,torch.bfloat16,torch.float8_e4m3fnuz,torch.float8_e4m3fnuz,QuantType.per_Tensor,1,1,asm,stage1,32,_ZN5aiter53fmoe_stage1_bf16_pertokenFp8_doweight_g1u1_32x512_pf2E,32,512,,,,,2.0,inf,37.88555555555553,failed,0.0,0.0
2026-01-12 04:50:32,19,16,7168,256,256,8,ActivationType.Gelu,torch.bfloat16,torch.float8_e4m3fnuz,torch.float8_e4m3fnuz,QuantType.per_Tensor,1,1,asm,stage1,32,_ZN5aiter53fmoe_stage1_bf16_pertokenFp8_doweight_g1u1_32x512_pf3E,32,512,,,,,3.0,inf,37.88555555555553,failed,0.0,0.0
2026-01-12 04:50:45,20,512,2048,192,128,8,ActivationType.Silu,torch.bfloat16,torch.bfloat16,torch.bfloat16,QuantType.No,1,1,ck,stage2,32,moe_ck2stages_gemm2_256x32x64x64_1x4_TypeCast_v1_Nswizzle0_Quant0_MulRoutedWeight0_B16_B16_B16,32,64,64.0,256.0,1.0,4.0,1.0,40.4582,0.0,0.00%,238.86,7567.91
2026-01-12 04:50:45,20,512,2048,192,128,8,ActivationType.Silu,torch.bfloat16,torch.bfloat16,torch.bfloat16,QuantType.No,1,1,ck,stage2,64,moe_ck2stages_gemm2_256x64x64x64_1x4_TypeCast_v1_Nswizzle0_Quant0_MulRoutedWeight0_B16_B16_B16,64,64,64.0,256.0,1.0,4.0,1.0,44.5762,0.0,0.00%,216.79,6868.78
2026-01-12 04:50:45,20,512,2048,192,128,8,ActivationType.Silu,torch.bfloat16,torch.bfloat16,torch.bfloat16,QuantType.No,1,1,ck,stage2,64,moe_ck2stages_gemm2_256x64x128x64_1x4_TypeCast_v3_Nswizzle0_Quant0_MulRoutedWeight0_B16_B16_B16,64,128,64.0,256.0,1.0,4.0,3.0,59.2183,0.0,0.00%,163.19,5170.43
2026-01-12 04:50:45,20,512,2048,192,128,8,ActivationType.Silu,torch.bfloat16,torch.bfloat16,torch.bfloat16,QuantType.No,1,1,ck,stage2,128,moe_ck2stages_gemm2_256x128x128x64_1x4_TypeCast_v3_Nswizzle0_Quant0_MulRoutedWeight0_B16_B16_B16,128,128,64.0,256.0,1.0,4.0,3.0,67.7863,0.0,0.00%,142.56,4516.9
2026-01-12 04:50:45,20,512,2048,192,128,8,ActivationType.Silu,torch.bfloat16,torch.bfloat16,torch.bfloat16,QuantType.No,1,1,ck,stage1,32,moe_ck2stages_gemm1_256x32x64x64_1x4_TypeCastExpertWeight_v1_Nswizzle0_Quant0_MulRoutedWeight1_silu_B16_B16_B16,32,64,64.0,256.0,1.0,4.0,1.0,70.2578,0.0,0.00%,137.55,4358.01
2026-01-12 04:50:45,20,512,2048,192,128,8,ActivationType.Silu,torch.bfloat16,torch.bfloat16,torch.bfloat16,QuantType.No,1,1,ck,stage1,64,moe_ck2stages_gemm1_256x64x64x64_1x4_TypeCastExpertWeight_v1_Nswizzle0_Quant0_MulRoutedWeight1_silu_B16_B16_B16,64,64,64.0,256.0,1.0,4.0,1.0,72.2214,0.0,0.00%,133.81,4239.52
2026-01-12 04:50:45,20,512,2048,192,128,8,ActivationType.Silu,torch.bfloat16,torch.bfloat16,torch.bfloat16,QuantType.No,1,1,ck,stage1,32,moe_ck2stages_gemm1_256x32x64x128_1x4_TypeCastExpertWeight_v1_Nswizzle0_Quant0_MulRoutedWeight1_silu_B16_B16_B16,32,64,128.0,256.0,1.0,4.0,1.0,72.9201,0.0,0.00%,132.52,4198.9
2026-01-12 04:50:45,20,512,2048,192,128,8,ActivationType.Silu,torch.bfloat16,torch.bfloat16,torch.bfloat16,QuantType.No,1,1,ck,stage1,64,moe_ck2stages_gemm1_256x64x64x128_1x4_TypeCastExpertWeight_v1_Nswizzle0_Quant0_MulRoutedWeight1_silu_B16_B16_B16,64,64,128.0,256.0,1.0,4.0,1.0,75.8958,0.0,0.00%,127.33,4034.27
2026-01-12 04:50:45,20,512,2048,192,128,8,ActivationType.Silu,torch.bfloat16,torch.bfloat16,torch.bfloat16,QuantType.No,1,1,ck,stage2,128,moe_ck2stages_gemm2_256x128x64x64_1x4_TypeCast_v3_Nswizzle0_Quant0_MulRoutedWeight0_B16_B16_B16,128,64,64.0,256.0,1.0,4.0,3.0,76.5333,0.0,0.00%,126.27,4000.67
2026-01-12 04:50:45,20,512,2048,192,128,8,ActivationType.Silu,torch.bfloat16,torch.bfloat16,torch.bfloat16,QuantType.No,1,1,ck,stage2,128,moe_ck2stages_gemm2_256x128x64x64_1x4_TypeCast_v1_Nswizzle0_Quant0_MulRoutedWeight0_B16_B16_B16,128,64,64.0,256.0,1.0,4.0,1.0,77.3205,0.0,0.00%,124.98,3959.94
2026-01-12 04:50:45,20,512,2048,192,128,8,ActivationType.Silu,torch.bfloat16,torch.bfloat16,torch.bfloat16,QuantType.No,1,1,ck,stage1,128,moe_ck2stages_gemm1_256x128x64x64_1x4_TypeCastExpertWeight_v1_Nswizzle0_Quant0_MulRoutedWeight1_silu_B16_B16_B16,128,64,64.0,256.0,1.0,4.0,1.0,91.6929,0.0,0.00%,105.39,3339.24
2026-01-12 04:50:45,20,512,2048,192,128,8,ActivationType.Silu,torch.bfloat16,torch.bfloat16,torch.bfloat16,QuantType.No,1,1,ck,stage2,32,moe_ck2stages_gemm2_256x32x64x128_1x4_TypeCast_v1_Nswizzle0_Quant0_MulRoutedWeight0_B16_B16_B16,32,64,128.0,256.0,1.0,4.0,1.0,inf,0.0,failed,0.0,0.0
2026-01-12 04:50:45,20,512,2048,192,128,8,ActivationType.Silu,torch.bfloat16,torch.bfloat16,torch.bfloat16,QuantType.No,1,1,ck,stage1,64,moe_ck2stages_gemm1_256x64x128x128_1x4_TypeCastExpertWeight_v3_Nswizzle0_Quant0_MulRoutedWeight1_silu_B16_B16_B16,64,128,128.0,256.0,1.0,4.0,3.0,inf,0.0,failed,0.0,0.0
2026-01-12 04:50:45,20,512,2048,192,128,8,ActivationType.Silu,torch.bfloat16,torch.bfloat16,torch.bfloat16,QuantType.No,1,1,ck,stage1,64,moe_ck2stages_gemm1_256x64x128x64_1x4_TypeCastExpertWeight_v3_Nswizzle0_Quant0_MulRoutedWeight1_silu_B16_B16_B16,64,128,64.0,256.0,1.0,4.0,3.0,inf,0.0,failed,0.0,0.0
2026-01-12 04:50:45,20,512,2048,192,128,8,ActivationType.Silu,torch.bfloat16,torch.bfloat16,torch.bfloat16,QuantType.No,1,1,ck,stage2,64,moe_ck2stages_gemm2_256x64x64x128_1x4_TypeCast_v1_Nswizzle0_Quant0_MulRoutedWeight0_B16_B16_B16,64,64,128.0,256.0,1.0,4.0,1.0,inf,0.0,failed,0.0,0.0
2026-01-12 04:50:45,20,512,2048,192,128,8,ActivationType.Silu,torch.bfloat16,torch.bfloat16,torch.bfloat16,QuantType.No,1,1,ck,stage2,64,moe_ck2stages_gemm2_256x64x128x128_1x4_TypeCast_v3_Nswizzle0_Quant0_MulRoutedWeight0_B16_B16_B16,64,128,128.0,256.0,1.0,4.0,3.0,inf,0.0,failed,0.0,0.0
2026-01-12 04:50:45,20,512,2048,192,128,8,ActivationType.Silu,torch.bfloat16,torch.bfloat16,torch.bfloat16,QuantType.No,1,1,ck,stage1,128,moe_ck2stages_gemm1_256x128x128x128_1x4_TypeCastExpertWeight_v3_Nswizzle0_Quant0_MulRoutedWeight1_silu_B16_B16_B16,128,128,128.0,256.0,1.0,4.0,3.0,inf,0.0,failed,0.0,0.0
2026-01-12 04:50:45,20,512,2048,192,128,8,ActivationType.Silu,torch.bfloat16,torch.bfloat16,torch.bfloat16,QuantType.No,1,1,ck,stage1,128,moe_ck2stages_gemm1_256x128x128x64_1x4_TypeCastExpertWeight_v3_Nswizzle0_Quant0_MulRoutedWeight1_silu_B16_B16_B16,128,128,64.0,256.0,1.0,4.0,3.0,inf,0.0,failed,0.0,0.0
2026-01-12 04:50:59,21,512,2048,192,128,8,ActivationType.Gelu,torch.bfloat16,torch.bfloat16,torch.bfloat16,QuantType.No,1,1,ck,stage2,32,moe_ck2stages_gemm2_256x32x64x64_1x4_TypeCast_v1_Nswizzle0_Quant0_MulRoutedWeight0_B16_B16_B16,32,64,64.0,256.0,1.0,4.0,1.0,40.497,0.0,0.00%,238.63,7560.66
2026-01-12 04:50:59,21,512,2048,192,128,8,ActivationType.Gelu,torch.bfloat16,torch.bfloat16,torch.bfloat16,QuantType.No,1,1,ck,stage2,64,moe_ck2stages_gemm2_256x64x64x64_1x4_TypeCast_v1_Nswizzle0_Quant0_MulRoutedWeight0_B16_B16_B16,64,64,64.0,256.0,1.0,4.0,1.0,44.6834,0.0,0.00%,216.27,6852.3
2026-01-12 04:50:59,21,512,2048,192,128,8,ActivationType.Gelu,torch.bfloat16,torch.bfloat16,torch.bfloat16,QuantType.No,1,1,ck,stage2,64,moe_ck2stages_gemm2_256x64x128x64_1x4_TypeCast_v3_Nswizzle0_Quant0_MulRoutedWeight0_B16_B16_B16,64,128,64.0,256.0,1.0,4.0,3.0,58.9558,0.0,0.00%,163.91,5193.45
2026-01-12 04:50:59,21,512,2048,192,128,8,ActivationType.Gelu,torch.bfloat16,torch.bfloat16,torch.bfloat16,QuantType.No,1,1,ck,stage2,128,moe_ck2stages_gemm2_256x128x128x64_1x4_TypeCast_v3_Nswizzle0_Quant0_MulRoutedWeight0_B16_B16_B16,128,128,64.0,256.0,1.0,4.0,3.0,67.9768,0.0,0.00%,142.16,4504.25
2026-01-12 04:50:59,21,512,2048,192,128,8,ActivationType.Gelu,torch.bfloat16,torch.bfloat16,torch.bfloat16,QuantType.No,1,1,ck,stage1,32,moe_ck2stages_gemm1_256x32x64x64_1x4_TypeCastExpertWeight_v1_Nswizzle0_Quant0_MulRoutedWeight1_gelu_B16_B16_B16,32,64,64.0,256.0,1.0,4.0,1.0,69.6911,0.0,0.00%,138.66,4393.45
2026-01-12 04:50:59,21,512,2048,192,128,8,ActivationType.Gelu,torch.bfloat16,torch.bfloat16,torch.bfloat16,QuantType.No,1,1,ck,stage1,64,moe_ck2stages_gemm1_256x64x64x64_1x4_TypeCastExpertWeight_v1_Nswizzle0_Quant0_MulRoutedWeight1_gelu_B16_B16_B16,64,64,64.0,256.0,1.0,4.0,1.0,70.8252,0.0,0.00%,136.44,4323.1
2026-01-12 04:50:59,21,512,2048,192,128,8,ActivationType.Gelu,torch.bfloat16,torch.bfloat16,torch.bfloat16,QuantType.No,1,1,ck,stage1,32,moe_ck2stages_gemm1_256x32x64x128_1x4_TypeCastExpertWeight_v1_Nswizzle0_Quant0_MulRoutedWeight1_gelu_B16_B16_B16,32,64,128.0,256.0,1.0,4.0,1.0,72.7277,0.0,0.00%,132.87,4210.01
2026-01-12 04:50:59,21,512,2048,192,128,8,ActivationType.Gelu,torch.bfloat16,torch.bfloat16,torch.bfloat16,QuantType.No,1,1,ck,stage1,64,moe_ck2stages_gemm1_256x64x64x128_1x4_TypeCastExpertWeight_v1_Nswizzle0_Quant0_MulRoutedWeight1_gelu_B16_B16_B16,64,64,128.0,256.0,1.0,4.0,1.0,75.3364,0.0,0.00%,128.27,4064.23
2026-01-12 04:50:59,21,512,2048,192,128,8,ActivationType.Gelu,torch.bfloat16,torch.bfloat16,torch.bfloat16,QuantType.No,1,1,ck,stage2,128,moe_ck2stages_gemm2_256x128x64x64_1x4_TypeCast_v3_Nswizzle0_Quant0_MulRoutedWeight0_B16_B16_B16,128,64,64.0,256.0,1.0,4.0,3.0,76.6626,0.0,0.00%,126.05,3993.92
2026-01-12 04:50:59,21,512,2048,192,128,8,ActivationType.Gelu,torch.bfloat16,torch.bfloat16,torch.bfloat16,QuantType.No,1,1,ck,stage2,128,moe_ck2stages_gemm2_256x128x64x64_1x4_TypeCast_v1_Nswizzle0_Quant0_MulRoutedWeight0_B16_B16_B16,128,64,64.0,256.0,1.0,4.0,1.0,77.5266,0.0,0.00%,124.65,3949.41
2026-01-12 04:50:59,21,512,2048,192,128,8,ActivationType.Gelu,torch.bfloat16,torch.bfloat16,torch.bfloat16,QuantType.No,1,1,ck,stage1,128,moe_ck2stages_gemm1_256x128x64x64_1x4_TypeCastExpertWeight_v1_Nswizzle0_Quant0_MulRoutedWeight1_gelu_B16_B16_B16,128,64,64.0,256.0,1.0,4.0,1.0,90.7648,0.0,0.00%,106.47,3373.38
2026-01-12 04:50:59,21,512,2048,192,128,8,ActivationType.Gelu,torch.bfloat16,torch.bfloat16,torch.bfloat16,QuantType.No,1,1,ck,stage2,32,moe_ck2stages_gemm2_256x32x64x128_1x4_TypeCast_v1_Nswizzle0_Quant0_MulRoutedWeight0_B16_B16_B16,32,64,128.0,256.0,1.0,4.0,1.0,inf,0.0,failed,0.0,0.0
2026-01-12 04:50:59,21,512,2048,192,128,8,ActivationType.Gelu,torch.bfloat16,torch.bfloat16,torch.bfloat16,QuantType.No,1,1,ck,stage1,64,moe_ck2stages_gemm1_256x64x128x128_1x4_TypeCastExpertWeight_v3_Nswizzle0_Quant0_MulRoutedWeight1_gelu_B16_B16_B16,64,128,128.0,256.0,1.0,4.0,3.0,inf,0.0,failed,0.0,0.0
2026-01-12 04:50:59,21,512,2048,192,128,8,ActivationType.Gelu,torch.bfloat16,torch.bfloat16,torch.bfloat16,QuantType.No,1,1,ck,stage1,64,moe_ck2stages_gemm1_256x64x128x64_1x4_TypeCastExpertWeight_v3_Nswizzle0_Quant0_MulRoutedWeight1_gelu_B16_B16_B16,64,128,64.0,256.0,1.0,4.0,3.0,inf,0.0,failed,0.0,0.0
2026-01-12 04:50:59,21,512,2048,192,128,8,ActivationType.Gelu,torch.bfloat16,torch.bfloat16,torch.bfloat16,QuantType.No,1,1,ck,stage2,64,moe_ck2stages_gemm2_256x64x64x128_1x4_TypeCast_v1_Nswizzle0_Quant0_MulRoutedWeight0_B16_B16_B16,64,64,128.0,256.0,1.0,4.0,1.0,inf,0.0,failed,0.0,0.0
2026-01-12 04:50:59,21,512,2048,192,128,8,ActivationType.Gelu,torch.bfloat16,torch.bfloat16,torch.bfloat16,QuantType.No,1,1,ck,stage2,64,moe_ck2stages_gemm2_256x64x128x128_1x4_TypeCast_v3_Nswizzle0_Quant0_MulRoutedWeight0_B16_B16_B16,64,128,128.0,256.0,1.0,4.0,3.0,inf,0.0,failed,0.0,0.0
2026-01-12 04:50:59,21,512,2048,192,128,8,ActivationType.Gelu,torch.bfloat16,torch.bfloat16,torch.bfloat16,QuantType.No,1,1,ck,stage1,128,moe_ck2stages_gemm1_256x128x128x128_1x4_TypeCastExpertWeight_v3_Nswizzle0_Quant0_MulRoutedWeight1_gelu_B16_B16_B16,128,128,128.0,256.0,1.0,4.0,3.0,inf,0.0,failed,0.0,0.0
2026-01-12 04:50:59,21,512,2048,192,128,8,ActivationType.Gelu,torch.bfloat16,torch.bfloat16,torch.bfloat16,QuantType.No,1,1,ck,stage1,128,moe_ck2stages_gemm1_256x128x128x64_1x4_TypeCastExpertWeight_v3_Nswizzle0_Quant0_MulRoutedWeight1_gelu_B16_B16_B16,128,128,64.0,256.0,1.0,4.0,3.0,inf,0.0,failed,0.0,0.0
2026-01-12 04:51:17,22,1024,7168,512,256,8,ActivationType.Silu,torch.bfloat16,torch.float8_e4m3fnuz,torch.float8_e4m3fnuz,QuantType.per_1x128,1,0,ck,stage2,16,moe_ck2stages_gemm2_256x16x128x256_1x4_MulABScaleExpertWeightA8W8blkscale_v1_Nswizzle0_Quant4_MulRoutedWeight1_F8_F8_B16,16,128,256.0,256.0,1.0,4.0,1.0,420.1773,102.14833333333341,15.59%,429.32,6760.46
2026-01-12 04:51:17,22,1024,7168,512,256,8,ActivationType.Silu,torch.bfloat16,torch.float8_e4m3fnuz,torch.float8_e4m3fnuz,QuantType.per_1x128,1,0,asm,stage1,64,_ZN5aiter55fmoe_stage1_bf16_pertokenFp8_blockscale_g1u1_64x256_pf2E,64,256,,,,,2.0,524.0348,102.14833333333341,4.99%,344.23,5420.62
2026-01-12 04:51:17,22,1024,7168,512,256,8,ActivationType.Silu,torch.bfloat16,torch.float8_e4m3fnuz,torch.float8_e4m3fnuz,QuantType.per_1x128,1,0,asm,stage1,64,_ZN5aiter55fmoe_stage1_bf16_pertokenFp8_blockscale_g1u1_64x256_pf3E,64,256,,,,,3.0,525.847,102.14833333333341,4.99%,343.04,5401.94
2026-01-12 04:51:17,22,1024,7168,512,256,8,ActivationType.Silu,torch.bfloat16,torch.float8_e4m3fnuz,torch.float8_e4m3fnuz,QuantType.per_1x128,1,0,asm,stage1,64,_ZN5aiter59fmoe_stage1_bf16_pertokenFp8_blockscale_g1u1_64x128_2tg_pf2E,64,128,,,,,2.0,552.4527,102.14833333333341,4.99%,326.52,5141.78
2026-01-12 04:51:17,22,1024,7168,512,256,8,ActivationType.Silu,torch.bfloat16,torch.float8_e4m3fnuz,torch.float8_e4m3fnuz,QuantType.per_1x128,1,0,asm,stage1,64,_ZN5aiter59fmoe_stage1_bf16_pertokenFp8_blockscale_g1u1_64x128_2tg_pf3E,64,128,,,,,3.0,556.2315,102.14833333333341,4.99%,324.3,5106.85
2026-01-12 04:51:17,22,1024,7168,512,256,8,ActivationType.Silu,torch.bfloat16,torch.float8_e4m3fnuz,torch.float8_e4m3fnuz,QuantType.per_1x128,1,0,ck,stage1,64,moe_ck2stages_gemm1_256x64x128x128_1x4_MulABScaleExpertWeightA8W8blkscale_v3_Nswizzle0_Quant4_MulRoutedWeight0_silu_F8_F8_B16,64,128,128.0,256.0,1.0,4.0,3.0,604.1843,102.14833333333341,0.01%,298.57,4701.53
2026-01-12 04:51:17,22,1024,7168,512,256,8,ActivationType.Silu,torch.bfloat16,torch.float8_e4m3fnuz,torch.float8_e4m3fnuz,QuantType.per_1x128,1,0,asm,stage1,32,_ZN5aiter59fmoe_stage1_bf16_pertokenFp8_blockscale_g1u1_32x256_2tg_pf3E,32,256,,,,,3.0,622.1723,102.14833333333341,13.36%,289.93,4565.6
2026-01-12 04:51:17,22,1024,7168,512,256,8,ActivationType.Silu,torch.bfloat16,torch.float8_e4m3fnuz,torch.float8_e4m3fnuz,QuantType.per_1x128,1,0,asm,stage1,32,_ZN5aiter55fmoe_stage1_bf16_pertokenFp8_blockscale_g1u1_32x512_pf3E,32,512,,,,,3.0,622.7526,102.14833333333341,9.18%,289.66,4561.35
2026-01-12 04:51:17,22,1024,7168,512,256,8,ActivationType.Silu,torch.bfloat16,torch.float8_e4m3fnuz,torch.float8_e4m3fnuz,QuantType.per_1x128,1,0,asm,stage1,32,_ZN5aiter55fmoe_stage1_bf16_pertokenFp8_blockscale_g1u1_32x512_pf2E,32,512,,,,,2.0,632.8634,102.14833333333341,9.17%,285.04,4488.48
2026-01-12 04:51:17,22,1024,7168,512,256,8,ActivationType.Silu,torch.bfloat16,torch.float8_e4m3fnuz,torch.float8_e4m3fnuz,QuantType.per_1x128,1,0,asm,stage1,32,_ZN5aiter59fmoe_stage1_bf16_pertokenFp8_blockscale_g1u1_32x256_2tg_pf2E,32,256,,,,,2.0,639.1777,102.14833333333341,13.35%,282.22,4444.14
2026-01-12 04:51:17,22,1024,7168,512,256,8,ActivationType.Silu,torch.bfloat16,torch.float8_e4m3fnuz,torch.float8_e4m3fnuz,QuantType.per_1x128,1,0,asm,stage1,128,_ZN5aiter56fmoe_stage1_bf16_pertokenFp8_blockscale_g1u1_128x128_pf3E,128,128,,,,,3.0,642.6232,102.14833333333341,4.97%,280.71,4420.31
2026-01-12 04:51:17,22,1024,7168,512,256,8,ActivationType.Silu,torch.bfloat16,torch.float8_e4m3fnuz,torch.float8_e4m3fnuz,QuantType.per_1x128,1,0,asm,stage1,128,_ZN5aiter56fmoe_stage1_bf16_pertokenFp8_blockscale_g1u1_128x128_pf2E,128,128,,,,,2.0,658.965,102.14833333333341,4.97%,273.75,4310.69
2026-01-12 04:51:17,22,1024,7168,512,256,8,ActivationType.Silu,torch.bfloat16,torch.float8_e4m3fnuz,torch.float8_e4m3fnuz,QuantType.per_1x128,1,0,asm,stage1,32,_ZN5aiter59fmoe_stage1_bf16_pertokenFp8_blockscale_g1u1_32x128_3tg_pf3E,32,128,,,,,3.0,660.1379,102.14833333333341,21.61%,273.26,4303.03
2026-01-12 04:51:17,22,1024,7168,512,256,8,ActivationType.Silu,torch.bfloat16,torch.float8_e4m3fnuz,torch.float8_e4m3fnuz,QuantType.per_1x128,1,0,asm,stage1,32,_ZN5aiter59fmoe_stage1_bf16_pertokenFp8_blockscale_g1u1_32x128_3tg_pf2E,32,128,,,,,2.0,668.9722,102.14833333333341,21.69%,269.65,4246.2
2026-01-12 04:51:17,22,1024,7168,512,256,8,ActivationType.Silu,torch.bfloat16,torch.float8_e4m3fnuz,torch.float8_e4m3fnuz,QuantType.per_1x128,1,0,ck,stage2,64,moe_ck2stages_gemm2_256x64x128x128_1x4_MulABScaleExpertWeightA8W8blkscale_v3_Nswizzle0_Quant4_MulRoutedWeight1_F8_F8_B16,64,128,128.0,256.0,1.0,4.0,3.0,904.3835,102.14833333333341,15.59%,199.46,3140.92
2026-01-12 04:51:17,22,1024,7168,512,256,8,ActivationType.Silu,torch.bfloat16,torch.float8_e4m3fnuz,torch.float8_e4m3fnuz,QuantType.per_1x128,1,0,ck,stage1,16,moe_ck2stages_gemm1_256x16x128x256_1x4_MulABScaleExpertWeightA8W8blkscale_v1_Nswizzle0_Quant4_MulRoutedWeight0_silu_F8_F8_B16,16,128,256.0,256.0,1.0,4.0,1.0,918.7798,102.14833333333341,0.01%,196.33,3091.7
2026-01-12 04:51:17,22,1024,7168,512,256,8,ActivationType.Silu,torch.bfloat16,torch.float8_e4m3fnuz,torch.float8_e4m3fnuz,QuantType.per_1x128,1,0,asm,stage1,16,_ZN5aiter59fmoe_stage1_bf16_pertokenFp8_blockscale_g1u1_16x128_4tg_pf2E,16,128,,,,,2.0,919.8828,102.14833333333341,44.30%,196.1,3087.99
2026-01-12 04:51:17,22,1024,7168,512,256,8,ActivationType.Silu,torch.bfloat16,torch.float8_e4m3fnuz,torch.float8_e4m3fnuz,QuantType.per_1x128,1,0,asm,stage1,16,_ZN5aiter59fmoe_stage1_bf16_pertokenFp8_blockscale_g1u1_16x128_4tg_pf3E,16,128,,,,,3.0,927.7098,102.14833333333341,49.23%,194.45,3061.94
2026-01-12 04:51:17,22,1024,7168,512,256,8,ActivationType.Silu,torch.bfloat16,torch.float8_e4m3fnuz,torch.float8_e4m3fnuz,QuantType.per_1x128,1,0,asm,asm_1stage,32,_ZN5aiter47fmoe_bf16_blockscaleFp8_g1u1_vs_silu_1tg_32x256E,32,256,,,,,,1010.9336,0.0,0.00%,178.44,2809.87
2026-01-12 04:51:17,22,1024,7168,512,256,8,ActivationType.Silu,torch.bfloat16,torch.float8_e4m3fnuz,torch.float8_e4m3fnuz,QuantType.per_1x128,1,0,asm,asm_1stage,32,_ZN5aiter52fmoe_bf16_blockscaleFp8_g1u1_novs_silu_1tg_ps_32x256E,32,256,,,,,,1012.4139,0.0,0.00%,178.18,2805.76
2026-01-12 04:51:17,22,1024,7168,512,256,8,ActivationType.Silu,torch.bfloat16,torch.float8_e4m3fnuz,torch.float8_e4m3fnuz,QuantType.per_1x128,1,0,asm,asm_1stage,32,_ZN5aiter49fmoe_bf16_blockscaleFp8_g1u1_novs_silu_1tg_32x256E,32,256,,,,,,1022.2972,0.0,0.00%,176.45,2778.64
2026-01-12 04:51:17,22,1024,7168,512,256,8,ActivationType.Silu,torch.bfloat16,torch.float8_e4m3fnuz,torch.float8_e4m3fnuz,QuantType.per_1x128,1,0,asm,stage1,16,_ZN5aiter59fmoe_stage1_bf16_pertokenFp8_blockscale_g1u1_16x256_2tg_pf3E,16,256,,,,,3.0,1024.6228,102.14833333333341,25.03%,176.05,2772.33
2026-01-12 04:51:17,22,1024,7168,512,256,8,ActivationType.Silu,torch.bfloat16,torch.float8_e4m3fnuz,torch.float8_e4m3fnuz,QuantType.per_1x128,1,0,asm,stage1,16,_ZN5aiter59fmoe_stage1_bf16_pertokenFp8_blockscale_g1u1_16x256_3tg_pf2E,16,256,,,,,2.0,1033.7276,102.14833333333341,24.94%,174.5,2747.91
2026-01-12 04:51:17,22,1024,7168,512,256,8,ActivationType.Silu,torch.bfloat16,torch.float8_e4m3fnuz,torch.float8_e4m3fnuz,QuantType.per_1x128,1,0,asm,asm_1stage,32,_ZN5aiter50fmoe_bf16_blockscaleFp8_g1u1_vs_silu_1tg_ps_32x256E,32,256,,,,,,1034.5613,0.0,0.00%,174.36,2745.7
2026-01-12 04:51:17,22,1024,7168,512,256,8,ActivationType.Silu,torch.bfloat16,torch.float8_e4m3fnuz,torch.float8_e4m3fnuz,QuantType.per_1x128,1,0,asm,stage1,16,_ZN5aiter59fmoe_stage1_bf16_pertokenFp8_blockscale_g1u1_16x512_2tg_pf2E,16,512,,,,,2.0,1044.7192,102.14833333333341,14.92%,172.67,2719.0
2026-01-12 04:51:17,22,1024,7168,512,256,8,ActivationType.Silu,torch.bfloat16,torch.float8_e4m3fnuz,torch.float8_e4m3fnuz,QuantType.per_1x128,1,0,asm,stage1,16,_ZN5aiter55fmoe_stage1_bf16_pertokenFp8_blockscale_g1u1_16x512_pf3E,16,512,,,,,3.0,1045.9608,102.14833333333341,15.00%,172.46,2715.77
2026-01-12 04:51:35,23,1024,7168,512,256,8,ActivationType.Gelu,torch.bfloat16,torch.float8_e4m3fnuz,torch.float8_e4m3fnuz,QuantType.per_1x128,1,0,ck,stage2,16,moe_ck2stages_gemm2_256x16x128x256_1x4_MulABScaleExpertWeightA8W8blkscale_v1_Nswizzle0_Quant4_MulRoutedWeight1_F8_F8_B16,16,128,256.0,256.0,1.0,4.0,1.0,424.1698,102.3081111111111,15.59%,425.27,6696.83
2026-01-12 04:51:35,23,1024,7168,512,256,8,ActivationType.Gelu,torch.bfloat16,torch.float8_e4m3fnuz,torch.float8_e4m3fnuz,QuantType.per_1x128,1,0,asm,stage1,64,_ZN5aiter55fmoe_stage1_bf16_pertokenFp8_blockscale_g1u1_64x256_pf3E,64,256,,,,,3.0,525.2515,102.3081111111111,5.22%,343.43,5408.06
2026-01-12 04:51:35,23,1024,7168,512,256,8,ActivationType.Gelu,torch.bfloat16,torch.float8_e4m3fnuz,torch.float8_e4m3fnuz,QuantType.per_1x128,1,0,asm,stage1,64,_ZN5aiter55fmoe_stage1_bf16_pertokenFp8_blockscale_g1u1_64x256_pf2E,64,256,,,,,2.0,525.4946,102.3081111111111,5.22%,343.27,5405.56
2026-01-12 04:51:35,23,1024,7168,512,256,8,ActivationType.Gelu,torch.bfloat16,torch.float8_e4m3fnuz,torch.float8_e4m3fnuz,QuantType.per_1x128,1,0,asm,stage1,64,_ZN5aiter59fmoe_stage1_bf16_pertokenFp8_blockscale_g1u1_64x128_2tg_pf2E,64,128,,,,,2.0,552.5272,102.3081111111111,5.23%,326.48,5141.09
2026-01-12 04:51:35,23,1024,7168,512,256,8,ActivationType.Gelu,torch.bfloat16,torch.float8_e4m3fnuz,torch.float8_e4m3fnuz,QuantType.per_1x128,1,0,asm,stage1,64,_ZN5aiter59fmoe_stage1_bf16_pertokenFp8_blockscale_g1u1_64x128_2tg_pf3E,64,128,,,,,3.0,557.9868,102.3081111111111,5.23%,323.28,5090.79
2026-01-12 04:51:35,23,1024,7168,512,256,8,ActivationType.Gelu,torch.bfloat16,torch.float8_e4m3fnuz,torch.float8_e4m3fnuz,QuantType.per_1x128,1,0,ck,stage1,64,moe_ck2stages_gemm1_256x64x128x128_1x4_MulABScaleExpertWeightA8W8blkscale_v3_Nswizzle0_Quant4_MulRoutedWeight0_gelu_F8_F8_B16,64,128,128.0,256.0,1.0,4.0,3.0,607.5437,102.3081111111111,0.01%,296.91,4675.54
2026-01-12 04:51:35,23,1024,7168,512,256,8,ActivationType.Gelu,torch.bfloat16,torch.float8_e4m3fnuz,torch.float8_e4m3fnuz,QuantType.per_1x128,1,0,asm,stage1,32,_ZN5aiter59fmoe_stage1_bf16_pertokenFp8_blockscale_g1u1_32x256_2tg_pf3E,32,256,,,,,3.0,620.8907,102.3081111111111,13.51%,290.53,4575.03
2026-01-12 04:51:35,23,1024,7168,512,256,8,ActivationType.Gelu,torch.bfloat16,torch.float8_e4m3fnuz,torch.float8_e4m3fnuz,QuantType.per_1x128,1,0,asm,stage1,32,_ZN5aiter55fmoe_stage1_bf16_pertokenFp8_blockscale_g1u1_32x512_pf3E,32,512,,,,,3.0,627.745,102.3081111111111,9.40%,287.36,4525.07
2026-01-12 04:51:35,23,1024,7168,512,256,8,ActivationType.Gelu,torch.bfloat16,torch.float8_e4m3fnuz,torch.float8_e4m3fnuz,QuantType.per_1x128,1,0,asm,stage1,32,_ZN5aiter55fmoe_stage1_bf16_pertokenFp8_blockscale_g1u1_32x512_pf2E,32,512,,,,,2.0,637.2408,102.3081111111111,9.40%,283.08,4457.64
2026-01-12 04:51:35,23,1024,7168,512,256,8,ActivationType.Gelu,torch.bfloat16,torch.float8_e4m3fnuz,torch.float8_e4m3fnuz,QuantType.per_1x128,1,0,asm,stage1,32,_ZN5aiter59fmoe_stage1_bf16_pertokenFp8_blockscale_g1u1_32x256_2tg_pf2E,32,256,,,,,2.0,639.0755,102.3081111111111,13.57%,282.26,4444.85
2026-01-12 04:51:35,23,1024,7168,512,256,8,ActivationType.Gelu,torch.bfloat16,torch.float8_e4m3fnuz,torch.float8_e4m3fnuz,QuantType.per_1x128,1,0,asm,stage1,128,_ZN5aiter56fmoe_stage1_bf16_pertokenFp8_blockscale_g1u1_128x128_pf3E,128,128,,,,,3.0,646.7135,102.3081111111111,5.20%,278.93,4392.35
2026-01-12 04:51:35,23,1024,7168,512,256,8,ActivationType.Gelu,torch.bfloat16,torch.float8_e4m3fnuz,torch.float8_e4m3fnuz,QuantType.per_1x128,1,0,asm,stage1,128,_ZN5aiter56fmoe_stage1_bf16_pertokenFp8_blockscale_g1u1_128x128_pf2E,128,128,,,,,2.0,660.7378,102.3081111111111,5.20%,273.01,4299.12
2026-01-12 04:51:35,23,1024,7168,512,256,8,ActivationType.Gelu,torch.bfloat16,torch.float8_e4m3fnuz,torch.float8_e4m3fnuz,QuantType.per_1x128,1,0,asm,stage1,32,_ZN5aiter59fmoe_stage1_bf16_pertokenFp8_blockscale_g1u1_32x128_3tg_pf3E,32,128,,,,,3.0,662.2911,102.3081111111111,21.55%,272.37,4289.04
2026-01-12 04:51:35,23,1024,7168,512,256,8,ActivationType.Gelu,torch.bfloat16,torch.float8_e4m3fnuz,torch.float8_e4m3fnuz,QuantType.per_1x128,1,0,asm,stage1,32,_ZN5aiter59fmoe_stage1_bf16_pertokenFp8_blockscale_g1u1_32x128_3tg_pf2E,32,128,,,,,2.0,672.2752,102.3081111111111,21.82%,268.33,4225.34
2026-01-12 04:51:35,23,1024,7168,512,256,8,ActivationType.Gelu,torch.bfloat16,torch.float8_e4m3fnuz,torch.float8_e4m3fnuz,QuantType.per_1x128,1,0,ck,stage2,64,moe_ck2stages_gemm2_256x64x128x128_1x4_MulABScaleExpertWeightA8W8blkscale_v3_Nswizzle0_Quant4_MulRoutedWeight1_F8_F8_B16,64,128,128.0,256.0,1.0,4.0,3.0,901.7137,102.3081111111111,15.59%,200.05,3150.22
2026-01-12 04:51:35,23,1024,7168,512,256,8,ActivationType.Gelu,torch.bfloat16,torch.float8_e4m3fnuz,torch.float8_e4m3fnuz,QuantType.per_1x128,1,0,ck,stage1,16,moe_ck2stages_gemm1_256x16x128x256_1x4_MulABScaleExpertWeightA8W8blkscale_v1_Nswizzle0_Quant4_MulRoutedWeight0_gelu_F8_F8_B16,16,128,256.0,256.0,1.0,4.0,1.0,921.1377,102.3081111111111,0.01%,195.83,3083.79
2026-01-12 04:51:35,23,1024,7168,512,256,8,ActivationType.Gelu,torch.bfloat16,torch.float8_e4m3fnuz,torch.float8_e4m3fnuz,QuantType.per_1x128,1,0,asm,stage1,16,_ZN5aiter59fmoe_stage1_bf16_pertokenFp8_blockscale_g1u1_16x128_4tg_pf3E,16,128,,,,,3.0,922.7744,102.3081111111111,48.80%,195.49,3078.32
2026-01-12 04:51:35,23,1024,7168,512,256,8,ActivationType.Gelu,torch.bfloat16,torch.float8_e4m3fnuz,torch.float8_e4m3fnuz,QuantType.per_1x128,1,0,asm,stage1,16,_ZN5aiter59fmoe_stage1_bf16_pertokenFp8_blockscale_g1u1_16x128_4tg_pf2E,16,128,,,,,2.0,925.328,102.3081111111111,44.32%,194.95,3069.82
2026-01-12 04:51:35,23,1024,7168,512,256,8,ActivationType.Gelu,torch.bfloat16,torch.float8_e4m3fnuz,torch.float8_e4m3fnuz,QuantType.per_1x128,1,0,asm,asm_1stage,32,_ZN5aiter47fmoe_bf16_blockscaleFp8_g1u1_vs_gelu_1tg_32x256E,32,256,,,,,,1012.2132,0.0,10.33%,178.21,2806.32
2026-01-12 04:51:35,23,1024,7168,512,256,8,ActivationType.Gelu,torch.bfloat16,torch.float8_e4m3fnuz,torch.float8_e4m3fnuz,QuantType.per_1x128,1,0,asm,asm_1stage,32,_ZN5aiter49fmoe_bf16_blockscaleFp8_g1u1_novs_gelu_1tg_32x256E,32,256,,,,,,1015.0032,0.0,10.33%,177.72,2798.6
2026-01-12 04:51:35,23,1024,7168,512,256,8,ActivationType.Gelu,torch.bfloat16,torch.float8_e4m3fnuz,torch.float8_e4m3fnuz,QuantType.per_1x128,1,0,asm,asm_1stage,32,_ZN5aiter52fmoe_bf16_blockscaleFp8_g1u1_novs_gelu_1tg_ps_32x256E,32,256,,,,,,1018.4583,0.0,10.33%,177.12,2789.11
2026-01-12 04:51:35,23,1024,7168,512,256,8,ActivationType.Gelu,torch.bfloat16,torch.float8_e4m3fnuz,torch.float8_e4m3fnuz,QuantType.per_1x128,1,0,asm,stage1,16,_ZN5aiter59fmoe_stage1_bf16_pertokenFp8_blockscale_g1u1_16x256_2tg_pf3E,16,256,,,,,3.0,1024.7758,102.3081111111111,25.26%,176.03,2771.92
2026-01-12 04:51:35,23,1024,7168,512,256,8,ActivationType.Gelu,torch.bfloat16,torch.float8_e4m3fnuz,torch.float8_e4m3fnuz,QuantType.per_1x128,1,0,asm,asm_1stage,32,_ZN5aiter50fmoe_bf16_blockscaleFp8_g1u1_vs_gelu_1tg_ps_32x256E,32,256,,,,,,1032.8842,0.0,10.33%,174.65,2750.16
2026-01-12 04:51:35,23,1024,7168,512,256,8,ActivationType.Gelu,torch.bfloat16,torch.float8_e4m3fnuz,torch.float8_e4m3fnuz,QuantType.per_1x128,1,0,asm,stage1,16,_ZN5aiter59fmoe_stage1_bf16_pertokenFp8_blockscale_g1u1_16x256_3tg_pf2E,16,256,,,,,2.0,1033.7172,102.3081111111111,25.08%,174.5,2747.94
2026-01-12 04:51:35,23,1024,7168,512,256,8,ActivationType.Gelu,torch.bfloat16,torch.float8_e4m3fnuz,torch.float8_e4m3fnuz,QuantType.per_1x128,1,0,asm,stage1,16,_ZN5aiter59fmoe_stage1_bf16_pertokenFp8_blockscale_g1u1_16x512_2tg_pf2E,16,512,,,,,2.0,1045.7814,102.3081111111111,15.09%,172.49,2716.24
2026-01-12 04:51:35,23,1024,7168,512,256,8,ActivationType.Gelu,torch.bfloat16,torch.float8_e4m3fnuz,torch.float8_e4m3fnuz,QuantType.per_1x128,1,0,asm,stage1,16,_ZN5aiter55fmoe_stage1_bf16_pertokenFp8_blockscale_g1u1_16x512_pf3E,16,512,,,,,3.0,1046.0274,102.3081111111111,15.21%,172.45,2715.6
2026-01-12 04:51:55,24,128,7168,2048,33,10,ActivationType.Silu,torch.bfloat16,torch.float8_e4m3fnuz,torch.float8_e4m3fnuz,QuantType.per_Token,1,0,ck,stage2,64,moe_ck2stages_gemm2_256x64x64x256_1x4_MulABScaleExpertWeight_v1_Nswizzle0_Quant2_MulRoutedWeight1_F8_F8_B16,64,64,256.0,256.0,1.0,4.0,1.0,162.0392,80.04344444444455,7.59%,695.78,8985.97
2026-01-12 04:51:55,24,128,7168,2048,33,10,ActivationType.Silu,torch.bfloat16,torch.float8_e4m3fnuz,torch.float8_e4m3fnuz,QuantType.per_Token,1,0,ck,stage2,32,moe_ck2stages_gemm2_256x32x64x256_1x4_MulABScaleExpertWeight_v1_Nswizzle0_Quant2_MulRoutedWeight1_F8_F8_B16,32,64,256.0,256.0,1.0,4.0,1.0,171.2012,80.04344444444455,7.59%,658.54,8505.07
2026-01-12 04:51:55,24,128,7168,2048,33,10,ActivationType.Silu,torch.bfloat16,torch.float8_e4m3fnuz,torch.float8_e4m3fnuz,QuantType.per_Token,1,0,ck,stage2,64,moe_ck2stages_gemm2_256x64x128x128_1x4_MulABScaleExpertWeight_v3_Nswizzle0_Quant2_MulRoutedWeight1_F8_F8_B16,64,128,128.0,256.0,1.0,4.0,3.0,176.8461,80.04344444444455,7.56%,637.52,8233.59
2026-01-12 04:51:55,24,128,7168,2048,33,10,ActivationType.Silu,torch.bfloat16,torch.float8_e4m3fnuz,torch.float8_e4m3fnuz,QuantType.per_Token,1,0,ck,stage2,64,moe_ck2stages_gemm2_256x64x128x256_1x4_MulABScaleExpertWeight_v3_Nswizzle0_Quant2_MulRoutedWeight1_F8_F8_B16,64,128,256.0,256.0,1.0,4.0,3.0,179.8288,80.04344444444455,7.58%,626.95,8097.03
2026-01-12 04:51:55,24,128,7168,2048,33,10,ActivationType.Silu,torch.bfloat16,torch.float8_e4m3fnuz,torch.float8_e4m3fnuz,QuantType.per_Token,1,0,ck,stage2,32,moe_ck2stages_gemm2_256x32x64x128_1x4_MulABScaleExpertWeight_v1_Nswizzle0_Quant2_MulRoutedWeight1_F8_F8_B16,32,64,128.0,256.0,1.0,4.0,1.0,181.1031,80.04344444444455,7.60%,622.53,8040.05
2026-01-12 04:51:55,24,128,7168,2048,33,10,ActivationType.Silu,torch.bfloat16,torch.float8_e4m3fnuz,torch.float8_e4m3fnuz,QuantType.per_Token,1,0,ck,stage2,128,moe_ck2stages_gemm2_256x128x128x128_1x4_MulABScaleExpertWeight_v3_Nswizzle0_Quant2_MulRoutedWeight1_F8_F8_B16,128,128,128.0,256.0,1.0,4.0,3.0,191.0185,80.04344444444455,7.56%,590.22,7622.71
2026-01-12 04:51:55,24,128,7168,2048,33,10,ActivationType.Silu,torch.bfloat16,torch.float8_e4m3fnuz,torch.float8_e4m3fnuz,QuantType.per_Token,1,0,ck,stage2,128,moe_ck2stages_gemm2_256x128x64x128_1x4_MulABScaleExpertWeight_v1_Nswizzle0_Quant2_MulRoutedWeight1_F8_F8_B16,128,64,128.0,256.0,1.0,4.0,1.0,203.3212,80.04344444444455,7.61%,554.51,7161.47
2026-01-12 04:51:55,24,128,7168,2048,33,10,ActivationType.Silu,torch.bfloat16,torch.float8_e4m3fnuz,torch.float8_e4m3fnuz,QuantType.per_Token,1,0,ck,stage2,64,moe_ck2stages_gemm2_256x64x128x64_1x4_MulABScaleExpertWeight_v3_Nswizzle0_Quant2_MulRoutedWeight1_F8_F8_B16,64,128,64.0,256.0,1.0,4.0,3.0,212.7674,80.04344444444455,99.56%,529.89,6843.52
2026-01-12 04:51:55,24,128,7168,2048,33,10,ActivationType.Silu,torch.bfloat16,torch.float8_e4m3fnuz,torch.float8_e4m3fnuz,QuantType.per_Token,1,0,ck,stage2,64,moe_ck2stages_gemm2_256x64x64x64_1x4_MulABScaleExpertWeight_v1_Nswizzle0_Quant2_MulRoutedWeight1_F8_F8_B16,64,64,64.0,256.0,1.0,4.0,1.0,222.1701,80.04344444444455,99.57%,507.46,6553.89
2026-01-12 04:51:55,24,128,7168,2048,33,10,ActivationType.Silu,torch.bfloat16,torch.float8_e4m3fnuz,torch.float8_e4m3fnuz,QuantType.per_Token,1,0,ck,stage2,32,moe_ck2stages_gemm2_256x32x64x64_1x4_MulABScaleExpertWeight_v1_Nswizzle0_Quant2_MulRoutedWeight1_F8_F8_B16,32,64,64.0,256.0,1.0,4.0,1.0,222.9036,80.04344444444455,99.56%,505.79,6532.33
2026-01-12 04:51:55,24,128,7168,2048,33,10,ActivationType.Silu,torch.bfloat16,torch.float8_e4m3fnuz,torch.float8_e4m3fnuz,QuantType.per_Token,1,0,asm,stage1,64,_ZN5aiter44fmoe_stage1_bf16_pertokenFp8_g1u1_64x256_pf2E,64,256,,,,,2.0,261.6541,80.04344444444455,0.00%,430.89,5564.9
2026-01-12 04:51:55,24,128,7168,2048,33,10,ActivationType.Silu,torch.bfloat16,torch.float8_e4m3fnuz,torch.float8_e4m3fnuz,QuantType.per_Token,1,0,asm,stage1,64,_ZN5aiter48fmoe_stage1_bf16_pertokenFp8_g1u1_64x128_2tg_pf2E,64,128,,,,,2.0,262.2253,80.04344444444455,0.00%,429.95,5552.78
2026-01-12 04:51:55,24,128,7168,2048,33,10,ActivationType.Silu,torch.bfloat16,torch.float8_e4m3fnuz,torch.float8_e4m3fnuz,QuantType.per_Token,1,0,asm,stage1,64,_ZN5aiter48fmoe_stage1_bf16_pertokenFp8_g1u1_64x128_2tg_pf3E,64,128,,,,,3.0,264.4596,80.04344444444455,0.00%,426.31,5505.86
2026-01-12 04:51:55,24,128,7168,2048,33,10,ActivationType.Silu,torch.bfloat16,torch.float8_e4m3fnuz,torch.float8_e4m3fnuz,QuantType.per_Token,1,0,asm,stage1,64,_ZN5aiter44fmoe_stage1_bf16_pertokenFp8_g1u1_64x256_pf3E,64,256,,,,,3.0,264.7286,80.04344444444455,0.00%,425.88,5500.27
2026-01-12 04:51:55,24,128,7168,2048,33,10,ActivationType.Silu,torch.bfloat16,torch.float8_e4m3fnuz,torch.float8_e4m3fnuz,QuantType.per_Token,1,0,asm,stage1,32,_ZN5aiter47fmoe_stage1_bf16_pertokenFp8_g1u1_32x64_4tg_pf2E,32,64,,,,,2.0,269.8343,80.04344444444455,0.00%,417.82,5396.2
2026-01-12 04:51:55,24,128,7168,2048,33,10,ActivationType.Silu,torch.bfloat16,torch.float8_e4m3fnuz,torch.float8_e4m3fnuz,QuantType.per_Token,1,0,asm,stage1,32,_ZN5aiter48fmoe_stage1_bf16_pertokenFp8_g1u1_32x256_2tg_pf3E,32,256,,,,,3.0,272.1847,80.04344444444455,0.00%,414.21,5349.6
2026-01-12 04:51:55,24,128,7168,2048,33,10,ActivationType.Silu,torch.bfloat16,torch.float8_e4m3fnuz,torch.float8_e4m3fnuz,QuantType.per_Token,1,0,asm,stage1,64,_ZN5aiter47fmoe_stage1_bf16_pertokenFp8_g1u1_64x64_2tg_pf3E,64,64,,,,,3.0,277.1204,80.04344444444455,1.19%,406.84,5254.32
2026-01-12 04:51:55,24,128,7168,2048,33,10,ActivationType.Silu,torch.bfloat16,torch.float8_e4m3fnuz,torch.float8_e4m3fnuz,QuantType.per_Token,1,0,ck,stage1,64,moe_ck2stages_gemm1_256x64x128x256_1x4_MulABScale_v3_Nswizzle0_Quant2_MulRoutedWeight0_silu_F8_F8_B16,64,128,256.0,256.0,1.0,4.0,3.0,277.7162,80.04344444444455,0.00%,405.96,5243.05
2026-01-12 04:51:55,24,128,7168,2048,33,10,ActivationType.Silu,torch.bfloat16,torch.float8_e4m3fnuz,torch.float8_e4m3fnuz,QuantType.per_Token,1,0,ck,stage1,64,moe_ck2stages_gemm1_256x64x128x128_1x4_MulABScale_v3_Nswizzle0_Quant2_MulRoutedWeight0_silu_F8_F8_B16,64,128,128.0,256.0,1.0,4.0,3.0,279.8052,80.04344444444455,0.00%,402.93,5203.9
2026-01-12 04:51:55,24,128,7168,2048,33,10,ActivationType.Silu,torch.bfloat16,torch.float8_e4m3fnuz,torch.float8_e4m3fnuz,QuantType.per_Token,1,0,asm,stage1,32,_ZN5aiter48fmoe_stage1_bf16_pertokenFp8_g1u1_32x256_2tg_pf2E,32,256,,,,,2.0,284.235,80.04344444444455,0.00%,396.65,5122.8
2026-01-12 04:51:55,24,128,7168,2048,33,10,ActivationType.Silu,torch.bfloat16,torch.float8_e4m3fnuz,torch.float8_e4m3fnuz,QuantType.per_Token,1,0,asm,stage1,16,_ZN5aiter48fmoe_stage1_bf16_pertokenFp8_g1u1_16x256_2tg_pf3E,16,256,,,,,3.0,287.1876,80.04344444444455,0.00%,392.58,5070.13
2026-01-12 04:51:55,24,128,7168,2048,33,10,ActivationType.Silu,torch.bfloat16,torch.float8_e4m3fnuz,torch.float8_e4m3fnuz,QuantType.per_Token,1,0,ck,stage2,128,moe_ck2stages_gemm2_256x128x128x64_1x4_MulABScaleExpertWeight_v3_Nswizzle0_Quant2_MulRoutedWeight1_F8_F8_B16,128,128,64.0,256.0,1.0,4.0,3.0,289.4093,80.04344444444455,99.57%,389.56,5031.21
2026-01-12 04:51:55,24,128,7168,2048,33,10,ActivationType.Silu,torch.bfloat16,torch.float8_e4m3fnuz,torch.float8_e4m3fnuz,QuantType.per_Token,1,0,asm,stage1,16,_ZN5aiter48fmoe_stage1_bf16_pertokenFp8_g1u1_16x256_3tg_pf2E,16,256,,,,,2.0,293.6914,80.04344444444455,0.00%,383.88,4957.85
2026-01-12 04:51:55,24,128,7168,2048,33,10,ActivationType.Silu,torch.bfloat16,torch.float8_e4m3fnuz,torch.float8_e4m3fnuz,QuantType.per_Token,1,0,asm,stage1,128,_ZN5aiter45fmoe_stage1_bf16_pertokenFp8_g1u1_128x128_pf3E,128,128,,,,,3.0,294.078,80.04344444444455,0.00%,383.38,4951.34
2026-01-12 04:51:55,24,128,7168,2048,33,10,ActivationType.Silu,torch.bfloat16,torch.float8_e4m3fnuz,torch.float8_e4m3fnuz,QuantType.per_Token,1,0,asm,stage1,16,_ZN5aiter48fmoe_stage1_bf16_pertokenFp8_g1u1_16x128_4tg_pf2E,16,128,,,,,2.0,296.086,80.04344444444455,0.01%,380.78,4917.76
2026-01-12 04:51:55,24,128,7168,2048,33,10,ActivationType.Silu,torch.bfloat16,torch.float8_e4m3fnuz,torch.float8_e4m3fnuz,QuantType.per_Token,1,0,asm,stage1,128,_ZN5aiter45fmoe_stage1_bf16_pertokenFp8_g1u1_128x128_pf2E,128,128,,,,,2.0,296.8816,80.04344444444455,0.00%,379.76,4904.58
2026-01-12 04:51:55,24,128,7168,2048,33,10,ActivationType.Silu,torch.bfloat16,torch.float8_e4m3fnuz,torch.float8_e4m3fnuz,QuantType.per_Token,1,0,asm,stage1,64,_ZN5aiter47fmoe_stage1_bf16_pertokenFp8_g1u1_64x64_3tg_pf2E,64,64,,,,,2.0,298.3037,80.04344444444455,0.00%,377.95,4881.2
2026-01-12 04:51:55,24,128,7168,2048,33,10,ActivationType.Silu,torch.bfloat16,torch.float8_e4m3fnuz,torch.float8_e4m3fnuz,QuantType.per_Token,1,0,asm,stage1,32,_ZN5aiter48fmoe_stage1_bf16_pertokenFp8_g1u1_32x128_3tg_pf2E,32,128,,,,,2.0,302.4933,80.04344444444455,0.00%,372.71,4813.59
2026-01-12 04:51:55,24,128,7168,2048,33,10,ActivationType.Silu,torch.bfloat16,torch.float8_e4m3fnuz,torch.float8_e4m3fnuz,QuantType.per_Token,1,0,asm,stage1,16,_ZN5aiter47fmoe_stage1_bf16_pertokenFp8_g1u1_16x64_6tg_pf2E,16,64,,,,,2.0,304.8639,80.04344444444455,0.00%,369.81,4776.16
