aiter/ops/triton/configs/gemm/gluon/gfx1250-GEMM-A16W16-N=6144-K=8192.json
{
    "M_LEQ_4": {
        "BLOCK_M": 16,
        "BLOCK_N": 32,
        "BLOCK_K": 512,
        "NUM_BUFFERS": 4,
        "num_warps": 2,
        "kernel_type": "compute_bound"
    },
    "M_LEQ_16": {
        "BLOCK_M": 16,
        "BLOCK_N": 32,
        "BLOCK_K": 512,
        "NUM_BUFFERS": 3,
        "num_warps": 2,
        "kernel_type": "compute_bound"
    },
    "M_LEQ_8192": {
        "BLOCK_M": 64,
        "BLOCK_N": 256,
        "BLOCK_K": 64,
        "NUM_BUFFERS": 5,
        "num_warps": 2,
        "kernel_type": "compute_bound"
    },
    "any": {
        "BLOCK_M": 256,
        "BLOCK_N": 256,
        "BLOCK_K": 64,
        "NUM_BUFFERS": 3,
        "num_warps": 4,
        "kernel_type": "compute_bound"
    }
}
