aiter/ops/triton/configs/gemm/gluon/gfx1250-GEMM-A16W16-N=9856-K=6144.json
{
    "M_LEQ_4": {
        "BLOCK_M": 16,
        "BLOCK_N": 64,
        "BLOCK_K": 256,
        "NUM_BUFFERS": 5,
        "num_warps": 2,
        "kernel_type": "compute_bound"
    },
    "M_LEQ_16": {
        "BLOCK_M": 16,
        "BLOCK_N": 64,
        "BLOCK_K": 128,
        "NUM_BUFFERS": 8,
        "num_warps": 2,
        "kernel_type": "compute_bound"
    },
    "M_LEQ_32": {
        "BLOCK_M": 32,
        "BLOCK_N": 256,
        "BLOCK_K": 64,
        "NUM_BUFFERS": 2,
        "num_warps": 2,
        "kernel_type": "bandwidth_bound"
    },
    "M_LEQ_64": {
        "BLOCK_M": 32,
        "BLOCK_N": 64,
        "BLOCK_K": 128,
        "NUM_BUFFERS": 4,
        "num_warps": 2,
        "kernel_type": "compute_bound"
    },
    "any": {
        "BLOCK_M": 128,
        "BLOCK_N": 256,
        "BLOCK_K": 64,
        "NUM_BUFFERS": 2,
        "num_warps": 2,
        "kernel_type": "compute_bound"
    }
}
