aiter/ops/triton/configs/gemm/gluon/gfx1250-GEMM-A8W8_BLOCKSCALE.json
{
    "M_LEQ_16": {
      "BLOCK_SIZE_M": 16,
      "BLOCK_SIZE_N": 32,
      "BLOCK_SIZE_K": 128,
      "GROUP_SIZE_M": 1,
      "num_warps": 2,
      "num_stages": 2,
      "waves_per_eu": 1,
      "matrix_instr_nonkdim": 16,
      "cache_modifier": ".cg"
    },
    "M_LEQ_32": {
      "BLOCK_SIZE_M": 32,
      "BLOCK_SIZE_N": 128,
      "BLOCK_SIZE_K": 128,
      "GROUP_SIZE_M": 4,
      "num_warps": 2,
      "num_stages": 2,
      "waves_per_eu": 1,
      "matrix_instr_nonkdim": 16,
      "cache_modifier": ".cg"
    },
    "M_LEQ_64": {
      "BLOCK_SIZE_M": 16,
      "BLOCK_SIZE_N": 32,
      "BLOCK_SIZE_K": 128,
      "GROUP_SIZE_M": 2,
      "num_warps": 2,
      "num_stages": 2,
      "waves_per_eu": 1,
      "matrix_instr_nonkdim": 16,
      "cache_modifier": ".ca"
    },
    "M_LEQ_128": {
      "BLOCK_SIZE_M": 16,
      "BLOCK_SIZE_N": 32,
      "BLOCK_SIZE_K": 128,
      "GROUP_SIZE_M": 2,
      "num_warps": 2,
      "num_stages": 2,
      "waves_per_eu": 1,
      "matrix_instr_nonkdim": 16,
      "cache_modifier": ".ca"
    },
    "any": {
      "BLOCK_SIZE_M": 64,
      "BLOCK_SIZE_N": 128,
      "BLOCK_SIZE_K": 128,
      "GROUP_SIZE_M": 1,
      "num_warps": 2,
      "num_stages": 2,
      "waves_per_eu": 2,
      "matrix_instr_nonkdim": 16,
      "cache_modifier": ".ca"
    }
  }