op_tests/moe_benchmarking_profiling/results/mi300_benchmark_best_kernels.csv
config_idx,token,model_dim,inter_dim,expert,topk,act_type,dtype,q_dtype_a,q_dtype_w,q_type,use_g1u1,doweight_stage1,kernel_type,stage,block_m,kernel_name,time_us,quant_time_us,error,tflops,bandwidth_gb
0,1,7168,256,256,8,ActivationType.Silu,torch.bfloat16,torch.float8_e4m3fnuz,torch.float8_e4m3fnuz,QuantType.per_1x128,1,0,asm,stage1,16,_ZN5aiter59fmoe_stage1_bf16_pertokenFp8_blockscale_g1u1_16x128_4tg_pf3E,40.3084,24.53533333333335,22.07%,2.19,34963.13
0,1,7168,256,256,8,ActivationType.Silu,torch.bfloat16,torch.float8_e4m3fnuz,torch.float8_e4m3fnuz,QuantType.per_1x128,1,0,ck,stage2,16,moe_ck2stages_gemm2_256x16x128x256_1x4_MulABScaleExpertWeightA8W8blkscale_v1_Nswizzle0_Quant4_MulRoutedWeight1_F8_F8_B16,10.0729,24.53533333333335,15.97%,8.74,139910.81
1,1,7168,256,257,9,ActivationType.Silu,torch.bfloat16,torch.float8_e4m3fnuz,torch.float8_e4m3fnuz,QuantType.per_1x128,1,0,asm,stage1,16,_ZN5aiter59fmoe_stage1_bf16_pertokenFp8_blockscale_g1u1_16x128_4tg_pf3E,39.9041,23.30211111111106,27.58%,2.48,35455.32
1,1,7168,256,257,9,ActivationType.Silu,torch.bfloat16,torch.float8_e4m3fnuz,torch.float8_e4m3fnuz,QuantType.per_1x128,1,0,ck,stage2,16,moe_ck2stages_gemm2_256x16x128x256_1x4_MulABScaleExpertWeightA8W8blkscale_v1_Nswizzle0_Quant4_MulRoutedWeight1_F8_F8_B16,10.661,23.30211111111106,18.04%,9.29,132709.19
2,2,7168,256,256,8,ActivationType.Silu,torch.bfloat16,torch.float8_e4m3fnuz,torch.float8_e4m3fnuz,QuantType.per_1x128,1,0,asm,stage1,16,_ZN5aiter59fmoe_stage1_bf16_pertokenFp8_blockscale_g1u1_16x128_4tg_pf3E,40.671,23.773999999999944,28.71%,4.33,34651.94
2,2,7168,256,256,8,ActivationType.Silu,torch.bfloat16,torch.float8_e4m3fnuz,torch.float8_e4m3fnuz,QuantType.per_1x128,1,0,ck,stage2,16,moe_ck2stages_gemm2_256x16x128x256_1x4_MulABScaleExpertWeightA8W8blkscale_v1_Nswizzle0_Quant4_MulRoutedWeight1_F8_F8_B16,14.435,23.773999999999944,15.14%,12.2,97632.78
3,2,7168,256,257,9,ActivationType.Silu,torch.bfloat16,torch.float8_e4m3fnuz,torch.float8_e4m3fnuz,QuantType.per_1x128,1,0,asm,stage1,16,_ZN5aiter59fmoe_stage1_bf16_pertokenFp8_blockscale_g1u1_16x128_4tg_pf3E,40.8983,23.72555555555564,36.00%,4.85,34593.96
3,2,7168,256,257,9,ActivationType.Silu,torch.bfloat16,torch.float8_e4m3fnuz,torch.float8_e4m3fnuz,QuantType.per_1x128,1,0,ck,stage2,16,moe_ck2stages_gemm2_256x16x128x256_1x4_MulABScaleExpertWeightA8W8blkscale_v1_Nswizzle0_Quant4_MulRoutedWeight1_F8_F8_B16,15.4579,23.72555555555564,17.42%,12.82,91528.23
4,4,2304,1536,8,2,ActivationType.Gelu,torch.bfloat16,torch.float8_e4m3fnuz,torch.float8_e4m3fnuz,QuantType.per_Token,1,0,asm,asm_1stage,32,_ZN5aiter45fmoe_bf16_pertokenFp8_g1u1_vs_gelu_1tg_32x128E,35.3891,0.0,0.00%,4.8,2400.8
5,4,2304,1536,8,2,ActivationType.Gelu,torch.bfloat16,torch.float8_e4m3fnuz,torch.float8_e4m3fnuz,QuantType.per_Token,1,1,asm,asm_1stage,32,_ZN5aiter50fmoe_bf16_pertokenFp8_g1u1_vs_tkw1_gelu_1tg_32x128E,36.8311,0.0,0.00%,4.61,2306.81
6,4,7168,256,256,8,ActivationType.Silu,torch.bfloat16,torch.float8_e4m3fnuz,torch.float8_e4m3fnuz,QuantType.per_1x128,1,0,asm,asm_1stage,32,_ZN5aiter47fmoe_bf16_blockscaleFp8_g1u1_vs_silu_1tg_32x128E,85.0389,0.0,0.00%,4.14,16573.26
7,4,7168,256,257,9,ActivationType.Silu,torch.bfloat16,torch.float8_e4m3fnuz,torch.float8_e4m3fnuz,QuantType.per_1x128,1,0,asm,asm_1stage,32,_ZN5aiter47fmoe_bf16_blockscaleFp8_g1u1_vs_silu_1tg_32x128E,86.705,0.0,0.00%,4.57,16318.29
8,8,7168,256,256,8,ActivationType.Silu,torch.bfloat16,torch.float8_e4m3fnuz,torch.float8_e4m3fnuz,QuantType.per_1x128,1,0,asm,asm_1stage,32,_ZN5aiter47fmoe_bf16_blockscaleFp8_g1u1_vs_silu_1tg_32x128E,109.3836,0.0,0.00%,6.44,12885.46
9,8,7168,256,257,9,ActivationType.Silu,torch.bfloat16,torch.float8_e4m3fnuz,torch.float8_e4m3fnuz,QuantType.per_1x128,1,0,asm,asm_1stage,32,_ZN5aiter47fmoe_bf16_blockscaleFp8_g1u1_vs_silu_1tg_32x128E,114.7458,0.0,0.00%,6.91,12331.29
10,16,2048,192,128,8,ActivationType.Silu,torch.bfloat16,torch.bfloat16,torch.bfloat16,QuantType.No,1,0,ck,stage1,32,moe_ck2stages_gemm1_256x32x64x128_1x4_TypeCast_v1_Nswizzle0_Quant0_MulRoutedWeight0_silu_B16_B16_B16,37.5078,0.0,0.00%,8.05,8054.88
10,16,2048,192,128,8,ActivationType.Silu,torch.bfloat16,torch.bfloat16,torch.bfloat16,QuantType.No,1,0,ck,stage2,32,moe_ck2stages_gemm2_256x32x64x64_1x4_TypeCastExpertWeight_v1_Nswizzle0_Quant0_MulRoutedWeight1_B16_B16_B16,24.3077,0.0,0.00%,12.42,12429.02
11,16,2048,192,128,8,ActivationType.Silu,torch.bfloat16,torch.bfloat16,torch.bfloat16,QuantType.No,1,1,ck,stage1,32,moe_ck2stages_gemm1_256x32x64x128_1x4_TypeCastExpertWeight_v1_Nswizzle0_Quant0_MulRoutedWeight1_silu_B16_B16_B16,37.7238,0.0,0.00%,8.01,8008.76
11,16,2048,192,128,8,ActivationType.Silu,torch.bfloat16,torch.bfloat16,torch.bfloat16,QuantType.No,1,1,ck,stage2,32,moe_ck2stages_gemm2_256x32x64x64_1x4_TypeCast_v1_Nswizzle0_Quant0_MulRoutedWeight0_B16_B16_B16,23.7307,0.0,0.00%,12.73,12731.23
12,16,2048,192,128,8,ActivationType.Gelu,torch.bfloat16,torch.bfloat16,torch.bfloat16,QuantType.No,1,0,ck,stage1,32,moe_ck2stages_gemm1_256x32x64x128_1x4_TypeCast_v1_Nswizzle0_Quant0_MulRoutedWeight0_gelu_B16_B16_B16,37.2151,0.0,0.00%,8.11,8118.24
12,16,2048,192,128,8,ActivationType.Gelu,torch.bfloat16,torch.bfloat16,torch.bfloat16,QuantType.No,1,0,ck,stage2,32,moe_ck2stages_gemm2_256x32x64x64_1x4_TypeCastExpertWeight_v1_Nswizzle0_Quant0_MulRoutedWeight1_B16_B16_B16,24.3182,0.0,0.00%,12.42,12423.66
13,16,2048,192,128,8,ActivationType.Gelu,torch.bfloat16,torch.bfloat16,torch.bfloat16,QuantType.No,1,1,ck,stage1,32,moe_ck2stages_gemm1_256x32x64x128_1x4_TypeCastExpertWeight_v1_Nswizzle0_Quant0_MulRoutedWeight1_gelu_B16_B16_B16,37.4938,0.0,0.00%,8.05,8057.89
13,16,2048,192,128,8,ActivationType.Gelu,torch.bfloat16,torch.bfloat16,torch.bfloat16,QuantType.No,1,1,ck,stage2,32,moe_ck2stages_gemm2_256x32x64x64_1x4_TypeCast_v1_Nswizzle0_Quant0_MulRoutedWeight0_B16_B16_B16,24.0152,0.0,0.00%,12.57,12580.41
14,16,4096,192,128,8,ActivationType.Silu,torch.bfloat16,torch.bfloat16,torch.bfloat16,QuantType.No,1,0,ck,stage1,32,moe_ck2stages_gemm1_256x32x64x128_1x4_TypeCast_v1_Nswizzle0_Quant0_MulRoutedWeight0_silu_B16_B16_B16,68.3851,0.0,0.00%,8.83,8835.87
14,16,4096,192,128,8,ActivationType.Silu,torch.bfloat16,torch.bfloat16,torch.bfloat16,QuantType.No,1,0,ck,stage2,32,moe_ck2stages_gemm2_256x32x64x64_1x4_TypeCastExpertWeight_v1_Nswizzle0_Quant0_MulRoutedWeight1_B16_B16_B16,43.021,0.0,0.06%,14.04,14045.28
15,16,4096,192,128,8,ActivationType.Silu,torch.bfloat16,torch.bfloat16,torch.bfloat16,QuantType.No,1,1,ck,stage1,32,moe_ck2stages_gemm1_256x32x64x128_1x4_TypeCastExpertWeight_v1_Nswizzle0_Quant0_MulRoutedWeight1_silu_B16_B16_B16,68.5664,0.0,0.00%,8.81,8812.51
15,16,4096,192,128,8,ActivationType.Silu,torch.bfloat16,torch.bfloat16,torch.bfloat16,QuantType.No,1,1,ck,stage2,32,moe_ck2stages_gemm2_256x32x64x64_1x4_TypeCast_v1_Nswizzle0_Quant0_MulRoutedWeight0_B16_B16_B16,42.0674,0.0,0.00%,14.36,14363.66
16,16,4096,192,128,8,ActivationType.Gelu,torch.bfloat16,torch.bfloat16,torch.bfloat16,QuantType.No,1,0,ck,stage1,32,moe_ck2stages_gemm1_256x32x64x128_1x4_TypeCast_v1_Nswizzle0_Quant0_MulRoutedWeight0_gelu_B16_B16_B16,68.26,0.0,0.00%,8.85,8852.06
16,16,4096,192,128,8,ActivationType.Gelu,torch.bfloat16,torch.bfloat16,torch.bfloat16,QuantType.No,1,0,ck,stage2,32,moe_ck2stages_gemm2_256x32x64x64_1x4_TypeCastExpertWeight_v1_Nswizzle0_Quant0_MulRoutedWeight1_B16_B16_B16,43.0789,0.0,0.11%,14.02,14026.4
17,16,4096,192,128,8,ActivationType.Gelu,torch.bfloat16,torch.bfloat16,torch.bfloat16,QuantType.No,1,1,ck,stage1,32,moe_ck2stages_gemm1_256x32x64x128_1x4_TypeCastExpertWeight_v1_Nswizzle0_Quant0_MulRoutedWeight1_gelu_B16_B16_B16,68.4295,0.0,0.00%,8.83,8830.14
17,16,4096,192,128,8,ActivationType.Gelu,torch.bfloat16,torch.bfloat16,torch.bfloat16,QuantType.No,1,1,ck,stage2,32,moe_ck2stages_gemm2_256x32x64x64_1x4_TypeCast_v1_Nswizzle0_Quant0_MulRoutedWeight0_B16_B16_B16,41.8242,0.0,0.00%,14.44,14447.18
18,16,4096,384,128,8,ActivationType.Gelu,torch.bfloat16,torch.bfloat16,torch.bfloat16,QuantType.No,1,0,ck,stage1,32,moe_ck2stages_gemm1_256x32x64x128_1x4_TypeCast_v1_Nswizzle0_Quant0_MulRoutedWeight0_gelu_B16_B16_B16,127.9362,0.0,0.00%,9.44,9443.94
18,16,4096,384,128,8,ActivationType.Gelu,torch.bfloat16,torch.bfloat16,torch.bfloat16,QuantType.No,1,0,ck,stage2,32,moe_ck2stages_gemm2_256x32x64x128_1x4_TypeCastExpertWeight_v1_Nswizzle0_Quant0_MulRoutedWeight1_B16_B16_B16,71.8811,0.0,0.50%,16.8,16808.61
19,16,4096,384,128,8,ActivationType.Gelu,torch.bfloat16,torch.bfloat16,torch.bfloat16,QuantType.No,1,1,ck,stage1,32,moe_ck2stages_gemm1_256x32x64x128_1x4_TypeCastExpertWeight_v1_Nswizzle0_Quant0_MulRoutedWeight1_gelu_B16_B16_B16,133.5561,0.0,0.00%,9.04,9046.55
19,16,4096,384,128,8,ActivationType.Gelu,torch.bfloat16,torch.bfloat16,torch.bfloat16,QuantType.No,1,1,ck,stage2,32,moe_ck2stages_gemm2_256x32x64x128_1x4_TypeCast_v1_Nswizzle0_Quant0_MulRoutedWeight0_B16_B16_B16,71.8063,0.0,0.00%,16.82,16826.12
20,16,4096,384,128,8,ActivationType.Silu,torch.bfloat16,torch.bfloat16,torch.bfloat16,QuantType.No,1,0,ck,stage1,32,moe_ck2stages_gemm1_256x32x64x128_1x4_TypeCast_v1_Nswizzle0_Quant0_MulRoutedWeight0_silu_B16_B16_B16,128.3618,0.0,0.00%,9.41,9412.63
20,16,4096,384,128,8,ActivationType.Silu,torch.bfloat16,torch.bfloat16,torch.bfloat16,QuantType.No,1,0,ck,stage2,32,moe_ck2stages_gemm2_256x32x64x128_1x4_TypeCastExpertWeight_v1_Nswizzle0_Quant0_MulRoutedWeight1_B16_B16_B16,71.6661,0.0,0.34%,16.86,16859.04
21,16,4096,384,128,8,ActivationType.Silu,torch.bfloat16,torch.bfloat16,torch.bfloat16,QuantType.No,1,1,ck,stage1,32,moe_ck2stages_gemm1_256x32x64x128_1x4_TypeCastExpertWeight_v1_Nswizzle0_Quant0_MulRoutedWeight1_silu_B16_B16_B16,132.9472,0.0,0.00%,9.09,9087.98
21,16,4096,384,128,8,ActivationType.Silu,torch.bfloat16,torch.bfloat16,torch.bfloat16,QuantType.No,1,1,ck,stage2,32,moe_ck2stages_gemm2_256x32x64x128_1x4_TypeCast_v1_Nswizzle0_Quant0_MulRoutedWeight0_B16_B16_B16,71.8737,0.0,0.00%,16.81,16810.35
22,16,4096,384,128,8,ActivationType.Silu,torch.bfloat16,torch.float8_e4m3fnuz,torch.float8_e4m3fnuz,QuantType.per_Tensor,1,0,ck,stage1,16,moe_ck2stages_gemm1_256x16x128x256_1x4_MulABScale_v1_Nswizzle0_Quant1_MulRoutedWeight0_silu_F8_F8_B16,67.43,33.92877777777774,0.00%,17.91,8960.05
22,16,4096,384,128,8,ActivationType.Silu,torch.bfloat16,torch.float8_e4m3fnuz,torch.float8_e4m3fnuz,QuantType.per_Tensor,1,0,ck,stage2,16,moe_ck2stages_gemm2_128x16x128x128_1x2_MulABScaleExpertWeight_v1_Nswizzle0_Quant1_MulRoutedWeight1_F8_F8_B16,42.7522,33.92877777777774,0.37%,28.25,14132.05
23,16,4096,384,128,8,ActivationType.Silu,torch.bfloat16,torch.float8_e4m3fnuz,torch.float8_e4m3fnuz,QuantType.per_Tensor,1,1,ck,stage1,16,moe_ck2stages_gemm1_256x16x128x256_1x4_MulABScale_v1_Nswizzle0_Quant1_MulRoutedWeight1_silu_F8_F8_B16,67.2327,34.7302222222222,0.00%,17.97,8986.35
23,16,4096,384,128,8,ActivationType.Silu,torch.bfloat16,torch.float8_e4m3fnuz,torch.float8_e4m3fnuz,QuantType.per_Tensor,1,1,ck,stage2,16,moe_ck2stages_gemm2_128x16x128x128_1x2_MulABScaleExpertWeight_v1_Nswizzle0_Quant1_MulRoutedWeight0_F8_F8_B16,42.6345,34.7302222222222,0.00%,28.33,14171.07
24,16,4096,384,128,8,ActivationType.Silu,torch.bfloat16,torch.float8_e4m3fnuz,torch.float8_e4m3fnuz,QuantType.per_Token,1,0,asm,asm_1stage,32,_ZN5aiter45fmoe_bf16_pertokenFp8_g1u1_vs_silu_1tg_32x192E,112.4304,0.0,0.00%,10.74,5373.78
25,16,4096,384,128,8,ActivationType.Silu,torch.bfloat16,torch.float8_e4m3fnuz,torch.float8_e4m3fnuz,QuantType.per_Token,1,1,asm,asm_1stage,32,_ZN5aiter50fmoe_bf16_pertokenFp8_g1u1_vs_tkw1_silu_1tg_32x192E,115.0153,0.0,0.00%,10.5,5253.01
26,16,4096,384,128,8,ActivationType.Gelu,torch.bfloat16,torch.float8_e4m3fnuz,torch.float8_e4m3fnuz,QuantType.per_Tensor,1,0,ck,stage1,16,moe_ck2stages_gemm1_256x16x128x256_1x4_MulABScale_v1_Nswizzle0_Quant1_MulRoutedWeight0_gelu_F8_F8_B16,67.3296,33.75077777777775,0.00%,17.94,8973.41
26,16,4096,384,128,8,ActivationType.Gelu,torch.bfloat16,torch.float8_e4m3fnuz,torch.float8_e4m3fnuz,QuantType.per_Tensor,1,0,ck,stage2,16,moe_ck2stages_gemm2_128x16x128x128_1x2_MulABScaleExpertWeight_v1_Nswizzle0_Quant1_MulRoutedWeight1_F8_F8_B16,42.6147,33.75077777777775,0.48%,28.35,14177.65
27,16,4096,384,128,8,ActivationType.Gelu,torch.bfloat16,torch.float8_e4m3fnuz,torch.float8_e4m3fnuz,QuantType.per_Tensor,1,1,ck,stage1,16,moe_ck2stages_gemm1_256x16x128x256_1x4_MulABScale_v1_Nswizzle0_Quant1_MulRoutedWeight1_gelu_F8_F8_B16,67.2416,32.958333333333336,0.00%,17.96,8985.16
27,16,4096,384,128,8,ActivationType.Gelu,torch.bfloat16,torch.float8_e4m3fnuz,torch.float8_e4m3fnuz,QuantType.per_Tensor,1,1,ck,stage2,16,moe_ck2stages_gemm2_128x16x128x128_1x2_MulABScaleExpertWeight_v1_Nswizzle0_Quant1_MulRoutedWeight0_F8_F8_B16,42.5711,32.958333333333336,0.00%,28.38,14192.17
28,16,4096,384,128,8,ActivationType.Gelu,torch.bfloat16,torch.float8_e4m3fnuz,torch.float8_e4m3fnuz,QuantType.per_Token,1,0,asm,asm_1stage,32,_ZN5aiter45fmoe_bf16_pertokenFp8_g1u1_vs_gelu_1tg_32x192E,112.6642,0.0,0.00%,10.72,5362.63
29,16,4096,384,128,8,ActivationType.Gelu,torch.bfloat16,torch.float8_e4m3fnuz,torch.float8_e4m3fnuz,QuantType.per_Token,1,1,asm,asm_1stage,32,_ZN5aiter50fmoe_bf16_pertokenFp8_g1u1_vs_tkw1_gelu_1tg_32x192E,115.0268,0.0,0.00%,10.5,5252.48
30,16,4096,384,128,8,ActivationType.Silu,torch.bfloat16,torch.float8_e4m3fnuz,torch.float8_e4m3fnuz,QuantType.per_1x128,1,0,asm,asm_1stage,32,_ZN5aiter47fmoe_bf16_blockscaleFp8_g1u1_vs_silu_1tg_32x128E,117.3106,0.0,0.00%,10.3,5150.23
31,16,4096,384,128,8,ActivationType.Gelu,torch.bfloat16,torch.float8_e4m3fnuz,torch.float8_e4m3fnuz,QuantType.per_1x128,1,0,asm,asm_1stage,32,_ZN5aiter47fmoe_bf16_blockscaleFp8_g1u1_vs_gelu_1tg_32x128E,117.9595,0.0,0.09%,10.24,5121.9
32,16,4096,384,128,8,ActivationType.Silu,torch.bfloat16,torch.float8_e4m3fnuz,torch.float8_e4m3fnuz,QuantType.per_1x128,1,1,ck,stage1,16,moe_ck2stages_gemm1_128x16x128x128_1x2_MulABScaleExpertWeightA8W8blkscale_v1_Nswizzle0_Quant4_MulRoutedWeight1_silu_F8_F8_B16,72.6023,27.868333333333325,0.01%,16.64,8321.73
32,16,4096,384,128,8,ActivationType.Silu,torch.bfloat16,torch.float8_e4m3fnuz,torch.float8_e4m3fnuz,QuantType.per_1x128,1,1,ck,stage2,16,moe_ck2stages_gemm2_128x16x128x128_1x2_MulABScaleExpertWeightA8W8blkscale_v1_Nswizzle0_Quant4_MulRoutedWeight0_F8_F8_B16,42.3167,27.868333333333325,16.70%,28.55,14277.49
33,16,4096,384,128,8,ActivationType.Gelu,torch.bfloat16,torch.float8_e4m3fnuz,torch.float8_e4m3fnuz,QuantType.per_1x128,1,1,ck,stage1,16,moe_ck2stages_gemm1_128x16x128x128_1x2_MulABScaleExpertWeightA8W8blkscale_v1_Nswizzle0_Quant4_MulRoutedWeight1_gelu_F8_F8_B16,72.1515,27.624333333333272,0.02%,16.74,8373.72
33,16,4096,384,128,8,ActivationType.Gelu,torch.bfloat16,torch.float8_e4m3fnuz,torch.float8_e4m3fnuz,QuantType.per_1x128,1,1,ck,stage2,16,moe_ck2stages_gemm2_128x16x128x128_1x2_MulABScaleExpertWeightA8W8blkscale_v1_Nswizzle0_Quant4_MulRoutedWeight0_F8_F8_B16,41.4639,27.624333333333272,16.61%,29.13,14571.14
34,16,5120,1024,128,1,ActivationType.Silu,torch.bfloat16,torch.float8_e4m3fnuz,torch.float8_e4m3fnuz,QuantType.per_Token,1,1,asm,asm_1stage,32,_ZN5aiter50fmoe_bf16_pertokenFp8_g1u1_vs_tkw1_silu_1tg_32x128E,93.6399,0.0,0.02%,5.38,21502.71
35,16,7168,256,256,8,ActivationType.Gelu,torch.bfloat16,torch.bfloat16,torch.bfloat16,QuantType.No,1,0,ck,stage1,32,moe_ck2stages_gemm1_256x32x64x128_1x4_TypeCast_v1_Nswizzle0_Quant0_MulRoutedWeight0_gelu_B16_B16_B16,195.2231,0.0,0.00%,7.22,14440.05
35,16,7168,256,256,8,ActivationType.Gelu,torch.bfloat16,torch.bfloat16,torch.bfloat16,QuantType.No,1,0,ck,stage2,32,moe_ck2stages_gemm2_256x32x64x128_1x4_TypeCastExpertWeight_v1_Nswizzle0_Quant0_MulRoutedWeight1_B16_B16_B16,105.3374,0.0,1.68%,13.38,26761.92
36,16,7168,256,256,8,ActivationType.Gelu,torch.bfloat16,torch.bfloat16,torch.bfloat16,QuantType.No,1,1,ck,stage1,32,moe_ck2stages_gemm1_256x32x64x128_1x4_TypeCastExpertWeight_v1_Nswizzle0_Quant0_MulRoutedWeight1_gelu_B16_B16_B16,196.3577,0.0,0.00%,7.18,14356.61
36,16,7168,256,256,8,ActivationType.Gelu,torch.bfloat16,torch.bfloat16,torch.bfloat16,QuantType.No,1,1,ck,stage2,32,moe_ck2stages_gemm2_256x32x64x128_1x4_TypeCast_v1_Nswizzle0_Quant0_MulRoutedWeight0_B16_B16_B16,105.2818,0.0,0.00%,13.39,26776.05
37,16,7168,256,256,8,ActivationType.Gelu,torch.bfloat16,torch.float8_e4m3fnuz,torch.float8_e4m3fnuz,QuantType.per_Tensor,1,0,ck,stage1,16,moe_ck2stages_gemm1_256x16x128x256_1x4_MulABScale_v1_Nswizzle0_Quant1_MulRoutedWeight0_gelu_F8_F8_B16,97.0222,29.971666666666653,0.00%,14.53,14528.95
37,16,7168,256,256,8,ActivationType.Gelu,torch.bfloat16,torch.float8_e4m3fnuz,torch.float8_e4m3fnuz,QuantType.per_Tensor,1,0,ck,stage2,16,moe_ck2stages_gemm2_256x16x128x256_1x4_MulABScaleExpertWeight_v1_Nswizzle0_Quant1_MulRoutedWeight1_F8_F8_B16,58.923,29.971666666666653,1.74%,23.92,23923.26
38,16,7168,256,256,8,ActivationType.Gelu,torch.bfloat16,torch.float8_e4m3fnuz,torch.float8_e4m3fnuz,QuantType.per_Tensor,1,1,ck,stage1,16,moe_ck2stages_gemm1_256x16x128x256_1x4_MulABScale_v1_Nswizzle0_Quant1_MulRoutedWeight1_gelu_F8_F8_B16,97.2841,29.74888888888889,0.00%,14.49,14489.83
38,16,7168,256,256,8,ActivationType.Gelu,torch.bfloat16,torch.float8_e4m3fnuz,torch.float8_e4m3fnuz,QuantType.per_Tensor,1,1,ck,stage2,16,moe_ck2stages_gemm2_256x16x128x256_1x4_MulABScaleExpertWeight_v1_Nswizzle0_Quant1_MulRoutedWeight0_F8_F8_B16,58.7294,29.74888888888889,0.00%,24.0,24002.12
39,16,7168,256,256,8,ActivationType.Gelu,torch.bfloat16,torch.float8_e4m3fnuz,torch.float8_e4m3fnuz,QuantType.per_Token,1,0,asm,asm_1stage,32,_ZN5aiter45fmoe_bf16_pertokenFp8_g1u1_vs_gelu_1tg_32x128E,162.1654,0.0,0.00%,8.69,8692.55
40,16,7168,256,256,8,ActivationType.Gelu,torch.bfloat16,torch.float8_e4m3fnuz,torch.float8_e4m3fnuz,QuantType.per_Token,1,1,asm,asm_1stage,32,_ZN5aiter50fmoe_bf16_pertokenFp8_g1u1_vs_tkw1_gelu_1tg_32x128E,167.4095,0.0,0.00%,8.42,8420.25
41,16,7168,256,256,8,ActivationType.Silu,torch.bfloat16,torch.bfloat16,torch.bfloat16,QuantType.No,1,0,ck,stage1,32,moe_ck2stages_gemm1_256x32x64x128_1x4_TypeCast_v1_Nswizzle0_Quant0_MulRoutedWeight0_silu_B16_B16_B16,197.3954,0.0,0.00%,7.14,14281.14
41,16,7168,256,256,8,ActivationType.Silu,torch.bfloat16,torch.bfloat16,torch.bfloat16,QuantType.No,1,0,ck,stage2,32,moe_ck2stages_gemm2_256x32x64x128_1x4_TypeCastExpertWeight_v1_Nswizzle0_Quant0_MulRoutedWeight1_B16_B16_B16,105.0992,0.0,1.40%,13.41,26822.57
42,16,7168,256,256,8,ActivationType.Silu,torch.bfloat16,torch.bfloat16,torch.bfloat16,QuantType.No,1,1,ck,stage1,32,moe_ck2stages_gemm1_256x32x64x128_1x4_TypeCastExpertWeight_v1_Nswizzle0_Quant0_MulRoutedWeight1_silu_B16_B16_B16,195.5189,0.0,0.00%,7.21,14418.2
42,16,7168,256,256,8,ActivationType.Silu,torch.bfloat16,torch.bfloat16,torch.bfloat16,QuantType.No,1,1,ck,stage2,32,moe_ck2stages_gemm2_256x32x64x128_1x4_TypeCast_v1_Nswizzle0_Quant0_MulRoutedWeight0_B16_B16_B16,105.2941,0.0,0.00%,13.38,26772.92
43,16,7168,256,256,8,ActivationType.Silu,torch.bfloat16,torch.float8_e4m3fnuz,torch.float8_e4m3fnuz,QuantType.per_Tensor,1,0,ck,stage1,16,moe_ck2stages_gemm1_256x16x128x256_1x4_MulABScale_v1_Nswizzle0_Quant1_MulRoutedWeight0_silu_F8_F8_B16,97.5577,30.274777777777757,0.00%,14.45,14449.19
43,16,7168,256,256,8,ActivationType.Silu,torch.bfloat16,torch.float8_e4m3fnuz,torch.float8_e4m3fnuz,QuantType.per_Tensor,1,0,ck,stage2,16,moe_ck2stages_gemm2_256x16x128x256_1x4_MulABScaleExpertWeight_v1_Nswizzle0_Quant1_MulRoutedWeight1_F8_F8_B16,58.2884,30.274777777777757,1.38%,24.18,24183.72
44,16,7168,256,256,8,ActivationType.Silu,torch.bfloat16,torch.float8_e4m3fnuz,torch.float8_e4m3fnuz,QuantType.per_Tensor,1,1,ck,stage1,16,moe_ck2stages_gemm1_256x16x128x256_1x4_MulABScale_v1_Nswizzle0_Quant1_MulRoutedWeight1_silu_F8_F8_B16,97.4882,30.39433333333339,0.00%,14.46,14459.5
44,16,7168,256,256,8,ActivationType.Silu,torch.bfloat16,torch.float8_e4m3fnuz,torch.float8_e4m3fnuz,QuantType.per_Tensor,1,1,ck,stage2,16,moe_ck2stages_gemm2_256x16x128x256_1x4_MulABScaleExpertWeight_v1_Nswizzle0_Quant1_MulRoutedWeight0_F8_F8_B16,57.9521,30.39433333333339,0.00%,24.32,24324.06
45,16,7168,256,256,8,ActivationType.Silu,torch.bfloat16,torch.float8_e4m3fnuz,torch.float8_e4m3fnuz,QuantType.per_Token,1,0,asm,asm_1stage,32,_ZN5aiter45fmoe_bf16_pertokenFp8_g1u1_vs_silu_1tg_32x128E,166.8267,0.0,0.00%,8.45,8449.67
46,16,7168,256,256,8,ActivationType.Silu,torch.bfloat16,torch.float8_e4m3fnuz,torch.float8_e4m3fnuz,QuantType.per_Token,1,1,asm,asm_1stage,32,_ZN5aiter50fmoe_bf16_pertokenFp8_g1u1_vs_tkw1_silu_1tg_32x128E,166.2902,0.0,0.00%,8.47,8476.93
47,16,7168,256,256,8,ActivationType.Gelu,torch.bfloat16,torch.float8_e4m3fnuz,torch.float8_e4m3fnuz,QuantType.per_1x128,1,0,asm,asm_1stage,32,_ZN5aiter47fmoe_bf16_blockscaleFp8_g1u1_vs_gelu_1tg_32x128E,164.563,0.0,1.93%,8.56,8565.9
48,16,7168,256,256,8,ActivationType.Gelu,torch.bfloat16,torch.float8_e4m3fnuz,torch.float8_e4m3fnuz,QuantType.per_1x128,1,1,ck,stage1,16,moe_ck2stages_gemm1_256x16x128x256_1x4_MulABScaleExpertWeightA8W8blkscale_v1_Nswizzle0_Quant4_MulRoutedWeight1_gelu_F8_F8_B16,101.3965,27.463888888888945,0.04%,13.9,13902.16
48,16,7168,256,256,8,ActivationType.Gelu,torch.bfloat16,torch.float8_e4m3fnuz,torch.float8_e4m3fnuz,QuantType.per_1x128,1,1,ck,stage2,16,moe_ck2stages_gemm2_256x16x128x256_1x4_MulABScaleExpertWeightA8W8blkscale_v1_Nswizzle0_Quant4_MulRoutedWeight0_F8_F8_B16,58.3523,27.463888888888945,16.57%,24.15,24157.23
49,16,7168,256,256,8,ActivationType.Silu,torch.bfloat16,torch.float8_e4m3fnuz,torch.float8_e4m3fnuz,QuantType.per_1x128,1,0,asm,asm_1stage,32,_ZN5aiter47fmoe_bf16_blockscaleFp8_g1u1_vs_silu_1tg_32x128E,159.7283,0.0,0.00%,8.82,8825.18
50,16,7168,256,256,8,ActivationType.Silu,torch.bfloat16,torch.float8_e4m3fnuz,torch.float8_e4m3fnuz,QuantType.per_1x128,1,1,ck,stage1,16,moe_ck2stages_gemm1_256x16x128x256_1x4_MulABScaleExpertWeightA8W8blkscale_v1_Nswizzle0_Quant4_MulRoutedWeight1_silu_F8_F8_B16,101.2092,27.91877777777785,0.01%,13.92,13927.89
50,16,7168,256,256,8,ActivationType.Silu,torch.bfloat16,torch.float8_e4m3fnuz,torch.float8_e4m3fnuz,QuantType.per_1x128,1,1,ck,stage2,16,moe_ck2stages_gemm2_256x16x128x256_1x4_MulABScaleExpertWeightA8W8blkscale_v1_Nswizzle0_Quant4_MulRoutedWeight0_F8_F8_B16,58.3291,27.91877777777785,16.56%,24.16,24166.84
51,16,7168,256,257,9,ActivationType.Silu,torch.bfloat16,torch.float8_e4m3fnuz,torch.float8_e4m3fnuz,QuantType.per_Token,1,0,asm,asm_1stage,32,_ZN5aiter45fmoe_bf16_pertokenFp8_g1u1_vs_silu_1tg_32x256E,178.3177,0.0,0.00%,8.89,7936.03
52,16,7168,256,257,9,ActivationType.Silu,torch.bfloat16,torch.float8_e4m3fnuz,torch.float8_e4m3fnuz,QuantType.per_1x128,1,0,asm,asm_1stage,32,_ZN5aiter47fmoe_bf16_blockscaleFp8_g1u1_vs_silu_1tg_32x128E,180.0796,0.0,0.00%,8.8,7858.39
53,16,7168,512,256,8,ActivationType.Gelu,torch.bfloat16,torch.bfloat16,torch.bfloat16,QuantType.No,1,0,ck,stage1,32,moe_ck2stages_gemm1_256x32x64x128_1x4_TypeCast_v1_Nswizzle0_Quant0_MulRoutedWeight0_gelu_B16_B16_B16,391.937,0.0,0.00%,7.19,14383.95
53,16,7168,512,256,8,ActivationType.Gelu,torch.bfloat16,torch.bfloat16,torch.bfloat16,QuantType.No,1,0,ck,stage2,32,moe_ck2stages_gemm2_256x32x64x64_1x4_TypeCastExpertWeight_v1_Nswizzle0_Quant0_MulRoutedWeight1_B16_B16_B16,213.5814,0.0,3.29%,13.2,26395.57
54,16,7168,512,256,8,ActivationType.Gelu,torch.bfloat16,torch.bfloat16,torch.bfloat16,QuantType.No,1,1,ck,stage1,32,moe_ck2stages_gemm1_256x32x64x64_1x4_TypeCastExpertWeight_v1_Nswizzle0_Quant0_MulRoutedWeight1_gelu_B16_B16_B16,394.2708,0.0,0.00%,7.15,14298.81
54,16,7168,512,256,8,ActivationType.Gelu,torch.bfloat16,torch.bfloat16,torch.bfloat16,QuantType.No,1,1,ck,stage2,32,moe_ck2stages_gemm2_256x32x64x128_1x4_TypeCast_v1_Nswizzle0_Quant0_MulRoutedWeight0_B16_B16_B16,208.1048,0.0,0.00%,13.54,27090.21
55,16,7168,512,256,8,ActivationType.Gelu,torch.bfloat16,torch.float8_e4m3fnuz,torch.float8_e4m3fnuz,QuantType.per_Tensor,1,0,ck,stage1,16,moe_ck2stages_gemm1_128x16x64x128_1x2_MulABScale_v1_Nswizzle0_Quant1_MulRoutedWeight0_gelu_F8_F8_B16,198.7739,37.80133333333335,0.00%,14.18,14181.52
55,16,7168,512,256,8,ActivationType.Gelu,torch.bfloat16,torch.float8_e4m3fnuz,torch.float8_e4m3fnuz,QuantType.per_Tensor,1,0,ck,stage2,16,moe_ck2stages_gemm2_256x16x128x256_1x4_MulABScaleExpertWeight_v1_Nswizzle0_Quant1_MulRoutedWeight1_F8_F8_B16,107.3711,37.80133333333335,3.22%,26.25,26253.96
56,16,7168,512,256,8,ActivationType.Gelu,torch.bfloat16,torch.float8_e4m3fnuz,torch.float8_e4m3fnuz,QuantType.per_Tensor,1,1,ck,stage1,16,moe_ck2stages_gemm1_256x16x128x256_1x4_MulABScale_v1_Nswizzle0_Quant1_MulRoutedWeight1_gelu_F8_F8_B16,198.6554,38.189222222222206,0.00%,14.19,14189.98
56,16,7168,512,256,8,ActivationType.Gelu,torch.bfloat16,torch.float8_e4m3fnuz,torch.float8_e4m3fnuz,QuantType.per_Tensor,1,1,ck,stage2,16,moe_ck2stages_gemm2_256x16x128x256_1x4_MulABScaleExpertWeight_v1_Nswizzle0_Quant1_MulRoutedWeight0_F8_F8_B16,108.895,38.189222222222206,0.00%,25.88,25886.55
57,16,7168,512,256,8,ActivationType.Gelu,torch.bfloat16,torch.float8_e4m3fnuz,torch.float8_e4m3fnuz,QuantType.per_Token,1,0,asm,asm_1stage,32,_ZN5aiter48fmoe_bf16_pertokenFp8_g1u1_vs_gelu_1tg_ps_32x512E,323.9433,0.0,0.00%,8.7,8701.88
58,16,7168,512,256,8,ActivationType.Gelu,torch.bfloat16,torch.float8_e4m3fnuz,torch.float8_e4m3fnuz,QuantType.per_Token,1,1,asm,asm_1stage,32,_ZN5aiter50fmoe_bf16_pertokenFp8_g1u1_vs_tkw1_gelu_1tg_32x512E,323.8492,0.0,0.00%,8.7,8704.41
59,16,7168,512,256,8,ActivationType.Silu,torch.bfloat16,torch.bfloat16,torch.bfloat16,QuantType.No,1,1,ck,stage1,32,moe_ck2stages_gemm1_256x32x64x128_1x4_TypeCastExpertWeight_v1_Nswizzle0_Quant0_MulRoutedWeight1_silu_B16_B16_B16,394.1746,0.0,0.00%,7.15,14302.3
59,16,7168,512,256,8,ActivationType.Silu,torch.bfloat16,torch.bfloat16,torch.bfloat16,QuantType.No,1,1,ck,stage2,32,moe_ck2stages_gemm2_256x32x64x64_1x4_TypeCast_v1_Nswizzle0_Quant0_MulRoutedWeight0_B16_B16_B16,210.9855,0.0,0.00%,13.36,26720.34
60,16,7168,512,256,8,ActivationType.Silu,torch.bfloat16,torch.float8_e4m3fnuz,torch.float8_e4m3fnuz,QuantType.per_Tensor,1,0,ck,stage1,16,moe_ck2stages_gemm1_256x16x128x256_1x4_MulABScale_v1_Nswizzle0_Quant1_MulRoutedWeight0_silu_F8_F8_B16,198.6065,36.89722222222222,0.00%,14.19,14193.47
60,16,7168,512,256,8,ActivationType.Silu,torch.bfloat16,torch.float8_e4m3fnuz,torch.float8_e4m3fnuz,QuantType.per_Tensor,1,0,ck,stage2,16,moe_ck2stages_gemm2_256x16x128x256_1x4_MulABScaleExpertWeight_v1_Nswizzle0_Quant1_MulRoutedWeight1_F8_F8_B16,106.9685,36.89722222222222,2.72%,26.35,26352.77
61,16,7168,512,256,8,ActivationType.Silu,torch.bfloat16,torch.float8_e4m3fnuz,torch.float8_e4m3fnuz,QuantType.per_Tensor,1,1,ck,stage1,16,moe_ck2stages_gemm1_256x16x128x256_1x4_MulABScale_v1_Nswizzle0_Quant1_MulRoutedWeight1_silu_F8_F8_B16,198.1298,37.28055555555556,0.00%,14.23,14227.62
61,16,7168,512,256,8,ActivationType.Silu,torch.bfloat16,torch.float8_e4m3fnuz,torch.float8_e4m3fnuz,QuantType.per_Tensor,1,1,ck,stage2,16,moe_ck2stages_gemm2_256x16x128x256_1x4_MulABScaleExpertWeight_v1_Nswizzle0_Quant1_MulRoutedWeight0_F8_F8_B16,107.4317,37.28055555555556,0.00%,26.24,26239.15
62,16,7168,512,256,8,ActivationType.Silu,torch.bfloat16,torch.float8_e4m3fnuz,torch.float8_e4m3fnuz,QuantType.per_Token,1,0,asm,asm_1stage,32,_ZN5aiter45fmoe_bf16_pertokenFp8_g1u1_vs_silu_1tg_32x256E,325.7172,0.0,0.00%,8.65,8654.49
63,16,7168,512,256,8,ActivationType.Silu,torch.bfloat16,torch.float8_e4m3fnuz,torch.float8_e4m3fnuz,QuantType.per_Token,1,1,asm,asm_1stage,32,_ZN5aiter53fmoe_bf16_pertokenFp8_g1u1_vs_tkw1_silu_1tg_ps_32x512E,325.7908,0.0,0.00%,8.65,8652.54
64,16,7168,512,256,8,ActivationType.Silu,torch.bfloat16,torch.bfloat16,torch.bfloat16,QuantType.No,1,0,ck,stage1,32,moe_ck2stages_gemm1_256x32x64x128_1x4_TypeCast_v1_Nswizzle0_Quant0_MulRoutedWeight0_silu_B16_B16_B16,393.8771,0.0,0.00%,7.16,14313.1
64,16,7168,512,256,8,ActivationType.Silu,torch.bfloat16,torch.bfloat16,torch.bfloat16,QuantType.No,1,0,ck,stage2,32,moe_ck2stages_gemm2_256x32x64x64_1x4_TypeCastExpertWeight_v1_Nswizzle0_Quant0_MulRoutedWeight1_B16_B16_B16,212.7974,0.0,2.77%,13.25,26492.82
65,16,7168,512,256,8,ActivationType.Gelu,torch.bfloat16,torch.float8_e4m3fnuz,torch.float8_e4m3fnuz,QuantType.per_1x128,1,0,asm,stage1,16,_ZN5aiter59fmoe_stage1_bf16_pertokenFp8_blockscale_g1u1_16x512_2tg_pf2E,194.3748,28.310222222222187,14.65%,14.5,14502.48
65,16,7168,512,256,8,ActivationType.Gelu,torch.bfloat16,torch.float8_e4m3fnuz,torch.float8_e4m3fnuz,QuantType.per_1x128,1,0,ck,stage2,16,moe_ck2stages_gemm2_256x16x128x256_1x4_MulABScaleExpertWeightA8W8blkscale_v1_Nswizzle0_Quant4_MulRoutedWeight1_F8_F8_B16,102.6166,28.310222222222187,15.47%,27.47,27470.37
66,16,7168,512,256,8,ActivationType.Silu,torch.bfloat16,torch.float8_e4m3fnuz,torch.float8_e4m3fnuz,QuantType.per_1x128,1,0,asm,asm_1stage,32,_ZN5aiter49fmoe_bf16_blockscaleFp8_g1u1_novs_silu_1tg_32x256E,328.4431,0.0,0.00%,8.58,8582.66
67,16,7168,512,256,8,ActivationType.Gelu,torch.bfloat16,torch.float8_e4m3fnuz,torch.float8_e4m3fnuz,QuantType.per_1x128,1,1,ck,stage1,16,moe_ck2stages_gemm1_256x16x128x256_1x4_MulABScaleExpertWeightA8W8blkscale_v1_Nswizzle0_Quant4_MulRoutedWeight1_gelu_F8_F8_B16,195.5374,28.21622222222216,0.02%,14.41,14416.25
67,16,7168,512,256,8,ActivationType.Gelu,torch.bfloat16,torch.float8_e4m3fnuz,torch.float8_e4m3fnuz,QuantType.per_1x128,1,1,ck,stage2,16,moe_ck2stages_gemm2_256x16x128x256_1x4_MulABScaleExpertWeightA8W8blkscale_v1_Nswizzle0_Quant4_MulRoutedWeight0_F8_F8_B16,107.024,28.21622222222216,16.63%,26.34,26339.1
68,16,7168,512,256,8,ActivationType.Silu,torch.bfloat16,torch.float8_e4m3fnuz,torch.float8_e4m3fnuz,QuantType.per_1x128,1,1,ck,stage1,16,moe_ck2stages_gemm1_256x16x128x256_1x4_MulABScaleExpertWeightA8W8blkscale_v1_Nswizzle0_Quant4_MulRoutedWeight1_silu_F8_F8_B16,195.9822,27.954111111111096,0.00%,14.38,14383.53
68,16,7168,512,256,8,ActivationType.Silu,torch.bfloat16,torch.float8_e4m3fnuz,torch.float8_e4m3fnuz,QuantType.per_1x128,1,1,ck,stage2,16,moe_ck2stages_gemm2_256x16x128x256_1x4_MulABScaleExpertWeightA8W8blkscale_v1_Nswizzle0_Quant4_MulRoutedWeight0_F8_F8_B16,106.3682,27.954111111111096,16.83%,26.5,26501.5
69,16,7168,2048,33,10,ActivationType.Silu,torch.bfloat16,torch.float8_e4m3fnuz,torch.float8_e4m3fnuz,QuantType.per_1x128,1,0,asm,asm_1stage,32,_ZN5aiter47fmoe_bf16_blockscaleFp8_g1u1_vs_silu_1tg_32x128E,416.331,0.0,0.00%,33.85,3491.62
70,16,7168,2048,33,10,ActivationType.Silu,torch.bfloat16,torch.float8_e4m3fnuz,torch.float8_e4m3fnuz,QuantType.per_Token,1,0,asm,asm_1stage,32,_ZN5aiter48fmoe_bf16_pertokenFp8_g1u1_vs_silu_1tg_ps_32x512E,394.6449,0.0,0.00%,35.71,3683.49
71,32,2048,192,128,8,ActivationType.Silu,torch.bfloat16,torch.bfloat16,torch.bfloat16,QuantType.No,1,0,ck,stage1,32,moe_ck2stages_gemm1_256x32x64x64_1x4_TypeCast_v1_Nswizzle0_Quant0_MulRoutedWeight0_silu_B16_B16_B16,49.0513,0.0,0.00%,12.31,6161.96
71,32,2048,192,128,8,ActivationType.Silu,torch.bfloat16,torch.bfloat16,torch.bfloat16,QuantType.No,1,0,ck,stage2,32,moe_ck2stages_gemm2_256x32x64x64_1x4_TypeCastExpertWeight_v1_Nswizzle0_Quant0_MulRoutedWeight1_B16_B16_B16,32.8944,0.0,0.00%,18.36,9188.56
72,32,2048,192,128,8,ActivationType.Silu,torch.bfloat16,torch.bfloat16,torch.bfloat16,QuantType.No,1,1,ck,stage1,32,moe_ck2stages_gemm1_256x32x64x64_1x4_TypeCastExpertWeight_v1_Nswizzle0_Quant0_MulRoutedWeight1_silu_B16_B16_B16,49.4104,0.0,0.00%,12.22,6117.17
72,32,2048,192,128,8,ActivationType.Silu,torch.bfloat16,torch.bfloat16,torch.bfloat16,QuantType.No,1,1,ck,stage2,32,moe_ck2stages_gemm2_256x32x64x64_1x4_TypeCast_v1_Nswizzle0_Quant0_MulRoutedWeight0_B16_B16_B16,32.3432,0.0,0.00%,18.67,9345.15
73,32,2048,192,128,8,ActivationType.Gelu,torch.bfloat16,torch.bfloat16,torch.bfloat16,QuantType.No,1,0,ck,stage1,32,moe_ck2stages_gemm1_256x32x64x64_1x4_TypeCast_v1_Nswizzle0_Quant0_MulRoutedWeight0_gelu_B16_B16_B16,48.3862,0.0,0.00%,12.48,6246.66
73,32,2048,192,128,8,ActivationType.Gelu,torch.bfloat16,torch.bfloat16,torch.bfloat16,QuantType.No,1,0,ck,stage2,32,moe_ck2stages_gemm2_256x32x64x64_1x4_TypeCastExpertWeight_v1_Nswizzle0_Quant0_MulRoutedWeight1_B16_B16_B16,33.2402,0.0,0.00%,18.17,9092.97
74,32,2048,192,128,8,ActivationType.Gelu,torch.bfloat16,torch.bfloat16,torch.bfloat16,QuantType.No,1,1,ck,stage1,32,moe_ck2stages_gemm1_256x32x64x64_1x4_TypeCastExpertWeight_v1_Nswizzle0_Quant0_MulRoutedWeight1_gelu_B16_B16_B16,48.7945,0.0,0.00%,12.38,6194.39
74,32,2048,192,128,8,ActivationType.Gelu,torch.bfloat16,torch.bfloat16,torch.bfloat16,QuantType.No,1,1,ck,stage2,32,moe_ck2stages_gemm2_256x32x64x64_1x4_TypeCast_v1_Nswizzle0_Quant0_MulRoutedWeight0_B16_B16_B16,32.2356,0.0,0.00%,18.74,9376.34
75,32,4096,192,128,8,ActivationType.Silu,torch.bfloat16,torch.bfloat16,torch.bfloat16,QuantType.No,1,0,ck,stage1,32,moe_ck2stages_gemm1_256x32x64x64_1x4_TypeCast_v1_Nswizzle0_Quant0_MulRoutedWeight0_silu_B16_B16_B16,90.9098,0.0,0.00%,13.29,6649.49
75,32,4096,192,128,8,ActivationType.Silu,torch.bfloat16,torch.bfloat16,torch.bfloat16,QuantType.No,1,0,ck,stage2,32,moe_ck2stages_gemm2_256x32x64x64_1x4_TypeCastExpertWeight_v1_Nswizzle0_Quant0_MulRoutedWeight1_B16_B16_B16,54.4749,0.0,0.07%,22.17,11096.93
76,32,4096,192,128,8,ActivationType.Silu,torch.bfloat16,torch.bfloat16,torch.bfloat16,QuantType.No,1,1,ck,stage1,32,moe_ck2stages_gemm1_256x32x64x64_1x4_TypeCastExpertWeight_v1_Nswizzle0_Quant0_MulRoutedWeight1_silu_B16_B16_B16,91.1703,0.0,0.00%,13.25,6630.49
76,32,4096,192,128,8,ActivationType.Silu,torch.bfloat16,torch.bfloat16,torch.bfloat16,QuantType.No,1,1,ck,stage2,32,moe_ck2stages_gemm2_256x32x64x64_1x4_TypeCast_v1_Nswizzle0_Quant0_MulRoutedWeight0_B16_B16_B16,53.5878,0.0,0.00%,22.54,11280.63
77,32,4096,192,128,8,ActivationType.Gelu,torch.bfloat16,torch.bfloat16,torch.bfloat16,QuantType.No,1,0,ck,stage1,32,moe_ck2stages_gemm1_256x32x64x64_1x4_TypeCast_v1_Nswizzle0_Quant0_MulRoutedWeight0_gelu_B16_B16_B16,90.878,0.0,0.00%,13.29,6651.82
77,32,4096,192,128,8,ActivationType.Gelu,torch.bfloat16,torch.bfloat16,torch.bfloat16,QuantType.No,1,0,ck,stage2,32,moe_ck2stages_gemm2_256x32x64x64_1x4_TypeCastExpertWeight_v1_Nswizzle0_Quant0_MulRoutedWeight1_B16_B16_B16,54.5566,0.0,0.11%,22.14,11080.31
78,32,4096,192,128,8,ActivationType.Gelu,torch.bfloat16,torch.bfloat16,torch.bfloat16,QuantType.No,1,1,ck,stage1,32,moe_ck2stages_gemm1_256x32x64x64_1x4_TypeCastExpertWeight_v1_Nswizzle0_Quant0_MulRoutedWeight1_gelu_B16_B16_B16,90.9629,0.0,0.00%,13.28,6645.61
78,32,4096,192,128,8,ActivationType.Gelu,torch.bfloat16,torch.bfloat16,torch.bfloat16,QuantType.No,1,1,ck,stage2,32,moe_ck2stages_gemm2_256x32x64x64_1x4_TypeCast_v1_Nswizzle0_Quant0_MulRoutedWeight0_B16_B16_B16,53.2864,0.0,0.00%,22.67,11344.43
79,32,4096,384,128,8,ActivationType.Gelu,torch.bfloat16,torch.bfloat16,torch.bfloat16,QuantType.No,1,0,ck,stage1,32,moe_ck2stages_gemm1_256x32x64x64_1x4_TypeCast_v1_Nswizzle0_Quant0_MulRoutedWeight0_gelu_B16_B16_B16,183.304,0.0,0.00%,13.18,6592.78
79,32,4096,384,128,8,ActivationType.Gelu,torch.bfloat16,torch.bfloat16,torch.bfloat16,QuantType.No,1,0,ck,stage2,32,moe_ck2stages_gemm2_256x32x64x128_1x4_TypeCastExpertWeight_v1_Nswizzle0_Quant0_MulRoutedWeight1_B16_B16_B16,96.3838,0.0,0.50%,25.07,12538.25
80,32,4096,384,128,8,ActivationType.Gelu,torch.bfloat16,torch.bfloat16,torch.bfloat16,QuantType.No,1,1,ck,stage1,32,moe_ck2stages_gemm1_256x32x64x128_1x4_TypeCastExpertWeight_v1_Nswizzle0_Quant0_MulRoutedWeight1_gelu_B16_B16_B16,180.4889,0.0,0.00%,13.39,6695.61
80,32,4096,384,128,8,ActivationType.Gelu,torch.bfloat16,torch.bfloat16,torch.bfloat16,QuantType.No,1,1,ck,stage2,32,moe_ck2stages_gemm2_256x32x64x128_1x4_TypeCast_v1_Nswizzle0_Quant0_MulRoutedWeight0_B16_B16_B16,96.1625,0.0,0.00%,25.12,12567.1
81,32,4096,384,128,8,ActivationType.Silu,torch.bfloat16,torch.bfloat16,torch.bfloat16,QuantType.No,1,0,ck,stage1,32,moe_ck2stages_gemm1_256x32x64x128_1x4_TypeCast_v1_Nswizzle0_Quant0_MulRoutedWeight0_silu_B16_B16_B16,179.3059,0.0,0.00%,13.47,6739.79
81,32,4096,384,128,8,ActivationType.Silu,torch.bfloat16,torch.bfloat16,torch.bfloat16,QuantType.No,1,0,ck,stage2,32,moe_ck2stages_gemm2_256x32x64x128_1x4_TypeCastExpertWeight_v1_Nswizzle0_Quant0_MulRoutedWeight1_B16_B16_B16,96.46,0.0,0.40%,25.05,12528.34
82,32,4096,384,128,8,ActivationType.Silu,torch.bfloat16,torch.bfloat16,torch.bfloat16,QuantType.No,1,1,ck,stage1,32,moe_ck2stages_gemm1_256x32x64x64_1x4_TypeCastExpertWeight_v1_Nswizzle0_Quant0_MulRoutedWeight1_silu_B16_B16_B16,179.7425,0.0,0.00%,13.44,6723.42
82,32,4096,384,128,8,ActivationType.Silu,torch.bfloat16,torch.bfloat16,torch.bfloat16,QuantType.No,1,1,ck,stage2,32,moe_ck2stages_gemm2_256x32x64x128_1x4_TypeCast_v1_Nswizzle0_Quant0_MulRoutedWeight0_B16_B16_B16,96.2862,0.0,0.00%,25.09,12550.96
83,32,4096,384,128,8,ActivationType.Silu,torch.bfloat16,torch.float8_e4m3fnuz,torch.float8_e4m3fnuz,QuantType.per_Tensor,1,0,ck,stage1,16,moe_ck2stages_gemm1_128x16x64x128_1x2_MulABScale_v1_Nswizzle0_Quant1_MulRoutedWeight0_silu_F8_F8_B16,93.0593,44.838555555555565,0.00%,25.96,6494.49
83,32,4096,384,128,8,ActivationType.Silu,torch.bfloat16,torch.float8_e4m3fnuz,torch.float8_e4m3fnuz,QuantType.per_Tensor,1,0,ck,stage2,16,moe_ck2stages_gemm2_128x16x128x128_1x2_MulABScaleExpertWeight_v1_Nswizzle0_Quant1_MulRoutedWeight1_F8_F8_B16,55.2053,44.838555555555565,0.38%,43.76,10947.73
84,32,4096,384,128,8,ActivationType.Silu,torch.bfloat16,torch.float8_e4m3fnuz,torch.float8_e4m3fnuz,QuantType.per_Tensor,1,1,ck,stage1,16,moe_ck2stages_gemm1_128x16x64x128_1x2_MulABScale_v1_Nswizzle0_Quant1_MulRoutedWeight1_silu_F8_F8_B16,92.3156,44.46877777777775,0.00%,26.17,6546.81
84,32,4096,384,128,8,ActivationType.Silu,torch.bfloat16,torch.float8_e4m3fnuz,torch.float8_e4m3fnuz,QuantType.per_Tensor,1,1,ck,stage2,16,moe_ck2stages_gemm2_128x16x128x128_1x2_MulABScaleExpertWeight_v1_Nswizzle0_Quant1_MulRoutedWeight0_F8_F8_B16,54.9597,44.46877777777775,0.00%,43.96,10996.66
85,32,4096,384,128,8,ActivationType.Silu,torch.bfloat16,torch.float8_e4m3fnuz,torch.float8_e4m3fnuz,QuantType.per_Token,1,0,asm,asm_1stage,32,_ZN5aiter45fmoe_bf16_pertokenFp8_g1u1_vs_silu_1tg_32x192E,146.1061,0.0,0.00%,16.54,4136.53
86,32,4096,384,128,8,ActivationType.Silu,torch.bfloat16,torch.float8_e4m3fnuz,torch.float8_e4m3fnuz,QuantType.per_Token,1,1,asm,asm_1stage,32,_ZN5aiter50fmoe_bf16_pertokenFp8_g1u1_vs_tkw1_silu_1tg_32x192E,148.3047,0.0,0.00%,16.29,4075.21
87,32,4096,384,128,8,ActivationType.Gelu,torch.bfloat16,torch.float8_e4m3fnuz,torch.float8_e4m3fnuz,QuantType.per_Tensor,1,0,ck,stage1,16,moe_ck2stages_gemm1_128x16x64x128_1x2_MulABScale_v1_Nswizzle0_Quant1_MulRoutedWeight0_gelu_F8_F8_B16,92.8197,44.726999999999975,0.00%,26.03,6511.26
87,32,4096,384,128,8,ActivationType.Gelu,torch.bfloat16,torch.float8_e4m3fnuz,torch.float8_e4m3fnuz,QuantType.per_Tensor,1,0,ck,stage2,16,moe_ck2stages_gemm2_128x16x128x128_1x2_MulABScaleExpertWeight_v1_Nswizzle0_Quant1_MulRoutedWeight1_F8_F8_B16,55.1595,44.726999999999975,0.51%,43.8,10956.83
88,32,4096,384,128,8,ActivationType.Gelu,torch.bfloat16,torch.float8_e4m3fnuz,torch.float8_e4m3fnuz,QuantType.per_Tensor,1,1,ck,stage1,16,moe_ck2stages_gemm1_128x16x64x128_1x2_MulABScale_v1_Nswizzle0_Quant1_MulRoutedWeight1_gelu_F8_F8_B16,92.2189,44.79844444444444,0.00%,26.2,6553.68
88,32,4096,384,128,8,ActivationType.Gelu,torch.bfloat16,torch.float8_e4m3fnuz,torch.float8_e4m3fnuz,QuantType.per_Tensor,1,1,ck,stage2,16,moe_ck2stages_gemm2_128x16x128x128_1x2_MulABScaleExpertWeight_v1_Nswizzle0_Quant1_MulRoutedWeight0_F8_F8_B16,55.2368,44.79844444444444,0.00%,43.74,10941.49
89,32,4096,384,128,8,ActivationType.Gelu,torch.bfloat16,torch.float8_e4m3fnuz,torch.float8_e4m3fnuz,QuantType.per_Token,1,0,asm,asm_1stage,32,_ZN5aiter45fmoe_bf16_pertokenFp8_g1u1_vs_gelu_1tg_32x192E,146.4346,0.0,0.00%,16.5,4127.26
90,32,4096,384,128,8,ActivationType.Gelu,torch.bfloat16,torch.float8_e4m3fnuz,torch.float8_e4m3fnuz,QuantType.per_Token,1,1,asm,asm_1stage,32,_ZN5aiter50fmoe_bf16_pertokenFp8_g1u1_vs_tkw1_gelu_1tg_32x192E,147.1652,0.0,0.00%,16.42,4106.77
91,32,4096,384,128,8,ActivationType.Silu,torch.bfloat16,torch.float8_e4m3fnuz,torch.float8_e4m3fnuz,QuantType.per_1x128,1,0,asm,stage1,16,_ZN5aiter59fmoe_stage1_bf16_pertokenFp8_blockscale_g1u1_16x128_4tg_pf2E,88.2477,29.035333333333355,43.59%,27.38,6848.6
91,32,4096,384,128,8,ActivationType.Silu,torch.bfloat16,torch.float8_e4m3fnuz,torch.float8_e4m3fnuz,QuantType.per_1x128,1,0,ck,stage2,16,moe_ck2stages_gemm2_128x16x128x128_1x2_MulABScaleExpertWeightA8W8blkscale_v1_Nswizzle0_Quant4_MulRoutedWeight1_F8_F8_B16,53.9558,29.035333333333355,15.24%,44.78,11201.26
92,32,4096,384,128,8,ActivationType.Gelu,torch.bfloat16,torch.float8_e4m3fnuz,torch.float8_e4m3fnuz,QuantType.per_1x128,1,0,asm,stage1,16,_ZN5aiter59fmoe_stage1_bf16_pertokenFp8_blockscale_g1u1_16x128_4tg_pf2E,88.4925,28.60799999999986,43.79%,27.3,6829.65
92,32,4096,384,128,8,ActivationType.Gelu,torch.bfloat16,torch.float8_e4m3fnuz,torch.float8_e4m3fnuz,QuantType.per_1x128,1,0,ck,stage2,16,moe_ck2stages_gemm2_128x16x128x128_1x2_MulABScaleExpertWeightA8W8blkscale_v1_Nswizzle0_Quant4_MulRoutedWeight1_F8_F8_B16,54.1113,28.60799999999986,15.14%,44.65,11169.07
93,32,4096,384,128,8,ActivationType.Silu,torch.bfloat16,torch.float8_e4m3fnuz,torch.float8_e4m3fnuz,QuantType.per_1x128,1,1,ck,stage1,16,moe_ck2stages_gemm1_128x16x128x128_1x2_MulABScaleExpertWeightA8W8blkscale_v1_Nswizzle0_Quant4_MulRoutedWeight1_silu_F8_F8_B16,98.6904,28.278777777777723,0.01%,24.48,6123.93
93,32,4096,384,128,8,ActivationType.Silu,torch.bfloat16,torch.float8_e4m3fnuz,torch.float8_e4m3fnuz,QuantType.per_1x128,1,1,ck,stage2,16,moe_ck2stages_gemm2_128x16x128x128_1x2_MulABScaleExpertWeightA8W8blkscale_v1_Nswizzle0_Quant4_MulRoutedWeight0_F8_F8_B16,54.1949,28.278777777777723,16.61%,44.58,11151.84
94,32,4096,384,128,8,ActivationType.Gelu,torch.bfloat16,torch.float8_e4m3fnuz,torch.float8_e4m3fnuz,QuantType.per_1x128,1,1,ck,stage1,16,moe_ck2stages_gemm1_128x16x128x128_1x2_MulABScaleExpertWeightA8W8blkscale_v1_Nswizzle0_Quant4_MulRoutedWeight1_gelu_F8_F8_B16,98.9867,28.287555555555528,0.01%,24.41,6105.6
94,32,4096,384,128,8,ActivationType.Gelu,torch.bfloat16,torch.float8_e4m3fnuz,torch.float8_e4m3fnuz,QuantType.per_1x128,1,1,ck,stage2,16,moe_ck2stages_gemm2_128x16x128x128_1x2_MulABScaleExpertWeightA8W8blkscale_v1_Nswizzle0_Quant4_MulRoutedWeight0_F8_F8_B16,54.1038,28.287555555555528,16.59%,44.65,11170.62
95,32,7168,256,256,8,ActivationType.Gelu,torch.bfloat16,torch.bfloat16,torch.bfloat16,QuantType.No,1,0,ck,stage1,32,moe_ck2stages_gemm1_256x32x64x128_1x4_TypeCast_v1_Nswizzle0_Quant0_MulRoutedWeight0_gelu_B16_B16_B16,321.6457,0.0,0.00%,8.76,8765.82
95,32,7168,256,256,8,ActivationType.Gelu,torch.bfloat16,torch.bfloat16,torch.bfloat16,QuantType.No,1,0,ck,stage2,32,moe_ck2stages_gemm2_256x32x64x64_1x4_TypeCastExpertWeight_v1_Nswizzle0_Quant0_MulRoutedWeight1_B16_B16_B16,172.1965,0.0,1.60%,16.37,16373.68
96,32,7168,256,256,8,ActivationType.Gelu,torch.bfloat16,torch.bfloat16,torch.bfloat16,QuantType.No,1,1,ck,stage1,32,moe_ck2stages_gemm1_256x32x64x64_1x4_TypeCastExpertWeight_v1_Nswizzle0_Quant0_MulRoutedWeight1_gelu_B16_B16_B16,320.2929,0.0,0.00%,8.8,8802.85
96,32,7168,256,256,8,ActivationType.Gelu,torch.bfloat16,torch.bfloat16,torch.bfloat16,QuantType.No,1,1,ck,stage2,32,moe_ck2stages_gemm2_256x32x64x128_1x4_TypeCast_v1_Nswizzle0_Quant0_MulRoutedWeight0_B16_B16_B16,170.2024,0.0,0.00%,16.56,16565.51
97,32,7168,256,256,8,ActivationType.Gelu,torch.bfloat16,torch.float8_e4m3fnuz,torch.float8_e4m3fnuz,QuantType.per_Tensor,1,0,ck,stage1,16,moe_ck2stages_gemm1_128x16x64x128_1x2_MulABScale_v1_Nswizzle0_Quant1_MulRoutedWeight0_gelu_F8_F8_B16,156.6576,37.56077777777778,0.00%,17.99,9000.36
97,32,7168,256,256,8,ActivationType.Gelu,torch.bfloat16,torch.float8_e4m3fnuz,torch.float8_e4m3fnuz,QuantType.per_Tensor,1,0,ck,stage2,16,moe_ck2stages_gemm2_256x16x128x256_1x4_MulABScaleExpertWeight_v1_Nswizzle0_Quant1_MulRoutedWeight1_F8_F8_B16,88.7339,37.56077777777778,1.55%,31.76,15889.92
98,32,7168,256,256,8,ActivationType.Gelu,torch.bfloat16,torch.float8_e4m3fnuz,torch.float8_e4m3fnuz,QuantType.per_Tensor,1,1,ck,stage1,16,moe_ck2stages_gemm1_128x16x64x128_1x2_MulABScale_v1_Nswizzle0_Quant1_MulRoutedWeight1_gelu_F8_F8_B16,159.7756,37.70788888888895,0.00%,17.64,8824.72
98,32,7168,256,256,8,ActivationType.Gelu,torch.bfloat16,torch.float8_e4m3fnuz,torch.float8_e4m3fnuz,QuantType.per_Tensor,1,1,ck,stage2,16,moe_ck2stages_gemm2_256x16x128x256_1x4_MulABScaleExpertWeight_v1_Nswizzle0_Quant1_MulRoutedWeight0_F8_F8_B16,88.1775,37.70788888888895,0.00%,31.96,15990.18
99,32,7168,256,256,8,ActivationType.Gelu,torch.bfloat16,torch.float8_e4m3fnuz,torch.float8_e4m3fnuz,QuantType.per_Token,1,0,asm,asm_1stage,32,_ZN5aiter48fmoe_bf16_pertokenFp8_g1u1_vs_gelu_1tg_ps_32x256E,250.9128,0.0,0.00%,11.23,5619.38
100,32,7168,256,256,8,ActivationType.Gelu,torch.bfloat16,torch.float8_e4m3fnuz,torch.float8_e4m3fnuz,QuantType.per_Token,1,1,asm,asm_1stage,32,_ZN5aiter53fmoe_bf16_pertokenFp8_g1u1_vs_tkw1_gelu_1tg_ps_32x256E,257.751,0.0,0.00%,10.94,5470.3
101,32,7168,256,256,8,ActivationType.Silu,torch.bfloat16,torch.bfloat16,torch.bfloat16,QuantType.No,1,0,ck,stage1,32,moe_ck2stages_gemm1_256x32x64x64_1x4_TypeCast_v1_Nswizzle0_Quant0_MulRoutedWeight0_silu_B16_B16_B16,321.8833,0.0,0.00%,8.76,8759.35
101,32,7168,256,256,8,ActivationType.Silu,torch.bfloat16,torch.bfloat16,torch.bfloat16,QuantType.No,1,0,ck,stage2,32,moe_ck2stages_gemm2_256x32x64x64_1x4_TypeCastExpertWeight_v1_Nswizzle0_Quant0_MulRoutedWeight1_B16_B16_B16,165.2619,0.0,1.30%,17.06,17060.74
102,32,7168,256,256,8,ActivationType.Silu,torch.bfloat16,torch.bfloat16,torch.bfloat16,QuantType.No,1,1,ck,stage1,32,moe_ck2stages_gemm1_256x32x64x64_1x4_TypeCastExpertWeight_v1_Nswizzle0_Quant0_MulRoutedWeight1_silu_B16_B16_B16,320.0205,0.0,0.00%,8.81,8810.34
102,32,7168,256,256,8,ActivationType.Silu,torch.bfloat16,torch.bfloat16,torch.bfloat16,QuantType.No,1,1,ck,stage2,32,moe_ck2stages_gemm2_256x32x64x128_1x4_TypeCast_v1_Nswizzle0_Quant0_MulRoutedWeight0_B16_B16_B16,168.5977,0.0,0.00%,16.72,16723.18
103,32,7168,256,256,8,ActivationType.Silu,torch.bfloat16,torch.float8_e4m3fnuz,torch.float8_e4m3fnuz,QuantType.per_Tensor,1,0,ck,stage1,16,moe_ck2stages_gemm1_128x16x64x128_1x2_MulABScale_v1_Nswizzle0_Quant1_MulRoutedWeight0_silu_F8_F8_B16,160.029,36.82222222222229,0.00%,17.61,8810.74
103,32,7168,256,256,8,ActivationType.Silu,torch.bfloat16,torch.float8_e4m3fnuz,torch.float8_e4m3fnuz,QuantType.per_Tensor,1,0,ck,stage2,16,moe_ck2stages_gemm2_256x16x128x256_1x4_MulABScaleExpertWeight_v1_Nswizzle0_Quant1_MulRoutedWeight1_F8_F8_B16,89.0968,36.82222222222229,1.26%,31.63,15825.2
104,32,7168,256,256,8,ActivationType.Silu,torch.bfloat16,torch.float8_e4m3fnuz,torch.float8_e4m3fnuz,QuantType.per_Tensor,1,1,ck,stage1,16,moe_ck2stages_gemm1_128x16x64x128_1x2_MulABScale_v1_Nswizzle0_Quant1_MulRoutedWeight1_silu_F8_F8_B16,158.1881,36.942,0.00%,17.82,8913.28
104,32,7168,256,256,8,ActivationType.Silu,torch.bfloat16,torch.float8_e4m3fnuz,torch.float8_e4m3fnuz,QuantType.per_Tensor,1,1,ck,stage2,16,moe_ck2stages_gemm2_256x16x128x256_1x4_MulABScaleExpertWeight_v1_Nswizzle0_Quant1_MulRoutedWeight0_F8_F8_B16,88.7036,36.942,0.00%,31.78,15895.34
105,32,7168,256,256,8,ActivationType.Silu,torch.bfloat16,torch.float8_e4m3fnuz,torch.float8_e4m3fnuz,QuantType.per_Token,1,0,asm,asm_1stage,32,_ZN5aiter45fmoe_bf16_pertokenFp8_g1u1_vs_silu_1tg_32x256E,251.7593,0.0,0.00%,11.2,5600.49
106,32,7168,256,256,8,ActivationType.Silu,torch.bfloat16,torch.float8_e4m3fnuz,torch.float8_e4m3fnuz,QuantType.per_Token,1,1,asm,asm_1stage,32,_ZN5aiter50fmoe_bf16_pertokenFp8_g1u1_vs_tkw1_silu_1tg_32x256E,258.8454,0.0,0.00%,10.89,5447.17
107,32,7168,256,256,8,ActivationType.Gelu,torch.bfloat16,torch.float8_e4m3fnuz,torch.float8_e4m3fnuz,QuantType.per_1x128,1,0,asm,asm_1stage,32,_ZN5aiter50fmoe_bf16_blockscaleFp8_g1u1_vs_gelu_1tg_ps_32x256E,261.507,0.0,1.78%,10.78,5391.73
108,32,7168,256,256,8,ActivationType.Gelu,torch.bfloat16,torch.float8_e4m3fnuz,torch.float8_e4m3fnuz,QuantType.per_1x128,1,1,ck,stage1,16,moe_ck2stages_gemm1_128x16x128x128_1x2_MulABScaleExpertWeightA8W8blkscale_v1_Nswizzle0_Quant4_MulRoutedWeight1_gelu_F8_F8_B16,165.2117,27.5564444444444,0.02%,17.06,8534.35
108,32,7168,256,256,8,ActivationType.Gelu,torch.bfloat16,torch.float8_e4m3fnuz,torch.float8_e4m3fnuz,QuantType.per_1x128,1,1,ck,stage2,16,moe_ck2stages_gemm2_256x16x128x256_1x4_MulABScaleExpertWeightA8W8blkscale_v1_Nswizzle0_Quant4_MulRoutedWeight0_F8_F8_B16,88.9229,27.5564444444444,16.54%,31.7,15856.14
109,32,7168,256,256,8,ActivationType.Silu,torch.bfloat16,torch.float8_e4m3fnuz,torch.float8_e4m3fnuz,QuantType.per_1x128,1,1,ck,stage1,16,moe_ck2stages_gemm1_128x16x128x128_1x2_MulABScaleExpertWeightA8W8blkscale_v1_Nswizzle0_Quant4_MulRoutedWeight1_silu_F8_F8_B16,166.903,28.028888888888964,0.02%,16.89,8447.87
109,32,7168,256,256,8,ActivationType.Silu,torch.bfloat16,torch.float8_e4m3fnuz,torch.float8_e4m3fnuz,QuantType.per_1x128,1,1,ck,stage2,16,moe_ck2stages_gemm2_256x16x128x256_1x4_MulABScaleExpertWeightA8W8blkscale_v1_Nswizzle0_Quant4_MulRoutedWeight0_F8_F8_B16,89.2387,28.028888888888964,16.56%,31.58,15800.03
110,32,7168,256,256,8,ActivationType.Silu,torch.bfloat16,torch.float8_e4m3fnuz,torch.float8_e4m3fnuz,QuantType.per_1x128,1,0,asm,asm_1stage,32,_ZN5aiter49fmoe_bf16_blockscaleFp8_g1u1_novs_silu_1tg_32x256E,261.7065,0.0,0.00%,10.77,5387.62
111,32,7168,256,257,9,ActivationType.Silu,torch.bfloat16,torch.float8_e4m3fnuz,torch.float8_e4m3fnuz,QuantType.per_Token,1,0,asm,asm_1stage,32,_ZN5aiter45fmoe_bf16_pertokenFp8_g1u1_vs_silu_1tg_32x256E,274.3117,0.0,0.00%,11.56,5160.11
112,32,7168,256,257,9,ActivationType.Silu,torch.bfloat16,torch.float8_e4m3fnuz,torch.float8_e4m3fnuz,QuantType.per_1x128,1,0,asm,asm_1stage,32,_ZN5aiter49fmoe_bf16_blockscaleFp8_g1u1_novs_silu_1tg_32x256E,281.3313,0.0,0.00%,11.27,5031.36
113,32,7168,512,256,8,ActivationType.Gelu,torch.bfloat16,torch.bfloat16,torch.bfloat16,QuantType.No,1,0,ck,stage1,32,moe_ck2stages_gemm1_256x32x64x128_1x4_TypeCast_v1_Nswizzle0_Quant0_MulRoutedWeight0_gelu_B16_B16_B16,610.6909,0.0,0.00%,9.23,9232.27
113,32,7168,512,256,8,ActivationType.Gelu,torch.bfloat16,torch.bfloat16,torch.bfloat16,QuantType.No,1,0,ck,stage2,32,moe_ck2stages_gemm2_256x32x64x128_1x4_TypeCastExpertWeight_v1_Nswizzle0_Quant0_MulRoutedWeight1_B16_B16_B16,320.4969,0.0,3.29%,17.59,17591.63
114,32,7168,512,256,8,ActivationType.Gelu,torch.bfloat16,torch.bfloat16,torch.bfloat16,QuantType.No,1,1,ck,stage1,32,moe_ck2stages_gemm1_256x32x64x128_1x4_TypeCastExpertWeight_v1_Nswizzle0_Quant0_MulRoutedWeight1_gelu_B16_B16_B16,611.9243,0.0,0.00%,9.21,9213.66
114,32,7168,512,256,8,ActivationType.Gelu,torch.bfloat16,torch.bfloat16,torch.bfloat16,QuantType.No,1,1,ck,stage2,32,moe_ck2stages_gemm2_256x32x64x128_1x4_TypeCast_v1_Nswizzle0_Quant0_MulRoutedWeight0_B16_B16_B16,321.3085,0.0,0.01%,17.54,17547.19
115,32,7168,512,256,8,ActivationType.Gelu,torch.bfloat16,torch.float8_e4m3fnuz,torch.float8_e4m3fnuz,QuantType.per_Tensor,1,0,asm,stage1,16,_ZN5aiter48fmoe_stage1_bf16_pertokenFp8_g1u1_16x512_2tg_pf2E,304.8995,32.058333333333366,0.00%,18.49,9246.52
115,32,7168,512,256,8,ActivationType.Gelu,torch.bfloat16,torch.float8_e4m3fnuz,torch.float8_e4m3fnuz,QuantType.per_Tensor,1,0,ck,stage2,16,moe_ck2stages_gemm2_256x16x128x256_1x4_MulABScaleExpertWeight_v1_Nswizzle0_Quant1_MulRoutedWeight1_F8_F8_B16,160.2403,32.058333333333366,3.25%,35.18,17593.95
116,32,7168,512,256,8,ActivationType.Gelu,torch.bfloat16,torch.float8_e4m3fnuz,torch.float8_e4m3fnuz,QuantType.per_Tensor,1,1,asm,stage1,16,_ZN5aiter57fmoe_stage1_bf16_pertokenFp8_doweight_g1u1_16x512_2tg_pf2E,307.8214,30.798666666666616,0.00%,18.31,9158.75
116,32,7168,512,256,8,ActivationType.Gelu,torch.bfloat16,torch.float8_e4m3fnuz,torch.float8_e4m3fnuz,QuantType.per_Tensor,1,1,ck,stage2,16,moe_ck2stages_gemm2_256x16x128x256_1x4_MulABScaleExpertWeight_v1_Nswizzle0_Quant1_MulRoutedWeight0_F8_F8_B16,166.65,30.798666666666616,0.01%,33.83,16917.25
117,32,7168,512,256,8,ActivationType.Gelu,torch.bfloat16,torch.float8_e4m3fnuz,torch.float8_e4m3fnuz,QuantType.per_Token,1,0,asm,asm_1stage,32,_ZN5aiter48fmoe_bf16_pertokenFp8_g1u1_vs_gelu_1tg_ps_32x512E,495.2367,0.0,0.00%,11.38,5692.75
118,32,7168,512,256,8,ActivationType.Gelu,torch.bfloat16,torch.float8_e4m3fnuz,torch.float8_e4m3fnuz,QuantType.per_Token,1,1,asm,stage1,16,_ZN5aiter57fmoe_stage1_bf16_pertokenFp8_doweight_g1u1_16x128_4tg_pf2E,308.7247,26.840666666666586,0.02%,18.26,9131.96
118,32,7168,512,256,8,ActivationType.Gelu,torch.bfloat16,torch.float8_e4m3fnuz,torch.float8_e4m3fnuz,QuantType.per_Token,1,1,ck,stage2,16,moe_ck2stages_gemm2_256x16x128x256_1x4_MulABScaleExpertWeight_v1_Nswizzle0_Quant2_MulRoutedWeight0_F8_F8_B16,167.1221,26.840666666666586,0.01%,33.73,16869.46
119,32,7168,512,256,8,ActivationType.Silu,torch.bfloat16,torch.bfloat16,torch.bfloat16,QuantType.No,1,1,ck,stage1,32,moe_ck2stages_gemm1_256x32x64x128_1x4_TypeCastExpertWeight_v1_Nswizzle0_Quant0_MulRoutedWeight1_silu_B16_B16_B16,613.5439,0.0,0.00%,9.19,9189.34
119,32,7168,512,256,8,ActivationType.Silu,torch.bfloat16,torch.bfloat16,torch.bfloat16,QuantType.No,1,1,ck,stage2,32,moe_ck2stages_gemm2_256x32x64x128_1x4_TypeCast_v1_Nswizzle0_Quant0_MulRoutedWeight0_B16_B16_B16,324.4307,0.0,0.01%,17.38,17378.32
120,32,7168,512,256,8,ActivationType.Silu,torch.bfloat16,torch.float8_e4m3fnuz,torch.float8_e4m3fnuz,QuantType.per_Tensor,1,0,asm,stage1,16,_ZN5aiter44fmoe_stage1_bf16_pertokenFp8_g1u1_16x512_pf3E,306.4578,31.33255555555556,0.00%,18.39,9199.51
120,32,7168,512,256,8,ActivationType.Silu,torch.bfloat16,torch.float8_e4m3fnuz,torch.float8_e4m3fnuz,QuantType.per_Tensor,1,0,ck,stage2,16,moe_ck2stages_gemm2_256x16x128x256_1x4_MulABScaleExpertWeight_v1_Nswizzle0_Quant1_MulRoutedWeight1_F8_F8_B16,160.5651,31.33255555555556,2.79%,35.11,17558.36
121,32,7168,512,256,8,ActivationType.Silu,torch.bfloat16,torch.float8_e4m3fnuz,torch.float8_e4m3fnuz,QuantType.per_Tensor,1,1,asm,stage1,16,_ZN5aiter57fmoe_stage1_bf16_pertokenFp8_doweight_g1u1_16x512_2tg_pf2E,306.4482,30.75899999999996,0.00%,18.4,9199.79
121,32,7168,512,256,8,ActivationType.Silu,torch.bfloat16,torch.float8_e4m3fnuz,torch.float8_e4m3fnuz,QuantType.per_Tensor,1,1,ck,stage2,16,moe_ck2stages_gemm2_256x16x128x256_1x4_MulABScaleExpertWeight_v1_Nswizzle0_Quant1_MulRoutedWeight0_F8_F8_B16,160.2215,30.75899999999996,0.01%,35.18,17596.02
122,32,7168,512,256,8,ActivationType.Silu,torch.bfloat16,torch.float8_e4m3fnuz,torch.float8_e4m3fnuz,QuantType.per_Token,1,0,asm,asm_1stage,32,_ZN5aiter45fmoe_bf16_pertokenFp8_g1u1_vs_silu_1tg_32x512E,485.1628,0.0,0.00%,11.62,5810.96
123,32,7168,512,256,8,ActivationType.Silu,torch.bfloat16,torch.float8_e4m3fnuz,torch.float8_e4m3fnuz,QuantType.per_Token,1,1,asm,stage1,16,_ZN5aiter57fmoe_stage1_bf16_pertokenFp8_doweight_g1u1_16x128_4tg_pf2E,308.2689,26.573777777777774,0.00%,18.29,9145.46
123,32,7168,512,256,8,ActivationType.Silu,torch.bfloat16,torch.float8_e4m3fnuz,torch.float8_e4m3fnuz,QuantType.per_Token,1,1,ck,stage2,16,moe_ck2stages_gemm2_256x16x128x256_1x4_MulABScaleExpertWeight_v1_Nswizzle0_Quant2_MulRoutedWeight0_F8_F8_B16,167.5208,26.573777777777774,0.01%,33.65,16829.32
124,32,7168,512,256,8,ActivationType.Silu,torch.bfloat16,torch.bfloat16,torch.bfloat16,QuantType.No,1,0,ck,stage1,32,moe_ck2stages_gemm1_256x32x64x128_1x4_TypeCast_v1_Nswizzle0_Quant0_MulRoutedWeight0_silu_B16_B16_B16,611.5421,0.0,0.00%,9.22,9219.42
124,32,7168,512,256,8,ActivationType.Silu,torch.bfloat16,torch.bfloat16,torch.bfloat16,QuantType.No,1,0,ck,stage2,32,moe_ck2stages_gemm2_256x32x64x128_1x4_TypeCastExpertWeight_v1_Nswizzle0_Quant0_MulRoutedWeight1_B16_B16_B16,323.408,0.0,2.83%,17.43,17433.28
125,32,7168,512,256,8,ActivationType.Gelu,torch.bfloat16,torch.float8_e4m3fnuz,torch.float8_e4m3fnuz,QuantType.per_1x128,1,0,asm,stage1,16,_ZN5aiter59fmoe_stage1_bf16_pertokenFp8_blockscale_g1u1_16x512_2tg_pf2E,302.1986,29.622888888888856,15.08%,18.65,9329.16
125,32,7168,512,256,8,ActivationType.Gelu,torch.bfloat16,torch.float8_e4m3fnuz,torch.float8_e4m3fnuz,QuantType.per_1x128,1,0,ck,stage2,16,moe_ck2stages_gemm2_256x16x128x256_1x4_MulABScaleExpertWeightA8W8blkscale_v1_Nswizzle0_Quant4_MulRoutedWeight1_F8_F8_B16,158.246,29.622888888888856,15.49%,35.62,17815.68
126,32,7168,512,256,8,ActivationType.Silu,torch.bfloat16,torch.float8_e4m3fnuz,torch.float8_e4m3fnuz,QuantType.per_1x128,1,0,asm,stage1,16,_ZN5aiter59fmoe_stage1_bf16_pertokenFp8_blockscale_g1u1_16x512_2tg_pf2E,300.7088,29.71200000000003,14.87%,18.75,9375.38
126,32,7168,512,256,8,ActivationType.Silu,torch.bfloat16,torch.float8_e4m3fnuz,torch.float8_e4m3fnuz,QuantType.per_1x128,1,0,ck,stage2,16,moe_ck2stages_gemm2_128x16x128x128_1x2_MulABScaleExpertWeightA8W8blkscale_v1_Nswizzle0_Quant4_MulRoutedWeight1_F8_F8_B16,162.7322,29.71200000000003,15.50%,34.64,17324.54
127,32,7168,512,256,8,ActivationType.Gelu,torch.bfloat16,torch.float8_e4m3fnuz,torch.float8_e4m3fnuz,QuantType.per_1x128,1,1,ck,stage1,16,moe_ck2stages_gemm1_256x16x128x256_1x4_MulABScaleExpertWeightA8W8blkscale_v1_Nswizzle0_Quant4_MulRoutedWeight1_gelu_F8_F8_B16,311.7751,28.986333333333285,0.02%,18.08,9042.61
127,32,7168,512,256,8,ActivationType.Gelu,torch.bfloat16,torch.float8_e4m3fnuz,torch.float8_e4m3fnuz,QuantType.per_1x128,1,1,ck,stage2,16,moe_ck2stages_gemm2_256x16x128x256_1x4_MulABScaleExpertWeightA8W8blkscale_v1_Nswizzle0_Quant4_MulRoutedWeight0_F8_F8_B16,158.8247,28.986333333333285,16.73%,35.49,17750.77
128,32,7168,512,256,8,ActivationType.Silu,torch.bfloat16,torch.float8_e4m3fnuz,torch.float8_e4m3fnuz,QuantType.per_1x128,1,1,ck,stage1,16,moe_ck2stages_gemm1_256x16x128x256_1x4_MulABScaleExpertWeightA8W8blkscale_v1_Nswizzle0_Quant4_MulRoutedWeight1_silu_F8_F8_B16,311.0183,29.40477777777778,0.02%,18.12,9064.61
128,32,7168,512,256,8,ActivationType.Silu,torch.bfloat16,torch.float8_e4m3fnuz,torch.float8_e4m3fnuz,QuantType.per_1x128,1,1,ck,stage2,16,moe_ck2stages_gemm2_256x16x128x256_1x4_MulABScaleExpertWeightA8W8blkscale_v1_Nswizzle0_Quant4_MulRoutedWeight0_F8_F8_B16,158.9413,29.40477777777778,16.78%,35.47,17737.75
129,32,7168,2048,33,10,ActivationType.Silu,torch.bfloat16,torch.float8_e4m3fnuz,torch.float8_e4m3fnuz,QuantType.per_1x128,1,0,asm,asm_1stage,32,_ZN5aiter47fmoe_bf16_blockscaleFp8_g1u1_vs_silu_1tg_32x128E,423.9941,0.0,0.00%,66.48,3429.33
130,32,7168,2048,33,10,ActivationType.Silu,torch.bfloat16,torch.float8_e4m3fnuz,torch.float8_e4m3fnuz,QuantType.per_Token,1,0,asm,asm_1stage,32,_ZN5aiter45fmoe_bf16_pertokenFp8_g1u1_vs_silu_1tg_32x512E,400.6129,0.0,0.00%,70.36,3629.47
131,56,6144,4096,8,2,ActivationType.Silu,torch.bfloat16,torch.float8_e4m3fnuz,torch.float8_e4m3fnuz,QuantType.per_1x128,1,0,asm,asm_1stage,32,_ZN5aiter47fmoe_bf16_blockscaleFp8_g1u1_vs_silu_1tg_32x256E,169.382,0.0,0.52%,99.84,3571.88
132,64,2048,192,128,8,ActivationType.Silu,torch.bfloat16,torch.bfloat16,torch.bfloat16,QuantType.No,1,0,ck,stage1,32,moe_ck2stages_gemm1_256x32x64x64_1x4_TypeCast_v1_Nswizzle0_Quant0_MulRoutedWeight0_silu_B16_B16_B16,57.8879,0.0,0.00%,20.87,5225.86
132,64,2048,192,128,8,ActivationType.Silu,torch.bfloat16,torch.bfloat16,torch.bfloat16,QuantType.No,1,0,ck,stage2,32,moe_ck2stages_gemm2_256x32x64x64_1x4_TypeCastExpertWeight_v1_Nswizzle0_Quant0_MulRoutedWeight1_B16_B16_B16,35.4541,0.0,0.00%,34.07,8532.56
133,64,2048,192,128,8,ActivationType.Silu,torch.bfloat16,torch.bfloat16,torch.bfloat16,QuantType.No,1,1,ck,stage1,32,moe_ck2stages_gemm1_256x32x64x64_1x4_TypeCastExpertWeight_v1_Nswizzle0_Quant0_MulRoutedWeight1_silu_B16_B16_B16,58.0802,0.0,0.00%,20.8,5208.56
133,64,2048,192,128,8,ActivationType.Silu,torch.bfloat16,torch.bfloat16,torch.bfloat16,QuantType.No,1,1,ck,stage2,32,moe_ck2stages_gemm2_256x32x64x64_1x4_TypeCast_v1_Nswizzle0_Quant0_MulRoutedWeight0_B16_B16_B16,34.8953,0.0,0.00%,34.62,8669.2
134,64,2048,192,128,8,ActivationType.Gelu,torch.bfloat16,torch.bfloat16,torch.bfloat16,QuantType.No,1,0,ck,stage1,32,moe_ck2stages_gemm1_256x32x64x64_1x4_TypeCast_v1_Nswizzle0_Quant0_MulRoutedWeight0_gelu_B16_B16_B16,56.5524,0.0,0.00%,21.36,5349.27
134,64,2048,192,128,8,ActivationType.Gelu,torch.bfloat16,torch.bfloat16,torch.bfloat16,QuantType.No,1,0,ck,stage2,32,moe_ck2stages_gemm2_256x32x64x64_1x4_TypeCastExpertWeight_v1_Nswizzle0_Quant0_MulRoutedWeight1_B16_B16_B16,35.5556,0.0,0.00%,33.97,8508.2
135,64,2048,192,128,8,ActivationType.Gelu,torch.bfloat16,torch.bfloat16,torch.bfloat16,QuantType.No,1,1,ck,stage1,32,moe_ck2stages_gemm1_256x32x64x64_1x4_TypeCastExpertWeight_v1_Nswizzle0_Quant0_MulRoutedWeight1_gelu_B16_B16_B16,57.1364,0.0,0.00%,21.14,5294.6
135,64,2048,192,128,8,ActivationType.Gelu,torch.bfloat16,torch.bfloat16,torch.bfloat16,QuantType.No,1,1,ck,stage2,32,moe_ck2stages_gemm2_256x32x64x64_1x4_TypeCast_v1_Nswizzle0_Quant0_MulRoutedWeight0_B16_B16_B16,34.8223,0.0,0.00%,34.69,8687.37
136,64,4096,192,128,8,ActivationType.Silu,torch.bfloat16,torch.bfloat16,torch.bfloat16,QuantType.No,1,0,ck,stage1,32,moe_ck2stages_gemm1_256x32x64x64_1x4_TypeCast_v1_Nswizzle0_Quant0_MulRoutedWeight0_silu_B16_B16_B16,102.3455,0.0,0.00%,23.61,5911.63
136,64,4096,192,128,8,ActivationType.Silu,torch.bfloat16,torch.bfloat16,torch.bfloat16,QuantType.No,1,0,ck,stage2,32,moe_ck2stages_gemm2_256x32x64x64_1x4_TypeCastExpertWeight_v1_Nswizzle0_Quant0_MulRoutedWeight1_B16_B16_B16,60.0445,0.0,0.08%,40.24,10076.33
137,64,4096,192,128,8,ActivationType.Silu,torch.bfloat16,torch.bfloat16,torch.bfloat16,QuantType.No,1,1,ck,stage1,32,moe_ck2stages_gemm1_256x32x64x64_1x4_TypeCastExpertWeight_v1_Nswizzle0_Quant0_MulRoutedWeight1_silu_B16_B16_B16,102.825,0.0,0.00%,23.5,5884.06
137,64,4096,192,128,8,ActivationType.Silu,torch.bfloat16,torch.bfloat16,torch.bfloat16,QuantType.No,1,1,ck,stage2,32,moe_ck2stages_gemm2_256x32x64x64_1x4_TypeCast_v1_Nswizzle0_Quant0_MulRoutedWeight0_B16_B16_B16,58.9165,0.0,0.00%,41.01,10269.25
138,64,4096,192,128,8,ActivationType.Gelu,torch.bfloat16,torch.bfloat16,torch.bfloat16,QuantType.No,1,0,ck,stage1,32,moe_ck2stages_gemm1_256x32x64x64_1x4_TypeCast_v1_Nswizzle0_Quant0_MulRoutedWeight0_gelu_B16_B16_B16,101.9636,0.0,0.00%,23.69,5933.77
138,64,4096,192,128,8,ActivationType.Gelu,torch.bfloat16,torch.bfloat16,torch.bfloat16,QuantType.No,1,0,ck,stage2,32,moe_ck2stages_gemm2_256x32x64x64_1x4_TypeCastExpertWeight_v1_Nswizzle0_Quant0_MulRoutedWeight1_B16_B16_B16,60.0931,0.0,0.13%,40.2,10068.18
139,64,4096,192,128,8,ActivationType.Gelu,torch.bfloat16,torch.bfloat16,torch.bfloat16,QuantType.No,1,1,ck,stage1,32,moe_ck2stages_gemm1_256x32x64x64_1x4_TypeCastExpertWeight_v1_Nswizzle0_Quant0_MulRoutedWeight1_gelu_B16_B16_B16,103.148,0.0,0.00%,23.42,5865.63
139,64,4096,192,128,8,ActivationType.Gelu,torch.bfloat16,torch.bfloat16,torch.bfloat16,QuantType.No,1,1,ck,stage2,32,moe_ck2stages_gemm2_256x32x64x64_1x4_TypeCast_v1_Nswizzle0_Quant0_MulRoutedWeight0_B16_B16_B16,58.7821,0.0,0.00%,41.1,10292.73
140,64,4096,384,128,8,ActivationType.Gelu,torch.bfloat16,torch.bfloat16,torch.bfloat16,QuantType.No,1,0,ck,stage1,32,moe_ck2stages_gemm1_256x32x64x128_1x4_TypeCast_v1_Nswizzle0_Quant0_MulRoutedWeight0_gelu_B16_B16_B16,203.378,0.0,0.00%,23.76,5944.64
140,64,4096,384,128,8,ActivationType.Gelu,torch.bfloat16,torch.bfloat16,torch.bfloat16,QuantType.No,1,0,ck,stage2,32,moe_ck2stages_gemm2_256x32x64x128_1x4_TypeCastExpertWeight_v1_Nswizzle0_Quant0_MulRoutedWeight1_B16_B16_B16,109.6485,0.0,0.52%,44.07,11026.22
141,64,4096,384,128,8,ActivationType.Gelu,torch.bfloat16,torch.bfloat16,torch.bfloat16,QuantType.No,1,1,ck,stage1,32,moe_ck2stages_gemm1_256x32x64x64_1x4_TypeCastExpertWeight_v1_Nswizzle0_Quant0_MulRoutedWeight1_gelu_B16_B16_B16,201.0137,0.0,0.00%,24.04,6014.56
141,64,4096,384,128,8,ActivationType.Gelu,torch.bfloat16,torch.bfloat16,torch.bfloat16,QuantType.No,1,1,ck,stage2,32,moe_ck2stages_gemm2_256x32x64x128_1x4_TypeCast_v1_Nswizzle0_Quant0_MulRoutedWeight0_B16_B16_B16,109.8226,0.0,0.00%,44.0,11008.74
142,64,4096,384,128,8,ActivationType.Silu,torch.bfloat16,torch.bfloat16,torch.bfloat16,QuantType.No,1,0,ck,stage1,32,moe_ck2stages_gemm1_256x32x64x128_1x4_TypeCast_v1_Nswizzle0_Quant0_MulRoutedWeight0_silu_B16_B16_B16,203.8343,0.0,0.00%,23.7,5931.33
142,64,4096,384,128,8,ActivationType.Silu,torch.bfloat16,torch.bfloat16,torch.bfloat16,QuantType.No,1,0,ck,stage2,32,moe_ck2stages_gemm2_256x32x64x128_1x4_TypeCastExpertWeight_v1_Nswizzle0_Quant0_MulRoutedWeight1_B16_B16_B16,109.7968,0.0,0.38%,44.01,11011.32
143,64,4096,384,128,8,ActivationType.Silu,torch.bfloat16,torch.bfloat16,torch.bfloat16,QuantType.No,1,1,ck,stage1,32,moe_ck2stages_gemm1_256x32x64x128_1x4_TypeCastExpertWeight_v1_Nswizzle0_Quant0_MulRoutedWeight1_silu_B16_B16_B16,204.8142,0.0,0.00%,23.59,5902.95
143,64,4096,384,128,8,ActivationType.Silu,torch.bfloat16,torch.bfloat16,torch.bfloat16,QuantType.No,1,1,ck,stage2,32,moe_ck2stages_gemm2_256x32x64x128_1x4_TypeCast_v1_Nswizzle0_Quant0_MulRoutedWeight0_B16_B16_B16,114.2772,0.0,0.00%,42.28,10579.61
144,64,4096,384,128,8,ActivationType.Silu,torch.bfloat16,torch.float8_e4m3fnuz,torch.float8_e4m3fnuz,QuantType.per_Tensor,1,0,ck,stage1,16,moe_ck2stages_gemm1_128x16x64x128_1x2_MulABScale_v1_Nswizzle0_Quant1_MulRoutedWeight0_silu_F8_F8_B16,102.2524,32.111777777777704,0.00%,47.25,5914.45
144,64,4096,384,128,8,ActivationType.Silu,torch.bfloat16,torch.float8_e4m3fnuz,torch.float8_e4m3fnuz,QuantType.per_Tensor,1,0,ck,stage2,16,moe_ck2stages_gemm2_128x16x128x128_1x2_MulABScaleExpertWeight_v1_Nswizzle0_Quant1_MulRoutedWeight1_F8_F8_B16,61.9241,32.111777777777704,0.37%,78.03,9766.25
145,64,4096,384,128,8,ActivationType.Silu,torch.bfloat16,torch.float8_e4m3fnuz,torch.float8_e4m3fnuz,QuantType.per_Tensor,1,1,ck,stage1,16,moe_ck2stages_gemm1_128x16x64x128_1x2_MulABScale_v1_Nswizzle0_Quant1_MulRoutedWeight1_silu_F8_F8_B16,102.6083,32.579111111111075,0.00%,47.09,5893.93
145,64,4096,384,128,8,ActivationType.Silu,torch.bfloat16,torch.float8_e4m3fnuz,torch.float8_e4m3fnuz,QuantType.per_Tensor,1,1,ck,stage2,16,moe_ck2stages_gemm2_128x16x128x128_1x2_MulABScaleExpertWeight_v1_Nswizzle0_Quant1_MulRoutedWeight0_F8_F8_B16,61.8739,32.579111111111075,0.00%,78.09,9774.17
146,64,4096,384,128,8,ActivationType.Silu,torch.bfloat16,torch.float8_e4m3fnuz,torch.float8_e4m3fnuz,QuantType.per_Token,1,0,asm,asm_1stage,32,_ZN5aiter45fmoe_bf16_pertokenFp8_g1u1_vs_silu_1tg_32x384E,164.9576,0.0,0.00%,29.29,3666.19
147,64,4096,384,128,8,ActivationType.Silu,torch.bfloat16,torch.float8_e4m3fnuz,torch.float8_e4m3fnuz,QuantType.per_Token,1,1,asm,asm_1stage,32,_ZN5aiter50fmoe_bf16_pertokenFp8_g1u1_vs_tkw1_silu_1tg_32x192E,168.5294,0.0,0.00%,28.67,3588.49
148,64,4096,384,128,8,ActivationType.Gelu,torch.bfloat16,torch.float8_e4m3fnuz,torch.float8_e4m3fnuz,QuantType.per_Tensor,1,0,ck,stage1,32,moe_ck2stages_gemm1_256x32x64x128_1x4_MulABScale_v1_Nswizzle0_Quant1_MulRoutedWeight0_gelu_F8_F8_B16,103.4599,31.969111111111104,0.00%,46.7,5845.42
148,64,4096,384,128,8,ActivationType.Gelu,torch.bfloat16,torch.float8_e4m3fnuz,torch.float8_e4m3fnuz,QuantType.per_Tensor,1,0,ck,stage2,32,moe_ck2stages_gemm2_256x32x64x128_1x4_MulABScaleExpertWeight_v1_Nswizzle0_Quant1_MulRoutedWeight1_F8_F8_B16,57.926,31.969111111111104,0.51%,83.41,10440.32
149,64,4096,384,128,8,ActivationType.Gelu,torch.bfloat16,torch.float8_e4m3fnuz,torch.float8_e4m3fnuz,QuantType.per_Tensor,1,1,ck,stage1,16,moe_ck2stages_gemm1_128x16x64x128_1x2_MulABScale_v1_Nswizzle0_Quant1_MulRoutedWeight1_gelu_F8_F8_B16,102.3868,31.812666666666644,0.00%,47.19,5906.68
149,64,4096,384,128,8,ActivationType.Gelu,torch.bfloat16,torch.float8_e4m3fnuz,torch.float8_e4m3fnuz,QuantType.per_Tensor,1,1,ck,stage2,16,moe_ck2stages_gemm2_128x16x128x128_1x2_MulABScaleExpertWeight_v1_Nswizzle0_Quant1_MulRoutedWeight0_F8_F8_B16,61.7948,31.812666666666644,0.00%,78.19,9786.68
150,64,4096,384,128,8,ActivationType.Gelu,torch.bfloat16,torch.float8_e4m3fnuz,torch.float8_e4m3fnuz,QuantType.per_Token,1,0,asm,asm_1stage,32,_ZN5aiter45fmoe_bf16_pertokenFp8_g1u1_vs_gelu_1tg_32x384E,165.6301,0.0,0.00%,29.17,3651.31
151,64,4096,384,128,8,ActivationType.Gelu,torch.bfloat16,torch.float8_e4m3fnuz,torch.float8_e4m3fnuz,QuantType.per_Token,1,1,asm,asm_1stage,32,_ZN5aiter50fmoe_bf16_pertokenFp8_g1u1_vs_tkw1_gelu_1tg_32x192E,168.9562,0.0,0.00%,28.6,3579.43
152,64,4096,384,128,8,ActivationType.Silu,torch.bfloat16,torch.float8_e4m3fnuz,torch.float8_e4m3fnuz,QuantType.per_1x128,1,0,asm,stage1,16,_ZN5aiter59fmoe_stage1_bf16_pertokenFp8_blockscale_g1u1_16x128_4tg_pf2E,98.9259,31.238666666666763,44.08%,48.84,6113.33
152,64,4096,384,128,8,ActivationType.Silu,torch.bfloat16,torch.float8_e4m3fnuz,torch.float8_e4m3fnuz,QuantType.per_1x128,1,0,ck,stage2,16,moe_ck2stages_gemm2_128x16x128x128_1x2_MulABScaleExpertWeightA8W8blkscale_v1_Nswizzle0_Quant4_MulRoutedWeight1_F8_F8_B16,58.3148,31.238666666666763,15.32%,82.86,10370.72
153,64,4096,384,128,8,ActivationType.Gelu,torch.bfloat16,torch.float8_e4m3fnuz,torch.float8_e4m3fnuz,QuantType.per_1x128,1,0,asm,stage1,16,_ZN5aiter59fmoe_stage1_bf16_pertokenFp8_blockscale_g1u1_16x128_4tg_pf2E,98.8312,32.43611111111114,44.34%,48.89,6119.18
153,64,4096,384,128,8,ActivationType.Gelu,torch.bfloat16,torch.float8_e4m3fnuz,torch.float8_e4m3fnuz,QuantType.per_1x128,1,0,ck,stage2,16,moe_ck2stages_gemm2_128x16x128x128_1x2_MulABScaleExpertWeightA8W8blkscale_v1_Nswizzle0_Quant4_MulRoutedWeight1_F8_F8_B16,60.3712,32.43611111111114,15.18%,80.04,10017.46
154,64,4096,384,128,8,ActivationType.Silu,torch.bfloat16,torch.float8_e4m3fnuz,torch.float8_e4m3fnuz,QuantType.per_1x128,1,1,ck,stage1,16,moe_ck2stages_gemm1_128x16x128x128_1x2_MulABScaleExpertWeightA8W8blkscale_v1_Nswizzle0_Quant4_MulRoutedWeight1_silu_F8_F8_B16,108.4603,30.526222222222348,0.01%,44.55,5575.92
154,64,4096,384,128,8,ActivationType.Silu,torch.bfloat16,torch.float8_e4m3fnuz,torch.float8_e4m3fnuz,QuantType.per_1x128,1,1,ck,stage2,16,moe_ck2stages_gemm2_128x16x128x128_1x2_MulABScaleExpertWeightA8W8blkscale_v1_Nswizzle0_Quant4_MulRoutedWeight0_F8_F8_B16,60.1401,30.526222222222348,16.58%,80.34,10055.96
155,64,4096,384,128,8,ActivationType.Gelu,torch.bfloat16,torch.float8_e4m3fnuz,torch.float8_e4m3fnuz,QuantType.per_1x128,1,1,ck,stage1,16,moe_ck2stages_gemm1_128x16x128x128_1x2_MulABScaleExpertWeightA8W8blkscale_v1_Nswizzle0_Quant4_MulRoutedWeight1_gelu_F8_F8_B16,107.5917,31.50533333333325,0.01%,44.91,5620.94
155,64,4096,384,128,8,ActivationType.Gelu,torch.bfloat16,torch.float8_e4m3fnuz,torch.float8_e4m3fnuz,QuantType.per_1x128,1,1,ck,stage2,16,moe_ck2stages_gemm2_128x16x128x128_1x2_MulABScaleExpertWeightA8W8blkscale_v1_Nswizzle0_Quant4_MulRoutedWeight0_F8_F8_B16,60.2388,31.50533333333325,16.56%,80.21,10039.48
156,64,7168,256,256,8,ActivationType.Gelu,torch.bfloat16,torch.bfloat16,torch.bfloat16,QuantType.No,1,0,ck,stage1,32,moe_ck2stages_gemm1_256x32x64x64_1x4_TypeCast_v1_Nswizzle0_Quant0_MulRoutedWeight0_gelu_B16_B16_B16,429.5641,0.0,0.00%,13.12,6565.74
156,64,7168,256,256,8,ActivationType.Gelu,torch.bfloat16,torch.bfloat16,torch.bfloat16,QuantType.No,1,0,ck,stage2,32,moe_ck2stages_gemm2_256x32x64x64_1x4_TypeCastExpertWeight_v1_Nswizzle0_Quant0_MulRoutedWeight1_B16_B16_B16,234.7867,0.0,1.62%,24.01,12012.64
157,64,7168,256,256,8,ActivationType.Gelu,torch.bfloat16,torch.bfloat16,torch.bfloat16,QuantType.No,1,1,ck,stage1,32,moe_ck2stages_gemm1_256x32x64x128_1x4_TypeCastExpertWeight_v1_Nswizzle0_Quant0_MulRoutedWeight1_gelu_B16_B16_B16,429.2572,0.0,0.00%,13.13,6570.44
157,64,7168,256,256,8,ActivationType.Gelu,torch.bfloat16,torch.bfloat16,torch.bfloat16,QuantType.No,1,1,ck,stage2,32,moe_ck2stages_gemm2_256x32x64x128_1x4_TypeCast_v1_Nswizzle0_Quant0_MulRoutedWeight0_B16_B16_B16,234.1065,0.0,0.00%,24.08,12047.54
158,64,7168,256,256,8,ActivationType.Gelu,torch.bfloat16,torch.float8_e4m3fnuz,torch.float8_e4m3fnuz,QuantType.per_Tensor,1,0,asm,stage1,16,_ZN5aiter48fmoe_stage1_bf16_pertokenFp8_g1u1_16x128_4tg_pf2E,213.7705,31.3864444444444,0.06%,26.37,6598.96
158,64,7168,256,256,8,ActivationType.Gelu,torch.bfloat16,torch.float8_e4m3fnuz,torch.float8_e4m3fnuz,QuantType.per_Tensor,1,0,ck,stage2,16,moe_ck2stages_gemm2_256x16x128x256_1x4_MulABScaleExpertWeight_v1_Nswizzle0_Quant1_MulRoutedWeight1_F8_F8_B16,118.3533,31.3864444444444,1.59%,47.63,11919.08
159,64,7168,256,256,8,ActivationType.Gelu,torch.bfloat16,torch.float8_e4m3fnuz,torch.float8_e4m3fnuz,QuantType.per_Tensor,1,1,asm,stage1,16,_ZN5aiter57fmoe_stage1_bf16_pertokenFp8_doweight_g1u1_16x128_4tg_pf2E,213.4348,31.30600000000005,0.00%,26.41,6609.34
159,64,7168,256,256,8,ActivationType.Gelu,torch.bfloat16,torch.float8_e4m3fnuz,torch.float8_e4m3fnuz,QuantType.per_Tensor,1,1,ck,stage2,16,moe_ck2stages_gemm2_256x16x128x256_1x4_MulABScaleExpertWeight_v1_Nswizzle0_Quant1_MulRoutedWeight0_F8_F8_B16,118.733,31.30600000000005,0.00%,47.48,11880.96
160,64,7168,256,256,8,ActivationType.Gelu,torch.bfloat16,torch.float8_e4m3fnuz,torch.float8_e4m3fnuz,QuantType.per_Token,1,0,asm,asm_1stage,32,_ZN5aiter45fmoe_bf16_pertokenFp8_g1u1_vs_gelu_1tg_32x256E,345.5462,0.0,0.00%,16.31,4082.41
161,64,7168,256,256,8,ActivationType.Gelu,torch.bfloat16,torch.float8_e4m3fnuz,torch.float8_e4m3fnuz,QuantType.per_Token,1,1,asm,asm_1stage,32,_ZN5aiter53fmoe_bf16_pertokenFp8_g1u1_vs_tkw1_gelu_1tg_ps_32x256E,347.8732,0.0,0.00%,16.2,4055.11
162,64,7168,256,256,8,ActivationType.Silu,torch.bfloat16,torch.bfloat16,torch.bfloat16,QuantType.No,1,0,ck,stage1,32,moe_ck2stages_gemm1_256x32x64x64_1x4_TypeCast_v1_Nswizzle0_Quant0_MulRoutedWeight0_silu_B16_B16_B16,430.8532,0.0,0.00%,13.08,6546.1
162,64,7168,256,256,8,ActivationType.Silu,torch.bfloat16,torch.bfloat16,torch.bfloat16,QuantType.No,1,0,ck,stage2,32,moe_ck2stages_gemm2_256x32x64x64_1x4_TypeCastExpertWeight_v1_Nswizzle0_Quant0_MulRoutedWeight1_B16_B16_B16,232.8963,0.0,1.30%,24.2,12110.14
163,64,7168,256,256,8,ActivationType.Silu,torch.bfloat16,torch.bfloat16,torch.bfloat16,QuantType.No,1,1,ck,stage1,32,moe_ck2stages_gemm1_256x32x64x64_1x4_TypeCastExpertWeight_v1_Nswizzle0_Quant0_MulRoutedWeight1_silu_B16_B16_B16,431.5715,0.0,0.00%,13.06,6535.2
163,64,7168,256,256,8,ActivationType.Silu,torch.bfloat16,torch.bfloat16,torch.bfloat16,QuantType.No,1,1,ck,stage2,32,moe_ck2stages_gemm2_256x32x64x128_1x4_TypeCast_v1_Nswizzle0_Quant0_MulRoutedWeight0_B16_B16_B16,223.2042,0.0,0.00%,25.26,12636.0
164,64,7168,256,256,8,ActivationType.Silu,torch.bfloat16,torch.float8_e4m3fnuz,torch.float8_e4m3fnuz,QuantType.per_Tensor,1,0,asm,stage1,16,_ZN5aiter48fmoe_stage1_bf16_pertokenFp8_g1u1_16x128_4tg_pf2E,213.2261,29.930444444444472,0.00%,26.44,6615.81
164,64,7168,256,256,8,ActivationType.Silu,torch.bfloat16,torch.float8_e4m3fnuz,torch.float8_e4m3fnuz,QuantType.per_Tensor,1,0,ck,stage2,16,moe_ck2stages_gemm2_256x16x128x256_1x4_MulABScaleExpertWeight_v1_Nswizzle0_Quant1_MulRoutedWeight1_F8_F8_B16,121.7975,29.930444444444472,1.24%,46.28,11582.03
165,64,7168,256,256,8,ActivationType.Silu,torch.bfloat16,torch.float8_e4m3fnuz,torch.float8_e4m3fnuz,QuantType.per_Tensor,1,1,ck,stage1,16,moe_ck2stages_gemm1_256x16x128x256_1x4_MulABScale_v1_Nswizzle0_Quant1_MulRoutedWeight1_silu_F8_F8_B16,212.0557,31.09277777777776,0.00%,26.58,6652.32
165,64,7168,256,256,8,ActivationType.Silu,torch.bfloat16,torch.float8_e4m3fnuz,torch.float8_e4m3fnuz,QuantType.per_Tensor,1,1,ck,stage2,16,moe_ck2stages_gemm2_256x16x128x256_1x4_MulABScaleExpertWeight_v1_Nswizzle0_Quant1_MulRoutedWeight0_F8_F8_B16,121.9475,31.09277777777776,0.00%,46.23,11567.78
166,64,7168,256,256,8,ActivationType.Silu,torch.bfloat16,torch.float8_e4m3fnuz,torch.float8_e4m3fnuz,QuantType.per_Token,1,0,asm,asm_1stage,32,_ZN5aiter45fmoe_bf16_pertokenFp8_g1u1_vs_silu_1tg_32x256E,346.2396,0.0,0.00%,16.28,4074.24
167,64,7168,256,256,8,ActivationType.Silu,torch.bfloat16,torch.float8_e4m3fnuz,torch.float8_e4m3fnuz,QuantType.per_Token,1,1,asm,asm_1stage,32,_ZN5aiter50fmoe_bf16_pertokenFp8_g1u1_vs_tkw1_silu_1tg_32x256E,348.7617,0.0,0.00%,16.16,4044.77
168,64,7168,256,256,8,ActivationType.Gelu,torch.bfloat16,torch.float8_e4m3fnuz,torch.float8_e4m3fnuz,QuantType.per_1x128,1,0,asm,asm_1stage,32,_ZN5aiter47fmoe_bf16_blockscaleFp8_g1u1_vs_gelu_1tg_32x128E,355.8495,0.0,2.00%,15.84,3964.21
169,64,7168,256,256,8,ActivationType.Gelu,torch.bfloat16,torch.float8_e4m3fnuz,torch.float8_e4m3fnuz,QuantType.per_1x128,1,1,ck,stage1,16,moe_ck2stages_gemm1_256x16x128x256_1x4_MulABScaleExpertWeightA8W8blkscale_v1_Nswizzle0_Quant4_MulRoutedWeight1_gelu_F8_F8_B16,209.1378,28.714222222222304,0.02%,26.95,6745.13
169,64,7168,256,256,8,ActivationType.Gelu,torch.bfloat16,torch.float8_e4m3fnuz,torch.float8_e4m3fnuz,QuantType.per_1x128,1,1,ck,stage2,16,moe_ck2stages_gemm2_256x16x128x256_1x4_MulABScaleExpertWeightA8W8blkscale_v1_Nswizzle0_Quant4_MulRoutedWeight0_F8_F8_B16,118.871,28.714222222222304,16.67%,47.42,11867.17
170,64,7168,256,256,8,ActivationType.Silu,torch.bfloat16,torch.float8_e4m3fnuz,torch.float8_e4m3fnuz,QuantType.per_1x128,1,1,ck,stage1,16,moe_ck2stages_gemm1_256x16x128x256_1x4_MulABScaleExpertWeightA8W8blkscale_v1_Nswizzle0_Quant4_MulRoutedWeight1_silu_F8_F8_B16,209.1384,29.342000000000034,0.02%,26.95,6745.11
170,64,7168,256,256,8,ActivationType.Silu,torch.bfloat16,torch.float8_e4m3fnuz,torch.float8_e4m3fnuz,QuantType.per_1x128,1,1,ck,stage2,16,moe_ck2stages_gemm2_256x16x128x256_1x4_MulABScaleExpertWeightA8W8blkscale_v1_Nswizzle0_Quant4_MulRoutedWeight0_F8_F8_B16,120.1361,29.342000000000034,16.65%,46.92,11742.2
171,64,7168,256,256,8,ActivationType.Silu,torch.bfloat16,torch.float8_e4m3fnuz,torch.float8_e4m3fnuz,QuantType.per_1x128,1,0,asm,asm_1stage,32,_ZN5aiter47fmoe_bf16_blockscaleFp8_g1u1_vs_silu_1tg_32x128E,356.4175,0.0,0.00%,15.82,3957.89
172,64,7168,256,257,9,ActivationType.Silu,torch.bfloat16,torch.float8_e4m3fnuz,torch.float8_e4m3fnuz,QuantType.per_Token,1,0,asm,asm_1stage,32,_ZN5aiter45fmoe_bf16_pertokenFp8_g1u1_vs_silu_1tg_32x256E,352.6816,0.0,0.00%,17.98,4015.43
173,64,7168,256,257,9,ActivationType.Silu,torch.bfloat16,torch.float8_e4m3fnuz,torch.float8_e4m3fnuz,QuantType.per_1x128,1,0,asm,asm_1stage,32,_ZN5aiter47fmoe_bf16_blockscaleFp8_g1u1_vs_silu_1tg_32x128E,360.0101,0.0,0.00%,17.62,3933.69
174,64,7168,512,256,8,ActivationType.Gelu,torch.bfloat16,torch.bfloat16,torch.bfloat16,QuantType.No,1,0,ck,stage1,32,moe_ck2stages_gemm1_256x32x64x128_1x4_TypeCast_v1_Nswizzle0_Quant0_MulRoutedWeight0_gelu_B16_B16_B16,858.2452,0.0,0.00%,13.14,6570.36
174,64,7168,512,256,8,ActivationType.Gelu,torch.bfloat16,torch.bfloat16,torch.bfloat16,QuantType.No,1,0,ck,stage2,32,moe_ck2stages_gemm2_256x32x64x128_1x4_TypeCastExpertWeight_v1_Nswizzle0_Quant0_MulRoutedWeight1_B16_B16_B16,449.4735,0.0,3.37%,25.08,12545.74
175,64,7168,512,256,8,ActivationType.Gelu,torch.bfloat16,torch.bfloat16,torch.bfloat16,QuantType.No,1,1,ck,stage1,32,moe_ck2stages_gemm1_256x32x64x128_1x4_TypeCastExpertWeight_v1_Nswizzle0_Quant0_MulRoutedWeight1_gelu_B16_B16_B16,857.7965,0.0,0.00%,13.14,6573.8
175,64,7168,512,256,8,ActivationType.Gelu,torch.bfloat16,torch.bfloat16,torch.bfloat16,QuantType.No,1,1,ck,stage2,32,moe_ck2stages_gemm2_256x32x64x64_1x4_TypeCast_v1_Nswizzle0_Quant0_MulRoutedWeight0_B16_B16_B16,448.853,0.0,0.00%,25.12,12563.09
176,64,7168,512,256,8,ActivationType.Gelu,torch.bfloat16,torch.float8_e4m3fnuz,torch.float8_e4m3fnuz,QuantType.per_Tensor,1,0,asm,stage1,16,_ZN5aiter48fmoe_stage1_bf16_pertokenFp8_g1u1_16x512_2tg_pf2E,420.4049,32.4943333333333,0.00%,26.82,6707.7
176,64,7168,512,256,8,ActivationType.Gelu,torch.bfloat16,torch.float8_e4m3fnuz,torch.float8_e4m3fnuz,QuantType.per_Tensor,1,0,ck,stage2,16,moe_ck2stages_gemm2_256x16x128x256_1x4_MulABScaleExpertWeight_v1_Nswizzle0_Quant1_MulRoutedWeight1_F8_F8_B16,229.6735,32.4943333333333,3.34%,49.09,12278.08
177,64,7168,512,256,8,ActivationType.Gelu,torch.bfloat16,torch.float8_e4m3fnuz,torch.float8_e4m3fnuz,QuantType.per_Tensor,1,1,asm,stage1,16,_ZN5aiter53fmoe_stage1_bf16_pertokenFp8_doweight_g1u1_16x512_pf3E,419.6457,31.430777777777863,0.00%,26.87,6719.83
177,64,7168,512,256,8,ActivationType.Gelu,torch.bfloat16,torch.float8_e4m3fnuz,torch.float8_e4m3fnuz,QuantType.per_Tensor,1,1,ck,stage2,16,moe_ck2stages_gemm2_256x16x128x256_1x4_MulABScaleExpertWeight_v1_Nswizzle0_Quant1_MulRoutedWeight0_F8_F8_B16,225.2442,31.430777777777863,0.00%,50.05,12519.52
178,64,7168,512,256,8,ActivationType.Gelu,torch.bfloat16,torch.float8_e4m3fnuz,torch.float8_e4m3fnuz,QuantType.per_Token,1,0,asm,asm_1stage,32,_ZN5aiter48fmoe_bf16_pertokenFp8_g1u1_vs_gelu_1tg_ps_32x512E,666.0564,0.0,0.00%,16.93,4233.8
179,64,7168,512,256,8,ActivationType.Gelu,torch.bfloat16,torch.float8_e4m3fnuz,torch.float8_e4m3fnuz,QuantType.per_Token,1,1,asm,asm_1stage,32,_ZN5aiter50fmoe_bf16_pertokenFp8_g1u1_vs_tkw1_gelu_1tg_32x512E,657.4226,0.0,0.00%,17.15,4289.4
180,64,7168,512,256,8,ActivationType.Silu,torch.bfloat16,torch.bfloat16,torch.bfloat16,QuantType.No,1,1,ck,stage1,32,moe_ck2stages_gemm1_256x32x64x128_1x4_TypeCastExpertWeight_v1_Nswizzle0_Quant0_MulRoutedWeight1_silu_B16_B16_B16,858.3284,0.0,0.00%,13.14,6569.72
180,64,7168,512,256,8,ActivationType.Silu,torch.bfloat16,torch.bfloat16,torch.bfloat16,QuantType.No,1,1,ck,stage2,32,moe_ck2stages_gemm2_256x32x64x128_1x4_TypeCast_v1_Nswizzle0_Quant0_MulRoutedWeight0_B16_B16_B16,448.0509,0.0,0.00%,25.16,12585.58
181,64,7168,512,256,8,ActivationType.Silu,torch.bfloat16,torch.float8_e4m3fnuz,torch.float8_e4m3fnuz,QuantType.per_Tensor,1,0,ck,stage1,16,moe_ck2stages_gemm1_256x16x128x256_1x4_MulABScale_v1_Nswizzle0_Quant1_MulRoutedWeight0_silu_F8_F8_B16,421.222,32.68133333333329,0.00%,26.77,6694.68
181,64,7168,512,256,8,ActivationType.Silu,torch.bfloat16,torch.float8_e4m3fnuz,torch.float8_e4m3fnuz,QuantType.per_Tensor,1,0,ck,stage2,16,moe_ck2stages_gemm2_256x16x128x256_1x4_MulABScaleExpertWeight_v1_Nswizzle0_Quant1_MulRoutedWeight1_F8_F8_B16,224.2761,32.68133333333329,2.87%,50.27,12573.56
182,64,7168,512,256,8,ActivationType.Silu,torch.bfloat16,torch.float8_e4m3fnuz,torch.float8_e4m3fnuz,QuantType.per_Tensor,1,1,ck,stage1,16,moe_ck2stages_gemm1_256x16x128x256_1x4_MulABScale_v1_Nswizzle0_Quant1_MulRoutedWeight1_silu_F8_F8_B16,420.6856,32.24111111111115,0.00%,26.8,6703.22
182,64,7168,512,256,8,ActivationType.Silu,torch.bfloat16,torch.float8_e4m3fnuz,torch.float8_e4m3fnuz,QuantType.per_Tensor,1,1,ck,stage2,16,moe_ck2stages_gemm2_256x16x128x256_1x4_MulABScaleExpertWeight_v1_Nswizzle0_Quant1_MulRoutedWeight0_F8_F8_B16,220.2999,32.24111111111115,0.00%,51.18,12800.5
183,64,7168,512,256,8,ActivationType.Silu,torch.bfloat16,torch.float8_e4m3fnuz,torch.float8_e4m3fnuz,QuantType.per_Token,1,0,asm,asm_1stage,32,_ZN5aiter45fmoe_bf16_pertokenFp8_g1u1_vs_silu_1tg_32x512E,664.038,0.0,0.00%,16.98,4246.67
184,64,7168,512,256,8,ActivationType.Silu,torch.bfloat16,torch.float8_e4m3fnuz,torch.float8_e4m3fnuz,QuantType.per_Token,1,1,asm,asm_1stage,32,_ZN5aiter53fmoe_bf16_pertokenFp8_g1u1_vs_tkw1_silu_1tg_ps_32x512E,664.8533,0.0,0.00%,16.96,4241.46
185,64,7168,512,256,8,ActivationType.Silu,torch.bfloat16,torch.bfloat16,torch.bfloat16,QuantType.No,1,0,ck,stage1,32,moe_ck2stages_gemm1_256x32x64x128_1x4_TypeCast_v1_Nswizzle0_Quant0_MulRoutedWeight0_silu_B16_B16_B16,857.7476,0.0,0.00%,13.14,6574.17
185,64,7168,512,256,8,ActivationType.Silu,torch.bfloat16,torch.bfloat16,torch.bfloat16,QuantType.No,1,0,ck,stage2,32,moe_ck2stages_gemm2_256x32x64x128_1x4_TypeCastExpertWeight_v1_Nswizzle0_Quant0_MulRoutedWeight1_B16_B16_B16,450.7521,0.0,2.83%,25.01,12510.16
186,64,7168,512,256,8,ActivationType.Gelu,torch.bfloat16,torch.float8_e4m3fnuz,torch.float8_e4m3fnuz,QuantType.per_1x128,1,0,asm,stage1,16,_ZN5aiter59fmoe_stage1_bf16_pertokenFp8_blockscale_g1u1_16x512_2tg_pf2E,416.6384,32.409111111111166,15.04%,27.06,6768.34
186,64,7168,512,256,8,ActivationType.Gelu,torch.bfloat16,torch.float8_e4m3fnuz,torch.float8_e4m3fnuz,QuantType.per_1x128,1,0,ck,stage2,16,moe_ck2stages_gemm2_256x16x128x256_1x4_MulABScaleExpertWeightA8W8blkscale_v1_Nswizzle0_Quant4_MulRoutedWeight1_F8_F8_B16,228.291,32.409111111111166,15.60%,49.39,12352.43
187,64,7168,512,256,8,ActivationType.Silu,torch.bfloat16,torch.float8_e4m3fnuz,torch.float8_e4m3fnuz,QuantType.per_1x128,1,0,asm,stage1,16,_ZN5aiter55fmoe_stage1_bf16_pertokenFp8_blockscale_g1u1_16x512_pf3E,415.8564,33.922222222222324,14.79%,27.11,6781.06
187,64,7168,512,256,8,ActivationType.Silu,torch.bfloat16,torch.float8_e4m3fnuz,torch.float8_e4m3fnuz,QuantType.per_1x128,1,0,ck,stage2,16,moe_ck2stages_gemm2_256x16x128x256_1x4_MulABScaleExpertWeightA8W8blkscale_v1_Nswizzle0_Quant4_MulRoutedWeight1_F8_F8_B16,225.1206,33.922222222222324,15.61%,50.08,12526.39
188,64,7168,512,256,8,ActivationType.Gelu,torch.bfloat16,torch.float8_e4m3fnuz,torch.float8_e4m3fnuz,QuantType.per_1x128,1,1,ck,stage1,16,moe_ck2stages_gemm1_256x16x128x256_1x4_MulABScaleExpertWeightA8W8blkscale_v1_Nswizzle0_Quant4_MulRoutedWeight1_gelu_F8_F8_B16,428.2715,32.53322222222235,0.01%,26.33,6584.49
188,64,7168,512,256,8,ActivationType.Gelu,torch.bfloat16,torch.float8_e4m3fnuz,torch.float8_e4m3fnuz,QuantType.per_1x128,1,1,ck,stage2,16,moe_ck2stages_gemm2_256x16x128x256_1x4_MulABScaleExpertWeightA8W8blkscale_v1_Nswizzle0_Quant4_MulRoutedWeight0_F8_F8_B16,228.1536,32.53322222222235,16.73%,49.42,12359.87
189,64,7168,512,256,8,ActivationType.Silu,torch.bfloat16,torch.float8_e4m3fnuz,torch.float8_e4m3fnuz,QuantType.per_1x128,1,1,ck,stage1,16,moe_ck2stages_gemm1_256x16x128x256_1x4_MulABScaleExpertWeightA8W8blkscale_v1_Nswizzle0_Quant4_MulRoutedWeight1_silu_F8_F8_B16,425.0146,31.9462222222222,0.01%,26.53,6634.95
189,64,7168,512,256,8,ActivationType.Silu,torch.bfloat16,torch.float8_e4m3fnuz,torch.float8_e4m3fnuz,QuantType.per_1x128,1,1,ck,stage2,16,moe_ck2stages_gemm2_128x16x128x128_1x2_MulABScaleExpertWeightA8W8blkscale_v1_Nswizzle0_Quant4_MulRoutedWeight0_F8_F8_B16,223.4573,31.9462222222222,16.73%,50.45,12619.63
190,64,7168,2048,33,10,ActivationType.Silu,torch.bfloat16,torch.float8_e4m3fnuz,torch.float8_e4m3fnuz,QuantType.per_1x128,1,0,asm,asm_1stage,32,_ZN5aiter50fmoe_bf16_blockscaleFp8_g1u1_vs_silu_1tg_ps_32x256E,449.4438,0.0,0.00%,125.42,3236.67
191,64,7168,2048,33,10,ActivationType.Silu,torch.bfloat16,torch.float8_e4m3fnuz,torch.float8_e4m3fnuz,QuantType.per_Token,1,0,asm,asm_1stage,32,_ZN5aiter45fmoe_bf16_pertokenFp8_g1u1_vs_silu_1tg_32x512E,407.2594,0.0,0.00%,138.42,3571.93
192,128,2048,192,128,8,ActivationType.Silu,torch.bfloat16,torch.bfloat16,torch.bfloat16,QuantType.No,1,0,ck,stage1,32,moe_ck2stages_gemm1_256x32x64x64_1x4_TypeCast_v1_Nswizzle0_Quant0_MulRoutedWeight0_silu_B16_B16_B16,57.8739,0.0,0.00%,41.74,5236.19
192,128,2048,192,128,8,ActivationType.Silu,torch.bfloat16,torch.bfloat16,torch.bfloat16,QuantType.No,1,0,ck,stage2,32,moe_ck2stages_gemm2_256x32x64x64_1x4_TypeCastExpertWeight_v1_Nswizzle0_Quant0_MulRoutedWeight1_B16_B16_B16,36.4905,0.0,0.00%,66.21,8304.59
193,128,2048,192,128,8,ActivationType.Silu,torch.bfloat16,torch.bfloat16,torch.bfloat16,QuantType.No,1,1,ck,stage1,32,moe_ck2stages_gemm1_256x32x64x64_1x4_TypeCastExpertWeight_v1_Nswizzle0_Quant0_MulRoutedWeight1_silu_B16_B16_B16,59.1309,0.0,0.00%,40.86,5124.87
193,128,2048,192,128,8,ActivationType.Silu,torch.bfloat16,torch.bfloat16,torch.bfloat16,QuantType.No,1,1,ck,stage2,32,moe_ck2stages_gemm2_256x32x64x64_1x4_TypeCast_v1_Nswizzle0_Quant0_MulRoutedWeight0_B16_B16_B16,35.4275,0.0,0.00%,68.19,8553.76
194,128,2048,192,128,8,ActivationType.Gelu,torch.bfloat16,torch.bfloat16,torch.bfloat16,QuantType.No,1,0,ck,stage1,32,moe_ck2stages_gemm1_256x32x64x64_1x4_TypeCast_v1_Nswizzle0_Quant0_MulRoutedWeight0_gelu_B16_B16_B16,57.985,0.0,0.00%,41.66,5226.15
194,128,2048,192,128,8,ActivationType.Gelu,torch.bfloat16,torch.bfloat16,torch.bfloat16,QuantType.No,1,0,ck,stage2,32,moe_ck2stages_gemm2_256x32x64x64_1x4_TypeCastExpertWeight_v1_Nswizzle0_Quant0_MulRoutedWeight1_B16_B16_B16,36.2657,0.0,0.00%,66.62,8356.06
195,128,2048,192,128,8,ActivationType.Gelu,torch.bfloat16,torch.bfloat16,torch.bfloat16,QuantType.No,1,1,ck,stage1,32,moe_ck2stages_gemm1_256x32x64x64_1x4_TypeCastExpertWeight_v1_Nswizzle0_Quant0_MulRoutedWeight1_gelu_B16_B16_B16,58.3161,0.0,0.00%,41.43,5196.48
195,128,2048,192,128,8,ActivationType.Gelu,torch.bfloat16,torch.bfloat16,torch.bfloat16,QuantType.No,1,1,ck,stage2,32,moe_ck2stages_gemm2_256x32x64x64_1x4_TypeCast_v1_Nswizzle0_Quant0_MulRoutedWeight0_B16_B16_B16,35.5635,0.0,0.00%,67.93,8521.05
196,128,4096,192,128,8,ActivationType.Silu,torch.bfloat16,torch.bfloat16,torch.bfloat16,QuantType.No,1,0,ck,stage1,32,moe_ck2stages_gemm1_256x32x64x128_1x4_TypeCast_v1_Nswizzle0_Quant0_MulRoutedWeight0_silu_B16_B16_B16,107.7664,0.0,0.00%,44.84,5623.99
196,128,4096,192,128,8,ActivationType.Silu,torch.bfloat16,torch.bfloat16,torch.bfloat16,QuantType.No,1,0,ck,stage2,32,moe_ck2stages_gemm2_256x32x64x64_1x4_TypeCastExpertWeight_v1_Nswizzle0_Quant0_MulRoutedWeight1_B16_B16_B16,61.8782,0.0,0.08%,78.09,9794.68
197,128,4096,192,128,8,ActivationType.Silu,torch.bfloat16,torch.bfloat16,torch.bfloat16,QuantType.No,1,1,ck,stage1,32,moe_ck2stages_gemm1_256x32x64x128_1x4_TypeCastExpertWeight_v1_Nswizzle0_Quant0_MulRoutedWeight1_silu_B16_B16_B16,107.7484,0.0,0.00%,44.84,5624.93
197,128,4096,192,128,8,ActivationType.Silu,torch.bfloat16,torch.bfloat16,torch.bfloat16,QuantType.No,1,1,ck,stage2,32,moe_ck2stages_gemm2_256x32x64x64_1x4_TypeCast_v1_Nswizzle0_Quant0_MulRoutedWeight0_B16_B16_B16,60.7984,0.0,0.00%,79.47,9968.63
198,128,4096,192,128,8,ActivationType.Gelu,torch.bfloat16,torch.bfloat16,torch.bfloat16,QuantType.No,1,0,ck,stage1,32,moe_ck2stages_gemm1_256x32x64x64_1x4_TypeCast_v1_Nswizzle0_Quant0_MulRoutedWeight0_gelu_B16_B16_B16,106.9357,0.0,0.00%,45.18,5667.68
198,128,4096,192,128,8,ActivationType.Gelu,torch.bfloat16,torch.bfloat16,torch.bfloat16,QuantType.No,1,0,ck,stage2,32,moe_ck2stages_gemm2_256x32x64x64_1x4_TypeCastExpertWeight_v1_Nswizzle0_Quant0_MulRoutedWeight1_B16_B16_B16,61.8443,0.0,0.12%,78.13,9800.05
199,128,4096,192,128,8,ActivationType.Gelu,torch.bfloat16,torch.bfloat16,torch.bfloat16,QuantType.No,1,1,ck,stage1,32,moe_ck2stages_gemm1_256x32x64x64_1x4_TypeCastExpertWeight_v1_Nswizzle0_Quant0_MulRoutedWeight1_gelu_B16_B16_B16,106.7835,0.0,0.00%,45.25,5675.75
199,128,4096,192,128,8,ActivationType.Gelu,torch.bfloat16,torch.bfloat16,torch.bfloat16,QuantType.No,1,1,ck,stage2,32,moe_ck2stages_gemm2_256x32x64x64_1x4_TypeCast_v1_Nswizzle0_Quant0_MulRoutedWeight0_B16_B16_B16,60.7756,0.0,0.00%,79.5,9972.37
200,128,4096,384,128,8,ActivationType.Gelu,torch.bfloat16,torch.bfloat16,torch.bfloat16,QuantType.No,1,0,ck,stage1,32,moe_ck2stages_gemm1_256x32x64x128_1x4_TypeCast_v1_Nswizzle0_Quant0_MulRoutedWeight0_gelu_B16_B16_B16,213.3882,0.0,0.00%,45.29,5670.68
200,128,4096,384,128,8,ActivationType.Gelu,torch.bfloat16,torch.bfloat16,torch.bfloat16,QuantType.No,1,0,ck,stage2,32,moe_ck2stages_gemm2_256x32x64x64_1x4_TypeCastExpertWeight_v1_Nswizzle0_Quant0_MulRoutedWeight1_B16_B16_B16,119.4523,0.0,0.52%,80.9,10130.04
201,128,4096,384,128,8,ActivationType.Gelu,torch.bfloat16,torch.bfloat16,torch.bfloat16,QuantType.No,1,1,ck,stage1,32,moe_ck2stages_gemm1_256x32x64x64_1x4_TypeCastExpertWeight_v1_Nswizzle0_Quant0_MulRoutedWeight1_gelu_B16_B16_B16,212.9981,0.0,0.00%,45.37,5681.07
201,128,4096,384,128,8,ActivationType.Gelu,torch.bfloat16,torch.bfloat16,torch.bfloat16,QuantType.No,1,1,ck,stage2,32,moe_ck2stages_gemm2_256x32x64x128_1x4_TypeCast_v1_Nswizzle0_Quant0_MulRoutedWeight0_B16_B16_B16,118.5751,0.0,0.00%,81.5,10204.98
202,128,4096,384,128,8,ActivationType.Silu,torch.bfloat16,torch.bfloat16,torch.bfloat16,QuantType.No,1,0,ck,stage1,32,moe_ck2stages_gemm1_256x32x64x64_1x4_TypeCast_v1_Nswizzle0_Quant0_MulRoutedWeight0_silu_B16_B16_B16,213.8838,0.0,0.00%,45.18,5657.54
202,128,4096,384,128,8,ActivationType.Silu,torch.bfloat16,torch.bfloat16,torch.bfloat16,QuantType.No,1,0,ck,stage2,32,moe_ck2stages_gemm2_256x32x64x128_1x4_TypeCastExpertWeight_v1_Nswizzle0_Quant0_MulRoutedWeight1_B16_B16_B16,119.1808,0.0,0.37%,81.08,10153.12
203,128,4096,384,128,8,ActivationType.Silu,torch.bfloat16,torch.bfloat16,torch.bfloat16,QuantType.No,1,1,ck,stage1,32,moe_ck2stages_gemm1_256x32x64x64_1x4_TypeCastExpertWeight_v1_Nswizzle0_Quant0_MulRoutedWeight1_silu_B16_B16_B16,214.82,0.0,0.00%,44.98,5632.89
203,128,4096,384,128,8,ActivationType.Silu,torch.bfloat16,torch.bfloat16,torch.bfloat16,QuantType.No,1,1,ck,stage2,32,moe_ck2stages_gemm2_256x32x64x128_1x4_TypeCast_v1_Nswizzle0_Quant0_MulRoutedWeight0_B16_B16_B16,119.2088,0.0,0.00%,81.07,10150.73
204,128,4096,384,128,8,ActivationType.Silu,torch.bfloat16,torch.float8_e4m3fnuz,torch.float8_e4m3fnuz,QuantType.per_Tensor,1,0,ck,stage1,32,moe_ck2stages_gemm1_256x32x64x256_1x4_MulABScale_v1_Nswizzle0_Quant1_MulRoutedWeight0_silu_F8_F8_B16,111.4872,32.31200000000002,0.00%,86.68,5431.59
204,128,4096,384,128,8,ActivationType.Silu,torch.bfloat16,torch.float8_e4m3fnuz,torch.float8_e4m3fnuz,QuantType.per_Tensor,1,0,ck,stage2,32,moe_ck2stages_gemm2_256x32x64x128_1x4_MulABScaleExpertWeight_v1_Nswizzle0_Quant1_MulRoutedWeight1_F8_F8_B16,62.7881,32.31200000000002,0.37%,153.91,9644.39
205,128,4096,384,128,8,ActivationType.Silu,torch.bfloat16,torch.float8_e4m3fnuz,torch.float8_e4m3fnuz,QuantType.per_Tensor,1,1,ck,stage1,32,moe_ck2stages_gemm1_256x32x64x256_1x4_MulABScale_v1_Nswizzle0_Quant1_MulRoutedWeight1_silu_F8_F8_B16,111.6797,33.40322222222218,0.00%,86.53,5422.23
205,128,4096,384,128,8,ActivationType.Silu,torch.bfloat16,torch.float8_e4m3fnuz,torch.float8_e4m3fnuz,QuantType.per_Tensor,1,1,ck,stage2,32,moe_ck2stages_gemm2_256x32x64x128_1x4_MulABScaleExpertWeight_v1_Nswizzle0_Quant1_MulRoutedWeight0_F8_F8_B16,62.5219,33.40322222222218,0.00%,154.56,9685.45
206,128,4096,384,128,8,ActivationType.Silu,torch.bfloat16,torch.float8_e4m3fnuz,torch.float8_e4m3fnuz,QuantType.per_Token,1,0,asm,asm_1stage,32,_ZN5aiter45fmoe_bf16_pertokenFp8_g1u1_vs_silu_1tg_32x384E,169.414,0.0,0.00%,57.04,3574.4
207,128,4096,384,128,8,ActivationType.Silu,torch.bfloat16,torch.float8_e4m3fnuz,torch.float8_e4m3fnuz,QuantType.per_Token,1,1,asm,asm_1stage,32,_ZN5aiter50fmoe_bf16_pertokenFp8_g1u1_vs_tkw1_silu_1tg_32x384E,170.0984,0.0,0.00%,56.81,3560.01
208,128,4096,384,128,8,ActivationType.Gelu,torch.bfloat16,torch.float8_e4m3fnuz,torch.float8_e4m3fnuz,QuantType.per_Tensor,1,0,ck,stage1,32,moe_ck2stages_gemm1_256x32x64x128_1x4_MulABScale_v1_Nswizzle0_Quant1_MulRoutedWeight0_gelu_F8_F8_B16,110.0652,33.2513333333333,0.00%,87.8,5501.76
208,128,4096,384,128,8,ActivationType.Gelu,torch.bfloat16,torch.float8_e4m3fnuz,torch.float8_e4m3fnuz,QuantType.per_Tensor,1,0,ck,stage2,32,moe_ck2stages_gemm2_256x32x64x128_1x4_MulABScaleExpertWeight_v1_Nswizzle0_Quant1_MulRoutedWeight1_F8_F8_B16,62.6045,33.2513333333333,0.51%,154.36,9672.67
209,128,4096,384,128,8,ActivationType.Gelu,torch.bfloat16,torch.float8_e4m3fnuz,torch.float8_e4m3fnuz,QuantType.per_Tensor,1,1,ck,stage1,32,moe_ck2stages_gemm1_256x32x64x128_1x4_MulABScale_v1_Nswizzle0_Quant1_MulRoutedWeight1_gelu_F8_F8_B16,111.0748,33.96799999999999,0.00%,87.0,5451.76
209,128,4096,384,128,8,ActivationType.Gelu,torch.bfloat16,torch.float8_e4m3fnuz,torch.float8_e4m3fnuz,QuantType.per_Tensor,1,1,ck,stage2,32,moe_ck2stages_gemm2_256x32x64x128_1x4_MulABScaleExpertWeight_v1_Nswizzle0_Quant1_MulRoutedWeight0_F8_F8_B16,62.5452,33.96799999999999,0.00%,154.51,9681.84
210,128,4096,384,128,8,ActivationType.Gelu,torch.bfloat16,torch.float8_e4m3fnuz,torch.float8_e4m3fnuz,QuantType.per_Token,1,0,asm,asm_1stage,32,_ZN5aiter45fmoe_bf16_pertokenFp8_g1u1_vs_gelu_1tg_32x384E,168.7507,0.0,0.00%,57.27,3588.45
211,128,4096,384,128,8,ActivationType.Gelu,torch.bfloat16,torch.float8_e4m3fnuz,torch.float8_e4m3fnuz,QuantType.per_Token,1,1,asm,asm_1stage,32,_ZN5aiter50fmoe_bf16_pertokenFp8_g1u1_vs_tkw1_gelu_1tg_32x384E,170.2626,0.0,0.00%,56.76,3556.58
212,128,4096,384,128,8,ActivationType.Silu,torch.bfloat16,torch.float8_e4m3fnuz,torch.float8_e4m3fnuz,QuantType.per_1x128,1,0,asm,asm_1stage,32,_ZN5aiter47fmoe_bf16_blockscaleFp8_g1u1_vs_silu_1tg_32x128E,201.0722,0.0,0.00%,48.06,3011.62
213,128,4096,384,128,8,ActivationType.Gelu,torch.bfloat16,torch.float8_e4m3fnuz,torch.float8_e4m3fnuz,QuantType.per_1x128,1,0,asm,asm_1stage,32,_ZN5aiter47fmoe_bf16_blockscaleFp8_g1u1_vs_gelu_1tg_32x128E,201.1254,0.0,0.13%,48.05,3010.82
214,128,4096,384,128,8,ActivationType.Silu,torch.bfloat16,torch.float8_e4m3fnuz,torch.float8_e4m3fnuz,QuantType.per_1x128,1,1,ck,stage1,16,moe_ck2stages_gemm1_128x16x128x128_1x2_MulABScaleExpertWeightA8W8blkscale_v1_Nswizzle0_Quant4_MulRoutedWeight1_silu_F8_F8_B16,111.8605,36.77511111111115,0.01%,86.39,5413.46
214,128,4096,384,128,8,ActivationType.Silu,torch.bfloat16,torch.float8_e4m3fnuz,torch.float8_e4m3fnuz,QuantType.per_1x128,1,1,ck,stage2,16,moe_ck2stages_gemm2_128x16x128x128_1x2_MulABScaleExpertWeightA8W8blkscale_v1_Nswizzle0_Quant4_MulRoutedWeight0_F8_F8_B16,61.9218,36.77511111111115,16.58%,156.06,9779.31
215,128,4096,384,128,8,ActivationType.Gelu,torch.bfloat16,torch.float8_e4m3fnuz,torch.float8_e4m3fnuz,QuantType.per_1x128,1,1,ck,stage1,16,moe_ck2stages_gemm1_128x16x128x128_1x2_MulABScaleExpertWeightA8W8blkscale_v1_Nswizzle0_Quant4_MulRoutedWeight1_gelu_F8_F8_B16,111.2975,36.6592222222221,0.01%,86.83,5440.85
215,128,4096,384,128,8,ActivationType.Gelu,torch.bfloat16,torch.float8_e4m3fnuz,torch.float8_e4m3fnuz,QuantType.per_1x128,1,1,ck,stage2,16,moe_ck2stages_gemm2_128x16x128x128_1x2_MulABScaleExpertWeightA8W8blkscale_v1_Nswizzle0_Quant4_MulRoutedWeight0_F8_F8_B16,62.8045,36.6592222222221,16.69%,153.87,9641.87
216,128,7168,256,256,8,ActivationType.Gelu,torch.bfloat16,torch.bfloat16,torch.bfloat16,QuantType.No,1,0,ck,stage1,32,moe_ck2stages_gemm1_256x32x64x64_1x4_TypeCast_v1_Nswizzle0_Quant0_MulRoutedWeight0_gelu_B16_B16_B16,495.685,0.0,0.00%,22.74,5693.62
216,128,7168,256,256,8,ActivationType.Gelu,torch.bfloat16,torch.bfloat16,torch.bfloat16,QuantType.No,1,0,ck,stage2,32,moe_ck2stages_gemm2_256x32x64x128_1x4_TypeCastExpertWeight_v1_Nswizzle0_Quant0_MulRoutedWeight1_B16_B16_B16,265.6012,0.0,1.63%,42.45,10625.86
217,128,7168,256,256,8,ActivationType.Gelu,torch.bfloat16,torch.bfloat16,torch.bfloat16,QuantType.No,1,1,ck,stage1,32,moe_ck2stages_gemm1_256x32x64x128_1x4_TypeCastExpertWeight_v1_Nswizzle0_Quant0_MulRoutedWeight1_gelu_B16_B16_B16,490.5081,0.0,0.00%,22.98,5753.71
217,128,7168,256,256,8,ActivationType.Gelu,torch.bfloat16,torch.bfloat16,torch.bfloat16,QuantType.No,1,1,ck,stage2,32,moe_ck2stages_gemm2_256x32x64x64_1x4_TypeCast_v1_Nswizzle0_Quant0_MulRoutedWeight0_B16_B16_B16,267.1771,0.0,0.00%,42.2,10563.19
218,128,7168,256,256,8,ActivationType.Gelu,torch.bfloat16,torch.float8_e4m3fnuz,torch.float8_e4m3fnuz,QuantType.per_Tensor,1,0,asm,stage1,16,_ZN5aiter48fmoe_stage1_bf16_pertokenFp8_g1u1_16x128_4tg_pf2E,238.4482,32.21888888888887,0.05%,47.28,5921.78
218,128,7168,256,256,8,ActivationType.Gelu,torch.bfloat16,torch.float8_e4m3fnuz,torch.float8_e4m3fnuz,QuantType.per_Tensor,1,0,ck,stage2,16,moe_ck2stages_gemm2_256x16x128x256_1x4_MulABScaleExpertWeight_v1_Nswizzle0_Quant1_MulRoutedWeight1_F8_F8_B16,137.0519,32.21888888888887,1.64%,82.26,10302.95
219,128,7168,256,256,8,ActivationType.Gelu,torch.bfloat16,torch.float8_e4m3fnuz,torch.float8_e4m3fnuz,QuantType.per_Tensor,1,1,asm,stage1,16,_ZN5aiter57fmoe_stage1_bf16_pertokenFp8_doweight_g1u1_16x128_4tg_pf2E,238.4333,32.38777777777777,0.00%,47.28,5922.15
219,128,7168,256,256,8,ActivationType.Gelu,torch.bfloat16,torch.float8_e4m3fnuz,torch.float8_e4m3fnuz,QuantType.per_Tensor,1,1,ck,stage2,16,moe_ck2stages_gemm2_256x16x128x256_1x4_MulABScaleExpertWeight_v1_Nswizzle0_Quant1_MulRoutedWeight0_F8_F8_B16,136.1928,32.38777777777777,0.00%,82.78,10367.94
220,128,7168,256,256,8,ActivationType.Gelu,torch.bfloat16,torch.float8_e4m3fnuz,torch.float8_e4m3fnuz,QuantType.per_Token,1,0,asm,asm_1stage,32,_ZN5aiter45fmoe_bf16_pertokenFp8_g1u1_vs_gelu_1tg_32x256E,387.5989,0.0,0.00%,29.09,3643.04
221,128,7168,256,256,8,ActivationType.Gelu,torch.bfloat16,torch.float8_e4m3fnuz,torch.float8_e4m3fnuz,QuantType.per_Token,1,1,asm,asm_1stage,32,_ZN5aiter50fmoe_bf16_pertokenFp8_g1u1_vs_tkw1_gelu_1tg_32x256E,390.4291,0.0,0.00%,28.88,3616.63
222,128,7168,256,256,8,ActivationType.Silu,torch.bfloat16,torch.bfloat16,torch.bfloat16,QuantType.No,1,0,ck,stage1,32,moe_ck2stages_gemm1_256x32x64x128_1x4_TypeCast_v1_Nswizzle0_Quant0_MulRoutedWeight0_silu_B16_B16_B16,486.3547,0.0,0.00%,23.18,5802.85
222,128,7168,256,256,8,ActivationType.Silu,torch.bfloat16,torch.bfloat16,torch.bfloat16,QuantType.No,1,0,ck,stage2,32,moe_ck2stages_gemm2_256x32x64x64_1x4_TypeCastExpertWeight_v1_Nswizzle0_Quant0_MulRoutedWeight1_B16_B16_B16,265.7743,0.0,1.32%,42.42,10618.94
223,128,7168,256,256,8,ActivationType.Silu,torch.bfloat16,torch.bfloat16,torch.bfloat16,QuantType.No,1,1,ck,stage1,32,moe_ck2stages_gemm1_256x32x64x128_1x4_TypeCastExpertWeight_v1_Nswizzle0_Quant0_MulRoutedWeight1_silu_B16_B16_B16,489.9208,0.0,0.00%,23.01,5760.61
223,128,7168,256,256,8,ActivationType.Silu,torch.bfloat16,torch.bfloat16,torch.bfloat16,QuantType.No,1,1,ck,stage2,32,moe_ck2stages_gemm2_256x32x64x128_1x4_TypeCast_v1_Nswizzle0_Quant0_MulRoutedWeight0_B16_B16_B16,265.7915,0.0,0.00%,42.42,10618.26
224,128,7168,256,256,8,ActivationType.Silu,torch.bfloat16,torch.float8_e4m3fnuz,torch.float8_e4m3fnuz,QuantType.per_Tensor,1,0,asm,stage1,16,_ZN5aiter47fmoe_stage1_bf16_pertokenFp8_g1u1_16x64_6tg_pf2E,241.7324,31.71977777777778,0.00%,46.64,5841.33
224,128,7168,256,256,8,ActivationType.Silu,torch.bfloat16,torch.float8_e4m3fnuz,torch.float8_e4m3fnuz,QuantType.per_Tensor,1,0,ck,stage2,16,moe_ck2stages_gemm2_256x16x128x256_1x4_MulABScaleExpertWeight_v1_Nswizzle0_Quant1_MulRoutedWeight1_F8_F8_B16,138.5693,31.71977777777778,1.28%,81.36,10190.13
225,128,7168,256,256,8,ActivationType.Silu,torch.bfloat16,torch.float8_e4m3fnuz,torch.float8_e4m3fnuz,QuantType.per_Tensor,1,1,ck,stage1,16,moe_ck2stages_gemm1_256x16x128x256_1x4_MulABScale_v1_Nswizzle0_Quant1_MulRoutedWeight1_silu_F8_F8_B16,244.21,31.81811111111111,0.00%,46.17,5782.07
225,128,7168,256,256,8,ActivationType.Silu,torch.bfloat16,torch.float8_e4m3fnuz,torch.float8_e4m3fnuz,QuantType.per_Tensor,1,1,ck,stage2,16,moe_ck2stages_gemm2_256x16x128x256_1x4_MulABScaleExpertWeight_v1_Nswizzle0_Quant1_MulRoutedWeight0_F8_F8_B16,134.7285,31.81811111111111,0.00%,83.68,10480.62
226,128,7168,256,256,8,ActivationType.Silu,torch.bfloat16,torch.float8_e4m3fnuz,torch.float8_e4m3fnuz,QuantType.per_Token,1,0,asm,asm_1stage,32,_ZN5aiter48fmoe_bf16_pertokenFp8_g1u1_vs_silu_1tg_ps_32x256E,390.5501,0.0,0.00%,28.87,3615.51
227,128,7168,256,256,8,ActivationType.Silu,torch.bfloat16,torch.float8_e4m3fnuz,torch.float8_e4m3fnuz,QuantType.per_Token,1,1,asm,asm_1stage,32,_ZN5aiter53fmoe_bf16_pertokenFp8_g1u1_vs_tkw1_silu_1tg_ps_32x256E,388.5663,0.0,0.00%,29.02,3633.97
228,128,7168,256,256,8,ActivationType.Gelu,torch.bfloat16,torch.float8_e4m3fnuz,torch.float8_e4m3fnuz,QuantType.per_1x128,1,0,asm,asm_1stage,32,_ZN5aiter47fmoe_bf16_blockscaleFp8_g1u1_vs_gelu_1tg_32x128E,398.6642,0.0,2.07%,28.28,3541.92
229,128,7168,256,256,8,ActivationType.Gelu,torch.bfloat16,torch.float8_e4m3fnuz,torch.float8_e4m3fnuz,QuantType.per_1x128,1,1,ck,stage1,16,moe_ck2stages_gemm1_256x16x128x256_1x4_MulABScaleExpertWeightA8W8blkscale_v1_Nswizzle0_Quant4_MulRoutedWeight1_gelu_F8_F8_B16,244.3945,31.49188888888891,0.01%,46.13,5777.7
229,128,7168,256,256,8,ActivationType.Gelu,torch.bfloat16,torch.float8_e4m3fnuz,torch.float8_e4m3fnuz,QuantType.per_1x128,1,1,ck,stage2,16,moe_ck2stages_gemm2_128x16x128x128_1x2_MulABScaleExpertWeightA8W8blkscale_v1_Nswizzle0_Quant4_MulRoutedWeight0_F8_F8_B16,136.8132,31.49188888888891,16.65%,82.41,10320.92
230,128,7168,256,256,8,ActivationType.Silu,torch.bfloat16,torch.float8_e4m3fnuz,torch.float8_e4m3fnuz,QuantType.per_1x128,1,1,ck,stage1,16,moe_ck2stages_gemm1_256x16x128x256_1x4_MulABScaleExpertWeightA8W8blkscale_v1_Nswizzle0_Quant4_MulRoutedWeight1_silu_F8_F8_B16,244.5479,33.40622222222225,0.02%,46.1,5774.08
230,128,7168,256,256,8,ActivationType.Silu,torch.bfloat16,torch.float8_e4m3fnuz,torch.float8_e4m3fnuz,QuantType.per_1x128,1,1,ck,stage2,16,moe_ck2stages_gemm2_128x16x128x128_1x2_MulABScaleExpertWeightA8W8blkscale_v1_Nswizzle0_Quant4_MulRoutedWeight0_F8_F8_B16,137.9778,33.40622222222225,16.68%,81.71,10233.81
231,128,7168,256,256,8,ActivationType.Silu,torch.bfloat16,torch.float8_e4m3fnuz,torch.float8_e4m3fnuz,QuantType.per_1x128,1,0,asm,asm_1stage,32,_ZN5aiter47fmoe_bf16_blockscaleFp8_g1u1_vs_silu_1tg_32x128E,397.3418,0.0,0.00%,28.37,3553.71
232,128,7168,256,257,9,ActivationType.Silu,torch.bfloat16,torch.float8_e4m3fnuz,torch.float8_e4m3fnuz,QuantType.per_Token,1,0,asm,asm_1stage,32,_ZN5aiter45fmoe_bf16_pertokenFp8_g1u1_vs_silu_1tg_32x256E,392.2254,0.0,0.00%,32.34,3614.1
233,128,7168,256,257,9,ActivationType.Silu,torch.bfloat16,torch.float8_e4m3fnuz,torch.float8_e4m3fnuz,QuantType.per_1x128,1,0,asm,asm_1stage,32,_ZN5aiter47fmoe_bf16_blockscaleFp8_g1u1_vs_silu_1tg_32x128E,400.7741,0.0,0.00%,31.65,3537.01
234,128,7168,512,256,8,ActivationType.Gelu,torch.bfloat16,torch.bfloat16,torch.bfloat16,QuantType.No,1,0,ck,stage1,32,moe_ck2stages_gemm1_256x32x64x128_1x4_TypeCast_v1_Nswizzle0_Quant0_MulRoutedWeight0_gelu_B16_B16_B16,970.3182,0.0,0.00%,23.24,5813.37
234,128,7168,512,256,8,ActivationType.Gelu,torch.bfloat16,torch.bfloat16,torch.bfloat16,QuantType.No,1,0,ck,stage2,32,moe_ck2stages_gemm2_256x32x64x128_1x4_TypeCastExpertWeight_v1_Nswizzle0_Quant0_MulRoutedWeight1_B16_B16_B16,514.7343,0.0,3.35%,43.81,10958.69
235,128,7168,512,256,8,ActivationType.Gelu,torch.bfloat16,torch.bfloat16,torch.bfloat16,QuantType.No,1,1,ck,stage1,32,moe_ck2stages_gemm1_256x32x64x128_1x4_TypeCastExpertWeight_v1_Nswizzle0_Quant0_MulRoutedWeight1_gelu_B16_B16_B16,970.0338,0.0,0.00%,23.25,5815.07
235,128,7168,512,256,8,ActivationType.Gelu,torch.bfloat16,torch.bfloat16,torch.bfloat16,QuantType.No,1,1,ck,stage2,32,moe_ck2stages_gemm2_256x32x64x128_1x4_TypeCast_v1_Nswizzle0_Quant0_MulRoutedWeight0_B16_B16_B16,513.706,0.0,0.00%,43.89,10980.63
236,128,7168,512,256,8,ActivationType.Gelu,torch.bfloat16,torch.float8_e4m3fnuz,torch.float8_e4m3fnuz,QuantType.per_Tensor,1,0,asm,stage1,16,_ZN5aiter44fmoe_stage1_bf16_pertokenFp8_g1u1_16x512_pf3E,477.5428,34.230333333333334,0.00%,47.22,5908.0
236,128,7168,512,256,8,ActivationType.Gelu,torch.bfloat16,torch.float8_e4m3fnuz,torch.float8_e4m3fnuz,QuantType.per_Tensor,1,0,ck,stage2,16,moe_ck2stages_gemm2_256x16x128x256_1x4_MulABScaleExpertWeight_v1_Nswizzle0_Quant1_MulRoutedWeight1_F8_F8_B16,264.6061,34.230333333333334,3.32%,85.22,10662.36
237,128,7168,512,256,8,ActivationType.Gelu,torch.bfloat16,torch.float8_e4m3fnuz,torch.float8_e4m3fnuz,QuantType.per_Tensor,1,1,asm,stage1,16,_ZN5aiter57fmoe_stage1_bf16_pertokenFp8_doweight_g1u1_16x256_2tg_pf3E,478.6453,36.60744444444445,0.07%,47.11,5894.4
237,128,7168,512,256,8,ActivationType.Gelu,torch.bfloat16,torch.float8_e4m3fnuz,torch.float8_e4m3fnuz,QuantType.per_Tensor,1,1,ck,stage2,16,moe_ck2stages_gemm2_256x16x128x256_1x4_MulABScaleExpertWeight_v1_Nswizzle0_Quant1_MulRoutedWeight0_F8_F8_B16,260.3153,36.60744444444445,0.00%,86.62,10838.11
238,128,7168,512,256,8,ActivationType.Gelu,torch.bfloat16,torch.float8_e4m3fnuz,torch.float8_e4m3fnuz,QuantType.per_Token,1,0,asm,asm_1stage,32,_ZN5aiter48fmoe_bf16_pertokenFp8_g1u1_vs_gelu_1tg_ps_32x512E,754.5648,0.0,0.00%,29.88,3739.01
239,128,7168,512,256,8,ActivationType.Gelu,torch.bfloat16,torch.float8_e4m3fnuz,torch.float8_e4m3fnuz,QuantType.per_Token,1,1,asm,asm_1stage,32,_ZN5aiter50fmoe_bf16_pertokenFp8_g1u1_vs_tkw1_gelu_1tg_32x512E,753.1522,0.0,0.00%,29.94,3746.02
240,128,7168,512,256,8,ActivationType.Silu,torch.bfloat16,torch.bfloat16,torch.bfloat16,QuantType.No,1,1,ck,stage1,32,moe_ck2stages_gemm1_256x32x64x128_1x4_TypeCastExpertWeight_v1_Nswizzle0_Quant0_MulRoutedWeight1_silu_B16_B16_B16,970.347,0.0,0.00%,23.24,5813.19
240,128,7168,512,256,8,ActivationType.Silu,torch.bfloat16,torch.bfloat16,torch.bfloat16,QuantType.No,1,1,ck,stage2,32,moe_ck2stages_gemm2_256x32x64x128_1x4_TypeCast_v1_Nswizzle0_Quant0_MulRoutedWeight0_B16_B16_B16,512.6071,0.0,0.00%,43.99,11004.17
241,128,7168,512,256,8,ActivationType.Silu,torch.bfloat16,torch.float8_e4m3fnuz,torch.float8_e4m3fnuz,QuantType.per_Tensor,1,0,asm,stage1,16,_ZN5aiter48fmoe_stage1_bf16_pertokenFp8_g1u1_16x512_2tg_pf2E,475.4989,36.55866666666665,0.00%,47.42,5933.4
241,128,7168,512,256,8,ActivationType.Silu,torch.bfloat16,torch.float8_e4m3fnuz,torch.float8_e4m3fnuz,QuantType.per_Tensor,1,0,ck,stage2,16,moe_ck2stages_gemm2_256x16x128x256_1x4_MulABScaleExpertWeight_v1_Nswizzle0_Quant1_MulRoutedWeight1_F8_F8_B16,262.7453,36.55866666666665,2.82%,85.82,10737.87
242,128,7168,512,256,8,ActivationType.Silu,torch.bfloat16,torch.float8_e4m3fnuz,torch.float8_e4m3fnuz,QuantType.per_Tensor,1,1,asm,stage1,16,_ZN5aiter57fmoe_stage1_bf16_pertokenFp8_doweight_g1u1_16x256_2tg_pf3E,476.5689,35.52144444444447,0.04%,47.31,5920.08
242,128,7168,512,256,8,ActivationType.Silu,torch.bfloat16,torch.float8_e4m3fnuz,torch.float8_e4m3fnuz,QuantType.per_Tensor,1,1,ck,stage2,16,moe_ck2stages_gemm2_256x16x128x256_1x4_MulABScaleExpertWeight_v1_Nswizzle0_Quant1_MulRoutedWeight0_F8_F8_B16,259.4096,35.52144444444447,0.01%,86.92,10875.95
243,128,7168,512,256,8,ActivationType.Silu,torch.bfloat16,torch.float8_e4m3fnuz,torch.float8_e4m3fnuz,QuantType.per_Token,1,0,asm,asm_1stage,32,_ZN5aiter45fmoe_bf16_pertokenFp8_g1u1_vs_silu_1tg_32x512E,753.3052,0.0,0.00%,29.93,3745.26
244,128,7168,512,256,8,ActivationType.Silu,torch.bfloat16,torch.float8_e4m3fnuz,torch.float8_e4m3fnuz,QuantType.per_Token,1,1,asm,asm_1stage,32,_ZN5aiter53fmoe_bf16_pertokenFp8_g1u1_vs_tkw1_silu_1tg_ps_32x512E,755.0254,0.0,0.00%,29.86,3736.73
245,128,7168,512,256,8,ActivationType.Silu,torch.bfloat16,torch.bfloat16,torch.bfloat16,QuantType.No,1,0,ck,stage1,32,moe_ck2stages_gemm1_256x32x64x128_1x4_TypeCast_v1_Nswizzle0_Quant0_MulRoutedWeight0_silu_B16_B16_B16,969.1939,0.0,0.00%,23.27,5820.11
245,128,7168,512,256,8,ActivationType.Silu,torch.bfloat16,torch.bfloat16,torch.bfloat16,QuantType.No,1,0,ck,stage2,32,moe_ck2stages_gemm2_256x32x64x128_1x4_TypeCastExpertWeight_v1_Nswizzle0_Quant0_MulRoutedWeight1_B16_B16_B16,513.3346,0.0,2.84%,43.93,10988.57
246,128,7168,512,256,8,ActivationType.Gelu,torch.bfloat16,torch.float8_e4m3fnuz,torch.float8_e4m3fnuz,QuantType.per_1x128,1,0,asm,stage1,16,_ZN5aiter59fmoe_stage1_bf16_pertokenFp8_blockscale_g1u1_16x512_2tg_pf2E,474.6361,33.09,15.09%,47.51,5944.19
246,128,7168,512,256,8,ActivationType.Gelu,torch.bfloat16,torch.float8_e4m3fnuz,torch.float8_e4m3fnuz,QuantType.per_1x128,1,0,ck,stage2,16,moe_ck2stages_gemm2_256x16x128x256_1x4_MulABScaleExpertWeightA8W8blkscale_v1_Nswizzle0_Quant4_MulRoutedWeight1_F8_F8_B16,259.7601,33.09,15.61%,86.81,10861.27
247,128,7168,512,256,8,ActivationType.Silu,torch.bfloat16,torch.float8_e4m3fnuz,torch.float8_e4m3fnuz,QuantType.per_1x128,1,0,asm,stage1,16,_ZN5aiter59fmoe_stage1_bf16_pertokenFp8_blockscale_g1u1_16x512_2tg_pf2E,473.7315,31.59400000000002,14.90%,47.6,5955.54
247,128,7168,512,256,8,ActivationType.Silu,torch.bfloat16,torch.float8_e4m3fnuz,torch.float8_e4m3fnuz,QuantType.per_1x128,1,0,ck,stage2,16,moe_ck2stages_gemm2_256x16x128x256_1x4_MulABScaleExpertWeightA8W8blkscale_v1_Nswizzle0_Quant4_MulRoutedWeight1_F8_F8_B16,262.4004,31.59400000000002,15.58%,85.93,10751.98
248,128,7168,512,256,8,ActivationType.Gelu,torch.bfloat16,torch.float8_e4m3fnuz,torch.float8_e4m3fnuz,QuantType.per_1x128,1,1,ck,stage1,16,moe_ck2stages_gemm1_256x16x128x256_1x4_MulABScaleExpertWeightA8W8blkscale_v1_Nswizzle0_Quant4_MulRoutedWeight1_gelu_F8_F8_B16,485.0449,31.176222222222204,0.01%,46.49,5816.63
248,128,7168,512,256,8,ActivationType.Gelu,torch.bfloat16,torch.float8_e4m3fnuz,torch.float8_e4m3fnuz,QuantType.per_1x128,1,1,ck,stage2,16,moe_ck2stages_gemm2_256x16x128x256_1x4_MulABScaleExpertWeightA8W8blkscale_v1_Nswizzle0_Quant4_MulRoutedWeight0_F8_F8_B16,259.2012,31.176222222222204,16.70%,86.99,10884.69
249,128,7168,512,256,8,ActivationType.Silu,torch.bfloat16,torch.float8_e4m3fnuz,torch.float8_e4m3fnuz,QuantType.per_1x128,1,1,ck,stage1,16,moe_ck2stages_gemm1_256x16x128x256_1x4_MulABScaleExpertWeightA8W8blkscale_v1_Nswizzle0_Quant4_MulRoutedWeight1_silu_F8_F8_B16,488.3539,31.768777777777828,0.01%,46.17,5777.21
249,128,7168,512,256,8,ActivationType.Silu,torch.bfloat16,torch.float8_e4m3fnuz,torch.float8_e4m3fnuz,QuantType.per_1x128,1,1,ck,stage2,16,moe_ck2stages_gemm2_256x16x128x256_1x4_MulABScaleExpertWeightA8W8blkscale_v1_Nswizzle0_Quant4_MulRoutedWeight0_F8_F8_B16,258.4962,31.768777777777828,16.66%,87.23,10914.38
250,128,7168,2048,33,10,ActivationType.Silu,torch.bfloat16,torch.float8_e4m3fnuz,torch.float8_e4m3fnuz,QuantType.per_1x128,1,0,asm,asm_1stage,32,_ZN5aiter52fmoe_bf16_blockscaleFp8_g1u1_novs_silu_1tg_ps_32x256E,525.1657,0.0,0.00%,214.68,2772.61
251,128,7168,2048,33,10,ActivationType.Silu,torch.bfloat16,torch.float8_e4m3fnuz,torch.float8_e4m3fnuz,QuantType.per_Token,1,0,asm,asm_1stage,32,_ZN5aiter48fmoe_bf16_pertokenFp8_g1u1_vs_silu_1tg_ps_32x256E,485.3033,0.0,0.02%,232.31,3000.35
252,256,2048,192,128,8,ActivationType.Silu,torch.bfloat16,torch.bfloat16,torch.bfloat16,QuantType.No,1,0,ck,stage1,32,moe_ck2stages_gemm1_256x32x64x64_1x4_TypeCast_v1_Nswizzle0_Quant0_MulRoutedWeight0_silu_B16_B16_B16,60.3818,0.0,0.00%,80.02,5036.07
252,256,2048,192,128,8,ActivationType.Silu,torch.bfloat16,torch.bfloat16,torch.bfloat16,QuantType.No,1,0,ck,stage2,32,moe_ck2stages_gemm2_256x32x64x64_1x4_TypeCastExpertWeight_v1_Nswizzle0_Quant0_MulRoutedWeight1_B16_B16_B16,37.3211,0.0,0.00%,129.47,8147.86
253,256,2048,192,128,8,ActivationType.Silu,torch.bfloat16,torch.bfloat16,torch.bfloat16,QuantType.No,1,1,ck,stage1,32,moe_ck2stages_gemm1_256x32x64x64_1x4_TypeCastExpertWeight_v1_Nswizzle0_Quant0_MulRoutedWeight1_silu_B16_B16_B16,60.5769,0.0,0.00%,79.76,5019.85
253,256,2048,192,128,8,ActivationType.Silu,torch.bfloat16,torch.bfloat16,torch.bfloat16,QuantType.No,1,1,ck,stage2,32,moe_ck2stages_gemm2_256x32x64x64_1x4_TypeCast_v1_Nswizzle0_Quant0_MulRoutedWeight0_B16_B16_B16,36.3881,0.0,0.00%,132.79,8356.77
254,256,2048,192,128,8,ActivationType.Gelu,torch.bfloat16,torch.bfloat16,torch.bfloat16,QuantType.No,1,0,ck,stage1,32,moe_ck2stages_gemm1_256x32x64x64_1x4_TypeCast_v1_Nswizzle0_Quant0_MulRoutedWeight0_gelu_B16_B16_B16,60.0135,0.0,0.00%,80.51,5066.98
254,256,2048,192,128,8,ActivationType.Gelu,torch.bfloat16,torch.bfloat16,torch.bfloat16,QuantType.No,1,0,ck,stage2,32,moe_ck2stages_gemm2_256x32x64x64_1x4_TypeCastExpertWeight_v1_Nswizzle0_Quant0_MulRoutedWeight1_B16_B16_B16,37.3748,0.0,0.00%,129.28,8136.15
255,256,2048,192,128,8,ActivationType.Gelu,torch.bfloat16,torch.bfloat16,torch.bfloat16,QuantType.No,1,1,ck,stage1,32,moe_ck2stages_gemm1_256x32x64x64_1x4_TypeCastExpertWeight_v1_Nswizzle0_Quant0_MulRoutedWeight1_gelu_B16_B16_B16,60.0667,0.0,0.00%,80.44,5062.49
255,256,2048,192,128,8,ActivationType.Gelu,torch.bfloat16,torch.bfloat16,torch.bfloat16,QuantType.No,1,1,ck,stage2,32,moe_ck2stages_gemm2_256x32x64x64_1x4_TypeCast_v1_Nswizzle0_Quant0_MulRoutedWeight0_B16_B16_B16,36.5103,0.0,0.00%,132.34,8328.8
256,256,4096,192,128,8,ActivationType.Silu,torch.bfloat16,torch.bfloat16,torch.bfloat16,QuantType.No,1,0,ck,stage1,32,moe_ck2stages_gemm1_256x32x64x128_1x4_TypeCast_v1_Nswizzle0_Quant0_MulRoutedWeight0_silu_B16_B16_B16,110.6202,0.0,0.00%,87.36,5497.86
256,256,4096,192,128,8,ActivationType.Silu,torch.bfloat16,torch.bfloat16,torch.bfloat16,QuantType.No,1,0,ck,stage2,32,moe_ck2stages_gemm2_256x32x64x64_1x4_TypeCastExpertWeight_v1_Nswizzle0_Quant0_MulRoutedWeight1_B16_B16_B16,63.7093,0.0,0.08%,151.68,9546.08
257,256,4096,192,128,8,ActivationType.Silu,torch.bfloat16,torch.bfloat16,torch.bfloat16,QuantType.No,1,1,ck,stage1,32,moe_ck2stages_gemm1_256x32x64x64_1x4_TypeCastExpertWeight_v1_Nswizzle0_Quant0_MulRoutedWeight1_silu_B16_B16_B16,111.2407,0.0,0.00%,86.87,5467.19
257,256,4096,192,128,8,ActivationType.Silu,torch.bfloat16,torch.bfloat16,torch.bfloat16,QuantType.No,1,1,ck,stage2,32,moe_ck2stages_gemm2_256x32x64x64_1x4_TypeCast_v1_Nswizzle0_Quant0_MulRoutedWeight0_B16_B16_B16,62.5401,0.0,0.00%,154.52,9724.55
258,256,4096,192,128,8,ActivationType.Gelu,torch.bfloat16,torch.bfloat16,torch.bfloat16,QuantType.No,1,0,ck,stage1,32,moe_ck2stages_gemm1_256x32x64x128_1x4_TypeCast_v1_Nswizzle0_Quant0_MulRoutedWeight0_gelu_B16_B16_B16,110.6338,0.0,0.00%,87.35,5497.18
258,256,4096,192,128,8,ActivationType.Gelu,torch.bfloat16,torch.bfloat16,torch.bfloat16,QuantType.No,1,0,ck,stage2,32,moe_ck2stages_gemm2_256x32x64x64_1x4_TypeCastExpertWeight_v1_Nswizzle0_Quant0_MulRoutedWeight1_B16_B16_B16,63.8578,0.0,0.12%,151.33,9523.88
259,256,4096,192,128,8,ActivationType.Gelu,torch.bfloat16,torch.bfloat16,torch.bfloat16,QuantType.No,1,1,ck,stage1,32,moe_ck2stages_gemm1_256x32x64x128_1x4_TypeCastExpertWeight_v1_Nswizzle0_Quant0_MulRoutedWeight1_gelu_B16_B16_B16,110.4472,0.0,0.00%,87.5,5506.47
259,256,4096,192,128,8,ActivationType.Gelu,torch.bfloat16,torch.bfloat16,torch.bfloat16,QuantType.No,1,1,ck,stage2,32,moe_ck2stages_gemm2_256x32x64x64_1x4_TypeCast_v1_Nswizzle0_Quant0_MulRoutedWeight0_B16_B16_B16,62.5176,0.0,0.00%,154.58,9728.05
260,256,4096,384,128,8,ActivationType.Gelu,torch.bfloat16,torch.bfloat16,torch.bfloat16,QuantType.No,1,0,ck,stage1,32,moe_ck2stages_gemm1_256x32x64x128_1x4_TypeCast_v1_Nswizzle0_Quant0_MulRoutedWeight0_gelu_B16_B16_B16,219.3778,0.0,0.00%,88.1,5525.42
260,256,4096,384,128,8,ActivationType.Gelu,torch.bfloat16,torch.bfloat16,torch.bfloat16,QuantType.No,1,0,ck,stage2,32,moe_ck2stages_gemm2_256x32x64x64_1x4_TypeCastExpertWeight_v1_Nswizzle0_Quant0_MulRoutedWeight1_B16_B16_B16,119.4378,0.0,0.52%,161.82,10148.83
261,256,4096,384,128,8,ActivationType.Gelu,torch.bfloat16,torch.bfloat16,torch.bfloat16,QuantType.No,1,1,ck,stage1,32,moe_ck2stages_gemm1_256x32x64x64_1x4_TypeCastExpertWeight_v1_Nswizzle0_Quant0_MulRoutedWeight1_gelu_B16_B16_B16,217.2916,0.0,0.00%,88.95,5578.47
261,256,4096,384,128,8,ActivationType.Gelu,torch.bfloat16,torch.bfloat16,torch.bfloat16,QuantType.No,1,1,ck,stage2,32,moe_ck2stages_gemm2_256x32x64x128_1x4_TypeCast_v1_Nswizzle0_Quant0_MulRoutedWeight0_B16_B16_B16,121.0421,0.0,0.00%,159.67,10014.32
262,256,4096,384,128,8,ActivationType.Silu,torch.bfloat16,torch.bfloat16,torch.bfloat16,QuantType.No,1,0,ck,stage1,32,moe_ck2stages_gemm1_256x32x64x64_1x4_TypeCast_v1_Nswizzle0_Quant0_MulRoutedWeight0_silu_B16_B16_B16,219.3142,0.0,0.00%,88.13,5527.02
262,256,4096,384,128,8,ActivationType.Silu,torch.bfloat16,torch.bfloat16,torch.bfloat16,QuantType.No,1,0,ck,stage2,32,moe_ck2stages_gemm2_256x32x64x128_1x4_TypeCastExpertWeight_v1_Nswizzle0_Quant0_MulRoutedWeight1_B16_B16_B16,120.4716,0.0,0.36%,160.43,10061.74
263,256,4096,384,128,8,ActivationType.Silu,torch.bfloat16,torch.bfloat16,torch.bfloat16,QuantType.No,1,1,ck,stage1,32,moe_ck2stages_gemm1_256x32x64x64_1x4_TypeCastExpertWeight_v1_Nswizzle0_Quant0_MulRoutedWeight1_silu_B16_B16_B16,218.3652,0.0,0.00%,88.51,5551.04
263,256,4096,384,128,8,ActivationType.Silu,torch.bfloat16,torch.bfloat16,torch.bfloat16,QuantType.No,1,1,ck,stage2,32,moe_ck2stages_gemm2_256x32x64x64_1x4_TypeCast_v1_Nswizzle0_Quant0_MulRoutedWeight0_B16_B16_B16,116.1157,0.0,0.00%,166.45,10439.19
264,256,4096,384,128,8,ActivationType.Silu,torch.bfloat16,torch.float8_e4m3fnuz,torch.float8_e4m3fnuz,QuantType.per_Tensor,1,0,ck,stage1,32,moe_ck2stages_gemm1_256x32x64x128_1x4_MulABScale_v1_Nswizzle0_Quant1_MulRoutedWeight0_silu_F8_F8_B16,113.3048,39.086777777777726,0.00%,170.58,5358.34
264,256,4096,384,128,8,ActivationType.Silu,torch.bfloat16,torch.float8_e4m3fnuz,torch.float8_e4m3fnuz,QuantType.per_Tensor,1,0,ck,stage2,32,moe_ck2stages_gemm2_256x32x64x128_1x4_MulABScaleExpertWeight_v1_Nswizzle0_Quant1_MulRoutedWeight1_F8_F8_B16,64.657,39.086777777777726,0.36%,298.92,9389.94
265,256,4096,384,128,8,ActivationType.Silu,torch.bfloat16,torch.float8_e4m3fnuz,torch.float8_e4m3fnuz,QuantType.per_Tensor,1,1,ck,stage1,32,moe_ck2stages_gemm1_256x32x64x128_1x4_MulABScale_v1_Nswizzle0_Quant1_MulRoutedWeight1_silu_F8_F8_B16,114.9982,40.635888888888935,0.00%,168.07,5279.43
265,256,4096,384,128,8,ActivationType.Silu,torch.bfloat16,torch.float8_e4m3fnuz,torch.float8_e4m3fnuz,QuantType.per_Tensor,1,1,ck,stage2,32,moe_ck2stages_gemm2_256x32x64x128_1x4_MulABScaleExpertWeight_v1_Nswizzle0_Quant1_MulRoutedWeight0_F8_F8_B16,64.3656,40.635888888888935,0.00%,300.27,9432.45
266,256,4096,384,128,8,ActivationType.Silu,torch.bfloat16,torch.float8_e4m3fnuz,torch.float8_e4m3fnuz,QuantType.per_Token,1,0,asm,asm_1stage,32,_ZN5aiter45fmoe_bf16_pertokenFp8_g1u1_vs_silu_1tg_32x384E,172.2368,0.0,0.00%,112.21,3524.95
267,256,4096,384,128,8,ActivationType.Silu,torch.bfloat16,torch.float8_e4m3fnuz,torch.float8_e4m3fnuz,QuantType.per_Token,1,1,asm,asm_1stage,32,_ZN5aiter50fmoe_bf16_pertokenFp8_g1u1_vs_tkw1_silu_1tg_32x384E,177.5762,0.0,0.00%,108.84,3418.96
268,256,4096,384,128,8,ActivationType.Gelu,torch.bfloat16,torch.float8_e4m3fnuz,torch.float8_e4m3fnuz,QuantType.per_Tensor,1,0,ck,stage1,32,moe_ck2stages_gemm1_256x32x64x256_1x4_MulABScale_v1_Nswizzle0_Quant1_MulRoutedWeight0_gelu_F8_F8_B16,114.9832,41.38811111111113,0.00%,168.09,5280.12
268,256,4096,384,128,8,ActivationType.Gelu,torch.bfloat16,torch.float8_e4m3fnuz,torch.float8_e4m3fnuz,QuantType.per_Tensor,1,0,ck,stage2,32,moe_ck2stages_gemm2_256x32x64x128_1x4_MulABScaleExpertWeight_v1_Nswizzle0_Quant1_MulRoutedWeight1_F8_F8_B16,64.4025,41.38811111111113,0.49%,300.1,9427.05
269,256,4096,384,128,8,ActivationType.Gelu,torch.bfloat16,torch.float8_e4m3fnuz,torch.float8_e4m3fnuz,QuantType.per_Tensor,1,1,ck,stage1,32,moe_ck2stages_gemm1_256x32x64x128_1x4_MulABScale_v1_Nswizzle0_Quant1_MulRoutedWeight1_gelu_F8_F8_B16,114.6761,41.000333333333295,0.00%,168.54,5294.26
269,256,4096,384,128,8,ActivationType.Gelu,torch.bfloat16,torch.float8_e4m3fnuz,torch.float8_e4m3fnuz,QuantType.per_Tensor,1,1,ck,stage2,32,moe_ck2stages_gemm2_256x32x64x128_1x4_MulABScaleExpertWeight_v1_Nswizzle0_Quant1_MulRoutedWeight0_F8_F8_B16,64.1884,41.000333333333295,0.00%,301.1,9458.49
270,256,4096,384,128,8,ActivationType.Gelu,torch.bfloat16,torch.float8_e4m3fnuz,torch.float8_e4m3fnuz,QuantType.per_Token,1,0,asm,asm_1stage,32,_ZN5aiter45fmoe_bf16_pertokenFp8_g1u1_vs_gelu_1tg_32x384E,171.5362,0.0,0.00%,112.67,3539.34
271,256,4096,384,128,8,ActivationType.Gelu,torch.bfloat16,torch.float8_e4m3fnuz,torch.float8_e4m3fnuz,QuantType.per_Token,1,1,asm,asm_1stage,32,_ZN5aiter50fmoe_bf16_pertokenFp8_g1u1_vs_tkw1_gelu_1tg_32x384E,175.8066,0.0,0.00%,109.94,3453.37
272,256,4096,384,128,8,ActivationType.Silu,torch.bfloat16,torch.float8_e4m3fnuz,torch.float8_e4m3fnuz,QuantType.per_1x128,1,0,asm,asm_1stage,32,_ZN5aiter49fmoe_bf16_blockscaleFp8_g1u1_novs_silu_1tg_32x128E,205.3019,0.0,0.00%,94.14,2957.23
273,256,4096,384,128,8,ActivationType.Gelu,torch.bfloat16,torch.float8_e4m3fnuz,torch.float8_e4m3fnuz,QuantType.per_1x128,1,0,asm,asm_1stage,32,_ZN5aiter47fmoe_bf16_blockscaleFp8_g1u1_vs_gelu_1tg_32x128E,205.91,0.0,0.16%,93.86,2948.5
274,256,4096,384,128,8,ActivationType.Silu,torch.bfloat16,torch.float8_e4m3fnuz,torch.float8_e4m3fnuz,QuantType.per_1x128,1,1,ck,stage1,32,moe_ck2stages_gemm1_256x32x128x128_1x4_MulABScaleExpertWeightA8W8blkscale_v1_Nswizzle0_Quant4_MulRoutedWeight1_silu_F8_F8_B16,120.0572,40.95911111111111,0.01%,160.98,5056.97
274,256,4096,384,128,8,ActivationType.Silu,torch.bfloat16,torch.float8_e4m3fnuz,torch.float8_e4m3fnuz,QuantType.per_1x128,1,1,ck,stage2,32,moe_ck2stages_gemm2_256x32x128x128_1x4_MulABScaleExpertWeightA8W8blkscale_v1_Nswizzle0_Quant4_MulRoutedWeight0_F8_F8_B16,67.4052,40.95911111111111,16.66%,286.73,9007.1
275,256,4096,384,128,8,ActivationType.Gelu,torch.bfloat16,torch.float8_e4m3fnuz,torch.float8_e4m3fnuz,QuantType.per_1x128,1,1,ck,stage1,32,moe_ck2stages_gemm1_256x32x128x128_1x4_MulABScaleExpertWeightA8W8blkscale_v1_Nswizzle0_Quant4_MulRoutedWeight1_gelu_F8_F8_B16,119.8958,40.53177777777783,0.01%,161.2,5063.78
275,256,4096,384,128,8,ActivationType.Gelu,torch.bfloat16,torch.float8_e4m3fnuz,torch.float8_e4m3fnuz,QuantType.per_1x128,1,1,ck,stage2,32,moe_ck2stages_gemm2_256x32x128x128_1x4_MulABScaleExpertWeightA8W8blkscale_v1_Nswizzle0_Quant4_MulRoutedWeight0_F8_F8_B16,67.4479,40.53177777777783,16.68%,286.55,9001.4
276,256,7168,256,256,8,ActivationType.Gelu,torch.bfloat16,torch.bfloat16,torch.bfloat16,QuantType.No,1,0,ck,stage1,32,moe_ck2stages_gemm1_256x32x64x128_1x4_TypeCast_v1_Nswizzle0_Quant0_MulRoutedWeight0_gelu_B16_B16_B16,512.2023,0.0,0.00%,44.02,5517.18
276,256,7168,256,256,8,ActivationType.Gelu,torch.bfloat16,torch.bfloat16,torch.bfloat16,QuantType.No,1,0,ck,stage2,32,moe_ck2stages_gemm2_256x32x64x128_1x4_TypeCastExpertWeight_v1_Nswizzle0_Quant0_MulRoutedWeight1_B16_B16_B16,271.4467,0.0,1.67%,83.07,10410.56
277,256,7168,256,256,8,ActivationType.Gelu,torch.bfloat16,torch.bfloat16,torch.bfloat16,QuantType.No,1,1,ck,stage1,32,moe_ck2stages_gemm1_256x32x64x128_1x4_TypeCastExpertWeight_v1_Nswizzle0_Quant0_MulRoutedWeight1_gelu_B16_B16_B16,498.7442,0.0,0.00%,45.21,5666.06
277,256,7168,256,256,8,ActivationType.Gelu,torch.bfloat16,torch.bfloat16,torch.bfloat16,QuantType.No,1,1,ck,stage2,32,moe_ck2stages_gemm2_256x32x64x128_1x4_TypeCast_v1_Nswizzle0_Quant0_MulRoutedWeight0_B16_B16_B16,268.7106,0.0,0.00%,83.91,10516.56
278,256,7168,256,256,8,ActivationType.Gelu,torch.bfloat16,torch.float8_e4m3fnuz,torch.float8_e4m3fnuz,QuantType.per_Tensor,1,0,asm,stage1,16,_ZN5aiter48fmoe_stage1_bf16_pertokenFp8_g1u1_16x128_4tg_pf3E,243.4804,36.06466666666664,0.42%,92.61,5810.7
278,256,7168,256,256,8,ActivationType.Gelu,torch.bfloat16,torch.float8_e4m3fnuz,torch.float8_e4m3fnuz,QuantType.per_Tensor,1,0,ck,stage2,16,moe_ck2stages_gemm2_256x16x128x256_1x4_MulABScaleExpertWeight_v1_Nswizzle0_Quant1_MulRoutedWeight1_F8_F8_B16,147.2075,36.06466666666664,1.65%,153.18,9610.86
279,256,7168,256,256,8,ActivationType.Gelu,torch.bfloat16,torch.float8_e4m3fnuz,torch.float8_e4m3fnuz,QuantType.per_Tensor,1,1,ck,stage1,16,moe_ck2stages_gemm1_256x16x128x256_1x4_MulABScale_v1_Nswizzle0_Quant1_MulRoutedWeight1_gelu_F8_F8_B16,247.2308,36.21122222222223,0.00%,91.2,5722.55
279,256,7168,256,256,8,ActivationType.Gelu,torch.bfloat16,torch.float8_e4m3fnuz,torch.float8_e4m3fnuz,QuantType.per_Tensor,1,1,ck,stage2,16,moe_ck2stages_gemm2_256x16x128x256_1x4_MulABScaleExpertWeight_v1_Nswizzle0_Quant1_MulRoutedWeight0_F8_F8_B16,146.92,36.21122222222223,0.00%,153.48,9629.67
280,256,7168,256,256,8,ActivationType.Gelu,torch.bfloat16,torch.float8_e4m3fnuz,torch.float8_e4m3fnuz,QuantType.per_Token,1,0,asm,asm_1stage,32,_ZN5aiter45fmoe_bf16_pertokenFp8_g1u1_vs_gelu_1tg_32x256E,396.3362,0.0,0.00%,56.89,3569.67
281,256,7168,256,256,8,ActivationType.Gelu,torch.bfloat16,torch.float8_e4m3fnuz,torch.float8_e4m3fnuz,QuantType.per_Token,1,1,asm,asm_1stage,32,_ZN5aiter53fmoe_bf16_pertokenFp8_g1u1_vs_tkw1_gelu_1tg_ps_32x256E,393.2068,0.0,0.00%,57.35,3598.08
282,256,7168,256,256,8,ActivationType.Silu,torch.bfloat16,torch.bfloat16,torch.bfloat16,QuantType.No,1,0,ck,stage1,32,moe_ck2stages_gemm1_256x32x64x128_1x4_TypeCast_v1_Nswizzle0_Quant0_MulRoutedWeight0_silu_B16_B16_B16,510.0698,0.0,0.00%,44.21,5540.25
282,256,7168,256,256,8,ActivationType.Silu,torch.bfloat16,torch.bfloat16,torch.bfloat16,QuantType.No,1,0,ck,stage2,32,moe_ck2stages_gemm2_256x32x64x64_1x4_TypeCastExpertWeight_v1_Nswizzle0_Quant0_MulRoutedWeight1_B16_B16_B16,271.217,0.0,1.33%,83.14,10419.38
283,256,7168,256,256,8,ActivationType.Silu,torch.bfloat16,torch.bfloat16,torch.bfloat16,QuantType.No,1,1,ck,stage1,32,moe_ck2stages_gemm1_256x32x64x128_1x4_TypeCastExpertWeight_v1_Nswizzle0_Quant0_MulRoutedWeight1_silu_B16_B16_B16,510.6146,0.0,0.00%,44.16,5534.34
283,256,7168,256,256,8,ActivationType.Silu,torch.bfloat16,torch.bfloat16,torch.bfloat16,QuantType.No,1,1,ck,stage2,32,moe_ck2stages_gemm2_256x32x64x128_1x4_TypeCast_v1_Nswizzle0_Quant0_MulRoutedWeight0_B16_B16_B16,269.6976,0.0,0.00%,83.61,10478.08
284,256,7168,256,256,8,ActivationType.Silu,torch.bfloat16,torch.float8_e4m3fnuz,torch.float8_e4m3fnuz,QuantType.per_Tensor,1,0,asm,stage1,16,_ZN5aiter48fmoe_stage1_bf16_pertokenFp8_g1u1_16x128_4tg_pf3E,243.5237,34.511111111111155,0.85%,92.59,5809.67
284,256,7168,256,256,8,ActivationType.Silu,torch.bfloat16,torch.float8_e4m3fnuz,torch.float8_e4m3fnuz,QuantType.per_Tensor,1,0,ck,stage2,16,moe_ck2stages_gemm2_256x16x128x256_1x4_MulABScaleExpertWeight_v1_Nswizzle0_Quant1_MulRoutedWeight1_F8_F8_B16,136.5034,34.511111111111155,1.32%,165.19,10364.51
285,256,7168,256,256,8,ActivationType.Silu,torch.bfloat16,torch.float8_e4m3fnuz,torch.float8_e4m3fnuz,QuantType.per_Tensor,1,1,ck,stage1,16,moe_ck2stages_gemm1_256x16x128x256_1x4_MulABScale_v1_Nswizzle0_Quant1_MulRoutedWeight1_silu_F8_F8_B16,247.4836,35.50844444444439,0.00%,91.11,5716.71
285,256,7168,256,256,8,ActivationType.Silu,torch.bfloat16,torch.float8_e4m3fnuz,torch.float8_e4m3fnuz,QuantType.per_Tensor,1,1,ck,stage2,16,moe_ck2stages_gemm2_256x16x128x256_1x4_MulABScaleExpertWeight_v1_Nswizzle0_Quant1_MulRoutedWeight0_F8_F8_B16,143.0964,35.50844444444439,0.00%,157.58,9886.98
286,256,7168,256,256,8,ActivationType.Silu,torch.bfloat16,torch.float8_e4m3fnuz,torch.float8_e4m3fnuz,QuantType.per_Token,1,0,asm,asm_1stage,32,_ZN5aiter45fmoe_bf16_pertokenFp8_g1u1_vs_silu_1tg_32x256E,395.9336,0.0,0.00%,56.95,3573.3
287,256,7168,256,256,8,ActivationType.Silu,torch.bfloat16,torch.float8_e4m3fnuz,torch.float8_e4m3fnuz,QuantType.per_Token,1,1,asm,asm_1stage,32,_ZN5aiter50fmoe_bf16_pertokenFp8_g1u1_vs_tkw1_silu_1tg_32x256E,394.7082,0.0,0.00%,57.13,3584.4
288,256,7168,256,256,8,ActivationType.Gelu,torch.bfloat16,torch.float8_e4m3fnuz,torch.float8_e4m3fnuz,QuantType.per_1x128,1,0,asm,asm_1stage,32,_ZN5aiter47fmoe_bf16_blockscaleFp8_g1u1_vs_gelu_1tg_32x128E,411.4435,0.0,2.11%,54.8,3438.6
289,256,7168,256,256,8,ActivationType.Gelu,torch.bfloat16,torch.float8_e4m3fnuz,torch.float8_e4m3fnuz,QuantType.per_1x128,1,1,ck,stage1,16,moe_ck2stages_gemm1_256x16x128x256_1x4_MulABScaleExpertWeightA8W8blkscale_v1_Nswizzle0_Quant4_MulRoutedWeight1_gelu_F8_F8_B16,251.8251,32.062222222222175,0.01%,89.54,5618.15
289,256,7168,256,256,8,ActivationType.Gelu,torch.bfloat16,torch.float8_e4m3fnuz,torch.float8_e4m3fnuz,QuantType.per_1x128,1,1,ck,stage2,16,moe_ck2stages_gemm2_256x16x128x256_1x4_MulABScaleExpertWeightA8W8blkscale_v1_Nswizzle0_Quant4_MulRoutedWeight0_F8_F8_B16,142.5451,32.062222222222175,16.63%,158.19,9925.22
290,256,7168,256,256,8,ActivationType.Silu,torch.bfloat16,torch.float8_e4m3fnuz,torch.float8_e4m3fnuz,QuantType.per_1x128,1,1,ck,stage1,16,moe_ck2stages_gemm1_256x16x128x256_1x4_MulABScaleExpertWeightA8W8blkscale_v1_Nswizzle0_Quant4_MulRoutedWeight1_silu_F8_F8_B16,251.7734,32.904000000000025,0.01%,89.56,5619.3
290,256,7168,256,256,8,ActivationType.Silu,torch.bfloat16,torch.float8_e4m3fnuz,torch.float8_e4m3fnuz,QuantType.per_1x128,1,1,ck,stage2,16,moe_ck2stages_gemm2_128x16x128x128_1x2_MulABScaleExpertWeightA8W8blkscale_v1_Nswizzle0_Quant4_MulRoutedWeight0_F8_F8_B16,138.9036,32.904000000000025,16.67%,162.33,10185.42
291,256,7168,256,256,8,ActivationType.Silu,torch.bfloat16,torch.float8_e4m3fnuz,torch.float8_e4m3fnuz,QuantType.per_1x128,1,0,asm,asm_1stage,32,_ZN5aiter47fmoe_bf16_blockscaleFp8_g1u1_vs_silu_1tg_32x128E,416.9224,0.0,0.00%,54.08,3393.42
292,256,7168,256,257,9,ActivationType.Silu,torch.bfloat16,torch.float8_e4m3fnuz,torch.float8_e4m3fnuz,QuantType.per_Token,1,0,asm,asm_1stage,32,_ZN5aiter45fmoe_bf16_pertokenFp8_g1u1_vs_silu_1tg_32x256E,402.9877,0.0,0.00%,62.95,3524.42
293,256,7168,256,257,9,ActivationType.Silu,torch.bfloat16,torch.float8_e4m3fnuz,torch.float8_e4m3fnuz,QuantType.per_1x128,1,0,asm,asm_1stage,32,_ZN5aiter47fmoe_bf16_blockscaleFp8_g1u1_vs_silu_1tg_32x128E,417.4347,0.0,0.00%,60.77,3402.44
294,256,7168,512,256,8,ActivationType.Gelu,torch.bfloat16,torch.bfloat16,torch.bfloat16,QuantType.No,1,0,ck,stage1,32,moe_ck2stages_gemm1_256x32x64x128_1x4_TypeCast_v1_Nswizzle0_Quant0_MulRoutedWeight0_gelu_B16_B16_B16,1007.652,0.0,0.00%,44.75,5601.62
294,256,7168,512,256,8,ActivationType.Gelu,torch.bfloat16,torch.bfloat16,torch.bfloat16,QuantType.No,1,0,ck,stage2,32,moe_ck2stages_gemm2_256x32x64x128_1x4_TypeCastExpertWeight_v1_Nswizzle0_Quant0_MulRoutedWeight1_B16_B16_B16,543.382,0.0,3.36%,82.99,10387.69
295,256,7168,512,256,8,ActivationType.Gelu,torch.bfloat16,torch.bfloat16,torch.bfloat16,QuantType.No,1,1,ck,stage1,32,moe_ck2stages_gemm1_256x32x64x128_1x4_TypeCastExpertWeight_v1_Nswizzle0_Quant0_MulRoutedWeight1_gelu_B16_B16_B16,1007.7155,0.0,0.00%,44.75,5601.27
295,256,7168,512,256,8,ActivationType.Gelu,torch.bfloat16,torch.bfloat16,torch.bfloat16,QuantType.No,1,1,ck,stage2,32,moe_ck2stages_gemm2_256x32x64x128_1x4_TypeCast_v1_Nswizzle0_Quant0_MulRoutedWeight0_B16_B16_B16,540.2325,0.0,0.00%,83.48,10448.25
296,256,7168,512,256,8,ActivationType.Gelu,torch.bfloat16,torch.float8_e4m3fnuz,torch.float8_e4m3fnuz,QuantType.per_Tensor,1,0,asm,stage1,16,_ZN5aiter48fmoe_stage1_bf16_pertokenFp8_g1u1_16x512_2tg_pf2E,488.2971,42.5586666666666,0.00%,92.36,5783.52
296,256,7168,512,256,8,ActivationType.Gelu,torch.bfloat16,torch.float8_e4m3fnuz,torch.float8_e4m3fnuz,QuantType.per_Tensor,1,0,ck,stage2,16,moe_ck2stages_gemm2_256x16x128x256_1x4_MulABScaleExpertWeight_v1_Nswizzle0_Quant1_MulRoutedWeight1_F8_F8_B16,277.6458,42.5586666666666,3.32%,162.43,10171.51
297,256,7168,512,256,8,ActivationType.Gelu,torch.bfloat16,torch.float8_e4m3fnuz,torch.float8_e4m3fnuz,QuantType.per_Tensor,1,1,asm,stage1,16,_ZN5aiter53fmoe_stage1_bf16_pertokenFp8_doweight_g1u1_16x512_pf3E,488.9697,43.194444444444414,0.00%,92.23,5775.57
297,256,7168,512,256,8,ActivationType.Gelu,torch.bfloat16,torch.float8_e4m3fnuz,torch.float8_e4m3fnuz,QuantType.per_Tensor,1,1,ck,stage2,16,moe_ck2stages_gemm2_256x16x128x256_1x4_MulABScaleExpertWeight_v1_Nswizzle0_Quant1_MulRoutedWeight0_F8_F8_B16,275.0488,43.194444444444414,0.00%,163.96,10267.55
298,256,7168,512,256,8,ActivationType.Gelu,torch.bfloat16,torch.float8_e4m3fnuz,torch.float8_e4m3fnuz,QuantType.per_Token,1,0,asm,asm_1stage,32,_ZN5aiter45fmoe_bf16_pertokenFp8_g1u1_vs_gelu_1tg_32x512E,777.8757,0.0,0.00%,57.97,3630.5
299,256,7168,512,256,8,ActivationType.Gelu,torch.bfloat16,torch.float8_e4m3fnuz,torch.float8_e4m3fnuz,QuantType.per_Token,1,1,asm,asm_1stage,32,_ZN5aiter50fmoe_bf16_pertokenFp8_g1u1_vs_tkw1_gelu_1tg_32x512E,795.0458,0.0,0.00%,56.72,3552.09
300,256,7168,512,256,8,ActivationType.Silu,torch.bfloat16,torch.bfloat16,torch.bfloat16,QuantType.No,1,1,ck,stage1,32,moe_ck2stages_gemm1_256x32x64x128_1x4_TypeCastExpertWeight_v1_Nswizzle0_Quant0_MulRoutedWeight1_silu_B16_B16_B16,1009.3589,0.0,0.00%,44.68,5592.15
300,256,7168,512,256,8,ActivationType.Silu,torch.bfloat16,torch.bfloat16,torch.bfloat16,QuantType.No,1,1,ck,stage2,32,moe_ck2stages_gemm2_256x32x64x64_1x4_TypeCast_v1_Nswizzle0_Quant0_MulRoutedWeight0_B16_B16_B16,548.3061,0.0,0.00%,82.25,10294.4
301,256,7168,512,256,8,ActivationType.Silu,torch.bfloat16,torch.float8_e4m3fnuz,torch.float8_e4m3fnuz,QuantType.per_Tensor,1,0,asm,stage1,16,_ZN5aiter48fmoe_stage1_bf16_pertokenFp8_g1u1_16x512_2tg_pf2E,490.0513,43.16322222222222,0.00%,92.03,5762.82
301,256,7168,512,256,8,ActivationType.Silu,torch.bfloat16,torch.float8_e4m3fnuz,torch.float8_e4m3fnuz,QuantType.per_Tensor,1,0,ck,stage2,16,moe_ck2stages_gemm2_256x16x128x256_1x4_MulABScaleExpertWeight_v1_Nswizzle0_Quant1_MulRoutedWeight1_F8_F8_B16,280.5285,43.16322222222222,2.84%,160.76,10066.99
302,256,7168,512,256,8,ActivationType.Silu,torch.bfloat16,torch.float8_e4m3fnuz,torch.float8_e4m3fnuz,QuantType.per_Tensor,1,1,asm,stage1,16,_ZN5aiter57fmoe_stage1_bf16_pertokenFp8_doweight_g1u1_16x512_2tg_pf2E,490.7896,43.00844444444444,0.00%,91.89,5754.15
302,256,7168,512,256,8,ActivationType.Silu,torch.bfloat16,torch.float8_e4m3fnuz,torch.float8_e4m3fnuz,QuantType.per_Tensor,1,1,ck,stage2,16,moe_ck2stages_gemm2_256x16x128x256_1x4_MulABScaleExpertWeight_v1_Nswizzle0_Quant1_MulRoutedWeight0_F8_F8_B16,275.4842,43.00844444444444,0.00%,163.7,10251.32
303,256,7168,512,256,8,ActivationType.Silu,torch.bfloat16,torch.float8_e4m3fnuz,torch.float8_e4m3fnuz,QuantType.per_Token,1,0,asm,asm_1stage,32,_ZN5aiter48fmoe_bf16_pertokenFp8_g1u1_vs_silu_1tg_ps_32x512E,780.2076,0.0,0.00%,57.8,3619.65
304,256,7168,512,256,8,ActivationType.Silu,torch.bfloat16,torch.float8_e4m3fnuz,torch.float8_e4m3fnuz,QuantType.per_Token,1,1,asm,asm_1stage,32,_ZN5aiter50fmoe_bf16_pertokenFp8_g1u1_vs_tkw1_silu_1tg_32x512E,796.343,0.0,0.00%,56.63,3546.31
305,256,7168,512,256,8,ActivationType.Silu,torch.bfloat16,torch.bfloat16,torch.bfloat16,QuantType.No,1,0,ck,stage1,32,moe_ck2stages_gemm1_256x32x64x128_1x4_TypeCast_v1_Nswizzle0_Quant0_MulRoutedWeight0_silu_B16_B16_B16,1010.0957,0.0,0.00%,44.65,5588.07
305,256,7168,512,256,8,ActivationType.Silu,torch.bfloat16,torch.bfloat16,torch.bfloat16,QuantType.No,1,0,ck,stage2,32,moe_ck2stages_gemm2_256x32x64x64_1x4_TypeCastExpertWeight_v1_Nswizzle0_Quant0_MulRoutedWeight1_B16_B16_B16,550.9773,0.0,2.87%,81.85,10244.5
306,256,7168,512,256,8,ActivationType.Gelu,torch.bfloat16,torch.float8_e4m3fnuz,torch.float8_e4m3fnuz,QuantType.per_1x128,1,0,asm,stage1,16,_ZN5aiter59fmoe_stage1_bf16_pertokenFp8_blockscale_g1u1_16x256_3tg_pf2E,493.7072,42.08999999999996,24.88%,91.34,5720.15
306,256,7168,512,256,8,ActivationType.Gelu,torch.bfloat16,torch.float8_e4m3fnuz,torch.float8_e4m3fnuz,QuantType.per_1x128,1,0,ck,stage2,16,moe_ck2stages_gemm2_256x16x128x256_1x4_MulABScaleExpertWeightA8W8blkscale_v1_Nswizzle0_Quant4_MulRoutedWeight1_F8_F8_B16,274.2901,42.08999999999996,15.73%,164.41,10295.95
307,256,7168,512,256,8,ActivationType.Silu,torch.bfloat16,torch.float8_e4m3fnuz,torch.float8_e4m3fnuz,QuantType.per_1x128,1,0,asm,stage1,16,_ZN5aiter59fmoe_stage1_bf16_pertokenFp8_blockscale_g1u1_16x256_2tg_pf3E,490.9399,40.23866666666664,25.10%,91.86,5752.39
307,256,7168,512,256,8,ActivationType.Silu,torch.bfloat16,torch.float8_e4m3fnuz,torch.float8_e4m3fnuz,QuantType.per_1x128,1,0,ck,stage2,16,moe_ck2stages_gemm2_128x16x128x128_1x2_MulABScaleExpertWeightA8W8blkscale_v1_Nswizzle0_Quant4_MulRoutedWeight1_F8_F8_B16,275.572,40.23866666666664,15.75%,163.65,10248.06
308,256,7168,512,256,8,ActivationType.Gelu,torch.bfloat16,torch.float8_e4m3fnuz,torch.float8_e4m3fnuz,QuantType.per_1x128,1,1,ck,stage1,16,moe_ck2stages_gemm1_256x16x128x256_1x4_MulABScaleExpertWeightA8W8blkscale_v1_Nswizzle0_Quant4_MulRoutedWeight1_gelu_F8_F8_B16,507.564,41.58711111111112,0.01%,88.85,5563.98
308,256,7168,512,256,8,ActivationType.Gelu,torch.bfloat16,torch.float8_e4m3fnuz,torch.float8_e4m3fnuz,QuantType.per_1x128,1,1,ck,stage2,16,moe_ck2stages_gemm2_256x16x128x256_1x4_MulABScaleExpertWeightA8W8blkscale_v1_Nswizzle0_Quant4_MulRoutedWeight0_F8_F8_B16,273.2646,41.58711111111112,16.73%,165.03,10334.59
309,256,7168,512,256,8,ActivationType.Silu,torch.bfloat16,torch.float8_e4m3fnuz,torch.float8_e4m3fnuz,QuantType.per_1x128,1,1,ck,stage1,16,moe_ck2stages_gemm1_256x16x128x256_1x4_MulABScaleExpertWeightA8W8blkscale_v1_Nswizzle0_Quant4_MulRoutedWeight1_silu_F8_F8_B16,509.5149,40.99100000000003,0.01%,88.51,5542.68
309,256,7168,512,256,8,ActivationType.Silu,torch.bfloat16,torch.float8_e4m3fnuz,torch.float8_e4m3fnuz,QuantType.per_1x128,1,1,ck,stage2,16,moe_ck2stages_gemm2_256x16x128x256_1x4_MulABScaleExpertWeightA8W8blkscale_v1_Nswizzle0_Quant4_MulRoutedWeight0_F8_F8_B16,270.8329,40.99100000000003,16.71%,166.51,10427.38
310,256,7168,2048,33,10,ActivationType.Silu,torch.bfloat16,torch.float8_e4m3fnuz,torch.float8_e4m3fnuz,QuantType.per_1x128,1,0,asm,asm_1stage,32,_ZN5aiter49fmoe_bf16_blockscaleFp8_g1u1_novs_silu_1tg_32x256E,673.7861,0.0,0.00%,334.65,2165.13
311,256,7168,2048,33,10,ActivationType.Silu,torch.bfloat16,torch.float8_e4m3fnuz,torch.float8_e4m3fnuz,QuantType.per_Token,1,0,asm,asm_1stage,32,_ZN5aiter48fmoe_bf16_pertokenFp8_g1u1_vs_silu_1tg_ps_32x256E,630.0987,0.0,0.02%,357.86,2315.24
312,512,2048,192,128,8,ActivationType.Silu,torch.bfloat16,torch.bfloat16,torch.bfloat16,QuantType.No,1,0,ck,stage1,32,moe_ck2stages_gemm1_256x32x64x64_1x4_TypeCast_v1_Nswizzle0_Quant0_MulRoutedWeight0_silu_B16_B16_B16,66.9736,0.0,0.00%,144.29,4571.71
312,512,2048,192,128,8,ActivationType.Silu,torch.bfloat16,torch.bfloat16,torch.bfloat16,QuantType.No,1,0,ck,stage2,32,moe_ck2stages_gemm2_256x32x64x64_1x4_TypeCastExpertWeight_v1_Nswizzle0_Quant0_MulRoutedWeight1_B16_B16_B16,41.6326,0.0,0.00%,232.12,7354.43
313,512,2048,192,128,8,ActivationType.Silu,torch.bfloat16,torch.bfloat16,torch.bfloat16,QuantType.No,1,1,ck,stage1,32,moe_ck2stages_gemm1_256x32x64x64_1x4_TypeCastExpertWeight_v1_Nswizzle0_Quant0_MulRoutedWeight1_silu_B16_B16_B16,67.0759,0.0,0.00%,144.07,4564.74
313,512,2048,192,128,8,ActivationType.Silu,torch.bfloat16,torch.bfloat16,torch.bfloat16,QuantType.No,1,1,ck,stage2,32,moe_ck2stages_gemm2_256x32x64x64_1x4_TypeCast_v1_Nswizzle0_Quant0_MulRoutedWeight0_B16_B16_B16,39.7104,0.0,0.00%,243.35,7710.43
314,512,2048,192,128,8,ActivationType.Gelu,torch.bfloat16,torch.bfloat16,torch.bfloat16,QuantType.No,1,0,ck,stage1,32,moe_ck2stages_gemm1_256x32x64x64_1x4_TypeCast_v1_Nswizzle0_Quant0_MulRoutedWeight0_gelu_B16_B16_B16,67.0529,0.0,0.00%,144.12,4566.31
314,512,2048,192,128,8,ActivationType.Gelu,torch.bfloat16,torch.bfloat16,torch.bfloat16,QuantType.No,1,0,ck,stage2,32,moe_ck2stages_gemm2_256x32x64x64_1x4_TypeCastExpertWeight_v1_Nswizzle0_Quant0_MulRoutedWeight1_B16_B16_B16,41.4738,0.0,0.00%,233.01,7382.59
315,512,2048,192,128,8,ActivationType.Gelu,torch.bfloat16,torch.bfloat16,torch.bfloat16,QuantType.No,1,1,ck,stage1,32,moe_ck2stages_gemm1_256x32x64x64_1x4_TypeCastExpertWeight_v1_Nswizzle0_Quant0_MulRoutedWeight1_gelu_B16_B16_B16,66.5355,0.0,0.00%,145.24,4601.82
315,512,2048,192,128,8,ActivationType.Gelu,torch.bfloat16,torch.bfloat16,torch.bfloat16,QuantType.No,1,1,ck,stage2,32,moe_ck2stages_gemm2_256x32x64x64_1x4_TypeCast_v1_Nswizzle0_Quant0_MulRoutedWeight0_B16_B16_B16,39.7956,0.0,0.00%,242.83,7693.92
316,512,4096,192,128,8,ActivationType.Silu,torch.bfloat16,torch.bfloat16,torch.bfloat16,QuantType.No,1,0,ck,stage1,32,moe_ck2stages_gemm1_256x32x64x128_1x4_TypeCast_v1_Nswizzle0_Quant0_MulRoutedWeight0_silu_B16_B16_B16,133.0623,0.0,0.00%,145.25,4602.12
316,512,4096,192,128,8,ActivationType.Silu,torch.bfloat16,torch.bfloat16,torch.bfloat16,QuantType.No,1,0,ck,stage2,32,moe_ck2stages_gemm2_256x32x64x64_1x4_TypeCastExpertWeight_v1_Nswizzle0_Quant0_MulRoutedWeight1_B16_B16_B16,73.6649,0.0,0.08%,262.37,8312.89
317,512,4096,192,128,8,ActivationType.Silu,torch.bfloat16,torch.bfloat16,torch.bfloat16,QuantType.No,1,1,ck,stage1,32,moe_ck2stages_gemm1_256x32x64x64_1x4_TypeCastExpertWeight_v1_Nswizzle0_Quant0_MulRoutedWeight1_silu_B16_B16_B16,137.2342,0.0,0.00%,140.83,4462.21
317,512,4096,192,128,8,ActivationType.Silu,torch.bfloat16,torch.bfloat16,torch.bfloat16,QuantType.No,1,1,ck,stage2,32,moe_ck2stages_gemm2_256x32x64x64_1x4_TypeCast_v1_Nswizzle0_Quant0_MulRoutedWeight0_B16_B16_B16,70.2574,0.0,0.00%,275.09,8716.07
318,512,4096,192,128,8,ActivationType.Gelu,torch.bfloat16,torch.bfloat16,torch.bfloat16,QuantType.No,1,0,ck,stage1,64,moe_ck2stages_gemm1_256x64x64x128_1x4_TypeCast_v1_Nswizzle0_Quant0_MulRoutedWeight0_gelu_B16_B16_B16,129.2448,0.0,0.00%,149.54,4738.05
318,512,4096,192,128,8,ActivationType.Gelu,torch.bfloat16,torch.bfloat16,torch.bfloat16,QuantType.No,1,0,ck,stage2,64,moe_ck2stages_gemm2_256x64x64x64_1x4_TypeCastExpertWeight_v1_Nswizzle0_Quant0_MulRoutedWeight1_B16_B16_B16,81.4096,0.0,0.13%,237.41,7522.07
319,512,4096,192,128,8,ActivationType.Gelu,torch.bfloat16,torch.bfloat16,torch.bfloat16,QuantType.No,1,1,ck,stage1,32,moe_ck2stages_gemm1_256x32x64x64_1x4_TypeCastExpertWeight_v1_Nswizzle0_Quant0_MulRoutedWeight1_gelu_B16_B16_B16,137.9765,0.0,0.00%,140.08,4438.21
319,512,4096,192,128,8,ActivationType.Gelu,torch.bfloat16,torch.bfloat16,torch.bfloat16,QuantType.No,1,1,ck,stage2,32,moe_ck2stages_gemm2_256x32x64x64_1x4_TypeCast_v1_Nswizzle0_Quant0_MulRoutedWeight0_B16_B16_B16,70.1468,0.0,0.00%,275.53,8729.81
320,512,4096,384,128,8,ActivationType.Gelu,torch.bfloat16,torch.bfloat16,torch.bfloat16,QuantType.No,1,0,ck,stage1,64,moe_ck2stages_gemm1_256x64x64x128_1x4_TypeCast_v1_Nswizzle0_Quant0_MulRoutedWeight0_gelu_B16_B16_B16,242.3759,0.0,0.00%,159.48,5018.44
320,512,4096,384,128,8,ActivationType.Gelu,torch.bfloat16,torch.bfloat16,torch.bfloat16,QuantType.No,1,0,ck,stage2,64,moe_ck2stages_gemm2_256x64x64x64_1x4_TypeCastExpertWeight_v1_Nswizzle0_Quant0_MulRoutedWeight1_B16_B16_B16,132.9313,0.0,0.50%,290.79,9150.2
321,512,4096,384,128,8,ActivationType.Silu,torch.bfloat16,torch.bfloat16,torch.bfloat16,QuantType.No,1,0,ck,stage1,64,moe_ck2stages_gemm1_256x64x64x128_1x4_TypeCast_v1_Nswizzle0_Quant0_MulRoutedWeight0_silu_B16_B16_B16,242.8626,0.0,0.00%,159.16,5008.38
321,512,4096,384,128,8,ActivationType.Silu,torch.bfloat16,torch.bfloat16,torch.bfloat16,QuantType.No,1,0,ck,stage2,64,moe_ck2stages_gemm2_256x64x64x64_1x4_TypeCastExpertWeight_v1_Nswizzle0_Quant0_MulRoutedWeight1_B16_B16_B16,132.5695,0.0,0.37%,291.58,9175.17
322,512,4096,384,128,8,ActivationType.Silu,torch.bfloat16,torch.bfloat16,torch.bfloat16,QuantType.No,1,1,ck,stage1,64,moe_ck2stages_gemm1_256x64x64x128_1x4_TypeCastExpertWeight_v1_Nswizzle0_Quant0_MulRoutedWeight1_silu_B16_B16_B16,244.0748,0.0,0.00%,158.37,4983.51
322,512,4096,384,128,8,ActivationType.Silu,torch.bfloat16,torch.bfloat16,torch.bfloat16,QuantType.No,1,1,ck,stage2,64,moe_ck2stages_gemm2_256x64x64x128_1x4_TypeCast_v1_Nswizzle0_Quant0_MulRoutedWeight0_B16_B16_B16,132.9032,0.0,0.00%,290.85,9152.14
323,512,4096,384,128,8,ActivationType.Silu,torch.bfloat16,torch.float8_e4m3fnuz,torch.float8_e4m3fnuz,QuantType.per_Tensor,1,0,asm,stage1,32,_ZN5aiter48fmoe_stage1_bf16_pertokenFp8_g1u1_32x128_3tg_pf2E,141.2323,48.34033333333333,0.00%,273.7,4321.05
323,512,4096,384,128,8,ActivationType.Silu,torch.bfloat16,torch.float8_e4m3fnuz,torch.float8_e4m3fnuz,QuantType.per_Tensor,1,0,ck,stage2,32,moe_ck2stages_gemm2_256x32x64x128_1x4_MulABScaleExpertWeight_v1_Nswizzle0_Quant1_MulRoutedWeight1_F8_F8_B16,78.278,48.34033333333333,0.36%,493.81,7796.2
324,512,4096,384,128,8,ActivationType.Silu,torch.bfloat16,torch.float8_e4m3fnuz,torch.float8_e4m3fnuz,QuantType.per_Tensor,1,1,asm,stage1,32,_ZN5aiter57fmoe_stage1_bf16_pertokenFp8_doweight_g1u1_32x128_3tg_pf2E,141.298,50.06311111111115,0.01%,273.57,4319.04
324,512,4096,384,128,8,ActivationType.Silu,torch.bfloat16,torch.float8_e4m3fnuz,torch.float8_e4m3fnuz,QuantType.per_Tensor,1,1,ck,stage2,32,moe_ck2stages_gemm2_256x32x64x128_1x4_MulABScaleExpertWeight_v1_Nswizzle0_Quant1_MulRoutedWeight0_F8_F8_B16,76.298,50.06311111111115,0.00%,506.63,7998.52
325,512,4096,384,128,8,ActivationType.Silu,torch.bfloat16,torch.float8_e4m3fnuz,torch.float8_e4m3fnuz,QuantType.per_Token,1,0,asm,asm_1stage,32,_ZN5aiter48fmoe_bf16_pertokenFp8_g1u1_vs_silu_1tg_ps_32x384E,211.5563,0.0,0.00%,182.72,2884.68
326,512,4096,384,128,8,ActivationType.Silu,torch.bfloat16,torch.float8_e4m3fnuz,torch.float8_e4m3fnuz,QuantType.per_Token,1,1,asm,asm_1stage,32,_ZN5aiter50fmoe_bf16_pertokenFp8_g1u1_vs_tkw1_silu_1tg_32x384E,218.1114,0.0,0.00%,177.22,2797.98
327,512,4096,384,128,8,ActivationType.Gelu,torch.bfloat16,torch.float8_e4m3fnuz,torch.float8_e4m3fnuz,QuantType.per_Tensor,1,0,asm,stage1,32,_ZN5aiter48fmoe_stage1_bf16_pertokenFp8_g1u1_32x128_3tg_pf3E,142.071,54.58955555555548,0.01%,272.08,4295.54
327,512,4096,384,128,8,ActivationType.Gelu,torch.bfloat16,torch.float8_e4m3fnuz,torch.float8_e4m3fnuz,QuantType.per_Tensor,1,0,ck,stage2,32,moe_ck2stages_gemm2_256x32x64x128_1x4_MulABScaleExpertWeight_v1_Nswizzle0_Quant1_MulRoutedWeight1_F8_F8_B16,78.2867,54.58955555555548,0.49%,493.76,7795.34
328,512,4096,384,128,8,ActivationType.Gelu,torch.bfloat16,torch.float8_e4m3fnuz,torch.float8_e4m3fnuz,QuantType.per_Tensor,1,1,asm,stage1,32,_ZN5aiter56fmoe_stage1_bf16_pertokenFp8_doweight_g1u1_32x64_4tg_pf2E,143.314,55.17211111111112,0.00%,269.72,4258.28
328,512,4096,384,128,8,ActivationType.Gelu,torch.bfloat16,torch.float8_e4m3fnuz,torch.float8_e4m3fnuz,QuantType.per_Tensor,1,1,ck,stage2,32,moe_ck2stages_gemm2_256x32x64x128_1x4_MulABScaleExpertWeight_v1_Nswizzle0_Quant1_MulRoutedWeight0_F8_F8_B16,76.7508,55.17211111111112,0.00%,503.64,7951.33
329,512,4096,384,128,8,ActivationType.Gelu,torch.bfloat16,torch.float8_e4m3fnuz,torch.float8_e4m3fnuz,QuantType.per_Token,1,0,asm,asm_1stage,32,_ZN5aiter48fmoe_bf16_pertokenFp8_g1u1_vs_gelu_1tg_ps_32x384E,220.0266,0.0,0.00%,175.68,2773.62
330,512,4096,384,128,8,ActivationType.Gelu,torch.bfloat16,torch.float8_e4m3fnuz,torch.float8_e4m3fnuz,QuantType.per_Token,1,1,asm,asm_1stage,32,_ZN5aiter53fmoe_bf16_pertokenFp8_g1u1_vs_tkw1_gelu_1tg_ps_32x384E,218.2552,0.0,0.00%,177.11,2796.14
331,512,4096,384,128,8,ActivationType.Gelu,torch.bfloat16,torch.bfloat16,torch.bfloat16,QuantType.No,1,1,ck,stage1,64,moe_ck2stages_gemm1_256x64x64x128_1x4_TypeCastExpertWeight_v1_Nswizzle0_Quant0_MulRoutedWeight1_gelu_B16_B16_B16,242.8008,0.0,0.00%,159.2,5009.65
331,512,4096,384,128,8,ActivationType.Gelu,torch.bfloat16,torch.bfloat16,torch.bfloat16,QuantType.No,1,1,ck,stage2,64,moe_ck2stages_gemm2_256x64x64x128_1x4_TypeCast_v1_Nswizzle0_Quant0_MulRoutedWeight0_B16_B16_B16,134.3851,0.0,0.00%,287.64,9051.21
332,512,4096,384,128,8,ActivationType.Silu,torch.bfloat16,torch.float8_e4m3fnuz,torch.float8_e4m3fnuz,QuantType.per_1x128,1,0,asm,asm_1stage,32,_ZN5aiter49fmoe_bf16_blockscaleFp8_g1u1_novs_silu_1tg_32x128E,251.4141,0.0,0.00%,153.75,2427.35
333,512,4096,384,128,8,ActivationType.Gelu,torch.bfloat16,torch.float8_e4m3fnuz,torch.float8_e4m3fnuz,QuantType.per_1x128,1,0,asm,asm_1stage,32,_ZN5aiter49fmoe_bf16_blockscaleFp8_g1u1_novs_gelu_1tg_32x128E,250.5956,0.0,0.16%,154.25,2435.28
334,512,4096,384,128,8,ActivationType.Silu,torch.bfloat16,torch.float8_e4m3fnuz,torch.float8_e4m3fnuz,QuantType.per_1x128,1,1,ck,stage1,32,moe_ck2stages_gemm1_256x32x128x128_1x4_MulABScaleExpertWeightA8W8blkscale_v1_Nswizzle0_Quant4_MulRoutedWeight1_silu_F8_F8_B16,140.0862,52.211777777777726,0.01%,275.94,4356.4
334,512,4096,384,128,8,ActivationType.Silu,torch.bfloat16,torch.float8_e4m3fnuz,torch.float8_e4m3fnuz,QuantType.per_1x128,1,1,ck,stage2,32,moe_ck2stages_gemm2_256x32x128x128_1x4_MulABScaleExpertWeightA8W8blkscale_v1_Nswizzle0_Quant4_MulRoutedWeight0_F8_F8_B16,82.711,52.211777777777726,16.68%,467.35,7378.36
335,512,4096,384,128,8,ActivationType.Gelu,torch.bfloat16,torch.float8_e4m3fnuz,torch.float8_e4m3fnuz,QuantType.per_1x128,1,1,ck,stage1,32,moe_ck2stages_gemm1_256x32x128x128_1x4_MulABScaleExpertWeightA8W8blkscale_v1_Nswizzle0_Quant4_MulRoutedWeight1_gelu_F8_F8_B16,139.2542,51.939888888888895,0.01%,277.58,4382.43
335,512,4096,384,128,8,ActivationType.Gelu,torch.bfloat16,torch.float8_e4m3fnuz,torch.float8_e4m3fnuz,QuantType.per_1x128,1,1,ck,stage2,32,moe_ck2stages_gemm2_256x32x128x128_1x4_MulABScaleExpertWeightA8W8blkscale_v1_Nswizzle0_Quant4_MulRoutedWeight0_F8_F8_B16,82.0228,51.939888888888895,16.68%,471.27,7440.26
336,512,6144,4096,8,2,ActivationType.Silu,torch.bfloat16,torch.float8_e4m3fnuz,torch.float8_e4m3fnuz,QuantType.per_Token,1,0,asm,asm_1stage,32,_ZN5aiter45fmoe_bf16_pertokenFp8_g1u1_vs_silu_1tg_32x512E,300.7132,0.0,4.92%,514.17,2039.87
337,512,6144,4096,8,2,ActivationType.Silu,torch.bfloat16,torch.int8,torch.int8,QuantType.per_Tensor,1,0,asm,stage1,64,_ZN5aiter49fmoe_stage1_bf16_pertokenInt8_g1u1_64x128_2tg_pf3E,196.4453,73.86277777777784,0.00%,787.08,3122.58
337,512,6144,4096,8,2,ActivationType.Silu,torch.bfloat16,torch.int8,torch.int8,QuantType.per_Tensor,1,0,ck,stage2,64,moe_ck2stages_gemm2_256x64x128x128_1x4_MulABScaleExpertWeight_v3_Nswizzle0_Quant1_MulRoutedWeight1_I8_I8_B16,110.0715,73.86277777777784,2.05%,1404.71,5572.9
338,512,6144,4096,8,2,ActivationType.Silu,torch.bfloat16,torch.bfloat16,torch.bfloat16,QuantType.No,1,0,ck,stage1,64,moe_ck2stages_gemm1_256x64x128x64_1x4_TypeCast_v3_Nswizzle0_Quant0_MulRoutedWeight0_silu_B16_B16_B16,369.2523,0.0,0.00%,418.73,3305.44
338,512,6144,4096,8,2,ActivationType.Silu,torch.bfloat16,torch.bfloat16,torch.bfloat16,QuantType.No,1,0,ck,stage2,64,moe_ck2stages_gemm2_256x64x128x64_1x4_TypeCastExpertWeight_v3_Nswizzle0_Quant0_MulRoutedWeight1_B16_B16_B16,207.5635,0.0,2.30%,744.92,5880.33
339,512,7168,256,256,8,ActivationType.Gelu,torch.bfloat16,torch.bfloat16,torch.bfloat16,QuantType.No,1,0,ck,stage1,32,moe_ck2stages_gemm1_256x32x64x128_1x4_TypeCast_v1_Nswizzle0_Quant0_MulRoutedWeight0_gelu_B16_B16_B16,524.4415,0.0,0.00%,85.99,5402.42
339,512,7168,256,256,8,ActivationType.Gelu,torch.bfloat16,torch.bfloat16,torch.bfloat16,QuantType.No,1,0,ck,stage2,32,moe_ck2stages_gemm2_256x32x64x64_1x4_TypeCastExpertWeight_v1_Nswizzle0_Quant0_MulRoutedWeight1_B16_B16_B16,286.7764,0.0,1.62%,157.26,9879.66
340,512,7168,256,256,8,ActivationType.Gelu,torch.bfloat16,torch.bfloat16,torch.bfloat16,QuantType.No,1,1,ck,stage1,32,moe_ck2stages_gemm1_256x32x64x128_1x4_TypeCastExpertWeight_v1_Nswizzle0_Quant0_MulRoutedWeight1_gelu_B16_B16_B16,512.0364,0.0,0.00%,88.07,5533.3
340,512,7168,256,256,8,ActivationType.Gelu,torch.bfloat16,torch.bfloat16,torch.bfloat16,QuantType.No,1,1,ck,stage2,32,moe_ck2stages_gemm2_256x32x64x64_1x4_TypeCast_v1_Nswizzle0_Quant0_MulRoutedWeight0_B16_B16_B16,285.7257,0.0,0.00%,157.83,9915.99
341,512,7168,256,256,8,ActivationType.Gelu,torch.bfloat16,torch.float8_e4m3fnuz,torch.float8_e4m3fnuz,QuantType.per_Tensor,1,0,asm,stage1,32,_ZN5aiter48fmoe_stage1_bf16_pertokenFp8_g1u1_32x256_2tg_pf3E,258.3554,43.11022222222223,0.00%,174.55,5497.45
341,512,7168,256,256,8,ActivationType.Gelu,torch.bfloat16,torch.float8_e4m3fnuz,torch.float8_e4m3fnuz,QuantType.per_Tensor,1,0,ck,stage2,32,moe_ck2stages_gemm2_256x32x64x128_1x4_MulABScaleExpertWeight_v1_Nswizzle0_Quant1_MulRoutedWeight1_F8_F8_B16,160.5585,43.11022222222223,1.62%,280.88,8845.97
342,512,7168,256,256,8,ActivationType.Gelu,torch.bfloat16,torch.float8_e4m3fnuz,torch.float8_e4m3fnuz,QuantType.per_Tensor,1,1,asm,stage1,32,_ZN5aiter57fmoe_stage1_bf16_pertokenFp8_doweight_g1u1_32x256_2tg_pf2E,257.6111,43.71566666666663,0.00%,175.06,5513.33
342,512,7168,256,256,8,ActivationType.Gelu,torch.bfloat16,torch.float8_e4m3fnuz,torch.float8_e4m3fnuz,QuantType.per_Tensor,1,1,ck,stage2,32,moe_ck2stages_gemm2_256x32x64x256_1x4_MulABScaleExpertWeight_v1_Nswizzle0_Quant1_MulRoutedWeight0_F8_F8_B16,160.5748,43.71566666666663,0.00%,280.85,8845.08
343,512,7168,256,256,8,ActivationType.Gelu,torch.bfloat16,torch.float8_e4m3fnuz,torch.float8_e4m3fnuz,QuantType.per_Token,1,0,asm,asm_1stage,32,_ZN5aiter48fmoe_bf16_pertokenFp8_g1u1_vs_gelu_1tg_ps_32x256E,415.3417,0.0,0.00%,108.58,3419.58
344,512,7168,256,256,8,ActivationType.Gelu,torch.bfloat16,torch.float8_e4m3fnuz,torch.float8_e4m3fnuz,QuantType.per_Token,1,1,asm,asm_1stage,32,_ZN5aiter50fmoe_bf16_pertokenFp8_g1u1_vs_tkw1_gelu_1tg_32x256E,414.5365,0.0,0.00%,108.79,3426.23
345,512,7168,256,256,8,ActivationType.Silu,torch.bfloat16,torch.bfloat16,torch.bfloat16,QuantType.No,1,0,ck,stage1,32,moe_ck2stages_gemm1_256x32x64x128_1x4_TypeCast_v1_Nswizzle0_Quant0_MulRoutedWeight0_silu_B16_B16_B16,523.7169,0.0,0.00%,86.11,5409.89
345,512,7168,256,256,8,ActivationType.Silu,torch.bfloat16,torch.bfloat16,torch.bfloat16,QuantType.No,1,0,ck,stage2,32,moe_ck2stages_gemm2_256x32x64x64_1x4_TypeCastExpertWeight_v1_Nswizzle0_Quant0_MulRoutedWeight1_B16_B16_B16,286.304,0.0,1.30%,157.51,9895.96
346,512,7168,256,256,8,ActivationType.Silu,torch.bfloat16,torch.bfloat16,torch.bfloat16,QuantType.No,1,1,ck,stage1,32,moe_ck2stages_gemm1_256x32x64x128_1x4_TypeCastExpertWeight_v1_Nswizzle0_Quant0_MulRoutedWeight1_silu_B16_B16_B16,522.3015,0.0,0.00%,86.34,5424.55
346,512,7168,256,256,8,ActivationType.Silu,torch.bfloat16,torch.bfloat16,torch.bfloat16,QuantType.No,1,1,ck,stage2,32,moe_ck2stages_gemm2_256x32x64x64_1x4_TypeCast_v1_Nswizzle0_Quant0_MulRoutedWeight0_B16_B16_B16,285.5801,0.0,0.00%,157.91,9921.04
347,512,7168,256,256,8,ActivationType.Silu,torch.bfloat16,torch.float8_e4m3fnuz,torch.float8_e4m3fnuz,QuantType.per_Tensor,1,0,asm,stage1,32,_ZN5aiter48fmoe_stage1_bf16_pertokenFp8_g1u1_32x256_2tg_pf2E,255.5268,42.94555555555556,0.00%,176.49,5558.31
347,512,7168,256,256,8,ActivationType.Silu,torch.bfloat16,torch.float8_e4m3fnuz,torch.float8_e4m3fnuz,QuantType.per_Tensor,1,0,ck,stage2,32,moe_ck2stages_gemm2_256x32x64x128_1x4_MulABScaleExpertWeight_v1_Nswizzle0_Quant1_MulRoutedWeight1_F8_F8_B16,160.187,42.94555555555556,1.29%,281.53,8866.49
348,512,7168,256,256,8,ActivationType.Silu,torch.bfloat16,torch.float8_e4m3fnuz,torch.float8_e4m3fnuz,QuantType.per_Tensor,1,1,asm,stage1,32,_ZN5aiter57fmoe_stage1_bf16_pertokenFp8_doweight_g1u1_32x256_2tg_pf2E,258.5096,44.22777777777782,0.00%,174.45,5494.17
348,512,7168,256,256,8,ActivationType.Silu,torch.bfloat16,torch.float8_e4m3fnuz,torch.float8_e4m3fnuz,QuantType.per_Tensor,1,1,ck,stage2,32,moe_ck2stages_gemm2_256x32x64x128_1x4_MulABScaleExpertWeight_v1_Nswizzle0_Quant1_MulRoutedWeight0_F8_F8_B16,155.9,44.22777777777782,0.00%,289.27,9110.3
349,512,7168,256,256,8,ActivationType.Silu,torch.bfloat16,torch.float8_e4m3fnuz,torch.float8_e4m3fnuz,QuantType.per_Token,1,0,asm,asm_1stage,32,_ZN5aiter48fmoe_bf16_pertokenFp8_g1u1_vs_silu_1tg_ps_32x256E,410.6355,0.0,0.00%,109.82,3458.78
350,512,7168,256,256,8,ActivationType.Silu,torch.bfloat16,torch.float8_e4m3fnuz,torch.float8_e4m3fnuz,QuantType.per_Token,1,1,asm,asm_1stage,32,_ZN5aiter50fmoe_bf16_pertokenFp8_g1u1_vs_tkw1_silu_1tg_32x256E,413.4332,0.0,0.00%,109.08,3435.37
351,512,7168,256,256,8,ActivationType.Gelu,torch.bfloat16,torch.float8_e4m3fnuz,torch.float8_e4m3fnuz,QuantType.per_1x128,1,0,asm,asm_1stage,32,_ZN5aiter50fmoe_bf16_blockscaleFp8_g1u1_vs_gelu_1tg_ps_32x256E,429.2279,0.0,2.17%,105.07,3308.96
352,512,7168,256,256,8,ActivationType.Gelu,torch.bfloat16,torch.float8_e4m3fnuz,torch.float8_e4m3fnuz,QuantType.per_1x128,1,1,ck,stage1,32,moe_ck2stages_gemm1_256x32x128x128_1x4_MulABScaleExpertWeightA8W8blkscale_v1_Nswizzle0_Quant4_MulRoutedWeight1_gelu_F8_F8_B16,275.911,40.72355555555564,0.01%,163.45,5147.66
352,512,7168,256,256,8,ActivationType.Gelu,torch.bfloat16,torch.float8_e4m3fnuz,torch.float8_e4m3fnuz,QuantType.per_1x128,1,1,ck,stage2,32,moe_ck2stages_gemm2_256x32x128x128_1x4_MulABScaleExpertWeightA8W8blkscale_v1_Nswizzle0_Quant4_MulRoutedWeight0_F8_F8_B16,160.578,40.72355555555564,16.62%,280.84,8844.9
353,512,7168,256,256,8,ActivationType.Silu,torch.bfloat16,torch.float8_e4m3fnuz,torch.float8_e4m3fnuz,QuantType.per_1x128,1,1,ck,stage1,32,moe_ck2stages_gemm1_256x32x128x128_1x4_MulABScaleExpertWeightA8W8blkscale_v1_Nswizzle0_Quant4_MulRoutedWeight1_silu_F8_F8_B16,269.158,40.91988888888893,0.01%,167.55,5276.81
353,512,7168,256,256,8,ActivationType.Silu,torch.bfloat16,torch.float8_e4m3fnuz,torch.float8_e4m3fnuz,QuantType.per_1x128,1,1,ck,stage2,32,moe_ck2stages_gemm2_256x32x128x128_1x4_MulABScaleExpertWeightA8W8blkscale_v1_Nswizzle0_Quant4_MulRoutedWeight0_F8_F8_B16,153.8513,40.91988888888893,16.63%,293.12,9231.62
354,512,7168,256,256,8,ActivationType.Silu,torch.bfloat16,torch.float8_e4m3fnuz,torch.float8_e4m3fnuz,QuantType.per_1x128,1,0,asm,asm_1stage,32,_ZN5aiter52fmoe_bf16_blockscaleFp8_g1u1_novs_silu_1tg_ps_32x256E,431.8911,0.0,0.00%,104.42,3288.55
355,512,7168,256,257,9,ActivationType.Silu,torch.bfloat16,torch.float8_e4m3fnuz,torch.float8_e4m3fnuz,QuantType.per_Token,1,0,asm,asm_1stage,32,_ZN5aiter48fmoe_bf16_pertokenFp8_g1u1_vs_silu_1tg_ps_32x256E,417.69,0.0,0.00%,121.46,3413.54
356,512,7168,256,257,9,ActivationType.Silu,torch.bfloat16,torch.float8_e4m3fnuz,torch.float8_e4m3fnuz,QuantType.per_1x128,1,0,asm,asm_1stage,32,_ZN5aiter49fmoe_bf16_blockscaleFp8_g1u1_novs_silu_1tg_32x256E,437.1717,0.0,0.00%,116.05,3261.42
357,512,7168,512,256,8,ActivationType.Gelu,torch.bfloat16,torch.bfloat16,torch.bfloat16,QuantType.No,1,0,ck,stage1,32,moe_ck2stages_gemm1_256x32x64x128_1x4_TypeCast_v1_Nswizzle0_Quant0_MulRoutedWeight0_gelu_B16_B16_B16,1029.1916,0.0,0.00%,87.64,5491.52
357,512,7168,512,256,8,ActivationType.Gelu,torch.bfloat16,torch.bfloat16,torch.bfloat16,QuantType.No,1,0,ck,stage2,32,moe_ck2stages_gemm2_256x32x64x128_1x4_TypeCastExpertWeight_v1_Nswizzle0_Quant0_MulRoutedWeight1_B16_B16_B16,561.455,0.0,3.32%,160.64,10066.39
358,512,7168,512,256,8,ActivationType.Gelu,torch.bfloat16,torch.bfloat16,torch.bfloat16,QuantType.No,1,1,ck,stage1,32,moe_ck2stages_gemm1_256x32x64x128_1x4_TypeCastExpertWeight_v1_Nswizzle0_Quant0_MulRoutedWeight1_gelu_B16_B16_B16,1028.2877,0.0,0.00%,87.71,5496.35
358,512,7168,512,256,8,ActivationType.Gelu,torch.bfloat16,torch.bfloat16,torch.bfloat16,QuantType.No,1,1,ck,stage2,32,moe_ck2stages_gemm2_256x32x64x128_1x4_TypeCast_v1_Nswizzle0_Quant0_MulRoutedWeight0_B16_B16_B16,558.21,0.0,0.01%,161.58,10124.91
359,512,7168,512,256,8,ActivationType.Gelu,torch.bfloat16,torch.float8_e4m3fnuz,torch.float8_e4m3fnuz,QuantType.per_Tensor,1,0,asm,stage1,32,_ZN5aiter44fmoe_stage1_bf16_pertokenFp8_g1u1_32x512_pf2E,515.7327,57.25633333333336,0.00%,174.89,5486.53
359,512,7168,512,256,8,ActivationType.Gelu,torch.bfloat16,torch.float8_e4m3fnuz,torch.float8_e4m3fnuz,QuantType.per_Tensor,1,0,ck,stage2,32,moe_ck2stages_gemm2_256x32x64x128_1x4_MulABScaleExpertWeight_v1_Nswizzle0_Quant1_MulRoutedWeight1_F8_F8_B16,287.3491,57.25633333333336,3.32%,313.88,9847.19
360,512,7168,512,256,8,ActivationType.Gelu,torch.bfloat16,torch.float8_e4m3fnuz,torch.float8_e4m3fnuz,QuantType.per_Tensor,1,1,asm,stage1,32,_ZN5aiter53fmoe_stage1_bf16_pertokenFp8_doweight_g1u1_32x512_pf3E,515.7609,60.72344444444445,0.00%,174.88,5486.23
360,512,7168,512,256,8,ActivationType.Gelu,torch.bfloat16,torch.float8_e4m3fnuz,torch.float8_e4m3fnuz,QuantType.per_Tensor,1,1,ck,stage2,32,moe_ck2stages_gemm2_256x32x64x128_1x4_MulABScaleExpertWeight_v1_Nswizzle0_Quant1_MulRoutedWeight0_F8_F8_B16,286.6909,60.72344444444445,0.01%,314.6,9869.8
361,512,7168,512,256,8,ActivationType.Gelu,torch.bfloat16,torch.float8_e4m3fnuz,torch.float8_e4m3fnuz,QuantType.per_Token,1,0,asm,asm_1stage,32,_ZN5aiter45fmoe_bf16_pertokenFp8_g1u1_vs_gelu_1tg_32x512E,811.9488,0.0,0.00%,111.08,3484.93
362,512,7168,512,256,8,ActivationType.Gelu,torch.bfloat16,torch.float8_e4m3fnuz,torch.float8_e4m3fnuz,QuantType.per_Token,1,1,asm,asm_1stage,32,_ZN5aiter50fmoe_bf16_pertokenFp8_g1u1_vs_tkw1_gelu_1tg_32x512E,808.0964,0.0,0.00%,111.61,3501.54
363,512,7168,512,256,8,ActivationType.Silu,torch.bfloat16,torch.bfloat16,torch.bfloat16,QuantType.No,1,1,ck,stage1,64,moe_ck2stages_gemm1_256x64x64x128_1x4_TypeCastExpertWeight_v1_Nswizzle0_Quant0_MulRoutedWeight1_silu_B16_B16_B16,1028.0464,0.0,0.00%,87.73,5497.64
363,512,7168,512,256,8,ActivationType.Silu,torch.bfloat16,torch.bfloat16,torch.bfloat16,QuantType.No,1,1,ck,stage2,64,moe_ck2stages_gemm2_256x64x64x64_1x4_TypeCast_v1_Nswizzle0_Quant0_MulRoutedWeight0_B16_B16_B16,564.1785,0.0,0.00%,159.87,10017.8
364,512,7168,512,256,8,ActivationType.Silu,torch.bfloat16,torch.float8_e4m3fnuz,torch.float8_e4m3fnuz,QuantType.per_Tensor,1,0,asm,stage1,32,_ZN5aiter44fmoe_stage1_bf16_pertokenFp8_g1u1_32x512_pf2E,515.0076,60.66999999999993,0.00%,175.13,5494.25
364,512,7168,512,256,8,ActivationType.Silu,torch.bfloat16,torch.float8_e4m3fnuz,torch.float8_e4m3fnuz,QuantType.per_Tensor,1,0,ck,stage2,32,moe_ck2stages_gemm2_256x32x64x256_1x4_MulABScaleExpertWeight_v1_Nswizzle0_Quant1_MulRoutedWeight1_F8_F8_B16,291.32,60.66999999999993,2.79%,309.61,9712.97
365,512,7168,512,256,8,ActivationType.Silu,torch.bfloat16,torch.float8_e4m3fnuz,torch.float8_e4m3fnuz,QuantType.per_Tensor,1,1,asm,stage1,32,_ZN5aiter53fmoe_stage1_bf16_pertokenFp8_doweight_g1u1_32x512_pf2E,515.186,58.96055555555555,0.00%,175.07,5492.35
365,512,7168,512,256,8,ActivationType.Silu,torch.bfloat16,torch.float8_e4m3fnuz,torch.float8_e4m3fnuz,QuantType.per_Tensor,1,1,ck,stage2,32,moe_ck2stages_gemm2_256x32x64x128_1x4_MulABScaleExpertWeight_v1_Nswizzle0_Quant1_MulRoutedWeight0_F8_F8_B16,287.2127,58.96055555555555,0.00%,314.03,9851.87
366,512,7168,512,256,8,ActivationType.Silu,torch.bfloat16,torch.float8_e4m3fnuz,torch.float8_e4m3fnuz,QuantType.per_Token,1,0,asm,asm_1stage,32,_ZN5aiter48fmoe_bf16_pertokenFp8_g1u1_vs_silu_1tg_ps_32x512E,811.1125,0.0,0.00%,111.2,3488.52
367,512,7168,512,256,8,ActivationType.Silu,torch.bfloat16,torch.float8_e4m3fnuz,torch.float8_e4m3fnuz,QuantType.per_Token,1,1,asm,asm_1stage,32,_ZN5aiter50fmoe_bf16_pertokenFp8_g1u1_vs_tkw1_silu_1tg_32x512E,806.6624,0.0,0.00%,111.81,3507.77
368,512,7168,512,256,8,ActivationType.Silu,torch.bfloat16,torch.bfloat16,torch.bfloat16,QuantType.No,1,0,ck,stage1,64,moe_ck2stages_gemm1_256x64x64x128_1x4_TypeCast_v1_Nswizzle0_Quant0_MulRoutedWeight0_silu_B16_B16_B16,1027.3801,0.0,0.00%,87.79,5501.2
368,512,7168,512,256,8,ActivationType.Silu,torch.bfloat16,torch.bfloat16,torch.bfloat16,QuantType.No,1,0,ck,stage2,64,moe_ck2stages_gemm2_256x64x64x64_1x4_TypeCastExpertWeight_v1_Nswizzle0_Quant0_MulRoutedWeight1_B16_B16_B16,559.706,0.0,2.83%,161.15,10097.85
369,512,7168,512,256,8,ActivationType.Gelu,torch.bfloat16,torch.float8_e4m3fnuz,torch.float8_e4m3fnuz,QuantType.per_1x128,1,0,asm,asm_1stage,32,_ZN5aiter50fmoe_bf16_blockscaleFp8_g1u1_vs_gelu_1tg_ps_32x256E,854.9402,0.0,10.03%,105.5,3309.68
370,512,7168,512,256,8,ActivationType.Silu,torch.bfloat16,torch.float8_e4m3fnuz,torch.float8_e4m3fnuz,QuantType.per_1x128,1,0,asm,asm_1stage,32,_ZN5aiter47fmoe_bf16_blockscaleFp8_g1u1_vs_silu_1tg_32x256E,849.8911,0.0,0.00%,106.12,3329.35
371,512,7168,512,256,8,ActivationType.Gelu,torch.bfloat16,torch.float8_e4m3fnuz,torch.float8_e4m3fnuz,QuantType.per_1x128,1,1,ck,stage1,32,moe_ck2stages_gemm1_256x32x128x128_1x4_MulABScaleExpertWeightA8W8blkscale_v1_Nswizzle0_Quant4_MulRoutedWeight1_gelu_F8_F8_B16,545.2301,58.59522222222222,0.01%,165.42,5189.7
371,512,7168,512,256,8,ActivationType.Gelu,torch.bfloat16,torch.float8_e4m3fnuz,torch.float8_e4m3fnuz,QuantType.per_1x128,1,1,ck,stage2,32,moe_ck2stages_gemm2_256x32x128x128_1x4_MulABScaleExpertWeightA8W8blkscale_v1_Nswizzle0_Quant4_MulRoutedWeight0_F8_F8_B16,307.8074,58.59522222222222,16.70%,293.02,9192.7
372,512,7168,512,256,8,ActivationType.Silu,torch.bfloat16,torch.float8_e4m3fnuz,torch.float8_e4m3fnuz,QuantType.per_1x128,1,1,ck,stage1,32,moe_ck2stages_gemm1_256x32x128x128_1x4_MulABScaleExpertWeightA8W8blkscale_v1_Nswizzle0_Quant4_MulRoutedWeight1_silu_F8_F8_B16,544.0302,59.11533333333325,0.02%,165.79,5201.15
372,512,7168,512,256,8,ActivationType.Silu,torch.bfloat16,torch.float8_e4m3fnuz,torch.float8_e4m3fnuz,QuantType.per_1x128,1,1,ck,stage2,32,moe_ck2stages_gemm2_256x32x128x128_1x4_MulABScaleExpertWeightA8W8blkscale_v1_Nswizzle0_Quant4_MulRoutedWeight0_F8_F8_B16,306.0405,59.11533333333325,16.73%,294.71,9245.78
373,512,7168,2048,33,10,ActivationType.Silu,torch.bfloat16,torch.float8_e4m3fnuz,torch.float8_e4m3fnuz,QuantType.per_1x128,1,0,asm,stage1,32,_ZN5aiter59fmoe_stage1_bf16_pertokenFp8_blockscale_g1u1_32x256_2tg_pf3E,540.6051,125.61411111111104,13.76%,834.2,2708.7
373,512,7168,2048,33,10,ActivationType.Silu,torch.bfloat16,torch.float8_e4m3fnuz,torch.float8_e4m3fnuz,QuantType.per_1x128,1,0,ck,stage2,32,moe_ck2stages_gemm2_256x32x128x128_1x4_MulABScaleExpertWeightA8W8blkscale_v1_Nswizzle0_Quant4_MulRoutedWeight1_F8_F8_B16,377.5628,125.61411111111104,16.79%,1194.43,3878.39
374,512,7168,2048,33,10,ActivationType.Silu,torch.bfloat16,torch.float8_e4m3fnuz,torch.float8_e4m3fnuz,QuantType.per_Token,1,0,asm,stage1,64,_ZN5aiter48fmoe_stage1_bf16_pertokenFp8_g1u1_64x128_2tg_pf3E,466.2973,109.38111111111114,0.00%,967.13,3140.35
374,512,7168,2048,33,10,ActivationType.Silu,torch.bfloat16,torch.float8_e4m3fnuz,torch.float8_e4m3fnuz,QuantType.per_Token,1,0,ck,stage2,64,moe_ck2stages_gemm2_256x64x128x128_1x4_MulABScaleExpertWeight_v3_Nswizzle0_Quant2_MulRoutedWeight1_F8_F8_B16,319.4319,109.38111111111114,7.61%,1411.79,4584.19
375,1024,2048,192,128,8,ActivationType.Silu,torch.bfloat16,torch.bfloat16,torch.bfloat16,QuantType.No,1,0,ck,stage1,64,moe_ck2stages_gemm1_256x64x64x64_1x4_TypeCast_v1_Nswizzle0_Quant0_MulRoutedWeight0_silu_B16_B16_B16,79.1452,0.0,0.00%,244.2,3921.63
375,1024,2048,192,128,8,ActivationType.Silu,torch.bfloat16,torch.bfloat16,torch.bfloat16,QuantType.No,1,0,ck,stage2,64,moe_ck2stages_gemm2_256x64x64x64_1x4_TypeCastExpertWeight_v1_Nswizzle0_Quant0_MulRoutedWeight1_B16_B16_B16,61.4526,0.0,0.00%,314.51,5050.7
376,1024,2048,192,128,8,ActivationType.Silu,torch.bfloat16,torch.bfloat16,torch.bfloat16,QuantType.No,1,1,ck,stage1,64,moe_ck2stages_gemm1_256x64x64x64_1x4_TypeCastExpertWeight_v1_Nswizzle0_Quant0_MulRoutedWeight1_silu_B16_B16_B16,79.7564,0.0,0.00%,242.33,3891.58
376,1024,2048,192,128,8,ActivationType.Silu,torch.bfloat16,torch.bfloat16,torch.bfloat16,QuantType.No,1,1,ck,stage2,64,moe_ck2stages_gemm2_256x64x64x64_1x4_TypeCast_v1_Nswizzle0_Quant0_MulRoutedWeight0_B16_B16_B16,60.9339,0.0,0.00%,317.19,5093.69
377,1024,2048,192,128,8,ActivationType.Gelu,torch.bfloat16,torch.bfloat16,torch.bfloat16,QuantType.No,1,0,ck,stage1,64,moe_ck2stages_gemm1_256x64x64x128_1x4_TypeCast_v1_Nswizzle0_Quant0_MulRoutedWeight0_gelu_B16_B16_B16,78.7465,0.0,0.00%,245.44,3941.49
377,1024,2048,192,128,8,ActivationType.Gelu,torch.bfloat16,torch.bfloat16,torch.bfloat16,QuantType.No,1,0,ck,stage2,64,moe_ck2stages_gemm2_256x64x64x64_1x4_TypeCastExpertWeight_v1_Nswizzle0_Quant0_MulRoutedWeight1_B16_B16_B16,61.2441,0.0,0.00%,315.58,5067.89
378,1024,2048,192,128,8,ActivationType.Gelu,torch.bfloat16,torch.bfloat16,torch.bfloat16,QuantType.No,1,1,ck,stage1,64,moe_ck2stages_gemm1_256x64x64x64_1x4_TypeCastExpertWeight_v1_Nswizzle0_Quant0_MulRoutedWeight1_gelu_B16_B16_B16,79.2454,0.0,0.00%,243.89,3916.68
378,1024,2048,192,128,8,ActivationType.Gelu,torch.bfloat16,torch.bfloat16,torch.bfloat16,QuantType.No,1,1,ck,stage2,64,moe_ck2stages_gemm2_256x64x64x64_1x4_TypeCast_v1_Nswizzle0_Quant0_MulRoutedWeight0_B16_B16_B16,60.883,0.0,0.00%,317.45,5097.95
379,1024,4096,192,128,8,ActivationType.Silu,torch.bfloat16,torch.bfloat16,torch.bfloat16,QuantType.No,1,0,ck,stage1,64,moe_ck2stages_gemm1_256x64x64x128_1x4_TypeCast_v1_Nswizzle0_Quant0_MulRoutedWeight0_silu_B16_B16_B16,166.6122,0.0,0.00%,232.0,3725.76
379,1024,4096,192,128,8,ActivationType.Silu,torch.bfloat16,torch.bfloat16,torch.bfloat16,QuantType.No,1,0,ck,stage2,64,moe_ck2stages_gemm2_256x64x64x64_1x4_TypeCastExpertWeight_v1_Nswizzle0_Quant0_MulRoutedWeight1_B16_B16_B16,108.5484,0.0,0.08%,356.11,5718.71
380,1024,4096,192,128,8,ActivationType.Silu,torch.bfloat16,torch.bfloat16,torch.bfloat16,QuantType.No,1,1,ck,stage1,64,moe_ck2stages_gemm1_256x64x64x128_1x4_TypeCastExpertWeight_v1_Nswizzle0_Quant0_MulRoutedWeight1_silu_B16_B16_B16,168.2222,0.0,0.00%,229.78,3690.1
380,1024,4096,192,128,8,ActivationType.Silu,torch.bfloat16,torch.bfloat16,torch.bfloat16,QuantType.No,1,1,ck,stage2,64,moe_ck2stages_gemm2_256x64x64x64_1x4_TypeCast_v1_Nswizzle0_Quant0_MulRoutedWeight0_B16_B16_B16,108.6552,0.0,0.00%,355.76,5713.09
381,1024,4096,192,128,8,ActivationType.Gelu,torch.bfloat16,torch.bfloat16,torch.bfloat16,QuantType.No,1,0,ck,stage1,64,moe_ck2stages_gemm1_256x64x64x64_1x4_TypeCast_v1_Nswizzle0_Quant0_MulRoutedWeight0_gelu_B16_B16_B16,169.2938,0.0,0.00%,228.33,3666.74
381,1024,4096,192,128,8,ActivationType.Gelu,torch.bfloat16,torch.bfloat16,torch.bfloat16,QuantType.No,1,0,ck,stage2,64,moe_ck2stages_gemm2_256x64x64x64_1x4_TypeCastExpertWeight_v1_Nswizzle0_Quant0_MulRoutedWeight1_B16_B16_B16,109.8842,0.0,0.12%,351.78,5649.19
382,1024,4096,192,128,8,ActivationType.Gelu,torch.bfloat16,torch.bfloat16,torch.bfloat16,QuantType.No,1,1,ck,stage1,64,moe_ck2stages_gemm1_256x64x64x128_1x4_TypeCastExpertWeight_v1_Nswizzle0_Quant0_MulRoutedWeight1_gelu_B16_B16_B16,165.112,0.0,0.00%,234.11,3759.61
382,1024,4096,192,128,8,ActivationType.Gelu,torch.bfloat16,torch.bfloat16,torch.bfloat16,QuantType.No,1,1,ck,stage2,64,moe_ck2stages_gemm2_256x64x64x64_1x4_TypeCast_v1_Nswizzle0_Quant0_MulRoutedWeight0_B16_B16_B16,106.4115,0.0,0.00%,363.26,5833.55
383,1024,4096,384,128,8,ActivationType.Gelu,torch.bfloat16,torch.bfloat16,torch.bfloat16,QuantType.No,1,0,ck,stage1,64,moe_ck2stages_gemm1_256x64x128x64_1x4_TypeCast_v3_Nswizzle0_Quant0_MulRoutedWeight0_gelu_B16_B16_B16,319.3385,0.0,0.00%,242.09,3835.23
383,1024,4096,384,128,8,ActivationType.Gelu,torch.bfloat16,torch.bfloat16,torch.bfloat16,QuantType.No,1,0,ck,stage2,64,moe_ck2stages_gemm2_256x64x64x64_1x4_TypeCastExpertWeight_v1_Nswizzle0_Quant0_MulRoutedWeight1_B16_B16_B16,171.7373,0.0,0.51%,450.16,7131.45
384,1024,4096,384,128,8,ActivationType.Silu,torch.bfloat16,torch.bfloat16,torch.bfloat16,QuantType.No,1,0,ck,stage1,128,moe_ck2stages_gemm1_256x128x64x64_1x4_TypeCast_v1_Nswizzle0_Quant0_MulRoutedWeight0_silu_B16_B16_B16,286.9943,0.0,0.00%,269.38,4267.46
384,1024,4096,384,128,8,ActivationType.Silu,torch.bfloat16,torch.bfloat16,torch.bfloat16,QuantType.No,1,0,ck,stage2,128,moe_ck2stages_gemm2_256x128x128x64_1x4_TypeCastExpertWeight_v3_Nswizzle0_Quant0_MulRoutedWeight1_B16_B16_B16,200.8457,0.0,0.37%,384.92,6097.9
385,1024,4096,384,128,8,ActivationType.Silu,torch.bfloat16,torch.bfloat16,torch.bfloat16,QuantType.No,1,1,ck,stage1,128,moe_ck2stages_gemm1_256x128x64x64_1x4_TypeCastExpertWeight_v1_Nswizzle0_Quant0_MulRoutedWeight1_silu_B16_B16_B16,283.779,0.0,0.00%,272.43,4315.81
385,1024,4096,384,128,8,ActivationType.Silu,torch.bfloat16,torch.bfloat16,torch.bfloat16,QuantType.No,1,1,ck,stage2,128,moe_ck2stages_gemm2_256x128x128x64_1x4_TypeCast_v3_Nswizzle0_Quant0_MulRoutedWeight0_B16_B16_B16,190.4146,0.0,0.00%,406.01,6431.95
386,1024,4096,384,128,8,ActivationType.Silu,torch.bfloat16,torch.float8_e4m3fnuz,torch.float8_e4m3fnuz,QuantType.per_Tensor,1,0,ck,stage1,64,moe_ck2stages_gemm1_256x64x128x128_1x4_MulABScale_v3_Nswizzle0_Quant1_MulRoutedWeight0_silu_F8_F8_B16,158.5218,65.38377777777767,0.00%,487.69,3889.45
386,1024,4096,384,128,8,ActivationType.Silu,torch.bfloat16,torch.float8_e4m3fnuz,torch.float8_e4m3fnuz,QuantType.per_Tensor,1,0,ck,stage2,64,moe_ck2stages_gemm2_256x64x128x128_1x4_MulABScaleExpertWeight_v3_Nswizzle0_Quant1_MulRoutedWeight1_F8_F8_B16,136.0927,65.38377777777767,0.36%,568.06,4530.46
387,1024,4096,384,128,8,ActivationType.Silu,torch.bfloat16,torch.float8_e4m3fnuz,torch.float8_e4m3fnuz,QuantType.per_Tensor,1,1,ck,stage1,128,moe_ck2stages_gemm1_256x128x64x128_1x4_MulABScale_v1_Nswizzle0_Quant1_MulRoutedWeight1_silu_F8_F8_B16,157.6035,64.98711111111106,0.00%,490.53,3912.11
387,1024,4096,384,128,8,ActivationType.Silu,torch.bfloat16,torch.float8_e4m3fnuz,torch.float8_e4m3fnuz,QuantType.per_Tensor,1,1,ck,stage2,128,moe_ck2stages_gemm2_256x128x64x128_1x4_MulABScaleExpertWeight_v1_Nswizzle0_Quant1_MulRoutedWeight0_F8_F8_B16,127.6811,64.98711111111106,0.00%,605.49,4828.93
388,1024,4096,384,128,8,ActivationType.Silu,torch.bfloat16,torch.float8_e4m3fnuz,torch.float8_e4m3fnuz,QuantType.per_Token,1,0,asm,stage1,64,_ZN5aiter48fmoe_stage1_bf16_pertokenFp8_g1u1_64x128_2tg_pf3E,162.0644,59.6047777777778,0.00%,477.03,3804.43
388,1024,4096,384,128,8,ActivationType.Silu,torch.bfloat16,torch.float8_e4m3fnuz,torch.float8_e4m3fnuz,QuantType.per_Token,1,0,ck,stage2,64,moe_ck2stages_gemm2_256x64x128x128_1x4_MulABScaleExpertWeight_v3_Nswizzle0_Quant2_MulRoutedWeight1_F8_F8_B16,154.4748,59.6047777777778,0.37%,500.47,3991.35
389,1024,4096,384,128,8,ActivationType.Silu,torch.bfloat16,torch.float8_e4m3fnuz,torch.float8_e4m3fnuz,QuantType.per_Token,1,1,asm,stage1,64,_ZN5aiter57fmoe_stage1_bf16_pertokenFp8_doweight_g1u1_64x128_2tg_pf3E,157.9946,60.22800000000007,0.00%,489.32,3902.43
389,1024,4096,384,128,8,ActivationType.Silu,torch.bfloat16,torch.float8_e4m3fnuz,torch.float8_e4m3fnuz,QuantType.per_Token,1,1,ck,stage2,64,moe_ck2stages_gemm2_256x64x128x128_1x4_MulABScaleExpertWeight_v3_Nswizzle0_Quant2_MulRoutedWeight0_F8_F8_B16,153.2658,60.22800000000007,0.00%,504.41,4022.83
390,1024,4096,384,128,8,ActivationType.Gelu,torch.bfloat16,torch.bfloat16,torch.bfloat16,QuantType.No,1,1,ck,stage1,128,moe_ck2stages_gemm1_256x128x64x64_1x4_TypeCastExpertWeight_v1_Nswizzle0_Quant0_MulRoutedWeight1_gelu_B16_B16_B16,292.7653,0.0,0.00%,264.07,4183.34
390,1024,4096,384,128,8,ActivationType.Gelu,torch.bfloat16,torch.bfloat16,torch.bfloat16,QuantType.No,1,1,ck,stage2,128,moe_ck2stages_gemm2_256x128x128x64_1x4_TypeCast_v3_Nswizzle0_Quant0_MulRoutedWeight0_B16_B16_B16,190.9347,0.0,0.00%,404.9,6414.43
391,1024,4096,384,128,8,ActivationType.Gelu,torch.bfloat16,torch.float8_e4m3fnuz,torch.float8_e4m3fnuz,QuantType.per_Tensor,1,0,asm,stage1,64,_ZN5aiter48fmoe_stage1_bf16_pertokenFp8_g1u1_64x128_2tg_pf2E,162.7056,63.97255555555557,0.00%,475.15,3789.44
391,1024,4096,384,128,8,ActivationType.Gelu,torch.bfloat16,torch.float8_e4m3fnuz,torch.float8_e4m3fnuz,QuantType.per_Tensor,1,0,ck,stage2,64,moe_ck2stages_gemm2_256x64x128x128_1x4_MulABScaleExpertWeight_v3_Nswizzle0_Quant1_MulRoutedWeight1_F8_F8_B16,136.8711,63.97255555555557,0.50%,564.83,4504.7
392,1024,4096,384,128,8,ActivationType.Gelu,torch.bfloat16,torch.float8_e4m3fnuz,torch.float8_e4m3fnuz,QuantType.per_Tensor,1,1,ck,stage1,128,moe_ck2stages_gemm1_256x128x64x128_1x4_MulABScale_v1_Nswizzle0_Quant1_MulRoutedWeight1_gelu_F8_F8_B16,155.4112,65.21422222222222,0.00%,497.45,3967.3
392,1024,4096,384,128,8,ActivationType.Gelu,torch.bfloat16,torch.float8_e4m3fnuz,torch.float8_e4m3fnuz,QuantType.per_Tensor,1,1,ck,stage2,128,moe_ck2stages_gemm2_256x128x64x128_1x4_MulABScaleExpertWeight_v1_Nswizzle0_Quant1_MulRoutedWeight0_F8_F8_B16,129.1577,65.21422222222222,0.00%,598.57,4773.72
393,1024,4096,384,128,8,ActivationType.Gelu,torch.bfloat16,torch.float8_e4m3fnuz,torch.float8_e4m3fnuz,QuantType.per_Token,1,0,asm,stage1,64,_ZN5aiter48fmoe_stage1_bf16_pertokenFp8_g1u1_64x128_2tg_pf3E,156.7304,60.246111111111205,0.05%,493.26,3933.91
393,1024,4096,384,128,8,ActivationType.Gelu,torch.bfloat16,torch.float8_e4m3fnuz,torch.float8_e4m3fnuz,QuantType.per_Token,1,0,ck,stage2,64,moe_ck2stages_gemm2_256x64x128x128_1x4_MulABScaleExpertWeight_v3_Nswizzle0_Quant2_MulRoutedWeight1_F8_F8_B16,154.4916,60.246111111111205,0.50%,500.41,3990.91
394,1024,4096,384,128,8,ActivationType.Gelu,torch.bfloat16,torch.float8_e4m3fnuz,torch.float8_e4m3fnuz,QuantType.per_Token,1,1,asm,stage1,64,_ZN5aiter57fmoe_stage1_bf16_pertokenFp8_doweight_g1u1_64x128_2tg_pf3E,162.9111,50.088222222222186,0.00%,474.55,3784.66
394,1024,4096,384,128,8,ActivationType.Gelu,torch.bfloat16,torch.float8_e4m3fnuz,torch.float8_e4m3fnuz,QuantType.per_Token,1,1,ck,stage2,64,moe_ck2stages_gemm2_256x64x128x128_1x4_MulABScaleExpertWeight_v3_Nswizzle0_Quant2_MulRoutedWeight0_F8_F8_B16,151.7121,50.088222222222186,0.00%,509.58,4064.03
395,1024,4096,384,128,8,ActivationType.Silu,torch.bfloat16,torch.float8_e4m3fnuz,torch.float8_e4m3fnuz,QuantType.per_1x128,1,0,asm,stage1,64,_ZN5aiter59fmoe_stage1_bf16_pertokenFp8_blockscale_g1u1_64x128_2tg_pf3E,164.9591,72.98544444444444,12.61%,468.66,3737.67
395,1024,4096,384,128,8,ActivationType.Silu,torch.bfloat16,torch.float8_e4m3fnuz,torch.float8_e4m3fnuz,QuantType.per_1x128,1,0,ck,stage2,64,moe_ck2stages_gemm2_256x64x128x128_1x4_MulABScaleExpertWeightA8W8blkscale_v3_Nswizzle0_Quant4_MulRoutedWeight1_F8_F8_B16,172.095,72.98544444444444,15.49%,449.23,3582.69
396,1024,4096,384,128,8,ActivationType.Gelu,torch.bfloat16,torch.float8_e4m3fnuz,torch.float8_e4m3fnuz,QuantType.per_1x128,1,0,asm,stage1,64,_ZN5aiter59fmoe_stage1_bf16_pertokenFp8_blockscale_g1u1_64x128_2tg_pf3E,170.9472,73.16744444444436,12.71%,452.24,3606.74
396,1024,4096,384,128,8,ActivationType.Gelu,torch.bfloat16,torch.float8_e4m3fnuz,torch.float8_e4m3fnuz,QuantType.per_1x128,1,0,ck,stage2,64,moe_ck2stages_gemm2_256x64x128x128_1x4_MulABScaleExpertWeightA8W8blkscale_v3_Nswizzle0_Quant4_MulRoutedWeight1_F8_F8_B16,170.3403,73.16744444444436,15.48%,453.85,3619.59
397,1024,4096,384,128,8,ActivationType.Silu,torch.bfloat16,torch.float8_e4m3fnuz,torch.float8_e4m3fnuz,QuantType.per_1x128,1,1,ck,stage1,64,moe_ck2stages_gemm1_256x64x128x128_1x4_MulABScaleExpertWeightA8W8blkscale_v3_Nswizzle0_Quant4_MulRoutedWeight1_silu_F8_F8_B16,187.1893,72.26844444444443,0.01%,413.0,3293.79
397,1024,4096,384,128,8,ActivationType.Silu,torch.bfloat16,torch.float8_e4m3fnuz,torch.float8_e4m3fnuz,QuantType.per_1x128,1,1,ck,stage2,64,moe_ck2stages_gemm2_256x64x128x128_1x4_MulABScaleExpertWeightA8W8blkscale_v3_Nswizzle0_Quant4_MulRoutedWeight0_F8_F8_B16,172.0477,72.26844444444443,16.71%,449.35,3583.67
398,1024,4096,384,128,8,ActivationType.Gelu,torch.bfloat16,torch.float8_e4m3fnuz,torch.float8_e4m3fnuz,QuantType.per_1x128,1,1,ck,stage1,32,moe_ck2stages_gemm1_256x32x128x128_1x4_MulABScaleExpertWeightA8W8blkscale_v1_Nswizzle0_Quant4_MulRoutedWeight1_gelu_F8_F8_B16,243.6922,73.65711111111104,0.01%,317.24,2530.09
398,1024,4096,384,128,8,ActivationType.Gelu,torch.bfloat16,torch.float8_e4m3fnuz,torch.float8_e4m3fnuz,QuantType.per_1x128,1,1,ck,stage2,32,moe_ck2stages_gemm2_256x32x128x128_1x4_MulABScaleExpertWeightA8W8blkscale_v1_Nswizzle0_Quant4_MulRoutedWeight0_F8_F8_B16,116.5725,73.65711111111104,16.69%,663.19,5289.09
399,1024,7168,256,256,8,ActivationType.Gelu,torch.bfloat16,torch.bfloat16,torch.bfloat16,QuantType.No,1,0,ck,stage1,64,moe_ck2stages_gemm1_256x64x128x128_1x4_TypeCast_v3_Nswizzle0_Quant0_MulRoutedWeight0_gelu_B16_B16_B16,531.1111,0.0,0.00%,169.82,5362.22
399,1024,7168,256,256,8,ActivationType.Gelu,torch.bfloat16,torch.bfloat16,torch.bfloat16,QuantType.No,1,0,ck,stage2,64,moe_ck2stages_gemm2_256x64x64x64_1x4_TypeCastExpertWeight_v1_Nswizzle0_Quant0_MulRoutedWeight1_B16_B16_B16,332.904,0.0,1.63%,270.93,8554.82
400,1024,7168,256,256,8,ActivationType.Gelu,torch.bfloat16,torch.bfloat16,torch.bfloat16,QuantType.No,1,1,ck,stage1,64,moe_ck2stages_gemm1_256x64x128x128_1x4_TypeCastExpertWeight_v3_Nswizzle0_Quant0_MulRoutedWeight1_gelu_B16_B16_B16,528.1473,0.0,0.00%,170.77,5392.31
400,1024,7168,256,256,8,ActivationType.Gelu,torch.bfloat16,torch.bfloat16,torch.bfloat16,QuantType.No,1,1,ck,stage2,64,moe_ck2stages_gemm2_256x64x64x128_1x4_TypeCast_v1_Nswizzle0_Quant0_MulRoutedWeight0_B16_B16_B16,329.3963,0.0,0.00%,273.82,8645.92
401,1024,7168,256,256,8,ActivationType.Gelu,torch.bfloat16,torch.float8_e4m3fnuz,torch.float8_e4m3fnuz,QuantType.per_Tensor,1,0,ck,stage1,64,moe_ck2stages_gemm1_256x64x128x128_1x4_MulABScale_v3_Nswizzle0_Quant1_MulRoutedWeight0_gelu_F8_F8_B16,276.7325,59.40977777777771,0.00%,325.93,5172.17
401,1024,7168,256,256,8,ActivationType.Gelu,torch.bfloat16,torch.float8_e4m3fnuz,torch.float8_e4m3fnuz,QuantType.per_Tensor,1,0,ck,stage2,64,moe_ck2stages_gemm2_256x64x64x256_1x4_MulABScaleExpertWeight_v1_Nswizzle0_Quant1_MulRoutedWeight1_F8_F8_B16,228.4284,59.40977777777771,1.62%,394.85,6265.89
402,1024,7168,256,256,8,ActivationType.Gelu,torch.bfloat16,torch.float8_e4m3fnuz,torch.float8_e4m3fnuz,QuantType.per_Tensor,1,1,ck,stage1,64,moe_ck2stages_gemm1_256x64x128x128_1x4_MulABScale_v3_Nswizzle0_Quant1_MulRoutedWeight1_gelu_F8_F8_B16,275.5189,60.77666666666671,0.00%,327.36,5194.95
402,1024,7168,256,256,8,ActivationType.Gelu,torch.bfloat16,torch.float8_e4m3fnuz,torch.float8_e4m3fnuz,QuantType.per_Tensor,1,1,ck,stage2,64,moe_ck2stages_gemm2_256x64x64x256_1x4_MulABScaleExpertWeight_v1_Nswizzle0_Quant1_MulRoutedWeight0_F8_F8_B16,218.7437,60.77666666666671,0.00%,412.33,6543.3
403,1024,7168,256,256,8,ActivationType.Gelu,torch.bfloat16,torch.float8_e4m3fnuz,torch.float8_e4m3fnuz,QuantType.per_Token,1,0,asm,asm_1stage,32,_ZN5aiter45fmoe_bf16_pertokenFp8_g1u1_vs_gelu_1tg_32x256E,547.2601,0.0,0.00%,164.81,2615.4
404,1024,7168,256,256,8,ActivationType.Gelu,torch.bfloat16,torch.float8_e4m3fnuz,torch.float8_e4m3fnuz,QuantType.per_Token,1,1,asm,asm_1stage,32,_ZN5aiter50fmoe_bf16_pertokenFp8_g1u1_vs_tkw1_gelu_1tg_32x256E,551.049,0.0,0.00%,163.68,2597.42
405,1024,7168,256,256,8,ActivationType.Silu,torch.bfloat16,torch.bfloat16,torch.bfloat16,QuantType.No,1,0,ck,stage1,64,moe_ck2stages_gemm1_256x64x128x128_1x4_TypeCast_v3_Nswizzle0_Quant0_MulRoutedWeight0_silu_B16_B16_B16,529.2301,0.0,0.00%,170.43,5381.27
405,1024,7168,256,256,8,ActivationType.Silu,torch.bfloat16,torch.bfloat16,torch.bfloat16,QuantType.No,1,0,ck,stage2,64,moe_ck2stages_gemm2_256x64x64x64_1x4_TypeCastExpertWeight_v1_Nswizzle0_Quant0_MulRoutedWeight1_B16_B16_B16,335.32,0.0,1.30%,268.98,8493.18
406,1024,7168,256,256,8,ActivationType.Silu,torch.bfloat16,torch.bfloat16,torch.bfloat16,QuantType.No,1,1,ck,stage1,64,moe_ck2stages_gemm1_256x64x128x128_1x4_TypeCastExpertWeight_v3_Nswizzle0_Quant0_MulRoutedWeight1_silu_B16_B16_B16,529.3701,0.0,0.00%,170.38,5379.85
406,1024,7168,256,256,8,ActivationType.Silu,torch.bfloat16,torch.bfloat16,torch.bfloat16,QuantType.No,1,1,ck,stage2,64,moe_ck2stages_gemm2_256x64x64x64_1x4_TypeCast_v1_Nswizzle0_Quant0_MulRoutedWeight0_B16_B16_B16,326.2986,0.0,0.00%,276.42,8727.99
407,1024,7168,256,256,8,ActivationType.Silu,torch.bfloat16,torch.float8_e4m3fnuz,torch.float8_e4m3fnuz,QuantType.per_Tensor,1,0,ck,stage1,64,moe_ck2stages_gemm1_256x64x128x128_1x4_MulABScale_v3_Nswizzle0_Quant1_MulRoutedWeight0_silu_F8_F8_B16,274.4403,60.95877777777778,0.00%,328.65,5215.36
407,1024,7168,256,256,8,ActivationType.Silu,torch.bfloat16,torch.float8_e4m3fnuz,torch.float8_e4m3fnuz,QuantType.per_Tensor,1,0,ck,stage2,64,moe_ck2stages_gemm2_256x64x64x256_1x4_MulABScaleExpertWeight_v1_Nswizzle0_Quant1_MulRoutedWeight1_F8_F8_B16,223.4642,60.95877777777778,1.30%,403.62,6405.08
408,1024,7168,256,256,8,ActivationType.Silu,torch.bfloat16,torch.float8_e4m3fnuz,torch.float8_e4m3fnuz,QuantType.per_Tensor,1,1,ck,stage1,64,moe_ck2stages_gemm1_256x64x128x128_1x4_MulABScale_v3_Nswizzle0_Quant1_MulRoutedWeight1_silu_F8_F8_B16,276.2106,59.29922222222222,0.00%,326.54,5181.94
408,1024,7168,256,256,8,ActivationType.Silu,torch.bfloat16,torch.float8_e4m3fnuz,torch.float8_e4m3fnuz,QuantType.per_Tensor,1,1,ck,stage2,64,moe_ck2stages_gemm2_256x64x64x256_1x4_MulABScaleExpertWeight_v1_Nswizzle0_Quant1_MulRoutedWeight0_F8_F8_B16,215.7357,59.29922222222222,0.00%,418.08,6634.54
409,1024,7168,256,256,8,ActivationType.Silu,torch.bfloat16,torch.float8_e4m3fnuz,torch.float8_e4m3fnuz,QuantType.per_Token,1,0,asm,asm_1stage,32,_ZN5aiter45fmoe_bf16_pertokenFp8_g1u1_vs_silu_1tg_32x256E,551.7997,0.0,0.00%,163.45,2593.89
410,1024,7168,256,256,8,ActivationType.Silu,torch.bfloat16,torch.float8_e4m3fnuz,torch.float8_e4m3fnuz,QuantType.per_Token,1,1,asm,asm_1stage,32,_ZN5aiter50fmoe_bf16_pertokenFp8_g1u1_vs_tkw1_silu_1tg_32x256E,551.5413,0.0,0.00%,163.53,2595.1
411,1024,7168,256,256,8,ActivationType.Gelu,torch.bfloat16,torch.float8_e4m3fnuz,torch.float8_e4m3fnuz,QuantType.per_1x128,1,0,asm,asm_1stage,32,_ZN5aiter47fmoe_bf16_blockscaleFp8_g1u1_vs_gelu_1tg_32x256E,558.482,0.0,2.15%,161.5,2562.85
412,1024,7168,256,256,8,ActivationType.Gelu,torch.bfloat16,torch.float8_e4m3fnuz,torch.float8_e4m3fnuz,QuantType.per_1x128,1,1,ck,stage1,32,moe_ck2stages_gemm1_256x32x128x128_1x4_MulABScaleExpertWeightA8W8blkscale_v1_Nswizzle0_Quant4_MulRoutedWeight1_gelu_F8_F8_B16,365.9359,60.72688888888893,0.01%,246.48,3911.36
412,1024,7168,256,256,8,ActivationType.Gelu,torch.bfloat16,torch.float8_e4m3fnuz,torch.float8_e4m3fnuz,QuantType.per_1x128,1,1,ck,stage2,32,moe_ck2stages_gemm2_256x32x128x128_1x4_MulABScaleExpertWeightA8W8blkscale_v1_Nswizzle0_Quant4_MulRoutedWeight0_F8_F8_B16,200.5992,60.72688888888893,16.65%,449.62,7135.15
413,1024,7168,256,256,8,ActivationType.Silu,torch.bfloat16,torch.float8_e4m3fnuz,torch.float8_e4m3fnuz,QuantType.per_1x128,1,1,ck,stage1,32,moe_ck2stages_gemm1_256x32x128x128_1x4_MulABScaleExpertWeightA8W8blkscale_v1_Nswizzle0_Quant4_MulRoutedWeight1_silu_F8_F8_B16,364.4076,59.5473333333333,0.01%,247.51,3927.76
413,1024,7168,256,256,8,ActivationType.Silu,torch.bfloat16,torch.float8_e4m3fnuz,torch.float8_e4m3fnuz,QuantType.per_1x128,1,1,ck,stage2,32,moe_ck2stages_gemm2_256x32x128x128_1x4_MulABScaleExpertWeightA8W8blkscale_v1_Nswizzle0_Quant4_MulRoutedWeight0_F8_F8_B16,196.4491,59.5473333333333,16.65%,459.12,7285.89
414,1024,7168,256,256,8,ActivationType.Silu,torch.bfloat16,torch.float8_e4m3fnuz,torch.float8_e4m3fnuz,QuantType.per_1x128,1,0,asm,asm_1stage,32,_ZN5aiter49fmoe_bf16_blockscaleFp8_g1u1_novs_silu_1tg_32x256E,560.5611,0.0,0.00%,160.9,2553.35
415,1024,7168,256,257,9,ActivationType.Silu,torch.bfloat16,torch.float8_e4m3fnuz,torch.float8_e4m3fnuz,QuantType.per_Token,1,0,asm,stage1,64,_ZN5aiter44fmoe_stage1_bf16_pertokenFp8_g1u1_64x256_pf2E,268.9545,57.61511111111108,0.00%,377.27,5342.21
415,1024,7168,256,257,9,ActivationType.Silu,torch.bfloat16,torch.float8_e4m3fnuz,torch.float8_e4m3fnuz,QuantType.per_Token,1,0,ck,stage2,64,moe_ck2stages_gemm2_256x64x64x256_1x4_MulABScaleExpertWeight_v1_Nswizzle0_Quant2_MulRoutedWeight1_F8_F8_B16,267.1069,57.61511111111108,1.37%,379.88,5379.16
416,1024,7168,256,257,9,ActivationType.Silu,torch.bfloat16,torch.float8_e4m3fnuz,torch.float8_e4m3fnuz,QuantType.per_1x128,1,0,asm,asm_1stage,32,_ZN5aiter52fmoe_bf16_blockscaleFp8_g1u1_novs_silu_1tg_ps_32x256E,604.2016,0.0,0.00%,167.94,2378.03
417,1024,7168,512,256,8,ActivationType.Gelu,torch.bfloat16,torch.bfloat16,torch.bfloat16,QuantType.No,1,0,ck,stage1,64,moe_ck2stages_gemm1_256x64x128x128_1x4_TypeCast_v3_Nswizzle0_Quant0_MulRoutedWeight0_gelu_B16_B16_B16,1051.738,0.0,0.00%,171.51,5387.75
417,1024,7168,512,256,8,ActivationType.Gelu,torch.bfloat16,torch.bfloat16,torch.bfloat16,QuantType.No,1,0,ck,stage2,64,moe_ck2stages_gemm2_256x64x128x128_1x4_TypeCastExpertWeight_v3_Nswizzle0_Quant0_MulRoutedWeight1_B16_B16_B16,615.2484,0.0,3.29%,293.2,9210.11
418,1024,7168,512,256,8,ActivationType.Gelu,torch.bfloat16,torch.bfloat16,torch.bfloat16,QuantType.No,1,1,ck,stage1,64,moe_ck2stages_gemm1_256x64x128x64_1x4_TypeCastExpertWeight_v3_Nswizzle0_Quant0_MulRoutedWeight1_gelu_B16_B16_B16,1053.1241,0.0,0.00%,171.29,5380.66
418,1024,7168,512,256,8,ActivationType.Gelu,torch.bfloat16,torch.bfloat16,torch.bfloat16,QuantType.No,1,1,ck,stage2,64,moe_ck2stages_gemm2_256x64x128x128_1x4_TypeCast_v3_Nswizzle0_Quant0_MulRoutedWeight0_B16_B16_B16,610.7361,0.0,0.01%,295.36,9278.16
419,1024,7168,512,256,8,ActivationType.Gelu,torch.bfloat16,torch.float8_e4m3fnuz,torch.float8_e4m3fnuz,QuantType.per_Tensor,1,0,asm,stage1,64,_ZN5aiter44fmoe_stage1_bf16_pertokenFp8_g1u1_64x256_pf2E,538.5174,66.26455555555546,0.00%,334.97,5274.84
419,1024,7168,512,256,8,ActivationType.Gelu,torch.bfloat16,torch.float8_e4m3fnuz,torch.float8_e4m3fnuz,QuantType.per_Tensor,1,0,ck,stage2,64,moe_ck2stages_gemm2_256x64x64x256_1x4_MulABScaleExpertWeight_v1_Nswizzle0_Quant1_MulRoutedWeight1_F8_F8_B16,353.2943,66.26455555555546,3.27%,510.59,8040.3
420,1024,7168,512,256,8,ActivationType.Gelu,torch.bfloat16,torch.float8_e4m3fnuz,torch.float8_e4m3fnuz,QuantType.per_Tensor,1,1,asm,stage1,64,_ZN5aiter53fmoe_stage1_bf16_pertokenFp8_doweight_g1u1_64x256_pf2E,537.506,68.53077777777779,0.00%,335.6,5284.76
420,1024,7168,512,256,8,ActivationType.Gelu,torch.bfloat16,torch.float8_e4m3fnuz,torch.float8_e4m3fnuz,QuantType.per_Tensor,1,1,ck,stage2,64,moe_ck2stages_gemm2_256x64x64x256_1x4_MulABScaleExpertWeight_v1_Nswizzle0_Quant1_MulRoutedWeight0_F8_F8_B16,345.7691,68.53077777777779,0.01%,521.7,8215.29
421,1024,7168,512,256,8,ActivationType.Gelu,torch.bfloat16,torch.float8_e4m3fnuz,torch.float8_e4m3fnuz,QuantType.per_Token,1,0,asm,stage1,64,_ZN5aiter44fmoe_stage1_bf16_pertokenFp8_g1u1_64x256_pf2E,526.8133,60.838111111111125,0.00%,342.41,5392.03
421,1024,7168,512,256,8,ActivationType.Gelu,torch.bfloat16,torch.float8_e4m3fnuz,torch.float8_e4m3fnuz,QuantType.per_Token,1,0,ck,stage2,64,moe_ck2stages_gemm2_256x64x64x256_1x4_MulABScaleExpertWeight_v1_Nswizzle0_Quant2_MulRoutedWeight1_F8_F8_B16,383.545,60.838111111111125,3.26%,470.32,7406.15
422,1024,7168,512,256,8,ActivationType.Gelu,torch.bfloat16,torch.float8_e4m3fnuz,torch.float8_e4m3fnuz,QuantType.per_Token,1,1,asm,stage1,64,_ZN5aiter53fmoe_stage1_bf16_pertokenFp8_doweight_g1u1_64x256_pf2E,529.3682,62.05733333333337,0.00%,340.76,5366.0
422,1024,7168,512,256,8,ActivationType.Gelu,torch.bfloat16,torch.float8_e4m3fnuz,torch.float8_e4m3fnuz,QuantType.per_Token,1,1,ck,stage2,64,moe_ck2stages_gemm2_256x64x64x256_1x4_MulABScaleExpertWeight_v1_Nswizzle0_Quant2_MulRoutedWeight0_F8_F8_B16,375.1291,62.05733333333337,0.01%,480.87,7572.31
423,1024,7168,512,256,8,ActivationType.Silu,torch.bfloat16,torch.bfloat16,torch.bfloat16,QuantType.No,1,1,ck,stage1,64,moe_ck2stages_gemm1_256x64x128x128_1x4_TypeCastExpertWeight_v3_Nswizzle0_Quant0_MulRoutedWeight1_silu_B16_B16_B16,1054.1015,0.0,0.00%,171.13,5375.67
423,1024,7168,512,256,8,ActivationType.Silu,torch.bfloat16,torch.bfloat16,torch.bfloat16,QuantType.No,1,1,ck,stage2,64,moe_ck2stages_gemm2_256x64x128x128_1x4_TypeCast_v3_Nswizzle0_Quant0_MulRoutedWeight0_B16_B16_B16,613.8877,0.0,0.01%,293.85,9230.52
424,1024,7168,512,256,8,ActivationType.Silu,torch.bfloat16,torch.float8_e4m3fnuz,torch.float8_e4m3fnuz,QuantType.per_Tensor,1,0,asm,stage1,64,_ZN5aiter44fmoe_stage1_bf16_pertokenFp8_g1u1_64x256_pf2E,538.4862,67.62666666666672,0.00%,334.99,5275.14
424,1024,7168,512,256,8,ActivationType.Silu,torch.bfloat16,torch.float8_e4m3fnuz,torch.float8_e4m3fnuz,QuantType.per_Tensor,1,0,ck,stage2,64,moe_ck2stages_gemm2_256x64x64x256_1x4_MulABScaleExpertWeight_v1_Nswizzle0_Quant1_MulRoutedWeight1_F8_F8_B16,352.4778,67.62666666666672,2.78%,511.77,8058.93
425,1024,7168,512,256,8,ActivationType.Silu,torch.bfloat16,torch.float8_e4m3fnuz,torch.float8_e4m3fnuz,QuantType.per_Tensor,1,1,asm,stage1,64,_ZN5aiter53fmoe_stage1_bf16_pertokenFp8_doweight_g1u1_64x256_pf2E,538.9395,66.14011111111115,0.00%,334.71,5270.71
425,1024,7168,512,256,8,ActivationType.Silu,torch.bfloat16,torch.float8_e4m3fnuz,torch.float8_e4m3fnuz,QuantType.per_Tensor,1,1,ck,stage2,64,moe_ck2stages_gemm2_256x64x64x256_1x4_MulABScaleExpertWeight_v1_Nswizzle0_Quant1_MulRoutedWeight0_F8_F8_B16,347.0341,66.14011111111115,0.01%,519.8,8185.34
426,1024,7168,512,256,8,ActivationType.Silu,torch.bfloat16,torch.float8_e4m3fnuz,torch.float8_e4m3fnuz,QuantType.per_Token,1,0,asm,stage1,64,_ZN5aiter44fmoe_stage1_bf16_pertokenFp8_g1u1_64x256_pf2E,525.3081,63.89544444444449,0.00%,343.4,5407.48
426,1024,7168,512,256,8,ActivationType.Silu,torch.bfloat16,torch.float8_e4m3fnuz,torch.float8_e4m3fnuz,QuantType.per_Token,1,0,ck,stage2,64,moe_ck2stages_gemm2_256x64x64x256_1x4_MulABScaleExpertWeight_v1_Nswizzle0_Quant2_MulRoutedWeight1_F8_F8_B16,384.0162,63.89544444444449,2.79%,469.74,7397.06
427,1024,7168,512,256,8,ActivationType.Silu,torch.bfloat16,torch.float8_e4m3fnuz,torch.float8_e4m3fnuz,QuantType.per_Token,1,1,asm,stage1,32,_ZN5aiter56fmoe_stage1_bf16_pertokenFp8_doweight_g1u1_32x64_4tg_pf2E,565.055,63.028111111110974,0.00%,319.24,5027.11
427,1024,7168,512,256,8,ActivationType.Silu,torch.bfloat16,torch.float8_e4m3fnuz,torch.float8_e4m3fnuz,QuantType.per_Token,1,1,ck,stage2,32,moe_ck2stages_gemm2_256x32x64x128_1x4_MulABScaleExpertWeight_v1_Nswizzle0_Quant2_MulRoutedWeight0_F8_F8_B16,349.8215,63.028111111110974,0.01%,515.66,8120.12
428,1024,7168,512,256,8,ActivationType.Silu,torch.bfloat16,torch.bfloat16,torch.bfloat16,QuantType.No,1,0,ck,stage1,64,moe_ck2stages_gemm1_256x64x128x128_1x4_TypeCast_v3_Nswizzle0_Quant0_MulRoutedWeight0_silu_B16_B16_B16,1062.2803,0.0,0.00%,169.81,5334.28
428,1024,7168,512,256,8,ActivationType.Silu,torch.bfloat16,torch.bfloat16,torch.bfloat16,QuantType.No,1,0,ck,stage2,64,moe_ck2stages_gemm2_256x64x128x128_1x4_TypeCastExpertWeight_v3_Nswizzle0_Quant0_MulRoutedWeight1_B16_B16_B16,618.5254,0.0,2.79%,291.64,9161.31
429,1024,7168,512,256,8,ActivationType.Gelu,torch.bfloat16,torch.float8_e4m3fnuz,torch.float8_e4m3fnuz,QuantType.per_1x128,1,0,asm,asm_1stage,32,_ZN5aiter47fmoe_bf16_blockscaleFp8_g1u1_vs_gelu_1tg_32x256E,1063.5966,0.0,10.33%,169.6,2670.74
430,1024,7168,512,256,8,ActivationType.Silu,torch.bfloat16,torch.float8_e4m3fnuz,torch.float8_e4m3fnuz,QuantType.per_1x128,1,0,asm,asm_1stage,32,_ZN5aiter49fmoe_bf16_blockscaleFp8_g1u1_novs_silu_1tg_32x256E,1052.805,0.0,0.00%,171.34,2698.12
431,1024,7168,512,256,8,ActivationType.Gelu,torch.bfloat16,torch.float8_e4m3fnuz,torch.float8_e4m3fnuz,QuantType.per_1x128,1,1,ck,stage1,32,moe_ck2stages_gemm1_256x32x128x128_1x4_MulABScaleExpertWeightA8W8blkscale_v1_Nswizzle0_Quant4_MulRoutedWeight1_gelu_F8_F8_B16,721.0191,79.50166666666671,0.01%,250.19,3939.69
431,1024,7168,512,256,8,ActivationType.Gelu,torch.bfloat16,torch.float8_e4m3fnuz,torch.float8_e4m3fnuz,QuantType.per_1x128,1,1,ck,stage2,32,moe_ck2stages_gemm2_256x32x128x128_1x4_MulABScaleExpertWeightA8W8blkscale_v1_Nswizzle0_Quant4_MulRoutedWeight0_F8_F8_B16,340.5072,79.50166666666671,16.70%,529.76,8342.24
432,1024,7168,512,256,8,ActivationType.Silu,torch.bfloat16,torch.float8_e4m3fnuz,torch.float8_e4m3fnuz,QuantType.per_1x128,1,1,ck,stage1,32,moe_ck2stages_gemm1_256x32x128x128_1x4_MulABScaleExpertWeightA8W8blkscale_v1_Nswizzle0_Quant4_MulRoutedWeight1_silu_F8_F8_B16,719.6373,78.60622222222213,0.01%,250.67,3947.26
432,1024,7168,512,256,8,ActivationType.Silu,torch.bfloat16,torch.float8_e4m3fnuz,torch.float8_e4m3fnuz,QuantType.per_1x128,1,1,ck,stage2,32,moe_ck2stages_gemm2_256x32x128x128_1x4_MulABScaleExpertWeightA8W8blkscale_v1_Nswizzle0_Quant4_MulRoutedWeight0_F8_F8_B16,325.1837,78.60622222222213,16.72%,554.73,8735.35
433,1024,7168,2048,33,10,ActivationType.Silu,torch.bfloat16,torch.float8_e4m3fnuz,torch.float8_e4m3fnuz,QuantType.per_1x128,1,0,asm,stage1,64,_ZN5aiter55fmoe_stage1_bf16_pertokenFp8_blockscale_g1u1_64x256_pf3E,787.6847,211.75566666666663,9.53%,1145.06,1873.02
433,1024,7168,2048,33,10,ActivationType.Silu,torch.bfloat16,torch.float8_e4m3fnuz,torch.float8_e4m3fnuz,QuantType.per_1x128,1,0,ck,stage2,64,moe_ck2stages_gemm2_256x64x128x128_1x4_MulABScaleExpertWeightA8W8blkscale_v3_Nswizzle0_Quant4_MulRoutedWeight1_F8_F8_B16,721.323,211.75566666666663,16.89%,1250.4,2045.33
434,1024,7168,2048,33,10,ActivationType.Silu,torch.bfloat16,torch.float8_e4m3fnuz,torch.float8_e4m3fnuz,QuantType.per_Token,1,0,asm,stage1,64,_ZN5aiter44fmoe_stage1_bf16_pertokenFp8_g1u1_64x256_pf3E,712.8282,180.478,0.00%,1265.3,2069.71
434,1024,7168,2048,33,10,ActivationType.Silu,torch.bfloat16,torch.float8_e4m3fnuz,torch.float8_e4m3fnuz,QuantType.per_Token,1,0,ck,stage2,64,moe_ck2stages_gemm2_256x64x128x128_1x4_MulABScaleExpertWeight_v3_Nswizzle0_Quant2_MulRoutedWeight1_F8_F8_B16,527.7381,180.478,7.67%,1709.07,2795.6
435,1,128,384,2,1,ActivationType.Silu,torch.bfloat16,torch.bfloat16,torch.bfloat16,QuantType.No,1,0,ck,stage1,32,moe_ck2stages_gemm1_256x32x64x64_1x4_TypeCast_v1_Nswizzle0_Quant0_MulRoutedWeight0_silu_B16_B16_B16,5.98,0.0,0.00%,0.05,98.72
435,1,128,384,2,1,ActivationType.Silu,torch.bfloat16,torch.bfloat16,torch.bfloat16,QuantType.No,1,0,ck,stage2,32,moe_ck2stages_gemm2_256x32x64x128_1x4_TypeCastExpertWeight_v1_Nswizzle0_Quant0_MulRoutedWeight1_B16_B16_B16,6.012,0.0,0.00%,0.05,98.19
438,1,192,512,2,1,ActivationType.Gelu,torch.bfloat16,torch.float8_e4m3fnuz,torch.float8_e4m3fnuz,QuantType.per_Tensor,1,1,asm,stage1,16,_ZN5aiter57fmoe_stage1_bf16_pertokenFp8_doweight_g1u1_16x128_4tg_pf3E,9.0669,16.885555555555513,0.00%,0.07,65.12
438,1,192,512,2,1,ActivationType.Gelu,torch.bfloat16,torch.float8_e4m3fnuz,torch.float8_e4m3fnuz,QuantType.per_Tensor,1,1,ck,stage2,32,moe_ck2stages_gemm2_256x32x64x256_1x4_MulABScaleExpertWeight_v1_Nswizzle0_Quant1_MulRoutedWeight0_F8_F8_B16,6.0054,16.885555555555513,0.00%,0.1,98.31
439,1,192,512,4,2,ActivationType.Silu,torch.bfloat16,torch.bfloat16,torch.bfloat16,QuantType.No,1,0,ck,stage1,64,moe_ck2stages_gemm1_256x64x64x64_1x4_TypeCast_v1_Nswizzle0_Quant0_MulRoutedWeight0_silu_B16_B16_B16,7.2503,0.0,0.00%,0.16,325.51
439,1,192,512,4,2,ActivationType.Silu,torch.bfloat16,torch.bfloat16,torch.bfloat16,QuantType.No,1,0,ck,stage2,32,moe_ck2stages_gemm2_256x32x64x128_1x4_TypeCastExpertWeight_v1_Nswizzle0_Quant0_MulRoutedWeight1_B16_B16_B16,7.5054,0.0,0.00%,0.16,314.45
441,1,256,640,2,1,ActivationType.Silu,torch.bfloat16,torch.float8_e4m3fnuz,torch.float8_e4m3fnuz,QuantType.per_1x128,1,0,asm,asm_1stage,32,_ZN5aiter47fmoe_bf16_blockscaleFp8_g1u1_vs_silu_1tg_32x128E,9.0759,0.0,0.00%,0.11,108.4
441,1,256,640,2,1,ActivationType.Silu,torch.bfloat16,torch.float8_e4m3fnuz,torch.float8_e4m3fnuz,QuantType.per_1x128,1,0,asm,stage1,16,_ZN5aiter59fmoe_stage1_bf16_pertokenFp8_blockscale_g1u1_16x128_4tg_pf3E,5.1611,19.84822222222224,21.02%,0.19,190.62
441,1,256,640,2,1,ActivationType.Silu,torch.bfloat16,torch.float8_e4m3fnuz,torch.float8_e4m3fnuz,QuantType.per_1x128,1,0,ck,stage1,16,moe_ck2stages_gemm1_256x16x128x256_1x4_MulABScaleExpertWeightA8W8blkscale_v1_Nswizzle0_Quant4_MulRoutedWeight0_silu_F8_F8_B16,10.9992,19.84822222222224,0.00%,0.09,89.44
441,1,256,640,2,1,ActivationType.Silu,torch.bfloat16,torch.float8_e4m3fnuz,torch.float8_e4m3fnuz,QuantType.per_1x128,1,0,ck,stage2,16,moe_ck2stages_gemm2_128x16x128x128_1x2_MulABScaleExpertWeightA8W8blkscale_v1_Nswizzle0_Quant4_MulRoutedWeight1_F8_F8_B16,7.1038,19.84822222222224,0.00%,0.14,138.49
442,1,256,640,4,2,ActivationType.Gelu,torch.bfloat16,torch.bfloat16,torch.bfloat16,QuantType.No,1,1,ck,stage1,32,moe_ck2stages_gemm1_256x32x64x128_1x4_TypeCastExpertWeight_v1_Nswizzle0_Quant0_MulRoutedWeight1_gelu_B16_B16_B16,6.2824,0.0,0.00%,0.31,626.06
442,1,256,640,4,2,ActivationType.Gelu,torch.bfloat16,torch.bfloat16,torch.bfloat16,QuantType.No,1,1,ck,stage2,32,moe_ck2stages_gemm2_256x32x64x128_1x4_TypeCast_v1_Nswizzle0_Quant0_MulRoutedWeight0_B16_B16_B16,8.7486,0.0,0.00%,0.22,449.58
443,1,256,768,6,3,ActivationType.Silu,torch.bfloat16,torch.float8_e4m3fnuz,torch.float8_e4m3fnuz,QuantType.per_Tensor,1,0,asm,stage1,16,_ZN5aiter47fmoe_stage1_bf16_pertokenFp8_g1u1_16x64_5tg_pf3E,10.3897,19.124666666666613,0.00%,0.34,340.69
443,1,256,768,6,3,ActivationType.Silu,torch.bfloat16,torch.float8_e4m3fnuz,torch.float8_e4m3fnuz,QuantType.per_Tensor,1,0,ck,stage1,32,moe_ck2stages_gemm1_256x32x64x256_1x4_MulABScale_v1_Nswizzle0_Quant1_MulRoutedWeight0_silu_F8_F8_B16,5.594,19.124666666666613,0.00%,0.63,632.77
443,1,256,768,6,3,ActivationType.Silu,torch.bfloat16,torch.float8_e4m3fnuz,torch.float8_e4m3fnuz,QuantType.per_Tensor,1,0,ck,stage2,32,moe_ck2stages_gemm2_256x32x64x256_1x4_MulABScaleExpertWeight_v1_Nswizzle0_Quant1_MulRoutedWeight1_F8_F8_B16,7.8546,19.124666666666613,0.00%,0.45,450.65
444,1,320,896,2,1,ActivationType.Gelu,torch.bfloat16,torch.float8_e4m3fnuz,torch.float8_e4m3fnuz,QuantType.per_Token,1,1,asm,asm_1stage,32,_ZN5aiter50fmoe_bf16_pertokenFp8_g1u1_vs_tkw1_gelu_1tg_32x128E,11.8833,0.0,0.00%,0.14,144.85
444,1,320,896,2,1,ActivationType.Gelu,torch.bfloat16,torch.float8_e4m3fnuz,torch.float8_e4m3fnuz,QuantType.per_Token,1,1,asm,stage1,16,_ZN5aiter56fmoe_stage1_bf16_pertokenFp8_doweight_g1u1_16x64_5tg_pf3E,5.0137,20.25744444444449,2.90%,0.34,343.32
444,1,320,896,2,1,ActivationType.Gelu,torch.bfloat16,torch.float8_e4m3fnuz,torch.float8_e4m3fnuz,QuantType.per_Token,1,1,ck,stage2,32,moe_ck2stages_gemm2_256x32x64x128_1x4_MulABScaleExpertWeight_v1_Nswizzle0_Quant2_MulRoutedWeight0_F8_F8_B16,8.3377,20.25744444444449,0.00%,0.21,206.45
445,1,320,896,4,2,ActivationType.Silu,torch.bfloat16,torch.bfloat16,torch.bfloat16,QuantType.No,1,0,ck,stage1,32,moe_ck2stages_gemm1_256x32x64x64_1x4_TypeCast_v1_Nswizzle0_Quant0_MulRoutedWeight0_silu_B16_B16_B16,8.2928,0.0,0.00%,0.41,829.94
445,1,320,896,4,2,ActivationType.Silu,torch.bfloat16,torch.bfloat16,torch.bfloat16,QuantType.No,1,0,ck,stage2,32,moe_ck2stages_gemm2_256x32x64x128_1x4_TypeCastExpertWeight_v1_Nswizzle0_Quant0_MulRoutedWeight1_B16_B16_B16,10.6637,0.0,0.00%,0.32,645.42
447,1,384,1024,3,1,ActivationType.Silu,torch.bfloat16,torch.float8_e4m3fnuz,torch.float8_e4m3fnuz,QuantType.per_Tensor,1,0,asm,stage1,16,_ZN5aiter47fmoe_stage1_bf16_pertokenFp8_g1u1_16x64_5tg_pf3E,10.5928,15.408333333333266,0.00%,0.22,334.2
447,1,384,1024,3,1,ActivationType.Silu,torch.bfloat16,torch.float8_e4m3fnuz,torch.float8_e4m3fnuz,QuantType.per_Tensor,1,0,ck,stage1,16,moe_ck2stages_gemm1_128x16x64x128_1x2_MulABScale_v1_Nswizzle0_Quant1_MulRoutedWeight0_silu_F8_F8_B16,5.9553,15.408333333333266,0.00%,0.4,594.44
447,1,384,1024,3,1,ActivationType.Silu,torch.bfloat16,torch.float8_e4m3fnuz,torch.float8_e4m3fnuz,QuantType.per_Tensor,1,0,ck,stage2,16,moe_ck2stages_gemm2_256x16x128x256_1x4_MulABScaleExpertWeight_v1_Nswizzle0_Quant1_MulRoutedWeight1_F8_F8_B16,7.8072,15.408333333333266,0.00%,0.3,453.44
448,1,384,1152,6,2,ActivationType.Gelu,torch.bfloat16,torch.float8_e4m3fnuz,torch.float8_e4m3fnuz,QuantType.per_Token,1,1,asm,asm_1stage,32,_ZN5aiter50fmoe_bf16_pertokenFp8_g1u1_vs_tkw1_gelu_1tg_32x128E,13.7866,0.0,0.00%,0.39,577.65
448,1,384,1152,6,2,ActivationType.Gelu,torch.bfloat16,torch.float8_e4m3fnuz,torch.float8_e4m3fnuz,QuantType.per_Token,1,1,asm,stage1,16,_ZN5aiter56fmoe_stage1_bf16_pertokenFp8_doweight_g1u1_16x64_5tg_pf3E,6.2454,24.37866666666666,0.00%,0.85,1275.14
448,1,384,1152,6,2,ActivationType.Gelu,torch.bfloat16,torch.float8_e4m3fnuz,torch.float8_e4m3fnuz,QuantType.per_Token,1,1,ck,stage1,16,moe_ck2stages_gemm1_128x16x64x128_1x2_MulABScale_v1_Nswizzle0_Quant2_MulRoutedWeight1_gelu_F8_F8_B16,7.8828,24.37866666666666,0.00%,0.67,1010.27
448,1,384,1152,6,2,ActivationType.Gelu,torch.bfloat16,torch.float8_e4m3fnuz,torch.float8_e4m3fnuz,QuantType.per_Token,1,1,ck,stage2,32,moe_ck2stages_gemm2_256x32x64x128_1x4_MulABScaleExpertWeight_v1_Nswizzle0_Quant2_MulRoutedWeight0_F8_F8_B16,11.7983,24.37866666666666,0.00%,0.45,674.99
449,1,448,1280,3,1,ActivationType.Silu,torch.bfloat16,torch.bfloat16,torch.bfloat16,QuantType.No,1,0,ck,stage1,32,moe_ck2stages_gemm1_256x32x64x64_1x4_TypeCast_v1_Nswizzle0_Quant0_MulRoutedWeight0_silu_B16_B16_B16,9.5892,0.0,0.00%,0.36,1076.6
449,1,448,1280,3,1,ActivationType.Silu,torch.bfloat16,torch.bfloat16,torch.bfloat16,QuantType.No,1,0,ck,stage2,32,moe_ck2stages_gemm2_256x32x64x128_1x4_TypeCastExpertWeight_v1_Nswizzle0_Quant0_MulRoutedWeight1_B16_B16_B16,12.5211,0.0,0.00%,0.27,824.51
451,1,512,1408,3,1,ActivationType.Silu,torch.bfloat16,torch.float8_e4m3fnuz,torch.float8_e4m3fnuz,QuantType.per_Tensor,1,0,asm,stage1,16,_ZN5aiter48fmoe_stage1_bf16_pertokenFp8_g1u1_16x128_4tg_pf3E,11.4963,16.676888888888875,0.00%,0.38,564.49
451,1,512,1408,3,1,ActivationType.Silu,torch.bfloat16,torch.float8_e4m3fnuz,torch.float8_e4m3fnuz,QuantType.per_Tensor,1,0,ck,stage1,32,moe_ck2stages_gemm1_256x32x64x256_1x4_MulABScale_v1_Nswizzle0_Quant1_MulRoutedWeight0_silu_F8_F8_B16,6.7919,16.676888888888875,0.00%,0.64,955.49
451,1,512,1408,3,1,ActivationType.Silu,torch.bfloat16,torch.float8_e4m3fnuz,torch.float8_e4m3fnuz,QuantType.per_Tensor,1,0,ck,stage2,32,moe_ck2stages_gemm2_256x32x64x128_1x4_MulABScaleExpertWeight_v1_Nswizzle0_Quant1_MulRoutedWeight1_F8_F8_B16,11.4249,16.676888888888875,0.00%,0.38,568.02
452,1,512,1536,6,2,ActivationType.Gelu,torch.bfloat16,torch.float8_e4m3fnuz,torch.float8_e4m3fnuz,QuantType.per_Token,1,1,asm,asm_1stage,32,_ZN5aiter50fmoe_bf16_pertokenFp8_g1u1_vs_tkw1_gelu_1tg_32x128E,13.9024,0.0,0.00%,0.68,1018.34
452,1,512,1536,6,2,ActivationType.Gelu,torch.bfloat16,torch.float8_e4m3fnuz,torch.float8_e4m3fnuz,QuantType.per_Token,1,1,asm,stage1,16,_ZN5aiter56fmoe_stage1_bf16_pertokenFp8_doweight_g1u1_16x64_5tg_pf3E,7.275,26.01788888888863,0.00%,1.3,1946.02
452,1,512,1536,6,2,ActivationType.Gelu,torch.bfloat16,torch.float8_e4m3fnuz,torch.float8_e4m3fnuz,QuantType.per_Token,1,1,ck,stage1,32,moe_ck2stages_gemm1_256x32x64x256_1x4_MulABScale_v1_Nswizzle0_Quant2_MulRoutedWeight1_gelu_F8_F8_B16,8.078,26.01788888888863,0.00%,1.17,1752.58
452,1,512,1536,6,2,ActivationType.Gelu,torch.bfloat16,torch.float8_e4m3fnuz,torch.float8_e4m3fnuz,QuantType.per_Token,1,1,ck,stage2,32,moe_ck2stages_gemm2_256x32x64x256_1x4_MulABScaleExpertWeight_v1_Nswizzle0_Quant2_MulRoutedWeight0_F8_F8_B16,10.9161,26.01788888888863,0.00%,0.86,1296.92
453,1,576,1664,4,2,ActivationType.Silu,torch.bfloat16,torch.bfloat16,torch.bfloat16,QuantType.No,1,0,ck,stage1,32,moe_ck2stages_gemm1_256x32x64x64_1x4_TypeCast_v1_Nswizzle0_Quant0_MulRoutedWeight0_silu_B16_B16_B16,10.8445,0.0,0.00%,1.06,2121.39
453,1,576,1664,4,2,ActivationType.Silu,torch.bfloat16,torch.bfloat16,torch.bfloat16,QuantType.No,1,0,ck,stage2,32,moe_ck2stages_gemm2_256x32x64x128_1x4_TypeCastExpertWeight_v1_Nswizzle0_Quant0_MulRoutedWeight1_B16_B16_B16,14.6999,0.0,0.00%,0.78,1565.01
455,1,640,1792,3,1,ActivationType.Silu,torch.bfloat16,torch.float8_e4m3fnuz,torch.float8_e4m3fnuz,QuantType.per_Tensor,1,0,asm,stage1,16,_ZN5aiter47fmoe_stage1_bf16_pertokenFp8_g1u1_16x64_5tg_pf3E,12.1015,16.285222222222238,0.00%,0.57,853.1
455,1,640,1792,3,1,ActivationType.Silu,torch.bfloat16,torch.float8_e4m3fnuz,torch.float8_e4m3fnuz,QuantType.per_Tensor,1,0,ck,stage1,32,moe_ck2stages_gemm1_256x32x64x128_1x4_MulABScale_v1_Nswizzle0_Quant1_MulRoutedWeight0_silu_F8_F8_B16,8.1477,16.285222222222238,0.00%,0.84,1267.09
455,1,640,1792,3,1,ActivationType.Silu,torch.bfloat16,torch.float8_e4m3fnuz,torch.float8_e4m3fnuz,QuantType.per_Tensor,1,0,ck,stage2,32,moe_ck2stages_gemm2_256x32x64x256_1x4_MulABScaleExpertWeight_v1_Nswizzle0_Quant1_MulRoutedWeight1_F8_F8_B16,9.9149,16.285222222222238,0.00%,0.69,1041.24
456,1,640,1920,6,2,ActivationType.Gelu,torch.bfloat16,torch.float8_e4m3fnuz,torch.float8_e4m3fnuz,QuantType.per_Token,1,1,asm,asm_1stage,32,_ZN5aiter50fmoe_bf16_pertokenFp8_g1u1_vs_tkw1_gelu_1tg_32x128E,16.9933,0.0,0.00%,0.87,1301.71
456,1,640,1920,6,2,ActivationType.Gelu,torch.bfloat16,torch.float8_e4m3fnuz,torch.float8_e4m3fnuz,QuantType.per_Token,1,1,asm,stage1,16,_ZN5aiter56fmoe_stage1_bf16_pertokenFp8_doweight_g1u1_16x64_5tg_pf3E,7.8875,27.04988888888891,0.00%,1.87,2804.48
456,1,640,1920,6,2,ActivationType.Gelu,torch.bfloat16,torch.float8_e4m3fnuz,torch.float8_e4m3fnuz,QuantType.per_Token,1,1,ck,stage1,32,moe_ck2stages_gemm1_256x32x64x128_1x4_MulABScale_v1_Nswizzle0_Quant2_MulRoutedWeight1_gelu_F8_F8_B16,9.5254,27.04988888888891,0.00%,1.55,2322.25
456,1,640,1920,6,2,ActivationType.Gelu,torch.bfloat16,torch.float8_e4m3fnuz,torch.float8_e4m3fnuz,QuantType.per_Token,1,1,ck,stage2,32,moe_ck2stages_gemm2_256x32x64x128_1x4_MulABScaleExpertWeight_v1_Nswizzle0_Quant2_MulRoutedWeight0_F8_F8_B16,15.514,27.04988888888891,0.00%,0.95,1425.83
457,1,704,1984,3,1,ActivationType.Silu,torch.bfloat16,torch.bfloat16,torch.bfloat16,QuantType.No,1,0,ck,stage1,32,moe_ck2stages_gemm1_256x32x64x64_1x4_TypeCast_v1_Nswizzle0_Quant0_MulRoutedWeight0_silu_B16_B16_B16,12.0488,0.0,0.00%,0.7,2086.85
457,1,704,1984,3,1,ActivationType.Silu,torch.bfloat16,torch.bfloat16,torch.bfloat16,QuantType.No,1,0,ck,stage2,32,moe_ck2stages_gemm2_256x32x64x64_1x4_TypeCastExpertWeight_v1_Nswizzle0_Quant0_MulRoutedWeight1_B16_B16_B16,22.6225,0.0,0.00%,0.37,1111.46
459,2,128,384,2,1,ActivationType.Silu,torch.bfloat16,torch.float8_e4m3fnuz,torch.float8_e4m3fnuz,QuantType.per_Tensor,1,0,asm,stage1,16,_ZN5aiter47fmoe_stage1_bf16_pertokenFp8_g1u1_16x64_5tg_pf3E,8.9652,14.174777777777864,0.00%,0.07,32.98
459,2,128,384,2,1,ActivationType.Silu,torch.bfloat16,torch.float8_e4m3fnuz,torch.float8_e4m3fnuz,QuantType.per_Tensor,1,0,ck,stage1,16,moe_ck2stages_gemm1_128x16x64x128_1x2_MulABScale_v1_Nswizzle0_Quant1_MulRoutedWeight0_silu_F8_F8_B16,4.9958,14.174777777777864,0.00%,0.12,59.19
459,2,128,384,2,1,ActivationType.Silu,torch.bfloat16,torch.float8_e4m3fnuz,torch.float8_e4m3fnuz,QuantType.per_Tensor,1,0,ck,stage2,32,moe_ck2stages_gemm2_256x32x64x128_1x4_MulABScaleExpertWeight_v1_Nswizzle0_Quant1_MulRoutedWeight1_F8_F8_B16,6.1112,14.174777777777864,0.00%,0.1,48.38
461,2,192,640,2,1,ActivationType.Silu,torch.bfloat16,torch.bfloat16,torch.bfloat16,QuantType.No,1,0,ck,stage1,32,moe_ck2stages_gemm1_256x32x64x64_1x4_TypeCast_v1_Nswizzle0_Quant0_MulRoutedWeight0_silu_B16_B16_B16,5.6335,0.0,0.00%,0.26,262.02
461,2,192,640,2,1,ActivationType.Silu,torch.bfloat16,torch.bfloat16,torch.bfloat16,QuantType.No,1,0,ck,stage2,32,moe_ck2stages_gemm2_256x32x64x128_1x4_TypeCastExpertWeight_v1_Nswizzle0_Quant0_MulRoutedWeight1_B16_B16_B16,7.8628,0.0,0.00%,0.19,187.73
464,2,256,896,6,2,ActivationType.Gelu,torch.bfloat16,torch.float8_e4m3fnuz,torch.float8_e4m3fnuz,QuantType.per_Token,1,1,asm,asm_1stage,32,_ZN5aiter50fmoe_bf16_pertokenFp8_g1u1_vs_tkw1_gelu_1tg_32x128E,10.4628,0.0,0.00%,0.53,394.76
464,2,256,896,6,2,ActivationType.Gelu,torch.bfloat16,torch.float8_e4m3fnuz,torch.float8_e4m3fnuz,QuantType.per_Token,1,1,asm,stage1,16,_ZN5aiter56fmoe_stage1_bf16_pertokenFp8_doweight_g1u1_16x64_5tg_pf3E,5.2233,26.672222222222217,0.00%,1.05,790.75
464,2,256,896,6,2,ActivationType.Gelu,torch.bfloat16,torch.float8_e4m3fnuz,torch.float8_e4m3fnuz,QuantType.per_Token,1,1,ck,stage1,32,moe_ck2stages_gemm1_256x32x64x256_1x4_MulABScale_v1_Nswizzle0_Quant2_MulRoutedWeight1_gelu_F8_F8_B16,6.5003,26.672222222222217,0.00%,0.85,635.4
464,2,256,896,6,2,ActivationType.Gelu,torch.bfloat16,torch.float8_e4m3fnuz,torch.float8_e4m3fnuz,QuantType.per_Token,1,1,ck,stage2,32,moe_ck2stages_gemm2_256x32x64x128_1x4_MulABScaleExpertWeight_v1_Nswizzle0_Quant2_MulRoutedWeight0_F8_F8_B16,9.934,26.672222222222217,0.00%,0.55,415.77
465,2,320,1024,3,1,ActivationType.Silu,torch.bfloat16,torch.bfloat16,torch.bfloat16,QuantType.No,1,0,ck,stage1,32,moe_ck2stages_gemm1_256x32x64x64_1x4_TypeCast_v1_Nswizzle0_Quant0_MulRoutedWeight0_silu_B16_B16_B16,8.1153,0.0,0.00%,0.48,727.12
465,2,320,1024,3,1,ActivationType.Silu,torch.bfloat16,torch.bfloat16,torch.bfloat16,QuantType.No,1,0,ck,stage2,32,moe_ck2stages_gemm2_256x32x64x128_1x4_TypeCastExpertWeight_v1_Nswizzle0_Quant0_MulRoutedWeight1_B16_B16_B16,10.7575,0.0,0.00%,0.37,548.53
467,2,384,1152,5,2,ActivationType.Silu,torch.bfloat16,torch.float8_e4m3fnuz,torch.float8_e4m3fnuz,QuantType.per_Tensor,1,0,asm,stage1,16,_ZN5aiter47fmoe_stage1_bf16_pertokenFp8_g1u1_16x64_5tg_pf3E,11.7299,17.994333333333344,0.00%,0.91,565.89
467,2,384,1152,5,2,ActivationType.Silu,torch.bfloat16,torch.float8_e4m3fnuz,torch.float8_e4m3fnuz,QuantType.per_Tensor,1,0,ck,stage1,16,moe_ck2stages_gemm1_128x16x64x128_1x2_MulABScale_v1_Nswizzle0_Quant1_MulRoutedWeight0_silu_F8_F8_B16,6.9503,17.994333333333344,0.00%,1.53,955.04
467,2,384,1152,5,2,ActivationType.Silu,torch.bfloat16,torch.float8_e4m3fnuz,torch.float8_e4m3fnuz,QuantType.per_Tensor,1,0,ck,stage2,32,moe_ck2stages_gemm2_256x32x64x128_1x4_MulABScaleExpertWeight_v1_Nswizzle0_Quant1_MulRoutedWeight1_F8_F8_B16,11.3836,17.994333333333344,0.00%,0.93,583.1
468,2,384,1280,10,4,ActivationType.Gelu,torch.bfloat16,torch.float8_e4m3fnuz,torch.float8_e4m3fnuz,QuantType.per_Token,1,1,asm,asm_1stage,32,_ZN5aiter50fmoe_bf16_pertokenFp8_g1u1_vs_tkw1_gelu_1tg_32x128E,14.0184,0.0,0.00%,1.68,1052.04
468,2,384,1280,10,4,ActivationType.Gelu,torch.bfloat16,torch.float8_e4m3fnuz,torch.float8_e4m3fnuz,QuantType.per_Token,1,1,asm,stage1,16,_ZN5aiter56fmoe_stage1_bf16_pertokenFp8_doweight_g1u1_16x64_5tg_pf3E,6.9205,26.711666666666588,0.00%,3.41,2131.05
468,2,384,1280,10,4,ActivationType.Gelu,torch.bfloat16,torch.float8_e4m3fnuz,torch.float8_e4m3fnuz,QuantType.per_Token,1,1,ck,stage1,32,moe_ck2stages_gemm1_256x32x64x128_1x4_MulABScale_v1_Nswizzle0_Quant2_MulRoutedWeight1_gelu_F8_F8_B16,8.587,26.711666666666588,0.00%,2.75,1717.47
468,2,384,1280,10,4,ActivationType.Gelu,torch.bfloat16,torch.float8_e4m3fnuz,torch.float8_e4m3fnuz,QuantType.per_Token,1,1,ck,stage2,32,moe_ck2stages_gemm2_256x32x64x256_1x4_MulABScaleExpertWeight_v1_Nswizzle0_Quant2_MulRoutedWeight0_F8_F8_B16,10.4947,26.711666666666588,0.00%,2.25,1405.27
469,2,448,1408,3,1,ActivationType.Silu,torch.bfloat16,torch.bfloat16,torch.bfloat16,QuantType.No,1,0,ck,stage1,32,moe_ck2stages_gemm1_256x32x64x64_1x4_TypeCast_v1_Nswizzle0_Quant0_MulRoutedWeight0_silu_B16_B16_B16,9.6765,0.0,0.00%,0.78,1173.74
469,2,448,1408,3,1,ActivationType.Silu,torch.bfloat16,torch.bfloat16,torch.bfloat16,QuantType.No,1,0,ck,stage2,32,moe_ck2stages_gemm2_256x32x64x128_1x4_TypeCastExpertWeight_v1_Nswizzle0_Quant0_MulRoutedWeight1_B16_B16_B16,13.262,0.0,0.00%,0.57,856.41
471,2,512,1536,3,1,ActivationType.Silu,torch.bfloat16,torch.float8_e4m3fnuz,torch.float8_e4m3fnuz,QuantType.per_Tensor,1,0,asm,stage1,16,_ZN5aiter47fmoe_stage1_bf16_pertokenFp8_g1u1_16x64_5tg_pf3E,12.2048,19.93888888888892,0.00%,0.77,580.18
471,2,512,1536,3,1,ActivationType.Silu,torch.bfloat16,torch.float8_e4m3fnuz,torch.float8_e4m3fnuz,QuantType.per_Tensor,1,0,ck,stage1,32,moe_ck2stages_gemm1_256x32x64x256_1x4_MulABScale_v1_Nswizzle0_Quant1_MulRoutedWeight0_silu_F8_F8_B16,6.9226,19.93888888888892,0.00%,1.36,1022.88
471,2,512,1536,3,1,ActivationType.Silu,torch.bfloat16,torch.float8_e4m3fnuz,torch.float8_e4m3fnuz,QuantType.per_Tensor,1,0,ck,stage2,32,moe_ck2stages_gemm2_256x32x64x256_1x4_MulABScaleExpertWeight_v1_Nswizzle0_Quant1_MulRoutedWeight1_F8_F8_B16,9.7212,19.93888888888892,0.00%,0.97,728.4
472,2,512,1664,6,2,ActivationType.Gelu,torch.bfloat16,torch.float8_e4m3fnuz,torch.float8_e4m3fnuz,QuantType.per_Token,1,1,asm,asm_1stage,32,_ZN5aiter50fmoe_bf16_pertokenFp8_g1u1_vs_tkw1_gelu_1tg_32x128E,14.0749,0.0,0.00%,1.45,1089.78
472,2,512,1664,6,2,ActivationType.Gelu,torch.bfloat16,torch.float8_e4m3fnuz,torch.float8_e4m3fnuz,QuantType.per_Token,1,1,asm,stage1,16,_ZN5aiter56fmoe_stage1_bf16_pertokenFp8_doweight_g1u1_16x64_5tg_pf3E,7.279,25.945555555555625,0.00%,2.81,2107.23
472,2,512,1664,6,2,ActivationType.Gelu,torch.bfloat16,torch.float8_e4m3fnuz,torch.float8_e4m3fnuz,QuantType.per_Token,1,1,ck,stage1,32,moe_ck2stages_gemm1_256x32x64x256_1x4_MulABScale_v1_Nswizzle0_Quant2_MulRoutedWeight1_gelu_F8_F8_B16,8.2028,25.945555555555625,0.00%,2.49,1869.91
472,2,512,1664,6,2,ActivationType.Gelu,torch.bfloat16,torch.float8_e4m3fnuz,torch.float8_e4m3fnuz,QuantType.per_Token,1,1,ck,stage2,32,moe_ck2stages_gemm2_256x32x64x128_1x4_MulABScaleExpertWeight_v1_Nswizzle0_Quant2_MulRoutedWeight0_F8_F8_B16,14.5891,25.945555555555625,0.00%,1.4,1051.37
473,2,576,1792,4,2,ActivationType.Silu,torch.bfloat16,torch.bfloat16,torch.bfloat16,QuantType.No,1,0,ck,stage1,32,moe_ck2stages_gemm1_256x32x64x64_1x4_TypeCast_v1_Nswizzle0_Quant0_MulRoutedWeight0_silu_B16_B16_B16,10.758,0.0,0.00%,2.3,2303.14
473,2,576,1792,4,2,ActivationType.Silu,torch.bfloat16,torch.bfloat16,torch.bfloat16,QuantType.No,1,0,ck,stage2,32,moe_ck2stages_gemm2_256x32x64x128_1x4_TypeCastExpertWeight_v1_Nswizzle0_Quant0_MulRoutedWeight1_B16_B16_B16,15.318,0.0,0.00%,1.62,1617.52
475,2,640,2048,3,1,ActivationType.Silu,torch.bfloat16,torch.float8_e4m3fnuz,torch.float8_e4m3fnuz,QuantType.per_Tensor,1,0,asm,stage1,16,_ZN5aiter47fmoe_stage1_bf16_pertokenFp8_g1u1_16x64_5tg_pf3E,13.4038,17.504111111111065,0.00%,1.17,880.37
475,2,640,2048,3,1,ActivationType.Silu,torch.bfloat16,torch.float8_e4m3fnuz,torch.float8_e4m3fnuz,QuantType.per_Tensor,1,0,ck,stage1,32,moe_ck2stages_gemm1_256x32x64x128_1x4_MulABScale_v1_Nswizzle0_Quant1_MulRoutedWeight0_silu_F8_F8_B16,8.5191,17.504111111111065,0.00%,1.85,1385.16
475,2,640,2048,3,1,ActivationType.Silu,torch.bfloat16,torch.float8_e4m3fnuz,torch.float8_e4m3fnuz,QuantType.per_Tensor,1,0,ck,stage2,32,moe_ck2stages_gemm2_256x32x64x256_1x4_MulABScaleExpertWeight_v1_Nswizzle0_Quant1_MulRoutedWeight1_F8_F8_B16,11.2441,17.504111111111065,0.00%,1.4,1049.47
477,2,704,2176,3,1,ActivationType.Silu,torch.bfloat16,torch.bfloat16,torch.bfloat16,QuantType.No,1,0,ck,stage1,32,moe_ck2stages_gemm1_256x32x64x64_1x4_TypeCast_v1_Nswizzle0_Quant0_MulRoutedWeight0_silu_B16_B16_B16,11.7382,0.0,0.00%,1.57,2349.59
477,2,704,2176,3,1,ActivationType.Silu,torch.bfloat16,torch.bfloat16,torch.bfloat16,QuantType.No,1,0,ck,stage2,32,moe_ck2stages_gemm2_256x32x64x128_1x4_TypeCastExpertWeight_v1_Nswizzle0_Quant0_MulRoutedWeight1_B16_B16_B16,16.8035,0.0,0.00%,1.09,1641.32
481,4,192,768,2,1,ActivationType.Silu,torch.bfloat16,torch.bfloat16,torch.bfloat16,QuantType.No,1,0,ck,stage1,32,moe_ck2stages_gemm1_256x32x64x64_1x4_TypeCast_v1_Nswizzle0_Quant0_MulRoutedWeight0_silu_B16_B16_B16,5.7686,0.0,0.00%,0.61,307.27
481,4,192,768,2,1,ActivationType.Silu,torch.bfloat16,torch.bfloat16,torch.bfloat16,QuantType.No,1,0,ck,stage2,32,moe_ck2stages_gemm2_256x32x64x128_1x4_TypeCastExpertWeight_v1_Nswizzle0_Quant0_MulRoutedWeight1_B16_B16_B16,8.4766,0.0,0.00%,0.42,209.11
483,4,256,896,3,1,ActivationType.Silu,torch.bfloat16,torch.float8_e4m3fnuz,torch.float8_e4m3fnuz,QuantType.per_Tensor,1,0,asm,stage1,16,_ZN5aiter47fmoe_stage1_bf16_pertokenFp8_g1u1_16x64_5tg_pf3E,10.3023,20.82044444444448,0.00%,0.53,200.68
483,4,256,896,3,1,ActivationType.Silu,torch.bfloat16,torch.float8_e4m3fnuz,torch.float8_e4m3fnuz,QuantType.per_Tensor,1,0,ck,stage1,16,moe_ck2stages_gemm1_128x16x64x128_1x2_MulABScale_v1_Nswizzle0_Quant1_MulRoutedWeight0_silu_F8_F8_B16,5.4398,20.82044444444448,0.00%,1.01,380.06
483,4,256,896,3,1,ActivationType.Silu,torch.bfloat16,torch.float8_e4m3fnuz,torch.float8_e4m3fnuz,QuantType.per_Tensor,1,0,ck,stage2,32,moe_ck2stages_gemm2_256x32x64x128_1x4_MulABScaleExpertWeight_v1_Nswizzle0_Quant1_MulRoutedWeight1_F8_F8_B16,8.2925,20.82044444444448,0.00%,0.66,249.32
485,4,320,1152,3,1,ActivationType.Silu,torch.bfloat16,torch.bfloat16,torch.bfloat16,QuantType.No,1,0,ck,stage1,32,moe_ck2stages_gemm1_256x32x64x64_1x4_TypeCast_v1_Nswizzle0_Quant0_MulRoutedWeight0_silu_B16_B16_B16,8.149,0.0,0.00%,1.09,814.9
485,4,320,1152,3,1,ActivationType.Silu,torch.bfloat16,torch.bfloat16,torch.bfloat16,QuantType.No,1,0,ck,stage2,32,moe_ck2stages_gemm2_256x32x64x128_1x4_TypeCastExpertWeight_v1_Nswizzle0_Quant0_MulRoutedWeight1_B16_B16_B16,12.0117,0.0,0.00%,0.74,552.85
487,4,384,1280,5,2,ActivationType.Silu,torch.bfloat16,torch.float8_e4m3fnuz,torch.float8_e4m3fnuz,QuantType.per_Tensor,1,0,asm,stage1,16,_ZN5aiter47fmoe_stage1_bf16_pertokenFp8_g1u1_16x64_5tg_pf3E,11.7478,21.457444444444413,0.00%,2.01,627.98
487,4,384,1280,5,2,ActivationType.Silu,torch.bfloat16,torch.float8_e4m3fnuz,torch.float8_e4m3fnuz,QuantType.per_Tensor,1,0,ck,stage1,16,moe_ck2stages_gemm1_128x16x64x128_1x2_MulABScale_v1_Nswizzle0_Quant1_MulRoutedWeight0_silu_F8_F8_B16,7.0557,21.457444444444413,0.00%,3.34,1045.6
487,4,384,1280,5,2,ActivationType.Silu,torch.bfloat16,torch.float8_e4m3fnuz,torch.float8_e4m3fnuz,QuantType.per_Tensor,1,0,ck,stage2,32,moe_ck2stages_gemm2_256x32x64x256_1x4_MulABScaleExpertWeight_v1_Nswizzle0_Quant1_MulRoutedWeight1_F8_F8_B16,9.7467,21.457444444444413,0.00%,2.42,756.91
488,4,384,1408,10,4,ActivationType.Gelu,torch.bfloat16,torch.float8_e4m3fnuz,torch.float8_e4m3fnuz,QuantType.per_Token,1,1,asm,asm_1stage,32,_ZN5aiter50fmoe_bf16_pertokenFp8_g1u1_vs_tkw1_gelu_1tg_32x128E,13.8743,0.0,0.00%,3.74,1169.41
488,4,384,1408,10,4,ActivationType.Gelu,torch.bfloat16,torch.float8_e4m3fnuz,torch.float8_e4m3fnuz,QuantType.per_Token,1,1,asm,stage1,16,_ZN5aiter56fmoe_stage1_bf16_pertokenFp8_doweight_g1u1_16x64_5tg_pf3E,7.1621,30.03166666666667,0.00%,7.25,2265.36
488,4,384,1408,10,4,ActivationType.Gelu,torch.bfloat16,torch.float8_e4m3fnuz,torch.float8_e4m3fnuz,QuantType.per_Token,1,1,ck,stage1,16,moe_ck2stages_gemm1_128x16x64x128_1x2_MulABScale_v1_Nswizzle0_Quant2_MulRoutedWeight1_gelu_F8_F8_B16,8.9775,30.03166666666667,0.00%,5.78,1807.27
488,4,384,1408,10,4,ActivationType.Gelu,torch.bfloat16,torch.float8_e4m3fnuz,torch.float8_e4m3fnuz,QuantType.per_Token,1,1,ck,stage2,32,moe_ck2stages_gemm2_256x32x64x128_1x4_MulABScaleExpertWeight_v1_Nswizzle0_Quant2_MulRoutedWeight0_F8_F8_B16,13.7648,30.03166666666667,0.00%,3.77,1178.71
489,4,448,1536,3,1,ActivationType.Silu,torch.bfloat16,torch.bfloat16,torch.bfloat16,QuantType.No,1,0,ck,stage1,32,moe_ck2stages_gemm1_256x32x64x64_1x4_TypeCast_v1_Nswizzle0_Quant0_MulRoutedWeight0_silu_B16_B16_B16,9.6715,0.0,0.00%,1.71,1281.44
489,4,448,1536,3,1,ActivationType.Silu,torch.bfloat16,torch.bfloat16,torch.bfloat16,QuantType.No,1,0,ck,stage2,32,moe_ck2stages_gemm2_256x32x64x128_1x4_TypeCastExpertWeight_v1_Nswizzle0_Quant0_MulRoutedWeight1_B16_B16_B16,13.9093,0.0,0.00%,1.19,891.02
491,4,512,1664,3,1,ActivationType.Silu,torch.bfloat16,torch.float8_e4m3fnuz,torch.float8_e4m3fnuz,QuantType.per_Tensor,1,0,asm,stage1,16,_ZN5aiter47fmoe_stage1_bf16_pertokenFp8_g1u1_16x64_5tg_pf3E,12.4907,20.473222222222205,0.00%,1.64,614.37
491,4,512,1664,3,1,ActivationType.Silu,torch.bfloat16,torch.float8_e4m3fnuz,torch.float8_e4m3fnuz,QuantType.per_Tensor,1,0,ck,stage1,32,moe_ck2stages_gemm1_256x32x64x256_1x4_MulABScale_v1_Nswizzle0_Quant1_MulRoutedWeight0_silu_F8_F8_B16,6.9777,20.473222222222205,0.00%,2.93,1099.77
491,4,512,1664,3,1,ActivationType.Silu,torch.bfloat16,torch.float8_e4m3fnuz,torch.float8_e4m3fnuz,QuantType.per_Tensor,1,0,ck,stage2,32,moe_ck2stages_gemm2_256x32x64x128_1x4_MulABScaleExpertWeight_v1_Nswizzle0_Quant1_MulRoutedWeight1_F8_F8_B16,13.8852,20.473222222222205,0.00%,1.47,552.66
492,4,512,1792,6,2,ActivationType.Gelu,torch.bfloat16,torch.float8_e4m3fnuz,torch.float8_e4m3fnuz,QuantType.per_Token,1,1,asm,asm_1stage,32,_ZN5aiter50fmoe_bf16_pertokenFp8_g1u1_vs_tkw1_gelu_1tg_32x128E,13.7932,0.0,0.00%,3.19,1197.78
492,4,512,1792,6,2,ActivationType.Gelu,torch.bfloat16,torch.float8_e4m3fnuz,torch.float8_e4m3fnuz,QuantType.per_Token,1,1,asm,stage1,16,_ZN5aiter56fmoe_stage1_bf16_pertokenFp8_doweight_g1u1_16x64_5tg_pf3E,7.5071,28.65277777777781,0.00%,5.87,2200.75
492,4,512,1792,6,2,ActivationType.Gelu,torch.bfloat16,torch.float8_e4m3fnuz,torch.float8_e4m3fnuz,QuantType.per_Token,1,1,ck,stage1,32,moe_ck2stages_gemm1_256x32x64x256_1x4_MulABScale_v1_Nswizzle0_Quant2_MulRoutedWeight1_gelu_F8_F8_B16,8.8174,28.65277777777781,0.00%,4.99,1873.71
492,4,512,1792,6,2,ActivationType.Gelu,torch.bfloat16,torch.float8_e4m3fnuz,torch.float8_e4m3fnuz,QuantType.per_Token,1,1,ck,stage2,32,moe_ck2stages_gemm2_256x32x64x256_1x4_MulABScaleExpertWeight_v1_Nswizzle0_Quant2_MulRoutedWeight0_F8_F8_B16,11.7911,28.65277777777781,0.00%,3.74,1401.16
493,4,576,1920,4,2,ActivationType.Silu,torch.bfloat16,torch.bfloat16,torch.bfloat16,QuantType.No,1,0,ck,stage1,32,moe_ck2stages_gemm1_256x32x64x64_1x4_TypeCast_v1_Nswizzle0_Quant0_MulRoutedWeight0_silu_B16_B16_B16,10.4483,0.0,0.00%,5.08,2541.21
493,4,576,1920,4,2,ActivationType.Silu,torch.bfloat16,torch.bfloat16,torch.bfloat16,QuantType.No,1,0,ck,stage2,32,moe_ck2stages_gemm2_256x32x64x128_1x4_TypeCastExpertWeight_v1_Nswizzle0_Quant0_MulRoutedWeight1_B16_B16_B16,15.8883,0.0,0.00%,3.34,1671.12
495,4,640,2176,3,1,ActivationType.Silu,torch.bfloat16,torch.float8_e4m3fnuz,torch.float8_e4m3fnuz,QuantType.per_Tensor,1,0,asm,stage1,16,_ZN5aiter47fmoe_stage1_bf16_pertokenFp8_g1u1_16x64_5tg_pf3E,13.4321,19.69933333333337,0.00%,2.49,933.69
495,4,640,2176,3,1,ActivationType.Silu,torch.bfloat16,torch.float8_e4m3fnuz,torch.float8_e4m3fnuz,QuantType.per_Tensor,1,0,ck,stage1,32,moe_ck2stages_gemm1_256x32x64x128_1x4_MulABScale_v1_Nswizzle0_Quant1_MulRoutedWeight0_silu_F8_F8_B16,8.474,19.69933333333337,0.00%,3.94,1479.99
495,4,640,2176,3,1,ActivationType.Silu,torch.bfloat16,torch.float8_e4m3fnuz,torch.float8_e4m3fnuz,QuantType.per_Tensor,1,0,ck,stage2,32,moe_ck2stages_gemm2_256x32x64x128_1x4_MulABScaleExpertWeight_v1_Nswizzle0_Quant1_MulRoutedWeight1_F8_F8_B16,16.1456,19.69933333333337,0.00%,2.07,776.77
497,4,704,2304,3,1,ActivationType.Silu,torch.bfloat16,torch.bfloat16,torch.bfloat16,QuantType.No,1,0,ck,stage1,32,moe_ck2stages_gemm1_256x32x64x64_1x4_TypeCast_v1_Nswizzle0_Quant0_MulRoutedWeight0_silu_B16_B16_B16,11.6786,0.0,0.00%,3.33,2500.95
497,4,704,2304,3,1,ActivationType.Silu,torch.bfloat16,torch.bfloat16,torch.bfloat16,QuantType.No,1,0,ck,stage2,32,moe_ck2stages_gemm2_256x32x64x128_1x4_TypeCastExpertWeight_v1_Nswizzle0_Quant0_MulRoutedWeight1_B16_B16_B16,17.5578,0.0,0.00%,2.22,1663.51
501,8,192,768,2,1,ActivationType.Silu,torch.bfloat16,torch.bfloat16,torch.bfloat16,QuantType.No,1,0,ck,stage1,64,moe_ck2stages_gemm1_256x64x64x64_1x4_TypeCast_v1_Nswizzle0_Quant0_MulRoutedWeight0_silu_B16_B16_B16,7.1623,0.0,0.00%,0.99,247.91
501,8,192,768,2,1,ActivationType.Silu,torch.bfloat16,torch.bfloat16,torch.bfloat16,QuantType.No,1,0,ck,stage2,32,moe_ck2stages_gemm2_256x32x64x128_1x4_TypeCastExpertWeight_v1_Nswizzle0_Quant0_MulRoutedWeight1_B16_B16_B16,8.4463,0.0,0.00%,0.84,210.22
505,8,320,1152,3,1,ActivationType.Silu,torch.bfloat16,torch.bfloat16,torch.bfloat16,QuantType.No,1,0,ck,stage1,32,moe_ck2stages_gemm1_256x32x64x64_1x4_TypeCast_v1_Nswizzle0_Quant0_MulRoutedWeight0_silu_B16_B16_B16,8.2325,0.0,0.00%,2.15,807.26
505,8,320,1152,3,1,ActivationType.Silu,torch.bfloat16,torch.bfloat16,torch.bfloat16,QuantType.No,1,0,ck,stage2,32,moe_ck2stages_gemm2_256x32x64x128_1x4_TypeCastExpertWeight_v1_Nswizzle0_Quant0_MulRoutedWeight1_B16_B16_B16,12.1249,0.0,0.00%,1.46,548.11
507,8,384,1408,5,2,ActivationType.Silu,torch.bfloat16,torch.float8_e4m3fnuz,torch.float8_e4m3fnuz,QuantType.per_Tensor,1,0,asm,stage1,16,_ZN5aiter47fmoe_stage1_bf16_pertokenFp8_g1u1_16x64_5tg_pf3E,11.916,27.101111111110946,0.00%,4.36,681.38
507,8,384,1408,5,2,ActivationType.Silu,torch.bfloat16,torch.float8_e4m3fnuz,torch.float8_e4m3fnuz,QuantType.per_Tensor,1,0,ck,stage1,32,moe_ck2stages_gemm1_256x32x64x128_1x4_MulABScale_v1_Nswizzle0_Quant1_MulRoutedWeight0_silu_F8_F8_B16,7.1431,27.101111111110946,0.00%,7.27,1136.66
507,8,384,1408,5,2,ActivationType.Silu,torch.bfloat16,torch.float8_e4m3fnuz,torch.float8_e4m3fnuz,QuantType.per_Tensor,1,0,ck,stage2,32,moe_ck2stages_gemm2_256x32x64x128_1x4_MulABScaleExpertWeight_v1_Nswizzle0_Quant1_MulRoutedWeight1_F8_F8_B16,13.0197,27.101111111110946,0.00%,3.99,623.62
509,8,448,1664,3,1,ActivationType.Silu,torch.bfloat16,torch.bfloat16,torch.bfloat16,QuantType.No,1,0,ck,stage1,32,moe_ck2stages_gemm1_256x32x64x64_1x4_TypeCast_v1_Nswizzle0_Quant0_MulRoutedWeight0_silu_B16_B16_B16,9.5775,0.0,0.00%,3.74,1402.54
509,8,448,1664,3,1,ActivationType.Silu,torch.bfloat16,torch.bfloat16,torch.bfloat16,QuantType.No,1,0,ck,stage2,32,moe_ck2stages_gemm2_256x32x64x128_1x4_TypeCastExpertWeight_v1_Nswizzle0_Quant0_MulRoutedWeight1_B16_B16_B16,14.7941,0.0,0.00%,2.42,907.99
511,8,512,1792,3,1,ActivationType.Silu,torch.bfloat16,torch.float8_e4m3fnuz,torch.float8_e4m3fnuz,QuantType.per_Tensor,1,0,asm,stage1,16,_ZN5aiter47fmoe_stage1_bf16_pertokenFp8_g1u1_16x64_5tg_pf3E,12.5686,23.762222222222317,0.00%,3.5,657.97
511,8,512,1792,3,1,ActivationType.Silu,torch.bfloat16,torch.float8_e4m3fnuz,torch.float8_e4m3fnuz,QuantType.per_Tensor,1,0,ck,stage1,32,moe_ck2stages_gemm1_256x32x64x256_1x4_MulABScale_v1_Nswizzle0_Quant1_MulRoutedWeight0_silu_F8_F8_B16,7.2142,23.762222222222317,0.00%,6.1,1146.33
511,8,512,1792,3,1,ActivationType.Silu,torch.bfloat16,torch.float8_e4m3fnuz,torch.float8_e4m3fnuz,QuantType.per_Tensor,1,0,ck,stage2,32,moe_ck2stages_gemm2_256x32x64x256_1x4_MulABScaleExpertWeight_v1_Nswizzle0_Quant1_MulRoutedWeight1_F8_F8_B16,11.0944,23.762222222222317,0.00%,3.97,745.41
512,8,512,1920,6,2,ActivationType.Gelu,torch.bfloat16,torch.float8_e4m3fnuz,torch.float8_e4m3fnuz,QuantType.per_Token,1,1,asm,asm_1stage,32,_ZN5aiter50fmoe_bf16_pertokenFp8_g1u1_vs_tkw1_gelu_1tg_32x128E,14.1031,0.0,0.00%,6.69,1255.54
512,8,512,1920,6,2,ActivationType.Gelu,torch.bfloat16,torch.float8_e4m3fnuz,torch.float8_e4m3fnuz,QuantType.per_Token,1,1,asm,stage1,16,_ZN5aiter56fmoe_stage1_bf16_pertokenFp8_doweight_g1u1_16x64_5tg_pf3E,7.6065,31.452555555555527,0.00%,12.41,2327.88
512,8,512,1920,6,2,ActivationType.Gelu,torch.bfloat16,torch.float8_e4m3fnuz,torch.float8_e4m3fnuz,QuantType.per_Token,1,1,ck,stage1,32,moe_ck2stages_gemm1_256x32x64x256_1x4_MulABScale_v1_Nswizzle0_Quant2_MulRoutedWeight1_gelu_F8_F8_B16,9.222,31.452555555555527,0.00%,10.23,1920.08
512,8,512,1920,6,2,ActivationType.Gelu,torch.bfloat16,torch.float8_e4m3fnuz,torch.float8_e4m3fnuz,QuantType.per_Token,1,1,ck,stage2,32,moe_ck2stages_gemm2_256x32x64x128_1x4_MulABScaleExpertWeight_v1_Nswizzle0_Quant2_MulRoutedWeight0_F8_F8_B16,15.9048,31.452555555555527,0.00%,5.93,1113.31
513,8,576,2048,4,2,ActivationType.Silu,torch.bfloat16,torch.bfloat16,torch.bfloat16,QuantType.No,1,0,ck,stage1,32,moe_ck2stages_gemm1_256x32x64x64_1x4_TypeCast_v1_Nswizzle0_Quant0_MulRoutedWeight0_silu_B16_B16_B16,10.5705,0.0,0.00%,10.71,2680.1
513,8,576,2048,4,2,ActivationType.Silu,torch.bfloat16,torch.bfloat16,torch.bfloat16,QuantType.No,1,0,ck,stage2,32,moe_ck2stages_gemm2_256x32x64x128_1x4_TypeCastExpertWeight_v1_Nswizzle0_Quant0_MulRoutedWeight1_B16_B16_B16,15.8483,0.0,0.00%,7.15,1787.57
515,8,640,2176,3,1,ActivationType.Silu,torch.bfloat16,torch.float8_e4m3fnuz,torch.float8_e4m3fnuz,QuantType.per_Tensor,1,0,asm,stage1,16,_ZN5aiter47fmoe_stage1_bf16_pertokenFp8_g1u1_16x64_5tg_pf3E,13.5752,29.85577777777773,0.00%,4.92,924.42
515,8,640,2176,3,1,ActivationType.Silu,torch.bfloat16,torch.float8_e4m3fnuz,torch.float8_e4m3fnuz,QuantType.per_Tensor,1,0,ck,stage1,32,moe_ck2stages_gemm1_256x32x64x128_1x4_MulABScale_v1_Nswizzle0_Quant1_MulRoutedWeight0_silu_F8_F8_B16,8.5727,29.85577777777773,0.00%,7.8,1463.85
515,8,640,2176,3,1,ActivationType.Silu,torch.bfloat16,torch.float8_e4m3fnuz,torch.float8_e4m3fnuz,QuantType.per_Tensor,1,0,ck,stage2,32,moe_ck2stages_gemm2_256x32x64x128_1x4_MulABScaleExpertWeight_v1_Nswizzle0_Quant1_MulRoutedWeight1_F8_F8_B16,16.3136,29.85577777777773,0.00%,4.1,769.24
517,8,704,2432,3,1,ActivationType.Silu,torch.bfloat16,torch.bfloat16,torch.bfloat16,QuantType.No,1,0,ck,stage1,32,moe_ck2stages_gemm1_256x32x64x64_1x4_TypeCast_v1_Nswizzle0_Quant0_MulRoutedWeight0_silu_B16_B16_B16,11.6282,0.0,0.00%,7.07,2652.24
517,8,704,2432,3,1,ActivationType.Silu,torch.bfloat16,torch.bfloat16,torch.bfloat16,QuantType.No,1,0,ck,stage2,32,moe_ck2stages_gemm2_256x32x64x128_1x4_TypeCastExpertWeight_v1_Nswizzle0_Quant0_MulRoutedWeight1_B16_B16_B16,17.5309,0.0,0.00%,4.69,1759.23
521,16,192,896,2,1,ActivationType.Silu,torch.bfloat16,torch.bfloat16,torch.bfloat16,QuantType.No,1,0,ck,stage1,32,moe_ck2stages_gemm1_256x32x64x64_1x4_TypeCast_v1_Nswizzle0_Quant0_MulRoutedWeight0_silu_B16_B16_B16,5.7641,0.0,0.00%,2.87,360.28
521,16,192,896,2,1,ActivationType.Silu,torch.bfloat16,torch.bfloat16,torch.bfloat16,QuantType.No,1,0,ck,stage2,32,moe_ck2stages_gemm2_256x32x64x128_1x4_TypeCastExpertWeight_v1_Nswizzle0_Quant0_MulRoutedWeight1_B16_B16_B16,8.8119,0.0,0.00%,1.87,235.67
525,16,320,1280,3,1,ActivationType.Silu,torch.bfloat16,torch.bfloat16,torch.bfloat16,QuantType.No,1,0,ck,stage1,32,moe_ck2stages_gemm1_256x32x64x64_1x4_TypeCast_v1_Nswizzle0_Quant0_MulRoutedWeight0_silu_B16_B16_B16,8.2848,0.0,0.00%,4.75,892.39
525,16,320,1280,3,1,ActivationType.Silu,torch.bfloat16,torch.bfloat16,torch.bfloat16,QuantType.No,1,0,ck,stage2,32,moe_ck2stages_gemm2_256x32x64x128_1x4_TypeCastExpertWeight_v1_Nswizzle0_Quant0_MulRoutedWeight1_B16_B16_B16,12.8074,0.0,0.00%,3.07,577.27
527,16,384,1536,5,2,ActivationType.Silu,torch.bfloat16,torch.float8_e4m3fnuz,torch.float8_e4m3fnuz,QuantType.per_Tensor,1,0,asm,stage1,16,_ZN5aiter47fmoe_stage1_bf16_pertokenFp8_g1u1_16x64_5tg_pf3E,12.0926,32.633888888888904,0.00%,9.36,733.16
527,16,384,1536,5,2,ActivationType.Silu,torch.bfloat16,torch.float8_e4m3fnuz,torch.float8_e4m3fnuz,QuantType.per_Tensor,1,0,ck,stage1,32,moe_ck2stages_gemm1_256x32x64x128_1x4_MulABScale_v1_Nswizzle0_Quant1_MulRoutedWeight0_silu_F8_F8_B16,7.3074,32.633888888888904,0.00%,15.5,1213.26
527,16,384,1536,5,2,ActivationType.Silu,torch.bfloat16,torch.float8_e4m3fnuz,torch.float8_e4m3fnuz,QuantType.per_Tensor,1,0,ck,stage2,32,moe_ck2stages_gemm2_256x32x64x256_1x4_MulABScaleExpertWeight_v1_Nswizzle0_Quant1_MulRoutedWeight1_F8_F8_B16,10.7042,32.633888888888904,0.00%,10.58,828.25
528,16,384,1664,10,4,ActivationType.Gelu,torch.bfloat16,torch.float8_e4m3fnuz,torch.float8_e4m3fnuz,QuantType.per_Token,1,1,asm,asm_1stage,32,_ZN5aiter50fmoe_bf16_pertokenFp8_g1u1_vs_tkw1_gelu_1tg_32x128E,14.1685,0.0,0.00%,17.32,1354.25
528,16,384,1664,10,4,ActivationType.Gelu,torch.bfloat16,torch.float8_e4m3fnuz,torch.float8_e4m3fnuz,QuantType.per_Token,1,1,asm,stage1,16,_ZN5aiter56fmoe_stage1_bf16_pertokenFp8_doweight_g1u1_16x64_5tg_pf3E,7.6458,31.923999999999975,0.00%,32.09,2509.58
528,16,384,1664,10,4,ActivationType.Gelu,torch.bfloat16,torch.float8_e4m3fnuz,torch.float8_e4m3fnuz,QuantType.per_Token,1,1,ck,stage1,16,moe_ck2stages_gemm1_128x16x64x128_1x2_MulABScale_v1_Nswizzle0_Quant2_MulRoutedWeight1_gelu_F8_F8_B16,9.3758,31.923999999999975,0.00%,26.17,2046.51
528,16,384,1664,10,4,ActivationType.Gelu,torch.bfloat16,torch.float8_e4m3fnuz,torch.float8_e4m3fnuz,QuantType.per_Token,1,1,ck,stage2,32,moe_ck2stages_gemm2_256x32x64x128_1x4_MulABScaleExpertWeight_v1_Nswizzle0_Quant2_MulRoutedWeight0_F8_F8_B16,14.8954,31.923999999999975,0.00%,16.47,1288.16
529,16,448,1792,3,1,ActivationType.Silu,torch.bfloat16,torch.bfloat16,torch.bfloat16,QuantType.No,1,0,ck,stage1,32,moe_ck2stages_gemm1_256x32x64x64_1x4_TypeCast_v1_Nswizzle0_Quant0_MulRoutedWeight0_silu_B16_B16_B16,9.6579,0.0,0.00%,7.98,1499.22
529,16,448,1792,3,1,ActivationType.Silu,torch.bfloat16,torch.bfloat16,torch.bfloat16,QuantType.No,1,0,ck,stage2,32,moe_ck2stages_gemm2_256x32x64x128_1x4_TypeCastExpertWeight_v1_Nswizzle0_Quant0_MulRoutedWeight1_B16_B16_B16,15.4602,0.0,0.00%,4.99,936.56
531,16,512,1920,3,1,ActivationType.Silu,torch.bfloat16,torch.float8_e4m3fnuz,torch.float8_e4m3fnuz,QuantType.per_Tensor,1,0,asm,stage1,16,_ZN5aiter47fmoe_stage1_bf16_pertokenFp8_g1u1_16x64_5tg_pf3E,12.6737,28.70855555555562,0.00%,7.45,700.03
531,16,512,1920,3,1,ActivationType.Silu,torch.bfloat16,torch.float8_e4m3fnuz,torch.float8_e4m3fnuz,QuantType.per_Tensor,1,0,ck,stage1,32,moe_ck2stages_gemm1_256x32x64x256_1x4_MulABScale_v1_Nswizzle0_Quant1_MulRoutedWeight0_silu_F8_F8_B16,7.2485,28.70855555555562,0.00%,13.02,1223.97
531,16,512,1920,3,1,ActivationType.Silu,torch.bfloat16,torch.float8_e4m3fnuz,torch.float8_e4m3fnuz,QuantType.per_Tensor,1,0,ck,stage2,32,moe_ck2stages_gemm2_256x32x64x128_1x4_MulABScaleExpertWeight_v1_Nswizzle0_Quant1_MulRoutedWeight1_F8_F8_B16,15.2712,28.70855555555562,0.00%,6.18,580.96
532,16,512,2048,6,2,ActivationType.Gelu,torch.bfloat16,torch.float8_e4m3fnuz,torch.float8_e4m3fnuz,QuantType.per_Token,1,1,asm,asm_1stage,32,_ZN5aiter50fmoe_bf16_pertokenFp8_g1u1_vs_tkw1_gelu_1tg_32x128E,15.2049,0.0,0.00%,13.24,1242.95
532,16,512,2048,6,2,ActivationType.Gelu,torch.bfloat16,torch.float8_e4m3fnuz,torch.float8_e4m3fnuz,QuantType.per_Token,1,1,asm,stage1,16,_ZN5aiter56fmoe_stage1_bf16_pertokenFp8_doweight_g1u1_16x64_5tg_pf3E,8.4215,32.0885555555556,0.00%,23.91,2244.13
532,16,512,2048,6,2,ActivationType.Gelu,torch.bfloat16,torch.float8_e4m3fnuz,torch.float8_e4m3fnuz,QuantType.per_Token,1,1,ck,stage1,32,moe_ck2stages_gemm1_256x32x64x256_1x4_MulABScale_v1_Nswizzle0_Quant2_MulRoutedWeight1_gelu_F8_F8_B16,9.469,32.0885555555556,0.00%,21.26,1995.88
532,16,512,2048,6,2,ActivationType.Gelu,torch.bfloat16,torch.float8_e4m3fnuz,torch.float8_e4m3fnuz,QuantType.per_Token,1,1,ck,stage2,32,moe_ck2stages_gemm2_256x32x64x256_1x4_MulABScaleExpertWeight_v1_Nswizzle0_Quant2_MulRoutedWeight0_F8_F8_B16,12.357,32.0885555555556,0.00%,16.29,1529.41
533,16,576,2176,4,2,ActivationType.Silu,torch.bfloat16,torch.bfloat16,torch.bfloat16,QuantType.No,1,0,ck,stage1,32,moe_ck2stages_gemm1_256x32x64x64_1x4_TypeCast_v1_Nswizzle0_Quant0_MulRoutedWeight0_silu_B16_B16_B16,10.7287,0.0,0.00%,22.43,2807.23
533,16,576,2176,4,2,ActivationType.Silu,torch.bfloat16,torch.bfloat16,torch.bfloat16,QuantType.No,1,0,ck,stage2,32,moe_ck2stages_gemm2_256x32x64x128_1x4_TypeCastExpertWeight_v1_Nswizzle0_Quant0_MulRoutedWeight1_B16_B16_B16,16.7639,0.0,0.00%,14.36,1796.59
535,16,640,2304,3,1,ActivationType.Silu,torch.bfloat16,torch.float8_e4m3fnuz,torch.float8_e4m3fnuz,QuantType.per_Tensor,1,0,asm,stage1,16,_ZN5aiter47fmoe_stage1_bf16_pertokenFp8_g1u1_16x64_5tg_pf3E,13.6068,30.492666666666643,0.00%,10.4,977.58
535,16,640,2304,3,1,ActivationType.Silu,torch.bfloat16,torch.float8_e4m3fnuz,torch.float8_e4m3fnuz,QuantType.per_Tensor,1,0,ck,stage1,32,moe_ck2stages_gemm1_256x32x64x128_1x4_MulABScale_v1_Nswizzle0_Quant1_MulRoutedWeight0_silu_F8_F8_B16,8.5035,30.492666666666643,0.00%,16.65,1564.27
535,16,640,2304,3,1,ActivationType.Silu,torch.bfloat16,torch.float8_e4m3fnuz,torch.float8_e4m3fnuz,QuantType.per_Tensor,1,0,ck,stage2,32,moe_ck2stages_gemm2_256x32x64x256_1x4_MulABScaleExpertWeight_v1_Nswizzle0_Quant1_MulRoutedWeight1_F8_F8_B16,12.638,30.492666666666643,0.00%,11.2,1052.52
537,16,704,2560,3,1,ActivationType.Silu,torch.bfloat16,torch.bfloat16,torch.bfloat16,QuantType.No,1,0,ck,stage1,32,moe_ck2stages_gemm1_256x32x64x64_1x4_TypeCast_v1_Nswizzle0_Quant0_MulRoutedWeight0_silu_B16_B16_B16,11.5842,0.0,0.00%,14.94,2804.28
537,16,704,2560,3,1,ActivationType.Silu,torch.bfloat16,torch.bfloat16,torch.bfloat16,QuantType.No,1,0,ck,stage2,32,moe_ck2stages_gemm2_256x32x64x128_1x4_TypeCastExpertWeight_v1_Nswizzle0_Quant0_MulRoutedWeight1_B16_B16_B16,18.1746,0.0,0.00%,9.52,1787.41
541,32,256,1280,3,1,ActivationType.Silu,torch.bfloat16,torch.bfloat16,torch.bfloat16,QuantType.No,1,0,ck,stage1,32,moe_ck2stages_gemm1_256x32x64x128_1x4_TypeCast_v1_Nswizzle0_Quant0_MulRoutedWeight0_silu_B16_B16_B16,6.9411,0.0,0.00%,9.06,854.48
541,32,256,1280,3,1,ActivationType.Silu,torch.bfloat16,torch.bfloat16,torch.bfloat16,QuantType.No,1,0,ck,stage2,32,moe_ck2stages_gemm2_256x32x64x128_1x4_TypeCastExpertWeight_v1_Nswizzle0_Quant0_MulRoutedWeight1_B16_B16_B16,12.8524,0.0,0.00%,4.9,461.47
542,32,256,1408,6,2,ActivationType.Gelu,torch.bfloat16,torch.float8_e4m3fnuz,torch.float8_e4m3fnuz,QuantType.per_1x128,1,1,ck,stage1,16,moe_ck2stages_gemm1_256x16x128x256_1x4_MulABScaleExpertWeightA8W8blkscale_v1_Nswizzle0_Quant4_MulRoutedWeight1_gelu_F8_F8_B16,10.9308,28.590555555555667,0.01%,12.66,595.81
542,32,256,1408,6,2,ActivationType.Gelu,torch.bfloat16,torch.float8_e4m3fnuz,torch.float8_e4m3fnuz,QuantType.per_1x128,1,1,ck,stage2,16,moe_ck2stages_gemm2_128x16x128x128_1x2_MulABScaleExpertWeightA8W8blkscale_v1_Nswizzle0_Quant4_MulRoutedWeight0_F8_F8_B16,14.9588,28.590555555555667,6.37%,9.25,435.37
545,32,384,1664,5,2,ActivationType.Silu,torch.bfloat16,torch.bfloat16,torch.bfloat16,QuantType.No,1,0,ck,stage1,32,moe_ck2stages_gemm1_256x32x64x128_1x4_TypeCast_v1_Nswizzle0_Quant0_MulRoutedWeight0_silu_B16_B16_B16,8.3862,0.0,0.00%,29.26,2291.67
545,32,384,1664,5,2,ActivationType.Silu,torch.bfloat16,torch.bfloat16,torch.bfloat16,QuantType.No,1,0,ck,stage2,32,moe_ck2stages_gemm2_256x32x64x128_1x4_TypeCastExpertWeight_v1_Nswizzle0_Quant0_MulRoutedWeight1_B16_B16_B16,15.0095,0.0,0.00%,16.35,1280.42
546,32,384,1792,10,4,ActivationType.Gelu,torch.bfloat16,torch.float8_e4m3fnuz,torch.float8_e4m3fnuz,QuantType.per_1x128,1,1,ck,stage1,16,moe_ck2stages_gemm1_128x16x128x128_1x2_MulABScaleExpertWeightA8W8blkscale_v1_Nswizzle0_Quant4_MulRoutedWeight1_gelu_F8_F8_B16,17.1587,31.79522222222221,0.01%,30.8,1205.26
546,32,384,1792,10,4,ActivationType.Gelu,torch.bfloat16,torch.float8_e4m3fnuz,torch.float8_e4m3fnuz,QuantType.per_1x128,1,1,ck,stage2,16,moe_ck2stages_gemm2_256x16x128x256_1x4_MulABScaleExpertWeightA8W8blkscale_v1_Nswizzle0_Quant4_MulRoutedWeight0_F8_F8_B16,12.4536,31.79522222222221,11.55%,42.44,1660.62
547,32,448,1920,3,1,ActivationType.Silu,torch.bfloat16,torch.float8_e4m3fnuz,torch.float8_e4m3fnuz,QuantType.per_Tensor,1,0,asm,stage1,16,_ZN5aiter47fmoe_stage1_bf16_pertokenFp8_g1u1_16x64_5tg_pf3E,12.6104,34.99677777777778,32.45%,13.1,617.3
547,32,448,1920,3,1,ActivationType.Silu,torch.bfloat16,torch.float8_e4m3fnuz,torch.float8_e4m3fnuz,QuantType.per_Tensor,1,0,ck,stage2,32,moe_ck2stages_gemm2_256x32x64x128_1x4_MulABScaleExpertWeight_v1_Nswizzle0_Quant1_MulRoutedWeight1_F8_F8_B16,15.289,34.99677777777778,0.00%,10.8,509.15
549,32,512,2048,3,1,ActivationType.Silu,torch.bfloat16,torch.bfloat16,torch.bfloat16,QuantType.No,1,0,ck,stage1,32,moe_ck2stages_gemm1_256x32x64x128_1x4_TypeCast_v1_Nswizzle0_Quant0_MulRoutedWeight0_silu_B16_B16_B16,8.693,0.0,0.00%,23.16,2178.75
549,32,512,2048,3,1,ActivationType.Silu,torch.bfloat16,torch.bfloat16,torch.bfloat16,QuantType.No,1,0,ck,stage2,32,moe_ck2stages_gemm2_256x32x64x128_1x4_TypeCastExpertWeight_v1_Nswizzle0_Quant0_MulRoutedWeight1_B16_B16_B16,16.0038,0.0,0.00%,12.58,1183.46
550,32,512,2176,6,2,ActivationType.Gelu,torch.bfloat16,torch.float8_e4m3fnuz,torch.float8_e4m3fnuz,QuantType.per_1x128,1,1,ck,stage1,16,moe_ck2stages_gemm1_256x16x128x256_1x4_MulABScaleExpertWeightA8W8blkscale_v1_Nswizzle0_Quant4_MulRoutedWeight1_gelu_F8_F8_B16,14.4214,30.289222222222243,0.01%,29.67,1393.98
550,32,512,2176,6,2,ActivationType.Gelu,torch.bfloat16,torch.float8_e4m3fnuz,torch.float8_e4m3fnuz,QuantType.per_1x128,1,1,ck,stage2,32,moe_ck2stages_gemm2_256x32x128x128_1x4_MulABScaleExpertWeightA8W8blkscale_v1_Nswizzle0_Quant4_MulRoutedWeight0_F8_F8_B16,19.2571,30.289222222222243,6.14%,22.22,1043.94
551,32,576,2304,4,2,ActivationType.Silu,torch.bfloat16,torch.float8_e4m3fnuz,torch.float8_e4m3fnuz,QuantType.per_Tensor,1,0,asm,stage1,16,_ZN5aiter47fmoe_stage1_bf16_pertokenFp8_g1u1_16x64_5tg_pf3E,14.2739,31.373222222222186,33.54%,35.7,1119.56
551,32,576,2304,4,2,ActivationType.Silu,torch.bfloat16,torch.float8_e4m3fnuz,torch.float8_e4m3fnuz,QuantType.per_Tensor,1,0,ck,stage2,32,moe_ck2stages_gemm2_256x32x64x256_1x4_MulABScaleExpertWeight_v1_Nswizzle0_Quant1_MulRoutedWeight1_F8_F8_B16,13.4366,31.373222222222186,0.00%,37.93,1189.33
553,32,640,2432,3,1,ActivationType.Silu,torch.bfloat16,torch.bfloat16,torch.bfloat16,QuantType.No,1,0,ck,stage1,32,moe_ck2stages_gemm1_256x32x64x128_1x4_TypeCast_v1_Nswizzle0_Quant0_MulRoutedWeight0_silu_B16_B16_B16,9.8447,0.0,0.00%,30.36,2854.18
553,32,640,2432,3,1,ActivationType.Silu,torch.bfloat16,torch.bfloat16,torch.bfloat16,QuantType.No,1,0,ck,stage2,32,moe_ck2stages_gemm2_256x32x64x128_1x4_TypeCastExpertWeight_v1_Nswizzle0_Quant0_MulRoutedWeight1_B16_B16_B16,18.5477,0.0,0.00%,16.11,1514.94
554,32,640,2560,6,2,ActivationType.Gelu,torch.bfloat16,torch.float8_e4m3fnuz,torch.float8_e4m3fnuz,QuantType.per_1x128,1,1,ck,stage1,16,moe_ck2stages_gemm1_128x16x128x128_1x2_MulABScaleExpertWeightA8W8blkscale_v1_Nswizzle0_Quant4_MulRoutedWeight1_gelu_F8_F8_B16,18.4834,30.17055555555556,0.02%,34.04,1598.87
554,32,640,2560,6,2,ActivationType.Gelu,torch.bfloat16,torch.float8_e4m3fnuz,torch.float8_e4m3fnuz,QuantType.per_1x128,1,1,ck,stage2,16,moe_ck2stages_gemm2_256x16x128x256_1x4_MulABScaleExpertWeightA8W8blkscale_v1_Nswizzle0_Quant4_MulRoutedWeight0_F8_F8_B16,15.5448,30.17055555555556,5.94%,40.47,1901.13
555,32,704,2688,3,1,ActivationType.Silu,torch.bfloat16,torch.float8_e4m3fnuz,torch.float8_e4m3fnuz,QuantType.per_Tensor,1,0,asm,stage1,16,_ZN5aiter47fmoe_stage1_bf16_pertokenFp8_g1u1_16x64_5tg_pf3E,14.5532,42.6124444444444,39.24%,24.97,1174.91
555,32,704,2688,3,1,ActivationType.Silu,torch.bfloat16,torch.float8_e4m3fnuz,torch.float8_e4m3fnuz,QuantType.per_Tensor,1,0,ck,stage2,32,moe_ck2stages_gemm2_256x32x64x128_1x4_MulABScaleExpertWeight_v1_Nswizzle0_Quant1_MulRoutedWeight1_F8_F8_B16,19.4252,42.6124444444444,0.00%,18.7,880.24
557,64,192,1152,2,1,ActivationType.Silu,torch.bfloat16,torch.bfloat16,torch.bfloat16,QuantType.No,1,0,ck,stage1,32,moe_ck2stages_gemm1_256x32x64x64_1x4_TypeCast_v1_Nswizzle0_Quant0_MulRoutedWeight0_silu_B16_B16_B16,6.0979,0.0,0.00%,13.93,443.33
557,64,192,1152,2,1,ActivationType.Silu,torch.bfloat16,torch.bfloat16,torch.bfloat16,QuantType.No,1,0,ck,stage2,32,moe_ck2stages_gemm2_256x32x64x128_1x4_TypeCastExpertWeight_v1_Nswizzle0_Quant0_MulRoutedWeight1_B16_B16_B16,10.2645,0.0,0.00%,8.27,263.37
559,64,256,1408,3,1,ActivationType.Silu,torch.bfloat16,torch.float8_e4m3fnuz,torch.float8_e4m3fnuz,QuantType.per_Tensor,1,0,asm,stage1,16,_ZN5aiter47fmoe_stage1_bf16_pertokenFp8_g1u1_16x64_5tg_pf3E,10.89,43.04455555555562,0.00%,12.71,302.4
559,64,256,1408,3,1,ActivationType.Silu,torch.bfloat16,torch.float8_e4m3fnuz,torch.float8_e4m3fnuz,QuantType.per_Tensor,1,0,ck,stage1,32,moe_ck2stages_gemm1_256x32x64x128_1x4_MulABScale_v1_Nswizzle0_Quant1_MulRoutedWeight0_silu_F8_F8_B16,6.1292,43.04455555555562,0.00%,22.58,537.29
559,64,256,1408,3,1,ActivationType.Silu,torch.bfloat16,torch.float8_e4m3fnuz,torch.float8_e4m3fnuz,QuantType.per_Tensor,1,0,ck,stage2,32,moe_ck2stages_gemm2_256x32x64x128_1x4_MulABScaleExpertWeight_v1_Nswizzle0_Quant1_MulRoutedWeight1_F8_F8_B16,12.8675,43.04455555555562,0.00%,10.76,255.93
561,64,320,1664,3,1,ActivationType.Silu,torch.bfloat16,torch.bfloat16,torch.bfloat16,QuantType.No,1,0,ck,stage1,32,moe_ck2stages_gemm1_256x32x64x64_1x4_TypeCast_v1_Nswizzle0_Quant0_MulRoutedWeight0_silu_B16_B16_B16,8.4272,0.0,0.00%,24.26,1147.07
561,64,320,1664,3,1,ActivationType.Silu,torch.bfloat16,torch.bfloat16,torch.bfloat16,QuantType.No,1,0,ck,stage2,32,moe_ck2stages_gemm2_256x32x64x128_1x4_TypeCastExpertWeight_v1_Nswizzle0_Quant0_MulRoutedWeight1_B16_B16_B16,15.4775,0.0,0.00%,13.21,624.56
563,64,384,1792,5,2,ActivationType.Silu,torch.bfloat16,torch.float8_e4m3fnuz,torch.float8_e4m3fnuz,QuantType.per_Tensor,1,0,asm,stage1,16,_ZN5aiter47fmoe_stage1_bf16_pertokenFp8_g1u1_16x64_5tg_pf3E,12.6062,30.81655555555561,0.00%,41.92,824.65
563,64,384,1792,5,2,ActivationType.Silu,torch.bfloat16,torch.float8_e4m3fnuz,torch.float8_e4m3fnuz,QuantType.per_Tensor,1,0,ck,stage1,16,moe_ck2stages_gemm1_128x16x64x128_1x2_MulABScale_v1_Nswizzle0_Quant1_MulRoutedWeight0_silu_F8_F8_B16,7.5803,30.81655555555561,0.00%,69.72,1371.4
563,64,384,1792,5,2,ActivationType.Silu,torch.bfloat16,torch.float8_e4m3fnuz,torch.float8_e4m3fnuz,QuantType.per_Tensor,1,0,ck,stage2,32,moe_ck2stages_gemm2_256x32x64x256_1x4_MulABScaleExpertWeight_v1_Nswizzle0_Quant1_MulRoutedWeight1_F8_F8_B16,12.1384,30.81655555555561,0.00%,43.54,856.43
565,64,448,2048,3,1,ActivationType.Silu,torch.bfloat16,torch.bfloat16,torch.bfloat16,QuantType.No,1,0,ck,stage1,32,moe_ck2stages_gemm1_256x32x64x64_1x4_TypeCast_v1_Nswizzle0_Quant0_MulRoutedWeight0_silu_B16_B16_B16,9.7565,0.0,0.00%,36.11,1704.48
565,64,448,2048,3,1,ActivationType.Silu,torch.bfloat16,torch.bfloat16,torch.bfloat16,QuantType.No,1,0,ck,stage2,32,moe_ck2stages_gemm2_256x32x64x128_1x4_TypeCastExpertWeight_v1_Nswizzle0_Quant0_MulRoutedWeight1_B16_B16_B16,16.8288,0.0,0.00%,20.94,988.17
567,64,512,2176,3,1,ActivationType.Silu,torch.bfloat16,torch.float8_e4m3fnuz,torch.float8_e4m3fnuz,QuantType.per_Tensor,1,0,asm,stage1,16,_ZN5aiter47fmoe_stage1_bf16_pertokenFp8_g1u1_16x64_5tg_pf3E,12.9314,31.239000000000008,0.00%,33.08,783.0
567,64,512,2176,3,1,ActivationType.Silu,torch.bfloat16,torch.float8_e4m3fnuz,torch.float8_e4m3fnuz,QuantType.per_Tensor,1,0,ck,stage1,32,moe_ck2stages_gemm1_256x32x64x256_1x4_MulABScale_v1_Nswizzle0_Quant1_MulRoutedWeight0_silu_F8_F8_B16,7.4919,31.239000000000008,0.00%,57.1,1351.5
567,64,512,2176,3,1,ActivationType.Silu,torch.bfloat16,torch.float8_e4m3fnuz,torch.float8_e4m3fnuz,QuantType.per_Tensor,1,0,ck,stage2,32,moe_ck2stages_gemm2_256x32x64x128_1x4_MulABScaleExpertWeight_v1_Nswizzle0_Quant1_MulRoutedWeight1_F8_F8_B16,17.1497,31.239000000000008,0.00%,24.95,590.41
568,64,512,2304,6,2,ActivationType.Gelu,torch.bfloat16,torch.float8_e4m3fnuz,torch.float8_e4m3fnuz,QuantType.per_Token,1,1,asm,asm_1stage,32,_ZN5aiter50fmoe_bf16_pertokenFp8_g1u1_vs_tkw1_gelu_1tg_32x128E,15.4411,0.0,0.00%,58.67,1381.51
568,64,512,2304,6,2,ActivationType.Gelu,torch.bfloat16,torch.float8_e4m3fnuz,torch.float8_e4m3fnuz,QuantType.per_Token,1,1,asm,stage1,32,_ZN5aiter56fmoe_stage1_bf16_pertokenFp8_doweight_g1u1_32x64_4tg_pf3E,8.9142,36.98444444444448,0.00%,101.63,2393.03
568,64,512,2304,6,2,ActivationType.Gelu,torch.bfloat16,torch.float8_e4m3fnuz,torch.float8_e4m3fnuz,QuantType.per_Token,1,1,ck,stage1,32,moe_ck2stages_gemm1_256x32x64x256_1x4_MulABScale_v1_Nswizzle0_Quant2_MulRoutedWeight1_gelu_F8_F8_B16,9.7023,36.98444444444448,0.00%,93.38,2198.65
568,64,512,2304,6,2,ActivationType.Gelu,torch.bfloat16,torch.float8_e4m3fnuz,torch.float8_e4m3fnuz,QuantType.per_Token,1,1,ck,stage2,32,moe_ck2stages_gemm2_256x32x64x256_1x4_MulABScaleExpertWeight_v1_Nswizzle0_Quant2_MulRoutedWeight0_F8_F8_B16,13.9658,36.98444444444448,0.00%,64.87,1527.44
569,64,576,2432,4,2,ActivationType.Silu,torch.bfloat16,torch.bfloat16,torch.bfloat16,QuantType.No,1,0,ck,stage1,32,moe_ck2stages_gemm1_256x32x64x64_1x4_TypeCast_v1_Nswizzle0_Quant0_MulRoutedWeight0_silu_B16_B16_B16,12.333,0.0,0.00%,87.23,2737.97
569,64,576,2432,4,2,ActivationType.Silu,torch.bfloat16,torch.bfloat16,torch.bfloat16,QuantType.No,1,0,ck,stage2,32,moe_ck2stages_gemm2_256x32x64x128_1x4_TypeCastExpertWeight_v1_Nswizzle0_Quant0_MulRoutedWeight1_B16_B16_B16,18.324,0.0,0.00%,58.71,1842.8
571,64,640,2560,3,1,ActivationType.Silu,torch.bfloat16,torch.float8_e4m3fnuz,torch.float8_e4m3fnuz,QuantType.per_Tensor,1,0,asm,stage1,16,_ZN5aiter47fmoe_stage1_bf16_pertokenFp8_g1u1_16x64_5tg_pf3E,14.0126,30.705777777777737,0.00%,44.9,1061.08
571,64,640,2560,3,1,ActivationType.Silu,torch.bfloat16,torch.float8_e4m3fnuz,torch.float8_e4m3fnuz,QuantType.per_Tensor,1,0,ck,stage1,32,moe_ck2stages_gemm1_256x32x64x128_1x4_MulABScale_v1_Nswizzle0_Quant1_MulRoutedWeight0_silu_F8_F8_B16,8.7668,30.705777777777737,0.00%,71.76,1696.0
571,64,640,2560,3,1,ActivationType.Silu,torch.bfloat16,torch.float8_e4m3fnuz,torch.float8_e4m3fnuz,QuantType.per_Tensor,1,0,ck,stage2,32,moe_ck2stages_gemm2_256x32x64x256_1x4_MulABScaleExpertWeight_v1_Nswizzle0_Quant1_MulRoutedWeight1_F8_F8_B16,14.035,30.705777777777737,0.00%,44.83,1059.39
573,64,704,2816,3,1,ActivationType.Silu,torch.bfloat16,torch.bfloat16,torch.bfloat16,QuantType.No,1,0,ck,stage1,32,moe_ck2stages_gemm1_256x32x64x64_1x4_TypeCast_v1_Nswizzle0_Quant0_MulRoutedWeight0_silu_B16_B16_B16,11.8557,0.0,0.00%,64.21,3025.09
573,64,704,2816,3,1,ActivationType.Silu,torch.bfloat16,torch.bfloat16,torch.bfloat16,QuantType.No,1,0,ck,stage2,32,moe_ck2stages_gemm2_256x32x64x128_1x4_TypeCastExpertWeight_v1_Nswizzle0_Quant0_MulRoutedWeight1_B16_B16_B16,19.9319,0.0,0.00%,38.19,1799.36
575,128,192,1280,2,1,ActivationType.Silu,torch.bfloat16,torch.float8_e4m3fnuz,torch.float8_e4m3fnuz,QuantType.per_Tensor,1,0,asm,stage1,16,_ZN5aiter47fmoe_stage1_bf16_pertokenFp8_g1u1_16x64_5tg_pf3E,10.2935,30.06933333333336,17.95%,18.34,150.41
575,128,192,1280,2,1,ActivationType.Silu,torch.bfloat16,torch.float8_e4m3fnuz,torch.float8_e4m3fnuz,QuantType.per_Tensor,1,0,ck,stage2,32,moe_ck2stages_gemm2_256x32x64x256_1x4_MulABScaleExpertWeight_v1_Nswizzle0_Quant1_MulRoutedWeight1_F8_F8_B16,9.0756,30.06933333333336,0.00%,20.8,170.6
577,128,256,1536,3,1,ActivationType.Silu,torch.bfloat16,torch.bfloat16,torch.bfloat16,QuantType.No,1,0,ck,stage1,32,moe_ck2stages_gemm1_256x32x64x128_1x4_TypeCast_v1_Nswizzle0_Quant0_MulRoutedWeight0_silu_B16_B16_B16,7.1627,0.0,0.00%,42.16,1006.46
577,128,256,1536,3,1,ActivationType.Silu,torch.bfloat16,torch.bfloat16,torch.bfloat16,QuantType.No,1,0,ck,stage2,32,moe_ck2stages_gemm2_256x32x64x128_1x4_TypeCastExpertWeight_v1_Nswizzle0_Quant0_MulRoutedWeight1_B16_B16_B16,14.0956,0.0,0.00%,21.42,511.43
578,128,256,1664,6,2,ActivationType.Gelu,torch.bfloat16,torch.float8_e4m3fnuz,torch.float8_e4m3fnuz,QuantType.per_1x128,1,1,ck,stage1,32,moe_ck2stages_gemm1_256x32x128x128_1x4_MulABScaleExpertWeightA8W8blkscale_v1_Nswizzle0_Quant4_MulRoutedWeight1_gelu_F8_F8_B16,13.0403,37.79088888888887,0.01%,50.18,595.54
578,128,256,1664,6,2,ActivationType.Gelu,torch.bfloat16,torch.float8_e4m3fnuz,torch.float8_e4m3fnuz,QuantType.per_1x128,1,1,ck,stage2,16,moe_ck2stages_gemm2_128x16x128x128_1x2_MulABScaleExpertWeightA8W8blkscale_v1_Nswizzle0_Quant4_MulRoutedWeight0_F8_F8_B16,16.4107,37.79088888888887,6.27%,39.87,473.23
579,128,320,1792,3,1,ActivationType.Silu,torch.bfloat16,torch.float8_e4m3fnuz,torch.float8_e4m3fnuz,QuantType.per_Tensor,1,0,asm,stage1,16,_ZN5aiter47fmoe_stage1_bf16_pertokenFp8_g1u1_16x64_5tg_pf3E,11.5326,31.73777777777794,24.79%,38.19,458.17
579,128,320,1792,3,1,ActivationType.Silu,torch.bfloat16,torch.float8_e4m3fnuz,torch.float8_e4m3fnuz,QuantType.per_Tensor,1,0,ck,stage2,32,moe_ck2stages_gemm2_256x32x64x256_1x4_MulABScaleExpertWeight_v1_Nswizzle0_Quant1_MulRoutedWeight1_F8_F8_B16,11.2227,31.73777777777794,0.00%,39.24,470.82
581,128,384,1920,5,2,ActivationType.Silu,torch.bfloat16,torch.bfloat16,torch.bfloat16,QuantType.No,1,0,ck,stage1,64,moe_ck2stages_gemm1_256x64x64x64_1x4_TypeCast_v1_Nswizzle0_Quant0_MulRoutedWeight0_silu_B16_B16_B16,11.0754,0.0,0.00%,102.25,2014.83
581,128,384,1920,5,2,ActivationType.Silu,torch.bfloat16,torch.bfloat16,torch.bfloat16,QuantType.No,1,0,ck,stage2,32,moe_ck2stages_gemm2_256x32x64x128_1x4_TypeCastExpertWeight_v1_Nswizzle0_Quant0_MulRoutedWeight1_B16_B16_B16,16.497,0.0,0.00%,68.65,1352.67
582,128,384,2048,10,4,ActivationType.Gelu,torch.bfloat16,torch.float8_e4m3fnuz,torch.float8_e4m3fnuz,QuantType.per_1x128,1,1,ck,stage1,16,moe_ck2stages_gemm1_128x16x128x128_1x2_MulABScaleExpertWeightA8W8blkscale_v1_Nswizzle0_Quant4_MulRoutedWeight1_gelu_F8_F8_B16,20.67,41.689666666666575,0.01%,116.88,1148.54
582,128,384,2048,10,4,ActivationType.Gelu,torch.bfloat16,torch.float8_e4m3fnuz,torch.float8_e4m3fnuz,QuantType.per_1x128,1,1,ck,stage2,16,moe_ck2stages_gemm2_256x16x128x256_1x4_MulABScaleExpertWeightA8W8blkscale_v1_Nswizzle0_Quant4_MulRoutedWeight0_F8_F8_B16,14.3581,41.689666666666575,11.63%,168.26,1653.45
583,128,448,2176,3,1,ActivationType.Silu,torch.bfloat16,torch.float8_e4m3fnuz,torch.float8_e4m3fnuz,QuantType.per_Tensor,1,0,asm,stage1,32,_ZN5aiter47fmoe_stage1_bf16_pertokenFp8_g1u1_32x64_4tg_pf3E,13.2757,36.87944444444441,30.17%,56.4,673.84
583,128,448,2176,3,1,ActivationType.Silu,torch.bfloat16,torch.float8_e4m3fnuz,torch.float8_e4m3fnuz,QuantType.per_Tensor,1,0,ck,stage2,32,moe_ck2stages_gemm2_256x32x64x128_1x4_MulABScaleExpertWeight_v1_Nswizzle0_Quant1_MulRoutedWeight1_F8_F8_B16,16.8856,36.87944444444441,0.00%,44.34,529.78
584,128,448,2176,6,2,ActivationType.Gelu,torch.bfloat16,torch.float8_e4m3fnuz,torch.float8_e4m3fnuz,QuantType.per_Token,1,1,asm,asm_1stage,32,_ZN5aiter50fmoe_bf16_pertokenFp8_g1u1_vs_tkw1_gelu_1tg_32x128E,18.2192,0.0,5.29%,82.19,972.56
584,128,448,2176,6,2,ActivationType.Gelu,torch.bfloat16,torch.float8_e4m3fnuz,torch.float8_e4m3fnuz,QuantType.per_Token,1,1,asm,stage1,64,_ZN5aiter56fmoe_stage1_bf16_pertokenFp8_doweight_g1u1_64x64_2tg_pf3E,10.4345,41.4712222222222,3.70%,143.5,1698.15
