op_tests/moe_benchmarking_profiling/results/mi350_best_kernels.csv
config_idx,token,model_dim,inter_dim,expert,topk,act_type,dtype,q_dtype_a,q_dtype_w,q_type,use_g1u1,doweight_stage1,kernel_type,stage,block_m,kernel_name,time_us,quant_time_us,error,tflops,bandwidth_gb
0,1,7168,256,256,8,ActivationType.Silu,torch.bfloat16,torch.float8_e4m3fn,torch.float8_e4m3fn,QuantType.per_1x128,1,0,ck,stage1,16,moe_ck2stages_gemm1_256x16x128x256_1x4_MulABScaleExpertWeightA8W8blkscale_v1_Nswizzle0_Quant4_MulRoutedWeight0_silu_F8_F8_B16,46.1632,19.13433333333329,0.00%,1.91,30528.81
0,1,7168,256,256,8,ActivationType.Silu,torch.bfloat16,torch.float8_e4m3fn,torch.float8_e4m3fn,QuantType.per_1x128,1,0,ck,stage2,16,moe_ck2stages_gemm2_256x16x128x256_1x4_MulABScaleExpertWeightA8W8blkscale_v1_Nswizzle0_Quant4_MulRoutedWeight1_F8_F8_B16,7.6563,19.13433333333329,15.56%,11.5,184071.63
0,1,7168,256,256,8,ActivationType.Silu,torch.bfloat16,torch.float8_e4m3fn,torch.float8_e4m3fn,QuantType.per_1x128,1,0,asm,asm_1stage,32,_ZN5aiter47fmoe_bf16_blockscaleFp8_g1u1_vs_silu_1tg_32x256E,110.2365,0.0,0.00%,0.8,12784.4
1,1,7168,256,257,9,ActivationType.Silu,torch.bfloat16,torch.float8_e4m3fn,torch.float8_e4m3fn,QuantType.per_1x128,1,0,ck,stage1,16,moe_ck2stages_gemm1_256x16x128x256_1x4_MulABScaleExpertWeightA8W8blkscale_v1_Nswizzle0_Quant4_MulRoutedWeight0_silu_F8_F8_B16,46.2238,20.463333333333324,0.09%,2.14,30607.88
1,1,7168,256,257,9,ActivationType.Silu,torch.bfloat16,torch.float8_e4m3fn,torch.float8_e4m3fn,QuantType.per_1x128,1,0,ck,stage2,16,moe_ck2stages_gemm2_256x16x128x256_1x4_MulABScaleExpertWeightA8W8blkscale_v1_Nswizzle0_Quant4_MulRoutedWeight1_F8_F8_B16,7.97,20.463333333333324,17.19%,12.43,177517.27
1,1,7168,256,257,9,ActivationType.Silu,torch.bfloat16,torch.float8_e4m3fn,torch.float8_e4m3fn,QuantType.per_1x128,1,0,asm,asm_1stage,32,_ZN5aiter47fmoe_bf16_blockscaleFp8_g1u1_vs_silu_1tg_32x256E,110.8421,0.0,0.00%,0.89,12764.22
2,2,7168,256,256,8,ActivationType.Silu,torch.bfloat16,torch.float8_e4m3fn,torch.float8_e4m3fn,QuantType.per_1x128,1,0,ck,stage1,16,moe_ck2stages_gemm1_256x16x128x256_1x4_MulABScaleExpertWeightA8W8blkscale_v1_Nswizzle0_Quant4_MulRoutedWeight0_silu_F8_F8_B16,47.1974,19.60533333333332,0.10%,3.73,29860.31
2,2,7168,256,256,8,ActivationType.Silu,torch.bfloat16,torch.float8_e4m3fn,torch.float8_e4m3fn,QuantType.per_1x128,1,0,ck,stage2,16,moe_ck2stages_gemm2_256x16x128x256_1x4_MulABScaleExpertWeightA8W8blkscale_v1_Nswizzle0_Quant4_MulRoutedWeight1_F8_F8_B16,11.7589,19.60533333333332,15.24%,14.98,119852.12
2,2,7168,256,256,8,ActivationType.Silu,torch.bfloat16,torch.float8_e4m3fn,torch.float8_e4m3fn,QuantType.per_1x128,1,0,asm,asm_1stage,32,_ZN5aiter47fmoe_bf16_blockscaleFp8_g1u1_vs_silu_1tg_32x256E,110.7454,0.0,0.00%,1.59,12725.85
3,2,7168,256,257,9,ActivationType.Silu,torch.bfloat16,torch.float8_e4m3fn,torch.float8_e4m3fn,QuantType.per_1x128,1,0,ck,stage1,16,moe_ck2stages_gemm1_256x16x128x256_1x4_MulABScaleExpertWeightA8W8blkscale_v1_Nswizzle0_Quant4_MulRoutedWeight0_silu_F8_F8_B16,47.6724,20.734333333333428,0.11%,4.16,29678.27
3,2,7168,256,257,9,ActivationType.Silu,torch.bfloat16,torch.float8_e4m3fn,torch.float8_e4m3fn,QuantType.per_1x128,1,0,ck,stage2,16,moe_ck2stages_gemm2_256x16x128x256_1x4_MulABScaleExpertWeightA8W8blkscale_v1_Nswizzle0_Quant4_MulRoutedWeight1_F8_F8_B16,12.3841,20.734333333333428,16.73%,16.0,114246.02
3,2,7168,256,257,9,ActivationType.Silu,torch.bfloat16,torch.float8_e4m3fn,torch.float8_e4m3fn,QuantType.per_1x128,1,0,asm,asm_1stage,32,_ZN5aiter47fmoe_bf16_blockscaleFp8_g1u1_vs_silu_1tg_32x256E,110.898,0.0,0.00%,1.79,12757.98
4,4,2304,1536,8,2,ActivationType.Gelu,torch.bfloat16,torch.float8_e4m3fn,torch.float8_e4m3fn,QuantType.per_Token,1,0,ck,stage1,32,moe_ck2stages_gemm1_256x32x64x256_1x4_TypeCast_v1_Nswizzle0_Quant2_MulRoutedWeight0_gelu_F8_F8_B16,12.7578,24.027666666666715,0.00%,13.31,6659.64
4,4,2304,1536,8,2,ActivationType.Gelu,torch.bfloat16,torch.float8_e4m3fn,torch.float8_e4m3fn,QuantType.per_Token,1,0,asm,stage1,16,_ZN5aiter47fmoe_stage1_bf16_pertokenFp8_g1u1_16x64_5tg_pf3E,14.756,24.027666666666715,0.00%,11.51,5757.81
4,4,2304,1536,8,2,ActivationType.Gelu,torch.bfloat16,torch.float8_e4m3fn,torch.float8_e4m3fn,QuantType.per_Token,1,0,ck,stage2,32,moe_ck2stages_gemm2_256x32x128x256_1x4_TypeCast_v1_Nswizzle0_Quant2_MulRoutedWeight1_F8_F8_B16,12.6609,24.027666666666715,0.25%,13.42,6710.61
4,4,2304,1536,8,2,ActivationType.Gelu,torch.bfloat16,torch.float8_e4m3fn,torch.float8_e4m3fn,QuantType.per_Token,1,0,asm,asm_1stage,32,_ZN5aiter45fmoe_bf16_pertokenFp8_g1u1_vs_gelu_1tg_32x192E,37.8685,0.0,18.59%,4.49,2243.61
5,4,2304,1536,8,2,ActivationType.Gelu,torch.bfloat16,torch.float8_e4m3fn,torch.float8_e4m3fn,QuantType.per_Token,1,1,ck,stage1,32,moe_ck2stages_gemm1_256x32x64x256_1x4_TypeCast_v1_Nswizzle0_Quant2_MulRoutedWeight1_gelu_F8_F8_B16,12.5427,24.921111111111102,0.00%,13.54,6773.84
5,4,2304,1536,8,2,ActivationType.Gelu,torch.bfloat16,torch.float8_e4m3fn,torch.float8_e4m3fn,QuantType.per_Token,1,1,asm,stage1,16,_ZN5aiter56fmoe_stage1_bf16_pertokenFp8_doweight_g1u1_16x64_5tg_pf3E,14.8593,24.921111111111102,0.00%,11.43,5717.79
5,4,2304,1536,8,2,ActivationType.Gelu,torch.bfloat16,torch.float8_e4m3fn,torch.float8_e4m3fn,QuantType.per_Token,1,1,ck,stage2,32,moe_ck2stages_gemm2_256x32x128x256_1x4_TypeCast_v1_Nswizzle0_Quant2_MulRoutedWeight0_F8_F8_B16,13.0245,24.921111111111102,0.02%,13.04,6523.27
5,4,2304,1536,8,2,ActivationType.Gelu,torch.bfloat16,torch.float8_e4m3fn,torch.float8_e4m3fn,QuantType.per_Token,1,1,asm,asm_1stage,32,_ZN5aiter46fmoe_bf16_pertokenFp8_g1u1_tkw1_gelu_1tg_32x64E,30.9768,0.0,0.00%,5.48,2742.77
6,4,7168,256,256,8,ActivationType.Silu,torch.bfloat16,torch.float8_e4m3fn,torch.float8_e4m3fn,QuantType.per_1x128,1,0,ck,stage1,16,moe_ck2stages_gemm1_256x16x128x256_1x4_MulABScaleExpertWeightA8W8blkscale_v1_Nswizzle0_Quant4_MulRoutedWeight0_silu_F8_F8_B16,48.9798,23.512333333333352,0.06%,7.19,28774.56
6,4,7168,256,256,8,ActivationType.Silu,torch.bfloat16,torch.float8_e4m3fn,torch.float8_e4m3fn,QuantType.per_1x128,1,0,ck,stage2,16,moe_ck2stages_gemm2_256x16x128x256_1x4_MulABScaleExpertWeightA8W8blkscale_v1_Nswizzle0_Quant4_MulRoutedWeight1_F8_F8_B16,17.3726,23.512333333333352,15.57%,20.28,81126.15
6,4,7168,256,256,8,ActivationType.Silu,torch.bfloat16,torch.float8_e4m3fn,torch.float8_e4m3fn,QuantType.per_1x128,1,0,asm,asm_1stage,32,_ZN5aiter47fmoe_bf16_blockscaleFp8_g1u1_vs_silu_1tg_32x256E,113.2341,0.0,0.00%,3.11,12446.53
7,4,7168,256,257,9,ActivationType.Silu,torch.bfloat16,torch.float8_e4m3fn,torch.float8_e4m3fn,QuantType.per_1x128,1,0,ck,stage1,16,moe_ck2stages_gemm1_256x16x128x256_1x4_MulABScaleExpertWeightA8W8blkscale_v1_Nswizzle0_Quant4_MulRoutedWeight0_silu_F8_F8_B16,50.0212,24.027888888888924,0.08%,7.92,28285.55
7,4,7168,256,257,9,ActivationType.Silu,torch.bfloat16,torch.float8_e4m3fn,torch.float8_e4m3fn,QuantType.per_1x128,1,0,ck,stage2,16,moe_ck2stages_gemm2_256x16x128x256_1x4_MulABScaleExpertWeightA8W8blkscale_v1_Nswizzle0_Quant4_MulRoutedWeight1_F8_F8_B16,18.8016,24.027888888888924,16.42%,21.08,75253.02
7,4,7168,256,257,9,ActivationType.Silu,torch.bfloat16,torch.float8_e4m3fn,torch.float8_e4m3fn,QuantType.per_1x128,1,0,asm,asm_1stage,32,_ZN5aiter47fmoe_bf16_blockscaleFp8_g1u1_vs_silu_1tg_32x256E,114.4012,0.0,0.00%,3.46,12367.68
8,8,7168,256,256,8,ActivationType.Silu,torch.bfloat16,torch.float8_e4m3fn,torch.float8_e4m3fn,QuantType.per_1x128,1,0,ck,stage1,16,moe_ck2stages_gemm1_256x16x128x256_1x4_MulABScaleExpertWeightA8W8blkscale_v1_Nswizzle0_Quant4_MulRoutedWeight0_silu_F8_F8_B16,54.1094,24.50777777777781,0.09%,13.02,26048.31
8,8,7168,256,256,8,ActivationType.Silu,torch.bfloat16,torch.float8_e4m3fn,torch.float8_e4m3fn,QuantType.per_1x128,1,0,ck,stage2,16,moe_ck2stages_gemm2_256x16x128x256_1x4_MulABScaleExpertWeightA8W8blkscale_v1_Nswizzle0_Quant4_MulRoutedWeight1_F8_F8_B16,26.4197,24.50777777777781,15.70%,26.67,53348.76
8,8,7168,256,256,8,ActivationType.Silu,torch.bfloat16,torch.float8_e4m3fn,torch.float8_e4m3fn,QuantType.per_1x128,1,0,asm,asm_1stage,32,_ZN5aiter47fmoe_bf16_blockscaleFp8_g1u1_vs_silu_1tg_32x256E,118.308,0.0,0.00%,5.96,11913.46
9,8,7168,256,257,9,ActivationType.Silu,torch.bfloat16,torch.float8_e4m3fn,torch.float8_e4m3fn,QuantType.per_1x128,1,0,ck,stage1,16,moe_ck2stages_gemm1_256x16x128x256_1x4_MulABScaleExpertWeightA8W8blkscale_v1_Nswizzle0_Quant4_MulRoutedWeight0_silu_F8_F8_B16,55.8441,25.37877777777784,0.08%,14.2,25337.74
9,8,7168,256,257,9,ActivationType.Silu,torch.bfloat16,torch.float8_e4m3fn,torch.float8_e4m3fn,QuantType.per_1x128,1,0,ck,stage2,16,moe_ck2stages_gemm2_256x16x128x256_1x4_MulABScaleExpertWeightA8W8blkscale_v1_Nswizzle0_Quant4_MulRoutedWeight1_F8_F8_B16,28.5965,25.37877777777784,16.58%,27.72,49480.29
9,8,7168,256,257,9,ActivationType.Silu,torch.bfloat16,torch.float8_e4m3fn,torch.float8_e4m3fn,QuantType.per_1x128,1,0,asm,asm_1stage,32,_ZN5aiter47fmoe_bf16_blockscaleFp8_g1u1_vs_silu_1tg_32x256E,121.5376,0.0,0.00%,6.52,11642.18
10,16,2048,192,128,8,ActivationType.Silu,torch.bfloat16,torch.bfloat16,torch.bfloat16,QuantType.No,1,0,ck,stage1,32,moe_ck2stages_gemm1_256x32x64x128_1x4_TypeCast_v1_Nswizzle0_Quant0_MulRoutedWeight0_silu_B16_B16_B16,25.9553,0.0,0.00%,11.63,11640.05
10,16,2048,192,128,8,ActivationType.Silu,torch.bfloat16,torch.bfloat16,torch.bfloat16,QuantType.No,1,0,ck,stage2,32,moe_ck2stages_gemm2_256x32x64x64_1x4_TypeCast_v1_Nswizzle0_Quant0_MulRoutedWeight1_B16_B16_B16,19.596,0.0,0.00%,15.41,15417.48
11,16,2048,192,128,8,ActivationType.Silu,torch.bfloat16,torch.bfloat16,torch.bfloat16,QuantType.No,1,1,ck,stage1,32,moe_ck2stages_gemm1_256x32x64x128_1x4_TypeCast_v1_Nswizzle0_Quant0_MulRoutedWeight1_silu_B16_B16_B16,25.9291,0.0,0.00%,11.65,11651.81
11,16,2048,192,128,8,ActivationType.Silu,torch.bfloat16,torch.bfloat16,torch.bfloat16,QuantType.No,1,1,ck,stage2,32,moe_ck2stages_gemm2_256x32x64x64_1x4_TypeCast_v1_Nswizzle0_Quant0_MulRoutedWeight0_B16_B16_B16,18.5106,0.0,0.00%,16.31,16321.51
12,16,2048,192,128,8,ActivationType.Gelu,torch.bfloat16,torch.bfloat16,torch.bfloat16,QuantType.No,1,0,ck,stage1,32,moe_ck2stages_gemm1_256x32x64x128_1x4_TypeCast_v1_Nswizzle0_Quant0_MulRoutedWeight0_gelu_B16_B16_B16,25.6294,0.0,0.00%,11.78,11788.06
12,16,2048,192,128,8,ActivationType.Gelu,torch.bfloat16,torch.bfloat16,torch.bfloat16,QuantType.No,1,0,ck,stage2,32,moe_ck2stages_gemm2_256x32x64x64_1x4_TypeCast_v1_Nswizzle0_Quant0_MulRoutedWeight1_B16_B16_B16,19.541,0.0,0.00%,15.45,15460.88
13,16,2048,192,128,8,ActivationType.Gelu,torch.bfloat16,torch.bfloat16,torch.bfloat16,QuantType.No,1,1,ck,stage1,32,moe_ck2stages_gemm1_256x32x64x128_1x4_TypeCast_v1_Nswizzle0_Quant0_MulRoutedWeight1_gelu_B16_B16_B16,25.903,0.0,0.00%,11.66,11663.55
13,16,2048,192,128,8,ActivationType.Gelu,torch.bfloat16,torch.bfloat16,torch.bfloat16,QuantType.No,1,1,ck,stage2,32,moe_ck2stages_gemm2_256x32x64x64_1x4_TypeCast_v1_Nswizzle0_Quant0_MulRoutedWeight0_B16_B16_B16,18.088,0.0,0.00%,16.7,16702.84
14,16,4096,192,128,8,ActivationType.Silu,torch.bfloat16,torch.bfloat16,torch.bfloat16,QuantType.No,1,0,ck,stage1,32,moe_ck2stages_gemm1_256x32x64x128_1x4_TypeCast_v1_Nswizzle0_Quant0_MulRoutedWeight0_silu_B16_B16_B16,47.5894,0.0,0.00%,12.69,12696.99
14,16,4096,192,128,8,ActivationType.Silu,torch.bfloat16,torch.bfloat16,torch.bfloat16,QuantType.No,1,0,ck,stage2,32,moe_ck2stages_gemm2_256x32x64x64_1x4_TypeCast_v1_Nswizzle0_Quant0_MulRoutedWeight1_B16_B16_B16,29.9781,0.0,0.09%,20.15,20156.11
15,16,4096,192,128,8,ActivationType.Silu,torch.bfloat16,torch.bfloat16,torch.bfloat16,QuantType.No,1,1,ck,stage1,32,moe_ck2stages_gemm1_256x32x64x128_1x4_TypeCast_v1_Nswizzle0_Quant0_MulRoutedWeight1_silu_B16_B16_B16,47.806,0.0,0.00%,12.63,12639.46
15,16,4096,192,128,8,ActivationType.Silu,torch.bfloat16,torch.bfloat16,torch.bfloat16,QuantType.No,1,1,ck,stage2,32,moe_ck2stages_gemm2_256x32x64x64_1x4_TypeCast_v1_Nswizzle0_Quant0_MulRoutedWeight0_B16_B16_B16,29.268,0.0,0.00%,20.64,20645.14
16,16,4096,192,128,8,ActivationType.Gelu,torch.bfloat16,torch.bfloat16,torch.bfloat16,QuantType.No,1,0,ck,stage1,32,moe_ck2stages_gemm1_256x32x64x128_1x4_TypeCast_v1_Nswizzle0_Quant0_MulRoutedWeight0_gelu_B16_B16_B16,47.535,0.0,0.00%,12.71,12711.52
16,16,4096,192,128,8,ActivationType.Gelu,torch.bfloat16,torch.bfloat16,torch.bfloat16,QuantType.No,1,0,ck,stage2,32,moe_ck2stages_gemm2_256x32x64x64_1x4_TypeCast_v1_Nswizzle0_Quant0_MulRoutedWeight1_B16_B16_B16,29.4809,0.0,0.13%,20.49,20496.05
17,16,4096,192,128,8,ActivationType.Gelu,torch.bfloat16,torch.bfloat16,torch.bfloat16,QuantType.No,1,1,ck,stage1,32,moe_ck2stages_gemm1_256x32x64x128_1x4_TypeCast_v1_Nswizzle0_Quant0_MulRoutedWeight1_gelu_B16_B16_B16,47.9629,0.0,0.00%,12.59,12598.11
17,16,4096,192,128,8,ActivationType.Gelu,torch.bfloat16,torch.bfloat16,torch.bfloat16,QuantType.No,1,1,ck,stage2,32,moe_ck2stages_gemm2_256x32x64x64_1x4_TypeCast_v1_Nswizzle0_Quant0_MulRoutedWeight0_B16_B16_B16,29.0208,0.0,0.00%,20.81,20820.99
18,16,4096,384,128,8,ActivationType.Gelu,torch.bfloat16,torch.bfloat16,torch.bfloat16,QuantType.No,1,0,ck,stage1,32,moe_ck2stages_gemm1_256x32x64x128_1x4_TypeCast_v1_Nswizzle0_Quant0_MulRoutedWeight0_gelu_B16_B16_B16,89.6206,0.0,0.00%,13.48,13481.52
18,16,4096,384,128,8,ActivationType.Gelu,torch.bfloat16,torch.bfloat16,torch.bfloat16,QuantType.No,1,0,ck,stage2,32,moe_ck2stages_gemm2_256x32x64x64_1x4_TypeCast_v1_Nswizzle0_Quant0_MulRoutedWeight1_B16_B16_B16,50.8349,0.0,0.46%,23.76,23767.56
19,16,4096,384,128,8,ActivationType.Gelu,torch.bfloat16,torch.bfloat16,torch.bfloat16,QuantType.No,1,1,ck,stage1,32,moe_ck2stages_gemm1_256x32x64x128_1x4_TypeCast_v1_Nswizzle0_Quant0_MulRoutedWeight1_gelu_B16_B16_B16,89.6315,0.0,0.00%,13.48,13479.88
19,16,4096,384,128,8,ActivationType.Gelu,torch.bfloat16,torch.bfloat16,torch.bfloat16,QuantType.No,1,1,ck,stage2,32,moe_ck2stages_gemm2_256x32x128x128_1x4_TypeCast_v1_Nswizzle0_Quant0_MulRoutedWeight0_B16_B16_B16,51.0373,0.0,0.00%,23.67,23673.31
20,16,4096,384,128,8,ActivationType.Silu,torch.bfloat16,torch.bfloat16,torch.bfloat16,QuantType.No,1,0,ck,stage1,32,moe_ck2stages_gemm1_256x32x64x128_1x4_TypeCast_v1_Nswizzle0_Quant0_MulRoutedWeight0_silu_B16_B16_B16,89.6185,0.0,0.00%,13.48,13481.83
20,16,4096,384,128,8,ActivationType.Silu,torch.bfloat16,torch.bfloat16,torch.bfloat16,QuantType.No,1,0,ck,stage2,32,moe_ck2stages_gemm2_256x32x64x64_1x4_TypeCast_v1_Nswizzle0_Quant0_MulRoutedWeight1_B16_B16_B16,50.7533,0.0,0.34%,23.8,23805.78
21,16,4096,384,128,8,ActivationType.Silu,torch.bfloat16,torch.bfloat16,torch.bfloat16,QuantType.No,1,1,ck,stage1,32,moe_ck2stages_gemm1_256x32x64x128_1x4_TypeCast_v1_Nswizzle0_Quant0_MulRoutedWeight1_silu_B16_B16_B16,89.8476,0.0,0.00%,13.44,13447.46
21,16,4096,384,128,8,ActivationType.Silu,torch.bfloat16,torch.bfloat16,torch.bfloat16,QuantType.No,1,1,ck,stage2,32,moe_ck2stages_gemm2_256x32x128x128_1x4_TypeCast_v1_Nswizzle0_Quant0_MulRoutedWeight0_B16_B16_B16,50.9867,0.0,0.00%,23.69,23696.8
22,16,4096,384,128,8,ActivationType.Silu,torch.bfloat16,torch.float8_e4m3fn,torch.float8_e4m3fn,QuantType.per_Tensor,1,0,ck,stage1,32,moe_ck2stages_gemm1_256x32x64x256_1x4_TypeCast_v1_Nswizzle0_Quant1_MulRoutedWeight0_silu_F8_F8_B16,46.6282,27.99399999999996,0.00%,25.91,12957.32
22,16,4096,384,128,8,ActivationType.Silu,torch.bfloat16,torch.float8_e4m3fn,torch.float8_e4m3fn,QuantType.per_Tensor,1,0,asm,stage1,32,_ZN5aiter47fmoe_stage1_bf16_pertokenFp8_g1u1_32x64_4tg_pf3E,53.7488,27.99399999999996,4.44%,22.47,11240.74
22,16,4096,384,128,8,ActivationType.Silu,torch.bfloat16,torch.float8_e4m3fn,torch.float8_e4m3fn,QuantType.per_Tensor,1,0,ck,stage2,128,moe_ck2stages_gemm2_256x128x128x128_1x4_TypeCast_v3_Nswizzle0_Quant1_MulRoutedWeight1_F8_F8_B16,41.8395,27.99399999999996,0.37%,28.87,14440.33
23,16,4096,384,128,8,ActivationType.Silu,torch.bfloat16,torch.float8_e4m3fn,torch.float8_e4m3fn,QuantType.per_Tensor,1,1,ck,stage1,32,moe_ck2stages_gemm1_256x32x64x256_1x4_TypeCast_v1_Nswizzle0_Quant1_MulRoutedWeight1_silu_F8_F8_B16,47.1902,28.21633333333334,0.00%,25.6,12803.01
23,16,4096,384,128,8,ActivationType.Silu,torch.bfloat16,torch.float8_e4m3fn,torch.float8_e4m3fn,QuantType.per_Tensor,1,1,asm,stage1,16,_ZN5aiter56fmoe_stage1_bf16_pertokenFp8_doweight_g1u1_16x64_5tg_pf3E,53.6493,28.21633333333334,1.18%,22.52,11261.59
23,16,4096,384,128,8,ActivationType.Silu,torch.bfloat16,torch.float8_e4m3fn,torch.float8_e4m3fn,QuantType.per_Tensor,1,1,ck,stage2,128,moe_ck2stages_gemm2_256x128x128x128_1x4_TypeCast_v3_Nswizzle0_Quant1_MulRoutedWeight0_F8_F8_B16,40.1416,28.21633333333334,0.00%,30.09,15051.13
24,16,4096,384,128,8,ActivationType.Silu,torch.bfloat16,torch.float8_e4m3fn,torch.float8_e4m3fn,QuantType.per_Token,1,0,asm,stage1,16,_ZN5aiter47fmoe_stage1_bf16_pertokenFp8_g1u1_16x64_5tg_pf3E,44.813,26.005444444444407,8.31%,26.96,13482.17
24,16,4096,384,128,8,ActivationType.Silu,torch.bfloat16,torch.float8_e4m3fn,torch.float8_e4m3fn,QuantType.per_Token,1,0,ck,stage1,32,moe_ck2stages_gemm1_256x32x64x256_1x4_TypeCast_v1_Nswizzle0_Quant2_MulRoutedWeight0_silu_F8_F8_B16,47.565,26.005444444444407,0.00%,25.4,12702.12
24,16,4096,384,128,8,ActivationType.Silu,torch.bfloat16,torch.float8_e4m3fn,torch.float8_e4m3fn,QuantType.per_Token,1,0,ck,stage2,128,moe_ck2stages_gemm2_256x128x128x128_1x4_TypeCast_v3_Nswizzle0_Quant2_MulRoutedWeight1_F8_F8_B16,66.427,26.005444444444407,0.33%,18.18,9095.34
24,16,4096,384,128,8,ActivationType.Silu,torch.bfloat16,torch.float8_e4m3fn,torch.float8_e4m3fn,QuantType.per_Token,1,0,asm,asm_1stage,32,_ZN5aiter45fmoe_bf16_pertokenFp8_g1u1_vs_silu_1tg_32x192E,75.7441,0.0,0.00%,15.95,7976.55
25,16,4096,384,128,8,ActivationType.Silu,torch.bfloat16,torch.float8_e4m3fn,torch.float8_e4m3fn,QuantType.per_Token,1,1,asm,stage1,16,_ZN5aiter56fmoe_stage1_bf16_pertokenFp8_doweight_g1u1_16x64_5tg_pf3E,45.0516,25.49433333333332,0.85%,26.81,13410.76
25,16,4096,384,128,8,ActivationType.Silu,torch.bfloat16,torch.float8_e4m3fn,torch.float8_e4m3fn,QuantType.per_Token,1,1,ck,stage1,32,moe_ck2stages_gemm1_256x32x64x256_1x4_TypeCast_v1_Nswizzle0_Quant2_MulRoutedWeight1_silu_F8_F8_B16,47.7589,25.49433333333332,0.00%,25.29,12650.55
25,16,4096,384,128,8,ActivationType.Silu,torch.bfloat16,torch.float8_e4m3fn,torch.float8_e4m3fn,QuantType.per_Token,1,1,ck,stage2,128,moe_ck2stages_gemm2_256x128x128x128_1x4_TypeCast_v3_Nswizzle0_Quant2_MulRoutedWeight0_F8_F8_B16,63.4166,25.49433333333332,0.00%,19.05,9527.1
25,16,4096,384,128,8,ActivationType.Silu,torch.bfloat16,torch.float8_e4m3fn,torch.float8_e4m3fn,QuantType.per_Token,1,1,asm,asm_1stage,32,_ZN5aiter50fmoe_bf16_pertokenFp8_g1u1_vs_tkw1_silu_1tg_32x128E,77.86,0.0,0.00%,15.51,7759.78
26,16,4096,384,128,8,ActivationType.Gelu,torch.bfloat16,torch.float8_e4m3fn,torch.float8_e4m3fn,QuantType.per_Tensor,1,0,ck,stage1,32,moe_ck2stages_gemm1_256x32x64x256_1x4_TypeCast_v1_Nswizzle0_Quant1_MulRoutedWeight0_gelu_F8_F8_B16,46.9142,28.31877777777781,0.00%,25.75,12878.33
26,16,4096,384,128,8,ActivationType.Gelu,torch.bfloat16,torch.float8_e4m3fn,torch.float8_e4m3fn,QuantType.per_Tensor,1,0,asm,stage1,16,_ZN5aiter47fmoe_stage1_bf16_pertokenFp8_g1u1_16x64_5tg_pf3E,53.5173,28.31877777777781,6.06%,22.57,11289.37
26,16,4096,384,128,8,ActivationType.Gelu,torch.bfloat16,torch.float8_e4m3fn,torch.float8_e4m3fn,QuantType.per_Tensor,1,0,ck,stage2,128,moe_ck2stages_gemm2_256x128x128x128_1x4_TypeCast_v3_Nswizzle0_Quant1_MulRoutedWeight1_F8_F8_B16,41.8954,28.31877777777781,0.49%,28.83,14421.07
27,16,4096,384,128,8,ActivationType.Gelu,torch.bfloat16,torch.float8_e4m3fn,torch.float8_e4m3fn,QuantType.per_Tensor,1,1,ck,stage1,32,moe_ck2stages_gemm1_256x32x64x256_1x4_TypeCast_v1_Nswizzle0_Quant1_MulRoutedWeight1_gelu_F8_F8_B16,47.0554,27.94988888888892,0.00%,25.67,12839.68
27,16,4096,384,128,8,ActivationType.Gelu,torch.bfloat16,torch.float8_e4m3fn,torch.float8_e4m3fn,QuantType.per_Tensor,1,1,asm,stage1,32,_ZN5aiter56fmoe_stage1_bf16_pertokenFp8_doweight_g1u1_32x64_4tg_pf3E,53.4786,27.94988888888892,0.51%,22.59,11297.54
27,16,4096,384,128,8,ActivationType.Gelu,torch.bfloat16,torch.float8_e4m3fn,torch.float8_e4m3fn,QuantType.per_Tensor,1,1,ck,stage2,128,moe_ck2stages_gemm2_256x128x128x128_1x4_TypeCast_v3_Nswizzle0_Quant1_MulRoutedWeight0_F8_F8_B16,39.7618,27.94988888888892,0.00%,30.38,15194.9
28,16,4096,384,128,8,ActivationType.Gelu,torch.bfloat16,torch.float8_e4m3fn,torch.float8_e4m3fn,QuantType.per_Token,1,0,asm,stage1,16,_ZN5aiter47fmoe_stage1_bf16_pertokenFp8_g1u1_16x64_5tg_pf3E,44.7696,24.84544444444447,7.00%,26.98,13495.24
28,16,4096,384,128,8,ActivationType.Gelu,torch.bfloat16,torch.float8_e4m3fn,torch.float8_e4m3fn,QuantType.per_Token,1,0,ck,stage1,32,moe_ck2stages_gemm1_256x32x64x256_1x4_TypeCast_v1_Nswizzle0_Quant2_MulRoutedWeight0_gelu_F8_F8_B16,47.9831,24.84544444444447,0.00%,25.17,12591.44
28,16,4096,384,128,8,ActivationType.Gelu,torch.bfloat16,torch.float8_e4m3fn,torch.float8_e4m3fn,QuantType.per_Token,1,0,ck,stage2,128,moe_ck2stages_gemm2_256x128x128x128_1x4_TypeCast_v3_Nswizzle0_Quant2_MulRoutedWeight1_F8_F8_B16,66.4984,24.84544444444447,0.49%,18.17,9085.58
28,16,4096,384,128,8,ActivationType.Gelu,torch.bfloat16,torch.float8_e4m3fn,torch.float8_e4m3fn,QuantType.per_Token,1,0,asm,asm_1stage,32,_ZN5aiter45fmoe_bf16_pertokenFp8_g1u1_vs_gelu_1tg_32x192E,75.2584,0.0,0.00%,16.05,8028.03
29,16,4096,384,128,8,ActivationType.Gelu,torch.bfloat16,torch.float8_e4m3fn,torch.float8_e4m3fn,QuantType.per_Token,1,1,asm,stage1,16,_ZN5aiter56fmoe_stage1_bf16_pertokenFp8_doweight_g1u1_16x64_5tg_pf3E,44.8865,24.387777777777817,1.35%,26.91,13460.09
29,16,4096,384,128,8,ActivationType.Gelu,torch.bfloat16,torch.float8_e4m3fn,torch.float8_e4m3fn,QuantType.per_Token,1,1,ck,stage1,32,moe_ck2stages_gemm1_256x32x64x256_1x4_TypeCast_v1_Nswizzle0_Quant2_MulRoutedWeight1_gelu_F8_F8_B16,47.6899,24.387777777777817,0.00%,25.33,12668.85
29,16,4096,384,128,8,ActivationType.Gelu,torch.bfloat16,torch.float8_e4m3fn,torch.float8_e4m3fn,QuantType.per_Token,1,1,ck,stage2,128,moe_ck2stages_gemm2_256x128x128x128_1x4_TypeCast_v3_Nswizzle0_Quant2_MulRoutedWeight0_F8_F8_B16,63.9148,24.387777777777817,0.00%,18.9,9452.84
29,16,4096,384,128,8,ActivationType.Gelu,torch.bfloat16,torch.float8_e4m3fn,torch.float8_e4m3fn,QuantType.per_Token,1,1,asm,asm_1stage,32,_ZN5aiter50fmoe_bf16_pertokenFp8_g1u1_vs_tkw1_gelu_1tg_32x128E,78.2349,0.0,0.00%,15.44,7722.59
30,16,4096,384,128,8,ActivationType.Silu,torch.bfloat16,torch.float8_e4m3fn,torch.float8_e4m3fn,QuantType.per_1x128,1,0,ck,stage1,16,moe_ck2stages_gemm1_256x16x128x256_1x4_MulABScaleExpertWeightA8W8blkscale_v1_Nswizzle0_Quant4_MulRoutedWeight0_silu_F8_F8_B16,52.3195,24.801111111111087,0.10%,23.09,11547.82
30,16,4096,384,128,8,ActivationType.Silu,torch.bfloat16,torch.float8_e4m3fn,torch.float8_e4m3fn,QuantType.per_1x128,1,0,ck,stage2,16,moe_ck2stages_gemm2_128x16x128x128_1x2_MulABScaleExpertWeightA8W8blkscale_v1_Nswizzle0_Quant4_MulRoutedWeight1_F8_F8_B16,30.0997,24.801111111111087,15.58%,40.13,20072.51
30,16,4096,384,128,8,ActivationType.Silu,torch.bfloat16,torch.float8_e4m3fn,torch.float8_e4m3fn,QuantType.per_1x128,1,0,asm,asm_1stage,32,_ZN5aiter43fmoe_bf16_blockscaleFp8_g1u1_vs_silu_32x384E,104.9881,0.0,0.00%,11.51,5754.71
31,16,4096,384,128,8,ActivationType.Gelu,torch.bfloat16,torch.float8_e4m3fn,torch.float8_e4m3fn,QuantType.per_1x128,1,0,ck,stage1,16,moe_ck2stages_gemm1_256x16x128x256_1x4_MulABScaleExpertWeightA8W8blkscale_v1_Nswizzle0_Quant4_MulRoutedWeight0_gelu_F8_F8_B16,52.1607,26.97444444444447,0.08%,23.16,11582.98
31,16,4096,384,128,8,ActivationType.Gelu,torch.bfloat16,torch.float8_e4m3fn,torch.float8_e4m3fn,QuantType.per_1x128,1,0,ck,stage2,16,moe_ck2stages_gemm2_128x16x128x128_1x2_MulABScaleExpertWeightA8W8blkscale_v1_Nswizzle0_Quant4_MulRoutedWeight1_F8_F8_B16,30.0368,26.97444444444447,15.66%,40.22,20114.54
32,16,4096,384,128,8,ActivationType.Silu,torch.bfloat16,torch.float8_e4m3fn,torch.float8_e4m3fn,QuantType.per_1x128,1,1,ck,stage1,16,moe_ck2stages_gemm1_256x16x128x256_1x4_MulABScaleExpertWeightA8W8blkscale_v1_Nswizzle0_Quant4_MulRoutedWeight1_silu_F8_F8_B16,51.9588,27.73422222222218,0.10%,23.25,11627.99
32,16,4096,384,128,8,ActivationType.Silu,torch.bfloat16,torch.float8_e4m3fn,torch.float8_e4m3fn,QuantType.per_1x128,1,1,ck,stage2,16,moe_ck2stages_gemm2_128x16x128x128_1x2_MulABScaleExpertWeightA8W8blkscale_v1_Nswizzle0_Quant4_MulRoutedWeight0_F8_F8_B16,29.853,27.73422222222218,16.67%,40.46,20238.38
33,16,4096,384,128,8,ActivationType.Gelu,torch.bfloat16,torch.float8_e4m3fn,torch.float8_e4m3fn,QuantType.per_1x128,1,1,ck,stage1,16,moe_ck2stages_gemm1_256x16x128x256_1x4_MulABScaleExpertWeightA8W8blkscale_v1_Nswizzle0_Quant4_MulRoutedWeight1_gelu_F8_F8_B16,52.3007,27.31199999999997,0.11%,23.1,11551.98
33,16,4096,384,128,8,ActivationType.Gelu,torch.bfloat16,torch.float8_e4m3fn,torch.float8_e4m3fn,QuantType.per_1x128,1,1,ck,stage2,32,moe_ck2stages_gemm2_256x32x128x128_1x4_MulABScaleExpertWeightA8W8blkscale_v1_Nswizzle0_Quant4_MulRoutedWeight0_F8_F8_B16,30.4835,27.31199999999997,16.75%,39.63,19819.78
34,16,5120,1024,128,1,ActivationType.Silu,torch.bfloat16,torch.float8_e4m3fn,torch.float8_e4m3fn,QuantType.per_Token,1,1,asm,stage1,16,_ZN5aiter56fmoe_stage1_bf16_pertokenFp8_doweight_g1u1_16x64_5tg_pf3E,32.4787,28.26344444444443,0.00%,15.5,61994.84
34,16,5120,1024,128,1,ActivationType.Silu,torch.bfloat16,torch.float8_e4m3fn,torch.float8_e4m3fn,QuantType.per_Token,1,1,ck,stage1,32,moe_ck2stages_gemm1_256x32x64x256_1x4_TypeCast_v1_Nswizzle0_Quant2_MulRoutedWeight1_silu_F8_F8_B16,33.6769,28.26344444444443,0.00%,14.95,59789.1
34,16,5120,1024,128,1,ActivationType.Silu,torch.bfloat16,torch.float8_e4m3fn,torch.float8_e4m3fn,QuantType.per_Token,1,1,ck,stage2,32,moe_ck2stages_gemm2_256x32x128x256_1x4_TypeCast_v1_Nswizzle0_Quant2_MulRoutedWeight0_F8_F8_B16,23.2069,28.26344444444443,0.00%,21.69,86763.49
34,16,5120,1024,128,1,ActivationType.Silu,torch.bfloat16,torch.float8_e4m3fn,torch.float8_e4m3fn,QuantType.per_Token,1,1,asm,asm_1stage,32,_ZN5aiter46fmoe_bf16_pertokenFp8_g1u1_tkw1_silu_1tg_32x64E,65.9555,0.0,0.08%,7.63,30528.34
35,16,7168,256,256,8,ActivationType.Gelu,torch.bfloat16,torch.bfloat16,torch.bfloat16,QuantType.No,1,0,ck,stage1,32,moe_ck2stages_gemm1_256x32x64x128_1x4_TypeCast_v1_Nswizzle0_Quant0_MulRoutedWeight0_gelu_B16_B16_B16,132.1768,0.0,0.00%,10.66,21327.73
35,16,7168,256,256,8,ActivationType.Gelu,torch.bfloat16,torch.bfloat16,torch.bfloat16,QuantType.No,1,0,ck,stage2,32,moe_ck2stages_gemm2_256x32x128x128_1x4_TypeCast_v1_Nswizzle0_Quant0_MulRoutedWeight1_B16_B16_B16,70.3088,0.0,1.71%,20.04,40095.0
36,16,7168,256,256,8,ActivationType.Gelu,torch.bfloat16,torch.bfloat16,torch.bfloat16,QuantType.No,1,1,ck,stage1,32,moe_ck2stages_gemm1_256x32x64x128_1x4_TypeCast_v1_Nswizzle0_Quant0_MulRoutedWeight1_gelu_B16_B16_B16,132.0814,0.0,0.00%,10.67,21343.13
36,16,7168,256,256,8,ActivationType.Gelu,torch.bfloat16,torch.bfloat16,torch.bfloat16,QuantType.No,1,1,ck,stage2,32,moe_ck2stages_gemm2_256x32x128x128_1x4_TypeCast_v1_Nswizzle0_Quant0_MulRoutedWeight0_B16_B16_B16,70.8585,0.0,0.00%,19.89,39783.95
37,16,7168,256,256,8,ActivationType.Gelu,torch.bfloat16,torch.float8_e4m3fn,torch.float8_e4m3fn,QuantType.per_Tensor,1,0,ck,stage1,32,moe_ck2stages_gemm1_256x32x64x256_1x4_TypeCast_v1_Nswizzle0_Quant1_MulRoutedWeight0_gelu_F8_F8_B16,68.8557,27.376666666666683,0.00%,20.47,20472.24
37,16,7168,256,256,8,ActivationType.Gelu,torch.bfloat16,torch.float8_e4m3fn,torch.float8_e4m3fn,QuantType.per_Tensor,1,0,asm,stage1,32,_ZN5aiter48fmoe_stage1_bf16_pertokenFp8_g1u1_32x128_3tg_pf3E,76.8342,27.376666666666683,0.00%,18.34,18346.39
37,16,7168,256,256,8,ActivationType.Gelu,torch.bfloat16,torch.float8_e4m3fn,torch.float8_e4m3fn,QuantType.per_Tensor,1,0,ck,stage2,32,moe_ck2stages_gemm2_256x32x128x256_1x4_TypeCast_v1_Nswizzle0_Quant1_MulRoutedWeight1_F8_F8_B16,40.1745,27.376666666666683,1.65%,35.08,35087.69
38,16,7168,256,256,8,ActivationType.Gelu,torch.bfloat16,torch.float8_e4m3fn,torch.float8_e4m3fn,QuantType.per_Tensor,1,1,ck,stage1,32,moe_ck2stages_gemm1_256x32x64x256_1x4_TypeCast_v1_Nswizzle0_Quant1_MulRoutedWeight1_gelu_F8_F8_B16,68.5573,26.9631111111111,0.00%,20.56,20561.34
38,16,7168,256,256,8,ActivationType.Gelu,torch.bfloat16,torch.float8_e4m3fn,torch.float8_e4m3fn,QuantType.per_Tensor,1,1,asm,stage1,16,_ZN5aiter57fmoe_stage1_bf16_pertokenFp8_doweight_g1u1_16x128_4tg_pf3E,77.1211,26.9631111111111,0.00%,18.27,18278.14
38,16,7168,256,256,8,ActivationType.Gelu,torch.bfloat16,torch.float8_e4m3fn,torch.float8_e4m3fn,QuantType.per_Tensor,1,1,ck,stage2,32,moe_ck2stages_gemm2_256x32x128x256_1x4_TypeCast_v1_Nswizzle0_Quant1_MulRoutedWeight0_F8_F8_B16,40.6551,26.9631111111111,0.00%,34.66,34672.9
39,16,7168,256,256,8,ActivationType.Gelu,torch.bfloat16,torch.float8_e4m3fn,torch.float8_e4m3fn,QuantType.per_Token,1,0,asm,stage1,16,_ZN5aiter48fmoe_stage1_bf16_pertokenFp8_g1u1_16x128_4tg_pf3E,68.0233,24.99211111111116,0.00%,20.72,20722.76
39,16,7168,256,256,8,ActivationType.Gelu,torch.bfloat16,torch.float8_e4m3fn,torch.float8_e4m3fn,QuantType.per_Token,1,0,ck,stage1,32,moe_ck2stages_gemm1_256x32x64x256_1x4_TypeCast_v1_Nswizzle0_Quant2_MulRoutedWeight0_gelu_F8_F8_B16,68.7969,24.99211111111116,0.00%,20.48,20489.73
39,16,7168,256,256,8,ActivationType.Gelu,torch.bfloat16,torch.float8_e4m3fn,torch.float8_e4m3fn,QuantType.per_Token,1,0,ck,stage2,32,moe_ck2stages_gemm2_256x32x128x256_1x4_TypeCast_v1_Nswizzle0_Quant2_MulRoutedWeight1_F8_F8_B16,46.3947,24.99211111111116,1.69%,30.38,30383.43
39,16,7168,256,256,8,ActivationType.Gelu,torch.bfloat16,torch.float8_e4m3fn,torch.float8_e4m3fn,QuantType.per_Token,1,0,asm,asm_1stage,32,_ZN5aiter48fmoe_bf16_pertokenFp8_g1u1_vs_gelu_1tg_ps_32x128E,118.5159,0.0,0.00%,11.89,11894.02
40,16,7168,256,256,8,ActivationType.Gelu,torch.bfloat16,torch.float8_e4m3fn,torch.float8_e4m3fn,QuantType.per_Token,1,1,asm,stage1,32,_ZN5aiter57fmoe_stage1_bf16_pertokenFp8_doweight_g1u1_32x128_3tg_pf3E,67.9659,24.84099999999997,0.00%,20.74,20740.26
40,16,7168,256,256,8,ActivationType.Gelu,torch.bfloat16,torch.float8_e4m3fn,torch.float8_e4m3fn,QuantType.per_Token,1,1,ck,stage1,32,moe_ck2stages_gemm1_256x32x64x256_1x4_TypeCast_v1_Nswizzle0_Quant2_MulRoutedWeight1_gelu_F8_F8_B16,69.2373,24.84099999999997,0.00%,20.35,20359.4
40,16,7168,256,256,8,ActivationType.Gelu,torch.bfloat16,torch.float8_e4m3fn,torch.float8_e4m3fn,QuantType.per_Token,1,1,ck,stage2,32,moe_ck2stages_gemm2_256x32x128x256_1x4_TypeCast_v1_Nswizzle0_Quant2_MulRoutedWeight0_F8_F8_B16,44.2558,24.84099999999997,0.00%,31.84,31851.87
40,16,7168,256,256,8,ActivationType.Gelu,torch.bfloat16,torch.float8_e4m3fn,torch.float8_e4m3fn,QuantType.per_Token,1,1,asm,asm_1stage,32,_ZN5aiter50fmoe_bf16_pertokenFp8_g1u1_vs_tkw1_gelu_1tg_32x128E,116.4073,0.0,0.00%,12.11,12109.47
41,16,7168,256,256,8,ActivationType.Silu,torch.bfloat16,torch.bfloat16,torch.bfloat16,QuantType.No,1,0,ck,stage1,32,moe_ck2stages_gemm1_256x32x64x128_1x4_TypeCast_v1_Nswizzle0_Quant0_MulRoutedWeight0_silu_B16_B16_B16,131.2243,0.0,0.00%,10.74,21482.54
41,16,7168,256,256,8,ActivationType.Silu,torch.bfloat16,torch.bfloat16,torch.bfloat16,QuantType.No,1,0,ck,stage2,32,moe_ck2stages_gemm2_256x32x128x128_1x4_TypeCast_v1_Nswizzle0_Quant0_MulRoutedWeight1_B16_B16_B16,70.077,0.0,1.41%,20.11,40227.62
42,16,7168,256,256,8,ActivationType.Silu,torch.bfloat16,torch.bfloat16,torch.bfloat16,QuantType.No,1,1,ck,stage1,32,moe_ck2stages_gemm1_256x32x64x128_1x4_TypeCast_v1_Nswizzle0_Quant0_MulRoutedWeight1_silu_B16_B16_B16,131.558,0.0,0.00%,10.71,21428.05
42,16,7168,256,256,8,ActivationType.Silu,torch.bfloat16,torch.bfloat16,torch.bfloat16,QuantType.No,1,1,ck,stage2,64,moe_ck2stages_gemm2_256x64x128x128_1x4_TypeCast_v1_Nswizzle0_Quant0_MulRoutedWeight0_B16_B16_B16,69.7238,0.0,0.00%,20.21,40431.4
43,16,7168,256,256,8,ActivationType.Silu,torch.bfloat16,torch.float8_e4m3fn,torch.float8_e4m3fn,QuantType.per_Tensor,1,0,ck,stage1,32,moe_ck2stages_gemm1_256x32x64x256_1x4_TypeCast_v1_Nswizzle0_Quant1_MulRoutedWeight0_silu_F8_F8_B16,68.3503,26.34088888888893,0.00%,20.62,20623.61
43,16,7168,256,256,8,ActivationType.Silu,torch.bfloat16,torch.float8_e4m3fn,torch.float8_e4m3fn,QuantType.per_Tensor,1,0,asm,stage1,16,_ZN5aiter48fmoe_stage1_bf16_pertokenFp8_g1u1_16x128_4tg_pf3E,76.5934,26.34088888888893,0.00%,18.4,18404.07
43,16,7168,256,256,8,ActivationType.Silu,torch.bfloat16,torch.float8_e4m3fn,torch.float8_e4m3fn,QuantType.per_Tensor,1,0,ck,stage2,32,moe_ck2stages_gemm2_256x32x128x256_1x4_TypeCast_v1_Nswizzle0_Quant1_MulRoutedWeight1_F8_F8_B16,40.4672,26.34088888888893,1.41%,34.83,34833.9
44,16,7168,256,256,8,ActivationType.Silu,torch.bfloat16,torch.float8_e4m3fn,torch.float8_e4m3fn,QuantType.per_Tensor,1,1,ck,stage1,32,moe_ck2stages_gemm1_256x32x64x256_1x4_TypeCast_v1_Nswizzle0_Quant1_MulRoutedWeight1_silu_F8_F8_B16,68.5544,26.19422222222225,0.00%,20.56,20562.21
44,16,7168,256,256,8,ActivationType.Silu,torch.bfloat16,torch.float8_e4m3fn,torch.float8_e4m3fn,QuantType.per_Tensor,1,1,asm,stage1,16,_ZN5aiter57fmoe_stage1_bf16_pertokenFp8_doweight_g1u1_16x128_4tg_pf3E,76.6927,26.19422222222225,0.00%,18.38,18380.24
44,16,7168,256,256,8,ActivationType.Silu,torch.bfloat16,torch.float8_e4m3fn,torch.float8_e4m3fn,QuantType.per_Tensor,1,1,ck,stage2,32,moe_ck2stages_gemm2_256x32x128x256_1x4_TypeCast_v1_Nswizzle0_Quant1_MulRoutedWeight0_F8_F8_B16,40.5587,26.19422222222225,0.00%,34.75,34755.31
45,16,7168,256,256,8,ActivationType.Silu,torch.bfloat16,torch.float8_e4m3fn,torch.float8_e4m3fn,QuantType.per_Token,1,0,asm,stage1,16,_ZN5aiter48fmoe_stage1_bf16_pertokenFp8_g1u1_16x128_4tg_pf3E,67.8298,26.169888888888995,0.00%,20.78,20781.87
45,16,7168,256,256,8,ActivationType.Silu,torch.bfloat16,torch.float8_e4m3fn,torch.float8_e4m3fn,QuantType.per_Token,1,0,ck,stage1,32,moe_ck2stages_gemm1_256x32x64x256_1x4_TypeCast_v1_Nswizzle0_Quant2_MulRoutedWeight0_silu_F8_F8_B16,69.3898,26.169888888888995,0.00%,20.31,20314.66
45,16,7168,256,256,8,ActivationType.Silu,torch.bfloat16,torch.float8_e4m3fn,torch.float8_e4m3fn,QuantType.per_Token,1,0,ck,stage2,32,moe_ck2stages_gemm2_256x32x128x256_1x4_TypeCast_v1_Nswizzle0_Quant2_MulRoutedWeight1_F8_F8_B16,45.4258,26.169888888888995,1.39%,31.02,31031.49
45,16,7168,256,256,8,ActivationType.Silu,torch.bfloat16,torch.float8_e4m3fn,torch.float8_e4m3fn,QuantType.per_Token,1,0,asm,asm_1stage,32,_ZN5aiter48fmoe_bf16_pertokenFp8_g1u1_vs_silu_1tg_ps_32x128E,117.6723,0.0,0.00%,11.98,11979.29
46,16,7168,256,256,8,ActivationType.Silu,torch.bfloat16,torch.float8_e4m3fn,torch.float8_e4m3fn,QuantType.per_Token,1,1,asm,stage1,32,_ZN5aiter57fmoe_stage1_bf16_pertokenFp8_doweight_g1u1_32x128_3tg_pf3E,67.82,25.592333333333315,0.00%,20.78,20784.87
46,16,7168,256,256,8,ActivationType.Silu,torch.bfloat16,torch.float8_e4m3fn,torch.float8_e4m3fn,QuantType.per_Token,1,1,ck,stage1,32,moe_ck2stages_gemm1_256x32x64x256_1x4_TypeCast_v1_Nswizzle0_Quant2_MulRoutedWeight1_silu_F8_F8_B16,69.0831,25.592333333333315,0.00%,20.4,20404.85
46,16,7168,256,256,8,ActivationType.Silu,torch.bfloat16,torch.float8_e4m3fn,torch.float8_e4m3fn,QuantType.per_Token,1,1,ck,stage2,32,moe_ck2stages_gemm2_256x32x128x256_1x4_TypeCast_v1_Nswizzle0_Quant2_MulRoutedWeight0_F8_F8_B16,43.3815,25.592333333333315,0.00%,32.49,32493.81
46,16,7168,256,256,8,ActivationType.Silu,torch.bfloat16,torch.float8_e4m3fn,torch.float8_e4m3fn,QuantType.per_Token,1,1,asm,asm_1stage,32,_ZN5aiter50fmoe_bf16_pertokenFp8_g1u1_vs_tkw1_silu_1tg_32x128E,116.2714,0.0,0.00%,12.12,12123.62
47,16,7168,256,256,8,ActivationType.Gelu,torch.bfloat16,torch.float8_e4m3fn,torch.float8_e4m3fn,QuantType.per_1x128,1,0,ck,stage1,16,moe_ck2stages_gemm1_256x16x128x256_1x4_MulABScaleExpertWeightA8W8blkscale_v1_Nswizzle0_Quant4_MulRoutedWeight0_gelu_F8_F8_B16,72.7013,26.845333333333244,0.09%,19.38,19389.34
47,16,7168,256,256,8,ActivationType.Gelu,torch.bfloat16,torch.float8_e4m3fn,torch.float8_e4m3fn,QuantType.per_1x128,1,0,ck,stage2,16,moe_ck2stages_gemm2_256x16x128x256_1x4_MulABScaleExpertWeightA8W8blkscale_v1_Nswizzle0_Quant4_MulRoutedWeight1_F8_F8_B16,40.9393,26.845333333333244,15.77%,34.42,34432.2
47,16,7168,256,256,8,ActivationType.Gelu,torch.bfloat16,torch.float8_e4m3fn,torch.float8_e4m3fn,QuantType.per_1x128,1,0,asm,asm_1stage,32,_ZN5aiter47fmoe_bf16_blockscaleFp8_g1u1_vs_gelu_1tg_32x256E,132.6945,0.0,2.17%,10.62,10623.12
48,16,7168,256,256,8,ActivationType.Gelu,torch.bfloat16,torch.float8_e4m3fn,torch.float8_e4m3fn,QuantType.per_1x128,1,1,ck,stage1,16,moe_ck2stages_gemm1_256x16x128x256_1x4_MulABScaleExpertWeightA8W8blkscale_v1_Nswizzle0_Quant4_MulRoutedWeight1_gelu_F8_F8_B16,72.4944,26.53877777777781,0.13%,19.44,19444.68
48,16,7168,256,256,8,ActivationType.Gelu,torch.bfloat16,torch.float8_e4m3fn,torch.float8_e4m3fn,QuantType.per_1x128,1,1,ck,stage2,16,moe_ck2stages_gemm2_256x16x128x256_1x4_MulABScaleExpertWeightA8W8blkscale_v1_Nswizzle0_Quant4_MulRoutedWeight0_F8_F8_B16,40.7009,26.53877777777781,16.77%,34.63,34633.88
49,16,7168,256,256,8,ActivationType.Silu,torch.bfloat16,torch.float8_e4m3fn,torch.float8_e4m3fn,QuantType.per_1x128,1,0,ck,stage1,16,moe_ck2stages_gemm1_256x16x128x256_1x4_MulABScaleExpertWeightA8W8blkscale_v1_Nswizzle0_Quant4_MulRoutedWeight0_silu_F8_F8_B16,72.6401,26.947888888888908,0.09%,19.4,19405.68
49,16,7168,256,256,8,ActivationType.Silu,torch.bfloat16,torch.float8_e4m3fn,torch.float8_e4m3fn,QuantType.per_1x128,1,0,ck,stage2,16,moe_ck2stages_gemm2_256x16x128x256_1x4_MulABScaleExpertWeightA8W8blkscale_v1_Nswizzle0_Quant4_MulRoutedWeight1_F8_F8_B16,40.3236,26.947888888888908,15.66%,34.95,34957.95
49,16,7168,256,256,8,ActivationType.Silu,torch.bfloat16,torch.float8_e4m3fn,torch.float8_e4m3fn,QuantType.per_1x128,1,0,asm,asm_1stage,32,_ZN5aiter47fmoe_bf16_blockscaleFp8_g1u1_vs_silu_1tg_32x256E,132.7878,0.0,0.00%,10.61,10615.66
50,16,7168,256,256,8,ActivationType.Silu,torch.bfloat16,torch.float8_e4m3fn,torch.float8_e4m3fn,QuantType.per_1x128,1,1,ck,stage1,16,moe_ck2stages_gemm1_256x16x128x256_1x4_MulABScaleExpertWeightA8W8blkscale_v1_Nswizzle0_Quant4_MulRoutedWeight1_silu_F8_F8_B16,72.5141,27.52099999999996,0.11%,19.43,19439.39
50,16,7168,256,256,8,ActivationType.Silu,torch.bfloat16,torch.float8_e4m3fn,torch.float8_e4m3fn,QuantType.per_1x128,1,1,ck,stage2,16,moe_ck2stages_gemm2_256x16x128x256_1x4_MulABScaleExpertWeightA8W8blkscale_v1_Nswizzle0_Quant4_MulRoutedWeight0_F8_F8_B16,40.3211,27.52099999999996,16.60%,34.95,34960.11
51,16,7168,256,257,9,ActivationType.Silu,torch.bfloat16,torch.float8_e4m3fn,torch.float8_e4m3fn,QuantType.per_Token,1,0,asm,stage1,16,_ZN5aiter48fmoe_stage1_bf16_pertokenFp8_g1u1_16x128_4tg_pf3E,70.9699,25.9967777777778,0.00%,22.34,19939.94
51,16,7168,256,257,9,ActivationType.Silu,torch.bfloat16,torch.float8_e4m3fn,torch.float8_e4m3fn,QuantType.per_Token,1,0,ck,stage1,32,moe_ck2stages_gemm1_256x32x64x256_1x4_TypeCast_v1_Nswizzle0_Quant2_MulRoutedWeight0_silu_F8_F8_B16,72.423,25.9967777777778,0.00%,21.89,19539.86
51,16,7168,256,257,9,ActivationType.Silu,torch.bfloat16,torch.float8_e4m3fn,torch.float8_e4m3fn,QuantType.per_Token,1,0,ck,stage2,32,moe_ck2stages_gemm2_256x32x128x256_1x4_TypeCast_v1_Nswizzle0_Quant2_MulRoutedWeight1_F8_F8_B16,47.7944,25.9967777777778,1.36%,33.17,29608.81
51,16,7168,256,257,9,ActivationType.Silu,torch.bfloat16,torch.float8_e4m3fn,torch.float8_e4m3fn,QuantType.per_Token,1,0,asm,asm_1stage,32,_ZN5aiter48fmoe_bf16_pertokenFp8_g1u1_vs_silu_1tg_ps_32x128E,124.6856,0.0,0.00%,12.72,11349.63
52,16,7168,256,257,9,ActivationType.Silu,torch.bfloat16,torch.float8_e4m3fn,torch.float8_e4m3fn,QuantType.per_1x128,1,0,ck,stage1,16,moe_ck2stages_gemm1_256x16x128x256_1x4_MulABScaleExpertWeightA8W8blkscale_v1_Nswizzle0_Quant4_MulRoutedWeight0_silu_F8_F8_B16,75.5042,26.876777777777747,0.09%,21.0,18742.47
52,16,7168,256,257,9,ActivationType.Silu,torch.bfloat16,torch.float8_e4m3fn,torch.float8_e4m3fn,QuantType.per_1x128,1,0,ck,stage2,16,moe_ck2stages_gemm2_256x16x128x256_1x4_MulABScaleExpertWeightA8W8blkscale_v1_Nswizzle0_Quant4_MulRoutedWeight1_F8_F8_B16,42.056,26.876777777777747,16.86%,37.7,33648.83
52,16,7168,256,257,9,ActivationType.Silu,torch.bfloat16,torch.float8_e4m3fn,torch.float8_e4m3fn,QuantType.per_1x128,1,0,asm,asm_1stage,32,_ZN5aiter50fmoe_bf16_blockscaleFp8_g1u1_vs_silu_1tg_ps_32x256E,135.529,0.0,0.00%,11.7,10441.57
53,16,7168,512,256,8,ActivationType.Gelu,torch.bfloat16,torch.bfloat16,torch.bfloat16,QuantType.No,1,0,ck,stage1,32,moe_ck2stages_gemm1_256x32x64x128_1x4_TypeCast_v1_Nswizzle0_Quant0_MulRoutedWeight0_gelu_B16_B16_B16,270.5942,0.0,0.00%,10.42,20834.16
53,16,7168,512,256,8,ActivationType.Gelu,torch.bfloat16,torch.bfloat16,torch.bfloat16,QuantType.No,1,0,ck,stage2,32,moe_ck2stages_gemm2_256x32x128x128_1x4_TypeCast_v1_Nswizzle0_Quant0_MulRoutedWeight1_B16_B16_B16,133.3189,0.0,3.29%,21.14,42286.6
54,16,7168,512,256,8,ActivationType.Gelu,torch.bfloat16,torch.bfloat16,torch.bfloat16,QuantType.No,1,1,ck,stage1,32,moe_ck2stages_gemm1_256x32x64x128_1x4_TypeCast_v1_Nswizzle0_Quant0_MulRoutedWeight1_gelu_B16_B16_B16,270.9628,0.0,0.00%,10.4,20805.82
54,16,7168,512,256,8,ActivationType.Gelu,torch.bfloat16,torch.bfloat16,torch.bfloat16,QuantType.No,1,1,ck,stage2,32,moe_ck2stages_gemm2_256x32x128x128_1x4_TypeCast_v1_Nswizzle0_Quant0_MulRoutedWeight0_B16_B16_B16,133.0458,0.0,0.00%,21.18,42373.4
55,16,7168,512,256,8,ActivationType.Gelu,torch.bfloat16,torch.float8_e4m3fn,torch.float8_e4m3fn,QuantType.per_Tensor,1,0,ck,stage1,32,moe_ck2stages_gemm1_256x32x64x256_1x4_TypeCast_v1_Nswizzle0_Quant1_MulRoutedWeight0_gelu_F8_F8_B16,139.1942,31.767444444444404,0.00%,20.25,20251.68
55,16,7168,512,256,8,ActivationType.Gelu,torch.bfloat16,torch.float8_e4m3fn,torch.float8_e4m3fn,QuantType.per_Tensor,1,0,asm,stage1,16,_ZN5aiter48fmoe_stage1_bf16_pertokenFp8_g1u1_16x256_3tg_pf2E,140.7384,31.767444444444404,0.01%,20.03,20029.48
55,16,7168,512,256,8,ActivationType.Gelu,torch.bfloat16,torch.float8_e4m3fn,torch.float8_e4m3fn,QuantType.per_Tensor,1,0,ck,stage2,32,moe_ck2stages_gemm2_256x32x128x256_1x4_TypeCast_v1_Nswizzle0_Quant1_MulRoutedWeight1_F8_F8_B16,70.0225,31.767444444444404,3.35%,40.25,40257.29
56,16,7168,512,256,8,ActivationType.Gelu,torch.bfloat16,torch.float8_e4m3fn,torch.float8_e4m3fn,QuantType.per_Tensor,1,1,ck,stage1,32,moe_ck2stages_gemm1_256x32x64x256_1x4_TypeCast_v1_Nswizzle0_Quant1_MulRoutedWeight1_gelu_F8_F8_B16,139.7647,30.776333333333355,0.00%,20.17,20169.02
56,16,7168,512,256,8,ActivationType.Gelu,torch.bfloat16,torch.float8_e4m3fn,torch.float8_e4m3fn,QuantType.per_Tensor,1,1,asm,stage1,16,_ZN5aiter57fmoe_stage1_bf16_pertokenFp8_doweight_g1u1_16x256_3tg_pf2E,141.517,30.776333333333355,0.00%,19.92,19919.28
56,16,7168,512,256,8,ActivationType.Gelu,torch.bfloat16,torch.float8_e4m3fn,torch.float8_e4m3fn,QuantType.per_Tensor,1,1,ck,stage2,32,moe_ck2stages_gemm2_256x32x128x256_1x4_TypeCast_v1_Nswizzle0_Quant1_MulRoutedWeight0_F8_F8_B16,69.5095,30.776333333333355,0.00%,40.55,40554.4
57,16,7168,512,256,8,ActivationType.Gelu,torch.bfloat16,torch.float8_e4m3fn,torch.float8_e4m3fn,QuantType.per_Token,1,0,asm,stage1,16,_ZN5aiter48fmoe_stage1_bf16_pertokenFp8_g1u1_16x256_3tg_pf2E,132.8114,26.76533333333333,0.01%,21.22,21224.96
57,16,7168,512,256,8,ActivationType.Gelu,torch.bfloat16,torch.float8_e4m3fn,torch.float8_e4m3fn,QuantType.per_Token,1,0,ck,stage1,32,moe_ck2stages_gemm1_256x32x64x256_1x4_TypeCast_v1_Nswizzle0_Quant2_MulRoutedWeight0_gelu_F8_F8_B16,143.9409,26.76533333333333,0.00%,19.58,19583.85
57,16,7168,512,256,8,ActivationType.Gelu,torch.bfloat16,torch.float8_e4m3fn,torch.float8_e4m3fn,QuantType.per_Token,1,0,ck,stage2,32,moe_ck2stages_gemm2_256x32x128x256_1x4_TypeCast_v1_Nswizzle0_Quant2_MulRoutedWeight1_F8_F8_B16,73.5992,26.76533333333333,3.25%,38.3,38300.91
57,16,7168,512,256,8,ActivationType.Gelu,torch.bfloat16,torch.float8_e4m3fn,torch.float8_e4m3fn,QuantType.per_Token,1,0,asm,asm_1stage,32,_ZN5aiter48fmoe_bf16_pertokenFp8_g1u1_vs_gelu_1tg_ps_32x256E,207.9434,0.0,0.00%,13.55,13556.17
58,16,7168,512,256,8,ActivationType.Gelu,torch.bfloat16,torch.float8_e4m3fn,torch.float8_e4m3fn,QuantType.per_Token,1,1,asm,stage1,16,_ZN5aiter57fmoe_stage1_bf16_pertokenFp8_doweight_g1u1_16x256_3tg_pf2E,132.6245,26.33444444444445,0.00%,21.25,21254.87
58,16,7168,512,256,8,ActivationType.Gelu,torch.bfloat16,torch.float8_e4m3fn,torch.float8_e4m3fn,QuantType.per_Token,1,1,ck,stage1,32,moe_ck2stages_gemm1_256x32x64x256_1x4_TypeCast_v1_Nswizzle0_Quant2_MulRoutedWeight1_gelu_F8_F8_B16,143.8751,26.33444444444445,0.00%,19.59,19592.8
58,16,7168,512,256,8,ActivationType.Gelu,torch.bfloat16,torch.float8_e4m3fn,torch.float8_e4m3fn,QuantType.per_Token,1,1,ck,stage2,32,moe_ck2stages_gemm2_256x32x128x256_1x4_TypeCast_v1_Nswizzle0_Quant2_MulRoutedWeight0_F8_F8_B16,73.3928,26.33444444444445,0.00%,38.4,38408.62
58,16,7168,512,256,8,ActivationType.Gelu,torch.bfloat16,torch.float8_e4m3fn,torch.float8_e4m3fn,QuantType.per_Token,1,1,asm,asm_1stage,32,_ZN5aiter50fmoe_bf16_pertokenFp8_g1u1_vs_tkw1_gelu_1tg_32x256E,209.0302,0.0,0.00%,13.48,13485.69
59,16,7168,512,256,8,ActivationType.Silu,torch.bfloat16,torch.bfloat16,torch.bfloat16,QuantType.No,1,1,ck,stage1,32,moe_ck2stages_gemm1_256x32x64x128_1x4_TypeCast_v1_Nswizzle0_Quant0_MulRoutedWeight1_silu_B16_B16_B16,270.4951,0.0,0.00%,10.42,20841.79
59,16,7168,512,256,8,ActivationType.Silu,torch.bfloat16,torch.bfloat16,torch.bfloat16,QuantType.No,1,1,ck,stage2,32,moe_ck2stages_gemm2_256x32x128x128_1x4_TypeCast_v1_Nswizzle0_Quant0_MulRoutedWeight0_B16_B16_B16,132.6828,0.0,0.00%,21.24,42489.33
60,16,7168,512,256,8,ActivationType.Silu,torch.bfloat16,torch.float8_e4m3fn,torch.float8_e4m3fn,QuantType.per_Tensor,1,0,ck,stage1,32,moe_ck2stages_gemm1_256x32x64x256_1x4_TypeCast_v1_Nswizzle0_Quant1_MulRoutedWeight0_silu_F8_F8_B16,139.2667,33.007555555555534,0.00%,20.24,20241.14
60,16,7168,512,256,8,ActivationType.Silu,torch.bfloat16,torch.float8_e4m3fn,torch.float8_e4m3fn,QuantType.per_Tensor,1,0,asm,stage1,16,_ZN5aiter48fmoe_stage1_bf16_pertokenFp8_g1u1_16x128_4tg_pf2E,140.7775,33.007555555555534,0.06%,20.02,20023.91
60,16,7168,512,256,8,ActivationType.Silu,torch.bfloat16,torch.float8_e4m3fn,torch.float8_e4m3fn,QuantType.per_Tensor,1,0,ck,stage2,32,moe_ck2stages_gemm2_256x32x128x256_1x4_TypeCast_v1_Nswizzle0_Quant1_MulRoutedWeight1_F8_F8_B16,69.7929,33.007555555555534,2.82%,40.38,40389.73
61,16,7168,512,256,8,ActivationType.Silu,torch.bfloat16,torch.float8_e4m3fn,torch.float8_e4m3fn,QuantType.per_Tensor,1,1,ck,stage1,32,moe_ck2stages_gemm1_256x32x64x256_1x4_TypeCast_v1_Nswizzle0_Quant1_MulRoutedWeight1_silu_F8_F8_B16,139.9283,32.14555555555563,0.00%,20.14,20145.43
61,16,7168,512,256,8,ActivationType.Silu,torch.bfloat16,torch.float8_e4m3fn,torch.float8_e4m3fn,QuantType.per_Tensor,1,1,asm,stage1,16,_ZN5aiter57fmoe_stage1_bf16_pertokenFp8_doweight_g1u1_16x256_3tg_pf2E,140.8976,32.14555555555563,0.00%,20.0,20006.84
61,16,7168,512,256,8,ActivationType.Silu,torch.bfloat16,torch.float8_e4m3fn,torch.float8_e4m3fn,QuantType.per_Tensor,1,1,ck,stage2,32,moe_ck2stages_gemm2_256x32x128x256_1x4_TypeCast_v1_Nswizzle0_Quant1_MulRoutedWeight0_F8_F8_B16,69.7388,32.14555555555563,0.00%,40.42,40421.06
62,16,7168,512,256,8,ActivationType.Silu,torch.bfloat16,torch.float8_e4m3fn,torch.float8_e4m3fn,QuantType.per_Token,1,0,asm,stage1,16,_ZN5aiter48fmoe_stage1_bf16_pertokenFp8_g1u1_16x256_3tg_pf2E,132.1498,25.88544444444439,0.00%,21.33,21331.22
62,16,7168,512,256,8,ActivationType.Silu,torch.bfloat16,torch.float8_e4m3fn,torch.float8_e4m3fn,QuantType.per_Token,1,0,ck,stage1,32,moe_ck2stages_gemm1_256x32x64x256_1x4_TypeCast_v1_Nswizzle0_Quant2_MulRoutedWeight0_silu_F8_F8_B16,144.8134,25.88544444444439,0.00%,19.46,19465.85
62,16,7168,512,256,8,ActivationType.Silu,torch.bfloat16,torch.float8_e4m3fn,torch.float8_e4m3fn,QuantType.per_Token,1,0,ck,stage2,32,moe_ck2stages_gemm2_256x32x128x256_1x4_TypeCast_v1_Nswizzle0_Quant2_MulRoutedWeight1_F8_F8_B16,73.0837,25.88544444444439,2.75%,38.57,38571.07
62,16,7168,512,256,8,ActivationType.Silu,torch.bfloat16,torch.float8_e4m3fn,torch.float8_e4m3fn,QuantType.per_Token,1,0,asm,asm_1stage,32,_ZN5aiter48fmoe_bf16_pertokenFp8_g1u1_vs_silu_1tg_ps_32x256E,207.9458,0.0,0.00%,13.55,13556.01
63,16,7168,512,256,8,ActivationType.Silu,torch.bfloat16,torch.float8_e4m3fn,torch.float8_e4m3fn,QuantType.per_Token,1,1,asm,stage1,16,_ZN5aiter57fmoe_stage1_bf16_pertokenFp8_doweight_g1u1_16x256_3tg_pf2E,132.1546,25.445333333333444,0.01%,21.33,21330.44
63,16,7168,512,256,8,ActivationType.Silu,torch.bfloat16,torch.float8_e4m3fn,torch.float8_e4m3fn,QuantType.per_Token,1,1,ck,stage1,32,moe_ck2stages_gemm1_256x32x64x256_1x4_TypeCast_v1_Nswizzle0_Quant2_MulRoutedWeight1_silu_F8_F8_B16,145.8123,25.445333333333444,0.00%,19.33,19332.5
63,16,7168,512,256,8,ActivationType.Silu,torch.bfloat16,torch.float8_e4m3fn,torch.float8_e4m3fn,QuantType.per_Token,1,1,ck,stage2,32,moe_ck2stages_gemm2_256x32x128x256_1x4_TypeCast_v1_Nswizzle0_Quant2_MulRoutedWeight0_F8_F8_B16,73.8649,25.445333333333444,0.00%,38.16,38163.14
63,16,7168,512,256,8,ActivationType.Silu,torch.bfloat16,torch.float8_e4m3fn,torch.float8_e4m3fn,QuantType.per_Token,1,1,asm,asm_1stage,32,_ZN5aiter50fmoe_bf16_pertokenFp8_g1u1_vs_tkw1_silu_1tg_32x256E,207.9711,0.0,0.00%,13.55,13554.37
64,16,7168,512,256,8,ActivationType.Silu,torch.bfloat16,torch.bfloat16,torch.bfloat16,QuantType.No,1,0,ck,stage1,32,moe_ck2stages_gemm1_256x32x64x128_1x4_TypeCast_v1_Nswizzle0_Quant0_MulRoutedWeight0_silu_B16_B16_B16,270.2981,0.0,0.00%,10.43,20856.98
64,16,7168,512,256,8,ActivationType.Silu,torch.bfloat16,torch.bfloat16,torch.bfloat16,QuantType.No,1,0,ck,stage2,32,moe_ck2stages_gemm2_256x32x128x128_1x4_TypeCast_v1_Nswizzle0_Quant0_MulRoutedWeight1_B16_B16_B16,133.1182,0.0,2.82%,21.17,42350.36
65,16,7168,512,256,8,ActivationType.Gelu,torch.bfloat16,torch.float8_e4m3fn,torch.float8_e4m3fn,QuantType.per_1x128,1,0,ck,stage1,16,moe_ck2stages_gemm1_256x16x128x256_1x4_MulABScaleExpertWeightA8W8blkscale_v1_Nswizzle0_Quant4_MulRoutedWeight0_gelu_F8_F8_B16,138.4564,27.191999999999968,0.12%,20.36,20359.6
65,16,7168,512,256,8,ActivationType.Gelu,torch.bfloat16,torch.float8_e4m3fn,torch.float8_e4m3fn,QuantType.per_1x128,1,0,ck,stage2,16,moe_ck2stages_gemm2_256x16x128x256_1x4_MulABScaleExpertWeightA8W8blkscale_v1_Nswizzle0_Quant4_MulRoutedWeight1_F8_F8_B16,70.3844,27.191999999999968,16.00%,40.05,40050.3
65,16,7168,512,256,8,ActivationType.Gelu,torch.bfloat16,torch.float8_e4m3fn,torch.float8_e4m3fn,QuantType.per_1x128,1,0,asm,asm_1stage,32,_ZN5aiter47fmoe_bf16_blockscaleFp8_g1u1_vs_gelu_1tg_32x256E,199.974,0.0,10.15%,14.09,14096.41
66,16,7168,512,256,8,ActivationType.Silu,torch.bfloat16,torch.float8_e4m3fn,torch.float8_e4m3fn,QuantType.per_1x128,1,0,ck,stage1,16,moe_ck2stages_gemm1_256x16x128x256_1x4_MulABScaleExpertWeightA8W8blkscale_v1_Nswizzle0_Quant4_MulRoutedWeight0_silu_F8_F8_B16,139.7213,22.95211111111108,0.11%,20.17,20175.28
66,16,7168,512,256,8,ActivationType.Silu,torch.bfloat16,torch.float8_e4m3fn,torch.float8_e4m3fn,QuantType.per_1x128,1,0,ck,stage2,16,moe_ck2stages_gemm2_256x16x128x256_1x4_MulABScaleExpertWeightA8W8blkscale_v1_Nswizzle0_Quant4_MulRoutedWeight1_F8_F8_B16,70.8772,22.95211111111108,15.84%,39.77,39771.84
66,16,7168,512,256,8,ActivationType.Silu,torch.bfloat16,torch.float8_e4m3fn,torch.float8_e4m3fn,QuantType.per_1x128,1,0,asm,asm_1stage,32,_ZN5aiter47fmoe_bf16_blockscaleFp8_g1u1_vs_silu_1tg_32x256E,200.8566,0.0,0.00%,14.03,14034.47
67,16,7168,512,256,8,ActivationType.Gelu,torch.bfloat16,torch.float8_e4m3fn,torch.float8_e4m3fn,QuantType.per_1x128,1,1,ck,stage1,16,moe_ck2stages_gemm1_256x16x128x256_1x4_MulABScaleExpertWeightA8W8blkscale_v1_Nswizzle0_Quant4_MulRoutedWeight1_gelu_F8_F8_B16,139.2189,23.01422222222228,0.11%,20.25,20248.09
67,16,7168,512,256,8,ActivationType.Gelu,torch.bfloat16,torch.float8_e4m3fn,torch.float8_e4m3fn,QuantType.per_1x128,1,1,ck,stage2,16,moe_ck2stages_gemm2_256x16x128x256_1x4_MulABScaleExpertWeightA8W8blkscale_v1_Nswizzle0_Quant4_MulRoutedWeight0_F8_F8_B16,69.7257,23.01422222222228,16.85%,40.42,40428.66
68,16,7168,512,256,8,ActivationType.Silu,torch.bfloat16,torch.float8_e4m3fn,torch.float8_e4m3fn,QuantType.per_1x128,1,1,ck,stage1,16,moe_ck2stages_gemm1_256x16x128x256_1x4_MulABScaleExpertWeightA8W8blkscale_v1_Nswizzle0_Quant4_MulRoutedWeight1_silu_F8_F8_B16,139.5885,23.347666666666683,0.12%,20.19,20194.47
68,16,7168,512,256,8,ActivationType.Silu,torch.bfloat16,torch.float8_e4m3fn,torch.float8_e4m3fn,QuantType.per_1x128,1,1,ck,stage2,16,moe_ck2stages_gemm2_256x16x128x256_1x4_MulABScaleExpertWeightA8W8blkscale_v1_Nswizzle0_Quant4_MulRoutedWeight0_F8_F8_B16,70.5904,23.347666666666683,16.75%,39.93,39933.42
69,16,7168,2048,33,10,ActivationType.Silu,torch.bfloat16,torch.float8_e4m3fn,torch.float8_e4m3fn,QuantType.per_1x128,1,0,ck,stage1,16,moe_ck2stages_gemm1_256x16x128x256_1x4_MulABScaleExpertWeightA8W8blkscale_v1_Nswizzle0_Quant4_MulRoutedWeight0_silu_F8_F8_B16,194.9965,25.818888888888942,0.12%,72.27,7454.85
69,16,7168,2048,33,10,ActivationType.Silu,torch.bfloat16,torch.float8_e4m3fn,torch.float8_e4m3fn,QuantType.per_1x128,1,0,ck,stage2,16,moe_ck2stages_gemm2_128x16x128x128_1x2_MulABScaleExpertWeightA8W8blkscale_v1_Nswizzle0_Quant4_MulRoutedWeight1_F8_F8_B16,96.4153,25.818888888888942,16.23%,146.17,15077.18
69,16,7168,2048,33,10,ActivationType.Silu,torch.bfloat16,torch.float8_e4m3fn,torch.float8_e4m3fn,QuantType.per_1x128,1,0,asm,asm_1stage,32,_ZN5aiter47fmoe_bf16_blockscaleFp8_g1u1_vs_silu_1tg_32x256E,338.488,0.0,0.00%,41.63,4294.6
70,16,7168,2048,33,10,ActivationType.Silu,torch.bfloat16,torch.float8_e4m3fn,torch.float8_e4m3fn,QuantType.per_Token,1,0,asm,stage1,16,_ZN5aiter47fmoe_stage1_bf16_pertokenFp8_g1u1_16x64_5tg_pf3E,173.532,29.138888888888843,4.16%,81.21,8376.96
70,16,7168,2048,33,10,ActivationType.Silu,torch.bfloat16,torch.float8_e4m3fn,torch.float8_e4m3fn,QuantType.per_Token,1,0,ck,stage1,32,moe_ck2stages_gemm1_256x32x64x256_1x4_TypeCast_v1_Nswizzle0_Quant2_MulRoutedWeight0_silu_F8_F8_B16,179.5259,29.138888888888843,0.00%,78.5,8097.27
70,16,7168,2048,33,10,ActivationType.Silu,torch.bfloat16,torch.float8_e4m3fn,torch.float8_e4m3fn,QuantType.per_Token,1,0,ck,stage2,32,moe_ck2stages_gemm2_256x32x128x256_1x4_TypeCast_v1_Nswizzle0_Quant2_MulRoutedWeight1_F8_F8_B16,103.3052,29.138888888888843,7.37%,136.42,14071.61
70,16,7168,2048,33,10,ActivationType.Silu,torch.bfloat16,torch.float8_e4m3fn,torch.float8_e4m3fn,QuantType.per_Token,1,0,asm,asm_1stage,32,_ZN5aiter45fmoe_bf16_pertokenFp8_g1u1_vs_silu_1tg_32x512E,272.113,0.0,0.01%,51.79,5342.16
71,32,2048,192,128,8,ActivationType.Silu,torch.bfloat16,torch.bfloat16,torch.bfloat16,QuantType.No,1,0,ck,stage1,32,moe_ck2stages_gemm1_256x32x64x64_1x4_TypeCast_v1_Nswizzle0_Quant0_MulRoutedWeight0_silu_B16_B16_B16,33.9052,0.0,0.00%,17.81,8914.62
71,32,2048,192,128,8,ActivationType.Silu,torch.bfloat16,torch.bfloat16,torch.bfloat16,QuantType.No,1,0,ck,stage2,32,moe_ck2stages_gemm2_256x32x64x64_1x4_TypeCast_v1_Nswizzle0_Quant0_MulRoutedWeight1_B16_B16_B16,22.6652,0.0,0.00%,26.65,13335.51
72,32,2048,192,128,8,ActivationType.Silu,torch.bfloat16,torch.bfloat16,torch.bfloat16,QuantType.No,1,1,ck,stage1,32,moe_ck2stages_gemm1_256x32x64x64_1x4_TypeCast_v1_Nswizzle0_Quant0_MulRoutedWeight1_silu_B16_B16_B16,34.048,0.0,0.00%,17.74,8877.23
72,32,2048,192,128,8,ActivationType.Silu,torch.bfloat16,torch.bfloat16,torch.bfloat16,QuantType.No,1,1,ck,stage2,32,moe_ck2stages_gemm2_256x32x64x64_1x4_TypeCast_v1_Nswizzle0_Quant0_MulRoutedWeight0_B16_B16_B16,22.6023,0.0,0.00%,26.72,13372.62
73,32,2048,192,128,8,ActivationType.Gelu,torch.bfloat16,torch.bfloat16,torch.bfloat16,QuantType.No,1,0,ck,stage1,32,moe_ck2stages_gemm1_256x32x64x64_1x4_TypeCast_v1_Nswizzle0_Quant0_MulRoutedWeight0_gelu_B16_B16_B16,33.5754,0.0,0.00%,17.99,9002.19
73,32,2048,192,128,8,ActivationType.Gelu,torch.bfloat16,torch.bfloat16,torch.bfloat16,QuantType.No,1,0,ck,stage2,32,moe_ck2stages_gemm2_256x32x64x64_1x4_TypeCast_v1_Nswizzle0_Quant0_MulRoutedWeight1_B16_B16_B16,22.9746,0.0,0.00%,26.29,13155.92
74,32,2048,192,128,8,ActivationType.Gelu,torch.bfloat16,torch.bfloat16,torch.bfloat16,QuantType.No,1,1,ck,stage1,32,moe_ck2stages_gemm1_256x32x64x64_1x4_TypeCast_v1_Nswizzle0_Quant0_MulRoutedWeight1_gelu_B16_B16_B16,34.0441,0.0,0.00%,17.74,8878.25
74,32,2048,192,128,8,ActivationType.Gelu,torch.bfloat16,torch.bfloat16,torch.bfloat16,QuantType.No,1,1,ck,stage2,32,moe_ck2stages_gemm2_256x32x64x64_1x4_TypeCast_v1_Nswizzle0_Quant0_MulRoutedWeight0_B16_B16_B16,22.5225,0.0,0.00%,26.82,13420.0
75,32,4096,192,128,8,ActivationType.Silu,torch.bfloat16,torch.bfloat16,torch.bfloat16,QuantType.No,1,0,ck,stage1,32,moe_ck2stages_gemm1_256x32x64x64_1x4_TypeCast_v1_Nswizzle0_Quant0_MulRoutedWeight0_silu_B16_B16_B16,62.7101,0.0,0.00%,19.26,9639.66
75,32,4096,192,128,8,ActivationType.Silu,torch.bfloat16,torch.bfloat16,torch.bfloat16,QuantType.No,1,0,ck,stage2,32,moe_ck2stages_gemm2_256x32x64x64_1x4_TypeCast_v1_Nswizzle0_Quant0_MulRoutedWeight1_B16_B16_B16,35.888,0.0,0.09%,33.66,16844.18
76,32,4096,192,128,8,ActivationType.Silu,torch.bfloat16,torch.bfloat16,torch.bfloat16,QuantType.No,1,1,ck,stage1,32,moe_ck2stages_gemm1_256x32x64x64_1x4_TypeCast_v1_Nswizzle0_Quant0_MulRoutedWeight1_silu_B16_B16_B16,63.0168,0.0,0.00%,19.17,9592.74
76,32,4096,192,128,8,ActivationType.Silu,torch.bfloat16,torch.bfloat16,torch.bfloat16,QuantType.No,1,1,ck,stage2,32,moe_ck2stages_gemm2_256x32x64x64_1x4_TypeCast_v1_Nswizzle0_Quant0_MulRoutedWeight0_B16_B16_B16,36.1344,0.0,0.00%,33.43,16729.32
77,32,4096,192,128,8,ActivationType.Gelu,torch.bfloat16,torch.bfloat16,torch.bfloat16,QuantType.No,1,0,ck,stage1,32,moe_ck2stages_gemm1_256x32x64x64_1x4_TypeCast_v1_Nswizzle0_Quant0_MulRoutedWeight0_gelu_B16_B16_B16,62.5581,0.0,0.00%,19.31,9663.08
77,32,4096,192,128,8,ActivationType.Gelu,torch.bfloat16,torch.bfloat16,torch.bfloat16,QuantType.No,1,0,ck,stage2,32,moe_ck2stages_gemm2_256x32x64x64_1x4_TypeCast_v1_Nswizzle0_Quant0_MulRoutedWeight1_B16_B16_B16,35.7601,0.0,0.14%,33.78,16904.43
78,32,4096,192,128,8,ActivationType.Gelu,torch.bfloat16,torch.bfloat16,torch.bfloat16,QuantType.No,1,1,ck,stage1,32,moe_ck2stages_gemm1_256x32x64x64_1x4_TypeCast_v1_Nswizzle0_Quant0_MulRoutedWeight1_gelu_B16_B16_B16,62.88,0.0,0.00%,19.21,9613.61
78,32,4096,192,128,8,ActivationType.Gelu,torch.bfloat16,torch.bfloat16,torch.bfloat16,QuantType.No,1,1,ck,stage2,32,moe_ck2stages_gemm2_256x32x64x64_1x4_TypeCast_v1_Nswizzle0_Quant0_MulRoutedWeight0_B16_B16_B16,35.7622,0.0,0.00%,33.78,16903.44
79,32,4096,384,128,8,ActivationType.Gelu,torch.bfloat16,torch.bfloat16,torch.bfloat16,QuantType.No,1,0,ck,stage1,64,moe_ck2stages_gemm1_256x64x64x128_1x4_TypeCast_v1_Nswizzle0_Quant0_MulRoutedWeight0_gelu_B16_B16_B16,126.5881,0.0,0.00%,19.08,9546.58
79,32,4096,384,128,8,ActivationType.Gelu,torch.bfloat16,torch.bfloat16,torch.bfloat16,QuantType.No,1,0,ck,stage2,32,moe_ck2stages_gemm2_256x32x64x64_1x4_TypeCast_v1_Nswizzle0_Quant0_MulRoutedWeight1_B16_B16_B16,68.6735,0.0,0.45%,35.18,17597.53
80,32,4096,384,128,8,ActivationType.Gelu,torch.bfloat16,torch.bfloat16,torch.bfloat16,QuantType.No,1,1,ck,stage1,64,moe_ck2stages_gemm1_256x64x64x128_1x4_TypeCast_v1_Nswizzle0_Quant0_MulRoutedWeight1_gelu_B16_B16_B16,126.9574,0.0,0.00%,19.03,9518.81
80,32,4096,384,128,8,ActivationType.Gelu,torch.bfloat16,torch.bfloat16,torch.bfloat16,QuantType.No,1,1,ck,stage2,32,moe_ck2stages_gemm2_256x32x128x128_1x4_TypeCast_v1_Nswizzle0_Quant0_MulRoutedWeight0_B16_B16_B16,69.042,0.0,0.00%,34.99,17503.6
81,32,4096,384,128,8,ActivationType.Silu,torch.bfloat16,torch.bfloat16,torch.bfloat16,QuantType.No,1,0,ck,stage1,64,moe_ck2stages_gemm1_256x64x64x128_1x4_TypeCast_v1_Nswizzle0_Quant0_MulRoutedWeight0_silu_B16_B16_B16,127.1695,0.0,0.00%,19.0,9502.94
81,32,4096,384,128,8,ActivationType.Silu,torch.bfloat16,torch.bfloat16,torch.bfloat16,QuantType.No,1,0,ck,stage2,32,moe_ck2stages_gemm2_256x32x128x128_1x4_TypeCast_v1_Nswizzle0_Quant0_MulRoutedWeight1_B16_B16_B16,68.5579,0.0,0.37%,35.24,17627.2
82,32,4096,384,128,8,ActivationType.Silu,torch.bfloat16,torch.bfloat16,torch.bfloat16,QuantType.No,1,1,ck,stage1,64,moe_ck2stages_gemm1_256x64x64x128_1x4_TypeCast_v1_Nswizzle0_Quant0_MulRoutedWeight1_silu_B16_B16_B16,126.9036,0.0,0.00%,19.04,9522.85
82,32,4096,384,128,8,ActivationType.Silu,torch.bfloat16,torch.bfloat16,torch.bfloat16,QuantType.No,1,1,ck,stage2,32,moe_ck2stages_gemm2_256x32x128x128_1x4_TypeCast_v1_Nswizzle0_Quant0_MulRoutedWeight0_B16_B16_B16,68.7585,0.0,0.00%,35.14,17575.77
83,32,4096,384,128,8,ActivationType.Silu,torch.bfloat16,torch.float8_e4m3fn,torch.float8_e4m3fn,QuantType.per_Tensor,1,0,ck,stage1,32,moe_ck2stages_gemm1_256x32x64x256_1x4_TypeCast_v1_Nswizzle0_Quant1_MulRoutedWeight0_silu_F8_F8_B16,65.0823,35.589777777777776,0.00%,37.12,9286.29
83,32,4096,384,128,8,ActivationType.Silu,torch.bfloat16,torch.float8_e4m3fn,torch.float8_e4m3fn,QuantType.per_Tensor,1,0,asm,stage1,16,_ZN5aiter48fmoe_stage1_bf16_pertokenFp8_g1u1_16x128_4tg_pf2E,70.875,35.589777777777776,0.03%,34.09,8527.31
83,32,4096,384,128,8,ActivationType.Silu,torch.bfloat16,torch.float8_e4m3fn,torch.float8_e4m3fn,QuantType.per_Tensor,1,0,ck,stage2,128,moe_ck2stages_gemm2_256x128x128x128_1x4_TypeCast_v3_Nswizzle0_Quant1_MulRoutedWeight1_F8_F8_B16,53.9278,35.589777777777776,0.36%,44.8,11207.08
84,32,4096,384,128,8,ActivationType.Silu,torch.bfloat16,torch.float8_e4m3fn,torch.float8_e4m3fn,QuantType.per_Tensor,1,1,ck,stage1,32,moe_ck2stages_gemm1_256x32x64x256_1x4_TypeCast_v1_Nswizzle0_Quant1_MulRoutedWeight1_silu_F8_F8_B16,64.9733,35.46522222222225,0.00%,37.18,9301.87
84,32,4096,384,128,8,ActivationType.Silu,torch.bfloat16,torch.float8_e4m3fn,torch.float8_e4m3fn,QuantType.per_Tensor,1,1,asm,stage1,16,_ZN5aiter56fmoe_stage1_bf16_pertokenFp8_doweight_g1u1_16x64_6tg_pf2E,70.7862,35.46522222222225,0.00%,34.13,8538.01
84,32,4096,384,128,8,ActivationType.Silu,torch.bfloat16,torch.float8_e4m3fn,torch.float8_e4m3fn,QuantType.per_Tensor,1,1,ck,stage2,128,moe_ck2stages_gemm2_256x128x128x128_1x4_TypeCast_v3_Nswizzle0_Quant1_MulRoutedWeight0_F8_F8_B16,50.9917,35.46522222222225,0.00%,47.38,11852.38
85,32,4096,384,128,8,ActivationType.Silu,torch.bfloat16,torch.float8_e4m3fn,torch.float8_e4m3fn,QuantType.per_Token,1,0,asm,stage1,16,_ZN5aiter47fmoe_stage1_bf16_pertokenFp8_g1u1_16x64_6tg_pf2E,62.2922,22.498888888888903,0.00%,38.78,9702.23
85,32,4096,384,128,8,ActivationType.Silu,torch.bfloat16,torch.float8_e4m3fn,torch.float8_e4m3fn,QuantType.per_Token,1,0,ck,stage1,32,moe_ck2stages_gemm1_256x32x64x256_1x4_TypeCast_v1_Nswizzle0_Quant2_MulRoutedWeight0_silu_F8_F8_B16,65.6306,22.498888888888903,0.00%,36.81,9208.71
85,32,4096,384,128,8,ActivationType.Silu,torch.bfloat16,torch.float8_e4m3fn,torch.float8_e4m3fn,QuantType.per_Token,1,0,ck,stage2,128,moe_ck2stages_gemm2_256x128x128x128_1x4_TypeCast_v3_Nswizzle0_Quant2_MulRoutedWeight1_F8_F8_B16,87.2768,22.498888888888903,0.34%,27.68,6924.78
85,32,4096,384,128,8,ActivationType.Silu,torch.bfloat16,torch.float8_e4m3fn,torch.float8_e4m3fn,QuantType.per_Token,1,0,asm,asm_1stage,32,_ZN5aiter45fmoe_bf16_pertokenFp8_g1u1_vs_silu_1tg_32x192E,102.791,0.0,0.00%,23.5,5879.63
86,32,4096,384,128,8,ActivationType.Silu,torch.bfloat16,torch.float8_e4m3fn,torch.float8_e4m3fn,QuantType.per_Token,1,1,asm,stage1,16,_ZN5aiter56fmoe_stage1_bf16_pertokenFp8_doweight_g1u1_16x64_6tg_pf2E,62.3102,21.6276666666667,0.00%,38.77,9699.42
86,32,4096,384,128,8,ActivationType.Silu,torch.bfloat16,torch.float8_e4m3fn,torch.float8_e4m3fn,QuantType.per_Token,1,1,ck,stage1,32,moe_ck2stages_gemm1_256x32x64x256_1x4_TypeCast_v1_Nswizzle0_Quant2_MulRoutedWeight1_silu_F8_F8_B16,65.5686,21.6276666666667,0.00%,36.85,9217.41
86,32,4096,384,128,8,ActivationType.Silu,torch.bfloat16,torch.float8_e4m3fn,torch.float8_e4m3fn,QuantType.per_Token,1,1,ck,stage2,128,moe_ck2stages_gemm2_256x128x128x128_1x4_TypeCast_v3_Nswizzle0_Quant2_MulRoutedWeight0_F8_F8_B16,84.021,21.6276666666667,0.00%,28.75,7193.12
86,32,4096,384,128,8,ActivationType.Silu,torch.bfloat16,torch.float8_e4m3fn,torch.float8_e4m3fn,QuantType.per_Token,1,1,asm,asm_1stage,32,_ZN5aiter50fmoe_bf16_pertokenFp8_g1u1_vs_tkw1_silu_1tg_32x192E,103.3261,0.0,0.00%,23.38,5849.18
87,32,4096,384,128,8,ActivationType.Gelu,torch.bfloat16,torch.float8_e4m3fn,torch.float8_e4m3fn,QuantType.per_Tensor,1,0,ck,stage1,32,moe_ck2stages_gemm1_256x32x64x256_1x4_TypeCast_v1_Nswizzle0_Quant1_MulRoutedWeight0_gelu_F8_F8_B16,64.7891,35.291999999999966,0.00%,37.29,9328.31
87,32,4096,384,128,8,ActivationType.Gelu,torch.bfloat16,torch.float8_e4m3fn,torch.float8_e4m3fn,QuantType.per_Tensor,1,0,asm,stage1,16,_ZN5aiter47fmoe_stage1_bf16_pertokenFp8_g1u1_16x64_6tg_pf2E,70.823,35.291999999999966,0.00%,34.11,8533.57
87,32,4096,384,128,8,ActivationType.Gelu,torch.bfloat16,torch.float8_e4m3fn,torch.float8_e4m3fn,QuantType.per_Tensor,1,0,ck,stage2,128,moe_ck2stages_gemm2_256x128x128x128_1x4_TypeCast_v3_Nswizzle0_Quant1_MulRoutedWeight1_F8_F8_B16,53.7805,35.291999999999966,0.50%,44.92,11237.77
88,32,4096,384,128,8,ActivationType.Gelu,torch.bfloat16,torch.float8_e4m3fn,torch.float8_e4m3fn,QuantType.per_Tensor,1,1,ck,stage1,32,moe_ck2stages_gemm1_256x32x64x256_1x4_TypeCast_v1_Nswizzle0_Quant1_MulRoutedWeight1_gelu_F8_F8_B16,64.4102,35.34533333333331,0.00%,37.51,9383.19
88,32,4096,384,128,8,ActivationType.Gelu,torch.bfloat16,torch.float8_e4m3fn,torch.float8_e4m3fn,QuantType.per_Tensor,1,1,asm,stage1,32,_ZN5aiter57fmoe_stage1_bf16_pertokenFp8_doweight_g1u1_32x128_3tg_pf2E,70.8957,35.34533333333331,0.00%,34.08,8524.82
88,32,4096,384,128,8,ActivationType.Gelu,torch.bfloat16,torch.float8_e4m3fn,torch.float8_e4m3fn,QuantType.per_Tensor,1,1,ck,stage2,128,moe_ck2stages_gemm2_256x128x128x128_1x4_TypeCast_v3_Nswizzle0_Quant1_MulRoutedWeight0_F8_F8_B16,51.1856,35.34533333333331,0.00%,47.2,11807.48
89,32,4096,384,128,8,ActivationType.Gelu,torch.bfloat16,torch.float8_e4m3fn,torch.float8_e4m3fn,QuantType.per_Token,1,0,asm,stage1,16,_ZN5aiter47fmoe_stage1_bf16_pertokenFp8_g1u1_16x64_6tg_pf2E,62.2914,22.76533333333326,0.00%,38.78,9702.35
89,32,4096,384,128,8,ActivationType.Gelu,torch.bfloat16,torch.float8_e4m3fn,torch.float8_e4m3fn,QuantType.per_Token,1,0,ck,stage1,32,moe_ck2stages_gemm1_256x32x64x256_1x4_TypeCast_v1_Nswizzle0_Quant2_MulRoutedWeight0_gelu_F8_F8_B16,65.4672,22.76533333333326,0.00%,36.9,9231.69
89,32,4096,384,128,8,ActivationType.Gelu,torch.bfloat16,torch.float8_e4m3fn,torch.float8_e4m3fn,QuantType.per_Token,1,0,ck,stage2,128,moe_ck2stages_gemm2_256x128x128x128_1x4_TypeCast_v3_Nswizzle0_Quant2_MulRoutedWeight1_F8_F8_B16,87.1405,22.76533333333326,0.47%,27.72,6935.62
89,32,4096,384,128,8,ActivationType.Gelu,torch.bfloat16,torch.float8_e4m3fn,torch.float8_e4m3fn,QuantType.per_Token,1,0,asm,asm_1stage,32,_ZN5aiter45fmoe_bf16_pertokenFp8_g1u1_vs_gelu_1tg_32x192E,102.8669,0.0,0.00%,23.49,5875.29
90,32,4096,384,128,8,ActivationType.Gelu,torch.bfloat16,torch.float8_e4m3fn,torch.float8_e4m3fn,QuantType.per_Token,1,1,asm,stage1,16,_ZN5aiter56fmoe_stage1_bf16_pertokenFp8_doweight_g1u1_16x64_6tg_pf2E,62.1215,23.02322222222224,0.00%,38.89,9728.89
90,32,4096,384,128,8,ActivationType.Gelu,torch.bfloat16,torch.float8_e4m3fn,torch.float8_e4m3fn,QuantType.per_Token,1,1,ck,stage1,32,moe_ck2stages_gemm1_256x32x64x256_1x4_TypeCast_v1_Nswizzle0_Quant2_MulRoutedWeight1_gelu_F8_F8_B16,65.4478,23.02322222222224,0.00%,36.91,9234.43
90,32,4096,384,128,8,ActivationType.Gelu,torch.bfloat16,torch.float8_e4m3fn,torch.float8_e4m3fn,QuantType.per_Token,1,1,ck,stage2,128,moe_ck2stages_gemm2_256x128x128x128_1x4_TypeCast_v3_Nswizzle0_Quant2_MulRoutedWeight0_F8_F8_B16,83.9224,23.02322222222224,0.00%,28.79,7201.57
90,32,4096,384,128,8,ActivationType.Gelu,torch.bfloat16,torch.float8_e4m3fn,torch.float8_e4m3fn,QuantType.per_Token,1,1,asm,asm_1stage,32,_ZN5aiter50fmoe_bf16_pertokenFp8_g1u1_vs_tkw1_gelu_1tg_32x192E,103.4896,0.0,0.00%,23.34,5839.94
91,32,4096,384,128,8,ActivationType.Silu,torch.bfloat16,torch.float8_e4m3fn,torch.float8_e4m3fn,QuantType.per_1x128,1,0,ck,stage1,16,moe_ck2stages_gemm1_128x16x128x128_1x2_MulABScaleExpertWeightA8W8blkscale_v1_Nswizzle0_Quant4_MulRoutedWeight0_silu_F8_F8_B16,74.3932,23.14311111111111,0.09%,32.47,8124.04
91,32,4096,384,128,8,ActivationType.Silu,torch.bfloat16,torch.float8_e4m3fn,torch.float8_e4m3fn,QuantType.per_1x128,1,0,ck,stage2,16,moe_ck2stages_gemm2_128x16x128x128_1x2_MulABScaleExpertWeightA8W8blkscale_v1_Nswizzle0_Quant4_MulRoutedWeight1_F8_F8_B16,38.6331,23.14311111111111,15.75%,62.53,15643.92
91,32,4096,384,128,8,ActivationType.Silu,torch.bfloat16,torch.float8_e4m3fn,torch.float8_e4m3fn,QuantType.per_1x128,1,0,asm,asm_1stage,32,_ZN5aiter43fmoe_bf16_blockscaleFp8_g1u1_vs_silu_32x384E,112.8889,0.0,0.00%,21.4,5353.7
92,32,4096,384,128,8,ActivationType.Gelu,torch.bfloat16,torch.float8_e4m3fn,torch.float8_e4m3fn,QuantType.per_1x128,1,0,ck,stage1,16,moe_ck2stages_gemm1_128x16x128x128_1x2_MulABScaleExpertWeightA8W8blkscale_v1_Nswizzle0_Quant4_MulRoutedWeight0_gelu_F8_F8_B16,74.2039,21.75655555555559,0.11%,32.56,8144.76
92,32,4096,384,128,8,ActivationType.Gelu,torch.bfloat16,torch.float8_e4m3fn,torch.float8_e4m3fn,QuantType.per_1x128,1,0,ck,stage2,16,moe_ck2stages_gemm2_128x16x128x128_1x2_MulABScaleExpertWeightA8W8blkscale_v1_Nswizzle0_Quant4_MulRoutedWeight1_F8_F8_B16,39.0562,21.75655555555559,15.67%,61.86,15474.44
93,32,4096,384,128,8,ActivationType.Silu,torch.bfloat16,torch.float8_e4m3fn,torch.float8_e4m3fn,QuantType.per_1x128,1,1,ck,stage1,16,moe_ck2stages_gemm1_128x16x128x128_1x2_MulABScaleExpertWeightA8W8blkscale_v1_Nswizzle0_Quant4_MulRoutedWeight1_silu_F8_F8_B16,73.4656,24.88099999999997,0.11%,32.89,8226.61
93,32,4096,384,128,8,ActivationType.Silu,torch.bfloat16,torch.float8_e4m3fn,torch.float8_e4m3fn,QuantType.per_1x128,1,1,ck,stage2,32,moe_ck2stages_gemm2_256x32x128x128_1x4_MulABScaleExpertWeightA8W8blkscale_v1_Nswizzle0_Quant4_MulRoutedWeight0_F8_F8_B16,38.2013,24.88099999999997,16.88%,63.24,15820.74
94,32,4096,384,128,8,ActivationType.Gelu,torch.bfloat16,torch.float8_e4m3fn,torch.float8_e4m3fn,QuantType.per_1x128,1,1,ck,stage1,16,moe_ck2stages_gemm1_128x16x128x128_1x2_MulABScaleExpertWeightA8W8blkscale_v1_Nswizzle0_Quant4_MulRoutedWeight1_gelu_F8_F8_B16,73.8091,24.97433333333329,0.12%,32.73,8188.33
94,32,4096,384,128,8,ActivationType.Gelu,torch.bfloat16,torch.float8_e4m3fn,torch.float8_e4m3fn,QuantType.per_1x128,1,1,ck,stage2,32,moe_ck2stages_gemm2_256x32x128x128_1x4_MulABScaleExpertWeightA8W8blkscale_v1_Nswizzle0_Quant4_MulRoutedWeight0_F8_F8_B16,38.8068,24.97433333333329,16.84%,62.26,15573.89
95,32,7168,256,256,8,ActivationType.Gelu,torch.bfloat16,torch.bfloat16,torch.bfloat16,QuantType.No,1,0,ck,stage1,32,moe_ck2stages_gemm1_256x32x64x128_1x4_TypeCast_v1_Nswizzle0_Quant0_MulRoutedWeight0_gelu_B16_B16_B16,200.4867,0.0,0.00%,14.06,14063.23
95,32,7168,256,256,8,ActivationType.Gelu,torch.bfloat16,torch.bfloat16,torch.bfloat16,QuantType.No,1,0,ck,stage2,32,moe_ck2stages_gemm2_256x32x128x128_1x4_TypeCast_v1_Nswizzle0_Quant0_MulRoutedWeight1_B16_B16_B16,103.3543,0.0,1.65%,27.27,27279.85
96,32,7168,256,256,8,ActivationType.Gelu,torch.bfloat16,torch.bfloat16,torch.bfloat16,QuantType.No,1,1,ck,stage1,32,moe_ck2stages_gemm1_256x32x64x128_1x4_TypeCast_v1_Nswizzle0_Quant0_MulRoutedWeight1_gelu_B16_B16_B16,200.6788,0.0,0.00%,14.05,14049.76
96,32,7168,256,256,8,ActivationType.Gelu,torch.bfloat16,torch.bfloat16,torch.bfloat16,QuantType.No,1,1,ck,stage2,64,moe_ck2stages_gemm2_256x64x128x128_1x4_TypeCast_v1_Nswizzle0_Quant0_MulRoutedWeight0_B16_B16_B16,101.2229,0.0,0.00%,27.85,27854.27
97,32,7168,256,256,8,ActivationType.Gelu,torch.bfloat16,torch.float8_e4m3fn,torch.float8_e4m3fn,QuantType.per_Tensor,1,0,ck,stage1,32,moe_ck2stages_gemm1_256x32x64x256_1x4_TypeCast_v1_Nswizzle0_Quant1_MulRoutedWeight0_gelu_F8_F8_B16,103.9588,31.452111111111087,0.00%,27.11,13562.82
97,32,7168,256,256,8,ActivationType.Gelu,torch.bfloat16,torch.float8_e4m3fn,torch.float8_e4m3fn,QuantType.per_Tensor,1,0,asm,stage1,32,_ZN5aiter47fmoe_stage1_bf16_pertokenFp8_g1u1_32x64_4tg_pf2E,107.831,31.452111111111087,0.00%,26.14,13075.78
97,32,7168,256,256,8,ActivationType.Gelu,torch.bfloat16,torch.float8_e4m3fn,torch.float8_e4m3fn,QuantType.per_Tensor,1,0,ck,stage2,32,moe_ck2stages_gemm2_256x32x128x256_1x4_TypeCast_v1_Nswizzle0_Quant1_MulRoutedWeight1_F8_F8_B16,57.2899,31.452111111111087,1.65%,49.2,24611.22
98,32,7168,256,256,8,ActivationType.Gelu,torch.bfloat16,torch.float8_e4m3fn,torch.float8_e4m3fn,QuantType.per_Tensor,1,1,ck,stage1,32,moe_ck2stages_gemm1_256x32x64x128_1x4_TypeCast_v1_Nswizzle0_Quant1_MulRoutedWeight1_gelu_F8_F8_B16,104.2429,30.149888888888903,0.00%,27.04,13525.85
98,32,7168,256,256,8,ActivationType.Gelu,torch.bfloat16,torch.float8_e4m3fn,torch.float8_e4m3fn,QuantType.per_Tensor,1,1,asm,stage1,32,_ZN5aiter56fmoe_stage1_bf16_pertokenFp8_doweight_g1u1_32x64_4tg_pf2E,107.8866,30.149888888888903,0.00%,26.13,13069.04
98,32,7168,256,256,8,ActivationType.Gelu,torch.bfloat16,torch.float8_e4m3fn,torch.float8_e4m3fn,QuantType.per_Tensor,1,1,ck,stage2,32,moe_ck2stages_gemm2_256x32x128x256_1x4_TypeCast_v1_Nswizzle0_Quant1_MulRoutedWeight0_F8_F8_B16,57.5761,30.149888888888903,0.00%,48.95,24488.88
99,32,7168,256,256,8,ActivationType.Gelu,torch.bfloat16,torch.float8_e4m3fn,torch.float8_e4m3fn,QuantType.per_Token,1,0,asm,stage1,16,_ZN5aiter47fmoe_stage1_bf16_pertokenFp8_g1u1_16x64_6tg_pf2E,99.3162,20.081111111111127,0.00%,28.38,14196.82
99,32,7168,256,256,8,ActivationType.Gelu,torch.bfloat16,torch.float8_e4m3fn,torch.float8_e4m3fn,QuantType.per_Token,1,0,ck,stage1,32,moe_ck2stages_gemm1_256x32x64x256_1x4_TypeCast_v1_Nswizzle0_Quant2_MulRoutedWeight0_gelu_F8_F8_B16,104.383,20.081111111111127,0.00%,27.0,13507.7
99,32,7168,256,256,8,ActivationType.Gelu,torch.bfloat16,torch.float8_e4m3fn,torch.float8_e4m3fn,QuantType.per_Token,1,0,ck,stage2,32,moe_ck2stages_gemm2_256x32x128x256_1x4_TypeCast_v1_Nswizzle0_Quant2_MulRoutedWeight1_F8_F8_B16,64.0849,20.081111111111127,1.63%,43.98,22001.66
99,32,7168,256,256,8,ActivationType.Gelu,torch.bfloat16,torch.float8_e4m3fn,torch.float8_e4m3fn,QuantType.per_Token,1,0,asm,asm_1stage,32,_ZN5aiter45fmoe_bf16_pertokenFp8_g1u1_vs_gelu_1tg_32x256E,154.6389,0.0,0.00%,18.23,9117.85
100,32,7168,256,256,8,ActivationType.Gelu,torch.bfloat16,torch.float8_e4m3fn,torch.float8_e4m3fn,QuantType.per_Token,1,1,asm,stage1,16,_ZN5aiter56fmoe_stage1_bf16_pertokenFp8_doweight_g1u1_16x64_6tg_pf2E,99.3464,20.20088888888885,0.00%,28.37,14192.5
100,32,7168,256,256,8,ActivationType.Gelu,torch.bfloat16,torch.float8_e4m3fn,torch.float8_e4m3fn,QuantType.per_Token,1,1,ck,stage1,32,moe_ck2stages_gemm1_256x32x64x256_1x4_TypeCast_v1_Nswizzle0_Quant2_MulRoutedWeight1_gelu_F8_F8_B16,104.4696,20.20088888888885,0.00%,26.98,13496.5
100,32,7168,256,256,8,ActivationType.Gelu,torch.bfloat16,torch.float8_e4m3fn,torch.float8_e4m3fn,QuantType.per_Token,1,1,ck,stage2,32,moe_ck2stages_gemm2_256x32x128x256_1x4_TypeCast_v1_Nswizzle0_Quant2_MulRoutedWeight0_F8_F8_B16,60.2967,20.20088888888885,0.00%,46.75,23383.94
100,32,7168,256,256,8,ActivationType.Gelu,torch.bfloat16,torch.float8_e4m3fn,torch.float8_e4m3fn,QuantType.per_Token,1,1,asm,asm_1stage,32,_ZN5aiter50fmoe_bf16_pertokenFp8_g1u1_vs_tkw1_gelu_1tg_32x256E,160.0609,0.0,0.00%,17.61,8808.99
101,32,7168,256,256,8,ActivationType.Silu,torch.bfloat16,torch.bfloat16,torch.bfloat16,QuantType.No,1,0,ck,stage1,32,moe_ck2stages_gemm1_256x32x64x128_1x4_TypeCast_v1_Nswizzle0_Quant0_MulRoutedWeight0_silu_B16_B16_B16,200.5593,0.0,0.00%,14.05,14058.14
101,32,7168,256,256,8,ActivationType.Silu,torch.bfloat16,torch.bfloat16,torch.bfloat16,QuantType.No,1,0,ck,stage2,32,moe_ck2stages_gemm2_256x32x128x128_1x4_TypeCast_v1_Nswizzle0_Quant0_MulRoutedWeight1_B16_B16_B16,102.808,0.0,1.37%,27.42,27424.81
102,32,7168,256,256,8,ActivationType.Silu,torch.bfloat16,torch.bfloat16,torch.bfloat16,QuantType.No,1,1,ck,stage1,32,moe_ck2stages_gemm1_256x32x64x128_1x4_TypeCast_v1_Nswizzle0_Quant0_MulRoutedWeight1_silu_B16_B16_B16,200.6477,0.0,0.00%,14.05,14051.94
102,32,7168,256,256,8,ActivationType.Silu,torch.bfloat16,torch.bfloat16,torch.bfloat16,QuantType.No,1,1,ck,stage2,64,moe_ck2stages_gemm2_256x64x128x128_1x4_TypeCast_v1_Nswizzle0_Quant0_MulRoutedWeight0_B16_B16_B16,101.0066,0.0,0.00%,27.9,27913.92
103,32,7168,256,256,8,ActivationType.Silu,torch.bfloat16,torch.float8_e4m3fn,torch.float8_e4m3fn,QuantType.per_Tensor,1,0,ck,stage1,32,moe_ck2stages_gemm1_256x32x64x256_1x4_TypeCast_v1_Nswizzle0_Quant1_MulRoutedWeight0_silu_F8_F8_B16,103.179,29.86522222222221,0.00%,27.32,13665.32
103,32,7168,256,256,8,ActivationType.Silu,torch.bfloat16,torch.float8_e4m3fn,torch.float8_e4m3fn,QuantType.per_Tensor,1,0,asm,stage1,16,_ZN5aiter47fmoe_stage1_bf16_pertokenFp8_g1u1_16x64_6tg_pf2E,108.5677,29.86522222222221,0.00%,25.96,12987.05
103,32,7168,256,256,8,ActivationType.Silu,torch.bfloat16,torch.float8_e4m3fn,torch.float8_e4m3fn,QuantType.per_Tensor,1,0,ck,stage2,32,moe_ck2stages_gemm2_256x32x128x256_1x4_TypeCast_v1_Nswizzle0_Quant1_MulRoutedWeight1_F8_F8_B16,57.0239,29.86522222222221,1.36%,49.43,24726.02
104,32,7168,256,256,8,ActivationType.Silu,torch.bfloat16,torch.float8_e4m3fn,torch.float8_e4m3fn,QuantType.per_Tensor,1,1,ck,stage1,32,moe_ck2stages_gemm1_256x32x64x256_1x4_TypeCast_v1_Nswizzle0_Quant1_MulRoutedWeight1_silu_F8_F8_B16,102.9314,29.10966666666664,0.00%,27.38,13698.19
104,32,7168,256,256,8,ActivationType.Silu,torch.bfloat16,torch.float8_e4m3fn,torch.float8_e4m3fn,QuantType.per_Tensor,1,1,asm,stage1,16,_ZN5aiter56fmoe_stage1_bf16_pertokenFp8_doweight_g1u1_16x64_6tg_pf2E,108.3886,29.10966666666664,0.00%,26.0,13008.51
104,32,7168,256,256,8,ActivationType.Silu,torch.bfloat16,torch.float8_e4m3fn,torch.float8_e4m3fn,QuantType.per_Tensor,1,1,ck,stage2,32,moe_ck2stages_gemm2_256x32x128x256_1x4_TypeCast_v1_Nswizzle0_Quant1_MulRoutedWeight0_F8_F8_B16,56.9045,29.10966666666664,0.00%,49.53,24777.9
105,32,7168,256,256,8,ActivationType.Silu,torch.bfloat16,torch.float8_e4m3fn,torch.float8_e4m3fn,QuantType.per_Token,1,0,asm,stage1,16,_ZN5aiter47fmoe_stage1_bf16_pertokenFp8_g1u1_16x64_6tg_pf2E,99.3773,20.4453333333333,0.00%,28.36,14188.09
105,32,7168,256,256,8,ActivationType.Silu,torch.bfloat16,torch.float8_e4m3fn,torch.float8_e4m3fn,QuantType.per_Token,1,0,ck,stage1,32,moe_ck2stages_gemm1_256x32x64x256_1x4_TypeCast_v1_Nswizzle0_Quant2_MulRoutedWeight0_silu_F8_F8_B16,104.6513,20.4453333333333,0.00%,26.93,13473.07
105,32,7168,256,256,8,ActivationType.Silu,torch.bfloat16,torch.float8_e4m3fn,torch.float8_e4m3fn,QuantType.per_Token,1,0,ck,stage2,32,moe_ck2stages_gemm2_256x32x128x256_1x4_TypeCast_v1_Nswizzle0_Quant2_MulRoutedWeight1_F8_F8_B16,63.9353,20.4453333333333,1.31%,44.08,22053.14
105,32,7168,256,256,8,ActivationType.Silu,torch.bfloat16,torch.float8_e4m3fn,torch.float8_e4m3fn,QuantType.per_Token,1,0,asm,asm_1stage,32,_ZN5aiter45fmoe_bf16_pertokenFp8_g1u1_vs_silu_1tg_32x256E,154.5952,0.0,0.00%,18.23,9120.43
106,32,7168,256,256,8,ActivationType.Silu,torch.bfloat16,torch.float8_e4m3fn,torch.float8_e4m3fn,QuantType.per_Token,1,1,asm,stage1,16,_ZN5aiter56fmoe_stage1_bf16_pertokenFp8_doweight_g1u1_16x64_6tg_pf2E,99.3529,23.93455555555563,0.00%,28.37,14191.58
106,32,7168,256,256,8,ActivationType.Silu,torch.bfloat16,torch.float8_e4m3fn,torch.float8_e4m3fn,QuantType.per_Token,1,1,ck,stage1,32,moe_ck2stages_gemm1_256x32x64x256_1x4_TypeCast_v1_Nswizzle0_Quant2_MulRoutedWeight1_silu_F8_F8_B16,103.4428,23.93455555555563,0.00%,27.25,13630.47
106,32,7168,256,256,8,ActivationType.Silu,torch.bfloat16,torch.float8_e4m3fn,torch.float8_e4m3fn,QuantType.per_Token,1,1,ck,stage2,32,moe_ck2stages_gemm2_256x32x128x256_1x4_TypeCast_v1_Nswizzle0_Quant2_MulRoutedWeight0_F8_F8_B16,60.5846,23.93455555555563,0.00%,46.52,23272.82
106,32,7168,256,256,8,ActivationType.Silu,torch.bfloat16,torch.float8_e4m3fn,torch.float8_e4m3fn,QuantType.per_Token,1,1,asm,asm_1stage,32,_ZN5aiter50fmoe_bf16_pertokenFp8_g1u1_vs_tkw1_silu_1tg_32x256E,159.9436,0.0,0.00%,17.62,8815.45
107,32,7168,256,256,8,ActivationType.Gelu,torch.bfloat16,torch.float8_e4m3fn,torch.float8_e4m3fn,QuantType.per_1x128,1,0,ck,stage1,16,moe_ck2stages_gemm1_128x16x128x128_1x2_MulABScaleExpertWeightA8W8blkscale_v1_Nswizzle0_Quant4_MulRoutedWeight0_gelu_F8_F8_B16,119.4651,25.39655555555554,0.10%,23.59,11802.39
107,32,7168,256,256,8,ActivationType.Gelu,torch.bfloat16,torch.float8_e4m3fn,torch.float8_e4m3fn,QuantType.per_1x128,1,0,ck,stage2,32,moe_ck2stages_gemm2_256x32x128x128_1x4_MulABScaleExpertWeightA8W8blkscale_v1_Nswizzle0_Quant4_MulRoutedWeight1_F8_F8_B16,57.747,25.39655555555554,15.66%,48.81,24416.41
107,32,7168,256,256,8,ActivationType.Gelu,torch.bfloat16,torch.float8_e4m3fn,torch.float8_e4m3fn,QuantType.per_1x128,1,0,asm,asm_1stage,32,_ZN5aiter47fmoe_bf16_blockscaleFp8_g1u1_vs_gelu_1tg_32x256E,154.4343,0.0,2.05%,18.25,9129.93
108,32,7168,256,256,8,ActivationType.Gelu,torch.bfloat16,torch.float8_e4m3fn,torch.float8_e4m3fn,QuantType.per_1x128,1,1,ck,stage1,16,moe_ck2stages_gemm1_128x16x128x128_1x2_MulABScaleExpertWeightA8W8blkscale_v1_Nswizzle0_Quant4_MulRoutedWeight1_gelu_F8_F8_B16,118.4895,25.82777777777769,0.14%,23.79,11899.57
108,32,7168,256,256,8,ActivationType.Gelu,torch.bfloat16,torch.float8_e4m3fn,torch.float8_e4m3fn,QuantType.per_1x128,1,1,ck,stage2,16,moe_ck2stages_gemm2_256x16x128x256_1x4_MulABScaleExpertWeightA8W8blkscale_v1_Nswizzle0_Quant4_MulRoutedWeight0_F8_F8_B16,57.3715,25.82777777777769,16.70%,49.13,24576.21
109,32,7168,256,256,8,ActivationType.Silu,torch.bfloat16,torch.float8_e4m3fn,torch.float8_e4m3fn,QuantType.per_1x128,1,1,ck,stage1,16,moe_ck2stages_gemm1_128x16x128x128_1x2_MulABScaleExpertWeightA8W8blkscale_v1_Nswizzle0_Quant4_MulRoutedWeight1_silu_F8_F8_B16,118.3899,25.23222222222224,0.11%,23.81,11909.58
109,32,7168,256,256,8,ActivationType.Silu,torch.bfloat16,torch.float8_e4m3fn,torch.float8_e4m3fn,QuantType.per_1x128,1,1,ck,stage2,16,moe_ck2stages_gemm2_256x16x128x256_1x4_MulABScaleExpertWeightA8W8blkscale_v1_Nswizzle0_Quant4_MulRoutedWeight0_F8_F8_B16,57.0403,25.23222222222224,16.69%,49.41,24718.91
110,32,7168,256,256,8,ActivationType.Silu,torch.bfloat16,torch.float8_e4m3fn,torch.float8_e4m3fn,QuantType.per_1x128,1,0,ck,stage1,16,moe_ck2stages_gemm1_128x16x128x128_1x2_MulABScaleExpertWeightA8W8blkscale_v1_Nswizzle0_Quant4_MulRoutedWeight0_silu_F8_F8_B16,118.3295,25.023222222222174,0.08%,23.82,11915.66
110,32,7168,256,256,8,ActivationType.Silu,torch.bfloat16,torch.float8_e4m3fn,torch.float8_e4m3fn,QuantType.per_1x128,1,0,ck,stage2,16,moe_ck2stages_gemm2_256x16x128x256_1x4_MulABScaleExpertWeightA8W8blkscale_v1_Nswizzle0_Quant4_MulRoutedWeight1_F8_F8_B16,57.1738,25.023222222222174,15.78%,49.3,24661.2
110,32,7168,256,256,8,ActivationType.Silu,torch.bfloat16,torch.float8_e4m3fn,torch.float8_e4m3fn,QuantType.per_1x128,1,0,asm,asm_1stage,32,_ZN5aiter50fmoe_bf16_blockscaleFp8_g1u1_vs_silu_1tg_ps_32x256E,155.2249,0.0,0.00%,18.16,9083.43
111,32,7168,256,257,9,ActivationType.Silu,torch.bfloat16,torch.float8_e4m3fn,torch.float8_e4m3fn,QuantType.per_Token,1,0,asm,stage1,16,_ZN5aiter47fmoe_stage1_bf16_pertokenFp8_g1u1_16x64_6tg_pf2E,108.5426,20.47222222222216,0.00%,29.21,13040.77
111,32,7168,256,257,9,ActivationType.Silu,torch.bfloat16,torch.float8_e4m3fn,torch.float8_e4m3fn,QuantType.per_Token,1,0,ck,stage1,32,moe_ck2stages_gemm1_256x32x64x128_1x4_TypeCast_v1_Nswizzle0_Quant2_MulRoutedWeight0_silu_F8_F8_B16,113.01,20.47222222222216,0.00%,28.06,12525.26
111,32,7168,256,257,9,ActivationType.Silu,torch.bfloat16,torch.float8_e4m3fn,torch.float8_e4m3fn,QuantType.per_Token,1,0,ck,stage2,32,moe_ck2stages_gemm2_256x32x128x256_1x4_TypeCast_v1_Nswizzle0_Quant2_MulRoutedWeight1_F8_F8_B16,68.5595,20.47222222222216,1.39%,46.25,20646.0
111,32,7168,256,257,9,ActivationType.Silu,torch.bfloat16,torch.float8_e4m3fn,torch.float8_e4m3fn,QuantType.per_Token,1,0,asm,asm_1stage,32,_ZN5aiter48fmoe_bf16_pertokenFp8_g1u1_vs_silu_1tg_ps_32x256E,168.8642,0.0,0.00%,18.78,8382.35
112,32,7168,256,257,9,ActivationType.Silu,torch.bfloat16,torch.float8_e4m3fn,torch.float8_e4m3fn,QuantType.per_1x128,1,0,ck,stage1,16,moe_ck2stages_gemm1_128x16x128x128_1x2_MulABScaleExpertWeightA8W8blkscale_v1_Nswizzle0_Quant4_MulRoutedWeight0_silu_F8_F8_B16,124.8775,22.20122222222227,0.09%,25.39,11334.94
112,32,7168,256,257,9,ActivationType.Silu,torch.bfloat16,torch.float8_e4m3fn,torch.float8_e4m3fn,QuantType.per_1x128,1,0,ck,stage2,32,moe_ck2stages_gemm2_256x32x128x128_1x4_MulABScaleExpertWeightA8W8blkscale_v1_Nswizzle0_Quant4_MulRoutedWeight1_F8_F8_B16,61.8256,22.20122222222227,17.01%,51.29,22894.71
112,32,7168,256,257,9,ActivationType.Silu,torch.bfloat16,torch.float8_e4m3fn,torch.float8_e4m3fn,QuantType.per_1x128,1,0,asm,asm_1stage,32,_ZN5aiter47fmoe_bf16_blockscaleFp8_g1u1_vs_silu_1tg_32x256E,166.7997,0.0,0.00%,19.01,8486.1
113,32,7168,512,256,8,ActivationType.Gelu,torch.bfloat16,torch.bfloat16,torch.bfloat16,QuantType.No,1,0,ck,stage1,32,moe_ck2stages_gemm1_256x32x64x128_1x4_TypeCast_v1_Nswizzle0_Quant0_MulRoutedWeight0_gelu_B16_B16_B16,385.2882,0.0,0.00%,14.63,14633.36
113,32,7168,512,256,8,ActivationType.Gelu,torch.bfloat16,torch.bfloat16,torch.bfloat16,QuantType.No,1,0,ck,stage2,32,moe_ck2stages_gemm2_256x32x128x128_1x4_TypeCast_v1_Nswizzle0_Quant0_MulRoutedWeight1_B16_B16_B16,193.2356,0.0,3.33%,29.17,29177.14
114,32,7168,512,256,8,ActivationType.Gelu,torch.bfloat16,torch.bfloat16,torch.bfloat16,QuantType.No,1,1,ck,stage1,32,moe_ck2stages_gemm1_256x32x64x128_1x4_TypeCast_v1_Nswizzle0_Quant0_MulRoutedWeight1_gelu_B16_B16_B16,385.0583,0.0,0.00%,14.64,14642.1
114,32,7168,512,256,8,ActivationType.Gelu,torch.bfloat16,torch.bfloat16,torch.bfloat16,QuantType.No,1,1,ck,stage2,64,moe_ck2stages_gemm2_256x64x128x128_1x4_TypeCast_v1_Nswizzle0_Quant0_MulRoutedWeight0_B16_B16_B16,191.4035,0.0,0.01%,29.45,29456.42
115,32,7168,512,256,8,ActivationType.Gelu,torch.bfloat16,torch.float8_e4m3fn,torch.float8_e4m3fn,QuantType.per_Tensor,1,0,ck,stage1,32,moe_ck2stages_gemm1_256x32x64x256_1x4_TypeCast_v1_Nswizzle0_Quant1_MulRoutedWeight0_gelu_F8_F8_B16,196.0103,24.739777777777785,0.00%,28.76,14383.23
115,32,7168,512,256,8,ActivationType.Gelu,torch.bfloat16,torch.float8_e4m3fn,torch.float8_e4m3fn,QuantType.per_Tensor,1,0,asm,stage1,16,_ZN5aiter47fmoe_stage1_bf16_pertokenFp8_g1u1_16x64_6tg_pf2E,205.1602,24.739777777777785,0.00%,27.48,13741.75
115,32,7168,512,256,8,ActivationType.Gelu,torch.bfloat16,torch.float8_e4m3fn,torch.float8_e4m3fn,QuantType.per_Tensor,1,0,ck,stage2,32,moe_ck2stages_gemm2_256x32x128x256_1x4_TypeCast_v1_Nswizzle0_Quant1_MulRoutedWeight1_F8_F8_B16,100.3034,24.739777777777785,3.38%,56.2,28107.33
116,32,7168,512,256,8,ActivationType.Gelu,torch.bfloat16,torch.float8_e4m3fn,torch.float8_e4m3fn,QuantType.per_Tensor,1,1,ck,stage1,32,moe_ck2stages_gemm1_256x32x64x256_1x4_TypeCast_v1_Nswizzle0_Quant1_MulRoutedWeight1_gelu_F8_F8_B16,193.9032,26.810999999999964,0.00%,29.07,14539.52
116,32,7168,512,256,8,ActivationType.Gelu,torch.bfloat16,torch.float8_e4m3fn,torch.float8_e4m3fn,QuantType.per_Tensor,1,1,asm,stage1,16,_ZN5aiter56fmoe_stage1_bf16_pertokenFp8_doweight_g1u1_16x64_6tg_pf2E,205.2202,26.810999999999964,0.00%,27.47,13737.73
116,32,7168,512,256,8,ActivationType.Gelu,torch.bfloat16,torch.float8_e4m3fn,torch.float8_e4m3fn,QuantType.per_Tensor,1,1,ck,stage2,32,moe_ck2stages_gemm2_256x32x128x256_1x4_TypeCast_v1_Nswizzle0_Quant1_MulRoutedWeight0_F8_F8_B16,100.2322,26.810999999999964,0.01%,56.24,28127.29
117,32,7168,512,256,8,ActivationType.Gelu,torch.bfloat16,torch.float8_e4m3fn,torch.float8_e4m3fn,QuantType.per_Token,1,0,asm,stage1,16,_ZN5aiter47fmoe_stage1_bf16_pertokenFp8_g1u1_16x64_6tg_pf2E,196.5198,24.46777777777776,0.00%,28.68,14345.94
117,32,7168,512,256,8,ActivationType.Gelu,torch.bfloat16,torch.float8_e4m3fn,torch.float8_e4m3fn,QuantType.per_Token,1,0,ck,stage1,32,moe_ck2stages_gemm1_256x32x64x256_1x4_TypeCast_v1_Nswizzle0_Quant2_MulRoutedWeight0_gelu_F8_F8_B16,204.1822,24.46777777777776,0.00%,27.61,13807.57
117,32,7168,512,256,8,ActivationType.Gelu,torch.bfloat16,torch.float8_e4m3fn,torch.float8_e4m3fn,QuantType.per_Token,1,0,ck,stage2,32,moe_ck2stages_gemm2_256x32x128x256_1x4_TypeCast_v1_Nswizzle0_Quant2_MulRoutedWeight1_F8_F8_B16,104.7561,24.46777777777776,3.37%,53.81,26912.61
117,32,7168,512,256,8,ActivationType.Gelu,torch.bfloat16,torch.float8_e4m3fn,torch.float8_e4m3fn,QuantType.per_Token,1,0,asm,asm_1stage,32,_ZN5aiter48fmoe_bf16_pertokenFp8_g1u1_vs_gelu_1tg_ps_32x512E,305.8258,0.0,0.00%,18.43,9218.52
118,32,7168,512,256,8,ActivationType.Gelu,torch.bfloat16,torch.float8_e4m3fn,torch.float8_e4m3fn,QuantType.per_Token,1,1,asm,stage1,16,_ZN5aiter56fmoe_stage1_bf16_pertokenFp8_doweight_g1u1_16x64_6tg_pf2E,195.8935,25.156555555555546,0.00%,28.78,14391.8
118,32,7168,512,256,8,ActivationType.Gelu,torch.bfloat16,torch.float8_e4m3fn,torch.float8_e4m3fn,QuantType.per_Token,1,1,ck,stage1,32,moe_ck2stages_gemm1_256x32x64x256_1x4_TypeCast_v1_Nswizzle0_Quant2_MulRoutedWeight1_gelu_F8_F8_B16,202.3913,25.156555555555546,0.00%,27.85,13929.75
118,32,7168,512,256,8,ActivationType.Gelu,torch.bfloat16,torch.float8_e4m3fn,torch.float8_e4m3fn,QuantType.per_Token,1,1,ck,stage2,32,moe_ck2stages_gemm2_256x32x128x256_1x4_TypeCast_v1_Nswizzle0_Quant2_MulRoutedWeight0_F8_F8_B16,104.0394,25.156555555555546,0.01%,54.18,27098.01
118,32,7168,512,256,8,ActivationType.Gelu,torch.bfloat16,torch.float8_e4m3fn,torch.float8_e4m3fn,QuantType.per_Token,1,1,asm,asm_1stage,32,_ZN5aiter50fmoe_bf16_pertokenFp8_g1u1_vs_tkw1_gelu_1tg_32x512E,309.3129,0.0,0.00%,18.22,9114.59
119,32,7168,512,256,8,ActivationType.Silu,torch.bfloat16,torch.bfloat16,torch.bfloat16,QuantType.No,1,1,ck,stage1,32,moe_ck2stages_gemm1_256x32x64x128_1x4_TypeCast_v1_Nswizzle0_Quant0_MulRoutedWeight1_silu_B16_B16_B16,384.724,0.0,0.00%,14.65,14654.82
119,32,7168,512,256,8,ActivationType.Silu,torch.bfloat16,torch.bfloat16,torch.bfloat16,QuantType.No,1,1,ck,stage2,64,moe_ck2stages_gemm2_256x64x128x128_1x4_TypeCast_v1_Nswizzle0_Quant0_MulRoutedWeight0_B16_B16_B16,191.0149,0.0,0.00%,29.51,29516.35
120,32,7168,512,256,8,ActivationType.Silu,torch.bfloat16,torch.float8_e4m3fn,torch.float8_e4m3fn,QuantType.per_Tensor,1,0,ck,stage1,32,moe_ck2stages_gemm1_256x32x64x256_1x4_TypeCast_v1_Nswizzle0_Quant1_MulRoutedWeight0_silu_F8_F8_B16,196.3278,26.85088888888886,0.00%,28.71,14359.97
120,32,7168,512,256,8,ActivationType.Silu,torch.bfloat16,torch.float8_e4m3fn,torch.float8_e4m3fn,QuantType.per_Tensor,1,0,asm,stage1,16,_ZN5aiter47fmoe_stage1_bf16_pertokenFp8_g1u1_16x64_6tg_pf2E,204.215,26.85088888888886,0.00%,27.6,13805.35
120,32,7168,512,256,8,ActivationType.Silu,torch.bfloat16,torch.float8_e4m3fn,torch.float8_e4m3fn,QuantType.per_Tensor,1,0,ck,stage2,32,moe_ck2stages_gemm2_256x32x128x256_1x4_TypeCast_v1_Nswizzle0_Quant1_MulRoutedWeight1_F8_F8_B16,100.231,26.85088888888886,2.82%,56.24,28127.63
121,32,7168,512,256,8,ActivationType.Silu,torch.bfloat16,torch.float8_e4m3fn,torch.float8_e4m3fn,QuantType.per_Tensor,1,1,ck,stage1,32,moe_ck2stages_gemm1_256x32x64x256_1x4_TypeCast_v1_Nswizzle0_Quant1_MulRoutedWeight1_silu_F8_F8_B16,195.2318,26.850999999999985,0.00%,28.87,14440.58
121,32,7168,512,256,8,ActivationType.Silu,torch.bfloat16,torch.float8_e4m3fn,torch.float8_e4m3fn,QuantType.per_Tensor,1,1,asm,stage1,16,_ZN5aiter56fmoe_stage1_bf16_pertokenFp8_doweight_g1u1_16x64_6tg_pf2E,205.1286,26.850999999999985,0.00%,27.48,13743.87
121,32,7168,512,256,8,ActivationType.Silu,torch.bfloat16,torch.float8_e4m3fn,torch.float8_e4m3fn,QuantType.per_Tensor,1,1,ck,stage2,32,moe_ck2stages_gemm2_256x32x128x256_1x4_TypeCast_v1_Nswizzle0_Quant1_MulRoutedWeight0_F8_F8_B16,100.1024,26.850999999999985,0.01%,56.31,28163.76
122,32,7168,512,256,8,ActivationType.Silu,torch.bfloat16,torch.float8_e4m3fn,torch.float8_e4m3fn,QuantType.per_Token,1,0,asm,stage1,16,_ZN5aiter47fmoe_stage1_bf16_pertokenFp8_g1u1_16x64_6tg_pf2E,195.4169,26.12544444444441,0.00%,28.85,14426.9
122,32,7168,512,256,8,ActivationType.Silu,torch.bfloat16,torch.float8_e4m3fn,torch.float8_e4m3fn,QuantType.per_Token,1,0,ck,stage1,32,moe_ck2stages_gemm1_256x32x64x256_1x4_TypeCast_v1_Nswizzle0_Quant2_MulRoutedWeight0_silu_F8_F8_B16,203.4554,26.12544444444441,0.00%,27.71,13856.9
122,32,7168,512,256,8,ActivationType.Silu,torch.bfloat16,torch.float8_e4m3fn,torch.float8_e4m3fn,QuantType.per_Token,1,0,ck,stage2,32,moe_ck2stages_gemm2_256x32x128x256_1x4_TypeCast_v1_Nswizzle0_Quant2_MulRoutedWeight1_F8_F8_B16,104.4003,26.12544444444441,2.80%,54.0,27004.33
122,32,7168,512,256,8,ActivationType.Silu,torch.bfloat16,torch.float8_e4m3fn,torch.float8_e4m3fn,QuantType.per_Token,1,0,asm,asm_1stage,32,_ZN5aiter45fmoe_bf16_pertokenFp8_g1u1_vs_silu_1tg_32x512E,304.6761,0.0,0.00%,18.5,9253.3
123,32,7168,512,256,8,ActivationType.Silu,torch.bfloat16,torch.float8_e4m3fn,torch.float8_e4m3fn,QuantType.per_Token,1,1,asm,stage1,16,_ZN5aiter56fmoe_stage1_bf16_pertokenFp8_doweight_g1u1_16x64_6tg_pf2E,196.1105,24.78333333333336,0.00%,28.74,14375.88
123,32,7168,512,256,8,ActivationType.Silu,torch.bfloat16,torch.float8_e4m3fn,torch.float8_e4m3fn,QuantType.per_Token,1,1,ck,stage1,32,moe_ck2stages_gemm1_256x32x64x256_1x4_TypeCast_v1_Nswizzle0_Quant2_MulRoutedWeight1_silu_F8_F8_B16,203.3339,24.78333333333336,0.00%,27.72,13865.18
123,32,7168,512,256,8,ActivationType.Silu,torch.bfloat16,torch.float8_e4m3fn,torch.float8_e4m3fn,QuantType.per_Token,1,1,ck,stage2,32,moe_ck2stages_gemm2_256x32x128x256_1x4_TypeCast_v1_Nswizzle0_Quant2_MulRoutedWeight0_F8_F8_B16,103.9999,24.78333333333336,0.00%,54.2,27108.3
123,32,7168,512,256,8,ActivationType.Silu,torch.bfloat16,torch.float8_e4m3fn,torch.float8_e4m3fn,QuantType.per_Token,1,1,asm,asm_1stage,32,_ZN5aiter50fmoe_bf16_pertokenFp8_g1u1_vs_tkw1_silu_1tg_32x512E,307.4408,0.0,0.00%,18.34,9170.09
124,32,7168,512,256,8,ActivationType.Silu,torch.bfloat16,torch.bfloat16,torch.bfloat16,QuantType.No,1,0,ck,stage1,32,moe_ck2stages_gemm1_256x32x64x128_1x4_TypeCast_v1_Nswizzle0_Quant0_MulRoutedWeight0_silu_B16_B16_B16,383.5719,0.0,0.00%,14.7,14698.84
124,32,7168,512,256,8,ActivationType.Silu,torch.bfloat16,torch.bfloat16,torch.bfloat16,QuantType.No,1,0,ck,stage2,32,moe_ck2stages_gemm2_256x32x128x128_1x4_TypeCast_v1_Nswizzle0_Quant0_MulRoutedWeight1_B16_B16_B16,193.4823,0.0,2.85%,29.14,29139.94
125,32,7168,512,256,8,ActivationType.Gelu,torch.bfloat16,torch.float8_e4m3fn,torch.float8_e4m3fn,QuantType.per_1x128,1,0,ck,stage1,16,moe_ck2stages_gemm1_128x16x128x128_1x2_MulABScaleExpertWeightA8W8blkscale_v1_Nswizzle0_Quant4_MulRoutedWeight0_gelu_F8_F8_B16,208.1237,25.62755555555556,0.12%,27.09,13546.08
125,32,7168,512,256,8,ActivationType.Gelu,torch.bfloat16,torch.float8_e4m3fn,torch.float8_e4m3fn,QuantType.per_1x128,1,0,ck,stage2,16,moe_ck2stages_gemm2_256x16x128x256_1x4_MulABScaleExpertWeightA8W8blkscale_v1_Nswizzle0_Quant4_MulRoutedWeight1_F8_F8_B16,100.6178,25.62755555555556,16.01%,56.03,28019.5
125,32,7168,512,256,8,ActivationType.Gelu,torch.bfloat16,torch.float8_e4m3fn,torch.float8_e4m3fn,QuantType.per_1x128,1,0,asm,asm_1stage,32,_ZN5aiter47fmoe_bf16_blockscaleFp8_g1u1_vs_gelu_1tg_32x256E,349.7382,0.0,10.20%,16.12,8061.06
126,32,7168,512,256,8,ActivationType.Silu,torch.bfloat16,torch.float8_e4m3fn,torch.float8_e4m3fn,QuantType.per_1x128,1,0,ck,stage1,16,moe_ck2stages_gemm1_256x16x128x256_1x4_MulABScaleExpertWeightA8W8blkscale_v1_Nswizzle0_Quant4_MulRoutedWeight0_silu_F8_F8_B16,206.9585,24.55200000000001,0.11%,27.24,13622.35
126,32,7168,512,256,8,ActivationType.Silu,torch.bfloat16,torch.float8_e4m3fn,torch.float8_e4m3fn,QuantType.per_1x128,1,0,ck,stage2,16,moe_ck2stages_gemm2_256x16x128x256_1x4_MulABScaleExpertWeightA8W8blkscale_v1_Nswizzle0_Quant4_MulRoutedWeight1_F8_F8_B16,100.8834,24.55200000000001,15.93%,55.88,27945.73
126,32,7168,512,256,8,ActivationType.Silu,torch.bfloat16,torch.float8_e4m3fn,torch.float8_e4m3fn,QuantType.per_1x128,1,0,asm,asm_1stage,32,_ZN5aiter47fmoe_bf16_blockscaleFp8_g1u1_vs_silu_1tg_32x256E,348.6922,0.0,0.00%,16.17,8085.24
127,32,7168,512,256,8,ActivationType.Gelu,torch.bfloat16,torch.float8_e4m3fn,torch.float8_e4m3fn,QuantType.per_1x128,1,1,ck,stage1,16,moe_ck2stages_gemm1_256x16x128x256_1x4_MulABScaleExpertWeightA8W8blkscale_v1_Nswizzle0_Quant4_MulRoutedWeight1_gelu_F8_F8_B16,208.3865,24.77422222222224,0.10%,27.05,13529.0
127,32,7168,512,256,8,ActivationType.Gelu,torch.bfloat16,torch.float8_e4m3fn,torch.float8_e4m3fn,QuantType.per_1x128,1,1,ck,stage2,16,moe_ck2stages_gemm2_256x16x128x256_1x4_MulABScaleExpertWeightA8W8blkscale_v1_Nswizzle0_Quant4_MulRoutedWeight0_F8_F8_B16,99.8601,24.77422222222224,16.77%,56.45,28232.1
128,32,7168,512,256,8,ActivationType.Silu,torch.bfloat16,torch.float8_e4m3fn,torch.float8_e4m3fn,QuantType.per_1x128,1,1,ck,stage1,16,moe_ck2stages_gemm1_256x16x128x256_1x4_MulABScaleExpertWeightA8W8blkscale_v1_Nswizzle0_Quant4_MulRoutedWeight1_silu_F8_F8_B16,208.4034,24.64988888888892,0.13%,27.05,13527.9
128,32,7168,512,256,8,ActivationType.Silu,torch.bfloat16,torch.float8_e4m3fn,torch.float8_e4m3fn,QuantType.per_1x128,1,1,ck,stage2,16,moe_ck2stages_gemm2_256x16x128x256_1x4_MulABScaleExpertWeightA8W8blkscale_v1_Nswizzle0_Quant4_MulRoutedWeight0_F8_F8_B16,101.066,24.64988888888892,16.78%,55.78,27895.24
129,32,7168,2048,33,10,ActivationType.Silu,torch.bfloat16,torch.float8_e4m3fn,torch.float8_e4m3fn,QuantType.per_1x128,1,0,ck,stage1,16,moe_ck2stages_gemm1_256x16x128x256_1x4_MulABScaleExpertWeightA8W8blkscale_v1_Nswizzle0_Quant4_MulRoutedWeight0_silu_F8_F8_B16,194.6337,30.027777777777747,0.12%,144.81,7470.52
129,32,7168,2048,33,10,ActivationType.Silu,torch.bfloat16,torch.float8_e4m3fn,torch.float8_e4m3fn,QuantType.per_1x128,1,0,ck,stage2,16,moe_ck2stages_gemm2_128x16x128x128_1x2_MulABScaleExpertWeightA8W8blkscale_v1_Nswizzle0_Quant4_MulRoutedWeight1_F8_F8_B16,99.4329,30.027777777777747,16.31%,283.46,14623.07
129,32,7168,2048,33,10,ActivationType.Silu,torch.bfloat16,torch.float8_e4m3fn,torch.float8_e4m3fn,QuantType.per_1x128,1,0,asm,asm_1stage,32,_ZN5aiter47fmoe_bf16_blockscaleFp8_g1u1_vs_silu_1tg_32x256E,345.2177,0.0,0.00%,81.65,4211.88
130,32,7168,2048,33,10,ActivationType.Silu,torch.bfloat16,torch.float8_e4m3fn,torch.float8_e4m3fn,QuantType.per_Token,1,0,asm,stage1,16,_ZN5aiter47fmoe_stage1_bf16_pertokenFp8_g1u1_16x64_5tg_pf3E,174.611,34.00544444444446,4.42%,161.42,8327.16
130,32,7168,2048,33,10,ActivationType.Silu,torch.bfloat16,torch.float8_e4m3fn,torch.float8_e4m3fn,QuantType.per_Token,1,0,ck,stage1,32,moe_ck2stages_gemm1_256x32x64x256_1x4_TypeCast_v1_Nswizzle0_Quant2_MulRoutedWeight0_silu_F8_F8_B16,180.6822,34.00544444444446,0.00%,156.0,8047.36
130,32,7168,2048,33,10,ActivationType.Silu,torch.bfloat16,torch.float8_e4m3fn,torch.float8_e4m3fn,QuantType.per_Token,1,0,ck,stage2,32,moe_ck2stages_gemm2_256x32x128x256_1x4_TypeCast_v1_Nswizzle0_Quant2_MulRoutedWeight1_F8_F8_B16,104.5801,34.00544444444446,7.34%,269.51,13903.36
130,32,7168,2048,33,10,ActivationType.Silu,torch.bfloat16,torch.float8_e4m3fn,torch.float8_e4m3fn,QuantType.per_Token,1,0,asm,asm_1stage,32,_ZN5aiter48fmoe_bf16_pertokenFp8_g1u1_vs_silu_1tg_ps_32x512E,282.8481,0.0,0.01%,99.65,5140.62
131,56,6144,4096,8,2,ActivationType.Silu,torch.bfloat16,torch.float8_e4m3fn,torch.float8_e4m3fn,QuantType.per_1x128,1,0,ck,stage1,32,moe_ck2stages_gemm1_256x32x128x128_1x4_MulABScaleExpertWeightA8W8blkscale_v1_Nswizzle0_Quant4_MulRoutedWeight0_silu_F8_F8_B16,76.4193,28.74322222222218,0.10%,221.3,7917.0
131,56,6144,4096,8,2,ActivationType.Silu,torch.bfloat16,torch.float8_e4m3fn,torch.float8_e4m3fn,QuantType.per_1x128,1,0,ck,stage2,16,moe_ck2stages_gemm2_128x16x128x128_1x2_MulABScaleExpertWeightA8W8blkscale_v1_Nswizzle0_Quant4_MulRoutedWeight1_F8_F8_B16,46.8803,28.74322222222218,5.24%,360.74,12905.46
131,56,6144,4096,8,2,ActivationType.Silu,torch.bfloat16,torch.float8_e4m3fn,torch.float8_e4m3fn,QuantType.per_1x128,1,0,asm,asm_1stage,32,_ZN5aiter49fmoe_bf16_blockscaleFp8_g1u1_novs_silu_1tg_32x256E,124.4108,0.0,0.45%,135.93,4863.02
132,64,2048,192,128,8,ActivationType.Silu,torch.bfloat16,torch.bfloat16,torch.bfloat16,QuantType.No,1,0,ck,stage1,32,moe_ck2stages_gemm1_256x32x64x64_1x4_TypeCast_v1_Nswizzle0_Quant0_MulRoutedWeight0_silu_B16_B16_B16,38.3562,0.0,0.00%,31.49,7886.97
132,64,2048,192,128,8,ActivationType.Silu,torch.bfloat16,torch.bfloat16,torch.bfloat16,QuantType.No,1,0,ck,stage2,32,moe_ck2stages_gemm2_256x32x64x64_1x4_TypeCast_v1_Nswizzle0_Quant0_MulRoutedWeight1_B16_B16_B16,24.8236,0.0,0.00%,48.66,12186.56
133,64,2048,192,128,8,ActivationType.Silu,torch.bfloat16,torch.bfloat16,torch.bfloat16,QuantType.No,1,1,ck,stage1,32,moe_ck2stages_gemm1_256x32x64x64_1x4_TypeCast_v1_Nswizzle0_Quant0_MulRoutedWeight1_silu_B16_B16_B16,38.7918,0.0,0.00%,31.14,7798.41
133,64,2048,192,128,8,ActivationType.Silu,torch.bfloat16,torch.bfloat16,torch.bfloat16,QuantType.No,1,1,ck,stage2,32,moe_ck2stages_gemm2_256x32x64x64_1x4_TypeCast_v1_Nswizzle0_Quant0_MulRoutedWeight0_B16_B16_B16,24.3155,0.0,0.00%,49.68,12441.21
134,64,2048,192,128,8,ActivationType.Gelu,torch.bfloat16,torch.bfloat16,torch.bfloat16,QuantType.No,1,0,ck,stage1,32,moe_ck2stages_gemm1_256x32x64x64_1x4_TypeCast_v1_Nswizzle0_Quant0_MulRoutedWeight0_gelu_B16_B16_B16,38.0355,0.0,0.00%,31.76,7953.47
134,64,2048,192,128,8,ActivationType.Gelu,torch.bfloat16,torch.bfloat16,torch.bfloat16,QuantType.No,1,0,ck,stage2,32,moe_ck2stages_gemm2_256x32x64x64_1x4_TypeCast_v1_Nswizzle0_Quant0_MulRoutedWeight1_B16_B16_B16,24.7081,0.0,0.00%,48.89,12243.52
135,64,2048,192,128,8,ActivationType.Gelu,torch.bfloat16,torch.bfloat16,torch.bfloat16,QuantType.No,1,1,ck,stage1,32,moe_ck2stages_gemm1_256x32x64x64_1x4_TypeCast_v1_Nswizzle0_Quant0_MulRoutedWeight1_gelu_B16_B16_B16,38.4497,0.0,0.00%,31.42,7867.79
135,64,2048,192,128,8,ActivationType.Gelu,torch.bfloat16,torch.bfloat16,torch.bfloat16,QuantType.No,1,1,ck,stage2,32,moe_ck2stages_gemm2_256x32x64x64_1x4_TypeCast_v1_Nswizzle0_Quant0_MulRoutedWeight0_B16_B16_B16,24.3139,0.0,0.00%,49.68,12442.03
136,64,4096,192,128,8,ActivationType.Silu,torch.bfloat16,torch.bfloat16,torch.bfloat16,QuantType.No,1,0,ck,stage1,32,moe_ck2stages_gemm1_256x32x64x64_1x4_TypeCast_v1_Nswizzle0_Quant0_MulRoutedWeight0_silu_B16_B16_B16,71.7432,0.0,0.00%,33.67,8433.25
136,64,4096,192,128,8,ActivationType.Silu,torch.bfloat16,torch.bfloat16,torch.bfloat16,QuantType.No,1,0,ck,stage2,32,moe_ck2stages_gemm2_256x32x64x64_1x4_TypeCast_v1_Nswizzle0_Quant0_MulRoutedWeight1_B16_B16_B16,40.8624,0.0,0.09%,59.12,14806.48
137,64,4096,192,128,8,ActivationType.Silu,torch.bfloat16,torch.bfloat16,torch.bfloat16,QuantType.No,1,1,ck,stage1,32,moe_ck2stages_gemm1_256x32x64x64_1x4_TypeCast_v1_Nswizzle0_Quant0_MulRoutedWeight1_silu_B16_B16_B16,71.918,0.0,0.00%,33.59,8412.75
137,64,4096,192,128,8,ActivationType.Silu,torch.bfloat16,torch.bfloat16,torch.bfloat16,QuantType.No,1,1,ck,stage2,32,moe_ck2stages_gemm2_256x32x64x64_1x4_TypeCast_v1_Nswizzle0_Quant0_MulRoutedWeight0_B16_B16_B16,40.5197,0.0,0.00%,59.62,14931.71
138,64,4096,192,128,8,ActivationType.Gelu,torch.bfloat16,torch.bfloat16,torch.bfloat16,QuantType.No,1,0,ck,stage1,32,moe_ck2stages_gemm1_256x32x64x64_1x4_TypeCast_v1_Nswizzle0_Quant0_MulRoutedWeight0_gelu_B16_B16_B16,71.2174,0.0,0.00%,33.92,8495.51
138,64,4096,192,128,8,ActivationType.Gelu,torch.bfloat16,torch.bfloat16,torch.bfloat16,QuantType.No,1,0,ck,stage2,32,moe_ck2stages_gemm2_256x32x64x64_1x4_TypeCast_v1_Nswizzle0_Quant0_MulRoutedWeight1_B16_B16_B16,40.7824,0.0,0.14%,59.24,14835.53
139,64,4096,192,128,8,ActivationType.Gelu,torch.bfloat16,torch.bfloat16,torch.bfloat16,QuantType.No,1,1,ck,stage1,32,moe_ck2stages_gemm1_256x32x64x64_1x4_TypeCast_v1_Nswizzle0_Quant0_MulRoutedWeight1_gelu_B16_B16_B16,71.8122,0.0,0.00%,33.64,8425.15
139,64,4096,192,128,8,ActivationType.Gelu,torch.bfloat16,torch.bfloat16,torch.bfloat16,QuantType.No,1,1,ck,stage2,32,moe_ck2stages_gemm2_256x32x64x64_1x4_TypeCast_v1_Nswizzle0_Quant0_MulRoutedWeight0_B16_B16_B16,40.2075,0.0,0.00%,60.09,15047.65
140,64,4096,384,128,8,ActivationType.Gelu,torch.bfloat16,torch.bfloat16,torch.bfloat16,QuantType.No,1,0,ck,stage1,32,moe_ck2stages_gemm1_256x32x64x128_1x4_TypeCast_v1_Nswizzle0_Quant0_MulRoutedWeight0_gelu_B16_B16_B16,136.8899,0.0,0.00%,35.3,8831.97
140,64,4096,384,128,8,ActivationType.Gelu,torch.bfloat16,torch.bfloat16,torch.bfloat16,QuantType.No,1,0,ck,stage2,32,moe_ck2stages_gemm2_256x32x128x128_1x4_TypeCast_v1_Nswizzle0_Quant0_MulRoutedWeight1_B16_B16_B16,75.2221,0.0,0.46%,64.23,16072.51
141,64,4096,384,128,8,ActivationType.Gelu,torch.bfloat16,torch.bfloat16,torch.bfloat16,QuantType.No,1,1,ck,stage1,32,moe_ck2stages_gemm1_256x32x64x128_1x4_TypeCast_v1_Nswizzle0_Quant0_MulRoutedWeight1_gelu_B16_B16_B16,136.4047,0.0,0.00%,35.42,8863.39
141,64,4096,384,128,8,ActivationType.Gelu,torch.bfloat16,torch.bfloat16,torch.bfloat16,QuantType.No,1,1,ck,stage2,32,moe_ck2stages_gemm2_256x32x128x128_1x4_TypeCast_v1_Nswizzle0_Quant0_MulRoutedWeight0_B16_B16_B16,75.1091,0.0,0.00%,64.33,16096.69
142,64,4096,384,128,8,ActivationType.Silu,torch.bfloat16,torch.bfloat16,torch.bfloat16,QuantType.No,1,0,ck,stage1,32,moe_ck2stages_gemm1_256x32x64x128_1x4_TypeCast_v1_Nswizzle0_Quant0_MulRoutedWeight0_silu_B16_B16_B16,136.4247,0.0,0.00%,35.42,8862.09
142,64,4096,384,128,8,ActivationType.Silu,torch.bfloat16,torch.bfloat16,torch.bfloat16,QuantType.No,1,0,ck,stage2,32,moe_ck2stages_gemm2_256x32x128x128_1x4_TypeCast_v1_Nswizzle0_Quant0_MulRoutedWeight1_B16_B16_B16,74.9172,0.0,0.36%,64.5,16137.92
143,64,4096,384,128,8,ActivationType.Silu,torch.bfloat16,torch.bfloat16,torch.bfloat16,QuantType.No,1,1,ck,stage1,32,moe_ck2stages_gemm1_256x32x64x128_1x4_TypeCast_v1_Nswizzle0_Quant0_MulRoutedWeight1_silu_B16_B16_B16,137.1067,0.0,0.00%,35.24,8818.01
143,64,4096,384,128,8,ActivationType.Silu,torch.bfloat16,torch.bfloat16,torch.bfloat16,QuantType.No,1,1,ck,stage2,32,moe_ck2stages_gemm2_256x32x128x128_1x4_TypeCast_v1_Nswizzle0_Quant0_MulRoutedWeight0_B16_B16_B16,75.1844,0.0,0.00%,64.27,16080.57
144,64,4096,384,128,8,ActivationType.Silu,torch.bfloat16,torch.float8_e4m3fn,torch.float8_e4m3fn,QuantType.per_Tensor,1,0,ck,stage1,32,moe_ck2stages_gemm1_256x32x64x256_1x4_TypeCast_v1_Nswizzle0_Quant1_MulRoutedWeight0_silu_F8_F8_B16,71.315,25.277555555555555,0.00%,67.75,8480.21
144,64,4096,384,128,8,ActivationType.Silu,torch.bfloat16,torch.float8_e4m3fn,torch.float8_e4m3fn,QuantType.per_Tensor,1,0,asm,stage1,32,_ZN5aiter48fmoe_stage1_bf16_pertokenFp8_g1u1_32x128_3tg_pf2E,76.3795,25.277555555555555,0.00%,63.26,7917.91
144,64,4096,384,128,8,ActivationType.Silu,torch.bfloat16,torch.float8_e4m3fn,torch.float8_e4m3fn,QuantType.per_Tensor,1,0,ck,stage2,128,moe_ck2stages_gemm2_256x128x128x128_1x4_TypeCast_v3_Nswizzle0_Quant1_MulRoutedWeight1_F8_F8_B16,59.7109,25.277555555555555,0.36%,80.92,10128.24
145,64,4096,384,128,8,ActivationType.Silu,torch.bfloat16,torch.float8_e4m3fn,torch.float8_e4m3fn,QuantType.per_Tensor,1,1,ck,stage1,32,moe_ck2stages_gemm1_256x32x64x256_1x4_TypeCast_v1_Nswizzle0_Quant1_MulRoutedWeight1_silu_F8_F8_B16,71.2512,27.899666666666647,0.00%,67.81,8487.8
145,64,4096,384,128,8,ActivationType.Silu,torch.bfloat16,torch.float8_e4m3fn,torch.float8_e4m3fn,QuantType.per_Tensor,1,1,asm,stage1,32,_ZN5aiter57fmoe_stage1_bf16_pertokenFp8_doweight_g1u1_32x128_3tg_pf2E,76.6478,27.899666666666647,0.00%,63.04,7890.2
145,64,4096,384,128,8,ActivationType.Silu,torch.bfloat16,torch.float8_e4m3fn,torch.float8_e4m3fn,QuantType.per_Tensor,1,1,ck,stage2,128,moe_ck2stages_gemm2_256x128x128x128_1x4_TypeCast_v3_Nswizzle0_Quant1_MulRoutedWeight0_F8_F8_B16,57.0269,27.899666666666647,0.00%,84.73,10604.93
146,64,4096,384,128,8,ActivationType.Silu,torch.bfloat16,torch.float8_e4m3fn,torch.float8_e4m3fn,QuantType.per_Token,1,0,asm,stage1,32,_ZN5aiter48fmoe_stage1_bf16_pertokenFp8_g1u1_32x128_3tg_pf2E,67.973,21.912111111111148,0.00%,71.08,8897.15
146,64,4096,384,128,8,ActivationType.Silu,torch.bfloat16,torch.float8_e4m3fn,torch.float8_e4m3fn,QuantType.per_Token,1,0,ck,stage1,32,moe_ck2stages_gemm1_256x32x64x256_1x4_TypeCast_v1_Nswizzle0_Quant2_MulRoutedWeight0_silu_F8_F8_B16,72.0403,21.912111111111148,0.00%,67.07,8394.83
146,64,4096,384,128,8,ActivationType.Silu,torch.bfloat16,torch.float8_e4m3fn,torch.float8_e4m3fn,QuantType.per_Token,1,0,ck,stage2,128,moe_ck2stages_gemm2_256x128x128x128_1x4_TypeCast_v3_Nswizzle0_Quant2_MulRoutedWeight1_F8_F8_B16,91.8408,21.912111111111148,0.35%,52.61,6584.94
146,64,4096,384,128,8,ActivationType.Silu,torch.bfloat16,torch.float8_e4m3fn,torch.float8_e4m3fn,QuantType.per_Token,1,0,asm,asm_1stage,32,_ZN5aiter45fmoe_bf16_pertokenFp8_g1u1_vs_silu_1tg_32x192E,113.8887,0.0,0.00%,42.43,5310.15
147,64,4096,384,128,8,ActivationType.Silu,torch.bfloat16,torch.float8_e4m3fn,torch.float8_e4m3fn,QuantType.per_Token,1,1,asm,stage1,16,_ZN5aiter57fmoe_stage1_bf16_pertokenFp8_doweight_g1u1_16x128_4tg_pf2E,68.0683,21.4055555555555,0.01%,70.99,8884.7
147,64,4096,384,128,8,ActivationType.Silu,torch.bfloat16,torch.float8_e4m3fn,torch.float8_e4m3fn,QuantType.per_Token,1,1,ck,stage1,32,moe_ck2stages_gemm1_256x32x64x256_1x4_TypeCast_v1_Nswizzle0_Quant2_MulRoutedWeight1_silu_F8_F8_B16,71.9702,21.4055555555555,0.00%,67.14,8403.01
147,64,4096,384,128,8,ActivationType.Silu,torch.bfloat16,torch.float8_e4m3fn,torch.float8_e4m3fn,QuantType.per_Token,1,1,ck,stage2,128,moe_ck2stages_gemm2_256x128x128x128_1x4_TypeCast_v3_Nswizzle0_Quant2_MulRoutedWeight0_F8_F8_B16,87.977,21.4055555555555,0.00%,54.92,6874.14
147,64,4096,384,128,8,ActivationType.Silu,torch.bfloat16,torch.float8_e4m3fn,torch.float8_e4m3fn,QuantType.per_Token,1,1,asm,asm_1stage,32,_ZN5aiter53fmoe_bf16_pertokenFp8_g1u1_vs_tkw1_silu_1tg_ps_32x192E,115.4107,0.0,0.00%,41.87,5240.12
148,64,4096,384,128,8,ActivationType.Gelu,torch.bfloat16,torch.float8_e4m3fn,torch.float8_e4m3fn,QuantType.per_Tensor,1,0,ck,stage1,32,moe_ck2stages_gemm1_256x32x64x256_1x4_TypeCast_v1_Nswizzle0_Quant1_MulRoutedWeight0_gelu_F8_F8_B16,71.0632,25.264333333333305,0.00%,67.99,8510.26
148,64,4096,384,128,8,ActivationType.Gelu,torch.bfloat16,torch.float8_e4m3fn,torch.float8_e4m3fn,QuantType.per_Tensor,1,0,asm,stage1,16,_ZN5aiter48fmoe_stage1_bf16_pertokenFp8_g1u1_16x128_4tg_pf2E,76.8483,25.264333333333305,0.00%,62.88,7869.61
148,64,4096,384,128,8,ActivationType.Gelu,torch.bfloat16,torch.float8_e4m3fn,torch.float8_e4m3fn,QuantType.per_Tensor,1,0,ck,stage2,128,moe_ck2stages_gemm2_256x128x128x128_1x4_TypeCast_v3_Nswizzle0_Quant1_MulRoutedWeight1_F8_F8_B16,59.4388,25.264333333333305,0.51%,81.29,10174.6
149,64,4096,384,128,8,ActivationType.Gelu,torch.bfloat16,torch.float8_e4m3fn,torch.float8_e4m3fn,QuantType.per_Tensor,1,1,ck,stage1,32,moe_ck2stages_gemm1_256x32x64x128_1x4_TypeCast_v1_Nswizzle0_Quant1_MulRoutedWeight1_gelu_F8_F8_B16,71.1158,25.321888888888875,0.00%,67.94,8503.96
149,64,4096,384,128,8,ActivationType.Gelu,torch.bfloat16,torch.float8_e4m3fn,torch.float8_e4m3fn,QuantType.per_Tensor,1,1,asm,stage1,16,_ZN5aiter57fmoe_stage1_bf16_pertokenFp8_doweight_g1u1_16x128_4tg_pf2E,77.063,25.321888888888875,0.00%,62.7,7847.69
149,64,4096,384,128,8,ActivationType.Gelu,torch.bfloat16,torch.float8_e4m3fn,torch.float8_e4m3fn,QuantType.per_Tensor,1,1,ck,stage2,128,moe_ck2stages_gemm2_256x128x128x128_1x4_TypeCast_v3_Nswizzle0_Quant1_MulRoutedWeight0_F8_F8_B16,56.8357,25.321888888888875,0.00%,85.01,10640.6
150,64,4096,384,128,8,ActivationType.Gelu,torch.bfloat16,torch.float8_e4m3fn,torch.float8_e4m3fn,QuantType.per_Token,1,0,asm,stage1,16,_ZN5aiter47fmoe_stage1_bf16_pertokenFp8_g1u1_16x64_6tg_pf2E,68.2632,22.810000000000027,0.00%,70.78,8859.33
150,64,4096,384,128,8,ActivationType.Gelu,torch.bfloat16,torch.float8_e4m3fn,torch.float8_e4m3fn,QuantType.per_Token,1,0,ck,stage1,32,moe_ck2stages_gemm1_256x32x64x256_1x4_TypeCast_v1_Nswizzle0_Quant2_MulRoutedWeight0_gelu_F8_F8_B16,71.8406,22.810000000000027,0.00%,67.26,8418.17
150,64,4096,384,128,8,ActivationType.Gelu,torch.bfloat16,torch.float8_e4m3fn,torch.float8_e4m3fn,QuantType.per_Token,1,0,ck,stage2,128,moe_ck2stages_gemm2_256x128x128x128_1x4_TypeCast_v3_Nswizzle0_Quant2_MulRoutedWeight1_F8_F8_B16,91.891,22.810000000000027,0.49%,52.58,6581.34
150,64,4096,384,128,8,ActivationType.Gelu,torch.bfloat16,torch.float8_e4m3fn,torch.float8_e4m3fn,QuantType.per_Token,1,0,asm,asm_1stage,32,_ZN5aiter45fmoe_bf16_pertokenFp8_g1u1_vs_gelu_1tg_32x192E,113.0238,0.0,0.00%,42.75,5350.79
151,64,4096,384,128,8,ActivationType.Gelu,torch.bfloat16,torch.float8_e4m3fn,torch.float8_e4m3fn,QuantType.per_Token,1,1,asm,stage1,16,_ZN5aiter57fmoe_stage1_bf16_pertokenFp8_doweight_g1u1_16x128_4tg_pf2E,68.0239,21.25877777777772,0.00%,71.03,8890.5
151,64,4096,384,128,8,ActivationType.Gelu,torch.bfloat16,torch.float8_e4m3fn,torch.float8_e4m3fn,QuantType.per_Token,1,1,ck,stage1,32,moe_ck2stages_gemm1_256x32x64x256_1x4_TypeCast_v1_Nswizzle0_Quant2_MulRoutedWeight1_gelu_F8_F8_B16,71.9277,21.25877777777772,0.00%,67.18,8407.97
151,64,4096,384,128,8,ActivationType.Gelu,torch.bfloat16,torch.float8_e4m3fn,torch.float8_e4m3fn,QuantType.per_Token,1,1,ck,stage2,128,moe_ck2stages_gemm2_256x128x128x128_1x4_TypeCast_v3_Nswizzle0_Quant2_MulRoutedWeight0_F8_F8_B16,87.9752,21.25877777777772,0.00%,54.92,6874.28
151,64,4096,384,128,8,ActivationType.Gelu,torch.bfloat16,torch.float8_e4m3fn,torch.float8_e4m3fn,QuantType.per_Token,1,1,asm,asm_1stage,32,_ZN5aiter50fmoe_bf16_pertokenFp8_g1u1_vs_tkw1_gelu_1tg_32x192E,114.7715,0.0,0.00%,42.1,5269.31
152,64,4096,384,128,8,ActivationType.Silu,torch.bfloat16,torch.float8_e4m3fn,torch.float8_e4m3fn,QuantType.per_1x128,1,0,ck,stage1,16,moe_ck2stages_gemm1_128x16x128x128_1x2_MulABScaleExpertWeightA8W8blkscale_v1_Nswizzle0_Quant4_MulRoutedWeight0_silu_F8_F8_B16,80.0501,27.31222222222217,0.11%,60.36,7554.85
152,64,4096,384,128,8,ActivationType.Silu,torch.bfloat16,torch.float8_e4m3fn,torch.float8_e4m3fn,QuantType.per_1x128,1,0,ck,stage2,16,moe_ck2stages_gemm2_128x16x128x128_1x2_MulABScaleExpertWeightA8W8blkscale_v1_Nswizzle0_Quant4_MulRoutedWeight1_F8_F8_B16,41.6228,27.31222222222217,15.61%,116.09,14529.69
153,64,4096,384,128,8,ActivationType.Gelu,torch.bfloat16,torch.float8_e4m3fn,torch.float8_e4m3fn,QuantType.per_1x128,1,0,ck,stage1,16,moe_ck2stages_gemm1_128x16x128x128_1x2_MulABScaleExpertWeightA8W8blkscale_v1_Nswizzle0_Quant4_MulRoutedWeight0_gelu_F8_F8_B16,80.0385,25.480888888888927,0.11%,60.37,7555.94
153,64,4096,384,128,8,ActivationType.Gelu,torch.bfloat16,torch.float8_e4m3fn,torch.float8_e4m3fn,QuantType.per_1x128,1,0,ck,stage2,16,moe_ck2stages_gemm2_128x16x128x128_1x2_MulABScaleExpertWeightA8W8blkscale_v1_Nswizzle0_Quant4_MulRoutedWeight1_F8_F8_B16,41.7766,25.480888888888927,15.51%,115.66,14476.19
154,64,4096,384,128,8,ActivationType.Silu,torch.bfloat16,torch.float8_e4m3fn,torch.float8_e4m3fn,QuantType.per_1x128,1,1,ck,stage1,16,moe_ck2stages_gemm1_128x16x128x128_1x2_MulABScaleExpertWeightA8W8blkscale_v1_Nswizzle0_Quant4_MulRoutedWeight1_silu_F8_F8_B16,79.8459,23.2321111111111,0.11%,60.51,7574.17
154,64,4096,384,128,8,ActivationType.Silu,torch.bfloat16,torch.float8_e4m3fn,torch.float8_e4m3fn,QuantType.per_1x128,1,1,ck,stage2,16,moe_ck2stages_gemm2_128x16x128x128_1x2_MulABScaleExpertWeightA8W8blkscale_v1_Nswizzle0_Quant4_MulRoutedWeight0_F8_F8_B16,42.2269,23.2321111111111,16.81%,114.43,14321.82
155,64,4096,384,128,8,ActivationType.Gelu,torch.bfloat16,torch.float8_e4m3fn,torch.float8_e4m3fn,QuantType.per_1x128,1,1,ck,stage1,16,moe_ck2stages_gemm1_128x16x128x128_1x2_MulABScaleExpertWeightA8W8blkscale_v1_Nswizzle0_Quant4_MulRoutedWeight1_gelu_F8_F8_B16,79.8621,23.796555555555567,0.12%,60.5,7572.63
155,64,4096,384,128,8,ActivationType.Gelu,torch.bfloat16,torch.float8_e4m3fn,torch.float8_e4m3fn,QuantType.per_1x128,1,1,ck,stage2,16,moe_ck2stages_gemm2_128x16x128x128_1x2_MulABScaleExpertWeightA8W8blkscale_v1_Nswizzle0_Quant4_MulRoutedWeight0_F8_F8_B16,41.7914,23.796555555555567,16.80%,115.62,14471.07
156,64,7168,256,256,8,ActivationType.Gelu,torch.bfloat16,torch.bfloat16,torch.bfloat16,QuantType.No,1,0,ck,stage1,32,moe_ck2stages_gemm1_256x32x64x128_1x4_TypeCast_v1_Nswizzle0_Quant0_MulRoutedWeight0_gelu_B16_B16_B16,276.3346,0.0,0.00%,20.4,10206.49
156,64,7168,256,256,8,ActivationType.Gelu,torch.bfloat16,torch.bfloat16,torch.bfloat16,QuantType.No,1,0,ck,stage2,32,moe_ck2stages_gemm2_256x32x128x128_1x4_TypeCast_v1_Nswizzle0_Quant0_MulRoutedWeight1_B16_B16_B16,140.9869,0.0,1.64%,39.98,20004.75
157,64,7168,256,256,8,ActivationType.Gelu,torch.bfloat16,torch.bfloat16,torch.bfloat16,QuantType.No,1,1,ck,stage1,32,moe_ck2stages_gemm1_256x32x64x128_1x4_TypeCast_v1_Nswizzle0_Quant0_MulRoutedWeight1_gelu_B16_B16_B16,276.1989,0.0,0.00%,20.41,10211.51
157,64,7168,256,256,8,ActivationType.Gelu,torch.bfloat16,torch.bfloat16,torch.bfloat16,QuantType.No,1,1,ck,stage2,64,moe_ck2stages_gemm2_256x64x128x128_1x4_TypeCast_v1_Nswizzle0_Quant0_MulRoutedWeight0_B16_B16_B16,139.6849,0.0,0.00%,40.36,20191.21
158,64,7168,256,256,8,ActivationType.Gelu,torch.bfloat16,torch.float8_e4m3fn,torch.float8_e4m3fn,QuantType.per_Tensor,1,0,ck,stage1,32,moe_ck2stages_gemm1_256x32x64x256_1x4_TypeCast_v1_Nswizzle0_Quant1_MulRoutedWeight0_gelu_F8_F8_B16,141.9118,24.43322222222225,0.00%,39.72,9940.42
158,64,7168,256,256,8,ActivationType.Gelu,torch.bfloat16,torch.float8_e4m3fn,torch.float8_e4m3fn,QuantType.per_Tensor,1,0,asm,stage1,16,_ZN5aiter48fmoe_stage1_bf16_pertokenFp8_g1u1_16x256_3tg_pf2E,146.9451,24.43322222222225,0.00%,38.36,9599.93
158,64,7168,256,256,8,ActivationType.Gelu,torch.bfloat16,torch.float8_e4m3fn,torch.float8_e4m3fn,QuantType.per_Tensor,1,0,ck,stage2,32,moe_ck2stages_gemm2_256x32x128x256_1x4_TypeCast_v1_Nswizzle0_Quant1_MulRoutedWeight1_F8_F8_B16,76.8185,24.43322222222225,1.62%,73.38,18363.58
159,64,7168,256,256,8,ActivationType.Gelu,torch.bfloat16,torch.float8_e4m3fn,torch.float8_e4m3fn,QuantType.per_Tensor,1,1,ck,stage1,32,moe_ck2stages_gemm1_256x32x64x256_1x4_TypeCast_v1_Nswizzle0_Quant1_MulRoutedWeight1_gelu_F8_F8_B16,142.4003,24.06433333333334,0.00%,39.59,9906.32
159,64,7168,256,256,8,ActivationType.Gelu,torch.bfloat16,torch.float8_e4m3fn,torch.float8_e4m3fn,QuantType.per_Tensor,1,1,asm,stage1,16,_ZN5aiter57fmoe_stage1_bf16_pertokenFp8_doweight_g1u1_16x128_4tg_pf2E,146.5309,24.06433333333334,0.02%,38.47,9627.06
159,64,7168,256,256,8,ActivationType.Gelu,torch.bfloat16,torch.float8_e4m3fn,torch.float8_e4m3fn,QuantType.per_Tensor,1,1,ck,stage2,32,moe_ck2stages_gemm2_256x32x128x256_1x4_TypeCast_v1_Nswizzle0_Quant1_MulRoutedWeight0_F8_F8_B16,76.8021,24.06433333333334,0.00%,73.4,18367.5
160,64,7168,256,256,8,ActivationType.Gelu,torch.bfloat16,torch.float8_e4m3fn,torch.float8_e4m3fn,QuantType.per_Token,1,0,asm,stage1,16,_ZN5aiter48fmoe_stage1_bf16_pertokenFp8_g1u1_16x128_4tg_pf2E,138.5847,20.805444444444504,0.07%,40.68,10179.06
160,64,7168,256,256,8,ActivationType.Gelu,torch.bfloat16,torch.float8_e4m3fn,torch.float8_e4m3fn,QuantType.per_Token,1,0,ck,stage1,32,moe_ck2stages_gemm1_256x32x64x256_1x4_TypeCast_v1_Nswizzle0_Quant2_MulRoutedWeight0_gelu_F8_F8_B16,142.1999,20.805444444444504,0.00%,39.64,9920.28
160,64,7168,256,256,8,ActivationType.Gelu,torch.bfloat16,torch.float8_e4m3fn,torch.float8_e4m3fn,QuantType.per_Token,1,0,ck,stage2,32,moe_ck2stages_gemm2_256x32x128x256_1x4_TypeCast_v1_Nswizzle0_Quant2_MulRoutedWeight1_F8_F8_B16,83.979,20.805444444444504,1.63%,67.13,16797.8
160,64,7168,256,256,8,ActivationType.Gelu,torch.bfloat16,torch.float8_e4m3fn,torch.float8_e4m3fn,QuantType.per_Token,1,0,asm,asm_1stage,32,_ZN5aiter45fmoe_bf16_pertokenFp8_g1u1_vs_gelu_1tg_32x256E,217.1329,0.0,0.00%,25.96,6496.77
161,64,7168,256,256,8,ActivationType.Gelu,torch.bfloat16,torch.float8_e4m3fn,torch.float8_e4m3fn,QuantType.per_Token,1,1,asm,stage1,16,_ZN5aiter57fmoe_stage1_bf16_pertokenFp8_doweight_g1u1_16x128_4tg_pf2E,138.6621,20.28533333333333,0.01%,40.65,10173.38
161,64,7168,256,256,8,ActivationType.Gelu,torch.bfloat16,torch.float8_e4m3fn,torch.float8_e4m3fn,QuantType.per_Token,1,1,ck,stage1,32,moe_ck2stages_gemm1_256x32x64x256_1x4_TypeCast_v1_Nswizzle0_Quant2_MulRoutedWeight1_gelu_F8_F8_B16,143.2627,20.28533333333333,0.00%,39.35,9846.68
161,64,7168,256,256,8,ActivationType.Gelu,torch.bfloat16,torch.float8_e4m3fn,torch.float8_e4m3fn,QuantType.per_Token,1,1,ck,stage2,32,moe_ck2stages_gemm2_256x32x128x256_1x4_TypeCast_v1_Nswizzle0_Quant2_MulRoutedWeight0_F8_F8_B16,80.4133,20.28533333333333,0.00%,70.1,17542.65
161,64,7168,256,256,8,ActivationType.Gelu,torch.bfloat16,torch.float8_e4m3fn,torch.float8_e4m3fn,QuantType.per_Token,1,1,asm,asm_1stage,32,_ZN5aiter53fmoe_bf16_pertokenFp8_g1u1_vs_tkw1_gelu_1tg_ps_32x256E,216.5198,0.0,0.00%,26.04,6515.17
162,64,7168,256,256,8,ActivationType.Silu,torch.bfloat16,torch.bfloat16,torch.bfloat16,QuantType.No,1,0,ck,stage1,32,moe_ck2stages_gemm1_256x32x64x128_1x4_TypeCast_v1_Nswizzle0_Quant0_MulRoutedWeight0_silu_B16_B16_B16,276.9386,0.0,0.00%,20.36,10184.23
162,64,7168,256,256,8,ActivationType.Silu,torch.bfloat16,torch.bfloat16,torch.bfloat16,QuantType.No,1,0,ck,stage2,32,moe_ck2stages_gemm2_256x32x128x128_1x4_TypeCast_v1_Nswizzle0_Quant0_MulRoutedWeight1_B16_B16_B16,141.2093,0.0,1.32%,39.92,19973.24
163,64,7168,256,256,8,ActivationType.Silu,torch.bfloat16,torch.bfloat16,torch.bfloat16,QuantType.No,1,1,ck,stage1,32,moe_ck2stages_gemm1_256x32x64x128_1x4_TypeCast_v1_Nswizzle0_Quant0_MulRoutedWeight1_silu_B16_B16_B16,277.8389,0.0,0.00%,20.29,10151.23
163,64,7168,256,256,8,ActivationType.Silu,torch.bfloat16,torch.bfloat16,torch.bfloat16,QuantType.No,1,1,ck,stage2,64,moe_ck2stages_gemm2_256x64x128x128_1x4_TypeCast_v1_Nswizzle0_Quant0_MulRoutedWeight0_B16_B16_B16,138.8641,0.0,0.00%,40.59,20310.56
164,64,7168,256,256,8,ActivationType.Silu,torch.bfloat16,torch.float8_e4m3fn,torch.float8_e4m3fn,QuantType.per_Tensor,1,0,ck,stage1,32,moe_ck2stages_gemm1_256x32x64x256_1x4_TypeCast_v1_Nswizzle0_Quant1_MulRoutedWeight0_silu_F8_F8_B16,141.0456,24.56188888888888,0.00%,39.97,10001.46
164,64,7168,256,256,8,ActivationType.Silu,torch.bfloat16,torch.float8_e4m3fn,torch.float8_e4m3fn,QuantType.per_Tensor,1,0,asm,stage1,16,_ZN5aiter48fmoe_stage1_bf16_pertokenFp8_g1u1_16x128_4tg_pf2E,146.7761,24.56188888888888,0.32%,38.41,9610.98
164,64,7168,256,256,8,ActivationType.Silu,torch.bfloat16,torch.float8_e4m3fn,torch.float8_e4m3fn,QuantType.per_Tensor,1,0,ck,stage2,32,moe_ck2stages_gemm2_256x32x128x256_1x4_TypeCast_v1_Nswizzle0_Quant1_MulRoutedWeight1_F8_F8_B16,76.1839,24.56188888888888,1.32%,73.99,18516.54
165,64,7168,256,256,8,ActivationType.Silu,torch.bfloat16,torch.float8_e4m3fn,torch.float8_e4m3fn,QuantType.per_Tensor,1,1,ck,stage1,32,moe_ck2stages_gemm1_256x32x64x256_1x4_TypeCast_v1_Nswizzle0_Quant1_MulRoutedWeight1_silu_F8_F8_B16,141.1015,25.228666666666665,0.00%,39.95,9997.5
165,64,7168,256,256,8,ActivationType.Silu,torch.bfloat16,torch.float8_e4m3fn,torch.float8_e4m3fn,QuantType.per_Tensor,1,1,asm,stage1,16,_ZN5aiter57fmoe_stage1_bf16_pertokenFp8_doweight_g1u1_16x256_3tg_pf2E,146.8815,25.228666666666665,0.01%,38.38,9604.08
165,64,7168,256,256,8,ActivationType.Silu,torch.bfloat16,torch.float8_e4m3fn,torch.float8_e4m3fn,QuantType.per_Tensor,1,1,ck,stage2,32,moe_ck2stages_gemm2_256x32x128x256_1x4_TypeCast_v1_Nswizzle0_Quant1_MulRoutedWeight0_F8_F8_B16,76.2793,25.228666666666665,0.00%,73.9,18493.38
166,64,7168,256,256,8,ActivationType.Silu,torch.bfloat16,torch.float8_e4m3fn,torch.float8_e4m3fn,QuantType.per_Token,1,0,asm,stage1,16,_ZN5aiter48fmoe_stage1_bf16_pertokenFp8_g1u1_16x128_4tg_pf2E,138.5388,20.330111111111137,0.29%,40.69,10182.44
166,64,7168,256,256,8,ActivationType.Silu,torch.bfloat16,torch.float8_e4m3fn,torch.float8_e4m3fn,QuantType.per_Token,1,0,ck,stage1,32,moe_ck2stages_gemm1_256x32x64x256_1x4_TypeCast_v1_Nswizzle0_Quant2_MulRoutedWeight0_silu_F8_F8_B16,142.2755,20.330111111111137,0.00%,39.62,9915.01
166,64,7168,256,256,8,ActivationType.Silu,torch.bfloat16,torch.float8_e4m3fn,torch.float8_e4m3fn,QuantType.per_Token,1,0,ck,stage2,32,moe_ck2stages_gemm2_256x32x128x256_1x4_TypeCast_v1_Nswizzle0_Quant2_MulRoutedWeight1_F8_F8_B16,84.6852,20.330111111111137,1.27%,66.57,16657.72
166,64,7168,256,256,8,ActivationType.Silu,torch.bfloat16,torch.float8_e4m3fn,torch.float8_e4m3fn,QuantType.per_Token,1,0,asm,asm_1stage,32,_ZN5aiter45fmoe_bf16_pertokenFp8_g1u1_vs_silu_1tg_32x256E,217.4425,0.0,0.00%,25.92,6487.52
167,64,7168,256,256,8,ActivationType.Silu,torch.bfloat16,torch.float8_e4m3fn,torch.float8_e4m3fn,QuantType.per_Token,1,1,asm,stage1,16,_ZN5aiter57fmoe_stage1_bf16_pertokenFp8_doweight_g1u1_16x256_3tg_pf2E,138.517,20.712111111111085,0.00%,40.7,10184.04
167,64,7168,256,256,8,ActivationType.Silu,torch.bfloat16,torch.float8_e4m3fn,torch.float8_e4m3fn,QuantType.per_Token,1,1,ck,stage1,32,moe_ck2stages_gemm1_256x32x64x256_1x4_TypeCast_v1_Nswizzle0_Quant2_MulRoutedWeight1_silu_F8_F8_B16,142.7352,20.712111111111085,0.00%,39.49,9883.07
167,64,7168,256,256,8,ActivationType.Silu,torch.bfloat16,torch.float8_e4m3fn,torch.float8_e4m3fn,QuantType.per_Token,1,1,ck,stage2,32,moe_ck2stages_gemm2_256x32x128x256_1x4_TypeCast_v1_Nswizzle0_Quant2_MulRoutedWeight0_F8_F8_B16,80.3685,20.712111111111085,0.00%,70.14,17552.43
167,64,7168,256,256,8,ActivationType.Silu,torch.bfloat16,torch.float8_e4m3fn,torch.float8_e4m3fn,QuantType.per_Token,1,1,asm,asm_1stage,32,_ZN5aiter50fmoe_bf16_pertokenFp8_g1u1_vs_tkw1_silu_1tg_32x256E,215.8041,0.0,0.00%,26.12,6536.77
168,64,7168,256,256,8,ActivationType.Gelu,torch.bfloat16,torch.float8_e4m3fn,torch.float8_e4m3fn,QuantType.per_1x128,1,0,ck,stage1,16,moe_ck2stages_gemm1_256x16x128x256_1x4_MulABScaleExpertWeightA8W8blkscale_v1_Nswizzle0_Quant4_MulRoutedWeight0_gelu_F8_F8_B16,144.0441,21.983333333333302,0.11%,39.13,9793.27
168,64,7168,256,256,8,ActivationType.Gelu,torch.bfloat16,torch.float8_e4m3fn,torch.float8_e4m3fn,QuantType.per_1x128,1,0,ck,stage2,32,moe_ck2stages_gemm2_256x32x128x128_1x4_MulABScaleExpertWeightA8W8blkscale_v1_Nswizzle0_Quant4_MulRoutedWeight1_F8_F8_B16,76.8365,21.983333333333302,15.76%,73.37,18359.27
168,64,7168,256,256,8,ActivationType.Gelu,torch.bfloat16,torch.float8_e4m3fn,torch.float8_e4m3fn,QuantType.per_1x128,1,0,asm,asm_1stage,32,_ZN5aiter49fmoe_bf16_blockscaleFp8_g1u1_novs_gelu_1tg_32x256E,212.0458,0.0,2.09%,26.58,6652.63
169,64,7168,256,256,8,ActivationType.Gelu,torch.bfloat16,torch.float8_e4m3fn,torch.float8_e4m3fn,QuantType.per_1x128,1,1,ck,stage1,16,moe_ck2stages_gemm1_256x16x128x256_1x4_MulABScaleExpertWeightA8W8blkscale_v1_Nswizzle0_Quant4_MulRoutedWeight1_gelu_F8_F8_B16,142.8999,22.29444444444448,0.12%,39.45,9871.68
169,64,7168,256,256,8,ActivationType.Gelu,torch.bfloat16,torch.float8_e4m3fn,torch.float8_e4m3fn,QuantType.per_1x128,1,1,ck,stage2,16,moe_ck2stages_gemm2_256x16x128x256_1x4_MulABScaleExpertWeightA8W8blkscale_v1_Nswizzle0_Quant4_MulRoutedWeight0_F8_F8_B16,77.2581,22.29444444444448,16.75%,72.97,18259.09
170,64,7168,256,256,8,ActivationType.Silu,torch.bfloat16,torch.float8_e4m3fn,torch.float8_e4m3fn,QuantType.per_1x128,1,1,ck,stage1,16,moe_ck2stages_gemm1_128x16x128x128_1x2_MulABScaleExpertWeightA8W8blkscale_v1_Nswizzle0_Quant4_MulRoutedWeight1_silu_F8_F8_B16,147.5395,22.032111111111096,0.11%,38.21,9561.25
170,64,7168,256,256,8,ActivationType.Silu,torch.bfloat16,torch.float8_e4m3fn,torch.float8_e4m3fn,QuantType.per_1x128,1,1,ck,stage2,16,moe_ck2stages_gemm2_256x16x128x256_1x4_MulABScaleExpertWeightA8W8blkscale_v1_Nswizzle0_Quant4_MulRoutedWeight0_F8_F8_B16,76.9109,22.032111111111096,16.61%,73.29,18341.51
171,64,7168,256,256,8,ActivationType.Silu,torch.bfloat16,torch.float8_e4m3fn,torch.float8_e4m3fn,QuantType.per_1x128,1,0,ck,stage1,16,moe_ck2stages_gemm1_256x16x128x256_1x4_MulABScaleExpertWeightA8W8blkscale_v1_Nswizzle0_Quant4_MulRoutedWeight0_silu_F8_F8_B16,142.695,25.2188888888889,0.09%,39.5,9885.86
171,64,7168,256,256,8,ActivationType.Silu,torch.bfloat16,torch.float8_e4m3fn,torch.float8_e4m3fn,QuantType.per_1x128,1,0,ck,stage2,16,moe_ck2stages_gemm2_256x16x128x256_1x4_MulABScaleExpertWeightA8W8blkscale_v1_Nswizzle0_Quant4_MulRoutedWeight1_F8_F8_B16,77.6662,25.2188888888889,15.82%,72.58,18163.14
171,64,7168,256,256,8,ActivationType.Silu,torch.bfloat16,torch.float8_e4m3fn,torch.float8_e4m3fn,QuantType.per_1x128,1,0,asm,asm_1stage,32,_ZN5aiter47fmoe_bf16_blockscaleFp8_g1u1_vs_silu_1tg_32x256E,212.9422,0.0,0.00%,26.47,6624.63
172,64,7168,256,257,9,ActivationType.Silu,torch.bfloat16,torch.float8_e4m3fn,torch.float8_e4m3fn,QuantType.per_Token,1,0,asm,stage1,16,_ZN5aiter48fmoe_stage1_bf16_pertokenFp8_g1u1_16x256_3tg_pf2E,141.7123,24.13433333333332,0.04%,44.75,9993.26
172,64,7168,256,257,9,ActivationType.Silu,torch.bfloat16,torch.float8_e4m3fn,torch.float8_e4m3fn,QuantType.per_Token,1,0,ck,stage1,64,moe_ck2stages_gemm1_256x64x64x256_1x4_TypeCast_v1_Nswizzle0_Quant2_MulRoutedWeight0_silu_F8_F8_B16,145.8995,24.13433333333332,0.00%,43.47,9706.46
172,64,7168,256,257,9,ActivationType.Silu,torch.bfloat16,torch.float8_e4m3fn,torch.float8_e4m3fn,QuantType.per_Token,1,0,ck,stage2,32,moe_ck2stages_gemm2_256x32x128x256_1x4_TypeCast_v1_Nswizzle0_Quant2_MulRoutedWeight1_F8_F8_B16,86.9867,24.13433333333332,1.38%,72.91,16280.28
172,64,7168,256,257,9,ActivationType.Silu,torch.bfloat16,torch.float8_e4m3fn,torch.float8_e4m3fn,QuantType.per_Token,1,0,asm,asm_1stage,32,_ZN5aiter45fmoe_bf16_pertokenFp8_g1u1_vs_silu_1tg_32x256E,221.4078,0.0,0.00%,28.64,6396.19
173,64,7168,256,257,9,ActivationType.Silu,torch.bfloat16,torch.float8_e4m3fn,torch.float8_e4m3fn,QuantType.per_1x128,1,0,ck,stage1,16,moe_ck2stages_gemm1_256x16x128x256_1x4_MulABScaleExpertWeightA8W8blkscale_v1_Nswizzle0_Quant4_MulRoutedWeight0_silu_F8_F8_B16,146.53,22.63211111111114,0.12%,43.28,9664.69
173,64,7168,256,257,9,ActivationType.Silu,torch.bfloat16,torch.float8_e4m3fn,torch.float8_e4m3fn,QuantType.per_1x128,1,0,ck,stage2,32,moe_ck2stages_gemm2_256x32x128x128_1x4_MulABScaleExpertWeightA8W8blkscale_v1_Nswizzle0_Quant4_MulRoutedWeight1_F8_F8_B16,79.8336,22.63211111111114,16.93%,79.44,17738.99
173,64,7168,256,257,9,ActivationType.Silu,torch.bfloat16,torch.float8_e4m3fn,torch.float8_e4m3fn,QuantType.per_1x128,1,0,asm,asm_1stage,32,_ZN5aiter52fmoe_bf16_blockscaleFp8_g1u1_novs_silu_1tg_ps_32x256E,218.4719,0.0,0.00%,29.03,6482.15
174,64,7168,512,256,8,ActivationType.Gelu,torch.bfloat16,torch.bfloat16,torch.bfloat16,QuantType.No,1,0,ck,stage1,32,moe_ck2stages_gemm1_256x32x64x128_1x4_TypeCast_v1_Nswizzle0_Quant0_MulRoutedWeight0_gelu_B16_B16_B16,563.6396,0.0,0.00%,20.0,10004.58
174,64,7168,512,256,8,ActivationType.Gelu,torch.bfloat16,torch.bfloat16,torch.bfloat16,QuantType.No,1,0,ck,stage2,64,moe_ck2stages_gemm2_256x64x64x64_1x4_TypeCast_v1_Nswizzle0_Quant0_MulRoutedWeight1_B16_B16_B16,266.1107,0.0,3.31%,42.37,21190.35
175,64,7168,512,256,8,ActivationType.Gelu,torch.bfloat16,torch.bfloat16,torch.bfloat16,QuantType.No,1,1,ck,stage1,32,moe_ck2stages_gemm1_256x32x64x128_1x4_TypeCast_v1_Nswizzle0_Quant0_MulRoutedWeight1_gelu_B16_B16_B16,565.1421,0.0,0.00%,19.95,9977.99
175,64,7168,512,256,8,ActivationType.Gelu,torch.bfloat16,torch.bfloat16,torch.bfloat16,QuantType.No,1,1,ck,stage2,64,moe_ck2stages_gemm2_256x64x128x128_1x4_TypeCast_v1_Nswizzle0_Quant0_MulRoutedWeight0_B16_B16_B16,263.9027,0.0,0.01%,42.72,21367.65
176,64,7168,512,256,8,ActivationType.Gelu,torch.bfloat16,torch.float8_e4m3fn,torch.float8_e4m3fn,QuantType.per_Tensor,1,0,asm,stage1,16,_ZN5aiter44fmoe_stage1_bf16_pertokenFp8_g1u1_16x512_pf3E,279.0969,25.024222222222257,0.00%,40.4,10103.83
176,64,7168,512,256,8,ActivationType.Gelu,torch.bfloat16,torch.float8_e4m3fn,torch.float8_e4m3fn,QuantType.per_Tensor,1,0,ck,stage1,32,moe_ck2stages_gemm1_256x32x64x256_1x4_TypeCast_v1_Nswizzle0_Quant1_MulRoutedWeight0_gelu_F8_F8_B16,284.516,25.024222222222257,0.00%,39.63,9911.39
176,64,7168,512,256,8,ActivationType.Gelu,torch.bfloat16,torch.float8_e4m3fn,torch.float8_e4m3fn,QuantType.per_Tensor,1,0,ck,stage2,32,moe_ck2stages_gemm2_256x32x128x256_1x4_TypeCast_v1_Nswizzle0_Quant1_MulRoutedWeight1_F8_F8_B16,139.2985,25.024222222222257,3.29%,80.94,20243.93
177,64,7168,512,256,8,ActivationType.Gelu,torch.bfloat16,torch.float8_e4m3fn,torch.float8_e4m3fn,QuantType.per_Tensor,1,1,asm,stage1,16,_ZN5aiter53fmoe_stage1_bf16_pertokenFp8_doweight_g1u1_16x512_pf3E,280.1933,26.033222222222246,0.00%,40.24,10064.3
177,64,7168,512,256,8,ActivationType.Gelu,torch.bfloat16,torch.float8_e4m3fn,torch.float8_e4m3fn,QuantType.per_Tensor,1,1,ck,stage1,32,moe_ck2stages_gemm1_256x32x64x256_1x4_TypeCast_v1_Nswizzle0_Quant1_MulRoutedWeight1_gelu_F8_F8_B16,285.0514,26.033222222222246,0.00%,39.55,9892.77
177,64,7168,512,256,8,ActivationType.Gelu,torch.bfloat16,torch.float8_e4m3fn,torch.float8_e4m3fn,QuantType.per_Tensor,1,1,ck,stage2,32,moe_ck2stages_gemm2_256x32x128x256_1x4_TypeCast_v1_Nswizzle0_Quant1_MulRoutedWeight0_F8_F8_B16,138.196,26.033222222222246,0.01%,81.58,20405.43
178,64,7168,512,256,8,ActivationType.Gelu,torch.bfloat16,torch.float8_e4m3fn,torch.float8_e4m3fn,QuantType.per_Token,1,0,asm,stage1,32,_ZN5aiter44fmoe_stage1_bf16_pertokenFp8_g1u1_32x512_pf2E,270.7322,21.663222222222227,0.00%,41.64,10416.01
178,64,7168,512,256,8,ActivationType.Gelu,torch.bfloat16,torch.float8_e4m3fn,torch.float8_e4m3fn,QuantType.per_Token,1,0,ck,stage1,64,moe_ck2stages_gemm1_256x64x64x256_1x4_TypeCast_v1_Nswizzle0_Quant2_MulRoutedWeight0_gelu_F8_F8_B16,295.3016,21.663222222222227,0.00%,38.18,9549.38
178,64,7168,512,256,8,ActivationType.Gelu,torch.bfloat16,torch.float8_e4m3fn,torch.float8_e4m3fn,QuantType.per_Token,1,0,ck,stage2,32,moe_ck2stages_gemm2_256x32x128x256_1x4_TypeCast_v1_Nswizzle0_Quant2_MulRoutedWeight1_F8_F8_B16,144.054,21.663222222222227,3.34%,78.26,19575.64
178,64,7168,512,256,8,ActivationType.Gelu,torch.bfloat16,torch.float8_e4m3fn,torch.float8_e4m3fn,QuantType.per_Token,1,0,asm,asm_1stage,32,_ZN5aiter48fmoe_bf16_pertokenFp8_g1u1_vs_gelu_1tg_ps_32x512E,425.3814,0.0,0.00%,26.5,6629.22
179,64,7168,512,256,8,ActivationType.Gelu,torch.bfloat16,torch.float8_e4m3fn,torch.float8_e4m3fn,QuantType.per_Token,1,1,asm,stage1,16,_ZN5aiter57fmoe_stage1_bf16_pertokenFp8_doweight_g1u1_16x256_3tg_pf2E,270.911,22.04100000000003,0.02%,41.62,10409.13
179,64,7168,512,256,8,ActivationType.Gelu,torch.bfloat16,torch.float8_e4m3fn,torch.float8_e4m3fn,QuantType.per_Token,1,1,ck,stage1,32,moe_ck2stages_gemm1_256x32x64x256_1x4_TypeCast_v1_Nswizzle0_Quant2_MulRoutedWeight1_gelu_F8_F8_B16,296.0617,22.04100000000003,0.00%,38.08,9524.87
179,64,7168,512,256,8,ActivationType.Gelu,torch.bfloat16,torch.float8_e4m3fn,torch.float8_e4m3fn,QuantType.per_Token,1,1,ck,stage2,32,moe_ck2stages_gemm2_256x32x128x256_1x4_TypeCast_v1_Nswizzle0_Quant2_MulRoutedWeight0_F8_F8_B16,143.9768,22.04100000000003,0.01%,78.31,19586.13
179,64,7168,512,256,8,ActivationType.Gelu,torch.bfloat16,torch.float8_e4m3fn,torch.float8_e4m3fn,QuantType.per_Token,1,1,asm,asm_1stage,32,_ZN5aiter53fmoe_bf16_pertokenFp8_g1u1_vs_tkw1_gelu_1tg_ps_32x512E,419.9992,0.0,0.00%,26.84,6714.18
180,64,7168,512,256,8,ActivationType.Silu,torch.bfloat16,torch.bfloat16,torch.bfloat16,QuantType.No,1,1,ck,stage1,32,moe_ck2stages_gemm1_256x32x64x128_1x4_TypeCast_v1_Nswizzle0_Quant0_MulRoutedWeight1_silu_B16_B16_B16,565.3758,0.0,0.00%,19.94,9973.86
180,64,7168,512,256,8,ActivationType.Silu,torch.bfloat16,torch.bfloat16,torch.bfloat16,QuantType.No,1,1,ck,stage2,64,moe_ck2stages_gemm2_256x64x128x128_1x4_TypeCast_v1_Nswizzle0_Quant0_MulRoutedWeight0_B16_B16_B16,263.657,0.0,0.00%,42.76,21387.56
181,64,7168,512,256,8,ActivationType.Silu,torch.bfloat16,torch.float8_e4m3fn,torch.float8_e4m3fn,QuantType.per_Tensor,1,0,asm,stage1,16,_ZN5aiter44fmoe_stage1_bf16_pertokenFp8_g1u1_16x512_pf3E,279.692,25.13966666666668,0.00%,40.31,10082.34
181,64,7168,512,256,8,ActivationType.Silu,torch.bfloat16,torch.float8_e4m3fn,torch.float8_e4m3fn,QuantType.per_Tensor,1,0,ck,stage1,32,moe_ck2stages_gemm1_256x32x64x256_1x4_TypeCast_v1_Nswizzle0_Quant1_MulRoutedWeight0_silu_F8_F8_B16,285.4967,25.13966666666668,0.00%,39.49,9877.34
181,64,7168,512,256,8,ActivationType.Silu,torch.bfloat16,torch.float8_e4m3fn,torch.float8_e4m3fn,QuantType.per_Tensor,1,0,ck,stage2,32,moe_ck2stages_gemm2_256x32x128x256_1x4_TypeCast_v1_Nswizzle0_Quant1_MulRoutedWeight1_F8_F8_B16,139.3923,25.13966666666668,2.83%,80.88,20230.3
182,64,7168,512,256,8,ActivationType.Silu,torch.bfloat16,torch.float8_e4m3fn,torch.float8_e4m3fn,QuantType.per_Tensor,1,1,asm,stage1,16,_ZN5aiter53fmoe_stage1_bf16_pertokenFp8_doweight_g1u1_16x512_pf3E,279.0059,25.699888888888893,0.00%,40.41,10107.13
182,64,7168,512,256,8,ActivationType.Silu,torch.bfloat16,torch.float8_e4m3fn,torch.float8_e4m3fn,QuantType.per_Tensor,1,1,ck,stage1,32,moe_ck2stages_gemm1_256x32x64x256_1x4_TypeCast_v1_Nswizzle0_Quant1_MulRoutedWeight1_silu_F8_F8_B16,285.7135,25.699888888888893,0.00%,39.46,9869.85
182,64,7168,512,256,8,ActivationType.Silu,torch.bfloat16,torch.float8_e4m3fn,torch.float8_e4m3fn,QuantType.per_Tensor,1,1,ck,stage2,32,moe_ck2stages_gemm2_256x32x128x256_1x4_TypeCast_v1_Nswizzle0_Quant1_MulRoutedWeight0_F8_F8_B16,139.1686,25.699888888888893,0.01%,81.01,20262.82
183,64,7168,512,256,8,ActivationType.Silu,torch.bfloat16,torch.float8_e4m3fn,torch.float8_e4m3fn,QuantType.per_Token,1,0,asm,stage1,16,_ZN5aiter48fmoe_stage1_bf16_pertokenFp8_g1u1_16x256_3tg_pf2E,270.6697,21.725333333333342,0.14%,41.65,10418.41
183,64,7168,512,256,8,ActivationType.Silu,torch.bfloat16,torch.float8_e4m3fn,torch.float8_e4m3fn,QuantType.per_Token,1,0,ck,stage1,64,moe_ck2stages_gemm1_256x64x64x256_1x4_TypeCast_v1_Nswizzle0_Quant2_MulRoutedWeight0_silu_F8_F8_B16,294.4103,21.725333333333342,0.00%,38.29,9578.29
183,64,7168,512,256,8,ActivationType.Silu,torch.bfloat16,torch.float8_e4m3fn,torch.float8_e4m3fn,QuantType.per_Token,1,0,ck,stage2,32,moe_ck2stages_gemm2_256x32x128x256_1x4_TypeCast_v1_Nswizzle0_Quant2_MulRoutedWeight1_F8_F8_B16,145.4276,21.725333333333342,2.81%,77.53,19390.74
183,64,7168,512,256,8,ActivationType.Silu,torch.bfloat16,torch.float8_e4m3fn,torch.float8_e4m3fn,QuantType.per_Token,1,0,asm,asm_1stage,32,_ZN5aiter45fmoe_bf16_pertokenFp8_g1u1_vs_silu_1tg_32x512E,424.4383,0.0,0.00%,26.56,6643.95
184,64,7168,512,256,8,ActivationType.Silu,torch.bfloat16,torch.float8_e4m3fn,torch.float8_e4m3fn,QuantType.per_Token,1,1,asm,stage1,16,_ZN5aiter57fmoe_stage1_bf16_pertokenFp8_doweight_g1u1_16x256_3tg_pf2E,270.7931,22.02333333333337,0.07%,41.63,10413.66
184,64,7168,512,256,8,ActivationType.Silu,torch.bfloat16,torch.float8_e4m3fn,torch.float8_e4m3fn,QuantType.per_Token,1,1,ck,stage1,32,moe_ck2stages_gemm1_256x32x64x256_1x4_TypeCast_v1_Nswizzle0_Quant2_MulRoutedWeight1_silu_F8_F8_B16,293.9462,22.02333333333337,0.00%,38.35,9593.42
184,64,7168,512,256,8,ActivationType.Silu,torch.bfloat16,torch.float8_e4m3fn,torch.float8_e4m3fn,QuantType.per_Token,1,1,ck,stage2,32,moe_ck2stages_gemm2_256x32x128x256_1x4_TypeCast_v1_Nswizzle0_Quant2_MulRoutedWeight0_F8_F8_B16,144.9567,22.02333333333337,0.00%,77.78,19453.73
184,64,7168,512,256,8,ActivationType.Silu,torch.bfloat16,torch.float8_e4m3fn,torch.float8_e4m3fn,QuantType.per_Token,1,1,asm,asm_1stage,32,_ZN5aiter53fmoe_bf16_pertokenFp8_g1u1_vs_tkw1_silu_1tg_ps_32x512E,426.0908,0.0,0.00%,26.46,6618.19
185,64,7168,512,256,8,ActivationType.Silu,torch.bfloat16,torch.bfloat16,torch.bfloat16,QuantType.No,1,0,ck,stage1,32,moe_ck2stages_gemm1_256x32x64x128_1x4_TypeCast_v1_Nswizzle0_Quant0_MulRoutedWeight0_silu_B16_B16_B16,565.4511,0.0,0.00%,19.94,9972.53
185,64,7168,512,256,8,ActivationType.Silu,torch.bfloat16,torch.bfloat16,torch.bfloat16,QuantType.No,1,0,ck,stage2,64,moe_ck2stages_gemm2_256x64x64x64_1x4_TypeCast_v1_Nswizzle0_Quant0_MulRoutedWeight1_B16_B16_B16,265.3272,0.0,2.84%,42.49,21252.93
186,64,7168,512,256,8,ActivationType.Gelu,torch.bfloat16,torch.float8_e4m3fn,torch.float8_e4m3fn,QuantType.per_1x128,1,0,ck,stage1,16,moe_ck2stages_gemm1_256x16x128x256_1x4_MulABScaleExpertWeightA8W8blkscale_v1_Nswizzle0_Quant4_MulRoutedWeight0_gelu_F8_F8_B16,283.595,24.009888888888863,0.11%,39.75,9943.58
186,64,7168,512,256,8,ActivationType.Gelu,torch.bfloat16,torch.float8_e4m3fn,torch.float8_e4m3fn,QuantType.per_1x128,1,0,ck,stage2,16,moe_ck2stages_gemm2_256x16x128x256_1x4_MulABScaleExpertWeightA8W8blkscale_v1_Nswizzle0_Quant4_MulRoutedWeight1_F8_F8_B16,141.5353,24.009888888888863,15.87%,79.66,19923.99
186,64,7168,512,256,8,ActivationType.Gelu,torch.bfloat16,torch.float8_e4m3fn,torch.float8_e4m3fn,QuantType.per_1x128,1,0,asm,asm_1stage,32,_ZN5aiter47fmoe_bf16_blockscaleFp8_g1u1_vs_gelu_1tg_32x256E,415.765,0.0,9.87%,27.12,6782.55
187,64,7168,512,256,8,ActivationType.Silu,torch.bfloat16,torch.float8_e4m3fn,torch.float8_e4m3fn,QuantType.per_1x128,1,0,ck,stage1,16,moe_ck2stages_gemm1_256x16x128x256_1x4_MulABScaleExpertWeightA8W8blkscale_v1_Nswizzle0_Quant4_MulRoutedWeight0_silu_F8_F8_B16,286.29,23.907777777777767,0.11%,39.38,9849.97
187,64,7168,512,256,8,ActivationType.Silu,torch.bfloat16,torch.float8_e4m3fn,torch.float8_e4m3fn,QuantType.per_1x128,1,0,ck,stage2,16,moe_ck2stages_gemm2_256x16x128x256_1x4_MulABScaleExpertWeightA8W8blkscale_v1_Nswizzle0_Quant4_MulRoutedWeight1_F8_F8_B16,141.1521,23.907777777777767,15.82%,79.87,19978.08
187,64,7168,512,256,8,ActivationType.Silu,torch.bfloat16,torch.float8_e4m3fn,torch.float8_e4m3fn,QuantType.per_1x128,1,0,asm,asm_1stage,32,_ZN5aiter47fmoe_bf16_blockscaleFp8_g1u1_vs_silu_1tg_32x256E,415.182,0.0,0.00%,27.16,6792.08
188,64,7168,512,256,8,ActivationType.Gelu,torch.bfloat16,torch.float8_e4m3fn,torch.float8_e4m3fn,QuantType.per_1x128,1,1,ck,stage1,16,moe_ck2stages_gemm1_256x16x128x256_1x4_MulABScaleExpertWeightA8W8blkscale_v1_Nswizzle0_Quant4_MulRoutedWeight1_gelu_F8_F8_B16,284.6507,23.889888888888915,0.11%,39.61,9906.7
188,64,7168,512,256,8,ActivationType.Gelu,torch.bfloat16,torch.float8_e4m3fn,torch.float8_e4m3fn,QuantType.per_1x128,1,1,ck,stage2,16,moe_ck2stages_gemm2_256x16x128x256_1x4_MulABScaleExpertWeightA8W8blkscale_v1_Nswizzle0_Quant4_MulRoutedWeight0_F8_F8_B16,140.1017,23.889888888888915,16.74%,80.47,20127.87
189,64,7168,512,256,8,ActivationType.Silu,torch.bfloat16,torch.float8_e4m3fn,torch.float8_e4m3fn,QuantType.per_1x128,1,1,ck,stage1,16,moe_ck2stages_gemm1_256x16x128x256_1x4_MulABScaleExpertWeightA8W8blkscale_v1_Nswizzle0_Quant4_MulRoutedWeight1_silu_F8_F8_B16,285.0686,23.805555555555525,0.13%,39.55,9892.18
189,64,7168,512,256,8,ActivationType.Silu,torch.bfloat16,torch.float8_e4m3fn,torch.float8_e4m3fn,QuantType.per_1x128,1,1,ck,stage2,16,moe_ck2stages_gemm2_256x16x128x256_1x4_MulABScaleExpertWeightA8W8blkscale_v1_Nswizzle0_Quant4_MulRoutedWeight0_F8_F8_B16,140.4709,23.805555555555525,16.73%,80.26,20074.97
190,64,7168,2048,33,10,ActivationType.Silu,torch.bfloat16,torch.float8_e4m3fn,torch.float8_e4m3fn,QuantType.per_1x128,1,0,ck,stage1,16,moe_ck2stages_gemm1_128x16x128x128_1x2_MulABScaleExpertWeightA8W8blkscale_v1_Nswizzle0_Quant4_MulRoutedWeight0_silu_F8_F8_B16,195.2605,34.85444444444448,0.12%,288.7,7450.06
190,64,7168,2048,33,10,ActivationType.Silu,torch.bfloat16,torch.float8_e4m3fn,torch.float8_e4m3fn,QuantType.per_1x128,1,0,ck,stage2,16,moe_ck2stages_gemm2_256x16x128x256_1x4_MulABScaleExpertWeightA8W8blkscale_v1_Nswizzle0_Quant4_MulRoutedWeight1_F8_F8_B16,101.8841,34.85444444444448,16.75%,553.29,14278.01
190,64,7168,2048,33,10,ActivationType.Silu,torch.bfloat16,torch.float8_e4m3fn,torch.float8_e4m3fn,QuantType.per_1x128,1,0,asm,asm_1stage,32,_ZN5aiter47fmoe_bf16_blockscaleFp8_g1u1_vs_silu_1tg_32x256E,354.4007,0.0,0.00%,159.06,4104.68
191,64,7168,2048,33,10,ActivationType.Silu,torch.bfloat16,torch.float8_e4m3fn,torch.float8_e4m3fn,QuantType.per_Token,1,0,asm,stage1,16,_ZN5aiter47fmoe_stage1_bf16_pertokenFp8_g1u1_16x64_5tg_pf3E,180.2921,36.85900000000002,5.95%,312.67,8068.59
191,64,7168,2048,33,10,ActivationType.Silu,torch.bfloat16,torch.float8_e4m3fn,torch.float8_e4m3fn,QuantType.per_Token,1,0,ck,stage1,32,moe_ck2stages_gemm1_256x32x64x256_1x4_TypeCast_v1_Nswizzle0_Quant2_MulRoutedWeight0_silu_F8_F8_B16,182.9091,36.85900000000002,0.00%,308.19,7953.14
191,64,7168,2048,33,10,ActivationType.Silu,torch.bfloat16,torch.float8_e4m3fn,torch.float8_e4m3fn,QuantType.per_Token,1,0,ck,stage2,32,moe_ck2stages_gemm2_256x32x128x256_1x4_TypeCast_v1_Nswizzle0_Quant2_MulRoutedWeight1_F8_F8_B16,106.3192,36.85900000000002,7.55%,530.21,13682.41
191,64,7168,2048,33,10,ActivationType.Silu,torch.bfloat16,torch.float8_e4m3fn,torch.float8_e4m3fn,QuantType.per_Token,1,0,asm,asm_1stage,32,_ZN5aiter48fmoe_bf16_pertokenFp8_g1u1_vs_silu_1tg_ps_32x512E,286.9894,0.0,0.00%,196.42,5068.84
192,128,2048,192,128,8,ActivationType.Silu,torch.bfloat16,torch.bfloat16,torch.bfloat16,QuantType.No,1,0,ck,stage1,32,moe_ck2stages_gemm1_256x32x64x64_1x4_TypeCast_v1_Nswizzle0_Quant0_MulRoutedWeight0_silu_B16_B16_B16,39.8278,0.0,0.00%,60.66,7608.72
192,128,2048,192,128,8,ActivationType.Silu,torch.bfloat16,torch.bfloat16,torch.bfloat16,QuantType.No,1,0,ck,stage2,32,moe_ck2stages_gemm2_256x32x64x64_1x4_TypeCast_v1_Nswizzle0_Quant0_MulRoutedWeight1_B16_B16_B16,25.5445,0.0,0.00%,94.58,11863.16
193,128,2048,192,128,8,ActivationType.Silu,torch.bfloat16,torch.bfloat16,torch.bfloat16,QuantType.No,1,1,ck,stage1,32,moe_ck2stages_gemm1_256x32x64x64_1x4_TypeCast_v1_Nswizzle0_Quant0_MulRoutedWeight1_silu_B16_B16_B16,39.604,0.0,0.00%,61.0,7651.71
193,128,2048,192,128,8,ActivationType.Silu,torch.bfloat16,torch.bfloat16,torch.bfloat16,QuantType.No,1,1,ck,stage2,32,moe_ck2stages_gemm2_256x32x64x64_1x4_TypeCast_v1_Nswizzle0_Quant0_MulRoutedWeight0_B16_B16_B16,25.0249,0.0,0.00%,96.54,12109.48
194,128,2048,192,128,8,ActivationType.Gelu,torch.bfloat16,torch.bfloat16,torch.bfloat16,QuantType.No,1,0,ck,stage1,32,moe_ck2stages_gemm1_256x32x64x64_1x4_TypeCast_v1_Nswizzle0_Quant0_MulRoutedWeight0_gelu_B16_B16_B16,39.5184,0.0,0.00%,61.13,7668.29
194,128,2048,192,128,8,ActivationType.Gelu,torch.bfloat16,torch.bfloat16,torch.bfloat16,QuantType.No,1,0,ck,stage2,32,moe_ck2stages_gemm2_256x32x64x64_1x4_TypeCast_v1_Nswizzle0_Quant0_MulRoutedWeight1_B16_B16_B16,25.4786,0.0,0.00%,94.82,11893.84
195,128,2048,192,128,8,ActivationType.Gelu,torch.bfloat16,torch.bfloat16,torch.bfloat16,QuantType.No,1,1,ck,stage1,32,moe_ck2stages_gemm1_256x32x64x64_1x4_TypeCast_v1_Nswizzle0_Quant0_MulRoutedWeight1_gelu_B16_B16_B16,39.6289,0.0,0.00%,60.96,7646.91
195,128,2048,192,128,8,ActivationType.Gelu,torch.bfloat16,torch.bfloat16,torch.bfloat16,QuantType.No,1,1,ck,stage2,32,moe_ck2stages_gemm2_256x32x64x64_1x4_TypeCast_v1_Nswizzle0_Quant0_MulRoutedWeight0_B16_B16_B16,24.9514,0.0,0.00%,96.82,12145.15
196,128,4096,192,128,8,ActivationType.Silu,torch.bfloat16,torch.bfloat16,torch.bfloat16,QuantType.No,1,0,ck,stage1,32,moe_ck2stages_gemm1_256x32x64x64_1x4_TypeCast_v1_Nswizzle0_Quant0_MulRoutedWeight0_silu_B16_B16_B16,73.096,0.0,0.00%,66.1,8291.52
196,128,4096,192,128,8,ActivationType.Silu,torch.bfloat16,torch.bfloat16,torch.bfloat16,QuantType.No,1,0,ck,stage2,32,moe_ck2stages_gemm2_256x32x64x64_1x4_TypeCast_v1_Nswizzle0_Quant0_MulRoutedWeight1_B16_B16_B16,42.0719,0.0,0.08%,114.85,14405.74
197,128,4096,192,128,8,ActivationType.Silu,torch.bfloat16,torch.bfloat16,torch.bfloat16,QuantType.No,1,1,ck,stage1,32,moe_ck2stages_gemm1_256x32x64x64_1x4_TypeCast_v1_Nswizzle0_Quant0_MulRoutedWeight1_silu_B16_B16_B16,73.9983,0.0,0.00%,65.3,8190.42
197,128,4096,192,128,8,ActivationType.Silu,torch.bfloat16,torch.bfloat16,torch.bfloat16,QuantType.No,1,1,ck,stage2,32,moe_ck2stages_gemm2_256x32x64x64_1x4_TypeCast_v1_Nswizzle0_Quant0_MulRoutedWeight0_B16_B16_B16,41.3355,0.0,0.00%,116.89,14662.38
198,128,4096,192,128,8,ActivationType.Gelu,torch.bfloat16,torch.bfloat16,torch.bfloat16,QuantType.No,1,0,ck,stage1,64,moe_ck2stages_gemm1_256x64x64x64_1x4_TypeCast_v1_Nswizzle0_Quant0_MulRoutedWeight0_gelu_B16_B16_B16,73.4625,0.0,0.00%,65.77,8250.15
198,128,4096,192,128,8,ActivationType.Gelu,torch.bfloat16,torch.bfloat16,torch.bfloat16,QuantType.No,1,0,ck,stage2,32,moe_ck2stages_gemm2_256x32x64x64_1x4_TypeCast_v1_Nswizzle0_Quant0_MulRoutedWeight1_B16_B16_B16,41.9287,0.0,0.12%,115.24,14454.94
199,128,4096,192,128,8,ActivationType.Gelu,torch.bfloat16,torch.bfloat16,torch.bfloat16,QuantType.No,1,1,ck,stage1,32,moe_ck2stages_gemm1_256x32x64x64_1x4_TypeCast_v1_Nswizzle0_Quant0_MulRoutedWeight1_gelu_B16_B16_B16,73.7299,0.0,0.00%,65.53,8220.23
199,128,4096,192,128,8,ActivationType.Gelu,torch.bfloat16,torch.bfloat16,torch.bfloat16,QuantType.No,1,1,ck,stage2,32,moe_ck2stages_gemm2_256x32x64x64_1x4_TypeCast_v1_Nswizzle0_Quant0_MulRoutedWeight0_B16_B16_B16,41.0283,0.0,0.00%,117.77,14772.17
200,128,4096,384,128,8,ActivationType.Gelu,torch.bfloat16,torch.bfloat16,torch.bfloat16,QuantType.No,1,0,ck,stage1,64,moe_ck2stages_gemm1_256x64x64x64_1x4_TypeCast_v1_Nswizzle0_Quant0_MulRoutedWeight0_gelu_B16_B16_B16,138.2342,0.0,0.00%,69.91,8753.67
200,128,4096,384,128,8,ActivationType.Gelu,torch.bfloat16,torch.bfloat16,torch.bfloat16,QuantType.No,1,0,ck,stage2,32,moe_ck2stages_gemm2_256x32x128x128_1x4_TypeCast_v1_Nswizzle0_Quant0_MulRoutedWeight1_B16_B16_B16,76.6133,0.0,0.49%,126.14,15794.34
201,128,4096,384,128,8,ActivationType.Gelu,torch.bfloat16,torch.bfloat16,torch.bfloat16,QuantType.No,1,1,ck,stage1,64,moe_ck2stages_gemm1_256x64x64x64_1x4_TypeCast_v1_Nswizzle0_Quant0_MulRoutedWeight1_gelu_B16_B16_B16,138.9419,0.0,0.00%,69.55,8709.08
201,128,4096,384,128,8,ActivationType.Gelu,torch.bfloat16,torch.bfloat16,torch.bfloat16,QuantType.No,1,1,ck,stage2,32,moe_ck2stages_gemm2_256x32x128x128_1x4_TypeCast_v1_Nswizzle0_Quant0_MulRoutedWeight0_B16_B16_B16,76.9527,0.0,0.00%,125.58,15724.68
202,128,4096,384,128,8,ActivationType.Silu,torch.bfloat16,torch.bfloat16,torch.bfloat16,QuantType.No,1,0,ck,stage1,64,moe_ck2stages_gemm1_256x64x64x64_1x4_TypeCast_v1_Nswizzle0_Quant0_MulRoutedWeight0_silu_B16_B16_B16,138.7522,0.0,0.00%,69.65,8720.99
202,128,4096,384,128,8,ActivationType.Silu,torch.bfloat16,torch.bfloat16,torch.bfloat16,QuantType.No,1,0,ck,stage2,32,moe_ck2stages_gemm2_256x32x128x128_1x4_TypeCast_v1_Nswizzle0_Quant0_MulRoutedWeight1_B16_B16_B16,76.4947,0.0,0.36%,126.33,15818.83
203,128,4096,384,128,8,ActivationType.Silu,torch.bfloat16,torch.bfloat16,torch.bfloat16,QuantType.No,1,1,ck,stage1,64,moe_ck2stages_gemm1_256x64x64x64_1x4_TypeCast_v1_Nswizzle0_Quant0_MulRoutedWeight1_silu_B16_B16_B16,139.0123,0.0,0.00%,69.52,8704.67
203,128,4096,384,128,8,ActivationType.Silu,torch.bfloat16,torch.bfloat16,torch.bfloat16,QuantType.No,1,1,ck,stage2,32,moe_ck2stages_gemm2_256x32x128x128_1x4_TypeCast_v1_Nswizzle0_Quant0_MulRoutedWeight0_B16_B16_B16,76.6139,0.0,0.00%,126.13,15794.22
204,128,4096,384,128,8,ActivationType.Silu,torch.bfloat16,torch.float8_e4m3fn,torch.float8_e4m3fn,QuantType.per_Tensor,1,0,ck,stage1,32,moe_ck2stages_gemm1_256x32x64x128_1x4_TypeCast_v1_Nswizzle0_Quant1_MulRoutedWeight0_silu_F8_F8_B16,71.6184,26.47299999999998,0.00%,134.93,8455.27
204,128,4096,384,128,8,ActivationType.Silu,torch.bfloat16,torch.float8_e4m3fn,torch.float8_e4m3fn,QuantType.per_Tensor,1,0,asm,stage1,32,_ZN5aiter47fmoe_stage1_bf16_pertokenFp8_g1u1_32x64_4tg_pf2E,76.8921,26.47299999999998,0.00%,125.68,7875.36
204,128,4096,384,128,8,ActivationType.Silu,torch.bfloat16,torch.float8_e4m3fn,torch.float8_e4m3fn,QuantType.per_Tensor,1,0,ck,stage2,128,moe_ck2stages_gemm2_256x128x128x128_1x4_TypeCast_v3_Nswizzle0_Quant1_MulRoutedWeight1_F8_F8_B16,60.7741,26.47299999999998,0.35%,159.01,9963.99
205,128,4096,384,128,8,ActivationType.Silu,torch.bfloat16,torch.float8_e4m3fn,torch.float8_e4m3fn,QuantType.per_Tensor,1,1,ck,stage1,32,moe_ck2stages_gemm1_256x32x64x128_1x4_TypeCast_v1_Nswizzle0_Quant1_MulRoutedWeight1_silu_F8_F8_B16,72.0643,25.624333333333368,0.00%,134.1,8402.95
205,128,4096,384,128,8,ActivationType.Silu,torch.bfloat16,torch.float8_e4m3fn,torch.float8_e4m3fn,QuantType.per_Tensor,1,1,asm,stage1,32,_ZN5aiter56fmoe_stage1_bf16_pertokenFp8_doweight_g1u1_32x64_4tg_pf2E,77.0507,25.624333333333368,0.00%,125.42,7859.15
205,128,4096,384,128,8,ActivationType.Silu,torch.bfloat16,torch.float8_e4m3fn,torch.float8_e4m3fn,QuantType.per_Tensor,1,1,ck,stage2,128,moe_ck2stages_gemm2_256x128x128x128_1x4_TypeCast_v3_Nswizzle0_Quant1_MulRoutedWeight0_F8_F8_B16,58.2433,25.624333333333368,0.00%,165.92,10396.95
206,128,4096,384,128,8,ActivationType.Silu,torch.bfloat16,torch.float8_e4m3fn,torch.float8_e4m3fn,QuantType.per_Token,1,0,asm,stage1,16,_ZN5aiter47fmoe_stage1_bf16_pertokenFp8_g1u1_16x64_6tg_pf2E,68.1369,23.049777777777813,0.00%,141.83,8887.29
206,128,4096,384,128,8,ActivationType.Silu,torch.bfloat16,torch.float8_e4m3fn,torch.float8_e4m3fn,QuantType.per_Token,1,0,ck,stage1,32,moe_ck2stages_gemm1_256x32x64x128_1x4_TypeCast_v1_Nswizzle0_Quant2_MulRoutedWeight0_silu_F8_F8_B16,72.5587,23.049777777777813,0.00%,133.18,8345.69
206,128,4096,384,128,8,ActivationType.Silu,torch.bfloat16,torch.float8_e4m3fn,torch.float8_e4m3fn,QuantType.per_Token,1,0,ck,stage2,128,moe_ck2stages_gemm2_256x128x128x128_1x4_TypeCast_v3_Nswizzle0_Quant2_MulRoutedWeight1_F8_F8_B16,94.1285,23.049777777777813,0.36%,102.66,6433.25
206,128,4096,384,128,8,ActivationType.Silu,torch.bfloat16,torch.float8_e4m3fn,torch.float8_e4m3fn,QuantType.per_Token,1,0,asm,asm_1stage,32,_ZN5aiter45fmoe_bf16_pertokenFp8_g1u1_vs_silu_1tg_32x192E,116.7224,0.0,0.00%,82.79,5187.97
207,128,4096,384,128,8,ActivationType.Silu,torch.bfloat16,torch.float8_e4m3fn,torch.float8_e4m3fn,QuantType.per_Token,1,1,asm,stage1,16,_ZN5aiter56fmoe_stage1_bf16_pertokenFp8_doweight_g1u1_16x64_6tg_pf2E,68.2548,22.712111111111096,0.00%,141.58,8871.94
207,128,4096,384,128,8,ActivationType.Silu,torch.bfloat16,torch.float8_e4m3fn,torch.float8_e4m3fn,QuantType.per_Token,1,1,ck,stage1,32,moe_ck2stages_gemm1_256x32x64x128_1x4_TypeCast_v1_Nswizzle0_Quant2_MulRoutedWeight1_silu_F8_F8_B16,72.3815,22.712111111111096,0.00%,133.51,8366.12
207,128,4096,384,128,8,ActivationType.Silu,torch.bfloat16,torch.float8_e4m3fn,torch.float8_e4m3fn,QuantType.per_Token,1,1,ck,stage2,128,moe_ck2stages_gemm2_256x128x128x128_1x4_TypeCast_v3_Nswizzle0_Quant2_MulRoutedWeight0_F8_F8_B16,90.3565,22.712111111111096,0.00%,106.95,6701.82
207,128,4096,384,128,8,ActivationType.Silu,torch.bfloat16,torch.float8_e4m3fn,torch.float8_e4m3fn,QuantType.per_Token,1,1,asm,asm_1stage,32,_ZN5aiter50fmoe_bf16_pertokenFp8_g1u1_vs_tkw1_silu_1tg_32x192E,115.3016,0.0,0.00%,83.81,5251.9
208,128,4096,384,128,8,ActivationType.Gelu,torch.bfloat16,torch.float8_e4m3fn,torch.float8_e4m3fn,QuantType.per_Tensor,1,0,ck,stage1,32,moe_ck2stages_gemm1_256x32x64x128_1x4_TypeCast_v1_Nswizzle0_Quant1_MulRoutedWeight0_gelu_F8_F8_B16,72.0685,26.513111111111105,0.00%,134.09,8402.46
208,128,4096,384,128,8,ActivationType.Gelu,torch.bfloat16,torch.float8_e4m3fn,torch.float8_e4m3fn,QuantType.per_Tensor,1,0,asm,stage1,16,_ZN5aiter47fmoe_stage1_bf16_pertokenFp8_g1u1_16x64_6tg_pf2E,76.7832,26.513111111111105,0.00%,125.86,7886.53
208,128,4096,384,128,8,ActivationType.Gelu,torch.bfloat16,torch.float8_e4m3fn,torch.float8_e4m3fn,QuantType.per_Tensor,1,0,ck,stage2,128,moe_ck2stages_gemm2_256x128x128x128_1x4_TypeCast_v3_Nswizzle0_Quant1_MulRoutedWeight1_F8_F8_B16,60.9367,26.513111111111105,0.49%,158.59,9937.4
209,128,4096,384,128,8,ActivationType.Gelu,torch.bfloat16,torch.float8_e4m3fn,torch.float8_e4m3fn,QuantType.per_Tensor,1,1,ck,stage1,32,moe_ck2stages_gemm1_256x32x64x128_1x4_TypeCast_v1_Nswizzle0_Quant1_MulRoutedWeight1_gelu_F8_F8_B16,71.8761,26.19755555555557,0.00%,134.45,8424.95
209,128,4096,384,128,8,ActivationType.Gelu,torch.bfloat16,torch.float8_e4m3fn,torch.float8_e4m3fn,QuantType.per_Tensor,1,1,asm,stage1,16,_ZN5aiter56fmoe_stage1_bf16_pertokenFp8_doweight_g1u1_16x64_6tg_pf2E,77.0057,26.19755555555557,0.00%,125.49,7863.74
209,128,4096,384,128,8,ActivationType.Gelu,torch.bfloat16,torch.float8_e4m3fn,torch.float8_e4m3fn,QuantType.per_Tensor,1,1,ck,stage2,128,moe_ck2stages_gemm2_256x128x128x128_1x4_TypeCast_v3_Nswizzle0_Quant1_MulRoutedWeight0_F8_F8_B16,58.0138,26.19755555555557,0.00%,166.58,10438.08
210,128,4096,384,128,8,ActivationType.Gelu,torch.bfloat16,torch.float8_e4m3fn,torch.float8_e4m3fn,QuantType.per_Token,1,0,asm,stage1,16,_ZN5aiter47fmoe_stage1_bf16_pertokenFp8_g1u1_16x64_6tg_pf2E,68.2184,22.97000000000002,0.00%,141.66,8876.68
210,128,4096,384,128,8,ActivationType.Gelu,torch.bfloat16,torch.float8_e4m3fn,torch.float8_e4m3fn,QuantType.per_Token,1,0,ck,stage1,32,moe_ck2stages_gemm1_256x32x64x128_1x4_TypeCast_v1_Nswizzle0_Quant2_MulRoutedWeight0_gelu_F8_F8_B16,72.4894,22.97000000000002,0.00%,133.31,8353.67
210,128,4096,384,128,8,ActivationType.Gelu,torch.bfloat16,torch.float8_e4m3fn,torch.float8_e4m3fn,QuantType.per_Token,1,0,ck,stage2,128,moe_ck2stages_gemm2_256x128x128x128_1x4_TypeCast_v3_Nswizzle0_Quant2_MulRoutedWeight1_F8_F8_B16,94.7586,22.97000000000002,0.51%,101.98,6390.48
210,128,4096,384,128,8,ActivationType.Gelu,torch.bfloat16,torch.float8_e4m3fn,torch.float8_e4m3fn,QuantType.per_Token,1,0,asm,asm_1stage,32,_ZN5aiter45fmoe_bf16_pertokenFp8_g1u1_vs_gelu_1tg_32x192E,115.5119,0.0,0.00%,83.66,5242.34
211,128,4096,384,128,8,ActivationType.Gelu,torch.bfloat16,torch.float8_e4m3fn,torch.float8_e4m3fn,QuantType.per_Token,1,1,asm,stage1,16,_ZN5aiter56fmoe_stage1_bf16_pertokenFp8_doweight_g1u1_16x64_6tg_pf2E,68.1957,22.96111111111114,0.00%,141.71,8879.63
211,128,4096,384,128,8,ActivationType.Gelu,torch.bfloat16,torch.float8_e4m3fn,torch.float8_e4m3fn,QuantType.per_Token,1,1,ck,stage1,32,moe_ck2stages_gemm1_256x32x64x128_1x4_TypeCast_v1_Nswizzle0_Quant2_MulRoutedWeight1_gelu_F8_F8_B16,72.4139,22.96111111111114,0.00%,133.45,8362.38
211,128,4096,384,128,8,ActivationType.Gelu,torch.bfloat16,torch.float8_e4m3fn,torch.float8_e4m3fn,QuantType.per_Token,1,1,ck,stage2,128,moe_ck2stages_gemm2_256x128x128x128_1x4_TypeCast_v3_Nswizzle0_Quant2_MulRoutedWeight0_F8_F8_B16,90.0536,22.96111111111114,0.00%,107.31,6724.36
211,128,4096,384,128,8,ActivationType.Gelu,torch.bfloat16,torch.float8_e4m3fn,torch.float8_e4m3fn,QuantType.per_Token,1,1,asm,asm_1stage,32,_ZN5aiter50fmoe_bf16_pertokenFp8_g1u1_vs_tkw1_gelu_1tg_32x192E,116.9767,0.0,0.00%,82.61,5176.69
212,128,4096,384,128,8,ActivationType.Silu,torch.bfloat16,torch.float8_e4m3fn,torch.float8_e4m3fn,QuantType.per_1x128,1,0,ck,stage1,16,moe_ck2stages_gemm1_128x16x128x128_1x2_MulABScaleExpertWeightA8W8blkscale_v1_Nswizzle0_Quant4_MulRoutedWeight0_silu_F8_F8_B16,80.9553,25.1965555555555,0.11%,119.37,7480.09
212,128,4096,384,128,8,ActivationType.Silu,torch.bfloat16,torch.float8_e4m3fn,torch.float8_e4m3fn,QuantType.per_1x128,1,0,ck,stage2,16,moe_ck2stages_gemm2_128x16x128x128_1x2_MulABScaleExpertWeightA8W8blkscale_v1_Nswizzle0_Quant4_MulRoutedWeight1_F8_F8_B16,42.7884,25.1965555555555,15.57%,225.85,14152.26
212,128,4096,384,128,8,ActivationType.Silu,torch.bfloat16,torch.float8_e4m3fn,torch.float8_e4m3fn,QuantType.per_1x128,1,0,asm,asm_1stage,32,_ZN5aiter43fmoe_bf16_blockscaleFp8_g1u1_vs_silu_32x384E,123.5609,0.0,0.00%,78.21,4900.84
213,128,4096,384,128,8,ActivationType.Gelu,torch.bfloat16,torch.float8_e4m3fn,torch.float8_e4m3fn,QuantType.per_1x128,1,0,ck,stage1,16,moe_ck2stages_gemm1_128x16x128x128_1x2_MulABScaleExpertWeightA8W8blkscale_v1_Nswizzle0_Quant4_MulRoutedWeight0_gelu_F8_F8_B16,81.3343,27.01888888888896,0.11%,118.81,7445.23
213,128,4096,384,128,8,ActivationType.Gelu,torch.bfloat16,torch.float8_e4m3fn,torch.float8_e4m3fn,QuantType.per_1x128,1,0,ck,stage2,16,moe_ck2stages_gemm2_128x16x128x128_1x2_MulABScaleExpertWeightA8W8blkscale_v1_Nswizzle0_Quant4_MulRoutedWeight1_F8_F8_B16,42.9766,27.01888888888896,15.51%,224.86,14090.29
214,128,4096,384,128,8,ActivationType.Silu,torch.bfloat16,torch.float8_e4m3fn,torch.float8_e4m3fn,QuantType.per_1x128,1,1,ck,stage1,16,moe_ck2stages_gemm1_128x16x128x128_1x2_MulABScaleExpertWeightA8W8blkscale_v1_Nswizzle0_Quant4_MulRoutedWeight1_silu_F8_F8_B16,80.9201,27.139111111111088,0.12%,119.42,7483.34
214,128,4096,384,128,8,ActivationType.Silu,torch.bfloat16,torch.float8_e4m3fn,torch.float8_e4m3fn,QuantType.per_1x128,1,1,ck,stage2,32,moe_ck2stages_gemm2_256x32x128x128_1x4_MulABScaleExpertWeightA8W8blkscale_v1_Nswizzle0_Quant4_MulRoutedWeight0_F8_F8_B16,42.6403,27.139111111111088,16.76%,226.63,14201.42
215,128,4096,384,128,8,ActivationType.Gelu,torch.bfloat16,torch.float8_e4m3fn,torch.float8_e4m3fn,QuantType.per_1x128,1,1,ck,stage1,16,moe_ck2stages_gemm1_128x16x128x128_1x2_MulABScaleExpertWeightA8W8blkscale_v1_Nswizzle0_Quant4_MulRoutedWeight1_gelu_F8_F8_B16,81.0733,27.094222222222204,0.12%,119.2,7469.2
215,128,4096,384,128,8,ActivationType.Gelu,torch.bfloat16,torch.float8_e4m3fn,torch.float8_e4m3fn,QuantType.per_1x128,1,1,ck,stage2,32,moe_ck2stages_gemm2_256x32x128x128_1x4_MulABScaleExpertWeightA8W8blkscale_v1_Nswizzle0_Quant4_MulRoutedWeight0_F8_F8_B16,42.6474,27.094222222222204,16.79%,226.59,14199.05
216,128,7168,256,256,8,ActivationType.Gelu,torch.bfloat16,torch.bfloat16,torch.bfloat16,QuantType.No,1,0,ck,stage1,64,moe_ck2stages_gemm1_256x64x64x128_1x4_TypeCast_v1_Nswizzle0_Quant0_MulRoutedWeight0_gelu_B16_B16_B16,301.2735,0.0,0.00%,37.42,9367.71
216,128,7168,256,256,8,ActivationType.Gelu,torch.bfloat16,torch.bfloat16,torch.bfloat16,QuantType.No,1,0,ck,stage2,32,moe_ck2stages_gemm2_256x32x128x128_1x4_TypeCast_v1_Nswizzle0_Quant0_MulRoutedWeight1_B16_B16_B16,158.2433,0.0,1.65%,71.25,17834.83
217,128,7168,256,256,8,ActivationType.Gelu,torch.bfloat16,torch.bfloat16,torch.bfloat16,QuantType.No,1,1,ck,stage1,64,moe_ck2stages_gemm1_256x64x64x128_1x4_TypeCast_v1_Nswizzle0_Quant0_MulRoutedWeight1_gelu_B16_B16_B16,301.5911,0.0,0.00%,37.38,9357.84
217,128,7168,256,256,8,ActivationType.Gelu,torch.bfloat16,torch.bfloat16,torch.bfloat16,QuantType.No,1,1,ck,stage2,64,moe_ck2stages_gemm2_256x64x128x128_1x4_TypeCast_v1_Nswizzle0_Quant0_MulRoutedWeight0_B16_B16_B16,156.9062,0.0,0.00%,71.85,17986.81
218,128,7168,256,256,8,ActivationType.Gelu,torch.bfloat16,torch.float8_e4m3fn,torch.float8_e4m3fn,QuantType.per_Tensor,1,0,ck,stage1,64,moe_ck2stages_gemm1_256x64x64x256_1x4_TypeCast_v1_Nswizzle0_Quant1_MulRoutedWeight0_gelu_F8_F8_B16,153.7224,29.16200000000001,0.00%,73.34,9185.64
218,128,7168,256,256,8,ActivationType.Gelu,torch.bfloat16,torch.float8_e4m3fn,torch.float8_e4m3fn,QuantType.per_Tensor,1,0,asm,stage1,16,_ZN5aiter48fmoe_stage1_bf16_pertokenFp8_g1u1_16x256_3tg_pf2E,160.0898,29.16200000000001,0.04%,70.42,8820.29
218,128,7168,256,256,8,ActivationType.Gelu,torch.bfloat16,torch.float8_e4m3fn,torch.float8_e4m3fn,QuantType.per_Tensor,1,0,ck,stage2,32,moe_ck2stages_gemm2_256x32x128x256_1x4_TypeCast_v1_Nswizzle0_Quant1_MulRoutedWeight1_F8_F8_B16,85.9093,29.16200000000001,1.66%,131.23,16436.39
219,128,7168,256,256,8,ActivationType.Gelu,torch.bfloat16,torch.float8_e4m3fn,torch.float8_e4m3fn,QuantType.per_Tensor,1,1,ck,stage1,32,moe_ck2stages_gemm1_256x32x64x256_1x4_TypeCast_v1_Nswizzle0_Quant1_MulRoutedWeight1_gelu_F8_F8_B16,154.4244,27.681888888888885,0.00%,73.01,9143.88
219,128,7168,256,256,8,ActivationType.Gelu,torch.bfloat16,torch.float8_e4m3fn,torch.float8_e4m3fn,QuantType.per_Tensor,1,1,asm,stage1,16,_ZN5aiter57fmoe_stage1_bf16_pertokenFp8_doweight_g1u1_16x256_3tg_pf2E,160.1616,27.681888888888885,0.06%,70.39,8816.34
219,128,7168,256,256,8,ActivationType.Gelu,torch.bfloat16,torch.float8_e4m3fn,torch.float8_e4m3fn,QuantType.per_Tensor,1,1,ck,stage2,32,moe_ck2stages_gemm2_256x32x128x256_1x4_TypeCast_v1_Nswizzle0_Quant1_MulRoutedWeight0_F8_F8_B16,85.5954,27.681888888888885,0.00%,131.72,16496.67
220,128,7168,256,256,8,ActivationType.Gelu,torch.bfloat16,torch.float8_e4m3fn,torch.float8_e4m3fn,QuantType.per_Token,1,0,asm,stage1,16,_ZN5aiter48fmoe_stage1_bf16_pertokenFp8_g1u1_16x256_3tg_pf2E,151.9112,24.680999999999987,0.18%,74.22,9295.16
220,128,7168,256,256,8,ActivationType.Gelu,torch.bfloat16,torch.float8_e4m3fn,torch.float8_e4m3fn,QuantType.per_Token,1,0,ck,stage1,32,moe_ck2stages_gemm1_256x32x64x256_1x4_TypeCast_v1_Nswizzle0_Quant2_MulRoutedWeight0_gelu_F8_F8_B16,153.8755,24.680999999999987,0.00%,73.27,9176.5
220,128,7168,256,256,8,ActivationType.Gelu,torch.bfloat16,torch.float8_e4m3fn,torch.float8_e4m3fn,QuantType.per_Token,1,0,ck,stage2,32,moe_ck2stages_gemm2_256x32x128x256_1x4_TypeCast_v1_Nswizzle0_Quant2_MulRoutedWeight1_F8_F8_B16,97.2502,24.680999999999987,1.64%,115.93,14519.65
220,128,7168,256,256,8,ActivationType.Gelu,torch.bfloat16,torch.float8_e4m3fn,torch.float8_e4m3fn,QuantType.per_Token,1,0,asm,asm_1stage,32,_ZN5aiter45fmoe_bf16_pertokenFp8_g1u1_vs_gelu_1tg_32x256E,242.8721,0.0,0.00%,46.42,5813.92
221,128,7168,256,256,8,ActivationType.Gelu,torch.bfloat16,torch.float8_e4m3fn,torch.float8_e4m3fn,QuantType.per_Token,1,1,asm,stage1,16,_ZN5aiter57fmoe_stage1_bf16_pertokenFp8_doweight_g1u1_16x256_3tg_pf2E,151.9874,21.45877777777777,0.04%,74.18,9290.5
221,128,7168,256,256,8,ActivationType.Gelu,torch.bfloat16,torch.float8_e4m3fn,torch.float8_e4m3fn,QuantType.per_Token,1,1,ck,stage1,32,moe_ck2stages_gemm1_256x32x64x256_1x4_TypeCast_v1_Nswizzle0_Quant2_MulRoutedWeight1_gelu_F8_F8_B16,153.7276,21.45877777777777,0.00%,73.34,9185.33
221,128,7168,256,256,8,ActivationType.Gelu,torch.bfloat16,torch.float8_e4m3fn,torch.float8_e4m3fn,QuantType.per_Token,1,1,ck,stage2,32,moe_ck2stages_gemm2_256x32x128x256_1x4_TypeCast_v1_Nswizzle0_Quant2_MulRoutedWeight0_F8_F8_B16,92.3402,21.45877777777777,0.00%,122.1,15291.7
221,128,7168,256,256,8,ActivationType.Gelu,torch.bfloat16,torch.float8_e4m3fn,torch.float8_e4m3fn,QuantType.per_Token,1,1,asm,asm_1stage,32,_ZN5aiter50fmoe_bf16_pertokenFp8_g1u1_vs_tkw1_gelu_1tg_32x128E,242.6212,0.0,0.00%,46.47,5819.93
222,128,7168,256,256,8,ActivationType.Silu,torch.bfloat16,torch.bfloat16,torch.bfloat16,QuantType.No,1,0,ck,stage1,32,moe_ck2stages_gemm1_256x32x64x128_1x4_TypeCast_v1_Nswizzle0_Quant0_MulRoutedWeight0_silu_B16_B16_B16,301.6595,0.0,0.00%,37.37,9355.72
222,128,7168,256,256,8,ActivationType.Silu,torch.bfloat16,torch.bfloat16,torch.bfloat16,QuantType.No,1,0,ck,stage2,32,moe_ck2stages_gemm2_256x32x128x128_1x4_TypeCast_v1_Nswizzle0_Quant0_MulRoutedWeight1_B16_B16_B16,158.3283,0.0,1.32%,71.21,17825.25
223,128,7168,256,256,8,ActivationType.Silu,torch.bfloat16,torch.bfloat16,torch.bfloat16,QuantType.No,1,1,ck,stage1,64,moe_ck2stages_gemm1_256x64x64x128_1x4_TypeCast_v1_Nswizzle0_Quant0_MulRoutedWeight1_silu_B16_B16_B16,301.0214,0.0,0.00%,37.45,9375.55
223,128,7168,256,256,8,ActivationType.Silu,torch.bfloat16,torch.bfloat16,torch.bfloat16,QuantType.No,1,1,ck,stage2,64,moe_ck2stages_gemm2_256x64x128x128_1x4_TypeCast_v1_Nswizzle0_Quant0_MulRoutedWeight0_B16_B16_B16,157.4017,0.0,0.00%,71.63,17930.19
224,128,7168,256,256,8,ActivationType.Silu,torch.bfloat16,torch.float8_e4m3fn,torch.float8_e4m3fn,QuantType.per_Tensor,1,0,ck,stage1,32,moe_ck2stages_gemm1_256x32x64x256_1x4_TypeCast_v1_Nswizzle0_Quant1_MulRoutedWeight0_silu_F8_F8_B16,153.8287,25.210777777777807,0.00%,73.29,9179.29
224,128,7168,256,256,8,ActivationType.Silu,torch.bfloat16,torch.float8_e4m3fn,torch.float8_e4m3fn,QuantType.per_Tensor,1,0,asm,stage1,16,_ZN5aiter48fmoe_stage1_bf16_pertokenFp8_g1u1_16x256_3tg_pf2E,160.1701,25.210777777777807,0.22%,70.39,8815.87
224,128,7168,256,256,8,ActivationType.Silu,torch.bfloat16,torch.float8_e4m3fn,torch.float8_e4m3fn,QuantType.per_Tensor,1,0,ck,stage2,32,moe_ck2stages_gemm2_256x32x128x256_1x4_TypeCast_v1_Nswizzle0_Quant1_MulRoutedWeight1_F8_F8_B16,86.0522,25.210777777777807,1.32%,131.02,16409.09
225,128,7168,256,256,8,ActivationType.Silu,torch.bfloat16,torch.float8_e4m3fn,torch.float8_e4m3fn,QuantType.per_Tensor,1,1,ck,stage1,32,moe_ck2stages_gemm1_256x32x64x256_1x4_TypeCast_v1_Nswizzle0_Quant1_MulRoutedWeight1_silu_F8_F8_B16,153.2716,27.4465555555556,0.00%,73.56,9212.66
225,128,7168,256,256,8,ActivationType.Silu,torch.bfloat16,torch.float8_e4m3fn,torch.float8_e4m3fn,QuantType.per_Tensor,1,1,asm,stage1,16,_ZN5aiter57fmoe_stage1_bf16_pertokenFp8_doweight_g1u1_16x256_3tg_pf2E,160.5741,27.4465555555556,0.04%,70.21,8793.69
225,128,7168,256,256,8,ActivationType.Silu,torch.bfloat16,torch.float8_e4m3fn,torch.float8_e4m3fn,QuantType.per_Tensor,1,1,ck,stage2,32,moe_ck2stages_gemm2_256x32x128x256_1x4_TypeCast_v1_Nswizzle0_Quant1_MulRoutedWeight0_F8_F8_B16,85.462,27.4465555555556,0.00%,131.92,16522.42
226,128,7168,256,256,8,ActivationType.Silu,torch.bfloat16,torch.float8_e4m3fn,torch.float8_e4m3fn,QuantType.per_Token,1,0,asm,stage1,16,_ZN5aiter48fmoe_stage1_bf16_pertokenFp8_g1u1_16x256_3tg_pf2E,151.8403,21.42766666666674,0.14%,74.25,9299.5
226,128,7168,256,256,8,ActivationType.Silu,torch.bfloat16,torch.float8_e4m3fn,torch.float8_e4m3fn,QuantType.per_Token,1,0,ck,stage1,32,moe_ck2stages_gemm1_256x32x64x256_1x4_TypeCast_v1_Nswizzle0_Quant2_MulRoutedWeight0_silu_F8_F8_B16,153.9,21.42766666666674,0.00%,73.26,9175.04
226,128,7168,256,256,8,ActivationType.Silu,torch.bfloat16,torch.float8_e4m3fn,torch.float8_e4m3fn,QuantType.per_Token,1,0,ck,stage2,32,moe_ck2stages_gemm2_256x32x128x256_1x4_TypeCast_v1_Nswizzle0_Quant2_MulRoutedWeight1_F8_F8_B16,97.3342,21.42766666666674,1.30%,115.83,14507.12
226,128,7168,256,256,8,ActivationType.Silu,torch.bfloat16,torch.float8_e4m3fn,torch.float8_e4m3fn,QuantType.per_Token,1,0,asm,asm_1stage,32,_ZN5aiter45fmoe_bf16_pertokenFp8_g1u1_vs_silu_1tg_32x256E,240.5029,0.0,0.00%,46.88,5871.19
227,128,7168,256,256,8,ActivationType.Silu,torch.bfloat16,torch.float8_e4m3fn,torch.float8_e4m3fn,QuantType.per_Token,1,1,asm,stage1,16,_ZN5aiter57fmoe_stage1_bf16_pertokenFp8_doweight_g1u1_16x256_3tg_pf2E,151.8169,21.36544444444448,0.04%,74.26,9300.93
227,128,7168,256,256,8,ActivationType.Silu,torch.bfloat16,torch.float8_e4m3fn,torch.float8_e4m3fn,QuantType.per_Token,1,1,ck,stage1,32,moe_ck2stages_gemm1_256x32x64x256_1x4_TypeCast_v1_Nswizzle0_Quant2_MulRoutedWeight1_silu_F8_F8_B16,154.8232,21.36544444444448,0.00%,72.82,9120.33
227,128,7168,256,256,8,ActivationType.Silu,torch.bfloat16,torch.float8_e4m3fn,torch.float8_e4m3fn,QuantType.per_Token,1,1,ck,stage2,32,moe_ck2stages_gemm2_256x32x128x256_1x4_TypeCast_v1_Nswizzle0_Quant2_MulRoutedWeight0_F8_F8_B16,92.5436,21.36544444444448,0.00%,121.83,15258.09
227,128,7168,256,256,8,ActivationType.Silu,torch.bfloat16,torch.float8_e4m3fn,torch.float8_e4m3fn,QuantType.per_Token,1,1,asm,asm_1stage,32,_ZN5aiter53fmoe_bf16_pertokenFp8_g1u1_vs_tkw1_silu_1tg_ps_32x256E,239.4696,0.0,0.00%,47.08,5896.53
228,128,7168,256,256,8,ActivationType.Gelu,torch.bfloat16,torch.float8_e4m3fn,torch.float8_e4m3fn,QuantType.per_1x128,1,0,ck,stage1,16,moe_ck2stages_gemm1_256x16x128x256_1x4_MulABScaleExpertWeightA8W8blkscale_v1_Nswizzle0_Quant4_MulRoutedWeight0_gelu_F8_F8_B16,158.2076,24.201111111111075,0.11%,71.26,8925.23
228,128,7168,256,256,8,ActivationType.Gelu,torch.bfloat16,torch.float8_e4m3fn,torch.float8_e4m3fn,QuantType.per_1x128,1,0,ck,stage2,32,moe_ck2stages_gemm2_256x32x128x128_1x4_MulABScaleExpertWeightA8W8blkscale_v1_Nswizzle0_Quant4_MulRoutedWeight1_F8_F8_B16,84.7661,24.201111111111075,15.77%,133.0,16658.06
228,128,7168,256,256,8,ActivationType.Gelu,torch.bfloat16,torch.float8_e4m3fn,torch.float8_e4m3fn,QuantType.per_1x128,1,0,asm,asm_1stage,32,_ZN5aiter47fmoe_bf16_blockscaleFp8_g1u1_vs_gelu_1tg_32x256E,240.3028,0.0,2.20%,46.92,5876.08
229,128,7168,256,256,8,ActivationType.Gelu,torch.bfloat16,torch.float8_e4m3fn,torch.float8_e4m3fn,QuantType.per_1x128,1,1,ck,stage1,16,moe_ck2stages_gemm1_256x16x128x256_1x4_MulABScaleExpertWeightA8W8blkscale_v1_Nswizzle0_Quant4_MulRoutedWeight1_gelu_F8_F8_B16,157.7243,24.174222222222244,0.12%,71.48,8952.58
229,128,7168,256,256,8,ActivationType.Gelu,torch.bfloat16,torch.float8_e4m3fn,torch.float8_e4m3fn,QuantType.per_1x128,1,1,ck,stage2,32,moe_ck2stages_gemm2_256x32x128x128_1x4_MulABScaleExpertWeightA8W8blkscale_v1_Nswizzle0_Quant4_MulRoutedWeight0_F8_F8_B16,84.3359,24.174222222222244,16.70%,133.68,16743.03
230,128,7168,256,256,8,ActivationType.Silu,torch.bfloat16,torch.float8_e4m3fn,torch.float8_e4m3fn,QuantType.per_1x128,1,1,ck,stage1,16,moe_ck2stages_gemm1_256x16x128x256_1x4_MulABScaleExpertWeightA8W8blkscale_v1_Nswizzle0_Quant4_MulRoutedWeight1_silu_F8_F8_B16,157.7329,23.92544444444445,0.12%,71.48,8952.09
230,128,7168,256,256,8,ActivationType.Silu,torch.bfloat16,torch.float8_e4m3fn,torch.float8_e4m3fn,QuantType.per_1x128,1,1,ck,stage2,32,moe_ck2stages_gemm2_256x32x128x128_1x4_MulABScaleExpertWeightA8W8blkscale_v1_Nswizzle0_Quant4_MulRoutedWeight0_F8_F8_B16,84.2163,23.92544444444445,16.60%,133.87,16766.81
231,128,7168,256,256,8,ActivationType.Silu,torch.bfloat16,torch.float8_e4m3fn,torch.float8_e4m3fn,QuantType.per_1x128,1,0,ck,stage1,16,moe_ck2stages_gemm1_256x16x128x256_1x4_MulABScaleExpertWeightA8W8blkscale_v1_Nswizzle0_Quant4_MulRoutedWeight0_silu_F8_F8_B16,158.2738,24.03666666666668,0.10%,71.23,8921.49
231,128,7168,256,256,8,ActivationType.Silu,torch.bfloat16,torch.float8_e4m3fn,torch.float8_e4m3fn,QuantType.per_1x128,1,0,ck,stage2,16,moe_ck2stages_gemm2_256x16x128x256_1x4_MulABScaleExpertWeightA8W8blkscale_v1_Nswizzle0_Quant4_MulRoutedWeight1_F8_F8_B16,86.703,24.03666666666668,15.76%,130.03,16285.93
231,128,7168,256,256,8,ActivationType.Silu,torch.bfloat16,torch.float8_e4m3fn,torch.float8_e4m3fn,QuantType.per_1x128,1,0,asm,asm_1stage,32,_ZN5aiter50fmoe_bf16_blockscaleFp8_g1u1_vs_silu_1tg_ps_32x256E,238.4821,0.0,0.00%,47.28,5920.94
232,128,7168,256,257,9,ActivationType.Silu,torch.bfloat16,torch.float8_e4m3fn,torch.float8_e4m3fn,QuantType.per_Token,1,0,asm,stage1,16,_ZN5aiter48fmoe_stage1_bf16_pertokenFp8_g1u1_16x256_3tg_pf2E,156.2573,21.62788888888885,0.12%,81.17,9071.86
232,128,7168,256,257,9,ActivationType.Silu,torch.bfloat16,torch.float8_e4m3fn,torch.float8_e4m3fn,QuantType.per_Token,1,0,ck,stage1,32,moe_ck2stages_gemm1_256x32x64x256_1x4_TypeCast_v1_Nswizzle0_Quant2_MulRoutedWeight0_silu_F8_F8_B16,158.7089,21.62788888888885,0.00%,79.92,8931.72
232,128,7168,256,257,9,ActivationType.Silu,torch.bfloat16,torch.float8_e4m3fn,torch.float8_e4m3fn,QuantType.per_Token,1,0,ck,stage2,32,moe_ck2stages_gemm2_256x32x128x256_1x4_TypeCast_v1_Nswizzle0_Quant2_MulRoutedWeight1_F8_F8_B16,99.8155,21.62788888888885,1.40%,127.07,14201.64
232,128,7168,256,257,9,ActivationType.Silu,torch.bfloat16,torch.float8_e4m3fn,torch.float8_e4m3fn,QuantType.per_Token,1,0,asm,asm_1stage,32,_ZN5aiter45fmoe_bf16_pertokenFp8_g1u1_vs_silu_1tg_32x256E,244.7772,0.0,0.00%,51.82,5791.16
233,128,7168,256,257,9,ActivationType.Silu,torch.bfloat16,torch.float8_e4m3fn,torch.float8_e4m3fn,QuantType.per_1x128,1,0,ck,stage1,16,moe_ck2stages_gemm1_256x16x128x256_1x4_MulABScaleExpertWeightA8W8blkscale_v1_Nswizzle0_Quant4_MulRoutedWeight0_silu_F8_F8_B16,161.1744,24.085444444444445,0.12%,78.69,8795.09
233,128,7168,256,257,9,ActivationType.Silu,torch.bfloat16,torch.float8_e4m3fn,torch.float8_e4m3fn,QuantType.per_1x128,1,0,ck,stage2,32,moe_ck2stages_gemm2_256x32x128x128_1x4_MulABScaleExpertWeightA8W8blkscale_v1_Nswizzle0_Quant4_MulRoutedWeight1_F8_F8_B16,89.1659,24.085444444444445,16.89%,142.25,15897.82
233,128,7168,256,257,9,ActivationType.Silu,torch.bfloat16,torch.float8_e4m3fn,torch.float8_e4m3fn,QuantType.per_1x128,1,0,asm,asm_1stage,32,_ZN5aiter47fmoe_bf16_blockscaleFp8_g1u1_vs_silu_1tg_32x256E,245.4776,0.0,0.00%,51.67,5774.64
234,128,7168,512,256,8,ActivationType.Gelu,torch.bfloat16,torch.bfloat16,torch.bfloat16,QuantType.No,1,0,ck,stage1,64,moe_ck2stages_gemm1_256x64x64x128_1x4_TypeCast_v1_Nswizzle0_Quant0_MulRoutedWeight0_gelu_B16_B16_B16,613.2377,0.0,0.00%,36.77,9198.41
234,128,7168,512,256,8,ActivationType.Gelu,torch.bfloat16,torch.bfloat16,torch.bfloat16,QuantType.No,1,0,ck,stage2,32,moe_ck2stages_gemm2_256x32x128x128_1x4_TypeCast_v1_Nswizzle0_Quant0_MulRoutedWeight1_B16_B16_B16,305.5626,0.0,3.29%,73.79,18460.42
235,128,7168,512,256,8,ActivationType.Gelu,torch.bfloat16,torch.bfloat16,torch.bfloat16,QuantType.No,1,1,ck,stage1,64,moe_ck2stages_gemm1_256x64x64x128_1x4_TypeCast_v1_Nswizzle0_Quant0_MulRoutedWeight1_gelu_B16_B16_B16,612.6891,0.0,0.00%,36.8,9206.65
235,128,7168,512,256,8,ActivationType.Gelu,torch.bfloat16,torch.bfloat16,torch.bfloat16,QuantType.No,1,1,ck,stage2,64,moe_ck2stages_gemm2_256x64x128x128_1x4_TypeCast_v1_Nswizzle0_Quant0_MulRoutedWeight0_B16_B16_B16,303.8181,0.0,0.01%,74.22,18566.42
236,128,7168,512,256,8,ActivationType.Gelu,torch.bfloat16,torch.float8_e4m3fn,torch.float8_e4m3fn,QuantType.per_Tensor,1,0,ck,stage1,32,moe_ck2stages_gemm1_256x32x64x256_1x4_TypeCast_v1_Nswizzle0_Quant1_MulRoutedWeight0_gelu_F8_F8_B16,309.6566,29.17111111111113,0.00%,72.82,9111.14
236,128,7168,512,256,8,ActivationType.Gelu,torch.bfloat16,torch.float8_e4m3fn,torch.float8_e4m3fn,QuantType.per_Tensor,1,0,asm,stage1,32,_ZN5aiter48fmoe_stage1_bf16_pertokenFp8_g1u1_32x128_3tg_pf3E,318.5215,29.17111111111113,4.83%,70.79,8857.56
236,128,7168,512,256,8,ActivationType.Gelu,torch.bfloat16,torch.float8_e4m3fn,torch.float8_e4m3fn,QuantType.per_Tensor,1,0,ck,stage2,32,moe_ck2stages_gemm2_256x32x128x256_1x4_TypeCast_v1_Nswizzle0_Quant1_MulRoutedWeight1_F8_F8_B16,161.6975,29.17111111111113,3.29%,139.45,17448.17
237,128,7168,512,256,8,ActivationType.Gelu,torch.bfloat16,torch.float8_e4m3fn,torch.float8_e4m3fn,QuantType.per_Tensor,1,1,ck,stage1,64,moe_ck2stages_gemm1_256x64x64x256_1x4_TypeCast_v1_Nswizzle0_Quant1_MulRoutedWeight1_gelu_F8_F8_B16,311.757,30.002111111111063,0.00%,72.33,9049.76
237,128,7168,512,256,8,ActivationType.Gelu,torch.bfloat16,torch.float8_e4m3fn,torch.float8_e4m3fn,QuantType.per_Tensor,1,1,asm,stage1,16,_ZN5aiter57fmoe_stage1_bf16_pertokenFp8_doweight_g1u1_16x256_3tg_pf2E,318.3829,30.002111111111063,0.06%,70.82,8861.42
237,128,7168,512,256,8,ActivationType.Gelu,torch.bfloat16,torch.float8_e4m3fn,torch.float8_e4m3fn,QuantType.per_Tensor,1,1,ck,stage2,64,moe_ck2stages_gemm2_256x64x128x256_1x4_TypeCast_v1_Nswizzle0_Quant1_MulRoutedWeight0_F8_F8_B16,159.7123,30.002111111111063,0.01%,141.18,17665.04
238,128,7168,512,256,8,ActivationType.Gelu,torch.bfloat16,torch.float8_e4m3fn,torch.float8_e4m3fn,QuantType.per_Token,1,0,asm,stage1,32,_ZN5aiter44fmoe_stage1_bf16_pertokenFp8_g1u1_32x512_pf2E,309.8981,27.023222222222213,0.00%,72.76,9104.04
238,128,7168,512,256,8,ActivationType.Gelu,torch.bfloat16,torch.float8_e4m3fn,torch.float8_e4m3fn,QuantType.per_Token,1,0,ck,stage1,32,moe_ck2stages_gemm1_256x32x64x256_1x4_TypeCast_v1_Nswizzle0_Quant2_MulRoutedWeight0_gelu_F8_F8_B16,312.7947,27.023222222222213,0.00%,72.09,9019.73
238,128,7168,512,256,8,ActivationType.Gelu,torch.bfloat16,torch.float8_e4m3fn,torch.float8_e4m3fn,QuantType.per_Token,1,0,ck,stage2,32,moe_ck2stages_gemm2_256x32x128x256_1x4_TypeCast_v1_Nswizzle0_Quant2_MulRoutedWeight1_F8_F8_B16,166.777,27.023222222222213,3.28%,135.2,16916.75
238,128,7168,512,256,8,ActivationType.Gelu,torch.bfloat16,torch.float8_e4m3fn,torch.float8_e4m3fn,QuantType.per_Token,1,0,asm,asm_1stage,32,_ZN5aiter45fmoe_bf16_pertokenFp8_g1u1_vs_gelu_1tg_32x512E,475.0561,0.0,0.00%,47.47,5938.93
239,128,7168,512,256,8,ActivationType.Gelu,torch.bfloat16,torch.float8_e4m3fn,torch.float8_e4m3fn,QuantType.per_Token,1,1,asm,stage1,64,_ZN5aiter56fmoe_stage1_bf16_pertokenFp8_doweight_g1u1_64x64_2tg_pf3E,309.5553,25.68988888888887,0.43%,72.84,9114.12
239,128,7168,512,256,8,ActivationType.Gelu,torch.bfloat16,torch.float8_e4m3fn,torch.float8_e4m3fn,QuantType.per_Token,1,1,ck,stage1,32,moe_ck2stages_gemm1_256x32x64x256_1x4_TypeCast_v1_Nswizzle0_Quant2_MulRoutedWeight1_gelu_F8_F8_B16,312.4116,25.68988888888887,0.00%,72.18,9030.79
239,128,7168,512,256,8,ActivationType.Gelu,torch.bfloat16,torch.float8_e4m3fn,torch.float8_e4m3fn,QuantType.per_Token,1,1,ck,stage2,32,moe_ck2stages_gemm2_256x32x128x256_1x4_TypeCast_v1_Nswizzle0_Quant2_MulRoutedWeight0_F8_F8_B16,166.9489,25.68988888888887,0.01%,135.06,16899.33
239,128,7168,512,256,8,ActivationType.Gelu,torch.bfloat16,torch.float8_e4m3fn,torch.float8_e4m3fn,QuantType.per_Token,1,1,asm,asm_1stage,32,_ZN5aiter53fmoe_bf16_pertokenFp8_g1u1_vs_tkw1_gelu_1tg_ps_32x512E,472.8233,0.0,0.00%,47.69,5966.97
240,128,7168,512,256,8,ActivationType.Silu,torch.bfloat16,torch.bfloat16,torch.bfloat16,QuantType.No,1,1,ck,stage1,64,moe_ck2stages_gemm1_256x64x64x128_1x4_TypeCast_v1_Nswizzle0_Quant0_MulRoutedWeight1_silu_B16_B16_B16,613.2312,0.0,0.00%,36.77,9198.51
240,128,7168,512,256,8,ActivationType.Silu,torch.bfloat16,torch.bfloat16,torch.bfloat16,QuantType.No,1,1,ck,stage2,64,moe_ck2stages_gemm2_256x64x128x128_1x4_TypeCast_v1_Nswizzle0_Quant0_MulRoutedWeight0_B16_B16_B16,303.5185,0.0,0.00%,74.29,18584.75
241,128,7168,512,256,8,ActivationType.Silu,torch.bfloat16,torch.float8_e4m3fn,torch.float8_e4m3fn,QuantType.per_Tensor,1,0,ck,stage1,64,moe_ck2stages_gemm1_256x64x64x256_1x4_TypeCast_v1_Nswizzle0_Quant1_MulRoutedWeight0_silu_F8_F8_B16,310.9671,29.179777777777858,0.00%,72.51,9072.74
241,128,7168,512,256,8,ActivationType.Silu,torch.bfloat16,torch.float8_e4m3fn,torch.float8_e4m3fn,QuantType.per_Tensor,1,0,asm,stage1,32,_ZN5aiter44fmoe_stage1_bf16_pertokenFp8_g1u1_32x512_pf2E,315.7982,29.179777777777858,0.00%,71.4,8933.95
241,128,7168,512,256,8,ActivationType.Silu,torch.bfloat16,torch.float8_e4m3fn,torch.float8_e4m3fn,QuantType.per_Tensor,1,0,ck,stage2,32,moe_ck2stages_gemm2_256x32x128x256_1x4_TypeCast_v1_Nswizzle0_Quant1_MulRoutedWeight1_F8_F8_B16,161.8162,29.179777777777858,2.81%,139.35,17435.37
242,128,7168,512,256,8,ActivationType.Silu,torch.bfloat16,torch.float8_e4m3fn,torch.float8_e4m3fn,QuantType.per_Tensor,1,1,ck,stage1,64,moe_ck2stages_gemm1_256x64x64x256_1x4_TypeCast_v1_Nswizzle0_Quant1_MulRoutedWeight1_silu_F8_F8_B16,310.2216,28.553222222222253,0.00%,72.69,9094.55
242,128,7168,512,256,8,ActivationType.Silu,torch.bfloat16,torch.float8_e4m3fn,torch.float8_e4m3fn,QuantType.per_Tensor,1,1,asm,stage1,64,_ZN5aiter57fmoe_stage1_bf16_pertokenFp8_doweight_g1u1_64x128_2tg_pf2E,318.977,28.553222222222253,0.00%,70.69,8844.92
242,128,7168,512,256,8,ActivationType.Silu,torch.bfloat16,torch.float8_e4m3fn,torch.float8_e4m3fn,QuantType.per_Tensor,1,1,ck,stage2,32,moe_ck2stages_gemm2_256x32x128x256_1x4_TypeCast_v1_Nswizzle0_Quant1_MulRoutedWeight0_F8_F8_B16,161.8898,28.553222222222253,0.00%,139.28,17427.44
243,128,7168,512,256,8,ActivationType.Silu,torch.bfloat16,torch.float8_e4m3fn,torch.float8_e4m3fn,QuantType.per_Token,1,0,asm,stage1,32,_ZN5aiter44fmoe_stage1_bf16_pertokenFp8_g1u1_32x512_pf2E,308.3121,28.134222222222267,0.00%,73.14,9150.87
243,128,7168,512,256,8,ActivationType.Silu,torch.bfloat16,torch.float8_e4m3fn,torch.float8_e4m3fn,QuantType.per_Token,1,0,ck,stage1,32,moe_ck2stages_gemm1_256x32x64x256_1x4_TypeCast_v1_Nswizzle0_Quant2_MulRoutedWeight0_silu_F8_F8_B16,311.7496,28.134222222222267,0.00%,72.33,9049.97
243,128,7168,512,256,8,ActivationType.Silu,torch.bfloat16,torch.float8_e4m3fn,torch.float8_e4m3fn,QuantType.per_Token,1,0,ck,stage2,32,moe_ck2stages_gemm2_256x32x128x256_1x4_TypeCast_v1_Nswizzle0_Quant2_MulRoutedWeight1_F8_F8_B16,160.7255,28.134222222222267,2.79%,140.29,17553.69
243,128,7168,512,256,8,ActivationType.Silu,torch.bfloat16,torch.float8_e4m3fn,torch.float8_e4m3fn,QuantType.per_Token,1,0,asm,asm_1stage,32,_ZN5aiter45fmoe_bf16_pertokenFp8_g1u1_vs_silu_1tg_32x512E,477.2289,0.0,0.00%,47.25,5911.89
244,128,7168,512,256,8,ActivationType.Silu,torch.bfloat16,torch.float8_e4m3fn,torch.float8_e4m3fn,QuantType.per_Token,1,1,asm,stage1,16,_ZN5aiter53fmoe_stage1_bf16_pertokenFp8_doweight_g1u1_16x512_pf3E,310.4851,26.156666666666663,0.00%,72.62,9086.83
244,128,7168,512,256,8,ActivationType.Silu,torch.bfloat16,torch.float8_e4m3fn,torch.float8_e4m3fn,QuantType.per_Token,1,1,ck,stage1,64,moe_ck2stages_gemm1_256x64x64x256_1x4_TypeCast_v1_Nswizzle0_Quant2_MulRoutedWeight1_silu_F8_F8_B16,312.5198,26.156666666666663,0.00%,72.15,9027.67
244,128,7168,512,256,8,ActivationType.Silu,torch.bfloat16,torch.float8_e4m3fn,torch.float8_e4m3fn,QuantType.per_Token,1,1,ck,stage2,32,moe_ck2stages_gemm2_256x32x128x256_1x4_TypeCast_v1_Nswizzle0_Quant2_MulRoutedWeight0_F8_F8_B16,161.962,26.156666666666663,0.00%,139.22,17419.67
244,128,7168,512,256,8,ActivationType.Silu,torch.bfloat16,torch.float8_e4m3fn,torch.float8_e4m3fn,QuantType.per_Token,1,1,asm,asm_1stage,32,_ZN5aiter50fmoe_bf16_pertokenFp8_g1u1_vs_tkw1_silu_1tg_32x512E,476.4628,0.0,0.00%,47.32,5921.4
245,128,7168,512,256,8,ActivationType.Silu,torch.bfloat16,torch.bfloat16,torch.bfloat16,QuantType.No,1,0,ck,stage1,64,moe_ck2stages_gemm1_256x64x64x128_1x4_TypeCast_v1_Nswizzle0_Quant0_MulRoutedWeight0_silu_B16_B16_B16,612.9278,0.0,0.00%,36.79,9203.07
245,128,7168,512,256,8,ActivationType.Silu,torch.bfloat16,torch.bfloat16,torch.bfloat16,QuantType.No,1,0,ck,stage2,64,moe_ck2stages_gemm2_256x64x128x64_1x4_TypeCast_v1_Nswizzle0_Quant0_MulRoutedWeight1_B16_B16_B16,305.3592,0.0,2.79%,73.84,18472.72
246,128,7168,512,256,8,ActivationType.Gelu,torch.bfloat16,torch.float8_e4m3fn,torch.float8_e4m3fn,QuantType.per_1x128,1,0,ck,stage1,16,moe_ck2stages_gemm1_256x16x128x256_1x4_MulABScaleExpertWeightA8W8blkscale_v1_Nswizzle0_Quant4_MulRoutedWeight0_gelu_F8_F8_B16,315.2608,27.143111111111136,0.11%,71.52,8949.18
246,128,7168,512,256,8,ActivationType.Gelu,torch.bfloat16,torch.float8_e4m3fn,torch.float8_e4m3fn,QuantType.per_1x128,1,0,ck,stage2,16,moe_ck2stages_gemm2_256x16x128x256_1x4_MulABScaleExpertWeightA8W8blkscale_v1_Nswizzle0_Quant4_MulRoutedWeight1_F8_F8_B16,163.2103,27.143111111111136,15.76%,138.16,17286.44
246,128,7168,512,256,8,ActivationType.Gelu,torch.bfloat16,torch.float8_e4m3fn,torch.float8_e4m3fn,QuantType.per_1x128,1,0,asm,asm_1stage,32,_ZN5aiter47fmoe_bf16_blockscaleFp8_g1u1_vs_gelu_1tg_32x256E,478.0556,0.0,10.10%,47.17,5901.67
247,128,7168,512,256,8,ActivationType.Silu,torch.bfloat16,torch.float8_e4m3fn,torch.float8_e4m3fn,QuantType.per_1x128,1,0,ck,stage1,16,moe_ck2stages_gemm1_256x16x128x256_1x4_MulABScaleExpertWeightA8W8blkscale_v1_Nswizzle0_Quant4_MulRoutedWeight0_silu_F8_F8_B16,317.3777,26.48111111111117,0.11%,71.05,8889.49
247,128,7168,512,256,8,ActivationType.Silu,torch.bfloat16,torch.float8_e4m3fn,torch.float8_e4m3fn,QuantType.per_1x128,1,0,ck,stage2,16,moe_ck2stages_gemm2_256x16x128x256_1x4_MulABScaleExpertWeightA8W8blkscale_v1_Nswizzle0_Quant4_MulRoutedWeight1_F8_F8_B16,162.7536,26.48111111111117,15.74%,138.54,17334.95
247,128,7168,512,256,8,ActivationType.Silu,torch.bfloat16,torch.float8_e4m3fn,torch.float8_e4m3fn,QuantType.per_1x128,1,0,asm,asm_1stage,32,_ZN5aiter49fmoe_bf16_blockscaleFp8_g1u1_novs_silu_1tg_32x256E,482.8685,0.0,0.00%,46.7,5842.84
248,128,7168,512,256,8,ActivationType.Gelu,torch.bfloat16,torch.float8_e4m3fn,torch.float8_e4m3fn,QuantType.per_1x128,1,1,ck,stage1,16,moe_ck2stages_gemm1_256x16x128x256_1x4_MulABScaleExpertWeightA8W8blkscale_v1_Nswizzle0_Quant4_MulRoutedWeight1_gelu_F8_F8_B16,317.5028,26.87222222222222,0.12%,71.02,8885.98
248,128,7168,512,256,8,ActivationType.Gelu,torch.bfloat16,torch.float8_e4m3fn,torch.float8_e4m3fn,QuantType.per_1x128,1,1,ck,stage2,32,moe_ck2stages_gemm2_256x32x128x128_1x4_MulABScaleExpertWeightA8W8blkscale_v1_Nswizzle0_Quant4_MulRoutedWeight0_F8_F8_B16,162.3513,26.87222222222222,16.74%,138.89,17377.9
249,128,7168,512,256,8,ActivationType.Silu,torch.bfloat16,torch.float8_e4m3fn,torch.float8_e4m3fn,QuantType.per_1x128,1,1,ck,stage1,16,moe_ck2stages_gemm1_256x16x128x256_1x4_MulABScaleExpertWeightA8W8blkscale_v1_Nswizzle0_Quant4_MulRoutedWeight1_silu_F8_F8_B16,316.948,26.72111111111116,0.12%,71.14,8901.54
249,128,7168,512,256,8,ActivationType.Silu,torch.bfloat16,torch.float8_e4m3fn,torch.float8_e4m3fn,QuantType.per_1x128,1,1,ck,stage2,32,moe_ck2stages_gemm2_256x32x128x128_1x4_MulABScaleExpertWeightA8W8blkscale_v1_Nswizzle0_Quant4_MulRoutedWeight0_F8_F8_B16,162.0206,26.72111111111116,16.71%,139.17,17413.37
250,128,7168,2048,33,10,ActivationType.Silu,torch.bfloat16,torch.float8_e4m3fn,torch.float8_e4m3fn,QuantType.per_1x128,1,0,ck,stage1,32,moe_ck2stages_gemm1_256x32x128x128_1x4_MulABScaleExpertWeightA8W8blkscale_v1_Nswizzle0_Quant4_MulRoutedWeight0_silu_F8_F8_B16,212.8921,52.721222222222224,0.12%,529.58,6839.52
250,128,7168,2048,33,10,ActivationType.Silu,torch.bfloat16,torch.float8_e4m3fn,torch.float8_e4m3fn,QuantType.per_1x128,1,0,ck,stage2,64,moe_ck2stages_gemm2_256x64x128x128_1x4_MulABScaleExpertWeightA8W8blkscale_v3_Nswizzle0_Quant4_MulRoutedWeight1_F8_F8_B16,108.9751,52.721222222222224,16.90%,1034.57,13361.57
250,128,7168,2048,33,10,ActivationType.Silu,torch.bfloat16,torch.float8_e4m3fn,torch.float8_e4m3fn,QuantType.per_1x128,1,0,asm,asm_1stage,32,_ZN5aiter52fmoe_bf16_blockscaleFp8_g1u1_novs_silu_1tg_ps_32x256E,333.0331,0.0,0.00%,338.53,4372.17
251,128,7168,2048,33,10,ActivationType.Silu,torch.bfloat16,torch.float8_e4m3fn,torch.float8_e4m3fn,QuantType.per_Token,1,0,ck,stage1,64,moe_ck2stages_gemm1_256x64x64x256_1x4_TypeCast_v1_Nswizzle0_Quant2_MulRoutedWeight0_silu_F8_F8_B16,182.7949,50.27666666666661,0.00%,616.77,7965.64
251,128,7168,2048,33,10,ActivationType.Silu,torch.bfloat16,torch.float8_e4m3fn,torch.float8_e4m3fn,QuantType.per_Token,1,0,asm,stage1,32,_ZN5aiter47fmoe_stage1_bf16_pertokenFp8_g1u1_32x64_4tg_pf2E,188.8454,50.27666666666661,0.00%,597.01,7710.43
251,128,7168,2048,33,10,ActivationType.Silu,torch.bfloat16,torch.float8_e4m3fn,torch.float8_e4m3fn,QuantType.per_Token,1,0,ck,stage2,32,moe_ck2stages_gemm2_256x32x128x256_1x4_TypeCast_v1_Nswizzle0_Quant2_MulRoutedWeight1_F8_F8_B16,110.113,50.27666666666661,7.60%,1023.88,13223.5
251,128,7168,2048,33,10,ActivationType.Silu,torch.bfloat16,torch.float8_e4m3fn,torch.float8_e4m3fn,QuantType.per_Token,1,0,asm,asm_1stage,32,_ZN5aiter48fmoe_bf16_pertokenFp8_g1u1_vs_silu_1tg_ps_32x256E,320.1045,0.0,0.01%,352.21,4548.76
252,256,2048,192,128,8,ActivationType.Silu,torch.bfloat16,torch.bfloat16,torch.bfloat16,QuantType.No,1,0,ck,stage1,32,moe_ck2stages_gemm1_256x32x64x64_1x4_TypeCast_v1_Nswizzle0_Quant0_MulRoutedWeight0_silu_B16_B16_B16,40.5505,0.0,0.00%,119.16,7498.97
252,256,2048,192,128,8,ActivationType.Silu,torch.bfloat16,torch.bfloat16,torch.bfloat16,QuantType.No,1,0,ck,stage2,32,moe_ck2stages_gemm2_256x32x64x64_1x4_TypeCast_v1_Nswizzle0_Quant0_MulRoutedWeight1_B16_B16_B16,26.2083,0.0,0.00%,184.36,11602.7
253,256,2048,192,128,8,ActivationType.Silu,torch.bfloat16,torch.bfloat16,torch.bfloat16,QuantType.No,1,1,ck,stage1,32,moe_ck2stages_gemm1_256x32x64x64_1x4_TypeCast_v1_Nswizzle0_Quant0_MulRoutedWeight1_silu_B16_B16_B16,40.4632,0.0,0.00%,119.41,7515.15
253,256,2048,192,128,8,ActivationType.Silu,torch.bfloat16,torch.bfloat16,torch.bfloat16,QuantType.No,1,1,ck,stage2,32,moe_ck2stages_gemm2_256x32x64x64_1x4_TypeCast_v1_Nswizzle0_Quant0_MulRoutedWeight0_B16_B16_B16,25.4986,0.0,0.00%,189.49,11925.64
254,256,2048,192,128,8,ActivationType.Gelu,torch.bfloat16,torch.bfloat16,torch.bfloat16,QuantType.No,1,0,ck,stage1,32,moe_ck2stages_gemm1_256x32x64x64_1x4_TypeCast_v1_Nswizzle0_Quant0_MulRoutedWeight0_gelu_B16_B16_B16,39.9521,0.0,0.00%,120.94,7611.29
254,256,2048,192,128,8,ActivationType.Gelu,torch.bfloat16,torch.bfloat16,torch.bfloat16,QuantType.No,1,0,ck,stage2,32,moe_ck2stages_gemm2_256x32x64x64_1x4_TypeCast_v1_Nswizzle0_Quant0_MulRoutedWeight1_B16_B16_B16,26.3764,0.0,0.00%,183.19,11528.75
255,256,2048,192,128,8,ActivationType.Gelu,torch.bfloat16,torch.bfloat16,torch.bfloat16,QuantType.No,1,1,ck,stage1,32,moe_ck2stages_gemm1_256x32x64x64_1x4_TypeCast_v1_Nswizzle0_Quant0_MulRoutedWeight1_gelu_B16_B16_B16,40.5094,0.0,0.00%,119.28,7506.58
255,256,2048,192,128,8,ActivationType.Gelu,torch.bfloat16,torch.bfloat16,torch.bfloat16,QuantType.No,1,1,ck,stage2,32,moe_ck2stages_gemm2_256x32x64x64_1x4_TypeCast_v1_Nswizzle0_Quant0_MulRoutedWeight0_B16_B16_B16,25.6859,0.0,0.00%,188.11,11838.68
256,256,4096,192,128,8,ActivationType.Silu,torch.bfloat16,torch.bfloat16,torch.bfloat16,QuantType.No,1,0,ck,stage1,64,moe_ck2stages_gemm1_256x64x64x64_1x4_TypeCast_v1_Nswizzle0_Quant0_MulRoutedWeight0_silu_B16_B16_B16,74.1686,0.0,0.00%,130.29,8199.89
256,256,4096,192,128,8,ActivationType.Silu,torch.bfloat16,torch.bfloat16,torch.bfloat16,QuantType.No,1,0,ck,stage2,32,moe_ck2stages_gemm2_256x32x64x64_1x4_TypeCast_v1_Nswizzle0_Quant0_MulRoutedWeight1_B16_B16_B16,42.9082,0.0,0.08%,225.22,14173.84
257,256,4096,192,128,8,ActivationType.Silu,torch.bfloat16,torch.bfloat16,torch.bfloat16,QuantType.No,1,1,ck,stage1,32,moe_ck2stages_gemm1_256x32x64x64_1x4_TypeCast_v1_Nswizzle0_Quant0_MulRoutedWeight1_silu_B16_B16_B16,74.8054,0.0,0.00%,129.18,8130.08
257,256,4096,192,128,8,ActivationType.Silu,torch.bfloat16,torch.bfloat16,torch.bfloat16,QuantType.No,1,1,ck,stage2,32,moe_ck2stages_gemm2_256x32x64x64_1x4_TypeCast_v1_Nswizzle0_Quant0_MulRoutedWeight0_B16_B16_B16,42.5468,0.0,0.00%,227.13,14294.24
258,256,4096,192,128,8,ActivationType.Gelu,torch.bfloat16,torch.bfloat16,torch.bfloat16,QuantType.No,1,0,ck,stage1,64,moe_ck2stages_gemm1_256x64x64x64_1x4_TypeCast_v1_Nswizzle0_Quant0_MulRoutedWeight0_gelu_B16_B16_B16,73.8264,0.0,0.00%,130.9,8237.89
258,256,4096,192,128,8,ActivationType.Gelu,torch.bfloat16,torch.bfloat16,torch.bfloat16,QuantType.No,1,0,ck,stage2,32,moe_ck2stages_gemm2_256x32x64x64_1x4_TypeCast_v1_Nswizzle0_Quant0_MulRoutedWeight1_B16_B16_B16,43.0524,0.0,0.12%,224.46,14126.37
259,256,4096,192,128,8,ActivationType.Gelu,torch.bfloat16,torch.bfloat16,torch.bfloat16,QuantType.No,1,1,ck,stage1,32,moe_ck2stages_gemm1_256x32x64x64_1x4_TypeCast_v1_Nswizzle0_Quant0_MulRoutedWeight1_gelu_B16_B16_B16,74.2887,0.0,0.00%,130.08,8186.63
259,256,4096,192,128,8,ActivationType.Gelu,torch.bfloat16,torch.bfloat16,torch.bfloat16,QuantType.No,1,1,ck,stage2,32,moe_ck2stages_gemm2_256x32x64x64_1x4_TypeCast_v1_Nswizzle0_Quant0_MulRoutedWeight0_B16_B16_B16,42.2687,0.0,0.00%,228.62,14388.28
260,256,4096,384,128,8,ActivationType.Gelu,torch.bfloat16,torch.bfloat16,torch.bfloat16,QuantType.No,1,0,ck,stage1,64,moe_ck2stages_gemm1_256x64x64x64_1x4_TypeCast_v1_Nswizzle0_Quant0_MulRoutedWeight0_gelu_B16_B16_B16,139.5127,0.0,0.00%,138.53,8688.48
260,256,4096,384,128,8,ActivationType.Gelu,torch.bfloat16,torch.bfloat16,torch.bfloat16,QuantType.No,1,0,ck,stage2,32,moe_ck2stages_gemm2_256x32x64x64_1x4_TypeCast_v1_Nswizzle0_Quant0_MulRoutedWeight1_B16_B16_B16,78.5181,0.0,0.50%,246.15,15437.89
261,256,4096,384,128,8,ActivationType.Gelu,torch.bfloat16,torch.bfloat16,torch.bfloat16,QuantType.No,1,1,ck,stage1,64,moe_ck2stages_gemm1_256x64x64x64_1x4_TypeCast_v1_Nswizzle0_Quant0_MulRoutedWeight1_gelu_B16_B16_B16,139.9867,0.0,0.00%,138.07,8659.06
261,256,4096,384,128,8,ActivationType.Gelu,torch.bfloat16,torch.bfloat16,torch.bfloat16,QuantType.No,1,1,ck,stage2,32,moe_ck2stages_gemm2_256x32x64x64_1x4_TypeCast_v1_Nswizzle0_Quant0_MulRoutedWeight0_B16_B16_B16,78.6296,0.0,0.00%,245.8,15416.0
262,256,4096,384,128,8,ActivationType.Silu,torch.bfloat16,torch.bfloat16,torch.bfloat16,QuantType.No,1,0,ck,stage1,64,moe_ck2stages_gemm1_256x64x64x64_1x4_TypeCast_v1_Nswizzle0_Quant0_MulRoutedWeight0_silu_B16_B16_B16,139.6856,0.0,0.00%,138.36,8677.73
262,256,4096,384,128,8,ActivationType.Silu,torch.bfloat16,torch.bfloat16,torch.bfloat16,QuantType.No,1,0,ck,stage2,32,moe_ck2stages_gemm2_256x32x64x64_1x4_TypeCast_v1_Nswizzle0_Quant0_MulRoutedWeight1_B16_B16_B16,78.6825,0.0,0.38%,245.64,15405.63
263,256,4096,384,128,8,ActivationType.Silu,torch.bfloat16,torch.bfloat16,torch.bfloat16,QuantType.No,1,1,ck,stage1,64,moe_ck2stages_gemm1_256x64x64x64_1x4_TypeCast_v1_Nswizzle0_Quant0_MulRoutedWeight1_silu_B16_B16_B16,139.4379,0.0,0.00%,138.61,8693.14
263,256,4096,384,128,8,ActivationType.Silu,torch.bfloat16,torch.bfloat16,torch.bfloat16,QuantType.No,1,1,ck,stage2,32,moe_ck2stages_gemm2_256x32x64x64_1x4_TypeCast_v1_Nswizzle0_Quant0_MulRoutedWeight0_B16_B16_B16,78.6106,0.0,0.00%,245.86,15419.73
264,256,4096,384,128,8,ActivationType.Silu,torch.bfloat16,torch.float8_e4m3fn,torch.float8_e4m3fn,QuantType.per_Tensor,1,0,ck,stage1,32,moe_ck2stages_gemm1_256x32x64x128_1x4_TypeCast_v1_Nswizzle0_Quant1_MulRoutedWeight0_silu_F8_F8_B16,71.7685,29.540000000000035,0.00%,269.3,8459.5
264,256,4096,384,128,8,ActivationType.Silu,torch.bfloat16,torch.float8_e4m3fn,torch.float8_e4m3fn,QuantType.per_Tensor,1,0,asm,stage1,32,_ZN5aiter48fmoe_stage1_bf16_pertokenFp8_g1u1_32x128_3tg_pf2E,77.8809,29.540000000000035,0.00%,248.17,7795.56
264,256,4096,384,128,8,ActivationType.Silu,torch.bfloat16,torch.float8_e4m3fn,torch.float8_e4m3fn,QuantType.per_Tensor,1,0,ck,stage2,128,moe_ck2stages_gemm2_256x128x128x128_1x4_TypeCast_v3_Nswizzle0_Quant1_MulRoutedWeight1_F8_F8_B16,65.0474,29.540000000000035,0.37%,297.13,9333.59
265,256,4096,384,128,8,ActivationType.Silu,torch.bfloat16,torch.float8_e4m3fn,torch.float8_e4m3fn,QuantType.per_Tensor,1,1,ck,stage1,32,moe_ck2stages_gemm1_256x32x64x128_1x4_TypeCast_v1_Nswizzle0_Quant1_MulRoutedWeight1_silu_F8_F8_B16,72.3504,29.69088888888896,0.00%,267.14,8391.46
265,256,4096,384,128,8,ActivationType.Silu,torch.bfloat16,torch.float8_e4m3fn,torch.float8_e4m3fn,QuantType.per_Tensor,1,1,asm,stage1,32,_ZN5aiter56fmoe_stage1_bf16_pertokenFp8_doweight_g1u1_32x64_4tg_pf2E,78.104,29.69088888888896,0.00%,247.46,7773.3
265,256,4096,384,128,8,ActivationType.Silu,torch.bfloat16,torch.float8_e4m3fn,torch.float8_e4m3fn,QuantType.per_Tensor,1,1,ck,stage2,128,moe_ck2stages_gemm2_256x128x128x128_1x4_TypeCast_v3_Nswizzle0_Quant1_MulRoutedWeight0_F8_F8_B16,64.21,29.69088888888896,0.00%,301.0,9455.31
266,256,4096,384,128,8,ActivationType.Silu,torch.bfloat16,torch.float8_e4m3fn,torch.float8_e4m3fn,QuantType.per_Token,1,0,asm,stage1,32,_ZN5aiter47fmoe_stage1_bf16_pertokenFp8_g1u1_32x64_4tg_pf2E,69.2655,26.427777777777848,0.00%,279.03,8765.19
266,256,4096,384,128,8,ActivationType.Silu,torch.bfloat16,torch.float8_e4m3fn,torch.float8_e4m3fn,QuantType.per_Token,1,0,ck,stage1,32,moe_ck2stages_gemm1_256x32x64x128_1x4_TypeCast_v1_Nswizzle0_Quant2_MulRoutedWeight0_silu_F8_F8_B16,72.7389,26.427777777777848,0.00%,265.71,8346.64
266,256,4096,384,128,8,ActivationType.Silu,torch.bfloat16,torch.float8_e4m3fn,torch.float8_e4m3fn,QuantType.per_Token,1,0,ck,stage2,128,moe_ck2stages_gemm2_256x128x128x128_1x4_TypeCast_v3_Nswizzle0_Quant2_MulRoutedWeight1_F8_F8_B16,100.0053,26.427777777777848,0.37%,193.26,6070.93
266,256,4096,384,128,8,ActivationType.Silu,torch.bfloat16,torch.float8_e4m3fn,torch.float8_e4m3fn,QuantType.per_Token,1,0,asm,asm_1stage,32,_ZN5aiter45fmoe_bf16_pertokenFp8_g1u1_vs_silu_1tg_32x192E,118.7157,0.0,0.00%,162.8,5114.11
267,256,4096,384,128,8,ActivationType.Silu,torch.bfloat16,torch.float8_e4m3fn,torch.float8_e4m3fn,QuantType.per_Token,1,1,asm,stage1,32,_ZN5aiter57fmoe_stage1_bf16_pertokenFp8_doweight_g1u1_32x128_3tg_pf2E,69.4153,26.37011111111109,0.00%,278.43,8746.28
267,256,4096,384,128,8,ActivationType.Silu,torch.bfloat16,torch.float8_e4m3fn,torch.float8_e4m3fn,QuantType.per_Token,1,1,ck,stage1,32,moe_ck2stages_gemm1_256x32x64x128_1x4_TypeCast_v1_Nswizzle0_Quant2_MulRoutedWeight1_silu_F8_F8_B16,72.8145,26.37011111111109,0.00%,265.43,8337.98
267,256,4096,384,128,8,ActivationType.Silu,torch.bfloat16,torch.float8_e4m3fn,torch.float8_e4m3fn,QuantType.per_Token,1,1,ck,stage2,128,moe_ck2stages_gemm2_256x128x128x128_1x4_TypeCast_v3_Nswizzle0_Quant2_MulRoutedWeight0_F8_F8_B16,95.0283,26.37011111111109,0.00%,203.39,6388.89
267,256,4096,384,128,8,ActivationType.Silu,torch.bfloat16,torch.float8_e4m3fn,torch.float8_e4m3fn,QuantType.per_Token,1,1,asm,asm_1stage,32,_ZN5aiter50fmoe_bf16_pertokenFp8_g1u1_vs_tkw1_silu_1tg_32x192E,117.6565,0.0,0.00%,164.27,5160.15
268,256,4096,384,128,8,ActivationType.Gelu,torch.bfloat16,torch.float8_e4m3fn,torch.float8_e4m3fn,QuantType.per_Tensor,1,0,ck,stage1,32,moe_ck2stages_gemm1_256x32x64x128_1x4_TypeCast_v1_Nswizzle0_Quant1_MulRoutedWeight0_gelu_F8_F8_B16,72.0176,29.31766666666669,0.00%,268.37,8430.24
268,256,4096,384,128,8,ActivationType.Gelu,torch.bfloat16,torch.float8_e4m3fn,torch.float8_e4m3fn,QuantType.per_Tensor,1,0,asm,stage1,32,_ZN5aiter48fmoe_stage1_bf16_pertokenFp8_g1u1_32x128_3tg_pf2E,77.9931,29.31766666666669,0.00%,247.81,7784.35
268,256,4096,384,128,8,ActivationType.Gelu,torch.bfloat16,torch.float8_e4m3fn,torch.float8_e4m3fn,QuantType.per_Tensor,1,0,ck,stage2,128,moe_ck2stages_gemm2_256x128x128x128_1x4_TypeCast_v3_Nswizzle0_Quant1_MulRoutedWeight1_F8_F8_B16,65.8611,29.31766666666669,0.50%,293.46,9218.27
269,256,4096,384,128,8,ActivationType.Gelu,torch.bfloat16,torch.float8_e4m3fn,torch.float8_e4m3fn,QuantType.per_Tensor,1,1,ck,stage1,32,moe_ck2stages_gemm1_256x32x64x128_1x4_TypeCast_v1_Nswizzle0_Quant1_MulRoutedWeight1_gelu_F8_F8_B16,72.017,29.08188888888889,0.00%,268.37,8430.31
269,256,4096,384,128,8,ActivationType.Gelu,torch.bfloat16,torch.float8_e4m3fn,torch.float8_e4m3fn,QuantType.per_Tensor,1,1,asm,stage1,32,_ZN5aiter56fmoe_stage1_bf16_pertokenFp8_doweight_g1u1_32x64_4tg_pf2E,77.9472,29.08188888888889,0.00%,247.95,7788.93
269,256,4096,384,128,8,ActivationType.Gelu,torch.bfloat16,torch.float8_e4m3fn,torch.float8_e4m3fn,QuantType.per_Tensor,1,1,ck,stage2,128,moe_ck2stages_gemm2_256x128x128x128_1x4_TypeCast_v3_Nswizzle0_Quant1_MulRoutedWeight0_F8_F8_B16,64.1559,29.08188888888889,0.00%,301.26,9463.28
270,256,4096,384,128,8,ActivationType.Gelu,torch.bfloat16,torch.float8_e4m3fn,torch.float8_e4m3fn,QuantType.per_Token,1,0,asm,stage1,32,_ZN5aiter48fmoe_stage1_bf16_pertokenFp8_g1u1_32x128_3tg_pf2E,69.4435,28.618777777777755,0.00%,278.32,8742.73
270,256,4096,384,128,8,ActivationType.Gelu,torch.bfloat16,torch.float8_e4m3fn,torch.float8_e4m3fn,QuantType.per_Token,1,0,ck,stage1,32,moe_ck2stages_gemm1_256x32x64x128_1x4_TypeCast_v1_Nswizzle0_Quant2_MulRoutedWeight0_gelu_F8_F8_B16,73.3599,28.618777777777755,0.00%,263.46,8275.99
270,256,4096,384,128,8,ActivationType.Gelu,torch.bfloat16,torch.float8_e4m3fn,torch.float8_e4m3fn,QuantType.per_Token,1,0,ck,stage2,128,moe_ck2stages_gemm2_256x128x128x128_1x4_TypeCast_v3_Nswizzle0_Quant2_MulRoutedWeight1_F8_F8_B16,99.3086,28.618777777777755,0.50%,194.62,6113.52
270,256,4096,384,128,8,ActivationType.Gelu,torch.bfloat16,torch.float8_e4m3fn,torch.float8_e4m3fn,QuantType.per_Token,1,0,asm,asm_1stage,32,_ZN5aiter45fmoe_bf16_pertokenFp8_g1u1_vs_gelu_1tg_32x192E,119.4075,0.0,0.00%,161.86,5084.48
271,256,4096,384,128,8,ActivationType.Gelu,torch.bfloat16,torch.float8_e4m3fn,torch.float8_e4m3fn,QuantType.per_Token,1,1,asm,stage1,32,_ZN5aiter57fmoe_stage1_bf16_pertokenFp8_doweight_g1u1_32x128_3tg_pf2E,69.5354,26.82322222222216,0.00%,277.95,8731.17
271,256,4096,384,128,8,ActivationType.Gelu,torch.bfloat16,torch.float8_e4m3fn,torch.float8_e4m3fn,QuantType.per_Token,1,1,ck,stage1,32,moe_ck2stages_gemm1_256x32x64x128_1x4_TypeCast_v1_Nswizzle0_Quant2_MulRoutedWeight1_gelu_F8_F8_B16,72.9823,26.82322222222216,0.00%,264.82,8318.8
271,256,4096,384,128,8,ActivationType.Gelu,torch.bfloat16,torch.float8_e4m3fn,torch.float8_e4m3fn,QuantType.per_Token,1,1,ck,stage2,128,moe_ck2stages_gemm2_256x128x128x128_1x4_TypeCast_v3_Nswizzle0_Quant2_MulRoutedWeight0_F8_F8_B16,94.5624,26.82322222222216,0.00%,204.39,6420.37
271,256,4096,384,128,8,ActivationType.Gelu,torch.bfloat16,torch.float8_e4m3fn,torch.float8_e4m3fn,QuantType.per_Token,1,1,asm,asm_1stage,32,_ZN5aiter50fmoe_bf16_pertokenFp8_g1u1_vs_tkw1_gelu_1tg_32x192E,117.7773,0.0,0.00%,164.1,5154.86
272,256,4096,384,128,8,ActivationType.Silu,torch.bfloat16,torch.float8_e4m3fn,torch.float8_e4m3fn,QuantType.per_1x128,1,0,ck,stage1,32,moe_ck2stages_gemm1_256x32x128x128_1x4_MulABScaleExpertWeightA8W8blkscale_v1_Nswizzle0_Quant4_MulRoutedWeight0_silu_F8_F8_B16,85.2224,32.32555555555554,0.11%,226.79,7124.01
272,256,4096,384,128,8,ActivationType.Silu,torch.bfloat16,torch.float8_e4m3fn,torch.float8_e4m3fn,QuantType.per_1x128,1,0,ck,stage2,32,moe_ck2stages_gemm2_256x32x128x128_1x4_MulABScaleExpertWeightA8W8blkscale_v1_Nswizzle0_Quant4_MulRoutedWeight1_F8_F8_B16,46.1174,32.32555555555554,15.51%,419.09,13164.78
273,256,4096,384,128,8,ActivationType.Gelu,torch.bfloat16,torch.float8_e4m3fn,torch.float8_e4m3fn,QuantType.per_1x128,1,0,ck,stage1,32,moe_ck2stages_gemm1_256x32x128x128_1x4_MulABScaleExpertWeightA8W8blkscale_v1_Nswizzle0_Quant4_MulRoutedWeight0_gelu_F8_F8_B16,85.3128,30.094444444444434,0.11%,226.55,7116.46
273,256,4096,384,128,8,ActivationType.Gelu,torch.bfloat16,torch.float8_e4m3fn,torch.float8_e4m3fn,QuantType.per_1x128,1,0,ck,stage2,32,moe_ck2stages_gemm2_256x32x128x128_1x4_MulABScaleExpertWeightA8W8blkscale_v1_Nswizzle0_Quant4_MulRoutedWeight1_F8_F8_B16,46.5348,30.094444444444434,15.54%,415.33,13046.7
274,256,4096,384,128,8,ActivationType.Silu,torch.bfloat16,torch.float8_e4m3fn,torch.float8_e4m3fn,QuantType.per_1x128,1,1,ck,stage1,32,moe_ck2stages_gemm1_256x32x128x128_1x4_MulABScaleExpertWeightA8W8blkscale_v1_Nswizzle0_Quant4_MulRoutedWeight1_silu_F8_F8_B16,84.9351,28.30777777777777,0.12%,227.55,7148.11
274,256,4096,384,128,8,ActivationType.Silu,torch.bfloat16,torch.float8_e4m3fn,torch.float8_e4m3fn,QuantType.per_1x128,1,1,ck,stage2,32,moe_ck2stages_gemm2_256x32x128x128_1x4_MulABScaleExpertWeightA8W8blkscale_v1_Nswizzle0_Quant4_MulRoutedWeight0_F8_F8_B16,45.1424,28.30777777777777,16.68%,428.14,13449.12
275,256,4096,384,128,8,ActivationType.Gelu,torch.bfloat16,torch.float8_e4m3fn,torch.float8_e4m3fn,QuantType.per_1x128,1,1,ck,stage1,32,moe_ck2stages_gemm1_256x32x128x128_1x4_MulABScaleExpertWeightA8W8blkscale_v1_Nswizzle0_Quant4_MulRoutedWeight1_gelu_F8_F8_B16,85.6866,27.77866666666665,0.12%,225.56,7085.42
275,256,4096,384,128,8,ActivationType.Gelu,torch.bfloat16,torch.float8_e4m3fn,torch.float8_e4m3fn,QuantType.per_1x128,1,1,ck,stage2,32,moe_ck2stages_gemm2_256x32x128x128_1x4_MulABScaleExpertWeightA8W8blkscale_v1_Nswizzle0_Quant4_MulRoutedWeight0_F8_F8_B16,45.1399,27.77866666666665,16.67%,428.17,13449.86
276,256,7168,256,256,8,ActivationType.Gelu,torch.bfloat16,torch.bfloat16,torch.bfloat16,QuantType.No,1,0,ck,stage1,64,moe_ck2stages_gemm1_256x64x64x128_1x4_TypeCast_v1_Nswizzle0_Quant0_MulRoutedWeight0_gelu_B16_B16_B16,313.5377,0.0,0.00%,71.92,9012.99
276,256,7168,256,256,8,ActivationType.Gelu,torch.bfloat16,torch.bfloat16,torch.bfloat16,QuantType.No,1,0,ck,stage2,32,moe_ck2stages_gemm2_256x32x64x64_1x4_TypeCast_v1_Nswizzle0_Quant0_MulRoutedWeight1_B16_B16_B16,168.1499,0.0,1.65%,134.1,16805.91
277,256,7168,256,256,8,ActivationType.Gelu,torch.bfloat16,torch.bfloat16,torch.bfloat16,QuantType.No,1,1,ck,stage1,64,moe_ck2stages_gemm1_256x64x64x128_1x4_TypeCast_v1_Nswizzle0_Quant0_MulRoutedWeight1_gelu_B16_B16_B16,313.6989,0.0,0.00%,71.88,9008.36
277,256,7168,256,256,8,ActivationType.Gelu,torch.bfloat16,torch.bfloat16,torch.bfloat16,QuantType.No,1,1,ck,stage2,64,moe_ck2stages_gemm2_256x64x128x128_1x4_TypeCast_v1_Nswizzle0_Quant0_MulRoutedWeight0_B16_B16_B16,165.5014,0.0,0.00%,136.24,17074.85
278,256,7168,256,256,8,ActivationType.Gelu,torch.bfloat16,torch.float8_e4m3fn,torch.float8_e4m3fn,QuantType.per_Tensor,1,0,ck,stage1,32,moe_ck2stages_gemm1_256x32x64x256_1x4_TypeCast_v1_Nswizzle0_Quant1_MulRoutedWeight0_gelu_F8_F8_B16,158.0365,27.52211111111107,0.00%,142.68,8952.31
278,256,7168,256,256,8,ActivationType.Gelu,torch.bfloat16,torch.float8_e4m3fn,torch.float8_e4m3fn,QuantType.per_Tensor,1,0,asm,stage1,16,_ZN5aiter48fmoe_stage1_bf16_pertokenFp8_g1u1_16x256_3tg_pf2E,167.0216,27.52211111111107,0.20%,135.0,8470.71
278,256,7168,256,256,8,ActivationType.Gelu,torch.bfloat16,torch.float8_e4m3fn,torch.float8_e4m3fn,QuantType.per_Tensor,1,0,ck,stage2,32,moe_ck2stages_gemm2_256x32x128x256_1x4_TypeCast_v1_Nswizzle0_Quant1_MulRoutedWeight1_F8_F8_B16,92.907,27.52211111111107,1.62%,242.7,15228.04
279,256,7168,256,256,8,ActivationType.Gelu,torch.bfloat16,torch.float8_e4m3fn,torch.float8_e4m3fn,QuantType.per_Tensor,1,1,ck,stage1,32,moe_ck2stages_gemm1_256x32x64x256_1x4_TypeCast_v1_Nswizzle0_Quant1_MulRoutedWeight1_gelu_F8_F8_B16,158.4973,26.95766666666674,0.00%,142.26,8926.28
279,256,7168,256,256,8,ActivationType.Gelu,torch.bfloat16,torch.float8_e4m3fn,torch.float8_e4m3fn,QuantType.per_Tensor,1,1,asm,stage1,16,_ZN5aiter57fmoe_stage1_bf16_pertokenFp8_doweight_g1u1_16x256_3tg_pf2E,166.3286,26.95766666666674,0.02%,135.57,8506.0
279,256,7168,256,256,8,ActivationType.Gelu,torch.bfloat16,torch.float8_e4m3fn,torch.float8_e4m3fn,QuantType.per_Tensor,1,1,ck,stage2,32,moe_ck2stages_gemm2_256x32x128x256_1x4_TypeCast_v1_Nswizzle0_Quant1_MulRoutedWeight0_F8_F8_B16,93.561,26.95766666666674,0.00%,241.0,15121.59
280,256,7168,256,256,8,ActivationType.Gelu,torch.bfloat16,torch.float8_e4m3fn,torch.float8_e4m3fn,QuantType.per_Token,1,0,asm,stage1,16,_ZN5aiter48fmoe_stage1_bf16_pertokenFp8_g1u1_16x256_3tg_pf2E,157.9906,23.432111111111105,0.18%,142.72,8954.91
280,256,7168,256,256,8,ActivationType.Gelu,torch.bfloat16,torch.float8_e4m3fn,torch.float8_e4m3fn,QuantType.per_Token,1,0,ck,stage1,64,moe_ck2stages_gemm1_256x64x64x256_1x4_TypeCast_v1_Nswizzle0_Quant2_MulRoutedWeight0_gelu_F8_F8_B16,160.4598,23.432111111111105,0.00%,140.52,8817.11
280,256,7168,256,256,8,ActivationType.Gelu,torch.bfloat16,torch.float8_e4m3fn,torch.float8_e4m3fn,QuantType.per_Token,1,0,ck,stage2,32,moe_ck2stages_gemm2_256x32x128x256_1x4_TypeCast_v1_Nswizzle0_Quant2_MulRoutedWeight1_F8_F8_B16,107.7269,23.432111111111105,1.64%,209.31,13133.13
280,256,7168,256,256,8,ActivationType.Gelu,torch.bfloat16,torch.float8_e4m3fn,torch.float8_e4m3fn,QuantType.per_Token,1,0,asm,asm_1stage,32,_ZN5aiter45fmoe_bf16_pertokenFp8_g1u1_vs_gelu_1tg_32x256E,250.9632,0.0,0.00%,89.85,5637.44
281,256,7168,256,256,8,ActivationType.Gelu,torch.bfloat16,torch.float8_e4m3fn,torch.float8_e4m3fn,QuantType.per_Token,1,1,asm,stage1,16,_ZN5aiter57fmoe_stage1_bf16_pertokenFp8_doweight_g1u1_16x256_3tg_pf2E,157.8217,24.30322222222225,0.18%,142.87,8964.49
281,256,7168,256,256,8,ActivationType.Gelu,torch.bfloat16,torch.float8_e4m3fn,torch.float8_e4m3fn,QuantType.per_Token,1,1,ck,stage1,32,moe_ck2stages_gemm1_256x32x64x256_1x4_TypeCast_v1_Nswizzle0_Quant2_MulRoutedWeight1_gelu_F8_F8_B16,160.3007,24.30322222222225,0.00%,140.66,8825.86
281,256,7168,256,256,8,ActivationType.Gelu,torch.bfloat16,torch.float8_e4m3fn,torch.float8_e4m3fn,QuantType.per_Token,1,1,ck,stage2,32,moe_ck2stages_gemm2_256x32x128x256_1x4_TypeCast_v1_Nswizzle0_Quant2_MulRoutedWeight0_F8_F8_B16,107.3869,24.30322222222225,0.00%,209.98,13174.71
281,256,7168,256,256,8,ActivationType.Gelu,torch.bfloat16,torch.float8_e4m3fn,torch.float8_e4m3fn,QuantType.per_Token,1,1,asm,asm_1stage,32,_ZN5aiter53fmoe_bf16_pertokenFp8_g1u1_vs_tkw1_gelu_1tg_ps_32x256E,251.8866,0.0,0.00%,89.52,5616.78
282,256,7168,256,256,8,ActivationType.Silu,torch.bfloat16,torch.bfloat16,torch.bfloat16,QuantType.No,1,0,ck,stage1,32,moe_ck2stages_gemm1_256x32x64x128_1x4_TypeCast_v1_Nswizzle0_Quant0_MulRoutedWeight0_silu_B16_B16_B16,312.4502,0.0,0.00%,72.17,9044.36
282,256,7168,256,256,8,ActivationType.Silu,torch.bfloat16,torch.bfloat16,torch.bfloat16,QuantType.No,1,0,ck,stage2,32,moe_ck2stages_gemm2_256x32x128x128_1x4_TypeCast_v1_Nswizzle0_Quant0_MulRoutedWeight1_B16_B16_B16,168.0064,0.0,1.31%,134.21,16820.27
283,256,7168,256,256,8,ActivationType.Silu,torch.bfloat16,torch.bfloat16,torch.bfloat16,QuantType.No,1,1,ck,stage1,32,moe_ck2stages_gemm1_256x32x64x128_1x4_TypeCast_v1_Nswizzle0_Quant0_MulRoutedWeight1_silu_B16_B16_B16,312.6766,0.0,0.00%,72.11,9037.81
283,256,7168,256,256,8,ActivationType.Silu,torch.bfloat16,torch.bfloat16,torch.bfloat16,QuantType.No,1,1,ck,stage2,64,moe_ck2stages_gemm2_256x64x128x128_1x4_TypeCast_v1_Nswizzle0_Quant0_MulRoutedWeight0_B16_B16_B16,166.7633,0.0,0.00%,135.21,16945.65
284,256,7168,256,256,8,ActivationType.Silu,torch.bfloat16,torch.float8_e4m3fn,torch.float8_e4m3fn,QuantType.per_Tensor,1,0,ck,stage1,32,moe_ck2stages_gemm1_256x32x64x256_1x4_TypeCast_v1_Nswizzle0_Quant1_MulRoutedWeight0_silu_F8_F8_B16,158.9416,26.49988888888885,0.00%,141.87,8901.33
284,256,7168,256,256,8,ActivationType.Silu,torch.bfloat16,torch.float8_e4m3fn,torch.float8_e4m3fn,QuantType.per_Tensor,1,0,asm,stage1,16,_ZN5aiter48fmoe_stage1_bf16_pertokenFp8_g1u1_16x256_3tg_pf2E,166.1526,26.49988888888885,0.21%,135.71,8515.01
284,256,7168,256,256,8,ActivationType.Silu,torch.bfloat16,torch.float8_e4m3fn,torch.float8_e4m3fn,QuantType.per_Tensor,1,0,ck,stage2,32,moe_ck2stages_gemm2_256x32x128x256_1x4_TypeCast_v1_Nswizzle0_Quant1_MulRoutedWeight1_F8_F8_B16,93.2315,26.49988888888885,1.31%,241.86,15175.03
285,256,7168,256,256,8,ActivationType.Silu,torch.bfloat16,torch.float8_e4m3fn,torch.float8_e4m3fn,QuantType.per_Tensor,1,1,ck,stage1,32,moe_ck2stages_gemm1_256x32x64x256_1x4_TypeCast_v1_Nswizzle0_Quant1_MulRoutedWeight1_silu_F8_F8_B16,158.7691,27.242111111111125,0.00%,142.02,8911.0
285,256,7168,256,256,8,ActivationType.Silu,torch.bfloat16,torch.float8_e4m3fn,torch.float8_e4m3fn,QuantType.per_Tensor,1,1,asm,stage1,16,_ZN5aiter57fmoe_stage1_bf16_pertokenFp8_doweight_g1u1_16x128_4tg_pf2E,165.8727,27.242111111111125,0.07%,135.94,8529.38
285,256,7168,256,256,8,ActivationType.Silu,torch.bfloat16,torch.float8_e4m3fn,torch.float8_e4m3fn,QuantType.per_Tensor,1,1,ck,stage2,32,moe_ck2stages_gemm2_256x32x128x256_1x4_TypeCast_v1_Nswizzle0_Quant1_MulRoutedWeight0_F8_F8_B16,93.6725,27.242111111111125,0.00%,240.72,15103.59
286,256,7168,256,256,8,ActivationType.Silu,torch.bfloat16,torch.float8_e4m3fn,torch.float8_e4m3fn,QuantType.per_Token,1,0,asm,stage1,16,_ZN5aiter48fmoe_stage1_bf16_pertokenFp8_g1u1_16x256_3tg_pf2E,157.8292,23.94755555555554,0.17%,142.87,8964.06
286,256,7168,256,256,8,ActivationType.Silu,torch.bfloat16,torch.float8_e4m3fn,torch.float8_e4m3fn,QuantType.per_Token,1,0,ck,stage1,64,moe_ck2stages_gemm1_256x64x64x256_1x4_TypeCast_v1_Nswizzle0_Quant2_MulRoutedWeight0_silu_F8_F8_B16,159.527,23.94755555555554,0.00%,141.35,8868.66
286,256,7168,256,256,8,ActivationType.Silu,torch.bfloat16,torch.float8_e4m3fn,torch.float8_e4m3fn,QuantType.per_Token,1,0,ck,stage2,32,moe_ck2stages_gemm2_256x32x128x256_1x4_TypeCast_v1_Nswizzle0_Quant2_MulRoutedWeight1_F8_F8_B16,108.3248,23.94755555555554,1.29%,208.16,13060.64
286,256,7168,256,256,8,ActivationType.Silu,torch.bfloat16,torch.float8_e4m3fn,torch.float8_e4m3fn,QuantType.per_Token,1,0,asm,asm_1stage,32,_ZN5aiter45fmoe_bf16_pertokenFp8_g1u1_vs_silu_1tg_32x256E,255.4507,0.0,0.00%,88.27,5538.41
287,256,7168,256,256,8,ActivationType.Silu,torch.bfloat16,torch.float8_e4m3fn,torch.float8_e4m3fn,QuantType.per_Token,1,1,asm,stage1,16,_ZN5aiter57fmoe_stage1_bf16_pertokenFp8_doweight_g1u1_16x256_3tg_pf2E,157.7084,26.365555555555563,0.04%,142.98,8970.93
287,256,7168,256,256,8,ActivationType.Silu,torch.bfloat16,torch.float8_e4m3fn,torch.float8_e4m3fn,QuantType.per_Token,1,1,ck,stage1,64,moe_ck2stages_gemm1_256x64x64x256_1x4_TypeCast_v1_Nswizzle0_Quant2_MulRoutedWeight1_silu_F8_F8_B16,159.8925,26.365555555555563,0.00%,141.02,8848.39
287,256,7168,256,256,8,ActivationType.Silu,torch.bfloat16,torch.float8_e4m3fn,torch.float8_e4m3fn,QuantType.per_Token,1,1,ck,stage2,32,moe_ck2stages_gemm2_256x32x128x256_1x4_TypeCast_v1_Nswizzle0_Quant2_MulRoutedWeight0_F8_F8_B16,107.4922,26.365555555555563,0.00%,209.77,13161.8
287,256,7168,256,256,8,ActivationType.Silu,torch.bfloat16,torch.float8_e4m3fn,torch.float8_e4m3fn,QuantType.per_Token,1,1,asm,asm_1stage,32,_ZN5aiter50fmoe_bf16_pertokenFp8_g1u1_vs_tkw1_silu_1tg_32x256E,257.2037,0.0,0.00%,87.67,5500.66
288,256,7168,256,256,8,ActivationType.Gelu,torch.bfloat16,torch.float8_e4m3fn,torch.float8_e4m3fn,QuantType.per_1x128,1,0,ck,stage1,16,moe_ck2stages_gemm1_256x16x128x256_1x4_MulABScaleExpertWeightA8W8blkscale_v1_Nswizzle0_Quant4_MulRoutedWeight0_gelu_F8_F8_B16,164.2527,27.645666666666685,0.12%,137.28,8613.5
288,256,7168,256,256,8,ActivationType.Gelu,torch.bfloat16,torch.float8_e4m3fn,torch.float8_e4m3fn,QuantType.per_1x128,1,0,ck,stage2,16,moe_ck2stages_gemm2_256x16x128x256_1x4_MulABScaleExpertWeightA8W8blkscale_v1_Nswizzle0_Quant4_MulRoutedWeight1_F8_F8_B16,90.6414,27.645666666666685,15.67%,248.77,15608.66
288,256,7168,256,256,8,ActivationType.Gelu,torch.bfloat16,torch.float8_e4m3fn,torch.float8_e4m3fn,QuantType.per_1x128,1,0,asm,asm_1stage,32,_ZN5aiter52fmoe_bf16_blockscaleFp8_g1u1_novs_gelu_1tg_ps_32x256E,252.17,0.0,2.33%,89.42,5610.47
289,256,7168,256,256,8,ActivationType.Gelu,torch.bfloat16,torch.float8_e4m3fn,torch.float8_e4m3fn,QuantType.per_1x128,1,1,ck,stage1,16,moe_ck2stages_gemm1_256x16x128x256_1x4_MulABScaleExpertWeightA8W8blkscale_v1_Nswizzle0_Quant4_MulRoutedWeight1_gelu_F8_F8_B16,163.0448,26.801111111111133,0.12%,138.3,8677.32
289,256,7168,256,256,8,ActivationType.Gelu,torch.bfloat16,torch.float8_e4m3fn,torch.float8_e4m3fn,QuantType.per_1x128,1,1,ck,stage2,32,moe_ck2stages_gemm2_256x32x128x128_1x4_MulABScaleExpertWeightA8W8blkscale_v1_Nswizzle0_Quant4_MulRoutedWeight0_F8_F8_B16,89.0263,26.801111111111133,16.68%,253.28,15891.83
290,256,7168,256,256,8,ActivationType.Silu,torch.bfloat16,torch.float8_e4m3fn,torch.float8_e4m3fn,QuantType.per_1x128,1,1,ck,stage1,16,moe_ck2stages_gemm1_256x16x128x256_1x4_MulABScaleExpertWeightA8W8blkscale_v1_Nswizzle0_Quant4_MulRoutedWeight1_silu_F8_F8_B16,163.0122,26.39655555555556,0.12%,138.32,8679.05
290,256,7168,256,256,8,ActivationType.Silu,torch.bfloat16,torch.float8_e4m3fn,torch.float8_e4m3fn,QuantType.per_1x128,1,1,ck,stage2,32,moe_ck2stages_gemm2_256x32x128x128_1x4_MulABScaleExpertWeightA8W8blkscale_v1_Nswizzle0_Quant4_MulRoutedWeight0_F8_F8_B16,89.5536,26.39655555555556,16.62%,251.79,15798.26
291,256,7168,256,256,8,ActivationType.Silu,torch.bfloat16,torch.float8_e4m3fn,torch.float8_e4m3fn,QuantType.per_1x128,1,0,ck,stage1,16,moe_ck2stages_gemm1_256x16x128x256_1x4_MulABScaleExpertWeightA8W8blkscale_v1_Nswizzle0_Quant4_MulRoutedWeight0_silu_F8_F8_B16,164.4194,27.352111111111125,0.10%,137.14,8604.77
291,256,7168,256,256,8,ActivationType.Silu,torch.bfloat16,torch.float8_e4m3fn,torch.float8_e4m3fn,QuantType.per_1x128,1,0,ck,stage2,32,moe_ck2stages_gemm2_256x32x128x128_1x4_MulABScaleExpertWeightA8W8blkscale_v1_Nswizzle0_Quant4_MulRoutedWeight1_F8_F8_B16,90.9432,27.352111111111125,15.71%,247.94,15556.87
291,256,7168,256,256,8,ActivationType.Silu,torch.bfloat16,torch.float8_e4m3fn,torch.float8_e4m3fn,QuantType.per_1x128,1,0,asm,asm_1stage,32,_ZN5aiter52fmoe_bf16_blockscaleFp8_g1u1_novs_silu_1tg_ps_32x256E,251.6639,0.0,0.00%,89.6,5621.75
292,256,7168,256,257,9,ActivationType.Silu,torch.bfloat16,torch.float8_e4m3fn,torch.float8_e4m3fn,QuantType.per_Token,1,0,ck,stage1,32,moe_ck2stages_gemm1_256x32x64x256_1x4_TypeCast_v1_Nswizzle0_Quant2_MulRoutedWeight0_silu_F8_F8_B16,173.4264,29.02777777777778,0.00%,146.27,8189.62
292,256,7168,256,257,9,ActivationType.Silu,torch.bfloat16,torch.float8_e4m3fn,torch.float8_e4m3fn,QuantType.per_Token,1,0,asm,stage1,16,_ZN5aiter47fmoe_stage1_bf16_pertokenFp8_g1u1_16x64_5tg_pf3E,174.1653,29.02777777777778,3.72%,145.65,8154.87
292,256,7168,256,257,9,ActivationType.Silu,torch.bfloat16,torch.float8_e4m3fn,torch.float8_e4m3fn,QuantType.per_Token,1,0,ck,stage2,32,moe_ck2stages_gemm2_256x32x128x256_1x4_TypeCast_v1_Nswizzle0_Quant2_MulRoutedWeight1_F8_F8_B16,108.1318,29.02777777777778,1.37%,234.59,13134.86
292,256,7168,256,257,9,ActivationType.Silu,torch.bfloat16,torch.float8_e4m3fn,torch.float8_e4m3fn,QuantType.per_Token,1,0,asm,asm_1stage,32,_ZN5aiter45fmoe_bf16_pertokenFp8_g1u1_vs_silu_1tg_32x256E,328.8949,0.0,0.00%,77.13,4318.39
293,256,7168,256,257,9,ActivationType.Silu,torch.bfloat16,torch.float8_e4m3fn,torch.float8_e4m3fn,QuantType.per_1x128,1,0,ck,stage1,16,moe_ck2stages_gemm1_256x16x128x256_1x4_MulABScaleExpertWeightA8W8blkscale_v1_Nswizzle0_Quant4_MulRoutedWeight0_silu_F8_F8_B16,192.3683,29.072222222222194,0.11%,131.87,7383.21
293,256,7168,256,257,9,ActivationType.Silu,torch.bfloat16,torch.float8_e4m3fn,torch.float8_e4m3fn,QuantType.per_1x128,1,0,ck,stage2,32,moe_ck2stages_gemm2_256x32x128x128_1x4_MulABScaleExpertWeightA8W8blkscale_v1_Nswizzle0_Quant4_MulRoutedWeight1_F8_F8_B16,91.7334,29.072222222222194,16.81%,276.53,15482.87
293,256,7168,256,257,9,ActivationType.Silu,torch.bfloat16,torch.float8_e4m3fn,torch.float8_e4m3fn,QuantType.per_1x128,1,0,asm,asm_1stage,32,_ZN5aiter47fmoe_bf16_blockscaleFp8_g1u1_vs_silu_1tg_32x256E,338.8025,0.0,0.00%,74.87,4192.11
294,256,7168,512,256,8,ActivationType.Gelu,torch.bfloat16,torch.bfloat16,torch.bfloat16,QuantType.No,1,0,ck,stage1,64,moe_ck2stages_gemm1_256x64x64x128_1x4_TypeCast_v1_Nswizzle0_Quant0_MulRoutedWeight0_gelu_B16_B16_B16,616.7209,0.0,0.00%,73.12,9152.41
294,256,7168,512,256,8,ActivationType.Gelu,torch.bfloat16,torch.bfloat16,torch.bfloat16,QuantType.No,1,0,ck,stage2,32,moe_ck2stages_gemm2_256x32x128x128_1x4_TypeCast_v1_Nswizzle0_Quant0_MulRoutedWeight1_B16_B16_B16,316.5285,0.0,3.29%,142.47,17832.47
295,256,7168,512,256,8,ActivationType.Gelu,torch.bfloat16,torch.bfloat16,torch.bfloat16,QuantType.No,1,1,ck,stage1,64,moe_ck2stages_gemm1_256x64x64x64_1x4_TypeCast_v1_Nswizzle0_Quant0_MulRoutedWeight1_gelu_B16_B16_B16,618.5984,0.0,0.00%,72.9,9124.63
295,256,7168,512,256,8,ActivationType.Gelu,torch.bfloat16,torch.bfloat16,torch.bfloat16,QuantType.No,1,1,ck,stage2,64,moe_ck2stages_gemm2_256x64x128x128_1x4_TypeCast_v1_Nswizzle0_Quant0_MulRoutedWeight0_B16_B16_B16,314.4735,0.0,0.01%,143.41,17949.0
296,256,7168,512,256,8,ActivationType.Gelu,torch.bfloat16,torch.float8_e4m3fn,torch.float8_e4m3fn,QuantType.per_Tensor,1,0,ck,stage1,32,moe_ck2stages_gemm1_256x32x64x256_1x4_TypeCast_v1_Nswizzle0_Quant1_MulRoutedWeight0_gelu_F8_F8_B16,313.4264,32.34433333333334,0.00%,143.88,9010.34
296,256,7168,512,256,8,ActivationType.Gelu,torch.bfloat16,torch.float8_e4m3fn,torch.float8_e4m3fn,QuantType.per_Tensor,1,0,asm,stage1,16,_ZN5aiter48fmoe_stage1_bf16_pertokenFp8_g1u1_16x256_3tg_pf2E,320.3856,32.34433333333334,0.10%,140.76,8814.62
296,256,7168,512,256,8,ActivationType.Gelu,torch.bfloat16,torch.float8_e4m3fn,torch.float8_e4m3fn,QuantType.per_Tensor,1,0,ck,stage2,32,moe_ck2stages_gemm2_256x32x128x256_1x4_TypeCast_v1_Nswizzle0_Quant1_MulRoutedWeight1_F8_F8_B16,164.9089,32.34433333333334,3.28%,273.47,17125.08
297,256,7168,512,256,8,ActivationType.Gelu,torch.bfloat16,torch.float8_e4m3fn,torch.float8_e4m3fn,QuantType.per_Tensor,1,1,ck,stage1,64,moe_ck2stages_gemm1_256x64x64x256_1x4_TypeCast_v1_Nswizzle0_Quant1_MulRoutedWeight1_gelu_F8_F8_B16,312.8394,32.43766666666656,0.00%,144.15,9027.24
297,256,7168,512,256,8,ActivationType.Gelu,torch.bfloat16,torch.float8_e4m3fn,torch.float8_e4m3fn,QuantType.per_Tensor,1,1,asm,stage1,32,_ZN5aiter53fmoe_stage1_bf16_pertokenFp8_doweight_g1u1_32x512_pf2E,320.3338,32.43766666666656,0.00%,140.78,8816.05
297,256,7168,512,256,8,ActivationType.Gelu,torch.bfloat16,torch.float8_e4m3fn,torch.float8_e4m3fn,QuantType.per_Tensor,1,1,ck,stage2,32,moe_ck2stages_gemm2_256x32x128x256_1x4_TypeCast_v1_Nswizzle0_Quant1_MulRoutedWeight0_F8_F8_B16,166.997,32.43766666666656,0.01%,270.05,16910.95
298,256,7168,512,256,8,ActivationType.Gelu,torch.bfloat16,torch.float8_e4m3fn,torch.float8_e4m3fn,QuantType.per_Token,1,0,asm,stage1,16,_ZN5aiter48fmoe_stage1_bf16_pertokenFp8_g1u1_16x256_3tg_pf2E,312.1038,32.53888888888889,0.15%,144.49,9048.52
298,256,7168,512,256,8,ActivationType.Gelu,torch.bfloat16,torch.float8_e4m3fn,torch.float8_e4m3fn,QuantType.per_Token,1,0,ck,stage1,64,moe_ck2stages_gemm1_256x64x64x256_1x4_TypeCast_v1_Nswizzle0_Quant2_MulRoutedWeight0_gelu_F8_F8_B16,314.6402,32.53888888888889,0.00%,143.33,8975.58
298,256,7168,512,256,8,ActivationType.Gelu,torch.bfloat16,torch.float8_e4m3fn,torch.float8_e4m3fn,QuantType.per_Token,1,0,ck,stage2,32,moe_ck2stages_gemm2_256x32x128x256_1x4_TypeCast_v1_Nswizzle0_Quant2_MulRoutedWeight1_F8_F8_B16,176.0319,32.53888888888889,3.26%,256.19,16042.99
298,256,7168,512,256,8,ActivationType.Gelu,torch.bfloat16,torch.float8_e4m3fn,torch.float8_e4m3fn,QuantType.per_Token,1,0,asm,asm_1stage,32,_ZN5aiter48fmoe_bf16_pertokenFp8_g1u1_vs_gelu_1tg_ps_32x512E,484.5682,0.0,0.00%,93.07,5828.03
299,256,7168,512,256,8,ActivationType.Gelu,torch.bfloat16,torch.float8_e4m3fn,torch.float8_e4m3fn,QuantType.per_Token,1,1,asm,stage1,16,_ZN5aiter57fmoe_stage1_bf16_pertokenFp8_doweight_g1u1_16x256_3tg_pf2E,312.221,27.4587777777778,0.12%,144.44,9045.12
299,256,7168,512,256,8,ActivationType.Gelu,torch.bfloat16,torch.float8_e4m3fn,torch.float8_e4m3fn,QuantType.per_Token,1,1,ck,stage1,32,moe_ck2stages_gemm1_256x32x64x256_1x4_TypeCast_v1_Nswizzle0_Quant2_MulRoutedWeight1_gelu_F8_F8_B16,316.5202,27.4587777777778,0.00%,142.48,8922.27
299,256,7168,512,256,8,ActivationType.Gelu,torch.bfloat16,torch.float8_e4m3fn,torch.float8_e4m3fn,QuantType.per_Token,1,1,ck,stage2,32,moe_ck2stages_gemm2_256x32x128x256_1x4_TypeCast_v1_Nswizzle0_Quant2_MulRoutedWeight0_F8_F8_B16,177.7284,27.4587777777778,0.01%,253.74,15889.85
299,256,7168,512,256,8,ActivationType.Gelu,torch.bfloat16,torch.float8_e4m3fn,torch.float8_e4m3fn,QuantType.per_Token,1,1,asm,asm_1stage,32,_ZN5aiter50fmoe_bf16_pertokenFp8_g1u1_vs_tkw1_gelu_1tg_32x512E,479.6627,0.0,0.00%,94.02,5887.63
300,256,7168,512,256,8,ActivationType.Silu,torch.bfloat16,torch.bfloat16,torch.bfloat16,QuantType.No,1,1,ck,stage1,64,moe_ck2stages_gemm1_256x64x64x128_1x4_TypeCast_v1_Nswizzle0_Quant0_MulRoutedWeight1_silu_B16_B16_B16,618.4556,0.0,0.00%,72.92,9126.74
300,256,7168,512,256,8,ActivationType.Silu,torch.bfloat16,torch.bfloat16,torch.bfloat16,QuantType.No,1,1,ck,stage2,64,moe_ck2stages_gemm2_256x64x128x128_1x4_TypeCast_v1_Nswizzle0_Quant0_MulRoutedWeight0_B16_B16_B16,314.0039,0.0,0.00%,143.62,17975.84
301,256,7168,512,256,8,ActivationType.Silu,torch.bfloat16,torch.float8_e4m3fn,torch.float8_e4m3fn,QuantType.per_Tensor,1,0,ck,stage1,64,moe_ck2stages_gemm1_256x64x64x256_1x4_TypeCast_v1_Nswizzle0_Quant1_MulRoutedWeight0_silu_F8_F8_B16,313.9644,31.504444444444463,0.00%,143.64,8994.9
301,256,7168,512,256,8,ActivationType.Silu,torch.bfloat16,torch.float8_e4m3fn,torch.float8_e4m3fn,QuantType.per_Tensor,1,0,asm,stage1,16,_ZN5aiter44fmoe_stage1_bf16_pertokenFp8_g1u1_16x512_pf3E,320.7516,31.504444444444463,0.00%,140.6,8804.56
301,256,7168,512,256,8,ActivationType.Silu,torch.bfloat16,torch.float8_e4m3fn,torch.float8_e4m3fn,QuantType.per_Tensor,1,0,ck,stage2,32,moe_ck2stages_gemm2_256x32x128x256_1x4_TypeCast_v1_Nswizzle0_Quant1_MulRoutedWeight1_F8_F8_B16,166.6891,31.504444444444463,2.77%,270.55,16942.18
302,256,7168,512,256,8,ActivationType.Silu,torch.bfloat16,torch.float8_e4m3fn,torch.float8_e4m3fn,QuantType.per_Tensor,1,1,ck,stage1,32,moe_ck2stages_gemm1_256x32x64x256_1x4_TypeCast_v1_Nswizzle0_Quant1_MulRoutedWeight1_silu_F8_F8_B16,313.8374,32.668888888888915,0.00%,143.7,8998.54
302,256,7168,512,256,8,ActivationType.Silu,torch.bfloat16,torch.float8_e4m3fn,torch.float8_e4m3fn,QuantType.per_Tensor,1,1,asm,stage1,64,_ZN5aiter57fmoe_stage1_bf16_pertokenFp8_doweight_g1u1_64x128_2tg_pf2E,320.861,32.668888888888915,0.00%,140.55,8801.56
302,256,7168,512,256,8,ActivationType.Silu,torch.bfloat16,torch.float8_e4m3fn,torch.float8_e4m3fn,QuantType.per_Tensor,1,1,ck,stage2,32,moe_ck2stages_gemm2_256x32x128x256_1x4_TypeCast_v1_Nswizzle0_Quant1_MulRoutedWeight0_F8_F8_B16,167.291,32.668888888888915,0.00%,269.57,16881.23
303,256,7168,512,256,8,ActivationType.Silu,torch.bfloat16,torch.float8_e4m3fn,torch.float8_e4m3fn,QuantType.per_Token,1,0,asm,stage1,32,_ZN5aiter44fmoe_stage1_bf16_pertokenFp8_g1u1_32x512_pf3E,311.6846,31.036444444444456,0.00%,144.69,9060.69
303,256,7168,512,256,8,ActivationType.Silu,torch.bfloat16,torch.float8_e4m3fn,torch.float8_e4m3fn,QuantType.per_Token,1,0,ck,stage1,64,moe_ck2stages_gemm1_256x64x64x256_1x4_TypeCast_v1_Nswizzle0_Quant2_MulRoutedWeight0_silu_F8_F8_B16,314.5804,31.036444444444456,0.00%,143.36,8977.28
303,256,7168,512,256,8,ActivationType.Silu,torch.bfloat16,torch.float8_e4m3fn,torch.float8_e4m3fn,QuantType.per_Token,1,0,ck,stage2,32,moe_ck2stages_gemm2_256x32x128x256_1x4_TypeCast_v1_Nswizzle0_Quant2_MulRoutedWeight1_F8_F8_B16,175.4662,31.036444444444456,2.79%,257.01,16094.71
303,256,7168,512,256,8,ActivationType.Silu,torch.bfloat16,torch.float8_e4m3fn,torch.float8_e4m3fn,QuantType.per_Token,1,0,asm,asm_1stage,32,_ZN5aiter45fmoe_bf16_pertokenFp8_g1u1_vs_silu_1tg_32x512E,480.3767,0.0,0.00%,93.88,5878.88
304,256,7168,512,256,8,ActivationType.Silu,torch.bfloat16,torch.float8_e4m3fn,torch.float8_e4m3fn,QuantType.per_Token,1,1,asm,stage1,16,_ZN5aiter53fmoe_stage1_bf16_pertokenFp8_doweight_g1u1_16x512_pf3E,312.2929,29.8544444444444,0.00%,144.41,9043.04
304,256,7168,512,256,8,ActivationType.Silu,torch.bfloat16,torch.float8_e4m3fn,torch.float8_e4m3fn,QuantType.per_Token,1,1,ck,stage1,32,moe_ck2stages_gemm1_256x32x64x256_1x4_TypeCast_v1_Nswizzle0_Quant2_MulRoutedWeight1_silu_F8_F8_B16,313.2314,29.8544444444444,0.00%,143.97,9015.95
304,256,7168,512,256,8,ActivationType.Silu,torch.bfloat16,torch.float8_e4m3fn,torch.float8_e4m3fn,QuantType.per_Token,1,1,ck,stage2,32,moe_ck2stages_gemm2_256x32x128x256_1x4_TypeCast_v1_Nswizzle0_Quant2_MulRoutedWeight0_F8_F8_B16,177.3097,29.8544444444444,0.00%,254.34,15927.37
304,256,7168,512,256,8,ActivationType.Silu,torch.bfloat16,torch.float8_e4m3fn,torch.float8_e4m3fn,QuantType.per_Token,1,1,asm,asm_1stage,32,_ZN5aiter53fmoe_bf16_pertokenFp8_g1u1_vs_tkw1_silu_1tg_ps_32x512E,481.2315,0.0,0.00%,93.71,5868.44
305,256,7168,512,256,8,ActivationType.Silu,torch.bfloat16,torch.bfloat16,torch.bfloat16,QuantType.No,1,0,ck,stage1,64,moe_ck2stages_gemm1_256x64x64x128_1x4_TypeCast_v1_Nswizzle0_Quant0_MulRoutedWeight0_silu_B16_B16_B16,617.4529,0.0,0.00%,73.04,9141.56
305,256,7168,512,256,8,ActivationType.Silu,torch.bfloat16,torch.bfloat16,torch.bfloat16,QuantType.No,1,0,ck,stage2,32,moe_ck2stages_gemm2_256x32x128x128_1x4_TypeCast_v1_Nswizzle0_Quant0_MulRoutedWeight1_B16_B16_B16,316.7602,0.0,2.77%,142.37,17819.42
306,256,7168,512,256,8,ActivationType.Gelu,torch.bfloat16,torch.float8_e4m3fn,torch.float8_e4m3fn,QuantType.per_1x128,1,0,ck,stage1,16,moe_ck2stages_gemm1_256x16x128x256_1x4_MulABScaleExpertWeightA8W8blkscale_v1_Nswizzle0_Quant4_MulRoutedWeight0_gelu_F8_F8_B16,320.0091,33.55200000000003,0.11%,140.92,8824.99
306,256,7168,512,256,8,ActivationType.Gelu,torch.bfloat16,torch.float8_e4m3fn,torch.float8_e4m3fn,QuantType.per_1x128,1,0,ck,stage2,16,moe_ck2stages_gemm2_256x16x128x256_1x4_MulABScaleExpertWeightA8W8blkscale_v1_Nswizzle0_Quant4_MulRoutedWeight1_F8_F8_B16,166.4378,33.55200000000003,15.69%,270.96,16967.76
306,256,7168,512,256,8,ActivationType.Gelu,torch.bfloat16,torch.float8_e4m3fn,torch.float8_e4m3fn,QuantType.per_1x128,1,0,asm,asm_1stage,32,_ZN5aiter49fmoe_bf16_blockscaleFp8_g1u1_novs_gelu_1tg_32x256E,491.9509,0.0,10.24%,91.67,5740.57
307,256,7168,512,256,8,ActivationType.Silu,torch.bfloat16,torch.float8_e4m3fn,torch.float8_e4m3fn,QuantType.per_1x128,1,0,ck,stage1,16,moe_ck2stages_gemm1_256x16x128x256_1x4_MulABScaleExpertWeightA8W8blkscale_v1_Nswizzle0_Quant4_MulRoutedWeight0_silu_F8_F8_B16,320.7834,32.72099999999998,0.12%,140.58,8803.69
307,256,7168,512,256,8,ActivationType.Silu,torch.bfloat16,torch.float8_e4m3fn,torch.float8_e4m3fn,QuantType.per_1x128,1,0,ck,stage2,16,moe_ck2stages_gemm2_256x16x128x256_1x4_MulABScaleExpertWeightA8W8blkscale_v1_Nswizzle0_Quant4_MulRoutedWeight1_F8_F8_B16,166.7383,32.72099999999998,15.68%,270.47,16937.18
307,256,7168,512,256,8,ActivationType.Silu,torch.bfloat16,torch.float8_e4m3fn,torch.float8_e4m3fn,QuantType.per_1x128,1,0,asm,asm_1stage,32,_ZN5aiter50fmoe_bf16_blockscaleFp8_g1u1_vs_silu_1tg_ps_32x256E,492.9122,0.0,0.00%,91.49,5729.37
308,256,7168,512,256,8,ActivationType.Gelu,torch.bfloat16,torch.float8_e4m3fn,torch.float8_e4m3fn,QuantType.per_1x128,1,1,ck,stage1,16,moe_ck2stages_gemm1_256x16x128x256_1x4_MulABScaleExpertWeightA8W8blkscale_v1_Nswizzle0_Quant4_MulRoutedWeight1_gelu_F8_F8_B16,319.5856,32.51644444444446,0.13%,141.11,8836.69
308,256,7168,512,256,8,ActivationType.Gelu,torch.bfloat16,torch.float8_e4m3fn,torch.float8_e4m3fn,QuantType.per_1x128,1,1,ck,stage2,16,moe_ck2stages_gemm2_256x16x128x256_1x4_MulABScaleExpertWeightA8W8blkscale_v1_Nswizzle0_Quant4_MulRoutedWeight0_F8_F8_B16,164.7318,32.51644444444446,16.69%,273.76,17143.49
309,256,7168,512,256,8,ActivationType.Silu,torch.bfloat16,torch.float8_e4m3fn,torch.float8_e4m3fn,QuantType.per_1x128,1,1,ck,stage1,16,moe_ck2stages_gemm1_256x16x128x256_1x4_MulABScaleExpertWeightA8W8blkscale_v1_Nswizzle0_Quant4_MulRoutedWeight1_silu_F8_F8_B16,319.4648,30.12988888888892,0.12%,141.16,8840.03
309,256,7168,512,256,8,ActivationType.Silu,torch.bfloat16,torch.float8_e4m3fn,torch.float8_e4m3fn,QuantType.per_1x128,1,1,ck,stage2,16,moe_ck2stages_gemm2_256x16x128x256_1x4_MulABScaleExpertWeightA8W8blkscale_v1_Nswizzle0_Quant4_MulRoutedWeight0_F8_F8_B16,164.7434,30.12988888888892,16.70%,273.74,17142.28
310,256,7168,2048,33,10,ActivationType.Silu,torch.bfloat16,torch.float8_e4m3fn,torch.float8_e4m3fn,QuantType.per_1x128,1,0,ck,stage1,64,moe_ck2stages_gemm1_256x64x128x128_1x4_MulABScaleExpertWeightA8W8blkscale_v3_Nswizzle0_Quant4_MulRoutedWeight0_silu_F8_F8_B16,278.5618,67.42355555555561,0.12%,809.46,5237.01
310,256,7168,2048,33,10,ActivationType.Silu,torch.bfloat16,torch.float8_e4m3fn,torch.float8_e4m3fn,QuantType.per_1x128,1,0,ck,stage2,64,moe_ck2stages_gemm2_256x64x128x128_1x4_MulABScaleExpertWeightA8W8blkscale_v3_Nswizzle0_Quant4_MulRoutedWeight1_F8_F8_B16,153.4494,67.42355555555561,16.99%,1469.45,9506.92
310,256,7168,2048,33,10,ActivationType.Silu,torch.bfloat16,torch.float8_e4m3fn,torch.float8_e4m3fn,QuantType.per_1x128,1,0,asm,asm_1stage,32,_ZN5aiter47fmoe_bf16_blockscaleFp8_g1u1_vs_silu_1tg_32x256E,559.8256,0.0,0.00%,402.78,2605.87
311,256,7168,2048,33,10,ActivationType.Silu,torch.bfloat16,torch.float8_e4m3fn,torch.float8_e4m3fn,QuantType.per_Token,1,0,asm,stage1,64,_ZN5aiter48fmoe_stage1_bf16_pertokenFp8_g1u1_64x128_2tg_pf3E,205.5771,54.35677777777781,0.02%,1096.84,7096.27
311,256,7168,2048,33,10,ActivationType.Silu,torch.bfloat16,torch.float8_e4m3fn,torch.float8_e4m3fn,QuantType.per_Token,1,0,ck,stage1,128,moe_ck2stages_gemm1_256x128x64x128_1x4_TypeCast_v1_Nswizzle0_Quant2_MulRoutedWeight0_silu_F8_F8_B16,217.3192,54.35677777777781,0.00%,1037.58,6712.85
311,256,7168,2048,33,10,ActivationType.Silu,torch.bfloat16,torch.float8_e4m3fn,torch.float8_e4m3fn,QuantType.per_Token,1,0,ck,stage2,32,moe_ck2stages_gemm2_256x32x128x256_1x4_TypeCast_v1_Nswizzle0_Quant2_MulRoutedWeight1_F8_F8_B16,134.8152,54.35677777777781,7.67%,1672.55,10820.97
311,256,7168,2048,33,10,ActivationType.Silu,torch.bfloat16,torch.float8_e4m3fn,torch.float8_e4m3fn,QuantType.per_Token,1,0,asm,asm_1stage,32,_ZN5aiter45fmoe_bf16_pertokenFp8_g1u1_vs_silu_1tg_32x512E,499.7349,0.0,0.00%,451.21,2919.21
312,512,2048,192,128,8,ActivationType.Silu,torch.bfloat16,torch.bfloat16,torch.bfloat16,QuantType.No,1,0,ck,stage1,64,moe_ck2stages_gemm1_256x64x64x64_1x4_TypeCast_v1_Nswizzle0_Quant0_MulRoutedWeight0_silu_B16_B16_B16,42.767,0.0,0.00%,225.96,7159.36
312,512,2048,192,128,8,ActivationType.Silu,torch.bfloat16,torch.bfloat16,torch.bfloat16,QuantType.No,1,0,ck,stage2,32,moe_ck2stages_gemm2_256x32x64x64_1x4_TypeCast_v1_Nswizzle0_Quant0_MulRoutedWeight1_B16_B16_B16,31.8491,0.0,0.00%,303.42,9613.59
313,512,2048,192,128,8,ActivationType.Silu,torch.bfloat16,torch.bfloat16,torch.bfloat16,QuantType.No,1,1,ck,stage1,64,moe_ck2stages_gemm1_256x64x64x64_1x4_TypeCast_v1_Nswizzle0_Quant0_MulRoutedWeight1_silu_B16_B16_B16,42.9546,0.0,0.00%,224.97,7128.09
313,512,2048,192,128,8,ActivationType.Silu,torch.bfloat16,torch.bfloat16,torch.bfloat16,QuantType.No,1,1,ck,stage2,32,moe_ck2stages_gemm2_256x32x64x64_1x4_TypeCast_v1_Nswizzle0_Quant0_MulRoutedWeight0_B16_B16_B16,30.4136,0.0,0.00%,317.74,10067.34
314,512,2048,192,128,8,ActivationType.Gelu,torch.bfloat16,torch.bfloat16,torch.bfloat16,QuantType.No,1,0,ck,stage1,64,moe_ck2stages_gemm1_256x64x64x64_1x4_TypeCast_v1_Nswizzle0_Quant0_MulRoutedWeight0_gelu_B16_B16_B16,42.1874,0.0,0.00%,229.07,7257.72
314,512,2048,192,128,8,ActivationType.Gelu,torch.bfloat16,torch.bfloat16,torch.bfloat16,QuantType.No,1,0,ck,stage2,32,moe_ck2stages_gemm2_256x32x64x64_1x4_TypeCast_v1_Nswizzle0_Quant0_MulRoutedWeight1_B16_B16_B16,31.9348,0.0,0.00%,302.61,9587.79
315,512,2048,192,128,8,ActivationType.Gelu,torch.bfloat16,torch.bfloat16,torch.bfloat16,QuantType.No,1,1,ck,stage1,64,moe_ck2stages_gemm1_256x64x64x64_1x4_TypeCast_v1_Nswizzle0_Quant0_MulRoutedWeight1_gelu_B16_B16_B16,43.1226,0.0,0.00%,224.1,7100.32
315,512,2048,192,128,8,ActivationType.Gelu,torch.bfloat16,torch.bfloat16,torch.bfloat16,QuantType.No,1,1,ck,stage2,32,moe_ck2stages_gemm2_256x32x64x64_1x4_TypeCast_v1_Nswizzle0_Quant0_MulRoutedWeight0_B16_B16_B16,30.7258,0.0,0.00%,314.51,9965.05
316,512,4096,192,128,8,ActivationType.Silu,torch.bfloat16,torch.bfloat16,torch.bfloat16,QuantType.No,1,0,ck,stage1,64,moe_ck2stages_gemm1_256x64x64x64_1x4_TypeCast_v1_Nswizzle0_Quant0_MulRoutedWeight0_silu_B16_B16_B16,76.7868,0.0,0.00%,251.7,7974.92
316,512,4096,192,128,8,ActivationType.Silu,torch.bfloat16,torch.bfloat16,torch.bfloat16,QuantType.No,1,0,ck,stage2,32,moe_ck2stages_gemm2_256x32x64x64_1x4_TypeCast_v1_Nswizzle0_Quant0_MulRoutedWeight1_B16_B16_B16,54.7943,0.0,0.08%,352.73,11175.77
317,512,4096,192,128,8,ActivationType.Silu,torch.bfloat16,torch.bfloat16,torch.bfloat16,QuantType.No,1,1,ck,stage1,64,moe_ck2stages_gemm1_256x64x64x64_1x4_TypeCast_v1_Nswizzle0_Quant0_MulRoutedWeight1_silu_B16_B16_B16,77.3122,0.0,0.00%,249.99,7920.72
317,512,4096,192,128,8,ActivationType.Silu,torch.bfloat16,torch.bfloat16,torch.bfloat16,QuantType.No,1,1,ck,stage2,32,moe_ck2stages_gemm2_256x32x64x64_1x4_TypeCast_v1_Nswizzle0_Quant0_MulRoutedWeight0_B16_B16_B16,52.5224,0.0,0.00%,367.98,11659.19
318,512,4096,192,128,8,ActivationType.Gelu,torch.bfloat16,torch.bfloat16,torch.bfloat16,QuantType.No,1,0,ck,stage1,64,moe_ck2stages_gemm1_256x64x64x64_1x4_TypeCast_v1_Nswizzle0_Quant0_MulRoutedWeight0_gelu_B16_B16_B16,77.1009,0.0,0.00%,250.68,7942.43
318,512,4096,192,128,8,ActivationType.Gelu,torch.bfloat16,torch.bfloat16,torch.bfloat16,QuantType.No,1,0,ck,stage2,32,moe_ck2stages_gemm2_256x32x64x64_1x4_TypeCast_v1_Nswizzle0_Quant0_MulRoutedWeight1_B16_B16_B16,54.4449,0.0,0.12%,354.99,11247.49
319,512,4096,192,128,8,ActivationType.Gelu,torch.bfloat16,torch.bfloat16,torch.bfloat16,QuantType.No,1,1,ck,stage1,64,moe_ck2stages_gemm1_256x64x64x64_1x4_TypeCast_v1_Nswizzle0_Quant0_MulRoutedWeight1_gelu_B16_B16_B16,77.0729,0.0,0.00%,250.77,7945.31
319,512,4096,192,128,8,ActivationType.Gelu,torch.bfloat16,torch.bfloat16,torch.bfloat16,QuantType.No,1,1,ck,stage2,32,moe_ck2stages_gemm2_256x32x64x64_1x4_TypeCast_v1_Nswizzle0_Quant0_MulRoutedWeight0_B16_B16_B16,52.8804,0.0,0.00%,365.49,11580.25
320,512,4096,384,128,8,ActivationType.Gelu,torch.bfloat16,torch.bfloat16,torch.bfloat16,QuantType.No,1,0,ck,stage1,64,moe_ck2stages_gemm1_256x64x64x64_1x4_TypeCast_v1_Nswizzle0_Quant0_MulRoutedWeight0_gelu_B16_B16_B16,144.0559,0.0,0.00%,268.33,8443.58
320,512,4096,384,128,8,ActivationType.Gelu,torch.bfloat16,torch.bfloat16,torch.bfloat16,QuantType.No,1,0,ck,stage2,32,moe_ck2stages_gemm2_256x32x64x64_1x4_TypeCast_v1_Nswizzle0_Quant0_MulRoutedWeight1_B16_B16_B16,87.6529,0.0,0.50%,441.0,13876.87
321,512,4096,384,128,8,ActivationType.Silu,torch.bfloat16,torch.bfloat16,torch.bfloat16,QuantType.No,1,0,ck,stage1,64,moe_ck2stages_gemm1_256x64x64x64_1x4_TypeCast_v1_Nswizzle0_Quant0_MulRoutedWeight0_silu_B16_B16_B16,143.8084,0.0,0.00%,268.79,8458.12
321,512,4096,384,128,8,ActivationType.Silu,torch.bfloat16,torch.bfloat16,torch.bfloat16,QuantType.No,1,0,ck,stage2,32,moe_ck2stages_gemm2_256x32x64x64_1x4_TypeCast_v1_Nswizzle0_Quant0_MulRoutedWeight1_B16_B16_B16,87.8153,0.0,0.37%,440.18,13851.21
322,512,4096,384,128,8,ActivationType.Silu,torch.bfloat16,torch.bfloat16,torch.bfloat16,QuantType.No,1,1,ck,stage1,64,moe_ck2stages_gemm1_256x64x64x64_1x4_TypeCast_v1_Nswizzle0_Quant0_MulRoutedWeight1_silu_B16_B16_B16,143.9314,0.0,0.00%,268.56,8450.89
322,512,4096,384,128,8,ActivationType.Silu,torch.bfloat16,torch.bfloat16,torch.bfloat16,QuantType.No,1,1,ck,stage2,64,moe_ck2stages_gemm2_256x64x64x64_1x4_TypeCast_v1_Nswizzle0_Quant0_MulRoutedWeight0_B16_B16_B16,85.1422,0.0,0.00%,454.0,14286.08
323,512,4096,384,128,8,ActivationType.Silu,torch.bfloat16,torch.float8_e4m3fn,torch.float8_e4m3fn,QuantType.per_Tensor,1,0,ck,stage1,64,moe_ck2stages_gemm1_256x64x64x128_1x4_TypeCast_v1_Nswizzle0_Quant1_MulRoutedWeight0_silu_F8_F8_B16,75.4934,36.49977777777784,0.00%,512.03,8083.77
323,512,4096,384,128,8,ActivationType.Silu,torch.bfloat16,torch.float8_e4m3fn,torch.float8_e4m3fn,QuantType.per_Tensor,1,0,asm,stage1,64,_ZN5aiter48fmoe_stage1_bf16_pertokenFp8_g1u1_64x128_2tg_pf2E,80.5375,36.49977777777784,0.00%,479.96,7577.48
323,512,4096,384,128,8,ActivationType.Silu,torch.bfloat16,torch.float8_e4m3fn,torch.float8_e4m3fn,QuantType.per_Tensor,1,0,ck,stage2,128,moe_ck2stages_gemm2_256x128x128x128_1x4_TypeCast_v3_Nswizzle0_Quant1_MulRoutedWeight1_F8_F8_B16,81.8423,36.49977777777784,0.36%,472.31,7456.67
324,512,4096,384,128,8,ActivationType.Silu,torch.bfloat16,torch.float8_e4m3fn,torch.float8_e4m3fn,QuantType.per_Tensor,1,1,ck,stage1,64,moe_ck2stages_gemm1_256x64x64x128_1x4_TypeCast_v1_Nswizzle0_Quant1_MulRoutedWeight1_silu_F8_F8_B16,75.7755,38.51777777777779,0.00%,510.12,8053.67
324,512,4096,384,128,8,ActivationType.Silu,torch.bfloat16,torch.float8_e4m3fn,torch.float8_e4m3fn,QuantType.per_Tensor,1,1,asm,stage1,64,_ZN5aiter57fmoe_stage1_bf16_pertokenFp8_doweight_g1u1_64x128_2tg_pf2E,80.8005,38.51777777777779,0.00%,478.4,7552.82
324,512,4096,384,128,8,ActivationType.Silu,torch.bfloat16,torch.float8_e4m3fn,torch.float8_e4m3fn,QuantType.per_Tensor,1,1,ck,stage2,128,moe_ck2stages_gemm2_256x128x128x128_1x4_TypeCast_v3_Nswizzle0_Quant1_MulRoutedWeight0_F8_F8_B16,81.2143,38.51777777777779,0.00%,475.96,7514.33
325,512,4096,384,128,8,ActivationType.Silu,torch.bfloat16,torch.float8_e4m3fn,torch.float8_e4m3fn,QuantType.per_Token,1,0,asm,stage1,64,_ZN5aiter48fmoe_stage1_bf16_pertokenFp8_g1u1_64x128_2tg_pf2E,72.2594,35.95222222222215,0.00%,534.94,8445.56
325,512,4096,384,128,8,ActivationType.Silu,torch.bfloat16,torch.float8_e4m3fn,torch.float8_e4m3fn,QuantType.per_Token,1,0,ck,stage1,64,moe_ck2stages_gemm1_256x64x64x128_1x4_TypeCast_v1_Nswizzle0_Quant2_MulRoutedWeight0_silu_F8_F8_B16,76.2561,35.95222222222215,0.00%,506.91,8002.92
325,512,4096,384,128,8,ActivationType.Silu,torch.bfloat16,torch.float8_e4m3fn,torch.float8_e4m3fn,QuantType.per_Token,1,0,ck,stage2,128,moe_ck2stages_gemm2_256x128x128x128_1x4_TypeCast_v3_Nswizzle0_Quant2_MulRoutedWeight1_F8_F8_B16,117.9444,35.95222222222215,0.36%,327.74,5174.23
325,512,4096,384,128,8,ActivationType.Silu,torch.bfloat16,torch.float8_e4m3fn,torch.float8_e4m3fn,QuantType.per_Token,1,0,asm,asm_1stage,32,_ZN5aiter48fmoe_bf16_pertokenFp8_g1u1_vs_silu_1tg_ps_32x384E,147.6325,0.0,0.00%,261.83,4133.72
326,512,4096,384,128,8,ActivationType.Silu,torch.bfloat16,torch.float8_e4m3fn,torch.float8_e4m3fn,QuantType.per_Token,1,1,asm,stage1,64,_ZN5aiter57fmoe_stage1_bf16_pertokenFp8_doweight_g1u1_64x128_2tg_pf2E,72.5267,36.64988888888889,0.00%,532.97,8414.44
326,512,4096,384,128,8,ActivationType.Silu,torch.bfloat16,torch.float8_e4m3fn,torch.float8_e4m3fn,QuantType.per_Token,1,1,ck,stage1,64,moe_ck2stages_gemm1_256x64x64x128_1x4_TypeCast_v1_Nswizzle0_Quant2_MulRoutedWeight1_silu_F8_F8_B16,76.6239,36.64988888888889,0.00%,504.47,7964.5
326,512,4096,384,128,8,ActivationType.Silu,torch.bfloat16,torch.float8_e4m3fn,torch.float8_e4m3fn,QuantType.per_Token,1,1,ck,stage2,128,moe_ck2stages_gemm2_256x128x128x128_1x4_TypeCast_v3_Nswizzle0_Quant2_MulRoutedWeight0_F8_F8_B16,112.8698,36.64988888888889,0.00%,342.47,5406.86
326,512,4096,384,128,8,ActivationType.Silu,torch.bfloat16,torch.float8_e4m3fn,torch.float8_e4m3fn,QuantType.per_Token,1,1,asm,asm_1stage,32,_ZN5aiter50fmoe_bf16_pertokenFp8_g1u1_vs_tkw1_silu_1tg_32x384E,144.0158,0.0,0.00%,268.41,4237.53
327,512,4096,384,128,8,ActivationType.Gelu,torch.bfloat16,torch.float8_e4m3fn,torch.float8_e4m3fn,QuantType.per_Tensor,1,0,ck,stage1,64,moe_ck2stages_gemm1_256x64x64x128_1x4_TypeCast_v1_Nswizzle0_Quant1_MulRoutedWeight0_gelu_F8_F8_B16,76.0417,36.03311111111111,0.00%,508.34,8025.48
327,512,4096,384,128,8,ActivationType.Gelu,torch.bfloat16,torch.float8_e4m3fn,torch.float8_e4m3fn,QuantType.per_Tensor,1,0,asm,stage1,64,_ZN5aiter47fmoe_stage1_bf16_pertokenFp8_g1u1_64x64_3tg_pf2E,81.1526,36.03311111111111,0.00%,476.32,7520.05
327,512,4096,384,128,8,ActivationType.Gelu,torch.bfloat16,torch.float8_e4m3fn,torch.float8_e4m3fn,QuantType.per_Tensor,1,0,ck,stage2,128,moe_ck2stages_gemm2_256x128x128x128_1x4_TypeCast_v3_Nswizzle0_Quant1_MulRoutedWeight1_F8_F8_B16,82.7858,36.03311111111111,0.50%,466.92,7371.69
328,512,4096,384,128,8,ActivationType.Gelu,torch.bfloat16,torch.float8_e4m3fn,torch.float8_e4m3fn,QuantType.per_Tensor,1,1,ck,stage1,64,moe_ck2stages_gemm1_256x64x64x128_1x4_TypeCast_v1_Nswizzle0_Quant1_MulRoutedWeight1_gelu_F8_F8_B16,75.6144,37.70433333333333,0.00%,511.21,8070.83
328,512,4096,384,128,8,ActivationType.Gelu,torch.bfloat16,torch.float8_e4m3fn,torch.float8_e4m3fn,QuantType.per_Tensor,1,1,asm,stage1,64,_ZN5aiter57fmoe_stage1_bf16_pertokenFp8_doweight_g1u1_64x128_2tg_pf2E,81.1208,37.70433333333333,0.00%,476.51,7522.99
328,512,4096,384,128,8,ActivationType.Gelu,torch.bfloat16,torch.float8_e4m3fn,torch.float8_e4m3fn,QuantType.per_Tensor,1,1,ck,stage2,128,moe_ck2stages_gemm2_256x128x128x128_1x4_TypeCast_v3_Nswizzle0_Quant1_MulRoutedWeight0_F8_F8_B16,81.0895,37.70433333333333,0.00%,476.69,7525.9
329,512,4096,384,128,8,ActivationType.Gelu,torch.bfloat16,torch.float8_e4m3fn,torch.float8_e4m3fn,QuantType.per_Token,1,0,asm,stage1,64,_ZN5aiter48fmoe_stage1_bf16_pertokenFp8_g1u1_64x128_2tg_pf2E,72.178,33.44988888888883,0.00%,535.55,8455.09
329,512,4096,384,128,8,ActivationType.Gelu,torch.bfloat16,torch.float8_e4m3fn,torch.float8_e4m3fn,QuantType.per_Token,1,0,ck,stage1,64,moe_ck2stages_gemm1_256x64x64x128_1x4_TypeCast_v1_Nswizzle0_Quant2_MulRoutedWeight0_gelu_F8_F8_B16,77.6553,33.44988888888883,0.00%,497.77,7858.72
329,512,4096,384,128,8,ActivationType.Gelu,torch.bfloat16,torch.float8_e4m3fn,torch.float8_e4m3fn,QuantType.per_Token,1,0,ck,stage2,128,moe_ck2stages_gemm2_256x128x128x128_1x4_TypeCast_v3_Nswizzle0_Quant2_MulRoutedWeight1_F8_F8_B16,118.0638,33.44988888888883,0.49%,327.41,5169.0
329,512,4096,384,128,8,ActivationType.Gelu,torch.bfloat16,torch.float8_e4m3fn,torch.float8_e4m3fn,QuantType.per_Token,1,0,asm,asm_1stage,32,_ZN5aiter48fmoe_bf16_pertokenFp8_g1u1_vs_gelu_1tg_ps_32x384E,147.9505,0.0,0.00%,261.27,4124.83
330,512,4096,384,128,8,ActivationType.Gelu,torch.bfloat16,torch.float8_e4m3fn,torch.float8_e4m3fn,QuantType.per_Token,1,1,asm,stage1,64,_ZN5aiter57fmoe_stage1_bf16_pertokenFp8_doweight_g1u1_64x128_2tg_pf2E,72.2436,34.77433333333336,0.00%,535.06,8447.41
330,512,4096,384,128,8,ActivationType.Gelu,torch.bfloat16,torch.float8_e4m3fn,torch.float8_e4m3fn,QuantType.per_Token,1,1,ck,stage1,64,moe_ck2stages_gemm1_256x64x64x128_1x4_TypeCast_v1_Nswizzle0_Quant2_MulRoutedWeight1_gelu_F8_F8_B16,76.9648,34.77433333333336,0.00%,502.24,7929.23
330,512,4096,384,128,8,ActivationType.Gelu,torch.bfloat16,torch.float8_e4m3fn,torch.float8_e4m3fn,QuantType.per_Token,1,1,ck,stage2,128,moe_ck2stages_gemm2_256x128x128x128_1x4_TypeCast_v3_Nswizzle0_Quant2_MulRoutedWeight0_F8_F8_B16,113.1774,34.77433333333336,0.00%,341.54,5392.17
330,512,4096,384,128,8,ActivationType.Gelu,torch.bfloat16,torch.float8_e4m3fn,torch.float8_e4m3fn,QuantType.per_Token,1,1,asm,asm_1stage,32,_ZN5aiter53fmoe_bf16_pertokenFp8_g1u1_vs_tkw1_gelu_1tg_ps_32x384E,146.209,0.0,0.00%,264.38,4173.96
331,512,4096,384,128,8,ActivationType.Gelu,torch.bfloat16,torch.bfloat16,torch.bfloat16,QuantType.No,1,1,ck,stage1,64,moe_ck2stages_gemm1_256x64x64x64_1x4_TypeCast_v1_Nswizzle0_Quant0_MulRoutedWeight1_gelu_B16_B16_B16,143.7879,0.0,0.00%,268.83,8459.32
331,512,4096,384,128,8,ActivationType.Gelu,torch.bfloat16,torch.bfloat16,torch.bfloat16,QuantType.No,1,1,ck,stage2,64,moe_ck2stages_gemm2_256x64x64x64_1x4_TypeCast_v1_Nswizzle0_Quant0_MulRoutedWeight0_B16_B16_B16,84.8305,0.0,0.00%,455.67,14338.57
332,512,4096,384,128,8,ActivationType.Silu,torch.bfloat16,torch.float8_e4m3fn,torch.float8_e4m3fn,QuantType.per_1x128,1,0,ck,stage1,64,moe_ck2stages_gemm1_256x64x128x128_1x4_MulABScaleExpertWeightA8W8blkscale_v3_Nswizzle0_Quant4_MulRoutedWeight0_silu_F8_F8_B16,99.8571,34.921333333333344,0.11%,387.1,6111.45
332,512,4096,384,128,8,ActivationType.Silu,torch.bfloat16,torch.float8_e4m3fn,torch.float8_e4m3fn,QuantType.per_1x128,1,0,ck,stage2,32,moe_ck2stages_gemm2_256x32x128x128_1x4_MulABScaleExpertWeightA8W8blkscale_v1_Nswizzle0_Quant4_MulRoutedWeight1_F8_F8_B16,57.4099,34.921333333333344,15.55%,673.31,10630.07
333,512,4096,384,128,8,ActivationType.Gelu,torch.bfloat16,torch.float8_e4m3fn,torch.float8_e4m3fn,QuantType.per_1x128,1,0,ck,stage1,64,moe_ck2stages_gemm1_256x64x128x128_1x4_MulABScaleExpertWeightA8W8blkscale_v3_Nswizzle0_Quant4_MulRoutedWeight0_gelu_F8_F8_B16,97.5522,40.43233333333332,0.11%,396.25,6255.84
333,512,4096,384,128,8,ActivationType.Gelu,torch.bfloat16,torch.float8_e4m3fn,torch.float8_e4m3fn,QuantType.per_1x128,1,0,ck,stage2,32,moe_ck2stages_gemm2_256x32x128x128_1x4_MulABScaleExpertWeightA8W8blkscale_v1_Nswizzle0_Quant4_MulRoutedWeight1_F8_F8_B16,58.0441,40.43233333333332,15.60%,665.95,10513.92
334,512,4096,384,128,8,ActivationType.Silu,torch.bfloat16,torch.float8_e4m3fn,torch.float8_e4m3fn,QuantType.per_1x128,1,1,ck,stage1,64,moe_ck2stages_gemm1_256x64x128x128_1x4_MulABScaleExpertWeightA8W8blkscale_v3_Nswizzle0_Quant4_MulRoutedWeight1_silu_F8_F8_B16,95.1146,44.33877777777784,0.12%,406.4,6416.17
334,512,4096,384,128,8,ActivationType.Silu,torch.bfloat16,torch.float8_e4m3fn,torch.float8_e4m3fn,QuantType.per_1x128,1,1,ck,stage2,32,moe_ck2stages_gemm2_256x32x128x128_1x4_MulABScaleExpertWeightA8W8blkscale_v1_Nswizzle0_Quant4_MulRoutedWeight0_F8_F8_B16,57.191,44.33877777777784,16.67%,675.89,10670.76
335,512,4096,384,128,8,ActivationType.Gelu,torch.bfloat16,torch.float8_e4m3fn,torch.float8_e4m3fn,QuantType.per_1x128,1,1,ck,stage1,64,moe_ck2stages_gemm1_256x64x128x128_1x4_MulABScaleExpertWeightA8W8blkscale_v3_Nswizzle0_Quant4_MulRoutedWeight1_gelu_F8_F8_B16,98.3606,37.03666666666663,0.12%,392.99,6204.43
335,512,4096,384,128,8,ActivationType.Gelu,torch.bfloat16,torch.float8_e4m3fn,torch.float8_e4m3fn,QuantType.per_1x128,1,1,ck,stage2,32,moe_ck2stages_gemm2_256x32x128x128_1x4_MulABScaleExpertWeightA8W8blkscale_v1_Nswizzle0_Quant4_MulRoutedWeight0_F8_F8_B16,56.7663,37.03666666666663,16.68%,680.94,10750.59
336,512,6144,4096,8,2,ActivationType.Silu,torch.bfloat16,torch.float8_e4m3fn,torch.float8_e4m3fn,QuantType.per_Token,1,0,asm,stage1,64,_ZN5aiter48fmoe_stage1_bf16_pertokenFp8_g1u1_64x128_2tg_pf3E,113.971,52.70344444444447,0.00%,1356.65,5382.22
336,512,6144,4096,8,2,ActivationType.Silu,torch.bfloat16,torch.float8_e4m3fn,torch.float8_e4m3fn,QuantType.per_Token,1,0,ck,stage1,128,moe_ck2stages_gemm1_256x128x128x128_1x4_TypeCast_v3_Nswizzle0_Quant2_MulRoutedWeight0_silu_F8_F8_B16,116.3928,52.70344444444447,0.00%,1328.42,5270.23
336,512,6144,4096,8,2,ActivationType.Silu,torch.bfloat16,torch.float8_e4m3fn,torch.float8_e4m3fn,QuantType.per_Token,1,0,ck,stage2,64,moe_ck2stages_gemm2_256x64x128x256_1x4_TypeCast_v1_Nswizzle0_Quant2_MulRoutedWeight1_F8_F8_B16,75.0308,52.70344444444447,2.34%,2060.74,8175.54
336,512,6144,4096,8,2,ActivationType.Silu,torch.bfloat16,torch.float8_e4m3fn,torch.float8_e4m3fn,QuantType.per_Token,1,0,asm,asm_1stage,32,_ZN5aiter45fmoe_bf16_pertokenFp8_g1u1_vs_silu_1tg_32x512E,344.6527,0.0,5.14%,448.62,1779.81
337,512,6144,4096,8,2,ActivationType.Silu,torch.bfloat16,torch.int8,torch.int8,QuantType.per_Tensor,1,0,ck,stage1,128,moe_ck2stages_gemm1_256x128x128x128_1x4_TypeCast_v3_Nswizzle0_Quant1_MulRoutedWeight0_silu_I8_I8_B16,112.986,56.17555555555559,0.00%,1368.48,5429.14
337,512,6144,4096,8,2,ActivationType.Silu,torch.bfloat16,torch.int8,torch.int8,QuantType.per_Tensor,1,0,asm,stage1,64,_ZN5aiter49fmoe_stage1_bf16_pertokenInt8_g1u1_64x128_2tg_pf3E,121.1399,56.17555555555559,0.00%,1276.37,5063.71
337,512,6144,4096,8,2,ActivationType.Silu,torch.bfloat16,torch.int8,torch.int8,QuantType.per_Tensor,1,0,ck,stage2,64,moe_ck2stages_gemm2_256x64x128x256_1x4_TypeCast_v1_Nswizzle0_Quant1_MulRoutedWeight1_I8_I8_B16,72.7177,56.17555555555559,2.08%,2126.29,8435.59
338,512,6144,4096,8,2,ActivationType.Silu,torch.bfloat16,torch.bfloat16,torch.bfloat16,QuantType.No,1,0,ck,stage1,128,moe_ck2stages_gemm1_256x128x128x64_1x4_TypeCast_v3_Nswizzle0_Quant0_MulRoutedWeight0_silu_B16_B16_B16,203.1957,0.0,0.00%,760.94,6006.73
338,512,6144,4096,8,2,ActivationType.Silu,torch.bfloat16,torch.bfloat16,torch.bfloat16,QuantType.No,1,0,ck,stage2,64,moe_ck2stages_gemm2_256x64x128x128_1x4_TypeCast_v1_Nswizzle0_Quant0_MulRoutedWeight1_B16_B16_B16,124.0779,0.0,2.35%,1246.14,9836.9
339,512,7168,256,256,8,ActivationType.Gelu,torch.bfloat16,torch.bfloat16,torch.bfloat16,QuantType.No,1,0,ck,stage1,64,moe_ck2stages_gemm1_256x64x64x128_1x4_TypeCast_v1_Nswizzle0_Quant0_MulRoutedWeight0_gelu_B16_B16_B16,317.4595,0.0,0.00%,142.06,8924.77
339,512,7168,256,256,8,ActivationType.Gelu,torch.bfloat16,torch.bfloat16,torch.bfloat16,QuantType.No,1,0,ck,stage2,32,moe_ck2stages_gemm2_256x32x128x128_1x4_TypeCast_v1_Nswizzle0_Quant0_MulRoutedWeight1_B16_B16_B16,181.557,0.0,1.63%,248.39,15605.3
340,512,7168,256,256,8,ActivationType.Gelu,torch.bfloat16,torch.bfloat16,torch.bfloat16,QuantType.No,1,1,ck,stage1,64,moe_ck2stages_gemm1_256x64x64x64_1x4_TypeCast_v1_Nswizzle0_Quant0_MulRoutedWeight1_gelu_B16_B16_B16,317.5387,0.0,0.00%,142.02,8922.54
340,512,7168,256,256,8,ActivationType.Gelu,torch.bfloat16,torch.bfloat16,torch.bfloat16,QuantType.No,1,1,ck,stage2,64,moe_ck2stages_gemm2_256x64x128x128_1x4_TypeCast_v1_Nswizzle0_Quant0_MulRoutedWeight0_B16_B16_B16,180.8716,0.0,0.00%,249.33,15664.44
341,512,7168,256,256,8,ActivationType.Gelu,torch.bfloat16,torch.float8_e4m3fn,torch.float8_e4m3fn,QuantType.per_Tensor,1,0,ck,stage1,32,moe_ck2stages_gemm1_256x32x64x256_1x4_TypeCast_v1_Nswizzle0_Quant1_MulRoutedWeight0_gelu_F8_F8_B16,162.516,32.055444444444475,0.00%,277.49,8739.42
341,512,7168,256,256,8,ActivationType.Gelu,torch.bfloat16,torch.float8_e4m3fn,torch.float8_e4m3fn,QuantType.per_Tensor,1,0,asm,stage1,32,_ZN5aiter48fmoe_stage1_bf16_pertokenFp8_g1u1_32x256_2tg_pf2E,168.9168,32.055444444444475,0.00%,266.98,8408.26
341,512,7168,256,256,8,ActivationType.Gelu,torch.bfloat16,torch.float8_e4m3fn,torch.float8_e4m3fn,QuantType.per_Tensor,1,0,ck,stage2,32,moe_ck2stages_gemm2_256x32x128x256_1x4_TypeCast_v1_Nswizzle0_Quant1_MulRoutedWeight1_F8_F8_B16,114.8169,32.055444444444475,1.62%,392.77,12370.1
342,512,7168,256,256,8,ActivationType.Gelu,torch.bfloat16,torch.float8_e4m3fn,torch.float8_e4m3fn,QuantType.per_Tensor,1,1,ck,stage1,32,moe_ck2stages_gemm1_256x32x64x256_1x4_TypeCast_v1_Nswizzle0_Quant1_MulRoutedWeight1_gelu_F8_F8_B16,161.4173,32.65988888888882,0.00%,279.38,8798.91
342,512,7168,256,256,8,ActivationType.Gelu,torch.bfloat16,torch.float8_e4m3fn,torch.float8_e4m3fn,QuantType.per_Tensor,1,1,asm,stage1,32,_ZN5aiter57fmoe_stage1_bf16_pertokenFp8_doweight_g1u1_32x256_2tg_pf2E,167.3639,32.65988888888882,0.00%,269.46,8486.28
342,512,7168,256,256,8,ActivationType.Gelu,torch.bfloat16,torch.float8_e4m3fn,torch.float8_e4m3fn,QuantType.per_Tensor,1,1,ck,stage2,32,moe_ck2stages_gemm2_256x32x128x256_1x4_TypeCast_v1_Nswizzle0_Quant1_MulRoutedWeight0_F8_F8_B16,115.3955,32.65988888888882,0.00%,390.81,12308.07
343,512,7168,256,256,8,ActivationType.Gelu,torch.bfloat16,torch.float8_e4m3fn,torch.float8_e4m3fn,QuantType.per_Token,1,0,asm,stage1,64,_ZN5aiter44fmoe_stage1_bf16_pertokenFp8_g1u1_64x256_pf2E,160.2835,28.810111111111123,0.00%,281.36,8861.15
343,512,7168,256,256,8,ActivationType.Gelu,torch.bfloat16,torch.float8_e4m3fn,torch.float8_e4m3fn,QuantType.per_Token,1,0,ck,stage1,32,moe_ck2stages_gemm1_256x32x64x256_1x4_TypeCast_v1_Nswizzle0_Quant2_MulRoutedWeight0_gelu_F8_F8_B16,161.9984,28.810111111111123,0.00%,278.38,8767.35
343,512,7168,256,256,8,ActivationType.Gelu,torch.bfloat16,torch.float8_e4m3fn,torch.float8_e4m3fn,QuantType.per_Token,1,0,ck,stage2,32,moe_ck2stages_gemm2_256x32x128x256_1x4_TypeCast_v1_Nswizzle0_Quant2_MulRoutedWeight1_F8_F8_B16,134.0752,28.810111111111123,1.61%,336.36,10593.28
343,512,7168,256,256,8,ActivationType.Gelu,torch.bfloat16,torch.float8_e4m3fn,torch.float8_e4m3fn,QuantType.per_Token,1,0,asm,asm_1stage,32,_ZN5aiter48fmoe_bf16_pertokenFp8_g1u1_vs_gelu_1tg_ps_32x256E,262.5789,0.0,0.00%,171.75,5409.03
344,512,7168,256,256,8,ActivationType.Gelu,torch.bfloat16,torch.float8_e4m3fn,torch.float8_e4m3fn,QuantType.per_Token,1,1,asm,stage1,32,_ZN5aiter57fmoe_stage1_bf16_pertokenFp8_doweight_g1u1_32x256_2tg_pf3E,159.8168,28.79222222222222,0.00%,282.18,8887.03
344,512,7168,256,256,8,ActivationType.Gelu,torch.bfloat16,torch.float8_e4m3fn,torch.float8_e4m3fn,QuantType.per_Token,1,1,ck,stage1,32,moe_ck2stages_gemm1_256x32x64x256_1x4_TypeCast_v1_Nswizzle0_Quant2_MulRoutedWeight1_gelu_F8_F8_B16,163.0732,28.79222222222222,0.00%,276.55,8709.56
344,512,7168,256,256,8,ActivationType.Gelu,torch.bfloat16,torch.float8_e4m3fn,torch.float8_e4m3fn,QuantType.per_Token,1,1,ck,stage2,32,moe_ck2stages_gemm2_256x32x128x256_1x4_TypeCast_v1_Nswizzle0_Quant2_MulRoutedWeight0_F8_F8_B16,135.2325,28.79222222222222,0.00%,333.48,10502.62
344,512,7168,256,256,8,ActivationType.Gelu,torch.bfloat16,torch.float8_e4m3fn,torch.float8_e4m3fn,QuantType.per_Token,1,1,asm,asm_1stage,32,_ZN5aiter50fmoe_bf16_pertokenFp8_g1u1_vs_tkw1_gelu_1tg_32x256E,266.9524,0.0,0.00%,168.93,5320.41
345,512,7168,256,256,8,ActivationType.Silu,torch.bfloat16,torch.bfloat16,torch.bfloat16,QuantType.No,1,0,ck,stage1,64,moe_ck2stages_gemm1_256x64x64x64_1x4_TypeCast_v1_Nswizzle0_Quant0_MulRoutedWeight0_silu_B16_B16_B16,316.8077,0.0,0.00%,142.35,8943.13
345,512,7168,256,256,8,ActivationType.Silu,torch.bfloat16,torch.bfloat16,torch.bfloat16,QuantType.No,1,0,ck,stage2,32,moe_ck2stages_gemm2_256x32x64x64_1x4_TypeCast_v1_Nswizzle0_Quant0_MulRoutedWeight1_B16_B16_B16,181.512,0.0,1.29%,248.45,15609.17
346,512,7168,256,256,8,ActivationType.Silu,torch.bfloat16,torch.bfloat16,torch.bfloat16,QuantType.No,1,1,ck,stage1,64,moe_ck2stages_gemm1_256x64x64x64_1x4_TypeCast_v1_Nswizzle0_Quant0_MulRoutedWeight1_silu_B16_B16_B16,317.4398,0.0,0.00%,142.07,8925.32
346,512,7168,256,256,8,ActivationType.Silu,torch.bfloat16,torch.bfloat16,torch.bfloat16,QuantType.No,1,1,ck,stage2,64,moe_ck2stages_gemm2_256x64x128x128_1x4_TypeCast_v1_Nswizzle0_Quant0_MulRoutedWeight0_B16_B16_B16,179.9542,0.0,0.00%,250.6,15744.3
