aiter/ops/opus/configs/opus_gemm_a16w16_tuned.csv
cu_num,M,N,K,bias,dtype,outdtype,scaleAB,bpreshuffle,libtype,solidx,splitK,us,kernelName,err_ratio,tflops,bw
256,1,100,5120,False,torch.bfloat16,torch.bfloat16,False,False,opus,201,8,7.4468,opus_gemm_flatmm_splitk_256x32x32x64_2x1_16x16x32_0x0x0_wgpcu2,0.0,0.14,138.91
256,16,100,5120,False,torch.bfloat16,torch.bfloat16,False,False,opus,204,2,18.9235,opus_gemm_flatmm_splitk_256x32x128x64_2x1_16x16x32_0x0x0_wgpcu2,0.0,0.87,62.94
256,32,100,5120,False,torch.bfloat16,torch.bfloat16,False,False,opus,202,4,8.1102,opus_gemm_flatmm_splitk_256x32x32x128_2x1_16x16x32_0x0x0_wgpcu2,0.0,4.04,167.45
256,64,100,5120,False,torch.bfloat16,torch.bfloat16,False,False,opus,202,4,8.208,opus_gemm_flatmm_splitk_256x32x32x128_2x1_16x16x32_0x0x0_wgpcu2,0.0,7.98,206.16
256,128,100,5120,False,torch.bfloat16,torch.bfloat16,False,False,opus,202,4,8.3356,opus_gemm_flatmm_splitk_256x32x32x128_2x1_16x16x32_0x0x0_wgpcu2,0.0,15.72,283.16
256,256,100,5120,False,torch.bfloat16,torch.bfloat16,False,False,opus,202,4,8.7462,opus_gemm_flatmm_splitk_256x32x32x128_2x1_16x16x32_0x0x0_wgpcu2,0.0,29.97,422.66
256,512,100,5120,False,torch.bfloat16,torch.bfloat16,False,False,opus,202,4,9.5114,opus_gemm_flatmm_splitk_256x32x32x128_2x1_16x16x32_0x0x0_wgpcu2,0.0,55.12,669.65
256,1024,100,5120,False,torch.bfloat16,torch.bfloat16,False,False,opus,201,2,15.6043,opus_gemm_flatmm_splitk_256x32x32x64_2x1_16x16x32_0x0x0_wgpcu2,0.0,67.2,750.73
256,2048,100,5120,False,torch.bfloat16,torch.bfloat16,False,False,opus,202,0,14.5669,opus_gemm_flatmm_splitk_256x32x32x128_2x1_16x16x32_0x0x0_wgpcu2,0.0,143.97,1538.08
256,4096,100,5120,False,torch.bfloat16,torch.bfloat16,False,False,opus,200,2,20.3393,opus_gemm_flatmm_splitk_256x64x64x64_2x1_16x16x32_0x0x0_wgpcu2,0.0,206.22,2152.79
256,8192,100,5120,False,torch.bfloat16,torch.bfloat16,False,False,opus,200,0,31.0555,opus_gemm_flatmm_splitk_256x64x64x64_2x1_16x16x32_0x0x0_wgpcu2,0.0,270.12,2786.9
256,16384,100,5120,False,torch.bfloat16,torch.bfloat16,False,False,opus,204,0,87.1896,opus_gemm_flatmm_splitk_256x32x128x64_2x1_16x16x32_0x0x0_wgpcu2,0.0,192.42,1973.55
256,32768,100,5120,False,torch.bfloat16,torch.bfloat16,False,False,opus,204,0,164.9335,opus_gemm_flatmm_splitk_256x32x128x64_2x1_16x16x32_0x0x0_wgpcu2,0.0,203.44,2080.37
256,2,128,2880,False,torch.bfloat16,torch.bfloat16,False,False,opus,205,4,8.4181,opus_gemm_flatmm_splitk_256x64x32x64_2x1_16x16x32_0x0x0_wgpcu2,0.0,0.18,89.01
256,4,128,2880,False,torch.bfloat16,torch.bfloat16,False,False,opus,201,4,8.5886,opus_gemm_flatmm_splitk_256x32x32x64_2x1_16x16x32_0x0x0_wgpcu2,0.0,0.34,88.65
256,8,128,2880,False,torch.bfloat16,torch.bfloat16,False,False,opus,201,4,8.3841,opus_gemm_flatmm_splitk_256x32x32x64_2x1_16x16x32_0x0x0_wgpcu2,0.0,0.7,93.68
256,16,128,2880,False,torch.bfloat16,torch.bfloat16,False,False,opus,201,4,8.7015,opus_gemm_flatmm_splitk_256x32x32x64_2x1_16x16x32_0x0x0_wgpcu2,0.0,1.36,95.79
256,32,128,2880,False,torch.bfloat16,torch.bfloat16,False,False,opus,201,4,8.4463,opus_gemm_flatmm_splitk_256x32x32x64_2x1_16x16x32_0x0x0_wgpcu2,0.0,2.79,110.08
256,48,128,2880,False,torch.bfloat16,torch.bfloat16,False,False,opus,203,4,8.6938,opus_gemm_flatmm_splitk_256x32x64x64_2x1_16x16x32_0x0x0_wgpcu2,0.0,4.07,118.02
256,64,128,2880,False,torch.bfloat16,torch.bfloat16,False,False,opus,201,2,14.0551,opus_gemm_flatmm_splitk_256x32x32x64_2x1_16x16x32_0x0x0_wgpcu2,0.0,3.36,79.85
256,80,128,2880,False,torch.bfloat16,torch.bfloat16,False,False,opus,207,8,11.6455,opus_gemm_flatmm_splitk_256x128x32x64_2x1_16x16x32_0x0x0_wgpcu2,0.0,5.06,104.64
256,96,128,2880,False,torch.bfloat16,torch.bfloat16,False,False,opus,201,4,8.4104,opus_gemm_flatmm_splitk_256x32x32x64_2x1_16x16x32_0x0x0_wgpcu2,0.0,8.42,156.33
256,112,128,2880,False,torch.bfloat16,torch.bfloat16,False,False,opus,202,4,8.7157,opus_gemm_flatmm_splitk_256x32x32x128_2x1_16x16x32_0x0x0_wgpcu2,0.0,9.47,161.9
256,128,128,2880,False,torch.bfloat16,torch.bfloat16,False,False,opus,201,4,8.4193,opus_gemm_flatmm_splitk_256x32x32x64_2x1_16x16x32_0x0x0_wgpcu2,0.0,11.21,179.03
256,256,128,2880,False,torch.bfloat16,torch.bfloat16,False,False,opus,202,4,8.6806,opus_gemm_flatmm_splitk_256x32x32x128_2x1_16x16x32_0x0x0_wgpcu2,0.0,21.74,262.35
256,1,200,5120,False,torch.bfloat16,torch.bfloat16,False,False,opus,201,8,7.7405,opus_gemm_flatmm_splitk_256x32x32x64_2x1_16x16x32_0x0x0_wgpcu2,0.0,0.26,265.96
256,16,200,5120,False,torch.bfloat16,torch.bfloat16,False,False,opus,201,8,8.3628,opus_gemm_flatmm_splitk_256x32x32x64_2x1_16x16x32_0x0x0_wgpcu2,0.0,3.92,265.25
256,32,200,5120,False,torch.bfloat16,torch.bfloat16,False,False,opus,201,8,8.7028,opus_gemm_flatmm_splitk_256x32x32x64_2x1_16x16x32_0x0x0_wgpcu2,0.0,7.53,274.45
256,64,200,5120,False,torch.bfloat16,torch.bfloat16,False,False,opus,201,8,9.0915,opus_gemm_flatmm_splitk_256x32x32x64_2x1_16x16x32_0x0x0_wgpcu2,0.0,14.42,300.17
256,128,200,5120,False,torch.bfloat16,torch.bfloat16,False,False,opus,202,4,9.769,opus_gemm_flatmm_splitk_256x32x32x128_2x1_16x16x32_0x0x0_wgpcu2,0.0,26.83,349.06
256,256,200,5120,False,torch.bfloat16,torch.bfloat16,False,False,opus,202,4,10.1823,opus_gemm_flatmm_splitk_256x32x32x128_2x1_16x16x32_0x0x0_wgpcu2,0.0,51.49,468.64
256,512,200,5120,False,torch.bfloat16,torch.bfloat16,False,False,opus,205,4,13.1284,opus_gemm_flatmm_splitk_256x64x32x64_2x1_16x16x32_0x0x0_wgpcu2,0.0,79.87,570.95
256,1024,200,5120,False,torch.bfloat16,torch.bfloat16,False,False,opus,200,4,17.0918,opus_gemm_flatmm_splitk_256x64x64x64_2x1_16x16x32_0x0x0_wgpcu2,0.0,122.7,757.28
256,2048,200,5120,False,torch.bfloat16,torch.bfloat16,False,False,opus,200,2,22.3603,opus_gemm_flatmm_splitk_256x64x64x64_2x1_16x16x32_0x0x0_wgpcu2,0.0,187.58,1066.12
256,4096,200,5120,False,torch.bfloat16,torch.bfloat16,False,False,opus,200,0,34.5666,opus_gemm_flatmm_splitk_256x64x64x64_2x1_16x16x32_0x0x0_wgpcu2,0.0,242.68,1320.04
256,8192,200,5120,False,torch.bfloat16,torch.bfloat16,False,False,opus,200,0,63.4321,opus_gemm_flatmm_splitk_256x64x64x64_2x1_16x16x32_0x0x0_wgpcu2,0.0,264.49,1406.4
256,16384,200,5120,False,torch.bfloat16,torch.bfloat16,False,False,opus,200,0,135.0647,opus_gemm_flatmm_splitk_256x64x64x64_2x1_16x16x32_0x0x0_wgpcu2,0.0,248.43,1305.85
256,32768,200,5120,False,torch.bfloat16,torch.bfloat16,False,False,opus,210,0,260.4792,opus_gemm_flatmm_splitk_256x32x256x64_2x1_16x16x32_0x0x0_wgpcu1,0.0,257.64,1346.36
256,6,384,7168,False,torch.bfloat16,torch.bfloat16,False,False,opus,202,4,8.4936,opus_gemm_flatmm_splitk_256x32x32x128_2x1_16x16x32_0x0x0_wgpcu2,0.0,3.89,658.81
256,6,384,7168,False,torch.bfloat16,torch.float32,False,False,opus,202,4,8.2967,opus_gemm_flatmm_splitk_256x32x32x128_2x1_16x16x32_0x0x0_wgpcu2,0.0,3.98,675.0
256,8,384,7168,False,torch.bfloat16,torch.bfloat16,False,False,opus,202,4,8.5284,opus_gemm_flatmm_splitk_256x32x32x128_2x1_16x16x32_0x0x0_wgpcu2,0.0,5.16,659.66
256,16,384,7168,False,torch.bfloat16,torch.bfloat16,False,False,opus,202,4,8.5383,opus_gemm_flatmm_splitk_256x32x32x128_2x1_16x16x32_0x0x0_wgpcu2,0.0,10.32,673.05
256,24,384,7168,False,torch.bfloat16,torch.bfloat16,False,False,opus,202,4,8.5629,opus_gemm_flatmm_splitk_256x32x32x128_2x1_16x16x32_0x0x0_wgpcu2,0.0,15.43,685.23
256,32,384,7168,False,torch.bfloat16,torch.bfloat16,False,False,opus,202,4,8.5779,opus_gemm_flatmm_splitk_256x32x32x128_2x1_16x16x32_0x0x0_wgpcu2,0.0,20.54,698.11
256,40,384,7168,False,torch.bfloat16,torch.bfloat16,False,False,opus,202,4,8.6595,opus_gemm_flatmm_splitk_256x32x32x128_2x1_16x16x32_0x0x0_wgpcu2,0.0,25.43,705.49
256,48,384,7168,False,torch.bfloat16,torch.bfloat16,False,False,opus,202,4,8.6896,opus_gemm_flatmm_splitk_256x32x32x128_2x1_16x16x32_0x0x0_wgpcu2,0.0,30.41,716.95
256,56,384,7168,False,torch.bfloat16,torch.bfloat16,False,False,opus,202,4,8.6421,opus_gemm_flatmm_splitk_256x32x32x128_2x1_16x16x32_0x0x0_wgpcu2,0.0,35.67,734.87
256,64,384,7168,False,torch.bfloat16,torch.bfloat16,False,False,opus,202,4,8.7066,opus_gemm_flatmm_splitk_256x32x32x128_2x1_16x16x32_0x0x0_wgpcu2,0.0,40.47,743.31
256,72,384,7168,False,torch.bfloat16,torch.bfloat16,False,False,opus,202,4,8.7625,opus_gemm_flatmm_splitk_256x32x32x128_2x1_16x16x32_0x0x0_wgpcu2,0.0,45.23,752.36
256,80,384,7168,False,torch.bfloat16,torch.bfloat16,False,False,opus,202,4,8.797,opus_gemm_flatmm_splitk_256x32x32x128_2x1_16x16x32_0x0x0_wgpcu2,0.0,50.06,763.14
256,88,384,7168,False,torch.bfloat16,torch.bfloat16,False,False,opus,202,4,8.8381,opus_gemm_flatmm_splitk_256x32x32x128_2x1_16x16x32_0x0x0_wgpcu2,0.0,54.81,773.26
256,96,384,7168,False,torch.bfloat16,torch.bfloat16,False,False,opus,202,4,8.8975,opus_gemm_flatmm_splitk_256x32x32x128_2x1_16x16x32_0x0x0_wgpcu2,0.0,59.4,781.68
256,104,384,7168,False,torch.bfloat16,torch.bfloat16,False,False,opus,202,4,8.9395,opus_gemm_flatmm_splitk_256x32x32x128_2x1_16x16x32_0x0x0_wgpcu2,0.0,64.04,791.53
256,112,384,7168,False,torch.bfloat16,torch.bfloat16,False,False,opus,202,4,8.9878,opus_gemm_flatmm_splitk_256x32x32x128_2x1_16x16x32_0x0x0_wgpcu2,0.0,68.6,800.72
256,120,384,7168,False,torch.bfloat16,torch.bfloat16,False,False,opus,202,4,9.0187,opus_gemm_flatmm_splitk_256x32x32x128_2x1_16x16x32_0x0x0_wgpcu2,0.0,73.25,811.37
256,128,384,7168,False,torch.bfloat16,torch.bfloat16,False,False,opus,202,4,9.0746,opus_gemm_flatmm_splitk_256x32x32x128_2x1_16x16x32_0x0x0_wgpcu2,0.0,77.65,819.69
256,136,384,7168,False,torch.bfloat16,torch.bfloat16,False,False,opus,202,4,9.1649,opus_gemm_flatmm_splitk_256x32x32x128_2x1_16x16x32_0x0x0_wgpcu2,0.0,81.69,824.8
256,144,384,7168,False,torch.bfloat16,torch.bfloat16,False,False,opus,202,4,9.2259,opus_gemm_flatmm_splitk_256x32x32x128_2x1_16x16x32_0x0x0_wgpcu2,0.0,85.92,832.44
256,168,384,7168,False,torch.bfloat16,torch.bfloat16,False,False,opus,202,4,10.4762,opus_gemm_flatmm_splitk_256x32x32x128_2x1_16x16x32_0x0x0_wgpcu2,0.0,88.28,767.69
256,176,384,7168,False,torch.bfloat16,torch.bfloat16,False,False,opus,202,4,10.4932,opus_gemm_flatmm_splitk_256x32x32x128_2x1_16x16x32_0x0x0_wgpcu2,0.0,92.33,777.96
256,184,384,7168,False,torch.bfloat16,torch.bfloat16,False,False,opus,202,4,10.5423,opus_gemm_flatmm_splitk_256x32x32x128_2x1_16x16x32_0x0x0_wgpcu2,0.0,96.08,785.8
256,192,384,7168,False,torch.bfloat16,torch.bfloat16,False,False,opus,202,4,10.5685,opus_gemm_flatmm_splitk_256x32x32x128_2x1_16x16x32_0x0x0_wgpcu2,0.0,100.01,795.29
256,200,384,7168,False,torch.bfloat16,torch.bfloat16,False,False,opus,202,4,10.7257,opus_gemm_flatmm_splitk_256x32x32x128_2x1_16x16x32_0x0x0_wgpcu2,0.0,102.65,794.9
256,208,384,7168,False,torch.bfloat16,torch.bfloat16,False,False,opus,202,4,10.7562,opus_gemm_flatmm_splitk_256x32x32x128_2x1_16x16x32_0x0x0_wgpcu2,0.0,106.45,803.88
256,216,384,7168,False,torch.bfloat16,torch.bfloat16,False,False,opus,202,4,10.8473,opus_gemm_flatmm_splitk_256x32x32x128_2x1_16x16x32_0x0x0_wgpcu2,0.0,109.62,808.26
256,224,384,7168,False,torch.bfloat16,torch.bfloat16,False,False,opus,202,4,10.8853,opus_gemm_flatmm_splitk_256x32x32x128_2x1_16x16x32_0x0x0_wgpcu2,0.0,113.28,816.54
256,232,384,7168,False,torch.bfloat16,torch.bfloat16,False,False,opus,202,2,10.8132,opus_gemm_flatmm_splitk_256x32x32x128_2x1_16x16x32_0x0x0_wgpcu2,0.0,118.11,833.16
256,240,384,7168,False,torch.bfloat16,torch.bfloat16,False,False,opus,202,2,10.8318,opus_gemm_flatmm_splitk_256x32x32x128_2x1_16x16x32_0x0x0_wgpcu2,0.0,121.97,842.89
256,248,384,7168,False,torch.bfloat16,torch.bfloat16,False,False,opus,202,2,10.8504,opus_gemm_flatmm_splitk_256x32x32x128_2x1_16x16x32_0x0x0_wgpcu2,0.0,125.82,852.58
256,256,384,7168,False,torch.bfloat16,torch.bfloat16,False,False,opus,202,2,10.873,opus_gemm_flatmm_splitk_256x32x32x128_2x1_16x16x32_0x0x0_wgpcu2,0.0,129.61,861.92
256,264,384,7168,False,torch.bfloat16,torch.bfloat16,False,False,opus,202,2,11.271,opus_gemm_flatmm_splitk_256x32x32x128_2x1_16x16x32_0x0x0_wgpcu2,0.0,128.94,842.2
256,272,384,7168,False,torch.bfloat16,torch.bfloat16,False,False,opus,202,2,11.2849,opus_gemm_flatmm_splitk_256x32x32x128_2x1_16x16x32_0x0x0_wgpcu2,0.0,132.69,851.87
256,280,384,7168,False,torch.bfloat16,torch.bfloat16,False,False,opus,202,2,11.321,opus_gemm_flatmm_splitk_256x32x32x128_2x1_16x16x32_0x0x0_wgpcu2,0.0,136.15,859.83
256,288,384,7168,False,torch.bfloat16,torch.bfloat16,False,False,opus,202,2,11.3697,opus_gemm_flatmm_splitk_256x32x32x128_2x1_16x16x32_0x0x0_wgpcu2,0.0,139.44,866.78
256,296,384,7168,False,torch.bfloat16,torch.bfloat16,False,False,opus,202,2,11.1835,opus_gemm_flatmm_splitk_256x32x32x128_2x1_16x16x32_0x0x0_wgpcu2,0.0,145.7,892.01
256,304,384,7168,False,torch.bfloat16,torch.bfloat16,False,False,opus,202,2,11.1621,opus_gemm_flatmm_splitk_256x32x32x128_2x1_16x16x32_0x0x0_wgpcu2,0.0,149.93,904.55
256,312,384,7168,False,torch.bfloat16,torch.bfloat16,False,False,opus,202,2,11.1998,opus_gemm_flatmm_splitk_256x32x32x128_2x1_16x16x32_0x0x0_wgpcu2,0.0,153.36,912.29
256,320,384,7168,False,torch.bfloat16,torch.bfloat16,False,False,opus,202,2,11.2314,opus_gemm_flatmm_splitk_256x32x32x128_2x1_16x16x32_0x0x0_wgpcu2,0.0,156.85,920.48
256,328,384,7168,False,torch.bfloat16,torch.bfloat16,False,False,opus,202,2,13.2235,opus_gemm_flatmm_splitk_256x32x32x128_2x1_16x16x32_0x0x0_wgpcu2,0.0,136.55,790.95
256,336,384,7168,False,torch.bfloat16,torch.bfloat16,False,False,opus,202,2,13.2069,opus_gemm_flatmm_splitk_256x32x32x128_2x1_16x16x32_0x0x0_wgpcu2,0.0,140.05,801.09
256,344,384,7168,False,torch.bfloat16,torch.bfloat16,False,False,opus,202,2,13.2457,opus_gemm_flatmm_splitk_256x32x32x128_2x1_16x16x32_0x0x0_wgpcu2,0.0,142.97,807.87
256,352,384,7168,False,torch.bfloat16,torch.bfloat16,False,False,opus,202,2,13.2576,opus_gemm_flatmm_splitk_256x32x32x128_2x1_16x16x32_0x0x0_wgpcu2,0.0,146.16,816.26
256,360,384,7168,False,torch.bfloat16,torch.bfloat16,False,False,opus,203,4,13.4948,opus_gemm_flatmm_splitk_256x32x64x64_2x1_16x16x32_0x0x0_wgpcu2,0.0,146.86,810.87
256,368,384,7168,False,torch.bfloat16,torch.bfloat16,False,False,opus,203,4,13.6398,opus_gemm_flatmm_splitk_256x32x64x64_2x1_16x16x32_0x0x0_wgpcu2,0.0,148.52,811.1
256,376,384,7168,False,torch.bfloat16,torch.bfloat16,False,False,opus,203,4,13.8034,opus_gemm_flatmm_splitk_256x32x64x64_2x1_16x16x32_0x0x0_wgpcu2,0.0,149.96,810.24
256,384,384,7168,False,torch.bfloat16,torch.bfloat16,False,False,opus,203,4,13.6121,opus_gemm_flatmm_splitk_256x32x64x64_2x1_16x16x32_0x0x0_wgpcu2,0.0,155.3,830.51
256,392,384,7168,False,torch.bfloat16,torch.bfloat16,False,False,opus,205,4,14.2659,opus_gemm_flatmm_splitk_256x64x32x64_2x1_16x16x32_0x0x0_wgpcu2,0.0,151.27,800.92
256,400,384,7168,False,torch.bfloat16,torch.bfloat16,False,False,opus,205,4,14.2762,opus_gemm_flatmm_splitk_256x64x32x64_2x1_16x16x32_0x0x0_wgpcu2,0.0,154.24,808.8
256,408,384,7168,False,torch.bfloat16,torch.bfloat16,False,False,opus,205,4,14.3737,opus_gemm_flatmm_splitk_256x64x32x64_2x1_16x16x32_0x0x0_wgpcu2,0.0,156.26,811.72
256,416,384,7168,False,torch.bfloat16,torch.bfloat16,False,False,opus,205,4,14.4739,opus_gemm_flatmm_splitk_256x64x32x64_2x1_16x16x32_0x0x0_wgpcu2,0.0,158.22,814.45
256,424,384,7168,False,torch.bfloat16,torch.bfloat16,False,False,opus,200,4,14.5661,opus_gemm_flatmm_splitk_256x64x64x64_2x1_16x16x32_0x0x0_wgpcu2,0.0,160.24,817.59
256,432,384,7168,False,torch.bfloat16,torch.bfloat16,False,False,opus,203,4,14.4442,opus_gemm_flatmm_splitk_256x32x64x64_2x1_16x16x32_0x0x0_wgpcu2,0.0,164.65,832.86
256,440,384,7168,False,torch.bfloat16,torch.bfloat16,False,False,opus,203,4,14.5059,opus_gemm_flatmm_splitk_256x32x64x64_2x1_16x16x32_0x0x0_wgpcu2,0.0,166.98,837.64
256,448,384,7168,False,torch.bfloat16,torch.bfloat16,False,False,opus,203,4,14.5269,opus_gemm_flatmm_splitk_256x32x64x64_2x1_16x16x32_0x0x0_wgpcu2,0.0,169.77,844.75
256,456,384,7168,False,torch.bfloat16,torch.bfloat16,False,False,opus,205,4,14.5448,opus_gemm_flatmm_splitk_256x64x32x64_2x1_16x16x32_0x0x0_wgpcu2,0.0,172.59,852.02
256,464,384,7168,False,torch.bfloat16,torch.bfloat16,False,False,opus,205,4,14.6347,opus_gemm_flatmm_splitk_256x64x32x64_2x1_16x16x32_0x0x0_wgpcu2,0.0,174.54,855.04
256,472,384,7168,False,torch.bfloat16,torch.bfloat16,False,False,opus,205,4,14.7103,opus_gemm_flatmm_splitk_256x64x32x64_2x1_16x16x32_0x0x0_wgpcu2,0.0,176.64,858.86
256,480,384,7168,False,torch.bfloat16,torch.bfloat16,False,False,opus,205,4,14.723,opus_gemm_flatmm_splitk_256x64x32x64_2x1_16x16x32_0x0x0_wgpcu2,0.0,179.48,866.33
256,488,384,7168,False,torch.bfloat16,torch.bfloat16,False,False,opus,205,4,14.8493,opus_gemm_flatmm_splitk_256x64x32x64_2x1_16x16x32_0x0x0_wgpcu2,0.0,180.91,867.1
256,496,384,7168,False,torch.bfloat16,torch.bfloat16,False,False,opus,205,4,14.9115,opus_gemm_flatmm_splitk_256x64x32x64_2x1_16x16x32_0x0x0_wgpcu2,0.0,183.11,871.58
256,504,384,7168,False,torch.bfloat16,torch.bfloat16,False,False,opus,200,4,15.0446,opus_gemm_flatmm_splitk_256x64x64x64_2x1_16x16x32_0x0x0_wgpcu2,0.0,184.42,871.9
256,512,384,7168,False,torch.bfloat16,torch.bfloat16,False,False,opus,200,4,15.102,opus_gemm_flatmm_splitk_256x64x64x64_2x1_16x16x32_0x0x0_wgpcu2,0.0,186.64,876.59
256,1,800,5120,False,torch.bfloat16,torch.bfloat16,False,False,opus,201,8,8.3638,opus_gemm_flatmm_splitk_256x32x32x64_2x1_16x16x32_0x0x0_wgpcu2,0.0,0.98,980.87
256,16,800,5120,False,torch.bfloat16,torch.bfloat16,False,False,opus,201,8,9.0422,opus_gemm_flatmm_splitk_256x32x32x64_2x1_16x16x32_0x0x0_wgpcu2,0.0,14.5,926.92
256,32,800,5120,False,torch.bfloat16,torch.bfloat16,False,False,opus,201,8,9.4527,opus_gemm_flatmm_splitk_256x32x32x64_2x1_16x16x32_0x0x0_wgpcu2,0.0,27.73,906.71
256,64,800,5120,False,torch.bfloat16,torch.bfloat16,False,False,opus,202,4,10.4026,opus_gemm_flatmm_splitk_256x32x32x128_2x1_16x16x32_0x0x0_wgpcu2,0.0,50.4,860.34
256,128,800,5120,False,torch.bfloat16,torch.bfloat16,False,False,opus,203,4,12.717,opus_gemm_flatmm_splitk_256x32x64x64_2x1_16x16x32_0x0x0_wgpcu2,0.0,82.45,763.35
256,256,800,5120,False,torch.bfloat16,torch.bfloat16,False,False,opus,200,4,15.41,opus_gemm_flatmm_splitk_256x64x64x64_2x1_16x16x32_0x0x0_wgpcu2,0.0,136.09,728.3
256,512,800,5120,False,torch.bfloat16,torch.bfloat16,False,False,opus,200,4,21.3813,opus_gemm_flatmm_splitk_256x64x64x64_2x1_16x16x32_0x0x0_wgpcu2,0.0,196.17,666.66
256,1024,800,5120,False,torch.bfloat16,torch.bfloat16,False,False,opus,200,2,32.5124,opus_gemm_flatmm_splitk_256x64x64x64_2x1_16x16x32_0x0x0_wgpcu2,0.0,258.01,624.87
256,2048,800,5120,False,torch.bfloat16,torch.bfloat16,False,False,opus,200,0,55.9764,opus_gemm_flatmm_splitk_256x64x64x64_2x1_16x16x32_0x0x0_wgpcu2,0.0,299.72,579.54
256,4096,800,5120,False,torch.bfloat16,torch.bfloat16,False,False,opus,6,0,71.63,opus_gemm_512x128x128x64_2x4_16x16x32_0x0x0,0.0,468.44,791.41
256,8192,800,5120,False,torch.bfloat16,torch.bfloat16,False,False,opus,8,0,109.6971,opus_gemm_512x128x256x64_2x4_16x16x32_0x0x0,0.0,611.77,958.87
256,16384,800,5120,False,torch.bfloat16,torch.bfloat16,False,False,opus,9,0,180.7879,opus_gemm_512x256x256x64_2x4_16x16x32_0x0x0,0.0,742.4,1118.32
256,32768,800,5120,False,torch.bfloat16,torch.bfloat16,False,False,opus,9,0,340.1065,opus_gemm_512x256x256x64_2x4_16x16x32_0x0x0,0.0,789.27,1164.83
256,1,1024,7168,False,torch.bfloat16,torch.bfloat16,False,False,opus,202,4,8.2128,opus_gemm_flatmm_splitk_256x32x32x128_2x1_16x16x32_0x0x0_wgpcu2,0.0,1.79,1789.46
256,2,1024,7168,False,torch.bfloat16,torch.bfloat16,False,False,opus,202,8,7.9823,opus_gemm_flatmm_splitk_256x32x32x128_2x1_16x16x32_0x0x0_wgpcu2,0.0,3.68,1843.18
256,8,1024,7168,False,torch.bfloat16,torch.bfloat16,False,False,opus,202,4,8.492,opus_gemm_flatmm_splitk_256x32x32x128_2x1_16x16x32_0x0x0_wgpcu2,0.0,13.83,1744.13
256,16,1024,7168,False,torch.bfloat16,torch.bfloat16,False,False,opus,202,4,8.5391,opus_gemm_flatmm_splitk_256x32x32x128_2x1_16x16x32_0x0x0_wgpcu2,0.0,27.51,1749.86
256,24,1024,7168,False,torch.bfloat16,torch.bfloat16,False,False,opus,202,4,8.5364,opus_gemm_flatmm_splitk_256x32x32x128_2x1_16x16x32_0x0x0_wgpcu2,0.0,41.27,1765.77
256,40,1024,7168,False,torch.bfloat16,torch.bfloat16,False,False,opus,202,4,9.1795,opus_gemm_flatmm_splitk_256x32x32x128_2x1_16x16x32_0x0x0_wgpcu2,0.0,63.97,1670.62
256,48,1024,7168,False,torch.bfloat16,torch.bfloat16,False,False,opus,202,4,9.2718,opus_gemm_flatmm_splitk_256x32x32x128_2x1_16x16x32_0x0x0_wgpcu2,0.0,76.0,1668.12
256,56,1024,7168,False,torch.bfloat16,torch.bfloat16,False,False,opus,202,4,9.2821,opus_gemm_flatmm_splitk_256x32x32x128_2x1_16x16x32_0x0x0_wgpcu2,0.0,88.57,1680.39
256,64,1024,7168,False,torch.bfloat16,torch.bfloat16,False,False,opus,202,4,9.3463,opus_gemm_flatmm_splitk_256x32x32x128_2x1_16x16x32_0x0x0_wgpcu2,0.0,100.52,1682.87
256,72,1024,7168,False,torch.bfloat16,torch.bfloat16,False,False,opus,202,4,10.9803,opus_gemm_flatmm_splitk_256x32x32x128_2x1_16x16x32_0x0x0_wgpcu2,0.0,96.26,1444.38
256,80,1024,7168,False,torch.bfloat16,torch.bfloat16,False,False,opus,202,4,10.9891,opus_gemm_flatmm_splitk_256x32x32x128_2x1_16x16x32_0x0x0_wgpcu2,0.0,106.87,1455.15
256,88,1024,7168,False,torch.bfloat16,torch.bfloat16,False,False,opus,202,4,11.0968,opus_gemm_flatmm_splitk_256x32x32x128_2x1_16x16x32_0x0x0_wgpcu2,0.0,116.42,1452.84
256,96,1024,7168,False,torch.bfloat16,torch.bfloat16,False,False,opus,202,4,11.1748,opus_gemm_flatmm_splitk_256x32x32x128_2x1_16x16x32_0x0x0_wgpcu2,0.0,126.11,1454.43
256,104,1024,7168,False,torch.bfloat16,torch.bfloat16,False,False,opus,203,4,11.4239,opus_gemm_flatmm_splitk_256x32x64x64_2x1_16x16x32_0x0x0_wgpcu2,0.0,133.64,1434.19
256,112,1024,7168,False,torch.bfloat16,torch.bfloat16,False,False,opus,203,4,11.4473,opus_gemm_flatmm_splitk_256x32x64x64_2x1_16x16x32_0x0x0_wgpcu2,0.0,143.63,1442.7
256,120,1024,7168,False,torch.bfloat16,torch.bfloat16,False,False,opus,203,4,11.4659,opus_gemm_flatmm_splitk_256x32x64x64_2x1_16x16x32_0x0x0_wgpcu2,0.0,153.64,1451.8
256,128,1024,7168,False,torch.bfloat16,torch.bfloat16,False,False,opus,203,4,11.4992,opus_gemm_flatmm_splitk_256x32x64x64_2x1_16x16x32_0x0x0_wgpcu2,0.0,163.41,1458.99
256,136,1024,7168,False,torch.bfloat16,torch.bfloat16,False,False,opus,200,4,13.3507,opus_gemm_flatmm_splitk_256x64x64x64_2x1_16x16x32_0x0x0_wgpcu2,0.0,149.54,1266.47
256,144,1024,7168,False,torch.bfloat16,torch.bfloat16,False,False,opus,200,4,13.4045,opus_gemm_flatmm_splitk_256x64x64x64_2x1_16x16x32_0x0x0_wgpcu2,0.0,157.7,1271.17
256,152,1024,7168,False,torch.bfloat16,torch.bfloat16,False,False,opus,200,4,13.4129,opus_gemm_flatmm_splitk_256x64x64x64_2x1_16x16x32_0x0x0_wgpcu2,0.0,166.36,1280.14
256,160,1024,7168,False,torch.bfloat16,torch.bfloat16,False,False,opus,200,4,13.4232,opus_gemm_flatmm_splitk_256x64x64x64_2x1_16x16x32_0x0x0_wgpcu2,0.0,174.98,1288.93
256,168,1024,7168,False,torch.bfloat16,torch.bfloat16,False,False,opus,200,4,13.4556,opus_gemm_flatmm_splitk_256x64x64x64_2x1_16x16x32_0x0x0_wgpcu2,0.0,183.29,1295.56
256,176,1024,7168,False,torch.bfloat16,torch.bfloat16,False,False,opus,200,4,13.4596,opus_gemm_flatmm_splitk_256x64x64x64_2x1_16x16x32_0x0x0_wgpcu2,0.0,191.96,1304.92
256,184,1024,7168,False,torch.bfloat16,torch.bfloat16,False,False,opus,200,4,13.4544,opus_gemm_flatmm_splitk_256x64x64x64_2x1_16x16x32_0x0x0_wgpcu2,0.0,200.76,1315.16
256,192,1024,7168,False,torch.bfloat16,torch.bfloat16,False,False,opus,200,4,13.494,opus_gemm_flatmm_splitk_256x64x64x64_2x1_16x16x32_0x0x0_wgpcu2,0.0,208.88,1321.02
256,200,1024,7168,False,torch.bfloat16,torch.bfloat16,False,False,opus,200,4,13.7653,opus_gemm_flatmm_splitk_256x64x64x64_2x1_16x16x32_0x0x0_wgpcu2,0.0,213.29,1304.5
256,208,1024,7168,False,torch.bfloat16,torch.bfloat16,False,False,opus,200,4,13.7737,opus_gemm_flatmm_splitk_256x64x64x64_2x1_16x16x32_0x0x0_wgpcu2,0.0,221.69,1313.22
256,216,1024,7168,False,torch.bfloat16,torch.bfloat16,False,False,opus,200,4,13.7859,opus_gemm_flatmm_splitk_256x64x64x64_2x1_16x16x32_0x0x0_wgpcu2,0.0,230.01,1321.57
256,224,1024,7168,False,torch.bfloat16,torch.bfloat16,False,False,opus,200,4,13.8243,opus_gemm_flatmm_splitk_256x64x64x64_2x1_16x16x32_0x0x0_wgpcu2,0.0,237.87,1327.38
256,232,1024,7168,False,torch.bfloat16,torch.bfloat16,False,False,opus,200,4,13.8572,opus_gemm_flatmm_splitk_256x64x64x64_2x1_16x16x32_0x0x0_wgpcu2,0.0,245.78,1333.69
256,240,1024,7168,False,torch.bfloat16,torch.bfloat16,False,False,opus,200,4,13.8719,opus_gemm_flatmm_splitk_256x64x64x64_2x1_16x16x32_0x0x0_wgpcu2,0.0,253.98,1341.72
256,248,1024,7168,False,torch.bfloat16,torch.bfloat16,False,False,opus,200,4,13.9004,opus_gemm_flatmm_splitk_256x64x64x64_2x1_16x16x32_0x0x0_wgpcu2,0.0,261.91,1348.4
256,256,1024,7168,False,torch.bfloat16,torch.bfloat16,False,False,opus,200,4,13.9673,opus_gemm_flatmm_splitk_256x64x64x64_2x1_16x16x32_0x0x0_wgpcu2,0.0,269.06,1351.33
256,264,1024,7168,False,torch.bfloat16,torch.bfloat16,False,False,opus,200,4,18.14,opus_gemm_flatmm_splitk_256x64x64x64_2x1_16x16x32_0x0x0_wgpcu2,0.0,213.65,1047.71
256,272,1024,7168,False,torch.bfloat16,torch.bfloat16,False,False,opus,200,4,18.0612,opus_gemm_flatmm_splitk_256x64x64x64_2x1_16x16x32_0x0x0_wgpcu2,0.0,221.08,1059.54
256,280,1024,7168,False,torch.bfloat16,torch.bfloat16,False,False,opus,200,4,18.0125,opus_gemm_flatmm_splitk_256x64x64x64_2x1_16x16x32_0x0x0_wgpcu2,0.0,228.2,1069.68
256,288,1024,7168,False,torch.bfloat16,torch.bfloat16,False,False,opus,200,4,17.9179,opus_gemm_flatmm_splitk_256x64x64x64_2x1_16x16x32_0x0x0_wgpcu2,0.0,235.96,1082.64
256,296,1024,7168,False,torch.bfloat16,torch.bfloat16,False,False,opus,200,4,17.8292,opus_gemm_flatmm_splitk_256x64x64x64_2x1_16x16x32_0x0x0_wgpcu2,0.0,243.72,1095.38
256,304,1024,7168,False,torch.bfloat16,torch.bfloat16,False,False,opus,200,4,17.8513,opus_gemm_flatmm_splitk_256x64x64x64_2x1_16x16x32_0x0x0_wgpcu2,0.0,250.0,1101.37
256,312,1024,7168,False,torch.bfloat16,torch.bfloat16,False,False,opus,200,4,18.2026,opus_gemm_flatmm_splitk_256x64x64x64_2x1_16x16x32_0x0x0_wgpcu2,0.0,251.62,1087.31
256,320,1024,7168,False,torch.bfloat16,torch.bfloat16,False,False,opus,200,4,17.7357,opus_gemm_flatmm_splitk_256x64x64x64_2x1_16x16x32_0x0x0_wgpcu2,0.0,264.87,1123.32
256,328,1024,7168,False,torch.bfloat16,torch.bfloat16,False,False,opus,200,4,18.346,opus_gemm_flatmm_splitk_256x64x64x64_2x1_16x16x32_0x0x0_wgpcu2,0.0,262.46,1093.1
256,336,1024,7168,False,torch.bfloat16,torch.bfloat16,False,False,opus,200,4,18.1804,opus_gemm_flatmm_splitk_256x64x64x64_2x1_16x16x32_0x0x0_wgpcu2,0.0,271.31,1110.27
256,344,1024,7168,False,torch.bfloat16,torch.bfloat16,False,False,opus,200,4,18.2751,opus_gemm_flatmm_splitk_256x64x64x64_2x1_16x16x32_0x0x0_wgpcu2,0.0,276.33,1111.69
256,376,1024,7168,False,torch.bfloat16,torch.bfloat16,False,False,opus,200,4,18.8228,opus_gemm_flatmm_splitk_256x64x64x64_2x1_16x16x32_0x0x0_wgpcu2,0.0,293.25,1107.19
256,384,1024,7168,False,torch.bfloat16,torch.bfloat16,False,False,opus,200,4,18.2244,opus_gemm_flatmm_splitk_256x64x64x64_2x1_16x16x32_0x0x0_wgpcu2,0.0,309.32,1150.74
256,4,2112,7168,False,torch.bfloat16,torch.bfloat16,False,False,opus,202,4,9.8053,opus_gemm_flatmm_splitk_256x32x32x128_2x1_16x16x32_0x0x0_wgpcu2,0.0,12.35,3095.46
256,8,2112,7168,False,torch.bfloat16,torch.bfloat16,False,False,opus,202,4,9.9736,opus_gemm_flatmm_splitk_256x32x32x128_2x1_16x16x32_0x0x0_wgpcu2,0.0,24.29,3050.66
256,16,2112,7168,False,torch.bfloat16,torch.bfloat16,False,False,opus,202,4,10.2366,opus_gemm_flatmm_splitk_256x32x32x128_2x1_16x16x32_0x0x0_wgpcu2,0.0,47.32,2986.79
256,24,2112,7168,False,torch.bfloat16,torch.bfloat16,False,False,opus,202,2,10.5007,opus_gemm_flatmm_splitk_256x32x32x128_2x1_16x16x32_0x0x0_wgpcu2,0.0,69.2,2925.81
256,32,2112,7168,False,torch.bfloat16,torch.bfloat16,False,False,opus,202,2,10.7205,opus_gemm_flatmm_splitk_256x32x32x128_2x1_16x16x32_0x0x0_wgpcu2,0.0,90.38,2879.67
256,40,2112,7168,False,torch.bfloat16,torch.bfloat16,False,False,opus,205,4,12.7245,opus_gemm_flatmm_splitk_256x64x32x64_2x1_16x16x32_0x0x0_wgpcu2,0.0,95.18,2437.82
256,48,2112,7168,False,torch.bfloat16,torch.bfloat16,False,False,opus,200,4,13.34,opus_gemm_flatmm_splitk_256x64x64x64_2x1_16x16x32_0x0x0_wgpcu2,0.0,108.95,2336.47
256,56,2112,7168,False,torch.bfloat16,torch.bfloat16,False,False,opus,200,4,13.3538,opus_gemm_flatmm_splitk_256x64x64x64_2x1_16x16x32_0x0x0_wgpcu2,0.0,126.97,2345.17
256,72,2112,7168,False,torch.bfloat16,torch.bfloat16,False,False,opus,204,8,15.8169,opus_gemm_flatmm_splitk_256x32x128x64_2x1_16x16x32_0x0x0_wgpcu2,0.0,137.83,1998.75
256,88,2112,7168,False,torch.bfloat16,torch.bfloat16,False,False,opus,203,4,16.0778,opus_gemm_flatmm_splitk_256x32x64x64_2x1_16x16x32_0x0x0_wgpcu2,0.0,165.72,1984.78
256,2,2560,2880,False,torch.bfloat16,torch.bfloat16,False,False,opus,202,4,10.2087,opus_gemm_flatmm_splitk_256x32x32x128_2x1_16x16x32_0x0x0_wgpcu2,0.0,2.89,1446.55
256,4,2560,2880,False,torch.bfloat16,torch.bfloat16,False,False,opus,209,0,0.2489,opus_gemm_flatmm_splitk_256x256x32x64_2x1_16x16x32_0x0x0_wgpcu1,0.0,236.97,59417.92
256,8,2560,2880,False,torch.bfloat16,torch.bfloat16,False,False,opus,203,4,10.4836,opus_gemm_flatmm_splitk_256x32x64x64_2x1_16x16x32_0x0x0_wgpcu2,0.0,11.25,1414.84
256,16,2560,2880,False,torch.bfloat16,torch.bfloat16,False,False,opus,203,4,10.7218,opus_gemm_flatmm_splitk_256x32x64x64_2x1_16x16x32_0x0x0_wgpcu2,0.0,22.0,1391.53
256,32,2560,2880,False,torch.bfloat16,torch.bfloat16,False,False,opus,200,8,10.9371,opus_gemm_flatmm_splitk_256x64x64x64_2x1_16x16x32_0x0x0_wgpcu2,0.0,43.14,1380.05
256,48,2560,2880,False,torch.bfloat16,torch.bfloat16,False,False,opus,200,8,11.5365,opus_gemm_flatmm_splitk_256x64x64x64_2x1_16x16x32_0x0x0_wgpcu2,0.0,61.35,1323.44
256,64,2560,2880,False,torch.bfloat16,torch.bfloat16,False,False,opus,210,4,18.9183,opus_gemm_flatmm_splitk_256x32x256x64_2x1_16x16x32_0x0x0_wgpcu1,0.0,49.88,816.24
256,128,2560,2880,False,torch.bfloat16,torch.bfloat16,False,False,opus,200,8,14.6334,opus_gemm_flatmm_splitk_256x64x64x64_2x1_16x16x32_0x0x0_wgpcu2,0.0,128.98,1102.84
256,256,2560,2880,False,torch.bfloat16,torch.bfloat16,False,False,opus,200,0,20.838,opus_gemm_flatmm_splitk_256x64x64x64_2x1_16x16x32_0x0x0_wgpcu2,0.0,181.15,841.29
256,1,2880,4096,False,torch.bfloat16,torch.bfloat16,False,False,opus,203,8,11.2954,opus_gemm_flatmm_splitk_256x32x64x64_2x1_16x16x32_0x0x0_wgpcu2,0.0,2.09,2089.96
256,2,2880,2048,False,torch.bfloat16,torch.bfloat16,False,False,opus,202,4,9.5551,opus_gemm_flatmm_splitk_256x32x32x128_2x1_16x16x32_0x0x0_wgpcu2,0.0,2.47,1236.64
256,2,2880,4096,False,torch.bfloat16,torch.bfloat16,False,False,opus,207,4,0.1531,opus_gemm_flatmm_splitk_256x128x32x64_2x1_16x16x32_0x0x0_wgpcu2,0.0,308.2,154283.89
256,4,2880,2048,False,torch.bfloat16,torch.bfloat16,False,False,opus,202,4,9.6485,opus_gemm_flatmm_splitk_256x32x32x128_2x1_16x16x32_0x0x0_wgpcu2,0.0,4.89,1226.71
256,4,2880,4096,False,torch.bfloat16,torch.bfloat16,False,False,opus,203,8,11.7323,opus_gemm_flatmm_splitk_256x32x64x64_2x1_16x16x32_0x0x0_wgpcu2,0.0,8.04,2015.7
256,8,2880,2048,False,torch.bfloat16,torch.bfloat16,False,False,opus,202,2,10.0857,opus_gemm_flatmm_splitk_256x32x32x128_2x1_16x16x32_0x0x0_wgpcu2,0.0,9.36,1177.44
256,8,2880,4096,False,torch.bfloat16,torch.bfloat16,False,False,opus,203,8,11.8294,opus_gemm_flatmm_splitk_256x32x64x64_2x1_16x16x32_0x0x0_wgpcu2,0.0,15.96,2003.87
256,16,2880,2048,False,torch.bfloat16,torch.bfloat16,False,False,opus,202,4,9.6297,opus_gemm_flatmm_splitk_256x32x32x128_2x1_16x16x32_0x0x0_wgpcu2,0.0,19.6,1241.39
256,16,2880,4096,False,torch.bfloat16,torch.bfloat16,False,False,opus,206,0,11.7134,opus_gemm_flatmm_splitk_256x64x32x128_2x1_16x16x32_0x0x0_wgpcu2,0.0,32.23,2033.24
256,32,2880,2048,False,torch.bfloat16,torch.bfloat16,False,False,opus,200,8,6.3472,opus_gemm_flatmm_splitk_256x64x64x64_2x1_16x16x32_0x0x0_wgpcu2,0.0,59.47,1908.22
256,32,2880,4096,False,torch.bfloat16,torch.bfloat16,False,False,opus,203,4,12.1024,opus_gemm_flatmm_splitk_256x32x64x64_2x1_16x16x32_0x0x0_wgpcu2,0.0,62.38,1986.34
256,48,2880,2048,False,torch.bfloat16,torch.bfloat16,False,False,opus,205,4,11.2956,opus_gemm_flatmm_splitk_256x64x32x64_2x1_16x16x32_0x0x0_wgpcu2,0.0,50.13,1086.23
256,48,2880,4096,False,torch.bfloat16,torch.bfloat16,False,False,opus,200,4,13.0319,opus_gemm_flatmm_splitk_256x64x64x64_2x1_16x16x32_0x0x0_wgpcu2,0.0,86.9,1861.79
256,64,2880,2048,False,torch.bfloat16,torch.bfloat16,False,False,opus,208,4,12.8161,opus_gemm_flatmm_splitk_256x64x64x128_2x1_16x16x32_0x0x0_wgpcu1,0.0,58.91,969.66
256,64,2880,4096,False,torch.bfloat16,torch.bfloat16,False,False,opus,200,4,14.3326,opus_gemm_flatmm_splitk_256x64x64x64_2x1_16x16x32_0x0x0_wgpcu2,0.0,105.35,1708.41
256,80,2880,4096,False,torch.bfloat16,torch.bfloat16,False,False,opus,200,2,16.7655,opus_gemm_flatmm_splitk_256x64x64x64_2x1_16x16x32_0x0x0_wgpcu2,0.0,112.58,1473.81
256,96,2880,4096,False,torch.bfloat16,torch.bfloat16,False,False,opus,200,4,16.9118,opus_gemm_flatmm_splitk_256x64x64x64_2x1_16x16x32_0x0x0_wgpcu2,0.0,133.93,1474.26
256,112,2880,4096,False,torch.bfloat16,torch.bfloat16,False,False,opus,200,4,17.1752,opus_gemm_flatmm_splitk_256x64x64x64_2x1_16x16x32_0x0x0_wgpcu2,0.0,153.85,1464.65
256,128,2880,2048,False,torch.bfloat16,torch.bfloat16,False,False,opus,200,2,13.3997,opus_gemm_flatmm_splitk_256x64x64x64_2x1_16x16x32_0x0x0_wgpcu2,0.0,112.69,974.5
256,128,2880,4096,False,torch.bfloat16,torch.bfloat16,False,False,opus,200,4,17.2904,opus_gemm_flatmm_splitk_256x64x64x64_2x1_16x16x32_0x0x0_wgpcu2,0.0,174.66,1467.8
256,256,2880,2048,False,torch.bfloat16,torch.bfloat16,False,False,opus,200,2,16.8185,opus_gemm_flatmm_splitk_256x64x64x64_2x1_16x16x32_0x0x0_wgpcu2,0.0,179.56,851.42
256,360,4096,512,False,torch.bfloat16,torch.bfloat16,False,False,opus,6,0,8.7672,opus_gemm_512x128x128x64_2x4_16x16x32_0x0x0,0.0,172.23,856.84
256,1,5120,640,False,torch.bfloat16,torch.bfloat16,False,False,opus,201,0,8.1737,opus_gemm_flatmm_splitk_256x32x32x64_2x1_16x16x32_0x0x0_wgpcu2,0.0,0.8,803.2
256,1,5120,1280,False,torch.bfloat16,torch.bfloat16,False,False,opus,201,2,9.5398,opus_gemm_flatmm_splitk_256x32x32x64_2x1_16x16x32_0x0x0_wgpcu2,0.0,1.37,1375.29
256,1,5120,2880,False,torch.bfloat16,torch.bfloat16,False,False,opus,202,2,13.0839,opus_gemm_flatmm_splitk_256x32x32x128_2x1_16x16x32_0x0x0_wgpcu2,0.0,2.25,2255.23
256,1,5120,3200,False,torch.bfloat16,torch.bfloat16,False,False,opus,203,8,12.5028,opus_gemm_flatmm_splitk_256x32x64x64_2x1_16x16x32_0x0x0_wgpcu2,0.0,2.62,2622.18
256,1,5120,5120,False,torch.bfloat16,torch.bfloat16,False,False,opus,202,2,17.273,opus_gemm_flatmm_splitk_256x32x32x128_2x1_16x16x32_0x0x0_wgpcu2,0.0,3.04,3036.49
256,1,5120,6400,False,torch.bfloat16,torch.bfloat16,False,False,opus,203,4,19.4744,opus_gemm_flatmm_splitk_256x32x64x64_2x1_16x16x32_0x0x0_wgpcu2,0.0,3.37,3366.42
256,1,5120,25600,False,torch.bfloat16,torch.bfloat16,False,False,opus,203,4,59.8692,opus_gemm_flatmm_splitk_256x32x64x64_2x1_16x16x32_0x0x0_wgpcu2,0.0,4.38,4379.64
256,2,5120,2880,False,torch.bfloat16,torch.bfloat16,False,False,opus,203,4,13.376,opus_gemm_flatmm_splitk_256x32x64x64_2x1_16x16x32_0x0x0_wgpcu2,0.0,4.41,2207.18
256,4,5120,2880,False,torch.bfloat16,torch.bfloat16,False,False,opus,203,4,13.3739,opus_gemm_flatmm_splitk_256x32x64x64_2x1_16x16x32_0x0x0_wgpcu2,0.0,8.82,2209.92
256,8,5120,2880,False,torch.bfloat16,torch.bfloat16,False,False,opus,203,4,13.2558,opus_gemm_flatmm_splitk_256x32x64x64_2x1_16x16x32_0x0x0_wgpcu2,0.0,17.8,2234.43
256,16,5120,640,False,torch.bfloat16,torch.bfloat16,False,False,opus,202,0,8.422,opus_gemm_flatmm_splitk_256x32x32x128_2x1_16x16x32_0x0x0_wgpcu2,0.0,12.45,800.04
256,16,5120,1280,False,torch.bfloat16,torch.bfloat16,False,False,opus,203,2,9.7786,opus_gemm_flatmm_splitk_256x32x64x64_2x1_16x16x32_0x0x0_wgpcu2,0.0,21.45,1361.34
256,16,5120,2880,False,torch.bfloat16,torch.bfloat16,False,False,opus,201,2,13.8799,opus_gemm_flatmm_splitk_256x32x32x64_2x1_16x16x32_0x0x0_wgpcu2,0.0,34.0,2143.19
256,16,5120,3200,False,torch.bfloat16,torch.bfloat16,False,False,opus,203,8,13.0353,opus_gemm_flatmm_splitk_256x32x64x64_2x1_16x16x32_0x0x0_wgpcu2,0.0,40.22,2534.21
256,16,5120,5120,False,torch.bfloat16,torch.bfloat16,False,False,opus,201,7,17.6976,opus_gemm_flatmm_splitk_256x32x32x64_2x1_16x16x32_0x0x0_wgpcu2,0.0,47.4,2981.0
256,16,5120,6400,False,torch.bfloat16,torch.bfloat16,False,False,opus,202,7,20.2999,opus_gemm_flatmm_splitk_256x32x32x128_2x1_16x16x32_0x0x0_wgpcu2,0.0,51.65,3246.55
256,16,5120,25600,False,torch.bfloat16,torch.bfloat16,False,False,opus,210,8,62.4171,opus_gemm_flatmm_splitk_256x32x256x64_2x1_16x16x32_0x0x0_wgpcu1,0.0,67.2,4215.62
256,32,5120,640,False,torch.bfloat16,torch.bfloat16,False,False,opus,201,0,8.6447,opus_gemm_flatmm_splitk_256x32x32x64_2x1_16x16x32_0x0x0_wgpcu2,0.0,24.26,800.75
256,32,5120,1280,False,torch.bfloat16,torch.bfloat16,False,False,opus,203,2,10.2333,opus_gemm_flatmm_splitk_256x32x64x64_2x1_16x16x32_0x0x0_wgpcu2,0.0,40.99,1320.86
256,32,5120,2880,False,torch.bfloat16,torch.bfloat16,False,False,opus,203,2,14.3975,opus_gemm_flatmm_splitk_256x32x64x64_2x1_16x16x32_0x0x0_wgpcu2,0.0,65.55,2083.92
256,32,5120,3200,False,torch.bfloat16,torch.bfloat16,False,False,opus,203,8,13.548,opus_gemm_flatmm_splitk_256x32x64x64_2x1_16x16x32_0x0x0_wgpcu2,0.0,77.4,2457.96
256,32,5120,5120,False,torch.bfloat16,torch.bfloat16,False,False,opus,201,7,19.946,opus_gemm_flatmm_splitk_256x32x32x64_2x1_16x16x32_0x0x0_wgpcu2,0.0,84.11,2661.39
256,32,5120,6400,False,torch.bfloat16,torch.bfloat16,False,False,opus,204,4,21.4118,opus_gemm_flatmm_splitk_256x32x128x64_2x1_16x16x32_0x0x0_wgpcu2,0.0,97.94,3095.18
256,32,5120,25600,False,torch.bfloat16,torch.bfloat16,False,False,opus,204,26,63.2881,opus_gemm_flatmm_splitk_256x32x128x64_2x1_16x16x32_0x0x0_wgpcu2,0.0,132.55,4173.14
256,48,5120,2880,False,torch.bfloat16,torch.bfloat16,False,False,opus,201,0,0.1656,opus_gemm_flatmm_splitk_256x32x32x64_2x1_16x16x32_0x0x0_wgpcu2,0.0,8548.17,182724.64
256,64,5120,640,False,torch.bfloat16,torch.bfloat16,False,False,opus,203,0,9.7882,opus_gemm_flatmm_splitk_256x32x64x64_2x1_16x16x32_0x0x0_wgpcu2,0.0,42.85,744.86
256,64,5120,1280,False,torch.bfloat16,torch.bfloat16,False,False,opus,200,2,11.7913,opus_gemm_flatmm_splitk_256x64x64x64_2x1_16x16x32_0x0x0_wgpcu2,0.0,71.14,1181.07
256,64,5120,2880,False,torch.bfloat16,torch.bfloat16,False,False,opus,200,8,14.9241,opus_gemm_flatmm_splitk_256x64x64x64_2x1_16x16x32_0x0x0_wgpcu2,0.0,126.47,2044.69
256,64,5120,3200,False,torch.bfloat16,torch.bfloat16,False,False,opus,200,8,16.0006,opus_gemm_flatmm_splitk_256x64x64x64_2x1_16x16x32_0x0x0_wgpcu2,0.0,131.07,2114.48
256,64,5120,5120,False,torch.bfloat16,torch.bfloat16,False,False,opus,200,4,25.7163,opus_gemm_flatmm_splitk_256x64x64x64_2x1_16x16x32_0x0x0_wgpcu2,0.0,130.48,2089.71
256,64,5120,6400,False,torch.bfloat16,torch.bfloat16,False,False,opus,200,2,25.5369,opus_gemm_flatmm_splitk_256x64x64x64_2x1_16x16x32_0x0x0_wgpcu2,0.0,164.24,2624.07
256,64,5120,25600,False,torch.bfloat16,torch.bfloat16,False,False,opus,200,13,79.5277,opus_gemm_flatmm_splitk_256x64x64x64_2x1_16x16x32_0x0x0_wgpcu2,0.0,210.96,3345.7
256,80,5120,2880,False,torch.bfloat16,torch.bfloat16,False,False,opus,204,4,18.4583,opus_gemm_flatmm_splitk_256x32x128x64_2x1_16x16x32_0x0x0_wgpcu2,0.0,127.82,1667.07
256,96,5120,2880,False,torch.bfloat16,torch.bfloat16,False,False,opus,204,4,18.5293,opus_gemm_flatmm_splitk_256x32x128x64_2x1_16x16x32_0x0x0_wgpcu2,0.0,152.79,1674.49
256,112,5120,2880,False,torch.bfloat16,torch.bfloat16,False,False,opus,200,0,21.0721,opus_gemm_flatmm_splitk_256x64x64x64_2x1_16x16x32_0x0x0_wgpcu2,0.0,156.75,1484.58
256,128,5120,640,False,torch.bfloat16,torch.bfloat16,False,False,opus,200,0,11.5039,opus_gemm_flatmm_splitk_256x64x64x64_2x1_16x16x32_0x0x0_wgpcu2,0.0,72.92,697.86
256,128,5120,1280,False,torch.bfloat16,torch.bfloat16,False,False,opus,200,0,14.6753,opus_gemm_flatmm_splitk_256x64x64x64_2x1_16x16x32_0x0x0_wgpcu2,0.0,114.32,1004.79
256,128,5120,2880,False,torch.bfloat16,torch.bfloat16,False,False,opus,200,0,21.8269,opus_gemm_flatmm_splitk_256x64x64x64_2x1_16x16x32_0x0x0_wgpcu2,0.0,172.95,1444.97
256,128,5120,3200,False,torch.bfloat16,torch.bfloat16,False,False,opus,200,0,23.0647,opus_gemm_flatmm_splitk_256x64x64x64_2x1_16x16x32_0x0x0_wgpcu2,0.0,181.85,1513.04
256,128,5120,5120,False,torch.bfloat16,torch.bfloat16,False,False,opus,200,7,36.7999,opus_gemm_flatmm_splitk_256x64x64x64_2x1_16x16x32_0x0x0_wgpcu2,0.0,182.36,1495.93
256,128,5120,6400,False,torch.bfloat16,torch.bfloat16,False,False,opus,200,4,36.2449,opus_gemm_flatmm_splitk_256x64x64x64_2x1_16x16x32_0x0x0_wgpcu2,0.0,231.44,1889.51
256,128,5120,25600,False,torch.bfloat16,torch.bfloat16,False,False,opus,200,8,115.1694,opus_gemm_flatmm_splitk_256x64x64x64_2x1_16x16x32_0x0x0_wgpcu2,0.0,291.35,2344.44
256,256,5120,640,False,torch.bfloat16,torch.bfloat16,False,False,opus,6,0,11.8228,opus_gemm_512x128x128x64_2x4_16x16x32_0x0x0,0.0,141.91,803.76
256,256,5120,1280,False,torch.bfloat16,torch.bfloat16,False,False,opus,6,0,18.9823,opus_gemm_512x128x128x64_2x4_16x16x32_0x0x0,0.0,176.77,863.12
256,256,5120,3200,False,torch.bfloat16,torch.bfloat16,False,False,opus,200,2,34.5516,opus_gemm_flatmm_splitk_256x64x64x64_2x1_16x16x32_0x0x0_wgpcu2,0.0,242.78,1071.67
256,256,5120,5120,False,torch.bfloat16,torch.bfloat16,False,False,opus,200,4,53.2275,opus_gemm_flatmm_splitk_256x64x64x64_2x1_16x16x32_0x0x0_wgpcu2,0.0,252.16,1083.49
256,256,5120,6400,False,torch.bfloat16,torch.bfloat16,False,False,opus,200,4,56.3961,opus_gemm_flatmm_splitk_256x64x64x64_2x1_16x16x32_0x0x0_wgpcu2,0.0,297.49,1266.65
256,256,5120,25600,False,torch.bfloat16,torch.bfloat16,False,False,opus,200,8,180.1003,opus_gemm_flatmm_splitk_256x64x64x64_2x1_16x16x32_0x0x0_wgpcu2,0.0,372.62,1542.88
256,512,5120,640,False,torch.bfloat16,torch.bfloat16,False,False,opus,6,0,12.6816,opus_gemm_512x128x128x64_2x4_16x16x32_0x0x0,0.0,264.59,981.88
256,512,5120,1280,False,torch.bfloat16,torch.bfloat16,False,False,opus,6,0,19.7478,opus_gemm_512x128x128x64_2x4_16x16x32_0x0x0,0.0,339.83,995.59
256,512,5120,3200,False,torch.bfloat16,torch.bfloat16,False,False,opus,6,0,40.318,opus_gemm_512x128x128x64_2x4_16x16x32_0x0x0,0.0,416.12,1024.05
256,512,5120,5120,False,torch.bfloat16,torch.bfloat16,False,False,opus,6,0,63.4855,opus_gemm_512x128x128x64_2x4_16x16x32_0x0x0,0.0,422.83,991.01
256,512,5120,6400,False,torch.bfloat16,torch.bfloat16,False,False,opus,6,0,76.8534,opus_gemm_512x128x128x64_2x4_16x16x32_0x0x0,0.0,436.6,1006.23
256,512,5120,25600,False,torch.bfloat16,torch.bfloat16,False,False,opus,6,0,280.24,opus_gemm_512x128x128x64_2x4_16x16x32_0x0x0,0.0,478.94,1047.68
256,1024,5120,640,False,torch.bfloat16,torch.bfloat16,False,False,opus,8,0,18.7601,opus_gemm_512x128x256x64_2x4_16x16x32_0x0x0,0.0,357.72,978.14
256,1024,5120,1280,False,torch.bfloat16,torch.bfloat16,False,False,opus,7,0,29.901,opus_gemm_512x256x128x64_2x4_16x16x32_0x0x0,0.0,448.87,876.71
256,1024,5120,3200,False,torch.bfloat16,torch.bfloat16,False,False,opus,8,0,58.1075,opus_gemm_512x128x256x64_2x4_16x16x32_0x0x0,0.0,577.45,857.16
256,1024,5120,5120,False,torch.bfloat16,torch.bfloat16,False,False,opus,8,0,89.7358,opus_gemm_512x128x256x64_2x4_16x16x32_0x0x0,0.0,598.28,817.96
256,1024,5120,6400,False,torch.bfloat16,torch.bfloat16,False,False,opus,8,0,109.9699,opus_gemm_512x128x256x64_2x4_16x16x32_0x0x0,0.0,610.25,810.49
256,1024,5120,25600,False,torch.bfloat16,torch.bfloat16,False,False,opus,8,0,376.3078,opus_gemm_512x128x256x64_2x4_16x16x32_0x0x0,0.0,713.34,863.81
256,2048,5120,640,False,torch.bfloat16,torch.bfloat16,False,False,opus,9,0,29.1374,opus_gemm_512x256x256x64_2x4_16x16x32_0x0x0,0.0,460.64,1034.63
256,2048,5120,1280,False,torch.bfloat16,torch.bfloat16,False,False,opus,9,0,45.9412,opus_gemm_512x256x256x64_2x4_16x16x32_0x0x0,0.0,584.3,855.91
256,2048,5120,3200,False,torch.bfloat16,torch.bfloat16,False,False,opus,9,0,97.1619,opus_gemm_512x256x256x64_2x4_16x16x32_0x0x0,0.0,690.69,687.99
256,2048,5120,5120,False,torch.bfloat16,torch.bfloat16,False,False,opus,9,0,143.117,opus_gemm_512x256x256x64_2x4_16x16x32_0x0x0,0.0,750.25,659.4
256,2048,5120,6400,False,torch.bfloat16,torch.bfloat16,False,False,opus,9,0,171.0236,opus_gemm_512x256x256x64_2x4_16x16x32_0x0x0,0.0,784.79,659.1
256,2048,5120,25600,False,torch.bfloat16,torch.bfloat16,False,False,opus,9,0,575.7097,opus_gemm_512x256x256x64_2x4_16x16x32_0x0x0,0.0,932.54,673.9
256,4096,5120,640,False,torch.bfloat16,torch.bfloat16,False,False,opus,6,0,53.1457,opus_gemm_512x128x128x64_2x4_16x16x32_0x0x0,0.0,505.09,1011.17
256,4096,5120,1280,False,torch.bfloat16,torch.bfloat16,False,False,opus,6,0,89.7814,opus_gemm_512x128x128x64_2x4_16x16x32_0x0x0,0.0,597.98,729.95
256,4096,5120,3200,False,torch.bfloat16,torch.bfloat16,False,False,opus,9,0,178.3706,opus_gemm_512x256x256x64_2x4_16x16x32_0x0x0,0.0,752.47,565.82
256,4096,5120,5120,False,torch.bfloat16,torch.bfloat16,False,False,opus,9,0,264.8013,opus_gemm_512x256x256x64_2x4_16x16x32_0x0x0,0.0,810.98,514.78
256,4096,5120,6400,False,torch.bfloat16,torch.bfloat16,False,False,opus,9,0,326.1558,opus_gemm_512x256x256x64_2x4_16x16x32_0x0x0,0.0,823.03,490.28
256,4096,5120,25600,False,torch.bfloat16,torch.bfloat16,False,False,opus,9,0,1162.2642,opus_gemm_512x256x256x64_2x4_16x16x32_0x0x0,0.0,923.84,442.07
256,8192,5120,640,False,torch.bfloat16,torch.bfloat16,False,False,opus,9,0,96.9443,opus_gemm_512x256x256x64_2x4_16x16x32_0x0x0,0.0,553.79,1041.07
256,8192,5120,1280,False,torch.bfloat16,torch.bfloat16,False,False,opus,9,0,152.4166,opus_gemm_512x256x256x64_2x4_16x16x32_0x0x0,0.0,704.48,773.96
256,8192,5120,3200,False,torch.bfloat16,torch.bfloat16,False,False,opus,9,0,297.8734,opus_gemm_512x256x256x64_2x4_16x16x32_0x0x0,0.0,901.17,567.63
256,8192,5120,5120,False,torch.bfloat16,torch.bfloat16,False,False,opus,9,0,430.8735,opus_gemm_512x256x256x64_2x4_16x16x32_0x0x0,0.0,996.8,511.06
256,8192,5120,6400,False,torch.bfloat16,torch.bfloat16,False,False,opus,9,0,527.909,opus_gemm_512x256x256x64_2x4_16x16x32_0x0x0,0.0,1016.98,481.67
256,8192,5120,25600,False,torch.bfloat16,torch.bfloat16,False,False,opus,9,0,1950.4373,opus_gemm_512x256x256x64_2x4_16x16x32_0x0x0,0.0,1101.03,392.46
256,16384,5120,640,False,torch.bfloat16,torch.bfloat16,False,False,opus,9,0,167.0358,opus_gemm_512x256x256x64_2x4_16x16x32_0x0x0,0.0,642.82,1169.19
256,16384,5120,1280,False,torch.bfloat16,torch.bfloat16,False,False,opus,9,0,262.3683,opus_gemm_512x256x256x64_2x4_16x16x32_0x0x0,0.0,818.5,849.27
256,16384,5120,3200,False,torch.bfloat16,torch.bfloat16,False,False,opus,9,0,512.6387,opus_gemm_512x256x256x64_2x4_16x16x32_0x0x0,0.0,1047.27,595.74
256,16384,5120,5120,False,torch.bfloat16,torch.bfloat16,False,False,opus,9,0,766.8609,opus_gemm_512x256x256x64_2x4_16x16x32_0x0x0,0.0,1120.14,505.92
256,16384,5120,6400,False,torch.bfloat16,torch.bfloat16,False,False,opus,9,0,944.4458,opus_gemm_512x256x256x64_2x4_16x16x32_0x0x0,0.0,1136.9,469.08
256,16384,5120,25600,False,torch.bfloat16,torch.bfloat16,False,False,opus,9,0,3636.3649,opus_gemm_512x256x256x64_2x4_16x16x32_0x0x0,0.0,1181.12,348.91
256,32768,5120,640,False,torch.bfloat16,torch.bfloat16,False,False,opus,9,0,319.9199,opus_gemm_512x256x256x64_2x4_16x16x32_0x0x0,0.0,671.26,1200.43
256,32768,5120,1280,False,torch.bfloat16,torch.bfloat16,False,False,opus,9,0,496.962,opus_gemm_512x256x256x64_2x4_16x16x32_0x0x0,0.0,864.24,870.36
256,32768,5120,3200,False,torch.bfloat16,torch.bfloat16,False,False,opus,9,0,994.5364,opus_gemm_512x256x256x64_2x4_16x16x32_0x0x0,0.0,1079.64,581.2
256,32768,5120,5120,False,torch.bfloat16,torch.bfloat16,False,False,opus,9,0,1512.8974,opus_gemm_512x256x256x64_2x4_16x16x32_0x0x0,0.0,1135.56,478.23
256,32768,5120,6400,False,torch.bfloat16,torch.bfloat16,False,False,opus,9,0,1863.0201,opus_gemm_512x256x256x64_2x4_16x16x32_0x0x0,0.0,1152.69,440.42
256,32768,5120,25600,False,torch.bfloat16,torch.bfloat16,False,False,opus,9,0,7282.2146,opus_gemm_512x256x256x64_2x4_16x16x32_0x0x0,0.0,1179.58,312.46
256,1,6400,5120,False,torch.bfloat16,torch.bfloat16,False,False,opus,202,2,18.2542,opus_gemm_flatmm_splitk_256x32x32x128_2x1_16x16x32_0x0x0_wgpcu2,0.0,3.59,3591.45
256,16,6400,5120,False,torch.bfloat16,torch.bfloat16,False,False,opus,203,4,19.9058,opus_gemm_flatmm_splitk_256x32x64x64_2x1_16x16x32_0x0x0_wgpcu2,0.0,52.68,3310.83
256,32,6400,5120,False,torch.bfloat16,torch.bfloat16,False,False,opus,203,2,21.1448,opus_gemm_flatmm_splitk_256x32x64x64_2x1_16x16x32_0x0x0_wgpcu2,0.0,99.18,3134.26
256,64,6400,5120,False,torch.bfloat16,torch.bfloat16,False,False,opus,200,4,24.2528,opus_gemm_flatmm_splitk_256x64x64x64_2x1_16x16x32_0x0x0_wgpcu2,0.0,172.94,2763.0
256,128,6400,5120,False,torch.bfloat16,torch.bfloat16,False,False,opus,200,2,39.3461,opus_gemm_flatmm_splitk_256x64x64x64_2x1_16x16x32_0x0x0_wgpcu2,0.0,213.2,1740.58
256,256,6400,5120,False,torch.bfloat16,torch.bfloat16,False,False,opus,6,0,62.1031,opus_gemm_512x128x128x64_2x4_16x16x32_0x0x0,0.0,270.15,1150.25
256,512,6400,5120,False,torch.bfloat16,torch.bfloat16,False,False,opus,6,0,71.1208,opus_gemm_512x128x128x64_2x4_16x16x32_0x0x0,0.0,471.79,1087.34
256,1024,6400,5120,False,torch.bfloat16,torch.bfloat16,False,False,opus,7,0,105.7324,opus_gemm_512x256x128x64_2x4_16x16x32_0x0x0,0.0,634.7,842.97
256,2048,6400,5120,False,torch.bfloat16,torch.bfloat16,False,False,opus,9,0,165.7402,opus_gemm_512x256x256x64_2x4_16x16x32_0x0x0,0.0,809.81,680.11
256,4096,6400,5120,False,torch.bfloat16,torch.bfloat16,False,False,opus,9,0,307.0953,opus_gemm_512x256x256x64_2x4_16x16x32_0x0x0,0.0,874.11,520.71
256,8192,6400,5120,False,torch.bfloat16,torch.bfloat16,False,False,opus,9,0,579.2864,opus_gemm_512x256x256x64_2x4_16x16x32_0x0x0,0.0,926.78,438.95
256,16384,6400,5120,False,torch.bfloat16,torch.bfloat16,False,False,opus,9,0,1045.0475,opus_gemm_512x256x256x64_2x4_16x16x32_0x0x0,0.0,1027.46,423.93
256,32768,6400,5120,False,torch.bfloat16,torch.bfloat16,False,False,opus,9,0,2016.6189,opus_gemm_512x256x256x64_2x4_16x16x32_0x0x0,0.0,1064.89,406.87
256,1,7168,512,False,torch.bfloat16,torch.bfloat16,False,False,opus,202,0,6.0108,opus_gemm_flatmm_splitk_256x32x32x128_2x1_16x16x32_0x0x0_wgpcu2,0.0,1.22,1223.7
256,48,7168,512,False,torch.bfloat16,torch.bfloat16,False,False,opus,205,0,6.9391,opus_gemm_flatmm_splitk_256x64x32x64_2x1_16x16x32_0x0x0_wgpcu2,0.0,50.77,1164.03
256,72,7168,512,False,torch.bfloat16,torch.bfloat16,False,False,opus,6,0,7.7573,opus_gemm_512x128x128x64_2x4_16x16x32_0x0x0,0.0,68.13,1088.77
256,80,7168,512,False,torch.bfloat16,torch.bfloat16,False,False,opus,6,0,7.8809,opus_gemm_512x128x128x64_2x4_16x16x32_0x0x0,0.0,74.51,1087.29
256,120,7168,512,False,torch.bfloat16,torch.bfloat16,False,False,opus,6,0,8.656,opus_gemm_512x128x128x64_2x4_16x16x32_0x0x0,0.0,101.76,1060.91
256,128,7168,512,False,torch.bfloat16,torch.bfloat16,False,False,opus,6,0,8.7708,opus_gemm_512x128x128x64_2x4_16x16x32_0x0x0,0.0,107.12,1061.03
256,1,12800,5120,False,torch.bfloat16,torch.bfloat16,False,False,opus,202,0,30.4024,opus_gemm_flatmm_splitk_256x32x32x128_2x1_16x16x32_0x0x0_wgpcu2,0.0,4.31,4312.42
256,16,12800,5120,False,torch.bfloat16,torch.bfloat16,False,False,opus,201,0,32.9068,opus_gemm_flatmm_splitk_256x32x32x64_2x1_16x16x32_0x0x0_wgpcu2,0.0,63.73,4000.55
256,32,12800,5120,False,torch.bfloat16,torch.bfloat16,False,False,opus,203,2,35.6913,opus_gemm_flatmm_splitk_256x32x64x64_2x1_16x16x32_0x0x0_wgpcu2,0.0,117.52,3704.51
256,64,12800,5120,False,torch.bfloat16,torch.bfloat16,False,False,opus,200,0,44.5534,opus_gemm_flatmm_splitk_256x64x64x64_2x1_16x16x32_0x0x0_wgpcu2,0.0,188.28,2993.39
256,128,12800,5120,False,torch.bfloat16,torch.bfloat16,False,False,opus,6,0,64.2011,opus_gemm_512x128x128x64_2x4_16x16x32_0x0x0,0.0,261.32,2113.04
256,256,12800,5120,False,torch.bfloat16,torch.bfloat16,False,False,opus,6,0,72.93,opus_gemm_512x128x128x64_2x4_16x16x32_0x0x0,0.0,460.09,1923.04
256,512,12800,5120,False,torch.bfloat16,torch.bfloat16,False,False,opus,7,0,108.1933,opus_gemm_512x256x128x64_2x4_16x16x32_0x0x0,0.0,620.27,1381.07
256,1024,12800,5120,False,torch.bfloat16,torch.bfloat16,False,False,opus,9,0,168.0814,opus_gemm_512x256x256x64_2x4_16x16x32_0x0x0,0.0,798.53,998.16
256,2048,12800,5120,False,torch.bfloat16,torch.bfloat16,False,False,opus,9,0,304.6707,opus_gemm_512x256x256x64_2x4_16x16x32_0x0x0,0.0,881.07,671.13
256,4096,12800,5120,False,torch.bfloat16,torch.bfloat16,False,False,opus,9,0,567.3953,opus_gemm_512x256x256x64_2x4_16x16x32_0x0x0,0.0,946.2,489.73
256,8192,12800,5120,False,torch.bfloat16,torch.bfloat16,False,False,opus,9,0,1032.2519,opus_gemm_512x256x256x64_2x4_16x16x32_0x0x0,0.0,1040.19,411.4
256,16384,12800,5120,False,torch.bfloat16,torch.bfloat16,False,False,opus,9,0,1987.2941,opus_gemm_512x256x256x64_2x4_16x16x32_0x0x0,0.0,1080.61,361.43
256,32768,12800,5120,False,torch.bfloat16,torch.bfloat16,False,False,opus,9,0,3909.5648,opus_gemm_512x256x256x64_2x4_16x16x32_0x0x0,0.0,1098.58,333.92
256,1,51200,5120,False,torch.bfloat16,torch.bfloat16,False,False,opus,202,0,101.0967,opus_gemm_flatmm_splitk_256x32x32x128_2x1_16x16x32_0x0x0_wgpcu2,0.0,5.19,5187.12
256,16,51200,5120,False,torch.bfloat16,torch.bfloat16,False,False,opus,210,0,109.8697,opus_gemm_flatmm_splitk_256x32x256x64_2x1_16x16x32_0x0x0_wgpcu1,0.0,76.35,4788.31
256,32,51200,5120,False,torch.bfloat16,torch.bfloat16,False,False,opus,210,0,115.6214,opus_gemm_flatmm_splitk_256x32x256x64_2x1_16x16x32_0x0x0_wgpcu1,0.0,145.1,4565.7
256,64,51200,5120,False,torch.bfloat16,torch.bfloat16,False,False,opus,8,0,124.5263,opus_gemm_512x128x256x64_2x4_16x16x32_0x0x0,0.0,269.46,4268.15
256,128,51200,5120,False,torch.bfloat16,torch.bfloat16,False,False,opus,8,0,136.4947,opus_gemm_512x128x256x64_2x4_16x16x32_0x0x0,0.0,491.66,3946.72
256,256,51200,5120,False,torch.bfloat16,torch.bfloat16,False,False,opus,9,0,189.2963,opus_gemm_512x256x256x64_2x4_16x16x32_0x0x0,0.0,709.04,2922.0
256,512,51200,5120,False,torch.bfloat16,torch.bfloat16,False,False,opus,9,0,348.4451,opus_gemm_512x256x256x64_2x4_16x16x32_0x0x0,0.0,770.38,1670.16
256,1024,51200,5120,False,torch.bfloat16,torch.bfloat16,False,False,opus,9,0,637.8282,opus_gemm_512x256x256x64_2x4_16x16x32_0x0x0,0.0,841.72,1002.83
256,2048,51200,5120,False,torch.bfloat16,torch.bfloat16,False,False,opus,9,0,1184.4952,opus_gemm_512x256x256x64_2x4_16x16x32_0x0x0,0.0,906.5,637.38
256,4096,51200,5120,False,torch.bfloat16,torch.bfloat16,False,False,opus,9,0,2308.1474,opus_gemm_512x256x256x64_2x4_16x16x32_0x0x0,0.0,930.39,427.04
256,8192,51200,5120,False,torch.bfloat16,torch.bfloat16,False,False,opus,9,0,4571.2036,opus_gemm_512x256x256x64_2x4_16x16x32_0x0x0,0.0,939.57,316.55
256,16384,51200,5120,False,torch.bfloat16,torch.bfloat16,False,False,opus,9,0,9177.7919,opus_gemm_512x256x256x64_2x4_16x16x32_0x0x0,0.0,935.95,258.21
256,32768,51200,5120,False,torch.bfloat16,torch.bfloat16,False,False,opus,9,0,18515.4799,opus_gemm_512x256x256x64_2x4_16x16x32_0x0x0,0.0,927.87,227.66
