aiter/configs/a4w4_blockscale_tuned_gemm.csv
cu_num,M,N,K,kernelId,splitK,us,kernelName
256,1,1280,8192,0,0,20.0584,a4w4_blockscale_256x64x128x128_16x16_16x16_8x32x1_8x32x1_1x32x1x8_8_2x2_intrawave_v3
256,64,1280,8192,0,0,22.8453,a4w4_blockscale_256x64x128x128_16x16_16x16_8x32x1_8x32x1_1x32x1x8_8_2x2_intrawave_v3
256,127,1280,8192,0,0,24.5557,a4w4_blockscale_256x64x128x128_16x16_16x16_8x32x1_8x32x1_1x32x1x8_8_2x2_intrawave_v3
256,129,1280,8192,0,0,24.2161,a4w4_blockscale_256x64x128x128_16x16_16x16_8x32x1_8x32x1_1x32x1x8_8_2x2_intrawave_v3
256,65,1280,8192,0,0,23.8037,a4w4_blockscale_256x64x128x128_16x16_16x16_8x32x1_8x32x1_1x32x1x8_8_2x2_intrawave_v3
256,32,1280,8192,0,0,20.5908,a4w4_blockscale_256x64x128x128_16x16_16x16_8x32x1_8x32x1_1x32x1x8_8_2x2_intrawave_v3
256,128,1280,8192,0,0,24.6445,a4w4_blockscale_256x64x128x128_16x16_16x16_8x32x1_8x32x1_1x32x1x8_8_2x2_intrawave_v3
256,192,1280,8192,0,0,24.9277,a4w4_blockscale_256x64x128x128_16x16_16x16_8x32x1_8x32x1_1x32x1x8_8_2x2_intrawave_v3
256,256,1280,8192,0,0,25.0789,a4w4_blockscale_256x64x128x128_16x16_16x16_8x32x1_8x32x1_1x32x1x8_8_2x2_intrawave_v3
256,320,1280,8192,0,0,25.7109,a4w4_blockscale_256x64x128x128_16x16_16x16_8x32x1_8x32x1_1x32x1x8_8_2x2_intrawave_v3
256,512,1280,8192,0,0,25.7093,a4w4_blockscale_256x64x128x128_16x16_16x16_8x32x1_8x32x1_1x32x1x8_8_2x2_intrawave_v3
256,1024,1280,8192,0,0,26.7065,a4w4_blockscale_256x64x128x128_16x16_16x16_8x32x1_8x32x1_1x32x1x8_8_2x2_intrawave_v3
256,2048,1280,8192,4,0,34.8178,a4w4_blockscale_256x96x128x128_16x16_16x16_8x32x1_8x32x1_1x32x1x8_8_2x2_intrawave_v3
256,4096,1280,8192,5,0,50.2876,a4w4_blockscale_256x96x256x128_16x16_16x16_8x32x1_8x32x1_1x32x1x8_8_2x2_intrawave_v3
256,8192,1280,8192,10,0,79.0087,a4w4_blockscale_256x128x384x128_16x16_16x16_8x32x1_8x32x1_1x32x1x8_8_2x2_intrawave_v3
256,1,8192,1024,0,0,6.1719,a4w4_blockscale_256x64x128x128_16x16_16x16_8x32x1_8x32x1_1x32x1x8_8_2x2_intrawave_v3
256,32,8192,1024,0,0,6.1951,a4w4_blockscale_256x64x128x128_16x16_16x16_8x32x1_8x32x1_1x32x1x8_8_2x2_intrawave_v3
256,64,8192,1024,0,0,6.6551,a4w4_blockscale_256x64x128x128_16x16_16x16_8x32x1_8x32x1_1x32x1x8_8_2x2_intrawave_v3
256,128,8192,1024,0,0,6.9631,a4w4_blockscale_256x64x128x128_16x16_16x16_8x32x1_8x32x1_1x32x1x8_8_2x2_intrawave_v3
256,192,8192,1024,0,0,7.1723,a4w4_blockscale_256x64x128x128_16x16_16x16_8x32x1_8x32x1_1x32x1x8_8_2x2_intrawave_v3
256,256,8192,1024,0,0,7.3523,a4w4_blockscale_256x64x128x128_16x16_16x16_8x32x1_8x32x1_1x32x1x8_8_2x2_intrawave_v3
256,320,8192,1024,4,0,8.2691,a4w4_blockscale_256x96x128x128_16x16_16x16_8x32x1_8x32x1_1x32x1x8_8_2x2_intrawave_v3
256,512,8192,1024,0,0,9.6371,a4w4_blockscale_256x64x128x128_16x16_16x16_8x32x1_8x32x1_1x32x1x8_8_2x2_intrawave_v3
256,1024,8192,1024,9,0,15.124,a4w4_blockscale_256x128x256x128_16x16_16x16_8x32x1_8x32x1_1x32x1x8_8_2x2_intrawave_v3
256,2048,8192,1024,9,0,29.2553,a4w4_blockscale_256x128x256x128_16x16_16x16_8x32x1_8x32x1_1x32x1x8_8_2x2_intrawave_v3
256,4096,8192,1024,10,0,54.98,a4w4_blockscale_256x128x384x128_16x16_16x16_8x32x1_8x32x1_1x32x1x8_8_2x2_intrawave_v3
256,8192,8192,1024,10,0,107.6091,a4w4_blockscale_256x128x384x128_16x16_16x16_8x32x1_8x32x1_1x32x1x8_8_2x2_intrawave_v3
256,16384,8192,1024,10,0,199.9461,a4w4_blockscale_256x128x384x128_16x16_16x16_8x32x1_8x32x1_1x32x1x8_8_2x2_intrawave_v3
256,1,16384,16384,0,0,48.7499,a4w4_blockscale_256x64x128x128_16x16_16x16_8x32x1_8x32x1_1x32x1x8_8_2x2_intrawave_v3
256,1,106496,16384,1,0,166.3724,a4w4_blockscale_256x64x256x128_16x16_16x16_8x32x1_8x32x1_1x32x1x8_8_2x2_intrawave_v3
256,1,16384,53248,0,0,153.6754,a4w4_blockscale_256x64x128x128_16x16_16x16_8x32x1_8x32x1_1x32x1x8_8_2x2_intrawave_v3
256,1,18432,16384,0,0,48.0015,a4w4_blockscale_256x64x128x128_16x16_16x16_8x32x1_8x32x1_1x32x1x8_8_2x2_intrawave_v3
256,4,16384,16384,0,0,47.2967,a4w4_blockscale_256x64x128x128_16x16_16x16_8x32x1_8x32x1_1x32x1x8_8_2x2_intrawave_v3
256,4,106496,16384,1,0,169.296,a4w4_blockscale_256x64x256x128_16x16_16x16_8x32x1_8x32x1_1x32x1x8_8_2x2_intrawave_v3
256,4,16384,53248,0,0,154.4138,a4w4_blockscale_256x64x128x128_16x16_16x16_8x32x1_8x32x1_1x32x1x8_8_2x2_intrawave_v3
256,4,18432,16384,0,0,47.8611,a4w4_blockscale_256x64x128x128_16x16_16x16_8x32x1_8x32x1_1x32x1x8_8_2x2_intrawave_v3
256,8,16384,16384,0,0,47.3527,a4w4_blockscale_256x64x128x128_16x16_16x16_8x32x1_8x32x1_1x32x1x8_8_2x2_intrawave_v3
256,8,106496,16384,1,0,171.4844,a4w4_blockscale_256x64x256x128_16x16_16x16_8x32x1_8x32x1_1x32x1x8_8_2x2_intrawave_v3
256,8,16384,53248,0,0,154.0534,a4w4_blockscale_256x64x128x128_16x16_16x16_8x32x1_8x32x1_1x32x1x8_8_2x2_intrawave_v3
256,8,18432,16384,0,0,48.0507,a4w4_blockscale_256x64x128x128_16x16_16x16_8x32x1_8x32x1_1x32x1x8_8_2x2_intrawave_v3
256,16,16384,16384,0,0,47.7127,a4w4_blockscale_256x64x128x128_16x16_16x16_8x32x1_8x32x1_1x32x1x8_8_2x2_intrawave_v3
256,16,106496,16384,0,0,172.8008,a4w4_blockscale_256x64x128x128_16x16_16x16_8x32x1_8x32x1_1x32x1x8_8_2x2_intrawave_v3
256,16,16384,53248,0,0,153.8542,a4w4_blockscale_256x64x128x128_16x16_16x16_8x32x1_8x32x1_1x32x1x8_8_2x2_intrawave_v3
256,16,18432,16384,0,0,48.3223,a4w4_blockscale_256x64x128x128_16x16_16x16_8x32x1_8x32x1_1x32x1x8_8_2x2_intrawave_v3
256,32,16384,16384,0,0,48.1723,a4w4_blockscale_256x64x128x128_16x16_16x16_8x32x1_8x32x1_1x32x1x8_8_2x2_intrawave_v3
256,32,106496,16384,1,0,180.7333,a4w4_blockscale_256x64x256x128_16x16_16x16_8x32x1_8x32x1_1x32x1x8_8_2x2_intrawave_v3
256,32,16384,53248,0,0,154.7322,a4w4_blockscale_256x64x128x128_16x16_16x16_8x32x1_8x32x1_1x32x1x8_8_2x2_intrawave_v3
256,32,18432,16384,0,0,49.3695,a4w4_blockscale_256x64x128x128_16x16_16x16_8x32x1_8x32x1_1x32x1x8_8_2x2_intrawave_v3
256,64,16384,16384,0,0,50.8427,a4w4_blockscale_256x64x128x128_16x16_16x16_8x32x1_8x32x1_1x32x1x8_8_2x2_intrawave_v3
256,64,106496,16384,3,0,196.9027,a4w4_blockscale_256x64x512x128_16x16_16x16_8x32x1_8x32x1_1x32x1x8_8_2x2_intrawave_v3
256,64,16384,53248,0,0,157.3395,a4w4_blockscale_256x64x128x128_16x16_16x16_8x32x1_8x32x1_1x32x1x8_8_2x2_intrawave_v3
256,64,18432,16384,0,0,51.7155,a4w4_blockscale_256x64x128x128_16x16_16x16_8x32x1_8x32x1_1x32x1x8_8_2x2_intrawave_v3
256,128,16384,16384,0,0,52.6212,a4w4_blockscale_256x64x128x128_16x16_16x16_8x32x1_8x32x1_1x32x1x8_8_2x2_intrawave_v3
256,128,106496,16384,9,0,273.0307,a4w4_blockscale_256x128x256x128_16x16_16x16_8x32x1_8x32x1_1x32x1x8_8_2x2_intrawave_v3
256,128,16384,53248,0,0,170.7488,a4w4_blockscale_256x64x128x128_16x16_16x16_8x32x1_8x32x1_1x32x1x8_8_2x2_intrawave_v3
256,128,18432,16384,1,0,64.9129,a4w4_blockscale_256x64x256x128_16x16_16x16_8x32x1_8x32x1_1x32x1x8_8_2x2_intrawave_v3
256,256,16384,16384,1,0,71.293,a4w4_blockscale_256x64x256x128_16x16_16x16_8x32x1_8x32x1_1x32x1x8_8_2x2_intrawave_v3
256,256,106496,16384,10,0,406.4861,a4w4_blockscale_256x128x384x128_16x16_16x16_8x32x1_8x32x1_1x32x1x8_8_2x2_intrawave_v3
256,256,16384,53248,1,0,229.853,a4w4_blockscale_256x64x256x128_16x16_16x16_8x32x1_8x32x1_1x32x1x8_8_2x2_intrawave_v3
256,256,18432,16384,2,0,88.7999,a4w4_blockscale_256x64x384x128_16x16_16x16_8x32x1_8x32x1_1x32x1x8_8_2x2_intrawave_v3
256,16384,16384,16384,7,0,3617.6576,a4w4_blockscale_256x96x512x128_16x16_16x16_8x32x1_8x32x1_1x32x1x8_8_2x2_intrawave_v3
256,16384,106496,16384,7,0,24041.8425,a4w4_blockscale_256x96x512x128_16x16_16x16_8x32x1_8x32x1_1x32x1x8_8_2x2_intrawave_v3
256,16384,16384,53248,7,0,11558.8738,a4w4_blockscale_256x96x512x128_16x16_16x16_8x32x1_8x32x1_1x32x1x8_8_2x2_intrawave_v3
256,16384,18432,16384,10,0,4036.1513,a4w4_blockscale_256x128x384x128_16x16_16x16_8x32x1_8x32x1_1x32x1x8_8_2x2_intrawave_v3
256,16,1536,7168,0,0,20.12,a4w4_blockscale_256x64x128x128_16x16_16x16_8x32x1_8x32x1_1x32x1x8_8_2x2_intrawave_v3
256,16,3072,1536,0,0,7.0439,a4w4_blockscale_256x64x128x128_16x16_16x16_8x32x1_8x32x1_1x32x1x8_8_2x2_intrawave_v3
256,16,576,7168,-1,0,nan,None
256,16,7168,256,-1,0,nan,None
256,16,7168,2048,0,0,8.4955,a4w4_blockscale_256x64x128x128_16x16_16x16_8x32x1_8x32x1_1x32x1x8_8_2x2_intrawave_v3
256,16,4608,7168,0,0,22.0656,a4w4_blockscale_256x64x128x128_16x16_16x16_8x32x1_8x32x1_1x32x1x8_8_2x2_intrawave_v3
256,16,7168,2304,0,0,9.6603,a4w4_blockscale_256x64x128x128_16x16_16x16_8x32x1_8x32x1_1x32x1x8_8_2x2_intrawave_v3
256,16,512,7168,4,0,16.6356,a4w4_blockscale_256x96x128x128_16x16_16x16_8x32x1_8x32x1_1x32x1x8_8_2x2_intrawave_v3
256,16,4096,512,-1,0,nan,None
256,32,1536,7168,0,0,20.1372,a4w4_blockscale_256x64x128x128_16x16_16x16_8x32x1_8x32x1_1x32x1x8_8_2x2_intrawave_v3
256,32,3072,1536,0,0,7.0275,a4w4_blockscale_256x64x128x128_16x16_16x16_8x32x1_8x32x1_1x32x1x8_8_2x2_intrawave_v3
256,32,576,7168,-1,0,nan,None
256,32,7168,256,-1,0,nan,None
256,32,7168,2048,0,0,8.5555,a4w4_blockscale_256x64x128x128_16x16_16x16_8x32x1_8x32x1_1x32x1x8_8_2x2_intrawave_v3
256,32,4608,7168,0,0,22.4524,a4w4_blockscale_256x64x128x128_16x16_16x16_8x32x1_8x32x1_1x32x1x8_8_2x2_intrawave_v3
256,32,7168,2304,0,0,9.7775,a4w4_blockscale_256x64x128x128_16x16_16x16_8x32x1_8x32x1_1x32x1x8_8_2x2_intrawave_v3
256,32,512,7168,4,0,16.61,a4w4_blockscale_256x96x128x128_16x16_16x16_8x32x1_8x32x1_1x32x1x8_8_2x2_intrawave_v3
256,32,4096,512,-1,0,nan,None
256,64,1536,7168,0,0,21.3796,a4w4_blockscale_256x64x128x128_16x16_16x16_8x32x1_8x32x1_1x32x1x8_8_2x2_intrawave_v3
256,64,3072,1536,0,0,7.2591,a4w4_blockscale_256x64x128x128_16x16_16x16_8x32x1_8x32x1_1x32x1x8_8_2x2_intrawave_v3
256,64,576,7168,-1,0,nan,None
256,64,7168,256,-1,0,nan,None
256,64,7168,2048,0,0,9.0671,a4w4_blockscale_256x64x128x128_16x16_16x16_8x32x1_8x32x1_1x32x1x8_8_2x2_intrawave_v3
256,64,4608,7168,0,0,23.3013,a4w4_blockscale_256x64x128x128_16x16_16x16_8x32x1_8x32x1_1x32x1x8_8_2x2_intrawave_v3
256,64,7168,2304,0,0,10.0287,a4w4_blockscale_256x64x128x128_16x16_16x16_8x32x1_8x32x1_1x32x1x8_8_2x2_intrawave_v3
256,64,512,7168,4,0,17.8396,a4w4_blockscale_256x96x128x128_16x16_16x16_8x32x1_8x32x1_1x32x1x8_8_2x2_intrawave_v3
256,64,4096,512,-1,0,nan,None
256,128,1536,7168,0,0,23.5429,a4w4_blockscale_256x64x128x128_16x16_16x16_8x32x1_8x32x1_1x32x1x8_8_2x2_intrawave_v3
256,128,3072,1536,0,0,7.5647,a4w4_blockscale_256x64x128x128_16x16_16x16_8x32x1_8x32x1_1x32x1x8_8_2x2_intrawave_v3
256,128,576,7168,-1,0,nan,None
256,128,7168,256,-1,0,nan,None
256,128,7168,2048,0,0,9.4491,a4w4_blockscale_256x64x128x128_16x16_16x16_8x32x1_8x32x1_1x32x1x8_8_2x2_intrawave_v3
256,128,4608,7168,0,0,23.6661,a4w4_blockscale_256x64x128x128_16x16_16x16_8x32x1_8x32x1_1x32x1x8_8_2x2_intrawave_v3
256,128,7168,2304,0,0,10.4763,a4w4_blockscale_256x64x128x128_16x16_16x16_8x32x1_8x32x1_1x32x1x8_8_2x2_intrawave_v3
256,128,512,7168,0,0,22.824,a4w4_blockscale_256x64x128x128_16x16_16x16_8x32x1_8x32x1_1x32x1x8_8_2x2_intrawave_v3
256,128,4096,512,-1,0,nan,None
256,256,1536,7168,0,0,23.4161,a4w4_blockscale_256x64x128x128_16x16_16x16_8x32x1_8x32x1_1x32x1x8_8_2x2_intrawave_v3
256,256,3072,1536,0,0,8.0947,a4w4_blockscale_256x64x128x128_16x16_16x16_8x32x1_8x32x1_1x32x1x8_8_2x2_intrawave_v3
256,256,576,7168,-1,0,nan,None
256,256,7168,256,-1,0,nan,None
256,256,7168,2048,0,0,9.7379,a4w4_blockscale_256x64x128x128_16x16_16x16_8x32x1_8x32x1_1x32x1x8_8_2x2_intrawave_v3
256,256,4608,7168,0,0,23.6497,a4w4_blockscale_256x64x128x128_16x16_16x16_8x32x1_8x32x1_1x32x1x8_8_2x2_intrawave_v3
256,256,7168,2304,0,0,10.7587,a4w4_blockscale_256x64x128x128_16x16_16x16_8x32x1_8x32x1_1x32x1x8_8_2x2_intrawave_v3
256,256,512,7168,0,0,22.7973,a4w4_blockscale_256x64x128x128_16x16_16x16_8x32x1_8x32x1_1x32x1x8_8_2x2_intrawave_v3
256,256,4096,512,-1,0,nan,None
256,512,1536,7168,0,0,23.7525,a4w4_blockscale_256x64x128x128_16x16_16x16_8x32x1_8x32x1_1x32x1x8_8_2x2_intrawave_v3
256,512,3072,1536,0,0,8.7443,a4w4_blockscale_256x64x128x128_16x16_16x16_8x32x1_8x32x1_1x32x1x8_8_2x2_intrawave_v3
256,512,576,7168,-1,0,nan,None
256,512,7168,256,-1,0,nan,None
256,512,7168,2048,1,0,13.0751,a4w4_blockscale_256x64x256x128_16x16_16x16_8x32x1_8x32x1_1x32x1x8_8_2x2_intrawave_v3
256,512,4608,7168,4,0,29.3113,a4w4_blockscale_256x96x128x128_16x16_16x16_8x32x1_8x32x1_1x32x1x8_8_2x2_intrawave_v3
256,512,7168,2304,8,0,12.8972,a4w4_blockscale_256x128x128x128_16x16_16x16_8x32x1_8x32x1_1x32x1x8_8_2x2_intrawave_v3
256,512,512,7168,0,0,23.2713,a4w4_blockscale_256x64x128x128_16x16_16x16_8x32x1_8x32x1_1x32x1x8_8_2x2_intrawave_v3
256,512,4096,512,-1,0,nan,None
256,1024,1536,7168,0,0,25.4493,a4w4_blockscale_256x64x128x128_16x16_16x16_8x32x1_8x32x1_1x32x1x8_8_2x2_intrawave_v3
256,1024,3072,1536,8,0,10.7531,a4w4_blockscale_256x128x128x128_16x16_16x16_8x32x1_8x32x1_1x32x1x8_8_2x2_intrawave_v3
256,1024,576,7168,-1,0,nan,None
256,1024,7168,256,-1,0,nan,None
256,1024,7168,2048,8,0,20.0388,a4w4_blockscale_256x128x128x128_16x16_16x16_8x32x1_8x32x1_1x32x1x8_8_2x2_intrawave_v3
256,1024,4608,7168,5,0,42.7179,a4w4_blockscale_256x96x256x128_16x16_16x16_8x32x1_8x32x1_1x32x1x8_8_2x2_intrawave_v3
256,1024,7168,2304,9,0,21.7636,a4w4_blockscale_256x128x256x128_16x16_16x16_8x32x1_8x32x1_1x32x1x8_8_2x2_intrawave_v3
256,1024,512,7168,0,0,24.6697,a4w4_blockscale_256x64x128x128_16x16_16x16_8x32x1_8x32x1_1x32x1x8_8_2x2_intrawave_v3
256,1024,4096,512,-1,0,nan,None
256,1536,1536,7168,4,0,29.7901,a4w4_blockscale_256x96x128x128_16x16_16x16_8x32x1_8x32x1_1x32x1x8_8_2x2_intrawave_v3
256,1536,3072,1536,4,0,12.9063,a4w4_blockscale_256x96x128x128_16x16_16x16_8x32x1_8x32x1_1x32x1x8_8_2x2_intrawave_v3
256,1536,576,7168,-1,0,nan,None
256,1536,7168,256,-1,0,nan,None
256,1536,7168,2048,10,0,26.5469,a4w4_blockscale_256x128x384x128_16x16_16x16_8x32x1_8x32x1_1x32x1x8_8_2x2_intrawave_v3
256,1536,4608,7168,6,0,54.1588,a4w4_blockscale_256x96x384x128_16x16_16x16_8x32x1_8x32x1_1x32x1x8_8_2x2_intrawave_v3
256,1536,7168,2304,7,0,29.3073,a4w4_blockscale_256x96x512x128_16x16_16x16_8x32x1_8x32x1_1x32x1x8_8_2x2_intrawave_v3
256,1536,512,7168,0,0,25.6329,a4w4_blockscale_256x64x128x128_16x16_16x16_8x32x1_8x32x1_1x32x1x8_8_2x2_intrawave_v3
256,1536,4096,512,-1,0,nan,None
256,2048,1536,7168,1,0,35.5898,a4w4_blockscale_256x64x256x128_16x16_16x16_8x32x1_8x32x1_1x32x1x8_8_2x2_intrawave_v3
256,2048,3072,1536,9,0,16.2532,a4w4_blockscale_256x128x256x128_16x16_16x16_8x32x1_8x32x1_1x32x1x8_8_2x2_intrawave_v3
256,2048,576,7168,-1,0,nan,None
256,2048,7168,256,-1,0,nan,None
256,2048,7168,2048,9,0,38.7606,a4w4_blockscale_256x128x256x128_16x16_16x16_8x32x1_8x32x1_1x32x1x8_8_2x2_intrawave_v3
256,2048,4608,7168,10,0,65.5637,a4w4_blockscale_256x128x384x128_16x16_16x16_8x32x1_8x32x1_1x32x1x8_8_2x2_intrawave_v3
256,2048,7168,2304,9,0,40.9814,a4w4_blockscale_256x128x256x128_16x16_16x16_8x32x1_8x32x1_1x32x1x8_8_2x2_intrawave_v3
256,2048,512,7168,0,0,26.4333,a4w4_blockscale_256x64x128x128_16x16_16x16_8x32x1_8x32x1_1x32x1x8_8_2x2_intrawave_v3
256,2048,4096,512,-1,0,nan,None
256,4096,1536,7168,2,0,50.05,a4w4_blockscale_256x64x384x128_16x16_16x16_8x32x1_8x32x1_1x32x1x8_8_2x2_intrawave_v3
256,4096,3072,1536,10,0,29.9885,a4w4_blockscale_256x128x384x128_16x16_16x16_8x32x1_8x32x1_1x32x1x8_8_2x2_intrawave_v3
256,4096,576,7168,-1,0,nan,None
256,4096,7168,256,-1,0,nan,None
256,4096,7168,2048,10,0,75.3022,a4w4_blockscale_256x128x384x128_16x16_16x16_8x32x1_8x32x1_1x32x1x8_8_2x2_intrawave_v3
256,4096,4608,7168,10,0,124.2608,a4w4_blockscale_256x128x384x128_16x16_16x16_8x32x1_8x32x1_1x32x1x8_8_2x2_intrawave_v3
256,4096,7168,2304,5,0,76.7202,a4w4_blockscale_256x96x256x128_16x16_16x16_8x32x1_8x32x1_1x32x1x8_8_2x2_intrawave_v3
256,4096,512,7168,0,0,27.4397,a4w4_blockscale_256x64x128x128_16x16_16x16_8x32x1_8x32x1_1x32x1x8_8_2x2_intrawave_v3
256,4096,4096,512,-1,0,nan,None
256,8192,1536,7168,10,0,74.3414,a4w4_blockscale_256x128x384x128_16x16_16x16_8x32x1_8x32x1_1x32x1x8_8_2x2_intrawave_v3
256,8192,3072,1536,10,0,48.8804,a4w4_blockscale_256x128x384x128_16x16_16x16_8x32x1_8x32x1_1x32x1x8_8_2x2_intrawave_v3
256,8192,576,7168,-1,0,nan,None
256,8192,7168,256,-1,0,nan,None
256,8192,7168,2048,10,0,130.8897,a4w4_blockscale_256x128x384x128_16x16_16x16_8x32x1_8x32x1_1x32x1x8_8_2x2_intrawave_v3
256,8192,4608,7168,10,0,221.1747,a4w4_blockscale_256x128x384x128_16x16_16x16_8x32x1_8x32x1_1x32x1x8_8_2x2_intrawave_v3
256,8192,7168,2304,10,0,138.7549,a4w4_blockscale_256x128x384x128_16x16_16x16_8x32x1_8x32x1_1x32x1x8_8_2x2_intrawave_v3
256,8192,512,7168,1,0,36.7186,a4w4_blockscale_256x64x256x128_16x16_16x16_8x32x1_8x32x1_1x32x1x8_8_2x2_intrawave_v3
256,8192,4096,512,-1,0,nan,None
256,16384,1536,7168,10,0,144.0426,a4w4_blockscale_256x128x384x128_16x16_16x16_8x32x1_8x32x1_1x32x1x8_8_2x2_intrawave_v3
256,16384,3072,1536,10,0,94.0565,a4w4_blockscale_256x128x384x128_16x16_16x16_8x32x1_8x32x1_1x32x1x8_8_2x2_intrawave_v3
256,16384,576,7168,-1,0,nan,None
256,16384,7168,256,-1,0,nan,None
256,16384,7168,2048,10,0,255.0743,a4w4_blockscale_256x128x384x128_16x16_16x16_8x32x1_8x32x1_1x32x1x8_8_2x2_intrawave_v3
256,16384,4608,7168,10,0,441.9043,a4w4_blockscale_256x128x384x128_16x16_16x16_8x32x1_8x32x1_1x32x1x8_8_2x2_intrawave_v3
256,16384,7168,2304,10,0,274.1845,a4w4_blockscale_256x128x384x128_16x16_16x16_8x32x1_8x32x1_1x32x1x8_8_2x2_intrawave_v3
256,16384,512,7168,9,0,59.9217,a4w4_blockscale_256x128x256x128_16x16_16x16_8x32x1_8x32x1_1x32x1x8_8_2x2_intrawave_v3
256,16384,4096,512,-1,0,nan,None
256,20480,1536,7168,10,0,194.9144,a4w4_blockscale_256x128x384x128_16x16_16x16_8x32x1_8x32x1_1x32x1x8_8_2x2_intrawave_v3
256,20480,3072,1536,10,0,119.5555,a4w4_blockscale_256x128x384x128_16x16_16x16_8x32x1_8x32x1_1x32x1x8_8_2x2_intrawave_v3
256,20480,576,7168,-1,0,nan,None
256,20480,7168,256,-1,0,nan,None
256,20480,7168,2048,10,0,319.4162,a4w4_blockscale_256x128x384x128_16x16_16x16_8x32x1_8x32x1_1x32x1x8_8_2x2_intrawave_v3
256,20480,4608,7168,10,0,561.4293,a4w4_blockscale_256x128x384x128_16x16_16x16_8x32x1_8x32x1_1x32x1x8_8_2x2_intrawave_v3
256,20480,7168,2304,10,0,341.772,a4w4_blockscale_256x128x384x128_16x16_16x16_8x32x1_8x32x1_1x32x1x8_8_2x2_intrawave_v3
256,20480,512,7168,7,0,70.0586,a4w4_blockscale_256x96x512x128_16x16_16x16_8x32x1_8x32x1_1x32x1x8_8_2x2_intrawave_v3
256,20480,4096,512,-1,0,nan,None
