aiter/configs/a8w8_bpreshuffle_cktile_tuned_gemm_300.csv
cu_num,M,N,K,kernelId,splitK,us,kernelName
304,1,512,7168,30,0,9.806,a8w8_bpreshuffle_cktile_0x0x8x4x1x0x0x0x0x2_16x64x512_1x4x1_16x16x64_default
304,1,3072,1536,2,0,5.1563,a8w8_bpreshuffle_cktile_0x0x8x4x1x0x0x0x0x1_16x64x512_1x4x1_16x16x64_default
304,1,4608,7168,2,0,12.8126,a8w8_bpreshuffle_cktile_0x0x8x4x1x0x0x0x0x1_16x64x512_1x4x1_16x16x64_default
304,1,7168,256,34,0,3.6832,a8w8_bpreshuffle_cktile_0x0x8x4x1x0x0x0x0x2_16x128x256_1x4x1_16x16x64_default
304,1,7168,2048,30,0,7.5911,a8w8_bpreshuffle_cktile_0x0x8x4x1x0x0x0x0x2_16x64x512_1x4x1_16x16x64_default
304,1,7168,2304,49,0,8.7949,a8w8_bpreshuffle_cktile_0x0x8x4x1x0x0x0x0x2_32x64x256_1x4x1_16x16x64_default
304,2,512,7168,30,0,10.1394,a8w8_bpreshuffle_cktile_0x0x8x4x1x0x0x0x0x2_16x64x512_1x4x1_16x16x64_default
304,2,3072,1536,2,0,5.2188,a8w8_bpreshuffle_cktile_0x0x8x4x1x0x0x0x0x1_16x64x512_1x4x1_16x16x64_default
304,2,4608,7168,2,0,13.1815,a8w8_bpreshuffle_cktile_0x0x8x4x1x0x0x0x0x1_16x64x512_1x4x1_16x16x64_default
304,2,7168,256,5,0,3.5882,a8w8_bpreshuffle_cktile_0x0x8x4x1x0x0x0x0x1_16x64x256_1x4x1_16x16x64_default
304,2,7168,2048,2,0,7.7818,a8w8_bpreshuffle_cktile_0x0x8x4x1x0x0x0x0x1_16x64x512_1x4x1_16x16x64_default
304,2,7168,2304,33,0,8.3683,a8w8_bpreshuffle_cktile_0x0x8x4x1x0x0x0x0x2_16x64x256_1x4x1_16x16x64_default
304,4,512,7168,2,0,10.0689,a8w8_bpreshuffle_cktile_0x0x8x4x1x0x0x0x0x1_16x64x512_1x4x1_16x16x64_default
304,4,3072,1536,30,0,5.4205,a8w8_bpreshuffle_cktile_0x0x8x4x1x0x0x0x0x2_16x64x512_1x4x1_16x16x64_default
304,4,4608,7168,2,0,13.2346,a8w8_bpreshuffle_cktile_0x0x8x4x1x0x0x0x0x1_16x64x512_1x4x1_16x16x64_default
304,4,7168,256,6,0,3.4786,a8w8_bpreshuffle_cktile_0x0x8x4x1x0x0x0x0x1_16x128x256_1x4x1_16x16x64_default
304,4,7168,2048,2,0,7.5019,a8w8_bpreshuffle_cktile_0x0x8x4x1x0x0x0x0x1_16x64x512_1x4x1_16x16x64_default
304,4,7168,2304,21,0,8.2562,a8w8_bpreshuffle_cktile_0x0x8x4x1x0x0x0x0x1_32x64x256_1x4x1_16x16x64_default
304,8,512,7168,2,0,9.5612,a8w8_bpreshuffle_cktile_0x0x8x4x1x0x0x0x0x1_16x64x512_1x4x1_16x16x64_default
304,8,3072,1536,2,0,5.1643,a8w8_bpreshuffle_cktile_0x0x8x4x1x0x0x0x0x1_16x64x512_1x4x1_16x16x64_default
304,8,4608,7168,30,0,12.814,a8w8_bpreshuffle_cktile_0x0x8x4x1x0x0x0x0x2_16x64x512_1x4x1_16x16x64_default
304,8,7168,256,5,0,3.6312,a8w8_bpreshuffle_cktile_0x0x8x4x1x0x0x0x0x1_16x64x256_1x4x1_16x16x64_default
304,8,7168,2048,30,0,7.3577,a8w8_bpreshuffle_cktile_0x0x8x4x1x0x0x0x0x2_16x64x512_1x4x1_16x16x64_default
304,8,7168,2304,5,0,8.9864,a8w8_bpreshuffle_cktile_0x0x8x4x1x0x0x0x0x1_16x64x256_1x4x1_16x16x64_default
304,16,512,7168,2,0,10.7533,a8w8_bpreshuffle_cktile_0x0x8x4x1x0x0x0x0x1_16x64x512_1x4x1_16x16x64_default
304,16,3072,1536,30,0,5.4024,a8w8_bpreshuffle_cktile_0x0x8x4x1x0x0x0x0x2_16x64x512_1x4x1_16x16x64_default
304,16,4608,7168,37,0,13.1187,a8w8_bpreshuffle_cktile_0x0x8x4x1x0x0x0x0x2_32x64x512_1x4x1_16x16x64_default
304,16,7168,256,33,0,3.5259,a8w8_bpreshuffle_cktile_0x0x8x4x1x0x0x0x0x2_16x64x256_1x4x1_16x16x64_default
304,16,7168,2048,2,0,6.9206,a8w8_bpreshuffle_cktile_0x0x8x4x1x0x0x0x0x1_16x64x512_1x4x1_16x16x64_default
304,16,7168,2304,5,0,9.2376,a8w8_bpreshuffle_cktile_0x0x8x4x1x0x0x0x0x1_16x64x256_1x4x1_16x16x64_default
304,32,512,7168,2,0,9.8761,a8w8_bpreshuffle_cktile_0x0x8x4x1x0x0x0x0x1_16x64x512_1x4x1_16x16x64_default
304,32,3072,1536,2,0,5.2033,a8w8_bpreshuffle_cktile_0x0x8x4x1x0x0x0x0x1_16x64x512_1x4x1_16x16x64_default
304,32,4608,7168,2,0,14.5203,a8w8_bpreshuffle_cktile_0x0x8x4x1x0x0x0x0x1_16x64x512_1x4x1_16x16x64_default
304,32,7168,256,33,0,3.6431,a8w8_bpreshuffle_cktile_0x0x8x4x1x0x0x0x0x2_16x64x256_1x4x1_16x16x64_default
304,32,7168,2048,2,0,7.7258,a8w8_bpreshuffle_cktile_0x0x8x4x1x0x0x0x0x1_16x64x512_1x4x1_16x16x64_default
304,32,7168,2304,49,0,9.6072,a8w8_bpreshuffle_cktile_0x0x8x4x1x0x0x0x0x2_32x64x256_1x4x1_16x16x64_default
304,64,512,7168,2,0,10.6241,a8w8_bpreshuffle_cktile_0x0x8x4x1x0x0x0x0x1_16x64x512_1x4x1_16x16x64_default
304,64,3072,1536,9,0,6.1264,a8w8_bpreshuffle_cktile_0x0x8x4x1x0x0x0x0x1_32x64x512_1x4x1_16x16x64_default
304,64,4608,7168,9,0,15.7012,a8w8_bpreshuffle_cktile_0x0x8x4x1x0x0x0x0x1_32x64x512_1x4x1_16x16x64_default
304,64,7168,256,21,0,3.9121,a8w8_bpreshuffle_cktile_0x0x8x4x1x0x0x0x0x1_32x64x256_1x4x1_16x16x64_default
304,64,7168,2048,9,0,8.793,a8w8_bpreshuffle_cktile_0x0x8x4x1x0x0x0x0x1_32x64x512_1x4x1_16x16x64_default
304,64,7168,2304,21,0,10.2061,a8w8_bpreshuffle_cktile_0x0x8x4x1x0x0x0x0x1_32x64x256_1x4x1_16x16x64_default
304,128,512,7168,2,0,9.5906,a8w8_bpreshuffle_cktile_0x0x8x4x1x0x0x0x0x1_16x64x512_1x4x1_16x16x64_default
304,128,3072,1536,37,0,6.4821,a8w8_bpreshuffle_cktile_0x0x8x4x1x0x0x0x0x2_32x64x512_1x4x1_16x16x64_default
304,128,4608,7168,9,0,20.7923,a8w8_bpreshuffle_cktile_0x0x8x4x1x0x0x0x0x1_32x64x512_1x4x1_16x16x64_default
304,128,7168,256,43,0,4.5879,a8w8_bpreshuffle_cktile_0x0x8x4x1x0x0x0x0x2_32x64x128_1x4x1_16x16x64_default
304,128,7168,2048,37,0,10.8584,a8w8_bpreshuffle_cktile_0x0x8x4x1x0x0x0x0x2_32x64x512_1x4x1_16x16x64_default
304,128,7168,2304,51,0,12.4821,a8w8_bpreshuffle_cktile_0x0x8x4x1x0x0x0x0x2_32x128x256_1x4x1_16x16x64_default
304,256,512,7168,37,0,11.0833,a8w8_bpreshuffle_cktile_0x0x8x4x1x0x0x0x0x2_32x64x512_1x4x1_16x16x64_default
304,256,3072,1536,51,0,8.3847,a8w8_bpreshuffle_cktile_0x0x8x4x1x0x0x0x0x2_32x128x256_1x4x1_16x16x64_default
304,256,4608,7168,23,0,30.6937,a8w8_bpreshuffle_cktile_0x0x8x4x1x0x0x0x0x1_32x128x256_1x4x1_16x16x64_default
304,256,7168,256,6,0,5.3839,a8w8_bpreshuffle_cktile_0x0x8x4x1x0x0x0x0x1_16x128x256_1x4x1_16x16x64_default
304,256,7168,2048,24,0,15.6063,a8w8_bpreshuffle_cktile_0x0x8x4x1x0x0x0x0x1_64x128x256_1x4x1_16x16x64_default
304,256,7168,2304,52,0,17.4402,a8w8_bpreshuffle_cktile_0x0x8x4x1x0x0x0x0x2_64x128x256_1x4x1_16x16x64_default
304,512,512,7168,9,0,12.7231,a8w8_bpreshuffle_cktile_0x0x8x4x1x0x0x0x0x1_32x64x512_1x4x1_16x16x64_default
304,512,3072,1536,57,0,11.515,a8w8_bpreshuffle_cktile_0x0x8x4x1x0x0x0x0x1_32x192x256_1x4x1_16x16x64_default
304,512,4608,7168,24,0,45.4527,a8w8_bpreshuffle_cktile_0x0x8x4x1x0x0x0x0x1_64x128x256_1x4x1_16x16x64_default
304,512,7168,256,46,0,7.3701,a8w8_bpreshuffle_cktile_0x0x8x4x1x0x0x0x0x2_64x128x128_1x4x1_16x16x64_default
304,512,7168,2048,29,0,24.4783,a8w8_bpreshuffle_cktile_0x0x8x4x1x0x0x0x0x2_128x128x256_1x4x1_16x16x64_default
304,512,7168,2304,29,0,26.5793,a8w8_bpreshuffle_cktile_0x0x8x4x1x0x0x0x0x2_128x128x256_1x4x1_16x16x64_default
304,1024,512,7168,9,0,17.8898,a8w8_bpreshuffle_cktile_0x0x8x4x1x0x0x0x0x1_32x64x512_1x4x1_16x16x64_default
304,1024,3072,1536,132,0,17.0442,a8w8_bpreshuffle_cktile_0x0x8x4x1x0x0x0x0x2_96x128x256_1x4x1_16x16x64_default
304,1024,4608,7168,1,0,73.565,a8w8_bpreshuffle_cktile_0x0x8x4x1x0x0x0x0x1_128x128x256_1x4x1_16x16x64_default
304,1024,7168,256,19,0,12.1142,a8w8_bpreshuffle_cktile_0x0x8x4x1x0x0x0x0x1_32x256x128_1x4x1_16x16x64_default
304,1024,7168,2048,14,0,41.5315,a8w8_bpreshuffle_cktile_0x0x8x4x1x0x0x0x0x1_128x256x128_1x4x1_16x16x64_default
304,1024,7168,2304,46,0,42.7825,a8w8_bpreshuffle_cktile_0x0x8x4x1x0x0x0x0x2_64x128x128_1x4x1_16x16x64_default
304,2048,512,7168,23,0,27.5652,a8w8_bpreshuffle_cktile_0x0x8x4x1x0x0x0x0x1_32x128x256_1x4x1_16x16x64_default
304,2048,3072,1536,128,0,28.8687,a8w8_bpreshuffle_cktile_0x0x8x4x1x0x0x0x0x2_128x192x256_1x4x1_16x16x64_default
304,2048,4608,7168,14,0,135.6471,a8w8_bpreshuffle_cktile_0x0x8x4x1x0x0x0x0x1_128x256x128_1x4x1_16x16x64_default
304,2048,7168,256,48,0,19.2179,a8w8_bpreshuffle_cktile_0x0x8x4x1x0x0x0x0x2_64x256x128_1x4x1_16x16x64_default
304,2048,7168,2048,28,0,68.5667,a8w8_bpreshuffle_cktile_0x0x8x4x1x0x0x0x0x2_128x128x128_1x4x1_16x16x64_default
304,2048,7168,2304,0,0,72.9137,a8w8_bpreshuffle_cktile_0x0x8x4x1x0x0x0x0x1_128x128x128_1x4x1_16x16x64_default
304,4096,512,7168,24,0,43.0565,a8w8_bpreshuffle_cktile_0x0x8x4x1x0x0x0x0x1_64x128x256_1x4x1_16x16x64_default
304,4096,3072,1536,55,0,48.1121,a8w8_bpreshuffle_cktile_0x0x8x4x1x0x0x0x0x2_128x192x128_1x4x1_16x16x64_default
304,4096,4608,7168,14,0,259.22,a8w8_bpreshuffle_cktile_0x0x8x4x1x0x0x0x0x1_128x256x128_1x4x1_16x16x64_default
304,4096,7168,256,115,0,32.6848,a8w8_bpreshuffle_cktile_0x0x8x4x1x0x0x0x0x2_96x256x128_1x4x1_16x16x64_default
304,4096,7168,2048,115,0,129.0336,a8w8_bpreshuffle_cktile_0x0x8x4x1x0x0x0x0x2_96x256x128_1x4x1_16x16x64_default
304,4096,7168,2304,115,0,141.711,a8w8_bpreshuffle_cktile_0x0x8x4x1x0x0x0x0x2_96x256x128_1x4x1_16x16x64_default
304,8192,512,7168,68,0,70.1676,a8w8_bpreshuffle_cktile_0x0x8x4x1x0x0x0x0x2_64x256x256_1x4x1_16x16x64_default
304,8192,3072,1536,81,0,89.6463,a8w8_bpreshuffle_cktile_0x0x8x4x1x0x0x0x0x1_96x192x128_1x4x1_16x16x64_default
304,8192,4608,7168,89,0,499.3328,a8w8_bpreshuffle_cktile_0x0x8x4x1x0x0x0x0x1_224x192x128_1x4x1_16x16x64_default
304,8192,7168,256,115,0,59.131,a8w8_bpreshuffle_cktile_0x0x8x4x1x0x0x0x0x2_96x256x128_1x4x1_16x16x64_default
304,8192,7168,2048,115,0,247.8193,a8w8_bpreshuffle_cktile_0x0x8x4x1x0x0x0x0x2_96x256x128_1x4x1_16x16x64_default
304,8192,7168,2304,115,0,270.8326,a8w8_bpreshuffle_cktile_0x0x8x4x1x0x0x0x0x2_96x256x128_1x4x1_16x16x64_default
304,16384,512,7168,14,0,128.6122,a8w8_bpreshuffle_cktile_0x0x8x4x1x0x0x0x0x1_128x256x128_1x4x1_16x16x64_default
304,16384,3072,1536,55,0,167.657,a8w8_bpreshuffle_cktile_0x0x8x4x1x0x0x0x0x2_128x192x128_1x4x1_16x16x64_default
304,16384,4608,7168,122,0,986.2648,a8w8_bpreshuffle_cktile_0x0x8x4x1x0x0x0x0x2_224x192x128_1x4x1_16x16x64_default
304,16384,7168,256,115,0,115.5114,a8w8_bpreshuffle_cktile_0x0x8x4x1x0x0x0x0x2_96x256x128_1x4x1_16x16x64_default
304,16384,7168,2048,115,0,472.8119,a8w8_bpreshuffle_cktile_0x0x8x4x1x0x0x0x0x2_96x256x128_1x4x1_16x16x64_default
304,16384,7168,2304,115,0,524.6551,a8w8_bpreshuffle_cktile_0x0x8x4x1x0x0x0x0x2_96x256x128_1x4x1_16x16x64_default
304,32768,512,7168,14,0,257.0784,a8w8_bpreshuffle_cktile_0x0x8x4x1x0x0x0x0x1_128x256x128_1x4x1_16x16x64_default
304,32768,3072,1536,55,0,321.4123,a8w8_bpreshuffle_cktile_0x0x8x4x1x0x0x0x0x2_128x192x128_1x4x1_16x16x64_default
304,32768,4608,7168,55,0,1937.9196,a8w8_bpreshuffle_cktile_0x0x8x4x1x0x0x0x0x2_128x192x128_1x4x1_16x16x64_default
304,32768,7168,256,41,0,220.9724,a8w8_bpreshuffle_cktile_0x0x8x4x1x0x0x0x0x2_128x128x64_1x4x1_16x16x64_default
304,32768,7168,2048,115,0,941.9754,a8w8_bpreshuffle_cktile_0x0x8x4x1x0x0x0x0x2_96x256x128_1x4x1_16x16x64_default
304,32768,7168,2304,115,0,1048.4302,a8w8_bpreshuffle_cktile_0x0x8x4x1x0x0x0x0x2_96x256x128_1x4x1_16x16x64_default
