aiter/configs/a8w8_blockscale_tuned_gemm.csv
gfx,cu_num,M,N,K,libtype,kernelId,splitK,us,kernelName,tflops,bw,errRatio
gfx950,256,7,8192,512,ck,13,0,3.7336,a8w8_blockscale_1x128x128_256x32x64x256_16x16_16x16_2x1_16x16x1_16x16x1_1x32x1x8_8_2x1_intrawave_v1,15.73,1155.07,0.0
gfx950,256,3,8192,512,ck,13,0,3.7574,a8w8_blockscale_1x128x128_256x32x64x256_16x16_16x16_2x1_16x16x1_16x16x1_1x32x1x8_8_2x1_intrawave_v1,6.7,1129.77,0.0
gfx950,256,6,8192,512,ck,13,0,3.7671,a8w8_blockscale_1x128x128_256x32x64x256_16x16_16x16_2x1_16x16x1_16x16x1_1x32x1x8_8_2x1_intrawave_v1,13.36,1140.31,0.0
gfx950,256,10,8192,512,ck,13,0,3.8138,a8w8_blockscale_1x128x128_256x32x64x256_16x16_16x16_2x1_16x16x1_16x16x1_1x32x1x8_8_2x1_intrawave_v1,22.0,1144.07,0.0
gfx950,256,11,8192,512,ck,8,0,3.9126,a8w8_blockscale_1x128x128_256x16x64x256_16x16_16x16_1x1_16x16x1_16x16x1_1x16x1x16_4_1x1_intrawave_v1,23.58,1119.5,0.0
gfx950,256,15,8192,512,ck,8,0,3.9158,a8w8_blockscale_1x128x128_256x16x64x256_16x16_16x16_1x1_16x16x1_16x16x1_1x16x1x16_4_1x1_intrawave_v1,32.13,1135.85,0.0
gfx950,256,23,8192,512,ck,13,0,3.9406,a8w8_blockscale_1x128x128_256x32x64x256_16x16_16x16_2x1_16x16x1_16x16x1_1x32x1x8_8_2x1_intrawave_v1,48.96,1163.0,0.0
gfx950,256,24,8192,512,ck,13,0,3.9606,a8w8_blockscale_1x128x128_256x32x64x256_16x16_16x16_2x1_16x16x1_16x16x1_1x32x1x8_8_2x1_intrawave_v1,50.83,1161.39,0.0
gfx950,256,26,8192,512,ck,13,0,3.9638,a8w8_blockscale_1x128x128_256x32x64x256_16x16_16x16_2x1_16x16x1_16x16x1_1x32x1x8_8_2x1_intrawave_v1,55.02,1168.98,0.0
gfx950,256,27,8192,512,ck,13,0,3.9792,a8w8_blockscale_1x128x128_256x32x64x256_16x16_16x16_2x1_16x16x1_16x16x1_1x32x1x8_8_2x1_intrawave_v1,56.92,1168.7,0.0
gfx950,256,28,8192,512,ck,13,0,3.9822,a8w8_blockscale_1x128x128_256x32x64x256_16x16_16x16_2x1_16x16x1_16x16x1_1x32x1x8_8_2x1_intrawave_v1,58.98,1172.06,0.0
gfx950,256,17,8192,512,ck,8,0,4.0994,a8w8_blockscale_1x128x128_256x16x64x256_16x16_16x16_1x1_16x16x1_16x16x1_1x16x1x16_4_1x1_intrawave_v1,34.79,1093.22,0.0
gfx950,256,30,8192,512,ck,8,0,4.1143,a8w8_blockscale_1x128x128_256x16x64x256_16x16_16x16_1x1_16x16x1_16x16x1_1x16x1x16_4_1x1_intrawave_v1,61.17,1142.64,0.0
gfx950,256,34,8192,512,ck,13,0,4.1582,a8w8_blockscale_1x128x128_256x32x64x256_16x16_16x16_2x1_16x16x1_16x16x1_1x32x1x8_8_2x1_intrawave_v1,68.59,1146.83,0.0
gfx950,256,33,8192,512,ck,13,0,4.1722,a8w8_blockscale_1x128x128_256x32x64x256_16x16_16x16_2x1_16x16x1_16x16x1_1x32x1x8_8_2x1_intrawave_v1,66.35,1138.94,0.0
gfx950,256,38,8192,512,ck,13,0,4.1805,a8w8_blockscale_1x128x128_256x32x64x256_16x16_16x16_2x1_16x16x1_16x16x1_1x32x1x8_8_2x1_intrawave_v1,76.25,1156.88,0.0
gfx950,256,37,8192,512,ck,13,0,4.1874,a8w8_blockscale_1x128x128_256x32x64x256_16x16_16x16_2x1_16x16x1_16x16x1_1x32x1x8_8_2x1_intrawave_v1,74.12,1150.94,0.0
gfx950,256,45,8192,512,ck,13,0,4.2159,a8w8_blockscale_1x128x128_256x32x64x256_16x16_16x16_2x1_16x16x1_16x16x1_1x32x1x8_8_2x1_intrawave_v1,89.54,1175.22,0.0
gfx950,256,35,8192,512,ck,13,0,4.2281,a8w8_blockscale_1x128x128_256x32x64x256_16x16_16x16_2x1_16x16x1_16x16x1_1x32x1x8_8_2x1_intrawave_v1,69.44,1131.87,0.0
gfx950,256,41,8192,512,ck,13,0,4.2358,a8w8_blockscale_1x128x128_256x32x64x256_16x16_16x16_2x1_16x16x1_16x16x1_1x32x1x8_8_2x1_intrawave_v1,81.2,1153.75,0.0
gfx950,256,42,8192,512,ck,13,0,4.237,a8w8_blockscale_1x128x128_256x32x64x256_16x16_16x16_2x1_16x16x1_16x16x1_1x32x1x8_8_2x1_intrawave_v1,83.15,1157.41,0.0
gfx950,256,57,8192,512,ck,13,0,4.2966,a8w8_blockscale_1x128x128_256x32x64x256_16x16_16x16_2x1_16x16x1_16x16x1_1x32x1x8_8_2x1_intrawave_v1,111.29,1200.34,0.0
gfx950,256,63,8192,512,ck,13,0,4.3334,a8w8_blockscale_1x128x128_256x32x64x256_16x16_16x16_2x1_16x16x1_16x16x1_1x32x1x8_8_2x1_intrawave_v1,121.96,1213.54,0.0
gfx950,256,20,8192,512,ck,7,0,4.4006,a8w8_blockscale_1x128x128_256x16x128x256_16x16_16x16_1x2_16x16x1_16x16x1_1x16x1x16_8_1x2_intrawave_v1,38.12,1029.91,0.0
gfx950,256,21,8192,512,ck,7,0,4.4128,a8w8_blockscale_1x128x128_256x16x128x256_16x16_16x16_1x2_16x16x1_16x16x1_1x16x1x16_8_1x2_intrawave_v1,39.92,1030.89,0.0
gfx950,256,39,8192,512,ck,7,0,4.4339,a8w8_blockscale_1x128x128_256x16x128x256_16x16_16x16_1x2_16x16x1_16x16x1_1x16x1x16_8_1x2_intrawave_v1,73.79,1094.58,0.0
gfx950,256,43,8192,512,ck,7,0,4.459,a8w8_blockscale_1x128x128_256x16x128x256_16x16_16x16_1x2_16x16x1_16x16x1_1x16x1x16_8_1x2_intrawave_v1,80.89,1103.57,0.0
gfx950,256,44,8192,512,ck,7,0,4.4775,a8w8_blockscale_1x128x128_256x16x128x256_16x16_16x16_1x2_16x16x1_16x16x1_1x16x1x16_8_1x2_intrawave_v1,82.43,1102.79,0.0
gfx950,256,58,8192,512,ck,7,0,4.4927,a8w8_blockscale_1x128x128_256x16x128x256_16x16_16x16_1x2_16x16x1_16x16x1_1x16x1x16_8_1x2_intrawave_v1,108.3,1151.71,0.0
gfx950,256,50,8192,512,ck,8,0,4.4964,a8w8_blockscale_1x128x128_256x16x64x256_16x16_16x16_1x1_16x16x1_16x16x1_1x16x1x16_4_1x1_intrawave_v1,93.28,1120.7,0.0
gfx950,256,61,8192,512,ck,7,0,4.515,a8w8_blockscale_1x128x128_256x16x128x256_16x16_16x16_1x2_16x16x1_16x16x1_1x16x1x16_8_1x2_intrawave_v1,113.33,1157.24,0.0
gfx950,256,60,8192,512,ck,8,0,4.5647,a8w8_blockscale_1x128x128_256x16x64x256_16x16_16x16_1x1_16x16x1_16x16x1_1x16x1x16_4_1x1_intrawave_v1,110.26,1140.94,0.0
gfx950,256,67,8192,512,ck,13,0,4.9762,a8w8_blockscale_1x128x128_256x32x64x256_16x16_16x16_2x1_16x16x1_16x16x1_1x32x1x8_8_2x1_intrawave_v1,112.94,1070.36,0.0
gfx950,256,68,8192,512,ck,13,0,4.9794,a8w8_blockscale_1x128x128_256x32x64x256_16x16_16x16_2x1_16x16x1_16x16x1_1x32x1x8_8_2x1_intrawave_v1,114.56,1073.07,0.0
gfx950,256,69,8192,512,ck,13,0,4.9987,a8w8_blockscale_1x128x128_256x32x64x256_16x16_16x16_2x1_16x16x1_16x16x1_1x32x1x8_8_2x1_intrawave_v1,115.79,1072.3,0.0
gfx950,256,75,8192,512,ck,13,0,5.0003,a8w8_blockscale_1x128x128_256x32x64x256_16x16_16x16_2x1_16x16x1_16x16x1_1x32x1x8_8_2x1_intrawave_v1,125.82,1092.24,0.0
gfx950,256,71,8192,512,ck,13,0,5.0032,a8w8_blockscale_1x128x128_256x32x64x256_16x16_16x16_2x1_16x16x1_16x16x1_1x32x1x8_8_2x1_intrawave_v1,119.04,1078.09,0.0
gfx950,256,74,8192,512,ck,13,0,5.0043,a8w8_blockscale_1x128x128_256x32x64x256_16x16_16x16_2x1_16x16x1_16x16x1_1x32x1x8_8_2x1_intrawave_v1,124.04,1087.99,0.0
gfx950,256,70,8192,512,ck,13,0,5.0118,a8w8_blockscale_1x128x128_256x32x64x256_16x16_16x16_2x1_16x16x1_16x16x1_1x32x1x8_8_2x1_intrawave_v1,117.16,1072.87,0.0
gfx950,256,79,8192,512,ck,13,0,5.035,a8w8_blockscale_1x128x128_256x32x64x256_16x16_16x16_2x1_16x16x1_16x16x1_1x32x1x8_8_2x1_intrawave_v1,131.62,1098.13,0.0
gfx950,256,76,8192,512,ck,13,0,5.0354,a8w8_blockscale_1x128x128_256x32x64x256_16x16_16x16_2x1_16x16x1_16x16x1_1x32x1x8_8_2x1_intrawave_v1,126.61,1087.98,0.0
gfx950,256,72,8192,512,ck,13,0,5.0394,a8w8_blockscale_1x128x128_256x32x64x256_16x16_16x16_2x1_16x16x1_16x16x1_1x32x1x8_8_2x1_intrawave_v1,119.85,1073.7,0.0
gfx950,256,85,8192,512,ck,13,0,5.0447,a8w8_blockscale_1x128x128_256x32x64x256_16x16_16x16_2x1_16x16x1_16x16x1_1x32x1x8_8_2x1_intrawave_v1,141.34,1116.11,0.0
gfx950,256,82,8192,512,ck,13,0,5.0454,a8w8_blockscale_1x128x128_256x32x64x256_16x16_16x16_2x1_16x16x1_16x16x1_1x32x1x8_8_2x1_intrawave_v1,136.34,1105.91,0.0
gfx950,256,84,8192,512,ck,13,0,5.0606,a8w8_blockscale_1x128x128_256x32x64x256_16x16_16x16_2x1_16x16x1_16x16x1_1x32x1x8_8_2x1_intrawave_v1,139.24,1109.27,0.0
gfx950,256,83,8192,512,ck,12,0,5.0847,a8w8_blockscale_1x128x128_256x32x128x256_16x16_32x32_1x1_16x16x1_16x16x1_1x32x1x8_8_1x1_intrawave_v1,136.93,1100.69,0.0
gfx950,256,73,8192,512,ck,12,0,5.0863,a8w8_blockscale_1x128x128_256x32x128x256_16x16_32x32_1x1_16x16x1_16x16x1_1x32x1x8_8_1x1_intrawave_v1,120.4,1067.12,0.0
gfx950,256,86,8192,512,ck,13,0,5.0876,a8w8_blockscale_1x128x128_256x32x64x256_16x16_16x16_2x1_16x16x1_16x16x1_1x32x1x8_8_2x1_intrawave_v1,141.8,1110.02,0.0
gfx950,256,87,8192,512,ck,13,0,5.0909,a8w8_blockscale_1x128x128_256x32x64x256_16x16_16x16_2x1_16x16x1_16x16x1_1x32x1x8_8_2x1_intrawave_v1,143.36,1112.62,0.0
gfx950,256,81,8192,512,ck,18,0,5.1114,a8w8_blockscale_1x128x128_256x64x64x256_16x16_32x32_1x1_16x16x1_16x16x1_1x32x1x8_8_1x1_intrawave_v1,132.93,1088.33,0.0
gfx950,256,104,8192,512,ck,13,0,5.1203,a8w8_blockscale_1x128x128_256x32x64x256_16x16_16x16_2x1_16x16x1_16x16x1_1x32x1x8_8_2x1_intrawave_v1,170.38,1162.33,0.0
gfx950,256,94,8192,512,ck,13,0,5.1238,a8w8_blockscale_1x128x128_256x32x64x256_16x16_16x16_2x1_16x16x1_16x16x1_1x32x1x8_8_2x1_intrawave_v1,153.9,1128.56,0.0
gfx950,256,108,8192,512,ck,13,0,5.1376,a8w8_blockscale_1x128x128_256x32x64x256_16x16_16x16_2x1_16x16x1_16x16x1_1x32x1x8_8_2x1_intrawave_v1,176.34,1171.57,0.0
gfx950,256,90,8192,512,ck,12,0,5.1401,a8w8_blockscale_1x128x128_256x32x128x256_16x16_32x32_1x1_16x16x1_16x16x1_1x32x1x8_8_1x1_intrawave_v1,146.88,1111.84,0.0
gfx950,256,106,8192,512,ck,13,0,5.1406,a8w8_blockscale_1x128x128_256x32x64x256_16x16_16x16_2x1_16x16x1_16x16x1_1x32x1x8_8_2x1_intrawave_v1,172.97,1164.32,0.0
gfx950,256,109,8192,512,ck,13,0,5.1535,a8w8_blockscale_1x128x128_256x32x64x256_16x16_16x16_2x1_16x16x1_16x16x1_1x32x1x8_8_2x1_intrawave_v1,177.42,1171.24,0.0
gfx950,256,103,8192,512,ck,13,0,5.1578,a8w8_blockscale_1x128x128_256x32x64x256_16x16_16x16_2x1_16x16x1_16x16x1_1x32x1x8_8_2x1_intrawave_v1,167.52,1150.61,0.0
gfx950,256,102,8192,512,ck,18,0,5.1751,a8w8_blockscale_1x128x128_256x64x64x256_16x16_32x32_1x1_16x16x1_16x16x1_1x32x1x8_8_1x1_intrawave_v1,165.34,1143.49,0.0
gfx950,256,113,8192,512,ck,13,0,5.1799,a8w8_blockscale_1x128x128_256x32x64x256_16x16_16x16_2x1_16x16x1_16x16x1_1x32x1x8_8_2x1_intrawave_v1,183.0,1178.31,0.0
gfx950,256,107,8192,512,ck,13,0,5.1871,a8w8_blockscale_1x128x128_256x32x64x256_16x16_16x16_2x1_16x16x1_16x16x1_1x32x1x8_8_2x1_intrawave_v1,173.04,1157.14,0.0
gfx950,256,117,8192,512,ck,13,0,5.1929,a8w8_blockscale_1x128x128_256x32x64x256_16x16_16x16_2x1_16x16x1_16x16x1_1x32x1x8_8_2x1_intrawave_v1,189.0,1188.38,0.0
gfx950,256,124,8192,512,ck,13,0,5.2387,a8w8_blockscale_1x128x128_256x32x64x256_16x16_16x16_2x1_16x16x1_16x16x1_1x32x1x8_8_2x1_intrawave_v1,198.56,1200.57,0.0
gfx950,256,120,8192,512,ck,13,0,5.239,a8w8_blockscale_1x128x128_256x32x64x256_16x16_16x16_2x1_16x16x1_16x16x1_1x32x1x8_8_2x1_intrawave_v1,192.14,1187.6,0.0
gfx950,256,118,8192,512,ck,12,0,5.2478,a8w8_blockscale_1x128x128_256x32x128x256_16x16_32x32_1x1_16x16x1_16x16x1_1x32x1x8_8_1x1_intrawave_v1,188.62,1179.17,0.0
gfx950,256,121,8192,512,ck,13,0,5.2517,a8w8_blockscale_1x128x128_256x32x64x256_16x16_16x16_2x1_16x16x1_16x16x1_1x32x1x8_8_2x1_intrawave_v1,193.27,1187.94,0.0
gfx950,256,125,8192,512,ck,13,0,5.2621,a8w8_blockscale_1x128x128_256x32x64x256_16x16_16x16_2x1_16x16x1_16x16x1_1x32x1x8_8_2x1_intrawave_v1,199.27,1198.44,0.0
gfx950,256,127,8192,512,ck,13,0,5.2923,a8w8_blockscale_1x128x128_256x32x64x256_16x16_16x16_2x1_16x16x1_16x16x1_1x32x1x8_8_2x1_intrawave_v1,201.3,1197.98,0.0
gfx950,256,123,8192,512,ck,12,0,5.2936,a8w8_blockscale_1x128x128_256x32x128x256_16x16_32x32_1x1_16x16x1_16x16x1_1x32x1x8_8_1x1_intrawave_v1,194.91,1184.92,0.0
gfx950,256,133,8192,512,ck,13,0,6.1567,a8w8_blockscale_1x128x128_256x32x64x256_16x16_16x16_2x1_16x16x1_16x16x1_1x32x1x8_8_2x1_intrawave_v1,181.21,1046.25,0.0
gfx950,256,151,8192,512,ck,13,0,6.1791,a8w8_blockscale_1x128x128_256x32x64x256_16x16_16x16_2x1_16x16x1_16x16x1_1x32x1x8_8_2x1_intrawave_v1,204.99,1091.68,0.0
gfx950,256,131,8192,512,ck,13,0,6.1819,a8w8_blockscale_1x128x128_256x32x64x256_16x16_16x16_2x1_16x16x1_16x16x1_1x32x1x8_8_2x1_intrawave_v1,177.76,1036.52,0.0
gfx950,256,153,8192,512,ck,13,0,6.1991,a8w8_blockscale_1x128x128_256x32x64x256_16x16_16x16_2x1_16x16x1_16x16x1_1x32x1x8_8_2x1_intrawave_v1,207.04,1093.61,0.0
gfx950,256,132,8192,512,ck,13,0,6.2003,a8w8_blockscale_1x128x128_256x32x64x256_16x16_16x16_2x1_16x16x1_16x16x1_1x32x1x8_8_2x1_intrawave_v1,178.59,1036.17,0.0
gfx950,256,40,128,7168,ck,6,3,6.2114,a8w8_blockscale_1x128x128_256x16x64x128_8x16_16x16_1x1_16x16x1_8x32x1_1x16x1x16_4_1x1_intrawave_v1,11.82,195.52,0.0004
gfx950,256,129,8192,512,ck,13,0,6.2185,a8w8_blockscale_1x128x128_256x32x64x256_16x16_16x16_2x1_16x16x1_16x16x1_1x32x1x8_8_2x1_intrawave_v1,174.02,1024.99,0.0
gfx950,256,158,8192,512,ck,13,0,6.2551,a8w8_blockscale_1x128x128_256x32x64x256_16x16_16x16_2x1_16x16x1_16x16x1_1x32x1x8_8_2x1_intrawave_v1,211.89,1097.32,0.0
gfx950,256,137,8192,512,ck,13,0,6.2551,a8w8_blockscale_1x128x128_256x32x64x256_16x16_16x16_2x1_16x16x1_16x16x1_1x32x1x8_8_2x1_intrawave_v1,183.73,1040.6,0.0
gfx950,256,159,8192,512,ck,13,0,6.2711,a8w8_blockscale_1x128x128_256x32x64x256_16x16_16x16_2x1_16x16x1_16x16x1_1x32x1x8_8_2x1_intrawave_v1,212.69,1097.22,0.0
gfx950,256,162,8192,512,ck,13,0,6.273,a8w8_blockscale_1x128x128_256x32x64x256_16x16_16x16_2x1_16x16x1_16x16x1_1x32x1x8_8_2x1_intrawave_v1,216.64,1104.97,0.0
gfx950,256,166,8192,512,ck,13,0,6.279,a8w8_blockscale_1x128x128_256x32x64x256_16x16_16x16_2x1_16x16x1_16x16x1_1x32x1x8_8_2x1_intrawave_v1,221.77,1114.67,0.0
gfx950,256,136,8192,512,ck,18,0,6.2807,a8w8_blockscale_1x128x128_256x64x64x256_16x16_32x32_1x1_16x16x1_16x16x1_1x32x1x8_8_1x1_intrawave_v1,181.64,1033.67,0.0
gfx950,256,163,8192,512,ck,13,0,6.2831,a8w8_blockscale_1x128x128_256x32x64x256_16x16_16x16_2x1_16x16x1_16x16x1_1x32x1x8_8_2x1_intrawave_v1,217.62,1105.88,0.0
gfx950,256,168,8192,512,ck,13,0,6.2881,a8w8_blockscale_1x128x128_256x32x64x256_16x16_16x16_2x1_16x16x1_16x16x1_1x32x1x8_8_2x1_intrawave_v1,224.12,1118.44,0.0
gfx950,256,176,8192,512,ck,13,0,6.3111,a8w8_blockscale_1x128x128_256x32x64x256_16x16_16x16_2x1_16x16x1_16x16x1_1x32x1x8_8_2x1_intrawave_v1,233.94,1135.78,0.0
gfx950,256,165,8192,512,ck,13,0,6.3139,a8w8_blockscale_1x128x128_256x32x64x256_16x16_16x16_2x1_16x16x1_16x16x1_1x32x1x8_8_2x1_intrawave_v1,219.22,1105.84,0.0
gfx950,256,149,8192,512,ck,18,0,6.3139,a8w8_blockscale_1x128x128_256x64x64x256_16x16_32x32_1x1_16x16x1_16x16x1_1x32x1x8_8_1x1_intrawave_v1,197.96,1063.02,0.0
gfx950,256,169,8192,512,ck,13,0,6.3146,a8w8_blockscale_1x128x128_256x32x64x256_16x16_16x16_2x1_16x16x1_16x16x1_1x32x1x8_8_2x1_intrawave_v1,224.51,1116.42,0.0
gfx950,256,184,8192,512,ck,13,0,6.3255,a8w8_blockscale_1x128x128_256x32x64x256_16x16_16x16_2x1_16x16x1_16x16x1_1x32x1x8_8_2x1_intrawave_v1,244.01,1154.56,0.0
gfx950,256,174,8192,512,ck,13,0,6.3308,a8w8_blockscale_1x128x128_256x32x64x256_16x16_16x16_2x1_16x16x1_16x16x1_1x32x1x8_8_2x1_intrawave_v1,230.56,1126.9,0.0
gfx950,256,172,8192,512,ck,13,0,6.3368,a8w8_blockscale_1x128x128_256x32x64x256_16x16_16x16_2x1_16x16x1_16x16x1_1x32x1x8_8_2x1_intrawave_v1,227.69,1120.5,0.0
gfx950,256,142,8192,512,ck,18,0,6.3427,a8w8_blockscale_1x128x128_256x64x64x256_16x16_32x32_1x1_16x16x1_16x16x1_1x32x1x8_8_1x1_intrawave_v1,187.8,1039.55,0.0
gfx950,256,182,8192,512,ck,13,0,6.357,a8w8_blockscale_1x128x128_256x32x64x256_16x16_16x16_2x1_16x16x1_16x16x1_1x32x1x8_8_2x1_intrawave_v1,240.16,1143.52,0.0
gfx950,256,1,6144,1536,ck,8,0,6.3579,a8w8_blockscale_1x128x128_256x16x64x256_16x16_16x16_1x1_16x16x1_16x16x1_1x16x1x16_4_1x1_intrawave_v1,2.97,1486.5,0.0
gfx950,256,178,8192,512,ck,13,0,6.3615,a8w8_blockscale_1x128x128_256x32x64x256_16x16_16x16_2x1_16x16x1_16x16x1_1x32x1x8_8_2x1_intrawave_v1,234.72,1132.09,0.0
gfx950,256,181,8192,512,ck,13,0,6.3707,a8w8_blockscale_1x128x128_256x32x64x256_16x16_16x16_2x1_16x16x1_16x16x1_1x32x1x8_8_2x1_intrawave_v1,238.33,1138.41,0.0
gfx950,256,175,8192,512,ck,13,0,6.3794,a8w8_blockscale_1x128x128_256x32x64x256_16x16_16x16_2x1_16x16x1_16x16x1_1x32x1x8_8_2x1_intrawave_v1,230.12,1120.97,0.0
gfx950,256,185,8192,512,ck,13,0,6.387,a8w8_blockscale_1x128x128_256x32x64x256_16x16_16x16_2x1_16x16x1_16x16x1_1x32x1x8_8_2x1_intrawave_v1,242.98,1146.09,0.0
gfx950,256,4,6144,1536,ck,8,0,6.3927,a8w8_blockscale_1x128x128_256x16x64x256_16x16_16x16_1x1_16x16x1_16x16x1_1x16x1x16_4_1x1_intrawave_v1,11.81,1484.89,0.0
gfx950,256,2,6144,1536,ck,8,0,6.4194,a8w8_blockscale_1x128x128_256x16x64x256_16x16_16x16_1x1_16x16x1_16x16x1_1x16x1x16_4_1x1_intrawave_v1,5.88,1474.41,0.0
gfx950,256,161,8192,512,ck,18,0,6.4235,a8w8_blockscale_1x128x128_256x64x64x256_16x16_32x32_1x1_16x16x1_16x16x1_1x32x1x8_8_1x1_intrawave_v1,210.25,1076.45,0.0
gfx950,256,16,6144,1536,ck,8,0,6.4237,a8w8_blockscale_1x128x128_256x16x64x256_16x16_16x16_1x1_16x16x1_16x16x1_1x16x1x16_4_1x1_intrawave_v1,47.01,1503.55,0.0
gfx950,256,190,8192,512,ck,13,0,6.4479,a8w8_blockscale_1x128x128_256x32x64x256_16x16_16x16_2x1_16x16x1_16x16x1_1x32x1x8_8_2x1_intrawave_v1,247.19,1148.37,0.0
gfx950,256,191,8192,512,ck,13,0,6.471,a8w8_blockscale_1x128x128_256x32x64x256_16x16_16x16_2x1_16x16x1_16x16x1_1x32x1x8_8_2x1_intrawave_v1,247.6,1146.88,0.0
gfx950,256,196,8192,512,ck,18,0,6.4828,a8w8_blockscale_1x128x128_256x64x64x256_16x16_32x32_1x1_16x16x1_16x16x1_1x32x1x8_8_1x1_intrawave_v1,253.62,1157.82,0.0
gfx950,256,24,8192,1536,ck,8,0,6.4842,a8w8_blockscale_1x128x128_256x16x64x256_16x16_16x16_1x1_16x16x1_16x16x1_1x16x1x16_4_1x1_intrawave_v1,93.15,2006.88,0.0
gfx950,256,200,8192,512,ck,18,0,6.4987,a8w8_blockscale_1x128x128_256x64x64x256_16x16_32x32_1x1_16x16x1_16x16x1_1x32x1x8_8_1x1_intrawave_v1,258.16,1165.39,0.0
gfx950,256,208,8192,512,ck,18,0,6.5097,a8w8_blockscale_1x128x128_256x64x64x256_16x16_32x32_1x1_16x16x1_16x16x1_1x32x1x8_8_1x1_intrawave_v1,268.04,1184.18,0.0
gfx950,256,202,8192,512,ck,18,0,6.5111,a8w8_blockscale_1x128x128_256x64x64x256_16x16_32x32_1x1_16x16x1_16x16x1_1x32x1x8_8_1x1_intrawave_v1,260.25,1168.36,0.0
gfx950,256,205,8192,512,ck,18,0,6.5115,a8w8_blockscale_1x128x128_256x64x64x256_16x16_32x32_1x1_16x16x1_16x16x1_1x32x1x8_8_1x1_intrawave_v1,264.1,1176.07,0.0
gfx950,256,215,8192,512,ck,18,0,6.5211,a8w8_blockscale_1x128x128_256x64x64x256_16x16_32x32_1x1_16x16x1_16x16x1_1x32x1x8_8_1x1_intrawave_v1,276.57,1200.25,0.0
gfx950,256,217,8192,512,ck,18,0,6.5352,a8w8_blockscale_1x128x128_256x64x64x256_16x16_32x32_1x1_16x16x1_16x16x1_1x32x1x8_8_1x1_intrawave_v1,278.54,1202.83,0.0
gfx950,256,183,8192,512,ck,18,0,6.5423,a8w8_blockscale_1x128x128_256x64x64x256_16x16_32x32_1x1_16x16x1_16x16x1_1x32x1x8_8_1x1_intrawave_v1,234.64,1113.72,0.0
gfx950,256,211,8192,512,ck,18,0,6.5425,a8w8_blockscale_1x128x128_256x64x64x256_16x16_32x32_1x1_16x16x1_16x16x1_1x32x1x8_8_1x1_intrawave_v1,270.54,1185.99,0.0
gfx950,256,219,8192,512,ck,18,0,6.5655,a8w8_blockscale_1x128x128_256x64x64x256_16x16_32x32_1x1_16x16x1_16x16x1_1x32x1x8_8_1x1_intrawave_v1,279.81,1202.43,0.0
gfx950,256,210,8192,512,ck,18,0,6.5732,a8w8_blockscale_1x128x128_256x64x64x256_16x16_32x32_1x1_16x16x1_16x16x1_1x32x1x8_8_1x1_intrawave_v1,268.0,1177.88,0.0
gfx950,256,214,8192,512,ck,18,0,6.5793,a8w8_blockscale_1x128x128_256x64x64x256_16x16_32x32_1x1_16x16x1_16x16x1_1x32x1x8_8_1x1_intrawave_v1,272.85,1187.06,0.0
gfx950,256,32,6144,1536,ck,8,0,6.5918,a8w8_blockscale_1x128x128_256x16x64x256_16x16_16x16_1x1_16x16x1_16x16x1_1x16x1x16_4_1x1_intrawave_v1,91.63,1498.76,0.0
gfx950,256,225,8192,512,ck,18,0,6.6027,a8w8_blockscale_1x128x128_256x64x64x256_16x16_32x32_1x1_16x16x1_16x16x1_1x32x1x8_8_1x1_intrawave_v1,285.86,1211.01,0.0
gfx950,256,212,8192,512,ck,18,0,6.6031,a8w8_blockscale_1x128x128_256x64x64x256_16x16_32x32_1x1_16x16x1_16x16x1_1x32x1x8_8_1x1_intrawave_v1,269.33,1177.67,0.0
gfx950,256,232,8192,512,ck,18,0,6.6191,a8w8_blockscale_1x128x128_256x64x64x256_16x16_32x32_1x1_16x16x1_16x16x1_1x32x1x8_8_1x1_intrawave_v1,294.02,1225.87,0.0
gfx950,256,230,8192,512,ck,18,0,6.6331,a8w8_blockscale_1x128x128_256x64x64x256_16x16_32x32_1x1_16x16x1_16x16x1_1x32x1x8_8_1x1_intrawave_v1,290.87,1218.19,0.0
gfx950,256,222,8192,512,ck,18,0,6.637,a8w8_blockscale_1x128x128_256x64x64x256_16x16_32x32_1x1_16x16x1_16x16x1_1x32x1x8_8_1x1_intrawave_v1,280.59,1197.11,0.0
gfx950,256,24,6144,1536,ck,8,0,6.6383,a8w8_blockscale_1x128x128_256x16x64x256_16x16_16x16_1x1_16x16x1_16x16x1_1x16x1x16_4_1x1_intrawave_v1,68.24,1471.61,0.0
gfx950,256,198,8192,512,ck,17,0,6.6579,a8w8_blockscale_1x128x128_256x64x128x256_16x16_32x32_2x1_16x16x1_16x16x1_1x32x1x8_8_1x1_intrawave_v1,249.47,1132.45,0.0
gfx950,256,235,8192,512,ck,18,0,6.6738,a8w8_blockscale_1x128x128_256x64x64x256_16x16_32x32_1x1_16x16x1_16x16x1_1x32x1x8_8_1x1_intrawave_v1,295.38,1223.42,0.0
gfx950,256,207,8192,512,ck,17,0,6.699,a8w8_blockscale_1x128x128_256x64x128x256_16x16_32x32_2x1_16x16x1_16x16x1_1x32x1x8_8_1x1_intrawave_v1,259.21,1148.2,0.0
gfx950,256,206,8192,512,ck,17,0,6.7158,a8w8_blockscale_1x128x128_256x64x128x256_16x16_32x32_2x1_16x16x1_16x16x1_1x32x1x8_8_1x1_intrawave_v1,257.31,1142.81,0.0
gfx950,256,243,8192,512,ck,17,0,6.7332,a8w8_blockscale_1x128x128_256x64x128x256_16x16_32x32_2x1_16x16x1_16x16x1_1x32x1x8_8_1x1_intrawave_v1,302.74,1232.7,0.0
gfx950,256,255,8192,512,ck,18,0,6.7351,a8w8_blockscale_1x128x128_256x64x64x256_16x16_32x32_1x1_16x16x1_16x16x1_1x32x1x8_8_1x1_intrawave_v1,317.6,1262.46,0.0
gfx950,256,24,128,7168,ck,8,2,6.7385,a8w8_blockscale_1x128x128_256x16x64x256_16x16_16x16_1x1_16x16x1_16x16x1_1x16x1x16_4_1x1_intrawave_v1,6.54,162.6,0.0
gfx950,256,247,8192,512,ck,17,0,6.7574,a8w8_blockscale_1x128x128_256x64x128x256_16x16_32x32_2x1_16x16x1_16x16x1_1x32x1x8_8_1x1_intrawave_v1,306.62,1238.29,0.0
gfx950,256,48,128,7168,ck,3,3,6.8196,a8w8_blockscale_1x128x128_256x64x64x128_16x16_32x32_1x1_8x32x1_8x32x1_1x32x1x8_8_1x1_intrawave_v3,12.92,186.79,0.001
gfx950,256,128,4096,1280,ck,8,0,6.897,a8w8_blockscale_1x128x128_256x16x64x256_16x16_16x16_1x1_16x16x1_16x16x1_1x16x1x16_4_1x1_intrawave_v1,194.6,935.96,0.0
gfx950,256,8,6144,1536,ck,8,0,7.0062,a8w8_blockscale_1x128x128_256x16x64x256_16x16_16x16_1x1_16x16x1_16x16x1_1x16x1x16_4_1x1_intrawave_v1,21.55,1362.76,0.0
gfx950,256,226,8192,512,ck,16,0,7.0869,a8w8_blockscale_1x128x128_256x64x64x128_16x16_32x32_1x1_8x32x1_8x32x1_1x32x1x8_8_1x1_intrawave_v1,267.51,1130.65,0.0
gfx950,256,233,8192,512,ck,2,0,7.2197,a8w8_blockscale_1x128x128_256x64x128x128_16x16_32x32_1x2_8x32x1_8x32x1_1x32x1x8_8_1x1_intrawave_v3,270.72,1126.23,0.0
gfx950,256,40,6144,1536,ck,18,0,7.2556,a8w8_blockscale_1x128x128_256x64x64x256_16x16_32x32_1x1_16x16x1_16x16x1_1x32x1x8_8_1x1_intrawave_v1,104.05,1376.89,0.0
gfx950,256,48,6144,1536,ck,18,0,7.2677,a8w8_blockscale_1x128x128_256x64x64x256_16x16_32x32_1x1_16x16x1_16x16x1_1x32x1x8_8_1x1_intrawave_v1,124.66,1389.81,0.0
gfx950,256,250,8192,512,ck,3,0,7.2763,a8w8_blockscale_1x128x128_256x64x64x128_16x16_32x32_1x1_8x32x1_8x32x1_1x32x1x8_8_1x1_intrawave_v3,288.22,1156.95,0.0
gfx950,256,40,8192,1536,ck,18,0,7.3147,a8w8_blockscale_1x128x128_256x64x64x256_16x16_32x32_1x1_16x16x1_16x16x1_1x32x1x8_8_1x1_intrawave_v1,137.62,1818.22,0.0
gfx950,256,56,6144,1536,ck,18,0,7.3214,a8w8_blockscale_1x128x128_256x64x64x256_16x16_32x32_1x1_16x16x1_16x16x1_1x32x1x8_8_1x1_intrawave_v1,144.37,1394.72,0.0
gfx950,256,48,8192,1536,ck,7,0,7.3799,a8w8_blockscale_1x128x128_256x16x128x256_16x16_16x16_1x2_16x16x1_16x16x1_1x16x1x16_8_1x2_intrawave_v1,163.68,1821.58,0.0
gfx950,256,232,128,7168,ck,8,2,7.3851,a8w8_blockscale_1x128x128_256x16x64x256_16x16_16x16_1x1_16x16x1_16x16x1_1x16x1x16_4_1x1_intrawave_v1,57.65,357.46,0.0
gfx950,256,56,8192,1536,ck,18,0,7.4346,a8w8_blockscale_1x128x128_256x64x64x256_16x16_32x32_1x1_16x16x1_16x16x1_1x32x1x8_8_1x1_intrawave_v1,189.56,1827.46,0.0
gfx950,256,88,6144,1536,ck,18,0,7.48,a8w8_blockscale_1x128x128_256x64x64x256_16x16_32x32_1x1_16x16x1_16x16x1_1x32x1x8_8_1x1_intrawave_v1,222.05,1424.29,0.0
gfx950,256,64,6144,1536,ck,8,0,7.5132,a8w8_blockscale_1x128x128_256x16x64x256_16x16_16x16_1x1_16x16x1_16x16x1_1x16x1x16_4_1x1_intrawave_v1,160.78,1373.84,0.0
gfx950,256,104,6144,1536,ck,18,0,7.5222,a8w8_blockscale_1x128x128_256x64x64x256_16x16_32x32_1x1_16x16x1_16x16x1_1x32x1x8_8_1x1_intrawave_v1,260.95,1445.7,0.0
gfx950,256,112,6144,1536,ck,18,0,7.5393,a8w8_blockscale_1x128x128_256x64x64x256_16x16_32x32_1x1_16x16x1_16x16x1_1x32x1x8_8_1x1_intrawave_v1,280.39,1457.09,0.0
gfx950,256,80,6144,1536,ck,18,0,7.5795,a8w8_blockscale_1x128x128_256x64x64x256_16x16_32x32_1x1_16x16x1_16x16x1_1x32x1x8_8_1x1_intrawave_v1,199.21,1391.0,0.0
gfx950,256,72,6144,1536,ck,7,0,7.5797,a8w8_blockscale_1x128x128_256x16x128x256_16x16_16x16_1x2_16x16x1_16x16x1_1x16x1x16_8_1x2_intrawave_v1,179.29,1376.38,0.0
gfx950,256,96,6144,1536,ck,18,0,7.5802,a8w8_blockscale_1x128x128_256x64x64x256_16x16_32x32_1x1_16x16x1_16x16x1_1x32x1x8_8_1x1_intrawave_v1,239.04,1420.05,0.0
gfx950,256,128,6144,1536,ck,18,0,7.5858,a8w8_blockscale_1x128x128_256x64x64x256_16x16_32x32_1x1_16x16x1_16x16x1_1x32x1x8_8_1x1_intrawave_v1,318.48,1477.32,0.0
gfx950,256,120,6144,1536,ck,18,0,7.6051,a8w8_blockscale_1x128x128_256x64x64x256_16x16_32x32_1x1_16x16x1_16x16x1_1x32x1x8_8_1x1_intrawave_v1,297.82,1459.03,0.0
gfx950,256,260,8192,512,ck,3,0,7.6072,a8w8_blockscale_1x128x128_256x64x64x128_16x16_32x32_1x1_8x32x1_8x32x1_1x32x1x8_8_1x1_intrawave_v3,286.71,1128.83,0.0
gfx950,256,286,8192,512,ck,13,0,7.608,a8w8_blockscale_1x128x128_256x32x64x256_16x16_16x16_2x1_16x16x1_16x16x1_1x32x1x8_8_2x1_intrawave_v1,315.34,1186.46,0.0
gfx950,256,88,8192,1536,ck,18,0,7.6226,a8w8_blockscale_1x128x128_256x64x64x256_16x16_32x32_1x1_16x16x1_16x16x1_1x32x1x8_8_1x1_intrawave_v1,290.53,1857.62,0.0
gfx950,256,72,128,7168,ck,8,2,7.6325,a8w8_blockscale_1x128x128_256x16x64x256_16x16_16x16_1x1_16x16x1_16x16x1_1x16x1x16_4_1x1_intrawave_v1,17.31,190.24,0.0001
gfx950,256,258,8192,512,ck,18,0,7.6359,a8w8_blockscale_1x128x128_256x64x64x256_16x16_32x32_1x1_16x16x1_16x16x1_1x32x1x8_8_1x1_intrawave_v1,283.43,1120.17,0.0
gfx950,256,281,8192,512,ck,13,0,7.6391,a8w8_blockscale_1x128x128_256x32x64x256_16x16_16x16_2x1_16x16x1_16x16x1_1x32x1x8_8_2x1_intrawave_v1,308.57,1170.57,0.0
gfx950,256,80,8192,1536,ck,18,0,7.6417,a8w8_blockscale_1x128x128_256x64x64x256_16x16_32x32_1x1_16x16x1_16x16x1_1x32x1x8_8_1x1_intrawave_v1,263.46,1834.21,0.0
gfx950,256,268,8192,512,ck,18,0,7.6424,a8w8_blockscale_1x128x128_256x64x64x256_16x16_32x32_1x1_16x16x1_16x16x1_1x32x1x8_8_1x1_intrawave_v1,294.17,1141.32,0.0
gfx950,256,310,8192,512,ck,16,0,7.6447,a8w8_blockscale_1x128x128_256x64x64x128_16x16_32x32_1x1_8x32x1_8x32x1_1x32x1x8_8_1x1_intrawave_v1,340.17,1233.8,0.0
gfx950,256,264,8192,512,ck,3,0,7.6633,a8w8_blockscale_1x128x128_256x64x64x128_16x16_32x32_1x1_8x32x1_8x32x1_1x32x1x8_8_1x1_intrawave_v3,288.99,1129.39,0.0
gfx950,256,72,8192,1536,ck,18,0,7.6639,a8w8_blockscale_1x128x128_256x64x64x256_16x16_32x32_1x1_16x16x1_16x16x1_1x32x1x8_8_1x1_intrawave_v1,236.43,1810.19,0.0
gfx950,256,280,8192,512,ck,18,0,7.6651,a8w8_blockscale_1x128x128_256x64x64x256_16x16_32x32_1x1_16x16x1_16x16x1_1x32x1x8_8_1x1_intrawave_v1,306.43,1164.39,0.0
gfx950,256,56,128,7168,ck,16,3,7.6673,a8w8_blockscale_1x128x128_256x64x64x128_16x16_32x32_1x1_8x32x1_8x32x1_1x32x1x8_8_1x1_intrawave_v1,13.4,173.89,0.0
gfx950,256,168,128,7168,ck,6,3,7.6813,a8w8_blockscale_1x128x128_256x16x64x128_8x16_16x16_1x1_16x16x1_8x32x1_1x16x1x16_4_1x1_intrawave_v1,40.13,281.82,0.0013
gfx950,256,270,8192,512,ck,18,0,7.6819,a8w8_blockscale_1x128x128_256x64x64x256_16x16_32x32_1x1_16x16x1_16x16x1_1x32x1x8_8_1x1_intrawave_v1,294.84,1139.85,0.0
gfx950,256,112,8192,1536,ck,18,0,7.6911,a8w8_blockscale_1x128x128_256x64x64x256_16x16_32x32_1x1_16x16x1_16x16x1_1x32x1x8_8_1x1_intrawave_v1,366.47,1896.99,0.0
gfx950,256,262,8192,512,ck,13,0,7.6923,a8w8_blockscale_1x128x128_256x32x64x256_16x16_16x16_2x1_16x16x1_16x16x1_1x32x1x8_8_2x1_intrawave_v1,285.72,1120.74,0.0
gfx950,256,265,8192,512,ck,13,0,7.7048,a8w8_blockscale_1x128x128_256x32x64x256_16x16_16x16_2x1_16x16x1_16x16x1_1x32x1x8_8_2x1_intrawave_v1,288.52,1125.5,0.0
gfx950,256,285,8192,512,ck,13,0,7.7186,a8w8_blockscale_1x128x128_256x32x64x256_16x16_16x16_2x1_16x16x1_16x16x1_1x32x1x8_8_2x1_intrawave_v1,309.74,1167.27,0.0
gfx950,256,275,8192,512,ck,18,0,7.7304,a8w8_blockscale_1x128x128_256x64x64x256_16x16_32x32_1x1_16x16x1_16x16x1_1x32x1x8_8_1x1_intrawave_v1,298.41,1143.63,0.0
gfx950,256,80,128,7168,ck,6,3,7.7437,a8w8_blockscale_1x128x128_256x16x64x128_8x16_16x16_1x1_16x16x1_8x32x1_1x16x1x16_4_1x1_intrawave_v1,18.96,195.18,0.0013
gfx950,256,144,6144,1536,ck,12,0,7.7459,a8w8_blockscale_1x128x128_256x32x128x256_16x16_32x32_1x1_16x16x1_16x16x1_1x32x1x8_8_1x1_intrawave_v1,350.88,1475.34,0.0
gfx950,256,300,8192,512,ck,13,0,7.7483,a8w8_blockscale_1x128x128_256x32x64x256_16x16_16x16_2x1_16x16x1_16x16x1_1x32x1x8_8_2x1_intrawave_v1,324.79,1195.5,0.0
gfx950,256,263,8192,512,ck,12,0,7.7517,a8w8_blockscale_1x128x128_256x32x128x256_16x16_32x32_1x1_16x16x1_16x16x1_1x32x1x8_8_1x1_intrawave_v1,284.61,1114.33,0.0
gfx950,256,257,8192,512,ck,16,0,7.7533,a8w8_blockscale_1x128x128_256x64x64x128_16x16_32x32_1x1_8x32x1_8x32x1_1x32x1x8_8_1x1_intrawave_v1,278.06,1101.02,0.0
gfx950,256,299,8192,512,ck,13,0,7.7546,a8w8_blockscale_1x128x128_256x32x64x256_16x16_16x16_2x1_16x16x1_16x16x1_1x32x1x8_8_2x1_intrawave_v1,323.45,1192.35,0.0
gfx950,256,309,8192,512,ck,16,0,7.7704,a8w8_blockscale_1x128x128_256x64x64x128_16x16_32x32_1x1_8x32x1_8x32x1_1x32x1x8_8_1x1_intrawave_v1,333.58,1211.67,0.0
gfx950,256,120,8192,1536,ck,18,0,7.7752,a8w8_blockscale_1x128x128_256x64x64x256_16x16_32x32_1x1_16x16x1_16x16x1_1x32x1x8_8_1x1_intrawave_v1,388.4,1894.91,0.0
gfx950,256,276,8192,512,ck,16,0,7.7799,a8w8_blockscale_1x128x128_256x64x64x128_16x16_32x32_1x1_8x32x1_8x32x1_1x32x1x8_8_1x1_intrawave_v1,297.59,1138.52,0.0
gfx950,256,316,8192,512,ck,16,0,7.7847,a8w8_blockscale_1x128x128_256x64x64x128_16x16_32x32_1x1_8x32x1_8x32x1_1x32x1x8_8_1x1_intrawave_v1,340.51,1224.64,0.0
gfx950,256,289,8192,512,ck,16,0,7.7936,a8w8_blockscale_1x128x128_256x64x64x128_16x16_32x32_1x1_8x32x1_8x32x1_1x32x1x8_8_1x1_intrawave_v1,311.06,1164.71,0.0
gfx950,256,303,8192,512,ck,13,0,7.8135,a8w8_blockscale_1x128x128_256x32x64x256_16x16_16x16_2x1_16x16x1_16x16x1_1x32x1x8_8_2x1_intrawave_v1,325.3,1192.01,0.0
gfx950,256,272,8192,512,ck,18,0,7.8151,a8w8_blockscale_1x128x128_256x64x64x256_16x16_32x32_1x1_16x16x1_16x16x1_1x32x1x8_8_1x1_intrawave_v1,291.96,1124.75,0.0
gfx950,256,261,8192,512,ck,13,0,7.8185,a8w8_blockscale_1x128x128_256x32x64x256_16x16_16x16_2x1_16x16x1_16x16x1_1x32x1x8_8_2x1_intrawave_v1,280.03,1100.49,0.0
gfx950,256,298,8192,512,ck,16,0,7.8466,a8w8_blockscale_1x128x128_256x64x64x128_16x16_32x32_1x1_8x32x1_8x32x1_1x32x1x8_8_1x1_intrawave_v1,318.58,1176.22,0.0
gfx950,256,307,8192,512,ck,12,0,7.8473,a8w8_blockscale_1x128x128_256x32x128x256_16x16_32x32_1x1_16x16x1_16x16x1_1x32x1x8_8_1x1_intrawave_v1,328.18,1195.49,0.0
gfx950,256,325,8192,512,ck,3,0,7.863,a8w8_blockscale_1x128x128_256x64x64x128_16x16_32x32_1x1_8x32x1_8x32x1_1x32x1x8_8_1x1_intrawave_v3,346.72,1231.78,0.0
gfx950,256,326,8192,512,ck,3,0,7.8701,a8w8_blockscale_1x128x128_256x64x64x128_16x16_32x32_1x1_8x32x1_8x32x1_1x32x1x8_8_1x1_intrawave_v3,347.48,1232.82,0.0
gfx950,256,314,8192,512,ck,13,0,7.8799,a8w8_blockscale_1x128x128_256x32x64x256_16x16_16x16_2x1_16x16x1_16x16x1_1x32x1x8_8_2x1_intrawave_v1,334.27,1205.55,0.0
gfx950,256,292,8192,512,ck,13,0,7.8812,a8w8_blockscale_1x128x128_256x32x64x256_16x16_16x16_2x1_16x16x1_16x16x1_1x32x1x8_8_2x1_intrawave_v1,310.8,1158.19,0.0
gfx950,256,290,8192,512,ck,18,0,7.8841,a8w8_blockscale_1x128x128_256x64x64x256_16x16_32x32_1x1_16x16x1_16x16x1_1x32x1x8_8_1x1_intrawave_v1,308.56,1153.48,0.0
gfx950,256,318,8192,512,ck,12,0,7.8905,a8w8_blockscale_1x128x128_256x32x128x256_16x16_32x32_1x1_16x16x1_16x16x1_1x32x1x8_8_1x1_intrawave_v1,338.07,1212.5,0.0
gfx950,256,294,8192,512,ck,13,0,7.9186,a8w8_blockscale_1x128x128_256x32x64x256_16x16_16x16_2x1_16x16x1_16x16x1_1x32x1x8_8_2x1_intrawave_v1,311.45,1156.99,0.0
gfx950,256,332,8192,512,ck,18,0,7.9203,a8w8_blockscale_1x128x128_256x64x64x256_16x16_32x32_1x1_16x16x1_16x16x1_1x32x1x8_8_1x1_intrawave_v1,351.63,1237.8,0.0
gfx950,256,324,8192,512,ck,16,0,7.9276,a8w8_blockscale_1x128x128_256x64x64x128_16x16_32x32_1x1_8x32x1_8x32x1_1x32x1x8_8_1x1_intrawave_v1,342.84,1219.61,0.0
gfx950,256,176,128,7168,ck,6,3,7.9293,a8w8_blockscale_1x128x128_256x16x64x128_8x16_16x16_1x1_16x16x1_8x32x1_1x16x1x16_4_1x1_intrawave_v1,40.73,280.49,0.0012
gfx950,256,335,8192,512,ck,18,0,7.9293,a8w8_blockscale_1x128x128_256x64x64x256_16x16_32x32_1x1_16x16x1_16x16x1_1x32x1x8_8_1x1_intrawave_v1,354.41,1242.79,0.0
gfx950,256,333,8192,512,ck,16,0,7.9434,a8w8_blockscale_1x128x128_256x64x64x128_16x16_32x32_1x1_8x32x1_8x32x1_1x32x1x8_8_1x1_intrawave_v1,351.66,1236.33,0.0
gfx950,256,315,8192,512,ck,16,0,7.9463,a8w8_blockscale_1x128x128_256x64x64x128_16x16_32x32_1x1_8x32x1_8x32x1_1x32x1x8_8_1x1_intrawave_v1,332.53,1197.61,0.0
gfx950,256,319,8192,512,ck,13,0,7.9524,a8w8_blockscale_1x128x128_256x32x64x256_16x16_16x16_2x1_16x16x1_16x16x1_1x32x1x8_8_2x1_intrawave_v1,336.5,1205.19,0.0
gfx950,256,152,6144,1536,ck,12,0,7.9614,a8w8_blockscale_1x128x128_256x32x128x256_16x16_32x32_1x1_16x16x1_16x16x1_1x32x1x8_8_1x1_intrawave_v1,360.35,1449.3,0.0
gfx950,256,283,8192,512,ck,18,0,7.9623,a8w8_blockscale_1x128x128_256x64x64x256_16x16_32x32_1x1_16x16x1_16x16x1_1x32x1x8_8_1x1_intrawave_v1,298.15,1127.3,0.0
gfx950,256,304,8192,512,ck,13,0,7.9631,a8w8_blockscale_1x128x128_256x32x64x256_16x16_16x16_2x1_16x16x1_16x16x1_1x32x1x8_8_2x1_intrawave_v1,320.24,1171.74,0.0
gfx950,256,353,8192,512,ck,18,0,7.9679,a8w8_blockscale_1x128x128_256x64x64x256_16x16_32x32_1x1_16x16x1_16x16x1_1x32x1x8_8_1x1_intrawave_v1,371.64,1274.94,0.0
gfx950,256,104,8192,1536,ck,12,0,7.9777,a8w8_blockscale_1x128x128_256x32x128x256_16x16_32x32_1x1_16x16x1_16x16x1_1x32x1x8_8_1x1_intrawave_v1,328.07,1810.87,0.0
gfx950,256,358,8192,512,ck,16,0,7.9808,a8w8_blockscale_1x128x128_256x64x64x128_16x16_32x32_1x1_8x32x1_8x32x1_1x32x1x8_8_1x1_intrawave_v1,376.29,1283.46,0.0
gfx950,256,321,8192,512,ck,16,0,7.9922,a8w8_blockscale_1x128x128_256x64x64x128_16x16_32x32_1x1_8x32x1_8x32x1_1x32x1x8_8_1x1_intrawave_v1,336.92,1203.41,0.0
gfx950,256,363,8192,512,ck,18,0,7.9979,a8w8_blockscale_1x128x128_256x64x64x256_16x16_32x32_1x1_16x16x1_16x16x1_1x32x1x8_8_1x1_intrawave_v1,380.73,1291.28,0.0
gfx950,256,361,8192,512,ck,18,0,8.0257,a8w8_blockscale_1x128x128_256x64x64x256_16x16_32x32_1x1_16x16x1_16x16x1_1x32x1x8_8_1x1_intrawave_v1,377.32,1282.6,0.0
gfx950,256,136,6144,1536,ck,12,0,8.0305,a8w8_blockscale_1x128x128_256x32x128x256_16x16_32x32_1x1_16x16x1_16x16x1_1x32x1x8_8_1x1_intrawave_v1,319.65,1409.28,0.0
gfx950,256,344,8192,512,ck,18,0,8.0311,a8w8_blockscale_1x128x128_256x64x64x256_16x16_32x32_1x1_16x16x1_16x16x1_1x32x1x8_8_1x1_intrawave_v1,359.31,1245.97,0.0
gfx950,256,373,8192,512,ck,18,0,8.0383,a8w8_blockscale_1x128x128_256x64x64x256_16x16_32x32_1x1_16x16x1_16x16x1_1x32x1x8_8_1x1_intrawave_v1,389.26,1305.81,0.0
gfx950,256,372,8192,512,ck,18,0,8.0419,a8w8_blockscale_1x128x128_256x64x64x256_16x16_32x32_1x1_16x16x1_16x16x1_1x32x1x8_8_1x1_intrawave_v1,388.04,1303.13,0.0
gfx950,256,343,8192,512,ck,16,0,8.0564,a8w8_blockscale_1x128x128_256x64x64x128_16x16_32x32_1x1_8x32x1_8x32x1_1x32x1x8_8_1x1_intrawave_v1,357.14,1239.96,0.0
gfx950,256,342,8192,512,ck,18,0,8.0663,a8w8_blockscale_1x128x128_256x64x64x256_16x16_32x32_1x1_16x16x1_16x16x1_1x32x1x8_8_1x1_intrawave_v1,355.67,1236.35,0.0
gfx950,256,374,8192,512,ck,3,0,8.0799,a8w8_blockscale_1x128x128_256x64x64x128_16x16_32x32_1x1_8x32x1_8x32x1_1x32x1x8_8_1x1_intrawave_v3,388.29,1301.18,0.0
gfx950,256,376,8192,512,ck,18,0,8.0848,a8w8_blockscale_1x128x128_256x64x64x256_16x16_32x32_1x1_16x16x1_16x16x1_1x32x1x8_8_1x1_intrawave_v1,390.13,1304.57,0.0
gfx950,256,370,8192,512,ck,18,0,8.0927,a8w8_blockscale_1x128x128_256x64x64x256_16x16_32x32_1x1_16x16x1_16x16x1_1x32x1x8_8_1x1_intrawave_v1,383.53,1290.77,0.0
gfx950,256,120,128,7168,ck,5,3,8.0953,a8w8_blockscale_1x128x128_256x16x128x128_8x16_16x16_1x2_16x16x1_8x32x1_1x16x1x16_8_1x2_intrawave_v1,27.2,223.39,0.0006
gfx950,256,349,8192,512,ck,18,0,8.1038,a8w8_blockscale_1x128x128_256x64x64x256_16x16_32x32_1x1_16x16x1_16x16x1_1x32x1x8_8_1x1_intrawave_v1,361.27,1245.22,0.0
gfx950,256,378,8192,512,ck,16,0,8.105,a8w8_blockscale_1x128x128_256x64x64x128_16x16_32x32_1x1_8x32x1_8x32x1_1x32x1x8_8_1x1_intrawave_v1,391.23,1305.49,0.0
gfx950,256,136,128,7168,ck,6,3,8.1497,a8w8_blockscale_1x128x128_256x16x64x128_8x16_16x16_1x1_16x16x1_8x32x1_1x16x1x16_4_1x1_intrawave_v1,30.62,236.47,0.0007
gfx950,256,341,8192,512,ck,16,0,8.1525,a8w8_blockscale_1x128x128_256x64x64x128_16x16_32x32_1x1_8x32x1_8x32x1_1x32x1x8_8_1x1_intrawave_v1,350.88,1221.2,0.0
gfx950,256,380,8192,512,ck,16,0,8.1656,a8w8_blockscale_1x128x128_256x64x64x128_16x16_32x32_1x1_8x32x1_8x32x1_1x32x1x8_8_1x1_intrawave_v1,390.38,1299.94,0.0
gfx950,256,356,8192,512,ck,16,0,8.1732,a8w8_blockscale_1x128x128_256x64x64x128_16x16_32x32_1x1_8x32x1_8x32x1_1x32x1x8_8_1x1_intrawave_v1,365.38,1249.12,0.0
gfx950,256,338,8192,512,ck,16,0,8.1834,a8w8_blockscale_1x128x128_256x64x64x128_16x16_32x32_1x1_8x32x1_8x32x1_1x32x1x8_8_1x1_intrawave_v1,346.48,1210.4,0.0
gfx950,256,362,8192,512,ck,16,0,8.1835,a8w8_blockscale_1x128x128_256x64x64x128_16x16_32x32_1x1_8x32x1_8x32x1_1x32x1x8_8_1x1_intrawave_v1,371.07,1259.93,0.0
gfx950,256,350,8192,512,ck,16,0,8.1897,a8w8_blockscale_1x128x128_256x64x64x128_16x16_32x32_1x1_8x32x1_8x32x1_1x32x1x8_8_1x1_intrawave_v1,358.5,1234.22,0.0
gfx950,256,346,8192,512,ck,3,0,8.1911,a8w8_blockscale_1x128x128_256x64x64x128_16x16_32x32_1x1_8x32x1_8x32x1_1x32x1x8_8_1x1_intrawave_v3,354.34,1225.76,0.0
gfx950,256,377,8192,512,ck,18,0,8.2015,a8w8_blockscale_1x128x128_256x64x64x256_16x16_32x32_1x1_16x16x1_16x16x1_1x32x1x8_8_1x1_intrawave_v1,385.6,1288.07,0.0
gfx950,256,368,8192,512,ck,3,0,8.2619,a8w8_blockscale_1x128x128_256x64x64x128_16x16_32x32_1x1_8x32x1_8x32x1_1x32x1x8_8_1x1_intrawave_v3,373.64,1260.25,0.0
gfx950,256,160,6144,1536,ck,12,0,8.3183,a8w8_blockscale_1x128x128_256x32x128x256_16x16_32x32_1x1_16x16x1_16x16x1_1x32x1x8_8_1x1_intrawave_v1,363.04,1400.41,0.0
gfx950,256,88,128,7168,ck,5,3,8.3649,a8w8_blockscale_1x128x128_256x16x128x128_8x16_16x16_1x2_16x16x1_8x32x1_1x16x1x16_8_1x2_intrawave_v1,19.3,187.79,0.0008
gfx950,256,382,8192,512,ck,3,0,8.3655,a8w8_blockscale_1x128x128_256x64x64x128_16x16_32x32_1x1_8x32x1_8x32x1_1x32x1x8_8_1x1_intrawave_v3,383.06,1272.92,0.0
gfx950,256,144,128,7168,ck,8,2,8.5353,a8w8_blockscale_1x128x128_256x16x64x256_16x16_16x16_1x1_16x16x1_16x16x1_1x16x1x16_4_1x1_intrawave_v1,30.96,232.75,0.0
gfx950,256,184,128,7168,ck,6,3,8.5701,a8w8_blockscale_1x128x128_256x16x64x128_8x16_16x16_1x1_16x16x1_8x32x1_1x16x1x16_4_1x1_intrawave_v1,39.4,266.45,0.0008
gfx950,256,208,128,7168,ck,8,2,8.5893,a8w8_blockscale_1x128x128_256x16x64x256_16x16_16x16_1x1_16x16x1_16x16x1_1x16x1x16_4_1x1_intrawave_v1,44.44,286.6,0.0
gfx950,256,112,128,7168,ck,11,3,8.6373,a8w8_blockscale_1x128x128_256x32x64x128_16x16_16x16_2x1_8x32x1_8x32x1_1x32x1x8_8_2x1_intrawave_v1,23.79,202.49,0.0008
gfx950,256,152,128,7168,ck,8,2,8.6946,a8w8_blockscale_1x128x128_256x16x64x256_16x16_16x16_1x1_16x16x1_16x16x1_1x16x1x16_4_1x1_intrawave_v1,32.08,235.31,0.0
gfx950,256,200,128,7168,ck,6,3,8.7508,a8w8_blockscale_1x128x128_256x16x64x128_8x16_16x16_1x1_16x16x1_8x32x1_1x16x1x16_4_1x1_intrawave_v1,41.94,274.52,0.0012
gfx950,256,104,128,7168,ck,18,2,8.8869,a8w8_blockscale_1x128x128_256x64x64x256_16x16_32x32_1x1_16x16x1_16x16x1_1x32x1x8_8_1x1_intrawave_v1,21.47,190.12,0.0
gfx950,256,216,128,7168,ck,8,2,9.2441,a8w8_blockscale_1x128x128_256x16x64x256_16x16_16x16_1x1_16x16x1_16x16x1_1x16x1x16_4_1x1_intrawave_v1,42.88,272.72,0.0
gfx950,256,469,8192,512,ck,0,0,9.2559,a8w8_blockscale_1x128x128_256x128x128x128_16x16_32x32_2x2_8x32x1_8x32x1_1x32x1x8_8_1x1_intrawave_v3,425.05,1309.28,0.0
gfx950,256,482,8192,512,ck,0,0,9.3195,a8w8_blockscale_1x128x128_256x128x128x128_16x16_32x32_2x2_8x32x1_8x32x1_1x32x1x8_8_1x1_intrawave_v3,433.85,1323.91,0.0
gfx950,256,492,8192,512,ck,18,0,9.349,a8w8_blockscale_1x128x128_256x64x64x256_16x16_32x32_1x1_16x16x1_16x16x1_1x32x1x8_8_1x1_intrawave_v1,441.46,1337.8,0.0
gfx950,256,472,8192,512,ck,18,0,9.3591,a8w8_blockscale_1x128x128_256x64x64x256_16x16_32x32_1x1_16x16x1_16x16x1_1x32x1x8_8_1x1_intrawave_v1,423.06,1300.25,0.0
gfx950,256,451,8192,512,ck,18,0,9.4131,a8w8_blockscale_1x128x128_256x64x64x256_16x16_32x32_1x1_16x16x1_16x16x1_1x32x1x8_8_1x1_intrawave_v1,401.91,1255.1,0.0
gfx950,256,475,8192,512,ck,0,0,9.4183,a8w8_blockscale_1x128x128_256x128x128x128_16x16_32x32_2x2_8x32x1_8x32x1_1x32x1x8_8_1x1_intrawave_v3,423.07,1297.46,0.0
gfx950,256,470,8192,512,ck,18,0,9.4674,a8w8_blockscale_1x128x128_256x64x64x256_16x16_32x32_1x1_16x16x1_16x16x1_1x32x1x8_8_1x1_intrawave_v1,416.44,1281.81,0.0
gfx950,256,478,8192,512,ck,17,0,9.4995,a8w8_blockscale_1x128x128_256x64x128x256_16x16_32x32_2x1_16x16x1_16x16x1_1x32x1x8_8_1x1_intrawave_v1,422.1,1291.71,0.0
gfx950,256,476,8192,512,ck,18,0,9.5078,a8w8_blockscale_1x128x128_256x64x64x256_16x16_32x32_1x1_16x16x1_16x16x1_1x32x1x8_8_1x1_intrawave_v1,419.97,1287.03,0.0
gfx950,256,450,8192,512,ck,17,0,9.548,a8w8_blockscale_1x128x128_256x64x128x256_16x16_32x32_2x1_16x16x1_16x16x1_1x32x1x8_8_1x1_intrawave_v1,395.36,1235.6,0.0
gfx950,256,304,128,7168,ck,6,3,9.5569,a8w8_blockscale_1x128x128_256x16x64x128_8x16_16x16_1x1_16x16x1_8x32x1_1x16x1x16_4_1x1_intrawave_v1,58.37,332.16,0.0002
gfx950,256,467,8192,512,ck,0,0,9.5623,a8w8_blockscale_1x128x128_256x128x128x128_16x16_32x32_2x2_8x32x1_8x32x1_1x32x1x8_8_1x1_intrawave_v3,409.68,1263.79,0.0
gfx950,256,391,8192,512,ck,0,0,9.5811,a8w8_blockscale_1x128x128_256x128x128x128_16x16_32x32_2x2_8x32x1_8x32x1_1x32x1x8_8_1x1_intrawave_v3,342.33,1127.29,0.0
gfx950,256,459,8192,512,ck,0,0,9.6055,a8w8_blockscale_1x128x128_256x128x128x128_16x16_32x32_2x2_8x32x1_8x32x1_1x32x1x8_8_1x1_intrawave_v3,400.85,1244.03,0.0
gfx950,256,494,8192,512,ck,18,0,9.6088,a8w8_blockscale_1x128x128_256x64x64x256_16x16_32x32_1x1_16x16x1_16x16x1_1x32x1x8_8_1x1_intrawave_v1,431.27,1305.15,0.0
gfx950,256,488,8192,512,ck,0,0,9.6214,a8w8_blockscale_1x128x128_256x128x128x128_16x16_32x32_2x2_8x32x1_8x32x1_1x32x1x8_8_1x1_intrawave_v3,425.47,1292.9,0.0
gfx950,256,486,8192,512,ck,0,0,9.6278,a8w8_blockscale_1x128x128_256x128x128x128_16x16_32x32_2x2_8x32x1_8x32x1_1x32x1x8_8_1x1_intrawave_v3,423.45,1288.54,0.0
gfx950,256,464,8192,512,ck,18,0,9.6347,a8w8_blockscale_1x128x128_256x64x64x256_16x16_32x32_1x1_16x16x1_16x16x1_1x32x1x8_8_1x1_intrawave_v1,403.99,1249.03,0.0
gfx950,256,240,128,7168,ck,6,3,9.6395,a8w8_blockscale_1x128x128_256x16x64x128_8x16_16x16_1x1_16x16x1_8x32x1_1x16x1x16_4_1x1_intrawave_v1,45.69,280.02,0.0012
gfx950,256,489,8192,512,ck,0,0,9.6655,a8w8_blockscale_1x128x128_256x128x128x128_16x16_32x32_2x2_8x32x1_8x32x1_1x32x1x8_8_1x1_intrawave_v3,424.4,1288.75,0.0
gfx950,256,428,8192,512,ck,0,0,9.6683,a8w8_blockscale_1x128x128_256x128x128x128_16x16_32x32_2x2_8x32x1_8x32x1_1x32x1x8_8_1x1_intrawave_v3,371.35,1181.78,0.0
gfx950,256,415,8192,512,ck,0,0,9.6959,a8w8_blockscale_1x128x128_256x128x128x128_16x16_32x32_2x2_8x32x1_8x32x1_1x32x1x8_8_1x1_intrawave_v3,359.05,1155.76,0.0
gfx950,256,456,8192,512,ck,17,0,9.7619,a8w8_blockscale_1x128x128_256x64x128x256_16x16_32x32_2x1_16x16x1_16x16x1_1x32x1x8_8_1x1_intrawave_v1,391.85,1218.91,0.0
gfx950,256,458,8192,512,ck,2,0,9.7702,a8w8_blockscale_1x128x128_256x64x128x128_16x16_32x32_1x2_8x32x1_8x32x1_1x32x1x8_8_1x1_intrawave_v3,393.23,1221.33,0.0
gfx950,256,386,8192,512,ck,18,0,9.7727,a8w8_blockscale_1x128x128_256x64x64x256_16x16_32x32_1x1_16x16x1_16x16x1_1x32x1x8_8_1x1_intrawave_v1,331.33,1096.54,0.0
gfx950,256,402,8192,512,ck,0,0,9.8027,a8w8_blockscale_1x128x128_256x128x128x128_16x16_32x32_2x2_8x32x1_8x32x1_1x32x1x8_8_1x1_intrawave_v3,344.01,1120.76,0.0
gfx950,256,421,8192,512,ck,0,0,9.8183,a8w8_blockscale_1x128x128_256x128x128x128_16x16_32x32_2x2_8x32x1_8x32x1_1x32x1x8_8_1x1_intrawave_v3,359.7,1151.68,0.0
gfx950,256,465,8192,512,ck,0,0,9.8411,a8w8_blockscale_1x128x128_256x128x128x128_16x16_32x32_2x2_8x32x1_8x32x1_1x32x1x8_8_1x1_intrawave_v3,396.37,1224.55,0.0
gfx950,256,468,8192,512,ck,18,0,9.8435,a8w8_blockscale_1x128x128_256x64x64x256_16x16_32x32_1x1_16x16x1_16x16x1_1x32x1x8_8_1x1_intrawave_v1,398.83,1229.4,0.0
gfx950,256,504,8192,512,ck,17,0,9.8779,a8w8_blockscale_1x128x128_256x64x128x256_16x16_32x32_2x1_16x16x1_16x16x1_1x32x1x8_8_1x1_intrawave_v1,428.01,1286.7,0.0
gfx950,256,437,8192,512,ck,18,0,9.8794,a8w8_blockscale_1x128x128_256x64x64x256_16x16_32x32_1x1_16x16x1_16x16x1_1x32x1x8_8_1x1_intrawave_v1,371.06,1171.92,0.0
gfx950,256,443,8192,512,ck,0,0,9.8983,a8w8_blockscale_1x128x128_256x128x128x128_16x16_32x32_2x2_8x32x1_8x32x1_1x32x1x8_8_1x1_intrawave_v3,375.43,1179.92,0.0
gfx950,256,396,8192,512,ck,0,0,9.905,a8w8_blockscale_1x128x128_256x128x128x128_16x16_32x32_2x2_8x32x1_8x32x1_1x32x1x8_8_1x1_intrawave_v3,335.37,1098.95,0.0
gfx950,256,502,8192,512,ck,0,0,9.9571,a8w8_blockscale_1x128x128_256x128x128x128_16x16_32x32_2x2_8x32x1_8x32x1_1x32x1x8_8_1x1_intrawave_v3,422.92,1273.07,0.0
gfx950,256,422,8192,512,ck,0,0,9.9779,a8w8_blockscale_1x128x128_256x128x128x128_16x16_32x32_2x2_8x32x1_8x32x1_1x32x1x8_8_1x1_intrawave_v3,354.78,1134.95,0.0
gfx950,256,407,8192,512,ck,18,0,9.9819,a8w8_blockscale_1x128x128_256x64x64x256_16x16_32x32_1x1_16x16x1_16x16x1_1x32x1x8_8_1x1_intrawave_v1,342.04,1109.11,0.0
gfx950,256,442,8192,512,ck,0,0,9.9895,a8w8_blockscale_1x128x128_256x128x128x128_16x16_32x32_2x2_8x32x1_8x32x1_1x32x1x8_8_1x1_intrawave_v3,371.17,1167.46,0.0
gfx950,256,474,8192,512,ck,17,0,9.9979,a8w8_blockscale_1x128x128_256x64x128x256_16x16_32x32_2x1_16x16x1_16x16x1_1x32x1x8_8_1x1_intrawave_v1,397.7,1220.56,0.0
gfx950,256,430,8192,512,ck,0,0,10.0015,a8w8_blockscale_1x128x128_256x128x128x128_16x16_32x32_2x2_8x32x1_8x32x1_1x32x1x8_8_1x1_intrawave_v3,360.66,1145.79,0.0
gfx950,256,510,8192,512,ck,2,0,10.0262,a8w8_blockscale_1x128x128_256x64x128x128_16x16_32x32_1x2_8x32x1_8x32x1_1x32x1x8_8_1x1_intrawave_v3,426.7,1277.78,0.0
gfx950,256,403,8192,512,ck,18,0,10.0427,a8w8_blockscale_1x128x128_256x64x64x256_16x16_32x32_1x1_16x16x1_16x16x1_1x32x1x8_8_1x1_intrawave_v1,336.62,1095.66,0.0
gfx950,256,479,8192,512,ck,17,0,10.0475,a8w8_blockscale_1x128x128_256x64x128x256_16x16_32x32_2x1_16x16x1_16x16x1_1x32x1x8_8_1x1_intrawave_v1,399.91,1222.94,0.0
gfx950,256,397,8192,512,ck,18,0,10.0487,a8w8_blockscale_1x128x128_256x64x64x256_16x16_32x32_1x1_16x16x1_16x16x1_1x32x1x8_8_1x1_intrawave_v1,331.41,1084.92,0.0
gfx950,256,392,8192,512,ck,0,0,10.0523,a8w8_blockscale_1x128x128_256x128x128x128_16x16_32x32_2x2_8x32x1_8x32x1_1x32x1x8_8_1x1_intrawave_v3,327.12,1076.13,0.0
gfx950,256,393,8192,512,ck,18,0,10.0527,a8w8_blockscale_1x128x128_256x64x64x256_16x16_32x32_1x1_16x16x1_16x16x1_1x32x1x8_8_1x1_intrawave_v1,327.94,1077.76,0.0
gfx950,256,425,8192,512,ck,0,0,10.0635,a8w8_blockscale_1x128x128_256x128x128x128_16x16_32x32_2x2_8x32x1_8x32x1_1x32x1x8_8_1x1_intrawave_v3,354.27,1130.33,0.0
gfx950,256,423,8192,512,ck,0,0,10.0671,a8w8_blockscale_1x128x128_256x128x128x128_16x16_32x32_2x2_8x32x1_8x32x1_1x32x1x8_8_1x1_intrawave_v3,352.47,1126.57,0.0
gfx950,256,388,8192,512,ck,0,0,10.1123,a8w8_blockscale_1x128x128_256x128x128x128_16x16_32x32_2x2_8x32x1_8x32x1_1x32x1x8_8_1x1_intrawave_v3,321.86,1063.06,0.0
gfx950,256,433,8192,512,ck,0,0,10.1186,a8w8_blockscale_1x128x128_256x128x128x128_16x16_32x32_2x2_8x32x1_8x32x1_1x32x1x8_8_1x1_intrawave_v3,358.97,1137.54,0.0
gfx950,256,400,128,7168,ck,8,2,10.1266,a8w8_blockscale_1x128x128_256x16x64x256_16x16_16x16_1x1_16x16x1_16x16x1_1x16x1x16_4_1x1_intrawave_v1,72.48,383.85,0.0
gfx950,256,420,8192,512,ck,18,0,10.1735,a8w8_blockscale_1x128x128_256x64x64x256_16x16_32x32_1x1_16x16x1_16x16x1_1x32x1x8_8_1x1_intrawave_v1,346.31,1109.81,0.0
gfx950,256,464,128,7168,ck,6,3,10.1957,a8w8_blockscale_1x128x128_256x16x64x128_8x16_16x16_1x1_16x16x1_8x32x1_1x16x1x16_4_1x1_intrawave_v1,83.51,427.85,0.0012
gfx950,256,507,8192,512,ck,17,0,10.1971,a8w8_blockscale_1x128x128_256x64x128x256_16x16_32x32_2x1_16x16x1_16x16x1_1x32x1x8_8_1x1_intrawave_v1,417.08,1251.39,0.0
gfx950,256,455,8192,512,ck,18,0,10.2007,a8w8_blockscale_1x128x128_256x64x64x256_16x16_32x32_1x1_16x16x1_16x16x1_1x32x1x8_8_1x1_intrawave_v1,374.17,1164.82,0.0
gfx950,256,434,8192,512,ck,0,0,10.2504,a8w8_blockscale_1x128x128_256x128x128x128_16x16_32x32_2x2_8x32x1_8x32x1_1x32x1x8_8_1x1_intrawave_v3,355.17,1124.56,0.0
gfx950,256,493,8192,512,ck,0,0,10.2507,a8w8_blockscale_1x128x128_256x128x128x128_16x16_32x32_2x2_8x32x1_8x32x1_1x32x1x8_8_1x1_intrawave_v3,403.44,1221.77,0.0
gfx950,256,471,8192,512,ck,0,0,10.2903,a8w8_blockscale_1x128x128_256x128x128x128_16x16_32x32_2x2_8x32x1_8x32x1_1x32x1x8_8_1x1_intrawave_v3,383.96,1180.95,0.0
gfx950,256,445,8192,512,ck,0,0,10.2935,a8w8_blockscale_1x128x128_256x128x128x128_16x16_32x32_2x2_8x32x1_8x32x1_1x32x1x8_8_1x1_intrawave_v3,362.65,1137.9,0.0
gfx950,256,440,8192,512,ck,0,0,10.3095,a8w8_blockscale_1x128x128_256x128x128x128_16x16_32x32_2x2_8x32x1_8x32x1_1x32x1x8_8_1x1_intrawave_v3,358.02,1127.94,0.0
gfx950,256,505,8192,512,ck,15,0,10.3135,a8w8_blockscale_1x128x128_256x64x128x128_16x16_32x32_2x1_8x32x1_8x32x1_1x32x1x8_8_1x1_intrawave_v1,410.75,1233.99,0.0
gfx950,256,481,8192,512,ck,0,0,10.3455,a8w8_blockscale_1x128x128_256x128x128x128_16x16_32x32_2x2_8x32x1_8x32x1_1x32x1x8_8_1x1_intrawave_v3,390.02,1190.98,0.0
gfx950,256,419,8192,512,ck,2,0,10.3635,a8w8_blockscale_1x128x128_256x64x128x128_16x16_32x32_1x2_8x32x1_8x32x1_1x32x1x8_8_1x1_intrawave_v3,339.15,1087.83,0.0
gfx950,256,426,8192,512,ck,0,0,10.4231,a8w8_blockscale_1x128x128_256x128x128x128_16x16_32x32_2x2_8x32x1_8x32x1_1x32x1x8_8_1x1_intrawave_v3,342.85,1092.96,0.0
gfx950,256,368,128,7168,ck,6,3,10.5301,a8w8_blockscale_1x128x128_256x16x64x128_8x16_16x16_1x1_16x16x1_8x32x1_1x16x1x16_4_1x1_intrawave_v1,64.13,346.58,0.0013
gfx950,256,436,8192,512,ck,0,0,10.5557,a8w8_blockscale_1x128x128_256x128x128x128_16x16_32x32_2x2_8x32x1_8x32x1_1x32x1x8_8_1x1_intrawave_v3,346.49,1095.23,0.0
gfx950,256,435,8192,512,ck,18,0,10.6019,a8w8_blockscale_1x128x128_256x64x64x256_16x16_32x32_1x1_16x16x1_16x16x1_1x32x1x8_8_1x1_intrawave_v1,344.19,1088.87,0.0
gfx950,256,248,128,7168,ck,7,2,10.6871,a8w8_blockscale_1x128x128_256x16x128x256_16x16_16x16_1x2_16x16x1_16x16x1_1x16x1x16_8_1x2_intrawave_v1,42.58,258.13,0.0
gfx950,256,409,8192,512,ck,13,0,10.7499,a8w8_blockscale_1x128x128_256x32x64x256_16x16_16x16_2x1_16x16x1_16x16x1_1x32x1x8_8_2x1_intrawave_v1,319.16,1033.01,0.0
gfx950,256,128,1024,4096,ck,8,1,10.7865,a8w8_blockscale_1x128x128_256x16x64x256_16x16_16x16_1x1_16x16x1_16x16x1_1x16x1x16_4_1x1_intrawave_v1,99.54,461.76,0.0
gfx950,256,336,128,7168,ck,5,3,10.8441,a8w8_blockscale_1x128x128_256x16x128x128_8x16_16x16_1x2_16x16x1_8x32x1_1x16x1x16_8_1x2_intrawave_v1,56.86,314.64,0.0005
gfx950,256,224,6144,1536,ck,18,0,10.8515,a8w8_blockscale_1x128x128_256x64x64x256_16x16_32x32_1x1_16x16x1_16x16x1_1x32x1x8_8_1x1_intrawave_v1,389.61,1155.03,0.0
gfx950,256,192,6144,1536,ck,18,0,10.9055,a8w8_blockscale_1x128x128_256x64x64x256_16x16_32x32_1x1_16x16x1_16x16x1_1x32x1x8_8_1x1_intrawave_v1,332.3,1108.74,0.0
gfx950,256,830,128,7168,ck,8,2,10.9267,a8w8_blockscale_1x128x128_256x16x64x256_16x16_16x16_1x1_16x16x1_16x16x1_1x16x1x16_4_1x1_intrawave_v1,139.39,647.9,0.0
gfx950,256,496,128,7168,ck,7,2,10.9409,a8w8_blockscale_1x128x128_256x16x128x256_16x16_16x16_1x2_16x16x1_16x16x1_1x16x1x16_8_1x2_intrawave_v1,83.19,420.42,0.0
gfx950,256,256,6144,1536,ck,18,0,10.9719,a8w8_blockscale_1x128x128_256x64x64x256_16x16_32x32_1x1_16x16x1_16x16x1_1x32x1x8_8_1x1_intrawave_v1,440.38,1182.67,0.0
gfx950,256,272,6144,1536,ck,18,0,10.9923,a8w8_blockscale_1x128x128_256x64x64x256_16x16_32x32_1x1_16x16x1_16x16x1_1x32x1x8_8_1x1_intrawave_v1,467.04,1200.6,0.0
gfx950,256,200,6144,1536,ck,18,0,11.0035,a8w8_blockscale_1x128x128_256x64x64x256_16x16_32x32_1x1_16x16x1_16x16x1_1x32x1x8_8_1x1_intrawave_v1,343.06,1108.92,0.0
gfx950,256,232,6144,1536,ck,18,0,11.0159,a8w8_blockscale_1x128x128_256x64x64x256_16x16_32x32_1x1_16x16x1_16x16x1_1x32x1x8_8_1x1_intrawave_v1,397.5,1147.83,0.0
gfx950,256,216,8192,1536,ck,18,0,11.0511,a8w8_blockscale_1x128x128_256x64x64x256_16x16_32x32_1x1_16x16x1_16x16x1_1x32x1x8_8_1x1_intrawave_v1,491.88,1488.87,0.0
gfx950,256,304,6144,1536,ck,18,0,11.0512,a8w8_blockscale_1x128x128_256x64x64x256_16x16_32x32_1x1_16x16x1_16x16x1_1x32x1x8_8_1x1_intrawave_v1,519.2,1234.23,0.0
gfx950,256,208,6144,1536,ck,18,0,11.1301,a8w8_blockscale_1x128x128_256x64x64x256_16x16_32x32_1x1_16x16x1_16x16x1_1x32x1x8_8_1x1_intrawave_v1,352.73,1106.24,0.0
gfx950,256,1001,128,7168,ck,8,2,11.1437,a8w8_blockscale_1x128x128_256x16x64x256_16x16_16x16_1x1_16x16x1_16x16x1_1x16x1x16_4_1x1_intrawave_v1,164.83,749.21,0.0
gfx950,256,320,6144,1536,ck,18,0,11.1485,a8w8_blockscale_1x128x128_256x64x64x256_16x16_32x32_1x1_16x16x1_16x16x1_1x32x1x8_8_1x1_intrawave_v1,541.76,1243.29,0.0
gfx950,256,272,128,7168,ck,8,2,11.1519,a8w8_blockscale_1x128x128_256x16x64x256_16x16_16x16_1x1_16x16x1_16x16x1_1x16x1x16_4_1x1_intrawave_v1,44.76,263.35,0.0
gfx950,256,184,6144,1536,ck,13,0,11.1566,a8w8_blockscale_1x128x128_256x32x64x256_16x16_16x16_2x1_16x16x1_16x16x1_1x32x1x8_8_2x1_intrawave_v1,311.29,1073.88,0.0
gfx950,256,176,6144,1536,ck,18,0,11.1569,a8w8_blockscale_1x128x128_256x64x64x256_16x16_32x32_1x1_16x16x1_16x16x1_1x32x1x8_8_1x1_intrawave_v1,297.74,1063.93,0.0
gfx950,256,248,8192,1536,ck,18,0,11.1784,a8w8_blockscale_1x128x128_256x64x64x256_16x16_32x32_1x1_16x16x1_16x16x1_1x32x1x8_8_1x1_intrawave_v1,558.32,1523.21,0.0
gfx950,256,240,6144,1536,ck,18,0,11.1829,a8w8_blockscale_1x128x128_256x64x64x256_16x16_32x32_1x1_16x16x1_16x16x1_1x32x1x8_8_1x1_intrawave_v1,405.07,1140.58,0.0
gfx950,256,168,6144,1536,ck,18,0,11.1836,a8w8_blockscale_1x128x128_256x64x64x256_16x16_32x32_1x1_16x16x1_16x16x1_1x32x1x8_8_1x1_intrawave_v1,283.53,1051.51,0.0
gfx950,256,569,8192,512,ck,18,0,11.1921,a8w8_blockscale_1x128x128_256x64x64x256_16x16_32x32_1x1_16x16x1_16x16x1_1x32x1x8_8_1x1_intrawave_v1,426.47,1233.74,0.0
gfx950,256,200,8192,1536,ck,18,0,11.2017,a8w8_blockscale_1x128x128_256x64x64x256_16x16_32x32_1x1_16x16x1_16x16x1_1x32x1x8_8_1x1_intrawave_v1,449.32,1443.26,0.0
gfx950,256,557,8192,512,ck,18,0,11.2373,a8w8_blockscale_1x128x128_256x64x64x256_16x16_32x32_1x1_16x16x1_16x16x1_1x32x1x8_8_1x1_intrawave_v1,415.8,1210.73,0.0
gfx950,256,734,128,7168,ck,8,2,11.241,a8w8_blockscale_1x128x128_256x16x64x256_16x16_16x16_1x1_16x16x1_16x16x1_1x16x1x16_4_1x1_intrawave_v1,119.82,566.38,0.0
gfx950,256,517,8192,512,ck,18,0,11.254,a8w8_blockscale_1x128x128_256x64x64x256_16x16_32x32_1x1_16x16x1_16x16x1_1x32x1x8_8_1x1_intrawave_v1,385.37,1148.88,0.0
gfx950,256,535,8192,512,ck,13,0,11.2601,a8w8_blockscale_1x128x128_256x32x64x256_16x16_16x16_2x1_16x16x1_16x16x1_1x32x1x8_8_2x1_intrawave_v1,398.57,1175.27,0.0
gfx950,256,571,8192,512,ck,18,0,11.261,a8w8_blockscale_1x128x128_256x64x64x256_16x16_32x32_1x1_16x16x1_16x16x1_1x32x1x8_8_1x1_intrawave_v1,425.35,1229.19,0.0
gfx950,256,551,8192,512,ck,18,0,11.2683,a8w8_blockscale_1x128x128_256x64x64x256_16x16_32x32_1x1_16x16x1_16x16x1_1x32x1x8_8_1x1_intrawave_v1,410.19,1198.41,0.0
gfx950,256,518,8192,512,ck,18,0,11.2744,a8w8_blockscale_1x128x128_256x64x64x256_16x16_32x32_1x1_16x16x1_16x16x1_1x32x1x8_8_1x1_intrawave_v1,385.41,1148.3,0.0
gfx950,256,560,8192,512,ck,18,0,11.2748,a8w8_blockscale_1x128x128_256x64x64x256_16x16_32x32_1x1_16x16x1_16x16x1_1x32x1x8_8_1x1_intrawave_v1,416.65,1211.2,0.0
gfx950,256,549,8192,512,ck,18,0,11.2818,a8w8_blockscale_1x128x128_256x64x64x256_16x16_32x32_1x1_16x16x1_16x16x1_1x32x1x8_8_1x1_intrawave_v1,408.21,1193.98,0.0
gfx950,256,529,8192,512,ck,18,0,11.2846,a8w8_blockscale_1x128x128_256x64x64x256_16x16_32x32_1x1_16x16x1_16x16x1_1x32x1x8_8_1x1_intrawave_v1,393.24,1163.74,0.0
gfx950,256,521,8192,512,ck,18,0,11.2861,a8w8_blockscale_1x128x128_256x64x64x256_16x16_32x32_1x1_16x16x1_16x16x1_1x32x1x8_8_1x1_intrawave_v1,387.24,1151.6,0.0
gfx950,256,534,8192,512,ck,18,0,11.2945,a8w8_blockscale_1x128x128_256x64x64x256_16x16_32x32_1x1_16x16x1_16x16x1_1x32x1x8_8_1x1_intrawave_v1,396.61,1170.2,0.0
gfx950,256,576,8192,512,ck,18,0,11.3038,a8w8_blockscale_1x128x128_256x64x64x256_16x16_32x32_1x1_16x16x1_16x16x1_1x32x1x8_8_1x1_intrawave_v1,427.45,1232.01,0.0
gfx950,256,432,128,7168,ck,6,3,11.3094,a8w8_blockscale_1x128x128_256x16x64x128_8x16_16x16_1x1_16x16x1_8x32x1_1x16x1x16_4_1x1_intrawave_v1,70.09,364.71,0.0011
gfx950,256,565,8192,512,ck,18,0,11.3144,a8w8_blockscale_1x128x128_256x64x64x256_16x16_32x32_1x1_16x16x1_16x16x1_1x32x1x8_8_1x1_intrawave_v1,418.9,1214.43,0.0
gfx950,256,566,8192,512,ck,18,0,11.3187,a8w8_blockscale_1x128x128_256x64x64x256_16x16_32x32_1x1_16x16x1_16x16x1_1x32x1x8_8_1x1_intrawave_v1,419.48,1215.46,0.0
gfx950,256,528,8192,512,ck,18,0,11.3191,a8w8_blockscale_1x128x128_256x64x64x256_16x16_32x32_1x1_16x16x1_16x16x1_1x32x1x8_8_1x1_intrawave_v1,391.3,1158.7,0.0
gfx950,256,516,8192,512,ck,18,0,11.3292,a8w8_blockscale_1x128x128_256x64x64x256_16x16_32x32_1x1_16x16x1_16x16x1_1x32x1x8_8_1x1_intrawave_v1,382.07,1139.77,0.0
gfx950,256,536,8192,512,ck,18,0,11.3302,a8w8_blockscale_1x128x128_256x64x64x256_16x16_32x32_1x1_16x16x1_16x16x1_1x32x1x8_8_1x1_intrawave_v1,396.84,1169.49,0.0
gfx950,256,176,8192,1536,ck,18,0,11.331,a8w8_blockscale_1x128x128_256x64x64x256_16x16_32x32_1x1_16x16x1_16x16x1_1x32x1x8_8_1x1_intrawave_v1,390.89,1388.83,0.0
gfx950,256,856,128,7168,ck,8,2,11.3334,a8w8_blockscale_1x128x128_256x16x64x256_16x16_16x16_1x1_16x16x1_16x16x1_1x16x1x16_4_1x1_intrawave_v1,138.6,641.68,0.0
gfx950,256,248,6144,1536,ck,18,0,11.3456,a8w8_blockscale_1x128x128_256x64x64x256_16x16_32x32_1x1_16x16x1_16x16x1_1x32x1x8_8_1x1_intrawave_v1,412.57,1133.97,0.0
gfx950,256,530,8192,512,ck,18,0,11.3528,a8w8_blockscale_1x128x128_256x64x64x256_16x16_32x32_1x1_16x16x1_16x16x1_1x32x1x8_8_1x1_intrawave_v1,391.62,1158.23,0.0
gfx950,256,522,8192,512,ck,13,0,11.3612,a8w8_blockscale_1x128x128_256x32x64x256_16x16_16x16_2x1_16x16x1_16x16x1_1x32x1x8_8_2x1_intrawave_v1,385.42,1145.48,0.0
gfx950,256,152,8192,1536,ck,18,0,11.3692,a8w8_blockscale_1x128x128_256x64x64x256_16x16_32x32_1x1_16x16x1_16x16x1_1x32x1x8_8_1x1_intrawave_v1,336.45,1346.34,0.0
gfx950,256,568,8192,512,ck,18,0,11.374,a8w8_blockscale_1x128x128_256x64x64x256_16x16_32x32_1x1_16x16x1_16x16x1_1x32x1x8_8_1x1_intrawave_v1,418.91,1212.52,0.0
gfx950,256,558,8192,512,ck,18,0,11.3816,a8w8_blockscale_1x128x128_256x64x64x256_16x16_32x32_1x1_16x16x1_16x16x1_1x32x1x8_8_1x1_intrawave_v1,411.26,1196.87,0.0
gfx950,256,288,6144,1536,ck,18,0,11.3906,a8w8_blockscale_1x128x128_256x64x64x256_16x16_32x32_1x1_16x16x1_16x16x1_1x32x1x8_8_1x1_intrawave_v1,477.22,1178.03,0.0
gfx950,256,144,8192,1536,ck,18,0,11.3974,a8w8_blockscale_1x128x128_256x64x64x256_16x16_32x32_1x1_16x16x1_16x16x1_1x32x1x8_8_1x1_intrawave_v1,317.96,1330.43,0.0
gfx950,256,168,8192,1536,ck,18,0,11.4003,a8w8_blockscale_1x128x128_256x64x64x256_16x16_32x32_1x1_16x16x1_16x16x1_1x32x1x8_8_1x1_intrawave_v1,370.86,1367.81,0.0
gfx950,256,216,6144,1536,ck,18,0,11.4012,a8w8_blockscale_1x128x128_256x64x64x256_16x16_32x32_1x1_16x16x1_16x16x1_1x32x1x8_8_1x1_intrawave_v1,357.58,1089.64,0.0
gfx950,256,553,8192,512,ck,18,0,11.4013,a8w8_blockscale_1x128x128_256x64x64x256_16x16_32x32_1x1_16x16x1_16x16x1_1x32x1x8_8_1x1_intrawave_v1,406.87,1187.39,0.0
gfx950,256,515,8192,512,ck,18,0,11.4189,a8w8_blockscale_1x128x128_256x64x64x256_16x16_32x32_1x1_16x16x1_16x16x1_1x32x1x8_8_1x1_intrawave_v1,378.33,1129.33,0.0
gfx950,256,546,8192,512,ck,18,0,11.4241,a8w8_blockscale_1x128x128_256x64x64x256_16x16_32x32_1x1_16x16x1_16x16x1_1x32x1x8_8_1x1_intrawave_v1,400.92,1174.67,0.0
gfx950,256,599,8192,512,ck,18,0,11.4468,a8w8_blockscale_1x128x128_256x64x64x256_16x16_32x32_1x1_16x16x1_16x16x1_1x32x1x8_8_1x1_intrawave_v1,438.97,1250.57,0.0
gfx950,256,580,8192,512,ck,18,0,11.4593,a8w8_blockscale_1x128x128_256x64x64x256_16x16_32x32_1x1_16x16x1_16x16x1_1x32x1x8_8_1x1_intrawave_v1,424.58,1221.19,0.0
gfx950,256,611,8192,512,ck,18,0,11.462,a8w8_blockscale_1x128x128_256x64x64x256_16x16_32x32_1x1_16x16x1_16x16x1_1x32x1x8_8_1x1_intrawave_v1,447.17,1266.6,0.0
gfx950,256,208,8192,1536,ck,18,0,11.4666,a8w8_blockscale_1x128x128_256x64x64x256_16x16_32x32_1x1_16x16x1_16x16x1_1x32x1x8_8_1x1_intrawave_v1,456.5,1422.42,0.0
gfx950,256,563,8192,512,ck,18,0,11.4695,a8w8_blockscale_1x128x128_256x64x64x256_16x16_32x32_1x1_16x16x1_16x16x1_1x32x1x8_8_1x1_intrawave_v1,411.77,1195.06,0.0
gfx950,256,639,8192,512,ck,18,0,11.4723,a8w8_blockscale_1x128x128_256x64x64x256_16x16_32x32_1x1_16x16x1_16x16x1_1x32x1x8_8_1x1_intrawave_v1,467.24,1306.7,0.0
gfx950,256,583,8192,512,ck,18,0,11.4782,a8w8_blockscale_1x128x128_256x64x64x256_16x16_32x32_1x1_16x16x1_16x16x1_1x32x1x8_8_1x1_intrawave_v1,426.07,1223.6,0.0
gfx950,256,1007,128,7168,ck,7,2,11.4861,a8w8_blockscale_1x128x128_256x16x128x256_16x16_16x16_1x2_16x16x1_16x16x1_1x16x1x16_8_1x2_intrawave_v1,160.88,730.75,0.0
gfx950,256,524,8192,512,ck,13,0,11.4862,a8w8_blockscale_1x128x128_256x32x64x256_16x16_16x16_2x1_16x16x1_16x16x1_1x32x1x8_8_2x1_intrawave_v1,382.69,1135.96,0.0
gfx950,256,613,8192,512,ck,18,0,11.4875,a8w8_blockscale_1x128x128_256x64x64x256_16x16_32x32_1x1_16x16x1_16x16x1_1x32x1x8_8_1x1_intrawave_v1,447.64,1266.73,0.0
gfx950,256,579,8192,512,ck,18,0,11.4879,a8w8_blockscale_1x128x128_256x64x64x256_16x16_32x32_1x1_16x16x1_16x16x1_1x32x1x8_8_1x1_intrawave_v1,422.79,1216.68,0.0
gfx950,256,184,8192,1536,ck,18,0,11.4961,a8w8_blockscale_1x128x128_256x64x64x256_16x16_32x32_1x1_16x16x1_16x16x1_1x32x1x8_8_1x1_intrawave_v1,402.79,1381.35,0.0
gfx950,256,636,8192,512,ck,18,0,11.4997,a8w8_blockscale_1x128x128_256x64x64x256_16x16_32x32_1x1_16x16x1_16x16x1_1x32x1x8_8_1x1_intrawave_v1,463.94,1299.18,0.0
gfx950,256,581,8192,512,ck,18,0,11.5037,a8w8_blockscale_1x128x128_256x64x64x256_16x16_32x32_1x1_16x16x1_16x16x1_1x32x1x8_8_1x1_intrawave_v1,423.67,1217.95,0.0
gfx950,256,626,8192,512,ck,18,0,11.5065,a8w8_blockscale_1x128x128_256x64x64x256_16x16_32x32_1x1_16x16x1_16x16x1_1x32x1x8_8_1x1_intrawave_v1,456.37,1283.73,0.0
gfx950,256,594,8192,512,ck,18,0,11.5066,a8w8_blockscale_1x128x128_256x64x64x256_16x16_32x32_1x1_16x16x1_16x16x1_1x32x1x8_8_1x1_intrawave_v1,433.04,1236.73,0.0
gfx950,256,232,8192,1536,ck,18,0,11.5075,a8w8_blockscale_1x128x128_256x64x64x256_16x16_32x32_1x1_16x16x1_16x16x1_1x32x1x8_8_1x1_intrawave_v1,507.36,1454.73,0.0
gfx950,256,637,8192,512,ck,18,0,11.5124,a8w8_blockscale_1x128x128_256x64x64x256_16x16_32x32_1x1_16x16x1_16x16x1_1x32x1x8_8_1x1_intrawave_v1,464.16,1299.21,0.0
gfx950,256,136,8192,1536,ck,18,0,11.5126,a8w8_blockscale_1x128x128_256x64x64x256_16x16_32x32_1x1_16x16x1_16x16x1_1x32x1x8_8_1x1_intrawave_v1,297.29,1304.66,0.0
gfx950,256,621,8192,512,ck,18,0,11.5133,a8w8_blockscale_1x128x128_256x64x64x256_16x16_32x32_1x1_16x16x1_16x16x1_1x32x1x8_8_1x1_intrawave_v1,452.46,1275.63,0.0
gfx950,256,629,8192,512,ck,18,0,11.5148,a8w8_blockscale_1x128x128_256x64x64x256_16x16_32x32_1x1_16x16x1_16x16x1_1x32x1x8_8_1x1_intrawave_v1,458.23,1287.2,0.0
gfx950,256,525,8192,512,ck,18,0,11.5179,a8w8_blockscale_1x128x128_256x64x64x256_16x16_32x32_1x1_16x16x1_16x16x1_1x32x1x8_8_1x1_intrawave_v1,382.36,1134.3,0.0
gfx950,256,596,8192,512,ck,18,0,11.52,a8w8_blockscale_1x128x128_256x64x64x256_16x16_32x32_1x1_16x16x1_16x16x1_1x32x1x8_8_1x1_intrawave_v1,433.99,1238.22,0.0
gfx950,256,607,8192,512,ck,18,0,11.52,a8w8_blockscale_1x128x128_256x64x64x256_16x16_32x32_1x1_16x16x1_16x16x1_1x32x1x8_8_1x1_intrawave_v1,442.0,1254.36,0.0
gfx950,256,586,8192,512,ck,18,0,11.5227,a8w8_blockscale_1x128x128_256x64x64x256_16x16_32x32_1x1_16x16x1_16x16x1_1x32x1x8_8_1x1_intrawave_v1,426.61,1223.27,0.0
gfx950,256,608,8192,512,ck,18,0,11.5253,a8w8_blockscale_1x128x128_256x64x64x256_16x16_32x32_1x1_16x16x1_16x16x1_1x32x1x8_8_1x1_intrawave_v1,442.53,1255.24,0.0
gfx950,256,605,8192,512,ck,18,0,11.5267,a8w8_blockscale_1x128x128_256x64x64x256_16x16_32x32_1x1_16x16x1_16x16x1_1x32x1x8_8_1x1_intrawave_v1,440.29,1250.69,0.0
gfx950,256,618,8192,512,ck,18,0,11.5316,a8w8_blockscale_1x128x128_256x64x64x256_16x16_32x32_1x1_16x16x1_16x16x1_1x32x1x8_8_1x1_intrawave_v1,449.56,1269.21,0.0
gfx950,256,592,8192,512,ck,18,0,11.5327,a8w8_blockscale_1x128x128_256x64x64x256_16x16_32x32_1x1_16x16x1_16x16x1_1x32x1x8_8_1x1_intrawave_v1,430.61,1231.0,0.0
gfx950,256,624,8192,512,ck,18,0,11.5395,a8w8_blockscale_1x128x128_256x64x64x256_16x16_32x32_1x1_16x16x1_16x16x1_1x32x1x8_8_1x1_intrawave_v1,453.62,1277.13,0.0
gfx950,256,600,8192,512,ck,18,0,11.5412,a8w8_blockscale_1x128x128_256x64x64x256_16x16_32x32_1x1_16x16x1_16x16x1_1x32x1x8_8_1x1_intrawave_v1,436.1,1241.8,0.0
gfx950,256,593,8192,512,ck,18,0,11.5413,a8w8_blockscale_1x128x128_256x64x64x256_16x16_32x32_1x1_16x16x1_16x16x1_1x32x1x8_8_1x1_intrawave_v1,431.01,1231.55,0.0
gfx950,256,623,8192,512,ck,18,0,11.5421,a8w8_blockscale_1x128x128_256x64x64x256_16x16_32x32_1x1_16x16x1_16x16x1_1x32x1x8_8_1x1_intrawave_v1,452.79,1275.38,0.0
gfx950,256,612,8192,512,ck,18,0,11.5591,a8w8_blockscale_1x128x128_256x64x64x256_16x16_32x32_1x1_16x16x1_16x16x1_1x32x1x8_8_1x1_intrawave_v1,444.14,1257.42,0.0
gfx950,256,617,8192,512,ck,18,0,11.5656,a8w8_blockscale_1x128x128_256x64x64x256_16x16_32x32_1x1_16x16x1_16x16x1_1x32x1x8_8_1x1_intrawave_v1,447.51,1264.02,0.0
gfx950,256,627,8192,512,ck,18,0,11.5677,a8w8_blockscale_1x128x128_256x64x64x256_16x16_32x32_1x1_16x16x1_16x16x1_1x32x1x8_8_1x1_intrawave_v1,454.68,1278.4,0.0
gfx950,256,622,8192,512,ck,18,0,11.5684,a8w8_blockscale_1x128x128_256x64x64x256_16x16_32x32_1x1_16x16x1_16x16x1_1x32x1x8_8_1x1_intrawave_v1,451.03,1271.02,0.0
gfx950,256,240,8192,1536,ck,18,0,11.5772,a8w8_blockscale_1x128x128_256x64x64x256_16x16_32x32_1x1_16x16x1_16x16x1_1x32x1x8_8_1x1_intrawave_v1,521.7,1458.36,0.0
gfx950,256,615,8192,512,ck,18,0,11.5772,a8w8_blockscale_1x128x128_256x64x64x256_16x16_32x32_1x1_16x16x1_16x16x1_1x32x1x8_8_1x1_intrawave_v1,445.62,1259.83,0.0
gfx950,256,556,8192,512,ck,18,0,11.6033,a8w8_blockscale_1x128x128_256x64x64x256_16x16_32x32_1x1_16x16x1_16x16x1_1x32x1x8_8_1x1_intrawave_v1,401.96,1171.09,0.0
gfx950,256,602,8192,512,ck,18,0,11.6211,a8w8_blockscale_1x128x128_256x64x64x256_16x16_32x32_1x1_16x16x1_16x16x1_1x32x1x8_8_1x1_intrawave_v1,434.55,1236.17,0.0
gfx950,256,640,8192,512,ck,18,0,11.6315,a8w8_blockscale_1x128x128_256x64x64x256_16x16_32x32_1x1_16x16x1_16x16x1_1x32x1x8_8_1x1_intrawave_v1,461.57,1290.27,0.0
gfx950,256,570,8192,512,ck,18,0,11.8307,a8w8_blockscale_1x128x128_256x64x64x256_16x16_32x32_1x1_16x16x1_16x16x1_1x32x1x8_8_1x1_intrawave_v1,404.16,1168.57,0.0
gfx950,256,1015,128,7168,ck,8,2,11.8456,a8w8_blockscale_1x128x128_256x16x64x256_16x16_16x16_1x1_16x16x1_16x16x1_1x16x1x16_4_1x1_intrawave_v1,157.23,713.59,0.0
gfx950,256,651,8192,512,ck,18,0,12.4808,a8w8_blockscale_1x128x128_256x64x64x256_16x16_32x32_1x1_16x16x1_16x16x1_1x32x1x8_8_1x1_intrawave_v1,437.55,1217.36,0.0
gfx950,256,679,8192,512,ck,18,0,12.4824,a8w8_blockscale_1x128x128_256x64x64x256_16x16_32x32_1x1_16x16x1_16x16x1_1x32x1x8_8_1x1_intrawave_v1,456.31,1255.1,0.0
gfx950,256,654,8192,512,ck,18,0,12.4829,a8w8_blockscale_1x128x128_256x64x64x256_16x16_32x32_1x1_16x16x1_16x16x1_1x32x1x8_8_1x1_intrawave_v1,439.49,1221.21,0.0
gfx950,256,652,8192,512,ck,18,0,12.4923,a8w8_blockscale_1x128x128_256x64x64x256_16x16_32x32_1x1_16x16x1_16x16x1_1x32x1x8_8_1x1_intrawave_v1,437.82,1217.59,0.0
gfx950,256,643,8192,512,ck,18,0,12.4991,a8w8_blockscale_1x128x128_256x64x64x256_16x16_32x32_1x1_16x16x1_16x16x1_1x32x1x8_8_1x1_intrawave_v1,431.54,1204.76,0.0
gfx950,256,667,8192,512,ck,18,0,12.5004,a8w8_blockscale_1x128x128_256x64x64x256_16x16_32x32_1x1_16x16x1_16x16x1_1x32x1x8_8_1x1_intrawave_v1,447.6,1237.08,0.0
gfx950,256,681,8192,512,ck,18,0,12.505,a8w8_blockscale_1x128x128_256x64x64x256_16x16_32x32_1x1_16x16x1_16x16x1_1x32x1x8_8_1x1_intrawave_v1,456.83,1255.54,0.0
gfx950,256,655,8192,512,ck,18,0,12.5066,a8w8_blockscale_1x128x128_256x64x64x256_16x16_32x32_1x1_16x16x1_16x16x1_1x32x1x8_8_1x1_intrawave_v1,439.33,1220.25,0.0
gfx950,256,672,8192,512,ck,18,0,12.5102,a8w8_blockscale_1x128x128_256x64x64x256_16x16_32x32_1x1_16x16x1_16x16x1_1x32x1x8_8_1x1_intrawave_v1,450.6,1242.86,0.0
gfx950,256,668,8192,512,ck,18,0,12.5171,a8w8_blockscale_1x128x128_256x64x64x256_16x16_32x32_1x1_16x16x1_16x16x1_1x32x1x8_8_1x1_intrawave_v1,447.67,1236.77,0.0
gfx950,256,703,8192,512,ck,18,0,12.5174,a8w8_blockscale_1x128x128_256x64x64x256_16x16_32x32_1x1_16x16x1_16x16x1_1x32x1x8_8_1x1_intrawave_v1,471.12,1283.99,0.0
gfx950,256,649,8192,512,ck,18,0,12.5179,a8w8_blockscale_1x128x128_256x64x64x256_16x16_32x32_1x1_16x16x1_16x16x1_1x32x1x8_8_1x1_intrawave_v1,434.91,1211.05,0.0
gfx950,256,646,8192,512,ck,18,0,12.5187,a8w8_blockscale_1x128x128_256x64x64x256_16x16_32x32_1x1_16x16x1_16x16x1_1x32x1x8_8_1x1_intrawave_v1,432.88,1206.92,0.0
gfx950,256,676,8192,512,ck,18,0,12.5207,a8w8_blockscale_1x128x128_256x64x64x256_16x16_32x32_1x1_16x16x1_16x16x1_1x32x1x8_8_1x1_intrawave_v1,452.91,1247.21,0.0
gfx950,256,657,8192,512,ck,18,0,12.5229,a8w8_blockscale_1x128x128_256x64x64x256_16x16_32x32_1x1_16x16x1_16x16x1_1x32x1x8_8_1x1_intrawave_v1,440.1,1221.36,0.0
gfx950,256,665,8192,512,ck,18,0,12.5275,a8w8_blockscale_1x128x128_256x64x64x256_16x16_32x32_1x1_16x16x1_16x16x1_1x32x1x8_8_1x1_intrawave_v1,445.29,1231.7,0.0
gfx950,256,663,8192,512,ck,18,0,12.5279,a8w8_blockscale_1x128x128_256x64x64x256_16x16_32x32_1x1_16x16x1_16x16x1_1x32x1x8_8_1x1_intrawave_v1,443.94,1228.97,0.0
gfx950,256,682,8192,512,ck,18,0,12.5356,a8w8_blockscale_1x128x128_256x64x64x256_16x16_32x32_1x1_16x16x1_16x16x1_1x32x1x8_8_1x1_intrawave_v1,456.38,1253.82,0.0
gfx950,256,683,8192,512,ck,18,0,12.5464,a8w8_blockscale_1x128x128_256x64x64x256_16x16_32x32_1x1_16x16x1_16x16x1_1x32x1x8_8_1x1_intrawave_v1,456.66,1254.09,0.0
gfx950,256,673,8192,512,ck,18,0,12.5497,a8w8_blockscale_1x128x128_256x64x64x256_16x16_32x32_1x1_16x16x1_16x16x1_1x32x1x8_8_1x1_intrawave_v1,449.85,1240.29,0.0
gfx950,256,659,8192,512,ck,18,0,12.555,a8w8_blockscale_1x128x128_256x64x64x256_16x16_32x32_1x1_16x16x1_16x16x1_1x32x1x8_8_1x1_intrawave_v1,440.31,1220.93,0.0
gfx950,256,690,8192,512,ck,18,0,12.5566,a8w8_blockscale_1x128x128_256x64x64x256_16x16_32x32_1x1_16x16x1_16x16x1_1x32x1x8_8_1x1_intrawave_v1,460.96,1262.49,0.0
gfx950,256,658,8192,512,ck,18,0,12.5571,a8w8_blockscale_1x128x128_256x64x64x256_16x16_32x32_1x1_16x16x1_16x16x1_1x32x1x8_8_1x1_intrawave_v1,439.57,1219.38,0.0
gfx950,256,656,8192,512,ck,18,0,12.5581,a8w8_blockscale_1x128x128_256x64x64x256_16x16_32x32_1x1_16x16x1_16x16x1_1x32x1x8_8_1x1_intrawave_v1,438.2,1216.59,0.0
gfx950,256,684,8192,512,ck,18,0,12.5722,a8w8_blockscale_1x128x128_256x64x64x256_16x16_32x32_1x1_16x16x1_16x16x1_1x32x1x8_8_1x1_intrawave_v1,456.39,1252.86,0.0
gfx950,256,669,8192,512,ck,18,0,12.5814,a8w8_blockscale_1x128x128_256x64x64x256_16x16_32x32_1x1_16x16x1_16x16x1_1x32x1x8_8_1x1_intrawave_v1,446.05,1231.8,0.0
gfx950,256,689,8192,512,ck,18,0,12.5826,a8w8_blockscale_1x128x128_256x64x64x256_16x16_32x32_1x1_16x16x1_16x16x1_1x32x1x8_8_1x1_intrawave_v1,459.34,1258.54,0.0
gfx950,256,701,8192,512,ck,18,0,12.6038,a8w8_blockscale_1x128x128_256x64x64x256_16x16_32x32_1x1_16x16x1_16x16x1_1x32x1x8_8_1x1_intrawave_v1,466.56,1272.51,0.0
gfx950,256,694,8192,512,ck,18,0,12.6126,a8w8_blockscale_1x128x128_256x64x64x256_16x16_32x32_1x1_16x16x1_16x16x1_1x32x1x8_8_1x1_intrawave_v1,461.58,1262.24,0.0
gfx950,256,645,8192,512,ck,18,0,12.6185,a8w8_blockscale_1x128x128_256x64x64x256_16x16_32x32_1x1_16x16x1_16x16x1_1x32x1x8_8_1x1_intrawave_v1,428.79,1196.04,0.0
gfx950,256,700,8192,512,ck,18,0,12.6197,a8w8_blockscale_1x128x128_256x64x64x256_16x16_32x32_1x1_16x16x1_16x16x1_1x32x1x8_8_1x1_intrawave_v1,465.31,1269.56,0.0
gfx950,256,691,8192,512,ck,18,0,12.6445,a8w8_blockscale_1x128x128_256x64x64x256_16x16_32x32_1x1_16x16x1_16x16x1_1x32x1x8_8_1x1_intrawave_v1,458.42,1255.05,0.0
gfx950,256,704,8192,512,ck,17,0,12.6635,a8w8_blockscale_1x128x128_256x64x128x256_16x16_32x32_2x1_16x16x1_16x16x1_1x32x1x8_8_1x1_intrawave_v1,466.35,1270.51,0.0
gfx950,256,712,8192,512,ck,18,0,12.7659,a8w8_blockscale_1x128x128_256x64x64x256_16x16_32x32_1x1_16x16x1_16x16x1_1x32x1x8_8_1x1_intrawave_v1,467.86,1270.91,0.0
gfx950,256,715,8192,512,ck,18,0,12.7719,a8w8_blockscale_1x128x128_256x64x64x256_16x16_32x32_1x1_16x16x1_16x16x1_1x32x1x8_8_1x1_intrawave_v1,469.61,1274.28,0.0
gfx950,256,714,8192,512,ck,18,0,12.7817,a8w8_blockscale_1x128x128_256x64x64x256_16x16_32x32_1x1_16x16x1_16x16x1_1x32x1x8_8_1x1_intrawave_v1,468.6,1271.98,0.0
gfx950,256,707,8192,512,ck,18,0,12.7981,a8w8_blockscale_1x128x128_256x64x64x256_16x16_32x32_1x1_16x16x1_16x16x1_1x32x1x8_8_1x1_intrawave_v1,463.41,1261.11,0.0
gfx950,256,728,8192,512,ck,18,0,12.8032,a8w8_blockscale_1x128x128_256x64x64x256_16x16_32x32_1x1_16x16x1_16x16x1_1x32x1x8_8_1x1_intrawave_v1,476.98,1288.32,0.0
gfx950,256,713,8192,512,ck,18,0,12.81,a8w8_blockscale_1x128x128_256x64x64x256_16x16_32x32_1x1_16x16x1_16x16x1_1x32x1x8_8_1x1_intrawave_v1,466.91,1267.85,0.0
gfx950,256,670,8192,512,ck,18,0,12.8147,a8w8_blockscale_1x128x128_256x64x64x256_16x16_32x32_1x1_16x16x1_16x16x1_1x32x1x8_8_1x1_intrawave_v1,438.59,1210.69,0.0
gfx950,256,717,8192,512,ck,18,0,12.8222,a8w8_blockscale_1x128x128_256x64x64x256_16x16_32x32_1x1_16x16x1_16x16x1_1x32x1x8_8_1x1_intrawave_v1,469.08,1271.91,0.0
gfx950,256,724,8192,512,ck,18,0,12.8444,a8w8_blockscale_1x128x128_256x64x64x256_16x16_32x32_1x1_16x16x1_16x16x1_1x32x1x8_8_1x1_intrawave_v1,472.84,1278.92,0.0
gfx950,256,732,8192,512,ck,18,0,12.8479,a8w8_blockscale_1x128x128_256x64x64x256_16x16_32x32_1x1_16x16x1_16x16x1_1x32x1x8_8_1x1_intrawave_v1,477.93,1289.1,0.0
gfx950,256,710,8192,512,ck,18,0,12.849,a8w8_blockscale_1x128x128_256x64x64x256_16x16_32x32_1x1_16x16x1_16x16x1_1x32x1x8_8_1x1_intrawave_v1,463.53,1260.06,0.0
gfx950,256,764,8192,512,ck,18,0,12.8513,a8w8_blockscale_1x128x128_256x64x64x256_16x16_32x32_1x1_16x16x1_16x16x1_1x32x1x8_8_1x1_intrawave_v1,498.7,1330.83,0.0
gfx950,256,733,8192,512,ck,18,0,12.856,a8w8_blockscale_1x128x128_256x64x64x256_16x16_32x32_1x1_16x16x1_16x16x1_1x32x1x8_8_1x1_intrawave_v1,478.29,1289.6,0.0
gfx950,256,726,8192,512,ck,18,0,12.856,a8w8_blockscale_1x128x128_256x64x64x256_16x16_32x32_1x1_16x16x1_16x16x1_1x32x1x8_8_1x1_intrawave_v1,473.72,1280.4,0.0
gfx950,256,765,8192,512,ck,18,0,12.8621,a8w8_blockscale_1x128x128_256x64x64x256_16x16_32x32_1x1_16x16x1_16x16x1_1x32x1x8_8_1x1_intrawave_v1,498.93,1331.02,0.0
gfx950,256,729,8192,512,ck,18,0,12.8659,a8w8_blockscale_1x128x128_256x64x64x256_16x16_32x32_1x1_16x16x1_16x16x1_1x32x1x8_8_1x1_intrawave_v1,475.31,1283.35,0.0
gfx950,256,755,8192,512,ck,18,0,12.8717,a8w8_blockscale_1x128x128_256x64x64x256_16x16_32x32_1x1_16x16x1_16x16x1_1x32x1x8_8_1x1_intrawave_v1,492.04,1316.9,0.0
gfx950,256,759,8192,512,ck,18,0,12.8726,a8w8_blockscale_1x128x128_256x64x64x256_16x16_32x32_1x1_16x16x1_16x16x1_1x32x1x8_8_1x1_intrawave_v1,494.61,1322.06,0.0
gfx950,256,718,8192,512,ck,18,0,12.8727,a8w8_blockscale_1x128x128_256x64x64x256_16x16_32x32_1x1_16x16x1_16x16x1_1x32x1x8_8_1x1_intrawave_v1,467.89,1268.24,0.0
gfx950,256,716,8192,512,ck,18,0,12.8856,a8w8_blockscale_1x128x128_256x64x64x256_16x16_32x32_1x1_16x16x1_16x16x1_1x32x1x8_8_1x1_intrawave_v1,466.12,1264.34,0.0
gfx950,256,758,8192,512,ck,18,0,12.8872,a8w8_blockscale_1x128x128_256x64x64x256_16x16_32x32_1x1_16x16x1_16x16x1_1x32x1x8_8_1x1_intrawave_v1,493.4,1319.25,0.0
gfx950,256,734,8192,512,ck,18,0,12.8873,a8w8_blockscale_1x128x128_256x64x64x256_16x16_32x32_1x1_16x16x1_16x16x1_1x32x1x8_8_1x1_intrawave_v1,477.78,1287.78,0.0
gfx950,256,760,8192,512,ck,18,0,12.8913,a8w8_blockscale_1x128x128_256x64x64x256_16x16_32x32_1x1_16x16x1_16x16x1_1x32x1x8_8_1x1_intrawave_v1,494.55,1321.45,0.0
gfx950,256,1009,128,7168,ck,7,2,12.8939,a8w8_blockscale_1x128x128_256x16x128x256_16x16_16x16_1x2_16x16x1_16x16x1_1x16x1x16_8_1x2_intrawave_v1,143.6,652.12,0.0
gfx950,256,753,8192,512,ck,18,0,12.8942,a8w8_blockscale_1x128x128_256x64x64x256_16x16_32x32_1x1_16x16x1_16x16x1_1x32x1x8_8_1x1_intrawave_v1,489.88,1311.98,0.0
gfx950,256,746,8192,512,ck,18,0,12.8945,a8w8_blockscale_1x128x128_256x64x64x256_16x16_32x32_1x1_16x16x1_16x16x1_1x32x1x8_8_1x1_intrawave_v1,485.32,1302.78,0.0
gfx950,256,739,8192,512,ck,18,0,12.9076,a8w8_blockscale_1x128x128_256x64x64x256_16x16_32x32_1x1_16x16x1_16x16x1_1x32x1x8_8_1x1_intrawave_v1,480.27,1292.3,0.0
gfx950,256,738,8192,512,ck,18,0,12.9095,a8w8_blockscale_1x128x128_256x64x64x256_16x16_32x32_1x1_16x16x1_16x16x1_1x32x1x8_8_1x1_intrawave_v1,479.55,1290.8,0.0
gfx950,256,748,8192,512,ck,18,0,12.9175,a8w8_blockscale_1x128x128_256x64x64x256_16x16_32x32_1x1_16x16x1_16x16x1_1x32x1x8_8_1x1_intrawave_v1,485.75,1303.08,0.0
gfx950,256,719,8192,512,ck,18,0,12.9273,a8w8_blockscale_1x128x128_256x64x64x256_16x16_32x32_1x1_16x16x1_16x16x1_1x32x1x8_8_1x1_intrawave_v1,466.56,1264.19,0.0
gfx950,256,743,8192,512,ck,18,0,12.931,a8w8_blockscale_1x128x128_256x64x64x256_16x16_32x32_1x1_16x16x1_16x16x1_1x32x1x8_8_1x1_intrawave_v1,482.0,1295.18,0.0
gfx950,256,1023,128,7168,ck,18,2,13.0101,a8w8_blockscale_1x128x128_256x64x64x256_16x16_32x32_1x1_16x16x1_16x16x1_1x32x1x8_8_1x1_intrawave_v1,144.29,654.28,0.0
gfx950,256,352,6144,1536,ck,18,0,13.791,a8w8_blockscale_1x128x128_256x64x64x256_16x16_32x32_1x1_16x16x1_16x16x1_1x32x1x8_8_1x1_intrawave_v1,481.75,1037.14,0.0
gfx950,256,814,8192,512,ck,18,0,13.8472,a8w8_blockscale_1x128x128_256x64x64x256_16x16_32x32_1x1_16x16x1_16x16x1_1x32x1x8_8_1x1_intrawave_v1,493.12,1296.12,0.0
gfx950,256,24,7168,4096,ck,8,0,13.8633,a8w8_blockscale_1x128x128_256x16x64x256_16x16_16x16_1x1_16x16x1_16x16x1_1x16x1x16_4_1x1_intrawave_v1,101.66,2149.74,0.0
gfx950,256,336,6144,1536,ck,18,0,13.8659,a8w8_blockscale_1x128x128_256x64x64x256_16x16_32x32_1x1_16x16x1_16x16x1_1x32x1x8_8_1x1_intrawave_v1,457.37,1015.59,0.0
gfx950,256,783,8192,512,ck,18,0,13.8674,a8w8_blockscale_1x128x128_256x64x64x256_16x16_32x32_1x1_16x16x1_16x16x1_1x32x1x8_8_1x1_intrawave_v1,473.65,1256.46,0.0
gfx950,256,811,8192,512,ck,18,0,13.8759,a8w8_blockscale_1x128x128_256x64x64x256_16x16_32x32_1x1_16x16x1_16x16x1_1x32x1x8_8_1x1_intrawave_v1,490.29,1289.79,0.0
gfx950,256,784,8192,512,ck,18,0,13.8933,a8w8_blockscale_1x128x128_256x64x64x256_16x16_32x32_1x1_16x16x1_16x16x1_1x32x1x8_8_1x1_intrawave_v1,473.37,1255.34,0.0
gfx950,256,816,8192,512,ck,18,0,13.8976,a8w8_blockscale_1x128x128_256x64x64x256_16x16_32x32_1x1_16x16x1_16x16x1_1x32x1x8_8_1x1_intrawave_v1,492.54,1293.85,0.0
gfx950,256,797,8192,512,ck,18,0,13.9026,a8w8_blockscale_1x128x128_256x64x64x256_16x16_32x32_1x1_16x16x1_16x16x1_1x32x1x8_8_1x1_intrawave_v1,480.9,1270.3,0.0
gfx950,256,795,8192,512,ck,18,0,13.9073,a8w8_blockscale_1x128x128_256x64x64x256_16x16_32x32_1x1_16x16x1_16x16x1_1x32x1x8_8_1x1_intrawave_v1,479.53,1267.44,0.0
gfx950,256,805,8192,512,ck,18,0,13.9147,a8w8_blockscale_1x128x128_256x64x64x256_16x16_32x32_1x1_16x16x1_16x16x1_1x32x1x8_8_1x1_intrawave_v1,485.3,1278.91,0.0
gfx950,256,801,8192,512,ck,18,0,13.9159,a8w8_blockscale_1x128x128_256x64x64x256_16x16_32x32_1x1_16x16x1_16x16x1_1x32x1x8_8_1x1_intrawave_v1,482.85,1273.94,0.0
gfx950,256,775,8192,512,ck,18,0,13.916,a8w8_blockscale_1x128x128_256x64x64x256_16x16_32x32_1x1_16x16x1_16x16x1_1x32x1x8_8_1x1_intrawave_v1,467.17,1242.36,0.0
gfx950,256,782,8192,512,ck,18,0,13.9209,a8w8_blockscale_1x128x128_256x64x64x256_16x16_32x32_1x1_16x16x1_16x16x1_1x32x1x8_8_1x1_intrawave_v1,471.23,1250.42,0.0
gfx950,256,773,8192,512,ck,18,0,13.9216,a8w8_blockscale_1x128x128_256x64x64x256_16x16_32x32_1x1_16x16x1_16x16x1_1x32x1x8_8_1x1_intrawave_v1,465.78,1239.43,0.0
gfx950,256,800,8192,512,ck,18,0,13.9297,a8w8_blockscale_1x128x128_256x64x64x256_16x16_32x32_1x1_16x16x1_16x16x1_1x32x1x8_8_1x1_intrawave_v1,481.77,1271.46,0.0
gfx950,256,786,8192,512,ck,18,0,13.9298,a8w8_blockscale_1x128x128_256x64x64x256_16x16_32x32_1x1_16x16x1_16x16x1_1x32x1x8_8_1x1_intrawave_v1,473.33,1254.47,0.0
gfx950,256,772,8192,512,ck,18,0,13.9319,a8w8_blockscale_1x128x128_256x64x64x256_16x16_32x32_1x1_16x16x1_16x16x1_1x32x1x8_8_1x1_intrawave_v1,464.83,1237.31,0.0
gfx950,256,793,8192,512,ck,18,0,13.9381,a8w8_blockscale_1x128x128_256x64x64x256_16x16_32x32_1x1_16x16x1_16x16x1_1x32x1x8_8_1x1_intrawave_v1,477.26,1262.21,0.0
gfx950,256,825,8192,512,ck,18,0,13.9439,a8w8_blockscale_1x128x128_256x64x64x256_16x16_32x32_1x1_16x16x1_16x16x1_1x32x1x8_8_1x1_intrawave_v1,496.32,1300.46,0.0
gfx950,256,807,8192,512,ck,18,0,13.9461,a8w8_blockscale_1x128x128_256x64x64x256_16x16_32x32_1x1_16x16x1_16x16x1_1x32x1x8_8_1x1_intrawave_v1,485.41,1278.45,0.0
gfx950,256,815,8192,512,ck,18,0,13.9591,a8w8_blockscale_1x128x128_256x64x64x256_16x16_32x32_1x1_16x16x1_16x16x1_1x32x1x8_8_1x1_intrawave_v1,489.77,1286.94,0.0
gfx950,256,794,8192,512,ck,18,0,13.9601,a8w8_blockscale_1x128x128_256x64x64x256_16x16_32x32_1x1_16x16x1_16x16x1_1x32x1x8_8_1x1_intrawave_v1,477.11,1261.43,0.0
gfx950,256,368,6144,1536,ck,18,0,13.963,a8w8_blockscale_1x128x128_256x64x64x256_16x16_32x32_1x1_16x16x1_16x16x1_1x32x1x8_8_1x1_intrawave_v1,497.44,1040.21,0.0
gfx950,256,829,8192,512,ck,18,0,13.964,a8w8_blockscale_1x128x128_256x64x64x256_16x16_32x32_1x1_16x16x1_16x16x1_1x32x1x8_8_1x1_intrawave_v1,498.01,1303.43,0.0
gfx950,256,824,8192,512,ck,18,0,13.9646,a8w8_blockscale_1x128x128_256x64x64x256_16x16_32x32_1x1_16x16x1_16x16x1_1x32x1x8_8_1x1_intrawave_v1,494.98,1297.32,0.0
gfx950,256,792,8192,512,ck,18,0,13.9648,a8w8_blockscale_1x128x128_256x64x64x256_16x16_32x32_1x1_16x16x1_16x16x1_1x32x1x8_8_1x1_intrawave_v1,475.75,1258.59,0.0
gfx950,256,777,8192,512,ck,18,0,13.9696,a8w8_blockscale_1x128x128_256x64x64x256_16x16_32x32_1x1_16x16x1_16x16x1_1x32x1x8_8_1x1_intrawave_v1,466.58,1240.01,0.0
gfx950,256,384,6144,1536,ck,18,0,13.9746,a8w8_blockscale_1x128x128_256x64x64x256_16x16_32x32_1x1_16x16x1_16x16x1_1x32x1x8_8_1x1_intrawave_v1,518.64,1055.17,0.0
gfx950,256,799,8192,512,ck,18,0,13.9767,a8w8_blockscale_1x128x128_256x64x64x256_16x16_32x32_1x1_16x16x1_16x16x1_1x32x1x8_8_1x1_intrawave_v1,479.55,1265.98,0.0
gfx950,256,822,8192,512,ck,18,0,13.9769,a8w8_blockscale_1x128x128_256x64x64x256_16x16_32x32_1x1_16x16x1_16x16x1_1x32x1x8_8_1x1_intrawave_v1,493.35,1293.76,0.0
gfx950,256,818,8192,512,ck,18,0,13.9791,a8w8_blockscale_1x128x128_256x64x64x256_16x16_32x32_1x1_16x16x1_16x16x1_1x32x1x8_8_1x1_intrawave_v1,490.87,1288.73,0.0
gfx950,256,803,8192,512,ck,18,0,13.9808,a8w8_blockscale_1x128x128_256x64x64x256_16x16_32x32_1x1_16x16x1_16x16x1_1x32x1x8_8_1x1_intrawave_v1,481.81,1270.44,0.0
gfx950,256,831,8192,512,ck,18,0,13.9834,a8w8_blockscale_1x128x128_256x64x64x256_16x16_32x32_1x1_16x16x1_16x16x1_1x32x1x8_8_1x1_intrawave_v1,498.51,1304.04,0.0
gfx950,256,788,8192,512,ck,18,0,13.9898,a8w8_blockscale_1x128x128_256x64x64x256_16x16_32x32_1x1_16x16x1_16x16x1_1x32x1x8_8_1x1_intrawave_v1,472.5,1251.51,0.0
gfx950,256,821,8192,512,ck,18,0,13.9902,a8w8_blockscale_1x128x128_256x64x64x256_16x16_32x32_1x1_16x16x1_16x16x1_1x32x1x8_8_1x1_intrawave_v1,492.28,1291.33,0.0
gfx950,256,819,8192,512,ck,18,0,13.9996,a8w8_blockscale_1x128x128_256x64x64x256_16x16_32x32_1x1_16x16x1_16x16x1_1x32x1x8_8_1x1_intrawave_v1,490.75,1288.05,0.0
gfx950,256,828,8192,512,ck,18,0,14.0074,a8w8_blockscale_1x128x128_256x64x64x256_16x16_32x32_1x1_16x16x1_16x16x1_1x32x1x8_8_1x1_intrawave_v1,495.86,1298.18,0.0
gfx950,256,833,8192,512,ck,18,0,14.2164,a8w8_blockscale_1x128x128_256x64x64x256_16x16_32x32_1x1_16x16x1_16x16x1_1x32x1x8_8_1x1_intrawave_v1,491.52,1285.04,0.0
gfx950,256,865,8192,512,ck,18,0,14.2478,a8w8_blockscale_1x128x128_256x64x64x256_16x16_32x32_1x1_16x16x1_16x16x1_1x32x1x8_8_1x1_intrawave_v1,509.28,1320.16,0.0
gfx950,256,869,8192,512,ck,18,0,14.2522,a8w8_blockscale_1x128x128_256x64x64x256_16x16_32x32_1x1_16x16x1_16x16x1_1x32x1x8_8_1x1_intrawave_v1,511.48,1324.49,0.0
gfx950,256,873,8192,512,ck,18,0,14.255,a8w8_blockscale_1x128x128_256x64x64x256_16x16_32x32_1x1_16x16x1_16x16x1_1x32x1x8_8_1x1_intrawave_v1,513.73,1328.97,0.0
gfx950,256,889,8192,512,ck,18,0,14.2564,a8w8_blockscale_1x128x128_256x64x64x256_16x16_32x32_1x1_16x16x1_16x16x1_1x32x1x8_8_1x1_intrawave_v1,523.1,1347.81,0.0
gfx950,256,895,8192,512,ck,18,0,14.2704,a8w8_blockscale_1x128x128_256x64x64x256_16x16_32x32_1x1_16x16x1_16x16x1_1x32x1x8_8_1x1_intrawave_v1,526.11,1353.59,0.0
gfx950,256,882,8192,512,ck,18,0,14.2749,a8w8_blockscale_1x128x128_256x64x64x256_16x16_32x32_1x1_16x16x1_16x16x1_1x32x1x8_8_1x1_intrawave_v1,518.31,1337.77,0.0
gfx950,256,858,8192,512,ck,18,0,14.2825,a8w8_blockscale_1x128x128_256x64x64x256_16x16_32x32_1x1_16x16x1_16x16x1_1x32x1x8_8_1x1_intrawave_v1,503.93,1308.67,0.0
gfx950,256,855,8192,512,ck,18,0,14.2857,a8w8_blockscale_1x128x128_256x64x64x256_16x16_32x32_1x1_16x16x1_16x16x1_1x32x1x8_8_1x1_intrawave_v1,502.06,1304.83,0.0
gfx950,256,880,8192,512,ck,18,0,14.2929,a8w8_blockscale_1x128x128_256x64x64x256_16x16_32x32_1x1_16x16x1_16x16x1_1x32x1x8_8_1x1_intrawave_v1,516.48,1333.72,0.0
gfx950,256,866,8192,512,ck,18,0,14.2929,a8w8_blockscale_1x128x128_256x64x64x256_16x16_32x32_1x1_16x16x1_16x16x1_1x32x1x8_8_1x1_intrawave_v1,508.26,1317.17,0.0
gfx950,256,872,8192,512,ck,18,0,14.2933,a8w8_blockscale_1x128x128_256x64x64x256_16x16_32x32_1x1_16x16x1_16x16x1_1x32x1x8_8_1x1_intrawave_v1,511.77,1324.23,0.0
gfx950,256,846,8192,512,ck,18,0,14.2952,a8w8_blockscale_1x128x128_256x64x64x256_16x16_32x32_1x1_16x16x1_16x16x1_1x32x1x8_8_1x1_intrawave_v1,496.44,1293.32,0.0
gfx950,256,863,8192,512,ck,18,0,14.3012,a8w8_blockscale_1x128x128_256x64x64x256_16x16_32x32_1x1_16x16x1_16x16x1_1x32x1x8_8_1x1_intrawave_v1,506.21,1312.87,0.0
gfx950,256,839,8192,512,ck,18,0,14.3072,a8w8_blockscale_1x128x128_256x64x64x256_16x16_32x32_1x1_16x16x1_16x16x1_1x32x1x8_8_1x1_intrawave_v1,491.92,1283.97,0.0
gfx950,256,842,8192,512,ck,18,0,14.3106,a8w8_blockscale_1x128x128_256x64x64x256_16x16_32x32_1x1_16x16x1_16x16x1_1x32x1x8_8_1x1_intrawave_v1,493.56,1287.21,0.0
gfx950,256,894,8192,512,ck,18,0,14.3129,a8w8_blockscale_1x128x128_256x64x64x256_16x16_32x32_1x1_16x16x1_16x16x1_1x32x1x8_8_1x1_intrawave_v1,523.96,1348.39,0.0
gfx950,256,870,8192,512,ck,18,0,14.3149,a8w8_blockscale_1x128x128_256x64x64x256_16x16_32x32_1x1_16x16x1_16x16x1_1x32x1x8_8_1x1_intrawave_v1,509.82,1319.87,0.0
gfx950,256,852,8192,512,ck,18,0,14.3244,a8w8_blockscale_1x128x128_256x64x64x256_16x16_32x32_1x1_16x16x1_16x16x1_1x32x1x8_8_1x1_intrawave_v1,498.95,1297.76,0.0
gfx950,256,850,8192,512,ck,18,0,14.3275,a8w8_blockscale_1x128x128_256x64x64x256_16x16_32x32_1x1_16x16x1_16x16x1_1x32x1x8_8_1x1_intrawave_v1,497.67,1295.13,0.0
gfx950,256,892,8192,512,ck,18,0,14.3298,a8w8_blockscale_1x128x128_256x64x64x256_16x16_32x32_1x1_16x16x1_16x16x1_1x32x1x8_8_1x1_intrawave_v1,522.17,1344.44,0.0
gfx950,256,861,8192,512,ck,18,0,14.3375,a8w8_blockscale_1x128x128_256x64x64x256_16x16_32x32_1x1_16x16x1_16x16x1_1x32x1x8_8_1x1_intrawave_v1,503.76,1307.18,0.0
gfx950,256,847,8192,512,ck,18,0,14.3419,a8w8_blockscale_1x128x128_256x64x64x256_16x16_32x32_1x1_16x16x1_16x16x1_1x32x1x8_8_1x1_intrawave_v1,495.41,1290.29,0.0
gfx950,256,272,8192,1536,ck,18,0,14.347,a8w8_blockscale_1x128x128_256x64x64x256_16x16_32x32_1x1_16x16x1_16x16x1_1x32x1x8_8_1x1_intrawave_v1,477.11,1216.78,0.0
gfx950,256,890,8192,512,ck,18,0,14.3489,a8w8_blockscale_1x128x128_256x64x64x256_16x16_32x32_1x1_16x16x1_16x16x1_1x32x1x8_8_1x1_intrawave_v1,520.31,1340.29,0.0
gfx950,256,875,8192,512,ck,18,0,14.3495,a8w8_blockscale_1x128x128_256x64x64x256_16x16_32x32_1x1_16x16x1_16x16x1_1x32x1x8_8_1x1_intrawave_v1,511.52,1322.58,0.0
gfx950,256,867,8192,512,ck,18,0,14.3498,a8w8_blockscale_1x128x128_256x64x64x256_16x16_32x32_1x1_16x16x1_16x16x1_1x32x1x8_8_1x1_intrawave_v1,506.83,1313.13,0.0
gfx950,256,860,8192,512,ck,18,0,14.3654,a8w8_blockscale_1x128x128_256x64x64x256_16x16_32x32_1x1_16x16x1_16x16x1_1x32x1x8_8_1x1_intrawave_v1,502.19,1303.47,0.0
gfx950,256,859,8192,512,ck,18,0,14.3712,a8w8_blockscale_1x128x128_256x64x64x256_16x16_32x32_1x1_16x16x1_16x16x1_1x32x1x8_8_1x1_intrawave_v1,501.41,1301.77,0.0
gfx950,256,400,6144,1536,ck,18,0,14.3732,a8w8_blockscale_1x128x128_256x64x64x256_16x16_32x32_1x1_16x16x1_16x16x1_1x32x1x8_8_1x1_intrawave_v1,525.27,1041.3,0.0
gfx950,256,837,8192,512,ck,18,0,14.3742,a8w8_blockscale_1x128x128_256x64x64x256_16x16_32x32_1x1_16x16x1_16x16x1_1x32x1x8_8_1x1_intrawave_v1,488.46,1275.64,0.0
gfx950,256,883,8192,512,ck,18,0,14.3771,a8w8_blockscale_1x128x128_256x64x64x256_16x16_32x32_1x1_16x16x1_16x16x1_1x32x1x8_8_1x1_intrawave_v1,515.2,1329.44,0.0
gfx950,256,1047,128,7168,ck,8,2,14.3777,a8w8_blockscale_1x128x128_256x16x64x256_16x16_16x16_1x1_16x16x1_16x16x1_1x16x1x16_4_1x1_intrawave_v1,133.63,604.44,0.0
gfx950,256,416,6144,1536,ck,18,0,14.3952,a8w8_blockscale_1x128x128_256x64x64x256_16x16_32x32_1x1_16x16x1_16x16x1_1x32x1x8_8_1x1_intrawave_v1,545.44,1055.07,0.0
gfx950,256,868,8192,512,ck,18,0,14.3975,a8w8_blockscale_1x128x128_256x64x64x256_16x16_32x32_1x1_16x16x1_16x16x1_1x32x1x8_8_1x1_intrawave_v1,505.73,1309.95,0.0
gfx950,256,884,8192,512,ck,18,0,14.4344,a8w8_blockscale_1x128x128_256x64x64x256_16x16_32x32_1x1_16x16x1_16x16x1_1x32x1x8_8_1x1_intrawave_v1,513.74,1325.33,0.0
gfx950,256,1003,128,7168,ck,7,2,14.4957,a8w8_blockscale_1x128x128_256x16x128x256_16x16_16x16_1x2_16x16x1_16x16x1_1x16x1x16_8_1x2_intrawave_v1,126.97,576.98,0.0
gfx950,256,1265,128,7168,ck,8,2,14.5029,a8w8_blockscale_1x128x128_256x16x64x256_16x16_16x16_1x1_16x16x1_16x16x1_1x16x1x16_4_1x1_intrawave_v1,160.06,710.81,0.0
gfx950,256,448,6144,1536,ck,18,0,14.5126,a8w8_blockscale_1x128x128_256x64x64x256_16x16_32x32_1x1_16x16x1_16x16x1_1x32x1x8_8_1x1_intrawave_v1,582.65,1077.02,0.0
gfx950,256,1000,128,7168,ck,8,2,14.5397,a8w8_blockscale_1x128x128_256x16x64x256_16x16_16x16_1x1_16x16x1_16x16x1_1x16x1x16_4_1x1_intrawave_v1,126.21,573.71,0.0
gfx950,256,304,8192,1536,ck,18,0,14.5481,a8w8_blockscale_1x128x128_256x64x64x256_16x16_32x32_1x1_16x16x1_16x16x1_1x32x1x8_8_1x1_intrawave_v1,525.87,1239.38,0.0
gfx950,256,40,7168,4096,ck,18,0,14.5552,a8w8_blockscale_1x128x128_256x64x64x256_16x16_32x32_1x1_16x16x1_16x16x1_1x32x1x8_8_1x1_intrawave_v1,161.37,2067.81,0.0
gfx950,256,24,7168,4608,ck,18,1,14.5909,a8w8_blockscale_1x128x128_256x64x64x256_16x16_32x32_1x1_16x16x1_16x16x1_1x32x1x8_8_1x1_intrawave_v1,108.66,2294.91,0.0
gfx950,256,464,6144,1536,ck,18,0,14.6645,a8w8_blockscale_1x128x128_256x64x64x256_16x16_32x32_1x1_16x16x1_16x16x1_1x32x1x8_8_1x1_intrawave_v1,597.2,1080.95,0.0
gfx950,256,480,6144,1536,ck,18,0,14.6806,a8w8_blockscale_1x128x128_256x64x64x256_16x16_32x32_1x1_16x16x1_16x16x1_1x32x1x8_8_1x1_intrawave_v1,617.12,1094.83,0.0
gfx950,256,80,7168,4096,ck,18,0,14.6956,a8w8_blockscale_1x128x128_256x64x64x256_16x16_32x32_1x1_16x16x1_16x16x1_1x32x1x8_8_1x1_intrawave_v1,319.66,2098.23,0.0
gfx950,256,72,7168,4096,ck,18,0,14.7442,a8w8_blockscale_1x128x128_256x64x64x256_16x16_32x32_1x1_16x16x1_16x16x1_1x32x1x8_8_1x1_intrawave_v1,286.75,2081.31,0.0
gfx950,256,48,7168,4096,ck,18,0,14.7478,a8w8_blockscale_1x128x128_256x64x64x256_16x16_32x32_1x1_16x16x1_16x16x1_1x32x1x8_8_1x1_intrawave_v1,191.12,2050.81,0.0
gfx950,256,432,6144,1536,ck,18,0,14.7763,a8w8_blockscale_1x128x128_256x64x64x256_16x16_32x32_1x1_16x16x1_16x16x1_1x32x1x8_8_1x1_intrawave_v1,551.81,1042.83,0.0
gfx950,256,104,7168,4096,ck,18,0,14.817,a8w8_blockscale_1x128x128_256x64x64x256_16x16_32x32_1x1_16x16x1_16x16x1_1x32x1x8_8_1x1_intrawave_v1,412.16,2110.89,0.0
gfx950,256,88,7168,4096,ck,18,0,14.8317,a8w8_blockscale_1x128x128_256x64x64x256_16x16_32x32_1x1_16x16x1_16x16x1_1x32x1x8_8_1x1_intrawave_v1,348.4,2088.91,0.0
gfx950,256,336,8192,1536,ck,18,0,14.8513,a8w8_blockscale_1x128x128_256x64x64x256_16x16_32x32_1x1_16x16x1_16x16x1_1x32x1x8_8_1x1_intrawave_v1,569.36,1252.69,0.0
gfx950,256,512,6144,1536,ck,18,0,14.8937,a8w8_blockscale_1x128x128_256x64x64x256_16x16_32x32_1x1_16x16x1_16x16x1_1x32x1x8_8_1x1_intrawave_v1,648.84,1108.86,0.0
gfx950,256,496,6144,1536,ck,18,0,14.9121,a8w8_blockscale_1x128x128_256x64x64x256_16x16_32x32_1x1_16x16x1_16x16x1_1x32x1x8_8_1x1_intrawave_v1,627.79,1092.66,0.0
gfx950,256,56,7168,4096,ck,18,0,14.92,a8w8_blockscale_1x128x128_256x64x64x256_16x16_32x32_1x1_16x16x1_16x16x1_1x32x1x8_8_1x1_intrawave_v1,220.4,2037.02,0.0
gfx950,256,918,8192,512,ck,0,0,14.9961,a8w8_blockscale_1x128x128_256x128x128x128_16x16_32x32_2x2_8x32x1_8x32x1_1x32x1x8_8_1x1_intrawave_v3,513.52,1314.0,0.0
gfx950,256,112,7168,4096,ck,18,0,15.0084,a8w8_blockscale_1x128x128_256x64x64x256_16x16_32x32_1x1_16x16x1_16x16x1_1x32x1x8_8_1x1_intrawave_v1,438.2,2093.79,0.0
gfx950,256,906,8192,512,ck,0,0,15.011,a8w8_blockscale_1x128x128_256x128x128x128_16x16_32x32_2x2_8x32x1_8x32x1_1x32x1x8_8_1x1_intrawave_v3,506.3,1299.19,0.0
gfx950,256,944,8192,512,ck,0,0,15.0113,a8w8_blockscale_1x128x128_256x128x128x128_16x16_32x32_2x2_8x32x1_8x32x1_1x32x1x8_8_1x1_intrawave_v3,527.53,1341.93,0.0
gfx950,256,368,8192,1536,ck,18,0,15.0156,a8w8_blockscale_1x128x128_256x64x64x256_16x16_32x32_1x1_16x16x1_16x16x1_1x32x1x8_8_1x1_intrawave_v1,616.76,1277.17,0.0
gfx950,256,909,8192,512,ck,0,0,15.0294,a8w8_blockscale_1x128x128_256x128x128x128_16x16_32x32_2x2_8x32x1_8x32x1_1x32x1x8_8_1x1_intrawave_v3,507.36,1300.97,0.0
gfx950,256,901,8192,512,ck,0,0,15.0315,a8w8_blockscale_1x128x128_256x128x128x128_16x16_32x32_2x2_8x32x1_8x32x1_1x32x1x8_8_1x1_intrawave_v3,502.82,1291.79,0.0
gfx950,256,905,8192,512,ck,0,0,15.0342,a8w8_blockscale_1x128x128_256x128x128x128_16x16_32x32_2x2_8x32x1_8x32x1_1x32x1x8_8_1x1_intrawave_v3,504.96,1296.06,0.0
gfx950,256,898,8192,512,ck,0,0,15.0391,a8w8_blockscale_1x128x128_256x128x128x128_16x16_32x32_2x2_8x32x1_8x32x1_1x32x1x8_8_1x1_intrawave_v3,500.89,1287.77,0.0
gfx950,256,915,8192,512,ck,0,0,15.0468,a8w8_blockscale_1x128x128_256x128x128x128_16x16_32x32_2x2_8x32x1_8x32x1_1x32x1x8_8_1x1_intrawave_v3,510.11,1306.2,0.0
gfx950,256,924,8192,512,ck,0,0,15.0556,a8w8_blockscale_1x128x128_256x128x128x128_16x16_32x32_2x2_8x32x1_8x32x1_1x32x1x8_8_1x1_intrawave_v3,514.83,1315.54,0.0
gfx950,256,935,8192,512,ck,0,0,15.0659,a8w8_blockscale_1x128x128_256x128x128x128_16x16_32x32_2x2_8x32x1_8x32x1_1x32x1x8_8_1x1_intrawave_v3,520.6,1326.97,0.0
gfx950,256,921,8192,512,ck,0,0,15.0665,a8w8_blockscale_1x128x128_256x128x128x128_16x16_32x32_2x2_8x32x1_8x32x1_1x32x1x8_8_1x1_intrawave_v3,512.79,1311.22,0.0
gfx950,256,961,8192,512,ck,0,0,15.0711,a8w8_blockscale_1x128x128_256x128x128x128_16x16_32x32_2x2_8x32x1_8x32x1_1x32x1x8_8_1x1_intrawave_v3,534.89,1355.66,0.0
gfx950,256,936,8192,512,ck,0,0,15.0782,a8w8_blockscale_1x128x128_256x128x128x128_16x16_32x32_2x2_8x32x1_8x32x1_1x32x1x8_8_1x1_intrawave_v3,520.73,1327.01,0.0
gfx950,256,908,8192,512,ck,0,0,15.0787,a8w8_blockscale_1x128x128_256x128x128x128_16x16_32x32_2x2_8x32x1_8x32x1_1x32x1x8_8_1x1_intrawave_v3,505.14,1295.59,0.0
gfx950,256,904,8192,512,ck,0,0,15.0959,a8w8_blockscale_1x128x128_256x128x128x128_16x16_32x32_2x2_8x32x1_8x32x1_1x32x1x8_8_1x1_intrawave_v3,502.34,1289.64,0.0
gfx950,256,120,7168,4096,ck,18,0,15.0961,a8w8_blockscale_1x128x128_256x64x64x256_16x16_32x32_1x1_16x16x1_16x16x1_1x32x1x8_8_1x1_intrawave_v1,466.77,2091.4,0.0
gfx950,256,934,8192,512,ck,0,0,15.0987,a8w8_blockscale_1x128x128_256x128x128x128_16x16_32x32_2x2_8x32x1_8x32x1_1x32x1x8_8_1x1_intrawave_v3,518.92,1322.97,0.0
gfx950,256,917,8192,512,ck,0,0,15.1001,a8w8_blockscale_1x128x128_256x128x128x128_16x16_32x32_2x2_8x32x1_8x32x1_1x32x1x8_8_1x1_intrawave_v3,509.42,1303.83,0.0
gfx950,256,945,8192,512,ck,0,0,15.1038,a8w8_blockscale_1x128x128_256x128x128x128_16x16_32x32_2x2_8x32x1_8x32x1_1x32x1x8_8_1x1_intrawave_v3,524.85,1334.83,0.0
gfx950,256,923,8192,512,ck,0,0,15.1179,a8w8_blockscale_1x128x128_256x128x128x128_16x16_32x32_2x2_8x32x1_8x32x1_1x32x1x8_8_1x1_intrawave_v3,512.15,1309.0,0.0
gfx950,256,948,8192,512,ck,0,0,15.1196,a8w8_blockscale_1x128x128_256x128x128x128_16x16_32x32_2x2_8x32x1_8x32x1_1x32x1x8_8_1x1_intrawave_v3,525.97,1336.79,0.0
gfx950,256,919,8192,512,ck,0,0,15.1208,a8w8_blockscale_1x128x128_256x128x128x128_16x16_32x32_2x2_8x32x1_8x32x1_1x32x1x8_8_1x1_intrawave_v3,509.84,1304.28,0.0
gfx950,256,931,8192,512,ck,0,0,15.1238,a8w8_blockscale_1x128x128_256x128x128x128_16x16_32x32_2x2_8x32x1_8x32x1_1x32x1x8_8_1x1_intrawave_v3,516.39,1317.43,0.0
gfx950,256,943,8192,512,ck,0,0,15.1242,a8w8_blockscale_1x128x128_256x128x128x128_16x16_32x32_2x2_8x32x1_8x32x1_1x32x1x8_8_1x1_intrawave_v3,523.03,1330.8,0.0
gfx950,256,964,8192,512,ck,0,0,15.1334,a8w8_blockscale_1x128x128_256x128x128x128_16x16_32x32_2x2_8x32x1_8x32x1_1x32x1x8_8_1x1_intrawave_v3,534.36,1353.43,0.0
gfx950,256,960,8192,512,ck,0,0,15.1342,a8w8_blockscale_1x128x128_256x128x128x128_16x16_32x32_2x2_8x32x1_8x32x1_1x32x1x8_8_1x1_intrawave_v3,532.11,1348.9,0.0
gfx950,256,946,8192,512,ck,0,0,15.1346,a8w8_blockscale_1x128x128_256x128x128x128_16x16_32x32_2x2_8x32x1_8x32x1_1x32x1x8_8_1x1_intrawave_v3,524.34,1333.23,0.0
gfx950,256,940,8192,512,ck,0,0,15.1354,a8w8_blockscale_1x128x128_256x128x128x128_16x16_32x32_2x2_8x32x1_8x32x1_1x32x1x8_8_1x1_intrawave_v3,520.98,1326.46,0.0
gfx950,256,958,8192,512,ck,0,0,15.1435,a8w8_blockscale_1x128x128_256x128x128x128_16x16_32x32_2x2_8x32x1_8x32x1_1x32x1x8_8_1x1_intrawave_v3,530.68,1345.84,0.0
gfx950,256,954,8192,512,ck,0,0,15.1442,a8w8_blockscale_1x128x128_256x128x128x128_16x16_32x32_2x2_8x32x1_8x32x1_1x32x1x8_8_1x1_intrawave_v3,528.44,1341.31,0.0
gfx950,256,933,8192,512,ck,0,0,15.1476,a8w8_blockscale_1x128x128_256x128x128x128_16x16_32x32_2x2_8x32x1_8x32x1_1x32x1x8_8_1x1_intrawave_v3,516.69,1317.59,0.0
gfx950,256,979,8192,512,ck,0,0,15.1496,a8w8_blockscale_1x128x128_256x128x128x128_16x16_32x32_2x2_8x32x1_8x32x1_1x32x1x8_8_1x1_intrawave_v3,542.09,1368.72,0.0
gfx950,256,939,8192,512,ck,0,0,15.1519,a8w8_blockscale_1x128x128_256x128x128x128_16x16_32x32_2x2_8x32x1_8x32x1_1x32x1x8_8_1x1_intrawave_v3,519.86,1323.9,0.0
gfx950,256,971,8192,512,ck,0,0,15.1541,a8w8_blockscale_1x128x128_256x128x128x128_16x16_32x32_2x2_8x32x1_8x32x1_1x32x1x8_8_1x1_intrawave_v3,537.5,1359.39,0.0
gfx950,256,957,8192,512,ck,0,0,15.1565,a8w8_blockscale_1x128x128_256x128x128x128_16x16_32x32_2x2_8x32x1_8x32x1_1x32x1x8_8_1x1_intrawave_v3,529.67,1343.57,0.0
gfx950,256,974,8192,512,ck,0,0,15.1608,a8w8_blockscale_1x128x128_256x128x128x128_16x16_32x32_2x2_8x32x1_8x32x1_1x32x1x8_8_1x1_intrawave_v3,538.92,1362.13,0.0
gfx950,256,952,8192,512,ck,0,0,15.162,a8w8_blockscale_1x128x128_256x128x128x128_16x16_32x32_2x2_8x32x1_8x32x1_1x32x1x8_8_1x1_intrawave_v3,526.71,1337.51,0.0
gfx950,256,950,8192,512,ck,0,0,15.1662,a8w8_blockscale_1x128x128_256x128x128x128_16x16_32x32_2x2_8x32x1_8x32x1_1x32x1x8_8_1x1_intrawave_v3,525.46,1334.91,0.0
gfx950,256,968,8192,512,ck,0,0,15.1749,a8w8_blockscale_1x128x128_256x128x128x128_16x16_32x32_2x2_8x32x1_8x32x1_1x32x1x8_8_1x1_intrawave_v3,535.11,1354.19,0.0
gfx950,256,951,8192,512,ck,0,0,15.1769,a8w8_blockscale_1x128x128_256x128x128x128_16x16_32x32_2x2_8x32x1_8x32x1_1x32x1x8_8_1x1_intrawave_v3,525.64,1335.08,0.0
gfx950,256,949,8192,512,ck,0,0,15.1829,a8w8_blockscale_1x128x128_256x128x128x128_16x16_32x32_2x2_8x32x1_8x32x1_1x32x1x8_8_1x1_intrawave_v3,524.33,1332.33,0.0
gfx950,256,965,8192,512,ck,0,0,15.1938,a8w8_blockscale_1x128x128_256x128x128x128_16x16_32x32_2x2_8x32x1_8x32x1_1x32x1x8_8_1x1_intrawave_v3,532.78,1349.17,0.0
gfx950,256,1002,8192,512,ck,0,0,15.208,a8w8_blockscale_1x128x128_256x128x128x128_16x16_32x32_2x2_8x32x1_8x32x1_1x32x1x8_8_1x1_intrawave_v3,552.69,1389.01,0.0
gfx950,256,963,8192,512,ck,0,0,15.2173,a8w8_blockscale_1x128x128_256x128x128x128_16x16_32x32_2x2_8x32x1_8x32x1_1x32x1x8_8_1x1_intrawave_v3,530.86,1344.86,0.0
gfx950,256,941,8192,512,ck,0,0,15.2189,a8w8_blockscale_1x128x128_256x128x128x128_16x16_32x32_2x2_8x32x1_8x32x1_1x32x1x8_8_1x1_intrawave_v3,518.68,1320.3,0.0
gfx950,256,1000,8192,512,ck,0,0,15.2281,a8w8_blockscale_1x128x128_256x128x128x128_16x16_32x32_2x2_8x32x1_8x32x1_1x32x1x8_8_1x1_intrawave_v3,550.86,1384.96,0.0
gfx950,256,1006,8192,512,ck,0,0,15.2341,a8w8_blockscale_1x128x128_256x128x128x128_16x16_32x32_2x2_8x32x1_8x32x1_1x32x1x8_8_1x1_intrawave_v3,553.95,1391.07,0.0
gfx950,256,981,8192,512,ck,0,0,15.2391,a8w8_blockscale_1x128x128_256x128x128x128_16x16_32x32_2x2_8x32x1_8x32x1_1x32x1x8_8_1x1_intrawave_v3,540.01,1362.89,0.0
gfx950,256,999,8192,512,ck,0,0,15.2408,a8w8_blockscale_1x128x128_256x128x128x128_16x16_32x32_2x2_8x32x1_8x32x1_1x32x1x8_8_1x1_intrawave_v3,549.85,1382.7,0.0
gfx950,256,996,8192,512,ck,0,0,15.2413,a8w8_blockscale_1x128x128_256x128x128x128_16x16_32x32_2x2_8x32x1_8x32x1_1x32x1x8_8_1x1_intrawave_v3,548.19,1379.33,0.0
gfx950,256,992,8192,512,ck,0,0,15.2456,a8w8_blockscale_1x128x128_256x128x128x128_16x16_32x32_2x2_8x32x1_8x32x1_1x32x1x8_8_1x1_intrawave_v3,545.83,1374.5,0.0
gfx950,256,1001,8192,512,ck,0,0,15.266,a8w8_blockscale_1x128x128_256x128x128x128_16x16_32x32_2x2_8x32x1_8x32x1_1x32x1x8_8_1x1_intrawave_v3,550.05,1382.63,0.0
gfx950,256,993,8192,512,ck,0,0,15.2667,a8w8_blockscale_1x128x128_256x128x128x128_16x16_32x32_2x2_8x32x1_8x32x1_1x32x1x8_8_1x1_intrawave_v3,545.62,1373.71,0.0
gfx950,256,1005,8192,512,ck,0,0,15.2696,a8w8_blockscale_1x128x128_256x128x128x128_16x16_32x32_2x2_8x32x1_8x32x1_1x32x1x8_8_1x1_intrawave_v3,552.11,1386.73,0.0
gfx950,256,1008,8192,512,ck,0,0,15.2817,a8w8_blockscale_1x128x128_256x128x128x128_16x16_32x32_2x2_8x32x1_8x32x1_1x32x1x8_8_1x1_intrawave_v3,553.32,1388.95,0.0
gfx950,256,985,8192,512,ck,0,0,15.2872,a8w8_blockscale_1x128x128_256x128x128x128_16x16_32x32_2x2_8x32x1_8x32x1_1x32x1x8_8_1x1_intrawave_v3,540.5,1363.03,0.0
gfx950,256,987,8192,512,ck,0,0,15.3031,a8w8_blockscale_1x128x128_256x128x128x128_16x16_32x32_2x2_8x32x1_8x32x1_1x32x1x8_8_1x1_intrawave_v3,541.04,1363.82,0.0
gfx950,256,1087,128,7168,ck,8,2,15.3129,a8w8_blockscale_1x128x128_256x16x64x256_16x16_16x16_1x1_16x16x1_16x16x1_1x16x1x16_4_1x1_intrawave_v1,130.26,586.92,0.0
gfx950,256,1015,8192,512,ck,0,0,15.3254,a8w8_blockscale_1x128x128_256x128x128x128_16x16_32x32_2x2_8x32x1_8x32x1_1x32x1x8_8_1x1_intrawave_v3,555.58,1392.7,0.0
gfx950,256,1011,8192,512,ck,0,0,15.348,a8w8_blockscale_1x128x128_256x128x128x128_16x16_32x32_2x2_8x32x1_8x32x1_1x32x1x8_8_1x1_intrawave_v3,552.57,1386.25,0.0
gfx950,256,1019,8192,512,ck,0,0,15.36,a8w8_blockscale_1x128x128_256x128x128x128_16x16_32x32_2x2_8x32x1_8x32x1_1x32x1x8_8_1x1_intrawave_v3,556.51,1393.97,0.0
gfx950,256,1012,8192,512,ck,0,0,15.3609,a8w8_blockscale_1x128x128_256x128x128x128_16x16_32x32_2x2_8x32x1_8x32x1_1x32x1x8_8_1x1_intrawave_v3,552.65,1386.19,0.0
gfx950,256,1010,8192,512,ck,0,0,15.3883,a8w8_blockscale_1x128x128_256x128x128x128_16x16_32x32_2x2_8x32x1_8x32x1_1x32x1x8_8_1x1_intrawave_v3,550.58,1381.52,0.0
gfx950,256,1040,128,7168,ck,18,2,15.4171,a8w8_blockscale_1x128x128_256x64x64x256_16x16_32x32_1x1_16x16x1_16x16x1_1x32x1x8_8_1x1_intrawave_v1,123.79,560.32,0.0
gfx950,256,40,7168,4608,ck,18,0,15.6778,a8w8_blockscale_1x128x128_256x64x64x256_16x16_32x32_1x1_16x16x1_16x16x1_1x32x1x8_8_1x1_intrawave_v1,168.54,2155.14,0.0
gfx950,256,48,7168,4608,ck,18,0,15.8779,a8w8_blockscale_1x128x128_256x64x64x256_16x16_32x32_1x1_16x16x1_16x16x1_1x32x1x8_8_1x1_intrawave_v1,199.7,2137.53,0.0
gfx950,256,56,7168,4608,ck,18,0,15.9613,a8w8_blockscale_1x128x128_256x64x64x256_16x16_32x32_1x1_16x16x1_16x16x1_1x32x1x8_8_1x1_intrawave_v1,231.77,2135.85,0.0
gfx950,256,72,7168,4608,ck,18,0,15.9709,a8w8_blockscale_1x128x128_256x64x64x256_16x16_32x32_1x1_16x16x1_16x16x1_1x32x1x8_8_1x1_intrawave_v1,297.81,2153.55,0.0
gfx950,256,80,7168,4608,ck,18,0,15.9936,a8w8_blockscale_1x128x128_256x64x64x256_16x16_32x32_1x1_16x16x1_16x16x1_1x32x1x8_8_1x1_intrawave_v1,330.43,2159.97,0.0
gfx950,256,1255,128,7168,ck,8,2,16.0425,a8w8_blockscale_1x128x128_256x16x64x256_16x16_16x16_1x1_16x16x1_16x16x1_1x16x1x16_4_1x1_intrawave_v1,143.55,637.97,0.0
gfx950,256,400,8192,1536,ck,0,0,16.0698,a8w8_blockscale_1x128x128_256x128x128x128_16x16_32x32_2x2_8x32x1_8x32x1_1x32x1x8_8_1x1_intrawave_v3,626.41,1229.07,0.0
gfx950,256,88,7168,4608,ck,18,0,16.0921,a8w8_blockscale_1x128x128_256x64x64x256_16x16_32x32_1x1_16x16x1_16x16x1_1x32x1x8_8_1x1_intrawave_v1,361.25,2156.16,0.0
gfx950,256,104,7168,4608,ck,18,0,16.1548,a8w8_blockscale_1x128x128_256x64x64x256_16x16_32x32_1x1_16x16x1_16x16x1_1x32x1x8_8_1x1_intrawave_v1,425.28,2166.56,0.0
gfx950,256,432,8192,1536,ck,0,0,16.2041,a8w8_blockscale_1x128x128_256x128x128x128_16x16_32x32_2x2_8x32x1_8x32x1_1x32x1x8_8_1x1_intrawave_v3,670.92,1254.27,0.0
gfx950,256,112,7168,4608,ck,18,0,16.2213,a8w8_blockscale_1x128x128_256x64x64x256_16x16_32x32_1x1_16x16x1_16x16x1_1x32x1x8_8_1x1_intrawave_v1,456.11,2167.02,0.0
gfx950,256,120,7168,4608,ck,18,0,16.37,a8w8_blockscale_1x128x128_256x64x64x256_16x16_32x32_1x1_16x16x1_16x16x1_1x32x1x8_8_1x1_intrawave_v1,484.25,2156.59,0.0
gfx950,256,464,8192,1536,ck,0,0,16.4194,a8w8_blockscale_1x128x128_256x128x128x128_16x16_32x32_2x2_8x32x1_8x32x1_1x32x1x8_8_1x1_intrawave_v3,711.17,1272.75,0.0
gfx950,256,1047,8192,512,ck,18,0,16.5099,a8w8_blockscale_1x128x128_256x64x64x256_16x16_32x32_1x1_16x16x1_16x16x1_1x32x1x8_8_1x1_intrawave_v1,531.98,1325.53,0.0
gfx950,256,1029,8192,512,ck,18,0,16.5528,a8w8_blockscale_1x128x128_256x64x64x256_16x16_32x32_1x1_16x16x1_16x16x1_1x32x1x8_8_1x1_intrawave_v1,521.48,1303.72,0.0
gfx950,256,496,8192,1536,ck,0,0,16.5654,a8w8_blockscale_1x128x128_256x128x128x128_16x16_32x32_2x2_8x32x1_8x32x1_1x32x1x8_8_1x1_intrawave_v3,753.51,1296.15,0.0
gfx950,256,1084,8192,512,ck,18,0,16.5732,a8w8_blockscale_1x128x128_256x64x64x256_16x16_32x32_1x1_16x16x1_16x16x1_1x32x1x8_8_1x1_intrawave_v1,548.67,1358.19,0.0
gfx950,256,1036,8192,512,ck,18,0,16.5756,a8w8_blockscale_1x128x128_256x64x64x256_16x16_32x32_1x1_16x16x1_16x16x1_1x32x1x8_8_1x1_intrawave_v1,524.3,1309.07,0.0
gfx950,256,1038,8192,512,ck,18,0,16.6079,a8w8_blockscale_1x128x128_256x64x64x256_16x16_32x32_1x1_16x16x1_16x16x1_1x32x1x8_8_1x1_intrawave_v1,524.29,1308.56,0.0
gfx950,256,1046,8192,512,ck,18,0,16.6095,a8w8_blockscale_1x128x128_256x64x64x256_16x16_32x32_1x1_16x16x1_16x16x1_1x32x1x8_8_1x1_intrawave_v1,528.28,1316.57,0.0
gfx950,256,1037,8192,512,ck,18,0,16.6122,a8w8_blockscale_1x128x128_256x64x64x256_16x16_32x32_1x1_16x16x1_16x16x1_1x32x1x8_8_1x1_intrawave_v1,523.65,1307.2,0.0
gfx950,256,1085,8192,512,ck,18,0,16.6664,a8w8_blockscale_1x128x128_256x64x64x256_16x16_32x32_1x1_16x16x1_16x16x1_1x32x1x8_8_1x1_intrawave_v1,546.11,1351.61,0.0
gfx950,256,1053,8192,512,ck,18,0,16.6719,a8w8_blockscale_1x128x128_256x64x64x256_16x16_32x32_1x1_16x16x1_16x16x1_1x32x1x8_8_1x1_intrawave_v1,529.83,1318.73,0.0
gfx950,256,1040,8192,512,ck,18,0,16.6732,a8w8_blockscale_1x128x128_256x64x64x256_16x16_32x32_1x1_16x16x1_16x16x1_1x32x1x8_8_1x1_intrawave_v1,523.24,1305.46,0.0
gfx950,256,1048,8192,512,ck,18,0,16.6771,a8w8_blockscale_1x128x128_256x64x64x256_16x16_32x32_1x1_16x16x1_16x16x1_1x32x1x8_8_1x1_intrawave_v1,527.15,1313.26,0.0
gfx950,256,1035,8192,512,ck,18,0,16.6791,a8w8_blockscale_1x128x128_256x64x64x256_16x16_32x32_1x1_16x16x1_16x16x1_1x32x1x8_8_1x1_intrawave_v1,520.54,1299.93,0.0
gfx950,256,1042,8192,512,ck,18,0,16.6857,a8w8_blockscale_1x128x128_256x64x64x256_16x16_32x32_1x1_16x16x1_16x16x1_1x32x1x8_8_1x1_intrawave_v1,523.86,1306.5,0.0
gfx950,256,1061,8192,512,ck,18,0,16.6878,a8w8_blockscale_1x128x128_256x64x64x256_16x16_32x32_1x1_16x16x1_16x16x1_1x32x1x8_8_1x1_intrawave_v1,533.34,1325.58,0.0
gfx950,256,1056,8192,512,ck,18,0,16.6882,a8w8_blockscale_1x128x128_256x64x64x256_16x16_32x32_1x1_16x16x1_16x16x1_1x32x1x8_8_1x1_intrawave_v1,530.82,1320.48,0.0
gfx950,256,621,6144,1536,ck,0,0,16.6961,a8w8_blockscale_1x128x128_256x128x128x128_16x16_32x32_2x2_8x32x1_8x32x1_1x32x1x8_8_1x1_intrawave_v3,702.02,1079.41,0.0
gfx950,256,1080,8192,512,ck,18,0,16.6993,a8w8_blockscale_1x128x128_256x64x64x256_16x16_32x32_1x1_16x16x1_16x16x1_1x32x1x8_8_1x1_intrawave_v1,542.52,1343.89,0.0
gfx950,256,1050,8192,512,ck,18,0,16.7077,a8w8_blockscale_1x128x128_256x64x64x256_16x16_32x32_1x1_16x16x1_16x16x1_1x32x1x8_8_1x1_intrawave_v1,527.18,1312.87,0.0
gfx950,256,1063,8192,512,ck,18,0,16.7162,a8w8_blockscale_1x128x128_256x64x64x256_16x16_32x32_1x1_16x16x1_16x16x1_1x32x1x8_8_1x1_intrawave_v1,533.44,1325.35,0.0
gfx950,256,1072,8192,512,ck,18,0,16.722,a8w8_blockscale_1x128x128_256x64x64x256_16x16_32x32_1x1_16x16x1_16x16x1_1x32x1x8_8_1x1_intrawave_v1,537.77,1333.98,0.0
gfx950,256,1069,8192,512,ck,18,0,16.7238,a8w8_blockscale_1x128x128_256x64x64x256_16x16_32x32_1x1_16x16x1_16x16x1_1x32x1x8_8_1x1_intrawave_v1,536.21,1330.81,0.0
gfx950,256,1076,8192,512,ck,18,0,16.7258,a8w8_blockscale_1x128x128_256x64x64x256_16x16_32x32_1x1_16x16x1_16x16x1_1x32x1x8_8_1x1_intrawave_v1,539.65,1337.72,0.0
gfx950,256,1073,8192,512,ck,18,0,16.7266,a8w8_blockscale_1x128x128_256x64x64x256_16x16_32x32_1x1_16x16x1_16x16x1_1x32x1x8_8_1x1_intrawave_v1,538.12,1334.62,0.0
gfx950,256,1051,8192,512,ck,18,0,16.7292,a8w8_blockscale_1x128x128_256x64x64x256_16x16_32x32_1x1_16x16x1_16x16x1_1x32x1x8_8_1x1_intrawave_v1,527.01,1312.2,0.0
gfx950,256,1075,8192,512,ck,18,0,16.7678,a8w8_blockscale_1x128x128_256x64x64x256_16x16_32x32_1x1_16x16x1_16x16x1_1x32x1x8_8_1x1_intrawave_v1,537.8,1333.36,0.0
gfx950,256,1071,8192,512,ck,18,0,16.7722,a8w8_blockscale_1x128x128_256x64x64x256_16x16_32x32_1x1_16x16x1_16x16x1_1x32x1x8_8_1x1_intrawave_v1,535.66,1328.98,0.0
gfx950,256,1116,8192,512,ck,18,0,16.9507,a8w8_blockscale_1x128x128_256x64x64x256_16x16_32x32_1x1_16x16x1_16x16x1_1x32x1x8_8_1x1_intrawave_v1,552.29,1359.84,0.0
gfx950,256,1106,8192,512,ck,18,0,17.0223,a8w8_blockscale_1x128x128_256x64x64x256_16x16_32x32_1x1_16x16x1_16x16x1_1x32x1x8_8_1x1_intrawave_v1,545.04,1344.19,0.0
gfx950,256,1639,128,7168,ck,8,2,17.0356,a8w8_blockscale_1x128x128_256x16x64x256_16x16_16x16_1x1_16x16x1_16x16x1_1x16x1x16_4_1x1_intrawave_v1,176.55,768.12,0.0
gfx950,256,1098,8192,512,ck,18,0,17.0579,a8w8_blockscale_1x128x128_256x64x64x256_16x16_32x32_1x1_16x16x1_16x16x1_1x32x1x8_8_1x1_intrawave_v1,539.97,1333.46,0.0
gfx950,256,1124,8192,512,ck,18,0,17.0641,a8w8_blockscale_1x128x128_256x64x64x256_16x16_32x32_1x1_16x16x1_16x16x1_1x32x1x8_8_1x1_intrawave_v1,552.55,1358.72,0.0
gfx950,256,1120,8192,512,ck,18,0,17.0775,a8w8_blockscale_1x128x128_256x64x64x256_16x16_32x32_1x1_16x16x1_16x16x1_1x32x1x8_8_1x1_intrawave_v1,550.15,1353.7,0.0
gfx950,256,1140,8192,512,ck,18,0,17.0808,a8w8_blockscale_1x128x128_256x64x64x256_16x16_32x32_1x1_16x16x1_16x16x1_1x32x1x8_8_1x1_intrawave_v1,559.87,1373.22,0.0
gfx950,256,1099,8192,512,ck,18,0,17.0955,a8w8_blockscale_1x128x128_256x64x64x256_16x16_32x32_1x1_16x16x1_16x16x1_1x32x1x8_8_1x1_intrawave_v1,539.27,1331.52,0.0
gfx950,256,1091,8192,512,ck,18,0,17.1013,a8w8_blockscale_1x128x128_256x64x64x256_16x16_32x32_1x1_16x16x1_16x16x1_1x32x1x8_8_1x1_intrawave_v1,535.16,1323.16,0.0
gfx950,256,1126,8192,512,ck,18,0,17.1151,a8w8_blockscale_1x128x128_256x64x64x256_16x16_32x32_1x1_16x16x1_16x16x1_1x32x1x8_8_1x1_intrawave_v1,551.89,1356.65,0.0
gfx950,256,1115,8192,512,ck,18,0,17.1151,a8w8_blockscale_1x128x128_256x64x64x256_16x16_32x32_1x1_16x16x1_16x16x1_1x32x1x8_8_1x1_intrawave_v1,546.49,1345.79,0.0
gfx950,256,1108,8192,512,ck,18,0,17.1204,a8w8_blockscale_1x128x128_256x64x64x256_16x16_32x32_1x1_16x16x1_16x16x1_1x32x1x8_8_1x1_intrawave_v1,542.89,1338.47,0.0
gfx950,256,1150,8192,512,ck,18,0,17.1216,a8w8_blockscale_1x128x128_256x64x64x256_16x16_32x32_1x1_16x16x1_16x16x1_1x32x1x8_8_1x1_intrawave_v1,563.43,1379.82,0.0
gfx950,256,1142,8192,512,ck,18,0,17.1237,a8w8_blockscale_1x128x128_256x64x64x256_16x16_32x32_1x1_16x16x1_16x16x1_1x32x1x8_8_1x1_intrawave_v1,559.45,1371.76,0.0
gfx950,256,1149,8192,512,ck,18,0,17.1312,a8w8_blockscale_1x128x128_256x64x64x256_16x16_32x32_1x1_16x16x1_16x16x1_1x32x1x8_8_1x1_intrawave_v1,562.63,1378.06,0.0
gfx950,256,1136,8192,512,ck,18,0,17.1323,a8w8_blockscale_1x128x128_256x64x64x256_16x16_32x32_1x1_16x16x1_16x16x1_1x32x1x8_8_1x1_intrawave_v1,556.23,1365.15,0.0
gfx950,256,1122,8192,512,ck,18,0,17.1381,a8w8_blockscale_1x128x128_256x64x64x256_16x16_32x32_1x1_16x16x1_16x16x1_1x32x1x8_8_1x1_intrawave_v1,549.19,1350.89,0.0
gfx950,256,1144,8192,512,ck,18,0,17.16,a8w8_blockscale_1x128x128_256x64x64x256_16x16_32x32_1x1_16x16x1_16x16x1_1x32x1x8_8_1x1_intrawave_v1,559.24,1370.82,0.0
gfx950,256,1134,8192,512,ck,18,0,17.1721,a8w8_blockscale_1x128x128_256x64x64x256_16x16_32x32_1x1_16x16x1_16x16x1_1x32x1x8_8_1x1_intrawave_v1,553.96,1360.02,0.0
gfx950,256,1097,8192,512,ck,18,0,17.1884,a8w8_blockscale_1x128x128_256x64x64x256_16x16_32x32_1x1_16x16x1_16x16x1_1x32x1x8_8_1x1_intrawave_v1,535.38,1322.36,0.0
gfx950,256,1685,128,7168,ck,8,2,17.2265,a8w8_blockscale_1x128x128_256x16x64x256_16x16_16x16_1x1_16x16x1_16x16x1_1x16x1x16_4_1x1_intrawave_v1,179.49,779.44,0.0
gfx950,256,1808,128,7168,ck,8,2,17.2811,a8w8_blockscale_1x128x128_256x16x64x256_16x16_16x16_1x1_16x16x1_16x16x1_1x16x1x16_4_1x1_intrawave_v1,191.98,829.81,0.0
gfx950,256,1718,128,7168,ck,8,2,17.3262,a8w8_blockscale_1x128x128_256x16x64x256_16x16_16x16_1x1_16x16x1_16x16x1_1x16x1x16_4_1x1_intrawave_v1,181.95,789.09,0.0
gfx950,256,1809,128,7168,ck,8,2,17.4448,a8w8_blockscale_1x128x128_256x16x64x256_16x16_16x16_1x1_16x16x1_16x16x1_1x16x1x16_4_1x1_intrawave_v1,190.29,822.45,0.0
gfx950,256,1816,128,7168,ck,8,2,17.4451,a8w8_blockscale_1x128x128_256x16x64x256_16x16_16x16_1x1_16x16x1_16x16x1_1x16x1x16_4_1x1_intrawave_v1,191.02,825.42,0.0
gfx950,256,2000,128,7168,ck,8,2,17.473,a8w8_blockscale_1x128x128_256x16x64x256_16x16_16x16_1x1_16x16x1_16x16x1_1x16x1x16_4_1x1_intrawave_v1,210.04,902.28,0.0
gfx950,256,1821,128,7168,ck,8,2,17.4856,a8w8_blockscale_1x128x128_256x16x64x256_16x16_16x16_1x1_16x16x1_16x16x1_1x16x1x16_4_1x1_intrawave_v1,191.1,825.63,0.0
gfx950,256,1710,128,7168,ck,18,2,17.7075,a8w8_blockscale_1x128x128_256x64x64x256_16x16_32x32_1x1_16x16x1_16x16x1_1x32x1x8_8_1x1_intrawave_v1,177.21,768.74,0.0
gfx950,256,2006,128,7168,ck,8,2,17.7099,a8w8_blockscale_1x128x128_256x16x64x256_16x16_16x16_1x1_16x16x1_16x16x1_1x16x1x16_4_1x1_intrawave_v1,207.85,892.72,0.0
gfx950,256,2037,128,7168,ck,8,2,17.744,a8w8_blockscale_1x128x128_256x16x64x256_16x16_16x16_1x1_16x16x1_16x16x1_1x16x1x16_4_1x1_intrawave_v1,210.66,903.98,0.0
gfx950,256,1172,8192,512,ck,18,0,17.9265,a8w8_blockscale_1x128x128_256x64x64x256_16x16_32x32_1x1_16x16x1_16x16x1_1x32x1x8_8_1x1_intrawave_v1,548.43,1338.6,0.0
gfx950,256,1173,8192,512,ck,18,0,17.9507,a8w8_blockscale_1x128x128_256x64x64x256_16x16_32x32_1x1_16x16x1_16x16x1_1x32x1x8_8_1x1_intrawave_v1,548.16,1337.74,0.0
gfx950,256,1177,8192,512,ck,18,0,17.9877,a8w8_blockscale_1x128x128_256x64x64x256_16x16_32x32_1x1_16x16x1_16x16x1_1x32x1x8_8_1x1_intrawave_v1,548.9,1338.74,0.0
gfx950,256,1934,128,7168,ck,8,1,17.9972,a8w8_blockscale_1x128x128_256x16x64x256_16x16_16x16_1x1_16x16x1_16x16x1_1x16x1x16_4_1x1_intrawave_v1,197.19,848.77,0.0
gfx950,256,1213,8192,512,ck,18,0,18.0063,a8w8_blockscale_1x128x128_256x64x64x256_16x16_32x32_1x1_16x16x1_16x16x1_1x32x1x8_8_1x1_intrawave_v1,565.1,1371.14,0.0
gfx950,256,1167,8192,512,ck,18,0,18.0404,a8w8_blockscale_1x128x128_256x64x64x256_16x16_32x32_1x1_16x16x1_16x16x1_1x32x1x8_8_1x1_intrawave_v1,542.64,1325.47,0.0
gfx950,256,1169,8192,512,ck,18,0,18.0502,a8w8_blockscale_1x128x128_256x64x64x256_16x16_32x32_1x1_16x16x1_16x16x1_1x32x1x8_8_1x1_intrawave_v1,543.28,1326.62,0.0
gfx950,256,1155,8192,512,ck,18,0,18.0561,a8w8_blockscale_1x128x128_256x64x64x256_16x16_32x32_1x1_16x16x1_16x16x1_1x32x1x8_8_1x1_intrawave_v1,536.6,1313.08,0.0
gfx950,256,1208,8192,512,ck,18,0,18.0612,a8w8_blockscale_1x128x128_256x64x64x256_16x16_32x32_1x1_16x16x1_16x16x1_1x32x1x8_8_1x1_intrawave_v1,561.06,1362.29,0.0
gfx950,256,1181,8192,512,ck,18,0,18.0659,a8w8_blockscale_1x128x128_256x64x64x256_16x16_32x32_1x1_16x16x1_16x16x1_1x32x1x8_8_1x1_intrawave_v1,548.38,1336.69,0.0
gfx950,256,1159,8192,512,ck,18,0,18.0706,a8w8_blockscale_1x128x128_256x64x64x256_16x16_32x32_1x1_16x16x1_16x16x1_1x32x1x8_8_1x1_intrawave_v1,538.02,1315.77,0.0
gfx950,256,1211,8192,512,ck,18,0,18.0725,a8w8_blockscale_1x128x128_256x64x64x256_16x16_32x32_1x1_16x16x1_16x16x1_1x32x1x8_8_1x1_intrawave_v1,562.1,1364.25,0.0
gfx950,256,1179,8192,512,ck,18,0,18.0861,a8w8_blockscale_1x128x128_256x64x64x256_16x16_32x32_1x1_16x16x1_16x16x1_1x32x1x8_8_1x1_intrawave_v1,546.84,1333.33,0.0
gfx950,256,1161,8192,512,ck,18,0,18.0961,a8w8_blockscale_1x128x128_256x64x64x256_16x16_32x32_1x1_16x16x1_16x16x1_1x32x1x8_8_1x1_intrawave_v1,538.19,1315.78,0.0
gfx950,256,1180,8192,512,ck,18,0,18.1213,a8w8_blockscale_1x128x128_256x64x64x256_16x16_32x32_1x1_16x16x1_16x16x1_1x32x1x8_8_1x1_intrawave_v1,546.24,1331.67,0.0
gfx950,256,1210,8192,512,ck,18,0,18.1234,a8w8_blockscale_1x128x128_256x64x64x256_16x16_32x32_1x1_16x16x1_16x16x1_1x32x1x8_8_1x1_intrawave_v1,560.06,1359.48,0.0
gfx950,256,1153,8192,512,ck,18,0,18.1289,a8w8_blockscale_1x128x128_256x64x64x256_16x16_32x32_1x1_16x16x1_16x16x1_1x32x1x8_8_1x1_intrawave_v1,533.52,1305.95,0.0
gfx950,256,1176,8192,512,ck,18,0,18.1332,a8w8_blockscale_1x128x128_256x64x64x256_16x16_32x32_1x1_16x16x1_16x16x1_1x32x1x8_8_1x1_intrawave_v1,544.03,1327.07,0.0
gfx950,256,1206,8192,512,ck,18,0,18.1335,a8w8_blockscale_1x128x128_256x64x64x256_16x16_32x32_1x1_16x16x1_16x16x1_1x32x1x8_8_1x1_intrawave_v1,557.9,1355.0,0.0
gfx950,256,1164,8192,512,ck,18,0,18.1354,a8w8_blockscale_1x128x128_256x64x64x256_16x16_32x32_1x1_16x16x1_16x16x1_1x32x1x8_8_1x1_intrawave_v1,538.41,1315.73,0.0
gfx950,256,1259,8192,512,ck,18,0,18.1413,a8w8_blockscale_1x128x128_256x64x64x256_16x16_32x32_1x1_16x16x1_16x16x1_1x32x1x8_8_1x1_intrawave_v1,582.17,1403.78,0.0
gfx950,256,1188,8192,512,ck,18,0,18.1549,a8w8_blockscale_1x128x128_256x64x64x256_16x16_32x32_1x1_16x16x1_16x16x1_1x32x1x8_8_1x1_intrawave_v1,548.92,1336.65,0.0
gfx950,256,1170,8192,512,ck,18,0,18.1604,a8w8_blockscale_1x128x128_256x64x64x256_16x16_32x32_1x1_16x16x1_16x16x1_1x32x1x8_8_1x1_intrawave_v1,540.44,1319.5,0.0
gfx950,256,1215,8192,512,ck,18,0,18.1689,a8w8_blockscale_1x128x128_256x64x64x256_16x16_32x32_1x1_16x16x1_16x16x1_1x32x1x8_8_1x1_intrawave_v1,560.97,1360.73,0.0
gfx950,256,1203,8192,512,ck,18,0,18.1738,a8w8_blockscale_1x128x128_256x64x64x256_16x16_32x32_1x1_16x16x1_16x16x1_1x32x1x8_8_1x1_intrawave_v1,555.28,1349.21,0.0
gfx950,256,1260,8192,512,ck,18,0,18.1834,a8w8_blockscale_1x128x128_256x64x64x256_16x16_32x32_1x1_16x16x1_16x16x1_1x32x1x8_8_1x1_intrawave_v1,581.28,1401.46,0.0
gfx950,256,1279,8192,512,ck,18,0,18.2126,a8w8_blockscale_1x128x128_256x64x64x256_16x16_32x32_1x1_16x16x1_16x16x1_1x32x1x8_8_1x1_intrawave_v1,589.1,1416.84,0.0
gfx950,256,1817,128,7168,ck,8,2,18.2156,a8w8_blockscale_1x128x128_256x16x64x256_16x16_16x16_1x1_16x16x1_16x16x1_1x16x1x16_4_1x1_intrawave_v1,183.04,790.91,0.0
gfx950,256,1197,8192,512,ck,18,0,18.2216,a8w8_blockscale_1x128x128_256x64x64x256_16x16_32x32_1x1_16x16x1_16x16x1_1x32x1x8_8_1x1_intrawave_v1,551.06,1340.1,0.0
gfx950,256,1168,8192,512,ck,18,0,18.2396,a8w8_blockscale_1x128x128_256x64x64x256_16x16_32x32_1x1_16x16x1_16x16x1_1x32x1x8_8_1x1_intrawave_v1,537.18,1311.92,0.0
gfx950,256,1192,8192,512,ck,18,0,18.2452,a8w8_blockscale_1x128x128_256x64x64x256_16x16_32x32_1x1_16x16x1_16x16x1_1x32x1x8_8_1x1_intrawave_v1,548.05,1333.74,0.0
gfx950,256,1253,8192,512,ck,18,0,18.2547,a8w8_blockscale_1x128x128_256x64x64x256_16x16_32x32_1x1_16x16x1_16x16x1_1x32x1x8_8_1x1_intrawave_v1,575.79,1389.5,0.0
gfx950,256,1207,8192,512,ck,18,0,18.2645,a8w8_blockscale_1x128x128_256x64x64x256_16x16_32x32_1x1_16x16x1_16x16x1_1x32x1x8_8_1x1_intrawave_v1,554.36,1346.21,0.0
gfx950,256,1261,8192,512,ck,18,0,18.2689,a8w8_blockscale_1x128x128_256x64x64x256_16x16_32x32_1x1_16x16x1_16x16x1_1x32x1x8_8_1x1_intrawave_v1,579.02,1395.82,0.0
gfx950,256,1221,8192,512,ck,18,0,18.2862,a8w8_blockscale_1x128x128_256x64x64x256_16x16_32x32_1x1_16x16x1_16x16x1_1x32x1x8_8_1x1_intrawave_v1,560.12,1357.54,0.0
gfx950,256,1234,8192,512,ck,18,0,18.3146,a8w8_blockscale_1x128x128_256x64x64x256_16x16_32x32_1x1_16x16x1_16x16x1_1x32x1x8_8_1x1_intrawave_v1,565.21,1367.43,0.0
gfx950,256,1247,8192,512,ck,18,0,18.3178,a8w8_blockscale_1x128x128_256x64x64x256_16x16_32x32_1x1_16x16x1_16x16x1_1x32x1x8_8_1x1_intrawave_v1,571.06,1379.18,0.0
gfx950,256,1246,8192,512,ck,18,0,18.3179,a8w8_blockscale_1x128x128_256x64x64x256_16x16_32x32_1x1_16x16x1_16x16x1_1x32x1x8_8_1x1_intrawave_v1,570.6,1378.25,0.0
gfx950,256,1222,8192,512,ck,18,0,18.3179,a8w8_blockscale_1x128x128_256x64x64x256_16x16_32x32_1x1_16x16x1_16x16x1_1x32x1x8_8_1x1_intrawave_v1,559.61,1356.12,0.0
gfx950,256,1255,8192,512,ck,18,0,18.3209,a8w8_blockscale_1x128x128_256x64x64x256_16x16_32x32_1x1_16x16x1_16x16x1_1x32x1x8_8_1x1_intrawave_v1,574.63,1386.33,0.0
gfx950,256,1271,8192,512,ck,18,0,18.3209,a8w8_blockscale_1x128x128_256x64x64x256_16x16_32x32_1x1_16x16x1_16x16x1_1x32x1x8_8_1x1_intrawave_v1,581.95,1401.08,0.0
gfx950,256,1244,8192,512,ck,18,0,18.3252,a8w8_blockscale_1x128x128_256x64x64x256_16x16_32x32_1x1_16x16x1_16x16x1_1x32x1x8_8_1x1_intrawave_v1,569.46,1375.86,0.0
gfx950,256,1249,8192,512,ck,18,0,18.334,a8w8_blockscale_1x128x128_256x64x64x256_16x16_32x32_1x1_16x16x1_16x16x1_1x32x1x8_8_1x1_intrawave_v1,571.47,1379.81,0.0
gfx950,256,1218,8192,512,ck,18,0,18.3633,a8w8_blockscale_1x128x128_256x64x64x256_16x16_32x32_1x1_16x16x1_16x16x1_1x32x1x8_8_1x1_intrawave_v1,556.4,1349.08,0.0
gfx950,256,1241,8192,512,ck,18,0,18.3673,a8w8_blockscale_1x128x128_256x64x64x256_16x16_32x32_1x1_16x16x1_16x16x1_1x32x1x8_8_1x1_intrawave_v1,566.78,1369.95,0.0
gfx950,256,1225,8192,512,ck,18,0,18.3872,a8w8_blockscale_1x128x128_256x64x64x256_16x16_32x32_1x1_16x16x1_16x16x1_1x32x1x8_8_1x1_intrawave_v1,558.87,1353.76,0.0
gfx950,256,1231,8192,512,ck,18,0,18.3947,a8w8_blockscale_1x128x128_256x64x64x256_16x16_32x32_1x1_16x16x1_16x16x1_1x32x1x8_8_1x1_intrawave_v1,561.38,1358.72,0.0
gfx950,256,1227,8192,512,ck,18,0,18.3947,a8w8_blockscale_1x128x128_256x64x64x256_16x16_32x32_1x1_16x16x1_16x16x1_1x32x1x8_8_1x1_intrawave_v1,559.55,1355.05,0.0
gfx950,256,1252,8192,512,ck,18,0,18.3963,a8w8_blockscale_1x128x128_256x64x64x256_16x16_32x32_1x1_16x16x1_16x16x1_1x32x1x8_8_1x1_intrawave_v1,570.9,1377.89,0.0
gfx950,256,1265,8192,512,ck,18,0,18.3983,a8w8_blockscale_1x128x128_256x64x64x256_16x16_32x32_1x1_16x16x1_16x16x1_1x32x1x8_8_1x1_intrawave_v1,576.77,1389.68,0.0
gfx950,256,1256,8192,512,ck,18,0,18.4074,a8w8_blockscale_1x128x128_256x64x64x256_16x16_32x32_1x1_16x16x1_16x16x1_1x32x1x8_8_1x1_intrawave_v1,572.38,1380.73,0.0
gfx950,256,1266,8192,512,ck,18,0,18.4107,a8w8_blockscale_1x128x128_256x64x64x256_16x16_32x32_1x1_16x16x1_16x16x1_1x32x1x8_8_1x1_intrawave_v1,576.84,1389.66,0.0
gfx950,256,1229,8192,512,ck,18,0,18.4204,a8w8_blockscale_1x128x128_256x64x64x256_16x16_32x32_1x1_16x16x1_16x16x1_1x32x1x8_8_1x1_intrawave_v1,559.68,1354.99,0.0
gfx950,256,1264,8192,512,ck,18,0,18.4213,a8w8_blockscale_1x128x128_256x64x64x256_16x16_32x32_1x1_16x16x1_16x16x1_1x32x1x8_8_1x1_intrawave_v1,575.59,1387.03,0.0
gfx950,256,1262,8192,512,ck,18,0,18.4335,a8w8_blockscale_1x128x128_256x64x64x256_16x16_32x32_1x1_16x16x1_16x16x1_1x32x1x8_8_1x1_intrawave_v1,574.3,1384.28,0.0
gfx950,256,1267,8192,512,ck,18,0,18.4391,a8w8_blockscale_1x128x128_256x64x64x256_16x16_32x32_1x1_16x16x1_16x16x1_1x32x1x8_8_1x1_intrawave_v1,576.4,1388.44,0.0
gfx950,256,1268,8192,512,ck,18,0,18.4662,a8w8_blockscale_1x128x128_256x64x64x256_16x16_32x32_1x1_16x16x1_16x16x1_1x32x1x8_8_1x1_intrawave_v1,576.01,1387.31,0.0
gfx950,256,1220,8192,512,ck,18,0,18.4692,a8w8_blockscale_1x128x128_256x64x64x256_16x16_32x32_1x1_16x16x1_16x16x1_1x32x1x8_8_1x1_intrawave_v1,554.12,1343.18,0.0
gfx950,256,1275,8192,512,ck,18,0,18.483,a8w8_blockscale_1x128x128_256x64x64x256_16x16_32x32_1x1_16x16x1_16x16x1_1x32x1x8_8_1x1_intrawave_v1,578.67,1392.45,0.0
gfx950,256,1263,8192,512,ck,18,0,18.5018,a8w8_blockscale_1x128x128_256x64x64x256_16x16_32x32_1x1_16x16x1_16x16x1_1x32x1x8_8_1x1_intrawave_v1,572.64,1380.08,0.0
gfx950,256,1224,8192,512,ck,18,0,18.516,a8w8_blockscale_1x128x128_256x64x64x256_16x16_32x32_1x1_16x16x1_16x16x1_1x32x1x8_8_1x1_intrawave_v1,554.53,1343.43,0.0
gfx950,256,1236,8192,512,ck,18,0,18.6206,a8w8_blockscale_1x128x128_256x64x64x256_16x16_32x32_1x1_16x16x1_16x16x1_1x32x1x8_8_1x1_intrawave_v1,556.82,1346.78,0.0
gfx950,256,1314,8192,512,ck,18,0,19.1436,a8w8_blockscale_1x128x128_256x64x64x256_16x16_32x32_1x1_16x16x1_16x16x1_1x32x1x8_8_1x1_intrawave_v1,575.79,1378.82,0.0
gfx950,256,1331,8192,512,ck,18,0,19.1614,a8w8_blockscale_1x128x128_256x64x64x256_16x16_32x32_1x1_16x16x1_16x16x1_1x32x1x8_8_1x1_intrawave_v1,582.69,1392.53,0.0
gfx950,256,1311,8192,512,ck,18,0,19.1825,a8w8_blockscale_1x128x128_256x64x64x256_16x16_32x32_1x1_16x16x1_16x16x1_1x32x1x8_8_1x1_intrawave_v1,573.31,1373.39,0.0
gfx950,256,1329,8192,512,ck,18,0,19.2281,a8w8_blockscale_1x128x128_256x64x64x256_16x16_32x32_1x1_16x16x1_16x16x1_1x32x1x8_8_1x1_intrawave_v1,579.8,1385.94,0.0
gfx950,256,1337,8192,512,ck,18,0,19.2404,a8w8_blockscale_1x128x128_256x64x64x256_16x16_32x32_1x1_16x16x1_16x16x1_1x32x1x8_8_1x1_intrawave_v1,582.92,1392.08,0.0
gfx950,256,1308,8192,512,ck,18,0,19.2531,a8w8_blockscale_1x128x128_256x64x64x256_16x16_32x32_1x1_16x16x1_16x16x1_1x32x1x8_8_1x1_intrawave_v1,569.9,1365.72,0.0
gfx950,256,1348,8192,512,ck,18,0,19.2721,a8w8_blockscale_1x128x128_256x64x64x256_16x16_32x32_1x1_16x16x1_16x16x1_1x32x1x8_8_1x1_intrawave_v1,586.75,1399.44,0.0
gfx950,256,1316,8192,512,ck,18,0,19.3069,a8w8_blockscale_1x128x128_256x64x64x256_16x16_32x32_1x1_16x16x1_16x16x1_1x32x1x8_8_1x1_intrawave_v1,571.79,1368.91,0.0
gfx950,256,1289,8192,512,ck,18,0,19.32,a8w8_blockscale_1x128x128_256x64x64x256_16x16_32x32_1x1_16x16x1_16x16x1_1x32x1x8_8_1x1_intrawave_v1,559.67,1344.37,0.0
gfx950,256,1338,8192,512,ck,18,0,19.3242,a8w8_blockscale_1x128x128_256x64x64x256_16x16_32x32_1x1_16x16x1_16x16x1_1x32x1x8_8_1x1_intrawave_v1,580.82,1386.92,0.0
gfx950,256,2056,128,7168,ck,8,2,19.3377,a8w8_blockscale_1x128x128_256x16x64x256_16x16_16x16_1x1_16x16x1_16x16x1_1x16x1x16_4_1x1_intrawave_v1,195.1,836.77,0.0
gfx950,256,1341,8192,512,ck,18,0,19.3695,a8w8_blockscale_1x128x128_256x64x64x256_16x16_32x32_1x1_16x16x1_16x16x1_1x32x1x8_8_1x1_intrawave_v1,580.76,1386.29,0.0
gfx950,256,1365,8192,512,ck,18,0,19.3754,a8w8_blockscale_1x128x128_256x64x64x256_16x16_32x32_1x1_16x16x1_16x16x1_1x32x1x8_8_1x1_intrawave_v1,590.98,1406.8,0.0
gfx950,256,1323,8192,512,ck,18,0,19.3785,a8w8_blockscale_1x128x128_256x64x64x256_16x16_32x32_1x1_16x16x1_16x16x1_1x32x1x8_8_1x1_intrawave_v1,572.7,1369.96,0.0
gfx950,256,1301,8192,512,ck,18,0,19.3857,a8w8_blockscale_1x128x128_256x64x64x256_16x16_32x32_1x1_16x16x1_16x16x1_1x32x1x8_8_1x1_intrawave_v1,562.97,1350.27,0.0
gfx950,256,1352,8192,512,ck,18,0,19.3875,a8w8_blockscale_1x128x128_256x64x64x256_16x16_32x32_1x1_16x16x1_16x16x1_1x32x1x8_8_1x1_intrawave_v1,584.99,1394.59,0.0
gfx950,256,1361,8192,512,ck,18,0,19.3879,a8w8_blockscale_1x128x128_256x64x64x256_16x16_32x32_1x1_16x16x1_16x16x1_1x32x1x8_8_1x1_intrawave_v1,588.87,1402.41,0.0
gfx950,256,1295,8192,512,ck,18,0,19.3899,a8w8_blockscale_1x128x128_256x64x64x256_16x16_32x32_1x1_16x16x1_16x16x1_1x32x1x8_8_1x1_intrawave_v1,560.25,1344.75,0.0
gfx950,256,1359,8192,512,ck,18,0,19.395,a8w8_blockscale_1x128x128_256x64x64x256_16x16_32x32_1x1_16x16x1_16x16x1_1x32x1x8_8_1x1_intrawave_v1,587.79,1400.15,0.0
gfx950,256,1297,8192,512,ck,18,0,19.4036,a8w8_blockscale_1x128x128_256x64x64x256_16x16_32x32_1x1_16x16x1_16x16x1_1x32x1x8_8_1x1_intrawave_v1,560.72,1345.54,0.0
gfx950,256,1376,8192,512,ck,18,0,19.4067,a8w8_blockscale_1x128x128_256x64x64x256_16x16_32x32_1x1_16x16x1_16x16x1_1x32x1x8_8_1x1_intrawave_v1,594.78,1414.11,0.0
gfx950,256,1343,8192,512,ck,18,0,19.415,a8w8_blockscale_1x128x128_256x64x64x256_16x16_32x32_1x1_16x16x1_16x16x1_1x32x1x8_8_1x1_intrawave_v1,580.27,1384.79,0.0
gfx950,256,1302,8192,512,ck,18,0,19.4165,a8w8_blockscale_1x128x128_256x64x64x256_16x16_32x32_1x1_16x16x1_16x16x1_1x32x1x8_8_1x1_intrawave_v1,562.51,1349.0,0.0
gfx950,256,1381,8192,512,ck,18,0,19.4194,a8w8_blockscale_1x128x128_256x64x64x256_16x16_32x32_1x1_16x16x1_16x16x1_1x32x1x8_8_1x1_intrawave_v1,596.55,1417.54,0.0
gfx950,256,1312,8192,512,ck,18,0,19.4198,a8w8_blockscale_1x128x128_256x64x64x256_16x16_32x32_1x1_16x16x1_16x16x1_1x32x1x8_8_1x1_intrawave_v1,566.73,1357.47,0.0
gfx950,256,1358,8192,512,ck,18,0,19.422,a8w8_blockscale_1x128x128_256x64x64x256_16x16_32x32_1x1_16x16x1_16x16x1_1x32x1x8_8_1x1_intrawave_v1,586.54,1397.34,0.0
gfx950,256,2054,128,7168,ck,8,2,19.4223,a8w8_blockscale_1x128x128_256x16x64x256_16x16_16x16_1x1_16x16x1_16x16x1_1x16x1x16_4_1x1_intrawave_v1,194.06,832.36,0.0
gfx950,256,1292,8192,512,ck,18,0,19.4226,a8w8_blockscale_1x128x128_256x64x64x256_16x16_32x32_1x1_16x16x1_16x16x1_1x32x1x8_8_1x1_intrawave_v1,558.01,1339.88,0.0
gfx950,256,1309,8192,512,ck,18,0,19.4228,a8w8_blockscale_1x128x128_256x64x64x256_16x16_32x32_1x1_16x16x1_16x16x1_1x32x1x8_8_1x1_intrawave_v1,565.35,1354.65,0.0
gfx950,256,1968,128,7168,ck,8,0,19.4303,a8w8_blockscale_1x128x128_256x16x64x256_16x16_16x16_1x1_16x16x1_16x16x1_1x16x1x16_4_1x1_intrawave_v1,185.86,799.16,0.0
gfx950,256,1396,8192,512,ck,18,0,19.4577,a8w8_blockscale_1x128x128_256x64x64x256_16x16_32x32_1x1_16x16x1_16x16x1_1x32x1x8_8_1x1_intrawave_v1,601.84,1427.77,0.0
gfx950,256,1300,8192,512,ck,18,0,19.47,a8w8_blockscale_1x128x128_256x64x64x256_16x16_32x32_1x1_16x16x1_16x16x1_1x32x1x8_8_1x1_intrawave_v1,560.1,1343.56,0.0
gfx950,256,1326,8192,512,ck,18,0,19.4792,a8w8_blockscale_1x128x128_256x64x64x256_16x16_32x32_1x1_16x16x1_16x16x1_1x32x1x8_8_1x1_intrawave_v1,571.03,1365.48,0.0
gfx950,256,1388,8192,512,ck,18,0,19.4808,a8w8_blockscale_1x128x128_256x64x64x256_16x16_32x32_1x1_16x16x1_16x16x1_1x32x1x8_8_1x1_intrawave_v1,597.69,1419.14,0.0
gfx950,256,1294,8192,512,ck,18,0,19.483,a8w8_blockscale_1x128x128_256x64x64x256_16x16_32x32_1x1_16x16x1_16x16x1_1x32x1x8_8_1x1_intrawave_v1,557.15,1337.46,0.0
gfx950,256,1345,8192,512,ck,18,0,19.5021,a8w8_blockscale_1x128x128_256x64x64x256_16x16_32x32_1x1_16x16x1_16x16x1_1x32x1x8_8_1x1_intrawave_v1,578.54,1380.33,0.0
gfx950,256,2032,128,7168,ck,8,0,19.5057,a8w8_blockscale_1x128x128_256x16x64x256_16x16_16x16_1x1_16x16x1_16x16x1_1x16x1x16_4_1x1_intrawave_v1,191.16,820.43,0.0
gfx950,256,2085,128,7168,ck,8,2,19.5115,a8w8_blockscale_1x128x128_256x16x64x256_16x16_16x16_1x1_16x16x1_16x16x1_1x16x1x16_4_1x1_intrawave_v1,196.09,840.35,0.0
gfx950,256,1354,8192,512,ck,18,0,19.5117,a8w8_blockscale_1x128x128_256x64x64x256_16x16_32x32_1x1_16x16x1_16x16x1_1x32x1x8_8_1x1_intrawave_v1,582.12,1387.45,0.0
gfx950,256,1379,8192,512,ck,18,0,19.5212,a8w8_blockscale_1x128x128_256x64x64x256_16x16_32x32_1x1_16x16x1_16x16x1_1x32x1x8_8_1x1_intrawave_v1,592.58,1408.41,0.0
gfx950,256,2087,128,7168,ck,8,2,19.5215,a8w8_blockscale_1x128x128_256x16x64x256_16x16_16x16_1x1_16x16x1_16x16x1_1x16x1x16_4_1x1_intrawave_v1,196.18,840.68,0.0
gfx950,256,1310,8192,512,ck,18,0,19.5216,a8w8_blockscale_1x128x128_256x64x64x256_16x16_32x32_1x1_16x16x1_16x16x1_1x32x1x8_8_1x1_intrawave_v1,562.92,1348.66,0.0
gfx950,256,1347,8192,512,ck,18,0,19.5239,a8w8_blockscale_1x128x128_256x64x64x256_16x16_32x32_1x1_16x16x1_16x16x1_1x32x1x8_8_1x1_intrawave_v1,578.75,1380.52,0.0
gfx950,256,1382,8192,512,ck,18,0,19.5254,a8w8_blockscale_1x128x128_256x64x64x256_16x16_32x32_1x1_16x16x1_16x16x1_1x32x1x8_8_1x1_intrawave_v1,593.74,1410.7,0.0
gfx950,256,1380,8192,512,ck,18,0,19.5277,a8w8_blockscale_1x128x128_256x64x64x256_16x16_32x32_1x1_16x16x1_16x16x1_1x32x1x8_8_1x1_intrawave_v1,592.81,1408.81,0.0
gfx950,256,1393,8192,512,ck,18,0,19.541,a8w8_blockscale_1x128x128_256x64x64x256_16x16_32x32_1x1_16x16x1_16x16x1_1x32x1x8_8_1x1_intrawave_v1,597.99,1419.09,0.0
gfx950,256,1395,8192,512,ck,18,0,19.5658,a8w8_blockscale_1x128x128_256x64x64x256_16x16_32x32_1x1_16x16x1_16x16x1_1x32x1x8_8_1x1_intrawave_v1,598.09,1419.02,0.0
gfx950,256,1374,8192,512,ck,18,0,19.5691,a8w8_blockscale_1x128x128_256x64x64x256_16x16_32x32_1x1_16x16x1_16x16x1_1x32x1x8_8_1x1_intrawave_v1,588.99,1400.65,0.0
gfx950,256,1404,8192,512,ck,18,0,19.5746,a8w8_blockscale_1x128x128_256x64x64x256_16x16_32x32_1x1_16x16x1_16x16x1_1x32x1x8_8_1x1_intrawave_v1,601.68,1426.15,0.0
gfx950,256,1403,8192,512,ck,18,0,19.5798,a8w8_blockscale_1x128x128_256x64x64x256_16x16_32x32_1x1_16x16x1_16x16x1_1x32x1x8_8_1x1_intrawave_v1,601.09,1424.91,0.0
gfx950,256,1303,8192,512,ck,18,0,19.5806,a8w8_blockscale_1x128x128_256x64x64x256_16x16_32x32_1x1_16x16x1_16x16x1_1x32x1x8_8_1x1_intrawave_v1,558.22,1338.56,0.0
gfx950,256,1377,8192,512,ck,18,0,19.5818,a8w8_blockscale_1x128x128_256x64x64x256_16x16_32x32_1x1_16x16x1_16x16x1_1x32x1x8_8_1x1_intrawave_v1,589.89,1402.33,0.0
gfx950,256,2109,128,7168,ck,8,2,19.5891,a8w8_blockscale_1x128x128_256x16x64x256_16x16_16x16_1x1_16x16x1_16x16x1_1x16x1x16_4_1x1_intrawave_v1,197.56,846.12,0.0
gfx950,256,1360,8192,512,ck,18,0,19.5917,a8w8_blockscale_1x128x128_256x64x64x256_16x16_32x32_1x1_16x16x1_16x16x1_1x32x1x8_8_1x1_intrawave_v1,582.31,1386.96,0.0
gfx950,256,1399,8192,512,ck,18,0,19.5948,a8w8_blockscale_1x128x128_256x64x64x256_16x16_32x32_1x1_16x16x1_16x16x1_1x32x1x8_8_1x1_intrawave_v1,598.92,1420.37,0.0
gfx950,256,1367,8192,512,ck,18,0,19.5965,a8w8_blockscale_1x128x128_256x64x64x256_16x16_32x32_1x1_16x16x1_16x16x1_1x32x1x8_8_1x1_intrawave_v1,585.17,1392.65,0.0
gfx950,256,2091,128,7168,ck,8,2,19.5991,a8w8_blockscale_1x128x128_256x16x64x256_16x16_16x16_1x1_16x16x1_16x16x1_1x16x1x16_4_1x1_intrawave_v1,195.77,838.87,0.0
gfx950,256,1406,8192,512,ck,18,0,19.603,a8w8_blockscale_1x128x128_256x64x64x256_16x16_32x32_1x1_16x16x1_16x16x1_1x32x1x8_8_1x1_intrawave_v1,601.66,1425.81,0.0
gfx950,256,1385,8192,512,ck,18,0,19.6048,a8w8_blockscale_1x128x128_256x64x64x256_16x16_32x32_1x1_16x16x1_16x16x1_1x32x1x8_8_1x1_intrawave_v1,592.62,1407.58,0.0
gfx950,256,1401,8192,512,ck,18,0,19.6056,a8w8_blockscale_1x128x128_256x64x64x256_16x16_32x32_1x1_16x16x1_16x16x1_1x32x1x8_8_1x1_intrawave_v1,599.44,1421.31,0.0
gfx950,256,1375,8192,512,ck,18,0,19.6058,a8w8_blockscale_1x128x128_256x64x64x256_16x16_32x32_1x1_16x16x1_16x16x1_1x32x1x8_8_1x1_intrawave_v1,588.31,1398.89,0.0
gfx950,256,1383,8192,512,ck,18,0,19.6186,a8w8_blockscale_1x128x128_256x64x64x256_16x16_32x32_1x1_16x16x1_16x16x1_1x32x1x8_8_1x1_intrawave_v1,591.35,1404.86,0.0
gfx950,256,2128,128,7168,ck,8,2,19.6263,a8w8_blockscale_1x128x128_256x16x64x256_16x16_16x16_1x1_16x16x1_16x16x1_1x16x1x16_4_1x1_intrawave_v1,198.96,851.7,0.0
gfx950,256,1384,8192,512,ck,18,0,19.63,a8w8_blockscale_1x128x128_256x64x64x256_16x16_32x32_1x1_16x16x1_16x16x1_1x32x1x8_8_1x1_intrawave_v1,591.43,1404.91,0.0
gfx950,256,1369,8192,512,ck,18,0,19.6362,a8w8_blockscale_1x128x128_256x64x64x256_16x16_32x32_1x1_16x16x1_16x16x1_1x32x1x8_8_1x1_intrawave_v1,584.84,1391.56,0.0
gfx950,256,1371,8192,512,ck,18,0,19.6539,a8w8_blockscale_1x128x128_256x64x64x256_16x16_32x32_1x1_16x16x1_16x16x1_1x32x1x8_8_1x1_intrawave_v1,585.17,1392.02,0.0
gfx950,256,1351,8192,512,ck,18,0,19.6804,a8w8_blockscale_1x128x128_256x64x64x256_16x16_32x32_1x1_16x16x1_16x16x1_1x32x1x8_8_1x1_intrawave_v1,575.85,1372.98,0.0
gfx950,256,1397,8192,512,ck,18,0,19.7292,a8w8_blockscale_1x128x128_256x64x64x256_16x16_32x32_1x1_16x16x1_16x16x1_1x32x1x8_8_1x1_intrawave_v1,593.99,1408.98,0.0
gfx950,256,2112,128,7168,ck,18,1,19.7591,a8w8_blockscale_1x128x128_256x64x64x256_16x16_32x32_1x1_16x16x1_16x16x1_1x32x1x8_8_1x1_intrawave_v1,196.14,839.97,0.0
gfx950,256,1344,8192,512,ck,18,0,19.8271,a8w8_blockscale_1x128x128_256x64x64x256_16x16_32x32_1x1_16x16x1_16x16x1_1x32x1x8_8_1x1_intrawave_v1,568.63,1356.86,0.0
gfx950,256,2160,128,7168,ck,8,2,19.8358,a8w8_blockscale_1x128x128_256x16x64x256_16x16_16x16_1x1_16x16x1_16x16x1_1x16x1x16_4_1x1_intrawave_v1,199.82,854.68,0.0
gfx950,256,1387,8192,512,ck,18,0,19.8528,a8w8_blockscale_1x128x128_256x64x64x256_16x16_32x32_1x1_16x16x1_16x16x1_1x32x1x8_8_1x1_intrawave_v1,586.06,1391.7,0.0
gfx950,256,2166,128,7168,ck,8,2,19.8745,a8w8_blockscale_1x128x128_256x16x64x256_16x16_16x16_1x1_16x16x1_16x16x1_1x16x1x16_4_1x1_intrawave_v1,199.99,855.26,0.0
gfx950,256,2161,128,7168,ck,8,2,19.901,a8w8_blockscale_1x128x128_256x16x64x256_16x16_16x16_1x1_16x16x1_16x16x1_1x16x1x16_4_1x1_intrawave_v1,199.26,852.26,0.0
gfx950,256,2088,128,7168,ck,8,2,19.9122,a8w8_blockscale_1x128x128_256x16x64x256_16x16_16x16_1x1_16x16x1_16x16x1_1x16x1x16_4_1x1_intrawave_v1,192.42,824.56,0.0
gfx950,256,1469,8192,512,ck,0,0,19.939,a8w8_blockscale_1x128x128_256x128x128x128_16x16_32x32_2x2_8x32x1_8x32x1_1x32x1x8_8_1x1_intrawave_v3,618.03,1455.16,0.0
gfx950,256,2127,128,7168,ck,18,1,19.9431,a8w8_blockscale_1x128x128_256x64x64x256_16x16_32x32_1x1_16x16x1_16x16x1_1x32x1x8_8_1x1_intrawave_v1,195.71,837.8,0.0
gfx950,256,2129,128,7168,ck,18,1,19.9487,a8w8_blockscale_1x128x128_256x64x64x256_16x16_32x32_1x1_16x16x1_16x16x1_1x32x1x8_8_1x1_intrawave_v1,195.84,838.31,0.0
gfx950,256,1428,8192,512,ck,0,0,19.951,a8w8_blockscale_1x128x128_256x128x128x128_16x16_32x32_2x2_8x32x1_8x32x1_1x32x1x8_8_1x1_intrawave_v3,600.42,1419.57,0.0
gfx950,256,1531,8192,512,ck,0,0,19.9532,a8w8_blockscale_1x128x128_256x128x128x128_16x16_32x32_2x2_8x32x1_8x32x1_1x32x1x8_8_1x1_intrawave_v3,643.65,1506.63,0.0
gfx950,256,2086,128,7168,ck,18,1,19.9784,a8w8_blockscale_1x128x128_256x64x64x256_16x16_32x32_1x1_16x16x1_16x16x1_1x32x1x8_8_1x1_intrawave_v1,191.6,821.09,0.0
gfx950,256,1500,8192,512,ck,0,0,19.9813,a8w8_blockscale_1x128x128_256x128x128x128_16x16_32x32_2x2_8x32x1_8x32x1_1x32x1x8_8_1x1_intrawave_v3,629.73,1478.3,0.0
gfx950,256,2111,128,7168,ck,18,1,19.9929,a8w8_blockscale_1x128x128_256x64x64x256_16x16_32x32_1x1_16x16x1_16x16x1_1x32x1x8_8_1x1_intrawave_v1,193.75,829.77,0.0
gfx950,256,1490,8192,512,ck,0,0,19.995,a8w8_blockscale_1x128x128_256x128x128x128_16x16_32x32_2x2_8x32x1_8x32x1_1x32x1x8_8_1x1_intrawave_v3,625.11,1468.83,0.0
gfx950,256,2149,128,7168,ck,8,2,19.9982,a8w8_blockscale_1x128x128_256x16x64x256_16x16_16x16_1x1_16x16x1_16x16x1_1x16x1x16_4_1x1_intrawave_v1,197.19,843.66,0.0
gfx950,256,2130,128,7168,ck,18,1,19.9987,a8w8_blockscale_1x128x128_256x64x64x256_16x16_32x32_1x1_16x16x1_16x16x1_1x32x1x8_8_1x1_intrawave_v1,195.44,836.59,0.0
gfx950,256,2188,128,7168,ck,18,1,19.9991,a8w8_blockscale_1x128x128_256x64x64x256_16x16_32x32_1x1_16x16x1_16x16x1_1x32x1x8_8_1x1_intrawave_v1,200.76,858.1,0.0
gfx950,256,1417,8192,512,ck,0,0,20.0008,a8w8_blockscale_1x128x128_256x128x128x128_16x16_32x32_2x2_8x32x1_8x32x1_1x32x1x8_8_1x1_intrawave_v3,594.31,1406.74,0.0
gfx950,256,2186,128,7168,ck,18,1,20.0035,a8w8_blockscale_1x128x128_256x64x64x256_16x16_32x32_1x1_16x16x1_16x16x1_1x32x1x8_8_1x1_intrawave_v1,200.53,857.17,0.0
gfx950,256,2185,128,7168,ck,18,1,20.0048,a8w8_blockscale_1x128x128_256x64x64x256_16x16_32x32_1x1_16x16x1_16x16x1_1x32x1x8_8_1x1_intrawave_v1,200.43,856.74,0.0
gfx950,256,1476,8192,512,ck,0,0,20.0183,a8w8_blockscale_1x128x128_256x128x128x128_16x16_32x32_2x2_8x32x1_8x32x1_1x32x1x8_8_1x1_intrawave_v3,618.51,1455.31,0.0
gfx950,256,1506,8192,512,ck,0,0,20.0233,a8w8_blockscale_1x128x128_256x128x128x128_16x16_32x32_2x2_8x32x1_8x32x1_1x32x1x8_8_1x1_intrawave_v3,630.93,1480.26,0.0
gfx950,256,1450,8192,512,ck,0,0,20.0256,a8w8_blockscale_1x128x128_256x128x128x128_16x16_32x32_2x2_8x32x1_8x32x1_1x32x1x8_8_1x1_intrawave_v3,607.4,1432.84,0.0
gfx950,256,1425,8192,512,ck,0,0,20.0264,a8w8_blockscale_1x128x128_256x128x128x128_16x16_32x32_2x2_8x32x1_8x32x1_1x32x1x8_8_1x1_intrawave_v3,596.9,1411.69,0.0
gfx950,256,1461,8192,512,ck,0,0,20.0286,a8w8_blockscale_1x128x128_256x128x128x128_16x16_32x32_2x2_8x32x1_8x32x1_1x32x1x8_8_1x1_intrawave_v3,611.91,1441.91,0.0
gfx950,256,1431,8192,512,ck,0,0,20.0314,a8w8_blockscale_1x128x128_256x128x128x128_16x16_32x32_2x2_8x32x1_8x32x1_1x32x1x8_8_1x1_intrawave_v3,599.26,1416.4,0.0
gfx950,256,2163,128,7168,ck,8,2,20.0339,a8w8_blockscale_1x128x128_256x16x64x256_16x16_16x16_1x1_16x16x1_16x16x1_1x16x1x16_4_1x1_intrawave_v1,198.12,847.34,0.0
gfx950,256,1459,8192,512,ck,0,0,20.06,a8w8_blockscale_1x128x128_256x128x128x128_16x16_32x32_2x2_8x32x1_8x32x1_1x32x1x8_8_1x1_intrawave_v3,610.12,1437.96,0.0
gfx950,256,2146,128,7168,ck,8,2,20.0645,a8w8_blockscale_1x128x128_256x16x64x256_16x16_16x16_1x1_16x16x1_16x16x1_1x16x1x16_4_1x1_intrawave_v1,196.26,839.76,0.0
gfx950,256,1514,8192,512,ck,0,0,20.0665,a8w8_blockscale_1x128x128_256x128x128x128_16x16_32x32_2x2_8x32x1_8x32x1_1x32x1x8_8_1x1_intrawave_v3,632.91,1483.81,0.0
gfx950,256,2249,128,7168,ck,8,2,20.0678,a8w8_blockscale_1x128x128_256x16x64x256_16x16_16x16_1x1_16x16x1_16x16x1_1x16x1x16_4_1x1_intrawave_v1,205.65,877.73,0.0
gfx950,256,1430,8192,512,ck,0,0,20.0699,a8w8_blockscale_1x128x128_256x128x128x128_16x16_32x32_2x2_8x32x1_8x32x1_1x32x1x8_8_1x1_intrawave_v3,597.7,1412.84,0.0
gfx950,256,2189,128,7168,ck,8,2,20.0701,a8w8_blockscale_1x128x128_256x16x64x256_16x16_16x16_1x1_16x16x1_16x16x1_1x16x1x16_4_1x1_intrawave_v1,200.14,855.43,0.0
gfx950,256,1410,8192,512,ck,0,0,20.0705,a8w8_blockscale_1x128x128_256x128x128x128_16x16_32x32_2x2_8x32x1_8x32x1_1x32x1x8_8_1x1_intrawave_v3,589.32,1395.96,0.0
gfx950,256,1511,8192,512,ck,0,0,20.0762,a8w8_blockscale_1x128x128_256x128x128x128_16x16_32x32_2x2_8x32x1_8x32x1_1x32x1x8_8_1x1_intrawave_v3,631.35,1480.57,0.0
gfx950,256,1437,8192,512,ck,0,0,20.0796,a8w8_blockscale_1x128x128_256x128x128x128_16x16_32x32_2x2_8x32x1_8x32x1_1x32x1x8_8_1x1_intrawave_v3,600.33,1418.05,0.0
gfx950,256,1498,8192,512,ck,0,0,20.0809,a8w8_blockscale_1x128x128_256x128x128x128_16x16_32x32_2x2_8x32x1_8x32x1_1x32x1x8_8_1x1_intrawave_v3,625.78,1469.28,0.0
gfx950,256,1471,8192,512,ck,0,0,20.0902,a8w8_blockscale_1x128x128_256x128x128x128_16x16_32x32_2x2_8x32x1_8x32x1_1x32x1x8_8_1x1_intrawave_v3,614.21,1445.9,0.0
gfx950,256,1423,8192,512,ck,0,0,20.0917,a8w8_blockscale_1x128x128_256x128x128x128_16x16_32x32_2x2_8x32x1_8x32x1_1x32x1x8_8_1x1_intrawave_v3,594.13,1405.42,0.0
gfx950,256,1496,8192,512,ck,0,0,20.0971,a8w8_blockscale_1x128x128_256x128x128x128_16x16_32x32_2x2_8x32x1_8x32x1_1x32x1x8_8_1x1_intrawave_v3,624.44,1466.42,0.0
gfx950,256,1454,8192,512,ck,0,0,20.1064,a8w8_blockscale_1x128x128_256x128x128x128_16x16_32x32_2x2_8x32x1_8x32x1_1x32x1x8_8_1x1_intrawave_v3,606.62,1430.44,0.0
gfx950,256,1435,8192,512,ck,0,0,20.1075,a8w8_blockscale_1x128x128_256x128x128x128_16x16_32x32_2x2_8x32x1_8x32x1_1x32x1x8_8_1x1_intrawave_v3,598.66,1414.4,0.0
gfx950,256,1497,8192,512,ck,0,0,20.1109,a8w8_blockscale_1x128x128_256x128x128x128_16x16_32x32_2x2_8x32x1_8x32x1_1x32x1x8_8_1x1_intrawave_v3,624.42,1466.25,0.0
gfx950,256,1485,128,7168,ck,8,0,20.1264,a8w8_blockscale_1x128x128_256x16x64x256_16x16_16x16_1x1_16x16x1_16x16x1_1x16x1x16_4_1x1_intrawave_v1,135.39,593.36,0.0
gfx950,256,2164,128,7168,ck,18,1,20.1278,a8w8_blockscale_1x128x128_256x64x64x256_16x16_32x32_1x1_16x16x1_16x16x1_1x32x1x8_8_1x1_intrawave_v1,197.29,843.76,0.0
gfx950,256,1444,8192,512,ck,0,0,20.128,a8w8_blockscale_1x128x128_256x128x128x128_16x16_32x32_2x2_8x32x1_8x32x1_1x32x1x8_8_1x1_intrawave_v3,601.81,1420.52,0.0
gfx950,256,1452,8192,512,ck,0,0,20.1296,a8w8_blockscale_1x128x128_256x128x128x128_16x16_32x32_2x2_8x32x1_8x32x1_1x32x1x8_8_1x1_intrawave_v3,605.09,1427.12,0.0
gfx950,256,2248,128,7168,ck,18,1,20.1354,a8w8_blockscale_1x128x128_256x64x64x256_16x16_32x32_1x1_16x16x1_16x16x1_1x32x1x8_8_1x1_intrawave_v1,204.87,874.41,0.0
gfx950,256,1521,8192,512,ck,0,0,20.1357,a8w8_blockscale_1x128x128_256x128x128x128_16x16_32x32_2x2_8x32x1_8x32x1_1x32x1x8_8_1x1_intrawave_v3,633.65,1484.58,0.0
gfx950,256,2219,128,7168,ck,8,2,20.1366,a8w8_blockscale_1x128x128_256x16x64x256_16x16_16x16_1x1_16x16x1_16x16x1_1x16x1x16_4_1x1_intrawave_v1,202.21,863.67,0.0
gfx950,256,1519,8192,512,ck,0,0,20.1394,a8w8_blockscale_1x128x128_256x128x128x128_16x16_32x32_2x2_8x32x1_8x32x1_1x32x1x8_8_1x1_intrawave_v3,632.7,1482.63,0.0
gfx950,256,1495,8192,512,ck,0,0,20.1439,a8w8_blockscale_1x128x128_256x128x128x128_16x16_32x32_2x2_8x32x1_8x32x1_1x32x1x8_8_1x1_intrawave_v3,622.57,1462.17,0.0
gfx950,256,1447,8192,512,ck,0,0,20.1446,a8w8_blockscale_1x128x128_256x128x128x128_16x16_32x32_2x2_8x32x1_8x32x1_1x32x1x8_8_1x1_intrawave_v3,602.56,1421.86,0.0
gfx950,256,1482,8192,512,ck,0,0,20.1466,a8w8_blockscale_1x128x128_256x128x128x128_16x16_32x32_2x2_8x32x1_8x32x1_1x32x1x8_8_1x1_intrawave_v3,617.07,1451.07,0.0
gfx950,256,2215,128,7168,ck,8,2,20.1496,a8w8_blockscale_1x128x128_256x16x64x256_16x16_16x16_1x1_16x16x1_16x16x1_1x16x1x16_4_1x1_intrawave_v1,201.72,861.64,0.0
gfx950,256,1492,8192,512,ck,0,0,20.15,a8w8_blockscale_1x128x128_256x128x128x128_16x16_32x32_2x2_8x32x1_8x32x1_1x32x1x8_8_1x1_intrawave_v3,621.13,1459.21,0.0
gfx950,256,1441,8192,512,ck,0,0,20.1574,a8w8_blockscale_1x128x128_256x128x128x128_16x16_32x32_2x2_8x32x1_8x32x1_1x32x1x8_8_1x1_intrawave_v3,599.68,1415.93,0.0
gfx950,256,2368,128,7168,ck,18,1,20.1605,a8w8_blockscale_1x128x128_256x64x64x256_16x16_32x32_1x1_16x16x1_16x16x1_1x32x1x8_8_1x1_intrawave_v1,215.54,917.51,0.0
gfx950,256,1503,8192,512,ck,0,0,20.1612,a8w8_blockscale_1x128x128_256x128x128x128_16x16_32x32_2x2_8x32x1_8x32x1_1x32x1x8_8_1x1_intrawave_v3,625.36,1467.62,0.0
gfx950,256,1333,128,7168,ck,8,0,20.164,a8w8_blockscale_1x128x128_256x16x64x256_16x16_16x16_1x1_16x16x1_16x16x1_1x16x1x16_4_1x1_intrawave_v1,121.31,536.29,0.0
gfx950,256,1467,8192,512,ck,0,0,20.1649,a8w8_blockscale_1x128x128_256x128x128x128_16x16_32x32_2x2_8x32x1_8x32x1_1x32x1x8_8_1x1_intrawave_v3,610.27,1437.19,0.0
gfx950,256,1502,8192,512,ck,0,0,20.1734,a8w8_blockscale_1x128x128_256x128x128x128_16x16_32x32_2x2_8x32x1_8x32x1_1x32x1x8_8_1x1_intrawave_v3,624.57,1465.9,0.0
gfx950,256,1516,8192,512,ck,0,0,20.1735,a8w8_blockscale_1x128x128_256x128x128x128_16x16_32x32_2x2_8x32x1_8x32x1_1x32x1x8_8_1x1_intrawave_v3,630.39,1477.61,0.0
gfx950,256,2207,128,7168,ck,8,2,20.1782,a8w8_blockscale_1x128x128_256x16x64x256_16x16_16x16_1x1_16x16x1_16x16x1_1x16x1x16_4_1x1_intrawave_v1,200.7,857.47,0.0
gfx950,256,2150,128,7168,ck,18,1,20.1784,a8w8_blockscale_1x128x128_256x64x64x256_16x16_32x32_1x1_16x16x1_16x16x1_1x32x1x8_8_1x1_intrawave_v1,195.52,836.49,0.0
gfx950,256,2268,128,7168,ck,8,2,20.1793,a8w8_blockscale_1x128x128_256x16x64x256_16x16_16x16_1x1_16x16x1_16x16x1_1x16x1x16_4_1x1_intrawave_v1,206.24,879.87,0.0
gfx950,256,2226,128,7168,ck,8,2,20.1794,a8w8_blockscale_1x128x128_256x16x64x256_16x16_16x16_1x1_16x16x1_16x16x1_1x16x1x16_4_1x1_intrawave_v1,202.42,864.41,0.0
gfx950,256,1432,8192,512,ck,0,0,20.1796,a8w8_blockscale_1x128x128_256x128x128x128_16x16_32x32_2x2_8x32x1_8x32x1_1x32x1x8_8_1x1_intrawave_v3,595.28,1406.84,0.0
gfx950,256,1493,8192,512,ck,0,0,20.1802,a8w8_blockscale_1x128x128_256x128x128x128_16x16_32x32_2x2_8x32x1_8x32x1_1x32x1x8_8_1x1_intrawave_v3,620.62,1457.87,0.0
gfx950,256,1499,8192,512,ck,0,0,20.1871,a8w8_blockscale_1x128x128_256x128x128x128_16x16_32x32_2x2_8x32x1_8x32x1_1x32x1x8_8_1x1_intrawave_v3,622.9,1462.39,0.0
gfx950,256,1517,128,7168,ck,8,0,20.1873,a8w8_blockscale_1x128x128_256x16x64x256_16x16_16x16_1x1_16x16x1_16x16x1_1x16x1x16_4_1x1_intrawave_v1,137.89,603.34,0.0
gfx950,256,1477,8192,512,ck,0,0,20.1916,a8w8_blockscale_1x128x128_256x128x128x128_16x16_32x32_2x2_8x32x1_8x32x1_1x32x1x8_8_1x1_intrawave_v3,613.62,1443.65,0.0
gfx950,256,1601,128,7168,ck,8,0,20.1922,a8w8_blockscale_1x128x128_256x16x64x256_16x16_16x16_1x1_16x16x1_16x16x1_1x16x1x16_4_1x1_intrawave_v1,145.49,634.07,0.0
gfx950,256,1424,8192,512,ck,0,0,20.1962,a8w8_blockscale_1x128x128_256x128x128x128_16x16_32x32_2x2_8x32x1_8x32x1_1x32x1x8_8_1x1_intrawave_v3,591.47,1398.99,0.0
gfx950,256,1443,8192,512,ck,0,0,20.1997,a8w8_blockscale_1x128x128_256x128x128x128_16x16_32x32_2x2_8x32x1_8x32x1_1x32x1x8_8_1x1_intrawave_v3,599.25,1414.64,0.0
gfx950,256,1442,8192,512,ck,0,0,20.2143,a8w8_blockscale_1x128x128_256x128x128x128_16x16_32x32_2x2_8x32x1_8x32x1_1x32x1x8_8_1x1_intrawave_v3,598.41,1412.78,0.0
gfx950,256,1490,128,7168,ck,8,0,20.2159,a8w8_blockscale_1x128x128_256x16x64x256_16x16_16x16_1x1_16x16x1_16x16x1_1x16x1x16_4_1x1_intrawave_v1,135.25,592.57,0.0
gfx950,256,2301,128,7168,ck,8,2,20.216,a8w8_blockscale_1x128x128_256x16x64x256_16x16_16x16_1x1_16x16x1_16x16x1_1x16x1x16_4_1x1_intrawave_v1,208.86,890.39,0.0
gfx950,256,2252,128,7168,ck,18,1,20.2224,a8w8_blockscale_1x128x128_256x64x64x256_16x16_32x32_1x1_16x16x1_16x16x1_1x32x1x8_8_1x1_intrawave_v1,204.35,872.12,0.0
gfx950,256,1523,8192,512,ck,0,0,20.2263,a8w8_blockscale_1x128x128_256x128x128x128_16x16_32x32_2x2_8x32x1_8x32x1_1x32x1x8_8_1x1_intrawave_v3,631.65,1479.6,0.0
gfx950,256,2216,128,7168,ck,8,2,20.2364,a8w8_blockscale_1x128x128_256x16x64x256_16x16_16x16_1x1_16x16x1_16x16x1_1x16x1x16_4_1x1_intrawave_v1,200.94,858.31,0.0
gfx950,256,2344,128,7168,ck,8,2,20.2444,a8w8_blockscale_1x128x128_256x16x64x256_16x16_16x16_1x1_16x16x1_16x16x1_1x16x1x16_4_1x1_intrawave_v1,212.47,904.91,0.0
gfx950,256,1533,8192,512,ck,0,0,20.2481,a8w8_blockscale_1x128x128_256x128x128x128_16x16_32x32_2x2_8x32x1_8x32x1_1x32x1x8_8_1x1_intrawave_v3,635.11,1486.36,0.0
gfx950,256,2251,128,7168,ck,8,2,20.2502,a8w8_blockscale_1x128x128_256x16x64x256_16x16_16x16_1x1_16x16x1_16x16x1_1x16x1x16_4_1x1_intrawave_v1,203.98,870.56,0.0
gfx950,256,1590,128,7168,ck,8,0,20.2529,a8w8_blockscale_1x128x128_256x16x64x256_16x16_16x16_1x1_16x16x1_16x16x1_1x16x1x16_4_1x1_intrawave_v1,144.06,628.14,0.0
gfx950,256,2090,128,7168,ck,8,2,20.2749,a8w8_blockscale_1x128x128_256x16x64x256_16x16_16x16_1x1_16x16x1_16x16x1_1x16x1x16_4_1x1_intrawave_v1,189.16,810.54,0.0
gfx950,256,1599,128,7168,ck,8,0,20.2964,a8w8_blockscale_1x128x128_256x16x64x256_16x16_16x16_1x1_16x16x1_16x16x1_1x16x1x16_4_1x1_intrawave_v1,144.57,630.09,0.0
gfx950,256,2387,128,7168,ck,18,1,20.3065,a8w8_blockscale_1x128x128_256x64x64x256_16x16_32x32_1x1_16x16x1_16x16x1_1x32x1x8_8_1x1_intrawave_v1,215.7,917.86,0.0
gfx950,256,813,128,7168,ck,8,0,20.3352,a8w8_blockscale_1x128x128_256x16x64x256_16x16_16x16_1x1_16x16x1_16x16x1_1x16x1x16_4_1x1_intrawave_v1,73.36,341.93,0.0
gfx950,256,2356,128,7168,ck,8,2,20.3441,a8w8_blockscale_1x128x128_256x16x64x256_16x16_16x16_1x1_16x16x1_16x16x1_1x16x1x16_4_1x1_intrawave_v1,212.51,904.85,0.0
gfx950,256,2412,128,7168,ck,8,2,20.3586,a8w8_blockscale_1x128x128_256x16x64x256_16x16_16x16_1x1_16x16x1_16x16x1_1x16x1x16_4_1x1_intrawave_v1,217.4,924.63,0.0
gfx950,256,2390,128,7168,ck,18,1,20.3747,a8w8_blockscale_1x128x128_256x64x64x256_16x16_32x32_1x1_16x16x1_16x16x1_1x32x1x8_8_1x1_intrawave_v1,215.25,915.88,0.0
gfx950,256,1580,128,7168,ck,8,0,20.3766,a8w8_blockscale_1x128x128_256x16x64x256_16x16_16x16_1x1_16x16x1_16x16x1_1x16x1x16_4_1x1_intrawave_v1,142.29,620.68,0.0
gfx950,256,809,128,7168,ck,8,0,20.3796,a8w8_blockscale_1x128x128_256x16x64x256_16x16_16x16_1x1_16x16x1_16x16x1_1x16x1x16_4_1x1_intrawave_v1,72.84,339.73,0.0
gfx950,256,849,128,7168,ck,8,0,20.3835,a8w8_blockscale_1x128x128_256x16x64x256_16x16_16x16_1x1_16x16x1_16x16x1_1x16x1x16_4_1x1_intrawave_v1,76.43,354.23,0.0
gfx950,256,869,128,7168,ck,8,0,20.398,a8w8_blockscale_1x128x128_256x16x64x256_16x16_16x16_1x1_16x16x1_16x16x1_1x16x1x16_4_1x1_intrawave_v1,78.18,361.26,0.0
gfx950,256,1334,128,7168,ck,8,0,20.4019,a8w8_blockscale_1x128x128_256x16x64x256_16x16_16x16_1x1_16x16x1_16x16x1_1x16x1x16_4_1x1_intrawave_v1,119.98,530.4,0.0
gfx950,256,2358,128,7168,ck,18,1,20.4156,a8w8_blockscale_1x128x128_256x64x64x256_16x16_32x32_1x1_16x16x1_16x16x1_1x32x1x8_8_1x1_intrawave_v1,211.94,902.41,0.0
gfx950,256,1553,128,7168,ck,8,0,20.4172,a8w8_blockscale_1x128x128_256x16x64x256_16x16_16x16_1x1_16x16x1_16x16x1_1x16x1x16_4_1x1_intrawave_v1,139.58,609.63,0.0
gfx950,256,1623,128,7168,ck,8,0,20.419,a8w8_blockscale_1x128x128_256x16x64x256_16x16_16x16_1x1_16x16x1_16x16x1_1x16x1x16_4_1x1_intrawave_v1,145.86,635.03,0.0
gfx950,256,2254,128,7168,ck,18,1,20.422,a8w8_blockscale_1x128x128_256x64x64x256_16x16_32x32_1x1_16x16x1_16x16x1_1x32x1x8_8_1x1_intrawave_v1,202.53,864.32,0.0
gfx950,256,1944,128,7168,ck,8,0,20.4354,a8w8_blockscale_1x128x128_256x16x64x256_16x16_16x16_1x1_16x16x1_16x16x1_1x16x1x16_4_1x1_intrawave_v1,174.56,751.14,0.0
gfx950,256,920,128,7168,ck,8,0,20.4416,a8w8_blockscale_1x128x128_256x16x64x256_16x16_16x16_1x1_16x16x1_16x16x1_1x16x1x16_4_1x1_intrawave_v1,82.59,379.01,0.0
gfx950,256,806,128,7168,ck,8,0,20.4458,a8w8_blockscale_1x128x128_256x16x64x256_16x16_16x16_1x1_16x16x1_16x16x1_1x16x1x16_4_1x1_intrawave_v1,72.34,337.54,0.0
gfx950,256,2369,128,7168,ck,8,2,20.4463,a8w8_blockscale_1x128x128_256x16x64x256_16x16_16x16_1x1_16x16x1_16x16x1_1x16x1x16_4_1x1_intrawave_v1,212.61,905.05,0.0
gfx950,256,1987,128,7168,ck,8,0,20.4485,a8w8_blockscale_1x128x128_256x16x64x256_16x16_16x16_1x1_16x16x1_16x16x1_1x16x1x16_4_1x1_intrawave_v1,178.31,766.27,0.0
gfx950,256,2378,128,7168,ck,8,2,20.4532,a8w8_blockscale_1x128x128_256x16x64x256_16x16_16x16_1x1_16x16x1_16x16x1_1x16x1x16_4_1x1_intrawave_v1,213.35,908.01,0.0
gfx950,256,1548,128,7168,ck,8,0,20.4533,a8w8_blockscale_1x128x128_256x16x64x256_16x16_16x16_1x1_16x16x1_16x16x1_1x16x1x16_4_1x1_intrawave_v1,138.88,606.74,0.0
gfx950,256,2415,128,7168,ck,18,1,20.4563,a8w8_blockscale_1x128x128_256x64x64x256_16x16_32x32_1x1_16x16x1_16x16x1_1x32x1x8_8_1x1_intrawave_v1,216.63,921.3,0.0
gfx950,256,2002,128,7168,ck,8,0,20.4731,a8w8_blockscale_1x128x128_256x16x64x256_16x16_16x16_1x1_16x16x1_16x16x1_1x16x1x16_4_1x1_intrawave_v1,179.44,770.78,0.0
gfx950,256,2101,128,7168,ck,8,2,20.4764,a8w8_blockscale_1x128x128_256x16x64x256_16x16_16x16_1x1_16x16x1_16x16x1_1x16x1x16_4_1x1_intrawave_v1,188.28,806.55,0.0
gfx950,256,910,128,7168,ck,8,0,20.4801,a8w8_blockscale_1x128x128_256x16x64x256_16x16_16x16_1x1_16x16x1_16x16x1_1x16x1x16_4_1x1_intrawave_v1,81.54,374.67,0.0
gfx950,256,1978,128,7168,ck,8,0,20.4845,a8w8_blockscale_1x128x128_256x16x64x256_16x16_16x16_1x1_16x16x1_16x16x1_1x16x1x16_4_1x1_intrawave_v1,177.19,761.66,0.0
gfx950,256,1185,128,7168,ck,8,0,20.4892,a8w8_blockscale_1x128x128_256x16x64x256_16x16_16x16_1x1_16x16x1_16x16x1_1x16x1x16_4_1x1_intrawave_v1,106.13,474.15,0.0
gfx950,256,2041,128,7168,ck,8,0,20.5033,a8w8_blockscale_1x128x128_256x16x64x256_16x16_16x16_1x1_16x16x1_16x16x1_1x16x1x16_4_1x1_intrawave_v1,182.67,783.77,0.0
gfx950,256,2403,128,7168,ck,18,1,20.5123,a8w8_blockscale_1x128x128_256x64x64x256_16x16_32x32_1x1_16x16x1_16x16x1_1x32x1x8_8_1x1_intrawave_v1,214.97,914.45,0.0
gfx950,256,2012,128,7168,ck,8,0,20.513,a8w8_blockscale_1x128x128_256x16x64x256_16x16_16x16_1x1_16x16x1_16x16x1_1x16x1x16_4_1x1_intrawave_v1,179.99,772.9,0.0
gfx950,256,677,6144,1536,ck,18,0,20.5232,a8w8_blockscale_1x128x128_256x64x64x256_16x16_32x32_1x1_16x16x1_16x16x1_1x32x1x8_8_1x1_intrawave_v1,622.61,915.84,0.0
gfx950,256,2004,128,7168,ck,8,0,20.5297,a8w8_blockscale_1x128x128_256x16x64x256_16x16_16x16_1x1_16x16x1_16x16x1_1x16x1x16_4_1x1_intrawave_v1,179.12,769.38,0.0
gfx950,256,2009,128,7168,ck,8,0,20.5334,a8w8_blockscale_1x128x128_256x16x64x256_16x16_16x16_1x1_16x16x1_16x16x1_1x16x1x16_4_1x1_intrawave_v1,179.54,771.05,0.0
gfx950,256,2035,128,7168,ck,8,0,20.5359,a8w8_blockscale_1x128x128_256x16x64x256_16x16_16x16_1x1_16x16x1_16x16x1_1x16x1x16_4_1x1_intrawave_v1,181.84,780.36,0.0
gfx950,256,1991,128,7168,ck,8,0,20.5415,a8w8_blockscale_1x128x128_256x16x64x256_16x16_16x16_1x1_16x16x1_16x16x1_1x16x1x16_4_1x1_intrawave_v1,177.86,764.24,0.0
gfx950,256,930,128,7168,ck,8,0,20.586,a8w8_blockscale_1x128x128_256x16x64x256_16x16_16x16_1x1_16x16x1_16x16x1_1x16x1x16_4_1x1_intrawave_v1,82.9,379.96,0.0
gfx950,256,1144,128,7168,ck,8,0,20.59,a8w8_blockscale_1x128x128_256x16x64x256_16x16_16x16_1x1_16x16x1_16x16x1_1x16x1x16_4_1x1_intrawave_v1,101.95,457.05,0.0
gfx950,256,2003,128,7168,ck,8,0,20.5916,a8w8_blockscale_1x128x128_256x16x64x256_16x16_16x16_1x1_16x16x1_16x16x1_1x16x1x16_4_1x1_intrawave_v1,178.5,766.71,0.0
gfx950,256,814,128,7168,ck,8,0,20.5946,a8w8_blockscale_1x128x128_256x16x64x256_16x16_16x16_1x1_16x16x1_16x16x1_1x16x1x16_4_1x1_intrawave_v1,72.53,337.98,0.0
gfx950,256,2011,128,7168,ck,8,0,20.605,a8w8_blockscale_1x128x128_256x16x64x256_16x16_16x16_1x1_16x16x1_16x16x1_1x16x1x16_4_1x1_intrawave_v1,179.09,769.09,0.0
gfx950,256,2445,128,7168,ck,18,1,20.6066,a8w8_blockscale_1x128x128_256x64x64x256_16x16_32x32_1x1_16x16x1_16x16x1_1x32x1x8_8_1x1_intrawave_v1,217.73,925.39,0.0
gfx950,256,1112,128,7168,ck,8,0,20.61,a8w8_blockscale_1x128x128_256x16x64x256_16x16_16x16_1x1_16x16x1_16x16x1_1x16x1x16_4_1x1_intrawave_v1,99.01,445.07,0.0
gfx950,256,2443,128,7168,ck,8,2,20.6252,a8w8_blockscale_1x128x128_256x16x64x256_16x16_16x16_1x1_16x16x1_16x16x1_1x16x1x16_4_1x1_intrawave_v1,217.35,923.84,0.0
gfx950,256,1980,128,7168,ck,8,0,20.6374,a8w8_blockscale_1x128x128_256x16x64x256_16x16_16x16_1x1_16x16x1_16x16x1_1x16x1x16_4_1x1_intrawave_v1,176.05,756.73,0.0
gfx950,256,2567,128,7168,ck,18,1,20.655,a8w8_blockscale_1x128x128_256x64x64x256_16x16_32x32_1x1_16x16x1_16x16x1_1x32x1x8_8_1x1_intrawave_v1,228.05,967.07,0.0
gfx950,256,902,128,7168,ck,8,0,20.658,a8w8_blockscale_1x128x128_256x16x64x256_16x16_16x16_1x1_16x16x1_16x16x1_1x16x1x16_4_1x1_intrawave_v1,80.12,368.57,0.0
gfx950,256,2479,128,7168,ck,18,1,20.6791,a8w8_blockscale_1x128x128_256x64x64x256_16x16_32x32_1x1_16x16x1_16x16x1_1x32x1x8_8_1x1_intrawave_v1,219.98,934.35,0.0
gfx950,256,2486,128,7168,ck,18,1,20.6923,a8w8_blockscale_1x128x128_256x64x64x256_16x16_32x32_1x1_16x16x1_16x16x1_1x32x1x8_8_1x1_intrawave_v1,220.46,936.27,0.0
gfx950,256,2126,128,7168,ck,8,2,20.7011,a8w8_blockscale_1x128x128_256x16x64x256_16x16_16x16_1x1_16x16x1_16x16x1_1x16x1x16_4_1x1_intrawave_v1,188.46,806.77,0.0
gfx950,256,2217,128,7168,ck,8,2,20.7018,a8w8_blockscale_1x128x128_256x16x64x256_16x16_16x16_1x1_16x16x1_16x16x1_1x16x1x16_4_1x1_intrawave_v1,196.51,839.37,0.0
gfx950,256,2597,128,7168,ck,18,1,20.7517,a8w8_blockscale_1x128x128_256x64x64x256_16x16_32x32_1x1_16x16x1_16x16x1_1x32x1x8_8_1x1_intrawave_v1,229.64,973.3,0.0
gfx950,256,2441,128,7168,ck,8,2,20.7532,a8w8_blockscale_1x128x128_256x16x64x256_16x16_16x16_1x1_16x16x1_16x16x1_1x16x1x16_4_1x1_intrawave_v1,215.83,917.42,0.0
gfx950,256,2148,128,7168,ck,8,2,20.7796,a8w8_blockscale_1x128x128_256x16x64x256_16x16_16x16_1x1_16x16x1_16x16x1_1x16x1x16_4_1x1_intrawave_v1,189.69,811.58,0.0
gfx950,256,1132,128,7168,ck,8,0,20.7832,a8w8_blockscale_1x128x128_256x16x64x256_16x16_16x16_1x1_16x16x1_16x16x1_1x16x1x16_4_1x1_intrawave_v1,99.95,448.51,0.0
gfx950,256,877,128,7168,ck,8,0,20.7832,a8w8_blockscale_1x128x128_256x16x64x256_16x16_16x16_1x1_16x16x1_16x16x1_1x16x1x16_4_1x1_intrawave_v1,77.43,357.42,0.0
gfx950,256,2250,128,7168,ck,18,1,20.7889,a8w8_blockscale_1x128x128_256x64x64x256_16x16_32x32_1x1_16x16x1_16x16x1_1x32x1x8_8_1x1_intrawave_v1,198.6,847.64,0.0
gfx950,256,2515,128,7168,ck,18,1,20.7906,a8w8_blockscale_1x128x128_256x64x64x256_16x16_32x32_1x1_16x16x1_16x16x1_1x32x1x8_8_1x1_intrawave_v1,221.98,942.2,0.0
gfx950,256,2548,128,7168,ck,18,1,20.8182,a8w8_blockscale_1x128x128_256x64x64x256_16x16_32x32_1x1_16x16x1_16x16x1_1x32x1x8_8_1x1_intrawave_v1,224.59,952.72,0.0
gfx950,256,2658,128,7168,ck,18,1,20.9837,a8w8_blockscale_1x128x128_256x64x64x256_16x16_32x32_1x1_16x16x1_16x16x1_1x32x1x8_8_1x1_intrawave_v1,232.44,984.12,0.0
gfx950,256,136,7168,4096,ck,18,0,20.9979,a8w8_blockscale_1x128x128_256x64x64x256_16x16_32x32_1x1_16x16x1_16x16x1_1x32x1x8_8_1x1_intrawave_v1,380.32,1517.62,0.0
gfx950,256,144,7168,4096,ck,18,0,21.0657,a8w8_blockscale_1x128x128_256x64x64x256_16x16_32x32_1x1_16x16x1_16x16x1_1x32x1x8_8_1x1_intrawave_v1,401.4,1519.74,0.0
gfx950,256,200,7168,4096,ck,18,0,21.0827,a8w8_blockscale_1x128x128_256x64x64x256_16x16_32x32_1x1_16x16x1_16x16x1_1x32x1x8_8_1x1_intrawave_v1,557.05,1567.47,0.0
gfx950,256,2282,128,7168,ck,8,2,21.0858,a8w8_blockscale_1x128x128_256x16x64x256_16x16_16x16_1x1_16x16x1_16x16x1_1x16x1x16_4_1x1_intrawave_v1,198.59,846.97,0.0
gfx950,256,2713,128,7168,ck,18,1,21.0858,a8w8_blockscale_1x128x128_256x64x64x256_16x16_32x32_1x1_16x16x1_16x16x1_1x32x1x8_8_1x1_intrawave_v1,236.1,998.72,0.0
gfx950,256,2534,128,7168,ck,8,2,21.1044,a8w8_blockscale_1x128x128_256x16x64x256_16x16_16x16_1x1_16x16x1_16x16x1_1x16x1x16_4_1x1_intrawave_v1,220.33,934.87,0.0
gfx950,256,734,6144,1536,ck,18,0,21.1349,a8w8_blockscale_1x128x128_256x64x64x256_16x16_32x32_1x1_16x16x1_16x16x1_1x32x1x8_8_1x1_intrawave_v1,655.49,926.62,0.0
gfx950,256,2355,128,7168,ck,18,1,21.1562,a8w8_blockscale_1x128x128_256x64x64x256_16x16_32x32_1x1_16x16x1_16x16x1_1x32x1x8_8_1x1_intrawave_v1,204.26,869.77,0.0
gfx950,256,2544,128,7168,ck,18,1,21.1944,a8w8_blockscale_1x128x128_256x64x64x256_16x16_32x32_1x1_16x16x1_16x16x1_1x32x1x8_8_1x1_intrawave_v1,220.26,934.41,0.0
gfx950,256,152,7168,4096,ck,18,0,21.2133,a8w8_blockscale_1x128x128_256x64x64x256_16x16_32x32_1x1_16x16x1_16x16x1_1x32x1x8_8_1x1_intrawave_v1,420.75,1516.11,0.0
gfx950,256,2794,128,7168,ck,18,1,21.2593,a8w8_blockscale_1x128x128_256x64x64x256_16x16_32x32_1x1_16x16x1_16x16x1_1x32x1x8_8_1x1_intrawave_v1,241.17,1018.86,0.0
gfx950,256,2464,128,7168,ck,8,2,21.2955,a8w8_blockscale_1x128x128_256x16x64x256_16x16_16x16_1x1_16x16x1_16x16x1_1x16x1x16_4_1x1_intrawave_v1,212.32,902.08,0.0
gfx950,256,2365,128,7168,ck,18,1,21.3173,a8w8_blockscale_1x128x128_256x64x64x256_16x16_32x32_1x1_16x16x1_16x16x1_1x32x1x8_8_1x1_intrawave_v1,203.58,866.68,0.0
gfx950,256,2748,128,7168,ck,18,1,21.3577,a8w8_blockscale_1x128x128_256x64x64x256_16x16_32x32_1x1_16x16x1_16x16x1_1x32x1x8_8_1x1_intrawave_v1,236.1,998.17,0.0
gfx950,256,809,6144,1536,ck,18,0,21.3738,a8w8_blockscale_1x128x128_256x64x64x256_16x16_32x32_1x1_16x16x1_16x16x1_1x32x1x8_8_1x1_intrawave_v1,714.4,964.77,0.0
gfx950,256,2747,128,7168,ck,18,1,21.3982,a8w8_blockscale_1x128x128_256x64x64x256_16x16_32x32_1x1_16x16x1_16x16x1_1x32x1x8_8_1x1_intrawave_v1,235.57,995.94,0.0
gfx950,256,2570,128,7168,ck,18,1,21.4158,a8w8_blockscale_1x128x128_256x64x64x256_16x16_32x32_1x1_16x16x1_16x16x1_1x32x1x8_8_1x1_intrawave_v1,220.21,933.76,0.0
gfx950,256,208,7168,4096,ck,18,0,21.4243,a8w8_blockscale_1x128x128_256x64x64x256_16x16_32x32_1x1_16x16x1_16x16x1_1x32x1x8_8_1x1_intrawave_v1,570.09,1549.36,0.0
gfx950,256,2304,128,7168,ck,7,0,21.4341,a8w8_blockscale_1x128x128_256x16x128x256_16x16_16x16_1x2_16x16x1_16x16x1_1x16x1x16_8_1x2_intrawave_v1,197.25,840.83,0.0
gfx950,256,2594,128,7168,ck,18,1,21.4718,a8w8_blockscale_1x128x128_256x64x64x256_16x16_32x32_1x1_16x16x1_16x16x1_1x32x1x8_8_1x1_intrawave_v1,221.69,939.62,0.0
gfx950,256,2444,128,7168,ck,18,1,21.4787,a8w8_blockscale_1x128x128_256x64x64x256_16x16_32x32_1x1_16x16x1_16x16x1_1x32x1x8_8_1x1_intrawave_v1,208.8,887.47,0.0
gfx950,256,2235,128,7168,ck,7,0,21.5066,a8w8_blockscale_1x128x128_256x16x128x256_16x16_16x16_1x2_16x16x1_16x16x1_1x16x1x16_8_1x2_intrawave_v1,190.7,814.18,0.0
gfx950,256,816,6144,1536,ck,18,0,21.5119,a8w8_blockscale_1x128x128_256x64x64x256_16x16_32x32_1x1_16x16x1_16x16x1_1x32x1x8_8_1x1_intrawave_v1,715.95,963.07,0.0
gfx950,256,216,7168,4096,ck,18,0,21.5318,a8w8_blockscale_1x128x128_256x64x64x256_16x16_32x32_1x1_16x16x1_16x16x1_1x32x1x8_8_1x1_intrawave_v1,589.06,1548.47,0.0
gfx950,256,2116,128,7168,ck,7,0,21.5607,a8w8_blockscale_1x128x128_256x16x128x256_16x16_16x16_1x2_16x16x1_16x16x1_1x16x1x16_8_1x2_intrawave_v1,180.09,771.16,0.0
gfx950,256,2119,128,7168,ck,7,0,21.5641,a8w8_blockscale_1x128x128_256x16x128x256_16x16_16x16_1x2_16x16x1_16x16x1_1x16x1x16_8_1x2_intrawave_v1,180.32,772.07,0.0
gfx950,256,168,7168,4096,ck,18,0,21.6361,a8w8_blockscale_1x128x128_256x64x64x256_16x16_32x32_1x1_16x16x1_16x16x1_1x32x1x8_8_1x1_intrawave_v1,455.95,1500.12,0.0
gfx950,256,830,6144,1536,ck,18,0,21.684,a8w8_blockscale_1x128x128_256x64x64x256_16x16_32x32_1x1_16x16x1_16x16x1_1x32x1x8_8_1x1_intrawave_v1,722.46,964.36,0.0
gfx950,256,814,6144,1536,ck,18,0,21.7468,a8w8_blockscale_1x128x128_256x64x64x256_16x16_32x32_1x1_16x16x1_16x16x1_1x32x1x8_8_1x1_intrawave_v1,706.48,951.4,0.0
gfx950,256,176,7168,4096,ck,18,0,21.7684,a8w8_blockscale_1x128x128_256x64x64x256_16x16_32x32_1x1_16x16x1_16x16x1_1x32x1x8_8_1x1_intrawave_v1,474.76,1497.77,0.0
gfx950,256,2636,128,7168,ck,18,1,21.776,a8w8_blockscale_1x128x128_256x64x64x256_16x16_32x32_1x1_16x16x1_16x16x1_1x32x1x8_8_1x1_intrawave_v1,222.13,940.81,0.0
gfx950,256,813,6144,1536,ck,18,0,21.7928,a8w8_blockscale_1x128x128_256x64x64x256_16x16_32x32_1x1_16x16x1_16x16x1_1x32x1x8_8_1x1_intrawave_v1,704.13,948.76,0.0
gfx950,256,3000,128,7168,ck,7,0,21.8011,a8w8_blockscale_1x128x128_256x16x128x256_16x16_16x16_1x2_16x16x1_16x16x1_1x16x1x16_8_1x2_intrawave_v1,252.51,1063.69,0.0
gfx950,256,806,6144,1536,ck,18,0,21.8095,a8w8_blockscale_1x128x128_256x64x64x256_16x16_32x32_1x1_16x16x1_16x16x1_1x32x1x8_8_1x1_intrawave_v1,697.53,943.59,0.0
gfx950,256,1594,8192,512,ck,18,0,21.8213,a8w8_blockscale_1x128x128_256x64x64x256_16x16_32x32_1x1_16x16x1_16x16x1_1x32x1x8_8_1x1_intrawave_v1,612.77,1426.43,0.0
gfx950,256,3004,128,7168,ck,18,1,21.8256,a8w8_blockscale_1x128x128_256x64x64x256_16x16_32x32_1x1_16x16x1_16x16x1_1x32x1x8_8_1x1_intrawave_v1,252.56,1063.85,0.0
gfx950,256,2843,128,7168,ck,7,0,21.8535,a8w8_blockscale_1x128x128_256x16x128x256_16x16_16x16_1x2_16x16x1_16x16x1_1x16x1x16_8_1x2_intrawave_v1,238.72,1007.8,0.0
gfx950,256,2841,128,7168,ck,7,0,21.8778,a8w8_blockscale_1x128x128_256x16x128x256_16x16_16x16_1x2_16x16x1_16x16x1_1x16x1x16_8_1x2_intrawave_v1,238.29,1006.0,0.0
gfx950,256,1567,8192,512,ck,18,0,21.9087,a8w8_blockscale_1x128x128_256x64x64x256_16x16_32x32_1x1_16x16x1_16x16x1_1x32x1x8_8_1x1_intrawave_v1,599.99,1399.92,0.0
gfx950,256,2593,128,7168,ck,7,0,21.9344,a8w8_blockscale_1x128x128_256x16x128x256_16x16_16x16_1x2_16x16x1_16x16x1_1x16x1x16_8_1x2_intrawave_v1,216.93,919.47,0.0
gfx950,256,2740,128,7168,ck,7,0,21.9348,a8w8_blockscale_1x128x128_256x16x128x256_16x16_16x16_1x2_16x16x1_16x16x1_1x16x1x16_8_1x2_intrawave_v1,229.22,969.2,0.0
gfx950,256,2757,128,7168,ck,7,0,21.936,a8w8_blockscale_1x128x128_256x16x128x256_16x16_16x16_1x2_16x16x1_16x16x1_1x16x1x16_8_1x2_intrawave_v1,230.63,974.9,0.0
gfx950,256,1549,8192,512,ck,18,0,21.9385,a8w8_blockscale_1x128x128_256x64x64x256_16x16_32x32_1x1_16x16x1_16x16x1_1x32x1x8_8_1x1_intrawave_v1,592.29,1384.15,0.0
gfx950,256,1570,8192,512,ck,18,0,21.9642,a8w8_blockscale_1x128x128_256x64x64x256_16x16_32x32_1x1_16x16x1_16x16x1_1x32x1x8_8_1x1_intrawave_v1,599.62,1398.69,0.0
gfx950,256,1562,8192,512,ck,18,0,21.9693,a8w8_blockscale_1x128x128_256x64x64x256_16x16_32x32_1x1_16x16x1_16x16x1_1x32x1x8_8_1x1_intrawave_v1,596.42,1392.21,0.0
gfx950,256,1564,8192,512,ck,18,0,21.9798,a8w8_blockscale_1x128x128_256x64x64x256_16x16_32x32_1x1_16x16x1_16x16x1_1x32x1x8_8_1x1_intrawave_v1,596.9,1393.08,0.0
gfx950,256,1613,8192,512,ck,18,0,21.9801,a8w8_blockscale_1x128x128_256x64x64x256_16x16_32x32_1x1_16x16x1_16x16x1_1x32x1x8_8_1x1_intrawave_v1,615.59,1430.73,0.0
gfx950,256,2734,128,7168,ck,7,0,21.9856,a8w8_blockscale_1x128x128_256x16x128x256_16x16_16x16_1x2_16x16x1_16x16x1_1x16x1x16_8_1x2_intrawave_v1,228.19,964.94,0.0
gfx950,256,2955,128,7168,ck,7,0,22.0035,a8w8_blockscale_1x128x128_256x16x128x256_16x16_16x16_1x2_16x16x1_16x16x1_1x16x1x16_8_1x2_intrawave_v1,246.44,1038.72,0.0
gfx950,256,2947,128,7168,ck,7,0,22.0095,a8w8_blockscale_1x128x128_256x16x128x256_16x16_16x16_1x2_16x16x1_16x16x1_1x16x1x16_8_1x2_intrawave_v1,245.7,1035.74,0.0
gfx950,256,2964,128,7168,ck,7,0,22.0109,a8w8_blockscale_1x128x128_256x16x128x256_16x16_16x16_1x2_16x16x1_16x16x1_1x16x1x16_8_1x2_intrawave_v1,247.1,1041.4,0.0
gfx950,256,1546,8192,512,ck,18,0,22.0367,a8w8_blockscale_1x128x128_256x64x64x256_16x16_32x32_1x1_16x16x1_16x16x1_1x32x1x8_8_1x1_intrawave_v1,588.51,1375.68,0.0
gfx950,256,1654,8192,512,ck,18,0,22.0371,a8w8_blockscale_1x128x128_256x64x64x256_16x16_32x32_1x1_16x16x1_16x16x1_1x32x1x8_8_1x1_intrawave_v1,629.61,1458.46,0.0
gfx950,256,2876,128,7168,ck,7,0,22.0384,a8w8_blockscale_1x128x128_256x16x128x256_16x16_16x16_1x2_16x16x1_16x16x1_1x16x1x16_8_1x2_intrawave_v1,239.47,1010.46,0.0
gfx950,256,2889,128,7168,ck,7,0,22.042,a8w8_blockscale_1x128x128_256x16x128x256_16x16_16x16_1x2_16x16x1_16x16x1_1x16x1x16_8_1x2_intrawave_v1,240.51,1014.67,0.0
gfx950,256,1590,8192,512,ck,18,0,22.0439,a8w8_blockscale_1x128x128_256x64x64x256_16x16_32x32_1x1_16x16x1_16x16x1_1x32x1x8_8_1x1_intrawave_v1,605.06,1408.96,0.0
gfx950,256,2729,128,7168,ck,7,0,22.0464,a8w8_blockscale_1x128x128_256x16x128x256_16x16_16x16_1x2_16x16x1_16x16x1_1x16x1x16_8_1x2_intrawave_v1,227.15,960.59,0.0
gfx950,256,1627,8192,512,ck,18,0,22.0566,a8w8_blockscale_1x128x128_256x64x64x256_16x16_32x32_1x1_16x16x1_16x16x1_1x32x1x8_8_1x1_intrawave_v1,618.78,1436.49,0.0
gfx950,256,1636,8192,512,ck,18,0,22.0691,a8w8_blockscale_1x128x128_256x64x64x256_16x16_32x32_1x1_16x16x1_16x16x1_1x32x1x8_8_1x1_intrawave_v1,621.85,1442.57,0.0
gfx950,256,1611,8192,512,ck,18,0,22.071,a8w8_blockscale_1x128x128_256x64x64x256_16x16_32x32_1x1_16x16x1_16x16x1_1x32x1x8_8_1x1_intrawave_v1,612.3,1423.3,0.0
gfx950,256,3258,128,7168,ck,18,1,22.0715,a8w8_blockscale_1x128x128_256x64x64x256_16x16_32x32_1x1_16x16x1_16x16x1_1x32x1x8_8_1x1_intrawave_v1,270.87,1137.43,0.0
gfx950,256,1541,8192,512,ck,18,0,22.0768,a8w8_blockscale_1x128x128_256x64x64x256_16x16_32x32_1x1_16x16x1_16x16x1_1x32x1x8_8_1x1_intrawave_v1,585.54,1369.36,0.0
gfx950,256,2946,128,7168,ck,7,0,22.0788,a8w8_blockscale_1x128x128_256x16x128x256_16x16_16x16_1x2_16x16x1_16x16x1_1x16x1x16_8_1x2_intrawave_v1,244.85,1032.15,0.0
gfx950,256,1538,8192,512,ck,18,0,22.0845,a8w8_blockscale_1x128x128_256x64x64x256_16x16_32x32_1x1_16x16x1_16x16x1_1x32x1x8_8_1x1_intrawave_v1,584.2,1366.59,0.0
gfx950,256,2918,128,7168,ck,7,0,22.0852,a8w8_blockscale_1x128x128_256x16x128x256_16x16_16x16_1x2_16x16x1_16x16x1_1x16x1x16_8_1x2_intrawave_v1,242.45,1022.44,0.0
gfx950,256,1615,8192,512,ck,18,0,22.0856,a8w8_blockscale_1x128x128_256x64x64x256_16x16_32x32_1x1_16x16x1_16x16x1_1x32x1x8_8_1x1_intrawave_v1,613.41,1425.42,0.0
gfx950,256,1599,8192,512,ck,18,0,22.0945,a8w8_blockscale_1x128x128_256x64x64x256_16x16_32x32_1x1_16x16x1_16x16x1_1x32x1x8_8_1x1_intrawave_v1,607.09,1412.61,0.0
gfx950,256,1632,8192,512,ck,18,0,22.0945,a8w8_blockscale_1x128x128_256x64x64x256_16x16_32x32_1x1_16x16x1_16x16x1_1x32x1x8_8_1x1_intrawave_v1,619.62,1437.85,0.0
gfx950,256,2952,128,7168,ck,7,0,22.1161,a8w8_blockscale_1x128x128_256x16x128x256_16x16_16x16_1x2_16x16x1_16x16x1_1x16x1x16_8_1x2_intrawave_v1,244.93,1032.42,0.0
gfx950,256,1553,8192,512,ck,18,0,22.124,a8w8_blockscale_1x128x128_256x64x64x256_16x16_32x32_1x1_16x16x1_16x16x1_1x32x1x8_8_1x1_intrawave_v1,588.84,1375.6,0.0
gfx950,256,1543,8192,512,ck,18,0,22.1352,a8w8_blockscale_1x128x128_256x64x64x256_16x16_32x32_1x1_16x16x1_16x16x1_1x32x1x8_8_1x1_intrawave_v1,584.75,1367.27,0.0
gfx950,256,2861,128,7168,ck,7,0,22.1388,a8w8_blockscale_1x128x128_256x16x128x256_16x16_16x16_1x2_16x16x1_16x16x1_1x16x1x16_8_1x2_intrawave_v1,237.14,1000.85,0.0
gfx950,256,1571,8192,512,ck,18,0,22.143,a8w8_blockscale_1x128x128_256x64x64x256_16x16_32x32_1x1_16x16x1_16x16x1_1x32x1x8_8_1x1_intrawave_v1,595.15,1388.16,0.0
gfx950,256,1572,8192,512,ck,18,0,22.1467,a8w8_blockscale_1x128x128_256x64x64x256_16x16_32x32_1x1_16x16x1_16x16x1_1x32x1x8_8_1x1_intrawave_v1,595.43,1388.69,0.0
gfx950,256,3019,128,7168,ck,7,0,22.1706,a8w8_blockscale_1x128x128_256x16x128x256_16x16_16x16_1x2_16x16x1_16x16x1_1x16x1x16_8_1x2_intrawave_v1,249.88,1052.32,0.0
gfx950,256,1561,8192,512,ck,18,0,22.171,a8w8_blockscale_1x128x128_256x64x64x256_16x16_32x32_1x1_16x16x1_16x16x1_1x32x1x8_8_1x1_intrawave_v1,590.62,1378.78,0.0
gfx950,256,1606,8192,512,ck,18,0,22.1719,a8w8_blockscale_1x128x128_256x64x64x256_16x16_32x32_1x1_16x16x1_16x16x1_1x32x1x8_8_1x1_intrawave_v1,607.62,1413.02,0.0
gfx950,256,1580,8192,512,ck,18,0,22.1721,a8w8_blockscale_1x128x128_256x64x64x256_16x16_32x32_1x1_16x16x1_16x16x1_1x32x1x8_8_1x1_intrawave_v1,597.78,1393.19,0.0
gfx950,256,1545,8192,512,ck,18,0,22.1808,a8w8_blockscale_1x128x128_256x64x64x256_16x16_32x32_1x1_16x16x1_16x16x1_1x32x1x8_8_1x1_intrawave_v1,584.31,1365.98,0.0
gfx950,256,1563,8192,512,ck,18,0,22.1814,a8w8_blockscale_1x128x128_256x64x64x256_16x16_32x32_1x1_16x16x1_16x16x1_1x32x1x8_8_1x1_intrawave_v1,591.1,1379.66,0.0
gfx950,256,1589,8192,512,ck,18,0,22.2025,a8w8_blockscale_1x128x128_256x64x64x256_16x16_32x32_1x1_16x16x1_16x16x1_1x32x1x8_8_1x1_intrawave_v1,600.36,1398.13,0.0
gfx950,256,1598,8192,512,ck,18,0,22.2044,a8w8_blockscale_1x128x128_256x64x64x256_16x16_32x32_1x1_16x16x1_16x16x1_1x32x1x8_8_1x1_intrawave_v1,603.71,1404.86,0.0
gfx950,256,1601,8192,512,ck,18,0,22.2076,a8w8_blockscale_1x128x128_256x64x64x256_16x16_32x32_1x1_16x16x1_16x16x1_1x32x1x8_8_1x1_intrawave_v1,604.76,1406.94,0.0
gfx950,256,232,7168,4096,ck,18,0,22.2182,a8w8_blockscale_1x128x128_256x64x64x256_16x16_32x32_1x1_16x16x1_16x16x1_1x32x1x8_8_1x1_intrawave_v1,613.15,1513.91,0.0
gfx950,256,3005,128,7168,ck,7,0,22.2184,a8w8_blockscale_1x128x128_256x16x128x256_16x16_16x16_1x2_16x16x1_16x16x1_1x16x1x16_8_1x2_intrawave_v1,248.18,1045.38,0.0
gfx950,256,1554,8192,512,ck,18,0,22.2315,a8w8_blockscale_1x128x128_256x64x64x256_16x16_32x32_1x1_16x16x1_16x16x1_1x32x1x8_8_1x1_intrawave_v1,586.37,1369.71,0.0
gfx950,256,1591,8192,512,ck,18,0,22.2344,a8w8_blockscale_1x128x128_256x64x64x256_16x16_32x32_1x1_16x16x1_16x16x1_1x32x1x8_8_1x1_intrawave_v1,600.25,1397.65,0.0
gfx950,256,1655,8192,512,ck,18,0,22.2413,a8w8_blockscale_1x128x128_256x64x64x256_16x16_32x32_1x1_16x16x1_16x16x1_1x32x1x8_8_1x1_intrawave_v1,624.21,1445.83,0.0
gfx950,256,1652,8192,512,ck,18,0,22.2465,a8w8_blockscale_1x128x128_256x64x64x256_16x16_32x32_1x1_16x16x1_16x16x1_1x32x1x8_8_1x1_intrawave_v1,622.93,1443.22,0.0
gfx950,256,1573,8192,512,ck,18,0,22.2497,a8w8_blockscale_1x128x128_256x64x64x256_16x16_32x32_1x1_16x16x1_16x16x1_1x32x1x8_8_1x1_intrawave_v1,593.05,1383.02,0.0
gfx950,256,3632,128,7168,ck,7,0,22.2814,a8w8_blockscale_1x128x128_256x16x128x256_16x16_16x16_1x2_16x16x1_16x16x1_1x16x1x16_8_1x2_intrawave_v1,299.12,1251.33,0.0
gfx950,256,1607,8192,512,ck,18,0,22.3337,a8w8_blockscale_1x128x128_256x64x64x256_16x16_32x32_1x1_16x16x1_16x16x1_1x32x1x8_8_1x1_intrawave_v1,603.59,1403.54,0.0
gfx950,256,3587,128,7168,ck,7,0,22.3606,a8w8_blockscale_1x128x128_256x16x128x256_16x16_16x16_1x2_16x16x1_16x16x1_1x16x1x16_8_1x2_intrawave_v1,294.36,1231.96,0.0
gfx950,256,1659,8192,512,ck,18,0,22.362,a8w8_blockscale_1x128x128_256x64x64x256_16x16_32x32_1x1_16x16x1_16x16x1_1x32x1x8_8_1x1_intrawave_v1,622.34,1441.05,0.0
gfx950,256,1626,8192,512,ck,18,0,22.3686,a8w8_blockscale_1x128x128_256x64x64x256_16x16_32x32_1x1_16x16x1_16x16x1_1x32x1x8_8_1x1_intrawave_v1,609.78,1415.7,0.0
gfx950,256,1608,8192,512,ck,18,0,22.3838,a8w8_blockscale_1x128x128_256x64x64x256_16x16_32x32_1x1_16x16x1_16x16x1_1x32x1x8_8_1x1_intrawave_v1,602.62,1401.15,0.0
gfx950,256,1568,8192,512,ck,18,0,22.3956,a8w8_blockscale_1x128x128_256x64x64x256_16x16_32x32_1x1_16x16x1_16x16x1_1x32x1x8_8_1x1_intrawave_v1,587.32,1370.23,0.0
gfx950,256,184,7168,4096,ck,18,0,22.4018,a8w8_blockscale_1x128x128_256x64x64x256_16x16_32x32_1x1_16x16x1_16x16x1_1x32x1x8_8_1x1_intrawave_v1,482.31,1462.01,0.0
gfx950,256,1660,8192,512,ck,18,0,22.4104,a8w8_blockscale_1x128x128_256x64x64x256_16x16_32x32_1x1_16x16x1_16x16x1_1x32x1x8_8_1x1_intrawave_v1,621.37,1438.69,0.0
gfx950,256,1648,8192,512,ck,18,0,22.4548,a8w8_blockscale_1x128x128_256x64x64x256_16x16_32x32_1x1_16x16x1_16x16x1_1x32x1x8_8_1x1_intrawave_v1,615.66,1426.82,0.0
gfx950,256,1649,8192,512,ck,18,0,22.458,a8w8_blockscale_1x128x128_256x64x64x256_16x16_32x32_1x1_16x16x1_16x16x1_1x32x1x8_8_1x1_intrawave_v1,615.94,1427.37,0.0
gfx950,256,1647,8192,512,ck,18,0,22.4609,a8w8_blockscale_1x128x128_256x64x64x256_16x16_32x32_1x1_16x16x1_16x16x1_1x32x1x8_8_1x1_intrawave_v1,615.12,1425.68,0.0
gfx950,256,3840,128,7168,ck,7,0,22.4731,a8w8_blockscale_1x128x128_256x16x128x256_16x16_16x16_1x2_16x16x1_16x16x1_1x16x1x16_8_1x2_intrawave_v1,313.55,1309.37,0.0
gfx950,256,1609,8192,512,ck,18,0,22.4748,a8w8_blockscale_1x128x128_256x64x64x256_16x16_32x32_1x1_16x16x1_16x16x1_1x32x1x8_8_1x1_intrawave_v1,600.55,1396.23,0.0
gfx950,256,1653,8192,512,ck,18,0,22.501,a8w8_blockscale_1x128x128_256x64x64x256_16x16_32x32_1x1_16x16x1_16x16x1_1x32x1x8_8_1x1_intrawave_v1,616.26,1427.64,0.0
gfx950,256,1640,8192,512,ck,18,0,22.5324,a8w8_blockscale_1x128x128_256x64x64x256_16x16_32x32_1x1_16x16x1_16x16x1_1x32x1x8_8_1x1_intrawave_v1,610.56,1415.91,0.0
gfx950,256,1631,8192,512,ck,18,0,22.5448,a8w8_blockscale_1x128x128_256x64x64x256_16x16_32x32_1x1_16x16x1_16x16x1_1x32x1x8_8_1x1_intrawave_v1,606.87,1408.38,0.0
gfx950,256,240,7168,4096,ck,18,0,22.5571,a8w8_blockscale_1x128x128_256x64x64x256_16x16_32x32_1x1_16x16x1_16x16x1_1x32x1x8_8_1x1_intrawave_v1,624.76,1497.7,0.0
gfx950,256,1646,8192,512,ck,18,0,22.568,a8w8_blockscale_1x128x128_256x64x64x256_16x16_32x32_1x1_16x16x1_16x16x1_1x32x1x8_8_1x1_intrawave_v1,611.82,1418.16,0.0
gfx950,256,3620,128,7168,ck,7,0,22.5757,a8w8_blockscale_1x128x128_256x16x128x256_16x16_16x16_1x2_16x16x1_16x16x1_1x16x1x16_8_1x2_intrawave_v1,294.24,1231.08,0.0
gfx950,256,3451,128,7168,ck,7,0,22.5909,a8w8_blockscale_1x128x128_256x16x128x256_16x16_16x16_1x2_16x16x1_16x16x1_1x16x1x16_8_1x2_intrawave_v1,280.32,1174.71,0.0
gfx950,256,3617,128,7168,ck,7,0,22.6041,a8w8_blockscale_1x128x128_256x16x128x256_16x16_16x16_1x2_16x16x1_16x16x1_1x16x1x16_8_1x2_intrawave_v1,293.63,1228.54,0.0
gfx950,256,3824,128,7168,ck,7,0,22.6106,a8w8_blockscale_1x128x128_256x16x128x256_16x16_16x16_1x2_16x16x1_16x16x1_1x16x1x16_8_1x2_intrawave_v1,310.34,1296.16,0.0
gfx950,256,3831,128,7168,ck,7,0,22.6164,a8w8_blockscale_1x128x128_256x16x128x256_16x16_16x16_1x2_16x16x1_16x16x1_1x16x1x16_8_1x2_intrawave_v1,310.83,1298.12,0.0
gfx950,256,4000,128,7168,ck,7,0,22.6338,a8w8_blockscale_1x128x128_256x16x128x256_16x16_16x16_1x2_16x16x1_16x16x1_1x16x1x16_8_1x2_intrawave_v1,324.3,1352.56,0.0
gfx950,256,1658,8192,512,ck,18,0,22.6642,a8w8_blockscale_1x128x128_256x64x64x256_16x16_32x32_1x1_16x16x1_16x16x1_1x32x1x8_8_1x1_intrawave_v1,613.67,1421.09,0.0
gfx950,256,3655,128,7168,ck,7,0,22.7267,a8w8_blockscale_1x128x128_256x16x128x256_16x16_16x16_1x2_16x16x1_16x16x1_1x16x1x16_8_1x2_intrawave_v1,295.11,1234.33,0.0
gfx950,256,144,7168,4608,ck,18,0,22.742,a8w8_blockscale_1x128x128_256x64x64x256_16x16_32x32_1x1_16x16x1_16x16x1_1x32x1x8_8_1x1_intrawave_v1,418.29,1572.34,0.0
gfx950,256,136,7168,4608,ck,18,0,22.745,a8w8_blockscale_1x128x128_256x64x64x256_16x16_32x32_1x1_16x16x1_16x16x1_1x32x1x8_8_1x1_intrawave_v1,395.0,1565.47,0.0
gfx950,256,3749,128,7168,ck,7,0,22.758,a8w8_blockscale_1x128x128_256x16x128x256_16x16_16x16_1x2_16x16x1_16x16x1_1x16x1x16_8_1x2_intrawave_v1,302.29,1263.3,0.0
gfx950,256,4002,128,7168,ck,7,0,22.7781,a8w8_blockscale_1x128x128_256x16x128x256_16x16_16x16_1x2_16x16x1_16x16x1_1x16x1x16_8_1x2_intrawave_v1,322.4,1344.64,0.0
gfx950,256,200,7168,4608,ck,18,0,22.7803,a8w8_blockscale_1x128x128_256x64x64x256_16x16_32x32_1x1_16x16x1_16x16x1_1x32x1x8_8_1x1_intrawave_v1,579.98,1616.26,0.0
gfx950,256,3894,128,7168,ck,7,0,22.819,a8w8_blockscale_1x128x128_256x16x128x256_16x16_16x16_1x2_16x16x1_16x16x1_1x16x1x16_8_1x2_intrawave_v1,313.14,1307.09,0.0
gfx950,256,3971,128,7168,ck,7,0,22.8352,a8w8_blockscale_1x128x128_256x16x128x256_16x16_16x16_1x2_16x16x1_16x16x1_1x16x1x16_8_1x2_intrawave_v1,319.1,1331.2,0.0
gfx950,256,3925,128,7168,ck,7,0,22.9206,a8w8_blockscale_1x128x128_256x16x128x256_16x16_16x16_1x2_16x16x1_16x16x1_1x16x1x16_8_1x2_intrawave_v1,314.23,1311.34,0.0
gfx950,256,4050,128,7168,ck,7,0,22.9365,a8w8_blockscale_1x128x128_256x16x128x256_16x16_16x16_1x2_16x16x1_16x16x1_1x16x1x16_8_1x2_intrawave_v1,324.02,1350.89,0.0
gfx950,256,248,7168,4096,ck,18,0,22.945,a8w8_blockscale_1x128x128_256x64x64x256_16x16_32x32_1x1_16x16x1_16x16x1_1x32x1x8_8_1x1_intrawave_v1,634.68,1478.81,0.0
gfx950,256,152,7168,4608,ck,18,0,22.9751,a8w8_blockscale_1x128x128_256x64x64x256_16x16_32x32_1x1_16x16x1_16x16x1_1x32x1x8_8_1x1_intrawave_v1,437.05,1562.98,0.0
gfx950,256,1664,8192,512,ck,18,0,23.0137,a8w8_blockscale_1x128x128_256x64x64x256_16x16_32x32_1x1_16x16x1_16x16x1_1x32x1x8_8_1x1_intrawave_v1,606.54,1403.91,0.0
gfx950,256,208,7168,4608,ck,18,0,23.0225,a8w8_blockscale_1x128x128_256x64x64x256_16x16_32x32_1x1_16x16x1_16x16x1_1x32x1x8_8_1x1_intrawave_v1,596.83,1605.84,0.0
gfx950,256,4046,128,7168,ck,7,0,23.0582,a8w8_blockscale_1x128x128_256x16x128x256_16x16_16x16_1x2_16x16x1_16x16x1_1x16x1x16_8_1x2_intrawave_v1,321.99,1342.47,0.0
gfx950,256,1721,8192,512,ck,18,0,23.0798,a8w8_blockscale_1x128x128_256x64x64x256_16x16_32x32_1x1_16x16x1_16x16x1_1x32x1x8_8_1x1_intrawave_v1,625.52,1441.62,0.0
gfx950,256,1709,8192,512,ck,18,0,23.1386,a8w8_blockscale_1x128x128_256x64x64x256_16x16_32x32_1x1_16x16x1_16x16x1_1x32x1x8_8_1x1_intrawave_v1,619.58,1429.19,0.0
gfx950,256,168,7168,4608,ck,18,0,23.1605,a8w8_blockscale_1x128x128_256x64x64x256_16x16_32x32_1x1_16x16x1_16x16x1_1x32x1x8_8_1x1_intrawave_v1,479.18,1563.56,0.0
gfx950,256,1680,8192,512,ck,18,0,23.1618,a8w8_blockscale_1x128x128_256x64x64x256_16x16_32x32_1x1_16x16x1_16x16x1_1x32x1x8_8_1x1_intrawave_v1,608.45,1406.61,0.0
gfx950,256,1693,8192,512,ck,18,0,23.1816,a8w8_blockscale_1x128x128_256x64x64x256_16x16_32x32_1x1_16x16x1_16x16x1_1x32x1x8_8_1x1_intrawave_v1,612.64,1414.88,0.0
gfx950,256,1694,8192,512,ck,18,0,23.1929,a8w8_blockscale_1x128x128_256x64x64x256_16x16_32x32_1x1_16x16x1_16x16x1_1x32x1x8_8_1x1_intrawave_v1,612.7,1414.92,0.0
gfx950,256,1667,8192,512,ck,18,0,23.2127,a8w8_blockscale_1x128x128_256x64x64x256_16x16_32x32_1x1_16x16x1_16x16x1_1x32x1x8_8_1x1_intrawave_v1,602.42,1394.06,0.0
gfx950,256,1722,8192,512,ck,18,0,23.2537,a8w8_blockscale_1x128x128_256x64x64x256_16x16_32x32_1x1_16x16x1_16x16x1_1x32x1x8_8_1x1_intrawave_v1,621.2,1431.57,0.0
gfx950,256,1706,8192,512,ck,18,0,23.2667,a8w8_blockscale_1x128x128_256x64x64x256_16x16_32x32_1x1_16x16x1_16x16x1_1x32x1x8_8_1x1_intrawave_v1,615.08,1419.15,0.0
gfx950,256,1690,8192,512,ck,18,0,23.2938,a8w8_blockscale_1x128x128_256x64x64x256_16x16_32x32_1x1_16x16x1_16x16x1_1x32x1x8_8_1x1_intrawave_v1,608.61,1405.89,0.0
gfx950,256,1714,8192,512,ck,18,0,23.2964,a8w8_blockscale_1x128x128_256x64x64x256_16x16_32x32_1x1_16x16x1_16x16x1_1x32x1x8_8_1x1_intrawave_v1,617.18,1423.14,0.0
gfx950,256,1701,8192,512,ck,18,0,23.2971,a8w8_blockscale_1x128x128_256x64x64x256_16x16_32x32_1x1_16x16x1_16x16x1_1x32x1x8_8_1x1_intrawave_v1,612.48,1413.67,0.0
gfx950,256,24,9216,7168,ck,8,2,23.3048,a8w8_blockscale_1x128x128_256x16x64x256_16x16_16x16_1x1_16x16x1_16x16x1_1x16x1x16_4_1x1_intrawave_v1,136.06,2860.99,0.0
gfx950,256,1675,8192,512,ck,18,0,23.307,a8w8_blockscale_1x128x128_256x64x64x256_16x16_32x32_1x1_16x16x1_16x16x1_1x32x1x8_8_1x1_intrawave_v1,602.86,1394.22,0.0
gfx950,256,216,7168,4608,ck,18,0,23.318,a8w8_blockscale_1x128x128_256x64x64x256_16x16_32x32_1x1_16x16x1_16x16x1_1x32x1x8_8_1x1_intrawave_v1,611.93,1591.99,0.0
gfx950,256,1711,8192,512,ck,18,0,23.3508,a8w8_blockscale_1x128x128_256x64x64x256_16x16_32x32_1x1_16x16x1_16x16x1_1x32x1x8_8_1x1_intrawave_v1,614.66,1417.65,0.0
gfx950,256,1692,8192,512,ck,18,0,23.358,a8w8_blockscale_1x128x128_256x64x64x256_16x16_32x32_1x1_16x16x1_16x16x1_1x32x1x8_8_1x1_intrawave_v1,607.65,1403.47,0.0
gfx950,256,176,7168,4608,ck,18,0,23.361,a8w8_blockscale_1x128x128_256x64x64x256_16x16_32x32_1x1_16x16x1_16x16x1_1x32x1x8_8_1x1_intrawave_v1,497.69,1556.62,0.0
gfx950,256,1716,8192,512,ck,18,0,23.3639,a8w8_blockscale_1x128x128_256x64x64x256_16x16_32x32_1x1_16x16x1_16x16x1_1x32x1x8_8_1x1_intrawave_v1,616.12,1420.48,0.0
gfx950,256,1735,8192,512,ck,18,0,23.3739,a8w8_blockscale_1x128x128_256x64x64x256_16x16_32x32_1x1_16x16x1_16x16x1_1x32x1x8_8_1x1_intrawave_v1,622.67,1433.6,0.0
gfx950,256,1739,8192,512,ck,18,0,23.3862,a8w8_blockscale_1x128x128_256x64x64x256_16x16_32x32_1x1_16x16x1_16x16x1_1x32x1x8_8_1x1_intrawave_v1,623.78,1435.74,0.0
gfx950,256,1783,8192,512,ck,18,0,23.3879,a8w8_blockscale_1x128x128_256x64x64x256_16x16_32x32_1x1_16x16x1_16x16x1_1x32x1x8_8_1x1_intrawave_v1,639.51,1467.42,0.0
gfx950,256,1689,8192,512,ck,18,0,23.4078,a8w8_blockscale_1x128x128_256x64x64x256_16x16_32x32_1x1_16x16x1_16x16x1_1x32x1x8_8_1x1_intrawave_v1,605.28,1398.32,0.0
gfx950,256,1703,8192,512,ck,18,0,23.4096,a8w8_blockscale_1x128x128_256x64x64x256_16x16_32x32_1x1_16x16x1_16x16x1_1x32x1x8_8_1x1_intrawave_v1,610.25,1408.32,0.0
gfx950,256,1697,8192,512,ck,18,0,23.4109,a8w8_blockscale_1x128x128_256x64x64x256_16x16_32x32_1x1_16x16x1_16x16x1_1x32x1x8_8_1x1_intrawave_v1,608.07,1403.91,0.0
gfx950,256,1726,8192,512,ck,18,0,23.4111,a8w8_blockscale_1x128x128_256x64x64x256_16x16_32x32_1x1_16x16x1_16x16x1_1x32x1x8_8_1x1_intrawave_v1,618.46,1424.83,0.0
gfx950,256,4123,128,7168,ck,18,0,23.4177,a8w8_blockscale_1x128x128_256x64x64x256_16x16_32x32_1x1_16x16x1_16x16x1_1x32x1x8_8_1x1_intrawave_v1,323.08,1346.27,0.0
gfx950,256,1756,8192,512,ck,18,0,23.4223,a8w8_blockscale_1x128x128_256x64x64x256_16x16_32x32_1x1_16x16x1_16x16x1_1x32x1x8_8_1x1_intrawave_v1,628.9,1445.79,0.0
gfx950,256,1695,8192,512,ck,18,0,23.4477,a8w8_blockscale_1x128x128_256x64x64x256_16x16_32x32_1x1_16x16x1_16x16x1_1x32x1x8_8_1x1_intrawave_v1,606.4,1400.27,0.0
gfx950,256,1782,8192,512,ck,18,0,23.4481,a8w8_blockscale_1x128x128_256x64x64x256_16x16_32x32_1x1_16x16x1_16x16x1_1x32x1x8_8_1x1_intrawave_v1,637.51,1462.93,0.0
gfx950,256,1743,8192,512,ck,18,0,23.4552,a8w8_blockscale_1x128x128_256x64x64x256_16x16_32x32_1x1_16x16x1_16x16x1_1x32x1x8_8_1x1_intrawave_v1,623.37,1434.4,0.0
gfx950,256,4598,128,7168,ck,18,0,23.4574,a8w8_blockscale_1x128x128_256x64x64x256_16x16_32x32_1x1_16x16x1_16x16x1_1x32x1x8_8_1x1_intrawave_v1,359.69,1494.33,0.0
gfx950,256,1752,8192,512,ck,18,0,23.4597,a8w8_blockscale_1x128x128_256x64x64x256_16x16_32x32_1x1_16x16x1_16x16x1_1x32x1x8_8_1x1_intrawave_v1,626.47,1440.6,0.0
gfx950,256,1719,8192,512,ck,18,0,23.4641,a8w8_blockscale_1x128x128_256x64x64x256_16x16_32x32_1x1_16x16x1_16x16x1_1x32x1x8_8_1x1_intrawave_v1,614.56,1416.57,0.0
gfx950,256,5440,128,7168,ck,18,0,23.4678,a8w8_blockscale_1x128x128_256x64x64x256_16x16_32x32_1x1_16x16x1_16x16x1_1x32x1x8_8_1x1_intrawave_v1,425.37,1760.03,0.0
gfx950,256,4176,128,7168,ck,18,0,23.4802,a8w8_blockscale_1x128x128_256x64x64x256_16x16_32x32_1x1_16x16x1_16x16x1_1x32x1x8_8_1x1_intrawave_v1,326.36,1359.45,0.0
gfx950,256,4294,128,7168,ck,18,0,23.4828,a8w8_blockscale_1x128x128_256x64x64x256_16x16_32x32_1x1_16x16x1_16x16x1_1x32x1x8_8_1x1_intrawave_v1,335.54,1396.6,0.0
gfx950,256,4522,128,7168,ck,18,0,23.4893,a8w8_blockscale_1x128x128_256x64x64x256_16x16_32x32_1x1_16x16x1_16x16x1_1x32x1x8_8_1x1_intrawave_v1,353.26,1468.28,0.0
gfx950,256,1727,8192,512,ck,18,0,23.4979,a8w8_blockscale_1x128x128_256x64x64x256_16x16_32x32_1x1_16x16x1_16x16x1_1x32x1x8_8_1x1_intrawave_v1,616.53,1420.28,0.0
gfx950,256,4180,128,7168,ck,18,0,23.4988,a8w8_blockscale_1x128x128_256x64x64x256_16x16_32x32_1x1_16x16x1_16x16x1_1x32x1x8_8_1x1_intrawave_v1,326.41,1359.64,0.0
gfx950,256,4507,128,7168,ck,18,0,23.5333,a8w8_blockscale_1x128x128_256x64x64x256_16x16_32x32_1x1_16x16x1_16x16x1_1x32x1x8_8_1x1_intrawave_v1,351.43,1460.8,0.0
gfx950,256,1708,8192,512,ck,18,0,23.5364,a8w8_blockscale_1x128x128_256x64x64x256_16x16_32x32_1x1_16x16x1_16x16x1_1x32x1x8_8_1x1_intrawave_v1,608.75,1404.32,0.0
gfx950,256,1786,8192,512,ck,18,0,23.5443,a8w8_blockscale_1x128x128_256x64x64x256_16x16_32x32_1x1_16x16x1_16x16x1_1x32x1x8_8_1x1_intrawave_v1,636.33,1459.83,0.0
gfx950,256,1738,8192,512,ck,18,0,23.5459,a8w8_blockscale_1x128x128_256x64x64x256_16x16_32x32_1x1_16x16x1_16x16x1_1x32x1x8_8_1x1_intrawave_v1,619.19,1425.28,0.0
gfx950,256,1702,8192,512,ck,18,0,23.5556,a8w8_blockscale_1x128x128_256x64x64x256_16x16_32x32_1x1_16x16x1_16x16x1_1x32x1x8_8_1x1_intrawave_v1,606.12,1398.87,0.0
gfx950,256,4504,128,7168,ck,18,0,23.5655,a8w8_blockscale_1x128x128_256x64x64x256_16x16_32x32_1x1_16x16x1_16x16x1_1x32x1x8_8_1x1_intrawave_v1,350.72,1457.86,0.0
gfx950,256,1698,8192,512,ck,18,0,23.5689,a8w8_blockscale_1x128x128_256x64x64x256_16x16_32x32_1x1_16x16x1_16x16x1_1x32x1x8_8_1x1_intrawave_v1,604.35,1395.22,0.0
gfx950,256,1677,8192,512,ck,18,0,23.5712,a8w8_blockscale_1x128x128_256x64x64x256_16x16_32x32_1x1_16x16x1_16x16x1_1x32x1x8_8_1x1_intrawave_v1,596.82,1380.03,0.0
gfx950,256,1742,8192,512,ck,18,0,23.5943,a8w8_blockscale_1x128x128_256x64x64x256_16x16_32x32_1x1_16x16x1_16x16x1_1x32x1x8_8_1x1_intrawave_v1,619.34,1425.22,0.0
gfx950,256,1717,8192,512,ck,18,0,23.5972,a8w8_blockscale_1x128x128_256x64x64x256_16x16_32x32_1x1_16x16x1_16x16x1_1x32x1x8_8_1x1_intrawave_v1,610.38,1407.15,0.0
gfx950,256,1731,8192,512,ck,18,0,23.6204,a8w8_blockscale_1x128x128_256x64x64x256_16x16_32x32_1x1_16x16x1_16x16x1_1x32x1x8_8_1x1_intrawave_v1,614.75,1415.78,0.0
gfx950,256,1733,8192,512,ck,18,0,23.6212,a8w8_blockscale_1x128x128_256x64x64x256_16x16_32x32_1x1_16x16x1_16x16x1_1x32x1x8_8_1x1_intrawave_v1,615.44,1417.16,0.0
gfx950,256,1688,8192,512,ck,18,0,23.6227,a8w8_blockscale_1x128x128_256x64x64x256_16x16_32x32_1x1_16x16x1_16x16x1_1x32x1x8_8_1x1_intrawave_v1,599.42,1384.89,0.0
gfx950,256,5003,128,7168,ck,18,0,23.6281,a8w8_blockscale_1x128x128_256x64x64x256_16x16_32x32_1x1_16x16x1_16x16x1_1x32x1x8_8_1x1_intrawave_v1,388.54,1610.78,0.0
gfx950,256,1744,8192,512,ck,18,0,23.6607,a8w8_blockscale_1x128x128_256x64x64x256_16x16_32x32_1x1_16x16x1_16x16x1_1x32x1x8_8_1x1_intrawave_v1,618.31,1422.65,0.0
gfx950,256,1753,8192,512,ck,18,0,23.6683,a8w8_blockscale_1x128x128_256x64x64x256_16x16_32x32_1x1_16x16x1_16x16x1_1x32x1x8_8_1x1_intrawave_v1,621.3,1428.62,0.0
gfx950,256,5004,128,7168,ck,18,0,23.6783,a8w8_blockscale_1x128x128_256x64x64x256_16x16_32x32_1x1_16x16x1_16x16x1_1x32x1x8_8_1x1_intrawave_v1,387.8,1607.68,0.0
gfx950,256,5018,128,7168,ck,18,0,23.681,a8w8_blockscale_1x128x128_256x64x64x256_16x16_32x32_1x1_16x16x1_16x16x1_1x32x1x8_8_1x1_intrawave_v1,388.84,1611.89,0.0
gfx950,256,1749,8192,512,ck,18,0,23.6833,a8w8_blockscale_1x128x128_256x64x64x256_16x16_32x32_1x1_16x16x1_16x16x1_1x32x1x8_8_1x1_intrawave_v1,619.49,1424.86,0.0
gfx950,256,1737,8192,512,ck,18,0,23.6896,a8w8_blockscale_1x128x128_256x64x64x256_16x16_32x32_1x1_16x16x1_16x16x1_1x32x1x8_8_1x1_intrawave_v1,615.08,1415.92,0.0
gfx950,256,232,7168,4608,ck,18,0,23.6956,a8w8_blockscale_1x128x128_256x64x64x256_16x16_32x32_1x1_16x16x1_16x16x1_1x32x1x8_8_1x1_intrawave_v1,646.79,1579.41,0.0
gfx950,256,240,7168,4608,ck,18,0,23.7008,a8w8_blockscale_1x128x128_256x64x64x256_16x16_32x32_1x1_16x16x1_16x16x1_1x32x1x8_8_1x1_intrawave_v1,668.94,1585.46,0.0
gfx950,256,5006,128,7168,ck,18,0,23.7044,a8w8_blockscale_1x128x128_256x64x64x256_16x16_32x32_1x1_16x16x1_16x16x1_1x32x1x8_8_1x1_intrawave_v1,387.53,1606.54,0.0
gfx950,256,4898,128,7168,ck,18,0,23.7065,a8w8_blockscale_1x128x128_256x64x64x256_16x16_32x32_1x1_16x16x1_16x16x1_1x32x1x8_8_1x1_intrawave_v1,379.13,1572.58,0.0
gfx950,256,5002,128,7168,ck,18,0,23.7098,a8w8_blockscale_1x128x128_256x64x64x256_16x16_32x32_1x1_16x16x1_16x16x1_1x32x1x8_8_1x1_intrawave_v1,387.13,1604.92,0.0
gfx950,256,184,7168,4608,ck,18,0,23.7109,a8w8_blockscale_1x128x128_256x64x64x256_16x16_32x32_1x1_16x16x1_16x16x1_1x32x1x8_8_1x1_intrawave_v1,512.64,1540.04,0.0
gfx950,256,5000,128,7168,ck,18,0,23.7126,a8w8_blockscale_1x128x128_256x64x64x256_16x16_32x32_1x1_16x16x1_16x16x1_1x32x1x8_8_1x1_intrawave_v1,386.93,1604.11,0.0
gfx950,256,5126,128,7168,ck,18,0,23.7165,a8w8_blockscale_1x128x128_256x64x64x256_16x16_32x32_1x1_16x16x1_16x16x1_1x32x1x8_8_1x1_intrawave_v1,396.61,1643.28,0.0
gfx950,256,1724,8192,512,ck,18,0,23.7172,a8w8_blockscale_1x128x128_256x64x64x256_16x16_32x32_1x1_16x16x1_16x16x1_1x32x1x8_8_1x1_intrawave_v1,609.77,1405.01,0.0
gfx950,256,1747,8192,512,ck,18,0,23.7217,a8w8_blockscale_1x128x128_256x64x64x256_16x16_32x32_1x1_16x16x1_16x16x1_1x32x1x8_8_1x1_intrawave_v1,617.78,1421.13,0.0
gfx950,256,5124,128,7168,ck,18,0,23.728,a8w8_blockscale_1x128x128_256x64x64x256_16x16_32x32_1x1_16x16x1_16x16x1_1x32x1x8_8_1x1_intrawave_v1,396.27,1641.86,0.0
gfx950,256,1765,8192,512,ck,18,0,23.7461,a8w8_blockscale_1x128x128_256x64x64x256_16x16_32x32_1x1_16x16x1_16x16x1_1x32x1x8_8_1x1_intrawave_v1,623.51,1432.48,0.0
gfx950,256,5007,128,7168,ck,18,0,23.7513,a8w8_blockscale_1x128x128_256x64x64x256_16x16_32x32_1x1_16x16x1_16x16x1_1x32x1x8_8_1x1_intrawave_v1,386.84,1603.68,0.0
gfx950,256,5272,128,7168,ck,18,0,23.7649,a8w8_blockscale_1x128x128_256x64x64x256_16x16_32x32_1x1_16x16x1_16x16x1_1x32x1x8_8_1x1_intrawave_v1,407.08,1685.55,0.0
gfx950,256,1732,8192,512,ck,18,0,23.7665,a8w8_blockscale_1x128x128_256x64x64x256_16x16_32x32_1x1_16x16x1_16x16x1_1x32x1x8_8_1x1_intrawave_v1,611.33,1407.79,0.0
gfx950,256,5273,128,7168,ck,18,0,23.7671,a8w8_blockscale_1x128x128_256x64x64x256_16x16_32x32_1x1_16x16x1_16x16x1_1x32x1x8_8_1x1_intrawave_v1,407.12,1685.7,0.0
gfx950,256,1736,8192,512,ck,18,0,23.7682,a8w8_blockscale_1x128x128_256x64x64x256_16x16_32x32_1x1_16x16x1_16x16x1_1x32x1x8_8_1x1_intrawave_v1,612.69,1410.53,0.0
gfx950,256,5269,128,7168,ck,18,0,23.7728,a8w8_blockscale_1x128x128_256x64x64x256_16x16_32x32_1x1_16x16x1_16x16x1_1x32x1x8_8_1x1_intrawave_v1,406.71,1684.05,0.0
gfx950,256,5295,128,7168,ck,18,0,23.779,a8w8_blockscale_1x128x128_256x64x64x256_16x16_32x32_1x1_16x16x1_16x16x1_1x32x1x8_8_1x1_intrawave_v1,408.61,1691.73,0.0
gfx950,256,1754,8192,512,ck,18,0,23.7845,a8w8_blockscale_1x128x128_256x64x64x256_16x16_32x32_1x1_16x16x1_16x16x1_1x32x1x8_8_1x1_intrawave_v1,618.62,1422.35,0.0
gfx950,256,5277,128,7168,ck,18,0,23.7847,a8w8_blockscale_1x128x128_256x64x64x256_16x16_32x32_1x1_16x16x1_16x16x1_1x32x1x8_8_1x1_intrawave_v1,407.12,1685.7,0.0
gfx950,256,5059,128,7168,ck,18,0,23.7849,a8w8_blockscale_1x128x128_256x64x64x256_16x16_32x32_1x1_16x16x1_16x16x1_1x32x1x8_8_1x1_intrawave_v1,390.3,1617.64,0.0
gfx950,256,1745,8192,512,ck,18,0,23.786,a8w8_blockscale_1x128x128_256x64x64x256_16x16_32x32_1x1_16x16x1_16x16x1_1x32x1x8_8_1x1_intrawave_v1,615.41,1415.87,0.0
gfx950,256,5281,128,7168,ck,18,0,23.7871,a8w8_blockscale_1x128x128_256x64x64x256_16x16_32x32_1x1_16x16x1_16x16x1_1x32x1x8_8_1x1_intrawave_v1,407.39,1686.78,0.0
gfx950,256,1758,8192,512,ck,18,0,23.7968,a8w8_blockscale_1x128x128_256x64x64x256_16x16_32x32_1x1_16x16x1_16x16x1_1x32x1x8_8_1x1_intrawave_v1,619.71,1424.46,0.0
gfx950,256,5276,128,7168,ck,18,0,23.808,a8w8_blockscale_1x128x128_256x64x64x256_16x16_32x32_1x1_16x16x1_16x16x1_1x32x1x8_8_1x1_intrawave_v1,406.65,1683.74,0.0
gfx950,256,5285,128,7168,ck,18,0,23.8124,a8w8_blockscale_1x128x128_256x64x64x256_16x16_32x32_1x1_16x16x1_16x16x1_1x32x1x8_8_1x1_intrawave_v1,407.27,1686.24,0.0
gfx950,256,5489,128,7168,ck,18,0,23.819,a8w8_blockscale_1x128x128_256x64x64x256_16x16_32x32_1x1_16x16x1_16x16x1_1x32x1x8_8_1x1_intrawave_v1,422.87,1749.35,0.0
gfx950,256,5251,128,7168,ck,18,0,23.8265,a8w8_blockscale_1x128x128_256x64x64x256_16x16_32x32_1x1_16x16x1_16x16x1_1x32x1x8_8_1x1_intrawave_v1,404.41,1674.64,0.0
gfx950,256,1740,8192,512,ck,18,0,23.8335,a8w8_blockscale_1x128x128_256x64x64x256_16x16_32x32_1x1_16x16x1_16x16x1_1x32x1x8_8_1x1_intrawave_v1,612.42,1409.5,0.0
gfx950,256,1741,8192,512,ck,18,0,23.8473,a8w8_blockscale_1x128x128_256x64x64x256_16x16_32x32_1x1_16x16x1_16x16x1_1x32x1x8_8_1x1_intrawave_v1,612.42,1409.39,0.0
gfx950,256,5368,128,7168,ck,18,0,23.8601,a8w8_blockscale_1x128x128_256x64x64x256_16x16_32x32_1x1_16x16x1_16x16x1_1x32x1x8_8_1x1_intrawave_v1,412.84,1708.69,0.0
gfx950,256,40,9216,7168,ck,18,0,23.8618,a8w8_blockscale_1x128x128_256x64x64x256_16x16_32x32_1x1_16x16x1_16x16x1_1x32x1x8_8_1x1_intrawave_v1,221.48,2811.37,0.0
gfx950,256,5302,128,7168,ck,18,0,23.8636,a8w8_blockscale_1x128x128_256x64x64x256_16x16_32x32_1x1_16x16x1_16x16x1_1x32x1x8_8_1x1_intrawave_v1,407.7,1687.91,0.0
gfx950,256,5431,128,7168,ck,18,0,23.8641,a8w8_blockscale_1x128x128_256x64x64x256_16x16_32x32_1x1_16x16x1_16x16x1_1x32x1x8_8_1x1_intrawave_v1,417.61,1728.0,0.0
gfx950,256,5264,128,7168,ck,18,0,23.8674,a8w8_blockscale_1x128x128_256x64x64x256_16x16_32x32_1x1_16x16x1_16x16x1_1x32x1x8_8_1x1_intrawave_v1,404.71,1675.82,0.0
gfx950,256,856,6144,1536,ck,0,0,23.8684,a8w8_blockscale_1x128x128_256x128x128x128_16x16_32x32_2x2_8x32x1_8x32x1_1x32x1x8_8_1x1_intrawave_v3,676.9,891.16,0.0
gfx950,256,5275,128,7168,ck,18,0,23.8699,a8w8_blockscale_1x128x128_256x64x64x256_16x16_32x32_1x1_16x16x1_16x16x1_1x32x1x8_8_1x1_intrawave_v1,405.52,1679.06,0.0
gfx950,256,1757,8192,512,ck,18,0,23.8708,a8w8_blockscale_1x128x128_256x64x64x256_16x16_32x32_1x1_16x16x1_16x16x1_1x32x1x8_8_1x1_intrawave_v1,617.44,1419.33,0.0
gfx950,256,5283,128,7168,ck,18,0,23.8726,a8w8_blockscale_1x128x128_256x64x64x256_16x16_32x32_1x1_16x16x1_16x16x1_1x32x1x8_8_1x1_intrawave_v1,406.09,1681.36,0.0
gfx950,256,1778,8192,512,ck,18,0,23.8777,a8w8_blockscale_1x128x128_256x64x64x256_16x16_32x32_1x1_16x16x1_16x16x1_1x32x1x8_8_1x1_intrawave_v1,624.64,1433.78,0.0
gfx950,256,1773,8192,512,ck,18,0,23.8813,a8w8_blockscale_1x128x128_256x64x64x256_16x16_32x32_1x1_16x16x1_16x16x1_1x32x1x8_8_1x1_intrawave_v1,622.79,1430.03,0.0
gfx950,256,5292,128,7168,ck,18,0,23.8918,a8w8_blockscale_1x128x128_256x64x64x256_16x16_32x32_1x1_16x16x1_16x16x1_1x32x1x8_8_1x1_intrawave_v1,406.45,1682.81,0.0
gfx950,256,877,6144,1536,ck,0,0,23.8941,a8w8_blockscale_1x128x128_256x128x128x128_16x16_32x32_2x2_8x32x1_8x32x1_1x32x1x8_8_1x1_intrawave_v3,692.76,902.35,0.0
gfx950,256,1790,8192,512,ck,18,0,23.912,a8w8_blockscale_1x128x128_256x64x64x256_16x16_32x32_1x1_16x16x1_16x16x1_1x32x1x8_8_1x1_intrawave_v1,627.95,1440.2,0.0
gfx950,256,5258,128,7168,ck,18,0,23.9228,a8w8_blockscale_1x128x128_256x64x64x256_16x16_32x32_1x1_16x16x1_16x16x1_1x32x1x8_8_1x1_intrawave_v1,403.32,1670.08,0.0
gfx950,256,5540,128,7168,ck,18,0,23.9436,a8w8_blockscale_1x128x128_256x64x64x256_16x16_32x32_1x1_16x16x1_16x16x1_1x32x1x8_8_1x1_intrawave_v1,424.58,1756.06,0.0
gfx950,256,5447,128,7168,ck,18,0,23.9483,a8w8_blockscale_1x128x128_256x64x64x256_16x16_32x32_1x1_16x16x1_16x16x1_1x32x1x8_8_1x1_intrawave_v1,417.37,1726.89,0.0
gfx950,256,1788,8192,512,ck,18,0,23.9509,a8w8_blockscale_1x128x128_256x64x64x256_16x16_32x32_1x1_16x16x1_16x16x1_1x32x1x8_8_1x1_intrawave_v1,626.23,1436.45,0.0
gfx950,256,1767,8192,512,ck,18,0,23.9524,a8w8_blockscale_1x128x128_256x64x64x256_16x16_32x32_1x1_16x16x1_16x16x1_1x32x1x8_8_1x1_intrawave_v1,618.84,1421.55,0.0
gfx950,256,869,6144,1536,ck,0,0,23.9728,a8w8_blockscale_1x128x128_256x128x128x128_16x16_32x32_2x2_8x32x1_8x32x1_1x32x1x8_8_1x1_intrawave_v3,684.18,894.77,0.0
gfx950,256,1755,8192,512,ck,18,0,23.9819,a8w8_blockscale_1x128x128_256x64x64x256_16x16_32x32_1x1_16x16x1_16x16x1_1x32x1x8_8_1x1_intrawave_v1,613.88,1411.35,0.0
gfx950,256,849,6144,1536,ck,0,0,23.9863,a8w8_blockscale_1x128x128_256x128x128x128_16x16_32x32_2x2_8x32x1_8x32x1_1x32x1x8_8_1x1_intrawave_v3,668.06,882.74,0.0
gfx950,256,6001,128,7168,ck,18,0,23.9985,a8w8_blockscale_1x128x128_256x64x64x256_16x16_32x32_1x1_16x16x1_16x16x1_1x32x1x8_8_1x1_intrawave_v1,458.86,1894.66,0.0
gfx950,256,1789,8192,512,ck,18,0,24.0016,a8w8_blockscale_1x128x128_256x64x64x256_16x16_32x32_1x1_16x16x1_16x16x1_1x32x1x8_8_1x1_intrawave_v1,625.26,1434.12,0.0
gfx950,256,1781,8192,512,ck,18,0,24.0285,a8w8_blockscale_1x128x128_256x64x64x256_16x16_32x32_1x1_16x16x1_16x16x1_1x32x1x8_8_1x1_intrawave_v1,621.77,1426.89,0.0
gfx950,256,5670,128,7168,ck,18,0,24.0342,a8w8_blockscale_1x128x128_256x64x64x256_16x16_32x32_1x1_16x16x1_16x16x1_1x32x1x8_8_1x1_intrawave_v1,432.9,1789.6,0.0
gfx950,256,6107,128,7168,ck,18,0,24.0409,a8w8_blockscale_1x128x128_256x64x64x256_16x16_32x32_1x1_16x16x1_16x16x1_1x32x1x8_8_1x1_intrawave_v1,466.14,1924.05,0.0
gfx950,256,6108,128,7168,ck,18,0,24.0632,a8w8_blockscale_1x128x128_256x64x64x256_16x16_32x32_1x1_16x16x1_16x16x1_1x32x1x8_8_1x1_intrawave_v1,465.78,1922.57,0.0
gfx950,256,6008,128,7168,ck,18,0,24.0669,a8w8_blockscale_1x128x128_256x64x64x256_16x16_32x32_1x1_16x16x1_16x16x1_1x32x1x8_8_1x1_intrawave_v1,458.09,1891.43,0.0
gfx950,256,1776,8192,512,ck,18,0,24.072,a8w8_blockscale_1x128x128_256x64x64x256_16x16_32x32_1x1_16x16x1_16x16x1_1x32x1x8_8_1x1_intrawave_v1,618.9,1420.8,0.0
gfx950,256,6026,128,7168,ck,18,0,24.0872,a8w8_blockscale_1x128x128_256x64x64x256_16x16_32x32_1x1_16x16x1_16x16x1_1x32x1x8_8_1x1_intrawave_v1,459.07,1895.39,0.0
gfx950,256,6002,128,7168,ck,18,0,24.0936,a8w8_blockscale_1x128x128_256x64x64x256_16x16_32x32_1x1_16x16x1_16x16x1_1x32x1x8_8_1x1_intrawave_v1,457.12,1887.49,0.0
gfx950,256,5890,128,7168,ck,18,0,24.1144,a8w8_blockscale_1x128x128_256x64x64x256_16x16_32x32_1x1_16x16x1_16x16x1_1x32x1x8_8_1x1_intrawave_v1,448.21,1851.38,0.0
gfx950,256,48,9216,7168,ck,18,0,24.1689,a8w8_blockscale_1x128x128_256x64x64x256_16x16_32x32_1x1_16x16x1_16x16x1_1x32x1x8_8_1x1_intrawave_v1,262.39,2784.12,0.0
gfx950,256,902,6144,1536,ck,0,0,24.1813,a8w8_blockscale_1x128x128_256x128x128x128_16x16_32x32_2x2_8x32x1_8x32x1_1x32x1x8_8_1x1_intrawave_v3,704.04,905.92,0.0
gfx950,256,6225,128,7168,ck,18,0,24.2455,a8w8_blockscale_1x128x128_256x64x64x256_16x16_32x32_1x1_16x16x1_16x16x1_1x32x1x8_8_1x1_intrawave_v1,471.14,1943.94,0.0
gfx950,256,1750,8192,512,ck,18,0,24.2518,a8w8_blockscale_1x128x128_256x64x64x256_16x16_32x32_1x1_16x16x1_16x16x1_1x32x1x8_8_1x1_intrawave_v1,605.32,1392.16,0.0
gfx950,256,910,6144,1536,ck,0,0,24.2772,a8w8_blockscale_1x128x128_256x128x128x128_16x16_32x32_2x2_8x32x1_8x32x1_1x32x1x8_8_1x1_intrawave_v3,707.48,906.9,0.0
gfx950,256,1809,8192,512,ck,18,0,24.2937,a8w8_blockscale_1x128x128_256x64x64x256_16x16_32x32_1x1_16x16x1_16x16x1_1x32x1x8_8_1x1_intrawave_v1,624.65,1430.79,0.0
gfx950,256,6146,128,7168,ck,18,0,24.3019,a8w8_blockscale_1x128x128_256x64x64x256_16x16_32x32_1x1_16x16x1_16x16x1_1x32x1x8_8_1x1_intrawave_v1,464.08,1915.3,0.0
gfx950,256,56,9216,7168,ck,18,0,24.303,a8w8_blockscale_1x128x128_256x64x64x256_16x16_32x32_1x1_16x16x1_16x16x1_1x32x1x8_8_1x1_intrawave_v1,304.44,2777.18,0.0
gfx950,256,920,6144,1536,ck,0,0,24.312,a8w8_blockscale_1x128x128_256x128x128x128_16x16_32x32_2x2_8x32x1_8x32x1_1x32x1x8_8_1x1_intrawave_v3,714.23,911.29,0.0
gfx950,256,6304,128,7168,ck,18,0,24.3201,a8w8_blockscale_1x128x128_256x64x64x256_16x16_32x32_1x1_16x16x1_16x16x1_1x32x1x8_8_1x1_intrawave_v1,475.65,1962.1,0.0
gfx950,256,926,6144,1536,ck,0,0,24.3205,a8w8_blockscale_1x128x128_256x128x128x128_16x16_32x32_2x2_8x32x1_8x32x1_1x32x1x8_8_1x1_intrawave_v3,718.64,914.38,0.0
gfx950,256,1793,8192,512,ck,18,0,24.3211,a8w8_blockscale_1x128x128_256x64x64x256_16x16_32x32_1x1_16x16x1_16x16x1_1x32x1x8_8_1x1_intrawave_v1,618.42,1418.06,0.0
gfx950,256,1841,8192,512,ck,18,0,24.3416,a8w8_blockscale_1x128x128_256x64x64x256_16x16_32x32_1x1_16x16x1_16x16x1_1x32x1x8_8_1x1_intrawave_v1,634.45,1450.19,0.0
gfx950,256,6476,128,7168,ck,18,0,24.3427,a8w8_blockscale_1x128x128_256x64x64x256_16x16_32x32_1x1_16x16x1_16x16x1_1x32x1x8_8_1x1_intrawave_v1,488.18,2012.73,0.0
gfx950,256,6418,128,7168,ck,18,0,24.3579,a8w8_blockscale_1x128x128_256x64x64x256_16x16_32x32_1x1_16x16x1_16x16x1_1x32x1x8_8_1x1_intrawave_v1,483.5,1993.8,0.0
gfx950,256,1851,8192,512,ck,18,0,24.3673,a8w8_blockscale_1x128x128_256x64x64x256_16x16_32x32_1x1_16x16x1_16x16x1_1x32x1x8_8_1x1_intrawave_v1,637.22,1455.59,0.0
gfx950,256,6307,128,7168,ck,18,0,24.3932,a8w8_blockscale_1x128x128_256x64x64x256_16x16_32x32_1x1_16x16x1_16x16x1_1x32x1x8_8_1x1_intrawave_v1,474.45,1957.13,0.0
gfx950,256,6449,128,7168,ck,18,0,24.397,a8w8_blockscale_1x128x128_256x64x64x256_16x16_32x32_1x1_16x16x1_16x16x1_1x32x1x8_8_1x1_intrawave_v1,485.06,2000.04,0.0
gfx950,256,248,7168,4608,ck,18,0,24.3971,a8w8_blockscale_1x128x128_256x64x64x256_16x16_32x32_1x1_16x16x1_16x16x1_1x32x1x8_8_1x1_intrawave_v1,671.51,1546.42,0.0
gfx950,256,962,6144,1536,ck,0,0,24.4257,a8w8_blockscale_1x128x128_256x128x128x128_16x16_32x32_2x2_8x32x1_8x32x1_1x32x1x8_8_1x1_intrawave_v3,743.36,930.82,0.0
gfx950,256,6583,128,7168,ck,18,0,24.4584,a8w8_blockscale_1x128x128_256x64x64x256_16x16_32x32_1x1_16x16x1_16x16x1_1x32x1x8_8_1x1_intrawave_v1,493.89,2035.69,0.0
gfx950,256,1840,8192,512,ck,18,0,24.4841,a8w8_blockscale_1x128x128_256x64x64x256_16x16_32x32_1x1_16x16x1_16x16x1_1x32x1x8_8_1x1_intrawave_v1,630.41,1441.06,0.0
gfx950,256,1833,8192,512,ck,18,0,24.4905,a8w8_blockscale_1x128x128_256x64x64x256_16x16_32x32_1x1_16x16x1_16x16x1_1x32x1x8_8_1x1_intrawave_v1,627.85,1435.85,0.0
gfx950,256,1812,8192,512,ck,18,0,24.4946,a8w8_blockscale_1x128x128_256x64x64x256_16x16_32x32_1x1_16x16x1_16x16x1_1x32x1x8_8_1x1_intrawave_v1,620.55,1421.12,0.0
gfx950,256,930,6144,1536,ck,0,0,24.5334,a8w8_blockscale_1x128x128_256x128x128x128_16x16_32x32_2x2_8x32x1_8x32x1_1x32x1x8_8_1x1_intrawave_v3,715.48,908.7,0.0
gfx950,256,734,8192,1536,ck,0,0,24.538,a8w8_blockscale_1x128x128_256x128x128x128_16x16_32x32_2x2_8x32x1_8x32x1_1x32x1x8_8_1x1_intrawave_v3,752.78,1048.83,0.0
gfx950,256,6811,128,7168,ck,18,0,24.5405,a8w8_blockscale_1x128x128_256x64x64x256_16x16_32x32_1x1_16x16x1_16x16x1_1x32x1x8_8_1x1_intrawave_v1,509.29,2097.85,0.0
gfx950,256,6819,128,7168,ck,18,0,24.5438,a8w8_blockscale_1x128x128_256x64x64x256_16x16_32x32_1x1_16x16x1_16x16x1_1x32x1x8_8_1x1_intrawave_v1,509.82,2099.99,0.0
gfx950,256,6809,128,7168,ck,18,0,24.5549,a8w8_blockscale_1x128x128_256x64x64x256_16x16_32x32_1x1_16x16x1_16x16x1_1x32x1x8_8_1x1_intrawave_v1,508.84,2096.02,0.0
gfx950,256,6812,128,7168,ck,18,0,24.5549,a8w8_blockscale_1x128x128_256x64x64x256_16x16_32x32_1x1_16x16x1_16x16x1_1x32x1x8_8_1x1_intrawave_v1,509.07,2096.93,0.0
gfx950,256,1844,8192,512,ck,18,0,24.5681,a8w8_blockscale_1x128x128_256x64x64x256_16x16_32x32_1x1_16x16x1_16x16x1_1x32x1x8_8_1x1_intrawave_v1,629.62,1438.88,0.0
gfx950,256,7000,128,7168,ck,18,0,24.5745,a8w8_blockscale_1x128x128_256x64x64x256_16x16_32x32_1x1_16x16x1_16x16x1_1x32x1x8_8_1x1_intrawave_v1,522.7,2152.05,0.0
gfx950,256,1001,6144,1536,ck,0,0,24.582,a8w8_blockscale_1x128x128_256x128x128x128_16x16_32x32_2x2_8x32x1_8x32x1_1x32x1x8_8_1x1_intrawave_v3,768.58,946.83,0.0
gfx950,256,6815,128,7168,ck,18,0,24.5935,a8w8_blockscale_1x128x128_256x64x64x256_16x16_32x32_1x1_16x16x1_16x16x1_1x32x1x8_8_1x1_intrawave_v1,508.49,2094.54,0.0
gfx950,256,6817,128,7168,ck,18,0,24.5958,a8w8_blockscale_1x128x128_256x64x64x256_16x16_32x32_1x1_16x16x1_16x16x1_1x32x1x8_8_1x1_intrawave_v1,508.59,2094.95,0.0
gfx950,256,1015,6144,1536,ck,0,0,24.6,a8w8_blockscale_1x128x128_256x128x128x128_16x16_32x32_2x2_8x32x1_8x32x1_1x32x1x8_8_1x1_intrawave_v3,778.76,954.01,0.0
gfx950,256,1828,8192,512,ck,18,0,24.6146,a8w8_blockscale_1x128x128_256x64x64x256_16x16_32x32_1x1_16x16x1_16x16x1_1x32x1x8_8_1x1_intrawave_v1,622.98,1425.18,0.0
gfx950,256,6818,128,7168,ck,18,0,24.6216,a8w8_blockscale_1x128x128_256x64x64x256_16x16_32x32_1x1_16x16x1_16x16x1_1x32x1x8_8_1x1_intrawave_v1,508.13,2093.05,0.0
gfx950,256,1849,8192,512,ck,18,0,24.6227,a8w8_blockscale_1x128x128_256x64x64x256_16x16_32x32_1x1_16x16x1_16x16x1_1x32x1x8_8_1x1_intrawave_v1,629.93,1439.12,0.0
gfx950,256,1007,6144,1536,ck,0,0,24.6275,a8w8_blockscale_1x128x128_256x128x128x128_16x16_32x32_2x2_8x32x1_8x32x1_1x32x1x8_8_1x1_intrawave_v3,771.76,948.45,0.0
gfx950,256,7001,128,7168,ck,18,0,24.6311,a8w8_blockscale_1x128x128_256x64x64x256_16x16_32x32_1x1_16x16x1_16x16x1_1x32x1x8_8_1x1_intrawave_v1,521.57,2147.4,0.0
gfx950,256,1814,8192,512,ck,18,0,24.6328,a8w8_blockscale_1x128x128_256x64x64x256_16x16_32x32_1x1_16x16x1_16x16x1_1x32x1x8_8_1x1_intrawave_v1,617.75,1414.52,0.0
gfx950,256,6813,128,7168,ck,18,0,24.6366,a8w8_blockscale_1x128x128_256x64x64x256_16x16_32x32_1x1_16x16x1_16x16x1_1x32x1x8_8_1x1_intrawave_v1,507.45,2090.27,0.0
gfx950,256,1000,6144,1536,ck,0,0,24.6384,a8w8_blockscale_1x128x128_256x128x128x128_16x16_32x32_2x2_8x32x1_8x32x1_1x32x1x8_8_1x1_intrawave_v3,766.05,944.1,0.0
gfx950,256,1009,6144,1536,ck,0,0,24.6439,a8w8_blockscale_1x128x128_256x128x128x128_16x16_32x32_2x2_8x32x1_8x32x1_1x32x1x8_8_1x1_intrawave_v3,772.78,948.94,0.0
gfx950,256,6814,128,7168,ck,18,0,24.6467,a8w8_blockscale_1x128x128_256x64x64x256_16x16_32x32_1x1_16x16x1_16x16x1_1x32x1x8_8_1x1_intrawave_v1,507.32,2089.72,0.0
gfx950,256,1797,8192,512,ck,18,0,24.6622,a8w8_blockscale_1x128x128_256x64x64x256_16x16_32x32_1x1_16x16x1_16x16x1_1x32x1x8_8_1x1_intrawave_v1,611.23,1401.19,0.0
gfx950,256,1813,8192,512,ck,18,0,24.6699,a8w8_blockscale_1x128x128_256x64x64x256_16x16_32x32_1x1_16x16x1_16x16x1_1x32x1x8_8_1x1_intrawave_v1,616.48,1411.71,0.0
gfx950,256,7289,128,7168,ck,18,0,24.707,a8w8_blockscale_1x128x128_256x64x64x256_16x16_32x32_1x1_16x16x1_16x16x1_1x32x1x8_8_1x1_intrawave_v1,541.36,2227.35,0.0
gfx950,256,1023,6144,1536,ck,0,0,24.7104,a8w8_blockscale_1x128x128_256x128x128x128_16x16_32x32_2x2_8x32x1_8x32x1_1x32x1x8_8_1x1_intrawave_v3,781.39,954.22,0.0
gfx950,256,1040,6144,1536,ck,0,0,24.7107,a8w8_blockscale_1x128x128_256x128x128x128_16x16_32x32_2x2_8x32x1_8x32x1_1x32x1x8_8_1x1_intrawave_v3,794.37,963.72,0.0
gfx950,256,1799,8192,512,ck,18,0,24.7215,a8w8_blockscale_1x128x128_256x64x64x256_16x16_32x32_1x1_16x16x1_16x16x1_1x32x1x8_8_1x1_intrawave_v1,610.44,1399.2,0.0
gfx950,256,7440,128,7168,ck,18,0,24.7219,a8w8_blockscale_1x128x128_256x64x64x256_16x16_32x32_1x1_16x16x1_16x16x1_1x32x1x8_8_1x1_intrawave_v1,552.24,2271.35,0.0
gfx950,256,1798,8192,512,ck,18,0,24.7268,a8w8_blockscale_1x128x128_256x64x64x256_16x16_32x32_1x1_16x16x1_16x16x1_1x32x1x8_8_1x1_intrawave_v1,609.97,1398.21,0.0
gfx950,256,1054,6144,1536,ck,0,0,24.7563,a8w8_blockscale_1x128x128_256x128x128x128_16x16_32x32_2x2_8x32x1_8x32x1_1x32x1x8_8_1x1_intrawave_v3,803.58,969.76,0.0
gfx950,256,1063,6144,1536,ck,0,0,24.7596,a8w8_blockscale_1x128x128_256x128x128x128_16x16_32x32_2x2_8x32x1_8x32x1_1x32x1x8_8_1x1_intrawave_v3,810.33,974.66,0.0
gfx950,256,7009,128,7168,ck,18,0,24.787,a8w8_blockscale_1x128x128_256x64x64x256_16x16_32x32_1x1_16x16x1_16x16x1_1x32x1x8_8_1x1_intrawave_v1,518.88,2136.29,0.0
gfx950,256,1003,6144,1536,ck,0,0,24.7954,a8w8_blockscale_1x128x128_256x128x128x128_16x16_32x32_2x2_8x32x1_8x32x1_1x32x1x8_8_1x1_intrawave_v3,763.49,939.8,0.0
gfx950,256,7050,128,7168,ck,18,0,24.8062,a8w8_blockscale_1x128x128_256x64x64x256_16x16_32x32_1x1_16x16x1_16x16x1_1x32x1x8_8_1x1_intrawave_v1,521.52,2146.91,0.0
gfx950,256,1802,8192,512,ck,18,0,24.8244,a8w8_blockscale_1x128x128_256x64x64x256_16x16_32x32_1x1_16x16x1_16x16x1_1x32x1x8_8_1x1_intrawave_v1,608.93,1395.44,0.0
gfx950,256,7238,128,7168,ck,18,0,24.8556,a8w8_blockscale_1x128x128_256x64x64x256_16x16_32x32_1x1_16x16x1_16x16x1_1x32x1x8_8_1x1_intrawave_v1,534.36,2198.8,0.0
gfx950,256,814,8192,1536,ck,0,0,24.8628,a8w8_blockscale_1x128x128_256x128x128x128_16x16_32x32_2x2_8x32x1_8x32x1_1x32x1x8_8_1x1_intrawave_v3,823.92,1092.79,0.0
gfx950,256,1808,8192,512,ck,18,0,24.8792,a8w8_blockscale_1x128x128_256x64x64x256_16x16_32x32_1x1_16x16x1_16x16x1_1x32x1x8_8_1x1_intrawave_v1,609.61,1396.44,0.0
gfx950,256,7539,128,7168,ck,18,0,24.8897,a8w8_blockscale_1x128x128_256x64x64x256_16x16_32x32_1x1_16x16x1_16x16x1_1x32x1x8_8_1x1_intrawave_v1,555.82,2285.57,0.0
gfx950,256,7242,128,7168,ck,18,0,24.8907,a8w8_blockscale_1x128x128_256x64x64x256_16x16_32x32_1x1_16x16x1_16x16x1_1x32x1x8_8_1x1_intrawave_v1,533.9,2196.89,0.0
gfx950,256,7241,128,7168,ck,18,0,24.921,a8w8_blockscale_1x128x128_256x64x64x256_16x16_32x32_1x1_16x16x1_16x16x1_1x32x1x8_8_1x1_intrawave_v1,533.18,2193.92,0.0
gfx950,256,1805,8192,512,ck,18,0,24.9468,a8w8_blockscale_1x128x128_256x64x64x256_16x16_32x32_1x1_16x16x1_16x16x1_1x32x1x8_8_1x1_intrawave_v1,606.95,1390.62,0.0
gfx950,256,1047,6144,1536,ck,0,0,24.9472,a8w8_blockscale_1x128x128_256x128x128x128_16x16_32x32_2x2_8x32x1_8x32x1_1x32x1x8_8_1x1_intrawave_v3,792.13,958.46,0.0
gfx950,256,1839,8192,512,ck,18,0,24.9624,a8w8_blockscale_1x128x128_256x64x64x256_16x16_32x32_1x1_16x16x1_16x16x1_1x32x1x8_8_1x1_intrawave_v1,618.0,1412.77,0.0
gfx950,256,1087,6144,1536,ck,0,0,24.9744,a8w8_blockscale_1x128x128_256x128x128x128_16x16_32x32_2x2_8x32x1_8x32x1_1x32x1x8_8_1x1_intrawave_v3,821.5,979.56,0.0
gfx950,256,1855,8192,512,ck,18,0,24.9792,a8w8_blockscale_1x128x128_256x64x64x256_16x16_32x32_1x1_16x16x1_16x16x1_1x32x1x8_8_1x1_intrawave_v1,622.95,1422.64,0.0
gfx950,256,7536,128,7168,ck,18,0,24.9917,a8w8_blockscale_1x128x128_256x64x64x256_16x16_32x32_1x1_16x16x1_16x16x1_1x32x1x8_8_1x1_intrawave_v1,553.33,2275.35,0.0
gfx950,256,1848,8192,512,ck,18,0,24.9967,a8w8_blockscale_1x128x128_256x64x64x256_16x16_32x32_1x1_16x16x1_16x16x1_1x32x1x8_8_1x1_intrawave_v1,620.17,1416.91,0.0
gfx950,256,7656,128,7168,ck,18,0,24.9972,a8w8_blockscale_1x128x128_256x64x64x256_16x16_32x32_1x1_16x16x1_16x16x1_1x32x1x8_8_1x1_intrawave_v1,562.02,2310.48,0.0
gfx950,256,1837,8192,512,ck,18,0,25.0132,a8w8_blockscale_1x128x128_256x64x64x256_16x16_32x32_1x1_16x16x1_16x16x1_1x32x1x8_8_1x1_intrawave_v1,616.07,1408.55,0.0
gfx950,256,7990,128,7168,ck,18,0,25.0458,a8w8_blockscale_1x128x128_256x64x64x256_16x16_32x32_1x1_16x16x1_16x16x1_1x32x1x8_8_1x1_intrawave_v1,585.4,2405.0,0.0
gfx950,256,806,8192,1536,ck,0,0,25.0472,a8w8_blockscale_1x128x128_256x128x128x128_16x16_32x32_2x2_8x32x1_8x32x1_1x32x1x8_8_1x1_intrawave_v3,809.82,1079.02,0.0
gfx950,256,8001,128,7168,ck,18,0,25.0547,a8w8_blockscale_1x128x128_256x64x64x256_16x16_32x32_1x1_16x16x1_16x16x1_1x32x1x8_8_1x1_intrawave_v1,585.99,2407.41,0.0
gfx950,256,813,8192,1536,ck,0,0,25.0603,a8w8_blockscale_1x128x128_256x128x128x128_16x16_32x32_2x2_8x32x1_8x32x1_1x32x1x8_8_1x1_intrawave_v3,816.42,1083.46,0.0
gfx950,256,8051,128,7168,ck,18,0,25.0608,a8w8_blockscale_1x128x128_256x64x64x256_16x16_32x32_1x1_16x16x1_16x16x1_1x32x1x8_8_1x1_intrawave_v1,589.51,2421.64,0.0
gfx950,256,1881,8192,512,ck,18,0,25.0692,a8w8_blockscale_1x128x128_256x64x64x256_16x16_32x32_1x1_16x16x1_16x16x1_1x32x1x8_8_1x1_intrawave_v1,629.42,1435.05,0.0
gfx950,256,1807,8192,512,ck,18,0,25.0965,a8w8_blockscale_1x128x128_256x64x64x256_16x16_32x32_1x1_16x16x1_16x16x1_1x32x1x8_8_1x1_intrawave_v1,604.0,1383.67,0.0
gfx950,256,1918,8192,512,ck,18,0,25.1018,a8w8_blockscale_1x128x128_256x64x64x256_16x16_32x32_1x1_16x16x1_16x16x1_1x32x1x8_8_1x1_intrawave_v1,640.96,1458.1,0.0
gfx950,256,1868,8192,512,ck,18,0,25.1073,a8w8_blockscale_1x128x128_256x64x64x256_16x16_32x32_1x1_16x16x1_16x16x1_1x32x1x8_8_1x1_intrawave_v1,624.12,1424.13,0.0
gfx950,256,8007,128,7168,ck,18,0,25.1141,a8w8_blockscale_1x128x128_256x64x64x256_16x16_32x32_1x1_16x16x1_16x16x1_1x32x1x8_8_1x1_intrawave_v1,585.05,2403.49,0.0
gfx950,256,1903,8192,512,ck,18,0,25.1142,a8w8_blockscale_1x128x128_256x64x64x256_16x16_32x32_1x1_16x16x1_16x16x1_1x32x1x8_8_1x1_intrawave_v1,635.64,1447.28,0.0
gfx950,256,8008,128,7168,ck,18,0,25.1145,a8w8_blockscale_1x128x128_256x64x64x256_16x16_32x32_1x1_16x16x1_16x16x1_1x32x1x8_8_1x1_intrawave_v1,585.11,2403.75,0.0
gfx950,256,1836,8192,512,ck,18,0,25.1184,a8w8_blockscale_1x128x128_256x64x64x256_16x16_32x32_1x1_16x16x1_16x16x1_1x32x1x8_8_1x1_intrawave_v1,613.16,1401.97,0.0
gfx950,256,8047,128,7168,ck,18,0,25.1219,a8w8_blockscale_1x128x128_256x64x64x256_16x16_32x32_1x1_16x16x1_16x16x1_1x32x1x8_8_1x1_intrawave_v1,587.79,2414.56,0.0
gfx950,256,1891,8192,512,ck,18,0,25.1409,a8w8_blockscale_1x128x128_256x64x64x256_16x16_32x32_1x1_16x16x1_16x16x1_1x32x1x8_8_1x1_intrawave_v1,630.96,1437.68,0.0
gfx950,256,8010,128,7168,ck,18,0,25.1431,a8w8_blockscale_1x128x128_256x64x64x256_16x16_32x32_1x1_16x16x1_16x16x1_1x32x1x8_8_1x1_intrawave_v1,584.59,2401.6,0.0
gfx950,256,7871,128,7168,ck,18,0,25.1434,a8w8_blockscale_1x128x128_256x64x64x256_16x16_32x32_1x1_16x16x1_16x16x1_1x32x1x8_8_1x1_intrawave_v1,574.44,2360.53,0.0
gfx950,256,1888,8192,512,ck,18,0,25.1439,a8w8_blockscale_1x128x128_256x64x64x256_16x16_32x32_1x1_16x16x1_16x16x1_1x32x1x8_8_1x1_intrawave_v1,629.88,1435.5,0.0
gfx950,256,1871,8192,512,ck,18,0,25.1466,a8w8_blockscale_1x128x128_256x64x64x256_16x16_32x32_1x1_16x16x1_16x16x1_1x32x1x8_8_1x1_intrawave_v1,624.14,1423.92,0.0
gfx950,256,1144,6144,1536,ck,0,0,25.1482,a8w8_blockscale_1x128x128_256x128x128x128_16x16_32x32_2x2_8x32x1_8x32x1_1x32x1x8_8_1x1_intrawave_v3,858.6,1004.12,0.0
gfx950,256,1870,8192,512,ck,18,0,25.1692,a8w8_blockscale_1x128x128_256x64x64x256_16x16_32x32_1x1_16x16x1_16x16x1_1x32x1x8_8_1x1_intrawave_v1,623.25,1421.97,0.0
gfx950,256,1860,8192,512,ck,18,0,25.1716,a8w8_blockscale_1x128x128_256x64x64x256_16x16_32x32_1x1_16x16x1_16x16x1_1x32x1x8_8_1x1_intrawave_v1,619.86,1415.12,0.0
gfx950,256,830,8192,1536,ck,0,0,25.1735,a8w8_blockscale_1x128x128_256x128x128x128_16x16_32x32_2x2_8x32x1_8x32x1_1x32x1x8_8_1x1_intrawave_v3,829.75,1090.69,0.0
gfx950,256,8015,128,7168,ck,18,0,25.1786,a8w8_blockscale_1x128x128_256x64x64x256_16x16_32x32_1x1_16x16x1_16x16x1_1x32x1x8_8_1x1_intrawave_v1,584.13,2399.69,0.0
gfx950,256,8182,128,7168,ck,18,0,25.204,a8w8_blockscale_1x128x128_256x64x64x256_16x16_32x32_1x1_16x16x1_16x16x1_1x32x1x8_8_1x1_intrawave_v1,595.7,2446.46,0.0
gfx950,256,1794,8192,512,ck,18,0,25.2156,a8w8_blockscale_1x128x128_256x64x64x256_16x16_32x32_1x1_16x16x1_16x16x1_1x32x1x8_8_1x1_intrawave_v1,596.82,1368.43,0.0
gfx950,256,8043,128,7168,ck,18,0,25.2255,a8w8_blockscale_1x128x128_256x64x64x256_16x16_32x32_1x1_16x16x1_16x16x1_1x32x1x8_8_1x1_intrawave_v1,585.08,2403.47,0.0
gfx950,256,8018,128,7168,ck,18,0,25.2267,a8w8_blockscale_1x128x128_256x64x64x256_16x16_32x32_1x1_16x16x1_16x16x1_1x32x1x8_8_1x1_intrawave_v1,583.23,2396.0,0.0
gfx950,256,1867,8192,512,ck,18,0,25.2305,a8w8_blockscale_1x128x128_256x64x64x256_16x16_32x32_1x1_16x16x1_16x16x1_1x32x1x8_8_1x1_intrawave_v1,620.74,1416.51,0.0
gfx950,256,7809,128,7168,ck,18,0,25.2328,a8w8_blockscale_1x128x128_256x64x64x256_16x16_32x32_1x1_16x16x1_16x16x1_1x32x1x8_8_1x1_intrawave_v1,567.89,2333.93,0.0
gfx950,256,869,8192,1536,ck,0,0,25.2446,a8w8_blockscale_1x128x128_256x128x128x128_16x16_32x32_2x2_8x32x1_8x32x1_1x32x1x8_8_1x1_intrawave_v3,866.29,1115.3,0.0
gfx950,256,1112,6144,1536,ck,0,0,25.2458,a8w8_blockscale_1x128x128_256x128x128x128_16x16_32x32_2x2_8x32x1_8x32x1_1x32x1x8_8_1x1_intrawave_v3,831.36,982.72,0.0
gfx950,256,809,8192,1536,ck,0,0,25.2509,a8w8_blockscale_1x128x128_256x128x128x128_16x16_32x32_2x2_8x32x1_8x32x1_1x32x1x8_8_1x1_intrawave_v3,806.27,1072.44,0.0
gfx950,256,8090,128,7168,ck,18,0,25.2774,a8w8_blockscale_1x128x128_256x64x64x256_16x16_32x32_1x1_16x16x1_16x16x1_1x32x1x8_8_1x1_intrawave_v1,587.29,2412.34,0.0
gfx950,256,1132,6144,1536,ck,0,0,25.2813,a8w8_blockscale_1x128x128_256x128x128x128_16x16_32x32_2x2_8x32x1_8x32x1_1x32x1x8_8_1x1_intrawave_v3,845.12,992.27,0.0
gfx950,256,1856,8192,512,ck,18,0,25.291,a8w8_blockscale_1x128x128_256x64x64x256_16x16_32x32_1x1_16x16x1_16x16x1_1x32x1x8_8_1x1_intrawave_v1,615.6,1405.77,0.0
gfx950,256,856,8192,1536,ck,0,0,25.2956,a8w8_blockscale_1x128x128_256x128x128x128_16x16_32x32_2x2_8x32x1_8x32x1_1x32x1x8_8_1x1_intrawave_v3,851.61,1103.85,0.0
gfx950,256,1910,8192,512,ck,18,0,25.3294,a8w8_blockscale_1x128x128_256x64x64x256_16x16_32x32_1x1_16x16x1_16x16x1_1x32x1x8_8_1x1_intrawave_v1,632.56,1439.66,0.0
gfx950,256,8048,128,7168,ck,18,0,25.3323,a8w8_blockscale_1x128x128_256x64x64x256_16x16_32x32_1x1_16x16x1_16x16x1_1x32x1x8_8_1x1_intrawave_v1,582.98,2394.8,0.0
gfx950,256,849,8192,1536,ck,0,0,25.334,a8w8_blockscale_1x128x128_256x128x128x128_16x16_32x32_2x2_8x32x1_8x32x1_1x32x1x8_8_1x1_intrawave_v3,843.36,1097.22,0.0
gfx950,256,1899,8192,512,ck,18,0,25.3552,a8w8_blockscale_1x128x128_256x64x64x256_16x16_32x32_1x1_16x16x1_16x16x1_1x32x1x8_8_1x1_intrawave_v1,628.27,1430.86,0.0
gfx950,256,8040,128,7168,ck,18,0,25.3597,a8w8_blockscale_1x128x128_256x64x64x256_16x16_32x32_1x1_16x16x1_16x16x1_1x32x1x8_8_1x1_intrawave_v1,581.77,2389.87,0.0
gfx950,256,1885,8192,512,ck,18,0,25.3629,a8w8_blockscale_1x128x128_256x64x64x256_16x16_32x32_1x1_16x16x1_16x16x1_1x32x1x8_8_1x1_intrawave_v1,623.45,1421.1,0.0
gfx950,256,1024,6144,1536,ck,2,0,25.3633,a8w8_blockscale_1x128x128_256x64x128x128_16x16_32x32_1x2_8x32x1_8x32x1_1x32x1x8_8_1x1_intrawave_v3,762.02,930.2,0.0
gfx950,256,1863,8192,512,ck,18,0,25.3657,a8w8_blockscale_1x128x128_256x64x64x256_16x16_32x32_1x1_16x16x1_16x16x1_1x32x1x8_8_1x1_intrawave_v1,616.11,1406.29,0.0
gfx950,256,1898,8192,512,ck,18,0,25.4804,a8w8_blockscale_1x128x128_256x64x64x256_16x16_32x32_1x1_16x16x1_16x16x1_1x32x1x8_8_1x1_intrawave_v1,624.86,1423.17,0.0
gfx950,256,1878,8192,512,ck,18,0,25.4913,a8w8_blockscale_1x128x128_256x64x64x256_16x16_32x32_1x1_16x16x1_16x16x1_1x32x1x8_8_1x1_intrawave_v1,618.01,1409.3,0.0
gfx950,256,1861,8192,512,ck,18,0,25.4954,a8w8_blockscale_1x128x128_256x64x64x256_16x16_32x32_1x1_16x16x1_16x16x1_1x32x1x8_8_1x1_intrawave_v1,612.31,1397.81,0.0
gfx950,256,1895,8192,512,ck,18,0,25.5015,a8w8_blockscale_1x128x128_256x64x64x256_16x16_32x32_1x1_16x16x1_16x16x1_1x32x1x8_8_1x1_intrawave_v1,623.35,1420.0,0.0
gfx950,256,1889,8192,512,ck,18,0,25.5087,a8w8_blockscale_1x128x128_256x64x64x256_16x16_32x32_1x1_16x16x1_16x16x1_1x32x1x8_8_1x1_intrawave_v1,621.2,1415.63,0.0
gfx950,256,1858,8192,512,ck,18,0,25.5315,a8w8_blockscale_1x128x128_256x64x64x256_16x16_32x32_1x1_16x16x1_16x16x1_1x32x1x8_8_1x1_intrawave_v1,610.46,1393.85,0.0
gfx950,256,1920,8192,512,ck,0,0,25.5316,a8w8_blockscale_1x128x128_256x128x128x128_16x16_32x32_2x2_8x32x1_8x32x1_1x32x1x8_8_1x1_intrawave_v3,630.83,1434.87,0.0
gfx950,256,1900,8192,512,ck,18,0,25.5472,a8w8_blockscale_1x128x128_256x64x64x256_16x16_32x32_1x1_16x16x1_16x16x1_1x32x1x8_8_1x1_intrawave_v1,623.88,1420.77,0.0
gfx950,256,877,8192,1536,ck,0,0,25.5813,a8w8_blockscale_1x128x128_256x128x128x128_16x16_32x32_2x2_8x32x1_8x32x1_1x32x1x8_8_1x1_intrawave_v3,862.76,1106.23,0.0
gfx950,256,1912,8192,512,ck,18,0,25.5972,a8w8_blockscale_1x128x128_256x64x64x256_16x16_32x32_1x1_16x16x1_16x16x1_1x32x1x8_8_1x1_intrawave_v1,626.59,1425.92,0.0
gfx950,256,1185,6144,1536,ck,0,0,25.5997,a8w8_blockscale_1x128x128_256x128x128x128_16x16_32x32_2x2_8x32x1_8x32x1_1x32x1x8_8_1x1_intrawave_v3,873.69,1008.55,0.0
gfx950,256,1265,6144,1536,ck,0,0,25.6036,a8w8_blockscale_1x128x128_256x128x128x128_16x16_32x32_2x2_8x32x1_8x32x1_1x32x1x8_8_1x1_intrawave_v3,932.53,1051.59,0.0
gfx950,256,1218,6144,1536,ck,0,0,25.6067,a8w8_blockscale_1x128x128_256x128x128x128_16x16_32x32_2x2_8x32x1_8x32x1_1x32x1x8_8_1x1_intrawave_v3,897.77,1026.09,0.0
gfx950,256,1908,8192,512,ck,18,0,25.6228,a8w8_blockscale_1x128x128_256x64x64x256_16x16_32x32_1x1_16x16x1_16x16x1_1x32x1x8_8_1x1_intrawave_v1,624.66,1421.85,0.0
gfx950,256,1896,8192,512,ck,0,0,25.6964,a8w8_blockscale_1x128x128_256x128x128x128_16x16_32x32_2x2_8x32x1_8x32x1_1x32x1x8_8_1x1_intrawave_v3,618.95,1409.89,0.0
gfx950,256,1901,8192,512,ck,18,0,25.6968,a8w8_blockscale_1x128x128_256x64x64x256_16x16_32x32_1x1_16x16x1_16x16x1_1x32x1x8_8_1x1_intrawave_v1,620.57,1413.16,0.0
gfx950,256,1255,6144,1536,ck,0,0,25.7008,a8w8_blockscale_1x128x128_256x128x128x128_16x16_32x32_2x2_8x32x1_8x32x1_1x32x1x8_8_1x1_intrawave_v3,921.66,1042.24,0.0
gfx950,256,72,9216,7168,ck,12,0,25.8224,a8w8_blockscale_1x128x128_256x32x128x256_16x16_32x32_1x1_16x16x1_16x16x1_1x32x1x8_8_1x1_intrawave_v1,368.39,2629.64,0.0
gfx950,256,1270,6144,1536,ck,0,0,25.8804,a8w8_blockscale_1x128x128_256x128x128x128_16x16_32x32_2x2_8x32x1_8x32x1_1x32x1x8_8_1x1_intrawave_v3,926.2,1043.02,0.0
gfx950,256,902,8192,1536,ck,0,0,25.8899,a8w8_blockscale_1x128x128_256x128x128x128_16x16_32x32_2x2_8x32x1_8x32x1_1x32x1x8_8_1x1_intrawave_v3,876.77,1110.35,0.0
gfx950,256,80,9216,7168,ck,12,0,25.913,a8w8_blockscale_1x128x128_256x32x128x256_16x16_32x32_1x1_16x16x1_16x16x1_1x32x1x8_8_1x1_intrawave_v1,407.89,2628.34,0.0
gfx950,256,1946,8192,512,ck,18,0,25.9824,a8w8_blockscale_1x128x128_256x64x64x256_16x16_32x32_1x1_16x16x1_16x16x1_1x32x1x8_8_1x1_intrawave_v1,628.28,1426.89,0.0
gfx950,256,930,8192,1536,ck,0,0,26.0915,a8w8_blockscale_1x128x128_256x128x128x128_16x16_32x32_2x2_8x32x1_8x32x1_1x32x1x8_8_1x1_intrawave_v3,897.01,1121.0,0.0
gfx950,256,88,9216,7168,ck,12,0,26.1576,a8w8_blockscale_1x128x128_256x32x128x256_16x16_32x32_1x1_16x16x1_16x16x1_1x32x1x8_8_1x1_intrawave_v1,444.48,2611.6,0.0
gfx950,256,920,8192,1536,ck,0,0,26.1625,a8w8_blockscale_1x128x128_256x128x128x128_16x16_32x32_2x2_8x32x1_8x32x1_1x32x1x8_8_1x1_intrawave_v3,884.95,1111.11,0.0
gfx950,256,1000,8192,1536,ck,0,0,26.178,a8w8_blockscale_1x128x128_256x128x128x128_16x16_32x32_2x2_8x32x1_8x32x1_1x32x1x8_8_1x1_intrawave_v3,961.33,1165.21,0.0
gfx950,256,910,8192,1536,ck,0,0,26.2249,a8w8_blockscale_1x128x128_256x128x128x128_16x16_32x32_2x2_8x32x1_8x32x1_1x32x1x8_8_1x1_intrawave_v3,873.25,1101.63,0.0
gfx950,256,1940,8192,512,ck,18,0,26.2332,a8w8_blockscale_1x128x128_256x64x64x256_16x16_32x32_1x1_16x16x1_16x16x1_1x32x1x8_8_1x1_intrawave_v1,620.36,1409.38,0.0
gfx950,256,1928,8192,512,ck,18,0,26.2582,a8w8_blockscale_1x128x128_256x64x64x256_16x16_32x32_1x1_16x16x1_16x16x1_1x32x1x8_8_1x1_intrawave_v1,615.93,1400.32,0.0
gfx950,256,1932,8192,512,ck,18,0,26.2813,a8w8_blockscale_1x128x128_256x64x64x256_16x16_32x32_1x1_16x16x1_16x16x1_1x32x1x8_8_1x1_intrawave_v1,616.67,1401.66,0.0
gfx950,256,1001,8192,1536,ck,0,0,26.3135,a8w8_blockscale_1x128x128_256x128x128x128_16x16_32x32_2x2_8x32x1_8x32x1_1x32x1x8_8_1x1_intrawave_v3,957.34,1159.89,0.0
gfx950,256,1923,8192,512,ck,0,0,26.3336,a8w8_blockscale_1x128x128_256x128x128x128_16x16_32x32_2x2_8x32x1_8x32x1_1x32x1x8_8_1x1_intrawave_v3,612.57,1393.1,0.0
gfx950,256,1933,8192,512,ck,0,0,26.3337,a8w8_blockscale_1x128x128_256x128x128x128_16x16_32x32_2x2_8x32x1_8x32x1_1x32x1x8_8_1x1_intrawave_v3,615.76,1399.51,0.0
gfx950,256,1007,8192,1536,ck,0,0,26.341,a8w8_blockscale_1x128x128_256x128x128x128_16x16_32x32_2x2_8x32x1_8x32x1_1x32x1x8_8_1x1_intrawave_v3,962.07,1162.76,0.0
gfx950,256,1925,8192,512,ck,0,0,26.3441,a8w8_blockscale_1x128x128_256x128x128x128_16x16_32x32_2x2_8x32x1_8x32x1_1x32x1x8_8_1x1_intrawave_v3,612.97,1393.83,0.0
gfx950,256,1009,8192,1536,ck,0,0,26.3527,a8w8_blockscale_1x128x128_256x128x128x128_16x16_32x32_2x2_8x32x1_8x32x1_1x32x1x8_8_1x1_intrawave_v3,963.56,1163.61,0.0
gfx950,256,1926,8192,512,ck,0,0,26.373,a8w8_blockscale_1x128x128_256x128x128x128_16x16_32x32_2x2_8x32x1_8x32x1_1x32x1x8_8_1x1_intrawave_v3,612.61,1392.94,0.0
gfx950,256,1015,8192,1536,ck,0,0,26.3778,a8w8_blockscale_1x128x128_256x128x128x128_16x16_32x32_2x2_8x32x1_8x32x1_1x32x1x8_8_1x1_intrawave_v3,968.36,1166.58,0.0
gfx950,256,1944,8192,512,ck,18,0,26.3819,a8w8_blockscale_1x128x128_256x64x64x256_16x16_32x32_1x1_16x16x1_16x16x1_1x32x1x8_8_1x1_intrawave_v1,618.13,1404.0,0.0
gfx950,256,1968,8192,512,ck,18,0,26.3948,a8w8_blockscale_1x128x128_256x64x64x256_16x16_32x32_1x1_16x16x1_16x16x1_1x32x1x8_8_1x1_intrawave_v1,625.46,1418.67,0.0
gfx950,256,1951,8192,512,ck,18,0,26.3956,a8w8_blockscale_1x128x128_256x64x64x256_16x16_32x32_1x1_16x16x1_16x16x1_1x32x1x8_8_1x1_intrawave_v1,620.03,1407.75,0.0
gfx950,256,1003,8192,1536,ck,0,0,26.403,a8w8_blockscale_1x128x128_256x128x128x128_16x16_32x32_2x2_8x32x1_8x32x1_1x32x1x8_8_1x1_intrawave_v3,956.0,1157.32,0.0
gfx950,256,1945,8192,512,ck,18,0,26.4092,a8w8_blockscale_1x128x128_256x64x64x256_16x16_32x32_1x1_16x16x1_16x16x1_1x32x1x8_8_1x1_intrawave_v1,617.81,1403.19,0.0
gfx950,256,1938,8192,512,ck,0,0,26.4252,a8w8_blockscale_1x128x128_256x128x128x128_16x16_32x32_2x2_8x32x1_8x32x1_1x32x1x8_8_1x1_intrawave_v3,615.21,1397.86,0.0
gfx950,256,1935,8192,512,ck,18,0,26.4271,a8w8_blockscale_1x128x128_256x64x64x256_16x16_32x32_1x1_16x16x1_16x16x1_1x32x1x8_8_1x1_intrawave_v1,614.22,1395.84,0.0
gfx950,256,1964,8192,512,ck,18,0,26.4283,a8w8_blockscale_1x128x128_256x64x64x256_16x16_32x32_1x1_16x16x1_16x16x1_1x32x1x8_8_1x1_intrawave_v1,623.39,1414.32,0.0
gfx950,256,1958,8192,512,ck,0,0,26.4384,a8w8_blockscale_1x128x128_256x128x128x128_16x16_32x32_2x2_8x32x1_8x32x1_1x32x1x8_8_1x1_intrawave_v3,621.25,1409.94,0.0
gfx950,256,1937,8192,512,ck,18,0,26.45,a8w8_blockscale_1x128x128_256x64x64x256_16x16_32x32_1x1_16x16x1_16x16x1_1x32x1x8_8_1x1_intrawave_v1,614.32,1395.91,0.0
gfx950,256,1927,8192,512,ck,18,0,26.4711,a8w8_blockscale_1x128x128_256x64x64x256_16x16_32x32_1x1_16x16x1_16x16x1_1x32x1x8_8_1x1_intrawave_v1,610.66,1388.42,0.0
gfx950,256,1967,8192,512,ck,0,0,26.4776,a8w8_blockscale_1x128x128_256x128x128x128_16x16_32x32_2x2_8x32x1_8x32x1_1x32x1x8_8_1x1_intrawave_v3,623.18,1413.6,0.0
gfx950,256,1965,8192,512,ck,0,0,26.4814,a8w8_blockscale_1x128x128_256x128x128x128_16x16_32x32_2x2_8x32x1_8x32x1_1x32x1x8_8_1x1_intrawave_v3,622.46,1412.12,0.0
gfx950,256,1956,8192,512,ck,18,0,26.49,a8w8_blockscale_1x128x128_256x64x64x256_16x16_32x32_1x1_16x16x1_16x16x1_1x32x1x8_8_1x1_intrawave_v1,619.41,1405.92,0.0
gfx950,256,1953,8192,512,ck,0,0,26.4938,a8w8_blockscale_1x128x128_256x128x128x128_16x16_32x32_2x2_8x32x1_8x32x1_1x32x1x8_8_1x1_intrawave_v3,618.37,1403.81,0.0
gfx950,256,1921,8192,512,ck,0,0,26.4947,a8w8_blockscale_1x128x128_256x128x128x128_16x16_32x32_2x2_8x32x1_8x32x1_1x32x1x8_8_1x1_intrawave_v3,608.22,1383.35,0.0
gfx950,256,1971,8192,512,ck,0,0,26.5029,a8w8_blockscale_1x128x128_256x128x128x128_16x16_32x32_2x2_8x32x1_8x32x1_1x32x1x8_8_1x1_intrawave_v3,623.85,1414.8,0.0
gfx950,256,1966,8192,512,ck,18,0,26.504,a8w8_blockscale_1x128x128_256x64x64x256_16x16_32x32_1x1_16x16x1_16x16x1_1x32x1x8_8_1x1_intrawave_v1,622.25,1411.55,0.0
gfx950,256,1023,8192,1536,ck,0,0,26.5102,a8w8_blockscale_1x128x128_256x128x128x128_16x16_32x32_2x2_8x32x1_8x32x1_1x32x1x8_8_1x1_intrawave_v3,971.12,1166.16,0.0
gfx950,256,1962,8192,512,ck,0,0,26.5254,a8w8_blockscale_1x128x128_256x128x128x128_16x16_32x32_2x2_8x32x1_8x32x1_1x32x1x8_8_1x1_intrawave_v3,620.48,1407.87,0.0
gfx950,256,1955,8192,512,ck,18,0,26.5372,a8w8_blockscale_1x128x128_256x64x64x256_16x16_32x32_1x1_16x16x1_16x16x1_1x32x1x8_8_1x1_intrawave_v1,617.99,1402.78,0.0
gfx950,256,1949,8192,512,ck,0,0,26.5499,a8w8_blockscale_1x128x128_256x128x128x128_16x16_32x32_2x2_8x32x1_8x32x1_1x32x1x8_8_1x1_intrawave_v3,615.8,1398.3,0.0
gfx950,256,1960,8192,512,ck,0,0,26.5528,a8w8_blockscale_1x128x128_256x128x128x128_16x16_32x32_2x2_8x32x1_8x32x1_1x32x1x8_8_1x1_intrawave_v3,619.21,1405.14,0.0
gfx950,256,1990,8192,512,ck,0,0,26.5638,a8w8_blockscale_1x128x128_256x128x128x128_16x16_32x32_2x2_8x32x1_8x32x1_1x32x1x8_8_1x1_intrawave_v3,628.42,1423.64,0.0
gfx950,256,2003,8192,512,ck,0,0,26.5799,a8w8_blockscale_1x128x128_256x128x128x128_16x16_32x32_2x2_8x32x1_8x32x1_1x32x1x8_8_1x1_intrawave_v3,632.15,1431.04,0.0
gfx950,256,1987,8192,512,ck,0,0,26.5971,a8w8_blockscale_1x128x128_256x128x128x128_16x16_32x32_2x2_8x32x1_8x32x1_1x32x1x8_8_1x1_intrawave_v3,626.69,1419.95,0.0
gfx950,256,1972,8192,512,ck,18,0,26.6033,a8w8_blockscale_1x128x128_256x64x64x256_16x16_32x32_1x1_16x16x1_16x16x1_1x32x1x8_8_1x1_intrawave_v1,621.82,1410.1,0.0
gfx950,256,1957,8192,512,ck,0,0,26.6138,a8w8_blockscale_1x128x128_256x128x128x128_16x16_32x32_2x2_8x32x1_8x32x1_1x32x1x8_8_1x1_intrawave_v3,616.84,1400.02,0.0
gfx950,256,1996,8192,512,ck,0,0,26.6244,a8w8_blockscale_1x128x128_256x128x128x128_16x16_32x32_2x2_8x32x1_8x32x1_1x32x1x8_8_1x1_intrawave_v3,628.88,1424.21,0.0
gfx950,256,1988,8192,512,ck,0,0,26.6324,a8w8_blockscale_1x128x128_256x128x128x128_16x16_32x32_2x2_8x32x1_8x32x1_1x32x1x8_8_1x1_intrawave_v3,626.18,1418.71,0.0
gfx950,256,1992,8192,512,ck,0,0,26.6332,a8w8_blockscale_1x128x128_256x128x128x128_16x16_32x32_2x2_8x32x1_8x32x1_1x32x1x8_8_1x1_intrawave_v3,627.42,1421.2,0.0
gfx950,256,1963,8192,512,ck,0,0,26.6433,a8w8_blockscale_1x128x128_256x128x128x128_16x16_32x32_2x2_8x32x1_8x32x1_1x32x1x8_8_1x1_intrawave_v3,618.05,1402.27,0.0
gfx950,256,2000,8192,512,ck,0,0,26.6455,a8w8_blockscale_1x128x128_256x128x128x128_16x16_32x32_2x2_8x32x1_8x32x1_1x32x1x8_8_1x1_intrawave_v3,629.65,1425.62,0.0
gfx950,256,1989,8192,512,ck,0,0,26.6531,a8w8_blockscale_1x128x128_256x128x128x128_16x16_32x32_2x2_8x32x1_8x32x1_1x32x1x8_8_1x1_intrawave_v3,626.0,1418.24,0.0
gfx950,256,2014,8192,512,ck,0,0,26.6569,a8w8_blockscale_1x128x128_256x128x128x128_16x16_32x32_2x2_8x32x1_8x32x1_1x32x1x8_8_1x1_intrawave_v3,633.78,1433.88,0.0
gfx950,256,2006,8192,512,ck,0,0,26.6571,a8w8_blockscale_1x128x128_256x128x128x128_16x16_32x32_2x2_8x32x1_8x32x1_1x32x1x8_8_1x1_intrawave_v3,631.26,1428.8,0.0
gfx950,256,1985,8192,512,ck,0,0,26.6821,a8w8_blockscale_1x128x128_256x128x128x128_16x16_32x32_2x2_8x32x1_8x32x1_1x32x1x8_8_1x1_intrawave_v3,624.07,1414.16,0.0
gfx950,256,2004,8192,512,ck,0,0,26.6838,a8w8_blockscale_1x128x128_256x128x128x128_16x16_32x32_2x2_8x32x1_8x32x1_1x32x1x8_8_1x1_intrawave_v3,630.0,1426.1,0.0
gfx950,256,1999,8192,512,ck,0,0,26.6952,a8w8_blockscale_1x128x128_256x128x128x128_16x16_32x32_2x2_8x32x1_8x32x1_1x32x1x8_8_1x1_intrawave_v3,628.16,1422.33,0.0
gfx950,256,2020,8192,512,ck,0,0,26.7042,a8w8_blockscale_1x128x128_256x128x128x128_16x16_32x32_2x2_8x32x1_8x32x1_1x32x1x8_8_1x1_intrawave_v3,634.54,1435.14,0.0
gfx950,256,2008,8192,512,ck,0,0,26.7087,a8w8_blockscale_1x128x128_256x128x128x128_16x16_32x32_2x2_8x32x1_8x32x1_1x32x1x8_8_1x1_intrawave_v3,630.67,1427.31,0.0
gfx950,256,1982,8192,512,ck,0,0,26.7251,a8w8_blockscale_1x128x128_256x128x128x128_16x16_32x32_2x2_8x32x1_8x32x1_1x32x1x8_8_1x1_intrawave_v3,622.12,1409.99,0.0
gfx950,256,1993,8192,512,ck,0,0,26.7337,a8w8_blockscale_1x128x128_256x128x128x128_16x16_32x32_2x2_8x32x1_8x32x1_1x32x1x8_8_1x1_intrawave_v3,625.37,1416.49,0.0
gfx950,256,1991,8192,512,ck,0,0,26.7406,a8w8_blockscale_1x128x128_256x128x128x128_16x16_32x32_2x2_8x32x1_8x32x1_1x32x1x8_8_1x1_intrawave_v3,624.58,1414.86,0.0
gfx950,256,1994,8192,512,ck,0,0,26.769,a8w8_blockscale_1x128x128_256x128x128x128_16x16_32x32_2x2_8x32x1_8x32x1_1x32x1x8_8_1x1_intrawave_v3,624.86,1415.25,0.0
gfx950,256,2001,8192,512,ck,0,0,26.783,a8w8_blockscale_1x128x128_256x128x128x128_16x16_32x32_2x2_8x32x1_8x32x1_1x32x1x8_8_1x1_intrawave_v3,626.73,1418.93,0.0
gfx950,256,2034,8192,512,ck,0,0,26.7889,a8w8_blockscale_1x128x128_256x128x128x128_16x16_32x32_2x2_8x32x1_8x32x1_1x32x1x8_8_1x1_intrawave_v3,636.92,1439.43,0.0
gfx950,256,2044,8192,512,ck,0,0,26.8476,a8w8_blockscale_1x128x128_256x128x128x128_16x16_32x32_2x2_8x32x1_8x32x1_1x32x1x8_8_1x1_intrawave_v3,638.65,1442.58,0.0
gfx950,256,2007,8192,512,ck,0,0,26.8485,a8w8_blockscale_1x128x128_256x128x128x128_16x16_32x32_2x2_8x32x1_8x32x1_1x32x1x8_8_1x1_intrawave_v3,627.07,1419.24,0.0
gfx950,256,2012,8192,512,ck,0,0,26.869,a8w8_blockscale_1x128x128_256x128x128x128_16x16_32x32_2x2_8x32x1_8x32x1_1x32x1x8_8_1x1_intrawave_v3,628.15,1421.31,0.0
gfx950,256,1995,8192,512,ck,0,0,26.8773,a8w8_blockscale_1x128x128_256x128x128x128_16x16_32x32_2x2_8x32x1_8x32x1_1x32x1x8_8_1x1_intrawave_v3,622.65,1410.18,0.0
gfx950,256,2002,8192,512,ck,0,0,26.8937,a8w8_blockscale_1x128x128_256x128x128x128_16x16_32x32_2x2_8x32x1_8x32x1_1x32x1x8_8_1x1_intrawave_v3,624.46,1413.72,0.0
gfx950,256,2005,8192,512,ck,0,0,26.8943,a8w8_blockscale_1x128x128_256x128x128x128_16x16_32x32_2x2_8x32x1_8x32x1_1x32x1x8_8_1x1_intrawave_v3,625.38,1415.57,0.0
gfx950,256,2028,8192,512,ck,0,0,26.906,a8w8_blockscale_1x128x128_256x128x128x128_16x16_32x32_2x2_8x32x1_8x32x1_1x32x1x8_8_1x1_intrawave_v3,632.28,1429.4,0.0
gfx950,256,2046,8192,512,ck,0,0,26.9197,a8w8_blockscale_1x128x128_256x128x128x128_16x16_32x32_2x2_8x32x1_8x32x1_1x32x1x8_8_1x1_intrawave_v3,637.57,1439.97,0.0
gfx950,256,2009,8192,512,ck,0,0,26.9255,a8w8_blockscale_1x128x128_256x128x128x128_16x16_32x32_2x2_8x32x1_8x32x1_1x32x1x8_8_1x1_intrawave_v3,625.9,1416.44,0.0
gfx950,256,2030,8192,512,ck,0,0,26.9394,a8w8_blockscale_1x128x128_256x128x128x128_16x16_32x32_2x2_8x32x1_8x32x1_1x32x1x8_8_1x1_intrawave_v3,632.12,1428.88,0.0
gfx950,256,2033,8192,512,ck,0,0,26.9458,a8w8_blockscale_1x128x128_256x128x128x128_16x16_32x32_2x2_8x32x1_8x32x1_1x32x1x8_8_1x1_intrawave_v3,632.9,1430.42,0.0
gfx950,256,2040,8192,512,ck,0,0,26.9534,a8w8_blockscale_1x128x128_256x128x128x128_16x16_32x32_2x2_8x32x1_8x32x1_1x32x1x8_8_1x1_intrawave_v3,634.9,1434.41,0.0
gfx950,256,2024,8192,512,ck,0,0,26.9597,a8w8_blockscale_1x128x128_256x128x128x128_16x16_32x32_2x2_8x32x1_8x32x1_1x32x1x8_8_1x1_intrawave_v3,629.77,1424.04,0.0
gfx950,256,2043,8192,512,ck,0,0,26.9812,a8w8_blockscale_1x128x128_256x128x128x128_16x16_32x32_2x2_8x32x1_8x32x1_1x32x1x8_8_1x1_intrawave_v3,635.18,1434.81,0.0
gfx950,256,2029,8192,512,ck,0,0,26.9815,a8w8_blockscale_1x128x128_256x128x128x128_16x16_32x32_2x2_8x32x1_8x32x1_1x32x1x8_8_1x1_intrawave_v3,630.82,1426.02,0.0
gfx950,256,2045,8192,512,ck,0,0,27.0197,a8w8_blockscale_1x128x128_256x128x128x128_16x16_32x32_2x2_8x32x1_8x32x1_1x32x1x8_8_1x1_intrawave_v3,634.9,1434.01,0.0
gfx950,256,2026,8192,512,ck,0,0,27.0243,a8w8_blockscale_1x128x128_256x128x128x128_16x16_32x32_2x2_8x32x1_8x32x1_1x32x1x8_8_1x1_intrawave_v3,628.89,1421.89,0.0
gfx950,256,2042,8192,512,ck,0,0,27.0549,a8w8_blockscale_1x128x128_256x128x128x128_16x16_32x32_2x2_8x32x1_8x32x1_1x32x1x8_8_1x1_intrawave_v3,633.14,1430.27,0.0
gfx950,256,2041,8192,512,ck,0,0,27.0788,a8w8_blockscale_1x128x128_256x128x128x128_16x16_32x32_2x2_8x32x1_8x32x1_1x32x1x8_8_1x1_intrawave_v3,632.27,1428.39,0.0
gfx950,256,2087,8192,512,ck,18,0,27.1083,a8w8_blockscale_1x128x128_256x64x64x256_16x16_32x32_1x1_16x16x1_16x16x1_1x32x1x8_8_1x1_intrawave_v1,645.82,1455.5,0.0
gfx950,256,2047,8192,512,ck,0,0,27.124,a8w8_blockscale_1x128x128_256x128x128x128_16x16_32x32_2x2_8x32x1_8x32x1_1x32x1x8_8_1x1_intrawave_v3,633.07,1429.75,0.0
gfx950,256,2088,8192,512,ck,18,0,27.1492,a8w8_blockscale_1x128x128_256x64x64x256_16x16_32x32_1x1_16x16x1_16x16x1_1x32x1x8_8_1x1_intrawave_v1,645.15,1453.93,0.0
gfx950,256,2075,8192,512,ck,18,0,27.1923,a8w8_blockscale_1x128x128_256x64x64x256_16x16_32x32_1x1_16x16x1_16x16x1_1x32x1x8_8_1x1_intrawave_v1,640.12,1443.55,0.0
gfx950,256,2068,8192,512,ck,18,0,27.2188,a8w8_blockscale_1x128x128_256x64x64x256_16x16_32x32_1x1_16x16x1_16x16x1_1x32x1x8_8_1x1_intrawave_v1,637.34,1437.8,0.0
gfx950,256,2067,8192,512,ck,18,0,27.2328,a8w8_blockscale_1x128x128_256x64x64x256_16x16_32x32_1x1_16x16x1_16x16x1_1x32x1x8_8_1x1_intrawave_v1,636.7,1436.44,0.0
gfx950,256,2053,8192,512,ck,18,0,27.2448,a8w8_blockscale_1x128x128_256x64x64x256_16x16_32x32_1x1_16x16x1_16x16x1_1x32x1x8_8_1x1_intrawave_v1,632.11,1427.13,0.0
gfx950,256,2059,8192,512,ck,18,0,27.2612,a8w8_blockscale_1x128x128_256x64x64x256_16x16_32x32_1x1_16x16x1_16x16x1_1x32x1x8_8_1x1_intrawave_v1,633.58,1429.99,0.0
gfx950,256,2058,8192,512,ck,18,0,27.2765,a8w8_blockscale_1x128x128_256x64x64x256_16x16_32x32_1x1_16x16x1_16x16x1_1x32x1x8_8_1x1_intrawave_v1,632.92,1428.57,0.0
gfx950,256,2081,8192,512,ck,18,0,27.3172,a8w8_blockscale_1x128x128_256x64x64x256_16x16_32x32_1x1_16x16x1_16x16x1_1x32x1x8_8_1x1_intrawave_v1,639.04,1440.66,0.0
gfx950,256,2136,8192,512,ck,18,0,27.3346,a8w8_blockscale_1x128x128_256x64x64x256_16x16_32x32_1x1_16x16x1_16x16x1_1x32x1x8_8_1x1_intrawave_v1,655.51,1473.74,0.0
gfx950,256,2066,8192,512,ck,18,0,27.3672,a8w8_blockscale_1x128x128_256x64x64x256_16x16_32x32_1x1_16x16x1_16x16x1_1x32x1x8_8_1x1_intrawave_v1,633.27,1428.77,0.0
gfx950,256,272,7168,4096,ck,12,0,27.3906,a8w8_blockscale_1x128x128_256x32x128x256_16x16_32x32_1x1_16x16x1_16x16x1_1x32x1x8_8_1x1_intrawave_v1,583.12,1254.94,0.0
gfx950,256,2085,8192,512,ck,18,0,27.4036,a8w8_blockscale_1x128x128_256x64x64x256_16x16_32x32_1x1_16x16x1_16x16x1_1x32x1x8_8_1x1_intrawave_v1,638.25,1438.59,0.0
gfx950,256,2094,8192,512,ck,18,0,27.4313,a8w8_blockscale_1x128x128_256x64x64x256_16x16_32x32_1x1_16x16x1_16x16x1_1x32x1x8_8_1x1_intrawave_v1,640.35,1442.68,0.0
gfx950,256,2120,8192,512,ck,18,0,27.4322,a8w8_blockscale_1x128x128_256x64x64x256_16x16_32x32_1x1_16x16x1_16x16x1_1x32x1x8_8_1x1_intrawave_v1,648.28,1458.64,0.0
gfx950,256,2051,8192,512,ck,18,0,27.4574,a8w8_blockscale_1x128x128_256x64x64x256_16x16_32x32_1x1_16x16x1_16x16x1_1x32x1x8_8_1x1_intrawave_v1,626.61,1414.85,0.0
gfx950,256,2079,8192,512,ck,18,0,27.464,a8w8_blockscale_1x128x128_256x64x64x256_16x16_32x32_1x1_16x16x1_16x16x1_1x32x1x8_8_1x1_intrawave_v1,635.01,1431.73,0.0
gfx950,256,2138,8192,512,ck,18,0,27.4692,a8w8_blockscale_1x128x128_256x64x64x256_16x16_32x32_1x1_16x16x1_16x16x1_1x32x1x8_8_1x1_intrawave_v1,652.91,1467.75,0.0
gfx950,256,2049,8192,512,ck,18,0,27.474,a8w8_blockscale_1x128x128_256x64x64x256_16x16_32x32_1x1_16x16x1_16x16x1_1x32x1x8_8_1x1_intrawave_v1,625.62,1412.76,0.0
gfx950,256,2111,8192,512,ck,18,0,27.4921,a8w8_blockscale_1x128x128_256x64x64x256_16x16_32x32_1x1_16x16x1_16x16x1_1x32x1x8_8_1x1_intrawave_v1,644.13,1449.94,0.0
gfx950,256,2114,8192,512,ck,18,0,27.4965,a8w8_blockscale_1x128x128_256x64x64x256_16x16_32x32_1x1_16x16x1_16x16x1_1x32x1x8_8_1x1_intrawave_v1,644.94,1451.55,0.0
gfx950,256,2124,8192,512,ck,18,0,27.5128,a8w8_blockscale_1x128x128_256x64x64x256_16x16_32x32_1x1_16x16x1_16x16x1_1x32x1x8_8_1x1_intrawave_v1,647.6,1456.83,0.0
gfx950,256,2139,8192,512,ck,18,0,27.5178,a8w8_blockscale_1x128x128_256x64x64x256_16x16_32x32_1x1_16x16x1_16x16x1_1x32x1x8_8_1x1_intrawave_v1,652.06,1465.77,0.0
gfx950,256,2097,8192,512,ck,18,0,27.5286,a8w8_blockscale_1x128x128_256x64x64x256_16x16_32x32_1x1_16x16x1_16x16x1_1x32x1x8_8_1x1_intrawave_v1,639.0,1439.42,0.0
gfx950,256,2113,8192,512,ck,18,0,27.5345,a8w8_blockscale_1x128x128_256x64x64x256_16x16_32x32_1x1_16x16x1_16x16x1_1x32x1x8_8_1x1_intrawave_v1,643.74,1448.93,0.0
gfx950,256,2083,8192,512,ck,18,0,27.55,a8w8_blockscale_1x128x128_256x64x64x256_16x16_32x32_1x1_16x16x1_16x16x1_1x32x1x8_8_1x1_intrawave_v1,634.25,1429.72,0.0
gfx950,256,2054,8192,512,ck,18,0,27.5797,a8w8_blockscale_1x128x128_256x64x64x256_16x16_32x32_1x1_16x16x1_16x16x1_1x32x1x8_8_1x1_intrawave_v1,624.74,1410.41,0.0
gfx950,256,2080,8192,512,ck,18,0,27.586,a8w8_blockscale_1x128x128_256x64x64x256_16x16_32x32_1x1_16x16x1_16x16x1_1x32x1x8_8_1x1_intrawave_v1,632.51,1426.01,0.0
gfx950,256,2065,8192,512,ck,18,0,27.5884,a8w8_blockscale_1x128x128_256x64x64x256_16x16_32x32_1x1_16x16x1_16x16x1_1x32x1x8_8_1x1_intrawave_v1,627.89,1416.7,0.0
gfx950,256,2134,8192,512,ck,18,0,27.5945,a8w8_blockscale_1x128x128_256x64x64x256_16x16_32x32_1x1_16x16x1_16x16x1_1x32x1x8_8_1x1_intrawave_v1,648.73,1458.64,0.0
gfx950,256,2105,8192,512,ck,18,0,27.6113,a8w8_blockscale_1x128x128_256x64x64x256_16x16_32x32_1x1_16x16x1_16x16x1_1x32x1x8_8_1x1_intrawave_v1,639.52,1440.0,0.0
gfx950,256,2057,8192,512,ck,18,0,27.6584,a8w8_blockscale_1x128x128_256x64x64x256_16x16_32x32_1x1_16x16x1_16x16x1_1x32x1x8_8_1x1_intrawave_v1,623.87,1408.23,0.0
gfx950,256,2169,8192,512,ck,18,0,27.6796,a8w8_blockscale_1x128x128_256x64x64x256_16x16_32x32_1x1_16x16x1_16x16x1_1x32x1x8_8_1x1_intrawave_v1,657.34,1475.52,0.0
gfx950,256,2091,8192,512,ck,18,0,27.6841,a8w8_blockscale_1x128x128_256x64x64x256_16x16_32x32_1x1_16x16x1_16x16x1_1x32x1x8_8_1x1_intrawave_v1,633.6,1427.67,0.0
gfx950,256,2143,8192,512,ck,18,0,27.7133,a8w8_blockscale_1x128x128_256x64x64x256_16x16_32x32_1x1_16x16x1_16x16x1_1x32x1x8_8_1x1_intrawave_v1,648.67,1457.87,0.0
gfx950,256,2095,8192,512,ck,18,0,27.718,a8w8_blockscale_1x128x128_256x64x64x256_16x16_32x32_1x1_16x16x1_16x16x1_1x32x1x8_8_1x1_intrawave_v1,634.03,1428.37,0.0
gfx950,256,2106,8192,512,ck,18,0,27.7257,a8w8_blockscale_1x128x128_256x64x64x256_16x16_32x32_1x1_16x16x1_16x16x1_1x32x1x8_8_1x1_intrawave_v1,637.19,1434.67,0.0
gfx950,256,2132,8192,512,ck,18,0,27.737,a8w8_blockscale_1x128x128_256x64x64x256_16x16_32x32_1x1_16x16x1_16x16x1_1x32x1x8_8_1x1_intrawave_v1,644.79,1449.93,0.0
gfx950,256,2102,8192,512,ck,18,0,27.7376,a8w8_blockscale_1x128x128_256x64x64x256_16x16_32x32_1x1_16x16x1_16x16x1_1x32x1x8_8_1x1_intrawave_v1,635.7,1431.62,0.0
gfx950,256,2100,8192,512,ck,18,0,27.7456,a8w8_blockscale_1x128x128_256x64x64x256_16x16_32x32_1x1_16x16x1_16x16x1_1x32x1x8_8_1x1_intrawave_v1,634.91,1429.99,0.0
gfx950,256,2129,8192,512,ck,18,0,27.7707,a8w8_blockscale_1x128x128_256x64x64x256_16x16_32x32_1x1_16x16x1_16x16x1_1x32x1x8_8_1x1_intrawave_v1,643.1,1446.34,0.0
gfx950,256,2098,8192,512,ck,18,0,27.7796,a8w8_blockscale_1x128x128_256x64x64x256_16x16_32x32_1x1_16x16x1_16x16x1_1x32x1x8_8_1x1_intrawave_v1,633.53,1427.02,0.0
gfx950,256,2071,8192,512,ck,18,0,27.8153,a8w8_blockscale_1x128x128_256x64x64x256_16x16_32x32_1x1_16x16x1_16x16x1_1x32x1x8_8_1x1_intrawave_v1,624.58,1408.79,0.0
gfx950,256,2166,8192,512,ck,18,0,27.8185,a8w8_blockscale_1x128x128_256x64x64x256_16x16_32x32_1x1_16x16x1_16x16x1_1x32x1x8_8_1x1_intrawave_v1,653.15,1466.33,0.0
gfx950,256,2127,8192,512,ck,18,0,27.8216,a8w8_blockscale_1x128x128_256x64x64x256_16x16_32x32_1x1_16x16x1_16x16x1_1x32x1x8_8_1x1_intrawave_v1,641.32,1442.48,0.0
gfx950,256,2146,8192,512,ck,18,0,27.8401,a8w8_blockscale_1x128x128_256x64x64x256_16x16_32x32_1x1_16x16x1_16x16x1_1x32x1x8_8_1x1_intrawave_v1,646.62,1453.05,0.0
gfx950,256,2145,8192,512,ck,18,0,27.8733,a8w8_blockscale_1x128x128_256x64x64x256_16x16_32x32_1x1_16x16x1_16x16x1_1x32x1x8_8_1x1_intrawave_v1,645.55,1450.72,0.0
gfx950,256,2070,8192,512,ck,18,0,27.8773,a8w8_blockscale_1x128x128_256x64x64x256_16x16_32x32_1x1_16x16x1_16x16x1_1x32x1x8_8_1x1_intrawave_v1,622.89,1405.05,0.0
gfx950,256,2163,8192,512,ck,18,0,27.8816,a8w8_blockscale_1x128x128_256x64x64x256_16x16_32x32_1x1_16x16x1_16x16x1_1x32x1x8_8_1x1_intrawave_v1,650.77,1461.19,0.0
gfx950,256,2148,8192,512,ck,18,0,27.8829,a8w8_blockscale_1x128x128_256x64x64x256_16x16_32x32_1x1_16x16x1_16x16x1_1x32x1x8_8_1x1_intrawave_v1,646.23,1452.03,0.0
gfx950,256,2172,8192,512,ck,18,0,27.9148,a8w8_blockscale_1x128x128_256x64x64x256_16x16_32x32_1x1_16x16x1_16x16x1_1x32x1x8_8_1x1_intrawave_v1,652.7,1464.9,0.0
gfx950,256,2141,8192,512,ck,18,0,27.9377,a8w8_blockscale_1x128x128_256x64x64x256_16x16_32x32_1x1_16x16x1_16x16x1_1x32x1x8_8_1x1_intrawave_v1,642.86,1444.95,0.0
gfx950,256,2133,8192,512,ck,18,0,27.958,a8w8_blockscale_1x128x128_256x64x64x256_16x16_32x32_1x1_16x16x1_16x16x1_1x32x1x8_8_1x1_intrawave_v1,639.99,1439.07,0.0
gfx950,256,2099,8192,512,ck,18,0,27.9645,a8w8_blockscale_1x128x128_256x64x64x256_16x16_32x32_1x1_16x16x1_16x16x1_1x32x1x8_8_1x1_intrawave_v1,629.64,1418.19,0.0
gfx950,256,2152,8192,512,ck,18,0,28.0041,a8w8_blockscale_1x128x128_256x64x64x256_16x16_32x32_1x1_16x16x1_16x16x1_1x32x1x8_8_1x1_intrawave_v1,644.63,1448.16,0.0
gfx950,256,2137,8192,512,ck,18,0,28.0078,a8w8_blockscale_1x128x128_256x64x64x256_16x16_32x32_1x1_16x16x1_16x16x1_1x32x1x8_8_1x1_intrawave_v1,640.05,1438.92,0.0
gfx950,256,2130,8192,512,ck,18,0,28.0209,a8w8_blockscale_1x128x128_256x64x64x256_16x16_32x32_1x1_16x16x1_16x16x1_1x32x1x8_8_1x1_intrawave_v1,637.66,1434.03,0.0
gfx950,256,2174,8192,512,ck,18,0,28.078,a8w8_blockscale_1x128x128_256x64x64x256_16x16_32x32_1x1_16x16x1_16x16x1_1x32x1x8_8_1x1_intrawave_v1,649.51,1457.59,0.0
gfx950,256,2104,8192,512,ck,18,0,28.0928,a8w8_blockscale_1x128x128_256x64x64x256_16x16_32x32_1x1_16x16x1_16x16x1_1x32x1x8_8_1x1_intrawave_v1,628.26,1414.72,0.0
gfx950,256,2131,8192,512,ck,18,0,28.1172,a8w8_blockscale_1x128x128_256x64x64x256_16x16_32x32_1x1_16x16x1_16x16x1_1x32x1x8_8_1x1_intrawave_v1,635.77,1429.72,0.0
gfx950,256,2122,8192,512,ck,18,0,28.118,a8w8_blockscale_1x128x128_256x64x64x256_16x16_32x32_1x1_16x16x1_16x16x1_1x32x1x8_8_1x1_intrawave_v1,633.07,1424.27,0.0
gfx950,256,2214,8192,512,ck,18,0,28.2789,a8w8_blockscale_1x128x128_256x64x64x256_16x16_32x32_1x1_16x16x1_16x16x1_1x32x1x8_8_1x1_intrawave_v1,656.76,1471.13,0.0
gfx950,256,2183,8192,512,ck,18,0,28.3019,a8w8_blockscale_1x128x128_256x64x64x256_16x16_32x32_1x1_16x16x1_16x16x1_1x32x1x8_8_1x1_intrawave_v1,647.04,1451.43,0.0
gfx950,256,2210,8192,512,ck,18,0,28.404,a8w8_blockscale_1x128x128_256x64x64x256_16x16_32x32_1x1_16x16x1_16x16x1_1x32x1x8_8_1x1_intrawave_v1,652.68,1462.28,0.0
gfx950,256,2208,8192,512,ck,18,0,28.4465,a8w8_blockscale_1x128x128_256x64x64x256_16x16_32x32_1x1_16x16x1_16x16x1_1x32x1x8_8_1x1_intrawave_v1,651.12,1458.9,0.0
gfx950,256,2235,8192,512,ck,18,0,28.5544,a8w8_blockscale_1x128x128_256x64x64x256_16x16_32x32_1x1_16x16x1_16x16x1_1x32x1x8_8_1x1_intrawave_v1,656.59,1469.37,0.0
gfx950,256,2182,8192,512,ck,18,0,28.5702,a8w8_blockscale_1x128x128_256x64x64x256_16x16_32x32_1x1_16x16x1_16x16x1_1x32x1x8_8_1x1_intrawave_v1,640.67,1437.21,0.0
gfx950,256,2237,8192,512,ck,18,0,28.6473,a8w8_blockscale_1x128x128_256x64x64x256_16x16_32x32_1x1_16x16x1_16x16x1_1x32x1x8_8_1x1_intrawave_v1,655.05,1465.78,0.0
gfx950,256,2232,8192,512,ck,18,0,28.686,a8w8_blockscale_1x128x128_256x64x64x256_16x16_32x32_1x1_16x16x1_16x16x1_1x32x1x8_8_1x1_intrawave_v1,652.7,1460.86,0.0
gfx950,256,2221,8192,512,ck,18,0,28.6892,a8w8_blockscale_1x128x128_256x64x64x256_16x16_32x32_1x1_16x16x1_16x16x1_1x32x1x8_8_1x1_intrawave_v1,649.41,1454.22,0.0
gfx950,256,2212,8192,512,ck,18,0,28.7157,a8w8_blockscale_1x128x128_256x64x64x256_16x16_32x32_1x1_16x16x1_16x16x1_1x32x1x8_8_1x1_intrawave_v1,646.18,1447.58,0.0
gfx950,256,2180,8192,512,ck,18,0,28.754,a8w8_blockscale_1x128x128_256x64x64x256_16x16_32x32_1x1_16x16x1_16x16x1_1x32x1x8_8_1x1_intrawave_v1,635.99,1426.85,0.0
gfx950,256,2238,8192,512,ck,18,0,28.7728,a8w8_blockscale_1x128x128_256x64x64x256_16x16_32x32_1x1_16x16x1_16x16x1_1x32x1x8_8_1x1_intrawave_v1,652.48,1459.97,0.0
gfx950,256,2186,8192,512,ck,18,0,28.7782,a8w8_blockscale_1x128x128_256x64x64x256_16x16_32x32_1x1_16x16x1_16x16x1_1x32x1x8_8_1x1_intrawave_v1,637.2,1429.17,0.0
gfx950,256,2193,8192,512,ck,18,0,28.7801,a8w8_blockscale_1x128x128_256x64x64x256_16x16_32x32_1x1_16x16x1_16x16x1_1x32x1x8_8_1x1_intrawave_v1,639.2,1433.19,0.0
gfx950,256,2262,8192,512,ck,18,0,28.7813,a8w8_blockscale_1x128x128_256x64x64x256_16x16_32x32_1x1_16x16x1_16x16x1_1x32x1x8_8_1x1_intrawave_v1,659.28,1473.63,0.0
gfx950,256,2263,8192,512,ck,18,0,28.7945,a8w8_blockscale_1x128x128_256x64x64x256_16x16_32x32_1x1_16x16x1_16x16x1_1x32x1x8_8_1x1_intrawave_v1,659.27,1473.54,0.0
gfx950,256,2177,8192,512,ck,18,0,28.7953,a8w8_blockscale_1x128x128_256x64x64x256_16x16_32x32_1x1_16x16x1_16x16x1_1x32x1x8_8_1x1_intrawave_v1,634.2,1423.04,0.0
gfx950,256,2272,8192,512,ck,18,0,28.7969,a8w8_blockscale_1x128x128_256x64x64x256_16x16_32x32_1x1_16x16x1_16x16x1_1x32x1x8_8_1x1_intrawave_v1,661.84,1478.7,0.0
gfx950,256,2179,8192,512,ck,18,0,28.7981,a8w8_blockscale_1x128x128_256x64x64x256_16x16_32x32_1x1_16x16x1_16x16x1_1x32x1x8_8_1x1_intrawave_v1,634.72,1424.08,0.0
gfx950,256,2246,8192,512,ck,18,0,28.8141,a8w8_blockscale_1x128x128_256x64x64x256_16x16_32x32_1x1_16x16x1_16x16x1_1x32x1x8_8_1x1_intrawave_v1,653.87,1462.57,0.0
gfx950,256,2219,8192,512,ck,18,0,28.8144,a8w8_blockscale_1x128x128_256x64x64x256_16x16_32x32_1x1_16x16x1_16x16x1_1x32x1x8_8_1x1_intrawave_v1,646.01,1446.73,0.0
gfx950,256,2187,8192,512,ck,18,0,28.8145,a8w8_blockscale_1x128x128_256x64x64x256_16x16_32x32_1x1_16x16x1_16x16x1_1x32x1x8_8_1x1_intrawave_v1,636.69,1427.96,0.0
gfx950,256,2253,8192,512,ck,18,0,28.8162,a8w8_blockscale_1x128x128_256x64x64x256_16x16_32x32_1x1_16x16x1_16x16x1_1x32x1x8_8_1x1_intrawave_v1,655.86,1466.57,0.0
gfx950,256,2231,8192,512,ck,18,0,28.8253,a8w8_blockscale_1x128x128_256x64x64x256_16x16_32x32_1x1_16x16x1_16x16x1_1x32x1x8_8_1x1_intrawave_v1,649.26,1453.21,0.0
gfx950,256,2178,8192,512,ck,18,0,28.8416,a8w8_blockscale_1x128x128_256x64x64x256_16x16_32x32_1x1_16x16x1_16x16x1_1x32x1x8_8_1x1_intrawave_v1,633.47,1421.34,0.0
gfx950,256,2220,8192,512,ck,18,0,28.8425,a8w8_blockscale_1x128x128_256x64x64x256_16x16_32x32_1x1_16x16x1_16x16x1_1x32x1x8_8_1x1_intrawave_v1,645.67,1445.9,0.0
gfx950,256,2249,8192,512,ck,18,0,28.8449,a8w8_blockscale_1x128x128_256x64x64x256_16x16_32x32_1x1_16x16x1_16x16x1_1x32x1x8_8_1x1_intrawave_v1,654.05,1462.77,0.0
gfx950,256,2239,8192,512,ck,18,0,28.8924,a8w8_blockscale_1x128x128_256x64x64x256_16x16_32x32_1x1_16x16x1_16x16x1_1x32x1x8_8_1x1_intrawave_v1,650.07,1454.52,0.0
gfx950,256,2216,8192,512,ck,18,0,28.9029,a8w8_blockscale_1x128x128_256x64x64x256_16x16_32x32_1x1_16x16x1_16x16x1_1x32x1x8_8_1x1_intrawave_v1,643.16,1440.54,0.0
gfx950,256,2225,8192,512,ck,18,0,28.9032,a8w8_blockscale_1x128x128_256x64x64x256_16x16_32x32_1x1_16x16x1_16x16x1_1x32x1x8_8_1x1_intrawave_v1,645.76,1445.79,0.0
gfx950,256,2184,8192,512,ck,18,0,28.9137,a8w8_blockscale_1x128x128_256x64x64x256_16x16_32x32_1x1_16x16x1_16x16x1_1x32x1x8_8_1x1_intrawave_v1,633.63,1421.3,0.0
gfx950,256,2260,8192,512,ck,18,0,28.9273,a8w8_blockscale_1x128x128_256x64x64x256_16x16_32x32_1x1_16x16x1_16x16x1_1x32x1x8_8_1x1_intrawave_v1,655.38,1465.03,0.0
gfx950,256,2297,8192,512,ck,18,0,28.9325,a8w8_blockscale_1x128x128_256x64x64x256_16x16_32x32_1x1_16x16x1_16x16x1_1x32x1x8_8_1x1_intrawave_v1,665.99,1486.37,0.0
gfx950,256,2284,8192,512,ck,18,0,28.9564,a8w8_blockscale_1x128x128_256x64x64x256_16x16_32x32_1x1_16x16x1_16x16x1_1x32x1x8_8_1x1_intrawave_v1,661.67,1477.56,0.0
gfx950,256,2240,8192,512,ck,17,0,28.9621,a8w8_blockscale_1x128x128_256x64x128x256_16x16_32x32_2x1_16x16x1_16x16x1_1x32x1x8_8_1x1_intrawave_v1,648.8,1451.6,0.0
gfx950,256,2291,8192,512,ck,18,0,28.9709,a8w8_blockscale_1x128x128_256x64x64x256_16x16_32x32_1x1_16x16x1_16x16x1_1x32x1x8_8_1x1_intrawave_v1,663.37,1480.9,0.0
gfx950,256,2255,8192,512,ck,18,0,28.9921,a8w8_blockscale_1x128x128_256x64x64x256_16x16_32x32_1x1_16x16x1_16x16x1_1x32x1x8_8_1x1_intrawave_v1,652.46,1458.84,0.0
gfx950,256,2198,8192,512,ck,18,0,28.9968,a8w8_blockscale_1x128x128_256x64x64x256_16x16_32x32_1x1_16x16x1_16x16x1_1x32x1x8_8_1x1_intrawave_v1,635.87,1425.39,0.0
gfx950,256,2302,8192,512,ck,18,0,28.9985,a8w8_blockscale_1x128x128_256x64x64x256_16x16_32x32_1x1_16x16x1_16x16x1_1x32x1x8_8_1x1_intrawave_v1,665.92,1485.9,0.0
gfx950,256,2192,8192,512,ck,18,0,29.0205,a8w8_blockscale_1x128x128_256x64x64x256_16x16_32x32_1x1_16x16x1_16x16x1_1x32x1x8_8_1x1_intrawave_v1,633.62,1420.73,0.0
gfx950,256,2244,8192,512,ck,18,0,29.0577,a8w8_blockscale_1x128x128_256x64x64x256_16x16_32x32_1x1_16x16x1_16x16x1_1x32x1x8_8_1x1_intrawave_v1,647.82,1449.15,0.0
gfx950,256,2292,8192,512,ck,18,0,29.0917,a8w8_blockscale_1x128x128_256x64x64x256_16x16_32x32_1x1_16x16x1_16x16x1_1x32x1x8_8_1x1_intrawave_v1,660.9,1475.33,0.0
gfx950,256,2242,8192,512,ck,18,0,29.0925,a8w8_blockscale_1x128x128_256x64x64x256_16x16_32x32_1x1_16x16x1_16x16x1_1x32x1x8_8_1x1_intrawave_v1,646.46,1446.25,0.0
gfx950,256,2257,8192,512,ck,18,0,29.0969,a8w8_blockscale_1x128x128_256x64x64x256_16x16_32x32_1x1_16x16x1_16x16x1_1x32x1x8_8_1x1_intrawave_v1,650.69,1454.75,0.0
gfx950,256,2250,8192,512,ck,18,0,29.1017,a8w8_blockscale_1x128x128_256x64x64x256_16x16_32x32_1x1_16x16x1_16x16x1_1x32x1x8_8_1x1_intrawave_v1,648.57,1450.44,0.0
gfx950,256,2275,8192,512,ck,18,0,29.1053,a8w8_blockscale_1x128x128_256x64x64x256_16x16_32x32_1x1_16x16x1_16x16x1_1x32x1x8_8_1x1_intrawave_v1,655.69,1464.77,0.0
gfx950,256,2286,8192,512,ck,18,0,29.1141,a8w8_blockscale_1x128x128_256x64x64x256_16x16_32x32_1x1_16x16x1_16x16x1_1x32x1x8_8_1x1_intrawave_v1,658.66,1470.72,0.0
gfx950,256,2204,8192,512,ck,18,0,29.1213,a8w8_blockscale_1x128x128_256x64x64x256_16x16_32x32_1x1_16x16x1_16x16x1_1x32x1x8_8_1x1_intrawave_v1,634.88,1422.78,0.0
gfx950,256,2190,8192,512,ck,18,0,29.1281,a8w8_blockscale_1x128x128_256x64x64x256_16x16_32x32_1x1_16x16x1_16x16x1_1x32x1x8_8_1x1_intrawave_v1,630.7,1414.32,0.0
gfx950,256,2224,8192,512,ck,0,0,29.1368,a8w8_blockscale_1x128x128_256x128x128x128_16x16_32x32_2x2_8x32x1_8x32x1_1x32x1x8_8_1x1_intrawave_v3,640.3,1433.62,0.0
gfx950,256,2290,8192,512,ck,18,0,29.1725,a8w8_blockscale_1x128x128_256x64x64x256_16x16_32x32_1x1_16x16x1_16x16x1_1x32x1x8_8_1x1_intrawave_v1,658.49,1470.09,0.0
gfx950,256,2196,8192,512,ck,18,0,29.1885,a8w8_blockscale_1x128x128_256x64x64x256_16x16_32x32_1x1_16x16x1_16x16x1_1x32x1x8_8_1x1_intrawave_v1,631.12,1414.87,0.0
gfx950,256,2207,8192,512,ck,0,0,29.2165,a8w8_blockscale_1x128x128_256x128x128x128_16x16_32x32_2x2_8x32x1_8x32x1_1x32x1x8_8_1x1_intrawave_v3,633.67,1419.87,0.0
gfx950,256,2269,8192,512,ck,18,0,29.2201,a8w8_blockscale_1x128x128_256x64x64x256_16x16_32x32_1x1_16x16x1_16x16x1_1x32x1x8_8_1x1_intrawave_v1,651.39,1455.55,0.0
gfx950,256,2248,8192,512,ck,0,0,29.2331,a8w8_blockscale_1x128x128_256x128x128x128_16x16_32x32_2x2_8x32x1_8x32x1_1x32x1x8_8_1x1_intrawave_v3,645.08,1442.77,0.0
gfx950,256,2304,8192,512,ck,0,0,29.2418,a8w8_blockscale_1x128x128_256x128x128x128_16x16_32x32_2x2_8x32x1_8x32x1_1x32x1x8_8_1x1_intrawave_v3,660.95,1474.69,0.0
gfx950,256,2245,8192,512,ck,18,0,29.2421,a8w8_blockscale_1x128x128_256x64x64x256_16x16_32x32_1x1_16x16x1_16x16x1_1x32x1x8_8_1x1_intrawave_v1,644.02,1440.59,0.0
gfx950,256,2300,8192,512,ck,18,0,29.2641,a8w8_blockscale_1x128x128_256x64x64x256_16x16_32x32_1x1_16x16x1_16x16x1_1x32x1x8_8_1x1_intrawave_v1,659.3,1471.26,0.0
gfx950,256,2278,8192,512,ck,0,0,29.3114,a8w8_blockscale_1x128x128_256x128x128x128_16x16_32x32_2x2_8x32x1_8x32x1_1x32x1x8_8_1x1_intrawave_v3,651.94,1456.2,0.0
gfx950,256,2295,8192,512,ck,18,0,29.4077,a8w8_blockscale_1x128x128_256x64x64x256_16x16_32x32_1x1_16x16x1_16x16x1_1x32x1x8_8_1x1_intrawave_v1,654.65,1461.2,0.0
gfx950,256,2285,8192,512,ck,0,0,29.4124,a8w8_blockscale_1x128x128_256x128x128x128_16x16_32x32_2x2_8x32x1_8x32x1_1x32x1x8_8_1x1_intrawave_v3,651.7,1455.23,0.0
gfx950,256,2298,8192,512,ck,0,0,29.4283,a8w8_blockscale_1x128x128_256x128x128x128_16x16_32x32_2x2_8x32x1_8x32x1_1x32x1x8_8_1x1_intrawave_v3,655.05,1461.9,0.0
gfx950,256,1301,6144,1536,ck,14,0,29.4757,a8w8_blockscale_1x128x128_256x64x256x128_16x16_32x32_2x2_8x32x1_8x32x1_1x32x1x8_8_1x1_intrawave_v1,833.08,930.33,0.0
gfx950,256,2283,8192,512,ck,18,0,29.5213,a8w8_blockscale_1x128x128_256x64x64x256_16x16_32x32_1x1_16x16x1_16x16x1_1x32x1x8_8_1x1_intrawave_v1,648.72,1448.71,0.0
gfx950,256,2364,8192,512,ck,0,0,29.5375,a8w8_blockscale_1x128x128_256x128x128x128_16x16_32x32_2x2_8x32x1_8x32x1_1x32x1x8_8_1x1_intrawave_v3,671.37,1494.25,0.0
gfx950,256,2352,8192,512,ck,0,0,29.5605,a8w8_blockscale_1x128x128_256x128x128x128_16x16_32x32_2x2_8x32x1_8x32x1_1x32x1x8_8_1x1_intrawave_v3,667.44,1486.23,0.0
gfx950,256,2430,8192,512,ck,0,0,29.5903,a8w8_blockscale_1x128x128_256x128x128x128_16x16_32x32_2x2_8x32x1_8x32x1_1x32x1x8_8_1x1_intrawave_v3,688.89,1529.27,0.0
gfx950,256,2428,8192,512,ck,0,0,29.6146,a8w8_blockscale_1x128x128_256x128x128x128_16x16_32x32_2x2_8x32x1_8x32x1_1x32x1x8_8_1x1_intrawave_v3,687.75,1526.87,0.0
gfx950,256,2374,8192,512,ck,0,0,29.6228,a8w8_blockscale_1x128x128_256x128x128x128_16x16_32x32_2x2_8x32x1_8x32x1_1x32x1x8_8_1x1_intrawave_v3,672.27,1495.65,0.0
gfx950,256,2310,8192,512,ck,0,0,29.6296,a8w8_blockscale_1x128x128_256x128x128x128_16x16_32x32_2x2_8x32x1_8x32x1_1x32x1x8_8_1x1_intrawave_v3,654.0,1458.81,0.0
gfx950,256,2308,8192,512,ck,0,0,29.6406,a8w8_blockscale_1x128x128_256x128x128x128_16x16_32x32_2x2_8x32x1_8x32x1_1x32x1x8_8_1x1_intrawave_v3,653.19,1457.13,0.0
gfx950,256,2347,8192,512,ck,0,0,29.6434,a8w8_blockscale_1x128x128_256x128x128x128_16x16_32x32_2x2_8x32x1_8x32x1_1x32x1x8_8_1x1_intrawave_v3,664.16,1479.22,0.0
gfx950,256,2350,8192,512,ck,0,0,29.6451,a8w8_blockscale_1x128x128_256x128x128x128_16x16_32x32_2x2_8x32x1_8x32x1_1x32x1x8_8_1x1_intrawave_v3,664.97,1480.85,0.0
gfx950,256,2475,8192,512,ck,0,0,29.6467,a8w8_blockscale_1x128x128_256x128x128x128_16x16_32x32_2x2_8x32x1_8x32x1_1x32x1x8_8_1x1_intrawave_v3,700.31,1552.01,0.0
gfx950,256,2341,8192,512,ck,0,0,29.6519,a8w8_blockscale_1x128x128_256x128x128x128_16x16_32x32_2x2_8x32x1_8x32x1_1x32x1x8_8_1x1_intrawave_v3,662.28,1475.38,0.0
gfx950,256,2469,8192,512,ck,0,0,29.6719,a8w8_blockscale_1x128x128_256x128x128x128_16x16_32x32_2x2_8x32x1_8x32x1_1x32x1x8_8_1x1_intrawave_v3,698.02,1547.27,0.0
gfx950,256,2348,8192,512,ck,0,0,29.6908,a8w8_blockscale_1x128x128_256x128x128x128_16x16_32x32_2x2_8x32x1_8x32x1_1x32x1x8_8_1x1_intrawave_v3,663.39,1477.43,0.0
gfx950,256,2389,8192,512,ck,0,0,29.6999,a8w8_blockscale_1x128x128_256x128x128x128_16x16_32x32_2x2_8x32x1_8x32x1_1x32x1x8_8_1x1_intrawave_v3,674.76,1500.3,0.0
gfx950,256,2353,8192,512,ck,0,0,29.705,a8w8_blockscale_1x128x128_256x128x128x128_16x16_32x32_2x2_8x32x1_8x32x1_1x32x1x8_8_1x1_intrawave_v3,664.48,1479.57,0.0
gfx950,256,2485,8192,512,ck,0,0,29.714,a8w8_blockscale_1x128x128_256x128x128x128_16x16_32x32_2x2_8x32x1_8x32x1_1x32x1x8_8_1x1_intrawave_v3,701.54,1554.18,0.0
gfx950,256,2349,8192,512,ck,0,0,29.715,a8w8_blockscale_1x128x128_256x128x128x128_16x16_32x32_2x2_8x32x1_8x32x1_1x32x1x8_8_1x1_intrawave_v3,663.13,1476.8,0.0
gfx950,256,2328,8192,512,ck,0,0,29.7189,a8w8_blockscale_1x128x128_256x128x128x128_16x16_32x32_2x2_8x32x1_8x32x1_1x32x1x8_8_1x1_intrawave_v3,657.11,1464.66,0.0
gfx950,256,2336,8192,512,ck,0,0,29.7274,a8w8_blockscale_1x128x128_256x128x128x128_16x16_32x32_2x2_8x32x1_8x32x1_1x32x1x8_8_1x1_intrawave_v3,659.18,1468.79,0.0
gfx950,256,2529,8192,512,ck,0,0,29.7295,a8w8_blockscale_1x128x128_256x128x128x128_16x16_32x32_2x2_8x32x1_8x32x1_1x32x1x8_8_1x1_intrawave_v3,713.59,1578.37,0.0
