aiter/configs/a8w8_tuned_gemm.csv
cu_num,M,N,K,q_dtype_w,kernelId,splitK,us,kernelName,tflops,bw,errRatio
80,1,1280,8192,torch.int8,34,0,20.5611,a8w8_rowwise_256x16x64x512_16x16_1x1_32x8x1_32x8x1_1x16x1x16_4x4x1_1x1_intrawave_v3,1.02,510.5,0.0
80,32,1280,8192,torch.int8,34,0,19.9841,a8w8_rowwise_256x16x64x512_16x16_1x1_32x8x1_32x8x1_1x16x1x16_4x4x1_1x1_intrawave_v3,33.58,541.92,0.0
80,64,1280,8192,torch.int8,34,0,19.6589,a8w8_rowwise_256x16x64x512_16x16_1x1_32x8x1_32x8x1_1x16x1x16_4x4x1_1x1_intrawave_v3,68.27,568.39,0.0
80,128,1280,8192,torch.int8,30,0,23.3376,a8w8_rowwise_256x32x64x512_16x16_1x2_32x8x1_32x8x1_1x32x1x8_8x8x1_1x2_intrawave_v3,115.02,508.28,0.0
80,192,1280,8192,torch.int8,23,0,33.0028,a8w8_rowwise_256x64x64x512_32x32_1x1_32x8x1_32x8x1_1x32x1x8_8x8x1_1x1_intrawave_v3,122.01,380.28,0.0
80,256,1280,8192,torch.int8,23,0,33.3204,a8w8_rowwise_256x64x64x512_32x32_1x1_32x8x1_32x8x1_1x32x1x8_8x8x1_1x1_intrawave_v3,161.12,397.3,0.0
80,320,1280,8192,torch.int8,21,0,54.4822,a8w8_rowwise_256x64x128x256_32x32_1x2_16x16x1_16x16x1_1x32x1x8_8x8x1_1x1_intrawave_v3,123.18,255.61,0.0
80,512,1280,8192,torch.int8,21,0,55.0378,a8w8_rowwise_256x64x128x256_32x32_1x2_16x16x1_16x16x1_1x32x1x8_8x8x1_1x1_intrawave_v3,195.09,290.54,0.0
80,1024,1280,8192,torch.int8,13,0,88.6516,a8w8_rowwise_256x128x128x128_32x32_2x2_8x32x1_8x32x1_1x32x1x8_8x8x1_1x1_intrawave_v3,242.24,242.48,0.0
80,2048,1280,8192,torch.int8,13,0,140.7575,a8w8_rowwise_256x128x128x128_32x32_2x2_8x32x1_8x32x1_1x32x1x8_8x8x1_1x1_intrawave_v3,305.13,230.94,0.0
80,4096,1280,8192,torch.int8,13,0,275.3109,a8w8_rowwise_256x128x128x128_32x32_2x2_8x32x1_8x32x1_1x32x1x8_8x8x1_1x1_intrawave_v3,312.01,198.05,0.0
80,8192,1280,8192,torch.int8,13,0,545.0371,a8w8_rowwise_256x128x128x128_32x32_2x2_8x32x1_8x32x1_1x32x1x8_8x8x1_1x1_intrawave_v3,315.21,180.84,0.0
80,16384,1280,8192,torch.int8,13,0,1075.9373,a8w8_rowwise_256x128x128x128_32x32_2x2_8x32x1_8x32x1_1x32x1x8_8x8x1_1x1_intrawave_v3,319.35,173.47,0.0
80,1,8192,1024,torch.int8,78,0,9.1327,a8w8_rowwise_64x16x16x128_16x16_1x1_8x8x1_8x8x1_1x16x1x4_4x4x1_1x1_interwave_v2,1.84,920.43,0.0
80,32,8192,1024,torch.int8,28,0,9.9382,a8w8_rowwise_256x32x128x256_32x32_1x1_16x16x1_16x16x1_1x32x1x8_8x8x1_1x1_intrawave_v3,54.02,900.13,0.0
80,64,8192,1024,torch.int8,21,0,13.6554,a8w8_rowwise_256x64x128x256_32x32_1x2_16x16x1_16x16x1_1x32x1x8_8x8x1_1x1_intrawave_v3,78.63,695.89,0.0
80,128,8192,1024,torch.int8,45,0,20.3684,a8w8_rowwise_256x128x64x128_32x32_2x1_8x32x1_8x32x1_1x32x1x8_8x8x1_1x1_intrawave_v3,105.43,521.24,0.0
80,192,8192,1024,torch.int8,47,0,26.1312,a8w8_rowwise_256x64x64x128_32x32_1x1_8x32x1_8x32x1_1x32x1x8_8x8x1_1x1_intrawave_v3,123.27,448.92,0.0
80,256,8192,1024,torch.int8,13,0,29.7436,a8w8_rowwise_256x128x128x128_32x32_2x2_8x32x1_8x32x1_1x32x1x8_8x8x1_1x1_intrawave_v3,144.4,431.86,0.0
80,320,8192,1024,torch.int8,47,0,39.6412,a8w8_rowwise_256x64x64x128_32x32_1x1_8x32x1_8x32x1_1x32x1x8_8x8x1_1x1_intrawave_v3,135.43,352.14,0.0
80,512,8192,1024,torch.int8,13,0,52.947,a8w8_rowwise_256x128x128x128_32x32_2x2_8x32x1_8x32x1_1x32x1x8_8x8x1_1x1_intrawave_v3,162.24,326.77,0.0
80,1024,8192,1024,torch.int8,13,0,90.2628,a8w8_rowwise_256x128x128x128_32x32_2x2_8x32x1_8x32x1_1x32x1x8_8x8x1_1x1_intrawave_v3,190.33,290.42,0.0
80,2048,8192,1024,torch.int8,41,0,165.9552,a8w8_rowwise_256x128x128x128_32x32_2x2_8x32x1_8x32x1_1x32x1x8_8x8x1_1x1_intrawave_v5,207.04,265.37,0.0
80,4096,8192,1024,torch.int8,13,0,305.9089,a8w8_rowwise_256x128x128x128_32x32_2x2_8x32x1_8x32x1_1x32x1x8_8x8x1_1x1_intrawave_v3,224.64,260.51,0.0
80,8192,8192,1024,torch.int8,13,0,598.5803,a8w8_rowwise_256x128x128x128_32x32_2x2_8x32x1_8x32x1_1x32x1x8_8x8x1_1x1_intrawave_v3,229.61,252.26,0.0
80,16384,8192,1024,torch.int8,13,0,1176.7808,a8w8_rowwise_256x128x128x128_32x32_2x2_8x32x1_8x32x1_1x32x1x8_8x8x1_1x1_intrawave_v3,233.58,249.5,0.0
256,1,100,5120,torch.int8,34,0,8.7502,a8w8_rowwise_256x16x64x512_16x16_1x1_32x8x1_32x8x1_1x16x1x16_4x4x1_1x1_intrawave_v3,0.12,59.12,0.0
256,16,100,5120,torch.int8,34,0,8.7447,a8w8_rowwise_256x16x64x512_16x16_1x1_32x8x1_32x8x1_1x16x1x16_4x4x1_1x1_intrawave_v3,1.87,68.28,0.0
256,32,100,5120,torch.int8,34,0,9.2459,a8w8_rowwise_256x16x64x512_16x16_1x1_32x8x1_32x8x1_1x16x1x16_4x4x1_1x1_intrawave_v3,3.54,73.79,0.0
256,64,100,5120,torch.int8,34,0,9.6716,a8w8_rowwise_256x16x64x512_16x16_1x1_32x8x1_32x8x1_1x16x1x16_4x4x1_1x1_intrawave_v3,6.78,88.14,0.0
256,128,100,5120,torch.int8,34,0,10.6683,a8w8_rowwise_256x16x64x512_16x16_1x1_32x8x1_32x8x1_1x16x1x16_4x4x1_1x1_intrawave_v3,12.29,111.82,0.0
256,256,100,5120,torch.int8,34,0,10.9556,a8w8_rowwise_256x16x64x512_16x16_1x1_32x8x1_32x8x1_1x16x1x16_4x4x1_1x1_intrawave_v3,23.93,171.05,0.0
256,512,100,5120,torch.int8,34,0,11.1055,a8w8_rowwise_256x16x64x512_16x16_1x1_32x8x1_32x8x1_1x16x1x16_4x4x1_1x1_intrawave_v3,47.21,291.37,0.0
256,1024,100,5120,torch.int8,34,0,11.6746,a8w8_rowwise_256x16x64x512_16x16_1x1_32x8x1_32x8x1_1x16x1x16_4x4x1_1x1_intrawave_v3,89.82,510.48,0.0
256,2048,100,5120,torch.int8,34,0,11.6595,a8w8_rowwise_256x16x64x512_16x16_1x1_32x8x1_32x8x1_1x16x1x16_4x4x1_1x1_intrawave_v3,179.87,978.37,0.0
256,4096,100,5120,torch.int8,34,0,16.1651,a8w8_rowwise_256x16x64x512_16x16_1x1_32x8x1_32x8x1_1x16x1x16_4x4x1_1x1_intrawave_v3,259.47,1379.68,0.0
256,8192,100,5120,torch.int8,29,0,27.2037,a8w8_rowwise_256x32x96x256_16x16_1x3_16x16x1_16x16x1_1x32x1x8_4x4x1_1x1_intrawave_v3,308.36,1620.86,0.0
256,16384,100,5120,torch.int8,27,0,42.6746,a8w8_rowwise_256x32x160x256_16x16_1x5_16x16x1_16x16x1_1x32x1x8_4x4x1_1x1_intrawave_v3,393.14,2054.5,0.0
256,32768,100,5120,torch.int8,27,0,78.5325,a8w8_rowwise_256x32x160x256_16x16_1x5_16x16x1_16x16x1_1x32x1x8_4x4x1_1x1_intrawave_v3,427.27,2226.31,0.0
256,64,192,1024,torch.int8,77,0,4.1582,a8w8_rowwise_64x16x16x64_16x16_1x1_4x16x1_4x16x1_1x16x1x4_4x4x1_1x1_interwave_v2,6.05,68.95,0.0
256,1,200,5120,torch.int8,34,0,9.0193,a8w8_rowwise_256x16x64x512_16x16_1x1_32x8x1_32x8x1_1x16x1x16_4x4x1_1x1_intrawave_v3,0.23,114.15,0.0
256,16,200,5120,torch.int8,34,0,10.4705,a8w8_rowwise_256x16x64x512_16x16_1x1_32x8x1_32x8x1_1x16x1x16_4x4x1_1x1_intrawave_v3,3.13,106.23,0.0
256,32,200,5120,torch.int8,34,0,10.4825,a8w8_rowwise_256x16x64x512_16x16_1x1_32x8x1_32x8x1_1x16x1x16_4x4x1_1x1_intrawave_v3,6.25,114.54,0.0
256,64,200,5120,torch.int8,34,0,9.9254,a8w8_rowwise_256x16x64x512_16x16_1x1_32x8x1_32x8x1_1x16x1x16_4x4x1_1x1_intrawave_v3,13.21,138.76,0.0
256,128,200,5120,torch.int8,34,0,9.652,a8w8_rowwise_256x16x64x512_16x16_1x1_32x8x1_32x8x1_1x16x1x16_4x4x1_1x1_intrawave_v3,27.16,179.3,0.0
256,256,200,5120,torch.int8,34,0,9.8147,a8w8_rowwise_256x16x64x512_16x16_1x1_32x8x1_32x8x1_1x16x1x16_4x4x1_1x1_intrawave_v3,53.42,248.31,0.0
256,512,200,5120,torch.int8,34,0,11.8774,a8w8_rowwise_256x16x64x512_16x16_1x1_32x8x1_32x8x1_1x16x1x16_4x4x1_1x1_intrawave_v3,88.28,324.17,0.0
256,1024,200,5120,torch.int8,34,0,12.0055,a8w8_rowwise_256x16x64x512_16x16_1x1_32x8x1_32x8x1_1x16x1x16_4x4x1_1x1_intrawave_v3,174.68,556.12,0.0
256,2048,200,5120,torch.int8,30,0,13.0876,a8w8_rowwise_256x32x64x512_16x16_1x2_32x8x1_32x8x1_1x32x1x8_8x8x1_1x2_intrawave_v3,320.48,942.03,0.0
256,4096,200,5120,torch.int8,23,0,15.2341,a8w8_rowwise_256x64x64x512_32x32_1x1_32x8x1_32x8x1_1x32x1x8_8x8x1_1x1_intrawave_v3,550.65,1551.38,0.0
256,8192,200,5120,torch.int8,21,0,25.2734,a8w8_rowwise_256x64x128x256_32x32_1x2_16x16x1_16x16x1_1x32x1x8_8x8x1_1x1_intrawave_v3,663.83,1829.74,0.0
256,16384,200,5120,torch.int8,21,0,44.0772,a8w8_rowwise_256x64x128x256_32x32_1x2_16x16x1_16x16x1_1x32x1x8_8x8x1_1x1_intrawave_v3,761.27,2075.08,0.0
256,32768,200,5120,torch.int8,21,0,82.0643,a8w8_rowwise_256x64x128x256_32x32_1x2_16x16x1_16x16x1_1x32x1x8_8x8x1_1x1_intrawave_v3,817.76,2216.6,0.0
256,1,800,5120,torch.int8,34,0,11.5471,a8w8_rowwise_256x16x64x512_16x16_1x1_32x8x1_32x8x1_1x16x1x16_4x4x1_1x1_intrawave_v3,0.71,355.3,0.0
256,16,800,5120,torch.int8,34,0,11.7219,a8w8_rowwise_256x16x64x512_16x16_1x1_32x8x1_32x8x1_1x16x1x16_4x4x1_1x1_intrawave_v3,11.18,358.6,0.0
256,32,800,5120,torch.int8,34,0,11.9874,a8w8_rowwise_256x16x64x512_16x16_1x1_32x8x1_32x8x1_1x16x1x16_4x4x1_1x1_intrawave_v3,21.87,359.63,0.0
256,64,800,5120,torch.int8,34,0,12.0241,a8w8_rowwise_256x16x64x512_16x16_1x1_32x8x1_32x8x1_1x16x1x16_4x4x1_1x1_intrawave_v3,43.6,376.42,0.0
256,128,800,5120,torch.int8,34,0,11.5628,a8w8_rowwise_256x16x64x512_16x16_1x1_32x8x1_32x8x1_1x16x1x16_4x4x1_1x1_intrawave_v3,90.69,428.63,0.0
256,256,800,5120,torch.int8,34,0,11.8423,a8w8_rowwise_256x16x64x512_16x16_1x1_32x8x1_32x8x1_1x16x1x16_4x4x1_1x1_intrawave_v3,177.09,491.15,0.0
256,512,800,5120,torch.int8,30,0,13.1908,a8w8_rowwise_256x32x64x512_16x16_1x2_32x8x1_32x8x1_1x32x1x8_8x8x1_1x2_intrawave_v3,317.97,571.36,0.0
256,1024,800,5120,torch.int8,23,0,15.5235,a8w8_rowwise_256x64x64x512_32x32_1x1_32x8x1_32x8x1_1x32x1x8_8x8x1_1x1_intrawave_v3,540.38,707.14,0.0
256,2048,800,5120,torch.int8,23,0,24.3923,a8w8_rowwise_256x64x64x512_32x32_1x1_32x8x1_32x8x1_1x32x1x8_8x8x1_1x1_intrawave_v3,687.81,732.14,0.0
256,4096,800,5120,torch.int8,15,0,36.4711,a8w8_rowwise_256x128x64x256_32x32_2x1_16x16x1_16x16x1_1x32x1x8_8x8x1_1x1_intrawave_v3,920.03,867.02,0.0
256,8192,800,5120,torch.int8,41,0,65.9722,a8w8_rowwise_256x128x128x128_32x32_2x2_8x32x1_8x32x1_1x32x1x8_8x8x1_1x1_intrawave_v5,1017.23,896.53,0.0
256,16384,800,5120,torch.int8,1,0,111.2384,a8w8_rowwise_256x256x256x128_32x32_4x4_8x32x1_8x32x1_1x32x1x8_8x8x1_1x1_intrawave_v3,1206.58,1026.59,0.0
256,32768,800,5120,torch.int8,1,0,216.0528,a8w8_rowwise_256x256x256x128_32x32_4x4_8x32x1_8x32x1_1x32x1x8_8x8x1_1x1_intrawave_v3,1242.45,1038.16,0.0
256,1,1024,2048,torch.float8_e4m3fn,34,0,5.8562,a8w8_rowwise_256x16x64x512_16x16_1x1_32x8x1_32x8x1_1x16x1x16_4x4x1_1x1_intrawave_v3,0.72,358.81,0.0
256,2,1024,2048,torch.float8_e4m3fn,79,0,5.6891,a8w8_rowwise_128x16x32x128_16x16_1x1_8x16x1_8x16x1_1x16x1x8_4x4x1_1x1_interwave_v2,1.47,370.07,0.0
256,4,1024,2048,torch.float8_e4m3fn,79,0,5.6846,a8w8_rowwise_128x16x32x128_16x16_1x1_8x16x1_8x16x1_1x16x1x8_4x4x1_1x1_interwave_v2,2.95,371.8,0.0
256,8,1024,2048,torch.float8_e4m3fn,76,0,5.7966,a8w8_rowwise_128x32x16x128_16x16_1x1_8x16x1_8x16x1_1x16x1x8_2x2x1_1x1_interwave_v2,5.79,367.44,0.0
256,16,1024,2048,torch.float8_e4m3fn,34,0,5.5359,a8w8_rowwise_256x16x64x512_16x16_1x1_32x8x1_32x8x1_1x16x1x16_4x4x1_1x1_intrawave_v3,12.12,390.67,0.0
256,16,1024,8192,torch.float8_e4m3fn,79,3,8.199,a8w8_rowwise_128x16x32x128_16x16_1x1_8x16x1_8x16x1_1x16x1x8_4x4x1_1x1_interwave_v2,32.74,1043.11,0.1616
256,32,1024,2048,torch.float8_e4m3fn,34,0,5.145,a8w8_rowwise_256x16x64x512_16x16_1x1_32x8x1_32x8x1_1x16x1x16_4x4x1_1x1_intrawave_v3,26.09,433.09,0.0
256,32,1024,8192,torch.float8_e4m3fn,79,3,8.7911,a8w8_rowwise_128x16x32x128_16x16_1x1_8x16x1_8x16x1_1x16x1x8_4x4x1_1x1_interwave_v2,61.07,991.49,0.1586
256,48,1024,2048,torch.float8_e4m3fn,34,0,5.1946,a8w8_rowwise_256x16x64x512_16x16_1x1_32x8x1_32x8x1_1x16x1x16_4x4x1_1x1_intrawave_v3,38.76,441.57,0.0
256,64,1024,2048,torch.float8_e4m3fn,34,0,5.23,a8w8_rowwise_256x16x64x512_16x16_1x1_32x8x1_32x8x1_1x16x1x16_4x4x1_1x1_intrawave_v3,51.33,451.11,0.0
256,64,1024,8192,torch.float8_e4m3fn,34,2,9.0741,a8w8_rowwise_256x16x64x512_16x16_1x1_32x8x1_32x8x1_1x16x1x16_4x4x1_1x1_intrawave_v3,118.33,996.68,0.1083
256,80,1024,2048,torch.float8_e4m3fn,34,0,5.3051,a8w8_rowwise_256x16x64x512_16x16_1x1_32x8x1_32x8x1_1x16x1x16_4x4x1_1x1_intrawave_v3,63.25,457.08,0.0
256,96,1024,2048,torch.float8_e4m3fn,34,0,5.3591,a8w8_rowwise_256x16x64x512_16x16_1x1_32x8x1_32x8x1_1x16x1x16_4x4x1_1x1_intrawave_v3,75.13,464.7,0.0
256,112,1024,2048,torch.float8_e4m3fn,34,0,5.3771,a8w8_rowwise_256x16x64x512_16x16_1x1_32x8x1_32x8x1_1x16x1x16_4x4x1_1x1_intrawave_v3,87.36,475.33,0.0
256,128,1024,2048,torch.float8_e4m3fn,34,0,5.3686,a8w8_rowwise_256x16x64x512_16x16_1x1_32x8x1_32x8x1_1x16x1x16_4x4x1_1x1_intrawave_v3,100.0,488.29,0.0
256,128,1024,8192,torch.float8_e4m3fn,34,2,12.0372,a8w8_rowwise_256x16x64x512_16x16_1x1_32x8x1_32x8x1_1x16x1x16_4x4x1_1x1_intrawave_v3,178.4,805.78,0.1084
256,256,1024,2048,torch.float8_e4m3fn,34,0,5.9482,a8w8_rowwise_256x16x64x512_16x16_1x1_32x8x1_32x8x1_1x16x1x16_4x4x1_1x1_intrawave_v3,180.52,528.85,0.0
256,256,1024,8192,torch.float8_e4m3fn,34,0,14.7059,a8w8_rowwise_256x16x64x512_16x16_1x1_32x8x1_32x8x1_1x16x1x16_4x4x1_1x1_intrawave_v3,292.06,748.68,0.0
256,512,1024,2048,torch.float8_e4m3fn,30,0,7.1945,a8w8_rowwise_256x32x64x512_16x16_1x2_32x8x1_32x8x1_1x32x1x8_8x8x1_1x2_intrawave_v3,298.49,582.99,0.0
256,667,1024,2048,torch.float8_e4m3fn,23,0,8.3712,a8w8_rowwise_256x64x64x512_32x32_1x1_32x8x1_32x8x1_1x32x1x8_8x8x1_1x1_intrawave_v3,334.19,576.88,0.0
256,671,1024,2048,torch.float8_e4m3fn,23,0,8.5467,a8w8_rowwise_256x64x64x512_32x32_1x1_32x8x1_32x8x1_1x32x1x8_8x8x1_1x1_intrawave_v3,329.29,566.95,0.0
256,931,1024,2048,torch.float8_e4m3fn,23,0,9.1791,a8w8_rowwise_256x64x64x512_32x32_1x1_32x8x1_32x8x1_1x32x1x8_8x8x1_1x1_intrawave_v3,425.41,643.91,0.0
256,1024,1024,2048,torch.float8_e4m3fn,23,0,7.9823,a8w8_rowwise_256x64x64x512_32x32_1x1_32x8x1_32x8x1_1x32x1x8_8x8x1_1x1_intrawave_v3,538.06,788.18,0.0
256,1025,1024,2048,torch.float8_e4m3fn,21,0,10.7241,a8w8_rowwise_256x64x128x256_32x32_1x2_16x16x1_16x16x1_1x32x1x8_8x8x1_1x1_intrawave_v3,400.89,587.05,0.0
256,1027,1024,2048,torch.float8_e4m3fn,22,0,10.6959,a8w8_rowwise_256x64x96x256_16x16_2x3_16x16x1_16x16x1_1x64x1x4_8x8x1_2x1_intrawave_v3,402.73,589.36,0.0
256,1031,1024,2048,torch.float8_e4m3fn,22,0,10.7806,a8w8_rowwise_256x64x96x256_16x16_2x3_16x16x1_16x16x1_1x64x1x4_8x8x1_2x1_intrawave_v3,401.12,586.25,0.0
256,1039,1024,2048,torch.float8_e4m3fn,21,0,10.7786,a8w8_rowwise_256x64x128x256_32x32_1x2_16x16x1_16x16x1_1x32x1x8_8x8x1_1x1_intrawave_v3,404.31,589.4,0.0
256,1040,1024,2048,torch.float8_e4m3fn,22,0,10.7763,a8w8_rowwise_256x64x96x256_16x16_2x3_16x16x1_16x16x1_1x64x1x4_8x8x1_2x1_intrawave_v3,404.78,589.9,0.0
256,1041,1024,2048,torch.float8_e4m3fn,22,0,10.4524,a8w8_rowwise_256x64x96x256_16x16_2x3_16x16x1_16x16x1_1x64x1x4_8x8x1_2x1_intrawave_v3,417.73,608.58,0.0
256,1072,1024,2048,torch.float8_e4m3fn,22,0,10.5702,a8w8_rowwise_256x64x96x256_16x16_2x3_16x16x1_16x16x1_1x64x1x4_8x8x1_2x1_intrawave_v3,425.37,613.81,0.0
256,1073,1024,2048,torch.float8_e4m3fn,22,0,10.7138,a8w8_rowwise_256x64x96x256_16x16_2x3_16x16x1_16x16x1_1x64x1x4_8x8x1_2x1_intrawave_v3,420.06,605.96,0.0
256,1077,1024,2048,torch.float8_e4m3fn,22,0,10.7538,a8w8_rowwise_256x64x96x256_16x16_2x3_16x16x1_16x16x1_1x64x1x4_8x8x1_2x1_intrawave_v3,420.06,605.23,0.0
256,1091,1024,2048,torch.float8_e4m3fn,22,0,10.7048,a8w8_rowwise_256x64x96x256_16x16_2x3_16x16x1_16x16x1_1x64x1x4_8x8x1_2x1_intrawave_v3,427.47,613.36,0.0
256,1343,1024,2048,torch.float8_e4m3fn,22,0,10.7849,a8w8_rowwise_256x64x96x256_16x16_2x3_16x16x1_16x16x1_1x64x1x4_8x8x1_2x1_intrawave_v3,522.3,704.51,0.0
256,1688,1024,2048,torch.float8_e4m3fn,15,0,11.5787,a8w8_rowwise_256x128x64x256_32x32_2x1_16x16x1_16x16x1_1x32x1x8_8x8x1_1x1_intrawave_v3,611.47,778.26,0.0
256,2017,1024,2048,torch.float8_e4m3fn,15,0,11.7864,a8w8_rowwise_256x128x64x256_32x32_2x1_16x16x1_16x16x1_1x32x1x8_8x8x1_1x1_intrawave_v3,717.77,878.88,0.0
256,2048,1024,2048,torch.float8_e4m3fn,21,0,11.4131,a8w8_rowwise_256x64x128x256_32x32_1x2_16x16x1_16x16x1_1x32x1x8_8x8x1_1x1_intrawave_v3,752.64,918.75,0.0
256,2050,1024,2048,torch.float8_e4m3fn,14,0,13.7237,a8w8_rowwise_256x128x96x256_32x32_1x3_16x16x1_16x16x1_1x64x1x4_8x8x1_1x1_intrawave_v3,626.53,764.66,0.0
256,2063,1024,2048,torch.float8_e4m3fn,14,0,13.6981,a8w8_rowwise_256x128x96x256_32x32_1x3_16x16x1_16x16x1_1x64x1x4_8x8x1_1x1_intrawave_v3,631.68,769.98,0.0
256,2064,1024,2048,torch.float8_e4m3fn,14,0,13.6865,a8w8_rowwise_256x128x96x256_32x32_1x3_16x16x1_16x16x1_1x64x1x4_8x8x1_1x1_intrawave_v3,632.52,770.93,0.0
256,2099,1024,2048,torch.float8_e4m3fn,14,0,13.9058,a8w8_rowwise_256x128x96x256_32x32_1x3_16x16x1_16x16x1_1x64x1x4_8x8x1_1x1_intrawave_v3,633.11,769.08,0.0
256,2159,1024,2048,torch.float8_e4m3fn,14,0,13.8112,a8w8_rowwise_256x128x96x256_32x32_1x3_16x16x1_16x16x1_1x64x1x4_8x8x1_1x1_intrawave_v3,655.66,792.14,0.0
256,2160,1024,2048,torch.float8_e4m3fn,14,0,13.995,a8w8_rowwise_256x128x96x256_32x32_1x3_16x16x1_16x16x1_1x64x1x4_8x8x1_1x1_intrawave_v3,647.35,782.03,0.0
256,2313,1024,2048,torch.float8_e4m3fn,14,0,14.0783,a8w8_rowwise_256x128x96x256_32x32_1x3_16x16x1_16x16x1_1x64x1x4_8x8x1_1x1_intrawave_v3,689.1,821.92,0.0
256,2325,1024,2048,torch.float8_e4m3fn,14,0,14.2154,a8w8_rowwise_256x128x96x256_32x32_1x3_16x16x1_16x16x1_1x64x1x4_8x8x1_1x1_intrawave_v3,686.0,817.45,0.0
256,3072,1024,2048,torch.float8_e4m3fn,45,0,16.4996,a8w8_rowwise_256x128x64x128_32x32_2x1_8x32x1_8x32x1_1x32x1x8_8x8x1_1x1_intrawave_v3,780.92,889.72,0.0
256,3073,1024,2048,torch.float8_e4m3fn,15,0,16.9862,a8w8_rowwise_256x128x64x256_32x32_2x1_16x16x1_16x16x1_1x32x1x8_8x8x1_1x1_intrawave_v3,758.8,864.48,0.0
256,3182,1024,2048,torch.float8_e4m3fn,15,0,17.1226,a8w8_rowwise_256x128x64x256_32x32_2x1_16x16x1_16x16x1_1x32x1x8_8x8x1_1x1_intrawave_v3,779.45,883.66,0.0
256,3183,1024,2048,torch.float8_e4m3fn,21,0,17.2387,a8w8_rowwise_256x64x128x256_32x32_1x2_16x16x1_16x16x1_1x32x1x8_8x8x1_1x1_intrawave_v3,774.45,877.95,0.0
256,3847,1024,2048,torch.float8_e4m3fn,46,0,18.0859,a8w8_rowwise_256x64x128x128_32x32_1x2_8x32x1_8x32x1_1x32x1x8_8x8x1_1x1_intrawave_v3,892.16,987.2,0.0
256,4096,1024,2048,torch.float8_e4m3fn,41,0,16.9652,a8w8_rowwise_256x128x128x128_32x32_2x2_8x32x1_8x32x1_1x32x1x8_8x8x1_1x1_intrawave_v5,1012.65,1112.53,0.0
256,4111,1024,2048,torch.float8_e4m3fn,11,0,19.7425,a8w8_rowwise_256x128x160x128_32x32_1x5_8x32x1_8x32x1_1x64x1x4_8x8x1_1x1_intrawave_v3,873.38,959.14,0.0
256,4141,1024,2048,torch.float8_e4m3fn,11,0,19.7121,a8w8_rowwise_256x128x160x128_32x32_1x5_8x32x1_8x32x1_1x64x1x4_8x8x1_1x1_intrawave_v3,881.11,966.85,0.0
256,4142,1024,2048,torch.float8_e4m3fn,11,0,19.7385,a8w8_rowwise_256x128x160x128_32x32_1x5_8x32x1_8x32x1_1x64x1x4_8x8x1_1x1_intrawave_v3,880.15,965.77,0.0
256,4345,1024,2048,torch.float8_e4m3fn,11,0,20.162,a8w8_rowwise_256x128x160x128_32x32_1x5_8x32x1_8x32x1_1x64x1x4_8x8x1_1x1_intrawave_v3,903.89,986.72,0.0
256,5105,1024,2048,torch.float8_e4m3fn,6,0,21.8229,a8w8_rowwise_256x256x96x128_32x32_2x3_8x32x1_8x32x1_1x64x1x4_8x8x1_2x1_intrawave_v3,981.17,1054.27,0.0
256,5121,1024,2048,torch.float8_e4m3fn,6,0,21.5472,a8w8_rowwise_256x256x96x128_32x32_2x3_8x32x1_8x32x1_1x64x1x4_8x8x1_2x1_intrawave_v3,996.84,1070.8,0.0
256,5123,1024,2048,torch.float8_e4m3fn,14,0,21.8427,a8w8_rowwise_256x128x96x256_32x32_1x3_16x16x1_16x16x1_1x64x1x4_8x8x1_1x1_intrawave_v3,983.73,1056.69,0.0
256,5131,1024,2048,torch.float8_e4m3fn,14,0,21.7988,a8w8_rowwise_256x128x96x256_32x32_1x3_16x16x1_16x16x1_1x64x1x4_8x8x1_1x1_intrawave_v3,987.25,1060.32,0.0
256,5427,1024,2048,torch.float8_e4m3fn,6,0,22.0539,a8w8_rowwise_256x256x96x128_32x32_2x3_8x32x1_8x32x1_1x64x1x4_8x8x1_2x1_intrawave_v3,1032.13,1103.03,0.0
256,6113,1024,2048,torch.float8_e4m3fn,13,0,25.3592,a8w8_rowwise_256x128x128x128_32x32_2x2_8x32x1_8x32x1_1x32x1x8_8x8x1_1x1_intrawave_v3,1011.06,1070.07,0.0
256,6197,1024,2048,torch.float8_e4m3fn,13,0,25.476,a8w8_rowwise_256x128x128x128_32x32_2x2_8x32x1_8x32x1_1x32x1x8_8x8x1_1x1_intrawave_v3,1020.26,1078.66,0.0
256,6409,1024,2048,torch.float8_e4m3fn,13,0,25.766,a8w8_rowwise_256x128x128x128_32x32_2x2_8x32x1_8x32x1_1x32x1x8_8x8x1_1x1_intrawave_v3,1043.29,1100.23,0.0
256,7121,1024,2048,torch.float8_e4m3fn,13,0,26.6376,a8w8_rowwise_256x128x128x128_32x32_2x2_8x32x1_8x32x1_1x32x1x8_8x8x1_1x1_intrawave_v3,1121.26,1173.71,0.0
256,7168,1024,2048,torch.float8_e4m3fn,13,0,25.6788,a8w8_rowwise_256x128x128x128_32x32_2x2_8x32x1_8x32x1_1x32x1x8_8x8x1_1x1_intrawave_v3,1170.8,1225.03,0.0
256,7169,1024,2048,torch.float8_e4m3fn,13,0,27.1524,a8w8_rowwise_256x128x128x128_32x32_2x2_8x32x1_8x32x1_1x32x1x8_8x8x1_1x1_intrawave_v3,1107.41,1158.7,0.0
256,7172,1024,2048,torch.float8_e4m3fn,13,0,26.9601,a8w8_rowwise_256x128x128x128_32x32_2x2_8x32x1_8x32x1_1x32x1x8_8x8x1_1x1_intrawave_v3,1115.78,1167.42,0.0
256,7176,1024,2048,torch.float8_e4m3fn,13,0,27.0988,a8w8_rowwise_256x128x128x128_32x32_2x2_8x32x1_8x32x1_1x32x1x8_8x8x1_1x1_intrawave_v3,1110.69,1162.05,0.0
256,7177,1024,2048,torch.float8_e4m3fn,35,0,27.5544,a8w8_rowwise_256x128x128x128_32x32_2x2_8x32x1_8x32x1_1x32x1x8_8x8x1_1x1_intrawave_v4,1092.48,1142.98,0.0
256,7178,1024,2048,torch.float8_e4m3fn,13,0,27.3713,a8w8_rowwise_256x128x128x128_32x32_2x2_8x32x1_8x32x1_1x32x1x8_8x8x1_1x1_intrawave_v3,1099.94,1150.78,0.0
256,7179,1024,2048,torch.float8_e4m3fn,44,0,27.1523,a8w8_rowwise_256x128x128x128_32x32_2x2_8x32x1_8x32x1_1x32x1x8_8x8x1_1x1_interwave_v1,1108.96,1160.21,0.0
256,7183,1024,2048,torch.float8_e4m3fn,35,0,26.937,a8w8_rowwise_256x128x128x128_32x32_2x2_8x32x1_8x32x1_1x32x1x8_8x8x1_1x1_intrawave_v4,1118.45,1170.09,0.0
256,7184,1024,2048,torch.float8_e4m3fn,13,0,27.2185,a8w8_rowwise_256x128x128x128_32x32_2x2_8x32x1_8x32x1_1x32x1x8_8x8x1_1x1_intrawave_v3,1107.04,1158.14,0.0
256,7209,1024,2048,torch.float8_e4m3fn,13,0,27.1248,a8w8_rowwise_256x128x128x128_32x32_2x2_8x32x1_8x32x1_1x32x1x8_8x8x1_1x1_intrawave_v3,1114.73,1165.92,0.0
256,7210,1024,2048,torch.float8_e4m3fn,13,0,27.5497,a8w8_rowwise_256x128x128x128_32x32_2x2_8x32x1_8x32x1_1x32x1x8_8x8x1_1x1_intrawave_v3,1097.69,1148.08,0.0
256,7211,1024,2048,torch.float8_e4m3fn,13,0,27.1793,a8w8_rowwise_256x128x128x128_32x32_2x2_8x32x1_8x32x1_1x32x1x8_8x8x1_1x1_intrawave_v3,1112.8,1163.88,0.0
256,7217,1024,2048,torch.float8_e4m3fn,44,0,27.2513,a8w8_rowwise_256x128x128x128_32x32_2x2_8x32x1_8x32x1_1x32x1x8_8x8x1_1x1_interwave_v1,1110.78,1161.71,0.0
256,7273,1024,2048,torch.float8_e4m3fn,44,0,27.5365,a8w8_rowwise_256x128x128x128_32x32_2x2_8x32x1_8x32x1_1x32x1x8_8x8x1_1x1_interwave_v1,1107.81,1158.0,0.0
256,7274,1024,2048,torch.float8_e4m3fn,13,0,27.1633,a8w8_rowwise_256x128x128x128_32x32_2x2_8x32x1_8x32x1_1x32x1x8_8x8x1_1x1_intrawave_v3,1123.18,1174.06,0.0
256,7391,1024,2048,torch.float8_e4m3fn,35,0,27.2381,a8w8_rowwise_256x128x128x128_32x32_2x2_8x32x1_8x32x1_1x32x1x8_8x8x1_1x1_intrawave_v4,1138.12,1188.43,0.0
256,7393,1024,2048,torch.float8_e4m3fn,35,0,27.6009,a8w8_rowwise_256x128x128x128_32x32_2x2_8x32x1_8x32x1_1x32x1x8_8x8x1_1x1_intrawave_v4,1123.46,1173.11,0.0
256,7715,1024,2048,torch.float8_e4m3fn,13,0,27.8209,a8w8_rowwise_256x128x128x128_32x32_2x2_8x32x1_8x32x1_1x32x1x8_8x8x1_1x1_intrawave_v3,1163.12,1211.24,0.0
256,7753,1024,2048,torch.float8_e4m3fn,13,0,27.8397,a8w8_rowwise_256x128x128x128_32x32_2x2_8x32x1_8x32x1_1x32x1x8_8x8x1_1x1_intrawave_v3,1168.06,1216.01,0.0
256,7819,1024,2048,torch.float8_e4m3fn,44,0,28.2611,a8w8_rowwise_256x128x128x128_32x32_2x2_8x32x1_8x32x1_1x32x1x8_8x8x1_1x1_interwave_v1,1160.44,1207.45,0.0
256,8099,1024,2048,torch.float8_e4m3fn,13,0,28.7865,a8w8_rowwise_256x128x128x128_32x32_2x2_8x32x1_8x32x1_1x32x1x8_8x8x1_1x1_intrawave_v3,1180.06,1225.25,0.0
256,8129,1024,2048,torch.float8_e4m3fn,13,0,28.8045,a8w8_rowwise_256x128x128x128_32x32_2x2_8x32x1_8x32x1_1x32x1x8_8x8x1_1x1_intrawave_v3,1183.69,1228.75,0.0
256,8188,1024,2048,torch.float8_e4m3fn,13,0,28.5485,a8w8_rowwise_256x128x128x128_32x32_2x2_8x32x1_8x32x1_1x32x1x8_8x8x1_1x1_intrawave_v3,1202.97,1248.23,0.0
256,8192,1024,2048,torch.float8_e4m3fn,13,0,27.5564,a8w8_rowwise_256x128x128x128_32x32_2x2_8x32x1_8x32x1_1x32x1x8_8x8x1_1x1_intrawave_v3,1246.89,1293.77,0.0
256,1,1280,8192,torch.float8_e4m3fn,79,3,7.6797,a8w8_rowwise_128x16x32x128_16x16_1x1_8x16x1_8x16x1_1x16x1x8_4x4x1_1x1_interwave_v2,2.73,1366.79,0.1344
256,1,1280,8192,torch.int8,34,0,17.6914,a8w8_rowwise_256x16x64x512_16x16_1x1_32x8x1_32x8x1_1x16x1x16_4x4x1_1x1_intrawave_v3,1.19,593.31,0.0
256,16,1280,8192,torch.float8_e4m3fn,79,3,8.8968,a8w8_rowwise_128x16x32x128_16x16_1x1_8x16x1_8x16x1_1x16x1x8_4x4x1_1x1_interwave_v2,37.72,1197.94,0.1643
256,16,1280,8192,torch.int8,34,0,15.0987,a8w8_rowwise_256x16x64x512_16x16_1x1_32x8x1_32x8x1_1x16x1x16_4x4x1_1x1_intrawave_v3,22.22,705.87,0.0
256,32,1280,8192,torch.float8_e4m3fn,60,3,9.3466,a8w8_rowwise_128x16x32x128_16x16_1x1_8x16x1_8x16x1_1x16x1x8_4x4x1_1x1_intrawave_v2,71.8,1158.69,0.1581
256,32,1280,8192,torch.int8,34,0,14.9955,a8w8_rowwise_256x16x64x512_16x16_1x1_32x8x1_32x8x1_1x16x1x16_4x4x1_1x1_intrawave_v3,44.75,722.2,0.0
256,64,1280,8192,torch.float8_e4m3fn,79,2,11.0767,a8w8_rowwise_128x16x32x128_16x16_1x1_8x16x1_8x16x1_1x16x1x8_4x4x1_1x1_interwave_v2,121.17,1008.77,0.1076
256,64,1280,8192,torch.int8,34,0,14.7691,a8w8_rowwise_256x16x64x512_16x16_1x1_32x8x1_32x8x1_1x16x1x16_4x4x1_1x1_intrawave_v3,90.88,756.57,0.0
256,128,1280,8192,torch.float8_e4m3fn,29,3,13.1684,a8w8_rowwise_256x32x96x256_16x16_1x3_16x16x1_16x16x1_1x32x1x8_4x4x1_1x1_intrawave_v3,203.85,900.79,0.1595
256,128,1280,8192,torch.int8,34,0,13.9827,a8w8_rowwise_256x16x64x512_16x16_1x1_32x8x1_32x8x1_1x16x1x16_4x4x1_1x1_intrawave_v3,191.98,848.34,0.0
256,192,1280,8192,torch.float8_e4m3fn,34,0,15.3959,a8w8_rowwise_256x16x64x512_16x16_1x1_32x8x1_32x8x1_1x16x1x16_4x4x1_1x1_intrawave_v3,261.53,815.16,0.0
256,192,1280,8192,torch.int8,34,0,14.6207,a8w8_rowwise_256x16x64x512_16x16_1x1_32x8x1_32x8x1_1x16x1x16_4x4x1_1x1_intrawave_v3,275.4,858.38,0.0
256,256,1280,8192,torch.float8_e4m3fn,30,0,17.037,a8w8_rowwise_256x32x64x512_16x16_1x2_32x8x1_32x8x1_1x32x1x8_8x8x1_1x2_intrawave_v3,315.12,777.03,0.0
256,256,1280,8192,torch.int8,30,0,16.2863,a8w8_rowwise_256x32x64x512_16x16_1x2_32x8x1_32x8x1_1x32x1x8_8x8x1_1x2_intrawave_v3,329.65,812.85,0.0
256,320,1280,8192,torch.float8_e4m3fn,30,0,17.4934,a8w8_rowwise_256x32x64x512_16x16_1x2_32x8x1_32x8x1_1x32x1x8_8x8x1_1x2_intrawave_v3,383.62,796.09,0.0
256,320,1280,8192,torch.int8,30,0,16.5161,a8w8_rowwise_256x32x64x512_16x16_1x2_32x8x1_32x8x1_1x32x1x8_8x8x1_1x2_intrawave_v3,406.32,843.2,0.0
256,512,1280,8192,torch.float8_e4m3fn,23,0,21.2265,a8w8_rowwise_256x64x64x512_32x32_1x1_32x8x1_32x8x1_1x32x1x8_8x8x1_1x1_intrawave_v3,505.85,753.34,0.0
256,512,1280,8192,torch.int8,28,0,23.2059,a8w8_rowwise_256x32x128x256_32x32_1x1_16x16x1_16x16x1_1x32x1x8_8x8x1_1x1_intrawave_v3,462.7,689.08,0.0
256,1024,1280,8192,torch.float8_e4m3fn,21,0,28.4599,a8w8_rowwise_256x64x128x256_32x32_1x2_16x16x1_16x16x1_1x32x1x8_8x8x1_1x1_intrawave_v3,754.56,755.3,0.0
256,1024,1280,8192,torch.int8,21,0,27.7294,a8w8_rowwise_256x64x128x256_32x32_1x2_16x16x1_16x16x1_1x32x1x8_8x8x1_1x1_intrawave_v3,774.44,775.2,0.0
256,2048,1280,8192,torch.float8_e4m3fn,14,0,36.1844,a8w8_rowwise_256x128x96x256_32x32_1x3_16x16x1_16x16x1_1x64x1x4_8x8x1_1x1_intrawave_v3,1186.97,898.34,0.0
256,2048,1280,8192,torch.int8,41,0,42.0169,a8w8_rowwise_256x128x128x128_32x32_2x2_8x32x1_8x32x1_1x32x1x8_8x8x1_1x1_intrawave_v5,1022.2,773.64,0.0
256,4096,1280,8192,torch.float8_e4m3fn,11,0,51.722,a8w8_rowwise_256x128x160x128_32x32_1x5_8x32x1_8x32x1_1x64x1x4_8x8x1_1x1_intrawave_v3,1660.79,1054.21,0.0
256,4096,1280,8192,torch.int8,11,0,59.932,a8w8_rowwise_256x128x160x128_32x32_1x5_8x32x1_8x32x1_1x64x1x4_8x8x1_1x1_intrawave_v3,1433.28,909.8,0.0
256,8192,1280,8192,torch.float8_e4m3fn,4,0,81.7243,a8w8_rowwise_256x256x160x128_32x32_2x5_8x32x1_8x32x1_1x64x1x4_8x8x1_2x1_intrawave_v3,2102.17,1206.08,0.0
256,8192,1280,8192,torch.int8,4,0,95.3807,a8w8_rowwise_256x256x160x128_32x32_2x5_8x32x1_8x32x1_1x64x1x4_8x8x1_2x1_intrawave_v3,1801.19,1033.4,0.0
256,16384,1280,8192,torch.float8_e4m3fn,4,0,174.2513,a8w8_rowwise_256x256x160x128_32x32_2x5_8x32x1_8x32x1_1x64x1x4_8x8x1_2x1_intrawave_v3,1971.85,1071.13,0.0
256,16384,1280,8192,torch.int8,4,0,178.1119,a8w8_rowwise_256x256x160x128_32x32_2x5_8x32x1_8x32x1_1x64x1x4_8x8x1_2x1_intrawave_v3,1929.11,1047.92,0.0
256,32768,1280,8192,torch.int8,1,0,339.8668,a8w8_rowwise_256x256x256x128_32x32_4x4_8x32x1_8x32x1_1x32x1x8_8x8x1_1x1_intrawave_v3,2021.95,1067.5,0.0
256,1,2048,512,torch.float8_e4m3fn,79,0,3.3714,a8w8_rowwise_128x16x32x128_16x16_1x1_8x16x1_8x16x1_1x16x1x8_4x4x1_1x1_interwave_v2,0.62,312.39,0.0
256,1,2048,4096,torch.float8_e4m3fn,34,0,10.3339,a8w8_rowwise_256x16x64x512_16x16_1x1_32x8x1_32x8x1_1x16x1x16_4x4x1_1x1_intrawave_v3,1.62,812.55,0.0
256,2,2048,512,torch.float8_e4m3fn,78,0,3.2854,a8w8_rowwise_64x16x16x128_16x16_1x1_8x8x1_8x8x1_1x16x1x4_4x4x1_1x1_interwave_v2,1.28,321.97,0.0
256,2,2048,4096,torch.float8_e4m3fn,34,0,10.3154,a8w8_rowwise_256x16x64x512_16x16_1x1_32x8x1_32x8x1_1x16x1x16_4x4x1_1x1_intrawave_v3,3.25,814.8,0.0
256,4,2048,512,torch.float8_e4m3fn,78,0,3.317,a8w8_rowwise_64x16x16x128_16x16_1x1_8x8x1_8x8x1_1x16x1x4_4x4x1_1x1_interwave_v2,2.53,321.68,0.0
256,4,2048,4096,torch.float8_e4m3fn,30,0,10.1272,a8w8_rowwise_256x32x64x512_16x16_1x2_32x8x1_32x8x1_1x32x1x8_8x8x1_1x2_intrawave_v3,6.63,831.56,0.0
256,8,2048,512,torch.float8_e4m3fn,78,0,3.315,a8w8_rowwise_64x16x16x128_16x16_1x1_8x8x1_8x8x1_1x16x1x4_4x4x1_1x1_interwave_v2,5.06,327.43,0.0
256,8,2048,4096,torch.float8_e4m3fn,34,0,9.9526,a8w8_rowwise_256x16x64x512_16x16_1x1_32x8x1_32x8x1_1x16x1x16_4x4x1_1x1_intrawave_v3,13.49,849.44,0.0
256,16,2048,512,torch.float8_e4m3fn,58,0,3.2714,a8w8_rowwise_64x16x16x64_16x16_1x1_4x16x1_4x16x1_1x16x1x4_4x4x1_1x1_intrawave_v2,10.26,343.07,0.0
256,16,2048,4096,torch.float8_e4m3fn,34,0,9.1917,a8w8_rowwise_256x16x64x512_16x16_1x1_32x8x1_32x8x1_1x16x1x16_4x4x1_1x1_intrawave_v3,29.2,926.89,0.0
256,32,2048,512,torch.float8_e4m3fn,78,0,3.3119,a8w8_rowwise_64x16x16x128_16x16_1x1_8x8x1_8x8x1_1x16x1x4_4x4x1_1x1_interwave_v2,20.26,361.13,0.0
256,32,2048,4096,torch.float8_e4m3fn,34,0,8.3664,a8w8_rowwise_256x16x64x512_16x16_1x1_32x8x1_32x8x1_1x16x1x16_4x4x1_1x1_intrawave_v3,64.17,1033.99,0.0
256,48,2048,512,torch.float8_e4m3fn,78,0,3.4122,a8w8_rowwise_64x16x16x128_16x16_1x1_8x8x1_8x8x1_1x16x1x4_4x4x1_1x1_interwave_v2,29.5,372.12,0.0
256,48,2048,4096,torch.float8_e4m3fn,34,0,8.3949,a8w8_rowwise_256x16x64x512_16x16_1x1_32x8x1_32x8x1_1x16x1x16_4x4x1_1x1_intrawave_v3,95.93,1046.09,0.0
256,64,2048,512,torch.float8_e4m3fn,79,0,3.4811,a8w8_rowwise_128x16x32x128_16x16_1x1_8x16x1_8x16x1_1x16x1x8_4x4x1_1x1_interwave_v2,38.56,385.94,0.0
256,64,2048,4096,torch.float8_e4m3fn,34,0,8.5607,a8w8_rowwise_256x16x64x512_16x16_1x1_32x8x1_32x8x1_1x16x1x16_4x4x1_1x1_intrawave_v3,125.43,1041.14,0.0
256,80,2048,512,torch.float8_e4m3fn,78,0,3.5445,a8w8_rowwise_64x16x16x128_16x16_1x1_8x8x1_8x8x1_1x16x1x4_4x4x1_1x1_interwave_v2,47.33,399.84,0.0
256,80,2048,4096,torch.float8_e4m3fn,34,0,8.9983,a8w8_rowwise_256x16x64x512_16x16_1x1_32x8x1_32x8x1_1x16x1x16_4x4x1_1x1_intrawave_v3,149.16,1005.08,0.0
256,96,2048,512,torch.float8_e4m3fn,78,0,3.5706,a8w8_rowwise_64x16x16x128_16x16_1x1_8x8x1_8x8x1_1x16x1x4_4x4x1_1x1_interwave_v2,56.38,417.56,0.0
256,96,2048,4096,torch.float8_e4m3fn,34,0,8.2305,a8w8_rowwise_256x16x64x512_16x16_1x1_32x8x1_32x8x1_1x16x1x16_4x4x1_1x1_intrawave_v3,195.69,1114.76,0.0
256,112,2048,512,torch.float8_e4m3fn,78,0,3.7724,a8w8_rowwise_64x16x16x128_16x16_1x1_8x8x1_8x8x1_1x16x1x4_4x4x1_1x1_interwave_v2,62.26,414.77,0.0
256,112,2048,4096,torch.float8_e4m3fn,34,0,8.9063,a8w8_rowwise_256x16x64x512_16x16_1x1_32x8x1_32x8x1_1x16x1x16_4x4x1_1x1_intrawave_v3,210.98,1044.89,0.0
256,128,2048,512,torch.float8_e4m3fn,79,0,3.8178,a8w8_rowwise_128x16x32x128_16x16_1x1_8x16x1_8x16x1_1x16x1x8_4x4x1_1x1_interwave_v2,70.31,429.15,0.0
256,128,2048,4096,torch.float8_e4m3fn,34,0,9.1799,a8w8_rowwise_256x16x64x512_16x16_1x1_32x8x1_32x8x1_1x16x1x16_4x4x1_1x1_intrawave_v3,233.93,1028.03,0.0
256,256,2048,512,torch.float8_e4m3fn,55,0,4.2488,a8w8_rowwise_128x64x32x128_32x32_1x1_8x16x1_8x16x1_1x16x1x8_4x4x1_1x1_intrawave_v2,126.36,524.44,0.0
256,256,2048,4096,torch.float8_e4m3fn,30,0,10.1866,a8w8_rowwise_256x32x64x512_16x16_1x2_32x8x1_32x8x1_1x32x1x8_8x8x1_1x2_intrawave_v3,421.63,1029.37,0.0
256,512,2048,512,torch.float8_e4m3fn,55,0,5.0799,a8w8_rowwise_128x64x32x128_32x32_1x1_8x16x1_8x16x1_1x16x1x8_4x4x1_1x1_intrawave_v2,211.37,670.85,0.0
256,512,2048,4096,torch.float8_e4m3fn,23,0,12.3243,a8w8_rowwise_256x64x64x512_32x32_1x1_32x8x1_32x8x1_1x32x1x8_8x8x1_1x1_intrawave_v3,696.99,1020.98,0.0
256,667,2048,512,torch.float8_e4m3fn,74,0,6.284,a8w8_rowwise_128x64x32x128_32x32_1x1_8x16x1_8x16x1_1x16x1x8_4x4x1_1x1_interwave_v2,222.6,655.97,0.0
256,667,2048,4096,torch.float8_e4m3fn,22,0,16.8668,a8w8_rowwise_256x64x96x256_16x16_2x3_16x16x1_16x16x1_1x64x1x4_8x8x1_2x1_intrawave_v3,663.46,821.3,0.0
256,671,2048,512,torch.float8_e4m3fn,74,0,6.1991,a8w8_rowwise_128x64x32x128_32x32_1x1_8x16x1_8x16x1_1x16x1x8_4x4x1_1x1_interwave_v2,227.0,667.93,0.0
256,671,2048,4096,torch.float8_e4m3fn,22,0,16.8996,a8w8_rowwise_256x64x96x256_16x16_2x3_16x16x1_16x16x1_1x64x1x4_8x8x1_2x1_intrawave_v3,666.14,821.64,0.0
256,931,2048,512,torch.float8_e4m3fn,47,0,6.9208,a8w8_rowwise_256x64x64x128_32x32_1x1_8x32x1_8x32x1_1x32x1x8_8x8x1_1x1_intrawave_v3,282.11,771.39,0.0
256,931,2048,4096,torch.float8_e4m3fn,21,0,18.3396,a8w8_rowwise_256x64x128x256_32x32_1x2_16x16x1_16x16x1_1x32x1x8_8x8x1_1x1_intrawave_v3,851.69,873.27,0.0
256,1024,2048,512,torch.float8_e4m3fn,46,0,6.5904,a8w8_rowwise_256x64x128x128_32x32_1x2_8x32x1_8x32x1_1x32x1x8_8x8x1_1x1_intrawave_v3,325.85,875.09,0.0
256,1024,2048,4096,torch.float8_e4m3fn,21,0,17.625,a8w8_rowwise_256x64x128x256_32x32_1x2_16x16x1_16x16x1_1x32x1x8_8x8x1_1x1_intrawave_v3,974.74,951.9,0.0
256,1025,2048,512,torch.float8_e4m3fn,19,0,7.5507,a8w8_rowwise_256x64x192x128_32x32_1x3_8x32x1_8x32x1_1x32x1x8_8x8x1_1x1_intrawave_v3,284.69,764.4,0.0
256,1025,2048,4096,torch.float8_e4m3fn,14,0,21.1473,a8w8_rowwise_256x128x96x256_32x32_1x3_16x16x1_16x16x1_1x64x1x4_8x8x1_1x1_intrawave_v3,813.18,793.74,0.0
256,1027,2048,512,torch.float8_e4m3fn,74,0,7.3427,a8w8_rowwise_128x64x32x128_32x32_1x1_8x16x1_8x16x1_1x16x1x8_4x4x1_1x1_interwave_v2,293.32,787.31,0.0
256,1027,2048,4096,torch.float8_e4m3fn,14,0,21.3061,a8w8_rowwise_256x128x96x256_32x32_1x3_16x16x1_16x16x1_1x64x1x4_8x8x1_1x1_intrawave_v3,808.7,788.59,0.0
256,1031,2048,512,torch.float8_e4m3fn,74,0,7.2832,a8w8_rowwise_128x64x32x128_32x32_1x1_8x16x1_8x16x1_1x16x1x8_4x4x1_1x1_interwave_v2,296.87,796.27,0.0
256,1031,2048,4096,torch.float8_e4m3fn,14,0,20.9363,a8w8_rowwise_256x128x96x256_32x32_1x3_16x16x1_16x16x1_1x64x1x4_8x8x1_1x1_intrawave_v3,826.19,804.08,0.0
256,1039,2048,512,torch.float8_e4m3fn,55,0,7.3292,a8w8_rowwise_128x64x32x128_32x32_1x1_8x16x1_8x16x1_1x16x1x8_4x4x1_1x1_intrawave_v2,297.3,796.31,0.0
256,1039,2048,4096,torch.float8_e4m3fn,14,0,21.3728,a8w8_rowwise_256x128x96x256_32x32_1x3_16x16x1_16x16x1_1x64x1x4_8x8x1_1x1_intrawave_v3,815.59,790.73,0.0
256,1040,2048,512,torch.float8_e4m3fn,74,0,7.5423,a8w8_rowwise_128x64x32x128_32x32_1x1_8x16x1_8x16x1_1x16x1x8_4x4x1_1x1_interwave_v2,289.17,774.42,0.0
256,1040,2048,4096,torch.float8_e4m3fn,14,0,21.2948,a8w8_rowwise_256x128x96x256_32x32_1x3_16x16x1_16x16x1_1x64x1x4_8x8x1_1x1_intrawave_v3,819.37,794.01,0.0
256,1041,2048,512,torch.float8_e4m3fn,74,0,7.5923,a8w8_rowwise_128x64x32x128_32x32_1x1_8x16x1_8x16x1_1x16x1x8_4x4x1_1x1_interwave_v2,287.55,769.93,0.0
256,1041,2048,4096,torch.float8_e4m3fn,14,0,21.4988,a8w8_rowwise_256x128x96x256_32x32_1x3_16x16x1_16x16x1_1x64x1x4_8x8x1_1x1_intrawave_v3,812.37,786.86,0.0
256,1072,2048,512,torch.float8_e4m3fn,62,0,7.5255,a8w8_rowwise_128x32x64x128_32x32_1x1_8x16x1_8x16x1_1x16x1x8_8x8x1_1x1_intrawave_v2,298.74,795.74,0.0
256,1072,2048,4096,torch.float8_e4m3fn,14,0,21.2772,a8w8_rowwise_256x128x96x256_32x32_1x3_16x16x1_16x16x1_1x64x1x4_8x8x1_1x1_intrawave_v3,845.28,806.99,0.0
256,1073,2048,512,torch.float8_e4m3fn,62,0,7.6052,a8w8_rowwise_128x32x64x128_32x32_1x1_8x16x1_8x16x1_1x16x1x8_8x8x1_1x1_intrawave_v2,295.88,788.01,0.0
256,1073,2048,4096,torch.float8_e4m3fn,14,0,21.1711,a8w8_rowwise_256x128x96x256_32x32_1x3_16x16x1_16x16x1_1x64x1x4_8x8x1_1x1_intrawave_v3,850.31,811.42,0.0
256,1077,2048,512,torch.float8_e4m3fn,55,0,7.1108,a8w8_rowwise_128x64x32x128_32x32_1x1_8x16x1_8x16x1_1x16x1x8_4x4x1_1x1_intrawave_v2,317.63,845.39,0.0
256,1077,2048,4096,torch.float8_e4m3fn,14,0,21.2132,a8w8_rowwise_256x128x96x256_32x32_1x3_16x16x1_16x16x1_1x64x1x4_8x8x1_1x1_intrawave_v3,851.78,811.35,0.0
256,1091,2048,512,torch.float8_e4m3fn,55,0,7.2956,a8w8_rowwise_128x64x32x128_32x32_1x1_8x16x1_8x16x1_1x16x1x8_4x4x1_1x1_intrawave_v2,313.61,832.82,0.0
256,1091,2048,4096,torch.float8_e4m3fn,14,0,21.3329,a8w8_rowwise_256x128x96x256_32x32_1x3_16x16x1_16x16x1_1x64x1x4_8x8x1_1x1_intrawave_v3,858.01,812.18,0.0
256,1343,2048,512,torch.float8_e4m3fn,46,0,8.2844,a8w8_rowwise_256x64x128x128_32x32_1x2_8x32x1_8x32x1_1x32x1x8_8x8x1_1x1_intrawave_v3,339.97,873.58,0.0
256,1343,2048,4096,torch.float8_e4m3fn,14,0,22.5552,a8w8_rowwise_256x128x96x256_32x32_1x3_16x16x1_16x16x1_1x64x1x4_8x8x1_1x1_intrawave_v3,998.96,859.69,0.0
256,1688,2048,512,torch.float8_e4m3fn,46,0,9.0565,a8w8_rowwise_256x64x128x128_32x32_1x2_8x32x1_8x32x1_1x32x1x8_8x8x1_1x1_intrawave_v3,390.88,974.65,0.0
256,1688,2048,4096,torch.float8_e4m3fn,15,0,28.176,a8w8_rowwise_256x128x64x256_32x32_2x1_16x16x1_16x16x1_1x32x1x8_8x8x1_1x1_intrawave_v3,1005.11,788.5,0.0
256,2017,2048,512,torch.float8_e4m3fn,16,0,10.4453,a8w8_rowwise_256x64x256x128_32x32_1x4_8x32x1_8x32x1_1x32x1x8_8x8x1_1x1_intrawave_v3,404.96,990.2,0.0
256,2017,2048,4096,torch.float8_e4m3fn,13,0,30.0872,a8w8_rowwise_256x128x128x128_32x32_2x2_8x32x1_8x32x1_1x32x1x8_8x8x1_1x1_intrawave_v3,1124.72,827.99,0.0
256,2048,2048,512,torch.float8_e4m3fn,46,0,9.5817,a8w8_rowwise_256x64x128x128_32x32_1x2_8x32x1_8x32x1_1x32x1x8_8x8x1_1x1_intrawave_v3,448.25,1094.35,0.0
256,2048,2048,4096,torch.float8_e4m3fn,41,0,25.9092,a8w8_rowwise_256x128x128x128_32x32_2x2_8x32x1_8x32x1_1x32x1x8_8x8x1_1x1_intrawave_v5,1326.16,971.31,0.0
256,2050,2048,512,torch.float8_e4m3fn,46,0,11.2013,a8w8_rowwise_256x64x128x128_32x32_1x2_8x32x1_8x32x1_1x32x1x8_8x8x1_1x1_intrawave_v3,383.81,936.94,0.0
256,2050,2048,4096,torch.float8_e4m3fn,11,0,31.5393,a8w8_rowwise_256x128x160x128_32x32_1x5_8x32x1_8x32x1_1x64x1x4_8x8x1_1x1_intrawave_v3,1090.49,798.44,0.0
256,2063,2048,512,torch.float8_e4m3fn,47,0,10.9878,a8w8_rowwise_256x64x64x128_32x32_1x1_8x32x1_8x32x1_1x32x1x8_8x8x1_1x1_intrawave_v3,393.75,960.6,0.0
256,2063,2048,4096,torch.float8_e4m3fn,11,0,31.3442,a8w8_rowwise_256x128x160x128_32x32_1x5_8x32x1_8x32x1_1x64x1x4_8x8x1_1x1_intrawave_v3,1104.24,806.81,0.0
256,2064,2048,512,torch.float8_e4m3fn,47,0,11.0128,a8w8_rowwise_256x64x64x128_32x32_1x1_8x32x1_8x32x1_1x32x1x8_8x8x1_1x1_intrawave_v3,393.04,958.84,0.0
256,2064,2048,4096,torch.float8_e4m3fn,11,0,31.3031,a8w8_rowwise_256x128x160x128_32x32_1x5_8x32x1_8x32x1_1x64x1x4_8x8x1_1x1_intrawave_v3,1106.22,808.13,0.0
256,2099,2048,512,torch.float8_e4m3fn,47,0,11.0082,a8w8_rowwise_256x64x64x128_32x32_1x1_8x32x1_8x32x1_1x32x1x8_8x8x1_1x1_intrawave_v3,399.88,973.89,0.0
256,2099,2048,4096,torch.float8_e4m3fn,11,0,32.3085,a8w8_rowwise_256x128x160x128_32x32_1x5_8x32x1_8x32x1_1x64x1x4_8x8x1_1x1_intrawave_v3,1089.97,791.85,0.0
256,2159,2048,512,torch.float8_e4m3fn,47,0,11.0808,a8w8_rowwise_256x64x64x128_32x32_1x1_8x32x1_8x32x1_1x32x1x8_8x8x1_1x1_intrawave_v3,408.61,992.46,0.0
256,2159,2048,4096,torch.float8_e4m3fn,11,0,32.2187,a8w8_rowwise_256x128x160x128_32x32_1x5_8x32x1_8x32x1_1x64x1x4_8x8x1_1x1_intrawave_v3,1124.25,809.32,0.0
256,2160,2048,512,torch.float8_e4m3fn,47,0,10.9991,a8w8_rowwise_256x64x64x128_32x32_1x1_8x32x1_8x32x1_1x32x1x8_8x8x1_1x1_intrawave_v3,411.84,1000.25,0.0
256,2160,2048,4096,torch.float8_e4m3fn,11,0,31.965,a8w8_rowwise_256x128x160x128_32x32_1x5_8x32x1_8x32x1_1x64x1x4_8x8x1_1x1_intrawave_v3,1133.7,816.0,0.0
256,2313,2048,512,torch.float8_e4m3fn,47,0,11.1706,a8w8_rowwise_256x64x64x128_32x32_1x1_8x32x1_8x32x1_1x32x1x8_8x8x1_1x1_intrawave_v3,434.24,1048.01,0.0
256,2313,2048,4096,torch.float8_e4m3fn,11,0,33.4533,a8w8_rowwise_256x128x160x128_32x32_1x5_8x32x1_8x32x1_1x64x1x4_8x8x1_1x1_intrawave_v3,1160.0,817.16,0.0
256,2325,2048,512,torch.float8_e4m3fn,47,0,11.1641,a8w8_rowwise_256x64x64x128_32x32_1x1_8x32x1_8x32x1_1x32x1x8_8x8x1_1x1_intrawave_v3,436.75,1053.57,0.0
256,2325,2048,4096,torch.float8_e4m3fn,11,0,32.6817,a8w8_rowwise_256x128x160x128_32x32_1x5_8x32x1_8x32x1_1x64x1x4_8x8x1_1x1_intrawave_v3,1193.54,839.46,0.0
256,3072,2048,512,torch.float8_e4m3fn,45,0,12.3298,a8w8_rowwise_256x128x64x128_32x32_2x1_8x32x1_8x32x1_1x32x1x8_8x8x1_1x1_intrawave_v3,522.51,1233.14,0.0
256,3072,2048,4096,torch.float8_e4m3fn,41,0,39.2425,a8w8_rowwise_256x128x128x128_32x32_2x2_8x32x1_8x32x1_1x32x1x8_8x8x1_1x1_intrawave_v5,1313.36,855.05,0.0
256,3073,2048,512,torch.float8_e4m3fn,17,0,13.5528,a8w8_rowwise_256x64x224x128_16x16_2x7_8x32x1_8x32x1_1x64x1x4_8x8x1_2x1_intrawave_v3,475.51,1122.2,0.0
256,3073,2048,4096,torch.float8_e4m3fn,13,0,42.6026,a8w8_rowwise_256x128x128x128_32x32_2x2_8x32x1_8x32x1_1x32x1x8_8x8x1_1x1_intrawave_v3,1210.17,787.81,0.0
256,3182,2048,512,torch.float8_e4m3fn,44,0,13.6756,a8w8_rowwise_256x128x128x128_32x32_2x2_8x32x1_8x32x1_1x32x1x8_8x8x1_1x1_interwave_v1,487.96,1148.85,0.0
256,3182,2048,4096,torch.float8_e4m3fn,13,0,41.2114,a8w8_rowwise_256x128x128x128_32x32_2x2_8x32x1_8x32x1_1x32x1x8_8x8x1_1x1_intrawave_v3,1295.4,836.07,0.0
256,3183,2048,512,torch.float8_e4m3fn,17,0,13.6366,a8w8_rowwise_256x64x224x128_16x16_2x7_8x32x1_8x32x1_1x64x1x4_8x8x1_2x1_intrawave_v3,489.51,1152.47,0.0
256,3183,2048,4096,torch.float8_e4m3fn,13,0,42.103,a8w8_rowwise_256x128x128x128_32x32_2x2_8x32x1_8x32x1_1x32x1x8_8x8x1_1x1_intrawave_v3,1268.36,818.56,0.0
256,3847,2048,512,torch.float8_e4m3fn,44,0,14.3886,a8w8_rowwise_256x128x128x128_32x32_2x2_8x32x1_8x32x1_1x32x1x8_8x8x1_1x1_interwave_v1,560.7,1304.89,0.0
256,3847,2048,4096,torch.float8_e4m3fn,35,0,46.791,a8w8_rowwise_256x128x128x128_32x32_2x2_8x32x1_8x32x1_1x32x1x8_8x8x1_1x1_intrawave_v4,1379.37,852.8,0.0
256,4096,2048,512,torch.float8_e4m3fn,44,0,14.4074,a8w8_rowwise_256x128x128x128_32x32_2x2_8x32x1_8x32x1_1x32x1x8_8x8x1_1x1_interwave_v1,596.22,1382.83,0.0
256,4096,2048,4096,torch.float8_e4m3fn,13,0,45.3002,a8w8_rowwise_256x128x128x128_32x32_2x2_8x32x1_8x32x1_1x32x1x8_8x8x1_1x1_intrawave_v3,1516.98,925.89,0.0
256,4111,2048,512,torch.float8_e4m3fn,19,0,16.0783,a8w8_rowwise_256x64x192x128_32x32_1x3_8x32x1_8x32x1_1x32x1x8_8x8x1_1x1_intrawave_v3,536.21,1243.42,0.0
256,4111,2048,4096,torch.float8_e4m3fn,4,0,48.4038,a8w8_rowwise_256x256x160x128_32x32_2x5_8x32x1_8x32x1_1x64x1x4_8x8x1_2x1_intrawave_v3,1424.91,869.06,0.0
256,4141,2048,512,torch.float8_e4m3fn,19,0,16.2648,a8w8_rowwise_256x64x192x128_32x32_1x3_8x32x1_8x32x1_1x32x1x8_8x8x1_1x1_intrawave_v3,533.93,1237.66,0.0
256,4141,2048,4096,torch.float8_e4m3fn,4,0,47.389,a8w8_rowwise_256x256x160x128_32x32_2x5_8x32x1_8x32x1_1x64x1x4_8x8x1_2x1_intrawave_v3,1466.05,892.86,0.0
256,4142,2048,512,torch.float8_e4m3fn,19,0,16.2696,a8w8_rowwise_256x64x192x128_32x32_1x3_8x32x1_8x32x1_1x32x1x8_8x8x1_1x1_intrawave_v3,533.9,1237.58,0.0
256,4142,2048,4096,torch.float8_e4m3fn,4,0,48.153,a8w8_rowwise_256x256x160x128_32x32_2x5_8x32x1_8x32x1_1x64x1x4_8x8x1_2x1_intrawave_v3,1443.13,878.86,0.0
256,4345,2048,512,torch.float8_e4m3fn,19,0,16.4279,a8w8_rowwise_256x64x192x128_32x32_1x3_8x32x1_8x32x1_1x32x1x8_8x8x1_1x1_intrawave_v3,554.67,1282.59,0.0
256,4345,2048,4096,torch.float8_e4m3fn,4,0,47.6498,a8w8_rowwise_256x256x160x128_32x32_2x5_8x32x1_8x32x1_1x64x1x4_8x8x1_2x1_intrawave_v3,1529.85,923.04,0.0
256,5105,2048,512,torch.float8_e4m3fn,45,0,17.5624,a8w8_rowwise_256x128x64x128_32x32_2x1_8x32x1_8x32x1_1x32x1x8_8x8x1_1x1_intrawave_v3,609.6,1399.15,0.0
256,5105,2048,4096,torch.float8_e4m3fn,3,0,55.6167,a8w8_rowwise_256x256x192x128_32x32_4x3_8x32x1_8x32x1_1x32x1x8_8x8x1_1x1_intrawave_v3,1539.96,902.76,0.0
256,5121,2048,512,torch.float8_e4m3fn,46,0,18.7376,a8w8_rowwise_256x64x128x128_32x32_1x2_8x32x1_8x32x1_1x32x1x8_8x8x1_1x1_intrawave_v3,573.15,1315.33,0.0
256,5121,2048,4096,torch.float8_e4m3fn,3,0,55.7491,a8w8_rowwise_256x256x192x128_32x32_4x3_8x32x1_8x32x1_1x32x1x8_8x8x1_1x1_intrawave_v3,1541.12,902.97,0.0
256,5123,2048,512,torch.float8_e4m3fn,10,0,18.7321,a8w8_rowwise_256x128x192x128_32x32_2x3_8x32x1_8x32x1_1x32x1x8_8x8x1_1x1_intrawave_v3,573.55,1316.21,0.0
256,5123,2048,4096,torch.float8_e4m3fn,10,0,58.0371,a8w8_rowwise_256x128x192x128_32x32_2x3_8x32x1_8x32x1_1x32x1x8_8x8x1_1x1_intrawave_v3,1480.94,867.66,0.0
256,5131,2048,512,torch.float8_e4m3fn,47,0,18.7957,a8w8_rowwise_256x64x64x128_32x32_1x1_8x32x1_8x32x1_1x32x1x8_8x8x1_1x1_intrawave_v3,572.5,1313.72,0.0
256,5131,2048,4096,torch.float8_e4m3fn,10,0,56.6563,a8w8_rowwise_256x128x192x128_32x32_2x3_8x32x1_8x32x1_1x32x1x8_8x8x1_1x1_intrawave_v3,1519.41,889.96,0.0
256,5427,2048,512,torch.float8_e4m3fn,46,0,18.976,a8w8_rowwise_256x64x128x128_32x32_1x2_8x32x1_8x32x1_1x32x1x8_8x8x1_1x1_intrawave_v3,599.77,1373.11,0.0
256,5427,2048,4096,torch.float8_e4m3fn,3,0,57.2255,a8w8_rowwise_256x256x192x128_32x32_4x3_8x32x1_8x32x1_1x32x1x8_8x8x1_1x1_intrawave_v3,1591.07,923.48,0.0
256,6113,2048,512,torch.float8_e4m3fn,13,0,19.992,a8w8_rowwise_256x128x128x128_32x32_2x2_8x32x1_8x32x1_1x32x1x8_8x8x1_1x1_intrawave_v3,641.25,1461.45,0.0
256,6113,2048,4096,torch.float8_e4m3fn,2,0,62.6504,a8w8_rowwise_256x256x224x128_32x32_2x7_8x32x1_8x32x1_1x64x1x4_8x8x1_2x1_intrawave_v3,1637.01,933.22,0.0
256,6197,2048,512,torch.float8_e4m3fn,45,0,21.5716,a8w8_rowwise_256x128x64x128_32x32_2x1_8x32x1_8x32x1_1x32x1x8_8x8x1_1x1_intrawave_v3,602.46,1372.38,0.0
256,6197,2048,4096,torch.float8_e4m3fn,2,0,63.1072,a8w8_rowwise_256x256x224x128_32x32_2x7_8x32x1_8x32x1_1x64x1x4_8x8x1_2x1_intrawave_v3,1647.49,937.36,0.0
256,6409,2048,512,torch.float8_e4m3fn,46,0,21.5552,a8w8_rowwise_256x64x128x128_32x32_1x2_8x32x1_8x32x1_1x32x1x8_8x8x1_1x1_intrawave_v3,623.55,1418.74,0.0
256,6409,2048,4096,torch.float8_e4m3fn,1,0,70.7436,a8w8_rowwise_256x256x256x128_32x32_4x4_8x32x1_8x32x1_1x32x1x8_8x8x1_1x1_intrawave_v3,1519.93,860.73,0.0
256,7121,2048,512,torch.float8_e4m3fn,45,0,22.4374,a8w8_rowwise_256x128x64x128_32x32_2x1_8x32x1_8x32x1_1x32x1x8_8x8x1_1x1_intrawave_v3,665.58,1509.18,0.0
256,7121,2048,4096,torch.float8_e4m3fn,1,0,71.3584,a8w8_rowwise_256x256x256x128_32x32_4x4_8x32x1_8x32x1_1x32x1x8_8x8x1_1x1_intrawave_v3,1674.23,935.05,0.0
256,7168,2048,512,torch.float8_e4m3fn,45,0,21.5915,a8w8_rowwise_256x128x64x128_32x32_2x1_8x32x1_8x32x1_1x32x1x8_8x8x1_1x1_intrawave_v3,696.22,1578.34,0.0
256,7168,2048,4096,torch.float8_e4m3fn,39,0,69.944,a8w8_rowwise_256x224x256x128_16x16_7x8_8x32x1_8x32x1_1x32x1x8_8x8x1_1x2_intrawave_v3,1719.36,959.47,0.0
256,7169,2048,512,torch.float8_e4m3fn,11,0,23.1506,a8w8_rowwise_256x128x160x128_32x32_1x5_8x32x1_8x32x1_1x64x1x4_8x8x1_1x1_intrawave_v3,649.42,1472.24,0.0
256,7169,2048,4096,torch.float8_e4m3fn,1,0,72.6957,a8w8_rowwise_256x256x256x128_32x32_4x4_8x32x1_8x32x1_1x32x1x8_8x8x1_1x1_intrawave_v3,1654.51,923.26,0.0
256,7172,2048,512,torch.float8_e4m3fn,45,0,23.0645,a8w8_rowwise_256x128x64x128_32x32_2x1_8x32x1_8x32x1_1x32x1x8_8x8x1_1x1_intrawave_v3,652.12,1478.34,0.0
256,7172,2048,4096,torch.float8_e4m3fn,1,0,71.1217,a8w8_rowwise_256x256x256x128_32x32_4x4_8x32x1_8x32x1_1x32x1x8_8x8x1_1x1_intrawave_v3,1691.84,944.04,0.0
256,7176,2048,512,torch.float8_e4m3fn,11,0,23.669,a8w8_rowwise_256x128x160x128_32x32_1x5_8x32x1_8x32x1_1x64x1x4_8x8x1_1x1_intrawave_v3,635.82,1441.36,0.0
256,7176,2048,4096,torch.float8_e4m3fn,1,0,71.2677,a8w8_rowwise_256x256x256x128_32x32_4x4_8x32x1_8x32x1_1x32x1x8_8x8x1_1x1_intrawave_v3,1689.31,942.56,0.0
256,7177,2048,512,torch.float8_e4m3fn,45,0,23.4122,a8w8_rowwise_256x128x64x128_32x32_2x1_8x32x1_8x32x1_1x32x1x8_8x8x1_1x1_intrawave_v3,642.88,1457.37,0.0
256,7177,2048,4096,torch.float8_e4m3fn,1,0,73.6833,a8w8_rowwise_256x256x256x128_32x32_4x4_8x32x1_8x32x1_1x32x1x8_8x8x1_1x1_intrawave_v3,1634.16,911.78,0.0
256,7178,2048,512,torch.float8_e4m3fn,45,0,24.1104,a8w8_rowwise_256x128x64x128_32x32_2x1_8x32x1_8x32x1_1x32x1x8_8x8x1_1x1_intrawave_v3,624.35,1415.36,0.0
256,7178,2048,4096,torch.float8_e4m3fn,1,0,71.6517,a8w8_rowwise_256x256x256x128_32x32_4x4_8x32x1_8x32x1_1x32x1x8_8x8x1_1x1_intrawave_v3,1680.73,937.74,0.0
256,7179,2048,512,torch.float8_e4m3fn,45,0,23.1936,a8w8_rowwise_256x128x64x128_32x32_2x1_8x32x1_8x32x1_1x32x1x8_8x8x1_1x1_intrawave_v3,649.12,1471.5,0.0
256,7179,2048,4096,torch.float8_e4m3fn,1,0,72.8445,a8w8_rowwise_256x256x256x128_32x32_4x4_8x32x1_8x32x1_1x32x1x8_8x8x1_1x1_intrawave_v3,1653.43,922.5,0.0
256,7183,2048,512,torch.float8_e4m3fn,11,0,23.8509,a8w8_rowwise_256x128x160x128_32x32_1x5_8x32x1_8x32x1_1x64x1x4_8x8x1_1x1_intrawave_v3,631.58,1431.72,0.0
256,7183,2048,4096,torch.float8_e4m3fn,1,0,71.4109,a8w8_rowwise_256x256x256x128_32x32_4x4_8x32x1_8x32x1_1x32x1x8_8x8x1_1x1_intrawave_v3,1687.57,941.48,0.0
256,7184,2048,512,torch.float8_e4m3fn,43,0,23.8284,a8w8_rowwise_256x256x128x64_32x32_4x2_4x64x1_4x64x1_1x32x1x8_8x8x1_1x1_interwave_v1,632.27,1433.27,0.0
256,7184,2048,4096,torch.float8_e4m3fn,1,0,72.1309,a8w8_rowwise_256x256x256x128_32x32_4x4_8x32x1_8x32x1_1x32x1x8_8x8x1_1x1_intrawave_v3,1670.96,932.19,0.0
256,7209,2048,512,torch.float8_e4m3fn,45,0,24.0244,a8w8_rowwise_256x128x64x128_32x32_2x1_8x32x1_8x32x1_1x32x1x8_8x8x1_1x1_intrawave_v3,629.29,1426.37,0.0
256,7209,2048,4096,torch.float8_e4m3fn,1,0,70.4913,a8w8_rowwise_256x256x256x128_32x32_4x4_8x32x1_8x32x1_1x32x1x8_8x8x1_1x1_intrawave_v3,1715.77,956.78,0.0
256,7210,2048,512,torch.float8_e4m3fn,45,0,23.1973,a8w8_rowwise_256x128x64x128_32x32_2x1_8x32x1_8x32x1_1x32x1x8_8x8x1_1x1_intrawave_v3,651.82,1477.42,0.0
256,7210,2048,4096,torch.float8_e4m3fn,1,0,73.6393,a8w8_rowwise_256x256x256x128_32x32_4x4_8x32x1_8x32x1_1x32x1x8_8x8x1_1x1_intrawave_v3,1642.65,915.99,0.0
256,7211,2048,512,torch.float8_e4m3fn,45,0,23.8416,a8w8_rowwise_256x128x64x128_32x32_2x1_8x32x1_8x32x1_1x32x1x8_8x8x1_1x1_intrawave_v3,634.29,1437.69,0.0
256,7211,2048,4096,torch.float8_e4m3fn,1,0,71.5673,a8w8_rowwise_256x256x256x128_32x32_4x4_8x32x1_8x32x1_1x32x1x8_8x8x1_1x1_intrawave_v3,1690.44,942.62,0.0
256,7217,2048,512,torch.float8_e4m3fn,45,0,23.2807,a8w8_rowwise_256x128x64x128_32x32_2x1_8x32x1_8x32x1_1x32x1x8_8x8x1_1x1_intrawave_v3,650.12,1473.52,0.0
256,7217,2048,4096,torch.float8_e4m3fn,1,0,70.3813,a8w8_rowwise_256x256x256x128_32x32_4x4_8x32x1_8x32x1_1x32x1x8_8x8x1_1x1_intrawave_v3,1720.36,959.21,0.0
256,7273,2048,512,torch.float8_e4m3fn,45,0,23.179,a8w8_rowwise_256x128x64x128_32x32_2x1_8x32x1_8x32x1_1x32x1x8_8x8x1_1x1_intrawave_v3,658.03,1491.12,0.0
256,7273,2048,4096,torch.float8_e4m3fn,1,0,71.9569,a8w8_rowwise_256x256x256x128_32x32_4x4_8x32x1_8x32x1_1x32x1x8_8x8x1_1x1_intrawave_v3,1695.75,944.58,0.0
256,7274,2048,512,torch.float8_e4m3fn,45,0,24.0072,a8w8_rowwise_256x128x64x128_32x32_2x1_8x32x1_8x32x1_1x32x1x8_8x8x1_1x1_intrawave_v3,635.42,1439.87,0.0
256,7274,2048,4096,torch.float8_e4m3fn,1,0,71.1189,a8w8_rowwise_256x256x256x128_32x32_4x4_8x32x1_8x32x1_1x32x1x8_8x8x1_1x1_intrawave_v3,1715.96,955.82,0.0
256,7391,2048,512,torch.float8_e4m3fn,43,0,23.9319,a8w8_rowwise_256x256x128x64_32x32_4x2_4x64x1_4x64x1_1x32x1x8_8x8x1_1x1_interwave_v1,647.67,1466.93,0.0
256,7391,2048,4096,torch.float8_e4m3fn,1,0,71.9605,a8w8_rowwise_256x256x256x128_32x32_4x4_8x32x1_8x32x1_1x32x1x8_8x8x1_1x1_intrawave_v3,1723.17,957.97,0.0
256,7393,2048,512,torch.float8_e4m3fn,46,0,23.9691,a8w8_rowwise_256x64x128x128_32x32_1x2_8x32x1_8x32x1_1x32x1x8_8x8x1_1x1_intrawave_v3,646.84,1465.03,0.0
256,7393,2048,4096,torch.float8_e4m3fn,1,0,71.8381,a8w8_rowwise_256x256x256x128_32x32_4x4_8x32x1_8x32x1_1x32x1x8_8x8x1_1x1_intrawave_v3,1726.58,959.83,0.0
256,7715,2048,512,torch.float8_e4m3fn,43,0,24.567,a8w8_rowwise_256x256x128x64_32x32_4x2_4x64x1_4x64x1_1x32x1x8_8x8x1_1x1_interwave_v1,658.59,1489.77,0.0
256,7715,2048,4096,torch.float8_e4m3fn,1,0,73.6001,a8w8_rowwise_256x256x256x128_32x32_4x4_8x32x1_8x32x1_1x32x1x8_8x8x1_1x1_intrawave_v3,1758.64,972.69,0.0
256,7753,2048,512,torch.float8_e4m3fn,42,0,24.3175,a8w8_rowwise_256x128x256x64_32x32_2x4_4x64x1_4x64x1_1x32x1x8_8x8x1_1x1_interwave_v1,668.62,1512.26,0.0
256,7753,2048,4096,torch.float8_e4m3fn,1,0,73.2517,a8w8_rowwise_256x256x256x128_32x32_4x4_8x32x1_8x32x1_1x32x1x8_8x8x1_1x1_intrawave_v3,1775.71,981.56,0.0
256,7819,2048,512,torch.float8_e4m3fn,43,0,24.4459,a8w8_rowwise_256x256x128x64_32x32_4x2_4x64x1_4x64x1_1x32x1x8_8x8x1_1x1_interwave_v1,670.77,1516.76,0.0
256,7819,2048,4096,torch.float8_e4m3fn,1,0,72.7261,a8w8_rowwise_256x256x256x128_32x32_4x4_8x32x1_8x32x1_1x32x1x8_8x8x1_1x1_intrawave_v3,1803.77,996.09,0.0
256,8099,2048,512,torch.float8_e4m3fn,43,0,24.6988,a8w8_rowwise_256x256x128x64_32x32_4x2_4x64x1_4x64x1_1x32x1x8_8x8x1_1x1_interwave_v1,687.68,1553.47,0.0
256,8099,2048,4096,torch.float8_e4m3fn,1,0,74.8213,a8w8_rowwise_256x256x256x128_32x32_4x4_8x32x1_8x32x1_1x32x1x8_8x8x1_1x1_intrawave_v3,1816.04,998.85,0.0
256,8129,2048,512,torch.float8_e4m3fn,43,0,25.1764,a8w8_rowwise_256x256x128x64_32x32_4x2_4x64x1_4x64x1_1x32x1x8_8x8x1_1x1_interwave_v1,677.13,1529.49,0.0
256,8129,2048,4096,torch.float8_e4m3fn,1,0,73.8309,a8w8_rowwise_256x256x256x128_32x32_4x4_8x32x1_8x32x1_1x32x1x8_8x8x1_1x1_intrawave_v3,1847.22,1015.58,0.0
256,8188,2048,512,torch.float8_e4m3fn,42,0,25.0653,a8w8_rowwise_256x128x256x64_32x32_2x4_4x64x1_4x64x1_1x32x1x8_8x8x1_1x1_interwave_v1,685.07,1547.11,0.0
256,8188,2048,4096,torch.float8_e4m3fn,1,0,73.7869,a8w8_rowwise_256x256x256x128_32x32_4x4_8x32x1_8x32x1_1x32x1x8_8x8x1_1x1_intrawave_v3,1861.74,1022.74,0.0
256,8192,2048,512,torch.float8_e4m3fn,43,0,24.603,a8w8_rowwise_256x256x128x64_32x32_4x2_4x64x1_4x64x1_1x32x1x8_8x8x1_1x1_interwave_v1,698.28,1576.93,0.0
256,8192,2048,4096,torch.float8_e4m3fn,1,0,73.0833,a8w8_rowwise_256x256x256x128_32x32_4x4_8x32x1_8x32x1_1x32x1x8_8x8x1_1x1_intrawave_v3,1880.58,1033.03,0.0
256,1,2304,16384,torch.int8,34,0,28.7938,a8w8_rowwise_256x16x64x512_16x16_1x1_32x8x1_32x8x1_1x16x1x16_4x4x1_1x1_intrawave_v3,2.62,1311.73,0.0
256,16,2304,16384,torch.int8,34,0,23.498,a8w8_rowwise_256x16x64x512_16x16_1x1_32x8x1_32x8x1_1x16x1x16_4x4x1_1x1_intrawave_v3,51.41,1620.76,0.0
256,32,2304,16384,torch.int8,34,0,23.2436,a8w8_rowwise_256x16x64x512_16x16_1x1_32x8x1_32x8x1_1x16x1x16_4x4x1_1x1_intrawave_v3,103.94,1652.95,0.0
256,64,2304,16384,torch.int8,34,0,23.2558,a8w8_rowwise_256x16x64x512_16x16_1x1_32x8x1_32x8x1_1x16x1x16_4x4x1_1x1_intrawave_v3,207.77,1680.97,0.0
256,128,2304,16384,torch.int8,30,0,26.5035,a8w8_rowwise_256x32x64x512_16x16_1x2_32x8x1_32x8x1_1x32x1x8_8x8x1_1x2_intrawave_v3,364.62,1525.67,0.0
256,256,2304,16384,torch.int8,23,0,32.4817,a8w8_rowwise_256x64x64x512_32x32_1x1_32x8x1_32x8x1_1x32x1x8_8x8x1_1x1_intrawave_v3,595.02,1327.6,0.0
256,512,2304,16384,torch.int8,23,0,54.2058,a8w8_rowwise_256x64x64x512_32x32_1x1_32x8x1_32x8x1_1x32x1x8_8x8x1_1x1_intrawave_v3,713.11,894.68,0.0
256,1024,2304,16384,torch.int8,23,0,86.7135,a8w8_rowwise_256x64x64x512_32x32_1x1_32x8x1_32x8x1_1x32x1x8_8x8x1_1x1_intrawave_v3,891.55,683.22,0.0
256,2048,2304,16384,torch.int8,23,0,145.2155,a8w8_rowwise_256x64x64x512_32x32_1x1_32x8x1_32x8x1_1x32x1x8_8x8x1_1x1_intrawave_v3,1064.75,556.0,0.0
256,4096,2304,16384,torch.int8,11,0,246.424,a8w8_rowwise_256x128x160x128_32x32_1x5_8x32x1_8x32x1_1x64x1x4_8x8x1_1x1_intrawave_v3,1254.9,502.11,0.0
256,8192,2304,16384,torch.int8,15,0,463.8213,a8w8_rowwise_256x128x64x256_32x32_2x1_16x16x1_16x16x1_1x32x1x8_8x8x1_1x1_intrawave_v3,1333.43,452.15,0.0
256,16384,2304,16384,torch.int8,15,0,878.7062,a8w8_rowwise_256x128x64x256_32x32_2x1_16x16x1_16x16x1_1x32x1x8_8x8x1_1x1_intrawave_v3,1407.7,434.37,0.0
256,32768,2304,16384,torch.int8,1,0,1717.9546,a8w8_rowwise_256x256x256x128_32x32_4x4_8x32x1_8x32x1_1x32x1x8_8x8x1_1x1_intrawave_v3,1440.03,422.37,0.0
256,1,2560,8192,torch.int8,34,0,17.4658,a8w8_rowwise_256x16x64x512_16x16_1x1_32x8x1_32x8x1_1x16x1x16_4x4x1_1x1_intrawave_v3,2.4,1201.48,0.0
256,16,2560,8192,torch.int8,34,0,14.8202,a8w8_rowwise_256x16x64x512_16x16_1x1_32x8x1_32x8x1_1x16x1x16_4x4x1_1x1_intrawave_v3,45.28,1429.43,0.0
256,32,2560,8192,torch.int8,34,0,14.7991,a8w8_rowwise_256x16x64x512_16x16_1x1_32x8x1_32x8x1_1x16x1x16_4x4x1_1x1_intrawave_v3,90.69,1445.87,0.0
256,64,2560,8192,torch.int8,34,0,14.5967,a8w8_rowwise_256x16x64x512_16x16_1x1_32x8x1_32x8x1_1x16x1x16_4x4x1_1x1_intrawave_v3,183.9,1495.1,0.0
256,128,2560,8192,torch.int8,30,0,16.5177,a8w8_rowwise_256x32x64x512_16x16_1x2_32x8x1_32x8x1_1x32x1x8_8x8x1_1x2_intrawave_v3,325.03,1372.8,0.0
256,256,2560,8192,torch.int8,28,0,23.112,a8w8_rowwise_256x32x128x256_32x32_1x1_16x16x1_16x16x1_1x32x1x8_8x8x1_1x1_intrawave_v3,464.58,1054.84,0.0
256,512,2560,8192,torch.int8,21,0,27.6646,a8w8_rowwise_256x64x128x256_32x32_1x2_16x16x1_16x16x1_1x32x1x8_8x8x1_1x1_intrawave_v3,776.26,1004.43,0.0
256,1024,2560,8192,torch.int8,41,0,42.1202,a8w8_rowwise_256x128x128x128_32x32_2x2_8x32x1_8x32x1_1x32x1x8_8x8x1_1x1_intrawave_v5,1019.69,821.53,0.0
256,2048,2560,8192,torch.int8,11,0,61.0366,a8w8_rowwise_256x128x160x128_32x32_1x5_8x32x1_8x32x1_1x64x1x4_8x8x1_1x1_intrawave_v3,1407.34,790.26,0.0
256,4096,2560,8192,torch.int8,4,0,90.7509,a8w8_rowwise_256x256x160x128_32x32_2x5_8x32x1_8x32x1_1x64x1x4_8x8x1_2x1_intrawave_v3,1893.08,831.92,0.0
256,8192,2560,8192,torch.int8,4,0,173.6356,a8w8_rowwise_256x256x160x128_32x32_2x5_8x32x1_8x32x1_1x64x1x4_8x8x1_2x1_intrawave_v3,1978.84,748.83,0.0
256,16384,2560,8192,torch.int8,1,0,329.1334,a8w8_rowwise_256x256x256x128_32x32_4x4_8x32x1_8x32x1_1x32x1x8_8x8x1_1x1_intrawave_v3,2087.89,726.38,0.0
256,32768,2560,8192,torch.int8,1,0,599.612,a8w8_rowwise_256x256x256x128_32x32_4x4_8x32x1_8x32x1_1x32x1x8_8x8x1_1x1_intrawave_v3,2292.13,762.46,0.0
256,16,3584,8192,torch.float8_e4m3fn,34,2,10.689,a8w8_rowwise_256x16x64x512_16x16_1x1_32x8x1_32x8x1_1x16x1x16_4x4x1_1x1_intrawave_v3,87.9,2769.75,0.1092
256,32,3584,8192,torch.float8_e4m3fn,34,2,12.64,a8w8_rowwise_256x16x64x512_16x16_1x1_32x8x1_32x8x1_1x16x1x16_4x4x1_1x1_intrawave_v3,148.66,2361.68,0.1084
256,64,3584,8192,torch.float8_e4m3fn,55,2,15.5912,a8w8_rowwise_128x64x32x128_32x32_1x1_8x16x1_8x16x1_1x16x1x8_4x4x1_1x1_intrawave_v2,241.04,1946.17,0.1078
256,128,3584,8192,torch.float8_e4m3fn,30,0,17.8922,a8w8_rowwise_256x32x64x512_16x16_1x2_32x8x1_32x8x1_1x32x1x8_8x8x1_1x2_intrawave_v3,420.08,1750.83,0.0
256,256,3584,8192,torch.float8_e4m3fn,23,0,20.9257,a8w8_rowwise_256x64x64x512_32x32_1x1_32x8x1_32x8x1_1x32x1x8_8x8x1_1x1_intrawave_v3,718.37,1590.98,0.0
256,1,4608,16384,torch.int8,34,0,30.4899,a8w8_rowwise_256x16x64x512_16x16_1x1_32x8x1_32x8x1_1x16x1x16_4x4x1_1x1_intrawave_v3,4.95,2476.99,0.0
256,16,4608,16384,torch.int8,34,0,25.7089,a8w8_rowwise_256x16x64x512_16x16_1x1_32x8x1_32x8x1_1x16x1x16_4x4x1_1x1_intrawave_v3,93.97,2952.56,0.0
256,32,4608,16384,torch.int8,34,0,24.957,a8w8_rowwise_256x16x64x512_16x16_1x1_32x8x1_32x8x1_1x16x1x16_4x4x1_1x1_intrawave_v3,193.61,3057.93,0.0
256,64,4608,16384,torch.int8,30,0,27.9735,a8w8_rowwise_256x32x64x512_16x16_1x2_32x8x1_32x8x1_1x32x1x8_8x8x1_1x2_intrawave_v3,345.46,2757.46,0.0
256,128,4608,16384,torch.int8,23,0,33.4047,a8w8_rowwise_256x64x64x512_32x32_1x1_32x8x1_32x8x1_1x32x1x8_8x8x1_1x1_intrawave_v3,578.58,2358.18,0.0
256,256,4608,16384,torch.int8,23,0,55.0189,a8w8_rowwise_256x64x64x512_32x32_1x1_32x8x1_32x8x1_1x32x1x8_8x8x1_1x1_intrawave_v3,702.57,1491.33,0.0
256,512,4608,16384,torch.int8,23,0,87.1647,a8w8_rowwise_256x64x64x512_32x32_1x1_32x8x1_32x8x1_1x32x1x8_8x8x1_1x1_intrawave_v3,886.93,1016.52,0.0
256,1024,4608,16384,torch.int8,23,0,143.2677,a8w8_rowwise_256x64x64x512_32x32_1x1_32x8x1_32x8x1_1x32x1x8_8x8x1_1x1_intrawave_v3,1079.23,709.94,0.0
256,2048,4608,16384,torch.int8,11,0,247.0665,a8w8_rowwise_256x128x160x128_32x32_1x5_8x32x1_8x32x1_1x64x1x4_8x8x1_1x1_intrawave_v3,1251.64,517.78,0.0
256,4096,4608,16384,torch.int8,15,0,433.3975,a8w8_rowwise_256x128x64x256_32x32_2x1_16x16x1_16x16x1_1x32x1x8_8x8x1_1x1_intrawave_v3,1427.04,416.14,0.0
256,8192,4608,16384,torch.int8,39,0,844.5637,a8w8_rowwise_256x224x256x128_16x16_7x8_8x32x1_8x32x1_1x32x1x8_8x8x1_1x2_intrawave_v3,1464.6,337.7,0.0
256,16384,4608,16384,torch.int8,40,0,1632.4516,a8w8_rowwise_256x256x224x128_16x16_8x7_8x32x1_8x32x1_1x64x1x4_8x8x1_2x1_intrawave_v3,1515.45,303.18,0.0
256,32768,4608,16384,torch.int8,40,0,3026.9648,a8w8_rowwise_256x256x224x128_16x16_8x7_8x32x1_8x32x1_1x64x1x4_8x8x1_2x1_intrawave_v3,1634.58,302.07,0.0
256,1,5120,640,torch.int8,79,0,4.3227,a8w8_rowwise_128x16x32x128_16x16_1x1_8x16x1_8x16x1_1x16x1x8_4x4x1_1x1_interwave_v2,1.52,760.56,0.0
256,1,5120,1280,torch.int8,34,0,6.1049,a8w8_rowwise_256x16x64x512_16x16_1x1_32x8x1_32x8x1_1x16x1x16_4x4x1_1x1_intrawave_v3,2.15,1075.39,0.0
256,1,5120,3200,torch.int8,30,0,9.8138,a8w8_rowwise_256x32x64x512_16x16_1x2_32x8x1_32x8x1_1x32x1x8_8x8x1_1x2_intrawave_v3,3.34,1670.86,0.0
256,1,5120,5120,torch.int8,34,0,12.3186,a8w8_rowwise_256x16x64x512_16x16_1x1_32x8x1_32x8x1_1x16x1x16_4x4x1_1x1_intrawave_v3,4.26,2129.28,0.0
256,1,5120,6400,torch.int8,34,0,14.5779,a8w8_rowwise_256x16x64x512_16x16_1x1_32x8x1_32x8x1_1x16x1x16_4x4x1_1x1_intrawave_v3,4.5,2248.93,0.0
256,1,5120,25600,torch.int8,23,0,47.1407,a8w8_rowwise_256x64x64x512_32x32_1x1_32x8x1_32x8x1_1x32x1x8_8x8x1_1x1_intrawave_v3,5.56,2781.2,0.0
256,16,5120,640,torch.int8,60,0,4.3842,a8w8_rowwise_128x16x32x128_16x16_1x1_8x16x1_8x16x1_1x16x1x8_4x4x1_1x1_intrawave_v2,23.92,787.12,0.0
256,16,5120,1280,torch.int8,79,0,6.1038,a8w8_rowwise_128x16x32x128_16x16_1x1_8x16x1_8x16x1_1x16x1x8_4x4x1_1x1_interwave_v2,34.36,1103.89,0.0
256,16,5120,3200,torch.int8,79,0,9.1289,a8w8_rowwise_128x16x32x128_16x16_1x1_8x16x1_8x16x1_1x16x1x8_4x4x1_1x1_interwave_v2,57.43,1818.3,0.0
256,16,5120,5120,torch.int8,34,0,11.1363,a8w8_rowwise_256x16x64x512_16x16_1x1_32x8x1_32x8x1_1x16x1x16_4x4x1_1x1_intrawave_v3,75.33,2376.03,0.0
256,16,5120,6400,torch.int8,34,0,14.8838,a8w8_rowwise_256x16x64x512_16x16_1x1_32x8x1_32x8x1_1x16x1x16_4x4x1_1x1_intrawave_v3,70.45,2219.48,0.0
256,16,5120,25600,torch.int8,34,0,38.7631,a8w8_rowwise_256x16x64x512_16x16_1x1_32x8x1_32x8x1_1x16x1x16_4x4x1_1x1_intrawave_v3,108.2,3396.15,0.0
256,32,5120,640,torch.int8,79,0,4.5986,a8w8_rowwise_128x16x32x128_16x16_1x1_8x16x1_8x16x1_1x16x1x8_4x4x1_1x1_interwave_v2,45.6,788.27,0.0
256,32,5120,1280,torch.int8,76,0,6.0464,a8w8_rowwise_128x32x16x128_16x16_1x1_8x16x1_8x16x1_1x16x1x8_2x2x1_1x1_interwave_v2,69.37,1144.85,0.0
256,32,5120,3200,torch.int8,76,0,10.1191,a8w8_rowwise_128x32x16x128_16x16_1x1_8x16x1_8x16x1_1x16x1x8_2x2x1_1x1_interwave_v2,103.62,1661.62,0.0
256,32,5120,5120,torch.int8,34,0,10.4248,a8w8_rowwise_256x16x64x512_16x16_1x1_32x8x1_32x8x1_1x16x1x16_4x4x1_1x1_intrawave_v3,160.94,2561.77,0.0
256,32,5120,6400,torch.int8,34,0,15.0885,a8w8_rowwise_256x16x64x512_16x16_1x1_32x8x1_32x8x1_1x16x1x16_4x4x1_1x1_intrawave_v3,138.99,2207.01,0.0
256,32,5120,25600,torch.int8,34,0,38.3258,a8w8_rowwise_256x16x64x512_16x16_1x1_32x8x1_32x8x1_1x16x1x16_4x4x1_1x1_intrawave_v3,218.88,3449.87,0.0
256,64,5120,640,torch.int8,77,0,5.0956,a8w8_rowwise_64x16x16x64_16x16_1x1_4x16x1_4x16x1_1x16x1x4_4x4x1_1x1_interwave_v2,82.31,779.72,0.0
256,64,5120,1280,torch.int8,76,0,6.4203,a8w8_rowwise_128x32x16x128_16x16_1x1_8x16x1_8x16x1_1x16x1x8_2x2x1_1x1_interwave_v2,130.66,1135.6,0.0
256,64,5120,3200,torch.int8,76,0,10.7687,a8w8_rowwise_128x32x16x128_16x16_1x1_8x16x1_8x16x1_1x16x1x8_2x2x1_1x1_interwave_v2,194.75,1601.32,0.0
256,64,5120,5120,torch.int8,30,0,11.7059,a8w8_rowwise_256x32x64x512_16x16_1x2_32x8x1_32x8x1_1x32x1x8_8x8x1_1x2_intrawave_v3,286.65,2323.4,0.0
256,64,5120,6400,torch.int8,30,0,16.907,a8w8_rowwise_256x32x64x512_16x16_1x2_32x8x1_32x8x1_1x32x1x8_8x8x1_1x2_intrawave_v3,248.08,2001.12,0.0
256,64,5120,25600,torch.int8,30,0,43.5801,a8w8_rowwise_256x32x64x512_16x16_1x2_32x8x1_32x8x1_1x32x1x8_8x8x1_1x2_intrawave_v3,384.97,3060.24,0.0
256,128,5120,640,torch.int8,79,0,5.566,a8w8_rowwise_128x16x32x128_16x16_1x1_8x16x1_8x16x1_1x16x1x8_4x4x1_1x1_interwave_v2,150.71,838.92,0.0
256,128,5120,1280,torch.int8,23,0,7.6695,a8w8_rowwise_256x64x64x512_32x32_1x1_32x8x1_32x8x1_1x32x1x8_8x8x1_1x1_intrawave_v3,218.75,1046.76,0.0
256,128,5120,3200,torch.int8,23,0,11.8363,a8w8_rowwise_256x64x64x512_32x32_1x1_32x8x1_32x8x1_1x32x1x8_8x8x1_1x1_intrawave_v3,354.36,1529.56,0.0
256,128,5120,5120,torch.int8,23,0,14.1859,a8w8_rowwise_256x64x64x512_32x32_1x1_32x8x1_32x8x1_1x32x1x8_8x8x1_1x1_intrawave_v3,473.07,1986.51,0.0
256,128,5120,6400,torch.int8,23,0,18.7826,a8w8_rowwise_256x64x64x512_32x32_1x1_32x8x1_32x8x1_1x32x1x8_8x8x1_1x1_intrawave_v3,446.62,1857.99,0.0
256,128,5120,25600,torch.int8,23,0,54.0309,a8w8_rowwise_256x64x64x512_32x32_1x1_32x8x1_32x8x1_1x32x1x8_8x8x1_1x1_intrawave_v3,621.02,2510.78,0.0
256,256,5120,640,torch.int8,81,0,6.6084,a8w8_rowwise_128x32x64x128_32x32_1x1_8x16x1_8x16x1_1x16x1x8_8x8x1_1x1_interwave_v2,253.88,917.33,0.0
256,256,5120,1280,torch.int8,15,0,8.2757,a8w8_rowwise_256x128x64x256_32x32_2x1_16x16x1_16x16x1_1x32x1x8_8x8x1_1x1_intrawave_v3,405.46,1148.27,0.0
256,256,5120,3200,torch.int8,15,0,15.7837,a8w8_rowwise_256x128x64x256_32x32_2x1_16x16x1_16x16x1_1x32x1x8_8x8x1_1x1_intrawave_v3,531.47,1256.02,0.0
256,256,5120,5120,torch.int8,23,0,21.8405,a8w8_rowwise_256x64x64x512_32x32_1x1_32x8x1_32x8x1_1x32x1x8_8x8x1_1x1_intrawave_v3,614.54,1380.31,0.0
256,256,5120,6400,torch.int8,21,0,23.7832,a8w8_rowwise_256x64x128x256_32x32_1x2_16x16x1_16x16x1_1x32x1x8_8x8x1_1x1_intrawave_v3,705.42,1556.89,0.0
256,256,5120,25600,torch.int8,23,0,86.0166,a8w8_rowwise_256x64x64x512_32x32_1x1_32x8x1_32x8x1_1x32x1x8_8x8x1_1x1_intrawave_v3,780.19,1630.46,0.0
256,512,5120,640,torch.int8,47,0,8.4036,a8w8_rowwise_256x64x64x128_32x32_1x1_8x32x1_8x32x1_1x32x1x8_8x8x1_1x1_intrawave_v3,399.29,1052.81,0.0
256,512,5120,1280,torch.int8,22,0,12.2285,a8w8_rowwise_256x64x96x256_16x16_2x3_16x16x1_16x16x1_1x64x1x4_8x8x1_2x1_intrawave_v3,548.79,1018.26,0.0
256,512,5120,3200,torch.int8,13,0,21.8498,a8w8_rowwise_256x128x128x128_32x32_2x2_8x32x1_8x32x1_1x32x1x8_8x8x1_1x1_intrawave_v3,767.84,1064.78,0.0
256,512,5120,5120,torch.int8,23,0,33.1376,a8w8_rowwise_256x64x64x512_32x32_1x1_32x8x1_32x8x1_1x32x1x8_8x8x1_1x1_intrawave_v3,810.06,1028.4,0.0
256,512,5120,6400,torch.int8,15,0,38.8017,a8w8_rowwise_256x128x64x256_32x32_2x1_16x16x1_16x16x1_1x32x1x8_8x8x1_1x1_intrawave_v3,864.77,1064.07,0.0
256,512,5120,25600,torch.int8,23,0,131.897,a8w8_rowwise_256x64x64x512_32x32_1x1_32x8x1_32x8x1_1x32x1x8_8x8x1_1x1_intrawave_v3,1017.6,1132.87,0.0
256,1024,5120,640,torch.int8,11,0,11.7704,a8w8_rowwise_256x128x160x128_32x32_1x5_8x32x1_8x32x1_1x64x1x4_8x8x1_1x1_intrawave_v3,570.15,1224.93,0.0
256,1024,5120,1280,torch.int8,11,0,17.5871,a8w8_rowwise_256x128x160x128_32x32_1x5_8x32x1_8x32x1_1x64x1x4_8x8x1_1x1_intrawave_v3,763.16,1043.38,0.0
256,1024,5120,3200,torch.int8,11,0,27.688,a8w8_rowwise_256x128x160x128_32x32_1x5_8x32x1_8x32x1_1x64x1x4_8x8x1_1x1_intrawave_v3,1211.88,1088.8,0.0
256,1024,5120,5120,torch.int8,23,0,55.7649,a8w8_rowwise_256x64x64x512_32x32_1x1_32x8x1_32x8x1_1x32x1x8_8x8x1_1x1_intrawave_v3,962.74,752.14,0.0
256,1024,5120,6400,torch.int8,11,0,57.5786,a8w8_rowwise_256x128x160x128_32x32_1x5_8x32x1_8x32x1_1x64x1x4_8x8x1_1x1_intrawave_v3,1165.52,865.03,0.0
256,1024,5120,25600,torch.int8,23,0,227.1849,a8w8_rowwise_256x64x64x512_32x32_1x1_32x8x1_32x8x1_1x32x1x8_8x8x1_1x1_intrawave_v3,1181.57,738.48,0.0
256,2048,5120,640,torch.int8,10,0,17.6749,a8w8_rowwise_256x128x192x128_32x32_2x3_8x32x1_8x32x1_1x32x1x8_8x8x1_1x1_intrawave_v3,759.37,1446.06,0.0
256,2048,5120,1280,torch.int8,4,0,27.4475,a8w8_rowwise_256x256x160x128_32x32_2x5_8x32x1_8x32x1_1x64x1x4_8x8x1_2x1_intrawave_v3,978.0,1098.34,0.0
256,2048,5120,3200,torch.int8,4,0,44.9517,a8w8_rowwise_256x256x160x128_32x32_2x5_8x32x1_8x32x1_1x64x1x4_8x8x1_2x1_intrawave_v3,1492.91,976.81,0.0
256,2048,5120,5120,torch.int8,15,0,96.048,a8w8_rowwise_256x128x64x256_32x32_2x1_16x16x1_16x16x1_1x32x1x8_8x8x1_1x1_intrawave_v3,1117.92,600.45,0.0
256,2048,5120,6400,torch.int8,4,0,90.0028,a8w8_rowwise_256x256x160x128_32x32_2x5_8x32x1_8x32x1_1x64x1x4_8x8x1_2x1_intrawave_v3,1491.26,742.72,0.0
256,2048,5120,25600,torch.int8,15,0,419.2679,a8w8_rowwise_256x128x64x256_32x32_2x1_16x16x1_16x16x1_1x32x1x8_8x8x1_1x1_intrawave_v3,1280.5,487.69,0.0
256,4096,5120,640,torch.int8,13,0,32.4583,a8w8_rowwise_256x128x128x128_32x32_2x2_8x32x1_8x32x1_1x32x1x8_8x8x1_1x1_intrawave_v3,827.02,1473.93,0.0
256,4096,5120,1280,torch.int8,13,0,50.6317,a8w8_rowwise_256x128x128x128_32x32_2x2_8x32x1_8x32x1_1x32x1x8_8x8x1_1x1_intrawave_v3,1060.35,1061.38,0.0
256,4096,5120,3200,torch.int8,4,0,86.6115,a8w8_rowwise_256x256x160x128_32x32_2x5_8x32x1_8x32x1_1x64x1x4_8x8x1_2x1_intrawave_v3,1549.65,824.77,0.0
256,4096,5120,5120,torch.int8,15,0,177.0814,a8w8_rowwise_256x128x64x256_32x32_2x1_16x16x1_16x16x1_1x32x1x8_8x8x1_1x1_intrawave_v3,1212.71,503.32,0.0
256,4096,5120,6400,torch.int8,4,0,162.2341,a8w8_rowwise_256x256x160x128_32x32_2x5_8x32x1_8x32x1_1x64x1x4_8x8x1_2x1_intrawave_v3,1654.62,622.1,0.0
256,4096,5120,25600,torch.int8,15,0,782.4893,a8w8_rowwise_256x128x64x256_32x32_2x1_16x16x1_16x16x1_1x32x1x8_8x8x1_1x1_intrawave_v3,1372.21,355.11,0.0
256,8192,5120,640,torch.int8,42,0,55.1814,a8w8_rowwise_256x128x256x64_32x32_2x4_4x64x1_4x64x1_1x32x1x8_8x8x1_1x1_interwave_v1,972.92,1674.58,0.0
256,8192,5120,1280,torch.int8,39,0,86.4091,a8w8_rowwise_256x224x256x128_16x16_7x8_8x32x1_8x32x1_1x32x1x8_8x8x1_1x2_intrawave_v3,1242.63,1168.0,0.0
256,8192,5120,3200,torch.int8,40,0,149.3935,a8w8_rowwise_256x256x224x128_16x16_8x7_8x32x1_8x32x1_1x64x1x4_8x8x1_2x1_intrawave_v3,1796.83,846.65,0.0
256,8192,5120,5120,torch.int8,39,0,277.9848,a8w8_rowwise_256x224x256x128_16x16_7x8_8x32x1_8x32x1_1x32x1x8_8x8x1_1x2_intrawave_v3,1545.04,546.95,0.0
256,8192,5120,6400,torch.int8,40,0,276.3348,a8w8_rowwise_256x256x224x128_16x16_8x7_8x32x1_8x32x1_1x64x1x4_8x8x1_2x1_intrawave_v3,1942.83,611.88,0.0
256,8192,5120,25600,torch.int8,39,0,1513.1737,a8w8_rowwise_256x224x256x128_16x16_7x8_8x32x1_8x32x1_1x32x1x8_8x8x1_1x2_intrawave_v3,1419.19,280.65,0.0
256,16384,5120,640,torch.int8,43,0,99.8836,a8w8_rowwise_256x256x128x64_32x32_4x2_4x64x1_4x64x1_1x32x1x8_8x8x1_1x1_interwave_v1,1074.99,1817.46,0.0
256,16384,5120,1280,torch.int8,1,0,153.6015,a8w8_rowwise_256x256x256x128_32x32_4x4_8x32x1_8x32x1_1x32x1x8_8x8x1_1x1_intrawave_v3,1398.09,1271.45,0.0
256,16384,5120,3200,torch.int8,1,0,271.2735,a8w8_rowwise_256x256x256x128_32x32_4x4_8x32x1_8x32x1_1x32x1x8_8x8x1_1x1_intrawave_v3,1979.08,872.13,0.0
256,16384,5120,5120,torch.int8,1,0,518.1604,a8w8_rowwise_256x256x256x128_32x32_4x4_8x32x1_8x32x1_1x32x1x8_8x8x1_1x1_intrawave_v3,1657.78,536.27,0.0
256,16384,5120,6400,torch.int8,1,0,543.7765,a8w8_rowwise_256x256x256x128_32x32_4x4_8x32x1_8x32x1_1x32x1x8_8x8x1_1x1_intrawave_v3,1974.6,561.62,0.0
256,16384,5120,25600,torch.int8,1,0,2869.8056,a8w8_rowwise_256x256x256x128_32x32_4x4_8x32x1_8x32x1_1x32x1x8_8x8x1_1x1_intrawave_v3,1496.61,250.29,0.0
256,32768,5120,640,torch.int8,43,0,191.0117,a8w8_rowwise_256x256x128x64_32x32_4x2_4x64x1_4x64x1_1x32x1x8_8x8x1_1x1_interwave_v1,1124.27,1883.62,0.0
256,32768,5120,1280,torch.int8,1,0,299.0856,a8w8_rowwise_256x256x256x128_32x32_4x4_8x32x1_8x32x1_1x32x1x8_8x8x1_1x1_intrawave_v3,1436.03,1284.05,0.0
256,32768,5120,3200,torch.int8,1,0,538.4921,a8w8_rowwise_256x256x256x128_32x32_4x4_8x32x1_8x32x1_1x32x1x8_8x8x1_1x1_intrawave_v3,1993.98,848.27,0.0
256,32768,5120,5120,torch.int8,40,0,999.0598,a8w8_rowwise_256x256x224x128_16x16_8x7_8x32x1_8x32x1_1x64x1x4_8x8x1_2x1_intrawave_v3,1719.6,530.03,0.0
256,32768,5120,6400,torch.int8,1,0,1028.2651,a8w8_rowwise_256x256x256x128_32x32_4x4_8x32x1_8x32x1_1x32x1x8_8x8x1_1x1_intrawave_v3,2088.45,562.14,0.0
256,32768,5120,25600,torch.int8,1,0,5734.5832,a8w8_rowwise_256x256x256x128_32x32_4x4_8x32x1_8x32x1_1x32x1x8_8x8x1_1x1_intrawave_v3,1497.92,227.65,0.0
256,1,6400,5120,torch.int8,34,0,12.7506,a8w8_rowwise_256x16x64x512_16x16_1x1_32x8x1_32x8x1_1x16x1x16_4x4x1_1x1_intrawave_v3,5.14,2571.32,0.0
256,16,6400,5120,torch.int8,34,0,11.5523,a8w8_rowwise_256x16x64x512_16x16_1x1_32x8x1_32x8x1_1x16x1x16_4x4x1_1x1_intrawave_v3,90.77,2861.31,0.0
256,32,6400,5120,torch.int8,34,0,10.9816,a8w8_rowwise_256x16x64x512_16x16_1x1_32x8x1_32x8x1_1x16x1x16_4x4x1_1x1_intrawave_v3,190.97,3036.12,0.0
256,64,6400,5120,torch.int8,30,0,12.4817,a8w8_rowwise_256x32x64x512_16x16_1x2_32x8x1_32x8x1_1x32x1x8_8x8x1_1x2_intrawave_v3,336.04,2717.17,0.0
256,128,6400,5120,torch.int8,23,0,14.96,a8w8_rowwise_256x64x64x512_32x32_1x1_32x8x1_32x8x1_1x32x1x8_8x8x1_1x1_intrawave_v3,560.74,2343.7,0.0
256,256,6400,5120,torch.int8,23,0,22.7861,a8w8_rowwise_256x64x64x512_32x32_1x1_32x8x1_32x8x1_1x32x1x8_8x8x1_1x1_intrawave_v3,736.29,1639.4,0.0
256,512,6400,5120,torch.int8,15,0,41.3468,a8w8_rowwise_256x128x64x256_32x32_2x1_16x16x1_16x16x1_1x32x1x8_8x8x1_1x1_intrawave_v3,811.54,1014.42,0.0
256,1024,6400,5120,torch.int8,23,0,72.0506,a8w8_rowwise_256x64x64x512_32x32_1x1_32x8x1_32x8x1_1x32x1x8_8x8x1_1x1_intrawave_v3,931.41,709.47,0.0
256,2048,6400,5120,torch.int8,39,0,107.5421,a8w8_rowwise_256x224x256x128_16x16_7x8_8x32x1_8x32x1_1x32x1x8_8x8x1_1x2_intrawave_v3,1248.05,645.96,0.0
256,4096,6400,5120,torch.int8,39,0,188.523,a8w8_rowwise_256x224x256x128_16x16_7x8_8x32x1_8x32x1_1x32x1x8_8x8x1_1x2_intrawave_v3,1423.89,563.16,0.0
256,8192,6400,5120,torch.int8,39,0,359.0195,a8w8_rowwise_256x224x256x128_16x16_7x8_8x32x1_8x32x1_1x32x1x8_8x8x1_1x2_intrawave_v3,1495.38,500.16,0.0
256,16384,6400,5120,torch.int8,40,0,690.0605,a8w8_rowwise_256x256x224x128_16x16_8x7_8x32x1_8x32x1_1x64x1x4_8x8x1_2x1_intrawave_v3,1556.01,472.96,0.0
256,32768,6400,5120,torch.int8,40,0,1274.1106,a8w8_rowwise_256x256x224x128_16x16_8x7_8x32x1_8x32x1_1x64x1x4_8x8x1_2x1_intrawave_v3,1685.48,486.59,0.0
256,1,7168,8192,torch.int8,34,0,19.015,a8w8_rowwise_256x16x64x512_16x16_1x1_32x8x1_32x8x1_1x16x1x16_4x4x1_1x1_intrawave_v3,6.18,3089.29,0.0
256,16,7168,8192,torch.float8_e4m3fn,80,2,15.5438,a8w8_rowwise_128x16x64x128_16x16_1x2_8x16x1_8x16x1_1x16x1x8_4x4x1_1x1_interwave_v2,120.89,3800.92,0.1089
256,16,7168,8192,torch.int8,34,0,16.6523,a8w8_rowwise_256x16x64x512_16x16_1x1_32x8x1_32x8x1_1x16x1x16_4x4x1_1x1_intrawave_v3,112.84,3547.9,0.0
256,32,7168,8192,torch.float8_e4m3fn,34,0,17.4961,a8w8_rowwise_256x16x64x512_16x16_1x1_32x8x1_32x8x1_1x16x1x16_4x4x1_1x1_intrawave_v3,214.8,3397.39,0.0
256,32,7168,8192,torch.int8,34,0,16.942,a8w8_rowwise_256x16x64x512_16x16_1x1_32x8x1_32x8x1_1x16x1x16_4x4x1_1x1_intrawave_v3,221.82,3508.51,0.0
256,64,7168,8192,torch.float8_e4m3fn,30,0,19.78,a8w8_rowwise_256x32x64x512_16x16_1x2_32x8x1_32x8x1_1x32x1x8_8x8x1_1x2_intrawave_v3,379.99,3041.56,0.0
256,64,7168,8192,torch.int8,30,0,18.4286,a8w8_rowwise_256x32x64x512_16x16_1x2_32x8x1_32x8x1_1x32x1x8_8x8x1_1x2_intrawave_v3,407.85,3264.6,0.0
256,128,7168,8192,torch.float8_e4m3fn,23,0,22.197,a8w8_rowwise_256x64x64x512_32x32_1x1_32x8x1_32x8x1_1x32x1x8_8x8x1_1x1_intrawave_v3,677.23,2775.32,0.0
256,128,7168,8192,torch.int8,28,0,26.0097,a8w8_rowwise_256x32x128x256_32x32_1x1_16x16x1_16x16x1_1x32x1x8_8x8x1_1x1_intrawave_v3,577.95,2368.49,0.0
256,256,7168,8192,torch.float8_e4m3fn,15,0,30.0111,a8w8_rowwise_256x128x64x256_32x32_2x1_16x16x1_16x16x1_1x32x1x8_8x8x1_1x1_intrawave_v3,1001.79,2148.79,0.0
256,256,7168,8192,torch.int8,15,0,30.291,a8w8_rowwise_256x128x64x256_32x32_2x1_16x16x1_16x16x1_1x32x1x8_8x8x1_1x1_intrawave_v3,992.53,2128.93,0.0
256,512,7168,8192,torch.int8,41,0,47.5197,a8w8_rowwise_256x128x128x128_32x32_2x2_8x32x1_8x32x1_1x32x1x8_8x8x1_1x1_intrawave_v5,1265.36,1478.43,0.0
256,1024,7168,8192,torch.int8,13,0,82.6278,a8w8_rowwise_256x128x128x128_32x32_2x2_8x32x1_8x32x1_1x32x1x8_8x8x1_1x1_intrawave_v3,1455.43,989.85,0.0
256,2048,7168,8192,torch.int8,2,0,116.6871,a8w8_rowwise_256x256x224x128_32x32_2x7_8x32x1_8x32x1_1x64x1x4_8x8x1_2x1_intrawave_v3,2061.22,898.62,0.0
256,4096,7168,8192,torch.int8,2,0,219.2844,a8w8_rowwise_256x256x224x128_32x32_2x7_8x32x1_8x32x1_1x64x1x4_8x8x1_2x1_intrawave_v3,2193.66,688.58,0.0
256,8192,7168,8192,torch.int8,2,0,420.8889,a8w8_rowwise_256x256x224x128_32x32_2x7_8x32x1_8x32x1_1x64x1x4_8x8x1_2x1_intrawave_v3,2285.81,577.99,0.0
256,16384,7168,8192,torch.int8,1,0,815.6995,a8w8_rowwise_256x256x256x128_32x32_4x4_8x32x1_8x32x1_1x32x1x8_8x8x1_1x1_intrawave_v3,2358.89,524.48,0.0
256,32768,7168,8192,torch.int8,1,0,1620.6254,a8w8_rowwise_256x256x256x128_32x32_4x4_8x32x1_8x32x1_1x32x1x8_8x8x1_1x1_intrawave_v3,2374.57,491.73,0.0
256,16,7424,8192,torch.float8_e4m3fn,60,2,16.1728,a8w8_rowwise_128x16x32x128_16x16_1x1_8x16x1_8x16x1_1x16x1x8_4x4x1_1x1_intrawave_v2,120.34,3783.27,0.1076
256,32,7424,8192,torch.float8_e4m3fn,34,0,17.6324,a8w8_rowwise_256x16x64x512_16x16_1x1_32x8x1_32x8x1_1x16x1x16_4x4x1_1x1_intrawave_v3,220.75,3491.0,0.0
256,48,7424,8192,torch.float8_e4m3fn,74,2,20.2638,a8w8_rowwise_128x64x32x128_32x32_1x1_8x16x1_8x16x1_1x16x1x8_4x4x1_1x1_interwave_v2,288.12,3055.86,0.1076
256,64,7424,8192,torch.float8_e4m3fn,30,0,20.8916,a8w8_rowwise_256x32x64x512_16x16_1x2_32x8x1_32x8x1_1x32x1x8_8x8x1_1x2_intrawave_v3,372.62,2981.68,0.0
256,4096,7424,8192,torch.float8_e4m3fn,1,0,232.7657,a8w8_rowwise_256x256x256x128_32x32_4x4_8x32x1_8x32x1_1x32x1x8_8x8x1_1x1_intrawave_v3,2140.42,666.72,0.0
256,5120,7424,8192,torch.float8_e4m3fn,2,0,308.3064,a8w8_rowwise_256x256x224x128_32x32_2x7_8x32x1_8x32x1_1x64x1x4_8x8x1_2x1_intrawave_v3,2019.97,579.88,0.0
256,8192,7424,8192,torch.float8_e4m3fn,1,0,441.2013,a8w8_rowwise_256x256x256x128_32x32_4x4_8x32x1_8x32x1_1x32x1x8_8x8x1_1x1_intrawave_v3,2258.45,565.64,0.0
256,1,8192,1024,torch.float8_e4m3fn,60,0,6.3982,a8w8_rowwise_128x16x32x128_16x16_1x1_8x16x1_8x16x1_1x16x1x8_4x4x1_1x1_intrawave_v2,2.62,1313.81,0.0
256,1,8192,1024,torch.int8,79,0,5.7218,a8w8_rowwise_128x16x32x128_16x16_1x1_8x16x1_8x16x1_1x16x1x8_4x4x1_1x1_interwave_v2,2.93,1469.12,0.0
256,1,8192,2048,torch.int8,34,0,7.1625,a8w8_rowwise_256x16x64x512_16x16_1x1_32x8x1_32x8x1_1x16x1x16_4x4x1_1x1_intrawave_v3,4.68,2344.94,0.0
256,1,8192,3584,torch.int8,34,0,11.2488,a8w8_rowwise_256x16x64x512_16x16_1x1_32x8x1_32x8x1_1x16x1x16_4x4x1_1x1_intrawave_v3,5.22,2611.84,0.0
256,1,8192,7168,torch.int8,34,0,16.9371,a8w8_rowwise_256x16x64x512_16x16_1x1_32x8x1_32x8x1_1x16x1x16_4x4x1_1x1_intrawave_v3,6.93,3468.35,0.0
256,1,8192,8192,torch.int8,34,0,19.4709,a8w8_rowwise_256x16x64x512_16x16_1x1_32x8x1_32x8x1_1x16x1x16_4x4x1_1x1_intrawave_v3,6.89,3447.89,0.0
256,1,8192,28672,torch.int8,34,0,59.8294,a8w8_rowwise_256x16x64x512_16x16_1x1_32x8x1_32x8x1_1x16x1x16_4x4x1_1x1_intrawave_v3,7.85,3926.6,0.0
256,16,8192,1024,torch.int8,79,0,5.4586,a8w8_rowwise_128x16x32x128_16x16_1x1_8x16x1_8x16x1_1x16x1x8_4x4x1_1x1_interwave_v2,49.18,1587.79,0.0
256,16,8192,2048,torch.int8,79,0,7.2552,a8w8_rowwise_128x16x32x128_16x16_1x1_8x16x1_8x16x1_1x16x1x8_4x4x1_1x1_interwave_v2,74.0,2353.09,0.0
256,16,8192,3584,torch.int8,34,0,10.6477,a8w8_rowwise_256x16x64x512_16x16_1x1_32x8x1_32x8x1_1x16x1x16_4x4x1_1x1_intrawave_v3,88.24,2787.42,0.0
256,16,8192,7168,torch.int8,34,0,15.2131,a8w8_rowwise_256x16x64x512_16x16_1x1_32x8x1_32x8x1_1x16x1x16_4x4x1_1x1_intrawave_v3,123.52,3884.62,0.0
256,16,8192,8192,torch.float8_e4m3fn,80,2,17.7026,a8w8_rowwise_128x16x64x128_16x16_1x2_8x16x1_8x16x1_1x16x1x8_4x4x1_1x1_interwave_v2,121.31,3813.12,0.107
256,16,8192,8192,torch.int8,34,0,17.2283,a8w8_rowwise_256x16x64x512_16x16_1x1_32x8x1_32x8x1_1x16x1x16_4x4x1_1x1_intrawave_v3,124.65,3918.09,0.0
256,16,8192,28672,torch.int8,34,0,55.9502,a8w8_rowwise_256x16x64x512_16x16_1x1_32x8x1_32x8x1_1x16x1x16_4x4x1_1x1_intrawave_v3,134.34,4210.92,0.0
256,32,8192,1024,torch.float8_e4m3fn,79,0,6.5212,a8w8_rowwise_128x16x32x128_16x16_1x1_8x16x1_8x16x1_1x16x1x8_4x4x1_1x1_interwave_v2,82.33,1371.78,0.0
256,32,8192,1024,torch.int8,79,0,5.6281,a8w8_rowwise_128x16x32x128_16x16_1x1_8x16x1_8x16x1_1x16x1x8_4x4x1_1x1_interwave_v2,95.39,1589.46,0.0
256,32,8192,2048,torch.int8,76,0,7.2889,a8w8_rowwise_128x32x16x128_16x16_1x1_8x16x1_8x16x1_1x16x1x8_2x2x1_1x1_interwave_v2,147.31,2382.67,0.0
256,32,8192,3584,torch.int8,34,0,9.4243,a8w8_rowwise_256x16x64x512_16x16_1x1_32x8x1_32x8x1_1x16x1x16_4x4x1_1x1_intrawave_v3,199.38,3183.17,0.0
256,32,8192,7168,torch.int8,34,0,16.2902,a8w8_rowwise_256x16x64x512_16x16_1x1_32x8x1_32x8x1_1x16x1x16_4x4x1_1x1_intrawave_v3,230.7,3650.9,0.0
256,32,8192,8192,torch.float8_e4m3fn,34,0,18.0338,a8w8_rowwise_256x16x64x512_16x16_1x1_32x8x1_32x8x1_1x16x1x16_4x4x1_1x1_intrawave_v3,238.16,3764.89,0.0
256,32,8192,8192,torch.int8,34,0,17.4586,a8w8_rowwise_256x16x64x512_16x16_1x1_32x8x1_32x8x1_1x16x1x16_4x4x1_1x1_intrawave_v3,246.01,3888.93,0.0
256,32,8192,28672,torch.int8,34,0,54.7382,a8w8_rowwise_256x16x64x512_16x16_1x1_32x8x1_32x8x1_1x16x1x16_4x4x1_1x1_intrawave_v3,274.62,4317.33,0.0
256,64,8192,1024,torch.float8_e4m3fn,79,0,7.3716,a8w8_rowwise_128x16x32x128_16x16_1x1_8x16x1_8x16x1_1x16x1x8_4x4x1_1x1_interwave_v2,145.66,1289.1,0.0
256,64,8192,1024,torch.int8,55,0,6.4279,a8w8_rowwise_128x64x32x128_32x32_1x1_8x16x1_8x16x1_1x16x1x8_4x4x1_1x1_intrawave_v2,167.04,1478.36,0.0
256,64,8192,2048,torch.int8,30,0,7.5798,a8w8_rowwise_256x32x64x512_16x16_1x2_32x8x1_32x8x1_1x32x1x8_8x8x1_1x2_intrawave_v3,283.32,2369.04,0.0
256,64,8192,3584,torch.int8,30,0,11.279,a8w8_rowwise_256x32x64x512_16x16_1x2_32x8x1_32x8x1_1x32x1x8_8x8x1_1x2_intrawave_v3,333.19,2716.38,0.0
256,64,8192,7168,torch.int8,30,0,17.495,a8w8_rowwise_256x32x64x512_16x16_1x2_32x8x1_32x8x1_1x32x1x8_8x8x1_1x2_intrawave_v3,429.62,3442.56,0.0
256,64,8192,8192,torch.float8_e4m3fn,30,0,19.8829,a8w8_rowwise_256x32x64x512_16x16_1x2_32x8x1_32x8x1_1x32x1x8_8x8x1_1x2_intrawave_v3,432.03,3454.31,0.0
256,64,8192,8192,torch.int8,30,0,19.4045,a8w8_rowwise_256x32x64x512_16x16_1x2_32x8x1_32x8x1_1x32x1x8_8x8x1_1x2_intrawave_v3,442.68,3539.47,0.0
256,64,8192,28672,torch.int8,30,0,61.7622,a8w8_rowwise_256x32x64x512_16x16_1x2_32x8x1_32x8x1_1x32x1x8_8x8x1_1x2_intrawave_v3,486.78,3849.68,0.0
256,128,8192,1024,torch.float8_e4m3fn,15,0,8.3628,a8w8_rowwise_256x128x64x256_32x32_2x1_16x16x1_16x16x1_1x32x1x8_8x8x1_1x1_intrawave_v3,256.79,1269.53,0.0
256,128,8192,1024,torch.int8,28,0,7.1186,a8w8_rowwise_256x32x128x256_32x32_1x1_16x16x1_16x16x1_1x32x1x8_8x8x1_1x1_intrawave_v3,301.67,1491.42,0.0
256,128,8192,2048,torch.int8,23,0,10.2945,a8w8_rowwise_256x64x64x512_32x32_1x1_32x8x1_32x8x1_1x32x1x8_8x8x1_1x1_intrawave_v3,417.21,1858.91,0.0
256,128,8192,3584,torch.int8,28,0,13.8708,a8w8_rowwise_256x32x128x256_32x32_1x1_16x16x1_16x16x1_1x32x1x8_8x8x1_1x1_intrawave_v3,541.87,2300.95,0.0
256,128,8192,7168,torch.int8,28,0,24.2653,a8w8_rowwise_256x32x128x256_32x32_1x1_16x16x1_16x16x1_1x32x1x8_8x8x1_1x1_intrawave_v3,619.5,2544.16,0.0
256,128,8192,8192,torch.float8_e4m3fn,23,0,23.2545,a8w8_rowwise_256x64x64x512_32x32_1x1_32x8x1_32x8x1_1x32x1x8_8x8x1_1x1_intrawave_v3,738.78,3021.12,0.0
256,128,8192,8192,torch.int8,28,0,26.3513,a8w8_rowwise_256x32x128x256_32x32_1x1_16x16x1_16x16x1_1x32x1x8_8x8x1_1x1_intrawave_v3,651.96,2666.08,0.0
256,128,8192,28672,torch.int8,28,0,87.5085,a8w8_rowwise_256x32x128x256_32x32_1x1_16x16x1_16x16x1_1x32x1x8_8x8x1_1x1_intrawave_v3,687.13,2750.0,0.0
256,192,8192,1024,torch.float8_e4m3fn,21,0,8.6496,a8w8_rowwise_256x64x128x256_32x32_1x2_16x16x1_16x16x1_1x32x1x8_8x8x1_1x1_intrawave_v3,372.41,1356.24,0.0
256,192,8192,1024,torch.int8,15,0,8.651,a8w8_rowwise_256x128x64x256_32x32_2x1_16x16x1_16x16x1_1x32x1x8_8x8x1_1x1_intrawave_v3,372.35,1356.02,0.0
256,256,8192,1024,torch.float8_e4m3fn,15,0,9.1986,a8w8_rowwise_256x128x64x256_32x32_2x1_16x16x1_16x16x1_1x32x1x8_8x8x1_1x1_intrawave_v3,466.92,1396.41,0.0
256,256,8192,1024,torch.int8,21,0,8.6043,a8w8_rowwise_256x64x128x256_32x32_1x2_16x16x1_16x16x1_1x32x1x8_8x8x1_1x1_intrawave_v3,499.17,1492.86,0.0
256,256,8192,2048,torch.int8,15,0,10.9387,a8w8_rowwise_256x128x64x256_32x32_2x1_16x16x1_16x16x1_1x32x1x8_8x8x1_1x1_intrawave_v3,785.28,1965.12,0.0
256,256,8192,3584,torch.int8,15,0,16.5846,a8w8_rowwise_256x128x64x256_32x32_2x1_16x16x1_16x16x1_1x32x1x8_8x8x1_1x1_intrawave_v3,906.41,2078.55,0.0
256,256,8192,7168,torch.int8,21,0,29.138,a8w8_rowwise_256x64x128x256_32x32_1x2_16x16x1_16x16x1_1x32x1x8_8x8x1_1x1_intrawave_v3,1031.81,2222.17,0.0
256,256,8192,8192,torch.float8_e4m3fn,15,0,31.0706,a8w8_rowwise_256x128x64x256_32x32_2x1_16x16x1_16x16x1_1x32x1x8_8x8x1_1x1_intrawave_v3,1105.86,2362.37,0.0
256,256,8192,8192,torch.int8,15,0,31.6256,a8w8_rowwise_256x128x64x256_32x32_2x1_16x16x1_16x16x1_1x32x1x8_8x8x1_1x1_intrawave_v3,1086.45,2320.91,0.0
256,256,8192,28672,torch.int8,15,0,102.0397,a8w8_rowwise_256x128x64x256_32x32_2x1_16x16x1_16x16x1_1x32x1x8_8x8x1_1x1_intrawave_v3,1178.55,2414.9,0.0
256,320,8192,1024,torch.float8_e4m3fn,62,0,12.0692,a8w8_rowwise_128x32x64x128_32x32_1x1_8x16x1_8x16x1_1x16x1x8_8x8x1_1x1_intrawave_v2,444.83,1156.59,0.0
256,320,8192,1024,torch.int8,47,0,11.5098,a8w8_rowwise_256x64x64x128_32x32_1x1_8x32x1_8x32x1_1x32x1x8_8x8x1_1x1_intrawave_v3,466.45,1212.81,0.0
256,512,8192,1024,torch.float8_e4m3fn,13,0,12.6356,a8w8_rowwise_256x128x128x128_32x32_2x2_8x32x1_8x32x1_1x32x1x8_8x8x1_1x1_intrawave_v3,679.82,1369.27,0.0
256,512,8192,1024,torch.int8,13,0,11.7749,a8w8_rowwise_256x128x128x128_32x32_2x2_8x32x1_8x32x1_1x32x1x8_8x8x1_1x1_intrawave_v3,729.51,1469.35,0.0
256,512,8192,2048,torch.int8,41,0,16.8904,a8w8_rowwise_256x128x128x128_32x32_2x2_8x32x1_8x32x1_1x32x1x8_8x8x1_1x1_intrawave_v5,1017.14,1552.03,0.0
256,512,8192,3584,torch.int8,41,0,24.9561,a8w8_rowwise_256x128x128x128_32x32_2x2_8x32x1_8x32x1_1x32x1x8_8x8x1_1x1_intrawave_v5,1204.71,1586.14,0.0
256,512,8192,7168,torch.int8,41,0,44.168,a8w8_rowwise_256x128x128x128_32x32_2x2_8x32x1_8x32x1_1x32x1x8_8x8x1_1x1_intrawave_v5,1361.38,1602.49,0.0
256,512,8192,8192,torch.int8,13,0,51.209,a8w8_rowwise_256x128x128x128_32x32_2x2_8x32x1_8x32x1_1x32x1x8_8x8x1_1x1_intrawave_v3,1341.94,1556.21,0.0
256,512,8192,28672,torch.int8,41,0,150.8316,a8w8_rowwise_256x128x128x128_32x32_2x2_8x32x1_8x32x1_1x32x1x8_8x8x1_1x1_intrawave_v5,1594.61,1710.18,0.0
256,1024,8192,1024,torch.float8_e4m3fn,13,0,18.4495,a8w8_rowwise_256x128x128x128_32x32_2x2_8x32x1_8x32x1_1x32x1x8_8x8x1_1x1_intrawave_v3,931.18,1420.87,0.0
256,1024,8192,1024,torch.int8,13,0,17.3848,a8w8_rowwise_256x128x128x128_32x32_2x2_8x32x1_8x32x1_1x32x1x8_8x8x1_1x1_intrawave_v3,988.21,1507.89,0.0
256,1024,8192,2048,torch.int8,41,0,27.2285,a8w8_rowwise_256x128x128x128_32x32_2x2_8x32x1_8x32x1_1x32x1x8_8x8x1_1x1_intrawave_v5,1261.9,1309.35,0.0
256,1024,8192,3584,torch.int8,13,0,43.9928,a8w8_rowwise_256x128x128x128_32x32_2x2_8x32x1_8x32x1_1x32x1x8_8x8x1_1x1_intrawave_v3,1366.8,1132.17,0.0
256,1024,8192,7168,torch.int8,13,0,79.3336,a8w8_rowwise_256x128x128x128_32x32_2x2_8x32x1_8x32x1_1x32x1x8_8x8x1_1x1_intrawave_v3,1515.87,1044.17,0.0
256,1024,8192,8192,torch.int8,13,0,88.9386,a8w8_rowwise_256x128x128x128_32x32_2x2_8x32x1_8x32x1_1x32x1x8_8x8x1_1x1_intrawave_v3,1545.32,1037.51,0.0
256,1024,8192,28672,torch.int8,41,0,274.6402,a8w8_rowwise_256x128x128x128_32x32_2x2_8x32x1_8x32x1_1x32x1x8_8x8x1_1x1_intrawave_v5,1751.51,1023.22,0.0
256,2048,8192,1024,torch.float8_e4m3fn,43,0,31.5009,a8w8_rowwise_256x256x128x64_32x32_4x2_4x64x1_4x64x1_1x32x1x8_8x8x1_1x1_interwave_v1,1090.75,1398.06,0.0
256,2048,8192,1024,torch.int8,1,0,29.7892,a8w8_rowwise_256x256x256x128_32x32_4x4_8x32x1_8x32x1_1x32x1x8_8x8x1_1x1_intrawave_v3,1153.43,1478.39,0.0
256,2048,8192,2048,torch.int8,1,0,42.7444,a8w8_rowwise_256x256x256x128_32x32_4x4_8x32x1_8x32x1_1x32x1x8_8x8x1_1x1_intrawave_v3,1607.68,1275.63,0.0
256,2048,8192,3584,torch.int8,1,0,65.1518,a8w8_rowwise_256x256x256x128_32x32_4x4_8x32x1_8x32x1_1x32x1x8_8x8x1_1x1_intrawave_v3,1845.83,1078.32,0.0
256,2048,8192,7168,torch.int8,1,0,113.2102,a8w8_rowwise_256x256x256x128_32x32_4x4_8x32x1_8x32x1_1x32x1x8_8x8x1_1x1_intrawave_v3,2124.53,944.74,0.0
256,2048,8192,8192,torch.int8,1,0,125.3472,a8w8_rowwise_256x256x256x128_32x32_4x4_8x32x1_8x32x1_1x32x1x8_8x8x1_1x1_intrawave_v3,2192.93,936.92,0.0
256,2048,8192,28672,torch.int8,1,0,387.0603,a8w8_rowwise_256x256x256x128_32x32_4x4_8x32x1_8x32x1_1x32x1x8_8x8x1_1x1_intrawave_v3,2485.59,845.23,0.0
256,4096,8192,1024,torch.float8_e4m3fn,43,0,59.9656,a8w8_rowwise_256x256x128x64_32x32_4x2_4x64x1_4x64x1_1x32x1x8_8x8x1_1x1_interwave_v1,1145.98,1328.96,0.0
256,4096,8192,1024,torch.int8,1,0,55.6305,a8w8_rowwise_256x256x256x128_32x32_4x4_8x32x1_8x32x1_1x32x1x8_8x8x1_1x1_intrawave_v3,1235.28,1432.52,0.0
256,4096,8192,2048,torch.int8,1,0,83.0059,a8w8_rowwise_256x256x256x128_32x32_4x4_8x32x1_8x32x1_1x32x1x8_8x8x1_1x1_intrawave_v3,1655.77,1111.66,0.0
256,4096,8192,3584,torch.int8,1,0,122.3648,a8w8_rowwise_256x256x256x128_32x32_4x4_8x32x1_8x32x1_1x32x1x8_8x8x1_1x1_intrawave_v3,1965.58,908.34,0.0
256,4096,8192,7168,torch.int8,1,0,215.6239,a8w8_rowwise_256x256x256x128_32x32_4x4_8x32x1_8x32x1_1x32x1x8_8x8x1_1x1_intrawave_v3,2230.9,719.72,0.0
256,4096,8192,8192,torch.int8,1,0,240.0438,a8w8_rowwise_256x256x256x128_32x32_4x4_8x32x1_8x32x1_1x32x1x8_8x8x1_1x1_intrawave_v3,2290.23,698.92,0.0
256,4096,8192,28672,torch.int8,1,0,764.1022,a8w8_rowwise_256x256x256x128_32x32_4x4_8x32x1_8x32x1_1x32x1x8_8x8x1_1x1_intrawave_v3,2518.18,548.92,0.0
256,8192,8192,1024,torch.float8_e4m3fn,10,0,119.8588,a8w8_rowwise_256x128x192x128_32x32_2x3_8x32x1_8x32x1_1x32x1x8_8x8x1_1x1_intrawave_v3,1146.67,1259.77,0.0
256,8192,8192,1024,torch.int8,1,0,105.9654,a8w8_rowwise_256x256x256x128_32x32_4x4_8x32x1_8x32x1_1x32x1x8_8x8x1_1x1_intrawave_v3,1297.02,1424.95,0.0
256,8192,8192,2048,torch.int8,1,0,159.9883,a8w8_rowwise_256x256x256x128_32x32_4x4_8x32x1_8x32x1_1x32x1x8_8x8x1_1x1_intrawave_v3,1718.11,1048.65,0.0
256,8192,8192,3584,torch.int8,1,0,232.9396,a8w8_rowwise_256x256x256x128_32x32_4x4_8x32x1_8x32x1_1x32x1x8_8x8x1_1x1_intrawave_v3,2065.07,828.27,0.0
256,8192,8192,7168,torch.int8,1,0,412.978,a8w8_rowwise_256x256x256x128_32x32_4x4_8x32x1_8x32x1_1x32x1x8_8x8x1_1x1_intrawave_v3,2329.6,609.37,0.0
256,8192,8192,8192,torch.int8,1,0,469.2882,a8w8_rowwise_256x256x256x128_32x32_4x4_8x32x1_8x32x1_1x32x1x8_8x8x1_1x1_intrawave_v3,2342.93,572.01,0.0
256,8192,8192,28672,torch.int8,1,0,1532.6908,a8w8_rowwise_256x256x256x128_32x32_4x4_8x32x1_8x32x1_1x32x1x8_8x8x1_1x1_intrawave_v3,2510.81,394.06,0.0
256,16384,8192,1024,torch.float8_e4m3fn,10,0,221.8588,a8w8_rowwise_256x128x192x128_32x32_2x3_8x32x1_8x32x1_1x32x1x8_8x8x1_1x1_intrawave_v3,1238.98,1323.37,0.0
256,16384,8192,1024,torch.int8,10,0,198.2601,a8w8_rowwise_256x128x192x128_32x32_2x3_8x32x1_8x32x1_1x32x1x8_8x8x1_1x1_intrawave_v3,1386.45,1480.89,0.0
256,16384,8192,2048,torch.int8,1,0,299.7045,a8w8_rowwise_256x256x256x128_32x32_4x4_8x32x1_8x32x1_1x32x1x8_8x8x1_1x1_intrawave_v3,1834.33,1063.6,0.0
256,16384,8192,3584,torch.int8,1,0,463.2471,a8w8_rowwise_256x256x256x128_32x32_4x4_8x32x1_8x32x1_1x32x1x8_8x8x1_1x1_intrawave_v3,2076.8,769.6,0.0
256,16384,8192,7168,torch.int8,1,0,819.3844,a8w8_rowwise_256x256x256x128_32x32_4x4_8x32x1_8x32x1_1x32x1x8_8x8x1_1x1_intrawave_v3,2348.28,542.6,0.0
256,16384,8192,8192,torch.int8,1,0,933.9446,a8w8_rowwise_256x256x256x128_32x32_4x4_8x32x1_8x32x1_1x32x1x8_8x8x1_1x1_intrawave_v3,2354.55,502.99,0.0
256,16384,8192,28672,torch.int8,1,0,3088.0838,a8w8_rowwise_256x256x256x128_32x32_4x4_8x32x1_8x32x1_1x32x1x8_8x8x1_1x1_intrawave_v3,2492.35,315.11,0.0
256,32768,8192,1024,torch.int8,10,0,379.9256,a8w8_rowwise_256x128x192x128_32x32_2x3_8x32x1_8x32x1_1x32x1x8_8x8x1_1x1_intrawave_v3,1447.01,1523.49,0.0
256,32768,8192,2048,torch.int8,1,0,594.1387,a8w8_rowwise_256x256x256x128_32x32_4x4_8x32x1_8x32x1_1x32x1x8_8x8x1_1x1_intrawave_v3,1850.6,1044.8,0.0
256,32768,8192,3584,torch.int8,1,0,899.1908,a8w8_rowwise_256x256x256x128_32x32_4x4_8x32x1_8x32x1_1x32x1x8_8x8x1_1x1_intrawave_v3,2139.86,760.32,0.0
256,32768,8192,7168,torch.int8,1,0,1640.4404,a8w8_rowwise_256x256x256x128_32x32_4x4_8x32x1_8x32x1_1x32x1x8_8x8x1_1x1_intrawave_v3,2345.89,506.25,0.0
256,32768,8192,8192,torch.int8,1,0,1837.7153,a8w8_rowwise_256x256x256x128_32x32_4x4_8x32x1_8x32x1_1x32x1x8_8x8x1_1x1_intrawave_v3,2393.21,474.73,0.0
256,32768,8192,28672,torch.int8,1,0,6209.7387,a8w8_rowwise_256x256x256x128_32x32_4x4_8x32x1_8x32x1_1x32x1x8_8x8x1_1x1_intrawave_v3,2478.87,275.58,0.0
256,1,9216,2048,torch.float8_e4m3fn,34,0,6.5656,a8w8_rowwise_256x16x64x512_16x16_1x1_32x8x1_32x8x1_1x16x1x16_4x4x1_1x1_intrawave_v3,5.75,2877.86,0.0
256,1,9216,16384,torch.int8,34,0,34.1179,a8w8_rowwise_256x16x64x512_16x16_1x1_32x8x1_32x8x1_1x16x1x16_4x4x1_1x1_intrawave_v3,8.85,4426.7,0.0
256,2,9216,2048,torch.float8_e4m3fn,34,0,7.2627,a8w8_rowwise_256x16x64x512_16x16_1x1_32x8x1_32x8x1_1x16x1x16_4x4x1_1x1_intrawave_v3,10.4,2604.45,0.0
256,4,9216,2048,torch.float8_e4m3fn,34,0,6.8684,a8w8_rowwise_256x16x64x512_16x16_1x1_32x8x1_32x8x1_1x16x1x16_4x4x1_1x1_intrawave_v3,21.98,2759.93,0.0
256,8,9216,2048,torch.float8_e4m3fn,30,0,6.7126,a8w8_rowwise_256x32x64x512_16x16_1x2_32x8x1_32x8x1_1x32x1x8_8x8x1_1x2_intrawave_v3,44.99,2836.19,0.0
256,16,9216,2048,torch.float8_e4m3fn,34,0,6.6464,a8w8_rowwise_256x16x64x512_16x16_1x1_32x8x1_32x8x1_1x16x1x16_4x4x1_1x1_intrawave_v3,90.87,2889.09,0.0
256,16,9216,16384,torch.int8,34,0,33.174,a8w8_rowwise_256x16x64x512_16x16_1x1_32x8x1_32x8x1_1x16x1x16_4x4x1_1x1_intrawave_v3,145.65,4568.4,0.0
256,32,9216,2048,torch.float8_e4m3fn,30,0,7.4777,a8w8_rowwise_256x32x64x512_16x16_1x2_32x8x1_32x8x1_1x32x1x8_8x8x1_1x2_intrawave_v3,161.54,2611.73,0.0
256,32,9216,16384,torch.int8,30,0,34.6699,a8w8_rowwise_256x32x64x512_16x16_1x2_32x8x1_32x8x1_1x32x1x8_8x8x1_1x2_intrawave_v3,278.73,4387.35,0.0
256,48,9216,2048,torch.float8_e4m3fn,23,0,8.9112,a8w8_rowwise_256x64x64x512_32x32_1x1_32x8x1_32x8x1_1x32x1x8_8x8x1_1x1_intrawave_v3,203.33,2228.37,0.0
256,64,9216,2048,torch.float8_e4m3fn,23,0,8.0885,a8w8_rowwise_256x64x64x512_32x32_1x1_32x8x1_32x8x1_1x32x1x8_8x8x1_1x1_intrawave_v3,298.69,2495.53,0.0
256,64,9216,16384,torch.int8,23,0,41.0647,a8w8_rowwise_256x64x64x512_32x32_1x1_32x8x1_32x8x1_1x32x1x8_8x8x1_1x1_intrawave_v3,470.66,3731.26,0.0
256,80,9216,2048,torch.float8_e4m3fn,15,0,10.4174,a8w8_rowwise_256x128x64x256_32x32_2x1_16x16x1_16x16x1_1x32x1x8_8x8x1_1x1_intrawave_v3,289.89,1969.09,0.0
256,96,9216,2048,torch.float8_e4m3fn,28,0,10.0884,a8w8_rowwise_256x32x128x256_32x32_1x1_16x16x1_16x16x1_1x32x1x8_8x8x1_1x1_intrawave_v3,359.21,2065.78,0.0
256,112,9216,2048,torch.float8_e4m3fn,22,0,11.1502,a8w8_rowwise_256x64x96x256_16x16_2x3_16x16x1_16x16x1_1x64x1x4_8x8x1_2x1_intrawave_v3,379.17,1898.45,0.0
256,128,9216,2048,torch.float8_e4m3fn,22,0,10.7786,a8w8_rowwise_256x64x96x256_16x16_2x3_16x16x1_16x16x1_1x64x1x4_8x8x1_2x1_intrawave_v3,448.28,1994.3,0.0
256,128,9216,16384,torch.int8,23,0,59.454,a8w8_rowwise_256x64x64x512_32x32_1x1_32x8x1_32x8x1_1x32x1x8_8x8x1_1x1_intrawave_v3,650.16,2614.65,0.0
256,256,9216,2048,torch.float8_e4m3fn,14,0,13.9337,a8w8_rowwise_256x128x96x256_32x32_1x3_16x16x1_16x16x1_1x64x1x4_8x8x1_1x1_intrawave_v3,693.55,1730.86,0.0
256,256,9216,16384,torch.int8,23,0,86.8248,a8w8_rowwise_256x64x64x512_32x32_1x1_32x8x1_32x8x1_1x32x1x8_8x8x1_1x1_intrawave_v3,890.41,1841.73,0.0
256,512,9216,2048,torch.float8_e4m3fn,11,0,20.7927,a8w8_rowwise_256x128x160x128_32x32_1x5_8x32x1_8x32x1_1x64x1x4_8x8x1_1x1_intrawave_v3,929.53,1412.04,0.0
256,512,9216,16384,torch.int8,23,0,141.9471,a8w8_rowwise_256x64x64x512_32x32_1x1_32x8x1_32x8x1_1x32x1x8_8x8x1_1x1_intrawave_v3,1089.27,1189.32,0.0
256,667,9216,2048,torch.float8_e4m3fn,13,0,26.2291,a8w8_rowwise_256x128x128x128_32x32_2x2_8x32x1_8x32x1_1x32x1x8_8x8x1_1x1_intrawave_v3,959.94,1240.4,0.0
256,671,9216,2048,torch.float8_e4m3fn,13,0,26.9108,a8w8_rowwise_256x128x128x128_32x32_2x2_8x32x1_8x32x1_1x32x1x8_8x8x1_1x1_intrawave_v3,941.24,1212.02,0.0
256,931,9216,2048,torch.float8_e4m3fn,4,0,29.5666,a8w8_rowwise_256x256x160x128_32x32_2x5_8x32x1_8x32x1_1x64x1x4_8x8x1_2x1_intrawave_v3,1188.64,1283.25,0.0
256,1024,9216,2048,torch.float8_e4m3fn,4,0,30.7316,a8w8_rowwise_256x256x160x128_32x32_2x5_8x32x1_8x32x1_1x64x1x4_8x8x1_2x1_intrawave_v3,1257.82,1296.58,0.0
256,1024,9216,16384,torch.int8,15,0,243.9282,a8w8_rowwise_256x128x64x256_32x32_2x1_16x16x1_16x16x1_1x32x1x8_8x8x1_1x1_intrawave_v3,1267.74,765.17,0.0
256,1025,9216,2048,torch.float8_e4m3fn,10,0,34.2865,a8w8_rowwise_256x128x192x128_32x32_2x3_8x32x1_8x32x1_1x32x1x8_8x8x1_1x1_intrawave_v3,1128.5,1162.74,0.0
256,1027,9216,2048,torch.float8_e4m3fn,10,0,34.8489,a8w8_rowwise_256x128x192x128_32x32_2x3_8x32x1_8x32x1_1x32x1x8_8x8x1_1x1_intrawave_v3,1112.46,1145.15,0.0
256,1031,9216,2048,torch.float8_e4m3fn,10,0,34.4521,a8w8_rowwise_256x128x192x128_32x32_2x3_8x32x1_8x32x1_1x32x1x8_8x8x1_1x1_intrawave_v3,1129.65,1160.72,0.0
256,1039,9216,2048,torch.float8_e4m3fn,10,0,34.7533,a8w8_rowwise_256x128x192x128_32x32_2x3_8x32x1_8x32x1_1x32x1x8_8x8x1_1x1_intrawave_v3,1128.55,1155.37,0.0
256,1040,9216,2048,torch.float8_e4m3fn,10,0,34.5845,a8w8_rowwise_256x128x192x128_32x32_2x3_8x32x1_8x32x1_1x32x1x8_8x8x1_1x1_intrawave_v3,1135.15,1161.61,0.0
256,1041,9216,2048,torch.float8_e4m3fn,10,0,35.2613,a8w8_rowwise_256x128x192x128_32x32_2x3_8x32x1_8x32x1_1x32x1x8_8x8x1_1x1_intrawave_v3,1114.44,1139.89,0.0
256,1072,9216,2048,torch.float8_e4m3fn,10,0,34.4877,a8w8_rowwise_256x128x192x128_32x32_2x3_8x32x1_8x32x1_1x32x1x8_8x8x1_1x1_intrawave_v3,1173.36,1183.87,0.0
256,1073,9216,2048,torch.float8_e4m3fn,10,0,34.1337,a8w8_rowwise_256x128x192x128_32x32_2x3_8x32x1_8x32x1_1x32x1x8_8x8x1_1x1_intrawave_v3,1186.64,1196.75,0.0
256,1077,9216,2048,torch.float8_e4m3fn,10,0,34.9229,a8w8_rowwise_256x128x192x128_32x32_2x3_8x32x1_8x32x1_1x32x1x8_8x8x1_1x1_intrawave_v3,1164.15,1172.05,0.0
256,1091,9216,2048,torch.float8_e4m3fn,10,0,34.9013,a8w8_rowwise_256x128x192x128_32x32_2x3_8x32x1_8x32x1_1x32x1x8_8x8x1_1x1_intrawave_v3,1180.01,1180.99,0.0
256,1343,9216,2048,torch.float8_e4m3fn,2,0,40.2901,a8w8_rowwise_256x256x224x128_32x32_2x7_8x32x1_8x32x1_1x64x1x4_8x8x1_2x1_intrawave_v3,1258.29,1151.13,0.0
256,1688,9216,2048,torch.float8_e4m3fn,1,0,46.5514,a8w8_rowwise_256x256x256x128_32x32_4x4_8x32x1_8x32x1_1x32x1x8_8x8x1_1x1_intrawave_v3,1368.81,1148.08,0.0
256,2017,9216,2048,torch.float8_e4m3fn,10,0,55.9439,a8w8_rowwise_256x128x192x128_32x32_2x3_8x32x1_8x32x1_1x32x1x8_8x8x1_1x1_intrawave_v3,1360.99,1075.77,0.0
256,2048,9216,2048,torch.float8_e4m3fn,10,0,55.6119,a8w8_rowwise_256x128x192x128_32x32_2x3_8x32x1_8x32x1_1x32x1x8_8x8x1_1x1_intrawave_v3,1390.16,1093.6,0.0
256,2048,9216,16384,torch.int8,15,0,431.0243,a8w8_rowwise_256x128x64x256_32x32_2x1_16x16x1_16x16x1_1x32x1x8_8x8x1_1x1_intrawave_v3,1434.9,515.74,0.0
256,2050,9216,2048,torch.float8_e4m3fn,10,0,62.6191,a8w8_rowwise_256x128x192x128_32x32_2x3_8x32x1_8x32x1_1x32x1x8_8x8x1_1x1_intrawave_v3,1235.8,971.88,0.0
256,2063,9216,2048,torch.float8_e4m3fn,11,0,62.7239,a8w8_rowwise_256x128x160x128_32x32_1x5_8x32x1_8x32x1_1x64x1x4_8x8x1_1x1_intrawave_v3,1241.56,974.5,0.0
256,2064,9216,2048,torch.float8_e4m3fn,11,0,62.8155,a8w8_rowwise_256x128x160x128_32x32_1x5_8x32x1_8x32x1_1x64x1x4_8x8x1_1x1_intrawave_v3,1240.35,973.41,0.0
256,2099,9216,2048,torch.float8_e4m3fn,10,0,62.7323,a8w8_rowwise_256x128x192x128_32x32_2x3_8x32x1_8x32x1_1x32x1x8_8x8x1_1x1_intrawave_v3,1263.06,986.12,0.0
256,2159,9216,2048,torch.float8_e4m3fn,11,0,63.4351,a8w8_rowwise_256x128x160x128_32x32_1x5_8x32x1_8x32x1_1x64x1x4_8x8x1_1x1_intrawave_v3,1284.77,994.57,0.0
256,2160,9216,2048,torch.float8_e4m3fn,11,0,63.6648,a8w8_rowwise_256x128x160x128_32x32_1x5_8x32x1_8x32x1_1x64x1x4_8x8x1_1x1_intrawave_v3,1280.73,991.3,0.0
256,2313,9216,2048,torch.float8_e4m3fn,10,0,66.2572,a8w8_rowwise_256x128x192x128_32x32_2x3_8x32x1_8x32x1_1x32x1x8_8x8x1_1x1_intrawave_v3,1317.79,999.81,0.0
256,2325,9216,2048,torch.float8_e4m3fn,10,0,66.368,a8w8_rowwise_256x128x192x128_32x32_2x3_8x32x1_8x32x1_1x32x1x8_8x8x1_1x1_intrawave_v3,1322.41,1001.84,0.0
256,3072,9216,2048,torch.float8_e4m3fn,2,0,76.1725,a8w8_rowwise_256x256x224x128_32x32_2x7_8x32x1_8x32x1_1x64x1x4_8x8x1_2x1_intrawave_v3,1522.39,1073.73,0.0
256,3073,9216,2048,torch.float8_e4m3fn,10,0,82.5861,a8w8_rowwise_256x128x192x128_32x32_2x3_8x32x1_8x32x1_1x32x1x8_8x8x1_1x1_intrawave_v3,1404.62,990.6,0.0
256,3182,9216,2048,torch.float8_e4m3fn,1,0,83.2005,a8w8_rowwise_256x256x256x128_32x32_4x4_8x32x1_8x32x1_1x32x1x8_8x8x1_1x1_intrawave_v3,1443.7,1010.11,0.0
256,3183,9216,2048,torch.float8_e4m3fn,1,0,83.2957,a8w8_rowwise_256x256x256x128_32x32_4x4_8x32x1_8x32x1_1x32x1x8_8x8x1_1x1_intrawave_v3,1442.5,1009.2,0.0
256,3847,9216,2048,torch.float8_e4m3fn,3,0,98.9987,a8w8_rowwise_256x256x192x128_32x32_4x3_8x32x1_8x32x1_1x32x1x8_8x8x1_1x1_intrawave_v3,1466.88,986.49,0.0
256,4096,9216,2048,torch.float8_e4m3fn,3,0,98.2667,a8w8_rowwise_256x256x192x128_32x32_4x3_8x32x1_8x32x1_1x32x1x8_8x8x1_1x1_intrawave_v3,1573.46,1045.73,0.0
256,4096,9216,16384,torch.int8,39,0,778.6417,a8w8_rowwise_256x224x256x128_16x16_7x8_8x32x1_8x32x1_1x32x1x8_8x8x1_1x2_intrawave_v3,1588.6,377.07,0.0
256,4111,9216,2048,torch.float8_e4m3fn,2,0,108.5819,a8w8_rowwise_256x256x224x128_32x32_2x7_8x32x1_8x32x1_1x64x1x4_8x8x1_2x1_intrawave_v3,1429.2,949.22,0.0
256,4141,9216,2048,torch.float8_e4m3fn,4,0,108.7019,a8w8_rowwise_256x256x160x128_32x32_2x5_8x32x1_8x32x1_1x64x1x4_8x8x1_2x1_intrawave_v3,1438.04,953.82,0.0
256,4142,9216,2048,torch.float8_e4m3fn,2,0,107.988,a8w8_rowwise_256x256x224x128_32x32_2x7_8x32x1_8x32x1_1x64x1x4_8x8x1_2x1_intrawave_v3,1447.89,960.32,0.0
256,4345,9216,2048,torch.float8_e4m3fn,10,0,108.7471,a8w8_rowwise_256x128x192x128_32x32_2x3_8x32x1_8x32x1_1x32x1x8_8x8x1_1x1_intrawave_v3,1508.25,991.84,0.0
256,5105,9216,2048,torch.float8_e4m3fn,1,0,122.0769,a8w8_rowwise_256x256x256x128_32x32_4x4_8x32x1_8x32x1_1x32x1x8_8x8x1_1x1_intrawave_v3,1578.57,1011.04,0.0
256,5121,9216,2048,torch.float8_e4m3fn,1,0,124.4065,a8w8_rowwise_256x256x256x128_32x32_4x4_8x32x1_8x32x1_1x32x1x8_8x8x1_1x1_intrawave_v3,1553.87,994.74,0.0
256,5123,9216,2048,torch.float8_e4m3fn,1,0,124.5837,a8w8_rowwise_256x256x256x128_32x32_4x4_8x32x1_8x32x1_1x32x1x8_8x8x1_1x1_intrawave_v3,1552.26,993.66,0.0
256,5131,9216,2048,torch.float8_e4m3fn,1,0,123.4117,a8w8_rowwise_256x256x256x128_32x32_4x4_8x32x1_8x32x1_1x32x1x8_8x8x1_1x1_intrawave_v3,1569.45,1004.42,0.0
256,5427,9216,2048,torch.float8_e4m3fn,2,0,135.9646,a8w8_rowwise_256x256x224x128_32x32_2x7_8x32x1_8x32x1_1x64x1x4_8x8x1_2x1_intrawave_v3,1506.73,956.27,0.0
256,6113,9216,2048,torch.float8_e4m3fn,2,0,143.2675,a8w8_rowwise_256x256x224x128_32x32_2x7_8x32x1_8x32x1_1x64x1x4_8x8x1_2x1_intrawave_v3,1610.68,1005.59,0.0
256,6197,9216,2048,torch.float8_e4m3fn,3,0,151.1432,a8w8_rowwise_256x256x192x128_32x32_4x3_8x32x1_8x32x1_1x32x1x8_8x8x1_1x1_intrawave_v3,1547.73,964.57,0.0
256,6409,9216,2048,torch.float8_e4m3fn,3,0,152.5767,a8w8_rowwise_256x256x192x128_32x32_4x3_8x32x1_8x32x1_1x32x1x8_8x8x1_1x1_intrawave_v3,1585.64,983.97,0.0
256,7121,9216,2048,torch.float8_e4m3fn,1,0,159.486,a8w8_rowwise_256x256x256x128_32x32_4x4_8x32x1_8x32x1_1x32x1x8_8x8x1_1x1_intrawave_v3,1685.47,1032.77,0.0
256,7168,9216,2048,torch.float8_e4m3fn,1,0,158.7184,a8w8_rowwise_256x256x256x128_32x32_4x4_8x32x1_8x32x1_1x32x1x8_8x8x1_1x1_intrawave_v3,1704.8,1043.83,0.0
256,7169,9216,2048,torch.float8_e4m3fn,2,0,169.4536,a8w8_rowwise_256x256x224x128_32x32_2x7_8x32x1_8x32x1_1x64x1x4_8x8x1_2x1_intrawave_v3,1597.02,977.82,0.0
256,7172,9216,2048,torch.float8_e4m3fn,10,0,167.5034,a8w8_rowwise_256x128x192x128_32x32_2x3_8x32x1_8x32x1_1x32x1x8_8x8x1_1x1_intrawave_v3,1616.29,989.57,0.0
256,7176,9216,2048,torch.float8_e4m3fn,10,0,169.0203,a8w8_rowwise_256x128x192x128_32x32_2x3_8x32x1_8x32x1_1x32x1x8_8x8x1_1x1_intrawave_v3,1602.68,981.18,0.0
256,7177,9216,2048,torch.float8_e4m3fn,10,0,168.3086,a8w8_rowwise_256x128x192x128_32x32_2x3_8x32x1_8x32x1_1x32x1x8_8x8x1_1x1_intrawave_v3,1609.68,985.45,0.0
256,7178,9216,2048,torch.float8_e4m3fn,2,0,168.5989,a8w8_rowwise_256x256x224x128_32x32_2x7_8x32x1_8x32x1_1x64x1x4_8x8x1_2x1_intrawave_v3,1607.13,983.87,0.0
256,7179,9216,2048,torch.float8_e4m3fn,10,0,167.4783,a8w8_rowwise_256x128x192x128_32x32_2x3_8x32x1_8x32x1_1x32x1x8_8x8x1_1x1_intrawave_v3,1618.11,990.58,0.0
256,7183,9216,2048,torch.float8_e4m3fn,2,0,171.3322,a8w8_rowwise_256x256x224x128_32x32_2x7_8x32x1_8x32x1_1x64x1x4_8x8x1_2x1_intrawave_v3,1582.59,968.77,0.0
256,7184,9216,2048,torch.float8_e4m3fn,2,0,168.942,a8w8_rowwise_256x256x224x128_32x32_2x7_8x32x1_8x32x1_1x64x1x4_8x8x1_2x1_intrawave_v3,1605.21,982.6,0.0
256,7209,9216,2048,torch.float8_e4m3fn,2,0,169.197,a8w8_rowwise_256x256x224x128_32x32_2x7_8x32x1_8x32x1_1x64x1x4_8x8x1_2x1_intrawave_v3,1608.37,984.15,0.0
256,7210,9216,2048,torch.float8_e4m3fn,2,0,169.7578,a8w8_rowwise_256x256x224x128_32x32_2x7_8x32x1_8x32x1_1x64x1x4_8x8x1_2x1_intrawave_v3,1603.27,981.02,0.0
256,7211,9216,2048,torch.float8_e4m3fn,2,0,167.9925,a8w8_rowwise_256x256x224x128_32x32_2x7_8x32x1_8x32x1_1x64x1x4_8x8x1_2x1_intrawave_v3,1620.35,991.45,0.0
256,7217,9216,2048,torch.float8_e4m3fn,2,0,169.6467,a8w8_rowwise_256x256x224x128_32x32_2x7_8x32x1_8x32x1_1x64x1x4_8x8x1_2x1_intrawave_v3,1605.88,982.5,0.0
256,7273,9216,2048,torch.float8_e4m3fn,10,0,168.9656,a8w8_rowwise_256x128x192x128_32x32_2x3_8x32x1_8x32x1_1x32x1x8_8x8x1_1x1_intrawave_v3,1624.87,993.25,0.0
256,7274,9216,2048,torch.float8_e4m3fn,10,0,170.5586,a8w8_rowwise_256x128x192x128_32x32_2x3_8x32x1_8x32x1_1x32x1x8_8x8x1_1x1_intrawave_v3,1609.91,984.1,0.0
256,7391,9216,2048,torch.float8_e4m3fn,10,0,168.4948,a8w8_rowwise_256x128x192x128_32x32_2x3_8x32x1_8x32x1_1x32x1x8_8x8x1_1x1_intrawave_v3,1655.84,1010.37,0.0
256,7393,9216,2048,torch.float8_e4m3fn,10,0,170.5746,a8w8_rowwise_256x128x192x128_32x32_2x3_8x32x1_8x32x1_1x32x1x8_8x8x1_1x1_intrawave_v3,1636.1,998.29,0.0
256,7715,9216,2048,torch.float8_e4m3fn,3,0,180.4511,a8w8_rowwise_256x256x192x128_32x32_4x3_8x32x1_8x32x1_1x32x1x8_8x8x1_1x1_intrawave_v3,1613.91,980.2,0.0
256,7753,9216,2048,torch.float8_e4m3fn,10,0,183.0197,a8w8_rowwise_256x128x192x128_32x32_2x3_8x32x1_8x32x1_1x32x1x8_8x8x1_1x1_intrawave_v3,1599.1,970.69,0.0
256,7819,9216,2048,torch.float8_e4m3fn,10,0,182.6197,a8w8_rowwise_256x128x192x128_32x32_2x3_8x32x1_8x32x1_1x32x1x8_8x8x1_1x1_intrawave_v3,1616.24,980.22,0.0
256,8099,9216,2048,torch.float8_e4m3fn,3,0,187.4604,a8w8_rowwise_256x256x192x128_32x32_4x3_8x32x1_8x32x1_1x32x1x8_8x8x1_1x1_intrawave_v3,1630.89,985.5,0.0
256,8129,9216,2048,torch.float8_e4m3fn,3,0,186.576,a8w8_rowwise_256x256x192x128_32x32_4x3_8x32x1_8x32x1_1x32x1x8_8x8x1_1x1_intrawave_v3,1644.69,993.46,0.0
256,8188,9216,2048,torch.float8_e4m3fn,3,0,186.9384,a8w8_rowwise_256x256x192x128_32x32_4x3_8x32x1_8x32x1_1x32x1x8_8x8x1_1x1_intrawave_v3,1653.41,998.0,0.0
256,8192,9216,2048,torch.float8_e4m3fn,10,0,181.7032,a8w8_rowwise_256x128x192x128_32x32_2x3_8x32x1_8x32x1_1x32x1x8_8x8x1_1x1_intrawave_v3,1701.88,1027.21,0.0
256,8192,9216,16384,torch.int8,43,0,1557.3892,a8w8_rowwise_256x256x128x64_32x32_4x2_4x64x1_4x64x1_1x32x1x8_8x8x1_1x1_interwave_v1,1588.49,280.09,0.0
256,16384,9216,16384,torch.int8,1,0,2949.0967,a8w8_rowwise_256x256x256x128_32x32_4x4_8x32x1_8x32x1_1x32x1x8_8x8x1_1x1_intrawave_v3,1677.73,244.62,0.0
256,32768,9216,16384,torch.int8,1,0,5884.19,a8w8_rowwise_256x256x256x128_32x32_4x4_8x32x1_8x32x1_1x32x1x8_8x8x1_1x1_intrawave_v3,1681.73,219.55,0.0
256,1,10240,8192,torch.int8,34,0,20.5574,a8w8_rowwise_256x16x64x512_16x16_1x1_32x8x1_32x8x1_1x16x1x16_4x4x1_1x1_intrawave_v3,8.16,4081.97,0.0
256,16,10240,8192,torch.float8_e4m3fn,34,0,19.5591,a8w8_rowwise_256x16x64x512_16x16_1x1_32x8x1_32x8x1_1x16x1x16_4x4x1_1x1_intrawave_v3,137.24,4312.31,0.0
256,16,10240,8192,torch.int8,34,0,18.6072,a8w8_rowwise_256x16x64x512_16x16_1x1_32x8x1_32x8x1_1x16x1x16_4x4x1_1x1_intrawave_v3,144.26,4532.91,0.0
256,32,10240,8192,torch.float8_e4m3fn,30,0,21.4049,a8w8_rowwise_256x32x64x512_16x16_1x2_32x8x1_32x8x1_1x32x1x8_8x8x1_1x2_intrawave_v3,250.82,3961.88,0.0
256,32,10240,8192,torch.int8,30,0,20.8953,a8w8_rowwise_256x32x64x512_16x16_1x2_32x8x1_32x8x1_1x32x1x8_8x8x1_1x2_intrawave_v3,256.93,4058.5,0.0
256,64,10240,8192,torch.float8_e4m3fn,23,0,24.8931,a8w8_rowwise_256x64x64x512_32x32_1x1_32x8x1_32x8x1_1x32x1x8_8x8x1_1x1_intrawave_v3,431.34,3443.57,0.0
256,64,10240,8192,torch.int8,28,0,27.6213,a8w8_rowwise_256x32x128x256_32x32_1x1_16x16x1_16x16x1_1x32x1x8_8x8x1_1x1_intrawave_v3,388.74,3103.44,0.0
256,128,10240,8192,torch.float8_e4m3fn,22,0,30.8204,a8w8_rowwise_256x64x96x256_16x16_2x3_16x16x1_16x16x1_1x64x1x4_8x8x1_2x1_intrawave_v3,696.77,2840.85,0.0
256,128,10240,8192,torch.int8,15,0,31.2683,a8w8_rowwise_256x128x64x256_32x32_2x1_16x16x1_16x16x1_1x32x1x8_8x8x1_1x1_intrawave_v3,686.79,2800.16,0.0
256,256,10240,8192,torch.float8_e4m3fn,14,0,37.6153,a8w8_rowwise_256x128x96x256_32x32_1x3_16x16x1_16x16x1_1x64x1x4_8x8x1_1x1_intrawave_v3,1141.81,2425.24,0.0
256,256,10240,8192,torch.int8,41,0,42.9954,a8w8_rowwise_256x128x128x128_32x32_2x2_8x32x1_8x32x1_1x32x1x8_8x8x1_1x1_intrawave_v5,998.94,2121.76,0.0
256,512,10240,8192,torch.int8,11,0,61.9597,a8w8_rowwise_256x128x160x128_32x32_1x5_8x32x1_8x32x1_1x64x1x4_8x8x1_1x1_intrawave_v3,1386.37,1590.81,0.0
256,1024,10240,8192,torch.int8,4,0,89.391,a8w8_rowwise_256x256x160x128_32x32_2x5_8x32x1_8x32x1_1x64x1x4_8x8x1_2x1_intrawave_v3,1921.88,1266.86,0.0
256,2048,10240,8192,torch.int8,4,0,170.1034,a8w8_rowwise_256x256x160x128_32x32_2x5_8x32x1_8x32x1_1x64x1x4_8x8x1_2x1_intrawave_v3,2019.93,838.35,0.0
256,4096,10240,8192,torch.int8,1,0,318.603,a8w8_rowwise_256x256x256x128_32x32_4x4_8x32x1_8x32x1_1x32x1x8_8x8x1_1x1_intrawave_v3,2156.9,631.9,0.0
256,8192,10240,8192,torch.int8,1,0,575.9516,a8w8_rowwise_256x256x256x128_32x32_4x4_8x32x1_8x32x1_1x32x1x8_8x8x1_1x1_intrawave_v3,2386.29,553.46,0.0
256,16384,10240,8192,torch.int8,1,0,1149.3883,a8w8_rowwise_256x256x256x128_32x32_4x4_8x32x1_8x32x1_1x32x1x8_8x8x1_1x1_intrawave_v3,2391.51,481.69,0.0
256,32768,10240,8192,torch.int8,1,0,2299.333,a8w8_rowwise_256x256x256x128_32x32_4x4_8x32x1_8x32x1_1x32x1x8_8x8x1_1x1_intrawave_v3,2390.94,445.09,0.0
256,1,12288,2048,torch.float8_e4m3fn,30,0,7.6509,a8w8_rowwise_256x32x64x512_16x16_1x2_32x8x1_32x8x1_1x32x1x8_8x8x1_1x2_intrawave_v3,6.58,3292.74,0.0
256,2,12288,2048,torch.float8_e4m3fn,34,0,7.8018,a8w8_rowwise_256x16x64x512_16x16_1x1_32x8x1_32x8x1_1x16x1x16_4x4x1_1x1_intrawave_v3,12.9,3232.47,0.0
256,4,12288,2048,torch.float8_e4m3fn,34,0,7.1481,a8w8_rowwise_256x16x64x512_16x16_1x1_32x8x1_32x8x1_1x16x1x16_4x4x1_1x1_intrawave_v3,28.17,3535.53,0.0
256,8,12288,2048,torch.float8_e4m3fn,34,0,7.4414,a8w8_rowwise_256x16x64x512_16x16_1x1_32x8x1_32x8x1_1x16x1x16_4x4x1_1x1_intrawave_v3,54.11,3410.49,0.0
256,16,12288,2048,torch.float8_e4m3fn,30,0,7.6404,a8w8_rowwise_256x32x64x512_16x16_1x2_32x8x1_32x8x1_1x32x1x8_8x8x1_1x2_intrawave_v3,105.4,3349.54,0.0
256,32,12288,2048,torch.float8_e4m3fn,30,0,7.1995,a8w8_rowwise_256x32x64x512_16x16_1x2_32x8x1_32x8x1_1x32x1x8_8x8x1_1x2_intrawave_v3,223.71,3613.83,0.0
256,48,12288,2048,torch.float8_e4m3fn,28,0,10.0623,a8w8_rowwise_256x32x128x256_32x32_1x1_16x16x1_16x16x1_1x32x1x8_8x8x1_1x1_intrawave_v3,240.1,2628.01,0.0
256,64,12288,2048,torch.float8_e4m3fn,23,0,9.8093,a8w8_rowwise_256x64x64x512_32x32_1x1_32x8x1_32x8x1_1x32x1x8_8x8x1_1x1_intrawave_v3,328.38,2739.21,0.0
256,80,12288,2048,torch.float8_e4m3fn,15,0,10.7922,a8w8_rowwise_256x128x64x256_32x32_2x1_16x16x1_16x16x1_1x32x1x8_8x8x1_1x1_intrawave_v3,373.1,2529.21,0.0
256,96,12288,2048,torch.float8_e4m3fn,15,0,11.0857,a8w8_rowwise_256x128x64x256_32x32_2x1_16x16x1_16x16x1_1x32x1x8_8x8x1_1x1_intrawave_v3,435.86,2500.67,0.0
256,112,12288,2048,torch.float8_e4m3fn,22,0,11.4026,a8w8_rowwise_256x64x96x256_16x16_2x3_16x16x1_16x16x1_1x64x1x4_8x8x1_2x1_intrawave_v3,494.37,2468.53,0.0
256,128,12288,2048,torch.float8_e4m3fn,22,0,11.23,a8w8_rowwise_256x64x96x256_16x16_2x3_16x16x1_16x16x1_1x64x1x4_8x8x1_2x1_intrawave_v3,573.68,2544.41,0.0
256,256,12288,2048,torch.float8_e4m3fn,14,0,14.5889,a8w8_rowwise_256x128x96x256_32x32_1x3_16x16x1_16x16x1_1x64x1x4_8x8x1_1x1_intrawave_v3,883.2,2192.19,0.0
256,512,12288,2048,torch.float8_e4m3fn,10,0,22.3709,a8w8_rowwise_256x128x192x128_32x32_2x3_8x32x1_8x32x1_1x32x1x8_8x8x1_1x1_intrawave_v3,1151.93,1734.28,0.0
256,667,12288,2048,torch.float8_e4m3fn,4,0,29.5033,a8w8_rowwise_256x256x160x128_32x32_2x5_8x32x1_8x32x1_1x64x1x4_8x8x1_2x1_intrawave_v3,1137.88,1454.89,0.0
256,671,12288,2048,torch.float8_e4m3fn,4,0,29.0457,a8w8_rowwise_256x256x160x128_32x32_2x5_8x32x1_8x32x1_1x64x1x4_8x8x1_2x1_intrawave_v3,1162.74,1481.48,0.0
256,931,12288,2048,torch.float8_e4m3fn,3,0,36.0242,a8w8_rowwise_256x256x192x128_32x32_4x3_8x32x1_8x32x1_1x32x1x8_8x8x1_1x1_intrawave_v3,1300.76,1386.64,0.0
256,1024,12288,2048,torch.float8_e4m3fn,3,0,35.1553,a8w8_rowwise_256x256x192x128_32x32_4x3_8x32x1_8x32x1_1x32x1x8_8x8x1_1x1_intrawave_v3,1466.06,1491.35,0.0
256,1025,12288,2048,torch.float8_e4m3fn,1,0,45.253,a8w8_rowwise_256x256x256x128_32x32_4x4_8x32x1_8x32x1_1x32x1x8_8x8x1_1x1_intrawave_v3,1140.03,1159.16,0.0
256,1027,12288,2048,torch.float8_e4m3fn,1,0,44.7805,a8w8_rowwise_256x256x256x128_32x32_4x4_8x32x1_8x32x1_1x32x1x8_8x8x1_1x1_intrawave_v3,1154.31,1172.58,0.0
256,1031,12288,2048,torch.float8_e4m3fn,1,0,45.2542,a8w8_rowwise_256x256x256x128_32x32_4x4_8x32x1_8x32x1_1x32x1x8_8x8x1_1x1_intrawave_v3,1146.68,1162.66,0.0
256,1039,12288,2048,torch.float8_e4m3fn,1,0,44.9902,a8w8_rowwise_256x256x256x128_32x32_4x4_8x32x1_8x32x1_1x32x1x8_8x8x1_1x1_intrawave_v3,1162.35,1174.21,0.0
256,1040,12288,2048,torch.float8_e4m3fn,1,0,45.1462,a8w8_rowwise_256x256x256x128_32x32_4x4_8x32x1_8x32x1_1x32x1x8_8x8x1_1x1_intrawave_v3,1159.45,1170.75,0.0
256,1041,12288,2048,torch.float8_e4m3fn,1,0,45.2066,a8w8_rowwise_256x256x256x128_32x32_4x4_8x32x1_8x32x1_1x32x1x8_8x8x1_1x1_intrawave_v3,1159.02,1169.77,0.0
256,1072,12288,2048,torch.float8_e4m3fn,1,0,45.2798,a8w8_rowwise_256x256x256x128_32x32_4x4_8x32x1_8x32x1_1x32x1x8_8x8x1_1x1_intrawave_v3,1191.6,1186.11,0.0
256,1073,12288,2048,torch.float8_e4m3fn,1,0,44.2389,a8w8_rowwise_256x256x256x128_32x32_4x4_8x32x1_8x32x1_1x32x1x8_8x8x1_1x1_intrawave_v3,1220.78,1214.62,0.0
256,1077,12288,2048,torch.float8_e4m3fn,1,0,45.4726,a8w8_rowwise_256x256x256x128_32x32_4x4_8x32x1_8x32x1_1x32x1x8_8x8x1_1x1_intrawave_v3,1192.08,1184.01,0.0
256,1091,12288,2048,torch.float8_e4m3fn,1,0,45.9982,a8w8_rowwise_256x256x256x128_32x32_4x4_8x32x1_8x32x1_1x32x1x8_8x8x1_1x1_intrawave_v3,1193.78,1178.58,0.0
256,1343,12288,2048,torch.float8_e4m3fn,10,0,52.1642,a8w8_rowwise_256x128x192x128_32x32_2x3_8x32x1_8x32x1_1x32x1x8_8x8x1_1x1_intrawave_v3,1295.82,1167.89,0.0
256,1688,12288,2048,torch.float8_e4m3fn,3,0,65.0979,a8w8_rowwise_256x256x192x128_32x32_4x3_8x32x1_8x32x1_1x32x1x8_8x8x1_1x1_intrawave_v3,1305.11,1076.95,0.0
256,2017,12288,2048,torch.float8_e4m3fn,3,0,69.4347,a8w8_rowwise_256x256x192x128_32x32_4x3_8x32x1_8x32x1_1x32x1x8_8x8x1_1x1_intrawave_v3,1462.08,1135.84,0.0
256,2048,12288,2048,torch.float8_e4m3fn,3,0,68.3812,a8w8_rowwise_256x256x192x128_32x32_4x3_8x32x1_8x32x1_1x32x1x8_8x8x1_1x1_intrawave_v3,1507.42,1165.4,0.0
256,2050,12288,2048,torch.float8_e4m3fn,2,0,74.4252,a8w8_rowwise_256x256x224x128_32x32_2x7_8x32x1_8x32x1_1x64x1x4_8x8x1_2x1_intrawave_v3,1386.36,1071.48,0.0
256,2063,12288,2048,torch.float8_e4m3fn,2,0,74.5564,a8w8_rowwise_256x256x224x128_32x32_2x7_8x32x1_8x32x1_1x64x1x4_8x8x1_2x1_intrawave_v3,1392.69,1074.24,0.0
256,2064,12288,2048,torch.float8_e4m3fn,2,0,75.138,a8w8_rowwise_256x256x224x128_32x32_2x7_8x32x1_8x32x1_1x64x1x4_8x8x1_2x1_intrawave_v3,1382.58,1066.27,0.0
256,2099,12288,2048,torch.float8_e4m3fn,2,0,74.7524,a8w8_rowwise_256x256x224x128_32x32_2x7_8x32x1_8x32x1_1x64x1x4_8x8x1_2x1_intrawave_v3,1413.28,1084.24,0.0
256,2159,12288,2048,torch.float8_e4m3fn,2,0,76.9537,a8w8_rowwise_256x256x224x128_32x32_2x7_8x32x1_8x32x1_1x64x1x4_8x8x1_2x1_intrawave_v3,1412.1,1073.98,0.0
256,2160,12288,2048,torch.float8_e4m3fn,2,0,75.1788,a8w8_rowwise_256x256x224x128_32x32_2x7_8x32x1_8x32x1_1x64x1x4_8x8x1_2x1_intrawave_v3,1446.1,1099.69,0.0
256,2313,12288,2048,torch.float8_e4m3fn,1,0,84.6661,a8w8_rowwise_256x256x256x128_32x32_4x4_8x32x1_8x32x1_1x32x1x8_8x8x1_1x1_intrawave_v3,1375.01,1024.58,0.0
256,2325,12288,2048,torch.float8_e4m3fn,1,0,84.7513,a8w8_rowwise_256x256x256x128_32x32_4x4_8x32x1_8x32x1_1x32x1x8_8x8x1_1x1_intrawave_v3,1380.76,1027.32,0.0
256,3072,12288,2048,torch.float8_e4m3fn,3,0,96.5962,a8w8_rowwise_256x256x192x128_32x32_4x3_8x32x1_8x32x1_1x32x1x8_8x8x1_1x1_intrawave_v3,1600.67,1107.24,0.0
256,3073,12288,2048,torch.float8_e4m3fn,2,0,107.8083,a8w8_rowwise_256x256x224x128_32x32_2x7_8x32x1_8x32x1_1x64x1x4_8x8x1_2x1_intrawave_v3,1434.67,992.33,0.0
256,3182,12288,2048,torch.float8_e4m3fn,2,0,107.9007,a8w8_rowwise_256x256x224x128_32x32_2x7_8x32x1_8x32x1_1x64x1x4_8x8x1_2x1_intrawave_v3,1484.28,1018.38,0.0
256,3183,12288,2048,torch.float8_e4m3fn,10,0,108.1604,a8w8_rowwise_256x128x192x128_32x32_2x3_8x32x1_8x32x1_1x32x1x8_8x8x1_1x1_intrawave_v3,1481.19,1016.18,0.0
256,3847,12288,2048,torch.float8_e4m3fn,1,0,125.0033,a8w8_rowwise_256x256x256x128_32x32_4x4_8x32x1_8x32x1_1x32x1x8_8x8x1_1x1_intrawave_v3,1548.97,1020.68,0.0
256,4096,12288,2048,torch.float8_e4m3fn,1,0,120.9612,a8w8_rowwise_256x256x256x128_32x32_4x4_8x32x1_8x32x1_1x32x1x8_8x8x1_1x1_intrawave_v3,1704.34,1109.59,0.0
256,4111,12288,2048,torch.float8_e4m3fn,2,0,137.7006,a8w8_rowwise_256x256x224x128_32x32_2x7_8x32x1_8x32x1_1x64x1x4_8x8x1_2x1_intrawave_v3,1502.63,977.61,0.0
256,4141,12288,2048,torch.float8_e4m3fn,10,0,138.056,a8w8_rowwise_256x128x192x128_32x32_2x3_8x32x1_8x32x1_1x32x1x8_8x8x1_1x1_intrawave_v3,1509.7,980.88,0.0
256,4142,12288,2048,torch.float8_e4m3fn,10,0,137.9172,a8w8_rowwise_256x128x192x128_32x32_2x3_8x32x1_8x32x1_1x32x1x8_8x8x1_1x1_intrawave_v3,1511.59,982.06,0.0
256,4345,12288,2048,torch.float8_e4m3fn,10,0,138.988,a8w8_rowwise_256x128x192x128_32x32_2x3_8x32x1_8x32x1_1x32x1x8_8x8x1_1x1_intrawave_v3,1573.45,1013.38,0.0
256,5105,12288,2048,torch.float8_e4m3fn,3,0,156.4224,a8w8_rowwise_256x256x192x128_32x32_4x3_8x32x1_8x32x1_1x32x1x8_8x8x1_1x1_intrawave_v3,1642.62,1029.78,0.0
256,5121,12288,2048,torch.float8_e4m3fn,1,0,158.0008,a8w8_rowwise_256x256x256x128_32x32_4x4_8x32x1_8x32x1_1x32x1x8_8x8x1_1x1_intrawave_v3,1631.31,1022.19,0.0
256,5123,12288,2048,torch.float8_e4m3fn,1,0,162.4103,a8w8_rowwise_256x256x256x128_32x32_4x4_8x32x1_8x32x1_1x32x1x8_8x8x1_1x1_intrawave_v3,1587.64,994.77,0.0
256,5131,12288,2048,torch.float8_e4m3fn,1,0,158.3148,a8w8_rowwise_256x256x256x128_32x32_4x4_8x32x1_8x32x1_1x32x1x8_8x8x1_1x1_intrawave_v3,1631.25,1021.85,0.0
256,5427,12288,2048,torch.float8_e4m3fn,10,0,170.2525,a8w8_rowwise_256x128x192x128_32x32_2x3_8x32x1_8x32x1_1x32x1x8_8x8x1_1x1_intrawave_v3,1604.38,996.49,0.0
256,6113,12288,2048,torch.float8_e4m3fn,3,0,182.2658,a8w8_rowwise_256x256x192x128_32x32_4x3_8x32x1_8x32x1_1x32x1x8_8x8x1_1x1_intrawave_v3,1688.07,1031.01,0.0
256,6197,12288,2048,torch.float8_e4m3fn,1,0,189.1628,a8w8_rowwise_256x256x256x128_32x32_4x4_8x32x1_8x32x1_1x32x1x8_8x8x1_1x1_intrawave_v3,1648.87,1005.24,0.0
256,6409,12288,2048,torch.float8_e4m3fn,1,0,191.6063,a8w8_rowwise_256x256x256x128_32x32_4x4_8x32x1_8x32x1_1x32x1x8_8x8x1_1x1_intrawave_v3,1683.53,1021.88,0.0
256,7121,12288,2048,torch.float8_e4m3fn,3,0,210.1141,a8w8_rowwise_256x256x192x128_32x32_4x3_8x32x1_8x32x1_1x32x1x8_8x8x1_1x1_intrawave_v3,1705.8,1022.09,0.0
256,7168,12288,2048,torch.float8_e4m3fn,3,0,203.844,a8w8_rowwise_256x256x192x128_32x32_4x3_8x32x1_8x32x1_1x32x1x8_8x8x1_1x1_intrawave_v3,1769.87,1059.67,0.0
256,7169,12288,2048,torch.float8_e4m3fn,10,0,221.0539,a8w8_rowwise_256x128x192x128_32x32_2x3_8x32x1_8x32x1_1x32x1x8_8x8x1_1x1_intrawave_v3,1632.31,977.29,0.0
256,7172,12288,2048,torch.float8_e4m3fn,10,0,223.673,a8w8_rowwise_256x128x192x128_32x32_2x3_8x32x1_8x32x1_1x32x1x8_8x8x1_1x1_intrawave_v3,1613.87,966.2,0.0
256,7176,12288,2048,torch.float8_e4m3fn,10,0,220.5928,a8w8_rowwise_256x128x192x128_32x32_2x3_8x32x1_8x32x1_1x32x1x8_8x8x1_1x1_intrawave_v3,1637.32,980.18,0.0
256,7177,12288,2048,torch.float8_e4m3fn,10,0,220.5881,a8w8_rowwise_256x128x192x128_32x32_2x3_8x32x1_8x32x1_1x32x1x8_8x8x1_1x1_intrawave_v3,1637.58,980.32,0.0
256,7178,12288,2048,torch.float8_e4m3fn,10,0,222.6227,a8w8_rowwise_256x128x192x128_32x32_2x3_8x32x1_8x32x1_1x32x1x8_8x8x1_1x1_intrawave_v3,1622.84,971.48,0.0
256,7179,12288,2048,torch.float8_e4m3fn,1,0,224.544,a8w8_rowwise_256x256x256x128_32x32_4x4_8x32x1_8x32x1_1x32x1x8_8x8x1_1x1_intrawave_v3,1609.18,963.28,0.0
256,7183,12288,2048,torch.float8_e4m3fn,1,0,221.7423,a8w8_rowwise_256x256x256x128_32x32_4x4_8x32x1_8x32x1_1x32x1x8_8x8x1_1x1_intrawave_v3,1630.42,975.93,0.0
256,7184,12288,2048,torch.float8_e4m3fn,10,0,221.6884,a8w8_rowwise_256x128x192x128_32x32_2x3_8x32x1_8x32x1_1x32x1x8_8x8x1_1x1_intrawave_v3,1631.04,976.29,0.0
256,7209,12288,2048,torch.float8_e4m3fn,2,0,225.1911,a8w8_rowwise_256x256x224x128_32x32_2x7_8x32x1_8x32x1_1x64x1x4_8x8x1_2x1_intrawave_v3,1611.26,964.06,0.0
256,7210,12288,2048,torch.float8_e4m3fn,10,0,221.0197,a8w8_rowwise_256x128x192x128_32x32_2x3_8x32x1_8x32x1_1x32x1x8_8x8x1_1x1_intrawave_v3,1641.9,982.38,0.0
256,7211,12288,2048,torch.float8_e4m3fn,2,0,222.6532,a8w8_rowwise_256x256x224x128_32x32_2x7_8x32x1_8x32x1_1x64x1x4_8x8x1_2x1_intrawave_v3,1630.08,975.29,0.0
256,7217,12288,2048,torch.float8_e4m3fn,4,0,221.9416,a8w8_rowwise_256x256x160x128_32x32_2x5_8x32x1_8x32x1_1x64x1x4_8x8x1_2x1_intrawave_v3,1636.66,979.14,0.0
256,7273,12288,2048,torch.float8_e4m3fn,10,0,221.2184,a8w8_rowwise_256x128x192x128_32x32_2x3_8x32x1_8x32x1_1x32x1x8_8x8x1_1x1_intrawave_v3,1654.75,989.08,0.0
256,7274,12288,2048,torch.float8_e4m3fn,10,0,222.2536,a8w8_rowwise_256x128x192x128_32x32_2x3_8x32x1_8x32x1_1x32x1x8_8x8x1_1x1_intrawave_v3,1647.27,984.59,0.0
256,7391,12288,2048,torch.float8_e4m3fn,2,0,223.3338,a8w8_rowwise_256x256x224x128_32x32_2x7_8x32x1_8x32x1_1x64x1x4_8x8x1_2x1_intrawave_v3,1665.67,993.78,0.0
256,7393,12288,2048,torch.float8_e4m3fn,1,0,222.5379,a8w8_rowwise_256x256x256x128_32x32_4x4_8x32x1_8x32x1_1x32x1x8_8x8x1_1x1_intrawave_v3,1672.08,997.57,0.0
256,7715,12288,2048,torch.float8_e4m3fn,1,0,231.0436,a8w8_rowwise_256x256x256x128_32x32_4x4_8x32x1_8x32x1_1x32x1x8_8x8x1_1x1_intrawave_v3,1680.67,997.95,0.0
256,7753,12288,2048,torch.float8_e4m3fn,1,0,229.7296,a8w8_rowwise_256x256x256x128_32x32_4x4_8x32x1_8x32x1_1x32x1x8_8x8x1_1x1_intrawave_v3,1698.61,1008.06,0.0
256,7819,12288,2048,torch.float8_e4m3fn,1,0,229.952,a8w8_rowwise_256x256x256x128_32x32_4x4_8x32x1_8x32x1_1x32x1x8_8x8x1_1x1_intrawave_v3,1711.41,1014.73,0.0
256,8099,12288,2048,torch.float8_e4m3fn,1,0,241.3234,a8w8_rowwise_256x256x256x128_32x32_4x4_8x32x1_8x32x1_1x32x1x8_8x8x1_1x1_intrawave_v3,1689.17,997.8,0.0
256,8129,12288,2048,torch.float8_e4m3fn,1,0,239.6845,a8w8_rowwise_256x256x256x128_32x32_4x4_8x32x1_8x32x1_1x32x1x8_8x8x1_1x1_intrawave_v3,1707.02,1007.96,0.0
256,8188,12288,2048,torch.float8_e4m3fn,1,0,241.4981,a8w8_rowwise_256x256x256x128_32x32_4x4_8x32x1_8x32x1_1x32x1x8_8x8x1_1x1_intrawave_v3,1706.5,1006.89,0.0
256,8192,12288,2048,torch.float8_e4m3fn,1,0,230.9001,a8w8_rowwise_256x256x256x128_32x32_4x4_8x32x1_8x32x1_1x32x1x8_8x8x1_1x1_intrawave_v3,1785.69,1053.57,0.0
256,1,12800,5120,torch.int8,34,0,14.7015,a8w8_rowwise_256x16x64x512_16x16_1x1_32x8x1_32x8x1_1x16x1x16_4x4x1_1x1_intrawave_v3,8.92,4459.87,0.0
256,16,12800,5120,torch.int8,34,0,14.2563,a8w8_rowwise_256x16x64x512_16x16_1x1_32x8x1_32x8x1_1x16x1x16_4x4x1_1x1_intrawave_v3,147.1,4631.46,0.0
256,32,12800,5120,torch.int8,30,0,14.9578,a8w8_rowwise_256x32x64x512_16x16_1x2_32x8x1_32x8x1_1x32x1x8_8x8x1_1x2_intrawave_v3,280.41,4447.11,0.0
256,64,12800,5120,torch.int8,23,0,18.5404,a8w8_rowwise_256x64x64x512_32x32_1x1_32x8x1_32x8x1_1x32x1x8_8x8x1_1x1_intrawave_v3,452.45,3640.81,0.0
256,128,12800,5120,torch.int8,23,0,25.5896,a8w8_rowwise_256x64x64x512_32x32_1x1_32x8x1_32x8x1_1x32x1x8_8x8x1_1x1_intrawave_v3,655.63,2714.7,0.0
256,256,12800,5120,torch.int8,15,0,42.5463,a8w8_rowwise_256x128x64x256_32x32_2x1_16x16x1_16x16x1_1x32x1x8_8x8x1_1x1_intrawave_v3,788.66,1725.19,0.0
256,512,12800,5120,torch.int8,23,0,74.3061,a8w8_rowwise_256x64x64x512_32x32_1x1_32x8x1_32x8x1_1x32x1x8_8x8x1_1x1_intrawave_v3,903.14,1093.65,0.0
256,1024,12800,5120,torch.int8,40,0,104.2861,a8w8_rowwise_256x256x224x128_16x16_8x7_8x32x1_8x32x1_1x64x1x4_8x8x1_2x1_intrawave_v3,1287.01,930.07,0.0
256,2048,12800,5120,torch.int8,39,0,188.6903,a8w8_rowwise_256x224x256x128_16x16_7x8_8x32x1_8x32x1_1x32x1x8_8x8x1_1x2_intrawave_v3,1422.62,680.75,0.0
256,4096,12800,5120,torch.int8,39,0,356.6531,a8w8_rowwise_256x224x256x128_16x16_7x8_8x32x1_8x32x1_1x32x1x8_8x8x1_1x2_intrawave_v3,1505.3,536.56,0.0
256,8192,12800,5120,torch.int8,39,0,683.3672,a8w8_rowwise_256x224x256x128_16x16_7x8_8x32x1_8x32x1_1x32x1x8_8x8x1_1x2_intrawave_v3,1571.25,464.16,0.0
256,16384,12800,5120,torch.int8,39,0,1303.8826,a8w8_rowwise_256x224x256x128_16x16_7x8_8x32x1_8x32x1_1x32x1x8_8x8x1_1x2_intrawave_v3,1646.99,436.28,0.0
256,32768,12800,5120,torch.int8,39,0,2481.3683,a8w8_rowwise_256x224x256x128_16x16_7x8_8x32x1_8x32x1_1x32x1x8_8x8x1_1x2_intrawave_v3,1730.89,432.09,0.0
256,1,13312,16384,torch.int8,34,0,43.9839,a8w8_rowwise_256x16x64x512_16x16_1x1_32x8x1_32x8x1_1x16x1x16_4x4x1_1x1_intrawave_v3,9.92,4959.7,0.0
256,16,13312,16384,torch.int8,30,0,45.4589,a8w8_rowwise_256x32x64x512_16x16_1x2_32x8x1_32x8x1_1x32x1x8_8x8x1_1x2_intrawave_v3,153.53,4812.96,0.0
256,32,13312,16384,torch.int8,30,0,46.5921,a8w8_rowwise_256x32x64x512_16x16_1x2_32x8x1_32x8x1_1x32x1x8_8x8x1_1x2_intrawave_v3,299.59,4710.67,0.0
256,64,13312,16384,torch.int8,23,0,50.0251,a8w8_rowwise_256x64x64x512_32x32_1x1_32x8x1_32x8x1_1x32x1x8_8x8x1_1x1_intrawave_v3,558.07,4414.91,0.0
256,128,13312,16384,torch.int8,23,0,65.9651,a8w8_rowwise_256x64x64x512_32x32_1x1_32x8x1_32x8x1_1x32x1x8_8x8x1_1x1_intrawave_v3,846.43,3389.81,0.0
256,256,13312,16384,torch.int8,23,0,113.4219,a8w8_rowwise_256x64x64x512_32x32_1x1_32x8x1_32x8x1_1x32x1x8_8x8x1_1x1_intrawave_v3,984.55,2020.01,0.0
256,512,13312,16384,torch.int8,23,0,199.0315,a8w8_rowwise_256x64x64x512_32x32_1x1_32x8x1_32x8x1_1x32x1x8_8x8x1_1x1_intrawave_v3,1122.13,1206.46,0.0
256,1024,13312,16384,torch.int8,40,0,306.5211,a8w8_rowwise_256x256x224x128_16x16_8x7_8x32x1_8x32x1_1x64x1x4_8x8x1_2x1_intrawave_v3,1457.25,855.22,0.0
256,2048,13312,16384,torch.int8,40,0,609.7983,a8w8_rowwise_256x256x224x128_16x16_8x7_8x32x1_8x32x1_1x64x1x4_8x8x1_2x1_intrawave_v3,1465.0,502.11,0.0
256,4096,13312,16384,torch.int8,10,0,1114.1158,a8w8_rowwise_256x128x192x128_32x32_2x3_8x32x1_8x32x1_1x32x1x8_8x8x1_1x1_intrawave_v3,1603.7,353.88,0.0
256,8192,13312,16384,torch.int8,40,0,2189.1084,a8w8_rowwise_256x256x224x128_16x16_8x7_8x32x1_8x32x1_1x64x1x4_8x8x1_2x1_intrawave_v3,1632.36,260.57,0.0
256,16384,13312,16384,torch.int8,1,0,4134.6494,a8w8_rowwise_256x256x256x128_32x32_4x4_8x32x1_8x32x1_1x32x1x8_8x8x1_1x1_intrawave_v3,1728.52,223.17,0.0
256,32768,13312,16384,torch.int8,40,0,8230.5195,a8w8_rowwise_256x256x224x128_16x16_8x7_8x32x1_8x32x1_1x64x1x4_8x8x1_2x1_intrawave_v3,1736.66,197.73,0.0
256,1,16384,2048,torch.int8,34,0,8.2219,a8w8_rowwise_256x16x64x512_16x16_1x1_32x8x1_32x8x1_1x16x1x16_4x4x1_1x1_intrawave_v3,8.16,4085.34,0.0
256,1,16384,4096,torch.int8,34,0,15.9093,a8w8_rowwise_256x16x64x512_16x16_1x1_32x8x1_32x8x1_1x16x1x16_4x4x1_1x1_intrawave_v3,8.44,4220.53,0.0
256,1,16384,6656,torch.int8,34,0,22.3992,a8w8_rowwise_256x16x64x512_16x16_1x1_32x8x1_32x8x1_1x16x1x16_4x4x1_1x1_intrawave_v3,9.74,4870.32,0.0
256,1,16384,8192,torch.int8,34,0,29.3945,a8w8_rowwise_256x16x64x512_16x16_1x1_32x8x1_32x8x1_1x16x1x16_4x4x1_1x1_intrawave_v3,9.13,4567.48,0.0
256,1,16384,13312,torch.int8,34,0,39.0876,a8w8_rowwise_256x16x64x512_16x16_1x1_32x8x1_32x8x1_1x16x1x16_4x4x1_1x1_intrawave_v3,11.16,5581.05,0.0
256,1,16384,26624,torch.int8,34,0,73.9812,a8w8_rowwise_256x16x64x512_16x16_1x1_32x8x1_32x8x1_1x16x1x16_4x4x1_1x1_intrawave_v3,11.79,5897.0,0.0
256,16,16384,2048,torch.int8,34,0,8.2068,a8w8_rowwise_256x16x64x512_16x16_1x1_32x8x1_32x8x1_1x16x1x16_4x4x1_1x1_intrawave_v3,130.84,4156.49,0.0
256,16,16384,4096,torch.int8,30,0,16.22,a8w8_rowwise_256x32x64x512_16x16_1x2_32x8x1_32x8x1_1x32x1x8_8x8x1_1x2_intrawave_v3,132.4,4173.78,0.0
256,16,16384,6656,torch.int8,34,0,21.7401,a8w8_rowwise_256x16x64x512_16x16_1x1_32x8x1_32x8x1_1x16x1x16_4x4x1_1x1_intrawave_v3,160.52,5045.18,0.0
256,16,16384,8192,torch.int8,30,0,29.6526,a8w8_rowwise_256x32x64x512_16x16_1x2_32x8x1_32x8x1_1x32x1x8_8x8x1_1x2_intrawave_v3,144.84,4548.44,0.0
256,16,16384,13312,torch.int8,34,0,38.6763,a8w8_rowwise_256x16x64x512_16x16_1x1_32x8x1_32x8x1_1x16x1x16_4x4x1_1x1_intrawave_v3,180.45,5658.27,0.0
256,16,16384,26624,torch.int8,34,0,73.7744,a8w8_rowwise_256x16x64x512_16x16_1x1_32x8x1_32x8x1_1x16x1x16_4x4x1_1x1_intrawave_v3,189.21,5925.6,0.0
256,32,16384,2048,torch.int8,30,0,10.4352,a8w8_rowwise_256x32x64x512_16x16_1x2_32x8x1_32x8x1_1x32x1x8_8x8x1_1x2_intrawave_v3,205.79,3322.27,0.0
256,32,16384,4096,torch.int8,30,0,16.4693,a8w8_rowwise_256x32x64x512_16x16_1x2_32x8x1_32x8x1_1x32x1x8_8x8x1_1x2_intrawave_v3,260.79,4146.41,0.0
256,32,16384,6656,torch.int8,30,0,22.4014,a8w8_rowwise_256x32x64x512_16x16_1x2_32x8x1_32x8x1_1x32x1x8_8x8x1_1x2_intrawave_v3,311.56,4924.4,0.0
256,32,16384,8192,torch.int8,30,0,30.4324,a8w8_rowwise_256x32x64x512_16x16_1x2_32x8x1_32x8x1_1x32x1x8_8x8x1_1x2_intrawave_v3,282.26,4453.43,0.0
256,32,16384,13312,torch.int8,30,0,39.8351,a8w8_rowwise_256x32x64x512_16x16_1x2_32x8x1_32x8x1_1x32x1x8_8x8x1_1x2_intrawave_v3,350.41,5512.18,0.0
256,32,16384,26624,torch.int8,30,0,74.3742,a8w8_rowwise_256x32x64x512_16x16_1x2_32x8x1_32x8x1_1x32x1x8_8x8x1_1x2_intrawave_v3,375.36,5890.59,0.0
256,64,16384,2048,torch.int8,23,0,11.4046,a8w8_rowwise_256x64x64x512_32x32_1x1_32x8x1_32x8x1_1x32x1x8_8x8x1_1x1_intrawave_v3,376.6,3137.56,0.0
256,64,16384,4096,torch.int8,23,0,19.0989,a8w8_rowwise_256x64x64x512_32x32_1x1_32x8x1_32x8x1_1x32x1x8_8x8x1_1x1_intrawave_v3,449.76,3637.29,0.0
256,64,16384,6656,torch.int8,23,0,26.4384,a8w8_rowwise_256x64x64x512_32x32_1x1_32x8x1_32x8x1_1x32x1x8_8x8x1_1x1_intrawave_v3,527.97,4220.19,0.0
256,64,16384,8192,torch.int8,23,0,33.8597,a8w8_rowwise_256x64x64x512_32x32_1x1_32x8x1_32x8x1_1x32x1x8_8x8x1_1x1_intrawave_v3,507.38,4041.36,0.0
256,64,16384,13312,torch.int8,23,0,46.8247,a8w8_rowwise_256x64x64x512_32x32_1x1_32x8x1_32x8x1_1x32x1x8_8x8x1_1x1_intrawave_v3,596.21,4720.86,0.0
256,64,16384,26624,torch.int8,23,0,89.8884,a8w8_rowwise_256x64x64x512_32x32_1x1_32x8x1_32x8x1_1x32x1x8_8x8x1_1x1_intrawave_v3,621.15,4895.06,0.0
256,128,16384,2048,torch.int8,23,0,14.5668,a8w8_rowwise_256x64x64x512_32x32_1x1_32x8x1_32x8x1_1x32x1x8_8x8x1_1x1_intrawave_v3,589.69,2609.42,0.0
256,128,16384,4096,torch.int8,23,0,23.3525,a8w8_rowwise_256x64x64x512_32x32_1x1_32x8x1_32x8x1_1x32x1x8_8x8x1_1x1_intrawave_v3,735.68,3075.79,0.0
256,128,16384,6656,torch.int8,23,0,34.0329,a8w8_rowwise_256x64x64x512_32x32_1x1_32x8x1_32x8x1_1x32x1x8_8x8x1_1x1_intrawave_v3,820.3,3352.58,0.0
256,128,16384,8192,torch.int8,23,0,45.1385,a8w8_rowwise_256x64x64x512_32x32_1x1_32x8x1_32x8x1_1x32x1x8_8x8x1_1x1_intrawave_v3,761.21,3089.62,0.0
256,128,16384,13312,torch.int8,23,0,61.6432,a8w8_rowwise_256x64x64x512_32x32_1x1_32x8x1_32x8x1_1x32x1x8_8x8x1_1x1_intrawave_v3,905.77,3633.85,0.0
256,128,16384,26624,torch.int8,23,0,118.3409,a8w8_rowwise_256x64x64x512_32x32_1x1_32x8x1_32x8x1_1x32x1x8_8x8x1_1x1_intrawave_v3,943.62,3750.27,0.0
256,256,16384,2048,torch.int8,15,0,22.0982,a8w8_rowwise_256x128x64x256_32x32_2x1_16x16x1_16x16x1_1x32x1x8_8x8x1_1x1_intrawave_v3,777.43,1921.76,0.0
256,256,16384,4096,torch.int8,15,0,39.8495,a8w8_rowwise_256x128x64x256_32x32_2x1_16x16x1_16x16x1_1x32x1x8_8x8x1_1x1_intrawave_v3,862.24,1920.88,0.0
256,256,16384,6656,torch.int8,23,0,57.6756,a8w8_rowwise_256x64x64x512_32x32_1x1_32x8x1_32x8x1_1x32x1x8_8x8x1_1x1_intrawave_v3,968.08,2065.77,0.0
256,256,16384,8192,torch.int8,15,0,72.9104,a8w8_rowwise_256x128x64x256_32x32_2x1_16x16x1_16x16x1_1x32x1x8_8x8x1_1x1_intrawave_v3,942.52,1984.68,0.0
256,256,16384,13312,torch.int8,23,0,106.2833,a8w8_rowwise_256x64x64x512_32x32_1x1_32x8x1_32x8x1_1x32x1x8_8x8x1_1x1_intrawave_v3,1050.67,2163.09,0.0
256,256,16384,26624,torch.int8,23,0,202.2465,a8w8_rowwise_256x64x64x512_32x32_1x1_32x8x1_32x8x1_1x32x1x8_8x8x1_1x1_intrawave_v3,1104.29,2231.99,0.0
256,512,16384,2048,torch.int8,15,0,38.4305,a8w8_rowwise_256x128x64x256_32x32_2x1_16x16x1_16x16x1_1x32x1x8_8x8x1_1x1_intrawave_v3,894.07,1336.96,0.0
256,512,16384,4096,torch.int8,15,0,65.4454,a8w8_rowwise_256x128x64x256_32x32_2x1_16x16x1_16x16x1_1x32x1x8_8x8x1_1x1_intrawave_v3,1050.03,1313.82,0.0
256,512,16384,6656,torch.int8,15,0,102.3241,a8w8_rowwise_256x128x64x256_32x32_2x1_16x16x1_16x16x1_1x32x1x8_8x8x1_1x1_intrawave_v3,1091.33,1263.02,0.0
256,512,16384,8192,torch.int8,15,0,123.6929,a8w8_rowwise_256x128x64x256_32x32_2x1_16x16x1_16x16x1_1x32x1x8_8x8x1_1x1_intrawave_v3,1111.13,1254.63,0.0
256,512,16384,13312,torch.int8,15,0,191.2442,a8w8_rowwise_256x128x64x256_32x32_2x1_16x16x1_16x16x1_1x32x1x8_8x8x1_1x1_intrawave_v3,1167.82,1263.81,0.0
256,512,16384,26624,torch.int8,15,0,365.7012,a8w8_rowwise_256x128x64x256_32x32_2x1_16x16x1_16x16x1_1x32x1x8_8x8x1_1x1_intrawave_v3,1221.43,1275.95,0.0
256,1024,16384,2048,torch.int8,1,0,61.8687,a8w8_rowwise_256x256x256x128_32x32_4x4_8x32x1_8x32x1_1x32x1x8_8x8x1_1x1_intrawave_v3,1110.73,1118.59,0.0
256,1024,16384,4096,torch.int8,1,0,108.4683,a8w8_rowwise_256x256x256x128_32x32_4x4_8x32x1_8x32x1_1x32x1x8_8x8x1_1x1_intrawave_v3,1267.09,966.71,0.0
256,1024,16384,6656,torch.int8,1,0,165.4754,a8w8_rowwise_256x256x256x128_32x32_4x4_8x32x1_8x32x1_1x32x1x8_8x8x1_1x1_intrawave_v3,1349.68,902.99,0.0
256,1024,16384,8192,torch.int8,1,0,202.2384,a8w8_rowwise_256x256x256x128_32x32_4x4_8x32x1_8x32x1_1x32x1x8_8x8x1_1x1_intrawave_v3,1359.18,871.05,0.0
256,1024,16384,13312,torch.int8,1,0,307.7016,a8w8_rowwise_256x256x256x128_32x32_4x4_8x32x1_8x32x1_1x32x1x8_8x8x1_1x1_intrawave_v3,1451.66,862.17,0.0
256,1024,16384,26624,torch.int8,1,0,603.8507,a8w8_rowwise_256x256x256x128_32x32_4x4_8x32x1_8x32x1_1x32x1x8_8x8x1_1x1_intrawave_v3,1479.43,823.09,0.0
256,2048,16384,2048,torch.int8,1,0,109.435,a8w8_rowwise_256x256x256x128_32x32_4x4_8x32x1_8x32x1_1x32x1x8_8x8x1_1x1_intrawave_v3,1255.9,958.17,0.0
256,2048,16384,4096,torch.int8,1,0,192.1657,a8w8_rowwise_256x256x256x128_32x32_4x4_8x32x1_8x32x1_1x32x1x8_8x8x1_1x1_intrawave_v3,1430.42,742.1,0.0
256,2048,16384,6656,torch.int8,1,0,297.4271,a8w8_rowwise_256x256x256x128_32x32_4x4_8x32x1_8x32x1_1x32x1x8_8x8x1_1x1_intrawave_v3,1501.8,638.11,0.0
256,2048,16384,8192,torch.int8,1,0,351.3779,a8w8_rowwise_256x256x256x128_32x32_4x4_8x32x1_8x32x1_1x32x1x8_8x8x1_1x1_intrawave_v3,1564.57,620.71,0.0
256,2048,16384,13312,torch.int8,1,0,562.4285,a8w8_rowwise_256x256x256x128_32x32_4x4_8x32x1_8x32x1_1x32x1x8_8x8x1_1x1_intrawave_v3,1588.39,555.58,0.0
256,2048,16384,26624,torch.int8,1,0,1159.8861,a8w8_rowwise_256x256x256x128_32x32_4x4_8x32x1_8x32x1_1x32x1x8_8x8x1_1x1_intrawave_v3,1540.42,480.95,0.0
256,4096,16384,2048,torch.int8,1,0,205.0841,a8w8_rowwise_256x256x256x128_32x32_4x4_8x32x1_8x32x1_1x32x1x8_8x8x1_1x1_intrawave_v3,1340.32,858.97,0.0
256,4096,16384,4096,torch.int8,39,0,353.73,a8w8_rowwise_256x224x256x128_16x16_7x8_8x32x1_8x32x1_1x32x1x8_8x8x1_1x2_intrawave_v3,1554.17,616.58,0.0
256,4096,16384,6656,torch.int8,39,0,561.0198,a8w8_rowwise_256x224x256x128_16x16_7x8_8x32x1_8x32x1_1x32x1x8_8x8x1_1x2_intrawave_v3,1592.37,482.22,0.0
256,4096,16384,8192,torch.int8,39,0,657.0519,a8w8_rowwise_256x224x256x128_16x16_7x8_8x32x1_8x32x1_1x32x1x8_8x8x1_1x2_intrawave_v3,1673.4,459.61,0.0
256,4096,16384,13312,torch.int8,1,0,1080.1678,a8w8_rowwise_256x256x256x128_32x32_4x4_8x32x1_8x32x1_1x32x1x8_8x8x1_1x1_intrawave_v3,1654.1,376.65,0.0
256,4096,16384,26624,torch.int8,1,0,2197.8702,a8w8_rowwise_256x256x256x128_32x32_4x4_8x32x1_8x32x1_1x32x1x8_8x8x1_1x1_intrawave_v3,1625.85,309.15,0.0
256,8192,16384,2048,torch.int8,39,0,392.4492,a8w8_rowwise_256x224x256x128_16x16_7x8_8x32x1_8x32x1_1x32x1x8_8x8x1_1x2_intrawave_v3,1400.83,812.25,0.0
256,8192,16384,4096,torch.int8,39,0,678.4652,a8w8_rowwise_256x224x256x128_16x16_7x8_8x32x1_8x32x1_1x32x1x8_8x8x1_1x2_intrawave_v3,1620.59,544.02,0.0
256,8192,16384,6656,torch.int8,39,0,1094.0621,a8w8_rowwise_256x224x256x128_16x16_7x8_8x32x1_8x32x1_1x32x1x8_8x8x1_1x2_intrawave_v3,1633.09,394.87,0.0
256,8192,16384,8192,torch.int8,1,0,1288.1354,a8w8_rowwise_256x256x256x128_32x32_4x4_8x32x1_8x32x1_1x32x1x8_8x8x1_1x1_intrawave_v3,1707.14,364.68,0.0
256,8192,16384,13312,torch.int8,1,0,2091.5748,a8w8_rowwise_256x256x256x128_32x32_4x4_8x32x1_8x32x1_1x32x1x8_8x8x1_1x1_intrawave_v3,1708.48,284.76,0.0
256,8192,16384,26624,torch.int8,1,0,4736.0103,a8w8_rowwise_256x256x256x128_32x32_4x4_8x32x1_8x32x1_1x32x1x8_8x8x1_1x1_intrawave_v3,1509.04,194.84,0.0
256,16384,16384,2048,torch.int8,1,0,719.1952,a8w8_rowwise_256x256x256x128_32x32_4x4_8x32x1_8x32x1_1x32x1x8_8x8x1_1x1_intrawave_v3,1528.81,839.8,0.0
256,16384,16384,4096,torch.int8,39,0,1327.6342,a8w8_rowwise_256x224x256x128_16x16_7x8_8x32x1_8x32x1_1x32x1x8_8x8x1_1x2_intrawave_v3,1656.35,505.48,0.0
256,16384,16384,6656,torch.int8,39,0,2120.7951,a8w8_rowwise_256x224x256x128_16x16_7x8_8x32x1_8x32x1_1x32x1x8_8x8x1_1x2_intrawave_v3,1684.94,355.99,0.0
256,16384,16384,8192,torch.int8,1,0,2555.2385,a8w8_rowwise_256x256x256x128_32x32_4x4_8x32x1_8x32x1_1x32x1x8_8x8x1_1x1_intrawave_v3,1721.19,315.16,0.0
256,16384,16384,13312,torch.int8,1,0,4157.4955,a8w8_rowwise_256x256x256x128_32x32_4x4_8x32x1_8x32x1_1x32x1x8_8x8x1_1x1_intrawave_v3,1719.02,234.05,0.0
256,16384,16384,26624,torch.int8,1,0,9368.503,a8w8_rowwise_256x256x256x128_32x32_4x4_8x32x1_8x32x1_1x32x1x8_8x8x1_1x1_intrawave_v3,1525.71,150.43,0.0
256,32768,16384,2048,torch.int8,1,0,1409.7173,a8w8_rowwise_256x256x256x128_32x32_4x4_8x32x1_8x32x1_1x32x1x8_8x8x1_1x1_intrawave_v3,1559.9,833.08,0.0
256,32768,16384,4096,torch.int8,39,0,2546.0869,a8w8_rowwise_256x224x256x128_16x16_7x8_8x32x1_8x32x1_1x32x1x8_8x8x1_1x2_intrawave_v3,1727.37,500.8,0.0
256,32768,16384,6656,torch.int8,39,0,4073.3594,a8w8_rowwise_256x224x256x128_16x16_7x8_8x32x1_8x32x1_1x32x1x8_8x8x1_1x2_intrawave_v3,1754.53,343.92,0.0
256,32768,16384,8192,torch.int8,39,0,4965.434,a8w8_rowwise_256x224x256x128_16x16_7x8_8x32x1_8x32x1_1x32x1x8_8x8x1_1x2_intrawave_v3,1771.47,297.33,0.0
256,32768,16384,13312,torch.int8,1,0,8271.2663,a8w8_rowwise_256x256x256x128_32x32_4x4_8x32x1_8x32x1_1x32x1x8_8x8x1_1x1_intrawave_v3,1728.11,208.92,0.0
256,32768,16384,26624,torch.int8,1,0,19064.3766,a8w8_rowwise_256x256x256x128_32x32_4x4_8x32x1_8x32x1_1x32x1x8_8x8x1_1x1_intrawave_v3,1499.51,124.96,0.0
256,1,26624,16384,torch.int8,34,0,88.2574,a8w8_rowwise_256x16x64x512_16x16_1x1_32x8x1_32x8x1_1x16x1x16_4x4x1_1x1_intrawave_v3,9.88,4943.24,0.0
256,16,26624,16384,torch.int8,30,0,86.8898,a8w8_rowwise_256x32x64x512_16x16_1x2_32x8x1_32x8x1_1x32x1x8_8x8x1_1x2_intrawave_v3,160.65,5033.06,0.0
256,32,26624,16384,torch.int8,30,0,89.3239,a8w8_rowwise_256x32x64x512_16x16_1x2_32x8x1_32x8x1_1x32x1x8_8x8x1_1x2_intrawave_v3,312.54,4908.38,0.0
256,64,26624,16384,torch.int8,23,0,91.2922,a8w8_rowwise_256x64x64x512_32x32_1x1_32x8x1_32x8x1_1x32x1x8_8x8x1_1x1_intrawave_v3,611.6,4826.96,0.0
256,128,26624,16384,torch.int8,23,0,129.1529,a8w8_rowwise_256x64x64x512_32x32_1x1_32x8x1_32x8x1_1x32x1x8_8x8x1_1x1_intrawave_v3,864.63,3446.46,0.0
256,256,26624,16384,torch.int8,23,0,206.2403,a8w8_rowwise_256x64x64x512_32x32_1x1_32x8x1_32x8x1_1x32x1x8_8x8x1_1x1_intrawave_v3,1082.9,2201.48,0.0
256,512,26624,16384,torch.int8,15,0,349.3418,a8w8_rowwise_256x128x64x256_32x32_2x1_16x16x1_16x16x1_1x32x1x8_8x8x1_1x1_intrawave_v3,1278.62,1350.71,0.0
256,1024,26624,16384,torch.int8,15,0,630.2527,a8w8_rowwise_256x128x64x256_32x32_2x1_16x16x1_16x16x1_1x32x1x8_8x8x1_1x1_intrawave_v3,1417.45,805.25,0.0
256,2048,26624,16384,torch.int8,40,0,1145.701,a8w8_rowwise_256x256x224x128_16x16_8x7_8x32x1_8x32x1_1x64x1x4_8x8x1_2x1_intrawave_v3,1559.49,505.21,0.0
256,4096,26624,16384,torch.int8,10,0,2199.7579,a8w8_rowwise_256x128x192x128_32x32_2x3_8x32x1_8x32x1_1x32x1x8_8x8x1_1x1_intrawave_v3,1624.46,327.95,0.0
256,8192,26624,16384,torch.int8,40,0,4074.1172,a8w8_rowwise_256x256x224x128_16x16_8x7_8x32x1_8x32x1_1x64x1x4_8x8x1_2x1_intrawave_v3,1754.2,247.08,0.0
256,16384,26624,16384,torch.int8,40,0,8090.2903,a8w8_rowwise_256x256x224x128_16x16_8x7_8x32x1_8x32x1_1x64x1x4_8x8x1_2x1_intrawave_v3,1766.77,194.93,0.0
256,32768,26624,16384,torch.int8,40,0,16029.2644,a8w8_rowwise_256x256x224x128_16x16_8x7_8x32x1_8x32x1_1x64x1x4_8x8x1_2x1_intrawave_v3,1783.44,169.56,0.0
256,16,28672,8192,torch.float8_e4m3fn,30,0,46.9441,a8w8_rowwise_256x32x64x512_16x16_1x2_32x8x1_32x8x1_1x32x1x8_8x8x1_1x2_intrawave_v3,160.11,5025.76,0.0
256,32,28672,8192,torch.float8_e4m3fn,23,0,47.2467,a8w8_rowwise_256x64x64x512_32x32_1x1_32x8x1_32x8x1_1x32x1x8_8x8x1_1x1_intrawave_v3,318.17,5015.76,0.0
256,64,28672,8192,torch.float8_e4m3fn,23,0,52.7168,a8w8_rowwise_256x64x64x512_32x32_1x1_32x8x1_32x8x1_1x32x1x8_8x8x1_1x1_intrawave_v3,570.31,4535.09,0.0
256,128,28672,8192,torch.float8_e4m3fn,41,0,60.0008,a8w8_rowwise_256x128x128x128_32x32_2x2_8x32x1_8x32x1_1x32x1x8_8x8x1_1x1_intrawave_v5,1002.15,4054.44,0.0
256,256,28672,8192,torch.float8_e4m3fn,4,0,80.7001,a8w8_rowwise_256x256x160x128_32x32_2x5_8x32x1_8x32x1_1x64x1x4_8x8x1_2x1_intrawave_v3,1490.2,3118.44,0.0
256,1,51200,5120,torch.int8,30,0,50.042,a8w8_rowwise_256x32x64x512_16x16_1x2_32x8x1_32x8x1_1x32x1x8_8x8x1_1x2_intrawave_v3,10.48,5240.63,0.0
256,16,51200,5120,torch.int8,30,0,51.7349,a8w8_rowwise_256x32x64x512_16x16_1x2_32x8x1_32x8x1_1x32x1x8_8x8x1_1x2_intrawave_v3,162.15,5100.32,0.0
256,32,51200,5120,torch.int8,30,0,53.9026,a8w8_rowwise_256x32x64x512_16x16_1x2_32x8x1_32x8x1_1x32x1x8_8x8x1_1x2_intrawave_v3,311.25,4927.12,0.0
256,64,51200,5120,torch.int8,23,0,61.5287,a8w8_rowwise_256x64x64x512_32x32_1x1_32x8x1_32x8x1_1x32x1x8_8x8x1_1x1_intrawave_v3,545.35,4372.35,0.0
256,128,51200,5120,torch.int8,23,0,82.0559,a8w8_rowwise_256x64x64x512_32x32_1x1_32x8x1_32x8x1_1x32x1x8_8x8x1_1x1_intrawave_v3,817.84,3362.42,0.0
256,256,51200,5120,torch.int8,40,0,120.9285,a8w8_rowwise_256x256x224x128_16x16_8x7_8x32x1_8x32x1_1x64x1x4_8x8x1_2x1_intrawave_v3,1109.89,2395.38,0.0
256,512,51200,5120,torch.int8,40,0,223.8159,a8w8_rowwise_256x256x224x128_16x16_8x7_8x32x1_8x32x1_1x64x1x4_8x8x1_2x1_intrawave_v3,1199.36,1417.21,0.0
256,1024,51200,5120,torch.int8,39,0,396.7395,a8w8_rowwise_256x224x256x128_16x16_7x8_8x32x1_8x32x1_1x32x1x8_8x8x1_1x2_intrawave_v3,1353.21,938.26,0.0
256,2048,51200,5120,torch.int8,39,0,756.332,a8w8_rowwise_256x224x256x128_16x16_7x8_8x32x1_8x32x1_1x32x1x8_8x8x1_1x2_intrawave_v3,1419.67,637.74,0.0
256,4096,51200,5120,torch.int8,1,0,1418.8126,a8w8_rowwise_256x256x256x128_32x32_4x4_8x32x1_8x32x1_1x32x1x8_8x8x1_1x1_intrawave_v3,1513.58,495.16,0.0
256,8192,51200,5120,torch.int8,1,0,2639.7599,a8w8_rowwise_256x256x256x128_32x32_4x4_8x32x1_8x32x1_1x32x1x8_8x8x1_1x1_intrawave_v3,1627.03,432.97,0.0
256,16384,51200,5120,torch.int8,1,0,5290.8019,a8w8_rowwise_256x256x256x128_32x32_4x4_8x32x1_8x32x1_1x32x1x8_8x8x1_1x1_intrawave_v3,1623.56,382.5,0.0
256,32768,51200,5120,torch.int8,1,0,10610.0611,a8w8_rowwise_256x256x256x128_32x32_4x4_8x32x1_8x32x1_1x32x1x8_8x8x1_1x1_intrawave_v3,1619.21,356.77,0.0
256,1,53248,16384,torch.int8,57,0,170.1222,a8w8_rowwise_128x32x16x128_16x16_1x1_8x16x1_8x16x1_1x16x1x8_2x2x1_1x1_intrawave_v2,10.26,5128.89,0.0
256,16,53248,16384,torch.int8,34,0,180.7857,a8w8_rowwise_256x16x64x512_16x16_1x1_32x8x1_32x8x1_1x16x1x16_4x4x1_1x1_intrawave_v3,154.42,4836.56,0.0
256,32,53248,16384,torch.int8,34,0,168.8762,a8w8_rowwise_256x16x64x512_16x16_1x1_32x8x1_32x8x1_1x16x1x16_4x4x1_1x1_intrawave_v3,330.62,5189.29,0.0
256,64,53248,16384,torch.int8,23,0,184.3385,a8w8_rowwise_256x64x64x512_32x32_1x1_32x8x1_32x8x1_1x32x1x8_8x8x1_1x1_intrawave_v3,605.78,4775.34,0.0
256,128,53248,16384,torch.int8,23,0,230.1893,a8w8_rowwise_256x64x64x512_32x32_1x1_32x8x1_32x8x1_1x32x1x8_8x8x1_1x1_intrawave_v3,970.24,3858.32,0.0
256,256,53248,16384,torch.int8,40,0,368.0253,a8w8_rowwise_256x256x224x128_16x16_8x7_8x32x1_8x32x1_1x64x1x4_8x8x1_2x1_intrawave_v3,1213.71,2456.01,0.0
256,512,53248,16384,torch.int8,15,0,651.6344,a8w8_rowwise_256x128x64x256_32x32_2x1_16x16x1_16x16x1_1x32x1x8_8x8x1_1x1_intrawave_v3,1370.94,1435.36,0.0
256,1024,53248,16384,torch.int8,40,0,1195.3563,a8w8_rowwise_256x256x224x128_16x16_8x7_8x32x1_8x32x1_1x64x1x4_8x8x1_2x1_intrawave_v3,1494.71,835.1,0.0
256,2048,53248,16384,torch.int8,1,0,2196.6099,a8w8_rowwise_256x256x256x128_32x32_4x4_8x32x1_8x32x1_1x32x1x8_8x8x1_1x1_intrawave_v3,1626.79,511.73,0.0
256,4096,53248,16384,torch.int8,1,0,4075.2597,a8w8_rowwise_256x256x256x128_32x32_4x4_8x32x1_8x32x1_1x32x1x8_8x8x1_1x1_intrawave_v3,1753.71,337.58,0.0
256,8192,53248,16384,torch.int8,40,0,8028.0784,a8w8_rowwise_256x256x224x128_16x16_8x7_8x32x1_8x32x1_1x64x1x4_8x8x1_2x1_intrawave_v3,1780.46,234.06,0.0
256,16384,53248,16384,torch.int8,40,0,15996.8357,a8w8_rowwise_256x256x224x128_16x16_8x7_8x32x1_8x32x1_1x64x1x4_8x8x1_2x1_intrawave_v3,1787.06,180.39,0.0
256,32768,53248,16384,torch.int8,40,0,31823.1958,a8w8_rowwise_256x256x224x128_16x16_8x7_8x32x1_8x32x1_1x64x1x4_8x8x1_2x1_intrawave_v3,1796.63,153.94,0.0
256,1,57344,8192,torch.int8,76,0,88.899,a8w8_rowwise_128x32x16x128_16x16_1x1_8x16x1_8x16x1_1x16x1x8_2x2x1_1x1_interwave_v2,10.57,5285.6,0.0
256,16,57344,8192,torch.float8_e4m3fn,69,2,92.3442,a8w8_rowwise_128x16x32x128_16x16_1x1_8x16x1_8x16x1_1x16x1x8_4x4x1_1x1_interwave_v1,162.79,5108.37,0.1072
256,16,57344,8192,torch.int8,80,0,90.9234,a8w8_rowwise_128x16x64x128_16x16_1x2_8x16x1_8x16x1_1x16x1x8_4x4x1_1x1_interwave_v2,165.33,5188.19,0.0
256,32,57344,8192,torch.float8_e4m3fn,62,0,92.8953,a8w8_rowwise_128x32x64x128_32x32_1x1_8x16x1_8x16x1_1x16x1x8_8x8x1_1x1_intrawave_v2,323.64,5099.23,0.0
256,32,57344,8192,torch.int8,81,0,93.0943,a8w8_rowwise_128x32x64x128_32x32_1x1_8x16x1_8x16x1_1x16x1x8_8x8x1_1x1_interwave_v2,322.95,5088.33,0.0
256,64,57344,8192,torch.float8_e4m3fn,17,0,98.9474,a8w8_rowwise_256x64x224x128_16x16_2x7_8x32x1_8x32x1_1x64x1x4_8x8x1_2x1_intrawave_v3,607.69,4827.07,0.0
256,64,57344,8192,torch.int8,46,0,99.6635,a8w8_rowwise_256x64x128x128_32x32_1x2_8x32x1_8x32x1_1x32x1x8_8x8x1_1x1_intrawave_v3,603.33,4792.39,0.0
256,128,57344,8192,torch.float8_e4m3fn,35,0,111.2293,a8w8_rowwise_256x128x128x128_32x32_2x2_8x32x1_8x32x1_1x32x1x8_8x8x1_1x1_intrawave_v4,1081.18,4364.77,0.0
256,128,57344,8192,torch.int8,13,0,108.1045,a8w8_rowwise_256x128x128x128_32x32_2x2_8x32x1_8x32x1_1x32x1x8_8x8x1_1x1_intrawave_v3,1112.43,4490.94,0.0
256,256,57344,8192,torch.float8_e4m3fn,2,0,140.7498,a8w8_rowwise_256x256x224x128_32x32_2x7_8x32x1_8x32x1_1x64x1x4_8x8x1_2x1_intrawave_v3,1708.83,3561.07,0.0
256,256,57344,8192,torch.int8,2,0,135.372,a8w8_rowwise_256x256x224x128_32x32_2x7_8x32x1_8x32x1_1x64x1x4_8x8x1_2x1_intrawave_v3,1776.72,3702.53,0.0
256,512,57344,8192,torch.int8,2,0,233.9286,a8w8_rowwise_256x256x224x128_32x32_2x7_8x32x1_8x32x1_1x64x1x4_8x8x1_2x1_intrawave_v3,2056.34,2277.09,0.0
256,1024,57344,8192,torch.int8,2,0,438.8629,a8w8_rowwise_256x256x224x128_32x32_2x7_8x32x1_8x32x1_1x64x1x4_8x8x1_2x1_intrawave_v3,2192.19,1357.12,0.0
256,2048,57344,8192,torch.int8,1,0,814.7053,a8w8_rowwise_256x256x256x128_32x32_4x4_8x32x1_8x32x1_1x32x1x8_8x8x1_1x1_intrawave_v3,2361.77,885.5,0.0
256,4096,57344,8192,torch.int8,1,0,1617.8989,a8w8_rowwise_256x256x256x128_32x32_4x4_8x32x1_8x32x1_1x32x1x8_8x8x1_1x1_intrawave_v3,2378.57,601.45,0.0
256,8192,57344,8192,torch.int8,1,0,3164.0659,a8w8_rowwise_256x256x256x128_32x32_4x4_8x32x1_8x32x1_1x32x1x8_8x8x1_1x1_intrawave_v3,2432.5,466.61,0.0
256,16384,57344,8192,torch.int8,1,0,6467.762,a8w8_rowwise_256x256x256x128_32x32_4x4_8x32x1_8x32x1_1x32x1x8_8x8x1_1x1_intrawave_v3,2379.98,383.91,0.0
256,32768,57344,8192,torch.int8,1,0,12840.4952,a8w8_rowwise_256x256x256x128_32x32_4x4_8x32x1_8x32x1_1x32x1x8_8x8x1_1x1_intrawave_v3,2397.6,350.17,0.0
