aiter/configs/a8w8_blockscale_tuned_gemm.csv
cu_num,M,N,K,libtype,kernelId,splitK,us,kernelName,tflops,bw,errRatio
64,16,512,7168,ck,5,0,20.9034,a8w8_blockscale_1x128x128_256x16x128x128_8x16_16x16_1x2_16x16x1_8x32x1_1x16x1x16_8_1x2_intrawave_v1,5.62,181.84,0.0
64,32,512,7168,ck,5,0,21.2612,a8w8_blockscale_1x128x128_256x16x128x128_8x16_16x16_1x2_16x16x1_8x32x1_1x16x1x16_8_1x2_intrawave_v1,11.05,184.95,0.0
64,64,512,7168,ck,7,0,21.5046,a8w8_blockscale_1x128x128_256x16x128x256_16x16_16x16_1x2_16x16x1_16x16x1_1x16x1x16_8_1x2_intrawave_v1,21.84,195.04,0.0
64,128,512,7168,ck,7,0,22.2355,a8w8_blockscale_1x128x128_256x16x128x256_16x16_16x16_1x2_16x16x1_16x16x1_1x16x1x16_8_1x2_intrawave_v1,42.25,212.21,0.0
64,256,512,7168,ck,5,0,25.4581,a8w8_blockscale_1x128x128_256x16x128x128_8x16_16x16_1x2_16x16x1_8x32x1_1x16x1x16_8_1x2_intrawave_v1,73.81,226.54,0.0
64,512,512,7168,ck,4,0,34.625,a8w8_blockscale_1x128x128_256x16x256x128_8x16_16x16_1x4_16x16x1_8x32x1_1x16x1x16_8_1x2_intrawave_v1,108.54,227.13,0.0
64,1024,512,7168,ck,4,0,69.4901,a8w8_blockscale_1x128x128_256x16x256x128_8x16_16x16_1x4_16x16x1_8x32x1_1x16x1x16_8_1x2_intrawave_v1,108.16,173.53,0.0
64,1536,512,7168,ck,4,0,82.4453,a8w8_blockscale_1x128x128_256x16x256x128_8x16_16x16_1x4_16x16x1_8x32x1_1x16x1x16_8_1x2_intrawave_v1,136.75,197.14,0.0
64,2048,512,7168,ck,4,0,110.2898,a8w8_blockscale_1x128x128_256x16x256x128_8x16_16x16_1x4_16x16x1_8x32x1_1x16x1x16_8_1x2_intrawave_v1,136.3,185.4,0.0
64,4096,512,7168,ck,4,0,217.6465,a8w8_blockscale_1x128x128_256x16x256x128_8x16_16x16_1x4_16x16x1_8x32x1_1x16x1x16_8_1x2_intrawave_v1,138.14,171.03,0.0
64,8192,512,7168,ck,4,0,419.4897,a8w8_blockscale_1x128x128_256x16x256x128_8x16_16x16_1x4_16x16x1_8x32x1_1x16x1x16_8_1x2_intrawave_v1,143.34,168.73,0.0
64,16384,512,7168,ck,4,0,836.5161,a8w8_blockscale_1x128x128_256x16x256x128_8x16_16x16_1x4_16x16x1_8x32x1_1x16x1x16_8_1x2_intrawave_v1,143.76,164.84,0.0
64,20480,512,7168,ck,4,0,1049.5192,a8w8_blockscale_1x128x128_256x16x256x128_8x16_16x16_1x4_16x16x1_8x32x1_1x16x1x16_8_1x2_intrawave_v1,143.23,163.35,0.0
64,16,576,7168,ck,7,0,27.7673,a8w8_blockscale_1x128x128_256x16x128x256_16x16_16x16_1x2_16x16x1_16x16x1_1x16x1x16_8_1x2_intrawave_v1,4.76,153.49,0.0
64,32,576,7168,ck,7,0,28.1286,a8w8_blockscale_1x128x128_256x16x128x256_16x16_16x16_1x2_16x16x1_16x16x1_1x16x1x16_8_1x2_intrawave_v1,9.39,156.25,0.0
64,64,576,7168,ck,7,0,28.0482,a8w8_blockscale_1x128x128_256x16x128x256_16x16_16x16_1x2_16x16x1_16x16x1_1x16x1x16_8_1x2_intrawave_v1,18.84,166.19,0.0
64,128,576,7168,ck,5,0,32.1311,a8w8_blockscale_1x128x128_256x16x128x128_8x16_16x16_1x2_16x16x1_8x32x1_1x16x1x16_8_1x2_intrawave_v1,32.9,161.64,0.0
64,256,576,7168,ck,5,0,42.8447,a8w8_blockscale_1x128x128_256x16x128x128_8x16_16x16_1x2_16x16x1_8x32x1_1x16x1x16_8_1x2_intrawave_v1,49.34,146.08,0.0
64,512,576,7168,ck,5,0,66.3018,a8w8_blockscale_1x128x128_256x16x128x128_8x16_16x16_1x2_16x16x1_8x32x1_1x16x1x16_8_1x2_intrawave_v1,63.77,126.52,0.0
64,1024,576,7168,ck,5,0,111.1355,a8w8_blockscale_1x128x128_256x16x128x128_8x16_16x16_1x2_16x16x1_8x32x1_1x16x1x16_8_1x2_intrawave_v1,76.08,113.81,0.0
64,1536,576,7168,ck,5,0,163.3528,a8w8_blockscale_1x128x128_256x16x128x128_8x16_16x16_1x2_16x16x1_8x32x1_1x16x1x16_8_1x2_intrawave_v1,77.65,103.51,0.0
64,2048,576,7168,ck,5,0,223.7906,a8w8_blockscale_1x128x128_256x16x128x128_8x16_16x16_1x2_16x16x1_8x32x1_1x16x1x16_8_1x2_intrawave_v1,75.57,94.59,0.0
64,4096,576,7168,ck,5,0,432.6188,a8w8_blockscale_1x128x128_256x16x128x128_8x16_16x16_1x2_16x16x1_8x32x1_1x16x1x16_8_1x2_intrawave_v1,78.18,88.32,0.0
64,8192,576,7168,ck,5,0,858.5882,a8w8_blockscale_1x128x128_256x16x128x128_8x16_16x16_1x2_16x16x1_8x32x1_1x16x1x16_8_1x2_intrawave_v1,78.79,84.19,0.0
64,16384,576,7168,ck,5,0,1726.5819,a8w8_blockscale_1x128x128_256x16x128x128_8x16_16x16_1x2_16x16x1_8x32x1_1x16x1x16_8_1x2_intrawave_v1,78.36,81.34,0.0
64,20480,576,7168,ck,5,0,2168.7173,a8w8_blockscale_1x128x128_256x16x128x128_8x16_16x16_1x2_16x16x1_8x32x1_1x16x1x16_8_1x2_intrawave_v1,77.98,80.47,0.0
64,128,1024,4096,ck,5,0,17.9151,a8w8_blockscale_1x128x128_256x16x128x128_8x16_16x16_1x2_16x16x1_8x32x1_1x16x1x16_8_1x2_intrawave_v1,59.94,278.02,0.0
64,16,1536,7168,ck,7,0,25.4793,a8w8_blockscale_1x128x128_256x16x128x256_16x16_16x16_1x2_16x16x1_16x16x1_1x16x1x16_8_1x2_intrawave_v1,13.83,438.55,0.0
64,32,1536,7168,ck,7,0,25.4148,a8w8_blockscale_1x128x128_256x16x128x256_16x16_16x16_1x2_16x16x1_16x16x1_1x16x1x16_8_1x2_intrawave_v1,27.73,446.11,0.0
64,64,1536,7168,ck,5,0,33.4499,a8w8_blockscale_1x128x128_256x16x128x128_8x16_16x16_1x2_16x16x1_8x32x1_1x16x1x16_8_1x2_intrawave_v1,42.13,348.74,0.0
64,128,1536,7168,ck,5,0,35.839,a8w8_blockscale_1x128x128_256x16x128x128_8x16_16x16_1x2_16x16x1_8x32x1_1x16x1x16_8_1x2_intrawave_v1,78.65,343.78,0.0
64,256,1536,7168,ck,4,0,53.4734,a8w8_blockscale_1x128x128_256x16x256x128_8x16_16x16_1x4_16x16x1_8x32x1_1x16x1x16_8_1x2_intrawave_v1,105.42,254.92,0.0
64,512,1536,7168,ck,4,0,87.5064,a8w8_blockscale_1x128x128_256x16x256x128_8x16_16x16_1x4_16x16x1_8x32x1_1x16x1x16_8_1x2_intrawave_v1,128.84,185.73,0.0
64,1024,1536,7168,ck,4,0,162.5052,a8w8_blockscale_1x128x128_256x16x256x128_8x16_16x16_1x4_16x16x1_8x32x1_1x16x1x16_8_1x2_intrawave_v1,138.76,132.28,0.0
64,1536,1536,7168,ck,4,0,240.2229,a8w8_blockscale_1x128x128_256x16x256x128_8x16_16x16_1x4_16x16x1_8x32x1_1x16x1x16_8_1x2_intrawave_v1,140.8,111.31,0.0
64,2048,1536,7168,ck,4,0,311.4019,a8w8_blockscale_1x128x128_256x16x256x128_8x16_16x16_1x4_16x16x1_8x32x1_1x16x1x16_8_1x2_intrawave_v1,144.82,102.7,0.0
64,4096,1536,7168,ck,4,0,612.5401,a8w8_blockscale_1x128x128_256x16x256x128_8x16_16x16_1x4_16x16x1_8x32x1_1x16x1x16_8_1x2_intrawave_v1,147.25,86.45,0.0
64,8192,1536,7168,ck,4,0,1208.0764,a8w8_blockscale_1x128x128_256x16x256x128_8x16_16x16_1x4_16x16x1_8x32x1_1x16x1x16_8_1x2_intrawave_v1,149.32,78.55,0.0
64,16384,1536,7168,ck,4,0,2467.1706,a8w8_blockscale_1x128x128_256x16x256x128_8x16_16x16_1x4_16x16x1_8x32x1_1x16x1x16_8_1x2_intrawave_v1,146.23,72.46,0.0
64,20480,1536,7168,ck,4,0,3092.1502,a8w8_blockscale_1x128x128_256x16x256x128_8x16_16x16_1x4_16x16x1_8x32x1_1x16x1x16_8_1x2_intrawave_v1,145.84,71.38,0.0
64,1,2560,2048,ck,7,0,14.4982,a8w8_blockscale_1x128x128_256x16x128x256_16x16_16x16_1x2_16x16x1_16x16x1_1x16x1x16_8_1x2_intrawave_v1,0.72,362.12,0.0
64,2,2560,2048,ck,7,0,13.2106,a8w8_blockscale_1x128x128_256x16x128x256_16x16_16x16_1x2_16x16x1_16x16x1_1x16x1x16_8_1x2_intrawave_v1,1.59,397.95,0.0
64,4,2560,2048,ck,7,0,13.2387,a8w8_blockscale_1x128x128_256x16x128x256_16x16_16x16_1x2_16x16x1_16x16x1_1x16x1x16_8_1x2_intrawave_v1,3.17,398.19,0.0
64,8,2560,2048,ck,7,0,13.3632,a8w8_blockscale_1x128x128_256x16x128x256_16x16_16x16_1x2_16x16x1_16x16x1_1x16x1x16_8_1x2_intrawave_v1,6.28,396.63,0.0
64,16,2560,2048,ck,7,0,13.5734,a8w8_blockscale_1x128x128_256x16x128x256_16x16_16x16_1x2_16x16x1_16x16x1_1x16x1x16_8_1x2_intrawave_v1,12.36,394.71,0.0
64,24,2560,2048,ck,7,0,15.0946,a8w8_blockscale_1x128x128_256x16x128x256_16x16_16x16_1x2_16x16x1_16x16x1_1x16x1x16_8_1x2_intrawave_v1,16.67,358.73,0.0
64,32,2560,2048,ck,7,0,15.0626,a8w8_blockscale_1x128x128_256x16x128x256_16x16_16x16_1x2_16x16x1_16x16x1_1x16x1x16_8_1x2_intrawave_v1,22.28,363.3,0.0
64,40,2560,2048,ck,7,0,14.8926,a8w8_blockscale_1x128x128_256x16x128x256_16x16_16x16_1x2_16x16x1_16x16x1_1x16x1x16_8_1x2_intrawave_v1,28.16,371.3,0.0
64,48,2560,2048,ck,7,0,15.0006,a8w8_blockscale_1x128x128_256x16x128x256_16x16_16x16_1x2_16x16x1_16x16x1_1x16x1x16_8_1x2_intrawave_v1,33.55,372.45,0.0
64,56,2560,2048,ck,5,0,16.2953,a8w8_blockscale_1x128x128_256x16x128x128_8x16_16x16_1x2_16x16x1_8x32x1_1x16x1x16_8_1x2_intrawave_v1,36.04,346.38,0.0
64,64,2560,2048,ck,5,0,16.6975,a8w8_blockscale_1x128x128_256x16x128x128_8x16_16x16_1x2_16x16x1_8x32x1_1x16x1x16_8_1x2_intrawave_v1,40.19,341.47,0.0
64,72,2560,2048,ck,5,0,17.5013,a8w8_blockscale_1x128x128_256x16x128x128_8x16_16x16_1x2_16x16x1_8x32x1_1x16x1x16_8_1x2_intrawave_v1,43.14,329.06,0.0
64,80,2560,2048,ck,5,0,16.9866,a8w8_blockscale_1x128x128_256x16x128x128_8x16_16x16_1x2_16x16x1_8x32x1_1x16x1x16_8_1x2_intrawave_v1,49.38,342.41,0.0
64,88,2560,2048,ck,5,0,17.5711,a8w8_blockscale_1x128x128_256x16x128x128_8x16_16x16_1x2_16x16x1_8x32x1_1x16x1x16_8_1x2_intrawave_v1,52.52,334.28,0.0
64,96,2560,2048,ck,5,0,17.7821,a8w8_blockscale_1x128x128_256x16x128x128_8x16_16x16_1x2_16x16x1_8x32x1_1x16x1x16_8_1x2_intrawave_v1,56.61,333.54,0.0
64,104,2560,2048,ck,5,0,20.1394,a8w8_blockscale_1x128x128_256x16x128x128_8x16_16x16_1x2_16x16x1_8x32x1_1x16x1x16_8_1x2_intrawave_v1,54.15,297.35,0.0
64,112,2560,2048,ck,5,0,19.6822,a8w8_blockscale_1x128x128_256x16x128x128_8x16_16x16_1x2_16x16x1_8x32x1_1x16x1x16_8_1x2_intrawave_v1,59.67,307.17,0.0
64,120,2560,2048,ck,5,0,19.7946,a8w8_blockscale_1x128x128_256x16x128x128_8x16_16x16_1x2_16x16x1_8x32x1_1x16x1x16_8_1x2_intrawave_v1,63.57,308.32,0.0
64,128,2560,2048,ck,4,0,20.3629,a8w8_blockscale_1x128x128_256x16x256x128_8x16_16x16_1x4_16x16x1_8x32x1_1x16x1x16_8_1x2_intrawave_v1,65.91,302.53,0.0
64,136,2560,2048,ck,4,0,20.2235,a8w8_blockscale_1x128x128_256x16x256x128_8x16_16x16_1x4_16x16x1_8x32x1_1x16x1x16_8_1x2_intrawave_v1,70.52,307.45,0.0
64,144,2560,2048,ck,4,0,20.5388,a8w8_blockscale_1x128x128_256x16x256x128_8x16_16x16_1x4_16x16x1_8x32x1_1x16x1x16_8_1x2_intrawave_v1,73.52,305.52,0.0
64,152,2560,2048,ck,5,0,24.1061,a8w8_blockscale_1x128x128_256x16x128x128_8x16_16x16_1x2_16x16x1_8x32x1_1x16x1x16_8_1x2_intrawave_v1,66.12,262.69,0.0
64,160,2560,2048,ck,5,0,24.4666,a8w8_blockscale_1x128x128_256x16x128x128_8x16_16x16_1x2_16x16x1_8x32x1_1x16x1x16_8_1x2_intrawave_v1,68.57,261.16,0.0
64,168,2560,2048,ck,5,0,26.4759,a8w8_blockscale_1x128x128_256x16x128x128_8x16_16x16_1x2_16x16x1_8x32x1_1x16x1x16_8_1x2_intrawave_v1,66.54,243.51,0.0
64,176,2560,2048,ck,5,0,26.9985,a8w8_blockscale_1x128x128_256x16x128x128_8x16_16x16_1x2_16x16x1_8x32x1_1x16x1x16_8_1x2_intrawave_v1,68.36,240.92,0.0
64,184,2560,2048,ck,5,0,29.9572,a8w8_blockscale_1x128x128_256x16x128x128_8x16_16x16_1x2_16x16x1_8x32x1_1x16x1x16_8_1x2_intrawave_v1,64.4,219.04,0.0
64,192,2560,2048,ck,5,0,31.164,a8w8_blockscale_1x128x128_256x16x128x128_8x16_16x16_1x2_16x16x1_8x32x1_1x16x1x16_8_1x2_intrawave_v1,64.6,212.4,0.0
64,200,2560,2048,ck,5,0,31.631,a8w8_blockscale_1x128x128_256x16x128x128_8x16_16x16_1x2_16x16x1_8x32x1_1x16x1x16_8_1x2_intrawave_v1,66.3,211.07,0.0
64,208,2560,2048,ck,5,0,32.4961,a8w8_blockscale_1x128x128_256x16x128x128_8x16_16x16_1x2_16x16x1_8x32x1_1x16x1x16_8_1x2_intrawave_v1,67.12,207.22,0.0
64,216,2560,2048,ck,5,0,32.7541,a8w8_blockscale_1x128x128_256x16x128x128_8x16_16x16_1x2_16x16x1_8x32x1_1x16x1x16_8_1x2_intrawave_v1,69.15,207.34,0.0
64,224,2560,2048,ck,5,0,33.2781,a8w8_blockscale_1x128x128_256x16x128x128_8x16_16x16_1x2_16x16x1_8x32x1_1x16x1x16_8_1x2_intrawave_v1,70.58,205.8,0.0
64,232,2560,2048,ck,5,0,33.4494,a8w8_blockscale_1x128x128_256x16x128x128_8x16_16x16_1x2_16x16x1_8x32x1_1x16x1x16_8_1x2_intrawave_v1,72.73,206.46,0.0
64,240,2560,2048,ck,5,0,33.6857,a8w8_blockscale_1x128x128_256x16x128x128_8x16_16x16_1x2_16x16x1_8x32x1_1x16x1x16_8_1x2_intrawave_v1,74.71,206.71,0.0
64,248,2560,2048,ck,5,0,27.8009,a8w8_blockscale_1x128x128_256x16x128x128_8x16_16x16_1x2_16x16x1_8x32x1_1x16x1x16_8_1x2_intrawave_v1,93.54,252.53,0.0
64,256,2560,2048,ck,5,0,27.8933,a8w8_blockscale_1x128x128_256x16x128x128_8x16_16x16_1x2_16x16x1_8x32x1_1x16x1x16_8_1x2_intrawave_v1,96.24,253.75,0.0
64,272,2560,2048,ck,5,0,36.6092,a8w8_blockscale_1x128x128_256x16x128x128_8x16_16x16_1x2_16x16x1_8x32x1_1x16x1x16_8_1x2_intrawave_v1,77.91,196.47,0.0
64,288,2560,2048,ck,4,0,38.5222,a8w8_blockscale_1x128x128_256x16x256x128_8x16_16x16_1x4_16x16x1_8x32x1_1x16x1x16_8_1x2_intrawave_v1,78.39,189.69,0.0
64,304,2560,2048,ck,4,0,38.0532,a8w8_blockscale_1x128x128_256x16x256x128_8x16_16x16_1x4_16x16x1_8x32x1_1x16x1x16_8_1x2_intrawave_v1,83.77,195.04,0.0
64,320,2560,2048,ck,5,0,42.657,a8w8_blockscale_1x128x128_256x16x128x128_8x16_16x16_1x2_16x16x1_8x32x1_1x16x1x16_8_1x2_intrawave_v1,78.66,176.68,0.0
64,336,2560,2048,ck,5,0,44.1037,a8w8_blockscale_1x128x128_256x16x128x128_8x16_16x16_1x2_16x16x1_8x32x1_1x16x1x16_8_1x2_intrawave_v1,79.88,173.48,0.0
64,352,2560,2048,ck,5,0,44.9421,a8w8_blockscale_1x128x128_256x16x128x128_8x16_16x16_1x2_16x16x1_8x32x1_1x16x1x16_8_1x2_intrawave_v1,82.13,172.8,0.0
64,368,2560,2048,ck,5,0,46.4629,a8w8_blockscale_1x128x128_256x16x128x128_8x16_16x16_1x2_16x16x1_8x32x1_1x16x1x16_8_1x2_intrawave_v1,83.05,169.61,0.0
64,384,2560,2048,ck,4,0,48.7284,a8w8_blockscale_1x128x128_256x16x256x128_8x16_16x16_1x4_16x16x1_8x32x1_1x16x1x16_8_1x2_intrawave_v1,82.63,164.08,0.0
64,400,2560,2048,ck,4,0,49.2078,a8w8_blockscale_1x128x128_256x16x256x128_8x16_16x16_1x4_16x16x1_8x32x1_1x16x1x16_8_1x2_intrawave_v1,85.24,164.81,0.0
64,416,2560,2048,ck,5,0,50.9392,a8w8_blockscale_1x128x128_256x16x128x128_8x16_16x16_1x2_16x16x1_8x32x1_1x16x1x16_8_1x2_intrawave_v1,85.63,161.46,0.0
64,432,2560,2048,ck,4,0,52.1469,a8w8_blockscale_1x128x128_256x16x256x128_8x16_16x16_1x4_16x16x1_8x32x1_1x16x1x16_8_1x2_intrawave_v1,86.87,159.92,0.0
64,448,2560,2048,ck,4,0,53.5107,a8w8_blockscale_1x128x128_256x16x256x128_8x16_16x16_1x4_16x16x1_8x32x1_1x16x1x16_8_1x2_intrawave_v1,87.79,157.99,0.0
64,464,2560,2048,ck,4,0,50.9425,a8w8_blockscale_1x128x128_256x16x256x128_8x16_16x16_1x4_16x16x1_8x32x1_1x16x1x16_8_1x2_intrawave_v1,95.51,168.21,0.0
64,480,2560,2048,ck,5,0,53.6699,a8w8_blockscale_1x128x128_256x16x128x128_8x16_16x16_1x2_16x16x1_8x32x1_1x16x1x16_8_1x2_intrawave_v1,93.78,161.79,0.0
64,496,2560,2048,ck,4,0,52.9997,a8w8_blockscale_1x128x128_256x16x256x128_8x16_16x16_1x4_16x16x1_8x32x1_1x16x1x16_8_1x2_intrawave_v1,98.13,166.0,0.0
64,512,2560,2048,ck,5,0,51.4665,a8w8_blockscale_1x128x128_256x16x128x128_8x16_16x16_1x2_16x16x1_8x32x1_1x16x1x16_8_1x2_intrawave_v1,104.31,173.18,0.0
64,8192,2560,2048,ck,4,0,661.0065,a8w8_blockscale_1x128x128_256x16x256x128_8x16_16x16_1x4_16x16x1_8x32x1_1x16x1x16_8_1x2_intrawave_v1,129.95,96.77,0.0
64,128,4096,1280,ck,5,0,16.9322,a8w8_blockscale_1x128x128_256x16x128x128_8x16_16x16_1x2_16x16x1_8x32x1_1x16x1x16_8_1x2_intrawave_v1,79.27,381.24,0.0
64,16,4608,7168,ck,7,0,62.3844,a8w8_blockscale_1x128x128_256x16x128x256_16x16_16x16_1x2_16x16x1_16x16x1_1x16x1x16_8_1x2_intrawave_v1,16.94,533.66,0.0
64,32,4608,7168,ck,5,0,66.1628,a8w8_blockscale_1x128x128_256x16x128x128_8x16_16x16_1x2_16x16x1_8x32x1_1x16x1x16_8_1x2_intrawave_v1,31.95,507.15,0.0
64,64,4608,7168,ck,5,0,72.0714,a8w8_blockscale_1x128x128_256x16x128x128_8x16_16x16_1x2_16x16x1_8x32x1_1x16x1x16_8_1x2_intrawave_v1,58.66,472.85,0.0
64,128,4608,7168,ck,5,0,95.5553,a8w8_blockscale_1x128x128_256x16x128x128_8x16_16x16_1x2_16x16x1_8x32x1_1x16x1x16_8_1x2_intrawave_v1,88.49,367.61,0.0
64,256,4608,7168,ck,4,0,127.1468,a8w8_blockscale_1x128x128_256x16x256x128_8x16_16x16_1x4_16x16x1_8x32x1_1x16x1x16_8_1x2_intrawave_v1,133.01,292.77,0.0
64,512,4608,7168,ck,4,0,242.2157,a8w8_blockscale_1x128x128_256x16x256x128_8x16_16x16_1x4_16x16x1_8x32x1_1x16x1x16_8_1x2_intrawave_v1,139.64,171.0,0.0
64,1024,4608,7168,ck,4,0,468.6791,a8w8_blockscale_1x128x128_256x16x256x128_8x16_16x16_1x4_16x16x1_8x32x1_1x16x1x16_8_1x2_intrawave_v1,144.33,106.27,0.0
64,1536,4608,7168,ck,4,0,688.9913,a8w8_blockscale_1x128x128_256x16x256x128_8x16_16x16_1x4_16x16x1_8x32x1_1x16x1x16_8_1x2_intrawave_v1,147.27,84.47,0.0
64,2048,4608,7168,ck,4,0,906.8234,a8w8_blockscale_1x128x128_256x16x256x128_8x16_16x16_1x4_16x16x1_8x32x1_1x16x1x16_8_1x2_intrawave_v1,149.19,73.43,0.0
64,4096,4608,7168,ck,4,0,1834.4362,a8w8_blockscale_1x128x128_256x16x256x128_8x16_16x16_1x4_16x16x1_8x32x1_1x16x1x16_8_1x2_intrawave_v1,147.5,54.59,0.0
64,8192,4608,7168,ck,4,0,3683.656,a8w8_blockscale_1x128x128_256x16x256x128_8x16_16x16_1x4_16x16x1_8x32x1_1x16x1x16_8_1x2_intrawave_v1,146.91,45.4,0.0
64,16384,4608,7168,ck,4,0,7442.1233,a8w8_blockscale_1x128x128_256x16x256x128_8x16_16x16_1x4_16x16x1_8x32x1_1x16x1x16_8_1x2_intrawave_v1,145.43,40.51,0.0
64,20480,4608,7168,ck,4,0,9377.5534,a8w8_blockscale_1x128x128_256x16x256x128_8x16_16x16_1x4_16x16x1_8x32x1_1x16x1x16_8_1x2_intrawave_v1,144.27,39.3,0.0
64,16,7168,256,ck,7,0,7.1231,a8w8_blockscale_1x128x128_256x16x128x256_16x16_16x16_1x2_16x16x1_16x16x1_1x16x1x16_8_1x2_intrawave_v1,8.24,290.39,0.0
64,16,7168,2304,ck,5,0,30.0182,a8w8_blockscale_1x128x128_256x16x128x128_8x16_16x16_1x2_16x16x1_8x32x1_1x16x1x16_8_1x2_intrawave_v1,17.61,559.04,0.0
64,32,7168,256,ck,5,0,7.5219,a8w8_blockscale_1x128x128_256x16x128x128_8x16_16x16_1x2_16x16x1_8x32x1_1x16x1x16_8_1x2_intrawave_v1,15.61,306.03,0.0
64,32,7168,2304,ck,4,0,31.9708,a8w8_blockscale_1x128x128_256x16x256x128_8x16_16x16_1x4_16x16x1_8x32x1_1x16x1x16_8_1x2_intrawave_v1,33.06,533.22,0.0
64,64,7168,256,ck,7,0,7.5657,a8w8_blockscale_1x128x128_256x16x128x256_16x16_16x16_1x2_16x16x1_16x16x1_1x16x1x16_8_1x2_intrawave_v1,31.05,365.98,0.0
64,64,7168,2304,ck,5,0,35.356,a8w8_blockscale_1x128x128_256x16x128x128_8x16_16x16_1x2_16x16x1_8x32x1_1x16x1x16_8_1x2_intrawave_v1,59.79,497.23,0.0
64,128,7168,256,ck,5,0,10.0212,a8w8_blockscale_1x128x128_256x16x128x128_8x16_16x16_1x2_16x16x1_8x32x1_1x16x1x16_8_1x2_intrawave_v1,46.88,369.5,0.0
64,128,7168,2304,ck,4,0,43.2376,a8w8_blockscale_1x128x128_256x16x256x128_8x16_16x16_1x4_16x16x1_8x32x1_1x16x1x16_8_1x2_intrawave_v1,97.78,431.22,0.0
64,256,7168,256,ck,5,0,16.5896,a8w8_blockscale_1x128x128_256x16x128x128_8x16_16x16_1x2_16x16x1_8x32x1_1x16x1x16_8_1x2_intrawave_v1,56.63,335.79,0.0
64,256,7168,2304,ck,4,0,63.8679,a8w8_blockscale_1x128x128_256x16x256x128_8x16_16x16_1x4_16x16x1_8x32x1_1x16x1x16_8_1x2_intrawave_v1,132.39,325.28,0.0
64,512,7168,256,ck,5,0,31.1325,a8w8_blockscale_1x128x128_256x16x128x128_8x16_16x16_1x2_16x16x1_8x32x1_1x16x1x16_8_1x2_intrawave_v1,60.36,298.92,0.0
64,512,7168,2304,ck,4,0,124.8986,a8w8_blockscale_1x128x128_256x16x256x128_8x16_16x16_1x4_16x16x1_8x32x1_1x16x1x16_8_1x2_intrawave_v1,135.4,200.44,0.0
64,1024,7168,256,ck,4,0,56.3823,a8w8_blockscale_1x128x128_256x16x256x128_8x16_16x16_1x4_16x16x1_8x32x1_1x16x1x16_8_1x2_intrawave_v1,66.65,297.56,0.0
64,1024,7168,2304,ck,4,0,246.5623,a8w8_blockscale_1x128x128_256x16x256x128_8x16_16x16_1x4_16x16x1_8x32x1_1x16x1x16_8_1x2_intrawave_v1,137.18,136.09,0.0
64,1536,7168,256,ck,4,0,83.3954,a8w8_blockscale_1x128x128_256x16x256x128_8x16_16x16_1x4_16x16x1_8x32x1_1x16x1x16_8_1x2_intrawave_v1,67.6,290.76,0.0
64,1536,7168,2304,ck,4,0,370.9114,a8w8_blockscale_1x128x128_256x16x256x128_8x16_16x16_1x4_16x16x1_8x32x1_1x16x1x16_8_1x2_intrawave_v1,136.78,113.43,0.0
64,2048,7168,256,ck,4,0,110.7998,a8w8_blockscale_1x128x128_256x16x256x128_8x16_16x16_1x4_16x16x1_8x32x1_1x16x1x16_8_1x2_intrawave_v1,67.84,286.28,0.0
64,2048,7168,2304,ck,4,0,494.2069,a8w8_blockscale_1x128x128_256x16x256x128_8x16_16x16_1x4_16x16x1_8x32x1_1x16x1x16_8_1x2_intrawave_v1,136.88,102.37,0.0
64,4096,7168,256,ck,5,0,208.3692,a8w8_blockscale_1x128x128_256x16x128x128_8x16_16x16_1x2_16x16x1_8x32x1_1x16x1x16_8_1x2_intrawave_v1,72.14,295.65,0.0
64,4096,7168,2304,ck,4,0,979.1387,a8w8_blockscale_1x128x128_256x16x256x128_8x16_16x16_1x4_16x16x1_8x32x1_1x16x1x16_8_1x2_intrawave_v1,138.17,86.48,0.0
64,8192,7168,256,ck,5,0,411.1168,a8w8_blockscale_1x128x128_256x16x128x128_8x16_16x16_1x2_16x16x1_8x32x1_1x16x1x16_8_1x2_intrawave_v1,73.13,295.23,0.0
64,8192,7168,2304,ck,4,0,1994.5164,a8w8_blockscale_1x128x128_256x16x256x128_8x16_16x16_1x4_16x16x1_8x32x1_1x16x1x16_8_1x2_intrawave_v1,135.66,76.63,0.0
64,16384,7168,256,ck,5,0,827.4453,a8w8_blockscale_1x128x128_256x16x128x128_8x16_16x16_1x2_16x16x1_8x32x1_1x16x1x16_8_1x2_intrawave_v1,72.67,291.15,0.0
64,16384,7168,2304,ck,4,0,4059.4132,a8w8_blockscale_1x128x128_256x16x256x128_8x16_16x16_1x4_16x16x1_8x32x1_1x16x1x16_8_1x2_intrawave_v1,133.31,71.23,0.0
64,20480,7168,256,ck,5,0,1048.1609,a8w8_blockscale_1x128x128_256x16x128x128_8x16_16x16_1x2_16x16x1_8x32x1_1x16x1x16_8_1x2_intrawave_v1,71.71,286.86,0.0
64,20480,7168,2304,ck,4,0,5079.9593,a8w8_blockscale_1x128x128_256x16x256x128_8x16_16x16_1x4_16x16x1_8x32x1_1x16x1x16_8_1x2_intrawave_v1,133.16,70.34,0.0

64,16,1024,1024,ck,4,0,11.2116,a8w8_blockscale_1x128x128_256x16x256x128_8x16_16x16_1x4_16x16x1_8x32x1_1x16x1x16_8_1x2_intrawave_v1,2.99,97.91,0.0
64,16,1024,2048,ck,4,0,12.5787,a8w8_blockscale_1x128x128_256x16x256x128_8x16_16x16_1x4_16x16x1_8x32x1_1x16x1x16_8_1x2_intrawave_v1,5.34,171.93,0.0
64,16,1024,3072,ck,7,0,12.0654,a8w8_blockscale_1x128x128_256x16x128x256_16x16_16x16_1x2_16x16x1_16x16x1_1x16x1x16_8_1x2_intrawave_v1,8.34,267.51,0.0
64,16,1024,4096,ck,7,0,15.261,a8w8_blockscale_1x128x128_256x16x128x256_16x16_16x16_1x2_16x16x1_16x16x1_1x16x1x16_8_1x2_intrawave_v1,8.79,281.28,0.0
64,16,1024,6144,ck,7,0,20.0908,a8w8_blockscale_1x128x128_256x16x128x256_16x16_16x16_1x2_16x16x1_16x16x1_1x16x1x16_8_1x2_intrawave_v1,10.02,319.68,0.0
64,32,1024,1024,ck,7,0,7.3162,a8w8_blockscale_1x128x128_256x16x128x256_16x16_16x16_1x2_16x16x1_16x16x1_1x16x1x16_8_1x2_intrawave_v1,9.17,156.76,0.0
64,32,1024,2048,ck,5,0,10.7403,a8w8_blockscale_1x128x128_256x16x128x128_8x16_16x16_1x2_16x16x1_8x32x1_1x16x1x16_8_1x2_intrawave_v1,12.5,207.46,0.0
64,32,1024,3072,ck,7,0,11.6332,a8w8_blockscale_1x128x128_256x16x128x256_16x16_16x16_1x2_16x16x1_16x16x1_1x16x1x16_8_1x2_intrawave_v1,17.31,284.49,0.0
64,32,1024,4096,ck,7,0,15.7059,a8w8_blockscale_1x128x128_256x16x128x256_16x16_16x16_1x2_16x16x1_16x16x1_1x16x1x16_8_1x2_intrawave_v1,17.09,279.57,0.0
64,32,1024,6144,ck,7,0,20.5095,a8w8_blockscale_1x128x128_256x16x128x256_16x16_16x16_1x2_16x16x1_16x16x1_1x16x1x16_8_1x2_intrawave_v1,19.63,319.54,0.0
64,64,1024,1024,ck,7,0,7.6219,a8w8_blockscale_1x128x128_256x16x128x256_16x16_16x16_1x2_16x16x1_16x16x1_1x16x1x16_8_1x2_intrawave_v1,17.61,163.37,0.0
64,64,1024,2048,ck,7,0,10.1227,a8w8_blockscale_1x128x128_256x16x128x256_16x16_16x16_1x2_16x16x1_16x16x1_1x16x1x16_8_1x2_intrawave_v1,26.52,233.07,0.0
64,64,1024,3072,ck,7,0,12.7136,a8w8_blockscale_1x128x128_256x16x128x256_16x16_16x16_1x2_16x16x1_16x16x1_1x16x1x16_8_1x2_intrawave_v1,31.67,273.2,0.0
64,64,1024,4096,ck,7,0,17.0125,a8w8_blockscale_1x128x128_256x16x128x256_16x16_16x16_1x2_16x16x1_16x16x1_1x16x1x16_8_1x2_intrawave_v1,31.56,269.66,0.0
64,64,1024,6144,ck,7,0,21.3803,a8w8_blockscale_1x128x128_256x16x128x256_16x16_16x16_1x2_16x16x1_16x16x1_1x16x1x16_8_1x2_intrawave_v1,37.67,318.79,0.0
64,128,1024,1024,ck,5,0,8.4495,a8w8_blockscale_1x128x128_256x16x128x128_8x16_16x16_1x2_16x16x1_8x32x1_1x16x1x16_8_1x2_intrawave_v1,31.77,170.64,0.0
64,128,1024,2048,ck,5,0,10.7245,a8w8_blockscale_1x128x128_256x16x128x128_8x16_16x16_1x2_16x16x1_8x32x1_1x16x1x16_8_1x2_intrawave_v1,50.06,244.43,0.0
64,128,1024,3072,ck,5,0,14.3693,a8w8_blockscale_1x128x128_256x16x128x128_8x16_16x16_1x2_16x16x1_8x32x1_1x16x1x16_8_1x2_intrawave_v1,56.04,264.53,0.0
64,128,1024,4096,ck,5,0,17.9279,a8w8_blockscale_1x128x128_256x16x128x128_8x16_16x16_1x2_16x16x1_8x32x1_1x16x1x16_8_1x2_intrawave_v1,59.89,277.82,0.0
64,128,1024,6144,ck,5,0,25.801,a8w8_blockscale_1x128x128_256x16x128x128_8x16_16x16_1x2_16x16x1_8x32x1_1x16x1x16_8_1x2_intrawave_v1,62.42,284.49,0.0
64,256,1024,1024,ck,4,0,10.0647,a8w8_blockscale_1x128x128_256x16x256x128_8x16_16x16_1x4_16x16x1_8x32x1_1x16x1x16_8_1x2_intrawave_v1,53.34,182.32,0.0
64,256,1024,2048,ck,5,0,12.9736,a8w8_blockscale_1x128x128_256x16x128x128_8x16_16x16_1x2_16x16x1_8x32x1_1x16x1x16_8_1x2_intrawave_v1,82.76,242.47,0.0
64,256,1024,3072,ck,5,0,18.6335,a8w8_blockscale_1x128x128_256x16x128x128_8x16_16x16_1x2_16x16x1_8x32x1_1x16x1x16_8_1x2_intrawave_v1,86.44,239.16,0.0
64,256,1024,4096,ck,5,0,29.0043,a8w8_blockscale_1x128x128_256x16x128x128_8x16_16x16_1x2_16x16x1_8x32x1_1x16x1x16_8_1x2_intrawave_v1,74.04,198.84,0.0
64,256,1024,6144,ck,5,0,32.1321,a8w8_blockscale_1x128x128_256x16x128x128_8x16_16x16_1x2_16x16x1_8x32x1_1x16x1x16_8_1x2_intrawave_v1,100.25,261.07,0.0
64,512,1024,1024,ck,5,0,17.9914,a8w8_blockscale_1x128x128_256x16x128x128_8x16_16x16_1x2_16x16x1_8x32x1_1x16x1x16_8_1x2_intrawave_v1,59.68,145.71,0.0
64,512,1024,2048,ck,5,0,23.3616,a8w8_blockscale_1x128x128_256x16x128x128_8x16_16x16_1x2_16x16x1_8x32x1_1x16x1x16_8_1x2_intrawave_v1,91.92,179.54,0.0
64,512,1024,3072,ck,5,0,36.0217,a8w8_blockscale_1x128x128_256x16x128x128_8x16_16x16_1x2_16x16x1_8x32x1_1x16x1x16_8_1x2_intrawave_v1,89.42,160.1,0.0
64,512,1024,4096,ck,5,0,57.7587,a8w8_blockscale_1x128x128_256x16x128x128_8x16_16x16_1x2_16x16x1_8x32x1_1x16x1x16_8_1x2_intrawave_v1,74.36,127.08,0.0
64,512,1024,6144,ck,5,0,60.5919,a8w8_blockscale_1x128x128_256x16x128x128_8x16_16x16_1x2_16x16x1_8x32x1_1x16x1x16_8_1x2_intrawave_v1,106.33,173.06,0.0
64,1024,1024,1024,ck,5,0,22.4987,a8w8_blockscale_1x128x128_256x16x128x128_8x16_16x16_1x2_16x16x1_8x32x1_1x16x1x16_8_1x2_intrawave_v1,95.45,186.42,0.0
64,1024,1024,2048,ck,5,0,42.575,a8w8_blockscale_1x128x128_256x16x128x128_8x16_16x16_1x2_16x16x1_8x32x1_1x16x1x16_8_1x2_intrawave_v1,100.88,147.77,0.0
64,1024,1024,3072,ck,4,0,59.3421,a8w8_blockscale_1x128x128_256x16x256x128_8x16_16x16_1x4_16x16x1_8x32x1_1x16x1x16_8_1x2_intrawave_v1,108.56,141.36,0.0
64,1024,1024,4096,ck,4,0,76.3389,a8w8_blockscale_1x128x128_256x16x256x128_8x16_16x16_1x4_16x16x1_8x32x1_1x16x1x16_8_1x2_intrawave_v1,112.52,137.36,0.0
64,1024,1024,6144,ck,4,0,97.4271,a8w8_blockscale_1x128x128_256x16x256x128_8x16_16x16_1x4_16x16x1_8x32x1_1x16x1x16_8_1x2_intrawave_v1,132.25,150.68,0.0
64,2048,1024,1024,ck,4,0,39.8597,a8w8_blockscale_1x128x128_256x16x256x128_8x16_16x16_1x4_16x16x1_8x32x1_1x16x1x16_8_1x2_intrawave_v1,107.75,184.15,0.0
64,2048,1024,2048,ck,4,0,71.0219,a8w8_blockscale_1x128x128_256x16x256x128_8x16_16x16_1x4_16x16x1_8x32x1_1x16x1x16_8_1x2_intrawave_v1,120.95,147.64,0.0
64,2048,1024,3072,ck,4,0,102.0793,a8w8_blockscale_1x128x128_256x16x256x128_8x16_16x16_1x4_16x16x1_8x32x1_1x16x1x16_8_1x2_intrawave_v1,126.22,133.54,0.0
64,2048,1024,4096,ck,4,0,135.5045,a8w8_blockscale_1x128x128_256x16x256x128_8x16_16x16_1x4_16x16x1_8x32x1_1x16x1x16_8_1x2_intrawave_v1,126.78,123.81,0.0
64,2048,1024,6144,ck,4,0,198.4605,a8w8_blockscale_1x128x128_256x16x256x128_8x16_16x16_1x4_16x16x1_8x32x1_1x16x1x16_8_1x2_intrawave_v1,129.85,116.24,0.0
64,4096,1024,1024,ck,4,0,78.2493,a8w8_blockscale_1x128x128_256x16x256x128_8x16_16x16_1x4_16x16x1_8x32x1_1x16x1x16_8_1x2_intrawave_v1,109.78,174.21,0.0
64,4096,1024,2048,ck,4,0,133.2712,a8w8_blockscale_1x128x128_256x16x256x128_8x16_16x16_1x4_16x16x1_8x32x1_1x16x1x16_8_1x2_intrawave_v1,128.91,141.62,0.0
64,4096,1024,3072,ck,4,0,192.9952,a8w8_blockscale_1x128x128_256x16x256x128_8x16_16x16_1x4_16x16x1_8x32x1_1x16x1x16_8_1x2_intrawave_v1,133.53,124.96,0.0
64,4096,1024,4096,ck,4,0,249.7745,a8w8_blockscale_1x128x128_256x16x256x128_8x16_16x16_1x4_16x16x1_8x32x1_1x16x1x16_8_1x2_intrawave_v1,137.56,117.55,0.0
64,4096,1024,6144,ck,4,0,360.6106,a8w8_blockscale_1x128x128_256x16x256x128_8x16_16x16_1x4_16x16x1_8x32x1_1x16x1x16_8_1x2_intrawave_v1,142.92,110.5,0.0
64,8192,1024,1024,ck,4,0,147.6937,a8w8_blockscale_1x128x128_256x16x256x128_8x16_16x16_1x4_16x16x1_8x32x1_1x16x1x16_8_1x2_intrawave_v1,116.32,177.49,0.0
64,8192,1024,2048,ck,4,0,263.7063,a8w8_blockscale_1x128x128_256x16x256x128_8x16_16x16_1x4_16x16x1_8x32x1_1x16x1x16_8_1x2_intrawave_v1,130.3,135.19,0.0
64,8192,1024,3072,ck,4,0,373.7466,a8w8_blockscale_1x128x128_256x16x256x128_8x16_16x16_1x4_16x16x1_8x32x1_1x16x1x16_8_1x2_intrawave_v1,137.9,120.64,0.0
64,8192,1024,4096,ck,4,0,519.9601,a8w8_blockscale_1x128x128_256x16x256x128_8x16_16x16_1x4_16x16x1_8x32x1_1x16x1x16_8_1x2_intrawave_v1,132.16,104.87,0.0
64,8192,1024,6144,ck,4,0,717.2778,a8w8_blockscale_1x128x128_256x16x256x128_8x16_16x16_1x4_16x16x1_8x32x1_1x16x1x16_8_1x2_intrawave_v1,143.71,102.33,0.0
64,16384,1024,1024,ck,4,0,301.7596,a8w8_blockscale_1x128x128_256x16x256x128_8x16_16x16_1x4_16x16x1_8x32x1_1x16x1x16_8_1x2_intrawave_v1,113.86,170.27,0.0
64,16384,1024,2048,ck,4,0,524.496,a8w8_blockscale_1x128x128_256x16x256x128_8x16_16x16_1x4_16x16x1_8x32x1_1x16x1x16_8_1x2_intrawave_v1,131.02,131.95,0.0
64,16384,1024,3072,ck,4,0,753.9319,a8w8_blockscale_1x128x128_256x16x256x128_8x16_16x16_1x4_16x16x1_8x32x1_1x16x1x16_8_1x2_intrawave_v1,136.72,115.44,0.0
64,16384,1024,4096,ck,4,0,983.3656,a8w8_blockscale_1x128x128_256x16x256x128_8x16_16x16_1x4_16x16x1_8x32x1_1x16x1x16_8_1x2_intrawave_v1,139.76,106.63,0.0
64,16384,1024,6144,ck,4,0,1437.0736,a8w8_blockscale_1x128x128_256x16x256x128_8x16_16x16_1x4_16x16x1_8x32x1_1x16x1x16_8_1x2_intrawave_v1,143.46,97.77,0.0
64,20480,1024,1024,ck,4,0,380.8384,a8w8_blockscale_1x128x128_256x16x256x128_8x16_16x16_1x4_16x16x1_8x32x1_1x16x1x16_8_1x2_intrawave_v1,112.78,167.95,0.0
64,20480,1024,2048,ck,4,0,671.5965,a8w8_blockscale_1x128x128_256x16x256x128_8x16_16x16_1x4_16x16x1_8x32x1_1x16x1x16_8_1x2_intrawave_v1,127.9,128.03,0.0
64,20480,1024,3072,ck,4,0,971.9149,a8w8_blockscale_1x128x128_256x16x256x128_8x16_16x16_1x4_16x16x1_8x32x1_1x16x1x16_8_1x2_intrawave_v1,132.57,111.12,0.0
64,20480,1024,4096,ck,4,0,1253.1838,a8w8_blockscale_1x128x128_256x16x256x128_8x16_16x16_1x4_16x16x1_8x32x1_1x16x1x16_8_1x2_intrawave_v1,137.09,103.75,0.0
64,20480,1024,6144,ck,4,0,1823.4432,a8w8_blockscale_1x128x128_256x16x256x128_8x16_16x16_1x4_16x16x1_8x32x1_1x16x1x16_8_1x2_intrawave_v1,141.32,95.46,0.0
64,16,2048,1024,ck,7,0,9.6311,a8w8_blockscale_1x128x128_256x16x128x256_16x16_16x16_1x2_16x16x1_16x16x1_1x16x1x16_8_1x2_intrawave_v1,6.97,226.25,0.0
64,16,2048,2048,ck,7,0,11.4142,a8w8_blockscale_1x128x128_256x16x128x256_16x16_16x16_1x2_16x16x1_16x16x1_1x16x1x16_8_1x2_intrawave_v1,11.76,376.08,0.0
64,16,2048,3072,ck,7,0,15.4556,a8w8_blockscale_1x128x128_256x16x128x256_16x16_16x16_1x2_16x16x1_16x16x1_1x16x1x16_8_1x2_intrawave_v1,13.03,414.49,0.0
64,16,2048,4096,ck,7,0,20.2357,a8w8_blockscale_1x128x128_256x16x128x256_16x16_16x16_1x2_16x16x1_16x16x1_1x16x1x16_8_1x2_intrawave_v1,13.27,421.02,0.0
64,16,2048,6144,ck,7,0,25.4992,a8w8_blockscale_1x128x128_256x16x128x256_16x16_16x16_1x2_16x16x1_16x16x1_1x16x1x16_8_1x2_intrawave_v1,15.79,499.89,0.0
64,32,2048,1024,ck,7,0,10.1447,a8w8_blockscale_1x128x128_256x16x128x256_16x16_16x16_1x2_16x16x1_16x16x1_1x16x1x16_8_1x2_intrawave_v1,13.23,222.87,0.0
64,32,2048,2048,ck,7,0,12.081,a8w8_blockscale_1x128x128_256x16x128x256_16x16_16x16_1x2_16x16x1_16x16x1_1x16x1x16_8_1x2_intrawave_v1,22.22,363.46,0.0
64,32,2048,3072,ck,7,0,16.5868,a8w8_blockscale_1x128x128_256x16x128x256_16x16_16x16_1x2_16x16x1_16x16x1_1x16x1x16_8_1x2_intrawave_v1,24.28,393.13,0.0
64,32,2048,4096,ck,7,0,23.2659,a8w8_blockscale_1x128x128_256x16x128x256_16x16_16x16_1x2_16x16x1_16x16x1_1x16x1x16_8_1x2_intrawave_v1,23.08,371.82,0.0
64,32,2048,6144,ck,7,0,26.7334,a8w8_blockscale_1x128x128_256x16x128x256_16x16_16x16_1x2_16x16x1_16x16x1_1x16x1x16_8_1x2_intrawave_v1,30.12,482.94,0.0
64,64,2048,1024,ck,7,0,10.5731,a8w8_blockscale_1x128x128_256x16x128x256_16x16_16x16_1x2_16x16x1_16x16x1_1x16x1x16_8_1x2_intrawave_v1,25.39,229.34,0.0
64,64,2048,2048,ck,7,0,13.6866,a8w8_blockscale_1x128x128_256x16x128x256_16x16_16x16_1x2_16x16x1_16x16x1_1x16x1x16_8_1x2_intrawave_v1,39.23,335.18,0.0
64,64,2048,3072,ck,7,0,18.4396,a8w8_blockscale_1x128x128_256x16x128x256_16x16_16x16_1x2_16x16x1_16x16x1_1x16x1x16_8_1x2_intrawave_v1,43.67,366.07,0.0
64,64,2048,4096,ck,5,0,23.9532,a8w8_blockscale_1x128x128_256x16x128x128_8x16_16x16_1x2_16x16x1_8x32x1_1x16x1x16_8_1x2_intrawave_v1,44.83,372.1,0.0
64,64,2048,6144,ck,7,0,32.8639,a8w8_blockscale_1x128x128_256x16x128x256_16x16_16x16_1x2_16x16x1_16x16x1_1x16x1x16_8_1x2_intrawave_v1,49.01,402.82,0.0
64,128,2048,1024,ck,4,0,12.0791,a8w8_blockscale_1x128x128_256x16x256x128_8x16_16x16_1x4_16x16x1_8x32x1_1x16x1x16_8_1x2_intrawave_v1,44.45,227.87,0.0
64,128,2048,2048,ck,5,0,16.108,a8w8_blockscale_1x128x128_256x16x128x128_8x16_16x16_1x2_16x16x1_8x32x1_1x16x1x16_8_1x2_intrawave_v1,66.66,309.21,0.0
64,128,2048,3072,ck,5,0,23.2447,a8w8_blockscale_1x128x128_256x16x128x128_8x16_16x16_1x2_16x16x1_8x32x1_1x16x1x16_8_1x2_intrawave_v1,69.29,310.13,0.0
64,128,2048,4096,ck,5,0,31.767,a8w8_blockscale_1x128x128_256x16x128x128_8x16_16x16_1x2_16x16x1_8x32x1_1x16x1x16_8_1x2_intrawave_v1,67.6,297.08,0.0
64,128,2048,6144,ck,5,0,39.0073,a8w8_blockscale_1x128x128_256x16x128x128_8x16_16x16_1x2_16x16x1_8x32x1_1x16x1x16_8_1x2_intrawave_v1,82.58,356.18,0.0
64,256,2048,1024,ck,5,0,16.365,a8w8_blockscale_1x128x128_256x16x128x128_8x16_16x16_1x2_16x16x1_8x32x1_1x16x1x16_8_1x2_intrawave_v1,65.61,208.24,0.0
64,256,2048,2048,ck,5,0,24.0856,a8w8_blockscale_1x128x128_256x16x128x128_8x16_16x16_1x2_16x16x1_8x32x1_1x16x1x16_8_1x2_intrawave_v1,89.16,239.44,0.0
64,256,2048,3072,ck,5,0,37.341,a8w8_blockscale_1x128x128_256x16x128x128_8x16_16x16_1x2_16x16x1_8x32x1_1x16x1x16_8_1x2_intrawave_v1,86.27,217.63,0.0
64,256,2048,4096,ck,5,0,59.5832,a8w8_blockscale_1x128x128_256x16x128x128_8x16_16x16_1x2_16x16x1_8x32x1_1x16x1x16_8_1x2_intrawave_v1,72.08,175.99,0.0
64,256,2048,6144,ck,5,0,61.8551,a8w8_blockscale_1x128x128_256x16x128x128_8x16_16x16_1x2_16x16x1_8x32x1_1x16x1x16_8_1x2_intrawave_v1,104.15,245.81,0.0
64,512,2048,1024,ck,4,0,24.451,a8w8_blockscale_1x128x128_256x16x256x128_8x16_16x16_1x4_16x16x1_8x32x1_1x16x1x16_8_1x2_intrawave_v1,87.83,192.98,0.0
64,512,2048,2048,ck,5,0,42.558,a8w8_blockscale_1x128x128_256x16x128x128_8x16_16x16_1x2_16x16x1_8x32x1_1x16x1x16_8_1x2_intrawave_v1,100.92,172.47,0.0
64,512,2048,3072,ck,4,0,58.3073,a8w8_blockscale_1x128x128_256x16x256x128_8x16_16x16_1x4_16x16x1_8x32x1_1x16x1x16_8_1x2_intrawave_v1,110.49,170.84,0.0
64,512,2048,4096,ck,4,0,77.3961,a8w8_blockscale_1x128x128_256x16x256x128_8x16_16x16_1x4_16x16x1_8x32x1_1x16x1x16_8_1x2_intrawave_v1,110.99,162.58,0.0
64,512,2048,6144,ck,4,0,95.8594,a8w8_blockscale_1x128x128_256x16x256x128_8x16_16x16_1x4_16x16x1_8x32x1_1x16x1x16_8_1x2_intrawave_v1,134.41,185.96,0.0
64,1024,2048,1024,ck,5,0,42.0063,a8w8_blockscale_1x128x128_256x16x128x128_8x16_16x16_1x2_16x16x1_8x32x1_1x16x1x16_8_1x2_intrawave_v1,102.25,174.74,0.0
64,1024,2048,2048,ck,4,0,75.1753,a8w8_blockscale_1x128x128_256x16x256x128_8x16_16x16_1x4_16x16x1_8x32x1_1x16x1x16_8_1x2_intrawave_v1,114.27,139.48,0.0
64,1024,2048,3072,ck,4,0,99.0819,a8w8_blockscale_1x128x128_256x16x256x128_8x16_16x16_1x4_16x16x1_8x32x1_1x16x1x16_8_1x2_intrawave_v1,130.04,137.58,0.0
64,1024,2048,4096,ck,4,0,145.7636,a8w8_blockscale_1x128x128_256x16x256x128_8x16_16x16_1x4_16x16x1_8x32x1_1x16x1x16_8_1x2_intrawave_v1,117.86,115.1,0.0
64,1024,2048,6144,ck,4,0,186.2717,a8w8_blockscale_1x128x128_256x16x256x128_8x16_16x16_1x4_16x16x1_8x32x1_1x16x1x16_8_1x2_intrawave_v1,138.35,123.84,0.0
64,2048,2048,1024,ck,4,0,75.1063,a8w8_blockscale_1x128x128_256x16x256x128_8x16_16x16_1x4_16x16x1_8x32x1_1x16x1x16_8_1x2_intrawave_v1,114.37,167.53,0.0
64,2048,2048,2048,ck,4,0,132.3238,a8w8_blockscale_1x128x128_256x16x256x128_8x16_16x16_1x4_16x16x1_8x32x1_1x16x1x16_8_1x2_intrawave_v1,129.83,126.79,0.0
64,2048,2048,3072,ck,4,0,187.8891,a8w8_blockscale_1x128x128_256x16x256x128_8x16_16x16_1x4_16x16x1_8x32x1_1x16x1x16_8_1x2_intrawave_v1,137.15,111.62,0.0
64,2048,2048,4096,ck,4,0,250.2008,a8w8_blockscale_1x128x128_256x16x256x128_8x16_16x16_1x4_16x16x1_8x32x1_1x16x1x16_8_1x2_intrawave_v1,137.33,100.58,0.0
64,2048,2048,6144,ck,4,0,359.7674,a8w8_blockscale_1x128x128_256x16x256x128_8x16_16x16_1x4_16x16x1_8x32x1_1x16x1x16_8_1x2_intrawave_v1,143.26,93.27,0.0
64,4096,2048,1024,ck,4,0,147.0432,a8w8_blockscale_1x128x128_256x16x256x128_8x16_16x16_1x4_16x16x1_8x32x1_1x16x1x16_8_1x2_intrawave_v1,116.84,156.88,0.0
64,4096,2048,2048,ck,4,0,272.5465,a8w8_blockscale_1x128x128_256x16x256x128_8x16_16x16_1x4_16x16x1_8x32x1_1x16x1x16_8_1x2_intrawave_v1,126.07,107.73,0.0
64,4096,2048,3072,ck,4,0,370.2105,a8w8_blockscale_1x128x128_256x16x256x128_8x16_16x16_1x4_16x16x1_8x32x1_1x16x1x16_8_1x2_intrawave_v1,139.22,96.3,0.0
64,4096,2048,4096,ck,4,0,488.5381,a8w8_blockscale_1x128x128_256x16x256x128_8x16_16x16_1x4_16x16x1_8x32x1_1x16x1x16_8_1x2_intrawave_v1,140.66,85.85,0.0
64,4096,2048,6144,ck,4,0,708.7425,a8w8_blockscale_1x128x128_256x16x256x128_8x16_16x16_1x4_16x16x1_8x32x1_1x16x1x16_8_1x2_intrawave_v1,145.44,76.93,0.0
64,8192,2048,1024,ck,4,0,297.5469,a8w8_blockscale_1x128x128_256x16x256x128_8x16_16x16_1x4_16x16x1_8x32x1_1x16x1x16_8_1x2_intrawave_v1,115.48,148.01,0.0
64,8192,2048,2048,ck,4,0,523.3344,a8w8_blockscale_1x128x128_256x16x256x128_8x16_16x16_1x4_16x16x1_8x32x1_1x16x1x16_8_1x2_intrawave_v1,131.31,104.19,0.0
64,8192,2048,3072,ck,4,0,738.2238,a8w8_blockscale_1x128x128_256x16x256x128_8x16_16x16_1x4_16x16x1_8x32x1_1x16x1x16_8_1x2_intrawave_v1,139.63,88.07,0.0
64,8192,2048,4096,ck,4,0,965.8568,a8w8_blockscale_1x128x128_256x16x256x128_8x16_16x16_1x4_16x16x1_8x32x1_1x16x1x16_8_1x2_intrawave_v1,142.3,78.17,0.0
64,8192,2048,6144,ck,4,0,1407.8513,a8w8_blockscale_1x128x128_256x16x256x128_8x16_16x16_1x4_16x16x1_8x32x1_1x16x1x16_8_1x2_intrawave_v1,146.43,68.52,0.0
64,16384,2048,1024,ck,4,0,598.4719,a8w8_blockscale_1x128x128_256x16x256x128_8x16_16x16_1x4_16x16x1_8x32x1_1x16x1x16_8_1x2_intrawave_v1,114.82,143.67,0.0
64,16384,2048,2048,ck,4,0,1049.3111,a8w8_blockscale_1x128x128_256x16x256x128_8x16_16x16_1x4_16x16x1_8x32x1_1x16x1x16_8_1x2_intrawave_v1,130.98,99.93,0.0
64,16384,2048,3072,ck,4,0,1498.0144,a8w8_blockscale_1x128x128_256x16x256x128_8x16_16x16_1x4_16x16x1_8x32x1_1x16x1x16_8_1x2_intrawave_v1,137.62,82.6,0.0
64,16384,2048,4096,ck,4,0,1954.7868,a8w8_blockscale_1x128x128_256x16x256x128_8x16_16x16_1x4_16x16x1_8x32x1_1x16x1x16_8_1x2_intrawave_v1,140.62,72.95,0.0
64,16384,2048,6144,ck,4,0,2851.0736,a8w8_blockscale_1x128x128_256x16x256x128_8x16_16x16_1x4_16x16x1_8x32x1_1x16x1x16_8_1x2_intrawave_v1,144.62,63.26,0.0
64,20480,2048,1024,ck,4,0,760.0871,a8w8_blockscale_1x128x128_256x16x256x128_8x16_16x16_1x4_16x16x1_8x32x1_1x16x1x16_8_1x2_intrawave_v1,113.01,140.71,0.0
64,20480,2048,2048,ck,4,0,1334.3078,a8w8_blockscale_1x128x128_256x16x256x128_8x16_16x16_1x4_16x16x1_8x32x1_1x16x1x16_8_1x2_intrawave_v1,128.75,97.45,0.0
64,20480,2048,3072,ck,4,0,1884.6874,a8w8_blockscale_1x128x128_256x16x256x128_8x16_16x16_1x4_16x16x1_8x32x1_1x16x1x16_8_1x2_intrawave_v1,136.73,81.23,0.0
64,20480,2048,4096,ck,4,0,2487.2721,a8w8_blockscale_1x128x128_256x16x256x128_8x16_16x16_1x4_16x16x1_8x32x1_1x16x1x16_8_1x2_intrawave_v1,138.14,70.82,0.0
64,20480,2048,6144,ck,4,0,3613.153,a8w8_blockscale_1x128x128_256x16x256x128_8x16_16x16_1x4_16x16x1_8x32x1_1x16x1x16_8_1x2_intrawave_v1,142.64,61.52,0.0
64,16,4096,1024,ck,5,0,14.4201,a8w8_blockscale_1x128x128_256x16x128x128_8x16_16x16_1x2_16x16x1_8x32x1_1x16x1x16_8_1x2_intrawave_v1,9.31,301.09,0.0
64,16,4096,2048,ck,7,0,20.0962,a8w8_blockscale_1x128x128_256x16x128x256_16x16_16x16_1x2_16x16x1_16x16x1_1x16x1x16_8_1x2_intrawave_v1,13.36,425.58,0.0
64,16,4096,3072,ck,7,0,26.9144,a8w8_blockscale_1x128x128_256x16x128x256_16x16_16x16_1x2_16x16x1_16x16x1_1x16x1x16_8_1x2_intrawave_v1,14.96,474.21,0.0
64,16,4096,4096,ck,7,0,37.6667,a8w8_blockscale_1x128x128_256x16x128x256_16x16_16x16_1x2_16x16x1_16x16x1_1x16x1x16_8_1x2_intrawave_v1,14.25,450.63,0.0
64,16,4096,6144,ck,7,0,46.7524,a8w8_blockscale_1x128x128_256x16x128x256_16x16_16x16_1x2_16x16x1_16x16x1_1x16x1x16_8_1x2_intrawave_v1,17.22,543.18,0.0
64,32,4096,1024,ck,7,0,14.1387,a8w8_blockscale_1x128x128_256x16x128x256_16x16_16x16_1x2_16x16x1_16x16x1_1x16x1x16_8_1x2_intrawave_v1,18.99,317.51,0.0
64,32,4096,2048,ck,7,0,21.1362,a8w8_blockscale_1x128x128_256x16x128x256_16x16_16x16_1x2_16x16x1_16x16x1_1x16x1x16_8_1x2_intrawave_v1,25.4,412.39,0.0
64,32,4096,3072,ck,7,0,28.062,a8w8_blockscale_1x128x128_256x16x128x256_16x16_16x16_1x2_16x16x1_16x16x1_1x16x1x16_8_1x2_intrawave_v1,28.7,461.24,0.0
64,32,4096,4096,ck,7,0,37.996,a8w8_blockscale_1x128x128_256x16x128x256_16x16_16x16_1x2_16x16x1_16x16x1_1x16x1x16_8_1x2_intrawave_v1,28.26,451.9,0.0
64,32,4096,6144,ck,7,0,48.4953,a8w8_blockscale_1x128x128_256x16x128x256_16x16_16x16_1x2_16x16x1_16x16x1_1x16x1x16_8_1x2_intrawave_v1,33.21,528.39,0.0
64,64,4096,1024,ck,7,0,16.8052,a8w8_blockscale_1x128x128_256x16x128x256_16x16_16x16_1x2_16x16x1_16x16x1_1x16x1x16_8_1x2_intrawave_v1,31.95,284.68,0.0
64,64,4096,2048,ck,7,0,24.166,a8w8_blockscale_1x128x128_256x16x128x256_16x16_16x16_1x2_16x16x1_16x16x1_1x16x1x16_8_1x2_intrawave_v1,44.43,374.24,0.0
64,64,4096,3072,ck,7,0,33.7073,a8w8_blockscale_1x128x128_256x16x128x256_16x16_16x16_1x2_16x16x1_16x16x1_1x16x1x16_8_1x2_intrawave_v1,47.78,394.69,0.0
64,64,4096,4096,ck,5,0,44.9669,a8w8_blockscale_1x128x128_256x16x128x128_8x16_16x16_1x2_16x16x1_8x32x1_1x16x1x16_8_1x2_intrawave_v1,47.76,390.59,0.0
64,64,4096,6144,ck,5,0,57.0882,a8w8_blockscale_1x128x128_256x16x128x128_8x16_16x16_1x2_16x16x1_8x32x1_1x16x1x16_8_1x2_intrawave_v1,56.43,456.9,0.0
64,128,4096,1024,ck,5,0,20.9177,a8w8_blockscale_1x128x128_256x16x128x128_8x16_16x16_1x2_16x16x1_8x32x1_1x16x1x16_8_1x2_intrawave_v1,51.33,256.91,0.0
64,128,4096,2048,ck,4,0,34.1479,a8w8_blockscale_1x128x128_256x16x256x128_8x16_16x16_1x4_16x16x1_8x32x1_1x16x1x16_8_1x2_intrawave_v1,62.89,284.04,0.0
64,128,4096,3072,ck,4,0,46.0803,a8w8_blockscale_1x128x128_256x16x256x128_8x16_16x16_1x4_16x16x1_8x32x1_1x16x1x16_8_1x2_intrawave_v1,69.9,304.35,0.0
64,128,4096,4096,ck,4,0,63.2485,a8w8_blockscale_1x128x128_256x16x256x128_8x16_16x16_1x4_16x16x1_8x32x1_1x16x1x16_8_1x2_intrawave_v1,67.91,290.13,0.0
64,128,4096,6144,ck,4,0,75.7924,a8w8_blockscale_1x128x128_256x16x256x128_8x16_16x16_1x4_16x16x1_8x32x1_1x16x1x16_8_1x2_intrawave_v1,85.0,356.25,0.0
64,256,4096,1024,ck,4,0,24.9796,a8w8_blockscale_1x128x128_256x16x256x128_8x16_16x16_1x4_16x16x1_8x32x1_1x16x1x16_8_1x2_intrawave_v1,85.97,262.36,0.0
64,256,4096,2048,ck,5,0,42.6028,a8w8_blockscale_1x128x128_256x16x128x128_8x16_16x16_1x2_16x16x1_8x32x1_1x16x1x16_8_1x2_intrawave_v1,100.81,258.43,0.0
64,256,4096,3072,ck,5,0,62.1239,a8w8_blockscale_1x128x128_256x16x128x128_8x16_16x16_1x2_16x16x1_8x32x1_1x16x1x16_8_1x2_intrawave_v1,103.7,248.96,0.0
64,256,4096,4096,ck,4,0,82.0384,a8w8_blockscale_1x128x128_256x16x256x128_8x16_16x16_1x4_16x16x1_8x32x1_1x16x1x16_8_1x2_intrawave_v1,104.71,242.85,0.0
64,256,4096,6144,ck,4,0,98.23,a8w8_blockscale_1x128x128_256x16x256x128_8x16_16x16_1x4_16x16x1_8x32x1_1x16x1x16_8_1x2_intrawave_v1,131.17,293.55,0.0
64,512,4096,1024,ck,4,0,39.7999,a8w8_blockscale_1x128x128_256x16x256x128_8x16_16x16_1x4_16x16x1_8x32x1_1x16x1x16_8_1x2_intrawave_v1,107.91,223.94,0.0
64,512,4096,2048,ck,4,0,74.0164,a8w8_blockscale_1x128x128_256x16x256x128_8x16_16x16_1x4_16x16x1_8x32x1_1x16x1x16_8_1x2_intrawave_v1,116.05,184.17,0.0
64,512,4096,3072,ck,4,0,98.8413,a8w8_blockscale_1x128x128_256x16x256x128_8x16_16x16_1x4_16x16x1_8x32x1_1x16x1x16_8_1x2_intrawave_v1,130.36,185.65,0.0
64,512,4096,4096,ck,4,0,134.6565,a8w8_blockscale_1x128x128_256x16x256x128_8x16_16x16_1x4_16x16x1_8x32x1_1x16x1x16_8_1x2_intrawave_v1,127.58,171.31,0.0
64,512,4096,6144,ck,4,0,187.8565,a8w8_blockscale_1x128x128_256x16x256x128_8x16_16x16_1x4_16x16x1_8x32x1_1x16x1x16_8_1x2_intrawave_v1,137.18,173.04,0.0
64,1024,4096,1024,ck,4,0,75.5577,a8w8_blockscale_1x128x128_256x16x256x128_8x16_16x16_1x4_16x16x1_8x32x1_1x16x1x16_8_1x2_intrawave_v1,113.69,180.41,0.0
64,1024,4096,2048,ck,4,0,132.7788,a8w8_blockscale_1x128x128_256x16x256x128_8x16_16x16_1x4_16x16x1_8x32x1_1x16x1x16_8_1x2_intrawave_v1,129.39,142.15,0.0
64,1024,4096,3072,ck,4,0,188.5431,a8w8_blockscale_1x128x128_256x16x256x128_8x16_16x16_1x4_16x16x1_8x32x1_1x16x1x16_8_1x2_intrawave_v1,136.68,127.91,0.0
64,1024,4096,4096,ck,4,0,251.1525,a8w8_blockscale_1x128x128_256x16x256x128_8x16_16x16_1x4_16x16x1_8x32x1_1x16x1x16_8_1x2_intrawave_v1,136.81,116.9,0.0
64,1024,4096,6144,ck,4,0,356.8252,a8w8_blockscale_1x128x128_256x16x256x128_8x16_16x16_1x4_16x16x1_8x32x1_1x16x1x16_8_1x2_intrawave_v1,144.44,111.67,0.0
64,2048,4096,1024,ck,4,0,145.018,a8w8_blockscale_1x128x128_256x16x256x128_8x16_16x16_1x4_16x16x1_8x32x1_1x16x1x16_8_1x2_intrawave_v1,118.47,159.07,0.0
64,2048,4096,2048,ck,4,0,261.6952,a8w8_blockscale_1x128x128_256x16x256x128_8x16_16x16_1x4_16x16x1_8x32x1_1x16x1x16_8_1x2_intrawave_v1,131.3,112.19,0.0
64,2048,4096,3072,ck,4,0,367.3987,a8w8_blockscale_1x128x128_256x16x256x128_8x16_16x16_1x4_16x16x1_8x32x1_1x16x1x16_8_1x2_intrawave_v1,140.28,97.04,0.0
64,2048,4096,4096,ck,4,0,489.6077,a8w8_blockscale_1x128x128_256x16x256x128_8x16_16x16_1x4_16x16x1_8x32x1_1x16x1x16_8_1x2_intrawave_v1,140.36,85.67,0.0
64,2048,4096,6144,ck,4,0,703.6504,a8w8_blockscale_1x128x128_256x16x256x128_8x16_16x16_1x4_16x16x1_8x32x1_1x16x1x16_8_1x2_intrawave_v1,146.49,77.49,0.0
64,4096,4096,1024,ck,4,0,304.1897,a8w8_blockscale_1x128x128_256x16x256x128_8x16_16x16_1x4_16x16x1_8x32x1_1x16x1x16_8_1x2_intrawave_v1,112.95,137.88,0.0
64,4096,4096,2048,ck,4,0,519.1016,a8w8_blockscale_1x128x128_256x16x256x128_8x16_16x16_1x4_16x16x1_8x32x1_1x16x1x16_8_1x2_intrawave_v1,132.38,96.96,0.0
64,4096,4096,3072,ck,4,0,740.2035,a8w8_blockscale_1x128x128_256x16x256x128_8x16_16x16_1x4_16x16x1_8x32x1_1x16x1x16_8_1x2_intrawave_v1,139.26,79.33,0.0
64,4096,4096,4096,ck,4,0,961.9447,a8w8_blockscale_1x128x128_256x16x256x128_8x16_16x16_1x4_16x16x1_8x32x1_1x16x1x16_8_1x2_intrawave_v1,142.88,69.76,0.0
64,4096,4096,6144,ck,4,0,1402.7717,a8w8_blockscale_1x128x128_256x16x256x128_8x16_16x16_1x4_16x16x1_8x32x1_1x16x1x16_8_1x2_intrawave_v1,146.97,59.8,0.0
64,8192,4096,1024,ck,4,0,598.164,a8w8_blockscale_1x128x128_256x16x256x128_8x16_16x16_1x4_16x16x1_8x32x1_1x16x1x16_8_1x2_intrawave_v1,114.88,133.23,0.0
64,8192,4096,2048,ck,4,0,1035.9867,a8w8_blockscale_1x128x128_256x16x256x128_8x16_16x16_1x4_16x16x1_8x32x1_1x16x1x16_8_1x2_intrawave_v1,132.66,89.07,0.0
64,8192,4096,3072,ck,4,0,1464.0675,a8w8_blockscale_1x128x128_256x16x256x128_8x16_16x16_1x4_16x16x1_8x32x1_1x16x1x16_8_1x2_intrawave_v1,140.81,71.62,0.0
64,8192,4096,4096,ck,4,0,1932.5472,a8w8_blockscale_1x128x128_256x16x256x128_8x16_16x16_1x4_16x16x1_8x32x1_1x16x1x16_8_1x2_intrawave_v1,142.24,60.77,0.0
64,8192,4096,6144,ck,4,0,2828.3231,a8w8_blockscale_1x128x128_256x16x256x128_8x16_16x16_1x4_16x16x1_8x32x1_1x16x1x16_8_1x2_intrawave_v1,145.78,50.42,0.0
64,16384,4096,1024,ck,4,0,1200.762,a8w8_blockscale_1x128x128_256x16x256x128_8x16_16x16_1x4_16x16x1_8x32x1_1x16x1x16_8_1x2_intrawave_v1,114.46,129.24,0.0
64,16384,4096,2048,ck,4,0,2066.7553,a8w8_blockscale_1x128x128_256x16x256x128_8x16_16x16_1x4_16x16x1_8x32x1_1x16x1x16_8_1x2_intrawave_v1,133.0,85.24,0.0
64,16384,4096,3072,ck,4,0,2982.9431,a8w8_blockscale_1x128x128_256x16x256x128_8x16_16x16_1x4_16x16x1_8x32x1_1x16x1x16_8_1x2_intrawave_v1,138.22,66.09,0.0
64,16384,4096,4096,ck,4,0,3935.3576,a8w8_blockscale_1x128x128_256x16x256x128_8x16_16x16_1x4_16x16x1_8x32x1_1x16x1x16_8_1x2_intrawave_v1,139.7,55.42,0.0
64,16384,4096,6144,ck,4,0,5806.9406,a8w8_blockscale_1x128x128_256x16x256x128_8x16_16x16_1x4_16x16x1_8x32x1_1x16x1x16_8_1x2_intrawave_v1,142.01,44.78,0.0
64,20480,4096,1024,ck,4,0,1515.3033,a8w8_blockscale_1x128x128_256x16x256x128_8x16_16x16_1x4_16x16x1_8x32x1_1x16x1x16_8_1x2_intrawave_v1,113.38,127.33,0.0
64,20480,4096,2048,ck,4,0,2618.3656,a8w8_blockscale_1x128x128_256x16x256x128_8x16_16x16_1x4_16x16x1_8x32x1_1x16x1x16_8_1x2_intrawave_v1,131.23,83.3,0.0
64,20480,4096,3072,ck,4,0,3764.3722,a8w8_blockscale_1x128x128_256x16x256x128_8x16_16x16_1x4_16x16x1_8x32x1_1x16x1x16_8_1x2_intrawave_v1,136.91,64.62,0.0
64,20480,4096,4096,ck,4,0,4937.3285,a8w8_blockscale_1x128x128_256x16x256x128_8x16_16x16_1x4_16x16x1_8x32x1_1x16x1x16_8_1x2_intrawave_v1,139.18,54.37,0.0
64,20480,4096,6144,ck,4,0,7245.82,a8w8_blockscale_1x128x128_256x16x256x128_8x16_16x16_1x4_16x16x1_8x32x1_1x16x1x16_8_1x2_intrawave_v1,142.26,43.99,0.0
64,16,6144,1024,ck,7,0,18.8588,a8w8_blockscale_1x128x128_256x16x128x256_16x16_16x16_1x2_16x16x1_16x16x1_1x16x1x16_8_1x2_intrawave_v1,10.68,344.9,0.0
64,16,6144,2048,ck,7,0,28.8498,a8w8_blockscale_1x128x128_256x16x128x256_16x16_16x16_1x2_16x16x1_16x16x1_1x16x1x16_8_1x2_intrawave_v1,13.96,444.1,0.0
64,16,6144,3072,ck,7,0,39.461,a8w8_blockscale_1x128x128_256x16x128x256_16x16_16x16_1x2_16x16x1_16x16x1_1x16x1x16_8_1x2_intrawave_v1,15.31,484.53,0.0
64,16,6144,4096,ck,7,0,54.9729,a8w8_blockscale_1x128x128_256x16x128x256_16x16_16x16_1x2_16x16x1_16x16x1_1x16x1x16_8_1x2_intrawave_v1,14.65,462.55,0.0
64,16,6144,6144,ck,7,0,70.1236,a8w8_blockscale_1x128x128_256x16x128x256_16x16_16x16_1x2_16x16x1_16x16x1_1x16x1x16_8_1x2_intrawave_v1,17.23,542.52,0.0
64,32,6144,1024,ck,7,0,21.3488,a8w8_blockscale_1x128x128_256x16x128x256_16x16_16x16_1x2_16x16x1_16x16x1_1x16x1x16_8_1x2_intrawave_v1,18.86,314.65,0.0
64,32,6144,2048,ck,7,0,31.5954,a8w8_blockscale_1x128x128_256x16x128x256_16x16_16x16_1x2_16x16x1_16x16x1_1x16x1x16_8_1x2_intrawave_v1,25.49,412.77,0.0
64,32,6144,3072,ck,7,0,41.9391,a8w8_blockscale_1x128x128_256x16x128x256_16x16_16x16_1x2_16x16x1_16x16x1_1x16x1x16_8_1x2_intrawave_v1,28.8,461.76,0.0
64,32,6144,4096,ck,7,0,59.5017,a8w8_blockscale_1x128x128_256x16x128x256_16x16_16x16_1x2_16x16x1_16x16x1_1x16x1x16_8_1x2_intrawave_v1,27.07,431.75,0.0
64,32,6144,6144,ck,7,0,73.4445,a8w8_blockscale_1x128x128_256x16x128x256_16x16_16x16_1x2_16x16x1_16x16x1_1x16x1x16_8_1x2_intrawave_v1,32.89,522.01,0.0
64,64,6144,1024,ck,7,0,21.7232,a8w8_blockscale_1x128x128_256x16x128x256_16x16_16x16_1x2_16x16x1_16x16x1_1x16x1x16_8_1x2_intrawave_v1,37.07,328.84,0.0
64,64,6144,2048,ck,7,0,32.3248,a8w8_blockscale_1x128x128_256x16x128x256_16x16_16x16_1x2_16x16x1_16x16x1_1x16x1x16_8_1x2_intrawave_v1,49.83,417.65,0.0
64,64,6144,3072,ck,7,0,45.7834,a8w8_blockscale_1x128x128_256x16x128x256_16x16_16x16_1x2_16x16x1_16x16x1_1x16x1x16_8_1x2_intrawave_v1,52.77,433.73,0.0
64,64,6144,4096,ck,7,0,64.8731,a8w8_blockscale_1x128x128_256x16x128x256_16x16_16x16_1x2_16x16x1_16x16x1_1x16x1x16_8_1x2_intrawave_v1,49.65,404.09,0.0
64,64,6144,6144,ck,7,0,86.2787,a8w8_blockscale_1x128x128_256x16x128x256_16x16_16x16_1x2_16x16x1_16x16x1_1x16x1x16_8_1x2_intrawave_v1,56.0,451.19,0.0
64,128,6144,1024,ck,7,0,28.7454,a8w8_blockscale_1x128x128_256x16x128x256_16x16_16x16_1x2_16x16x1_16x16x1_1x16x1x16_8_1x2_intrawave_v1,56.03,278.15,0.0
64,128,6144,2048,ck,4,0,41.6072,a8w8_blockscale_1x128x128_256x16x256x128_8x16_16x16_1x4_16x16x1_8x32x1_1x16x1x16_8_1x2_intrawave_v1,77.42,346.52,0.0
64,128,6144,3072,ck,4,0,56.8249,a8w8_blockscale_1x128x128_256x16x256x128_8x16_16x16_1x4_16x16x1_8x32x1_1x16x1x16_8_1x2_intrawave_v1,85.03,366.75,0.0
64,128,6144,4096,ck,5,0,80.088,a8w8_blockscale_1x128x128_256x16x128x128_8x16_16x16_1x2_16x16x1_8x32x1_1x16x1x16_8_1x2_intrawave_v1,80.44,340.41,0.0
64,128,6144,6144,ck,4,0,100.1766,a8w8_blockscale_1x128x128_256x16x256x128_8x16_16x16_1x4_16x16x1_8x32x1_1x16x1x16_8_1x2_intrawave_v1,96.47,400.37,0.0
64,256,6144,1024,ck,4,0,36.2969,a8w8_blockscale_1x128x128_256x16x256x128_8x16_16x16_1x4_16x16x1_8x32x1_1x16x1x16_8_1x2_intrawave_v1,88.75,267.22,0.0
64,256,6144,2048,ck,4,0,59.2936,a8w8_blockscale_1x128x128_256x16x256x128_8x16_16x16_1x4_16x16x1_8x32x1_1x16x1x16_8_1x2_intrawave_v1,108.65,274.11,0.0
64,256,6144,3072,ck,4,0,77.2901,a8w8_blockscale_1x128x128_256x16x256x128_8x16_16x16_1x4_16x16x1_8x32x1_1x16x1x16_8_1x2_intrawave_v1,125.03,295.08,0.0
64,256,6144,4096,ck,5,0,124.7157,a8w8_blockscale_1x128x128_256x16x128x128_8x16_16x16_1x2_16x16x1_8x32x1_1x16x1x16_8_1x2_intrawave_v1,103.31,235.42,0.0
64,256,6144,6144,ck,5,0,158.9916,a8w8_blockscale_1x128x128_256x16x128x128_8x16_16x16_1x2_16x16x1_8x32x1_1x16x1x16_8_1x2_intrawave_v1,121.56,267.1,0.0
64,512,6144,1024,ck,4,0,56.7536,a8w8_blockscale_1x128x128_256x16x256x128_8x16_16x16_1x4_16x16x1_8x32x1_1x16x1x16_8_1x2_intrawave_v1,113.52,230.95,0.0
64,512,6144,2048,ck,4,0,98.8534,a8w8_blockscale_1x128x128_256x16x256x128_8x16_16x16_1x4_16x16x1_8x32x1_1x16x1x16_8_1x2_intrawave_v1,130.34,201.54,0.0
64,512,6144,3072,ck,4,0,144.22,a8w8_blockscale_1x128x128_256x16x256x128_8x16_16x16_1x4_16x16x1_8x32x1_1x16x1x16_8_1x2_intrawave_v1,134.01,185.4,0.0
64,512,6144,4096,ck,4,0,203.2092,a8w8_blockscale_1x128x128_256x16x256x128_8x16_16x16_1x4_16x16x1_8x32x1_1x16x1x16_8_1x2_intrawave_v1,126.81,165.12,0.0
64,512,6144,6144,ck,4,0,271.9618,a8w8_blockscale_1x128x128_256x16x256x128_8x16_16x16_1x4_16x16x1_8x32x1_1x16x1x16_8_1x2_intrawave_v1,142.13,173.5,0.0
64,1024,6144,1024,ck,4,0,109.3472,a8w8_blockscale_1x128x128_256x16x256x128_8x16_16x16_1x4_16x16x1_8x32x1_1x16x1x16_8_1x2_intrawave_v1,117.83,182.2,0.0
64,1024,6144,2048,ck,4,0,193.6088,a8w8_blockscale_1x128x128_256x16x256x128_8x16_16x16_1x4_16x16x1_8x32x1_1x16x1x16_8_1x2_intrawave_v1,133.1,140.81,0.0
64,1024,6144,3072,ck,4,0,275.258,a8w8_blockscale_1x128x128_256x16x256x128_8x16_16x16_1x4_16x16x1_8x32x1_1x16x1x16_8_1x2_intrawave_v1,140.43,125.71,0.0
64,1024,6144,4096,ck,4,0,371.4071,a8w8_blockscale_1x128x128_256x16x256x128_8x16_16x16_1x4_16x16x1_8x32x1_1x16x1x16_8_1x2_intrawave_v1,138.77,112.93,0.0
64,1024,6144,6144,ck,4,0,531.1774,a8w8_blockscale_1x128x128_256x16x256x128_8x16_16x16_1x4_16x16x1_8x32x1_1x16x1x16_8_1x2_intrawave_v1,145.54,106.6,0.0
64,2048,6144,1024,ck,4,0,218.8243,a8w8_blockscale_1x128x128_256x16x256x128_8x16_16x16_1x4_16x16x1_8x32x1_1x16x1x16_8_1x2_intrawave_v1,117.76,153.34,0.0
64,2048,6144,2048,ck,4,0,385.8245,a8w8_blockscale_1x128x128_256x16x256x128_8x16_16x16_1x4_16x16x1_8x32x1_1x16x1x16_8_1x2_intrawave_v1,133.58,108.71,0.0
64,2048,6144,3072,ck,4,0,554.9579,a8w8_blockscale_1x128x128_256x16x256x128_8x16_16x16_1x4_16x16x1_8x32x1_1x16x1x16_8_1x2_intrawave_v1,139.31,90.69,0.0
64,2048,6144,4096,ck,4,0,729.4863,a8w8_blockscale_1x128x128_256x16x256x128_8x16_16x16_1x4_16x16x1_8x32x1_1x16x1x16_8_1x2_intrawave_v1,141.3,80.5,0.0
64,2048,6144,6144,ck,4,0,1049.3659,a8w8_blockscale_1x128x128_256x16x256x128_8x16_16x16_1x4_16x16x1_8x32x1_1x16x1x16_8_1x2_intrawave_v1,147.35,71.95,0.0
64,4096,6144,1024,ck,4,0,446.9151,a8w8_blockscale_1x128x128_256x16x256x128_8x16_16x16_1x4_16x16x1_8x32x1_1x16x1x16_8_1x2_intrawave_v1,115.32,136.08,0.0
64,4096,6144,2048,ck,4,0,776.821,a8w8_blockscale_1x128x128_256x16x256x128_8x16_16x16_1x4_16x16x1_8x32x1_1x16x1x16_8_1x2_intrawave_v1,132.69,91.79,0.0
64,4096,6144,3072,ck,4,0,1096.0375,a8w8_blockscale_1x128x128_256x16x256x128_8x16_16x16_1x4_16x16x1_8x32x1_1x16x1x16_8_1x2_intrawave_v1,141.07,74.62,0.0
64,4096,6144,4096,ck,4,0,1429.0189,a8w8_blockscale_1x128x128_256x16x256x128_8x16_16x16_1x4_16x16x1_8x32x1_1x16x1x16_8_1x2_intrawave_v1,144.27,64.57,0.0
64,4096,6144,6144,ck,4,0,2124.8397,a8w8_blockscale_1x128x128_256x16x256x128_8x16_16x16_1x4_16x16x1_8x32x1_1x16x1x16_8_1x2_intrawave_v1,145.53,53.3,0.0
64,8192,6144,1024,ck,4,0,900.8286,a8w8_blockscale_1x128x128_256x16x256x128_8x16_16x16_1x4_16x16x1_8x32x1_1x16x1x16_8_1x2_intrawave_v1,114.43,128.04,0.0
64,8192,6144,2048,ck,4,0,1560.1354,a8w8_blockscale_1x128x128_256x16x256x128_8x16_16x16_1x4_16x16x1_8x32x1_1x16x1x16_8_1x2_intrawave_v1,132.14,83.34,0.0
64,8192,6144,3072,ck,4,0,2236.8234,a8w8_blockscale_1x128x128_256x16x256x128_8x16_16x16_1x4_16x16x1_8x32x1_1x16x1x16_8_1x2_intrawave_v1,138.25,64.69,0.0
64,8192,6144,4096,ck,4,0,2904.164,a8w8_blockscale_1x128x128_256x16x256x128_8x16_16x16_1x4_16x16x1_8x32x1_1x16x1x16_8_1x2_intrawave_v1,141.97,54.88,0.0
64,8192,6144,6144,ck,4,0,4320.1586,a8w8_blockscale_1x128x128_256x16x256x128_8x16_16x16_1x4_16x16x1_8x32x1_1x16x1x16_8_1x2_intrawave_v1,143.16,43.69,0.0
64,16384,6144,1024,ck,4,0,1795.133,a8w8_blockscale_1x128x128_256x16x256x128_8x16_16x16_1x4_16x16x1_8x32x1_1x16x1x16_8_1x2_intrawave_v1,114.84,125.0,0.0
64,16384,6144,2048,ck,4,0,3164.6472,a8w8_blockscale_1x128x128_256x16x256x128_8x16_16x16_1x4_16x16x1_8x32x1_1x16x1x16_8_1x2_intrawave_v1,130.29,78.2,0.0
64,16384,6144,3072,ck,4,0,4515.7798,a8w8_blockscale_1x128x128_256x16x256x128_8x16_16x16_1x4_16x16x1_8x32x1_1x16x1x16_8_1x2_intrawave_v1,136.96,59.91,0.0
64,16384,6144,4096,ck,4,0,5972.6438,a8w8_blockscale_1x128x128_256x16x256x128_8x16_16x16_1x4_16x16x1_8x32x1_1x16x1x16_8_1x2_intrawave_v1,138.07,49.16,0.0
64,16384,6144,6144,ck,4,0,8662.5514,a8w8_blockscale_1x128x128_256x16x256x128_8x16_16x16_1x4_16x16x1_8x32x1_1x16x1x16_8_1x2_intrawave_v1,142.79,39.22,0.0
64,20480,6144,1024,ck,4,0,2235.6229,a8w8_blockscale_1x128x128_256x16x256x128_8x16_16x16_1x4_16x16x1_8x32x1_1x16x1x16_8_1x2_intrawave_v1,115.27,124.76,0.0
64,20480,6144,2048,ck,4,0,3979.6584,a8w8_blockscale_1x128x128_256x16x256x128_8x16_16x16_1x4_16x16x1_8x32x1_1x16x1x16_8_1x2_intrawave_v1,129.51,76.94,0.0
64,20480,6144,3072,ck,4,0,5737.1556,a8w8_blockscale_1x128x128_256x16x256x128_8x16_16x16_1x4_16x16x1_8x32x1_1x16x1x16_8_1x2_intrawave_v1,134.75,58.12,0.0
64,20480,6144,4096,ck,4,0,7402.1059,a8w8_blockscale_1x128x128_256x16x256x128_8x16_16x16_1x4_16x16x1_8x32x1_1x16x1x16_8_1x2_intrawave_v1,139.26,48.73,0.0
64,20480,6144,6144,ck,4,0,10950.3475,a8w8_blockscale_1x128x128_256x16x256x128_8x16_16x16_1x4_16x16x1_8x32x1_1x16x1x16_8_1x2_intrawave_v1,141.2,37.92,0.0
256,16,512,7168,ck,8,0,21.6091,a8w8_blockscale_1x128x128_256x16x64x256_16x16_16x16_1x1_16x16x1_16x16x1_1x16x1x16_4_1x1_intrawave_v1,5.43,175.9,0.0
256,32,512,7168,ck,8,0,21.7352,a8w8_blockscale_1x128x128_256x16x64x256_16x16_16x16_1x1_16x16x1_16x16x1_1x16x1x16_4_1x1_intrawave_v1,10.81,180.91,0.0
256,64,512,7168,ck,8,0,21.6273,a8w8_blockscale_1x128x128_256x16x64x256_16x16_16x16_1x1_16x16x1_16x16x1_1x16x1x16_4_1x1_intrawave_v1,21.72,193.94,0.0
256,128,512,7168,ck,8,0,21.4148,a8w8_blockscale_1x128x128_256x16x64x256_16x16_16x16_1x1_16x16x1_16x16x1_1x16x1x16_4_1x1_intrawave_v1,43.87,220.34,0.0
256,256,512,7168,ck,8,0,21.577,a8w8_blockscale_1x128x128_256x16x64x256_16x16_16x16_1x1_16x16x1_16x16x1_1x16x1x16_4_1x1_intrawave_v1,87.09,267.28,0.0
256,512,512,7168,ck,8,0,22.1872,a8w8_blockscale_1x128x128_256x16x64x256_16x16_16x16_1x1_16x16x1_16x16x1_1x16x1x16_4_1x1_intrawave_v1,169.38,354.45,0.0
256,1024,512,7168,ck,18,0,27.5523,a8w8_blockscale_1x128x128_256x64x64x256_16x16_32x32_1x1_16x16x1_16x16x1_1x32x1x8_8_1x1_intrawave_v1,272.8,437.66,0.0
256,1536,512,7168,ck,18,0,28.3801,a8w8_blockscale_1x128x128_256x64x64x256_16x16_32x32_1x1_16x16x1_16x16x1_1x32x1x8_8_1x1_intrawave_v1,397.26,572.69,0.0
256,2048,512,7168,ck,18,0,29.4451,a8w8_blockscale_1x128x128_256x64x64x256_16x16_32x32_1x1_16x16x1_16x16x1_1x32x1x8_8_1x1_intrawave_v1,510.52,694.42,0.0
256,4096,512,7168,ck,2,0,45.5413,a8w8_blockscale_1x128x128_256x64x128x128_16x16_32x32_1x2_8x32x1_8x32x1_1x32x1x8_8_1x1_intrawave_v3,660.16,817.38,0.0
256,8192,512,7168,ck,0,0,64.1614,a8w8_blockscale_1x128x128_256x128x128x128_16x16_32x32_2x2_8x32x1_8x32x1_1x32x1x8_8_1x1_intrawave_v3,937.16,1103.14,0.0
256,16384,512,7168,cktile,11,0,98.713,a8w8_blockscale_cktile_192x256x128_4x2x1_16x16x128_intrawave_0x1x0_1,1218.27,1396.85,0.0
256,20480,512,7168,cktile,11,0,106.7764,a8w8_blockscale_cktile_192x256x128_4x2x1_16x16x128_intrawave_0x1x0_1,1407.84,1605.62,0.0
256,16,576,7168,ck,8,0,21.6838,a8w8_blockscale_1x128x128_256x16x64x256_16x16_16x16_1x1_16x16x1_16x16x1_1x16x1x16_4_1x1_intrawave_v1,6.09,196.55,0.0
256,32,576,7168,ck,8,0,21.7855,a8w8_blockscale_1x128x128_256x16x64x256_16x16_16x16_1x1_16x16x1_16x16x1_1x16x1x16_4_1x1_intrawave_v1,12.13,201.74,0.0
256,64,576,7168,ck,8,0,21.6935,a8w8_blockscale_1x128x128_256x16x64x256_16x16_16x16_1x1_16x16x1_16x16x1_1x16x1x16_4_1x1_intrawave_v1,24.36,214.87,0.0
256,128,576,7168,ck,8,0,21.5068,a8w8_blockscale_1x128x128_256x16x64x256_16x16_16x16_1x1_16x16x1_16x16x1_1x16x1x16_4_1x1_intrawave_v1,49.15,241.49,0.0
256,256,576,7168,ck,8,0,21.6926,a8w8_blockscale_1x128x128_256x16x64x256_16x16_16x16_1x1_16x16x1_16x16x1_1x16x1x16_4_1x1_intrawave_v1,97.45,288.52,0.0
256,512,576,7168,ck,18,0,27.36,a8w8_blockscale_1x128x128_256x64x64x256_16x16_32x32_1x1_16x16x1_16x16x1_1x32x1x8_8_1x1_intrawave_v1,154.53,306.6,0.0
256,1024,576,7168,ck,18,0,27.8966,a8w8_blockscale_1x128x128_256x64x64x256_16x16_32x32_1x1_16x16x1_16x16x1_1x32x1x8_8_1x1_intrawave_v1,303.11,453.4,0.0
256,1536,576,7168,ck,18,0,29.2873,a8w8_blockscale_1x128x128_256x64x64x256_16x16_32x32_1x1_16x16x1_16x16x1_1x32x1x8_8_1x1_intrawave_v1,433.07,577.32,0.0
256,2048,576,7168,ck,3,0,47.4069,a8w8_blockscale_1x128x128_256x64x64x128_16x16_32x32_1x1_8x32x1_8x32x1_1x32x1x8_8_1x1_intrawave_v3,356.73,446.52,0.0
256,4096,576,7168,ck,0,0,57.0941,a8w8_blockscale_1x128x128_256x128x128x128_16x16_32x32_2x2_8x32x1_8x32x1_1x32x1x8_8_1x1_intrawave_v3,592.41,669.2,0.0
256,8192,576,7168,ck,0,0,89.2735,a8w8_blockscale_1x128x128_256x128x128x128_16x16_32x32_2x2_8x32x1_8x32x1_1x32x1x8_8_1x1_intrawave_v3,757.74,809.72,0.0
256,16384,576,7168,ck,0,0,153.6456,a8w8_blockscale_1x128x128_256x128x128x128_16x16_32x32_2x2_8x32x1_8x32x1_1x32x1x8_8_1x1_intrawave_v3,880.54,914.08,0.0
256,20480,576,7168,cktile,11,0,181.5841,a8w8_blockscale_cktile_192x256x128_4x2x1_16x16x128_intrawave_0x1x0_1,931.33,961.11,0.0
256,128,1024,4096,ck,8,0,13.7599,a8w8_blockscale_1x128x128_256x16x64x256_16x16_16x16_1x1_16x16x1_16x16x1_1x16x1x16_4_1x1_intrawave_v1,78.03,361.97,0.0
256,16,1536,7168,ck,8,0,22.0787,a8w8_blockscale_1x128x128_256x16x64x256_16x16_16x16_1x1_16x16x1_16x16x1_1x16x1x16_4_1x1_intrawave_v1,15.96,506.09,0.0
256,32,1536,7168,ck,8,0,22.1428,a8w8_blockscale_1x128x128_256x16x64x256_16x16_16x16_1x1_16x16x1_16x16x1_1x16x1x16_4_1x1_intrawave_v1,31.82,512.03,0.0
256,64,1536,7168,ck,8,0,22.0238,a8w8_blockscale_1x128x128_256x16x64x256_16x16_16x16_1x1_16x16x1_16x16x1_1x16x1x16_4_1x1_intrawave_v1,63.99,529.67,0.0
256,128,1536,7168,ck,8,0,21.7841,a8w8_blockscale_1x128x128_256x16x64x256_16x16_16x16_1x1_16x16x1_16x16x1_1x16x1x16_4_1x1_intrawave_v1,129.39,565.59,0.0
256,256,1536,7168,ck,18,0,27.6348,a8w8_blockscale_1x128x128_256x64x64x256_16x16_32x32_1x1_16x16x1_16x16x1_1x32x1x8_8_1x1_intrawave_v1,203.99,493.27,0.0
256,512,1536,7168,ck,18,0,28.2551,a8w8_blockscale_1x128x128_256x64x64x256_16x16_32x32_1x1_16x16x1_16x16x1_1x32x1x8_8_1x1_intrawave_v1,399.02,575.22,0.0
256,1024,1536,7168,ck,2,0,43.8957,a8w8_blockscale_1x128x128_256x64x128x128_16x16_32x32_1x2_8x32x1_8x32x1_1x32x1x8_8_1x1_intrawave_v3,513.69,489.7,0.0
256,1536,1536,7168,ck,0,0,55.3724,a8w8_blockscale_1x128x128_256x128x128x128_16x16_32x32_2x2_8x32x1_8x32x1_1x32x1x8_8_1x1_intrawave_v3,610.83,482.89,0.0
256,2048,1536,7168,ck,0,0,57.9353,a8w8_blockscale_1x128x128_256x128x128x128_16x16_32x32_2x2_8x32x1_8x32x1_1x32x1x8_8_1x1_intrawave_v3,778.41,552.02,0.0
256,4096,1536,7168,cktile,11,0,90.0488,a8w8_blockscale_cktile_192x256x128_4x2x1_16x16x128_intrawave_0x1x0_1,1001.62,588.05,0.0
256,8192,1536,7168,cktile,11,0,158.9815,a8w8_blockscale_cktile_192x256x128_4x2x1_16x16x128_intrawave_0x1x0_1,1134.65,596.9,0.0
256,16384,1536,7168,cktile,11,0,256.6513,a8w8_blockscale_cktile_192x256x128_4x2x1_16x16x128_intrawave_0x1x0_1,1405.71,696.6,0.0
256,20480,1536,7168,cktile,11,0,295.5655,a8w8_blockscale_cktile_192x256x128_4x2x1_16x16x128_intrawave_0x1x0_1,1525.79,746.79,0.0
256,128,4096,1280,ck,7,0,7.4194,a8w8_blockscale_1x128x128_256x16x128x256_16x16_16x16_1x2_16x16x1_16x16x1_1x16x1x16_8_1x2_intrawave_v1,180.9,870.06,0.0
256,16,4608,7168,ck,8,0,21.9393,a8w8_blockscale_1x128x128_256x16x64x256_16x16_16x16_1x1_16x16x1_16x16x1_1x16x1x16_4_1x1_intrawave_v1,48.18,1517.47,0.0
256,32,4608,7168,ck,8,0,22.0732,a8w8_blockscale_1x128x128_256x16x64x256_16x16_16x16_1x1_16x16x1_16x16x1_1x16x1x16_4_1x1_intrawave_v1,95.77,1520.14,0.0
256,64,4608,7168,ck,18,0,27.3651,a8w8_blockscale_1x128x128_256x64x64x256_16x16_32x32_1x1_16x16x1_16x16x1_1x32x1x8_8_1x1_intrawave_v1,154.5,1245.34,0.0
256,128,4608,7168,ck,18,0,27.8801,a8w8_blockscale_1x128x128_256x64x64x256_16x16_32x32_1x1_16x16x1_16x16x1_1x32x1x8_8_1x1_intrawave_v1,303.29,1259.94,0.0
256,256,4608,7168,ck,2,0,43.3671,a8w8_blockscale_1x128x128_256x64x128x128_16x16_32x32_1x2_8x32x1_8x32x1_1x32x1x8_8_1x1_intrawave_v3,389.96,858.36,0.0
256,512,4608,7168,ck,0,0,55.8745,a8w8_blockscale_1x128x128_256x128x128x128_16x16_32x32_2x2_8x32x1_8x32x1_1x32x1x8_8_1x1_intrawave_v3,605.34,741.28,0.0
256,1024,4608,7168,cktile,11,0,85.0782,a8w8_blockscale_cktile_192x256x128_4x2x1_16x16x128_intrawave_0x1x0_1,795.1,585.43,0.0
256,1536,4608,7168,cktile,11,0,90.2343,a8w8_blockscale_cktile_192x256x128_4x2x1_16x16x128_intrawave_0x1x0_1,1124.5,644.94,0.0
256,2048,4608,7168,cktile,11,0,97.1032,a8w8_blockscale_cktile_192x256x128_4x2x1_16x16x128_intrawave_0x1x0_1,1393.28,685.71,0.0
256,4096,4608,7168,cktile,11,0,186.6265,a8w8_blockscale_cktile_192x256x128_4x2x1_16x16x128_intrawave_0x1x0_1,1449.86,536.57,0.0
256,8192,4608,7168,cktile,11,0,328.9546,a8w8_blockscale_cktile_192x256x128_4x2x1_16x16x128_intrawave_0x1x0_1,1645.11,508.42,0.0
256,16384,4608,7168,cktile,11,0,611.6269,a8w8_blockscale_cktile_192x256x128_4x2x1_16x16x128_intrawave_0x1x0_1,1769.59,492.89,0.0
256,20480,4608,7168,cktile,11,0,772.5376,a8w8_blockscale_cktile_192x256x128_4x2x1_16x16x128_intrawave_0x1x0_1,1751.26,477.1,0.0
256,16,7168,256,ck,8,0,2.9877,a8w8_blockscale_1x128x128_256x16x64x256_16x16_16x16_1x1_16x16x1_16x16x1_1x16x1x16_4_1x1_intrawave_v1,19.65,692.33,0.0
256,16,7168,2304,ck,8,0,8.6,a8w8_blockscale_1x128x128_256x16x64x256_16x16_16x16_1x1_16x16x1_16x16x1_1x16x1x16_4_1x1_intrawave_v1,61.45,1951.32,0.0
256,32,7168,256,ck,8,0,3.3047,a8w8_blockscale_1x128x128_256x16x64x256_16x16_16x16_1x1_16x16x1_16x16x1_1x16x1x16_4_1x1_intrawave_v1,35.54,696.57,0.0
256,32,7168,2304,ck,8,0,8.8565,a8w8_blockscale_1x128x128_256x16x64x256_16x16_16x16_1x1_16x16x1_16x16x1_1x16x1x16_4_1x1_intrawave_v1,119.34,1924.86,0.0
256,64,7168,256,ck,13,0,3.8674,a8w8_blockscale_1x128x128_256x32x64x256_16x16_16x16_2x1_16x16x1_16x16x1_1x32x1x8_8_2x1_intrawave_v1,60.73,715.96,0.0
256,64,7168,2304,ck,18,0,11.0993,a8w8_blockscale_1x128x128_256x64x64x256_16x16_32x32_1x1_16x16x1_16x16x1_1x32x1x8_8_1x1_intrawave_v1,190.46,1583.89,0.0
256,128,7168,256,ck,8,0,4.6007,a8w8_blockscale_1x128x128_256x16x64x256_16x16_16x16_1x1_16x16x1_16x16x1_1x16x1x16_4_1x1_intrawave_v1,102.11,804.83,0.0
256,128,7168,2304,ck,18,0,11.6712,a8w8_blockscale_1x128x128_256x64x64x256_16x16_32x32_1x1_16x16x1_16x16x1_1x32x1x8_8_1x1_intrawave_v1,362.25,1597.52,0.0
256,256,7168,256,cktile,6,0,5.3481,a8w8_blockscale_cktile_32x128x128_1x4x1_16x16x64_intrawave_0x1x0_1,175.67,1041.6,0.0
256,256,7168,2304,ck,2,0,17.2075,a8w8_blockscale_1x128x128_256x64x128x128_16x16_32x32_1x2_8x32x1_8x32x1_1x32x1x8_8_1x1_intrawave_v3,491.4,1207.32,0.0
256,512,7168,256,cktile,10,0,7.6955,a8w8_blockscale_cktile_128x128x128_2x2x1_16x16x128_intrawave_0x1x0_2,244.17,1209.29,0.0
256,512,7168,2304,ck,0,0,22.3331,a8w8_blockscale_1x128x128_256x128x128x128_16x16_32x32_2x2_8x32x1_8x32x1_1x32x1x8_8_1x1_intrawave_v3,757.24,1120.97,0.0
256,1024,7168,256,cktile,10,0,11.2282,a8w8_blockscale_cktile_128x128x128_2x2x1_16x16x128_intrawave_0x1x0_2,334.7,1494.2,0.0
256,1024,7168,2304,ck,0,0,37.7104,a8w8_blockscale_1x128x128_256x128x128x128_16x16_32x32_2x2_8x32x1_8x32x1_1x32x1x8_8_1x1_intrawave_v3,896.91,889.79,0.0
256,1536,7168,256,cktile,10,0,13.3199,a8w8_blockscale_cktile_128x128x128_2x2x1_16x16x128_intrawave_0x1x0_2,423.21,1820.46,0.0
256,1536,7168,2304,cktile,11,0,43.5424,a8w8_blockscale_cktile_192x256x128_4x2x1_16x16x128_intrawave_0x1x0_1,1165.17,966.28,0.0
256,2048,7168,256,cktile,10,0,18.4391,a8w8_blockscale_cktile_128x128x128_2x2x1_16x16x128_intrawave_0x1x0_2,407.62,1720.23,0.0
256,2048,7168,2304,ck,0,0,74.1963,a8w8_blockscale_1x128x128_256x128x128x128_16x16_32x32_2x2_8x32x1_8x32x1_1x32x1x8_8_1x1_intrawave_v3,911.71,681.89,0.0
256,4096,7168,256,cktile,10,0,29.5555,a8w8_blockscale_cktile_128x128x128_2x2x1_16x16x128_intrawave_0x1x0_2,508.62,2084.34,0.0
256,4096,7168,2304,cktile,11,0,117.9301,a8w8_blockscale_cktile_192x256x128_4x2x1_16x16x128_intrawave_0x1x0_1,1147.22,717.99,0.0
256,8192,7168,256,cktile,10,0,54.7017,a8w8_blockscale_cktile_128x128x128_2x2x1_16x16x128_intrawave_0x1x0_2,549.61,2218.81,0.0
256,8192,7168,2304,cktile,11,0,199.6737,a8w8_blockscale_cktile_192x256x128_4x2x1_16x16x128_intrawave_0x1x0_1,1355.13,765.4,0.0
256,16384,7168,256,cktile,10,0,101.2722,a8w8_blockscale_cktile_128x128x128_2x2x1_16x16x128_intrawave_0x1x0_2,593.74,2378.84,0.0
256,16384,7168,2304,cktile,11,0,371.4356,a8w8_blockscale_cktile_192x256x128_4x2x1_16x16x128_intrawave_0x1x0_1,1456.96,778.45,0.0
256,20480,7168,256,cktile,10,0,125.313,a8w8_blockscale_cktile_128x128x128_2x2x1_16x16x128_intrawave_0x1x0_2,599.79,2399.43,0.0
256,20480,7168,2304,cktile,11,0,470.5953,a8w8_blockscale_cktile_192x256x128_4x2x1_16x16x128_intrawave_0x1x0_1,1437.45,759.26,0.0
