aiter/configs/a8w8_blockscale_tuned_gemm.csv
cu_num,M,N,K,libtype,kernelId,splitK,us,kernelName,tflops,bw,errRatio
256,8192,512,7168,ck,0,0,64.1614,a8w8_blockscale_1x128x128_256x128x128x128_16x16_32x32_2x2_8x32x1_8x32x1_1x32x1x8_8_1x1_intrawave_v3,937.16,1103.14,0.0
256,16384,512,7168,cktile,11,0,98.713,a8w8_blockscale_cktile_192x256x128_4x2x1_16x16x128_intrawave_0x1x0_1,1218.27,1396.85,0.0
256,20480,512,7168,cktile,11,0,106.7764,a8w8_blockscale_cktile_192x256x128_4x2x1_16x16x128_intrawave_0x1x0_1,1407.84,1605.62,0.0
256,128,1024,4096,ck,8,0,13.7599,a8w8_blockscale_1x128x128_256x16x64x256_16x16_16x16_1x1_16x16x1_16x16x1_1x16x1x16_4_1x1_intrawave_v1,78.03,361.97,0.0
256,128,4096,1280,ck,7,0,7.4194,a8w8_blockscale_1x128x128_256x16x128x256_16x16_16x16_1x2_16x16x1_16x16x1_1x16x1x16_8_1x2_intrawave_v1,180.9,870.06,0.0
256,1,256,4096,ck,8,0,11.6484,a8w8_blockscale_1x128x128_256x16x64x256_16x16_16x16_1x1_16x16x1_16x16x1_1x16x1x16_4_1x1_intrawave_v1,0.18,90.41,0.0
256,2,256,4096,ck,8,0,11.5873,a8w8_blockscale_1x128x128_256x16x64x256_16x16_16x16_1x1_16x16x1_16x16x1_1x16x1x16_4_1x1_intrawave_v1,0.36,91.29,0.0
256,3,256,4096,ck,8,0,11.6965,a8w8_blockscale_1x128x128_256x16x64x256_16x16_16x16_1x1_16x16x1_16x16x1_1x16x1x16_4_1x1_intrawave_v1,0.54,90.83,0.0
256,4,256,4096,ck,8,0,11.6725,a8w8_blockscale_1x128x128_256x16x64x256_16x16_16x16_1x1_16x16x1_16x16x1_1x16x1x16_4_1x1_intrawave_v1,0.72,91.41,0.0
256,5,256,4096,ck,8,0,11.6926,a8w8_blockscale_1x128x128_256x16x64x256_16x16_16x16_1x1_16x16x1_16x16x1_1x16x1x16_4_1x1_intrawave_v1,0.9,91.65,0.0
256,6,256,4096,ck,8,0,11.6725,a8w8_blockscale_1x128x128_256x16x64x256_16x16_16x16_1x1_16x16x1_16x16x1_1x16x1x16_4_1x1_intrawave_v1,1.08,92.2,0.0
256,7,256,4096,ck,8,0,11.6516,a8w8_blockscale_1x128x128_256x16x64x256_16x16_16x16_1x1_16x16x1_16x16x1_1x16x1x16_4_1x1_intrawave_v1,1.26,92.76,0.0
256,8,256,4096,ck,8,0,11.7159,a8w8_blockscale_1x128x128_256x16x64x256_16x16_16x16_1x1_16x16x1_16x16x1_1x16x1x16_4_1x1_intrawave_v1,1.43,92.65,0.0
256,9,256,4096,ck,8,0,11.6991,a8w8_blockscale_1x128x128_256x16x64x256_16x16_16x16_1x1_16x16x1_16x16x1_1x16x1x16_4_1x1_intrawave_v1,1.61,93.17,0.0
256,10,256,4096,ck,8,0,11.7725,a8w8_blockscale_1x128x128_256x16x64x256_16x16_16x16_1x1_16x16x1_16x16x1_1x16x1x16_4_1x1_intrawave_v1,1.78,92.98,0.0
256,11,256,4096,ck,8,0,11.76,a8w8_blockscale_1x128x128_256x16x64x256_16x16_16x16_1x1_16x16x1_16x16x1_1x16x1x16_4_1x1_intrawave_v1,1.96,93.47,0.0
256,12,256,4096,ck,8,0,11.7434,a8w8_blockscale_1x128x128_256x16x64x256_16x16_16x16_1x1_16x16x1_16x16x1_1x16x1x16_4_1x1_intrawave_v1,2.14,94.0,0.0
256,13,256,4096,ck,8,0,11.8432,a8w8_blockscale_1x128x128_256x16x64x256_16x16_16x16_1x1_16x16x1_16x16x1_1x16x1x16_4_1x1_intrawave_v1,2.3,93.6,0.0
256,14,256,4096,ck,8,0,11.7508,a8w8_blockscale_1x128x128_256x16x64x256_16x16_16x16_1x1_16x16x1_16x16x1_1x16x1x16_4_1x1_intrawave_v1,2.5,94.72,0.0
256,15,256,4096,ck,8,0,11.8463,a8w8_blockscale_1x128x128_256x16x64x256_16x16_16x16_1x1_16x16x1_16x16x1_1x16x1x16_4_1x1_intrawave_v1,2.66,94.35,0.0
256,16,256,4096,ck,8,0,11.2404,a8w8_blockscale_1x128x128_256x16x64x256_16x16_16x16_1x1_16x16x1_16x16x1_1x16x1x16_4_1x1_intrawave_v1,2.99,99.85,0.0
256,17,256,4096,ck,8,0,12.1599,a8w8_blockscale_1x128x128_256x16x64x256_16x16_16x16_1x1_16x16x1_16x16x1_1x16x1x16_4_1x1_intrawave_v1,2.93,92.67,0.0
256,18,256,4096,ck,8,0,12.1369,a8w8_blockscale_1x128x128_256x16x64x256_16x16_16x16_1x1_16x16x1_16x16x1_1x16x1x16_4_1x1_intrawave_v1,3.11,93.23,0.0
256,19,256,4096,ck,8,0,12.1636,a8w8_blockscale_1x128x128_256x16x64x256_16x16_16x16_1x1_16x16x1_16x16x1_1x16x1x16_4_1x1_intrawave_v1,3.28,93.4,0.0
256,20,256,4096,ck,8,0,12.1709,a8w8_blockscale_1x128x128_256x16x64x256_16x16_16x16_1x1_16x16x1_16x16x1_1x16x1x16_4_1x1_intrawave_v1,3.45,93.73,0.0
256,21,256,4096,ck,8,0,12.2024,a8w8_blockscale_1x128x128_256x16x64x256_16x16_16x16_1x1_16x16x1_16x16x1_1x16x1x16_4_1x1_intrawave_v1,3.61,93.86,0.0
256,22,256,4096,ck,8,0,12.1607,a8w8_blockscale_1x128x128_256x16x64x256_16x16_16x16_1x1_16x16x1_16x16x1_1x16x1x16_4_1x1_intrawave_v1,3.79,94.56,0.0
256,23,256,4096,ck,8,0,12.1771,a8w8_blockscale_1x128x128_256x16x64x256_16x16_16x16_1x1_16x16x1_16x16x1_1x16x1x16_4_1x1_intrawave_v1,3.96,94.81,0.0
256,24,256,4096,ck,8,0,12.1462,a8w8_blockscale_1x128x128_256x16x64x256_16x16_16x16_1x1_16x16x1_16x16x1_1x16x1x16_4_1x1_intrawave_v1,4.14,95.43,0.0
256,25,256,4096,ck,8,0,12.2004,a8w8_blockscale_1x128x128_256x16x64x256_16x16_16x16_1x1_16x16x1_16x16x1_1x16x1x16_4_1x1_intrawave_v1,4.3,95.39,0.0
256,26,256,4096,ck,8,0,12.1705,a8w8_blockscale_1x128x128_256x16x64x256_16x16_16x16_1x1_16x16x1_16x16x1_1x16x1x16_4_1x1_intrawave_v1,4.48,96.0,0.0
256,27,256,4096,ck,8,0,12.1983,a8w8_blockscale_1x128x128_256x16x64x256_16x16_16x16_1x1_16x16x1_16x16x1_1x16x1x16_4_1x1_intrawave_v1,4.64,96.16,0.0
256,28,256,4096,ck,8,0,12.2156,a8w8_blockscale_1x128x128_256x16x64x256_16x16_16x16_1x1_16x16x1_16x16x1_1x16x1x16_4_1x1_intrawave_v1,4.81,96.4,0.0
256,29,256,4096,ck,8,0,12.1865,a8w8_blockscale_1x128x128_256x16x64x256_16x16_16x16_1x1_16x16x1_16x16x1_1x16x1x16_4_1x1_intrawave_v1,4.99,97.01,0.0
256,30,256,4096,ck,8,0,12.1771,a8w8_blockscale_1x128x128_256x16x64x256_16x16_16x16_1x1_16x16x1_16x16x1_1x16x1x16_4_1x1_intrawave_v1,5.17,97.46,0.0
256,31,256,4096,ck,8,0,12.1863,a8w8_blockscale_1x128x128_256x16x64x256_16x16_16x16_1x1_16x16x1_16x16x1_1x16x1x16_4_1x1_intrawave_v1,5.33,97.77,0.0
256,32,256,4096,ck,8,0,11.6371,a8w8_blockscale_1x128x128_256x16x64x256_16x16_16x16_1x1_16x16x1_16x16x1_1x16x1x16_4_1x1_intrawave_v1,5.77,102.78,0.0
256,817,256,4096,ck,8,0,13.1975,a8w8_blockscale_1x128x128_256x16x64x256_16x16_16x16_1x1_16x16x1_16x16x1_1x16x1x16_4_1x1_intrawave_v1,129.83,364.71,0.0
256,820,256,4096,ck,8,0,13.2432,a8w8_blockscale_1x128x128_256x16x64x256_16x16_16x16_1x1_16x16x1_16x16x1_1x16x1x16_4_1x1_intrawave_v1,129.85,364.5,0.0
256,824,256,4096,ck,8,0,13.1876,a8w8_blockscale_1x128x128_256x16x64x256_16x16_16x16_1x1_16x16x1_16x16x1_1x16x1x16_4_1x1_intrawave_v1,131.04,367.43,0.0
256,834,256,4096,ck,8,0,13.205,a8w8_blockscale_1x128x128_256x16x64x256_16x16_16x16_1x1_16x16x1_16x16x1_1x16x1x16_4_1x1_intrawave_v1,132.45,370.44,0.0
256,845,256,4096,ck,8,0,13.3196,a8w8_blockscale_1x128x128_256x16x64x256_16x16_16x16_1x1_16x16x1_16x16x1_1x16x1x16_4_1x1_intrawave_v1,133.04,371.06,0.0
256,847,256,4096,ck,8,0,13.233,a8w8_blockscale_1x128x128_256x16x64x256_16x16_16x16_1x1_16x16x1_16x16x1_1x16x1x16_4_1x1_intrawave_v1,134.23,374.18,0.0
256,849,256,4096,ck,8,0,13.2907,a8w8_blockscale_1x128x128_256x16x64x256_16x16_16x16_1x1_16x16x1_16x16x1_1x16x1x16_4_1x1_intrawave_v1,133.96,373.25,0.0
256,856,256,4096,ck,8,0,13.3639,a8w8_blockscale_1x128x128_256x16x64x256_16x16_16x16_1x1_16x16x1_16x16x1_1x16x1x16_4_1x1_intrawave_v1,134.33,373.62,0.0
256,860,256,4096,ck,8,0,13.2663,a8w8_blockscale_1x128x128_256x16x64x256_16x16_16x16_1x1_16x16x1_16x16x1_1x16x1x16_4_1x1_intrawave_v1,135.95,377.76,0.0
256,866,256,4096,ck,8,0,13.3794,a8w8_blockscale_1x128x128_256x16x64x256_16x16_16x16_1x1_16x16x1_16x16x1_1x16x1x16_4_1x1_intrawave_v1,135.74,376.63,0.0
256,868,256,4096,ck,8,0,13.3721,a8w8_blockscale_1x128x128_256x16x64x256_16x16_16x16_1x1_16x16x1_16x16x1_1x16x1x16_4_1x1_intrawave_v1,136.13,377.53,0.0
256,876,256,4096,ck,8,0,13.3396,a8w8_blockscale_1x128x128_256x16x64x256_16x16_16x16_1x1_16x16x1_16x16x1_1x16x1x16_4_1x1_intrawave_v1,137.72,381.21,0.0
256,879,256,4096,ck,8,0,13.3843,a8w8_blockscale_1x128x128_256x16x64x256_16x16_16x16_1x1_16x16x1_16x16x1_1x16x1x16_4_1x1_intrawave_v1,137.73,380.97,0.0
256,883,256,4096,ck,8,0,13.3718,a8w8_blockscale_1x128x128_256x16x64x256_16x16_16x16_1x1_16x16x1_16x16x1_1x16x1x16_4_1x1_intrawave_v1,138.48,382.7,0.0
256,888,256,4096,ck,8,0,13.3352,a8w8_blockscale_1x128x128_256x16x64x256_16x16_16x16_1x1_16x16x1_16x16x1_1x16x1x16_4_1x1_intrawave_v1,139.65,385.48,0.0
256,895,256,4096,ck,8,0,13.3764,a8w8_blockscale_1x128x128_256x16x64x256_16x16_16x16_1x1_16x16x1_16x16x1_1x16x1x16_4_1x1_intrawave_v1,140.32,386.71,0.0
256,899,256,4096,ck,8,0,13.5224,a8w8_blockscale_1x128x128_256x16x64x256_16x16_16x16_1x1_16x16x1_16x16x1_1x16x1x16_4_1x1_intrawave_v1,139.42,383.89,0.0
256,928,256,4096,ck,8,0,13.191,a8w8_blockscale_1x128x128_256x16x64x256_16x16_16x16_1x1_16x16x1_16x16x1_1x16x1x16_4_1x1_intrawave_v1,147.54,403.67,0.0
256,934,256,4096,ck,8,0,13.5471,a8w8_blockscale_1x128x128_256x16x64x256_16x16_16x16_1x1_16x16x1_16x16x1_1x16x1x16_4_1x1_intrawave_v1,144.59,395.1,0.0
256,940,256,4096,ck,8,0,13.5208,a8w8_blockscale_1x128x128_256x16x64x256_16x16_16x16_1x1_16x16x1_16x16x1_1x16x1x16_4_1x1_intrawave_v1,145.8,397.91,0.0
256,944,256,4096,ck,8,0,13.2013,a8w8_blockscale_1x128x128_256x16x64x256_16x16_16x16_1x1_16x16x1_16x16x1_1x16x1x16_4_1x1_intrawave_v1,149.96,408.94,0.0
256,950,256,4096,ck,8,0,13.4747,a8w8_blockscale_1x128x128_256x16x64x256_16x16_16x16_1x1_16x16x1_16x16x1_1x16x1x16_4_1x1_intrawave_v1,147.85,402.69,0.0
256,966,256,4096,ck,8,0,13.598,a8w8_blockscale_1x128x128_256x16x64x256_16x16_16x16_1x1_16x16x1_16x16x1_1x16x1x16_4_1x1_intrawave_v1,148.98,404.46,0.0
256,994,256,4096,ck,8,0,13.5844,a8w8_blockscale_1x128x128_256x16x64x256_16x16_16x16_1x1_16x16x1_16x16x1_1x16x1x16_4_1x1_intrawave_v1,153.45,414.37,0.0
256,1015,256,4096,ck,8,0,13.562,a8w8_blockscale_1x128x128_256x16x64x256_16x16_16x16_1x1_16x16x1_16x16x1_1x16x1x16_4_1x1_intrawave_v1,156.95,422.19,0.0
256,1017,256,4096,ck,8,0,13.54,a8w8_blockscale_1x128x128_256x16x64x256_16x16_16x16_1x1_16x16x1_16x16x1_1x16x1x16_4_1x1_intrawave_v1,157.52,423.55,0.0
256,1019,256,4096,ck,8,0,13.4285,a8w8_blockscale_1x128x128_256x16x64x256_16x16_16x16_1x1_16x16x1_16x16x1_1x16x1x16_4_1x1_intrawave_v1,159.14,427.76,0.0
256,1024,256,4096,ck,8,0,12.9718,a8w8_blockscale_1x128x128_256x16x64x256_16x16_16x16_1x1_16x16x1_16x16x1_1x16x1x16_4_1x1_intrawave_v1,165.55,444.59,0.0
256,1198,256,4096,ck,7,0,16.4596,a8w8_blockscale_1x128x128_256x16x128x256_16x16_16x16_1x2_16x16x1_16x16x1_1x16x1x16_8_1x2_intrawave_v1,152.64,399.1,0.0
256,1517,256,4096,ck,7,0,16.5766,a8w8_blockscale_1x128x128_256x16x128x256_16x16_16x16_1x2_16x16x1_16x16x1_1x16x1x16_8_1x2_intrawave_v1,191.92,484.96,0.0
256,1697,256,4096,ck,7,0,16.6,a8w8_blockscale_1x128x128_256x16x128x256_16x16_16x16_1x2_16x16x1_16x16x1_1x16x1x16_8_1x2_intrawave_v1,214.39,534.24,0.0
256,1790,256,4096,ck,7,0,16.7699,a8w8_blockscale_1x128x128_256x16x128x256_16x16_16x16_1x2_16x16x1_16x16x1_1x16x1x16_8_1x2_intrawave_v1,223.85,554.38,0.0
256,2029,256,4096,ck,7,0,16.8839,a8w8_blockscale_1x128x128_256x16x128x256_16x16_16x16_1x2_16x16x1_16x16x1_1x16x1x16_8_1x2_intrawave_v1,252.02,615.87,0.0
256,2046,256,4096,ck,7,0,16.7331,a8w8_blockscale_1x128x128_256x16x128x256_16x16_16x16_1x2_16x16x1_16x16x1_1x16x1x16_8_1x2_intrawave_v1,256.42,626.1,0.0
256,2285,256,4096,ck,18,0,20.3799,a8w8_blockscale_1x128x128_256x64x64x256_16x16_32x32_1x1_16x16x1_16x16x1_1x32x1x8_8_1x1_intrawave_v1,235.13,568.1,0.0
256,2558,256,4096,ck,18,0,20.336,a8w8_blockscale_1x128x128_256x64x64x256_16x16_32x32_1x1_16x16x1_16x16x1_1x32x1x8_8_1x1_intrawave_v1,263.79,631.19,0.0
256,3051,256,4096,ck,18,0,20.5039,a8w8_blockscale_1x128x128_256x64x64x256_16x16_32x32_1x1_16x16x1_16x16x1_1x32x1x8_8_1x1_intrawave_v1,312.06,736.82,0.0
256,12828,256,4096,ck,0,0,36.3451,a8w8_blockscale_1x128x128_256x128x128x128_16x16_32x32_2x2_8x32x1_8x32x1_1x32x1x8_8_1x1_intrawave_v3,740.19,1655.24,0.0
256,16071,256,4096,ck,0,0,37.9108,a8w8_blockscale_1x128x128_256x128x128x128_16x16_32x32_2x2_8x32x1_8x32x1_1x32x1x8_8_1x1_intrawave_v3,889.02,1981.06,0.0
256,1,1024,4096,ck,8,0,13.1154,a8w8_blockscale_1x128x128_256x16x64x256_16x16_16x16_1x1_16x16x1_16x16x1_1x16x1x16_4_1x1_intrawave_v1,0.64,320.27,0.0
256,2,1024,4096,ck,8,0,13.381,a8w8_blockscale_1x128x128_256x16x64x256_16x16_16x16_1x1_16x16x1_16x16x1_1x16x1x16_4_1x1_intrawave_v1,1.25,314.37,0.0
256,3,1024,4096,ck,8,0,13.3685,a8w8_blockscale_1x128x128_256x16x64x256_16x16_16x16_1x1_16x16x1_16x16x1_1x16x1x16_4_1x1_intrawave_v1,1.88,315.12,0.0
256,4,1024,4096,ck,8,0,13.2379,a8w8_blockscale_1x128x128_256x16x64x256_16x16_16x16_1x1_16x16x1_16x16x1_1x16x1x16_4_1x1_intrawave_v1,2.53,318.7,0.0
256,5,1024,4096,ck,8,0,13.3855,a8w8_blockscale_1x128x128_256x16x64x256_16x16_16x16_1x1_16x16x1_16x16x1_1x16x1x16_4_1x1_intrawave_v1,3.13,315.64,0.0
256,6,1024,4096,ck,8,0,13.32,a8w8_blockscale_1x128x128_256x16x64x256_16x16_16x16_1x1_16x16x1_16x16x1_1x16x1x16_4_1x1_intrawave_v1,3.78,317.66,0.0
256,7,1024,4096,ck,8,0,13.3068,a8w8_blockscale_1x128x128_256x16x64x256_16x16_16x16_1x1_16x16x1_16x16x1_1x16x1x16_4_1x1_intrawave_v1,4.41,318.43,0.0
256,8,1024,4096,ck,8,0,13.4171,a8w8_blockscale_1x128x128_256x16x64x256_16x16_16x16_1x1_16x16x1_16x16x1_1x16x1x16_4_1x1_intrawave_v1,5.0,316.27,0.0
256,9,1024,4096,ck,8,0,13.5368,a8w8_blockscale_1x128x128_256x16x64x256_16x16_16x16_1x1_16x16x1_16x16x1_1x16x1x16_4_1x1_intrawave_v1,5.58,313.93,0.0
256,10,1024,4096,ck,8,0,13.2507,a8w8_blockscale_1x128x128_256x16x64x256_16x16_16x16_1x1_16x16x1_16x16x1_1x16x1x16_4_1x1_intrawave_v1,6.33,321.17,0.0
256,11,1024,4096,ck,8,0,13.4837,a8w8_blockscale_1x128x128_256x16x64x256_16x16_16x16_1x1_16x16x1_16x16x1_1x16x1x16_4_1x1_intrawave_v1,6.84,316.08,0.0
256,12,1024,4096,ck,8,0,13.6327,a8w8_blockscale_1x128x128_256x16x64x256_16x16_16x16_1x1_16x16x1_16x16x1_1x16x1x16_4_1x1_intrawave_v1,7.38,313.07,0.0
256,13,1024,4096,ck,8,0,13.4404,a8w8_blockscale_1x128x128_256x16x64x256_16x16_16x16_1x1_16x16x1_16x16x1_1x16x1x16_4_1x1_intrawave_v1,8.11,318.01,0.0
256,14,1024,4096,ck,8,0,13.5023,a8w8_blockscale_1x128x128_256x16x64x256_16x16_16x16_1x1_16x16x1_16x16x1_1x16x1x16_4_1x1_intrawave_v1,8.7,317.01,0.0
256,15,1024,4096,ck,8,0,13.6496,a8w8_blockscale_1x128x128_256x16x64x256_16x16_16x16_1x1_16x16x1_16x16x1_1x16x1x16_4_1x1_intrawave_v1,9.22,314.04,0.0
256,16,1024,4096,ck,8,0,12.8563,a8w8_blockscale_1x128x128_256x16x64x256_16x16_16x16_1x1_16x16x1_16x16x1_1x16x1x16_4_1x1_intrawave_v1,10.44,333.89,0.0
256,17,1024,4096,ck,8,0,13.2306,a8w8_blockscale_1x128x128_256x16x64x256_16x16_16x16_1x1_16x16x1_16x16x1_1x16x1x16_4_1x1_intrawave_v1,10.78,324.91,0.0
256,18,1024,4096,ck,8,0,13.5734,a8w8_blockscale_1x128x128_256x16x64x256_16x16_16x16_1x1_16x16x1_16x16x1_1x16x1x16_4_1x1_intrawave_v1,11.12,317.16,0.0
256,19,1024,4096,ck,8,0,13.3131,a8w8_blockscale_1x128x128_256x16x64x256_16x16_16x16_1x1_16x16x1_16x16x1_1x16x1x16_4_1x1_intrawave_v1,11.97,323.82,0.0
256,20,1024,4096,ck,8,0,13.5269,a8w8_blockscale_1x128x128_256x16x64x256_16x16_16x16_1x1_16x16x1_16x16x1_1x16x1x16_4_1x1_intrawave_v1,12.4,319.16,0.0
256,21,1024,4096,ck,8,0,13.5148,a8w8_blockscale_1x128x128_256x16x64x256_16x16_16x16_1x1_16x16x1_16x16x1_1x16x1x16_4_1x1_intrawave_v1,13.03,319.9,0.0
256,22,1024,4096,ck,8,0,13.5952,a8w8_blockscale_1x128x128_256x16x64x256_16x16_16x16_1x1_16x16x1_16x16x1_1x16x1x16_4_1x1_intrawave_v1,13.57,318.46,0.0
256,23,1024,4096,ck,8,0,13.6672,a8w8_blockscale_1x128x128_256x16x64x256_16x16_16x16_1x1_16x16x1_16x16x1_1x16x1x16_4_1x1_intrawave_v1,14.12,317.23,0.0
256,24,1024,4096,ck,8,0,13.6326,a8w8_blockscale_1x128x128_256x16x64x256_16x16_16x16_1x1_16x16x1_16x16x1_1x16x1x16_4_1x1_intrawave_v1,14.77,318.48,0.0
256,25,1024,4096,ck,8,0,13.7406,a8w8_blockscale_1x128x128_256x16x64x256_16x16_16x16_1x1_16x16x1_16x16x1_1x16x1x16_4_1x1_intrawave_v1,15.26,316.43,0.0
256,26,1024,4096,ck,8,0,13.5588,a8w8_blockscale_1x128x128_256x16x64x256_16x16_16x16_1x1_16x16x1_16x16x1_1x16x1x16_4_1x1_intrawave_v1,16.09,321.12,0.0
256,27,1024,4096,ck,8,0,13.2086,a8w8_blockscale_1x128x128_256x16x64x256_16x16_16x16_1x1_16x16x1_16x16x1_1x16x1x16_4_1x1_intrawave_v1,17.15,330.1,0.0
256,28,1024,4096,ck,8,0,13.7531,a8w8_blockscale_1x128x128_256x16x64x256_16x16_16x16_1x1_16x16x1_16x16x1_1x16x1x16_4_1x1_intrawave_v1,17.08,317.48,0.0
256,29,1024,4096,ck,8,0,13.5532,a8w8_blockscale_1x128x128_256x16x64x256_16x16_16x16_1x1_16x16x1_16x16x1_1x16x1x16_4_1x1_intrawave_v1,17.95,322.62,0.0
256,30,1024,4096,ck,8,0,13.6764,a8w8_blockscale_1x128x128_256x16x64x256_16x16_16x16_1x1_16x16x1_16x16x1_1x16x1x16_4_1x1_intrawave_v1,18.4,320.16,0.0
256,31,1024,4096,ck,8,0,13.7761,a8w8_blockscale_1x128x128_256x16x64x256_16x16_16x16_1x1_16x16x1_16x16x1_1x16x1x16_4_1x1_intrawave_v1,18.88,318.29,0.0
256,32,1024,4096,ck,8,0,13.0392,a8w8_blockscale_1x128x128_256x16x64x256_16x16_16x16_1x1_16x16x1_16x16x1_1x16x1x16_4_1x1_intrawave_v1,20.59,336.75,0.0
256,817,1024,4096,ck,18,0,20.5847,a8w8_blockscale_1x128x128_256x64x64x256_16x16_32x32_1x1_16x16x1_16x16x1_1x32x1x8_8_1x1_intrawave_v1,332.94,447.61,0.0
256,820,1024,4096,ck,18,0,20.6429,a8w8_blockscale_1x128x128_256x64x64x256_16x16_32x32_1x1_16x16x1_16x16x1_1x32x1x8_8_1x1_intrawave_v1,333.22,447.24,0.0
256,824,1024,4096,ck,18,0,20.5634,a8w8_blockscale_1x128x128_256x64x64x256_16x16_32x32_1x1_16x16x1_16x16x1_1x32x1x8_8_1x1_intrawave_v1,336.14,450.17,0.0
256,834,1024,4096,ck,18,0,20.5851,a8w8_blockscale_1x128x128_256x64x64x256_16x16_32x32_1x1_16x16x1_16x16x1_1x32x1x8_8_1x1_intrawave_v1,339.86,452.68,0.0
256,845,1024,4096,ck,18,0,20.6611,a8w8_blockscale_1x128x128_256x64x64x256_16x16_32x32_1x1_16x16x1_16x16x1_1x32x1x8_8_1x1_intrawave_v1,343.08,454.28,0.0
256,847,1024,4096,ck,18,0,20.6434,a8w8_blockscale_1x128x128_256x64x64x256_16x16_32x32_1x1_16x16x1_16x16x1_1x32x1x8_8_1x1_intrawave_v1,344.19,455.27,0.0
256,849,1024,4096,ck,18,0,20.8001,a8w8_blockscale_1x128x128_256x64x64x256_16x16_32x32_1x1_16x16x1_16x16x1_1x32x1x8_8_1x1_intrawave_v1,342.4,452.43,0.0
256,856,1024,4096,ck,18,0,20.6949,a8w8_blockscale_1x128x128_256x64x64x256_16x16_32x32_1x1_16x16x1_16x16x1_1x32x1x8_8_1x1_intrawave_v1,346.98,456.81,0.0
256,860,1024,4096,ck,18,0,20.6952,a8w8_blockscale_1x128x128_256x64x64x256_16x16_32x32_1x1_16x16x1_16x16x1_1x32x1x8_8_1x1_intrawave_v1,348.59,457.99,0.0
256,866,1024,4096,ck,18,0,20.6166,a8w8_blockscale_1x128x128_256x64x64x256_16x16_32x32_1x1_16x16x1_16x16x1_1x32x1x8_8_1x1_intrawave_v1,352.36,461.52,0.0
256,868,1024,4096,ck,12,0,20.945,a8w8_blockscale_1x128x128_256x32x128x256_16x16_32x32_1x1_16x16x1_16x16x1_1x32x1x8_8_1x1_intrawave_v1,347.64,454.87,0.0
256,876,1024,4096,ck,18,0,20.6839,a8w8_blockscale_1x128x128_256x64x64x256_16x16_32x32_1x1_16x16x1_16x16x1_1x32x1x8_8_1x1_intrawave_v1,355.27,462.99,0.0
256,879,1024,4096,ck,18,0,20.9043,a8w8_blockscale_1x128x128_256x64x64x256_16x16_32x32_1x1_16x16x1_16x16x1_1x32x1x8_8_1x1_intrawave_v1,352.73,458.99,0.0
256,883,1024,4096,ck,18,0,20.7254,a8w8_blockscale_1x128x128_256x64x64x256_16x16_32x32_1x1_16x16x1_16x16x1_1x32x1x8_8_1x1_intrawave_v1,357.39,464.14,0.0
256,888,1024,4096,ck,18,0,20.6046,a8w8_blockscale_1x128x128_256x64x64x256_16x16_32x32_1x1_16x16x1_16x16x1_1x32x1x8_8_1x1_intrawave_v1,361.53,468.35,0.0
256,895,1024,4096,ck,18,0,20.6972,a8w8_blockscale_1x128x128_256x64x64x256_16x16_32x32_1x1_16x16x1_16x16x1_1x32x1x8_8_1x1_intrawave_v1,362.74,468.33,0.0
256,899,1024,4096,ck,18,0,20.8417,a8w8_blockscale_1x128x128_256x64x64x256_16x16_32x32_1x1_16x16x1_16x16x1_1x32x1x8_8_1x1_intrawave_v1,361.84,466.27,0.0
256,928,1024,4096,ck,12,0,19.2435,a8w8_blockscale_1x128x128_256x32x128x256_16x16_32x32_1x1_16x16x1_16x16x1_1x32x1x8_8_1x1_intrawave_v1,404.53,514.25,0.0
256,934,1024,4096,ck,18,0,20.8674,a8w8_blockscale_1x128x128_256x64x64x256_16x16_32x32_1x1_16x16x1_16x16x1_1x32x1x8_8_1x1_intrawave_v1,375.46,476.0,0.0
256,940,1024,4096,ck,12,0,21.0976,a8w8_blockscale_1x128x128_256x32x128x256_16x16_32x32_1x1_16x16x1_16x16x1_1x32x1x8_8_1x1_intrawave_v1,373.75,472.55,0.0
256,944,1024,4096,ck,18,0,20.9155,a8w8_blockscale_1x128x128_256x64x64x256_16x16_32x32_1x1_16x16x1_16x16x1_1x32x1x8_8_1x1_intrawave_v1,378.61,477.84,0.0
256,950,1024,4096,ck,18,0,20.7541,a8w8_blockscale_1x128x128_256x64x64x256_16x16_32x32_1x1_16x16x1_16x16x1_1x32x1x8_8_1x1_intrawave_v1,383.98,483.33,0.0
256,966,1024,4096,ck,18,0,20.8813,a8w8_blockscale_1x128x128_256x64x64x256_16x16_32x32_1x1_16x16x1_16x16x1_1x32x1x8_8_1x1_intrawave_v1,388.07,485.09,0.0
256,994,1024,4096,ck,18,0,20.9797,a8w8_blockscale_1x128x128_256x64x64x256_16x16_32x32_1x1_16x16x1_16x16x1_1x32x1x8_8_1x1_intrawave_v1,397.44,491.02,0.0
256,1015,1024,4096,ck,18,0,20.8869,a8w8_blockscale_1x128x128_256x64x64x256_16x16_32x32_1x1_16x16x1_16x16x1_1x32x1x8_8_1x1_intrawave_v1,407.64,499.38,0.0
256,1017,1024,4096,ck,18,0,20.9567,a8w8_blockscale_1x128x128_256x64x64x256_16x16_32x32_1x1_16x16x1_16x16x1_1x32x1x8_8_1x1_intrawave_v1,407.09,498.3,0.0
256,1019,1024,4096,ck,18,0,20.8854,a8w8_blockscale_1x128x128_256x64x64x256_16x16_32x32_1x1_16x16x1_16x16x1_1x32x1x8_8_1x1_intrawave_v1,409.28,500.59,0.0
256,1024,1024,4096,ck,18,0,16.8585,a8w8_blockscale_1x128x128_256x64x64x256_16x16_32x32_1x1_16x16x1_16x16x1_1x32x1x8_8_1x1_intrawave_v1,509.53,621.99,0.0
256,1198,1024,4096,ck,2,0,26.1001,a8w8_blockscale_1x128x128_256x64x128x128_16x16_32x32_1x2_8x32x1_8x32x1_1x32x1x8_8_1x1_intrawave_v3,385.04,442.71,0.0
256,1517,1024,4096,ck,2,0,26.1347,a8w8_blockscale_1x128x128_256x64x128x128_16x16_32x32_1x2_8x32x1_8x32x1_1x32x1x8_8_1x1_intrawave_v3,486.92,517.12,0.0
256,1697,1024,4096,ck,2,0,26.2637,a8w8_blockscale_1x128x128_256x64x128x128_16x16_32x32_1x2_8x32x1_8x32x1_1x32x1x8_8_1x1_intrawave_v3,542.02,556.69,0.0
256,1790,1024,4096,ck,2,0,26.31,a8w8_blockscale_1x128x128_256x64x128x128_16x16_32x32_1x2_8x32x1_8x32x1_1x32x1x8_8_1x1_intrawave_v3,570.72,577.43,0.0
256,2029,1024,4096,ck,2,0,26.389,a8w8_blockscale_1x128x128_256x64x128x128_16x16_32x32_1x2_8x32x1_8x32x1_1x32x1x8_8_1x1_intrawave_v3,644.98,631.34,0.0
256,2046,1024,4096,ck,2,0,26.6977,a8w8_blockscale_1x128x128_256x64x128x128_16x16_32x32_1x2_8x32x1_8x32x1_1x32x1x8_8_1x1_intrawave_v3,642.87,627.95,0.0
256,2285,1024,4096,ck,2,0,32.7969,a8w8_blockscale_1x128x128_256x64x128x128_16x16_32x32_1x2_8x32x1_8x32x1_1x32x1x8_8_1x1_intrawave_v3,584.44,555.95,0.0
256,2558,1024,4096,ck,0,0,33.354,a8w8_blockscale_1x128x128_256x128x128x128_16x16_32x32_2x2_8x32x1_8x32x1_1x32x1x8_8_1x1_intrawave_v3,643.34,596.95,0.0
256,3051,1024,4096,ck,0,0,34.0504,a8w8_blockscale_1x128x128_256x128x128x128_16x16_32x32_2x2_8x32x1_8x32x1_1x32x1x8_8_1x1_intrawave_v3,751.64,673.7,0.0
256,12828,1024,4096,ck,0,0,102.7388,a8w8_blockscale_1x128x128_256x128x128x128_16x16_32x32_2x2_8x32x1_8x32x1_1x32x1x8_8_1x1_intrawave_v3,1047.4,807.97,0.0
256,16071,1024,4096,ck,0,0,114.1491,a8w8_blockscale_1x128x128_256x128x128x128_16x16_32x32_2x2_8x32x1_8x32x1_1x32x1x8_8_1x1_intrawave_v3,1181.03,901.76,0.0
256,1,1536,4096,ck,8,0,13.5272,a8w8_blockscale_1x128x128_256x16x64x256_16x16_16x16_1x1_16x16x1_16x16x1_1x16x1x16_4_1x1_intrawave_v1,0.93,465.63,0.0
256,2,1536,4096,ck,8,0,13.7464,a8w8_blockscale_1x128x128_256x16x64x256_16x16_16x16_1x1_16x16x1_16x16x1_1x16x1x16_4_1x1_intrawave_v1,1.83,458.72,0.0
256,3,1536,4096,ck,8,0,13.8664,a8w8_blockscale_1x128x128_256x16x64x256_16x16_16x16_1x1_16x16x1_16x16x1_1x16x1x16_4_1x1_intrawave_v1,2.72,455.27,0.0
256,4,1536,4096,ck,8,0,13.3511,a8w8_blockscale_1x128x128_256x16x64x256_16x16_16x16_1x1_16x16x1_16x16x1_1x16x1x16_4_1x1_intrawave_v1,3.77,473.38,0.0
256,5,1536,4096,ck,8,0,13.8088,a8w8_blockscale_1x128x128_256x16x64x256_16x16_16x16_1x1_16x16x1_16x16x1_1x16x1x16_4_1x1_intrawave_v1,4.56,458.21,0.0
256,6,1536,4096,ck,8,0,13.6493,a8w8_blockscale_1x128x128_256x16x64x256_16x16_16x16_1x1_16x16x1_16x16x1_1x16x1x16_4_1x1_intrawave_v1,5.53,464.09,0.0
256,7,1536,4096,ck,8,0,13.5074,a8w8_blockscale_1x128x128_256x16x64x256_16x16_16x16_1x1_16x16x1_16x16x1_1x16x1x16_4_1x1_intrawave_v1,6.52,469.49,0.0
256,8,1536,4096,ck,8,0,13.7531,a8w8_blockscale_1x128x128_256x16x64x256_16x16_16x16_1x1_16x16x1_16x16x1_1x16x1x16_4_1x1_intrawave_v1,7.32,461.63,0.0
256,9,1536,4096,ck,8,0,13.7472,a8w8_blockscale_1x128x128_256x16x64x256_16x16_16x16_1x1_16x16x1_16x16x1_1x16x1x16_4_1x1_intrawave_v1,8.24,462.35,0.0
256,10,1536,4096,ck,8,0,13.7014,a8w8_blockscale_1x128x128_256x16x64x256_16x16_16x16_1x1_16x16x1_16x16x1_1x16x1x16_4_1x1_intrawave_v1,9.18,464.42,0.0
256,11,1536,4096,ck,8,0,13.9248,a8w8_blockscale_1x128x128_256x16x64x256_16x16_16x16_1x1_16x16x1_16x16x1_1x16x1x16_4_1x1_intrawave_v1,9.94,457.48,0.0
256,12,1536,4096,ck,8,0,13.7484,a8w8_blockscale_1x128x128_256x16x64x256_16x16_16x16_1x1_16x16x1_16x16x1_1x16x1x16_4_1x1_intrawave_v1,10.98,463.87,0.0
256,13,1536,4096,ck,8,0,13.8228,a8w8_blockscale_1x128x128_256x16x64x256_16x16_16x16_1x1_16x16x1_16x16x1_1x16x1x16_4_1x1_intrawave_v1,11.83,461.89,0.0
256,14,1536,4096,ck,8,0,13.7446,a8w8_blockscale_1x128x128_256x16x64x256_16x16_16x16_1x1_16x16x1_16x16x1_1x16x1x16_4_1x1_intrawave_v1,12.82,465.04,0.0
256,15,1536,4096,ck,8,0,13.6646,a8w8_blockscale_1x128x128_256x16x64x256_16x16_16x16_1x1_16x16x1_16x16x1_1x16x1x16_4_1x1_intrawave_v1,13.81,468.29,0.0
256,16,1536,4096,ck,8,0,13.4016,a8w8_blockscale_1x128x128_256x16x64x256_16x16_16x16_1x1_16x16x1_16x16x1_1x16x1x16_4_1x1_intrawave_v1,15.02,478.01,0.0
256,17,1536,4096,ck,8,0,13.9749,a8w8_blockscale_1x128x128_256x16x64x256_16x16_16x16_1x1_16x16x1_16x16x1_1x16x1x16_4_1x1_intrawave_v1,15.31,458.92,0.0
256,18,1536,4096,ck,8,0,13.9044,a8w8_blockscale_1x128x128_256x16x64x256_16x16_16x16_1x1_16x16x1_16x16x1_1x16x1x16_4_1x1_intrawave_v1,16.29,461.76,0.0
256,19,1536,4096,ck,8,0,13.8532,a8w8_blockscale_1x128x128_256x16x64x256_16x16_16x16_1x1_16x16x1_16x16x1_1x16x1x16_4_1x1_intrawave_v1,17.26,463.98,0.0
256,20,1536,4096,ck,8,0,13.922,a8w8_blockscale_1x128x128_256x16x64x256_16x16_16x16_1x1_16x16x1_16x16x1_1x16x1x16_4_1x1_intrawave_v1,18.08,462.2,0.0
256,21,1536,4096,ck,8,0,13.8486,a8w8_blockscale_1x128x128_256x16x64x256_16x16_16x16_1x1_16x16x1_16x16x1_1x16x1x16_4_1x1_intrawave_v1,19.08,465.17,0.0
256,22,1536,4096,ck,8,0,14.0224,a8w8_blockscale_1x128x128_256x16x64x256_16x16_16x16_1x1_16x16x1_16x16x1_1x16x1x16_4_1x1_intrawave_v1,19.74,459.92,0.0
256,23,1536,4096,ck,8,0,13.9532,a8w8_blockscale_1x128x128_256x16x64x256_16x16_16x16_1x1_16x16x1_16x16x1_1x16x1x16_4_1x1_intrawave_v1,20.74,462.71,0.0
256,24,1536,4096,ck,8,0,13.8226,a8w8_blockscale_1x128x128_256x16x64x256_16x16_16x16_1x1_16x16x1_16x16x1_1x16x1x16_4_1x1_intrawave_v1,21.85,467.6,0.0
256,25,1536,4096,ck,8,0,14.0452,a8w8_blockscale_1x128x128_256x16x64x256_16x16_16x16_1x1_16x16x1_16x16x1_1x16x1x16_4_1x1_intrawave_v1,22.4,460.7,0.0
256,26,1536,4096,ck,8,0,14.0368,a8w8_blockscale_1x128x128_256x16x64x256_16x16_16x16_1x1_16x16x1_16x16x1_1x16x1x16_4_1x1_intrawave_v1,23.31,461.49,0.0
256,27,1536,4096,ck,8,0,13.9519,a8w8_blockscale_1x128x128_256x16x64x256_16x16_16x16_1x1_16x16x1_16x16x1_1x16x1x16_4_1x1_intrawave_v1,24.35,464.81,0.0
256,28,1536,4096,ck,8,0,13.8832,a8w8_blockscale_1x128x128_256x16x64x256_16x16_16x16_1x1_16x16x1_16x16x1_1x16x1x16_4_1x1_intrawave_v1,25.38,467.63,0.0
256,29,1536,4096,ck,8,0,13.9148,a8w8_blockscale_1x128x128_256x16x64x256_16x16_16x16_1x1_16x16x1_16x16x1_1x16x1x16_4_1x1_intrawave_v1,26.22,467.08,0.0
256,30,1536,4096,ck,8,0,13.7864,a8w8_blockscale_1x128x128_256x16x64x256_16x16_16x16_1x1_16x16x1_16x16x1_1x16x1x16_4_1x1_intrawave_v1,27.38,471.95,0.0
256,31,1536,4096,ck,8,0,13.8344,a8w8_blockscale_1x128x128_256x16x64x256_16x16_16x16_1x1_16x16x1_16x16x1_1x16x1x16_4_1x1_intrawave_v1,28.2,470.83,0.0
256,32,1536,4096,ck,8,0,13.4644,a8w8_blockscale_1x128x128_256x16x64x256_16x16_16x16_1x1_16x16x1_16x16x1_1x16x1x16_4_1x1_intrawave_v1,29.91,484.3,0.0
256,817,1536,4096,ck,2,0,25.9869,a8w8_blockscale_1x128x128_256x64x128x128_16x16_32x32_1x2_8x32x1_8x32x1_1x32x1x8_8_1x1_intrawave_v3,395.59,467.46,0.0
256,820,1536,4096,ck,2,0,25.6461,a8w8_blockscale_1x128x128_256x64x128x128_16x16_32x32_1x2_8x32x1_8x32x1_1x32x1x8_8_1x1_intrawave_v3,402.32,474.51,0.0
256,824,1536,4096,ck,2,0,25.7912,a8w8_blockscale_1x128x128_256x64x128x128_16x16_32x32_1x2_8x32x1_8x32x1_1x32x1x8_8_1x1_intrawave_v3,402.01,472.95,0.0
256,834,1536,4096,ck,2,0,25.5453,a8w8_blockscale_1x128x128_256x64x128x128_16x16_32x32_1x2_8x32x1_8x32x1_1x32x1x8_8_1x1_intrawave_v3,410.81,480.31,0.0
256,845,1536,4096,ck,2,0,26.1442,a8w8_blockscale_1x128x128_256x64x128x128_16x16_32x32_1x2_8x32x1_8x32x1_1x32x1x8_8_1x1_intrawave_v3,406.69,472.32,0.0
256,847,1536,4096,ck,2,0,25.9222,a8w8_blockscale_1x128x128_256x64x128x128_16x16_32x32_1x2_8x32x1_8x32x1_1x32x1x8_8_1x1_intrawave_v3,411.14,476.92,0.0
256,849,1536,4096,ck,2,0,25.9012,a8w8_blockscale_1x128x128_256x64x128x128_16x16_32x32_1x2_8x32x1_8x32x1_1x32x1x8_8_1x1_intrawave_v3,412.45,477.86,0.0
256,856,1536,4096,ck,2,0,25.5541,a8w8_blockscale_1x128x128_256x64x128x128_16x16_32x32_1x2_8x32x1_8x32x1_1x32x1x8_8_1x1_intrawave_v3,421.5,486.31,0.0
256,860,1536,4096,ck,2,0,26.0144,a8w8_blockscale_1x128x128_256x64x128x128_16x16_32x32_1x2_8x32x1_8x32x1_1x32x1x8_8_1x1_intrawave_v3,415.97,478.81,0.0
256,866,1536,4096,ck,2,0,25.8462,a8w8_blockscale_1x128x128_256x64x128x128_16x16_32x32_1x2_8x32x1_8x32x1_1x32x1x8_8_1x1_intrawave_v3,421.6,483.59,0.0
256,868,1536,4096,ck,2,0,25.8208,a8w8_blockscale_1x128x128_256x64x128x128_16x16_32x32_1x2_8x32x1_8x32x1_1x32x1x8_8_1x1_intrawave_v3,422.99,484.62,0.0
256,876,1536,4096,ck,2,0,25.9976,a8w8_blockscale_1x128x128_256x64x128x128_16x16_32x32_1x2_8x32x1_8x32x1_1x32x1x8_8_1x1_intrawave_v3,423.99,483.53,0.0
256,879,1536,4096,ck,2,0,25.775,a8w8_blockscale_1x128x128_256x64x128x128_16x16_32x32_1x2_8x32x1_8x32x1_1x32x1x8_8_1x1_intrawave_v3,429.11,488.54,0.0
256,883,1536,4096,ck,2,0,26.0607,a8w8_blockscale_1x128x128_256x64x128x128_16x16_32x32_1x2_8x32x1_8x32x1_1x32x1x8_8_1x1_intrawave_v3,426.34,484.28,0.0
256,888,1536,4096,ck,2,0,26.0105,a8w8_blockscale_1x128x128_256x64x128x128_16x16_32x32_1x2_8x32x1_8x32x1_1x32x1x8_8_1x1_intrawave_v3,429.58,486.6,0.0
256,895,1536,4096,ck,2,0,26.0797,a8w8_blockscale_1x128x128_256x64x128x128_16x16_32x32_1x2_8x32x1_8x32x1_1x32x1x8_8_1x1_intrawave_v3,431.82,487.23,0.0
256,899,1536,4096,ck,2,0,25.8357,a8w8_blockscale_1x128x128_256x64x128x128_16x16_32x32_1x2_8x32x1_8x32x1_1x32x1x8_8_1x1_intrawave_v3,437.85,492.94,0.0
256,928,1536,4096,ck,2,0,25.717,a8w8_blockscale_1x128x128_256x64x128x128_16x16_32x32_1x2_8x32x1_8x32x1_1x32x1x8_8_1x1_intrawave_v3,454.06,503.3,0.0
256,934,1536,4096,ck,2,0,26.2347,a8w8_blockscale_1x128x128_256x64x128x128_16x16_32x32_1x2_8x32x1_8x32x1_1x32x1x8_8_1x1_intrawave_v3,447.97,495.01,0.0
256,940,1536,4096,ck,2,0,26.0737,a8w8_blockscale_1x128x128_256x64x128x128_16x16_32x32_1x2_8x32x1_8x32x1_1x32x1x8_8_1x1_intrawave_v3,453.63,499.71,0.0
256,944,1536,4096,ck,2,0,25.7498,a8w8_blockscale_1x128x128_256x64x128x128_16x16_32x32_1x2_8x32x1_8x32x1_1x32x1x8_8_1x1_intrawave_v3,461.3,507.11,0.0
256,950,1536,4096,ck,2,0,26.2089,a8w8_blockscale_1x128x128_256x64x128x128_16x16_32x32_1x2_8x32x1_8x32x1_1x32x1x8_8_1x1_intrawave_v3,456.1,499.87,0.0
256,966,1536,4096,ck,2,0,25.9467,a8w8_blockscale_1x128x128_256x64x128x128_16x16_32x32_1x2_8x32x1_8x32x1_1x32x1x8_8_1x1_intrawave_v3,468.46,509.34,0.0
256,994,1536,4096,ck,2,0,26.0242,a8w8_blockscale_1x128x128_256x64x128x128_16x16_32x32_1x2_8x32x1_8x32x1_1x32x1x8_8_1x1_intrawave_v3,480.61,515.54,0.0
256,1015,1536,4096,ck,2,0,26.0405,a8w8_blockscale_1x128x128_256x64x128x128_16x16_32x32_1x2_8x32x1_8x32x1_1x32x1x8_8_1x1_intrawave_v3,490.45,521.0,0.0
256,1017,1536,4096,ck,2,0,25.9519,a8w8_blockscale_1x128x128_256x64x128x128_16x16_32x32_1x2_8x32x1_8x32x1_1x32x1x8_8_1x1_intrawave_v3,493.1,523.33,0.0
256,1019,1536,4096,ck,2,0,25.9948,a8w8_blockscale_1x128x128_256x64x128x128_16x16_32x32_1x2_8x32x1_8x32x1_1x32x1x8_8_1x1_intrawave_v3,493.25,523.01,0.0
256,1024,1536,4096,ck,2,0,25.3902,a8w8_blockscale_1x128x128_256x64x128x128_16x16_32x32_1x2_8x32x1_8x32x1_1x32x1x8_8_1x1_intrawave_v3,507.48,536.88,0.0
256,1198,1536,4096,ck,2,0,26.3163,a8w8_blockscale_1x128x128_256x64x128x128_16x16_32x32_1x2_8x32x1_8x32x1_1x32x1x8_8_1x1_intrawave_v3,572.81,565.38,0.0
256,1517,1536,4096,ck,0,0,32.6822,a8w8_blockscale_1x128x128_256x128x128x128_16x16_32x32_2x2_8x32x1_8x32x1_1x32x1x8_8_1x1_intrawave_v3,584.06,525.22,0.0
256,1697,1536,4096,ck,0,0,33.0111,a8w8_blockscale_1x128x128_256x128x128x128_16x16_32x32_2x2_8x32x1_8x32x1_1x32x1x8_8_1x1_intrawave_v3,646.85,559.07,0.0
256,1790,1536,4096,ck,0,0,33.3415,a8w8_blockscale_1x128x128_256x128x128x128_16x16_32x32_2x2_8x32x1_8x32x1_1x32x1x8_8_1x1_intrawave_v3,675.54,573.52,0.0
256,2029,1536,4096,ck,0,0,33.7235,a8w8_blockscale_1x128x128_256x128x128x128_16x16_32x32_2x2_8x32x1_8x32x1_1x32x1x8_8_1x1_intrawave_v3,757.06,617.83,0.0
256,2046,1536,4096,ck,0,0,33.9134,a8w8_blockscale_1x128x128_256x128x128x128_16x16_32x32_2x2_8x32x1_8x32x1_1x32x1x8_8_1x1_intrawave_v3,759.13,617.96,0.0
256,2285,1536,4096,ck,0,0,34.4658,a8w8_blockscale_1x128x128_256x128x128x128_16x16_32x32_2x2_8x32x1_8x32x1_1x32x1x8_8_1x1_intrawave_v3,834.22,657.76,0.0
256,2558,1536,4096,ck,0,0,34.9461,a8w8_blockscale_1x128x128_256x128x128x128_16x16_32x32_2x2_8x32x1_8x32x1_1x32x1x8_8_1x1_intrawave_v3,921.05,704.72,0.0
256,3051,1536,4096,ck,2,0,48.6676,a8w8_blockscale_1x128x128_256x64x128x128_16x16_32x32_1x2_8x32x1_8x32x1_1x32x1x8_8_1x1_intrawave_v3,788.83,578.64,0.0
256,12828,1536,4096,ck,0,0,134.549,a8w8_blockscale_1x128x128_256x128x128x128_16x16_32x32_2x2_8x32x1_8x32x1_1x32x1x8_8_1x1_intrawave_v3,1199.66,730.16,0.0
256,16071,1536,4096,ck,0,0,160.6552,a8w8_blockscale_1x128x128_256x128x128x128_16x16_32x32_2x2_8x32x1_8x32x1_1x32x1x8_8_1x1_intrawave_v3,1258.72,756.21,0.0
256,1,2560,4096,ck,8,0,13.7685,a8w8_blockscale_1x128x128_256x16x64x256_16x16_16x16_1x1_16x16x1_16x16x1_1x16x1x16_4_1x1_intrawave_v1,1.52,762.25,0.0
256,2,2560,4096,ck,8,0,13.7492,a8w8_blockscale_1x128x128_256x16x64x256_16x16_16x16_1x1_16x16x1_16x16x1_1x16x1x16_4_1x1_intrawave_v1,3.05,763.99,0.0
256,3,2560,4096,ck,8,0,13.7353,a8w8_blockscale_1x128x128_256x16x64x256_16x16_16x16_1x1_16x16x1_16x16x1_1x16x1x16_4_1x1_intrawave_v1,4.58,765.43,0.0
256,4,2560,4096,ck,8,0,13.4067,a8w8_blockscale_1x128x128_256x16x64x256_16x16_16x16_1x1_16x16x1_16x16x1_1x16x1x16_4_1x1_intrawave_v1,6.26,784.88,0.0
256,5,2560,4096,ck,8,0,13.8257,a8w8_blockscale_1x128x128_256x16x64x256_16x16_16x16_1x1_16x16x1_16x16x1_1x16x1x16_4_1x1_intrawave_v1,7.58,761.76,0.0
256,6,2560,4096,ck,8,0,13.8715,a8w8_blockscale_1x128x128_256x16x64x256_16x16_16x16_1x1_16x16x1_16x16x1_1x16x1x16_4_1x1_intrawave_v1,9.07,759.91,0.0
256,7,2560,4096,ck,8,0,13.7575,a8w8_blockscale_1x128x128_256x16x64x256_16x16_16x16_1x1_16x16x1_16x16x1_1x16x1x16_4_1x1_intrawave_v1,10.67,766.87,0.0
256,8,2560,4096,ck,8,0,13.7302,a8w8_blockscale_1x128x128_256x16x64x256_16x16_16x16_1x1_16x16x1_16x16x1_1x16x1x16_4_1x1_intrawave_v1,12.22,769.07,0.0
256,9,2560,4096,ck,8,0,13.6153,a8w8_blockscale_1x128x128_256x16x64x256_16x16_16x16_1x1_16x16x1_16x16x1_1x16x1x16_4_1x1_intrawave_v1,13.86,776.24,0.0
256,10,2560,4096,ck,8,0,13.8779,a8w8_blockscale_1x128x128_256x16x64x256_16x16_16x16_1x1_16x16x1_16x16x1_1x16x1x16_4_1x1_intrawave_v1,15.11,762.21,0.0
256,11,2560,4096,ck,8,0,13.7854,a8w8_blockscale_1x128x128_256x16x64x256_16x16_16x16_1x1_16x16x1_16x16x1_1x16x1x16_4_1x1_intrawave_v1,16.73,768.0,0.0
256,12,2560,4096,ck,8,0,13.9469,a8w8_blockscale_1x128x128_256x16x64x256_16x16_16x16_1x1_16x16x1_16x16x1_1x16x1x16_4_1x1_intrawave_v1,18.04,759.76,0.0
256,13,2560,4096,ck,8,0,13.9124,a8w8_blockscale_1x128x128_256x16x64x256_16x16_16x16_1x1_16x16x1_16x16x1_1x16x1x16_4_1x1_intrawave_v1,19.6,762.31,0.0
256,14,2560,4096,ck,8,0,13.8792,a8w8_blockscale_1x128x128_256x16x64x256_16x16_16x16_1x1_16x16x1_16x16x1_1x16x1x16_4_1x1_intrawave_v1,21.15,764.8,0.0
256,15,2560,4096,ck,8,0,14.0308,a8w8_blockscale_1x128x128_256x16x64x256_16x16_16x16_1x1_16x16x1_16x16x1_1x16x1x16_4_1x1_intrawave_v1,22.42,757.19,0.0
256,16,2560,4096,ck,8,0,13.3644,a8w8_blockscale_1x128x128_256x16x64x256_16x16_16x16_1x1_16x16x1_16x16x1_1x16x1x16_4_1x1_intrawave_v1,25.11,795.64,0.0
256,17,2560,4096,ck,8,0,13.8877,a8w8_blockscale_1x128x128_256x16x64x256_16x16_16x16_1x1_16x16x1_16x16x1_1x16x1x16_4_1x1_intrawave_v1,25.67,766.32,0.0
256,18,2560,4096,ck,8,0,13.92,a8w8_blockscale_1x128x128_256x16x64x256_16x16_16x16_1x1_16x16x1_16x16x1_1x16x1x16_4_1x1_intrawave_v1,27.12,765.2,0.0
256,19,2560,4096,ck,8,0,13.9571,a8w8_blockscale_1x128x128_256x16x64x256_16x16_16x16_1x1_16x16x1_16x16x1_1x16x1x16_4_1x1_intrawave_v1,28.55,763.83,0.0
256,20,2560,4096,ck,8,0,13.8603,a8w8_blockscale_1x128x128_256x16x64x256_16x16_16x16_1x1_16x16x1_16x16x1_1x16x1x16_4_1x1_intrawave_v1,30.26,769.83,0.0
256,21,2560,4096,ck,8,0,13.9325,a8w8_blockscale_1x128x128_256x16x64x256_16x16_16x16_1x1_16x16x1_16x16x1_1x16x1x16_4_1x1_intrawave_v1,31.61,766.5,0.0
256,22,2560,4096,ck,8,0,13.9516,a8w8_blockscale_1x128x128_256x16x64x256_16x16_16x16_1x1_16x16x1_16x16x1_1x16x1x16_4_1x1_intrawave_v1,33.07,766.11,0.0
256,23,2560,4096,ck,8,0,13.7125,a8w8_blockscale_1x128x128_256x16x64x256_16x16_16x16_1x1_16x16x1_16x16x1_1x16x1x16_4_1x1_intrawave_v1,35.18,780.14,0.0
256,24,2560,4096,ck,8,0,13.8146,a8w8_blockscale_1x128x128_256x16x64x256_16x16_16x16_1x1_16x16x1_16x16x1_1x16x1x16_4_1x1_intrawave_v1,36.43,775.05,0.0
256,25,2560,4096,ck,8,0,14.0555,a8w8_blockscale_1x128x128_256x16x64x256_16x16_16x16_1x1_16x16x1_16x16x1_1x16x1x16_4_1x1_intrawave_v1,37.3,762.42,0.0
256,26,2560,4096,ck,8,0,14.084,a8w8_blockscale_1x128x128_256x16x64x256_16x16_16x16_1x1_16x16x1_16x16x1_1x16x1x16_4_1x1_intrawave_v1,38.71,761.53,0.0
256,27,2560,4096,ck,8,0,13.8615,a8w8_blockscale_1x128x128_256x16x64x256_16x16_16x16_1x1_16x16x1_16x16x1_1x16x1x16_4_1x1_intrawave_v1,40.85,774.42,0.0
256,28,2560,4096,ck,8,0,13.8705,a8w8_blockscale_1x128x128_256x16x64x256_16x16_16x16_1x1_16x16x1_16x16x1_1x16x1x16_4_1x1_intrawave_v1,42.33,774.58,0.0
256,29,2560,4096,ck,8,0,13.7564,a8w8_blockscale_1x128x128_256x16x64x256_16x16_16x16_1x1_16x16x1_16x16x1_1x16x1x16_4_1x1_intrawave_v1,44.21,781.67,0.0
256,30,2560,4096,ck,8,0,13.9204,a8w8_blockscale_1x128x128_256x16x64x256_16x16_16x16_1x1_16x16x1_16x16x1_1x16x1x16_4_1x1_intrawave_v1,45.2,773.13,0.0
256,31,2560,4096,ck,8,0,14.08,a8w8_blockscale_1x128x128_256x16x64x256_16x16_16x16_1x1_16x16x1_16x16x1_1x16x1x16_4_1x1_intrawave_v1,46.17,765.02,0.0
256,32,2560,4096,ck,8,0,13.2381,a8w8_blockscale_1x128x128_256x16x64x256_16x16_16x16_1x1_16x16x1_16x16x1_1x16x1x16_4_1x1_intrawave_v1,50.69,814.37,0.0
256,817,2560,4096,ck,2,0,31.9287,a8w8_blockscale_1x128x128_256x64x128x128_16x16_32x32_1x2_8x32x1_8x32x1_1x32x1x8_8_1x1_intrawave_v3,536.62,564.23,0.0
256,820,2560,4096,ck,2,0,32.2108,a8w8_blockscale_1x128x128_256x64x128x128_16x16_32x32_1x2_8x32x1_8x32x1_1x32x1x8_8_1x1_intrawave_v3,533.88,560.15,0.0
256,824,2560,4096,ck,2,0,31.9435,a8w8_blockscale_1x128x128_256x64x128x128_16x16_32x32_1x2_8x32x1_8x32x1_1x32x1x8_8_1x1_intrawave_v3,540.97,565.99,0.0
256,834,2560,4096,ck,2,0,32.4203,a8w8_blockscale_1x128x128_256x64x128x128_16x16_32x32_1x2_8x32x1_8x32x1_1x32x1x8_8_1x1_intrawave_v3,539.48,560.51,0.0
256,845,2560,4096,ck,2,0,32.2913,a8w8_blockscale_1x128x128_256x64x128x128_16x16_32x32_1x2_8x32x1_8x32x1_1x32x1x8_8_1x1_intrawave_v3,548.78,565.89,0.0
256,847,2560,4096,ck,2,0,32.205,a8w8_blockscale_1x128x128_256x64x128x128_16x16_32x32_1x2_8x32x1_8x32x1_1x32x1x8_8_1x1_intrawave_v3,551.56,567.98,0.0
256,849,2560,4096,ck,2,0,32.5521,a8w8_blockscale_1x128x128_256x64x128x128_16x16_32x32_1x2_8x32x1_8x32x1_1x32x1x8_8_1x1_intrawave_v3,546.96,562.49,0.0
256,856,2560,4096,ck,2,0,32.5284,a8w8_blockscale_1x128x128_256x64x128x128_16x16_32x32_1x2_8x32x1_8x32x1_1x32x1x8_8_1x1_intrawave_v3,551.88,564.88,0.0
256,860,2560,4096,ck,2,0,32.4073,a8w8_blockscale_1x128x128_256x64x128x128_16x16_32x32_1x2_8x32x1_8x32x1_1x32x1x8_8_1x1_intrawave_v3,556.53,568.13,0.0
256,866,2560,4096,ck,2,0,32.4061,a8w8_blockscale_1x128x128_256x64x128x128_16x16_32x32_1x2_8x32x1_8x32x1_1x32x1x8_8_1x1_intrawave_v3,560.43,569.86,0.0
256,868,2560,4096,ck,0,0,32.7124,a8w8_blockscale_1x128x128_256x128x128x128_16x16_32x32_2x2_8x32x1_8x32x1_1x32x1x8_8_1x1_intrawave_v3,556.46,565.08,0.0
256,876,2560,4096,ck,2,0,32.6099,a8w8_blockscale_1x128x128_256x64x128x128_16x16_32x32_1x2_8x32x1_8x32x1_1x32x1x8_8_1x1_intrawave_v3,563.36,569.12,0.0
256,879,2560,4096,ck,2,0,32.8108,a8w8_blockscale_1x128x128_256x64x128x128_16x16_32x32_1x2_8x32x1_8x32x1_1x32x1x8_8_1x1_intrawave_v3,561.83,566.48,0.0
256,883,2560,4096,ck,2,0,32.3533,a8w8_blockscale_1x128x128_256x64x128x128_16x16_32x32_1x2_8x32x1_8x32x1_1x32x1x8_8_1x1_intrawave_v3,572.36,575.63,0.0
256,888,2560,4096,ck,2,0,32.6583,a8w8_blockscale_1x128x128_256x64x128x128_16x16_32x32_1x2_8x32x1_8x32x1_1x32x1x8_8_1x1_intrawave_v3,570.23,571.66,0.0
256,895,2560,4096,ck,2,0,32.8731,a8w8_blockscale_1x128x128_256x64x128x128_16x16_32x32_1x2_8x32x1_8x32x1_1x32x1x8_8_1x1_intrawave_v3,570.97,569.89,0.0
256,899,2560,4096,ck,0,0,32.3915,a8w8_blockscale_1x128x128_256x128x128x128_16x16_32x32_2x2_8x32x1_8x32x1_1x32x1x8_8_1x1_intrawave_v3,582.05,579.5,0.0
256,928,2560,4096,ck,0,0,32.5509,a8w8_blockscale_1x128x128_256x128x128x128_16x16_32x32_2x2_8x32x1_8x32x1_1x32x1x8_8_1x1_intrawave_v3,597.88,584.88,0.0
256,934,2560,4096,ck,0,0,32.7249,a8w8_blockscale_1x128x128_256x128x128x128_16x16_32x32_2x2_8x32x1_8x32x1_1x32x1x8_8_1x1_intrawave_v3,598.55,583.45,0.0
256,940,2560,4096,ck,0,0,32.5167,a8w8_blockscale_1x128x128_256x128x128x128_16x16_32x32_2x2_8x32x1_8x32x1_1x32x1x8_8_1x1_intrawave_v3,606.25,588.89,0.0
256,944,2560,4096,ck,0,0,32.5141,a8w8_blockscale_1x128x128_256x128x128x128_16x16_32x32_2x2_8x32x1_8x32x1_1x32x1x8_8_1x1_intrawave_v3,608.88,590.07,0.0
256,950,2560,4096,ck,0,0,32.6449,a8w8_blockscale_1x128x128_256x128x128x128_16x16_32x32_2x2_8x32x1_8x32x1_1x32x1x8_8_1x1_intrawave_v3,610.29,589.4,0.0
256,966,2560,4096,ck,0,0,33.081,a8w8_blockscale_1x128x128_256x128x128x128_16x16_32x32_2x2_8x32x1_8x32x1_1x32x1x8_8_1x1_intrawave_v3,612.39,586.09,0.0
256,994,2560,4096,ck,0,0,33.1831,a8w8_blockscale_1x128x128_256x128x128x128_16x16_32x32_2x2_8x32x1_8x32x1_1x32x1x8_8_1x1_intrawave_v3,628.2,592.06,0.0
256,1015,2560,4096,ck,0,0,33.1753,a8w8_blockscale_1x128x128_256x128x128x128_16x16_32x32_2x2_8x32x1_8x32x1_1x32x1x8_8_1x1_intrawave_v3,641.62,598.04,0.0
256,1017,2560,4096,ck,0,0,33.1005,a8w8_blockscale_1x128x128_256x128x128x128_16x16_32x32_2x2_8x32x1_8x32x1_1x32x1x8_8_1x1_intrawave_v3,644.34,599.94,0.0
256,1019,2560,4096,ck,0,0,33.2857,a8w8_blockscale_1x128x128_256x128x128x128_16x16_32x32_2x2_8x32x1_8x32x1_1x32x1x8_8_1x1_intrawave_v3,642.02,597.16,0.0
256,1024,2560,4096,ck,0,0,32.1333,a8w8_blockscale_1x128x128_256x128x128x128_16x16_32x32_2x2_8x32x1_8x32x1_1x32x1x8_8_1x1_intrawave_v3,668.3,620.01,0.0
256,1198,2560,4096,ck,0,0,33.0408,a8w8_blockscale_1x128x128_256x128x128x128_16x16_32x32_2x2_8x32x1_8x32x1_1x32x1x8_8_1x1_intrawave_v3,760.39,651.51,0.0
256,1517,2560,4096,ck,0,0,35.3598,a8w8_blockscale_1x128x128_256x128x128x128_16x16_32x32_2x2_8x32x1_8x32x1_1x32x1x8_8_1x1_intrawave_v3,899.72,691.93,0.0
256,1697,2560,4096,ck,2,0,47.2993,a8w8_blockscale_1x128x128_256x64x128x128_16x16_32x32_1x2_8x32x1_8x32x1_1x32x1x8_8_1x1_intrawave_v3,752.41,552.34,0.0
256,1790,2560,4096,ck,2,0,47.8291,a8w8_blockscale_1x128x128_256x64x128x128_16x16_32x32_1x2_8x32x1_8x32x1_1x32x1x8_8_1x1_intrawave_v3,784.86,564.14,0.0
256,2029,2560,4096,ck,2,0,52.6504,a8w8_blockscale_1x128x128_256x64x128x128_16x16_32x32_1x2_8x32x1_8x32x1_1x32x1x8_8_1x1_intrawave_v3,808.18,554.32,0.0
256,2046,2560,4096,ck,2,0,51.0669,a8w8_blockscale_1x128x128_256x64x128x128_16x16_32x32_1x2_8x32x1_8x32x1_1x32x1x8_8_1x1_intrawave_v3,840.23,574.57,0.0
256,2285,2560,4096,ck,0,0,52.0556,a8w8_blockscale_1x128x128_256x128x128x128_16x16_32x32_2x2_8x32x1_8x32x1_1x32x1x8_8_1x1_intrawave_v3,920.55,605.97,0.0
256,2558,2560,4096,ck,0,0,54.0868,a8w8_blockscale_1x128x128_256x128x128x128_16x16_32x32_2x2_8x32x1_8x32x1_1x32x1x8_8_1x1_intrawave_v3,991.83,629.73,0.0
256,3051,2560,4096,ck,0,0,58.2741,a8w8_blockscale_1x128x128_256x128x128x128_16x16_32x32_2x2_8x32x1_8x32x1_1x32x1x8_8_1x1_intrawave_v3,1097.99,662.45,0.0
256,12828,2560,4096,ck,0,0,212.0447,a8w8_blockscale_1x128x128_256x128x128x128_16x16_32x32_2x2_8x32x1_8x32x1_1x32x1x8_8_1x1_intrawave_v3,1268.71,606.99,0.0
256,16071,2560,4096,ck,0,0,251.8662,a8w8_blockscale_1x128x128_256x128x128x128_16x16_32x32_2x2_8x32x1_8x32x1_1x32x1x8_8_1x1_intrawave_v3,1338.14,629.68,0.0
256,1,4096,128,ck,6,0,2.7194,a8w8_blockscale_1x128x128_256x16x64x128_8x16_16x16_1x1_16x16x1_8x32x1_1x16x1x16_4_1x1_intrawave_v1,0.39,195.85,0.0
256,2,4096,128,ck,6,0,2.7134,a8w8_blockscale_1x128x128_256x16x64x128_8x16_16x16_1x1_16x16x1_8x32x1_1x16x1x16_4_1x1_intrawave_v1,0.77,199.35,0.0
256,3,4096,128,ck,6,0,2.7231,a8w8_blockscale_1x128x128_256x16x64x128_8x16_16x16_1x1_16x16x1_8x32x1_1x16x1x16_4_1x1_intrawave_v1,1.16,201.7,0.0
256,4,4096,128,cktile,7,0,2.661,a8w8_blockscale_cktile_32x128x128_1x4x1_32x32x16_intrawave_0x0x0x0_1,1.58,209.53,0.0
256,5,4096,128,cktile,0,0,2.6549,a8w8_blockscale_cktile_16x128x128_1x4x1_16x16x32_intrawave_0x0x0x0_1,1.97,213.15,0.0
256,6,4096,128,ck,6,0,2.7392,a8w8_blockscale_1x128x128_256x16x64x128_8x16_16x16_1x1_16x16x1_8x32x1_1x16x1x16_4_1x1_intrawave_v1,2.3,209.63,0.0
256,7,4096,128,cktile,0,0,2.6961,a8w8_blockscale_cktile_16x128x128_1x4x1_16x16x32_intrawave_0x0x0x0_1,2.72,216.06,0.0
256,8,4096,128,ck,6,0,2.7655,a8w8_blockscale_1x128x128_256x16x64x128_8x16_16x16_1x1_16x16x1_8x32x1_1x16x1x16_4_1x1_intrawave_v1,3.03,213.65,0.0
256,9,4096,128,ck,6,0,2.7407,a8w8_blockscale_1x128x128_256x16x64x128_8x16_16x16_1x1_16x16x1_8x32x1_1x16x1x16_4_1x1_intrawave_v1,3.44,218.62,0.0
256,10,4096,128,ck,8,0,2.9466,a8w8_blockscale_1x128x128_256x16x64x256_16x16_16x16_1x1_16x16x1_16x16x1_1x16x1x16_4_1x1_intrawave_v1,3.56,206.17,0.0
256,11,4096,128,cktile,0,0,2.7631,a8w8_blockscale_cktile_16x128x128_1x4x1_16x16x32_intrawave_0x0x0x0_1,4.17,222.87,0.0
256,12,4096,128,cktile,0,0,2.452,a8w8_blockscale_cktile_16x128x128_1x4x1_16x16x32_intrawave_0x0x0x0_1,5.13,254.54,0.0
256,13,4096,128,ck,6,0,2.7415,a8w8_blockscale_1x128x128_256x16x64x128_8x16_16x16_1x1_16x16x1_8x32x1_1x16x1x16_4_1x1_intrawave_v1,4.97,230.69,0.0
256,14,4096,128,cktile,0,0,2.7035,a8w8_blockscale_cktile_16x128x128_1x4x1_16x16x32_intrawave_0x0x0x0_1,5.43,237.01,0.0
256,15,4096,128,ck,6,0,2.7611,a8w8_blockscale_1x128x128_256x16x64x128_8x16_16x16_1x1_16x16x1_8x32x1_1x16x1x16_4_1x1_intrawave_v1,5.7,235.08,0.0
256,16,4096,128,ck,8,0,2.9075,a8w8_blockscale_1x128x128_256x16x64x256_16x16_16x16_1x1_16x16x1_16x16x1_1x16x1x16_4_1x1_intrawave_v1,5.77,226.11,0.0
256,17,4096,128,ck,6,0,2.9938,a8w8_blockscale_1x128x128_256x16x64x128_8x16_16x16_1x1_16x16x1_8x32x1_1x16x1x16_4_1x1_intrawave_v1,5.95,222.37,0.0
256,18,4096,128,cktile,0,0,2.861,a8w8_blockscale_cktile_16x128x128_1x4x1_16x16x32_intrawave_0x0x0x0_1,6.6,235.6,0.0
256,19,4096,128,ck,11,0,2.9963,a8w8_blockscale_1x128x128_256x32x64x128_16x16_16x16_2x1_8x32x1_8x32x1_1x32x1x8_8_2x1_intrawave_v1,6.65,227.74,0.0
256,20,4096,128,ck,6,0,2.989,a8w8_blockscale_1x128x128_256x16x64x128_8x16_16x16_1x1_16x16x1_8x32x1_1x16x1x16_4_1x1_intrawave_v1,7.02,231.08,0.0
256,21,4096,128,ck,11,0,2.9941,a8w8_blockscale_1x128x128_256x32x64x128_16x16_16x16_2x1_8x32x1_8x32x1_1x32x1x8_8_2x1_intrawave_v1,7.35,233.46,0.0
256,22,4096,128,cktile,0,0,2.6402,a8w8_blockscale_cktile_16x128x128_1x4x1_16x16x32_intrawave_0x0x0x0_1,8.74,267.91,0.0
256,23,4096,128,ck,11,0,3.0178,a8w8_blockscale_1x128x128_256x32x64x128_16x16_16x16_2x1_8x32x1_8x32x1_1x32x1x8_8_2x1_intrawave_v1,7.99,237.14,0.0
256,24,4096,128,ck,11,0,2.9893,a8w8_blockscale_1x128x128_256x32x64x128_16x16_16x16_2x1_8x32x1_8x32x1_1x32x1x8_8_2x1_intrawave_v1,8.42,242.19,0.0
256,25,4096,128,ck,6,0,3.028,a8w8_blockscale_1x128x128_256x16x64x128_8x16_16x16_1x1_16x16x1_8x32x1_1x16x1x16_4_1x1_intrawave_v1,8.66,241.84,0.0
256,26,4096,128,ck,11,0,3.0126,a8w8_blockscale_1x128x128_256x32x64x128_16x16_16x16_2x1_8x32x1_8x32x1_1x32x1x8_8_2x1_intrawave_v1,9.05,245.84,0.0
256,27,4096,128,ck,6,0,3.0467,a8w8_blockscale_1x128x128_256x16x64x128_8x16_16x16_1x1_16x16x1_8x32x1_1x16x1x16_4_1x1_intrawave_v1,9.29,245.82,0.0
256,28,4096,128,ck,11,0,3.0166,a8w8_blockscale_1x128x128_256x32x64x128_16x16_16x16_2x1_8x32x1_8x32x1_1x32x1x8_8_2x1_intrawave_v1,9.73,251.03,0.0
256,29,4096,128,ck,11,0,3.0282,a8w8_blockscale_1x128x128_256x32x64x128_16x16_16x16_2x1_8x32x1_8x32x1_1x32x1x8_8_2x1_intrawave_v1,10.04,252.81,0.0
256,30,4096,128,ck,6,0,3.0078,a8w8_blockscale_1x128x128_256x16x64x128_8x16_16x16_1x1_16x16x1_8x32x1_1x16x1x16_4_1x1_intrawave_v1,10.46,257.29,0.0
256,31,4096,128,ck,6,0,3.0046,a8w8_blockscale_1x128x128_256x16x64x128_8x16_16x16_1x1_16x16x1_8x32x1_1x16x1x16_4_1x1_intrawave_v1,10.82,260.34,0.0
256,32,4096,128,ck,6,0,3.0534,a8w8_blockscale_1x128x128_256x16x64x128_8x16_16x16_1x1_16x16x1_8x32x1_1x16x1x16_4_1x1_intrawave_v1,10.99,258.9,0.0
256,817,4096,128,cktile,7,0,5.9769,a8w8_blockscale_cktile_32x128x128_1x4x1_32x32x16_intrawave_0x0x0x0_1,143.33,1225.0,0.0
256,820,4096,128,cktile,5,0,6.0867,a8w8_blockscale_cktile_64x128x128_2x2x1_16x16x32_intrawave_0x0x0x0_1,141.26,1207.01,0.0
256,824,4096,128,cktile,4,0,6.0425,a8w8_blockscale_cktile_32x128x128_2x2x1_16x16x32_intrawave_0x0x0x0_1,142.99,1221.34,0.0
256,834,4096,128,cktile,7,0,6.034,a8w8_blockscale_cktile_32x128x128_1x4x1_32x32x16_intrawave_0x0x0x0_1,144.93,1236.85,0.0
256,845,4096,128,cktile,0,0,6.0217,a8w8_blockscale_cktile_16x128x128_1x4x1_16x16x32_intrawave_0x0x0x0_1,147.14,1254.58,0.0
256,847,4096,128,cktile,4,0,5.7977,a8w8_blockscale_cktile_32x128x128_2x2x1_16x16x32_intrawave_0x0x0x0_1,153.19,1305.92,0.0
256,849,4096,128,cktile,5,0,5.8272,a8w8_blockscale_cktile_64x128x128_2x2x1_16x16x32_intrawave_0x0x0x0_1,152.77,1302.16,0.0
256,856,4096,128,cktile,2,0,5.9801,a8w8_blockscale_cktile_64x128x128_1x4x1_16x16x32_intrawave_0x0x0x0_1,150.09,1278.61,0.0
256,860,4096,128,cktile,10,0,5.9612,a8w8_blockscale_cktile_64x128x128_2x2x1_32x32x16_intrawave_0x0x0x0_1,151.27,1288.25,0.0
256,866,4096,128,cktile,5,0,6.0474,a8w8_blockscale_cktile_64x128x128_2x2x1_16x16x32_intrawave_0x0x0x0_1,150.16,1278.14,0.0
256,868,4096,128,cktile,2,0,6.1867,a8w8_blockscale_cktile_64x128x128_1x4x1_16x16x32_intrawave_0x0x0x0_1,147.12,1252.05,0.0
256,876,4096,128,cktile,0,0,6.098,a8w8_blockscale_cktile_16x128x128_1x4x1_16x16x32_intrawave_0x0x0x0_1,150.63,1281.18,0.0
256,879,4096,128,cktile,4,0,6.024,a8w8_blockscale_cktile_32x128x128_2x2x1_16x16x32_intrawave_0x0x0x0_1,153.0,1301.06,0.0
256,883,4096,128,cktile,1,0,6.0729,a8w8_blockscale_cktile_32x128x128_1x4x1_16x16x32_intrawave_0x0x0x0_1,152.46,1296.06,0.0
256,888,4096,128,cktile,1,0,5.978,a8w8_blockscale_cktile_32x128x128_1x4x1_16x16x32_intrawave_0x0x0x0_1,155.76,1323.59,0.0
256,895,4096,128,cktile,11,0,6.4777,a8w8_blockscale_cktile_128x128x128_2x2x1_32x32x16_intrawave_0x0x0x0_1,144.88,1230.48,0.0
256,899,4096,128,cktile,1,0,6.3356,a8w8_blockscale_cktile_32x128x128_1x4x1_16x16x32_intrawave_0x0x0x0_1,148.79,1263.33,0.0
256,928,4096,128,cktile,1,0,6.6152,a8w8_blockscale_cktile_32x128x128_1x4x1_16x16x32_intrawave_0x0x0x0_1,147.1,1246.41,0.0
256,934,4096,128,cktile,0,0,6.5073,a8w8_blockscale_cktile_16x128x128_1x4x1_16x16x32_intrawave_0x0x0x0_1,150.5,1274.75,0.0
256,940,4096,128,cktile,5,0,6.455,a8w8_blockscale_cktile_64x128x128_2x2x1_16x16x32_intrawave_0x0x0x0_1,152.7,1292.81,0.0
256,944,4096,128,cktile,0,0,6.4517,a8w8_blockscale_cktile_16x128x128_1x4x1_16x16x32_intrawave_0x0x0x0_1,153.43,1298.63,0.0
256,950,4096,128,cktile,0,0,6.4673,a8w8_blockscale_cktile_16x128x128_1x4x1_16x16x32_intrawave_0x0x0x0_1,154.03,1303.22,0.0
256,966,4096,128,cktile,2,0,6.1413,a8w8_blockscale_cktile_64x128x128_1x4x1_16x16x32_intrawave_0x0x0x0_1,164.94,1394.07,0.0
256,994,4096,128,cktile,10,0,6.49,a8w8_blockscale_cktile_64x128x128_2x2x1_32x32x16_intrawave_0x0x0x0_1,160.6,1355.06,0.0
256,1015,4096,128,cktile,2,0,6.1358,a8w8_blockscale_cktile_64x128x128_1x4x1_16x16x32_intrawave_0x0x0x0_1,173.46,1461.76,0.0
256,1017,4096,128,cktile,5,0,6.2999,a8w8_blockscale_cktile_64x128x128_2x2x1_16x16x32_intrawave_0x0x0x0_1,169.27,1426.33,0.0
256,1019,4096,128,cktile,5,0,6.0189,a8w8_blockscale_cktile_64x128x128_2x2x1_16x16x32_intrawave_0x0x0x0_1,177.52,1495.68,0.0
256,1024,4096,128,cktile,10,0,5.9827,a8w8_blockscale_cktile_64x128x128_2x2x1_32x32x16_intrawave_0x0x0x0_1,179.47,1511.69,0.0
256,1198,4096,128,cktile,1,0,6.7678,a8w8_blockscale_cktile_32x128x128_1x4x1_16x16x32_intrawave_0x0x0x0_1,185.61,1550.23,0.0
256,1517,4096,128,cktile,2,0,7.5068,a8w8_blockscale_cktile_64x128x128_1x4x1_16x16x32_intrawave_0x0x0x0_1,211.9,1751.18,0.0
256,1697,4096,128,cktile,5,0,8.2077,a8w8_blockscale_cktile_64x128x128_2x2x1_16x16x32_intrawave_0x0x0x0_1,216.8,1784.1,0.0
256,1790,4096,128,cktile,5,0,8.3876,a8w8_blockscale_cktile_64x128x128_2x2x1_16x16x32_intrawave_0x0x0x0_1,223.78,1838.08,0.0
256,2029,4096,128,cktile,5,0,8.8171,a8w8_blockscale_cktile_64x128x128_2x2x1_16x16x32_intrawave_0x0x0x0_1,241.3,1974.07,0.0
256,2046,4096,128,cktile,5,0,8.8175,a8w8_blockscale_cktile_64x128x128_2x2x1_16x16x32_intrawave_0x0x0x0_1,243.31,1990.02,0.0
256,2285,4096,128,cktile,5,0,9.7338,a8w8_blockscale_cktile_64x128x128_2x2x1_16x16x32_intrawave_0x0x0x0_1,246.15,2006.97,0.0
256,2558,4096,128,cktile,5,0,9.9419,a8w8_blockscale_cktile_64x128x128_2x2x1_16x16x32_intrawave_0x0x0x0_1,269.79,2193.43,0.0
256,3051,4096,128,cktile,5,0,10.6763,a8w8_blockscale_cktile_64x128x128_2x2x1_16x16x32_intrawave_0x0x0x0_1,299.65,2426.74,0.0
256,12828,4096,128,cktile,5,0,33.2138,a8w8_blockscale_cktile_64x128x128_2x2x1_16x16x32_intrawave_0x0x0x0_1,404.99,3229.18,0.0
256,16071,4096,128,cktile,5,0,41.7231,a8w8_blockscale_cktile_64x128x128_2x2x1_16x16x32_intrawave_0x0x0x0_1,403.89,3217.28,0.0
