aiter/configs/a8w8_bpreshuffle_cktile_tuned_gemm.csv
cu_num,M,N,K,kernelId,splitK,us,kernelName,tflops,bw,errRatio
80,1,9216,4096,30,0,12.9048,a8w8_bpreshuffle_cktile_0x0x8x4x1x0x0x0x0x2_16x64x512_1x4x1_16x16x64_default,5.85,2926.92,0.0
80,2,9216,4096,2,0,12.9388,a8w8_bpreshuffle_cktile_0x0x8x4x1x0x0x0x0x1_16x64x512_1x4x1_16x16x64_default,11.67,2920.97,0.0
80,4,9216,4096,2,0,12.9816,a8w8_bpreshuffle_cktile_0x0x8x4x1x0x0x0x0x1_16x64x512_1x4x1_16x16x64_default,23.26,2914.81,0.0
80,8,9216,4096,30,0,13.1572,a8w8_bpreshuffle_cktile_0x0x8x4x1x0x0x0x0x2_16x64x512_1x4x1_16x16x64_default,45.9,2882.75,0.0
80,16,9216,4096,2,0,14.0139,a8w8_bpreshuffle_cktile_0x0x8x4x1x0x0x0x0x1_16x64x512_1x4x1_16x16x64_default,86.2,2719.38,0.0
80,32,9216,4096,9,0,16.7096,a8w8_bpreshuffle_cktile_0x0x8x4x1x0x0x0x0x1_32x64x512_1x4x1_16x16x64_default,144.58,2302.25,0.0
80,64,9216,4096,22,0,24.5395,a8w8_bpreshuffle_cktile_0x0x8x4x1x0x0x0x0x1_64x64x256_1x4x1_16x16x64_default,196.9,1597.04,0.0
80,128,9216,4096,24,0,35.4998,a8w8_bpreshuffle_cktile_0x0x8x4x1x0x0x0x0x1_64x128x256_1x4x1_16x16x64_default,272.22,1144.58,0.0
80,256,9216,4096,68,0,63.803,a8w8_bpreshuffle_cktile_0x0x8x4x1x0x0x0x0x2_64x256x256_1x4x1_16x16x64_default,302.92,682.04,0.0
80,1024,9216,4096,54,0,211.9977,a8w8_bpreshuffle_cktile_0x0x8x4x1x0x0x0x0x2_64x192x128_1x4x1_16x16x64_default,364.67,286.88,0.0
80,2048,9216,4096,54,0,410.3007,a8w8_bpreshuffle_cktile_0x0x8x4x1x0x0x0x0x2_64x192x128_1x4x1_16x16x64_default,376.84,204.45,0.0
80,4096,9216,4096,54,0,786.7339,a8w8_bpreshuffle_cktile_0x0x8x4x1x0x0x0x0x2_64x192x128_1x4x1_16x16x64_default,393.07,165.27,0.0
80,4240,9216,4096,54,0,829.5777,a8w8_bpreshuffle_cktile_0x0x8x4x1x0x0x0x0x2_64x192x128_1x4x1_16x16x64_default,385.87,160.64,0.0
80,16384,9216,4096,54,0,3084.9868,a8w8_bpreshuffle_cktile_0x0x8x4x1x0x0x0x0x2_64x192x128_1x4x1_16x16x64_default,400.96,131.88,0.0
80,32768,9216,4096,54,0,6135.9085,a8w8_bpreshuffle_cktile_0x0x8x4x1x0x0x0x0x2_64x192x128_1x4x1_16x16x64_default,403.18,126.46,0.0
80,1,4608,4096,30,0,9.9687,a8w8_bpreshuffle_cktile_0x0x8x4x1x0x0x0x0x2_16x64x512_1x4x1_16x16x64_default,3.79,1894.7,0.0
80,2,4608,4096,2,0,9.8532,a8w8_bpreshuffle_cktile_0x0x8x4x1x0x0x0x0x1_16x64x512_1x4x1_16x16x64_default,7.66,1918.26,0.0
80,4,4608,4096,2,0,10.3186,a8w8_bpreshuffle_cktile_0x0x8x4x1x0x0x0x0x1_16x64x512_1x4x1_16x16x64_default,14.63,1834.32,0.0
80,8,4608,4096,30,0,10.2518,a8w8_bpreshuffle_cktile_0x0x8x4x1x0x0x0x0x2_16x64x512_1x4x1_16x16x64_default,29.46,1851.47,0.0
80,16,4608,4096,9,0,10.1797,a8w8_bpreshuffle_cktile_0x0x8x4x1x0x0x0x0x1_32x64x512_1x4x1_16x16x64_default,59.33,1875.04,0.0
80,32,4608,4096,37,0,11.0049,a8w8_bpreshuffle_cktile_0x0x8x4x1x0x0x0x0x2_32x64x512_1x4x1_16x16x64_default,109.77,1753.8,0.0
80,64,4608,4096,23,0,15.8202,a8w8_bpreshuffle_cktile_0x0x8x4x1x0x0x0x0x1_32x128x256_1x4x1_16x16x64_default,152.71,1246.91,0.0
80,128,4608,4096,24,0,22.8823,a8w8_bpreshuffle_cktile_0x0x8x4x1x0x0x0x0x1_64x128x256_1x4x1_16x16x64_default,211.16,899.31,0.0
80,256,4608,4096,24,0,35.1223,a8w8_bpreshuffle_cktile_0x0x8x4x1x0x0x0x0x1_64x128x256_1x4x1_16x16x64_default,275.14,634.42,0.0
80,1024,4608,4096,26,0,111.4377,a8w8_bpreshuffle_cktile_0x0x8x4x1x0x0x0x0x1_64x192x128_1x4x1_16x16x64_default,346.87,291.7,0.0
80,2048,4608,4096,54,0,210.7297,a8w8_bpreshuffle_cktile_0x0x8x4x1x0x0x0x0x2_64x192x128_1x4x1_16x16x64_default,366.87,218.94,0.0
80,4096,4608,4096,54,0,408.7369,a8w8_bpreshuffle_cktile_0x0x8x4x1x0x0x0x0x2_64x192x128_1x4x1_16x16x64_default,378.28,179.58,0.0
80,16384,4608,4096,54,0,1545.3929,a8w8_bpreshuffle_cktile_0x0x8x4x1x0x0x0x0x2_64x192x128_1x4x1_16x16x64_default,400.21,153.34,0.0
80,32768,4608,4096,54,0,3099.2964,a8w8_bpreshuffle_cktile_0x0x8x4x1x0x0x0x0x2_64x192x128_1x4x1_16x16x64_default,399.11,146.83,0.0
80,1,1280,8192,2,0,12.7965,a8w8_bpreshuffle_cktile_0x0x8x4x1x0x0x0x0x1_16x64x512_1x4x1_16x16x64_default,1.64,820.26,0.0
80,32,1280,8192,2,0,13.6423,a8w8_bpreshuffle_cktile_0x0x8x4x1x0x0x0x0x1_16x64x512_1x4x1_16x16x64_default,49.19,793.84,0.0
80,64,1280,8192,2,0,13.4425,a8w8_bpreshuffle_cktile_0x0x8x4x1x0x0x0x0x1_16x64x512_1x4x1_16x16x64_default,99.85,831.24,0.0
80,128,1280,8192,9,0,16.5571,a8w8_bpreshuffle_cktile_0x0x8x4x1x0x0x0x0x1_32x64x512_1x4x1_16x16x64_default,162.13,716.43,0.0
80,192,1280,8192,23,0,24.9874,a8w8_bpreshuffle_cktile_0x0x8x4x1x0x0x0x0x1_32x128x256_1x4x1_16x16x64_default,161.14,502.26,0.0
80,256,1280,8192,23,0,25.3858,a8w8_bpreshuffle_cktile_0x0x8x4x1x0x0x0x0x1_32x128x256_1x4x1_16x16x64_default,211.48,521.48,0.0
80,320,1280,8192,23,0,36.0155,a8w8_bpreshuffle_cktile_0x0x8x4x1x0x0x0x0x1_32x128x256_1x4x1_16x16x64_default,186.33,386.68,0.0
80,512,1280,8192,24,0,39.0062,a8w8_bpreshuffle_cktile_0x0x8x4x1x0x0x0x0x1_64x128x256_1x4x1_16x16x64_default,275.27,409.95,0.0
80,1024,1280,8192,24,0,62.422,a8w8_bpreshuffle_cktile_0x0x8x4x1x0x0x0x0x1_64x128x256_1x4x1_16x16x64_default,344.03,344.36,0.0
80,2048,1280,8192,68,0,115.5764,a8w8_bpreshuffle_cktile_0x0x8x4x1x0x0x0x0x2_64x256x256_1x4x1_16x16x64_default,371.61,281.25,0.0
80,4096,1280,8192,68,0,224.3581,a8w8_bpreshuffle_cktile_0x0x8x4x1x0x0x0x0x2_64x256x256_1x4x1_16x16x64_default,382.87,243.03,0.0
80,8192,1280,8192,48,0,434.5678,a8w8_bpreshuffle_cktile_0x0x8x4x1x0x0x0x0x2_64x256x128_1x4x1_16x16x64_default,395.33,226.81,0.0
80,16384,1280,8192,48,0,855.908,a8w8_bpreshuffle_cktile_0x0x8x4x1x0x0x0x0x2_64x256x128_1x4x1_16x16x64_default,401.44,218.07,0.0
80,1,8192,1024,33,0,6.6064,a8w8_bpreshuffle_cktile_0x0x8x4x1x0x0x0x0x2_16x64x256_1x4x1_16x16x64_default,2.54,1272.4,0.0
80,32,8192,1024,37,0,6.9748,a8w8_bpreshuffle_cktile_0x0x8x4x1x0x0x0x0x2_32x64x512_1x4x1_16x16x64_default,76.97,1282.57,0.0
80,64,8192,1024,23,0,10.4742,a8w8_bpreshuffle_cktile_0x0x8x4x1x0x0x0x0x1_32x128x256_1x4x1_16x16x64_default,102.51,907.25,0.0
80,128,8192,1024,24,0,14.6067,a8w8_bpreshuffle_cktile_0x0x8x4x1x0x0x0x0x1_64x128x256_1x4x1_16x16x64_default,147.02,726.85,0.0
80,192,8192,1024,51,0,18.4464,a8w8_bpreshuffle_cktile_0x0x8x4x1x0x0x0x0x2_32x128x256_1x4x1_16x16x64_default,174.63,635.95,0.0
80,256,8192,1024,46,0,22.7833,a8w8_bpreshuffle_cktile_0x0x8x4x1x0x0x0x0x2_64x128x128_1x4x1_16x16x64_default,188.51,563.79,0.0
80,320,8192,1024,48,0,24.6382,a8w8_bpreshuffle_cktile_0x0x8x4x1x0x0x0x0x2_64x256x128_1x4x1_16x16x64_default,217.9,566.57,0.0
80,512,8192,1024,46,0,37.6643,a8w8_bpreshuffle_cktile_0x0x8x4x1x0x0x0x0x2_64x128x128_1x4x1_16x16x64_default,228.07,459.36,0.0
80,1024,8192,1024,46,0,65.3665,a8w8_bpreshuffle_cktile_0x0x8x4x1x0x0x0x0x2_64x128x128_1x4x1_16x16x64_default,262.82,401.04,0.0
80,2048,8192,1024,41,0,117.7909,a8w8_bpreshuffle_cktile_0x0x8x4x1x0x0x0x0x2_128x128x64_1x4x1_16x16x64_default,291.7,373.88,0.0
80,4096,8192,1024,41,0,222.3966,a8w8_bpreshuffle_cktile_0x0x8x4x1x0x0x0x0x2_128x128x64_1x4x1_16x16x64_default,309.0,358.33,0.0
80,8192,8192,1024,41,0,423.1597,a8w8_bpreshuffle_cktile_0x0x8x4x1x0x0x0x0x2_128x128x64_1x4x1_16x16x64_default,324.79,356.83,0.0
80,16384,8192,1024,41,0,821.258,a8w8_bpreshuffle_cktile_0x0x8x4x1x0x0x0x0x2_128x128x64_1x4x1_16x16x64_default,334.7,357.5,0.0
80,16,1536,7168,2,0,11.9166,a8w8_bpreshuffle_cktile_0x0x8x4x1x0x0x0x0x1_16x64x512_1x4x1_16x16x64_default,29.57,937.67,0.0
80,32,1536,7168,2,0,12.2456,a8w8_bpreshuffle_cktile_0x0x8x4x1x0x0x0x0x1_16x64x512_1x4x1_16x16x64_default,57.54,925.86,0.0
80,64,1536,7168,9,0,14.8021,a8w8_bpreshuffle_cktile_0x0x8x4x1x0x0x0x0x1_32x64x512_1x4x1_16x16x64_default,95.21,788.09,0.0
80,128,1536,7168,21,0,20.5898,a8w8_bpreshuffle_cktile_0x0x8x4x1x0x0x0x0x1_32x64x256_1x4x1_16x16x64_default,136.89,598.39,0.0
80,256,1536,7168,66,0,29.7058,a8w8_bpreshuffle_cktile_0x0x8x4x1x0x0x0x0x2_32x192x256_1x4x1_16x16x64_default,189.77,458.88,0.0
80,512,1536,7168,58,0,44.6328,a8w8_bpreshuffle_cktile_0x0x8x4x1x0x0x0x0x1_64x192x256_1x4x1_16x16x64_default,252.6,364.15,0.0
80,1024,1536,7168,58,0,77.1886,a8w8_bpreshuffle_cktile_0x0x8x4x1x0x0x0x0x1_64x192x256_1x4x1_16x16x64_default,292.12,278.48,0.0
80,1536,1536,7168,20,0,101.7773,a8w8_bpreshuffle_cktile_0x0x8x4x1x0x0x0x0x1_64x256x128_1x4x1_16x16x64_default,332.32,262.72,0.0
80,2048,1536,7168,24,0,130.8105,a8w8_bpreshuffle_cktile_0x0x8x4x1x0x0x0x0x1_64x128x256_1x4x1_16x16x64_default,344.75,244.49,0.0
80,4096,1536,7168,48,0,242.9667,a8w8_bpreshuffle_cktile_0x0x8x4x1x0x0x0x0x2_64x256x128_1x4x1_16x16x64_default,371.22,217.94,0.0
80,8192,1536,7168,54,0,461.2919,a8w8_bpreshuffle_cktile_0x0x8x4x1x0x0x0x0x2_64x192x128_1x4x1_16x16x64_default,391.05,205.72,0.0
80,16384,1536,7168,54,0,905.9909,a8w8_bpreshuffle_cktile_0x0x8x4x1x0x0x0x0x2_64x192x128_1x4x1_16x16x64_default,398.21,197.33,0.0
80,20480,1536,7168,48,0,1118.0539,a8w8_bpreshuffle_cktile_0x0x8x4x1x0x0x0x0x2_64x256x128_1x4x1_16x16x64_default,403.35,197.42,0.0
80,16,3072,1536,2,0,5.9618,a8w8_bpreshuffle_cktile_0x0x8x4x1x0x0x0x0x1_16x64x512_1x4x1_16x16x64_default,25.33,812.08,0.0
80,32,3072,1536,9,0,6.7498,a8w8_bpreshuffle_cktile_0x0x8x4x1x0x0x0x0x1_32x64x512_1x4x1_16x16x64_default,44.74,735.48,0.0
80,64,3072,1536,21,0,8.9754,a8w8_bpreshuffle_cktile_0x0x8x4x1x0x0x0x0x1_32x64x256_1x4x1_16x16x64_default,67.29,580.49,0.0
80,128,3072,1536,21,0,11.1207,a8w8_bpreshuffle_cktile_0x0x8x4x1x0x0x0x0x1_32x64x256_1x4x1_16x16x64_default,108.62,512.7,0.0
80,256,3072,1536,57,0,15.8689,a8w8_bpreshuffle_cktile_0x0x8x4x1x0x0x0x0x1_32x192x256_1x4x1_16x16x64_default,152.24,421.24,0.0
80,512,3072,1536,23,0,23.6895,a8w8_bpreshuffle_cktile_0x0x8x4x1x0x0x0x0x1_32x128x256_1x4x1_16x16x64_default,203.97,365.17,0.0
80,1024,3072,1536,46,0,39.0277,a8w8_bpreshuffle_cktile_0x0x8x4x1x0x0x0x0x2_64x128x128_1x4x1_16x16x64_default,247.61,322.41,0.0
80,1536,3072,1536,54,0,50.9012,a8w8_bpreshuffle_cktile_0x0x8x4x1x0x0x0x0x2_64x192x128_1x4x1_16x16x64_default,284.78,324.45,0.0
80,2048,3072,1536,48,0,65.8281,a8w8_bpreshuffle_cktile_0x0x8x4x1x0x0x0x0x2_64x256x128_1x4x1_16x16x64_default,293.6,310.62,0.0
80,4096,3072,1536,54,0,117.4866,a8w8_bpreshuffle_cktile_0x0x8x4x1x0x0x0x0x2_64x192x128_1x4x1_16x16x64_default,329.01,307.91,0.0
80,8192,3072,1536,54,0,225.0856,a8w8_bpreshuffle_cktile_0x0x8x4x1x0x0x0x0x2_64x192x128_1x4x1_16x16x64_default,343.47,300.48,0.0
80,16384,3072,1536,54,0,438.9518,a8w8_bpreshuffle_cktile_0x0x8x4x1x0x0x0x0x2_64x192x128_1x4x1_16x16x64_default,352.25,297.41,0.0
80,20480,3072,1536,54,0,542.6733,a8w8_bpreshuffle_cktile_0x0x8x4x1x0x0x0x0x2_64x192x128_1x4x1_16x16x64_default,356.15,298.53,0.0
80,16,576,7168,2,0,12.0528,a8w8_bpreshuffle_cktile_0x0x8x4x1x0x0x0x0x1_16x64x512_1x4x1_16x16x64_default,10.96,353.6,0.0
80,32,576,7168,30,0,12.3251,a8w8_bpreshuffle_cktile_0x0x8x4x1x0x0x0x0x2_16x64x512_1x4x1_16x16x64_default,21.44,356.59,0.0
80,64,576,7168,2,0,12.2075,a8w8_bpreshuffle_cktile_0x0x8x4x1x0x0x0x0x1_16x64x512_1x4x1_16x16x64_default,43.29,381.83,0.0
80,128,576,7168,2,0,12.3514,a8w8_bpreshuffle_cktile_0x0x8x4x1x0x0x0x0x1_16x64x512_1x4x1_16x16x64_default,85.57,420.5,0.0
80,256,576,7168,9,0,14.9376,a8w8_bpreshuffle_cktile_0x0x8x4x1x0x0x0x0x1_32x64x512_1x4x1_16x16x64_default,141.52,418.99,0.0
80,512,576,7168,9,0,22.5703,a8w8_bpreshuffle_cktile_0x0x8x4x1x0x0x0x0x1_32x64x512_1x4x1_16x16x64_default,187.32,371.67,0.0
80,1024,576,7168,22,0,35.4728,a8w8_bpreshuffle_cktile_0x0x8x4x1x0x0x0x0x1_64x64x256_1x4x1_16x16x64_default,238.37,356.57,0.0
80,1536,576,7168,58,0,44.4162,a8w8_bpreshuffle_cktile_0x0x8x4x1x0x0x0x0x1_64x192x256_1x4x1_16x16x64_default,285.56,380.68,0.0
80,2048,576,7168,131,0,65.7335,a8w8_bpreshuffle_cktile_0x0x8x4x1x0x0x0x0x2_96x192x256_1x4x1_16x16x64_default,257.27,322.03,0.0
80,4096,576,7168,74,0,107.8111,a8w8_bpreshuffle_cktile_0x0x8x4x1x0x0x0x0x1_160x192x128_1x4x1_16x16x64_default,313.72,354.39,0.0
80,8192,576,7168,58,0,186.7817,a8w8_bpreshuffle_cktile_0x0x8x4x1x0x0x0x0x1_64x192x256_1x4x1_16x16x64_default,362.16,387.01,0.0
80,16384,576,7168,54,0,359.7223,a8w8_bpreshuffle_cktile_0x0x8x4x1x0x0x0x0x2_64x192x128_1x4x1_16x16x64_default,376.1,390.42,0.0
80,20480,576,7168,54,0,436.2202,a8w8_bpreshuffle_cktile_0x0x8x4x1x0x0x0x0x2_64x192x128_1x4x1_16x16x64_default,387.68,400.08,0.0
80,16,7168,2048,2,0,9.1742,a8w8_bpreshuffle_cktile_0x0x8x4x1x0x0x0x0x1_16x64x512_1x4x1_16x16x64_default,51.2,1628.72,0.0
80,32,7168,2048,49,0,10.7453,a8w8_bpreshuffle_cktile_0x0x8x4x1x0x0x0x0x2_32x64x256_1x4x1_16x16x64_default,87.44,1414.98,0.0
80,64,7168,2048,49,0,13.6786,a8w8_bpreshuffle_cktile_0x0x8x4x1x0x0x0x0x2_32x64x256_1x4x1_16x16x64_default,137.37,1149.87,0.0
80,128,7168,2048,23,0,19.541,a8w8_bpreshuffle_cktile_0x0x8x4x1x0x0x0x0x1_32x128x256_1x4x1_16x16x64_default,192.32,858.56,0.0
80,256,7168,2048,18,0,30.4226,a8w8_bpreshuffle_cktile_0x0x8x4x1x0x0x0x0x1_64x128x128_1x4x1_16x16x64_default,247.06,620.41,0.0
80,512,7168,2048,48,0,52.0579,a8w8_bpreshuffle_cktile_0x0x8x4x1x0x0x0x0x2_64x256x128_1x4x1_16x16x64_default,288.76,443.13,0.0
80,1024,7168,2048,48,0,96.1383,a8w8_bpreshuffle_cktile_0x0x8x4x1x0x0x0x0x2_64x256x128_1x4x1_16x16x64_default,312.72,327.21,0.0
80,1536,7168,2048,46,0,135.3627,a8w8_bpreshuffle_cktile_0x0x8x4x1x0x0x0x0x2_64x128x128_1x4x1_16x16x64_default,333.16,294.36,0.0
80,2048,7168,2048,48,0,180.4336,a8w8_bpreshuffle_cktile_0x0x8x4x1x0x0x0x0x2_64x256x128_1x4x1_16x16x64_default,333.25,267.33,0.0
80,4096,7168,2048,41,0,338.9949,a8w8_bpreshuffle_cktile_0x0x8x4x1x0x0x0x0x2_128x128x64_1x4x1_16x16x64_default,354.75,241.27,0.0
80,8192,7168,2048,41,0,651.1562,a8w8_bpreshuffle_cktile_0x0x8x4x1x0x0x0x0x2_128x128x64_1x4x1_16x16x64_default,369.37,228.67,0.0
80,16384,7168,2048,41,0,1282.8862,a8w8_bpreshuffle_cktile_0x0x8x4x1x0x0x0x0x2_128x128x64_1x4x1_16x16x64_default,374.96,220.69,0.0
80,20480,7168,2048,41,0,1602.6372,a8w8_bpreshuffle_cktile_0x0x8x4x1x0x0x0x0x2_128x128x64_1x4x1_16x16x64_default,375.19,218.53,0.0
80,16,4608,7168,9,0,14.6651,a8w8_bpreshuffle_cktile_0x0x8x4x1x0x0x0x0x1_32x64x512_1x4x1_16x16x64_default,72.07,2270.17,0.0
80,32,4608,7168,9,0,14.9106,a8w8_bpreshuffle_cktile_0x0x8x4x1x0x0x0x0x1_32x64x512_1x4x1_16x16x64_default,141.77,2250.37,0.0
80,64,4608,7168,23,0,23.5169,a8w8_bpreshuffle_cktile_0x0x8x4x1x0x0x0x0x1_32x128x256_1x4x1_16x16x64_default,179.78,1449.12,0.0
80,128,4608,7168,24,0,35.1222,a8w8_bpreshuffle_cktile_0x0x8x4x1x0x0x0x0x1_64x128x256_1x4x1_16x16x64_default,240.75,1000.15,0.0
80,256,4608,7168,24,0,55.8852,a8w8_bpreshuffle_cktile_0x0x8x4x1x0x0x0x0x1_64x128x256_1x4x1_16x16x64_default,302.61,666.09,0.0
80,512,4608,7168,0,0,103.0634,a8w8_bpreshuffle_cktile_0x0x8x4x1x0x0x0x0x1_128x128x128_1x4x1_16x16x64_default,328.18,401.88,0.0
80,1024,4608,7168,26,0,184.555,a8w8_bpreshuffle_cktile_0x0x8x4x1x0x0x0x0x1_64x192x128_1x4x1_16x16x64_default,366.53,269.88,0.0
80,1536,4608,7168,18,0,272.9456,a8w8_bpreshuffle_cktile_0x0x8x4x1x0x0x0x0x1_64x128x128_1x4x1_16x16x64_default,371.75,213.21,0.0
80,2048,4608,7168,54,0,354.6475,a8w8_bpreshuffle_cktile_0x0x8x4x1x0x0x0x0x2_64x192x128_1x4x1_16x16x64_default,381.48,187.75,0.0
80,4096,4608,7168,54,0,692.6798,a8w8_bpreshuffle_cktile_0x0x8x4x1x0x0x0x0x2_64x192x128_1x4x1_16x16x64_default,390.63,144.57,0.0
80,8192,4608,7168,48,0,1343.0841,a8w8_bpreshuffle_cktile_0x0x8x4x1x0x0x0x0x2_64x256x128_1x4x1_16x16x64_default,402.93,124.53,0.0
80,16384,4608,7168,54,0,2639.293,a8w8_bpreshuffle_cktile_0x0x8x4x1x0x0x0x0x2_64x192x128_1x4x1_16x16x64_default,410.08,114.22,0.0
80,20480,4608,7168,54,0,3276.6577,a8w8_bpreshuffle_cktile_0x0x8x4x1x0x0x0x0x2_64x192x128_1x4x1_16x16x64_default,412.89,112.48,0.0
80,16,7168,2304,21,0,11.0122,a8w8_bpreshuffle_cktile_0x0x8x4x1x0x0x0x0x1_32x64x256_1x4x1_16x16x64_default,47.99,1523.88,0.0
80,32,7168,2304,49,0,11.1539,a8w8_bpreshuffle_cktile_0x0x8x4x1x0x0x0x0x2_32x64x256_1x4x1_16x16x64_default,94.76,1528.39,0.0
80,64,7168,2304,49,0,14.327,a8w8_bpreshuffle_cktile_0x0x8x4x1x0x0x0x0x2_32x64x256_1x4x1_16x16x64_default,147.55,1227.06,0.0
80,128,7168,2304,23,0,21.2273,a8w8_bpreshuffle_cktile_0x0x8x4x1x0x0x0x0x1_32x128x256_1x4x1_16x16x64_default,199.17,878.35,0.0
80,256,7168,2304,46,0,31.7244,a8w8_bpreshuffle_cktile_0x0x8x4x1x0x0x0x0x2_64x128x128_1x4x1_16x16x64_default,266.54,654.86,0.0
80,512,7168,2304,48,0,56.153,a8w8_bpreshuffle_cktile_0x0x8x4x1x0x0x0x0x2_64x256x128_1x4x1_16x16x64_default,301.17,445.83,0.0
80,1024,7168,2304,48,0,103.9455,a8w8_bpreshuffle_cktile_0x0x8x4x1x0x0x0x0x2_64x256x128_1x4x1_16x16x64_default,325.39,322.81,0.0
80,1536,7168,2304,46,0,144.8029,a8w8_bpreshuffle_cktile_0x0x8x4x1x0x0x0x0x2_64x128x128_1x4x1_16x16x64_default,350.37,290.56,0.0
80,2048,7168,2304,46,0,193.0686,a8w8_bpreshuffle_cktile_0x0x8x4x1x0x0x0x0x2_64x128x128_1x4x1_16x16x64_default,350.37,262.05,0.0
80,4096,7168,2304,41,0,366.5239,a8w8_bpreshuffle_cktile_0x0x8x4x1x0x0x0x0x2_128x128x64_1x4x1_16x16x64_default,369.12,231.01,0.0
80,8192,7168,2304,41,0,709.1492,a8w8_bpreshuffle_cktile_0x0x8x4x1x0x0x0x0x2_128x128x64_1x4x1_16x16x64_default,381.56,215.51,0.0
80,16384,7168,2304,41,0,1404.7256,a8w8_bpreshuffle_cktile_0x0x8x4x1x0x0x0x0x2_128x128x64_1x4x1_16x16x64_default,385.25,205.84,0.0
80,20480,7168,2304,41,0,1741.0107,a8w8_bpreshuffle_cktile_0x0x8x4x1x0x0x0x0x2_128x128x64_1x4x1_16x16x64_default,388.54,205.23,0.0
80,16,512,7168,30,0,11.9822,a8w8_bpreshuffle_cktile_0x0x8x4x1x0x0x0x0x2_16x64x512_1x4x1_16x16x64_default,9.8,317.23,0.0
80,32,512,7168,2,0,12.2803,a8w8_bpreshuffle_cktile_0x0x8x4x1x0x0x0x0x1_16x64x512_1x4x1_16x16x64_default,19.13,320.2,0.0
80,64,512,7168,30,0,12.315,a8w8_bpreshuffle_cktile_0x0x8x4x1x0x0x0x0x2_16x64x512_1x4x1_16x16x64_default,38.15,340.58,0.0
80,128,512,7168,2,0,12.3314,a8w8_bpreshuffle_cktile_0x0x8x4x1x0x0x0x0x1_16x64x512_1x4x1_16x16x64_default,76.19,382.65,0.0
80,256,512,7168,9,0,14.8513,a8w8_bpreshuffle_cktile_0x0x8x4x1x0x0x0x0x1_32x64x512_1x4x1_16x16x64_default,126.52,388.33,0.0
80,512,512,7168,37,0,22.2836,a8w8_bpreshuffle_cktile_0x0x8x4x1x0x0x0x0x2_32x64x512_1x4x1_16x16x64_default,168.65,352.92,0.0
80,1024,512,7168,24,0,34.5858,a8w8_bpreshuffle_cktile_0x0x8x4x1x0x0x0x0x1_64x128x256_1x4x1_16x16x64_default,217.32,348.66,0.0
80,1536,512,7168,99,0,47.427,a8w8_bpreshuffle_cktile_0x0x8x4x1x0x0x0x0x1_96x128x256_1x4x1_16x16x64_default,237.72,342.69,0.0
80,2048,512,7168,24,0,54.6059,a8w8_bpreshuffle_cktile_0x0x8x4x1x0x0x0x0x1_64x128x256_1x4x1_16x16x64_default,275.29,374.45,0.0
80,4096,512,7168,18,0,101.3206,a8w8_bpreshuffle_cktile_0x0x8x4x1x0x0x0x0x1_64x128x128_1x4x1_16x16x64_default,296.73,367.39,0.0
80,8192,512,7168,24,0,180.3432,a8w8_bpreshuffle_cktile_0x0x8x4x1x0x0x0x0x1_64x128x256_1x4x1_16x16x64_default,333.42,392.47,0.0
80,16384,512,7168,24,0,332.6272,a8w8_bpreshuffle_cktile_0x0x8x4x1x0x0x0x0x1_64x128x256_1x4x1_16x16x64_default,361.54,414.54,0.0
80,20480,512,7168,48,0,387.5191,a8w8_bpreshuffle_cktile_0x0x8x4x1x0x0x0x0x2_64x256x128_1x4x1_16x16x64_default,387.91,442.41,0.0
80,16,4096,512,30,0,3.9474,a8w8_bpreshuffle_cktile_0x0x8x4x1x0x0x0x0x2_16x64x512_1x4x1_16x16x64_default,17.0,566.55,0.0
80,32,4096,512,49,0,4.2976,a8w8_bpreshuffle_cktile_0x0x8x4x1x0x0x0x0x2_32x64x256_1x4x1_16x16x64_default,31.23,552.79,0.0
80,64,4096,512,49,0,5.4494,a8w8_bpreshuffle_cktile_0x0x8x4x1x0x0x0x0x2_32x64x256_1x4x1_16x16x64_default,49.26,487.06,0.0
80,128,4096,512,49,0,6.8127,a8w8_bpreshuffle_cktile_0x0x8x4x1x0x0x0x0x2_32x64x256_1x4x1_16x16x64_default,78.8,471.36,0.0
80,256,4096,512,15,0,10.6842,a8w8_bpreshuffle_cktile_0x0x8x4x1x0x0x0x0x1_32x64x128_1x4x1_16x16x64_default,100.5,404.84,0.0
80,512,4096,512,45,0,15.5946,a8w8_bpreshuffle_cktile_0x0x8x4x1x0x0x0x0x2_32x128x128_1x4x1_16x16x64_default,137.71,420.25,0.0
80,1024,4096,512,46,0,25.069,a8w8_bpreshuffle_cktile_0x0x8x4x1x0x0x0x0x2_64x128x128_1x4x1_16x16x64_default,171.33,439.19,0.0
80,1536,4096,512,46,0,33.2391,a8w8_bpreshuffle_cktile_0x0x8x4x1x0x0x0x0x2_64x128x128_1x4x1_16x16x64_default,193.82,465.31,0.0
80,2048,4096,512,46,0,42.7751,a8w8_bpreshuffle_cktile_0x0x8x4x1x0x0x0x0x2_64x128x128_1x4x1_16x16x64_default,200.82,465.76,0.0
80,4096,4096,512,41,0,75.405,a8w8_bpreshuffle_cktile_0x0x8x4x1x0x0x0x0x2_128x128x64_1x4x1_16x16x64_default,227.83,500.61,0.0
80,8192,4096,512,41,0,137.5652,a8w8_bpreshuffle_cktile_0x0x8x4x1x0x0x0x0x2_128x128x64_1x4x1_16x16x64_default,249.77,533.57,0.0
80,16384,4096,512,41,0,262.5162,a8w8_bpreshuffle_cktile_0x0x8x4x1x0x0x0x0x2_128x128x64_1x4x1_16x16x64_default,261.77,551.22,0.0
80,20480,4096,512,41,0,322.8676,a8w8_bpreshuffle_cktile_0x0x8x4x1x0x0x0x0x2_128x128x64_1x4x1_16x16x64_default,266.05,558.6,0.0
80,16,7168,256,33,0,4.1533,a8w8_bpreshuffle_cktile_0x0x8x4x1x0x0x0x0x2_16x64x256_1x4x1_16x16x64_default,14.14,498.03,0.0
80,32,7168,256,15,0,4.3338,a8w8_bpreshuffle_cktile_0x0x8x4x1x0x0x0x0x1_32x64x128_1x4x1_16x16x64_default,27.1,531.16,0.0
80,64,7168,256,16,0,5.6176,a8w8_bpreshuffle_cktile_0x0x8x4x1x0x0x0x0x1_64x64x128_1x4x1_16x16x64_default,41.81,492.9,0.0
80,128,7168,256,45,0,7.0727,a8w8_bpreshuffle_cktile_0x0x8x4x1x0x0x0x0x2_32x128x128_1x4x1_16x16x64_default,66.42,523.53,0.0
80,256,7168,256,18,0,11.1402,a8w8_bpreshuffle_cktile_0x0x8x4x1x0x0x0x0x1_64x128x128_1x4x1_16x16x64_default,84.34,500.04,0.0
80,512,7168,256,45,0,16.3518,a8w8_bpreshuffle_cktile_0x0x8x4x1x0x0x0x0x2_32x128x128_1x4x1_16x16x64_default,114.91,569.12,0.0
80,1024,7168,256,45,0,27.5099,a8w8_bpreshuffle_cktile_0x0x8x4x1x0x0x0x0x2_32x128x128_1x4x1_16x16x64_default,136.61,609.86,0.0
80,1536,7168,256,45,0,36.8025,a8w8_bpreshuffle_cktile_0x0x8x4x1x0x0x0x0x2_32x128x128_1x4x1_16x16x64_default,153.17,658.88,0.0
80,2048,7168,256,41,0,47.1463,a8w8_bpreshuffle_cktile_0x0x8x4x1x0x0x0x0x2_128x128x64_1x4x1_16x16x64_default,159.42,672.79,0.0
80,4096,7168,256,41,0,85.1181,a8w8_bpreshuffle_cktile_0x0x8x4x1x0x0x0x0x2_128x128x64_1x4x1_16x16x64_default,176.61,723.75,0.0
80,8192,7168,256,41,0,156.5563,a8w8_bpreshuffle_cktile_0x0x8x4x1x0x0x0x0x2_128x128x64_1x4x1_16x16x64_default,192.04,775.27,0.0
80,16384,7168,256,41,0,301.4756,a8w8_bpreshuffle_cktile_0x0x8x4x1x0x0x0x0x2_128x128x64_1x4x1_16x16x64_default,199.45,799.1,0.0
80,20480,7168,256,41,0,373.7383,a8w8_bpreshuffle_cktile_0x0x8x4x1x0x0x0x0x2_128x128x64_1x4x1_16x16x64_default,201.11,804.52,0.0
80,32,7168,1536,51,0,9.8996,a8w8_bpreshuffle_cktile_0x0x8x4x1x0x0x0x0x2_32x128x256_1x4x1_16x16x64_default,71.18,1163.48,0.0
80,32,7168,576,41,0,13.2274,a8w8_bpreshuffle_cktile_0x0x8x4x1x0x0x0x0x2_128x128x64_1x4x1_16x16x64_default,19.98,348.21,0.0
80,32,2048,7168,2,0,12.4173,a8w8_bpreshuffle_cktile_0x0x8x4x1x0x0x0x0x1_16x64x512_1x4x1_16x16x64_default,75.66,1211.25,0.0
80,32,7168,512,49,0,5.5426,a8w8_bpreshuffle_cktile_0x0x8x4x1x0x0x0x0x2_32x64x256_1x4x1_16x16x64_default,42.38,747.87,0.0
80,32,256,7168,2,0,10.8848,a8w8_bpreshuffle_cktile_0x0x8x4x1x0x0x0x0x1_16x64x512_1x4x1_16x16x64_default,10.79,191.16,0.0
80,64,7168,1536,21,0,11.5816,a8w8_bpreshuffle_cktile_0x0x8x4x1x0x0x0x0x1_32x64x256_1x4x1_16x16x64_default,121.68,1038.36,0.0
80,64,7168,576,41,0,13.6023,a8w8_bpreshuffle_cktile_0x0x8x4x1x0x0x0x0x2_128x128x64_1x4x1_16x16x64_default,38.85,373.7,0.0
80,64,2048,7168,9,0,14.9748,a8w8_bpreshuffle_cktile_0x0x8x4x1x0x0x0x0x1_32x64x512_1x4x1_16x16x64_default,125.48,1028.46,0.0
80,64,7168,512,21,0,6.7758,a8w8_bpreshuffle_cktile_0x0x8x4x1x0x0x0x0x1_32x64x256_1x4x1_16x16x64_default,69.33,681.88,0.0
80,64,256,7168,2,0,11.4051,a8w8_bpreshuffle_cktile_0x0x8x4x1x0x0x0x0x1_16x64x512_1x4x1_16x16x64_default,20.59,203.99,0.0
80,96,7168,1536,17,0,14.9313,a8w8_bpreshuffle_cktile_0x0x8x4x1x0x0x0x0x1_32x128x128_1x4x1_16x16x64_default,141.58,839.43,0.0
80,96,7168,576,41,0,14.1469,a8w8_bpreshuffle_cktile_0x0x8x4x1x0x0x0x0x2_128x128x64_1x4x1_16x16x64_default,56.04,393.04,0.0
80,96,2048,7168,21,0,20.7002,a8w8_bpreshuffle_cktile_0x0x8x4x1x0x0x0x0x1_32x64x256_1x4x1_16x16x64_default,136.16,761.41,0.0
80,96,7168,512,17,0,8.226,a8w8_bpreshuffle_cktile_0x0x8x4x1x0x0x0x0x1_32x128x128_1x4x1_16x16x64_default,85.66,619.43,0.0
80,96,256,7168,30,0,11.4763,a8w8_bpreshuffle_cktile_0x0x8x4x1x0x0x0x0x2_16x64x512_1x4x1_16x16x64_default,30.7,224.14,0.0
80,128,7168,1536,51,0,16.5378,a8w8_bpreshuffle_cktile_0x0x8x4x1x0x0x0x0x2_32x128x256_1x4x1_16x16x64_default,170.43,788.6,0.0
80,128,7168,576,41,0,14.7401,a8w8_bpreshuffle_cktile_0x0x8x4x1x0x0x0x0x2_128x128x64_1x4x1_16x16x64_default,71.71,409.6,0.0
80,128,2048,7168,9,0,22.4085,a8w8_bpreshuffle_cktile_0x0x8x4x1x0x0x0x0x1_32x64x512_1x4x1_16x16x64_default,167.71,719.45,0.0
80,128,7168,512,23,0,10.1582,a8w8_bpreshuffle_cktile_0x0x8x4x1x0x0x0x0x1_32x128x256_1x4x1_16x16x64_default,92.49,548.38,0.0
80,128,256,7168,30,0,11.8782,a8w8_bpreshuffle_cktile_0x0x8x4x1x0x0x0x0x2_16x64x512_1x4x1_16x16x64_default,39.55,237.25,0.0
80,256,7168,1536,46,0,25.3317,a8w8_bpreshuffle_cktile_0x0x8x4x1x0x0x0x0x2_64x128x128_1x4x1_16x16x64_default,222.53,595.04,0.0
80,256,7168,576,71,0,17.4843,a8w8_bpreshuffle_cktile_0x0x8x4x1x0x0x0x0x2_64x256x64_1x4x1_16x16x64_default,120.9,454.48,0.0
80,256,2048,7168,24,0,34.809,a8w8_bpreshuffle_cktile_0x0x8x4x1x0x0x0x0x1_64x128x256_1x4x1_16x16x64_default,215.93,504.57,0.0
80,256,7168,512,18,0,14.0471,a8w8_bpreshuffle_cktile_0x0x8x4x1x0x0x0x0x1_64x128x128_1x4x1_16x16x64_default,133.77,531.86,0.0
80,256,256,7168,2,0,12.0719,a8w8_bpreshuffle_cktile_0x0x8x4x1x0x0x0x0x1_16x64x512_1x4x1_16x16x64_default,77.83,314.87,0.0
80,512,7168,1536,48,0,42.1033,a8w8_bpreshuffle_cktile_0x0x8x4x1x0x0x0x0x2_64x256x128_1x4x1_16x16x64_default,267.78,454.51,0.0
80,512,7168,576,71,0,22.909,a8w8_bpreshuffle_cktile_0x0x8x4x1x0x0x0x0x2_64x256x64_1x4x1_16x16x64_default,184.55,513.5,0.0
80,512,2048,7168,24,0,55.1913,a8w8_bpreshuffle_cktile_0x0x8x4x1x0x0x0x0x1_64x128x256_1x4x1_16x16x64_default,272.37,370.48,0.0
80,512,7168,512,48,0,22.4995,a8w8_bpreshuffle_cktile_0x0x8x4x1x0x0x0x0x2_64x256x128_1x4x1_16x16x64_default,167.03,501.0,0.0
80,512,256,7168,9,0,14.8883,a8w8_bpreshuffle_cktile_0x0x8x4x1x0x0x0x0x1_32x64x512_1x4x1_16x16x64_default,126.21,387.36,0.0
80,1024,7168,1536,48,0,77.1567,a8w8_bpreshuffle_cktile_0x0x8x4x1x0x0x0x0x2_64x256x128_1x4x1_16x16x64_default,292.24,353.35,0.0
80,1024,7168,576,41,0,39.3022,a8w8_bpreshuffle_cktile_0x0x8x4x1x0x0x0x0x2_128x128x64_1x4x1_16x16x64_default,215.15,493.58,0.0
80,1024,2048,7168,18,0,100.866,a8w8_bpreshuffle_cktile_0x0x8x4x1x0x0x0x0x1_64x128x128_1x4x1_16x16x64_default,298.07,259.89,0.0
80,1024,7168,512,46,0,39.1797,a8w8_bpreshuffle_cktile_0x0x8x4x1x0x0x0x0x2_64x128x128_1x4x1_16x16x64_default,191.84,481.74,0.0
80,1024,256,7168,9,0,22.0293,a8w8_bpreshuffle_cktile_0x0x8x4x1x0x0x0x0x1_32x64x512_1x4x1_16x16x64_default,170.6,440.29,0.0
80,2048,7168,1536,41,0,143.6136,a8w8_bpreshuffle_cktile_0x0x8x4x1x0x0x0x0x2_128x128x64_1x4x1_16x16x64_default,314.02,303.01,0.0
80,2048,7168,576,41,0,69.2915,a8w8_bpreshuffle_cktile_0x0x8x4x1x0x0x0x0x2_128x128x64_1x4x1_16x16x64_default,244.06,500.33,0.0
80,2048,2048,7168,18,0,177.5591,a8w8_bpreshuffle_cktile_0x0x8x4x1x0x0x0x0x1_64x128x128_1x4x1_16x16x64_default,338.65,212.6,0.0
80,2048,7168,512,41,0,68.617,a8w8_bpreshuffle_cktile_0x0x8x4x1x0x0x0x0x2_128x128x64_1x4x1_16x16x64_default,219.08,496.65,0.0
80,2048,256,7168,24,0,35.1531,a8w8_bpreshuffle_cktile_0x0x8x4x1x0x0x0x0x1_64x128x256_1x4x1_16x16x64_default,213.81,499.63,0.0
80,4096,7168,1536,41,0,264.7829,a8w8_bpreshuffle_cktile_0x0x8x4x1x0x0x0x0x2_128x128x64_1x4x1_16x16x64_default,340.63,287.11,0.0
80,4096,7168,576,41,0,125.0143,a8w8_bpreshuffle_cktile_0x0x8x4x1x0x0x0x0x2_128x128x64_1x4x1_16x16x64_default,270.55,521.61,0.0
80,4096,2048,7168,18,0,322.9083,a8w8_bpreshuffle_cktile_0x0x8x4x1x0x0x0x0x1_64x128x128_1x4x1_16x16x64_default,372.42,188.34,0.0
80,4096,7168,512,41,0,124.4324,a8w8_bpreshuffle_cktile_0x0x8x4x1x0x0x0x0x2_128x128x64_1x4x1_16x16x64_default,241.62,518.25,0.0
80,4096,256,7168,24,0,55.334,a8w8_bpreshuffle_cktile_0x0x8x4x1x0x0x0x0x1_64x128x256_1x4x1_16x16x64_default,271.67,601.66,0.0
80,8192,7168,1536,41,0,503.6996,a8w8_bpreshuffle_cktile_0x0x8x4x1x0x0x0x0x2_128x128x64_1x4x1_16x16x64_default,358.13,280.0,0.0
80,8192,7168,576,41,0,236.1366,a8w8_bpreshuffle_cktile_0x0x8x4x1x0x0x0x0x2_128x128x64_1x4x1_16x16x64_default,286.47,534.81,0.0
80,8192,2048,7168,48,0,610.2692,a8w8_bpreshuffle_cktile_0x0x8x4x1x0x0x0x0x2_64x256x128_1x4x1_16x16x64_default,394.12,175.26,0.0
80,8192,7168,512,41,0,230.7146,a8w8_bpreshuffle_cktile_0x0x8x4x1x0x0x0x0x2_128x128x64_1x4x1_16x16x64_default,260.62,543.12,0.0
80,8192,256,7168,68,0,102.6022,a8w8_bpreshuffle_cktile_0x0x8x4x1x0x0x0x0x2_64x256x256_1x4x1_16x16x64_default,293.02,631.07,0.0
80,16384,7168,1536,41,0,995.5304,a8w8_bpreshuffle_cktile_0x0x8x4x1x0x0x0x0x2_128x128x64_1x4x1_16x16x64_default,362.4,272.27,0.0
80,16384,7168,576,41,0,461.9614,a8w8_bpreshuffle_cktile_0x0x8x4x1x0x0x0x0x2_128x128x64_1x4x1_16x16x64_default,292.86,537.81,0.0
80,16384,2048,7168,48,0,1211.3868,a8w8_bpreshuffle_cktile_0x0x8x4x1x0x0x0x0x2_64x256x128_1x4x1_16x16x64_default,397.1,164.46,0.0
80,16384,7168,512,41,0,448.4529,a8w8_bpreshuffle_cktile_0x0x8x4x1x0x0x0x0x2_128x128x64_1x4x1_16x16x64_default,268.16,550.65,0.0
80,16384,256,7168,24,0,182.3289,a8w8_bpreshuffle_cktile_0x0x8x4x1x0x0x0x0x1_64x128x256_1x4x1_16x16x64_default,329.79,700.19,0.0
80,5112,6912,5120,54,0,899.3494,a8w8_bpreshuffle_cktile_0x0x8x4x1x0x0x0x0x2_64x192x128_1x4x1_16x16x64_default,402.31,147.03,0.0
80,5104,5120,8192,48,0,1053.0629,a8w8_bpreshuffle_cktile_0x0x8x4x1x0x0x0x0x2_64x256x128_1x4x1_16x16x64_default,406.58,129.17,0.0
80,2048,4096,5120,18,0,234.6564,a8w8_bpreshuffle_cktile_0x0x8x4x1x0x0x0x0x1_64x128x128_1x4x1_16x16x64_default,366.06,205.55,0.0
80,5120,5120,4096,48,0,547.1132,a8w8_bpreshuffle_cktile_0x0x8x4x1x0x0x0x0x2_64x256x128_1x4x1_16x16x64_default,392.51,172.49,0.0
80,5120,5120,8192,48,0,1062.5069,a8w8_bpreshuffle_cktile_0x0x8x4x1x0x0x0x0x2_64x256x128_1x4x1_16x16x64_default,404.23,128.3,0.0
80,32,2112,7168,2,0,12.3951,a8w8_bpreshuffle_cktile_0x0x8x4x1x0x0x0x0x1_16x64x512_1x4x1_16x16x64_default,78.17,1250.77,0.0
80,64,2112,7168,9,0,14.9879,a8w8_bpreshuffle_cktile_0x0x8x4x1x0x0x0x0x1_32x64x512_1x4x1_16x16x64_default,129.29,1058.71,0.0
80,96,2112,7168,9,0,22.2991,a8w8_bpreshuffle_cktile_0x0x8x4x1x0x0x0x0x1_32x64x512_1x4x1_16x16x64_default,130.35,727.94,0.0
80,128,2112,7168,9,0,22.6786,a8w8_bpreshuffle_cktile_0x0x8x4x1x0x0x0x0x1_32x64x512_1x4x1_16x16x64_default,170.89,731.83,0.0
80,256,2112,7168,22,0,35.8442,a8w8_bpreshuffle_cktile_0x0x8x4x1x0x0x0x0x1_64x64x256_1x4x1_16x16x64_default,216.24,503.71,0.0
80,512,2112,7168,131,0,65.1728,a8w8_bpreshuffle_cktile_0x0x8x4x1x0x0x0x0x2_96x192x256_1x4x1_16x16x64_default,237.86,321.78,0.0
80,1024,2112,7168,121,0,107.0765,a8w8_bpreshuffle_cktile_0x0x8x4x1x0x0x0x0x2_160x192x128_1x4x1_16x16x64_default,289.55,250.33,0.0
80,2048,2112,7168,26,0,183.0673,a8w8_bpreshuffle_cktile_0x0x8x4x1x0x0x0x0x1_64x192x128_1x4x1_16x16x64_default,338.72,210.14,0.0
80,4096,2112,7168,54,0,319.8768,a8w8_bpreshuffle_cktile_0x0x8x4x1x0x0x0x0x2_64x192x128_1x4x1_16x16x64_default,387.7,193.2,0.0
80,8192,2112,7168,54,0,628.2407,a8w8_bpreshuffle_cktile_0x0x8x4x1x0x0x0x0x2_64x192x128_1x4x1_16x16x64_default,394.81,172.64,0.0
80,16384,2112,7168,54,0,1249.322,a8w8_bpreshuffle_cktile_0x0x8x4x1x0x0x0x0x2_64x192x128_1x4x1_16x16x64_default,397.07,161.52,0.0
