aiter/configs/a8w8_blockscale_tuned_gemm.csv
cu_num,M,N,K,libtype,kernelId,splitK,us,kernelName,tflops,bw,errRatio
256,1,2048,3072,ck,8,0,10.9445,a8w8_blockscale_1x128x128_256x16x64x256_16x16_16x16_1x1_16x16x1_16x16x1_1x16x1x16_4_1x1_intrawave_v1,1.15,575.51,0.0
256,2,2048,3072,ck,8,0,11.2588,a8w8_blockscale_1x128x128_256x16x64x256_16x16_16x16_1x1_16x16x1_16x16x1_1x16x1x16_4_1x1_intrawave_v1,2.24,560.08,0.0
256,4,2048,3072,ck,8,0,10.7627,a8w8_blockscale_1x128x128_256x16x64x256_16x16_16x16_1x1_16x16x1_16x16x1_1x16x1x16_4_1x1_intrawave_v1,4.68,587.23,0.0
256,8,2048,3072,ck,8,0,10.4386,a8w8_blockscale_1x128x128_256x16x64x256_16x16_16x16_1x1_16x16x1_16x16x1_1x16x1x16_4_1x1_intrawave_v1,9.64,608.2,0.0
256,16,2048,3072,ck,8,0,10.7826,a8w8_blockscale_1x128x128_256x16x64x256_16x16_16x16_1x1_16x16x1_16x16x1_1x16x1x16_4_1x1_intrawave_v1,18.67,594.12,0.0
256,24,2048,3072,ck,8,0,11.1659,a8w8_blockscale_1x128x128_256x16x64x256_16x16_16x16_1x1_16x16x1_16x16x1_1x16x1x16_4_1x1_intrawave_v1,27.05,578.86,0.0
256,32,2048,3072,ck,8,0,11.1999,a8w8_blockscale_1x128x128_256x16x64x256_16x16_16x16_1x1_16x16x1_16x16x1_1x16x1x16_4_1x1_intrawave_v1,35.95,582.22,0.0
256,40,2048,3072,ck,8,0,11.4245,a8w8_blockscale_1x128x128_256x16x64x256_16x16_16x16_1x1_16x16x1_16x16x1_1x16x1x16_4_1x1_intrawave_v1,44.06,575.8,0.0
256,48,2048,3072,ck,8,0,11.1586,a8w8_blockscale_1x128x128_256x16x64x256_16x16_16x16_1x1_16x16x1_16x16x1_1x16x1x16_4_1x1_intrawave_v1,54.13,594.66,0.0
256,56,2048,3072,ck,8,0,11.1884,a8w8_blockscale_1x128x128_256x16x64x256_16x16_16x16_1x1_16x16x1_16x16x1_1x16x1x16_4_1x1_intrawave_v1,62.98,598.2,0.0
256,64,2048,3072,ck,8,0,11.0536,a8w8_blockscale_1x128x128_256x16x64x256_16x16_16x16_1x1_16x16x1_16x16x1_1x16x1x16_4_1x1_intrawave_v1,72.85,610.68,0.0
256,72,2048,3072,ck,8,0,11.2475,a8w8_blockscale_1x128x128_256x16x64x256_16x16_16x16_1x1_16x16x1_16x16x1_1x16x1x16_4_1x1_intrawave_v1,80.55,605.25,0.0
256,80,2048,3072,ck,8,0,10.5898,a8w8_blockscale_1x128x128_256x16x64x256_16x16_16x16_1x1_16x16x1_16x16x1_1x16x1x16_4_1x1_intrawave_v1,95.06,648.26,0.0
256,88,2048,3072,ck,7,0,11.3783,a8w8_blockscale_1x128x128_256x16x128x256_16x16_16x16_1x2_16x16x1_16x16x1_1x16x1x16_8_1x2_intrawave_v1,97.32,608.37,0.0
256,96,2048,3072,ck,18,0,11.4977,a8w8_blockscale_1x128x128_256x64x64x256_16x16_32x32_1x1_16x16x1_16x16x1_1x32x1x8_8_1x1_intrawave_v1,105.06,607.04,0.0
256,104,2048,3072,ck,8,0,11.0495,a8w8_blockscale_1x128x128_256x16x64x256_16x16_16x16_1x1_16x16x1_16x16x1_1x16x1x16_4_1x1_intrawave_v1,118.43,636.85,0.0
256,112,2048,3072,ck,8,0,11.425,a8w8_blockscale_1x128x128_256x16x64x256_16x16_16x16_1x1_16x16x1_16x16x1_1x16x1x16_4_1x1_intrawave_v1,123.35,620.94,0.0
256,120,2048,3072,ck,8,0,11.2775,a8w8_blockscale_1x128x128_256x16x64x256_16x16_16x16_1x1_16x16x1_16x16x1_1x16x1x16_4_1x1_intrawave_v1,133.89,634.15,0.0
256,128,2048,3072,ck,8,0,10.3035,a8w8_blockscale_1x128x128_256x16x64x256_16x16_16x16_1x1_16x16x1_16x16x1_1x16x1x16_4_1x1_intrawave_v1,156.32,699.66,0.0
256,136,2048,3072,ck,8,0,11.0152,a8w8_blockscale_1x128x128_256x16x64x256_16x16_16x16_1x1_16x16x1_16x16x1_1x16x1x16_4_1x1_intrawave_v1,155.36,659.66,0.0
256,144,2048,3072,ck,8,0,11.1456,a8w8_blockscale_1x128x128_256x16x64x256_16x16_16x16_1x1_16x16x1_16x16x1_1x16x1x16_4_1x1_intrawave_v1,162.57,657.09,0.0
256,152,2048,3072,ck,7,0,11.2815,a8w8_blockscale_1x128x128_256x16x128x256_16x16_16x16_1x2_16x16x1_16x16x1_1x16x1x16_8_1x2_intrawave_v1,169.53,654.26,0.0
256,160,2048,3072,ck,8,0,11.4242,a8w8_blockscale_1x128x128_256x16x64x256_16x16_16x16_1x1_16x16x1_16x16x1_1x16x1x16_4_1x1_intrawave_v1,176.23,651.1,0.0
256,168,2048,3072,ck,7,0,11.6217,a8w8_blockscale_1x128x128_256x16x128x256_16x16_16x16_1x2_16x16x1_16x16x1_1x16x1x16_8_1x2_intrawave_v1,181.9,644.97,0.0
256,176,2048,3072,ck,7,0,11.5732,a8w8_blockscale_1x128x128_256x16x128x256_16x16_16x16_1x2_16x16x1_16x16x1_1x16x1x16_8_1x2_intrawave_v1,191.36,652.63,0.0
256,184,2048,3072,ck,18,0,11.5395,a8w8_blockscale_1x128x128_256x64x64x256_16x16_32x32_1x1_16x16x1_16x16x1_1x32x1x8_8_1x1_intrawave_v1,200.64,659.51,0.0
256,192,2048,3072,ck,7,0,11.2847,a8w8_blockscale_1x128x128_256x16x128x256_16x16_16x16_1x2_16x16x1_16x16x1_1x16x1x16_8_1x2_intrawave_v1,214.09,679.48,0.0
256,200,2048,3072,ck,18,0,11.5043,a8w8_blockscale_1x128x128_256x64x64x256_16x16_32x32_1x1_16x16x1_16x16x1_1x32x1x8_8_1x1_intrawave_v1,218.75,671.49,0.0
256,208,2048,3072,ck,7,0,11.4884,a8w8_blockscale_1x128x128_256x16x128x256_16x16_16x16_1x2_16x16x1_16x16x1_1x16x1x16_8_1x2_intrawave_v1,227.82,677.41,0.0
256,216,2048,3072,ck,7,0,11.5296,a8w8_blockscale_1x128x128_256x16x128x256_16x16_16x16_1x2_16x16x1_16x16x1_1x16x1x16_8_1x2_intrawave_v1,235.73,679.97,0.0
256,224,2048,3072,ck,7,0,11.4084,a8w8_blockscale_1x128x128_256x16x128x256_16x16_16x16_1x2_16x16x1_16x16x1_1x16x1x16_8_1x2_intrawave_v1,247.06,692.22,0.0
256,232,2048,3072,ck,18,0,11.5751,a8w8_blockscale_1x128x128_256x64x64x256_16x16_32x32_1x1_16x16x1_16x16x1_1x32x1x8_8_1x1_intrawave_v1,252.2,687.2,0.0
256,240,2048,3072,ck,18,0,11.6395,a8w8_blockscale_1x128x128_256x64x64x256_16x16_32x32_1x1_16x16x1_16x16x1_1x32x1x8_8_1x1_intrawave_v1,259.45,688.33,0.0
256,248,2048,3072,ck,7,0,11.182,a8w8_blockscale_1x128x128_256x16x128x256_16x16_16x16_1x2_16x16x1_16x16x1_1x16x1x16_8_1x2_intrawave_v1,279.07,721.62,0.0
256,256,2048,3072,ck,18,0,11.6116,a8w8_blockscale_1x128x128_256x64x64x256_16x16_32x32_1x1_16x16x1_16x16x1_1x32x1x8_8_1x1_intrawave_v1,277.41,699.86,0.0
256,272,2048,3072,ck,18,0,11.6657,a8w8_blockscale_1x128x128_256x64x64x256_16x16_32x32_1x1_16x16x1_16x16x1_1x32x1x8_8_1x1_intrawave_v1,293.39,706.44,0.0
256,288,2048,3072,ck,18,0,11.6347,a8w8_blockscale_1x128x128_256x64x64x256_16x16_32x32_1x1_16x16x1_16x16x1_1x32x1x8_8_1x1_intrawave_v1,311.47,718.18,0.0
256,304,2048,3072,ck,18,0,11.6587,a8w8_blockscale_1x128x128_256x64x64x256_16x16_32x32_1x1_16x16x1_16x16x1_1x32x1x8_8_1x1_intrawave_v1,328.1,726.54,0.0
256,320,2048,3072,ck,18,0,11.6383,a8w8_blockscale_1x128x128_256x64x64x256_16x16_32x32_1x1_16x16x1_16x16x1_1x32x1x8_8_1x1_intrawave_v1,345.97,737.67,0.0
256,336,2048,3072,ck,18,0,11.8074,a8w8_blockscale_1x128x128_256x64x64x256_16x16_32x32_1x1_16x16x1_16x16x1_1x32x1x8_8_1x1_intrawave_v1,358.07,736.82,0.0
256,352,2048,3072,ck,18,0,11.5864,a8w8_blockscale_1x128x128_256x64x64x256_16x16_32x32_1x1_16x16x1_16x16x1_1x32x1x8_8_1x1_intrawave_v1,382.27,760.77,0.0
256,368,2048,3072,ck,18,0,11.7379,a8w8_blockscale_1x128x128_256x64x64x256_16x16_32x32_1x1_16x16x1_16x16x1_1x32x1x8_8_1x1_intrawave_v1,394.49,760.72,0.0
256,384,2048,3072,ck,18,0,12.1539,a8w8_blockscale_1x128x128_256x64x64x256_16x16_32x32_1x1_16x16x1_16x16x1_1x32x1x8_8_1x1_intrawave_v1,397.55,744.12,0.0
256,400,2048,3072,ck,12,0,12.6567,a8w8_blockscale_1x128x128_256x32x128x256_16x16_32x32_1x1_16x16x1_16x16x1_1x32x1x8_8_1x1_intrawave_v1,397.67,723.62,0.0
256,416,2048,3072,ck,18,0,11.7269,a8w8_blockscale_1x128x128_256x64x64x256_16x16_32x32_1x1_16x16x1_16x16x1_1x32x1x8_8_1x1_intrawave_v1,446.37,790.78,0.0
256,432,2048,3072,ck,18,0,11.8508,a8w8_blockscale_1x128x128_256x64x64x256_16x16_32x32_1x1_16x16x1_16x16x1_1x32x1x8_8_1x1_intrawave_v1,458.69,792.19,0.0
256,448,2048,3072,ck,18,0,11.7467,a8w8_blockscale_1x128x128_256x64x64x256_16x16_32x32_1x1_16x16x1_16x16x1_1x32x1x8_8_1x1_intrawave_v1,479.89,808.97,0.0
256,464,2048,3072,ck,18,0,11.955,a8w8_blockscale_1x128x128_256x64x64x256_16x16_32x32_1x1_16x16x1_16x16x1_1x32x1x8_8_1x1_intrawave_v1,488.37,804.47,0.0
256,480,2048,3072,ck,18,0,12.3829,a8w8_blockscale_1x128x128_256x64x64x256_16x16_32x32_1x1_16x16x1_16x16x1_1x32x1x8_8_1x1_intrawave_v1,487.75,785.93,0.0
256,496,2048,3072,ck,18,0,12.3999,a8w8_blockscale_1x128x128_256x64x64x256_16x16_32x32_1x1_16x16x1_16x16x1_1x32x1x8_8_1x1_intrawave_v1,503.32,794.1,0.0
256,512,2048,3072,ck,18,0,11.7797,a8w8_blockscale_1x128x128_256x64x64x256_16x16_32x32_1x1_16x16x1_16x16x1_1x32x1x8_8_1x1_intrawave_v1,546.91,845.65,0.0
256,1000,2048,3072,ck,18,0,18.0286,a8w8_blockscale_1x128x128_256x64x64x256_16x16_32x32_1x1_16x16x1_16x16x1_1x32x1x8_8_1x1_intrawave_v1,697.94,746.56,0.0
256,1001,2048,3072,ck,18,0,17.9109,a8w8_blockscale_1x128x128_256x64x64x256_16x16_32x32_1x1_16x16x1_16x16x1_1x32x1x8_8_1x1_intrawave_v1,703.23,751.87,0.0
256,1002,2048,3072,ck,18,0,17.8483,a8w8_blockscale_1x128x128_256x64x64x256_16x16_32x32_1x1_16x16x1_16x16x1_1x32x1x8_8_1x1_intrawave_v1,706.4,754.91,0.0
256,1003,2048,3072,ck,18,0,17.7767,a8w8_blockscale_1x128x128_256x64x64x256_16x16_32x32_1x1_16x16x1_16x16x1_1x32x1x8_8_1x1_intrawave_v1,709.96,758.35,0.0
256,1004,2048,3072,ck,18,0,18.2137,a8w8_blockscale_1x128x128_256x64x64x256_16x16_32x32_1x1_16x16x1_16x16x1_1x32x1x8_8_1x1_intrawave_v1,693.61,740.55,0.0
256,1005,2048,3072,ck,18,0,18.0366,a8w8_blockscale_1x128x128_256x64x64x256_16x16_32x32_1x1_16x16x1_16x16x1_1x32x1x8_8_1x1_intrawave_v1,701.12,748.22,0.0
256,1025,2048,3072,ck,18,0,22.4361,a8w8_blockscale_1x128x128_256x64x64x256_16x16_32x32_1x1_16x16x1_16x16x1_1x32x1x8_8_1x1_intrawave_v1,574.85,607.89,0.0
256,1029,2048,3072,ck,18,0,22.6741,a8w8_blockscale_1x128x128_256x64x64x256_16x16_32x32_1x1_16x16x1_16x16x1_1x32x1x8_8_1x1_intrawave_v1,571.04,602.77,0.0
256,1030,2048,3072,ck,18,0,22.5404,a8w8_blockscale_1x128x128_256x64x64x256_16x16_32x32_1x1_16x16x1_16x16x1_1x32x1x8_8_1x1_intrawave_v1,574.99,606.67,0.0
256,1031,2048,3072,ck,18,0,22.4632,a8w8_blockscale_1x128x128_256x64x64x256_16x16_32x32_1x1_16x16x1_16x16x1_1x32x1x8_8_1x1_intrawave_v1,577.52,609.07,0.0
256,1034,2048,3072,ck,18,0,22.4285,a8w8_blockscale_1x128x128_256x64x64x256_16x16_32x32_1x1_16x16x1_16x16x1_1x32x1x8_8_1x1_intrawave_v1,580.1,610.97,0.0
256,1122,2048,3072,ck,18,0,22.5779,a8w8_blockscale_1x128x128_256x64x64x256_16x16_32x32_1x1_16x16x1_16x16x1_1x32x1x8_8_1x1_intrawave_v1,625.3,634.87,0.0
256,1163,2048,3072,ck,18,0,22.5987,a8w8_blockscale_1x128x128_256x64x64x256_16x16_32x32_1x1_16x16x1_16x16x1_1x32x1x8_8_1x1_intrawave_v1,647.56,647.29,0.0
256,1738,2048,3072,ck,0,0,26.9987,a8w8_blockscale_1x128x128_256x128x128x128_16x16_32x32_2x2_8x32x1_8x32x1_1x32x1x8_8_1x1_intrawave_v3,810.01,694.46,0.0
256,1743,2048,3072,ck,0,0,26.986,a8w8_blockscale_1x128x128_256x128x128x128_16x16_32x32_2x2_8x32x1_8x32x1_1x32x1x8_8_1x1_intrawave_v3,812.72,696.11,0.0
256,2000,2048,3072,ck,0,0,27.7591,a8w8_blockscale_1x128x128_256x128x128x128_16x16_32x32_2x2_8x32x1_8x32x1_1x32x1x8_8_1x1_intrawave_v3,906.58,743.09,0.0
256,2001,2048,3072,ck,0,0,27.8,a8w8_blockscale_1x128x128_256x128x128x128_16x16_32x32_2x2_8x32x1_8x32x1_1x32x1x8_8_1x1_intrawave_v3,905.7,742.25,0.0
256,2002,2048,3072,ck,0,0,27.7265,a8w8_blockscale_1x128x128_256x128x128x128_16x16_32x32_2x2_8x32x1_8x32x1_1x32x1x8_8_1x1_intrawave_v3,908.55,744.48,0.0
256,2004,2048,3072,ck,0,0,27.684,a8w8_blockscale_1x128x128_256x128x128x128_16x16_32x32_2x2_8x32x1_8x32x1_1x32x1x8_8_1x1_intrawave_v3,910.86,746.14,0.0
256,2006,2048,3072,ck,0,0,27.9224,a8w8_blockscale_1x128x128_256x128x128x128_16x16_32x32_2x2_8x32x1_8x32x1_1x32x1x8_8_1x1_intrawave_v3,903.98,740.28,0.0
256,2029,2048,3072,ck,0,0,28.1135,a8w8_blockscale_1x128x128_256x128x128x128_16x16_32x32_2x2_8x32x1_8x32x1_1x32x1x8_8_1x1_intrawave_v3,908.13,741.11,0.0
256,2030,2048,3072,ck,0,0,28.0009,a8w8_blockscale_1x128x128_256x128x128x128_16x16_32x32_2x2_8x32x1_8x32x1_1x32x1x8_8_1x1_intrawave_v3,912.23,744.35,0.0
256,2055,2048,3072,ck,18,0,36.2672,a8w8_blockscale_1x128x128_256x64x64x256_16x16_32x32_1x1_16x16x1_16x16x1_1x32x1x8_8_1x1_intrawave_v1,712.98,579.63,0.0
256,2060,2048,3072,ck,18,0,35.6379,a8w8_blockscale_1x128x128_256x64x64x256_16x16_32x32_1x1_16x16x1_16x16x1_1x32x1x8_8_1x1_intrawave_v1,727.34,590.87,0.0
256,2062,2048,3072,ck,18,0,35.1724,a8w8_blockscale_1x128x128_256x64x64x256_16x16_32x32_1x1_16x16x1_16x16x1_1x32x1x8_8_1x1_intrawave_v1,737.68,599.1,0.0
256,2157,2048,3072,ck,18,0,36.4396,a8w8_blockscale_1x128x128_256x64x64x256_16x16_32x32_1x1_16x16x1_16x16x1_1x32x1x8_8_1x1_intrawave_v1,744.83,596.96,0.0
256,2158,2048,3072,ck,18,0,36.2376,a8w8_blockscale_1x128x128_256x64x64x256_16x16_32x32_1x1_16x16x1_16x16x1_1x32x1x8_8_1x1_intrawave_v1,749.33,600.48,0.0
256,2201,2048,3072,ck,18,0,36.4788,a8w8_blockscale_1x128x128_256x64x64x256_16x16_32x32_1x1_16x16x1_16x16x1_1x32x1x8_8_1x1_intrawave_v1,759.21,604.96,0.0
256,2213,2048,3072,ck,18,0,36.5192,a8w8_blockscale_1x128x128_256x64x64x256_16x16_32x32_1x1_16x16x1_16x16x1_1x32x1x8_8_1x1_intrawave_v1,762.5,606.65,0.0
256,2230,2048,3072,ck,18,0,35.9728,a8w8_blockscale_1x128x128_256x64x64x256_16x16_32x32_1x1_16x16x1_16x16x1_1x32x1x8_8_1x1_intrawave_v1,780.03,619.25,0.0
256,2240,2048,3072,ck,18,0,35.9812,a8w8_blockscale_1x128x128_256x64x64x256_16x16_32x32_1x1_16x16x1_16x16x1_1x32x1x8_8_1x1_intrawave_v1,783.35,621.1,0.0
256,2243,2048,3072,ck,18,0,36.99,a8w8_blockscale_1x128x128_256x64x64x256_16x16_32x32_1x1_16x16x1_16x16x1_1x32x1x8_8_1x1_intrawave_v1,763.0,604.74,0.0
256,2256,2048,3072,ck,18,0,36.6576,a8w8_blockscale_1x128x128_256x64x64x256_16x16_32x32_1x1_16x16x1_16x16x1_1x32x1x8_8_1x1_intrawave_v1,774.38,612.76,0.0
256,2335,2048,3072,ck,18,0,36.9572,a8w8_blockscale_1x128x128_256x64x64x256_16x16_32x32_1x1_16x16x1_16x16x1_1x32x1x8_8_1x1_intrawave_v1,795.0,623.12,0.0
256,2415,2048,3072,ck,18,0,36.6404,a8w8_blockscale_1x128x128_256x64x64x256_16x16_32x32_1x1_16x16x1_16x16x1_1x32x1x8_8_1x1_intrawave_v1,829.35,644.16,0.0
256,2478,2048,3072,ck,18,0,36.8444,a8w8_blockscale_1x128x128_256x64x64x256_16x16_32x32_1x1_16x16x1_16x16x1_1x32x1x8_8_1x1_intrawave_v1,846.27,652.85,0.0
256,2735,2048,3072,ck,0,0,39.3931,a8w8_blockscale_1x128x128_256x128x128x128_16x16_32x32_2x2_8x32x1_8x32x1_1x32x1x8_8_1x1_intrawave_v3,873.61,657.37,0.0
256,2741,2048,3072,ck,0,0,39.7047,a8w8_blockscale_1x128x128_256x128x128x128_16x16_32x32_2x2_8x32x1_8x32x1_1x32x1x8_8_1x1_intrawave_v3,868.66,653.3,0.0
256,3000,2048,3072,ck,0,0,40.4081,a8w8_blockscale_1x128x128_256x128x128x128_16x16_32x32_2x2_8x32x1_8x32x1_1x32x1x8_8_1x1_intrawave_v3,934.19,687.87,0.0
256,3001,2048,3072,ck,0,0,41.179,a8w8_blockscale_1x128x128_256x128x128x128_16x16_32x32_2x2_8x32x1_8x32x1_1x32x1x8_8_1x1_intrawave_v3,917.0,675.17,0.0
256,3004,2048,3072,ck,0,0,40.9297,a8w8_blockscale_1x128x128_256x128x128x128_16x16_32x32_2x2_8x32x1_8x32x1_1x32x1x8_8_1x1_intrawave_v3,923.51,679.8,0.0
256,3005,2048,3072,ck,0,0,40.5895,a8w8_blockscale_1x128x128_256x128x128x128_16x16_32x32_2x2_8x32x1_8x32x1_1x32x1x8_8_1x1_intrawave_v3,931.56,685.68,0.0
256,3006,2048,3072,ck,0,0,41.0552,a8w8_blockscale_1x128x128_256x128x128x128_16x16_32x32_2x2_8x32x1_8x32x1_1x32x1x8_8_1x1_intrawave_v3,921.3,678.07,0.0
256,3011,2048,3072,ck,0,0,40.405,a8w8_blockscale_1x128x128_256x128x128x128_16x16_32x32_2x2_8x32x1_8x32x1_1x32x1x8_8_1x1_intrawave_v3,937.68,689.87,0.0
256,3049,2048,3072,ck,0,0,40.9055,a8w8_blockscale_1x128x128_256x128x128x128_16x16_32x32_2x2_8x32x1_8x32x1_1x32x1x8_8_1x1_intrawave_v3,937.9,688.09,0.0
256,3063,2048,3072,ck,0,0,40.8429,a8w8_blockscale_1x128x128_256x128x128x128_16x16_32x32_2x2_8x32x1_8x32x1_1x32x1x8_8_1x1_intrawave_v3,943.65,691.6,0.0
256,3093,2048,3072,ck,0,0,40.6197,a8w8_blockscale_1x128x128_256x128x128x128_16x16_32x32_2x2_8x32x1_8x32x1_1x32x1x8_8_1x1_intrawave_v3,958.13,700.7,0.0
256,3120,2048,3072,ck,0,0,41.1434,a8w8_blockscale_1x128x128_256x128x128x128_16x16_32x32_2x2_8x32x1_8x32x1_1x32x1x8_8_1x1_intrawave_v3,954.19,696.48,0.0
256,3200,2048,3072,ck,0,0,40.5316,a8w8_blockscale_1x128x128_256x128x128x128_16x16_32x32_2x2_8x32x1_8x32x1_1x32x1x8_8_1x1_intrawave_v3,993.43,721.14,0.0
256,3230,2048,3072,ck,0,0,41.7716,a8w8_blockscale_1x128x128_256x128x128x128_16x16_32x32_2x2_8x32x1_8x32x1_1x32x1x8_8_1x1_intrawave_v3,972.98,704.88,0.0
256,3509,2048,3072,ck,0,0,41.9512,a8w8_blockscale_1x128x128_256x128x128x128_16x16_32x32_2x2_8x32x1_8x32x1_1x32x1x8_8_1x1_intrawave_v3,1052.5,749.54,0.0
256,3862,2048,3072,ck,0,0,45.8537,a8w8_blockscale_1x128x128_256x128x128x128_16x16_32x32_2x2_8x32x1_8x32x1_1x32x1x8_8_1x1_intrawave_v3,1059.79,740.93,0.0
256,3904,2048,3072,ck,0,0,44.9443,a8w8_blockscale_1x128x128_256x128x128x128_16x16_32x32_2x2_8x32x1_8x32x1_1x32x1x8_8_1x1_intrawave_v3,1092.99,762.62,0.0
256,3922,2048,3072,ck,0,0,46.2949,a8w8_blockscale_1x128x128_256x128x128x128_16x16_32x32_2x2_8x32x1_8x32x1_1x32x1x8_8_1x1_intrawave_v3,1066.0,743.16,0.0
256,4000,2048,3072,ck,0,0,45.7541,a8w8_blockscale_1x128x128_256x128x128x128_16x16_32x32_2x2_8x32x1_8x32x1_1x32x1x8_8_1x1_intrawave_v3,1100.05,764.16,0.0
256,4001,2048,3072,ck,0,0,46.1557,a8w8_blockscale_1x128x128_256x128x128x128_16x16_32x32_2x2_8x32x1_8x32x1_1x32x1x8_8_1x1_intrawave_v3,1090.75,757.67,0.0
256,4002,2048,3072,ck,0,0,46.5557,a8w8_blockscale_1x128x128_256x128x128x128_16x16_32x32_2x2_8x32x1_8x32x1_1x32x1x8_8_1x1_intrawave_v3,1081.65,751.31,0.0
256,4004,2048,3072,ck,0,0,45.9797,a8w8_blockscale_1x128x128_256x128x128x128_16x16_32x32_2x2_8x32x1_8x32x1_1x32x1x8_8_1x1_intrawave_v3,1095.74,761.03,0.0
256,4007,2048,3072,ck,0,0,46.7097,a8w8_blockscale_1x128x128_256x128x128x128_16x16_32x32_2x2_8x32x1_8x32x1_1x32x1x8_8_1x1_intrawave_v3,1079.43,749.6,0.0
256,4032,2048,3072,ck,0,0,45.6841,a8w8_blockscale_1x128x128_256x128x128x128_16x16_32x32_2x2_8x32x1_8x32x1_1x32x1x8_8_1x1_intrawave_v3,1110.55,770.35,0.0
256,4042,2048,3072,ck,0,0,46.8141,a8w8_blockscale_1x128x128_256x128x128x128_16x16_32x32_2x2_8x32x1_8x32x1_1x32x1x8_8_1x1_intrawave_v3,1086.43,753.29,0.0
256,4064,2048,3072,ck,0,0,47.0685,a8w8_blockscale_1x128x128_256x128x128x128_16x16_32x32_2x2_8x32x1_8x32x1_1x32x1x8_8_1x1_intrawave_v3,1086.44,752.57,0.0
256,4092,2048,3072,ck,0,0,47.7577,a8w8_blockscale_1x128x128_256x128x128x128_16x16_32x32_2x2_8x32x1_8x32x1_1x32x1x8_8_1x1_intrawave_v3,1078.14,745.91,0.0
256,4159,2048,3072,ck,0,0,61.0533,a8w8_blockscale_1x128x128_256x128x128x128_16x16_32x32_2x2_8x32x1_8x32x1_1x32x1x8_8_1x1_intrawave_v3,857.16,591.34,0.0
256,4207,2048,3072,ck,0,0,61.4912,a8w8_blockscale_1x128x128_256x128x128x128_16x16_32x32_2x2_8x32x1_8x32x1_1x32x1x8_8_1x1_intrawave_v3,860.88,592.72,0.0
256,4248,2048,3072,ck,0,0,61.8301,a8w8_blockscale_1x128x128_256x128x128x128_16x16_32x32_2x2_8x32x1_8x32x1_1x32x1x8_8_1x1_intrawave_v3,864.5,594.23,0.0
256,4462,2048,3072,ck,0,0,60.8514,a8w8_blockscale_1x128x128_256x128x128x128_16x16_32x32_2x2_8x32x1_8x32x1_1x32x1x8_8_1x1_intrawave_v3,922.66,628.99,0.0
256,4476,2048,3072,ck,0,0,60.4476,a8w8_blockscale_1x128x128_256x128x128x128_16x16_32x32_2x2_8x32x1_8x32x1_1x32x1x8_8_1x1_intrawave_v3,931.73,634.85,0.0
256,4883,2048,3072,ck,0,0,61.6855,a8w8_blockscale_1x128x128_256x128x128x128_16x16_32x32_2x2_8x32x1_8x32x1_1x32x1x8_8_1x1_intrawave_v3,996.06,669.41,0.0
256,4915,2048,3072,ck,0,0,61.8321,a8w8_blockscale_1x128x128_256x128x128x128_16x16_32x32_2x2_8x32x1_8x32x1_1x32x1x8_8_1x1_intrawave_v3,1000.21,671.53,0.0
256,5000,2048,3072,ck,0,0,62.495,a8w8_blockscale_1x128x128_256x128x128x128_16x16_32x32_2x2_8x32x1_8x32x1_1x32x1x8_8_1x1_intrawave_v3,1006.71,674.16,0.0
256,5001,2048,3072,ck,0,0,63.0338,a8w8_blockscale_1x128x128_256x128x128x128_16x16_32x32_2x2_8x32x1_8x32x1_1x32x1x8_8_1x1_intrawave_v3,998.31,668.51,0.0
256,5003,2048,3072,ck,0,0,63.6518,a8w8_blockscale_1x128x128_256x128x128x128_16x16_32x32_2x2_8x32x1_8x32x1_1x32x1x8_8_1x1_intrawave_v3,989.01,662.24,0.0
256,5005,2048,3072,ck,0,0,62.9438,a8w8_blockscale_1x128x128_256x128x128x128_16x16_32x32_2x2_8x32x1_8x32x1_1x32x1x8_8_1x1_intrawave_v3,1000.53,669.92,0.0
256,5007,2048,3072,ck,0,0,62.1302,a8w8_blockscale_1x128x128_256x128x128x128_16x16_32x32_2x2_8x32x1_8x32x1_1x32x1x8_8_1x1_intrawave_v3,1014.04,678.92,0.0
256,5013,2048,3072,ck,0,0,61.957,a8w8_blockscale_1x128x128_256x128x128x128_16x16_32x32_2x2_8x32x1_8x32x1_1x32x1x8_8_1x1_intrawave_v3,1018.1,681.52,0.0
256,5017,2048,3072,ck,0,0,62.5917,a8w8_blockscale_1x128x128_256x128x128x128_16x16_32x32_2x2_8x32x1_8x32x1_1x32x1x8_8_1x1_intrawave_v3,1008.58,675.06,0.0
256,5031,2048,3072,ck,0,0,63.2302,a8w8_blockscale_1x128x128_256x128x128x128_16x16_32x32_2x2_8x32x1_8x32x1_1x32x1x8_8_1x1_intrawave_v3,1001.18,669.83,0.0
256,5038,2048,3072,ck,0,0,62.2333,a8w8_blockscale_1x128x128_256x128x128x128_16x16_32x32_2x2_8x32x1_8x32x1_1x32x1x8_8_1x1_intrawave_v3,1018.63,681.37,0.0
256,5044,2048,3072,ck,0,0,62.9086,a8w8_blockscale_1x128x128_256x128x128x128_16x16_32x32_2x2_8x32x1_8x32x1_1x32x1x8_8_1x1_intrawave_v3,1008.9,674.74,0.0
256,5071,2048,3072,ck,0,0,62.664,a8w8_blockscale_1x128x128_256x128x128x128_16x16_32x32_2x2_8x32x1_8x32x1_1x32x1x8_8_1x1_intrawave_v3,1018.26,680.46,0.0
256,5083,2048,3072,ck,0,0,63.1806,a8w8_blockscale_1x128x128_256x128x128x128_16x16_32x32_2x2_8x32x1_8x32x1_1x32x1x8_8_1x1_intrawave_v3,1012.32,676.26,0.0
256,5087,2048,3072,ck,0,0,63.103,a8w8_blockscale_1x128x128_256x128x128x128_16x16_32x32_2x2_8x32x1_8x32x1_1x32x1x8_8_1x1_intrawave_v3,1014.36,677.54,0.0
256,5091,2048,3072,ck,0,0,62.5881,a8w8_blockscale_1x128x128_256x128x128x128_16x16_32x32_2x2_8x32x1_8x32x1_1x32x1x8_8_1x1_intrawave_v3,1023.51,683.58,0.0
256,5102,2048,3072,ck,0,0,63.6516,a8w8_blockscale_1x128x128_256x128x128x128_16x16_32x32_2x2_8x32x1_8x32x1_1x32x1x8_8_1x1_intrawave_v3,1008.58,673.39,0.0
256,5119,2048,3072,ck,0,0,63.5642,a8w8_blockscale_1x128x128_256x128x128x128_16x16_32x32_2x2_8x32x1_8x32x1_1x32x1x8_8_1x1_intrawave_v3,1013.34,676.24,0.0
256,5120,2048,3072,ck,0,0,62.6002,a8w8_blockscale_1x128x128_256x128x128x128_16x16_32x32_2x2_8x32x1_8x32x1_1x32x1x8_8_1x1_intrawave_v3,1029.14,686.76,0.0
256,5122,2048,3072,ck,0,0,63.681,a8w8_blockscale_1x128x128_256x128x128x128_16x16_32x32_2x2_8x32x1_8x32x1_1x32x1x8_8_1x1_intrawave_v3,1012.07,675.33,0.0
256,5127,2048,3072,ck,0,0,62.8158,a8w8_blockscale_1x128x128_256x128x128x128_16x16_32x32_2x2_8x32x1_8x32x1_1x32x1x8_8_1x1_intrawave_v3,1027.01,685.21,0.0
256,5159,2048,3072,ck,0,0,63.5646,a8w8_blockscale_1x128x128_256x128x128x128_16x16_32x32_2x2_8x32x1_8x32x1_1x32x1x8_8_1x1_intrawave_v3,1021.25,680.74,0.0
256,5191,2048,3072,ck,0,0,62.8494,a8w8_blockscale_1x128x128_256x128x128x128_16x16_32x32_2x2_8x32x1_8x32x1_1x32x1x8_8_1x1_intrawave_v3,1039.28,692.14,0.0
256,5237,2048,3072,ck,0,0,63.1498,a8w8_blockscale_1x128x128_256x128x128x128_16x16_32x32_2x2_8x32x1_8x32x1_1x32x1x8_8_1x1_intrawave_v3,1043.5,694.07,0.0
256,5251,2048,3072,ck,0,0,64.4378,a8w8_blockscale_1x128x128_256x128x128x128_16x16_32x32_2x2_8x32x1_8x32x1_1x32x1x8_8_1x1_intrawave_v3,1025.37,681.75,0.0
256,5255,2048,3072,ck,0,0,63.9038,a8w8_blockscale_1x128x128_256x128x128x128_16x16_32x32_2x2_8x32x1_8x32x1_1x32x1x8_8_1x1_intrawave_v3,1034.73,687.9,0.0
256,5418,2048,3072,ck,0,0,65.1199,a8w8_blockscale_1x128x128_256x128x128x128_16x16_32x32_2x2_8x32x1_8x32x1_1x32x1x8_8_1x1_intrawave_v3,1046.9,692.99,0.0
256,5498,2048,3072,ck,0,0,64.6198,a8w8_blockscale_1x128x128_256x128x128x128_16x16_32x32_2x2_8x32x1_8x32x1_1x32x1x8_8_1x1_intrawave_v3,1070.58,707.23,0.0
256,5505,2048,3072,ck,0,0,66.1202,a8w8_blockscale_1x128x128_256x128x128x128_16x16_32x32_2x2_8x32x1_8x32x1_1x32x1x8_8_1x1_intrawave_v3,1047.62,691.94,0.0
256,5511,2048,3072,ck,0,0,66.0978,a8w8_blockscale_1x128x128_256x128x128x128_16x16_32x32_2x2_8x32x1_8x32x1_1x32x1x8_8_1x1_intrawave_v3,1049.12,692.83,0.0
256,5542,2048,3072,ck,0,0,65.8842,a8w8_blockscale_1x128x128_256x128x128x128_16x16_32x32_2x2_8x32x1_8x32x1_1x32x1x8_8_1x1_intrawave_v3,1058.44,698.45,0.0
256,5591,2048,3072,ck,0,0,65.779,a8w8_blockscale_1x128x128_256x128x128x128_16x16_32x32_2x2_8x32x1_8x32x1_1x32x1x8_8_1x1_intrawave_v3,1069.51,704.9,0.0
256,5626,2048,3072,ck,0,0,65.1126,a8w8_blockscale_1x128x128_256x128x128x128_16x16_32x32_2x2_8x32x1_8x32x1_1x32x1x8_8_1x1_intrawave_v3,1087.22,715.97,0.0
256,5664,2048,3072,ck,0,0,65.4922,a8w8_blockscale_1x128x128_256x128x128x128_16x16_32x32_2x2_8x32x1_8x32x1_1x32x1x8_8_1x1_intrawave_v3,1088.22,715.98,0.0
256,5732,2048,3072,ck,0,0,65.8678,a8w8_blockscale_1x128x128_256x128x128x128_16x16_32x32_2x2_8x32x1_8x32x1_1x32x1x8_8_1x1_intrawave_v3,1095.0,719.3,0.0
256,6001,2048,3072,ck,0,0,70.016,a8w8_blockscale_1x128x128_256x128x128x128_16x16_32x32_2x2_8x32x1_8x32x1_1x32x1x8_8_1x1_intrawave_v3,1078.47,704.22,0.0
256,6002,2048,3072,ck,0,0,67.845,a8w8_blockscale_1x128x128_256x128x128x128_16x16_32x32_2x2_8x32x1_8x32x1_1x32x1x8_8_1x1_intrawave_v3,1113.16,726.86,0.0
256,6030,2048,3072,ck,0,0,71.0018,a8w8_blockscale_1x128x128_256x128x128x128_16x16_32x32_2x2_8x32x1_8x32x1_1x32x1x8_8_1x1_intrawave_v3,1068.63,697.37,0.0
256,6183,2048,3072,ck,0,0,77.3522,a8w8_blockscale_1x128x128_256x128x128x128_16x16_32x32_2x2_8x32x1_8x32x1_1x32x1x8_8_1x1_intrawave_v3,1005.79,654.3,0.0
256,7001,2048,3072,ck,0,0,80.7739,a8w8_blockscale_1x128x128_256x128x128x128_16x16_32x32_2x2_8x32x1_8x32x1_1x32x1x8_8_1x1_intrawave_v3,1090.61,699.17,0.0
256,7039,2048,3072,ck,0,0,81.0735,a8w8_blockscale_1x128x128_256x128x128x128_16x16_32x32_2x2_8x32x1_8x32x1_1x32x1x8_8_1x1_intrawave_v3,1092.48,699.95,0.0
256,7058,2048,3072,ck,0,0,81.1251,a8w8_blockscale_1x128x128_256x128x128x128_16x16_32x32_2x2_8x32x1_8x32x1_1x32x1x8_8_1x1_intrawave_v3,1094.73,701.18,0.0
256,7140,2048,3072,ck,0,0,80.8307,a8w8_blockscale_1x128x128_256x128x128x128_16x16_32x32_2x2_8x32x1_8x32x1_1x32x1x8_8_1x1_intrawave_v3,1111.48,711.0,0.0
256,7235,2048,3072,ck,0,0,82.0827,a8w8_blockscale_1x128x128_256x128x128x128_16x16_32x32_2x2_8x32x1_8x32x1_1x32x1x8_8_1x1_intrawave_v3,1109.09,708.46,0.0
256,7239,2048,3072,ck,0,0,83.4847,a8w8_blockscale_1x128x128_256x128x128x128_16x16_32x32_2x2_8x32x1_8x32x1_1x32x1x8_8_1x1_intrawave_v3,1091.07,696.9,0.0
256,7241,2048,3072,ck,0,0,82.5195,a8w8_blockscale_1x128x128_256x128x128x128_16x16_32x32_2x2_8x32x1_8x32x1_1x32x1x8_8_1x1_intrawave_v3,1104.14,705.23,0.0
256,7243,2048,3072,ck,0,0,82.3539,a8w8_blockscale_1x128x128_256x128x128x128_16x16_32x32_2x2_8x32x1_8x32x1_1x32x1x8_8_1x1_intrawave_v3,1106.66,706.82,0.0
256,7250,2048,3072,ck,0,0,82.3267,a8w8_blockscale_1x128x128_256x128x128x128_16x16_32x32_2x2_8x32x1_8x32x1_1x32x1x8_8_1x1_intrawave_v3,1108.1,707.66,0.0
256,7340,2048,3072,ck,0,0,82.8539,a8w8_blockscale_1x128x128_256x128x128x128_16x16_32x32_2x2_8x32x1_8x32x1_1x32x1x8_8_1x1_intrawave_v3,1114.72,710.95,0.0
256,8000,2048,3072,ck,0,0,87.3327,a8w8_blockscale_1x128x128_256x128x128x128_16x16_32x32_2x2_8x32x1_8x32x1_1x32x1x8_8_1x1_intrawave_v3,1152.64,728.66,0.0
256,8015,2048,3072,ck,0,0,88.3007,a8w8_blockscale_1x128x128_256x128x128x128_16x16_32x32_2x2_8x32x1_8x32x1_1x32x1x8_8_1x1_intrawave_v3,1142.14,721.89,0.0
256,8016,2048,3072,ck,0,0,86.4783,a8w8_blockscale_1x128x128_256x128x128x128_16x16_32x32_2x2_8x32x1_8x32x1_1x32x1x8_8_1x1_intrawave_v3,1166.36,737.18,0.0
256,8021,2048,3072,ck,0,0,86.5795,a8w8_blockscale_1x128x128_256x128x128x128_16x16_32x32_2x2_8x32x1_8x32x1_1x32x1x8_8_1x1_intrawave_v3,1165.72,736.73,0.0
256,8027,2048,3072,ck,0,0,85.4379,a8w8_blockscale_1x128x128_256x128x128x128_16x16_32x32_2x2_8x32x1_8x32x1_1x32x1x8_8_1x1_intrawave_v3,1182.18,747.08,0.0
256,8029,2048,3072,ck,0,0,85.5935,a8w8_blockscale_1x128x128_256x128x128x128_16x16_32x32_2x2_8x32x1_8x32x1_1x32x1x8_8_1x1_intrawave_v3,1180.33,745.89,0.0
256,8036,2048,3072,ck,0,0,86.0255,a8w8_blockscale_1x128x128_256x128x128x128_16x16_32x32_2x2_8x32x1_8x32x1_1x32x1x8_8_1x1_intrawave_v3,1175.42,742.73,0.0
256,8041,2048,3072,ck,0,0,85.6595,a8w8_blockscale_1x128x128_256x128x128x128_16x16_32x32_2x2_8x32x1_8x32x1_1x32x1x8_8_1x1_intrawave_v3,1181.18,746.32,0.0
256,8051,2048,3072,ck,0,0,88.2051,a8w8_blockscale_1x128x128_256x128x128x128_16x16_32x32_2x2_8x32x1_8x32x1_1x32x1x8_8_1x1_intrawave_v3,1148.52,725.59,0.0
256,8178,2048,3072,ck,0,0,87.6366,a8w8_blockscale_1x128x128_256x128x128x128_16x16_32x32_2x2_8x32x1_8x32x1_1x32x1x8_8_1x1_intrawave_v3,1174.2,740.69,0.0
256,8183,2048,3072,ck,0,0,87.1415,a8w8_blockscale_1x128x128_256x128x128x128_16x16_32x32_2x2_8x32x1_8x32x1_1x32x1x8_8_1x1_intrawave_v3,1181.6,745.31,0.0
256,8490,2048,3072,ck,0,0,96.9501,a8w8_blockscale_1x128x128_256x128x128x128_16x16_32x32_2x2_8x32x1_8x32x1_1x32x1x8_8_1x1_intrawave_v3,1101.9,692.6,0.0
256,8683,2048,3072,ck,0,0,97.5382,a8w8_blockscale_1x128x128_256x128x128x128_16x16_32x32_2x2_8x32x1_8x32x1_1x32x1x8_8_1x1_intrawave_v3,1120.15,702.61,0.0
256,8969,2048,3072,ck,0,0,101.1808,a8w8_blockscale_1x128x128_256x128x128x128_16x16_32x32_2x2_8x32x1_8x32x1_1x32x1x8_8_1x1_intrawave_v3,1115.39,697.58,0.0
256,9000,2048,3072,ck,0,0,101.3668,a8w8_blockscale_1x128x128_256x128x128x128_16x16_32x32_2x2_8x32x1_8x32x1_1x32x1x8_8_1x1_intrawave_v3,1117.19,698.49,0.0
256,9008,2048,3072,ck,0,0,101.4812,a8w8_blockscale_1x128x128_256x128x128x128_16x16_32x32_2x2_8x32x1_8x32x1_1x32x1x8_8_1x1_intrawave_v3,1116.92,698.27,0.0
256,9023,2048,3072,ck,0,0,102.0884,a8w8_blockscale_1x128x128_256x128x128x128_16x16_32x32_2x2_8x32x1_8x32x1_1x32x1x8_8_1x1_intrawave_v3,1112.13,695.17,0.0
256,9099,2048,3072,ck,0,0,101.3268,a8w8_blockscale_1x128x128_256x128x128x128_16x16_32x32_2x2_8x32x1_8x32x1_1x32x1x8_8_1x1_intrawave_v3,1129.93,705.77,0.0
256,9108,2048,3072,ck,0,0,102.2788,a8w8_blockscale_1x128x128_256x128x128x128_16x16_32x32_2x2_8x32x1_8x32x1_1x32x1x8_8_1x1_intrawave_v3,1120.52,699.83,0.0
256,9183,2048,3072,ck,0,0,101.1324,a8w8_blockscale_1x128x128_256x128x128x128_16x16_32x32_2x2_8x32x1_8x32x1_1x32x1x8_8_1x1_intrawave_v3,1142.55,713.08,0.0
256,9210,2048,3072,ck,0,0,102.1228,a8w8_blockscale_1x128x128_256x128x128x128_16x16_32x32_2x2_8x32x1_8x32x1_1x32x1x8_8_1x1_intrawave_v3,1134.8,708.06,0.0
256,9214,2048,3072,ck,0,0,101.8628,a8w8_blockscale_1x128x128_256x128x128x128_16x16_32x32_2x2_8x32x1_8x32x1_1x32x1x8_8_1x1_intrawave_v3,1138.19,710.15,0.0
256,9308,2048,3072,ck,0,0,102.388,a8w8_blockscale_1x128x128_256x128x128x128_16x16_32x32_2x2_8x32x1_8x32x1_1x32x1x8_8_1x1_intrawave_v3,1143.9,713.08,0.0
256,9383,2048,3072,ck,0,0,102.7317,a8w8_blockscale_1x128x128_256x128x128x128_16x16_32x32_2x2_8x32x1_8x32x1_1x32x1x8_8_1x1_intrawave_v3,1149.26,715.93,0.0
256,9432,2048,3072,ck,0,0,101.9509,a8w8_blockscale_1x128x128_256x128x128x128_16x16_32x32_2x2_8x32x1_8x32x1_1x32x1x8_8_1x1_intrawave_v3,1164.11,724.86,0.0
256,9438,2048,3072,ck,0,0,102.7669,a8w8_blockscale_1x128x128_256x128x128x128_16x16_32x32_2x2_8x32x1_8x32x1_1x32x1x8_8_1x1_intrawave_v3,1155.6,719.52,0.0
256,9471,2048,3072,ck,0,0,103.3477,a8w8_blockscale_1x128x128_256x128x128x128_16x16_32x32_2x2_8x32x1_8x32x1_1x32x1x8_8_1x1_intrawave_v3,1153.12,717.77,0.0
256,9486,2048,3072,ck,0,0,103.9853,a8w8_blockscale_1x128x128_256x128x128x128_16x16_32x32_2x2_8x32x1_8x32x1_1x32x1x8_8_1x1_intrawave_v3,1147.87,714.4,0.0
256,10000,2048,3072,ck,0,0,104.8512,a8w8_blockscale_1x128x128_256x128x128x128_16x16_32x32_2x2_8x32x1_8x32x1_1x32x1x8_8_1x1_intrawave_v3,1200.07,743.64,0.0
256,10001,2048,3072,ck,0,0,107.283,a8w8_blockscale_1x128x128_256x128x128x128_16x16_32x32_2x2_8x32x1_8x32x1_1x32x1x8_8_1x1_intrawave_v3,1172.99,726.85,0.0
256,10002,2048,3072,ck,0,0,106.6346,a8w8_blockscale_1x128x128_256x128x128x128_16x16_32x32_2x2_8x32x1_8x32x1_1x32x1x8_8_1x1_intrawave_v3,1180.24,731.34,0.0
256,10003,2048,3072,ck,0,0,106.557,a8w8_blockscale_1x128x128_256x128x128x128_16x16_32x32_2x2_8x32x1_8x32x1_1x32x1x8_8_1x1_intrawave_v3,1181.22,731.94,0.0
256,10005,2048,3072,ck,0,0,107.2869,a8w8_blockscale_1x128x128_256x128x128x128_16x16_32x32_2x2_8x32x1_8x32x1_1x32x1x8_8_1x1_intrawave_v3,1173.41,727.09,0.0
256,10008,2048,3072,ck,0,0,106.7777,a8w8_blockscale_1x128x128_256x128x128x128_16x16_32x32_2x2_8x32x1_8x32x1_1x32x1x8_8_1x1_intrawave_v3,1179.36,730.76,0.0
256,10012,2048,3072,ck,0,0,107.3901,a8w8_blockscale_1x128x128_256x128x128x128_16x16_32x32_2x2_8x32x1_8x32x1_1x32x1x8_8_1x1_intrawave_v3,1173.11,726.86,0.0
256,10030,2048,3072,ck,0,0,107.872,a8w8_blockscale_1x128x128_256x128x128x128_16x16_32x32_2x2_8x32x1_8x32x1_1x32x1x8_8_1x1_intrawave_v3,1169.97,724.81,0.0
256,10031,2048,3072,ck,0,0,108.274,a8w8_blockscale_1x128x128_256x128x128x128_16x16_32x32_2x2_8x32x1_8x32x1_1x32x1x8_8_1x1_intrawave_v3,1165.74,722.18,0.0
256,10063,2048,3072,ck,0,0,105.979,a8w8_blockscale_1x128x128_256x128x128x128_16x16_32x32_2x2_8x32x1_8x32x1_1x32x1x8_8_1x1_intrawave_v3,1194.78,739.99,0.0
256,10095,2048,3072,ck,0,0,107.9996,a8w8_blockscale_1x128x128_256x128x128x128_16x16_32x32_2x2_8x32x1_8x32x1_1x32x1x8_8_1x1_intrawave_v3,1176.16,728.27,0.0
256,10126,2048,3072,ck,0,0,108.498,a8w8_blockscale_1x128x128_256x128x128x128_16x16_32x32_2x2_8x32x1_8x32x1_1x32x1x8_8_1x1_intrawave_v3,1174.35,726.97,0.0
256,10127,2048,3072,ck,0,0,110.0177,a8w8_blockscale_1x128x128_256x128x128x128_16x16_32x32_2x2_8x32x1_8x32x1_1x32x1x8_8_1x1_intrawave_v3,1158.24,716.99,0.0
256,10244,2048,3072,ck,0,0,113.8614,a8w8_blockscale_1x128x128_256x128x128x128_16x16_32x32_2x2_8x32x1_8x32x1_1x32x1x8_8_1x1_intrawave_v3,1132.07,700.15,0.0
256,10248,2048,3072,ck,0,0,114.9578,a8w8_blockscale_1x128x128_256x128x128x128_16x16_32x32_2x2_8x32x1_8x32x1_1x32x1x8_8_1x1_intrawave_v3,1121.71,693.73,0.0
256,10255,2048,3072,ck,0,0,113.7862,a8w8_blockscale_1x128x128_256x128x128x128_16x16_32x32_2x2_8x32x1_8x32x1_1x32x1x8_8_1x1_intrawave_v3,1134.04,701.31,0.0
256,10330,2048,3072,ck,0,0,114.6758,a8w8_blockscale_1x128x128_256x128x128x128_16x16_32x32_2x2_8x32x1_8x32x1_1x32x1x8_8_1x1_intrawave_v3,1133.47,700.56,0.0
256,10332,2048,3072,ck,0,0,114.719,a8w8_blockscale_1x128x128_256x128x128x128_16x16_32x32_2x2_8x32x1_8x32x1_1x32x1x8_8_1x1_intrawave_v3,1133.26,700.42,0.0
256,10349,2048,3072,ck,0,0,112.7618,a8w8_blockscale_1x128x128_256x128x128x128_16x16_32x32_2x2_8x32x1_8x32x1_1x32x1x8_8_1x1_intrawave_v3,1154.83,713.66,0.0
256,10351,2048,3072,ck,0,0,113.3562,a8w8_blockscale_1x128x128_256x128x128x128_16x16_32x32_2x2_8x32x1_8x32x1_1x32x1x8_8_1x1_intrawave_v3,1149.0,710.04,0.0
256,10357,2048,3072,ck,0,0,115.167,a8w8_blockscale_1x128x128_256x128x128x128_16x16_32x32_2x2_8x32x1_8x32x1_1x32x1x8_8_1x1_intrawave_v3,1131.58,699.25,0.0
256,10359,2048,3072,ck,0,0,115.1518,a8w8_blockscale_1x128x128_256x128x128x128_16x16_32x32_2x2_8x32x1_8x32x1_1x32x1x8_8_1x1_intrawave_v3,1131.95,699.47,0.0
256,10360,2048,3072,ck,0,0,120.4281,a8w8_blockscale_1x128x128_256x128x128x128_16x16_32x32_2x2_8x32x1_8x32x1_1x32x1x8_8_1x1_intrawave_v3,1082.46,668.88,0.0
256,10364,2048,3072,ck,0,0,115.3911,a8w8_blockscale_1x128x128_256x128x128x128_16x16_32x32_2x2_8x32x1_8x32x1_1x32x1x8_8_1x1_intrawave_v3,1130.15,698.33,0.0
256,10368,2048,3072,ck,0,0,114.9462,a8w8_blockscale_1x128x128_256x128x128x128_16x16_32x32_2x2_8x32x1_8x32x1_1x32x1x8_8_1x1_intrawave_v3,1134.96,701.28,0.0
256,10382,2048,3072,ck,0,0,115.8417,a8w8_blockscale_1x128x128_256x128x128x128_16x16_32x32_2x2_8x32x1_8x32x1_1x32x1x8_8_1x1_intrawave_v3,1127.71,696.72,0.0
256,10383,2048,3072,ck,0,0,115.629,a8w8_blockscale_1x128x128_256x128x128x128_16x16_32x32_2x2_8x32x1_8x32x1_1x32x1x8_8_1x1_intrawave_v3,1129.89,698.07,0.0
256,10386,2048,3072,ck,0,0,115.9246,a8w8_blockscale_1x128x128_256x128x128x128_16x16_32x32_2x2_8x32x1_8x32x1_1x32x1x8_8_1x1_intrawave_v3,1127.34,696.47,0.0
256,10389,2048,3072,ck,0,0,116.3458,a8w8_blockscale_1x128x128_256x128x128x128_16x16_32x32_2x2_8x32x1_8x32x1_1x32x1x8_8_1x1_intrawave_v3,1123.58,694.14,0.0
256,10390,2048,3072,ck,0,0,114.7494,a8w8_blockscale_1x128x128_256x128x128x128_16x16_32x32_2x2_8x32x1_8x32x1_1x32x1x8_8_1x1_intrawave_v3,1139.32,703.86,0.0
256,10401,2048,3072,ck,0,0,113.9446,a8w8_blockscale_1x128x128_256x128x128x128_16x16_32x32_2x2_8x32x1_8x32x1_1x32x1x8_8_1x1_intrawave_v3,1148.58,709.52,0.0
256,10403,2048,3072,ck,0,0,116.3786,a8w8_blockscale_1x128x128_256x128x128x128_16x16_32x32_2x2_8x32x1_8x32x1_1x32x1x8_8_1x1_intrawave_v3,1124.78,694.8,0.0
256,10406,2048,3072,ck,0,0,116.671,a8w8_blockscale_1x128x128_256x128x128x128_16x16_32x32_2x2_8x32x1_8x32x1_1x32x1x8_8_1x1_intrawave_v3,1122.28,693.25,0.0
256,10408,2048,3072,ck,0,0,113.1241,a8w8_blockscale_1x128x128_256x128x128x128_16x16_32x32_2x2_8x32x1_8x32x1_1x32x1x8_8_1x1_intrawave_v3,1157.69,715.11,0.0
256,10409,2048,3072,ck,0,0,116.285,a8w8_blockscale_1x128x128_256x128x128x128_16x16_32x32_2x2_8x32x1_8x32x1_1x32x1x8_8_1x1_intrawave_v3,1126.33,695.73,0.0
256,10410,2048,3072,ck,0,0,115.0702,a8w8_blockscale_1x128x128_256x128x128x128_16x16_32x32_2x2_8x32x1_8x32x1_1x32x1x8_8_1x1_intrawave_v3,1138.33,703.14,0.0
256,10414,2048,3072,ck,0,0,116.1558,a8w8_blockscale_1x128x128_256x128x128x128_16x16_32x32_2x2_8x32x1_8x32x1_1x32x1x8_8_1x1_intrawave_v3,1128.13,696.81,0.0
256,10415,2048,3072,ck,0,0,116.2646,a8w8_blockscale_1x128x128_256x128x128x128_16x16_32x32_2x2_8x32x1_8x32x1_1x32x1x8_8_1x1_intrawave_v3,1127.18,696.22,0.0
256,10416,2048,3072,ck,0,0,114.5197,a8w8_blockscale_1x128x128_256x128x128x128_16x16_32x32_2x2_8x32x1_8x32x1_1x32x1x8_8_1x1_intrawave_v3,1144.46,706.89,0.0
256,10423,2048,3072,ck,0,0,116.2846,a8w8_blockscale_1x128x128_256x128x128x128_16x16_32x32_2x2_8x32x1_8x32x1_1x32x1x8_8_1x1_intrawave_v3,1127.85,696.6,0.0
256,10426,2048,3072,ck,0,0,112.7773,a8w8_blockscale_1x128x128_256x128x128x128_16x16_32x32_2x2_8x32x1_8x32x1_1x32x1x8_8_1x1_intrawave_v3,1163.26,718.45,0.0
256,10435,2048,3072,ck,0,0,117.3294,a8w8_blockscale_1x128x128_256x128x128x128_16x16_32x32_2x2_8x32x1_8x32x1_1x32x1x8_8_1x1_intrawave_v3,1119.09,691.13,0.0
256,10441,2048,3072,ck,0,0,120.1893,a8w8_blockscale_1x128x128_256x128x128x128_16x16_32x32_2x2_8x32x1_8x32x1_1x32x1x8_8_1x1_intrawave_v3,1093.09,675.04,0.0
256,10443,2048,3072,ck,0,0,116.0821,a8w8_blockscale_1x128x128_256x128x128x128_16x16_32x32_2x2_8x32x1_8x32x1_1x32x1x8_8_1x1_intrawave_v3,1131.99,699.05,0.0
256,10444,2048,3072,ck,0,0,115.7957,a8w8_blockscale_1x128x128_256x128x128x128_16x16_32x32_2x2_8x32x1_8x32x1_1x32x1x8_8_1x1_intrawave_v3,1134.89,700.84,0.0
256,10450,2048,3072,ck,0,0,114.8324,a8w8_blockscale_1x128x128_256x128x128x128_16x16_32x32_2x2_8x32x1_8x32x1_1x32x1x8_8_1x1_intrawave_v3,1145.07,707.09,0.0
256,10452,2048,3072,ck,0,0,115.8649,a8w8_blockscale_1x128x128_256x128x128x128_16x16_32x32_2x2_8x32x1_8x32x1_1x32x1x8_8_1x1_intrawave_v3,1135.09,700.91,0.0
256,10457,2048,3072,ck,0,0,117.0669,a8w8_blockscale_1x128x128_256x128x128x128_16x16_32x32_2x2_8x32x1_8x32x1_1x32x1x8_8_1x1_intrawave_v3,1123.97,694.02,0.0
256,10462,2048,3072,ck,0,0,116.2377,a8w8_blockscale_1x128x128_256x128x128x128_16x16_32x32_2x2_8x32x1_8x32x1_1x32x1x8_8_1x1_intrawave_v3,1132.53,699.28,0.0
256,10465,2048,3072,ck,0,0,113.2877,a8w8_blockscale_1x128x128_256x128x128x128_16x16_32x32_2x2_8x32x1_8x32x1_1x32x1x8_8_1x1_intrawave_v3,1162.35,717.68,0.0
256,10469,2048,3072,ck,0,0,113.1121,a8w8_blockscale_1x128x128_256x128x128x128_16x16_32x32_2x2_8x32x1_8x32x1_1x32x1x8_8_1x1_intrawave_v3,1164.6,719.05,0.0
256,10471,2048,3072,ck,0,0,115.8309,a8w8_blockscale_1x128x128_256x128x128x128_16x16_32x32_2x2_8x32x1_8x32x1_1x32x1x8_8_1x1_intrawave_v3,1137.48,702.3,0.0
256,10474,2048,3072,ck,0,0,116.3829,a8w8_blockscale_1x128x128_256x128x128x128_16x16_32x32_2x2_8x32x1_8x32x1_1x32x1x8_8_1x1_intrawave_v3,1132.41,699.15,0.0
256,10476,2048,3072,ck,0,0,114.5825,a8w8_blockscale_1x128x128_256x128x128x128_16x16_32x32_2x2_8x32x1_8x32x1_1x32x1x8_8_1x1_intrawave_v3,1150.43,710.26,0.0
256,10479,2048,3072,ck,0,0,114.9513,a8w8_blockscale_1x128x128_256x128x128x128_16x16_32x32_2x2_8x32x1_8x32x1_1x32x1x8_8_1x1_intrawave_v3,1147.06,708.17,0.0
256,10483,2048,3072,ck,0,0,116.6549,a8w8_blockscale_1x128x128_256x128x128x128_16x16_32x32_2x2_8x32x1_8x32x1_1x32x1x8_8_1x1_intrawave_v3,1130.74,698.07,0.0
256,10487,2048,3072,ck,0,0,114.0357,a8w8_blockscale_1x128x128_256x128x128x128_16x16_32x32_2x2_8x32x1_8x32x1_1x32x1x8_8_1x1_intrawave_v3,1157.16,714.36,0.0
256,10492,2048,3072,ck,0,0,115.8877,a8w8_blockscale_1x128x128_256x128x128x128_16x16_32x32_2x2_8x32x1_8x32x1_1x32x1x8_8_1x1_intrawave_v3,1139.21,703.25,0.0
256,10493,2048,3072,ck,0,0,115.8597,a8w8_blockscale_1x128x128_256x128x128x128_16x16_32x32_2x2_8x32x1_8x32x1_1x32x1x8_8_1x1_intrawave_v3,1139.59,703.48,0.0
256,10495,2048,3072,ck,0,0,116.2517,a8w8_blockscale_1x128x128_256x128x128x128_16x16_32x32_2x2_8x32x1_8x32x1_1x32x1x8_8_1x1_intrawave_v3,1135.96,701.23,0.0
256,10500,2048,3072,ck,0,0,115.1897,a8w8_blockscale_1x128x128_256x128x128x128_16x16_32x32_2x2_8x32x1_8x32x1_1x32x1x8_8_1x1_intrawave_v3,1146.98,708.01,0.0
256,10501,2048,3072,ck,0,0,116.5953,a8w8_blockscale_1x128x128_256x128x128x128_16x16_32x32_2x2_8x32x1_8x32x1_1x32x1x8_8_1x1_intrawave_v3,1133.26,699.54,0.0
256,10505,2048,3072,ck,0,0,117.0033,a8w8_blockscale_1x128x128_256x128x128x128_16x16_32x32_2x2_8x32x1_8x32x1_1x32x1x8_8_1x1_intrawave_v3,1129.74,697.34,0.0
256,10507,2048,3072,ck,0,0,116.4505,a8w8_blockscale_1x128x128_256x128x128x128_16x16_32x32_2x2_8x32x1_8x32x1_1x32x1x8_8_1x1_intrawave_v3,1135.32,700.78,0.0
256,10509,2048,3072,ck,0,0,116.3205,a8w8_blockscale_1x128x128_256x128x128x128_16x16_32x32_2x2_8x32x1_8x32x1_1x32x1x8_8_1x1_intrawave_v3,1136.81,701.68,0.0
256,10511,2048,3072,ck,0,0,117.0525,a8w8_blockscale_1x128x128_256x128x128x128_16x16_32x32_2x2_8x32x1_8x32x1_1x32x1x8_8_1x1_intrawave_v3,1129.91,697.42,0.0
256,10513,2048,3072,ck,0,0,115.6805,a8w8_blockscale_1x128x128_256x128x128x128_16x16_32x32_2x2_8x32x1_8x32x1_1x32x1x8_8_1x1_intrawave_v3,1143.53,705.81,0.0
256,10517,2048,3072,ck,0,0,115.8733,a8w8_blockscale_1x128x128_256x128x128x128_16x16_32x32_2x2_8x32x1_8x32x1_1x32x1x8_8_1x1_intrawave_v3,1142.06,704.88,0.0
256,10520,2048,3072,ck,0,0,116.4013,a8w8_blockscale_1x128x128_256x128x128x128_16x16_32x32_2x2_8x32x1_8x32x1_1x32x1x8_8_1x1_intrawave_v3,1137.21,701.87,0.0
256,10522,2048,3072,ck,0,0,117.0433,a8w8_blockscale_1x128x128_256x128x128x128_16x16_32x32_2x2_8x32x1_8x32x1_1x32x1x8_8_1x1_intrawave_v3,1131.18,698.14,0.0
256,10523,2048,3072,ck,0,0,117.2517,a8w8_blockscale_1x128x128_256x128x128x128_16x16_32x32_2x2_8x32x1_8x32x1_1x32x1x8_8_1x1_intrawave_v3,1129.28,696.96,0.0
256,10526,2048,3072,ck,0,0,115.3118,a8w8_blockscale_1x128x128_256x128x128x128_16x16_32x32_2x2_8x32x1_8x32x1_1x32x1x8_8_1x1_intrawave_v3,1148.61,708.88,0.0
256,10528,2048,3072,ck,0,0,114.9769,a8w8_blockscale_1x128x128_256x128x128x128_16x16_32x32_2x2_8x32x1_8x32x1_1x32x1x8_8_1x1_intrawave_v3,1152.17,711.07,0.0
256,10534,2048,3072,ck,0,0,117.0549,a8w8_blockscale_1x128x128_256x128x128x128_16x16_32x32_2x2_8x32x1_8x32x1_1x32x1x8_8_1x1_intrawave_v3,1132.36,698.81,0.0
256,10535,2048,3072,ck,0,0,116.5327,a8w8_blockscale_1x128x128_256x128x128x128_16x16_32x32_2x2_8x32x1_8x32x1_1x32x1x8_8_1x1_intrawave_v3,1137.54,702.0,0.0
256,10536,2048,3072,ck,0,0,114.1044,a8w8_blockscale_1x128x128_256x128x128x128_16x16_32x32_2x2_8x32x1_8x32x1_1x32x1x8_8_1x1_intrawave_v3,1161.86,717.01,0.0
256,10542,2048,3072,ck,0,0,116.0976,a8w8_blockscale_1x128x128_256x128x128x128_16x16_32x32_2x2_8x32x1_8x32x1_1x32x1x8_8_1x1_intrawave_v3,1142.57,705.07,0.0
256,10543,2048,3072,ck,0,0,117.6529,a8w8_blockscale_1x128x128_256x128x128x128_16x16_32x32_2x2_8x32x1_8x32x1_1x32x1x8_8_1x1_intrawave_v3,1127.57,695.81,0.0
256,10546,2048,3072,ck,0,0,113.7084,a8w8_blockscale_1x128x128_256x128x128x128_16x16_32x32_2x2_8x32x1_8x32x1_1x32x1x8_8_1x1_intrawave_v3,1167.01,720.13,0.0
256,10548,2048,3072,ck,0,0,116.208,a8w8_blockscale_1x128x128_256x128x128x128_16x16_32x32_2x2_8x32x1_8x32x1_1x32x1x8_8_1x1_intrawave_v3,1142.13,704.77,0.0
256,10550,2048,3072,ck,0,0,113.8704,a8w8_blockscale_1x128x128_256x128x128x128_16x16_32x32_2x2_8x32x1_8x32x1_1x32x1x8_8_1x1_intrawave_v3,1165.8,719.36,0.0
256,10551,2048,3072,ck,0,0,115.5264,a8w8_blockscale_1x128x128_256x128x128x128_16x16_32x32_2x2_8x32x1_8x32x1_1x32x1x8_8_1x1_intrawave_v3,1149.19,709.11,0.0
256,10555,2048,3072,ck,0,0,117.1113,a8w8_blockscale_1x128x128_256x128x128x128_16x16_32x32_2x2_8x32x1_8x32x1_1x32x1x8_8_1x1_intrawave_v3,1134.07,699.76,0.0
256,10556,2048,3072,ck,0,0,117.1601,a8w8_blockscale_1x128x128_256x128x128x128_16x16_32x32_2x2_8x32x1_8x32x1_1x32x1x8_8_1x1_intrawave_v3,1133.71,699.53,0.0
256,10559,2048,3072,ck,0,0,114.9877,a8w8_blockscale_1x128x128_256x128x128x128_16x16_32x32_2x2_8x32x1_8x32x1_1x32x1x8_8_1x1_intrawave_v3,1155.45,712.93,0.0
256,10560,2048,3072,ck,0,0,115.2785,a8w8_blockscale_1x128x128_256x128x128x128_16x16_32x32_2x2_8x32x1_8x32x1_1x32x1x8_8_1x1_intrawave_v3,1152.65,711.2,0.0
256,10564,2048,3072,ck,0,0,117.1589,a8w8_blockscale_1x128x128_256x128x128x128_16x16_32x32_2x2_8x32x1_8x32x1_1x32x1x8_8_1x1_intrawave_v3,1134.58,700.03,0.0
256,10568,2048,3072,ck,0,0,115.4989,a8w8_blockscale_1x128x128_256x128x128x128_16x16_32x32_2x2_8x32x1_8x32x1_1x32x1x8_8_1x1_intrawave_v3,1151.32,710.33,0.0
256,10569,2048,3072,ck,0,0,116.8913,a8w8_blockscale_1x128x128_256x128x128x128_16x16_32x32_2x2_8x32x1_8x32x1_1x32x1x8_8_1x1_intrawave_v3,1137.71,701.93,0.0
256,10571,2048,3072,ck,0,0,116.6497,a8w8_blockscale_1x128x128_256x128x128x128_16x16_32x32_2x2_8x32x1_8x32x1_1x32x1x8_8_1x1_intrawave_v3,1140.29,703.51,0.0
256,10572,2048,3072,ck,0,0,116.1549,a8w8_blockscale_1x128x128_256x128x128x128_16x16_32x32_2x2_8x32x1_8x32x1_1x32x1x8_8_1x1_intrawave_v3,1145.25,706.57,0.0
256,10576,2048,3072,ck,0,0,115.4189,a8w8_blockscale_1x128x128_256x128x128x128_16x16_32x32_2x2_8x32x1_8x32x1_1x32x1x8_8_1x1_intrawave_v3,1152.99,711.32,0.0
256,10581,2048,3072,ck,0,0,116.5901,a8w8_blockscale_1x128x128_256x128x128x128_16x16_32x32_2x2_8x32x1_8x32x1_1x32x1x8_8_1x1_intrawave_v3,1141.95,704.49,0.0
256,10584,2048,3072,ck,0,0,116.7529,a8w8_blockscale_1x128x128_256x128x128x128_16x16_32x32_2x2_8x32x1_8x32x1_1x32x1x8_8_1x1_intrawave_v3,1140.68,703.69,0.0
256,10585,2048,3072,ck,0,0,116.4565,a8w8_blockscale_1x128x128_256x128x128x128_16x16_32x32_2x2_8x32x1_8x32x1_1x32x1x8_8_1x1_intrawave_v3,1143.69,705.54,0.0
256,10589,2048,3072,ck,0,0,118.6629,a8w8_blockscale_1x128x128_256x128x128x128_16x16_32x32_2x2_8x32x1_8x32x1_1x32x1x8_8_1x1_intrawave_v3,1122.85,692.66,0.0
256,10593,2048,3072,ck,0,0,117.4877,a8w8_blockscale_1x128x128_256x128x128x128_16x16_32x32_2x2_8x32x1_8x32x1_1x32x1x8_8_1x1_intrawave_v3,1134.51,699.84,0.0
256,10596,2048,3072,ck,0,0,116.4625,a8w8_blockscale_1x128x128_256x128x128x128_16x16_32x32_2x2_8x32x1_8x32x1_1x32x1x8_8_1x1_intrawave_v3,1144.82,706.18,0.0
256,10601,2048,3072,ck,0,0,116.6229,a8w8_blockscale_1x128x128_256x128x128x128_16x16_32x32_2x2_8x32x1_8x32x1_1x32x1x8_8_1x1_intrawave_v3,1143.78,705.52,0.0
256,10605,2048,3072,ck,0,0,116.4477,a8w8_blockscale_1x128x128_256x128x128x128_16x16_32x32_2x2_8x32x1_8x32x1_1x32x1x8_8_1x1_intrawave_v3,1145.94,706.82,0.0
256,10609,2048,3072,ck,0,0,115.7949,a8w8_blockscale_1x128x128_256x128x128x128_16x16_32x32_2x2_8x32x1_8x32x1_1x32x1x8_8_1x1_intrawave_v3,1152.83,711.06,0.0
256,10613,2048,3072,ck,0,0,116.8805,a8w8_blockscale_1x128x128_256x128x128x128_16x16_32x32_2x2_8x32x1_8x32x1_1x32x1x8_8_1x1_intrawave_v3,1142.56,704.7,0.0
256,10617,2048,3072,ck,0,0,115.9133,a8w8_blockscale_1x128x128_256x128x128x128_16x16_32x32_2x2_8x32x1_8x32x1_1x32x1x8_8_1x1_intrawave_v3,1152.52,710.83,0.0
256,10619,2048,3072,ck,0,0,115.4097,a8w8_blockscale_1x128x128_256x128x128x128_16x16_32x32_2x2_8x32x1_8x32x1_1x32x1x8_8_1x1_intrawave_v3,1157.77,714.05,0.0
256,10624,2048,3072,ck,0,0,114.7421,a8w8_blockscale_1x128x128_256x128x128x128_16x16_32x32_2x2_8x32x1_8x32x1_1x32x1x8_8_1x1_intrawave_v3,1165.05,718.52,0.0
256,10626,2048,3072,ck,0,0,115.7353,a8w8_blockscale_1x128x128_256x128x128x128_16x16_32x32_2x2_8x32x1_8x32x1_1x32x1x8_8_1x1_intrawave_v3,1155.27,712.48,0.0
256,10630,2048,3072,ck,0,0,117.3649,a8w8_blockscale_1x128x128_256x128x128x128_16x16_32x32_2x2_8x32x1_8x32x1_1x32x1x8_8_1x1_intrawave_v3,1139.66,702.83,0.0
256,10640,2048,3072,ck,0,0,117.7825,a8w8_blockscale_1x128x128_256x128x128x128_16x16_32x32_2x2_8x32x1_8x32x1_1x32x1x8_8_1x1_intrawave_v3,1136.69,700.94,0.0
256,10644,2048,3072,ck,0,0,116.8573,a8w8_blockscale_1x128x128_256x128x128x128_16x16_32x32_2x2_8x32x1_8x32x1_1x32x1x8_8_1x1_intrawave_v3,1146.12,706.74,0.0
256,10655,2048,3072,ck,0,0,116.4688,a8w8_blockscale_1x128x128_256x128x128x128_16x16_32x32_2x2_8x32x1_8x32x1_1x32x1x8_8_1x1_intrawave_v3,1151.13,709.77,0.0
256,10658,2048,3072,ck,0,0,117.42,a8w8_blockscale_1x128x128_256x128x128x128_16x16_32x32_2x2_8x32x1_8x32x1_1x32x1x8_8_1x1_intrawave_v3,1142.13,704.21,0.0
256,10659,2048,3072,ck,0,0,117.0688,a8w8_blockscale_1x128x128_256x128x128x128_16x16_32x32_2x2_8x32x1_8x32x1_1x32x1x8_8_1x1_intrawave_v3,1145.66,706.38,0.0
256,10664,2048,3072,ck,0,0,116.2916,a8w8_blockscale_1x128x128_256x128x128x128_16x16_32x32_2x2_8x32x1_8x32x1_1x32x1x8_8_1x1_intrawave_v3,1153.86,711.41,0.0
256,10672,2048,3072,ck,0,0,116.8488,a8w8_blockscale_1x128x128_256x128x128x128_16x16_32x32_2x2_8x32x1_8x32x1_1x32x1x8_8_1x1_intrawave_v3,1149.22,708.51,0.0
256,10676,2048,3072,ck,0,0,116.67,a8w8_blockscale_1x128x128_256x128x128x128_16x16_32x32_2x2_8x32x1_8x32x1_1x32x1x8_8_1x1_intrawave_v3,1151.41,709.84,0.0
256,10678,2048,3072,ck,0,0,116.7728,a8w8_blockscale_1x128x128_256x128x128x128_16x16_32x32_2x2_8x32x1_8x32x1_1x32x1x8_8_1x1_intrawave_v3,1150.61,709.34,0.0
256,10690,2048,3072,ck,0,0,114.6784,a8w8_blockscale_1x128x128_256x128x128x128_16x16_32x32_2x2_8x32x1_8x32x1_1x32x1x8_8_1x1_intrawave_v3,1172.94,723.04,0.0
256,10691,2048,3072,ck,0,0,116.5992,a8w8_blockscale_1x128x128_256x128x128x128_16x16_32x32_2x2_8x32x1_8x32x1_1x32x1x8_8_1x1_intrawave_v3,1153.73,711.19,0.0
256,10695,2048,3072,ck,0,0,117.5832,a8w8_blockscale_1x128x128_256x128x128x128_16x16_32x32_2x2_8x32x1_8x32x1_1x32x1x8_8_1x1_intrawave_v3,1144.5,705.49,0.0
256,10697,2048,3072,ck,0,0,117.3944,a8w8_blockscale_1x128x128_256x128x128x128_16x16_32x32_2x2_8x32x1_8x32x1_1x32x1x8_8_1x1_intrawave_v3,1146.56,706.74,0.0
256,10700,2048,3072,ck,0,0,117.3944,a8w8_blockscale_1x128x128_256x128x128x128_16x16_32x32_2x2_8x32x1_8x32x1_1x32x1x8_8_1x1_intrawave_v3,1146.88,706.93,0.0
256,10711,2048,3072,ck,0,0,116.9772,a8w8_blockscale_1x128x128_256x128x128x128_16x16_32x32_2x2_8x32x1_8x32x1_1x32x1x8_8_1x1_intrawave_v3,1152.15,710.12,0.0
256,10715,2048,3072,ck,0,0,116.6636,a8w8_blockscale_1x128x128_256x128x128x128_16x16_32x32_2x2_8x32x1_8x32x1_1x32x1x8_8_1x1_intrawave_v3,1155.68,712.28,0.0
256,10724,2048,3072,ck,0,0,118.4648,a8w8_blockscale_1x128x128_256x128x128x128_16x16_32x32_2x2_8x32x1_8x32x1_1x32x1x8_8_1x1_intrawave_v3,1139.07,701.99,0.0
256,10725,2048,3072,ck,0,0,116.0772,a8w8_blockscale_1x128x128_256x128x128x128_16x16_32x32_2x2_8x32x1_8x32x1_1x32x1x8_8_1x1_intrawave_v3,1162.6,716.49,0.0
256,10733,2048,3072,ck,0,0,116.908,a8w8_blockscale_1x128x128_256x128x128x128_16x16_32x32_2x2_8x32x1_8x32x1_1x32x1x8_8_1x1_intrawave_v3,1155.2,711.89,0.0
256,10737,2048,3072,ck,0,0,116.4756,a8w8_blockscale_1x128x128_256x128x128x128_16x16_32x32_2x2_8x32x1_8x32x1_1x32x1x8_8_1x1_intrawave_v3,1159.92,714.78,0.0
256,10751,2048,3072,ck,0,0,118.2276,a8w8_blockscale_1x128x128_256x128x128x128_16x16_32x32_2x2_8x32x1_8x32x1_1x32x1x8_8_1x1_intrawave_v3,1144.22,705.04,0.0
256,10752,2048,3072,ck,0,0,116.5808,a8w8_blockscale_1x128x128_256x128x128x128_16x16_32x32_2x2_8x32x1_8x32x1_1x32x1x8_8_1x1_intrawave_v3,1160.5,715.06,0.0
256,10758,2048,3072,ck,0,0,117.1496,a8w8_blockscale_1x128x128_256x128x128x128_16x16_32x32_2x2_8x32x1_8x32x1_1x32x1x8_8_1x1_intrawave_v3,1155.51,711.95,0.0
256,10762,2048,3072,ck,0,0,117.6416,a8w8_blockscale_1x128x128_256x128x128x128_16x16_32x32_2x2_8x32x1_8x32x1_1x32x1x8_8_1x1_intrawave_v3,1151.1,709.22,0.0
256,10774,2048,3072,ck,0,0,116.5152,a8w8_blockscale_1x128x128_256x128x128x128_16x16_32x32_2x2_8x32x1_8x32x1_1x32x1x8_8_1x1_intrawave_v3,1163.52,716.81,0.0
256,10775,2048,3072,ck,0,0,116.7748,a8w8_blockscale_1x128x128_256x128x128x128_16x16_32x32_2x2_8x32x1_8x32x1_1x32x1x8_8_1x1_intrawave_v3,1161.05,715.28,0.0
256,10777,2048,3072,ck,0,0,118.116,a8w8_blockscale_1x128x128_256x128x128x128_16x16_32x32_2x2_8x32x1_8x32x1_1x32x1x8_8_1x1_intrawave_v3,1148.08,707.28,0.0
256,10778,2048,3072,ck,0,0,117.2684,a8w8_blockscale_1x128x128_256x128x128x128_16x16_32x32_2x2_8x32x1_8x32x1_1x32x1x8_8_1x1_intrawave_v3,1156.48,712.45,0.0
256,10779,2048,3072,ck,0,0,118.3032,a8w8_blockscale_1x128x128_256x128x128x128_16x16_32x32_2x2_8x32x1_8x32x1_1x32x1x8_8_1x1_intrawave_v3,1146.47,706.28,0.0
256,10782,2048,3072,ck,0,0,117.4376,a8w8_blockscale_1x128x128_256x128x128x128_16x16_32x32_2x2_8x32x1_8x32x1_1x32x1x8_8_1x1_intrawave_v3,1155.24,711.67,0.0
256,10788,2048,3072,ck,0,0,117.1016,a8w8_blockscale_1x128x128_256x128x128x128_16x16_32x32_2x2_8x32x1_8x32x1_1x32x1x8_8_1x1_intrawave_v3,1159.2,714.08,0.0
256,10801,2048,3072,ck,0,0,116.6288,a8w8_blockscale_1x128x128_256x128x128x128_16x16_32x32_2x2_8x32x1_8x32x1_1x32x1x8_8_1x1_intrawave_v3,1165.3,717.77,0.0
256,10818,2048,3072,ck,0,0,117.4216,a8w8_blockscale_1x128x128_256x128x128x128_16x16_32x32_2x2_8x32x1_8x32x1_1x32x1x8_8_1x1_intrawave_v3,1159.26,713.96,0.0
256,10841,2048,3072,ck,0,0,115.98,a8w8_blockscale_1x128x128_256x128x128x128_16x16_32x32_2x2_8x32x1_8x32x1_1x32x1x8_8_1x1_intrawave_v3,1176.16,724.26,0.0
256,10858,2048,3072,ck,0,0,117.8196,a8w8_blockscale_1x128x128_256x128x128x128_16x16_32x32_2x2_8x32x1_8x32x1_1x32x1x8_8_1x1_intrawave_v3,1159.61,713.99,0.0
256,10868,2048,3072,ck,0,0,118.3912,a8w8_blockscale_1x128x128_256x128x128x128_16x16_32x32_2x2_8x32x1_8x32x1_1x32x1x8_8_1x1_intrawave_v3,1155.08,711.14,0.0
256,10894,2048,3072,ck,0,0,116.28,a8w8_blockscale_1x128x128_256x128x128x128_16x16_32x32_2x2_8x32x1_8x32x1_1x32x1x8_8_1x1_intrawave_v3,1178.86,725.66,0.0
256,10909,2048,3072,ck,0,0,118.8877,a8w8_blockscale_1x128x128_256x128x128x128_16x16_32x32_2x2_8x32x1_8x32x1_1x32x1x8_8_1x1_intrawave_v3,1154.59,710.65,0.0
256,10925,2048,3072,ck,0,0,119.138,a8w8_blockscale_1x128x128_256x128x128x128_16x16_32x32_2x2_8x32x1_8x32x1_1x32x1x8_8_1x1_intrawave_v3,1153.86,710.12,0.0
256,10944,2048,3072,ck,0,0,118.0496,a8w8_blockscale_1x128x128_256x128x128x128_16x16_32x32_2x2_8x32x1_8x32x1_1x32x1x8_8_1x1_intrawave_v3,1166.52,717.82,0.0
256,10966,2048,3072,ck,0,0,118.4012,a8w8_blockscale_1x128x128_256x128x128x128_16x16_32x32_2x2_8x32x1_8x32x1_1x32x1x8_8_1x1_intrawave_v3,1165.4,717.02,0.0
256,10989,2048,3072,ck,0,0,118.9124,a8w8_blockscale_1x128x128_256x128x128x128_16x16_32x32_2x2_8x32x1_8x32x1_1x32x1x8_8_1x1_intrawave_v3,1162.82,715.32,0.0
256,11003,2048,3072,ck,0,0,118.9084,a8w8_blockscale_1x128x128_256x128x128x128_16x16_32x32_2x2_8x32x1_8x32x1_1x32x1x8_8_1x1_intrawave_v3,1164.34,716.19,0.0
256,11005,2048,3072,ck,0,0,121.0852,a8w8_blockscale_1x128x128_256x128x128x128_16x16_32x32_2x2_8x32x1_8x32x1_1x32x1x8_8_1x1_intrawave_v3,1143.62,703.43,0.0
256,11024,2048,3072,ck,0,0,119.7612,a8w8_blockscale_1x128x128_256x128x128x128_16x16_32x32_2x2_8x32x1_8x32x1_1x32x1x8_8_1x1_intrawave_v3,1158.26,712.35,0.0
256,11028,2048,3072,ck,0,0,120.2096,a8w8_blockscale_1x128x128_256x128x128x128_16x16_32x32_2x2_8x32x1_8x32x1_1x32x1x8_8_1x1_intrawave_v3,1154.35,709.93,0.0
256,11030,2048,3072,ck,0,0,119.3456,a8w8_blockscale_1x128x128_256x128x128x128_16x16_32x32_2x2_8x32x1_8x32x1_1x32x1x8_8_1x1_intrawave_v3,1162.92,715.19,0.0
256,11033,2048,3072,ck,0,0,120.1756,a8w8_blockscale_1x128x128_256x128x128x128_16x16_32x32_2x2_8x32x1_8x32x1_1x32x1x8_8_1x1_intrawave_v3,1155.2,710.43,0.0
256,11060,2048,3072,ck,0,0,118.746,a8w8_blockscale_1x128x128_256x128x128x128_16x16_32x32_2x2_8x32x1_8x32x1_1x32x1x8_8_1x1_intrawave_v3,1171.97,720.61,0.0
256,11079,2048,3072,ck,0,0,118.4908,a8w8_blockscale_1x128x128_256x128x128x128_16x16_32x32_2x2_8x32x1_8x32x1_1x32x1x8_8_1x1_intrawave_v3,1176.51,723.31,0.0
256,11102,2048,3072,ck,0,0,119.1172,a8w8_blockscale_1x128x128_256x128x128x128_16x16_32x32_2x2_8x32x1_8x32x1_1x32x1x8_8_1x1_intrawave_v3,1172.76,720.89,0.0
256,11151,2048,3072,ck,0,0,119.5532,a8w8_blockscale_1x128x128_256x128x128x128_16x16_32x32_2x2_8x32x1_8x32x1_1x32x1x8_8_1x1_intrawave_v3,1173.64,721.2,0.0
256,11155,2048,3072,ck,0,0,118.9896,a8w8_blockscale_1x128x128_256x128x128x128_16x16_32x32_2x2_8x32x1_8x32x1_1x32x1x8_8_1x1_intrawave_v3,1179.62,724.86,0.0
256,11160,2048,3072,ck,0,0,120.8292,a8w8_blockscale_1x128x128_256x128x128x128_16x16_32x32_2x2_8x32x1_8x32x1_1x32x1x8_8_1x1_intrawave_v3,1162.18,714.12,0.0
256,11172,2048,3072,ck,0,0,119.4856,a8w8_blockscale_1x128x128_256x128x128x128_16x16_32x32_2x2_8x32x1_8x32x1_1x32x1x8_8_1x1_intrawave_v3,1176.51,722.87,0.0
256,11187,2048,3072,ck,0,0,120.8212,a8w8_blockscale_1x128x128_256x128x128x128_16x16_32x32_2x2_8x32x1_8x32x1_1x32x1x8_8_1x1_intrawave_v3,1165.07,715.77,0.0
256,11195,2048,3072,ck,0,0,121.0856,a8w8_blockscale_1x128x128_256x128x128x128_16x16_32x32_2x2_8x32x1_8x32x1_1x32x1x8_8_1x1_intrawave_v3,1163.36,714.68,0.0
256,11219,2048,3072,ck,0,0,123.0354,a8w8_blockscale_1x128x128_256x128x128x128_16x16_32x32_2x2_8x32x1_8x32x1_1x32x1x8_8_1x1_intrawave_v3,1147.37,704.75,0.0
256,11254,2048,3072,ck,0,0,119.8847,a8w8_blockscale_1x128x128_256x128x128x128_16x16_32x32_2x2_8x32x1_8x32x1_1x32x1x8_8_1x1_intrawave_v3,1181.2,725.36,0.0
256,11418,2048,3072,ck,0,0,122.4611,a8w8_blockscale_1x128x128_256x128x128x128_16x16_32x32_2x2_8x32x1_8x32x1_1x32x1x8_8_1x1_intrawave_v3,1173.2,719.7,0.0
256,11734,2048,3072,ck,0,0,121.9308,a8w8_blockscale_1x128x128_256x128x128x128_16x16_32x32_2x2_8x32x1_8x32x1_1x32x1x8_8_1x1_intrawave_v3,1210.92,741.41,0.0
256,11833,2048,3072,ck,0,0,123.5822,a8w8_blockscale_1x128x128_256x128x128x128_16x16_32x32_2x2_8x32x1_8x32x1_1x32x1x8_8_1x1_intrawave_v3,1204.81,737.25,0.0
256,11894,2048,3072,ck,0,0,123.6108,a8w8_blockscale_1x128x128_256x128x128x128_16x16_32x32_2x2_8x32x1_8x32x1_1x32x1x8_8_1x1_intrawave_v3,1210.74,740.61,0.0
256,12003,2048,3072,ck,0,0,124.4189,a8w8_blockscale_1x128x128_256x128x128x128_16x16_32x32_2x2_8x32x1_8x32x1_1x32x1x8_8_1x1_intrawave_v3,1213.9,742.08,0.0
256,12004,2048,3072,ck,0,0,124.7728,a8w8_blockscale_1x128x128_256x128x128x128_16x16_32x32_2x2_8x32x1_8x32x1_1x32x1x8_8_1x1_intrawave_v3,1210.56,740.03,0.0
256,12020,2048,3072,ck,0,0,123.4236,a8w8_blockscale_1x128x128_256x128x128x128_16x16_32x32_2x2_8x32x1_8x32x1_1x32x1x8_8_1x1_intrawave_v3,1225.43,749.05,0.0
256,13004,2048,3072,ck,0,0,139.4206,a8w8_blockscale_1x128x128_256x128x128x128_16x16_32x32_2x2_8x32x1_8x32x1_1x32x1x8_8_1x1_intrawave_v3,1173.63,713.7,0.0
256,13169,2048,3072,ck,0,0,137.1177,a8w8_blockscale_1x128x128_256x128x128x128_16x16_32x32_2x2_8x32x1_8x32x1_1x32x1x8_8_1x1_intrawave_v3,1208.48,734.31,0.0
256,13182,2048,3072,ck,0,0,137.0673,a8w8_blockscale_1x128x128_256x128x128x128_16x16_32x32_2x2_8x32x1_8x32x1_1x32x1x8_8_1x1_intrawave_v3,1210.12,735.26,0.0
256,13663,2048,3072,ck,0,0,140.9709,a8w8_blockscale_1x128x128_256x128x128x128_16x16_32x32_2x2_8x32x1_8x32x1_1x32x1x8_8_1x1_intrawave_v3,1219.54,739.36,0.0
256,14002,2048,3072,ck,0,0,144.2842,a8w8_blockscale_1x128x128_256x128x128x128_16x16_32x32_2x2_8x32x1_8x32x1_1x32x1x8_8_1x1_intrawave_v3,1221.1,739.22,0.0
256,14005,2048,3072,ck,0,0,143.3346,a8w8_blockscale_1x128x128_256x128x128x128_16x16_32x32_2x2_8x32x1_8x32x1_1x32x1x8_8_1x1_intrawave_v3,1229.46,744.27,0.0
256,14008,2048,3072,ck,0,0,145.2426,a8w8_blockscale_1x128x128_256x128x128x128_16x16_32x32_2x2_8x32x1_8x32x1_1x32x1x8_8_1x1_intrawave_v3,1213.57,734.64,0.0
256,14022,2048,3072,ck,0,0,147.869,a8w8_blockscale_1x128x128_256x128x128x128_16x16_32x32_2x2_8x32x1_8x32x1_1x32x1x8_8_1x1_intrawave_v3,1193.2,722.27,0.0
256,14305,2048,3072,ck,0,0,148.425,a8w8_blockscale_1x128x128_256x128x128x128_16x16_32x32_2x2_8x32x1_8x32x1_1x32x1x8_8_1x1_intrawave_v3,1212.72,733.23,0.0
256,14433,2048,3072,ck,0,0,153.9639,a8w8_blockscale_1x128x128_256x128x128x128_16x16_32x32_2x2_8x32x1_8x32x1_1x32x1x8_8_1x1_intrawave_v3,1179.56,712.81,0.0
256,14434,2048,3072,ck,0,0,150.7166,a8w8_blockscale_1x128x128_256x128x128x128_16x16_32x32_2x2_8x32x1_8x32x1_1x32x1x8_8_1x1_intrawave_v3,1205.05,728.22,0.0
256,14476,2048,3072,ck,0,0,152.6907,a8w8_blockscale_1x128x128_256x128x128x128_16x16_32x32_2x2_8x32x1_8x32x1_1x32x1x8_8_1x1_intrawave_v3,1192.94,720.77,0.0
256,14837,2048,3072,ck,0,0,154.3558,a8w8_blockscale_1x128x128_256x128x128x128_16x16_32x32_2x2_8x32x1_8x32x1_1x32x1x8_8_1x1_intrawave_v3,1209.5,729.76,0.0
256,15000,2048,3072,ck,0,0,155.6703,a8w8_blockscale_1x128x128_256x128x128x128_16x16_32x32_2x2_8x32x1_8x32x1_1x32x1x8_8_1x1_intrawave_v3,1212.46,731.11,0.0
256,15001,2048,3072,ck,0,0,156.1054,a8w8_blockscale_1x128x128_256x128x128x128_16x16_32x32_2x2_8x32x1_8x32x1_1x32x1x8_8_1x1_intrawave_v3,1209.16,729.11,0.0
256,15004,2048,3072,ck,0,0,158.7259,a8w8_blockscale_1x128x128_256x128x128x128_16x16_32x32_2x2_8x32x1_8x32x1_1x32x1x8_8_1x1_intrawave_v3,1189.43,717.21,0.0
256,15015,2048,3072,ck,0,0,154.9149,a8w8_blockscale_1x128x128_256x128x128x128_16x16_32x32_2x2_8x32x1_8x32x1_1x32x1x8_8_1x1_intrawave_v3,1219.59,735.36,0.0
256,15019,2048,3072,ck,0,0,157.2411,a8w8_blockscale_1x128x128_256x128x128x128_16x16_32x32_2x2_8x32x1_8x32x1_1x32x1x8_8_1x1_intrawave_v3,1201.87,724.67,0.0
256,15042,2048,3072,ck,0,0,157.4879,a8w8_blockscale_1x128x128_256x128x128x128_16x16_32x32_2x2_8x32x1_8x32x1_1x32x1x8_8_1x1_intrawave_v3,1201.82,724.58,0.0
256,15045,2048,3072,ck,0,0,156.2195,a8w8_blockscale_1x128x128_256x128x128x128_16x16_32x32_2x2_8x32x1_8x32x1_1x32x1x8_8_1x1_intrawave_v3,1211.82,730.6,0.0
256,15061,2048,3072,ck,0,0,156.0779,a8w8_blockscale_1x128x128_256x128x128x128_16x16_32x32_2x2_8x32x1_8x32x1_1x32x1x8_8_1x1_intrawave_v3,1214.21,732.0,0.0
256,15154,2048,3072,ck,0,0,154.7187,a8w8_blockscale_1x128x128_256x128x128x128_16x16_32x32_2x2_8x32x1_8x32x1_1x32x1x8_8_1x1_intrawave_v3,1232.44,742.74,0.0
256,15241,2048,3072,ck,0,0,153.5794,a8w8_blockscale_1x128x128_256x128x128x128_16x16_32x32_2x2_8x32x1_8x32x1_1x32x1x8_8_1x1_intrawave_v3,1248.71,752.31,0.0
256,15248,2048,3072,ck,0,0,164.0334,a8w8_blockscale_1x128x128_256x128x128x128_16x16_32x32_2x2_8x32x1_8x32x1_1x32x1x8_8_1x1_intrawave_v3,1169.67,704.67,0.0
256,15249,2048,3072,ck,0,0,157.2677,a8w8_blockscale_1x128x128_256x128x128x128_16x16_32x32_2x2_8x32x1_8x32x1_1x32x1x8_8_1x1_intrawave_v3,1220.07,735.03,0.0
256,15509,2048,3072,ck,0,0,157.9041,a8w8_blockscale_1x128x128_256x128x128x128_16x16_32x32_2x2_8x32x1_8x32x1_1x32x1x8_8_1x1_intrawave_v3,1235.87,743.87,0.0
256,15529,2048,3072,ck,0,0,157.9271,a8w8_blockscale_1x128x128_256x128x128x128_16x16_32x32_2x2_8x32x1_8x32x1_1x32x1x8_8_1x1_intrawave_v3,1237.28,744.67,0.0
256,15621,2048,3072,ck,0,0,160.4339,a8w8_blockscale_1x128x128_256x128x128x128_16x16_32x32_2x2_8x32x1_8x32x1_1x32x1x8_8_1x1_intrawave_v3,1225.16,737.14,0.0
256,16294,2048,3072,ck,0,0,163.6759,a8w8_blockscale_1x128x128_256x128x128x128_16x16_32x32_2x2_8x32x1_8x32x1_1x32x1x8_8_1x1_intrawave_v3,1252.63,752.02,0.0
256,16699,2048,3072,ck,0,0,171.2644,a8w8_blockscale_1x128x128_256x128x128x128_16x16_32x32_2x2_8x32x1_8x32x1_1x32x1x8_8_1x1_intrawave_v3,1226.89,735.65,0.0
256,16876,2048,3072,ck,0,0,173.4384,a8w8_blockscale_1x128x128_256x128x128x128_16x16_32x32_2x2_8x32x1_8x32x1_1x32x1x8_8_1x1_intrawave_v3,1224.35,733.74,0.0
256,16887,2048,3072,ck,0,0,173.2916,a8w8_blockscale_1x128x128_256x128x128x128_16x16_32x32_2x2_8x32x1_8x32x1_1x32x1x8_8_1x1_intrawave_v3,1226.19,734.82,0.0
256,16943,2048,3072,ck,0,0,173.4252,a8w8_blockscale_1x128x128_256x128x128x128_16x16_32x32_2x2_8x32x1_8x32x1_1x32x1x8_8_1x1_intrawave_v3,1229.3,736.56,0.0
256,16978,2048,3072,ck,0,0,174.428,a8w8_blockscale_1x128x128_256x128x128x128_16x16_32x32_2x2_8x32x1_8x32x1_1x32x1x8_8_1x1_intrawave_v3,1224.76,733.77,0.0
256,17047,2048,3072,ck,0,0,173.6684,a8w8_blockscale_1x128x128_256x128x128x128_16x16_32x32_2x2_8x32x1_8x32x1_1x32x1x8_8_1x1_intrawave_v3,1235.12,739.83,0.0
256,17235,2048,3072,ck,0,0,183.533,a8w8_blockscale_1x128x128_256x128x128x128_16x16_32x32_2x2_8x32x1_8x32x1_1x32x1x8_8_1x1_intrawave_v3,1181.62,707.4,0.0
256,17241,2048,3072,ck,0,0,178.0186,a8w8_blockscale_1x128x128_256x128x128x128_16x16_32x32_2x2_8x32x1_8x32x1_1x32x1x8_8_1x1_intrawave_v3,1218.65,729.56,0.0
256,17301,2048,3072,ck,0,0,177.8565,a8w8_blockscale_1x128x128_256x128x128x128_16x16_32x32_2x2_8x32x1_8x32x1_1x32x1x8_8_1x1_intrawave_v3,1224.0,732.64,0.0
256,17872,2048,3072,ck,0,0,177.0613,a8w8_blockscale_1x128x128_256x128x128x128_16x16_32x32_2x2_8x32x1_8x32x1_1x32x1x8_8_1x1_intrawave_v3,1270.08,759.05,0.0
256,18004,2048,3072,ck,0,0,182.4263,a8w8_blockscale_1x128x128_256x128x128x128_16x16_32x32_2x2_8x32x1_8x32x1_1x32x1x8_8_1x1_intrawave_v3,1241.83,741.91,0.0
256,18006,2048,3072,ck,0,0,182.9161,a8w8_blockscale_1x128x128_256x128x128x128_16x16_32x32_2x2_8x32x1_8x32x1_1x32x1x8_8_1x1_intrawave_v3,1238.64,740.0,0.0
256,18014,2048,3072,ck,0,0,182.6717,a8w8_blockscale_1x128x128_256x128x128x128_16x16_32x32_2x2_8x32x1_8x32x1_1x32x1x8_8_1x1_intrawave_v3,1240.85,741.31,0.0
256,18046,2048,3072,ck,0,0,182.4723,a8w8_blockscale_1x128x128_256x128x128x128_16x16_32x32_2x2_8x32x1_8x32x1_1x32x1x8_8_1x1_intrawave_v3,1244.41,743.37,0.0
256,18055,2048,3072,ck,0,0,183.6925,a8w8_blockscale_1x128x128_256x128x128x128_16x16_32x32_2x2_8x32x1_8x32x1_1x32x1x8_8_1x1_intrawave_v3,1236.77,738.79,0.0
256,18247,2048,3072,ck,0,0,180.9058,a8w8_blockscale_1x128x128_256x128x128x128_16x16_32x32_2x2_8x32x1_8x32x1_1x32x1x8_8_1x1_intrawave_v3,1269.17,757.78,0.0
256,18371,2048,3072,ck,0,0,181.7151,a8w8_blockscale_1x128x128_256x128x128x128_16x16_32x32_2x2_8x32x1_8x32x1_1x32x1x8_8_1x1_intrawave_v3,1272.1,759.29,0.0
256,18671,2048,3072,ck,0,0,189.4385,a8w8_blockscale_1x128x128_256x128x128x128_16x16_32x32_2x2_8x32x1_8x32x1_1x32x1x8_8_1x1_intrawave_v3,1240.17,739.69,0.0
256,18910,2048,3072,ck,0,0,189.8546,a8w8_blockscale_1x128x128_256x128x128x128_16x16_32x32_2x2_8x32x1_8x32x1_1x32x1x8_8_1x1_intrawave_v3,1253.29,747.09,0.0
256,18964,2048,3072,ck,0,0,188.9152,a8w8_blockscale_1x128x128_256x128x128x128_16x16_32x32_2x2_8x32x1_8x32x1_1x32x1x8_8_1x1_intrawave_v3,1263.12,752.85,0.0
256,18996,2048,3072,ck,0,0,190.9557,a8w8_blockscale_1x128x128_256x128x128x128_16x16_32x32_2x2_8x32x1_8x32x1_1x32x1x8_8_1x1_intrawave_v3,1251.73,746.01,0.0
256,19600,2048,3072,ck,0,0,193.7193,a8w8_blockscale_1x128x128_256x128x128x128_16x16_32x32_2x2_8x32x1_8x32x1_1x32x1x8_8_1x1_intrawave_v3,1273.11,757.72,0.0
256,19690,2048,3072,ck,0,0,192.8849,a8w8_blockscale_1x128x128_256x128x128x128_16x16_32x32_2x2_8x32x1_8x32x1_1x32x1x8_8_1x1_intrawave_v3,1284.48,764.34,0.0
256,19798,2048,3072,ck,0,0,197.1159,a8w8_blockscale_1x128x128_256x128x128x128_16x16_32x32_2x2_8x32x1_8x32x1_1x32x1x8_8_1x1_intrawave_v3,1263.81,751.86,0.0
256,19875,2048,3072,ck,0,0,193.7641,a8w8_blockscale_1x128x128_256x128x128x128_16x16_32x32_2x2_8x32x1_8x32x1_1x32x1x8_8_1x1_intrawave_v3,1290.67,767.71,0.0
256,20000,2048,3072,ck,0,0,200.1806,a8w8_blockscale_1x128x128_256x128x128x128_16x16_32x32_2x2_8x32x1_8x32x1_1x32x1x8_8_1x1_intrawave_v3,1257.16,747.58,0.0
256,20001,2048,3072,ck,0,0,204.5522,a8w8_blockscale_1x128x128_256x128x128x128_16x16_32x32_2x2_8x32x1_8x32x1_1x32x1x8_8_1x1_intrawave_v3,1230.35,731.64,0.0
256,20002,2048,3072,ck,0,0,196.6378,a8w8_blockscale_1x128x128_256x128x128x128_16x16_32x32_2x2_8x32x1_8x32x1_1x32x1x8_8_1x1_intrawave_v3,1279.93,761.12,0.0
256,20003,2048,3072,ck,0,0,195.9883,a8w8_blockscale_1x128x128_256x128x128x128_16x16_32x32_2x2_8x32x1_8x32x1_1x32x1x8_8_1x1_intrawave_v3,1284.24,763.68,0.0
256,20004,2048,3072,ck,0,0,196.1072,a8w8_blockscale_1x128x128_256x128x128x128_16x16_32x32_2x2_8x32x1_8x32x1_1x32x1x8_8_1x1_intrawave_v3,1283.53,763.26,0.0
256,20006,2048,3072,ck,0,0,199.5581,a8w8_blockscale_1x128x128_256x128x128x128_16x16_32x32_2x2_8x32x1_8x32x1_1x32x1x8_8_1x1_intrawave_v3,1261.46,750.13,0.0
256,20013,2048,3072,ck,0,0,200.2053,a8w8_blockscale_1x128x128_256x128x128x128_16x16_32x32_2x2_8x32x1_8x32x1_1x32x1x8_8_1x1_intrawave_v3,1257.82,747.96,0.0
256,20015,2048,3072,ck,0,0,201.6097,a8w8_blockscale_1x128x128_256x128x128x128_16x16_32x32_2x2_8x32x1_8x32x1_1x32x1x8_8_1x1_intrawave_v3,1249.18,742.82,0.0
256,20017,2048,3072,ck,0,0,193.7597,a8w8_blockscale_1x128x128_256x128x128x128_16x16_32x32_2x2_8x32x1_8x32x1_1x32x1x8_8_1x1_intrawave_v3,1299.92,772.98,0.0
256,20020,2048,3072,ck,0,0,198.8137,a8w8_blockscale_1x128x128_256x128x128x128_16x16_32x32_2x2_8x32x1_8x32x1_1x32x1x8_8_1x1_intrawave_v3,1267.07,753.44,0.0
256,20028,2048,3072,ck,0,0,196.2885,a8w8_blockscale_1x128x128_256x128x128x128_16x16_32x32_2x2_8x32x1_8x32x1_1x32x1x8_8_1x1_intrawave_v3,1283.88,763.43,0.0
256,20030,2048,3072,ck,0,0,201.0417,a8w8_blockscale_1x128x128_256x128x128x128_16x16_32x32_2x2_8x32x1_8x32x1_1x32x1x8_8_1x1_intrawave_v3,1253.65,745.45,0.0
256,20040,2048,3072,ck,0,0,198.3521,a8w8_blockscale_1x128x128_256x128x128x128_16x16_32x32_2x2_8x32x1_8x32x1_1x32x1x8_8_1x1_intrawave_v3,1271.28,755.92,0.0
256,20060,2048,3072,ck,0,0,197.5837,a8w8_blockscale_1x128x128_256x128x128x128_16x16_32x32_2x2_8x32x1_8x32x1_1x32x1x8_8_1x1_intrawave_v3,1277.5,759.58,0.0
256,20157,2048,3072,ck,0,0,202.2987,a8w8_blockscale_1x128x128_256x128x128x128_16x16_32x32_2x2_8x32x1_8x32x1_1x32x1x8_8_1x1_intrawave_v3,1253.76,745.32,0.0
256,20226,2048,3072,ck,0,0,196.2802,a8w8_blockscale_1x128x128_256x128x128x128_16x16_32x32_2x2_8x32x1_8x32x1_1x32x1x8_8_1x1_intrawave_v3,1296.63,770.69,0.0
256,20239,2048,3072,ck,0,0,197.4438,a8w8_blockscale_1x128x128_256x128x128x128_16x16_32x32_2x2_8x32x1_8x32x1_1x32x1x8_8_1x1_intrawave_v3,1289.81,766.62,0.0
256,20242,2048,3072,ck,0,0,198.019,a8w8_blockscale_1x128x128_256x128x128x128_16x16_32x32_2x2_8x32x1_8x32x1_1x32x1x8_8_1x1_intrawave_v3,1286.26,764.5,0.0
256,20254,2048,3072,ck,0,0,199.1537,a8w8_blockscale_1x128x128_256x128x128x128_16x16_32x32_2x2_8x32x1_8x32x1_1x32x1x8_8_1x1_intrawave_v3,1279.69,760.58,0.0
256,20327,2048,3072,ck,0,0,196.4474,a8w8_blockscale_1x128x128_256x128x128x128_16x16_32x32_2x2_8x32x1_8x32x1_1x32x1x8_8_1x1_intrawave_v3,1301.99,773.72,0.0
256,20360,2048,3072,ck,0,0,200.9558,a8w8_blockscale_1x128x128_256x128x128x128_16x16_32x32_2x2_8x32x1_8x32x1_1x32x1x8_8_1x1_intrawave_v3,1274.85,757.54,0.0
256,20369,2048,3072,ck,0,0,197.3922,a8w8_blockscale_1x128x128_256x128x128x128_16x16_32x32_2x2_8x32x1_8x32x1_1x32x1x8_8_1x1_intrawave_v3,1298.44,771.54,0.0
256,20388,2048,3072,ck,0,0,200.153,a8w8_blockscale_1x128x128_256x128x128x128_16x16_32x32_2x2_8x32x1_8x32x1_1x32x1x8_8_1x1_intrawave_v3,1281.72,761.58,0.0
256,20414,2048,3072,ck,0,0,197.897,a8w8_blockscale_1x128x128_256x128x128x128_16x16_32x32_2x2_8x32x1_8x32x1_1x32x1x8_8_1x1_intrawave_v3,1297.99,771.2,0.0
256,20453,2048,3072,ck,0,0,201.2892,a8w8_blockscale_1x128x128_256x128x128x128_16x16_32x32_2x2_8x32x1_8x32x1_1x32x1x8_8_1x1_intrawave_v3,1278.55,759.6,0.0
256,20472,2048,3072,ck,0,0,197.9521,a8w8_blockscale_1x128x128_256x128x128x128_16x16_32x32_2x2_8x32x1_8x32x1_1x32x1x8_8_1x1_intrawave_v3,1301.31,773.09,0.0
256,20478,2048,3072,ck,0,0,198.5141,a8w8_blockscale_1x128x128_256x128x128x128_16x16_32x32_2x2_8x32x1_8x32x1_1x32x1x8_8_1x1_intrawave_v3,1298.01,771.12,0.0
256,20487,2048,3072,ck,0,0,204.7374,a8w8_blockscale_1x128x128_256x128x128x128_16x16_32x32_2x2_8x32x1_8x32x1_1x32x1x8_8_1x1_intrawave_v3,1259.11,747.99,0.0
256,20493,2048,3072,ck,0,0,207.4694,a8w8_blockscale_1x128x128_256x128x128x128_16x16_32x32_2x2_8x32x1_8x32x1_1x32x1x8_8_1x1_intrawave_v3,1242.89,738.35,0.0
256,20504,2048,3072,ck,0,0,202.8374,a8w8_blockscale_1x128x128_256x128x128x128_16x16_32x32_2x2_8x32x1_8x32x1_1x32x1x8_8_1x1_intrawave_v3,1271.95,755.6,0.0
256,20687,2048,3072,ck,0,0,205.0931,a8w8_blockscale_1x128x128_256x128x128x128_16x16_32x32_2x2_8x32x1_8x32x1_1x32x1x8_8_1x1_intrawave_v3,1269.19,753.69,0.0
256,20768,2048,3072,ck,0,0,203.4734,a8w8_blockscale_1x128x128_256x128x128x128_16x16_32x32_2x2_8x32x1_8x32x1_1x32x1x8_8_1x1_intrawave_v3,1284.31,762.54,0.0
256,20771,2048,3072,ck,0,0,204.8043,a8w8_blockscale_1x128x128_256x128x128x128_16x16_32x32_2x2_8x32x1_8x32x1_1x32x1x8_8_1x1_intrawave_v3,1276.14,757.69,0.0
256,20784,2048,3072,ck,0,0,203.8002,a8w8_blockscale_1x128x128_256x128x128x128_16x16_32x32_2x2_8x32x1_8x32x1_1x32x1x8_8_1x1_intrawave_v3,1283.23,761.88,0.0
256,20842,2048,3072,ck,0,0,207.7363,a8w8_blockscale_1x128x128_256x128x128x128_16x16_32x32_2x2_8x32x1_8x32x1_1x32x1x8_8_1x1_intrawave_v3,1262.43,749.44,0.0
256,20850,2048,3072,ck,0,0,205.5306,a8w8_blockscale_1x128x128_256x128x128x128_16x16_32x32_2x2_8x32x1_8x32x1_1x32x1x8_8_1x1_intrawave_v3,1276.47,757.77,0.0
256,21003,2048,3072,ck,0,0,204.931,a8w8_blockscale_1x128x128_256x128x128x128_16x16_32x32_2x2_8x32x1_8x32x1_1x32x1x8_8_1x1_intrawave_v3,1289.6,765.34,0.0
256,21011,2048,3072,ck,0,0,209.2598,a8w8_blockscale_1x128x128_256x128x128x128_16x16_32x32_2x2_8x32x1_8x32x1_1x32x1x8_8_1x1_intrawave_v3,1263.4,749.78,0.0
256,21170,2048,3072,ck,0,0,207.5699,a8w8_blockscale_1x128x128_256x128x128x128_16x16_32x32_2x2_8x32x1_8x32x1_1x32x1x8_8_1x1_intrawave_v3,1283.33,761.37,0.0
256,21225,2048,3072,ck,0,0,205.8819,a8w8_blockscale_1x128x128_256x128x128x128_16x16_32x32_2x2_8x32x1_8x32x1_1x32x1x8_8_1x1_intrawave_v3,1297.21,769.53,0.0
256,21470,2048,3072,ck,0,0,206.8466,a8w8_blockscale_1x128x128_256x128x128x128_16x16_32x32_2x2_8x32x1_8x32x1_1x32x1x8_8_1x1_intrawave_v3,1306.07,774.43,0.0
256,21743,2048,3072,ck,0,0,210.9299,a8w8_blockscale_1x128x128_256x128x128x128_16x16_32x32_2x2_8x32x1_8x32x1_1x32x1x8_8_1x1_intrawave_v3,1297.07,768.72,0.0
256,21830,2048,3072,ck,0,0,212.9199,a8w8_blockscale_1x128x128_256x128x128x128_16x16_32x32_2x2_8x32x1_8x32x1_1x32x1x8_8_1x1_intrawave_v3,1290.09,764.46,0.0
256,22001,2048,3072,ck,0,0,217.9303,a8w8_blockscale_1x128x128_256x128x128x128_16x16_32x32_2x2_8x32x1_8x32x1_1x32x1x8_8_1x1_intrawave_v3,1270.3,752.51,0.0
256,22059,2048,3072,ck,0,0,217.9115,a8w8_blockscale_1x128x128_256x128x128x128_16x16_32x32_2x2_8x32x1_8x32x1_1x32x1x8_8_1x1_intrawave_v3,1273.76,754.48,0.0
256,22187,2048,3072,ck,0,0,216.3663,a8w8_blockscale_1x128x128_256x128x128x128_16x16_32x32_2x2_8x32x1_8x32x1_1x32x1x8_8_1x1_intrawave_v3,1290.3,764.11,0.0
256,22213,2048,3072,ck,0,0,215.9099,a8w8_blockscale_1x128x128_256x128x128x128_16x16_32x32_2x2_8x32x1_8x32x1_1x32x1x8_8_1x1_intrawave_v3,1294.54,766.59,0.0
256,22341,2048,3072,ck,0,0,216.7583,a8w8_blockscale_1x128x128_256x128x128x128_16x16_32x32_2x2_8x32x1_8x32x1_1x32x1x8_8_1x1_intrawave_v3,1296.9,767.82,0.0
256,22360,2048,3072,ck,0,0,215.9295,a8w8_blockscale_1x128x128_256x128x128x128_16x16_32x32_2x2_8x32x1_8x32x1_1x32x1x8_8_1x1_intrawave_v3,1302.99,771.4,0.0
256,22410,2048,3072,ck,0,0,218.4091,a8w8_blockscale_1x128x128_256x128x128x128_16x16_32x32_2x2_8x32x1_8x32x1_1x32x1x8_8_1x1_intrawave_v3,1291.08,764.28,0.0
256,23173,2048,3072,ck,0,0,222.8807,a8w8_blockscale_1x128x128_256x128x128x128_16x16_32x32_2x2_8x32x1_8x32x1_1x32x1x8_8_1x1_intrawave_v3,1308.25,773.49,0.0
256,23227,2048,3072,ck,0,0,228.2736,a8w8_blockscale_1x128x128_256x128x128x128_16x16_32x32_2x2_8x32x1_8x32x1_1x32x1x8_8_1x1_intrawave_v3,1280.32,756.91,0.0
256,23334,2048,3072,ck,0,0,227.6636,a8w8_blockscale_1x128x128_256x128x128x128_16x16_32x32_2x2_8x32x1_8x32x1_1x32x1x8_8_1x1_intrawave_v3,1289.66,762.31,0.0
256,23718,2048,3072,ck,0,0,227.2564,a8w8_blockscale_1x128x128_256x128x128x128_16x16_32x32_2x2_8x32x1_8x32x1_1x32x1x8_8_1x1_intrawave_v3,1313.24,775.78,0.0
256,23755,2048,3072,ck,0,0,227.0972,a8w8_blockscale_1x128x128_256x128x128x128_16x16_32x32_2x2_8x32x1_8x32x1_1x32x1x8_8_1x1_intrawave_v3,1316.21,777.5,0.0
256,23795,2048,3072,ck,0,0,231.172,a8w8_blockscale_1x128x128_256x128x128x128_16x16_32x32_2x2_8x32x1_8x32x1_1x32x1x8_8_1x1_intrawave_v3,1295.18,765.03,0.0
256,23997,2048,3072,ck,0,0,233.5608,a8w8_blockscale_1x128x128_256x128x128x128_16x16_32x32_2x2_8x32x1_8x32x1_1x32x1x8_8_1x1_intrawave_v3,1292.82,763.41,0.0
256,24003,2048,3072,ck,0,0,224.7135,a8w8_blockscale_1x128x128_256x128x128x128_16x16_32x32_2x2_8x32x1_8x32x1_1x32x1x8_8_1x1_intrawave_v3,1344.06,793.65,0.0
256,24675,2048,3072,ck,0,0,242.4701,a8w8_blockscale_1x128x128_256x128x128x128_16x16_32x32_2x2_8x32x1_8x32x1_1x32x1x8_8_1x1_intrawave_v3,1280.5,755.4,0.0
256,25000,2048,3072,ck,0,0,239.8057,a8w8_blockscale_1x128x128_256x128x128x128_16x16_32x32_2x2_8x32x1_8x32x1_1x32x1x8_8_1x1_intrawave_v3,1311.78,773.51,0.0
256,25003,2048,3072,ck,0,0,235.1728,a8w8_blockscale_1x128x128_256x128x128x128_16x16_32x32_2x2_8x32x1_8x32x1_1x32x1x8_8_1x1_intrawave_v3,1337.78,788.84,0.0
256,25004,2048,3072,ck,0,0,237.9484,a8w8_blockscale_1x128x128_256x128x128x128_16x16_32x32_2x2_8x32x1_8x32x1_1x32x1x8_8_1x1_intrawave_v3,1322.23,779.67,0.0
256,25007,2048,3072,ck,0,0,238.1861,a8w8_blockscale_1x128x128_256x128x128x128_16x16_32x32_2x2_8x32x1_8x32x1_1x32x1x8_8_1x1_intrawave_v3,1321.07,778.98,0.0
256,25009,2048,3072,ck,0,0,236.3388,a8w8_blockscale_1x128x128_256x128x128x128_16x16_32x32_2x2_8x32x1_8x32x1_1x32x1x8_8_1x1_intrawave_v3,1331.5,785.13,0.0
256,25019,2048,3072,ck,0,0,240.088,a8w8_blockscale_1x128x128_256x128x128x128_16x16_32x32_2x2_8x32x1_8x32x1_1x32x1x8_8_1x1_intrawave_v3,1311.24,773.17,0.0
256,25033,2048,3072,ck,0,0,243.3916,a8w8_blockscale_1x128x128_256x128x128x128_16x16_32x32_2x2_8x32x1_8x32x1_1x32x1x8_8_1x1_intrawave_v3,1294.16,763.08,0.0
256,25045,2048,3072,ck,0,0,239.114,a8w8_blockscale_1x128x128_256x128x128x128_16x16_32x32_2x2_8x32x1_8x32x1_1x32x1x8_8_1x1_intrawave_v3,1317.94,777.09,0.0
256,25090,2048,3072,ck,0,0,242.6944,a8w8_blockscale_1x128x128_256x128x128x128_16x16_32x32_2x2_8x32x1_8x32x1_1x32x1x8_8_1x1_intrawave_v3,1300.83,766.96,0.0
256,25117,2048,3072,ck,0,0,240.0356,a8w8_blockscale_1x128x128_256x128x128x128_16x16_32x32_2x2_8x32x1_8x32x1_1x32x1x8_8_1x1_intrawave_v3,1316.66,776.26,0.0
256,25238,2048,3072,ck,0,0,241.0376,a8w8_blockscale_1x128x128_256x128x128x128_16x16_32x32_2x2_8x32x1_8x32x1_1x32x1x8_8_1x1_intrawave_v3,1317.5,776.63,0.0
256,25507,2048,3072,ck,0,0,239.6156,a8w8_blockscale_1x128x128_256x128x128x128_16x16_32x32_2x2_8x32x1_8x32x1_1x32x1x8_8_1x1_intrawave_v3,1339.45,789.29,0.0
256,25943,2048,3072,ck,0,0,248.2376,a8w8_blockscale_1x128x128_256x128x128x128_16x16_32x32_2x2_8x32x1_8x32x1_1x32x1x8_8_1x1_intrawave_v3,1315.02,774.46,0.0
256,26762,2048,3072,ck,0,0,255.6005,a8w8_blockscale_1x128x128_256x128x128x128_16x16_32x32_2x2_8x32x1_8x32x1_1x32x1x8_8_1x1_intrawave_v3,1317.46,775.12,0.0
256,26798,2048,3072,ck,0,0,258.9873,a8w8_blockscale_1x128x128_256x128x128x128_16x16_32x32_2x2_8x32x1_8x32x1_1x32x1x8_8_1x1_intrawave_v3,1301.98,765.98,0.0
256,27235,2048,3072,ck,0,0,257.1621,a8w8_blockscale_1x128x128_256x128x128x128_16x16_32x32_2x2_8x32x1_8x32x1_1x32x1x8_8_1x1_intrawave_v3,1332.61,783.6,0.0
256,27239,2048,3072,ck,0,0,255.8546,a8w8_blockscale_1x128x128_256x128x128x128_16x16_32x32_2x2_8x32x1_8x32x1_1x32x1x8_8_1x1_intrawave_v3,1339.61,787.72,0.0
256,27246,2048,3072,ck,0,0,259.8289,a8w8_blockscale_1x128x128_256x128x128x128_16x16_32x32_2x2_8x32x1_8x32x1_1x32x1x8_8_1x1_intrawave_v3,1319.46,775.86,0.0
256,27262,2048,3072,ck,0,0,255.4048,a8w8_blockscale_1x128x128_256x128x128x128_16x16_32x32_2x2_8x32x1_8x32x1_1x32x1x8_8_1x1_intrawave_v3,1343.1,789.75,0.0
256,27494,2048,3072,ck,0,0,260.1589,a8w8_blockscale_1x128x128_256x128x128x128_16x16_32x32_2x2_8x32x1_8x32x1_1x32x1x8_8_1x1_intrawave_v3,1329.78,781.71,0.0
256,27666,2048,3072,ck,0,0,264.0593,a8w8_blockscale_1x128x128_256x128x128x128_16x16_32x32_2x2_8x32x1_8x32x1_1x32x1x8_8_1x1_intrawave_v3,1318.34,774.83,0.0
256,27718,2048,3072,ck,0,0,259.1019,a8w8_blockscale_1x128x128_256x128x128x128_16x16_32x32_2x2_8x32x1_8x32x1_1x32x1x8_8_1x1_intrawave_v3,1346.08,791.09,0.0
256,27997,2048,3072,ck,0,0,267.8733,a8w8_blockscale_1x128x128_256x128x128x128_16x16_32x32_2x2_8x32x1_8x32x1_1x32x1x8_8_1x1_intrawave_v3,1315.11,772.66,0.0
256,28004,2048,3072,ck,0,0,261.9892,a8w8_blockscale_1x128x128_256x128x128x128_16x16_32x32_2x2_8x32x1_8x32x1_1x32x1x8_8_1x1_intrawave_v3,1344.99,790.2,0.0
256,28006,2048,3072,ck,0,0,264.9681,a8w8_blockscale_1x128x128_256x128x128x128_16x16_32x32_2x2_8x32x1_8x32x1_1x32x1x8_8_1x1_intrawave_v3,1329.96,781.37,0.0
256,28036,2048,3072,ck,0,0,264.1318,a8w8_blockscale_1x128x128_256x128x128x128_16x16_32x32_2x2_8x32x1_8x32x1_1x32x1x8_8_1x1_intrawave_v3,1335.6,784.66,0.0
256,28142,2048,3072,ck,0,0,264.5557,a8w8_blockscale_1x128x128_256x128x128x128_16x16_32x32_2x2_8x32x1_8x32x1_1x32x1x8_8_1x1_intrawave_v3,1338.5,786.27,0.0
256,28198,2048,3072,ck,0,0,265.0017,a8w8_blockscale_1x128x128_256x128x128x128_16x16_32x32_2x2_8x32x1_8x32x1_1x32x1x8_8_1x1_intrawave_v3,1338.91,786.47,0.0
256,28205,2048,3072,ck,0,0,265.1133,a8w8_blockscale_1x128x128_256x128x128x128_16x16_32x32_2x2_8x32x1_8x32x1_1x32x1x8_8_1x1_intrawave_v3,1338.68,786.32,0.0
256,28249,2048,3072,ck,0,0,265.5593,a8w8_blockscale_1x128x128_256x128x128x128_16x16_32x32_2x2_8x32x1_8x32x1_1x32x1x8_8_1x1_intrawave_v3,1338.51,786.19,0.0
256,28494,2048,3072,ck,0,0,264.6745,a8w8_blockscale_1x128x128_256x128x128x128_16x16_32x32_2x2_8x32x1_8x32x1_1x32x1x8_8_1x1_intrawave_v3,1354.64,795.45,0.0
256,28698,2048,3072,ck,0,0,273.5157,a8w8_blockscale_1x128x128_256x128x128x128_16x16_32x32_2x2_8x32x1_8x32x1_1x32x1x8_8_1x1_intrawave_v3,1320.23,775.09,0.0
256,28959,2048,3072,ck,0,0,272.4381,a8w8_blockscale_1x128x128_256x128x128x128_16x16_32x32_2x2_8x32x1_8x32x1_1x32x1x8_8_1x1_intrawave_v3,1337.51,785.02,0.0
256,29003,2048,3072,ck,0,0,278.0338,a8w8_blockscale_1x128x128_256x128x128x128_16x16_32x32_2x2_8x32x1_8x32x1_1x32x1x8_8_1x1_intrawave_v3,1312.58,770.36,0.0
256,29013,2048,3072,ck,0,0,273.6232,a8w8_blockscale_1x128x128_256x128x128x128_16x16_32x32_2x2_8x32x1_8x32x1_1x32x1x8_8_1x1_intrawave_v3,1334.2,783.04,0.0
256,29035,2048,3072,ck,0,0,274.3438,a8w8_blockscale_1x128x128_256x128x128x128_16x16_32x32_2x2_8x32x1_8x32x1_1x32x1x8_8_1x1_intrawave_v3,1331.7,781.55,0.0
256,29338,2048,3072,ck,0,0,291.9993,a8w8_blockscale_1x128x128_256x128x128x128_16x16_32x32_2x2_8x32x1_8x32x1_1x32x1x8_8_1x1_intrawave_v3,1264.24,741.74,0.0
256,30000,2048,3072,ck,0,0,281.5626,a8w8_blockscale_1x128x128_256x128x128x128_16x16_32x32_2x2_8x32x1_8x32x1_1x32x1x8_8_1x1_intrawave_v3,1340.69,786.08,0.0
256,30001,2048,3072,ck,0,0,283.6318,a8w8_blockscale_1x128x128_256x128x128x128_16x16_32x32_2x2_8x32x1_8x32x1_1x32x1x8_8_1x1_intrawave_v3,1330.95,780.37,0.0
256,30002,2048,3072,ck,0,0,283.5174,a8w8_blockscale_1x128x128_256x128x128x128_16x16_32x32_2x2_8x32x1_8x32x1_1x32x1x8_8_1x1_intrawave_v3,1331.53,780.71,0.0
256,30003,2048,3072,ck,0,0,285.5678,a8w8_blockscale_1x128x128_256x128x128x128_16x16_32x32_2x2_8x32x1_8x32x1_1x32x1x8_8_1x1_intrawave_v3,1322.02,775.13,0.0
256,30006,2048,3072,ck,0,0,279.6298,a8w8_blockscale_1x128x128_256x128x128x128_16x16_32x32_2x2_8x32x1_8x32x1_1x32x1x8_8_1x1_intrawave_v3,1350.22,791.67,0.0
256,30010,2048,3072,ck,0,0,286.6459,a8w8_blockscale_1x128x128_256x128x128x128_16x16_32x32_2x2_8x32x1_8x32x1_1x32x1x8_8_1x1_intrawave_v3,1317.35,772.39,0.0
256,30012,2048,3072,ck,0,0,284.1226,a8w8_blockscale_1x128x128_256x128x128x128_16x16_32x32_2x2_8x32x1_8x32x1_1x32x1x8_8_1x1_intrawave_v3,1329.14,779.3,0.0
256,30013,2048,3072,ck,0,0,280.7618,a8w8_blockscale_1x128x128_256x128x128x128_16x16_32x32_2x2_8x32x1_8x32x1_1x32x1x8_8_1x1_intrawave_v3,1345.09,788.66,0.0
256,30026,2048,3072,ck,0,0,283.0722,a8w8_blockscale_1x128x128_256x128x128x128_16x16_32x32_2x2_8x32x1_8x32x1_1x32x1x8_8_1x1_intrawave_v3,1334.69,782.55,0.0
256,30029,2048,3072,ck,0,0,281.9014,a8w8_blockscale_1x128x128_256x128x128x128_16x16_32x32_2x2_8x32x1_8x32x1_1x32x1x8_8_1x1_intrawave_v3,1340.37,785.88,0.0
256,30034,2048,3072,ck,0,0,284.427,a8w8_blockscale_1x128x128_256x128x128x128_16x16_32x32_2x2_8x32x1_8x32x1_1x32x1x8_8_1x1_intrawave_v3,1328.69,779.02,0.0
256,30042,2048,3072,ck,0,0,284.5682,a8w8_blockscale_1x128x128_256x128x128x128_16x16_32x32_2x2_8x32x1_8x32x1_1x32x1x8_8_1x1_intrawave_v3,1328.38,778.84,0.0
256,30045,2048,3072,ck,0,0,283.0174,a8w8_blockscale_1x128x128_256x128x128x128_16x16_32x32_2x2_8x32x1_8x32x1_1x32x1x8_8_1x1_intrawave_v3,1335.8,783.18,0.0
256,30048,2048,3072,ck,0,0,281.7962,a8w8_blockscale_1x128x128_256x128x128x128_16x16_32x32_2x2_8x32x1_8x32x1_1x32x1x8_8_1x1_intrawave_v3,1341.72,786.65,0.0
256,30061,2048,3072,ck,0,0,280.2882,a8w8_blockscale_1x128x128_256x128x128x128_16x16_32x32_2x2_8x32x1_8x32x1_1x32x1x8_8_1x1_intrawave_v3,1349.52,791.22,0.0
256,30089,2048,3072,ck,0,0,286.4122,a8w8_blockscale_1x128x128_256x128x128x128_16x16_32x32_2x2_8x32x1_8x32x1_1x32x1x8_8_1x1_intrawave_v3,1321.9,775.0,0.0
256,30096,2048,3072,ck,0,0,281.391,a8w8_blockscale_1x128x128_256x128x128x128_16x16_32x32_2x2_8x32x1_8x32x1_1x32x1x8_8_1x1_intrawave_v3,1345.8,789.01,0.0
256,30109,2048,3072,ck,0,0,282.031,a8w8_blockscale_1x128x128_256x128x128x128_16x16_32x32_2x2_8x32x1_8x32x1_1x32x1x8_8_1x1_intrawave_v3,1343.32,787.55,0.0
256,30112,2048,3072,ck,0,0,278.6133,a8w8_blockscale_1x128x128_256x128x128x128_16x16_32x32_2x2_8x32x1_8x32x1_1x32x1x8_8_1x1_intrawave_v3,1359.94,797.29,0.0
256,30113,2048,3072,ck,0,0,279.8486,a8w8_blockscale_1x128x128_256x128x128x128_16x16_32x32_2x2_8x32x1_8x32x1_1x32x1x8_8_1x1_intrawave_v3,1353.98,793.79,0.0
256,30116,2048,3072,ck,0,0,281.5506,a8w8_blockscale_1x128x128_256x128x128x128_16x16_32x32_2x2_8x32x1_8x32x1_1x32x1x8_8_1x1_intrawave_v3,1345.93,789.07,0.0
256,30237,2048,3072,ck,0,0,284.2518,a8w8_blockscale_1x128x128_256x128x128x128_16x16_32x32_2x2_8x32x1_8x32x1_1x32x1x8_8_1x1_intrawave_v3,1338.49,784.62,0.0
256,30240,2048,3072,ck,0,0,286.4926,a8w8_blockscale_1x128x128_256x128x128x128_16x16_32x32_2x2_8x32x1_8x32x1_1x32x1x8_8_1x1_intrawave_v3,1328.16,778.56,0.0
256,30243,2048,3072,ck,0,0,282.199,a8w8_blockscale_1x128x128_256x128x128x128_16x16_32x32_2x2_8x32x1_8x32x1_1x32x1x8_8_1x1_intrawave_v3,1348.5,790.48,0.0
256,30244,2048,3072,ck,0,0,283.9798,a8w8_blockscale_1x128x128_256x128x128x128_16x16_32x32_2x2_8x32x1_8x32x1_1x32x1x8_8_1x1_intrawave_v3,1340.09,785.55,0.0
256,30247,2048,3072,ck,0,0,285.435,a8w8_blockscale_1x128x128_256x128x128x128_16x16_32x32_2x2_8x32x1_8x32x1_1x32x1x8_8_1x1_intrawave_v3,1333.39,781.62,0.0
256,30473,2048,3072,ck,0,0,282.7818,a8w8_blockscale_1x128x128_256x128x128x128_16x16_32x32_2x2_8x32x1_8x32x1_1x32x1x8_8_1x1_intrawave_v3,1355.95,794.68,0.0
256,30480,2048,3072,ck,0,0,281.3646,a8w8_blockscale_1x128x128_256x128x128x128_16x16_32x32_2x2_8x32x1_8x32x1_1x32x1x8_8_1x1_intrawave_v3,1363.1,798.86,0.0
256,30486,2048,3072,ck,0,0,280.8166,a8w8_blockscale_1x128x128_256x128x128x128_16x16_32x32_2x2_8x32x1_8x32x1_1x32x1x8_8_1x1_intrawave_v3,1366.03,800.58,0.0
256,30487,2048,3072,ck,0,0,279.4277,a8w8_blockscale_1x128x128_256x128x128x128_16x16_32x32_2x2_8x32x1_8x32x1_1x32x1x8_8_1x1_intrawave_v3,1372.86,804.58,0.0
256,30494,2048,3072,ck,0,0,280.9162,a8w8_blockscale_1x128x128_256x128x128x128_16x16_32x32_2x2_8x32x1_8x32x1_1x32x1x8_8_1x1_intrawave_v3,1365.9,800.5,0.0
256,30760,2048,3072,ck,0,0,286.925,a8w8_blockscale_1x128x128_256x128x128x128_16x16_32x32_2x2_8x32x1_8x32x1_1x32x1x8_8_1x1_intrawave_v3,1348.96,790.38,0.0
256,31001,2048,3072,ck,0,0,288.6022,a8w8_blockscale_1x128x128_256x128x128x128_16x16_32x32_2x2_8x32x1_8x32x1_1x32x1x8_8_1x1_intrawave_v3,1351.63,791.77,0.0
256,31003,2048,3072,ck,0,0,291.5078,a8w8_blockscale_1x128x128_256x128x128x128_16x16_32x32_2x2_8x32x1_8x32x1_1x32x1x8_8_1x1_intrawave_v3,1338.24,783.93,0.0
256,31033,2048,3072,ck,0,0,291.2306,a8w8_blockscale_1x128x128_256x128x128x128_16x16_32x32_2x2_8x32x1_8x32x1_1x32x1x8_8_1x1_intrawave_v3,1340.81,785.41,0.0
256,31363,2048,3072,ck,0,0,296.398,a8w8_blockscale_1x128x128_256x128x128x128_16x16_32x32_2x2_8x32x1_8x32x1_1x32x1x8_8_1x1_intrawave_v3,1331.45,779.7,0.0
256,31631,2048,3072,ck,0,0,294.7879,a8w8_blockscale_1x128x128_256x128x128x128_16x16_32x32_2x2_8x32x1_8x32x1_1x32x1x8_8_1x1_intrawave_v3,1350.16,790.47,0.0
256,31726,2048,3072,ck,0,0,295.9936,a8w8_blockscale_1x128x128_256x128x128x128_16x16_32x32_2x2_8x32x1_8x32x1_1x32x1x8_8_1x1_intrawave_v3,1348.7,789.56,0.0
256,31796,2048,3072,ck,0,0,296.992,a8w8_blockscale_1x128x128_256x128x128x128_16x16_32x32_2x2_8x32x1_8x32x1_1x32x1x8_8_1x1_intrawave_v3,1347.13,788.59,0.0
256,31859,2048,3072,ck,0,0,297.846,a8w8_blockscale_1x128x128_256x128x128x128_16x16_32x32_2x2_8x32x1_8x32x1_1x32x1x8_8_1x1_intrawave_v3,1345.93,787.85,0.0
256,31917,2048,3072,ck,0,0,299.0524,a8w8_blockscale_1x128x128_256x128x128x128_16x16_32x32_2x2_8x32x1_8x32x1_1x32x1x8_8_1x1_intrawave_v3,1342.94,786.06,0.0
256,31997,2048,3072,ck,0,0,297.7584,a8w8_blockscale_1x128x128_256x128x128x128_16x16_32x32_2x2_8x32x1_8x32x1_1x32x1x8_8_1x1_intrawave_v3,1352.15,791.4,0.0
256,31998,2048,3072,ck,0,0,296.5428,a8w8_blockscale_1x128x128_256x128x128x128_16x16_32x32_2x2_8x32x1_8x32x1_1x32x1x8_8_1x1_intrawave_v3,1357.74,794.67,0.0
256,32001,2048,3072,ck,0,0,304.1437,a8w8_blockscale_1x128x128_256x128x128x128_16x16_32x32_2x2_8x32x1_8x32x1_1x32x1x8_8_1x1_intrawave_v3,1323.93,774.88,0.0
256,32002,2048,3072,ck,0,0,298.8812,a8w8_blockscale_1x128x128_256x128x128x128_16x16_32x32_2x2_8x32x1_8x32x1_1x32x1x8_8_1x1_intrawave_v3,1347.29,788.55,0.0
256,32003,2048,3072,ck,0,0,300.7553,a8w8_blockscale_1x128x128_256x128x128x128_16x16_32x32_2x2_8x32x1_8x32x1_1x32x1x8_8_1x1_intrawave_v3,1338.93,783.66,0.0
256,32005,2048,3072,ck,0,0,300.398,a8w8_blockscale_1x128x128_256x128x128x128_16x16_32x32_2x2_8x32x1_8x32x1_1x32x1x8_8_1x1_intrawave_v3,1340.61,784.64,0.0
256,32006,2048,3072,ck,0,0,297.3928,a8w8_blockscale_1x128x128_256x128x128x128_16x16_32x32_2x2_8x32x1_8x32x1_1x32x1x8_8_1x1_intrawave_v3,1354.2,792.59,0.0
256,32007,2048,3072,ck,0,0,300.0066,a8w8_blockscale_1x128x128_256x128x128x128_16x16_32x32_2x2_8x32x1_8x32x1_1x32x1x8_8_1x1_intrawave_v3,1342.44,785.71,0.0
256,32008,2048,3072,ck,0,0,298.2156,a8w8_blockscale_1x128x128_256x128x128x128_16x16_32x32_2x2_8x32x1_8x32x1_1x32x1x8_8_1x1_intrawave_v3,1350.55,790.45,0.0
256,32009,2048,3072,ck,0,0,299.8616,a8w8_blockscale_1x128x128_256x128x128x128_16x16_32x32_2x2_8x32x1_8x32x1_1x32x1x8_8_1x1_intrawave_v3,1343.17,786.14,0.0
256,32011,2048,3072,ck,0,0,300.4893,a8w8_blockscale_1x128x128_256x128x128x128_16x16_32x32_2x2_8x32x1_8x32x1_1x32x1x8_8_1x1_intrawave_v3,1340.45,784.54,0.0
256,32015,2048,3072,ck,0,0,299.4612,a8w8_blockscale_1x128x128_256x128x128x128_16x16_32x32_2x2_8x32x1_8x32x1_1x32x1x8_8_1x1_intrawave_v3,1345.22,787.33,0.0
256,32017,2048,3072,ck,0,0,298.4028,a8w8_blockscale_1x128x128_256x128x128x128_16x16_32x32_2x2_8x32x1_8x32x1_1x32x1x8_8_1x1_intrawave_v3,1350.08,790.17,0.0
256,32019,2048,3072,ck,0,0,296.4577,a8w8_blockscale_1x128x128_256x128x128x128_16x16_32x32_2x2_8x32x1_8x32x1_1x32x1x8_8_1x1_intrawave_v3,1359.02,795.4,0.0
256,32024,2048,3072,ck,0,0,302.5608,a8w8_blockscale_1x128x128_256x128x128x128_16x16_32x32_2x2_8x32x1_8x32x1_1x32x1x8_8_1x1_intrawave_v3,1331.82,779.48,0.0
256,32041,2048,3072,ck,0,0,296.7816,a8w8_blockscale_1x128x128_256x128x128x128_16x16_32x32_2x2_8x32x1_8x32x1_1x32x1x8_8_1x1_intrawave_v3,1358.47,795.07,0.0
256,32043,2048,3072,ck,0,0,299.0948,a8w8_blockscale_1x128x128_256x128x128x128_16x16_32x32_2x2_8x32x1_8x32x1_1x32x1x8_8_1x1_intrawave_v3,1348.05,788.97,0.0
256,32064,2048,3072,ck,0,0,296.6955,a8w8_blockscale_1x128x128_256x128x128x128_16x16_32x32_2x2_8x32x1_8x32x1_1x32x1x8_8_1x1_intrawave_v3,1359.84,795.85,0.0
256,32123,2048,3072,ck,0,0,299.952,a8w8_blockscale_1x128x128_256x128x128x128_16x16_32x32_2x2_8x32x1_8x32x1_1x32x1x8_8_1x1_intrawave_v3,1347.55,788.62,0.0
256,32125,2048,3072,ck,0,0,299.84,a8w8_blockscale_1x128x128_256x128x128x128_16x16_32x32_2x2_8x32x1_8x32x1_1x32x1x8_8_1x1_intrawave_v3,1348.14,788.97,0.0
256,32164,2048,3072,ck,0,0,296.4031,a8w8_blockscale_1x128x128_256x128x128x128_16x16_32x32_2x2_8x32x1_8x32x1_1x32x1x8_8_1x1_intrawave_v3,1365.43,799.06,0.0
256,32244,2048,3072,ck,0,0,297.4883,a8w8_blockscale_1x128x128_256x128x128x128_16x16_32x32_2x2_8x32x1_8x32x1_1x32x1x8_8_1x1_intrawave_v3,1363.83,798.07,0.0
256,32308,2048,3072,ck,0,0,297.6403,a8w8_blockscale_1x128x128_256x128x128x128_16x16_32x32_2x2_8x32x1_8x32x1_1x32x1x8_8_1x1_intrawave_v3,1365.84,799.2,0.0
256,32382,2048,3072,ck,0,0,298.1143,a8w8_blockscale_1x128x128_256x128x128x128_16x16_32x32_2x2_8x32x1_8x32x1_1x32x1x8_8_1x1_intrawave_v3,1366.79,799.71,0.0
256,32415,2048,3072,ck,0,0,300.1823,a8w8_blockscale_1x128x128_256x128x128x128_16x16_32x32_2x2_8x32x1_8x32x1_1x32x1x8_8_1x1_intrawave_v3,1358.76,794.99,0.0
256,32416,2048,3072,ck,0,0,296.2867,a8w8_blockscale_1x128x128_256x128x128x128_16x16_32x32_2x2_8x32x1_8x32x1_1x32x1x8_8_1x1_intrawave_v3,1376.67,805.47,0.0
256,32435,2048,3072,ck,0,0,297.0331,a8w8_blockscale_1x128x128_256x128x128x128_16x16_32x32_2x2_8x32x1_8x32x1_1x32x1x8_8_1x1_intrawave_v3,1374.01,803.9,0.0
256,32465,2048,3072,ck,0,0,297.4279,a8w8_blockscale_1x128x128_256x128x128x128_16x16_32x32_2x2_8x32x1_8x32x1_1x32x1x8_8_1x1_intrawave_v3,1373.46,803.56,0.0
256,32474,2048,3072,ck,0,0,302.5656,a8w8_blockscale_1x128x128_256x128x128x128_16x16_32x32_2x2_8x32x1_8x32x1_1x32x1x8_8_1x1_intrawave_v3,1350.51,790.13,0.0
256,32483,2048,3072,ck,0,0,300.2539,a8w8_blockscale_1x128x128_256x128x128x128_16x16_32x32_2x2_8x32x1_8x32x1_1x32x1x8_8_1x1_intrawave_v3,1361.28,796.42,0.0
256,32692,2048,3072,ck,0,0,297.7587,a8w8_blockscale_1x128x128_256x128x128x128_16x16_32x32_2x2_8x32x1_8x32x1_1x32x1x8_8_1x1_intrawave_v3,1381.52,808.13,0.0
256,32768,2048,3072,ck,0,0,298.9455,a8w8_blockscale_1x128x128_256x128x128x128_16x16_32x32_2x2_8x32x1_8x32x1_1x32x1x8_8_1x1_intrawave_v3,1379.24,806.74,0.0
256,1,3072,3072,ck,8,0,10.7391,a8w8_blockscale_1x128x128_256x16x64x256_16x16_16x16_1x1_16x16x1_16x16x1_1x16x1x16_4_1x1_intrawave_v1,1.76,879.63,0.0
256,1,3072,6144,ck,8,0,17.9676,a8w8_blockscale_1x128x128_256x16x64x256_16x16_16x16_1x1_16x16x1_16x16x1_1x16x1x16_4_1x1_intrawave_v1,2.1,1051.15,0.0
256,2,3072,3072,ck,8,0,11.0945,a8w8_blockscale_1x128x128_256x16x64x256_16x16_16x16_1x1_16x16x1_16x16x1_1x16x1x16_4_1x1_intrawave_v1,3.4,852.28,0.0
256,2,3072,6144,ck,8,0,18.1191,a8w8_blockscale_1x128x128_256x16x64x256_16x16_16x16_1x1_16x16x1_16x16x1_1x16x1x16_4_1x1_intrawave_v1,4.17,1043.04,0.0
256,4,3072,3072,ck,8,0,11.2174,a8w8_blockscale_1x128x128_256x16x64x256_16x16_16x16_1x1_16x16x1_16x16x1_1x16x1x16_4_1x1_intrawave_v1,6.73,844.59,0.0
256,4,3072,6144,ck,8,0,18.1154,a8w8_blockscale_1x128x128_256x16x64x256_16x16_16x16_1x1_16x16x1_16x16x1_1x16x1x16_4_1x1_intrawave_v1,8.34,1044.61,0.0
256,8,3072,3072,ck,8,0,11.2266,a8w8_blockscale_1x128x128_256x16x64x256_16x16_16x16_1x1_16x16x1_16x16x1_1x16x1x16_4_1x1_intrawave_v1,13.45,847.18,0.0
256,8,3072,6144,ck,8,0,18.1398,a8w8_blockscale_1x128x128_256x16x64x256_16x16_16x16_1x1_16x16x1_16x16x1_1x16x1x16_4_1x1_intrawave_v1,16.65,1045.91,0.0
256,16,3072,3072,ck,8,0,11.3548,a8w8_blockscale_1x128x128_256x16x64x256_16x16_16x16_1x1_16x16x1_16x16x1_1x16x1x16_4_1x1_intrawave_v1,26.6,844.1,0.0
256,16,3072,6144,ck,8,0,17.952,a8w8_blockscale_1x128x128_256x16x64x256_16x16_16x16_1x1_16x16x1_16x16x1_1x16x1x16_4_1x1_intrawave_v1,33.64,1062.33,0.0
256,24,3072,3072,ck,8,0,11.211,a8w8_blockscale_1x128x128_256x16x64x256_16x16_16x16_1x1_16x16x1_16x16x1_1x16x1x16_4_1x1_intrawave_v1,40.41,861.51,0.0
256,24,3072,6144,ck,8,0,18.161,a8w8_blockscale_1x128x128_256x16x64x256_16x16_16x16_1x1_16x16x1_16x16x1_1x16x1x16_4_1x1_intrawave_v1,49.89,1055.52,0.0
256,32,3072,3072,ck,8,0,11.0011,a8w8_blockscale_1x128x128_256x16x64x256_16x16_16x16_1x1_16x16x1_16x16x1_1x16x1x16_4_1x1_intrawave_v1,54.9,884.65,0.0
256,32,3072,6144,ck,8,0,17.8502,a8w8_blockscale_1x128x128_256x16x64x256_16x16_16x16_1x1_16x16x1_16x16x1_1x16x1x16_4_1x1_intrawave_v1,67.67,1079.4,0.0
256,40,3072,3072,ck,8,0,11.0078,a8w8_blockscale_1x128x128_256x16x64x256_16x16_16x16_1x1_16x16x1_16x16x1_1x16x1x16_4_1x1_intrawave_v1,68.59,890.81,0.0
256,40,3072,6144,ck,8,0,18.0926,a8w8_blockscale_1x128x128_256x16x64x256_16x16_16x16_1x1_16x16x1_16x16x1_1x16x1x16_4_1x1_intrawave_v1,83.46,1070.38,0.0
256,48,3072,3072,ck,8,0,10.9195,a8w8_blockscale_1x128x128_256x16x64x256_16x16_16x16_1x1_16x16x1_16x16x1_1x16x1x16_4_1x1_intrawave_v1,82.97,904.76,0.0
256,48,3072,6144,ck,8,0,17.7191,a8w8_blockscale_1x128x128_256x16x64x256_16x16_16x16_1x1_16x16x1_16x16x1_1x16x1x16_4_1x1_intrawave_v1,102.26,1098.49,0.0
256,56,3072,3072,ck,8,0,11.322,a8w8_blockscale_1x128x128_256x16x64x256_16x16_16x16_1x1_16x16x1_16x16x1_1x16x1x16_4_1x1_intrawave_v1,93.35,879.11,0.0
256,56,3072,6144,ck,8,0,18.1412,a8w8_blockscale_1x128x128_256x16x64x256_16x16_16x16_1x1_16x16x1_16x16x1_1x16x1x16_4_1x1_intrawave_v1,116.53,1078.35,0.0
256,64,3072,3072,ck,8,0,10.8791,a8w8_blockscale_1x128x128_256x16x64x256_16x16_16x16_1x1_16x16x1_16x16x1_1x16x1x16_4_1x1_intrawave_v1,111.03,921.68,0.0
256,64,3072,6144,ck,8,0,17.6684,a8w8_blockscale_1x128x128_256x16x64x256_16x16_16x16_1x1_16x16x1_16x16x1_1x16x1x16_4_1x1_intrawave_v1,136.74,1112.77,0.0
256,72,3072,3072,ck,8,0,11.3797,a8w8_blockscale_1x128x128_256x16x64x256_16x16_16x16_1x1_16x16x1_16x16x1_1x16x1x16_4_1x1_intrawave_v1,119.42,887.61,0.0
256,72,3072,6144,ck,8,0,18.3859,a8w8_blockscale_1x128x128_256x16x64x256_16x16_16x16_1x1_16x16x1_16x16x1_1x16x1x16_4_1x1_intrawave_v1,147.83,1074.69,0.0
256,80,3072,3072,ck,18,0,11.3168,a8w8_blockscale_1x128x128_256x64x64x256_16x16_32x32_1x1_16x16x1_16x16x1_1x32x1x8_8_1x1_intrawave_v1,133.43,899.06,0.0
256,80,3072,6144,ck,8,0,17.9431,a8w8_blockscale_1x128x128_256x16x64x256_16x16_16x16_1x1_16x16x1_16x16x1_1x16x1x16_4_1x1_intrawave_v1,168.3,1106.69,0.0
256,88,3072,3072,ck,18,0,11.7235,a8w8_blockscale_1x128x128_256x64x64x256_16x16_32x32_1x1_16x16x1_16x16x1_1x32x1x8_8_1x1_intrawave_v1,141.68,874.16,0.0
256,88,3072,6144,ck,8,0,19.0095,a8w8_blockscale_1x128x128_256x16x64x256_16x16_16x16_1x1_16x16x1_16x16x1_1x16x1x16_4_1x1_intrawave_v1,174.75,1049.78,0.0
256,96,3072,3072,ck,7,0,11.2747,a8w8_blockscale_1x128x128_256x16x128x256_16x16_16x16_1x2_16x16x1_16x16x1_1x16x1x16_8_1x2_intrawave_v1,160.71,915.49,0.0
256,96,3072,6144,ck,8,0,18.554,a8w8_blockscale_1x128x128_256x16x64x256_16x16_16x16_1x1_16x16x1_16x16x1_1x16x1x16_4_1x1_intrawave_v1,195.32,1080.85,0.0
256,104,3072,3072,ck,8,0,11.6875,a8w8_blockscale_1x128x128_256x16x64x256_16x16_16x16_1x1_16x16x1_16x16x1_1x16x1x16_4_1x1_intrawave_v1,167.95,889.47,0.0
256,104,3072,6144,ck,18,0,19.365,a8w8_blockscale_1x128x128_256x64x64x256_16x16_32x32_1x1_16x16x1_16x16x1_1x32x1x8_8_1x1_intrawave_v1,202.73,1040.66,0.0
256,112,3072,3072,ck,7,0,11.4663,a8w8_blockscale_1x128x128_256x16x128x256_16x16_16x16_1x2_16x16x1_16x16x1_1x16x1x16_8_1x2_intrawave_v1,184.36,913.06,0.0
256,112,3072,6144,ck,18,0,19.4615,a8w8_blockscale_1x128x128_256x64x64x256_16x16_32x32_1x1_16x16x1_16x16x1_1x32x1x8_8_1x1_intrawave_v1,217.24,1040.55,0.0
256,120,3072,3072,ck,18,0,11.7295,a8w8_blockscale_1x128x128_256x64x64x256_16x16_32x32_1x1_16x16x1_16x16x1_1x32x1x8_8_1x1_intrawave_v1,193.1,898.85,0.0
256,120,3072,6144,ck,7,0,19.2923,a8w8_blockscale_1x128x128_256x16x128x256_16x16_16x16_1x2_16x16x1_16x16x1_1x16x1x16_8_1x2_intrawave_v1,234.8,1054.77,0.0
256,128,3072,3072,ck,8,0,12.0091,a8w8_blockscale_1x128x128_256x16x64x256_16x16_16x16_1x1_16x16x1_16x16x1_1x16x1x16_4_1x1_intrawave_v1,201.17,884.07,0.0
256,128,3072,6144,ck,7,0,19.1716,a8w8_blockscale_1x128x128_256x16x128x256_16x16_16x16_1x2_16x16x1_16x16x1_1x16x1x16_8_1x2_intrawave_v1,252.03,1066.54,0.0
256,136,3072,3072,ck,18,0,11.8539,a8w8_blockscale_1x128x128_256x64x64x256_16x16_32x32_1x1_16x16x1_16x16x1_1x32x1x8_8_1x1_intrawave_v1,216.55,901.86,0.0
256,136,3072,6144,ck,18,0,19.2506,a8w8_blockscale_1x128x128_256x64x64x256_16x16_32x32_1x1_16x16x1_16x16x1_1x32x1x8_8_1x1_intrawave_v1,266.68,1067.27,0.0
256,144,3072,3072,ck,7,0,11.1953,a8w8_blockscale_1x128x128_256x16x128x256_16x16_16x16_1x2_16x16x1_16x16x1_1x16x1x16_8_1x2_intrawave_v1,242.77,961.5,0.0
256,144,3072,6144,ck,18,0,19.3652,a8w8_blockscale_1x128x128_256x64x64x256_16x16_32x32_1x1_16x16x1_16x16x1_1x32x1x8_8_1x1_intrawave_v1,280.7,1066.03,0.0
256,152,3072,3072,ck,7,0,11.6647,a8w8_blockscale_1x128x128_256x16x128x256_16x16_16x16_1x2_16x16x1_16x16x1_1x16x1x16_8_1x2_intrawave_v1,245.95,929.13,0.0
256,152,3072,6144,ck,18,0,19.378,a8w8_blockscale_1x128x128_256x64x64x256_16x16_32x32_1x1_16x16x1_16x16x1_1x32x1x8_8_1x1_intrawave_v1,296.1,1070.4,0.0
256,160,3072,3072,ck,18,0,11.3186,a8w8_blockscale_1x128x128_256x64x64x256_16x16_32x32_1x1_16x16x1_16x16x1_1x32x1x8_8_1x1_intrawave_v1,266.81,964.05,0.0
256,160,3072,6144,ck,18,0,19.3684,a8w8_blockscale_1x128x128_256x64x64x256_16x16_32x32_1x1_16x16x1_16x16x1_1x32x1x8_8_1x1_intrawave_v1,311.84,1076.0,0.0
256,168,3072,3072,ck,18,0,11.6642,a8w8_blockscale_1x128x128_256x64x64x256_16x16_32x32_1x1_16x16x1_16x16x1_1x32x1x8_8_1x1_intrawave_v1,271.85,941.81,0.0
256,168,3072,6144,ck,18,0,19.4805,a8w8_blockscale_1x128x128_256x64x64x256_16x16_32x32_1x1_16x16x1_16x16x1_1x32x1x8_8_1x1_intrawave_v1,325.55,1074.86,0.0
256,176,3072,3072,ck,18,0,11.7862,a8w8_blockscale_1x128x128_256x64x64x256_16x16_32x32_1x1_16x16x1_16x16x1_1x32x1x8_8_1x1_intrawave_v1,281.85,938.32,0.0
256,176,3072,6144,ck,18,0,19.5647,a8w8_blockscale_1x128x128_256x64x64x256_16x16_32x32_1x1_16x16x1_16x16x1_1x32x1x8_8_1x1_intrawave_v1,339.58,1075.26,0.0
256,184,3072,3072,ck,12,0,12.1017,a8w8_blockscale_1x128x128_256x32x128x256_16x16_32x32_1x1_16x16x1_16x16x1_1x32x1x8_8_1x1_intrawave_v1,286.97,919.95,0.0
256,184,3072,6144,ck,18,0,19.6143,a8w8_blockscale_1x128x128_256x64x64x256_16x16_32x32_1x1_16x16x1_16x16x1_1x32x1x8_8_1x1_intrawave_v1,354.12,1077.55,0.0
256,192,3072,3072,ck,18,0,11.3465,a8w8_blockscale_1x128x128_256x64x64x256_16x16_32x32_1x1_16x16x1_16x16x1_1x32x1x8_8_1x1_intrawave_v1,319.38,987.68,0.0
256,192,3072,6144,ck,18,0,19.657,a8w8_blockscale_1x128x128_256x64x64x256_16x16_32x32_1x1_16x16x1_16x16x1_1x32x1x8_8_1x1_intrawave_v1,368.71,1080.21,0.0
256,200,3072,3072,ck,18,0,11.7056,a8w8_blockscale_1x128x128_256x64x64x256_16x16_32x32_1x1_16x16x1_16x16x1_1x32x1x8_8_1x1_intrawave_v1,322.48,963.67,0.0
256,200,3072,6144,ck,18,0,19.4884,a8w8_blockscale_1x128x128_256x64x64x256_16x16_32x32_1x1_16x16x1_16x16x1_1x32x1x8_8_1x1_intrawave_v1,387.4,1094.6,0.0
256,208,3072,3072,ck,18,0,11.3931,a8w8_blockscale_1x128x128_256x64x64x256_16x16_32x32_1x1_16x16x1_16x16x1_1x32x1x8_8_1x1_intrawave_v1,344.58,996.58,0.0
256,208,3072,6144,ck,18,0,19.5442,a8w8_blockscale_1x128x128_256x64x64x256_16x16_32x32_1x1_16x16x1_16x16x1_1x32x1x8_8_1x1_intrawave_v1,401.74,1096.5,0.0
256,216,3072,3072,ck,18,0,11.4318,a8w8_blockscale_1x128x128_256x64x64x256_16x16_32x32_1x1_16x16x1_16x16x1_1x32x1x8_8_1x1_intrawave_v1,356.62,999.65,0.0
256,216,3072,6144,ck,18,0,19.5493,a8w8_blockscale_1x128x128_256x64x64x256_16x16_32x32_1x1_16x16x1_16x16x1_1x32x1x8_8_1x1_intrawave_v1,417.09,1101.25,0.0
256,224,3072,3072,ck,18,0,11.6631,a8w8_blockscale_1x128x128_256x64x64x256_16x16_32x32_1x1_16x16x1_16x16x1_1x32x1x8_8_1x1_intrawave_v1,362.5,986.15,0.0
256,224,3072,6144,ck,18,0,19.5149,a8w8_blockscale_1x128x128_256x64x64x256_16x16_32x32_1x1_16x16x1_16x16x1_1x32x1x8_8_1x1_intrawave_v1,433.3,1108.22,0.0
256,232,3072,3072,ck,18,0,11.4682,a8w8_blockscale_1x128x128_256x64x64x256_16x16_32x32_1x1_16x16x1_16x16x1_1x32x1x8_8_1x1_intrawave_v1,381.83,1009.34,0.0
256,232,3072,6144,ck,18,0,19.6137,a8w8_blockscale_1x128x128_256x64x64x256_16x16_32x32_1x1_16x16x1_16x16x1_1x32x1x8_8_1x1_intrawave_v1,446.51,1107.65,0.0
256,240,3072,3072,ck,18,0,12.0015,a8w8_blockscale_1x128x128_256x64x64x256_16x16_32x32_1x1_16x16x1_16x16x1_1x32x1x8_8_1x1_intrawave_v1,377.44,970.63,0.0
256,240,3072,6144,ck,18,0,19.6361,a8w8_blockscale_1x128x128_256x64x64x256_16x16_32x32_1x1_16x16x1_16x16x1_1x32x1x8_8_1x1_intrawave_v1,461.38,1111.4,0.0
256,248,3072,3072,ck,18,0,11.5146,a8w8_blockscale_1x128x128_256x64x64x256_16x16_32x32_1x1_16x16x1_16x16x1_1x32x1x8_8_1x1_intrawave_v1,406.51,1018.08,0.0
256,248,3072,6144,ck,18,0,19.7019,a8w8_blockscale_1x128x128_256x64x64x256_16x16_32x32_1x1_16x16x1_16x16x1_1x32x1x8_8_1x1_intrawave_v1,475.17,1112.67,0.0
256,256,3072,3072,ck,18,0,11.4259,a8w8_blockscale_1x128x128_256x64x64x256_16x16_32x32_1x1_16x16x1_16x16x1_1x32x1x8_8_1x1_intrawave_v1,422.88,1032.43,0.0
256,256,3072,6144,ck,18,0,19.7186,a8w8_blockscale_1x128x128_256x64x64x256_16x16_32x32_1x1_16x16x1_16x16x1_1x32x1x8_8_1x1_intrawave_v1,490.08,1116.72,0.0
256,272,3072,3072,ck,18,0,11.8013,a8w8_blockscale_1x128x128_256x64x64x256_16x16_32x32_1x1_16x16x1_16x16x1_1x32x1x8_8_1x1_intrawave_v1,435.02,1012.09,0.0
256,272,3072,6144,ck,18,0,19.9949,a8w8_blockscale_1x128x128_256x64x64x256_16x16_32x32_1x1_16x16x1_16x16x1_1x32x1x8_8_1x1_intrawave_v1,513.51,1111.12,0.0
256,288,3072,3072,ck,18,0,11.635,a8w8_blockscale_1x128x128_256x64x64x256_16x16_32x32_1x1_16x16x1_16x16x1_1x32x1x8_8_1x1_intrawave_v1,467.2,1039.23,0.0
256,288,3072,6144,ck,18,0,20.0434,a8w8_blockscale_1x128x128_256x64x64x256_16x16_32x32_1x1_16x16x1_16x16x1_1x32x1x8_8_1x1_intrawave_v1,542.4,1118.24,0.0
256,304,3072,3072,ck,18,0,11.7131,a8w8_blockscale_1x128x128_256x64x64x256_16x16_32x32_1x1_16x16x1_16x16x1_1x32x1x8_8_1x1_intrawave_v1,489.86,1044.89,0.0
256,304,3072,6144,ck,18,0,20.1361,a8w8_blockscale_1x128x128_256x64x64x256_16x16_32x32_1x1_16x16x1_16x16x1_1x32x1x8_8_1x1_intrawave_v1,569.9,1122.85,0.0
256,320,3072,3072,ck,18,0,11.597,a8w8_blockscale_1x128x128_256x64x64x256_16x16_32x32_1x1_16x16x1_16x16x1_1x32x1x8_8_1x1_intrawave_v1,520.81,1068.06,0.0
256,320,3072,6144,ck,18,0,20.2616,a8w8_blockscale_1x128x128_256x64x64x256_16x16_32x32_1x1_16x16x1_16x16x1_1x32x1x8_8_1x1_intrawave_v1,596.18,1125.6,0.0
256,336,3072,3072,ck,18,0,15.2368,a8w8_blockscale_1x128x128_256x64x64x256_16x16_32x32_1x1_16x16x1_16x16x1_1x32x1x8_8_1x1_intrawave_v1,416.22,822.6,0.0
256,336,3072,6144,ck,18,0,25.9855,a8w8_blockscale_1x128x128_256x64x64x256_16x16_32x32_1x1_16x16x1_16x16x1_1x32x1x8_8_1x1_intrawave_v1,488.1,885.23,0.0
256,352,3072,3072,ck,18,0,15.436,a8w8_blockscale_1x128x128_256x64x64x256_16x16_32x32_1x1_16x16x1_16x16x1_1x32x1x8_8_1x1_intrawave_v1,430.41,821.54,0.0
256,352,3072,6144,ck,18,0,26.0648,a8w8_blockscale_1x128x128_256x64x64x256_16x16_32x32_1x1_16x16x1_16x16x1_1x32x1x8_8_1x1_intrawave_v1,509.79,890.08,0.0
256,368,3072,3072,ck,18,0,15.5012,a8w8_blockscale_1x128x128_256x64x64x256_16x16_32x32_1x1_16x16x1_16x16x1_1x32x1x8_8_1x1_intrawave_v1,448.08,827.59,0.0
256,368,3072,6144,ck,18,0,26.1735,a8w8_blockscale_1x128x128_256x64x64x256_16x16_32x32_1x1_16x16x1_16x16x1_1x32x1x8_8_1x1_intrawave_v1,530.75,893.89,0.0
256,384,3072,3072,ck,18,0,15.2715,a8w8_blockscale_1x128x128_256x64x64x256_16x16_32x32_1x1_16x16x1_16x16x1_1x32x1x8_8_1x1_intrawave_v1,474.59,849.7,0.0
256,384,3072,6144,ck,18,0,26.0545,a8w8_blockscale_1x128x128_256x64x64x256_16x16_32x32_1x1_16x16x1_16x16x1_1x32x1x8_8_1x1_intrawave_v1,556.35,905.52,0.0
256,400,3072,3072,ck,18,0,15.917,a8w8_blockscale_1x128x128_256x64x64x256_16x16_32x32_1x1_16x16x1_16x16x1_1x32x1x8_8_1x1_intrawave_v1,474.32,824.5,0.0
256,400,3072,6144,ck,18,0,28.8855,a8w8_blockscale_1x128x128_256x64x64x256_16x16_32x32_1x1_16x16x1_16x16x1_1x32x1x8_8_1x1_intrawave_v1,522.74,823.58,0.0
256,416,3072,3072,ck,18,0,15.9799,a8w8_blockscale_1x128x128_256x64x64x256_16x16_32x32_1x1_16x16x1_16x16x1_1x32x1x8_8_1x1_intrawave_v1,491.35,830.48,0.0
256,416,3072,6144,ck,18,0,28.8916,a8w8_blockscale_1x128x128_256x64x64x256_16x16_32x32_1x1_16x16x1_16x16x1_1x32x1x8_8_1x1_intrawave_v1,543.53,830.21,0.0
256,432,3072,3072,ck,18,0,16.0519,a8w8_blockscale_1x128x128_256x64x64x256_16x16_32x32_1x1_16x16x1_16x16x1_1x32x1x8_8_1x1_intrawave_v1,507.96,835.94,0.0
256,432,3072,6144,ck,18,0,28.9824,a8w8_blockscale_1x128x128_256x64x64x256_16x16_32x32_1x1_16x16x1_16x16x1_1x32x1x8_8_1x1_intrawave_v1,562.67,834.4,0.0
256,448,3072,3072,ck,18,0,16.1287,a8w8_blockscale_1x128x128_256x64x64x256_16x16_32x32_1x1_16x16x1_16x16x1_1x32x1x8_8_1x1_intrawave_v1,524.27,841.11,0.0
256,448,3072,6144,ck,18,0,28.7674,a8w8_blockscale_1x128x128_256x64x64x256_16x16_32x32_1x1_16x16x1_16x16x1_1x32x1x8_8_1x1_intrawave_v1,587.87,847.47,0.0
256,464,3072,3072,ck,18,0,16.5269,a8w8_blockscale_1x128x128_256x64x64x256_16x16_32x32_1x1_16x16x1_16x16x1_1x32x1x8_8_1x1_intrawave_v1,529.91,829.76,0.0
256,464,3072,6144,ck,18,0,28.8127,a8w8_blockscale_1x128x128_256x64x64x256_16x16_32x32_1x1_16x16x1_16x16x1_1x32x1x8_8_1x1_intrawave_v1,607.91,852.96,0.0
256,480,3072,3072,ck,18,0,16.3433,a8w8_blockscale_1x128x128_256x64x64x256_16x16_32x32_1x1_16x16x1_16x16x1_1x32x1x8_8_1x1_intrawave_v1,554.34,848.11,0.0
256,480,3072,6144,ck,18,0,29.2006,a8w8_blockscale_1x128x128_256x64x64x256_16x16_32x32_1x1_16x16x1_16x16x1_1x32x1x8_8_1x1_intrawave_v1,620.51,848.36,0.0
256,496,3072,3072,ck,18,0,16.5347,a8w8_blockscale_1x128x128_256x64x64x256_16x16_32x32_1x1_16x16x1_16x16x1_1x32x1x8_8_1x1_intrawave_v1,566.18,847.21,0.0
256,496,3072,6144,ck,18,0,29.1685,a8w8_blockscale_1x128x128_256x64x64x256_16x16_32x32_1x1_16x16x1_16x16x1_1x32x1x8_8_1x1_intrawave_v1,641.9,856.03,0.0
256,512,3072,3072,ck,18,0,16.7295,a8w8_blockscale_1x128x128_256x64x64x256_16x16_32x32_1x1_16x16x1_16x16x1_1x32x1x8_8_1x1_intrawave_v1,577.64,846.16,0.0
256,512,3072,6144,ck,18,0,29.635,a8w8_blockscale_1x128x128_256x64x64x256_16x16_32x32_1x1_16x16x1_16x16x1_1x32x1x8_8_1x1_intrawave_v1,652.18,849.19,0.0
256,822,3072,3072,ck,18,0,23.3535,a8w8_blockscale_1x128x128_256x64x64x256_16x16_32x32_1x1_16x16x1_16x16x1_1x32x1x8_8_1x1_intrawave_v1,664.34,728.49,0.0
256,1000,3072,3072,ck,18,0,24.4343,a8w8_blockscale_1x128x128_256x64x64x256_16x16_32x32_1x1_16x16x1_16x16x1_1x32x1x8_8_1x1_intrawave_v1,772.45,763.4,0.0
256,1000,3072,6144,ck,18,0,45.9309,a8w8_blockscale_1x128x128_256x64x64x256_16x16_32x32_1x1_16x16x1_16x16x1_1x32x1x8_8_1x1_intrawave_v1,821.86,678.46,0.0
256,1001,3072,3072,ck,18,0,24.251,a8w8_blockscale_1x128x128_256x64x64x256_16x16_32x32_1x1_16x16x1_16x16x1_1x32x1x8_8_1x1_intrawave_v1,779.07,769.55,0.0
256,1001,3072,6144,ck,18,0,46.1813,a8w8_blockscale_1x128x128_256x64x64x256_16x16_32x32_1x1_16x16x1_16x16x1_1x32x1x8_8_1x1_intrawave_v1,818.22,675.05,0.0
256,1002,3072,3072,ck,18,0,24.6537,a8w8_blockscale_1x128x128_256x64x64x256_16x16_32x32_1x1_16x16x1_16x16x1_1x32x1x8_8_1x1_intrawave_v1,767.11,757.36,0.0
256,1003,3072,3072,ck,18,0,24.5227,a8w8_blockscale_1x128x128_256x64x64x256_16x16_32x32_1x1_16x16x1_16x16x1_1x32x1x8_8_1x1_intrawave_v1,771.98,761.78,0.0
256,1004,3072,3072,ck,18,0,24.6341,a8w8_blockscale_1x128x128_256x64x64x256_16x16_32x32_1x1_16x16x1_16x16x1_1x32x1x8_8_1x1_intrawave_v1,769.25,758.71,0.0
256,1021,3072,3072,ck,18,0,24.9648,a8w8_blockscale_1x128x128_256x64x64x256_16x16_32x32_1x1_16x16x1_16x16x1_1x32x1x8_8_1x1_intrawave_v1,771.92,754.93,0.0
256,1023,3072,3072,ck,18,0,24.3908,a8w8_blockscale_1x128x128_256x64x64x256_16x16_32x32_1x1_16x16x1_16x16x1_1x32x1x8_8_1x1_intrawave_v1,791.63,773.45,0.0
256,1024,3072,3072,ck,18,0,24.4735,a8w8_blockscale_1x128x128_256x64x64x256_16x16_32x32_1x1_16x16x1_16x16x1_1x32x1x8_8_1x1_intrawave_v1,789.73,771.22,0.0
256,1030,3072,3072,ck,0,0,26.4218,a8w8_blockscale_1x128x128_256x128x128x128_16x16_32x32_2x2_8x32x1_8x32x1_1x32x1x8_8_1x1_intrawave_v3,735.78,716.44,0.0
256,1031,3072,3072,ck,0,0,26.4344,a8w8_blockscale_1x128x128_256x128x128x128_16x16_32x32_2x2_8x32x1_8x32x1_1x32x1x8_8_1x1_intrawave_v3,736.14,716.45,0.0
256,1031,3072,6144,ck,0,0,47.0852,a8w8_blockscale_1x128x128_256x128x128x128_16x16_32x32_2x2_8x32x1_8x32x1_1x32x1x8_8_1x1_intrawave_v3,826.56,669.92,0.0
256,1082,3072,6144,ck,0,0,46.642,a8w8_blockscale_1x128x128_256x128x128x128_16x16_32x32_2x2_8x32x1_8x32x1_1x32x1x8_8_1x1_intrawave_v3,875.69,689.72,0.0
256,1113,3072,6144,ck,0,0,47.3908,a8w8_blockscale_1x128x128_256x128x128x128_16x16_32x32_2x2_8x32x1_8x32x1_1x32x1x8_8_1x1_intrawave_v3,886.55,686.86,0.0
256,1122,3072,3072,ck,0,0,27.0674,a8w8_blockscale_1x128x128_256x128x128x128_16x16_32x32_2x2_8x32x1_8x32x1_1x32x1x8_8_1x1_intrawave_v3,782.38,730.68,0.0
256,1209,3072,3072,ck,0,0,27.4666,a8w8_blockscale_1x128x128_256x128x128x128_16x16_32x32_2x2_8x32x1_8x32x1_1x32x1x8_8_1x1_intrawave_v3,830.79,749.25,0.0
256,1211,3072,6144,ck,0,0,47.9461,a8w8_blockscale_1x128x128_256x128x128x128_16x16_32x32_2x2_8x32x1_8x32x1_1x32x1x8_8_1x1_intrawave_v3,953.44,704.02,0.0
256,1212,3072,6144,ck,0,0,48.4139,a8w8_blockscale_1x128x128_256x128x128x128_16x16_32x32_2x2_8x32x1_8x32x1_1x32x1x8_8_1x1_intrawave_v3,945.01,697.47,0.0
256,1214,3072,6144,ck,0,0,47.6736,a8w8_blockscale_1x128x128_256x128x128x128_16x16_32x32_2x2_8x32x1_8x32x1_1x32x1x8_8_1x1_intrawave_v3,961.27,708.82,0.0
256,1216,3072,6144,ck,0,0,47.7457,a8w8_blockscale_1x128x128_256x128x128x128_16x16_32x32_2x2_8x32x1_8x32x1_1x32x1x8_8_1x1_intrawave_v3,961.39,708.26,0.0
256,1217,3072,6144,ck,0,0,48.5945,a8w8_blockscale_1x128x128_256x128x128x128_16x16_32x32_2x2_8x32x1_8x32x1_1x32x1x8_8_1x1_intrawave_v3,945.38,696.15,0.0
256,1218,3072,6144,ck,0,0,48.6837,a8w8_blockscale_1x128x128_256x128x128x128_16x16_32x32_2x2_8x32x1_8x32x1_1x32x1x8_8_1x1_intrawave_v3,944.42,695.12,0.0
256,1219,3072,6144,ck,0,0,48.7041,a8w8_blockscale_1x128x128_256x128x128x128_16x16_32x32_2x2_8x32x1_8x32x1_1x32x1x8_8_1x1_intrawave_v3,944.8,695.08,0.0
256,1222,3072,6144,ck,0,0,48.1297,a8w8_blockscale_1x128x128_256x128x128x128_16x16_32x32_2x2_8x32x1_8x32x1_1x32x1x8_8_1x1_intrawave_v3,958.43,704.15,0.0
256,1223,3072,6144,ck,0,0,48.3304,a8w8_blockscale_1x128x128_256x128x128x128_16x16_32x32_2x2_8x32x1_8x32x1_1x32x1x8_8_1x1_intrawave_v3,955.23,701.48,0.0
256,1224,3072,6144,ck,0,0,48.2505,a8w8_blockscale_1x128x128_256x128x128x128_16x16_32x32_2x2_8x32x1_8x32x1_1x32x1x8_8_1x1_intrawave_v3,957.6,702.89,0.0
256,1225,3072,6144,ck,0,0,48.201,a8w8_blockscale_1x128x128_256x128x128x128_16x16_32x32_2x2_8x32x1_8x32x1_1x32x1x8_8_1x1_intrawave_v3,959.36,703.87,0.0
256,1226,3072,6144,ck,0,0,48.3425,a8w8_blockscale_1x128x128_256x128x128x128_16x16_32x32_2x2_8x32x1_8x32x1_1x32x1x8_8_1x1_intrawave_v3,957.33,702.06,0.0
256,1227,3072,6144,ck,0,0,48.2533,a8w8_blockscale_1x128x128_256x128x128x128_16x16_32x32_2x2_8x32x1_8x32x1_1x32x1x8_8_1x1_intrawave_v3,959.89,703.61,0.0
256,1228,3072,6144,ck,0,0,47.922,a8w8_blockscale_1x128x128_256x128x128x128_16x16_32x32_2x2_8x32x1_8x32x1_1x32x1x8_8_1x1_intrawave_v3,967.31,708.74,0.0
256,1229,3072,6144,ck,0,0,49.3241,a8w8_blockscale_1x128x128_256x128x128x128_16x16_32x32_2x2_8x32x1_8x32x1_1x32x1x8_8_1x1_intrawave_v3,940.58,688.84,0.0
256,1230,3072,6144,ck,0,0,47.9702,a8w8_blockscale_1x128x128_256x128x128x128_16x16_32x32_2x2_8x32x1_8x32x1_1x32x1x8_8_1x1_intrawave_v3,967.91,708.54,0.0
256,1231,3072,6144,ck,0,0,47.7212,a8w8_blockscale_1x128x128_256x128x128x128_16x16_32x32_2x2_8x32x1_8x32x1_1x32x1x8_8_1x1_intrawave_v3,973.75,712.49,0.0
256,1232,3072,6144,ck,0,0,48.4388,a8w8_blockscale_1x128x128_256x128x128x128_16x16_32x32_2x2_8x32x1_8x32x1_1x32x1x8_8_1x1_intrawave_v3,960.11,702.19,0.0
256,1236,3072,6144,ck,0,0,48.381,a8w8_blockscale_1x128x128_256x128x128x128_16x16_32x32_2x2_8x32x1_8x32x1_1x32x1x8_8_1x1_intrawave_v3,964.38,704.04,0.0
256,1237,3072,6144,ck,0,0,48.2194,a8w8_blockscale_1x128x128_256x128x128x128_16x16_32x32_2x2_8x32x1_8x32x1_1x32x1x8_8_1x1_intrawave_v3,968.39,706.66,0.0
256,1239,3072,3072,ck,0,0,27.2407,a8w8_blockscale_1x128x128_256x128x128x128_16x16_32x32_2x2_8x32x1_8x32x1_1x32x1x8_8_1x1_intrawave_v3,858.47,765.61,0.0
256,1239,3072,6144,ck,0,0,48.1075,a8w8_blockscale_1x128x128_256x128x128x128_16x16_32x32_2x2_8x32x1_8x32x1_1x32x1x8_8_1x1_intrawave_v3,972.21,708.81,0.0
256,1240,3072,6144,ck,0,0,48.5713,a8w8_blockscale_1x128x128_256x128x128x128_16x16_32x32_2x2_8x32x1_8x32x1_1x32x1x8_8_1x1_intrawave_v3,963.71,702.3,0.0
256,1241,3072,6144,ck,0,0,48.9125,a8w8_blockscale_1x128x128_256x128x128x128_16x16_32x32_2x2_8x32x1_8x32x1_1x32x1x8_8_1x1_intrawave_v3,957.75,697.65,0.0
256,1248,3072,6144,ck,0,0,48.8827,a8w8_blockscale_1x128x128_256x128x128x128_16x16_32x32_2x2_8x32x1_8x32x1_1x32x1x8_8_1x1_intrawave_v3,963.74,699.83,0.0
256,1253,3072,6144,ck,0,0,49.285,a8w8_blockscale_1x128x128_256x128x128x128_16x16_32x32_2x2_8x32x1_8x32x1_1x32x1x8_8_1x1_intrawave_v3,959.71,695.37,0.0
256,1254,3072,6144,ck,0,0,48.6403,a8w8_blockscale_1x128x128_256x128x128x128_16x16_32x32_2x2_8x32x1_8x32x1_1x32x1x8_8_1x1_intrawave_v3,973.2,704.84,0.0
256,1255,3072,6144,ck,0,0,48.9354,a8w8_blockscale_1x128x128_256x128x128x128_16x16_32x32_2x2_8x32x1_8x32x1_1x32x1x8_8_1x1_intrawave_v3,968.11,700.84,0.0
256,1256,3072,6144,ck,0,0,48.4838,a8w8_blockscale_1x128x128_256x128x128x128_16x16_32x32_2x2_8x32x1_8x32x1_1x32x1x8_8_1x1_intrawave_v3,977.9,707.62,0.0
256,1257,3072,6144,ck,0,0,48.46,a8w8_blockscale_1x128x128_256x128x128x128_16x16_32x32_2x2_8x32x1_8x32x1_1x32x1x8_8_1x1_intrawave_v3,979.16,708.22,0.0
256,1281,3072,6144,ck,14,0,52.4701,a8w8_blockscale_1x128x128_256x64x256x128_16x16_32x32_2x2_8x32x1_8x32x1_1x32x1x8_8_1x1_intrawave_v1,921.59,659.71,0.0
256,1455,3072,3072,ck,18,0,36.484,a8w8_blockscale_1x128x128_256x64x64x256_16x16_32x32_1x1_16x16x1_16x16x1_1x32x1x8_8_1x1_intrawave_v1,752.72,626.21,0.0
256,1485,3072,3072,ck,18,0,37.2592,a8w8_blockscale_1x128x128_256x64x64x256_16x16_32x32_1x1_16x16x1_16x16x1_1x32x1x8_8_1x1_intrawave_v1,752.26,620.6,0.0
256,1674,3072,3072,ck,0,0,39.1612,a8w8_blockscale_1x128x128_256x128x128x128_16x16_32x32_2x2_8x32x1_8x32x1_1x32x1x8_8_1x1_intrawave_v3,806.81,634.93,0.0
256,1734,3072,3072,ck,0,0,39.6152,a8w8_blockscale_1x128x128_256x128x128x128_16x16_32x32_2x2_8x32x1_8x32x1_1x32x1x8_8_1x1_intrawave_v3,826.15,641.62,0.0
256,1738,3072,3072,ck,0,0,39.3736,a8w8_blockscale_1x128x128_256x128x128x128_16x16_32x32_2x2_8x32x1_8x32x1_1x32x1x8_8_1x1_intrawave_v3,833.14,646.49,0.0
256,1920,3072,3072,ck,0,0,41.2301,a8w8_blockscale_1x128x128_256x128x128x128_16x16_32x32_2x2_8x32x1_8x32x1_1x32x1x8_8_1x1_intrawave_v3,878.94,658.06,0.0
256,1976,3072,3072,ck,0,0,41.6106,a8w8_blockscale_1x128x128_256x128x128x128_16x16_32x32_2x2_8x32x1_8x32x1_1x32x1x8_8_1x1_intrawave_v3,896.3,664.45,0.0
256,2000,3072,3072,ck,0,0,42.2918,a8w8_blockscale_1x128x128_256x128x128x128_16x16_32x32_2x2_8x32x1_8x32x1_1x32x1x8_8_1x1_intrawave_v3,892.58,658.97,0.0
256,2000,3072,6144,ck,0,0,75.3188,a8w8_blockscale_1x128x128_256x128x128x128_16x16_32x32_2x2_8x32x1_8x32x1_1x32x1x8_8_1x1_intrawave_v3,1002.37,576.89,0.0
256,2001,3072,3072,ck,0,0,42.2817,a8w8_blockscale_1x128x128_256x128x128x128_16x16_32x32_2x2_8x32x1_8x32x1_1x32x1x8_8_1x1_intrawave_v3,893.24,659.35,0.0
256,2001,3072,6144,ck,0,0,75.0754,a8w8_blockscale_1x128x128_256x128x128x128_16x16_32x32_2x2_8x32x1_8x32x1_1x32x1x8_8_1x1_intrawave_v3,1006.12,578.92,0.0
256,2002,3072,6144,ck,0,0,74.8257,a8w8_blockscale_1x128x128_256x128x128x128_16x16_32x32_2x2_8x32x1_8x32x1_1x32x1x8_8_1x1_intrawave_v3,1009.99,581.02,0.0
256,2008,3072,3072,ck,0,0,41.7102,a8w8_blockscale_1x128x128_256x128x128x128_16x16_32x32_2x2_8x32x1_8x32x1_1x32x1x8_8_1x1_intrawave_v3,908.64,669.93,0.0
256,2010,3072,3072,ck,0,0,42.02,a8w8_blockscale_1x128x128_256x128x128x128_16x16_32x32_2x2_8x32x1_8x32x1_1x32x1x8_8_1x1_intrawave_v3,902.84,665.43,0.0
256,2029,3072,3072,ck,0,0,41.8898,a8w8_blockscale_1x128x128_256x128x128x128_16x16_32x32_2x2_8x32x1_8x32x1_1x32x1x8_8_1x1_intrawave_v3,914.21,671.68,0.0
256,2033,3072,6144,ck,0,0,75.5716,a8w8_blockscale_1x128x128_256x128x128x128_16x16_32x32_2x2_8x32x1_8x32x1_1x32x1x8_8_1x1_intrawave_v3,1015.5,580.32,0.0
256,2044,3072,3072,ck,0,0,42.3939,a8w8_blockscale_1x128x128_256x128x128x128_16x16_32x32_2x2_8x32x1_8x32x1_1x32x1x8_8_1x1_intrawave_v3,910.02,666.95,0.0
256,2050,3072,3072,ck,0,0,42.2775,a8w8_blockscale_1x128x128_256x128x128x128_16x16_32x32_2x2_8x32x1_8x32x1_1x32x1x8_8_1x1_intrawave_v3,915.2,670.1,0.0
256,2149,3072,3072,ck,0,0,43.4045,a8w8_blockscale_1x128x128_256x128x128x128_16x16_32x32_2x2_8x32x1_8x32x1_1x32x1x8_8_1x1_intrawave_v3,934.49,673.72,0.0
256,2158,3072,3072,ck,0,0,42.2784,a8w8_blockscale_1x128x128_256x128x128x128_16x16_32x32_2x2_8x32x1_8x32x1_1x32x1x8_8_1x1_intrawave_v3,963.4,693.62,0.0
256,2160,3072,3072,ck,0,0,42.634,a8w8_blockscale_1x128x128_256x128x128x128_16x16_32x32_2x2_8x32x1_8x32x1_1x32x1x8_8_1x1_intrawave_v3,956.25,688.27,0.0
256,2162,3072,3072,ck,0,0,43.2648,a8w8_blockscale_1x128x128_256x128x128x128_16x16_32x32_2x2_8x32x1_8x32x1_1x32x1x8_8_1x1_intrawave_v3,943.18,678.66,0.0
256,2164,3072,3072,ck,0,0,42.6842,a8w8_blockscale_1x128x128_256x128x128x128_16x16_32x32_2x2_8x32x1_8x32x1_1x32x1x8_8_1x1_intrawave_v3,956.89,688.33,0.0
256,2192,3072,3072,ck,0,0,43.6917,a8w8_blockscale_1x128x128_256x128x128x128_16x16_32x32_2x2_8x32x1_8x32x1_1x32x1x8_8_1x1_intrawave_v3,946.92,678.36,0.0
256,2198,3072,6144,ck,0,0,79.3278,a8w8_blockscale_1x128x128_256x128x128x128_16x16_32x32_2x2_8x32x1_8x32x1_1x32x1x8_8_1x1_intrawave_v3,1045.93,578.4,0.0
256,2200,3072,6144,ck,0,0,77.9623,a8w8_blockscale_1x128x128_256x128x128x128_16x16_32x32_2x2_8x32x1_8x32x1_1x32x1x8_8_1x1_intrawave_v3,1065.22,588.85,0.0
256,2201,3072,6144,ck,0,0,78.297,a8w8_blockscale_1x128x128_256x128x128x128_16x16_32x32_2x2_8x32x1_8x32x1_1x32x1x8_8_1x1_intrawave_v3,1061.15,586.49,0.0
256,2208,3072,3072,ck,0,0,42.8021,a8w8_blockscale_1x128x128_256x128x128x128_16x16_32x32_2x2_8x32x1_8x32x1_1x32x1x8_8_1x1_intrawave_v3,973.66,695.9,0.0
256,2212,3072,6144,ck,0,0,80.2971,a8w8_blockscale_1x128x128_256x128x128x128_16x16_32x32_2x2_8x32x1_8x32x1_1x32x1x8_8_1x1_intrawave_v3,1039.89,573.56,0.0
256,2216,3072,6144,ck,0,0,79.0995,a8w8_blockscale_1x128x128_256x128x128x128_16x16_32x32_2x2_8x32x1_8x32x1_1x32x1x8_8_1x1_intrawave_v3,1057.54,582.87,0.0
256,2240,3072,3072,ck,0,0,42.9675,a8w8_blockscale_1x128x128_256x128x128x128_16x16_32x32_2x2_8x32x1_8x32x1_1x32x1x8_8_1x1_intrawave_v3,983.97,700.09,0.0
256,2240,3072,6144,ck,0,0,78.8843,a8w8_blockscale_1x128x128_256x128x128x128_16x16_32x32_2x2_8x32x1_8x32x1_1x32x1x8_8_1x1_intrawave_v3,1071.91,588.2,0.0
256,2254,3072,3072,ck,0,0,43.6784,a8w8_blockscale_1x128x128_256x128x128x128_16x16_32x32_2x2_8x32x1_8x32x1_1x32x1x8_8_1x1_intrawave_v3,974.0,691.65,0.0
256,2256,3072,3072,ck,0,0,43.7519,a8w8_blockscale_1x128x128_256x128x128x128_16x16_32x32_2x2_8x32x1_8x32x1_1x32x1x8_8_1x1_intrawave_v3,973.23,690.91,0.0
256,2358,3072,6144,ck,0,0,81.6594,a8w8_blockscale_1x128x128_256x128x128x128_16x16_32x32_2x2_8x32x1_8x32x1_1x32x1x8_8_1x1_intrawave_v3,1090.03,585.96,0.0
256,2367,3072,6144,ck,0,0,79.847,a8w8_blockscale_1x128x128_256x128x128x128_16x16_32x32_2x2_8x32x1_8x32x1_1x32x1x8_8_1x1_intrawave_v3,1119.03,600.65,0.0
256,2370,3072,6144,ck,0,0,80.9762,a8w8_blockscale_1x128x128_256x128x128x128_16x16_32x32_2x2_8x32x1_8x32x1_1x32x1x8_8_1x1_intrawave_v3,1104.82,592.73,0.0
256,2448,3072,6144,ck,0,0,82.8187,a8w8_blockscale_1x128x128_256x128x128x128_16x16_32x32_2x2_8x32x1_8x32x1_1x32x1x8_8_1x1_intrawave_v3,1115.8,591.12,0.0
256,2455,3072,6144,ck,0,0,80.4258,a8w8_blockscale_1x128x128_256x128x128x128_16x16_32x32_2x2_8x32x1_8x32x1_1x32x1x8_8_1x1_intrawave_v3,1152.28,609.77,0.0
256,2489,3072,3072,ck,0,0,44.8516,a8w8_blockscale_1x128x128_256x128x128x128_16x16_32x32_2x2_8x32x1_8x32x1_1x32x1x8_8_1x1_intrawave_v3,1047.42,721.84,0.0
256,2504,3072,3072,ck,0,0,44.9813,a8w8_blockscale_1x128x128_256x128x128x128_16x16_32x32_2x2_8x32x1_8x32x1_1x32x1x8_8_1x1_intrawave_v3,1050.69,722.83,0.0
256,2950,3072,3072,ck,0,0,60.9525,a8w8_blockscale_1x128x128_256x128x128x128_16x16_32x32_2x2_8x32x1_8x32x1_1x32x1x8_8_1x1_intrawave_v3,913.49,600.87,0.0
256,3000,3072,3072,ck,0,0,60.4971,a8w8_blockscale_1x128x128_256x128x128x128_16x16_32x32_2x2_8x32x1_8x32x1_1x32x1x8_8_1x1_intrawave_v3,935.96,613.01,0.0
256,3000,3072,6144,ck,0,0,113.2292,a8w8_blockscale_1x128x128_256x128x128x128_16x16_32x32_2x2_8x32x1_8x32x1_1x32x1x8_8_1x1_intrawave_v3,1000.15,492.26,0.0
256,3001,3072,3072,ck,0,0,60.7117,a8w8_blockscale_1x128x128_256x128x128x128_16x16_32x32_2x2_8x32x1_8x32x1_1x32x1x8_8_1x1_intrawave_v3,932.97,610.99,0.0
256,3001,3072,6144,ck,0,0,112.3852,a8w8_blockscale_1x128x128_256x128x128x128_16x16_32x32_2x2_8x32x1_8x32x1_1x32x1x8_8_1x1_intrawave_v3,1008.0,496.07,0.0
256,3004,3072,6144,ck,0,0,112.8472,a8w8_blockscale_1x128x128_256x128x128x128_16x16_32x32_2x2_8x32x1_8x32x1_1x32x1x8_8_1x1_intrawave_v3,1004.87,494.36,0.0
256,3005,3072,3072,ck,0,0,61.0141,a8w8_blockscale_1x128x128_256x128x128x128_16x16_32x32_2x2_8x32x1_8x32x1_1x32x1x8_8_1x1_intrawave_v3,929.58,608.57,0.0
256,3019,3072,6144,ck,0,0,112.0452,a8w8_blockscale_1x128x128_256x128x128x128_16x16_32x32_2x2_8x32x1_8x32x1_1x32x1x8_8_1x1_intrawave_v3,1017.12,499.55,0.0
256,3022,3072,3072,ck,0,0,61.4717,a8w8_blockscale_1x128x128_256x128x128x128_16x16_32x32_2x2_8x32x1_8x32x1_1x32x1x8_8_1x1_intrawave_v3,927.88,606.59,0.0
256,3028,3072,3072,ck,0,0,60.6481,a8w8_blockscale_1x128x128_256x128x128x128_16x16_32x32_2x2_8x32x1_8x32x1_1x32x1x8_8_1x1_intrawave_v3,942.35,615.74,0.0
256,3031,3072,3072,ck,0,0,60.9033,a8w8_blockscale_1x128x128_256x128x128x128_16x16_32x32_2x2_8x32x1_8x32x1_1x32x1x8_8_1x1_intrawave_v3,939.33,613.61,0.0
256,3056,3072,3072,ck,0,0,60.6132,a8w8_blockscale_1x128x128_256x128x128x128_16x16_32x32_2x2_8x32x1_8x32x1_1x32x1x8_8_1x1_intrawave_v3,951.61,620.35,0.0
256,3108,3072,3072,ck,0,0,61.4292,a8w8_blockscale_1x128x128_256x128x128x128_16x16_32x32_2x2_8x32x1_8x32x1_1x32x1x8_8_1x1_intrawave_v3,954.95,619.91,0.0
256,3125,3072,3072,ck,0,0,61.2874,a8w8_blockscale_1x128x128_256x128x128x128_16x16_32x32_2x2_8x32x1_8x32x1_1x32x1x8_8_1x1_intrawave_v3,962.39,623.9,0.0
256,3384,3072,6144,ck,0,0,117.0081,a8w8_blockscale_1x128x128_256x128x128x128_16x16_32x32_2x2_8x32x1_8x32x1_1x32x1x8_8_1x1_intrawave_v3,1091.73,516.69,0.0
256,3448,3072,6144,ck,0,0,116.9872,a8w8_blockscale_1x128x128_256x128x128x128_16x16_32x32_2x2_8x32x1_8x32x1_1x32x1x8_8_1x1_intrawave_v3,1112.58,523.51,0.0
256,3456,3072,6144,ck,0,0,115.0037,a8w8_blockscale_1x128x128_256x128x128x128_16x16_32x32_2x2_8x32x1_8x32x1_1x32x1x8_8_1x1_intrawave_v3,1134.4,533.39,0.0
256,3465,3072,6144,ck,0,0,117.5149,a8w8_blockscale_1x128x128_256x128x128x128_16x16_32x32_2x2_8x32x1_8x32x1_1x32x1x8_8_1x1_intrawave_v3,1113.04,522.93,0.0
256,3472,3072,3072,ck,0,0,62.9178,a8w8_blockscale_1x128x128_256x128x128x128_16x16_32x32_2x2_8x32x1_8x32x1_1x32x1x8_8_1x1_intrawave_v3,1041.55,658.56,0.0
256,3473,3072,3072,ck,0,0,64.803,a8w8_blockscale_1x128x128_256x128x128x128_16x16_32x32_2x2_8x32x1_8x32x1_1x32x1x8_8_1x1_intrawave_v3,1011.54,639.54,0.0
256,3480,3072,3072,ck,0,0,64.2186,a8w8_blockscale_1x128x128_256x128x128x128_16x16_32x32_2x2_8x32x1_8x32x1_1x32x1x8_8_1x1_intrawave_v3,1022.8,646.37,0.0
256,3495,3072,3072,ck,0,0,63.739,a8w8_blockscale_1x128x128_256x128x128x128_16x16_32x32_2x2_8x32x1_8x32x1_1x32x1x8_8_1x1_intrawave_v3,1034.94,653.4,0.0
256,3509,3072,3072,ck,0,0,64.7014,a8w8_blockscale_1x128x128_256x128x128x128_16x16_32x32_2x2_8x32x1_8x32x1_1x32x1x8_8_1x1_intrawave_v3,1023.63,645.68,0.0
256,3548,3072,6144,ck,0,0,117.1937,a8w8_blockscale_1x128x128_256x128x128x128_16x16_32x32_2x2_8x32x1_8x32x1_1x32x1x8_8_1x1_intrawave_v3,1142.83,533.07,0.0
256,3606,3072,6144,ck,0,0,120.2881,a8w8_blockscale_1x128x128_256x128x128x128_16x16_32x32_2x2_8x32x1_8x32x1_1x32x1x8_8_1x1_intrawave_v3,1131.63,525.28,0.0
256,3703,3072,3072,ck,0,0,66.9238,a8w8_blockscale_1x128x128_256x128x128x128_16x16_32x32_2x2_8x32x1_8x32x1_1x32x1x8_8_1x1_intrawave_v3,1044.35,650.95,0.0
256,3893,3072,3072,ck,0,0,68.1484,a8w8_blockscale_1x128x128_256x128x128x128_16x16_32x32_2x2_8x32x1_8x32x1_1x32x1x8_8_1x1_intrawave_v3,1078.2,664.95,0.0
256,3897,3072,3072,ck,0,0,68.4233,a8w8_blockscale_1x128x128_256x128x128x128_16x16_32x32_2x2_8x32x1_8x32x1_1x32x1x8_8_1x1_intrawave_v3,1074.98,662.81,0.0
256,3935,3072,6144,ck,14,0,132.5766,a8w8_blockscale_1x128x128_256x64x256x128_16x16_32x32_2x2_8x32x1_8x32x1_1x32x1x8_8_1x1_intrawave_v1,1120.42,507.09,0.0
256,3937,3072,6144,ck,14,0,131.4102,a8w8_blockscale_1x128x128_256x64x256x128_16x16_32x32_2x2_8x32x1_8x32x1_1x32x1x8_8_1x1_intrawave_v1,1130.94,511.77,0.0
256,3940,3072,6144,ck,14,0,131.8454,a8w8_blockscale_1x128x128_256x64x256x128_16x16_32x32_2x2_8x32x1_8x32x1_1x32x1x8_8_1x1_intrawave_v1,1128.06,510.36,0.0
256,4000,3072,3072,ck,0,0,67.6676,a8w8_blockscale_1x128x128_256x128x128x128_16x16_32x32_2x2_8x32x1_8x32x1_1x32x1x8_8_1x1_intrawave_v3,1115.71,684.24,0.0
256,4000,3072,6144,ck,0,0,132.8826,a8w8_blockscale_1x128x128_256x128x128x128_16x16_32x32_2x2_8x32x1_8x32x1_1x32x1x8_8_1x1_intrawave_v3,1136.3,511.93,0.0
256,4001,3072,3072,ck,0,0,68.3734,a8w8_blockscale_1x128x128_256x128x128x128_16x16_32x32_2x2_8x32x1_8x32x1_1x32x1x8_8_1x1_intrawave_v3,1104.47,677.32,0.0
256,4004,3072,3072,ck,0,0,68.0953,a8w8_blockscale_1x128x128_256x128x128x128_16x16_32x32_2x2_8x32x1_8x32x1_1x32x1x8_8_1x1_intrawave_v3,1109.81,680.49,0.0
256,4017,3072,6144,ck,0,0,132.4474,a8w8_blockscale_1x128x128_256x128x128x128_16x16_32x32_2x2_8x32x1_8x32x1_1x32x1x8_8_1x1_intrawave_v3,1144.88,515.19,0.0
256,4018,3072,6144,ck,0,0,132.0234,a8w8_blockscale_1x128x128_256x128x128x128_16x16_32x32_2x2_8x32x1_8x32x1_1x32x1x8_8_1x1_intrawave_v3,1148.84,516.94,0.0
256,4025,3072,6144,ck,14,0,132.517,a8w8_blockscale_1x128x128_256x64x256x128_16x16_32x32_2x2_8x32x1_8x32x1_1x32x1x8_8_1x1_intrawave_v1,1146.56,515.66,0.0
256,4028,3072,3072,ck,0,0,68.461,a8w8_blockscale_1x128x128_256x128x128x128_16x16_32x32_2x2_8x32x1_8x32x1_1x32x1x8_8_1x1_intrawave_v3,1110.5,680.08,0.0
256,4049,3072,3072,ck,0,0,68.7336,a8w8_blockscale_1x128x128_256x128x128x128_16x16_32x32_2x2_8x32x1_8x32x1_1x32x1x8_8_1x1_intrawave_v3,1111.86,680.2,0.0
256,4054,3072,3072,ck,0,0,67.4537,a8w8_blockscale_1x128x128_256x128x128x128_16x16_32x32_2x2_8x32x1_8x32x1_1x32x1x8_8_1x1_intrawave_v3,1134.36,693.79,0.0
256,4116,3072,3072,ck,0,0,76.0563,a8w8_blockscale_1x128x128_256x128x128x128_16x16_32x32_2x2_8x32x1_8x32x1_1x32x1x8_8_1x1_intrawave_v3,1021.44,622.83,0.0
256,4123,3072,3072,ck,0,0,75.8519,a8w8_blockscale_1x128x128_256x128x128x128_16x16_32x32_2x2_8x32x1_8x32x1_1x32x1x8_8_1x1_intrawave_v3,1025.93,625.36,0.0
256,4125,3072,3072,ck,0,0,75.9227,a8w8_blockscale_1x128x128_256x128x128x128_16x16_32x32_2x2_8x32x1_8x32x1_1x32x1x8_8_1x1_intrawave_v3,1025.47,625.02,0.0
256,4126,3072,3072,ck,0,0,76.7535,a8w8_blockscale_1x128x128_256x128x128x128_16x16_32x32_2x2_8x32x1_8x32x1_1x32x1x8_8_1x1_intrawave_v3,1014.62,618.37,0.0
256,4161,3072,6144,ck,0,0,143.6735,a8w8_blockscale_1x128x128_256x128x128x128_16x16_32x32_2x2_8x32x1_8x32x1_1x32x1x8_8_1x1_intrawave_v3,1093.26,487.25,0.0
256,4188,3072,3072,ck,0,0,76.2043,a8w8_blockscale_1x128x128_256x128x128x128_16x16_32x32_2x2_8x32x1_8x32x1_1x32x1x8_8_1x1_intrawave_v3,1037.29,630.33,0.0
256,4216,3072,3072,ck,0,0,76.7479,a8w8_blockscale_1x128x128_256x128x128x128_16x16_32x32_2x2_8x32x1_8x32x1_1x32x1x8_8_1x1_intrawave_v3,1036.83,629.23,0.0
256,4218,3072,3072,ck,0,0,76.7843,a8w8_blockscale_1x128x128_256x128x128x128_16x16_32x32_2x2_8x32x1_8x32x1_1x32x1x8_8_1x1_intrawave_v3,1036.83,629.17,0.0
256,4246,3072,3072,ck,0,0,76.9471,a8w8_blockscale_1x128x128_256x128x128x128_16x16_32x32_2x2_8x32x1_8x32x1_1x32x1x8_8_1x1_intrawave_v3,1041.5,631.19,0.0
256,4442,3072,6144,ck,0,0,145.4675,a8w8_blockscale_1x128x128_256x128x128x128_16x16_32x32_2x2_8x32x1_8x32x1_1x32x1x8_8_1x1_intrawave_v3,1152.7,504.98,0.0
256,4476,3072,3072,ck,0,0,79.462,a8w8_blockscale_1x128x128_256x128x128x128_16x16_32x32_2x2_8x32x1_8x32x1_1x32x1x8_8_1x1_intrawave_v3,1063.17,637.89,0.0
256,4476,3072,6144,ck,0,0,147.062,a8w8_blockscale_1x128x128_256x128x128x128_16x16_32x32_2x2_8x32x1_8x32x1_1x32x1x8_8_1x1_intrawave_v3,1148.93,502.34,0.0
256,4508,3072,3072,ck,0,0,78.0339,a8w8_blockscale_1x128x128_256x128x128x128_16x16_32x32_2x2_8x32x1_8x32x1_1x32x1x8_8_1x1_intrawave_v3,1090.37,653.34,0.0
256,4545,3072,6144,ck,0,0,146.1244,a8w8_blockscale_1x128x128_256x128x128x128_16x16_32x32_2x2_8x32x1_8x32x1_1x32x1x8_8_1x1_intrawave_v3,1174.12,511.37,0.0
256,4676,3072,3072,ck,0,0,80.4331,a8w8_blockscale_1x128x128_256x128x128x128_16x16_32x32_2x2_8x32x1_8x32x1_1x32x1x8_8_1x1_intrawave_v3,1097.27,653.1,0.0
256,5000,3072,3072,ck,0,0,83.5848,a8w8_blockscale_1x128x128_256x128x128x128_16x16_32x32_2x2_8x32x1_8x32x1_1x32x1x8_8_1x1_intrawave_v3,1129.06,664.2,0.0
256,5000,3072,6144,ck,0,0,152.7684,a8w8_blockscale_1x128x128_256x128x128x128_16x16_32x32_2x2_8x32x1_8x32x1_1x32x1x8_8_1x1_intrawave_v3,1235.49,525.73,0.0
256,5001,3072,3072,ck,0,0,83.0783,a8w8_blockscale_1x128x128_256x128x128x128_16x16_32x32_2x2_8x32x1_8x32x1_1x32x1x8_8_1x1_intrawave_v3,1136.17,668.36,0.0
256,5001,3072,6144,ck,0,0,152.8124,a8w8_blockscale_1x128x128_256x128x128x128_16x16_32x32_2x2_8x32x1_8x32x1_1x32x1x8_8_1x1_intrawave_v3,1235.38,525.66,0.0
256,5002,3072,3072,ck,0,0,82.2707,a8w8_blockscale_1x128x128_256x128x128x128_16x16_32x32_2x2_8x32x1_8x32x1_1x32x1x8_8_1x1_intrawave_v3,1147.55,675.04,0.0
256,5003,3072,3072,ck,0,0,83.3587,a8w8_blockscale_1x128x128_256x128x128x128_16x16_32x32_2x2_8x32x1_8x32x1_1x32x1x8_8_1x1_intrawave_v3,1132.8,666.34,0.0
256,5003,3072,6144,ck,0,0,151.4164,a8w8_blockscale_1x128x128_256x128x128x128_16x16_32x32_2x2_8x32x1_8x32x1_1x32x1x8_8_1x1_intrawave_v3,1247.27,530.66,0.0
256,5004,3072,6144,ck,0,0,152.984,a8w8_blockscale_1x128x128_256x128x128x128_16x16_32x32_2x2_8x32x1_8x32x1_1x32x1x8_8_1x1_intrawave_v3,1234.73,525.31,0.0
256,5007,3072,3072,ck,0,0,83.8667,a8w8_blockscale_1x128x128_256x128x128x128_16x16_32x32_2x2_8x32x1_8x32x1_1x32x1x8_8_1x1_intrawave_v3,1126.84,662.74,0.0
256,5008,3072,3072,ck,0,0,84.0755,a8w8_blockscale_1x128x128_256x128x128x128_16x16_32x32_2x2_8x32x1_8x32x1_1x32x1x8_8_1x1_intrawave_v3,1124.26,661.2,0.0
256,5009,3072,6144,ck,0,0,152.6756,a8w8_blockscale_1x128x128_256x128x128x128_16x16_32x32_2x2_8x32x1_8x32x1_1x32x1x8_8_1x1_intrawave_v3,1238.47,526.77,0.0
256,5013,3072,3072,ck,0,0,84.556,a8w8_blockscale_1x128x128_256x128x128x128_16x16_32x32_2x2_8x32x1_8x32x1_1x32x1x8_8_1x1_intrawave_v3,1118.99,657.99,0.0
256,5026,3072,3072,ck,0,0,82.6227,a8w8_blockscale_1x128x128_256x128x128x128_16x16_32x32_2x2_8x32x1_8x32x1_1x32x1x8_8_1x1_intrawave_v3,1148.14,674.84,0.0
256,5027,3072,6144,ck,0,0,154.5908,a8w8_blockscale_1x128x128_256x128x128x128_16x16_32x32_2x2_8x32x1_8x32x1_1x32x1x8_8_1x1_intrawave_v3,1227.52,521.67,0.0
256,5031,3072,3072,ck,0,0,84.4315,a8w8_blockscale_1x128x128_256x128x128x128_16x16_32x32_2x2_8x32x1_8x32x1_1x32x1x8_8_1x1_intrawave_v3,1124.66,660.92,0.0
256,5042,3072,6144,ck,0,0,152.2569,a8w8_blockscale_1x128x128_256x128x128x128_16x16_32x32_2x2_8x32x1_8x32x1_1x32x1x8_8_1x1_intrawave_v3,1250.05,530.88,0.0
256,5091,3072,3072,ck,0,0,82.9427,a8w8_blockscale_1x128x128_256x128x128x128_16x16_32x32_2x2_8x32x1_8x32x1_1x32x1x8_8_1x1_intrawave_v3,1158.5,679.46,0.0
256,5099,3072,6144,ck,0,0,153.8784,a8w8_blockscale_1x128x128_256x128x128x128_16x16_32x32_2x2_8x32x1_8x32x1_1x32x1x8_8_1x1_intrawave_v3,1250.86,529.84,0.0
256,5100,3072,6144,ck,0,0,153.2564,a8w8_blockscale_1x128x128_256x128x128x128_16x16_32x32_2x2_8x32x1_8x32x1_1x32x1x8_8_1x1_intrawave_v3,1256.19,532.07,0.0
256,5101,3072,6144,ck,0,0,151.253,a8w8_blockscale_1x128x128_256x128x128x128_16x16_32x32_2x2_8x32x1_8x32x1_1x32x1x8_8_1x1_intrawave_v3,1273.07,539.2,0.0
256,5102,3072,6144,ck,0,0,155.4516,a8w8_blockscale_1x128x128_256x128x128x128_16x16_32x32_2x2_8x32x1_8x32x1_1x32x1x8_8_1x1_intrawave_v3,1238.93,524.71,0.0
256,5109,3072,3072,ck,0,0,84.5856,a8w8_blockscale_1x128x128_256x128x128x128_16x16_32x32_2x2_8x32x1_8x32x1_1x32x1x8_8_1x1_intrawave_v3,1140.02,668.22,0.0
256,5111,3072,6144,ck,0,0,153.5798,a8w8_blockscale_1x128x128_256x128x128x128_16x16_32x32_2x2_8x32x1_8x32x1_1x32x1x8_8_1x1_intrawave_v3,1256.24,531.83,0.0
256,5114,3072,3072,ck,0,0,83.7759,a8w8_blockscale_1x128x128_256x128x128x128_16x16_32x32_2x2_8x32x1_8x32x1_1x32x1x8_8_1x1_intrawave_v3,1152.16,675.23,0.0
256,5114,3072,6144,ck,0,0,152.9012,a8w8_blockscale_1x128x128_256x128x128x128_16x16_32x32_2x2_8x32x1_8x32x1_1x32x1x8_8_1x1_intrawave_v3,1262.56,534.43,0.0
256,5116,3072,6144,ck,0,0,153.67,a8w8_blockscale_1x128x128_256x128x128x128_16x16_32x32_2x2_8x32x1_8x32x1_1x32x1x8_8_1x1_intrawave_v3,1256.74,531.92,0.0
256,5119,3072,6144,ck,0,0,154.6832,a8w8_blockscale_1x128x128_256x128x128x128_16x16_32x32_2x2_8x32x1_8x32x1_1x32x1x8_8_1x1_intrawave_v3,1249.24,528.67,0.0
256,5121,3072,3072,ck,0,0,85.1992,a8w8_blockscale_1x128x128_256x128x128x128_16x16_32x32_2x2_8x32x1_8x32x1_1x32x1x8_8_1x1_intrawave_v3,1134.47,664.7,0.0
256,5123,3072,6144,ck,0,0,154.3869,a8w8_blockscale_1x128x128_256x128x128x128_16x16_32x32_2x2_8x32x1_8x32x1_1x32x1x8_8_1x1_intrawave_v3,1252.61,530.0,0.0
256,5124,3072,6144,ck,0,0,154.2532,a8w8_blockscale_1x128x128_256x128x128x128_16x16_32x32_2x2_8x32x1_8x32x1_1x32x1x8_8_1x1_intrawave_v3,1253.94,530.54,0.0
256,5125,3072,6144,ck,0,0,153.3628,a8w8_blockscale_1x128x128_256x128x128x128_16x16_32x32_2x2_8x32x1_8x32x1_1x32x1x8_8_1x1_intrawave_v3,1261.47,533.7,0.0
256,5127,3072,3072,ck,0,0,84.9363,a8w8_blockscale_1x128x128_256x128x128x128_16x16_32x32_2x2_8x32x1_8x32x1_1x32x1x8_8_1x1_intrawave_v3,1139.31,667.41,0.0
256,5157,3072,6144,ck,0,0,158.7697,a8w8_blockscale_1x128x128_256x128x128x128_16x16_32x32_2x2_8x32x1_8x32x1_1x32x1x8_8_1x1_intrawave_v3,1226.12,518.01,0.0
256,5158,3072,6144,ck,0,0,153.9092,a8w8_blockscale_1x128x128_256x128x128x128_16x16_32x32_2x2_8x32x1_8x32x1_1x32x1x8_8_1x1_intrawave_v3,1265.08,534.44,0.0
256,5159,3072,6144,ck,0,0,156.7193,a8w8_blockscale_1x128x128_256x128x128x128_16x16_32x32_2x2_8x32x1_8x32x1_1x32x1x8_8_1x1_intrawave_v3,1242.64,524.94,0.0
256,5160,3072,6144,ck,0,0,155.6906,a8w8_blockscale_1x128x128_256x128x128x128_16x16_32x32_2x2_8x32x1_8x32x1_1x32x1x8_8_1x1_intrawave_v3,1251.09,528.49,0.0
256,5161,3072,6144,ck,0,0,155.488,a8w8_blockscale_1x128x128_256x128x128x128_16x16_32x32_2x2_8x32x1_8x32x1_1x32x1x8_8_1x1_intrawave_v3,1252.97,529.25,0.0
256,5184,3072,6144,ck,0,0,155.3181,a8w8_blockscale_1x128x128_256x128x128x128_16x16_32x32_2x2_8x32x1_8x32x1_1x32x1x8_8_1x1_intrawave_v3,1259.93,531.65,0.0
256,5216,3072,6144,ck,0,0,155.9149,a8w8_blockscale_1x128x128_256x128x128x128_16x16_32x32_2x2_8x32x1_8x32x1_1x32x1x8_8_1x1_intrawave_v3,1262.85,532.14,0.0
256,5218,3072,6144,ck,0,0,154.96,a8w8_blockscale_1x128x128_256x128x128x128_16x16_32x32_2x2_8x32x1_8x32x1_1x32x1x8_8_1x1_intrawave_v3,1271.12,535.58,0.0
256,5221,3072,6144,ck,0,0,155.4201,a8w8_blockscale_1x128x128_256x128x128x128_16x16_32x32_2x2_8x32x1_8x32x1_1x32x1x8_8_1x1_intrawave_v3,1268.09,534.23,0.0
256,5231,3072,6144,ck,0,0,154.7736,a8w8_blockscale_1x128x128_256x128x128x128_16x16_32x32_2x2_8x32x1_8x32x1_1x32x1x8_8_1x1_intrawave_v3,1275.82,537.26,0.0
256,5233,3072,6144,ck,0,0,156.3789,a8w8_blockscale_1x128x128_256x128x128x128_16x16_32x32_2x2_8x32x1_8x32x1_1x32x1x8_8_1x1_intrawave_v3,1263.21,531.9,0.0
256,5235,3072,6144,ck,0,0,154.3297,a8w8_blockscale_1x128x128_256x128x128x128_16x16_32x32_2x2_8x32x1_8x32x1_1x32x1x8_8_1x1_intrawave_v3,1280.47,539.12,0.0
256,5237,3072,6144,ck,0,0,156.5613,a8w8_blockscale_1x128x128_256x128x128x128_16x16_32x32_2x2_8x32x1_8x32x1_1x32x1x8_8_1x1_intrawave_v3,1262.7,531.59,0.0
256,5238,3072,6144,ck,0,0,154.2425,a8w8_blockscale_1x128x128_256x128x128x128_16x16_32x32_2x2_8x32x1_8x32x1_1x32x1x8_8_1x1_intrawave_v3,1281.93,539.66,0.0
256,5239,3072,6144,ck,0,0,155.0889,a8w8_blockscale_1x128x128_256x128x128x128_16x16_32x32_2x2_8x32x1_8x32x1_1x32x1x8_8_1x1_intrawave_v3,1275.18,536.8,0.0
256,5240,3072,3072,ck,0,0,84.2264,a8w8_blockscale_1x128x128_256x128x128x128_16x16_32x32_2x2_8x32x1_8x32x1_1x32x1x8_8_1x1_intrawave_v3,1174.24,685.4,0.0
256,5241,3072,6144,ck,0,0,157.1901,a8w8_blockscale_1x128x128_256x128x128x128_16x16_32x32_2x2_8x32x1_8x32x1_1x32x1x8_8_1x1_intrawave_v3,1258.61,529.78,0.0
256,5247,3072,6144,ck,0,0,155.5577,a8w8_blockscale_1x128x128_256x128x128x128_16x16_32x32_2x2_8x32x1_8x32x1_1x32x1x8_8_1x1_intrawave_v3,1273.27,535.81,0.0
256,5251,3072,3072,ck,0,0,84.5696,a8w8_blockscale_1x128x128_256x128x128x128_16x16_32x32_2x2_8x32x1_8x32x1_1x32x1x8_8_1x1_intrawave_v3,1171.93,683.82,0.0
256,5251,3072,6144,ck,0,0,158.3169,a8w8_blockscale_1x128x128_256x128x128x128_16x16_32x32_2x2_8x32x1_8x32x1_1x32x1x8_8_1x1_intrawave_v3,1252.04,526.78,0.0
256,5252,3072,3072,ck,0,0,85.178,a8w8_blockscale_1x128x128_256x128x128x128_16x16_32x32_2x2_8x32x1_8x32x1_1x32x1x8_8_1x1_intrawave_v3,1163.78,679.04,0.0
256,5252,3072,6144,ck,0,0,157.1157,a8w8_blockscale_1x128x128_256x128x128x128_16x16_32x32_2x2_8x32x1_8x32x1_1x32x1x8_8_1x1_intrawave_v3,1261.85,530.89,0.0
256,5253,3072,3072,ck,0,0,85.226,a8w8_blockscale_1x128x128_256x128x128x128_16x16_32x32_2x2_8x32x1_8x32x1_1x32x1x8_8_1x1_intrawave_v3,1163.34,678.77,0.0
256,5255,3072,3072,ck,0,0,86.6176,a8w8_blockscale_1x128x128_256x128x128x128_16x16_32x32_2x2_8x32x1_8x32x1_1x32x1x8_8_1x1_intrawave_v3,1145.09,668.08,0.0
256,5257,3072,3072,ck,0,0,85.2264,a8w8_blockscale_1x128x128_256x128x128x128_16x16_32x32_2x2_8x32x1_8x32x1_1x32x1x8_8_1x1_intrawave_v3,1164.22,679.2,0.0
256,5259,3072,3072,ck,0,0,85.652,a8w8_blockscale_1x128x128_256x128x128x128_16x16_32x32_2x2_8x32x1_8x32x1_1x32x1x8_8_1x1_intrawave_v3,1158.88,676.04,0.0
256,5261,3072,3072,ck,0,0,85.4484,a8w8_blockscale_1x128x128_256x128x128x128_16x16_32x32_2x2_8x32x1_8x32x1_1x32x1x8_8_1x1_intrawave_v3,1162.08,677.87,0.0
256,5262,3072,3072,ck,0,0,85.8624,a8w8_blockscale_1x128x128_256x128x128x128_16x16_32x32_2x2_8x32x1_8x32x1_1x32x1x8_8_1x1_intrawave_v3,1156.7,674.7,0.0
256,5264,3072,3072,ck,0,0,84.2784,a8w8_blockscale_1x128x128_256x128x128x128_16x16_32x32_2x2_8x32x1_8x32x1_1x32x1x8_8_1x1_intrawave_v3,1178.89,687.6,0.0
256,5270,3072,3072,ck,0,0,84.1176,a8w8_blockscale_1x128x128_256x128x128x128_16x16_32x32_2x2_8x32x1_8x32x1_1x32x1x8_8_1x1_intrawave_v3,1182.49,689.58,0.0
256,5271,3072,3072,ck,0,0,84.9672,a8w8_blockscale_1x128x128_256x128x128x128_16x16_32x32_2x2_8x32x1_8x32x1_1x32x1x8_8_1x1_intrawave_v3,1170.88,682.79,0.0
256,5272,3072,3072,ck,0,0,84.6144,a8w8_blockscale_1x128x128_256x128x128x128_16x16_32x32_2x2_8x32x1_8x32x1_1x32x1x8_8_1x1_intrawave_v3,1175.99,685.75,0.0
256,5273,3072,3072,ck,0,0,84.9896,a8w8_blockscale_1x128x128_256x128x128x128_16x16_32x32_2x2_8x32x1_8x32x1_1x32x1x8_8_1x1_intrawave_v3,1171.02,682.83,0.0
256,5274,3072,3072,ck,0,0,84.4336,a8w8_blockscale_1x128x128_256x128x128x128_16x16_32x32_2x2_8x32x1_8x32x1_1x32x1x8_8_1x1_intrawave_v3,1178.96,687.43,0.0
256,5275,3072,3072,ck,0,0,84.5648,a8w8_blockscale_1x128x128_256x128x128x128_16x16_32x32_2x2_8x32x1_8x32x1_1x32x1x8_8_1x1_intrawave_v3,1177.35,686.47,0.0
256,5282,3072,3072,ck,0,0,84.5552,a8w8_blockscale_1x128x128_256x128x128x128_16x16_32x32_2x2_8x32x1_8x32x1_1x32x1x8_8_1x1_intrawave_v3,1179.05,687.32,0.0
256,5283,3072,3072,ck,0,0,85.0672,a8w8_blockscale_1x128x128_256x128x128x128_16x16_32x32_2x2_8x32x1_8x32x1_1x32x1x8_8_1x1_intrawave_v3,1172.17,683.29,0.0
256,5284,3072,3072,ck,0,0,84.6052,a8w8_blockscale_1x128x128_256x128x128x128_16x16_32x32_2x2_8x32x1_8x32x1_1x32x1x8_8_1x1_intrawave_v3,1178.79,687.13,0.0
256,5286,3072,3072,ck,0,0,84.596,a8w8_blockscale_1x128x128_256x128x128x128_16x16_32x32_2x2_8x32x1_8x32x1_1x32x1x8_8_1x1_intrawave_v3,1179.37,687.42,0.0
256,5288,3072,3072,ck,0,0,85.0236,a8w8_blockscale_1x128x128_256x128x128x128_16x16_32x32_2x2_8x32x1_8x32x1_1x32x1x8_8_1x1_intrawave_v3,1173.88,684.18,0.0
256,5289,3072,3072,ck,0,0,84.0928,a8w8_blockscale_1x128x128_256x128x128x128_16x16_32x32_2x2_8x32x1_8x32x1_1x32x1x8_8_1x1_intrawave_v3,1187.1,691.86,0.0
256,5297,3072,3072,ck,0,0,86.3316,a8w8_blockscale_1x128x128_256x128x128x128_16x16_32x32_2x2_8x32x1_8x32x1_1x32x1x8_8_1x1_intrawave_v3,1158.06,674.77,0.0
256,5303,3072,3072,ck,0,0,85.01,a8w8_blockscale_1x128x128_256x128x128x128_16x16_32x32_2x2_8x32x1_8x32x1_1x32x1x8_8_1x1_intrawave_v3,1177.4,685.91,0.0
256,5307,3072,3072,ck,0,0,84.0688,a8w8_blockscale_1x128x128_256x128x128x128_16x16_32x32_2x2_8x32x1_8x32x1_1x32x1x8_8_1x1_intrawave_v3,1191.48,694.03,0.0
256,5311,3072,3072,ck,0,0,84.602,a8w8_blockscale_1x128x128_256x128x128x128_16x16_32x32_2x2_8x32x1_8x32x1_1x32x1x8_8_1x1_intrawave_v3,1184.86,690.09,0.0
256,5314,3072,3072,ck,0,0,87.2892,a8w8_blockscale_1x128x128_256x128x128x128_16x16_32x32_2x2_8x32x1_8x32x1_1x32x1x8_8_1x1_intrawave_v3,1149.04,669.17,0.0
256,5316,3072,3072,ck,0,0,84.6232,a8w8_blockscale_1x128x128_256x128x128x128_16x16_32x32_2x2_8x32x1_8x32x1_1x32x1x8_8_1x1_intrawave_v3,1185.68,690.47,0.0
256,5320,3072,3072,ck,0,0,84.2472,a8w8_blockscale_1x128x128_256x128x128x128_16x16_32x32_2x2_8x32x1_8x32x1_1x32x1x8_8_1x1_intrawave_v3,1191.87,693.99,0.0
256,5324,3072,3072,ck,0,0,85.6441,a8w8_blockscale_1x128x128_256x128x128x128_16x16_32x32_2x2_8x32x1_8x32x1_1x32x1x8_8_1x1_intrawave_v3,1173.31,683.1,0.0
256,5325,3072,6144,ck,0,0,156.6501,a8w8_blockscale_1x128x128_256x128x128x128_16x16_32x32_2x2_8x32x1_8x32x1_1x32x1x8_8_1x1_intrawave_v3,1283.19,538.19,0.0
256,5327,3072,3072,ck,0,0,85.174,a8w8_blockscale_1x128x128_256x128x128x128_16x16_32x32_2x2_8x32x1_8x32x1_1x32x1x8_8_1x1_intrawave_v3,1180.45,687.19,0.0
256,5328,3072,3072,ck,0,0,84.0699,a8w8_blockscale_1x128x128_256x128x128x128_16x16_32x32_2x2_8x32x1_8x32x1_1x32x1x8_8_1x1_intrawave_v3,1196.18,696.33,0.0
256,5330,3072,3072,ck,0,0,85.5028,a8w8_blockscale_1x128x128_256x128x128x128_16x16_32x32_2x2_8x32x1_8x32x1_1x32x1x8_8_1x1_intrawave_v3,1176.57,684.87,0.0
256,5331,3072,6144,ck,0,0,158.5989,a8w8_blockscale_1x128x128_256x128x128x128_16x16_32x32_2x2_8x32x1_8x32x1_1x32x1x8_8_1x1_intrawave_v3,1268.85,532.04,0.0
256,5333,3072,6144,ck,0,0,158.1352,a8w8_blockscale_1x128x128_256x128x128x128_16x16_32x32_2x2_8x32x1_8x32x1_1x32x1x8_8_1x1_intrawave_v3,1273.05,533.76,0.0
256,5335,3072,3072,ck,0,0,85.3416,a8w8_blockscale_1x128x128_256x128x128x128_16x16_32x32_2x2_8x32x1_8x32x1_1x32x1x8_8_1x1_intrawave_v3,1179.9,686.71,0.0
256,5337,3072,3072,ck,0,0,85.9748,a8w8_blockscale_1x128x128_256x128x128x128_16x16_32x32_2x2_8x32x1_8x32x1_1x32x1x8_8_1x1_intrawave_v3,1171.65,681.86,0.0
256,5338,3072,3072,ck,0,0,85.2235,a8w8_blockscale_1x128x128_256x128x128x128_16x16_32x32_2x2_8x32x1_8x32x1_1x32x1x8_8_1x1_intrawave_v3,1182.2,687.98,0.0
256,5339,3072,3072,ck,0,0,84.2619,a8w8_blockscale_1x128x128_256x128x128x128_16x16_32x32_2x2_8x32x1_8x32x1_1x32x1x8_8_1x1_intrawave_v3,1195.92,695.94,0.0
256,5341,3072,3072,ck,0,0,84.9879,a8w8_blockscale_1x128x128_256x128x128x128_16x16_32x32_2x2_8x32x1_8x32x1_1x32x1x8_8_1x1_intrawave_v3,1186.15,690.21,0.0
256,5345,3072,3072,ck,0,0,86.1943,a8w8_blockscale_1x128x128_256x128x128x128_16x16_32x32_2x2_8x32x1_8x32x1_1x32x1x8_8_1x1_intrawave_v3,1170.42,680.98,0.0
256,5349,3072,3072,ck,0,0,85.5748,a8w8_blockscale_1x128x128_256x128x128x128_16x16_32x32_2x2_8x32x1_8x32x1_1x32x1x8_8_1x1_intrawave_v3,1179.77,686.34,0.0
256,5350,3072,6144,ck,0,0,158.4264,a8w8_blockscale_1x128x128_256x128x128x128_16x16_32x32_2x2_8x32x1_8x32x1_1x32x1x8_8_1x1_intrawave_v3,1274.76,534.1,0.0
256,5351,3072,6144,ck,0,0,157.016,a8w8_blockscale_1x128x128_256x128x128x128_16x16_32x32_2x2_8x32x1_8x32x1_1x32x1x8_8_1x1_intrawave_v3,1286.45,538.97,0.0
256,5352,3072,3072,ck,0,0,85.7523,a8w8_blockscale_1x128x128_256x128x128x128_16x16_32x32_2x2_8x32x1_8x32x1_1x32x1x8_8_1x1_intrawave_v3,1177.99,685.24,0.0
256,5352,3072,6144,ck,0,0,157.1392,a8w8_blockscale_1x128x128_256x128x128x128_16x16_32x32_2x2_8x32x1_8x32x1_1x32x1x8_8_1x1_intrawave_v3,1285.68,538.63,0.0
256,5354,3072,3072,ck,0,0,86.5587,a8w8_blockscale_1x128x128_256x128x128x128_16x16_32x32_2x2_8x32x1_8x32x1_1x32x1x8_8_1x1_intrawave_v3,1167.45,679.07,0.0
256,5356,3072,6144,ck,0,0,158.626,a8w8_blockscale_1x128x128_256x128x128x128_16x16_32x32_2x2_8x32x1_8x32x1_1x32x1x8_8_1x1_intrawave_v3,1274.58,533.89,0.0
256,5360,3072,3072,ck,0,0,86.2347,a8w8_blockscale_1x128x128_256x128x128x128_16x16_32x32_2x2_8x32x1_8x32x1_1x32x1x8_8_1x1_intrawave_v3,1173.15,682.27,0.0
256,5361,3072,3072,ck,0,0,85.3879,a8w8_blockscale_1x128x128_256x128x128x128_16x16_32x32_2x2_8x32x1_8x32x1_1x32x1x8_8_1x1_intrawave_v3,1185.01,689.14,0.0
256,5362,3072,3072,ck,0,0,84.9915,a8w8_blockscale_1x128x128_256x128x128x128_16x16_32x32_2x2_8x32x1_8x32x1_1x32x1x8_8_1x1_intrawave_v3,1190.76,692.46,0.0
256,5366,3072,3072,ck,0,0,86.0339,a8w8_blockscale_1x128x128_256x128x128x128_16x16_32x32_2x2_8x32x1_8x32x1_1x32x1x8_8_1x1_intrawave_v3,1177.21,684.5,0.0
256,5369,3072,3072,ck,0,0,85.9919,a8w8_blockscale_1x128x128_256x128x128x128_16x16_32x32_2x2_8x32x1_8x32x1_1x32x1x8_8_1x1_intrawave_v3,1178.44,685.16,0.0
256,5372,3072,3072,ck,0,0,84.7179,a8w8_blockscale_1x128x128_256x128x128x128_16x16_32x32_2x2_8x32x1_8x32x1_1x32x1x8_8_1x1_intrawave_v3,1196.83,695.79,0.0
256,5373,3072,3072,ck,0,0,85.8667,a8w8_blockscale_1x128x128_256x128x128x128_16x16_32x32_2x2_8x32x1_8x32x1_1x32x1x8_8_1x1_intrawave_v3,1181.04,686.58,0.0
256,5373,3072,6144,ck,0,0,156.9971,a8w8_blockscale_1x128x128_256x128x128x128_16x16_32x32_2x2_8x32x1_8x32x1_1x32x1x8_8_1x1_intrawave_v3,1291.9,540.76,0.0
256,5374,3072,6144,ck,0,0,156.3071,a8w8_blockscale_1x128x128_256x128x128x128_16x16_32x32_2x2_8x32x1_8x32x1_1x32x1x8_8_1x1_intrawave_v3,1297.84,543.23,0.0
256,5375,3072,6144,ck,0,0,156.8843,a8w8_blockscale_1x128x128_256x128x128x128_16x16_32x32_2x2_8x32x1_8x32x1_1x32x1x8_8_1x1_intrawave_v3,1293.31,541.31,0.0
256,5378,3072,6144,ck,14,0,171.5024,a8w8_blockscale_1x128x128_256x64x256x128_16x16_32x32_2x2_8x32x1_8x32x1_1x32x1x8_8_1x1_intrawave_v1,1183.73,495.38,0.0
256,5379,3072,3072,ck,14,0,94.9867,a8w8_blockscale_1x128x128_256x64x256x128_16x16_32x32_2x2_8x32x1_8x32x1_1x32x1x8_8_1x1_intrawave_v1,1068.84,621.25,0.0
256,5379,3072,6144,ck,14,0,168.744,a8w8_blockscale_1x128x128_256x64x256x128_16x16_32x32_2x2_8x32x1_8x32x1_1x32x1x8_8_1x1_intrawave_v1,1203.3,503.55,0.0
256,5380,3072,3072,ck,14,0,94.084,a8w8_blockscale_1x128x128_256x64x256x128_16x16_32x32_2x2_8x32x1_8x32x1_1x32x1x8_8_1x1_intrawave_v1,1079.29,627.3,0.0
256,5380,3072,6144,ck,14,0,169.3272,a8w8_blockscale_1x128x128_256x64x256x128_16x16_32x32_2x2_8x32x1_8x32x1_1x32x1x8_8_1x1_intrawave_v1,1199.38,501.89,0.0
256,5382,3072,3072,ck,14,0,94.3615,a8w8_blockscale_1x128x128_256x64x256x128_16x16_32x32_2x2_8x32x1_8x32x1_1x32x1x8_8_1x1_intrawave_v1,1076.52,625.65,0.0
256,5384,3072,3072,ck,14,0,94.6472,a8w8_blockscale_1x128x128_256x64x256x128_16x16_32x32_2x2_8x32x1_8x32x1_1x32x1x8_8_1x1_intrawave_v1,1073.67,623.96,0.0
256,5386,3072,3072,ck,14,0,94.374,a8w8_blockscale_1x128x128_256x64x256x128_16x16_32x32_2x2_8x32x1_8x32x1_1x32x1x8_8_1x1_intrawave_v1,1077.18,625.96,0.0
256,5389,3072,3072,ck,14,0,93.6356,a8w8_blockscale_1x128x128_256x64x256x128_16x16_32x32_2x2_8x32x1_8x32x1_1x32x1x8_8_1x1_intrawave_v1,1086.27,631.19,0.0
256,5390,3072,3072,ck,14,0,94.8916,a8w8_blockscale_1x128x128_256x64x256x128_16x16_32x32_2x2_8x32x1_8x32x1_1x32x1x8_8_1x1_intrawave_v1,1072.1,622.94,0.0
256,5395,3072,3072,ck,14,0,94.6316,a8w8_blockscale_1x128x128_256x64x256x128_16x16_32x32_2x2_8x32x1_8x32x1_1x32x1x8_8_1x1_intrawave_v1,1076.04,625.13,0.0
256,5397,3072,3072,ck,0,0,95.2476,a8w8_blockscale_1x128x128_256x128x128x128_16x16_32x32_2x2_8x32x1_8x32x1_1x32x1x8_8_1x1_intrawave_v3,1069.48,621.29,0.0
256,5398,3072,3072,ck,14,0,94.3928,a8w8_blockscale_1x128x128_256x64x256x128_16x16_32x32_2x2_8x32x1_8x32x1_1x32x1x8_8_1x1_intrawave_v1,1079.36,627.01,0.0
256,5402,3072,3072,ck,14,0,94.1884,a8w8_blockscale_1x128x128_256x64x256x128_16x16_32x32_2x2_8x32x1_8x32x1_1x32x1x8_8_1x1_intrawave_v1,1082.5,628.76,0.0
256,5402,3072,6144,ck,14,0,169.18,a8w8_blockscale_1x128x128_256x64x256x128_16x16_32x32_2x2_8x32x1_8x32x1_1x32x1x8_8_1x1_intrawave_v1,1205.34,503.93,0.0
256,5404,3072,3072,ck,14,0,94.84,a8w8_blockscale_1x128x128_256x64x256x128_16x16_32x32_2x2_8x32x1_8x32x1_1x32x1x8_8_1x1_intrawave_v1,1075.46,624.64,0.0
256,5408,3072,3072,ck,14,0,94.1828,a8w8_blockscale_1x128x128_256x64x256x128_16x16_32x32_2x2_8x32x1_8x32x1_1x32x1x8_8_1x1_intrawave_v1,1083.77,629.39,0.0
256,5409,3072,6144,ck,14,0,171.1315,a8w8_blockscale_1x128x128_256x64x256x128_16x16_32x32_2x2_8x32x1_8x32x1_1x32x1x8_8_1x1_intrawave_v1,1193.13,498.68,0.0
256,5410,3072,3072,ck,0,0,95.6,a8w8_blockscale_1x128x128_256x128x128x128_16x16_32x32_2x2_8x32x1_8x32x1_1x32x1x8_8_1x1_intrawave_v3,1068.1,620.25,0.0
256,5414,3072,3072,ck,14,0,95.2936,a8w8_blockscale_1x128x128_256x64x256x128_16x16_32x32_2x2_8x32x1_8x32x1_1x32x1x8_8_1x1_intrawave_v1,1072.33,622.63,0.0
256,5416,3072,3072,ck,14,0,94.2705,a8w8_blockscale_1x128x128_256x64x256x128_16x16_32x32_2x2_8x32x1_8x32x1_1x32x1x8_8_1x1_intrawave_v1,1084.36,629.58,0.0
256,5419,3072,3072,ck,14,0,94.7765,a8w8_blockscale_1x128x128_256x64x256x128_16x16_32x32_2x2_8x32x1_8x32x1_1x32x1x8_8_1x1_intrawave_v1,1079.17,626.51,0.0
256,5426,3072,3072,ck,14,0,94.4584,a8w8_blockscale_1x128x128_256x64x256x128_16x16_32x32_2x2_8x32x1_8x32x1_1x32x1x8_8_1x1_intrawave_v1,1084.21,629.31,0.0
256,5426,3072,6144,ck,14,0,170.8276,a8w8_blockscale_1x128x128_256x64x256x128_16x16_32x32_2x2_8x32x1_8x32x1_1x32x1x8_8_1x1_intrawave_v1,1199.01,500.79,0.0
256,5429,3072,3072,ck,14,0,94.7033,a8w8_blockscale_1x128x128_256x64x256x128_16x16_32x32_2x2_8x32x1_8x32x1_1x32x1x8_8_1x1_intrawave_v1,1082.0,627.97,0.0
256,5431,3072,3072,ck,14,0,94.1952,a8w8_blockscale_1x128x128_256x64x256x128_16x16_32x32_2x2_8x32x1_8x32x1_1x32x1x8_8_1x1_intrawave_v1,1088.24,631.55,0.0
256,5434,3072,6144,ck,14,0,171.193,a8w8_blockscale_1x128x128_256x64x256x128_16x16_32x32_2x2_8x32x1_8x32x1_1x32x1x8_8_1x1_intrawave_v1,1198.22,500.3,0.0
256,5443,3072,3072,ck,0,0,94.8325,a8w8_blockscale_1x128x128_256x128x128x128_16x16_32x32_2x2_8x32x1_8x32x1_1x32x1x8_8_1x1_intrawave_v3,1083.31,628.48,0.0
256,5445,3072,3072,ck,0,0,94.2548,a8w8_blockscale_1x128x128_256x128x128x128_16x16_32x32_2x2_8x32x1_8x32x1_1x32x1x8_8_1x1_intrawave_v3,1090.35,632.52,0.0
256,5456,3072,3072,ck,0,0,95.7648,a8w8_blockscale_1x128x128_256x128x128x128_16x16_32x32_2x2_8x32x1_8x32x1_1x32x1x8_8_1x1_intrawave_v3,1075.33,623.61,0.0
256,5459,3072,3072,ck,0,0,97.1412,a8w8_blockscale_1x128x128_256x128x128x128_16x16_32x32_2x2_8x32x1_8x32x1_1x32x1x8_8_1x1_intrawave_v3,1060.67,615.06,0.0
256,5462,3072,3072,ck,0,0,96.59,a8w8_blockscale_1x128x128_256x128x128x128_16x16_32x32_2x2_8x32x1_8x32x1_1x32x1x8_8_1x1_intrawave_v3,1067.31,618.85,0.0
256,5463,3072,3072,ck,0,0,96.6852,a8w8_blockscale_1x128x128_256x128x128x128_16x16_32x32_2x2_8x32x1_8x32x1_1x32x1x8_8_1x1_intrawave_v3,1066.46,618.34,0.0
256,5466,3072,3072,ck,0,0,96.6004,a8w8_blockscale_1x128x128_256x128x128x128_16x16_32x32_2x2_8x32x1_8x32x1_1x32x1x8_8_1x1_intrawave_v3,1067.98,619.17,0.0
256,5472,3072,3072,ck,0,0,96.1896,a8w8_blockscale_1x128x128_256x128x128x128_16x16_32x32_2x2_8x32x1_8x32x1_1x32x1x8_8_1x1_intrawave_v3,1073.72,622.39,0.0
256,5474,3072,3072,ck,0,0,95.388,a8w8_blockscale_1x128x128_256x128x128x128_16x16_32x32_2x2_8x32x1_8x32x1_1x32x1x8_8_1x1_intrawave_v3,1083.14,627.81,0.0
256,5480,3072,3072,ck,0,0,97.4057,a8w8_blockscale_1x128x128_256x128x128x128_16x16_32x32_2x2_8x32x1_8x32x1_1x32x1x8_8_1x1_intrawave_v3,1061.86,615.37,0.0
256,5502,3072,6144,ck,0,0,177.8002,a8w8_blockscale_1x128x128_256x128x128x128_16x16_32x32_2x2_8x32x1_8x32x1_1x32x1x8_8_1x1_intrawave_v3,1168.13,486.41,0.0
256,5507,3072,6144,ck,0,0,181.1348,a8w8_blockscale_1x128x128_256x128x128x128_16x16_32x32_2x2_8x32x1_8x32x1_1x32x1x8_8_1x1_intrawave_v3,1147.67,477.79,0.0
256,5508,3072,6144,ck,0,0,175.0101,a8w8_blockscale_1x128x128_256x128x128x128_16x16_32x32_2x2_8x32x1_8x32x1_1x32x1x8_8_1x1_intrawave_v3,1188.05,494.58,0.0
256,5514,3072,3072,ck,0,0,97.8644,a8w8_blockscale_1x128x128_256x128x128x128_16x16_32x32_2x2_8x32x1_8x32x1_1x32x1x8_8_1x1_intrawave_v3,1063.44,615.69,0.0
256,5533,3072,3072,ck,0,0,97.9672,a8w8_blockscale_1x128x128_256x128x128x128_16x16_32x32_2x2_8x32x1_8x32x1_1x32x1x8_8_1x1_intrawave_v3,1065.99,616.83,0.0
256,5551,3072,3072,ck,0,0,97.78,a8w8_blockscale_1x128x128_256x128x128x128_16x16_32x32_2x2_8x32x1_8x32x1_1x32x1x8_8_1x1_intrawave_v3,1071.5,619.71,0.0
256,5566,3072,3072,ck,0,0,97.8064,a8w8_blockscale_1x128x128_256x128x128x128_16x16_32x32_2x2_8x32x1_8x32x1_1x32x1x8_8_1x1_intrawave_v3,1074.11,620.96,0.0
256,5579,3072,3072,ck,0,0,97.422,a8w8_blockscale_1x128x128_256x128x128x128_16x16_32x32_2x2_8x32x1_8x32x1_1x32x1x8_8_1x1_intrawave_v3,1080.87,624.64,0.0
256,5587,3072,3072,ck,0,0,96.4328,a8w8_blockscale_1x128x128_256x128x128x128_16x16_32x32_2x2_8x32x1_8x32x1_1x32x1x8_8_1x1_intrawave_v3,1093.52,631.81,0.0
256,5594,3072,3072,ck,0,0,97.272,a8w8_blockscale_1x128x128_256x128x128x128_16x16_32x32_2x2_8x32x1_8x32x1_1x32x1x8_8_1x1_intrawave_v3,1085.44,627.02,0.0
256,5614,3072,3072,ck,0,0,98.5368,a8w8_blockscale_1x128x128_256x128x128x128_16x16_32x32_2x2_8x32x1_8x32x1_1x32x1x8_8_1x1_intrawave_v3,1075.34,620.84,0.0
256,5630,3072,3072,ck,0,0,97.3048,a8w8_blockscale_1x128x128_256x128x128x128_16x16_32x32_2x2_8x32x1_8x32x1_1x32x1x8_8_1x1_intrawave_v3,1092.06,630.22,0.0
256,5653,3072,3072,ck,0,0,97.288,a8w8_blockscale_1x128x128_256x128x128x128_16x16_32x32_2x2_8x32x1_8x32x1_1x32x1x8_8_1x1_intrawave_v3,1096.71,632.51,0.0
256,5654,3072,3072,ck,0,0,98.1424,a8w8_blockscale_1x128x128_256x128x128x128_16x16_32x32_2x2_8x32x1_8x32x1_1x32x1x8_8_1x1_intrawave_v3,1087.36,627.09,0.0
256,5655,3072,3072,ck,0,0,97.4024,a8w8_blockscale_1x128x128_256x128x128x128_16x16_32x32_2x2_8x32x1_8x32x1_1x32x1x8_8_1x1_intrawave_v3,1095.81,631.95,0.0
256,5665,3072,3072,ck,0,0,99.3052,a8w8_blockscale_1x128x128_256x128x128x128_16x16_32x32_2x2_8x32x1_8x32x1_1x32x1x8_8_1x1_intrawave_v3,1076.71,620.77,0.0
256,5670,3072,3072,ck,0,0,98.4204,a8w8_blockscale_1x128x128_256x128x128x128_16x16_32x32_2x2_8x32x1_8x32x1_1x32x1x8_8_1x1_intrawave_v3,1087.35,626.82,0.0
256,5671,3072,3072,ck,0,0,96.0116,a8w8_blockscale_1x128x128_256x128x128x128_16x16_32x32_2x2_8x32x1_8x32x1_1x32x1x8_8_1x1_intrawave_v3,1114.83,642.64,0.0
256,5676,3072,3072,ck,0,0,97.5536,a8w8_blockscale_1x128x128_256x128x128x128_16x16_32x32_2x2_8x32x1_8x32x1_1x32x1x8_8_1x1_intrawave_v3,1098.17,632.96,0.0
256,5678,3072,3072,ck,0,0,97.9121,a8w8_blockscale_1x128x128_256x128x128x128_16x16_32x32_2x2_8x32x1_8x32x1_1x32x1x8_8_1x1_intrawave_v3,1094.54,630.83,0.0
256,5681,3072,3072,ck,0,0,97.5613,a8w8_blockscale_1x128x128_256x128x128x128_16x16_32x32_2x2_8x32x1_8x32x1_1x32x1x8_8_1x1_intrawave_v3,1099.06,633.38,0.0
256,5687,3072,3072,ck,0,0,98.2421,a8w8_blockscale_1x128x128_256x128x128x128_16x16_32x32_2x2_8x32x1_8x32x1_1x32x1x8_8_1x1_intrawave_v3,1092.59,629.55,0.0
256,5691,3072,3072,ck,0,0,99.0501,a8w8_blockscale_1x128x128_256x128x128x128_16x16_32x32_2x2_8x32x1_8x32x1_1x32x1x8_8_1x1_intrawave_v3,1084.44,624.79,0.0
256,5695,3072,3072,ck,0,0,98.6029,a8w8_blockscale_1x128x128_256x128x128x128_16x16_32x32_2x2_8x32x1_8x32x1_1x32x1x8_8_1x1_intrawave_v3,1090.13,628.0,0.0
256,5696,3072,3072,ck,0,0,98.9421,a8w8_blockscale_1x128x128_256x128x128x128_16x16_32x32_2x2_8x32x1_8x32x1_1x32x1x8_8_1x1_intrawave_v3,1086.58,625.94,0.0
256,5697,3072,3072,ck,0,0,98.7269,a8w8_blockscale_1x128x128_256x128x128x128_16x16_32x32_2x2_8x32x1_8x32x1_1x32x1x8_8_1x1_intrawave_v3,1089.14,627.39,0.0
256,5813,3072,3072,ck,0,0,99.5285,a8w8_blockscale_1x128x128_256x128x128x128_16x16_32x32_2x2_8x32x1_8x32x1_1x32x1x8_8_1x1_intrawave_v3,1102.36,633.08,0.0
256,6000,3072,3072,ck,0,0,99.2873,a8w8_blockscale_1x128x128_256x128x128x128_16x16_32x32_2x2_8x32x1_8x32x1_1x32x1x8_8_1x1_intrawave_v3,1140.59,651.98,0.0
256,6000,3072,6144,ck,0,0,185.6624,a8w8_blockscale_1x128x128_256x128x128x128_16x16_32x32_2x2_8x32x1_8x32x1_1x32x1x8_8_1x1_intrawave_v3,1219.92,498.77,0.0
256,6001,3072,3072,ck,0,0,101.3091,a8w8_blockscale_1x128x128_256x128x128x128_16x16_32x32_2x2_8x32x1_8x32x1_1x32x1x8_8_1x1_intrawave_v3,1118.01,639.06,0.0
256,6002,3072,3072,ck,0,0,101.0847,a8w8_blockscale_1x128x128_256x128x128x128_16x16_32x32_2x2_8x32x1_8x32x1_1x32x1x8_8_1x1_intrawave_v3,1120.68,640.57,0.0
256,6004,3072,3072,ck,0,0,99.9915,a8w8_blockscale_1x128x128_256x128x128x128_16x16_32x32_2x2_8x32x1_8x32x1_1x32x1x8_8_1x1_intrawave_v3,1133.31,647.76,0.0
256,6225,3072,3072,ck,0,0,103.4456,a8w8_blockscale_1x128x128_256x128x128x128_16x16_32x32_2x2_8x32x1_8x32x1_1x32x1x8_8_1x1_intrawave_v3,1135.79,645.82,0.0
256,6231,3072,6144,ck,0,0,186.8426,a8w8_blockscale_1x128x128_256x128x128x128_16x16_32x32_2x2_8x32x1_8x32x1_1x32x1x8_8_1x1_intrawave_v3,1258.88,510.81,0.0
256,6251,3072,6144,ck,0,0,185.3837,a8w8_blockscale_1x128x128_256x128x128x128_16x16_32x32_2x2_8x32x1_8x32x1_1x32x1x8_8_1x1_intrawave_v3,1272.86,516.15,0.0
256,6319,3072,3072,ck,0,0,102.12,a8w8_blockscale_1x128x128_256x128x128x128_16x16_32x32_2x2_8x32x1_8x32x1_1x32x1x8_8_1x1_intrawave_v3,1167.91,662.68,0.0
256,6469,3072,3072,ck,0,0,103.4624,a8w8_blockscale_1x128x128_256x128x128x128_16x16_32x32_2x2_8x32x1_8x32x1_1x32x1x8_8_1x1_intrawave_v3,1180.12,667.45,0.0
256,6983,3072,3072,ck,0,0,115.6921,a8w8_blockscale_1x128x128_256x128x128x128_16x16_32x32_2x2_8x32x1_8x32x1_1x32x1x8_8_1x1_intrawave_v3,1139.23,637.84,0.0
256,7001,3072,3072,ck,0,0,117.1949,a8w8_blockscale_1x128x128_256x128x128x128_16x16_32x32_2x2_8x32x1_8x32x1_1x32x1x8_8_1x1_intrawave_v3,1127.52,631.07,0.0
256,7001,3072,6144,ck,0,0,214.4726,a8w8_blockscale_1x128x128_256x128x128x128_16x16_32x32_2x2_8x32x1_8x32x1_1x32x1x8_8_1x1_intrawave_v3,1232.23,489.12,0.0
256,7003,3072,3072,ck,0,0,116.0961,a8w8_blockscale_1x128x128_256x128x128x128_16x16_32x32_2x2_8x32x1_8x32x1_1x32x1x8_8_1x1_intrawave_v3,1138.52,637.2,0.0
256,7004,3072,3072,ck,0,0,114.2801,a8w8_blockscale_1x128x128_256x128x128x128_16x16_32x32_2x2_8x32x1_8x32x1_1x32x1x8_8_1x1_intrawave_v3,1156.77,647.41,0.0
256,7011,3072,6144,ck,0,0,211.6266,a8w8_blockscale_1x128x128_256x128x128x128_16x16_32x32_2x2_8x32x1_8x32x1_1x32x1x8_8_1x1_intrawave_v3,1250.58,496.28,0.0
256,7029,3072,3072,ck,0,0,115.9865,a8w8_blockscale_1x128x128_256x128x128x128_16x16_32x32_2x2_8x32x1_8x32x1_1x32x1x8_8_1x1_intrawave_v3,1143.82,639.87,0.0
256,7050,3072,3072,ck,0,0,118.3689,a8w8_blockscale_1x128x128_256x128x128x128_16x16_32x32_2x2_8x32x1_8x32x1_1x32x1x8_8_1x1_intrawave_v3,1124.15,628.63,0.0
256,7204,3072,3072,ck,0,0,116.9153,a8w8_blockscale_1x128x128_256x128x128x128_16x16_32x32_2x2_8x32x1_8x32x1_1x32x1x8_8_1x1_intrawave_v3,1162.99,648.58,0.0
256,7235,3072,3072,ck,0,0,118.7333,a8w8_blockscale_1x128x128_256x128x128x128_16x16_32x32_2x2_8x32x1_8x32x1_1x32x1x8_8_1x1_intrawave_v3,1150.11,641.06,0.0
256,7237,3072,3072,ck,0,0,117.2477,a8w8_blockscale_1x128x128_256x128x128x128_16x16_32x32_2x2_8x32x1_8x32x1_1x32x1x8_8_1x1_intrawave_v3,1165.0,649.34,0.0
256,7238,3072,3072,ck,0,0,118.8385,a8w8_blockscale_1x128x128_256x128x128x128_16x16_32x32_2x2_8x32x1_8x32x1_1x32x1x8_8_1x1_intrawave_v3,1149.57,640.72,0.0
256,7239,3072,6144,ck,0,0,214.7285,a8w8_blockscale_1x128x128_256x128x128x128_16x16_32x32_2x2_8x32x1_8x32x1_1x32x1x8_8_1x1_intrawave_v3,1272.6,502.16,0.0
256,7240,3072,3072,ck,0,0,117.2497,a8w8_blockscale_1x128x128_256x128x128x128_16x16_32x32_2x2_8x32x1_8x32x1_1x32x1x8_8_1x1_intrawave_v3,1165.47,649.56,0.0
256,7241,3072,3072,ck,0,0,118.0817,a8w8_blockscale_1x128x128_256x128x128x128_16x16_32x32_2x2_8x32x1_8x32x1_1x32x1x8_8_1x1_intrawave_v3,1157.41,645.06,0.0
256,7243,3072,3072,ck,0,0,118.1037,a8w8_blockscale_1x128x128_256x128x128x128_16x16_32x32_2x2_8x32x1_8x32x1_1x32x1x8_8_1x1_intrawave_v3,1157.52,645.1,0.0
256,7254,3072,3072,ck,0,0,118.0409,a8w8_blockscale_1x128x128_256x128x128x128_16x16_32x32_2x2_8x32x1_8x32x1_1x32x1x8_8_1x1_intrawave_v3,1159.89,646.3,0.0
256,7260,3072,6144,ck,0,0,217.2216,a8w8_blockscale_1x128x128_256x128x128x128_16x16_32x32_2x2_8x32x1_8x32x1_1x32x1x8_8_1x1_intrawave_v3,1261.64,497.58,0.0
256,7264,3072,6144,ck,0,0,214.3439,a8w8_blockscale_1x128x128_256x128x128x128_16x16_32x32_2x2_8x32x1_8x32x1_1x32x1x8_8_1x1_intrawave_v3,1279.28,504.49,0.0
256,7284,3072,3072,ck,0,0,118.6193,a8w8_blockscale_1x128x128_256x128x128x128_16x16_32x32_2x2_8x32x1_8x32x1_1x32x1x8_8_1x1_intrawave_v3,1159.01,645.48,0.0
256,7340,3072,3072,ck,0,0,120.7581,a8w8_blockscale_1x128x128_256x128x128x128_16x16_32x32_2x2_8x32x1_8x32x1_1x32x1x8_8_1x1_intrawave_v3,1147.23,638.32,0.0
256,7473,3072,3072,ck,0,0,120.523,a8w8_blockscale_1x128x128_256x128x128x128_16x16_32x32_2x2_8x32x1_8x32x1_1x32x1x8_8_1x1_intrawave_v3,1170.3,649.74,0.0
256,7695,3072,6144,ck,0,0,221.2956,a8w8_blockscale_1x128x128_256x128x128x128_16x16_32x32_2x2_8x32x1_8x32x1_1x32x1x8_8_1x1_intrawave_v3,1312.62,512.57,0.0
256,7726,3072,3072,ck,0,0,121.325,a8w8_blockscale_1x128x128_256x128x128x128_16x16_32x32_2x2_8x32x1_8x32x1_1x32x1x8_8_1x1_intrawave_v3,1201.92,664.66,0.0
256,8004,3072,3072,ck,0,0,123.7834,a8w8_blockscale_1x128x128_256x128x128x128_16x16_32x32_2x2_8x32x1_8x32x1_1x32x1x8_8_1x1_intrawave_v3,1220.44,672.16,0.0
256,8020,3072,3072,ck,0,0,123.4162,a8w8_blockscale_1x128x128_256x128x128x128_16x16_32x32_2x2_8x32x1_8x32x1_1x32x1x8_8_1x1_intrawave_v3,1226.52,675.35,0.0
256,8029,3072,3072,ck,0,0,123.5094,a8w8_blockscale_1x128x128_256x128x128x128_16x16_32x32_2x2_8x32x1_8x32x1_1x32x1x8_8_1x1_intrawave_v3,1226.97,675.51,0.0
256,8040,3072,3072,ck,0,0,124.419,a8w8_blockscale_1x128x128_256x128x128x128_16x16_32x32_2x2_8x32x1_8x32x1_1x32x1x8_8_1x1_intrawave_v3,1219.67,671.39,0.0
256,8041,3072,3072,ck,0,0,124.8654,a8w8_blockscale_1x128x128_256x128x128x128_16x16_32x32_2x2_8x32x1_8x32x1_1x32x1x8_8_1x1_intrawave_v3,1215.46,669.06,0.0
256,8088,3072,3072,ck,0,0,123.8058,a8w8_blockscale_1x128x128_256x128x128x128_16x16_32x32_2x2_8x32x1_8x32x1_1x32x1x8_8_1x1_intrawave_v3,1233.03,678.29,0.0
256,8100,3072,3072,ck,0,0,123.4219,a8w8_blockscale_1x128x128_256x128x128x128_16x16_32x32_2x2_8x32x1_8x32x1_1x32x1x8_8_1x1_intrawave_v3,1238.7,681.3,0.0
256,8311,3072,6144,ck,0,0,249.358,a8w8_blockscale_1x128x128_256x128x128x128_16x16_32x32_2x2_8x32x1_8x32x1_1x32x1x8_8_1x1_intrawave_v3,1258.15,485.25,0.0
256,8460,3072,6144,ck,0,0,250.199,a8w8_blockscale_1x128x128_256x128x128x128_16x16_32x32_2x2_8x32x1_8x32x1_1x32x1x8_8_1x1_intrawave_v3,1276.4,490.93,0.0
256,8541,3072,6144,ck,0,0,248.739,a8w8_blockscale_1x128x128_256x128x128x128_16x16_32x32_2x2_8x32x1_8x32x1_1x32x1x8_8_1x1_intrawave_v3,1296.19,497.82,0.0
256,8603,3072,6144,ck,0,0,247.5738,a8w8_blockscale_1x128x128_256x128x128x128_16x16_32x32_2x2_8x32x1_8x32x1_1x32x1x8_8_1x1_intrawave_v3,1311.74,503.24,0.0
256,8659,3072,6144,ck,0,0,246.0203,a8w8_blockscale_1x128x128_256x128x128x128_16x16_32x32_2x2_8x32x1_8x32x1_1x32x1x8_8_1x1_intrawave_v3,1328.62,509.21,0.0
256,8683,3072,3072,ck,0,0,138.2824,a8w8_blockscale_1x128x128_256x128x128x128_16x16_32x32_2x2_8x32x1_8x32x1_1x32x1x8_8_1x1_intrawave_v3,1185.16,646.93,0.0
256,8683,3072,6144,ck,0,0,248.4798,a8w8_blockscale_1x128x128_256x128x128x128_16x16_32x32_2x2_8x32x1_8x32x1_1x32x1x8_8_1x1_intrawave_v3,1319.11,505.36,0.0
256,8897,3072,6144,ck,0,0,253.5546,a8w8_blockscale_1x128x128_256x128x128x128_16x16_32x32_2x2_8x32x1_8x32x1_1x32x1x8_8_1x1_intrawave_v3,1324.57,505.61,0.0
256,8927,3072,3072,ck,0,0,138.0889,a8w8_blockscale_1x128x128_256x128x128x128_16x16_32x32_2x2_8x32x1_8x32x1_1x32x1x8_8_1x1_intrawave_v3,1220.17,664.13,0.0
256,8969,3072,6144,ck,0,0,256.4294,a8w8_blockscale_1x128x128_256x128x128x128_16x16_32x32_2x2_8x32x1_8x32x1_1x32x1x8_8_1x1_intrawave_v3,1320.32,503.4,0.0
256,8972,3072,3072,ck,0,0,137.6102,a8w8_blockscale_1x128x128_256x128x128x128_16x16_32x32_2x2_8x32x1_8x32x1_1x32x1x8_8_1x1_intrawave_v3,1230.58,669.45,0.0
256,9002,3072,6144,ck,0,0,253.8659,a8w8_blockscale_1x128x128_256x128x128x128_16x16_32x32_2x2_8x32x1_8x32x1_1x32x1x8_8_1x1_intrawave_v3,1338.56,510.08,0.0
256,9005,3072,6144,ck,0,0,254.4149,a8w8_blockscale_1x128x128_256x128x128x128_16x16_32x32_2x2_8x32x1_8x32x1_1x32x1x8_8_1x1_intrawave_v3,1336.11,509.12,0.0
256,9008,3072,3072,ck,0,0,141.7511,a8w8_blockscale_1x128x128_256x128x128x128_16x16_32x32_2x2_8x32x1_8x32x1_1x32x1x8_8_1x1_intrawave_v3,1199.43,652.23,0.0
256,9205,3072,3072,ck,0,0,141.4027,a8w8_blockscale_1x128x128_256x128x128x128_16x16_32x32_2x2_8x32x1_8x32x1_1x32x1x8_8_1x1_intrawave_v3,1228.68,666.68,0.0
256,9352,3072,3072,ck,0,0,143.2427,a8w8_blockscale_1x128x128_256x128x128x128_16x16_32x32_2x2_8x32x1_8x32x1_1x32x1x8_8_1x1_intrawave_v3,1232.27,667.57,0.0
256,9408,3072,3072,ck,0,0,142.7335,a8w8_blockscale_1x128x128_256x128x128x128_16x16_32x32_2x2_8x32x1_8x32x1_1x32x1x8_8_1x1_intrawave_v3,1244.07,673.57,0.0
256,9416,3072,3072,ck,0,0,143.9164,a8w8_blockscale_1x128x128_256x128x128x128_16x16_32x32_2x2_8x32x1_8x32x1_1x32x1x8_8_1x1_intrawave_v3,1234.89,668.55,0.0
256,9439,3072,3072,ck,0,0,144.0628,a8w8_blockscale_1x128x128_256x128x128x128_16x16_32x32_2x2_8x32x1_8x32x1_1x32x1x8_8_1x1_intrawave_v3,1236.65,669.34,0.0
256,9486,3072,3072,ck,0,0,149.8223,a8w8_blockscale_1x128x128_256x128x128x128_16x16_32x32_2x2_8x32x1_8x32x1_1x32x1x8_8_1x1_intrawave_v3,1195.03,646.5,0.0
256,9486,3072,6144,ck,0,0,277.5472,a8w8_blockscale_1x128x128_256x128x128x128_16x16_32x32_2x2_8x32x1_8x32x1_1x32x1x8_8_1x1_intrawave_v3,1290.18,487.98,0.0
256,9628,3072,3072,ck,0,0,148.512,a8w8_blockscale_1x128x128_256x128x128x128_16x16_32x32_2x2_8x32x1_8x32x1_1x32x1x8_8_1x1_intrawave_v3,1223.62,661.02,0.0
256,9694,3072,6144,ck,0,0,279.7272,a8w8_blockscale_1x128x128_256x128x128x128_16x16_32x32_2x2_8x32x1_8x32x1_1x32x1x8_8_1x1_intrawave_v3,1308.19,493.32,0.0
256,9716,3072,3072,ck,0,0,151.4707,a8w8_blockscale_1x128x128_256x128x128x128_16x16_32x32_2x2_8x32x1_8x32x1_1x32x1x8_8_1x1_intrawave_v3,1210.69,653.46,0.0
256,9762,3072,6144,ck,0,0,280.0601,a8w8_blockscale_1x128x128_256x128x128x128_16x16_32x32_2x2_8x32x1_8x32x1_1x32x1x8_8_1x1_intrawave_v3,1315.8,495.71,0.0
256,9830,3072,3072,ck,0,0,152.0897,a8w8_blockscale_1x128x128_256x128x128x128_16x16_32x32_2x2_8x32x1_8x32x1_1x32x1x8_8_1x1_intrawave_v3,1219.91,657.71,0.0
256,10000,3072,3072,ck,0,0,156.0553,a8w8_blockscale_1x128x128_256x128x128x128_16x16_32x32_2x2_8x32x1_8x32x1_1x32x1x8_8_1x1_intrawave_v3,1209.47,651.03,0.0
256,10000,3072,6144,ck,0,0,284.677,a8w8_blockscale_1x128x128_256x128x128x128_16x16_32x32_2x2_8x32x1_8x32x1_1x32x1x8_8_1x1_intrawave_v3,1326.02,497.95,0.0
256,10001,3072,3072,ck,0,0,156.4781,a8w8_blockscale_1x128x128_256x128x128x128_16x16_32x32_2x2_8x32x1_8x32x1_1x32x1x8_8_1x1_intrawave_v3,1206.32,649.33,0.0
256,10001,3072,6144,ck,0,0,283.153,a8w8_blockscale_1x128x128_256x128x128x128_16x16_32x32_2x2_8x32x1_8x32x1_1x32x1x8_8_1x1_intrawave_v3,1333.29,500.67,0.0
256,10002,3072,3072,ck,0,0,156.2473,a8w8_blockscale_1x128x128_256x128x128x128_16x16_32x32_2x2_8x32x1_8x32x1_1x32x1x8_8_1x1_intrawave_v3,1208.22,650.35,0.0
256,10002,3072,6144,ck,0,0,284.7281,a8w8_blockscale_1x128x128_256x128x128x128_16x16_32x32_2x2_8x32x1_8x32x1_1x32x1x8_8_1x1_intrawave_v3,1326.05,497.95,0.0
256,10003,3072,3072,ck,0,0,157.2173,a8w8_blockscale_1x128x128_256x128x128x128_16x16_32x32_2x2_8x32x1_8x32x1_1x32x1x8_8_1x1_intrawave_v3,1200.89,646.4,0.0
256,10003,3072,6144,ck,0,0,283.8738,a8w8_blockscale_1x128x128_256x128x128x128_16x16_32x32_2x2_8x32x1_8x32x1_1x32x1x8_8_1x1_intrawave_v3,1330.17,499.49,0.0
256,10004,3072,3072,ck,0,0,152.9281,a8w8_blockscale_1x128x128_256x128x128x128_16x16_32x32_2x2_8x32x1_8x32x1_1x32x1x8_8_1x1_intrawave_v3,1234.69,664.59,0.0
256,10006,3072,3072,ck,0,0,155.3385,a8w8_blockscale_1x128x128_256x128x128x128_16x16_32x32_2x2_8x32x1_8x32x1_1x32x1x8_8_1x1_intrawave_v3,1215.78,654.39,0.0
256,10006,3072,6144,ck,0,0,282.7139,a8w8_blockscale_1x128x128_256x128x128x128_16x16_32x32_2x2_8x32x1_8x32x1_1x32x1x8_8_1x1_intrawave_v3,1336.03,501.67,0.0
256,10007,3072,3072,ck,0,0,154.7355,a8w8_blockscale_1x128x128_256x128x128x128_16x16_32x32_2x2_8x32x1_8x32x1_1x32x1x8_8_1x1_intrawave_v3,1220.64,657.0,0.0
256,10009,3072,3072,ck,0,0,155.9144,a8w8_blockscale_1x128x128_256x128x128x128_16x16_32x32_2x2_8x32x1_8x32x1_1x32x1x8_8_1x1_intrawave_v3,1211.65,652.15,0.0
256,10014,3072,6144,ck,0,0,283.5552,a8w8_blockscale_1x128x128_256x128x128x128_16x16_32x32_2x2_8x32x1_8x32x1_1x32x1x8_8_1x1_intrawave_v3,1333.13,500.52,0.0
256,10016,3072,6144,ck,0,0,283.2062,a8w8_blockscale_1x128x128_256x128x128x128_16x16_32x32_2x2_8x32x1_8x32x1_1x32x1x8_8_1x1_intrawave_v3,1335.04,501.23,0.0
256,10019,3072,6144,ck,0,0,281.1858,a8w8_blockscale_1x128x128_256x128x128x128_16x16_32x32_2x2_8x32x1_8x32x1_1x32x1x8_8_1x1_intrawave_v3,1345.03,504.96,0.0
256,10020,3072,6144,ck,0,0,283.0876,a8w8_blockscale_1x128x128_256x128x128x128_16x16_32x32_2x2_8x32x1_8x32x1_1x32x1x8_8_1x1_intrawave_v3,1336.13,501.61,0.0
256,10030,3072,3072,ck,0,0,157.0418,a8w8_blockscale_1x128x128_256x128x128x128_16x16_32x32_2x2_8x32x1_8x32x1_1x32x1x8_8_1x1_intrawave_v3,1205.47,648.7,0.0
256,10031,3072,3072,ck,0,0,155.5614,a8w8_blockscale_1x128x128_256x128x128x128_16x16_32x32_2x2_8x32x1_8x32x1_1x32x1x8_8_1x1_intrawave_v3,1217.07,654.94,0.0
256,10054,3072,3072,ck,0,0,152.9011,a8w8_blockscale_1x128x128_256x128x128x128_16x16_32x32_2x2_8x32x1_8x32x1_1x32x1x8_8_1x1_intrawave_v3,1241.08,667.72,0.0
256,10055,3072,3072,ck,0,0,152.1515,a8w8_blockscale_1x128x128_256x128x128x128_16x16_32x32_2x2_8x32x1_8x32x1_1x32x1x8_8_1x1_intrawave_v3,1247.32,671.07,0.0
256,10056,3072,3072,ck,0,0,152.9,a8w8_blockscale_1x128x128_256x128x128x128_16x16_32x32_2x2_8x32x1_8x32x1_1x32x1x8_8_1x1_intrawave_v3,1241.34,667.84,0.0
256,10058,3072,3072,ck,0,0,155.1903,a8w8_blockscale_1x128x128_256x128x128x128_16x16_32x32_2x2_8x32x1_8x32x1_1x32x1x8_8_1x1_intrawave_v3,1223.26,658.11,0.0
256,10063,3072,3072,ck,0,0,156.4131,a8w8_blockscale_1x128x128_256x128x128x128_16x16_32x32_2x2_8x32x1_8x32x1_1x32x1x8_8_1x1_intrawave_v3,1214.3,653.26,0.0
256,10095,3072,3072,ck,0,0,158.5339,a8w8_blockscale_1x128x128_256x128x128x128_16x16_32x32_2x2_8x32x1_8x32x1_1x32x1x8_8_1x1_intrawave_v3,1201.87,646.38,0.0
256,10120,3072,3072,ck,0,0,154.8241,a8w8_blockscale_1x128x128_256x128x128x128_16x16_32x32_2x2_8x32x1_8x32x1_1x32x1x8_8_1x1_intrawave_v3,1233.71,663.35,0.0
256,10125,3072,3072,ck,0,0,154.4111,a8w8_blockscale_1x128x128_256x128x128x128_16x16_32x32_2x2_8x32x1_8x32x1_1x32x1x8_8_1x1_intrawave_v3,1237.62,665.43,0.0
256,10126,3072,3072,ck,0,0,156.8883,a8w8_blockscale_1x128x128_256x128x128x128_16x16_32x32_2x2_8x32x1_8x32x1_1x32x1x8_8_1x1_intrawave_v3,1218.2,654.98,0.0
256,10127,3072,3072,ck,0,0,155.9936,a8w8_blockscale_1x128x128_256x128x128x128_16x16_32x32_2x2_8x32x1_8x32x1_1x32x1x8_8_1x1_intrawave_v3,1225.31,658.79,0.0
256,10128,3072,3072,ck,0,0,154.8303,a8w8_blockscale_1x128x128_256x128x128x128_16x16_32x32_2x2_8x32x1_8x32x1_1x32x1x8_8_1x1_intrawave_v3,1234.64,663.8,0.0
256,10131,3072,3072,ck,0,0,154.1848,a8w8_blockscale_1x128x128_256x128x128x128_16x16_32x32_2x2_8x32x1_8x32x1_1x32x1x8_8_1x1_intrawave_v3,1240.18,666.76,0.0
256,10134,3072,3072,ck,0,0,153.0594,a8w8_blockscale_1x128x128_256x128x128x128_16x16_32x32_2x2_8x32x1_8x32x1_1x32x1x8_8_1x1_intrawave_v3,1249.66,671.84,0.0
256,10140,3072,3072,ck,0,0,155.2168,a8w8_blockscale_1x128x128_256x128x128x128_16x16_32x32_2x2_8x32x1_8x32x1_1x32x1x8_8_1x1_intrawave_v3,1233.02,662.86,0.0
256,10141,3072,3072,ck,0,0,154.5846,a8w8_blockscale_1x128x128_256x128x128x128_16x16_32x32_2x2_8x32x1_8x32x1_1x32x1x8_8_1x1_intrawave_v3,1238.19,665.63,0.0
256,10142,3072,3072,ck,0,0,155.9268,a8w8_blockscale_1x128x128_256x128x128x128_16x16_32x32_2x2_8x32x1_8x32x1_1x32x1x8_8_1x1_intrawave_v3,1227.65,659.96,0.0
256,10143,3072,3072,ck,0,0,155.796,a8w8_blockscale_1x128x128_256x128x128x128_16x16_32x32_2x2_8x32x1_8x32x1_1x32x1x8_8_1x1_intrawave_v3,1228.8,660.58,0.0
256,10148,3072,3072,ck,0,0,153.8192,a8w8_blockscale_1x128x128_256x128x128x128_16x16_32x32_2x2_8x32x1_8x32x1_1x32x1x8_8_1x1_intrawave_v3,1245.21,669.36,0.0
256,10156,3072,3072,ck,0,0,155.5168,a8w8_blockscale_1x128x128_256x128x128x128_16x16_32x32_2x2_8x32x1_8x32x1_1x32x1x8_8_1x1_intrawave_v3,1232.59,662.53,0.0
256,10157,3072,3072,ck,0,0,154.0216,a8w8_blockscale_1x128x128_256x128x128x128_16x16_32x32_2x2_8x32x1_8x32x1_1x32x1x8_8_1x1_intrawave_v3,1244.68,669.02,0.0
256,10173,3072,3072,ck,0,0,156.51,a8w8_blockscale_1x128x128_256x128x128x128_16x16_32x32_2x2_8x32x1_8x32x1_1x32x1x8_8_1x1_intrawave_v3,1226.82,659.33,0.0
256,10174,3072,3072,ck,0,0,153.2256,a8w8_blockscale_1x128x128_256x128x128x128_16x16_32x32_2x2_8x32x1_8x32x1_1x32x1x8_8_1x1_intrawave_v3,1253.24,673.52,0.0
256,10175,3072,3072,ck,0,0,156.2912,a8w8_blockscale_1x128x128_256x128x128x128_16x16_32x32_2x2_8x32x1_8x32x1_1x32x1x8_8_1x1_intrawave_v3,1228.77,660.37,0.0
256,10176,3072,3072,ck,0,0,155.2548,a8w8_blockscale_1x128x128_256x128x128x128_16x16_32x32_2x2_8x32x1_8x32x1_1x32x1x8_8_1x1_intrawave_v3,1237.1,664.84,0.0
256,10177,3072,3072,ck,0,0,152.775,a8w8_blockscale_1x128x128_256x128x128x128_16x16_32x32_2x2_8x32x1_8x32x1_1x32x1x8_8_1x1_intrawave_v3,1257.3,675.69,0.0
256,10178,3072,3072,ck,0,0,154.0644,a8w8_blockscale_1x128x128_256x128x128x128_16x16_32x32_2x2_8x32x1_8x32x1_1x32x1x8_8_1x1_intrawave_v3,1246.9,670.09,0.0
256,10179,3072,3072,ck,0,0,152.1892,a8w8_blockscale_1x128x128_256x128x128x128_16x16_32x32_2x2_8x32x1_8x32x1_1x32x1x8_8_1x1_intrawave_v3,1262.39,678.41,0.0
256,10180,3072,3072,ck,0,0,156.6572,a8w8_blockscale_1x128x128_256x128x128x128_16x16_32x32_2x2_8x32x1_8x32x1_1x32x1x8_8_1x1_intrawave_v3,1226.51,659.12,0.0
256,10181,3072,3072,ck,0,0,156.1444,a8w8_blockscale_1x128x128_256x128x128x128_16x16_32x32_2x2_8x32x1_8x32x1_1x32x1x8_8_1x1_intrawave_v3,1230.66,661.34,0.0
256,10205,3072,3072,ck,0,0,155.706,a8w8_blockscale_1x128x128_256x128x128x128_16x16_32x32_2x2_8x32x1_8x32x1_1x32x1x8_8_1x1_intrawave_v3,1237.03,664.63,0.0
256,10206,3072,3072,ck,0,0,154.6331,a8w8_blockscale_1x128x128_256x128x128x128_16x16_32x32_2x2_8x32x1_8x32x1_1x32x1x8_8_1x1_intrawave_v3,1245.73,669.3,0.0
256,10208,3072,3072,ck,0,0,155.6672,a8w8_blockscale_1x128x128_256x128x128x128_16x16_32x32_2x2_8x32x1_8x32x1_1x32x1x8_8_1x1_intrawave_v3,1237.7,664.97,0.0
256,10223,3072,3072,ck,0,0,153.8892,a8w8_blockscale_1x128x128_256x128x128x128_16x16_32x32_2x2_8x32x1_8x32x1_1x32x1x8_8_1x1_intrawave_v3,1253.84,673.55,0.0
256,10225,3072,3072,ck,0,0,154.5992,a8w8_blockscale_1x128x128_256x128x128x128_16x16_32x32_2x2_8x32x1_8x32x1_1x32x1x8_8_1x1_intrawave_v3,1248.33,670.58,0.0
256,10226,3072,3072,ck,0,0,154.098,a8w8_blockscale_1x128x128_256x128x128x128_16x16_32x32_2x2_8x32x1_8x32x1_1x32x1x8_8_1x1_intrawave_v3,1252.51,672.82,0.0
256,10231,3072,3072,ck,0,0,153.9756,a8w8_blockscale_1x128x128_256x128x128x128_16x16_32x32_2x2_8x32x1_8x32x1_1x32x1x8_8_1x1_intrawave_v3,1254.12,673.65,0.0
256,10233,3072,3072,ck,0,0,156.1568,a8w8_blockscale_1x128x128_256x128x128x128_16x16_32x32_2x2_8x32x1_8x32x1_1x32x1x8_8_1x1_intrawave_v3,1236.84,664.36,0.0
256,10235,3072,3072,ck,0,0,155.3304,a8w8_blockscale_1x128x128_256x128x128x128_16x16_32x32_2x2_8x32x1_8x32x1_1x32x1x8_8_1x1_intrawave_v3,1243.67,668.01,0.0
256,10236,3072,3072,ck,0,0,155.1555,a8w8_blockscale_1x128x128_256x128x128x128_16x16_32x32_2x2_8x32x1_8x32x1_1x32x1x8_8_1x1_intrawave_v3,1245.19,668.83,0.0
256,10237,3072,3072,ck,0,0,155.7786,a8w8_blockscale_1x128x128_256x128x128x128_16x16_32x32_2x2_8x32x1_8x32x1_1x32x1x8_8_1x1_intrawave_v3,1240.33,666.21,0.0
256,10242,3072,3072,ck,0,0,158.5532,a8w8_blockscale_1x128x128_256x128x128x128_16x16_32x32_2x2_8x32x1_8x32x1_1x32x1x8_8_1x1_intrawave_v3,1219.22,654.84,0.0
256,10247,3072,3072,ck,0,0,158.9754,a8w8_blockscale_1x128x128_256x128x128x128_16x16_32x32_2x2_8x32x1_8x32x1_1x32x1x8_8_1x1_intrawave_v3,1216.58,653.39,0.0
256,10248,3072,3072,ck,0,0,158.2382,a8w8_blockscale_1x128x128_256x128x128x128_16x16_32x32_2x2_8x32x1_8x32x1_1x32x1x8_8_1x1_intrawave_v3,1222.36,656.5,0.0
256,10250,3072,3072,ck,0,0,156.7004,a8w8_blockscale_1x128x128_256x128x128x128_16x16_32x32_2x2_8x32x1_8x32x1_1x32x1x8_8_1x1_intrawave_v3,1234.6,663.06,0.0
256,10252,3072,3072,ck,0,0,156.9149,a8w8_blockscale_1x128x128_256x128x128x128_16x16_32x32_2x2_8x32x1_8x32x1_1x32x1x8_8_1x1_intrawave_v3,1233.15,662.27,0.0
256,10254,3072,3072,ck,0,0,156.6857,a8w8_blockscale_1x128x128_256x128x128x128_16x16_32x32_2x2_8x32x1_8x32x1_1x32x1x8_8_1x1_intrawave_v3,1235.2,663.35,0.0
256,10258,3072,3072,ck,0,0,156.8938,a8w8_blockscale_1x128x128_256x128x128x128_16x16_32x32_2x2_8x32x1_8x32x1_1x32x1x8_8_1x1_intrawave_v3,1234.04,662.71,0.0
256,10259,3072,3072,ck,0,0,157.6557,a8w8_blockscale_1x128x128_256x128x128x128_16x16_32x32_2x2_8x32x1_8x32x1_1x32x1x8_8_1x1_intrawave_v3,1228.2,659.56,0.0
256,10272,3072,3072,ck,0,0,155.6005,a8w8_blockscale_1x128x128_256x128x128x128_16x16_32x32_2x2_8x32x1_8x32x1_1x32x1x8_8_1x1_intrawave_v3,1246.0,669.05,0.0
256,10274,3072,3072,ck,0,0,156.8081,a8w8_blockscale_1x128x128_256x128x128x128_16x16_32x32_2x2_8x32x1_8x32x1_1x32x1x8_8_1x1_intrawave_v3,1236.64,664.01,0.0
256,10276,3072,3072,ck,0,0,156.4923,a8w8_blockscale_1x128x128_256x128x128x128_16x16_32x32_2x2_8x32x1_8x32x1_1x32x1x8_8_1x1_intrawave_v3,1239.38,665.47,0.0
256,10277,3072,3072,ck,0,0,156.9233,a8w8_blockscale_1x128x128_256x128x128x128_16x16_32x32_2x2_8x32x1_8x32x1_1x32x1x8_8_1x1_intrawave_v3,1236.09,663.7,0.0
256,10281,3072,3072,ck,0,0,156.0417,a8w8_blockscale_1x128x128_256x128x128x128_16x16_32x32_2x2_8x32x1_8x32x1_1x32x1x8_8_1x1_intrawave_v3,1243.56,667.69,0.0
256,10282,3072,3072,ck,0,0,155.7285,a8w8_blockscale_1x128x128_256x128x128x128_16x16_32x32_2x2_8x32x1_8x32x1_1x32x1x8_8_1x1_intrawave_v3,1246.18,669.09,0.0
256,10283,3072,3072,ck,0,0,154.0109,a8w8_blockscale_1x128x128_256x128x128x128_16x16_32x32_2x2_8x32x1_8x32x1_1x32x1x8_8_1x1_intrawave_v3,1260.2,676.61,0.0
256,10283,3072,6144,ck,0,0,287.8076,a8w8_blockscale_1x128x128_256x128x128x128_16x16_32x32_2x2_8x32x1_8x32x1_1x32x1x8_8_1x1_intrawave_v3,1348.71,504.61,0.0
256,10284,3072,3072,ck,0,0,156.8241,a8w8_blockscale_1x128x128_256x128x128x128_16x16_32x32_2x2_8x32x1_8x32x1_1x32x1x8_8_1x1_intrawave_v3,1237.72,664.53,0.0
256,10286,3072,3072,ck,0,0,156.4393,a8w8_blockscale_1x128x128_256x128x128x128_16x16_32x32_2x2_8x32x1_8x32x1_1x32x1x8_8_1x1_intrawave_v3,1241.0,666.28,0.0
256,10287,3072,3072,ck,0,0,158.1221,a8w8_blockscale_1x128x128_256x128x128x128_16x16_32x32_2x2_8x32x1_8x32x1_1x32x1x8_8_1x1_intrawave_v3,1227.92,659.25,0.0
256,10299,3072,3072,ck,0,0,156.7003,a8w8_blockscale_1x128x128_256x128x128x128_16x16_32x32_2x2_8x32x1_8x32x1_1x32x1x8_8_1x1_intrawave_v3,1240.5,665.94,0.0
256,10301,3072,3072,ck,0,0,154.7427,a8w8_blockscale_1x128x128_256x128x128x128_16x16_32x32_2x2_8x32x1_8x32x1_1x32x1x8_8_1x1_intrawave_v3,1256.44,674.48,0.0
256,10302,3072,3072,ck,0,0,159.8077,a8w8_blockscale_1x128x128_256x128x128x128_16x16_32x32_2x2_8x32x1_8x32x1_1x32x1x8_8_1x1_intrawave_v3,1216.74,653.16,0.0
256,10303,3072,3072,ck,0,0,156.9201,a8w8_blockscale_1x128x128_256x128x128x128_16x16_32x32_2x2_8x32x1_8x32x1_1x32x1x8_8_1x1_intrawave_v3,1239.25,665.24,0.0
256,10304,3072,3072,ck,0,0,157.2477,a8w8_blockscale_1x128x128_256x128x128x128_16x16_32x32_2x2_8x32x1_8x32x1_1x32x1x8_8_1x1_intrawave_v3,1236.78,663.91,0.0
256,10305,3072,3072,ck,0,0,157.8657,a8w8_blockscale_1x128x128_256x128x128x128_16x16_32x32_2x2_8x32x1_8x32x1_1x32x1x8_8_1x1_intrawave_v3,1232.06,661.37,0.0
256,10310,3072,3072,ck,0,0,156.8129,a8w8_blockscale_1x128x128_256x128x128x128_16x16_32x32_2x2_8x32x1_8x32x1_1x32x1x8_8_1x1_intrawave_v3,1240.94,666.11,0.0
256,10312,3072,3072,ck,0,0,156.9913,a8w8_blockscale_1x128x128_256x128x128x128_16x16_32x32_2x2_8x32x1_8x32x1_1x32x1x8_8_1x1_intrawave_v3,1239.77,665.47,0.0
256,10318,3072,3072,ck,0,0,155.0451,a8w8_blockscale_1x128x128_256x128x128x128_16x16_32x32_2x2_8x32x1_8x32x1_1x32x1x8_8_1x1_intrawave_v3,1256.06,674.18,0.0
256,10320,3072,3072,ck,0,0,155.2205,a8w8_blockscale_1x128x128_256x128x128x128_16x16_32x32_2x2_8x32x1_8x32x1_1x32x1x8_8_1x1_intrawave_v3,1254.88,673.53,0.0
256,10321,3072,3072,ck,0,0,157.6429,a8w8_blockscale_1x128x128_256x128x128x128_16x16_32x32_2x2_8x32x1_8x32x1_1x32x1x8_8_1x1_intrawave_v3,1235.72,663.24,0.0
256,10322,3072,3072,ck,0,0,157.1061,a8w8_blockscale_1x128x128_256x128x128x128_16x16_32x32_2x2_8x32x1_8x32x1_1x32x1x8_8_1x1_intrawave_v3,1240.06,665.57,0.0
256,10328,3072,3072,ck,0,0,155.9057,a8w8_blockscale_1x128x128_256x128x128x128_16x16_32x32_2x2_8x32x1_8x32x1_1x32x1x8_8_1x1_intrawave_v3,1250.34,671.05,0.0
256,10333,3072,3072,ck,0,0,158.7877,a8w8_blockscale_1x128x128_256x128x128x128_16x16_32x32_2x2_8x32x1_8x32x1_1x32x1x8_8_1x1_intrawave_v3,1228.24,659.16,0.0
256,10334,3072,3072,ck,0,0,156.3952,a8w8_blockscale_1x128x128_256x128x128x128_16x16_32x32_2x2_8x32x1_8x32x1_1x32x1x8_8_1x1_intrawave_v3,1247.15,669.3,0.0
256,10336,3072,3072,ck,0,0,156.3048,a8w8_blockscale_1x128x128_256x128x128x128_16x16_32x32_2x2_8x32x1_8x32x1_1x32x1x8_8_1x1_intrawave_v3,1248.11,669.81,0.0
256,10337,3072,3072,ck,0,0,156.6541,a8w8_blockscale_1x128x128_256x128x128x128_16x16_32x32_2x2_8x32x1_8x32x1_1x32x1x8_8_1x1_intrawave_v3,1245.45,668.37,0.0
256,10338,3072,3072,ck,0,0,156.4817,a8w8_blockscale_1x128x128_256x128x128x128_16x16_32x32_2x2_8x32x1_8x32x1_1x32x1x8_8_1x1_intrawave_v3,1246.94,669.17,0.0
256,10347,3072,3072,ck,0,0,156.5544,a8w8_blockscale_1x128x128_256x128x128x128_16x16_32x32_2x2_8x32x1_8x32x1_1x32x1x8_8_1x1_intrawave_v3,1247.45,669.38,0.0
256,10349,3072,3072,ck,0,0,158.4693,a8w8_blockscale_1x128x128_256x128x128x128_16x16_32x32_2x2_8x32x1_8x32x1_1x32x1x8_8_1x1_intrawave_v3,1232.61,661.41,0.0
256,10350,3072,3072,ck,0,0,155.1929,a8w8_blockscale_1x128x128_256x128x128x128_16x16_32x32_2x2_8x32x1_8x32x1_1x32x1x8_8_1x1_intrawave_v3,1258.75,675.44,0.0
256,10357,3072,3072,ck,0,0,159.0764,a8w8_blockscale_1x128x128_256x128x128x128_16x16_32x32_2x2_8x32x1_8x32x1_1x32x1x8_8_1x1_intrawave_v3,1228.85,659.35,0.0
256,10358,3072,3072,ck,0,0,158.5185,a8w8_blockscale_1x128x128_256x128x128x128_16x16_32x32_2x2_8x32x1_8x32x1_1x32x1x8_8_1x1_intrawave_v3,1233.3,661.73,0.0
256,10359,3072,3072,ck,0,0,157.2609,a8w8_blockscale_1x128x128_256x128x128x128_16x16_32x32_2x2_8x32x1_8x32x1_1x32x1x8_8_1x1_intrawave_v3,1243.28,667.08,0.0
256,10360,3072,3072,ck,0,0,159.2234,a8w8_blockscale_1x128x128_256x128x128x128_16x16_32x32_2x2_8x32x1_8x32x1_1x32x1x8_8_1x1_intrawave_v3,1228.08,658.92,0.0
256,10361,3072,3072,ck,0,0,158.4422,a8w8_blockscale_1x128x128_256x128x128x128_16x16_32x32_2x2_8x32x1_8x32x1_1x32x1x8_8_1x1_intrawave_v3,1234.25,662.22,0.0
256,10364,3072,3072,ck,0,0,159.4957,a8w8_blockscale_1x128x128_256x128x128x128_16x16_32x32_2x2_8x32x1_8x32x1_1x32x1x8_8_1x1_intrawave_v3,1226.45,658.02,0.0
256,10365,3072,3072,ck,0,0,156.6796,a8w8_blockscale_1x128x128_256x128x128x128_16x16_32x32_2x2_8x32x1_8x32x1_1x32x1x8_8_1x1_intrawave_v3,1248.62,669.91,0.0
256,10370,3072,3072,ck,0,0,158.4364,a8w8_blockscale_1x128x128_256x128x128x128_16x16_32x32_2x2_8x32x1_8x32x1_1x32x1x8_8_1x1_intrawave_v3,1235.37,662.77,0.0
256,10373,3072,3072,ck,0,0,155.9709,a8w8_blockscale_1x128x128_256x128x128x128_16x16_32x32_2x2_8x32x1_8x32x1_1x32x1x8_8_1x1_intrawave_v3,1255.26,673.43,0.0
256,10379,3072,3072,ck,0,0,159.5609,a8w8_blockscale_1x128x128_256x128x128x128_16x16_32x32_2x2_8x32x1_8x32x1_1x32x1x8_8_1x1_intrawave_v3,1227.73,658.62,0.0
256,10382,3072,3072,ck,0,0,158.0705,a8w8_blockscale_1x128x128_256x128x128x128_16x16_32x32_2x2_8x32x1_8x32x1_1x32x1x8_8_1x1_intrawave_v3,1239.66,665.01,0.0
256,10384,3072,3072,ck,0,0,160.1377,a8w8_blockscale_1x128x128_256x128x128x128_16x16_32x32_2x2_8x32x1_8x32x1_1x32x1x8_8_1x1_intrawave_v3,1223.89,656.54,0.0
256,10386,3072,3072,ck,0,0,159.51,a8w8_blockscale_1x128x128_256x128x128x128_16x16_32x32_2x2_8x32x1_8x32x1_1x32x1x8_8_1x1_intrawave_v3,1228.95,659.23,0.0
256,10389,3072,3072,ck,0,0,159.3621,a8w8_blockscale_1x128x128_256x128x128x128_16x16_32x32_2x2_8x32x1_8x32x1_1x32x1x8_8_1x1_intrawave_v3,1230.44,660.02,0.0
256,10391,3072,3072,ck,0,0,158.3981,a8w8_blockscale_1x128x128_256x128x128x128_16x16_32x32_2x2_8x32x1_8x32x1_1x32x1x8_8_1x1_intrawave_v3,1238.17,664.15,0.0
256,10392,3072,3072,ck,0,0,157.3416,a8w8_blockscale_1x128x128_256x128x128x128_16x16_32x32_2x2_8x32x1_8x32x1_1x32x1x8_8_1x1_intrawave_v3,1246.6,668.67,0.0
256,10393,3072,3072,ck,0,0,156.754,a8w8_blockscale_1x128x128_256x128x128x128_16x16_32x32_2x2_8x32x1_8x32x1_1x32x1x8_8_1x1_intrawave_v3,1251.4,671.24,0.0
256,10394,3072,3072,ck,0,0,155.9764,a8w8_blockscale_1x128x128_256x128x128x128_16x16_32x32_2x2_8x32x1_8x32x1_1x32x1x8_8_1x1_intrawave_v3,1257.76,674.64,0.0
256,10396,3072,6144,ck,0,0,288.1743,a8w8_blockscale_1x128x128_256x128x128x128_16x16_32x32_2x2_8x32x1_8x32x1_1x32x1x8_8_1x1_intrawave_v3,1361.8,508.79,0.0
256,10397,3072,6144,ck,0,0,287.8829,a8w8_blockscale_1x128x128_256x128x128x128_16x16_32x32_2x2_8x32x1_8x32x1_1x32x1x8_8_1x1_intrawave_v3,1363.31,509.35,0.0
256,10398,3072,6144,ck,0,0,287.8017,a8w8_blockscale_1x128x128_256x128x128x128_16x16_32x32_2x2_8x32x1_8x32x1_1x32x1x8_8_1x1_intrawave_v3,1363.83,509.53,0.0
256,10399,3072,6144,ck,0,0,285.6238,a8w8_blockscale_1x128x128_256x128x128x128_16x16_32x32_2x2_8x32x1_8x32x1_1x32x1x8_8_1x1_intrawave_v3,1374.36,513.46,0.0
256,10400,3072,6144,ck,0,0,284.7786,a8w8_blockscale_1x128x128_256x128x128x128_16x16_32x32_2x2_8x32x1_8x32x1_1x32x1x8_8_1x1_intrawave_v3,1378.57,515.03,0.0
256,10401,3072,3072,ck,0,0,157.9111,a8w8_blockscale_1x128x128_256x128x128x128_16x16_32x32_2x2_8x32x1_8x32x1_1x32x1x8_8_1x1_intrawave_v3,1243.18,666.79,0.0
256,10401,3072,6144,ck,0,0,290.589,a8w8_blockscale_1x128x128_256x128x128x128_16x16_32x32_2x2_8x32x1_8x32x1_1x32x1x8_8_1x1_intrawave_v3,1351.13,504.77,0.0
256,10404,3072,3072,ck,0,0,159.5224,a8w8_blockscale_1x128x128_256x128x128x128_16x16_32x32_2x2_8x32x1_8x32x1_1x32x1x8_8_1x1_intrawave_v3,1230.98,660.22,0.0
256,10408,3072,3072,ck,0,0,160.3629,a8w8_blockscale_1x128x128_256x128x128x128_16x16_32x32_2x2_8x32x1_8x32x1_1x32x1x8_8_1x1_intrawave_v3,1225.0,656.99,0.0
256,10410,3072,3072,ck,0,0,159.5372,a8w8_blockscale_1x128x128_256x128x128x128_16x16_32x32_2x2_8x32x1_8x32x1_1x32x1x8_8_1x1_intrawave_v3,1231.58,660.51,0.0
256,10413,3072,3072,ck,0,0,156.3016,a8w8_blockscale_1x128x128_256x128x128x128_16x16_32x32_2x2_8x32x1_8x32x1_1x32x1x8_8_1x1_intrawave_v3,1257.43,674.36,0.0
256,10416,3072,3072,ck,0,0,159.2504,a8w8_blockscale_1x128x128_256x128x128x128_16x16_32x32_2x2_8x32x1_8x32x1_1x32x1x8_8_1x1_intrawave_v3,1234.51,662.05,0.0
256,10418,3072,3072,ck,0,0,158.7124,a8w8_blockscale_1x128x128_256x128x128x128_16x16_32x32_2x2_8x32x1_8x32x1_1x32x1x8_8_1x1_intrawave_v3,1238.93,664.41,0.0
256,10419,3072,3072,ck,0,0,158.0684,a8w8_blockscale_1x128x128_256x128x128x128_16x16_32x32_2x2_8x32x1_8x32x1_1x32x1x8_8_1x1_intrawave_v3,1244.09,667.17,0.0
256,10420,3072,6144,ck,0,0,288.8849,a8w8_blockscale_1x128x128_256x128x128x128_16x16_32x32_2x2_8x32x1_8x32x1_1x32x1x8_8_1x1_intrawave_v3,1361.59,508.56,0.0
256,10421,3072,3072,ck,0,0,158.928,a8w8_blockscale_1x128x128_256x128x128x128_16x16_32x32_2x2_8x32x1_8x32x1_1x32x1x8_8_1x1_intrawave_v3,1237.6,663.68,0.0
256,10421,3072,6144,ck,0,0,288.6501,a8w8_blockscale_1x128x128_256x128x128x128_16x16_32x32_2x2_8x32x1_8x32x1_1x32x1x8_8_1x1_intrawave_v3,1362.83,509.02,0.0
256,10426,3072,3072,ck,0,0,158.4976,a8w8_blockscale_1x128x128_256x128x128x128_16x16_32x32_2x2_8x32x1_8x32x1_1x32x1x8_8_1x1_intrawave_v3,1241.56,665.77,0.0
256,10428,3072,3072,ck,0,0,157.0592,a8w8_blockscale_1x128x128_256x128x128x128_16x16_32x32_2x2_8x32x1_8x32x1_1x32x1x8_8_1x1_intrawave_v3,1253.17,671.99,0.0
256,10429,3072,3072,ck,0,0,158.164,a8w8_blockscale_1x128x128_256x128x128x128_16x16_32x32_2x2_8x32x1_8x32x1_1x32x1x8_8_1x1_intrawave_v3,1244.54,667.35,0.0
256,10430,3072,3072,ck,0,0,157.282,a8w8_blockscale_1x128x128_256x128x128x128_16x16_32x32_2x2_8x32x1_8x32x1_1x32x1x8_8_1x1_intrawave_v3,1251.64,671.15,0.0
256,10432,3072,3072,ck,0,0,156.6452,a8w8_blockscale_1x128x128_256x128x128x128_16x16_32x32_2x2_8x32x1_8x32x1_1x32x1x8_8_1x1_intrawave_v3,1256.96,674.0,0.0
256,10433,3072,3072,ck,0,0,158.02,a8w8_blockscale_1x128x128_256x128x128x128_16x16_32x32_2x2_8x32x1_8x32x1_1x32x1x8_8_1x1_intrawave_v3,1246.15,668.19,0.0
256,10439,3072,3072,ck,0,0,157.0988,a8w8_blockscale_1x128x128_256x128x128x128_16x16_32x32_2x2_8x32x1_8x32x1_1x32x1x8_8_1x1_intrawave_v3,1254.18,672.46,0.0
256,10440,3072,6144,ck,0,0,288.7527,a8w8_blockscale_1x128x128_256x128x128x128_16x16_32x32_2x2_8x32x1_8x32x1_1x32x1x8_8_1x1_intrawave_v3,1364.82,509.64,0.0
256,10442,3072,3072,ck,0,0,158.6928,a8w8_blockscale_1x128x128_256x128x128x128_16x16_32x32_2x2_8x32x1_8x32x1_1x32x1x8_8_1x1_intrawave_v3,1241.94,665.88,0.0
256,10442,3072,6144,ck,0,0,290.1983,a8w8_blockscale_1x128x128_256x128x128x128_16x16_32x32_2x2_8x32x1_8x32x1_1x32x1x8_8_1x1_intrawave_v3,1358.29,507.19,0.0
256,10444,3072,3072,ck,0,0,157.2066,a8w8_blockscale_1x128x128_256x128x128x128_16x16_32x32_2x2_8x32x1_8x32x1_1x32x1x8_8_1x1_intrawave_v3,1253.92,672.29,0.0
256,10444,3072,6144,ck,0,0,289.7038,a8w8_blockscale_1x128x128_256x128x128x128_16x16_32x32_2x2_8x32x1_8x32x1_1x32x1x8_8_1x1_intrawave_v3,1360.87,508.14,0.0
256,10446,3072,6144,ck,0,0,289.0325,a8w8_blockscale_1x128x128_256x128x128x128_16x16_32x32_2x2_8x32x1_8x32x1_1x32x1x8_8_1x1_intrawave_v3,1364.29,509.41,0.0
256,10449,3072,3072,ck,0,0,156.5021,a8w8_blockscale_1x128x128_256x128x128x128_16x16_32x32_2x2_8x32x1_8x32x1_1x32x1x8_8_1x1_intrawave_v3,1260.16,675.62,0.0
256,10453,3072,3072,ck,0,0,160.0576,a8w8_blockscale_1x128x128_256x128x128x128_16x16_32x32_2x2_8x32x1_8x32x1_1x32x1x8_8_1x1_intrawave_v3,1232.64,660.84,0.0
256,10456,3072,3072,ck,0,0,157.1655,a8w8_blockscale_1x128x128_256x128x128x128_16x16_32x32_2x2_8x32x1_8x32x1_1x32x1x8_8_1x1_intrawave_v3,1255.69,673.17,0.0
256,10460,3072,3072,ck,0,0,157.9679,a8w8_blockscale_1x128x128_256x128x128x128_16x16_32x32_2x2_8x32x1_8x32x1_1x32x1x8_8_1x1_intrawave_v3,1249.78,669.99,0.0
256,10461,3072,3072,ck,0,0,157.5676,a8w8_blockscale_1x128x128_256x128x128x128_16x16_32x32_2x2_8x32x1_8x32x1_1x32x1x8_8_1x1_intrawave_v3,1253.08,671.75,0.0
256,10462,3072,3072,ck,0,0,158.5927,a8w8_blockscale_1x128x128_256x128x128x128_16x16_32x32_2x2_8x32x1_8x32x1_1x32x1x8_8_1x1_intrawave_v3,1245.1,667.46,0.0
256,10463,3072,3072,ck,0,0,157.778,a8w8_blockscale_1x128x128_256x128x128x128_16x16_32x32_2x2_8x32x1_8x32x1_1x32x1x8_8_1x1_intrawave_v3,1251.65,670.97,0.0
256,10464,3072,3072,ck,0,0,156.8136,a8w8_blockscale_1x128x128_256x128x128x128_16x16_32x32_2x2_8x32x1_8x32x1_1x32x1x8_8_1x1_intrawave_v3,1259.47,675.15,0.0
256,10468,3072,3072,ck,0,0,158.3429,a8w8_blockscale_1x128x128_256x128x128x128_16x16_32x32_2x2_8x32x1_8x32x1_1x32x1x8_8_1x1_intrawave_v3,1247.78,668.87,0.0
256,10470,3072,3072,ck,0,0,159.2663,a8w8_blockscale_1x128x128_256x128x128x128_16x16_32x32_2x2_8x32x1_8x32x1_1x32x1x8_8_1x1_intrawave_v3,1240.78,665.1,0.0
256,10476,3072,3072,ck,0,0,157.4665,a8w8_blockscale_1x128x128_256x128x128x128_16x16_32x32_2x2_8x32x1_8x32x1_1x32x1x8_8_1x1_intrawave_v3,1255.68,673.06,0.0
256,10477,3072,3072,ck,0,0,157.3564,a8w8_blockscale_1x128x128_256x128x128x128_16x16_32x32_2x2_8x32x1_8x32x1_1x32x1x8_8_1x1_intrawave_v3,1256.68,673.59,0.0
256,10482,3072,3072,ck,0,0,157.5212,a8w8_blockscale_1x128x128_256x128x128x128_16x16_32x32_2x2_8x32x1_8x32x1_1x32x1x8_8_1x1_intrawave_v3,1255.97,673.17,0.0
256,10484,3072,3072,ck,0,0,158.1872,a8w8_blockscale_1x128x128_256x128x128x128_16x16_32x32_2x2_8x32x1_8x32x1_1x32x1x8_8_1x1_intrawave_v3,1250.92,670.46,0.0
256,10485,3072,3072,ck,0,0,157.2984,a8w8_blockscale_1x128x128_256x128x128x128_16x16_32x32_2x2_8x32x1_8x32x1_1x32x1x8_8_1x1_intrawave_v3,1258.1,674.3,0.0
256,10489,3072,3072,ck,0,0,159.1928,a8w8_blockscale_1x128x128_256x128x128x128_16x16_32x32_2x2_8x32x1_8x32x1_1x32x1x8_8_1x1_intrawave_v3,1243.61,666.51,0.0
256,10491,3072,3072,ck,0,0,155.9095,a8w8_blockscale_1x128x128_256x128x128x128_16x16_32x32_2x2_8x32x1_8x32x1_1x32x1x8_8_1x1_intrawave_v3,1270.04,680.67,0.0
256,10493,3072,3072,ck,0,0,159.4196,a8w8_blockscale_1x128x128_256x128x128x128_16x16_32x32_2x2_8x32x1_8x32x1_1x32x1x8_8_1x1_intrawave_v3,1242.31,665.79,0.0
256,10495,3072,3072,ck,0,0,159.1339,a8w8_blockscale_1x128x128_256x128x128x128_16x16_32x32_2x2_8x32x1_8x32x1_1x32x1x8_8_1x1_intrawave_v3,1244.78,667.11,0.0
256,10496,3072,3072,ck,0,0,155.6967,a8w8_blockscale_1x128x128_256x128x128x128_16x16_32x32_2x2_8x32x1_8x32x1_1x32x1x8_8_1x1_intrawave_v3,1272.38,681.89,0.0
256,10498,3072,3072,ck,0,0,158.0572,a8w8_blockscale_1x128x128_256x128x128x128_16x16_32x32_2x2_8x32x1_8x32x1_1x32x1x8_8_1x1_intrawave_v3,1253.62,671.82,0.0
256,10508,3072,3072,ck,0,0,158.5528,a8w8_blockscale_1x128x128_256x128x128x128_16x16_32x32_2x2_8x32x1_8x32x1_1x32x1x8_8_1x1_intrawave_v3,1250.89,670.31,0.0
256,10510,3072,3072,ck,0,0,160.4688,a8w8_blockscale_1x128x128_256x128x128x128_16x16_32x32_2x2_8x32x1_8x32x1_1x32x1x8_8_1x1_intrawave_v3,1236.19,662.42,0.0
256,10511,3072,3072,ck,0,0,160.0424,a8w8_blockscale_1x128x128_256x128x128x128_16x16_32x32_2x2_8x32x1_8x32x1_1x32x1x8_8_1x1_intrawave_v3,1239.6,664.24,0.0
256,10512,3072,3072,ck,0,0,158.688,a8w8_blockscale_1x128x128_256x128x128x128_16x16_32x32_2x2_8x32x1_8x32x1_1x32x1x8_8_1x1_intrawave_v3,1250.3,669.97,0.0
256,10514,3072,3072,ck,0,0,160.612,a8w8_blockscale_1x128x128_256x128x128x128_16x16_32x32_2x2_8x32x1_8x32x1_1x32x1x8_8_1x1_intrawave_v3,1235.56,662.06,0.0
256,10515,3072,3072,ck,0,0,158.1907,a8w8_blockscale_1x128x128_256x128x128x128_16x16_32x32_2x2_8x32x1_8x32x1_1x32x1x8_8_1x1_intrawave_v3,1254.59,672.25,0.0
256,10516,3072,3072,ck,0,0,158.4351,a8w8_blockscale_1x128x128_256x128x128x128_16x16_32x32_2x2_8x32x1_8x32x1_1x32x1x8_8_1x1_intrawave_v3,1252.77,671.27,0.0
256,10517,3072,3072,ck,0,0,159.8519,a8w8_blockscale_1x128x128_256x128x128x128_16x16_32x32_2x2_8x32x1_8x32x1_1x32x1x8_8_1x1_intrawave_v3,1241.79,665.38,0.0
256,10519,3072,3072,ck,0,0,157.8063,a8w8_blockscale_1x128x128_256x128x128x128_16x16_32x32_2x2_8x32x1_8x32x1_1x32x1x8_8_1x1_intrawave_v3,1258.12,674.12,0.0
256,10524,3072,3072,ck,0,0,157.7977,a8w8_blockscale_1x128x128_256x128x128x128_16x16_32x32_2x2_8x32x1_8x32x1_1x32x1x8_8_1x1_intrawave_v3,1258.79,674.45,0.0
256,10525,3072,3072,ck,0,0,159.5154,a8w8_blockscale_1x128x128_256x128x128x128_16x16_32x32_2x2_8x32x1_8x32x1_1x32x1x8_8_1x1_intrawave_v3,1245.35,667.24,0.0
256,10532,3072,3072,ck,0,0,159.2239,a8w8_blockscale_1x128x128_256x128x128x128_16x16_32x32_2x2_8x32x1_8x32x1_1x32x1x8_8_1x1_intrawave_v3,1248.46,668.87,0.0
256,10534,3072,3072,ck,0,0,159.2031,a8w8_blockscale_1x128x128_256x128x128x128_16x16_32x32_2x2_8x32x1_8x32x1_1x32x1x8_8_1x1_intrawave_v3,1248.86,669.07,0.0
256,10544,3072,3072,ck,0,0,158.8899,a8w8_blockscale_1x128x128_256x128x128x128_16x16_32x32_2x2_8x32x1_8x32x1_1x32x1x8_8_1x1_intrawave_v3,1252.51,670.97,0.0
256,10545,3072,3072,ck,0,0,157.9147,a8w8_blockscale_1x128x128_256x128x128x128_16x16_32x32_2x2_8x32x1_8x32x1_1x32x1x8_8_1x1_intrawave_v3,1260.37,675.17,0.0
256,10547,3072,3072,ck,0,0,160.1923,a8w8_blockscale_1x128x128_256x128x128x128_16x16_32x32_2x2_8x32x1_8x32x1_1x32x1x8_8_1x1_intrawave_v3,1242.68,665.69,0.0
256,10549,3072,3072,ck,0,0,160.7747,a8w8_blockscale_1x128x128_256x128x128x128_16x16_32x32_2x2_8x32x1_8x32x1_1x32x1x8_8_1x1_intrawave_v3,1238.41,663.39,0.0
256,10550,3072,3072,ck,0,0,158.7531,a8w8_blockscale_1x128x128_256x128x128x128_16x16_32x32_2x2_8x32x1_8x32x1_1x32x1x8_8_1x1_intrawave_v3,1254.3,671.9,0.0
256,10551,3072,3072,ck,0,0,159.4163,a8w8_blockscale_1x128x128_256x128x128x128_16x16_32x32_2x2_8x32x1_8x32x1_1x32x1x8_8_1x1_intrawave_v3,1249.2,669.16,0.0
256,10552,3072,3072,ck,0,0,157.3767,a8w8_blockscale_1x128x128_256x128x128x128_16x16_32x32_2x2_8x32x1_8x32x1_1x32x1x8_8_1x1_intrawave_v3,1265.51,677.89,0.0
256,10558,3072,3072,ck,0,0,159.1262,a8w8_blockscale_1x128x128_256x128x128x128_16x16_32x32_2x2_8x32x1_8x32x1_1x32x1x8_8_1x1_intrawave_v3,1252.31,670.79,0.0
256,10559,3072,3072,ck,0,0,159.3292,a8w8_blockscale_1x128x128_256x128x128x128_16x16_32x32_2x2_8x32x1_8x32x1_1x32x1x8_8_1x1_intrawave_v3,1250.83,669.99,0.0
256,10560,3072,3072,ck,0,0,159.0956,a8w8_blockscale_1x128x128_256x128x128x128_16x16_32x32_2x2_8x32x1_8x32x1_1x32x1x8_8_1x1_intrawave_v3,1252.79,671.03,0.0
256,10571,3072,3072,ck,0,0,160.584,a8w8_blockscale_1x128x128_256x128x128x128_16x16_32x32_2x2_8x32x1_8x32x1_1x32x1x8_8_1x1_intrawave_v3,1242.47,665.44,0.0
256,10574,3072,3072,ck,0,0,160.4944,a8w8_blockscale_1x128x128_256x128x128x128_16x16_32x32_2x2_8x32x1_8x32x1_1x32x1x8_8_1x1_intrawave_v3,1243.52,665.99,0.0
256,10575,3072,3072,ck,0,0,158.4108,a8w8_blockscale_1x128x128_256x128x128x128_16x16_32x32_2x2_8x32x1_8x32x1_1x32x1x8_8_1x1_intrawave_v3,1259.99,674.8,0.0
256,10576,3072,3072,ck,0,0,160.3744,a8w8_blockscale_1x128x128_256x128x128x128_16x16_32x32_2x2_8x32x1_8x32x1_1x32x1x8_8_1x1_intrawave_v3,1244.68,666.6,0.0
256,10578,3072,3072,ck,0,0,158.3003,a8w8_blockscale_1x128x128_256x128x128x128_16x16_32x32_2x2_8x32x1_8x32x1_1x32x1x8_8_1x1_intrawave_v3,1261.23,675.45,0.0
256,10579,3072,3072,ck,0,0,156.292,a8w8_blockscale_1x128x128_256x128x128x128_16x16_32x32_2x2_8x32x1_8x32x1_1x32x1x8_8_1x1_intrawave_v3,1277.56,684.19,0.0
256,10580,3072,3072,ck,0,0,157.8279,a8w8_blockscale_1x128x128_256x128x128x128_16x16_32x32_2x2_8x32x1_8x32x1_1x32x1x8_8_1x1_intrawave_v3,1265.24,677.59,0.0
256,10586,3072,3072,ck,0,0,160.2107,a8w8_blockscale_1x128x128_256x128x128x128_16x16_32x32_2x2_8x32x1_8x32x1_1x32x1x8_8_1x1_intrawave_v3,1247.13,667.86,0.0
256,10588,3072,3072,ck,0,0,158.0679,a8w8_blockscale_1x128x128_256x128x128x128_16x16_32x32_2x2_8x32x1_8x32x1_1x32x1x8_8_1x1_intrawave_v3,1264.28,677.03,0.0
256,10591,3072,3072,ck,0,0,161.0132,a8w8_blockscale_1x128x128_256x128x128x128_16x16_32x32_2x2_8x32x1_8x32x1_1x32x1x8_8_1x1_intrawave_v3,1241.5,664.81,0.0
256,10592,3072,3072,ck,0,0,157.7307,a8w8_blockscale_1x128x128_256x128x128x128_16x16_32x32_2x2_8x32x1_8x32x1_1x32x1x8_8_1x1_intrawave_v3,1267.46,678.71,0.0
256,10595,3072,3072,ck,0,0,159.6719,a8w8_blockscale_1x128x128_256x128x128x128_16x16_32x32_2x2_8x32x1_8x32x1_1x32x1x8_8_1x1_intrawave_v3,1252.41,670.63,0.0
256,10605,3072,3072,ck,0,0,159.7087,a8w8_blockscale_1x128x128_256x128x128x128_16x16_32x32_2x2_8x32x1_8x32x1_1x32x1x8_8_1x1_intrawave_v3,1253.3,671.05,0.0
256,10609,3072,3072,ck,0,0,160.4527,a8w8_blockscale_1x128x128_256x128x128x128_16x16_32x32_2x2_8x32x1_8x32x1_1x32x1x8_8_1x1_intrawave_v3,1247.96,668.17,0.0
256,10610,3072,3072,ck,0,0,159.1331,a8w8_blockscale_1x128x128_256x128x128x128_16x16_32x32_2x2_8x32x1_8x32x1_1x32x1x8_8_1x1_intrawave_v3,1258.42,673.77,0.0
256,10612,3072,3072,ck,0,0,159.3391,a8w8_blockscale_1x128x128_256x128x128x128_16x16_32x32_2x2_8x32x1_8x32x1_1x32x1x8_8_1x1_intrawave_v3,1257.03,673.01,0.0
256,10613,3072,3072,ck,0,0,160.8063,a8w8_blockscale_1x128x128_256x128x128x128_16x16_32x32_2x2_8x32x1_8x32x1_1x32x1x8_8_1x1_intrawave_v3,1245.68,666.93,0.0
256,10635,3072,3072,ck,0,0,161.0427,a8w8_blockscale_1x128x128_256x128x128x128_16x16_32x32_2x2_8x32x1_8x32x1_1x32x1x8_8_1x1_intrawave_v3,1246.43,667.21,0.0
256,10637,3072,3072,ck,0,0,157.2958,a8w8_blockscale_1x128x128_256x128x128x128_16x16_32x32_2x2_8x32x1_8x32x1_1x32x1x8_8_1x1_intrawave_v3,1276.36,683.22,0.0
256,10642,3072,3072,ck,0,0,160.2135,a8w8_blockscale_1x128x128_256x128x128x128_16x16_32x32_2x2_8x32x1_8x32x1_1x32x1x8_8_1x1_intrawave_v3,1253.71,671.07,0.0
256,10643,3072,3072,ck,0,0,157.8297,a8w8_blockscale_1x128x128_256x128x128x128_16x16_32x32_2x2_8x32x1_8x32x1_1x32x1x8_8_1x1_intrawave_v3,1272.76,681.26,0.0
256,10654,3072,3072,ck,0,0,161.0631,a8w8_blockscale_1x128x128_256x128x128x128_16x16_32x32_2x2_8x32x1_8x32x1_1x32x1x8_8_1x1_intrawave_v3,1248.5,668.21,0.0
256,10656,3072,3072,ck,0,0,157.0283,a8w8_blockscale_1x128x128_256x128x128x128_16x16_32x32_2x2_8x32x1_8x32x1_1x32x1x8_8_1x1_intrawave_v3,1280.82,685.5,0.0
256,10657,3072,3072,ck,0,0,158.6379,a8w8_blockscale_1x128x128_256x128x128x128_16x16_32x32_2x2_8x32x1_8x32x1_1x32x1x8_8_1x1_intrawave_v3,1267.95,678.6,0.0
256,10669,3072,3072,ck,0,0,158.8966,a8w8_blockscale_1x128x128_256x128x128x128_16x16_32x32_2x2_8x32x1_8x32x1_1x32x1x8_8_1x1_intrawave_v3,1267.31,678.19,0.0
256,10670,3072,3072,ck,0,0,157.2086,a8w8_blockscale_1x128x128_256x128x128x128_16x16_32x32_2x2_8x32x1_8x32x1_1x32x1x8_8_1x1_intrawave_v3,1281.03,685.53,0.0
256,10672,3072,3072,ck,0,0,161.0895,a8w8_blockscale_1x128x128_256x128x128x128_16x16_32x32_2x2_8x32x1_8x32x1_1x32x1x8_8_1x1_intrawave_v3,1250.41,669.13,0.0
256,10675,3072,3072,ck,0,0,157.3352,a8w8_blockscale_1x128x128_256x128x128x128_16x16_32x32_2x2_8x32x1_8x32x1_1x32x1x8_8_1x1_intrawave_v3,1280.6,685.28,0.0
256,10678,3072,3072,ck,0,0,160.2931,a8w8_blockscale_1x128x128_256x128x128x128_16x16_32x32_2x2_8x32x1_8x32x1_1x32x1x8_8_1x1_intrawave_v3,1257.32,672.8,0.0
256,10681,3072,3072,ck,0,0,159.6917,a8w8_blockscale_1x128x128_256x128x128x128_16x16_32x32_2x2_8x32x1_8x32x1_1x32x1x8_8_1x1_intrawave_v3,1262.41,675.51,0.0
256,10691,3072,3072,ck,0,0,159.0487,a8w8_blockscale_1x128x128_256x128x128x128_16x16_32x32_2x2_8x32x1_8x32x1_1x32x1x8_8_1x1_intrawave_v3,1268.7,678.82,0.0
256,10702,3072,3072,ck,0,0,161.0447,a8w8_blockscale_1x128x128_256x128x128x128_16x16_32x32_2x2_8x32x1_8x32x1_1x32x1x8_8_1x1_intrawave_v3,1254.27,671.04,0.0
256,10703,3072,3072,ck,0,0,158.0182,a8w8_blockscale_1x128x128_256x128x128x128_16x16_32x32_2x2_8x32x1_8x32x1_1x32x1x8_8_1x1_intrawave_v3,1278.41,683.95,0.0
256,10716,3072,3072,ck,0,0,159.0494,a8w8_blockscale_1x128x128_256x128x128x128_16x16_32x32_2x2_8x32x1_8x32x1_1x32x1x8_8_1x1_intrawave_v3,1271.67,680.27,0.0
256,10742,3072,3072,ck,0,0,159.7599,a8w8_blockscale_1x128x128_256x128x128x128_16x16_32x32_2x2_8x32x1_8x32x1_1x32x1x8_8_1x1_intrawave_v3,1269.08,678.74,0.0
256,10749,3072,3072,ck,0,0,158.9435,a8w8_blockscale_1x128x128_256x128x128x128_16x16_32x32_2x2_8x32x1_8x32x1_1x32x1x8_8_1x1_intrawave_v3,1276.43,682.63,0.0
256,10751,3072,3072,ck,0,0,159.9103,a8w8_blockscale_1x128x128_256x128x128x128_16x16_32x32_2x2_8x32x1_8x32x1_1x32x1x8_8_1x1_intrawave_v3,1268.95,678.62,0.0
256,10752,3072,3072,ck,0,0,160.5047,a8w8_blockscale_1x128x128_256x128x128x128_16x16_32x32_2x2_8x32x1_8x32x1_1x32x1x8_8_1x1_intrawave_v3,1264.37,676.16,0.0
256,10754,3072,3072,ck,0,0,160.2235,a8w8_blockscale_1x128x128_256x128x128x128_16x16_32x32_2x2_8x32x1_8x32x1_1x32x1x8_8_1x1_intrawave_v3,1266.82,677.47,0.0
256,10755,3072,3072,ck,0,0,158.8495,a8w8_blockscale_1x128x128_256x128x128x128_16x16_32x32_2x2_8x32x1_8x32x1_1x32x1x8_8_1x1_intrawave_v3,1277.9,683.38,0.0
256,10756,3072,3072,ck,0,0,159.6222,a8w8_blockscale_1x128x128_256x128x128x128_16x16_32x32_2x2_8x32x1_8x32x1_1x32x1x8_8_1x1_intrawave_v3,1271.83,680.13,0.0
256,10759,3072,3072,ck,0,0,162.7086,a8w8_blockscale_1x128x128_256x128x128x128_16x16_32x32_2x2_8x32x1_8x32x1_1x32x1x8_8_1x1_intrawave_v3,1248.06,667.4,0.0
256,10760,3072,3072,ck,0,0,160.3337,a8w8_blockscale_1x128x128_256x128x128x128_16x16_32x32_2x2_8x32x1_8x32x1_1x32x1x8_8_1x1_intrawave_v3,1266.66,677.35,0.0
256,10793,3072,3072,ck,0,0,162.2699,a8w8_blockscale_1x128x128_256x128x128x128_16x16_32x32_2x2_8x32x1_8x32x1_1x32x1x8_8_1x1_intrawave_v3,1255.38,671.14,0.0
256,10803,3072,6144,ck,0,0,299.9134,a8w8_blockscale_1x128x128_256x128x128x128_16x16_32x32_2x2_8x32x1_8x32x1_1x32x1x8_8_1x1_intrawave_v3,1359.72,505.55,0.0
256,10806,3072,6144,ck,0,0,298.9038,a8w8_blockscale_1x128x128_256x128x128x128_16x16_32x32_2x2_8x32x1_8x32x1_1x32x1x8_8_1x1_intrawave_v3,1364.7,507.38,0.0
256,10808,3072,6144,ck,0,0,299.929,a8w8_blockscale_1x128x128_256x128x128x128_16x16_32x32_2x2_8x32x1_8x32x1_1x32x1x8_8_1x1_intrawave_v3,1360.28,505.73,0.0
256,10813,3072,3072,ck,0,0,159.4839,a8w8_blockscale_1x128x128_256x128x128x128_16x16_32x32_2x2_8x32x1_8x32x1_1x32x1x8_8_1x1_intrawave_v3,1279.68,684.02,0.0
256,10821,3072,3072,ck,0,0,162.0615,a8w8_blockscale_1x128x128_256x128x128x128_16x16_32x32_2x2_8x32x1_8x32x1_1x32x1x8_8_1x1_intrawave_v3,1260.26,673.59,0.0
256,10828,3072,3072,ck,0,0,160.7847,a8w8_blockscale_1x128x128_256x128x128x128_16x16_32x32_2x2_8x32x1_8x32x1_1x32x1x8_8_1x1_intrawave_v3,1271.09,679.34,0.0
256,10840,3072,3072,ck,0,0,160.4219,a8w8_blockscale_1x128x128_256x128x128x128_16x16_32x32_2x2_8x32x1_8x32x1_1x32x1x8_8_1x1_intrawave_v3,1275.38,681.57,0.0
256,10841,3072,3072,ck,0,0,161.0578,a8w8_blockscale_1x128x128_256x128x128x128_16x16_32x32_2x2_8x32x1_8x32x1_1x32x1x8_8_1x1_intrawave_v3,1270.46,678.94,0.0
256,10843,3072,3072,ck,0,0,160.194,a8w8_blockscale_1x128x128_256x128x128x128_16x16_32x32_2x2_8x32x1_8x32x1_1x32x1x8_8_1x1_intrawave_v3,1277.54,682.71,0.0
256,10844,3072,6144,ck,0,0,302.0209,a8w8_blockscale_1x128x128_256x128x128x128_16x16_32x32_2x2_8x32x1_8x32x1_1x32x1x8_8_1x1_intrawave_v3,1355.36,503.69,0.0
256,10845,3072,6144,ck,0,0,298.966,a8w8_blockscale_1x128x128_256x128x128x128_16x16_32x32_2x2_8x32x1_8x32x1_1x32x1x8_8_1x1_intrawave_v3,1369.34,508.88,0.0
256,10846,3072,6144,ck,0,0,299.4151,a8w8_blockscale_1x128x128_256x128x128x128_16x16_32x32_2x2_8x32x1_8x32x1_1x32x1x8_8_1x1_intrawave_v3,1367.41,508.16,0.0
256,10885,3072,3072,ck,0,0,169.495,a8w8_blockscale_1x128x128_256x128x128x128_16x16_32x32_2x2_8x32x1_8x32x1_1x32x1x8_8_1x1_intrawave_v3,1212.12,647.53,0.0
256,10902,3072,3072,ck,0,0,172.7424,a8w8_blockscale_1x128x128_256x128x128x128_16x16_32x32_2x2_8x32x1_8x32x1_1x32x1x8_8_1x1_intrawave_v3,1191.19,636.27,0.0
256,10905,3072,3072,ck,0,0,168.9899,a8w8_blockscale_1x128x128_256x128x128x128_16x16_32x32_2x2_8x32x1_8x32x1_1x32x1x8_8_1x1_intrawave_v3,1217.97,650.56,0.0
256,10906,3072,3072,ck,0,0,168.6147,a8w8_blockscale_1x128x128_256x128x128x128_16x16_32x32_2x2_8x32x1_8x32x1_1x32x1x8_8_1x1_intrawave_v3,1220.79,652.06,0.0
256,10908,3072,3072,ck,0,0,169.7763,a8w8_blockscale_1x128x128_256x128x128x128_16x16_32x32_2x2_8x32x1_8x32x1_1x32x1x8_8_1x1_intrawave_v3,1212.66,647.71,0.0
256,10924,3072,3072,ck,0,0,169.6821,a8w8_blockscale_1x128x128_256x128x128x128_16x16_32x32_2x2_8x32x1_8x32x1_1x32x1x8_8_1x1_intrawave_v3,1215.12,648.94,0.0
256,10925,3072,3072,ck,0,0,169.2079,a8w8_blockscale_1x128x128_256x128x128x128_16x16_32x32_2x2_8x32x1_8x32x1_1x32x1x8_8_1x1_intrawave_v3,1218.63,650.81,0.0
256,10926,3072,3072,ck,0,0,166.3415,a8w8_blockscale_1x128x128_256x128x128x128_16x16_32x32_2x2_8x32x1_8x32x1_1x32x1x8_8_1x1_intrawave_v3,1239.75,662.08,0.0
256,10927,3072,3072,ck,0,0,169.2283,a8w8_blockscale_1x128x128_256x128x128x128_16x16_32x32_2x2_8x32x1_8x32x1_1x32x1x8_8_1x1_intrawave_v3,1218.71,650.84,0.0
256,10928,3072,3072,ck,0,0,167.8895,a8w8_blockscale_1x128x128_256x128x128x128_16x16_32x32_2x2_8x32x1_8x32x1_1x32x1x8_8_1x1_intrawave_v3,1228.54,656.08,0.0
256,10929,3072,3072,ck,0,0,169.0299,a8w8_blockscale_1x128x128_256x128x128x128_16x16_32x32_2x2_8x32x1_8x32x1_1x32x1x8_8_1x1_intrawave_v3,1220.36,651.71,0.0
256,10956,3072,3072,ck,0,0,169.5187,a8w8_blockscale_1x128x128_256x128x128x128_16x16_32x32_2x2_8x32x1_8x32x1_1x32x1x8_8_1x1_intrawave_v3,1219.85,651.3,0.0
256,10961,3072,6144,ck,0,0,315.1063,a8w8_blockscale_1x128x128_256x128x128x128_16x16_32x32_2x2_8x32x1_8x32x1_1x32x1x8_8_1x1_intrawave_v3,1313.09,487.34,0.0
256,10962,3072,6144,ck,0,0,307.1466,a8w8_blockscale_1x128x128_256x128x128x128_16x16_32x32_2x2_8x32x1_8x32x1_1x32x1x8_8_1x1_intrawave_v3,1347.24,500.01,0.0
256,10963,3072,6144,ck,0,0,306.9702,a8w8_blockscale_1x128x128_256x128x128x128_16x16_32x32_2x2_8x32x1_8x32x1_1x32x1x8_8_1x1_intrawave_v3,1348.14,500.33,0.0
256,10992,3072,3072,ck,0,0,170.9171,a8w8_blockscale_1x128x128_256x128x128x128_16x16_32x32_2x2_8x32x1_8x32x1_1x32x1x8_8_1x1_intrawave_v3,1213.85,647.91,0.0
256,10997,3072,3072,ck,0,0,169.2491,a8w8_blockscale_1x128x128_256x128x128x128_16x16_32x32_2x2_8x32x1_8x32x1_1x32x1x8_8_1x1_intrawave_v3,1226.37,654.57,0.0
256,11001,3072,3072,ck,0,0,168.8599,a8w8_blockscale_1x128x128_256x128x128x128_16x16_32x32_2x2_8x32x1_8x32x1_1x32x1x8_8_1x1_intrawave_v3,1229.64,656.3,0.0
256,11004,3072,3072,ck,0,0,170.7459,a8w8_blockscale_1x128x128_256x128x128x128_16x16_32x32_2x2_8x32x1_8x32x1_1x32x1x8_8_1x1_intrawave_v3,1216.39,649.21,0.0
256,11005,3072,3072,ck,0,0,171.0775,a8w8_blockscale_1x128x128_256x128x128x128_16x16_32x32_2x2_8x32x1_8x32x1_1x32x1x8_8_1x1_intrawave_v3,1214.14,648.01,0.0
256,11009,3072,3072,ck,0,0,172.0575,a8w8_blockscale_1x128x128_256x128x128x128_16x16_32x32_2x2_8x32x1_8x32x1_1x32x1x8_8_1x1_intrawave_v3,1207.67,644.53,0.0
256,11010,3072,3072,ck,0,0,169.793,a8w8_blockscale_1x128x128_256x128x128x128_16x16_32x32_2x2_8x32x1_8x32x1_1x32x1x8_8_1x1_intrawave_v3,1223.88,653.18,0.0
256,11011,3072,3072,ck,0,0,169.8823,a8w8_blockscale_1x128x128_256x128x128x128_16x16_32x32_2x2_8x32x1_8x32x1_1x32x1x8_8_1x1_intrawave_v3,1223.35,652.89,0.0
256,11012,3072,3072,ck,0,0,169.8639,a8w8_blockscale_1x128x128_256x128x128x128_16x16_32x32_2x2_8x32x1_8x32x1_1x32x1x8_8_1x1_intrawave_v3,1223.59,653.02,0.0
256,11014,3072,3072,ck,0,0,169.7637,a8w8_blockscale_1x128x128_256x128x128x128_16x16_32x32_2x2_8x32x1_8x32x1_1x32x1x8_8_1x1_intrawave_v3,1224.54,653.51,0.0
256,11015,3072,3072,ck,0,0,169.5396,a8w8_blockscale_1x128x128_256x128x128x128_16x16_32x32_2x2_8x32x1_8x32x1_1x32x1x8_8_1x1_intrawave_v3,1226.27,654.43,0.0
256,11021,3072,3072,ck,0,0,170.4031,a8w8_blockscale_1x128x128_256x128x128x128_16x16_32x32_2x2_8x32x1_8x32x1_1x32x1x8_8_1x1_intrawave_v3,1220.72,651.44,0.0
256,11023,3072,3072,ck,0,0,169.1375,a8w8_blockscale_1x128x128_256x128x128x128_16x16_32x32_2x2_8x32x1_8x32x1_1x32x1x8_8_1x1_intrawave_v3,1230.08,656.42,0.0
256,11035,3072,3072,ck,0,0,173.0355,a8w8_blockscale_1x128x128_256x128x128x128_16x16_32x32_2x2_8x32x1_8x32x1_1x32x1x8_8_1x1_intrawave_v3,1203.68,642.27,0.0
256,11074,3072,3072,ck,0,0,172.8171,a8w8_blockscale_1x128x128_256x128x128x128_16x16_32x32_2x2_8x32x1_8x32x1_1x32x1x8_8_1x1_intrawave_v3,1209.46,645.16,0.0
256,11080,3072,3072,ck,0,0,172.2435,a8w8_blockscale_1x128x128_256x128x128x128_16x16_32x32_2x2_8x32x1_8x32x1_1x32x1x8_8_1x1_intrawave_v3,1214.14,647.63,0.0
256,11119,3072,3072,ck,0,0,173.5943,a8w8_blockscale_1x128x128_256x128x128x128_16x16_32x32_2x2_8x32x1_8x32x1_1x32x1x8_8_1x1_intrawave_v3,1208.93,644.66,0.0
256,11123,3072,3072,ck,0,0,171.1795,a8w8_blockscale_1x128x128_256x128x128x128_16x16_32x32_2x2_8x32x1_8x32x1_1x32x1x8_8_1x1_intrawave_v3,1226.43,653.97,0.0
256,11126,3072,3072,ck,0,0,170.4135,a8w8_blockscale_1x128x128_256x128x128x128_16x16_32x32_2x2_8x32x1_8x32x1_1x32x1x8_8_1x1_intrawave_v3,1232.27,657.07,0.0
256,11668,3072,3072,ck,0,0,176.3043,a8w8_blockscale_1x128x128_256x128x128x128_16x16_32x32_2x2_8x32x1_8x32x1_1x32x1x8_8_1x1_intrawave_v3,1249.13,663.45,0.0
256,11818,3072,3072,ck,0,0,177.9432,a8w8_blockscale_1x128x128_256x128x128x128_16x16_32x32_2x2_8x32x1_8x32x1_1x32x1x8_8_1x1_intrawave_v3,1253.53,665.11,0.0
256,12002,3072,3072,ck,0,0,177.402,a8w8_blockscale_1x128x128_256x128x128x128_16x16_32x32_2x2_8x32x1_8x32x1_1x32x1x8_8_1x1_intrawave_v3,1276.93,676.7,0.0
256,12004,3072,3072,ck,0,0,179.7559,a8w8_blockscale_1x128x128_256x128x128x128_16x16_32x32_2x2_8x32x1_8x32x1_1x32x1x8_8_1x1_intrawave_v3,1260.42,667.94,0.0
256,12020,3072,3072,ck,0,0,180.6879,a8w8_blockscale_1x128x128_256x128x128x128_16x16_32x32_2x2_8x32x1_8x32x1_1x32x1x8_8_1x1_intrawave_v3,1255.59,665.31,0.0
256,12022,3072,3072,ck,0,0,176.1651,a8w8_blockscale_1x128x128_256x128x128x128_16x16_32x32_2x2_8x32x1_8x32x1_1x32x1x8_8_1x1_intrawave_v3,1288.04,682.5,0.0
256,12023,3072,3072,ck,0,0,176.4603,a8w8_blockscale_1x128x128_256x128x128x128_16x16_32x32_2x2_8x32x1_8x32x1_1x32x1x8_8_1x1_intrawave_v3,1285.99,681.41,0.0
256,12108,3072,3072,ck,0,0,176.492,a8w8_blockscale_1x128x128_256x128x128x128_16x16_32x32_2x2_8x32x1_8x32x1_1x32x1x8_8_1x1_intrawave_v3,1294.85,685.72,0.0
256,12159,3072,3072,ck,0,0,180.8122,a8w8_blockscale_1x128x128_256x128x128x128_16x16_32x32_2x2_8x32x1_8x32x1_1x32x1x8_8_1x1_intrawave_v3,1269.24,671.94,0.0
256,12163,3072,3072,ck,0,0,176.3251,a8w8_blockscale_1x128x128_256x128x128x128_16x16_32x32_2x2_8x32x1_8x32x1_1x32x1x8_8_1x1_intrawave_v3,1301.96,689.25,0.0
256,12288,3072,3072,ck,0,0,176.6407,a8w8_blockscale_1x128x128_256x128x128x128_16x16_32x32_2x2_8x32x1_8x32x1_1x32x1x8_8_1x1_intrawave_v3,1312.99,694.54,0.0
256,12615,3072,3072,ck,0,0,190.2924,a8w8_blockscale_1x128x128_256x128x128x128_16x16_32x32_2x2_8x32x1_8x32x1_1x32x1x8_8_1x1_intrawave_v3,1251.23,660.55,0.0
256,12684,3072,3072,ck,0,0,190.7772,a8w8_blockscale_1x128x128_256x128x128x128_16x16_32x32_2x2_8x32x1_8x32x1_1x32x1x8_8_1x1_intrawave_v3,1254.88,662.2,0.0
256,13001,3072,6144,ck,0,0,352.1791,a8w8_blockscale_1x128x128_256x128x128x128_16x16_32x32_2x2_8x32x1_8x32x1_1x32x1x8_8_1x1_intrawave_v3,1393.53,507.22,0.0
256,13003,3072,6144,ck,0,0,350.3768,a8w8_blockscale_1x128x128_256x128x128x128_16x16_32x32_2x2_8x32x1_8x32x1_1x32x1x8_8_1x1_intrawave_v3,1400.91,509.89,0.0
256,13051,3072,6144,ck,0,0,350.0718,a8w8_blockscale_1x128x128_256x128x128x128_16x16_32x32_2x2_8x32x1_8x32x1_1x32x1x8_8_1x1_intrawave_v3,1407.31,512.02,0.0
256,13117,3072,3072,ck,0,0,190.0991,a8w8_blockscale_1x128x128_256x128x128x128_16x16_32x32_2x2_8x32x1_8x32x1_1x32x1x8_8_1x1_intrawave_v3,1302.35,685.56,0.0
256,13199,3072,3072,ck,0,0,195.9568,a8w8_blockscale_1x128x128_256x128x128x128_16x16_32x32_2x2_8x32x1_8x32x1_1x32x1x8_8_1x1_intrawave_v3,1271.31,668.92,0.0
256,13517,3072,6144,ck,0,0,359.8771,a8w8_blockscale_1x128x128_256x128x128x128_16x16_32x32_2x2_8x32x1_8x32x1_1x32x1x8_8_1x1_intrawave_v3,1417.84,513.98,0.0
256,13534,3072,6144,ck,0,0,355.4177,a8w8_blockscale_1x128x128_256x128x128x128_16x16_32x32_2x2_8x32x1_8x32x1_1x32x1x8_8_1x1_intrawave_v3,1437.44,521.02,0.0
256,13563,3072,3072,ck,0,0,197.7592,a8w8_blockscale_1x128x128_256x128x128x128_16x16_32x32_2x2_8x32x1_8x32x1_1x32x1x8_8_1x1_intrawave_v3,1294.47,679.79,0.0
256,13656,3072,6144,ck,0,0,378.721,a8w8_blockscale_1x128x128_256x128x128x128_16x16_32x32_2x2_8x32x1_8x32x1_1x32x1x8_8_1x1_intrawave_v3,1361.15,492.92,0.0
256,13672,3072,6144,ck,0,0,377.6671,a8w8_blockscale_1x128x128_256x128x128x128_16x16_32x32_2x2_8x32x1_8x32x1_1x32x1x8_8_1x1_intrawave_v3,1366.55,494.82,0.0
256,13674,3072,6144,ck,0,0,368.2805,a8w8_blockscale_1x128x128_256x128x128x128_16x16_32x32_2x2_8x32x1_8x32x1_1x32x1x8_8_1x1_intrawave_v3,1401.58,507.49,0.0
256,13799,3072,6144,ck,0,0,366.5405,a8w8_blockscale_1x128x128_256x128x128x128_16x16_32x32_2x2_8x32x1_8x32x1_1x32x1x8_8_1x1_intrawave_v3,1421.11,514.09,0.0
256,13852,3072,6144,ck,0,0,379.8794,a8w8_blockscale_1x128x128_256x128x128x128_16x16_32x32_2x2_8x32x1_8x32x1_1x32x1x8_8_1x1_intrawave_v3,1376.48,497.76,0.0
256,13872,3072,6144,ck,0,0,378.6986,a8w8_blockscale_1x128x128_256x128x128x128_16x16_32x32_2x2_8x32x1_8x32x1_1x32x1x8_8_1x1_intrawave_v3,1382.76,499.96,0.0
256,13903,3072,6144,ck,0,0,379.6458,a8w8_blockscale_1x128x128_256x128x128x128_16x16_32x32_2x2_8x32x1_8x32x1_1x32x1x8_8_1x1_intrawave_v3,1382.4,499.71,0.0
256,13910,3072,6144,ck,0,0,378.191,a8w8_blockscale_1x128x128_256x128x128x128_16x16_32x32_2x2_8x32x1_8x32x1_1x32x1x8_8_1x1_intrawave_v3,1388.41,501.86,0.0
256,13912,3072,6144,ck,0,0,374.4402,a8w8_blockscale_1x128x128_256x128x128x128_16x16_32x32_2x2_8x32x1_8x32x1_1x32x1x8_8_1x1_intrawave_v3,1402.52,506.96,0.0
256,13931,3072,6144,ck,0,0,379.7774,a8w8_blockscale_1x128x128_256x128x128x128_16x16_32x32_2x2_8x32x1_8x32x1_1x32x1x8_8_1x1_intrawave_v3,1384.7,500.45,0.0
256,13934,3072,6144,ck,0,0,382.1354,a8w8_blockscale_1x128x128_256x128x128x128_16x16_32x32_2x2_8x32x1_8x32x1_1x32x1x8_8_1x1_intrawave_v3,1376.45,497.46,0.0
256,13936,3072,6144,ck,0,0,375.3138,a8w8_blockscale_1x128x128_256x128x128x128_16x16_32x32_2x2_8x32x1_8x32x1_1x32x1x8_8_1x1_intrawave_v3,1401.67,506.56,0.0
256,13939,3072,6144,ck,0,0,374.7686,a8w8_blockscale_1x128x128_256x128x128x128_16x16_32x32_2x2_8x32x1_8x32x1_1x32x1x8_8_1x1_intrawave_v3,1404.01,507.4,0.0
256,13941,3072,6144,ck,0,0,376.931,a8w8_blockscale_1x128x128_256x128x128x128_16x16_32x32_2x2_8x32x1_8x32x1_1x32x1x8_8_1x1_intrawave_v3,1396.16,504.55,0.0
256,13942,3072,6144,ck,0,0,377.0958,a8w8_blockscale_1x128x128_256x128x128x128_16x16_32x32_2x2_8x32x1_8x32x1_1x32x1x8_8_1x1_intrawave_v3,1395.65,504.36,0.0
256,13962,3072,6144,ck,0,0,379.4282,a8w8_blockscale_1x128x128_256x128x128x128_16x16_32x32_2x2_8x32x1_8x32x1_1x32x1x8_8_1x1_intrawave_v3,1389.06,501.91,0.0
256,13984,3072,6144,ck,0,0,378.791,a8w8_blockscale_1x128x128_256x128x128x128_16x16_32x32_2x2_8x32x1_8x32x1_1x32x1x8_8_1x1_intrawave_v3,1393.59,503.47,0.0
256,14002,3072,3072,ck,0,0,209.8881,a8w8_blockscale_1x128x128_256x128x128x128_16x16_32x32_2x2_8x32x1_8x32x1_1x32x1x8_8_1x1_intrawave_v3,1259.14,659.78,0.0
256,14037,3072,3072,ck,0,0,207.717,a8w8_blockscale_1x128x128_256x128x128x128_16x16_32x32_2x2_8x32x1_8x32x1_1x32x1x8_8_1x1_intrawave_v3,1275.48,668.23,0.0
256,14050,3072,3072,ck,0,0,203.1377,a8w8_blockscale_1x128x128_256x128x128x128_16x16_32x32_2x2_8x32x1_8x32x1_1x32x1x8_8_1x1_intrawave_v3,1305.44,683.88,0.0
256,14051,3072,6144,ck,0,0,385.4798,a8w8_blockscale_1x128x128_256x128x128x128_16x16_32x32_2x2_8x32x1_8x32x1_1x32x1x8_8_1x1_intrawave_v3,1375.97,496.87,0.0
256,14055,3072,6144,ck,0,0,382.311,a8w8_blockscale_1x128x128_256x128x128x128_16x16_32x32_2x2_8x32x1_8x32x1_1x32x1x8_8_1x1_intrawave_v3,1387.77,501.12,0.0
256,14082,3072,6144,ck,0,0,382.1055,a8w8_blockscale_1x128x128_256x128x128x128_16x16_32x32_2x2_8x32x1_8x32x1_1x32x1x8_8_1x1_intrawave_v3,1391.18,502.25,0.0
256,14104,3072,6144,ck,0,0,380.3949,a8w8_blockscale_1x128x128_256x128x128x128_16x16_32x32_2x2_8x32x1_8x32x1_1x32x1x8_8_1x1_intrawave_v3,1399.62,505.22,0.0
256,14107,3072,6144,ck,0,0,377.1158,a8w8_blockscale_1x128x128_256x128x128x128_16x16_32x32_2x2_8x32x1_8x32x1_1x32x1x8_8_1x1_intrawave_v3,1412.09,509.71,0.0
256,14109,3072,6144,ck,0,0,382.9673,a8w8_blockscale_1x128x128_256x128x128x128_16x16_32x32_2x2_8x32x1_8x32x1_1x32x1x8_8_1x1_intrawave_v3,1390.71,501.99,0.0
256,14110,3072,6144,ck,0,0,381.6785,a8w8_blockscale_1x128x128_256x128x128x128_16x16_32x32_2x2_8x32x1_8x32x1_1x32x1x8_8_1x1_intrawave_v3,1395.51,503.72,0.0
256,14111,3072,6144,ck,0,0,381.1351,a8w8_blockscale_1x128x128_256x128x128x128_16x16_32x32_2x2_8x32x1_8x32x1_1x32x1x8_8_1x1_intrawave_v3,1397.59,504.47,0.0
256,14112,3072,6144,ck,0,0,382.6735,a8w8_blockscale_1x128x128_256x128x128x128_16x16_32x32_2x2_8x32x1_8x32x1_1x32x1x8_8_1x1_intrawave_v3,1392.07,502.47,0.0
256,14113,3072,6144,ck,0,0,382.4274,a8w8_blockscale_1x128x128_256x128x128x128_16x16_32x32_2x2_8x32x1_8x32x1_1x32x1x8_8_1x1_intrawave_v3,1393.07,502.83,0.0
256,14114,3072,6144,ck,0,0,378.497,a8w8_blockscale_1x128x128_256x128x128x128_16x16_32x32_2x2_8x32x1_8x32x1_1x32x1x8_8_1x1_intrawave_v3,1407.64,508.08,0.0
256,14115,3072,6144,ck,0,0,378.9114,a8w8_blockscale_1x128x128_256x128x128x128_16x16_32x32_2x2_8x32x1_8x32x1_1x32x1x8_8_1x1_intrawave_v3,1406.2,507.56,0.0
256,14116,3072,6144,ck,0,0,383.5411,a8w8_blockscale_1x128x128_256x128x128x128_16x16_32x32_2x2_8x32x1_8x32x1_1x32x1x8_8_1x1_intrawave_v3,1389.32,501.46,0.0
256,14118,3072,6144,ck,0,0,384.7051,a8w8_blockscale_1x128x128_256x128x128x128_16x16_32x32_2x2_8x32x1_8x32x1_1x32x1x8_8_1x1_intrawave_v3,1385.31,500.01,0.0
256,14120,3072,3072,ck,0,0,206.7449,a8w8_blockscale_1x128x128_256x128x128x128_16x16_32x32_2x2_8x32x1_8x32x1_1x32x1x8_8_1x1_intrawave_v3,1289.06,675.07,0.0
256,14120,3072,6144,ck,0,0,383.9548,a8w8_blockscale_1x128x128_256x128x128x128_16x16_32x32_2x2_8x32x1_8x32x1_1x32x1x8_8_1x1_intrawave_v3,1388.22,501.05,0.0
256,14122,3072,3072,ck,0,0,206.6101,a8w8_blockscale_1x128x128_256x128x128x128_16x16_32x32_2x2_8x32x1_8x32x1_1x32x1x8_8_1x1_intrawave_v3,1290.08,675.6,0.0
256,14122,3072,6144,ck,0,0,385.0309,a8w8_blockscale_1x128x128_256x128x128x128_16x16_32x32_2x2_8x32x1_8x32x1_1x32x1x8_8_1x1_intrawave_v3,1384.53,499.71,0.0
256,14123,3072,3072,ck,0,0,207.0577,a8w8_blockscale_1x128x128_256x128x128x128_16x16_32x32_2x2_8x32x1_8x32x1_1x32x1x8_8_1x1_intrawave_v3,1287.38,674.18,0.0
256,14124,3072,6144,ck,0,0,384.1516,a8w8_blockscale_1x128x128_256x128x128x128_16x16_32x32_2x2_8x32x1_8x32x1_1x32x1x8_8_1x1_intrawave_v3,1387.9,500.92,0.0
256,14126,3072,6144,ck,0,0,380.1598,a8w8_blockscale_1x128x128_256x128x128x128_16x16_32x32_2x2_8x32x1_8x32x1_1x32x1x8_8_1x1_intrawave_v3,1402.67,506.25,0.0
256,14128,3072,6144,ck,0,0,379.2523,a8w8_blockscale_1x128x128_256x128x128x128_16x16_32x32_2x2_8x32x1_8x32x1_1x32x1x8_8_1x1_intrawave_v3,1406.23,507.52,0.0
256,14130,3072,6144,ck,0,0,381.2087,a8w8_blockscale_1x128x128_256x128x128x128_16x16_32x32_2x2_8x32x1_8x32x1_1x32x1x8_8_1x1_intrawave_v3,1399.21,504.98,0.0
256,14132,3072,6144,ck,0,0,376.5578,a8w8_blockscale_1x128x128_256x128x128x128_16x16_32x32_2x2_8x32x1_8x32x1_1x32x1x8_8_1x1_intrawave_v3,1416.69,511.29,0.0
256,14134,3072,6144,ck,0,0,377.7903,a8w8_blockscale_1x128x128_256x128x128x128_16x16_32x32_2x2_8x32x1_8x32x1_1x32x1x8_8_1x1_intrawave_v3,1412.27,509.68,0.0
256,14177,3072,3072,ck,0,0,208.1501,a8w8_blockscale_1x128x128_256x128x128x128_16x16_32x32_2x2_8x32x1_8x32x1_1x32x1x8_8_1x1_intrawave_v3,1285.52,673.04,0.0
256,14189,3072,3072,ck,0,0,205.4849,a8w8_blockscale_1x128x128_256x128x128x128_16x16_32x32_2x2_8x32x1_8x32x1_1x32x1x8_8_1x1_intrawave_v3,1303.3,682.3,0.0
256,14353,3072,6144,ck,0,0,387.8415,a8w8_blockscale_1x128x128_256x128x128x128_16x16_32x32_2x2_8x32x1_8x32x1_1x32x1x8_8_1x1_intrawave_v3,1396.98,503.41,0.0
256,14473,3072,6144,ck,0,0,399.0356,a8w8_blockscale_1x128x128_256x128x128x128_16x16_32x32_2x2_8x32x1_8x32x1_1x32x1x8_8_1x1_intrawave_v3,1369.14,492.99,0.0
256,14483,3072,3072,ck,0,0,210.3321,a8w8_blockscale_1x128x128_256x128x128x128_16x16_32x32_2x2_8x32x1_8x32x1_1x32x1x8_8_1x1_intrawave_v3,1299.65,679.46,0.0
256,14837,3072,3072,ck,0,0,216.2725,a8w8_blockscale_1x128x128_256x128x128x128_16x16_32x32_2x2_8x32x1_8x32x1_1x32x1x8_8_1x1_intrawave_v3,1294.84,675.88,0.0
256,15000,3072,3072,ck,0,0,225.4294,a8w8_blockscale_1x128x128_256x128x128x128_16x16_32x32_2x2_8x32x1_8x32x1_1x32x1x8_8_1x1_intrawave_v3,1255.89,655.09,0.0
256,15000,3072,6144,ck,0,0,408.5692,a8w8_blockscale_1x128x128_256x128x128x128_16x16_32x32_2x2_8x32x1_8x32x1_1x32x1x8_8_1x1_intrawave_v3,1385.89,497.33,0.0
256,15001,3072,3072,ck,0,0,223.6582,a8w8_blockscale_1x128x128_256x128x128x128_16x16_32x32_2x2_8x32x1_8x32x1_1x32x1x8_8_1x1_intrawave_v3,1265.92,660.32,0.0
256,15001,3072,6144,ck,0,0,410.3649,a8w8_blockscale_1x128x128_256x128x128x128_16x16_32x32_2x2_8x32x1_8x32x1_1x32x1x8_8_1x1_intrawave_v3,1379.92,495.19,0.0
256,15002,3072,3072,ck,0,0,219.5254,a8w8_blockscale_1x128x128_256x128x128x128_16x16_32x32_2x2_8x32x1_8x32x1_1x32x1x8_8_1x1_intrawave_v3,1289.84,672.8,0.0
256,15002,3072,6144,ck,0,0,407.6808,a8w8_blockscale_1x128x128_256x128x128x128_16x16_32x32_2x2_8x32x1_8x32x1_1x32x1x8_8_1x1_intrawave_v3,1389.09,498.48,0.0
256,15010,3072,6144,ck,0,0,413.0863,a8w8_blockscale_1x128x128_256x128x128x128_16x16_32x32_2x2_8x32x1_8x32x1_1x32x1x8_8_1x1_intrawave_v3,1371.65,492.19,0.0
256,15023,3072,3072,ck,0,0,223.7102,a8w8_blockscale_1x128x128_256x128x128x128_16x16_32x32_2x2_8x32x1_8x32x1_1x32x1x8_8_1x1_intrawave_v3,1267.49,661.07,0.0
256,15106,3072,3072,ck,0,0,222.542,a8w8_blockscale_1x128x128_256x128x128x128_16x16_32x32_2x2_8x32x1_8x32x1_1x32x1x8_8_1x1_intrawave_v3,1281.18,667.98,0.0
256,15112,3072,3072,ck,0,0,224.8291,a8w8_blockscale_1x128x128_256x128x128x128_16x16_32x32_2x2_8x32x1_8x32x1_1x32x1x8_8_1x1_intrawave_v3,1268.65,661.43,0.0
256,15235,3072,3072,ck,0,0,227.6824,a8w8_blockscale_1x128x128_256x128x128x128_16x16_32x32_2x2_8x32x1_8x32x1_1x32x1x8_8_1x1_intrawave_v3,1262.95,658.12,0.0
256,15241,3072,3072,ck,0,0,226.0475,a8w8_blockscale_1x128x128_256x128x128x128_16x16_32x32_2x2_8x32x1_8x32x1_1x32x1x8_8_1x1_intrawave_v3,1272.58,663.13,0.0
256,15277,3072,6144,ck,0,0,411.2176,a8w8_blockscale_1x128x128_256x128x128x128_16x16_32x32_2x2_8x32x1_8x32x1_1x32x1x8_8_1x1_intrawave_v3,1402.39,502.41,0.0
256,15279,3072,6144,ck,0,0,409.1934,a8w8_blockscale_1x128x128_256x128x128x128_16x16_32x32_2x2_8x32x1_8x32x1_1x32x1x8_8_1x1_intrawave_v3,1409.51,504.95,0.0
256,15336,3072,6144,ck,0,0,404.6606,a8w8_blockscale_1x128x128_256x128x128x128_16x16_32x32_2x2_8x32x1_8x32x1_1x32x1x8_8_1x1_intrawave_v3,1430.62,512.34,0.0
256,15349,3072,6144,ck,0,0,405.7366,a8w8_blockscale_1x128x128_256x128x128x128_16x16_32x32_2x2_8x32x1_8x32x1_1x32x1x8_8_1x1_intrawave_v3,1428.03,511.37,0.0
256,15441,3072,3072,ck,0,0,227.3921,a8w8_blockscale_1x128x128_256x128x128x128_16x16_32x32_2x2_8x32x1_8x32x1_1x32x1x8_8_1x1_intrawave_v3,1281.66,667.31,0.0
256,15510,3072,6144,ck,0,0,415.2472,a8w8_blockscale_1x128x128_256x128x128x128_16x16_32x32_2x2_8x32x1_8x32x1_1x32x1x8_8_1x1_intrawave_v3,1409.96,504.43,0.0
256,15514,3072,3072,ck,0,0,221.9423,a8w8_blockscale_1x128x128_256x128x128x128_16x16_32x32_2x2_8x32x1_8x32x1_1x32x1x8_8_1x1_intrawave_v3,1319.34,686.73,0.0
256,15537,3072,6144,ck,0,0,418.8865,a8w8_blockscale_1x128x128_256x128x128x128_16x16_32x32_2x2_8x32x1_8x32x1_1x32x1x8_8_1x1_intrawave_v3,1400.15,500.84,0.0
256,15559,3072,3072,ck,0,0,223.0811,a8w8_blockscale_1x128x128_256x128x128x128_16x16_32x32_2x2_8x32x1_8x32x1_1x32x1x8_8_1x1_intrawave_v3,1316.41,685.08,0.0
256,15637,3072,6144,ck,0,0,420.079,a8w8_blockscale_1x128x128_256x128x128x128_16x16_32x32_2x2_8x32x1_8x32x1_1x32x1x8_8_1x1_intrawave_v3,1405.16,502.34,0.0
256,15658,3072,6144,ck,0,0,416.7194,a8w8_blockscale_1x128x128_256x128x128x128_16x16_32x32_2x2_8x32x1_8x32x1_1x32x1x8_8_1x1_intrawave_v3,1418.39,507.01,0.0
256,15677,3072,6144,ck,0,0,420.3678,a8w8_blockscale_1x128x128_256x128x128x128_16x16_32x32_2x2_8x32x1_8x32x1_1x32x1x8_8_1x1_intrawave_v3,1407.78,503.16,0.0
256,15749,3072,6144,ck,0,0,418.1642,a8w8_blockscale_1x128x128_256x128x128x128_16x16_32x32_2x2_8x32x1_8x32x1_1x32x1x8_8_1x1_intrawave_v3,1421.7,507.93,0.0
256,15817,3072,6144,ck,0,0,417.5974,a8w8_blockscale_1x128x128_256x128x128x128_16x16_32x32_2x2_8x32x1_8x32x1_1x32x1x8_8_1x1_intrawave_v3,1429.78,510.62,0.0
256,15818,3072,6144,ck,0,0,417.9098,a8w8_blockscale_1x128x128_256x128x128x128_16x16_32x32_2x2_8x32x1_8x32x1_1x32x1x8_8_1x1_intrawave_v3,1428.8,510.27,0.0
256,15840,3072,6144,ck,0,0,419.621,a8w8_blockscale_1x128x128_256x128x128x128_16x16_32x32_2x2_8x32x1_8x32x1_1x32x1x8_8_1x1_intrawave_v3,1424.95,508.83,0.0
256,15841,3072,6144,ck,0,0,415.3566,a8w8_blockscale_1x128x128_256x128x128x128_16x16_32x32_2x2_8x32x1_8x32x1_1x32x1x8_8_1x1_intrawave_v3,1439.67,514.08,0.0
256,15853,3072,3072,ck,0,0,222.8926,a8w8_blockscale_1x128x128_256x128x128x128_16x16_32x32_2x2_8x32x1_8x32x1_1x32x1x8_8_1x1_intrawave_v3,1342.42,697.82,0.0
256,15858,3072,6144,ck,0,0,421.5442,a8w8_blockscale_1x128x128_256x128x128x128_16x16_32x32_2x2_8x32x1_8x32x1_1x32x1x8_8_1x1_intrawave_v3,1420.06,507.03,0.0
256,15871,3072,3072,ck,0,0,228.5735,a8w8_blockscale_1x128x128_256x128x128x128_16x16_32x32_2x2_8x32x1_8x32x1_1x32x1x8_8_1x1_intrawave_v3,1310.54,681.2,0.0
256,16199,3072,3072,ck,0,0,227.6633,a8w8_blockscale_1x128x128_256x128x128x128_16x16_32x32_2x2_8x32x1_8x32x1_1x32x1x8_8_1x1_intrawave_v3,1342.97,697.2,0.0
256,16225,3072,6144,ck,0,0,434.0967,a8w8_blockscale_1x128x128_256x128x128x128_16x16_32x32_2x2_8x32x1_8x32x1_1x32x1x8_8_1x1_intrawave_v3,1410.91,502.76,0.0
256,16248,3072,6144,ck,0,0,428.4903,a8w8_blockscale_1x128x128_256x128x128x128_16x16_32x32_2x2_8x32x1_8x32x1_1x32x1x8_8_1x1_intrawave_v3,1431.4,510.0,0.0
256,16249,3072,6144,ck,0,0,427.1107,a8w8_blockscale_1x128x128_256x128x128x128_16x16_32x32_2x2_8x32x1_8x32x1_1x32x1x8_8_1x1_intrawave_v3,1436.11,511.68,0.0
256,16294,3072,3072,ck,0,0,234.868,a8w8_blockscale_1x128x128_256x128x128x128_16x16_32x32_2x2_8x32x1_8x32x1_1x32x1x8_8_1x1_intrawave_v3,1309.41,679.54,0.0
256,16340,3072,6144,ck,0,0,430.4383,a8w8_blockscale_1x128x128_256x128x128x128_16x16_32x32_2x2_8x32x1_8x32x1_1x32x1x8_8_1x1_intrawave_v3,1432.99,510.32,0.0
256,16422,3072,6144,ck,0,0,435.8963,a8w8_blockscale_1x128x128_256x128x128x128_16x16_32x32_2x2_8x32x1_8x32x1_1x32x1x8_8_1x1_intrawave_v3,1422.15,506.24,0.0
256,16443,3072,3072,ck,0,0,235.0264,a8w8_blockscale_1x128x128_256x128x128x128_16x16_32x32_2x2_8x32x1_8x32x1_1x32x1x8_8_1x1_intrawave_v3,1320.5,684.93,0.0
256,16463,3072,3072,ck,0,0,236.3756,a8w8_blockscale_1x128x128_256x128x128x128_16x16_32x32_2x2_8x32x1_8x32x1_1x32x1x8_8_1x1_intrawave_v3,1314.55,681.8,0.0
256,16527,3072,3072,ck,0,0,238.9572,a8w8_blockscale_1x128x128_256x128x128x128_16x16_32x32_2x2_8x32x1_8x32x1_1x32x1x8_8_1x1_intrawave_v3,1305.41,676.9,0.0
256,16646,3072,3072,ck,0,0,236.5944,a8w8_blockscale_1x128x128_256x128x128x128_16x16_32x32_2x2_8x32x1_8x32x1_1x32x1x8_8_1x1_intrawave_v3,1327.94,688.29,0.0
256,16681,3072,3072,ck,0,0,241.7956,a8w8_blockscale_1x128x128_256x128x128x128_16x16_32x32_2x2_8x32x1_8x32x1_1x32x1x8_8_1x1_intrawave_v3,1302.11,674.82,0.0
256,16697,3072,3072,ck,0,0,240.6844,a8w8_blockscale_1x128x128_256x128x128x128_16x16_32x32_2x2_8x32x1_8x32x1_1x32x1x8_8_1x1_intrawave_v3,1309.37,678.55,0.0
256,16699,3072,6144,ck,0,0,453.9612,a8w8_blockscale_1x128x128_256x128x128x128_16x16_32x32_2x2_8x32x1_8x32x1_1x32x1x8_8_1x1_intrawave_v3,1388.59,493.59,0.0
256,16726,3072,3072,ck,0,0,233.4675,a8w8_blockscale_1x128x128_256x128x128x128_16x16_32x32_2x2_8x32x1_8x32x1_1x32x1x8_8_1x1_intrawave_v3,1352.19,700.67,0.0
256,16758,3072,3072,ck,0,0,238.5612,a8w8_blockscale_1x128x128_256x128x128x128_16x16_32x32_2x2_8x32x1_8x32x1_1x32x1x8_8_1x1_intrawave_v3,1325.85,686.95,0.0
256,16804,3072,6144,ck,0,0,444.1532,a8w8_blockscale_1x128x128_256x128x128x128_16x16_32x32_2x2_8x32x1_8x32x1_1x32x1x8_8_1x1_intrawave_v3,1428.18,507.4,0.0
256,16852,3072,6144,ck,0,0,440.6823,a8w8_blockscale_1x128x128_256x128x128x128_16x16_32x32_2x2_8x32x1_8x32x1_1x32x1x8_8_1x1_intrawave_v3,1443.54,512.73,0.0
256,16940,3072,3072,ck,0,0,244.2372,a8w8_blockscale_1x128x128_256x128x128x128_16x16_32x32_2x2_8x32x1_8x32x1_1x32x1x8_8_1x1_intrawave_v3,1309.1,677.85,0.0
256,16995,3072,3072,ck,0,0,243.1002,a8w8_blockscale_1x128x128_256x128x128x128_16x16_32x32_2x2_8x32x1_8x32x1_1x32x1x8_8_1x1_intrawave_v3,1319.5,683.11,0.0
256,17006,3072,3072,ck,0,0,237.8416,a8w8_blockscale_1x128x128_256x128x128x128_16x16_32x32_2x2_8x32x1_8x32x1_1x32x1x8_8_1x1_intrawave_v3,1349.54,698.64,0.0
256,17013,3072,3072,ck,0,0,243.588,a8w8_blockscale_1x128x128_256x128x128x128_16x16_32x32_2x2_8x32x1_8x32x1_1x32x1x8_8_1x1_intrawave_v3,1318.25,682.42,0.0
256,17047,3072,3072,ck,0,0,244.3896,a8w8_blockscale_1x128x128_256x128x128x128_16x16_32x32_2x2_8x32x1_8x32x1_1x32x1x8_8_1x1_intrawave_v3,1316.55,681.46,0.0
256,17079,3072,3072,ck,0,0,246.9537,a8w8_blockscale_1x128x128_256x128x128x128_16x16_32x32_2x2_8x32x1_8x32x1_1x32x1x8_8_1x1_intrawave_v3,1305.33,675.58,0.0
256,17235,3072,3072,ck,0,0,249.9307,a8w8_blockscale_1x128x128_256x128x128x128_16x16_32x32_2x2_8x32x1_8x32x1_1x32x1x8_8_1x1_intrawave_v3,1301.56,673.29,0.0
256,17237,3072,3072,ck,0,0,239.5401,a8w8_blockscale_1x128x128_256x128x128x128_16x16_32x32_2x2_8x32x1_8x32x1_1x32x1x8_8_1x1_intrawave_v3,1358.18,702.57,0.0
256,17241,3072,3072,ck,0,0,245.7252,a8w8_blockscale_1x128x128_256x128x128x128_16x16_32x32_2x2_8x32x1_8x32x1_1x32x1x8_8_1x1_intrawave_v3,1324.3,685.03,0.0
256,17241,3072,6144,ck,0,0,458.3526,a8w8_blockscale_1x128x128_256x128x128x128_16x16_32x32_2x2_8x32x1_8x32x1_1x32x1x8_8_1x1_intrawave_v3,1419.92,503.39,0.0
256,17242,3072,3072,ck,0,0,245.1997,a8w8_blockscale_1x128x128_256x128x128x128_16x16_32x32_2x2_8x32x1_8x32x1_1x32x1x8_8_1x1_intrawave_v3,1327.21,686.54,0.0
256,17286,3072,6144,ck,0,0,462.8672,a8w8_blockscale_1x128x128_256x128x128x128_16x16_32x32_2x2_8x32x1_8x32x1_1x32x1x8_8_1x1_intrawave_v3,1409.74,499.68,0.0
256,17292,3072,3072,ck,0,0,240.8332,a8w8_blockscale_1x128x128_256x128x128x128_16x16_32x32_2x2_8x32x1_8x32x1_1x32x1x8_8_1x1_intrawave_v3,1355.19,700.9,0.0
256,17420,3072,6144,ck,0,0,471.2818,a8w8_blockscale_1x128x128_256x128x128x128_16x16_32x32_2x2_8x32x1_8x32x1_1x32x1x8_8_1x1_intrawave_v3,1395.31,494.25,0.0
256,17849,3072,6144,ck,0,0,463.4722,a8w8_blockscale_1x128x128_256x128x128x128_16x16_32x32_2x2_8x32x1_8x32x1_1x32x1x8_8_1x1_intrawave_v3,1453.76,513.95,0.0
256,17860,3072,6144,ck,0,0,467.5691,a8w8_blockscale_1x128x128_256x128x128x128_16x16_32x32_2x2_8x32x1_8x32x1_1x32x1x8_8_1x1_intrawave_v3,1441.91,509.74,0.0
256,17888,3072,6144,ck,0,0,476.2283,a8w8_blockscale_1x128x128_256x128x128x128_16x16_32x32_2x2_8x32x1_8x32x1_1x32x1x8_8_1x1_intrawave_v3,1417.91,501.19,0.0
256,18014,3072,6144,ck,0,0,484.9215,a8w8_blockscale_1x128x128_256x128x128x128_16x16_32x32_2x2_8x32x1_8x32x1_1x32x1x8_8_1x1_intrawave_v3,1402.3,495.4,0.0
256,18046,3072,3072,ck,0,0,261.0917,a8w8_blockscale_1x128x128_256x128x128x128_16x16_32x32_2x2_8x32x1_8x32x1_1x32x1x8_8_1x1_intrawave_v3,1304.55,673.13,0.0
256,18047,3072,6144,ck,0,0,477.1936,a8w8_blockscale_1x128x128_256x128x128x128_16x16_32x32_2x2_8x32x1_8x32x1_1x32x1x8_8_1x1_intrawave_v3,1427.62,504.27,0.0
256,18160,3072,3072,ck,0,0,259.6478,a8w8_blockscale_1x128x128_256x128x128x128_16x16_32x32_2x2_8x32x1_8x32x1_1x32x1x8_8_1x1_intrawave_v3,1320.09,680.92,0.0
256,18558,3072,3072,ck,0,0,266.4091,a8w8_blockscale_1x128x128_256x128x128x128_16x16_32x32_2x2_8x32x1_8x32x1_1x32x1x8_8_1x1_intrawave_v3,1314.78,677.41,0.0
256,18581,3072,3072,ck,0,0,259.2074,a8w8_blockscale_1x128x128_256x128x128x128_16x16_32x32_2x2_8x32x1_8x32x1_1x32x1x8_8_1x1_intrawave_v3,1352.99,697.05,0.0
256,18638,3072,6144,ck,0,0,499.287,a8w8_blockscale_1x128x128_256x128x128x128_16x16_32x32_2x2_8x32x1_8x32x1_1x32x1x8_8_1x1_intrawave_v3,1409.13,496.5,0.0
256,18706,3072,3072,ck,0,0,267.2341,a8w8_blockscale_1x128x128_256x128x128x128_16x16_32x32_2x2_8x32x1_8x32x1_1x32x1x8_8_1x1_intrawave_v3,1321.18,680.42,0.0
256,18867,3072,6144,ck,0,0,499.248,a8w8_blockscale_1x128x128_256x128x128x128_16x16_32x32_2x2_8x32x1_8x32x1_1x32x1x8_8_1x1_intrawave_v3,1426.56,502.18,0.0
256,18964,3072,3072,ck,0,0,265.5894,a8w8_blockscale_1x128x128_256x128x128x128_16x16_32x32_2x2_8x32x1_8x32x1_1x32x1x8_8_1x1_intrawave_v3,1347.7,693.59,0.0
256,18964,3072,6144,ck,0,0,498.4092,a8w8_blockscale_1x128x128_256x128x128x128_16x16_32x32_2x2_8x32x1_8x32x1_1x32x1x8_8_1x1_intrawave_v3,1436.3,505.42,0.0
256,18965,3072,3072,ck,0,0,261.0066,a8w8_blockscale_1x128x128_256x128x128x128_16x16_32x32_2x2_8x32x1_8x32x1_1x32x1x8_8_1x1_intrawave_v3,1371.43,705.8,0.0
256,18989,3072,6144,ck,0,0,499.0552,a8w8_blockscale_1x128x128_256x128x128x128_16x16_32x32_2x2_8x32x1_8x32x1_1x32x1x8_8_1x1_intrawave_v3,1436.34,505.38,0.0
256,18998,3072,6144,ck,0,0,498.7447,a8w8_blockscale_1x128x128_256x128x128x128_16x16_32x32_2x2_8x32x1_8x32x1_1x32x1x8_8_1x1_intrawave_v3,1437.91,505.91,0.0
256,19001,3072,3072,ck,0,0,262.6506,a8w8_blockscale_1x128x128_256x128x128x128_16x16_32x32_2x2_8x32x1_8x32x1_1x32x1x8_8_1x1_intrawave_v3,1365.43,702.65,0.0
256,19002,3072,3072,ck,0,0,258.8881,a8w8_blockscale_1x128x128_256x128x128x128_16x16_32x32_2x2_8x32x1_8x32x1_1x32x1x8_8_1x1_intrawave_v3,1385.35,712.89,0.0
256,19002,3072,6144,ck,0,0,503.903,a8w8_blockscale_1x128x128_256x128x128x128_16x16_32x32_2x2_8x32x1_8x32x1_1x32x1x8_8_1x1_intrawave_v3,1423.49,500.83,0.0
256,19003,3072,6144,ck,0,0,494.905,a8w8_blockscale_1x128x128_256x128x128x128_16x16_32x32_2x2_8x32x1_8x32x1_1x32x1x8_8_1x1_intrawave_v3,1449.45,509.96,0.0
256,19025,3072,6144,ck,0,0,491.5499,a8w8_blockscale_1x128x128_256x128x128x128_16x16_32x32_2x2_8x32x1_8x32x1_1x32x1x8_8_1x1_intrawave_v3,1461.03,513.99,0.0
256,19026,3072,6144,ck,0,0,498.2182,a8w8_blockscale_1x128x128_256x128x128x128_16x16_32x32_2x2_8x32x1_8x32x1_1x32x1x8_8_1x1_intrawave_v3,1441.55,507.14,0.0
256,19047,3072,3072,ck,0,0,261.8733,a8w8_blockscale_1x128x128_256x128x128x128_16x16_32x32_2x2_8x32x1_8x32x1_1x32x1x8_8_1x1_intrawave_v3,1372.8,706.35,0.0
256,19057,3072,6144,ck,0,0,501.1489,a8w8_blockscale_1x128x128_256x128x128x128_16x16_32x32_2x2_8x32x1_8x32x1_1x32x1x8_8_1x1_intrawave_v3,1435.46,504.93,0.0
256,19310,3072,3072,ck,0,0,276.8178,a8w8_blockscale_1x128x128_256x128x128x128_16x16_32x32_2x2_8x32x1_8x32x1_1x32x1x8_8_1x1_intrawave_v3,1316.62,676.97,0.0
256,19416,3072,3072,ck,0,0,271.7314,a8w8_blockscale_1x128x128_256x128x128x128_16x16_32x32_2x2_8x32x1_8x32x1_1x32x1x8_8_1x1_intrawave_v3,1348.63,693.24,0.0
256,19573,3072,3072,ck,0,0,270.6994,a8w8_blockscale_1x128x128_256x128x128x128_16x16_32x32_2x2_8x32x1_8x32x1_1x32x1x8_8_1x1_intrawave_v3,1364.72,701.23,0.0
256,19798,3072,3072,ck,0,0,286.6715,a8w8_blockscale_1x128x128_256x128x128x128_16x16_32x32_2x2_8x32x1_8x32x1_1x32x1x8_8_1x1_intrawave_v3,1303.49,669.39,0.0
256,19867,3072,3072,ck,0,0,272.3886,a8w8_blockscale_1x128x128_256x128x128x128_16x16_32x32_2x2_8x32x1_8x32x1_1x32x1x8_8_1x1_intrawave_v3,1376.63,706.83,0.0
256,20000,3072,3072,ck,0,0,284.6266,a8w8_blockscale_1x128x128_256x128x128x128_16x16_32x32_2x2_8x32x1_8x32x1_1x32x1x8_8_1x1_intrawave_v3,1326.25,680.74,0.0
256,20000,3072,6144,ck,0,0,537.0842,a8w8_blockscale_1x128x128_256x128x128x128_16x16_32x32_2x2_8x32x1_8x32x1_1x32x1x8_8_1x1_intrawave_v3,1405.69,492.72,0.0
256,20001,3072,3072,ck,0,0,284.4119,a8w8_blockscale_1x128x128_256x128x128x128_16x16_32x32_2x2_8x32x1_8x32x1_1x32x1x8_8_1x1_intrawave_v3,1327.32,681.29,0.0
256,20001,3072,6144,ck,0,0,534.7348,a8w8_blockscale_1x128x128_256x128x128x128_16x16_32x32_2x2_8x32x1_8x32x1_1x32x1x8_8_1x1_intrawave_v3,1411.94,494.91,0.0
256,20002,3072,3072,ck,0,0,284.5767,a8w8_blockscale_1x128x128_256x128x128x128_16x16_32x32_2x2_8x32x1_8x32x1_1x32x1x8_8_1x1_intrawave_v3,1326.62,680.93,0.0
256,20002,3072,6144,ck,0,0,525.7038,a8w8_blockscale_1x128x128_256x128x128x128_16x16_32x32_2x2_8x32x1_8x32x1_1x32x1x8_8_1x1_intrawave_v3,1436.27,503.44,0.0
256,20003,3072,3072,ck,0,0,285.011,a8w8_blockscale_1x128x128_256x128x128x128_16x16_32x32_2x2_8x32x1_8x32x1_1x32x1x8_8_1x1_intrawave_v3,1324.66,679.92,0.0
256,20004,3072,3072,ck,0,0,281.1959,a8w8_blockscale_1x128x128_256x128x128x128_16x16_32x32_2x2_8x32x1_8x32x1_1x32x1x8_8_1x1_intrawave_v3,1342.7,689.18,0.0
256,20004,3072,6144,ck,0,0,527.1454,a8w8_blockscale_1x128x128_256x128x128x128_16x16_32x32_2x2_8x32x1_8x32x1_1x32x1x8_8_1x1_intrawave_v3,1432.48,502.11,0.0
256,20005,3072,6144,ck,0,0,533.1109,a8w8_blockscale_1x128x128_256x128x128x128_16x16_32x32_2x2_8x32x1_8x32x1_1x32x1x8_8_1x1_intrawave_v3,1416.52,496.51,0.0
256,20012,3072,3072,ck,0,0,286.7433,a8w8_blockscale_1x128x128_256x128x128x128_16x16_32x32_2x2_8x32x1_8x32x1_1x32x1x8_8_1x1_intrawave_v3,1317.25,676.1,0.0
256,20014,3072,3072,ck,0,0,286.2738,a8w8_blockscale_1x128x128_256x128x128x128_16x16_32x32_2x2_8x32x1_8x32x1_1x32x1x8_8_1x1_intrawave_v3,1319.55,677.28,0.0
256,20015,3072,6144,ck,0,0,528.8843,a8w8_blockscale_1x128x128_256x128x128x128_16x16_32x32_2x2_8x32x1_8x32x1_1x32x1x8_8_1x1_intrawave_v3,1428.56,500.71,0.0
256,20017,3072,3072,ck,0,0,283.3281,a8w8_blockscale_1x128x128_256x128x128x128_16x16_32x32_2x2_8x32x1_8x32x1_1x32x1x8_8_1x1_intrawave_v3,1333.47,684.41,0.0
256,20021,3072,3072,ck,0,0,285.4839,a8w8_blockscale_1x128x128_256x128x128x128_16x16_32x32_2x2_8x32x1_8x32x1_1x32x1x8_8_1x1_intrawave_v3,1323.66,679.38,0.0
256,20027,3072,6144,ck,0,0,535.5888,a8w8_blockscale_1x128x128_256x128x128x128_16x16_32x32_2x2_8x32x1_8x32x1_1x32x1x8_8_1x1_intrawave_v3,1411.52,494.72,0.0
256,20030,3072,3072,ck,0,0,281.5898,a8w8_blockscale_1x128x128_256x128x128x128_16x16_32x32_2x2_8x32x1_8x32x1_1x32x1x8_8_1x1_intrawave_v3,1342.57,689.06,0.0
256,20047,3072,3072,ck,0,0,283.933,a8w8_blockscale_1x128x128_256x128x128x128_16x16_32x32_2x2_8x32x1_8x32x1_1x32x1x8_8_1x1_intrawave_v3,1332.62,683.93,0.0
256,20055,3072,3072,ck,0,0,277.047,a8w8_blockscale_1x128x128_256x128x128x128_16x16_32x32_2x2_8x32x1_8x32x1_1x32x1x8_8_1x1_intrawave_v3,1366.29,701.2,0.0
256,20056,3072,3072,ck,0,0,278.911,a8w8_blockscale_1x128x128_256x128x128x128_16x16_32x32_2x2_8x32x1_8x32x1_1x32x1x8_8_1x1_intrawave_v3,1357.22,696.54,0.0
256,20057,3072,3072,ck,0,0,280.2594,a8w8_blockscale_1x128x128_256x128x128x128_16x16_32x32_2x2_8x32x1_8x32x1_1x32x1x8_8_1x1_intrawave_v3,1350.76,693.22,0.0
256,20105,3072,3072,ck,0,0,283.249,a8w8_blockscale_1x128x128_256x128x128x128_16x16_32x32_2x2_8x32x1_8x32x1_1x32x1x8_8_1x1_intrawave_v3,1339.7,687.47,0.0
256,20108,3072,3072,ck,0,0,278.0234,a8w8_blockscale_1x128x128_256x128x128x128_16x16_32x32_2x2_8x32x1_8x32x1_1x32x1x8_8_1x1_intrawave_v3,1365.09,700.49,0.0
256,20111,3072,3072,ck,0,0,282.7202,a8w8_blockscale_1x128x128_256x128x128x128_16x16_32x32_2x2_8x32x1_8x32x1_1x32x1x8_8_1x1_intrawave_v3,1342.61,688.95,0.0
256,20119,3072,3072,ck,0,0,281.3158,a8w8_blockscale_1x128x128_256x128x128x128_16x16_32x32_2x2_8x32x1_8x32x1_1x32x1x8_8_1x1_intrawave_v3,1349.85,692.65,0.0
256,20126,3072,3072,ck,0,0,278.9758,a8w8_blockscale_1x128x128_256x128x128x128_16x16_32x32_2x2_8x32x1_8x32x1_1x32x1x8_8_1x1_intrawave_v3,1361.64,698.69,0.0
256,20135,3072,3072,ck,0,0,283.9538,a8w8_blockscale_1x128x128_256x128x128x128_16x16_32x32_2x2_8x32x1_8x32x1_1x32x1x8_8_1x1_intrawave_v3,1338.37,686.74,0.0
256,20174,3072,3072,ck,0,0,286.381,a8w8_blockscale_1x128x128_256x128x128x128_16x16_32x32_2x2_8x32x1_8x32x1_1x32x1x8_8_1x1_intrawave_v3,1329.6,682.17,0.0
256,20176,3072,3072,ck,0,0,279.9066,a8w8_blockscale_1x128x128_256x128x128x128_16x16_32x32_2x2_8x32x1_8x32x1_1x32x1x8_8_1x1_intrawave_v3,1360.49,698.02,0.0
256,20177,3072,3072,ck,0,0,281.6194,a8w8_blockscale_1x128x128_256x128x128x128_16x16_32x32_2x2_8x32x1_8x32x1_1x32x1x8_8_1x1_intrawave_v3,1352.28,693.8,0.0
256,20261,3072,3072,ck,0,0,288.8799,a8w8_blockscale_1x128x128_256x128x128x128_16x16_32x32_2x2_8x32x1_8x32x1_1x32x1x8_8_1x1_intrawave_v3,1323.78,679.05,0.0
256,20269,3072,6144,ck,0,0,532.5542,a8w8_blockscale_1x128x128_256x128x128x128_16x16_32x32_2x2_8x32x1_8x32x1_1x32x1x8_8_1x1_intrawave_v3,1436.72,503.12,0.0
256,20274,3072,3072,ck,0,0,282.4126,a8w8_blockscale_1x128x128_256x128x128x128_16x16_32x32_2x2_8x32x1_8x32x1_1x32x1x8_8_1x1_intrawave_v3,1354.96,695.02,0.0
256,20294,3072,3072,ck,0,0,279.3534,a8w8_blockscale_1x128x128_256x128x128x128_16x16_32x32_2x2_8x32x1_8x32x1_1x32x1x8_8_1x1_intrawave_v3,1371.15,703.29,0.0
256,20335,3072,6144,ck,0,0,534.5926,a8w8_blockscale_1x128x128_256x128x128x128_16x16_32x32_2x2_8x32x1_8x32x1_1x32x1x8_8_1x1_intrawave_v3,1435.9,502.72,0.0
256,20348,3072,3072,ck,0,0,284.8827,a8w8_blockscale_1x128x128_256x128x128x128_16x16_32x32_2x2_8x32x1_8x32x1_1x32x1x8_8_1x1_intrawave_v3,1348.12,691.39,0.0
256,20388,3072,3072,ck,0,0,284.0407,a8w8_blockscale_1x128x128_256x128x128x128_16x16_32x32_2x2_8x32x1_8x32x1_1x32x1x8_8_1x1_intrawave_v3,1354.77,694.73,0.0
256,20419,3072,6144,ck,0,0,527.1989,a8w8_blockscale_1x128x128_256x128x128x128_16x16_32x32_2x2_8x32x1_8x32x1_1x32x1x8_8_1x1_intrawave_v3,1462.05,511.73,0.0
256,20428,3072,6144,ck,0,0,522.192,a8w8_blockscale_1x128x128_256x128x128x128_16x16_32x32_2x2_8x32x1_8x32x1_1x32x1x8_8_1x1_intrawave_v3,1476.72,516.85,0.0
256,20433,3072,6144,ck,0,0,522.871,a8w8_blockscale_1x128x128_256x128x128x128_16x16_32x32_2x2_8x32x1_8x32x1_1x32x1x8_8_1x1_intrawave_v3,1475.16,516.29,0.0
256,20446,3072,6144,ck,0,0,520.3241,a8w8_blockscale_1x128x128_256x128x128x128_16x16_32x32_2x2_8x32x1_8x32x1_1x32x1x8_8_1x1_intrawave_v3,1483.33,519.13,0.0
256,20456,3072,6144,ck,0,0,525.8863,a8w8_blockscale_1x128x128_256x128x128x128_16x16_32x32_2x2_8x32x1_8x32x1_1x32x1x8_8_1x1_intrawave_v3,1468.36,513.87,0.0
256,20459,3072,6144,ck,0,0,519.4936,a8w8_blockscale_1x128x128_256x128x128x128_16x16_32x32_2x2_8x32x1_8x32x1_1x32x1x8_8_1x1_intrawave_v3,1486.64,520.27,0.0
256,20460,3072,6144,ck,0,0,517.8616,a8w8_blockscale_1x128x128_256x128x128x128_16x16_32x32_2x2_8x32x1_8x32x1_1x32x1x8_8_1x1_intrawave_v3,1491.4,521.93,0.0
256,20461,3072,6144,ck,0,0,521.3368,a8w8_blockscale_1x128x128_256x128x128x128_16x16_32x32_2x2_8x32x1_8x32x1_1x32x1x8_8_1x1_intrawave_v3,1481.53,518.47,0.0
256,20462,3072,6144,ck,0,0,528.3229,a8w8_blockscale_1x128x128_256x128x128x128_16x16_32x32_2x2_8x32x1_8x32x1_1x32x1x8_8_1x1_intrawave_v3,1462.01,511.64,0.0
256,20463,3072,6144,ck,0,0,519.4324,a8w8_blockscale_1x128x128_256x128x128x128_16x16_32x32_2x2_8x32x1_8x32x1_1x32x1x8_8_1x1_intrawave_v3,1487.11,520.42,0.0
256,20464,3072,6144,ck,0,0,522.3544,a8w8_blockscale_1x128x128_256x128x128x128_16x16_32x32_2x2_8x32x1_8x32x1_1x32x1x8_8_1x1_intrawave_v3,1478.86,517.53,0.0
256,20465,3072,6144,ck,0,0,527.462,a8w8_blockscale_1x128x128_256x128x128x128_16x16_32x32_2x2_8x32x1_8x32x1_1x32x1x8_8_1x1_intrawave_v3,1464.61,512.55,0.0
256,20466,3072,6144,ck,0,0,515.8472,a8w8_blockscale_1x128x128_256x128x128x128_16x16_32x32_2x2_8x32x1_8x32x1_1x32x1x8_8_1x1_intrawave_v3,1497.66,524.11,0.0
256,20467,3072,6144,ck,0,0,527.7045,a8w8_blockscale_1x128x128_256x128x128x128_16x16_32x32_2x2_8x32x1_8x32x1_1x32x1x8_8_1x1_intrawave_v3,1464.08,512.36,0.0
256,20468,3072,6144,ck,0,0,521.8564,a8w8_blockscale_1x128x128_256x128x128x128_16x16_32x32_2x2_8x32x1_8x32x1_1x32x1x8_8_1x1_intrawave_v3,1480.56,518.12,0.0
256,20470,3072,6144,ck,0,0,518.1108,a8w8_blockscale_1x128x128_256x128x128x128_16x16_32x32_2x2_8x32x1_8x32x1_1x32x1x8_8_1x1_intrawave_v3,1491.41,521.91,0.0
256,20472,3072,6144,ck,0,0,530.2284,a8w8_blockscale_1x128x128_256x128x128x128_16x16_32x32_2x2_8x32x1_8x32x1_1x32x1x8_8_1x1_intrawave_v3,1457.47,510.03,0.0
256,20474,3072,6144,ck,0,0,529.7886,a8w8_blockscale_1x128x128_256x128x128x128_16x16_32x32_2x2_8x32x1_8x32x1_1x32x1x8_8_1x1_intrawave_v3,1458.82,510.5,0.0
256,20476,3072,6144,ck,0,0,518.7879,a8w8_blockscale_1x128x128_256x128x128x128_16x16_32x32_2x2_8x32x1_8x32x1_1x32x1x8_8_1x1_intrawave_v3,1489.9,521.38,0.0
256,20478,3072,6144,ck,0,0,525.254,a8w8_blockscale_1x128x128_256x128x128x128_16x16_32x32_2x2_8x32x1_8x32x1_1x32x1x8_8_1x1_intrawave_v3,1471.7,515.0,0.0
256,20480,3072,6144,ck,0,0,516.048,a8w8_blockscale_1x128x128_256x128x128x128_16x16_32x32_2x2_8x32x1_8x32x1_1x32x1x8_8_1x1_intrawave_v3,1498.11,524.24,0.0
256,20482,3072,6144,ck,0,0,538.6219,a8w8_blockscale_1x128x128_256x128x128x128_16x16_32x32_2x2_8x32x1_8x32x1_1x32x1x8_8_1x1_intrawave_v3,1435.46,502.31,0.0
256,20484,3072,6144,ck,0,0,530.0653,a8w8_blockscale_1x128x128_256x128x128x128_16x16_32x32_2x2_8x32x1_8x32x1_1x32x1x8_8_1x1_intrawave_v3,1458.77,510.47,0.0
256,20499,3072,6144,ck,0,0,544.4025,a8w8_blockscale_1x128x128_256x128x128x128_16x16_32x32_2x2_8x32x1_8x32x1_1x32x1x8_8_1x1_intrawave_v3,1421.4,497.36,0.0
256,20518,3072,6144,ck,0,0,545.1131,a8w8_blockscale_1x128x128_256x128x128x128_16x16_32x32_2x2_8x32x1_8x32x1_1x32x1x8_8_1x1_intrawave_v3,1420.86,497.14,0.0
256,20539,3072,6144,ck,0,0,534.1201,a8w8_blockscale_1x128x128_256x128x128x128_16x16_32x32_2x2_8x32x1_8x32x1_1x32x1x8_8_1x1_intrawave_v3,1451.59,507.86,0.0
256,20554,3072,3072,ck,0,0,284.6874,a8w8_blockscale_1x128x128_256x128x128x128_16x16_32x32_2x2_8x32x1_8x32x1_1x32x1x8_8_1x1_intrawave_v3,1362.7,698.53,0.0
256,20585,3072,3072,ck,0,0,285.3638,a8w8_blockscale_1x128x128_256x128x128x128_16x16_32x32_2x2_8x32x1_8x32x1_1x32x1x8_8_1x1_intrawave_v3,1361.52,697.88,0.0
256,20597,3072,3072,ck,0,0,284.6798,a8w8_blockscale_1x128x128_256x128x128x128_16x16_32x32_2x2_8x32x1_8x32x1_1x32x1x8_8_1x1_intrawave_v3,1365.59,699.94,0.0
256,20598,3072,6144,ck,0,0,537.1457,a8w8_blockscale_1x128x128_256x128x128x128_16x16_32x32_2x2_8x32x1_8x32x1_1x32x1x8_8_1x1_intrawave_v3,1447.56,506.35,0.0
256,20605,3072,6144,ck,0,0,543.4549,a8w8_blockscale_1x128x128_256x128x128x128_16x16_32x32_2x2_8x32x1_8x32x1_1x32x1x8_8_1x1_intrawave_v3,1431.24,500.63,0.0
256,20606,3072,6144,ck,0,0,534.6429,a8w8_blockscale_1x128x128_256x128x128x128_16x16_32x32_2x2_8x32x1_8x32x1_1x32x1x8_8_1x1_intrawave_v3,1454.9,508.9,0.0
256,20607,3072,6144,ck,0,0,530.2925,a8w8_blockscale_1x128x128_256x128x128x128_16x16_32x32_2x2_8x32x1_8x32x1_1x32x1x8_8_1x1_intrawave_v3,1466.9,513.1,0.0
256,20608,3072,6144,ck,0,0,531.0093,a8w8_blockscale_1x128x128_256x128x128x128_16x16_32x32_2x2_8x32x1_8x32x1_1x32x1x8_8_1x1_intrawave_v3,1464.99,512.43,0.0
256,20628,3072,6144,ck,0,0,532.5429,a8w8_blockscale_1x128x128_256x128x128x128_16x16_32x32_2x2_8x32x1_8x32x1_1x32x1x8_8_1x1_intrawave_v3,1462.19,511.42,0.0
256,20630,3072,6144,ck,0,0,533.0557,a8w8_blockscale_1x128x128_256x128x128x128_16x16_32x32_2x2_8x32x1_8x32x1_1x32x1x8_8_1x1_intrawave_v3,1460.93,510.97,0.0
256,20632,3072,6144,ck,0,0,538.0515,a8w8_blockscale_1x128x128_256x128x128x128_16x16_32x32_2x2_8x32x1_8x32x1_1x32x1x8_8_1x1_intrawave_v3,1447.5,506.27,0.0
256,20634,3072,6144,ck,0,0,541.1909,a8w8_blockscale_1x128x128_256x128x128x128_16x16_32x32_2x2_8x32x1_8x32x1_1x32x1x8_8_1x1_intrawave_v3,1439.25,503.38,0.0
256,20636,3072,6144,ck,0,0,539.6757,a8w8_blockscale_1x128x128_256x128x128x128_16x16_32x32_2x2_8x32x1_8x32x1_1x32x1x8_8_1x1_intrawave_v3,1443.43,504.84,0.0
256,20637,3072,6144,ck,0,0,540.1005,a8w8_blockscale_1x128x128_256x128x128x128_16x16_32x32_2x2_8x32x1_8x32x1_1x32x1x8_8_1x1_intrawave_v3,1442.36,504.47,0.0
256,20639,3072,6144,ck,0,0,546.0237,a8w8_blockscale_1x128x128_256x128x128x128_16x16_32x32_2x2_8x32x1_8x32x1_1x32x1x8_8_1x1_intrawave_v3,1426.85,499.04,0.0
256,20640,3072,6144,ck,0,0,535.4696,a8w8_blockscale_1x128x128_256x128x128x128_16x16_32x32_2x2_8x32x1_8x32x1_1x32x1x8_8_1x1_intrawave_v3,1455.05,508.9,0.0
256,20645,3072,3072,ck,0,0,289.5227,a8w8_blockscale_1x128x128_256x128x128x128_16x16_32x32_2x2_8x32x1_8x32x1_1x32x1x8_8_1x1_intrawave_v3,1345.87,689.76,0.0
256,20649,3072,3072,ck,0,0,285.5646,a8w8_blockscale_1x128x128_256x128x128x128_16x16_32x32_2x2_8x32x1_8x32x1_1x32x1x8_8_1x1_intrawave_v3,1364.79,699.45,0.0
256,20650,3072,3072,ck,0,0,284.9082,a8w8_blockscale_1x128x128_256x128x128x128_16x16_32x32_2x2_8x32x1_8x32x1_1x32x1x8_8_1x1_intrawave_v3,1368.0,701.09,0.0
256,20653,3072,3072,ck,0,0,285.2914,a8w8_blockscale_1x128x128_256x128x128x128_16x16_32x32_2x2_8x32x1_8x32x1_1x32x1x8_8_1x1_intrawave_v3,1366.37,700.25,0.0
256,20658,3072,3072,ck,0,0,279.6418,a8w8_blockscale_1x128x128_256x128x128x128_16x16_32x32_2x2_8x32x1_8x32x1_1x32x1x8_8_1x1_intrawave_v3,1394.31,714.56,0.0
256,20673,3072,6144,ck,0,0,537.9013,a8w8_blockscale_1x128x128_256x128x128x128_16x16_32x32_2x2_8x32x1_8x32x1_1x32x1x8_8_1x1_intrawave_v3,1450.79,507.35,0.0
256,20684,3072,3072,ck,0,0,281.4918,a8w8_blockscale_1x128x128_256x128x128x128_16x16_32x32_2x2_8x32x1_8x32x1_1x32x1x8_8_1x1_intrawave_v3,1386.89,710.72,0.0
256,20685,3072,3072,ck,0,0,286.641,a8w8_blockscale_1x128x128_256x128x128x128_16x16_32x32_2x2_8x32x1_8x32x1_1x32x1x8_8_1x1_intrawave_v3,1362.04,697.98,0.0
256,20697,3072,6144,ck,0,0,552.0657,a8w8_blockscale_1x128x128_256x128x128x128_16x16_32x32_2x2_8x32x1_8x32x1_1x32x1x8_8_1x1_intrawave_v3,1415.2,494.87,0.0
256,20698,3072,6144,ck,0,0,534.6729,a8w8_blockscale_1x128x128_256x128x128x128_16x16_32x32_2x2_8x32x1_8x32x1_1x32x1x8_8_1x1_intrawave_v3,1461.31,510.99,0.0
256,20720,3072,6144,ck,0,0,541.0781,a8w8_blockscale_1x128x128_256x128x128x128_16x16_32x32_2x2_8x32x1_8x32x1_1x32x1x8_8_1x1_intrawave_v3,1445.55,505.44,0.0
256,20721,3072,6144,ck,0,0,531.3097,a8w8_blockscale_1x128x128_256x128x128x128_16x16_32x32_2x2_8x32x1_8x32x1_1x32x1x8_8_1x1_intrawave_v3,1472.2,514.75,0.0
256,20741,3072,3072,ck,0,0,285.6894,a8w8_blockscale_1x128x128_256x128x128x128_16x16_32x32_2x2_8x32x1_8x32x1_1x32x1x8_8_1x1_intrawave_v3,1370.28,702.11,0.0
256,20742,3072,6144,ck,0,0,536.8579,a8w8_blockscale_1x128x128_256x128x128x128_16x16_32x32_2x2_8x32x1_8x32x1_1x32x1x8_8_1x1_intrawave_v3,1458.46,509.92,0.0
256,20744,3072,6144,ck,0,0,534.3575,a8w8_blockscale_1x128x128_256x128x128x128_16x16_32x32_2x2_8x32x1_8x32x1_1x32x1x8_8_1x1_intrawave_v3,1465.42,512.35,0.0
256,20745,3072,6144,ck,0,0,543.3982,a8w8_blockscale_1x128x128_256x128x128x128_16x16_32x32_2x2_8x32x1_8x32x1_1x32x1x8_8_1x1_intrawave_v3,1441.11,503.85,0.0
256,20758,3072,3072,ck,0,0,287.4638,a8w8_blockscale_1x128x128_256x128x128x128_16x16_32x32_2x2_8x32x1_8x32x1_1x32x1x8_8_1x1_intrawave_v3,1362.93,698.32,0.0
256,20767,3072,6144,ck,0,0,540.572,a8w8_blockscale_1x128x128_256x128x128x128_16x16_32x32_2x2_8x32x1_8x32x1_1x32x1x8_8_1x1_intrawave_v3,1450.18,506.98,0.0
256,20790,3072,6144,ck,0,0,547.1601,a8w8_blockscale_1x128x128_256x128x128x128_16x16_32x32_2x2_8x32x1_8x32x1_1x32x1x8_8_1x1_intrawave_v3,1434.31,501.39,0.0
256,20802,3072,6144,ck,0,0,545.8303,a8w8_blockscale_1x128x128_256x128x128x128_16x16_32x32_2x2_8x32x1_8x32x1_1x32x1x8_8_1x1_intrawave_v3,1438.63,502.88,0.0
256,20804,3072,6144,ck,0,0,537.332,a8w8_blockscale_1x128x128_256x128x128x128_16x16_32x32_2x2_8x32x1_8x32x1_1x32x1x8_8_1x1_intrawave_v3,1461.53,510.88,0.0
256,20813,3072,6144,ck,0,0,547.2438,a8w8_blockscale_1x128x128_256x128x128x128_16x16_32x32_2x2_8x32x1_8x32x1_1x32x1x8_8_1x1_intrawave_v3,1435.68,501.83,0.0
256,20825,3072,3072,ck,0,0,292.2783,a8w8_blockscale_1x128x128_256x128x128x128_16x16_32x32_2x2_8x32x1_8x32x1_1x32x1x8_8_1x1_intrawave_v3,1344.81,688.93,0.0
256,20832,3072,6144,ck,0,0,544.5188,a8w8_blockscale_1x128x128_256x128x128x128_16x16_32x32_2x2_8x32x1_8x32x1_1x32x1x8_8_1x1_intrawave_v3,1444.18,504.77,0.0
256,20835,3072,6144,ck,0,0,546.3554,a8w8_blockscale_1x128x128_256x128x128x128_16x16_32x32_2x2_8x32x1_8x32x1_1x32x1x8_8_1x1_intrawave_v3,1439.53,503.14,0.0
256,20836,3072,6144,ck,0,0,552.1481,a8w8_blockscale_1x128x128_256x128x128x128_16x16_32x32_2x2_8x32x1_8x32x1_1x32x1x8_8_1x1_intrawave_v3,1424.5,497.89,0.0
256,20837,3072,6144,ck,0,0,536.1136,a8w8_blockscale_1x128x128_256x128x128x128_16x16_32x32_2x2_8x32x1_8x32x1_1x32x1x8_8_1x1_intrawave_v3,1467.17,512.8,0.0
256,20838,3072,6144,ck,0,0,545.272,a8w8_blockscale_1x128x128_256x128x128x128_16x16_32x32_2x2_8x32x1_8x32x1_1x32x1x8_8_1x1_intrawave_v3,1442.6,504.21,0.0
256,20839,3072,6144,ck,0,0,543.2337,a8w8_blockscale_1x128x128_256x128x128x128_16x16_32x32_2x2_8x32x1_8x32x1_1x32x1x8_8_1x1_intrawave_v3,1448.08,506.12,0.0
256,20840,3072,6144,ck,0,0,540.1449,a8w8_blockscale_1x128x128_256x128x128x128_16x16_32x32_2x2_8x32x1_8x32x1_1x32x1x8_8_1x1_intrawave_v3,1456.43,509.04,0.0
256,20841,3072,6144,ck,0,0,532.9188,a8w8_blockscale_1x128x128_256x128x128x128_16x16_32x32_2x2_8x32x1_8x32x1_1x32x1x8_8_1x1_intrawave_v3,1476.25,515.97,0.0
256,20842,3072,6144,ck,0,0,541.2727,a8w8_blockscale_1x128x128_256x128x128x128_16x16_32x32_2x2_8x32x1_8x32x1_1x32x1x8_8_1x1_intrawave_v3,1453.54,508.03,0.0
256,20843,3072,6144,ck,0,0,548.2701,a8w8_blockscale_1x128x128_256x128x128x128_16x16_32x32_2x2_8x32x1_8x32x1_1x32x1x8_8_1x1_intrawave_v3,1435.05,501.57,0.0
256,20844,3072,6144,ck,0,0,543.6209,a8w8_blockscale_1x128x128_256x128x128x128_16x16_32x32_2x2_8x32x1_8x32x1_1x32x1x8_8_1x1_intrawave_v3,1447.4,505.88,0.0
256,20845,3072,6144,ck,0,0,537.3296,a8w8_blockscale_1x128x128_256x128x128x128_16x16_32x32_2x2_8x32x1_8x32x1_1x32x1x8_8_1x1_intrawave_v3,1464.41,511.82,0.0
256,20846,3072,6144,ck,0,0,543.1509,a8w8_blockscale_1x128x128_256x128x128x128_16x16_32x32_2x2_8x32x1_8x32x1_1x32x1x8_8_1x1_intrawave_v3,1448.79,506.36,0.0
256,20848,3072,6144,ck,0,0,554.5022,a8w8_blockscale_1x128x128_256x128x128x128_16x16_32x32_2x2_8x32x1_8x32x1_1x32x1x8_8_1x1_intrawave_v3,1419.27,496.04,0.0
256,20850,3072,6144,ck,0,0,549.0185,a8w8_blockscale_1x128x128_256x128x128x128_16x16_32x32_2x2_8x32x1_8x32x1_1x32x1x8_8_1x1_intrawave_v3,1433.58,501.04,0.0
256,20852,3072,6144,ck,0,0,546.2232,a8w8_blockscale_1x128x128_256x128x128x128_16x16_32x32_2x2_8x32x1_8x32x1_1x32x1x8_8_1x1_intrawave_v3,1441.05,503.65,0.0
256,20854,3072,6144,ck,0,0,536.3323,a8w8_blockscale_1x128x128_256x128x128x128_16x16_32x32_2x2_8x32x1_8x32x1_1x32x1x8_8_1x1_intrawave_v3,1467.77,512.98,0.0
256,20856,3072,6144,ck,0,0,542.6441,a8w8_blockscale_1x128x128_256x128x128x128_16x16_32x32_2x2_8x32x1_8x32x1_1x32x1x8_8_1x1_intrawave_v3,1450.84,507.06,0.0
256,20858,3072,6144,ck,0,0,538.3676,a8w8_blockscale_1x128x128_256x128x128x128_16x16_32x32_2x2_8x32x1_8x32x1_1x32x1x8_8_1x1_intrawave_v3,1462.5,511.13,0.0
256,20859,3072,6144,ck,0,0,537.2212,a8w8_blockscale_1x128x128_256x128x128x128_16x16_32x32_2x2_8x32x1_8x32x1_1x32x1x8_8_1x1_intrawave_v3,1465.69,512.25,0.0
256,20860,3072,6144,ck,0,0,543.7689,a8w8_blockscale_1x128x128_256x128x128x128_16x16_32x32_2x2_8x32x1_8x32x1_1x32x1x8_8_1x1_intrawave_v3,1448.11,506.1,0.0
256,20862,3072,6144,ck,0,0,541.818,a8w8_blockscale_1x128x128_256x128x128x128_16x16_32x32_2x2_8x32x1_8x32x1_1x32x1x8_8_1x1_intrawave_v3,1453.47,507.97,0.0
256,20882,3072,6144,ck,0,0,536.9412,a8w8_blockscale_1x128x128_256x128x128x128_16x16_32x32_2x2_8x32x1_8x32x1_1x32x1x8_8_1x1_intrawave_v3,1468.07,513.04,0.0
256,20931,3072,3072,ck,0,0,288.1162,a8w8_blockscale_1x128x128_256x128x128x128_16x16_32x32_2x2_8x32x1_8x32x1_1x32x1x8_8_1x1_intrawave_v3,1371.18,702.28,0.0
256,21002,3072,3072,ck,0,0,288.8754,a8w8_blockscale_1x128x128_256x128x128x128_16x16_32x32_2x2_8x32x1_8x32x1_1x32x1x8_8_1x1_intrawave_v3,1372.22,702.7,0.0
256,21009,3072,6144,ck,0,0,548.3149,a8w8_blockscale_1x128x128_256x128x128x128_16x16_32x32_2x2_8x32x1_8x32x1_1x32x1x8_8_1x1_intrawave_v3,1446.36,505.24,0.0
256,21015,3072,3072,ck,0,0,295.1043,a8w8_blockscale_1x128x128_256x128x128x128_16x16_32x32_2x2_8x32x1_8x32x1_1x32x1x8_8_1x1_intrawave_v3,1344.08,688.27,0.0
256,21016,3072,6144,ck,0,0,547.7234,a8w8_blockscale_1x128x128_256x128x128x128_16x16_32x32_2x2_8x32x1_8x32x1_1x32x1x8_8_1x1_intrawave_v3,1448.41,505.95,0.0
256,21018,3072,6144,ck,0,0,537.7063,a8w8_blockscale_1x128x128_256x128x128x128_16x16_32x32_2x2_8x32x1_8x32x1_1x32x1x8_8_1x1_intrawave_v3,1475.53,515.42,0.0
256,21020,3072,6144,ck,0,0,549.819,a8w8_blockscale_1x128x128_256x128x128x128_16x16_32x32_2x2_8x32x1_8x32x1_1x32x1x8_8_1x1_intrawave_v3,1443.16,504.11,0.0
256,21039,3072,6144,ck,0,0,552.0674,a8w8_blockscale_1x128x128_256x128x128x128_16x16_32x32_2x2_8x32x1_8x32x1_1x32x1x8_8_1x1_intrawave_v3,1438.58,502.48,0.0
256,21042,3072,6144,ck,0,0,540.5601,a8w8_blockscale_1x128x128_256x128x128x128_16x16_32x32_2x2_8x32x1_8x32x1_1x32x1x8_8_1x1_intrawave_v3,1469.42,513.24,0.0
256,21044,3072,6144,ck,0,0,533.3084,a8w8_blockscale_1x128x128_256x128x128x128_16x16_32x32_2x2_8x32x1_8x32x1_1x32x1x8_8_1x1_intrawave_v3,1489.54,520.27,0.0
256,21046,3072,6144,ck,0,0,544.324,a8w8_blockscale_1x128x128_256x128x128x128_16x16_32x32_2x2_8x32x1_8x32x1_1x32x1x8_8_1x1_intrawave_v3,1459.53,509.78,0.0
