aiter/configs/a8w8_blockscale_tuned_gemm.csv
cu_num,M,N,K,libtype,kernelId,splitK,us,kernelName,tflops,bw,errRatio
256,8192,512,7168,ck,0,0,64.1614,a8w8_blockscale_1x128x128_256x128x128x128_16x16_32x32_2x2_8x32x1_8x32x1_1x32x1x8_8_1x1_intrawave_v3,937.16,1103.14,0.0
256,16384,512,7168,cktile,11,0,98.713,a8w8_blockscale_cktile_192x256x128_4x2x1_16x16x128_intrawave_0x1x0_1,1218.27,1396.85,0.0
256,20480,512,7168,cktile,11,0,106.7764,a8w8_blockscale_cktile_192x256x128_4x2x1_16x16x128_intrawave_0x1x0_1,1407.84,1605.62,0.0
256,128,1024,4096,ck,8,0,13.7599,a8w8_blockscale_1x128x128_256x16x64x256_16x16_16x16_1x1_16x16x1_16x16x1_1x16x1x16_4_1x1_intrawave_v1,78.03,361.97,0.0
256,128,4096,1280,ck,7,0,7.4194,a8w8_blockscale_1x128x128_256x16x128x256_16x16_16x16_1x2_16x16x1_16x16x1_1x16x1x16_8_1x2_intrawave_v1,180.9,870.06,0.0
256,1,6144,1536,ck,8,0,7.1539,a8w8_blockscale_1x128x128_256x16x64x256_16x16_16x16_1x1_16x16x1_16x16x1_1x16x1x16_4_1x1_intrawave_v1,2.64,1321.1,0.0
256,2,6144,1536,ck,8,0,8.5218,a8w8_blockscale_1x128x128_256x16x64x256_16x16_16x16_1x1_16x16x1_16x16x1_1x16x1x16_4_1x1_intrawave_v1,4.43,1110.66,0.0
256,4,6144,1536,ck,8,0,7.2587,a8w8_blockscale_1x128x128_256x16x64x256_16x16_16x16_1x1_16x16x1_16x16x1_1x16x1x16_4_1x1_intrawave_v1,10.4,1307.74,0.0
256,8,6144,1536,ck,8,0,8.3403,a8w8_blockscale_1x128x128_256x16x64x256_16x16_16x16_1x1_16x16x1_16x16x1_1x16x1x16_4_1x1_intrawave_v1,18.1,1144.78,0.0
256,16,6144,1536,ck,8,0,6.4172,a8w8_blockscale_1x128x128_256x16x64x256_16x16_16x16_1x1_16x16x1_16x16x1_1x16x1x16_4_1x1_intrawave_v1,47.06,1505.08,0.0
256,24,6144,1536,ck,8,0,8.0134,a8w8_blockscale_1x128x128_256x16x64x256_16x16_16x16_1x1_16x16x1_16x16x1_1x16x1x16_4_1x1_intrawave_v1,56.53,1219.08,0.0
256,32,6144,1536,ck,8,0,7.7103,a8w8_blockscale_1x128x128_256x16x64x256_16x16_16x16_1x1_16x16x1_16x16x1_1x16x1x16_4_1x1_intrawave_v1,78.33,1281.34,0.0
256,40,6144,1536,ck,7,0,8.7377,a8w8_blockscale_1x128x128_256x16x128x256_16x16_16x16_1x2_16x16x1_16x16x1_1x16x1x16_8_1x2_intrawave_v1,86.4,1143.34,0.0
256,48,6144,1536,ck,13,0,9.4861,a8w8_blockscale_1x128x128_256x32x64x256_16x16_16x16_2x1_16x16x1_16x16x1_1x32x1x8_8_2x1_intrawave_v1,95.5,1064.79,0.0
256,56,6144,1536,ck,13,0,9.631,a8w8_blockscale_1x128x128_256x32x64x256_16x16_16x16_2x1_16x16x1_16x16x1_1x32x1x8_8_2x1_intrawave_v1,109.75,1060.26,0.0
256,64,6144,1536,ck,13,0,9.7344,a8w8_blockscale_1x128x128_256x32x64x256_16x16_16x16_2x1_16x16x1_16x16x1_1x32x1x8_8_2x1_intrawave_v1,124.09,1060.36,0.0
256,72,6144,1536,ck,7,0,9.8019,a8w8_blockscale_1x128x128_256x16x128x256_16x16_16x16_1x2_16x16x1_16x16x1_1x16x1x16_8_1x2_intrawave_v1,138.64,1064.34,0.0
256,80,6144,1536,ck,7,0,9.3032,a8w8_blockscale_1x128x128_256x16x128x256_16x16_16x16_1x2_16x16x1_16x16x1_1x16x1x16_8_1x2_intrawave_v1,162.3,1133.28,0.0
256,88,6144,1536,ck,18,0,10.4617,a8w8_blockscale_1x128x128_256x64x64x256_16x16_32x32_1x1_16x16x1_16x16x1_1x32x1x8_8_1x1_intrawave_v1,158.76,1018.35,0.0
256,96,6144,1536,ck,12,0,10.1477,a8w8_blockscale_1x128x128_256x32x128x256_16x16_32x32_1x1_16x16x1_16x16x1_1x32x1x8_8_1x1_intrawave_v1,178.56,1060.76,0.0
256,104,6144,1536,ck,18,0,10.4216,a8w8_blockscale_1x128x128_256x64x64x256_16x16_32x32_1x1_16x16x1_16x16x1_1x32x1x8_8_1x1_intrawave_v1,188.35,1043.49,0.0
256,112,6144,1536,ck,18,0,10.3916,a8w8_blockscale_1x128x128_256x64x64x256_16x16_32x32_1x1_16x16x1_16x16x1_1x32x1x8_8_1x1_intrawave_v1,203.43,1057.15,0.0
256,120,6144,1536,ck,18,0,10.5174,a8w8_blockscale_1x128x128_256x64x64x256_16x16_32x32_1x1_16x16x1_16x16x1_1x32x1x8_8_1x1_intrawave_v1,215.35,1055.02,0.0
256,128,6144,1536,ck,18,0,9.9203,a8w8_blockscale_1x128x128_256x64x64x256_16x16_32x32_1x1_16x16x1_16x16x1_1x32x1x8_8_1x1_intrawave_v1,243.53,1129.67,0.0
256,136,6144,1536,ck,12,0,11.1413,a8w8_blockscale_1x128x128_256x32x128x256_16x16_32x32_1x1_16x16x1_16x16x1_1x32x1x8_8_1x1_intrawave_v1,230.4,1015.79,0.0
256,144,6144,1536,ck,12,0,11.0706,a8w8_blockscale_1x128x128_256x32x128x256_16x16_32x32_1x1_16x16x1_16x16x1_1x32x1x8_8_1x1_intrawave_v1,245.51,1032.27,0.0
256,152,6144,1536,ck,12,0,11.1858,a8w8_blockscale_1x128x128_256x32x128x256_16x16_32x32_1x1_16x16x1_16x16x1_1x32x1x8_8_1x1_intrawave_v1,256.48,1031.52,0.0
256,160,6144,1536,ck,12,0,10.3991,a8w8_blockscale_1x128x128_256x32x128x256_16x16_32x32_1x1_16x16x1_16x16x1_1x32x1x8_8_1x1_intrawave_v1,290.4,1120.2,0.0
256,168,6144,1536,ck,2,0,13.33,a8w8_blockscale_1x128x128_256x64x128x128_16x16_32x32_1x2_8x32x1_8x32x1_1x32x1x8_8_1x1_intrawave_v3,237.88,882.19,0.0
256,176,6144,1536,ck,2,0,13.37,a8w8_blockscale_1x128x128_256x64x128x128_16x16_32x32_1x2_8x32x1_8x32x1_1x32x1x8_8_1x1_intrawave_v3,248.46,887.82,0.0
256,184,6144,1536,ck,2,0,13.3839,a8w8_blockscale_1x128x128_256x64x128x128_16x16_32x32_1x2_8x32x1_8x32x1_1x32x1x8_8_1x1_intrawave_v3,259.48,895.17,0.0
256,192,6144,1536,ck,2,0,12.9865,a8w8_blockscale_1x128x128_256x64x128x128_16x16_32x32_1x2_8x32x1_8x32x1_1x32x1x8_8_1x1_intrawave_v3,279.05,931.07,0.0
256,200,6144,1536,ck,2,0,13.5133,a8w8_blockscale_1x128x128_256x64x128x128_16x16_32x32_1x2_8x32x1_8x32x1_1x32x1x8_8_1x1_intrawave_v3,279.35,902.96,0.0
256,208,6144,1536,ck,2,0,13.3328,a8w8_blockscale_1x128x128_256x64x128x128_16x16_32x32_1x2_8x32x1_8x32x1_1x32x1x8_8_1x1_intrawave_v3,294.45,923.48,0.0
256,216,6144,1536,ck,2,0,13.3114,a8w8_blockscale_1x128x128_256x64x128x128_16x16_32x32_1x2_8x32x1_8x32x1_1x32x1x8_8_1x1_intrawave_v3,306.27,933.27,0.0
256,224,6144,1536,ck,2,0,13.6133,a8w8_blockscale_1x128x128_256x64x128x128_16x16_32x32_1x2_8x32x1_8x32x1_1x32x1x8_8_1x1_intrawave_v3,310.57,920.7,0.0
256,232,6144,1536,ck,2,0,13.3853,a8w8_blockscale_1x128x128_256x64x128x128_16x16_32x32_1x2_8x32x1_8x32x1_1x32x1x8_8_1x1_intrawave_v3,327.14,944.64,0.0
256,240,6144,1536,ck,2,0,13.4108,a8w8_blockscale_1x128x128_256x64x128x128_16x16_32x32_1x2_8x32x1_8x32x1_1x32x1x8_8_1x1_intrawave_v3,337.78,951.09,0.0
256,248,6144,1536,ck,2,0,13.6967,a8w8_blockscale_1x128x128_256x64x128x128_16x16_32x32_1x2_8x32x1_8x32x1_1x32x1x8_8_1x1_intrawave_v3,341.75,939.32,0.0
256,256,6144,1536,ck,2,0,13.3839,a8w8_blockscale_1x128x128_256x64x128x128_16x16_32x32_1x2_8x32x1_8x32x1_1x32x1x8_8_1x1_intrawave_v3,361.02,969.53,0.0
256,272,6144,1536,ck,2,0,13.6069,a8w8_blockscale_1x128x128_256x64x128x128_16x16_32x32_1x2_8x32x1_8x32x1_1x32x1x8_8_1x1_intrawave_v3,377.3,969.9,0.0
256,288,6144,1536,ck,2,0,13.7957,a8w8_blockscale_1x128x128_256x64x128x128_16x16_32x32_1x2_8x32x1_8x32x1_1x32x1x8_8_1x1_intrawave_v3,394.02,972.66,0.0
256,304,6144,1536,ck,2,0,13.7961,a8w8_blockscale_1x128x128_256x64x128x128_16x16_32x32_1x2_8x32x1_8x32x1_1x32x1x8_8_1x1_intrawave_v3,415.9,988.66,0.0
256,320,6144,1536,ck,2,0,13.538,a8w8_blockscale_1x128x128_256x64x128x128_16x16_32x32_1x2_8x32x1_8x32x1_1x32x1x8_8_1x1_intrawave_v3,446.14,1023.85,0.0
256,336,6144,1536,ck,3,0,17.0201,a8w8_blockscale_1x128x128_256x64x64x128_16x16_32x32_1x1_8x32x1_8x32x1_1x32x1x8_8_1x1_intrawave_v3,372.61,827.38,0.0
256,352,6144,1536,ck,3,0,16.803,a8w8_blockscale_1x128x128_256x64x64x128_16x16_32x32_1x1_8x32x1_8x32x1_1x32x1x8_8_1x1_intrawave_v3,395.39,851.23,0.0
256,368,6144,1536,ck,3,0,16.9094,a8w8_blockscale_1x128x128_256x64x64x128_16x16_32x32_1x1_8x32x1_8x32x1_1x32x1x8_8_1x1_intrawave_v3,410.76,858.96,0.0
256,384,6144,1536,ck,3,0,16.9846,a8w8_blockscale_1x128x128_256x64x64x128_16x16_32x32_1x1_8x32x1_8x32x1_1x32x1x8_8_1x1_intrawave_v3,426.73,868.17,0.0
256,400,6144,1536,ck,0,0,17.4597,a8w8_blockscale_1x128x128_256x128x128x128_16x16_32x32_2x2_8x32x1_8x32x1_1x32x1x8_8_1x1_intrawave_v3,432.41,857.22,0.0
256,416,6144,1536,ck,0,0,17.5764,a8w8_blockscale_1x128x128_256x128x128x128_16x16_32x32_2x2_8x32x1_8x32x1_1x32x1x8_8_1x1_intrawave_v3,446.72,864.11,0.0
256,432,6144,1536,ck,0,0,17.6235,a8w8_blockscale_1x128x128_256x128x128x128_16x16_32x32_2x2_8x32x1_8x32x1_1x32x1x8_8_1x1_intrawave_v3,462.66,874.35,0.0
256,448,6144,1536,ck,0,0,17.5664,a8w8_blockscale_1x128x128_256x128x128x128_16x16_32x32_2x2_8x32x1_8x32x1_1x32x1x8_8_1x1_intrawave_v3,481.36,889.79,0.0
256,464,6144,1536,ck,0,0,17.7583,a8w8_blockscale_1x128x128_256x128x128x128_16x16_32x32_2x2_8x32x1_8x32x1_1x32x1x8_8_1x1_intrawave_v3,493.16,892.63,0.0
256,480,6144,1536,ck,0,0,17.8613,a8w8_blockscale_1x128x128_256x128x128x128_16x16_32x32_2x2_8x32x1_8x32x1_1x32x1x8_8_1x1_intrawave_v3,507.22,899.86,0.0
256,496,6144,1536,ck,0,0,17.9719,a8w8_blockscale_1x128x128_256x128x128x128_16x16_32x32_2x2_8x32x1_8x32x1_1x32x1x8_8_1x1_intrawave_v3,520.91,906.63,0.0
256,512,6144,1536,ck,0,0,17.2783,a8w8_blockscale_1x128x128_256x128x128x128_16x16_32x32_2x2_8x32x1_8x32x1_1x32x1x8_8_1x1_intrawave_v3,559.3,955.83,0.0
256,621,6144,1536,ck,0,0,18.5311,a8w8_blockscale_1x128x128_256x128x128x128_16x16_32x32_2x2_8x32x1_8x32x1_1x32x1x8_8_1x1_intrawave_v3,632.5,972.52,0.0
256,677,6144,1536,ck,2,0,25.065,a8w8_blockscale_1x128x128_256x64x128x128_16x16_32x32_1x2_8x32x1_8x32x1_1x32x1x8_8_1x1_intrawave_v3,509.79,749.89,0.0
256,814,6144,1536,ck,2,0,25.9372,a8w8_blockscale_1x128x128_256x64x128x128_16x16_32x32_1x2_8x32x1_8x32x1_1x32x1x8_8_1x1_intrawave_v3,592.34,797.69,0.0
256,816,6144,1536,ck,2,0,25.7336,a8w8_blockscale_1x128x128_256x64x128x128_16x16_32x32_1x2_8x32x1_8x32x1_1x32x1x8_8_1x1_intrawave_v3,598.5,805.08,0.0
256,926,6144,1536,ck,2,0,26.6806,a8w8_blockscale_1x128x128_256x64x128x128_16x16_32x32_1x2_8x32x1_8x32x1_1x32x1x8_8_1x1_intrawave_v3,655.07,833.5,0.0
256,962,6144,1536,ck,2,0,26.8078,a8w8_blockscale_1x128x128_256x64x128x128_16x16_32x32_1x2_8x32x1_8x32x1_1x32x1x8_8_1x1_intrawave_v3,677.31,848.11,0.0
256,1000,6144,1536,ck,2,0,26.6328,a8w8_blockscale_1x128x128_256x64x128x128_16x16_32x32_1x2_8x32x1_8x32x1_1x32x1x8_8_1x1_intrawave_v3,708.69,873.4,0.0
256,1003,6144,1536,ck,2,0,27.0048,a8w8_blockscale_1x128x128_256x64x128x128_16x16_32x32_1x2_8x32x1_8x32x1_1x32x1x8_8_1x1_intrawave_v3,701.02,862.91,0.0
256,1054,6144,1536,ck,0,0,27.8513,a8w8_blockscale_1x128x128_256x128x128x128_16x16_32x32_2x2_8x32x1_8x32x1_1x32x1x8_8_1x1_intrawave_v3,714.28,861.99,0.0
256,1063,6144,1536,ck,0,0,27.9409,a8w8_blockscale_1x128x128_256x128x128x128_16x16_32x32_2x2_8x32x1_8x32x1_1x32x1x8_8_1x1_intrawave_v3,718.07,863.68,0.0
256,1218,6144,1536,ck,0,0,28.4734,a8w8_blockscale_1x128x128_256x128x128x128_16x16_32x32_2x2_8x32x1_8x32x1_1x32x1x8_8_1x1_intrawave_v3,807.38,922.78,0.0
256,1255,6144,1536,ck,0,0,28.545,a8w8_blockscale_1x128x128_256x128x128x128_16x16_32x32_2x2_8x32x1_8x32x1_1x32x1x8_8_1x1_intrawave_v3,829.82,938.39,0.0
256,1270,6144,1536,ck,0,0,28.6133,a8w8_blockscale_1x128x128_256x128x128x128_16x16_32x32_2x2_8x32x1_8x32x1_1x32x1x8_8_1x1_intrawave_v3,837.74,943.4,0.0
256,1301,6144,1536,ck,2,0,33.4682,a8w8_blockscale_1x128x128_256x64x128x128_16x16_32x32_1x2_8x32x1_8x32x1_1x32x1x8_8_1x1_intrawave_v3,733.7,819.35,0.0
256,1334,6144,1536,ck,2,0,33.4192,a8w8_blockscale_1x128x128_256x64x128x128_16x16_32x32_1x2_8x32x1_8x32x1_1x32x1x8_8_1x1_intrawave_v3,753.41,834.2,0.0
256,1351,6144,1536,cktile,11,0,38.3759,a8w8_blockscale_cktile_192x256x128_4x2x1_16x16x128_intrawave_0x1x0_1,664.46,732.58,0.0
256,1359,6144,1536,cktile,11,0,38.3593,a8w8_blockscale_cktile_192x256x128_4x2x1_16x16x128_intrawave_0x1x0_1,668.68,735.78,0.0
256,1685,6144,1536,cktile,11,0,38.8047,a8w8_blockscale_cktile_192x256x128_4x2x1_16x16x128_intrawave_0x1x0_1,819.57,843.47,0.0
256,1696,6144,1536,cktile,11,0,38.7176,a8w8_blockscale_cktile_192x256x128_4x2x1_16x16x128_intrawave_0x1x0_1,826.78,849.3,0.0
256,1710,6144,1536,cktile,11,0,38.7724,a8w8_blockscale_cktile_192x256x128_4x2x1_16x16x128_intrawave_0x1x0_1,832.43,853.09,0.0
256,1808,6144,1536,cktile,11,0,38.9531,a8w8_blockscale_cktile_192x256x128_4x2x1_16x16x128_intrawave_0x1x0_1,876.05,883.91,0.0
256,1809,6144,1536,cktile,11,0,38.8921,a8w8_blockscale_cktile_192x256x128_4x2x1_16x16x128_intrawave_0x1x0_1,877.91,885.65,0.0
256,1810,6144,1536,cktile,11,0,38.987,a8w8_blockscale_cktile_192x256x128_4x2x1_16x16x128_intrawave_0x1x0_1,876.26,883.85,0.0
256,1813,6144,1536,cktile,11,0,38.9747,a8w8_blockscale_cktile_192x256x128_4x2x1_16x16x128_intrawave_0x1x0_1,877.99,885.19,0.0
256,1816,6144,1536,cktile,11,0,38.8689,a8w8_blockscale_cktile_192x256x128_4x2x1_16x16x128_intrawave_0x1x0_1,881.83,888.67,0.0
256,1817,6144,1536,cktile,11,0,39.4969,a8w8_blockscale_cktile_192x256x128_4x2x1_16x16x128_intrawave_0x1x0_1,868.29,874.89,0.0
256,1821,6144,1536,cktile,11,0,39.0122,a8w8_blockscale_cktile_192x256x128_4x2x1_16x16x128_intrawave_0x1x0_1,881.01,887.18,0.0
256,1865,6144,1536,cktile,11,0,39.1664,a8w8_blockscale_cktile_192x256x128_4x2x1_16x16x128_intrawave_0x1x0_1,898.75,899.21,0.0
256,1867,6144,1536,cktile,11,0,39.1572,a8w8_blockscale_cktile_192x256x128_4x2x1_16x16x128_intrawave_0x1x0_1,899.92,900.13,0.0
256,1922,6144,1536,ck,0,0,41.1435,a8w8_blockscale_1x128x128_256x128x128x128_16x16_32x32_2x2_8x32x1_8x32x1_1x32x1x8_8_1x1_intrawave_v3,881.71,875.15,0.0
256,2037,6144,1536,ck,0,0,42.413,a8w8_blockscale_1x128x128_256x128x128x128_16x16_32x32_2x2_8x32x1_8x32x1_1x32x1x8_8_1x1_intrawave_v3,906.49,886.44,0.0
256,2040,6144,1536,ck,0,0,42.2017,a8w8_blockscale_1x128x128_256x128x128x128_16x16_32x32_2x2_8x32x1_8x32x1_1x32x1x8_8_1x1_intrawave_v3,912.37,891.86,0.0
