aiter/configs/a8w8_tuned_gemm.csv
cu_num,M,N,K,kernelId,splitK,us,kernelName,tflops,bw,errRatio
256,1,100,5120,34,0,8.7502,a8w8_rowwise_256x16x64x512_16x16_1x1_32x8x1_32x8x1_1x16x1x16_4x4x1_1x1_intrawave_v3,0.12,59.12,0
256,1,200,5120,34,0,9.0193,a8w8_rowwise_256x16x64x512_16x16_1x1_32x8x1_32x8x1_1x16x1x16_4x4x1_1x1_intrawave_v3,0.23,114.15,0
256,1,800,5120,34,0,11.5471,a8w8_rowwise_256x16x64x512_16x16_1x1_32x8x1_32x8x1_1x16x1x16_4x4x1_1x1_intrawave_v3,0.71,355.3,0
256,1,1280,8192,34,0,17.6914,a8w8_rowwise_256x16x64x512_16x16_1x1_32x8x1_32x8x1_1x16x1x16_4x4x1_1x1_intrawave_v3,1.19,593.31,0
256,1,2304,16384,34,0,28.7938,a8w8_rowwise_256x16x64x512_16x16_1x1_32x8x1_32x8x1_1x16x1x16_4x4x1_1x1_intrawave_v3,2.62,1311.73,0
256,1,2560,8192,34,0,17.4658,a8w8_rowwise_256x16x64x512_16x16_1x1_32x8x1_32x8x1_1x16x1x16_4x4x1_1x1_intrawave_v3,2.4,1201.48,0
256,1,4608,16384,34,0,30.4899,a8w8_rowwise_256x16x64x512_16x16_1x1_32x8x1_32x8x1_1x16x1x16_4x4x1_1x1_intrawave_v3,4.95,2476.99,0
256,1,5120,640,79,0,4.3227,a8w8_rowwise_128x16x32x128_16x16_1x1_8x16x1_8x16x1_1x16x1x8_4x4x1_1x1_interwave_v2,1.52,760.56,0
256,1,5120,1280,34,0,6.1049,a8w8_rowwise_256x16x64x512_16x16_1x1_32x8x1_32x8x1_1x16x1x16_4x4x1_1x1_intrawave_v3,2.15,1075.39,0
256,1,5120,3200,30,0,9.8138,a8w8_rowwise_256x32x64x512_16x16_1x2_32x8x1_32x8x1_1x32x1x8_8x8x1_1x2_intrawave_v3,3.34,1670.86,0
256,1,5120,5120,34,0,12.3186,a8w8_rowwise_256x16x64x512_16x16_1x1_32x8x1_32x8x1_1x16x1x16_4x4x1_1x1_intrawave_v3,4.26,2129.28,0
256,1,5120,6400,34,0,14.5779,a8w8_rowwise_256x16x64x512_16x16_1x1_32x8x1_32x8x1_1x16x1x16_4x4x1_1x1_intrawave_v3,4.5,2248.93,0
256,1,5120,25600,23,0,47.1407,a8w8_rowwise_256x64x64x512_32x32_1x1_32x8x1_32x8x1_1x32x1x8_8x8x1_1x1_intrawave_v3,5.56,2781.2,0
256,1,6400,5120,34,0,12.7506,a8w8_rowwise_256x16x64x512_16x16_1x1_32x8x1_32x8x1_1x16x1x16_4x4x1_1x1_intrawave_v3,5.14,2571.32,0
256,1,7168,8192,34,0,19.015,a8w8_rowwise_256x16x64x512_16x16_1x1_32x8x1_32x8x1_1x16x1x16_4x4x1_1x1_intrawave_v3,6.18,3089.29,0
256,1,8192,1024,79,0,5.7218,a8w8_rowwise_128x16x32x128_16x16_1x1_8x16x1_8x16x1_1x16x1x8_4x4x1_1x1_interwave_v2,2.93,1469.12,0
256,1,8192,2048,34,0,7.1625,a8w8_rowwise_256x16x64x512_16x16_1x1_32x8x1_32x8x1_1x16x1x16_4x4x1_1x1_intrawave_v3,4.68,2344.94,0
256,1,8192,3584,34,0,11.2488,a8w8_rowwise_256x16x64x512_16x16_1x1_32x8x1_32x8x1_1x16x1x16_4x4x1_1x1_intrawave_v3,5.22,2611.84,0
256,1,8192,7168,34,0,16.9371,a8w8_rowwise_256x16x64x512_16x16_1x1_32x8x1_32x8x1_1x16x1x16_4x4x1_1x1_intrawave_v3,6.93,3468.35,0
256,1,8192,8192,34,0,19.4709,a8w8_rowwise_256x16x64x512_16x16_1x1_32x8x1_32x8x1_1x16x1x16_4x4x1_1x1_intrawave_v3,6.89,3447.89,0
256,1,8192,28672,34,0,59.8294,a8w8_rowwise_256x16x64x512_16x16_1x1_32x8x1_32x8x1_1x16x1x16_4x4x1_1x1_intrawave_v3,7.85,3926.6,0
256,1,9216,16384,34,0,34.1179,a8w8_rowwise_256x16x64x512_16x16_1x1_32x8x1_32x8x1_1x16x1x16_4x4x1_1x1_intrawave_v3,8.85,4426.7,0
256,1,10240,8192,34,0,20.5574,a8w8_rowwise_256x16x64x512_16x16_1x1_32x8x1_32x8x1_1x16x1x16_4x4x1_1x1_intrawave_v3,8.16,4081.97,0
256,1,12800,5120,34,0,14.7015,a8w8_rowwise_256x16x64x512_16x16_1x1_32x8x1_32x8x1_1x16x1x16_4x4x1_1x1_intrawave_v3,8.92,4459.87,0
256,1,13312,16384,34,0,43.9839,a8w8_rowwise_256x16x64x512_16x16_1x1_32x8x1_32x8x1_1x16x1x16_4x4x1_1x1_intrawave_v3,9.92,4959.7,0
256,1,16384,2048,34,0,8.2219,a8w8_rowwise_256x16x64x512_16x16_1x1_32x8x1_32x8x1_1x16x1x16_4x4x1_1x1_intrawave_v3,8.16,4085.34,0
256,1,16384,4096,34,0,15.9093,a8w8_rowwise_256x16x64x512_16x16_1x1_32x8x1_32x8x1_1x16x1x16_4x4x1_1x1_intrawave_v3,8.44,4220.53,0
256,1,16384,6656,34,0,22.3992,a8w8_rowwise_256x16x64x512_16x16_1x1_32x8x1_32x8x1_1x16x1x16_4x4x1_1x1_intrawave_v3,9.74,4870.32,0
256,1,16384,8192,34,0,29.3945,a8w8_rowwise_256x16x64x512_16x16_1x1_32x8x1_32x8x1_1x16x1x16_4x4x1_1x1_intrawave_v3,9.13,4567.48,0
256,1,16384,13312,34,0,39.0876,a8w8_rowwise_256x16x64x512_16x16_1x1_32x8x1_32x8x1_1x16x1x16_4x4x1_1x1_intrawave_v3,11.16,5581.05,0
256,1,16384,26624,34,0,73.9812,a8w8_rowwise_256x16x64x512_16x16_1x1_32x8x1_32x8x1_1x16x1x16_4x4x1_1x1_intrawave_v3,11.79,5897,0
256,1,26624,16384,34,0,88.2574,a8w8_rowwise_256x16x64x512_16x16_1x1_32x8x1_32x8x1_1x16x1x16_4x4x1_1x1_intrawave_v3,9.88,4943.24,0
256,1,51200,5120,30,0,50.042,a8w8_rowwise_256x32x64x512_16x16_1x2_32x8x1_32x8x1_1x32x1x8_8x8x1_1x2_intrawave_v3,10.48,5240.63,0
256,1,53248,16384,57,0,170.1222,a8w8_rowwise_128x32x16x128_16x16_1x1_8x16x1_8x16x1_1x16x1x8_2x2x1_1x1_intrawave_v2,10.26,5128.89,0
256,1,57344,8192,76,0,88.899,a8w8_rowwise_128x32x16x128_16x16_1x1_8x16x1_8x16x1_1x16x1x8_2x2x1_1x1_interwave_v2,10.57,5285.6,0
256,16,100,5120,34,0,8.7447,a8w8_rowwise_256x16x64x512_16x16_1x1_32x8x1_32x8x1_1x16x1x16_4x4x1_1x1_intrawave_v3,1.87,68.28,0
256,16,200,5120,34,0,10.4705,a8w8_rowwise_256x16x64x512_16x16_1x1_32x8x1_32x8x1_1x16x1x16_4x4x1_1x1_intrawave_v3,3.13,106.23,0
256,16,800,5120,34,0,11.7219,a8w8_rowwise_256x16x64x512_16x16_1x1_32x8x1_32x8x1_1x16x1x16_4x4x1_1x1_intrawave_v3,11.18,358.6,0
256,16,1280,8192,34,0,15.0987,a8w8_rowwise_256x16x64x512_16x16_1x1_32x8x1_32x8x1_1x16x1x16_4x4x1_1x1_intrawave_v3,22.22,705.87,0
256,16,2304,16384,34,0,23.498,a8w8_rowwise_256x16x64x512_16x16_1x1_32x8x1_32x8x1_1x16x1x16_4x4x1_1x1_intrawave_v3,51.41,1620.76,0
256,16,2560,8192,34,0,14.8202,a8w8_rowwise_256x16x64x512_16x16_1x1_32x8x1_32x8x1_1x16x1x16_4x4x1_1x1_intrawave_v3,45.28,1429.43,0
256,16,4608,16384,34,0,25.7089,a8w8_rowwise_256x16x64x512_16x16_1x1_32x8x1_32x8x1_1x16x1x16_4x4x1_1x1_intrawave_v3,93.97,2952.56,0
256,16,5120,640,60,0,4.3842,a8w8_rowwise_128x16x32x128_16x16_1x1_8x16x1_8x16x1_1x16x1x8_4x4x1_1x1_intrawave_v2,23.92,787.12,0
256,16,5120,1280,79,0,6.1038,a8w8_rowwise_128x16x32x128_16x16_1x1_8x16x1_8x16x1_1x16x1x8_4x4x1_1x1_interwave_v2,34.36,1103.89,0
256,16,5120,3200,79,0,9.1289,a8w8_rowwise_128x16x32x128_16x16_1x1_8x16x1_8x16x1_1x16x1x8_4x4x1_1x1_interwave_v2,57.43,1818.3,0
256,16,5120,5120,34,0,11.1363,a8w8_rowwise_256x16x64x512_16x16_1x1_32x8x1_32x8x1_1x16x1x16_4x4x1_1x1_intrawave_v3,75.33,2376.03,0
256,16,5120,6400,34,0,14.8838,a8w8_rowwise_256x16x64x512_16x16_1x1_32x8x1_32x8x1_1x16x1x16_4x4x1_1x1_intrawave_v3,70.45,2219.48,0
256,16,5120,25600,34,0,38.7631,a8w8_rowwise_256x16x64x512_16x16_1x1_32x8x1_32x8x1_1x16x1x16_4x4x1_1x1_intrawave_v3,108.2,3396.15,0
256,16,6400,5120,34,0,11.5523,a8w8_rowwise_256x16x64x512_16x16_1x1_32x8x1_32x8x1_1x16x1x16_4x4x1_1x1_intrawave_v3,90.77,2861.31,0
256,16,7168,8192,34,0,16.6523,a8w8_rowwise_256x16x64x512_16x16_1x1_32x8x1_32x8x1_1x16x1x16_4x4x1_1x1_intrawave_v3,112.84,3547.9,0
256,16,8192,1024,79,0,5.4586,a8w8_rowwise_128x16x32x128_16x16_1x1_8x16x1_8x16x1_1x16x1x8_4x4x1_1x1_interwave_v2,49.18,1587.79,0
256,16,8192,2048,79,0,7.2552,a8w8_rowwise_128x16x32x128_16x16_1x1_8x16x1_8x16x1_1x16x1x8_4x4x1_1x1_interwave_v2,74,2353.09,0
256,16,8192,3584,34,0,10.6477,a8w8_rowwise_256x16x64x512_16x16_1x1_32x8x1_32x8x1_1x16x1x16_4x4x1_1x1_intrawave_v3,88.24,2787.42,0
256,16,8192,7168,34,0,15.2131,a8w8_rowwise_256x16x64x512_16x16_1x1_32x8x1_32x8x1_1x16x1x16_4x4x1_1x1_intrawave_v3,123.52,3884.62,0
256,16,8192,8192,34,0,17.2283,a8w8_rowwise_256x16x64x512_16x16_1x1_32x8x1_32x8x1_1x16x1x16_4x4x1_1x1_intrawave_v3,124.65,3918.09,0
256,16,8192,28672,34,0,55.9502,a8w8_rowwise_256x16x64x512_16x16_1x1_32x8x1_32x8x1_1x16x1x16_4x4x1_1x1_intrawave_v3,134.34,4210.92,0
256,16,9216,16384,34,0,33.174,a8w8_rowwise_256x16x64x512_16x16_1x1_32x8x1_32x8x1_1x16x1x16_4x4x1_1x1_intrawave_v3,145.65,4568.4,0
256,16,10240,8192,34,0,18.6072,a8w8_rowwise_256x16x64x512_16x16_1x1_32x8x1_32x8x1_1x16x1x16_4x4x1_1x1_intrawave_v3,144.26,4532.91,0
256,16,12800,5120,34,0,14.2563,a8w8_rowwise_256x16x64x512_16x16_1x1_32x8x1_32x8x1_1x16x1x16_4x4x1_1x1_intrawave_v3,147.1,4631.46,0
256,16,13312,16384,30,0,45.4589,a8w8_rowwise_256x32x64x512_16x16_1x2_32x8x1_32x8x1_1x32x1x8_8x8x1_1x2_intrawave_v3,153.53,4812.96,0
256,16,16384,2048,34,0,8.2068,a8w8_rowwise_256x16x64x512_16x16_1x1_32x8x1_32x8x1_1x16x1x16_4x4x1_1x1_intrawave_v3,130.84,4156.49,0
256,16,16384,4096,30,0,16.22,a8w8_rowwise_256x32x64x512_16x16_1x2_32x8x1_32x8x1_1x32x1x8_8x8x1_1x2_intrawave_v3,132.4,4173.78,0
256,16,16384,6656,34,0,21.7401,a8w8_rowwise_256x16x64x512_16x16_1x1_32x8x1_32x8x1_1x16x1x16_4x4x1_1x1_intrawave_v3,160.52,5045.18,0
256,16,16384,8192,30,0,29.6526,a8w8_rowwise_256x32x64x512_16x16_1x2_32x8x1_32x8x1_1x32x1x8_8x8x1_1x2_intrawave_v3,144.84,4548.44,0
256,16,16384,13312,34,0,38.6763,a8w8_rowwise_256x16x64x512_16x16_1x1_32x8x1_32x8x1_1x16x1x16_4x4x1_1x1_intrawave_v3,180.45,5658.27,0
256,16,16384,26624,34,0,73.7744,a8w8_rowwise_256x16x64x512_16x16_1x1_32x8x1_32x8x1_1x16x1x16_4x4x1_1x1_intrawave_v3,189.21,5925.6,0
256,16,26624,16384,30,0,86.8898,a8w8_rowwise_256x32x64x512_16x16_1x2_32x8x1_32x8x1_1x32x1x8_8x8x1_1x2_intrawave_v3,160.65,5033.06,0
256,16,51200,5120,30,0,51.7349,a8w8_rowwise_256x32x64x512_16x16_1x2_32x8x1_32x8x1_1x32x1x8_8x8x1_1x2_intrawave_v3,162.15,5100.32,0
256,16,53248,16384,34,0,180.7857,a8w8_rowwise_256x16x64x512_16x16_1x1_32x8x1_32x8x1_1x16x1x16_4x4x1_1x1_intrawave_v3,154.42,4836.56,0
256,16,57344,8192,80,0,90.9234,a8w8_rowwise_128x16x64x128_16x16_1x2_8x16x1_8x16x1_1x16x1x8_4x4x1_1x1_interwave_v2,165.33,5188.19,0
256,32,100,5120,34,0,9.2459,a8w8_rowwise_256x16x64x512_16x16_1x1_32x8x1_32x8x1_1x16x1x16_4x4x1_1x1_intrawave_v3,3.54,73.79,0
256,32,200,5120,34,0,10.4825,a8w8_rowwise_256x16x64x512_16x16_1x1_32x8x1_32x8x1_1x16x1x16_4x4x1_1x1_intrawave_v3,6.25,114.54,0
256,32,800,5120,34,0,11.9874,a8w8_rowwise_256x16x64x512_16x16_1x1_32x8x1_32x8x1_1x16x1x16_4x4x1_1x1_intrawave_v3,21.87,359.63,0
256,32,1280,8192,34,0,14.9955,a8w8_rowwise_256x16x64x512_16x16_1x1_32x8x1_32x8x1_1x16x1x16_4x4x1_1x1_intrawave_v3,44.75,722.2,0
256,32,2304,16384,34,0,23.2436,a8w8_rowwise_256x16x64x512_16x16_1x1_32x8x1_32x8x1_1x16x1x16_4x4x1_1x1_intrawave_v3,103.94,1652.95,0
256,32,2560,8192,34,0,14.7991,a8w8_rowwise_256x16x64x512_16x16_1x1_32x8x1_32x8x1_1x16x1x16_4x4x1_1x1_intrawave_v3,90.69,1445.87,0
256,32,4608,16384,34,0,24.957,a8w8_rowwise_256x16x64x512_16x16_1x1_32x8x1_32x8x1_1x16x1x16_4x4x1_1x1_intrawave_v3,193.61,3057.93,0
256,32,5120,640,79,0,4.5986,a8w8_rowwise_128x16x32x128_16x16_1x1_8x16x1_8x16x1_1x16x1x8_4x4x1_1x1_interwave_v2,45.6,788.27,0
256,32,5120,1280,76,0,6.0464,a8w8_rowwise_128x32x16x128_16x16_1x1_8x16x1_8x16x1_1x16x1x8_2x2x1_1x1_interwave_v2,69.37,1144.85,0
256,32,5120,3200,76,0,10.1191,a8w8_rowwise_128x32x16x128_16x16_1x1_8x16x1_8x16x1_1x16x1x8_2x2x1_1x1_interwave_v2,103.62,1661.62,0
256,32,5120,5120,34,0,10.4248,a8w8_rowwise_256x16x64x512_16x16_1x1_32x8x1_32x8x1_1x16x1x16_4x4x1_1x1_intrawave_v3,160.94,2561.77,0
256,32,5120,6400,34,0,15.0885,a8w8_rowwise_256x16x64x512_16x16_1x1_32x8x1_32x8x1_1x16x1x16_4x4x1_1x1_intrawave_v3,138.99,2207.01,0
256,32,5120,25600,34,0,38.3258,a8w8_rowwise_256x16x64x512_16x16_1x1_32x8x1_32x8x1_1x16x1x16_4x4x1_1x1_intrawave_v3,218.88,3449.87,0
256,32,6400,5120,34,0,10.9816,a8w8_rowwise_256x16x64x512_16x16_1x1_32x8x1_32x8x1_1x16x1x16_4x4x1_1x1_intrawave_v3,190.97,3036.12,0
256,32,7168,8192,34,0,16.942,a8w8_rowwise_256x16x64x512_16x16_1x1_32x8x1_32x8x1_1x16x1x16_4x4x1_1x1_intrawave_v3,221.82,3508.51,0
256,32,8192,1024,79,0,5.6281,a8w8_rowwise_128x16x32x128_16x16_1x1_8x16x1_8x16x1_1x16x1x8_4x4x1_1x1_interwave_v2,95.39,1589.46,0
256,32,8192,2048,76,0,7.2889,a8w8_rowwise_128x32x16x128_16x16_1x1_8x16x1_8x16x1_1x16x1x8_2x2x1_1x1_interwave_v2,147.31,2382.67,0
256,32,8192,3584,34,0,9.4243,a8w8_rowwise_256x16x64x512_16x16_1x1_32x8x1_32x8x1_1x16x1x16_4x4x1_1x1_intrawave_v3,199.38,3183.17,0
256,32,8192,7168,34,0,16.2902,a8w8_rowwise_256x16x64x512_16x16_1x1_32x8x1_32x8x1_1x16x1x16_4x4x1_1x1_intrawave_v3,230.7,3650.9,0
256,32,8192,8192,34,0,17.4586,a8w8_rowwise_256x16x64x512_16x16_1x1_32x8x1_32x8x1_1x16x1x16_4x4x1_1x1_intrawave_v3,246.01,3888.93,0
256,32,8192,28672,34,0,54.7382,a8w8_rowwise_256x16x64x512_16x16_1x1_32x8x1_32x8x1_1x16x1x16_4x4x1_1x1_intrawave_v3,274.62,4317.33,0
256,32,9216,16384,30,0,34.6699,a8w8_rowwise_256x32x64x512_16x16_1x2_32x8x1_32x8x1_1x32x1x8_8x8x1_1x2_intrawave_v3,278.73,4387.35,0
256,32,10240,8192,30,0,20.8953,a8w8_rowwise_256x32x64x512_16x16_1x2_32x8x1_32x8x1_1x32x1x8_8x8x1_1x2_intrawave_v3,256.93,4058.5,0
256,32,12800,5120,30,0,14.9578,a8w8_rowwise_256x32x64x512_16x16_1x2_32x8x1_32x8x1_1x32x1x8_8x8x1_1x2_intrawave_v3,280.41,4447.11,0
256,32,13312,16384,30,0,46.5921,a8w8_rowwise_256x32x64x512_16x16_1x2_32x8x1_32x8x1_1x32x1x8_8x8x1_1x2_intrawave_v3,299.59,4710.67,0
256,32,16384,2048,30,0,10.4352,a8w8_rowwise_256x32x64x512_16x16_1x2_32x8x1_32x8x1_1x32x1x8_8x8x1_1x2_intrawave_v3,205.79,3322.27,0
256,32,16384,4096,30,0,16.4693,a8w8_rowwise_256x32x64x512_16x16_1x2_32x8x1_32x8x1_1x32x1x8_8x8x1_1x2_intrawave_v3,260.79,4146.41,0
256,32,16384,6656,30,0,22.4014,a8w8_rowwise_256x32x64x512_16x16_1x2_32x8x1_32x8x1_1x32x1x8_8x8x1_1x2_intrawave_v3,311.56,4924.4,0
256,32,16384,8192,30,0,30.4324,a8w8_rowwise_256x32x64x512_16x16_1x2_32x8x1_32x8x1_1x32x1x8_8x8x1_1x2_intrawave_v3,282.26,4453.43,0
256,32,16384,13312,30,0,39.8351,a8w8_rowwise_256x32x64x512_16x16_1x2_32x8x1_32x8x1_1x32x1x8_8x8x1_1x2_intrawave_v3,350.41,5512.18,0
256,32,16384,26624,30,0,74.3742,a8w8_rowwise_256x32x64x512_16x16_1x2_32x8x1_32x8x1_1x32x1x8_8x8x1_1x2_intrawave_v3,375.36,5890.59,0
256,32,26624,16384,30,0,89.3239,a8w8_rowwise_256x32x64x512_16x16_1x2_32x8x1_32x8x1_1x32x1x8_8x8x1_1x2_intrawave_v3,312.54,4908.38,0
256,32,51200,5120,30,0,53.9026,a8w8_rowwise_256x32x64x512_16x16_1x2_32x8x1_32x8x1_1x32x1x8_8x8x1_1x2_intrawave_v3,311.25,4927.12,0
256,32,53248,16384,34,0,168.8762,a8w8_rowwise_256x16x64x512_16x16_1x1_32x8x1_32x8x1_1x16x1x16_4x4x1_1x1_intrawave_v3,330.62,5189.29,0
256,32,57344,8192,81,0,93.0943,a8w8_rowwise_128x32x64x128_32x32_1x1_8x16x1_8x16x1_1x16x1x8_8x8x1_1x1_interwave_v2,322.95,5088.33,0
256,64,100,5120,34,0,9.6716,a8w8_rowwise_256x16x64x512_16x16_1x1_32x8x1_32x8x1_1x16x1x16_4x4x1_1x1_intrawave_v3,6.78,88.14,0
256,64,192,1024,77,0,4.1582,a8w8_rowwise_64x16x16x64_16x16_1x1_4x16x1_4x16x1_1x16x1x4_4x4x1_1x1_interwave_v2,6.05,68.95,0
256,64,200,5120,34,0,9.9254,a8w8_rowwise_256x16x64x512_16x16_1x1_32x8x1_32x8x1_1x16x1x16_4x4x1_1x1_intrawave_v3,13.21,138.76,0
256,64,800,5120,34,0,12.0241,a8w8_rowwise_256x16x64x512_16x16_1x1_32x8x1_32x8x1_1x16x1x16_4x4x1_1x1_intrawave_v3,43.6,376.42,0
256,64,1280,8192,34,0,14.7691,a8w8_rowwise_256x16x64x512_16x16_1x1_32x8x1_32x8x1_1x16x1x16_4x4x1_1x1_intrawave_v3,90.88,756.57,0
256,64,2304,16384,34,0,23.2558,a8w8_rowwise_256x16x64x512_16x16_1x1_32x8x1_32x8x1_1x16x1x16_4x4x1_1x1_intrawave_v3,207.77,1680.97,0
256,64,2560,8192,34,0,14.5967,a8w8_rowwise_256x16x64x512_16x16_1x1_32x8x1_32x8x1_1x16x1x16_4x4x1_1x1_intrawave_v3,183.9,1495.1,0
256,64,4608,16384,30,0,27.9735,a8w8_rowwise_256x32x64x512_16x16_1x2_32x8x1_32x8x1_1x32x1x8_8x8x1_1x2_intrawave_v3,345.46,2757.46,0
256,64,5120,640,77,0,5.0956,a8w8_rowwise_64x16x16x64_16x16_1x1_4x16x1_4x16x1_1x16x1x4_4x4x1_1x1_interwave_v2,82.31,779.72,0
256,64,5120,1280,76,0,6.4203,a8w8_rowwise_128x32x16x128_16x16_1x1_8x16x1_8x16x1_1x16x1x8_2x2x1_1x1_interwave_v2,130.66,1135.6,0
256,64,5120,3200,76,0,10.7687,a8w8_rowwise_128x32x16x128_16x16_1x1_8x16x1_8x16x1_1x16x1x8_2x2x1_1x1_interwave_v2,194.75,1601.32,0
256,64,5120,5120,30,0,11.7059,a8w8_rowwise_256x32x64x512_16x16_1x2_32x8x1_32x8x1_1x32x1x8_8x8x1_1x2_intrawave_v3,286.65,2323.4,0
256,64,5120,6400,30,0,16.907,a8w8_rowwise_256x32x64x512_16x16_1x2_32x8x1_32x8x1_1x32x1x8_8x8x1_1x2_intrawave_v3,248.08,2001.12,0
256,64,5120,25600,30,0,43.5801,a8w8_rowwise_256x32x64x512_16x16_1x2_32x8x1_32x8x1_1x32x1x8_8x8x1_1x2_intrawave_v3,384.97,3060.24,0
256,64,6400,5120,30,0,12.4817,a8w8_rowwise_256x32x64x512_16x16_1x2_32x8x1_32x8x1_1x32x1x8_8x8x1_1x2_intrawave_v3,336.04,2717.17,0
256,64,7168,8192,30,0,18.4286,a8w8_rowwise_256x32x64x512_16x16_1x2_32x8x1_32x8x1_1x32x1x8_8x8x1_1x2_intrawave_v3,407.85,3264.6,0
256,64,8192,2048,30,0,7.5798,a8w8_rowwise_256x32x64x512_16x16_1x2_32x8x1_32x8x1_1x32x1x8_8x8x1_1x2_intrawave_v3,283.32,2369.04,0
256,64,8192,3584,30,0,11.279,a8w8_rowwise_256x32x64x512_16x16_1x2_32x8x1_32x8x1_1x32x1x8_8x8x1_1x2_intrawave_v3,333.19,2716.38,0
256,64,8192,7168,30,0,17.495,a8w8_rowwise_256x32x64x512_16x16_1x2_32x8x1_32x8x1_1x32x1x8_8x8x1_1x2_intrawave_v3,429.62,3442.56,0
256,64,8192,8192,30,0,19.4045,a8w8_rowwise_256x32x64x512_16x16_1x2_32x8x1_32x8x1_1x32x1x8_8x8x1_1x2_intrawave_v3,442.68,3539.47,0
256,64,8192,28672,30,0,61.7622,a8w8_rowwise_256x32x64x512_16x16_1x2_32x8x1_32x8x1_1x32x1x8_8x8x1_1x2_intrawave_v3,486.78,3849.68,0
256,64,9216,16384,23,0,41.0647,a8w8_rowwise_256x64x64x512_32x32_1x1_32x8x1_32x8x1_1x32x1x8_8x8x1_1x1_intrawave_v3,470.66,3731.26,0
256,64,10240,8192,28,0,27.6213,a8w8_rowwise_256x32x128x256_32x32_1x1_16x16x1_16x16x1_1x32x1x8_8x8x1_1x1_intrawave_v3,388.74,3103.44,0
256,64,12800,5120,23,0,18.5404,a8w8_rowwise_256x64x64x512_32x32_1x1_32x8x1_32x8x1_1x32x1x8_8x8x1_1x1_intrawave_v3,452.45,3640.81,0
256,64,13312,16384,23,0,50.0251,a8w8_rowwise_256x64x64x512_32x32_1x1_32x8x1_32x8x1_1x32x1x8_8x8x1_1x1_intrawave_v3,558.07,4414.91,0
256,64,16384,2048,23,0,11.4046,a8w8_rowwise_256x64x64x512_32x32_1x1_32x8x1_32x8x1_1x32x1x8_8x8x1_1x1_intrawave_v3,376.6,3137.56,0
256,64,16384,4096,23,0,19.0989,a8w8_rowwise_256x64x64x512_32x32_1x1_32x8x1_32x8x1_1x32x1x8_8x8x1_1x1_intrawave_v3,449.76,3637.29,0
256,64,16384,6656,23,0,26.4384,a8w8_rowwise_256x64x64x512_32x32_1x1_32x8x1_32x8x1_1x32x1x8_8x8x1_1x1_intrawave_v3,527.97,4220.19,0
256,64,16384,8192,23,0,33.8597,a8w8_rowwise_256x64x64x512_32x32_1x1_32x8x1_32x8x1_1x32x1x8_8x8x1_1x1_intrawave_v3,507.38,4041.36,0
256,64,16384,13312,23,0,46.8247,a8w8_rowwise_256x64x64x512_32x32_1x1_32x8x1_32x8x1_1x32x1x8_8x8x1_1x1_intrawave_v3,596.21,4720.86,0
256,64,16384,26624,23,0,89.8884,a8w8_rowwise_256x64x64x512_32x32_1x1_32x8x1_32x8x1_1x32x1x8_8x8x1_1x1_intrawave_v3,621.15,4895.06,0
256,64,26624,16384,23,0,91.2922,a8w8_rowwise_256x64x64x512_32x32_1x1_32x8x1_32x8x1_1x32x1x8_8x8x1_1x1_intrawave_v3,611.6,4826.96,0
256,64,51200,5120,23,0,61.5287,a8w8_rowwise_256x64x64x512_32x32_1x1_32x8x1_32x8x1_1x32x1x8_8x8x1_1x1_intrawave_v3,545.35,4372.35,0
256,64,53248,16384,23,0,184.3385,a8w8_rowwise_256x64x64x512_32x32_1x1_32x8x1_32x8x1_1x32x1x8_8x8x1_1x1_intrawave_v3,605.78,4775.34,0
256,64,57344,8192,46,0,99.6635,a8w8_rowwise_256x64x128x128_32x32_1x2_8x32x1_8x32x1_1x32x1x8_8x8x1_1x1_intrawave_v3,603.33,4792.39,0
256,128,100,5120,34,0,10.6683,a8w8_rowwise_256x16x64x512_16x16_1x1_32x8x1_32x8x1_1x16x1x16_4x4x1_1x1_intrawave_v3,12.29,111.82,0
256,128,200,5120,34,0,9.652,a8w8_rowwise_256x16x64x512_16x16_1x1_32x8x1_32x8x1_1x16x1x16_4x4x1_1x1_intrawave_v3,27.16,179.3,0
256,128,800,5120,34,0,11.5628,a8w8_rowwise_256x16x64x512_16x16_1x1_32x8x1_32x8x1_1x16x1x16_4x4x1_1x1_intrawave_v3,90.69,428.63,0
256,128,1280,8192,34,0,13.9827,a8w8_rowwise_256x16x64x512_16x16_1x1_32x8x1_32x8x1_1x16x1x16_4x4x1_1x1_intrawave_v3,191.98,848.34,0
256,128,2304,16384,30,0,26.5035,a8w8_rowwise_256x32x64x512_16x16_1x2_32x8x1_32x8x1_1x32x1x8_8x8x1_1x2_intrawave_v3,364.62,1525.67,0
256,128,2560,8192,30,0,16.5177,a8w8_rowwise_256x32x64x512_16x16_1x2_32x8x1_32x8x1_1x32x1x8_8x8x1_1x2_intrawave_v3,325.03,1372.8,0
256,128,4608,16384,23,0,33.4047,a8w8_rowwise_256x64x64x512_32x32_1x1_32x8x1_32x8x1_1x32x1x8_8x8x1_1x1_intrawave_v3,578.58,2358.18,0
256,128,5120,640,79,0,5.566,a8w8_rowwise_128x16x32x128_16x16_1x1_8x16x1_8x16x1_1x16x1x8_4x4x1_1x1_interwave_v2,150.71,838.92,0
256,128,5120,1280,23,0,7.6695,a8w8_rowwise_256x64x64x512_32x32_1x1_32x8x1_32x8x1_1x32x1x8_8x8x1_1x1_intrawave_v3,218.75,1046.76,0
256,128,5120,3200,23,0,11.8363,a8w8_rowwise_256x64x64x512_32x32_1x1_32x8x1_32x8x1_1x32x1x8_8x8x1_1x1_intrawave_v3,354.36,1529.56,0
256,128,5120,5120,23,0,14.1859,a8w8_rowwise_256x64x64x512_32x32_1x1_32x8x1_32x8x1_1x32x1x8_8x8x1_1x1_intrawave_v3,473.07,1986.51,0
256,128,5120,6400,23,0,18.7826,a8w8_rowwise_256x64x64x512_32x32_1x1_32x8x1_32x8x1_1x32x1x8_8x8x1_1x1_intrawave_v3,446.62,1857.99,0
256,128,5120,25600,23,0,54.0309,a8w8_rowwise_256x64x64x512_32x32_1x1_32x8x1_32x8x1_1x32x1x8_8x8x1_1x1_intrawave_v3,621.02,2510.78,0
256,128,6400,5120,23,0,14.96,a8w8_rowwise_256x64x64x512_32x32_1x1_32x8x1_32x8x1_1x32x1x8_8x8x1_1x1_intrawave_v3,560.74,2343.7,0
256,128,7168,8192,28,0,26.0097,a8w8_rowwise_256x32x128x256_32x32_1x1_16x16x1_16x16x1_1x32x1x8_8x8x1_1x1_intrawave_v3,577.95,2368.49,0
256,128,8192,1024,28,0,7.1186,a8w8_rowwise_256x32x128x256_32x32_1x1_16x16x1_16x16x1_1x32x1x8_8x8x1_1x1_intrawave_v3,301.67,1491.42,0
256,128,8192,2048,23,0,10.2945,a8w8_rowwise_256x64x64x512_32x32_1x1_32x8x1_32x8x1_1x32x1x8_8x8x1_1x1_intrawave_v3,417.21,1858.91,0
256,128,8192,3584,28,0,13.8708,a8w8_rowwise_256x32x128x256_32x32_1x1_16x16x1_16x16x1_1x32x1x8_8x8x1_1x1_intrawave_v3,541.87,2300.95,0
256,128,8192,7168,28,0,24.2653,a8w8_rowwise_256x32x128x256_32x32_1x1_16x16x1_16x16x1_1x32x1x8_8x8x1_1x1_intrawave_v3,619.5,2544.16,0
256,128,8192,8192,28,0,26.3513,a8w8_rowwise_256x32x128x256_32x32_1x1_16x16x1_16x16x1_1x32x1x8_8x8x1_1x1_intrawave_v3,651.96,2666.08,0
256,128,8192,28672,28,0,87.5085,a8w8_rowwise_256x32x128x256_32x32_1x1_16x16x1_16x16x1_1x32x1x8_8x8x1_1x1_intrawave_v3,687.13,2750,0
256,128,9216,16384,23,0,59.454,a8w8_rowwise_256x64x64x512_32x32_1x1_32x8x1_32x8x1_1x32x1x8_8x8x1_1x1_intrawave_v3,650.16,2614.65,0
256,128,10240,8192,15,0,31.2683,a8w8_rowwise_256x128x64x256_32x32_2x1_16x16x1_16x16x1_1x32x1x8_8x8x1_1x1_intrawave_v3,686.79,2800.16,0
256,128,12800,5120,23,0,25.5896,a8w8_rowwise_256x64x64x512_32x32_1x1_32x8x1_32x8x1_1x32x1x8_8x8x1_1x1_intrawave_v3,655.63,2714.7,0
256,128,13312,16384,23,0,65.9651,a8w8_rowwise_256x64x64x512_32x32_1x1_32x8x1_32x8x1_1x32x1x8_8x8x1_1x1_intrawave_v3,846.43,3389.81,0
256,128,16384,2048,23,0,14.5668,a8w8_rowwise_256x64x64x512_32x32_1x1_32x8x1_32x8x1_1x32x1x8_8x8x1_1x1_intrawave_v3,589.69,2609.42,0
256,128,16384,4096,23,0,23.3525,a8w8_rowwise_256x64x64x512_32x32_1x1_32x8x1_32x8x1_1x32x1x8_8x8x1_1x1_intrawave_v3,735.68,3075.79,0
256,128,16384,6656,23,0,34.0329,a8w8_rowwise_256x64x64x512_32x32_1x1_32x8x1_32x8x1_1x32x1x8_8x8x1_1x1_intrawave_v3,820.3,3352.58,0
256,128,16384,8192,23,0,45.1385,a8w8_rowwise_256x64x64x512_32x32_1x1_32x8x1_32x8x1_1x32x1x8_8x8x1_1x1_intrawave_v3,761.21,3089.62,0
256,128,16384,13312,23,0,61.6432,a8w8_rowwise_256x64x64x512_32x32_1x1_32x8x1_32x8x1_1x32x1x8_8x8x1_1x1_intrawave_v3,905.77,3633.85,0
256,128,16384,26624,23,0,118.3409,a8w8_rowwise_256x64x64x512_32x32_1x1_32x8x1_32x8x1_1x32x1x8_8x8x1_1x1_intrawave_v3,943.62,3750.27,0
256,128,26624,16384,23,0,129.1529,a8w8_rowwise_256x64x64x512_32x32_1x1_32x8x1_32x8x1_1x32x1x8_8x8x1_1x1_intrawave_v3,864.63,3446.46,0
256,128,51200,5120,23,0,82.0559,a8w8_rowwise_256x64x64x512_32x32_1x1_32x8x1_32x8x1_1x32x1x8_8x8x1_1x1_intrawave_v3,817.84,3362.42,0
256,128,53248,16384,23,0,230.1893,a8w8_rowwise_256x64x64x512_32x32_1x1_32x8x1_32x8x1_1x32x1x8_8x8x1_1x1_intrawave_v3,970.24,3858.32,0
256,128,57344,8192,13,0,108.1045,a8w8_rowwise_256x128x128x128_32x32_2x2_8x32x1_8x32x1_1x32x1x8_8x8x1_1x1_intrawave_v3,1112.43,4490.94,0
256,256,100,5120,34,0,10.9556,a8w8_rowwise_256x16x64x512_16x16_1x1_32x8x1_32x8x1_1x16x1x16_4x4x1_1x1_intrawave_v3,23.93,171.05,0
256,256,200,5120,34,0,9.8147,a8w8_rowwise_256x16x64x512_16x16_1x1_32x8x1_32x8x1_1x16x1x16_4x4x1_1x1_intrawave_v3,53.42,248.31,0
256,256,800,5120,34,0,11.8423,a8w8_rowwise_256x16x64x512_16x16_1x1_32x8x1_32x8x1_1x16x1x16_4x4x1_1x1_intrawave_v3,177.09,491.15,0
256,256,1280,8192,30,0,16.2863,a8w8_rowwise_256x32x64x512_16x16_1x2_32x8x1_32x8x1_1x32x1x8_8x8x1_1x2_intrawave_v3,329.65,812.85,0
256,256,2304,16384,23,0,32.4817,a8w8_rowwise_256x64x64x512_32x32_1x1_32x8x1_32x8x1_1x32x1x8_8x8x1_1x1_intrawave_v3,595.02,1327.6,0
256,256,2560,8192,28,0,23.112,a8w8_rowwise_256x32x128x256_32x32_1x1_16x16x1_16x16x1_1x32x1x8_8x8x1_1x1_intrawave_v3,464.58,1054.84,0
256,256,4608,16384,23,0,55.0189,a8w8_rowwise_256x64x64x512_32x32_1x1_32x8x1_32x8x1_1x32x1x8_8x8x1_1x1_intrawave_v3,702.57,1491.33,0
256,256,5120,640,81,0,6.6084,a8w8_rowwise_128x32x64x128_32x32_1x1_8x16x1_8x16x1_1x16x1x8_8x8x1_1x1_interwave_v2,253.88,917.33,0
256,256,5120,1280,15,0,8.2757,a8w8_rowwise_256x128x64x256_32x32_2x1_16x16x1_16x16x1_1x32x1x8_8x8x1_1x1_intrawave_v3,405.46,1148.27,0
256,256,5120,3200,15,0,15.7837,a8w8_rowwise_256x128x64x256_32x32_2x1_16x16x1_16x16x1_1x32x1x8_8x8x1_1x1_intrawave_v3,531.47,1256.02,0
256,256,5120,5120,23,0,21.8405,a8w8_rowwise_256x64x64x512_32x32_1x1_32x8x1_32x8x1_1x32x1x8_8x8x1_1x1_intrawave_v3,614.54,1380.31,0
256,256,5120,6400,21,0,23.7832,a8w8_rowwise_256x64x128x256_32x32_1x2_16x16x1_16x16x1_1x32x1x8_8x8x1_1x1_intrawave_v3,705.42,1556.89,0
256,256,5120,25600,23,0,86.0166,a8w8_rowwise_256x64x64x512_32x32_1x1_32x8x1_32x8x1_1x32x1x8_8x8x1_1x1_intrawave_v3,780.19,1630.46,0
256,256,6400,5120,23,0,22.7861,a8w8_rowwise_256x64x64x512_32x32_1x1_32x8x1_32x8x1_1x32x1x8_8x8x1_1x1_intrawave_v3,736.29,1639.4,0
256,256,7168,8192,15,0,30.291,a8w8_rowwise_256x128x64x256_32x32_2x1_16x16x1_16x16x1_1x32x1x8_8x8x1_1x1_intrawave_v3,992.53,2128.93,0
256,256,8192,1024,21,0,8.6043,a8w8_rowwise_256x64x128x256_32x32_1x2_16x16x1_16x16x1_1x32x1x8_8x8x1_1x1_intrawave_v3,499.17,1492.86,0
256,256,8192,2048,15,0,10.9387,a8w8_rowwise_256x128x64x256_32x32_2x1_16x16x1_16x16x1_1x32x1x8_8x8x1_1x1_intrawave_v3,785.28,1965.12,0
256,256,8192,3584,15,0,16.5846,a8w8_rowwise_256x128x64x256_32x32_2x1_16x16x1_16x16x1_1x32x1x8_8x8x1_1x1_intrawave_v3,906.41,2078.55,0
256,256,8192,7168,21,0,29.138,a8w8_rowwise_256x64x128x256_32x32_1x2_16x16x1_16x16x1_1x32x1x8_8x8x1_1x1_intrawave_v3,1031.81,2222.17,0
256,256,8192,8192,15,0,31.6256,a8w8_rowwise_256x128x64x256_32x32_2x1_16x16x1_16x16x1_1x32x1x8_8x8x1_1x1_intrawave_v3,1086.45,2320.91,0
256,256,8192,28672,15,0,102.0397,a8w8_rowwise_256x128x64x256_32x32_2x1_16x16x1_16x16x1_1x32x1x8_8x8x1_1x1_intrawave_v3,1178.55,2414.9,0
256,256,9216,16384,23,0,86.8248,a8w8_rowwise_256x64x64x512_32x32_1x1_32x8x1_32x8x1_1x32x1x8_8x8x1_1x1_intrawave_v3,890.41,1841.73,0
256,256,10240,8192,41,0,42.9954,a8w8_rowwise_256x128x128x128_32x32_2x2_8x32x1_8x32x1_1x32x1x8_8x8x1_1x1_intrawave_v5,998.94,2121.76,0
256,256,12800,5120,15,0,42.5463,a8w8_rowwise_256x128x64x256_32x32_2x1_16x16x1_16x16x1_1x32x1x8_8x8x1_1x1_intrawave_v3,788.66,1725.19,0
256,256,13312,16384,23,0,113.4219,a8w8_rowwise_256x64x64x512_32x32_1x1_32x8x1_32x8x1_1x32x1x8_8x8x1_1x1_intrawave_v3,984.55,2020.01,0
256,256,16384,2048,15,0,22.0982,a8w8_rowwise_256x128x64x256_32x32_2x1_16x16x1_16x16x1_1x32x1x8_8x8x1_1x1_intrawave_v3,777.43,1921.76,0
256,256,16384,4096,15,0,39.8495,a8w8_rowwise_256x128x64x256_32x32_2x1_16x16x1_16x16x1_1x32x1x8_8x8x1_1x1_intrawave_v3,862.24,1920.88,0
256,256,16384,6656,23,0,57.6756,a8w8_rowwise_256x64x64x512_32x32_1x1_32x8x1_32x8x1_1x32x1x8_8x8x1_1x1_intrawave_v3,968.08,2065.77,0
256,256,16384,8192,15,0,72.9104,a8w8_rowwise_256x128x64x256_32x32_2x1_16x16x1_16x16x1_1x32x1x8_8x8x1_1x1_intrawave_v3,942.52,1984.68,0
256,256,16384,13312,23,0,106.2833,a8w8_rowwise_256x64x64x512_32x32_1x1_32x8x1_32x8x1_1x32x1x8_8x8x1_1x1_intrawave_v3,1050.67,2163.09,0
256,256,16384,26624,23,0,202.2465,a8w8_rowwise_256x64x64x512_32x32_1x1_32x8x1_32x8x1_1x32x1x8_8x8x1_1x1_intrawave_v3,1104.29,2231.99,0
256,256,26624,16384,23,0,206.2403,a8w8_rowwise_256x64x64x512_32x32_1x1_32x8x1_32x8x1_1x32x1x8_8x8x1_1x1_intrawave_v3,1082.9,2201.48,0
256,256,51200,5120,40,0,120.9285,a8w8_rowwise_256x256x224x128_16x16_8x7_8x32x1_8x32x1_1x64x1x4_8x8x1_2x1_intrawave_v3,1109.89,2395.38,0
256,256,53248,16384,40,0,368.0253,a8w8_rowwise_256x256x224x128_16x16_8x7_8x32x1_8x32x1_1x64x1x4_8x8x1_2x1_intrawave_v3,1213.71,2456.01,0
256,256,57344,8192,2,0,135.372,a8w8_rowwise_256x256x224x128_32x32_2x7_8x32x1_8x32x1_1x64x1x4_8x8x1_2x1_intrawave_v3,1776.72,3702.53,0
256,512,100,5120,34,0,11.1055,a8w8_rowwise_256x16x64x512_16x16_1x1_32x8x1_32x8x1_1x16x1x16_4x4x1_1x1_intrawave_v3,47.21,291.37,0
256,512,200,5120,34,0,11.8774,a8w8_rowwise_256x16x64x512_16x16_1x1_32x8x1_32x8x1_1x16x1x16_4x4x1_1x1_intrawave_v3,88.28,324.17,0
256,512,800,5120,30,0,13.1908,a8w8_rowwise_256x32x64x512_16x16_1x2_32x8x1_32x8x1_1x32x1x8_8x8x1_1x2_intrawave_v3,317.97,571.36,0
256,512,1280,8192,28,0,23.2059,a8w8_rowwise_256x32x128x256_32x32_1x1_16x16x1_16x16x1_1x32x1x8_8x8x1_1x1_intrawave_v3,462.7,689.08,0
256,512,2304,16384,23,0,54.2058,a8w8_rowwise_256x64x64x512_32x32_1x1_32x8x1_32x8x1_1x32x1x8_8x8x1_1x1_intrawave_v3,713.11,894.68,0
256,512,2560,8192,21,0,27.6646,a8w8_rowwise_256x64x128x256_32x32_1x2_16x16x1_16x16x1_1x32x1x8_8x8x1_1x1_intrawave_v3,776.26,1004.43,0
256,512,4608,16384,23,0,87.1647,a8w8_rowwise_256x64x64x512_32x32_1x1_32x8x1_32x8x1_1x32x1x8_8x8x1_1x1_intrawave_v3,886.93,1016.52,0
256,512,5120,640,47,0,8.4036,a8w8_rowwise_256x64x64x128_32x32_1x1_8x32x1_8x32x1_1x32x1x8_8x8x1_1x1_intrawave_v3,399.29,1052.81,0
256,512,5120,1280,22,0,12.2285,a8w8_rowwise_256x64x96x256_16x16_2x3_16x16x1_16x16x1_1x64x1x4_8x8x1_2x1_intrawave_v3,548.79,1018.26,0
256,512,5120,3200,13,0,21.8498,a8w8_rowwise_256x128x128x128_32x32_2x2_8x32x1_8x32x1_1x32x1x8_8x8x1_1x1_intrawave_v3,767.84,1064.78,0
256,512,5120,5120,23,0,33.1376,a8w8_rowwise_256x64x64x512_32x32_1x1_32x8x1_32x8x1_1x32x1x8_8x8x1_1x1_intrawave_v3,810.06,1028.4,0
256,512,5120,6400,15,0,38.8017,a8w8_rowwise_256x128x64x256_32x32_2x1_16x16x1_16x16x1_1x32x1x8_8x8x1_1x1_intrawave_v3,864.77,1064.07,0
256,512,5120,25600,23,0,131.897,a8w8_rowwise_256x64x64x512_32x32_1x1_32x8x1_32x8x1_1x32x1x8_8x8x1_1x1_intrawave_v3,1017.6,1132.87,0
256,512,6400,5120,15,0,41.3468,a8w8_rowwise_256x128x64x256_32x32_2x1_16x16x1_16x16x1_1x32x1x8_8x8x1_1x1_intrawave_v3,811.54,1014.42,0
256,512,7168,8192,41,0,47.5197,a8w8_rowwise_256x128x128x128_32x32_2x2_8x32x1_8x32x1_1x32x1x8_8x8x1_1x1_intrawave_v5,1265.36,1478.43,0
256,512,8192,1024,13,0,11.7749,a8w8_rowwise_256x128x128x128_32x32_2x2_8x32x1_8x32x1_1x32x1x8_8x8x1_1x1_intrawave_v3,729.51,1469.35,0
256,512,8192,2048,41,0,16.8904,a8w8_rowwise_256x128x128x128_32x32_2x2_8x32x1_8x32x1_1x32x1x8_8x8x1_1x1_intrawave_v5,1017.14,1552.03,0
256,512,8192,3584,41,0,24.9561,a8w8_rowwise_256x128x128x128_32x32_2x2_8x32x1_8x32x1_1x32x1x8_8x8x1_1x1_intrawave_v5,1204.71,1586.14,0
256,512,8192,7168,41,0,44.168,a8w8_rowwise_256x128x128x128_32x32_2x2_8x32x1_8x32x1_1x32x1x8_8x8x1_1x1_intrawave_v5,1361.38,1602.49,0
256,512,8192,8192,13,0,51.209,a8w8_rowwise_256x128x128x128_32x32_2x2_8x32x1_8x32x1_1x32x1x8_8x8x1_1x1_intrawave_v3,1341.94,1556.21,0
256,512,8192,28672,41,0,150.8316,a8w8_rowwise_256x128x128x128_32x32_2x2_8x32x1_8x32x1_1x32x1x8_8x8x1_1x1_intrawave_v5,1594.61,1710.18,0
256,512,9216,16384,23,0,141.9471,a8w8_rowwise_256x64x64x512_32x32_1x1_32x8x1_32x8x1_1x32x1x8_8x8x1_1x1_intrawave_v3,1089.27,1189.32,0
256,512,10240,8192,11,0,61.9597,a8w8_rowwise_256x128x160x128_32x32_1x5_8x32x1_8x32x1_1x64x1x4_8x8x1_1x1_intrawave_v3,1386.37,1590.81,0
256,512,12800,5120,23,0,74.3061,a8w8_rowwise_256x64x64x512_32x32_1x1_32x8x1_32x8x1_1x32x1x8_8x8x1_1x1_intrawave_v3,903.14,1093.65,0
256,512,13312,16384,23,0,199.0315,a8w8_rowwise_256x64x64x512_32x32_1x1_32x8x1_32x8x1_1x32x1x8_8x8x1_1x1_intrawave_v3,1122.13,1206.46,0
256,512,16384,2048,15,0,38.4305,a8w8_rowwise_256x128x64x256_32x32_2x1_16x16x1_16x16x1_1x32x1x8_8x8x1_1x1_intrawave_v3,894.07,1336.96,0
256,512,16384,4096,15,0,65.4454,a8w8_rowwise_256x128x64x256_32x32_2x1_16x16x1_16x16x1_1x32x1x8_8x8x1_1x1_intrawave_v3,1050.03,1313.82,0
256,512,16384,6656,15,0,102.3241,a8w8_rowwise_256x128x64x256_32x32_2x1_16x16x1_16x16x1_1x32x1x8_8x8x1_1x1_intrawave_v3,1091.33,1263.02,0
256,512,16384,8192,15,0,123.6929,a8w8_rowwise_256x128x64x256_32x32_2x1_16x16x1_16x16x1_1x32x1x8_8x8x1_1x1_intrawave_v3,1111.13,1254.63,0
256,512,16384,13312,15,0,191.2442,a8w8_rowwise_256x128x64x256_32x32_2x1_16x16x1_16x16x1_1x32x1x8_8x8x1_1x1_intrawave_v3,1167.82,1263.81,0
256,512,16384,26624,15,0,365.7012,a8w8_rowwise_256x128x64x256_32x32_2x1_16x16x1_16x16x1_1x32x1x8_8x8x1_1x1_intrawave_v3,1221.43,1275.95,0
256,512,26624,16384,15,0,349.3418,a8w8_rowwise_256x128x64x256_32x32_2x1_16x16x1_16x16x1_1x32x1x8_8x8x1_1x1_intrawave_v3,1278.62,1350.71,0
256,512,51200,5120,40,0,223.8159,a8w8_rowwise_256x256x224x128_16x16_8x7_8x32x1_8x32x1_1x64x1x4_8x8x1_2x1_intrawave_v3,1199.36,1417.21,0
256,512,53248,16384,15,0,651.6344,a8w8_rowwise_256x128x64x256_32x32_2x1_16x16x1_16x16x1_1x32x1x8_8x8x1_1x1_intrawave_v3,1370.94,1435.36,0
256,512,57344,8192,2,0,233.9286,a8w8_rowwise_256x256x224x128_32x32_2x7_8x32x1_8x32x1_1x64x1x4_8x8x1_2x1_intrawave_v3,2056.34,2277.09,0
256,1024,100,5120,34,0,11.6746,a8w8_rowwise_256x16x64x512_16x16_1x1_32x8x1_32x8x1_1x16x1x16_4x4x1_1x1_intrawave_v3,89.82,510.48,0
256,1024,200,5120,34,0,12.0055,a8w8_rowwise_256x16x64x512_16x16_1x1_32x8x1_32x8x1_1x16x1x16_4x4x1_1x1_intrawave_v3,174.68,556.12,0
256,1024,800,5120,23,0,15.5235,a8w8_rowwise_256x64x64x512_32x32_1x1_32x8x1_32x8x1_1x32x1x8_8x8x1_1x1_intrawave_v3,540.38,707.14,0
256,1024,1280,8192,21,0,27.7294,a8w8_rowwise_256x64x128x256_32x32_1x2_16x16x1_16x16x1_1x32x1x8_8x8x1_1x1_intrawave_v3,774.44,775.2,0
256,1024,2304,16384,23,0,86.7135,a8w8_rowwise_256x64x64x512_32x32_1x1_32x8x1_32x8x1_1x32x1x8_8x8x1_1x1_intrawave_v3,891.55,683.22,0
256,1024,2560,8192,41,0,42.1202,a8w8_rowwise_256x128x128x128_32x32_2x2_8x32x1_8x32x1_1x32x1x8_8x8x1_1x1_intrawave_v5,1019.69,821.53,0
256,1024,4608,16384,23,0,143.2677,a8w8_rowwise_256x64x64x512_32x32_1x1_32x8x1_32x8x1_1x32x1x8_8x8x1_1x1_intrawave_v3,1079.23,709.94,0
256,1024,5120,640,11,0,11.7704,a8w8_rowwise_256x128x160x128_32x32_1x5_8x32x1_8x32x1_1x64x1x4_8x8x1_1x1_intrawave_v3,570.15,1224.93,0
256,1024,5120,1280,11,0,17.5871,a8w8_rowwise_256x128x160x128_32x32_1x5_8x32x1_8x32x1_1x64x1x4_8x8x1_1x1_intrawave_v3,763.16,1043.38,0
256,1024,5120,3200,11,0,27.688,a8w8_rowwise_256x128x160x128_32x32_1x5_8x32x1_8x32x1_1x64x1x4_8x8x1_1x1_intrawave_v3,1211.88,1088.8,0
256,1024,5120,5120,23,0,55.7649,a8w8_rowwise_256x64x64x512_32x32_1x1_32x8x1_32x8x1_1x32x1x8_8x8x1_1x1_intrawave_v3,962.74,752.14,0
256,1024,5120,6400,11,0,57.5786,a8w8_rowwise_256x128x160x128_32x32_1x5_8x32x1_8x32x1_1x64x1x4_8x8x1_1x1_intrawave_v3,1165.52,865.03,0
256,1024,5120,25600,23,0,227.1849,a8w8_rowwise_256x64x64x512_32x32_1x1_32x8x1_32x8x1_1x32x1x8_8x8x1_1x1_intrawave_v3,1181.57,738.48,0
256,1024,6400,5120,23,0,72.0506,a8w8_rowwise_256x64x64x512_32x32_1x1_32x8x1_32x8x1_1x32x1x8_8x8x1_1x1_intrawave_v3,931.41,709.47,0
256,1024,7168,8192,13,0,82.6278,a8w8_rowwise_256x128x128x128_32x32_2x2_8x32x1_8x32x1_1x32x1x8_8x8x1_1x1_intrawave_v3,1455.43,989.85,0
256,1024,8192,1024,13,0,17.3848,a8w8_rowwise_256x128x128x128_32x32_2x2_8x32x1_8x32x1_1x32x1x8_8x8x1_1x1_intrawave_v3,988.21,1507.89,0
256,1024,8192,2048,41,0,27.2285,a8w8_rowwise_256x128x128x128_32x32_2x2_8x32x1_8x32x1_1x32x1x8_8x8x1_1x1_intrawave_v5,1261.9,1309.35,0
256,1024,8192,3584,13,0,43.9928,a8w8_rowwise_256x128x128x128_32x32_2x2_8x32x1_8x32x1_1x32x1x8_8x8x1_1x1_intrawave_v3,1366.8,1132.17,0
256,1024,8192,7168,13,0,79.3336,a8w8_rowwise_256x128x128x128_32x32_2x2_8x32x1_8x32x1_1x32x1x8_8x8x1_1x1_intrawave_v3,1515.87,1044.17,0
256,1024,8192,8192,13,0,88.9386,a8w8_rowwise_256x128x128x128_32x32_2x2_8x32x1_8x32x1_1x32x1x8_8x8x1_1x1_intrawave_v3,1545.32,1037.51,0
256,1024,8192,28672,41,0,274.6402,a8w8_rowwise_256x128x128x128_32x32_2x2_8x32x1_8x32x1_1x32x1x8_8x8x1_1x1_intrawave_v5,1751.51,1023.22,0
256,1024,9216,16384,15,0,243.9282,a8w8_rowwise_256x128x64x256_32x32_2x1_16x16x1_16x16x1_1x32x1x8_8x8x1_1x1_intrawave_v3,1267.74,765.17,0
256,1024,10240,8192,4,0,89.391,a8w8_rowwise_256x256x160x128_32x32_2x5_8x32x1_8x32x1_1x64x1x4_8x8x1_2x1_intrawave_v3,1921.88,1266.86,0
256,1024,12800,5120,40,0,104.2861,a8w8_rowwise_256x256x224x128_16x16_8x7_8x32x1_8x32x1_1x64x1x4_8x8x1_2x1_intrawave_v3,1287.01,930.07,0
256,1024,13312,16384,40,0,306.5211,a8w8_rowwise_256x256x224x128_16x16_8x7_8x32x1_8x32x1_1x64x1x4_8x8x1_2x1_intrawave_v3,1457.25,855.22,0
256,1024,16384,2048,1,0,61.8687,a8w8_rowwise_256x256x256x128_32x32_4x4_8x32x1_8x32x1_1x32x1x8_8x8x1_1x1_intrawave_v3,1110.73,1118.59,0
256,1024,16384,4096,1,0,108.4683,a8w8_rowwise_256x256x256x128_32x32_4x4_8x32x1_8x32x1_1x32x1x8_8x8x1_1x1_intrawave_v3,1267.09,966.71,0
256,1024,16384,6656,1,0,165.4754,a8w8_rowwise_256x256x256x128_32x32_4x4_8x32x1_8x32x1_1x32x1x8_8x8x1_1x1_intrawave_v3,1349.68,902.99,0
256,1024,16384,8192,1,0,202.2384,a8w8_rowwise_256x256x256x128_32x32_4x4_8x32x1_8x32x1_1x32x1x8_8x8x1_1x1_intrawave_v3,1359.18,871.05,0
256,1024,16384,13312,1,0,307.7016,a8w8_rowwise_256x256x256x128_32x32_4x4_8x32x1_8x32x1_1x32x1x8_8x8x1_1x1_intrawave_v3,1451.66,862.17,0
256,1024,16384,26624,1,0,603.8507,a8w8_rowwise_256x256x256x128_32x32_4x4_8x32x1_8x32x1_1x32x1x8_8x8x1_1x1_intrawave_v3,1479.43,823.09,0
256,1024,26624,16384,15,0,630.2527,a8w8_rowwise_256x128x64x256_32x32_2x1_16x16x1_16x16x1_1x32x1x8_8x8x1_1x1_intrawave_v3,1417.45,805.25,0
256,1024,51200,5120,39,0,396.7395,a8w8_rowwise_256x224x256x128_16x16_7x8_8x32x1_8x32x1_1x32x1x8_8x8x1_1x2_intrawave_v3,1353.21,938.26,0
256,1024,53248,16384,40,0,1195.3563,a8w8_rowwise_256x256x224x128_16x16_8x7_8x32x1_8x32x1_1x64x1x4_8x8x1_2x1_intrawave_v3,1494.71,835.1,0
256,1024,57344,8192,2,0,438.8629,a8w8_rowwise_256x256x224x128_32x32_2x7_8x32x1_8x32x1_1x64x1x4_8x8x1_2x1_intrawave_v3,2192.19,1357.12,0
256,2048,100,5120,34,0,11.6595,a8w8_rowwise_256x16x64x512_16x16_1x1_32x8x1_32x8x1_1x16x1x16_4x4x1_1x1_intrawave_v3,179.87,978.37,0
256,2048,200,5120,30,0,13.0876,a8w8_rowwise_256x32x64x512_16x16_1x2_32x8x1_32x8x1_1x32x1x8_8x8x1_1x2_intrawave_v3,320.48,942.03,0
256,2048,800,5120,23,0,24.3923,a8w8_rowwise_256x64x64x512_32x32_1x1_32x8x1_32x8x1_1x32x1x8_8x8x1_1x1_intrawave_v3,687.81,732.14,0
256,2048,1280,8192,41,0,42.0169,a8w8_rowwise_256x128x128x128_32x32_2x2_8x32x1_8x32x1_1x32x1x8_8x8x1_1x1_intrawave_v5,1022.2,773.64,0
256,2048,2304,16384,23,0,145.2155,a8w8_rowwise_256x64x64x512_32x32_1x1_32x8x1_32x8x1_1x32x1x8_8x8x1_1x1_intrawave_v3,1064.75,556,0
256,2048,2560,8192,11,0,61.0366,a8w8_rowwise_256x128x160x128_32x32_1x5_8x32x1_8x32x1_1x64x1x4_8x8x1_1x1_intrawave_v3,1407.34,790.26,0
256,2048,4608,16384,11,0,247.0665,a8w8_rowwise_256x128x160x128_32x32_1x5_8x32x1_8x32x1_1x64x1x4_8x8x1_1x1_intrawave_v3,1251.64,517.78,0
256,2048,5120,640,10,0,17.6749,a8w8_rowwise_256x128x192x128_32x32_2x3_8x32x1_8x32x1_1x32x1x8_8x8x1_1x1_intrawave_v3,759.37,1446.06,0
256,2048,5120,1280,4,0,27.4475,a8w8_rowwise_256x256x160x128_32x32_2x5_8x32x1_8x32x1_1x64x1x4_8x8x1_2x1_intrawave_v3,978,1098.34,0
256,2048,5120,3200,4,0,44.9517,a8w8_rowwise_256x256x160x128_32x32_2x5_8x32x1_8x32x1_1x64x1x4_8x8x1_2x1_intrawave_v3,1492.91,976.81,0
256,2048,5120,5120,15,0,96.048,a8w8_rowwise_256x128x64x256_32x32_2x1_16x16x1_16x16x1_1x32x1x8_8x8x1_1x1_intrawave_v3,1117.92,600.45,0
256,2048,5120,6400,4,0,90.0028,a8w8_rowwise_256x256x160x128_32x32_2x5_8x32x1_8x32x1_1x64x1x4_8x8x1_2x1_intrawave_v3,1491.26,742.72,0
256,2048,5120,25600,15,0,419.2679,a8w8_rowwise_256x128x64x256_32x32_2x1_16x16x1_16x16x1_1x32x1x8_8x8x1_1x1_intrawave_v3,1280.5,487.69,0
256,2048,6400,5120,39,0,107.5421,a8w8_rowwise_256x224x256x128_16x16_7x8_8x32x1_8x32x1_1x32x1x8_8x8x1_1x2_intrawave_v3,1248.05,645.96,0
256,2048,7168,8192,2,0,116.6871,a8w8_rowwise_256x256x224x128_32x32_2x7_8x32x1_8x32x1_1x64x1x4_8x8x1_2x1_intrawave_v3,2061.22,898.62,0
256,2048,8192,1024,1,0,29.7892,a8w8_rowwise_256x256x256x128_32x32_4x4_8x32x1_8x32x1_1x32x1x8_8x8x1_1x1_intrawave_v3,1153.43,1478.39,0
256,2048,8192,2048,1,0,42.7444,a8w8_rowwise_256x256x256x128_32x32_4x4_8x32x1_8x32x1_1x32x1x8_8x8x1_1x1_intrawave_v3,1607.68,1275.63,0
256,2048,8192,3584,1,0,65.1518,a8w8_rowwise_256x256x256x128_32x32_4x4_8x32x1_8x32x1_1x32x1x8_8x8x1_1x1_intrawave_v3,1845.83,1078.32,0
256,2048,8192,7168,1,0,113.2102,a8w8_rowwise_256x256x256x128_32x32_4x4_8x32x1_8x32x1_1x32x1x8_8x8x1_1x1_intrawave_v3,2124.53,944.74,0
256,2048,8192,8192,1,0,125.3472,a8w8_rowwise_256x256x256x128_32x32_4x4_8x32x1_8x32x1_1x32x1x8_8x8x1_1x1_intrawave_v3,2192.93,936.92,0
256,2048,8192,28672,1,0,387.0603,a8w8_rowwise_256x256x256x128_32x32_4x4_8x32x1_8x32x1_1x32x1x8_8x8x1_1x1_intrawave_v3,2485.59,845.23,0
256,2048,9216,16384,15,0,431.0243,a8w8_rowwise_256x128x64x256_32x32_2x1_16x16x1_16x16x1_1x32x1x8_8x8x1_1x1_intrawave_v3,1434.9,515.74,0
256,2048,10240,8192,4,0,170.1034,a8w8_rowwise_256x256x160x128_32x32_2x5_8x32x1_8x32x1_1x64x1x4_8x8x1_2x1_intrawave_v3,2019.93,838.35,0
256,2048,12800,5120,39,0,188.6903,a8w8_rowwise_256x224x256x128_16x16_7x8_8x32x1_8x32x1_1x32x1x8_8x8x1_1x2_intrawave_v3,1422.62,680.75,0
256,2048,13312,16384,40,0,609.7983,a8w8_rowwise_256x256x224x128_16x16_8x7_8x32x1_8x32x1_1x64x1x4_8x8x1_2x1_intrawave_v3,1465,502.11,0
256,2048,16384,2048,1,0,109.435,a8w8_rowwise_256x256x256x128_32x32_4x4_8x32x1_8x32x1_1x32x1x8_8x8x1_1x1_intrawave_v3,1255.9,958.17,0
256,2048,16384,4096,1,0,192.1657,a8w8_rowwise_256x256x256x128_32x32_4x4_8x32x1_8x32x1_1x32x1x8_8x8x1_1x1_intrawave_v3,1430.42,742.1,0
256,2048,16384,6656,1,0,297.4271,a8w8_rowwise_256x256x256x128_32x32_4x4_8x32x1_8x32x1_1x32x1x8_8x8x1_1x1_intrawave_v3,1501.8,638.11,0
256,2048,16384,8192,1,0,351.3779,a8w8_rowwise_256x256x256x128_32x32_4x4_8x32x1_8x32x1_1x32x1x8_8x8x1_1x1_intrawave_v3,1564.57,620.71,0
256,2048,16384,13312,1,0,562.4285,a8w8_rowwise_256x256x256x128_32x32_4x4_8x32x1_8x32x1_1x32x1x8_8x8x1_1x1_intrawave_v3,1588.39,555.58,0
256,2048,16384,26624,1,0,1159.8861,a8w8_rowwise_256x256x256x128_32x32_4x4_8x32x1_8x32x1_1x32x1x8_8x8x1_1x1_intrawave_v3,1540.42,480.95,0
256,2048,26624,16384,40,0,1145.701,a8w8_rowwise_256x256x224x128_16x16_8x7_8x32x1_8x32x1_1x64x1x4_8x8x1_2x1_intrawave_v3,1559.49,505.21,0
256,2048,51200,5120,39,0,756.332,a8w8_rowwise_256x224x256x128_16x16_7x8_8x32x1_8x32x1_1x32x1x8_8x8x1_1x2_intrawave_v3,1419.67,637.74,0
256,2048,53248,16384,1,0,2196.6099,a8w8_rowwise_256x256x256x128_32x32_4x4_8x32x1_8x32x1_1x32x1x8_8x8x1_1x1_intrawave_v3,1626.79,511.73,0
256,2048,57344,8192,1,0,814.7053,a8w8_rowwise_256x256x256x128_32x32_4x4_8x32x1_8x32x1_1x32x1x8_8x8x1_1x1_intrawave_v3,2361.77,885.5,0
256,4096,100,5120,34,0,16.1651,a8w8_rowwise_256x16x64x512_16x16_1x1_32x8x1_32x8x1_1x16x1x16_4x4x1_1x1_intrawave_v3,259.47,1379.68,0
256,4096,200,5120,23,0,15.2341,a8w8_rowwise_256x64x64x512_32x32_1x1_32x8x1_32x8x1_1x32x1x8_8x8x1_1x1_intrawave_v3,550.65,1551.38,0
256,4096,800,5120,15,0,36.4711,a8w8_rowwise_256x128x64x256_32x32_2x1_16x16x1_16x16x1_1x32x1x8_8x8x1_1x1_intrawave_v3,920.03,867.02,0
256,4096,1280,8192,11,0,59.932,a8w8_rowwise_256x128x160x128_32x32_1x5_8x32x1_8x32x1_1x64x1x4_8x8x1_1x1_intrawave_v3,1433.28,909.8,0
256,4096,2304,16384,11,0,246.424,a8w8_rowwise_256x128x160x128_32x32_1x5_8x32x1_8x32x1_1x64x1x4_8x8x1_1x1_intrawave_v3,1254.9,502.11,0
256,4096,2560,8192,4,0,90.7509,a8w8_rowwise_256x256x160x128_32x32_2x5_8x32x1_8x32x1_1x64x1x4_8x8x1_2x1_intrawave_v3,1893.08,831.92,0
256,4096,4608,16384,15,0,433.3975,a8w8_rowwise_256x128x64x256_32x32_2x1_16x16x1_16x16x1_1x32x1x8_8x8x1_1x1_intrawave_v3,1427.04,416.14,0
256,4096,5120,640,13,0,32.4583,a8w8_rowwise_256x128x128x128_32x32_2x2_8x32x1_8x32x1_1x32x1x8_8x8x1_1x1_intrawave_v3,827.02,1473.93,0
256,4096,5120,1280,13,0,50.6317,a8w8_rowwise_256x128x128x128_32x32_2x2_8x32x1_8x32x1_1x32x1x8_8x8x1_1x1_intrawave_v3,1060.35,1061.38,0
256,4096,5120,3200,4,0,86.6115,a8w8_rowwise_256x256x160x128_32x32_2x5_8x32x1_8x32x1_1x64x1x4_8x8x1_2x1_intrawave_v3,1549.65,824.77,0
256,4096,5120,5120,15,0,177.0814,a8w8_rowwise_256x128x64x256_32x32_2x1_16x16x1_16x16x1_1x32x1x8_8x8x1_1x1_intrawave_v3,1212.71,503.32,0
256,4096,5120,6400,4,0,162.2341,a8w8_rowwise_256x256x160x128_32x32_2x5_8x32x1_8x32x1_1x64x1x4_8x8x1_2x1_intrawave_v3,1654.62,622.1,0
256,4096,5120,25600,15,0,782.4893,a8w8_rowwise_256x128x64x256_32x32_2x1_16x16x1_16x16x1_1x32x1x8_8x8x1_1x1_intrawave_v3,1372.21,355.11,0
256,4096,6400,5120,39,0,188.523,a8w8_rowwise_256x224x256x128_16x16_7x8_8x32x1_8x32x1_1x32x1x8_8x8x1_1x2_intrawave_v3,1423.89,563.16,0
256,4096,7168,8192,2,0,219.2844,a8w8_rowwise_256x256x224x128_32x32_2x7_8x32x1_8x32x1_1x64x1x4_8x8x1_2x1_intrawave_v3,2193.66,688.58,0
256,4096,8192,1024,1,0,55.6305,a8w8_rowwise_256x256x256x128_32x32_4x4_8x32x1_8x32x1_1x32x1x8_8x8x1_1x1_intrawave_v3,1235.28,1432.52,0
256,4096,8192,2048,1,0,83.0059,a8w8_rowwise_256x256x256x128_32x32_4x4_8x32x1_8x32x1_1x32x1x8_8x8x1_1x1_intrawave_v3,1655.77,1111.66,0
256,4096,8192,3584,1,0,122.3648,a8w8_rowwise_256x256x256x128_32x32_4x4_8x32x1_8x32x1_1x32x1x8_8x8x1_1x1_intrawave_v3,1965.58,908.34,0
256,4096,8192,7168,1,0,215.6239,a8w8_rowwise_256x256x256x128_32x32_4x4_8x32x1_8x32x1_1x32x1x8_8x8x1_1x1_intrawave_v3,2230.9,719.72,0
256,4096,8192,8192,1,0,240.0438,a8w8_rowwise_256x256x256x128_32x32_4x4_8x32x1_8x32x1_1x32x1x8_8x8x1_1x1_intrawave_v3,2290.23,698.92,0
256,4096,8192,28672,1,0,764.1022,a8w8_rowwise_256x256x256x128_32x32_4x4_8x32x1_8x32x1_1x32x1x8_8x8x1_1x1_intrawave_v3,2518.18,548.92,0
256,4096,9216,16384,39,0,778.6417,a8w8_rowwise_256x224x256x128_16x16_7x8_8x32x1_8x32x1_1x32x1x8_8x8x1_1x2_intrawave_v3,1588.6,377.07,0
256,4096,10240,8192,1,0,318.603,a8w8_rowwise_256x256x256x128_32x32_4x4_8x32x1_8x32x1_1x32x1x8_8x8x1_1x1_intrawave_v3,2156.9,631.9,0
256,4096,12800,5120,39,0,356.6531,a8w8_rowwise_256x224x256x128_16x16_7x8_8x32x1_8x32x1_1x32x1x8_8x8x1_1x2_intrawave_v3,1505.3,536.56,0
256,4096,13312,16384,10,0,1114.1158,a8w8_rowwise_256x128x192x128_32x32_2x3_8x32x1_8x32x1_1x32x1x8_8x8x1_1x1_intrawave_v3,1603.7,353.88,0
256,4096,16384,2048,1,0,205.0841,a8w8_rowwise_256x256x256x128_32x32_4x4_8x32x1_8x32x1_1x32x1x8_8x8x1_1x1_intrawave_v3,1340.32,858.97,0
256,4096,16384,4096,39,0,353.73,a8w8_rowwise_256x224x256x128_16x16_7x8_8x32x1_8x32x1_1x32x1x8_8x8x1_1x2_intrawave_v3,1554.17,616.58,0
256,4096,16384,6656,39,0,561.0198,a8w8_rowwise_256x224x256x128_16x16_7x8_8x32x1_8x32x1_1x32x1x8_8x8x1_1x2_intrawave_v3,1592.37,482.22,0
256,4096,16384,8192,39,0,657.0519,a8w8_rowwise_256x224x256x128_16x16_7x8_8x32x1_8x32x1_1x32x1x8_8x8x1_1x2_intrawave_v3,1673.4,459.61,0
256,4096,16384,13312,1,0,1080.1678,a8w8_rowwise_256x256x256x128_32x32_4x4_8x32x1_8x32x1_1x32x1x8_8x8x1_1x1_intrawave_v3,1654.1,376.65,0
256,4096,16384,26624,1,0,2197.8702,a8w8_rowwise_256x256x256x128_32x32_4x4_8x32x1_8x32x1_1x32x1x8_8x8x1_1x1_intrawave_v3,1625.85,309.15,0
256,4096,26624,16384,10,0,2199.7579,a8w8_rowwise_256x128x192x128_32x32_2x3_8x32x1_8x32x1_1x32x1x8_8x8x1_1x1_intrawave_v3,1624.46,327.95,0
256,4096,51200,5120,1,0,1418.8126,a8w8_rowwise_256x256x256x128_32x32_4x4_8x32x1_8x32x1_1x32x1x8_8x8x1_1x1_intrawave_v3,1513.58,495.16,0
256,4096,53248,16384,1,0,4075.2597,a8w8_rowwise_256x256x256x128_32x32_4x4_8x32x1_8x32x1_1x32x1x8_8x8x1_1x1_intrawave_v3,1753.71,337.58,0
256,4096,57344,8192,1,0,1617.8989,a8w8_rowwise_256x256x256x128_32x32_4x4_8x32x1_8x32x1_1x32x1x8_8x8x1_1x1_intrawave_v3,2378.57,601.45,0
256,8192,100,5120,29,0,27.2037,a8w8_rowwise_256x32x96x256_16x16_1x3_16x16x1_16x16x1_1x32x1x8_4x4x1_1x1_intrawave_v3,308.36,1620.86,0
256,8192,200,5120,21,0,25.2734,a8w8_rowwise_256x64x128x256_32x32_1x2_16x16x1_16x16x1_1x32x1x8_8x8x1_1x1_intrawave_v3,663.83,1829.74,0
256,8192,800,5120,41,0,65.9722,a8w8_rowwise_256x128x128x128_32x32_2x2_8x32x1_8x32x1_1x32x1x8_8x8x1_1x1_intrawave_v5,1017.23,896.53,0
256,8192,1280,8192,4,0,95.3807,a8w8_rowwise_256x256x160x128_32x32_2x5_8x32x1_8x32x1_1x64x1x4_8x8x1_2x1_intrawave_v3,1801.19,1033.4,0
256,8192,2304,16384,15,0,463.8213,a8w8_rowwise_256x128x64x256_32x32_2x1_16x16x1_16x16x1_1x32x1x8_8x8x1_1x1_intrawave_v3,1333.43,452.15,0
256,8192,2560,8192,4,0,173.6356,a8w8_rowwise_256x256x160x128_32x32_2x5_8x32x1_8x32x1_1x64x1x4_8x8x1_2x1_intrawave_v3,1978.84,748.83,0
256,8192,4608,16384,39,0,844.5637,a8w8_rowwise_256x224x256x128_16x16_7x8_8x32x1_8x32x1_1x32x1x8_8x8x1_1x2_intrawave_v3,1464.6,337.7,0
256,8192,5120,640,42,0,55.1814,a8w8_rowwise_256x128x256x64_32x32_2x4_4x64x1_4x64x1_1x32x1x8_8x8x1_1x1_interwave_v1,972.92,1674.58,0
256,8192,5120,1280,39,0,86.4091,a8w8_rowwise_256x224x256x128_16x16_7x8_8x32x1_8x32x1_1x32x1x8_8x8x1_1x2_intrawave_v3,1242.63,1168,0
256,8192,5120,3200,40,0,149.3935,a8w8_rowwise_256x256x224x128_16x16_8x7_8x32x1_8x32x1_1x64x1x4_8x8x1_2x1_intrawave_v3,1796.83,846.65,0
256,8192,5120,5120,39,0,277.9848,a8w8_rowwise_256x224x256x128_16x16_7x8_8x32x1_8x32x1_1x32x1x8_8x8x1_1x2_intrawave_v3,1545.04,546.95,0
256,8192,5120,6400,40,0,276.3348,a8w8_rowwise_256x256x224x128_16x16_8x7_8x32x1_8x32x1_1x64x1x4_8x8x1_2x1_intrawave_v3,1942.83,611.88,0
256,8192,5120,25600,39,0,1513.1737,a8w8_rowwise_256x224x256x128_16x16_7x8_8x32x1_8x32x1_1x32x1x8_8x8x1_1x2_intrawave_v3,1419.19,280.65,0
256,8192,6400,5120,39,0,359.0195,a8w8_rowwise_256x224x256x128_16x16_7x8_8x32x1_8x32x1_1x32x1x8_8x8x1_1x2_intrawave_v3,1495.38,500.16,0
256,8192,7168,8192,2,0,420.8889,a8w8_rowwise_256x256x224x128_32x32_2x7_8x32x1_8x32x1_1x64x1x4_8x8x1_2x1_intrawave_v3,2285.81,577.99,0
256,8192,8192,1024,1,0,105.9654,a8w8_rowwise_256x256x256x128_32x32_4x4_8x32x1_8x32x1_1x32x1x8_8x8x1_1x1_intrawave_v3,1297.02,1424.95,0
256,8192,8192,2048,1,0,159.9883,a8w8_rowwise_256x256x256x128_32x32_4x4_8x32x1_8x32x1_1x32x1x8_8x8x1_1x1_intrawave_v3,1718.11,1048.65,0
256,8192,8192,3584,1,0,232.9396,a8w8_rowwise_256x256x256x128_32x32_4x4_8x32x1_8x32x1_1x32x1x8_8x8x1_1x1_intrawave_v3,2065.07,828.27,0
256,8192,8192,7168,1,0,412.978,a8w8_rowwise_256x256x256x128_32x32_4x4_8x32x1_8x32x1_1x32x1x8_8x8x1_1x1_intrawave_v3,2329.6,609.37,0
256,8192,8192,8192,1,0,469.2882,a8w8_rowwise_256x256x256x128_32x32_4x4_8x32x1_8x32x1_1x32x1x8_8x8x1_1x1_intrawave_v3,2342.93,572.01,0
256,8192,8192,28672,1,0,1532.6908,a8w8_rowwise_256x256x256x128_32x32_4x4_8x32x1_8x32x1_1x32x1x8_8x8x1_1x1_intrawave_v3,2510.81,394.06,0
256,8192,9216,16384,43,0,1557.3892,a8w8_rowwise_256x256x128x64_32x32_4x2_4x64x1_4x64x1_1x32x1x8_8x8x1_1x1_interwave_v1,1588.49,280.09,0
256,8192,10240,8192,1,0,575.9516,a8w8_rowwise_256x256x256x128_32x32_4x4_8x32x1_8x32x1_1x32x1x8_8x8x1_1x1_intrawave_v3,2386.29,553.46,0
256,8192,12800,5120,39,0,683.3672,a8w8_rowwise_256x224x256x128_16x16_7x8_8x32x1_8x32x1_1x32x1x8_8x8x1_1x2_intrawave_v3,1571.25,464.16,0
256,8192,13312,16384,40,0,2189.1084,a8w8_rowwise_256x256x224x128_16x16_8x7_8x32x1_8x32x1_1x64x1x4_8x8x1_2x1_intrawave_v3,1632.36,260.57,0
256,8192,16384,2048,39,0,392.4492,a8w8_rowwise_256x224x256x128_16x16_7x8_8x32x1_8x32x1_1x32x1x8_8x8x1_1x2_intrawave_v3,1400.83,812.25,0
256,8192,16384,4096,39,0,678.4652,a8w8_rowwise_256x224x256x128_16x16_7x8_8x32x1_8x32x1_1x32x1x8_8x8x1_1x2_intrawave_v3,1620.59,544.02,0
256,8192,16384,6656,39,0,1094.0621,a8w8_rowwise_256x224x256x128_16x16_7x8_8x32x1_8x32x1_1x32x1x8_8x8x1_1x2_intrawave_v3,1633.09,394.87,0
256,8192,16384,8192,1,0,1288.1354,a8w8_rowwise_256x256x256x128_32x32_4x4_8x32x1_8x32x1_1x32x1x8_8x8x1_1x1_intrawave_v3,1707.14,364.68,0
256,8192,16384,13312,1,0,2091.5748,a8w8_rowwise_256x256x256x128_32x32_4x4_8x32x1_8x32x1_1x32x1x8_8x8x1_1x1_intrawave_v3,1708.48,284.76,0
256,8192,16384,26624,1,0,4736.0103,a8w8_rowwise_256x256x256x128_32x32_4x4_8x32x1_8x32x1_1x32x1x8_8x8x1_1x1_intrawave_v3,1509.04,194.84,0
256,8192,26624,16384,40,0,4074.1172,a8w8_rowwise_256x256x224x128_16x16_8x7_8x32x1_8x32x1_1x64x1x4_8x8x1_2x1_intrawave_v3,1754.2,247.08,0
256,8192,51200,5120,1,0,2639.7599,a8w8_rowwise_256x256x256x128_32x32_4x4_8x32x1_8x32x1_1x32x1x8_8x8x1_1x1_intrawave_v3,1627.03,432.97,0
256,8192,53248,16384,40,0,8028.0784,a8w8_rowwise_256x256x224x128_16x16_8x7_8x32x1_8x32x1_1x64x1x4_8x8x1_2x1_intrawave_v3,1780.46,234.06,0
256,8192,57344,8192,1,0,3164.0659,a8w8_rowwise_256x256x256x128_32x32_4x4_8x32x1_8x32x1_1x32x1x8_8x8x1_1x1_intrawave_v3,2432.5,466.61,0
256,16384,100,5120,27,0,42.6746,a8w8_rowwise_256x32x160x256_16x16_1x5_16x16x1_16x16x1_1x32x1x8_4x4x1_1x1_intrawave_v3,393.14,2054.5,0
256,16384,200,5120,21,0,44.0772,a8w8_rowwise_256x64x128x256_32x32_1x2_16x16x1_16x16x1_1x32x1x8_8x8x1_1x1_intrawave_v3,761.27,2075.08,0
256,16384,800,5120,1,0,111.2384,a8w8_rowwise_256x256x256x128_32x32_4x4_8x32x1_8x32x1_1x32x1x8_8x8x1_1x1_intrawave_v3,1206.58,1026.59,0
256,16384,1280,8192,4,0,178.1119,a8w8_rowwise_256x256x160x128_32x32_2x5_8x32x1_8x32x1_1x64x1x4_8x8x1_2x1_intrawave_v3,1929.11,1047.92,0
256,16384,2304,16384,15,0,878.7062,a8w8_rowwise_256x128x64x256_32x32_2x1_16x16x1_16x16x1_1x32x1x8_8x8x1_1x1_intrawave_v3,1407.7,434.37,0
256,16384,2560,8192,1,0,329.1334,a8w8_rowwise_256x256x256x128_32x32_4x4_8x32x1_8x32x1_1x32x1x8_8x8x1_1x1_intrawave_v3,2087.89,726.38,0
256,16384,4608,16384,40,0,1632.4516,a8w8_rowwise_256x256x224x128_16x16_8x7_8x32x1_8x32x1_1x64x1x4_8x8x1_2x1_intrawave_v3,1515.45,303.18,0
256,16384,5120,640,43,0,99.8836,a8w8_rowwise_256x256x128x64_32x32_4x2_4x64x1_4x64x1_1x32x1x8_8x8x1_1x1_interwave_v1,1074.99,1817.46,0
256,16384,5120,1280,1,0,153.6015,a8w8_rowwise_256x256x256x128_32x32_4x4_8x32x1_8x32x1_1x32x1x8_8x8x1_1x1_intrawave_v3,1398.09,1271.45,0
256,16384,5120,3200,1,0,271.2735,a8w8_rowwise_256x256x256x128_32x32_4x4_8x32x1_8x32x1_1x32x1x8_8x8x1_1x1_intrawave_v3,1979.08,872.13,0
256,16384,5120,5120,1,0,518.1604,a8w8_rowwise_256x256x256x128_32x32_4x4_8x32x1_8x32x1_1x32x1x8_8x8x1_1x1_intrawave_v3,1657.78,536.27,0
256,16384,5120,6400,1,0,543.7765,a8w8_rowwise_256x256x256x128_32x32_4x4_8x32x1_8x32x1_1x32x1x8_8x8x1_1x1_intrawave_v3,1974.6,561.62,0
256,16384,5120,25600,1,0,2869.8056,a8w8_rowwise_256x256x256x128_32x32_4x4_8x32x1_8x32x1_1x32x1x8_8x8x1_1x1_intrawave_v3,1496.61,250.29,0
256,16384,6400,5120,40,0,690.0605,a8w8_rowwise_256x256x224x128_16x16_8x7_8x32x1_8x32x1_1x64x1x4_8x8x1_2x1_intrawave_v3,1556.01,472.96,0
256,16384,7168,8192,1,0,815.6995,a8w8_rowwise_256x256x256x128_32x32_4x4_8x32x1_8x32x1_1x32x1x8_8x8x1_1x1_intrawave_v3,2358.89,524.48,0
256,16384,8192,1024,10,0,198.2601,a8w8_rowwise_256x128x192x128_32x32_2x3_8x32x1_8x32x1_1x32x1x8_8x8x1_1x1_intrawave_v3,1386.45,1480.89,0
256,16384,8192,2048,1,0,299.7045,a8w8_rowwise_256x256x256x128_32x32_4x4_8x32x1_8x32x1_1x32x1x8_8x8x1_1x1_intrawave_v3,1834.33,1063.6,0
256,16384,8192,3584,1,0,463.2471,a8w8_rowwise_256x256x256x128_32x32_4x4_8x32x1_8x32x1_1x32x1x8_8x8x1_1x1_intrawave_v3,2076.8,769.6,0
256,16384,8192,7168,1,0,819.3844,a8w8_rowwise_256x256x256x128_32x32_4x4_8x32x1_8x32x1_1x32x1x8_8x8x1_1x1_intrawave_v3,2348.28,542.6,0
256,16384,8192,8192,1,0,933.9446,a8w8_rowwise_256x256x256x128_32x32_4x4_8x32x1_8x32x1_1x32x1x8_8x8x1_1x1_intrawave_v3,2354.55,502.99,0
256,16384,8192,28672,1,0,3088.0838,a8w8_rowwise_256x256x256x128_32x32_4x4_8x32x1_8x32x1_1x32x1x8_8x8x1_1x1_intrawave_v3,2492.35,315.11,0
256,16384,9216,16384,1,0,2949.0967,a8w8_rowwise_256x256x256x128_32x32_4x4_8x32x1_8x32x1_1x32x1x8_8x8x1_1x1_intrawave_v3,1677.73,244.62,0
256,16384,10240,8192,1,0,1149.3883,a8w8_rowwise_256x256x256x128_32x32_4x4_8x32x1_8x32x1_1x32x1x8_8x8x1_1x1_intrawave_v3,2391.51,481.69,0
256,16384,12800,5120,39,0,1303.8826,a8w8_rowwise_256x224x256x128_16x16_7x8_8x32x1_8x32x1_1x32x1x8_8x8x1_1x2_intrawave_v3,1646.99,436.28,0
256,16384,13312,16384,1,0,4134.6494,a8w8_rowwise_256x256x256x128_32x32_4x4_8x32x1_8x32x1_1x32x1x8_8x8x1_1x1_intrawave_v3,1728.52,223.17,0
256,16384,16384,2048,1,0,719.1952,a8w8_rowwise_256x256x256x128_32x32_4x4_8x32x1_8x32x1_1x32x1x8_8x8x1_1x1_intrawave_v3,1528.81,839.8,0
256,16384,16384,4096,39,0,1327.6342,a8w8_rowwise_256x224x256x128_16x16_7x8_8x32x1_8x32x1_1x32x1x8_8x8x1_1x2_intrawave_v3,1656.35,505.48,0
256,16384,16384,6656,39,0,2120.7951,a8w8_rowwise_256x224x256x128_16x16_7x8_8x32x1_8x32x1_1x32x1x8_8x8x1_1x2_intrawave_v3,1684.94,355.99,0
256,16384,16384,8192,1,0,2555.2385,a8w8_rowwise_256x256x256x128_32x32_4x4_8x32x1_8x32x1_1x32x1x8_8x8x1_1x1_intrawave_v3,1721.19,315.16,0
256,16384,16384,13312,1,0,4157.4955,a8w8_rowwise_256x256x256x128_32x32_4x4_8x32x1_8x32x1_1x32x1x8_8x8x1_1x1_intrawave_v3,1719.02,234.05,0
256,16384,16384,26624,1,0,9368.503,a8w8_rowwise_256x256x256x128_32x32_4x4_8x32x1_8x32x1_1x32x1x8_8x8x1_1x1_intrawave_v3,1525.71,150.43,0
256,16384,26624,16384,40,0,8090.2903,a8w8_rowwise_256x256x224x128_16x16_8x7_8x32x1_8x32x1_1x64x1x4_8x8x1_2x1_intrawave_v3,1766.77,194.93,0
256,16384,51200,5120,1,0,5290.8019,a8w8_rowwise_256x256x256x128_32x32_4x4_8x32x1_8x32x1_1x32x1x8_8x8x1_1x1_intrawave_v3,1623.56,382.5,0
256,16384,53248,16384,40,0,15996.8357,a8w8_rowwise_256x256x224x128_16x16_8x7_8x32x1_8x32x1_1x64x1x4_8x8x1_2x1_intrawave_v3,1787.06,180.39,0
256,16384,57344,8192,1,0,6467.762,a8w8_rowwise_256x256x256x128_32x32_4x4_8x32x1_8x32x1_1x32x1x8_8x8x1_1x1_intrawave_v3,2379.98,383.91,0
256,32768,100,5120,27,0,78.5325,a8w8_rowwise_256x32x160x256_16x16_1x5_16x16x1_16x16x1_1x32x1x8_4x4x1_1x1_intrawave_v3,427.27,2226.31,0
256,32768,200,5120,21,0,82.0643,a8w8_rowwise_256x64x128x256_32x32_1x2_16x16x1_16x16x1_1x32x1x8_8x8x1_1x1_intrawave_v3,817.76,2216.6,0
256,32768,800,5120,1,0,216.0528,a8w8_rowwise_256x256x256x128_32x32_4x4_8x32x1_8x32x1_1x32x1x8_8x8x1_1x1_intrawave_v3,1242.45,1038.16,0
256,32768,1280,8192,1,0,339.8668,a8w8_rowwise_256x256x256x128_32x32_4x4_8x32x1_8x32x1_1x32x1x8_8x8x1_1x1_intrawave_v3,2021.95,1067.5,0
256,32768,2304,16384,1,0,1717.9546,a8w8_rowwise_256x256x256x128_32x32_4x4_8x32x1_8x32x1_1x32x1x8_8x8x1_1x1_intrawave_v3,1440.03,422.37,0
256,32768,2560,8192,1,0,599.612,a8w8_rowwise_256x256x256x128_32x32_4x4_8x32x1_8x32x1_1x32x1x8_8x8x1_1x1_intrawave_v3,2292.13,762.46,0
256,32768,4608,16384,40,0,3026.9648,a8w8_rowwise_256x256x224x128_16x16_8x7_8x32x1_8x32x1_1x64x1x4_8x8x1_2x1_intrawave_v3,1634.58,302.07,0
256,32768,5120,640,43,0,191.0117,a8w8_rowwise_256x256x128x64_32x32_4x2_4x64x1_4x64x1_1x32x1x8_8x8x1_1x1_interwave_v1,1124.27,1883.62,0
256,32768,5120,1280,1,0,299.0856,a8w8_rowwise_256x256x256x128_32x32_4x4_8x32x1_8x32x1_1x32x1x8_8x8x1_1x1_intrawave_v3,1436.03,1284.05,0
256,32768,5120,3200,1,0,538.4921,a8w8_rowwise_256x256x256x128_32x32_4x4_8x32x1_8x32x1_1x32x1x8_8x8x1_1x1_intrawave_v3,1993.98,848.27,0
256,32768,5120,5120,40,0,999.0598,a8w8_rowwise_256x256x224x128_16x16_8x7_8x32x1_8x32x1_1x64x1x4_8x8x1_2x1_intrawave_v3,1719.6,530.03,0
256,32768,5120,6400,1,0,1028.2651,a8w8_rowwise_256x256x256x128_32x32_4x4_8x32x1_8x32x1_1x32x1x8_8x8x1_1x1_intrawave_v3,2088.45,562.14,0
256,32768,5120,25600,1,0,5734.5832,a8w8_rowwise_256x256x256x128_32x32_4x4_8x32x1_8x32x1_1x32x1x8_8x8x1_1x1_intrawave_v3,1497.92,227.65,0
256,32768,6400,5120,40,0,1274.1106,a8w8_rowwise_256x256x224x128_16x16_8x7_8x32x1_8x32x1_1x64x1x4_8x8x1_2x1_intrawave_v3,1685.48,486.59,0
256,32768,7168,8192,1,0,1620.6254,a8w8_rowwise_256x256x256x128_32x32_4x4_8x32x1_8x32x1_1x32x1x8_8x8x1_1x1_intrawave_v3,2374.57,491.73,0
256,32768,8192,1024,10,0,379.9256,a8w8_rowwise_256x128x192x128_32x32_2x3_8x32x1_8x32x1_1x32x1x8_8x8x1_1x1_intrawave_v3,1447.01,1523.49,0
256,32768,8192,2048,1,0,594.1387,a8w8_rowwise_256x256x256x128_32x32_4x4_8x32x1_8x32x1_1x32x1x8_8x8x1_1x1_intrawave_v3,1850.6,1044.8,0
256,32768,8192,3584,1,0,899.1908,a8w8_rowwise_256x256x256x128_32x32_4x4_8x32x1_8x32x1_1x32x1x8_8x8x1_1x1_intrawave_v3,2139.86,760.32,0
256,32768,8192,7168,1,0,1640.4404,a8w8_rowwise_256x256x256x128_32x32_4x4_8x32x1_8x32x1_1x32x1x8_8x8x1_1x1_intrawave_v3,2345.89,506.25,0
256,32768,8192,8192,1,0,1837.7153,a8w8_rowwise_256x256x256x128_32x32_4x4_8x32x1_8x32x1_1x32x1x8_8x8x1_1x1_intrawave_v3,2393.21,474.73,0
256,32768,8192,28672,1,0,6209.7387,a8w8_rowwise_256x256x256x128_32x32_4x4_8x32x1_8x32x1_1x32x1x8_8x8x1_1x1_intrawave_v3,2478.87,275.58,0
256,32768,9216,16384,1,0,5884.19,a8w8_rowwise_256x256x256x128_32x32_4x4_8x32x1_8x32x1_1x32x1x8_8x8x1_1x1_intrawave_v3,1681.73,219.55,0
256,32768,10240,8192,1,0,2299.333,a8w8_rowwise_256x256x256x128_32x32_4x4_8x32x1_8x32x1_1x32x1x8_8x8x1_1x1_intrawave_v3,2390.94,445.09,0
256,32768,12800,5120,39,0,2481.3683,a8w8_rowwise_256x224x256x128_16x16_7x8_8x32x1_8x32x1_1x32x1x8_8x8x1_1x2_intrawave_v3,1730.89,432.09,0
256,32768,13312,16384,40,0,8230.5195,a8w8_rowwise_256x256x224x128_16x16_8x7_8x32x1_8x32x1_1x64x1x4_8x8x1_2x1_intrawave_v3,1736.66,197.73,0
256,32768,16384,2048,1,0,1409.7173,a8w8_rowwise_256x256x256x128_32x32_4x4_8x32x1_8x32x1_1x32x1x8_8x8x1_1x1_intrawave_v3,1559.9,833.08,0
256,32768,16384,4096,39,0,2546.0869,a8w8_rowwise_256x224x256x128_16x16_7x8_8x32x1_8x32x1_1x32x1x8_8x8x1_1x2_intrawave_v3,1727.37,500.8,0
256,32768,16384,6656,39,0,4073.3594,a8w8_rowwise_256x224x256x128_16x16_7x8_8x32x1_8x32x1_1x32x1x8_8x8x1_1x2_intrawave_v3,1754.53,343.92,0
256,32768,16384,8192,39,0,4965.434,a8w8_rowwise_256x224x256x128_16x16_7x8_8x32x1_8x32x1_1x32x1x8_8x8x1_1x2_intrawave_v3,1771.47,297.33,0
256,32768,16384,13312,1,0,8271.2663,a8w8_rowwise_256x256x256x128_32x32_4x4_8x32x1_8x32x1_1x32x1x8_8x8x1_1x1_intrawave_v3,1728.11,208.92,0
256,32768,16384,26624,1,0,19064.3766,a8w8_rowwise_256x256x256x128_32x32_4x4_8x32x1_8x32x1_1x32x1x8_8x8x1_1x1_intrawave_v3,1499.51,124.96,0
256,32768,26624,16384,40,0,16029.2644,a8w8_rowwise_256x256x224x128_16x16_8x7_8x32x1_8x32x1_1x64x1x4_8x8x1_2x1_intrawave_v3,1783.44,169.56,0
256,32768,51200,5120,1,0,10610.0611,a8w8_rowwise_256x256x256x128_32x32_4x4_8x32x1_8x32x1_1x32x1x8_8x8x1_1x1_intrawave_v3,1619.21,356.77,0
256,32768,53248,16384,40,0,31823.1958,a8w8_rowwise_256x256x224x128_16x16_8x7_8x32x1_8x32x1_1x64x1x4_8x8x1_2x1_intrawave_v3,1796.63,153.94,0
256,32768,57344,8192,1,0,12840.4952,a8w8_rowwise_256x256x256x128_32x32_4x4_8x32x1_8x32x1_1x32x1x8_8x8x1_1x1_intrawave_v3,2397.6,350.17,0
80,1,1280,8192,34,0,20.5611,a8w8_rowwise_256x16x64x512_16x16_1x1_32x8x1_32x8x1_1x16x1x16_4x4x1_1x1_intrawave_v3,1.02,510.5,0
80,32,1280,8192,34,0,19.9841,a8w8_rowwise_256x16x64x512_16x16_1x1_32x8x1_32x8x1_1x16x1x16_4x4x1_1x1_intrawave_v3,33.58,541.92,0
80,64,1280,8192,34,0,19.6589,a8w8_rowwise_256x16x64x512_16x16_1x1_32x8x1_32x8x1_1x16x1x16_4x4x1_1x1_intrawave_v3,68.27,568.39,0
80,128,1280,8192,30,0,23.3376,a8w8_rowwise_256x32x64x512_16x16_1x2_32x8x1_32x8x1_1x32x1x8_8x8x1_1x2_intrawave_v3,115.02,508.28,0
80,192,1280,8192,23,0,33.0028,a8w8_rowwise_256x64x64x512_32x32_1x1_32x8x1_32x8x1_1x32x1x8_8x8x1_1x1_intrawave_v3,122.01,380.28,0
80,256,1280,8192,23,0,33.3204,a8w8_rowwise_256x64x64x512_32x32_1x1_32x8x1_32x8x1_1x32x1x8_8x8x1_1x1_intrawave_v3,161.12,397.3,0
80,320,1280,8192,21,0,54.4822,a8w8_rowwise_256x64x128x256_32x32_1x2_16x16x1_16x16x1_1x32x1x8_8x8x1_1x1_intrawave_v3,123.18,255.61,0
80,512,1280,8192,21,0,55.0378,a8w8_rowwise_256x64x128x256_32x32_1x2_16x16x1_16x16x1_1x32x1x8_8x8x1_1x1_intrawave_v3,195.09,290.54,0
80,1024,1280,8192,13,0,88.6516,a8w8_rowwise_256x128x128x128_32x32_2x2_8x32x1_8x32x1_1x32x1x8_8x8x1_1x1_intrawave_v3,242.24,242.48,0
80,2048,1280,8192,13,0,140.7575,a8w8_rowwise_256x128x128x128_32x32_2x2_8x32x1_8x32x1_1x32x1x8_8x8x1_1x1_intrawave_v3,305.13,230.94,0
80,4096,1280,8192,13,0,275.3109,a8w8_rowwise_256x128x128x128_32x32_2x2_8x32x1_8x32x1_1x32x1x8_8x8x1_1x1_intrawave_v3,312.01,198.05,0
80,8192,1280,8192,13,0,545.0371,a8w8_rowwise_256x128x128x128_32x32_2x2_8x32x1_8x32x1_1x32x1x8_8x8x1_1x1_intrawave_v3,315.21,180.84,0
80,16384,1280,8192,13,0,1075.9373,a8w8_rowwise_256x128x128x128_32x32_2x2_8x32x1_8x32x1_1x32x1x8_8x8x1_1x1_intrawave_v3,319.35,173.47,0
80,1,8192,1024,78,0,9.1327,a8w8_rowwise_64x16x16x128_16x16_1x1_8x8x1_8x8x1_1x16x1x4_4x4x1_1x1_interwave_v2,1.84,920.43,0
80,32,8192,1024,28,0,9.9382,a8w8_rowwise_256x32x128x256_32x32_1x1_16x16x1_16x16x1_1x32x1x8_8x8x1_1x1_intrawave_v3,54.02,900.13,0
80,64,8192,1024,21,0,13.6554,a8w8_rowwise_256x64x128x256_32x32_1x2_16x16x1_16x16x1_1x32x1x8_8x8x1_1x1_intrawave_v3,78.63,695.89,0
80,128,8192,1024,45,0,20.3684,a8w8_rowwise_256x128x64x128_32x32_2x1_8x32x1_8x32x1_1x32x1x8_8x8x1_1x1_intrawave_v3,105.43,521.24,0
80,192,8192,1024,47,0,26.1312,a8w8_rowwise_256x64x64x128_32x32_1x1_8x32x1_8x32x1_1x32x1x8_8x8x1_1x1_intrawave_v3,123.27,448.92,0
80,256,8192,1024,13,0,29.7436,a8w8_rowwise_256x128x128x128_32x32_2x2_8x32x1_8x32x1_1x32x1x8_8x8x1_1x1_intrawave_v3,144.4,431.86,0
80,320,8192,1024,47,0,39.6412,a8w8_rowwise_256x64x64x128_32x32_1x1_8x32x1_8x32x1_1x32x1x8_8x8x1_1x1_intrawave_v3,135.43,352.14,0
80,512,8192,1024,13,0,52.947,a8w8_rowwise_256x128x128x128_32x32_2x2_8x32x1_8x32x1_1x32x1x8_8x8x1_1x1_intrawave_v3,162.24,326.77,0
80,1024,8192,1024,13,0,90.2628,a8w8_rowwise_256x128x128x128_32x32_2x2_8x32x1_8x32x1_1x32x1x8_8x8x1_1x1_intrawave_v3,190.33,290.42,0
80,2048,8192,1024,41,0,165.9552,a8w8_rowwise_256x128x128x128_32x32_2x2_8x32x1_8x32x1_1x32x1x8_8x8x1_1x1_intrawave_v5,207.04,265.37,0
80,4096,8192,1024,13,0,305.9089,a8w8_rowwise_256x128x128x128_32x32_2x2_8x32x1_8x32x1_1x32x1x8_8x8x1_1x1_intrawave_v3,224.64,260.51,0
80,8192,8192,1024,13,0,598.5803,a8w8_rowwise_256x128x128x128_32x32_2x2_8x32x1_8x32x1_1x32x1x8_8x8x1_1x1_intrawave_v3,229.61,252.26,0
80,16384,8192,1024,13,0,1176.7808,a8w8_rowwise_256x128x128x128_32x32_2x2_8x32x1_8x32x1_1x32x1x8_8x8x1_1x1_intrawave_v3,233.58,249.5,0
304,1,2304,16384,34,0,28.6795,a8w8_rowwise_256x16x64x512_16x16_1x1_32x8x1_32x8x1_1x16x1x16_4x4x1_1x1_intrawave_v3,2.63,1316.96,0.0
304,16,2304,16384,34,0,23.2689,a8w8_rowwise_256x16x64x512_16x16_1x1_32x8x1_32x8x1_1x16x1x16_4x4x1_1x1_intrawave_v3,51.91,1636.72,0.0
304,32,2304,16384,34,0,23.5703,a8w8_rowwise_256x16x64x512_16x16_1x1_32x8x1_32x8x1_1x16x1x16_4x4x1_1x1_intrawave_v3,102.5,1630.04,0.0
304,64,2304,16384,34,0,25.47,a8w8_rowwise_256x16x64x512_16x16_1x1_32x8x1_32x8x1_1x16x1x16_4x4x1_1x1_intrawave_v3,189.71,1534.83,0.0
304,128,2304,16384,30,0,32.7549,a8w8_rowwise_256x32x64x512_16x16_1x2_32x8x1_32x8x1_1x32x1x8_8x8x1_1x2_intrawave_v3,295.03,1234.49,0.0
304,256,2304,16384,30,0,46.9272,a8w8_rowwise_256x32x64x512_16x16_1x2_32x8x1_32x8x1_1x32x1x8_8x8x1_1x2_intrawave_v3,411.86,918.93,0.0
304,512,2304,16384,23,0,72.2141,a8w8_rowwise_256x64x64x512_32x32_1x1_32x8x1_32x8x1_1x32x1x8_8x8x1_1x1_intrawave_v3,535.28,671.57,0.0
304,1024,2304,16384,15,0,121.2888,a8w8_rowwise_256x128x64x256_32x32_2x1_16x16x1_16x16x1_1x32x1x8_8x8x1_1x1_intrawave_v3,637.4,488.46,0.0
304,2048,2304,16384,12,0,186.9998,a8w8_rowwise_256x128x128x256_32x32_2x2_16x16x1_16x16x1_1x32x1x8_8x8x1_1x1_intrawave_v3,826.84,431.77,0.0
304,4096,2304,16384,41,0,340.1495,a8w8_rowwise_256x128x128x128_32x32_2x2_8x32x1_8x32x1_1x32x1x8_8x8x1_1x1_intrawave_v5,909.12,363.76,0.0
304,8192,2304,16384,1,0,605.2873,a8w8_rowwise_256x256x256x128_32x32_4x4_8x32x1_8x32x1_1x32x1x8_8x8x1_1x1_intrawave_v3,1021.79,346.47,0.0
304,16384,2304,16384,1,0,1177.3348,a8w8_rowwise_256x256x256x128_32x32_4x4_8x32x1_8x32x1_1x32x1x8_8x8x1_1x1_intrawave_v3,1050.64,324.19,0.0
304,1,4608,16384,34,0,34.5767,a8w8_rowwise_256x16x64x512_16x16_1x1_32x8x1_32x8x1_1x16x1x16_4x4x1_1x1_intrawave_v3,4.37,2184.22,0.0
304,16,4608,16384,34,0,30.8324,a8w8_rowwise_256x16x64x512_16x16_1x1_32x8x1_32x8x1_1x16x1x16_4x4x1_1x1_intrawave_v3,78.36,2461.93,0.0
304,32,4608,16384,34,0,31.4376,a8w8_rowwise_256x16x64x512_16x16_1x1_32x8x1_32x8x1_1x16x1x16_4x4x1_1x1_intrawave_v3,153.7,2427.56,0.0
304,64,4608,16384,30,0,39.5064,a8w8_rowwise_256x32x64x512_16x16_1x2_32x8x1_32x8x1_1x32x1x8_8x8x1_1x2_intrawave_v3,244.61,1952.49,0.0
304,128,4608,16384,30,0,50.9774,a8w8_rowwise_256x32x64x512_16x16_1x2_32x8x1_32x8x1_1x32x1x8_8x8x1_1x2_intrawave_v3,379.14,1545.28,0.0
304,256,4608,16384,23,0,72.3774,a8w8_rowwise_256x64x64x512_32x32_1x1_32x8x1_32x8x1_1x32x1x8_8x8x1_1x1_intrawave_v3,534.07,1133.66,0.0
304,512,4608,16384,21,0,121.1695,a8w8_rowwise_256x64x128x256_32x32_1x2_16x16x1_16x16x1_1x32x1x8_8x8x1_1x1_intrawave_v3,638.03,731.25,0.0
304,1024,4608,16384,12,0,190.6199,a8w8_rowwise_256x128x128x256_32x32_2x2_16x16x1_16x16x1_1x32x1x8_8x8x1_1x1_intrawave_v3,811.14,533.58,0.0
304,2048,4608,16384,8,0,343.0006,a8w8_rowwise_256x128x256x128_32x32_2x4_8x32x1_8x32x1_1x32x1x8_8x8x1_1x1_intrawave_v3,901.57,372.96,0.0
304,4096,4608,16384,1,0,579.7297,a8w8_rowwise_256x256x256x128_32x32_4x4_8x32x1_8x32x1_1x32x1x8_8x8x1_1x1_intrawave_v3,1066.83,311.1,0.0
304,8192,4608,16384,1,0,1166.1022,a8w8_rowwise_256x256x256x128_32x32_4x4_8x32x1_8x32x1_1x32x1x8_8x8x1_1x1_intrawave_v3,1060.76,244.59,0.0
304,16384,4608,16384,1,0,2366.9547,a8w8_rowwise_256x256x256x128_32x32_4x4_8x32x1_8x32x1_1x32x1x8_8x8x1_1x1_intrawave_v3,1045.18,209.1,0.0
304,1,9216,16384,34,0,55.426,a8w8_rowwise_256x16x64x512_16x16_1x1_32x8x1_32x8x1_1x16x1x16_4x4x1_1x1_intrawave_v3,5.45,2724.89,0.0
304,16,9216,16384,34,0,54.4676,a8w8_rowwise_256x16x64x512_16x16_1x1_32x8x1_32x8x1_1x16x1x16_4x4x1_1x1_intrawave_v3,88.71,2782.42,0.0
304,32,9216,16384,30,0,56.4449,a8w8_rowwise_256x32x64x512_16x16_1x2_32x8x1_32x8x1_1x32x1x8_8x8x1_1x2_intrawave_v3,171.21,2694.82,0.0
304,64,9216,16384,30,0,63.489,a8w8_rowwise_256x32x64x512_16x16_1x2_32x8x1_32x8x1_1x32x1x8_8x8x1_1x2_intrawave_v3,304.42,2413.38,0.0
304,128,9216,16384,23,0,87.1118,a8w8_rowwise_256x64x64x512_32x32_1x1_32x8x1_32x8x1_1x32x1x8_8x8x1_1x1_intrawave_v3,443.74,1784.5,0.0
304,256,9216,16384,21,0,126.8029,a8w8_rowwise_256x64x128x256_32x32_1x2_16x16x1_16x16x1_1x32x1x8_8x8x1_1x1_intrawave_v3,609.68,1261.07,0.0
304,512,9216,16384,12,0,190.7462,a8w8_rowwise_256x128x128x256_32x32_2x2_16x16x1_16x16x1_1x32x1x8_8x8x1_1x1_intrawave_v3,810.6,885.05,0.0
304,1024,9216,16384,8,0,349.8704,a8w8_rowwise_256x128x256x128_32x32_2x4_8x32x1_8x32x1_1x32x1x8_8x8x1_1x1_intrawave_v3,883.86,533.47,0.0
304,2048,9216,16384,1,0,612.1422,a8w8_rowwise_256x256x256x128_32x32_4x4_8x32x1_8x32x1_1x32x1x8_8x8x1_1x1_intrawave_v3,1010.35,363.15,0.0
304,4096,9216,16384,1,0,1167.7788,a8w8_rowwise_256x256x256x128_32x32_4x4_8x32x1_8x32x1_1x32x1x8_8x8x1_1x1_intrawave_v3,1059.23,251.42,0.0
304,8192,9216,16384,1,0,2336.9927,a8w8_rowwise_256x256x256x128_32x32_4x4_8x32x1_8x32x1_1x32x1x8_8x8x1_1x1_intrawave_v3,1058.58,186.65,0.0
304,16384,9216,16384,3,0,4941.136,a8w8_rowwise_256x256x192x128_32x32_4x3_8x32x1_8x32x1_1x32x1x8_8x8x1_1x1_intrawave_v3,1001.35,146.0,0.0
304,1,16384,2048,60,0,12.3237,a8w8_rowwise_128x16x32x128_16x16_1x1_8x16x1_8x16x1_1x16x1x8_4x4x1_1x1_intrawave_v2,5.45,2725.58,0.0
304,16,16384,2048,79,0,12.5761,a8w8_rowwise_128x16x32x128_16x16_1x1_8x16x1_8x16x1_1x16x1x8_4x4x1_1x1_interwave_v2,85.38,2712.41,0.0
304,32,16384,2048,30,0,13.9189,a8w8_rowwise_256x32x64x512_16x16_1x2_32x8x1_32x8x1_1x32x1x8_8x8x1_1x2_intrawave_v3,154.29,2490.75,0.0
304,64,16384,2048,23,0,17.2724,a8w8_rowwise_256x64x64x512_32x32_1x1_32x8x1_32x8x1_1x32x1x8_8x8x1_1x1_intrawave_v3,248.66,2071.67,0.0
304,128,16384,2048,21,0,22.4401,a8w8_rowwise_256x64x128x256_32x32_1x2_16x16x1_16x16x1_1x32x1x8_8x8x1_1x1_intrawave_v3,382.79,1693.88,0.0
304,256,16384,2048,12,0,32.1694,a8w8_rowwise_256x128x128x256_32x32_2x2_16x16x1_16x16x1_1x32x1x8_8x8x1_1x1_intrawave_v3,534.04,1320.12,0.0
304,512,16384,2048,8,0,54.7246,a8w8_rowwise_256x128x256x128_32x32_2x4_8x32x1_8x32x1_1x32x1x8_8x8x1_1x1_intrawave_v3,627.87,938.89,0.0
304,1024,16384,2048,1,0,92.8645,a8w8_rowwise_256x256x256x128_32x32_4x4_8x32x1_8x32x1_1x32x1x8_8x8x1_1x1_intrawave_v3,740.0,745.24,0.0
304,2048,16384,2048,40,0,180.7233,a8w8_rowwise_256x256x224x128_16x16_8x7_8x32x1_8x32x1_1x64x1x4_8x8x1_2x1_intrawave_v3,760.49,580.21,0.0
304,4096,16384,2048,39,0,342.9705,a8w8_rowwise_256x224x256x128_16x16_7x8_8x32x1_8x32x1_1x32x1x8_8x8x1_1x2_intrawave_v3,801.46,513.63,0.0
304,8192,16384,2048,1,0,660.6535,a8w8_rowwise_256x256x256x128_32x32_4x4_8x32x1_8x32x1_1x32x1x8_8x8x1_1x1_intrawave_v3,832.14,482.5,0.0
304,16384,16384,2048,1,0,1232.0046,a8w8_rowwise_256x256x256x128_32x32_4x4_8x32x1_8x32x1_1x32x1x8_8x8x1_1x1_intrawave_v3,892.46,490.24,0.0
304,1,16384,4096,79,0,28.334,a8w8_rowwise_128x16x32x128_16x16_1x1_8x16x1_8x16x1_1x16x1x8_4x4x1_1x1_interwave_v2,4.74,2369.79,0.0
304,16,16384,4096,79,0,26.9573,a8w8_rowwise_128x16x32x128_16x16_1x1_8x16x1_8x16x1_1x16x1x8_4x4x1_1x1_interwave_v2,79.66,2511.33,0.0
304,32,16384,4096,34,0,30.2745,a8w8_rowwise_256x16x64x512_16x16_1x1_32x8x1_32x8x1_1x16x1x16_4x4x1_1x1_intrawave_v3,141.87,2255.64,0.0
304,64,16384,4096,23,0,34.0507,a8w8_rowwise_256x64x64x512_32x32_1x1_32x8x1_32x8x1_1x32x1x8_8x8x1_1x1_intrawave_v3,252.27,2040.14,0.0
304,128,16384,4096,21,0,41.5708,a8w8_rowwise_256x64x128x256_32x32_1x2_16x16x1_16x16x1_1x32x1x8_8x8x1_1x1_intrawave_v3,413.27,1727.83,0.0
304,256,16384,4096,12,0,57.0762,a8w8_rowwise_256x128x128x256_32x32_2x2_16x16x1_16x16x1_1x32x1x8_8x8x1_1x1_intrawave_v3,602.0,1341.12,0.0
304,512,16384,4096,9,0,96.7765,a8w8_rowwise_256x128x224x128_32x32_1x7_8x32x1_8x32x1_1x64x1x4_8x8x1_1x1_intrawave_v3,710.08,888.47,0.0
304,1024,16384,4096,40,0,163.5083,a8w8_rowwise_256x256x224x128_16x16_8x7_8x32x1_8x32x1_1x64x1x4_8x8x1_2x1_intrawave_v3,840.56,641.3,0.0
304,2048,16384,4096,1,0,312.9741,a8w8_rowwise_256x256x256x128_32x32_4x4_8x32x1_8x32x1_1x32x1x8_8x8x1_1x1_intrawave_v3,878.28,455.65,0.0
304,4096,16384,4096,5,0,597.5252,a8w8_rowwise_256x256x128x128_32x32_4x2_8x32x1_8x32x1_1x32x1x8_8x8x1_1x1_intrawave_v3,920.05,365.01,0.0
304,8192,16384,4096,1,0,1104.5749,a8w8_rowwise_256x256x256x128_32x32_4x4_8x32x1_8x32x1_1x32x1x8_8x8x1_1x1_intrawave_v3,995.42,334.15,0.0
304,16384,16384,4096,1,0,2258.4942,a8w8_rowwise_256x256x256x128_32x32_4x4_8x32x1_8x32x1_1x32x1x8_8x8x1_1x1_intrawave_v3,973.67,297.14,0.0
304,1,16384,8192,76,0,52.4221,a8w8_rowwise_128x32x16x128_16x16_1x1_8x16x1_8x16x1_1x16x1x8_2x2x1_1x1_interwave_v2,5.12,2561.11,0.0
304,16,16384,8192,79,0,46.6428,a8w8_rowwise_128x16x32x128_16x16_1x1_8x16x1_8x16x1_1x16x1x8_4x4x1_1x1_interwave_v2,92.08,2891.62,0.0
304,32,16384,8192,57,0,57.5903,a8w8_rowwise_128x32x16x128_16x16_1x1_8x16x1_8x16x1_1x16x1x8_2x2x1_1x1_intrawave_v2,149.16,2353.32,0.0
304,64,16384,8192,28,0,62.2452,a8w8_rowwise_256x32x128x256_32x32_1x1_16x16x1_16x16x1_1x32x1x8_8x8x1_1x1_intrawave_v3,276.0,2198.39,0.0
304,128,16384,8192,21,0,76.8511,a8w8_rowwise_256x64x128x256_32x32_1x2_16x16x1_16x16x1_1x32x1x8_8x8x1_1x1_intrawave_v3,447.09,1814.69,0.0
304,256,16384,8192,12,0,106.7914,a8w8_rowwise_256x128x128x256_32x32_2x2_16x16x1_16x16x1_1x32x1x8_8x8x1_1x1_intrawave_v3,643.49,1355.01,0.0
304,512,16384,8192,9,0,178.3552,a8w8_rowwise_256x128x224x128_32x32_1x7_8x32x1_8x32x1_1x64x1x4_8x8x1_1x1_intrawave_v3,770.59,870.11,0.0
304,1024,16384,8192,2,0,295.4391,a8w8_rowwise_256x256x224x128_32x32_2x7_8x32x1_8x32x1_1x64x1x4_8x8x1_2x1_intrawave_v3,930.4,596.27,0.0
304,2048,16384,8192,1,0,570.4739,a8w8_rowwise_256x256x256x128_32x32_4x4_8x32x1_8x32x1_1x32x1x8_8x8x1_1x1_intrawave_v3,963.68,382.32,0.0
304,4096,16384,8192,39,0,1134.3658,a8w8_rowwise_256x224x256x128_16x16_7x8_8x32x1_8x32x1_1x32x1x8_8x8x1_1x2_intrawave_v3,969.27,266.22,0.0
304,8192,16384,8192,1,0,2059.5688,a8w8_rowwise_256x256x256x128_32x32_4x4_8x32x1_8x32x1_1x32x1x8_8x8x1_1x1_intrawave_v3,1067.71,228.09,0.0
304,16384,16384,8192,1,0,4386.371,a8w8_rowwise_256x256x256x128_32x32_4x4_8x32x1_8x32x1_1x32x1x8_8x8x1_1x1_intrawave_v3,1002.66,183.59,0.0
304,1,13312,16384,34,0,71.7882,a8w8_rowwise_256x16x64x512_16x16_1x1_32x8x1_32x8x1_1x16x1x16_4x4x1_1x1_intrawave_v3,6.08,3038.76,0.0
304,16,13312,16384,79,0,72.6482,a8w8_rowwise_128x16x32x128_16x16_1x1_8x16x1_8x16x1_1x16x1x8_4x4x1_1x1_interwave_v2,96.07,3011.66,0.0
304,32,13312,16384,30,0,79.4559,a8w8_rowwise_256x32x64x512_16x16_1x2_32x8x1_32x8x1_1x32x1x8_8x8x1_1x2_intrawave_v3,175.68,2762.29,0.0
304,64,13312,16384,28,0,95.4713,a8w8_rowwise_256x32x128x256_32x32_1x1_16x16x1_16x16x1_1x32x1x8_8x8x1_1x1_intrawave_v3,292.42,2313.33,0.0
304,128,13312,16384,21,0,124.0871,a8w8_rowwise_256x64x128x256_32x32_1x2_16x16x1_16x16x1_1x32x1x8_8x8x1_1x1_intrawave_v3,449.96,1802.03,0.0
304,256,13312,16384,18,0,177.7085,a8w8_rowwise_256x64x192x256_32x32_1x3_16x16x1_16x16x1_1x32x1x8_8x8x1_1x1_intrawave_v3,628.38,1289.27,0.0
304,512,13312,16384,10,0,282.1335,a8w8_rowwise_256x128x192x128_32x32_2x3_8x32x1_8x32x1_1x32x1x8_8x8x1_1x1_intrawave_v3,791.61,851.1,0.0
304,1024,13312,16384,3,0,479.0662,a8w8_rowwise_256x256x192x128_32x32_4x3_8x32x1_8x32x1_1x32x1x8_8x8x1_1x1_intrawave_v3,932.39,547.2,0.0
304,2048,13312,16384,3,0,926.6322,a8w8_rowwise_256x256x192x128_32x32_4x3_8x32x1_8x32x1_1x32x1x8_8x8x1_1x1_intrawave_v3,964.09,330.43,0.0
304,4096,13312,16384,1,0,1694.3203,a8w8_rowwise_256x256x256x128_32x32_4x4_8x32x1_8x32x1_1x32x1x8_8x8x1_1x1_intrawave_v3,1054.53,232.7,0.0
304,8192,13312,16384,1,0,3350.4418,a8w8_rowwise_256x256x256x128_32x32_4x4_8x32x1_8x32x1_1x32x1x8_8x8x1_1x1_intrawave_v3,1066.55,170.25,0.0
304,16384,13312,16384,1,0,6940.3287,a8w8_rowwise_256x256x256x128_32x32_4x4_8x32x1_8x32x1_1x32x1x8_8x8x1_1x1_intrawave_v3,1029.75,132.95,0.0
304,1,26624,16384,79,0,132.9526,a8w8_rowwise_128x16x32x128_16x16_1x1_8x16x1_8x16x1_1x16x1x8_4x4x1_1x1_interwave_v2,6.56,3281.45,0.0
304,16,26624,16384,50,0,134.4203,a8w8_rowwise_128x16x32x128_16x16_1x1_8x16x1_8x16x1_1x16x1x8_4x4x1_1x1_intrawave_v1,103.84,3253.39,0.0
304,32,26624,16384,28,0,140.8074,a8w8_rowwise_256x32x128x256_32x32_1x1_16x16x1_16x16x1_1x32x1x8_8x8x1_1x1_intrawave_v3,198.27,3113.73,0.0
304,64,26624,16384,21,0,160.6647,a8w8_rowwise_256x64x128x256_32x32_1x2_16x16x1_16x16x1_1x32x1x8_8x8x1_1x1_intrawave_v3,347.52,2742.76,0.0
304,128,26624,16384,18,0,205.4418,a8w8_rowwise_256x64x192x256_32x32_1x3_16x16x1_16x16x1_1x32x1x8_8x8x1_1x1_intrawave_v3,543.56,2166.65,0.0
304,256,26624,16384,10,0,306.9355,a8w8_rowwise_256x128x192x128_32x32_2x3_8x32x1_8x32x1_1x32x1x8_8x8x1_1x1_intrawave_v3,727.64,1479.25,0.0
304,512,26624,16384,3,0,517.2821,a8w8_rowwise_256x256x192x128_32x32_4x3_8x32x1_8x32x1_1x32x1x8_8x8x1_1x1_intrawave_v3,863.51,912.19,0.0
304,1024,26624,16384,3,0,965.0278,a8w8_rowwise_256x256x192x128_32x32_4x3_8x32x1_8x32x1_1x32x1x8_8x8x1_1x1_intrawave_v3,925.73,525.9,0.0
304,2048,26624,16384,1,0,1723.4511,a8w8_rowwise_256x256x256x128_32x32_4x4_8x32x1_8x32x1_1x32x1x8_8x8x1_1x1_intrawave_v3,1036.7,335.85,0.0
304,4096,26624,16384,1,0,3514.236,a8w8_rowwise_256x256x256x128_32x32_4x4_8x32x1_8x32x1_1x32x1x8_8x8x1_1x1_intrawave_v3,1016.84,205.29,0.0
304,8192,26624,16384,1,0,7117.2259,a8w8_rowwise_256x256x256x128_32x32_4x4_8x32x1_8x32x1_1x32x1x8_8x8x1_1x1_intrawave_v3,1004.16,141.44,0.0
304,16384,26624,16384,1,0,14303.6898,a8w8_rowwise_256x256x256x128_32x32_4x4_8x32x1_8x32x1_1x32x1x8_8x8x1_1x1_intrawave_v3,999.3,110.26,0.0
304,1,53248,16384,61,0,249.8351,a8w8_rowwise_128x16x64x128_16x16_1x2_8x16x1_8x16x1_1x16x1x8_4x4x1_1x1_intrawave_v2,6.98,3492.46,0.0
304,16,53248,16384,61,0,258.7482,a8w8_rowwise_128x16x64x128_16x16_1x2_8x16x1_8x16x1_1x16x1x8_4x4x1_1x1_intrawave_v2,107.89,3379.27,0.0
304,32,53248,16384,29,0,273.3943,a8w8_rowwise_256x32x96x256_16x16_1x3_16x16x1_16x16x1_1x32x1x8_4x4x1_1x1_intrawave_v3,204.23,3205.43,0.0
304,64,53248,16384,21,0,319.4143,a8w8_rowwise_256x64x128x256_32x32_1x2_16x16x1_16x16x1_1x32x1x8_8x8x1_1x1_intrawave_v3,349.61,2755.92,0.0
304,128,53248,16384,10,0,366.3643,a8w8_rowwise_256x128x192x128_32x32_2x3_8x32x1_8x32x1_1x32x1x8_8x8x1_1x1_intrawave_v3,609.61,2424.21,0.0
304,256,53248,16384,3,0,557.2429,a8w8_rowwise_256x256x192x128_32x32_4x3_8x32x1_8x32x1_1x32x1x8_8x8x1_1x1_intrawave_v3,801.58,1622.04,0.0
304,512,53248,16384,3,0,1005.5382,a8w8_rowwise_256x256x192x128_32x32_4x3_8x32x1_8x32x1_1x32x1x8_8x8x1_1x1_intrawave_v3,888.43,930.18,0.0
304,1024,53248,16384,1,0,1779.7552,a8w8_rowwise_256x256x256x128_32x32_4x4_8x32x1_8x32x1_1x32x1x8_8x8x1_1x1_intrawave_v3,1003.91,560.89,0.0
304,2048,53248,16384,1,0,3471.8241,a8w8_rowwise_256x256x256x128_32x32_4x4_8x32x1_8x32x1_1x32x1x8_8x8x1_1x1_intrawave_v3,1029.26,323.77,0.0
304,4096,53248,16384,1,0,6922.4474,a8w8_rowwise_256x256x256x128_32x32_4x4_8x32x1_8x32x1_1x32x1x8_8x8x1_1x1_intrawave_v3,1032.41,198.73,0.0
304,8192,53248,16384,1,0,13586.757,a8w8_rowwise_256x256x256x128_32x32_4x4_8x32x1_8x32x1_1x32x1x8_8x8x1_1x1_intrawave_v3,1052.03,138.3,0.0
304,16384,53248,16384,1,0,27428.455,a8w8_rowwise_256x256x256x128_32x32_4x4_8x32x1_8x32x1_1x32x1x8_8x8x1_1x1_intrawave_v3,1042.25,105.21,0.0
304,1,16384,6656,34,0,31.3479,a8w8_rowwise_256x16x64x512_16x16_1x1_32x8x1_32x8x1_1x16x1x16_4x4x1_1x1_intrawave_v3,6.96,3480.02,0.0
304,16,16384,6656,60,0,32.8949,a8w8_rowwise_128x16x32x128_16x16_1x1_8x16x1_8x16x1_1x16x1x8_4x4x1_1x1_intrawave_v2,106.09,3334.34,0.0
304,32,16384,6656,30,0,32.7568,a8w8_rowwise_256x32x64x512_16x16_1x2_32x8x1_32x8x1_1x32x1x8_8x8x1_1x2_intrawave_v3,213.06,3367.65,0.0
304,64,16384,6656,23,0,39.3254,a8w8_rowwise_256x64x64x512_32x32_1x1_32x8x1_32x8x1_1x32x1x8_8x8x1_1x1_intrawave_v3,354.95,2837.23,0.0
304,128,16384,6656,21,0,56.9313,a8w8_rowwise_256x64x128x256_32x32_1x2_16x16x1_16x16x1_1x32x1x8_8x8x1_1x1_intrawave_v3,490.37,2004.14,0.0
304,256,16384,6656,12,0,85.1283,a8w8_rowwise_256x128x128x256_32x32_2x2_16x16x1_16x16x1_1x32x1x8_8x8x1_1x1_intrawave_v3,655.89,1399.59,0.0
304,512,16384,6656,8,0,145.1711,a8w8_rowwise_256x128x256x128_32x32_2x4_8x32x1_8x32x1_1x32x1x8_8x8x1_1x1_intrawave_v3,769.22,890.24,0.0
304,1024,16384,6656,1,0,254.0318,a8w8_rowwise_256x256x256x128_32x32_4x4_8x32x1_8x32x1_1x32x1x8_8x8x1_1x1_intrawave_v3,879.17,588.2,0.0
304,2048,16384,6656,2,0,476.6825,a8w8_rowwise_256x256x224x128_32x32_2x7_8x32x1_8x32x1_1x64x1x4_8x8x1_2x1_intrawave_v3,937.05,398.15,0.0
304,4096,16384,6656,39,0,928.8166,a8w8_rowwise_256x224x256x128_16x16_7x8_8x32x1_8x32x1_1x32x1x8_8x8x1_1x2_intrawave_v3,961.82,291.27,0.0
304,8192,16384,6656,1,0,1780.685,a8w8_rowwise_256x256x256x128_32x32_4x4_8x32x1_8x32x1_1x32x1x8_8x8x1_1x1_intrawave_v3,1003.38,242.61,0.0
304,16384,16384,6656,0,0,3594.5515,a8w8_rowwise_256x256x256x64_32x32_4x4_4x64x1_4x64x1_1x32x1x8_8x8x1_1x1_intrawave_v4,994.12,210.03,0.0
304,1,16384,13312,34,0,58.6816,a8w8_rowwise_256x16x64x512_16x16_1x1_32x8x1_32x8x1_1x16x1x16_4x4x1_1x1_intrawave_v3,7.43,3717.52,0.0
304,16,16384,13312,34,0,56.7555,a8w8_rowwise_256x16x64x512_16x16_1x1_32x8x1_32x8x1_1x16x1x16_4x4x1_1x1_intrawave_v3,122.97,3855.86,0.0
304,32,16384,13312,30,0,61.708,a8w8_rowwise_256x32x64x512_16x16_1x2_32x8x1_32x8x1_1x32x1x8_8x8x1_1x2_intrawave_v3,226.2,3558.35,0.0
304,64,16384,13312,23,0,81.1462,a8w8_rowwise_256x64x64x512_32x32_1x1_32x8x1_32x8x1_1x32x1x8_8x8x1_1x1_intrawave_v3,344.04,2724.13,0.0
304,128,16384,13312,21,0,109.5328,a8w8_rowwise_256x64x128x256_32x32_1x2_16x16x1_16x16x1_1x32x1x8_8x8x1_1x1_intrawave_v3,509.75,2045.07,0.0
304,256,16384,13312,12,0,157.448,a8w8_rowwise_256x128x128x256_32x32_2x2_16x16x1_16x16x1_1x32x1x8_8x8x1_1x1_intrawave_v3,709.24,1460.17,0.0
304,512,16384,13312,13,0,283.0054,a8w8_rowwise_256x128x128x128_32x32_2x2_8x32x1_8x32x1_1x32x1x8_8x8x1_1x1_intrawave_v3,789.17,854.04,0.0
304,1024,16384,13312,1,0,458.2987,a8w8_rowwise_256x256x256x128_32x32_4x4_8x32x1_8x32x1_1x32x1x8_8x8x1_1x1_intrawave_v3,974.64,578.86,0.0
304,2048,16384,13312,40,0,908.9011,a8w8_rowwise_256x256x224x128_16x16_8x7_8x32x1_8x32x1_1x64x1x4_8x8x1_2x1_intrawave_v3,982.89,343.79,0.0
304,4096,16384,13312,1,0,1767.8174,a8w8_rowwise_256x256x256x128_32x32_4x4_8x32x1_8x32x1_1x32x1x8_8x8x1_1x1_intrawave_v3,1010.68,230.14,0.0
304,8192,16384,13312,1,0,3390.8179,a8w8_rowwise_256x256x256x128_32x32_4x4_8x32x1_8x32x1_1x32x1x8_8x8x1_1x1_intrawave_v3,1053.85,175.65,0.0
304,16384,16384,13312,0,0,6772.4738,a8w8_rowwise_256x256x256x64_32x32_4x4_4x64x1_4x64x1_1x32x1x8_8x8x1_1x1_intrawave_v4,1055.28,143.68,0.0
304,1,16384,26624,30,0,124.1458,a8w8_rowwise_256x32x64x512_16x16_1x2_32x8x1_32x8x1_1x32x1x8_8x8x1_1x2_intrawave_v3,7.03,3514.15,0.0
304,16,16384,26624,34,0,121.1541,a8w8_rowwise_256x16x64x512_16x16_1x1_32x8x1_32x8x1_1x16x1x16_4x4x1_1x1_intrawave_v3,115.21,3608.28,0.0
304,32,16384,26624,30,0,121.093,a8w8_rowwise_256x32x64x512_16x16_1x2_32x8x1_32x8x1_1x32x1x8_8x8x1_1x2_intrawave_v3,230.54,3617.95,0.0
304,64,16384,26624,23,0,154.5576,a8w8_rowwise_256x64x64x512_32x32_1x1_32x8x1_32x8x1_1x32x1x8_8x8x1_1x1_intrawave_v3,361.25,2846.89,0.0
304,128,16384,26624,21,0,216.1726,a8w8_rowwise_256x64x128x256_32x32_1x2_16x16x1_16x16x1_1x32x1x8_8x8x1_1x1_intrawave_v3,516.57,2053.03,0.0
304,256,16384,26624,12,0,320.3206,a8w8_rowwise_256x128x128x256_32x32_2x2_16x16x1_16x16x1_1x32x1x8_8x8x1_1x1_intrawave_v3,697.23,1409.25,0.0
304,512,16384,26624,5,0,553.4094,a8w8_rowwise_256x256x128x128_32x32_4x2_8x32x1_8x32x1_1x32x1x8_8x8x1_1x1_intrawave_v3,807.14,843.17,0.0
304,1024,16384,26624,2,0,898.8341,a8w8_rowwise_256x256x224x128_32x32_2x7_8x32x1_8x32x1_1x64x1x4_8x8x1_2x1_intrawave_v3,993.9,552.97,0.0
304,2048,16384,26624,1,0,1741.8999,a8w8_rowwise_256x256x256x128_32x32_4x4_8x32x1_8x32x1_1x32x1x8_8x8x1_1x1_intrawave_v3,1025.72,320.25,0.0
304,4096,16384,26624,2,0,3541.9569,a8w8_rowwise_256x256x224x128_32x32_2x7_8x32x1_8x32x1_1x64x1x4_8x8x1_2x1_intrawave_v3,1008.88,191.84,0.0
304,8192,16384,26624,1,0,7024.073,a8w8_rowwise_256x256x256x128_32x32_4x4_8x32x1_8x32x1_1x32x1x8_8x8x1_1x1_intrawave_v3,1017.48,131.37,0.0
304,16384,16384,26624,1,0,14236.2489,a8w8_rowwise_256x256x256x128_32x32_4x4_8x32x1_8x32x1_1x32x1x8_8x8x1_1x1_intrawave_v3,1004.03,98.99,0.0
304,1,1280,8192,34,0,15.9787,a8w8_rowwise_256x16x64x512_16x16_1x1_32x8x1_32x8x1_1x16x1x16_4x4x1_1x1_intrawave_v3,1.31,656.91,0.0
304,16,1280,8192,34,0,12.7577,a8w8_rowwise_256x16x64x512_16x16_1x1_32x8x1_32x8x1_1x16x1x16_4x4x1_1x1_intrawave_v3,26.3,835.4,0.0
304,32,1280,8192,34,0,12.9103,a8w8_rowwise_256x16x64x512_16x16_1x1_32x8x1_32x8x1_1x16x1x16_4x4x1_1x1_intrawave_v3,51.98,838.85,0.0
304,64,1280,8192,34,0,12.8697,a8w8_rowwise_256x16x64x512_16x16_1x1_32x8x1_32x8x1_1x16x1x16_4x4x1_1x1_intrawave_v3,104.29,868.23,0.0
304,128,1280,8192,34,0,13.1909,a8w8_rowwise_256x16x64x512_16x16_1x1_32x8x1_32x8x1_1x16x1x16_4x4x1_1x1_intrawave_v3,203.5,899.26,0.0
304,160,1280,8192,30,0,15.7223,a8w8_rowwise_256x32x64x512_16x16_1x2_32x8x1_32x8x1_1x32x1x8_8x8x1_1x2_intrawave_v3,213.42,776.35,0.0
304,192,1280,8192,30,0,15.7756,a8w8_rowwise_256x32x64x512_16x16_1x2_32x8x1_32x8x1_1x32x1x8_8x8x1_1x2_intrawave_v3,255.24,795.54,0.0
304,256,1280,8192,30,0,17.2958,a8w8_rowwise_256x32x64x512_16x16_1x2_32x8x1_32x8x1_1x32x1x8_8x8x1_1x2_intrawave_v3,310.41,765.4,0.0
304,288,1280,8192,30,0,19.7052,a8w8_rowwise_256x32x64x512_16x16_1x2_32x8x1_32x8x1_1x32x1x8_8x8x1_1x2_intrawave_v3,306.51,689.28,0.0
304,384,1280,8192,30,0,22.7365,a8w8_rowwise_256x32x64x512_16x16_1x2_32x8x1_32x8x1_1x32x1x8_8x8x1_1x2_intrawave_v3,354.19,642.78,0.0
304,512,1280,8192,23,0,27.1554,a8w8_rowwise_256x64x64x512_32x32_1x1_32x8x1_32x8x1_1x32x1x8_8x8x1_1x1_intrawave_v3,395.41,588.86,0.0
304,640,1280,8192,23,0,30.2715,a8w8_rowwise_256x64x64x512_32x32_1x1_32x8x1_32x8x1_1x32x1x8_8x8x1_1x1_intrawave_v3,443.38,573.71,0.0
304,768,1280,8192,23,0,32.6734,a8w8_rowwise_256x64x64x512_32x32_1x1_32x8x1_32x8x1_1x32x1x8_8x8x1_1x1_intrawave_v3,492.94,573.66,0.0
304,1024,1280,8192,21,0,49.3968,a8w8_rowwise_256x64x128x256_32x32_1x2_16x16x1_16x16x1_1x32x1x8_8x8x1_1x1_intrawave_v3,434.74,435.17,0.0
304,1152,1280,8192,21,0,52.6908,a8w8_rowwise_256x64x128x256_32x32_1x2_16x16x1_16x16x1_1x32x1x8_8x8x1_1x1_intrawave_v3,458.51,434.08,0.0
304,1280,1280,8192,15,0,54.6696,a8w8_rowwise_256x128x64x256_32x32_2x1_16x16x1_16x16x1_1x32x1x8_8x8x1_1x1_intrawave_v3,491.01,443.54,0.0
304,1536,1280,8192,21,0,59.1949,a8w8_rowwise_256x64x128x256_32x32_1x2_16x16x1_16x16x1_1x32x1x8_8x8x1_1x1_intrawave_v3,544.17,456.13,0.0
304,1600,1280,8192,21,0,61.1907,a8w8_rowwise_256x64x128x256_32x32_1x2_16x16x1_16x16x1_1x32x1x8_8x8x1_1x1_intrawave_v3,548.36,452.5,0.0
304,2048,1280,8192,14,0,73.7632,a8w8_rowwise_256x128x96x256_32x32_1x3_16x16x1_16x16x1_1x64x1x4_8x8x1_1x1_intrawave_v3,582.26,440.68,0.0
304,2880,1280,8192,12,0,93.1801,a8w8_rowwise_256x128x128x256_32x32_2x2_16x16x1_16x16x1_1x32x1x8_8x8x1_1x1_intrawave_v3,648.19,444.85,0.0
304,3200,1280,8192,12,0,92.8367,a8w8_rowwise_256x128x128x256_32x32_2x2_16x16x1_16x16x1_1x32x1x8_8x8x1_1x1_intrawave_v3,722.87,483.56,0.0
304,4096,1280,8192,11,0,122.7137,a8w8_rowwise_256x128x160x128_32x32_1x5_8x32x1_8x32x1_1x64x1x4_8x8x1_1x1_intrawave_v3,700.0,444.33,0.0
304,8192,1280,8192,4,0,205.4474,a8w8_rowwise_256x256x160x128_32x32_2x5_8x32x1_8x32x1_1x64x1x4_8x8x1_2x1_intrawave_v3,836.22,479.76,0.0
304,16384,1280,8192,4,0,387.7063,a8w8_rowwise_256x256x160x128_32x32_2x5_8x32x1_8x32x1_1x64x1x4_8x8x1_2x1_intrawave_v3,886.23,481.41,0.0
304,1,2560,8192,34,0,16.9795,a8w8_rowwise_256x16x64x512_16x16_1x1_32x8x1_32x8x1_1x16x1x16_4x4x1_1x1_intrawave_v3,2.47,1235.89,0.0
304,16,2560,8192,34,0,13.7931,a8w8_rowwise_256x16x64x512_16x16_1x1_32x8x1_32x8x1_1x16x1x16_4x4x1_1x1_intrawave_v3,48.65,1535.88,0.0
304,32,2560,8192,34,0,13.8473,a8w8_rowwise_256x16x64x512_16x16_1x1_32x8x1_32x8x1_1x16x1x16_4x4x1_1x1_intrawave_v3,96.93,1545.25,0.0
304,64,2560,8192,34,0,15.5912,a8w8_rowwise_256x16x64x512_16x16_1x1_32x8x1_32x8x1_1x16x1x16_4x4x1_1x1_intrawave_v3,172.17,1399.73,0.0
304,128,2560,8192,30,0,19.7703,a8w8_rowwise_256x32x64x512_16x16_1x2_32x8x1_32x8x1_1x32x1x8_8x8x1_1x2_intrawave_v3,271.55,1146.95,0.0
304,160,2560,8192,30,0,22.6804,a8w8_rowwise_256x32x64x512_16x16_1x2_32x8x1_32x8x1_1x32x1x8_8x8x1_1x2_intrawave_v3,295.89,1018.56,0.0
304,192,2560,8192,23,0,22.7768,a8w8_rowwise_256x64x64x512_32x32_1x1_32x8x1_32x8x1_1x32x1x8_8x8x1_1x1_intrawave_v3,353.56,1032.96,0.0
304,256,2560,8192,23,0,27.5697,a8w8_rowwise_256x64x64x512_32x32_1x1_32x8x1_32x8x1_1x32x1x8_8x8x1_1x1_intrawave_v3,389.46,884.28,0.0
304,288,2560,8192,23,0,31.4763,a8w8_rowwise_256x64x64x512_32x32_1x1_32x8x1_32x8x1_1x32x1x8_8x8x1_1x1_intrawave_v3,383.77,788.07,0.0
304,384,2560,8192,23,0,32.78,a8w8_rowwise_256x64x64x512_32x32_1x1_32x8x1_32x8x1_1x32x1x8_8x8x1_1x1_intrawave_v3,491.34,795.71,0.0
304,512,2560,8192,15,0,48.8242,a8w8_rowwise_256x128x64x256_32x32_2x1_16x16x1_16x16x1_1x32x1x8_8x8x1_1x1_intrawave_v3,439.84,569.13,0.0
304,640,2560,8192,21,0,54.7062,a8w8_rowwise_256x64x128x256_32x32_1x2_16x16x1_16x16x1_1x32x1x8_8x8x1_1x1_intrawave_v3,490.69,539.08,0.0
304,768,2560,8192,15,0,58.1948,a8w8_rowwise_256x128x64x256_32x32_2x1_16x16x1_16x16x1_1x32x1x8_8x8x1_1x1_intrawave_v3,553.52,536.05,0.0
304,1024,2560,8192,12,0,72.405,a8w8_rowwise_256x128x128x256_32x32_2x2_16x16x1_16x16x1_1x32x1x8_8x8x1_1x1_intrawave_v3,593.19,477.91,0.0
304,1152,2560,8192,12,0,78.1624,a8w8_rowwise_256x128x128x256_32x32_2x2_16x16x1_16x16x1_1x32x1x8_8x8x1_1x1_intrawave_v3,618.18,464.51,0.0
304,1280,2560,8192,14,0,80.7308,a8w8_rowwise_256x128x96x256_32x32_1x3_16x16x1_16x16x1_1x64x1x4_8x8x1_1x1_intrawave_v3,665.01,470.83,0.0
304,1536,2560,8192,12,0,90.1833,a8w8_rowwise_256x128x128x256_32x32_2x2_16x16x1_16x16x1_1x32x1x8_8x8x1_1x1_intrawave_v3,714.37,459.27,0.0
304,1600,2560,8192,13,0,98.0636,a8w8_rowwise_256x128x128x128_32x32_2x2_8x32x1_8x32x1_1x32x1x8_8x8x1_1x1_intrawave_v3,684.34,431.05,0.0
304,2048,2560,8192,11,0,120.3003,a8w8_rowwise_256x128x160x128_32x32_1x5_8x32x1_8x32x1_1x64x1x4_8x8x1_1x1_intrawave_v3,714.04,400.95,0.0
304,2880,2560,8192,8,0,157.6236,a8w8_rowwise_256x128x256x128_32x32_2x4_8x32x1_8x32x1_1x32x1x8_8x8x1_1x1_intrawave_v3,766.36,376.28,0.0
304,3200,2560,8192,8,0,164.5695,a8w8_rowwise_256x128x256x128_32x32_2x4_8x32x1_8x32x1_1x32x1x8_8x8x1_1x1_intrawave_v3,815.57,386.28,0.0
304,4096,2560,8192,4,0,200.2878,a8w8_rowwise_256x256x160x128_32x32_2x5_8x32x1_8x32x1_1x64x1x4_8x8x1_2x1_intrawave_v3,857.76,376.94,0.0
304,8192,2560,8192,4,0,382.7015,a8w8_rowwise_256x256x160x128_32x32_2x5_8x32x1_8x32x1_1x64x1x4_8x8x1_2x1_intrawave_v3,897.82,339.75,0.0
304,16384,2560,8192,3,0,733.2065,a8w8_rowwise_256x256x192x128_32x32_4x3_8x32x1_8x32x1_1x32x1x8_8x8x1_1x1_intrawave_v3,937.25,326.07,0.0
304,1,10240,8192,76,0,32.9811,a8w8_rowwise_128x32x16x128_16x16_1x1_8x16x1_8x16x1_1x16x1x8_2x2x1_1x1_interwave_v2,5.09,2544.33,0.0
304,16,10240,8192,79,0,31.2289,a8w8_rowwise_128x16x32x128_16x16_1x1_8x16x1_8x16x1_1x16x1x8_4x4x1_1x1_interwave_v2,85.96,2700.86,0.0
304,32,10240,8192,30,0,32.5977,a8w8_rowwise_256x32x64x512_16x16_1x2_32x8x1_32x8x1_1x32x1x8_8x8x1_1x2_intrawave_v3,164.7,2601.52,0.0
304,64,10240,8192,23,0,39.9711,a8w8_rowwise_256x64x64x512_32x32_1x1_32x8x1_32x8x1_1x32x1x8_8x8x1_1x1_intrawave_v3,268.63,2144.58,0.0
304,128,10240,8192,21,0,54.0698,a8w8_rowwise_256x64x128x256_32x32_1x2_16x16x1_16x16x1_1x32x1x8_8x8x1_1x1_intrawave_v3,397.17,1619.32,0.0
304,160,10240,8192,21,0,62.1679,a8w8_rowwise_256x64x128x256_32x32_1x2_16x16x1_16x16x1_1x32x1x8_8x8x1_1x1_intrawave_v3,431.79,1423.14,0.0
304,192,10240,8192,21,0,63.0522,a8w8_rowwise_256x64x128x256_32x32_1x2_16x16x1_16x16x1_1x32x1x8_8x8x1_1x1_intrawave_v3,510.88,1417.73,0.0
304,256,10240,8192,14,0,75.6202,a8w8_rowwise_256x128x96x256_32x32_1x3_16x16x1_16x16x1_1x64x1x4_8x8x1_1x1_intrawave_v3,567.97,1206.37,0.0
304,288,10240,8192,18,0,90.3638,a8w8_rowwise_256x64x192x256_32x32_1x3_16x16x1_16x16x1_1x32x1x8_8x8x1_1x1_intrawave_v3,534.71,1019.7,0.0
304,384,10240,8192,12,0,95.8545,a8w8_rowwise_256x128x128x256_32x32_2x2_16x16x1_16x16x1_1x32x1x8_8x8x1_1x1_intrawave_v3,672.11,990.0,0.0
304,512,10240,8192,11,0,125.1466,a8w8_rowwise_256x128x160x128_32x32_1x5_8x32x1_8x32x1_1x64x1x4_8x8x1_1x1_intrawave_v3,686.39,787.61,0.0
304,640,10240,8192,10,0,141.7275,a8w8_rowwise_256x128x192x128_32x32_2x3_8x32x1_8x32x1_1x32x1x8_8x8x1_1x1_intrawave_v3,757.61,721.36,0.0
304,768,10240,8192,8,0,165.39,a8w8_rowwise_256x128x256x128_32x32_2x4_8x32x1_8x32x1_1x32x1x8_8x8x1_1x1_intrawave_v3,779.06,640.34,0.0
304,1024,10240,8192,4,0,199.2803,a8w8_rowwise_256x256x160x128_32x32_2x5_8x32x1_8x32x1_1x64x1x4_8x8x1_2x1_intrawave_v3,862.1,568.28,0.0
304,1152,10240,8192,3,0,239.5102,a8w8_rowwise_256x256x192x128_32x32_4x3_8x32x1_8x32x1_1x32x1x8_8x8x1_1x1_intrawave_v3,806.95,488.15,0.0
304,1280,10240,8192,3,0,239.7934,a8w8_rowwise_256x256x192x128_32x32_4x3_8x32x1_8x32x1_1x32x1x8_8x8x1_1x1_intrawave_v3,895.56,502.88,0.0
304,1536,10240,8192,2,0,286.0219,a8w8_rowwise_256x256x224x128_32x32_2x7_8x32x1_8x32x1_1x64x1x4_8x8x1_2x1_intrawave_v3,900.97,447.26,0.0
304,1600,10240,8192,1,0,319.6496,a8w8_rowwise_256x256x256x128_32x32_4x4_8x32x1_8x32x1_1x32x1x8_8x8x1_1x1_intrawave_v3,839.78,405.95,0.0
304,2048,10240,8192,4,0,382.77,a8w8_rowwise_256x256x160x128_32x32_2x5_8x32x1_8x32x1_1x64x1x4_8x8x1_2x1_intrawave_v3,897.66,372.56,0.0
304,2880,10240,8192,39,0,528.1918,a8w8_rowwise_256x224x256x128_16x16_7x8_8x32x1_8x32x1_1x32x1x8_8x8x1_1x2_intrawave_v3,914.79,315.15,0.0
304,3200,10240,8192,39,0,568.0046,a8w8_rowwise_256x224x256x128_16x16_7x8_8x32x1_8x32x1_1x32x1x8_8x8x1_1x2_intrawave_v3,945.19,309.22,0.0
304,4096,10240,8192,3,0,709.8451,a8w8_rowwise_256x256x192x128_32x32_4x3_8x32x1_8x32x1_1x32x1x8_8x8x1_1x1_intrawave_v3,968.09,283.62,0.0
304,8192,10240,8192,39,0,1384.6045,a8w8_rowwise_256x224x256x128_16x16_7x8_8x32x1_8x32x1_1x32x1x8_8x8x1_1x2_intrawave_v3,992.62,230.22,0.0
304,16384,10240,8192,39,0,2765.5902,a8w8_rowwise_256x224x256x128_16x16_7x8_8x32x1_8x32x1_1x32x1x8_8x8x1_1x2_intrawave_v3,993.92,200.19,0.0
304,1,8192,1024,78,0,6.1655,a8w8_rowwise_64x16x16x128_16x16_1x1_8x8x1_8x8x1_1x16x1x4_4x4x1_1x1_interwave_v2,2.72,1363.4,0.0
304,16,8192,1024,79,0,6.2013,a8w8_rowwise_128x16x32x128_16x16_1x1_8x16x1_8x16x1_1x16x1x8_4x4x1_1x1_interwave_v2,43.29,1397.63,0.0
304,32,8192,1024,60,0,6.4955,a8w8_rowwise_128x16x32x128_16x16_1x1_8x16x1_8x16x1_1x16x1x8_4x4x1_1x1_intrawave_v2,82.65,1377.21,0.0
304,64,8192,1024,57,0,7.6483,a8w8_rowwise_128x32x16x128_16x16_1x1_8x16x1_8x16x1_1x16x1x8_2x2x1_1x1_intrawave_v2,140.39,1242.46,0.0
304,128,8192,1024,47,0,10.8548,a8w8_rowwise_256x64x64x128_32x32_1x1_8x32x1_8x32x1_1x32x1x8_8x8x1_1x1_intrawave_v3,197.84,978.08,0.0
304,160,8192,1024,21,0,12.2865,a8w8_rowwise_256x64x128x256_32x32_1x2_16x16x1_16x16x1_1x32x1x8_8x8x1_1x1_intrawave_v3,218.48,909.44,0.0
304,192,8192,1024,21,0,11.5412,a8w8_rowwise_256x64x128x256_32x32_1x2_16x16x1_16x16x1_1x32x1x8_8x8x1_1x1_intrawave_v3,279.11,1016.44,0.0
304,256,8192,1024,15,0,13.2269,a8w8_rowwise_256x128x64x256_32x32_2x1_16x16x1_16x16x1_1x32x1x8_8x8x1_1x1_intrawave_v3,324.71,971.13,0.0
304,288,8192,1024,14,0,15.0267,a8w8_rowwise_256x128x96x256_32x32_1x3_16x16x1_16x16x1_1x64x1x4_8x8x1_1x1_intrawave_v3,321.55,891.89,0.0
304,384,8192,1024,14,0,16.3122,a8w8_rowwise_256x128x96x256_32x32_1x3_16x16x1_16x16x1_1x64x1x4_8x8x1_1x1_intrawave_v3,394.95,924.05,0.0
304,512,8192,1024,12,0,19.8567,a8w8_rowwise_256x128x128x256_32x32_2x2_16x16x1_16x16x1_1x32x1x8_8x8x1_1x1_intrawave_v3,432.6,871.32,0.0
304,640,8192,1024,11,0,24.922,a8w8_rowwise_256x128x160x128_32x32_1x5_8x32x1_8x32x1_1x64x1x4_8x8x1_1x1_intrawave_v3,430.84,783.63,0.0
304,768,8192,1024,10,0,27.6688,a8w8_rowwise_256x128x192x128_32x32_2x3_8x32x1_8x32x1_1x32x1x8_8x8x1_1x1_intrawave_v3,465.68,786.37,0.0
304,1024,8192,1024,13,0,32.631,a8w8_rowwise_256x128x128x128_32x32_2x2_8x32x1_8x32x1_1x32x1x8_8x8x1_1x1_intrawave_v3,526.49,803.36,0.0
304,1152,8192,1024,13,0,34.8583,a8w8_rowwise_256x128x128x128_32x32_2x2_8x32x1_8x32x1_1x32x1x8_8x8x1_1x1_intrawave_v3,554.45,815.95,0.0
304,1280,8192,1024,4,0,41.1603,a8w8_rowwise_256x256x160x128_32x32_2x5_8x32x1_8x32x1_1x64x1x4_8x8x1_2x1_intrawave_v3,521.74,745.16,0.0
304,1536,8192,1024,3,0,47.2856,a8w8_rowwise_256x256x192x128_32x32_4x3_8x32x1_8x32x1_1x32x1x8_8x8x1_1x1_intrawave_v3,544.98,742.88,0.0
304,1600,8192,1024,3,0,48.8817,a8w8_rowwise_256x256x192x128_32x32_4x3_8x32x1_8x32x1_1x32x1x8_8x8x1_1x1_intrawave_v3,549.15,741.41,0.0
304,2048,8192,1024,2,0,58.0331,a8w8_rowwise_256x256x224x128_32x32_2x7_8x32x1_8x32x1_1x64x1x4_8x8x1_2x1_intrawave_v3,592.07,758.88,0.0
304,2880,8192,1024,13,0,81.5914,a8w8_rowwise_256x128x128x128_32x32_2x2_8x32x1_8x32x1_1x32x1x8_8x8x1_1x1_intrawave_v3,592.2,717.28,0.0
304,3200,8192,1024,13,0,90.0792,a8w8_rowwise_256x128x128x128_32x32_2x2_8x32x1_8x32x1_1x32x1x8_8x8x1_1x1_intrawave_v3,596.0,711.53,0.0
304,4096,8192,1024,39,0,109.1757,a8w8_rowwise_256x224x256x128_16x16_7x8_8x32x1_8x32x1_1x32x1x8_8x8x1_1x2_intrawave_v3,629.44,729.94,0.0
304,8192,8192,1024,13,0,206.612,a8w8_rowwise_256x128x128x128_32x32_2x2_8x32x1_8x32x1_1x32x1x8_8x8x1_1x1_intrawave_v3,665.2,730.81,0.0
304,16384,8192,1024,13,0,394.3857,a8w8_rowwise_256x128x128x128_32x32_2x2_8x32x1_8x32x1_1x32x1x8_8x8x1_1x1_intrawave_v3,696.98,744.45,0.0
304,1,8192,2048,75,0,10.1591,a8w8_rowwise_128x64x16x128_16x16_2x1_8x16x1_8x16x1_1x16x1x8_2x2x1_1x1_interwave_v2,3.3,1653.26,0.0
304,16,8192,2048,34,0,8.3028,a8w8_rowwise_256x16x64x512_16x16_1x1_32x8x1_32x8x1_1x16x1x16_4x4x1_1x1_intrawave_v3,64.66,2056.19,0.0
304,32,8192,2048,79,0,9.0847,a8w8_rowwise_128x16x32x128_16x16_1x1_8x16x1_8x16x1_1x16x1x8_4x4x1_1x1_interwave_v2,118.19,1911.68,0.0
304,64,8192,2048,30,0,10.7765,a8w8_rowwise_256x32x64x512_16x16_1x2_32x8x1_32x8x1_1x32x1x8_8x8x1_1x2_intrawave_v3,199.27,1666.3,0.0
304,128,8192,2048,23,0,13.2923,a8w8_rowwise_256x64x64x512_32x32_1x1_32x8x1_32x8x1_1x32x1x8_8x8x1_1x1_intrawave_v3,323.12,1439.67,0.0
304,160,8192,2048,22,0,17.3621,a8w8_rowwise_256x64x96x256_16x16_2x3_16x16x1_16x16x1_1x64x1x4_8x8x1_2x1_intrawave_v3,309.22,1136.17,0.0
304,192,8192,2048,21,0,17.4677,a8w8_rowwise_256x64x128x256_32x32_1x2_16x16x1_16x16x1_1x32x1x8_8x8x1_1x1_intrawave_v3,368.82,1163.07,0.0
304,256,8192,2048,15,0,19.6745,a8w8_rowwise_256x128x64x256_32x32_2x1_16x16x1_16x16x1_1x32x1x8_8x8x1_1x1_intrawave_v3,436.6,1092.57,0.0
304,288,8192,2048,14,0,24.2054,a8w8_rowwise_256x128x96x256_32x32_1x3_16x16x1_16x16x1_1x64x1x4_8x8x1_1x1_intrawave_v3,399.24,912.43,0.0
304,384,8192,2048,14,0,25.2592,a8w8_rowwise_256x128x96x256_32x32_1x3_16x16x1_16x16x1_1x64x1x4_8x8x1_1x1_intrawave_v3,510.11,944.41,0.0
304,512,8192,2048,12,0,29.8035,a8w8_rowwise_256x128x128x256_32x32_2x2_16x16x1_16x16x1_1x32x1x8_8x8x1_1x1_intrawave_v3,576.44,879.57,0.0
304,640,8192,2048,11,0,39.4791,a8w8_rowwise_256x128x160x128_32x32_1x5_8x32x1_8x32x1_1x64x1x4_8x8x1_1x1_intrawave_v3,543.95,723.77,0.0
304,768,8192,2048,10,0,43.777,a8w8_rowwise_256x128x192x128_32x32_2x3_8x32x1_8x32x1_1x32x1x8_8x8x1_1x1_intrawave_v3,588.66,706.6,0.0
304,1024,8192,2048,13,0,53.0707,a8w8_rowwise_256x128x128x128_32x32_2x2_8x32x1_8x32x1_1x32x1x8_8x8x1_1x1_intrawave_v3,647.43,671.78,0.0
304,1152,8192,2048,13,0,55.8857,a8w8_rowwise_256x128x128x128_32x32_2x2_8x32x1_8x32x1_1x32x1x8_8x8x1_1x1_intrawave_v3,691.67,680.15,0.0
304,1280,8192,2048,4,0,65.7456,a8w8_rowwise_256x256x160x128_32x32_2x5_8x32x1_8x32x1_1x64x1x4_8x8x1_2x1_intrawave_v3,653.27,614.04,0.0
304,1536,8192,2048,3,0,74.6746,a8w8_rowwise_256x256x192x128_32x32_4x3_8x32x1_8x32x1_1x32x1x8_8x8x1_1x1_intrawave_v3,690.19,603.8,0.0
304,1600,8192,2048,3,0,77.8053,a8w8_rowwise_256x256x192x128_32x32_4x3_8x32x1_8x32x1_1x32x1x8_8x8x1_1x1_intrawave_v3,690.02,594.67,0.0
304,2048,8192,2048,2,0,92.9431,a8w8_rowwise_256x256x224x128_32x32_2x7_8x32x1_8x32x1_1x64x1x4_8x8x1_2x1_intrawave_v3,739.37,586.66,0.0
304,2880,8192,2048,41,0,138.526,a8w8_rowwise_256x128x128x128_32x32_2x2_8x32x1_8x32x1_1x32x1x8_8x8x1_1x1_intrawave_v5,697.61,504.32,0.0
304,3200,8192,2048,3,0,142.349,a8w8_rowwise_256x256x192x128_32x32_4x3_8x32x1_8x32x1_1x32x1x8_8x8x1_1x1_intrawave_v3,754.3,532.21,0.0
304,4096,8192,2048,1,0,175.5555,a8w8_rowwise_256x256x256x128_32x32_4x4_8x32x1_8x32x1_1x32x1x8_8x8x1_1x1_intrawave_v3,782.88,525.62,0.0
304,8192,8192,2048,2,0,339.8257,a8w8_rowwise_256x256x224x128_32x32_2x7_8x32x1_8x32x1_1x64x1x4_8x8x1_2x1_intrawave_v3,808.88,493.7,0.0
304,16384,8192,2048,1,0,642.0528,a8w8_rowwise_256x256x256x128_32x32_4x4_8x32x1_8x32x1_1x32x1x8_8x8x1_1x1_intrawave_v3,856.25,496.48,0.0
304,1,8192,8192,76,0,29.4276,a8w8_rowwise_128x32x16x128_16x16_1x1_8x16x1_8x16x1_1x16x1x8_2x2x1_1x1_interwave_v2,4.56,2281.31,0.0
304,16,8192,8192,79,0,28.8358,a8w8_rowwise_128x16x32x128_16x16_1x1_8x16x1_8x16x1_1x16x1x8_4x4x1_1x1_interwave_v2,74.47,2340.91,0.0
304,32,8192,8192,34,0,29.7226,a8w8_rowwise_256x16x64x512_16x16_1x1_32x8x1_32x8x1_1x16x1x16_4x4x1_1x1_intrawave_v3,144.5,2284.3,0.0
304,64,8192,8192,30,0,31.9013,a8w8_rowwise_256x32x64x512_16x16_1x2_32x8x1_32x8x1_1x32x1x8_8x8x1_1x2_intrawave_v3,269.27,2152.94,0.0
304,128,8192,8192,23,0,40.6154,a8w8_rowwise_256x64x64x512_32x32_1x1_32x8x1_32x8x1_1x32x1x8_8x8x1_1x1_intrawave_v3,422.99,1729.75,0.0
304,160,8192,8192,21,0,56.0743,a8w8_rowwise_256x64x128x256_32x32_1x2_16x16x1_16x16x1_1x32x1x8_8x8x1_1x1_intrawave_v3,382.97,1266.91,0.0
304,192,8192,8192,21,0,57.8149,a8w8_rowwise_256x64x128x256_32x32_1x2_16x16x1_16x16x1_1x32x1x8_8x8x1_1x1_intrawave_v3,445.73,1242.37,0.0
304,256,8192,8192,15,0,64.836,a8w8_rowwise_256x128x64x256_32x32_2x1_16x16x1_16x16x1_1x32x1x8_8x8x1_1x1_intrawave_v3,529.95,1132.09,0.0
304,288,8192,8192,14,0,78.9922,a8w8_rowwise_256x128x96x256_32x32_1x3_16x16x1_16x16x1_1x64x1x4_8x8x1_1x1_intrawave_v3,489.35,939.17,0.0
304,384,8192,8192,12,0,80.5664,a8w8_rowwise_256x128x128x256_32x32_2x2_16x16x1_16x16x1_1x32x1x8_8x8x1_1x1_intrawave_v3,639.72,950.1,0.0
304,512,8192,8192,12,0,97.408,a8w8_rowwise_256x128x128x256_32x32_2x2_16x16x1_16x16x1_1x32x1x8_8x8x1_1x1_intrawave_v3,705.48,818.12,0.0
304,640,8192,8192,10,0,125.3203,a8w8_rowwise_256x128x192x128_32x32_2x3_8x32x1_8x32x1_1x32x1x8_8x8x1_1x1_intrawave_v3,685.44,661.01,0.0
304,768,8192,8192,10,0,135.9744,a8w8_rowwise_256x128x192x128_32x32_2x3_8x32x1_8x32x1_1x32x1x8_8x8x1_1x1_intrawave_v3,758.08,632.35,0.0
304,1024,8192,8192,8,0,167.3874,a8w8_rowwise_256x128x256x128_32x32_2x4_8x32x1_8x32x1_1x32x1x8_8x8x1_1x1_intrawave_v3,821.08,551.26,0.0
304,1152,8192,8192,8,0,177.7054,a8w8_rowwise_256x128x256x128_32x32_2x4_8x32x1_8x32x1_1x32x1x8_8x8x1_1x1_intrawave_v3,870.09,536.96,0.0
304,1536,8192,8192,3,0,234.9012,a8w8_rowwise_256x256x192x128_32x32_4x3_8x32x1_8x32x1_1x32x1x8_8x8x1_1x1_intrawave_v3,877.64,446.39,0.0
304,1600,8192,8192,3,0,244.8493,a8w8_rowwise_256x256x192x128_32x32_4x3_8x32x1_8x32x1_1x32x1x8_8x8x1_1x1_intrawave_v3,877.06,434.68,0.0
304,2048,8192,8192,1,0,290.8672,a8w8_rowwise_256x256x256x128_32x32_4x4_8x32x1_8x32x1_1x32x1x8_8x8x1_1x1_intrawave_v3,945.03,403.76,0.0
304,2880,8192,8192,3,0,439.4602,a8w8_rowwise_256x256x192x128_32x32_4x3_8x32x1_8x32x1_1x32x1x8_8x8x1_1x1_intrawave_v3,879.6,313.77,0.0
304,3200,8192,8192,3,0,459.3386,a8w8_rowwise_256x256x192x128_32x32_4x3_8x32x1_8x32x1_1x32x1x8_8x8x1_1x1_intrawave_v3,935.03,317.31,0.0
304,4096,8192,8192,1,0,565.7464,a8w8_rowwise_256x256x256x128_32x32_4x4_8x32x1_8x32x1_1x32x1x8_8x8x1_1x1_intrawave_v3,971.74,296.55,0.0
304,8192,8192,8192,1,0,1111.3673,a8w8_rowwise_256x256x256x128_32x32_4x4_8x32x1_8x32x1_1x32x1x8_8x8x1_1x1_intrawave_v3,989.33,241.54,0.0
304,16384,8192,8192,1,0,2103.0808,a8w8_rowwise_256x256x256x128_32x32_4x4_8x32x1_8x32x1_1x32x1x8_8x8x1_1x1_intrawave_v3,1045.62,223.37,0.0
304,1,7168,8192,76,0,26.3577,a8w8_rowwise_128x32x16x128_16x16_1x1_8x16x1_8x16x1_1x16x1x8_2x2x1_1x1_interwave_v2,4.46,2228.68,0.0
304,16,7168,8192,79,0,25.5898,a8w8_rowwise_128x16x32x128_16x16_1x1_8x16x1_8x16x1_1x16x1x8_4x4x1_1x1_interwave_v2,73.43,2308.76,0.0
304,32,7168,8192,34,0,26.0863,a8w8_rowwise_256x16x64x512_16x16_1x1_32x8x1_32x8x1_1x16x1x16_4x4x1_1x1_intrawave_v3,144.06,2278.63,0.0
304,64,7168,8192,30,0,28.916,a8w8_rowwise_256x32x64x512_16x16_1x2_32x8x1_32x8x1_1x32x1x8_8x8x1_1x2_intrawave_v3,259.93,2080.58,0.0
304,128,7168,8192,23,0,37.5577,a8w8_rowwise_256x64x64x512_32x32_1x1_32x8x1_32x8x1_1x32x1x8_8x8x1_1x1_intrawave_v3,400.25,1640.25,0.0
304,192,7168,8192,21,0,53.1631,a8w8_rowwise_256x64x128x256_32x32_1x2_16x16x1_16x16x1_1x32x1x8_8x8x1_1x1_intrawave_v3,424.14,1185.89,0.0
304,256,7168,8192,15,0,59.3026,a8w8_rowwise_256x128x64x256_32x32_2x1_16x16x1_16x16x1_1x32x1x8_8x8x1_1x1_intrawave_v3,506.97,1087.43,0.0
304,288,7168,8192,21,0,68.8015,a8w8_rowwise_256x64x128x256_32x32_1x2_16x16x1_16x16x1_1x32x1x8_8x8x1_1x1_intrawave_v3,491.6,947.77,0.0
304,384,7168,8192,14,0,77.052,a8w8_rowwise_256x128x96x256_32x32_1x3_16x16x1_16x16x1_1x64x1x4_8x8x1_1x1_intrawave_v3,585.28,874.36,0.0
304,512,7168,8192,12,0,88.5613,a8w8_rowwise_256x128x128x256_32x32_2x2_16x16x1_16x16x1_1x32x1x8_8x8x1_1x1_intrawave_v3,678.96,793.29,0.0
304,640,7168,8192,12,0,101.0976,a8w8_rowwise_256x128x128x256_32x32_2x2_16x16x1_16x16x1_1x32x1x8_8x8x1_1x1_intrawave_v3,743.46,723.44,0.0
304,768,7168,8192,11,0,127.2817,a8w8_rowwise_256x128x160x128_32x32_1x5_8x32x1_8x32x1_1x64x1x4_8x8x1_1x1_intrawave_v3,708.62,597.27,0.0
304,1024,7168,8192,10,0,149.3996,a8w8_rowwise_256x128x192x128_32x32_2x3_8x32x1_8x32x1_1x32x1x8_8x8x1_1x1_intrawave_v3,804.95,547.45,0.0
304,1152,7168,8192,8,0,170.8504,a8w8_rowwise_256x128x256x128_32x32_2x4_8x32x1_8x32x1_1x32x1x8_8x8x1_1x1_intrawave_v3,791.87,495.59,0.0
304,1536,7168,8192,4,0,214.8354,a8w8_rowwise_256x256x160x128_32x32_2x5_8x32x1_8x32x1_1x64x1x4_8x8x1_2x1_intrawave_v3,839.66,434.39,0.0
304,1600,7168,8192,3,0,227.8127,a8w8_rowwise_256x256x192x128_32x32_4x3_8x32x1_8x32x1_1x32x1x8_8x8x1_1x1_intrawave_v3,824.82,415.98,0.0
304,2048,7168,8192,3,0,255.777,a8w8_rowwise_256x256x192x128_32x32_4x3_8x32x1_8x32x1_1x32x1x8_8x8x1_1x1_intrawave_v3,940.34,409.96,0.0
304,2880,7168,8192,10,0,405.7718,a8w8_rowwise_256x128x192x128_32x32_2x3_8x32x1_8x32x1_1x32x1x8_8x8x1_1x1_intrawave_v3,833.54,304.61,0.0
304,3200,7168,8192,4,0,425.8221,a8w8_rowwise_256x256x160x128_32x32_2x5_8x32x1_8x32x1_1x64x1x4_8x8x1_2x1_intrawave_v3,882.55,307.19,0.0
304,4096,7168,8192,2,0,502.5343,a8w8_rowwise_256x256x224x128_32x32_2x7_8x32x1_8x32x1_1x64x1x4_8x8x1_2x1_intrawave_v3,957.22,300.47,0.0
304,8192,7168,8192,1,0,921.8131,a8w8_rowwise_256x256x256x128_32x32_4x4_8x32x1_8x32x1_1x32x1x8_8x8x1_1x1_intrawave_v3,1043.67,263.9,0.0
304,16384,7168,8192,1,0,1841.4584,a8w8_rowwise_256x256x256x128_32x32_4x4_8x32x1_8x32x1_1x32x1x8_8x8x1_1x1_intrawave_v3,1044.9,232.33,0.0
304,1,14336,8192,79,0,41.6157,a8w8_rowwise_128x16x32x128_16x16_1x1_8x16x1_8x16x1_1x16x1x8_4x4x1_1x1_interwave_v2,5.64,2822.91,0.0
304,16,14336,8192,79,0,39.5399,a8w8_rowwise_128x16x32x128_16x16_1x1_8x16x1_8x16x1_1x16x1x8_4x4x1_1x1_interwave_v2,95.05,2985.09,0.0
304,32,14336,8192,57,0,49.394,a8w8_rowwise_128x32x16x128_16x16_1x1_8x16x1_8x16x1_1x16x1x8_2x2x1_1x1_intrawave_v2,152.17,2401.51,0.0
304,64,14336,8192,28,0,55.3806,a8w8_rowwise_256x32x128x256_32x32_1x1_16x16x1_16x16x1_1x32x1x8_8x8x1_1x1_intrawave_v3,271.44,2163.21,0.0
304,128,14336,8192,21,0,67.5828,a8w8_rowwise_256x64x128x256_32x32_1x2_16x16x1_16x16x1_1x32x1x8_8x8x1_1x1_intrawave_v3,444.86,1807.55,0.0
304,160,14336,8192,18,0,85.5929,a8w8_rowwise_256x64x192x256_32x32_1x3_16x16x1_16x16x1_1x32x1x8_8x8x1_1x1_intrawave_v3,439.07,1440.99,0.0
304,192,14336,8192,18,0,90.2667,a8w8_rowwise_256x64x192x256_32x32_1x3_16x16x1_16x16x1_1x32x1x8_8x8x1_1x1_intrawave_v3,499.6,1379.45,0.0
304,256,14336,8192,14,0,94.2864,a8w8_rowwise_256x128x96x256_32x32_1x3_16x16x1_16x16x1_1x64x1x4_8x8x1_1x1_intrawave_v3,637.73,1345.66,0.0
304,288,14336,8192,10,0,123.9357,a8w8_rowwise_256x128x192x128_32x32_2x3_8x32x1_8x32x1_1x32x1x8_8x8x1_1x1_intrawave_v3,545.81,1033.26,0.0
304,384,14336,8192,11,0,131.3778,a8w8_rowwise_256x128x160x128_32x32_1x5_8x32x1_8x32x1_1x64x1x4_8x8x1_1x1_intrawave_v3,686.53,1001.66,0.0
304,512,14336,8192,10,0,155.2374,a8w8_rowwise_256x128x192x128_32x32_2x3_8x32x1_8x32x1_1x32x1x8_8x8x1_1x1_intrawave_v3,774.68,878.11,0.0
304,640,14336,8192,8,0,186.4211,a8w8_rowwise_256x128x256x128_32x32_2x4_8x32x1_8x32x1_1x32x1x8_8x8x1_1x1_intrawave_v3,806.37,756.53,0.0
304,768,14336,8192,4,0,218.7617,a8w8_rowwise_256x256x160x128_32x32_2x5_8x32x1_8x32x1_1x64x1x4_8x8x1_2x1_intrawave_v3,824.59,666.26,0.0
304,1024,14336,8192,3,0,258.4235,a8w8_rowwise_256x256x192x128_32x32_4x3_8x32x1_8x32x1_1x32x1x8_8x8x1_1x1_intrawave_v3,930.71,600.52,0.0
304,1152,14336,8192,1,0,308.7551,a8w8_rowwise_256x256x256x128_32x32_4x4_8x32x1_8x32x1_1x32x1x8_8x8x1_1x1_intrawave_v3,876.37,517.91,0.0
304,1536,14336,8192,4,0,409.8497,a8w8_rowwise_256x256x160x128_32x32_2x5_8x32x1_8x32x1_1x64x1x4_8x8x1_2x1_intrawave_v3,880.27,424.7,0.0
304,1600,14336,8192,3,0,448.8761,a8w8_rowwise_256x256x192x128_32x32_4x3_8x32x1_8x32x1_1x32x1x8_8x8x1_1x1_intrawave_v3,837.22,393.03,0.0
304,2048,14336,8192,3,0,506.9991,a8w8_rowwise_256x256x192x128_32x32_4x3_8x32x1_8x32x1_1x32x1x8_8x8x1_1x1_intrawave_v3,948.79,380.55,0.0
304,2880,14336,8192,3,0,733.7976,a8w8_rowwise_256x256x192x128_32x32_4x3_8x32x1_8x32x1_1x32x1x8_8x8x1_1x1_intrawave_v3,921.86,304.73,0.0
304,3200,14336,8192,39,0,819.0098,a8w8_rowwise_256x224x256x128_16x16_7x8_8x32x1_8x32x1_1x32x1x8_8x8x1_1x2_intrawave_v3,917.72,287.43,0.0
304,4096,14336,8192,1,0,939.9878,a8w8_rowwise_256x256x256x128_32x32_4x4_8x32x1_8x32x1_1x32x1x8_8x8x1_1x1_intrawave_v3,1023.49,285.57,0.0
304,8192,14336,8192,1,0,1828.7838,a8w8_rowwise_256x256x256x128_32x32_4x4_8x32x1_8x32x1_1x32x1x8_8x8x1_1x1_intrawave_v3,1052.14,229.35,0.0
304,16384,14336,8192,1,0,3742.3681,a8w8_rowwise_256x256x256x128_32x32_4x4_8x32x1_8x32x1_1x32x1x8_8x8x1_1x1_intrawave_v3,1028.3,192.77,0.0
304,1,57344,8192,69,0,147.0255,a8w8_rowwise_128x16x32x128_16x16_1x1_8x16x1_8x16x1_1x16x1x8_4x4x1_1x1_interwave_v1,6.39,3195.94,0.0
304,16,57344,8192,80,0,148.1131,a8w8_rowwise_128x16x64x128_16x16_1x2_8x16x1_8x16x1_1x16x1x8_4x4x1_1x1_interwave_v2,101.49,3184.92,0.0
304,32,57344,8192,81,0,157.7857,a8w8_rowwise_128x32x64x128_32x32_1x1_8x16x1_8x16x1_1x16x1x8_8x8x1_1x1_interwave_v2,190.54,3002.14,0.0
304,64,57344,8192,47,0,185.1347,a8w8_rowwise_256x64x64x128_32x32_1x1_8x32x1_8x32x1_1x32x1x8_8x8x1_1x1_intrawave_v3,324.79,2579.89,0.0
304,128,57344,8192,10,0,219.9884,a8w8_rowwise_256x128x192x128_32x32_2x3_8x32x1_8x32x1_1x32x1x8_8x8x1_1x1_intrawave_v3,546.66,2206.89,0.0
304,160,57344,8192,3,0,268.1783,a8w8_rowwise_256x256x192x128_32x32_4x3_8x32x1_8x32x1_1x32x1x8_8x8x1_1x1_intrawave_v3,560.54,1824.99,0.0
304,192,57344,8192,3,0,282.731,a8w8_rowwise_256x256x192x128_32x32_4x3_8x32x1_8x32x1_1x32x1x8_8x8x1_1x1_intrawave_v3,638.02,1744.96,0.0
304,256,57344,8192,3,0,307.699,a8w8_rowwise_256x256x192x128_32x32_4x3_8x32x1_8x32x1_1x32x1x8_8x8x1_1x1_intrawave_v3,781.67,1628.93,0.0
304,288,57344,8192,10,0,427.5262,a8w8_rowwise_256x128x192x128_32x32_2x3_8x32x1_8x32x1_1x32x1x8_8x8x1_1x1_intrawave_v3,632.9,1181.57,0.0
304,384,57344,8192,13,0,469.6757,a8w8_rowwise_256x128x128x128_32x32_2x2_8x32x1_8x32x1_1x32x1x8_8x8x1_1x1_intrawave_v3,768.14,1100.65,0.0
304,512,57344,8192,40,0,549.0063,a8w8_rowwise_256x256x224x128_16x16_8x7_8x32x1_8x32x1_1x64x1x4_8x8x1_2x1_intrawave_v3,876.19,970.26,0.0
304,640,57344,8192,8,0,743.9607,a8w8_rowwise_256x128x256x128_32x32_2x4_8x32x1_8x32x1_1x32x1x8_8x8x1_1x1_intrawave_v3,808.24,737.14,0.0
304,768,57344,8192,3,0,784.2667,a8w8_rowwise_256x256x192x128_32x32_4x3_8x32x1_8x32x1_1x32x1x8_8x8x1_1x1_intrawave_v3,920.04,719.31,0.0
304,1024,57344,8192,1,0,978.4872,a8w8_rowwise_256x256x256x128_32x32_4x4_8x32x1_8x32x1_1x32x1x8_8x8x1_1x1_intrawave_v3,983.22,608.69,0.0
304,1152,57344,8192,1,0,1259.6589,a8w8_rowwise_256x256x256x128_32x32_4x4_8x32x1_8x32x1_1x32x1x8_8x8x1_1x1_intrawave_v3,859.23,485.31,0.0
304,1536,57344,8192,1,0,1536.7113,a8w8_rowwise_256x256x256x128_32x32_4x4_8x32x1_8x32x1_1x32x1x8_8x8x1_1x1_intrawave_v3,939.09,428.52,0.0
304,1600,57344,8192,39,0,1656.6646,a8w8_rowwise_256x224x256x128_16x16_7x8_8x32x1_8x32x1_1x32x1x8_8x8x1_1x2_intrawave_v3,907.39,402.24,0.0
304,2048,57344,8192,40,0,1894.6063,a8w8_rowwise_256x256x224x128_16x16_8x7_8x32x1_8x32x1_1x64x1x4_8x8x1_2x1_intrawave_v3,1015.59,380.78,0.0
304,2880,57344,8192,39,0,2854.2191,a8w8_rowwise_256x224x256x128_16x16_7x8_8x32x1_8x32x1_1x32x1x8_8x8x1_1x2_intrawave_v3,948.01,288.58,0.0
304,3200,57344,8192,1,0,3189.2161,a8w8_rowwise_256x256x256x128_32x32_4x4_8x32x1_8x32x1_1x32x1x8_8x8x1_1x1_intrawave_v3,942.7,270.59,0.0
304,4096,57344,8192,40,0,3752.0545,a8w8_rowwise_256x256x224x128_16x16_8x7_8x32x1_8x32x1_1x64x1x4_8x8x1_2x1_intrawave_v3,1025.65,259.35,0.0
304,8192,57344,8192,1,0,7243.5376,a8w8_rowwise_256x256x256x128_32x32_4x4_8x32x1_8x32x1_1x32x1x8_8x8x1_1x1_intrawave_v3,1062.54,203.82,0.0
304,16384,57344,8192,40,0,15251.6143,a8w8_rowwise_256x256x224x128_16x16_8x7_8x32x1_8x32x1_1x64x1x4_8x8x1_2x1_intrawave_v3,1009.28,162.8,0.0
304,1,8192,3584,30,0,12.0983,a8w8_rowwise_256x32x64x512_16x16_1x2_32x8x1_32x8x1_1x32x1x8_8x8x1_1x2_intrawave_v3,4.85,2428.45,0.0
304,16,8192,3584,78,0,11.9126,a8w8_rowwise_64x16x16x128_16x16_1x1_8x8x1_8x8x1_1x16x1x4_4x4x1_1x1_interwave_v2,78.87,2491.45,0.0
304,32,8192,3584,30,0,12.5332,a8w8_rowwise_256x32x64x512_16x16_1x2_32x8x1_32x8x1_1x32x1x8_8x8x1_1x2_intrawave_v3,149.93,2393.57,0.0
304,64,8192,3584,30,0,15.0246,a8w8_rowwise_256x32x64x512_16x16_1x2_32x8x1_32x8x1_1x32x1x8_8x8x1_1x2_intrawave_v3,250.13,2039.19,0.0
304,128,8192,3584,23,0,19.7166,a8w8_rowwise_256x64x64x512_32x32_1x1_32x8x1_32x8x1_1x32x1x8_8x8x1_1x1_intrawave_v3,381.21,1618.74,0.0
304,160,8192,3584,22,0,26.6408,a8w8_rowwise_256x64x96x256_16x16_2x3_16x16x1_16x16x1_1x64x1x4_8x8x1_2x1_intrawave_v3,352.66,1222.0,0.0
304,192,8192,3584,21,0,27.2541,a8w8_rowwise_256x64x128x256_32x32_1x2_16x16x1_16x16x1_1x32x1x8_8x8x1_1x1_intrawave_v3,413.67,1217.94,0.0
304,256,8192,3584,15,0,30.0406,a8w8_rowwise_256x128x64x256_32x32_2x1_16x16x1_16x16x1_1x32x1x8_8x8x1_1x1_intrawave_v3,500.4,1147.51,0.0
304,288,8192,3584,14,0,37.0547,a8w8_rowwise_256x128x96x256_32x32_1x3_16x16x1_16x16x1_1x64x1x4_8x8x1_1x1_intrawave_v3,456.39,947.54,0.0
304,384,8192,3584,14,0,41.0345,a8w8_rowwise_256x128x96x256_32x32_1x3_16x16x1_16x16x1_1x64x1x4_8x8x1_1x1_intrawave_v3,549.5,902.36,0.0
304,512,8192,3584,12,0,47.3861,a8w8_rowwise_256x128x128x256_32x32_2x2_16x16x1_16x16x1_1x32x1x8_8x8x1_1x1_intrawave_v3,634.46,835.35,0.0
304,640,8192,3584,10,0,61.3192,a8w8_rowwise_256x128x192x128_32x32_2x3_8x32x1_8x32x1_1x32x1x8_8x8x1_1x1_intrawave_v3,612.87,687.22,0.0
304,768,8192,3584,10,0,70.0225,a8w8_rowwise_256x128x192x128_32x32_2x3_8x32x1_8x32x1_1x32x1x8_8x8x1_1x1_intrawave_v3,644.04,638.3,0.0
304,1024,8192,3584,41,0,84.3005,a8w8_rowwise_256x128x128x128_32x32_2x2_8x32x1_8x32x1_1x32x1x8_8x8x1_1x1_intrawave_v5,713.28,590.83,0.0
304,1152,8192,3584,41,0,91.3868,a8w8_rowwise_256x128x128x128_32x32_2x2_8x32x1_8x32x1_1x32x1x8_8x8x1_1x1_intrawave_v5,740.21,572.98,0.0
304,1280,8192,3584,4,0,101.0272,a8w8_rowwise_256x256x160x128_32x32_2x5_8x32x1_8x32x1_1x64x1x4_8x8x1_2x1_intrawave_v3,743.98,543.61,0.0
304,1536,8192,3584,3,0,115.4872,a8w8_rowwise_256x256x192x128_32x32_4x3_8x32x1_8x32x1_1x32x1x8_8x8x1_1x1_intrawave_v3,780.99,519.81,0.0
304,1600,8192,3584,3,0,127.2071,a8w8_rowwise_256x256x192x128_32x32_4x3_8x32x1_8x32x1_1x32x1x8_8x8x1_1x1_intrawave_v3,738.58,481.96,0.0
304,2048,8192,3584,40,0,142.6961,a8w8_rowwise_256x256x224x128_16x16_8x7_8x32x1_8x32x1_1x64x1x4_8x8x1_2x1_intrawave_v3,842.76,492.34,0.0
304,2880,8192,3584,3,0,213.3855,a8w8_rowwise_256x256x192x128_32x32_4x3_8x32x1_8x32x1_1x32x1x8_8x8x1_1x1_intrawave_v3,792.53,407.09,0.0
304,3200,8192,3584,3,0,220.6791,a8w8_rowwise_256x256x192x128_32x32_4x3_8x32x1_8x32x1_1x32x1x8_8x8x1_1x1_intrawave_v3,851.48,422.59,0.0
304,4096,8192,3584,1,0,277.9926,a8w8_rowwise_256x256x256x128_32x32_4x4_8x32x1_8x32x1_1x32x1x8_8x8x1_1x1_intrawave_v3,865.2,399.83,0.0
304,8192,8192,3584,39,0,533.533,a8w8_rowwise_256x224x256x128_16x16_7x8_8x32x1_8x32x1_1x32x1x8_8x8x1_1x2_intrawave_v3,901.61,361.62,0.0
304,16384,8192,3584,1,0,1015.8834,a8w8_rowwise_256x256x256x128_32x32_4x4_8x32x1_8x32x1_1x32x1x8_8x8x1_1x1_intrawave_v3,947.03,350.94,0.0
304,1,8192,7168,34,0,18.6091,a8w8_rowwise_256x16x64x512_16x16_1x1_32x8x1_32x8x1_1x16x1x16_4x4x1_1x1_intrawave_v3,6.31,3156.72,0.0
304,16,8192,7168,79,0,19.8251,a8w8_rowwise_128x16x32x128_16x16_1x1_8x16x1_8x16x1_1x16x1x8_4x4x1_1x1_interwave_v2,94.78,2980.92,0.0
304,32,8192,7168,30,0,20.9147,a8w8_rowwise_256x32x64x512_16x16_1x2_32x8x1_32x8x1_1x32x1x8_8x8x1_1x2_intrawave_v3,179.69,2843.64,0.0
304,64,8192,7168,30,0,26.1814,a8w8_rowwise_256x32x64x512_16x16_1x2_32x8x1_32x8x1_1x32x1x8_8x8x1_1x2_intrawave_v3,287.08,2300.4,0.0
304,128,8192,7168,23,0,34.0492,a8w8_rowwise_256x64x64x512_32x32_1x1_32x8x1_32x8x1_1x32x1x8_8x8x1_1x1_intrawave_v3,441.49,1813.11,0.0
304,160,8192,7168,21,0,50.8875,a8w8_rowwise_256x64x128x256_32x32_1x2_16x16x1_16x16x1_1x32x1x8_8x8x1_1x1_intrawave_v3,369.26,1227.97,0.0
304,192,8192,7168,21,0,49.1571,a8w8_rowwise_256x64x128x256_32x32_1x2_16x16x1_16x16x1_1x32x1x8_8x8x1_1x1_intrawave_v3,458.7,1286.53,0.0
304,256,8192,7168,21,0,56.3874,a8w8_rowwise_256x64x128x256_32x32_1x2_16x16x1_16x16x1_1x32x1x8_8x8x1_1x1_intrawave_v3,533.18,1148.3,0.0
304,288,8192,7168,14,0,68.4787,a8w8_rowwise_256x128x96x256_32x32_1x3_16x16x1_16x16x1_1x64x1x4_8x8x1_1x1_intrawave_v3,493.92,956.55,0.0
304,384,8192,7168,14,0,74.9283,a8w8_rowwise_256x128x96x256_32x32_1x3_16x16x1_16x16x1_1x64x1x4_8x8x1_1x1_intrawave_v3,601.87,904.39,0.0
304,512,8192,7168,12,0,86.7333,a8w8_rowwise_256x128x128x256_32x32_2x2_16x16x1_16x16x1_1x32x1x8_8x8x1_1x1_intrawave_v3,693.27,816.05,0.0
304,640,8192,7168,10,0,112.3295,a8w8_rowwise_256x128x192x128_32x32_2x3_8x32x1_8x32x1_1x32x1x8_8x8x1_1x1_intrawave_v3,669.12,656.94,0.0
304,768,8192,7168,10,0,123.7772,a8w8_rowwise_256x128x192x128_32x32_2x3_8x32x1_8x32x1_1x32x1x8_8x8x1_1x1_intrawave_v3,728.68,620.54,0.0
304,1024,8192,7168,13,0,154.8525,a8w8_rowwise_256x128x128x128_32x32_2x2_8x32x1_8x32x1_1x32x1x8_8x8x1_1x1_intrawave_v3,776.6,534.94,0.0
304,1152,8192,7168,13,0,163.1911,a8w8_rowwise_256x128x128x128_32x32_2x2_8x32x1_8x32x1_1x32x1x8_8x8x1_1x1_intrawave_v3,829.04,526.08,0.0
304,1280,8192,7168,4,0,188.5321,a8w8_rowwise_256x256x160x128_32x32_2x5_8x32x1_8x32x1_1x64x1x4_8x8x1_2x1_intrawave_v3,797.34,471.36,0.0
304,1536,8192,7168,3,0,213.4924,a8w8_rowwise_256x256x192x128_32x32_4x3_8x32x1_8x32x1_1x32x1x8_8x8x1_1x1_intrawave_v3,844.94,444.49,0.0
304,1600,8192,7168,3,0,225.7807,a8w8_rowwise_256x256x192x128_32x32_4x3_8x32x1_8x32x1_1x32x1x8_8x8x1_1x1_intrawave_v3,832.24,426.98,0.0
304,2048,8192,7168,1,0,259.0134,a8w8_rowwise_256x256x256x128_32x32_4x4_8x32x1_8x32x1_1x32x1x8_8x8x1_1x1_intrawave_v3,928.59,412.93,0.0
304,2880,8192,7168,3,0,395.8923,a8w8_rowwise_256x256x192x128_32x32_4x3_8x32x1_8x32x1_1x32x1x8_8x8x1_1x1_intrawave_v3,854.35,319.66,0.0
304,3200,8192,7168,8,0,422.0128,a8w8_rowwise_256x128x256x128_32x32_2x4_8x32x1_8x32x1_1x32x1x8_8x8x1_1x1_intrawave_v3,890.52,317.73,0.0
304,4096,8192,7168,1,0,503.579,a8w8_rowwise_256x256x256x128_32x32_4x4_8x32x1_8x32x1_1x32x1x8_8x8x1_1x1_intrawave_v3,955.24,308.17,0.0
304,8192,8192,7168,1,0,972.5594,a8w8_rowwise_256x256x256x128_32x32_4x4_8x32x1_8x32x1_1x32x1x8_8x8x1_1x1_intrawave_v3,989.22,258.76,0.0
304,16384,8192,7168,1,0,1869.9288,a8w8_rowwise_256x256x256x128_32x32_4x4_8x32x1_8x32x1_1x32x1x8_8x8x1_1x1_intrawave_v3,1028.99,237.76,0.0
304,1,8192,28672,34,0,82.9237,a8w8_rowwise_256x16x64x512_16x16_1x1_32x8x1_32x8x1_1x16x1x16_4x4x1_1x1_intrawave_v3,5.66,2833.04,0.0
304,16,8192,28672,34,0,82.1943,a8w8_rowwise_256x16x64x512_16x16_1x1_32x8x1_32x8x1_1x16x1x16_4x4x1_1x1_intrawave_v3,91.44,2866.4,0.0
304,32,8192,28672,34,0,85.5325,a8w8_rowwise_256x16x64x512_16x16_1x1_32x8x1_32x8x1_1x16x1x16_4x4x1_1x1_intrawave_v3,175.75,2762.96,0.0
304,64,8192,28672,30,0,99.8508,a8w8_rowwise_256x32x64x512_16x16_1x2_32x8x1_32x8x1_1x32x1x8_8x8x1_1x2_intrawave_v3,301.1,2381.2,0.0
304,128,8192,28672,23,0,140.9446,a8w8_rowwise_256x64x64x512_32x32_1x1_32x8x1_32x8x1_1x32x1x8_8x8x1_1x1_intrawave_v3,426.62,1707.4,0.0
304,160,8192,28672,21,0,191.8027,a8w8_rowwise_256x64x128x256_32x32_1x2_16x16x1_16x16x1_1x32x1x8_8x8x1_1x1_intrawave_v3,391.87,1262.18,0.0
304,192,8192,28672,21,0,188.7311,a8w8_rowwise_256x64x128x256_32x32_1x2_16x16x1_16x16x1_1x32x1x8_8x8x1_1x1_intrawave_v3,477.9,1290.36,0.0
304,256,8192,28672,21,0,210.7426,a8w8_rowwise_256x64x128x256_32x32_1x2_16x16x1_16x16x1_1x32x1x8_8x8x1_1x1_intrawave_v3,570.64,1169.27,0.0
304,288,8192,28672,14,0,248.0301,a8w8_rowwise_256x128x96x256_32x32_1x3_16x16x1_16x16x1_1x64x1x4_8x8x1_1x1_intrawave_v3,545.46,999.3,0.0
304,384,8192,28672,14,0,264.4405,a8w8_rowwise_256x128x96x256_32x32_1x3_16x16x1_16x16x1_1x64x1x4_8x8x1_1x1_intrawave_v3,682.15,953.65,0.0
304,512,8192,28672,12,0,318.9535,a8w8_rowwise_256x128x128x256_32x32_2x2_16x16x1_16x16x1_1x32x1x8_8x8x1_1x1_intrawave_v3,754.09,808.74,0.0
304,640,8192,28672,11,0,419.8908,a8w8_rowwise_256x128x160x128_32x32_1x5_8x32x1_8x32x1_1x64x1x4_8x8x1_1x1_intrawave_v3,716.01,628.06,0.0
304,768,8192,28672,10,0,454.6675,a8w8_rowwise_256x128x192x128_32x32_2x3_8x32x1_8x32x1_1x32x1x8_8x8x1_1x1_intrawave_v3,793.5,592.71,0.0
304,1024,8192,28672,41,0,573.4503,a8w8_rowwise_256x128x128x128_32x32_2x2_8x32x1_8x32x1_1x32x1x8_8x8x1_1x1_intrawave_v5,838.85,490.05,0.0
304,1152,8192,28672,41,0,629.2754,a8w8_rowwise_256x128x128x128_32x32_2x2_8x32x1_8x32x1_1x32x1x8_8x8x1_1x1_intrawave_v5,859.98,455.74,0.0
304,1280,8192,28672,4,0,689.9758,a8w8_rowwise_256x256x160x128_32x32_2x5_8x32x1_8x32x1_1x64x1x4_8x8x1_2x1_intrawave_v3,871.47,424.0,0.0
304,1536,8192,28672,3,0,758.8686,a8w8_rowwise_256x256x192x128_32x32_4x3_8x32x1_8x32x1_1x32x1x8_8x8x1_1x1_intrawave_v3,950.83,400.71,0.0
304,1600,8192,28672,3,0,828.3848,a8w8_rowwise_256x256x192x128_32x32_4x3_8x32x1_8x32x1_1x32x1x8_8x8x1_1x1_intrawave_v3,907.33,370.57,0.0
304,2048,8192,28672,2,0,945.2125,a8w8_rowwise_256x256x224x128_32x32_2x7_8x32x1_8x32x1_1x64x1x4_8x8x1_2x1_intrawave_v3,1017.84,346.12,0.0
304,2880,8192,28672,3,0,1480.9313,a8w8_rowwise_256x256x192x128_32x32_4x3_8x32x1_8x32x1_1x32x1x8_8x8x1_1x1_intrawave_v3,913.56,246.22,0.0
304,3200,8192,28672,3,0,1632.6481,a8w8_rowwise_256x256x192x128_32x32_4x3_8x32x1_8x32x1_1x32x1x8_8x8x1_1x1_intrawave_v3,920.74,232.18,0.0
304,4096,8192,28672,40,0,1924.4375,a8w8_rowwise_256x256x224x128_16x16_8x7_8x32x1_8x32x1_1x64x1x4_8x8x1_2x1_intrawave_v3,999.85,217.95,0.0
304,8192,8192,28672,39,0,3888.8655,a8w8_rowwise_256x224x256x128_16x16_7x8_8x32x1_8x32x1_1x32x1x8_8x8x1_1x2_intrawave_v3,989.57,155.31,0.0
304,16384,8192,28672,1,0,7377.3814,a8w8_rowwise_256x256x256x128_32x32_4x4_8x32x1_8x32x1_1x32x1x8_8x8x1_1x1_intrawave_v3,1043.27,131.9,0.0
