aiter/configs/a8w8_blockscale_tuned_gemm.csv
cu_num,M,N,K,libtype,kernelId,splitK,us,kernelName,tflops,bw,errRatio
256,515,2048,3072,ck,18,0,15.5034,a8w8_blockscale_1x128x128_256x64x64x256_16x16_32x32_1x1_16x16x1_16x16x1_1x32x1x8_8_1x1_intrawave_v1,417.99,643.92,0.0
256,562,2048,3072,ck,18,0,15.5338,a8w8_blockscale_1x128x128_256x64x64x256_16x16_32x32_1x1_16x16x1_16x16x1_1x32x1x8_8_1x1_intrawave_v1,455.24,664.35,0.0
256,592,2048,3072,ck,18,0,16.2675,a8w8_blockscale_1x128x128_256x64x64x256_16x16_32x32_1x1_16x16x1_16x16x1_1x32x1x8_8_1x1_intrawave_v1,457.91,647.6,0.0
256,640,2048,3072,ck,18,0,16.2726,a8w8_blockscale_1x128x128_256x64x64x256_16x16_32x32_1x1_16x16x1_16x16x1_1x32x1x8_8_1x1_intrawave_v1,494.88,668.55,0.0
256,659,2048,3072,ck,18,0,16.5111,a8w8_blockscale_1x128x128_256x64x64x256_16x16_32x32_1x1_16x16x1_16x16x1_1x32x1x8_8_1x1_intrawave_v1,502.22,667.14,0.0
256,767,2048,3072,ck,18,0,16.03,a8w8_blockscale_1x128x128_256x64x64x256_16x16_32x32_1x1_16x16x1_16x16x1_1x32x1x8_8_1x1_intrawave_v1,602.06,735.45,0.0
256,768,2048,3072,ck,18,0,16.028,a8w8_blockscale_1x128x128_256x64x64x256_16x16_32x32_1x1_16x16x1_16x16x1_1x32x1x8_8_1x1_intrawave_v1,602.92,735.99,0.0
256,896,2048,3072,ck,18,0,16.8908,a8w8_blockscale_1x128x128_256x64x64x256_16x16_32x32_1x1_16x16x1_16x16x1_1x32x1x8_8_1x1_intrawave_v1,667.48,752.72,0.0
256,990,2048,3072,ck,18,0,17.9485,a8w8_blockscale_1x128x128_256x64x64x256_16x16_32x32_1x1_16x16x1_16x16x1_1x32x1x8_8_1x1_intrawave_v1,694.05,745.9,0.0
256,1013,2048,3072,ck,18,0,17.6978,a8w8_blockscale_1x128x128_256x64x64x256_16x16_32x32_1x1_16x16x1_16x16x1_1x32x1x8_8_1x1_intrawave_v1,720.23,765.78,0.0
256,1021,2048,3072,ck,18,0,18.0756,a8w8_blockscale_1x128x128_256x64x64x256_16x16_32x32_1x1_16x16x1_16x16x1_1x32x1x8_8_1x1_intrawave_v1,710.75,752.95,0.0
256,1024,2048,3072,ck,18,0,17.6749,a8w8_blockscale_1x128x128_256x64x64x256_16x16_32x32_1x1_16x16x1_16x16x1_1x32x1x8_8_1x1_intrawave_v1,728.99,771.23,0.0
256,1044,2048,3072,ck,18,0,22.3987,a8w8_blockscale_1x128x128_256x64x64x256_16x16_32x32_1x1_16x16x1_16x16x1_1x32x1x8_8_1x1_intrawave_v1,586.49,614.98,0.0
256,1048,2048,3072,ck,18,0,22.3025,a8w8_blockscale_1x128x128_256x64x64x256_16x16_32x32_1x1_16x16x1_16x16x1_1x32x1x8_8_1x1_intrawave_v1,591.27,618.92,0.0
256,1058,2048,3072,ck,18,0,22.3753,a8w8_blockscale_1x128x128_256x64x64x256_16x16_32x32_1x1_16x16x1_16x16x1_1x32x1x8_8_1x1_intrawave_v1,594.97,620.11,0.0
256,1068,2048,3072,ck,18,0,22.5623,a8w8_blockscale_1x128x128_256x64x64x256_16x16_32x32_1x1_16x16x1_16x16x1_1x32x1x8_8_1x1_intrawave_v1,595.62,618.15,0.0
256,1077,2048,3072,ck,18,0,22.492,a8w8_blockscale_1x128x128_256x64x64x256_16x16_32x32_1x1_16x16x1_16x16x1_1x32x1x8_8_1x1_intrawave_v1,602.52,622.95,0.0
256,1090,2048,3072,ck,18,0,22.2771,a8w8_blockscale_1x128x128_256x64x64x256_16x16_32x32_1x1_16x16x1_16x16x1_1x32x1x8_8_1x1_intrawave_v1,615.67,633.14,0.0
256,1092,2048,3072,ck,18,0,22.2951,a8w8_blockscale_1x128x128_256x64x64x256_16x16_32x32_1x1_16x16x1_16x16x1_1x32x1x8_8_1x1_intrawave_v1,616.3,633.27,0.0
256,1094,2048,3072,ck,18,0,22.432,a8w8_blockscale_1x128x128_256x64x64x256_16x16_32x32_1x1_16x16x1_16x16x1_1x32x1x8_8_1x1_intrawave_v1,613.66,630.05,0.0
256,1095,2048,3072,ck,18,0,22.2848,a8w8_blockscale_1x128x128_256x64x64x256_16x16_32x32_1x1_16x16x1_16x16x1_1x32x1x8_8_1x1_intrawave_v1,618.28,634.53,0.0
256,1096,2048,3072,ck,18,0,22.2429,a8w8_blockscale_1x128x128_256x64x64x256_16x16_32x32_1x1_16x16x1_16x16x1_1x32x1x8_8_1x1_intrawave_v1,620.01,636.05,0.0
256,1101,2048,3072,ck,18,0,22.4377,a8w8_blockscale_1x128x128_256x64x64x256_16x16_32x32_1x1_16x16x1_16x16x1_1x32x1x8_8_1x1_intrawave_v1,617.43,632.12,0.0
256,1102,2048,3072,ck,18,0,22.3445,a8w8_blockscale_1x128x128_256x64x64x256_16x16_32x32_1x1_16x16x1_16x16x1_1x32x1x8_8_1x1_intrawave_v1,620.57,635.08,0.0
256,1106,2048,3072,ck,18,0,22.3909,a8w8_blockscale_1x128x128_256x64x64x256_16x16_32x32_1x1_16x16x1_16x16x1_1x32x1x8_8_1x1_intrawave_v1,621.53,635.05,0.0
256,1107,2048,3072,ck,18,0,22.3125,a8w8_blockscale_1x128x128_256x64x64x256_16x16_32x32_1x1_16x16x1_16x16x1_1x32x1x8_8_1x1_intrawave_v1,624.28,637.6,0.0
256,1116,2048,3072,ck,18,0,22.3291,a8w8_blockscale_1x128x128_256x64x64x256_16x16_32x32_1x1_16x16x1_16x16x1_1x32x1x8_8_1x1_intrawave_v1,628.89,640.01,0.0
256,1121,2048,3072,ck,18,0,22.6408,a8w8_blockscale_1x128x128_256x64x64x256_16x16_32x32_1x1_16x16x1_16x16x1_1x32x1x8_8_1x1_intrawave_v1,623.01,632.79,0.0
256,1123,2048,3072,ck,18,0,22.385,a8w8_blockscale_1x128x128_256x64x64x256_16x16_32x32_1x1_16x16x1_16x16x1_1x32x1x8_8_1x1_intrawave_v1,631.25,640.66,0.0
256,1124,2048,3072,ck,18,0,22.3392,a8w8_blockscale_1x128x128_256x64x64x256_16x16_32x32_1x1_16x16x1_16x16x1_1x32x1x8_8_1x1_intrawave_v1,633.11,642.29,0.0
256,1125,2048,3072,ck,18,0,22.4936,a8w8_blockscale_1x128x128_256x64x64x256_16x16_32x32_1x1_16x16x1_16x16x1_1x32x1x8_8_1x1_intrawave_v1,629.32,638.2,0.0
256,1126,2048,3072,ck,18,0,22.4089,a8w8_blockscale_1x128x128_256x64x64x256_16x16_32x32_1x1_16x16x1_16x16x1_1x32x1x8_8_1x1_intrawave_v1,632.26,640.93,0.0
256,1127,2048,3072,ck,18,0,22.3938,a8w8_blockscale_1x128x128_256x64x64x256_16x16_32x32_1x1_16x16x1_16x16x1_1x32x1x8_8_1x1_intrawave_v1,633.25,641.69,0.0
256,1131,2048,3072,ck,18,0,22.5351,a8w8_blockscale_1x128x128_256x64x64x256_16x16_32x32_1x1_16x16x1_16x16x1_1x32x1x8_8_1x1_intrawave_v1,631.52,638.93,0.0
256,1134,2048,3072,ck,18,0,22.3926,a8w8_blockscale_1x128x128_256x64x64x256_16x16_32x32_1x1_16x16x1_16x16x1_1x32x1x8_8_1x1_intrawave_v1,637.22,643.96,0.0
256,1135,2048,3072,ck,18,0,22.4541,a8w8_blockscale_1x128x128_256x64x64x256_16x16_32x32_1x1_16x16x1_16x16x1_1x32x1x8_8_1x1_intrawave_v1,636.04,642.52,0.0
256,1136,2048,3072,ck,18,0,22.4749,a8w8_blockscale_1x128x128_256x64x64x256_16x16_32x32_1x1_16x16x1_16x16x1_1x32x1x8_8_1x1_intrawave_v1,636.01,642.24,0.0
256,1139,2048,3072,ck,18,0,22.1205,a8w8_blockscale_1x128x128_256x64x64x256_16x16_32x32_1x1_16x16x1_16x16x1_1x32x1x8_8_1x1_intrawave_v1,647.9,653.5,0.0
256,1140,2048,3072,ck,18,0,22.55,a8w8_blockscale_1x128x128_256x64x64x256_16x16_32x32_1x1_16x16x1_16x16x1_1x32x1x8_8_1x1_intrawave_v1,636.12,641.37,0.0
256,1142,2048,3072,ck,18,0,22.5136,a8w8_blockscale_1x128x128_256x64x64x256_16x16_32x32_1x1_16x16x1_16x16x1_1x32x1x8_8_1x1_intrawave_v1,638.27,643.05,0.0
256,1144,2048,3072,ck,18,0,22.5392,a8w8_blockscale_1x128x128_256x64x64x256_16x16_32x32_1x1_16x16x1_16x16x1_1x32x1x8_8_1x1_intrawave_v1,638.66,642.95,0.0
256,1146,2048,3072,ck,18,0,22.8433,a8w8_blockscale_1x128x128_256x64x64x256_16x16_32x32_1x1_16x16x1_16x16x1_1x32x1x8_8_1x1_intrawave_v1,631.26,635.02,0.0
256,1147,2048,3072,ck,18,0,22.6134,a8w8_blockscale_1x128x128_256x64x64x256_16x16_32x32_1x1_16x16x1_16x16x1_1x32x1x8_8_1x1_intrawave_v1,638.23,641.79,0.0
256,1148,2048,3072,ck,18,0,22.5992,a8w8_blockscale_1x128x128_256x64x64x256_16x16_32x32_1x1_16x16x1_16x16x1_1x32x1x8_8_1x1_intrawave_v1,639.19,642.51,0.0
256,1149,2048,3072,ck,18,0,22.364,a8w8_blockscale_1x128x128_256x64x64x256_16x16_32x32_1x1_16x16x1_16x16x1_1x32x1x8_8_1x1_intrawave_v1,646.47,649.59,0.0
256,1150,2048,3072,ck,18,0,22.7415,a8w8_blockscale_1x128x128_256x64x64x256_16x16_32x32_1x1_16x16x1_16x16x1_1x32x1x8_8_1x1_intrawave_v1,636.3,639.12,0.0
256,1151,2048,3072,ck,18,0,22.665,a8w8_blockscale_1x128x128_256x64x64x256_16x16_32x32_1x1_16x16x1_16x16x1_1x32x1x8_8_1x1_intrawave_v1,639.0,641.6,0.0
256,1152,2048,3072,ck,18,0,22.4514,a8w8_blockscale_1x128x128_256x64x64x256_16x16_32x32_1x1_16x16x1_16x16x1_1x32x1x8_8_1x1_intrawave_v1,645.64,648.02,0.0
256,1154,2048,3072,ck,18,0,22.8979,a8w8_blockscale_1x128x128_256x64x64x256_16x16_32x32_1x1_16x16x1_16x16x1_1x32x1x8_8_1x1_intrawave_v1,634.15,636.01,0.0
256,1156,2048,3072,ck,18,0,22.567,a8w8_blockscale_1x128x128_256x64x64x256_16x16_32x32_1x1_16x16x1_16x16x1_1x32x1x8_8_1x1_intrawave_v1,644.56,645.97,0.0
256,1158,2048,3072,ck,18,0,22.7815,a8w8_blockscale_1x128x128_256x64x64x256_16x16_32x32_1x1_16x16x1_16x16x1_1x32x1x8_8_1x1_intrawave_v1,639.6,640.52,0.0
256,1159,2048,3072,ck,18,0,22.7881,a8w8_blockscale_1x128x128_256x64x64x256_16x16_32x32_1x1_16x16x1_16x16x1_1x32x1x8_8_1x1_intrawave_v1,639.97,640.65,0.0
256,1169,2048,3072,ck,18,0,22.7866,a8w8_blockscale_1x128x128_256x64x64x256_16x16_32x32_1x1_16x16x1_16x16x1_1x32x1x8_8_1x1_intrawave_v1,645.53,643.84,0.0
256,1170,2048,3072,ck,18,0,22.6671,a8w8_blockscale_1x128x128_256x64x64x256_16x16_32x32_1x1_16x16x1_16x16x1_1x32x1x8_8_1x1_intrawave_v1,649.49,647.55,0.0
256,1174,2048,3072,ck,18,0,22.5012,a8w8_blockscale_1x128x128_256x64x64x256_16x16_32x32_1x1_16x16x1_16x16x1_1x32x1x8_8_1x1_intrawave_v1,656.51,653.6,0.0
256,1179,2048,3072,ck,18,0,22.6698,a8w8_blockscale_1x128x128_256x64x64x256_16x16_32x32_1x1_16x16x1_16x16x1_1x32x1x8_8_1x1_intrawave_v1,654.41,650.32,0.0
256,1270,2048,3072,ck,18,0,22.8445,a8w8_blockscale_1x128x128_256x64x64x256_16x16_32x32_1x1_16x16x1_16x16x1_1x32x1x8_8_1x1_intrawave_v1,699.52,673.9,0.0
256,1280,2048,3072,ck,18,0,22.5186,a8w8_blockscale_1x128x128_256x64x64x256_16x16_32x32_1x1_16x16x1_16x16x1_1x32x1x8_8_1x1_intrawave_v1,715.24,686.83,0.0
256,1289,2048,3072,ck,18,0,23.0982,a8w8_blockscale_1x128x128_256x64x64x256_16x16_32x32_1x1_16x16x1_16x16x1_1x32x1x8_8_1x1_intrawave_v1,702.19,672.39,0.0
256,1408,2048,3072,ck,18,0,23.0832,a8w8_blockscale_1x128x128_256x64x64x256_16x16_32x32_1x1_16x16x1_16x16x1_1x32x1x8_8_1x1_intrawave_v1,767.52,709.78,0.0
256,1458,2048,3072,ck,18,0,23.9046,a8w8_blockscale_1x128x128_256x64x64x256_16x16_32x32_1x1_16x16x1_16x16x1_1x32x1x8_8_1x1_intrawave_v1,767.46,700.38,0.0
256,1536,2048,3072,ck,18,0,24.0198,a8w8_blockscale_1x128x128_256x64x64x256_16x16_32x32_1x1_16x16x1_16x16x1_1x32x1x8_8_1x1_intrawave_v1,804.64,720.3,0.0
256,1664,2048,3072,ck,0,0,26.6233,a8w8_blockscale_1x128x128_256x128x128x128_16x16_32x32_2x2_8x32x1_8x32x1_1x32x1x8_8_1x1_intrawave_v3,786.45,684.33,0.0
256,1792,2048,3072,ck,0,0,26.8876,a8w8_blockscale_1x128x128_256x128x128x128_16x16_32x32_2x2_8x32x1_8x32x1_1x32x1x8_8_1x1_intrawave_v3,838.62,711.72,0.0
256,1896,2048,3072,ck,0,0,27.4593,a8w8_blockscale_1x128x128_256x128x128x128_16x16_32x32_2x2_8x32x1_8x32x1_1x32x1x8_8_1x1_intrawave_v3,868.82,724.05,0.0
256,1920,2048,3072,ck,0,0,27.1204,a8w8_blockscale_1x128x128_256x128x128x128_16x16_32x32_2x2_8x32x1_8x32x1_1x32x1x8_8_1x1_intrawave_v3,890.81,739.44,0.0
256,1997,2048,3072,ck,0,0,27.6522,a8w8_blockscale_1x128x128_256x128x128x128_16x16_32x32_2x2_8x32x1_8x32x1_1x32x1x8_8_1x1_intrawave_v3,908.72,745.18,0.0
256,2048,2048,3072,ck,0,0,27.6219,a8w8_blockscale_1x128x128_256x128x128x128_16x16_32x32_2x2_8x32x1_8x32x1_1x32x1x8_8_1x1_intrawave_v3,932.95,759.24,0.0
256,2074,2048,3072,ck,18,0,34.7709,a8w8_blockscale_1x128x128_256x64x64x256_16x16_32x32_1x1_16x16x1_16x16x1_1x32x1x8_8_1x1_intrawave_v1,750.54,608.49,0.0
256,2094,2048,3072,ck,18,0,35.0824,a8w8_blockscale_1x128x128_256x64x64x256_16x16_32x32_1x1_16x16x1_16x16x1_1x32x1x8_8_1x1_intrawave_v1,751.05,607.18,0.0
256,2154,2048,3072,ck,18,0,35.3455,a8w8_blockscale_1x128x128_256x64x64x256_16x16_32x32_1x1_16x16x1_16x16x1_1x32x1x8_8_1x1_intrawave_v1,766.82,614.83,0.0
256,2169,2048,3072,ck,18,0,35.6409,a8w8_blockscale_1x128x128_256x64x64x256_16x16_32x32_1x1_16x16x1_16x16x1_1x32x1x8_8_1x1_intrawave_v1,765.76,612.75,0.0
256,2176,2048,3072,ck,18,0,35.3097,a8w8_blockscale_1x128x128_256x64x64x256_16x16_32x32_1x1_16x16x1_16x16x1_1x32x1x8_8_1x1_intrawave_v1,775.44,619.92,0.0
256,2248,2048,3072,ck,18,0,35.6378,a8w8_blockscale_1x128x128_256x64x64x256_16x16_32x32_1x1_16x16x1_16x16x1_1x32x1x8_8_1x1_intrawave_v1,793.72,628.69,0.0
256,2249,2048,3072,ck,18,0,35.6814,a8w8_blockscale_1x128x128_256x64x64x256_16x16_32x32_1x1_16x16x1_16x16x1_1x32x1x8_8_1x1_intrawave_v1,793.1,628.12,0.0
256,2264,2048,3072,ck,18,0,35.8485,a8w8_blockscale_1x128x128_256x64x64x256_16x16_32x32_1x1_16x16x1_16x16x1_1x32x1x8_8_1x1_intrawave_v1,794.67,628.19,0.0
256,2291,2048,3072,ck,18,0,35.9761,a8w8_blockscale_1x128x128_256x64x64x256_16x16_32x32_1x1_16x16x1_16x16x1_1x32x1x8_8_1x1_intrawave_v1,801.29,631.35,0.0
256,2304,2048,3072,ck,18,0,34.9771,a8w8_blockscale_1x128x128_256x64x64x256_16x16_32x32_1x1_16x16x1_16x16x1_1x32x1x8_8_1x1_intrawave_v1,828.86,652.04,0.0
256,2409,2048,3072,ck,18,0,35.5497,a8w8_blockscale_1x128x128_256x64x64x256_16x16_32x32_1x1_16x16x1_16x16x1_1x32x1x8_8_1x1_intrawave_v1,852.67,662.71,0.0
256,2419,2048,3072,ck,18,0,35.8414,a8w8_blockscale_1x128x128_256x64x64x256_16x16_32x32_1x1_16x16x1_16x16x1_1x32x1x8_8_1x1_intrawave_v1,849.24,659.32,0.0
256,2432,2048,3072,ck,18,0,35.9918,a8w8_blockscale_1x128x128_256x64x64x256_16x16_32x32_1x1_16x16x1_16x16x1_1x32x1x8_8_1x1_intrawave_v1,850.24,659.15,0.0
256,2488,2048,3072,ck,18,0,36.4353,a8w8_blockscale_1x128x128_256x64x64x256_16x16_32x32_1x1_16x16x1_16x16x1_1x32x1x8_8_1x1_intrawave_v1,859.23,662.14,0.0
256,2537,2048,3072,ck,18,0,36.9953,a8w8_blockscale_1x128x128_256x64x64x256_16x16_32x32_1x1_16x16x1_16x16x1_1x32x1x8_8_1x1_intrawave_v1,862.89,661.62,0.0
256,2560,2048,3072,ck,18,0,37.0642,a8w8_blockscale_1x128x128_256x64x64x256_16x16_32x32_1x1_16x16x1_16x16x1_1x32x1x8_8_1x1_intrawave_v1,869.09,664.83,0.0
256,2609,2048,3072,ck,0,0,38.9292,a8w8_blockscale_1x128x128_256x128x128x128_16x16_32x32_2x2_8x32x1_8x32x1_1x32x1x8_8_1x1_intrawave_v3,843.3,642.01,0.0
256,2618,2048,3072,ck,0,0,39.2558,a8w8_blockscale_1x128x128_256x128x128x128_16x16_32x32_2x2_8x32x1_8x32x1_1x32x1x8_8_1x1_intrawave_v3,839.16,638.31,0.0
256,2670,2048,3072,ck,0,0,38.863,a8w8_blockscale_1x128x128_256x128x128x128_16x16_32x32_2x2_8x32x1_8x32x1_1x32x1x8_8_1x1_intrawave_v3,864.48,654.35,0.0
256,2688,2048,3072,ck,0,0,39.1211,a8w8_blockscale_1x128x128_256x128x128x128_16x16_32x32_2x2_8x32x1_8x32x1_1x32x1x8_8_1x1_intrawave_v3,864.57,653.33,0.0
256,2728,2048,3072,ck,0,0,39.6273,a8w8_blockscale_1x128x128_256x128x128x128_16x16_32x32_2x2_8x32x1_8x32x1_1x32x1x8_8_1x1_intrawave_v3,866.23,652.22,0.0
256,2760,2048,3072,ck,0,0,39.3903,a8w8_blockscale_1x128x128_256x128x128x128_16x16_32x32_2x2_8x32x1_8x32x1_1x32x1x8_8_1x1_intrawave_v3,881.66,661.97,0.0
256,2796,2048,3072,ck,0,0,39.5702,a8w8_blockscale_1x128x128_256x128x128x128_16x16_32x32_2x2_8x32x1_8x32x1_1x32x1x8_8_1x1_intrawave_v3,889.1,665.48,0.0
256,2806,2048,3072,ck,0,0,39.1457,a8w8_blockscale_1x128x128_256x128x128x128_16x16_32x32_2x2_8x32x1_8x32x1_1x32x1x8_8_1x1_intrawave_v3,901.95,674.53,0.0
256,2816,2048,3072,ck,0,0,39.1932,a8w8_blockscale_1x128x128_256x128x128x128_16x16_32x32_2x2_8x32x1_8x32x1_1x32x1x8_8_1x1_intrawave_v3,904.07,675.54,0.0
256,2828,2048,3072,ck,0,0,40.1417,a8w8_blockscale_1x128x128_256x128x128x128_16x16_32x32_2x2_8x32x1_8x32x1_1x32x1x8_8_1x1_intrawave_v3,886.47,661.72,0.0
256,2910,2048,3072,ck,0,0,39.6835,a8w8_blockscale_1x128x128_256x128x128x128_16x16_32x32_2x2_8x32x1_8x32x1_1x32x1x8_8_1x1_intrawave_v3,922.71,684.17,0.0
256,2925,2048,3072,ck,0,0,39.7799,a8w8_blockscale_1x128x128_256x128x128x128_16x16_32x32_2x2_8x32x1_8x32x1_1x32x1x8_8_1x1_intrawave_v3,925.22,685.22,0.0
256,2944,2048,3072,ck,0,0,39.1517,a8w8_blockscale_1x128x128_256x128x128x128_16x16_32x32_2x2_8x32x1_8x32x1_1x32x1x8_8_1x1_intrawave_v3,946.17,699.69,0.0
256,2945,2048,3072,ck,0,0,40.1842,a8w8_blockscale_1x128x128_256x128x128x128_16x16_32x32_2x2_8x32x1_8x32x1_1x32x1x8_8_1x1_intrawave_v3,922.17,681.89,0.0
256,2994,2048,3072,ck,0,0,40.2353,a8w8_blockscale_1x128x128_256x128x128x128_16x16_32x32_2x2_8x32x1_8x32x1_1x32x1x8_8_1x1_intrawave_v3,936.32,689.75,0.0
256,3072,2048,3072,ck,0,0,40.0445,a8w8_blockscale_1x128x128_256x128x128x128_16x16_32x32_2x2_8x32x1_8x32x1_1x32x1x8_8_1x1_intrawave_v3,965.29,707.0,0.0
256,3104,2048,3072,ck,0,0,40.4875,a8w8_blockscale_1x128x128_256x128x128x128_16x16_32x32_2x2_8x32x1_8x32x1_1x32x1x8_8_1x1_intrawave_v3,964.68,704.93,0.0
256,3201,2048,3072,ck,0,0,40.1131,a8w8_blockscale_1x128x128_256x128x128x128_16x16_32x32_2x2_8x32x1_8x32x1_1x32x1x8_8_1x1_intrawave_v3,1004.11,728.84,0.0
256,3215,2048,3072,ck,0,0,40.4799,a8w8_blockscale_1x128x128_256x128x128x128_16x16_32x32_2x2_8x32x1_8x32x1_1x32x1x8_8_1x1_intrawave_v3,999.36,724.72,0.0
256,3221,2048,3072,ck,0,0,40.3881,a8w8_blockscale_1x128x128_256x128x128x128_16x16_32x32_2x2_8x32x1_8x32x1_1x32x1x8_8_1x1_intrawave_v3,1003.5,727.43,0.0
256,3261,2048,3072,ck,0,0,40.7312,a8w8_blockscale_1x128x128_256x128x128x128_16x16_32x32_2x2_8x32x1_8x32x1_1x32x1x8_8_1x1_intrawave_v3,1007.41,728.34,0.0
256,3262,2048,3072,ck,0,0,40.5568,a8w8_blockscale_1x128x128_256x128x128x128_16x16_32x32_2x2_8x32x1_8x32x1_1x32x1x8_8_1x1_intrawave_v3,1012.05,731.65,0.0
256,3271,2048,3072,ck,0,0,41.1538,a8w8_blockscale_1x128x128_256x128x128x128_16x16_32x32_2x2_8x32x1_8x32x1_1x32x1x8_8_1x1_intrawave_v3,1000.12,722.61,0.0
256,3278,2048,3072,ck,0,0,40.6333,a8w8_blockscale_1x128x128_256x128x128x128_16x16_32x32_2x2_8x32x1_8x32x1_1x32x1x8_8_1x1_intrawave_v3,1015.1,733.1,0.0
256,3280,2048,3072,ck,0,0,41.0161,a8w8_blockscale_1x128x128_256x128x128x128_16x16_32x32_2x2_8x32x1_8x32x1_1x32x1x8_8_1x1_intrawave_v3,1006.24,726.6,0.0
256,3290,2048,3072,ck,0,0,40.5988,a8w8_blockscale_1x128x128_256x128x128x128_16x16_32x32_2x2_8x32x1_8x32x1_1x32x1x8_8_1x1_intrawave_v3,1019.68,735.84,0.0
256,3301,2048,3072,ck,0,0,41.0037,a8w8_blockscale_1x128x128_256x128x128x128_16x16_32x32_2x2_8x32x1_8x32x1_1x32x1x8_8_1x1_intrawave_v3,1012.99,730.5,0.0
256,3310,2048,3072,ck,0,0,41.2201,a8w8_blockscale_1x128x128_256x128x128x128_16x16_32x32_2x2_8x32x1_8x32x1_1x32x1x8_8_1x1_intrawave_v3,1010.42,728.23,0.0
256,3314,2048,3072,ck,0,0,41.2799,a8w8_blockscale_1x128x128_256x128x128x128_16x16_32x32_2x2_8x32x1_8x32x1_1x32x1x8_8_1x1_intrawave_v3,1010.17,727.87,0.0
256,3315,2048,3072,ck,0,0,41.0419,a8w8_blockscale_1x128x128_256x128x128x128_16x16_32x32_2x2_8x32x1_8x32x1_1x32x1x8_8_1x1_intrawave_v3,1016.34,732.26,0.0
256,3317,2048,3072,ck,0,0,40.5296,a8w8_blockscale_1x128x128_256x128x128x128_16x16_32x32_2x2_8x32x1_8x32x1_1x32x1x8_8_1x1_intrawave_v3,1029.8,741.87,0.0
256,3328,2048,3072,ck,0,0,41.2677,a8w8_blockscale_1x128x128_256x128x128x128_16x16_32x32_2x2_8x32x1_8x32x1_1x32x1x8_8_1x1_intrawave_v3,1014.74,730.51,0.0
256,3331,2048,3072,ck,0,0,40.8166,a8w8_blockscale_1x128x128_256x128x128x128_16x16_32x32_2x2_8x32x1_8x32x1_1x32x1x8_8_1x1_intrawave_v3,1026.88,739.11,0.0
256,3333,2048,3072,ck,0,0,40.6278,a8w8_blockscale_1x128x128_256x128x128x128_16x16_32x32_2x2_8x32x1_8x32x1_1x32x1x8_8_1x1_intrawave_v3,1032.27,742.9,0.0
256,3336,2048,3072,ck,0,0,41.891,a8w8_blockscale_1x128x128_256x128x128x128_16x16_32x32_2x2_8x32x1_8x32x1_1x32x1x8_8_1x1_intrawave_v3,1002.04,721.01,0.0
256,3352,2048,3072,ck,0,0,40.8763,a8w8_blockscale_1x128x128_256x128x128x128_16x16_32x32_2x2_8x32x1_8x32x1_1x32x1x8_8_1x1_intrawave_v3,1031.84,741.72,0.0
256,3359,2048,3072,ck,0,0,40.9845,a8w8_blockscale_1x128x128_256x128x128x128_16x16_32x32_2x2_8x32x1_8x32x1_1x32x1x8_8_1x1_intrawave_v3,1031.27,740.98,0.0
256,3361,2048,3072,ck,0,0,40.6763,a8w8_blockscale_1x128x128_256x128x128x128_16x16_32x32_2x2_8x32x1_8x32x1_1x32x1x8_8_1x1_intrawave_v3,1039.7,746.95,0.0
256,3365,2048,3072,ck,0,0,40.9548,a8w8_blockscale_1x128x128_256x128x128x128_16x16_32x32_2x2_8x32x1_8x32x1_1x32x1x8_8_1x1_intrawave_v3,1033.86,742.57,0.0
256,3371,2048,3072,ck,0,0,41.1024,a8w8_blockscale_1x128x128_256x128x128x128_16x16_32x32_2x2_8x32x1_8x32x1_1x32x1x8_8_1x1_intrawave_v3,1031.98,740.95,0.0
256,3378,2048,3072,ck,0,0,41.412,a8w8_blockscale_1x128x128_256x128x128x128_16x16_32x32_2x2_8x32x1_8x32x1_1x32x1x8_8_1x1_intrawave_v3,1026.4,736.62,0.0
256,3382,2048,3072,ck,0,0,40.9512,a8w8_blockscale_1x128x128_256x128x128x128_16x16_32x32_2x2_8x32x1_8x32x1_1x32x1x8_8_1x1_intrawave_v3,1039.17,745.61,0.0
256,3383,2048,3072,ck,0,0,41.0141,a8w8_blockscale_1x128x128_256x128x128x128_16x16_32x32_2x2_8x32x1_8x32x1_1x32x1x8_8_1x1_intrawave_v3,1037.89,744.64,0.0
256,3387,2048,3072,ck,0,0,41.5872,a8w8_blockscale_1x128x128_256x128x128x128_16x16_32x32_2x2_8x32x1_8x32x1_1x32x1x8_8_1x1_intrawave_v3,1024.79,735.07,0.0
256,3389,2048,3072,ck,0,0,41.0809,a8w8_blockscale_1x128x128_256x128x128x128_16x16_32x32_2x2_8x32x1_8x32x1_1x32x1x8_8_1x1_intrawave_v3,1038.04,744.48,0.0
256,3393,2048,3072,ck,0,0,40.9938,a8w8_blockscale_1x128x128_256x128x128x128_16x16_32x32_2x2_8x32x1_8x32x1_1x32x1x8_8_1x1_intrawave_v3,1041.47,746.76,0.0
256,3395,2048,3072,ck,0,0,41.287,a8w8_blockscale_1x128x128_256x128x128x128_16x16_32x32_2x2_8x32x1_8x32x1_1x32x1x8_8_1x1_intrawave_v3,1034.68,741.8,0.0
256,3396,2048,3072,ck,0,0,41.7953,a8w8_blockscale_1x128x128_256x128x128x128_16x16_32x32_2x2_8x32x1_8x32x1_1x32x1x8_8_1x1_intrawave_v3,1022.4,732.95,0.0
256,3403,2048,3072,ck,0,0,41.2085,a8w8_blockscale_1x128x128_256x128x128x128_16x16_32x32_2x2_8x32x1_8x32x1_1x32x1x8_8_1x1_intrawave_v3,1039.1,744.61,0.0
256,3404,2048,3072,ck,0,0,41.1979,a8w8_blockscale_1x128x128_256x128x128x128_16x16_32x32_2x2_8x32x1_8x32x1_1x32x1x8_8_1x1_intrawave_v3,1039.67,744.97,0.0
256,3413,2048,3072,ck,0,0,41.3239,a8w8_blockscale_1x128x128_256x128x128x128_16x16_32x32_2x2_8x32x1_8x32x1_1x32x1x8_8_1x1_intrawave_v3,1039.24,744.26,0.0
256,3426,2048,3072,ck,0,0,40.8825,a8w8_blockscale_1x128x128_256x128x128x128_16x16_32x32_2x2_8x32x1_8x32x1_1x32x1x8_8_1x1_intrawave_v3,1054.46,754.58,0.0
256,3428,2048,3072,ck,0,0,43.2285,a8w8_blockscale_1x128x128_256x128x128x128_16x16_32x32_2x2_8x32x1_8x32x1_1x32x1x8_8_1x1_intrawave_v3,997.82,713.96,0.0
256,3433,2048,3072,ck,0,0,41.0087,a8w8_blockscale_1x128x128_256x128x128x128_16x16_32x32_2x2_8x32x1_8x32x1_1x32x1x8_8_1x1_intrawave_v3,1053.37,753.48,0.0
256,3456,2048,3072,ck,0,0,40.9022,a8w8_blockscale_1x128x128_256x128x128x128_16x16_32x32_2x2_8x32x1_8x32x1_1x32x1x8_8_1x1_intrawave_v3,1063.18,759.47,0.0
256,3480,2048,3072,ck,0,0,41.6828,a8w8_blockscale_1x128x128_256x128x128x128_16x16_32x32_2x2_8x32x1_8x32x1_1x32x1x8_8_1x1_intrawave_v3,1050.52,749.38,0.0
256,3504,2048,3072,ck,0,0,42.3012,a8w8_blockscale_1x128x128_256x128x128x128_16x16_32x32_2x2_8x32x1_8x32x1_1x32x1x8_8_1x1_intrawave_v3,1042.3,742.49,0.0
256,3584,2048,3072,ck,0,0,41.0824,a8w8_blockscale_1x128x128_256x128x128x128_16x16_32x32_2x2_8x32x1_8x32x1_1x32x1x8_8_1x1_intrawave_v3,1097.72,778.47,0.0
256,3703,2048,3072,ck,0,0,43.1119,a8w8_blockscale_1x128x128_256x128x128x128_16x16_32x32_2x2_8x32x1_8x32x1_1x32x1x8_8_1x1_intrawave_v3,1080.78,761.61,0.0
256,3712,2048,3072,ck,0,0,43.0222,a8w8_blockscale_1x128x128_256x128x128x128_16x16_32x32_2x2_8x32x1_8x32x1_1x32x1x8_8_1x1_intrawave_v3,1085.67,764.7,0.0
256,3806,2048,3072,ck,0,0,43.6984,a8w8_blockscale_1x128x128_256x128x128x128_16x16_32x32_2x2_8x32x1_8x32x1_1x32x1x8_8_1x1_intrawave_v3,1095.93,768.29,0.0
256,3840,2048,3072,ck,0,0,43.8298,a8w8_blockscale_1x128x128_256x128x128x128_16x16_32x32_2x2_8x32x1_8x32x1_1x32x1x8_8_1x1_intrawave_v3,1102.41,771.54,0.0
256,3966,2048,3072,ck,0,0,44.6384,a8w8_blockscale_1x128x128_256x128x128x128_16x16_32x32_2x2_8x32x1_8x32x1_1x32x1x8_8_1x1_intrawave_v3,1117.96,777.8,0.0
256,3968,2048,3072,ck,0,0,44.9726,a8w8_blockscale_1x128x128_256x128x128x128_16x16_32x32_2x2_8x32x1_8x32x1_1x32x1x8_8_1x1_intrawave_v3,1110.21,772.34,0.0
256,4096,2048,3072,ck,0,0,45.5615,a8w8_blockscale_1x128x128_256x128x128x128_16x16_32x32_2x2_8x32x1_8x32x1_1x32x1x8_8_1x1_intrawave_v3,1131.21,782.49,0.0
256,4139,2048,3072,ck,0,0,60.5729,a8w8_blockscale_1x128x128_256x128x128x128_16x16_32x32_2x2_8x32x1_8x32x1_1x32x1x8_8_1x1_intrawave_v3,859.8,593.66,0.0
256,4224,2048,3072,ck,0,0,59.8948,a8w8_blockscale_1x128x128_256x128x128x128_16x16_32x32_2x2_8x32x1_8x32x1_1x32x1x8_8_1x1_intrawave_v3,887.39,610.56,0.0
256,4352,2048,3072,ck,0,0,59.7791,a8w8_blockscale_1x128x128_256x128x128x128_16x16_32x32_2x2_8x32x1_8x32x1_1x32x1x8_8_1x1_intrawave_v3,916.05,627.09,0.0
256,4370,2048,3072,ck,0,0,60.7835,a8w8_blockscale_1x128x128_256x128x128x128_16x16_32x32_2x2_8x32x1_8x32x1_1x32x1x8_8_1x1_intrawave_v3,904.64,618.85,0.0
256,4412,2048,3072,ck,0,0,60.2238,a8w8_blockscale_1x128x128_256x128x128x128_16x16_32x32_2x2_8x32x1_8x32x1_1x32x1x8_8_1x1_intrawave_v3,921.83,629.6,0.0
256,4417,2048,3072,ck,0,0,60.4656,a8w8_blockscale_1x128x128_256x128x128x128_16x16_32x32_2x2_8x32x1_8x32x1_1x32x1x8_8_1x1_intrawave_v3,919.18,627.67,0.0
256,4441,2048,3072,ck,0,0,60.537,a8w8_blockscale_1x128x128_256x128x128x128_16x16_32x32_2x2_8x32x1_8x32x1_1x32x1x8_8_1x1_intrawave_v3,923.08,629.77,0.0
256,4442,2048,3072,ck,0,0,60.332,a8w8_blockscale_1x128x128_256x128x128x128_16x16_32x32_2x2_8x32x1_8x32x1_1x32x1x8_8_1x1_intrawave_v3,926.43,632.03,0.0
256,4445,2048,3072,ck,0,0,60.5796,a8w8_blockscale_1x128x128_256x128x128x128_16x16_32x32_2x2_8x32x1_8x32x1_1x32x1x8_8_1x1_intrawave_v3,923.27,629.8,0.0
256,4448,2048,3072,ck,0,0,60.198,a8w8_blockscale_1x128x128_256x128x128x128_16x16_32x32_2x2_8x32x1_8x32x1_1x32x1x8_8_1x1_intrawave_v3,929.75,634.15,0.0
256,4461,2048,3072,ck,0,0,60.5396,a8w8_blockscale_1x128x128_256x128x128x128_16x16_32x32_2x2_8x32x1_8x32x1_1x32x1x8_8_1x1_intrawave_v3,927.2,632.11,0.0
256,4466,2048,3072,ck,0,0,60.5935,a8w8_blockscale_1x128x128_256x128x128x128_16x16_32x32_2x2_8x32x1_8x32x1_1x32x1x8_8_1x1_intrawave_v3,927.41,632.14,0.0
256,4480,2048,3072,ck,0,0,59.8859,a8w8_blockscale_1x128x128_256x128x128x128_16x16_32x32_2x2_8x32x1_8x32x1_1x32x1x8_8_1x1_intrawave_v3,941.31,641.29,0.0
256,4500,2048,3072,ck,0,0,60.0232,a8w8_blockscale_1x128x128_256x128x128x128_16x16_32x32_2x2_8x32x1_8x32x1_1x32x1x8_8_1x1_intrawave_v3,943.35,642.21,0.0
256,4502,2048,3072,ck,0,0,60.9206,a8w8_blockscale_1x128x128_256x128x128x128_16x16_32x32_2x2_8x32x1_8x32x1_1x32x1x8_8_1x1_intrawave_v3,929.87,632.98,0.0
256,4514,2048,3072,ck,0,0,60.4011,a8w8_blockscale_1x128x128_256x128x128x128_16x16_32x32_2x2_8x32x1_8x32x1_1x32x1x8_8_1x1_intrawave_v3,940.37,639.85,0.0
256,4517,2048,3072,ck,0,0,60.514,a8w8_blockscale_1x128x128_256x128x128x128_16x16_32x32_2x2_8x32x1_8x32x1_1x32x1x8_8_1x1_intrawave_v3,939.24,639.01,0.0
256,4520,2048,3072,ck,0,0,60.4801,a8w8_blockscale_1x128x128_256x128x128x128_16x16_32x32_2x2_8x32x1_8x32x1_1x32x1x8_8_1x1_intrawave_v3,940.39,639.73,0.0
256,4541,2048,3072,ck,0,0,60.0085,a8w8_blockscale_1x128x128_256x128x128x128_16x16_32x32_2x2_8x32x1_8x32x1_1x32x1x8_8_1x1_intrawave_v3,952.18,647.26,0.0
256,4549,2048,3072,ck,0,0,60.7258,a8w8_blockscale_1x128x128_256x128x128x128_16x16_32x32_2x2_8x32x1_8x32x1_1x32x1x8_8_1x1_intrawave_v3,942.59,640.56,0.0
256,4550,2048,3072,ck,0,0,60.8775,a8w8_blockscale_1x128x128_256x128x128x128_16x16_32x32_2x2_8x32x1_8x32x1_1x32x1x8_8_1x1_intrawave_v3,940.45,639.08,0.0
256,4586,2048,3072,ck,0,0,60.1338,a8w8_blockscale_1x128x128_256x128x128x128_16x16_32x32_2x2_8x32x1_8x32x1_1x32x1x8_8_1x1_intrawave_v3,959.61,651.28,0.0
256,4608,2048,3072,ck,0,0,59.8002,a8w8_blockscale_1x128x128_256x128x128x128_16x16_32x32_2x2_8x32x1_8x32x1_1x32x1x8_8_1x1_intrawave_v3,969.6,657.55,0.0
256,4672,2048,3072,ck,0,0,61.3834,a8w8_blockscale_1x128x128_256x128x128x128_16x16_32x32_2x2_8x32x1_8x32x1_1x32x1x8_8_1x1_intrawave_v3,957.71,648.06,0.0
256,4735,2048,3072,ck,0,0,60.138,a8w8_blockscale_1x128x128_256x128x128x128_16x16_32x32_2x2_8x32x1_8x32x1_1x32x1x8_8_1x1_intrawave_v3,990.72,668.99,0.0
256,4736,2048,3072,ck,0,0,59.4356,a8w8_blockscale_1x128x128_256x128x128x128_16x16_32x32_2x2_8x32x1_8x32x1_1x32x1x8_8_1x1_intrawave_v3,1002.64,677.02,0.0
256,4864,2048,3072,ck,0,0,60.4993,a8w8_blockscale_1x128x128_256x128x128x128_16x16_32x32_2x2_8x32x1_8x32x1_1x32x1x8_8_1x1_intrawave_v3,1011.64,680.28,0.0
256,4992,2048,3072,ck,0,0,61.6452,a8w8_blockscale_1x128x128_256x128x128x128_16x16_32x32_2x2_8x32x1_8x32x1_1x32x1x8_8_1x1_intrawave_v3,1018.96,682.52,0.0
256,5147,2048,3072,ck,0,0,62.7135,a8w8_blockscale_1x128x128_256x128x128x128_16x16_32x32_2x2_8x32x1_8x32x1_1x32x1x8_8_1x1_intrawave_v3,1032.7,688.61,0.0
256,5202,2048,3072,ck,0,0,62.3155,a8w8_blockscale_1x128x128_256x128x128x128_16x16_32x32_2x2_8x32x1_8x32x1_1x32x1x8_8_1x1_intrawave_v3,1050.4,699.33,0.0
256,5235,2048,3072,ck,0,0,62.6104,a8w8_blockscale_1x128x128_256x128x128x128_16x16_32x32_2x2_8x32x1_8x32x1_1x32x1x8_8_1x1_intrawave_v3,1052.09,699.82,0.0
256,5248,2048,3072,ck,0,0,62.175,a8w8_blockscale_1x128x128_256x128x128x128_16x16_32x32_2x2_8x32x1_8x32x1_1x32x1x8_8_1x1_intrawave_v3,1062.08,706.22,0.0
256,5258,2048,3072,ck,0,0,62.9178,a8w8_blockscale_1x128x128_256x128x128x128_16x16_32x32_2x2_8x32x1_8x32x1_1x32x1x8_8_1x1_intrawave_v3,1051.55,699.02,0.0
256,5295,2048,3072,ck,0,0,63.2085,a8w8_blockscale_1x128x128_256x128x128x128_16x16_32x32_2x2_8x32x1_8x32x1_1x32x1x8_8_1x1_intrawave_v3,1054.08,700.0,0.0
256,5342,2048,3072,ck,0,0,63.6437,a8w8_blockscale_1x128x128_256x128x128x128_16x16_32x32_2x2_8x32x1_8x32x1_1x32x1x8_8_1x1_intrawave_v3,1056.16,700.51,0.0
256,5371,2048,3072,ck,0,0,62.3957,a8w8_blockscale_1x128x128_256x128x128x128_16x16_32x32_2x2_8x32x1_8x32x1_1x32x1x8_8_1x1_intrawave_v3,1083.13,717.85,0.0
256,5376,2048,3072,ck,0,0,62.7352,a8w8_blockscale_1x128x128_256x128x128x128_16x16_32x32_2x2_8x32x1_8x32x1_1x32x1x8_8_1x1_intrawave_v3,1078.27,714.54,0.0
256,5396,2048,3072,ck,0,0,62.6817,a8w8_blockscale_1x128x128_256x128x128x128_16x16_32x32_2x2_8x32x1_8x32x1_1x32x1x8_8_1x1_intrawave_v3,1083.21,717.43,0.0
256,5405,2048,3072,ck,0,0,63.0366,a8w8_blockscale_1x128x128_256x128x128x128_16x16_32x32_2x2_8x32x1_8x32x1_1x32x1x8_8_1x1_intrawave_v3,1078.91,714.42,0.0
256,5455,2048,3072,ck,0,0,64.2792,a8w8_blockscale_1x128x128_256x128x128x128_16x16_32x32_2x2_8x32x1_8x32x1_1x32x1x8_8_1x1_intrawave_v3,1067.84,706.18,0.0
256,5459,2048,3072,ck,0,0,63.8082,a8w8_blockscale_1x128x128_256x128x128x128_16x16_32x32_2x2_8x32x1_8x32x1_1x32x1x8_8_1x1_intrawave_v3,1076.51,711.85,0.0
256,5492,2048,3072,ck,0,0,64.4511,a8w8_blockscale_1x128x128_256x128x128x128_16x16_32x32_2x2_8x32x1_8x32x1_1x32x1x8_8_1x1_intrawave_v3,1072.21,708.41,0.0
256,5504,2048,3072,ck,0,0,63.5642,a8w8_blockscale_1x128x128_256x128x128x128_16x16_32x32_2x2_8x32x1_8x32x1_1x32x1x8_8_1x1_intrawave_v3,1089.55,719.65,0.0
256,5521,2048,3072,ck,0,0,64.1045,a8w8_blockscale_1x128x128_256x128x128x128_16x16_32x32_2x2_8x32x1_8x32x1_1x32x1x8_8_1x1_intrawave_v3,1083.7,715.49,0.0
256,5538,2048,3072,ck,0,0,64.1624,a8w8_blockscale_1x128x128_256x128x128x128_16x16_32x32_2x2_8x32x1_8x32x1_1x32x1x8_8_1x1_intrawave_v3,1086.06,716.74,0.0
256,5546,2048,3072,ck,0,0,64.2182,a8w8_blockscale_1x128x128_256x128x128x128_16x16_32x32_2x2_8x32x1_8x32x1_1x32x1x8_8_1x1_intrawave_v3,1086.68,717.01,0.0
256,5565,2048,3072,ck,0,0,62.9597,a8w8_blockscale_1x128x128_256x128x128x128_16x16_32x32_2x2_8x32x1_8x32x1_1x32x1x8_8_1x1_intrawave_v3,1112.2,733.51,0.0
256,5599,2048,3072,ck,0,0,64.7884,a8w8_blockscale_1x128x128_256x128x128x128_16x16_32x32_2x2_8x32x1_8x32x1_1x32x1x8_8_1x1_intrawave_v3,1087.41,716.56,0.0
256,5609,2048,3072,ck,0,0,64.2551,a8w8_blockscale_1x128x128_256x128x128x128_16x16_32x32_2x2_8x32x1_8x32x1_1x32x1x8_8_1x1_intrawave_v3,1098.4,723.63,0.0
256,5614,2048,3072,ck,0,0,64.553,a8w8_blockscale_1x128x128_256x128x128x128_16x16_32x32_2x2_8x32x1_8x32x1_1x32x1x8_8_1x1_intrawave_v3,1094.3,720.84,0.0
256,5622,2048,3072,ck,0,0,64.2027,a8w8_blockscale_1x128x128_256x128x128x128_16x16_32x32_2x2_8x32x1_8x32x1_1x32x1x8_8_1x1_intrawave_v3,1101.84,725.67,0.0
256,5632,2048,3072,ck,0,0,63.4933,a8w8_blockscale_1x128x128_256x128x128x128_16x16_32x32_2x2_8x32x1_8x32x1_1x32x1x8_8_1x1_intrawave_v3,1116.13,734.91,0.0
256,5633,2048,3072,ck,0,0,65.3217,a8w8_blockscale_1x128x128_256x128x128x128_16x16_32x32_2x2_8x32x1_8x32x1_1x32x1x8_8_1x1_intrawave_v3,1085.08,714.45,0.0
256,5634,2048,3072,ck,0,0,64.1035,a8w8_blockscale_1x128x128_256x128x128x128_16x16_32x32_2x2_8x32x1_8x32x1_1x32x1x8_8_1x1_intrawave_v3,1105.9,728.13,0.0
256,5644,2048,3072,ck,0,0,65.1323,a8w8_blockscale_1x128x128_256x128x128x128_16x16_32x32_2x2_8x32x1_8x32x1_1x32x1x8_8_1x1_intrawave_v3,1090.36,717.73,0.0
256,5648,2048,3072,ck,0,0,65.3508,a8w8_blockscale_1x128x128_256x128x128x128_16x16_32x32_2x2_8x32x1_8x32x1_1x32x1x8_8_1x1_intrawave_v3,1087.49,715.77,0.0
256,5661,2048,3072,ck,0,0,65.4609,a8w8_blockscale_1x128x128_256x128x128x128_16x16_32x32_2x2_8x32x1_8x32x1_1x32x1x8_8_1x1_intrawave_v3,1088.16,715.99,0.0
256,5665,2048,3072,ck,0,0,65.2878,a8w8_blockscale_1x128x128_256x128x128x128_16x16_32x32_2x2_8x32x1_8x32x1_1x32x1x8_8_1x1_intrawave_v3,1091.81,718.33,0.0
256,5667,2048,3072,ck,0,0,65.3397,a8w8_blockscale_1x128x128_256x128x128x128_16x16_32x32_2x2_8x32x1_8x32x1_1x32x1x8_8_1x1_intrawave_v3,1091.33,717.98,0.0
256,5672,2048,3072,ck,0,0,65.2635,a8w8_blockscale_1x128x128_256x128x128x128_16x16_32x32_2x2_8x32x1_8x32x1_1x32x1x8_8_1x1_intrawave_v3,1093.57,719.37,0.0
256,5673,2048,3072,ck,0,0,65.7516,a8w8_blockscale_1x128x128_256x128x128x128_16x16_32x32_2x2_8x32x1_8x32x1_1x32x1x8_8_1x1_intrawave_v3,1085.64,714.14,0.0
256,5676,2048,3072,ck,0,0,64.7308,a8w8_blockscale_1x128x128_256x128x128x128_16x16_32x32_2x2_8x32x1_8x32x1_1x32x1x8_8_1x1_intrawave_v3,1103.35,725.73,0.0
256,5682,2048,3072,ck,0,0,65.4573,a8w8_blockscale_1x128x128_256x128x128x128_16x16_32x32_2x2_8x32x1_8x32x1_1x32x1x8_8_1x1_intrawave_v3,1092.26,718.33,0.0
256,5688,2048,3072,ck,0,0,64.5587,a8w8_blockscale_1x128x128_256x128x128x128_16x16_32x32_2x2_8x32x1_8x32x1_1x32x1x8_8_1x1_intrawave_v3,1108.63,729.0,0.0
256,5690,2048,3072,ck,0,0,65.1111,a8w8_blockscale_1x128x128_256x128x128x128_16x16_32x32_2x2_8x32x1_8x32x1_1x32x1x8_8_1x1_intrawave_v3,1099.61,723.03,0.0
256,5708,2048,3072,ck,0,0,64.8961,a8w8_blockscale_1x128x128_256x128x128x128_16x16_32x32_2x2_8x32x1_8x32x1_1x32x1x8_8_1x1_intrawave_v3,1106.74,727.42,0.0
256,5720,2048,3072,ck,0,0,65.2372,a8w8_blockscale_1x128x128_256x128x128x128_16x16_32x32_2x2_8x32x1_8x32x1_1x32x1x8_8_1x1_intrawave_v3,1103.27,724.93,0.0
256,5721,2048,3072,ck,0,0,64.1684,a8w8_blockscale_1x128x128_256x128x128x128_16x16_32x32_2x2_8x32x1_8x32x1_1x32x1x8_8_1x1_intrawave_v3,1121.84,737.12,0.0
256,5737,2048,3072,ck,0,0,66.0803,a8w8_blockscale_1x128x128_256x128x128x128_16x16_32x32_2x2_8x32x1_8x32x1_1x32x1x8_8_1x1_intrawave_v3,1092.43,717.53,0.0
256,5738,2048,3072,ck,0,0,64.1485,a8w8_blockscale_1x128x128_256x128x128x128_16x16_32x32_2x2_8x32x1_8x32x1_1x32x1x8_8_1x1_intrawave_v3,1125.53,739.24,0.0
256,5760,2048,3072,ck,0,0,64.932,a8w8_blockscale_1x128x128_256x128x128x128_16x16_32x32_2x2_8x32x1_8x32x1_1x32x1x8_8_1x1_intrawave_v3,1116.21,732.75,0.0
256,5780,2048,3072,ck,0,0,65.7187,a8w8_blockscale_1x128x128_256x128x128x128_16x16_32x32_2x2_8x32x1_8x32x1_1x32x1x8_8_1x1_intrawave_v3,1106.67,726.16,0.0
256,5782,2048,3072,ck,0,0,65.6878,a8w8_blockscale_1x128x128_256x128x128x128_16x16_32x32_2x2_8x32x1_8x32x1_1x32x1x8_8_1x1_intrawave_v3,1107.58,726.72,0.0
256,5856,2048,3072,ck,0,0,66.6969,a8w8_blockscale_1x128x128_256x128x128x128_16x16_32x32_2x2_8x32x1_8x32x1_1x32x1x8_8_1x1_intrawave_v3,1104.78,723.68,0.0
256,5876,2048,3072,ck,0,0,65.5901,a8w8_blockscale_1x128x128_256x128x128x128_16x16_32x32_2x2_8x32x1_8x32x1_1x32x1x8_8_1x1_intrawave_v3,1127.26,738.08,0.0
256,5888,2048,3072,ck,0,0,64.7308,a8w8_blockscale_1x128x128_256x128x128x128_16x16_32x32_2x2_8x32x1_8x32x1_1x32x1x8_8_1x1_intrawave_v3,1144.56,749.21,0.0
256,5892,2048,3072,ck,0,0,68.6316,a8w8_blockscale_1x128x128_256x128x128x128_16x16_32x32_2x2_8x32x1_8x32x1_1x32x1x8_8_1x1_intrawave_v3,1080.24,707.04,0.0
256,5938,2048,3072,ck,0,0,69.3283,a8w8_blockscale_1x128x128_256x128x128x128_16x16_32x32_2x2_8x32x1_8x32x1_1x32x1x8_8_1x1_intrawave_v3,1077.73,704.69,0.0
256,5954,2048,3072,ck,0,0,68.5461,a8w8_blockscale_1x128x128_256x128x128x128_16x16_32x32_2x2_8x32x1_8x32x1_1x32x1x8_8_1x1_intrawave_v3,1092.97,714.41,0.0
256,5969,2048,3072,ck,0,0,68.7471,a8w8_blockscale_1x128x128_256x128x128x128_16x16_32x32_2x2_8x32x1_8x32x1_1x32x1x8_8_1x1_intrawave_v3,1092.52,713.88,0.0
256,6010,2048,3072,ck,0,0,67.2281,a8w8_blockscale_1x128x128_256x128x128x128_16x16_32x32_2x2_8x32x1_8x32x1_1x32x1x8_8_1x1_intrawave_v3,1124.88,734.38,0.0
256,6016,2048,3072,ck,0,0,70.3499,a8w8_blockscale_1x128x128_256x128x128x128_16x16_32x32_2x2_8x32x1_8x32x1_1x32x1x8_8_1x1_intrawave_v3,1076.03,702.41,0.0
256,6039,2048,3072,ck,0,0,70.2914,a8w8_blockscale_1x128x128_256x128x128x128_16x16_32x32_2x2_8x32x1_8x32x1_1x32x1x8_8_1x1_intrawave_v3,1081.05,705.34,0.0
256,6045,2048,3072,ck,0,0,71.1406,a8w8_blockscale_1x128x128_256x128x128x128_16x16_32x32_2x2_8x32x1_8x32x1_1x32x1x8_8_1x1_intrawave_v3,1069.2,697.52,0.0
256,6053,2048,3072,ck,0,0,69.4043,a8w8_blockscale_1x128x128_256x128x128x128_16x16_32x32_2x2_8x32x1_8x32x1_1x32x1x8_8_1x1_intrawave_v3,1097.4,715.8,0.0
256,6108,2048,3072,ck,0,0,70.6651,a8w8_blockscale_1x128x128_256x128x128x128_16x16_32x32_2x2_8x32x1_8x32x1_1x32x1x8_8_1x1_intrawave_v3,1087.62,708.6,0.0
256,6144,2048,3072,ck,0,0,69.4681,a8w8_blockscale_1x128x128_256x128x128x128_16x16_32x32_2x2_8x32x1_8x32x1_1x32x1x8_8_1x1_intrawave_v3,1112.88,724.53,0.0
256,6190,2048,3072,ck,0,0,76.2691,a8w8_blockscale_1x128x128_256x128x128x128_16x16_32x32_2x2_8x32x1_8x32x1_1x32x1x8_8_1x1_intrawave_v3,1021.23,664.25,0.0
256,6220,2048,3072,ck,0,0,76.0377,a8w8_blockscale_1x128x128_256x128x128x128_16x16_32x32_2x2_8x32x1_8x32x1_1x32x1x8_8_1x1_intrawave_v3,1029.3,669.09,0.0
256,6250,2048,3072,ck,0,0,76.8429,a8w8_blockscale_1x128x128_256x128x128x128_16x16_32x32_2x2_8x32x1_8x32x1_1x32x1x8_8_1x1_intrawave_v3,1023.43,664.88,0.0
256,6258,2048,3072,ck,0,0,76.2275,a8w8_blockscale_1x128x128_256x128x128x128_16x16_32x32_2x2_8x32x1_8x32x1_1x32x1x8_8_1x1_intrawave_v3,1033.01,671.0,0.0
256,6272,2048,3072,ck,0,0,77.0347,a8w8_blockscale_1x128x128_256x128x128x128_16x16_32x32_2x2_8x32x1_8x32x1_1x32x1x8_8_1x1_intrawave_v3,1024.47,665.27,0.0
256,6311,2048,3072,ck,0,0,76.2332,a8w8_blockscale_1x128x128_256x128x128x128_16x16_32x32_2x2_8x32x1_8x32x1_1x32x1x8_8_1x1_intrawave_v3,1041.68,675.94,0.0
256,6324,2048,3072,ck,0,0,76.0575,a8w8_blockscale_1x128x128_256x128x128x128_16x16_32x32_2x2_8x32x1_8x32x1_1x32x1x8_8_1x1_intrawave_v3,1046.24,678.72,0.0
256,6400,2048,3072,ck,0,0,75.8841,a8w8_blockscale_1x128x128_256x128x128x128_16x16_32x32_2x2_8x32x1_8x32x1_1x32x1x8_8_1x1_intrawave_v3,1061.23,687.45,0.0
256,6448,2048,3072,ck,0,0,76.5187,a8w8_blockscale_1x128x128_256x128x128x128_16x16_32x32_2x2_8x32x1_8x32x1_1x32x1x8_8_1x1_intrawave_v3,1060.32,686.25,0.0
256,6528,2048,3072,ck,0,0,76.2497,a8w8_blockscale_1x128x128_256x128x128x128_16x16_32x32_2x2_8x32x1_8x32x1_1x32x1x8_8_1x1_intrawave_v3,1077.27,696.19,0.0
256,6537,2048,3072,ck,0,0,77.2068,a8w8_blockscale_1x128x128_256x128x128x128_16x16_32x32_2x2_8x32x1_8x32x1_1x32x1x8_8_1x1_intrawave_v3,1065.38,688.39,0.0
256,6641,2048,3072,ck,0,0,77.8995,a8w8_blockscale_1x128x128_256x128x128x128_16x16_32x32_2x2_8x32x1_8x32x1_1x32x1x8_8_1x1_intrawave_v3,1072.7,691.84,0.0
256,6656,2048,3072,ck,0,0,76.9463,a8w8_blockscale_1x128x128_256x128x128x128_16x16_32x32_2x2_8x32x1_8x32x1_1x32x1x8_8_1x1_intrawave_v3,1088.45,701.81,0.0
256,6784,2048,3072,ck,0,0,77.0995,a8w8_blockscale_1x128x128_256x128x128x128_16x16_32x32_2x2_8x32x1_8x32x1_1x32x1x8_8_1x1_intrawave_v3,1107.17,712.32,0.0
256,6789,2048,3072,ck,0,0,79.413,a8w8_blockscale_1x128x128_256x128x128x128_16x16_32x32_2x2_8x32x1_8x32x1_1x32x1x8_8_1x1_intrawave_v3,1075.71,692.02,0.0
256,6848,2048,3072,ck,0,0,79.9036,a8w8_blockscale_1x128x128_256x128x128x128_16x16_32x32_2x2_8x32x1_8x32x1_1x32x1x8_8_1x1_intrawave_v3,1078.4,693.06,0.0
256,6853,2048,3072,ck,0,0,79.054,a8w8_blockscale_1x128x128_256x128x128x128_16x16_32x32_2x2_8x32x1_8x32x1_1x32x1x8_8_1x1_intrawave_v3,1090.78,700.96,0.0
256,6901,2048,3072,ck,0,0,78.8772,a8w8_blockscale_1x128x128_256x128x128x128_16x16_32x32_2x2_8x32x1_8x32x1_1x32x1x8_8_1x1_intrawave_v3,1100.88,706.89,0.0
256,6912,2048,3072,ck,0,0,78.8449,a8w8_blockscale_1x128x128_256x128x128x128_16x16_32x32_2x2_8x32x1_8x32x1_1x32x1x8_8_1x1_intrawave_v3,1103.09,708.18,0.0
256,7040,2048,3072,ck,0,0,78.7112,a8w8_blockscale_1x128x128_256x128x128x128_16x16_32x32_2x2_8x32x1_8x32x1_1x32x1x8_8_1x1_intrawave_v3,1125.43,721.04,0.0
256,7077,2048,3072,ck,0,0,78.973,a8w8_blockscale_1x128x128_256x128x128x128_16x16_32x32_2x2_8x32x1_8x32x1_1x32x1x8_8_1x1_intrawave_v3,1127.59,722.01,0.0
256,7130,2048,3072,ck,0,0,81.0353,a8w8_blockscale_1x128x128_256x128x128x128_16x16_32x32_2x2_8x32x1_8x32x1_1x32x1x8_8_1x1_intrawave_v3,1107.12,708.32,0.0
256,7168,2048,3072,ck,0,0,78.1765,a8w8_blockscale_1x128x128_256x128x128x128_16x16_32x32_2x2_8x32x1_8x32x1_1x32x1x8_8_1x1_intrawave_v3,1153.73,737.71,0.0
256,7296,2048,3072,ck,0,0,80.5857,a8w8_blockscale_1x128x128_256x128x128x128_16x16_32x32_2x2_8x32x1_8x32x1_1x32x1x8_8_1x1_intrawave_v3,1139.22,727.04,0.0
256,7424,2048,3072,ck,0,0,81.0637,a8w8_blockscale_1x128x128_256x128x128x128_16x16_32x32_2x2_8x32x1_8x32x1_1x32x1x8_8_1x1_intrawave_v3,1152.37,734.07,0.0
256,7552,2048,3072,ck,0,0,82.7164,a8w8_blockscale_1x128x128_256x128x128x128_16x16_32x32_2x2_8x32x1_8x32x1_1x32x1x8_8_1x1_intrawave_v3,1148.82,730.5,0.0
256,7568,2048,3072,ck,0,0,83.3376,a8w8_blockscale_1x128x128_256x128x128x128_16x16_32x32_2x2_8x32x1_8x32x1_1x32x1x8_8_1x1_intrawave_v3,1142.67,726.43,0.0
256,7680,2048,3072,ck,0,0,81.2778,a8w8_blockscale_1x128x128_256x128x128x128_16x16_32x32_2x2_8x32x1_8x32x1_1x32x1x8_8_1x1_intrawave_v3,1188.97,754.72,0.0
256,7808,2048,3072,ck,0,0,83.5884,a8w8_blockscale_1x128x128_256x128x128x128_16x16_32x32_2x2_8x32x1_8x32x1_1x32x1x8_8_1x1_intrawave_v3,1175.37,744.83,0.0
256,7936,2048,3072,ck,0,0,82.8115,a8w8_blockscale_1x128x128_256x128x128x128_16x16_32x32_2x2_8x32x1_8x32x1_1x32x1x8_8_1x1_intrawave_v3,1205.85,762.9,0.0
256,7946,2048,3072,ck,0,0,85.5172,a8w8_blockscale_1x128x128_256x128x128x128_16x16_32x32_2x2_8x32x1_8x32x1_1x32x1x8_8_1x1_intrawave_v3,1169.17,739.6,0.0
256,8062,2048,3072,ck,0,0,85.0445,a8w8_blockscale_1x128x128_256x128x128x128_16x16_32x32_2x2_8x32x1_8x32x1_1x32x1x8_8_1x1_intrawave_v3,1192.83,753.49,0.0
256,8064,2048,3072,ck,0,0,85.3331,a8w8_blockscale_1x128x128_256x128x128x128_16x16_32x32_2x2_8x32x1_8x32x1_1x32x1x8_8_1x1_intrawave_v3,1189.09,751.11,0.0
256,8192,2048,3072,ck,0,0,86.3668,a8w8_blockscale_1x128x128_256x128x128x128_16x16_32x32_2x2_8x32x1_8x32x1_1x32x1x8_8_1x1_intrawave_v3,1193.51,752.74,0.0
256,8240,2048,3072,ck,0,0,96.9105,a8w8_blockscale_1x128x128_256x128x128x128_16x16_32x32_2x2_8x32x1_8x32x1_1x32x1x8_8_1x1_intrawave_v3,1069.89,674.39,0.0
256,8320,2048,3072,ck,0,0,96.0227,a8w8_blockscale_1x128x128_256x128x128x128_16x16_32x32_2x2_8x32x1_8x32x1_1x32x1x8_8_1x1_intrawave_v3,1090.26,686.6,0.0
256,8365,2048,3072,ck,0,0,96.2901,a8w8_blockscale_1x128x128_256x128x128x128_16x16_32x32_2x2_8x32x1_8x32x1_1x32x1x8_8_1x1_intrawave_v3,1093.11,688.04,0.0
256,8381,2048,3072,ck,0,0,97.2047,a8w8_blockscale_1x128x128_256x128x128x128_16x16_32x32_2x2_8x32x1_8x32x1_1x32x1x8_8_1x1_intrawave_v3,1084.9,682.75,0.0
256,8448,2048,3072,ck,0,0,95.8172,a8w8_blockscale_1x128x128_256x128x128x128_16x16_32x32_2x2_8x32x1_8x32x1_1x32x1x8_8_1x1_intrawave_v3,1109.41,697.65,0.0
256,8576,2048,3072,ck,0,0,96.7923,a8w8_blockscale_1x128x128_256x128x128x128_16x16_32x32_2x2_8x32x1_8x32x1_1x32x1x8_8_1x1_intrawave_v3,1114.87,700.1,0.0
256,8619,2048,3072,ck,0,0,96.5297,a8w8_blockscale_1x128x128_256x128x128x128_16x16_32x32_2x2_8x32x1_8x32x1_1x32x1x8_8_1x1_intrawave_v3,1123.51,705.2,0.0
256,8704,2048,3072,ck,0,0,96.1273,a8w8_blockscale_1x128x128_256x128x128x128_16x16_32x32_2x2_8x32x1_8x32x1_1x32x1x8_8_1x1_intrawave_v3,1139.34,714.49,0.0
256,8832,2048,3072,ck,0,0,96.6285,a8w8_blockscale_1x128x128_256x128x128x128_16x16_32x32_2x2_8x32x1_8x32x1_1x32x1x8_8_1x1_intrawave_v3,1150.1,720.28,0.0
256,8960,2048,3072,ck,0,0,98.0006,a8w8_blockscale_1x128x128_256x128x128x128_16x16_32x32_2x2_8x32x1_8x32x1_1x32x1x8_8_1x1_intrawave_v3,1150.43,719.55,0.0
256,9088,2048,3072,ck,0,0,97.2163,a8w8_blockscale_1x128x128_256x128x128x128_16x16_32x32_2x2_8x32x1_8x32x1_1x32x1x8_8_1x1_intrawave_v3,1176.28,734.8,0.0
256,9216,2048,3072,ck,0,0,98.6459,a8w8_blockscale_1x128x128_256x128x128x128_16x16_32x32_2x2_8x32x1_8x32x1_1x32x1x8_8_1x1_intrawave_v3,1175.56,733.45,0.0
256,9344,2048,3072,ck,0,0,98.5439,a8w8_blockscale_1x128x128_256x128x128x128_16x16_32x32_2x2_8x32x1_8x32x1_1x32x1x8_8_1x1_intrawave_v3,1193.12,743.52,0.0
256,9348,2048,3072,ck,0,0,100.3887,a8w8_blockscale_1x128x128_256x128x128x128_16x16_32x32_2x2_8x32x1_8x32x1_1x32x1x8_8_1x1_intrawave_v3,1171.7,730.14,0.0
256,9472,2048,3072,ck,0,0,100.251,a8w8_blockscale_1x128x128_256x128x128x128_16x16_32x32_2x2_8x32x1_8x32x1_1x32x1x8_8_1x1_intrawave_v3,1188.87,740.01,0.0
256,9600,2048,3072,ck,0,0,100.2793,a8w8_blockscale_1x128x128_256x128x128x128_16x16_32x32_2x2_8x32x1_8x32x1_1x32x1x8_8_1x1_intrawave_v3,1204.6,748.95,0.0
256,9728,2048,3072,ck,0,0,102.0667,a8w8_blockscale_1x128x128_256x128x128x128_16x16_32x32_2x2_8x32x1_8x32x1_1x32x1x8_8_1x1_intrawave_v3,1199.28,744.82,0.0
256,9856,2048,3072,ck,0,0,102.0227,a8w8_blockscale_1x128x128_256x128x128x128_16x16_32x32_2x2_8x32x1_8x32x1_1x32x1x8_8_1x1_intrawave_v3,1215.58,754.14,0.0
256,9984,2048,3072,ck,0,0,105.681,a8w8_blockscale_1x128x128_256x128x128x128_16x16_32x32_2x2_8x32x1_8x32x1_1x32x1x8_8_1x1_intrawave_v3,1188.75,736.71,0.0
256,10016,2048,3072,ck,0,0,104.7003,a8w8_blockscale_1x128x128_256x128x128x128_16x16_32x32_2x2_8x32x1_8x32x1_1x32x1x8_8_1x1_intrawave_v3,1203.73,745.81,0.0
256,10023,2048,3072,ck,0,0,104.7345,a8w8_blockscale_1x128x128_256x128x128x128_16x16_32x32_2x2_8x32x1_8x32x1_1x32x1x8_8_1x1_intrawave_v3,1204.17,746.04,0.0
256,10112,2048,3072,ck,0,0,102.1655,a8w8_blockscale_1x128x128_256x128x128x128_16x16_32x32_2x2_8x32x1_8x32x1_1x32x1x8_8_1x1_intrawave_v3,1245.41,771.05,0.0
256,10140,2048,3072,ck,0,0,106.1528,a8w8_blockscale_1x128x128_256x128x128x128_16x16_32x32_2x2_8x32x1_8x32x1_1x32x1x8_8_1x1_intrawave_v3,1201.95,743.97,0.0
256,10240,2048,3072,ck,0,0,106.0433,a8w8_blockscale_1x128x128_256x128x128x128_16x16_32x32_2x2_8x32x1_8x32x1_1x32x1x8_8_1x1_intrawave_v3,1215.06,751.5,0.0
256,10442,2048,3072,ck,0,0,115.0917,a8w8_blockscale_1x128x128_256x128x128x128_16x16_32x32_2x2_8x32x1_8x32x1_1x32x1x8_8_1x1_intrawave_v3,1141.62,705.0,0.0
256,10496,2048,3072,ck,0,0,111.9955,a8w8_blockscale_1x128x128_256x128x128x128_16x16_32x32_2x2_8x32x1_8x32x1_1x32x1x8_8_1x1_intrawave_v3,1179.25,727.95,0.0
256,10760,2048,3072,ck,0,0,113.5511,a8w8_blockscale_1x128x128_256x128x128x128_16x16_32x32_2x2_8x32x1_8x32x1_1x32x1x8_8_1x1_intrawave_v3,1192.35,734.64,0.0
256,10786,2048,3072,ck,0,0,115.2777,a8w8_blockscale_1x128x128_256x128x128x128_16x16_32x32_2x2_8x32x1_8x32x1_1x32x1x8_8_1x1_intrawave_v3,1177.32,725.25,0.0
256,10804,2048,3072,ck,0,0,113.5733,a8w8_blockscale_1x128x128_256x128x128x128_16x16_32x32_2x2_8x32x1_8x32x1_1x32x1x8_8_1x1_intrawave_v3,1196.99,737.27,0.0
256,10819,2048,3072,ck,0,0,115.0776,a8w8_blockscale_1x128x128_256x128x128x128_16x16_32x32_2x2_8x32x1_8x32x1_1x32x1x8_8_1x1_intrawave_v3,1182.98,728.57,0.0
256,10840,2048,3072,ck,0,0,116.4841,a8w8_blockscale_1x128x128_256x128x128x128_16x16_32x32_2x2_8x32x1_8x32x1_1x32x1x8_8_1x1_intrawave_v3,1170.96,721.06,0.0
256,10863,2048,3072,ck,0,0,114.1145,a8w8_blockscale_1x128x128_256x128x128x128_16x16_32x32_2x2_8x32x1_8x32x1_1x32x1x8_8_1x1_intrawave_v3,1197.82,737.48,0.0
256,10880,2048,3072,ck,0,0,115.4514,a8w8_blockscale_1x128x128_256x128x128x128_16x16_32x32_2x2_8x32x1_8x32x1_1x32x1x8_8_1x1_intrawave_v3,1185.8,730.0,0.0
256,10915,2048,3072,ck,0,0,114.9443,a8w8_blockscale_1x128x128_256x128x128x128_16x16_32x32_2x2_8x32x1_8x32x1_1x32x1x8_8_1x1_intrawave_v3,1194.86,735.4,0.0
256,10970,2048,3072,ck,0,0,116.4693,a8w8_blockscale_1x128x128_256x128x128x128_16x16_32x32_2x2_8x32x1_8x32x1_1x32x1x8_8_1x1_intrawave_v3,1185.16,729.16,0.0
256,10973,2048,3072,ck,0,0,116.5714,a8w8_blockscale_1x128x128_256x128x128x128_16x16_32x32_2x2_8x32x1_8x32x1_1x32x1x8_8_1x1_intrawave_v3,1184.44,728.7,0.0
256,11008,2048,3072,ck,0,0,114.2722,a8w8_blockscale_1x128x128_256x128x128x128_16x16_32x32_2x2_8x32x1_8x32x1_1x32x1x8_8_1x1_intrawave_v3,1212.13,745.56,0.0
256,11025,2048,3072,ck,0,0,117.0262,a8w8_blockscale_1x128x128_256x128x128x128_16x16_32x32_2x2_8x32x1_8x32x1_1x32x1x8_8_1x1_intrawave_v3,1185.43,729.06,0.0
256,11041,2048,3072,ck,0,0,115.2655,a8w8_blockscale_1x128x128_256x128x128x128_16x16_32x32_2x2_8x32x1_8x32x1_1x32x1x8_8_1x1_intrawave_v3,1205.29,741.19,0.0
256,11061,2048,3072,ck,0,0,117.5073,a8w8_blockscale_1x128x128_256x128x128x128_16x16_32x32_2x2_8x32x1_8x32x1_1x32x1x8_8_1x1_intrawave_v3,1184.43,728.27,0.0
256,11083,2048,3072,ck,0,0,116.7474,a8w8_blockscale_1x128x128_256x128x128x128_16x16_32x32_2x2_8x32x1_8x32x1_1x32x1x8_8_1x1_intrawave_v3,1194.51,734.36,0.0
256,11087,2048,3072,ck,0,0,114.8537,a8w8_blockscale_1x128x128_256x128x128x128_16x16_32x32_2x2_8x32x1_8x32x1_1x32x1x8_8_1x1_intrawave_v3,1214.65,746.72,0.0
256,11112,2048,3072,ck,0,0,117.7556,a8w8_blockscale_1x128x128_256x128x128x128_16x16_32x32_2x2_8x32x1_8x32x1_1x32x1x8_8_1x1_intrawave_v3,1187.39,729.84,0.0
256,11113,2048,3072,ck,0,0,116.1635,a8w8_blockscale_1x128x128_256x128x128x128_16x16_32x32_2x2_8x32x1_8x32x1_1x32x1x8_8_1x1_intrawave_v3,1203.77,739.9,0.0
256,11127,2048,3072,ck,0,0,117.5993,a8w8_blockscale_1x128x128_256x128x128x128_16x16_32x32_2x2_8x32x1_8x32x1_1x32x1x8_8_1x1_intrawave_v3,1190.57,731.72,0.0
256,11136,2048,3072,ck,0,0,116.0728,a8w8_blockscale_1x128x128_256x128x128x128_16x16_32x32_2x2_8x32x1_8x32x1_1x32x1x8_8_1x1_intrawave_v3,1207.2,741.9,0.0
256,11137,2048,3072,ck,0,0,118.4839,a8w8_blockscale_1x128x128_256x128x128x128_16x16_32x32_2x2_8x32x1_8x32x1_1x32x1x8_8_1x1_intrawave_v3,1182.74,726.86,0.0
256,11156,2048,3072,ck,0,0,118.3305,a8w8_blockscale_1x128x128_256x128x128x128_16x16_32x32_2x2_8x32x1_8x32x1_1x32x1x8_8_1x1_intrawave_v3,1186.3,728.96,0.0
256,11162,2048,3072,ck,0,0,118.5837,a8w8_blockscale_1x128x128_256x128x128x128_16x16_32x32_2x2_8x32x1_8x32x1_1x32x1x8_8_1x1_intrawave_v3,1184.4,727.76,0.0
256,11165,2048,3072,ck,0,0,116.8658,a8w8_blockscale_1x128x128_256x128x128x128_16x16_32x32_2x2_8x32x1_8x32x1_1x32x1x8_8_1x1_intrawave_v3,1202.13,738.64,0.0
256,11234,2048,3072,ck,0,0,118.811,a8w8_blockscale_1x128x128_256x128x128x128_16x16_32x32_2x2_8x32x1_8x32x1_1x32x1x8_8_1x1_intrawave_v3,1189.76,730.71,0.0
256,11238,2048,3072,ck,0,0,118.1052,a8w8_blockscale_1x128x128_256x128x128x128_16x16_32x32_2x2_8x32x1_8x32x1_1x32x1x8_8_1x1_intrawave_v3,1197.29,735.32,0.0
256,11264,2048,3072,ck,0,0,117.4091,a8w8_blockscale_1x128x128_256x128x128x128_16x16_32x32_2x2_8x32x1_8x32x1_1x32x1x8_8_1x1_intrawave_v3,1207.18,741.27,0.0
256,11274,2048,3072,ck,0,0,118.7265,a8w8_blockscale_1x128x128_256x128x128x128_16x16_32x32_2x2_8x32x1_8x32x1_1x32x1x8_8_1x1_intrawave_v3,1194.84,733.65,0.0
256,11284,2048,3072,ck,0,0,119.1968,a8w8_blockscale_1x128x128_256x128x128x128_16x16_32x32_2x2_8x32x1_8x32x1_1x32x1x8_8_1x1_intrawave_v3,1191.19,731.35,0.0
256,11296,2048,3072,ck,0,0,118.5072,a8w8_blockscale_1x128x128_256x128x128x128_16x16_32x32_2x2_8x32x1_8x32x1_1x32x1x8_8_1x1_intrawave_v3,1199.39,736.34,0.0
256,11302,2048,3072,ck,0,0,116.5888,a8w8_blockscale_1x128x128_256x128x128x128_16x16_32x32_2x2_8x32x1_8x32x1_1x32x1x8_8_1x1_intrawave_v3,1219.77,748.82,0.0
256,11313,2048,3072,ck,0,0,119.7776,a8w8_blockscale_1x128x128_256x128x128x128_16x16_32x32_2x2_8x32x1_8x32x1_1x32x1x8_8_1x1_intrawave_v3,1188.46,729.54,0.0
256,11322,2048,3072,ck,0,0,118.0046,a8w8_blockscale_1x128x128_256x128x128x128_16x16_32x32_2x2_8x32x1_8x32x1_1x32x1x8_8_1x1_intrawave_v3,1207.27,741.05,0.0
256,11339,2048,3072,ck,0,0,118.9457,a8w8_blockscale_1x128x128_256x128x128x128_16x16_32x32_2x2_8x32x1_8x32x1_1x32x1x8_8_1x1_intrawave_v3,1199.52,736.21,0.0
256,11366,2048,3072,ck,0,0,119.6384,a8w8_blockscale_1x128x128_256x128x128x128_16x16_32x32_2x2_8x32x1_8x32x1_1x32x1x8_8_1x1_intrawave_v3,1195.41,733.57,0.0
256,11391,2048,3072,ck,0,0,120.011,a8w8_blockscale_1x128x128_256x128x128x128_16x16_32x32_2x2_8x32x1_8x32x1_1x32x1x8_8_1x1_intrawave_v3,1194.32,732.78,0.0
256,11392,2048,3072,ck,0,0,117.1152,a8w8_blockscale_1x128x128_256x128x128x128_16x16_32x32_2x2_8x32x1_8x32x1_1x32x1x8_8_1x1_intrawave_v3,1223.96,750.96,0.0
256,11401,2048,3072,ck,0,0,118.7711,a8w8_blockscale_1x128x128_256x128x128x128_16x16_32x32_2x2_8x32x1_8x32x1_1x32x1x8_8_1x1_intrawave_v3,1207.85,741.04,0.0
256,11402,2048,3072,ck,0,0,117.8942,a8w8_blockscale_1x128x128_256x128x128x128_16x16_32x32_2x2_8x32x1_8x32x1_1x32x1x8_8_1x1_intrawave_v3,1216.94,746.61,0.0
256,11407,2048,3072,ck,0,0,117.8697,a8w8_blockscale_1x128x128_256x128x128x128_16x16_32x32_2x2_8x32x1_8x32x1_1x32x1x8_8_1x1_intrawave_v3,1217.73,747.07,0.0
256,11427,2048,3072,ck,0,0,120.0738,a8w8_blockscale_1x128x128_256x128x128x128_16x16_32x32_2x2_8x32x1_8x32x1_1x32x1x8_8_1x1_intrawave_v3,1197.47,734.55,0.0
256,11428,2048,3072,ck,0,0,117.8018,a8w8_blockscale_1x128x128_256x128x128x128_16x16_32x32_2x2_8x32x1_8x32x1_1x32x1x8_8_1x1_intrawave_v3,1220.67,748.78,0.0
256,11430,2048,3072,ck,0,0,118.6854,a8w8_blockscale_1x128x128_256x128x128x128_16x16_32x32_2x2_8x32x1_8x32x1_1x32x1x8_8_1x1_intrawave_v3,1211.8,743.32,0.0
256,11436,2048,3072,ck,0,0,119.0222,a8w8_blockscale_1x128x128_256x128x128x128_16x16_32x32_2x2_8x32x1_8x32x1_1x32x1x8_8_1x1_intrawave_v3,1209.0,741.58,0.0
256,11443,2048,3072,ck,0,0,119.2917,a8w8_blockscale_1x128x128_256x128x128x128_16x16_32x32_2x2_8x32x1_8x32x1_1x32x1x8_8_1x1_intrawave_v3,1207.01,740.33,0.0
256,11444,2048,3072,ck,0,0,118.6783,a8w8_blockscale_1x128x128_256x128x128x128_16x16_32x32_2x2_8x32x1_8x32x1_1x32x1x8_8_1x1_intrawave_v3,1213.35,744.21,0.0
256,11465,2048,3072,ck,0,0,118.506,a8w8_blockscale_1x128x128_256x128x128x128_16x16_32x32_2x2_8x32x1_8x32x1_1x32x1x8_8_1x1_intrawave_v3,1217.35,746.57,0.0
256,11475,2048,3072,ck,0,0,120.2804,a8w8_blockscale_1x128x128_256x128x128x128_16x16_32x32_2x2_8x32x1_8x32x1_1x32x1x8_8_1x1_intrawave_v3,1200.44,736.15,0.0
256,11505,2048,3072,ck,0,0,117.4465,a8w8_blockscale_1x128x128_256x128x128x128_16x16_32x32_2x2_8x32x1_8x32x1_1x32x1x8_8_1x1_intrawave_v3,1232.62,755.74,0.0
256,11509,2048,3072,ck,0,0,120.003,a8w8_blockscale_1x128x128_256x128x128x128_16x16_32x32_2x2_8x32x1_8x32x1_1x32x1x8_8_1x1_intrawave_v3,1206.78,739.88,0.0
256,11520,2048,3072,ck,0,0,119.3877,a8w8_blockscale_1x128x128_256x128x128x128_16x16_32x32_2x2_8x32x1_8x32x1_1x32x1x8_8_1x1_intrawave_v3,1214.15,744.35,0.0
256,11557,2048,3072,ck,0,0,120.9855,a8w8_blockscale_1x128x128_256x128x128x128_16x16_32x32_2x2_8x32x1_8x32x1_1x32x1x8_8_1x1_intrawave_v3,1201.97,736.72,0.0
256,11572,2048,3072,ck,0,0,121.4287,a8w8_blockscale_1x128x128_256x128x128x128_16x16_32x32_2x2_8x32x1_8x32x1_1x32x1x8_8_1x1_intrawave_v3,1199.14,734.91,0.0
256,11593,2048,3072,ck,0,0,120.1821,a8w8_blockscale_1x128x128_256x128x128x128_16x16_32x32_2x2_8x32x1_8x32x1_1x32x1x8_8_1x1_intrawave_v3,1213.77,743.79,0.0
256,11648,2048,3072,ck,0,0,126.482,a8w8_blockscale_1x128x128_256x128x128x128_16x16_32x32_2x2_8x32x1_8x32x1_1x32x1x8_8_1x1_intrawave_v3,1158.79,709.86,0.0
256,11759,2048,3072,ck,0,0,119.7358,a8w8_blockscale_1x128x128_256x128x128x128_16x16_32x32_2x2_8x32x1_8x32x1_1x32x1x8_8_1x1_intrawave_v3,1235.74,756.5,0.0
256,11776,2048,3072,ck,0,0,120.7219,a8w8_blockscale_1x128x128_256x128x128x128_16x16_32x32_2x2_8x32x1_8x32x1_1x32x1x8_8_1x1_intrawave_v3,1227.42,751.33,0.0
256,11873,2048,3072,ck,0,0,120.6672,a8w8_blockscale_1x128x128_256x128x128x128_16x16_32x32_2x2_8x32x1_8x32x1_1x32x1x8_8_1x1_intrawave_v3,1238.09,757.43,0.0
256,11904,2048,3072,ck,0,0,120.092,a8w8_blockscale_1x128x128_256x128x128x128_16x16_32x32_2x2_8x32x1_8x32x1_1x32x1x8_8_1x1_intrawave_v3,1247.27,762.91,0.0
256,12032,2048,3072,ck,0,0,119.3809,a8w8_blockscale_1x128x128_256x128x128x128_16x16_32x32_2x2_8x32x1_8x32x1_1x32x1x8_8_1x1_intrawave_v3,1268.19,775.14,0.0
256,12088,2048,3072,ck,0,0,123.0379,a8w8_blockscale_1x128x128_256x128x128x128_16x16_32x32_2x2_8x32x1_8x32x1_1x32x1x8_8_1x1_intrawave_v3,1236.22,755.36,0.0
256,12160,2048,3072,ck,0,0,122.362,a8w8_blockscale_1x128x128_256x128x128x128_16x16_32x32_2x2_8x32x1_8x32x1_1x32x1x8_8_1x1_intrawave_v3,1250.46,763.75,0.0
256,12250,2048,3072,ck,0,0,123.7643,a8w8_blockscale_1x128x128_256x128x128x128_16x16_32x32_2x2_8x32x1_8x32x1_1x32x1x8_8_1x1_intrawave_v3,1245.44,760.31,0.0
256,12252,2048,3072,ck,0,0,123.3707,a8w8_blockscale_1x128x128_256x128x128x128_16x16_32x32_2x2_8x32x1_8x32x1_1x32x1x8_8_1x1_intrawave_v3,1249.61,762.85,0.0
256,12265,2048,3072,ck,0,0,122.833,a8w8_blockscale_1x128x128_256x128x128x128_16x16_32x32_2x2_8x32x1_8x32x1_1x32x1x8_8_1x1_intrawave_v3,1256.42,766.95,0.0
256,12277,2048,3072,ck,0,0,124.062,a8w8_blockscale_1x128x128_256x128x128x128_16x16_32x32_2x2_8x32x1_8x32x1_1x32x1x8_8_1x1_intrawave_v3,1245.19,760.05,0.0
256,12288,2048,3072,ck,0,0,122.9128,a8w8_blockscale_1x128x128_256x128x128x128_16x16_32x32_2x2_8x32x1_8x32x1_1x32x1x8_8_1x1_intrawave_v3,1257.96,767.8,0.0
256,12389,2048,3072,ck,0,0,131.1535,a8w8_blockscale_1x128x128_256x128x128x128_16x16_32x32_2x2_8x32x1_8x32x1_1x32x1x8_8_1x1_intrawave_v3,1188.6,725.07,0.0
256,12416,2048,3072,ck,0,0,131.6217,a8w8_blockscale_1x128x128_256x128x128x128_16x16_32x32_2x2_8x32x1_8x32x1_1x32x1x8_8_1x1_intrawave_v3,1186.96,723.96,0.0
256,12544,2048,3072,ck,0,0,132.1974,a8w8_blockscale_1x128x128_256x128x128x128_16x16_32x32_2x2_8x32x1_8x32x1_1x32x1x8_8_1x1_intrawave_v3,1193.97,727.75,0.0
256,12599,2048,3072,ck,0,0,131.1723,a8w8_blockscale_1x128x128_256x128x128x128_16x16_32x32_2x2_8x32x1_8x32x1_1x32x1x8_8_1x1_intrawave_v3,1208.58,736.44,0.0
256,12608,2048,3072,ck,0,0,132.3293,a8w8_blockscale_1x128x128_256x128x128x128_16x16_32x32_2x2_8x32x1_8x32x1_1x32x1x8_8_1x1_intrawave_v3,1198.87,730.49,0.0
256,12672,2048,3072,ck,0,0,131.4849,a8w8_blockscale_1x128x128_256x128x128x128_16x16_32x32_2x2_8x32x1_8x32x1_1x32x1x8_8_1x1_intrawave_v3,1212.69,738.67,0.0
256,12693,2048,3072,ck,0,0,133.0822,a8w8_blockscale_1x128x128_256x128x128x128_16x16_32x32_2x2_8x32x1_8x32x1_1x32x1x8_8_1x1_intrawave_v3,1200.12,730.94,0.0
256,12714,2048,3072,ck,0,0,133.0246,a8w8_blockscale_1x128x128_256x128x128x128_16x16_32x32_2x2_8x32x1_8x32x1_1x32x1x8_8_1x1_intrawave_v3,1202.63,732.39,0.0
256,12741,2048,3072,ck,0,0,133.8935,a8w8_blockscale_1x128x128_256x128x128x128_16x16_32x32_2x2_8x32x1_8x32x1_1x32x1x8_8_1x1_intrawave_v3,1197.36,729.08,0.0
256,12798,2048,3072,ck,0,0,133.807,a8w8_blockscale_1x128x128_256x128x128x128_16x16_32x32_2x2_8x32x1_8x32x1_1x32x1x8_8_1x1_intrawave_v3,1203.5,732.6,0.0
256,12800,2048,3072,ck,0,0,132.3089,a8w8_blockscale_1x128x128_256x128x128x128_16x16_32x32_2x2_8x32x1_8x32x1_1x32x1x8_8_1x1_intrawave_v3,1217.31,741.01,0.0
256,12880,2048,3072,ck,0,0,134.8899,a8w8_blockscale_1x128x128_256x128x128x128_16x16_32x32_2x2_8x32x1_8x32x1_1x32x1x8_8_1x1_intrawave_v3,1201.48,731.08,0.0
256,12928,2048,3072,ck,0,0,135.1037,a8w8_blockscale_1x128x128_256x128x128x128_16x16_32x32_2x2_8x32x1_8x32x1_1x32x1x8_8_1x1_intrawave_v3,1204.05,732.47,0.0
256,12980,2048,3072,ck,0,0,134.0269,a8w8_blockscale_1x128x128_256x128x128x128_16x16_32x32_2x2_8x32x1_8x32x1_1x32x1x8_8_1x1_intrawave_v3,1218.61,741.14,0.0
256,13003,2048,3072,ck,0,0,137.2721,a8w8_blockscale_1x128x128_256x128x128x128_16x16_32x32_2x2_8x32x1_8x32x1_1x32x1x8_8_1x1_intrawave_v3,1191.91,724.82,0.0
256,13039,2048,3072,ck,0,0,137.1465,a8w8_blockscale_1x128x128_256x128x128x128_16x16_32x32_2x2_8x32x1_8x32x1_1x32x1x8_8_1x1_intrawave_v3,1196.3,727.36,0.0
256,13056,2048,3072,ck,0,0,132.8497,a8w8_blockscale_1x128x128_256x128x128x128_16x16_32x32_2x2_8x32x1_8x32x1_1x32x1x8_8_1x1_intrawave_v3,1236.6,751.8,0.0
256,13153,2048,3072,ck,0,0,137.4841,a8w8_blockscale_1x128x128_256x128x128x128_16x16_32x32_2x2_8x32x1_8x32x1_1x32x1x8_8_1x1_intrawave_v3,1203.8,731.52,0.0
256,13184,2048,3072,ck,0,0,134.9123,a8w8_blockscale_1x128x128_256x128x128x128_16x16_32x32_2x2_8x32x1_8x32x1_1x32x1x8_8_1x1_intrawave_v3,1229.64,747.11,0.0
256,13294,2048,3072,ck,0,0,134.0603,a8w8_blockscale_1x128x128_256x128x128x128_16x16_32x32_2x2_8x32x1_8x32x1_1x32x1x8_8_1x1_intrawave_v3,1247.78,757.74,0.0
256,13312,2048,3072,ck,0,0,133.5666,a8w8_blockscale_1x128x128_256x128x128x128_16x16_32x32_2x2_8x32x1_8x32x1_1x32x1x8_8_1x1_intrawave_v3,1254.08,761.51,0.0
256,13363,2048,3072,ck,0,0,136.1481,a8w8_blockscale_1x128x128_256x128x128x128_16x16_32x32_2x2_8x32x1_8x32x1_1x32x1x8_8_1x1_intrawave_v3,1235.02,749.75,0.0
256,13440,2048,3072,ck,0,0,135.9923,a8w8_blockscale_1x128x128_256x128x128x128_16x16_32x32_2x2_8x32x1_8x32x1_1x32x1x8_8_1x1_intrawave_v3,1243.56,754.67,0.0
256,13525,2048,3072,ck,0,0,137.5838,a8w8_blockscale_1x128x128_256x128x128x128_16x16_32x32_2x2_8x32x1_8x32x1_1x32x1x8_8_1x1_intrawave_v3,1236.95,750.37,0.0
256,13568,2048,3072,ck,0,0,135.0395,a8w8_blockscale_1x128x128_256x128x128x128_16x16_32x32_2x2_8x32x1_8x32x1_1x32x1x8_8_1x1_intrawave_v3,1264.26,766.79,0.0
256,13696,2048,3072,ck,0,0,136.3744,a8w8_blockscale_1x128x128_256x128x128x128_16x16_32x32_2x2_8x32x1_8x32x1_1x32x1x8_8_1x1_intrawave_v3,1263.69,766.01,0.0
256,13712,2048,3072,ck,0,0,137.8659,a8w8_blockscale_1x128x128_256x128x128x128_16x16_32x32_2x2_8x32x1_8x32x1_1x32x1x8_8_1x1_intrawave_v3,1251.48,758.56,0.0
256,13824,2048,3072,ck,0,0,137.7891,a8w8_blockscale_1x128x128_256x128x128x128_16x16_32x32_2x2_8x32x1_8x32x1_1x32x1x8_8_1x1_intrawave_v3,1262.41,764.81,0.0
256,13836,2048,3072,ck,0,0,141.2021,a8w8_blockscale_1x128x128_256x128x128x128_16x16_32x32_2x2_8x32x1_8x32x1_1x32x1x8_8_1x1_intrawave_v3,1232.96,746.93,0.0
256,13860,2048,3072,ck,0,0,141.5221,a8w8_blockscale_1x128x128_256x128x128x128_16x16_32x32_2x2_8x32x1_8x32x1_1x32x1x8_8_1x1_intrawave_v3,1232.31,746.46,0.0
256,13952,2048,3072,ck,0,0,140.1377,a8w8_blockscale_1x128x128_256x128x128x128_16x16_32x32_2x2_8x32x1_8x32x1_1x32x1x8_8_1x1_intrawave_v3,1252.74,758.54,0.0
256,14080,2048,3072,ck,0,0,141.9084,a8w8_blockscale_1x128x128_256x128x128x128_16x16_32x32_2x2_8x32x1_8x32x1_1x32x1x8_8_1x1_intrawave_v3,1248.46,755.54,0.0
256,14208,2048,3072,ck,0,0,140.6676,a8w8_blockscale_1x128x128_256x128x128x128_16x16_32x32_2x2_8x32x1_8x32x1_1x32x1x8_8_1x1_intrawave_v3,1270.93,768.72,0.0
256,14336,2048,3072,ck,0,0,141.8539,a8w8_blockscale_1x128x128_256x128x128x128_16x16_32x32_2x2_8x32x1_8x32x1_1x32x1x8_8_1x1_intrawave_v3,1271.65,768.76,0.0
256,14464,2048,3072,ck,0,0,146.8634,a8w8_blockscale_1x128x128_256x128x128x128_16x16_32x32_2x2_8x32x1_8x32x1_1x32x1x8_8_1x1_intrawave_v3,1239.24,748.79,0.0
256,14592,2048,3072,ck,0,0,150.6038,a8w8_blockscale_1x128x128_256x128x128x128_16x16_32x32_2x2_8x32x1_8x32x1_1x32x1x8_8_1x1_intrawave_v3,1219.16,736.28,0.0
256,14720,2048,3072,ck,0,0,148.7943,a8w8_blockscale_1x128x128_256x128x128x128_16x16_32x32_2x2_8x32x1_8x32x1_1x32x1x8_8_1x1_intrawave_v3,1244.81,751.4,0.0
256,14848,2048,3072,ck,0,0,148.2831,a8w8_blockscale_1x128x128_256x128x128x128_16x16_32x32_2x2_8x32x1_8x32x1_1x32x1x8_8_1x1_intrawave_v3,1259.96,760.18,0.0
256,14883,2048,3072,ck,0,0,149.3181,a8w8_blockscale_1x128x128_256x128x128x128_16x16_32x32_2x2_8x32x1_8x32x1_1x32x1x8_8_1x1_intrawave_v3,1254.18,756.59,0.0
256,14976,2048,3072,ck,0,0,151.1302,a8w8_blockscale_1x128x128_256x128x128x128_16x16_32x32_2x2_8x32x1_8x32x1_1x32x1x8_8_1x1_intrawave_v3,1246.88,751.93,0.0
256,15048,2048,3072,ck,0,0,152.9629,a8w8_blockscale_1x128x128_256x128x128x128_16x16_32x32_2x2_8x32x1_8x32x1_1x32x1x8_8_1x1_intrawave_v3,1237.87,746.3,0.0
256,15104,2048,3072,ck,0,0,150.2685,a8w8_blockscale_1x128x128_256x128x128x128_16x16_32x32_2x2_8x32x1_8x32x1_1x32x1x8_8_1x1_intrawave_v3,1264.75,762.35,0.0
256,15125,2048,3072,ck,0,0,155.2264,a8w8_blockscale_1x128x128_256x128x128x128_16x16_32x32_2x2_8x32x1_8x32x1_1x32x1x8_8_1x1_intrawave_v3,1226.06,738.97,0.0
256,15215,2048,3072,ck,0,0,153.8731,a8w8_blockscale_1x128x128_256x128x128x128_16x16_32x32_2x2_8x32x1_8x32x1_1x32x1x8_8_1x1_intrawave_v3,1244.2,749.66,0.0
256,15232,2048,3072,ck,0,0,161.6253,a8w8_blockscale_1x128x128_256x128x128x128_16x16_32x32_2x2_8x32x1_8x32x1_1x32x1x8_8_1x1_intrawave_v3,1185.85,714.46,0.0
256,15296,2048,3072,ck,0,0,152.7135,a8w8_blockscale_1x128x128_256x128x128x128_16x16_32x32_2x2_8x32x1_8x32x1_1x32x1x8_8_1x1_intrawave_v3,1260.32,759.15,0.0
256,15360,2048,3072,ck,0,0,150.5011,a8w8_blockscale_1x128x128_256x128x128x128_16x16_32x32_2x2_8x32x1_8x32x1_1x32x1x8_8_1x1_intrawave_v3,1284.2,773.36,0.0
256,15488,2048,3072,ck,0,0,151.0088,a8w8_blockscale_1x128x128_256x128x128x128_16x16_32x32_2x2_8x32x1_8x32x1_1x32x1x8_8_1x1_intrawave_v3,1290.55,776.84,0.0
256,15510,2048,3072,ck,0,0,153.2877,a8w8_blockscale_1x128x128_256x128x128x128_16x16_32x32_2x2_8x32x1_8x32x1_1x32x1x8_8_1x1_intrawave_v3,1273.17,766.32,0.0
256,15597,2048,3072,ck,0,0,155.535,a8w8_blockscale_1x128x128_256x128x128x128_16x16_32x32_2x2_8x32x1_8x32x1_1x32x1x8_8_1x1_intrawave_v3,1261.81,759.26,0.0
256,15605,2048,3072,ck,0,0,155.4731,a8w8_blockscale_1x128x128_256x128x128x128_16x16_32x32_2x2_8x32x1_8x32x1_1x32x1x8_8_1x1_intrawave_v3,1262.96,759.93,0.0
256,15614,2048,3072,ck,0,0,155.0479,a8w8_blockscale_1x128x128_256x128x128x128_16x16_32x32_2x2_8x32x1_8x32x1_1x32x1x8_8_1x1_intrawave_v3,1267.15,762.43,0.0
256,15616,2048,3072,ck,0,0,156.2932,a8w8_blockscale_1x128x128_256x128x128x128_16x16_32x32_2x2_8x32x1_8x32x1_1x32x1x8_8_1x1_intrawave_v3,1257.22,756.44,0.0
256,15617,2048,3072,ck,0,0,156.5874,a8w8_blockscale_1x128x128_256x128x128x128_16x16_32x32_2x2_8x32x1_8x32x1_1x32x1x8_8_1x1_intrawave_v3,1254.94,755.07,0.0
256,15643,2048,3072,ck,0,0,156.6717,a8w8_blockscale_1x128x128_256x128x128x128_16x16_32x32_2x2_8x32x1_8x32x1_1x32x1x8_8_1x1_intrawave_v3,1256.35,755.85,0.0
256,15654,2048,3072,ck,0,0,157.5603,a8w8_blockscale_1x128x128_256x128x128x128_16x16_32x32_2x2_8x32x1_8x32x1_1x32x1x8_8_1x1_intrawave_v3,1250.14,752.09,0.0
256,15681,2048,3072,ck,0,0,158.9029,a8w8_blockscale_1x128x128_256x128x128x128_16x16_32x32_2x2_8x32x1_8x32x1_1x32x1x8_8_1x1_intrawave_v3,1241.72,746.95,0.0
256,15744,2048,3072,ck,0,0,158.8577,a8w8_blockscale_1x128x128_256x128x128x128_16x16_32x32_2x2_8x32x1_8x32x1_1x32x1x8_8_1x1_intrawave_v3,1247.06,750.01,0.0
256,15872,2048,3072,ck,0,0,153.2631,a8w8_blockscale_1x128x128_256x128x128x128_16x16_32x32_2x2_8x32x1_8x32x1_1x32x1x8_8_1x1_intrawave_v3,1303.09,783.37,0.0
256,15905,2048,3072,ck,0,0,158.123,a8w8_blockscale_1x128x128_256x128x128x128_16x16_32x32_2x2_8x32x1_8x32x1_1x32x1x8_8_1x1_intrawave_v3,1265.67,760.79,0.0
256,15997,2048,3072,ck,0,0,159.5369,a8w8_blockscale_1x128x128_256x128x128x128_16x16_32x32_2x2_8x32x1_8x32x1_1x32x1x8_8_1x1_intrawave_v3,1261.71,758.18,0.0
256,16000,2048,3072,ck,0,0,158.5993,a8w8_blockscale_1x128x128_256x128x128x128_16x16_32x32_2x2_8x32x1_8x32x1_1x32x1x8_8_1x1_intrawave_v3,1269.4,762.8,0.0
256,16096,2048,3072,ck,0,0,158.9155,a8w8_blockscale_1x128x128_256x128x128x128_16x16_32x32_2x2_8x32x1_8x32x1_1x32x1x8_8_1x1_intrawave_v3,1274.48,765.61,0.0
256,16128,2048,3072,ck,0,0,157.9894,a8w8_blockscale_1x128x128_256x128x128x128_16x16_32x32_2x2_8x32x1_8x32x1_1x32x1x8_8_1x1_intrawave_v3,1284.5,771.55,0.0
256,16171,2048,3072,ck,0,0,160.5572,a8w8_blockscale_1x128x128_256x128x128x128_16x16_32x32_2x2_8x32x1_8x32x1_1x32x1x8_8_1x1_intrawave_v3,1267.33,761.13,0.0
256,16200,2048,3072,ck,0,0,160.9677,a8w8_blockscale_1x128x128_256x128x128x128_16x16_32x32_2x2_8x32x1_8x32x1_1x32x1x8_8_1x1_intrawave_v3,1266.36,760.48,0.0
256,16214,2048,3072,ck,0,0,159.9608,a8w8_blockscale_1x128x128_256x128x128x128_16x16_32x32_2x2_8x32x1_8x32x1_1x32x1x8_8_1x1_intrawave_v3,1275.43,765.9,0.0
256,16256,2048,3072,ck,0,0,156.7624,a8w8_blockscale_1x128x128_256x128x128x128_16x16_32x32_2x2_8x32x1_8x32x1_1x32x1x8_8_1x1_intrawave_v3,1304.83,783.44,0.0
256,16284,2048,3072,ck,0,0,162.5842,a8w8_blockscale_1x128x128_256x128x128x128_16x16_32x32_2x2_8x32x1_8x32x1_1x32x1x8_8_1x1_intrawave_v3,1260.27,756.62,0.0
256,16333,2048,3072,ck,0,0,159.5243,a8w8_blockscale_1x128x128_256x128x128x128_16x16_32x32_2x2_8x32x1_8x32x1_1x32x1x8_8_1x1_intrawave_v3,1288.31,773.34,0.0
256,16384,2048,3072,ck,0,0,161.0845,a8w8_blockscale_1x128x128_256x128x128x128_16x16_32x32_2x2_8x32x1_8x32x1_1x32x1x8_8_1x1_intrawave_v3,1279.82,768.12,0.0
256,16512,2048,3072,ck,0,0,165.1728,a8w8_blockscale_1x128x128_256x128x128x128_16x16_32x32_2x2_8x32x1_8x32x1_1x32x1x8_8_1x1_intrawave_v3,1257.89,754.66,0.0
256,16640,2048,3072,ck,0,0,165.9696,a8w8_blockscale_1x128x128_256x128x128x128_16x16_32x32_2x2_8x32x1_8x32x1_1x32x1x8_8_1x1_intrawave_v3,1261.55,756.57,0.0
256,16768,2048,3072,ck,0,0,167.1369,a8w8_blockscale_1x128x128_256x128x128x128_16x16_32x32_2x2_8x32x1_8x32x1_1x32x1x8_8_1x1_intrawave_v3,1262.38,756.77,0.0
256,16896,2048,3072,ck,0,0,170.6692,a8w8_blockscale_1x128x128_256x128x128x128_16x16_32x32_2x2_8x32x1_8x32x1_1x32x1x8_8_1x1_intrawave_v3,1245.69,746.48,0.0
256,17024,2048,3072,ck,0,0,167.4678,a8w8_blockscale_1x128x128_256x128x128x128_16x16_32x32_2x2_8x32x1_8x32x1_1x32x1x8_8_1x1_intrawave_v3,1279.12,766.23,0.0
256,17152,2048,3072,ck,0,0,171.1543,a8w8_blockscale_1x128x128_256x128x128x128_16x16_32x32_2x2_8x32x1_8x32x1_1x32x1x8_8_1x1_intrawave_v3,1260.98,755.09,0.0
256,17280,2048,3072,ck,0,0,168.0384,a8w8_blockscale_1x128x128_256x128x128x128_16x16_32x32_2x2_8x32x1_8x32x1_1x32x1x8_8_1x1_intrawave_v3,1293.95,774.55,0.0
256,17408,2048,3072,ck,0,0,172.7104,a8w8_blockscale_1x128x128_256x128x128x128_16x16_32x32_2x2_8x32x1_8x32x1_1x32x1x8_8_1x1_intrawave_v3,1268.27,758.91,0.0
256,17536,2048,3072,ck,0,0,170.7765,a8w8_blockscale_1x128x128_256x128x128x128_16x16_32x32_2x2_8x32x1_8x32x1_1x32x1x8_8_1x1_intrawave_v3,1292.06,772.88,0.0
256,17664,2048,3072,ck,0,0,172.7306,a8w8_blockscale_1x128x128_256x128x128x128_16x16_32x32_2x2_8x32x1_8x32x1_1x32x1x8_8_1x1_intrawave_v3,1286.77,769.45,0.0
256,17792,2048,3072,ck,0,0,173.7185,a8w8_blockscale_1x128x128_256x128x128x128_16x16_32x32_2x2_8x32x1_8x32x1_1x32x1x8_8_1x1_intrawave_v3,1288.72,770.35,0.0
256,17920,2048,3072,ck,0,0,173.8748,a8w8_blockscale_1x128x128_256x128x128x128_16x16_32x32_2x2_8x32x1_8x32x1_1x32x1x8_8_1x1_intrawave_v3,1296.83,774.94,0.0
256,18048,2048,3072,ck,0,0,175.7297,a8w8_blockscale_1x128x128_256x128x128x128_16x16_32x32_2x2_8x32x1_8x32x1_1x32x1x8_8_1x1_intrawave_v3,1292.31,771.98,0.0
256,18176,2048,3072,ck,0,0,179.9647,a8w8_blockscale_1x128x128_256x128x128x128_16x16_32x32_2x2_8x32x1_8x32x1_1x32x1x8_8_1x1_intrawave_v3,1270.84,758.91,0.0
256,18304,2048,3072,ck,0,0,178.3488,a8w8_blockscale_1x128x128_256x128x128x128_16x16_32x32_2x2_8x32x1_8x32x1_1x32x1x8_8_1x1_intrawave_v3,1291.39,770.93,0.0
256,18432,2048,3072,ck,0,0,176.0319,a8w8_blockscale_1x128x128_256x128x128x128_16x16_32x32_2x2_8x32x1_8x32x1_1x32x1x8_8_1x1_intrawave_v3,1317.54,786.29,0.0
256,18560,2048,3072,ck,0,0,180.2393,a8w8_blockscale_1x128x128_256x128x128x128_16x16_32x32_2x2_8x32x1_8x32x1_1x32x1x8_8_1x1_intrawave_v3,1295.72,773.03,0.0
256,18688,2048,3072,ck,0,0,180.1501,a8w8_blockscale_1x128x128_256x128x128x128_16x16_32x32_2x2_8x32x1_8x32x1_1x32x1x8_8_1x1_intrawave_v3,1305.3,778.5,0.0
256,18816,2048,3072,ck,0,0,184.1732,a8w8_blockscale_1x128x128_256x128x128x128_16x16_32x32_2x2_8x32x1_8x32x1_1x32x1x8_8_1x1_intrawave_v3,1285.53,766.48,0.0
256,18944,2048,3072,ck,0,0,182.0645,a8w8_blockscale_1x128x128_256x128x128x128_16x16_32x32_2x2_8x32x1_8x32x1_1x32x1x8_8_1x1_intrawave_v3,1309.27,780.39,0.0
256,19072,2048,3072,ck,0,0,180.8069,a8w8_blockscale_1x128x128_256x128x128x128_16x16_32x32_2x2_8x32x1_8x32x1_1x32x1x8_8_1x1_intrawave_v3,1327.28,790.9,0.0
256,19200,2048,3072,ck,0,0,183.5785,a8w8_blockscale_1x128x128_256x128x128x128_16x16_32x32_2x2_8x32x1_8x32x1_1x32x1x8_8_1x1_intrawave_v3,1316.01,783.95,0.0
256,19328,2048,3072,ck,0,0,184.1308,a8w8_blockscale_1x128x128_256x128x128x128_16x16_32x32_2x2_8x32x1_8x32x1_1x32x1x8_8_1x1_intrawave_v3,1320.81,786.59,0.0
256,19456,2048,3072,ck,0,0,183.3637,a8w8_blockscale_1x128x128_256x128x128x128_16x16_32x32_2x2_8x32x1_8x32x1_1x32x1x8_8_1x1_intrawave_v3,1335.12,794.88,0.0
256,19584,2048,3072,ck,0,0,190.1056,a8w8_blockscale_1x128x128_256x128x128x128_16x16_32x32_2x2_8x32x1_8x32x1_1x32x1x8_8_1x1_intrawave_v3,1296.25,771.52,0.0
256,19712,2048,3072,ck,0,0,186.2965,a8w8_blockscale_1x128x128_256x128x128x128_16x16_32x32_2x2_8x32x1_8x32x1_1x32x1x8_8_1x1_intrawave_v3,1331.4,792.22,0.0
256,19840,2048,3072,ck,0,0,192.2304,a8w8_blockscale_1x128x128_256x128x128x128_16x16_32x32_2x2_8x32x1_8x32x1_1x32x1x8_8_1x1_intrawave_v3,1298.68,772.53,0.0
256,19968,2048,3072,ck,0,0,190.4,a8w8_blockscale_1x128x128_256x128x128x128_16x16_32x32_2x2_8x32x1_8x32x1_1x32x1x8_8_1x1_intrawave_v3,1319.62,784.78,0.0
256,20096,2048,3072,ck,0,0,193.7977,a8w8_blockscale_1x128x128_256x128x128x128_16x16_32x32_2x2_8x32x1_8x32x1_1x32x1x8_8_1x1_intrawave_v3,1304.79,775.76,0.0
256,20224,2048,3072,ck,0,0,189.6848,a8w8_blockscale_1x128x128_256x128x128x128_16x16_32x32_2x2_8x32x1_8x32x1_1x32x1x8_8_1x1_intrawave_v3,1341.58,797.41,0.0
256,20352,2048,3072,ck,0,0,193.7549,a8w8_blockscale_1x128x128_256x128x128x128_16x16_32x32_2x2_8x32x1_8x32x1_1x32x1x8_8_1x1_intrawave_v3,1321.71,785.4,0.0
256,20480,2048,3072,ck,0,0,193.982,a8w8_blockscale_1x128x128_256x128x128x128_16x16_32x32_2x2_8x32x1_8x32x1_1x32x1x8_8_1x1_intrawave_v3,1328.46,789.21,0.0
256,20608,2048,3072,ck,0,0,202.5428,a8w8_blockscale_1x128x128_256x128x128x128_16x16_32x32_2x2_8x32x1_8x32x1_1x32x1x8_8_1x1_intrawave_v3,1280.27,760.38,0.0
256,20736,2048,3072,ck,0,0,215.7328,a8w8_blockscale_1x128x128_256x128x128x128_16x16_32x32_2x2_8x32x1_8x32x1_1x32x1x8_8_1x1_intrawave_v3,1209.46,718.14,0.0
256,20864,2048,3072,ck,0,0,199.0823,a8w8_blockscale_1x128x128_256x128x128x128_16x16_32x32_2x2_8x32x1_8x32x1_1x32x1x8_8_1x1_intrawave_v3,1318.7,782.81,0.0
256,20992,2048,3072,ck,0,0,199.3478,a8w8_blockscale_1x128x128_256x128x128x128_16x16_32x32_2x2_8x32x1_8x32x1_1x32x1x8_8_1x1_intrawave_v3,1325.02,786.37,0.0
256,21120,2048,3072,ck,0,0,204.5146,a8w8_blockscale_1x128x128_256x128x128x128_16x16_32x32_2x2_8x32x1_8x32x1_1x32x1x8_8_1x1_intrawave_v3,1299.42,770.99,0.0
256,21248,2048,3072,ck,0,0,202.2871,a8w8_blockscale_1x128x128_256x128x128x128_16x16_32x32_2x2_8x32x1_8x32x1_1x32x1x8_8_1x1_intrawave_v3,1321.69,784.02,0.0
256,21376,2048,3072,ck,0,0,206.0184,a8w8_blockscale_1x128x128_256x128x128x128_16x16_32x32_2x2_8x32x1_8x32x1_1x32x1x8_8_1x1_intrawave_v3,1305.57,774.27,0.0
256,21504,2048,3072,ck,0,0,202.8245,a8w8_blockscale_1x128x128_256x128x128x128_16x16_32x32_2x2_8x32x1_8x32x1_1x32x1x8_8_1x1_intrawave_v3,1334.07,790.99,0.0
256,21632,2048,3072,ck,0,0,205.9711,a8w8_blockscale_1x128x128_256x128x128x128_16x16_32x32_2x2_8x32x1_8x32x1_1x32x1x8_8_1x1_intrawave_v3,1321.51,783.36,0.0
256,21760,2048,3072,ck,0,0,202.1655,a8w8_blockscale_1x128x128_256x128x128x128_16x16_32x32_2x2_8x32x1_8x32x1_1x32x1x8_8_1x1_intrawave_v3,1354.36,802.65,0.0
256,21888,2048,3072,ck,0,0,208.1786,a8w8_blockscale_1x128x128_256x128x128x128_16x16_32x32_2x2_8x32x1_8x32x1_1x32x1x8_8_1x1_intrawave_v3,1322.97,783.87,0.0
256,22016,2048,3072,ck,0,0,208.0462,a8w8_blockscale_1x128x128_256x128x128x128_16x16_32x32_2x2_8x32x1_8x32x1_1x32x1x8_8_1x1_intrawave_v3,1331.56,788.78,0.0
256,22144,2048,3072,ck,0,0,211.3934,a8w8_blockscale_1x128x128_256x128x128x128_16x16_32x32_2x2_8x32x1_8x32x1_1x32x1x8_8_1x1_intrawave_v3,1318.09,780.63,0.0
256,22272,2048,3072,ck,0,0,210.6334,a8w8_blockscale_1x128x128_256x128x128x128_16x16_32x32_2x2_8x32x1_8x32x1_1x32x1x8_8_1x1_intrawave_v3,1330.49,787.8,0.0
256,22400,2048,3072,ck,0,0,206.846,a8w8_blockscale_1x128x128_256x128x128x128_16x16_32x32_2x2_8x32x1_8x32x1_1x32x1x8_8_1x1_intrawave_v3,1362.64,806.66,0.0
256,22528,2048,3072,ck,0,0,213.1784,a8w8_blockscale_1x128x128_256x128x128x128_16x16_32x32_2x2_8x32x1_8x32x1_1x32x1x8_8_1x1_intrawave_v3,1329.72,787.0,0.0
256,22656,2048,3072,ck,0,0,216.1559,a8w8_blockscale_1x128x128_256x128x128x128_16x16_32x32_2x2_8x32x1_8x32x1_1x32x1x8_8_1x1_intrawave_v3,1318.86,780.41,0.0
256,22784,2048,3072,ck,0,0,215.2015,a8w8_blockscale_1x128x128_256x128x128x128_16x16_32x32_2x2_8x32x1_8x32x1_1x32x1x8_8_1x1_intrawave_v3,1332.19,788.13,0.0
256,22912,2048,3072,ck,0,0,213.362,a8w8_blockscale_1x128x128_256x128x128x128_16x16_32x32_2x2_8x32x1_8x32x1_1x32x1x8_8_1x1_intrawave_v3,1351.22,799.23,0.0
256,23040,2048,3072,ck,0,0,217.5669,a8w8_blockscale_1x128x128_256x128x128x128_16x16_32x32_2x2_8x32x1_8x32x1_1x32x1x8_8_1x1_intrawave_v3,1332.51,788.0,0.0
256,23168,2048,3072,ck,0,0,217.9841,a8w8_blockscale_1x128x128_256x128x128x128_16x16_32x32_2x2_8x32x1_8x32x1_1x32x1x8_8_1x1_intrawave_v3,1337.35,790.7,0.0
256,23296,2048,3072,ck,0,0,217.5767,a8w8_blockscale_1x128x128_256x128x128x128_16x16_32x32_2x2_8x32x1_8x32x1_1x32x1x8_8_1x1_intrawave_v3,1347.26,796.4,0.0
256,23424,2048,3072,ck,0,0,217.7448,a8w8_blockscale_1x128x128_256x128x128x128_16x16_32x32_2x2_8x32x1_8x32x1_1x32x1x8_8_1x1_intrawave_v3,1353.61,799.99,0.0
256,23552,2048,3072,ck,0,0,220.9282,a8w8_blockscale_1x128x128_256x128x128x128_16x16_32x32_2x2_8x32x1_8x32x1_1x32x1x8_8_1x1_intrawave_v3,1341.4,792.62,0.0
256,23680,2048,3072,ck,0,0,220.1462,a8w8_blockscale_1x128x128_256x128x128x128_16x16_32x32_2x2_8x32x1_8x32x1_1x32x1x8_8_1x1_intrawave_v3,1353.48,799.6,0.0
256,23808,2048,3072,ck,0,0,220.5113,a8w8_blockscale_1x128x128_256x128x128x128_16x16_32x32_2x2_8x32x1_8x32x1_1x32x1x8_8_1x1_intrawave_v3,1358.54,802.44,0.0
256,23936,2048,3072,ck,0,0,227.8417,a8w8_blockscale_1x128x128_256x128x128x128_16x16_32x32_2x2_8x32x1_8x32x1_1x32x1x8_8_1x1_intrawave_v3,1321.9,780.65,0.0
256,24064,2048,3072,ck,0,0,223.1161,a8w8_blockscale_1x128x128_256x128x128x128_16x16_32x32_2x2_8x32x1_8x32x1_1x32x1x8_8_1x1_intrawave_v3,1357.12,801.3,0.0
256,24192,2048,3072,ck,0,0,223.4513,a8w8_blockscale_1x128x128_256x128x128x128_16x16_32x32_2x2_8x32x1_8x32x1_1x32x1x8_8_1x1_intrawave_v3,1362.29,804.2,0.0
256,24320,2048,3072,ck,0,0,223.8922,a8w8_blockscale_1x128x128_256x128x128x128_16x16_32x32_2x2_8x32x1_8x32x1_1x32x1x8_8_1x1_intrawave_v3,1366.8,806.72,0.0
256,24448,2048,3072,ck,0,0,224.0578,a8w8_blockscale_1x128x128_256x128x128x128_16x16_32x32_2x2_8x32x1_8x32x1_1x32x1x8_8_1x1_intrawave_v3,1372.98,810.21,0.0
256,24576,2048,3072,ck,0,0,226.1071,a8w8_blockscale_1x128x128_256x128x128x128_16x16_32x32_2x2_8x32x1_8x32x1_1x32x1x8_8_1x1_intrawave_v3,1367.66,806.93,0.0
256,24704,2048,3072,ck,0,0,233.388,a8w8_blockscale_1x128x128_256x128x128x128_16x16_32x32_2x2_8x32x1_8x32x1_1x32x1x8_8_1x1_intrawave_v3,1331.89,785.69,0.0
256,24832,2048,3072,ck,0,0,233.5339,a8w8_blockscale_1x128x128_256x128x128x128_16x16_32x32_2x2_8x32x1_8x32x1_1x32x1x8_8_1x1_intrawave_v3,1337.96,789.12,0.0
256,24960,2048,3072,ck,0,0,232.2609,a8w8_blockscale_1x128x128_256x128x128x128_16x16_32x32_2x2_8x32x1_8x32x1_1x32x1x8_8_1x1_intrawave_v3,1352.23,797.4,0.0
256,25088,2048,3072,ck,0,0,231.7298,a8w8_blockscale_1x128x128_256x128x128x128_16x16_32x32_2x2_8x32x1_8x32x1_1x32x1x8_8_1x1_intrawave_v3,1362.28,803.19,0.0
256,25216,2048,3072,ck,0,0,237.0742,a8w8_blockscale_1x128x128_256x128x128x128_16x16_32x32_2x2_8x32x1_8x32x1_1x32x1x8_8_1x1_intrawave_v3,1338.36,788.95,0.0
256,25344,2048,3072,ck,0,0,237.6362,a8w8_blockscale_1x128x128_256x128x128x128_16x16_32x32_2x2_8x32x1_8x32x1_1x32x1x8_8_1x1_intrawave_v3,1341.97,790.95,0.0
256,25472,2048,3072,ck,0,0,245.8136,a8w8_blockscale_1x128x128_256x128x128x128_16x16_32x32_2x2_8x32x1_8x32x1_1x32x1x8_8_1x1_intrawave_v3,1303.88,768.37,0.0
256,25600,2048,3072,ck,0,0,238.7491,a8w8_blockscale_1x128x128_256x128x128x128_16x16_32x32_2x2_8x32x1_8x32x1_1x32x1x8_8_1x1_intrawave_v3,1349.21,794.94,0.0
256,25728,2048,3072,ck,0,0,237.2053,a8w8_blockscale_1x128x128_256x128x128x128_16x16_32x32_2x2_8x32x1_8x32x1_1x32x1x8_8_1x1_intrawave_v3,1364.78,803.99,0.0
256,25856,2048,3072,ck,0,0,234.4812,a8w8_blockscale_1x128x128_256x128x128x128_16x16_32x32_2x2_8x32x1_8x32x1_1x32x1x8_8_1x1_intrawave_v3,1387.5,817.24,0.0
256,25984,2048,3072,ck,0,0,243.3881,a8w8_blockscale_1x128x128_256x128x128x128_16x16_32x32_2x2_8x32x1_8x32x1_1x32x1x8_8_1x1_intrawave_v3,1343.35,791.1,0.0
256,26112,2048,3072,ck,0,0,245.167,a8w8_blockscale_1x128x128_256x128x128x128_16x16_32x32_2x2_8x32x1_8x32x1_1x32x1x8_8_1x1_intrawave_v3,1340.17,789.1,0.0
256,26240,2048,3072,ck,0,0,243.267,a8w8_blockscale_1x128x128_256x128x128x128_16x16_32x32_2x2_8x32x1_8x32x1_1x32x1x8_8_1x1_intrawave_v3,1357.26,799.04,0.0
256,26368,2048,3072,ck,0,0,244.6696,a8w8_blockscale_1x128x128_256x128x128x128_16x16_32x32_2x2_8x32x1_8x32x1_1x32x1x8_8_1x1_intrawave_v3,1356.06,798.21,0.0
256,26496,2048,3072,ck,0,0,245.656,a8w8_blockscale_1x128x128_256x128x128x128_16x16_32x32_2x2_8x32x1_8x32x1_1x32x1x8_8_1x1_intrawave_v3,1357.17,798.74,0.0
256,26624,2048,3072,ck,0,0,240.3289,a8w8_blockscale_1x128x128_256x128x128x128_16x16_32x32_2x2_8x32x1_8x32x1_1x32x1x8_8_1x1_intrawave_v3,1393.95,820.26,0.0
256,26752,2048,3072,ck,0,0,251.0824,a8w8_blockscale_1x128x128_256x128x128x128_16x16_32x32_2x2_8x32x1_8x32x1_1x32x1x8_8_1x1_intrawave_v3,1340.67,788.78,0.0
256,26880,2048,3072,ck,0,0,245.8839,a8w8_blockscale_1x128x128_256x128x128x128_16x16_32x32_2x2_8x32x1_8x32x1_1x32x1x8_8_1x1_intrawave_v3,1375.56,809.19,0.0
256,27008,2048,3072,ck,0,0,253.7007,a8w8_blockscale_1x128x128_256x128x128x128_16x16_32x32_2x2_8x32x1_8x32x1_1x32x1x8_8_1x1_intrawave_v3,1339.53,787.88,0.0
256,27136,2048,3072,ck,0,0,251.1396,a8w8_blockscale_1x128x128_256x128x128x128_16x16_32x32_2x2_8x32x1_8x32x1_1x32x1x8_8_1x1_intrawave_v3,1359.6,799.56,0.0
256,27264,2048,3072,ck,0,0,254.8526,a8w8_blockscale_1x128x128_256x128x128x128_16x16_32x32_2x2_8x32x1_8x32x1_1x32x1x8_8_1x1_intrawave_v3,1346.11,791.52,0.0
256,27392,2048,3072,ck,0,0,259.0476,a8w8_blockscale_1x128x128_256x128x128x128_16x16_32x32_2x2_8x32x1_8x32x1_1x32x1x8_8_1x1_intrawave_v3,1330.53,782.24,0.0
256,27520,2048,3072,ck,0,0,256.6071,a8w8_blockscale_1x128x128_256x128x128x128_16x16_32x32_2x2_8x32x1_8x32x1_1x32x1x8_8_1x1_intrawave_v3,1349.46,793.25,0.0
256,27648,2048,3072,ck,0,0,254.285,a8w8_blockscale_1x128x128_256x128x128x128_16x16_32x32_2x2_8x32x1_8x32x1_1x32x1x8_8_1x1_intrawave_v3,1368.12,804.11,0.0
256,27776,2048,3072,ck,0,0,255.7516,a8w8_blockscale_1x128x128_256x128x128x128_16x16_32x32_2x2_8x32x1_8x32x1_1x32x1x8_8_1x1_intrawave_v3,1366.57,803.08,0.0
256,27904,2048,3072,ck,0,0,257.7994,a8w8_blockscale_1x128x128_256x128x128x128_16x16_32x32_2x2_8x32x1_8x32x1_1x32x1x8_8_1x1_intrawave_v3,1361.96,800.26,0.0
256,28032,2048,3072,ck,0,0,259.8781,a8w8_blockscale_1x128x128_256x128x128x128_16x16_32x32_2x2_8x32x1_8x32x1_1x32x1x8_8_1x1_intrawave_v3,1357.27,797.39,0.0
256,28160,2048,3072,ck,0,0,255.5975,a8w8_blockscale_1x128x128_256x128x128x128_16x16_32x32_2x2_8x32x1_8x32x1_1x32x1x8_8_1x1_intrawave_v3,1386.3,814.34,0.0
256,28288,2048,3072,ck,0,0,256.3696,a8w8_blockscale_1x128x128_256x128x128x128_16x16_32x32_2x2_8x32x1_8x32x1_1x32x1x8_8_1x1_intrawave_v3,1388.41,815.46,0.0
256,28416,2048,3072,ck,0,0,260.2886,a8w8_blockscale_1x128x128_256x128x128x128_16x16_32x32_2x2_8x32x1_8x32x1_1x32x1x8_8_1x1_intrawave_v3,1373.69,806.71,0.0
256,28544,2048,3072,ck,0,0,260.6758,a8w8_blockscale_1x128x128_256x128x128x128_16x16_32x32_2x2_8x32x1_8x32x1_1x32x1x8_8_1x1_intrawave_v3,1377.83,809.03,0.0
256,28672,2048,3072,ck,0,0,264.5525,a8w8_blockscale_1x128x128_256x128x128x128_16x16_32x32_2x2_8x32x1_8x32x1_1x32x1x8_8_1x1_intrawave_v3,1363.73,800.64,0.0
256,28800,2048,3072,ck,0,0,270.63,a8w8_blockscale_1x128x128_256x128x128x128_16x16_32x32_2x2_8x32x1_8x32x1_1x32x1x8_8_1x1_intrawave_v3,1339.05,786.05,0.0
256,28928,2048,3072,ck,0,0,269.6252,a8w8_blockscale_1x128x128_256x128x128x128_16x16_32x32_2x2_8x32x1_8x32x1_1x32x1x8_8_1x1_intrawave_v3,1350.02,792.39,0.0
256,29056,2048,3072,ck,0,0,270.1627,a8w8_blockscale_1x128x128_256x128x128x128_16x16_32x32_2x2_8x32x1_8x32x1_1x32x1x8_8_1x1_intrawave_v3,1353.29,794.21,0.0
256,29184,2048,3072,ck,0,0,267.1984,a8w8_blockscale_1x128x128_256x128x128x128_16x16_32x32_2x2_8x32x1_8x32x1_1x32x1x8_8_1x1_intrawave_v3,1374.33,806.45,0.0
256,29312,2048,3072,ck,0,0,273.3642,a8w8_blockscale_1x128x128_256x128x128x128_16x16_32x32_2x2_8x32x1_8x32x1_1x32x1x8_8_1x1_intrawave_v3,1349.23,791.62,0.0
256,29440,2048,3072,ck,0,0,268.0163,a8w8_blockscale_1x128x128_256x128x128x128_16x16_32x32_2x2_8x32x1_8x32x1_1x32x1x8_8_1x1_intrawave_v3,1382.16,810.84,0.0
256,29568,2048,3072,ck,0,0,272.303,a8w8_blockscale_1x128x128_256x128x128x128_16x16_32x32_2x2_8x32x1_8x32x1_1x32x1x8_8_1x1_intrawave_v3,1366.31,801.44,0.0
256,29696,2048,3072,ck,0,0,267.1434,a8w8_blockscale_1x128x128_256x128x128x128_16x16_32x32_2x2_8x32x1_8x32x1_1x32x1x8_8_1x1_intrawave_v3,1398.73,820.35,0.0
256,29824,2048,3072,ck,0,0,274.8701,a8w8_blockscale_1x128x128_256x128x128x128_16x16_32x32_2x2_8x32x1_8x32x1_1x32x1x8_8_1x1_intrawave_v3,1365.27,800.63,0.0
256,29952,2048,3072,ck,0,0,269.0358,a8w8_blockscale_1x128x128_256x128x128x128_16x16_32x32_2x2_8x32x1_8x32x1_1x32x1x8_8_1x1_intrawave_v3,1400.87,821.41,0.0
256,30080,2048,3072,ck,0,0,279.592,a8w8_blockscale_1x128x128_256x128x128x128_16x16_32x32_2x2_8x32x1_8x32x1_1x32x1x8_8_1x1_intrawave_v3,1353.74,793.67,0.0
256,30208,2048,3072,ck,0,0,277.4723,a8w8_blockscale_1x128x128_256x128x128x128_16x16_32x32_2x2_8x32x1_8x32x1_1x32x1x8_8_1x1_intrawave_v3,1369.88,803.04,0.0
256,30336,2048,3072,ck,0,0,283.3953,a8w8_blockscale_1x128x128_256x128x128x128_16x16_32x32_2x2_8x32x1_8x32x1_1x32x1x8_8_1x1_intrawave_v3,1346.94,789.5,0.0
256,30464,2048,3072,ck,0,0,280.8952,a8w8_blockscale_1x128x128_256x128x128x128_16x16_32x32_2x2_8x32x1_8x32x1_1x32x1x8_8_1x1_intrawave_v3,1364.66,799.79,0.0
256,30592,2048,3072,ck,0,0,272.307,a8w8_blockscale_1x128x128_256x128x128x128_16x16_32x32_2x2_8x32x1_8x32x1_1x32x1x8_8_1x1_intrawave_v3,1413.61,828.38,0.0
256,30720,2048,3072,ck,0,0,271.2621,a8w8_blockscale_1x128x128_256x128x128x128_16x16_32x32_2x2_8x32x1_8x32x1_1x32x1x8_8_1x1_intrawave_v3,1424.99,834.96,0.0
256,30848,2048,3072,ck,0,0,282.3219,a8w8_blockscale_1x128x128_256x128x128x128_16x16_32x32_2x2_8x32x1_8x32x1_1x32x1x8_8_1x1_intrawave_v3,1374.88,805.5,0.0
256,30976,2048,3072,ck,0,0,283.5401,a8w8_blockscale_1x128x128_256x128x128x128_16x16_32x32_2x2_8x32x1_8x32x1_1x32x1x8_8_1x1_intrawave_v3,1374.65,805.27,0.0
256,31104,2048,3072,ck,0,0,283.7584,a8w8_blockscale_1x128x128_256x128x128x128_16x16_32x32_2x2_8x32x1_8x32x1_1x32x1x8_8_1x1_intrawave_v3,1379.27,807.89,0.0
256,31232,2048,3072,ck,0,0,285.6703,a8w8_blockscale_1x128x128_256x128x128x128_16x16_32x32_2x2_8x32x1_8x32x1_1x32x1x8_8_1x1_intrawave_v3,1375.68,805.69,0.0
256,31360,2048,3072,ck,0,0,285.291,a8w8_blockscale_1x128x128_256x128x128x128_16x16_32x32_2x2_8x32x1_8x32x1_1x32x1x8_8_1x1_intrawave_v3,1383.15,809.98,0.0
256,31488,2048,3072,ck,0,0,288.564,a8w8_blockscale_1x128x128_256x128x128x128_16x16_32x32_2x2_8x32x1_8x32x1_1x32x1x8_8_1x1_intrawave_v3,1373.04,803.97,0.0
256,31616,2048,3072,ck,0,0,289.685,a8w8_blockscale_1x128x128_256x128x128x128_16x16_32x32_2x2_8x32x1_8x32x1_1x32x1x8_8_1x1_intrawave_v3,1373.29,804.03,0.0
256,31744,2048,3072,ck,0,0,284.8343,a8w8_blockscale_1x128x128_256x128x128x128_16x16_32x32_2x2_8x32x1_8x32x1_1x32x1x8_8_1x1_intrawave_v3,1402.33,820.94,0.0
256,31872,2048,3072,ck,0,0,288.7817,a8w8_blockscale_1x128x128_256x128x128x128_16x16_32x32_2x2_8x32x1_8x32x1_1x32x1x8_8_1x1_intrawave_v3,1388.74,812.9,0.0
256,32000,2048,3072,ck,0,0,289.6101,a8w8_blockscale_1x128x128_256x128x128x128_16x16_32x32_2x2_8x32x1_8x32x1_1x32x1x8_8_1x1_intrawave_v3,1390.33,813.74,0.0
256,32128,2048,3072,ck,0,0,294.522,a8w8_blockscale_1x128x128_256x128x128x128_16x16_32x32_2x2_8x32x1_8x32x1_1x32x1x8_8_1x1_intrawave_v3,1372.61,803.28,0.0
256,32256,2048,3072,ck,0,0,291.4642,a8w8_blockscale_1x128x128_256x128x128x128_16x16_32x32_2x2_8x32x1_8x32x1_1x32x1x8_8_1x1_intrawave_v3,1392.54,814.86,0.0
256,32384,2048,3072,ck,0,0,297.0086,a8w8_blockscale_1x128x128_256x128x128x128_16x16_32x32_2x2_8x32x1_8x32x1_1x32x1x8_8_1x1_intrawave_v3,1371.96,802.74,0.0
256,32512,2048,3072,ck,0,0,299.2744,a8w8_blockscale_1x128x128_256x128x128x128_16x16_32x32_2x2_8x32x1_8x32x1_1x32x1x8_8_1x1_intrawave_v3,1366.96,799.73,0.0
256,32640,2048,3072,ck,0,0,296.8127,a8w8_blockscale_1x128x128_256x128x128x128_16x16_32x32_2x2_8x32x1_8x32x1_1x32x1x8_8_1x1_intrawave_v3,1383.72,809.45,0.0
256,32896,2048,3072,ck,0,0,305.5191,a8w8_blockscale_1x128x128_256x128x128x128_16x16_32x32_2x2_8x32x1_8x32x1_1x32x1x8_8_1x1_intrawave_v3,1354.83,792.39,0.0
256,33024,2048,3072,ck,0,0,304.9272,a8w8_blockscale_1x128x128_256x128x128x128_16x16_32x32_2x2_8x32x1_8x32x1_1x32x1x8_8_1x1_intrawave_v3,1362.75,796.94,0.0
256,640,3072,3072,ck,18,0,17.3313,a8w8_blockscale_1x128x128_256x64x64x256_16x16_32x32_1x1_16x16x1_16x16x1_1x32x1x8_8_1x1_intrawave_v1,696.98,884.84,0.0
256,640,3072,6144,ck,18,0,30.365,a8w8_blockscale_1x128x128_256x64x64x256_16x16_32x32_1x1_16x16x1_16x16x1_1x32x1x8_8_1x1_intrawave_v1,795.63,880.58,0.0
256,768,3072,3072,ck,18,0,22.0436,a8w8_blockscale_1x128x128_256x64x64x256_16x16_32x32_1x1_16x16x1_16x16x1_1x32x1x8_8_1x1_intrawave_v1,657.58,749.2,0.0
256,768,3072,6144,ck,18,0,40.0485,a8w8_blockscale_1x128x128_256x64x64x256_16x16_32x32_1x1_16x16x1_16x16x1_1x32x1x8_8_1x1_intrawave_v1,723.9,706.93,0.0
256,896,3072,3072,ck,18,0,22.8257,a8w8_blockscale_1x128x128_256x64x64x256_16x16_32x32_1x1_16x16x1_16x16x1_1x32x1x8_8_1x1_intrawave_v1,740.89,775.21,0.0
256,896,3072,6144,ck,18,0,42.0875,a8w8_blockscale_1x128x128_256x64x64x256_16x16_32x32_1x1_16x16x1_16x16x1_1x32x1x8_8_1x1_intrawave_v1,803.63,710.05,0.0
256,1004,3072,6144,ck,18,0,44.3599,a8w8_blockscale_1x128x128_256x64x64x256_16x16_32x32_1x1_16x16x1_16x16x1_1x32x1x8_8_1x1_intrawave_v1,854.37,703.6,0.0
256,1024,3072,6144,ck,18,0,45.0999,a8w8_blockscale_1x128x128_256x64x64x256_16x16_32x32_1x1_16x16x1_16x16x1_1x32x1x8_8_1x1_intrawave_v1,857.09,697.5,0.0
256,1028,3072,6144,ck,0,0,46.3788,a8w8_blockscale_1x128x128_256x128x128x128_16x16_32x32_2x2_8x32x1_8x32x1_1x32x1x8_8_1x1_intrawave_v3,836.71,679.33,0.0
256,1029,3072,6144,ck,0,0,46.1059,a8w8_blockscale_1x128x128_256x128x128x128_16x16_32x32_2x2_8x32x1_8x32x1_1x32x1x8_8_1x1_intrawave_v3,842.48,683.62,0.0
256,1034,3072,6144,ck,0,0,46.1366,a8w8_blockscale_1x128x128_256x128x128x128_16x16_32x32_2x2_8x32x1_8x32x1_1x32x1x8_8_1x1_intrawave_v3,846.01,684.49,0.0
256,1037,3072,3072,ck,0,0,26.1974,a8w8_blockscale_1x128x128_256x128x128x128_16x16_32x32_2x2_8x32x1_8x32x1_1x32x1x8_8_1x1_intrawave_v3,747.12,725.04,0.0
256,1059,3072,6144,ck,0,0,46.3406,a8w8_blockscale_1x128x128_256x128x128x128_16x16_32x32_2x2_8x32x1_8x32x1_1x32x1x8_8_1x1_intrawave_v3,862.65,688.11,0.0
256,1062,3072,3072,ck,0,0,26.5598,a8w8_blockscale_1x128x128_256x128x128x128_16x16_32x32_2x2_8x32x1_8x32x1_1x32x1x8_8_1x1_intrawave_v3,754.7,723.82,0.0
256,1070,3072,3072,ck,0,0,26.4578,a8w8_blockscale_1x128x128_256x128x128x128_16x16_32x32_2x2_8x32x1_8x32x1_1x32x1x8_8_1x1_intrawave_v3,763.31,729.4,0.0
256,1090,3072,6144,ck,0,0,46.5107,a8w8_blockscale_1x128x128_256x128x128x128_16x16_32x32_2x2_8x32x1_8x32x1_1x32x1x8_8_1x1_intrawave_v3,884.66,693.78,0.0
256,1108,3072,6144,ck,0,0,46.94,a8w8_blockscale_1x128x128_256x128x128x128_16x16_32x32_2x2_8x32x1_8x32x1_1x32x1x8_8_1x1_intrawave_v3,891.04,692.15,0.0
256,1123,3072,3072,ck,0,0,26.9393,a8w8_blockscale_1x128x128_256x128x128x128_16x16_32x32_2x2_8x32x1_8x32x1_1x32x1x8_8_1x1_intrawave_v3,786.8,734.49,0.0
256,1152,3072,3072,ck,0,0,26.8657,a8w8_blockscale_1x128x128_256x128x128x128_16x16_32x32_2x2_8x32x1_8x32x1_1x32x1x8_8_1x1_intrawave_v3,809.33,746.45,0.0
256,1152,3072,6144,ck,0,0,46.8211,a8w8_blockscale_1x128x128_256x128x128x128_16x16_32x32_2x2_8x32x1_8x32x1_1x32x1x8_8_1x1_intrawave_v3,928.78,705.45,0.0
256,1255,3072,3072,ck,0,0,27.2793,a8w8_blockscale_1x128x128_256x128x128x128_16x16_32x32_2x2_8x32x1_8x32x1_1x32x1x8_8_1x1_intrawave_v3,868.33,769.93,0.0
256,1280,3072,3072,ck,0,0,27.3526,a8w8_blockscale_1x128x128_256x128x128x128_16x16_32x32_2x2_8x32x1_8x32x1_1x32x1x8_8_1x1_intrawave_v3,883.25,776.29,0.0
256,1280,3072,6144,ck,0,0,47.622,a8w8_blockscale_1x128x128_256x128x128x128_16x16_32x32_2x2_8x32x1_8x32x1_1x32x1x8_8_1x1_intrawave_v3,1014.62,726.62,0.0
256,1408,3072,3072,ck,18,0,34.2208,a8w8_blockscale_1x128x128_256x64x64x256_16x16_32x32_1x1_16x16x1_16x16x1_1x32x1x8_8_1x1_intrawave_v1,776.58,654.96,0.0
256,1408,3072,6144,ck,18,0,63.8137,a8w8_blockscale_1x128x128_256x64x64x256_16x16_32x32_1x1_16x16x1_16x16x1_1x32x1x8_8_1x1_intrawave_v1,832.9,566.9,0.0
256,1419,3072,6144,ck,18,0,66.3665,a8w8_blockscale_1x128x128_256x64x64x256_16x16_32x32_1x1_16x16x1_16x16x1_1x32x1x8_8_1x1_intrawave_v1,807.12,547.13,0.0
256,1501,3072,3072,ck,18,0,36.0039,a8w8_blockscale_1x128x128_256x64x64x256_16x16_32x32_1x1_16x16x1_16x16x1_1x32x1x8_8_1x1_intrawave_v1,786.87,646.33,0.0
256,1536,3072,3072,ck,18,0,35.5335,a8w8_blockscale_1x128x128_256x64x64x256_16x16_32x32_1x1_16x16x1_16x16x1_1x32x1x8_8_1x1_intrawave_v1,815.88,663.96,0.0
256,1536,3072,6144,ck,18,0,66.6154,a8w8_blockscale_1x128x128_256x64x64x256_16x16_32x32_1x1_16x16x1_16x16x1_1x32x1x8_8_1x1_intrawave_v1,870.4,566.67,0.0
256,1664,3072,3072,ck,18,0,35.9968,a8w8_blockscale_1x128x128_256x64x64x256_16x16_32x32_1x1_16x16x1_16x16x1_1x32x1x8_8_1x1_intrawave_v1,872.49,688.19,0.0
256,1664,3072,6144,ck,18,0,68.7941,a8w8_blockscale_1x128x128_256x64x64x256_16x16_32x32_1x1_16x16x1_16x16x1_1x32x1x8_8_1x1_intrawave_v1,913.07,571.58,0.0
256,1792,3072,3072,ck,0,0,38.7846,a8w8_blockscale_1x128x128_256x128x128x128_16x16_32x32_2x2_8x32x1_8x32x1_1x32x1x8_8_1x1_intrawave_v3,872.07,669.14,0.0
256,1792,3072,6144,ck,0,0,68.831,a8w8_blockscale_1x128x128_256x128x128x128_16x16_32x32_2x2_8x32x1_8x32x1_1x32x1x8_8_1x1_intrawave_v3,982.78,594.13,0.0
256,1920,3072,6144,ck,0,0,75.2543,a8w8_blockscale_1x128x128_256x128x128x128_16x16_32x32_2x2_8x32x1_8x32x1_1x32x1x8_8_1x1_intrawave_v3,963.1,564.32,0.0
256,2002,3072,3072,ck,0,0,41.6544,a8w8_blockscale_1x128x128_256x128x128x128_16x16_32x32_2x2_8x32x1_8x32x1_1x32x1x8_8_1x1_intrawave_v3,907.14,669.5,0.0
256,2005,3072,3072,ck,0,0,41.6421,a8w8_blockscale_1x128x128_256x128x128x128_16x16_32x32_2x2_8x32x1_8x32x1_1x32x1x8_8_1x1_intrawave_v3,908.77,670.36,0.0
256,2013,3072,3072,ck,0,0,41.5405,a8w8_blockscale_1x128x128_256x128x128x128_16x16_32x32_2x2_8x32x1_8x32x1_1x32x1x8_8_1x1_intrawave_v3,914.63,673.78,0.0
256,2014,3072,3072,ck,0,0,41.5713,a8w8_blockscale_1x128x128_256x128x128x128_16x16_32x32_2x2_8x32x1_8x32x1_1x32x1x8_8_1x1_intrawave_v3,914.4,673.5,0.0
256,2024,3072,3072,ck,0,0,41.7173,a8w8_blockscale_1x128x128_256x128x128x128_16x16_32x32_2x2_8x32x1_8x32x1_1x32x1x8_8_1x1_intrawave_v3,915.73,673.35,0.0
256,2028,3072,3072,ck,0,0,41.7262,a8w8_blockscale_1x128x128_256x128x128x128_16x16_32x32_2x2_8x32x1_8x32x1_1x32x1x8_8_1x1_intrawave_v3,917.34,674.09,0.0
256,2030,3072,3072,ck,0,0,41.3377,a8w8_blockscale_1x128x128_256x128x128x128_16x16_32x32_2x2_8x32x1_8x32x1_1x32x1x8_8_1x1_intrawave_v3,926.88,680.87,0.0
256,2037,3072,6144,ck,0,0,75.3532,a8w8_blockscale_1x128x128_256x128x128x128_16x16_32x32_2x2_8x32x1_8x32x1_1x32x1x8_8_1x1_intrawave_v3,1020.45,582.66,0.0
256,2048,3072,3072,ck,0,0,41.34,a8w8_blockscale_1x128x128_256x128x128x128_16x16_32x32_2x2_8x32x1_8x32x1_1x32x1x8_8_1x1_intrawave_v3,935.04,684.85,0.0
256,2048,3072,6144,ck,0,0,74.4781,a8w8_blockscale_1x128x128_256x128x128x128_16x16_32x32_2x2_8x32x1_8x32x1_1x32x1x8_8_1x1_intrawave_v3,1038.02,591.32,0.0
256,2057,3072,3072,ck,0,0,41.8165,a8w8_blockscale_1x128x128_256x128x128x128_16x16_32x32_2x2_8x32x1_8x32x1_1x32x1x8_8_1x1_intrawave_v3,928.45,679.03,0.0
256,2059,3072,3072,ck,0,0,41.9371,a8w8_blockscale_1x128x128_256x128x128x128_16x16_32x32_2x2_8x32x1_8x32x1_1x32x1x8_8_1x1_intrawave_v3,926.68,677.51,0.0
256,2176,3072,3072,ck,0,0,42.7132,a8w8_blockscale_1x128x128_256x128x128x128_16x16_32x32_2x2_8x32x1_8x32x1_1x32x1x8_8_1x1_intrawave_v3,961.54,690.45,0.0
256,2176,3072,6144,ck,0,0,76.9461,a8w8_blockscale_1x128x128_256x128x128x128_16x16_32x32_2x2_8x32x1_8x32x1_1x32x1x8_8_1x1_intrawave_v3,1067.52,592.79,0.0
256,2272,3072,3072,ck,0,0,42.8343,a8w8_blockscale_1x128x128_256x128x128x128_16x16_32x32_2x2_8x32x1_8x32x1_1x32x1x8_8_1x1_intrawave_v3,1001.13,709.15,0.0
256,2304,3072,3072,ck,0,0,42.4732,a8w8_blockscale_1x128x128_256x128x128x128_16x16_32x32_2x2_8x32x1_8x32x1_1x32x1x8_8_1x1_intrawave_v3,1023.86,722.12,0.0
256,2304,3072,6144,ck,0,0,77.2853,a8w8_blockscale_1x128x128_256x128x128x128_16x16_32x32_2x2_8x32x1_8x32x1_1x32x1x8_8_1x1_intrawave_v3,1125.35,610.54,0.0
256,2432,3072,3072,ck,0,0,43.7539,a8w8_blockscale_1x128x128_256x128x128x128_16x16_32x32_2x2_8x32x1_8x32x1_1x32x1x8_8_1x1_intrawave_v3,1049.11,727.95,0.0
256,2432,3072,6144,ck,0,0,79.1942,a8w8_blockscale_1x128x128_256x128x128x128_16x16_32x32_2x2_8x32x1_8x32x1_1x32x1x8_8_1x1_intrawave_v3,1159.24,615.69,0.0
256,2446,3072,3072,ck,0,0,43.0876,a8w8_blockscale_1x128x128_256x128x128x128_16x16_32x32_2x2_8x32x1_8x32x1_1x32x1x8_8_1x1_intrawave_v3,1071.46,742.2,0.0
256,2472,3072,3072,ck,0,0,43.9802,a8w8_blockscale_1x128x128_256x128x128x128_16x16_32x32_2x2_8x32x1_8x32x1_1x32x1x8_8_1x1_intrawave_v3,1060.87,732.58,0.0
256,2546,3072,6144,ck,0,0,81.5502,a8w8_blockscale_1x128x128_256x128x128x128_16x16_32x32_2x2_8x32x1_8x32x1_1x32x1x8_8_1x1_intrawave_v3,1178.52,615.08,0.0
256,2550,3072,3072,ck,0,0,43.3792,a8w8_blockscale_1x128x128_256x128x128x128_16x16_32x32_2x2_8x32x1_8x32x1_1x32x1x8_8_1x1_intrawave_v3,1109.51,759.3,0.0
256,2560,3072,3072,ck,0,0,44.009,a8w8_blockscale_1x128x128_256x128x128x128_16x16_32x32_2x2_8x32x1_8x32x1_1x32x1x8_8_1x1_intrawave_v3,1097.92,750.53,0.0
256,2560,3072,6144,ck,0,0,79.9718,a8w8_blockscale_1x128x128_256x128x128x128_16x16_32x32_2x2_8x32x1_8x32x1_1x32x1x8_8_1x1_intrawave_v3,1208.39,629.37,0.0
256,2661,3072,6144,ck,0,0,83.8378,a8w8_blockscale_1x128x128_256x128x128x128_16x16_32x32_2x2_8x32x1_8x32x1_1x32x1x8_8_1x1_intrawave_v3,1198.14,615.15,0.0
256,2688,3072,3072,ck,0,0,44.5736,a8w8_blockscale_1x128x128_256x128x128x128_16x16_32x32_2x2_8x32x1_8x32x1_1x32x1x8_8_1x1_intrawave_v3,1138.21,767.49,0.0
256,2688,3072,6144,ck,0,0,82.8248,a8w8_blockscale_1x128x128_256x128x128x128_16x16_32x32_2x2_8x32x1_8x32x1_1x32x1x8_8_1x1_intrawave_v3,1225.1,626.68,0.0
256,2804,3072,6144,ck,0,0,111.3303,a8w8_blockscale_1x128x128_256x128x128x128_16x16_32x32_2x2_8x32x1_8x32x1_1x32x1x8_8_1x1_intrawave_v3,950.75,479.02,0.0
256,2816,3072,3072,ck,18,0,59.7069,a8w8_blockscale_1x128x128_256x64x64x256_16x16_32x32_1x1_16x16x1_16x16x1_1x32x1x8_8_1x1_intrawave_v1,890.19,592.72,0.0
256,2816,3072,6144,ck,0,0,108.727,a8w8_blockscale_1x128x128_256x128x128x128_16x16_32x32_2x2_8x32x1_8x32x1_1x32x1x8_8_1x1_intrawave_v3,977.68,491.85,0.0
256,2820,3072,6144,ck,0,0,111.6934,a8w8_blockscale_1x128x128_256x128x128x128_16x16_32x32_2x2_8x32x1_8x32x1_1x32x1x8_8_1x1_intrawave_v3,953.07,479.23,0.0
256,2944,3072,3072,ck,0,0,59.8929,a8w8_blockscale_1x128x128_256x128x128x128_16x16_32x32_2x2_8x32x1_8x32x1_1x32x1x8_8_1x1_intrawave_v3,927.76,610.57,0.0
256,2944,3072,6144,ck,0,0,109.7414,a8w8_blockscale_1x128x128_256x128x128x128_16x16_32x32_2x2_8x32x1_8x32x1_1x32x1x8_8_1x1_intrawave_v3,1012.67,501.64,0.0
256,3002,3072,3072,ck,0,0,60.4978,a8w8_blockscale_1x128x128_256x128x128x128_16x16_32x32_2x2_8x32x1_8x32x1_1x32x1x8_8_1x1_intrawave_v3,936.58,613.31,0.0
256,3003,3072,3072,ck,0,0,59.6882,a8w8_blockscale_1x128x128_256x128x128x128_16x16_32x32_2x2_8x32x1_8x32x1_1x32x1x8_8_1x1_intrawave_v3,949.6,621.78,0.0
256,3008,3072,3072,ck,0,0,60.4063,a8w8_blockscale_1x128x128_256x128x128x128_16x16_32x32_2x2_8x32x1_8x32x1_1x32x1x8_8_1x1_intrawave_v3,939.87,615.15,0.0
256,3028,3072,6144,ck,0,0,110.6774,a8w8_blockscale_1x128x128_256x128x128x128_16x16_32x32_2x2_8x32x1_8x32x1_1x32x1x8_8_1x1_intrawave_v3,1032.76,506.72,0.0
256,3029,3072,3072,ck,0,0,60.6733,a8w8_blockscale_1x128x128_256x128x128x128_16x16_32x32_2x2_8x32x1_8x32x1_1x32x1x8_8_1x1_intrawave_v3,942.27,615.63,0.0
256,3072,3072,3072,ck,0,0,60.4559,a8w8_blockscale_1x128x128_256x128x128x128_16x16_32x32_2x2_8x32x1_8x32x1_1x32x1x8_8_1x1_intrawave_v3,959.08,624.4,0.0
256,3072,3072,6144,ck,0,0,109.3382,a8w8_blockscale_1x128x128_256x128x128x128_16x16_32x32_2x2_8x32x1_8x32x1_1x32x1x8_8_1x1_intrawave_v3,1060.6,517.87,0.0
256,3109,3072,3072,ck,0,0,60.7153,a8w8_blockscale_1x128x128_256x128x128x128_16x16_32x32_2x2_8x32x1_8x32x1_1x32x1x8_8_1x1_intrawave_v3,966.48,627.35,0.0
256,3158,3072,3072,ck,0,0,60.4763,a8w8_blockscale_1x128x128_256x128x128x128_16x16_32x32_2x2_8x32x1_8x32x1_1x32x1x8_8_1x1_intrawave_v3,985.6,637.3,0.0
256,3200,3072,3072,ck,0,0,60.0779,a8w8_blockscale_1x128x128_256x128x128x128_16x16_32x32_2x2_8x32x1_8x32x1_1x32x1x8_8_1x1_intrawave_v3,1005.33,647.97,0.0
256,3200,3072,6144,ck,0,0,110.12,a8w8_blockscale_1x128x128_256x128x128x128_16x16_32x32_2x2_8x32x1_8x32x1_1x32x1x8_8_1x1_intrawave_v3,1096.95,528.48,0.0
256,3328,3072,3072,ck,0,0,61.6765,a8w8_blockscale_1x128x128_256x128x128x128_16x16_32x32_2x2_8x32x1_8x32x1_1x32x1x8_8_1x1_intrawave_v3,1018.44,650.3,0.0
256,3328,3072,6144,ck,0,0,112.2664,a8w8_blockscale_1x128x128_256x128x128x128_16x16_32x32_2x2_8x32x1_8x32x1_1x32x1x8_8_1x1_intrawave_v3,1119.02,532.38,0.0
256,3372,3072,3072,ck,0,0,62.0249,a8w8_blockscale_1x128x128_256x128x128x128_16x16_32x32_2x2_8x32x1_8x32x1_1x32x1x8_8_1x1_intrawave_v3,1026.11,653.18,0.0
256,3444,3072,3072,ck,0,0,62.3148,a8w8_blockscale_1x128x128_256x128x128x128_16x16_32x32_2x2_8x32x1_8x32x1_1x32x1x8_8_1x1_intrawave_v3,1043.14,660.79,0.0
256,3445,3072,3072,ck,0,0,62.3616,a8w8_blockscale_1x128x128_256x128x128x128_16x16_32x32_2x2_8x32x1_8x32x1_1x32x1x8_8_1x1_intrawave_v3,1042.66,660.44,0.0
256,3456,3072,3072,ck,0,0,61.9561,a8w8_blockscale_1x128x128_256x128x128x128_16x16_32x32_2x2_8x32x1_8x32x1_1x32x1x8_8_1x1_intrawave_v3,1052.84,666.4,0.0
256,3584,3072,3072,ck,0,0,62.8812,a8w8_blockscale_1x128x128_256x128x128x128_16x16_32x32_2x2_8x32x1_8x32x1_1x32x1x8_8_1x1_intrawave_v3,1075.77,675.36,0.0
256,3584,3072,6144,ck,0,0,114.8392,a8w8_blockscale_1x128x128_256x128x128x128_16x16_32x32_2x2_8x32x1_8x32x1_1x32x1x8_8_1x1_intrawave_v3,1178.09,547.85,0.0
256,3712,3072,3072,ck,0,0,63.8642,a8w8_blockscale_1x128x128_256x128x128x128_16x16_32x32_2x2_8x32x1_8x32x1_1x32x1x8_8_1x1_intrawave_v3,1097.04,683.43,0.0
256,3712,3072,6144,ck,0,0,117.1667,a8w8_blockscale_1x128x128_256x128x128x128_16x16_32x32_2x2_8x32x1_8x32x1_1x32x1x8_8_1x1_intrawave_v3,1195.93,550.39,0.0
256,3840,3072,3072,ck,0,0,65.2142,a8w8_blockscale_1x128x128_256x128x128x128_16x16_32x32_2x2_8x32x1_8x32x1_1x32x1x8_8_1x1_intrawave_v3,1111.38,687.38,0.0
256,3840,3072,6144,ck,0,0,118.2673,a8w8_blockscale_1x128x128_256x128x128x128_16x16_32x32_2x2_8x32x1_8x32x1_1x32x1x8_8_1x1_intrawave_v3,1225.66,558.57,0.0
256,3968,3072,3072,ck,0,0,65.392,a8w8_blockscale_1x128x128_256x128x128x128_16x16_32x32_2x2_8x32x1_8x32x1_1x32x1x8_8_1x1_intrawave_v3,1145.3,703.55,0.0
256,3968,3072,6144,ck,0,0,127.1202,a8w8_blockscale_1x128x128_256x128x128x128_16x16_32x32_2x2_8x32x1_8x32x1_1x32x1x8_8_1x1_intrawave_v3,1178.31,532.04,0.0
256,4092,3072,3072,ck,0,0,66.8102,a8w8_blockscale_1x128x128_256x128x128x128_16x16_32x32_2x2_8x32x1_8x32x1_1x32x1x8_8_1x1_intrawave_v3,1156.02,705.72,0.0
256,4096,3072,3072,ck,0,0,67.0128,a8w8_blockscale_1x128x128_256x128x128x128_16x16_32x32_2x2_8x32x1_8x32x1_1x32x1x8_8_1x1_intrawave_v3,1153.65,704.13,0.0
256,4096,3072,6144,ck,0,0,126.5941,a8w8_blockscale_1x128x128_256x128x128x128_16x16_32x32_2x2_8x32x1_8x32x1_1x32x1x8_8_1x1_intrawave_v3,1221.37,546.68,0.0
256,4207,3072,3072,ck,0,0,75.6991,a8w8_blockscale_1x128x128_256x128x128x128_16x16_32x32_2x2_8x32x1_8x32x1_1x32x1x8_8_1x1_intrawave_v3,1048.95,636.85,0.0
256,4224,3072,3072,ck,0,0,76.4034,a8w8_blockscale_1x128x128_256x128x128x128_16x16_32x32_2x2_8x32x1_8x32x1_1x32x1x8_8_1x1_intrawave_v3,1043.48,633.03,0.0
256,4224,3072,6144,ck,0,0,140.1515,a8w8_blockscale_1x128x128_256x128x128x128_16x16_32x32_2x2_8x32x1_8x32x1_1x32x1x8_8_1x1_intrawave_v3,1137.7,505.02,0.0
256,4241,3072,3072,ck,0,0,75.8757,a8w8_blockscale_1x128x128_256x128x128x128_16x16_32x32_2x2_8x32x1_8x32x1_1x32x1x8_8_1x1_intrawave_v3,1054.96,639.5,0.0
256,4245,3072,3072,ck,0,0,75.9545,a8w8_blockscale_1x128x128_256x128x128x128_16x16_32x32_2x2_8x32x1_8x32x1_1x32x1x8_8_1x1_intrawave_v3,1054.86,639.32,0.0
256,4352,3072,3072,ck,0,0,76.3059,a8w8_blockscale_1x128x128_256x128x128x128_16x16_32x32_2x2_8x32x1_8x32x1_1x32x1x8_8_1x1_intrawave_v3,1076.47,649.3,0.0
256,4352,3072,6144,ck,0,0,138.6771,a8w8_blockscale_1x128x128_256x128x128x128_16x16_32x32_2x2_8x32x1_8x32x1_1x32x1x8_8_1x1_intrawave_v3,1184.64,521.73,0.0
256,4480,3072,3072,ck,0,0,77.617,a8w8_blockscale_1x128x128_256x128x128x128_16x16_32x32_2x2_8x32x1_8x32x1_1x32x1x8_8_1x1_intrawave_v3,1089.42,653.53,0.0
256,4480,3072,6144,ck,0,0,142.5375,a8w8_blockscale_1x128x128_256x128x128x128_16x16_32x32_2x2_8x32x1_8x32x1_1x32x1x8_8_1x1_intrawave_v3,1186.46,518.63,0.0
256,4499,3072,3072,ck,0,0,78.7871,a8w8_blockscale_1x128x128_256x128x128x128_16x16_32x32_2x2_8x32x1_8x32x1_1x32x1x8_8_1x1_intrawave_v3,1077.79,646.04,0.0
256,4504,3072,3072,ck,0,0,78.4863,a8w8_blockscale_1x128x128_256x128x128x128_16x16_32x32_2x2_8x32x1_8x32x1_1x32x1x8_8_1x1_intrawave_v3,1083.12,649.11,0.0
256,4608,3072,3072,ck,0,0,77.3658,a8w8_blockscale_1x128x128_256x128x128x128_16x16_32x32_2x2_8x32x1_8x32x1_1x32x1x8_8_1x1_intrawave_v3,1124.18,670.9,0.0
256,4608,3072,6144,ck,0,0,143.3815,a8w8_blockscale_1x128x128_256x128x128x128_16x16_32x32_2x2_8x32x1_8x32x1_1x32x1x8_8_1x1_intrawave_v3,1213.17,526.55,0.0
256,4736,3072,3072,ck,0,0,79.9344,a8w8_blockscale_1x128x128_256x128x128x128_16x16_32x32_2x2_8x32x1_8x32x1_1x32x1x8_8_1x1_intrawave_v3,1118.28,664.1,0.0
256,4736,3072,6144,ck,0,0,145.1673,a8w8_blockscale_1x128x128_256x128x128x128_16x16_32x32_2x2_8x32x1_8x32x1_1x32x1x8_8_1x1_intrawave_v3,1231.53,530.91,0.0
256,4864,3072,3072,ck,0,0,80.6737,a8w8_blockscale_1x128x128_256x128x128x128_16x16_32x32_2x2_8x32x1_8x32x1_1x32x1x8_8_1x1_intrawave_v3,1137.98,672.63,0.0
256,4864,3072,6144,ck,0,0,146.1368,a8w8_blockscale_1x128x128_256x128x128x128_16x16_32x32_2x2_8x32x1_8x32x1_1x32x1x8_8_1x1_intrawave_v3,1256.42,538.15,0.0
256,4915,3072,3072,ck,0,0,81.2003,a8w8_blockscale_1x128x128_256x128x128x128_16x16_32x32_2x2_8x32x1_8x32x1_1x32x1x8_8_1x1_intrawave_v3,1142.45,674.06,0.0
256,4929,3072,3072,ck,0,0,80.811,a8w8_blockscale_1x128x128_256x128x128x128_16x16_32x32_2x2_8x32x1_8x32x1_1x32x1x8_8_1x1_intrawave_v3,1151.23,678.9,0.0
256,4992,3072,3072,ck,0,0,81.2469,a8w8_blockscale_1x128x128_256x128x128x128_16x16_32x32_2x2_8x32x1_8x32x1_1x32x1x8_8_1x1_intrawave_v3,1159.69,682.41,0.0
256,4992,3072,6144,ck,0,0,147.8526,a8w8_blockscale_1x128x128_256x128x128x128_16x16_32x32_2x2_8x32x1_8x32x1_1x32x1x8_8_1x1_intrawave_v3,1274.52,542.54,0.0
256,5002,3072,6144,ck,0,0,148.7273,a8w8_blockscale_1x128x128_256x128x128x128_16x16_32x32_2x2_8x32x1_8x32x1_1x32x1x8_8_1x1_intrawave_v3,1269.57,540.18,0.0
256,5027,3072,3072,ck,0,0,81.3821,a8w8_blockscale_1x128x128_256x128x128x128_16x16_32x32_2x2_8x32x1_8x32x1_1x32x1x8_8_1x1_intrawave_v3,1165.88,685.24,0.0
256,5045,3072,6144,ck,0,0,149.8293,a8w8_blockscale_1x128x128_256x128x128x128_16x16_32x32_2x2_8x32x1_8x32x1_1x32x1x8_8_1x1_intrawave_v3,1271.06,539.73,0.0
256,5052,3072,6144,ck,0,0,148.9802,a8w8_blockscale_1x128x128_256x128x128x128_16x16_32x32_2x2_8x32x1_8x32x1_1x32x1x8_8_1x1_intrawave_v3,1280.08,543.38,0.0
256,5057,3072,6144,ck,0,0,149.361,a8w8_blockscale_1x128x128_256x128x128x128_16x16_32x32_2x2_8x32x1_8x32x1_1x32x1x8_8_1x1_intrawave_v3,1278.08,542.41,0.0
256,5059,3072,6144,ck,0,0,149.242,a8w8_blockscale_1x128x128_256x128x128x128_16x16_32x32_2x2_8x32x1_8x32x1_1x32x1x8_8_1x1_intrawave_v3,1279.61,543.01,0.0
256,5063,3072,3072,ck,0,0,80.4377,a8w8_blockscale_1x128x128_256x128x128x128_16x16_32x32_2x2_8x32x1_8x32x1_1x32x1x8_8_1x1_intrawave_v3,1188.01,697.41,0.0
256,5063,3072,6144,ck,0,0,149.6357,a8w8_blockscale_1x128x128_256x128x128x128_16x16_32x32_2x2_8x32x1_8x32x1_1x32x1x8_8_1x1_intrawave_v3,1277.25,541.91,0.0
256,5071,3072,6144,ck,0,0,148.9516,a8w8_blockscale_1x128x128_256x128x128x128_16x16_32x32_2x2_8x32x1_8x32x1_1x32x1x8_8_1x1_intrawave_v3,1285.14,545.06,0.0
256,5083,3072,6144,ck,0,0,147.7857,a8w8_blockscale_1x128x128_256x128x128x128_16x16_32x32_2x2_8x32x1_8x32x1_1x32x1x8_8_1x1_intrawave_v3,1298.35,550.35,0.0
256,5084,3072,6144,ck,0,0,149.5094,a8w8_blockscale_1x128x128_256x128x128x128_16x16_32x32_2x2_8x32x1_8x32x1_1x32x1x8_8_1x1_intrawave_v3,1283.63,544.09,0.0
256,5089,3072,6144,ck,0,0,149.3873,a8w8_blockscale_1x128x128_256x128x128x128_16x16_32x32_2x2_8x32x1_8x32x1_1x32x1x8_8_1x1_intrawave_v3,1285.94,544.95,0.0
256,5090,3072,6144,ck,0,0,148.3199,a8w8_blockscale_1x128x128_256x128x128x128_16x16_32x32_2x2_8x32x1_8x32x1_1x32x1x8_8_1x1_intrawave_v3,1295.45,548.95,0.0
256,5112,3072,6144,ck,0,0,148.8186,a8w8_blockscale_1x128x128_256x128x128x128_16x16_32x32_2x2_8x32x1_8x32x1_1x32x1x8_8_1x1_intrawave_v3,1296.69,548.93,0.0
256,5115,3072,6144,ck,0,0,148.9774,a8w8_blockscale_1x128x128_256x128x128x128_16x16_32x32_2x2_8x32x1_8x32x1_1x32x1x8_8_1x1_intrawave_v3,1296.07,548.59,0.0
256,5119,3072,3072,ck,0,0,82.1674,a8w8_blockscale_1x128x128_256x128x128x128_16x16_32x32_2x2_8x32x1_8x32x1_1x32x1x8_8_1x1_intrawave_v3,1175.87,689.01,0.0
256,5120,3072,3072,ck,0,0,80.8342,a8w8_blockscale_1x128x128_256x128x128x128_16x16_32x32_2x2_8x32x1_8x32x1_1x32x1x8_8_1x1_intrawave_v3,1195.49,700.48,0.0
256,5120,3072,6144,ck,0,0,148.8929,a8w8_blockscale_1x128x128_256x128x128x128_16x16_32x32_2x2_8x32x1_8x32x1_1x32x1x8_8_1x1_intrawave_v3,1298.07,549.31,0.0
256,5128,3072,6144,ck,0,0,151.7445,a8w8_blockscale_1x128x128_256x128x128x128_16x16_32x32_2x2_8x32x1_8x32x1_1x32x1x8_8_1x1_intrawave_v3,1275.67,539.64,0.0
256,5129,3072,6144,ck,0,0,151.9611,a8w8_blockscale_1x128x128_256x128x128x128_16x16_32x32_2x2_8x32x1_8x32x1_1x32x1x8_8_1x1_intrawave_v3,1274.1,538.95,0.0
256,5136,3072,6144,ck,0,0,152.1427,a8w8_blockscale_1x128x128_256x128x128x128_16x16_32x32_2x2_8x32x1_8x32x1_1x32x1x8_8_1x1_intrawave_v3,1274.31,538.87,0.0
256,5137,3072,6144,ck,0,0,152.0579,a8w8_blockscale_1x128x128_256x128x128x128_16x16_32x32_2x2_8x32x1_8x32x1_1x32x1x8_8_1x1_intrawave_v3,1275.27,539.25,0.0
256,5139,3072,6144,ck,0,0,152.451,a8w8_blockscale_1x128x128_256x128x128x128_16x16_32x32_2x2_8x32x1_8x32x1_1x32x1x8_8_1x1_intrawave_v3,1272.48,538.02,0.0
256,5142,3072,6144,ck,0,0,151.3967,a8w8_blockscale_1x128x128_256x128x128x128_16x16_32x32_2x2_8x32x1_8x32x1_1x32x1x8_8_1x1_intrawave_v3,1282.09,542.01,0.0
256,5144,3072,6144,ck,0,0,152.4385,a8w8_blockscale_1x128x128_256x128x128x128_16x16_32x32_2x2_8x32x1_8x32x1_1x32x1x8_8_1x1_intrawave_v3,1273.82,538.47,0.0
256,5153,3072,6144,ck,0,0,152.4187,a8w8_blockscale_1x128x128_256x128x128x128_16x16_32x32_2x2_8x32x1_8x32x1_1x32x1x8_8_1x1_intrawave_v3,1276.22,539.27,0.0
256,5165,3072,6144,ck,0,0,152.0437,a8w8_blockscale_1x128x128_256x128x128x128_16x16_32x32_2x2_8x32x1_8x32x1_1x32x1x8_8_1x1_intrawave_v3,1282.34,541.57,0.0
256,5168,3072,6144,ck,0,0,152.2949,a8w8_blockscale_1x128x128_256x128x128x128_16x16_32x32_2x2_8x32x1_8x32x1_1x32x1x8_8_1x1_intrawave_v3,1280.97,540.92,0.0
256,5180,3072,6144,ck,0,0,153.0944,a8w8_blockscale_1x128x128_256x128x128x128_16x16_32x32_2x2_8x32x1_8x32x1_1x32x1x8_8_1x1_intrawave_v3,1277.24,539.05,0.0
256,5188,3072,6144,ck,0,0,152.7221,a8w8_blockscale_1x128x128_256x128x128x128_16x16_32x32_2x2_8x32x1_8x32x1_1x32x1x8_8_1x1_intrawave_v3,1282.33,541.01,0.0
256,5189,3072,6144,ck,0,0,151.4251,a8w8_blockscale_1x128x128_256x128x128x128_16x16_32x32_2x2_8x32x1_8x32x1_1x32x1x8_8_1x1_intrawave_v3,1293.56,545.73,0.0
256,5190,3072,6144,ck,0,0,152.5075,a8w8_blockscale_1x128x128_256x128x128x128_16x16_32x32_2x2_8x32x1_8x32x1_1x32x1x8_8_1x1_intrawave_v3,1284.63,541.93,0.0
256,5192,3072,6144,ck,0,0,152.0472,a8w8_blockscale_1x128x128_256x128x128x128_16x16_32x32_2x2_8x32x1_8x32x1_1x32x1x8_8_1x1_intrawave_v3,1289.02,543.74,0.0
256,5193,3072,6144,ck,0,0,152.3079,a8w8_blockscale_1x128x128_256x128x128x128_16x16_32x32_2x2_8x32x1_8x32x1_1x32x1x8_8_1x1_intrawave_v3,1287.06,542.89,0.0
256,5194,3072,6144,ck,0,0,151.7477,a8w8_blockscale_1x128x128_256x128x128x128_16x16_32x32_2x2_8x32x1_8x32x1_1x32x1x8_8_1x1_intrawave_v3,1292.06,544.97,0.0
256,5195,3072,6144,ck,0,0,151.3052,a8w8_blockscale_1x128x128_256x128x128x128_16x16_32x32_2x2_8x32x1_8x32x1_1x32x1x8_8_1x1_intrawave_v3,1296.09,546.65,0.0
256,5206,3072,6144,ck,0,0,153.834,a8w8_blockscale_1x128x128_256x128x128x128_16x16_32x32_2x2_8x32x1_8x32x1_1x32x1x8_8_1x1_intrawave_v3,1277.48,538.54,0.0
256,5212,3072,6144,ck,0,0,152.3739,a8w8_blockscale_1x128x128_256x128x128x128_16x16_32x32_2x2_8x32x1_8x32x1_1x32x1x8_8_1x1_intrawave_v3,1291.21,544.18,0.0
256,5236,3072,3072,ck,0,0,83.9762,a8w8_blockscale_1x128x128_256x128x128x128_16x16_32x32_2x2_8x32x1_8x32x1_1x32x1x8_8_1x1_intrawave_v3,1176.84,687.01,0.0
256,5242,3072,3072,ck,0,0,82.5771,a8w8_blockscale_1x128x128_256x128x128x128_16x16_32x32_2x2_8x32x1_8x32x1_1x32x1x8_8_1x1_intrawave_v3,1198.15,699.32,0.0
256,5242,3072,6144,ck,0,0,153.5663,a8w8_blockscale_1x128x128_256x128x128x128_16x16_32x32_2x2_8x32x1_8x32x1_1x32x1x8_8_1x1_intrawave_v3,1288.56,542.36,0.0
256,5243,3072,6144,ck,0,0,152.5444,a8w8_blockscale_1x128x128_256x128x128x128_16x16_32x32_2x2_8x32x1_8x32x1_1x32x1x8_8_1x1_intrawave_v3,1297.44,546.07,0.0
256,5244,3072,6144,ck,0,0,153.2892,a8w8_blockscale_1x128x128_256x128x128x128_16x16_32x32_2x2_8x32x1_8x32x1_1x32x1x8_8_1x1_intrawave_v3,1291.38,543.5,0.0
256,5246,3072,3072,ck,0,0,87.9001,a8w8_blockscale_1x128x128_256x128x128x128_16x16_32x32_2x2_8x32x1_8x32x1_1x32x1x8_8_1x1_intrawave_v3,1126.45,657.39,0.0
256,5248,3072,3072,ck,0,0,82.8809,a8w8_blockscale_1x128x128_256x128x128x128_16x16_32x32_2x2_8x32x1_8x32x1_1x32x1x8_8_1x1_intrawave_v3,1195.12,697.42,0.0
256,5248,3072,6144,ck,0,0,151.6262,a8w8_blockscale_1x128x128_256x128x128x128_16x16_32x32_2x2_8x32x1_8x32x1_1x32x1x8_8_1x1_intrawave_v3,1306.54,549.78,0.0
256,5504,3072,3072,ck,0,0,94.2739,a8w8_blockscale_1x128x128_256x128x128x128_16x16_32x32_2x2_8x32x1_8x32x1_1x32x1x8_8_1x1_intrawave_v3,1101.94,638.16,0.0
256,5509,3072,6144,ck,0,0,174.1972,a8w8_blockscale_1x128x128_256x128x128x128_16x16_32x32_2x2_8x32x1_8x32x1_1x32x1x8_8_1x1_intrawave_v3,1193.81,496.96,0.0
256,5510,3072,6144,ck,0,0,174.984,a8w8_blockscale_1x128x128_256x128x128x128_16x16_32x32_2x2_8x32x1_8x32x1_1x32x1x8_8_1x1_intrawave_v3,1188.65,494.8,0.0
256,5511,3072,3072,ck,0,0,94.2669,a8w8_blockscale_1x128x128_256x128x128x128_16x16_32x32_2x2_8x32x1_8x32x1_1x32x1x8_8_1x1_intrawave_v3,1103.43,638.89,0.0
256,5518,3072,3072,ck,0,0,94.3873,a8w8_blockscale_1x128x128_256x128x128x128_16x16_32x32_2x2_8x32x1_8x32x1_1x32x1x8_8_1x1_intrawave_v3,1103.42,638.76,0.0
256,5554,3072,3072,ck,0,0,95.8537,a8w8_blockscale_1x128x128_256x128x128x128_16x16_32x32_2x2_8x32x1_8x32x1_1x32x1x8_8_1x1_intrawave_v3,1093.63,632.45,0.0
256,5567,3072,3072,ck,0,0,96.0516,a8w8_blockscale_1x128x128_256x128x128x128_16x16_32x32_2x2_8x32x1_8x32x1_1x32x1x8_8_1x1_intrawave_v3,1093.93,632.4,0.0
256,5629,3072,3072,ck,0,0,96.6306,a8w8_blockscale_1x128x128_256x128x128x128_16x16_32x32_2x2_8x32x1_8x32x1_1x32x1x8_8_1x1_intrawave_v3,1099.48,634.52,0.0
256,5632,3072,3072,ck,0,0,95.5211,a8w8_blockscale_1x128x128_256x128x128x128_16x16_32x32_2x2_8x32x1_8x32x1_1x32x1x8_8_1x1_intrawave_v3,1112.85,642.18,0.0
256,5632,3072,6144,ck,0,0,172.3524,a8w8_blockscale_1x128x128_256x128x128x128_16x16_32x32_2x2_8x32x1_8x32x1_1x32x1x8_8_1x1_intrawave_v3,1233.52,511.05,0.0
256,5721,3072,3072,ck,0,0,95.5033,a8w8_blockscale_1x128x128_256x128x128x128_16x16_32x32_2x2_8x32x1_8x32x1_1x32x1x8_8_1x1_intrawave_v3,1130.64,650.89,0.0
256,5760,3072,3072,ck,0,0,95.5484,a8w8_blockscale_1x128x128_256x128x128x128_16x16_32x32_2x2_8x32x1_8x32x1_1x32x1x8_8_1x1_intrawave_v3,1137.81,654.34,0.0
256,5760,3072,6144,ck,0,0,176.1514,a8w8_blockscale_1x128x128_256x128x128x128_16x16_32x32_2x2_8x32x1_8x32x1_1x32x1x8_8_1x1_intrawave_v3,1234.35,508.96,0.0
256,5873,3072,3072,ck,0,0,96.7927,a8w8_blockscale_1x128x128_256x128x128x128_16x16_32x32_2x2_8x32x1_8x32x1_1x32x1x8_8_1x1_intrawave_v3,1145.22,656.69,0.0
256,5888,3072,3072,ck,0,0,95.4061,a8w8_blockscale_1x128x128_256x128x128x128_16x16_32x32_2x2_8x32x1_8x32x1_1x32x1x8_8_1x1_intrawave_v3,1164.83,667.68,0.0
256,5888,3072,6144,ck,0,0,177.8618,a8w8_blockscale_1x128x128_256x128x128x128_16x16_32x32_2x2_8x32x1_8x32x1_1x32x1x8_8_1x1_intrawave_v3,1249.65,512.9,0.0
256,5890,3072,3072,ck,0,0,96.3362,a8w8_blockscale_1x128x128_256x128x128x128_16x16_32x32_2x2_8x32x1_8x32x1_1x32x1x8_8_1x1_intrawave_v3,1153.98,661.43,0.0
256,5893,3072,3072,ck,0,0,98.8342,a8w8_blockscale_1x128x128_256x128x128x128_16x16_32x32_2x2_8x32x1_8x32x1_1x32x1x8_8_1x1_intrawave_v3,1125.39,644.99,0.0
256,5902,3072,3072,ck,0,0,98.5514,a8w8_blockscale_1x128x128_256x128x128x128_16x16_32x32_2x2_8x32x1_8x32x1_1x32x1x8_8_1x1_intrawave_v3,1130.34,647.68,0.0
256,5906,3072,3072,ck,0,0,97.0729,a8w8_blockscale_1x128x128_256x128x128x128_16x16_32x32_2x2_8x32x1_8x32x1_1x32x1x8_8_1x1_intrawave_v3,1148.33,657.93,0.0
256,5907,3072,3072,ck,0,0,97.8719,a8w8_blockscale_1x128x128_256x128x128x128_16x16_32x32_2x2_8x32x1_8x32x1_1x32x1x8_8_1x1_intrawave_v3,1139.15,652.65,0.0
256,5909,3072,3072,ck,0,0,96.9129,a8w8_blockscale_1x128x128_256x128x128x128_16x16_32x32_2x2_8x32x1_8x32x1_1x32x1x8_8_1x1_intrawave_v3,1150.81,659.3,0.0
256,6016,3072,3072,ck,0,0,98.6098,a8w8_blockscale_1x128x128_256x128x128x128_16x16_32x32_2x2_8x32x1_8x32x1_1x32x1x8_8_1x1_intrawave_v3,1151.49,657.95,0.0
256,6016,3072,6144,ck,0,0,179.7866,a8w8_blockscale_1x128x128_256x128x128x128_16x16_32x32_2x2_8x32x1_8x32x1_1x32x1x8_8_1x1_intrawave_v3,1263.14,516.16,0.0
256,6119,3072,3072,ck,0,0,99.4487,a8w8_blockscale_1x128x128_256x128x128x128_16x16_32x32_2x2_8x32x1_8x32x1_1x32x1x8_8_1x1_intrawave_v3,1161.32,661.95,0.0
256,6144,3072,3072,ck,0,0,98.0369,a8w8_blockscale_1x128x128_256x128x128x128_16x16_32x32_2x2_8x32x1_8x32x1_1x32x1x8_8_1x1_intrawave_v3,1182.86,673.83,0.0
256,6144,3072,6144,ck,0,0,177.707,a8w8_blockscale_1x128x128_256x128x128x128_16x16_32x32_2x2_8x32x1_8x32x1_1x32x1x8_8_1x1_intrawave_v3,1305.12,531.05,0.0
256,6272,3072,3072,ck,0,0,98.9434,a8w8_blockscale_1x128x128_256x128x128x128_16x16_32x32_2x2_8x32x1_8x32x1_1x32x1x8_8_1x1_intrawave_v3,1196.44,679.58,0.0
256,6272,3072,6144,ck,0,0,181.1063,a8w8_blockscale_1x128x128_256x128x128x128_16x16_32x32_2x2_8x32x1_8x32x1_1x32x1x8_8_1x1_intrawave_v3,1307.3,529.77,0.0
256,6339,3072,3072,ck,0,0,102.3028,a8w8_blockscale_1x128x128_256x128x128x128_16x16_32x32_2x2_8x32x1_8x32x1_1x32x1x8_8_1x1_intrawave_v3,1169.51,663.3,0.0
256,6380,3072,3072,ck,0,0,99.1226,a8w8_blockscale_1x128x128_256x128x128x128_16x16_32x32_2x2_8x32x1_8x32x1_1x32x1x8_8_1x1_intrawave_v3,1214.84,688.39,0.0
256,6400,3072,3072,ck,0,0,99.6315,a8w8_blockscale_1x128x128_256x128x128x128_16x16_32x32_2x2_8x32x1_8x32x1_1x32x1x8_8_1x1_intrawave_v3,1212.43,686.73,0.0
256,6400,3072,6144,ck,0,0,183.8441,a8w8_blockscale_1x128x128_256x128x128x128_16x16_32x32_2x2_8x32x1_8x32x1_1x32x1x8_8_1x1_intrawave_v3,1314.11,530.44,0.0
256,6415,3072,3072,ck,0,0,102.1346,a8w8_blockscale_1x128x128_256x128x128x128_16x16_32x32_2x2_8x32x1_8x32x1_1x32x1x8_8_1x1_intrawave_v3,1185.49,671.25,0.0
256,6442,3072,3072,ck,0,0,98.7914,a8w8_blockscale_1x128x128_256x128x128x128_16x16_32x32_2x2_8x32x1_8x32x1_1x32x1x8_8_1x1_intrawave_v3,1230.76,696.48,0.0
256,6528,3072,3072,ck,0,0,101.357,a8w8_blockscale_1x128x128_256x128x128x128_16x16_32x32_2x2_8x32x1_8x32x1_1x32x1x8_8_1x1_intrawave_v3,1215.62,686.67,0.0
256,6528,3072,6144,ck,0,0,187.0456,a8w8_blockscale_1x128x128_256x128x128x128_16x16_32x32_2x2_8x32x1_8x32x1_1x32x1x8_8_1x1_intrawave_v3,1317.45,529.77,0.0
256,6656,3072,3072,ck,0,0,102.4933,a8w8_blockscale_1x128x128_256x128x128x128_16x16_32x32_2x2_8x32x1_8x32x1_1x32x1x8_8_1x1_intrawave_v3,1225.72,690.57,0.0
256,6656,3072,6144,ck,0,0,186.1569,a8w8_blockscale_1x128x128_256x128x128x128_16x16_32x32_2x2_8x32x1_8x32x1_1x32x1x8_8_1x1_intrawave_v3,1349.7,540.74,0.0
256,6714,3072,6144,ck,0,0,197.832,a8w8_blockscale_1x128x128_256x128x128x128_16x16_32x32_2x2_8x32x1_8x32x1_1x32x1x8_8_1x1_intrawave_v3,1281.11,512.43,0.0
256,6784,3072,3072,ck,0,0,105.8425,a8w8_blockscale_1x128x128_256x128x128x128_16x16_32x32_2x2_8x32x1_8x32x1_1x32x1x8_8_1x1_intrawave_v3,1209.76,679.86,0.0
256,6784,3072,6144,ck,0,0,191.4607,a8w8_blockscale_1x128x128_256x128x128x128_16x16_32x32_2x2_8x32x1_8x32x1_1x32x1x8_8_1x1_intrawave_v3,1337.55,533.98,0.0
256,6899,3072,3072,ck,0,0,113.4786,a8w8_blockscale_1x128x128_256x128x128x128_16x16_32x32_2x2_8x32x1_8x32x1_1x32x1x8_8_1x1_intrawave_v3,1147.48,643.45,0.0
256,6912,3072,3072,ck,0,0,111.5799,a8w8_blockscale_1x128x128_256x128x128x128_16x16_32x32_2x2_8x32x1_8x32x1_1x32x1x8_8_1x1_intrawave_v3,1169.2,655.48,0.0
256,6912,3072,6144,ck,0,0,207.9509,a8w8_blockscale_1x128x128_256x128x128x128_16x16_32x32_2x2_8x32x1_8x32x1_1x32x1x8_8_1x1_intrawave_v3,1254.72,499.2,0.0
256,6954,3072,3072,ck,0,0,113.9893,a8w8_blockscale_1x128x128_256x128x128x128_16x16_32x32_2x2_8x32x1_8x32x1_1x32x1x8_8_1x1_intrawave_v3,1151.44,645.02,0.0
256,6981,3072,3072,ck,0,0,112.6433,a8w8_blockscale_1x128x128_256x128x128x128_16x16_32x32_2x2_8x32x1_8x32x1_1x32x1x8_8_1x1_intrawave_v3,1169.73,654.94,0.0
256,7000,3072,3072,ck,0,0,111.5882,a8w8_blockscale_1x128x128_256x128x128x128_16x16_32x32_2x2_8x32x1_8x32x1_1x32x1x8_8_1x1_intrawave_v3,1184.0,662.7,0.0
256,7040,3072,3072,ck,0,0,114.5202,a8w8_blockscale_1x128x128_256x128x128x128_16x16_32x32_2x2_8x32x1_8x32x1_1x32x1x8_8_1x1_intrawave_v3,1160.28,648.95,0.0
256,7040,3072,6144,ck,0,0,209.216,a8w8_blockscale_1x128x128_256x128x128x128_16x16_32x32_2x2_8x32x1_8x32x1_1x32x1x8_8_1x1_intrawave_v3,1270.22,503.7,0.0
256,7060,3072,6144,ck,0,0,207.1725,a8w8_blockscale_1x128x128_256x128x128x128_16x16_32x32_2x2_8x32x1_8x32x1_1x32x1x8_8_1x1_intrawave_v3,1286.4,509.85,0.0
256,7168,3072,3072,ck,0,0,114.8151,a8w8_blockscale_1x128x128_256x128x128x128_16x16_32x32_2x2_8x32x1_8x32x1_1x32x1x8_8_1x1_intrawave_v3,1178.34,657.56,0.0
256,7168,3072,6144,ck,0,0,209.6006,a8w8_blockscale_1x128x128_256x128x128x128_16x16_32x32_2x2_8x32x1_8x32x1_1x32x1x8_8_1x1_intrawave_v3,1290.95,510.28,0.0
256,7169,3072,3072,ck,0,0,113.4871,a8w8_blockscale_1x128x128_256x128x128x128_16x16_32x32_2x2_8x32x1_8x32x1_1x32x1x8_8_1x1_intrawave_v3,1192.3,665.33,0.0
256,7182,3072,3072,ck,0,0,114.8397,a8w8_blockscale_1x128x128_256x128x128x128_16x16_32x32_2x2_8x32x1_8x32x1_1x32x1x8_8_1x1_intrawave_v3,1180.39,658.54,0.0
256,7217,3072,3072,ck,0,0,114.9845,a8w8_blockscale_1x128x128_256x128x128x128_16x16_32x32_2x2_8x32x1_8x32x1_1x32x1x8_8_1x1_intrawave_v3,1184.65,660.52,0.0
256,7220,3072,6144,ck,0,0,212.1643,a8w8_blockscale_1x128x128_256x128x128x128_16x16_32x32_2x2_8x32x1_8x32x1_1x32x1x8_8_1x1_intrawave_v3,1284.6,507.12,0.0
256,7222,3072,6144,ck,0,0,208.3591,a8w8_blockscale_1x128x128_256x128x128x128_16x16_32x32_2x2_8x32x1_8x32x1_1x32x1x8_8_1x1_intrawave_v3,1308.42,516.5,0.0
256,7235,3072,6144,ck,0,0,209.5359,a8w8_blockscale_1x128x128_256x128x128x128_16x16_32x32_2x2_8x32x1_8x32x1_1x32x1x8_8_1x1_intrawave_v3,1303.41,514.37,0.0
256,7237,3072,6144,ck,0,0,207.1897,a8w8_blockscale_1x128x128_256x128x128x128_16x16_32x32_2x2_8x32x1_8x32x1_1x32x1x8_8_1x1_intrawave_v3,1318.54,520.31,0.0
256,7289,3072,6144,ck,0,0,208.8969,a8w8_blockscale_1x128x128_256x128x128x128_16x16_32x32_2x2_8x32x1_8x32x1_1x32x1x8_8_1x1_intrawave_v3,1317.16,519.12,0.0
256,7296,3072,3072,ck,0,0,114.6816,a8w8_blockscale_1x128x128_256x128x128x128_16x16_32x32_2x2_8x32x1_8x32x1_1x32x1x8_8_1x1_intrawave_v3,1200.78,668.61,0.0
256,7296,3072,6144,ck,0,0,211.7765,a8w8_blockscale_1x128x128_256x128x128x128_16x16_32x32_2x2_8x32x1_8x32x1_1x32x1x8_8_1x1_intrawave_v3,1300.5,512.46,0.0
256,7354,3072,6144,ck,0,0,212.6158,a8w8_blockscale_1x128x128_256x128x128x128_16x16_32x32_2x2_8x32x1_8x32x1_1x32x1x8_8_1x1_intrawave_v3,1305.66,513.79,0.0
256,7373,3072,6144,ck,0,0,210.0279,a8w8_blockscale_1x128x128_256x128x128x128_16x16_32x32_2x2_8x32x1_8x32x1_1x32x1x8_8_1x1_intrawave_v3,1325.16,521.23,0.0
256,7403,3072,3072,ck,0,0,116.2288,a8w8_blockscale_1x128x128_256x128x128x128_16x16_32x32_2x2_8x32x1_8x32x1_1x32x1x8_8_1x1_intrawave_v3,1202.17,668.19,0.0
256,7424,3072,3072,ck,0,0,115.5561,a8w8_blockscale_1x128x128_256x128x128x128_16x16_32x32_2x2_8x32x1_8x32x1_1x32x1x8_8_1x1_intrawave_v3,1212.6,673.76,0.0
256,7424,3072,6144,ck,0,0,213.273,a8w8_blockscale_1x128x128_256x128x128x128_16x16_32x32_2x2_8x32x1_8x32x1_1x32x1x8_8_1x1_intrawave_v3,1314.03,516.24,0.0
256,7455,3072,6144,ck,0,0,215.4833,a8w8_blockscale_1x128x128_256x128x128x128_16x16_32x32_2x2_8x32x1_8x32x1_1x32x1x8_8_1x1_intrawave_v3,1305.98,512.71,0.0
256,7552,3072,3072,ck,0,0,118.5542,a8w8_blockscale_1x128x128_256x128x128x128_16x16_32x32_2x2_8x32x1_8x32x1_1x32x1x8_8_1x1_intrawave_v3,1202.31,666.67,0.0
256,7552,3072,6144,ck,0,0,215.4211,a8w8_blockscale_1x128x128_256x128x128x128_16x16_32x32_2x2_8x32x1_8x32x1_1x32x1x8_8_1x1_intrawave_v3,1323.35,518.4,0.0
256,7658,3072,6144,ck,0,0,217.5239,a8w8_blockscale_1x128x128_256x128x128x128_16x16_32x32_2x2_8x32x1_8x32x1_1x32x1x8_8_1x1_intrawave_v3,1328.96,519.37,0.0
256,7678,3072,6144,ck,0,0,213.8933,a8w8_blockscale_1x128x128_256x128x128x128_16x16_32x32_2x2_8x32x1_8x32x1_1x32x1x8_8_1x1_intrawave_v3,1355.04,529.34,0.0
256,7680,3072,3072,ck,0,0,118.2608,a8w8_blockscale_1x128x128_256x128x128x128_16x16_32x32_2x2_8x32x1_8x32x1_1x32x1x8_8_1x1_intrawave_v3,1225.72,678.3,0.0
256,7680,3072,6144,ck,0,0,216.0636,a8w8_blockscale_1x128x128_256x128x128x128_16x16_32x32_2x2_8x32x1_8x32x1_1x32x1x8_8_1x1_intrawave_v3,1341.78,524.13,0.0
256,7698,3072,6144,ck,0,0,218.2307,a8w8_blockscale_1x128x128_256x128x128x128_16x16_32x32_2x2_8x32x1_8x32x1_1x32x1x8_8_1x1_intrawave_v3,1331.57,519.94,0.0
256,7808,3072,3072,ck,0,0,120.7532,a8w8_blockscale_1x128x128_256x128x128x128_16x16_32x32_2x2_8x32x1_8x32x1_1x32x1x8_8_1x1_intrawave_v3,1220.43,674.07,0.0
256,7808,3072,6144,ck,0,0,217.9329,a8w8_blockscale_1x128x128_256x128x128x128_16x16_32x32_2x2_8x32x1_8x32x1_1x32x1x8_8_1x1_intrawave_v3,1352.44,526.86,0.0
256,7828,3072,6144,ck,0,0,218.378,a8w8_blockscale_1x128x128_256x128x128x128_16x16_32x32_2x2_8x32x1_8x32x1_1x32x1x8_8_1x1_intrawave_v3,1353.15,526.91,0.0
256,7831,3072,6144,ck,0,0,215.4345,a8w8_blockscale_1x128x128_256x128x128x128_16x16_32x32_2x2_8x32x1_8x32x1_1x32x1x8_8_1x1_intrawave_v3,1372.16,534.28,0.0
256,7917,3072,3072,ck,0,0,118.9056,a8w8_blockscale_1x128x128_256x128x128x128_16x16_32x32_2x2_8x32x1_8x32x1_1x32x1x8_8_1x1_intrawave_v3,1256.7,692.99,0.0
256,7936,3072,3072,ck,0,0,119.9872,a8w8_blockscale_1x128x128_256x128x128x128_16x16_32x32_2x2_8x32x1_8x32x1_1x32x1x8_8_1x1_intrawave_v3,1248.36,688.2,0.0
256,7936,3072,6144,ck,0,0,220.1201,a8w8_blockscale_1x128x128_256x128x128x128_16x16_32x32_2x2_8x32x1_8x32x1_1x32x1x8_8_1x1_intrawave_v3,1360.96,528.77,0.0
256,8001,3072,3072,ck,0,0,121.6149,a8w8_blockscale_1x128x128_256x128x128x128_16x16_32x32_2x2_8x32x1_8x32x1_1x32x1x8_8_1x1_intrawave_v3,1241.74,683.92,0.0
256,8005,3072,3072,ck,0,0,120.7501,a8w8_blockscale_1x128x128_256x128x128x128_16x16_32x32_2x2_8x32x1_8x32x1_1x32x1x8_8_1x1_intrawave_v3,1251.26,689.12,0.0
256,8026,3072,6144,ck,0,0,226.4439,a8w8_blockscale_1x128x128_256x128x128x128_16x16_32x32_2x2_8x32x1_8x32x1_1x32x1x8_8_1x1_intrawave_v3,1337.95,518.88,0.0
256,8035,3072,6144,ck,0,0,221.4897,a8w8_blockscale_1x128x128_256x128x128x128_16x16_32x32_2x2_8x32x1_8x32x1_1x32x1x8_8_1x1_intrawave_v3,1369.41,530.99,0.0
256,8064,3072,3072,ck,0,0,122.1073,a8w8_blockscale_1x128x128_256x128x128x128_16x16_32x32_2x2_8x32x1_8x32x1_1x32x1x8_8_1x1_intrawave_v3,1246.47,685.91,0.0
256,8064,3072,6144,ck,0,0,223.5506,a8w8_blockscale_1x128x128_256x128x128x128_16x16_32x32_2x2_8x32x1_8x32x1_1x32x1x8_8_1x1_intrawave_v3,1361.69,527.69,0.0
256,8192,3072,3072,ck,0,0,123.7502,a8w8_blockscale_1x128x128_256x128x128x128_16x16_32x32_2x2_8x32x1_8x32x1_1x32x1x8_8_1x1_intrawave_v3,1249.44,686.34,0.0
256,8192,3072,6144,ck,0,0,222.6452,a8w8_blockscale_1x128x128_256x128x128x128_16x16_32x32_2x2_8x32x1_8x32x1_1x32x1x8_8_1x1_intrawave_v3,1388.93,536.9,0.0
256,8213,3072,3072,ck,0,0,129.4027,a8w8_blockscale_1x128x128_256x128x128x128_16x16_32x32_2x2_8x32x1_8x32x1_1x32x1x8_8_1x1_intrawave_v3,1197.93,657.85,0.0
256,8216,3072,3072,ck,0,0,130.9283,a8w8_blockscale_1x128x128_256x128x128x128_16x16_32x32_2x2_8x32x1_8x32x1_1x32x1x8_8_1x1_intrawave_v3,1184.4,650.4,0.0
256,8320,3072,3072,ck,0,0,130.959,a8w8_blockscale_1x128x128_256x128x128x128_16x16_32x32_2x2_8x32x1_8x32x1_1x32x1x8_8_1x1_intrawave_v3,1199.11,657.57,0.0
256,8320,3072,6144,ck,0,0,243.4711,a8w8_blockscale_1x128x128_256x128x128x128_16x16_32x32_2x2_8x32x1_8x32x1_1x32x1x8_8_1x1_intrawave_v3,1289.97,497.43,0.0
256,8448,3072,3072,ck,0,0,131.1491,a8w8_blockscale_1x128x128_256x128x128x128_16x16_32x32_2x2_8x32x1_8x32x1_1x32x1x8_8_1x1_intrawave_v3,1215.8,665.61,0.0
256,8448,3072,6144,ck,0,0,241.8934,a8w8_blockscale_1x128x128_256x128x128x128_16x16_32x32_2x2_8x32x1_8x32x1_1x32x1x8_8_1x1_intrawave_v3,1318.35,507.18,0.0
256,8470,3072,3072,ck,0,0,133.7647,a8w8_blockscale_1x128x128_256x128x128x128_16x16_32x32_2x2_8x32x1_8x32x1_1x32x1x8_8_1x1_intrawave_v3,1195.13,654.11,0.0
256,8515,3072,3072,ck,0,0,133.9267,a8w8_blockscale_1x128x128_256x128x128x128_16x16_32x32_2x2_8x32x1_8x32x1_1x32x1x8_8_1x1_intrawave_v3,1200.02,656.41,0.0
256,8576,3072,3072,ck,0,0,139.7252,a8w8_blockscale_1x128x128_256x128x128x128_16x16_32x32_2x2_8x32x1_8x32x1_1x32x1x8_8_1x1_intrawave_v3,1158.46,633.2,0.0
256,8576,3072,6144,ck,0,0,245.1504,a8w8_blockscale_1x128x128_256x128x128x128_16x16_32x32_2x2_8x32x1_8x32x1_1x32x1x8_8_1x1_intrawave_v3,1320.55,506.86,0.0
256,8704,3072,3072,ck,0,0,133.7051,a8w8_blockscale_1x128x128_256x128x128x128_16x16_32x32_2x2_8x32x1_8x32x1_1x32x1x8_8_1x1_intrawave_v3,1228.69,670.53,0.0
256,8704,3072,6144,ck,0,0,245.0184,a8w8_blockscale_1x128x128_256x128x128x128_16x16_32x32_2x2_8x32x1_8x32x1_1x32x1x8_8_1x1_intrawave_v3,1340.98,513.55,0.0
256,8832,3072,3072,ck,0,0,135.8232,a8w8_blockscale_1x128x128_256x128x128x128_16x16_32x32_2x2_8x32x1_8x32x1_1x32x1x8_8_1x1_intrawave_v3,1227.32,668.76,0.0
256,8832,3072,6144,ck,0,0,246.776,a8w8_blockscale_1x128x128_256x128x128x128_16x16_32x32_2x2_8x32x1_8x32x1_1x32x1x8_8_1x1_intrawave_v3,1351.01,516.27,0.0
256,8903,3072,6144,ck,0,0,249.3522,a8w8_blockscale_1x128x128_256x128x128x128_16x16_32x32_2x2_8x32x1_8x32x1_1x32x1x8_8_1x1_intrawave_v3,1347.8,514.43,0.0
256,8960,3072,3072,ck,0,0,137.1691,a8w8_blockscale_1x128x128_256x128x128x128_16x16_32x32_2x2_8x32x1_8x32x1_1x32x1x8_8_1x1_intrawave_v3,1232.89,670.8,0.0
256,8960,3072,6144,ck,0,0,249.0797,a8w8_blockscale_1x128x128_256x128x128x128_16x16_32x32_2x2_8x32x1_8x32x1_1x32x1x8_8_1x1_intrawave_v3,1357.91,517.81,0.0
256,9001,3072,3072,ck,0,0,137.1114,a8w8_blockscale_1x128x128_256x128x128x128_16x16_32x32_2x2_8x32x1_8x32x1_1x32x1x8_8_1x1_intrawave_v3,1239.05,673.83,0.0
256,9005,3072,3072,ck,0,0,136.0738,a8w8_blockscale_1x128x128_256x128x128x128_16x16_32x32_2x2_8x32x1_8x32x1_1x32x1x8_8_1x1_intrawave_v3,1249.06,679.24,0.0
256,9007,3072,3072,ck,0,0,133.7127,a8w8_blockscale_1x128x128_256x128x128x128_16x16_32x32_2x2_8x32x1_8x32x1_1x32x1x8_8_1x1_intrawave_v3,1271.39,691.38,0.0
256,9088,3072,3072,ck,0,0,138.5093,a8w8_blockscale_1x128x128_256x128x128x128_16x16_32x32_2x2_8x32x1_8x32x1_1x32x1x8_8_1x1_intrawave_v3,1238.4,672.82,0.0
256,9088,3072,6144,ck,0,0,251.4178,a8w8_blockscale_1x128x128_256x128x128x128_16x16_32x32_2x2_8x32x1_8x32x1_1x32x1x8_8_1x1_intrawave_v3,1364.5,519.25,0.0
256,9216,3072,3072,ck,0,0,137.303,a8w8_blockscale_1x128x128_256x128x128x128_16x16_32x32_2x2_8x32x1_8x32x1_1x32x1x8_8_1x1_intrawave_v3,1266.88,687.33,0.0
256,9216,3072,6144,ck,0,0,253.135,a8w8_blockscale_1x128x128_256x128x128x128_16x16_32x32_2x2_8x32x1_8x32x1_1x32x1x8_8_1x1_intrawave_v3,1374.34,521.94,0.0
256,9344,3072,3072,ck,0,0,138.7322,a8w8_blockscale_1x128x128_256x128x128x128_16x16_32x32_2x2_8x32x1_8x32x1_1x32x1x8_8_1x1_intrawave_v3,1271.24,688.75,0.0
256,9344,3072,6144,ck,0,0,255.3871,a8w8_blockscale_1x128x128_256x128x128x128_16x16_32x32_2x2_8x32x1_8x32x1_1x32x1x8_8_1x1_intrawave_v3,1381.14,523.49,0.0
256,9472,3072,3072,ck,0,0,139.6873,a8w8_blockscale_1x128x128_256x128x128x128_16x16_32x32_2x2_8x32x1_8x32x1_1x32x1x8_8_1x1_intrawave_v3,1279.84,692.48,0.0
256,9472,3072,6144,ck,0,0,256.7575,a8w8_blockscale_1x128x128_256x128x128x128_16x16_32x32_2x2_8x32x1_8x32x1_1x32x1x8_8_1x1_intrawave_v3,1392.58,526.83,0.0
256,9600,3072,3072,ck,0,0,147.4648,a8w8_blockscale_1x128x128_256x128x128x128_16x16_32x32_2x2_8x32x1_8x32x1_1x32x1x8_8_1x1_intrawave_v3,1228.73,663.96,0.0
256,9600,3072,6144,ck,0,0,275.6973,a8w8_blockscale_1x128x128_256x128x128x128_16x16_32x32_2x2_8x32x1_8x32x1_1x32x1x8_8_1x1_intrawave_v3,1314.44,496.34,0.0
256,9613,3072,3072,ck,0,0,144.8336,a8w8_blockscale_1x128x128_256x128x128x128_16x16_32x32_2x2_8x32x1_8x32x1_1x32x1x8_8_1x1_intrawave_v3,1252.74,676.85,0.0
256,9728,3072,3072,ck,0,0,148.4472,a8w8_blockscale_1x128x128_256x128x128x128_16x16_32x32_2x2_8x32x1_8x32x1_1x32x1x8_8_1x1_intrawave_v3,1236.87,667.51,0.0
256,9728,3072,6144,ck,0,0,274.2537,a8w8_blockscale_1x128x128_256x128x128x128_16x16_32x32_2x2_8x32x1_8x32x1_1x32x1x8_8_1x1_intrawave_v3,1338.98,504.69,0.0
256,9823,3072,6144,ck,0,0,273.292,a8w8_blockscale_1x128x128_256x128x128x128_16x16_32x32_2x2_8x32x1_8x32x1_1x32x1x8_8_1x1_intrawave_v3,1356.81,510.73,0.0
256,9856,3072,3072,ck,0,0,150.4759,a8w8_blockscale_1x128x128_256x128x128x128_16x16_32x32_2x2_8x32x1_8x32x1_1x32x1x8_8_1x1_intrawave_v3,1236.25,666.35,0.0
256,9856,3072,6144,ck,0,0,276.8804,a8w8_blockscale_1x128x128_256x128x128x128_16x16_32x32_2x2_8x32x1_8x32x1_1x32x1x8_8_1x1_intrawave_v3,1343.73,505.58,0.0
256,9957,3072,6144,ck,0,0,276.8731,a8w8_blockscale_1x128x128_256x128x128x128_16x16_32x32_2x2_8x32x1_8x32x1_1x32x1x8_8_1x1_intrawave_v3,1357.53,510.07,0.0
256,9984,3072,3072,ck,0,0,152.2567,a8w8_blockscale_1x128x128_256x128x128x128_16x16_32x32_2x2_8x32x1_8x32x1_1x32x1x8_8_1x1_intrawave_v3,1237.66,666.31,0.0
256,9984,3072,6144,ck,0,0,276.1472,a8w8_blockscale_1x128x128_256x128x128x128_16x16_32x32_2x2_8x32x1_8x32x1_1x32x1x8_8_1x1_intrawave_v3,1364.79,512.62,0.0
256,10014,3072,3072,ck,0,0,149.8963,a8w8_blockscale_1x128x128_256x128x128x128_16x16_32x32_2x2_8x32x1_8x32x1_1x32x1x8_8_1x1_intrawave_v3,1260.92,678.64,0.0
256,10022,3072,6144,ck,0,0,282.7234,a8w8_blockscale_1x128x128_256x128x128x128_16x16_32x32_2x2_8x32x1_8x32x1_1x32x1x8_8_1x1_intrawave_v3,1338.12,502.35,0.0
256,10031,3072,6144,ck,0,0,284.0567,a8w8_blockscale_1x128x128_256x128x128x128_16x16_32x32_2x2_8x32x1_8x32x1_1x32x1x8_8_1x1_intrawave_v3,1333.04,500.38,0.0
256,10035,3072,6144,ck,0,0,280.939,a8w8_blockscale_1x128x128_256x128x128x128_16x16_32x32_2x2_8x32x1_8x32x1_1x32x1x8_8_1x1_intrawave_v3,1348.37,506.1,0.0
256,10036,3072,6144,ck,0,0,282.9578,a8w8_blockscale_1x128x128_256x128x128x128_16x16_32x32_2x2_8x32x1_8x32x1_1x32x1x8_8_1x1_intrawave_v3,1338.88,502.54,0.0
256,10037,3072,6144,ck,0,0,281.457,a8w8_blockscale_1x128x128_256x128x128x128_16x16_32x32_2x2_8x32x1_8x32x1_1x32x1x8_8_1x1_intrawave_v3,1346.15,505.26,0.0
256,10038,3072,6144,ck,0,0,273.7988,a8w8_blockscale_1x128x128_256x128x128x128_16x16_32x32_2x2_8x32x1_8x32x1_1x32x1x8_8_1x1_intrawave_v3,1383.94,519.44,0.0
256,10041,3072,6144,ck,0,0,274.2631,a8w8_blockscale_1x128x128_256x128x128x128_16x16_32x32_2x2_8x32x1_8x32x1_1x32x1x8_8_1x1_intrawave_v3,1382.01,518.69,0.0
256,10042,3072,6144,ck,0,0,271.6767,a8w8_blockscale_1x128x128_256x128x128x128_16x16_32x32_2x2_8x32x1_8x32x1_1x32x1x8_8_1x1_intrawave_v3,1395.31,523.68,0.0
256,10045,3072,6144,ck,0,0,280.5938,a8w8_blockscale_1x128x128_256x128x128x128_16x16_32x32_2x2_8x32x1_8x32x1_1x32x1x8_8_1x1_intrawave_v3,1351.37,507.16,0.0
256,10046,3072,3072,ck,0,0,151.3729,a8w8_blockscale_1x128x128_256x128x128x128_16x16_32x32_2x2_8x32x1_8x32x1_1x32x1x8_8_1x1_intrawave_v3,1252.61,673.97,0.0
256,10076,3072,3072,ck,0,0,149.6544,a8w8_blockscale_1x128x128_256x128x128x128_16x16_32x32_2x2_8x32x1_8x32x1_1x32x1x8_8_1x1_intrawave_v3,1270.78,683.56,0.0
256,10083,3072,6144,ck,0,0,283.4526,a8w8_blockscale_1x128x128_256x128x128x128_16x16_32x32_2x2_8x32x1_8x32x1_1x32x1x8_8_1x1_intrawave_v3,1342.8,503.7,0.0
256,10088,3072,6144,ck,0,0,283.5644,a8w8_blockscale_1x128x128_256x128x128x128_16x16_32x32_2x2_8x32x1_8x32x1_1x32x1x8_8_1x1_intrawave_v3,1342.94,503.72,0.0
256,10109,3072,3072,ck,0,0,152.2582,a8w8_blockscale_1x128x128_256x128x128x128_16x16_32x32_2x2_8x32x1_8x32x1_1x32x1x8_8_1x1_intrawave_v3,1253.14,673.87,0.0
256,10112,3072,3072,ck,0,0,151.7632,a8w8_blockscale_1x128x128_256x128x128x128_16x16_32x32_2x2_8x32x1_8x32x1_1x32x1x8_8_1x1_intrawave_v3,1257.6,676.25,0.0
256,10112,3072,6144,ck,0,0,284.4018,a8w8_blockscale_1x128x128_256x128x128x128_16x16_32x32_2x2_8x32x1_8x32x1_1x32x1x8_8_1x1_intrawave_v3,1342.17,503.27,0.0
256,10196,3072,6144,ck,0,0,287.1672,a8w8_blockscale_1x128x128_256x128x128x128_16x16_32x32_2x2_8x32x1_8x32x1_1x32x1x8_8_1x1_intrawave_v3,1340.29,502.02,0.0
256,10216,3072,6144,ck,0,0,282.899,a8w8_blockscale_1x128x128_256x128x128x128_16x16_32x32_2x2_8x32x1_8x32x1_1x32x1x8_8_1x1_intrawave_v3,1363.18,510.46,0.0
256,10217,3072,6144,ck,0,0,279.6045,a8w8_blockscale_1x128x128_256x128x128x128_16x16_32x32_2x2_8x32x1_8x32x1_1x32x1x8_8_1x1_intrawave_v3,1379.37,516.52,0.0
256,10225,3072,6144,ck,0,0,277.1144,a8w8_blockscale_1x128x128_256x128x128x128_16x16_32x32_2x2_8x32x1_8x32x1_1x32x1x8_8_1x1_intrawave_v3,1392.86,521.51,0.0
256,10227,3072,6144,ck,0,0,281.3442,a8w8_blockscale_1x128x128_256x128x128x128_16x16_32x32_2x2_8x32x1_8x32x1_1x32x1x8_8_1x1_intrawave_v3,1372.19,513.76,0.0
256,10240,3072,6144,ck,0,0,282.0186,a8w8_blockscale_1x128x128_256x128x128x128_16x16_32x32_2x2_8x32x1_8x32x1_1x32x1x8_8_1x1_intrawave_v3,1370.64,513.1,0.0
256,10253,3072,6144,ck,0,0,281.0561,a8w8_blockscale_1x128x128_256x128x128x128_16x16_32x32_2x2_8x32x1_8x32x1_1x32x1x8_8_1x1_intrawave_v3,1377.08,515.42,0.0
256,10255,3072,3072,ck,0,0,151.9023,a8w8_blockscale_1x128x128_256x128x128x128_16x16_32x32_2x2_8x32x1_8x32x1_1x32x1x8_8_1x1_intrawave_v3,1274.22,684.3,0.0
256,10256,3072,3072,ck,0,0,151.6884,a8w8_blockscale_1x128x128_256x128x128x128_16x16_32x32_2x2_8x32x1_8x32x1_1x32x1x8_8_1x1_intrawave_v3,1276.14,685.33,0.0
256,10264,3072,6144,ck,0,0,287.6644,a8w8_blockscale_1x128x128_256x128x128x128_16x16_32x32_2x2_8x32x1_8x32x1_1x32x1x8_8_1x1_intrawave_v3,1346.89,504.05,0.0
256,10265,3072,6144,ck,0,0,284.6618,a8w8_blockscale_1x128x128_256x128x128x128_16x16_32x32_2x2_8x32x1_8x32x1_1x32x1x8_8_1x1_intrawave_v3,1361.23,509.41,0.0
256,10266,3072,3072,ck,0,0,153.1263,a8w8_blockscale_1x128x128_256x128x128x128_16x16_32x32_2x2_8x32x1_8x32x1_1x32x1x8_8_1x1_intrawave_v3,1265.39,679.5,0.0
256,10268,3072,3072,ck,0,0,154.7503,a8w8_blockscale_1x128x128_256x128x128x128_16x16_32x32_2x2_8x32x1_8x32x1_1x32x1x8_8_1x1_intrawave_v3,1252.35,672.48,0.0
256,10269,3072,6144,ck,0,0,283.5225,a8w8_blockscale_1x128x128_256x128x128x128_16x16_32x32_2x2_8x32x1_8x32x1_1x32x1x8_8_1x1_intrawave_v3,1367.23,511.63,0.0
256,10270,3072,6144,ck,0,0,283.3817,a8w8_blockscale_1x128x128_256x128x128x128_16x16_32x32_2x2_8x32x1_8x32x1_1x32x1x8_8_1x1_intrawave_v3,1368.05,511.93,0.0
256,10271,3072,6144,ck,0,0,282.4196,a8w8_blockscale_1x128x128_256x128x128x128_16x16_32x32_2x2_8x32x1_8x32x1_1x32x1x8_8_1x1_intrawave_v3,1372.84,513.72,0.0
256,10272,3072,6144,ck,0,0,284.4592,a8w8_blockscale_1x128x128_256x128x128x128_16x16_32x32_2x2_8x32x1_8x32x1_1x32x1x8_8_1x1_intrawave_v3,1363.13,510.08,0.0
256,10291,3072,3072,ck,0,0,152.3437,a8w8_blockscale_1x128x128_256x128x128x128_16x16_32x32_2x2_8x32x1_8x32x1_1x32x1x8_8_1x1_intrawave_v3,1274.99,684.5,0.0
256,10297,3072,3072,ck,0,0,152.6102,a8w8_blockscale_1x128x128_256x128x128x128_16x16_32x32_2x2_8x32x1_8x32x1_1x32x1x8_8_1x1_intrawave_v3,1273.5,683.67,0.0
256,10298,3072,3072,ck,0,0,152.2826,a8w8_blockscale_1x128x128_256x128x128x128_16x16_32x32_2x2_8x32x1_8x32x1_1x32x1x8_8_1x1_intrawave_v3,1276.37,685.2,0.0
256,10309,3072,3072,ck,0,0,153.0832,a8w8_blockscale_1x128x128_256x128x128x128_16x16_32x32_2x2_8x32x1_8x32x1_1x32x1x8_8_1x1_intrawave_v3,1271.05,682.28,0.0
256,10316,3072,3072,ck,0,0,152.9691,a8w8_blockscale_1x128x128_256x128x128x128_16x16_32x32_2x2_8x32x1_8x32x1_1x32x1x8_8_1x1_intrawave_v3,1272.86,683.21,0.0
256,10323,3072,3072,ck,0,0,153.8717,a8w8_blockscale_1x128x128_256x128x128x128_16x16_32x32_2x2_8x32x1_8x32x1_1x32x1x8_8_1x1_intrawave_v3,1266.25,679.62,0.0
256,10368,3072,3072,ck,0,0,149.7787,a8w8_blockscale_1x128x128_256x128x128x128_16x16_32x32_2x2_8x32x1_8x32x1_1x32x1x8_8_1x1_intrawave_v3,1306.52,700.96,0.0
256,10368,3072,6144,ck,0,0,283.6156,a8w8_blockscale_1x128x128_256x128x128x128_16x16_32x32_2x2_8x32x1_8x32x1_1x32x1x8_8_1x1_intrawave_v3,1379.96,515.76,0.0
256,10460,3072,6144,ck,0,0,287.9034,a8w8_blockscale_1x128x128_256x128x128x128_16x16_32x32_2x2_8x32x1_8x32x1_1x32x1x8_8_1x1_intrawave_v3,1371.47,512.0,0.0
256,10461,3072,6144,ck,0,0,286.2025,a8w8_blockscale_1x128x128_256x128x128x128_16x16_32x32_2x2_8x32x1_8x32x1_1x32x1x8_8_1x1_intrawave_v3,1379.76,515.09,0.0
256,10462,3072,6144,ck,0,0,286.0244,a8w8_blockscale_1x128x128_256x128x128x128_16x16_32x32_2x2_8x32x1_8x32x1_1x32x1x8_8_1x1_intrawave_v3,1380.75,515.45,0.0
256,10463,3072,6144,ck,0,0,286.2249,a8w8_blockscale_1x128x128_256x128x128x128_16x16_32x32_2x2_8x32x1_8x32x1_1x32x1x8_8_1x1_intrawave_v3,1379.91,515.13,0.0
256,10469,3072,6144,ck,0,0,283.7762,a8w8_blockscale_1x128x128_256x128x128x128_16x16_32x32_2x2_8x32x1_8x32x1_1x32x1x8_8_1x1_intrawave_v3,1392.62,519.84,0.0
256,10470,3072,6144,ck,0,0,280.6451,a8w8_blockscale_1x128x128_256x128x128x128_16x16_32x32_2x2_8x32x1_8x32x1_1x32x1x8_8_1x1_intrawave_v3,1408.29,525.68,0.0
256,10471,3072,6144,ck,0,0,285.6365,a8w8_blockscale_1x128x128_256x128x128x128_16x16_32x32_2x2_8x32x1_8x32x1_1x32x1x8_8_1x1_intrawave_v3,1383.81,516.54,0.0
256,10472,3072,6144,ck,0,0,283.957,a8w8_blockscale_1x128x128_256x128x128x128_16x16_32x32_2x2_8x32x1_8x32x1_1x32x1x8_8_1x1_intrawave_v3,1392.13,519.64,0.0
256,10476,3072,6144,ck,0,0,284.5129,a8w8_blockscale_1x128x128_256x128x128x128_16x16_32x32_2x2_8x32x1_8x32x1_1x32x1x8_8_1x1_intrawave_v3,1389.94,518.79,0.0
256,10479,3072,6144,ck,0,0,283.1793,a8w8_blockscale_1x128x128_256x128x128x128_16x16_32x32_2x2_8x32x1_8x32x1_1x32x1x8_8_1x1_intrawave_v3,1396.89,521.37,0.0
256,10496,3072,6144,ck,0,0,285.1692,a8w8_blockscale_1x128x128_256x128x128x128_16x16_32x32_2x2_8x32x1_8x32x1_1x32x1x8_8_1x1_intrawave_v3,1389.39,518.46,0.0
256,10497,3072,6144,ck,0,0,288.1814,a8w8_blockscale_1x128x128_256x128x128x128_16x16_32x32_2x2_8x32x1_8x32x1_1x32x1x8_8_1x1_intrawave_v3,1375.0,513.08,0.0
256,10509,3072,6144,ck,0,0,288.8852,a8w8_blockscale_1x128x128_256x128x128x128_16x16_32x32_2x2_8x32x1_8x32x1_1x32x1x8_8_1x1_intrawave_v3,1373.21,512.35,0.0
256,10513,3072,6144,ck,0,0,288.2052,a8w8_blockscale_1x128x128_256x128x128x128_16x16_32x32_2x2_8x32x1_8x32x1_1x32x1x8_8_1x1_intrawave_v3,1376.98,513.72,0.0
256,10514,3072,6144,ck,0,0,283.4633,a8w8_blockscale_1x128x128_256x128x128x128_16x16_32x32_2x2_8x32x1_8x32x1_1x32x1x8_8_1x1_intrawave_v3,1400.15,522.36,0.0
256,10515,3072,6144,ck,0,0,289.8411,a8w8_blockscale_1x128x128_256x128x128x128_16x16_32x32_2x2_8x32x1_8x32x1_1x32x1x8_8_1x1_intrawave_v3,1369.47,510.91,0.0
256,10516,3072,6144,ck,0,0,290.1475,a8w8_blockscale_1x128x128_256x128x128x128_16x16_32x32_2x2_8x32x1_8x32x1_1x32x1x8_8_1x1_intrawave_v3,1368.15,510.41,0.0
256,10520,3072,6144,ck,0,0,303.6079,a8w8_blockscale_1x128x128_256x128x128x128_16x16_32x32_2x2_8x32x1_8x32x1_1x32x1x8_8_1x1_intrawave_v3,1307.99,487.95,0.0
256,10522,3072,6144,ck,0,0,286.3164,a8w8_blockscale_1x128x128_256x128x128x128_16x16_32x32_2x2_8x32x1_8x32x1_1x32x1x8_8_1x1_intrawave_v3,1387.25,517.5,0.0
256,10524,3072,6144,ck,0,0,288.7898,a8w8_blockscale_1x128x128_256x128x128x128_16x16_32x32_2x2_8x32x1_8x32x1_1x32x1x8_8_1x1_intrawave_v3,1375.63,513.15,0.0
256,10526,3072,6144,ck,0,0,288.1883,a8w8_blockscale_1x128x128_256x128x128x128_16x16_32x32_2x2_8x32x1_8x32x1_1x32x1x8_8_1x1_intrawave_v3,1378.76,514.31,0.0
256,10527,3072,6144,ck,0,0,287.6211,a8w8_blockscale_1x128x128_256x128x128x128_16x16_32x32_2x2_8x32x1_8x32x1_1x32x1x8_8_1x1_intrawave_v3,1381.61,515.37,0.0
256,10553,3072,6144,ck,0,0,288.0946,a8w8_blockscale_1x128x128_256x128x128x128_16x16_32x32_2x2_8x32x1_8x32x1_1x32x1x8_8_1x1_intrawave_v3,1382.75,515.63,0.0
256,10585,3072,6144,ck,0,0,290.6611,a8w8_blockscale_1x128x128_256x128x128x128_16x16_32x32_2x2_8x32x1_8x32x1_1x32x1x8_8_1x1_intrawave_v3,1374.7,512.43,0.0
256,10607,3072,6144,ck,0,0,287.9602,a8w8_blockscale_1x128x128_256x128x128x128_16x16_32x32_2x2_8x32x1_8x32x1_1x32x1x8_8_1x1_intrawave_v3,1390.47,518.17,0.0
256,10618,3072,6144,ck,0,0,289.6353,a8w8_blockscale_1x128x128_256x128x128x128_16x16_32x32_2x2_8x32x1_8x32x1_1x32x1x8_8_1x1_intrawave_v3,1383.86,515.64,0.0
256,10624,3072,6144,ck,0,0,284.0581,a8w8_blockscale_1x128x128_256x128x128x128_16x16_32x32_2x2_8x32x1_8x32x1_1x32x1x8_8_1x1_intrawave_v3,1411.83,526.03,0.0
256,10628,3072,6144,ck,0,0,292.0449,a8w8_blockscale_1x128x128_256x128x128x128_16x16_32x32_2x2_8x32x1_8x32x1_1x32x1x8_8_1x1_intrawave_v3,1373.74,511.81,0.0
256,10649,3072,6144,ck,0,0,290.9183,a8w8_blockscale_1x128x128_256x128x128x128_16x16_32x32_2x2_8x32x1_8x32x1_1x32x1x8_8_1x1_intrawave_v3,1381.78,514.68,0.0
256,10652,3072,6144,ck,0,0,291.1476,a8w8_blockscale_1x128x128_256x128x128x128_16x16_32x32_2x2_8x32x1_8x32x1_1x32x1x8_8_1x1_intrawave_v3,1381.08,514.4,0.0
256,10670,3072,6144,ck,0,0,290.8175,a8w8_blockscale_1x128x128_256x128x128x128_16x16_32x32_2x2_8x32x1_8x32x1_1x32x1x8_8_1x1_intrawave_v3,1384.99,515.74,0.0
256,10691,3072,6144,ck,0,0,289.4495,a8w8_blockscale_1x128x128_256x128x128x128_16x16_32x32_2x2_8x32x1_8x32x1_1x32x1x8_8_1x1_intrawave_v3,1394.27,519.07,0.0
256,10694,3072,6144,ck,0,0,292.448,a8w8_blockscale_1x128x128_256x128x128x128_16x16_32x32_2x2_8x32x1_8x32x1_1x32x1x8_8_1x1_intrawave_v3,1380.36,513.88,0.0
256,10703,3072,6144,ck,0,0,289.778,a8w8_blockscale_1x128x128_256x128x128x128_16x16_32x32_2x2_8x32x1_8x32x1_1x32x1x8_8_1x1_intrawave_v3,1394.26,518.99,0.0
256,10706,3072,6144,ck,0,0,288.1391,a8w8_blockscale_1x128x128_256x128x128x128_16x16_32x32_2x2_8x32x1_8x32x1_1x32x1x8_8_1x1_intrawave_v3,1402.58,522.07,0.0
256,10707,3072,6144,ck,0,0,292.8991,a8w8_blockscale_1x128x128_256x128x128x128_16x16_32x32_2x2_8x32x1_8x32x1_1x32x1x8_8_1x1_intrawave_v3,1379.91,513.63,0.0
256,10708,3072,6144,ck,0,0,287.102,a8w8_blockscale_1x128x128_256x128x128x128_16x16_32x32_2x2_8x32x1_8x32x1_1x32x1x8_8_1x1_intrawave_v3,1407.91,524.04,0.0
256,10709,3072,6144,ck,0,0,287.5497,a8w8_blockscale_1x128x128_256x128x128x128_16x16_32x32_2x2_8x32x1_8x32x1_1x32x1x8_8_1x1_intrawave_v3,1405.85,523.27,0.0
256,10710,3072,6144,ck,0,0,292.3193,a8w8_blockscale_1x128x128_256x128x128x128_16x16_32x32_2x2_8x32x1_8x32x1_1x32x1x8_8_1x1_intrawave_v3,1383.04,514.78,0.0
256,10714,3072,6144,ck,0,0,288.9785,a8w8_blockscale_1x128x128_256x128x128x128_16x16_32x32_2x2_8x32x1_8x32x1_1x32x1x8_8_1x1_intrawave_v3,1399.55,520.9,0.0
256,10716,3072,6144,ck,0,0,289.944,a8w8_blockscale_1x128x128_256x128x128x128_16x16_32x32_2x2_8x32x1_8x32x1_1x32x1x8_8_1x1_intrawave_v3,1395.15,519.25,0.0
256,10717,3072,6144,ck,0,0,289.3593,a8w8_blockscale_1x128x128_256x128x128x128_16x16_32x32_2x2_8x32x1_8x32x1_1x32x1x8_8_1x1_intrawave_v3,1398.1,520.34,0.0
256,10718,3072,6144,ck,0,0,287.221,a8w8_blockscale_1x128x128_256x128x128x128_16x16_32x32_2x2_8x32x1_8x32x1_1x32x1x8_8_1x1_intrawave_v3,1408.64,524.26,0.0
256,10721,3072,6144,ck,0,0,289.8033,a8w8_blockscale_1x128x128_256x128x128x128_16x16_32x32_2x2_8x32x1_8x32x1_1x32x1x8_8_1x1_intrawave_v3,1396.48,519.71,0.0
256,10724,3072,6144,ck,0,0,290.1071,a8w8_blockscale_1x128x128_256x128x128x128_16x16_32x32_2x2_8x32x1_8x32x1_1x32x1x8_8_1x1_intrawave_v3,1395.41,519.29,0.0
256,10742,3072,6144,ck,0,0,289.9623,a8w8_blockscale_1x128x128_256x128x128x128_16x16_32x32_2x2_8x32x1_8x32x1_1x32x1x8_8_1x1_intrawave_v3,1398.45,520.32,0.0
256,10747,3072,6144,ck,0,0,287.4155,a8w8_blockscale_1x128x128_256x128x128x128_16x16_32x32_2x2_8x32x1_8x32x1_1x32x1x8_8_1x1_intrawave_v3,1411.5,525.14,0.0
256,10752,3072,6144,ck,0,0,284.5157,a8w8_blockscale_1x128x128_256x128x128x128_16x16_32x32_2x2_8x32x1_8x32x1_1x32x1x8_8_1x1_intrawave_v3,1426.54,530.71,0.0
256,10767,3072,6144,ck,0,0,299.5488,a8w8_blockscale_1x128x128_256x128x128x128_16x16_32x32_2x2_8x32x1_8x32x1_1x32x1x8_8_1x1_intrawave_v3,1356.84,504.69,0.0
256,10776,3072,3072,ck,0,0,157.8013,a8w8_blockscale_1x128x128_256x128x128x128_16x16_32x32_2x2_8x32x1_8x32x1_1x32x1x8_8_1x1_intrawave_v3,1288.9,689.15,0.0
256,10780,3072,3072,ck,0,0,158.8798,a8w8_blockscale_1x128x128_256x128x128x128_16x16_32x32_2x2_8x32x1_8x32x1_1x32x1x8_8_1x1_intrawave_v3,1280.63,684.7,0.0
256,10782,3072,3072,ck,0,0,158.6606,a8w8_blockscale_1x128x128_256x128x128x128_16x16_32x32_2x2_8x32x1_8x32x1_1x32x1x8_8_1x1_intrawave_v3,1282.63,685.77,0.0
256,10782,3072,6144,ck,0,0,297.1897,a8w8_blockscale_1x128x128_256x128x128x128_16x16_32x32_2x2_8x32x1_8x32x1_1x32x1x8_8_1x1_intrawave_v3,1369.52,509.32,0.0
256,10783,3072,6144,ck,0,0,293.0661,a8w8_blockscale_1x128x128_256x128x128x128_16x16_32x32_2x2_8x32x1_8x32x1_1x32x1x8_8_1x1_intrawave_v3,1388.92,516.52,0.0
256,10784,3072,6144,ck,0,0,291.4869,a8w8_blockscale_1x128x128_256x128x128x128_16x16_32x32_2x2_8x32x1_8x32x1_1x32x1x8_8_1x1_intrawave_v3,1396.57,519.37,0.0
256,10785,3072,6144,ck,0,0,294.9178,a8w8_blockscale_1x128x128_256x128x128x128_16x16_32x32_2x2_8x32x1_8x32x1_1x32x1x8_8_1x1_intrawave_v3,1380.45,513.36,0.0
256,10800,3072,3072,ck,0,0,158.3902,a8w8_blockscale_1x128x128_256x128x128x128_16x16_32x32_2x2_8x32x1_8x32x1_1x32x1x8_8_1x1_intrawave_v3,1286.97,687.98,0.0
256,10803,3072,3072,ck,0,0,158.2861,a8w8_blockscale_1x128x128_256x128x128x128_16x16_32x32_2x2_8x32x1_8x32x1_1x32x1x8_8_1x1_intrawave_v3,1288.17,688.61,0.0
256,10843,3072,6144,ck,0,0,299.3285,a8w8_blockscale_1x128x128_256x128x128x128_16x16_32x32_2x2_8x32x1_8x32x1_1x32x1x8_8_1x1_intrawave_v3,1367.43,508.18,0.0
256,10873,3072,6144,ck,0,0,302.3195,a8w8_blockscale_1x128x128_256x128x128x128_16x16_32x32_2x2_8x32x1_8x32x1_1x32x1x8_8_1x1_intrawave_v3,1357.64,504.37,0.0
256,10877,3072,6144,ck,0,0,298.307,a8w8_blockscale_1x128x128_256x128x128x128_16x16_32x32_2x2_8x32x1_8x32x1_1x32x1x8_8_1x1_intrawave_v3,1376.41,511.32,0.0
256,10880,3072,3072,ck,0,0,158.2762,a8w8_blockscale_1x128x128_256x128x128x128_16x16_32x32_2x2_8x32x1_8x32x1_1x32x1x8_8_1x1_intrawave_v3,1297.44,693.14,0.0
256,10880,3072,6144,ck,0,0,291.605,a8w8_blockscale_1x128x128_256x128x128x128_16x16_32x32_2x2_8x32x1_8x32x1_1x32x1x8_8_1x1_intrawave_v3,1408.43,523.2,0.0
256,10903,3072,3072,ck,0,0,164.3798,a8w8_blockscale_1x128x128_256x128x128x128_16x16_32x32_2x2_8x32x1_8x32x1_1x32x1x8_8_1x1_intrawave_v3,1251.9,668.69,0.0
256,10934,3072,3072,ck,0,0,168.3513,a8w8_blockscale_1x128x128_256x128x128x128_16x16_32x32_2x2_8x32x1_8x32x1_1x32x1x8_8_1x1_intrawave_v3,1225.84,654.61,0.0
256,10967,3072,3072,ck,0,0,164.1902,a8w8_blockscale_1x128x128_256x128x128x128_16x16_32x32_2x2_8x32x1_8x32x1_1x32x1x8_8_1x1_intrawave_v3,1260.7,673.06,0.0
256,10969,3072,3072,ck,0,0,163.7755,a8w8_blockscale_1x128x128_256x128x128x128_16x16_32x32_2x2_8x32x1_8x32x1_1x32x1x8_8_1x1_intrawave_v3,1264.13,674.87,0.0
256,11004,3072,6144,ck,0,0,311.8948,a8w8_blockscale_1x128x128_256x128x128x128_16x16_32x32_2x2_8x32x1_8x32x1_1x32x1x8_8_1x1_intrawave_v3,1331.82,494.05,0.0
256,11008,3072,3072,ck,0,0,165.9065,a8w8_blockscale_1x128x128_256x128x128x128_16x16_32x32_2x2_8x32x1_8x32x1_1x32x1x8_8_1x1_intrawave_v3,1252.33,668.37,0.0
256,11008,3072,6144,ck,0,0,305.7708,a8w8_blockscale_1x128x128_256x128x128x128_16x16_32x32_2x2_8x32x1_8x32x1_1x32x1x8_8_1x1_intrawave_v3,1358.99,504.11,0.0
256,11060,3072,3072,ck,0,0,169.0825,a8w8_blockscale_1x128x128_256x128x128x128_16x16_32x32_2x2_8x32x1_8x32x1_1x32x1x8_8_1x1_intrawave_v3,1234.61,658.65,0.0
256,11061,3072,3072,ck,0,0,167.6449,a8w8_blockscale_1x128x128_256x128x128x128_16x16_32x32_2x2_8x32x1_8x32x1_1x32x1x8_8_1x1_intrawave_v3,1245.31,664.35,0.0
256,11079,3072,3072,ck,0,0,165.764,a8w8_blockscale_1x128x128_256x128x128x128_16x16_32x32_2x2_8x32x1_8x32x1_1x32x1x8_8_1x1_intrawave_v3,1261.49,672.89,0.0
256,11102,3072,3072,ck,0,0,168.8369,a8w8_blockscale_1x128x128_256x128x128x128_16x16_32x32_2x2_8x32x1_8x32x1_1x32x1x8_8_1x1_intrawave_v3,1241.1,661.9,0.0
256,11107,3072,3072,ck,0,0,164.009,a8w8_blockscale_1x128x128_256x128x128x128_16x16_32x32_2x2_8x32x1_8x32x1_1x32x1x8_8_1x1_intrawave_v3,1278.21,681.67,0.0
256,11108,3072,3072,ck,0,0,169.8677,a8w8_blockscale_1x128x128_256x128x128x128_16x16_32x32_2x2_8x32x1_8x32x1_1x32x1x8_8_1x1_intrawave_v3,1234.23,658.21,0.0
256,11117,3072,3072,ck,0,0,169.6258,a8w8_blockscale_1x128x128_256x128x128x128_16x16_32x32_2x2_8x32x1_8x32x1_1x32x1x8_8_1x1_intrawave_v3,1237.0,659.64,0.0
256,11118,3072,3072,ck,0,0,167.5686,a8w8_blockscale_1x128x128_256x128x128x128_16x16_32x32_2x2_8x32x1_8x32x1_1x32x1x8_8_1x1_intrawave_v3,1252.29,667.79,0.0
256,11136,3072,3072,ck,0,0,166.2725,a8w8_blockscale_1x128x128_256x128x128x128_16x16_32x32_2x2_8x32x1_8x32x1_1x32x1x8_8_1x1_intrawave_v3,1264.1,673.99,0.0
256,11136,3072,6144,ck,0,0,309.3155,a8w8_blockscale_1x128x128_256x128x128x128_16x16_32x32_2x2_8x32x1_8x32x1_1x32x1x8_8_1x1_intrawave_v3,1359.03,503.41,0.0
256,11152,3072,3072,ck,0,0,169.3969,a8w8_blockscale_1x128x128_256x128x128x128_16x16_32x32_2x2_8x32x1_8x32x1_1x32x1x8_8_1x1_intrawave_v3,1242.57,662.43,0.0
256,11159,3072,3072,ck,0,0,171.486,a8w8_blockscale_1x128x128_256x128x128x128_16x16_32x32_2x2_8x32x1_8x32x1_1x32x1x8_8_1x1_intrawave_v3,1228.2,654.74,0.0
256,11160,3072,3072,ck,0,0,164.8049,a8w8_blockscale_1x128x128_256x128x128x128_16x16_32x32_2x2_8x32x1_8x32x1_1x32x1x8_8_1x1_intrawave_v3,1278.1,681.34,0.0
256,11264,3072,3072,ck,0,0,165.8291,a8w8_blockscale_1x128x128_256x128x128x128_16x16_32x32_2x2_8x32x1_8x32x1_1x32x1x8_8_1x1_intrawave_v3,1282.05,682.91,0.0
256,11264,3072,6144,ck,0,0,311.5794,a8w8_blockscale_1x128x128_256x128x128x128_16x16_32x32_2x2_8x32x1_8x32x1_1x32x1x8_8_1x1_intrawave_v3,1364.67,504.8,0.0
256,11392,3072,3072,ck,0,0,167.2565,a8w8_blockscale_1x128x128_256x128x128x128_16x16_32x32_2x2_8x32x1_8x32x1_1x32x1x8_8_1x1_intrawave_v3,1285.55,684.13,0.0
256,11392,3072,6144,ck,0,0,309.678,a8w8_blockscale_1x128x128_256x128x128x128_16x16_32x32_2x2_8x32x1_8x32x1_1x32x1x8_8_1x1_intrawave_v3,1388.65,512.98,0.0
256,11520,3072,3072,ck,0,0,172.0338,a8w8_blockscale_1x128x128_256x128x128x128_16x16_32x32_2x2_8x32x1_8x32x1_1x32x1x8_8_1x1_intrawave_v3,1263.9,671.99,0.0
256,11520,3072,6144,ck,0,0,314.2265,a8w8_blockscale_1x128x128_256x128x128x128_16x16_32x32_2x2_8x32x1_8x32x1_1x32x1x8_8_1x1_intrawave_v3,1383.92,510.56,0.0
256,11607,3072,6144,ck,0,0,320.0498,a8w8_blockscale_1x128x128_256x128x128x128_16x16_32x32_2x2_8x32x1_8x32x1_1x32x1x8_8_1x1_intrawave_v3,1369.0,504.61,0.0
256,11648,3072,3072,ck,0,0,173.791,a8w8_blockscale_1x128x128_256x128x128x128_16x16_32x32_2x2_8x32x1_8x32x1_1x32x1x8_8_1x1_intrawave_v3,1265.02,671.99,0.0
256,11648,3072,6144,ck,0,0,311.9842,a8w8_blockscale_1x128x128_256x128x128x128_16x16_32x32_2x2_8x32x1_8x32x1_1x32x1x8_8_1x1_intrawave_v3,1409.36,519.27,0.0
256,11714,3072,3072,ck,0,0,173.491,a8w8_blockscale_1x128x128_256x128x128x128_16x16_32x32_2x2_8x32x1_8x32x1_1x32x1x8_8_1x1_intrawave_v3,1274.39,676.65,0.0
256,11776,3072,3072,ck,0,0,171.7844,a8w8_blockscale_1x128x128_256x128x128x128_16x16_32x32_2x2_8x32x1_8x32x1_1x32x1x8_8_1x1_intrawave_v3,1293.86,686.7,0.0
256,11776,3072,6144,ck,0,0,313.5663,a8w8_blockscale_1x128x128_256x128x128x128_16x16_32x32_2x2_8x32x1_8x32x1_1x32x1x8_8_1x1_intrawave_v3,1417.66,521.67,0.0
256,11825,3072,6144,ck,0,0,319.4063,a8w8_blockscale_1x128x128_256x128x128x128_16x16_32x32_2x2_8x32x1_8x32x1_1x32x1x8_8_1x1_intrawave_v3,1397.53,514.02,0.0
256,11904,3072,3072,ck,0,0,173.9667,a8w8_blockscale_1x128x128_256x128x128x128_16x16_32x32_2x2_8x32x1_8x32x1_1x32x1x8_8_1x1_intrawave_v3,1291.51,684.87,0.0
256,11904,3072,6144,ck,0,0,318.4337,a8w8_blockscale_1x128x128_256x128x128x128_16x16_32x32_2x2_8x32x1_8x32x1_1x32x1x8_8_1x1_intrawave_v3,1411.16,518.63,0.0
256,12032,3072,3072,ck,0,0,173.342,a8w8_blockscale_1x128x128_256x128x128x128_16x16_32x32_2x2_8x32x1_8x32x1_1x32x1x8_8_1x1_intrawave_v3,1310.11,694.14,0.0
256,12032,3072,6144,ck,0,0,318.2249,a8w8_blockscale_1x128x128_256x128x128x128_16x16_32x32_2x2_8x32x1_8x32x1_1x32x1x8_8_1x1_intrawave_v3,1427.27,523.92,0.0
256,12160,3072,3072,ck,0,0,176.2385,a8w8_blockscale_1x128x128_256x128x128x128_16x16_32x32_2x2_8x32x1_8x32x1_1x32x1x8_8_1x1_intrawave_v3,1302.28,689.43,0.0
256,12160,3072,6144,ck,0,0,324.0899,a8w8_blockscale_1x128x128_256x128x128x128_16x16_32x32_2x2_8x32x1_8x32x1_1x32x1x8_8_1x1_intrawave_v3,1416.35,519.29,0.0
256,12288,3072,6144,ck,0,0,327.5609,a8w8_blockscale_1x128x128_256x128x128x128_16x16_32x32_2x2_8x32x1_8x32x1_1x32x1x8_8_1x1_intrawave_v3,1416.09,518.59,0.0
256,12416,3072,3072,ck,0,0,183.1806,a8w8_blockscale_1x128x128_256x128x128x128_16x16_32x32_2x2_8x32x1_8x32x1_1x32x1x8_8_1x1_intrawave_v3,1279.31,676.18,0.0
256,12416,3072,6144,ck,0,0,338.2369,a8w8_blockscale_1x128x128_256x128x128x128_16x16_32x32_2x2_8x32x1_8x32x1_1x32x1x8_8_1x1_intrawave_v3,1385.68,506.87,0.0
256,12430,3072,3072,ck,0,0,181.5333,a8w8_blockscale_1x128x128_256x128x128x128_16x16_32x32_2x2_8x32x1_8x32x1_1x32x1x8_8_1x1_intrawave_v3,1292.37,683.03,0.0
256,12544,3072,3072,ck,0,0,182.578,a8w8_blockscale_1x128x128_256x128x128x128_16x16_32x32_2x2_8x32x1_8x32x1_1x32x1x8_8_1x1_intrawave_v3,1296.76,684.87,0.0
256,12544,3072,6144,ck,0,0,338.2612,a8w8_blockscale_1x128x128_256x128x128x128_16x16_32x32_2x2_8x32x1_8x32x1_1x32x1x8_8_1x1_intrawave_v3,1399.87,511.48,0.0
256,12655,3072,6144,ck,0,0,345.9631,a8w8_blockscale_1x128x128_256x128x128x128_16x16_32x32_2x2_8x32x1_8x32x1_1x32x1x8_8_1x1_intrawave_v3,1380.81,504.04,0.0
256,12672,3072,3072,ck,0,0,185.4955,a8w8_blockscale_1x128x128_256x128x128x128_16x16_32x32_2x2_8x32x1_8x32x1_1x32x1x8_8_1x1_intrawave_v3,1289.39,680.46,0.0
256,12672,3072,6144,ck,0,0,343.0612,a8w8_blockscale_1x128x128_256x128x128x128_16x16_32x32_2x2_8x32x1_8x32x1_1x32x1x8_8_1x1_intrawave_v3,1394.36,508.91,0.0
256,12772,3072,6144,ck,0,0,346.5787,a8w8_blockscale_1x128x128_256x128x128x128_16x16_32x32_2x2_8x32x1_8x32x1_1x32x1x8_8_1x1_intrawave_v3,1391.1,507.29,0.0
256,12800,3072,3072,ck,0,0,187.1702,a8w8_blockscale_1x128x128_256x128x128x128_16x16_32x32_2x2_8x32x1_8x32x1_1x32x1x8_8_1x1_intrawave_v3,1290.76,680.67,0.0
256,12800,3072,6144,ck,0,0,337.7994,a8w8_blockscale_1x128x128_256x128x128x128_16x16_32x32_2x2_8x32x1_8x32x1_1x32x1x8_8_1x1_intrawave_v3,1430.39,521.5,0.0
256,12928,3072,3072,ck,0,0,188.6042,a8w8_blockscale_1x128x128_256x128x128x128_16x16_32x32_2x2_8x32x1_8x32x1_1x32x1x8_8_1x1_intrawave_v3,1293.76,681.75,0.0
256,12928,3072,6144,ck,0,0,344.3726,a8w8_blockscale_1x128x128_256x128x128x128_16x16_32x32_2x2_8x32x1_8x32x1_1x32x1x8_8_1x1_intrawave_v3,1417.12,516.11,0.0
256,13056,3072,3072,ck,0,0,190.0833,a8w8_blockscale_1x128x128_256x128x128x128_16x16_32x32_2x2_8x32x1_8x32x1_1x32x1x8_8_1x1_intrawave_v3,1296.4,682.65,0.0
256,13056,3072,6144,ck,0,0,343.2987,a8w8_blockscale_1x128x128_256x128x128x128_16x16_32x32_2x2_8x32x1_8x32x1_1x32x1x8_8_1x1_intrawave_v3,1435.62,522.3,0.0
256,13145,3072,3072,ck,0,0,188.3165,a8w8_blockscale_1x128x128_256x128x128x128_16x16_32x32_2x2_8x32x1_8x32x1_1x32x1x8_8_1x1_intrawave_v3,1317.48,693.42,0.0
256,13184,3072,3072,ck,0,0,188.8121,a8w8_blockscale_1x128x128_256x128x128x128_16x16_32x32_2x2_8x32x1_8x32x1_1x32x1x8_8_1x1_intrawave_v3,1317.92,693.5,0.0
256,13184,3072,6144,ck,0,0,344.785,a8w8_blockscale_1x128x128_256x128x128x128_16x16_32x32_2x2_8x32x1_8x32x1_1x32x1x8_8_1x1_intrawave_v3,1443.45,524.61,0.0
256,13312,3072,3072,ck,0,0,190.0643,a8w8_blockscale_1x128x128_256x128x128x128_16x16_32x32_2x2_8x32x1_8x32x1_1x32x1x8_8_1x1_intrawave_v3,1321.95,695.14,0.0
256,13312,3072,6144,ck,0,0,349.0233,a8w8_blockscale_1x128x128_256x128x128x128_16x16_32x32_2x2_8x32x1_8x32x1_1x32x1x8_8_1x1_intrawave_v3,1439.76,522.75,0.0
256,13332,3072,6144,ck,0,0,353.2013,a8w8_blockscale_1x128x128_256x128x128x128_16x16_32x32_2x2_8x32x1_8x32x1_1x32x1x8_8_1x1_intrawave_v3,1424.87,517.26,0.0
256,13440,3072,3072,ck,0,0,192.0218,a8w8_blockscale_1x128x128_256x128x128x128_16x16_32x32_2x2_8x32x1_8x32x1_1x32x1x8_8_1x1_intrawave_v3,1321.06,694.19,0.0
256,13440,3072,6144,ck,0,0,356.5206,a8w8_blockscale_1x128x128_256x128x128x128_16x16_32x32_2x2_8x32x1_8x32x1_1x32x1x8_8_1x1_intrawave_v3,1423.04,516.17,0.0
256,13568,3072,3072,ck,0,0,191.9169,a8w8_blockscale_1x128x128_256x128x128x128_16x16_32x32_2x2_8x32x1_8x32x1_1x32x1x8_8_1x1_intrawave_v3,1334.37,700.72,0.0
256,13568,3072,6144,ck,0,0,354.6849,a8w8_blockscale_1x128x128_256x128x128x128_16x16_32x32_2x2_8x32x1_8x32x1_1x32x1x8_8_1x1_intrawave_v3,1444.03,523.28,0.0
256,13663,3072,3072,ck,0,0,199.0316,a8w8_blockscale_1x128x128_256x128x128x128_16x16_32x32_2x2_8x32x1_8x32x1_1x32x1x8_8_1x1_intrawave_v3,1295.68,680.07,0.0
256,13696,3072,3072,ck,0,0,201.0007,a8w8_blockscale_1x128x128_256x128x128x128_16x16_32x32_2x2_8x32x1_8x32x1_1x32x1x8_8_1x1_intrawave_v3,1286.08,674.92,0.0
256,13696,3072,6144,ck,0,0,366.559,a8w8_blockscale_1x128x128_256x128x128x128_16x16_32x32_2x2_8x32x1_8x32x1_1x32x1x8_8_1x1_intrawave_v3,1410.43,510.62,0.0
256,13824,3072,3072,ck,0,0,202.5572,a8w8_blockscale_1x128x128_256x128x128x128_16x16_32x32_2x2_8x32x1_8x32x1_1x32x1x8_8_1x1_intrawave_v3,1288.13,675.56,0.0
256,13824,3072,6144,ck,0,0,371.0137,a8w8_blockscale_1x128x128_256x128x128x128_16x16_32x32_2x2_8x32x1_8x32x1_1x32x1x8_8_1x1_intrawave_v3,1406.52,508.72,0.0
256,13952,3072,3072,ck,0,0,204.5074,a8w8_blockscale_1x128x128_256x128x128x128_16x16_32x32_2x2_8x32x1_8x32x1_1x32x1x8_8_1x1_intrawave_v3,1287.66,674.88,0.0
256,13952,3072,6144,ck,0,0,371.7074,a8w8_blockscale_1x128x128_256x128x128x128_16x16_32x32_2x2_8x32x1_8x32x1_1x32x1x8_8_1x1_intrawave_v3,1416.9,512.01,0.0
256,14007,3072,6144,ck,0,0,373.8796,a8w8_blockscale_1x128x128_256x128x128x128_16x16_32x32_2x2_8x32x1_8x32x1_1x32x1x8_8_1x1_intrawave_v3,1414.22,510.84,0.0
256,14010,3072,6144,ck,0,0,371.3313,a8w8_blockscale_1x128x128_256x128x128x128_16x16_32x32_2x2_8x32x1_8x32x1_1x32x1x8_8_1x1_intrawave_v3,1424.23,514.44,0.0
256,14080,3072,3072,ck,0,0,202.6711,a8w8_blockscale_1x128x128_256x128x128x128_16x16_32x32_2x2_8x32x1_8x32x1_1x32x1x8_8_1x1_intrawave_v3,1311.24,686.82,0.0
256,14080,3072,6144,ck,0,0,375.6026,a8w8_blockscale_1x128x128_256x128x128x128_16x16_32x32_2x2_8x32x1_8x32x1_1x32x1x8_8_1x1_intrawave_v3,1415.07,510.88,0.0
256,14208,3072,3072,ck,0,0,208.0039,a8w8_blockscale_1x128x128_256x128x128x128_16x16_32x32_2x2_8x32x1_8x32x1_1x32x1x8_8_1x1_intrawave_v3,1289.24,674.88,0.0
256,14208,3072,6144,ck,0,0,378.302,a8w8_blockscale_1x128x128_256x128x128x128_16x16_32x32_2x2_8x32x1_8x32x1_1x32x1x8_8_1x1_intrawave_v3,1417.74,511.4,0.0
256,14305,3072,3072,ck,0,0,200.2256,a8w8_blockscale_1x128x128_256x128x128x128_16x16_32x32_2x2_8x32x1_8x32x1_1x32x1x8_8_1x1_intrawave_v3,1348.47,705.56,0.0
256,14336,3072,3072,ck,0,0,199.9708,a8w8_blockscale_1x128x128_256x128x128x128_16x16_32x32_2x2_8x32x1_8x32x1_1x32x1x8_8_1x1_intrawave_v3,1353.11,707.89,0.0
256,14336,3072,6144,ck,0,0,375.2761,a8w8_blockscale_1x128x128_256x128x128x128_16x16_32x32_2x2_8x32x1_8x32x1_1x32x1x8_8_1x1_intrawave_v3,1442.05,519.71,0.0
256,14464,3072,3072,ck,0,0,206.4342,a8w8_blockscale_1x128x128_256x128x128x128_16x16_32x32_2x2_8x32x1_8x32x1_1x32x1x8_8_1x1_intrawave_v3,1322.45,691.44,0.0
256,14464,3072,6144,ck,0,0,376.4022,a8w8_blockscale_1x128x128_256x128x128x128_16x16_32x32_2x2_8x32x1_8x32x1_1x32x1x8_8_1x1_intrawave_v3,1450.57,522.33,0.0
256,14497,3072,6144,ck,0,0,389.0357,a8w8_blockscale_1x128x128_256x128x128x128_16x16_32x32_2x2_8x32x1_8x32x1_1x32x1x8_8_1x1_intrawave_v3,1406.67,506.41,0.0
256,14531,3072,6144,ck,0,0,387.5461,a8w8_blockscale_1x128x128_256x128x128x128_16x16_32x32_2x2_8x32x1_8x32x1_1x32x1x8_8_1x1_intrawave_v3,1415.38,509.44,0.0
256,14592,3072,3072,ck,0,0,208.0008,a8w8_blockscale_1x128x128_256x128x128x128_16x16_32x32_2x2_8x32x1_8x32x1_1x32x1x8_8_1x1_intrawave_v3,1324.1,691.91,0.0
256,14592,3072,6144,ck,0,0,383.3522,a8w8_blockscale_1x128x128_256x128x128x128_16x16_32x32_2x2_8x32x1_8x32x1_1x32x1x8_8_1x1_intrawave_v3,1436.88,516.97,0.0
256,14720,3072,3072,ck,0,0,203.1284,a8w8_blockscale_1x128x128_256x128x128x128_16x16_32x32_2x2_8x32x1_8x32x1_1x32x1x8_8_1x1_intrawave_v3,1367.76,714.31,0.0
256,14720,3072,6144,ck,0,0,390.5158,a8w8_blockscale_1x128x128_256x128x128x128_16x16_32x32_2x2_8x32x1_8x32x1_1x32x1x8_8_1x1_intrawave_v3,1422.89,511.51,0.0
256,14848,3072,3072,ck,0,0,207.2597,a8w8_blockscale_1x128x128_256x128x128x128_16x16_32x32_2x2_8x32x1_8x32x1_1x32x1x8_8_1x1_intrawave_v3,1352.15,705.76,0.0
256,14848,3072,6144,ck,0,0,396.3949,a8w8_blockscale_1x128x128_256x128x128x128_16x16_32x32_2x2_8x32x1_8x32x1_1x32x1x8_8_1x1_intrawave_v3,1413.98,507.89,0.0
256,14976,3072,3072,ck,0,0,210.7456,a8w8_blockscale_1x128x128_256x128x128x128_16x16_32x32_2x2_8x32x1_8x32x1_1x32x1x8_8_1x1_intrawave_v3,1341.25,699.69,0.0
256,14976,3072,6144,ck,0,0,383.348,a8w8_blockscale_1x128x128_256x128x128x128_16x16_32x32_2x2_8x32x1_8x32x1_1x32x1x8_8_1x1_intrawave_v3,1474.7,529.28,0.0
256,15016,3072,6144,ck,0,0,401.24,a8w8_blockscale_1x128x128_256x128x128x128_16x16_32x32_2x2_8x32x1_8x32x1_1x32x1x8_8_1x1_intrawave_v3,1412.71,506.91,0.0
256,15104,3072,3072,ck,0,0,219.2804,a8w8_blockscale_1x128x128_256x128x128x128_16x16_32x32_2x2_8x32x1_8x32x1_1x32x1x8_8_1x1_intrawave_v3,1300.06,677.83,0.0
256,15104,3072,6144,ck,0,0,401.1748,a8w8_blockscale_1x128x128_256x128x128x128_16x16_32x32_2x2_8x32x1_8x32x1_1x32x1x8_8_1x1_intrawave_v3,1421.22,509.68,0.0
256,15125,3072,3072,ck,0,0,222.3559,a8w8_blockscale_1x128x128_256x128x128x128_16x16_32x32_2x2_8x32x1_8x32x1_1x32x1x8_8_1x1_intrawave_v3,1283.86,669.33,0.0
256,15226,3072,6144,ck,0,0,411.0188,a8w8_blockscale_1x128x128_256x128x128x128_16x16_32x32_2x2_8x32x1_8x32x1_1x32x1x8_8_1x1_intrawave_v3,1398.38,501.12,0.0
256,15232,3072,3072,ck,0,0,214.8505,a8w8_blockscale_1x128x128_256x128x128x128_16x16_32x32_2x2_8x32x1_8x32x1_1x32x1x8_8_1x1_intrawave_v3,1338.11,697.3,0.0
256,15232,3072,6144,ck,0,0,405.5899,a8w8_blockscale_1x128x128_256x128x128x128_16x16_32x32_2x2_8x32x1_8x32x1_1x32x1x8_8_1x1_intrawave_v3,1417.66,508.01,0.0
256,15234,3072,3072,ck,0,0,213.3005,a8w8_blockscale_1x128x128_256x128x128x128_16x16_32x32_2x2_8x32x1_8x32x1_1x32x1x8_8_1x1_intrawave_v3,1348.01,702.45,0.0
256,15237,3072,3072,ck,0,0,216.3418,a8w8_blockscale_1x128x128_256x128x128x128_16x16_32x32_2x2_8x32x1_8x32x1_1x32x1x8_8_1x1_intrawave_v3,1329.33,692.71,0.0
256,15240,3072,3072,ck,0,0,215.0542,a8w8_blockscale_1x128x128_256x128x128x128_16x16_32x32_2x2_8x32x1_8x32x1_1x32x1x8_8_1x1_intrawave_v3,1337.55,696.98,0.0
256,15241,3072,6144,ck,0,0,407.2091,a8w8_blockscale_1x128x128_256x128x128x128_16x16_32x32_2x2_8x32x1_8x32x1_1x32x1x8_8_1x1_intrawave_v3,1412.86,506.27,0.0
256,15360,3072,3072,ck,0,0,221.4056,a8w8_blockscale_1x128x128_256x128x128x128_16x16_32x32_2x2_8x32x1_8x32x1_1x32x1x8_8_1x1_intrawave_v3,1309.41,681.98,0.0
256,15360,3072,6144,ck,0,0,402.6528,a8w8_blockscale_1x128x128_256x128x128x128_16x16_32x32_2x2_8x32x1_8x32x1_1x32x1x8_8_1x1_intrawave_v3,1440.0,515.63,0.0
256,15488,3072,3072,ck,0,0,218.7865,a8w8_blockscale_1x128x128_256x128x128x128_16x16_32x32_2x2_8x32x1_8x32x1_1x32x1x8_8_1x1_intrawave_v3,1336.13,695.54,0.0
256,15488,3072,6144,ck,0,0,407.7364,a8w8_blockscale_1x128x128_256x128x128x128_16x16_32x32_2x2_8x32x1_8x32x1_1x32x1x8_8_1x1_intrawave_v3,1433.9,513.05,0.0
256,15616,3072,3072,ck,0,0,218.8754,a8w8_blockscale_1x128x128_256x128x128x128_16x16_32x32_2x2_8x32x1_8x32x1_1x32x1x8_8_1x1_intrawave_v3,1346.62,700.65,0.0
256,15616,3072,6144,ck,0,0,409.5328,a8w8_blockscale_1x128x128_256x128x128x128_16x16_32x32_2x2_8x32x1_8x32x1_1x32x1x8_8_1x1_intrawave_v3,1439.41,514.64,0.0
256,15744,3072,3072,ck,0,0,221.9768,a8w8_blockscale_1x128x128_256x128x128x128_16x16_32x32_2x2_8x32x1_8x32x1_1x32x1x8_8_1x1_intrawave_v3,1338.69,696.17,0.0
256,15744,3072,6144,ck,0,0,411.4888,a8w8_blockscale_1x128x128_256x128x128x128_16x16_32x32_2x2_8x32x1_8x32x1_1x32x1x8_8_1x1_intrawave_v3,1444.31,516.02,0.0
256,15786,3072,6144,ck,0,0,411.953,a8w8_blockscale_1x128x128_256x128x128x128_16x16_32x32_2x2_8x32x1_8x32x1_1x32x1x8_8_1x1_intrawave_v3,1446.53,516.69,0.0
256,15820,3072,3072,ck,0,0,224.4759,a8w8_blockscale_1x128x128_256x128x128x128_16x16_32x32_2x2_8x32x1_8x32x1_1x32x1x8_8_1x1_intrawave_v3,1330.18,691.54,0.0
256,15872,3072,3072,ck,0,0,222.3063,a8w8_blockscale_1x128x128_256x128x128x128_16x16_32x32_2x2_8x32x1_8x32x1_1x32x1x8_8_1x1_intrawave_v3,1347.57,700.45,0.0
256,15872,3072,6144,ck,0,0,416.3552,a8w8_blockscale_1x128x128_256x128x128x128_16x16_32x32_2x2_8x32x1_8x32x1_1x32x1x8_8_1x1_intrawave_v3,1439.03,513.77,0.0
256,15887,3072,6144,ck,0,0,415.5243,a8w8_blockscale_1x128x128_256x128x128x128_16x16_32x32_2x2_8x32x1_8x32x1_1x32x1x8_8_1x1_intrawave_v3,1443.27,515.24,0.0
256,16000,3072,3072,ck,0,0,227.3966,a8w8_blockscale_1x128x128_256x128x128x128_16x16_32x32_2x2_8x32x1_8x32x1_1x32x1x8_8_1x1_intrawave_v3,1328.03,689.95,0.0
256,16000,3072,6144,ck,0,0,420.1625,a8w8_blockscale_1x128x128_256x128x128x128_16x16_32x32_2x2_8x32x1_8x32x1_1x32x1x8_8_1x1_intrawave_v3,1437.49,512.85,0.0
256,16003,3072,3072,ck,0,0,227.0163,a8w8_blockscale_1x128x128_256x128x128x128_16x16_32x32_2x2_8x32x1_8x32x1_1x32x1x8_8_1x1_intrawave_v3,1330.51,691.23,0.0
256,16080,3072,3072,ck,0,0,220.7286,a8w8_blockscale_1x128x128_256x128x128x128_16x16_32x32_2x2_8x32x1_8x32x1_1x32x1x8_8_1x1_intrawave_v3,1374.99,714.14,0.0
256,16128,3072,3072,ck,0,0,225.6175,a8w8_blockscale_1x128x128_256x128x128x128_16x16_32x32_2x2_8x32x1_8x32x1_1x32x1x8_8_1x1_intrawave_v3,1349.21,700.62,0.0
256,16128,3072,6144,ck,0,0,427.3047,a8w8_blockscale_1x128x128_256x128x128x128_16x16_32x32_2x2_8x32x1_8x32x1_1x32x1x8_8_1x1_intrawave_v3,1424.77,507.96,0.0
256,16138,3072,6144,ck,0,0,427.1487,a8w8_blockscale_1x128x128_256x128x128x128_16x16_32x32_2x2_8x32x1_8x32x1_1x32x1x8_8_1x1_intrawave_v3,1426.18,508.44,0.0
256,16141,3072,6144,ck,0,0,430.1437,a8w8_blockscale_1x128x128_256x128x128x128_16x16_32x32_2x2_8x32x1_8x32x1_1x32x1x8_8_1x1_intrawave_v3,1416.51,504.98,0.0
256,16256,3072,3072,ck,0,0,225.9062,a8w8_blockscale_1x128x128_256x128x128x128_16x16_32x32_2x2_8x32x1_8x32x1_1x32x1x8_8_1x1_intrawave_v3,1358.18,704.95,0.0
256,16256,3072,6144,ck,0,0,424.6449,a8w8_blockscale_1x128x128_256x128x128x128_16x16_32x32_2x2_8x32x1_8x32x1_1x32x1x8_8_1x1_intrawave_v3,1445.07,514.85,0.0
256,16263,3072,6144,ck,0,0,422.6621,a8w8_blockscale_1x128x128_256x128x128x128_16x16_32x32_2x2_8x32x1_8x32x1_1x32x1x8_8_1x1_intrawave_v3,1452.48,517.47,0.0
256,16384,3072,3072,ck,0,0,227.7282,a8w8_blockscale_1x128x128_256x128x128x128_16x16_32x32_2x2_8x32x1_8x32x1_1x32x1x8_8_1x1_intrawave_v3,1357.92,704.49,0.0
256,16384,3072,6144,ck,0,0,419.889,a8w8_blockscale_1x128x128_256x128x128x128_16x16_32x32_2x2_8x32x1_8x32x1_1x32x1x8_8_1x1_intrawave_v3,1472.95,524.43,0.0
256,16512,3072,3072,ck,0,0,234.8488,a8w8_blockscale_1x128x128_256x128x128x128_16x16_32x32_2x2_8x32x1_8x32x1_1x32x1x8_8_1x1_intrawave_v3,1327.04,688.15,0.0
256,16512,3072,6144,ck,0,0,435.5964,a8w8_blockscale_1x128x128_256x128x128x128_16x16_32x32_2x2_8x32x1_8x32x1_1x32x1x8_8_1x1_intrawave_v3,1430.93,509.13,0.0
256,16640,3072,3072,ck,0,0,234.9146,a8w8_blockscale_1x128x128_256x128x128x128_16x16_32x32_2x2_8x32x1_8x32x1_1x32x1x8_8_1x1_intrawave_v3,1336.95,692.98,0.0
256,16640,3072,6144,ck,0,0,437.5944,a8w8_blockscale_1x128x128_256x128x128x128_16x16_32x32_2x2_8x32x1_8x32x1_1x32x1x8_8_1x1_intrawave_v3,1435.44,510.4,0.0
256,16768,3072,3072,ck,0,0,237.5638,a8w8_blockscale_1x128x128_256x128x128x128_16x16_32x32_2x2_8x32x1_8x32x1_1x32x1x8_8_1x1_intrawave_v3,1332.21,690.22,0.0
256,16768,3072,6144,ck,0,0,440.1017,a8w8_blockscale_1x128x128_256x128x128x128_16x16_32x32_2x2_8x32x1_8x32x1_1x32x1x8_8_1x1_intrawave_v3,1438.24,511.06,0.0
256,16896,3072,3072,ck,0,0,235.8245,a8w8_blockscale_1x128x128_256x128x128x128_16x16_32x32_2x2_8x32x1_8x32x1_1x32x1x8_8_1x1_intrawave_v3,1352.28,700.31,0.0
256,16896,3072,6144,ck,0,0,438.6069,a8w8_blockscale_1x128x128_256x128x128x128_16x16_32x32_2x2_8x32x1_8x32x1_1x32x1x8_8_1x1_intrawave_v3,1454.16,516.39,0.0
256,17024,3072,3072,ck,0,0,235.8885,a8w8_blockscale_1x128x128_256x128x128x128_16x16_32x32_2x2_8x32x1_8x32x1_1x32x1x8_8_1x1_intrawave_v3,1362.16,705.12,0.0
256,17024,3072,6144,ck,0,0,437.3528,a8w8_blockscale_1x128x128_256x128x128x128_16x16_32x32_2x2_8x32x1_8x32x1_1x32x1x8_8_1x1_intrawave_v3,1469.37,521.47,0.0
256,17152,3072,3072,ck,0,0,245.7052,a8w8_blockscale_1x128x128_256x128x128x128_16x16_32x32_2x2_8x32x1_8x32x1_1x32x1x8_8_1x1_intrawave_v3,1317.57,681.75,0.0
256,17152,3072,6144,ck,0,0,441.2238,a8w8_blockscale_1x128x128_256x128x128x128_16x16_32x32_2x2_8x32x1_8x32x1_1x32x1x8_8_1x1_intrawave_v3,1467.43,520.46,0.0
256,17280,3072,3072,ck,0,0,239.0545,a8w8_blockscale_1x128x128_256x128x128x128_16x16_32x32_2x2_8x32x1_8x32x1_1x32x1x8_8_1x1_intrawave_v3,1364.33,705.65,0.0
256,17280,3072,6144,ck,0,0,444.9009,a8w8_blockscale_1x128x128_256x128x128x128_16x16_32x32_2x2_8x32x1_8x32x1_1x32x1x8_8_1x1_intrawave_v3,1466.17,519.69,0.0
256,17408,3072,3072,ck,0,0,238.9888,a8w8_blockscale_1x128x128_256x128x128x128_16x16_32x32_2x2_8x32x1_8x32x1_1x32x1x8_8_1x1_intrawave_v3,1374.81,710.78,0.0
256,17408,3072,6144,ck,0,0,448.2376,a8w8_blockscale_1x128x128_256x128x128x128_16x16_32x32_2x2_8x32x1_8x32x1_1x32x1x8_8_1x1_intrawave_v3,1466.03,519.33,0.0
256,17536,3072,3072,ck,0,0,245.5578,a8w8_blockscale_1x128x128_256x128x128x128_16x16_32x32_2x2_8x32x1_8x32x1_1x32x1x8_8_1x1_intrawave_v3,1347.87,696.57,0.0
256,17536,3072,6144,ck,0,0,454.9901,a8w8_blockscale_1x128x128_256x128x128x128_16x16_32x32_2x2_8x32x1_8x32x1_1x32x1x8_8_1x1_intrawave_v3,1454.89,515.08,0.0
256,17664,3072,3072,ck,0,0,243.8646,a8w8_blockscale_1x128x128_256x128x128x128_16x16_32x32_2x2_8x32x1_8x32x1_1x32x1x8_8_1x1_intrawave_v3,1367.14,706.25,0.0
256,17664,3072,6144,ck,0,0,455.0306,a8w8_blockscale_1x128x128_256x128x128x128_16x16_32x32_2x2_8x32x1_8x32x1_1x32x1x8_8_1x1_intrawave_v3,1465.38,518.49,0.0
256,17792,3072,3072,ck,0,0,242.3932,a8w8_blockscale_1x128x128_256x128x128x128_16x16_32x32_2x2_8x32x1_8x32x1_1x32x1x8_8_1x1_intrawave_v3,1385.41,715.4,0.0
256,17792,3072,6144,ck,0,0,462.1634,a8w8_blockscale_1x128x128_256x128x128x128_16x16_32x32_2x2_8x32x1_8x32x1_1x32x1x8_8_1x1_intrawave_v3,1453.22,513.89,0.0
256,17920,3072,3072,ck,0,0,252.5685,a8w8_blockscale_1x128x128_256x128x128x128_16x16_32x32_2x2_8x32x1_8x32x1_1x32x1x8_8_1x1_intrawave_v3,1339.16,691.25,0.0
256,17920,3072,6144,ck,0,0,462.4339,a8w8_blockscale_1x128x128_256x128x128x128_16x16_32x32_2x2_8x32x1_8x32x1_1x32x1x8_8_1x1_intrawave_v3,1462.82,516.99,0.0
256,18048,3072,3072,ck,0,0,252.9574,a8w8_blockscale_1x128x128_256x128x128x128_16x16_32x32_2x2_8x32x1_8x32x1_1x32x1x8_8_1x1_intrawave_v3,1346.65,694.85,0.0
256,18048,3072,6144,ck,0,0,466.1725,a8w8_blockscale_1x128x128_256x128x128x128_16x16_32x32_2x2_8x32x1_8x32x1_1x32x1x8_8_1x1_intrawave_v3,1461.45,516.22,0.0
256,18176,3072,3072,ck,0,0,257.4887,a8w8_blockscale_1x128x128_256x128x128x128_16x16_32x32_2x2_8x32x1_8x32x1_1x32x1x8_8_1x1_intrawave_v3,1332.33,687.2,0.0
256,18176,3072,6144,ck,0,0,471.9685,a8w8_blockscale_1x128x128_256x128x128x128_16x16_32x32_2x2_8x32x1_8x32x1_1x32x1x8_8_1x1_intrawave_v3,1453.74,513.21,0.0
256,18304,3072,3072,ck,0,0,255.5736,a8w8_blockscale_1x128x128_256x128x128x128_16x16_32x32_2x2_8x32x1_8x32x1_1x32x1x8_8_1x1_intrawave_v3,1351.77,696.97,0.0
256,18304,3072,6144,ck,0,0,474.2157,a8w8_blockscale_1x128x128_256x128x128x128_16x16_32x32_2x2_8x32x1_8x32x1_1x32x1x8_8_1x1_intrawave_v3,1457.04,514.1,0.0
256,18432,3072,3072,ck,0,0,256.5762,a8w8_blockscale_1x128x128_256x128x128x128_16x16_32x32_2x2_8x32x1_8x32x1_1x32x1x8_8_1x1_intrawave_v3,1355.9,698.84,0.0
256,18432,3072,6144,ck,0,0,486.7686,a8w8_blockscale_1x128x128_256x128x128x128_16x16_32x32_2x2_8x32x1_8x32x1_1x32x1x8_8_1x1_intrawave_v3,1429.4,504.07,0.0
256,18560,3072,3072,ck,0,0,255.1499,a8w8_blockscale_1x128x128_256x128x128x128_16x16_32x32_2x2_8x32x1_8x32x1_1x32x1x8_8_1x1_intrawave_v3,1372.95,707.37,0.0
256,18560,3072,6144,ck,0,0,477.3626,a8w8_blockscale_1x128x128_256x128x128x128_16x16_32x32_2x2_8x32x1_8x32x1_1x32x1x8_8_1x1_intrawave_v3,1467.68,517.3,0.0
256,18688,3072,3072,ck,0,0,255.3478,a8w8_blockscale_1x128x128_256x128x128x128_16x16_32x32_2x2_8x32x1_8x32x1_1x32x1x8_8_1x1_intrawave_v3,1381.35,711.44,0.0
256,18688,3072,6144,ck,0,0,481.0742,a8w8_blockscale_1x128x128_256x128x128x128_16x16_32x32_2x2_8x32x1_8x32x1_1x32x1x8_8_1x1_intrawave_v3,1466.4,516.58,0.0
256,18816,3072,3072,ck,0,0,261.3272,a8w8_blockscale_1x128x128_256x128x128x128_16x16_32x32_2x2_8x32x1_8x32x1_1x32x1x8_8_1x1_intrawave_v3,1358.99,699.68,0.0
256,18816,3072,6144,ck,0,0,486.0756,a8w8_blockscale_1x128x128_256x128x128x128_16x16_32x32_2x2_8x32x1_8x32x1_1x32x1x8_8_1x1_intrawave_v3,1461.25,514.5,0.0
256,18944,3072,3072,ck,0,0,259.7054,a8w8_blockscale_1x128x128_256x128x128x128_16x16_32x32_2x2_8x32x1_8x32x1_1x32x1x8_8_1x1_intrawave_v3,1376.78,708.59,0.0
256,18944,3072,6144,ck,0,0,485.1001,a8w8_blockscale_1x128x128_256x128x128x128_16x16_32x32_2x2_8x32x1_8x32x1_1x32x1x8_8_1x1_intrawave_v3,1474.15,518.78,0.0
256,19072,3072,3072,ck,0,0,262.1854,a8w8_blockscale_1x128x128_256x128x128x128_16x16_32x32_2x2_8x32x1_8x32x1_1x32x1x8_8_1x1_intrawave_v3,1372.97,706.39,0.0
256,19072,3072,6144,ck,0,0,486.7595,a8w8_blockscale_1x128x128_256x128x128x128_16x16_32x32_2x2_8x32x1_8x32x1_1x32x1x8_8_1x1_intrawave_v3,1479.05,520.24,0.0
256,19200,3072,3072,ck,0,0,256.3666,a8w8_blockscale_1x128x128_256x128x128x128_16x16_32x32_2x2_8x32x1_8x32x1_1x32x1x8_8_1x1_intrawave_v3,1413.55,727.02,0.0
256,19200,3072,6144,ck,0,0,495.0118,a8w8_blockscale_1x128x128_256x128x128x128_16x16_32x32_2x2_8x32x1_8x32x1_1x32x1x8_8_1x1_intrawave_v3,1464.16,514.74,0.0
256,19328,3072,3072,ck,0,0,262.4658,a8w8_blockscale_1x128x128_256x128x128x128_16x16_32x32_2x2_8x32x1_8x32x1_1x32x1x8_8_1x1_intrawave_v3,1389.91,714.62,0.0
256,19328,3072,6144,ck,0,0,498.2564,a8w8_blockscale_1x128x128_256x128x128x128_16x16_32x32_2x2_8x32x1_8x32x1_1x32x1x8_8_1x1_intrawave_v3,1464.32,514.55,0.0
256,19456,3072,3072,ck,0,0,261.3672,a8w8_blockscale_1x128x128_256x128x128x128_16x16_32x32_2x2_8x32x1_8x32x1_1x32x1x8_8_1x1_intrawave_v3,1405.0,722.14,0.0
256,19456,3072,6144,ck,0,0,496.5428,a8w8_blockscale_1x128x128_256x128x128x128_16x16_32x32_2x2_8x32x1_8x32x1_1x32x1x8_8_1x1_intrawave_v3,1479.11,519.49,0.0
256,19584,3072,3072,ck,0,0,268.7075,a8w8_blockscale_1x128x128_256x128x128x128_16x16_32x32_2x2_8x32x1_8x32x1_1x32x1x8_8_1x1_intrawave_v3,1375.61,706.8,0.0
256,19584,3072,6144,ck,0,0,501.0424,a8w8_blockscale_1x128x128_256x128x128x128_16x16_32x32_2x2_8x32x1_8x32x1_1x32x1x8_8_1x1_intrawave_v3,1475.47,517.97,0.0
256,19712,3072,3072,ck,0,0,273.372,a8w8_blockscale_1x128x128_256x128x128x128_16x16_32x32_2x2_8x32x1_8x32x1_1x32x1x8_8_1x1_intrawave_v3,1360.97,699.06,0.0
256,19712,3072,6144,ck,0,0,506.2119,a8w8_blockscale_1x128x128_256x128x128x128_16x16_32x32_2x2_8x32x1_8x32x1_1x32x1x8_8_1x1_intrawave_v3,1469.94,515.78,0.0
256,19840,3072,3072,ck,0,0,273.969,a8w8_blockscale_1x128x128_256x128x128x128_16x16_32x32_2x2_8x32x1_8x32x1_1x32x1x8_8_1x1_intrawave_v3,1366.82,701.84,0.0
256,19840,3072,6144,ck,0,0,506.6085,a8w8_blockscale_1x128x128_256x128x128x128_16x16_32x32_2x2_8x32x1_8x32x1_1x32x1x8_8_1x1_intrawave_v3,1478.33,518.48,0.0
256,19968,3072,3072,ck,0,0,275.7419,a8w8_blockscale_1x128x128_256x128x128x128_16x16_32x32_2x2_8x32x1_8x32x1_1x32x1x8_8_1x1_intrawave_v3,1366.8,701.61,0.0
256,19968,3072,6144,ck,0,0,512.604,a8w8_blockscale_1x128x128_256x128x128x128_16x16_32x32_2x2_8x32x1_8x32x1_1x32x1x8_8_1x1_intrawave_v3,1470.47,515.49,0.0
256,20096,3072,3072,ck,0,0,276.8822,a8w8_blockscale_1x128x128_256x128x128x128_16x16_32x32_2x2_8x32x1_8x32x1_1x32x1x8_8_1x1_intrawave_v3,1369.89,702.98,0.0
256,20096,3072,6144,ck,0,0,518.798,a8w8_blockscale_1x128x128_256x128x128x128_16x16_32x32_2x2_8x32x1_8x32x1_1x32x1x8_8_1x1_intrawave_v3,1462.22,512.37,0.0
256,20224,3072,3072,ck,0,0,271.1017,a8w8_blockscale_1x128x128_256x128x128x128_16x16_32x32_2x2_8x32x1_8x32x1_1x32x1x8_8_1x1_intrawave_v3,1408.01,722.32,0.0
256,20224,3072,6144,ck,0,0,519.4027,a8w8_blockscale_1x128x128_256x128x128x128_16x16_32x32_2x2_8x32x1_8x32x1_1x32x1x8_8_1x1_intrawave_v3,1469.82,514.8,0.0
256,20352,3072,3072,ck,0,0,283.5056,a8w8_blockscale_1x128x128_256x128x128x128_16x16_32x32_2x2_8x32x1_8x32x1_1x32x1x8_8_1x1_intrawave_v3,1354.93,694.88,0.0
256,20352,3072,6144,ck,0,0,524.6518,a8w8_blockscale_1x128x128_256x128x128x128_16x16_32x32_2x2_8x32x1_8x32x1_1x32x1x8_8_1x1_intrawave_v3,1464.33,512.64,0.0
256,20480,3072,3072,ck,0,0,274.6493,a8w8_blockscale_1x128x128_256x128x128x128_16x16_32x32_2x2_8x32x1_8x32x1_1x32x1x8_8_1x1_intrawave_v3,1407.42,721.58,0.0
256,20608,3072,3072,ck,0,0,282.3424,a8w8_blockscale_1x128x128_256x128x128x128_16x16_32x32_2x2_8x32x1_8x32x1_1x32x1x8_8_1x1_intrawave_v3,1377.63,706.09,0.0
256,20736,3072,3072,ck,0,0,288.7839,a8w8_blockscale_1x128x128_256x128x128x128_16x16_32x32_2x2_8x32x1_8x32x1_1x32x1x8_8_1x1_intrawave_v3,1355.27,694.43,0.0
256,20736,3072,6144,ck,0,0,528.4051,a8w8_blockscale_1x128x128_256x128x128x128_16x16_32x32_2x2_8x32x1_8x32x1_1x32x1x8_8_1x1_intrawave_v3,1481.36,517.93,0.0
256,20864,3072,3072,ck,0,0,279.076,a8w8_blockscale_1x128x128_256x128x128x128_16x16_32x32_2x2_8x32x1_8x32x1_1x32x1x8_8_1x1_intrawave_v3,1411.07,722.81,0.0
256,20864,3072,6144,ck,0,0,535.2379,a8w8_blockscale_1x128x128_256x128x128x128_16x16_32x32_2x2_8x32x1_8x32x1_1x32x1x8_8_1x1_intrawave_v3,1471.48,514.26,0.0
256,20992,3072,3072,ck,0,0,283.3129,a8w8_blockscale_1x128x128_256x128x128x128_16x16_32x32_2x2_8x32x1_8x32x1_1x32x1x8_8_1x1_intrawave_v3,1398.49,716.17,0.0
256,20992,3072,6144,ck,0,0,533.25,a8w8_blockscale_1x128x128_256x128x128x128_16x16_32x32_2x2_8x32x1_8x32x1_1x32x1x8_8_1x1_intrawave_v3,1486.02,519.13,0.0
256,21120,3072,3072,ck,0,0,285.7087,a8w8_blockscale_1x128x128_256x128x128x128_16x16_32x32_2x2_8x32x1_8x32x1_1x32x1x8_8_1x1_intrawave_v3,1395.22,714.29,0.0
256,21120,3072,6144,ck,0,0,534.465,a8w8_blockscale_1x128x128_256x128x128x128_16x16_32x32_2x2_8x32x1_8x32x1_1x32x1x8_8_1x1_intrawave_v3,1491.68,520.89,0.0
256,21248,3072,3072,ck,0,0,282.8578,a8w8_blockscale_1x128x128_256x128x128x128_16x16_32x32_2x2_8x32x1_8x32x1_1x32x1x8_8_1x1_intrawave_v3,1417.82,725.66,0.0
256,21248,3072,6144,ck,0,0,534.2417,a8w8_blockscale_1x128x128_256x128x128x128_16x16_32x32_2x2_8x32x1_8x32x1_1x32x1x8_8_1x1_intrawave_v3,1501.35,524.05,0.0
256,21376,3072,3072,ck,0,0,287.8551,a8w8_blockscale_1x128x128_256x128x128x128_16x16_32x32_2x2_8x32x1_8x32x1_1x32x1x8_8_1x1_intrawave_v3,1401.6,717.16,0.0
256,21376,3072,6144,ck,0,0,538.7151,a8w8_blockscale_1x128x128_256x128x128x128_16x16_32x32_2x2_8x32x1_8x32x1_1x32x1x8_8_1x1_intrawave_v3,1497.85,522.62,0.0
256,21504,3072,3072,ck,0,0,278.5412,a8w8_blockscale_1x128x128_256x128x128x128_16x16_32x32_2x2_8x32x1_8x32x1_1x32x1x8_8_1x1_intrawave_v3,1457.14,745.38,0.0
256,21504,3072,6144,ck,0,0,541.7041,a8w8_blockscale_1x128x128_256x128x128x128_16x16_32x32_2x2_8x32x1_8x32x1_1x32x1x8_8_1x1_intrawave_v3,1498.51,522.64,0.0
256,21632,3072,3072,ck,0,0,287.553,a8w8_blockscale_1x128x128_256x128x128x128_16x16_32x32_2x2_8x32x1_8x32x1_1x32x1x8_8_1x1_intrawave_v3,1419.88,726.12,0.0
256,21632,3072,6144,ck,0,0,552.3685,a8w8_blockscale_1x128x128_256x128x128x128_16x16_32x32_2x2_8x32x1_8x32x1_1x32x1x8_8_1x1_intrawave_v3,1478.33,515.4,0.0
256,21760,3072,3072,ck,0,0,293.4698,a8w8_blockscale_1x128x128_256x128x128x128_16x16_32x32_2x2_8x32x1_8x32x1_1x32x1x8_8_1x1_intrawave_v3,1399.48,715.5,0.0
256,21760,3072,6144,ck,0,0,547.1153,a8w8_blockscale_1x128x128_256x128x128x128_16x16_32x32_2x2_8x32x1_8x32x1_1x32x1x8_8_1x1_intrawave_v3,1501.35,523.22,0.0
256,21888,3072,3072,ck,0,0,288.8823,a8w8_blockscale_1x128x128_256x128x128x128_16x16_32x32_2x2_8x32x1_8x32x1_1x32x1x8_8_1x1_intrawave_v3,1430.07,730.94,0.0
256,21888,3072,6144,ck,0,0,552.1857,a8w8_blockscale_1x128x128_256x128x128x128_16x16_32x32_2x2_8x32x1_8x32x1_1x32x1x8_8_1x1_intrawave_v3,1496.32,521.26,0.0
256,22016,3072,3072,ck,0,0,296.6671,a8w8_blockscale_1x128x128_256x128x128x128_16x16_32x32_2x2_8x32x1_8x32x1_1x32x1x8_8_1x1_intrawave_v3,1400.69,715.74,0.0
256,22016,3072,6144,ck,0,0,556.6004,a8w8_blockscale_1x128x128_256x128x128x128_16x16_32x32_2x2_8x32x1_8x32x1_1x32x1x8_8_1x1_intrawave_v3,1493.13,519.95,0.0
256,22144,3072,3072,ck,0,0,299.7356,a8w8_blockscale_1x128x128_256x128x128x128_16x16_32x32_2x2_8x32x1_8x32x1_1x32x1x8_8_1x1_intrawave_v3,1394.41,712.35,0.0
256,22144,3072,6144,ck,0,0,564.9844,a8w8_blockscale_1x128x128_256x128x128x128_16x16_32x32_2x2_8x32x1_8x32x1_1x32x1x8_8_1x1_intrawave_v3,1479.52,515.02,0.0
256,22272,3072,3072,ck,0,0,291.6237,a8w8_blockscale_1x128x128_256x128x128x128_16x16_32x32_2x2_8x32x1_8x32x1_1x32x1x8_8_1x1_intrawave_v3,1441.48,736.21,0.0
256,22272,3072,6144,ck,0,0,564.2111,a8w8_blockscale_1x128x128_256x128x128x128_16x16_32x32_2x2_8x32x1_8x32x1_1x32x1x8_8_1x1_intrawave_v3,1490.12,518.52,0.0
256,22400,3072,3072,ck,0,0,299.3488,a8w8_blockscale_1x128x128_256x128x128x128_16x16_32x32_2x2_8x32x1_8x32x1_1x32x1x8_8_1x1_intrawave_v3,1412.35,721.15,0.0
256,22400,3072,6144,ck,0,0,566.5828,a8w8_blockscale_1x128x128_256x128x128x128_16x16_32x32_2x2_8x32x1_8x32x1_1x32x1x8_8_1x1_intrawave_v3,1492.41,519.12,0.0
256,22528,3072,3072,ck,0,0,304.4912,a8w8_blockscale_1x128x128_256x128x128x128_16x16_32x32_2x2_8x32x1_8x32x1_1x32x1x8_8_1x1_intrawave_v3,1396.43,712.85,0.0
256,22528,3072,6144,ck,0,0,571.7677,a8w8_blockscale_1x128x128_256x128x128x128_16x16_32x32_2x2_8x32x1_8x32x1_1x32x1x8_8_1x1_intrawave_v3,1487.32,517.17,0.0
256,22656,3072,3072,ck,0,0,300.1848,a8w8_blockscale_1x128x128_256x128x128x128_16x16_32x32_2x2_8x32x1_8x32x1_1x32x1x8_8_1x1_intrawave_v3,1424.51,727.0,0.0
256,22656,3072,6144,ck,0,0,573.2816,a8w8_blockscale_1x128x128_256x128x128x128_16x16_32x32_2x2_8x32x1_8x32x1_1x32x1x8_8_1x1_intrawave_v3,1491.82,518.54,0.0
256,22784,3072,3072,ck,0,0,301.3929,a8w8_blockscale_1x128x128_256x128x128x128_16x16_32x32_2x2_8x32x1_8x32x1_1x32x1x8_8_1x1_intrawave_v3,1426.82,728.0,0.0
256,22784,3072,6144,ck,0,0,581.5652,a8w8_blockscale_1x128x128_256x128x128x128_16x16_32x32_2x2_8x32x1_8x32x1_1x32x1x8_8_1x1_intrawave_v3,1478.88,513.86,0.0
256,22912,3072,3072,ck,0,0,312.6766,a8w8_blockscale_1x128x128_256x128x128x128_16x16_32x32_2x2_8x32x1_8x32x1_1x32x1x8_8_1x1_intrawave_v3,1383.06,705.5,0.0
256,22912,3072,6144,ck,0,0,581.7566,a8w8_blockscale_1x128x128_256x128x128x128_16x16_32x32_2x2_8x32x1_8x32x1_1x32x1x8_8_1x1_intrawave_v3,1486.7,516.4,0.0
256,23040,3072,3072,ck,0,0,302.6691,a8w8_blockscale_1x128x128_256x128x128x128_16x16_32x32_2x2_8x32x1_8x32x1_1x32x1x8_8_1x1_intrawave_v3,1436.77,732.73,0.0
256,23040,3072,6144,ck,0,0,585.0439,a8w8_blockscale_1x128x128_256x128x128x128_16x16_32x32_2x2_8x32x1_8x32x1_1x32x1x8_8_1x1_intrawave_v3,1486.61,516.18,0.0
256,23168,3072,3072,ck,0,0,300.4629,a8w8_blockscale_1x128x128_256x128x128x128_16x16_32x32_2x2_8x32x1_8x32x1_1x32x1x8_8_1x1_intrawave_v3,1455.36,742.03,0.0
256,23168,3072,6144,ck,0,0,570.6791,a8w8_blockscale_1x128x128_256x128x128x128_16x16_32x32_2x2_8x32x1_8x32x1_1x32x1x8_8_1x1_intrawave_v3,1532.49,531.93,0.0
256,23296,3072,3072,ck,0,0,306.1145,a8w8_blockscale_1x128x128_256x128x128x128_16x16_32x32_2x2_8x32x1_8x32x1_1x32x1x8_8_1x1_intrawave_v3,1436.38,732.19,0.0
256,23296,3072,6144,ck,0,0,584.1071,a8w8_blockscale_1x128x128_256x128x128x128_16x16_32x32_2x2_8x32x1_8x32x1_1x32x1x8_8_1x1_intrawave_v3,1505.54,522.4,0.0
256,23424,3072,3072,ck,0,0,316.744,a8w8_blockscale_1x128x128_256x128x128x128_16x16_32x32_2x2_8x32x1_8x32x1_1x32x1x8_8_1x1_intrawave_v3,1395.81,711.34,0.0
256,23424,3072,6144,ck,0,0,588.7897,a8w8_blockscale_1x128x128_256x128x128x128_16x16_32x32_2x2_8x32x1_8x32x1_1x32x1x8_8_1x1_intrawave_v3,1501.77,520.91,0.0
256,23552,3072,3072,ck,0,0,321.6493,a8w8_blockscale_1x128x128_256x128x128x128_16x16_32x32_2x2_8x32x1_8x32x1_1x32x1x8_8_1x1_intrawave_v3,1382.03,704.16,0.0
256,23552,3072,6144,ck,0,0,591.6439,a8w8_blockscale_1x128x128_256x128x128x128_16x16_32x32_2x2_8x32x1_8x32x1_1x32x1x8_8_1x1_intrawave_v3,1502.69,521.06,0.0
256,23680,3072,3072,ck,0,0,321.2174,a8w8_blockscale_1x128x128_256x128x128x128_16x16_32x32_2x2_8x32x1_8x32x1_1x32x1x8_8_1x1_intrawave_v3,1391.41,708.78,0.0
256,23680,3072,6144,ck,0,0,594.8486,a8w8_blockscale_1x128x128_256x128x128x128_16x16_32x32_2x2_8x32x1_8x32x1_1x32x1x8_8_1x1_intrawave_v3,1502.72,520.9,0.0
256,23808,3072,3072,ck,0,0,319.4686,a8w8_blockscale_1x128x128_256x128x128x128_16x16_32x32_2x2_8x32x1_8x32x1_1x32x1x8_8_1x1_intrawave_v3,1406.59,716.35,0.0
256,23808,3072,6144,ck,0,0,599.4571,a8w8_blockscale_1x128x128_256x128x128x128_16x16_32x32_2x2_8x32x1_8x32x1_1x32x1x8_8_1x1_intrawave_v3,1499.23,519.52,0.0
256,23936,3072,3072,ck,0,0,315.7123,a8w8_blockscale_1x128x128_256x128x128x128_16x16_32x32_2x2_8x32x1_8x32x1_1x32x1x8_8_1x1_intrawave_v3,1430.98,728.61,0.0
256,23936,3072,6144,ck,0,0,604.4775,a8w8_blockscale_1x128x128_256x128x128x128_16x16_32x32_2x2_8x32x1_8x32x1_1x32x1x8_8_1x1_intrawave_v3,1494.77,517.8,0.0
256,24064,3072,3072,ck,0,0,311.5429,a8w8_blockscale_1x128x128_256x128x128x128_16x16_32x32_2x2_8x32x1_8x32x1_1x32x1x8_8_1x1_intrawave_v3,1457.88,742.15,0.0
256,24064,3072,6144,ck,0,0,605.1576,a8w8_blockscale_1x128x128_256x128x128x128_16x16_32x32_2x2_8x32x1_8x32x1_1x32x1x8_8_1x1_intrawave_v3,1501.07,519.82,0.0
256,24192,3072,3072,ck,0,0,311.6917,a8w8_blockscale_1x128x128_256x128x128x128_16x16_32x32_2x2_8x32x1_8x32x1_1x32x1x8_8_1x1_intrawave_v3,1464.94,745.58,0.0
256,24192,3072,6144,ck,0,0,616.4411,a8w8_blockscale_1x128x128_256x128x128x128_16x16_32x32_2x2_8x32x1_8x32x1_1x32x1x8_8_1x1_intrawave_v3,1481.44,512.86,0.0
256,24320,3072,3072,ck,0,0,321.0924,a8w8_blockscale_1x128x128_256x128x128x128_16x16_32x32_2x2_8x32x1_8x32x1_1x32x1x8_8_1x1_intrawave_v3,1429.57,727.42,0.0
256,24320,3072,6144,ck,0,0,614.0851,a8w8_blockscale_1x128x128_256x128x128x128_16x16_32x32_2x2_8x32x1_8x32x1_1x32x1x8_8_1x1_intrawave_v3,1494.99,517.39,0.0
256,24448,3072,3072,ck,0,0,331.6302,a8w8_blockscale_1x128x128_256x128x128x128_16x16_32x32_2x2_8x32x1_8x32x1_1x32x1x8_8_1x1_intrawave_v3,1391.43,707.87,0.0
256,24448,3072,6144,ck,0,0,614.3733,a8w8_blockscale_1x128x128_256x128x128x128_16x16_32x32_2x2_8x32x1_8x32x1_1x32x1x8_8_1x1_intrawave_v3,1502.15,519.7,0.0
256,24576,3072,3072,ck,0,0,323.5339,a8w8_blockscale_1x128x128_256x128x128x128_16x16_32x32_2x2_8x32x1_8x32x1_1x32x1x8_8_1x1_intrawave_v3,1433.72,729.23,0.0
256,24576,3072,6144,ck,0,0,604.6952,a8w8_blockscale_1x128x128_256x128x128x128_16x16_32x32_2x2_8x32x1_8x32x1_1x32x1x8_8_1x1_intrawave_v3,1534.18,530.62,0.0
256,24704,3072,3072,ck,0,0,333.2773,a8w8_blockscale_1x128x128_256x128x128x128_16x16_32x32_2x2_8x32x1_8x32x1_1x32x1x8_8_1x1_intrawave_v3,1399.05,711.45,0.0
256,24704,3072,6144,ck,0,0,623.9242,a8w8_blockscale_1x128x128_256x128x128x128_16x16_32x32_2x2_8x32x1_8x32x1_1x32x1x8_8_1x1_intrawave_v3,1494.64,516.79,0.0
256,24832,3072,3072,ck,0,0,324.656,a8w8_blockscale_1x128x128_256x128x128x128_16x16_32x32_2x2_8x32x1_8x32x1_1x32x1x8_8_1x1_intrawave_v3,1443.65,733.97,0.0
256,24832,3072,6144,ck,0,0,624.729,a8w8_blockscale_1x128x128_256x128x128x128_16x16_32x32_2x2_8x32x1_8x32x1_1x32x1x8_8_1x1_intrawave_v3,1500.45,518.64,0.0
256,24960,3072,3072,ck,0,0,324.618,a8w8_blockscale_1x128x128_256x128x128x128_16x16_32x32_2x2_8x32x1_8x32x1_1x32x1x8_8_1x1_intrawave_v3,1451.26,737.69,0.0
256,24960,3072,6144,ck,0,0,625.1699,a8w8_blockscale_1x128x128_256x128x128x128_16x16_32x32_2x2_8x32x1_8x32x1_1x32x1x8_8_1x1_intrawave_v3,1507.12,520.79,0.0
256,25088,3072,3072,ck,0,0,324.58,a8w8_blockscale_1x128x128_256x128x128x128_16x16_32x32_2x2_8x32x1_8x32x1_1x32x1x8_8_1x1_intrawave_v3,1458.87,741.41,0.0
256,25088,3072,6144,ck,0,0,627.3745,a8w8_blockscale_1x128x128_256x128x128x128_16x16_32x32_2x2_8x32x1_8x32x1_1x32x1x8_8_1x1_intrawave_v3,1509.53,521.47,0.0
256,25216,3072,3072,ck,0,0,333.6981,a8w8_blockscale_1x128x128_256x128x128x128_16x16_32x32_2x2_8x32x1_8x32x1_1x32x1x8_8_1x1_intrawave_v3,1426.25,724.69,0.0
256,25216,3072,6144,ck,0,0,635.6181,a8w8_blockscale_1x128x128_256x128x128x128_16x16_32x32_2x2_8x32x1_8x32x1_1x32x1x8_8_1x1_intrawave_v3,1497.55,517.18,0.0
256,25344,3072,3072,ck,0,0,328.9841,a8w8_blockscale_1x128x128_256x128x128x128_16x16_32x32_2x2_8x32x1_8x32x1_1x32x1x8_8_1x1_intrawave_v3,1454.03,738.66,0.0
256,25344,3072,6144,ck,0,0,630.7361,a8w8_blockscale_1x128x128_256x128x128x128_16x16_32x32_2x2_8x32x1_8x32x1_1x32x1x8_8_1x1_intrawave_v3,1516.81,523.68,0.0
256,25472,3072,3072,ck,0,0,328.5531,a8w8_blockscale_1x128x128_256x128x128x128_16x16_32x32_2x2_8x32x1_8x32x1_1x32x1x8_8_1x1_intrawave_v3,1463.29,743.22,0.0
256,25472,3072,6144,ck,0,0,638.0572,a8w8_blockscale_1x128x128_256x128x128x128_16x16_32x32_2x2_8x32x1_8x32x1_1x32x1x8_8_1x1_intrawave_v3,1506.97,520.13,0.0
256,25600,3072,3072,ck,0,0,329.9704,a8w8_blockscale_1x128x128_256x128x128x128_16x16_32x32_2x2_8x32x1_8x32x1_1x32x1x8_8_1x1_intrawave_v3,1464.32,743.6,0.0
256,25600,3072,6144,ck,0,0,645.5501,a8w8_blockscale_1x128x128_256x128x128x128_16x16_32x32_2x2_8x32x1_8x32x1_1x32x1x8_8_1x1_intrawave_v3,1496.97,516.53,0.0
256,25728,3072,3072,ck,0,0,341.9827,a8w8_blockscale_1x128x128_256x128x128x128_16x16_32x32_2x2_8x32x1_8x32x1_1x32x1x8_8_1x1_intrawave_v3,1419.95,720.93,0.0
256,25728,3072,6144,ck,0,0,647.7554,a8w8_blockscale_1x128x128_256x128x128x128_16x16_32x32_2x2_8x32x1_8x32x1_1x32x1x8_8_1x1_intrawave_v3,1499.33,517.2,0.0
256,25856,3072,6144,ck,0,0,645.0016,a8w8_blockscale_1x128x128_256x128x128x128_16x16_32x32_2x2_8x32x1_8x32x1_1x32x1x8_8_1x1_intrawave_v3,1513.22,521.85,0.0
256,25984,3072,3072,ck,0,0,348.5385,a8w8_blockscale_1x128x128_256x128x128x128_16x16_32x32_2x2_8x32x1_8x32x1_1x32x1x8_8_1x1_intrawave_v3,1407.11,714.14,0.0
256,25984,3072,6144,ck,0,0,652.28,a8w8_blockscale_1x128x128_256x128x128x128_16x16_32x32_2x2_8x32x1_8x32x1_1x32x1x8_8_1x1_intrawave_v3,1503.75,518.44,0.0
256,26112,3072,3072,ck,0,0,345.3059,a8w8_blockscale_1x128x128_256x128x128x128_16x16_32x32_2x2_8x32x1_8x32x1_1x32x1x8_8_1x1_intrawave_v3,1427.28,724.24,0.0
256,26112,3072,6144,ck,0,0,639.4533,a8w8_blockscale_1x128x128_256x128x128x128_16x16_32x32_2x2_8x32x1_8x32x1_1x32x1x8_8_1x1_intrawave_v3,1541.47,531.3,0.0
256,26240,3072,3072,ck,0,0,341.7989,a8w8_blockscale_1x128x128_256x128x128x128_16x16_32x32_2x2_8x32x1_8x32x1_1x32x1x8_8_1x1_intrawave_v3,1448.99,735.13,0.0
256,26240,3072,6144,ck,0,0,659.909,a8w8_blockscale_1x128x128_256x128x128x128_16x16_32x32_2x2_8x32x1_8x32x1_1x32x1x8_8_1x1_intrawave_v3,1501.01,517.21,0.0
256,26368,3072,3072,ck,0,0,342.6876,a8w8_blockscale_1x128x128_256x128x128x128_16x16_32x32_2x2_8x32x1_8x32x1_1x32x1x8_8_1x1_intrawave_v3,1452.28,736.66,0.0
256,26368,3072,6144,ck,0,0,664.8882,a8w8_blockscale_1x128x128_256x128x128x128_16x16_32x32_2x2_8x32x1_8x32x1_1x32x1x8_8_1x1_intrawave_v3,1497.03,515.7,0.0
256,26496,3072,3072,ck,0,0,342.487,a8w8_blockscale_1x128x128_256x128x128x128_16x16_32x32_2x2_8x32x1_8x32x1_1x32x1x8_8_1x1_intrawave_v3,1460.19,740.54,0.0
256,26496,3072,6144,ck,0,0,665.482,a8w8_blockscale_1x128x128_256x128x128x128_16x16_32x32_2x2_8x32x1_8x32x1_1x32x1x8_8_1x1_intrawave_v3,1502.96,517.61,0.0
256,26624,3072,3072,ck,0,0,341.0976,a8w8_blockscale_1x128x128_256x128x128x128_16x16_32x32_2x2_8x32x1_8x32x1_1x32x1x8_8_1x1_intrawave_v3,1473.22,747.01,0.0
256,26624,3072,6144,ck,0,0,661.7972,a8w8_blockscale_1x128x128_256x128x128x128_16x16_32x32_2x2_8x32x1_8x32x1_1x32x1x8_8_1x1_intrawave_v3,1518.63,522.86,0.0
256,26752,3072,3072,ck,0,0,343.3944,a8w8_blockscale_1x128x128_256x128x128x128_16x16_32x32_2x2_8x32x1_8x32x1_1x32x1x8_8_1x1_intrawave_v3,1470.4,745.45,0.0
256,26752,3072,6144,ck,0,0,676.9431,a8w8_blockscale_1x128x128_256x128x128x128_16x16_32x32_2x2_8x32x1_8x32x1_1x32x1x8_8_1x1_intrawave_v3,1491.79,513.49,0.0
256,26880,3072,3072,ck,0,0,349.8223,a8w8_blockscale_1x128x128_256x128x128x128_16x16_32x32_2x2_8x32x1_8x32x1_1x32x1x8_8_1x1_intrawave_v3,1450.29,735.13,0.0
256,26880,3072,6144,ck,0,0,676.1834,a8w8_blockscale_1x128x128_256x128x128x128_16x16_32x32_2x2_8x32x1_8x32x1_1x32x1x8_8_1x1_intrawave_v3,1500.61,516.39,0.0
256,27008,3072,3072,ck,0,0,353.4082,a8w8_blockscale_1x128x128_256x128x128x128_16x16_32x32_2x2_8x32x1_8x32x1_1x32x1x8_8_1x1_intrawave_v3,1442.41,731.0,0.0
256,27008,3072,6144,ck,0,0,684.6986,a8w8_blockscale_1x128x128_256x128x128x128_16x16_32x32_2x2_8x32x1_8x32x1_1x32x1x8_8_1x1_intrawave_v3,1489.0,512.27,0.0
256,27136,3072,3072,ck,0,0,352.3393,a8w8_blockscale_1x128x128_256x128x128x128_16x16_32x32_2x2_8x32x1_8x32x1_1x32x1x8_8_1x1_intrawave_v3,1453.64,736.57,0.0
256,27136,3072,6144,ck,0,0,677.2519,a8w8_blockscale_1x128x128_256x128x128x128_16x16_32x32_2x2_8x32x1_8x32x1_1x32x1x8_8_1x1_intrawave_v3,1512.51,520.22,0.0
256,27264,3072,3072,ck,0,0,357.0517,a8w8_blockscale_1x128x128_256x128x128x128_16x16_32x32_2x2_8x32x1_8x32x1_1x32x1x8_8_1x1_intrawave_v3,1441.22,730.15,0.0
256,27264,3072,6144,ck,0,0,681.931,a8w8_blockscale_1x128x128_256x128x128x128_16x16_32x32_2x2_8x32x1_8x32x1_1x32x1x8_8_1x1_intrawave_v3,1509.22,518.96,0.0
256,27392,3072,3072,ck,0,0,368.0028,a8w8_blockscale_1x128x128_256x128x128x128_16x16_32x32_2x2_8x32x1_8x32x1_1x32x1x8_8_1x1_intrawave_v3,1404.9,711.63,0.0
256,27392,3072,6144,ck,0,0,681.7477,a8w8_blockscale_1x128x128_256x128x128x128_16x16_32x32_2x2_8x32x1_8x32x1_1x32x1x8_8_1x1_intrawave_v3,1516.71,521.41,0.0
256,27520,3072,3072,ck,0,0,356.4486,a8w8_blockscale_1x128x128_256x128x128x128_16x16_32x32_2x2_8x32x1_8x32x1_1x32x1x8_8_1x1_intrawave_v3,1457.22,738.01,0.0
256,27520,3072,6144,ck,0,0,689.5667,a8w8_blockscale_1x128x128_256x128x128x128_16x16_32x32_2x2_8x32x1_8x32x1_1x32x1x8_8_1x1_intrawave_v3,1506.52,517.77,0.0
256,27648,3072,3072,ck,0,0,359.7006,a8w8_blockscale_1x128x128_256x128x128x128_16x16_32x32_2x2_8x32x1_8x32x1_1x32x1x8_8_1x1_intrawave_v3,1450.76,734.61,0.0
256,27648,3072,6144,ck,0,0,675.8608,a8w8_blockscale_1x128x128_256x128x128x128_16x16_32x32_2x2_8x32x1_8x32x1_1x32x1x8_8_1x1_intrawave_v3,1544.22,530.6,0.0
256,27776,3072,3072,ck,0,0,366.5238,a8w8_blockscale_1x128x128_256x128x128x128_16x16_32x32_2x2_8x32x1_8x32x1_1x32x1x8_8_1x1_intrawave_v3,1430.34,724.16,0.0
256,27776,3072,6144,ck,0,0,694.6789,a8w8_blockscale_1x128x128_256x128x128x128_16x16_32x32_2x2_8x32x1_8x32x1_1x32x1x8_8_1x1_intrawave_v3,1509.34,518.49,0.0
256,27904,3072,3072,ck,0,0,361.1895,a8w8_blockscale_1x128x128_256x128x128x128_16x16_32x32_2x2_8x32x1_8x32x1_1x32x1x8_8_1x1_intrawave_v3,1458.16,738.12,0.0
256,27904,3072,6144,ck,0,0,690.119,a8w8_blockscale_1x128x128_256x128x128x128_16x16_32x32_2x2_8x32x1_8x32x1_1x32x1x8_8_1x1_intrawave_v3,1526.32,524.2,0.0
256,28032,3072,3072,ck,0,0,369.7223,a8w8_blockscale_1x128x128_256x128x128x128_16x16_32x32_2x2_8x32x1_8x32x1_1x32x1x8_8_1x1_intrawave_v3,1431.04,724.27,0.0
256,28032,3072,6144,ck,0,0,702.4245,a8w8_blockscale_1x128x128_256x128x128x128_16x16_32x32_2x2_8x32x1_8x32x1_1x32x1x8_8_1x1_intrawave_v3,1506.46,517.25,0.0
256,28160,3072,3072,ck,0,0,372.3619,a8w8_blockscale_1x128x128_256x128x128x128_16x16_32x32_2x2_8x32x1_8x32x1_1x32x1x8_8_1x1_intrawave_v3,1427.38,722.31,0.0
256,28160,3072,6144,ck,0,0,699.1661,a8w8_blockscale_1x128x128_256x128x128x128_16x16_32x32_2x2_8x32x1_8x32x1_1x32x1x8_8_1x1_intrawave_v3,1520.39,521.91,0.0
256,28288,3072,3072,ck,0,0,369.7117,a8w8_blockscale_1x128x128_256x128x128x128_16x16_32x32_2x2_8x32x1_8x32x1_1x32x1x8_8_1x1_intrawave_v3,1444.15,730.68,0.0
256,28288,3072,6144,ck,0,0,703.4455,a8w8_blockscale_1x128x128_256x128x128x128_16x16_32x32_2x2_8x32x1_8x32x1_1x32x1x8_8_1x1_intrawave_v3,1518.01,520.97,0.0
256,28416,3072,3072,ck,0,0,369.0504,a8w8_blockscale_1x128x128_256x128x128x128_16x16_32x32_2x2_8x32x1_8x32x1_1x32x1x8_8_1x1_intrawave_v3,1453.28,735.18,0.0
256,28416,3072,6144,ck,0,0,709.5232,a8w8_blockscale_1x128x128_256x128x128x128_16x16_32x32_2x2_8x32x1_8x32x1_1x32x1x8_8_1x1_intrawave_v3,1511.82,518.73,0.0
256,28544,3072,3072,ck,0,0,376.2935,a8w8_blockscale_1x128x128_256x128x128x128_16x16_32x32_2x2_8x32x1_8x32x1_1x32x1x8_8_1x1_intrawave_v3,1431.73,724.17,0.0
256,28544,3072,6144,ck,0,0,714.4452,a8w8_blockscale_1x128x128_256x128x128x128_16x16_32x32_2x2_8x32x1_8x32x1_1x32x1x8_8_1x1_intrawave_v3,1508.16,517.36,0.0
256,28672,3072,3072,ck,0,0,369.0706,a8w8_blockscale_1x128x128_256x128x128x128_16x16_32x32_2x2_8x32x1_8x32x1_1x32x1x8_8_1x1_intrawave_v3,1466.29,741.53,0.0
256,28672,3072,6144,ck,0,0,699.0507,a8w8_blockscale_1x128x128_256x128x128x128_16x16_32x32_2x2_8x32x1_8x32x1_1x32x1x8_8_1x1_intrawave_v3,1548.29,531.0,0.0
256,28800,3072,3072,ck,0,0,382.0055,a8w8_blockscale_1x128x128_256x128x128x128_16x16_32x32_2x2_8x32x1_8x32x1_1x32x1x8_8_1x1_intrawave_v3,1422.97,719.51,0.0
256,28800,3072,6144,ck,0,0,715.4793,a8w8_blockscale_1x128x128_256x128x128x128_16x16_32x32_2x2_8x32x1_8x32x1_1x32x1x8_8_1x1_intrawave_v3,1519.49,521.01,0.0
256,28928,3072,3072,ck,0,0,377.013,a8w8_blockscale_1x128x128_256x128x128x128_16x16_32x32_2x2_8x32x1_8x32x1_1x32x1x8_8_1x1_intrawave_v3,1448.22,732.17,0.0
256,28928,3072,6144,ck,0,0,717.0915,a8w8_blockscale_1x128x128_256x128x128x128_16x16_32x32_2x2_8x32x1_8x32x1_1x32x1x8_8_1x1_intrawave_v3,1522.81,522.03,0.0
256,29056,3072,3072,ck,0,0,376.97,a8w8_blockscale_1x128x128_256x128x128x128_16x16_32x32_2x2_8x32x1_8x32x1_1x32x1x8_8_1x1_intrawave_v3,1454.79,735.38,0.0
256,29056,3072,6144,ck,0,0,724.9701,a8w8_blockscale_1x128x128_256x128x128x128_16x16_32x32_2x2_8x32x1_8x32x1_1x32x1x8_8_1x1_intrawave_v3,1512.93,518.52,0.0
256,29184,3072,3072,ck,0,0,376.2692,a8w8_blockscale_1x128x128_256x128x128x128_16x16_32x32_2x2_8x32x1_8x32x1_1x32x1x8_8_1x1_intrawave_v3,1463.92,739.89,0.0
256,29184,3072,6144,ck,0,0,710.1059,a8w8_blockscale_1x128x128_256x128x128x128_16x16_32x32_2x2_8x32x1_8x32x1_1x32x1x8_8_1x1_intrawave_v3,1551.4,531.59,0.0
256,29312,3072,3072,ck,0,0,384.0804,a8w8_blockscale_1x128x128_256x128x128x128_16x16_32x32_2x2_8x32x1_8x32x1_1x32x1x8_8_1x1_intrawave_v3,1440.44,727.91,0.0
256,29312,3072,6144,ck,0,0,727.9375,a8w8_blockscale_1x128x128_256x128x128x128_16x16_32x32_2x2_8x32x1_8x32x1_1x32x1x8_8_1x1_intrawave_v3,1520.04,520.73,0.0
256,29440,3072,3072,ck,0,0,382.866,a8w8_blockscale_1x128x128_256x128x128x128_16x16_32x32_2x2_8x32x1_8x32x1_1x32x1x8_8_1x1_intrawave_v3,1451.32,733.3,0.0
256,29440,3072,6144,ck,0,0,724.3931,a8w8_blockscale_1x128x128_256x128x128x128_16x16_32x32_2x2_8x32x1_8x32x1_1x32x1x8_8_1x1_intrawave_v3,1534.14,525.45,0.0
256,29568,3072,3072,ck,0,0,385.6151,a8w8_blockscale_1x128x128_256x128x128x128_16x16_32x32_2x2_8x32x1_8x32x1_1x32x1x8_8_1x1_intrawave_v3,1447.24,731.13,0.0
256,29568,3072,6144,ck,0,0,732.6827,a8w8_blockscale_1x128x128_256x128x128x128_16x16_32x32_2x2_8x32x1_8x32x1_1x32x1x8_8_1x1_intrawave_v3,1523.38,521.65,0.0
256,29696,3072,3072,ck,0,0,379.9326,a8w8_blockscale_1x128x128_256x128x128x128_16x16_32x32_2x2_8x32x1_8x32x1_1x32x1x8_8_1x1_intrawave_v3,1475.24,745.17,0.0
256,29696,3072,6144,ck,0,0,756.193,a8w8_blockscale_1x128x128_256x128x128x128_16x16_32x32_2x2_8x32x1_8x32x1_1x32x1x8_8_1x1_intrawave_v3,1482.41,507.51,0.0
256,29824,3072,3072,ck,0,0,394.7874,a8w8_blockscale_1x128x128_256x128x128x128_16x16_32x32_2x2_8x32x1_8x32x1_1x32x1x8_8_1x1_intrawave_v3,1425.85,720.12,0.0
256,29824,3072,6144,ck,0,0,739.9179,a8w8_blockscale_1x128x128_256x128x128x128_16x16_32x32_2x2_8x32x1_8x32x1_1x32x1x8_8_1x1_intrawave_v3,1521.54,520.8,0.0
256,29952,3072,3072,ck,0,0,386.6471,a8w8_blockscale_1x128x128_256x128x128x128_16x16_32x32_2x2_8x32x1_8x32x1_1x32x1x8_8_1x1_intrawave_v3,1462.12,738.33,0.0
256,29952,3072,6144,ck,0,0,726.1729,a8w8_blockscale_1x128x128_256x128x128x128_16x16_32x32_2x2_8x32x1_8x32x1_1x32x1x8_8_1x1_intrawave_v3,1557.0,532.83,0.0
256,30080,3072,3072,ck,0,0,390.3786,a8w8_blockscale_1x128x128_256x128x128x128_16x16_32x32_2x2_8x32x1_8x32x1_1x32x1x8_8_1x1_intrawave_v3,1454.33,734.3,0.0
256,30080,3072,6144,ck,0,0,741.2686,a8w8_blockscale_1x128x128_256x128x128x128_16x16_32x32_2x2_8x32x1_8x32x1_1x32x1x8_8_1x1_intrawave_v3,1531.81,524.1,0.0
256,30208,3072,3072,ck,0,0,391.3567,a8w8_blockscale_1x128x128_256x128x128x128_16x16_32x32_2x2_8x32x1_8x32x1_1x32x1x8_8_1x1_intrawave_v3,1456.87,735.48,0.0
256,30208,3072,6144,ck,0,0,755.6517,a8w8_blockscale_1x128x128_256x128x128x128_16x16_32x32_2x2_8x32x1_8x32x1_1x32x1x8_8_1x1_intrawave_v3,1509.05,516.2,0.0
256,30336,3072,3072,ck,0,0,388.8493,a8w8_blockscale_1x128x128_256x128x128x128_16x16_32x32_2x2_8x32x1_8x32x1_1x32x1x8_8_1x1_intrawave_v3,1472.48,743.25,0.0
256,30336,3072,6144,ck,0,0,749.5907,a8w8_blockscale_1x128x128_256x128x128x128_16x16_32x32_2x2_8x32x1_8x32x1_1x32x1x8_8_1x1_intrawave_v3,1527.69,522.48,0.0
256,30464,3072,3072,ck,0,0,393.7578,a8w8_blockscale_1x128x128_256x128x128x128_16x16_32x32_2x2_8x32x1_8x32x1_1x32x1x8_8_1x1_intrawave_v3,1460.26,736.98,0.0
256,30464,3072,6144,ck,0,0,761.9549,a8w8_blockscale_1x128x128_256x128x128x128_16x16_32x32_2x2_8x32x1_8x32x1_1x32x1x8_8_1x1_intrawave_v3,1509.25,516.06,0.0
256,30592,3072,3072,ck,0,0,399.373,a8w8_blockscale_1x128x128_256x128x128x128_16x16_32x32_2x2_8x32x1_8x32x1_1x32x1x8_8_1x1_intrawave_v3,1445.78,729.58,0.0
256,30592,3072,6144,ck,0,0,755.7166,a8w8_blockscale_1x128x128_256x128x128x128_16x16_32x32_2x2_8x32x1_8x32x1_1x32x1x8_8_1x1_intrawave_v3,1528.1,522.4,0.0
256,30720,3072,3072,ck,0,0,390.2904,a8w8_blockscale_1x128x128_256x128x128x128_16x16_32x32_2x2_8x32x1_8x32x1_1x32x1x8_8_1x1_intrawave_v3,1485.61,749.58,0.0
256,30720,3072,6144,ck,0,0,753.5873,a8w8_blockscale_1x128x128_256x128x128x128_16x16_32x32_2x2_8x32x1_8x32x1_1x32x1x8_8_1x1_intrawave_v3,1538.83,525.97,0.0
256,30848,3072,3072,ck,0,0,403.0869,a8w8_blockscale_1x128x128_256x128x128x128_16x16_32x32_2x2_8x32x1_8x32x1_1x32x1x8_8_1x1_intrawave_v3,1444.44,728.71,0.0
256,30848,3072,6144,ck,0,0,762.2164,a8w8_blockscale_1x128x128_256x128x128x128_16x16_32x32_2x2_8x32x1_8x32x1_1x32x1x8_8_1x1_intrawave_v3,1527.75,522.08,0.0
256,30976,3072,3072,ck,0,0,395.8205,a8w8_blockscale_1x128x128_256x128x128x128_16x16_32x32_2x2_8x32x1_8x32x1_1x32x1x8_8_1x1_intrawave_v3,1477.06,745.06,0.0
256,30976,3072,6144,ck,0,0,765.669,a8w8_blockscale_1x128x128_256x128x128x128_16x16_32x32_2x2_8x32x1_8x32x1_1x32x1x8_8_1x1_intrawave_v3,1527.17,521.78,0.0
256,31104,3072,3072,ck,0,0,403.4038,a8w8_blockscale_1x128x128_256x128x128x128_16x16_32x32_2x2_8x32x1_8x32x1_1x32x1x8_8_1x1_intrawave_v3,1455.29,733.98,0.0
256,31104,3072,6144,ck,0,0,766.88,a8w8_blockscale_1x128x128_256x128x128x128_16x16_32x32_2x2_8x32x1_8x32x1_1x32x1x8_8_1x1_intrawave_v3,1531.06,523.0,0.0
256,31232,3072,3072,ck,0,0,402.1461,a8w8_blockscale_1x128x128_256x128x128x128_16x16_32x32_2x2_8x32x1_8x32x1_1x32x1x8_8_1x1_intrawave_v3,1465.85,739.21,0.0
256,31232,3072,6144,ck,0,0,779.5977,a8w8_blockscale_1x128x128_256x128x128x128_16x16_32x32_2x2_8x32x1_8x32x1_1x32x1x8_8_1x1_intrawave_v3,1512.28,516.49,0.0
256,31360,3072,3072,ck,0,0,402.18,a8w8_blockscale_1x128x128_256x128x128x128_16x16_32x32_2x2_8x32x1_8x32x1_1x32x1x8_8_1x1_intrawave_v3,1471.73,742.08,0.0
256,31360,3072,6144,ck,0,0,780.0649,a8w8_blockscale_1x128x128_256x128x128x128_16x16_32x32_2x2_8x32x1_8x32x1_1x32x1x8_8_1x1_intrawave_v3,1517.57,518.2,0.0
256,31488,3072,3072,ck,0,0,406.8044,a8w8_blockscale_1x128x128_256x128x128x128_16x16_32x32_2x2_8x32x1_8x32x1_1x32x1x8_8_1x1_intrawave_v3,1460.94,736.55,0.0
256,31488,3072,6144,ck,0,0,774.4741,a8w8_blockscale_1x128x128_256x128x128x128_16x16_32x32_2x2_8x32x1_8x32x1_1x32x1x8_8_1x1_intrawave_v3,1534.76,523.97,0.0
256,31616,3072,3072,ck,0,0,405.5774,a8w8_blockscale_1x128x128_256x128x128x128_16x16_32x32_2x2_8x32x1_8x32x1_1x32x1x8_8_1x1_intrawave_v3,1471.31,741.68,0.0
256,31616,3072,6144,ck,0,0,780.6291,a8w8_blockscale_1x128x128_256x128x128x128_16x16_32x32_2x2_8x32x1_8x32x1_1x32x1x8_8_1x1_intrawave_v3,1528.85,521.85,0.0
256,31744,3072,3072,ck,0,0,405.6695,a8w8_blockscale_1x128x128_256x128x128x128_16x16_32x32_2x2_8x32x1_8x32x1_1x32x1x8_8_1x1_intrawave_v3,1476.94,744.42,0.0
256,31744,3072,6144,ck,0,0,768.3119,a8w8_blockscale_1x128x128_256x128x128x128_16x16_32x32_2x2_8x32x1_8x32x1_1x32x1x8_8_1x1_intrawave_v3,1559.65,532.26,0.0
256,31872,3072,3072,ck,0,0,409.9735,a8w8_blockscale_1x128x128_256x128x128x128_16x16_32x32_2x2_8x32x1_8x32x1_1x32x1x8_8_1x1_intrawave_v3,1467.32,739.49,0.0
256,31872,3072,6144,ck,0,0,789.056,a8w8_blockscale_1x128x128_256x128x128x128_16x16_32x32_2x2_8x32x1_8x32x1_1x32x1x8_8_1x1_intrawave_v3,1524.77,520.26,0.0
256,32000,3072,3072,ck,0,0,414.4374,a8w8_blockscale_1x128x128_256x128x128x128_16x16_32x32_2x2_8x32x1_8x32x1_1x32x1x8_8_1x1_intrawave_v3,1457.35,734.37,0.0
256,32000,3072,6144,ck,0,0,802.2227,a8w8_blockscale_1x128x128_256x128x128x128_16x16_32x32_2x2_8x32x1_8x32x1_1x32x1x8_8_1x1_intrawave_v3,1505.77,513.69,0.0
256,32128,3072,3072,ck,0,0,418.7867,a8w8_blockscale_1x128x128_256x128x128x128_16x16_32x32_2x2_8x32x1_8x32x1_1x32x1x8_8_1x1_intrawave_v3,1447.98,729.56,0.0
256,32128,3072,6144,ck,0,0,790.8731,a8w8_blockscale_1x128x128_256x128x128x128_16x16_32x32_2x2_8x32x1_8x32x1_1x32x1x8_8_1x1_intrawave_v3,1533.48,523.05,0.0
256,32256,3072,3072,ck,0,0,417.6874,a8w8_blockscale_1x128x128_256x128x128x128_16x16_32x32_2x2_8x32x1_8x32x1_1x32x1x8_8_1x1_intrawave_v3,1457.58,734.3,0.0
256,32256,3072,6144,ck,0,0,792.619,a8w8_blockscale_1x128x128_256x128x128x128_16x16_32x32_2x2_8x32x1_8x32x1_1x32x1x8_8_1x1_intrawave_v3,1536.2,523.88,0.0
256,32384,3072,3072,ck,0,0,412.0818,a8w8_blockscale_1x128x128_256x128x128x128_16x16_32x32_2x2_8x32x1_8x32x1_1x32x1x8_8_1x1_intrawave_v3,1483.27,747.15,0.0
256,32384,3072,6144,ck,0,0,795.1705,a8w8_blockscale_1x128x128_256x128x128x128_16x16_32x32_2x2_8x32x1_8x32x1_1x32x1x8_8_1x1_intrawave_v3,1537.35,524.18,0.0
256,32512,3072,3072,ck,0,0,415.0286,a8w8_blockscale_1x128x128_256x128x128x128_16x16_32x32_2x2_8x32x1_8x32x1_1x32x1x8_8_1x1_intrawave_v3,1478.56,744.69,0.0
256,32512,3072,6144,ck,0,0,809.7112,a8w8_blockscale_1x128x128_256x128x128x128_16x16_32x32_2x2_8x32x1_8x32x1_1x32x1x8_8_1x1_intrawave_v3,1515.71,516.7,0.0
256,32640,3072,3072,ck,0,0,414.5847,a8w8_blockscale_1x128x128_256x128x128x128_16x16_32x32_2x2_8x32x1_8x32x1_1x32x1x8_8_1x1_intrawave_v3,1485.97,748.33,0.0
256,32640,3072,6144,ck,0,0,818.7137,a8w8_blockscale_1x128x128_256x128x128x128_16x16_32x32_2x2_8x32x1_8x32x1_1x32x1x8_8_1x1_intrawave_v3,1504.94,512.94,0.0
256,32896,3072,3072,ck,0,0,424.0518,a8w8_blockscale_1x128x128_256x128x128x128_16x16_32x32_2x2_8x32x1_8x32x1_1x32x1x8_8_1x1_intrawave_v3,1464.19,737.19,0.0
256,32896,3072,6144,ck,0,0,802.8555,a8w8_blockscale_1x128x128_256x128x128x128_16x16_32x32_2x2_8x32x1_8x32x1_1x32x1x8_8_1x1_intrawave_v3,1546.71,526.99,0.0
256,33024,3072,3072,ck,0,0,425.0127,a8w8_blockscale_1x128x128_256x128x128x128_16x16_32x32_2x2_8x32x1_8x32x1_1x32x1x8_8_1x1_intrawave_v3,1466.56,738.3,0.0
256,33024,3072,6144,ck,0,0,812.7093,a8w8_blockscale_1x128x128_256x128x128x128_16x16_32x32_2x2_8x32x1_8x32x1_1x32x1x8_8_1x1_intrawave_v3,1533.9,522.54,0.0
256,640,4096,3072,ck,18,0,22.5377,a8w8_blockscale_1x128x128_256x64x64x256_16x16_32x32_1x1_16x16x1_16x16x1_1x32x1x8_8_1x1_intrawave_v1,714.63,878.17,0.0
256,768,4096,3072,ck,18,0,23.581,a8w8_blockscale_1x128x128_256x64x64x256_16x16_32x32_1x1_16x16x1_16x16x1_1x32x1x8_8_1x1_intrawave_v1,819.62,900.46,0.0
256,896,4096,3072,ck,0,0,26.6857,a8w8_blockscale_1x128x128_256x128x128x128_16x16_32x32_2x2_8x32x1_8x32x1_1x32x1x8_8_1x1_intrawave_v3,844.97,849.72,0.0
256,1037,4096,3072,ck,18,0,35.3414,a8w8_blockscale_1x128x128_256x64x64x256_16x16_32x32_1x1_16x16x1_16x16x1_1x32x1x8_8_1x1_intrawave_v1,738.42,686.55,0.0
256,1062,4096,3072,ck,18,0,35.2309,a8w8_blockscale_1x128x128_256x64x64x256_16x16_32x32_1x1_16x16x1_16x16x1_1x32x1x8_8_1x1_intrawave_v1,758.6,696.7,0.0
256,1070,4096,3072,ck,18,0,35.0965,a8w8_blockscale_1x128x128_256x64x64x256_16x16_32x32_1x1_16x16x1_16x16x1_1x32x1x8_8_1x1_intrawave_v1,767.24,701.93,0.0
256,1123,4096,3072,ck,18,0,35.2583,a8w8_blockscale_1x128x128_256x64x64x256_16x16_32x32_1x1_16x16x1_16x16x1_1x32x1x8_8_1x1_intrawave_v1,801.55,715.64,0.0
256,1152,4096,3072,ck,18,0,35.6505,a8w8_blockscale_1x128x128_256x64x64x256_16x16_32x32_1x1_16x16x1_16x16x1_1x32x1x8_8_1x1_intrawave_v1,813.2,716.93,0.0
256,1255,4096,3072,ck,18,0,37.4793,a8w8_blockscale_1x128x128_256x64x64x256_16x16_32x32_1x1_16x16x1_16x16x1_1x32x1x8_8_1x1_intrawave_v1,842.68,712.91,0.0
256,1280,4096,3072,ck,18,0,35.7092,a8w8_blockscale_1x128x128_256x64x64x256_16x16_32x32_1x1_16x16x1_16x16x1_1x32x1x8_8_1x1_intrawave_v1,902.07,756.13,0.0
256,1408,4096,3072,ck,0,0,41.1765,a8w8_blockscale_1x128x128_256x128x128x128_16x16_32x32_2x2_8x32x1_8x32x1_1x32x1x8_8_1x1_intrawave_v3,860.53,690.75,0.0
256,1501,4096,3072,ck,0,0,40.0475,a8w8_blockscale_1x128x128_256x128x128x128_16x16_32x32_2x2_8x32x1_8x32x1_1x32x1x8_8_1x1_intrawave_v3,943.23,736.38,0.0
256,1536,4096,3072,ck,0,0,39.2519,a8w8_blockscale_1x128x128_256x128x128x128_16x16_32x32_2x2_8x32x1_8x32x1_1x32x1x8_8_1x1_intrawave_v3,984.79,761.35,0.0
256,1664,4096,3072,ck,0,0,41.7828,a8w8_blockscale_1x128x128_256x128x128x128_16x16_32x32_2x2_8x32x1_8x32x1_1x32x1x8_8_1x1_intrawave_v3,1002.23,749.74,0.0
256,1792,4096,3072,ck,0,0,43.245,a8w8_blockscale_1x128x128_256x128x128x128_16x16_32x32_2x2_8x32x1_8x32x1_1x32x1x8_8_1x1_intrawave_v3,1042.83,757.73,0.0
256,2002,4096,3072,ck,0,0,45.6708,a8w8_blockscale_1x128x128_256x128x128x128_16x16_32x32_2x2_8x32x1_8x32x1_1x32x1x8_8_1x1_intrawave_v3,1103.16,769.28,0.0
256,2005,4096,3072,ck,0,0,45.8809,a8w8_blockscale_1x128x128_256x128x128x128_16x16_32x32_2x2_8x32x1_8x32x1_1x32x1x8_8_1x1_intrawave_v3,1099.75,766.49,0.0
256,2013,4096,3072,ck,0,0,45.8617,a8w8_blockscale_1x128x128_256x128x128x128_16x16_32x32_2x2_8x32x1_8x32x1_1x32x1x8_8_1x1_intrawave_v3,1104.6,768.78,0.0
256,2014,4096,3072,ck,0,0,46.1012,a8w8_blockscale_1x128x128_256x128x128x128_16x16_32x32_2x2_8x32x1_8x32x1_1x32x1x8_8_1x1_intrawave_v3,1099.41,765.03,0.0
256,2024,4096,3072,ck,0,0,45.6379,a8w8_blockscale_1x128x128_256x128x128x128_16x16_32x32_2x2_8x32x1_8x32x1_1x32x1x8_8_1x1_intrawave_v3,1116.08,775.26,0.0
256,2028,4096,3072,ck,0,0,45.8551,a8w8_blockscale_1x128x128_256x128x128x128_16x16_32x32_2x2_8x32x1_8x32x1_1x32x1x8_8_1x1_intrawave_v3,1112.99,772.57,0.0
256,2030,4096,3072,ck,0,0,45.4014,a8w8_blockscale_1x128x128_256x128x128x128_16x16_32x32_2x2_8x32x1_8x32x1_1x32x1x8_8_1x1_intrawave_v3,1125.22,780.79,0.0
256,2048,4096,3072,ck,0,0,44.4146,a8w8_blockscale_1x128x128_256x128x128x128_16x16_32x32_2x2_8x32x1_8x32x1_1x32x1x8_8_1x1_intrawave_v3,1160.42,802.7,0.0
256,2057,4096,3072,ck,0,0,60.7244,a8w8_blockscale_1x128x128_256x128x128x128_16x16_32x32_2x2_8x32x1_8x32x1_1x32x1x8_8_1x1_intrawave_v3,852.48,588.77,0.0
256,2059,4096,3072,ck,0,0,60.0868,a8w8_blockscale_1x128x128_256x128x128x128_16x16_32x32_2x2_8x32x1_8x32x1_1x32x1x8_8_1x1_intrawave_v3,862.36,595.4,0.0
256,2176,4096,3072,ck,0,0,59.4637,a8w8_blockscale_1x128x128_256x128x128x128_16x16_32x32_2x2_8x32x1_8x32x1_1x32x1x8_8_1x1_intrawave_v3,920.91,623.8,0.0
256,2272,4096,3072,ck,0,0,60.7155,a8w8_blockscale_1x128x128_256x128x128x128_16x16_32x32_2x2_8x32x1_8x32x1_1x32x1x8_8_1x1_intrawave_v3,941.72,628.75,0.0
256,2304,4096,3072,ck,0,0,60.0231,a8w8_blockscale_1x128x128_256x128x128x128_16x16_32x32_2x2_8x32x1_8x32x1_1x32x1x8_8_1x1_intrawave_v3,966.0,642.01,0.0
256,2432,4096,3072,ck,0,0,60.1666,a8w8_blockscale_1x128x128_256x128x128x128_16x16_32x32_2x2_8x32x1_8x32x1_1x32x1x8_8_1x1_intrawave_v3,1017.23,664.44,0.0
256,2446,4096,3072,ck,0,0,62.0872,a8w8_blockscale_1x128x128_256x128x128x128_16x16_32x32_2x2_8x32x1_8x32x1_1x32x1x8_8_1x1_intrawave_v3,991.44,646.42,0.0
256,2472,4096,3072,ck,0,0,61.5618,a8w8_blockscale_1x128x128_256x128x128x128_16x16_32x32_2x2_8x32x1_8x32x1_1x32x1x8_8_1x1_intrawave_v3,1010.53,656.7,0.0
256,2550,4096,3072,ck,0,0,62.0837,a8w8_blockscale_1x128x128_256x128x128x128_16x16_32x32_2x2_8x32x1_8x32x1_1x32x1x8_8_1x1_intrawave_v3,1033.65,665.33,0.0
256,2560,4096,3072,ck,0,0,63.4361,a8w8_blockscale_1x128x128_256x128x128x128_16x16_32x32_2x2_8x32x1_8x32x1_1x32x1x8_8_1x1_intrawave_v3,1015.58,652.92,0.0
256,2688,4096,3072,ck,0,0,62.273,a8w8_blockscale_1x128x128_256x128x128x128_16x16_32x32_2x2_8x32x1_8x32x1_1x32x1x8_8_1x1_intrawave_v3,1086.28,688.27,0.0
256,2816,4096,3072,ck,0,0,63.6254,a8w8_blockscale_1x128x128_256x128x128x128_16x16_32x32_2x2_8x32x1_8x32x1_1x32x1x8_8_1x1_intrawave_v3,1113.82,696.3,0.0
256,2944,4096,3072,ck,0,0,64.793,a8w8_blockscale_1x128x128_256x128x128x128_16x16_32x32_2x2_8x32x1_8x32x1_1x32x1x8_8_1x1_intrawave_v3,1143.46,706.0,0.0
256,3002,4096,3072,ck,0,0,66.8852,a8w8_blockscale_1x128x128_256x128x128x128_16x16_32x32_2x2_8x32x1_8x32x1_1x32x1x8_8_1x1_intrawave_v3,1129.51,693.69,0.0
256,3003,4096,3072,ck,0,0,66.6685,a8w8_blockscale_1x128x128_256x128x128x128_16x16_32x32_2x2_8x32x1_8x32x1_1x32x1x8_8_1x1_intrawave_v3,1133.56,696.11,0.0
256,3008,4096,3072,ck,0,0,67.0989,a8w8_blockscale_1x128x128_256x128x128x128_16x16_32x32_2x2_8x32x1_8x32x1_1x32x1x8_8_1x1_intrawave_v3,1128.17,692.49,0.0
256,3029,4096,3072,ck,0,0,67.2569,a8w8_blockscale_1x128x128_256x128x128x128_16x16_32x32_2x2_8x32x1_8x32x1_1x32x1x8_8_1x1_intrawave_v3,1133.37,694.38,0.0
256,3072,4096,3072,ck,0,0,65.8634,a8w8_blockscale_1x128x128_256x128x128x128_16x16_32x32_2x2_8x32x1_8x32x1_1x32x1x8_8_1x1_intrawave_v3,1173.78,716.42,0.0
256,3109,4096,3072,ck,0,0,76.0914,a8w8_blockscale_1x128x128_256x128x128x128_16x16_32x32_2x2_8x32x1_8x32x1_1x32x1x8_8_1x1_intrawave_v3,1028.24,625.6,0.0
256,3158,4096,3072,ck,0,0,75.9635,a8w8_blockscale_1x128x128_256x128x128x128_16x16_32x32_2x2_8x32x1_8x32x1_1x32x1x8_8_1x1_intrawave_v3,1046.21,633.92,0.0
256,3200,4096,3072,ck,0,0,76.6274,a8w8_blockscale_1x128x128_256x128x128x128_16x16_32x32_2x2_8x32x1_8x32x1_1x32x1x8_8_1x1_intrawave_v3,1050.94,634.6,0.0
256,3328,4096,3072,ck,0,0,76.9724,a8w8_blockscale_1x128x128_256x128x128x128_16x16_32x32_2x2_8x32x1_8x32x1_1x32x1x8_8_1x1_intrawave_v3,1088.08,650.49,0.0
256,3372,4096,3072,ck,0,0,78.9694,a8w8_blockscale_1x128x128_256x128x128x128_16x16_32x32_2x2_8x32x1_8x32x1_1x32x1x8_8_1x1_intrawave_v3,1074.58,640.31,0.0
256,3444,4096,3072,ck,0,0,78.1487,a8w8_blockscale_1x128x128_256x128x128x128_16x16_32x32_2x2_8x32x1_8x32x1_1x32x1x8_8_1x1_intrawave_v3,1109.05,657.42,0.0
256,3445,4096,3072,ck,0,0,78.1733,a8w8_blockscale_1x128x128_256x128x128x128_16x16_32x32_2x2_8x32x1_8x32x1_1x32x1x8_8_1x1_intrawave_v3,1109.03,657.35,0.0
256,3456,4096,3072,ck,0,0,78.2848,a8w8_blockscale_1x128x128_256x128x128x128_16x16_32x32_2x2_8x32x1_8x32x1_1x32x1x8_8_1x1_intrawave_v3,1110.98,658.0,0.0
256,3584,4096,3072,ck,0,0,79.8812,a8w8_blockscale_1x128x128_256x128x128x128_16x16_32x32_2x2_8x32x1_8x32x1_1x32x1x8_8_1x1_intrawave_v3,1129.11,662.9,0.0
256,3712,4096,3072,ck,0,0,80.9416,a8w8_blockscale_1x128x128_256x128x128x128_16x16_32x32_2x2_8x32x1_8x32x1_1x32x1x8_8_1x1_intrawave_v3,1154.11,672.03,0.0
256,3840,4096,3072,ck,0,0,82.1916,a8w8_blockscale_1x128x128_256x128x128x128_16x16_32x32_2x2_8x32x1_8x32x1_1x32x1x8_8_1x1_intrawave_v3,1175.75,679.35,0.0
256,3968,4096,3072,ck,0,0,85.264,a8w8_blockscale_1x128x128_256x128x128x128_16x16_32x32_2x2_8x32x1_8x32x1_1x32x1x8_8_1x1_intrawave_v3,1171.16,671.78,0.0
256,4092,4096,3072,ck,0,0,86.3938,a8w8_blockscale_1x128x128_256x128x128x128_16x16_32x32_2x2_8x32x1_8x32x1_1x32x1x8_8_1x1_intrawave_v3,1191.97,679.16,0.0
256,4096,4096,3072,ck,0,0,84.8104,a8w8_blockscale_1x128x128_256x128x128x128_16x16_32x32_2x2_8x32x1_8x32x1_1x32x1x8_8_1x1_intrawave_v3,1215.41,692.37,0.0
256,4207,4096,3072,ck,0,0,95.8232,a8w8_blockscale_1x128x128_256x128x128x128_16x16_32x32_2x2_8x32x1_8x32x1_1x32x1x8_8_1x1_intrawave_v3,1104.87,625.85,0.0
256,4224,4096,3072,ck,0,0,95.6931,a8w8_blockscale_1x128x128_256x128x128x128_16x16_32x32_2x2_8x32x1_8x32x1_1x32x1x8_8_1x1_intrawave_v3,1110.85,628.7,0.0
256,4241,4096,3072,ck,0,0,98.5494,a8w8_blockscale_1x128x128_256x128x128x128_16x16_32x32_2x2_8x32x1_8x32x1_1x32x1x8_8_1x1_intrawave_v3,1082.99,612.42,0.0
256,4245,4096,3072,ck,0,0,96.049,a8w8_blockscale_1x128x128_256x128x128x128_16x16_32x32_2x2_8x32x1_8x32x1_1x32x1x8_8_1x1_intrawave_v3,1112.23,628.83,0.0
256,4352,4096,3072,ck,0,0,97.0168,a8w8_blockscale_1x128x128_256x128x128x128_16x16_32x32_2x2_8x32x1_8x32x1_1x32x1x8_8_1x1_intrawave_v3,1128.89,634.98,0.0
256,4480,4096,3072,ck,0,0,95.7822,a8w8_blockscale_1x128x128_256x128x128x128_16x16_32x32_2x2_8x32x1_8x32x1_1x32x1x8_8_1x1_intrawave_v3,1177.08,658.22,0.0
256,4499,4096,3072,ck,0,0,97.9219,a8w8_blockscale_1x128x128_256x128x128x128_16x16_32x32_2x2_8x32x1_8x32x1_1x32x1x8_8_1x1_intrawave_v3,1156.24,646.02,0.0
256,4504,4096,3072,ck,0,0,96.2604,a8w8_blockscale_1x128x128_256x128x128x128_16x16_32x32_2x2_8x32x1_8x32x1_1x32x1x8_8_1x1_intrawave_v3,1177.5,657.76,0.0
256,4608,4096,3072,ck,0,0,98.7027,a8w8_blockscale_1x128x128_256x128x128x128_16x16_32x32_2x2_8x32x1_8x32x1_1x32x1x8_8_1x1_intrawave_v3,1174.88,653.35,0.0
256,4736,4096,3072,ck,0,0,100.1952,a8w8_blockscale_1x128x128_256x128x128x128_16x16_32x32_2x2_8x32x1_8x32x1_1x32x1x8_8_1x1_intrawave_v3,1189.53,658.01,0.0
256,4864,4096,3072,ck,0,0,105.5049,a8w8_blockscale_1x128x128_256x128x128x128_16x16_32x32_2x2_8x32x1_8x32x1_1x32x1x8_8_1x1_intrawave_v3,1160.2,638.56,0.0
256,4915,4096,3072,ck,0,0,102.9621,a8w8_blockscale_1x128x128_256x128x128x128_16x16_32x32_2x2_8x32x1_8x32x1_1x32x1x8_8_1x1_intrawave_v3,1201.32,659.91,0.0
256,4929,4096,3072,ck,0,0,102.593,a8w8_blockscale_1x128x128_256x128x128x128_16x16_32x32_2x2_8x32x1_8x32x1_1x32x1x8_8_1x1_intrawave_v3,1209.07,663.82,0.0
256,4992,4096,3072,ck,0,0,101.6947,a8w8_blockscale_1x128x128_256x128x128x128_16x16_32x32_2x2_8x32x1_8x32x1_1x32x1x8_8_1x1_intrawave_v3,1235.34,676.66,0.0
256,5027,4096,3072,ck,0,0,103.7398,a8w8_blockscale_1x128x128_256x128x128x128_16x16_32x32_2x2_8x32x1_8x32x1_1x32x1x8_8_1x1_intrawave_v3,1219.48,667.12,0.0
256,5063,4096,3072,ck,0,0,105.0319,a8w8_blockscale_1x128x128_256x128x128x128_16x16_32x32_2x2_8x32x1_8x32x1_1x32x1x8_8_1x1_intrawave_v3,1213.1,662.78,0.0
256,5119,4096,3072,ck,0,0,105.4298,a8w8_blockscale_1x128x128_256x128x128x128_16x16_32x32_2x2_8x32x1_8x32x1_1x32x1x8_8_1x1_intrawave_v3,1221.89,666.26,0.0
256,5120,4096,3072,ck,0,0,103.2358,a8w8_blockscale_1x128x128_256x128x128x128_16x16_32x32_2x2_8x32x1_8x32x1_1x32x1x8_8_1x1_intrawave_v3,1248.1,680.53,0.0
256,5236,4096,3072,ck,0,0,111.7181,a8w8_blockscale_1x128x128_256x128x128x128_16x16_32x32_2x2_8x32x1_8x32x1_1x32x1x8_8_1x1_intrawave_v3,1179.47,640.55,0.0
256,5242,4096,3072,ck,0,0,113.2171,a8w8_blockscale_1x128x128_256x128x128x128_16x16_32x32_2x2_8x32x1_8x32x1_1x32x1x8_8_1x1_intrawave_v3,1165.19,632.67,0.0
256,5246,4096,3072,ck,0,0,113.8438,a8w8_blockscale_1x128x128_256x128x128x128_16x16_32x32_2x2_8x32x1_8x32x1_1x32x1x8_8_1x1_intrawave_v3,1159.66,629.58,0.0
256,5248,4096,3072,ck,0,0,113.7154,a8w8_blockscale_1x128x128_256x128x128x128_16x16_32x32_2x2_8x32x1_8x32x1_1x32x1x8_8_1x1_intrawave_v3,1161.41,630.49,0.0
256,5504,4096,3072,ck,0,0,116.702,a8w8_blockscale_1x128x128_256x128x128x128_16x16_32x32_2x2_8x32x1_8x32x1_1x32x1x8_8_1x1_intrawave_v3,1186.89,639.06,0.0
256,5511,4096,3072,ck,0,0,116.7456,a8w8_blockscale_1x128x128_256x128x128x128_16x16_32x32_2x2_8x32x1_8x32x1_1x32x1x8_8_1x1_intrawave_v3,1187.96,639.5,0.0
256,5518,4096,3072,ck,0,0,116.1386,a8w8_blockscale_1x128x128_256x128x128x128_16x16_32x32_2x2_8x32x1_8x32x1_1x32x1x8_8_1x1_intrawave_v3,1195.68,643.52,0.0
256,5554,4096,3072,ck,0,0,116.6104,a8w8_blockscale_1x128x128_256x128x128x128_16x16_32x32_2x2_8x32x1_8x32x1_1x32x1x8_8_1x1_intrawave_v3,1198.62,644.4,0.0
256,5567,4096,3072,ck,0,0,116.6658,a8w8_blockscale_1x128x128_256x128x128x128_16x16_32x32_2x2_8x32x1_8x32x1_1x32x1x8_8_1x1_intrawave_v3,1200.85,645.34,0.0
256,5629,4096,3072,ck,0,0,115.8109,a8w8_blockscale_1x128x128_256x128x128x128_16x16_32x32_2x2_8x32x1_8x32x1_1x32x1x8_8_1x1_intrawave_v3,1223.19,656.14,0.0
256,5632,4096,3072,ck,0,0,116.5349,a8w8_blockscale_1x128x128_256x128x128x128_16x16_32x32_2x2_8x32x1_8x32x1_1x32x1x8_8_1x1_intrawave_v3,1216.24,652.35,0.0
256,5721,4096,3072,ck,0,0,116.8905,a8w8_blockscale_1x128x128_256x128x128x128_16x16_32x32_2x2_8x32x1_8x32x1_1x32x1x8_8_1x1_intrawave_v3,1231.7,658.94,0.0
256,5760,4096,3072,ck,0,0,117.3444,a8w8_blockscale_1x128x128_256x128x128x128_16x16_32x32_2x2_8x32x1_8x32x1_1x32x1x8_8_1x1_intrawave_v3,1235.3,660.14,0.0
256,5873,4096,3072,ck,0,0,119.3081,a8w8_blockscale_1x128x128_256x128x128x128_16x16_32x32_2x2_8x32x1_8x32x1_1x32x1x8_8_1x1_intrawave_v3,1238.8,659.94,0.0
256,5888,4096,3072,ck,0,0,118.676,a8w8_blockscale_1x128x128_256x128x128x128_16x16_32x32_2x2_8x32x1_8x32x1_1x32x1x8_8_1x1_intrawave_v3,1248.58,664.88,0.0
256,5890,4096,3072,ck,0,0,119.0441,a8w8_blockscale_1x128x128_256x128x128x128_16x16_32x32_2x2_8x32x1_8x32x1_1x32x1x8_8_1x1_intrawave_v3,1245.14,663.01,0.0
256,5893,4096,3072,ck,0,0,119.4676,a8w8_blockscale_1x128x128_256x128x128x128_16x16_32x32_2x2_8x32x1_8x32x1_1x32x1x8_8_1x1_intrawave_v3,1241.36,660.95,0.0
256,5902,4096,3072,ck,0,0,119.8595,a8w8_blockscale_1x128x128_256x128x128x128_16x16_32x32_2x2_8x32x1_8x32x1_1x32x1x8_8_1x1_intrawave_v3,1239.19,659.63,0.0
256,5906,4096,3072,ck,0,0,119.7147,a8w8_blockscale_1x128x128_256x128x128x128_16x16_32x32_2x2_8x32x1_8x32x1_1x32x1x8_8_1x1_intrawave_v3,1241.53,660.81,0.0
256,5907,4096,3072,ck,0,0,120.1273,a8w8_blockscale_1x128x128_256x128x128x128_16x16_32x32_2x2_8x32x1_8x32x1_1x32x1x8_8_1x1_intrawave_v3,1237.47,658.63,0.0
256,5909,4096,3072,ck,0,0,120.0974,a8w8_blockscale_1x128x128_256x128x128x128_16x16_32x32_2x2_8x32x1_8x32x1_1x32x1x8_8_1x1_intrawave_v3,1238.2,658.98,0.0
256,6016,4096,3072,ck,0,0,119.7608,a8w8_blockscale_1x128x128_256x128x128x128_16x16_32x32_2x2_8x32x1_8x32x1_1x32x1x8_8_1x1_intrawave_v3,1264.17,670.9,0.0
256,6119,4096,3072,ck,0,0,121.9836,a8w8_blockscale_1x128x128_256x128x128x128_16x16_32x32_2x2_8x32x1_8x32x1_1x32x1x8_8_1x1_intrawave_v3,1262.38,668.18,0.0
256,6144,4096,3072,ck,0,0,121.157,a8w8_blockscale_1x128x128_256x128x128x128_16x16_32x32_2x2_8x32x1_8x32x1_1x32x1x8_8_1x1_intrawave_v3,1276.19,675.07,0.0
256,6272,4096,3072,ck,0,0,131.7941,a8w8_blockscale_1x128x128_256x128x128x128_16x16_32x32_2x2_8x32x1_8x32x1_1x32x1x8_8_1x1_intrawave_v3,1197.63,631.52,0.0
256,6339,4096,3072,ck,0,0,130.0963,a8w8_blockscale_1x128x128_256x128x128x128_16x16_32x32_2x2_8x32x1_8x32x1_1x32x1x8_8_1x1_intrawave_v3,1226.22,645.56,0.0
256,6380,4096,3072,ck,0,0,131.1491,a8w8_blockscale_1x128x128_256x128x128x128_16x16_32x32_2x2_8x32x1_8x32x1_1x32x1x8_8_1x1_intrawave_v3,1224.24,643.9,0.0
256,6400,4096,3072,ck,0,0,132.6449,a8w8_blockscale_1x128x128_256x128x128x128_16x16_32x32_2x2_8x32x1_8x32x1_1x32x1x8_8_1x1_intrawave_v3,1214.23,638.34,0.0
256,6415,4096,3072,ck,0,0,134.635,a8w8_blockscale_1x128x128_256x128x128x128_16x16_32x32_2x2_8x32x1_8x32x1_1x32x1x8_8_1x1_intrawave_v3,1199.08,630.16,0.0
256,6442,4096,3072,ck,0,0,134.648,a8w8_blockscale_1x128x128_256x128x128x128_16x16_32x32_2x2_8x32x1_8x32x1_1x32x1x8_8_1x1_intrawave_v3,1204.02,632.36,0.0
256,6528,4096,3072,ck,0,0,133.602,a8w8_blockscale_1x128x128_256x128x128x128_16x16_32x32_2x2_8x32x1_8x32x1_1x32x1x8_8_1x1_intrawave_v3,1229.64,644.56,0.0
256,6656,4096,3072,ck,0,0,133.1081,a8w8_blockscale_1x128x128_256x128x128x128_16x16_32x32_2x2_8x32x1_8x32x1_1x32x1x8_8_1x1_intrawave_v3,1258.4,657.78,0.0
256,6784,4096,3072,ck,0,0,135.6209,a8w8_blockscale_1x128x128_256x128x128x128_16x16_32x32_2x2_8x32x1_8x32x1_1x32x1x8_8_1x1_intrawave_v3,1258.84,656.23,0.0
256,6899,4096,3072,ck,0,0,137.538,a8w8_blockscale_1x128x128_256x128x128x128_16x16_32x32_2x2_8x32x1_8x32x1_1x32x1x8_8_1x1_intrawave_v3,1262.33,656.5,0.0
256,6912,4096,3072,ck,0,0,137.3333,a8w8_blockscale_1x128x128_256x128x128x128_16x16_32x32_2x2_8x32x1_8x32x1_1x32x1x8_8_1x1_intrawave_v3,1266.6,658.54,0.0
256,6954,4096,3072,ck,0,0,138.6067,a8w8_blockscale_1x128x128_256x128x128x128_16x16_32x32_2x2_8x32x1_8x32x1_1x32x1x8_8_1x1_intrawave_v3,1262.59,655.9,0.0
256,6981,4096,3072,ck,0,0,138.0266,a8w8_blockscale_1x128x128_256x128x128x128_16x16_32x32_2x2_8x32x1_8x32x1_1x32x1x8_8_1x1_intrawave_v3,1272.82,660.86,0.0
256,7000,4096,3072,ck,0,0,138.8361,a8w8_blockscale_1x128x128_256x128x128x128_16x16_32x32_2x2_8x32x1_8x32x1_1x32x1x8_8_1x1_intrawave_v3,1268.84,658.55,0.0
256,7040,4096,3072,ck,0,0,138.2734,a8w8_blockscale_1x128x128_256x128x128x128_16x16_32x32_2x2_8x32x1_8x32x1_1x32x1x8_8_1x1_intrawave_v3,1281.28,664.49,0.0
256,7168,4096,3072,ck,0,0,138.8603,a8w8_blockscale_1x128x128_256x128x128x128_16x16_32x32_2x2_8x32x1_8x32x1_1x32x1x8_8_1x1_intrawave_v3,1299.07,672.07,0.0
256,7169,4096,3072,ck,0,0,150.4079,a8w8_blockscale_1x128x128_256x128x128x128_16x16_32x32_2x2_8x32x1_8x32x1_1x32x1x8_8_1x1_intrawave_v3,1199.5,620.54,0.0
256,7182,4096,3072,ck,0,0,147.6081,a8w8_blockscale_1x128x128_256x128x128x128_16x16_32x32_2x2_8x32x1_8x32x1_1x32x1x8_8_1x1_intrawave_v3,1224.46,633.31,0.0
256,7217,4096,3072,ck,0,0,148.6498,a8w8_blockscale_1x128x128_256x128x128x128_16x16_32x32_2x2_8x32x1_8x32x1_1x32x1x8_8_1x1_intrawave_v3,1221.81,631.52,0.0
256,7296,4096,3072,ck,0,0,149.0118,a8w8_blockscale_1x128x128_256x128x128x128_16x16_32x32_2x2_8x32x1_8x32x1_1x32x1x8_8_1x1_intrawave_v3,1232.18,635.96,0.0
256,7403,4096,3072,ck,0,0,151.2935,a8w8_blockscale_1x128x128_256x128x128x128_16x16_32x32_2x2_8x32x1_8x32x1_1x32x1x8_8_1x1_intrawave_v3,1231.4,634.33,0.0
256,7424,4096,3072,ck,0,0,147.9847,a8w8_blockscale_1x128x128_256x128x128x128_16x16_32x32_2x2_8x32x1_8x32x1_1x32x1x8_8_1x1_intrawave_v3,1262.5,650.11,0.0
256,7552,4096,3072,ck,0,0,150.613,a8w8_blockscale_1x128x128_256x128x128x128_16x16_32x32_2x2_8x32x1_8x32x1_1x32x1x8_8_1x1_intrawave_v3,1261.86,648.34,0.0
256,7680,4096,3072,ck,0,0,153.8241,a8w8_blockscale_1x128x128_256x128x128x128_16x16_32x32_2x2_8x32x1_8x32x1_1x32x1x8_8_1x1_intrawave_v3,1256.46,644.18,0.0
256,7808,4096,3072,ck,0,0,154.3137,a8w8_blockscale_1x128x128_256x128x128x128_16x16_32x32_2x2_8x32x1_8x32x1_1x32x1x8_8_1x1_intrawave_v3,1273.35,651.48,0.0
256,7917,4096,3072,ck,0,0,155.1828,a8w8_blockscale_1x128x128_256x128x128x128_16x16_32x32_2x2_8x32x1_8x32x1_1x32x1x8_8_1x1_intrawave_v3,1283.89,655.74,0.0
256,7936,4096,3072,ck,0,0,153.0567,a8w8_blockscale_1x128x128_256x128x128x128_16x16_32x32_2x2_8x32x1_8x32x1_1x32x1x8_8_1x1_intrawave_v3,1304.85,666.25,0.0
256,8001,4096,3072,ck,0,0,157.1753,a8w8_blockscale_1x128x128_256x128x128x128_16x16_32x32_2x2_8x32x1_8x32x1_1x32x1x8_8_1x1_intrawave_v3,1281.06,653.45,0.0
256,8005,4096,3072,ck,0,0,154.3171,a8w8_blockscale_1x128x128_256x128x128x128_16x16_32x32_2x2_8x32x1_8x32x1_1x32x1x8_8_1x1_intrawave_v3,1305.44,665.84,0.0
256,8064,4096,3072,ck,0,0,157.388,a8w8_blockscale_1x128x128_256x128x128x128_16x16_32x32_2x2_8x32x1_8x32x1_1x32x1x8_8_1x1_intrawave_v3,1289.41,657.08,0.0
256,8192,4096,3072,ck,0,0,158.11,a8w8_blockscale_1x128x128_256x128x128x128_16x16_32x32_2x2_8x32x1_8x32x1_1x32x1x8_8_1x1_intrawave_v3,1303.89,663.19,0.0
256,8213,4096,3072,ck,0,0,168.6507,a8w8_blockscale_1x128x128_256x128x128x128_16x16_32x32_2x2_8x32x1_8x32x1_1x32x1x8_8_1x1_intrawave_v3,1225.53,623.15,0.0
256,8216,4096,3072,ck,0,0,169.3905,a8w8_blockscale_1x128x128_256x128x128x128_16x16_32x32_2x2_8x32x1_8x32x1_1x32x1x8_8_1x1_intrawave_v3,1220.63,620.62,0.0
256,8320,4096,3072,ck,0,0,167.7507,a8w8_blockscale_1x128x128_256x128x128x128_16x16_32x32_2x2_8x32x1_8x32x1_1x32x1x8_8_1x1_intrawave_v3,1248.16,633.67,0.0
256,8448,4096,3072,ck,0,0,169.0543,a8w8_blockscale_1x128x128_256x128x128x128_16x16_32x32_2x2_8x32x1_8x32x1_1x32x1x8_8_1x1_intrawave_v3,1257.59,637.32,0.0
256,8470,4096,3072,ck,0,0,170.3589,a8w8_blockscale_1x128x128_256x128x128x128_16x16_32x32_2x2_8x32x1_8x32x1_1x32x1x8_8_1x1_intrawave_v3,1251.21,633.89,0.0
256,8515,4096,3072,ck,0,0,170.5902,a8w8_blockscale_1x128x128_256x128x128x128_16x16_32x32_2x2_8x32x1_8x32x1_1x32x1x8_8_1x1_intrawave_v3,1256.15,636.0,0.0
256,8576,4096,3072,ck,0,0,171.1615,a8w8_blockscale_1x128x128_256x128x128x128_16x16_32x32_2x2_8x32x1_8x32x1_1x32x1x8_8_1x1_intrawave_v3,1260.93,637.89,0.0
256,8704,4096,3072,ck,0,0,169.6945,a8w8_blockscale_1x128x128_256x128x128x128_16x16_32x32_2x2_8x32x1_8x32x1_1x32x1x8_8_1x1_intrawave_v3,1290.81,651.91,0.0
256,8832,4096,3072,ck,0,0,172.1524,a8w8_blockscale_1x128x128_256x128x128x128_16x16_32x32_2x2_8x32x1_8x32x1_1x32x1x8_8_1x1_intrawave_v3,1291.09,650.97,0.0
256,8960,4096,3072,ck,0,0,172.566,a8w8_blockscale_1x128x128_256x128x128x128_16x16_32x32_2x2_8x32x1_8x32x1_1x32x1x8_8_1x1_intrawave_v3,1306.66,657.77,0.0
256,9001,4096,3072,ck,0,0,175.4588,a8w8_blockscale_1x128x128_256x128x128x128_16x16_32x32_2x2_8x32x1_8x32x1_1x32x1x8_8_1x1_intrawave_v3,1291.0,649.56,0.0
256,9005,4096,3072,ck,0,0,175.4582,a8w8_blockscale_1x128x128_256x128x128x128_16x16_32x32_2x2_8x32x1_8x32x1_1x32x1x8_8_1x1_intrawave_v3,1291.58,649.81,0.0
256,9007,4096,3072,ck,0,0,175.2419,a8w8_blockscale_1x128x128_256x128x128x128_16x16_32x32_2x2_8x32x1_8x32x1_1x32x1x8_8_1x1_intrawave_v3,1293.46,650.74,0.0
256,9088,4096,3072,ck,0,0,175.8778,a8w8_blockscale_1x128x128_256x128x128x128_16x16_32x32_2x2_8x32x1_8x32x1_1x32x1x8_8_1x1_intrawave_v3,1300.37,653.58,0.0
256,9216,4096,3072,ck,0,0,176.2852,a8w8_blockscale_1x128x128_256x128x128x128_16x16_32x32_2x2_8x32x1_8x32x1_1x32x1x8_8_1x1_intrawave_v3,1315.64,660.25,0.0
256,9344,4096,3072,ck,0,0,184.4907,a8w8_blockscale_1x128x128_256x128x128x128_16x16_32x32_2x2_8x32x1_8x32x1_1x32x1x8_8_1x1_intrawave_v3,1274.59,638.7,0.0
256,9472,4096,3072,ck,0,0,183.8441,a8w8_blockscale_1x128x128_256x128x128x128_16x16_32x32_2x2_8x32x1_8x32x1_1x32x1x8_8_1x1_intrawave_v3,1296.59,648.79,0.0
256,9600,4096,3072,ck,0,0,188.2826,a8w8_blockscale_1x128x128_256x128x128x128_16x16_32x32_2x2_8x32x1_8x32x1_1x32x1x8_8_1x1_intrawave_v3,1283.13,641.15,0.0
256,9613,4096,3072,ck,0,0,185.7477,a8w8_blockscale_1x128x128_256x128x128x128_16x16_32x32_2x2_8x32x1_8x32x1_1x32x1x8_8_1x1_intrawave_v3,1302.41,650.69,0.0
256,9728,4096,3072,ck,0,0,186.2495,a8w8_blockscale_1x128x128_256x128x128x128_16x16_32x32_2x2_8x32x1_8x32x1_1x32x1x8_8_1x1_intrawave_v3,1314.44,655.89,0.0
256,9856,4096,3072,ck,0,0,188.7557,a8w8_blockscale_1x128x128_256x128x128x128_16x16_32x32_2x2_8x32x1_8x32x1_1x32x1x8_8_1x1_intrawave_v3,1314.05,654.82,0.0
256,9984,4096,3072,ck,0,0,190.6184,a8w8_blockscale_1x128x128_256x128x128x128_16x16_32x32_2x2_8x32x1_8x32x1_1x32x1x8_8_1x1_intrawave_v3,1318.11,655.98,0.0
256,10014,4096,3072,ck,0,0,192.8549,a8w8_blockscale_1x128x128_256x128x128x128_16x16_32x32_2x2_8x32x1_8x32x1_1x32x1x8_8_1x1_intrawave_v3,1306.74,650.13,0.0
256,10046,4096,3072,ck,0,0,192.0642,a8w8_blockscale_1x128x128_256x128x128x128_16x16_32x32_2x2_8x32x1_8x32x1_1x32x1x8_8_1x1_intrawave_v3,1316.31,654.68,0.0
256,10076,4096,3072,ck,0,0,203.3182,a8w8_blockscale_1x128x128_256x128x128x128_16x16_32x32_2x2_8x32x1_8x32x1_1x32x1x8_8_1x1_intrawave_v3,1247.16,620.11,0.0
256,10109,4096,3072,ck,0,0,193.7005,a8w8_blockscale_1x128x128_256x128x128x128_16x16_32x32_2x2_8x32x1_8x32x1_1x32x1x8_8_1x1_intrawave_v3,1313.37,652.82,0.0
256,10112,4096,3072,ck,0,0,191.9325,a8w8_blockscale_1x128x128_256x128x128x128_16x16_32x32_2x2_8x32x1_8x32x1_1x32x1x8_8_1x1_intrawave_v3,1325.87,659.01,0.0
256,10255,4096,3072,ck,0,0,203.5391,a8w8_blockscale_1x128x128_256x128x128x128_16x16_32x32_2x2_8x32x1_8x32x1_1x32x1x8_8_1x1_intrawave_v3,1267.94,629.34,0.0
256,10256,4096,3072,ck,0,0,200.0887,a8w8_blockscale_1x128x128_256x128x128x128_16x16_32x32_2x2_8x32x1_8x32x1_1x32x1x8_8_1x1_intrawave_v3,1289.93,640.25,0.0
256,10266,4096,3072,ck,0,0,199.3529,a8w8_blockscale_1x128x128_256x128x128x128_16x16_32x32_2x2_8x32x1_8x32x1_1x32x1x8_8_1x1_intrawave_v3,1295.95,643.18,0.0
256,10268,4096,3072,ck,0,0,201.9301,a8w8_blockscale_1x128x128_256x128x128x128_16x16_32x32_2x2_8x32x1_8x32x1_1x32x1x8_8_1x1_intrawave_v3,1279.66,635.08,0.0
256,10291,4096,3072,ck,0,0,202.4882,a8w8_blockscale_1x128x128_256x128x128x128_16x16_32x32_2x2_8x32x1_8x32x1_1x32x1x8_8_1x1_intrawave_v3,1279.0,634.61,0.0
256,10297,4096,3072,ck,0,0,197.5068,a8w8_blockscale_1x128x128_256x128x128x128_16x16_32x32_2x2_8x32x1_8x32x1_1x32x1x8_8_1x1_intrawave_v3,1312.02,650.96,0.0
256,10298,4096,3072,ck,0,0,200.5861,a8w8_blockscale_1x128x128_256x128x128x128_16x16_32x32_2x2_8x32x1_8x32x1_1x32x1x8_8_1x1_intrawave_v3,1292.0,641.02,0.0
256,10309,4096,3072,ck,0,0,202.4967,a8w8_blockscale_1x128x128_256x128x128x128_16x16_32x32_2x2_8x32x1_8x32x1_1x32x1x8_8_1x1_intrawave_v3,1281.18,635.58,0.0
256,10316,4096,3072,ck,0,0,198.9258,a8w8_blockscale_1x128x128_256x128x128x128_16x16_32x32_2x2_8x32x1_8x32x1_1x32x1x8_8_1x1_intrawave_v3,1305.06,647.39,0.0
256,10323,4096,3072,ck,0,0,199.2032,a8w8_blockscale_1x128x128_256x128x128x128_16x16_32x32_2x2_8x32x1_8x32x1_1x32x1x8_8_1x1_intrawave_v3,1304.13,646.88,0.0
256,10368,4096,3072,ck,0,0,202.2254,a8w8_blockscale_1x128x128_256x128x128x128_16x16_32x32_2x2_8x32x1_8x32x1_1x32x1x8_8_1x1_intrawave_v3,1290.24,639.72,0.0
256,10776,4096,3072,ck,0,0,208.4758,a8w8_blockscale_1x128x128_256x128x128x128_16x16_32x32_2x2_8x32x1_8x32x1_1x32x1x8_8_1x1_intrawave_v3,1300.81,642.59,0.0
256,10780,4096,3072,ck,0,0,206.1791,a8w8_blockscale_1x128x128_256x128x128x128_16x16_32x32_2x2_8x32x1_8x32x1_1x32x1x8_8_1x1_intrawave_v3,1315.79,649.96,0.0
256,10782,4096,3072,ck,0,0,208.2998,a8w8_blockscale_1x128x128_256x128x128x128_16x16_32x32_2x2_8x32x1_8x32x1_1x32x1x8_8_1x1_intrawave_v3,1302.63,643.45,0.0
256,10800,4096,3072,ck,0,0,205.5279,a8w8_blockscale_1x128x128_256x128x128x128_16x16_32x32_2x2_8x32x1_8x32x1_1x32x1x8_8_1x1_intrawave_v3,1322.4,653.12,0.0
256,10803,4096,3072,ck,0,0,205.5345,a8w8_blockscale_1x128x128_256x128x128x128_16x16_32x32_2x2_8x32x1_8x32x1_1x32x1x8_8_1x1_intrawave_v3,1322.73,653.26,0.0
256,10880,4096,3072,ck,0,0,203.1603,a8w8_blockscale_1x128x128_256x128x128x128_16x16_32x32_2x2_8x32x1_8x32x1_1x32x1x8_8_1x1_intrawave_v3,1347.72,665.17,0.0
256,10903,4096,3072,ck,0,0,221.1714,a8w8_blockscale_1x128x128_256x128x128x128_16x16_32x32_2x2_8x32x1_8x32x1_1x32x1x8_8_1x1_intrawave_v3,1240.59,612.17,0.0
256,10934,4096,3072,ck,0,0,209.4731,a8w8_blockscale_1x128x128_256x128x128x128_16x16_32x32_2x2_8x32x1_8x32x1_1x32x1x8_8_1x1_intrawave_v3,1313.6,648.02,0.0
256,10967,4096,3072,ck,0,0,208.3727,a8w8_blockscale_1x128x128_256x128x128x128_16x16_32x32_2x2_8x32x1_8x32x1_1x32x1x8_8_1x1_intrawave_v3,1324.52,653.23,0.0
256,10969,4096,3072,ck,0,0,205.0536,a8w8_blockscale_1x128x128_256x128x128x128_16x16_32x32_2x2_8x32x1_8x32x1_1x32x1x8_8_1x1_intrawave_v3,1346.2,663.91,0.0
256,11008,4096,3072,ck,0,0,209.1081,a8w8_blockscale_1x128x128_256x128x128x128_16x16_32x32_2x2_8x32x1_8x32x1_1x32x1x8_8_1x1_intrawave_v3,1324.8,653.14,0.0
256,11060,4096,3072,ck,0,0,212.2891,a8w8_blockscale_1x128x128_256x128x128x128_16x16_32x32_2x2_8x32x1_8x32x1_1x32x1x8_8_1x1_intrawave_v3,1311.11,646.11,0.0
256,11061,4096,3072,ck,0,0,212.5199,a8w8_blockscale_1x128x128_256x128x128x128_16x16_32x32_2x2_8x32x1_8x32x1_1x32x1x8_8_1x1_intrawave_v3,1309.8,645.46,0.0
256,11079,4096,3072,ck,0,0,211.6072,a8w8_blockscale_1x128x128_256x128x128x128_16x16_32x32_2x2_8x32x1_8x32x1_1x32x1x8_8_1x1_intrawave_v3,1317.59,649.21,0.0
256,11102,4096,3072,ck,0,0,212.3307,a8w8_blockscale_1x128x128_256x128x128x128_16x16_32x32_2x2_8x32x1_8x32x1_1x32x1x8_8_1x1_intrawave_v3,1315.83,648.21,0.0
256,11107,4096,3072,ck,0,0,210.8931,a8w8_blockscale_1x128x128_256x128x128x128_16x16_32x32_2x2_8x32x1_8x32x1_1x32x1x8_8_1x1_intrawave_v3,1325.4,652.9,0.0
256,11108,4096,3072,ck,0,0,209.4604,a8w8_blockscale_1x128x128_256x128x128x128_16x16_32x32_2x2_8x32x1_8x32x1_1x32x1x8_8_1x1_intrawave_v3,1334.58,657.42,0.0
256,11117,4096,3072,ck,0,0,212.7706,a8w8_blockscale_1x128x128_256x128x128x128_16x16_32x32_2x2_8x32x1_8x32x1_1x32x1x8_8_1x1_intrawave_v3,1314.88,647.67,0.0
256,11118,4096,3072,ck,0,0,210.8207,a8w8_blockscale_1x128x128_256x128x128x128_16x16_32x32_2x2_8x32x1_8x32x1_1x32x1x8_8_1x1_intrawave_v3,1327.16,653.71,0.0
256,11136,4096,3072,ck,0,0,211.2315,a8w8_blockscale_1x128x128_256x128x128x128_16x16_32x32_2x2_8x32x1_8x32x1_1x32x1x8_8_1x1_intrawave_v3,1326.73,653.4,0.0
256,11152,4096,3072,ck,0,0,210.9767,a8w8_blockscale_1x128x128_256x128x128x128_16x16_32x32_2x2_8x32x1_8x32x1_1x32x1x8_8_1x1_intrawave_v3,1330.24,655.04,0.0
256,11159,4096,3072,ck,0,0,213.7994,a8w8_blockscale_1x128x128_256x128x128x128_16x16_32x32_2x2_8x32x1_8x32x1_1x32x1x8_8_1x1_intrawave_v3,1313.5,646.76,0.0
256,11160,4096,3072,ck,0,0,209.9332,a8w8_blockscale_1x128x128_256x128x128x128_16x16_32x32_2x2_8x32x1_8x32x1_1x32x1x8_8_1x1_intrawave_v3,1337.81,658.73,0.0
256,11264,4096,3072,ck,0,0,211.1574,a8w8_blockscale_1x128x128_256x128x128x128_16x16_32x32_2x2_8x32x1_8x32x1_1x32x1x8_8_1x1_intrawave_v3,1342.45,660.46,0.0
256,11392,4096,3072,ck,0,0,223.6294,a8w8_blockscale_1x128x128_256x128x128x128_16x16_32x32_2x2_8x32x1_8x32x1_1x32x1x8_8_1x1_intrawave_v3,1281.98,630.07,0.0
256,11520,4096,3072,ck,0,0,216.4747,a8w8_blockscale_1x128x128_256x128x128x128_16x16_32x32_2x2_8x32x1_8x32x1_1x32x1x8_8_1x1_intrawave_v3,1339.23,657.56,0.0
256,11648,4096,3072,ck,0,0,223.8567,a8w8_blockscale_1x128x128_256x128x128x128_16x16_32x32_2x2_8x32x1_8x32x1_1x32x1x8_8_1x1_intrawave_v3,1309.46,642.31,0.0
256,11714,4096,3072,ck,0,0,220.936,a8w8_blockscale_1x128x128_256x128x128x128_16x16_32x32_2x2_8x32x1_8x32x1_1x32x1x8_8_1x1_intrawave_v3,1334.29,654.17,0.0
256,11776,4096,3072,ck,0,0,220.566,a8w8_blockscale_1x128x128_256x128x128x128_16x16_32x32_2x2_8x32x1_8x32x1_1x32x1x8_8_1x1_intrawave_v3,1343.6,658.43,0.0
256,11904,4096,3072,ck,0,0,223.8175,a8w8_blockscale_1x128x128_256x128x128x128_16x16_32x32_2x2_8x32x1_8x32x1_1x32x1x8_8_1x1_intrawave_v3,1338.47,655.31,0.0
256,12032,4096,3072,ck,0,0,221.26,a8w8_blockscale_1x128x128_256x128x128x128_16x16_32x32_2x2_8x32x1_8x32x1_1x32x1x8_8_1x1_intrawave_v3,1368.5,669.4,0.0
256,12160,4096,3072,ck,0,0,225.6973,a8w8_blockscale_1x128x128_256x128x128x128_16x16_32x32_2x2_8x32x1_8x32x1_1x32x1x8_8_1x1_intrawave_v3,1355.87,662.63,0.0
256,12416,4096,3072,ck,0,0,238.5951,a8w8_blockscale_1x128x128_256x128x128x128_16x16_32x32_2x2_8x32x1_8x32x1_1x32x1x8_8_1x1_intrawave_v3,1309.58,638.89,0.0
256,12430,4096,3072,ck,0,0,238.9664,a8w8_blockscale_1x128x128_256x128x128x128_16x16_32x32_2x2_8x32x1_8x32x1_1x32x1x8_8_1x1_intrawave_v3,1309.02,638.56,0.0
256,12544,4096,3072,ck,0,0,231.7012,a8w8_blockscale_1x128x128_256x128x128x128_16x16_32x32_2x2_8x32x1_8x32x1_1x32x1x8_8_1x1_intrawave_v3,1362.44,664.12,0.0
256,12672,4096,3072,ck,0,0,237.061,a8w8_blockscale_1x128x128_256x128x128x128_16x16_32x32_2x2_8x32x1_8x32x1_1x32x1x8_8_1x1_intrawave_v3,1345.23,655.19,0.0
256,12800,4096,3072,ck,0,0,240.911,a8w8_blockscale_1x128x128_256x128x128x128_16x16_32x32_2x2_8x32x1_8x32x1_1x32x1x8_8_1x1_intrawave_v3,1337.1,650.71,0.0
256,12928,4096,3072,ck,0,0,237.9382,a8w8_blockscale_1x128x128_256x128x128x128_16x16_32x32_2x2_8x32x1_8x32x1_1x32x1x8_8_1x1_intrawave_v3,1367.35,664.89,0.0
256,13056,4096,3072,ck,0,0,241.3561,a8w8_blockscale_1x128x128_256x128x128x128_16x16_32x32_2x2_8x32x1_8x32x1_1x32x1x8_8_1x1_intrawave_v3,1361.33,661.45,0.0
256,13145,4096,3072,ck,0,0,242.9897,a8w8_blockscale_1x128x128_256x128x128x128_16x16_32x32_2x2_8x32x1_8x32x1_1x32x1x8_8_1x1_intrawave_v3,1361.39,661.13,0.0
256,13178,4096,3072,ck,0,0,245.7239,a8w8_blockscale_1x128x128_256x128x128x128_16x16_32x32_2x2_8x32x1_8x32x1_1x32x1x8_8_1x1_intrawave_v3,1349.63,655.29,0.0
256,13184,4096,3072,ck,0,0,245.1046,a8w8_blockscale_1x128x128_256x128x128x128_16x16_32x32_2x2_8x32x1_8x32x1_1x32x1x8_8_1x1_intrawave_v3,1353.65,657.22,0.0
256,13312,4096,3072,ck,0,0,244.137,a8w8_blockscale_1x128x128_256x128x128x128_16x16_32x32_2x2_8x32x1_8x32x1_1x32x1x8_8_1x1_intrawave_v3,1372.21,665.73,0.0
256,13440,4096,3072,ck,0,0,249.3819,a8w8_blockscale_1x128x128_256x128x128x128_16x16_32x32_2x2_8x32x1_8x32x1_1x32x1x8_8_1x1_intrawave_v3,1356.27,657.51,0.0
256,13568,4096,3072,ck,0,0,249.848,a8w8_blockscale_1x128x128_256x128x128x128_16x16_32x32_2x2_8x32x1_8x32x1_1x32x1x8_8_1x1_intrawave_v3,1366.63,662.05,0.0
256,13663,4096,3072,ck,0,0,254.2264,a8w8_blockscale_1x128x128_256x128x128x128_16x16_32x32_2x2_8x32x1_8x32x1_1x32x1x8_8_1x1_intrawave_v3,1352.5,654.86,0.0
256,13696,4096,3072,ck,0,0,252.6372,a8w8_blockscale_1x128x128_256x128x128x128_16x16_32x32_2x2_8x32x1_8x32x1_1x32x1x8_8_1x1_intrawave_v3,1364.29,660.45,0.0
256,13824,4096,3072,ck,0,0,254.7893,a8w8_blockscale_1x128x128_256x128x128x128_16x16_32x32_2x2_8x32x1_8x32x1_1x32x1x8_8_1x1_intrawave_v3,1365.41,660.53,0.0
256,13952,4096,3072,ck,0,0,253.3118,a8w8_blockscale_1x128x128_256x128x128x128_16x16_32x32_2x2_8x32x1_8x32x1_1x32x1x8_8_1x1_intrawave_v3,1386.09,670.08,0.0
256,14080,4096,3072,ck,0,0,255.4106,a8w8_blockscale_1x128x128_256x128x128x128_16x16_32x32_2x2_8x32x1_8x32x1_1x32x1x8_8_1x1_intrawave_v3,1387.31,670.22,0.0
256,14208,4096,3072,ck,0,0,257.731,a8w8_blockscale_1x128x128_256x128x128x128_16x16_32x32_2x2_8x32x1_8x32x1_1x32x1x8_8_1x1_intrawave_v3,1387.32,669.78,0.0
256,14305,4096,3072,ck,0,0,259.3234,a8w8_blockscale_1x128x128_256x128x128x128_16x16_32x32_2x2_8x32x1_8x32x1_1x32x1x8_8_1x1_intrawave_v3,1388.22,669.88,0.0
256,14336,4096,3072,ck,0,0,264.0531,a8w8_blockscale_1x128x128_256x128x128x128_16x16_32x32_2x2_8x32x1_8x32x1_1x32x1x8_8_1x1_intrawave_v3,1366.31,659.2,0.0
256,14464,4096,3072,ck,0,0,271.5717,a8w8_blockscale_1x128x128_256x128x128x128_16x16_32x32_2x2_8x32x1_8x32x1_1x32x1x8_8_1x1_intrawave_v3,1340.34,646.26,0.0
256,14592,4096,3072,ck,0,0,271.72,a8w8_blockscale_1x128x128_256x128x128x128_16x16_32x32_2x2_8x32x1_8x32x1_1x32x1x8_8_1x1_intrawave_v3,1351.46,651.21,0.0
256,14720,4096,3072,ck,0,0,270.5984,a8w8_blockscale_1x128x128_256x128x128x128_16x16_32x32_2x2_8x32x1_8x32x1_1x32x1x8_8_1x1_intrawave_v3,1368.97,659.24,0.0
256,14848,4096,3072,ck,0,0,273.3112,a8w8_blockscale_1x128x128_256x128x128x128_16x16_32x32_2x2_8x32x1_8x32x1_1x32x1x8_8_1x1_intrawave_v3,1367.17,657.97,0.0
256,14976,4096,3072,ck,0,0,274.7023,a8w8_blockscale_1x128x128_256x128x128x128_16x16_32x32_2x2_8x32x1_8x32x1_1x32x1x8_8_1x1_intrawave_v3,1371.97,659.89,0.0
256,15104,4096,3072,ck,0,0,275.3013,a8w8_blockscale_1x128x128_256x128x128x128_16x16_32x32_2x2_8x32x1_8x32x1_1x32x1x8_8_1x1_intrawave_v3,1380.69,663.69,0.0
256,15125,4096,3072,ck,0,0,284.6371,a8w8_blockscale_1x128x128_256x128x128x128_16x16_32x32_2x2_8x32x1_8x32x1_1x32x1x8_8_1x1_intrawave_v3,1337.26,642.75,0.0
256,15232,4096,3072,ck,0,0,278.8217,a8w8_blockscale_1x128x128_256x128x128x128_16x16_32x32_2x2_8x32x1_8x32x1_1x32x1x8_8_1x1_intrawave_v3,1374.81,660.48,0.0
256,15234,4096,3072,ck,0,0,282.1142,a8w8_blockscale_1x128x128_256x128x128x128_16x16_32x32_2x2_8x32x1_8x32x1_1x32x1x8_8_1x1_intrawave_v3,1358.94,652.85,0.0
256,15237,4096,3072,ck,0,0,278.9608,a8w8_blockscale_1x128x128_256x128x128x128_16x16_32x32_2x2_8x32x1_8x32x1_1x32x1x8_8_1x1_intrawave_v3,1374.57,660.35,0.0
256,15240,4096,3072,ck,0,0,276.4641,a8w8_blockscale_1x128x128_256x128x128x128_16x16_32x32_2x2_8x32x1_8x32x1_1x32x1x8_8_1x1_intrawave_v3,1387.26,666.44,0.0
256,15360,4096,3072,ck,0,0,278.4893,a8w8_blockscale_1x128x128_256x128x128x128_16x16_32x32_2x2_8x32x1_8x32x1_1x32x1x8_8_1x1_intrawave_v3,1388.01,666.45,0.0
256,15488,4096,3072,ck,0,0,284.8913,a8w8_blockscale_1x128x128_256x128x128x128_16x16_32x32_2x2_8x32x1_8x32x1_1x32x1x8_8_1x1_intrawave_v3,1368.13,656.53,0.0
256,15616,4096,3072,ck,0,0,289.8838,a8w8_blockscale_1x128x128_256x128x128x128_16x16_32x32_2x2_8x32x1_8x32x1_1x32x1x8_8_1x1_intrawave_v3,1355.68,650.2,0.0
256,15744,4096,3072,ck,0,0,286.6873,a8w8_blockscale_1x128x128_256x128x128x128_16x16_32x32_2x2_8x32x1_8x32x1_1x32x1x8_8_1x1_intrawave_v3,1382.03,662.48,0.0
256,15820,4096,3072,ck,0,0,293.3709,a8w8_blockscale_1x128x128_256x128x128x128_16x16_32x32_2x2_8x32x1_8x32x1_1x32x1x8_8_1x1_intrawave_v3,1357.06,650.3,0.0
256,15872,4096,3072,ck,0,0,289.9076,a8w8_blockscale_1x128x128_256x128x128x128_16x16_32x32_2x2_8x32x1_8x32x1_1x32x1x8_8_1x1_intrawave_v3,1377.79,660.09,0.0
256,16000,4096,3072,ck,0,0,289.1699,a8w8_blockscale_1x128x128_256x128x128x128_16x16_32x32_2x2_8x32x1_8x32x1_1x32x1x8_8_1x1_intrawave_v3,1392.45,666.76,0.0
256,16003,4096,3072,ck,0,0,294.7427,a8w8_blockscale_1x128x128_256x128x128x128_16x16_32x32_2x2_8x32x1_8x32x1_1x32x1x8_8_1x1_intrawave_v3,1366.37,654.27,0.0
256,16080,4096,3072,ck,0,0,291.3715,a8w8_blockscale_1x128x128_256x128x128x128_16x16_32x32_2x2_8x32x1_8x32x1_1x32x1x8_8_1x1_intrawave_v3,1388.83,664.81,0.0
256,16128,4096,3072,ck,0,0,286.3779,a8w8_blockscale_1x128x128_256x128x128x128_16x16_32x32_2x2_8x32x1_8x32x1_1x32x1x8_8_1x1_intrawave_v3,1417.27,678.3,0.0
256,16256,4096,3072,ck,0,0,293.6991,a8w8_blockscale_1x128x128_256x128x128x128_16x16_32x32_2x2_8x32x1_8x32x1_1x32x1x8_8_1x1_intrawave_v3,1392.91,666.3,0.0
256,16384,4096,3072,ck,0,0,297.5559,a8w8_blockscale_1x128x128_256x128x128x128_16x16_32x32_2x2_8x32x1_8x32x1_1x32x1x8_8_1x1_intrawave_v3,1385.68,662.51,0.0
256,16512,4096,3072,ck,0,0,306.6582,a8w8_blockscale_1x128x128_256x128x128x128_16x16_32x32_2x2_8x32x1_8x32x1_1x32x1x8_8_1x1_intrawave_v3,1355.05,647.54,0.0
256,16640,4096,3072,ck,0,0,304.9799,a8w8_blockscale_1x128x128_256x128x128x128_16x16_32x32_2x2_8x32x1_8x32x1_1x32x1x8_8_1x1_intrawave_v3,1373.07,655.83,0.0
256,16768,4096,3072,ck,0,0,305.5031,a8w8_blockscale_1x128x128_256x128x128x128_16x16_32x32_2x2_8x32x1_8x32x1_1x32x1x8_8_1x1_intrawave_v3,1381.26,659.43,0.0
256,16896,4096,3072,ck,0,0,307.2649,a8w8_blockscale_1x128x128_256x128x128x128_16x16_32x32_2x2_8x32x1_8x32x1_1x32x1x8_8_1x1_intrawave_v3,1383.83,660.34,0.0
256,17024,4096,3072,ck,0,0,300.8983,a8w8_blockscale_1x128x128_256x128x128x128_16x16_32x32_2x2_8x32x1_8x32x1_1x32x1x8_8_1x1_intrawave_v3,1423.81,679.1,0.0
256,17152,4096,3072,ck,0,0,303.7043,a8w8_blockscale_1x128x128_256x128x128x128_16x16_32x32_2x2_8x32x1_8x32x1_1x32x1x8_8_1x1_intrawave_v3,1421.26,677.58,0.0
256,17280,4096,3072,ck,0,0,312.5278,a8w8_blockscale_1x128x128_256x128x128x128_16x16_32x32_2x2_8x32x1_8x32x1_1x32x1x8_8_1x1_intrawave_v3,1391.45,663.06,0.0
256,17408,4096,3072,ck,0,0,309.3844,a8w8_blockscale_1x128x128_256x128x128x128_16x16_32x32_2x2_8x32x1_8x32x1_1x32x1x8_8_1x1_intrawave_v3,1415.99,674.46,0.0
256,17536,4096,3072,ck,0,0,312.8477,a8w8_blockscale_1x128x128_256x128x128x128_16x16_32x32_2x2_8x32x1_8x32x1_1x32x1x8_8_1x1_intrawave_v3,1410.62,671.6,0.0
256,17664,4096,3072,ck,0,0,317.783,a8w8_blockscale_1x128x128_256x128x128x128_16x16_32x32_2x2_8x32x1_8x32x1_1x32x1x8_8_1x1_intrawave_v3,1398.84,665.71,0.0
256,17792,4096,3072,ck,0,0,321.8286,a8w8_blockscale_1x128x128_256x128x128x128_16x16_32x32_2x2_8x32x1_8x32x1_1x32x1x8_8_1x1_intrawave_v3,1391.27,661.82,0.0
256,17920,4096,3072,ck,0,0,316.9622,a8w8_blockscale_1x128x128_256x128x128x128_16x16_32x32_2x2_8x32x1_8x32x1_1x32x1x8_8_1x1_intrawave_v3,1422.79,676.53,0.0
256,18048,4096,3072,ck,0,0,319.3283,a8w8_blockscale_1x128x128_256x128x128x128_16x16_32x32_2x2_8x32x1_8x32x1_1x32x1x8_8_1x1_intrawave_v3,1422.34,676.03,0.0
256,18176,4096,3072,ck,0,0,321.7683,a8w8_blockscale_1x128x128_256x128x128x128_16x16_32x32_2x2_8x32x1_8x32x1_1x32x1x8_8_1x1_intrawave_v3,1421.56,675.38,0.0
256,18304,4096,3072,ck,0,0,323.7754,a8w8_blockscale_1x128x128_256x128x128x128_16x16_32x32_2x2_8x32x1_8x32x1_1x32x1x8_8_1x1_intrawave_v3,1422.7,675.65,0.0
256,18432,4096,3072,ck,0,0,331.0837,a8w8_blockscale_1x128x128_256x128x128x128_16x16_32x32_2x2_8x32x1_8x32x1_1x32x1x8_8_1x1_intrawave_v3,1401.02,665.09,0.0
256,18560,4096,3072,ck,0,0,328.539,a8w8_blockscale_1x128x128_256x128x128x128_16x16_32x32_2x2_8x32x1_8x32x1_1x32x1x8_8_1x1_intrawave_v3,1421.68,674.63,0.0
256,18688,4096,3072,ck,0,0,336.1475,a8w8_blockscale_1x128x128_256x128x128x128_16x16_32x32_2x2_8x32x1_8x32x1_1x32x1x8_8_1x1_intrawave_v3,1399.08,663.65,0.0
256,18816,4096,3072,ck,0,0,337.3534,a8w8_blockscale_1x128x128_256x128x128x128_16x16_32x32_2x2_8x32x1_8x32x1_1x32x1x8_8_1x1_intrawave_v3,1403.63,665.55,0.0
256,18944,4096,3072,ck,0,0,333.964,a8w8_blockscale_1x128x128_256x128x128x128_16x16_32x32_2x2_8x32x1_8x32x1_1x32x1x8_8_1x1_intrawave_v3,1427.52,676.62,0.0
256,19072,4096,3072,ck,0,0,340.4379,a8w8_blockscale_1x128x128_256x128x128x128_16x16_32x32_2x2_8x32x1_8x32x1_1x32x1x8_8_1x1_intrawave_v3,1409.84,667.99,0.0
256,19200,4096,3072,ck,0,0,338.4491,a8w8_blockscale_1x128x128_256x128x128x128_16x16_32x32_2x2_8x32x1_8x32x1_1x32x1x8_8_1x1_intrawave_v3,1427.64,676.18,0.0
256,19328,4096,3072,ck,0,0,341.322,a8w8_blockscale_1x128x128_256x128x128x128_16x16_32x32_2x2_8x32x1_8x32x1_1x32x1x8_8_1x1_intrawave_v3,1425.06,674.71,0.0
256,19456,4096,3072,ck,0,0,342.2698,a8w8_blockscale_1x128x128_256x128x128x128_16x16_32x32_2x2_8x32x1_8x32x1_1x32x1x8_8_1x1_intrawave_v3,1430.53,677.05,0.0
256,19584,4096,3072,ck,0,0,351.6284,a8w8_blockscale_1x128x128_256x128x128x128_16x16_32x32_2x2_8x32x1_8x32x1_1x32x1x8_8_1x1_intrawave_v3,1401.61,663.13,0.0
256,19712,4096,3072,ck,0,0,351.7126,a8w8_blockscale_1x128x128_256x128x128x128_16x16_32x32_2x2_8x32x1_8x32x1_1x32x1x8_8_1x1_intrawave_v3,1410.44,667.08,0.0
256,19840,4096,3072,ck,0,0,345.9929,a8w8_blockscale_1x128x128_256x128x128x128_16x16_32x32_2x2_8x32x1_8x32x1_1x32x1x8_8_1x1_intrawave_v3,1443.06,682.27,0.0
256,19968,4096,3072,ck,0,0,350.4448,a8w8_blockscale_1x128x128_256x128x128x128_16x16_32x32_2x2_8x32x1_8x32x1_1x32x1x8_8_1x1_intrawave_v3,1433.92,677.72,0.0
256,20096,4096,3072,ck,0,0,351.1661,a8w8_blockscale_1x128x128_256x128x128x128_16x16_32x32_2x2_8x32x1_8x32x1_1x32x1x8_8_1x1_intrawave_v3,1440.15,680.43,0.0
256,20224,4096,3072,ck,0,0,351.3985,a8w8_blockscale_1x128x128_256x128x128x128_16x16_32x32_2x2_8x32x1_8x32x1_1x32x1x8_8_1x1_intrawave_v3,1448.37,684.08,0.0
256,20352,4096,3072,ck,0,0,362.8073,a8w8_blockscale_1x128x128_256x128x128x128_16x16_32x32_2x2_8x32x1_8x32x1_1x32x1x8_8_1x1_intrawave_v3,1411.7,666.55,0.0
256,20480,4096,3072,ck,0,0,359.7539,a8w8_blockscale_1x128x128_256x128x128x128_16x16_32x32_2x2_8x32x1_8x32x1_1x32x1x8_8_1x1_intrawave_v3,1432.64,676.21,0.0
256,20608,4096,3072,ck,0,0,369.5577,a8w8_blockscale_1x128x128_256x128x128x128_16x16_32x32_2x2_8x32x1_8x32x1_1x32x1x8_8_1x1_intrawave_v3,1403.35,662.17,0.0
256,20736,4096,3072,ck,0,0,374.35,a8w8_blockscale_1x128x128_256x128x128x128_16x16_32x32_2x2_8x32x1_8x32x1_1x32x1x8_8_1x1_intrawave_v3,1393.99,657.55,0.0
256,20864,4096,3072,ck,0,0,362.2145,a8w8_blockscale_1x128x128_256x128x128x128_16x16_32x32_2x2_8x32x1_8x32x1_1x32x1x8_8_1x1_intrawave_v3,1449.58,683.56,0.0
256,20992,4096,3072,ck,0,0,360.7058,a8w8_blockscale_1x128x128_256x128x128x128_16x16_32x32_2x2_8x32x1_8x32x1_1x32x1x8_8_1x1_intrawave_v3,1464.58,690.42,0.0
256,21120,4096,3072,ck,0,0,366.543,a8w8_blockscale_1x128x128_256x128x128x128_16x16_32x32_2x2_8x32x1_8x32x1_1x32x1x8_8_1x1_intrawave_v3,1450.04,683.35,0.0
256,21248,4096,3072,ck,0,0,373.1958,a8w8_blockscale_1x128x128_256x128x128x128_16x16_32x32_2x2_8x32x1_8x32x1_1x32x1x8_8_1x1_intrawave_v3,1432.82,675.04,0.0
256,21376,4096,3072,ck,0,0,374.9947,a8w8_blockscale_1x128x128_256x128x128x128_16x16_32x32_2x2_8x32x1_8x32x1_1x32x1x8_8_1x1_intrawave_v3,1434.54,675.64,0.0
256,21504,4096,3072,ck,0,0,375.9684,a8w8_blockscale_1x128x128_256x128x128x128_16x16_32x32_2x2_8x32x1_8x32x1_1x32x1x8_8_1x1_intrawave_v3,1439.39,677.73,0.0
256,21632,4096,3072,ck,0,0,381.9088,a8w8_blockscale_1x128x128_256x128x128x128_16x16_32x32_2x2_8x32x1_8x32x1_1x32x1x8_8_1x1_intrawave_v3,1425.44,670.96,0.0
256,21760,4096,3072,ck,0,0,381.5467,a8w8_blockscale_1x128x128_256x128x128x128_16x16_32x32_2x2_8x32x1_8x32x1_1x32x1x8_8_1x1_intrawave_v3,1435.23,675.38,0.0
256,21888,4096,3072,ck,0,0,382.0085,a8w8_blockscale_1x128x128_256x128x128x128_16x16_32x32_2x2_8x32x1_8x32x1_1x32x1x8_8_1x1_intrawave_v3,1441.93,678.33,0.0
256,22016,4096,3072,ck,0,0,383.7908,a8w8_blockscale_1x128x128_256x128x128x128_16x16_32x32_2x2_8x32x1_8x32x1_1x32x1x8_8_1x1_intrawave_v3,1443.63,678.94,0.0
256,22144,4096,3072,ck,0,0,384.4339,a8w8_blockscale_1x128x128_256x128x128x128_16x16_32x32_2x2_8x32x1_8x32x1_1x32x1x8_8_1x1_intrawave_v3,1449.59,681.56,0.0
256,22272,4096,3072,ck,0,0,392.6962,a8w8_blockscale_1x128x128_256x128x128x128_16x16_32x32_2x2_8x32x1_8x32x1_1x32x1x8_8_1x1_intrawave_v3,1427.29,670.89,0.0
256,22400,4096,3072,ck,0,0,392.4755,a8w8_blockscale_1x128x128_256x128x128x128_16x16_32x32_2x2_8x32x1_8x32x1_1x32x1x8_8_1x1_intrawave_v3,1436.3,674.94,0.0
256,22528,4096,3072,ck,0,0,393.9965,a8w8_blockscale_1x128x128_256x128x128x128_16x16_32x32_2x2_8x32x1_8x32x1_1x32x1x8_8_1x1_intrawave_v3,1438.94,675.99,0.0
256,22656,4096,3072,ck,0,0,393.0137,a8w8_blockscale_1x128x128_256x128x128x128_16x16_32x32_2x2_8x32x1_8x32x1_1x32x1x8_8_1x1_intrawave_v3,1450.73,681.35,0.0
256,22784,4096,3072,ck,0,0,389.4182,a8w8_blockscale_1x128x128_256x128x128x128_16x16_32x32_2x2_8x32x1_8x32x1_1x32x1x8_8_1x1_intrawave_v3,1472.4,691.34,0.0
256,22912,4096,3072,ck,0,0,418.6236,a8w8_blockscale_1x128x128_256x128x128x128_16x16_32x32_2x2_8x32x1_8x32x1_1x32x1x8_8_1x1_intrawave_v3,1377.37,646.56,0.0
256,23040,4096,3072,ck,0,0,400.0672,a8w8_blockscale_1x128x128_256x128x128x128_16x16_32x32_2x2_8x32x1_8x32x1_1x32x1x8_8_1x1_intrawave_v3,1449.31,680.15,0.0
256,23168,4096,3072,ck,0,0,397.8457,a8w8_blockscale_1x128x128_256x128x128x128_16x16_32x32_2x2_8x32x1_8x32x1_1x32x1x8_8_1x1_intrawave_v3,1465.5,687.57,0.0
256,23296,4096,3072,ck,0,0,404.2837,a8w8_blockscale_1x128x128_256x128x128x128_16x16_32x32_2x2_8x32x1_8x32x1_1x32x1x8_8_1x1_intrawave_v3,1450.13,680.19,0.0
256,23424,4096,3072,ck,0,0,413.06,a8w8_blockscale_1x128x128_256x128x128x128_16x16_32x32_2x2_8x32x1_8x32x1_1x32x1x8_8_1x1_intrawave_v3,1427.12,669.23,0.0
256,23552,4096,3072,ck,0,0,401.8563,a8w8_blockscale_1x128x128_256x128x128x128_16x16_32x32_2x2_8x32x1_8x32x1_1x32x1x8_8_1x1_intrawave_v3,1474.92,691.47,0.0
256,23680,4096,3072,ck,0,0,419.9057,a8w8_blockscale_1x128x128_256x128x128x128_16x16_32x32_2x2_8x32x1_8x32x1_1x32x1x8_8_1x1_intrawave_v3,1419.19,665.18,0.0
256,23808,4096,3072,ck,0,0,410.1684,a8w8_blockscale_1x128x128_256x128x128x128_16x16_32x32_2x2_8x32x1_8x32x1_1x32x1x8_8_1x1_intrawave_v3,1460.74,684.49,0.0
256,23936,4096,3072,ck,0,0,418.3269,a8w8_blockscale_1x128x128_256x128x128x128_16x16_32x32_2x2_8x32x1_8x32x1_1x32x1x8_8_1x1_intrawave_v3,1439.95,674.59,0.0
256,24064,4096,3072,ck,0,0,413.6084,a8w8_blockscale_1x128x128_256x128x128x128_16x16_32x32_2x2_8x32x1_8x32x1_1x32x1x8_8_1x1_intrawave_v3,1464.16,685.77,0.0
256,24192,4096,3072,ck,0,0,419.8191,a8w8_blockscale_1x128x128_256x128x128x128_16x16_32x32_2x2_8x32x1_8x32x1_1x32x1x8_8_1x1_intrawave_v3,1450.18,679.06,0.0
256,24320,4096,3072,ck,0,0,418.2955,a8w8_blockscale_1x128x128_256x128x128x128_16x16_32x32_2x2_8x32x1_8x32x1_1x32x1x8_8_1x1_intrawave_v3,1463.16,684.98,0.0
256,24448,4096,3072,ck,0,0,429.6719,a8w8_blockscale_1x128x128_256x128x128x128_16x16_32x32_2x2_8x32x1_8x32x1_1x32x1x8_8_1x1_intrawave_v3,1431.92,670.2,0.0
256,24576,4096,3072,ck,0,0,420.3335,a8w8_blockscale_1x128x128_256x128x128x128_16x16_32x32_2x2_8x32x1_8x32x1_1x32x1x8_8_1x1_intrawave_v3,1471.39,688.52,0.0
256,24704,4096,3072,ck,0,0,417.1254,a8w8_blockscale_1x128x128_256x128x128x128_16x16_32x32_2x2_8x32x1_8x32x1_1x32x1x8_8_1x1_intrawave_v3,1490.43,697.27,0.0
256,24832,4096,3072,ck,0,0,430.9802,a8w8_blockscale_1x128x128_256x128x128x128_16x16_32x32_2x2_8x32x1_8x32x1_1x32x1x8_8_1x1_intrawave_v3,1449.99,678.2,0.0
256,24960,4096,3072,ck,0,0,435.5778,a8w8_blockscale_1x128x128_256x128x128x128_16x16_32x32_2x2_8x32x1_8x32x1_1x32x1x8_8_1x1_intrawave_v3,1442.08,674.35,0.0
256,25088,4096,3072,ck,0,0,419.8239,a8w8_blockscale_1x128x128_256x128x128x128_16x16_32x32_2x2_8x32x1_8x32x1_1x32x1x8_8_1x1_intrawave_v3,1503.87,703.09,0.0
256,25216,4096,3072,ck,0,0,432.3737,a8w8_blockscale_1x128x128_256x128x128x128_16x16_32x32_2x2_8x32x1_8x32x1_1x32x1x8_8_1x1_intrawave_v3,1467.67,686.02,0.0
256,25344,4096,3072,ck,0,0,431.5121,a8w8_blockscale_1x128x128_256x128x128x128_16x16_32x32_2x2_8x32x1_8x32x1_1x32x1x8_8_1x1_intrawave_v3,1478.06,690.73,0.0
256,25472,4096,3072,ck,0,0,431.5943,a8w8_blockscale_1x128x128_256x128x128x128_16x16_32x32_2x2_8x32x1_8x32x1_1x32x1x8_8_1x1_intrawave_v3,1485.25,693.94,0.0
256,25600,4096,3072,ck,0,0,435.9626,a8w8_blockscale_1x128x128_256x128x128x128_16x16_32x32_2x2_8x32x1_8x32x1_1x32x1x8_8_1x1_intrawave_v3,1477.75,690.29,0.0
256,25728,4096,3072,ck,0,0,449.1085,a8w8_blockscale_1x128x128_256x128x128x128_16x16_32x32_2x2_8x32x1_8x32x1_1x32x1x8_8_1x1_intrawave_v3,1441.67,673.3,0.0
256,25984,4096,3072,ck,0,0,435.0335,a8w8_blockscale_1x128x128_256x128x128x128_16x16_32x32_2x2_8x32x1_8x32x1_1x32x1x8_8_1x1_intrawave_v3,1503.12,701.71,0.0
256,26112,4096,3072,ck,0,0,446.31,a8w8_blockscale_1x128x128_256x128x128x128_16x16_32x32_2x2_8x32x1_8x32x1_1x32x1x8_8_1x1_intrawave_v3,1472.36,687.21,0.0
