aiter/configs/a8w8_blockscale_tuned_gemm.csv
cu_num,M,N,K,libtype,kernelId,splitK,us,kernelName,tflops,bw,errRatio
256,8192,512,7168,ck,0,0,64.1614,a8w8_blockscale_1x128x128_256x128x128x128_16x16_32x32_2x2_8x32x1_8x32x1_1x32x1x8_8_1x1_intrawave_v3,937.16,1103.14,0.0
256,16384,512,7168,cktile,11,0,98.713,a8w8_blockscale_cktile_192x256x128_4x2x1_16x16x128_intrawave_0x1x0_1,1218.27,1396.85,0.0
256,20480,512,7168,cktile,11,0,106.7764,a8w8_blockscale_cktile_192x256x128_4x2x1_16x16x128_intrawave_0x1x0_1,1407.84,1605.62,0.0
256,128,1024,4096,ck,8,0,13.7599,a8w8_blockscale_1x128x128_256x16x64x256_16x16_16x16_1x1_16x16x1_16x16x1_1x16x1x16_4_1x1_intrawave_v1,78.03,361.97,0.0
256,1,2048,3072,ck,8,0,12.0033,a8w8_blockscale_1x128x128_256x16x64x256_16x16_16x16_1x1_16x16x1_16x16x1_1x16x1x16_4_1x1_intrawave_v1,1.05,524.74,0.0
256,2,2048,3072,ck,8,0,10.5499,a8w8_blockscale_1x128x128_256x16x64x256_16x16_16x16_1x1_16x16x1_16x16x1_1x16x1x16_4_1x1_intrawave_v1,2.39,597.71,0.0
256,4,2048,3072,ck,8,0,10.5466,a8w8_blockscale_1x128x128_256x16x64x256_16x16_16x16_1x1_16x16x1_16x16x1_1x16x1x16_4_1x1_intrawave_v1,4.77,599.26,0.0
256,8,2048,3072,ck,8,0,10.7536,a8w8_blockscale_1x128x128_256x16x64x256_16x16_16x16_1x1_16x16x1_16x16x1_1x16x1x16_4_1x1_intrawave_v1,9.36,590.39,0.0
256,16,2048,3072,ck,8,0,10.2346,a8w8_blockscale_1x128x128_256x16x64x256_16x16_16x16_1x1_16x16x1_16x16x1_1x16x1x16_4_1x1_intrawave_v1,19.67,625.93,0.0
256,24,2048,3072,ck,8,0,10.7587,a8w8_blockscale_1x128x128_256x16x64x256_16x16_16x16_1x1_16x16x1_16x16x1_1x16x1x16_4_1x1_intrawave_v1,28.07,600.77,0.0
256,32,2048,3072,ck,8,0,10.4003,a8w8_blockscale_1x128x128_256x16x64x256_16x16_16x16_1x1_16x16x1_16x16x1_1x16x1x16_4_1x1_intrawave_v1,38.72,626.98,0.0
256,40,2048,3072,ck,8,0,10.6512,a8w8_blockscale_1x128x128_256x16x64x256_16x16_16x16_1x1_16x16x1_16x16x1_1x16x1x16_4_1x1_intrawave_v1,47.25,617.6,0.0
256,48,2048,3072,ck,8,0,10.3199,a8w8_blockscale_1x128x128_256x16x64x256_16x16_16x16_1x1_16x16x1_16x16x1_1x16x1x16_4_1x1_intrawave_v1,58.53,642.98,0.0
256,56,2048,3072,ck,8,0,10.6766,a8w8_blockscale_1x128x128_256x16x64x256_16x16_16x16_1x1_16x16x1_16x16x1_1x16x1x16_4_1x1_intrawave_v1,66.0,626.87,0.0
256,64,2048,3072,ck,8,0,10.367,a8w8_blockscale_1x128x128_256x16x64x256_16x16_16x16_1x1_16x16x1_16x16x1_1x16x1x16_4_1x1_intrawave_v1,77.68,651.12,0.0
256,72,2048,3072,ck,8,0,10.8065,a8w8_blockscale_1x128x128_256x16x64x256_16x16_16x16_1x1_16x16x1_16x16x1_1x16x1x16_4_1x1_intrawave_v1,83.84,629.95,0.0
256,80,2048,3072,ck,8,0,10.275,a8w8_blockscale_1x128x128_256x16x64x256_16x16_16x16_1x1_16x16x1_16x16x1_1x16x1x16_4_1x1_intrawave_v1,97.97,668.12,0.0
256,88,2048,3072,ck,8,0,10.7361,a8w8_blockscale_1x128x128_256x16x64x256_16x16_16x16_1x1_16x16x1_16x16x1_1x16x1x16_4_1x1_intrawave_v1,103.14,644.76,0.0
256,96,2048,3072,ck,8,0,10.2233,a8w8_blockscale_1x128x128_256x16x64x256_16x16_16x16_1x1_16x16x1_16x16x1_1x16x1x16_4_1x1_intrawave_v1,118.16,682.71,0.0
256,104,2048,3072,ck,8,0,10.8719,a8w8_blockscale_1x128x128_256x16x64x256_16x16_16x16_1x1_16x16x1_16x16x1_1x16x1x16_4_1x1_intrawave_v1,120.37,647.26,0.0
256,112,2048,3072,ck,8,0,10.289,a8w8_blockscale_1x128x128_256x16x64x256_16x16_16x16_1x1_16x16x1_16x16x1_1x16x1x16_4_1x1_intrawave_v1,136.97,689.5,0.0
256,120,2048,3072,ck,8,0,10.7167,a8w8_blockscale_1x128x128_256x16x64x256_16x16_16x16_1x1_16x16x1_16x16x1_1x16x1x16_4_1x1_intrawave_v1,140.9,667.33,0.0
256,128,2048,3072,ck,8,0,10.2443,a8w8_blockscale_1x128x128_256x16x64x256_16x16_16x16_1x1_16x16x1_16x16x1_1x16x1x16_4_1x1_intrawave_v1,157.22,703.7,0.0
256,136,2048,3072,ck,7,0,13.1862,a8w8_blockscale_1x128x128_256x16x128x256_16x16_16x16_1x2_16x16x1_16x16x1_1x16x1x16_8_1x2_intrawave_v1,129.78,551.05,0.0
256,144,2048,3072,ck,7,0,12.8465,a8w8_blockscale_1x128x128_256x16x128x256_16x16_16x16_1x2_16x16x1_16x16x1_1x16x1x16_8_1x2_intrawave_v1,141.05,570.09,0.0
256,152,2048,3072,ck,7,0,13.1621,a8w8_blockscale_1x128x128_256x16x128x256_16x16_16x16_1x2_16x16x1_16x16x1_1x16x1x16_8_1x2_intrawave_v1,145.31,560.78,0.0
256,160,2048,3072,ck,7,0,13.004,a8w8_blockscale_1x128x128_256x16x128x256_16x16_16x16_1x2_16x16x1_16x16x1_1x16x1x16_8_1x2_intrawave_v1,154.82,572.0,0.0
256,168,2048,3072,ck,7,0,13.1817,a8w8_blockscale_1x128x128_256x16x128x256_16x16_16x16_1x2_16x16x1_16x16x1_1x16x1x16_8_1x2_intrawave_v1,160.37,568.64,0.0
256,176,2048,3072,ck,7,0,12.9041,a8w8_blockscale_1x128x128_256x16x128x256_16x16_16x16_1x2_16x16x1_16x16x1_1x16x1x16_8_1x2_intrawave_v1,171.62,585.32,0.0
256,184,2048,3072,ck,7,0,13.1931,a8w8_blockscale_1x128x128_256x16x128x256_16x16_16x16_1x2_16x16x1_16x16x1_1x16x1x16_8_1x2_intrawave_v1,175.49,576.84,0.0
256,192,2048,3072,ck,18,0,12.9314,a8w8_blockscale_1x128x128_256x64x64x256_16x16_32x32_1x1_16x16x1_16x16x1_1x32x1x8_8_1x1_intrawave_v1,186.83,592.95,0.0
256,200,2048,3072,ck,7,0,13.355,a8w8_blockscale_1x128x128_256x16x128x256_16x16_16x16_1x2_16x16x1_16x16x1_1x16x1x16_8_1x2_intrawave_v1,188.44,578.44,0.0
256,208,2048,3072,ck,7,0,13.075,a8w8_blockscale_1x128x128_256x16x128x256_16x16_16x16_1x2_16x16x1_16x16x1_1x16x1x16_8_1x2_intrawave_v1,200.17,595.21,0.0
256,216,2048,3072,ck,7,0,13.3756,a8w8_blockscale_1x128x128_256x16x128x256_16x16_16x16_1x2_16x16x1_16x16x1_1x16x1x16_8_1x2_intrawave_v1,203.2,586.12,0.0
256,224,2048,3072,ck,7,0,13.1671,a8w8_blockscale_1x128x128_256x16x128x256_16x16_16x16_1x2_16x16x1_16x16x1_1x16x1x16_8_1x2_intrawave_v1,214.06,599.76,0.0
256,232,2048,3072,ck,7,0,13.4259,a8w8_blockscale_1x128x128_256x16x128x256_16x16_16x16_1x2_16x16x1_16x16x1_1x16x1x16_8_1x2_intrawave_v1,217.43,592.47,0.0
256,240,2048,3072,ck,7,0,13.2884,a8w8_blockscale_1x128x128_256x16x128x256_16x16_16x16_1x2_16x16x1_16x16x1_1x16x1x16_8_1x2_intrawave_v1,227.26,602.92,0.0
256,248,2048,3072,ck,7,0,13.6695,a8w8_blockscale_1x128x128_256x16x128x256_16x16_16x16_1x2_16x16x1_16x16x1_1x16x1x16_8_1x2_intrawave_v1,228.29,590.3,0.0
256,256,2048,3072,ck,18,0,12.8956,a8w8_blockscale_1x128x128_256x64x64x256_16x16_32x32_1x1_16x16x1_16x16x1_1x32x1x8_8_1x1_intrawave_v1,249.79,630.17,0.0
256,272,2048,3072,ck,18,0,16.1592,a8w8_blockscale_1x128x128_256x64x64x256_16x16_32x32_1x1_16x16x1_16x16x1_1x32x1x8_8_1x1_intrawave_v1,211.8,510.0,0.0
256,288,2048,3072,ck,12,0,14.7966,a8w8_blockscale_1x128x128_256x32x128x256_16x16_32x32_1x1_16x16x1_16x16x1_1x32x1x8_8_1x1_intrawave_v1,244.91,564.71,0.0
256,304,2048,3072,ck,18,0,16.1218,a8w8_blockscale_1x128x128_256x64x64x256_16x16_32x32_1x1_16x16x1_16x16x1_1x32x1x8_8_1x1_intrawave_v1,237.27,525.41,0.0
256,320,2048,3072,ck,18,0,13.2301,a8w8_blockscale_1x128x128_256x64x64x256_16x16_32x32_1x1_16x16x1_16x16x1_1x32x1x8_8_1x1_intrawave_v1,304.35,648.92,0.0
256,336,2048,3072,ck,18,0,16.1579,a8w8_blockscale_1x128x128_256x64x64x256_16x16_32x32_1x1_16x16x1_16x16x1_1x32x1x8_8_1x1_intrawave_v1,261.66,538.43,0.0
256,352,2048,3072,ck,12,0,15.059,a8w8_blockscale_1x128x128_256x32x128x256_16x16_32x32_1x1_16x16x1_16x16x1_1x32x1x8_8_1x1_intrawave_v1,294.12,585.34,0.0
256,368,2048,3072,ck,18,0,16.2387,a8w8_blockscale_1x128x128_256x64x64x256_16x16_32x32_1x1_16x16x1_16x16x1_1x32x1x8_8_1x1_intrawave_v1,285.15,549.88,0.0
256,384,2048,3072,ck,18,0,13.2916,a8w8_blockscale_1x128x128_256x64x64x256_16x16_32x32_1x1_16x16x1_16x16x1_1x32x1x8_8_1x1_intrawave_v1,363.53,680.43,0.0
256,400,2048,3072,ck,18,0,16.4996,a8w8_blockscale_1x128x128_256x64x64x256_16x16_32x32_1x1_16x16x1_16x16x1_1x32x1x8_8_1x1_intrawave_v1,305.05,555.08,0.0
256,416,2048,3072,ck,12,0,15.3374,a8w8_blockscale_1x128x128_256x32x128x256_16x16_32x32_1x1_16x16x1_16x16x1_1x32x1x8_8_1x1_intrawave_v1,341.29,604.62,0.0
256,432,2048,3072,ck,18,0,16.5531,a8w8_blockscale_1x128x128_256x64x64x256_16x16_32x32_1x1_16x16x1_16x16x1_1x32x1x8_8_1x1_intrawave_v1,328.39,567.15,0.0
256,448,2048,3072,ck,18,0,13.4215,a8w8_blockscale_1x128x128_256x64x64x256_16x16_32x32_1x1_16x16x1_16x16x1_1x32x1x8_8_1x1_intrawave_v1,420.01,708.02,0.0
256,464,2048,3072,ck,18,0,16.5858,a8w8_blockscale_1x128x128_256x64x64x256_16x16_32x32_1x1_16x16x1_16x16x1_1x32x1x8_8_1x1_intrawave_v1,352.02,579.86,0.0
256,480,2048,3072,ck,12,0,15.3522,a8w8_blockscale_1x128x128_256x32x128x256_16x16_32x32_1x1_16x16x1_16x16x1_1x32x1x8_8_1x1_intrawave_v1,393.42,633.92,0.0
256,496,2048,3072,ck,18,0,16.8224,a8w8_blockscale_1x128x128_256x64x64x256_16x16_32x32_1x1_16x16x1_16x16x1_1x32x1x8_8_1x1_intrawave_v1,371.0,585.34,0.0
256,512,2048,3072,ck,18,0,13.4861,a8w8_blockscale_1x128x128_256x64x64x256_16x16_32x32_1x1_16x16x1_16x16x1_1x32x1x8_8_1x1_intrawave_v1,477.71,738.65,0.0
256,548,2048,3072,ck,2,0,20.6718,a8w8_blockscale_1x128x128_256x64x128x128_16x16_32x32_1x2_8x32x1_8x32x1_1x32x1x8_8_1x1_intrawave_v3,333.57,494.37,0.0
256,1000,2048,3072,ck,2,0,21.2543,a8w8_blockscale_1x128x128_256x64x128x128_16x16_32x32_1x2_8x32x1_8x32x1_1x32x1x8_8_1x1_intrawave_v3,592.02,633.26,0.0
256,1001,2048,3072,ck,2,0,21.2938,a8w8_blockscale_1x128x128_256x64x128x128_16x16_32x32_1x2_8x32x1_8x32x1_1x32x1x8_8_1x1_intrawave_v3,591.51,632.42,0.0
256,1003,2048,3072,ck,2,0,21.1703,a8w8_blockscale_1x128x128_256x64x128x128_16x16_32x32_1x2_8x32x1_8x32x1_1x32x1x8_8_1x1_intrawave_v3,596.15,636.79,0.0
256,1028,2048,3072,ck,2,0,26.3074,a8w8_blockscale_1x128x128_256x64x128x128_16x16_32x32_1x2_8x32x1_8x32x1_1x32x1x8_8_1x1_intrawave_v3,491.7,519.25,0.0
256,1248,2048,3072,ck,2,0,26.9111,a8w8_blockscale_1x128x128_256x64x128x128_16x16_32x32_1x2_8x32x1_8x32x1_1x32x1x8_8_1x1_intrawave_v3,583.53,566.2,0.0
256,1454,2048,3072,ck,0,0,26.8783,a8w8_blockscale_1x128x128_256x128x128x128_16x16_32x32_2x2_8x32x1_8x32x1_1x32x1x8_8_1x1_intrawave_v3,680.68,621.83,0.0
256,2000,2048,3072,ck,0,0,28.529,a8w8_blockscale_1x128x128_256x128x128x128_16x16_32x32_2x2_8x32x1_8x32x1_1x32x1x8_8_1x1_intrawave_v3,882.11,723.03,0.0
256,2001,2048,3072,ck,0,0,28.383,a8w8_blockscale_1x128x128_256x128x128x128_16x16_32x32_2x2_8x32x1_8x32x1_1x32x1x8_8_1x1_intrawave_v3,887.09,727.01,0.0
256,2002,2048,3072,ck,0,0,28.638,a8w8_blockscale_1x128x128_256x128x128x128_16x16_32x32_2x2_8x32x1_8x32x1_1x32x1x8_8_1x1_intrawave_v3,879.64,720.78,0.0
256,2013,2048,3072,ck,0,0,28.1042,a8w8_blockscale_1x128x128_256x128x128x128_16x16_32x32_2x2_8x32x1_8x32x1_1x32x1x8_8_1x1_intrawave_v3,901.27,737.28,0.0
256,3000,2048,3072,ck,0,0,42.2913,a8w8_blockscale_1x128x128_256x128x128x128_16x16_32x32_2x2_8x32x1_8x32x1_1x32x1x8_8_1x1_intrawave_v3,892.59,657.24,0.0
256,3001,2048,3072,ck,0,0,41.5774,a8w8_blockscale_1x128x128_256x128x128x128_16x16_32x32_2x2_8x32x1_8x32x1_1x32x1x8_8_1x1_intrawave_v3,908.22,668.7,0.0
256,3004,2048,3072,ck,0,0,42.8614,a8w8_blockscale_1x128x128_256x128x128x128_16x16_32x32_2x2_8x32x1_8x32x1_1x32x1x8_8_1x1_intrawave_v3,881.89,649.17,0.0
256,3005,2048,3072,ck,0,0,42.1871,a8w8_blockscale_1x128x128_256x128x128x128_16x16_32x32_2x2_8x32x1_8x32x1_1x32x1x8_8_1x1_intrawave_v3,896.28,659.71,0.0
256,3027,2048,3072,ck,0,0,42.465,a8w8_blockscale_1x128x128_256x128x128x128_16x16_32x32_2x2_8x32x1_8x32x1_1x32x1x8_8_1x1_intrawave_v3,896.94,659.11,0.0
256,3055,2048,3072,ck,0,0,42.4072,a8w8_blockscale_1x128x128_256x128x128x128_16x16_32x32_2x2_8x32x1_8x32x1_1x32x1x8_8_1x1_intrawave_v3,906.47,664.74,0.0
256,3390,2048,3072,ck,0,0,43.889,a8w8_blockscale_1x128x128_256x128x128x128_16x16_32x32_2x2_8x32x1_8x32x1_1x32x1x8_8_1x1_intrawave_v3,971.91,697.01,0.0
256,3665,2048,3072,ck,0,0,45.3676,a8w8_blockscale_1x128x128_256x128x128x128_16x16_32x32_2x2_8x32x1_8x32x1_1x32x1x8_8_1x1_intrawave_v3,1016.5,717.74,0.0
256,4000,2048,3072,ck,0,0,48.2643,a8w8_blockscale_1x128x128_256x128x128x128_16x16_32x32_2x2_8x32x1_8x32x1_1x32x1x8_8_1x1_intrawave_v3,1042.83,724.42,0.0
256,4001,2048,3072,ck,0,0,47.3505,a8w8_blockscale_1x128x128_256x128x128x128_16x16_32x32_2x2_8x32x1_8x32x1_1x32x1x8_8_1x1_intrawave_v3,1063.22,738.55,0.0
256,4009,2048,3072,ck,0,0,47.497,a8w8_blockscale_1x128x128_256x128x128x128_16x16_32x32_2x2_8x32x1_8x32x1_1x32x1x8_8_1x1_intrawave_v3,1062.06,737.48,0.0
256,4068,2048,3072,ck,0,0,47.746,a8w8_blockscale_1x128x128_256x128x128x128_16x16_32x32_2x2_8x32x1_8x32x1_1x32x1x8_8_1x1_intrawave_v3,1072.07,742.49,0.0
256,4481,2048,3072,cktile,11,0,53.5853,a8w8_blockscale_cktile_192x256x128_4x2x1_16x16x128_intrawave_0x1x0_1,1052.23,716.82,0.0
256,5000,2048,3072,cktile,11,0,54.4902,a8w8_blockscale_cktile_192x256x128_4x2x1_16x16x128_intrawave_0x1x0_1,1154.6,773.19,0.0
256,5002,2048,3072,cktile,11,0,54.1198,a8w8_blockscale_cktile_192x256x128_4x2x1_16x16x128_intrawave_0x1x0_1,1162.97,778.75,0.0
256,5003,2048,3072,cktile,11,0,53.9172,a8w8_blockscale_cktile_192x256x128_4x2x1_16x16x128_intrawave_0x1x0_1,1167.57,781.81,0.0
256,5025,2048,3072,cktile,11,0,54.1316,a8w8_blockscale_cktile_192x256x128_4x2x1_16x16x128_intrawave_0x1x0_1,1168.06,781.63,0.0
256,5090,2048,3072,cktile,11,0,53.9881,a8w8_blockscale_cktile_192x256x128_4x2x1_16x16x128_intrawave_0x1x0_1,1186.32,792.33,0.0
256,5127,2048,3072,cktile,11,0,54.4499,a8w8_blockscale_cktile_192x256x128_4x2x1_16x16x128_intrawave_0x1x0_1,1184.81,790.48,0.0
256,5255,2048,3072,cktile,11,0,54.1336,a8w8_blockscale_cktile_192x256x128_4x2x1_16x16x128_intrawave_0x1x0_1,1221.48,812.05,0.0
256,5508,2048,3072,cktile,11,0,55.8602,a8w8_blockscale_cktile_192x256x128_4x2x1_16x16x128_intrawave_0x1x0_1,1240.72,819.42,0.0
256,6003,2048,3072,cktile,11,0,55.4962,a8w8_blockscale_cktile_192x256x128_4x2x1_16x16x128_intrawave_0x1x0_1,1361.09,888.73,0.0
256,6054,2048,3072,cktile,11,0,55.7127,a8w8_blockscale_cktile_192x256x128_4x2x1_16x16x128_intrawave_0x1x0_1,1367.32,891.83,0.0
256,6111,2048,3072,cktile,11,0,58.1114,a8w8_blockscale_cktile_192x256x128_4x2x1_16x16x128_intrawave_0x1x0_1,1323.22,862.05,0.0
256,6209,2048,3072,ck,0,0,83.0253,a8w8_blockscale_1x128x128_256x128x128x128_16x16_32x32_2x2_8x32x1_8x32x1_1x32x1x8_8_1x1_intrawave_v3,941.01,611.83,0.0
256,7000,2048,3072,ck,0,0,83.4639,a8w8_blockscale_1x128x128_256x128x128x128_16x16_32x32_2x2_8x32x1_8x32x1_1x32x1x8_8_1x1_intrawave_v3,1055.31,676.55,0.0
256,7001,2048,3072,ck,0,0,85.6415,a8w8_blockscale_1x128x128_256x128x128x128_16x16_32x32_2x2_8x32x1_8x32x1_1x32x1x8_8_1x1_intrawave_v3,1028.62,659.43,0.0
256,7087,2048,3072,ck,0,0,82.8235,a8w8_blockscale_1x128x128_256x128x128x128_16x16_32x32_2x2_8x32x1_8x32x1_1x32x1x8_8_1x1_intrawave_v3,1076.69,689.31,0.0
256,7131,2048,3072,ck,0,0,85.2839,a8w8_blockscale_1x128x128_256x128x128x128_16x16_32x32_2x2_8x32x1_8x32x1_1x32x1x8_8_1x1_intrawave_v3,1052.12,673.12,0.0
256,7189,2048,3072,ck,0,0,85.8039,a8w8_blockscale_1x128x128_256x128x128x128_16x16_32x32_2x2_8x32x1_8x32x1_1x32x1x8_8_1x1_intrawave_v3,1054.25,673.89,0.0
256,8036,2048,3072,ck,0,0,90.8549,a8w8_blockscale_1x128x128_256x128x128x128_16x16_32x32_2x2_8x32x1_8x32x1_1x32x1x8_8_1x1_intrawave_v3,1112.94,703.25,0.0
256,9479,2048,3072,cktile,11,0,101.8836,a8w8_blockscale_cktile_192x256x128_4x2x1_16x16x128_intrawave_0x1x0_1,1170.68,728.64,0.0
256,10000,2048,3072,cktile,11,0,102.2741,a8w8_blockscale_cktile_192x256x128_4x2x1_16x16x128_intrawave_0x1x0_1,1230.31,762.38,0.0
256,10001,2048,3072,cktile,11,0,103.231,a8w8_blockscale_cktile_192x256x128_4x2x1_16x16x128_intrawave_0x1x0_1,1219.03,755.38,0.0
256,10002,2048,3072,cktile,11,0,102.0285,a8w8_blockscale_cktile_192x256x128_4x2x1_16x16x128_intrawave_0x1x0_1,1233.52,764.35,0.0
256,10015,2048,3072,cktile,11,0,102.3005,a8w8_blockscale_cktile_192x256x128_4x2x1_16x16x128_intrawave_0x1x0_1,1231.84,763.23,0.0
256,10060,2048,3072,cktile,11,0,102.559,a8w8_blockscale_cktile_192x256x128_4x2x1_16x16x128_intrawave_0x1x0_1,1234.26,764.45,0.0
256,10062,2048,3072,cktile,11,0,101.695,a8w8_blockscale_cktile_192x256x128_4x2x1_16x16x128_intrawave_0x1x0_1,1244.99,771.09,0.0
256,10215,2048,3072,cktile,11,0,102.9797,a8w8_blockscale_cktile_192x256x128_4x2x1_16x16x128_intrawave_0x1x0_1,1248.15,772.12,0.0
256,10228,2048,3072,cktile,11,0,103.1125,a8w8_blockscale_cktile_192x256x128_4x2x1_16x16x128_intrawave_0x1x0_1,1248.13,772.03,0.0
256,10321,2048,3072,cktile,11,0,102.8456,a8w8_blockscale_cktile_192x256x128_4x2x1_16x16x128_intrawave_0x1x0_1,1262.75,780.51,0.0
256,10329,2048,3072,cktile,11,0,103.3187,a8w8_blockscale_cktile_192x256x128_4x2x1_16x16x128_intrawave_0x1x0_1,1257.94,777.49,0.0
256,10341,2048,3072,cktile,11,0,102.225,a8w8_blockscale_cktile_192x256x128_4x2x1_16x16x128_intrawave_0x1x0_1,1272.88,786.65,0.0
256,10346,2048,3072,cktile,11,0,101.8517,a8w8_blockscale_cktile_192x256x128_4x2x1_16x16x128_intrawave_0x1x0_1,1278.16,789.89,0.0
256,10362,2048,3072,cktile,11,0,102.3938,a8w8_blockscale_cktile_192x256x128_4x2x1_16x16x128_intrawave_0x1x0_1,1273.36,786.83,0.0
256,10363,2048,3072,cktile,11,0,102.0916,a8w8_blockscale_cktile_192x256x128_4x2x1_16x16x128_intrawave_0x1x0_1,1277.25,789.23,0.0
256,10369,2048,3072,cktile,11,0,102.1479,a8w8_blockscale_cktile_192x256x128_4x2x1_16x16x128_intrawave_0x1x0_1,1277.29,789.21,0.0
256,10376,2048,3072,cktile,11,0,102.8485,a8w8_blockscale_cktile_192x256x128_4x2x1_16x16x128_intrawave_0x1x0_1,1269.44,784.32,0.0
256,10379,2048,3072,cktile,11,0,102.7483,a8w8_blockscale_cktile_192x256x128_4x2x1_16x16x128_intrawave_0x1x0_1,1271.05,785.3,0.0
256,10388,2048,3072,cktile,11,0,103.1974,a8w8_blockscale_cktile_192x256x128_4x2x1_16x16x128_intrawave_0x1x0_1,1266.61,782.51,0.0
256,10414,2048,3072,cktile,11,0,102.8253,a8w8_blockscale_cktile_192x256x128_4x2x1_16x16x128_intrawave_0x1x0_1,1274.38,787.15,0.0
256,10432,2048,3072,cktile,11,0,103.1074,a8w8_blockscale_cktile_192x256x128_4x2x1_16x16x128_intrawave_0x1x0_1,1273.09,786.25,0.0
256,10436,2048,3072,cktile,11,0,102.3397,a8w8_blockscale_cktile_192x256x128_4x2x1_16x16x128_intrawave_0x1x0_1,1283.13,792.43,0.0
256,10437,2048,3072,cktile,11,0,101.5165,a8w8_blockscale_cktile_192x256x128_4x2x1_16x16x128_intrawave_0x1x0_1,1293.66,798.92,0.0
256,10453,2048,3072,cktile,11,0,102.7693,a8w8_blockscale_cktile_192x256x128_4x2x1_16x16x128_intrawave_0x1x0_1,1279.85,790.3,0.0
256,10454,2048,3072,cktile,11,0,102.9709,a8w8_blockscale_cktile_192x256x128_4x2x1_16x16x128_intrawave_0x1x0_1,1277.47,788.82,0.0
256,10459,2048,3072,cktile,11,0,102.685,a8w8_blockscale_cktile_192x256x128_4x2x1_16x16x128_intrawave_0x1x0_1,1281.63,791.37,0.0
256,10466,2048,3072,cktile,11,0,102.8399,a8w8_blockscale_cktile_192x256x128_4x2x1_16x16x128_intrawave_0x1x0_1,1280.56,790.66,0.0
256,10469,2048,3072,cktile,11,0,101.9603,a8w8_blockscale_cktile_192x256x128_4x2x1_16x16x128_intrawave_0x1x0_1,1291.98,797.7,0.0
256,10472,2048,3072,cktile,11,0,102.7742,a8w8_blockscale_cktile_192x256x128_4x2x1_16x16x128_intrawave_0x1x0_1,1282.11,791.59,0.0
256,10483,2048,3072,cktile,11,0,102.3611,a8w8_blockscale_cktile_192x256x128_4x2x1_16x16x128_intrawave_0x1x0_1,1288.64,795.55,0.0
256,10497,2048,3072,cktile,11,0,101.9797,a8w8_blockscale_cktile_192x256x128_4x2x1_16x16x128_intrawave_0x1x0_1,1295.19,799.51,0.0
256,10508,2048,3072,cktile,11,0,103.0015,a8w8_blockscale_cktile_192x256x128_4x2x1_16x16x128_intrawave_0x1x0_1,1283.68,792.35,0.0
256,10510,2048,3072,cktile,11,0,102.5328,a8w8_blockscale_cktile_192x256x128_4x2x1_16x16x128_intrawave_0x1x0_1,1289.8,796.11,0.0
256,10519,2048,3072,cktile,11,0,102.907,a8w8_blockscale_cktile_192x256x128_4x2x1_16x16x128_intrawave_0x1x0_1,1286.21,793.84,0.0
256,10530,2048,3072,cktile,11,0,102.1676,a8w8_blockscale_cktile_192x256x128_4x2x1_16x16x128_intrawave_0x1x0_1,1296.87,800.36,0.0
256,10542,2048,3072,cktile,11,0,103.0646,a8w8_blockscale_cktile_192x256x128_4x2x1_16x16x128_intrawave_0x1x0_1,1287.05,794.23,0.0
256,10553,2048,3072,cktile,11,0,102.6255,a8w8_blockscale_cktile_192x256x128_4x2x1_16x16x128_intrawave_0x1x0_1,1293.9,798.39,0.0
256,10559,2048,3072,cktile,11,0,103.2632,a8w8_blockscale_cktile_192x256x128_4x2x1_16x16x128_intrawave_0x1x0_1,1286.64,793.88,0.0
256,10566,2048,3072,cktile,11,0,102.722,a8w8_blockscale_cktile_192x256x128_4x2x1_16x16x128_intrawave_0x1x0_1,1294.28,798.55,0.0
256,10572,2048,3072,cktile,11,0,102.6889,a8w8_blockscale_cktile_192x256x128_4x2x1_16x16x128_intrawave_0x1x0_1,1295.43,799.23,0.0
256,10576,2048,3072,cktile,11,0,103.2403,a8w8_blockscale_cktile_192x256x128_4x2x1_16x16x128_intrawave_0x1x0_1,1289.0,795.23,0.0
256,10578,2048,3072,cktile,11,0,104.2573,a8w8_blockscale_cktile_192x256x128_4x2x1_16x16x128_intrawave_0x1x0_1,1276.67,787.61,0.0
256,10583,2048,3072,cktile,11,0,102.1966,a8w8_blockscale_cktile_192x256x128_4x2x1_16x16x128_intrawave_0x1x0_1,1303.03,803.85,0.0
256,10594,2048,3072,cktile,11,0,102.3623,a8w8_blockscale_cktile_192x256x128_4x2x1_16x16x128_intrawave_0x1x0_1,1302.27,803.32,0.0
256,10603,2048,3072,cktile,11,0,102.3813,a8w8_blockscale_cktile_192x256x128_4x2x1_16x16x128_intrawave_0x1x0_1,1303.13,803.8,0.0
256,10605,2048,3072,cktile,11,0,102.2865,a8w8_blockscale_cktile_192x256x128_4x2x1_16x16x128_intrawave_0x1x0_1,1304.59,804.68,0.0
256,10616,2048,3072,cktile,11,0,103.0763,a8w8_blockscale_cktile_192x256x128_4x2x1_16x16x128_intrawave_0x1x0_1,1295.94,799.28,0.0
256,10628,2048,3072,cktile,11,0,102.3803,a8w8_blockscale_cktile_192x256x128_4x2x1_16x16x128_intrawave_0x1x0_1,1306.22,805.55,0.0
256,10640,2048,3072,cktile,11,0,102.4139,a8w8_blockscale_cktile_192x256x128_4x2x1_16x16x128_intrawave_0x1x0_1,1307.27,806.13,0.0
256,10643,2048,3072,cktile,11,0,102.8942,a8w8_blockscale_cktile_192x256x128_4x2x1_16x16x128_intrawave_0x1x0_1,1301.53,802.58,0.0
256,10659,2048,3072,cktile,11,0,103.5542,a8w8_blockscale_cktile_192x256x128_4x2x1_16x16x128_intrawave_0x1x0_1,1295.18,798.57,0.0
256,10666,2048,3072,cktile,11,0,103.1814,a8w8_blockscale_cktile_192x256x128_4x2x1_16x16x128_intrawave_0x1x0_1,1300.71,801.94,0.0
256,10679,2048,3072,cktile,11,0,102.6189,a8w8_blockscale_cktile_192x256x128_4x2x1_16x16x128_intrawave_0x1x0_1,1309.44,807.24,0.0
256,10689,2048,3072,cktile,11,0,102.6374,a8w8_blockscale_cktile_192x256x128_4x2x1_16x16x128_intrawave_0x1x0_1,1310.43,807.8,0.0
256,10705,2048,3072,cktile,11,0,103.5001,a8w8_blockscale_cktile_192x256x128_4x2x1_16x16x128_intrawave_0x1x0_1,1301.45,802.17,0.0
256,10709,2048,3072,cktile,11,0,102.8741,a8w8_blockscale_cktile_192x256x128_4x2x1_16x16x128_intrawave_0x1x0_1,1309.86,807.33,0.0
256,10721,2048,3072,cktile,11,0,103.4738,a8w8_blockscale_cktile_192x256x128_4x2x1_16x16x128_intrawave_0x1x0_1,1303.73,803.48,0.0
256,10742,2048,3072,cktile,11,0,103.112,a8w8_blockscale_cktile_192x256x128_4x2x1_16x16x128_intrawave_0x1x0_1,1310.86,807.76,0.0
256,10751,2048,3072,cktile,11,0,103.6891,a8w8_blockscale_cktile_192x256x128_4x2x1_16x16x128_intrawave_0x1x0_1,1304.66,803.89,0.0
256,10771,2048,3072,cktile,11,0,102.3814,a8w8_blockscale_cktile_192x256x128_4x2x1_16x16x128_intrawave_0x1x0_1,1323.78,815.56,0.0
256,10829,2048,3072,cktile,11,0,103.9718,a8w8_blockscale_cktile_192x256x128_4x2x1_16x16x128_intrawave_0x1x0_1,1310.55,807.08,0.0
256,10844,2048,3072,cktile,11,0,102.5387,a8w8_blockscale_cktile_192x256x128_4x2x1_16x16x128_intrawave_0x1x0_1,1330.71,819.41,0.0
256,10846,2048,3072,cktile,11,0,102.8334,a8w8_blockscale_cktile_192x256x128_4x2x1_16x16x128_intrawave_0x1x0_1,1327.14,817.2,0.0
256,10853,2048,3072,cktile,11,0,103.9459,a8w8_blockscale_cktile_192x256x128_4x2x1_16x16x128_intrawave_0x1x0_1,1313.78,808.94,0.0
256,10862,2048,3072,cktile,11,0,102.2116,a8w8_blockscale_cktile_192x256x128_4x2x1_16x16x128_intrawave_0x1x0_1,1337.18,823.29,0.0
256,10877,2048,3072,cktile,11,0,102.0148,a8w8_blockscale_cktile_192x256x128_4x2x1_16x16x128_intrawave_0x1x0_1,1341.61,825.94,0.0
256,11083,2048,3072,cktile,11,0,102.9304,a8w8_blockscale_cktile_192x256x128_4x2x1_16x16x128_intrawave_0x1x0_1,1354.86,832.94,0.0
256,11184,2048,3072,cktile,11,0,103.2663,a8w8_blockscale_cktile_192x256x128_4x2x1_16x16x128_intrawave_0x1x0_1,1362.76,837.24,0.0
256,11216,2048,3072,cktile,11,0,103.9526,a8w8_blockscale_cktile_192x256x128_4x2x1_16x16x128_intrawave_0x1x0_1,1357.64,833.92,0.0
256,11223,2048,3072,cktile,11,0,104.8367,a8w8_blockscale_cktile_192x256x128_4x2x1_16x16x128_intrawave_0x1x0_1,1347.03,827.36,0.0
256,11224,2048,3072,cktile,11,0,104.2216,a8w8_blockscale_cktile_192x256x128_4x2x1_16x16x128_intrawave_0x1x0_1,1355.1,832.31,0.0
256,11249,2048,3072,cktile,11,0,104.4728,a8w8_blockscale_cktile_192x256x128_4x2x1_16x16x128_intrawave_0x1x0_1,1354.85,832.03,0.0
256,12760,2048,3072,ck,0,0,141.6469,a8w8_blockscale_1x128x128_256x128x128x128_16x16_32x32_2x2_8x32x1_8x32x1_1x32x1x8_8_1x1_intrawave_v3,1133.51,690.13,0.0
256,13003,2048,3072,ck,0,0,143.2009,a8w8_blockscale_1x128x128_256x128x128x128_16x16_32x32_2x2_8x32x1_8x32x1_1x32x1x8_8_1x1_intrawave_v3,1142.56,694.81,0.0
256,13976,2048,3072,cktile,11,0,147.0094,a8w8_blockscale_cktile_192x256x128_4x2x1_16x16x128_intrawave_0x1x0_1,1196.24,724.25,0.0
256,14470,2048,3072,cktile,11,0,147.8249,a8w8_blockscale_cktile_192x256x128_4x2x1_16x16x128_intrawave_0x1x0_1,1231.69,744.21,0.0
256,14486,2048,3072,cktile,11,0,148.4973,a8w8_blockscale_cktile_192x256x128_4x2x1_16x16x128_intrawave_0x1x0_1,1227.47,741.61,0.0
256,14509,2048,3072,cktile,11,0,147.9749,a8w8_blockscale_cktile_192x256x128_4x2x1_16x16x128_intrawave_0x1x0_1,1233.76,745.34,0.0
256,14809,2048,3072,cktile,11,0,148.894,a8w8_blockscale_cktile_192x256x128_4x2x1_16x16x128_intrawave_0x1x0_1,1251.5,755.18,0.0
256,15000,2048,3072,cktile,11,0,149.092,a8w8_blockscale_cktile_192x256x128_4x2x1_16x16x128_intrawave_0x1x0_1,1265.95,763.36,0.0
256,15001,2048,3072,cktile,11,0,148.1816,a8w8_blockscale_cktile_192x256x128_4x2x1_16x16x128_intrawave_0x1x0_1,1273.82,768.1,0.0
256,15029,2048,3072,cktile,11,0,149.9229,a8w8_blockscale_cktile_192x256x128_4x2x1_16x16x128_intrawave_0x1x0_1,1261.37,760.52,0.0
256,15479,2048,3072,cktile,11,0,150.465,a8w8_blockscale_cktile_192x256x128_4x2x1_16x16x128_intrawave_0x1x0_1,1294.46,779.22,0.0
256,15509,2048,3072,cktile,11,0,150.9971,a8w8_blockscale_cktile_192x256x128_4x2x1_16x16x128_intrawave_0x1x0_1,1292.4,777.9,0.0
256,18950,2048,3072,cktile,11,0,193.6611,a8w8_blockscale_cktile_192x256x128_4x2x1_16x16x128_intrawave_0x1x0_1,1231.25,733.89,0.0
256,20000,2048,3072,cktile,11,0,194.4585,a8w8_blockscale_cktile_192x256x128_4x2x1_16x16x128_intrawave_0x1x0_1,1294.15,769.58,0.0
256,20001,2048,3072,cktile,11,0,195.5813,a8w8_blockscale_cktile_192x256x128_4x2x1_16x16x128_intrawave_0x1x0_1,1286.78,765.2,0.0
256,20002,2048,3072,cktile,11,0,195.0546,a8w8_blockscale_cktile_192x256x128_4x2x1_16x16x128_intrawave_0x1x0_1,1290.32,767.3,0.0
256,20030,2048,3072,cktile,11,0,195.4874,a8w8_blockscale_cktile_192x256x128_4x2x1_16x16x128_intrawave_0x1x0_1,1289.27,766.63,0.0
256,20062,2048,3072,cktile,11,0,195.3197,a8w8_blockscale_cktile_192x256x128_4x2x1_16x16x128_intrawave_0x1x0_1,1292.44,768.46,0.0
256,20254,2048,3072,cktile,11,0,196.5793,a8w8_blockscale_cktile_192x256x128_4x2x1_16x16x128_intrawave_0x1x0_1,1296.45,770.54,0.0
256,20428,2048,3072,cktile,11,0,197.0264,a8w8_blockscale_cktile_192x256x128_4x2x1_16x16x128_intrawave_0x1x0_1,1304.62,775.12,0.0
256,20508,2048,3072,cktile,11,0,196.0826,a8w8_blockscale_cktile_192x256x128_4x2x1_16x16x128_intrawave_0x1x0_1,1316.03,781.78,0.0
256,20934,2048,3072,cktile,11,0,198.8294,a8w8_blockscale_cktile_192x256x128_4x2x1_16x16x128_intrawave_0x1x0_1,1324.81,786.33,0.0
256,21072,2048,3072,cktile,11,0,197.161,a8w8_blockscale_cktile_192x256x128_4x2x1_16x16x128_intrawave_0x1x0_1,1344.83,798.01,0.0
256,21611,2048,3072,cktile,11,0,200.6439,a8w8_blockscale_cktile_192x256x128_4x2x1_16x16x128_intrawave_0x1x0_1,1355.28,803.41,0.0
256,21764,2048,3072,cktile,11,0,199.0064,a8w8_blockscale_cktile_192x256x128_4x2x1_16x16x128_intrawave_0x1x0_1,1376.11,815.53,0.0
256,22355,2048,3072,cktile,11,0,199.7619,a8w8_blockscale_cktile_192x256x128_4x2x1_16x16x128_intrawave_0x1x0_1,1408.13,833.65,0.0
256,23797,2048,3072,cktile,11,0,202.548,a8w8_blockscale_cktile_192x256x128_4x2x1_16x16x128_intrawave_0x1x0_1,1478.34,873.22,0.0
256,23970,2048,3072,cktile,11,0,200.9043,a8w8_blockscale_cktile_192x256x128_4x2x1_16x16x128_intrawave_0x1x0_1,1501.27,886.53,0.0
256,24145,2048,3072,cktile,11,0,202.0966,a8w8_blockscale_cktile_192x256x128_4x2x1_16x16x128_intrawave_0x1x0_1,1503.31,887.51,0.0
256,24658,2048,3072,cktile,11,0,241.9037,a8w8_blockscale_cktile_192x256x128_4x2x1_16x16x128_intrawave_0x1x0_1,1282.62,756.66,0.0
256,24923,2048,3072,cktile,11,0,240.1298,a8w8_blockscale_cktile_192x256x128_4x2x1_16x16x128_intrawave_0x1x0_1,1305.98,770.16,0.0
256,25002,2048,3072,cktile,11,0,242.2661,a8w8_blockscale_cktile_192x256x128_4x2x1_16x16x128_intrawave_0x1x0_1,1298.56,765.71,0.0
256,25003,2048,3072,cktile,11,0,240.3653,a8w8_blockscale_cktile_192x256x128_4x2x1_16x16x128_intrawave_0x1x0_1,1308.89,771.8,0.0
256,25007,2048,3072,cktile,11,0,241.4423,a8w8_blockscale_cktile_192x256x128_4x2x1_16x16x128_intrawave_0x1x0_1,1303.25,768.47,0.0
256,25603,2048,3072,cktile,11,0,243.8087,a8w8_blockscale_cktile_192x256x128_4x2x1_16x16x128_intrawave_0x1x0_1,1321.37,778.54,0.0
256,27037,2048,3072,cktile,11,0,248.4238,a8w8_blockscale_cktile_192x256x128_4x2x1_16x16x128_intrawave_0x1x0_1,1369.45,805.45,0.0
256,28004,2048,3072,cktile,11,0,249.3314,a8w8_blockscale_cktile_192x256x128_4x2x1_16x16x128_intrawave_0x1x0_1,1413.27,830.32,0.0
256,28036,2048,3072,cktile,11,0,249.4461,a8w8_blockscale_cktile_192x256x128_4x2x1_16x16x128_intrawave_0x1x0_1,1414.23,830.85,0.0
256,28514,2048,3072,cktile,11,0,249.2587,a8w8_blockscale_cktile_192x256x128_4x2x1_16x16x128_intrawave_0x1x0_1,1439.42,845.23,0.0
256,30001,2048,3072,cktile,11,0,247.4592,a8w8_blockscale_cktile_192x256x128_4x2x1_16x16x128_intrawave_0x1x0_1,1525.5,894.44,0.0
256,30002,2048,3072,cktile,11,0,247.5096,a8w8_blockscale_cktile_192x256x128_4x2x1_16x16x128_intrawave_0x1x0_1,1525.24,894.29,0.0
256,30032,2048,3072,cktile,11,0,248.0628,a8w8_blockscale_cktile_192x256x128_4x2x1_16x16x128_intrawave_0x1x0_1,1523.36,893.16,0.0
256,30469,2048,3072,cktile,11,0,251.4543,a8w8_blockscale_cktile_192x256x128_4x2x1_16x16x128_intrawave_0x1x0_1,1524.69,893.57,0.0
256,30486,2048,3072,cktile,11,0,248.6849,a8w8_blockscale_cktile_192x256x128_4x2x1_16x16x128_intrawave_0x1x0_1,1542.52,904.02,0.0
256,31001,2048,3072,cktile,11,0,285.8905,a8w8_blockscale_cktile_192x256x128_4x2x1_16x16x128_intrawave_0x1x0_1,1364.45,799.28,0.0
256,32003,2048,3072,cktile,11,0,290.0422,a8w8_blockscale_cktile_192x256x128_4x2x1_16x16x128_intrawave_0x1x0_1,1388.39,812.6,0.0
256,32004,2048,3072,cktile,11,0,289.9005,a8w8_blockscale_cktile_192x256x128_4x2x1_16x16x128_intrawave_0x1x0_1,1389.11,813.02,0.0
256,32005,2048,3072,cktile,11,0,290.3178,a8w8_blockscale_cktile_192x256x128_4x2x1_16x16x128_intrawave_0x1x0_1,1387.16,811.88,0.0
256,34003,2048,3072,cktile,11,0,298.5716,a8w8_blockscale_cktile_192x256x128_4x2x1_16x16x128_intrawave_0x1x0_1,1433.01,837.4,0.0
256,34007,2048,3072,cktile,11,0,297.5946,a8w8_blockscale_cktile_192x256x128_4x2x1_16x16x128_intrawave_0x1x0_1,1437.89,840.25,0.0
256,35001,2048,3072,cktile,11,0,297.4752,a8w8_blockscale_cktile_192x256x128_4x2x1_16x16x128_intrawave_0x1x0_1,1480.51,864.54,0.0
256,35006,2048,3072,cktile,11,0,298.4229,a8w8_blockscale_cktile_192x256x128_4x2x1_16x16x128_intrawave_0x1x0_1,1476.02,861.91,0.0
256,35009,2048,3072,cktile,11,0,295.525,a8w8_blockscale_cktile_192x256x128_4x2x1_16x16x128_intrawave_0x1x0_1,1490.62,870.44,0.0
256,35453,2048,3072,cktile,11,0,297.241,a8w8_blockscale_cktile_192x256x128_4x2x1_16x16x128_intrawave_0x1x0_1,1500.81,876.12,0.0
256,35791,2048,3072,cktile,11,0,295.5094,a8w8_blockscale_cktile_192x256x128_4x2x1_16x16x128_intrawave_0x1x0_1,1524.0,889.45,0.0
256,36016,2048,3072,cktile,11,0,297.6046,a8w8_blockscale_cktile_192x256x128_4x2x1_16x16x128_intrawave_0x1x0_1,1522.78,888.61,0.0
256,37930,2048,3072,cktile,11,0,340.0545,a8w8_blockscale_cktile_192x256x128_4x2x1_16x16x128_intrawave_0x1x0_1,1403.51,818.03,0.0
256,38006,2048,3072,cktile,11,0,336.7823,a8w8_blockscale_cktile_192x256x128_4x2x1_16x16x128_intrawave_0x1x0_1,1419.99,827.59,0.0
256,38538,2048,3072,cktile,11,0,340.3356,a8w8_blockscale_cktile_192x256x128_4x2x1_16x16x128_intrawave_0x1x0_1,1424.83,830.16,0.0
256,40001,2048,3072,cktile,11,0,342.3773,a8w8_blockscale_cktile_192x256x128_4x2x1_16x16x128_intrawave_0x1x0_1,1470.1,855.84,0.0
256,40358,2048,3072,cktile,11,0,348.3691,a8w8_blockscale_cktile_192x256x128_4x2x1_16x16x128_intrawave_0x1x0_1,1457.71,848.46,0.0
256,40476,2048,3072,cktile,11,0,347.8681,a8w8_blockscale_cktile_192x256x128_4x2x1_16x16x128_intrawave_0x1x0_1,1464.08,852.11,0.0
256,43462,2048,3072,cktile,11,0,388.4761,a8w8_blockscale_cktile_192x256x128_4x2x1_16x16x128_intrawave_0x1x0_1,1407.75,818.14,0.0
256,45000,2048,3072,cktile,11,0,387.4338,a8w8_blockscale_cktile_192x256x128_4x2x1_16x16x128_intrawave_0x1x0_1,1461.49,848.79,0.0
256,45001,2048,3072,cktile,11,0,389.2066,a8w8_blockscale_cktile_192x256x128_4x2x1_16x16x128_intrawave_0x1x0_1,1454.87,844.95,0.0
256,45007,2048,3072,cktile,11,0,386.7335,a8w8_blockscale_cktile_192x256x128_4x2x1_16x16x128_intrawave_0x1x0_1,1464.37,850.46,0.0
256,46359,2048,3072,cktile,11,0,391.5522,a8w8_blockscale_cktile_192x256x128_4x2x1_16x16x128_intrawave_0x1x0_1,1489.79,864.74,0.0
256,47925,2048,3072,cktile,11,0,391.2706,a8w8_blockscale_cktile_192x256x128_4x2x1_16x16x128_intrawave_0x1x0_1,1541.23,894.06,0.0
256,49015,2048,3072,cktile,11,0,392.2546,a8w8_blockscale_cktile_192x256x128_4x2x1_16x16x128_intrawave_0x1x0_1,1572.32,911.73,0.0
256,50000,2048,3072,cktile,11,0,437.1264,a8w8_blockscale_cktile_192x256x128_4x2x1_16x16x128_intrawave_0x1x0_1,1439.28,834.29,0.0
256,50084,2048,3072,cktile,11,0,435.0215,a8w8_blockscale_cktile_192x256x128_4x2x1_16x16x128_intrawave_0x1x0_1,1448.67,839.71,0.0
256,50091,2048,3072,cktile,11,0,439.0316,a8w8_blockscale_cktile_192x256x128_4x2x1_16x16x128_intrawave_0x1x0_1,1435.64,832.16,0.0
256,50798,2048,3072,cktile,11,0,429.9562,a8w8_blockscale_cktile_192x256x128_4x2x1_16x16x128_intrawave_0x1x0_1,1486.63,861.51,0.0
256,51013,2048,3072,cktile,11,0,437.4819,a8w8_blockscale_cktile_192x256x128_4x2x1_16x16x128_intrawave_0x1x0_1,1467.24,850.21,0.0
256,51297,2048,3072,cktile,11,0,445.4215,a8w8_blockscale_cktile_192x256x128_4x2x1_16x16x128_intrawave_0x1x0_1,1449.11,839.63,0.0
256,51369,2048,3072,cktile,11,0,442.3057,a8w8_blockscale_cktile_192x256x128_4x2x1_16x16x128_intrawave_0x1x0_1,1461.37,846.71,0.0
256,51558,2048,3072,cktile,11,0,445.7665,a8w8_blockscale_cktile_192x256x128_4x2x1_16x16x128_intrawave_0x1x0_1,1455.36,843.18,0.0
256,51980,2048,3072,cktile,11,0,444.6986,a8w8_blockscale_cktile_192x256x128_4x2x1_16x16x128_intrawave_0x1x0_1,1470.79,852.0,0.0
256,52057,2048,3072,cktile,11,0,444.8247,a8w8_blockscale_cktile_192x256x128_4x2x1_16x16x128_intrawave_0x1x0_1,1472.55,853.0,0.0
256,52101,2048,3072,cktile,11,0,446.2731,a8w8_blockscale_cktile_192x256x128_4x2x1_16x16x128_intrawave_0x1x0_1,1469.02,850.94,0.0
256,53069,2048,3072,cktile,11,0,444.0581,a8w8_blockscale_cktile_192x256x128_4x2x1_16x16x128_intrawave_0x1x0_1,1503.77,870.81,0.0
256,53093,2048,3072,cktile,11,0,447.8672,a8w8_blockscale_cktile_192x256x128_4x2x1_16x16x128_intrawave_0x1x0_1,1491.66,863.79,0.0
256,53339,2048,3072,cktile,11,0,445.7535,a8w8_blockscale_cktile_192x256x128_4x2x1_16x16x128_intrawave_0x1x0_1,1505.68,871.84,0.0
256,53803,2048,3072,cktile,11,0,444.4001,a8w8_blockscale_cktile_192x256x128_4x2x1_16x16x128_intrawave_0x1x0_1,1523.4,881.98,0.0
256,54090,2048,3072,cktile,11,0,441.3336,a8w8_blockscale_cktile_192x256x128_4x2x1_16x16x128_intrawave_0x1x0_1,1542.17,892.77,0.0
256,54120,2048,3072,cktile,11,0,446.3741,a8w8_blockscale_cktile_192x256x128_4x2x1_16x16x128_intrawave_0x1x0_1,1525.6,883.17,0.0
256,54541,2048,3072,cktile,11,0,440.0748,a8w8_blockscale_cktile_192x256x128_4x2x1_16x16x128_intrawave_0x1x0_1,1559.47,902.67,0.0
256,55009,2048,3072,cktile,11,0,443.84,a8w8_blockscale_cktile_192x256x128_4x2x1_16x16x128_intrawave_0x1x0_1,1559.51,902.57,0.0
256,55065,2048,3072,cktile,11,0,447.0353,a8w8_blockscale_cktile_192x256x128_4x2x1_16x16x128_intrawave_0x1x0_1,1549.94,897.02,0.0
256,57001,2048,3072,cktile,11,0,482.9887,a8w8_blockscale_cktile_192x256x128_4x2x1_16x16x128_intrawave_0x1x0_1,1485.0,858.97,0.0
256,57327,2048,3072,cktile,11,0,484.7525,a8w8_blockscale_cktile_192x256x128_4x2x1_16x16x128_intrawave_0x1x0_1,1488.06,860.67,0.0
256,57390,2048,3072,cktile,11,0,486.3913,a8w8_blockscale_cktile_192x256x128_4x2x1_16x16x128_intrawave_0x1x0_1,1484.68,858.7,0.0
256,59529,2048,3072,cktile,11,0,490.0047,a8w8_blockscale_cktile_192x256x128_4x2x1_16x16x128_intrawave_0x1x0_1,1528.66,883.66,0.0
256,60001,2048,3072,cktile,11,0,490.8487,a8w8_blockscale_cktile_192x256x128_4x2x1_16x16x128_intrawave_0x1x0_1,1538.13,889.03,0.0
256,60002,2048,3072,cktile,11,0,491.5124,a8w8_blockscale_cktile_192x256x128_4x2x1_16x16x128_intrawave_0x1x0_1,1536.07,887.84,0.0
256,60004,2048,3072,cktile,11,0,483.6151,a8w8_blockscale_cktile_192x256x128_4x2x1_16x16x128_intrawave_0x1x0_1,1561.21,902.37,0.0
256,60005,2048,3072,cktile,11,0,488.483,a8w8_blockscale_cktile_192x256x128_4x2x1_16x16x128_intrawave_0x1x0_1,1545.68,893.39,0.0
256,60006,2048,3072,cktile,11,0,492.3379,a8w8_blockscale_cktile_192x256x128_4x2x1_16x16x128_intrawave_0x1x0_1,1533.6,886.41,0.0
256,60008,2048,3072,cktile,11,0,488.6282,a8w8_blockscale_cktile_192x256x128_4x2x1_16x16x128_intrawave_0x1x0_1,1545.3,893.17,0.0
256,60127,2048,3072,cktile,11,0,490.1763,a8w8_blockscale_cktile_192x256x128_4x2x1_16x16x128_intrawave_0x1x0_1,1543.47,892.09,0.0
256,60217,2048,3072,cktile,11,0,492.2002,a8w8_blockscale_cktile_192x256x128_4x2x1_16x16x128_intrawave_0x1x0_1,1539.42,889.73,0.0
256,60224,2048,3072,cktile,11,0,487.5329,a8w8_blockscale_cktile_192x256x128_4x2x1_16x16x128_intrawave_0x1x0_1,1554.34,898.35,0.0
256,62537,2048,3072,cktile,11,0,536.2741,a8w8_blockscale_cktile_192x256x128_4x2x1_16x16x128_intrawave_0x1x0_1,1467.34,847.62,0.0
256,62559,2048,3072,cktile,11,0,538.3238,a8w8_blockscale_cktile_192x256x128_4x2x1_16x16x128_intrawave_0x1x0_1,1462.27,844.69,0.0
256,63226,2048,3072,cktile,11,0,539.1246,a8w8_blockscale_cktile_192x256x128_4x2x1_16x16x128_intrawave_0x1x0_1,1475.66,852.3,0.0
256,63269,2048,3072,cktile,11,0,539.3941,a8w8_blockscale_cktile_192x256x128_4x2x1_16x16x128_intrawave_0x1x0_1,1475.93,852.44,0.0
256,63504,2048,3072,cktile,11,0,533.2045,a8w8_blockscale_cktile_192x256x128_4x2x1_16x16x128_intrawave_0x1x0_1,1498.61,865.5,0.0
256,64077,2048,3072,cktile,11,0,541.9778,a8w8_blockscale_cktile_192x256x128_4x2x1_16x16x128_intrawave_0x1x0_1,1487.65,859.07,0.0
256,64476,2048,3072,cktile,11,0,543.7802,a8w8_blockscale_cktile_192x256x128_4x2x1_16x16x128_intrawave_0x1x0_1,1491.96,861.48,0.0
256,64949,2048,3072,cktile,11,0,550.2706,a8w8_blockscale_cktile_192x256x128_4x2x1_16x16x128_intrawave_0x1x0_1,1485.17,857.48,0.0
256,65003,2048,3072,cktile,11,0,547.1683,a8w8_blockscale_cktile_192x256x128_4x2x1_16x16x128_intrawave_0x1x0_1,1494.84,863.05,0.0
256,65004,2048,3072,cktile,11,0,547.6479,a8w8_blockscale_cktile_192x256x128_4x2x1_16x16x128_intrawave_0x1x0_1,1493.55,862.31,0.0
256,65204,2048,3072,cktile,11,0,548.5381,a8w8_blockscale_cktile_192x256x128_4x2x1_16x16x128_intrawave_0x1x0_1,1495.71,863.52,0.0
256,65316,2048,3072,cktile,11,0,545.3503,a8w8_blockscale_cktile_192x256x128_4x2x1_16x16x128_intrawave_0x1x0_1,1507.04,870.04,0.0
256,65317,2048,3072,cktile,11,0,542.1251,a8w8_blockscale_cktile_192x256x128_4x2x1_16x16x128_intrawave_0x1x0_1,1516.03,875.23,0.0
256,65536,2048,3072,cktile,11,0,537.8985,a8w8_blockscale_cktile_192x256x128_4x2x1_16x16x128_intrawave_0x1x0_1,1533.07,885.02,0.0
256,1,3072,3072,ck,8,0,11.4772,a8w8_blockscale_1x128x128_256x16x64x256_16x16_16x16_1x1_16x16x1_16x16x1_1x16x1x16_4_1x1_intrawave_v1,1.64,823.06,0.0
256,1,3072,6144,ck,8,0,18.8982,a8w8_blockscale_1x128x128_256x16x64x256_16x16_16x16_1x1_16x16x1_16x16x1_1x16x1x16_4_1x1_intrawave_v1,2.0,999.39,0.0
256,2,3072,3072,ck,8,0,10.8523,a8w8_blockscale_1x128x128_256x16x64x256_16x16_16x16_1x1_16x16x1_16x16x1_1x16x1x16_4_1x1_intrawave_v1,3.48,871.3,0.0
256,2,3072,6144,ck,8,0,18.9606,a8w8_blockscale_1x128x128_256x16x64x256_16x16_16x16_1x1_16x16x1_16x16x1_1x16x1x16_4_1x1_intrawave_v1,3.98,996.75,0.0
256,4,3072,3072,ck,8,0,10.8635,a8w8_blockscale_1x128x128_256x16x64x256_16x16_16x16_1x1_16x16x1_16x16x1_1x16x1x16_4_1x1_intrawave_v1,6.95,872.1,0.0
256,4,3072,6144,ck,8,0,18.9792,a8w8_blockscale_1x128x128_256x16x64x256_16x16_16x16_1x1_16x16x1_16x16x1_1x16x1x16_4_1x1_intrawave_v1,7.96,997.07,0.0
256,8,3072,3072,ck,8,0,10.8619,a8w8_blockscale_1x128x128_256x16x64x256_16x16_16x16_1x1_16x16x1_16x16x1_1x16x1x16_4_1x1_intrawave_v1,13.9,875.62,0.0
256,8,3072,6144,ck,8,0,19.2752,a8w8_blockscale_1x128x128_256x16x64x256_16x16_16x16_1x1_16x16x1_16x16x1_1x16x1x16_4_1x1_intrawave_v1,15.67,984.3,0.0
256,16,3072,3072,ck,8,0,10.3005,a8w8_blockscale_1x128x128_256x16x64x256_16x16_16x16_1x1_16x16x1_16x16x1_1x16x1x16_4_1x1_intrawave_v1,29.32,930.5,0.0
256,16,3072,6144,ck,8,0,18.2645,a8w8_blockscale_1x128x128_256x16x64x256_16x16_16x16_1x1_16x16x1_16x16x1_1x16x1x16_4_1x1_intrawave_v1,33.07,1044.16,0.0
256,24,3072,3072,ck,8,0,10.8666,a8w8_blockscale_1x128x128_256x16x64x256_16x16_16x16_1x1_16x16x1_16x16x1_1x16x1x16_4_1x1_intrawave_v1,41.69,888.81,0.0
256,24,3072,6144,ck,8,0,19.0149,a8w8_blockscale_1x128x128_256x16x64x256_16x16_16x16_1x1_16x16x1_16x16x1_1x16x1x16_4_1x1_intrawave_v1,47.65,1008.12,0.0
256,32,3072,3072,ck,8,0,10.5587,a8w8_blockscale_1x128x128_256x16x64x256_16x16_16x16_1x1_16x16x1_16x16x1_1x16x1x16_4_1x1_intrawave_v1,57.2,921.71,0.0
256,32,3072,6144,ck,8,0,18.3592,a8w8_blockscale_1x128x128_256x16x64x256_16x16_16x16_1x1_16x16x1_16x16x1_1x16x1x16_4_1x1_intrawave_v1,65.8,1049.48,0.0
256,40,3072,3072,ck,8,0,11.0459,a8w8_blockscale_1x128x128_256x16x64x256_16x16_16x16_1x1_16x16x1_16x16x1_1x16x1x16_4_1x1_intrawave_v1,68.35,887.73,0.0
256,40,3072,6144,ck,8,0,19.1262,a8w8_blockscale_1x128x128_256x16x64x256_16x16_16x16_1x1_16x16x1_16x16x1_1x16x1x16_4_1x1_intrawave_v1,78.95,1012.53,0.0
256,48,3072,3072,ck,8,0,10.4403,a8w8_blockscale_1x128x128_256x16x64x256_16x16_16x16_1x1_16x16x1_16x16x1_1x16x1x16_4_1x1_intrawave_v1,86.78,946.29,0.0
256,48,3072,6144,ck,8,0,18.3404,a8w8_blockscale_1x128x128_256x16x64x256_16x16_16x16_1x1_16x16x1_16x16x1_1x16x1x16_4_1x1_intrawave_v1,98.79,1061.27,0.0
256,56,3072,3072,ck,8,0,10.8079,a8w8_blockscale_1x128x128_256x16x64x256_16x16_16x16_1x1_16x16x1_16x16x1_1x16x1x16_4_1x1_intrawave_v1,97.8,920.93,0.0
256,56,3072,6144,ck,8,0,19.1824,a8w8_blockscale_1x128x128_256x16x64x256_16x16_16x16_1x1_16x16x1_16x16x1_1x16x1x16_4_1x1_intrawave_v1,110.2,1019.81,0.0
256,64,3072,3072,ck,8,0,10.5734,a8w8_blockscale_1x128x128_256x16x64x256_16x16_16x16_1x1_16x16x1_16x16x1_1x16x1x16_4_1x1_intrawave_v1,114.25,948.32,0.0
256,64,3072,6144,ck,8,0,18.4312,a8w8_blockscale_1x128x128_256x16x64x256_16x16_16x16_1x1_16x16x1_16x16x1_1x16x1x16_4_1x1_intrawave_v1,131.08,1066.71,0.0
256,72,3072,3072,ck,8,0,11.0705,a8w8_blockscale_1x128x128_256x16x64x256_16x16_16x16_1x1_16x16x1_16x16x1_1x16x1x16_4_1x1_intrawave_v1,122.75,912.4,0.0
256,72,3072,6144,ck,8,0,19.3446,a8w8_blockscale_1x128x128_256x16x64x256_16x16_16x16_1x1_16x16x1_16x16x1_1x16x1x16_4_1x1_intrawave_v1,140.5,1021.43,0.0
256,80,3072,3072,ck,8,0,10.6544,a8w8_blockscale_1x128x128_256x16x64x256_16x16_16x16_1x1_16x16x1_16x16x1_1x16x1x16_4_1x1_intrawave_v1,141.72,954.95,0.0
256,80,3072,6144,ck,8,0,18.8283,a8w8_blockscale_1x128x128_256x16x64x256_16x16_16x16_1x1_16x16x1_16x16x1_1x16x1x16_4_1x1_intrawave_v1,160.39,1054.66,0.0
256,88,3072,3072,ck,7,0,13.0888,a8w8_blockscale_1x128x128_256x16x128x256_16x16_16x16_1x2_16x16x1_16x16x1_1x16x1x16_8_1x2_intrawave_v1,126.9,782.97,0.0
256,88,3072,6144,ck,7,0,23.5957,a8w8_blockscale_1x128x128_256x16x128x256_16x16_16x16_1x2_16x16x1_16x16x1_1x16x1x16_8_1x2_intrawave_v1,140.78,845.74,0.0
256,96,3072,3072,ck,7,0,13.0916,a8w8_blockscale_1x128x128_256x16x128x256_16x16_16x16_1x2_16x16x1_16x16x1_1x16x1x16_8_1x2_intrawave_v1,138.4,788.44,0.0
256,96,3072,6144,ck,7,0,23.3197,a8w8_blockscale_1x128x128_256x16x128x256_16x16_16x16_1x2_16x16x1_16x16x1_1x16x1x16_8_1x2_intrawave_v1,155.4,859.96,0.0
256,104,3072,3072,ck,7,0,13.1795,a8w8_blockscale_1x128x128_256x16x128x256_16x16_16x16_1x2_16x16x1_16x16x1_1x16x1x16_8_1x2_intrawave_v1,148.94,788.77,0.0
256,104,3072,6144,ck,7,0,23.4614,a8w8_blockscale_1x128x128_256x16x128x256_16x16_16x16_1x2_16x16x1_16x16x1_1x16x1x16_8_1x2_intrawave_v1,167.33,858.96,0.0
256,112,3072,3072,ck,7,0,12.9368,a8w8_blockscale_1x128x128_256x16x128x256_16x16_16x16_1x2_16x16x1_16x16x1_1x16x1x16_8_1x2_intrawave_v1,163.4,809.27,0.0
256,112,3072,6144,ck,7,0,23.285,a8w8_blockscale_1x128x128_256x16x128x256_16x16_16x16_1x2_16x16x1_16x16x1_1x16x1x16_8_1x2_intrawave_v1,181.57,869.69,0.0
256,120,3072,3072,ck,7,0,13.3591,a8w8_blockscale_1x128x128_256x16x128x256_16x16_16x16_1x2_16x16x1_16x16x1_1x16x1x16_8_1x2_intrawave_v1,169.54,789.21,0.0
256,120,3072,6144,ck,7,0,23.4517,a8w8_blockscale_1x128x128_256x16x128x256_16x16_16x16_1x2_16x16x1_16x16x1_1x16x1x16_8_1x2_intrawave_v1,193.16,867.7,0.0
256,128,3072,3072,ck,7,0,13.0395,a8w8_blockscale_1x128x128_256x16x128x256_16x16_16x16_1x2_16x16x1_16x16x1_1x16x1x16_8_1x2_intrawave_v1,185.28,814.21,0.0
256,128,3072,6144,ck,18,0,22.616,a8w8_blockscale_1x128x128_256x64x64x256_16x16_32x32_1x1_16x16x1_16x16x1_1x32x1x8_8_1x1_intrawave_v1,213.65,904.1,0.0
256,136,3072,3072,ck,7,0,13.412,a8w8_blockscale_1x128x128_256x16x128x256_16x16_16x16_1x2_16x16x1_16x16x1_1x16x1x16_8_1x2_intrawave_v1,191.39,797.09,0.0
256,136,3072,6144,ck,7,0,23.8192,a8w8_blockscale_1x128x128_256x16x128x256_16x16_16x16_1x2_16x16x1_16x16x1_1x16x1x16_8_1x2_intrawave_v1,215.53,862.56,0.0
256,144,3072,3072,ck,7,0,12.9642,a8w8_blockscale_1x128x128_256x16x128x256_16x16_16x16_1x2_16x16x1_16x16x1_1x16x1x16_8_1x2_intrawave_v1,209.65,830.31,0.0
256,144,3072,6144,ck,7,0,23.5007,a8w8_blockscale_1x128x128_256x16x128x256_16x16_16x16_1x2_16x16x1_16x16x1_1x16x1x16_8_1x2_intrawave_v1,231.3,878.44,0.0
256,152,3072,3072,ck,7,0,13.5341,a8w8_blockscale_1x128x128_256x16x128x256_16x16_16x16_1x2_16x16x1_16x16x1_1x16x1x16_8_1x2_intrawave_v1,211.98,800.79,0.0
256,152,3072,6144,ck,7,0,24.0689,a8w8_blockscale_1x128x128_256x16x128x256_16x16_16x16_1x2_16x16x1_16x16x1_1x16x1x16_8_1x2_intrawave_v1,238.39,861.78,0.0
256,160,3072,3072,ck,7,0,13.1736,a8w8_blockscale_1x128x128_256x16x128x256_16x16_16x16_1x2_16x16x1_16x16x1_1x16x1x16_8_1x2_intrawave_v1,229.24,828.3,0.0
256,160,3072,6144,ck,7,0,23.5168,a8w8_blockscale_1x128x128_256x16x128x256_16x16_16x16_1x2_16x16x1_16x16x1_1x16x1x16_8_1x2_intrawave_v1,256.83,886.19,0.0
256,168,3072,3072,ck,18,0,15.926,a8w8_blockscale_1x128x128_256x64x64x256_16x16_32x32_1x1_16x16x1_16x16x1_1x32x1x8_8_1x1_intrawave_v1,199.1,689.78,0.0
256,168,3072,6144,ck,12,0,28.9256,a8w8_blockscale_1x128x128_256x32x128x256_16x16_32x32_1x1_16x16x1_16x16x1_1x32x1x8_8_1x1_intrawave_v1,219.24,723.88,0.0
256,176,3072,3072,ck,18,0,16.1117,a8w8_blockscale_1x128x128_256x64x64x256_16x16_32x32_1x1_16x16x1_16x16x1_1x32x1x8_8_1x1_intrawave_v1,206.18,686.41,0.0
256,176,3072,6144,ck,12,0,28.4841,a8w8_blockscale_1x128x128_256x32x128x256_16x16_32x32_1x1_16x16x1_16x16x1_1x32x1x8_8_1x1_intrawave_v1,233.25,738.55,0.0
256,184,3072,3072,ck,18,0,16.0898,a8w8_blockscale_1x128x128_256x64x64x256_16x16_32x32_1x1_16x16x1_16x16x1_1x32x1x8_8_1x1_intrawave_v1,215.84,691.92,0.0
256,184,3072,6144,ck,18,0,28.5961,a8w8_blockscale_1x128x128_256x64x64x256_16x16_32x32_1x1_16x16x1_16x16x1_1x32x1x8_8_1x1_intrawave_v1,242.89,739.1,0.0
256,192,3072,3072,ck,18,0,13.1147,a8w8_blockscale_1x128x128_256x64x64x256_16x16_32x32_1x1_16x16x1_16x16x1_1x32x1x8_8_1x1_intrawave_v1,276.32,854.51,0.0
256,192,3072,6144,ck,18,0,22.8914,a8w8_blockscale_1x128x128_256x64x64x256_16x16_32x32_1x1_16x16x1_16x16x1_1x32x1x8_8_1x1_intrawave_v1,316.61,927.58,0.0
256,200,3072,3072,ck,18,0,16.1575,a8w8_blockscale_1x128x128_256x64x64x256_16x16_32x32_1x1_16x16x1_16x16x1_1x32x1x8_8_1x1_intrawave_v1,233.63,698.15,0.0
256,200,3072,6144,ck,12,0,28.9028,a8w8_blockscale_1x128x128_256x32x128x256_16x16_32x32_1x1_16x16x1_16x16x1_1x32x1x8_8_1x1_intrawave_v1,261.21,738.06,0.0
256,208,3072,3072,ck,18,0,16.2707,a8w8_blockscale_1x128x128_256x64x64x256_16x16_32x32_1x1_16x16x1_16x16x1_1x32x1x8_8_1x1_intrawave_v1,241.28,697.83,0.0
256,208,3072,6144,ck,18,0,29.0255,a8w8_blockscale_1x128x128_256x64x64x256_16x16_32x32_1x1_16x16x1_16x16x1_1x32x1x8_8_1x1_intrawave_v1,270.51,738.33,0.0
256,216,3072,3072,ck,18,0,16.2224,a8w8_blockscale_1x128x128_256x64x64x256_16x16_32x32_1x1_16x16x1_16x16x1_1x32x1x8_8_1x1_intrawave_v1,251.31,704.45,0.0
256,216,3072,6144,ck,12,0,29.0446,a8w8_blockscale_1x128x128_256x32x128x256_16x16_32x32_1x1_16x16x1_16x16x1_1x32x1x8_8_1x1_intrawave_v1,280.73,741.22,0.0
256,224,3072,3072,ck,12,0,15.0546,a8w8_blockscale_1x128x128_256x32x128x256_16x16_32x32_1x1_16x16x1_16x16x1_1x32x1x8_8_1x1_intrawave_v1,280.83,763.99,0.0
256,224,3072,6144,ck,12,0,26.3504,a8w8_blockscale_1x128x128_256x32x128x256_16x16_32x32_1x1_16x16x1_16x16x1_1x32x1x8_8_1x1_intrawave_v1,320.9,820.74,0.0
256,232,3072,3072,ck,18,0,16.3421,a8w8_blockscale_1x128x128_256x64x64x256_16x16_32x32_1x1_16x16x1_16x16x1_1x32x1x8_8_1x1_intrawave_v1,267.95,708.31,0.0
256,232,3072,6144,ck,12,0,29.2271,a8w8_blockscale_1x128x128_256x32x128x256_16x16_32x32_1x1_16x16x1_16x16x1_1x32x1x8_8_1x1_intrawave_v1,299.64,743.32,0.0
256,240,3072,3072,ck,18,0,16.3729,a8w8_blockscale_1x128x128_256x64x64x256_16x16_32x32_1x1_16x16x1_16x16x1_1x32x1x8_8_1x1_intrawave_v1,276.67,711.48,0.0
256,240,3072,6144,ck,12,0,29.0937,a8w8_blockscale_1x128x128_256x32x128x256_16x16_32x32_1x1_16x16x1_16x16x1_1x32x1x8_8_1x1_intrawave_v1,311.4,750.11,0.0
256,248,3072,3072,ck,18,0,16.4225,a8w8_blockscale_1x128x128_256x64x64x256_16x16_32x32_1x1_16x16x1_16x16x1_1x32x1x8_8_1x1_intrawave_v1,285.03,713.82,0.0
256,248,3072,6144,ck,18,0,29.1472,a8w8_blockscale_1x128x128_256x64x64x256_16x16_32x32_1x1_16x16x1_16x16x1_1x32x1x8_8_1x1_intrawave_v1,321.19,752.11,0.0
256,256,3072,3072,ck,18,0,13.3536,a8w8_blockscale_1x128x128_256x64x64x256_16x16_32x32_1x1_16x16x1_16x16x1_1x32x1x8_8_1x1_intrawave_v1,361.84,883.39,0.0
256,256,3072,6144,ck,18,0,23.3756,a8w8_blockscale_1x128x128_256x64x64x256_16x16_32x32_1x1_16x16x1_16x16x1_1x32x1x8_8_1x1_intrawave_v1,413.41,942.01,0.0
256,272,3072,3072,ck,12,0,16.6396,a8w8_blockscale_1x128x128_256x32x128x256_16x16_32x32_1x1_16x16x1_16x16x1_1x32x1x8_8_1x1_intrawave_v1,308.53,717.8,0.0
256,272,3072,6144,ck,18,0,29.6555,a8w8_blockscale_1x128x128_256x64x64x256_16x16_32x32_1x1_16x16x1_16x16x1_1x32x1x8_8_1x1_intrawave_v1,346.23,749.16,0.0
256,288,3072,3072,ck,12,0,15.3781,a8w8_blockscale_1x128x128_256x32x128x256_16x16_32x32_1x1_16x16x1_16x16x1_1x32x1x8_8_1x1_intrawave_v1,353.48,786.27,0.0
256,288,3072,6144,ck,12,0,26.7466,a8w8_blockscale_1x128x128_256x32x128x256_16x16_32x32_1x1_16x16x1_16x16x1_1x32x1x8_8_1x1_intrawave_v1,406.47,837.99,0.0
256,304,3072,3072,ck,18,0,16.6404,a8w8_blockscale_1x128x128_256x64x64x256_16x16_32x32_1x1_16x16x1_16x16x1_1x32x1x8_8_1x1_intrawave_v1,344.81,735.49,0.0
256,304,3072,6144,ck,12,0,29.55,a8w8_blockscale_1x128x128_256x32x128x256_16x16_32x32_1x1_16x16x1_16x16x1_1x32x1x8_8_1x1_intrawave_v1,388.35,765.14,0.0
256,320,3072,3072,ck,18,0,13.5301,a8w8_blockscale_1x128x128_256x64x64x256_16x16_32x32_1x1_16x16x1_16x16x1_1x32x1x8_8_1x1_intrawave_v1,446.4,915.46,0.0
256,320,3072,6144,ck,18,0,23.4841,a8w8_blockscale_1x128x128_256x64x64x256_16x16_32x32_1x1_16x16x1_16x16x1_1x32x1x8_8_1x1_intrawave_v1,514.37,971.15,0.0
256,336,3072,3072,ck,2,0,20.8375,a8w8_blockscale_1x128x128_256x64x128x128_16x16_32x32_1x2_8x32x1_8x32x1_1x32x1x8_8_1x1_intrawave_v3,304.34,601.5,0.0
256,336,3072,6144,ck,2,0,36.3686,a8w8_blockscale_1x128x128_256x64x128x128_16x16_32x32_1x2_8x32x1_8x32x1_1x32x1x8_8_1x1_intrawave_v3,348.75,632.5,0.0
256,352,3072,3072,ck,2,0,20.5641,a8w8_blockscale_1x128x128_256x64x128x128_16x16_32x32_1x2_8x32x1_8x32x1_1x32x1x8_8_1x1_intrawave_v3,323.08,616.67,0.0
256,352,3072,6144,ck,2,0,36.3979,a8w8_blockscale_1x128x128_256x64x128x128_16x16_32x32_1x2_8x32x1_8x32x1_1x32x1x8_8_1x1_intrawave_v3,365.06,637.39,0.0
256,368,3072,3072,ck,2,0,21.1496,a8w8_blockscale_1x128x128_256x64x128x128_16x16_32x32_1x2_8x32x1_8x32x1_1x32x1x8_8_1x1_intrawave_v3,328.41,606.57,0.0
256,368,3072,6144,ck,2,0,36.6512,a8w8_blockscale_1x128x128_256x64x128x128_16x16_32x32_1x2_8x32x1_8x32x1_1x32x1x8_8_1x1_intrawave_v3,379.02,638.35,0.0
256,384,3072,3072,ck,3,0,20.3035,a8w8_blockscale_1x128x128_256x64x64x128_16x16_32x32_1x1_8x32x1_8x32x1_1x32x1x8_8_1x1_intrawave_v3,356.97,639.11,0.0
256,384,3072,6144,ck,3,0,35.5012,a8w8_blockscale_1x128x128_256x64x64x128_16x16_32x32_1x1_8x32x1_8x32x1_1x32x1x8_8_1x1_intrawave_v3,408.31,664.57,0.0
256,400,3072,3072,ck,2,0,20.9281,a8w8_blockscale_1x128x128_256x64x128x128_16x16_32x32_1x2_8x32x1_8x32x1_1x32x1x8_8_1x1_intrawave_v3,360.75,627.08,0.0
256,400,3072,6144,ck,2,0,36.4357,a8w8_blockscale_1x128x128_256x64x128x128_16x16_32x32_1x2_8x32x1_8x32x1_1x32x1x8_8_1x1_intrawave_v3,414.41,652.92,0.0
256,416,3072,3072,ck,2,0,20.6049,a8w8_blockscale_1x128x128_256x64x128x128_16x16_32x32_1x2_8x32x1_8x32x1_1x32x1x8_8_1x1_intrawave_v3,381.06,644.07,0.0
256,416,3072,6144,ck,2,0,36.2497,a8w8_blockscale_1x128x128_256x64x128x128_16x16_32x32_1x2_8x32x1_8x32x1_1x32x1x8_8_1x1_intrawave_v3,433.2,661.69,0.0
256,432,3072,3072,ck,2,0,21.0176,a8w8_blockscale_1x128x128_256x64x128x128_16x16_32x32_1x2_8x32x1_8x32x1_1x32x1x8_8_1x1_intrawave_v3,387.95,638.44,0.0
256,432,3072,6144,ck,2,0,36.4109,a8w8_blockscale_1x128x128_256x64x128x128_16x16_32x32_1x2_8x32x1_8x32x1_1x32x1x8_8_1x1_intrawave_v3,447.87,664.16,0.0
256,448,3072,3072,ck,2,0,20.8888,a8w8_blockscale_1x128x128_256x64x128x128_16x16_32x32_1x2_8x32x1_8x32x1_1x32x1x8_8_1x1_intrawave_v3,404.8,649.44,0.0
256,448,3072,6144,ck,2,0,36.2227,a8w8_blockscale_1x128x128_256x64x128x128_16x16_32x32_1x2_8x32x1_8x32x1_1x32x1x8_8_1x1_intrawave_v3,466.87,673.04,0.0
256,464,3072,3072,ck,2,0,20.3779,a8w8_blockscale_1x128x128_256x64x128x128_16x16_32x32_1x2_8x32x1_8x32x1_1x32x1x8_8_1x1_intrawave_v3,429.76,672.95,0.0
256,464,3072,6144,ck,2,0,35.9327,a8w8_blockscale_1x128x128_256x64x128x128_16x16_32x32_1x2_8x32x1_8x32x1_1x32x1x8_8_1x1_intrawave_v3,487.45,683.95,0.0
256,480,3072,3072,ck,2,0,20.5327,a8w8_blockscale_1x128x128_256x64x128x128_16x16_32x32_1x2_8x32x1_8x32x1_1x32x1x8_8_1x1_intrawave_v3,441.23,675.06,0.0
256,480,3072,6144,ck,2,0,36.0967,a8w8_blockscale_1x128x128_256x64x128x128_16x16_32x32_1x2_8x32x1_8x32x1_1x32x1x8_8_1x1_intrawave_v3,501.97,686.28,0.0
256,496,3072,3072,ck,2,0,20.9368,a8w8_blockscale_1x128x128_256x64x128x128_16x16_32x32_1x2_8x32x1_8x32x1_1x32x1x8_8_1x1_intrawave_v3,447.14,669.08,0.0
256,496,3072,6144,ck,2,0,36.4348,a8w8_blockscale_1x128x128_256x64x128x128_16x16_32x32_1x2_8x32x1_8x32x1_1x32x1x8_8_1x1_intrawave_v3,513.89,685.31,0.0
256,512,3072,3072,ck,2,0,20.7784,a8w8_blockscale_1x128x128_256x64x128x128_16x16_32x32_1x2_8x32x1_8x32x1_1x32x1x8_8_1x1_intrawave_v3,465.08,681.27,0.0
256,512,3072,6144,ck,2,0,36.2205,a8w8_blockscale_1x128x128_256x64x128x128_16x16_32x32_1x2_8x32x1_8x32x1_1x32x1x8_8_1x1_intrawave_v3,533.6,694.8,0.0
256,1000,3072,3072,ck,0,0,27.1223,a8w8_blockscale_1x128x128_256x128x128x128_16x16_32x32_2x2_8x32x1_8x32x1_1x32x1x8_8_1x1_intrawave_v3,695.9,687.74,0.0
256,1000,3072,6144,ck,0,0,47.4161,a8w8_blockscale_1x128x128_256x128x128x128_16x16_32x32_2x2_8x32x1_8x32x1_1x32x1x8_8_1x1_intrawave_v3,796.12,657.21,0.0
256,1001,3072,3072,ck,0,0,27.5093,a8w8_blockscale_1x128x128_256x128x128x128_16x16_32x32_2x2_8x32x1_8x32x1_1x32x1x8_8_1x1_intrawave_v3,686.79,678.4,0.0
256,1001,3072,6144,ck,0,0,47.0962,a8w8_blockscale_1x128x128_256x128x128x128_16x16_32x32_2x2_8x32x1_8x32x1_1x32x1x8_8_1x1_intrawave_v3,802.33,661.94,0.0
256,1002,3072,6144,ck,0,0,47.2224,a8w8_blockscale_1x128x128_256x128x128x128_16x16_32x32_2x2_8x32x1_8x32x1_1x32x1x8_8_1x1_intrawave_v3,800.98,660.43,0.0
256,1003,3072,3072,ck,0,0,27.4477,a8w8_blockscale_1x128x128_256x128x128x128_16x16_32x32_2x2_8x32x1_8x32x1_1x32x1x8_8_1x1_intrawave_v3,689.71,680.6,0.0
256,1005,3072,3072,ck,0,0,27.7035,a8w8_blockscale_1x128x128_256x128x128x128_16x16_32x32_2x2_8x32x1_8x32x1_1x32x1x8_8_1x1_intrawave_v3,684.71,674.98,0.0
256,1012,3072,6144,ck,0,0,46.9331,a8w8_blockscale_1x128x128_256x128x128x128_16x16_32x32_2x2_8x32x1_8x32x1_1x32x1x8_8_1x1_intrawave_v3,813.96,667.12,0.0
256,1028,3072,6144,ck,0,0,47.3381,a8w8_blockscale_1x128x128_256x128x128x128_16x16_32x32_2x2_8x32x1_8x32x1_1x32x1x8_8_1x1_intrawave_v3,819.76,665.56,0.0
256,1058,3072,6144,ck,0,0,47.119,a8w8_blockscale_1x128x128_256x128x128x128_16x16_32x32_2x2_8x32x1_8x32x1_1x32x1x8_8_1x1_intrawave_v3,847.6,676.48,0.0
256,1063,3072,3072,ck,0,0,27.6872,a8w8_blockscale_1x128x128_256x128x128x128_16x16_32x32_2x2_8x32x1_8x32x1_1x32x1x8_8_1x1_intrawave_v3,724.65,694.68,0.0
256,1095,3072,3072,ck,0,0,27.6677,a8w8_blockscale_1x128x128_256x128x128x128_16x16_32x32_2x2_8x32x1_8x32x1_1x32x1x8_8_1x1_intrawave_v3,746.99,705.83,0.0
256,1123,3072,3072,ck,0,0,27.7047,a8w8_blockscale_1x128x128_256x128x128x128_16x16_32x32_2x2_8x32x1_8x32x1_1x32x1x8_8_1x1_intrawave_v3,765.07,714.2,0.0
256,1140,3072,6144,ck,0,0,48.3752,a8w8_blockscale_1x128x128_256x128x128x128_16x16_32x32_2x2_8x32x1_8x32x1_1x32x1x8_8_1x1_intrawave_v3,889.58,679.74,0.0
256,1169,3072,6144,ck,0,0,48.8845,a8w8_blockscale_1x128x128_256x128x128x128_16x16_32x32_2x2_8x32x1_8x32x1_1x32x1x8_8_1x1_intrawave_v3,902.7,679.95,0.0
256,1192,3072,6144,ck,0,0,48.4248,a8w8_blockscale_1x128x128_256x128x128x128_16x16_32x32_2x2_8x32x1_8x32x1_1x32x1x8_8_1x1_intrawave_v3,929.2,692.24,0.0
256,1193,3072,6144,ck,0,0,48.648,a8w8_blockscale_1x128x128_256x128x128x128_16x16_32x32_2x2_8x32x1_8x32x1_1x32x1x8_8_1x1_intrawave_v3,925.72,689.32,0.0
256,1198,3072,6144,ck,0,0,47.552,a8w8_blockscale_1x128x128_256x128x128x128_16x16_32x32_2x2_8x32x1_8x32x1_1x32x1x8_8_1x1_intrawave_v3,951.02,706.5,0.0
256,1200,3072,6144,ck,0,0,48.2711,a8w8_blockscale_1x128x128_256x128x128x128_16x16_32x32_2x2_8x32x1_8x32x1_1x32x1x8_8_1x1_intrawave_v3,938.42,696.48,0.0
256,1201,3072,6144,ck,0,0,48.1399,a8w8_blockscale_1x128x128_256x128x128x128_16x16_32x32_2x2_8x32x1_8x32x1_1x32x1x8_8_1x1_intrawave_v3,941.76,698.64,0.0
256,1202,3072,6144,ck,0,0,48.6517,a8w8_blockscale_1x128x128_256x128x128x128_16x16_32x32_2x2_8x32x1_8x32x1_1x32x1x8_8_1x1_intrawave_v3,932.63,691.54,0.0
256,1203,3072,6144,ck,0,0,48.0216,a8w8_blockscale_1x128x128_256x128x128x128_16x16_32x32_2x2_8x32x1_8x32x1_1x32x1x8_8_1x1_intrawave_v3,945.65,700.87,0.0
256,1205,3072,6144,ck,0,0,49.1179,a8w8_blockscale_1x128x128_256x128x128x128_16x16_32x32_2x2_8x32x1_8x32x1_1x32x1x8_8_1x1_intrawave_v3,926.08,685.73,0.0
256,1212,3072,6144,ck,0,0,49.2201,a8w8_blockscale_1x128x128_256x128x128x128_16x16_32x32_2x2_8x32x1_8x32x1_1x32x1x8_8_1x1_intrawave_v3,929.53,686.05,0.0
256,1213,3072,6144,ck,0,0,49.6039,a8w8_blockscale_1x128x128_256x128x128x128_16x16_32x32_2x2_8x32x1_8x32x1_1x32x1x8_8_1x1_intrawave_v3,923.1,680.99,0.0
256,1214,3072,6144,ck,0,0,48.9586,a8w8_blockscale_1x128x128_256x128x128x128_16x16_32x32_2x2_8x32x1_8x32x1_1x32x1x8_8_1x1_intrawave_v3,936.04,690.22,0.0
256,1215,3072,6144,ck,0,0,48.8592,a8w8_blockscale_1x128x128_256x128x128x128_16x16_32x32_2x2_8x32x1_8x32x1_1x32x1x8_8_1x1_intrawave_v3,938.71,691.87,0.0
256,1216,3072,6144,ck,0,0,48.4799,a8w8_blockscale_1x128x128_256x128x128x128_16x16_32x32_2x2_8x32x1_8x32x1_1x32x1x8_8_1x1_intrawave_v3,946.83,697.54,0.0
256,1228,3072,6144,ck,0,0,48.7093,a8w8_blockscale_1x128x128_256x128x128x128_16x16_32x32_2x2_8x32x1_8x32x1_1x32x1x8_8_1x1_intrawave_v3,951.68,697.28,0.0
256,1229,3072,6144,ck,0,0,48.9289,a8w8_blockscale_1x128x128_256x128x128x128_16x16_32x32_2x2_8x32x1_8x32x1_1x32x1x8_8_1x1_intrawave_v3,948.18,694.4,0.0
256,1258,3072,6144,ck,0,0,49.0962,a8w8_blockscale_1x128x128_256x128x128x128_16x16_32x32_2x2_8x32x1_8x32x1_1x32x1x8_8_1x1_intrawave_v3,967.24,699.29,0.0
256,1263,3072,6144,ck,0,0,50.0281,a8w8_blockscale_1x128x128_256x128x128x128_16x16_32x32_2x2_8x32x1_8x32x1_1x32x1x8_8_1x1_intrawave_v3,953.0,687.5,0.0
256,1270,3072,6144,ck,0,0,48.7836,a8w8_blockscale_1x128x128_256x128x128x128_16x16_32x32_2x2_8x32x1_8x32x1_1x32x1x8_8_1x1_intrawave_v3,982.73,706.8,0.0
256,1511,3072,3072,ck,2,0,39.5322,a8w8_blockscale_1x128x128_256x64x128x128_16x16_32x32_1x2_8x32x1_8x32x1_1x32x1x8_8_1x1_intrawave_v3,721.42,590.98,0.0
256,1616,3072,3072,ck,2,0,40.4866,a8w8_blockscale_1x128x128_256x64x128x128_16x16_32x32_1x2_8x32x1_8x32x1_1x32x1x8_8_1x1_intrawave_v3,753.36,600.95,0.0
256,2000,3072,3072,ck,0,0,43.6633,a8w8_blockscale_1x128x128_256x128x128x128_16x16_32x32_2x2_8x32x1_8x32x1_1x32x1x8_8_1x1_intrawave_v3,864.54,638.27,0.0
256,2000,3072,6144,ck,0,0,75.2268,a8w8_blockscale_1x128x128_256x128x128x128_16x16_32x32_2x2_8x32x1_8x32x1_1x32x1x8_8_1x1_intrawave_v3,1003.6,577.59,0.0
256,2002,3072,3072,ck,2,0,43.3194,a8w8_blockscale_1x128x128_256x64x128x128_16x16_32x32_1x2_8x32x1_8x32x1_1x32x1x8_8_1x1_intrawave_v3,872.28,643.77,0.0
256,2003,3072,3072,ck,0,0,43.5311,a8w8_blockscale_1x128x128_256x128x128x128_16x16_32x32_2x2_8x32x1_8x32x1_1x32x1x8_8_1x1_intrawave_v3,868.47,640.85,0.0
256,2004,3072,6144,ck,0,0,76.5989,a8w8_blockscale_1x128x128_256x128x128x128_16x16_32x32_2x2_8x32x1_8x32x1_1x32x1x8_8_1x1_intrawave_v3,987.59,567.89,0.0
256,2032,3072,6144,ck,0,0,79.2534,a8w8_blockscale_1x128x128_256x128x128x128_16x16_32x32_2x2_8x32x1_8x32x1_1x32x1x8_8_1x1_intrawave_v3,967.85,553.21,0.0
256,2125,3072,3072,ck,0,0,44.2748,a8w8_blockscale_1x128x128_256x128x128x128_16x16_32x32_2x2_8x32x1_8x32x1_1x32x1x8_8_1x1_intrawave_v3,905.89,655.48,0.0
256,2197,3072,6144,ck,0,0,79.1298,a8w8_blockscale_1x128x128_256x128x128x128_16x16_32x32_2x2_8x32x1_8x32x1_1x32x1x8_8_1x1_intrawave_v3,1048.08,579.69,0.0
256,2200,3072,6144,ck,0,0,79.3582,a8w8_blockscale_1x128x128_256x128x128x128_16x16_32x32_2x2_8x32x1_8x32x1_1x32x1x8_8_1x1_intrawave_v3,1046.49,578.49,0.0
256,2202,3072,6144,ck,0,0,77.4611,a8w8_blockscale_1x128x128_256x128x128x128_16x16_32x32_2x2_8x32x1_8x32x1_1x32x1x8_8_1x1_intrawave_v3,1073.09,592.98,0.0
256,2204,3072,6144,ck,0,0,77.8575,a8w8_blockscale_1x128x128_256x128x128x128_16x16_32x32_2x2_8x32x1_8x32x1_1x32x1x8_8_1x1_intrawave_v3,1068.6,590.27,0.0
256,2213,3072,6144,ck,0,0,80.129,a8w8_blockscale_1x128x128_256x128x128x128_16x16_32x32_2x2_8x32x1_8x32x1_1x32x1x8_8_1x1_intrawave_v3,1042.54,574.92,0.0
256,2216,3072,6144,ck,0,0,78.115,a8w8_blockscale_1x128x128_256x128x128x128_16x16_32x32_2x2_8x32x1_8x32x1_1x32x1x8_8_1x1_intrawave_v3,1070.87,590.21,0.0
256,2230,3072,6144,ck,0,0,79.1374,a8w8_blockscale_1x128x128_256x128x128x128_16x16_32x32_2x2_8x32x1_8x32x1_1x32x1x8_8_1x1_intrawave_v3,1063.72,584.76,0.0
256,2233,3072,6144,ck,0,0,77.8198,a8w8_blockscale_1x128x128_256x128x128x128_16x16_32x32_2x2_8x32x1_8x32x1_1x32x1x8_8_1x1_intrawave_v3,1083.18,595.14,0.0
256,2235,3072,6144,ck,0,0,78.8406,a8w8_blockscale_1x128x128_256x128x128x128_16x16_32x32_2x2_8x32x1_8x32x1_1x32x1x8_8_1x1_intrawave_v3,1070.11,587.74,0.0
256,2236,3072,6144,ck,0,0,77.9258,a8w8_blockscale_1x128x128_256x128x128x128_16x16_32x32_2x2_8x32x1_8x32x1_1x32x1x8_8_1x1_intrawave_v3,1083.16,594.8,0.0
256,2237,3072,6144,ck,0,0,76.9389,a8w8_blockscale_1x128x128_256x128x128x128_16x16_32x32_2x2_8x32x1_8x32x1_1x32x1x8_8_1x1_intrawave_v3,1097.55,602.59,0.0
256,2238,3072,6144,ck,0,0,79.7002,a8w8_blockscale_1x128x128_256x128x128x128_16x16_32x32_2x2_8x32x1_8x32x1_1x32x1x8_8_1x1_intrawave_v3,1059.99,581.87,0.0
256,2355,3072,6144,ck,0,0,79.9302,a8w8_blockscale_1x128x128_256x128x128x128_16x16_32x32_2x2_8x32x1_8x32x1_1x32x1x8_8_1x1_intrawave_v3,1112.2,598.18,0.0
256,3000,3072,3072,cktile,11,0,53.2318,a8w8_blockscale_cktile_192x256x128_4x2x1_16x16x128_intrawave_0x1x0_1,1063.71,696.67,0.0
256,3000,3072,6144,cktile,11,0,84.0575,a8w8_blockscale_cktile_192x256x128_4x2x1_16x16x128_intrawave_0x1x0_1,1347.25,663.1,0.0
256,3001,3072,3072,cktile,11,0,52.7633,a8w8_blockscale_cktile_192x256x128_4x2x1_16x16x128_intrawave_0x1x0_1,1073.51,703.03,0.0
256,3001,3072,6144,cktile,11,0,84.7491,a8w8_blockscale_cktile_192x256x128_4x2x1_16x16x128_intrawave_0x1x0_1,1336.7,657.83,0.0
256,3004,3072,3072,cktile,11,0,52.6452,a8w8_blockscale_cktile_192x256x128_4x2x1_16x16x128_intrawave_0x1x0_1,1076.99,705.14,0.0
256,3004,3072,6144,cktile,11,0,85.0733,a8w8_blockscale_cktile_192x256x128_4x2x1_16x16x128_intrawave_0x1x0_1,1332.94,655.76,0.0
256,3005,3072,6144,cktile,11,0,83.9444,a8w8_blockscale_cktile_192x256x128_4x2x1_16x16x128_intrawave_0x1x0_1,1351.31,664.72,0.0
256,3006,3072,6144,cktile,11,0,84.2409,a8w8_blockscale_cktile_192x256x128_4x2x1_16x16x128_intrawave_0x1x0_1,1347.0,662.53,0.0
256,3012,3072,6144,cktile,11,0,84.4947,a8w8_blockscale_cktile_192x256x128_4x2x1_16x16x128_intrawave_0x1x0_1,1345.64,661.41,0.0
256,3024,3072,3072,cktile,11,0,52.9882,a8w8_blockscale_cktile_192x256x128_4x2x1_16x16x128_intrawave_0x1x0_1,1077.15,704.05,0.0
256,3029,3072,6144,cktile,11,0,85.0541,a8w8_blockscale_cktile_192x256x128_4x2x1_16x16x128_intrawave_0x1x0_1,1344.33,659.52,0.0
256,3030,3072,3072,cktile,11,0,52.5707,a8w8_blockscale_cktile_192x256x128_4x2x1_16x16x128_intrawave_0x1x0_1,1087.86,710.69,0.0
256,3032,3072,3072,cktile,11,0,52.6789,a8w8_blockscale_cktile_192x256x128_4x2x1_16x16x128_intrawave_0x1x0_1,1086.34,709.58,0.0
256,3056,3072,6144,cktile,11,0,84.688,a8w8_blockscale_cktile_192x256x128_4x2x1_16x16x128_intrawave_0x1x0_1,1362.18,666.29,0.0
256,3084,3072,6144,cktile,11,0,85.7689,a8w8_blockscale_cktile_192x256x128_4x2x1_16x16x128_intrawave_0x1x0_1,1357.33,661.9,0.0
256,3113,3072,6144,cktile,11,0,84.8867,a8w8_blockscale_cktile_192x256x128_4x2x1_16x16x128_intrawave_0x1x0_1,1384.34,672.98,0.0
256,3201,3072,6144,cktile,11,0,86.908,a8w8_blockscale_cktile_192x256x128_4x2x1_16x16x128_intrawave_0x1x0_1,1390.36,669.77,0.0
256,3202,3072,6144,cktile,11,0,87.4236,a8w8_blockscale_cktile_192x256x128_4x2x1_16x16x128_intrawave_0x1x0_1,1382.6,665.96,0.0
256,3225,3072,6144,cktile,11,0,85.3543,a8w8_blockscale_cktile_192x256x128_4x2x1_16x16x128_intrawave_0x1x0_1,1426.29,685.42,0.0
256,3227,3072,6144,cktile,11,0,85.556,a8w8_blockscale_cktile_192x256x128_4x2x1_16x16x128_intrawave_0x1x0_1,1423.81,684.09,0.0
256,3236,3072,6144,cktile,11,0,84.8655,a8w8_blockscale_cktile_192x256x128_4x2x1_16x16x128_intrawave_0x1x0_1,1439.39,690.96,0.0
256,3242,3072,6144,cktile,11,0,85.5014,a8w8_blockscale_cktile_192x256x128_4x2x1_16x16x128_intrawave_0x1x0_1,1431.34,686.68,0.0
256,3256,3072,6144,cktile,11,0,85.4103,a8w8_blockscale_cktile_192x256x128_4x2x1_16x16x128_intrawave_0x1x0_1,1439.05,689.43,0.0
256,3258,3072,6144,cktile,11,0,85.213,a8w8_blockscale_cktile_192x256x128_4x2x1_16x16x128_intrawave_0x1x0_1,1443.27,691.31,0.0
256,3263,3072,6144,cktile,11,0,85.795,a8w8_blockscale_cktile_192x256x128_4x2x1_16x16x128_intrawave_0x1x0_1,1435.68,687.34,0.0
256,3485,3072,6144,cktile,11,0,87.4433,a8w8_blockscale_cktile_192x256x128_4x2x1_16x16x128_intrawave_0x1x0_1,1504.45,705.58,0.0
256,3486,3072,6144,cktile,11,0,85.794,a8w8_blockscale_cktile_192x256x128_4x2x1_16x16x128_intrawave_0x1x0_1,1533.81,719.28,0.0
256,3491,3072,6144,cktile,11,0,87.0706,a8w8_blockscale_cktile_192x256x128_4x2x1_16x16x128_intrawave_0x1x0_1,1513.49,709.44,0.0
256,3509,3072,6144,cktile,11,0,88.1188,a8w8_blockscale_cktile_192x256x128_4x2x1_16x16x128_intrawave_0x1x0_1,1503.2,703.52,0.0
256,3520,3072,6144,cktile,11,0,88.3828,a8w8_blockscale_cktile_192x256x128_4x2x1_16x16x128_intrawave_0x1x0_1,1503.41,702.94,0.0
256,3531,3072,6144,cktile,11,0,86.7771,a8w8_blockscale_cktile_192x256x128_4x2x1_16x16x128_intrawave_0x1x0_1,1536.01,717.51,0.0
256,3541,3072,6144,cktile,11,0,88.6444,a8w8_blockscale_cktile_192x256x128_4x2x1_16x16x128_intrawave_0x1x0_1,1507.92,703.78,0.0
256,3542,3072,6144,cktile,11,0,87.3356,a8w8_blockscale_cktile_192x256x128_4x2x1_16x16x128_intrawave_0x1x0_1,1530.95,714.47,0.0
256,3549,3072,6144,cktile,11,0,88.1245,a8w8_blockscale_cktile_192x256x128_4x2x1_16x16x128_intrawave_0x1x0_1,1520.24,709.05,0.0
256,3563,3072,6144,cktile,11,0,88.0404,a8w8_blockscale_cktile_192x256x128_4x2x1_16x16x128_intrawave_0x1x0_1,1527.69,711.68,0.0
256,3603,3072,6144,cktile,11,0,87.2822,a8w8_blockscale_cktile_192x256x128_4x2x1_16x16x128_intrawave_0x1x0_1,1558.26,723.49,0.0
256,3634,3072,6144,cktile,11,0,88.1657,a8w8_blockscale_cktile_192x256x128_4x2x1_16x16x128_intrawave_0x1x0_1,1555.92,720.56,0.0
256,3649,3072,6144,cktile,11,0,87.6309,a8w8_blockscale_cktile_192x256x128_4x2x1_16x16x128_intrawave_0x1x0_1,1571.88,727.06,0.0
256,3660,3072,6144,cktile,11,0,87.5931,a8w8_blockscale_cktile_192x256x128_4x2x1_16x16x128_intrawave_0x1x0_1,1577.3,728.92,0.0
256,3668,3072,6144,cktile,11,0,87.8111,a8w8_blockscale_cktile_192x256x128_4x2x1_16x16x128_intrawave_0x1x0_1,1576.82,728.23,0.0
256,3669,3072,6144,cktile,11,0,88.5459,a8w8_blockscale_cktile_192x256x128_4x2x1_16x16x128_intrawave_0x1x0_1,1564.16,722.33,0.0
256,3718,3072,6144,cktile,11,0,88.3152,a8w8_blockscale_cktile_192x256x128_4x2x1_16x16x128_intrawave_0x1x0_1,1589.19,731.03,0.0
256,3725,3072,6144,cktile,11,0,88.7503,a8w8_blockscale_cktile_192x256x128_4x2x1_16x16x128_intrawave_0x1x0_1,1584.38,728.42,0.0
256,3734,3072,6144,cktile,11,0,89.2624,a8w8_blockscale_cktile_192x256x128_4x2x1_16x16x128_intrawave_0x1x0_1,1579.09,725.48,0.0
256,3859,3072,6144,cktile,11,0,89.2156,a8w8_blockscale_cktile_192x256x128_4x2x1_16x16x128_intrawave_0x1x0_1,1632.81,743.07,0.0
256,3982,3072,3072,cktile,11,0,55.2488,a8w8_blockscale_cktile_192x256x128_4x2x1_16x16x128_intrawave_0x1x0_1,1360.35,835.05,0.0
256,4000,3072,3072,cktile,11,0,55.2846,a8w8_blockscale_cktile_192x256x128_4x2x1_16x16x128_intrawave_0x1x0_1,1365.61,837.51,0.0
256,4000,3072,6144,cktile,11,0,89.9149,a8w8_blockscale_cktile_192x256x128_4x2x1_16x16x128_intrawave_0x1x0_1,1679.31,756.56,0.0
256,4001,3072,3072,cktile,11,0,55.5252,a8w8_blockscale_cktile_192x256x128_4x2x1_16x16x128_intrawave_0x1x0_1,1360.04,834.04,0.0
256,4001,3072,6144,cktile,11,0,90.0573,a8w8_blockscale_cktile_192x256x128_4x2x1_16x16x128_intrawave_0x1x0_1,1677.07,755.5,0.0
256,4004,3072,3072,cktile,11,0,55.2823,a8w8_blockscale_cktile_192x256x128_4x2x1_16x16x128_intrawave_0x1x0_1,1367.04,838.21,0.0
256,4060,3072,3072,ck,0,0,70.0381,a8w8_blockscale_1x128x128_256x128x128x128_16x16_32x32_2x2_8x32x1_8x32x1_1x32x1x8_8_1x1_intrawave_v3,1094.12,668.98,0.0
256,4080,3072,6144,ck,0,0,125.9044,a8w8_blockscale_1x128x128_256x128x128x128_16x16_32x32_2x2_8x32x1_8x32x1_1x32x1x8_8_1x1_intrawave_v3,1223.27,548.11,0.0
256,4123,3072,3072,ck,0,0,80.9802,a8w8_blockscale_1x128x128_256x128x128x128_16x16_32x32_2x2_8x32x1_8x32x1_1x32x1x8_8_1x1_intrawave_v3,960.96,585.76,0.0
256,4195,3072,6144,cktile,11,0,143.6377,a8w8_blockscale_cktile_192x256x128_4x2x1_16x16x128_intrawave_0x1x0_1,1102.47,490.28,0.0
256,4197,3072,6144,cktile,11,0,142.5419,a8w8_blockscale_cktile_192x256x128_4x2x1_16x16x128_intrawave_0x1x0_1,1111.47,494.22,0.0
256,4219,3072,6144,cktile,11,0,142.9387,a8w8_blockscale_cktile_192x256x128_4x2x1_16x16x128_intrawave_0x1x0_1,1114.2,494.74,0.0
256,4223,3072,6144,cktile,11,0,143.1558,a8w8_blockscale_cktile_192x256x128_4x2x1_16x16x128_intrawave_0x1x0_1,1113.56,494.33,0.0
256,4225,3072,6144,cktile,11,0,143.3216,a8w8_blockscale_cktile_192x256x128_4x2x1_16x16x128_intrawave_0x1x0_1,1112.8,493.93,0.0
256,4239,3072,3072,ck,0,0,81.4534,a8w8_blockscale_1x128x128_256x128x128x128_16x16_32x32_2x2_8x32x1_8x32x1_1x32x1x8_8_1x1_intrawave_v3,982.26,595.48,0.0
256,4246,3072,6144,ck,0,0,143.4568,a8w8_blockscale_1x128x128_256x128x128x128_16x16_32x32_2x2_8x32x1_8x32x1_1x32x1x8_8_1x1_intrawave_v3,1117.28,495.27,0.0
256,4250,3072,6144,cktile,11,0,146.7944,a8w8_blockscale_cktile_192x256x128_4x2x1_16x16x128_intrawave_0x1x0_1,1092.9,484.34,0.0
256,4472,3072,3072,ck,0,0,82.2741,a8w8_blockscale_1x128x128_256x128x128x128_16x16_32x32_2x2_8x32x1_8x32x1_1x32x1x8_8_1x1_intrawave_v3,1025.91,615.64,0.0
256,4472,3072,6144,ck,0,0,145.9093,a8w8_blockscale_1x128x128_256x128x128x128_16x16_32x32_2x2_8x32x1_8x32x1_1x32x1x8_8_1x1_intrawave_v3,1156.97,505.97,0.0
256,4481,3072,6144,ck,0,0,147.8124,a8w8_blockscale_1x128x128_256x128x128x128_16x16_32x32_2x2_8x32x1_8x32x1_1x32x1x8_8_1x1_intrawave_v3,1144.37,500.21,0.0
256,4496,3072,6144,ck,0,0,146.6604,a8w8_blockscale_1x128x128_256x128x128x128_16x16_32x32_2x2_8x32x1_8x32x1_1x32x1x8_8_1x1_intrawave_v3,1157.22,505.39,0.0
256,4513,3072,6144,ck,0,0,148.3216,a8w8_blockscale_1x128x128_256x128x128x128_16x16_32x32_2x2_8x32x1_8x32x1_1x32x1x8_8_1x1_intrawave_v3,1148.59,501.14,0.0
256,4522,3072,6144,ck,0,0,149.6704,a8w8_blockscale_1x128x128_256x128x128x128_16x16_32x32_2x2_8x32x1_8x32x1_1x32x1x8_8_1x1_intrawave_v3,1140.5,497.36,0.0
256,4553,3072,3072,ck,0,0,82.9762,a8w8_blockscale_1x128x128_256x128x128x128_16x16_32x32_2x2_8x32x1_8x32x1_1x32x1x8_8_1x1_intrawave_v3,1035.66,619.43,0.0
256,4799,3072,6144,ck,0,0,149.186,a8w8_blockscale_1x128x128_256x128x128x128_16x16_32x32_2x2_8x32x1_8x32x1_1x32x1x8_8_1x1_intrawave_v3,1214.3,521.79,0.0
256,5000,3072,3072,ck,0,0,86.5486,a8w8_blockscale_1x128x128_256x128x128x128_16x16_32x32_2x2_8x32x1_8x32x1_1x32x1x8_8_1x1_intrawave_v3,1090.39,641.46,0.0
256,5000,3072,6144,ck,0,0,153.3548,a8w8_blockscale_1x128x128_256x128x128x128_16x16_32x32_2x2_8x32x1_8x32x1_1x32x1x8_8_1x1_intrawave_v3,1230.76,523.72,0.0
256,5001,3072,3072,ck,0,0,83.8474,a8w8_blockscale_1x128x128_256x128x128x128_16x16_32x32_2x2_8x32x1_8x32x1_1x32x1x8_8_1x1_intrawave_v3,1125.74,662.23,0.0
256,5001,3072,6144,ck,0,0,151.4048,a8w8_blockscale_1x128x128_256x128x128x128_16x16_32x32_2x2_8x32x1_8x32x1_1x32x1x8_8_1x1_intrawave_v3,1246.87,530.54,0.0
256,5002,3072,6144,ck,0,0,153.4744,a8w8_blockscale_1x128x128_256x128x128x128_16x16_32x32_2x2_8x32x1_8x32x1_1x32x1x8_8_1x1_intrawave_v3,1230.3,523.47,0.0
256,5003,3072,3072,ck,0,0,85.787,a8w8_blockscale_1x128x128_256x128x128x128_16x16_32x32_2x2_8x32x1_8x32x1_1x32x1x8_8_1x1_intrawave_v3,1100.73,647.47,0.0
256,5003,3072,6144,ck,0,0,150.9388,a8w8_blockscale_1x128x128_256x128x128x128_16x16_32x32_2x2_8x32x1_8x32x1_1x32x1x8_8_1x1_intrawave_v3,1251.22,532.34,0.0
256,5007,3072,6144,ck,0,0,151.2888,a8w8_blockscale_1x128x128_256x128x128x128_16x16_32x32_2x2_8x32x1_8x32x1_1x32x1x8_8_1x1_intrawave_v3,1249.32,531.44,0.0
256,5012,3072,3072,ck,0,0,84.2494,a8w8_blockscale_1x128x128_256x128x128x128_16x16_32x32_2x2_8x32x1_8x32x1_1x32x1x8_8_1x1_intrawave_v3,1122.84,660.28,0.0
256,5012,3072,6144,ck,0,0,154.3465,a8w8_blockscale_1x128x128_256x128x128x128_16x16_32x32_2x2_8x32x1_8x32x1_1x32x1x8_8_1x1_intrawave_v3,1225.79,521.31,0.0
256,5031,3072,3072,ck,0,0,86.363,a8w8_blockscale_1x128x128_256x128x128x128_16x16_32x32_2x2_8x32x1_8x32x1_1x32x1x8_8_1x1_intrawave_v3,1099.51,646.14,0.0
256,5033,3072,3072,ck,0,0,85.2164,a8w8_blockscale_1x128x128_256x128x128x128_16x16_32x32_2x2_8x32x1_8x32x1_1x32x1x8_8_1x1_intrawave_v3,1114.75,655.05,0.0
256,5037,3072,6144,ck,0,0,152.0282,a8w8_blockscale_1x128x128_256x128x128x128_16x16_32x32_2x2_8x32x1_8x32x1_1x32x1x8_8_1x1_intrawave_v3,1250.69,531.28,0.0
256,5040,3072,6144,ck,0,0,152.0025,a8w8_blockscale_1x128x128_256x128x128x128_16x16_32x32_2x2_8x32x1_8x32x1_1x32x1x8_8_1x1_intrawave_v3,1251.65,531.61,0.0
256,5073,3072,6144,ck,0,0,153.5925,a8w8_blockscale_1x128x128_256x128x128x128_16x16_32x32_2x2_8x32x1_8x32x1_1x32x1x8_8_1x1_intrawave_v3,1246.8,528.75,0.0
256,5095,3072,6144,ck,0,0,153.3045,a8w8_blockscale_1x128x128_256x128x128x128_16x16_32x32_2x2_8x32x1_8x32x1_1x32x1x8_8_1x1_intrawave_v3,1254.56,531.5,0.0
256,5096,3072,6144,ck,0,0,153.2112,a8w8_blockscale_1x128x128_256x128x128x128_16x16_32x32_2x2_8x32x1_8x32x1_1x32x1x8_8_1x1_intrawave_v3,1255.57,531.91,0.0
256,5120,3072,3072,ck,0,0,82.3091,a8w8_blockscale_1x128x128_256x128x128x128_16x16_32x32_2x2_8x32x1_8x32x1_1x32x1x8_8_1x1_intrawave_v3,1174.07,687.93,0.0
256,5146,3072,6144,ck,0,0,154.9365,a8w8_blockscale_1x128x128_256x128x128x128_16x16_32x32_2x2_8x32x1_8x32x1_1x32x1x8_8_1x1_intrawave_v3,1253.77,529.95,0.0
256,5156,3072,6144,ck,0,0,153.8667,a8w8_blockscale_1x128x128_256x128x128x128_16x16_32x32_2x2_8x32x1_8x32x1_1x32x1x8_8_1x1_intrawave_v3,1264.94,534.43,0.0
256,5157,3072,6144,ck,0,0,152.5323,a8w8_blockscale_1x128x128_256x128x128x128_16x16_32x32_2x2_8x32x1_8x32x1_1x32x1x8_8_1x1_intrawave_v3,1276.26,539.19,0.0
256,5159,3072,6144,ck,0,0,154.1677,a8w8_blockscale_1x128x128_256x128x128x128_16x16_32x32_2x2_8x32x1_8x32x1_1x32x1x8_8_1x1_intrawave_v3,1263.21,533.63,0.0
256,5161,3072,6144,ck,0,0,153.9893,a8w8_blockscale_1x128x128_256x128x128x128_16x16_32x32_2x2_8x32x1_8x32x1_1x32x1x8_8_1x1_intrawave_v3,1265.16,534.41,0.0
256,5163,3072,6144,ck,0,0,155.0353,a8w8_blockscale_1x128x128_256x128x128x128_16x16_32x32_2x2_8x32x1_8x32x1_1x32x1x8_8_1x1_intrawave_v3,1257.11,530.96,0.0
256,5166,3072,6144,ck,0,0,154.3729,a8w8_blockscale_1x128x128_256x128x128x128_16x16_32x32_2x2_8x32x1_8x32x1_1x32x1x8_8_1x1_intrawave_v3,1263.24,533.48,0.0
256,5168,3072,6144,ck,0,0,155.1745,a8w8_blockscale_1x128x128_256x128x128x128_16x16_32x32_2x2_8x32x1_8x32x1_1x32x1x8_8_1x1_intrawave_v3,1257.2,530.88,0.0
256,5174,3072,6144,ck,0,0,153.5193,a8w8_blockscale_1x128x128_256x128x128x128_16x16_32x32_2x2_8x32x1_8x32x1_1x32x1x8_8_1x1_intrawave_v3,1272.23,537.08,0.0
256,5197,3072,6144,ck,0,0,153.0326,a8w8_blockscale_1x128x128_256x128x128x128_16x16_32x32_2x2_8x32x1_8x32x1_1x32x1x8_8_1x1_intrawave_v3,1281.95,540.64,0.0
256,5199,3072,6144,ck,0,0,153.8929,a8w8_blockscale_1x128x128_256x128x128x128_16x16_32x32_2x2_8x32x1_8x32x1_1x32x1x8_8_1x1_intrawave_v3,1275.27,537.77,0.0
256,5201,3072,6144,ck,0,0,156.5541,a8w8_blockscale_1x128x128_256x128x128x128_16x16_32x32_2x2_8x32x1_8x32x1_1x32x1x8_8_1x1_intrawave_v3,1254.08,528.79,0.0
256,5211,3072,6144,ck,0,0,156.1185,a8w8_blockscale_1x128x128_256x128x128x128_16x16_32x32_2x2_8x32x1_8x32x1_1x32x1x8_8_1x1_intrawave_v3,1260.0,531.05,0.0
256,5212,3072,6144,ck,0,0,153.8473,a8w8_blockscale_1x128x128_256x128x128x128_16x16_32x32_2x2_8x32x1_8x32x1_1x32x1x8_8_1x1_intrawave_v3,1278.84,538.97,0.0
256,5214,3072,6144,ck,0,0,154.0457,a8w8_blockscale_1x128x128_256x128x128x128_16x16_32x32_2x2_8x32x1_8x32x1_1x32x1x8_8_1x1_intrawave_v3,1277.69,538.44,0.0
256,5217,3072,6144,ck,0,0,154.4584,a8w8_blockscale_1x128x128_256x128x128x128_16x16_32x32_2x2_8x32x1_8x32x1_1x32x1x8_8_1x1_intrawave_v3,1275.0,537.24,0.0
256,5222,3072,6144,ck,0,0,157.5949,a8w8_blockscale_1x128x128_256x128x128x128_16x16_32x32_2x2_8x32x1_8x32x1_1x32x1x8_8_1x1_intrawave_v3,1250.83,526.94,0.0
256,5223,3072,6144,ck,0,0,154.1485,a8w8_blockscale_1x128x128_256x128x128x128_16x16_32x32_2x2_8x32x1_8x32x1_1x32x1x8_8_1x1_intrawave_v3,1279.04,538.8,0.0
256,5248,3072,6144,ck,0,0,149.7752,a8w8_blockscale_1x128x128_256x128x128x128_16x16_32x32_2x2_8x32x1_8x32x1_1x32x1x8_8_1x1_intrawave_v3,1322.68,556.58,0.0
256,5250,3072,3072,ck,0,0,88.2186,a8w8_blockscale_1x128x128_256x128x128x128_16x16_32x32_2x2_8x32x1_8x32x1_1x32x1x8_8_1x1_intrawave_v3,1123.24,655.43,0.0
256,5255,3072,3072,ck,0,0,89.4667,a8w8_blockscale_1x128x128_256x128x128x128_16x16_32x32_2x2_8x32x1_8x32x1_1x32x1x8_8_1x1_intrawave_v3,1108.62,646.8,0.0
256,5255,3072,6144,ck,0,0,159.2273,a8w8_blockscale_1x128x128_256x128x128x128_16x16_32x32_2x2_8x32x1_8x32x1_1x32x1x8_8_1x1_intrawave_v3,1245.83,524.08,0.0
256,5257,3072,3072,ck,0,0,87.2838,a8w8_blockscale_1x128x128_256x128x128x128_16x16_32x32_2x2_8x32x1_8x32x1_1x32x1x8_8_1x1_intrawave_v3,1136.78,663.19,0.0
256,5261,3072,6144,ck,0,0,157.4337,a8w8_blockscale_1x128x128_256x128x128x128_16x16_32x32_2x2_8x32x1_8x32x1_1x32x1x8_8_1x1_intrawave_v3,1261.46,530.52,0.0
256,5262,3072,6144,ck,0,0,158.6209,a8w8_blockscale_1x128x128_256x128x128x128_16x16_32x32_2x2_8x32x1_8x32x1_1x32x1x8_8_1x1_intrawave_v3,1252.26,526.63,0.0
256,5265,3072,3072,ck,0,0,86.6741,a8w8_blockscale_1x128x128_256x128x128x128_16x16_32x32_2x2_8x32x1_8x32x1_1x32x1x8_8_1x1_intrawave_v3,1146.52,668.71,0.0
256,5266,3072,3072,ck,0,0,85.8654,a8w8_blockscale_1x128x128_256x128x128x128_16x16_32x32_2x2_8x32x1_8x32x1_1x32x1x8_8_1x1_intrawave_v3,1157.54,675.11,0.0
256,5267,3072,6144,ck,0,0,154.0883,a8w8_blockscale_1x128x128_256x128x128x128_16x16_32x32_2x2_8x32x1_8x32x1_1x32x1x8_8_1x1_intrawave_v3,1290.32,542.52,0.0
256,5268,3072,6144,ck,0,0,158.9242,a8w8_blockscale_1x128x128_256x128x128x128_16x16_32x32_2x2_8x32x1_8x32x1_1x32x1x8_8_1x1_intrawave_v3,1251.29,526.08,0.0
256,5269,3072,6144,ck,0,0,155.5809,a8w8_blockscale_1x128x128_256x128x128x128_16x16_32x32_2x2_8x32x1_8x32x1_1x32x1x8_8_1x1_intrawave_v3,1278.42,537.47,0.0
256,5270,3072,3072,ck,0,0,88.4083,a8w8_blockscale_1x128x128_256x128x128x128_16x16_32x32_2x2_8x32x1_8x32x1_1x32x1x8_8_1x1_intrawave_v3,1125.1,656.11,0.0
256,5270,3072,6144,ck,0,0,154.5805,a8w8_blockscale_1x128x128_256x128x128x128_16x16_32x32_2x2_8x32x1_8x32x1_1x32x1x8_8_1x1_intrawave_v3,1286.94,541.03,0.0
256,5272,3072,6144,ck,0,0,155.8869,a8w8_blockscale_1x128x128_256x128x128x128_16x16_32x32_2x2_8x32x1_8x32x1_1x32x1x8_8_1x1_intrawave_v3,1276.64,536.65,0.0
256,5275,3072,6144,ck,0,0,156.2769,a8w8_blockscale_1x128x128_256x128x128x128_16x16_32x32_2x2_8x32x1_8x32x1_1x32x1x8_8_1x1_intrawave_v3,1274.18,535.55,0.0
256,5278,3072,6144,ck,0,0,155.9913,a8w8_blockscale_1x128x128_256x128x128x128_16x16_32x32_2x2_8x32x1_8x32x1_1x32x1x8_8_1x1_intrawave_v3,1277.24,536.76,0.0
256,5280,3072,6144,ck,0,0,155.4837,a8w8_blockscale_1x128x128_256x128x128x128_16x16_32x32_2x2_8x32x1_8x32x1_1x32x1x8_8_1x1_intrawave_v3,1281.89,538.67,0.0
256,5282,3072,3072,ck,0,0,88.4491,a8w8_blockscale_1x128x128_256x128x128x128_16x16_32x32_2x2_8x32x1_8x32x1_1x32x1x8_8_1x1_intrawave_v3,1127.14,657.06,0.0
256,5283,3072,6144,ck,0,0,155.4166,a8w8_blockscale_1x128x128_256x128x128x128_16x16_32x32_2x2_8x32x1_8x32x1_1x32x1x8_8_1x1_intrawave_v3,1283.17,539.14,0.0
256,5285,3072,6144,ck,0,0,154.5689,a8w8_blockscale_1x128x128_256x128x128x128_16x16_32x32_2x2_8x32x1_8x32x1_1x32x1x8_8_1x1_intrawave_v3,1290.7,542.26,0.0
256,5288,3072,6144,ck,0,0,155.4687,a8w8_blockscale_1x128x128_256x128x128x128_16x16_32x32_2x2_8x32x1_8x32x1_1x32x1x8_8_1x1_intrawave_v3,1283.96,539.36,0.0
256,5291,3072,6144,ck,0,0,157.6281,a8w8_blockscale_1x128x128_256x128x128x128_16x16_32x32_2x2_8x32x1_8x32x1_1x32x1x8_8_1x1_intrawave_v3,1267.09,532.2,0.0
256,5293,3072,6144,ck,0,0,157.2789,a8w8_blockscale_1x128x128_256x128x128x128_16x16_32x32_2x2_8x32x1_8x32x1_1x32x1x8_8_1x1_intrawave_v3,1270.38,533.54,0.0
256,5296,3072,6144,ck,0,0,156.6389,a8w8_blockscale_1x128x128_256x128x128x128_16x16_32x32_2x2_8x32x1_8x32x1_1x32x1x8_8_1x1_intrawave_v3,1276.29,535.96,0.0
256,5299,3072,6144,ck,0,0,158.6982,a8w8_blockscale_1x128x128_256x128x128x128_16x16_32x32_2x2_8x32x1_8x32x1_1x32x1x8_8_1x1_intrawave_v3,1260.45,529.23,0.0
256,5301,3072,6144,ck,0,0,153.7681,a8w8_blockscale_1x128x128_256x128x128x128_16x16_32x32_2x2_8x32x1_8x32x1_1x32x1x8_8_1x1_intrawave_v3,1301.35,546.36,0.0
256,5309,3072,3072,ck,0,0,87.8662,a8w8_blockscale_1x128x128_256x128x128x128_16x16_32x32_2x2_8x32x1_8x32x1_1x32x1x8_8_1x1_intrawave_v3,1140.42,664.25,0.0
256,5310,3072,3072,ck,0,0,87.8295,a8w8_blockscale_1x128x128_256x128x128x128_16x16_32x32_2x2_8x32x1_8x32x1_1x32x1x8_8_1x1_intrawave_v3,1141.11,664.63,0.0
256,5313,3072,3072,ck,0,0,86.751,a8w8_blockscale_1x128x128_256x128x128x128_16x16_32x32_2x2_8x32x1_8x32x1_1x32x1x8_8_1x1_intrawave_v3,1155.95,673.21,0.0
256,5314,3072,3072,ck,0,0,87.9906,a8w8_blockscale_1x128x128_256x128x128x128_16x16_32x32_2x2_8x32x1_8x32x1_1x32x1x8_8_1x1_intrawave_v3,1139.88,663.83,0.0
256,5318,3072,3072,ck,0,0,86.855,a8w8_blockscale_1x128x128_256x128x128x128_16x16_32x32_2x2_8x32x1_8x32x1_1x32x1x8_8_1x1_intrawave_v3,1155.65,672.94,0.0
256,5318,3072,6144,ck,0,0,156.1297,a8w8_blockscale_1x128x128_256x128x128x128_16x16_32x32_2x2_8x32x1_8x32x1_1x32x1x8_8_1x1_intrawave_v3,1285.78,539.44,0.0
256,5320,3072,6144,ck,0,0,156.9129,a8w8_blockscale_1x128x128_256x128x128x128_16x16_32x32_2x2_8x32x1_8x32x1_1x32x1x8_8_1x1_intrawave_v3,1279.84,536.9,0.0
256,5324,3072,6144,ck,0,0,154.7987,a8w8_blockscale_1x128x128_256x128x128x128_16x16_32x32_2x2_8x32x1_8x32x1_1x32x1x8_8_1x1_intrawave_v3,1298.29,544.55,0.0
256,5328,3072,6144,ck,0,0,154.6817,a8w8_blockscale_1x128x128_256x128x128x128_16x16_32x32_2x2_8x32x1_8x32x1_1x32x1x8_8_1x1_intrawave_v3,1300.25,545.28,0.0
256,5333,3072,6144,ck,0,0,157.0309,a8w8_blockscale_1x128x128_256x128x128x128_16x16_32x32_2x2_8x32x1_8x32x1_1x32x1x8_8_1x1_intrawave_v3,1282.0,537.51,0.0
256,5339,3072,6144,ck,0,0,156.4907,a8w8_blockscale_1x128x128_256x128x128x128_16x16_32x32_2x2_8x32x1_8x32x1_1x32x1x8_8_1x1_intrawave_v3,1287.88,539.84,0.0
256,5340,3072,6144,ck,0,0,156.6518,a8w8_blockscale_1x128x128_256x128x128x128_16x16_32x32_2x2_8x32x1_8x32x1_1x32x1x8_8_1x1_intrawave_v3,1286.79,539.36,0.0
256,5341,3072,6144,ck,0,0,157.545,a8w8_blockscale_1x128x128_256x128x128x128_16x16_32x32_2x2_8x32x1_8x32x1_1x32x1x8_8_1x1_intrawave_v3,1279.74,536.38,0.0
256,5343,3072,6144,ck,0,0,155.1405,a8w8_blockscale_1x128x128_256x128x128x128_16x16_32x32_2x2_8x32x1_8x32x1_1x32x1x8_8_1x1_intrawave_v3,1300.06,544.86,0.0
256,5344,3072,6144,ck,0,0,154.4897,a8w8_blockscale_1x128x128_256x128x128x128_16x16_32x32_2x2_8x32x1_8x32x1_1x32x1x8_8_1x1_intrawave_v3,1305.78,547.23,0.0
256,5355,3072,3072,ck,0,0,88.7931,a8w8_blockscale_1x128x128_256x128x128x128_16x16_32x32_2x2_8x32x1_8x32x1_1x32x1x8_8_1x1_intrawave_v3,1138.29,662.09,0.0
256,5355,3072,6144,ck,0,0,157.1304,a8w8_blockscale_1x128x128_256x128x128x128_16x16_32x32_2x2_8x32x1_8x32x1_1x32x1x8_8_1x1_intrawave_v3,1286.48,538.89,0.0
256,5356,3072,3072,ck,0,0,88.5307,a8w8_blockscale_1x128x128_256x128x128x128_16x16_32x32_2x2_8x32x1_8x32x1_1x32x1x8_8_1x1_intrawave_v3,1141.88,664.15,0.0
256,5359,3072,3072,ck,0,0,88.5287,a8w8_blockscale_1x128x128_256x128x128x128_16x16_32x32_2x2_8x32x1_8x32x1_1x32x1x8_8_1x1_intrawave_v3,1142.54,664.48,0.0
256,5361,3072,3072,ck,0,0,88.1522,a8w8_blockscale_1x128x128_256x128x128x128_16x16_32x32_2x2_8x32x1_8x32x1_1x32x1x8_8_1x1_intrawave_v3,1147.85,667.53,0.0
256,5364,3072,6144,ck,0,0,155.5997,a8w8_blockscale_1x128x128_256x128x128x128_16x16_32x32_2x2_8x32x1_8x32x1_1x32x1x8_8_1x1_intrawave_v3,1301.31,544.91,0.0
256,5365,3072,3072,ck,0,0,87.0275,a8w8_blockscale_1x128x128_256x128x128x128_16x16_32x32_2x2_8x32x1_8x32x1_1x32x1x8_8_1x1_intrawave_v3,1163.55,676.58,0.0
256,5366,3072,6144,ck,0,0,154.7754,a8w8_blockscale_1x128x128_256x128x128x128_16x16_32x32_2x2_8x32x1_8x32x1_1x32x1x8_8_1x1_intrawave_v3,1308.73,547.97,0.0
256,5369,3072,3072,ck,0,0,87.6435,a8w8_blockscale_1x128x128_256x128x128x128_16x16_32x32_2x2_8x32x1_8x32x1_1x32x1x8_8_1x1_intrawave_v3,1156.23,672.24,0.0
256,5371,3072,6144,ck,0,0,156.4471,a8w8_blockscale_1x128x128_256x128x128x128_16x16_32x32_2x2_8x32x1_8x32x1_1x32x1x8_8_1x1_intrawave_v3,1295.96,542.5,0.0
256,5373,3072,3072,ck,0,0,89.1101,a8w8_blockscale_1x128x128_256x128x128x128_16x16_32x32_2x2_8x32x1_8x32x1_1x32x1x8_8_1x1_intrawave_v3,1138.05,661.59,0.0
256,5391,3072,6144,cktile,11,0,160.9406,a8w8_blockscale_cktile_192x256x128_4x2x1_16x16x128_intrawave_0x1x0_1,1264.46,528.88,0.0
256,5398,3072,3072,cktile,11,0,98.6398,a8w8_blockscale_cktile_192x256x128_4x2x1_16x16x128_intrawave_0x1x0_1,1032.89,600.01,0.0
256,5401,3072,3072,cktile,11,0,97.779,a8w8_blockscale_cktile_192x256x128_4x2x1_16x16x128_intrawave_0x1x0_1,1042.56,605.58,0.0
256,5404,3072,3072,cktile,11,0,98.0674,a8w8_blockscale_cktile_192x256x128_4x2x1_16x16x128_intrawave_0x1x0_1,1040.07,604.08,0.0
256,5406,3072,6144,cktile,11,0,161.1793,a8w8_blockscale_cktile_192x256x128_4x2x1_16x16x128_intrawave_0x1x0_1,1266.1,529.24,0.0
256,5410,3072,6144,cktile,11,0,160.0594,a8w8_blockscale_cktile_192x256x128_4x2x1_16x16x128_intrawave_0x1x0_1,1275.91,533.25,0.0
256,5411,3072,6144,cktile,11,0,161.3735,a8w8_blockscale_cktile_192x256x128_4x2x1_16x16x128_intrawave_0x1x0_1,1265.75,528.99,0.0
256,5412,3072,6144,cktile,11,0,161.0978,a8w8_blockscale_cktile_192x256x128_4x2x1_16x16x128_intrawave_0x1x0_1,1268.15,529.97,0.0
256,5413,3072,3072,cktile,11,0,98.0271,a8w8_blockscale_cktile_192x256x128_4x2x1_16x16x128_intrawave_0x1x0_1,1042.23,605.17,0.0
256,5429,3072,6144,cktile,11,0,161.3119,a8w8_blockscale_cktile_192x256x128_4x2x1_16x16x128_intrawave_0x1x0_1,1270.44,530.56,0.0
256,5443,3072,3072,cktile,11,0,98.7297,a8w8_blockscale_cktile_192x256x128_4x2x1_16x16x128_intrawave_0x1x0_1,1040.55,603.67,0.0
256,5444,3072,3072,cktile,11,0,97.8304,a8w8_blockscale_cktile_192x256x128_4x2x1_16x16x128_intrawave_0x1x0_1,1050.31,609.31,0.0
256,5446,3072,3072,cktile,11,0,97.5945,a8w8_blockscale_cktile_192x256x128_4x2x1_16x16x128_intrawave_0x1x0_1,1053.23,610.97,0.0
256,5449,3072,3072,cktile,11,0,98.6059,a8w8_blockscale_cktile_192x256x128_4x2x1_16x16x128_intrawave_0x1x0_1,1043.0,604.99,0.0
256,5450,3072,3072,cktile,11,0,98.1688,a8w8_blockscale_cktile_192x256x128_4x2x1_16x16x128_intrawave_0x1x0_1,1047.84,607.77,0.0
256,5454,3072,3072,cktile,11,0,98.5363,a8w8_blockscale_cktile_192x256x128_4x2x1_16x16x128_intrawave_0x1x0_1,1044.7,605.88,0.0
256,5489,3072,3072,cktile,11,0,98.0071,a8w8_blockscale_cktile_192x256x128_4x2x1_16x16x128_intrawave_0x1x0_1,1057.08,612.44,0.0
256,5491,3072,3072,cktile,11,0,97.9713,a8w8_blockscale_cktile_192x256x128_4x2x1_16x16x128_intrawave_0x1x0_1,1057.85,612.86,0.0
256,5492,3072,3072,cktile,11,0,98.4096,a8w8_blockscale_cktile_192x256x128_4x2x1_16x16x128_intrawave_0x1x0_1,1053.33,610.22,0.0
256,5494,3072,3072,cktile,11,0,98.0124,a8w8_blockscale_cktile_192x256x128_4x2x1_16x16x128_intrawave_0x1x0_1,1057.99,612.88,0.0
256,5495,3072,3072,cktile,11,0,98.3629,a8w8_blockscale_cktile_192x256x128_4x2x1_16x16x128_intrawave_0x1x0_1,1054.41,610.79,0.0
256,5496,3072,3072,cktile,11,0,98.3883,a8w8_blockscale_cktile_192x256x128_4x2x1_16x16x128_intrawave_0x1x0_1,1054.33,610.73,0.0
256,5499,3072,3072,cktile,11,0,98.0166,a8w8_blockscale_cktile_192x256x128_4x2x1_16x16x128_intrawave_0x1x0_1,1058.9,613.32,0.0
256,5500,3072,3072,cktile,11,0,98.3756,a8w8_blockscale_cktile_192x256x128_4x2x1_16x16x128_intrawave_0x1x0_1,1055.23,611.18,0.0
256,5535,3072,3072,cktile,11,0,97.551,a8w8_blockscale_cktile_192x256x128_4x2x1_16x16x128_intrawave_0x1x0_1,1070.92,619.65,0.0
256,5538,3072,3072,cktile,11,0,98.2626,a8w8_blockscale_cktile_192x256x128_4x2x1_16x16x128_intrawave_0x1x0_1,1063.74,615.45,0.0
256,5539,3072,3072,cktile,11,0,98.3275,a8w8_blockscale_cktile_192x256x128_4x2x1_16x16x128_intrawave_0x1x0_1,1063.23,615.13,0.0
256,5541,3072,3072,cktile,11,0,98.2368,a8w8_blockscale_cktile_192x256x128_4x2x1_16x16x128_intrawave_0x1x0_1,1064.6,615.89,0.0
256,5542,3072,3072,cktile,11,0,98.3116,a8w8_blockscale_cktile_192x256x128_4x2x1_16x16x128_intrawave_0x1x0_1,1063.98,615.51,0.0
256,5543,3072,3072,cktile,11,0,98.4858,a8w8_blockscale_cktile_192x256x128_4x2x1_16x16x128_intrawave_0x1x0_1,1062.29,614.52,0.0
256,5545,3072,3072,cktile,11,0,98.5527,a8w8_blockscale_cktile_192x256x128_4x2x1_16x16x128_intrawave_0x1x0_1,1061.95,614.29,0.0
256,5546,3072,3072,cktile,11,0,98.2969,a8w8_blockscale_cktile_192x256x128_4x2x1_16x16x128_intrawave_0x1x0_1,1064.91,615.98,0.0
256,5549,3072,3072,cktile,11,0,98.5908,a8w8_blockscale_cktile_192x256x128_4x2x1_16x16x128_intrawave_0x1x0_1,1062.31,614.43,0.0
256,5552,3072,3072,cktile,11,0,97.8645,a8w8_blockscale_cktile_192x256x128_4x2x1_16x16x128_intrawave_0x1x0_1,1070.77,619.27,0.0
256,5573,3072,3072,cktile,11,0,98.6031,a8w8_blockscale_cktile_192x256x128_4x2x1_16x16x128_intrawave_0x1x0_1,1066.77,616.59,0.0
256,5593,3072,3072,cktile,11,0,98.2508,a8w8_blockscale_cktile_192x256x128_4x2x1_16x16x128_intrawave_0x1x0_1,1074.44,620.68,0.0
256,5597,3072,3072,cktile,11,0,98.3974,a8w8_blockscale_cktile_192x256x128_4x2x1_16x16x128_intrawave_0x1x0_1,1073.6,620.13,0.0
256,5600,3072,3072,cktile,11,0,98.1667,a8w8_blockscale_cktile_192x256x128_4x2x1_16x16x128_intrawave_0x1x0_1,1076.7,621.87,0.0
256,5619,3072,3072,cktile,11,0,98.5411,a8w8_blockscale_cktile_192x256x128_4x2x1_16x16x128_intrawave_0x1x0_1,1076.25,621.28,0.0
256,5661,3072,3072,cktile,11,0,99.1033,a8w8_blockscale_cktile_192x256x128_4x2x1_16x16x128_intrawave_0x1x0_1,1078.15,621.66,0.0
256,5666,3072,3072,cktile,11,0,98.5569,a8w8_blockscale_cktile_192x256x128_4x2x1_16x16x128_intrawave_0x1x0_1,1085.08,625.58,0.0
256,5669,3072,3072,cktile,11,0,98.2845,a8w8_blockscale_cktile_192x256x128_4x2x1_16x16x128_intrawave_0x1x0_1,1088.66,627.59,0.0
256,5672,3072,3072,cktile,11,0,98.3928,a8w8_blockscale_cktile_192x256x128_4x2x1_16x16x128_intrawave_0x1x0_1,1088.04,627.18,0.0
256,5675,3072,3072,cktile,11,0,98.7796,a8w8_blockscale_cktile_192x256x128_4x2x1_16x16x128_intrawave_0x1x0_1,1084.35,625.01,0.0
256,5676,3072,3072,cktile,11,0,97.9448,a8w8_blockscale_cktile_192x256x128_4x2x1_16x16x128_intrawave_0x1x0_1,1093.79,630.43,0.0
256,5681,3072,3072,cktile,11,0,98.8752,a8w8_blockscale_cktile_192x256x128_4x2x1_16x16x128_intrawave_0x1x0_1,1084.45,624.96,0.0
256,5682,3072,3072,cktile,11,0,99.1507,a8w8_blockscale_cktile_192x256x128_4x2x1_16x16x128_intrawave_0x1x0_1,1081.63,623.32,0.0
256,6001,3072,3072,cktile,11,0,99.9548,a8w8_blockscale_cktile_192x256x128_4x2x1_16x16x128_intrawave_0x1x0_1,1133.16,647.72,0.0
256,6001,3072,6144,cktile,11,0,162.7297,a8w8_blockscale_cktile_192x256x128_4x2x1_16x16x128_intrawave_0x1x0_1,1392.06,569.13,0.0
256,6004,3072,3072,cktile,11,0,99.7544,a8w8_blockscale_cktile_192x256x128_4x2x1_16x16x128_intrawave_0x1x0_1,1136.01,649.3,0.0
256,6006,3072,3072,cktile,11,0,99.1586,a8w8_blockscale_cktile_192x256x128_4x2x1_16x16x128_intrawave_0x1x0_1,1143.21,653.38,0.0
256,6039,3072,3072,cktile,11,0,99.1261,a8w8_blockscale_cktile_192x256x128_4x2x1_16x16x128_intrawave_0x1x0_1,1149.87,656.66,0.0
256,6111,3072,3072,cktile,11,0,99.2345,a8w8_blockscale_cktile_192x256x128_4x2x1_16x16x128_intrawave_0x1x0_1,1162.31,662.63,0.0
256,6376,3072,3072,cktile,11,0,100.9326,a8w8_blockscale_cktile_192x256x128_4x2x1_16x16x128_intrawave_0x1x0_1,1192.31,675.68,0.0
256,6407,3072,3072,cktile,11,0,100.4613,a8w8_blockscale_cktile_192x256x128_4x2x1_16x16x128_intrawave_0x1x0_1,1203.73,681.7,0.0
256,6474,3072,3072,cktile,11,0,100.8774,a8w8_blockscale_cktile_192x256x128_4x2x1_16x16x128_intrawave_0x1x0_1,1211.3,685.01,0.0
256,6702,3072,6144,cktile,11,0,165.028,a8w8_blockscale_cktile_192x256x128_4x2x1_16x16x128_intrawave_0x1x0_1,1533.02,613.4,0.0
256,6792,3072,6144,cktile,11,0,166.4211,a8w8_blockscale_cktile_192x256x128_4x2x1_16x16x128_intrawave_0x1x0_1,1540.61,614.91,0.0
256,6830,3072,6144,cktile,11,0,165.7912,a8w8_blockscale_cktile_192x256x128_4x2x1_16x16x128_intrawave_0x1x0_1,1555.11,620.07,0.0
256,7001,3072,3072,cktile,11,0,101.0115,a8w8_blockscale_cktile_192x256x128_4x2x1_16x16x128_intrawave_0x1x0_1,1308.16,732.18,0.0
256,7001,3072,6144,cktile,11,0,167.9399,a8w8_blockscale_cktile_192x256x128_4x2x1_16x16x128_intrawave_0x1x0_1,1573.65,624.64,0.0
256,7787,3072,6144,cktile,11,0,169.7159,a8w8_blockscale_cktile_192x256x128_4x2x1_16x16x128_intrawave_0x1x0_1,1732.01,675.02,0.0
256,8004,3072,6144,cktile,11,0,171.2961,a8w8_blockscale_cktile_192x256x128_4x2x1_16x16x128_intrawave_0x1x0_1,1763.85,684.36,0.0
256,8626,3072,6144,cktile,11,0,237.2792,a8w8_blockscale_cktile_192x256x128_4x2x1_16x16x128_intrawave_0x1x0_1,1372.31,526.26,0.0
256,8643,3072,6144,cktile,11,0,238.4982,a8w8_blockscale_cktile_192x256x128_4x2x1_16x16x128_intrawave_0x1x0_1,1367.99,524.45,0.0
256,8644,3072,6144,cktile,11,0,238.4966,a8w8_blockscale_cktile_192x256x128_4x2x1_16x16x128_intrawave_0x1x0_1,1368.15,524.5,0.0
256,8681,3072,6144,cktile,11,0,238.4568,a8w8_blockscale_cktile_192x256x128_4x2x1_16x16x128_intrawave_0x1x0_1,1374.24,526.5,0.0
256,8741,3072,6144,cktile,11,0,237.5429,a8w8_blockscale_cktile_192x256x128_4x2x1_16x16x128_intrawave_0x1x0_1,1389.06,531.63,0.0
256,8744,3072,6144,cktile,11,0,238.5309,a8w8_blockscale_cktile_192x256x128_4x2x1_16x16x128_intrawave_0x1x0_1,1383.78,529.58,0.0
256,8761,3072,6144,cktile,11,0,240.114,a8w8_blockscale_cktile_192x256x128_4x2x1_16x16x128_intrawave_0x1x0_1,1377.33,526.96,0.0
256,8953,3072,3072,ck,0,0,142.3394,a8w8_blockscale_1x128x128_256x128x128x128_16x16_32x32_2x2_8x32x1_8x32x1_1x32x1x8_8_1x1_intrawave_v3,1187.18,645.98,0.0
256,8955,3072,6144,cktile,11,0,238.0214,a8w8_blockscale_cktile_192x256x128_4x2x1_16x16x128_intrawave_0x1x0_1,1420.21,541.6,0.0
256,8965,3072,6144,cktile,11,0,237.634,a8w8_blockscale_cktile_192x256x128_4x2x1_16x16x128_intrawave_0x1x0_1,1424.11,543.0,0.0
256,8979,3072,6144,cktile,11,0,237.0323,a8w8_blockscale_cktile_192x256x128_4x2x1_16x16x128_intrawave_0x1x0_1,1429.96,545.11,0.0
256,8987,3072,3072,ck,0,0,140.5792,a8w8_blockscale_1x128x128_256x128x128x128_16x16_32x32_2x2_8x32x1_8x32x1_1x32x1x8_8_1x1_intrawave_v3,1206.61,656.29,0.0
256,9003,3072,6144,cktile,11,0,238.5555,a8w8_blockscale_cktile_192x256x128_4x2x1_16x16x128_intrawave_0x1x0_1,1424.62,542.86,0.0
256,9006,3072,6144,cktile,11,0,239.656,a8w8_blockscale_cktile_192x256x128_4x2x1_16x16x128_intrawave_0x1x0_1,1418.55,540.53,0.0
256,9020,3072,6144,cktile,11,0,239.813,a8w8_blockscale_cktile_192x256x128_4x2x1_16x16x128_intrawave_0x1x0_1,1419.83,540.89,0.0
256,9022,3072,6144,cktile,11,0,238.9271,a8w8_blockscale_cktile_192x256x128_4x2x1_16x16x128_intrawave_0x1x0_1,1425.41,543.0,0.0
256,9028,3072,6144,cktile,11,0,239.9714,a8w8_blockscale_cktile_192x256x128_4x2x1_16x16x128_intrawave_0x1x0_1,1420.15,540.94,0.0
256,9051,3072,6144,cktile,11,0,240.1265,a8w8_blockscale_cktile_192x256x128_4x2x1_16x16x128_intrawave_0x1x0_1,1422.85,541.77,0.0
256,9471,3072,3072,cktile,11,0,145.1335,a8w8_blockscale_cktile_192x256x128_4x2x1_16x16x128_intrawave_0x1x0_1,1231.69,666.43,0.0
256,9479,3072,3072,cktile,11,0,146.1322,a8w8_blockscale_cktile_192x256x128_4x2x1_16x16x128_intrawave_0x1x0_1,1224.3,662.38,0.0
256,9479,3072,6144,cktile,11,0,239.3664,a8w8_blockscale_cktile_192x256x128_4x2x1_16x16x128_intrawave_0x1x0_1,1494.86,565.46,0.0
256,9496,3072,6144,cktile,11,0,242.1847,a8w8_blockscale_cktile_192x256x128_4x2x1_16x16x128_intrawave_0x1x0_1,1480.12,559.74,0.0
256,9529,3072,6144,cktile,11,0,240.3573,a8w8_blockscale_cktile_192x256x128_4x2x1_16x16x128_intrawave_0x1x0_1,1496.55,565.69,0.0
256,9891,3072,3072,cktile,11,0,147.9856,a8w8_blockscale_cktile_192x256x128_4x2x1_16x16x128_intrawave_0x1x0_1,1261.52,679.75,0.0
256,10000,3072,3072,cktile,11,0,145.7603,a8w8_blockscale_cktile_192x256x128_4x2x1_16x16x128_intrawave_0x1x0_1,1294.89,697.02,0.0
256,10000,3072,6144,cktile,11,0,243.9029,a8w8_blockscale_cktile_192x256x128_4x2x1_16x16x128_intrawave_0x1x0_1,1547.7,581.19,0.0
256,10001,3072,3072,cktile,11,0,147.0725,a8w8_blockscale_cktile_192x256x128_4x2x1_16x16x128_intrawave_0x1x0_1,1283.47,690.86,0.0
256,10002,3072,3072,cktile,11,0,145.8582,a8w8_blockscale_cktile_192x256x128_4x2x1_16x16x128_intrawave_0x1x0_1,1294.28,696.67,0.0
256,10002,3072,6144,cktile,11,0,240.9592,a8w8_blockscale_cktile_192x256x128_4x2x1_16x16x128_intrawave_0x1x0_1,1566.92,588.39,0.0
256,10003,3072,6144,cktile,11,0,243.6433,a8w8_blockscale_cktile_192x256x128_4x2x1_16x16x128_intrawave_0x1x0_1,1549.81,581.96,0.0
256,10012,3072,3072,cktile,11,0,146.8225,a8w8_blockscale_cktile_192x256x128_4x2x1_16x16x128_intrawave_0x1x0_1,1287.07,692.73,0.0
256,10012,3072,6144,cktile,11,0,240.7452,a8w8_blockscale_cktile_192x256x128_4x2x1_16x16x128_intrawave_0x1x0_1,1569.88,589.43,0.0
256,10014,3072,6144,cktile,11,0,242.1842,a8w8_blockscale_cktile_192x256x128_4x2x1_16x16x128_intrawave_0x1x0_1,1560.86,586.03,0.0
256,10017,3072,6144,cktile,11,0,239.6844,a8w8_blockscale_cktile_192x256x128_4x2x1_16x16x128_intrawave_0x1x0_1,1577.61,592.29,0.0
256,10018,3072,6144,cktile,11,0,243.8882,a8w8_blockscale_cktile_192x256x128_4x2x1_16x16x128_intrawave_0x1x0_1,1550.57,582.13,0.0
256,10019,3072,6144,cktile,11,0,240.1083,a8w8_blockscale_cktile_192x256x128_4x2x1_16x16x128_intrawave_0x1x0_1,1575.14,591.35,0.0
256,10036,3072,6144,cktile,11,0,243.7358,a8w8_blockscale_cktile_192x256x128_4x2x1_16x16x128_intrawave_0x1x0_1,1554.33,583.41,0.0
256,10051,3072,3072,cktile,11,0,147.5775,a8w8_blockscale_cktile_192x256x128_4x2x1_16x16x128_intrawave_0x1x0_1,1285.47,691.62,0.0
256,10062,3072,3072,cktile,11,0,145.7738,a8w8_blockscale_cktile_192x256x128_4x2x1_16x16x128_intrawave_0x1x0_1,1302.8,700.87,0.0
256,10080,3072,6144,cktile,11,0,241.6704,a8w8_blockscale_cktile_192x256x128_4x2x1_16x16x128_intrawave_0x1x0_1,1574.49,590.63,0.0
256,10095,3072,6144,cktile,11,0,243.4395,a8w8_blockscale_cktile_192x256x128_4x2x1_16x16x128_intrawave_0x1x0_1,1565.37,587.09,0.0
256,10114,3072,3072,cktile,11,0,149.2652,a8w8_blockscale_cktile_192x256x128_4x2x1_16x16x128_intrawave_0x1x0_1,1278.9,687.69,0.0
256,10127,3072,3072,cktile,11,0,147.1464,a8w8_blockscale_cktile_192x256x128_4x2x1_16x16x128_intrawave_0x1x0_1,1298.98,698.4,0.0
256,10132,3072,3072,cktile,11,0,147.3727,a8w8_blockscale_cktile_192x256x128_4x2x1_16x16x128_intrawave_0x1x0_1,1297.63,697.64,0.0
256,10159,3072,6144,cktile,11,0,243.7038,a8w8_blockscale_cktile_192x256x128_4x2x1_16x16x128_intrawave_0x1x0_1,1573.59,589.68,0.0
256,10160,3072,3072,cktile,11,0,146.6016,a8w8_blockscale_cktile_192x256x128_4x2x1_16x16x128_intrawave_0x1x0_1,1308.06,703.07,0.0
256,10165,3072,6144,cktile,11,0,241.8978,a8w8_blockscale_cktile_192x256x128_4x2x1_16x16x128_intrawave_0x1x0_1,1586.27,594.39,0.0
256,10168,3072,3072,cktile,11,0,147.5595,a8w8_blockscale_cktile_192x256x128_4x2x1_16x16x128_intrawave_0x1x0_1,1300.59,699.01,0.0
256,10169,3072,3072,cktile,11,0,147.3221,a8w8_blockscale_cktile_192x256x128_4x2x1_16x16x128_intrawave_0x1x0_1,1302.82,700.2,0.0
256,10176,3072,6144,cktile,11,0,241.0376,a8w8_blockscale_cktile_192x256x128_4x2x1_16x16x128_intrawave_0x1x0_1,1593.66,597.07,0.0
256,10186,3072,3072,cktile,11,0,146.9804,a8w8_blockscale_cktile_192x256x128_4x2x1_16x16x128_intrawave_0x1x0_1,1308.03,702.89,0.0
256,10186,3072,6144,cktile,11,0,242.7584,a8w8_blockscale_cktile_192x256x128_4x2x1_16x16x128_intrawave_0x1x0_1,1583.91,593.35,0.0
256,10187,3072,3072,cktile,11,0,148.0069,a8w8_blockscale_cktile_192x256x128_4x2x1_16x16x128_intrawave_0x1x0_1,1299.08,698.08,0.0
256,10188,3072,3072,cktile,11,0,147.4799,a8w8_blockscale_cktile_192x256x128_4x2x1_16x16x128_intrawave_0x1x0_1,1303.85,700.64,0.0
256,10195,3072,6144,cktile,11,0,242.3665,a8w8_blockscale_cktile_192x256x128_4x2x1_16x16x128_intrawave_0x1x0_1,1587.88,594.76,0.0
256,10197,3072,3072,cktile,11,0,147.6663,a8w8_blockscale_cktile_192x256x128_4x2x1_16x16x128_intrawave_0x1x0_1,1303.36,700.31,0.0
256,10197,3072,6144,cktile,11,0,242.3065,a8w8_blockscale_cktile_192x256x128_4x2x1_16x16x128_intrawave_0x1x0_1,1588.58,595.01,0.0
256,10200,3072,3072,cktile,11,0,148.1967,a8w8_blockscale_cktile_192x256x128_4x2x1_16x16x128_intrawave_0x1x0_1,1299.07,697.99,0.0
256,10206,3072,6144,cktile,11,0,240.9129,a8w8_blockscale_cktile_192x256x128_4x2x1_16x16x128_intrawave_0x1x0_1,1599.18,598.91,0.0
256,10225,3072,3072,cktile,11,0,147.1547,a8w8_blockscale_cktile_192x256x128_4x2x1_16x16x128_intrawave_0x1x0_1,1311.48,704.5,0.0
256,10230,3072,3072,cktile,11,0,147.0879,a8w8_blockscale_cktile_192x256x128_4x2x1_16x16x128_intrawave_0x1x0_1,1312.72,705.14,0.0
256,10233,3072,6144,cktile,11,0,240.7263,a8w8_blockscale_cktile_192x256x128_4x2x1_16x16x128_intrawave_0x1x0_1,1604.66,600.75,0.0
256,10238,3072,3072,cktile,11,0,147.5653,a8w8_blockscale_cktile_192x256x128_4x2x1_16x16x128_intrawave_0x1x0_1,1309.49,703.35,0.0
256,10239,3072,3072,cktile,11,0,146.7695,a8w8_blockscale_cktile_192x256x128_4x2x1_16x16x128_intrawave_0x1x0_1,1316.72,707.23,0.0
256,10240,3072,3072,cktile,11,0,146.3891,a8w8_blockscale_cktile_192x256x128_4x2x1_16x16x128_intrawave_0x1x0_1,1320.27,709.13,0.0
256,10245,3072,3072,cktile,11,0,146.2264,a8w8_blockscale_cktile_192x256x128_4x2x1_16x16x128_intrawave_0x1x0_1,1322.39,710.23,0.0
256,10246,3072,3072,cktile,11,0,146.2003,a8w8_blockscale_cktile_192x256x128_4x2x1_16x16x128_intrawave_0x1x0_1,1322.75,710.42,0.0
256,10247,3072,3072,cktile,11,0,146.6974,a8w8_blockscale_cktile_192x256x128_4x2x1_16x16x128_intrawave_0x1x0_1,1318.4,708.08,0.0
256,10249,3072,3072,cktile,11,0,147.2935,a8w8_blockscale_cktile_192x256x128_4x2x1_16x16x128_intrawave_0x1x0_1,1313.32,705.34,0.0
256,10254,3072,3072,cktile,11,0,146.3449,a8w8_blockscale_cktile_192x256x128_4x2x1_16x16x128_intrawave_0x1x0_1,1322.48,710.23,0.0
256,10256,3072,3072,cktile,11,0,146.9676,a8w8_blockscale_cktile_192x256x128_4x2x1_16x16x128_intrawave_0x1x0_1,1317.13,707.34,0.0
256,10262,3072,3072,cktile,11,0,148.584,a8w8_blockscale_cktile_192x256x128_4x2x1_16x16x128_intrawave_0x1x0_1,1303.56,700.02,0.0
256,10277,3072,3072,cktile,11,0,145.9415,a8w8_blockscale_cktile_192x256x128_4x2x1_16x16x128_intrawave_0x1x0_1,1329.11,713.64,0.0
256,10278,3072,6144,cktile,11,0,242.5333,a8w8_blockscale_cktile_192x256x128_4x2x1_16x16x128_intrawave_0x1x0_1,1599.7,598.56,0.0
256,10279,3072,6144,cktile,11,0,242.565,a8w8_blockscale_cktile_192x256x128_4x2x1_16x16x128_intrawave_0x1x0_1,1599.65,598.53,0.0
256,10280,3072,6144,cktile,11,0,241.8704,a8w8_blockscale_cktile_192x256x128_4x2x1_16x16x128_intrawave_0x1x0_1,1604.4,600.3,0.0
256,10283,3072,3072,cktile,11,0,147.031,a8w8_blockscale_cktile_192x256x128_4x2x1_16x16x128_intrawave_0x1x0_1,1320.03,708.73,0.0
256,10293,3072,3072,cktile,11,0,147.5187,a8w8_blockscale_cktile_192x256x128_4x2x1_16x16x128_intrawave_0x1x0_1,1316.94,707.01,0.0
256,10296,3072,3072,cktile,11,0,147.348,a8w8_blockscale_cktile_192x256x128_4x2x1_16x16x128_intrawave_0x1x0_1,1318.85,708.02,0.0
256,10298,3072,3072,cktile,11,0,148.1503,a8w8_blockscale_cktile_192x256x128_4x2x1_16x16x128_intrawave_0x1x0_1,1311.97,704.31,0.0
256,10300,3072,6144,cktile,11,0,242.0181,a8w8_blockscale_cktile_192x256x128_4x2x1_16x16x128_intrawave_0x1x0_1,1606.54,600.95,0.0
256,10304,3072,3072,cktile,11,0,147.9708,a8w8_blockscale_cktile_192x256x128_4x2x1_16x16x128_intrawave_0x1x0_1,1314.32,705.54,0.0
256,10306,3072,6144,cktile,11,0,242.4556,a8w8_blockscale_cktile_192x256x128_4x2x1_16x16x128_intrawave_0x1x0_1,1604.58,600.17,0.0
256,10307,3072,3072,cktile,11,0,147.5587,a8w8_blockscale_cktile_192x256x128_4x2x1_16x16x128_intrawave_0x1x0_1,1318.38,707.69,0.0
256,10313,3072,3072,cktile,11,0,147.5416,a8w8_blockscale_cktile_192x256x128_4x2x1_16x16x128_intrawave_0x1x0_1,1319.3,708.15,0.0
256,10333,3072,3072,cktile,11,0,147.5708,a8w8_blockscale_cktile_192x256x128_4x2x1_16x16x128_intrawave_0x1x0_1,1321.6,709.26,0.0
256,10344,3072,3072,cktile,11,0,147.3869,a8w8_blockscale_cktile_192x256x128_4x2x1_16x16x128_intrawave_0x1x0_1,1324.65,710.83,0.0
256,10348,3072,3072,cktile,11,0,146.5365,a8w8_blockscale_cktile_192x256x128_4x2x1_16x16x128_intrawave_0x1x0_1,1332.86,715.21,0.0
256,10349,3072,3072,cktile,11,0,146.8266,a8w8_blockscale_cktile_192x256x128_4x2x1_16x16x128_intrawave_0x1x0_1,1330.35,713.86,0.0
256,10355,3072,3072,cktile,11,0,148.2577,a8w8_blockscale_cktile_192x256x128_4x2x1_16x16x128_intrawave_0x1x0_1,1318.27,707.34,0.0
256,10357,3072,3072,cktile,11,0,147.309,a8w8_blockscale_cktile_192x256x128_4x2x1_16x16x128_intrawave_0x1x0_1,1327.02,712.02,0.0
256,10359,3072,3072,cktile,11,0,148.0739,a8w8_blockscale_cktile_192x256x128_4x2x1_16x16x128_intrawave_0x1x0_1,1320.42,708.47,0.0
256,10360,3072,3072,cktile,11,0,148.4291,a8w8_blockscale_cktile_192x256x128_4x2x1_16x16x128_intrawave_0x1x0_1,1317.39,706.84,0.0
256,10363,3072,3072,cktile,11,0,148.0892,a8w8_blockscale_cktile_192x256x128_4x2x1_16x16x128_intrawave_0x1x0_1,1320.79,708.64,0.0
256,10366,3072,3072,cktile,11,0,147.7303,a8w8_blockscale_cktile_192x256x128_4x2x1_16x16x128_intrawave_0x1x0_1,1324.38,710.55,0.0
256,10367,3072,3072,cktile,11,0,147.3154,a8w8_blockscale_cktile_192x256x128_4x2x1_16x16x128_intrawave_0x1x0_1,1328.24,712.62,0.0
256,10369,3072,6144,cktile,11,0,241.6275,a8w8_blockscale_cktile_192x256x128_4x2x1_16x16x128_intrawave_0x1x0_1,1619.92,605.43,0.0
256,10370,3072,3072,cktile,11,0,147.482,a8w8_blockscale_cktile_192x256x128_4x2x1_16x16x128_intrawave_0x1x0_1,1327.13,712.0,0.0
256,10371,3072,6144,cktile,11,0,242.1629,a8w8_blockscale_cktile_192x256x128_4x2x1_16x16x128_intrawave_0x1x0_1,1616.65,604.19,0.0
256,10380,3072,6144,cktile,11,0,241.5633,a8w8_blockscale_cktile_192x256x128_4x2x1_16x16x128_intrawave_0x1x0_1,1622.07,606.15,0.0
256,10384,3072,3072,cktile,11,0,148.3763,a8w8_blockscale_cktile_192x256x128_4x2x1_16x16x128_intrawave_0x1x0_1,1320.91,708.58,0.0
256,10391,3072,3072,cktile,11,0,147.8816,a8w8_blockscale_cktile_192x256x128_4x2x1_16x16x128_intrawave_0x1x0_1,1326.22,711.38,0.0
256,10399,3072,3072,cktile,11,0,147.2982,a8w8_blockscale_cktile_192x256x128_4x2x1_16x16x128_intrawave_0x1x0_1,1332.5,714.7,0.0
256,10406,3072,3072,cktile,11,0,147.9804,a8w8_blockscale_cktile_192x256x128_4x2x1_16x16x128_intrawave_0x1x0_1,1327.25,711.84,0.0
256,10411,3072,3072,cktile,11,0,146.731,a8w8_blockscale_cktile_192x256x128_4x2x1_16x16x128_intrawave_0x1x0_1,1339.19,718.22,0.0
256,10413,3072,3072,cktile,11,0,147.9033,a8w8_blockscale_cktile_192x256x128_4x2x1_16x16x128_intrawave_0x1x0_1,1328.83,712.65,0.0
256,10415,3072,3072,cktile,11,0,147.3701,a8w8_blockscale_cktile_192x256x128_4x2x1_16x16x128_intrawave_0x1x0_1,1333.9,715.35,0.0
256,10416,3072,3072,cktile,11,0,147.4643,a8w8_blockscale_cktile_192x256x128_4x2x1_16x16x128_intrawave_0x1x0_1,1333.17,714.96,0.0
256,10418,3072,3072,cktile,11,0,146.7296,a8w8_blockscale_cktile_192x256x128_4x2x1_16x16x128_intrawave_0x1x0_1,1340.11,718.67,0.0
256,10419,3072,3072,cktile,11,0,147.3111,a8w8_blockscale_cktile_192x256x128_4x2x1_16x16x128_intrawave_0x1x0_1,1334.94,715.89,0.0
256,10422,3072,3072,cktile,11,0,147.7663,a8w8_blockscale_cktile_192x256x128_4x2x1_16x16x128_intrawave_0x1x0_1,1331.21,713.87,0.0
256,10434,3072,3072,cktile,11,0,148.1393,a8w8_blockscale_cktile_192x256x128_4x2x1_16x16x128_intrawave_0x1x0_1,1329.39,712.82,0.0
256,10440,3072,3072,cktile,11,0,147.17,a8w8_blockscale_cktile_192x256x128_4x2x1_16x16x128_intrawave_0x1x0_1,1338.92,717.89,0.0
256,10444,3072,3072,cktile,11,0,147.4622,a8w8_blockscale_cktile_192x256x128_4x2x1_16x16x128_intrawave_0x1x0_1,1336.78,716.72,0.0
256,10450,3072,6144,cktile,11,0,244.0864,a8w8_blockscale_cktile_192x256x128_4x2x1_16x16x128_intrawave_0x1x0_1,1616.13,603.41,0.0
256,10451,3072,6144,cktile,11,0,242.8034,a8w8_blockscale_cktile_192x256x128_4x2x1_16x16x128_intrawave_0x1x0_1,1624.82,606.65,0.0
256,10459,3072,3072,cktile,11,0,146.9518,a8w8_blockscale_cktile_192x256x128_4x2x1_16x16x128_intrawave_0x1x0_1,1343.35,720.15,0.0
256,10461,3072,3072,cktile,11,0,146.8187,a8w8_blockscale_cktile_192x256x128_4x2x1_16x16x128_intrawave_0x1x0_1,1344.82,720.93,0.0
256,10468,3072,3072,cktile,11,0,147.3247,a8w8_blockscale_cktile_192x256x128_4x2x1_16x16x128_intrawave_0x1x0_1,1341.1,718.89,0.0
256,10473,3072,3072,cktile,11,0,147.5296,a8w8_blockscale_cktile_192x256x128_4x2x1_16x16x128_intrawave_0x1x0_1,1339.88,718.2,0.0
256,10474,3072,3072,cktile,11,0,148.0583,a8w8_blockscale_cktile_192x256x128_4x2x1_16x16x128_intrawave_0x1x0_1,1335.22,715.7,0.0
256,10476,3072,3072,cktile,11,0,147.9979,a8w8_blockscale_cktile_192x256x128_4x2x1_16x16x128_intrawave_0x1x0_1,1336.02,716.12,0.0
256,10480,3072,3072,cktile,11,0,147.3785,a8w8_blockscale_cktile_192x256x128_4x2x1_16x16x128_intrawave_0x1x0_1,1342.15,719.38,0.0
256,10480,3072,6144,cktile,11,0,244.6026,a8w8_blockscale_cktile_192x256x128_4x2x1_16x16x128_intrawave_0x1x0_1,1617.34,603.64,0.0
256,10484,3072,3072,cktile,11,0,147.1221,a8w8_blockscale_cktile_192x256x128_4x2x1_16x16x128_intrawave_0x1x0_1,1345.0,720.88,0.0
256,10484,3072,6144,cktile,11,0,244.7286,a8w8_blockscale_cktile_192x256x128_4x2x1_16x16x128_intrawave_0x1x0_1,1617.13,603.53,0.0
256,10489,3072,3072,cktile,11,0,149.5155,a8w8_blockscale_cktile_192x256x128_4x2x1_16x16x128_intrawave_0x1x0_1,1324.1,709.65,0.0
256,10489,3072,6144,cktile,11,0,243.1989,a8w8_blockscale_cktile_192x256x128_4x2x1_16x16x128_intrawave_0x1x0_1,1628.08,607.58,0.0
256,10495,3072,3072,cktile,11,0,148.223,a8w8_blockscale_cktile_192x256x128_4x2x1_16x16x128_intrawave_0x1x0_1,1336.41,716.21,0.0
256,10498,3072,3072,cktile,11,0,147.1751,a8w8_blockscale_cktile_192x256x128_4x2x1_16x16x128_intrawave_0x1x0_1,1346.31,721.5,0.0
256,10503,3072,6144,cktile,11,0,241.792,a8w8_blockscale_cktile_192x256x128_4x2x1_16x16x128_intrawave_0x1x0_1,1639.74,611.83,0.0
256,10509,3072,6144,cktile,11,0,244.6059,a8w8_blockscale_cktile_192x256x128_4x2x1_16x16x128_intrawave_0x1x0_1,1621.8,605.09,0.0
256,10513,3072,3072,cktile,11,0,148.3091,a8w8_blockscale_cktile_192x256x128_4x2x1_16x16x128_intrawave_0x1x0_1,1337.92,716.91,0.0
256,10521,3072,3072,cktile,11,0,148.5754,a8w8_blockscale_cktile_192x256x128_4x2x1_16x16x128_intrawave_0x1x0_1,1336.54,716.13,0.0
256,10526,3072,3072,cktile,11,0,148.3209,a8w8_blockscale_cktile_192x256x128_4x2x1_16x16x128_intrawave_0x1x0_1,1339.47,717.67,0.0
256,10529,3072,3072,cktile,11,0,147.7837,a8w8_blockscale_cktile_192x256x128_4x2x1_16x16x128_intrawave_0x1x0_1,1344.72,720.46,0.0
256,10532,3072,3072,cktile,11,0,147.908,a8w8_blockscale_cktile_192x256x128_4x2x1_16x16x128_intrawave_0x1x0_1,1343.98,720.04,0.0
256,10535,3072,3072,cktile,11,0,147.8436,a8w8_blockscale_cktile_192x256x128_4x2x1_16x16x128_intrawave_0x1x0_1,1344.94,720.54,0.0
256,10547,3072,3072,cktile,11,0,146.992,a8w8_blockscale_cktile_192x256x128_4x2x1_16x16x128_intrawave_0x1x0_1,1354.28,725.47,0.0
256,10554,3072,3072,cktile,11,0,148.1675,a8w8_blockscale_cktile_192x256x128_4x2x1_16x16x128_intrawave_0x1x0_1,1344.42,720.15,0.0
256,10556,3072,6144,cktile,11,0,243.6118,a8w8_blockscale_cktile_192x256x128_4x2x1_16x16x128_intrawave_0x1x0_1,1635.7,609.93,0.0
256,10569,3072,3072,cktile,11,0,147.9704,a8w8_blockscale_cktile_192x256x128_4x2x1_16x16x128_intrawave_0x1x0_1,1348.13,722.04,0.0
256,10573,3072,6144,cktile,11,0,245.1739,a8w8_blockscale_cktile_192x256x128_4x2x1_16x16x128_intrawave_0x1x0_1,1627.9,606.9,0.0
256,10580,3072,3072,cktile,11,0,147.655,a8w8_blockscale_cktile_192x256x128_4x2x1_16x16x128_intrawave_0x1x0_1,1352.41,724.27,0.0
256,10587,3072,3072,cktile,11,0,148.0709,a8w8_blockscale_cktile_192x256x128_4x2x1_16x16x128_intrawave_0x1x0_1,1349.51,722.67,0.0
256,10589,3072,3072,cktile,11,0,148.1331,a8w8_blockscale_cktile_192x256x128_4x2x1_16x16x128_intrawave_0x1x0_1,1349.2,722.49,0.0
256,10593,3072,3072,cktile,11,0,146.99,a8w8_blockscale_cktile_192x256x128_4x2x1_16x16x128_intrawave_0x1x0_1,1360.2,728.36,0.0
256,10595,3072,3072,cktile,11,0,148.024,a8w8_blockscale_cktile_192x256x128_4x2x1_16x16x128_intrawave_0x1x0_1,1350.96,723.4,0.0
256,10600,3072,3072,cktile,11,0,147.9567,a8w8_blockscale_cktile_192x256x128_4x2x1_16x16x128_intrawave_0x1x0_1,1352.21,724.04,0.0
256,10613,3072,3072,cktile,11,0,147.7625,a8w8_blockscale_cktile_192x256x128_4x2x1_16x16x128_intrawave_0x1x0_1,1355.65,725.8,0.0
256,10628,3072,3072,cktile,11,0,147.9839,a8w8_blockscale_cktile_192x256x128_4x2x1_16x16x128_intrawave_0x1x0_1,1355.53,725.65,0.0
256,10635,3072,3072,cktile,11,0,148.8656,a8w8_blockscale_cktile_192x256x128_4x2x1_16x16x128_intrawave_0x1x0_1,1348.39,721.79,0.0
256,10640,3072,3072,cktile,11,0,148.4841,a8w8_blockscale_cktile_192x256x128_4x2x1_16x16x128_intrawave_0x1x0_1,1352.49,723.95,0.0
256,10648,3072,6144,cktile,11,0,241.1133,a8w8_blockscale_cktile_192x256x128_4x2x1_16x16x128_intrawave_0x1x0_1,1667.05,620.94,0.0
256,10651,3072,6144,cktile,11,0,242.3666,a8w8_blockscale_cktile_192x256x128_4x2x1_16x16x128_intrawave_0x1x0_1,1658.9,617.88,0.0
256,10652,3072,3072,cktile,11,0,149.816,a8w8_blockscale_cktile_192x256x128_4x2x1_16x16x128_intrawave_0x1x0_1,1341.98,718.25,0.0
256,10656,3072,3072,cktile,11,0,148.2888,a8w8_blockscale_cktile_192x256x128_4x2x1_16x16x128_intrawave_0x1x0_1,1356.31,725.9,0.0
256,10676,3072,3072,cktile,11,0,148.1344,a8w8_blockscale_cktile_192x256x128_4x2x1_16x16x128_intrawave_0x1x0_1,1360.27,727.9,0.0
256,10691,3072,3072,cktile,11,0,147.1427,a8w8_blockscale_cktile_192x256x128_4x2x1_16x16x128_intrawave_0x1x0_1,1371.36,733.75,0.0
256,10694,3072,3072,cktile,11,0,149.0852,a8w8_blockscale_cktile_192x256x128_4x2x1_16x16x128_intrawave_0x1x0_1,1353.87,724.37,0.0
256,10696,3072,3072,cktile,11,0,148.7394,a8w8_blockscale_cktile_192x256x128_4x2x1_16x16x128_intrawave_0x1x0_1,1357.27,726.18,0.0
256,10700,3072,3072,cktile,11,0,147.2952,a8w8_blockscale_cktile_192x256x128_4x2x1_16x16x128_intrawave_0x1x0_1,1371.1,733.55,0.0
256,10715,3072,3072,cktile,11,0,147.6455,a8w8_blockscale_cktile_192x256x128_4x2x1_16x16x128_intrawave_0x1x0_1,1369.76,732.75,0.0
256,10733,3072,3072,cktile,11,0,148.3861,a8w8_blockscale_cktile_192x256x128_4x2x1_16x16x128_intrawave_0x1x0_1,1365.21,730.21,0.0
256,10754,3072,3072,cktile,11,0,148.9402,a8w8_blockscale_cktile_192x256x128_4x2x1_16x16x128_intrawave_0x1x0_1,1362.79,728.79,0.0
256,10801,3072,3072,cktile,11,0,149.3155,a8w8_blockscale_cktile_192x256x128_4x2x1_16x16x128_intrawave_0x1x0_1,1365.31,729.86,0.0
256,10803,3072,3072,cktile,11,0,148.608,a8w8_blockscale_cktile_192x256x128_4x2x1_16x16x128_intrawave_0x1x0_1,1372.06,733.46,0.0
256,10804,3072,3072,cktile,11,0,148.6055,a8w8_blockscale_cktile_192x256x128_4x2x1_16x16x128_intrawave_0x1x0_1,1372.21,733.53,0.0
256,10841,3072,3072,cktile,11,0,147.8873,a8w8_blockscale_cktile_192x256x128_4x2x1_16x16x128_intrawave_0x1x0_1,1383.6,739.4,0.0
256,10855,3072,3072,cktile,11,0,148.5373,a8w8_blockscale_cktile_192x256x128_4x2x1_16x16x128_intrawave_0x1x0_1,1379.33,737.03,0.0
256,10856,3072,3072,cktile,11,0,147.7988,a8w8_blockscale_cktile_192x256x128_4x2x1_16x16x128_intrawave_0x1x0_1,1386.35,740.78,0.0
256,10857,3072,3072,cktile,11,0,148.4146,a8w8_blockscale_cktile_192x256x128_4x2x1_16x16x128_intrawave_0x1x0_1,1380.72,737.77,0.0
256,10873,3072,3072,cktile,11,0,148.2096,a8w8_blockscale_cktile_192x256x128_4x2x1_16x16x128_intrawave_0x1x0_1,1384.67,739.78,0.0
256,10874,3072,3072,cktile,11,0,147.2293,a8w8_blockscale_cktile_192x256x128_4x2x1_16x16x128_intrawave_0x1x0_1,1394.02,744.77,0.0
256,10913,3072,3072,cktile,11,0,146.8731,a8w8_blockscale_cktile_192x256x128_4x2x1_16x16x128_intrawave_0x1x0_1,1402.41,749.02,0.0
256,10914,3072,3072,cktile,11,0,148.1856,a8w8_blockscale_cktile_192x256x128_4x2x1_16x16x128_intrawave_0x1x0_1,1390.11,742.45,0.0
256,10915,3072,3072,cktile,11,0,147.8836,a8w8_blockscale_cktile_192x256x128_4x2x1_16x16x128_intrawave_0x1x0_1,1393.08,744.03,0.0
256,10916,3072,3072,cktile,11,0,148.2844,a8w8_blockscale_cktile_192x256x128_4x2x1_16x16x128_intrawave_0x1x0_1,1389.44,742.08,0.0
256,10921,3072,3072,cktile,11,0,147.94,a8w8_blockscale_cktile_192x256x128_4x2x1_16x16x128_intrawave_0x1x0_1,1393.31,744.12,0.0
256,10931,3072,3072,cktile,11,0,146.9349,a8w8_blockscale_cktile_192x256x128_4x2x1_16x16x128_intrawave_0x1x0_1,1404.13,749.84,0.0
256,10974,3072,3072,cktile,11,0,148.8828,a8w8_blockscale_cktile_192x256x128_4x2x1_16x16x128_intrawave_0x1x0_1,1391.21,742.69,0.0
256,10975,3072,3072,cktile,11,0,148.1,a8w8_blockscale_cktile_192x256x128_4x2x1_16x16x128_intrawave_0x1x0_1,1398.69,746.68,0.0
256,10976,3072,3072,cktile,11,0,148.0489,a8w8_blockscale_cktile_192x256x128_4x2x1_16x16x128_intrawave_0x1x0_1,1399.3,747.0,0.0
256,10977,3072,3072,cktile,11,0,147.9616,a8w8_blockscale_cktile_192x256x128_4x2x1_16x16x128_intrawave_0x1x0_1,1400.25,747.5,0.0
256,10988,3072,3072,cktile,11,0,149.3752,a8w8_blockscale_cktile_192x256x128_4x2x1_16x16x128_intrawave_0x1x0_1,1388.39,741.1,0.0
256,10989,3072,3072,cktile,11,0,148.58,a8w8_blockscale_cktile_192x256x128_4x2x1_16x16x128_intrawave_0x1x0_1,1395.95,745.13,0.0
256,10991,3072,3072,cktile,11,0,148.2242,a8w8_blockscale_cktile_192x256x128_4x2x1_16x16x128_intrawave_0x1x0_1,1399.56,747.05,0.0
256,11001,3072,3072,cktile,11,0,148.9466,a8w8_blockscale_cktile_192x256x128_4x2x1_16x16x128_intrawave_0x1x0_1,1394.04,744.04,0.0
256,11003,3072,6144,cktile,11,0,246.403,a8w8_blockscale_cktile_192x256x128_4x2x1_16x16x128_intrawave_0x1x0_1,1685.65,625.31,0.0
256,11053,3072,3072,cktile,11,0,149.2882,a8w8_blockscale_cktile_192x256x128_4x2x1_16x16x128_intrawave_0x1x0_1,1397.42,745.55,0.0
256,11059,3072,3072,cktile,11,0,149.2178,a8w8_blockscale_cktile_192x256x128_4x2x1_16x16x128_intrawave_0x1x0_1,1398.84,746.27,0.0
256,11099,3072,3072,cktile,11,0,149.3071,a8w8_blockscale_cktile_192x256x128_4x2x1_16x16x128_intrawave_0x1x0_1,1403.06,748.29,0.0
256,11111,3072,3072,cktile,11,0,148.7968,a8w8_blockscale_cktile_192x256x128_4x2x1_16x16x128_intrawave_0x1x0_1,1409.39,751.6,0.0
256,11612,3072,3072,cktile,11,0,148.7097,a8w8_blockscale_cktile_192x256x128_4x2x1_16x16x128_intrawave_0x1x0_1,1473.81,783.09,0.0
256,11636,3072,6144,cktile,11,0,245.9482,a8w8_blockscale_cktile_192x256x128_4x2x1_16x16x128_intrawave_0x1x0_1,1785.92,658.1,0.0
256,11645,3072,3072,cktile,11,0,149.5361,a8w8_blockscale_cktile_192x256x128_4x2x1_16x16x128_intrawave_0x1x0_1,1469.83,780.8,0.0
256,11667,3072,3072,cktile,11,0,149.4645,a8w8_blockscale_cktile_192x256x128_4x2x1_16x16x128_intrawave_0x1x0_1,1473.31,782.53,0.0
256,12004,3072,3072,cktile,11,0,151.5652,a8w8_blockscale_cktile_192x256x128_4x2x1_16x16x128_intrawave_0x1x0_1,1494.85,792.17,0.0
256,12434,3072,3072,cktile,11,0,177.8107,a8w8_blockscale_cktile_192x256x128_4x2x1_16x16x128_intrawave_0x1x0_1,1319.85,697.53,0.0
256,12869,3072,6144,cktile,11,0,317.0999,a8w8_blockscale_cktile_192x256x128_4x2x1_16x16x128_intrawave_0x1x0_1,1531.97,558.21,0.0
256,12894,3072,3072,cktile,11,0,191.5176,a8w8_blockscale_cktile_192x256x128_4x2x1_16x16x128_intrawave_0x1x0_1,1270.72,669.75,0.0
256,12909,3072,3072,cktile,11,0,188.9836,a8w8_blockscale_cktile_192x256x128_4x2x1_16x16x128_intrawave_0x1x0_1,1289.26,679.46,0.0
256,13004,3072,3072,cktile,11,0,190.0812,a8w8_blockscale_cktile_192x256x128_4x2x1_16x16x128_intrawave_0x1x0_1,1291.25,680.14,0.0
256,13006,3072,3072,cktile,11,0,190.2637,a8w8_blockscale_cktile_192x256x128_4x2x1_16x16x128_intrawave_0x1x0_1,1290.21,679.59,0.0
256,13178,3072,3072,cktile,11,0,189.9884,a8w8_blockscale_cktile_192x256x128_4x2x1_16x16x128_intrawave_0x1x0_1,1309.17,688.91,0.0
256,14004,3072,6144,cktile,11,0,319.4498,a8w8_blockscale_cktile_192x256x128_4x2x1_16x16x128_intrawave_0x1x0_1,1654.82,597.76,0.0
256,15000,3072,3072,cktile,11,0,195.8309,a8w8_blockscale_cktile_192x256x128_4x2x1_16x16x128_intrawave_0x1x0_1,1445.71,754.11,0.0
256,15000,3072,6144,cktile,11,0,321.5279,a8w8_blockscale_cktile_192x256x128_4x2x1_16x16x128_intrawave_0x1x0_1,1761.06,631.96,0.0
256,15001,3072,3072,cktile,11,0,197.7617,a8w8_blockscale_cktile_192x256x128_4x2x1_16x16x128_intrawave_0x1x0_1,1431.69,746.79,0.0
256,15001,3072,6144,cktile,11,0,320.931,a8w8_blockscale_cktile_192x256x128_4x2x1_16x16x128_intrawave_0x1x0_1,1764.46,633.18,0.0
256,15002,3072,3072,cktile,11,0,197.3535,a8w8_blockscale_cktile_192x256x128_4x2x1_16x16x128_intrawave_0x1x0_1,1434.75,748.38,0.0
256,15015,3072,6144,cktile,11,0,322.967,a8w8_blockscale_cktile_192x256x128_4x2x1_16x16x128_intrawave_0x1x0_1,1754.97,629.72,0.0
256,15094,3072,6144,cktile,11,0,327.3598,a8w8_blockscale_cktile_192x256x128_4x2x1_16x16x128_intrawave_0x1x0_1,1740.53,624.23,0.0
256,15179,3072,6144,cktile,11,0,323.0377,a8w8_blockscale_cktile_192x256x128_4x2x1_16x16x128_intrawave_0x1x0_1,1773.75,635.82,0.0
256,15264,3072,3072,cktile,11,0,196.7695,a8w8_blockscale_cktile_192x256x128_4x2x1_16x16x128_intrawave_0x1x0_1,1464.14,762.87,0.0
256,15391,3072,6144,cktile,11,0,323.5004,a8w8_blockscale_cktile_192x256x128_4x2x1_16x16x128_intrawave_0x1x0_1,1795.95,642.96,0.0
256,15457,3072,6144,cktile,11,0,326.5096,a8w8_blockscale_cktile_192x256x128_4x2x1_16x16x128_intrawave_0x1x0_1,1787.03,639.52,0.0
256,15585,3072,3072,cktile,11,0,196.4725,a8w8_blockscale_cktile_192x256x128_4x2x1_16x16x128_intrawave_0x1x0_1,1497.19,779.08,0.0
256,16014,3072,3072,cktile,11,0,198.4612,a8w8_blockscale_cktile_192x256x128_4x2x1_16x16x128_intrawave_0x1x0_1,1522.99,791.2,0.0
256,16404,3072,3072,cktile,11,0,224.0432,a8w8_blockscale_cktile_192x256x128_4x2x1_16x16x128_intrawave_0x1x0_1,1381.94,716.9,0.0
256,16406,3072,3072,cktile,11,0,224.541,a8w8_blockscale_cktile_192x256x128_4x2x1_16x16x128_intrawave_0x1x0_1,1379.05,715.39,0.0
256,18007,3072,3072,cktile,11,0,241.481,a8w8_blockscale_cktile_192x256x128_4x2x1_16x16x128_intrawave_0x1x0_1,1407.44,726.31,0.0
256,18371,3072,3072,cktile,11,0,242.3118,a8w8_blockscale_cktile_192x256x128_4x2x1_16x16x128_intrawave_0x1x0_1,1430.97,737.66,0.0
256,18617,3072,6144,cktile,11,0,397.8414,a8w8_blockscale_cktile_192x256x128_4x2x1_16x16x128_intrawave_0x1x0_1,1766.45,622.46,0.0
256,18950,3072,3072,cktile,11,0,241.6941,a8w8_blockscale_cktile_192x256x128_4x2x1_16x16x128_intrawave_0x1x0_1,1479.84,761.63,0.0
256,18950,3072,6144,cktile,11,0,395.5095,a8w8_blockscale_cktile_192x256x128_4x2x1_16x16x128_intrawave_0x1x0_1,1808.65,636.48,0.0
256,18963,3072,6144,cktile,11,0,400.0197,a8w8_blockscale_cktile_192x256x128_4x2x1_16x16x128_intrawave_0x1x0_1,1789.49,629.7,0.0
256,18964,3072,3072,cktile,11,0,244.369,a8w8_blockscale_cktile_192x256x128_4x2x1_16x16x128_intrawave_0x1x0_1,1464.73,753.82,0.0
256,19001,3072,6144,cktile,11,0,395.9349,a8w8_blockscale_cktile_192x256x128_4x2x1_16x16x128_intrawave_0x1x0_1,1811.57,637.37,0.0
256,19002,3072,6144,cktile,11,0,396.9753,a8w8_blockscale_cktile_192x256x128_4x2x1_16x16x128_intrawave_0x1x0_1,1806.92,635.73,0.0
256,19507,3072,6144,cktile,11,0,398.847,a8w8_blockscale_cktile_192x256x128_4x2x1_16x16x128_intrawave_0x1x0_1,1846.23,648.31,0.0
256,20000,3072,3072,cktile,11,0,244.9043,a8w8_blockscale_cktile_192x256x128_4x2x1_16x16x128_intrawave_0x1x0_1,1541.37,791.15,0.0
256,20000,3072,6144,cktile,11,0,402.393,a8w8_blockscale_cktile_192x256x128_4x2x1_16x16x128_intrawave_0x1x0_1,1876.21,657.65,0.0
256,20001,3072,3072,cktile,11,0,242.6238,a8w8_blockscale_cktile_192x256x128_4x2x1_16x16x128_intrawave_0x1x0_1,1555.93,798.63,0.0
256,20001,3072,6144,cktile,11,0,405.2611,a8w8_blockscale_cktile_192x256x128_4x2x1_16x16x128_intrawave_0x1x0_1,1863.03,653.03,0.0
256,20002,3072,3072,cktile,11,0,244.3048,a8w8_blockscale_cktile_192x256x128_4x2x1_16x16x128_intrawave_0x1x0_1,1545.3,793.17,0.0
256,20002,3072,6144,cktile,11,0,402.21,a8w8_blockscale_cktile_192x256x128_4x2x1_16x16x128_intrawave_0x1x0_1,1877.25,658.01,0.0
256,20004,3072,3072,cktile,11,0,245.7,a8w8_blockscale_cktile_192x256x128_4x2x1_16x16x128_intrawave_0x1x0_1,1536.68,788.74,0.0
256,20006,3072,6144,cktile,11,0,408.1628,a8w8_blockscale_cktile_192x256x128_4x2x1_16x16x128_intrawave_0x1x0_1,1850.25,648.54,0.0
256,20011,3072,6144,cktile,11,0,407.5712,a8w8_blockscale_cktile_192x256x128_4x2x1_16x16x128_intrawave_0x1x0_1,1853.39,649.63,0.0
256,20017,3072,6144,cktile,11,0,410.4376,a8w8_blockscale_cktile_192x256x128_4x2x1_16x16x128_intrawave_0x1x0_1,1841.0,645.27,0.0
256,20034,3072,6144,cktile,11,0,411.5277,a8w8_blockscale_cktile_192x256x128_4x2x1_16x16x128_intrawave_0x1x0_1,1837.68,644.07,0.0
256,20062,3072,3072,cktile,11,0,247.0219,a8w8_blockscale_cktile_192x256x128_4x2x1_16x16x128_intrawave_0x1x0_1,1532.89,786.69,0.0
256,20072,3072,6144,cktile,11,0,403.3654,a8w8_blockscale_cktile_192x256x128_4x2x1_16x16x128_intrawave_0x1x0_1,1878.43,658.26,0.0
256,20078,3072,6144,cktile,11,0,404.2651,a8w8_blockscale_cktile_192x256x128_4x2x1_16x16x128_intrawave_0x1x0_1,1874.81,656.98,0.0
256,20132,3072,3072,cktile,11,0,244.7693,a8w8_blockscale_cktile_192x256x128_4x2x1_16x16x128_intrawave_0x1x0_1,1552.4,796.56,0.0
256,20149,3072,6144,cktile,11,0,408.933,a8w8_blockscale_cktile_192x256x128_4x2x1_16x16x128_intrawave_0x1x0_1,1859.96,651.61,0.0
256,20227,3072,6144,cktile,11,0,399.0489,a8w8_blockscale_cktile_192x256x128_4x2x1_16x16x128_intrawave_0x1x0_1,1913.41,670.15,0.0
256,20234,3072,6144,cktile,11,0,407.1797,a8w8_blockscale_cktile_192x256x128_4x2x1_16x16x128_intrawave_0x1x0_1,1875.85,656.98,0.0
256,20245,3072,6144,cktile,11,0,404.9892,a8w8_blockscale_cktile_192x256x128_4x2x1_16x16x128_intrawave_0x1x0_1,1887.02,660.87,0.0
256,20255,3072,6144,cktile,11,0,404.3999,a8w8_blockscale_cktile_192x256x128_4x2x1_16x16x128_intrawave_0x1x0_1,1890.7,662.14,0.0
256,20264,3072,6144,cktile,11,0,403.0025,a8w8_blockscale_cktile_192x256x128_4x2x1_16x16x128_intrawave_0x1x0_1,1898.1,664.71,0.0
256,20272,3072,6144,cktile,11,0,403.1154,a8w8_blockscale_cktile_192x256x128_4x2x1_16x16x128_intrawave_0x1x0_1,1898.32,664.76,0.0
256,20360,3072,6144,cktile,11,0,437.9251,a8w8_blockscale_cktile_192x256x128_4x2x1_16x16x128_intrawave_0x1x0_1,1755.01,614.39,0.0
256,20368,3072,3072,cktile,11,0,260.4704,a8w8_blockscale_cktile_192x256x128_4x2x1_16x16x128_intrawave_0x1x0_1,1475.92,756.89,0.0
256,20368,3072,6144,cktile,11,0,433.5206,a8w8_blockscale_cktile_192x256x128_4x2x1_16x16x128_intrawave_0x1x0_1,1773.54,620.86,0.0
256,20375,3072,6144,cktile,11,0,445.2633,a8w8_blockscale_cktile_192x256x128_4x2x1_16x16x128_intrawave_0x1x0_1,1727.36,604.68,0.0
256,20394,3072,6144,cktile,11,0,432.5762,a8w8_blockscale_cktile_192x256x128_4x2x1_16x16x128_intrawave_0x1x0_1,1779.68,622.96,0.0
256,20438,3072,6144,cktile,11,0,443.1744,a8w8_blockscale_cktile_192x256x128_4x2x1_16x16x128_intrawave_0x1x0_1,1740.87,609.28,0.0
256,20441,3072,6144,cktile,11,0,442.8341,a8w8_blockscale_cktile_192x256x128_4x2x1_16x16x128_intrawave_0x1x0_1,1742.46,609.83,0.0
256,20450,3072,6144,cktile,11,0,446.9597,a8w8_blockscale_cktile_192x256x128_4x2x1_16x16x128_intrawave_0x1x0_1,1727.14,604.45,0.0
256,20571,3072,6144,cktile,11,0,457.0584,a8w8_blockscale_cktile_192x256x128_4x2x1_16x16x128_intrawave_0x1x0_1,1698.97,594.35,0.0
256,20602,3072,3072,cktile,11,0,267.8433,a8w8_blockscale_cktile_192x256x128_4x2x1_16x16x128_intrawave_0x1x0_1,1451.78,744.11,0.0
256,20666,3072,3072,cktile,11,0,265.0929,a8w8_blockscale_cktile_192x256x128_4x2x1_16x16x128_intrawave_0x1x0_1,1471.4,754.06,0.0
256,20763,3072,6144,cktile,11,0,461.2868,a8w8_blockscale_cktile_192x256x128_4x2x1_16x16x128_intrawave_0x1x0_1,1699.11,594.01,0.0
256,20830,3072,3072,cktile,11,0,274.7866,a8w8_blockscale_cktile_192x256x128_4x2x1_16x16x128_intrawave_0x1x0_1,1430.76,732.96,0.0
256,20929,3072,3072,cktile,11,0,277.1561,a8w8_blockscale_cktile_192x256x128_4x2x1_16x16x128_intrawave_0x1x0_1,1425.27,729.98,0.0
256,21430,3072,6144,cktile,11,0,482.9157,a8w8_blockscale_cktile_192x256x128_4x2x1_16x16x128_intrawave_0x1x0_1,1675.15,584.38,0.0
256,21545,3072,3072,cktile,11,0,282.4407,a8w8_blockscale_cktile_192x256x128_4x2x1_16x16x128_intrawave_0x1x0_1,1439.77,736.42,0.0
256,21610,3072,3072,cktile,11,0,284.5283,a8w8_blockscale_cktile_192x256x128_4x2x1_16x16x128_intrawave_0x1x0_1,1433.51,733.13,0.0
256,21721,3072,3072,cktile,11,0,285.2019,a8w8_blockscale_cktile_192x256x128_4x2x1_16x16x128_intrawave_0x1x0_1,1437.47,734.98,0.0
256,21738,3072,3072,cktile,11,0,284.2815,a8w8_blockscale_cktile_192x256x128_4x2x1_16x16x128_intrawave_0x1x0_1,1443.26,737.91,0.0
256,21800,3072,3072,cktile,11,0,283.6351,a8w8_blockscale_cktile_192x256x128_4x2x1_16x16x128_intrawave_0x1x0_1,1450.67,741.61,0.0
256,21844,3072,3072,cktile,11,0,282.3154,a8w8_blockscale_cktile_192x256x128_4x2x1_16x16x128_intrawave_0x1x0_1,1460.39,746.51,0.0
256,21925,3072,3072,cktile,11,0,289.8991,a8w8_blockscale_cktile_192x256x128_4x2x1_16x16x128_intrawave_0x1x0_1,1427.46,729.56,0.0
256,22009,3072,6144,cktile,11,0,482.6766,a8w8_blockscale_cktile_192x256x128_4x2x1_16x16x128_intrawave_0x1x0_1,1721.26,599.41,0.0
256,22011,3072,3072,cktile,11,0,286.9668,a8w8_blockscale_cktile_192x256x128_4x2x1_16x16x128_intrawave_0x1x0_1,1447.71,739.77,0.0
256,22279,3072,6144,cktile,11,0,478.8428,a8w8_blockscale_cktile_192x256x128_4x2x1_16x16x128_intrawave_0x1x0_1,1756.33,611.14,0.0
256,22355,3072,3072,cktile,11,0,290.8432,a8w8_blockscale_cktile_192x256x128_4x2x1_16x16x128_intrawave_0x1x0_1,1450.74,740.81,0.0
256,22410,3072,3072,cktile,11,0,289.0514,a8w8_blockscale_cktile_192x256x128_4x2x1_16x16x128_intrawave_0x1x0_1,1463.32,747.16,0.0
256,23010,3072,3072,cktile,11,0,292.3176,a8w8_blockscale_cktile_192x256x128_4x2x1_16x16x128_intrawave_0x1x0_1,1485.71,757.73,0.0
256,23463,3072,3072,cktile,11,0,291.1168,a8w8_blockscale_cktile_192x256x128_4x2x1_16x16x128_intrawave_0x1x0_1,1521.21,775.19,0.0
256,23970,3072,6144,cktile,11,0,485.4396,a8w8_blockscale_cktile_192x256x128_4x2x1_16x16x128_intrawave_0x1x0_1,1863.95,645.64,0.0
256,23999,3072,6144,cktile,11,0,483.6143,a8w8_blockscale_cktile_192x256x128_4x2x1_16x16x128_intrawave_0x1x0_1,1873.25,648.81,0.0
256,24008,3072,3072,cktile,11,0,287.9132,a8w8_blockscale_cktile_192x256x128_4x2x1_16x16x128_intrawave_0x1x0_1,1573.86,801.27,0.0
256,24241,3072,6144,cktile,11,0,486.9351,a8w8_blockscale_cktile_192x256x128_4x2x1_16x16x128_intrawave_0x1x0_1,1879.24,650.49,0.0
256,24605,3072,3072,cktile,11,0,313.9851,a8w8_blockscale_cktile_192x256x128_4x2x1_16x16x128_intrawave_0x1x0_1,1479.06,752.26,0.0
256,25000,3072,3072,cktile,11,0,323.1986,a8w8_blockscale_cktile_192x256x128_4x2x1_16x16x128_intrawave_0x1x0_1,1459.97,742.07,0.0
256,25002,3072,6144,cktile,11,0,550.3501,a8w8_blockscale_cktile_192x256x128_4x2x1_16x16x128_intrawave_0x1x0_1,1714.9,592.53,0.0
256,25007,3072,6144,cktile,11,0,541.574,a8w8_blockscale_cktile_192x256x128_4x2x1_16x16x128_intrawave_0x1x0_1,1743.04,602.25,0.0
256,25066,3072,6144,cktile,11,0,533.0744,a8w8_blockscale_cktile_192x256x128_4x2x1_16x16x128_intrawave_0x1x0_1,1775.01,613.21,0.0
256,25149,3072,6144,cktile,11,0,552.7524,a8w8_blockscale_cktile_192x256x128_4x2x1_16x16x128_intrawave_0x1x0_1,1717.48,593.22,0.0
256,26007,3072,3072,cktile,11,0,332.2061,a8w8_blockscale_cktile_192x256x128_4x2x1_16x16x128_intrawave_0x1x0_1,1477.59,749.89,0.0
256,26038,3072,3072,cktile,11,0,331.7461,a8w8_blockscale_cktile_192x256x128_4x2x1_16x16x128_intrawave_0x1x0_1,1481.41,751.79,0.0
256,26191,3072,3072,cktile,11,0,333.0677,a8w8_blockscale_cktile_192x256x128_4x2x1_16x16x128_intrawave_0x1x0_1,1484.2,753.04,0.0
256,26922,3072,3072,cktile,11,0,339.0348,a8w8_blockscale_cktile_192x256x128_4x2x1_16x16x128_intrawave_0x1x0_1,1498.77,759.66,0.0
256,27009,3072,6144,cktile,11,0,564.4144,a8w8_blockscale_cktile_192x256x128_4x2x1_16x16x128_intrawave_0x1x0_1,1806.4,621.46,0.0
256,27555,3072,6144,cktile,11,0,559.8763,a8w8_blockscale_cktile_192x256x128_4x2x1_16x16x128_intrawave_0x1x0_1,1857.85,638.48,0.0
256,27654,3072,3072,cktile,11,0,338.925,a8w8_blockscale_cktile_192x256x128_4x2x1_16x16x128_intrawave_0x1x0_1,1540.02,779.81,0.0
256,27935,3072,3072,cktile,11,0,339.3496,a8w8_blockscale_cktile_192x256x128_4x2x1_16x16x128_intrawave_0x1x0_1,1553.72,786.46,0.0
256,28004,3072,6144,cktile,11,0,561.4269,a8w8_blockscale_cktile_192x256x128_4x2x1_16x16x128_intrawave_0x1x0_1,1882.91,646.54,0.0
256,28005,3072,6144,cktile,11,0,564.9417,a8w8_blockscale_cktile_192x256x128_4x2x1_16x16x128_intrawave_0x1x0_1,1871.26,642.54,0.0
256,28036,3072,6144,cktile,11,0,566.2827,a8w8_blockscale_cktile_192x256x128_4x2x1_16x16x128_intrawave_0x1x0_1,1868.9,641.69,0.0
256,28261,3072,6144,cktile,11,0,564.4312,a8w8_blockscale_cktile_192x256x128_4x2x1_16x16x128_intrawave_0x1x0_1,1890.07,648.7,0.0
256,28429,3072,3072,cktile,11,0,334.2817,a8w8_blockscale_cktile_192x256x128_4x2x1_16x16x128_intrawave_0x1x0_1,1605.17,812.01,0.0
256,28597,3072,3072,cktile,11,0,339.9774,a8w8_blockscale_cktile_192x256x128_4x2x1_16x16x128_intrawave_0x1x0_1,1587.61,802.96,0.0
256,28959,3072,6144,cktile,11,0,617.0734,a8w8_blockscale_cktile_192x256x128_4x2x1_16x16x128_intrawave_0x1x0_1,1771.53,607.26,0.0
256,28961,3072,6144,cktile,11,0,607.0186,a8w8_blockscale_cktile_192x256x128_4x2x1_16x16x128_intrawave_0x1x0_1,1801.0,617.36,0.0
256,28997,3072,6144,cktile,11,0,613.3964,a8w8_blockscale_cktile_192x256x128_4x2x1_16x16x128_intrawave_0x1x0_1,1784.49,611.66,0.0
256,29003,3072,3072,cktile,11,0,363.8694,a8w8_blockscale_cktile_192x256x128_4x2x1_16x16x128_intrawave_0x1x0_1,1504.42,760.52,0.0
256,29747,3072,6144,cktile,11,0,645.3356,a8w8_blockscale_cktile_192x256x128_4x2x1_16x16x128_intrawave_0x1x0_1,1740.04,595.67,0.0
256,30000,3072,3072,cktile,11,0,379.778,a8w8_blockscale_cktile_192x256x128_4x2x1_16x16x128_intrawave_0x1x0_1,1490.95,752.85,0.0
256,30000,3072,6144,cktile,11,0,634.9503,a8w8_blockscale_cktile_192x256x128_4x2x1_16x16x128_intrawave_0x1x0_1,1783.54,610.31,0.0
256,30001,3072,3072,cktile,11,0,374.7308,a8w8_blockscale_cktile_192x256x128_4x2x1_16x16x128_intrawave_0x1x0_1,1511.08,763.02,0.0
256,30001,3072,6144,cktile,11,0,638.8491,a8w8_blockscale_cktile_192x256x128_4x2x1_16x16x128_intrawave_0x1x0_1,1772.72,606.6,0.0
256,30002,3072,6144,cktile,11,0,642.7544,a8w8_blockscale_cktile_192x256x128_4x2x1_16x16x128_intrawave_0x1x0_1,1762.01,602.93,0.0
256,30003,3072,3072,cktile,11,0,376.1066,a8w8_blockscale_cktile_192x256x128_4x2x1_16x16x128_intrawave_0x1x0_1,1505.66,760.28,0.0
256,30006,3072,6144,cktile,11,0,642.9362,a8w8_blockscale_cktile_192x256x128_4x2x1_16x16x128_intrawave_0x1x0_1,1761.74,602.84,0.0
256,30010,3072,6144,cktile,11,0,624.1272,a8w8_blockscale_cktile_192x256x128_4x2x1_16x16x128_intrawave_0x1x0_1,1815.08,621.09,0.0
256,30012,3072,6144,cktile,11,0,634.2201,a8w8_blockscale_cktile_192x256x128_4x2x1_16x16x128_intrawave_0x1x0_1,1786.31,611.24,0.0
256,30016,3072,6144,cktile,11,0,621.9421,a8w8_blockscale_cktile_192x256x128_4x2x1_16x16x128_intrawave_0x1x0_1,1821.82,623.39,0.0
256,30079,3072,6144,cktile,11,0,644.0477,a8w8_blockscale_cktile_192x256x128_4x2x1_16x16x128_intrawave_0x1x0_1,1762.98,603.19,0.0
256,30086,3072,6144,cktile,11,0,632.9613,a8w8_blockscale_cktile_192x256x128_4x2x1_16x16x128_intrawave_0x1x0_1,1794.28,613.89,0.0
256,30095,3072,6144,cktile,11,0,636.4127,a8w8_blockscale_cktile_192x256x128_4x2x1_16x16x128_intrawave_0x1x0_1,1785.08,610.74,0.0
256,30216,3072,6144,cktile,11,0,639.0448,a8w8_blockscale_cktile_192x256x128_4x2x1_16x16x128_intrawave_0x1x0_1,1784.88,610.55,0.0
256,30218,3072,6144,cktile,11,0,635.2925,a8w8_blockscale_cktile_192x256x128_4x2x1_16x16x128_intrawave_0x1x0_1,1795.54,614.19,0.0
256,30224,3072,6144,cktile,11,0,641.8118,a8w8_blockscale_cktile_192x256x128_4x2x1_16x16x128_intrawave_0x1x0_1,1777.65,608.07,0.0
256,30295,3072,6144,cktile,11,0,635.9329,a8w8_blockscale_cktile_192x256x128_4x2x1_16x16x128_intrawave_0x1x0_1,1798.3,615.06,0.0
256,30303,3072,6144,cktile,11,0,640.2525,a8w8_blockscale_cktile_192x256x128_4x2x1_16x16x128_intrawave_0x1x0_1,1786.64,611.07,0.0
256,30314,3072,6144,cktile,11,0,631.5283,a8w8_blockscale_cktile_192x256x128_4x2x1_16x16x128_intrawave_0x1x0_1,1811.98,619.72,0.0
256,30324,3072,6144,cktile,11,0,625.7138,a8w8_blockscale_cktile_192x256x128_4x2x1_16x16x128_intrawave_0x1x0_1,1829.42,625.68,0.0
256,30334,3072,6144,cktile,11,0,626.6352,a8w8_blockscale_cktile_192x256x128_4x2x1_16x16x128_intrawave_0x1x0_1,1827.33,624.95,0.0
256,30342,3072,6144,cktile,11,0,643.2077,a8w8_blockscale_cktile_192x256x128_4x2x1_16x16x128_intrawave_0x1x0_1,1780.72,609.01,0.0
256,30343,3072,6144,cktile,11,0,648.2376,a8w8_blockscale_cktile_192x256x128_4x2x1_16x16x128_intrawave_0x1x0_1,1766.96,604.3,0.0
256,30437,3072,6144,cktile,11,0,643.6186,a8w8_blockscale_cktile_192x256x128_4x2x1_16x16x128_intrawave_0x1x0_1,1785.15,610.43,0.0
256,30486,3072,3072,cktile,11,0,383.5167,a8w8_blockscale_cktile_192x256x128_4x2x1_16x16x128_intrawave_0x1x0_1,1500.34,757.19,0.0
256,30509,3072,6144,cktile,11,0,628.7891,a8w8_blockscale_cktile_192x256x128_4x2x1_16x16x128_intrawave_0x1x0_1,1831.58,626.23,0.0
256,30553,3072,3072,cktile,11,0,384.4089,a8w8_blockscale_cktile_192x256x128_4x2x1_16x16x128_intrawave_0x1x0_1,1500.14,757.04,0.0
256,30743,3072,6144,cktile,11,0,640.2536,a8w8_blockscale_cktile_192x256x128_4x2x1_16x16x128_intrawave_0x1x0_1,1812.58,619.51,0.0
256,30745,3072,6144,cktile,11,0,647.5098,a8w8_blockscale_cktile_192x256x128_4x2x1_16x16x128_intrawave_0x1x0_1,1792.38,612.61,0.0
256,30801,3072,3072,cktile,11,0,383.8914,a8w8_blockscale_cktile_192x256x128_4x2x1_16x16x128_intrawave_0x1x0_1,1514.36,764.02,0.0
256,31001,3072,3072,cktile,11,0,385.8779,a8w8_blockscale_cktile_192x256x128_4x2x1_16x16x128_intrawave_0x1x0_1,1516.35,764.86,0.0
256,31001,3072,6144,cktile,11,0,640.5232,a8w8_blockscale_cktile_192x256x128_4x2x1_16x16x128_intrawave_0x1x0_1,1827.02,624.2,0.0
256,31007,3072,3072,cktile,11,0,384.4065,a8w8_blockscale_cktile_192x256x128_4x2x1_16x16x128_intrawave_0x1x0_1,1522.44,767.93,0.0
256,31033,3072,3072,cktile,11,0,385.076,a8w8_blockscale_cktile_192x256x128_4x2x1_16x16x128_intrawave_0x1x0_1,1521.07,767.22,0.0
256,31033,3072,6144,cktile,11,0,649.5363,a8w8_blockscale_cktile_192x256x128_4x2x1_16x16x128_intrawave_0x1x0_1,1803.53,616.14,0.0
256,31097,3072,6144,cktile,11,0,639.5078,a8w8_blockscale_cktile_192x256x128_4x2x1_16x16x128_intrawave_0x1x0_1,1835.59,627.04,0.0
256,31810,3072,6144,cktile,11,0,647.8777,a8w8_blockscale_cktile_192x256x128_4x2x1_16x16x128_intrawave_0x1x0_1,1853.42,632.46,0.0
256,31895,3072,3072,cktile,11,0,383.0156,a8w8_blockscale_cktile_192x256x128_4x2x1_16x16x128_intrawave_0x1x0_1,1571.73,792.09,0.0
256,32001,3072,3072,cktile,11,0,383.3802,a8w8_blockscale_cktile_192x256x128_4x2x1_16x16x128_intrawave_0x1x0_1,1575.46,793.88,0.0
256,32001,3072,6144,cktile,11,0,652.3087,a8w8_blockscale_cktile_192x256x128_4x2x1_16x16x128_intrawave_0x1x0_1,1851.88,631.76,0.0
256,32002,3072,3072,cktile,11,0,387.5249,a8w8_blockscale_cktile_192x256x128_4x2x1_16x16x128_intrawave_0x1x0_1,1558.65,785.41,0.0
256,32004,3072,6144,cktile,11,0,642.7887,a8w8_blockscale_cktile_192x256x128_4x2x1_16x16x128_intrawave_0x1x0_1,1879.48,641.17,0.0
256,32005,3072,3072,cktile,11,0,385.2956,a8w8_blockscale_cktile_192x256x128_4x2x1_16x16x128_intrawave_0x1x0_1,1567.82,790.03,0.0
256,32006,3072,3072,cktile,11,0,383.1184,a8w8_blockscale_cktile_192x256x128_4x2x1_16x16x128_intrawave_0x1x0_1,1576.78,794.54,0.0
256,32007,3072,3072,cktile,11,0,384.4384,a8w8_blockscale_cktile_192x256x128_4x2x1_16x16x128_intrawave_0x1x0_1,1571.41,791.84,0.0
256,32008,3072,6144,cktile,11,0,632.5623,a8w8_blockscale_cktile_192x256x128_4x2x1_16x16x128_intrawave_0x1x0_1,1910.11,651.62,0.0
256,32012,3072,6144,cktile,11,0,639.355,a8w8_blockscale_cktile_192x256x128_4x2x1_16x16x128_intrawave_0x1x0_1,1890.05,644.77,0.0
256,32014,3072,6144,cktile,11,0,654.7211,a8w8_blockscale_cktile_192x256x128_4x2x1_16x16x128_intrawave_0x1x0_1,1845.81,629.68,0.0
256,32019,3072,3072,cktile,11,0,383.8129,a8w8_blockscale_cktile_192x256x128_4x2x1_16x16x128_intrawave_0x1x0_1,1574.57,793.42,0.0
256,32040,3072,6144,cktile,11,0,650.4809,a8w8_blockscale_cktile_192x256x128_4x2x1_16x16x128_intrawave_0x1x0_1,1859.35,634.27,0.0
256,32065,3072,6144,cktile,11,0,639.5131,a8w8_blockscale_cktile_192x256x128_4x2x1_16x16x128_intrawave_0x1x0_1,1892.71,645.63,0.0
256,32315,3072,3072,cktile,11,0,383.7124,a8w8_blockscale_cktile_192x256x128_4x2x1_16x16x128_intrawave_0x1x0_1,1589.54,800.74,0.0
256,32409,3072,3072,cktile,11,0,381.5848,a8w8_blockscale_cktile_192x256x128_4x2x1_16x16x128_intrawave_0x1x0_1,1603.05,807.47,0.0
256,32417,3072,3072,cktile,11,0,382.4731,a8w8_blockscale_cktile_192x256x128_4x2x1_16x16x128_intrawave_0x1x0_1,1599.72,805.79,0.0
256,33031,3072,6144,cktile,11,0,700.5865,a8w8_blockscale_cktile_192x256x128_4x2x1_16x16x128_intrawave_0x1x0_1,1779.76,606.29,0.0
256,33563,3072,3072,cktile,11,0,417.7193,a8w8_blockscale_cktile_192x256x128_4x2x1_16x16x128_intrawave_0x1x0_1,1516.52,763.08,0.0
256,33693,3072,3072,cktile,11,0,422.3808,a8w8_blockscale_cktile_192x256x128_4x2x1_16x16x128_intrawave_0x1x0_1,1505.59,757.5,0.0
256,33741,3072,6144,cktile,11,0,724.9991,a8w8_blockscale_cktile_192x256x128_4x2x1_16x16x128_intrawave_0x1x0_1,1756.8,597.91,0.0
256,33823,3072,3072,cktile,11,0,421.3186,a8w8_blockscale_cktile_192x256x128_4x2x1_16x16x128_intrawave_0x1x0_1,1515.21,762.25,0.0
256,33995,3072,6144,cktile,11,0,728.4237,a8w8_blockscale_cktile_192x256x128_4x2x1_16x16x128_intrawave_0x1x0_1,1761.71,599.38,0.0
256,34261,3072,6144,cktile,11,0,728.4136,a8w8_blockscale_cktile_192x256x128_4x2x1_16x16x128_intrawave_0x1x0_1,1775.52,603.88,0.0
256,34316,3072,3072,cktile,11,0,422.8221,a8w8_blockscale_cktile_192x256x128_4x2x1_16x16x128_intrawave_0x1x0_1,1531.83,770.28,0.0
256,34348,3072,3072,cktile,11,0,420.9997,a8w8_blockscale_cktile_192x256x128_4x2x1_16x16x128_intrawave_0x1x0_1,1539.9,774.32,0.0
256,34501,3072,3072,cktile,11,0,430.0568,a8w8_blockscale_cktile_192x256x128_4x2x1_16x16x128_intrawave_0x1x0_1,1514.18,761.29,0.0
256,35001,3072,3072,cktile,11,0,430.332,a8w8_blockscale_cktile_192x256x128_4x2x1_16x16x128_intrawave_0x1x0_1,1535.14,771.51,0.0
256,35001,3072,6144,cktile,11,0,723.1154,a8w8_blockscale_cktile_192x256x128_4x2x1_16x16x128_intrawave_0x1x0_1,1827.15,620.88,0.0
256,35092,3072,6144,cktile,11,0,720.3537,a8w8_blockscale_cktile_192x256x128_4x2x1_16x16x128_intrawave_0x1x0_1,1838.93,624.81,0.0
256,35108,3072,3072,cktile,11,0,429.7869,a8w8_blockscale_cktile_192x256x128_4x2x1_16x16x128_intrawave_0x1x0_1,1541.79,774.79,0.0
256,35163,3072,6144,cktile,11,0,722.1201,a8w8_blockscale_cktile_192x256x128_4x2x1_16x16x128_intrawave_0x1x0_1,1838.14,624.49,0.0
256,35171,3072,6144,cktile,11,0,733.4924,a8w8_blockscale_cktile_192x256x128_4x2x1_16x16x128_intrawave_0x1x0_1,1810.05,614.94,0.0
256,35200,3072,6144,cktile,11,0,718.4855,a8w8_blockscale_cktile_192x256x128_4x2x1_16x16x128_intrawave_0x1x0_1,1849.38,628.28,0.0
256,35209,3072,6144,cktile,11,0,708.8781,a8w8_blockscale_cktile_192x256x128_4x2x1_16x16x128_intrawave_0x1x0_1,1874.93,636.95,0.0
256,35265,3072,6144,cktile,11,0,727.2488,a8w8_blockscale_cktile_192x256x128_4x2x1_16x16x128_intrawave_0x1x0_1,1830.47,621.81,0.0
256,35546,3072,3072,cktile,11,0,433.3874,a8w8_blockscale_cktile_192x256x128_4x2x1_16x16x128_intrawave_0x1x0_1,1548.06,777.66,0.0
256,36016,3072,3072,cktile,11,0,429.683,a8w8_blockscale_cktile_192x256x128_4x2x1_16x16x128_intrawave_0x1x0_1,1582.05,794.45,0.0
256,36031,3072,3072,cktile,11,0,433.571,a8w8_blockscale_cktile_192x256x128_4x2x1_16x16x128_intrawave_0x1x0_1,1568.51,787.64,0.0
256,36171,3072,3072,cktile,11,0,429.0634,a8w8_blockscale_cktile_192x256x128_4x2x1_16x16x128_intrawave_0x1x0_1,1591.15,798.92,0.0
256,36230,3072,6144,cktile,11,0,731.4094,a8w8_blockscale_cktile_192x256x128_4x2x1_16x16x128_intrawave_0x1x0_1,1869.86,634.49,0.0
256,37042,3072,3072,cktile,11,0,446.1616,a8w8_blockscale_cktile_192x256x128_4x2x1_16x16x128_intrawave_0x1x0_1,1567.02,786.3,0.0
256,37248,3072,6144,cktile,11,0,765.6726,a8w8_blockscale_cktile_192x256x128_4x2x1_16x16x128_intrawave_0x1x0_1,1836.38,622.43,0.0
256,37515,3072,3072,cktile,11,0,460.5941,a8w8_blockscale_cktile_192x256x128_4x2x1_16x16x128_intrawave_0x1x0_1,1537.3,771.12,0.0
256,38016,3072,3072,cktile,11,0,472.1913,a8w8_blockscale_cktile_192x256x128_4x2x1_16x16x128_intrawave_0x1x0_1,1519.57,761.96,0.0
256,38326,3072,3072,cktile,11,0,468.3582,a8w8_blockscale_cktile_192x256x128_4x2x1_16x16x128_intrawave_0x1x0_1,1544.5,774.3,0.0
256,38508,3072,3072,cktile,11,0,477.1235,a8w8_blockscale_cktile_192x256x128_4x2x1_16x16x128_intrawave_0x1x0_1,1523.33,763.59,0.0
256,38867,3072,6144,cktile,11,0,793.4576,a8w8_blockscale_cktile_192x256x128_4x2x1_16x16x128_intrawave_0x1x0_1,1849.1,625.71,0.0
256,38956,3072,6144,cktile,11,0,804.2195,a8w8_blockscale_cktile_192x256x128_4x2x1_16x16x128_intrawave_0x1x0_1,1828.53,618.69,0.0
256,38959,3072,6144,cktile,11,0,798.5613,a8w8_blockscale_cktile_192x256x128_4x2x1_16x16x128_intrawave_0x1x0_1,1841.63,623.12,0.0
256,38988,3072,6144,cktile,11,0,793.7668,a8w8_blockscale_cktile_192x256x128_4x2x1_16x16x128_intrawave_0x1x0_1,1854.13,627.34,0.0
256,38993,3072,6144,cktile,11,0,798.0976,a8w8_blockscale_cktile_192x256x128_4x2x1_16x16x128_intrawave_0x1x0_1,1844.31,624.01,0.0
256,39088,3072,6144,cktile,11,0,788.7957,a8w8_blockscale_cktile_192x256x128_4x2x1_16x16x128_intrawave_0x1x0_1,1870.6,632.85,0.0
256,39284,3072,3072,cktile,11,0,479.8832,a8w8_blockscale_cktile_192x256x128_4x2x1_16x16x128_intrawave_0x1x0_1,1545.09,774.1,0.0
256,39723,3072,6144,cktile,11,0,800.3609,a8w8_blockscale_cktile_192x256x128_4x2x1_16x16x128_intrawave_0x1x0_1,1873.52,633.45,0.0
256,39980,3072,3072,cktile,11,0,479.8384,a8w8_blockscale_cktile_192x256x128_4x2x1_16x16x128_intrawave_0x1x0_1,1572.61,787.54,0.0
256,40000,3072,6144,cktile,11,0,819.4659,a8w8_blockscale_cktile_192x256x128_4x2x1_16x16x128_intrawave_0x1x0_1,1842.6,622.84,0.0
256,40004,3072,6144,cktile,11,0,806.0315,a8w8_blockscale_cktile_192x256x128_4x2x1_16x16x128_intrawave_0x1x0_1,1873.5,633.28,0.0
256,40009,3072,6144,cktile,11,0,817.8046,a8w8_blockscale_cktile_192x256x128_4x2x1_16x16x128_intrawave_0x1x0_1,1846.76,624.24,0.0
256,40013,3072,6144,cktile,11,0,813.6639,a8w8_blockscale_cktile_192x256x128_4x2x1_16x16x128_intrawave_0x1x0_1,1856.34,627.48,0.0
256,40015,3072,6144,cktile,11,0,801.3538,a8w8_blockscale_cktile_192x256x128_4x2x1_16x16x128_intrawave_0x1x0_1,1884.95,637.15,0.0
256,40074,3072,6144,cktile,11,0,822.5712,a8w8_blockscale_cktile_192x256x128_4x2x1_16x16x128_intrawave_0x1x0_1,1839.04,621.59,0.0
256,40081,3072,6144,cktile,11,0,813.0583,a8w8_blockscale_cktile_192x256x128_4x2x1_16x16x128_intrawave_0x1x0_1,1860.88,628.97,0.0
256,40092,3072,6144,cktile,11,0,816.6761,a8w8_blockscale_cktile_192x256x128_4x2x1_16x16x128_intrawave_0x1x0_1,1853.15,626.35,0.0
256,40130,3072,6144,cktile,11,0,786.3932,a8w8_blockscale_cktile_192x256x128_4x2x1_16x16x128_intrawave_0x1x0_1,1926.34,651.06,0.0
256,40148,3072,6144,cktile,11,0,808.1409,a8w8_blockscale_cktile_192x256x128_4x2x1_16x16x128_intrawave_0x1x0_1,1875.34,633.82,0.0
256,40155,3072,6144,cktile,11,0,802.4195,a8w8_blockscale_cktile_192x256x128_4x2x1_16x16x128_intrawave_0x1x0_1,1889.04,638.44,0.0
256,40157,3072,6144,cktile,11,0,802.7686,a8w8_blockscale_cktile_192x256x128_4x2x1_16x16x128_intrawave_0x1x0_1,1888.31,638.2,0.0
256,40164,3072,6144,cktile,11,0,803.9521,a8w8_blockscale_cktile_192x256x128_4x2x1_16x16x128_intrawave_0x1x0_1,1885.86,637.36,0.0
256,40222,3072,6144,cktile,11,0,808.6605,a8w8_blockscale_cktile_192x256x128_4x2x1_16x16x128_intrawave_0x1x0_1,1877.59,634.53,0.0
256,40288,3072,6144,cktile,11,0,802.2359,a8w8_blockscale_cktile_192x256x128_4x2x1_16x16x128_intrawave_0x1x0_1,1895.73,640.63,0.0
256,40364,3072,6144,cktile,11,0,808.7427,a8w8_blockscale_cktile_192x256x128_4x2x1_16x16x128_intrawave_0x1x0_1,1884.02,636.63,0.0
256,40373,3072,6144,cktile,11,0,802.5902,a8w8_blockscale_cktile_192x256x128_4x2x1_16x16x128_intrawave_0x1x0_1,1898.89,641.64,0.0
256,40384,3072,6144,cktile,11,0,811.4964,a8w8_blockscale_cktile_192x256x128_4x2x1_16x16x128_intrawave_0x1x0_1,1878.56,634.77,0.0
256,40395,3072,6144,cktile,11,0,808.9053,a8w8_blockscale_cktile_192x256x128_4x2x1_16x16x128_intrawave_0x1x0_1,1885.09,636.97,0.0
256,40405,3072,6144,cktile,11,0,803.6978,a8w8_blockscale_cktile_192x256x128_4x2x1_16x16x128_intrawave_0x1x0_1,1897.78,641.25,0.0
256,40413,3072,6144,cktile,11,0,807.4813,a8w8_blockscale_cktile_192x256x128_4x2x1_16x16x128_intrawave_0x1x0_1,1889.26,638.37,0.0
256,40476,3072,3072,cktile,11,0,477.0672,a8w8_blockscale_cktile_192x256x128_4x2x1_16x16x128_intrawave_0x1x0_1,1601.37,801.7,0.0
256,40715,3072,3072,cktile,11,0,480.3028,a8w8_blockscale_cktile_192x256x128_4x2x1_16x16x128_intrawave_0x1x0_1,1599.97,800.88,0.0
256,41215,3072,3072,cktile,11,0,483.6474,a8w8_blockscale_cktile_192x256x128_4x2x1_16x16x128_intrawave_0x1x0_1,1608.42,804.87,0.0
256,41307,3072,3072,cktile,11,0,499.0494,a8w8_blockscale_cktile_192x256x128_4x2x1_16x16x128_intrawave_0x1x0_1,1562.26,781.73,0.0
256,42387,3072,3072,cktile,11,0,519.8813,a8w8_blockscale_cktile_192x256x128_4x2x1_16x16x128_intrawave_0x1x0_1,1538.87,769.55,0.0
256,42405,3072,3072,cktile,11,0,516.3438,a8w8_blockscale_cktile_192x256x128_4x2x1_16x16x128_intrawave_0x1x0_1,1550.07,775.15,0.0
256,42707,3072,3072,cktile,11,0,519.1901,a8w8_blockscale_cktile_192x256x128_4x2x1_16x16x128_intrawave_0x1x0_1,1552.55,776.26,0.0
256,42723,3072,6144,cktile,11,0,878.5519,a8w8_blockscale_cktile_192x256x128_4x2x1_16x16x128_intrawave_0x1x0_1,1835.68,619.04,0.0
256,43085,3072,6144,cktile,11,0,892.4771,a8w8_blockscale_cktile_192x256x128_4x2x1_16x16x128_intrawave_0x1x0_1,1822.35,614.36,0.0
256,43337,3072,3072,cktile,11,0,524.0946,a8w8_blockscale_cktile_192x256x128_4x2x1_16x16x128_intrawave_0x1x0_1,1560.71,780.07,0.0
256,43991,3072,6144,cktile,11,0,867.2802,a8w8_blockscale_cktile_192x256x128_4x2x1_16x16x128_intrawave_0x1x0_1,1914.73,645.05,0.0
256,44084,3072,6144,cktile,11,0,890.3673,a8w8_blockscale_cktile_192x256x128_4x2x1_16x16x128_intrawave_0x1x0_1,1869.02,629.6,0.0
256,44313,3072,3072,cktile,11,0,529.5778,a8w8_blockscale_cktile_192x256x128_4x2x1_16x16x128_intrawave_0x1x0_1,1579.33,788.98,0.0
256,44477,3072,6144,cktile,11,0,895.8411,a8w8_blockscale_cktile_192x256x128_4x2x1_16x16x128_intrawave_0x1x0_1,1874.16,631.15,0.0
256,45002,3072,3072,cktile,11,0,525.4868,a8w8_blockscale_cktile_192x256x128_4x2x1_16x16x128_intrawave_0x1x0_1,1616.38,807.21,0.0
256,45055,3072,6144,cktile,11,0,903.883,a8w8_blockscale_cktile_192x256x128_4x2x1_16x16x128_intrawave_0x1x0_1,1881.63,633.39,0.0
256,45073,3072,6144,cktile,11,0,878.3174,a8w8_blockscale_cktile_192x256x128_4x2x1_16x16x128_intrawave_0x1x0_1,1937.17,652.08,0.0
256,45224,3072,3072,cktile,11,0,526.6338,a8w8_blockscale_cktile_192x256x128_4x2x1_16x16x128_intrawave_0x1x0_1,1620.81,809.33,0.0
256,45599,3072,6144,cktile,11,0,911.7466,a8w8_blockscale_cktile_192x256x128_4x2x1_16x16x128_intrawave_0x1x0_1,1887.92,635.26,0.0
256,46082,3072,3072,cktile,11,0,563.8127,a8w8_blockscale_cktile_192x256x128_4x2x1_16x16x128_intrawave_0x1x0_1,1542.66,769.99,0.0
256,47559,3072,6144,cktile,11,0,963.5756,a8w8_blockscale_cktile_192x256x128_4x2x1_16x16x128_intrawave_0x1x0_1,1863.16,626.08,0.0
256,47737,3072,6144,cktile,11,0,942.4597,a8w8_blockscale_cktile_192x256x128_4x2x1_16x16x128_intrawave_0x1x0_1,1912.03,642.43,0.0
256,47900,3072,3072,cktile,11,0,575.1332,a8w8_blockscale_cktile_192x256x128_4x2x1_16x16x128_intrawave_0x1x0_1,1571.95,783.96,0.0
256,47925,3072,3072,cktile,11,0,575.3396,a8w8_blockscale_cktile_192x256x128_4x2x1_16x16x128_intrawave_0x1x0_1,1572.21,784.08,0.0
256,47996,3072,3072,cktile,11,0,574.548,a8w8_blockscale_cktile_192x256x128_4x2x1_16x16x128_intrawave_0x1x0_1,1576.71,786.3,0.0
256,48080,3072,6144,cktile,11,0,970.2725,a8w8_blockscale_cktile_192x256x128_4x2x1_16x16x128_intrawave_0x1x0_1,1870.57,628.36,0.0
256,48137,3072,3072,cktile,11,0,571.9961,a8w8_blockscale_cktile_192x256x128_4x2x1_16x16x128_intrawave_0x1x0_1,1588.39,792.08,0.0
256,48310,3072,6144,cktile,11,0,962.9864,a8w8_blockscale_cktile_192x256x128_4x2x1_16x16x128_intrawave_0x1x0_1,1893.74,636.05,0.0
256,48329,3072,3072,cktile,11,0,573.6383,a8w8_blockscale_cktile_192x256x128_4x2x1_16x16x128_intrawave_0x1x0_1,1590.16,792.9,0.0
256,48530,3072,3072,cktile,11,0,567.9893,a8w8_blockscale_cktile_192x256x128_4x2x1_16x16x128_intrawave_0x1x0_1,1612.66,804.05,0.0
256,48957,3072,6144,cktile,11,0,967.6663,a8w8_blockscale_cktile_192x256x128_4x2x1_16x16x128_intrawave_0x1x0_1,1909.82,641.19,0.0
256,48982,3072,6144,cktile,11,0,957.4032,a8w8_blockscale_cktile_192x256x128_4x2x1_16x16x128_intrawave_0x1x0_1,1931.27,648.38,0.0
256,48989,3072,6144,cktile,11,0,954.662,a8w8_blockscale_cktile_192x256x128_4x2x1_16x16x128_intrawave_0x1x0_1,1937.1,650.34,0.0
256,49527,3072,3072,cktile,11,0,589.9522,a8w8_blockscale_cktile_192x256x128_4x2x1_16x16x128_intrawave_0x1x0_1,1584.52,789.69,0.0
256,49559,3072,3072,cktile,11,0,592.9482,a8w8_blockscale_cktile_192x256x128_4x2x1_16x16x128_intrawave_0x1x0_1,1577.53,786.2,0.0
256,50001,3072,3072,cktile,11,0,597.3474,a8w8_blockscale_cktile_192x256x128_4x2x1_16x16x128_intrawave_0x1x0_1,1579.88,787.22,0.0
256,50001,3072,6144,cktile,11,0,1047.528,a8w8_blockscale_cktile_192x256x128_4x2x1_16x16x128_intrawave_0x1x0_1,1801.84,604.55,0.0
256,50002,3072,3072,cktile,11,0,597.2775,a8w8_blockscale_cktile_192x256x128_4x2x1_16x16x128_intrawave_0x1x0_1,1580.1,787.33,0.0
256,50003,3072,6144,cktile,11,0,1021.4868,a8w8_blockscale_cktile_192x256x128_4x2x1_16x16x128_intrawave_0x1x0_1,1847.85,619.99,0.0
256,50007,3072,6144,cktile,11,0,1002.9797,a8w8_blockscale_cktile_192x256x128_4x2x1_16x16x128_intrawave_0x1x0_1,1882.09,631.48,0.0
256,50011,3072,6144,cktile,11,0,1025.6221,a8w8_blockscale_cktile_192x256x128_4x2x1_16x16x128_intrawave_0x1x0_1,1840.69,617.59,0.0
256,50014,3072,6144,cktile,11,0,1040.3079,a8w8_blockscale_cktile_192x256x128_4x2x1_16x16x128_intrawave_0x1x0_1,1814.81,608.9,0.0
256,50020,3072,6144,cktile,11,0,1028.4153,a8w8_blockscale_cktile_192x256x128_4x2x1_16x16x128_intrawave_0x1x0_1,1836.02,616.02,0.0
256,50022,3072,6144,cktile,11,0,1032.9524,a8w8_blockscale_cktile_192x256x128_4x2x1_16x16x128_intrawave_0x1x0_1,1828.03,613.33,0.0
256,50033,3072,6144,cktile,11,0,1036.8895,a8w8_blockscale_cktile_192x256x128_4x2x1_16x16x128_intrawave_0x1x0_1,1821.49,611.14,0.0
256,50043,3072,6144,cktile,11,0,1029.083,a8w8_blockscale_cktile_192x256x128_4x2x1_16x16x128_intrawave_0x1x0_1,1835.67,615.89,0.0
256,50047,3072,6144,cktile,11,0,1053.3201,a8w8_blockscale_cktile_192x256x128_4x2x1_16x16x128_intrawave_0x1x0_1,1793.58,601.77,0.0
256,50051,3072,6144,cktile,11,0,1026.3598,a8w8_blockscale_cktile_192x256x128_4x2x1_16x16x128_intrawave_0x1x0_1,1840.84,617.62,0.0
256,50111,3072,3072,cktile,11,0,612.9369,a8w8_blockscale_cktile_192x256x128_4x2x1_16x16x128_intrawave_0x1x0_1,1543.08,768.86,0.0
256,50150,3072,6144,cktile,11,0,1019.0734,a8w8_blockscale_cktile_192x256x128_4x2x1_16x16x128_intrawave_0x1x0_1,1857.67,623.23,0.0
256,50161,3072,6144,cktile,11,0,1039.8971,a8w8_blockscale_cktile_192x256x128_4x2x1_16x16x128_intrawave_0x1x0_1,1820.87,610.88,0.0
256,50218,3072,6144,cktile,11,0,1037.8615,a8w8_blockscale_cktile_192x256x128_4x2x1_16x16x128_intrawave_0x1x0_1,1826.51,612.75,0.0
256,50225,3072,6144,cktile,11,0,1031.3844,a8w8_blockscale_cktile_192x256x128_4x2x1_16x16x128_intrawave_0x1x0_1,1838.24,616.68,0.0
256,50234,3072,6144,cktile,11,0,1045.4051,a8w8_blockscale_cktile_192x256x128_4x2x1_16x16x128_intrawave_0x1x0_1,1813.91,608.52,0.0
256,50294,3072,6144,cktile,11,0,1055.6765,a8w8_blockscale_cktile_192x256x128_4x2x1_16x16x128_intrawave_0x1x0_1,1798.41,603.3,0.0
256,50302,3072,6144,cktile,11,0,1050.1558,a8w8_blockscale_cktile_192x256x128_4x2x1_16x16x128_intrawave_0x1x0_1,1808.15,606.56,0.0
256,50359,3072,6144,cktile,11,0,1022.9953,a8w8_blockscale_cktile_192x256x128_4x2x1_16x16x128_intrawave_0x1x0_1,1858.26,623.35,0.0
256,50435,3072,6144,cktile,11,0,1057.5429,a8w8_blockscale_cktile_192x256x128_4x2x1_16x16x128_intrawave_0x1x0_1,1800.27,603.87,0.0
256,50681,3072,6144,cktile,11,0,1061.3799,a8w8_blockscale_cktile_192x256x128_4x2x1_16x16x128_intrawave_0x1x0_1,1802.51,604.54,0.0
256,51074,3072,6144,cktile,11,0,1048.3858,a8w8_blockscale_cktile_192x256x128_4x2x1_16x16x128_intrawave_0x1x0_1,1839.0,616.64,0.0
256,52991,3072,3072,cktile,11,0,611.5389,a8w8_blockscale_cktile_192x256x128_4x2x1_16x16x128_intrawave_0x1x0_1,1635.5,814.02,0.0
256,53073,3072,3072,cktile,11,0,617.8349,a8w8_blockscale_cktile_192x256x128_4x2x1_16x16x128_intrawave_0x1x0_1,1621.34,806.94,0.0
256,53093,3072,3072,cktile,11,0,618.4665,a8w8_blockscale_cktile_192x256x128_4x2x1_16x16x128_intrawave_0x1x0_1,1620.29,806.42,0.0
256,53126,3072,3072,cktile,11,0,612.9432,a8w8_blockscale_cktile_192x256x128_4x2x1_16x16x128_intrawave_0x1x0_1,1635.91,814.18,0.0
256,53264,3072,3072,cktile,11,0,617.8492,a8w8_blockscale_cktile_192x256x128_4x2x1_16x16x128_intrawave_0x1x0_1,1627.14,809.77,0.0
256,53520,3072,3072,cktile,11,0,617.0777,a8w8_blockscale_cktile_192x256x128_4x2x1_16x16x128_intrawave_0x1x0_1,1637.0,814.61,0.0
256,53570,3072,6144,cktile,11,0,1083.8149,a8w8_blockscale_cktile_192x256x128_4x2x1_16x16x128_intrawave_0x1x0_1,1865.82,624.78,0.0
256,53579,3072,3072,cktile,11,0,631.6983,a8w8_blockscale_cktile_192x256x128_4x2x1_16x16x128_intrawave_0x1x0_1,1600.87,796.62,0.0
256,53701,3072,3072,cktile,11,0,614.6637,a8w8_blockscale_cktile_192x256x128_4x2x1_16x16x128_intrawave_0x1x0_1,1648.99,820.52,0.0
256,53956,3072,3072,cktile,11,0,629.2802,a8w8_blockscale_cktile_192x256x128_4x2x1_16x16x128_intrawave_0x1x0_1,1618.33,805.2,0.0
256,53979,3072,6144,cktile,11,0,1100.8277,a8w8_blockscale_cktile_192x256x128_4x2x1_16x16x128_intrawave_0x1x0_1,1851.01,619.69,0.0
256,53987,3072,6144,cktile,11,0,1113.1712,a8w8_blockscale_cktile_192x256x128_4x2x1_16x16x128_intrawave_0x1x0_1,1830.75,612.9,0.0
256,54074,3072,6144,cktile,11,0,1069.479,a8w8_blockscale_cktile_192x256x128_4x2x1_16x16x128_intrawave_0x1x0_1,1908.62,638.94,0.0
256,54477,3072,6144,cktile,11,0,1138.7167,a8w8_blockscale_cktile_192x256x128_4x2x1_16x16x128_intrawave_0x1x0_1,1805.93,604.44,0.0
256,54478,3072,6144,cktile,11,0,1104.0107,a8w8_blockscale_cktile_192x256x128_4x2x1_16x16x128_intrawave_0x1x0_1,1862.73,623.45,0.0
256,55001,3072,3072,cktile,11,0,652.4471,a8w8_blockscale_cktile_192x256x128_4x2x1_16x16x128_intrawave_0x1x0_1,1591.1,791.37,0.0
256,55004,3072,3072,cktile,11,0,652.1466,a8w8_blockscale_cktile_192x256x128_4x2x1_16x16x128_intrawave_0x1x0_1,1591.92,791.78,0.0
256,55005,3072,3072,cktile,11,0,647.6756,a8w8_blockscale_cktile_192x256x128_4x2x1_16x16x128_intrawave_0x1x0_1,1602.94,797.26,0.0
256,55027,3072,3072,cktile,11,0,662.1463,a8w8_blockscale_cktile_192x256x128_4x2x1_16x16x128_intrawave_0x1x0_1,1568.54,780.14,0.0
256,55066,3072,6144,cktile,11,0,1124.8893,a8w8_blockscale_cktile_192x256x128_4x2x1_16x16x128_intrawave_0x1x0_1,1847.89,618.31,0.0
256,55072,3072,6144,cktile,11,0,1138.0103,a8w8_blockscale_cktile_192x256x128_4x2x1_16x16x128_intrawave_0x1x0_1,1826.78,611.24,0.0
256,55086,3072,6144,cktile,11,0,1125.914,a8w8_blockscale_cktile_192x256x128_4x2x1_16x16x128_intrawave_0x1x0_1,1846.88,617.96,0.0
256,55113,3072,6144,cktile,11,0,1145.9888,a8w8_blockscale_cktile_192x256x128_4x2x1_16x16x128_intrawave_0x1x0_1,1815.42,607.43,0.0
256,55172,3072,6144,cktile,11,0,1140.1528,a8w8_blockscale_cktile_192x256x128_4x2x1_16x16x128_intrawave_0x1x0_1,1826.66,611.17,0.0
256,55175,3072,6144,cktile,11,0,1117.093,a8w8_blockscale_cktile_192x256x128_4x2x1_16x16x128_intrawave_0x1x0_1,1864.47,623.82,0.0
256,55183,3072,6144,cktile,11,0,1117.9784,a8w8_blockscale_cktile_192x256x128_4x2x1_16x16x128_intrawave_0x1x0_1,1863.26,623.41,0.0
256,55197,3072,6144,cktile,11,0,1124.4288,a8w8_blockscale_cktile_192x256x128_4x2x1_16x16x128_intrawave_0x1x0_1,1853.04,619.99,0.0
256,55223,3072,6144,cktile,11,0,1120.637,a8w8_blockscale_cktile_192x256x128_4x2x1_16x16x128_intrawave_0x1x0_1,1860.19,622.37,0.0
256,55349,3072,6144,cktile,11,0,1127.7835,a8w8_blockscale_cktile_192x256x128_4x2x1_16x16x128_intrawave_0x1x0_1,1852.62,619.8,0.0
256,55549,3072,6144,cktile,11,0,1136.4029,a8w8_blockscale_cktile_192x256x128_4x2x1_16x16x128_intrawave_0x1x0_1,1845.21,617.26,0.0
256,56072,3072,6144,cktile,11,0,1132.0578,a8w8_blockscale_cktile_192x256x128_4x2x1_16x16x128_intrawave_0x1x0_1,1869.73,625.31,0.0
256,56131,3072,3072,cktile,11,0,668.8224,a8w8_blockscale_cktile_192x256x128_4x2x1_16x16x128_intrawave_0x1x0_1,1584.03,787.56,0.0
256,57008,3072,6144,cktile,11,0,1124.5875,a8w8_blockscale_cktile_192x256x128_4x2x1_16x16x128_intrawave_0x1x0_1,1913.57,639.69,0.0
256,57100,3072,3072,cktile,11,0,658.5223,a8w8_blockscale_cktile_192x256x128_4x2x1_16x16x128_intrawave_0x1x0_1,1636.58,813.44,0.0
256,57390,3072,6144,cktile,11,0,1110.709,a8w8_blockscale_cktile_192x256x128_4x2x1_16x16x128_intrawave_0x1x0_1,1950.47,651.91,0.0
256,58563,3072,3072,cktile,11,0,697.1845,a8w8_blockscale_cktile_192x256x128_4x2x1_16x16x128_intrawave_0x1x0_1,1585.43,787.67,0.0
256,58985,3072,6144,cktile,11,0,1192.716,a8w8_blockscale_cktile_192x256x128_4x2x1_16x16x128_intrawave_0x1x0_1,1866.84,623.52,0.0
256,58986,3072,6144,cktile,11,0,1175.9805,a8w8_blockscale_cktile_192x256x128_4x2x1_16x16x128_intrawave_0x1x0_1,1893.44,632.4,0.0
256,59012,3072,6144,cktile,11,0,1214.8953,a8w8_blockscale_cktile_192x256x128_4x2x1_16x16x128_intrawave_0x1x0_1,1833.6,612.41,0.0
256,59069,3072,3072,cktile,11,0,706.7934,a8w8_blockscale_cktile_192x256x128_4x2x1_16x16x128_intrawave_0x1x0_1,1577.39,783.56,0.0
256,60001,3072,6144,cktile,11,0,1213.8129,a8w8_blockscale_cktile_192x256x128_4x2x1_16x16x128_intrawave_0x1x0_1,1865.99,622.97,0.0
256,60002,3072,3072,cktile,11,0,711.8609,a8w8_blockscale_cktile_192x256x128_4x2x1_16x16x128_intrawave_0x1x0_1,1590.9,790.06,0.0
256,60003,3072,6144,cktile,11,0,1226.645,a8w8_blockscale_cktile_192x256x128_4x2x1_16x16x128_intrawave_0x1x0_1,1846.53,616.47,0.0
256,60004,3072,3072,cktile,11,0,720.9291,a8w8_blockscale_cktile_192x256x128_4x2x1_16x16x128_intrawave_0x1x0_1,1570.94,780.15,0.0
256,60004,3072,6144,cktile,11,0,1214.4349,a8w8_blockscale_cktile_192x256x128_4x2x1_16x16x128_intrawave_0x1x0_1,1865.13,622.68,0.0
256,60006,3072,6144,cktile,11,0,1200.4213,a8w8_blockscale_cktile_192x256x128_4x2x1_16x16x128_intrawave_0x1x0_1,1886.96,629.97,0.0
256,60012,3072,3072,cktile,11,0,713.5869,a8w8_blockscale_cktile_192x256x128_4x2x1_16x16x128_intrawave_0x1x0_1,1587.32,788.28,0.0
256,60014,3072,6144,cktile,11,0,1224.1286,a8w8_blockscale_cktile_192x256x128_4x2x1_16x16x128_intrawave_0x1x0_1,1850.67,617.85,0.0
256,60025,3072,6144,cktile,11,0,1221.7942,a8w8_blockscale_cktile_192x256x128_4x2x1_16x16x128_intrawave_0x1x0_1,1854.54,619.14,0.0
256,60026,3072,3072,cktile,11,0,714.1565,a8w8_blockscale_cktile_192x256x128_4x2x1_16x16x128_intrawave_0x1x0_1,1586.42,787.83,0.0
256,60029,3072,6144,cktile,11,0,1221.6982,a8w8_blockscale_cktile_192x256x128_4x2x1_16x16x128_intrawave_0x1x0_1,1854.81,619.23,0.0
256,60065,3072,6144,cktile,11,0,1190.8662,a8w8_blockscale_cktile_192x256x128_4x2x1_16x16x128_intrawave_0x1x0_1,1903.97,635.63,0.0
256,60070,3072,6144,cktile,11,0,1185.5578,a8w8_blockscale_cktile_192x256x128_4x2x1_16x16x128_intrawave_0x1x0_1,1912.66,638.53,0.0
256,60076,3072,6144,cktile,11,0,1206.1856,a8w8_blockscale_cktile_192x256x128_4x2x1_16x16x128_intrawave_0x1x0_1,1880.14,627.67,0.0
256,60132,3072,6144,cktile,11,0,1207.5716,a8w8_blockscale_cktile_192x256x128_4x2x1_16x16x128_intrawave_0x1x0_1,1879.73,627.52,0.0
256,60139,3072,6144,cktile,11,0,1203.6778,a8w8_blockscale_cktile_192x256x128_4x2x1_16x16x128_intrawave_0x1x0_1,1886.03,629.62,0.0
256,60171,3072,6144,cktile,11,0,1228.5262,a8w8_blockscale_cktile_192x256x128_4x2x1_16x16x128_intrawave_0x1x0_1,1848.87,617.21,0.0
256,60189,3072,6144,cktile,11,0,1230.2907,a8w8_blockscale_cktile_192x256x128_4x2x1_16x16x128_intrawave_0x1x0_1,1846.77,616.5,0.0
256,60192,3072,6144,cktile,11,0,1209.7918,a8w8_blockscale_cktile_192x256x128_4x2x1_16x16x128_intrawave_0x1x0_1,1878.15,626.98,0.0
256,60195,3072,6144,cktile,11,0,1234.2231,a8w8_blockscale_cktile_192x256x128_4x2x1_16x16x128_intrawave_0x1x0_1,1841.07,614.6,0.0
256,60221,3072,6144,cktile,11,0,1229.8353,a8w8_blockscale_cktile_192x256x128_4x2x1_16x16x128_intrawave_0x1x0_1,1848.43,617.05,0.0
256,60248,3072,6144,cktile,11,0,1216.9529,a8w8_blockscale_cktile_192x256x128_4x2x1_16x16x128_intrawave_0x1x0_1,1868.84,623.85,0.0
256,60429,3072,6144,cktile,11,0,1198.0614,a8w8_blockscale_cktile_192x256x128_4x2x1_16x16x128_intrawave_0x1x0_1,1904.01,635.55,0.0
256,60685,3072,6144,cktile,11,0,1231.7397,a8w8_blockscale_cktile_192x256x128_4x2x1_16x16x128_intrawave_0x1x0_1,1859.79,620.73,0.0
256,61067,3072,6144,cktile,11,0,1230.294,a8w8_blockscale_cktile_192x256x128_4x2x1_16x16x128_intrawave_0x1x0_1,1873.7,625.27,0.0
256,61447,3072,3072,cktile,11,0,710.6427,a8w8_blockscale_cktile_192x256x128_4x2x1_16x16x128_intrawave_0x1x0_1,1632.01,810.16,0.0
256,61539,3072,3072,cktile,11,0,703.1755,a8w8_blockscale_cktile_192x256x128_4x2x1_16x16x128_intrawave_0x1x0_1,1651.81,819.97,0.0
256,62303,3072,6144,cktile,11,0,1233.2165,a8w8_blockscale_cktile_192x256x128_4x2x1_16x16x128_intrawave_0x1x0_1,1907.09,636.1,0.0
256,62341,3072,6144,cktile,11,0,1287.1417,a8w8_blockscale_cktile_192x256x128_4x2x1_16x16x128_intrawave_0x1x0_1,1828.31,609.82,0.0
256,64005,3072,3072,cktile,11,0,763.4672,a8w8_blockscale_cktile_192x256x128_4x2x1_16x16x128_intrawave_0x1x0_1,1582.33,784.98,0.0
256,64071,3072,6144,cktile,11,0,1312.1993,a8w8_blockscale_cktile_192x256x128_4x2x1_16x16x128_intrawave_0x1x0_1,1843.16,614.37,0.0
256,64476,3072,6144,cktile,11,0,1289.7288,a8w8_blockscale_cktile_192x256x128_4x2x1_16x16x128_intrawave_0x1x0_1,1887.13,628.93,0.0
256,64477,3072,6144,cktile,11,0,1278.2302,a8w8_blockscale_cktile_192x256x128_4x2x1_16x16x128_intrawave_0x1x0_1,1904.14,634.6,0.0
256,64492,3072,6144,cktile,11,0,1288.7403,a8w8_blockscale_cktile_192x256x128_4x2x1_16x16x128_intrawave_0x1x0_1,1889.05,629.57,0.0
256,64494,3072,6144,cktile,11,0,1284.5902,a8w8_blockscale_cktile_192x256x128_4x2x1_16x16x128_intrawave_0x1x0_1,1895.21,631.62,0.0
256,64507,3072,3072,cktile,11,0,760.5907,a8w8_blockscale_cktile_192x256x128_4x2x1_16x16x128_intrawave_0x1x0_1,1600.77,794.03,0.0
256,64564,3072,6144,cktile,11,0,1290.2748,a8w8_blockscale_cktile_192x256x128_4x2x1_16x16x128_intrawave_0x1x0_1,1888.91,629.51,0.0
256,64616,3072,3072,cktile,11,0,762.0747,a8w8_blockscale_cktile_192x256x128_4x2x1_16x16x128_intrawave_0x1x0_1,1600.35,793.8,0.0
256,64768,3072,6144,cktile,11,0,1292.5877,a8w8_blockscale_cktile_192x256x128_4x2x1_16x16x128_intrawave_0x1x0_1,1891.48,630.32,0.0
256,64872,3072,3072,cktile,11,0,766.825,a8w8_blockscale_cktile_192x256x128_4x2x1_16x16x128_intrawave_0x1x0_1,1596.74,791.96,0.0
256,64899,3072,6144,cktile,11,0,1295.7769,a8w8_blockscale_cktile_192x256x128_4x2x1_16x16x128_intrawave_0x1x0_1,1890.65,630.01,0.0
256,65002,3072,6144,cktile,11,0,1298.702,a8w8_blockscale_cktile_192x256x128_4x2x1_16x16x128_intrawave_0x1x0_1,1889.38,629.57,0.0
256,65015,3072,6144,cktile,11,0,1305.9639,a8w8_blockscale_cktile_192x256x128_4x2x1_16x16x128_intrawave_0x1x0_1,1879.25,626.19,0.0
256,65089,3072,3072,cktile,11,0,761.0536,a8w8_blockscale_cktile_192x256x128_4x2x1_16x16x128_intrawave_0x1x0_1,1614.23,800.6,0.0
256,65092,3072,3072,cktile,11,0,768.0883,a8w8_blockscale_cktile_192x256x128_4x2x1_16x16x128_intrawave_0x1x0_1,1599.52,793.3,0.0
256,65102,3072,3072,cktile,11,0,761.4954,a8w8_blockscale_cktile_192x256x128_4x2x1_16x16x128_intrawave_0x1x0_1,1613.61,800.29,0.0
256,65126,3072,3072,cktile,11,0,766.7531,a8w8_blockscale_cktile_192x256x128_4x2x1_16x16x128_intrawave_0x1x0_1,1603.14,795.09,0.0
256,65316,3072,3072,cktile,11,0,754.5322,a8w8_blockscale_cktile_192x256x128_4x2x1_16x16x128_intrawave_0x1x0_1,1633.86,810.29,0.0
256,65317,3072,3072,cktile,11,0,755.2246,a8w8_blockscale_cktile_192x256x128_4x2x1_16x16x128_intrawave_0x1x0_1,1632.38,809.56,0.0
256,65339,3072,3072,cktile,11,0,757.4171,a8w8_blockscale_cktile_192x256x128_4x2x1_16x16x128_intrawave_0x1x0_1,1628.21,807.48,0.0
256,65348,3072,3072,cktile,11,0,754.9897,a8w8_blockscale_cktile_192x256x128_4x2x1_16x16x128_intrawave_0x1x0_1,1633.67,810.19,0.0
256,65536,3072,3072,cktile,11,0,750.8178,a8w8_blockscale_cktile_192x256x128_4x2x1_16x16x128_intrawave_0x1x0_1,1647.47,817.0,0.0
256,65536,3072,6144,cktile,11,0,1276.2108,a8w8_blockscale_cktile_192x256x128_4x2x1_16x16x128_intrawave_0x1x0_1,1938.47,645.8,0.0
256,1,4096,3072,ck,8,0,10.3263,a8w8_blockscale_1x128x128_256x16x64x256_16x16_16x16_1x1_16x16x1_16x16x1_1x16x1x16_4_1x1_intrawave_v1,2.44,1219.62,0.0
256,2,4096,3072,ck,8,0,10.3505,a8w8_blockscale_1x128x128_256x16x64x256_16x16_16x16_1x1_16x16x1_16x16x1_1x16x1x16_4_1x1_intrawave_v1,4.86,1217.86,0.0
256,4,4096,3072,ck,8,0,10.462,a8w8_blockscale_1x128x128_256x16x64x256_16x16_16x16_1x1_16x16x1_16x16x1_1x16x1x16_4_1x1_intrawave_v1,9.62,1207.03,0.0
256,8,4096,3072,ck,8,0,10.4862,a8w8_blockscale_1x128x128_256x16x64x256_16x16_16x16_1x1_16x16x1_16x16x1_1x16x1x16_4_1x1_intrawave_v1,19.2,1208.54,0.0
256,16,4096,3072,ck,8,0,10.0129,a8w8_blockscale_1x128x128_256x16x64x256_16x16_16x16_1x1_16x16x1_16x16x1_1x16x1x16_4_1x1_intrawave_v1,40.21,1274.67,0.0
256,24,4096,3072,ck,8,0,10.6775,a8w8_blockscale_1x128x128_256x16x64x256_16x16_16x16_1x1_16x16x1_16x16x1_1x16x1x16_4_1x1_intrawave_v1,56.57,1203.77,0.0
256,32,4096,3072,ck,8,0,10.6296,a8w8_blockscale_1x128x128_256x16x64x256_16x16_16x16_1x1_16x16x1_16x16x1_1x16x1x16_4_1x1_intrawave_v1,75.76,1217.67,0.0
256,40,4096,3072,ck,8,0,10.6771,a8w8_blockscale_1x128x128_256x16x64x256_16x16_16x16_1x1_16x16x1_16x16x1_1x16x1x16_4_1x1_intrawave_v1,94.28,1220.69,0.0
256,48,4096,3072,ck,8,0,10.3028,a8w8_blockscale_1x128x128_256x16x64x256_16x16_16x16_1x1_16x16x1_16x16x1_1x16x1x16_4_1x1_intrawave_v1,117.25,1273.79,0.0
256,56,4096,3072,ck,8,0,10.8121,a8w8_blockscale_1x128x128_256x16x64x256_16x16_16x16_1x1_16x16x1_16x16x1_1x16x1x16_4_1x1_intrawave_v1,130.34,1222.12,0.0
256,64,4096,3072,ck,8,0,10.2119,a8w8_blockscale_1x128x128_256x16x64x256_16x16_16x16_1x1_16x16x1_16x16x1_1x16x1x16_4_1x1_intrawave_v1,157.72,1302.77,0.0
256,72,4096,3072,ck,7,0,13.3701,a8w8_blockscale_1x128x128_256x16x128x256_16x16_16x16_1x2_16x16x1_16x16x1_1x16x1x16_8_1x2_intrawave_v1,135.52,1001.78,0.0
256,80,4096,3072,ck,7,0,13.0601,a8w8_blockscale_1x128x128_256x16x128x256_16x16_16x16_1x2_16x16x1_16x16x1_1x16x1x16_8_1x2_intrawave_v1,154.15,1032.46,0.0
256,88,4096,3072,ck,7,0,13.0841,a8w8_blockscale_1x128x128_256x16x128x256_16x16_16x16_1x2_16x16x1_16x16x1_1x16x1x16_8_1x2_intrawave_v1,169.26,1037.45,0.0
256,96,4096,3072,ck,7,0,12.9939,a8w8_blockscale_1x128x128_256x16x128x256_16x16_16x16_1x2_16x16x1_16x16x1_1x16x1x16_8_1x2_intrawave_v1,185.93,1051.59,0.0
256,104,4096,3072,ck,7,0,13.3082,a8w8_blockscale_1x128x128_256x16x128x256_16x16_16x16_1x2_16x16x1_16x16x1_1x16x1x16_8_1x2_intrawave_v1,196.66,1033.53,0.0
256,112,4096,3072,ck,7,0,13.1027,a8w8_blockscale_1x128x128_256x16x128x256_16x16_16x16_1x2_16x16x1_16x16x1_1x16x1x16_8_1x2_intrawave_v1,215.11,1056.61,0.0
256,120,4096,3072,ck,7,0,13.2898,a8w8_blockscale_1x128x128_256x16x128x256_16x16_16x16_1x2_16x16x1_16x16x1_1x16x1x16_8_1x2_intrawave_v1,227.23,1048.52,0.0
256,128,4096,1280,ck,7,0,7.4194,a8w8_blockscale_1x128x128_256x16x128x256_16x16_16x16_1x2_16x16x1_16x16x1_1x16x1x16_8_1x2_intrawave_v1,180.9,870.06,0.0
256,128,4096,3072,ck,7,0,13.0846,a8w8_blockscale_1x128x128_256x16x128x256_16x16_16x16_1x2_16x16x1_16x16x1_1x16x1x16_8_1x2_intrawave_v1,246.18,1071.85,0.0
256,136,4096,3072,ck,18,0,16.1148,a8w8_blockscale_1x128x128_256x64x64x256_16x16_32x32_1x1_16x16x1_16x16x1_1x32x1x8_8_1x1_intrawave_v1,212.39,875.89,0.0
256,144,4096,3072,ck,12,0,16.2392,a8w8_blockscale_1x128x128_256x32x128x256_16x16_32x32_1x1_16x16x1_16x16x1_1x32x1x8_8_1x1_intrawave_v1,223.16,874.73,0.0
256,152,4096,3072,ck,18,0,16.1809,a8w8_blockscale_1x128x128_256x64x64x256_16x16_32x32_1x1_16x16x1_16x16x1_1x32x1x8_8_1x1_intrawave_v1,236.4,883.45,0.0
256,160,4096,3072,ck,12,0,15.0321,a8w8_blockscale_1x128x128_256x32x128x256_16x16_32x32_1x1_16x16x1_16x16x1_1x32x1x8_8_1x1_intrawave_v1,267.86,956.96,0.0
256,168,4096,3072,ck,18,0,16.3105,a8w8_blockscale_1x128x128_256x64x64x256_16x16_32x32_1x1_16x16x1_16x16x1_1x32x1x8_8_1x1_intrawave_v1,259.21,887.48,0.0
256,176,4096,3072,ck,18,0,16.2255,a8w8_blockscale_1x128x128_256x64x64x256_16x16_32x32_1x1_16x16x1_16x16x1_1x32x1x8_8_1x1_intrawave_v1,272.98,897.68,0.0
256,184,4096,3072,ck,18,0,16.2124,a8w8_blockscale_1x128x128_256x64x64x256_16x16_32x32_1x1_16x16x1_16x16x1_1x32x1x8_8_1x1_intrawave_v1,285.62,903.97,0.0
256,192,4096,3072,ck,18,0,13.2771,a8w8_blockscale_1x128x128_256x64x64x256_16x16_32x32_1x1_16x16x1_16x16x1_1x32x1x8_8_1x1_intrawave_v1,363.92,1110.6,0.0
256,200,4096,3072,ck,18,0,16.4387,a8w8_blockscale_1x128x128_256x64x64x256_16x16_32x32_1x1_16x16x1_16x16x1_1x32x1x8_8_1x1_intrawave_v1,306.18,902.49,0.0
256,208,4096,3072,ck,12,0,16.5855,a8w8_blockscale_1x128x128_256x32x128x256_16x16_32x32_1x1_16x16x1_16x16x1_1x32x1x8_8_1x1_intrawave_v1,315.61,899.93,0.0
256,216,4096,3072,ck,18,0,16.6456,a8w8_blockscale_1x128x128_256x64x64x256_16x16_32x32_1x1_16x16x1_16x16x1_1x32x1x8_8_1x1_intrawave_v1,326.56,902.1,0.0
256,224,4096,3072,ck,12,0,15.3636,a8w8_blockscale_1x128x128_256x32x128x256_16x16_32x32_1x1_16x16x1_16x16x1_1x32x1x8_8_1x1_intrawave_v1,366.92,983.24,0.0
256,232,4096,3072,ck,18,0,16.4895,a8w8_blockscale_1x128x128_256x64x64x256_16x16_32x32_1x1_16x16x1_16x16x1_1x32x1x8_8_1x1_intrawave_v1,354.07,921.57,0.0
256,240,4096,3072,ck,18,0,16.5845,a8w8_blockscale_1x128x128_256x64x64x256_16x16_32x32_1x1_16x16x1_16x16x1_1x32x1x8_8_1x1_intrawave_v1,364.18,921.72,0.0
256,248,4096,3072,ck,18,0,16.5951,a8w8_blockscale_1x128x128_256x64x64x256_16x16_32x32_1x1_16x16x1_16x16x1_1x32x1x8_8_1x1_intrawave_v1,376.08,926.56,0.0
256,256,4096,3072,ck,18,0,13.4882,a8w8_blockscale_1x128x128_256x64x64x256_16x16_32x32_1x1_16x16x1_16x16x1_1x32x1x8_8_1x1_intrawave_v1,477.64,1146.67,0.0
256,272,4096,3072,ck,2,0,20.6542,a8w8_blockscale_1x128x128_256x64x128x128_16x16_32x32_1x2_8x32x1_8x32x1_1x32x1x8_8_1x1_intrawave_v3,331.41,757.56,0.0
256,288,4096,3072,ck,2,0,20.8293,a8w8_blockscale_1x128x128_256x64x128x128_16x16_32x32_1x2_8x32x1_8x32x1_1x32x1x8_8_1x1_intrawave_v3,347.96,759.84,0.0
256,304,4096,3072,ck,2,0,20.9445,a8w8_blockscale_1x128x128_256x64x128x128_16x16_32x32_1x2_8x32x1_8x32x1_1x32x1x8_8_1x1_intrawave_v3,365.27,764.27,0.0
256,320,4096,3072,ck,2,0,20.7562,a8w8_blockscale_1x128x128_256x64x128x128_16x16_32x32_1x2_8x32x1_8x32x1_1x32x1x8_8_1x1_intrawave_v3,387.98,779.88,0.0
256,336,4096,3072,ck,2,0,20.6417,a8w8_blockscale_1x128x128_256x64x128x128_16x16_32x32_1x2_8x32x1_8x32x1_1x32x1x8_8_1x1_intrawave_v3,409.64,792.94,0.0
256,352,4096,3072,ck,2,0,20.7457,a8w8_blockscale_1x128x128_256x64x128x128_16x16_32x32_1x2_8x32x1_8x32x1_1x32x1x8_8_1x1_intrawave_v3,427.0,797.65,0.0
256,368,4096,3072,ck,2,0,20.7486,a8w8_blockscale_1x128x128_256x64x128x128_16x16_32x32_1x2_8x32x1_8x32x1_1x32x1x8_8_1x1_intrawave_v3,446.34,806.23,0.0
256,384,4096,3072,ck,2,0,20.6982,a8w8_blockscale_1x128x128_256x64x128x128_16x16_32x32_1x2_8x32x1_8x32x1_1x32x1x8_8_1x1_intrawave_v3,466.88,816.9,0.0
256,400,4096,3072,ck,2,0,20.701,a8w8_blockscale_1x128x128_256x64x128x128_16x16_32x32_1x2_8x32x1_8x32x1_1x32x1x8_8_1x1_intrawave_v3,486.27,825.49,0.0
256,416,4096,3072,ck,2,0,20.8886,a8w8_blockscale_1x128x128_256x64x128x128_16x16_32x32_1x2_8x32x1_8x32x1_1x32x1x8_8_1x1_intrawave_v3,501.18,826.71,0.0
256,432,4096,3072,ck,2,0,20.8914,a8w8_blockscale_1x128x128_256x64x128x128_16x16_32x32_1x2_8x32x1_8x32x1_1x32x1x8_8_1x1_intrawave_v3,520.39,835.22,0.0
256,448,4096,3072,ck,2,0,20.7822,a8w8_blockscale_1x128x128_256x64x128x128_16x16_32x32_1x2_8x32x1_8x32x1_1x32x1x8_8_1x1_intrawave_v3,542.5,848.28,0.0
256,464,4096,3072,ck,2,0,20.8475,a8w8_blockscale_1x128x128_256x64x128x128_16x16_32x32_1x2_8x32x1_8x32x1_1x32x1x8_8_1x1_intrawave_v3,560.11,854.27,0.0
256,480,4096,3072,ck,2,0,21.083,a8w8_blockscale_1x128x128_256x64x128x128_16x16_32x32_1x2_8x32x1_8x32x1_1x32x1x8_8_1x1_intrawave_v3,572.95,853.28,0.0
256,496,4096,3072,ck,2,0,21.0661,a8w8_blockscale_1x128x128_256x64x128x128_16x16_32x32_1x2_8x32x1_8x32x1_1x32x1x8_8_1x1_intrawave_v3,592.53,862.52,0.0
256,512,4096,3072,ck,2,0,20.8363,a8w8_blockscale_1x128x128_256x64x128x128_16x16_32x32_1x2_8x32x1_8x32x1_1x32x1x8_8_1x1_intrawave_v3,618.39,880.68,0.0
256,1000,4096,3072,ck,0,0,28.929,a8w8_blockscale_1x128x128_256x128x128x128_16x16_32x32_2x2_8x32x1_8x32x1_1x32x1x8_8_1x1_intrawave_v3,869.92,824.33,0.0
256,1001,4096,3072,ck,0,0,28.5332,a8w8_blockscale_1x128x128_256x128x128x128_16x16_32x32_2x2_8x32x1_8x32x1_1x32x1x8_8_1x1_intrawave_v3,882.87,836.15,0.0
256,1003,4096,3072,ck,0,0,28.8214,a8w8_blockscale_1x128x128_256x128x128x128_16x16_32x32_2x2_8x32x1_8x32x1_1x32x1x8_8_1x1_intrawave_v3,875.78,828.58,0.0
256,1005,4096,3072,ck,0,0,28.8735,a8w8_blockscale_1x128x128_256x128x128x128_16x16_32x32_2x2_8x32x1_8x32x1_1x32x1x8_8_1x1_intrawave_v3,875.95,827.86,0.0
256,1063,4096,3072,ck,2,0,40.1994,a8w8_blockscale_1x128x128_256x64x128x128_16x16_32x32_1x2_8x32x1_8x32x1_1x32x1x8_8_1x1_intrawave_v3,665.46,610.87,0.0
256,1095,4096,3072,ck,2,0,39.2361,a8w8_blockscale_1x128x128_256x64x128x128_16x16_32x32_1x2_8x32x1_8x32x1_1x32x1x8_8_1x1_intrawave_v3,702.33,635.05,0.0
256,1123,4096,3072,ck,2,0,38.7086,a8w8_blockscale_1x128x128_256x64x128x128_16x16_32x32_1x2_8x32x1_8x32x1_1x32x1x8_8_1x1_intrawave_v3,730.1,651.85,0.0
256,1511,4096,3072,ck,0,0,42.3138,a8w8_blockscale_1x128x128_256x128x128x128_16x16_32x32_2x2_8x32x1_8x32x1_1x32x1x8_8_1x1_intrawave_v3,898.66,699.6,0.0
256,1616,4096,3072,ck,0,0,43.9825,a8w8_blockscale_1x128x128_256x128x128x128_16x16_32x32_2x2_8x32x1_8x32x1_1x32x1x8_8_1x1_intrawave_v3,924.64,699.95,0.0
256,2000,4096,3072,ck,0,0,49.3167,a8w8_blockscale_1x128x128_256x128x128x128_16x16_32x32_2x2_8x32x1_8x32x1_1x32x1x8_8_1x1_intrawave_v3,1020.58,711.95,0.0
256,2002,4096,3072,ck,0,0,46.9326,a8w8_blockscale_1x128x128_256x128x128x128_16x16_32x32_2x2_8x32x1_8x32x1_1x32x1x8_8_1x1_intrawave_v3,1073.5,748.59,0.0
256,2003,4096,3072,ck,0,0,47.8974,a8w8_blockscale_1x128x128_256x128x128x128_16x16_32x32_2x2_8x32x1_8x32x1_1x32x1x8_8_1x1_intrawave_v3,1052.4,733.75,0.0
256,2125,4096,3072,cktile,11,0,52.663,a8w8_blockscale_cktile_192x256x128_4x2x1_16x16x128_intrawave_0x1x0_1,1015.46,693.45,0.0
256,3000,4096,3072,cktile,11,0,55.9377,a8w8_blockscale_cktile_192x256x128_4x2x1_16x16x128_intrawave_0x1x0_1,1349.67,829.05,0.0
256,3001,4096,3072,cktile,11,0,55.5492,a8w8_blockscale_cktile_192x256x128_4x2x1_16x16x128_intrawave_0x1x0_1,1359.56,835.05,0.0
256,3004,4096,3072,cktile,11,0,54.3076,a8w8_blockscale_cktile_192x256x128_4x2x1_16x16x128_intrawave_0x1x0_1,1392.04,854.76,0.0
256,3024,4096,3072,cktile,11,0,54.7057,a8w8_blockscale_cktile_192x256x128_4x2x1_16x16x128_intrawave_0x1x0_1,1391.11,852.66,0.0
256,3030,4096,3072,cktile,11,0,54.7177,a8w8_blockscale_cktile_192x256x128_4x2x1_16x16x128_intrawave_0x1x0_1,1393.56,853.71,0.0
256,3032,4096,3072,cktile,11,0,56.3293,a8w8_blockscale_cktile_192x256x128_4x2x1_16x16x128_intrawave_0x1x0_1,1354.58,829.68,0.0
256,3982,4096,3072,ck,0,0,88.3438,a8w8_blockscale_1x128x128_256x128x128x128_16x16_32x32_2x2_8x32x1_8x32x1_1x32x1x8_8_1x1_intrawave_v3,1134.32,650.14,0.0
256,4000,4096,3072,ck,0,0,88.8003,a8w8_blockscale_1x128x128_256x128x128x128_16x16_32x32_2x2_8x32x1_8x32x1_1x32x1x8_8_1x1_intrawave_v3,1133.59,649.08,0.0
256,4001,4096,3072,ck,0,0,87.5966,a8w8_blockscale_1x128x128_256x128x128x128_16x16_32x32_2x2_8x32x1_8x32x1_1x32x1x8_8_1x1_intrawave_v3,1149.46,658.13,0.0
256,4004,4096,3072,ck,0,0,88.8718,a8w8_blockscale_1x128x128_256x128x128x128_16x16_32x32_2x2_8x32x1_8x32x1_1x32x1x8_8_1x1_intrawave_v3,1133.81,649.07,0.0
256,4060,4096,3072,ck,0,0,88.9394,a8w8_blockscale_1x128x128_256x128x128x128_16x16_32x32_2x2_8x32x1_8x32x1_1x32x1x8_8_1x1_intrawave_v3,1148.8,655.67,0.0
256,4123,4096,3072,cktile,11,0,98.4596,a8w8_blockscale_cktile_192x256x128_4x2x1_16x16x128_intrawave_0x1x0_1,1053.82,599.48,0.0
256,4239,4096,3072,cktile,11,0,98.782,a8w8_blockscale_cktile_192x256x128_4x2x1_16x16x128_intrawave_0x1x0_1,1079.93,610.75,0.0
256,4472,4096,3072,cktile,11,0,99.5525,a8w8_blockscale_cktile_192x256x128_4x2x1_16x16x128_intrawave_0x1x0_1,1130.47,632.39,0.0
256,4553,4096,3072,cktile,11,0,99.3,a8w8_blockscale_cktile_192x256x128_4x2x1_16x16x128_intrawave_0x1x0_1,1153.88,643.18,0.0
256,5000,4096,3072,cktile,11,0,101.405,a8w8_blockscale_cktile_192x256x128_4x2x1_16x16x128_intrawave_0x1x0_1,1240.86,679.48,0.0
256,5001,4096,3072,cktile,11,0,99.8444,a8w8_blockscale_cktile_192x256x128_4x2x1_16x16x128_intrawave_0x1x0_1,1260.5,690.22,0.0
256,5003,4096,3072,cktile,11,0,99.8629,a8w8_blockscale_cktile_192x256x128_4x2x1_16x16x128_intrawave_0x1x0_1,1260.77,690.31,0.0
256,5012,4096,3072,cktile,11,0,100.8859,a8w8_blockscale_cktile_192x256x128_4x2x1_16x16x128_intrawave_0x1x0_1,1250.24,684.32,0.0
256,5031,4096,3072,cktile,11,0,100.5698,a8w8_blockscale_cktile_192x256x128_4x2x1_16x16x128_intrawave_0x1x0_1,1258.92,688.6,0.0
256,5033,4096,3072,cktile,11,0,100.9289,a8w8_blockscale_cktile_192x256x128_4x2x1_16x16x128_intrawave_0x1x0_1,1254.94,686.37,0.0
256,5120,4096,3072,cktile,11,0,100.4735,a8w8_blockscale_cktile_192x256x128_4x2x1_16x16x128_intrawave_0x1x0_1,1282.42,699.24,0.0
256,5250,4096,3072,cktile,11,0,100.6936,a8w8_blockscale_cktile_192x256x128_4x2x1_16x16x128_intrawave_0x1x0_1,1312.1,712.25,0.0
256,5255,4096,3072,cktile,11,0,101.2268,a8w8_blockscale_cktile_192x256x128_4x2x1_16x16x128_intrawave_0x1x0_1,1306.44,709.05,0.0
256,5257,4096,3072,cktile,11,0,100.5842,a8w8_blockscale_cktile_192x256x128_4x2x1_16x16x128_intrawave_0x1x0_1,1315.28,713.81,0.0
256,5265,4096,3072,cktile,11,0,100.9331,a8w8_blockscale_cktile_192x256x128_4x2x1_16x16x128_intrawave_0x1x0_1,1312.73,712.23,0.0
256,5266,4096,3072,cktile,11,0,100.0612,a8w8_blockscale_cktile_192x256x128_4x2x1_16x16x128_intrawave_0x1x0_1,1324.42,718.55,0.0
256,5270,4096,3072,cktile,11,0,100.8131,a8w8_blockscale_cktile_192x256x128_4x2x1_16x16x128_intrawave_0x1x0_1,1315.54,713.64,0.0
256,5282,4096,3072,cktile,11,0,100.6849,a8w8_blockscale_cktile_192x256x128_4x2x1_16x16x128_intrawave_0x1x0_1,1320.22,715.89,0.0
256,5309,4096,3072,cktile,11,0,100.8452,a8w8_blockscale_cktile_192x256x128_4x2x1_16x16x128_intrawave_0x1x0_1,1324.86,717.77,0.0
256,5310,4096,3072,cktile,11,0,101.3376,a8w8_blockscale_cktile_192x256x128_4x2x1_16x16x128_intrawave_0x1x0_1,1318.67,714.39,0.0
256,5313,4096,3072,cktile,11,0,101.4487,a8w8_blockscale_cktile_192x256x128_4x2x1_16x16x128_intrawave_0x1x0_1,1317.97,713.94,0.0
256,5314,4096,3072,cktile,11,0,101.1161,a8w8_blockscale_cktile_192x256x128_4x2x1_16x16x128_intrawave_0x1x0_1,1322.55,716.4,0.0
256,5318,4096,3072,cktile,11,0,101.5854,a8w8_blockscale_cktile_192x256x128_4x2x1_16x16x128_intrawave_0x1x0_1,1317.43,713.54,0.0
256,5355,4096,3072,cktile,11,0,101.5892,a8w8_blockscale_cktile_192x256x128_4x2x1_16x16x128_intrawave_0x1x0_1,1326.55,717.61,0.0
256,5356,4096,3072,cktile,11,0,101.4369,a8w8_blockscale_cktile_192x256x128_4x2x1_16x16x128_intrawave_0x1x0_1,1328.79,718.8,0.0
256,5359,4096,3072,cktile,11,0,101.6538,a8w8_blockscale_cktile_192x256x128_4x2x1_16x16x128_intrawave_0x1x0_1,1326.7,717.6,0.0
256,5361,4096,3072,cktile,11,0,101.5672,a8w8_blockscale_cktile_192x256x128_4x2x1_16x16x128_intrawave_0x1x0_1,1328.32,718.43,0.0
256,5365,4096,3072,cktile,11,0,100.2144,a8w8_blockscale_cktile_192x256x128_4x2x1_16x16x128_intrawave_0x1x0_1,1347.26,728.58,0.0
256,5369,4096,3072,cktile,11,0,101.6707,a8w8_blockscale_cktile_192x256x128_4x2x1_16x16x128_intrawave_0x1x0_1,1328.95,718.59,0.0
256,5373,4096,3072,cktile,11,0,101.575,a8w8_blockscale_cktile_192x256x128_4x2x1_16x16x128_intrawave_0x1x0_1,1331.19,719.71,0.0
256,5398,4096,3072,cktile,11,0,101.6659,a8w8_blockscale_cktile_192x256x128_4x2x1_16x16x128_intrawave_0x1x0_1,1336.19,721.83,0.0
256,5401,4096,3072,cktile,11,0,101.096,a8w8_blockscale_cktile_192x256x128_4x2x1_16x16x128_intrawave_0x1x0_1,1344.47,726.24,0.0
256,5404,4096,3072,cktile,11,0,101.3177,a8w8_blockscale_cktile_192x256x128_4x2x1_16x16x128_intrawave_0x1x0_1,1342.27,724.98,0.0
256,5413,4096,3072,cktile,11,0,102.2534,a8w8_blockscale_cktile_192x256x128_4x2x1_16x16x128_intrawave_0x1x0_1,1332.21,719.34,0.0
256,5443,4096,3072,cktile,11,0,101.2634,a8w8_blockscale_cktile_192x256x128_4x2x1_16x16x128_intrawave_0x1x0_1,1352.69,729.71,0.0
256,5444,4096,3072,cktile,11,0,100.5718,a8w8_blockscale_cktile_192x256x128_4x2x1_16x16x128_intrawave_0x1x0_1,1362.24,734.84,0.0
256,5446,4096,3072,cktile,11,0,101.3982,a8w8_blockscale_cktile_192x256x128_4x2x1_16x16x128_intrawave_0x1x0_1,1351.63,729.07,0.0
256,5449,4096,3072,cktile,11,0,102.3925,a8w8_blockscale_cktile_192x256x128_4x2x1_16x16x128_intrawave_0x1x0_1,1339.24,722.32,0.0
256,5450,4096,3072,cktile,11,0,101.7833,a8w8_blockscale_cktile_192x256x128_4x2x1_16x16x128_intrawave_0x1x0_1,1347.51,726.76,0.0
256,5454,4096,3072,cktile,11,0,101.3232,a8w8_blockscale_cktile_192x256x128_4x2x1_16x16x128_intrawave_0x1x0_1,1354.62,730.5,0.0
256,5489,4096,3072,cktile,11,0,101.2774,a8w8_blockscale_cktile_192x256x128_4x2x1_16x16x128_intrawave_0x1x0_1,1363.93,734.72,0.0
256,5491,4096,3072,cktile,11,0,101.2948,a8w8_blockscale_cktile_192x256x128_4x2x1_16x16x128_intrawave_0x1x0_1,1364.19,734.82,0.0
256,5492,4096,3072,cktile,11,0,100.9708,a8w8_blockscale_cktile_192x256x128_4x2x1_16x16x128_intrawave_0x1x0_1,1368.82,737.29,0.0
256,5494,4096,3072,cktile,11,0,102.3606,a8w8_blockscale_cktile_192x256x128_4x2x1_16x16x128_intrawave_0x1x0_1,1350.73,727.5,0.0
256,5495,4096,3072,cktile,11,0,102.8438,a8w8_blockscale_cktile_192x256x128_4x2x1_16x16x128_intrawave_0x1x0_1,1344.62,724.19,0.0
256,5496,4096,3072,cktile,11,0,100.6972,a8w8_blockscale_cktile_192x256x128_4x2x1_16x16x128_intrawave_0x1x0_1,1373.54,739.74,0.0
256,5499,4096,3072,cktile,11,0,101.3864,a8w8_blockscale_cktile_192x256x128_4x2x1_16x16x128_intrawave_0x1x0_1,1364.95,735.05,0.0
256,5500,4096,3072,cktile,11,0,100.8561,a8w8_blockscale_cktile_192x256x128_4x2x1_16x16x128_intrawave_0x1x0_1,1372.37,739.02,0.0
256,5535,4096,3072,cktile,11,0,102.361,a8w8_blockscale_cktile_192x256x128_4x2x1_16x16x128_intrawave_0x1x0_1,1360.8,732.01,0.0
256,5538,4096,3072,cktile,11,0,101.7497,a8w8_blockscale_cktile_192x256x128_4x2x1_16x16x128_intrawave_0x1x0_1,1369.72,736.74,0.0
256,5539,4096,3072,cktile,11,0,101.4251,a8w8_blockscale_cktile_192x256x128_4x2x1_16x16x128_intrawave_0x1x0_1,1374.35,739.21,0.0
256,5541,4096,3072,cktile,11,0,101.6382,a8w8_blockscale_cktile_192x256x128_4x2x1_16x16x128_intrawave_0x1x0_1,1371.96,737.88,0.0
256,5542,4096,3072,cktile,11,0,100.8438,a8w8_blockscale_cktile_192x256x128_4x2x1_16x16x128_intrawave_0x1x0_1,1383.02,743.8,0.0
256,5543,4096,3072,cktile,11,0,101.3203,a8w8_blockscale_cktile_192x256x128_4x2x1_16x16x128_intrawave_0x1x0_1,1376.76,740.42,0.0
256,5545,4096,3072,cktile,11,0,101.8466,a8w8_blockscale_cktile_192x256x128_4x2x1_16x16x128_intrawave_0x1x0_1,1370.14,736.81,0.0
256,5546,4096,3072,cktile,11,0,101.9502,a8w8_blockscale_cktile_192x256x128_4x2x1_16x16x128_intrawave_0x1x0_1,1369.0,736.17,0.0
256,5549,4096,3072,cktile,11,0,102.0153,a8w8_blockscale_cktile_192x256x128_4x2x1_16x16x128_intrawave_0x1x0_1,1368.86,736.04,0.0
256,5552,4096,3072,cktile,11,0,101.2215,a8w8_blockscale_cktile_192x256x128_4x2x1_16x16x128_intrawave_0x1x0_1,1380.35,742.14,0.0
256,5573,4096,3072,cktile,11,0,101.9586,a8w8_blockscale_cktile_192x256x128_4x2x1_16x16x128_intrawave_0x1x0_1,1375.55,739.1,0.0
256,5593,4096,3072,cktile,11,0,102.1678,a8w8_blockscale_cktile_192x256x128_4x2x1_16x16x128_intrawave_0x1x0_1,1377.66,739.79,0.0
256,5597,4096,3072,cktile,11,0,101.9415,a8w8_blockscale_cktile_192x256x128_4x2x1_16x16x128_intrawave_0x1x0_1,1381.71,741.87,0.0
256,5600,4096,3072,cktile,11,0,101.7015,a8w8_blockscale_cktile_192x256x128_4x2x1_16x16x128_intrawave_0x1x0_1,1385.71,743.95,0.0
256,5619,4096,3072,cktile,11,0,101.9658,a8w8_blockscale_cktile_192x256x128_4x2x1_16x16x128_intrawave_0x1x0_1,1386.81,744.13,0.0
256,5661,4096,3072,cktile,11,0,101.7411,a8w8_blockscale_cktile_192x256x128_4x2x1_16x16x128_intrawave_0x1x0_1,1400.26,750.42,0.0
256,5666,4096,3072,cktile,11,0,102.1733,a8w8_blockscale_cktile_192x256x128_4x2x1_16x16x128_intrawave_0x1x0_1,1395.57,747.8,0.0
256,5669,4096,3072,cktile,11,0,101.9775,a8w8_blockscale_cktile_192x256x128_4x2x1_16x16x128_intrawave_0x1x0_1,1398.99,749.56,0.0
256,5672,4096,3072,cktile,11,0,101.2838,a8w8_blockscale_cktile_192x256x128_4x2x1_16x16x128_intrawave_0x1x0_1,1409.31,755.03,0.0
256,5675,4096,3072,cktile,11,0,103.5223,a8w8_blockscale_cktile_192x256x128_4x2x1_16x16x128_intrawave_0x1x0_1,1379.57,739.03,0.0
256,5676,4096,3072,cktile,11,0,102.5494,a8w8_blockscale_cktile_192x256x128_4x2x1_16x16x128_intrawave_0x1x0_1,1392.9,746.15,0.0
256,5681,4096,3072,cktile,11,0,100.821,a8w8_blockscale_cktile_192x256x128_4x2x1_16x16x128_intrawave_0x1x0_1,1418.03,759.5,0.0
256,5682,4096,3072,cktile,11,0,101.0951,a8w8_blockscale_cktile_192x256x128_4x2x1_16x16x128_intrawave_0x1x0_1,1414.43,757.55,0.0
256,6001,4096,3072,cktile,11,0,103.6241,a8w8_blockscale_cktile_192x256x128_4x2x1_16x16x128_intrawave_0x1x0_1,1457.38,773.74,0.0
256,6004,4096,3072,cktile,11,0,102.6709,a8w8_blockscale_cktile_192x256x128_4x2x1_16x16x128_intrawave_0x1x0_1,1471.65,781.25,0.0
256,6006,4096,3072,cktile,11,0,102.7889,a8w8_blockscale_cktile_192x256x128_4x2x1_16x16x128_intrawave_0x1x0_1,1470.45,780.58,0.0
256,6039,4096,3072,cktile,11,0,103.0652,a8w8_blockscale_cktile_192x256x128_4x2x1_16x16x128_intrawave_0x1x0_1,1474.57,782.09,0.0
256,6111,4096,3072,cktile,11,0,102.0761,a8w8_blockscale_cktile_192x256x128_4x2x1_16x16x128_intrawave_0x1x0_1,1506.6,797.61,0.0
256,6376,4096,3072,ck,0,0,140.4586,a8w8_blockscale_1x128x128_256x128x128x128_16x16_32x32_2x2_8x32x1_8x32x1_1x32x1x8_8_1x1_intrawave_v3,1142.38,600.9,0.0
256,6407,4096,3072,ck,0,0,135.3853,a8w8_blockscale_1x128x128_256x128x128x128_16x16_32x32_2x2_8x32x1_8x32x1_1x32x1x8_8_1x1_intrawave_v3,1190.95,626.0,0.0
256,6474,4096,3072,ck,0,0,140.8964,a8w8_blockscale_1x128x128_256x128x128x128_16x16_32x32_2x2_8x32x1_8x32x1_1x32x1x8_8_1x1_intrawave_v3,1156.34,606.87,0.0
256,7001,4096,3072,cktile,11,0,144.1305,a8w8_blockscale_cktile_192x256x128_4x2x1_16x16x128_intrawave_0x1x0_1,1222.41,634.44,0.0
256,8953,4096,3072,cktile,11,0,149.5955,a8w8_blockscale_cktile_192x256x128_4x2x1_16x16x128_intrawave_0x1x0_1,1506.13,758.24,0.0
256,8987,4096,3072,cktile,11,0,149.5166,a8w8_blockscale_cktile_192x256x128_4x2x1_16x16x128_intrawave_0x1x0_1,1512.64,761.2,0.0
256,9471,4096,3072,cktile,11,0,191.192,a8w8_blockscale_cktile_192x256x128_4x2x1_16x16x128_intrawave_0x1x0_1,1246.63,623.79,0.0
256,9479,4096,3072,cktile,11,0,190.1362,a8w8_blockscale_cktile_192x256x128_4x2x1_16x16x128_intrawave_0x1x0_1,1254.61,627.73,0.0
256,9891,4096,3072,cktile,11,0,190.2411,a8w8_blockscale_cktile_192x256x128_4x2x1_16x16x128_intrawave_0x1x0_1,1308.42,651.78,0.0
256,10000,4096,3072,cktile,11,0,191.1862,a8w8_blockscale_cktile_192x256x128_4x2x1_16x16x128_intrawave_0x1x0_1,1316.3,654.98,0.0
256,10001,4096,3072,cktile,11,0,191.5167,a8w8_blockscale_cktile_192x256x128_4x2x1_16x16x128_intrawave_0x1x0_1,1314.16,653.91,0.0
256,10002,4096,3072,cktile,11,0,191.7991,a8w8_blockscale_cktile_192x256x128_4x2x1_16x16x128_intrawave_0x1x0_1,1312.36,653.0,0.0
256,10012,4096,3072,cktile,11,0,193.314,a8w8_blockscale_cktile_192x256x128_4x2x1_16x16x128_intrawave_0x1x0_1,1303.37,648.47,0.0
256,10051,4096,3072,cktile,11,0,192.9227,a8w8_blockscale_cktile_192x256x128_4x2x1_16x16x128_intrawave_0x1x0_1,1311.1,652.06,0.0
256,10062,4096,3072,cktile,11,0,191.9081,a8w8_blockscale_cktile_192x256x128_4x2x1_16x16x128_intrawave_0x1x0_1,1319.48,656.15,0.0
256,10114,4096,3072,cktile,11,0,192.4752,a8w8_blockscale_cktile_192x256x128_4x2x1_16x16x128_intrawave_0x1x0_1,1322.39,657.26,0.0
256,10127,4096,3072,cktile,11,0,192.1406,a8w8_blockscale_cktile_192x256x128_4x2x1_16x16x128_intrawave_0x1x0_1,1326.39,659.17,0.0
256,10132,4096,3072,cktile,11,0,192.0204,a8w8_blockscale_cktile_192x256x128_4x2x1_16x16x128_intrawave_0x1x0_1,1327.88,659.88,0.0
256,10160,4096,3072,cktile,11,0,193.5196,a8w8_blockscale_cktile_192x256x128_4x2x1_16x16x128_intrawave_0x1x0_1,1321.23,656.39,0.0
256,10168,4096,3072,cktile,11,0,193.2008,a8w8_blockscale_cktile_192x256x128_4x2x1_16x16x128_intrawave_0x1x0_1,1324.46,657.94,0.0
256,10169,4096,3072,cktile,11,0,193.0873,a8w8_blockscale_cktile_192x256x128_4x2x1_16x16x128_intrawave_0x1x0_1,1325.37,658.39,0.0
256,10186,4096,3072,cktile,11,0,191.822,a8w8_blockscale_cktile_192x256x128_4x2x1_16x16x128_intrawave_0x1x0_1,1336.34,663.73,0.0
256,10187,4096,3072,cktile,11,0,192.7012,a8w8_blockscale_cktile_192x256x128_4x2x1_16x16x128_intrawave_0x1x0_1,1330.37,660.76,0.0
256,10188,4096,3072,cktile,11,0,192.4066,a8w8_blockscale_cktile_192x256x128_4x2x1_16x16x128_intrawave_0x1x0_1,1332.54,661.83,0.0
256,10197,4096,3072,cktile,11,0,193.0036,a8w8_blockscale_cktile_192x256x128_4x2x1_16x16x128_intrawave_0x1x0_1,1329.59,660.31,0.0
256,10200,4096,3072,cktile,11,0,192.7232,a8w8_blockscale_cktile_192x256x128_4x2x1_16x16x128_intrawave_0x1x0_1,1331.92,661.44,0.0
256,10225,4096,3072,cktile,11,0,193.8455,a8w8_blockscale_cktile_192x256x128_4x2x1_16x16x128_intrawave_0x1x0_1,1327.45,659.07,0.0
256,10230,4096,3072,cktile,11,0,193.2971,a8w8_blockscale_cktile_192x256x128_4x2x1_16x16x128_intrawave_0x1x0_1,1331.87,661.23,0.0
256,10238,4096,3072,cktile,11,0,193.9652,a8w8_blockscale_cktile_192x256x128_4x2x1_16x16x128_intrawave_0x1x0_1,1328.32,659.42,0.0
256,10239,4096,3072,cktile,11,0,192.002,a8w8_blockscale_cktile_192x256x128_4x2x1_16x16x128_intrawave_0x1x0_1,1342.03,666.22,0.0
256,10240,4096,3072,cktile,11,0,193.0498,a8w8_blockscale_cktile_192x256x128_4x2x1_16x16x128_intrawave_0x1x0_1,1334.88,662.66,0.0
256,10245,4096,3072,cktile,11,0,192.6881,a8w8_blockscale_cktile_192x256x128_4x2x1_16x16x128_intrawave_0x1x0_1,1338.04,664.2,0.0
256,10246,4096,3072,cktile,11,0,192.555,a8w8_blockscale_cktile_192x256x128_4x2x1_16x16x128_intrawave_0x1x0_1,1339.09,664.71,0.0
256,10247,4096,3072,cktile,11,0,192.8641,a8w8_blockscale_cktile_192x256x128_4x2x1_16x16x128_intrawave_0x1x0_1,1337.08,663.71,0.0
256,10249,4096,3072,cktile,11,0,193.7345,a8w8_blockscale_cktile_192x256x128_4x2x1_16x16x128_intrawave_0x1x0_1,1331.33,660.84,0.0
256,10254,4096,3072,cktile,11,0,192.9575,a8w8_blockscale_cktile_192x256x128_4x2x1_16x16x128_intrawave_0x1x0_1,1337.34,663.79,0.0
256,10256,4096,3072,cktile,11,0,194.2836,a8w8_blockscale_cktile_192x256x128_4x2x1_16x16x128_intrawave_0x1x0_1,1328.47,659.38,0.0
256,10262,4096,3072,cktile,11,0,192.4396,a8w8_blockscale_cktile_192x256x128_4x2x1_16x16x128_intrawave_0x1x0_1,1341.99,666.05,0.0
256,10277,4096,3072,cktile,11,0,192.6498,a8w8_blockscale_cktile_192x256x128_4x2x1_16x16x128_intrawave_0x1x0_1,1342.48,666.2,0.0
256,10283,4096,3072,cktile,11,0,192.9337,a8w8_blockscale_cktile_192x256x128_4x2x1_16x16x128_intrawave_0x1x0_1,1341.29,665.57,0.0
256,10293,4096,3072,cktile,11,0,192.7359,a8w8_blockscale_cktile_192x256x128_4x2x1_16x16x128_intrawave_0x1x0_1,1343.97,666.84,0.0
256,10296,4096,3072,cktile,11,0,192.9069,a8w8_blockscale_cktile_192x256x128_4x2x1_16x16x128_intrawave_0x1x0_1,1343.17,666.42,0.0
256,10298,4096,3072,cktile,11,0,193.4676,a8w8_blockscale_cktile_192x256x128_4x2x1_16x16x128_intrawave_0x1x0_1,1339.54,664.61,0.0
256,10304,4096,3072,cktile,11,0,194.2994,a8w8_blockscale_cktile_192x256x128_4x2x1_16x16x128_intrawave_0x1x0_1,1334.58,662.11,0.0
256,10307,4096,3072,cktile,11,0,194.1104,a8w8_blockscale_cktile_192x256x128_4x2x1_16x16x128_intrawave_0x1x0_1,1336.27,662.93,0.0
256,10313,4096,3072,cktile,11,0,194.0541,a8w8_blockscale_cktile_192x256x128_4x2x1_16x16x128_intrawave_0x1x0_1,1337.44,663.47,0.0
256,10333,4096,3072,cktile,11,0,194.0882,a8w8_blockscale_cktile_192x256x128_4x2x1_16x16x128_intrawave_0x1x0_1,1339.8,664.51,0.0
256,10344,4096,3072,cktile,11,0,193.0125,a8w8_blockscale_cktile_192x256x128_4x2x1_16x16x128_intrawave_0x1x0_1,1348.7,668.86,0.0
256,10348,4096,3072,cktile,11,0,193.5531,a8w8_blockscale_cktile_192x256x128_4x2x1_16x16x128_intrawave_0x1x0_1,1345.45,667.22,0.0
256,10349,4096,3072,cktile,11,0,192.1947,a8w8_blockscale_cktile_192x256x128_4x2x1_16x16x128_intrawave_0x1x0_1,1355.09,672.0,0.0
256,10355,4096,3072,cktile,11,0,193.0699,a8w8_blockscale_cktile_192x256x128_4x2x1_16x16x128_intrawave_0x1x0_1,1349.73,669.3,0.0
256,10357,4096,3072,cktile,11,0,193.982,a8w8_blockscale_cktile_192x256x128_4x2x1_16x16x128_intrawave_0x1x0_1,1343.64,666.27,0.0
256,10359,4096,3072,cktile,11,0,193.7971,a8w8_blockscale_cktile_192x256x128_4x2x1_16x16x128_intrawave_0x1x0_1,1345.18,667.02,0.0
256,10360,4096,3072,cktile,11,0,193.9572,a8w8_blockscale_cktile_192x256x128_4x2x1_16x16x128_intrawave_0x1x0_1,1344.2,666.53,0.0
256,10363,4096,3072,cktile,11,0,193.1848,a8w8_blockscale_cktile_192x256x128_4x2x1_16x16x128_intrawave_0x1x0_1,1349.97,669.37,0.0
256,10366,4096,3072,cktile,11,0,192.5616,a8w8_blockscale_cktile_192x256x128_4x2x1_16x16x128_intrawave_0x1x0_1,1354.73,671.71,0.0
256,10367,4096,3072,cktile,11,0,192.6626,a8w8_blockscale_cktile_192x256x128_4x2x1_16x16x128_intrawave_0x1x0_1,1354.15,671.42,0.0
256,10370,4096,3072,cktile,11,0,192.8168,a8w8_blockscale_cktile_192x256x128_4x2x1_16x16x128_intrawave_0x1x0_1,1353.46,671.05,0.0
256,10384,4096,3072,cktile,11,0,193.7559,a8w8_blockscale_cktile_192x256x128_4x2x1_16x16x128_intrawave_0x1x0_1,1348.72,668.62,0.0
256,10391,4096,3072,cktile,11,0,193.4674,a8w8_blockscale_cktile_192x256x128_4x2x1_16x16x128_intrawave_0x1x0_1,1351.64,670.02,0.0
256,10399,4096,3072,cktile,11,0,194.2029,a8w8_blockscale_cktile_192x256x128_4x2x1_16x16x128_intrawave_0x1x0_1,1347.56,667.95,0.0
256,10406,4096,3072,cktile,11,0,193.6446,a8w8_blockscale_cktile_192x256x128_4x2x1_16x16x128_intrawave_0x1x0_1,1352.35,670.28,0.0
256,10411,4096,3072,cktile,11,0,194.1099,a8w8_blockscale_cktile_192x256x128_4x2x1_16x16x128_intrawave_0x1x0_1,1349.76,668.96,0.0
256,10413,4096,3072,cktile,11,0,193.7065,a8w8_blockscale_cktile_192x256x128_4x2x1_16x16x128_intrawave_0x1x0_1,1352.83,670.47,0.0
256,10415,4096,3072,cktile,11,0,193.2355,a8w8_blockscale_cktile_192x256x128_4x2x1_16x16x128_intrawave_0x1x0_1,1356.39,672.22,0.0
256,10416,4096,3072,cktile,11,0,194.6008,a8w8_blockscale_cktile_192x256x128_4x2x1_16x16x128_intrawave_0x1x0_1,1347.0,667.57,0.0
256,10418,4096,3072,cktile,11,0,194.0052,a8w8_blockscale_cktile_192x256x128_4x2x1_16x16x128_intrawave_0x1x0_1,1351.39,669.73,0.0
256,10419,4096,3072,cktile,11,0,195.05,a8w8_blockscale_cktile_192x256x128_4x2x1_16x16x128_intrawave_0x1x0_1,1344.28,666.2,0.0
256,10422,4096,3072,cktile,11,0,192.699,a8w8_blockscale_cktile_192x256x128_4x2x1_16x16x128_intrawave_0x1x0_1,1361.08,674.5,0.0
256,10434,4096,3072,cktile,11,0,193.9208,a8w8_blockscale_cktile_192x256x128_4x2x1_16x16x128_intrawave_0x1x0_1,1354.06,670.95,0.0
256,10440,4096,3072,cktile,11,0,192.4408,a8w8_blockscale_cktile_192x256x128_4x2x1_16x16x128_intrawave_0x1x0_1,1365.26,676.46,0.0
256,10444,4096,3072,cktile,11,0,194.0512,a8w8_blockscale_cktile_192x256x128_4x2x1_16x16x128_intrawave_0x1x0_1,1354.45,671.08,0.0
256,10459,4096,3072,cktile,11,0,194.0728,a8w8_blockscale_cktile_192x256x128_4x2x1_16x16x128_intrawave_0x1x0_1,1356.24,671.88,0.0
256,10461,4096,3072,cktile,11,0,194.8694,a8w8_blockscale_cktile_192x256x128_4x2x1_16x16x128_intrawave_0x1x0_1,1350.95,669.25,0.0
256,10468,4096,3072,cktile,11,0,194.7322,a8w8_blockscale_cktile_192x256x128_4x2x1_16x16x128_intrawave_0x1x0_1,1352.81,670.12,0.0
256,10473,4096,3072,cktile,11,0,193.6068,a8w8_blockscale_cktile_192x256x128_4x2x1_16x16x128_intrawave_0x1x0_1,1361.32,674.31,0.0
256,10474,4096,3072,cktile,11,0,193.51,a8w8_blockscale_cktile_192x256x128_4x2x1_16x16x128_intrawave_0x1x0_1,1362.14,674.7,0.0
256,10476,4096,3072,cktile,11,0,193.768,a8w8_blockscale_cktile_192x256x128_4x2x1_16x16x128_intrawave_0x1x0_1,1360.58,673.92,0.0
256,10480,4096,3072,cktile,11,0,193.8881,a8w8_blockscale_cktile_192x256x128_4x2x1_16x16x128_intrawave_0x1x0_1,1360.26,673.74,0.0
256,10484,4096,3072,cktile,11,0,193.3406,a8w8_blockscale_cktile_192x256x128_4x2x1_16x16x128_intrawave_0x1x0_1,1364.63,675.88,0.0
256,10489,4096,3072,cktile,11,0,194.1443,a8w8_blockscale_cktile_192x256x128_4x2x1_16x16x128_intrawave_0x1x0_1,1359.63,673.37,0.0
256,10495,4096,3072,cktile,11,0,194.1312,a8w8_blockscale_cktile_192x256x128_4x2x1_16x16x128_intrawave_0x1x0_1,1360.5,673.76,0.0
256,10498,4096,3072,cktile,11,0,193.7487,a8w8_blockscale_cktile_192x256x128_4x2x1_16x16x128_intrawave_0x1x0_1,1363.57,675.27,0.0
256,10513,4096,3072,cktile,11,0,193.8633,a8w8_blockscale_cktile_192x256x128_4x2x1_16x16x128_intrawave_0x1x0_1,1364.72,675.74,0.0
256,10521,4096,3072,cktile,11,0,194.2875,a8w8_blockscale_cktile_192x256x128_4x2x1_16x16x128_intrawave_0x1x0_1,1362.77,674.73,0.0
256,10526,4096,3072,cktile,11,0,194.3237,a8w8_blockscale_cktile_192x256x128_4x2x1_16x16x128_intrawave_0x1x0_1,1363.17,674.89,0.0
256,10529,4096,3072,cktile,11,0,192.2757,a8w8_blockscale_cktile_192x256x128_4x2x1_16x16x128_intrawave_0x1x0_1,1378.08,682.26,0.0
256,10532,4096,3072,cktile,11,0,194.4256,a8w8_blockscale_cktile_192x256x128_4x2x1_16x16x128_intrawave_0x1x0_1,1363.23,674.89,0.0
256,10535,4096,3072,cktile,11,0,194.6077,a8w8_blockscale_cktile_192x256x128_4x2x1_16x16x128_intrawave_0x1x0_1,1362.34,674.43,0.0
256,10547,4096,3072,cktile,11,0,192.2237,a8w8_blockscale_cktile_192x256x128_4x2x1_16x16x128_intrawave_0x1x0_1,1380.81,683.5,0.0
256,10554,4096,3072,cktile,11,0,194.3629,a8w8_blockscale_cktile_192x256x128_4x2x1_16x16x128_intrawave_0x1x0_1,1366.52,676.38,0.0
256,10569,4096,3072,cktile,11,0,193.7688,a8w8_blockscale_cktile_192x256x128_4x2x1_16x16x128_intrawave_0x1x0_1,1372.65,679.33,0.0
256,10580,4096,3072,cktile,11,0,194.2093,a8w8_blockscale_cktile_192x256x128_4x2x1_16x16x128_intrawave_0x1x0_1,1370.97,678.42,0.0
256,10587,4096,3072,cktile,11,0,194.3367,a8w8_blockscale_cktile_192x256x128_4x2x1_16x16x128_intrawave_0x1x0_1,1370.97,678.38,0.0
256,10589,4096,3072,cktile,11,0,194.0425,a8w8_blockscale_cktile_192x256x128_4x2x1_16x16x128_intrawave_0x1x0_1,1373.31,679.53,0.0
256,10593,4096,3072,cktile,11,0,193.3693,a8w8_blockscale_cktile_192x256x128_4x2x1_16x16x128_intrawave_0x1x0_1,1378.61,682.13,0.0
256,10595,4096,3072,cktile,11,0,193.9556,a8w8_blockscale_cktile_192x256x128_4x2x1_16x16x128_intrawave_0x1x0_1,1374.71,680.18,0.0
256,10600,4096,3072,cktile,11,0,193.6285,a8w8_blockscale_cktile_192x256x128_4x2x1_16x16x128_intrawave_0x1x0_1,1377.68,681.62,0.0
256,10613,4096,3072,cktile,11,0,193.6606,a8w8_blockscale_cktile_192x256x128_4x2x1_16x16x128_intrawave_0x1x0_1,1379.14,682.26,0.0
256,10628,4096,3072,cktile,11,0,193.2159,a8w8_blockscale_cktile_192x256x128_4x2x1_16x16x128_intrawave_0x1x0_1,1384.27,684.71,0.0
256,10635,4096,3072,cktile,11,0,194.0738,a8w8_blockscale_cktile_192x256x128_4x2x1_16x16x128_intrawave_0x1x0_1,1379.06,682.09,0.0
256,10640,4096,3072,cktile,11,0,193.9232,a8w8_blockscale_cktile_192x256x128_4x2x1_16x16x128_intrawave_0x1x0_1,1380.78,682.91,0.0
256,10652,4096,3072,cktile,11,0,194.0607,a8w8_blockscale_cktile_192x256x128_4x2x1_16x16x128_intrawave_0x1x0_1,1381.35,683.12,0.0
256,10656,4096,3072,cktile,11,0,194.3455,a8w8_blockscale_cktile_192x256x128_4x2x1_16x16x128_intrawave_0x1x0_1,1379.85,682.35,0.0
256,10676,4096,3072,cktile,11,0,194.3241,a8w8_blockscale_cktile_192x256x128_4x2x1_16x16x128_intrawave_0x1x0_1,1382.59,683.59,0.0
256,10691,4096,3072,cktile,11,0,194.1471,a8w8_blockscale_cktile_192x256x128_4x2x1_16x16x128_intrawave_0x1x0_1,1385.79,685.08,0.0
256,10694,4096,3072,cktile,11,0,193.9171,a8w8_blockscale_cktile_192x256x128_4x2x1_16x16x128_intrawave_0x1x0_1,1387.83,686.07,0.0
256,10696,4096,3072,cktile,11,0,194.2522,a8w8_blockscale_cktile_192x256x128_4x2x1_16x16x128_intrawave_0x1x0_1,1385.69,685.0,0.0
256,10700,4096,3072,cktile,11,0,194.2273,a8w8_blockscale_cktile_192x256x128_4x2x1_16x16x128_intrawave_0x1x0_1,1386.39,685.32,0.0
256,10715,4096,3072,cktile,11,0,194.8299,a8w8_blockscale_cktile_192x256x128_4x2x1_16x16x128_intrawave_0x1x0_1,1384.04,684.07,0.0
256,10733,4096,3072,cktile,11,0,195.1084,a8w8_blockscale_cktile_192x256x128_4x2x1_16x16x128_intrawave_0x1x0_1,1384.38,684.13,0.0
256,10754,4096,3072,cktile,11,0,194.6339,a8w8_blockscale_cktile_192x256x128_4x2x1_16x16x128_intrawave_0x1x0_1,1390.47,687.01,0.0
256,10801,4096,3072,cktile,11,0,193.7409,a8w8_blockscale_cktile_192x256x128_4x2x1_16x16x128_intrawave_0x1x0_1,1402.99,692.91,0.0
256,10803,4096,3072,cktile,11,0,194.9493,a8w8_blockscale_cktile_192x256x128_4x2x1_16x16x128_intrawave_0x1x0_1,1394.55,688.73,0.0
256,10804,4096,3072,cktile,11,0,194.3621,a8w8_blockscale_cktile_192x256x128_4x2x1_16x16x128_intrawave_0x1x0_1,1398.89,690.87,0.0
256,10841,4096,3072,cktile,11,0,193.6147,a8w8_blockscale_cktile_192x256x128_4x2x1_16x16x128_intrawave_0x1x0_1,1409.1,695.69,0.0
256,10855,4096,3072,cktile,11,0,195.0393,a8w8_blockscale_cktile_192x256x128_4x2x1_16x16x128_intrawave_0x1x0_1,1400.62,691.42,0.0
256,10856,4096,3072,cktile,11,0,193.8284,a8w8_blockscale_cktile_192x256x128_4x2x1_16x16x128_intrawave_0x1x0_1,1409.5,695.8,0.0
256,10857,4096,3072,cktile,11,0,194.8396,a8w8_blockscale_cktile_192x256x128_4x2x1_16x16x128_intrawave_0x1x0_1,1402.31,692.24,0.0
256,10873,4096,3072,cktile,11,0,195.0905,a8w8_blockscale_cktile_192x256x128_4x2x1_16x16x128_intrawave_0x1x0_1,1402.57,692.28,0.0
256,10874,4096,3072,cktile,11,0,194.2711,a8w8_blockscale_cktile_192x256x128_4x2x1_16x16x128_intrawave_0x1x0_1,1408.61,695.25,0.0
256,10913,4096,3072,cktile,11,0,193.4553,a8w8_blockscale_cktile_192x256x128_4x2x1_16x16x128_intrawave_0x1x0_1,1419.63,700.46,0.0
256,10914,4096,3072,cktile,11,0,194.41,a8w8_blockscale_cktile_192x256x128_4x2x1_16x16x128_intrawave_0x1x0_1,1412.79,697.07,0.0
256,10915,4096,3072,cktile,11,0,194.1467,a8w8_blockscale_cktile_192x256x128_4x2x1_16x16x128_intrawave_0x1x0_1,1414.83,698.08,0.0
256,10916,4096,3072,cktile,11,0,194.897,a8w8_blockscale_cktile_192x256x128_4x2x1_16x16x128_intrawave_0x1x0_1,1409.51,695.45,0.0
256,10921,4096,3072,cktile,11,0,194.0239,a8w8_blockscale_cktile_192x256x128_4x2x1_16x16x128_intrawave_0x1x0_1,1416.51,698.87,0.0
256,10931,4096,3072,cktile,11,0,194.1517,a8w8_blockscale_cktile_192x256x128_4x2x1_16x16x128_intrawave_0x1x0_1,1416.87,698.99,0.0
256,10974,4096,3072,cktile,11,0,194.899,a8w8_blockscale_cktile_192x256x128_4x2x1_16x16x128_intrawave_0x1x0_1,1416.99,698.79,0.0
256,10975,4096,3072,cktile,11,0,194.2553,a8w8_blockscale_cktile_192x256x128_4x2x1_16x16x128_intrawave_0x1x0_1,1421.81,701.17,0.0
256,10976,4096,3072,cktile,11,0,195.7834,a8w8_blockscale_cktile_192x256x128_4x2x1_16x16x128_intrawave_0x1x0_1,1410.85,695.75,0.0
256,10977,4096,3072,cktile,11,0,194.8266,a8w8_blockscale_cktile_192x256x128_4x2x1_16x16x128_intrawave_0x1x0_1,1417.9,699.23,0.0
256,10988,4096,3072,cktile,11,0,195.8029,a8w8_blockscale_cktile_192x256x128_4x2x1_16x16x128_intrawave_0x1x0_1,1412.25,696.37,0.0
256,10989,4096,3072,cktile,11,0,194.9501,a8w8_blockscale_cktile_192x256x128_4x2x1_16x16x128_intrawave_0x1x0_1,1418.55,699.48,0.0
256,10991,4096,3072,cktile,11,0,195.3825,a8w8_blockscale_cktile_192x256x128_4x2x1_16x16x128_intrawave_0x1x0_1,1415.67,698.04,0.0
256,11001,4096,3072,cktile,11,0,194.1125,a8w8_blockscale_cktile_192x256x128_4x2x1_16x16x128_intrawave_0x1x0_1,1426.23,703.19,0.0
256,11053,4096,3072,cktile,11,0,194.9169,a8w8_blockscale_cktile_192x256x128_4x2x1_16x16x128_intrawave_0x1x0_1,1427.06,703.29,0.0
256,11059,4096,3072,cktile,11,0,196.1989,a8w8_blockscale_cktile_192x256x128_4x2x1_16x16x128_intrawave_0x1x0_1,1418.5,699.04,0.0
256,11099,4096,3072,cktile,11,0,194.4325,a8w8_blockscale_cktile_192x256x128_4x2x1_16x16x128_intrawave_0x1x0_1,1436.57,707.71,0.0
256,11111,4096,3072,cktile,11,0,197.1476,a8w8_blockscale_cktile_192x256x128_4x2x1_16x16x128_intrawave_0x1x0_1,1418.32,698.65,0.0
256,11612,4096,3072,cktile,11,0,195.992,a8w8_blockscale_cktile_192x256x128_4x2x1_16x16x128_intrawave_0x1x0_1,1491.01,731.56,0.0
256,11645,4096,3072,cktile,11,0,197.2669,a8w8_blockscale_cktile_192x256x128_4x2x1_16x16x128_intrawave_0x1x0_1,1485.58,728.72,0.0
256,11667,4096,3072,cktile,11,0,195.4215,a8w8_blockscale_cktile_192x256x128_4x2x1_16x16x128_intrawave_0x1x0_1,1502.44,736.87,0.0
256,12004,4096,3072,cktile,11,0,196.977,a8w8_blockscale_cktile_192x256x128_4x2x1_16x16x128_intrawave_0x1x0_1,1533.63,750.32,0.0
256,12434,4096,3072,cktile,11,0,237.6853,a8w8_blockscale_cktile_192x256x128_4x2x1_16x16x128_intrawave_0x1x0_1,1316.5,642.19,0.0
256,12894,4096,3072,cktile,11,0,238.6552,a8w8_blockscale_cktile_192x256x128_4x2x1_16x16x128_intrawave_0x1x0_1,1359.65,661.29,0.0
256,12909,4096,3072,cktile,11,0,240.7353,a8w8_blockscale_cktile_192x256x128_4x2x1_16x16x128_intrawave_0x1x0_1,1349.47,656.28,0.0
256,13004,4096,3072,cktile,11,0,236.5545,a8w8_blockscale_cktile_192x256x128_4x2x1_16x16x128_intrawave_0x1x0_1,1383.43,672.4,0.0
256,13006,4096,3072,cktile,11,0,238.2879,a8w8_blockscale_cktile_192x256x128_4x2x1_16x16x128_intrawave_0x1x0_1,1373.58,667.61,0.0
256,13178,4096,3072,cktile,11,0,240.3026,a8w8_blockscale_cktile_192x256x128_4x2x1_16x16x128_intrawave_0x1x0_1,1380.07,670.07,0.0
256,15000,4096,3072,cktile,11,0,244.2698,a8w8_blockscale_cktile_192x256x128_4x2x1_16x16x128_intrawave_0x1x0_1,1545.37,743.21,0.0
256,15001,4096,3072,cktile,11,0,243.6704,a8w8_blockscale_cktile_192x256x128_4x2x1_16x16x128_intrawave_0x1x0_1,1549.28,745.08,0.0
256,15002,4096,3072,cktile,11,0,243.8268,a8w8_blockscale_cktile_192x256x128_4x2x1_16x16x128_intrawave_0x1x0_1,1548.38,744.65,0.0
256,15264,4096,3072,cktile,11,0,243.1769,a8w8_blockscale_cktile_192x256x128_4x2x1_16x16x128_intrawave_0x1x0_1,1579.64,758.78,0.0
256,15585,4096,3072,cktile,11,0,285.4154,a8w8_blockscale_cktile_192x256x128_4x2x1_16x16x128_intrawave_0x1x0_1,1374.17,659.15,0.0
256,16014,4096,3072,cktile,11,0,288.6994,a8w8_blockscale_cktile_192x256x128_4x2x1_16x16x128_intrawave_0x1x0_1,1395.93,668.39,0.0
256,16404,4096,3072,cktile,11,0,286.8108,a8w8_blockscale_cktile_192x256x128_4x2x1_16x16x128_intrawave_0x1x0_1,1439.35,688.11,0.0
256,16406,4096,3072,cktile,11,0,288.0475,a8w8_blockscale_cktile_192x256x128_4x2x1_16x16x128_intrawave_0x1x0_1,1433.34,685.23,0.0
256,18007,4096,3072,cktile,11,0,291.6803,a8w8_blockscale_cktile_192x256x128_4x2x1_16x16x128_intrawave_0x1x0_1,1553.62,738.53,0.0
256,18371,4096,3072,cktile,11,0,291.2899,a8w8_blockscale_cktile_192x256x128_4x2x1_16x16x128_intrawave_0x1x0_1,1587.15,753.59,0.0
256,18950,4096,3072,cktile,11,0,334.7199,a8w8_blockscale_cktile_192x256x128_4x2x1_16x16x128_intrawave_0x1x0_1,1424.75,675.3,0.0
256,18964,4096,3072,cktile,11,0,336.1808,a8w8_blockscale_cktile_192x256x128_4x2x1_16x16x128_intrawave_0x1x0_1,1419.61,672.83,0.0
256,20000,4096,3072,cktile,11,0,337.7884,a8w8_blockscale_cktile_192x256x128_4x2x1_16x16x128_intrawave_0x1x0_1,1490.03,704.18,0.0
256,20001,4096,3072,cktile,11,0,337.5176,a8w8_blockscale_cktile_192x256x128_4x2x1_16x16x128_intrawave_0x1x0_1,1491.3,704.78,0.0
256,20002,4096,3072,cktile,11,0,337.3924,a8w8_blockscale_cktile_192x256x128_4x2x1_16x16x128_intrawave_0x1x0_1,1491.93,705.07,0.0
256,20004,4096,3072,cktile,11,0,335.6928,a8w8_blockscale_cktile_192x256x128_4x2x1_16x16x128_intrawave_0x1x0_1,1499.64,708.71,0.0
256,20062,4096,3072,cktile,11,0,338.8128,a8w8_blockscale_cktile_192x256x128_4x2x1_16x16x128_intrawave_0x1x0_1,1490.13,704.11,0.0
256,20132,4096,3072,cktile,11,0,338.3135,a8w8_blockscale_cktile_192x256x128_4x2x1_16x16x128_intrawave_0x1x0_1,1497.54,707.48,0.0
256,20368,4096,3072,cktile,11,0,339.072,a8w8_blockscale_cktile_192x256x128_4x2x1_16x16x128_intrawave_0x1x0_1,1511.71,713.74,0.0
256,20602,4096,3072,cktile,11,0,338.8891,a8w8_blockscale_cktile_192x256x128_4x2x1_16x16x128_intrawave_0x1x0_1,1529.9,721.9,0.0
256,20666,4096,3072,cktile,11,0,339.1314,a8w8_blockscale_cktile_192x256x128_4x2x1_16x16x128_intrawave_0x1x0_1,1533.56,723.51,0.0
256,20830,4096,3072,cktile,11,0,339.7931,a8w8_blockscale_cktile_192x256x128_4x2x1_16x16x128_intrawave_0x1x0_1,1542.72,727.54,0.0
256,20929,4096,3072,cktile,11,0,339.6704,a8w8_blockscale_cktile_192x256x128_4x2x1_16x16x128_intrawave_0x1x0_1,1550.61,731.08,0.0
256,21545,4096,3072,cktile,11,0,374.5383,a8w8_blockscale_cktile_192x256x128_4x2x1_16x16x128_intrawave_0x1x0_1,1447.64,681.55,0.0
256,21610,4096,3072,cktile,11,0,377.5801,a8w8_blockscale_cktile_192x256x128_4x2x1_16x16x128_intrawave_0x1x0_1,1440.31,678.0,0.0
256,21721,4096,3072,cktile,11,0,378.9178,a8w8_blockscale_cktile_192x256x128_4x2x1_16x16x128_intrawave_0x1x0_1,1442.6,678.9,0.0
256,21738,4096,3072,cktile,11,0,377.969,a8w8_blockscale_cktile_192x256x128_4x2x1_16x16x128_intrawave_0x1x0_1,1447.35,681.11,0.0
256,21800,4096,3072,cktile,11,0,379.8116,a8w8_blockscale_cktile_192x256x128_4x2x1_16x16x128_intrawave_0x1x0_1,1444.44,679.65,0.0
256,21844,4096,3072,cktile,11,0,381.6786,a8w8_blockscale_cktile_192x256x128_4x2x1_16x16x128_intrawave_0x1x0_1,1440.28,677.62,0.0
256,21925,4096,3072,cktile,11,0,380.7795,a8w8_blockscale_cktile_192x256x128_4x2x1_16x16x128_intrawave_0x1x0_1,1449.03,681.62,0.0
256,22011,4096,3072,cktile,11,0,381.6254,a8w8_blockscale_cktile_192x256x128_4x2x1_16x16x128_intrawave_0x1x0_1,1451.49,682.65,0.0
256,22355,4096,3072,cktile,11,0,383.805,a8w8_blockscale_cktile_192x256x128_4x2x1_16x16x128_intrawave_0x1x0_1,1465.8,688.86,0.0
256,22410,4096,3072,cktile,11,0,386.5382,a8w8_blockscale_cktile_192x256x128_4x2x1_16x16x128_intrawave_0x1x0_1,1459.02,685.6,0.0
256,23010,4096,3072,cktile,11,0,386.1574,a8w8_blockscale_cktile_192x256x128_4x2x1_16x16x128_intrawave_0x1x0_1,1499.56,703.77,0.0
256,23463,4096,3072,cktile,11,0,389.6588,a8w8_blockscale_cktile_192x256x128_4x2x1_16x16x128_intrawave_0x1x0_1,1515.34,710.55,0.0
256,24008,4096,3072,cktile,11,0,388.2317,a8w8_blockscale_cktile_192x256x128_4x2x1_16x16x128_intrawave_0x1x0_1,1556.24,728.97,0.0
256,24605,4096,3072,cktile,11,0,423.7011,a8w8_blockscale_cktile_192x256x128_4x2x1_16x16x128_intrawave_0x1x0_1,1461.42,683.82,0.0
256,25000,4096,3072,cktile,11,0,428.6839,a8w8_blockscale_cktile_192x256x128_4x2x1_16x16x128_intrawave_0x1x0_1,1467.62,686.25,0.0
256,26007,4096,3072,cktile,11,0,432.7922,a8w8_blockscale_cktile_192x256x128_4x2x1_16x16x128_intrawave_0x1x0_1,1512.24,705.94,0.0
256,26038,4096,3072,cktile,11,0,434.9414,a8w8_blockscale_cktile_192x256x128_4x2x1_16x16x128_intrawave_0x1x0_1,1506.57,703.26,0.0
256,26191,4096,3072,cktile,11,0,437.4069,a8w8_blockscale_cktile_192x256x128_4x2x1_16x16x128_intrawave_0x1x0_1,1506.88,703.23,0.0
256,26922,4096,3072,cktile,11,0,434.6182,a8w8_blockscale_cktile_192x256x128_4x2x1_16x16x128_intrawave_0x1x0_1,1558.87,726.69,0.0
256,27654,4096,3072,cktile,11,0,466.1624,a8w8_blockscale_cktile_192x256x128_4x2x1_16x16x128_intrawave_0x1x0_1,1492.9,695.2,0.0
256,27935,4096,3072,cktile,11,0,474.8079,a8w8_blockscale_cktile_192x256x128_4x2x1_16x16x128_intrawave_0x1x0_1,1480.61,689.21,0.0
256,28429,4096,3072,cktile,11,0,477.866,a8w8_blockscale_cktile_192x256x128_4x2x1_16x16x128_intrawave_0x1x0_1,1497.15,696.44,0.0
256,28597,4096,3072,cktile,11,0,478.4721,a8w8_blockscale_cktile_192x256x128_4x2x1_16x16x128_intrawave_0x1x0_1,1504.09,699.52,0.0
256,29003,4096,3072,cktile,11,0,484.1167,a8w8_blockscale_cktile_192x256x128_4x2x1_16x16x128_intrawave_0x1x0_1,1507.66,700.81,0.0
256,30000,4096,3072,cktile,11,0,483.7473,a8w8_blockscale_cktile_192x256x128_4x2x1_16x16x128_intrawave_0x1x0_1,1560.68,724.56,0.0
256,30001,4096,3072,cktile,11,0,483.1799,a8w8_blockscale_cktile_192x256x128_4x2x1_16x16x128_intrawave_0x1x0_1,1562.56,725.43,0.0
256,30003,4096,3072,cktile,11,0,482.3977,a8w8_blockscale_cktile_192x256x128_4x2x1_16x16x128_intrawave_0x1x0_1,1565.2,726.66,0.0
256,30486,4096,3072,cktile,11,0,484.0264,a8w8_blockscale_cktile_192x256x128_4x2x1_16x16x128_intrawave_0x1x0_1,1585.05,735.45,0.0
256,30553,4096,3072,cktile,11,0,481.9878,a8w8_blockscale_cktile_192x256x128_4x2x1_16x16x128_intrawave_0x1x0_1,1595.25,740.13,0.0
256,30801,4096,3072,cktile,11,0,523.4312,a8w8_blockscale_cktile_192x256x128_4x2x1_16x16x128_intrawave_0x1x0_1,1480.87,686.86,0.0
256,31001,4096,3072,cktile,11,0,524.5876,a8w8_blockscale_cktile_192x256x128_4x2x1_16x16x128_intrawave_0x1x0_1,1487.2,689.64,0.0
256,31007,4096,3072,cktile,11,0,525.0101,a8w8_blockscale_cktile_192x256x128_4x2x1_16x16x128_intrawave_0x1x0_1,1486.29,689.22,0.0
256,31033,4096,3072,cktile,11,0,524.13,a8w8_blockscale_cktile_192x256x128_4x2x1_16x16x128_intrawave_0x1x0_1,1490.03,690.93,0.0
256,31895,4096,3072,cktile,11,0,532.7633,a8w8_blockscale_cktile_192x256x128_4x2x1_16x16x128_intrawave_0x1x0_1,1506.61,697.96,0.0
256,32001,4096,3072,cktile,11,0,529.7153,a8w8_blockscale_cktile_192x256x128_4x2x1_16x16x128_intrawave_0x1x0_1,1520.31,704.23,0.0
256,32002,4096,3072,cktile,11,0,528.9973,a8w8_blockscale_cktile_192x256x128_4x2x1_16x16x128_intrawave_0x1x0_1,1522.42,705.21,0.0
256,32005,4096,3072,cktile,11,0,530.7108,a8w8_blockscale_cktile_192x256x128_4x2x1_16x16x128_intrawave_0x1x0_1,1517.65,703.0,0.0
256,32006,4096,3072,cktile,11,0,529.1449,a8w8_blockscale_cktile_192x256x128_4x2x1_16x16x128_intrawave_0x1x0_1,1522.19,705.1,0.0
256,32007,4096,3072,cktile,11,0,526.9289,a8w8_blockscale_cktile_192x256x128_4x2x1_16x16x128_intrawave_0x1x0_1,1528.64,708.08,0.0
256,32019,4096,3072,cktile,11,0,532.8389,a8w8_blockscale_cktile_192x256x128_4x2x1_16x16x128_intrawave_0x1x0_1,1512.25,700.48,0.0
256,32315,4096,3072,cktile,11,0,534.6498,a8w8_blockscale_cktile_192x256x128_4x2x1_16x16x128_intrawave_0x1x0_1,1521.06,704.35,0.0
256,32409,4096,3072,cktile,11,0,529.6241,a8w8_blockscale_cktile_192x256x128_4x2x1_16x16x128_intrawave_0x1x0_1,1539.96,713.03,0.0
256,32417,4096,3072,cktile,11,0,530.212,a8w8_blockscale_cktile_192x256x128_4x2x1_16x16x128_intrawave_0x1x0_1,1538.63,712.41,0.0
256,33563,4096,3072,cktile,11,0,531.7417,a8w8_blockscale_cktile_192x256x128_4x2x1_16x16x128_intrawave_0x1x0_1,1588.44,734.64,0.0
256,33693,4096,3072,cktile,11,0,532.8229,a8w8_blockscale_cktile_192x256x128_4x2x1_16x16x128_intrawave_0x1x0_1,1591.36,735.89,0.0
256,33823,4096,3072,cktile,11,0,564.6689,a8w8_blockscale_cktile_192x256x128_4x2x1_16x16x128_intrawave_0x1x0_1,1507.4,696.98,0.0
256,34316,4096,3072,cktile,11,0,571.8332,a8w8_blockscale_cktile_192x256x128_4x2x1_16x16x128_intrawave_0x1x0_1,1510.21,697.96,0.0
256,34348,4096,3072,cktile,11,0,575.1258,a8w8_blockscale_cktile_192x256x128_4x2x1_16x16x128_intrawave_0x1x0_1,1502.97,694.59,0.0
256,34501,4096,3072,cktile,11,0,575.0482,a8w8_blockscale_cktile_192x256x128_4x2x1_16x16x128_intrawave_0x1x0_1,1509.87,697.68,0.0
256,35001,4096,3072,cktile,11,0,578.2535,a8w8_blockscale_cktile_192x256x128_4x2x1_16x16x128_intrawave_0x1x0_1,1523.26,703.56,0.0
256,35108,4096,3072,cktile,11,0,576.7744,a8w8_blockscale_cktile_192x256x128_4x2x1_16x16x128_intrawave_0x1x0_1,1531.83,707.45,0.0
256,35546,4096,3072,cktile,11,0,576.711,a8w8_blockscale_cktile_192x256x128_4x2x1_16x16x128_intrawave_0x1x0_1,1551.11,716.08,0.0
256,36016,4096,3072,cktile,11,0,581.7247,a8w8_blockscale_cktile_192x256x128_4x2x1_16x16x128_intrawave_0x1x0_1,1558.08,719.01,0.0
256,36031,4096,3072,cktile,11,0,579.7243,a8w8_blockscale_cktile_192x256x128_4x2x1_16x16x128_intrawave_0x1x0_1,1564.11,721.78,0.0
256,36171,4096,3072,cktile,11,0,579.8312,a8w8_blockscale_cktile_192x256x128_4x2x1_16x16x128_intrawave_0x1x0_1,1569.89,724.37,0.0
256,37042,4096,3072,cktile,11,0,619.7612,a8w8_blockscale_cktile_192x256x128_4x2x1_16x16x128_intrawave_0x1x0_1,1504.12,693.53,0.0
256,37515,4096,3072,cktile,11,0,616.162,a8w8_blockscale_cktile_192x256x128_4x2x1_16x16x128_intrawave_0x1x0_1,1532.22,706.23,0.0
256,38016,4096,3072,cktile,11,0,625.2321,a8w8_blockscale_cktile_192x256x128_4x2x1_16x16x128_intrawave_0x1x0_1,1530.16,705.01,0.0
256,38326,4096,3072,cktile,11,0,627.0205,a8w8_blockscale_cktile_192x256x128_4x2x1_16x16x128_intrawave_0x1x0_1,1538.24,708.57,0.0
256,38508,4096,3072,cktile,11,0,624.5138,a8w8_blockscale_cktile_192x256x128_4x2x1_16x16x128_intrawave_0x1x0_1,1551.74,714.7,0.0
256,39284,4096,3072,cktile,11,0,628.9757,a8w8_blockscale_cktile_192x256x128_4x2x1_16x16x128_intrawave_0x1x0_1,1571.78,723.52,0.0
256,39980,4096,3072,cktile,11,0,664.7778,a8w8_blockscale_cktile_192x256x128_4x2x1_16x16x128_intrawave_0x1x0_1,1513.48,696.35,0.0
256,40476,4096,3072,cktile,11,0,670.2606,a8w8_blockscale_cktile_192x256x128_4x2x1_16x16x128_intrawave_0x1x0_1,1519.73,698.99,0.0
256,40715,4096,3072,cktile,11,0,669.6886,a8w8_blockscale_cktile_192x256x128_4x2x1_16x16x128_intrawave_0x1x0_1,1530.0,703.61,0.0
256,41215,4096,3072,cktile,11,0,673.6831,a8w8_blockscale_cktile_192x256x128_4x2x1_16x16x128_intrawave_0x1x0_1,1539.61,707.79,0.0
256,41307,4096,3072,cktile,11,0,674.494,a8w8_blockscale_cktile_192x256x128_4x2x1_16x16x128_intrawave_0x1x0_1,1541.19,708.48,0.0
256,42387,4096,3072,cktile,11,0,677.4819,a8w8_blockscale_cktile_192x256x128_4x2x1_16x16x128_intrawave_0x1x0_1,1574.51,723.31,0.0
256,42405,4096,3072,cktile,11,0,677.8985,a8w8_blockscale_cktile_192x256x128_4x2x1_16x16x128_intrawave_0x1x0_1,1574.21,723.17,0.0
256,42707,4096,3072,cktile,11,0,677.4962,a8w8_blockscale_cktile_192x256x128_4x2x1_16x16x128_intrawave_0x1x0_1,1586.37,728.62,0.0
256,43337,4096,3072,cktile,11,0,717.1426,a8w8_blockscale_cktile_192x256x128_4x2x1_16x16x128_intrawave_0x1x0_1,1520.77,698.23,0.0
256,44313,4096,3072,cktile,11,0,721.6181,a8w8_blockscale_cktile_192x256x128_4x2x1_16x16x128_intrawave_0x1x0_1,1545.38,709.13,0.0
256,45002,4096,3072,cktile,11,0,723.0069,a8w8_blockscale_cktile_192x256x128_4x2x1_16x16x128_intrawave_0x1x0_1,1566.39,718.51,0.0
256,45224,4096,3072,cktile,11,0,725.0962,a8w8_blockscale_cktile_192x256x128_4x2x1_16x16x128_intrawave_0x1x0_1,1569.58,719.89,0.0
256,46082,4096,3072,cktile,11,0,756.8109,a8w8_blockscale_cktile_192x256x128_4x2x1_16x16x128_intrawave_0x1x0_1,1532.34,702.49,0.0
256,47900,4096,3072,cktile,11,0,772.2875,a8w8_blockscale_cktile_192x256x128_4x2x1_16x16x128_intrawave_0x1x0_1,1560.87,714.93,0.0
256,47925,4096,3072,cktile,11,0,771.1251,a8w8_blockscale_cktile_192x256x128_4x2x1_16x16x128_intrawave_0x1x0_1,1564.04,716.37,0.0
256,47996,4096,3072,cktile,11,0,777.4452,a8w8_blockscale_cktile_192x256x128_4x2x1_16x16x128_intrawave_0x1x0_1,1553.63,711.57,0.0
256,48137,4096,3072,cktile,11,0,773.8459,a8w8_blockscale_cktile_192x256x128_4x2x1_16x16x128_intrawave_0x1x0_1,1565.44,716.94,0.0
256,48329,4096,3072,cktile,11,0,769.9427,a8w8_blockscale_cktile_192x256x128_4x2x1_16x16x128_intrawave_0x1x0_1,1579.65,723.38,0.0
256,48530,4096,3072,cktile,11,0,771.216,a8w8_blockscale_cktile_192x256x128_4x2x1_16x16x128_intrawave_0x1x0_1,1583.6,725.12,0.0
256,49527,4096,3072,cktile,11,0,816.9022,a8w8_blockscale_cktile_192x256x128_4x2x1_16x16x128_intrawave_0x1x0_1,1525.75,698.31,0.0
256,49559,4096,3072,cktile,11,0,820.7197,a8w8_blockscale_cktile_192x256x128_4x2x1_16x16x128_intrawave_0x1x0_1,1519.63,695.51,0.0
256,50001,4096,3072,cktile,11,0,820.8677,a8w8_blockscale_cktile_192x256x128_4x2x1_16x16x128_intrawave_0x1x0_1,1532.91,701.45,0.0
256,50002,4096,3072,cktile,11,0,813.6792,a8w8_blockscale_cktile_192x256x128_4x2x1_16x16x128_intrawave_0x1x0_1,1546.48,707.66,0.0
256,50111,4096,3072,cktile,11,0,817.999,a8w8_blockscale_cktile_192x256x128_4x2x1_16x16x128_intrawave_0x1x0_1,1541.67,705.42,0.0
256,52991,4096,3072,cktile,11,0,861.6466,a8w8_blockscale_cktile_192x256x128_4x2x1_16x16x128_intrawave_0x1x0_1,1547.69,707.34,0.0
256,53073,4096,3072,cktile,11,0,865.1397,a8w8_blockscale_cktile_192x256x128_4x2x1_16x16x128_intrawave_0x1x0_1,1543.83,705.55,0.0
256,53093,4096,3072,cktile,11,0,856.6006,a8w8_blockscale_cktile_192x256x128_4x2x1_16x16x128_intrawave_0x1x0_1,1559.8,712.84,0.0
256,53126,4096,3072,cktile,11,0,864.4138,a8w8_blockscale_cktile_192x256x128_4x2x1_16x16x128_intrawave_0x1x0_1,1546.67,706.83,0.0
256,53264,4096,3072,cktile,11,0,862.0658,a8w8_blockscale_cktile_192x256x128_4x2x1_16x16x128_intrawave_0x1x0_1,1554.91,710.56,0.0
256,53520,4096,3072,cktile,11,0,866.2363,a8w8_blockscale_cktile_192x256x128_4x2x1_16x16x128_intrawave_0x1x0_1,1554.86,710.47,0.0
256,53579,4096,3072,cktile,11,0,866.8179,a8w8_blockscale_cktile_192x256x128_4x2x1_16x16x128_intrawave_0x1x0_1,1555.53,710.76,0.0
256,53701,4096,3072,cktile,11,0,873.4052,a8w8_blockscale_cktile_192x256x128_4x2x1_16x16x128_intrawave_0x1x0_1,1547.31,706.97,0.0
256,53956,4096,3072,cktile,11,0,869.8647,a8w8_blockscale_cktile_192x256x128_4x2x1_16x16x128_intrawave_0x1x0_1,1560.99,713.15,0.0
256,55001,4096,3072,cktile,11,0,872.0136,a8w8_blockscale_cktile_192x256x128_4x2x1_16x16x128_intrawave_0x1x0_1,1587.3,724.89,0.0
256,55004,4096,3072,cktile,11,0,869.5507,a8w8_blockscale_cktile_192x256x128_4x2x1_16x16x128_intrawave_0x1x0_1,1591.88,726.98,0.0
256,55005,4096,3072,cktile,11,0,868.1131,a8w8_blockscale_cktile_192x256x128_4x2x1_16x16x128_intrawave_0x1x0_1,1594.55,728.2,0.0
256,55027,4096,3072,cktile,11,0,871.454,a8w8_blockscale_cktile_192x256x128_4x2x1_16x16x128_intrawave_0x1x0_1,1589.07,725.69,0.0
256,56131,4096,3072,cktile,11,0,914.8601,a8w8_blockscale_cktile_192x256x128_4x2x1_16x16x128_intrawave_0x1x0_1,1544.04,704.85,0.0
256,57100,4096,3072,cktile,11,0,917.403,a8w8_blockscale_cktile_192x256x128_4x2x1_16x16x128_intrawave_0x1x0_1,1566.34,714.8,0.0
256,58563,4096,3072,cktile,11,0,960.2443,a8w8_blockscale_cktile_192x256x128_4x2x1_16x16x128_intrawave_0x1x0_1,1534.8,700.07,0.0
256,59069,4096,3072,cktile,11,0,960.1143,a8w8_blockscale_cktile_192x256x128_4x2x1_16x16x128_intrawave_0x1x0_1,1548.27,706.1,0.0
256,60002,4096,3072,cktile,11,0,961.8277,a8w8_blockscale_cktile_192x256x128_4x2x1_16x16x128_intrawave_0x1x0_1,1569.93,715.77,0.0
256,60004,4096,3072,cktile,11,0,967.8524,a8w8_blockscale_cktile_192x256x128_4x2x1_16x16x128_intrawave_0x1x0_1,1560.21,711.34,0.0
256,60012,4096,3072,cktile,11,0,968.3316,a8w8_blockscale_cktile_192x256x128_4x2x1_16x16x128_intrawave_0x1x0_1,1559.64,711.08,0.0
256,60026,4096,3072,cktile,11,0,963.0543,a8w8_blockscale_cktile_192x256x128_4x2x1_16x16x128_intrawave_0x1x0_1,1568.56,715.14,0.0
256,61447,4096,3072,cktile,11,0,1000.6836,a8w8_blockscale_cktile_192x256x128_4x2x1_16x16x128_intrawave_0x1x0_1,1545.31,704.24,0.0
256,61539,4096,3072,cktile,11,0,996.68,a8w8_blockscale_cktile_192x256x128_4x2x1_16x16x128_intrawave_0x1x0_1,1553.84,708.11,0.0
256,64005,4096,3072,cktile,11,0,1017.3818,a8w8_blockscale_cktile_192x256x128_4x2x1_16x16x128_intrawave_0x1x0_1,1583.22,721.0,0.0
256,64507,4096,3072,cktile,11,0,1008.7959,a8w8_blockscale_cktile_192x256x128_4x2x1_16x16x128_intrawave_0x1x0_1,1609.22,732.74,0.0
256,64616,4096,3072,cktile,11,0,1058.184,a8w8_blockscale_cktile_192x256x128_4x2x1_16x16x128_intrawave_0x1x0_1,1536.7,699.71,0.0
256,64872,4096,3072,cktile,11,0,1056.0728,a8w8_blockscale_cktile_192x256x128_4x2x1_16x16x128_intrawave_0x1x0_1,1545.88,703.84,0.0
256,65089,4096,3072,cktile,11,0,1059.193,a8w8_blockscale_cktile_192x256x128_4x2x1_16x16x128_intrawave_0x1x0_1,1546.48,704.07,0.0
256,65092,4096,3072,cktile,11,0,1061.9117,a8w8_blockscale_cktile_192x256x128_4x2x1_16x16x128_intrawave_0x1x0_1,1542.59,702.3,0.0
256,65102,4096,3072,cktile,11,0,1057.858,a8w8_blockscale_cktile_192x256x128_4x2x1_16x16x128_intrawave_0x1x0_1,1548.74,705.1,0.0
256,65126,4096,3072,cktile,11,0,1056.9155,a8w8_blockscale_cktile_192x256x128_4x2x1_16x16x128_intrawave_0x1x0_1,1550.69,705.98,0.0
256,65316,4096,3072,cktile,11,0,1049.6841,a8w8_blockscale_cktile_192x256x128_4x2x1_16x16x128_intrawave_0x1x0_1,1565.93,712.88,0.0
256,65317,4096,3072,cktile,11,0,1060.1816,a8w8_blockscale_cktile_192x256x128_4x2x1_16x16x128_intrawave_0x1x0_1,1550.45,705.84,0.0
256,65339,4096,3072,cktile,11,0,1056.2221,a8w8_blockscale_cktile_192x256x128_4x2x1_16x16x128_intrawave_0x1x0_1,1556.78,708.72,0.0
256,65348,4096,3072,cktile,11,0,1060.5793,a8w8_blockscale_cktile_192x256x128_4x2x1_16x16x128_intrawave_0x1x0_1,1550.6,705.9,0.0
256,65536,4096,3072,cktile,11,0,1054.5304,a8w8_blockscale_cktile_192x256x128_4x2x1_16x16x128_intrawave_0x1x0_1,1563.98,711.96,0.0
256,1,6144,1536,ck,8,0,7.1635,a8w8_blockscale_1x128x128_256x16x64x256_16x16_16x16_1x1_16x16x1_16x16x1_1x16x1x16_4_1x1_intrawave_v1,2.63,1319.33,0.0
256,2,6144,1536,ck,8,0,8.2127,a8w8_blockscale_1x128x128_256x16x64x256_16x16_16x16_1x1_16x16x1_16x16x1_1x16x1x16_4_1x1_intrawave_v1,4.6,1152.46,0.0
256,4,6144,1536,ck,8,0,6.9155,a8w8_blockscale_1x128x128_256x16x64x256_16x16_16x16_1x1_16x16x1_16x16x1_1x16x1x16_4_1x1_intrawave_v1,10.92,1372.64,0.0
256,8,6144,1536,ck,8,0,7.5223,a8w8_blockscale_1x128x128_256x16x64x256_16x16_16x16_1x1_16x16x1_16x16x1_1x16x1x16_4_1x1_intrawave_v1,20.07,1269.26,0.0
256,16,6144,1536,ck,8,0,7.1035,a8w8_blockscale_1x128x128_256x16x64x256_16x16_16x16_1x1_16x16x1_16x16x1_1x16x1x16_4_1x1_intrawave_v1,42.51,1359.66,0.0
256,24,6144,1536,ck,8,0,7.6282,a8w8_blockscale_1x128x128_256x16x64x256_16x16_16x16_1x1_16x16x1_16x16x1_1x16x1x16_4_1x1_intrawave_v1,59.38,1280.64,0.0
256,32,6144,1536,ck,8,0,7.3427,a8w8_blockscale_1x128x128_256x16x64x256_16x16_16x16_1x1_16x16x1_16x16x1_1x16x1x16_4_1x1_intrawave_v1,82.26,1345.49,0.0
256,40,6144,1536,ck,7,0,8.3268,a8w8_blockscale_1x128x128_256x16x128x256_16x16_16x16_1x2_16x16x1_16x16x1_1x16x1x16_8_1x2_intrawave_v1,90.67,1199.76,0.0
256,48,6144,1536,ck,7,0,8.1431,a8w8_blockscale_1x128x128_256x16x128x256_16x16_16x16_1x2_16x16x1_16x16x1_1x16x1x16_8_1x2_intrawave_v1,111.26,1240.4,0.0
256,56,6144,1536,ck,7,0,7.9345,a8w8_blockscale_1x128x128_256x16x128x256_16x16_16x16_1x2_16x16x1_16x16x1_1x16x1x16_8_1x2_intrawave_v1,133.21,1286.95,0.0
256,64,6144,1536,ck,7,0,8.077,a8w8_blockscale_1x128x128_256x16x128x256_16x16_16x16_1x2_16x16x1_16x16x1_1x16x1x16_8_1x2_intrawave_v1,149.56,1277.94,0.0
256,72,6144,1536,ck,7,0,8.2886,a8w8_blockscale_1x128x128_256x16x128x256_16x16_16x16_1x2_16x16x1_16x16x1_1x16x1x16_8_1x2_intrawave_v1,163.95,1258.66,0.0
256,80,6144,1536,ck,7,0,8.1063,a8w8_blockscale_1x128x128_256x16x128x256_16x16_16x16_1x2_16x16x1_16x16x1_1x16x1x16_8_1x2_intrawave_v1,186.27,1300.61,0.0
256,88,6144,1536,ck,18,0,9.5537,a8w8_blockscale_1x128x128_256x64x64x256_16x16_32x32_1x1_16x16x1_16x16x1_1x32x1x8_8_1x1_intrawave_v1,173.85,1115.14,0.0
256,96,6144,1536,ck,12,0,9.2091,a8w8_blockscale_1x128x128_256x32x128x256_16x16_32x32_1x1_16x16x1_16x16x1_1x32x1x8_8_1x1_intrawave_v1,196.76,1168.88,0.0
256,104,6144,1536,ck,18,0,9.5849,a8w8_blockscale_1x128x128_256x64x64x256_16x16_32x32_1x1_16x16x1_16x16x1_1x32x1x8_8_1x1_intrawave_v1,204.79,1134.58,0.0
256,112,6144,1536,ck,18,0,9.5672,a8w8_blockscale_1x128x128_256x64x64x256_16x16_32x32_1x1_16x16x1_16x16x1_1x32x1x8_8_1x1_intrawave_v1,220.96,1148.24,0.0
256,120,6144,1536,ck,18,0,9.6606,a8w8_blockscale_1x128x128_256x64x64x256_16x16_32x32_1x1_16x16x1_16x16x1_1x32x1x8_8_1x1_intrawave_v1,234.45,1148.59,0.0
256,128,6144,1536,ck,18,0,8.2433,a8w8_blockscale_1x128x128_256x64x64x256_16x16_32x32_1x1_16x16x1_16x16x1_1x32x1x8_8_1x1_intrawave_v1,293.08,1359.49,0.0
256,136,6144,1536,ck,12,0,10.2957,a8w8_blockscale_1x128x128_256x32x128x256_16x16_32x32_1x1_16x16x1_16x16x1_1x32x1x8_8_1x1_intrawave_v1,249.32,1099.22,0.0
256,144,6144,1536,ck,12,0,10.3708,a8w8_blockscale_1x128x128_256x32x128x256_16x16_32x32_1x1_16x16x1_16x16x1_1x32x1x8_8_1x1_intrawave_v1,262.07,1101.92,0.0
256,152,6144,1536,ck,12,0,10.3103,a8w8_blockscale_1x128x128_256x32x128x256_16x16_32x32_1x1_16x16x1_16x16x1_1x32x1x8_8_1x1_intrawave_v1,278.26,1119.12,0.0
256,160,6144,1536,ck,12,0,9.7649,a8w8_blockscale_1x128x128_256x32x128x256_16x16_32x32_1x1_16x16x1_16x16x1_1x32x1x8_8_1x1_intrawave_v1,309.26,1192.95,0.0
256,168,6144,1536,ck,2,0,12.7928,a8w8_blockscale_1x128x128_256x64x128x128_16x16_32x32_1x2_8x32x1_8x32x1_1x32x1x8_8_1x1_intrawave_v3,247.87,919.24,0.0
256,176,6144,1536,ck,2,0,12.6189,a8w8_blockscale_1x128x128_256x64x128x128_16x16_32x32_1x2_8x32x1_8x32x1_1x32x1x8_8_1x1_intrawave_v3,263.25,940.67,0.0
256,184,6144,1536,ck,2,0,12.8008,a8w8_blockscale_1x128x128_256x64x128x128_16x16_32x32_1x2_8x32x1_8x32x1_1x32x1x8_8_1x1_intrawave_v3,271.3,935.94,0.0
256,192,6144,1536,ck,2,0,12.6179,a8w8_blockscale_1x128x128_256x64x128x128_16x16_32x32_1x2_8x32x1_8x32x1_1x32x1x8_8_1x1_intrawave_v3,287.2,958.27,0.0
256,200,6144,1536,ck,2,0,12.8496,a8w8_blockscale_1x128x128_256x64x128x128_16x16_32x32_1x2_8x32x1_8x32x1_1x32x1x8_8_1x1_intrawave_v3,293.77,949.6,0.0
256,208,6144,1536,ck,2,0,12.6742,a8w8_blockscale_1x128x128_256x64x128x128_16x16_32x32_1x2_8x32x1_8x32x1_1x32x1x8_8_1x1_intrawave_v3,309.75,971.47,0.0
256,216,6144,1536,ck,2,0,12.8958,a8w8_blockscale_1x128x128_256x64x128x128_16x16_32x32_1x2_8x32x1_8x32x1_1x32x1x8_8_1x1_intrawave_v3,316.14,963.35,0.0
256,224,6144,1536,ck,2,0,12.6831,a8w8_blockscale_1x128x128_256x64x128x128_16x16_32x32_1x2_8x32x1_8x32x1_1x32x1x8_8_1x1_intrawave_v3,333.35,988.23,0.0
256,232,6144,1536,ck,2,0,12.6991,a8w8_blockscale_1x128x128_256x64x128x128_16x16_32x32_1x2_8x32x1_8x32x1_1x32x1x8_8_1x1_intrawave_v3,344.82,995.69,0.0
256,240,6144,1536,ck,2,0,12.8804,a8w8_blockscale_1x128x128_256x64x128x128_16x16_32x32_1x2_8x32x1_8x32x1_1x32x1x8_8_1x1_intrawave_v3,351.69,990.26,0.0
256,248,6144,1536,ck,2,0,12.936,a8w8_blockscale_1x128x128_256x64x128x128_16x16_32x32_1x2_8x32x1_8x32x1_1x32x1x8_8_1x1_intrawave_v3,361.85,994.55,0.0
256,256,6144,1536,ck,2,0,12.4491,a8w8_blockscale_1x128x128_256x64x128x128_16x16_32x32_1x2_8x32x1_8x32x1_1x32x1x8_8_1x1_intrawave_v3,388.13,1042.33,0.0
256,272,6144,1536,ck,2,0,12.9686,a8w8_blockscale_1x128x128_256x64x128x128_16x16_32x32_1x2_8x32x1_8x32x1_1x32x1x8_8_1x1_intrawave_v3,395.87,1017.64,0.0
256,288,6144,1536,ck,2,0,13.1339,a8w8_blockscale_1x128x128_256x64x128x128_16x16_32x32_1x2_8x32x1_8x32x1_1x32x1x8_8_1x1_intrawave_v3,413.88,1021.67,0.0
256,304,6144,1536,ck,2,0,13.0538,a8w8_blockscale_1x128x128_256x64x128x128_16x16_32x32_1x2_8x32x1_8x32x1_1x32x1x8_8_1x1_intrawave_v3,439.55,1044.88,0.0
256,320,6144,1536,ck,2,0,13.0421,a8w8_blockscale_1x128x128_256x64x128x128_16x16_32x32_1x2_8x32x1_8x32x1_1x32x1x8_8_1x1_intrawave_v3,463.1,1062.78,0.0
256,336,6144,1536,ck,3,0,15.9909,a8w8_blockscale_1x128x128_256x64x64x128_16x16_32x32_1x1_8x32x1_8x32x1_1x32x1x8_8_1x1_intrawave_v3,396.59,880.63,0.0
256,352,6144,1536,ck,3,0,15.9118,a8w8_blockscale_1x128x128_256x64x64x128_16x16_32x32_1x1_8x32x1_8x32x1_1x32x1x8_8_1x1_intrawave_v3,417.54,898.91,0.0
256,368,6144,1536,ck,3,0,16.1416,a8w8_blockscale_1x128x128_256x64x64x128_16x16_32x32_1x1_8x32x1_8x32x1_1x32x1x8_8_1x1_intrawave_v3,430.3,899.81,0.0
256,384,6144,1536,ck,0,0,15.9789,a8w8_blockscale_1x128x128_256x128x128x128_16x16_32x32_2x2_8x32x1_8x32x1_1x32x1x8_8_1x1_intrawave_v3,453.58,922.82,0.0
256,400,6144,1536,ck,0,0,16.5703,a8w8_blockscale_1x128x128_256x128x128x128_16x16_32x32_2x2_8x32x1_8x32x1_1x32x1x8_8_1x1_intrawave_v3,455.62,903.23,0.0
256,416,6144,1536,ck,0,0,16.5803,a8w8_blockscale_1x128x128_256x128x128x128_16x16_32x32_2x2_8x32x1_8x32x1_1x32x1x8_8_1x1_intrawave_v3,473.56,916.02,0.0
256,432,6144,1536,ck,0,0,16.7347,a8w8_blockscale_1x128x128_256x128x128x128_16x16_32x32_2x2_8x32x1_8x32x1_1x32x1x8_8_1x1_intrawave_v3,487.23,920.79,0.0
256,448,6144,1536,ck,0,0,16.7143,a8w8_blockscale_1x128x128_256x128x128x128_16x16_32x32_2x2_8x32x1_8x32x1_1x32x1x8_8_1x1_intrawave_v3,505.9,935.15,0.0
256,464,6144,1536,ck,0,0,16.7963,a8w8_blockscale_1x128x128_256x128x128x128_16x16_32x32_2x2_8x32x1_8x32x1_1x32x1x8_8_1x1_intrawave_v3,521.41,943.75,0.0
256,480,6144,1536,ck,0,0,16.9476,a8w8_blockscale_1x128x128_256x128x128x128_16x16_32x32_2x2_8x32x1_8x32x1_1x32x1x8_8_1x1_intrawave_v3,534.57,948.38,0.0
256,496,6144,1536,ck,0,0,17.1337,a8w8_blockscale_1x128x128_256x128x128x128_16x16_32x32_2x2_8x32x1_8x32x1_1x32x1x8_8_1x1_intrawave_v3,546.39,950.98,0.0
256,512,6144,1536,ck,0,0,16.3827,a8w8_blockscale_1x128x128_256x128x128x128_16x16_32x32_2x2_8x32x1_8x32x1_1x32x1x8_8_1x1_intrawave_v3,589.87,1008.08,0.0
256,621,6144,1536,ck,0,0,17.5622,a8w8_blockscale_1x128x128_256x128x128x128_16x16_32x32_2x2_8x32x1_8x32x1_1x32x1x8_8_1x1_intrawave_v3,667.4,1026.17,0.0
256,640,6144,1536,ck,0,0,17.0496,a8w8_blockscale_1x128x128_256x128x128x128_16x16_32x32_2x2_8x32x1_8x32x1_1x32x1x8_8_1x1_intrawave_v3,708.5,1072.43,0.0
256,666,6144,1536,ck,2,0,23.758,a8w8_blockscale_1x128x128_256x64x128x128_16x16_32x32_1x2_8x32x1_8x32x1_1x32x1x8_8_1x1_intrawave_v3,529.1,784.74,0.0
256,818,6144,1536,ck,2,0,24.6916,a8w8_blockscale_1x128x128_256x64x128x128_16x16_32x32_1x2_8x32x1_8x32x1_1x32x1x8_8_1x1_intrawave_v3,625.28,840.17,0.0
256,826,6144,1536,ck,2,0,24.9066,a8w8_blockscale_1x128x128_256x64x128x128_16x16_32x32_1x2_8x32x1_8x32x1_1x32x1x8_8_1x1_intrawave_v3,625.95,837.36,0.0
256,926,6144,1536,ck,2,0,25.2979,a8w8_blockscale_1x128x128_256x64x128x128_16x16_32x32_1x2_8x32x1_8x32x1_1x32x1x8_8_1x1_intrawave_v3,690.87,879.05,0.0
256,930,6144,1536,ck,2,0,25.1335,a8w8_blockscale_1x128x128_256x64x128x128_16x16_32x32_1x2_8x32x1_8x32x1_1x32x1x8_8_1x1_intrawave_v3,698.4,887.0,0.0
256,956,6144,1536,ck,2,0,25.1149,a8w8_blockscale_1x128x128_256x64x128x128_16x16_32x32_1x2_8x32x1_8x32x1_1x32x1x8_8_1x1_intrawave_v3,718.45,901.97,0.0
256,1000,6144,1536,ck,2,0,25.9331,a8w8_blockscale_1x128x128_256x64x128x128_16x16_32x32_1x2_8x32x1_8x32x1_1x32x1x8_8_1x1_intrawave_v3,727.81,896.97,0.0
256,1001,6144,1536,ck,2,0,25.8138,a8w8_blockscale_1x128x128_256x64x128x128_16x16_32x32_1x2_8x32x1_8x32x1_1x32x1x8_8_1x1_intrawave_v3,731.9,901.65,0.0
256,1003,6144,1536,ck,2,0,26.0025,a8w8_blockscale_1x128x128_256x64x128x128_16x16_32x32_1x2_8x32x1_8x32x1_1x32x1x8_8_1x1_intrawave_v3,728.05,896.17,0.0
256,1019,6144,1536,ck,2,0,25.5239,a8w8_blockscale_1x128x128_256x64x128x128_16x16_32x32_1x2_8x32x1_8x32x1_1x32x1x8_8_1x1_intrawave_v3,753.53,921.64,0.0
256,1109,6144,1536,ck,0,0,26.5847,a8w8_blockscale_1x128x128_256x128x128x128_16x16_32x32_2x2_8x32x1_8x32x1_1x32x1x8_8_1x1_intrawave_v3,787.36,931.66,0.0
256,1112,6144,1536,ck,0,0,26.4819,a8w8_blockscale_1x128x128_256x128x128x128_16x16_32x32_2x2_8x32x1_8x32x1_1x32x1x8_8_1x1_intrawave_v3,792.55,936.85,0.0
256,1119,6144,1536,ck,0,0,26.4446,a8w8_blockscale_1x128x128_256x128x128x128_16x16_32x32_2x2_8x32x1_8x32x1_1x32x1x8_8_1x1_intrawave_v3,798.67,941.83,0.0
256,1131,6144,1536,ck,0,0,26.4053,a8w8_blockscale_1x128x128_256x128x128x128_16x16_32x32_2x2_8x32x1_8x32x1_1x32x1x8_8_1x1_intrawave_v3,808.43,949.51,0.0
256,1218,6144,1536,ck,0,0,27.0359,a8w8_blockscale_1x128x128_256x128x128x128_16x16_32x32_2x2_8x32x1_8x32x1_1x32x1x8_8_1x1_intrawave_v3,850.31,971.85,0.0
256,1255,6144,1536,ck,0,0,27.0524,a8w8_blockscale_1x128x128_256x128x128x128_16x16_32x32_2x2_8x32x1_8x32x1_1x32x1x8_8_1x1_intrawave_v3,875.61,990.16,0.0
256,1351,6144,1536,cktile,11,0,36.1283,a8w8_blockscale_cktile_192x256x128_4x2x1_16x16x128_intrawave_0x1x0_1,705.8,778.15,0.0
256,1591,6144,1536,cktile,12,0,36.6657,a8w8_blockscale_cktile_192x256x128_4x2x1_16x16x128_intrawave_0x1x0_2,819.0,857.24,0.0
256,1710,6144,1536,cktile,11,0,36.8027,a8w8_blockscale_cktile_192x256x128_4x2x1_16x16x128_intrawave_0x1x0_1,876.98,898.74,0.0
256,1733,6144,1536,cktile,12,0,37.0358,a8w8_blockscale_cktile_192x256x128_4x2x1_16x16x128_intrawave_0x1x0_2,883.18,901.67,0.0
256,1768,6144,1536,cktile,11,0,37.255,a8w8_blockscale_cktile_192x256x128_4x2x1_16x16x128_intrawave_0x1x0_1,895.72,909.35,0.0
256,1808,6144,1536,cktile,11,0,37.5603,a8w8_blockscale_cktile_192x256x128_4x2x1_16x16x128_intrawave_0x1x0_1,908.54,916.69,0.0
256,1809,6144,1536,cktile,12,0,37.1166,a8w8_blockscale_cktile_192x256x128_4x2x1_16x16x128_intrawave_0x1x0_2,919.9,928.02,0.0
256,1814,6144,1536,cktile,12,0,37.2865,a8w8_blockscale_cktile_192x256x128_4x2x1_16x16x128_intrawave_0x1x0_2,918.24,925.64,0.0
256,1816,6144,1536,cktile,12,0,37.1376,a8w8_blockscale_cktile_192x256x128_4x2x1_16x16x128_intrawave_0x1x0_2,922.94,930.1,0.0
256,1817,6144,1536,cktile,12,0,36.9671,a8w8_blockscale_cktile_192x256x128_4x2x1_16x16x128_intrawave_0x1x0_2,927.71,934.76,0.0
256,1821,6144,1536,cktile,12,0,37.1899,a8w8_blockscale_cktile_192x256x128_4x2x1_16x16x128_intrawave_0x1x0_2,924.18,930.65,0.0
256,1864,6144,1536,cktile,12,0,37.1112,a8w8_blockscale_cktile_192x256x128_4x2x1_16x16x128_intrawave_0x1x0_2,948.01,948.64,0.0
256,1865,6144,1536,cktile,12,0,37.2294,a8w8_blockscale_cktile_192x256x128_4x2x1_16x16x128_intrawave_0x1x0_2,945.51,946.0,0.0
256,1965,6144,1536,ck,0,0,40.2235,a8w8_blockscale_1x128x128_256x128x128x128_16x16_32x32_2x2_8x32x1_8x32x1_1x32x1x8_8_1x1_intrawave_v3,922.05,909.95,0.0
256,2000,6144,1536,ck,0,0,40.6076,a8w8_blockscale_1x128x128_256x128x128x128_16x16_32x32_2x2_8x32x1_8x32x1_1x32x1x8_8_1x1_intrawave_v3,929.6,913.26,0.0
256,2002,6144,1536,ck,0,0,40.0146,a8w8_blockscale_1x128x128_256x128x128x128_16x16_32x32_2x2_8x32x1_8x32x1_1x32x1x8_8_1x1_intrawave_v3,944.32,927.48,0.0
256,2006,6144,1536,ck,0,0,40.6914,a8w8_blockscale_1x128x128_256x128x128x128_16x16_32x32_2x2_8x32x1_8x32x1_1x32x1x8_8_1x1_intrawave_v3,930.47,913.41,0.0
256,2054,6144,1536,ck,0,0,47.0701,a8w8_blockscale_1x128x128_256x128x128x128_16x16_32x32_2x2_8x32x1_8x32x1_1x32x1x8_8_1x1_intrawave_v3,823.62,803.73,0.0
256,2079,6144,1536,ck,0,0,48.3318,a8w8_blockscale_1x128x128_256x128x128x128_16x16_32x32_2x2_8x32x1_8x32x1_1x32x1x8_8_1x1_intrawave_v3,811.88,789.9,0.0
256,2096,6144,1536,ck,0,0,47.9386,a8w8_blockscale_1x128x128_256x128x128x128_16x16_32x32_2x2_8x32x1_8x32x1_1x32x1x8_8_1x1_intrawave_v3,825.24,801.28,0.0
256,2106,6144,1536,ck,0,0,47.5882,a8w8_blockscale_1x128x128_256x128x128x128_16x16_32x32_2x2_8x32x1_8x32x1_1x32x1x8_8_1x1_intrawave_v3,835.28,810.09,0.0
256,2127,6144,1536,ck,0,0,47.7507,a8w8_blockscale_1x128x128_256x128x128x128_16x16_32x32_2x2_8x32x1_8x32x1_1x32x1x8_8_1x1_intrawave_v3,840.74,813.41,0.0
256,2186,6144,1536,ck,0,0,49.0056,a8w8_blockscale_1x128x128_256x128x128x128_16x16_32x32_2x2_8x32x1_8x32x1_1x32x1x8_8_1x1_intrawave_v3,841.93,809.22,0.0
256,2198,6144,1536,ck,0,0,47.4912,a8w8_blockscale_1x128x128_256x128x128x128_16x16_32x32_2x2_8x32x1_8x32x1_1x32x1x8_8_1x1_intrawave_v3,873.55,838.52,0.0
256,2236,6144,1536,ck,0,0,47.7757,a8w8_blockscale_1x128x128_256x128x128x128_16x16_32x32_2x2_8x32x1_8x32x1_1x32x1x8_8_1x1_intrawave_v3,883.36,844.52,0.0
256,2251,6144,1536,ck,0,0,48.5478,a8w8_blockscale_1x128x128_256x128x128x128_16x16_32x32_2x2_8x32x1_8x32x1_1x32x1x8_8_1x1_intrawave_v3,875.14,835.36,0.0
256,2266,6144,1536,ck,0,0,48.1881,a8w8_blockscale_1x128x128_256x128x128x128_16x16_32x32_2x2_8x32x1_8x32x1_1x32x1x8_8_1x1_intrawave_v3,887.55,845.9,0.0
256,2440,6144,1536,ck,0,0,50.6874,a8w8_blockscale_1x128x128_256x128x128x128_16x16_32x32_2x2_8x32x1_8x32x1_1x32x1x8_8_1x1_intrawave_v3,908.58,851.65,0.0
256,2445,6144,1536,ck,0,0,50.4794,a8w8_blockscale_1x128x128_256x128x128x128_16x16_32x32_2x2_8x32x1_8x32x1_1x32x1x8_8_1x1_intrawave_v3,914.19,856.52,0.0
256,2489,6144,1536,ck,0,0,49.8714,a8w8_blockscale_1x128x128_256x128x128x128_16x16_32x32_2x2_8x32x1_8x32x1_1x32x1x8_8_1x1_intrawave_v3,941.99,879.16,0.0
256,2532,6144,1536,ck,0,0,49.079,a8w8_blockscale_1x128x128_256x128x128x128_16x16_32x32_2x2_8x32x1_8x32x1_1x32x1x8_8_1x1_intrawave_v3,973.73,905.47,0.0
256,2564,6144,1536,ck,0,0,50.7104,a8w8_blockscale_1x128x128_256x128x128x128_16x16_32x32_2x2_8x32x1_8x32x1_1x32x1x8_8_1x1_intrawave_v3,954.32,885.06,0.0
256,2571,6144,1536,ck,0,0,50.813,a8w8_blockscale_1x128x128_256x128x128x128_16x16_32x32_2x2_8x32x1_8x32x1_1x32x1x8_8_1x1_intrawave_v3,954.99,885.18,0.0
256,2633,6144,1536,ck,0,0,50.5142,a8w8_blockscale_1x128x128_256x128x128x128_16x16_32x32_2x2_8x32x1_8x32x1_1x32x1x8_8_1x1_intrawave_v3,983.81,907.38,0.0
256,2687,6144,1536,ck,0,0,51.6222,a8w8_blockscale_1x128x128_256x128x128x128_16x16_32x32_2x2_8x32x1_8x32x1_1x32x1x8_8_1x1_intrawave_v3,982.43,902.37,0.0
256,2694,6144,1536,ck,0,0,57.8079,a8w8_blockscale_1x128x128_256x128x128x128_16x16_32x32_2x2_8x32x1_8x32x1_1x32x1x8_8_1x1_intrawave_v3,879.6,807.49,0.0
256,2735,6144,1536,ck,0,0,59.0713,a8w8_blockscale_1x128x128_256x128x128x128_16x16_32x32_2x2_8x32x1_8x32x1_1x32x1x8_8_1x1_intrawave_v3,873.88,799.81,0.0
256,2743,6144,1536,ck,0,0,58.4191,a8w8_blockscale_1x128x128_256x128x128x128_16x16_32x32_2x2_8x32x1_8x32x1_1x32x1x8_8_1x1_intrawave_v3,886.22,810.63,0.0
256,3000,6144,1536,ck,0,0,58.8895,a8w8_blockscale_1x128x128_256x128x128x128_16x16_32x32_2x2_8x32x1_8x32x1_1x32x1x8_8_1x1_intrawave_v3,961.51,864.49,0.0
256,3021,6144,1536,ck,0,0,59.9499,a8w8_blockscale_1x128x128_256x128x128x128_16x16_32x32_2x2_8x32x1_8x32x1_1x32x1x8_8_1x1_intrawave_v3,951.12,854.04,0.0
256,3029,6144,1536,ck,0,0,60.4682,a8w8_blockscale_1x128x128_256x128x128x128_16x16_32x32_2x2_8x32x1_8x32x1_1x32x1x8_8_1x1_intrawave_v3,945.46,848.55,0.0
256,3181,6144,1536,ck,0,0,60.6831,a8w8_blockscale_1x128x128_256x128x128x128_16x16_32x32_2x2_8x32x1_8x32x1_1x32x1x8_8_1x1_intrawave_v3,989.39,880.17,0.0
256,3271,6144,1536,ck,0,0,61.1131,a8w8_blockscale_1x128x128_256x128x128x128_16x16_32x32_2x2_8x32x1_8x32x1_1x32x1x8_8_1x1_intrawave_v3,1010.23,894.33,0.0
256,3503,6144,1536,cktile,11,0,67.9401,a8w8_blockscale_cktile_192x256x128_4x2x1_16x16x128_intrawave_0x1x0_1,973.16,851.67,0.0
256,3617,6144,1536,cktile,12,0,68.2975,a8w8_blockscale_cktile_192x256x128_4x2x1_16x16x128_intrawave_0x1x0_2,999.58,870.29,0.0
256,3620,6144,1536,cktile,11,0,68.1974,a8w8_blockscale_cktile_192x256x128_4x2x1_16x16x128_intrawave_0x1x0_1,1001.87,872.17,0.0
256,3632,6144,1536,cktile,12,0,68.1048,a8w8_blockscale_cktile_192x256x128_4x2x1_16x16x128_intrawave_0x1x0_2,1006.56,875.8,0.0
256,3703,6144,1536,cktile,12,0,68.0598,a8w8_blockscale_cktile_192x256x128_4x2x1_16x16x128_intrawave_0x1x0_2,1026.92,890.8,0.0
256,3800,6144,1536,cktile,12,0,68.328,a8w8_blockscale_cktile_192x256x128_4x2x1_16x16x128_intrawave_0x1x0_2,1049.68,906.93,0.0
256,3806,6144,1536,cktile,11,0,68.1666,a8w8_blockscale_cktile_192x256x128_4x2x1_16x16x128_intrawave_0x1x0_1,1053.83,910.29,0.0
256,3856,6144,1536,cktile,12,0,68.4887,a8w8_blockscale_cktile_192x256x128_4x2x1_16x16x128_intrawave_0x1x0_2,1062.65,916.1,0.0
256,4000,6144,1536,cktile,12,0,68.4689,a8w8_blockscale_cktile_192x256x128_4x2x1_16x16x128_intrawave_0x1x0_2,1102.65,945.44,0.0
256,4028,6144,1536,cktile,11,0,68.2518,a8w8_blockscale_cktile_192x256x128_4x2x1_16x16x128_intrawave_0x1x0_1,1113.9,954.12,0.0
256,4060,6144,1536,ck,0,0,73.6739,a8w8_blockscale_1x128x128_256x128x128x128_16x16_32x32_2x2_8x32x1_8x32x1_1x32x1x8_8_1x1_intrawave_v3,1040.12,889.9,0.0
256,4078,6144,1536,ck,0,0,74.9941,a8w8_blockscale_1x128x128_256x128x128x128_16x16_32x32_2x2_8x32x1_8x32x1_1x32x1x8_8_1x1_intrawave_v3,1026.34,877.56,0.0
256,4107,6144,1536,ck,0,0,79.1745,a8w8_blockscale_1x128x128_256x128x128x128_16x16_32x32_2x2_8x32x1_8x32x1_1x32x1x8_8_1x1_intrawave_v3,979.07,836.28,0.0
256,4123,6144,1536,ck,0,0,80.295,a8w8_blockscale_1x128x128_256x128x128x128_16x16_32x32_2x2_8x32x1_8x32x1_1x32x1x8_8_1x1_intrawave_v3,969.16,827.37,0.0
256,4204,6144,1536,ck,0,0,80.4406,a8w8_blockscale_1x128x128_256x128x128x128_16x16_32x32_2x2_8x32x1_8x32x1_1x32x1x8_8_1x1_intrawave_v3,986.42,839.79,0.0
256,4229,6144,1536,ck,0,0,82.9513,a8w8_blockscale_1x128x128_256x128x128x128_16x16_32x32_2x2_8x32x1_8x32x1_1x32x1x8_8_1x1_intrawave_v3,962.25,818.54,0.0
256,4252,6144,1536,ck,0,0,80.9117,a8w8_blockscale_1x128x128_256x128x128x128_16x16_32x32_2x2_8x32x1_8x32x1_1x32x1x8_8_1x1_intrawave_v3,991.87,843.1,0.0
256,4310,6144,1536,ck,0,0,83.7962,a8w8_blockscale_1x128x128_256x128x128x128_16x16_32x32_2x2_8x32x1_8x32x1_1x32x1x8_8_1x1_intrawave_v3,970.79,823.65,0.0
256,4359,6144,1536,ck,0,0,82.4945,a8w8_blockscale_1x128x128_256x128x128x128_16x16_32x32_2x2_8x32x1_8x32x1_1x32x1x8_8_1x1_intrawave_v3,997.32,844.86,0.0
256,4393,6144,1536,ck,0,0,84.8254,a8w8_blockscale_1x128x128_256x128x128x128_16x16_32x32_2x2_8x32x1_8x32x1_1x32x1x8_8_1x1_intrawave_v3,977.48,827.18,0.0
256,4433,6144,1536,ck,0,0,83.8565,a8w8_blockscale_1x128x128_256x128x128x128_16x16_32x32_2x2_8x32x1_8x32x1_1x32x1x8_8_1x1_intrawave_v3,997.78,843.33,0.0
256,4484,6144,1536,ck,0,0,83.0829,a8w8_blockscale_1x128x128_256x128x128x128_16x16_32x32_2x2_8x32x1_8x32x1_1x32x1x8_8_1x1_intrawave_v3,1018.65,859.67,0.0
256,4498,6144,1536,ck,0,0,81.8686,a8w8_blockscale_1x128x128_256x128x128x128_16x16_32x32_2x2_8x32x1_8x32x1_1x32x1x8_8_1x1_intrawave_v3,1036.99,874.79,0.0
256,4504,6144,1536,ck,0,0,84.9485,a8w8_blockscale_1x128x128_256x128x128x128_16x16_32x32_2x2_8x32x1_8x32x1_1x32x1x8_8_1x1_intrawave_v3,1000.73,844.05,0.0
256,4507,6144,1536,ck,0,0,83.3613,a8w8_blockscale_1x128x128_256x128x128x128_16x16_32x32_2x2_8x32x1_8x32x1_1x32x1x8_8_1x1_intrawave_v3,1020.46,860.61,0.0
256,4537,6144,1536,ck,0,0,82.0453,a8w8_blockscale_1x128x128_256x128x128x128_16x16_32x32_2x2_8x32x1_8x32x1_1x32x1x8_8_1x1_intrawave_v3,1043.73,879.47,0.0
256,4560,6144,1536,ck,0,0,83.4013,a8w8_blockscale_1x128x128_256x128x128x128_16x16_32x32_2x2_8x32x1_8x32x1_1x32x1x8_8_1x1_intrawave_v3,1031.96,868.99,0.0
256,4562,6144,1536,ck,0,0,80.9365,a8w8_blockscale_1x128x128_256x128x128x128_16x16_32x32_2x2_8x32x1_8x32x1_1x32x1x8_8_1x1_intrawave_v3,1063.86,895.79,0.0
256,4597,6144,1536,ck,0,0,82.246,a8w8_blockscale_1x128x128_256x128x128x128_16x16_32x32_2x2_8x32x1_8x32x1_1x32x1x8_8_1x1_intrawave_v3,1054.95,887.41,0.0
256,4598,6144,1536,ck,0,0,83.0571,a8w8_blockscale_1x128x128_256x128x128x128_16x16_32x32_2x2_8x32x1_8x32x1_1x32x1x8_8_1x1_intrawave_v3,1044.88,878.91,0.0
256,4617,6144,1536,ck,0,0,82.8745,a8w8_blockscale_1x128x128_256x128x128x128_16x16_32x32_2x2_8x32x1_8x32x1_1x32x1x8_8_1x1_intrawave_v3,1051.51,884.02,0.0
256,4685,6144,1536,ck,0,0,82.7061,a8w8_blockscale_1x128x128_256x128x128x128_16x16_32x32_2x2_8x32x1_8x32x1_1x32x1x8_8_1x1_intrawave_v3,1069.16,897.18,0.0
256,4856,6144,1536,ck,0,0,89.9842,a8w8_blockscale_1x128x128_256x128x128x128_16x16_32x32_2x2_8x32x1_8x32x1_1x32x1x8_8_1x1_intrawave_v3,1018.56,850.89,0.0
256,4898,6144,1536,ck,0,0,92.3974,a8w8_blockscale_1x128x128_256x128x128x128_16x16_32x32_2x2_8x32x1_8x32x1_1x32x1x8_8_1x1_intrawave_v3,1000.53,834.95,0.0
256,4936,6144,1536,ck,0,0,90.6275,a8w8_blockscale_1x128x128_256x128x128x128_16x16_32x32_2x2_8x32x1_8x32x1_1x32x1x8_8_1x1_intrawave_v3,1027.99,857.05,0.0
256,5000,6144,1536,ck,0,0,92.8354,a8w8_blockscale_1x128x128_256x128x128x128_16x16_32x32_2x2_8x32x1_8x32x1_1x32x1x8_8_1x1_intrawave_v3,1016.55,846.2,0.0
256,5001,6144,1536,ck,0,0,92.0774,a8w8_blockscale_1x128x128_256x128x128x128_16x16_32x32_2x2_8x32x1_8x32x1_1x32x1x8_8_1x1_intrawave_v3,1025.12,853.31,0.0
256,5002,6144,1536,ck,0,0,91.7502,a8w8_blockscale_1x128x128_256x128x128x128_16x16_32x32_2x2_8x32x1_8x32x1_1x32x1x8_8_1x1_intrawave_v3,1028.99,856.51,0.0
256,5003,6144,1536,ck,0,0,91.4694,a8w8_blockscale_1x128x128_256x128x128x128_16x16_32x32_2x2_8x32x1_8x32x1_1x32x1x8_8_1x1_intrawave_v3,1032.35,859.29,0.0
256,5004,6144,1536,ck,0,0,92.1794,a8w8_blockscale_1x128x128_256x128x128x128_16x16_32x32_2x2_8x32x1_8x32x1_1x32x1x8_8_1x1_intrawave_v3,1024.6,852.82,0.0
256,5012,6144,1536,ck,0,0,95.101,a8w8_blockscale_1x128x128_256x128x128x128_16x16_32x32_2x2_8x32x1_8x32x1_1x32x1x8_8_1x1_intrawave_v3,994.71,827.78,0.0
256,5014,6144,1536,ck,0,0,92.5905,a8w8_blockscale_1x128x128_256x128x128x128_16x16_32x32_2x2_8x32x1_8x32x1_1x32x1x8_8_1x1_intrawave_v3,1022.09,850.53,0.0
256,5027,6144,1536,ck,0,0,92.338,a8w8_blockscale_1x128x128_256x128x128x128_16x16_32x32_2x2_8x32x1_8x32x1_1x32x1x8_8_1x1_intrawave_v3,1027.54,854.8,0.0
256,5028,6144,1536,ck,0,0,93.603,a8w8_blockscale_1x128x128_256x128x128x128_16x16_32x32_2x2_8x32x1_8x32x1_1x32x1x8_8_1x1_intrawave_v3,1013.86,843.39,0.0
256,5030,6144,1536,ck,0,0,93.0834,a8w8_blockscale_1x128x128_256x128x128x128_16x16_32x32_2x2_8x32x1_8x32x1_1x32x1x8_8_1x1_intrawave_v3,1019.92,848.4,0.0
256,5060,6144,1536,ck,0,0,92.5796,a8w8_blockscale_1x128x128_256x128x128x128_16x16_32x32_2x2_8x32x1_8x32x1_1x32x1x8_8_1x1_intrawave_v3,1031.59,857.5,0.0
256,5061,6144,1536,ck,0,0,91.7659,a8w8_blockscale_1x128x128_256x128x128x128_16x16_32x32_2x2_8x32x1_8x32x1_1x32x1x8_8_1x1_intrawave_v3,1040.94,865.25,0.0
256,5107,6144,1536,ck,0,0,92.3165,a8w8_blockscale_1x128x128_256x128x128x128_16x16_32x32_2x2_8x32x1_8x32x1_1x32x1x8_8_1x1_intrawave_v3,1044.14,866.98,0.0
256,5124,6144,1536,ck,0,0,92.9686,a8w8_blockscale_1x128x128_256x128x128x128_16x16_32x32_2x2_8x32x1_8x32x1_1x32x1x8_8_1x1_intrawave_v3,1040.27,863.42,0.0
256,5125,6144,1536,ck,0,0,94.1859,a8w8_blockscale_1x128x128_256x128x128x128_16x16_32x32_2x2_8x32x1_8x32x1_1x32x1x8_8_1x1_intrawave_v3,1027.02,852.41,0.0
256,5126,6144,1536,ck,0,0,92.3471,a8w8_blockscale_1x128x128_256x128x128x128_16x16_32x32_2x2_8x32x1_8x32x1_1x32x1x8_8_1x1_intrawave_v3,1047.68,869.53,0.0
256,5243,6144,1536,ck,0,0,95.445,a8w8_blockscale_1x128x128_256x128x128x128_16x16_32x32_2x2_8x32x1_8x32x1_1x32x1x8_8_1x1_intrawave_v3,1036.81,858.26,0.0
256,5244,6144,1536,ck,0,0,93.7857,a8w8_blockscale_1x128x128_256x128x128x128_16x16_32x32_2x2_8x32x1_8x32x1_1x32x1x8_8_1x1_intrawave_v3,1055.35,873.59,0.0
256,5252,6144,1536,ck,0,0,92.4683,a8w8_blockscale_1x128x128_256x128x128x128_16x16_32x32_2x2_8x32x1_8x32x1_1x32x1x8_8_1x1_intrawave_v3,1072.02,887.23,0.0
256,5253,6144,1536,ck,0,0,92.853,a8w8_blockscale_1x128x128_256x128x128x128_16x16_32x32_2x2_8x32x1_8x32x1_1x32x1x8_8_1x1_intrawave_v3,1067.79,883.7,0.0
256,5254,6144,1536,ck,0,0,94.984,a8w8_blockscale_1x128x128_256x128x128x128_16x16_32x32_2x2_8x32x1_8x32x1_1x32x1x8_8_1x1_intrawave_v3,1044.03,864.02,0.0
256,5255,6144,1536,ck,0,0,92.9348,a8w8_blockscale_1x128x128_256x128x128x128_16x16_32x32_2x2_8x32x1_8x32x1_1x32x1x8_8_1x1_intrawave_v3,1067.25,883.22,0.0
256,5349,6144,1536,ck,0,0,95.0188,a8w8_blockscale_1x128x128_256x128x128x128_16x16_32x32_2x2_8x32x1_8x32x1_1x32x1x8_8_1x1_intrawave_v3,1062.52,877.53,0.0
256,5431,6144,1536,cktile,11,0,98.2462,a8w8_blockscale_cktile_192x256x128_4x2x1_16x16x128_intrawave_0x1x0_1,1043.37,860.24,0.0
256,5438,6144,1536,cktile,11,0,98.5734,a8w8_blockscale_cktile_192x256x128_4x2x1_16x16x128_intrawave_0x1x0_1,1041.24,858.37,0.0
256,5440,6144,1536,cktile,11,0,98.67,a8w8_blockscale_cktile_192x256x128_4x2x1_16x16x128_intrawave_0x1x0_1,1040.61,857.81,0.0
256,5608,6144,1536,cktile,12,0,98.9627,a8w8_blockscale_cktile_192x256x128_4x2x1_16x16x128_intrawave_0x1x0_2,1069.57,878.74,0.0
256,5661,6144,1536,cktile,11,0,98.5413,a8w8_blockscale_cktile_192x256x128_4x2x1_16x16x128_intrawave_0x1x0_1,1084.29,889.93,0.0
256,5684,6144,1536,cktile,12,0,98.5842,a8w8_blockscale_cktile_192x256x128_4x2x1_16x16x128_intrawave_0x1x0_2,1088.23,892.77,0.0
256,5753,6144,1536,cktile,11,0,98.8754,a8w8_blockscale_cktile_192x256x128_4x2x1_16x16x128_intrawave_0x1x0_1,1098.19,899.79,0.0
256,5818,6144,1536,cktile,11,0,99.4574,a8w8_blockscale_cktile_192x256x128_4x2x1_16x16x128_intrawave_0x1x0_1,1104.1,903.55,0.0
256,5820,6144,1536,cktile,12,0,99.1772,a8w8_blockscale_cktile_192x256x128_4x2x1_16x16x128_intrawave_0x1x0_2,1107.6,906.39,0.0
256,5890,6144,1536,cktile,11,0,98.9797,a8w8_blockscale_cktile_192x256x128_4x2x1_16x16x128_intrawave_0x1x0_1,1123.16,917.97,0.0
256,5922,6144,1536,cktile,11,0,98.9976,a8w8_blockscale_cktile_192x256x128_4x2x1_16x16x128_intrawave_0x1x0_1,1129.06,922.27,0.0
256,6010,6144,1536,cktile,11,0,99.6555,a8w8_blockscale_cktile_192x256x128_4x2x1_16x16x128_intrawave_0x1x0_1,1138.27,928.39,0.0
256,6058,6144,1536,cktile,12,0,99.5688,a8w8_blockscale_cktile_192x256x128_4x2x1_16x16x128_intrawave_0x1x0_2,1148.36,935.87,0.0
256,6242,6144,1536,ck,0,0,111.8962,a8w8_blockscale_1x128x128_256x128x128x128_16x16_32x32_2x2_8x32x1_8x32x1_1x32x1x8_8_1x1_intrawave_v3,1052.88,855.49,0.0
256,6291,6144,1536,ck,0,0,112.0178,a8w8_blockscale_1x128x128_256x128x128x128_16x16_32x32_2x2_8x32x1_8x32x1_1x32x1x8_8_1x1_intrawave_v3,1060.0,860.61,0.0
256,6304,6144,1536,ck,0,0,115.2221,a8w8_blockscale_1x128x128_256x128x128x128_16x16_32x32_2x2_8x32x1_8x32x1_1x32x1x8_8_1x1_intrawave_v3,1032.65,838.24,0.0
256,6476,6144,1536,ck,0,0,115.9869,a8w8_blockscale_1x128x128_256x128x128x128_16x16_32x32_2x2_8x32x1_8x32x1_1x32x1x8_8_1x1_intrawave_v3,1053.83,853.21,0.0
256,6675,6144,1536,ck,0,0,115.8167,a8w8_blockscale_1x128x128_256x128x128x128_16x16_32x32_2x2_8x32x1_8x32x1_1x32x1x8_8_1x1_intrawave_v3,1087.81,878.22,0.0
256,6811,6144,1536,ck,0,0,121.8425,a8w8_blockscale_1x128x128_256x128x128x128_16x16_32x32_2x2_8x32x1_8x32x1_1x32x1x8_8_1x1_intrawave_v3,1055.08,850.22,0.0
256,6812,6144,1536,ck,0,0,123.6356,a8w8_blockscale_1x128x128_256x128x128x128_16x16_32x32_2x2_8x32x1_8x32x1_1x32x1x8_8_1x1_intrawave_v3,1039.93,838.0,0.0
256,6814,6144,1536,ck,0,0,121.5657,a8w8_blockscale_1x128x128_256x128x128x128_16x16_32x32_2x2_8x32x1_8x32x1_1x32x1x8_8_1x1_intrawave_v3,1057.95,852.49,0.0
256,6815,6144,1536,ck,0,0,124.3469,a8w8_blockscale_1x128x128_256x128x128x128_16x16_32x32_2x2_8x32x1_8x32x1_1x32x1x8_8_1x1_intrawave_v3,1034.44,833.54,0.0
256,6818,6144,1536,ck,0,0,120.6444,a8w8_blockscale_1x128x128_256x128x128x128_16x16_32x32_2x2_8x32x1_8x32x1_1x32x1x8_8_1x1_intrawave_v3,1066.65,859.46,0.0
256,6819,6144,1536,ck,0,0,119.54,a8w8_blockscale_1x128x128_256x128x128x128_16x16_32x32_2x2_8x32x1_8x32x1_1x32x1x8_8_1x1_intrawave_v3,1076.66,867.52,0.0
256,6827,6144,1536,ck,0,0,119.5108,a8w8_blockscale_1x128x128_256x128x128x128_16x16_32x32_2x2_8x32x1_8x32x1_1x32x1x8_8_1x1_intrawave_v3,1078.19,868.65,0.0
256,6829,6144,1536,ck,0,0,123.8827,a8w8_blockscale_1x128x128_256x128x128x128_16x16_32x32_2x2_8x32x1_8x32x1_1x32x1x8_8_1x1_intrawave_v3,1040.44,838.22,0.0
256,6830,6144,1536,ck,0,0,124.2452,a8w8_blockscale_1x128x128_256x128x128x128_16x16_32x32_2x2_8x32x1_8x32x1_1x32x1x8_8_1x1_intrawave_v3,1037.56,835.89,0.0
256,6858,6144,1536,ck,0,0,121.9176,a8w8_blockscale_1x128x128_256x128x128x128_16x16_32x32_2x2_8x32x1_8x32x1_1x32x1x8_8_1x1_intrawave_v3,1061.7,855.02,0.0
256,6859,6144,1536,ck,0,0,124.0862,a8w8_blockscale_1x128x128_256x128x128x128_16x16_32x32_2x2_8x32x1_8x32x1_1x32x1x8_8_1x1_intrawave_v3,1043.3,840.19,0.0
