aiter/configs/a8w8_blockscale_tuned_gemm.csv
cu_num,M,N,K,libtype,kernelId,splitK,us,kernelName,tflops,bw,errRatio
256,16,512,7168,ck,8,0,20.9978,a8w8_blockscale_1x128x128_256x16x64x256_16x16_16x16_1x1_16x16x1_16x16x1_1x16x1x16_4_1x1_intrawave_v1,5.59,181.02,0.0
256,32,512,7168,ck,8,0,20.8949,a8w8_blockscale_1x128x128_256x16x64x256_16x16_16x16_1x1_16x16x1_16x16x1_1x16x1x16_4_1x1_intrawave_v1,11.24,188.19,0.0
256,64,512,7168,ck,8,0,20.5506,a8w8_blockscale_1x128x128_256x16x64x256_16x16_16x16_1x1_16x16x1_16x16x1_1x16x1x16_4_1x1_intrawave_v1,22.86,204.1,0.0
256,128,512,7168,ck,8,0,19.8412,a8w8_blockscale_1x128x128_256x16x64x256_16x16_16x16_1x1_16x16x1_16x16x1_1x16x1x16_4_1x1_intrawave_v1,47.35,237.82,0.0
256,256,512,7168,ck,8,0,20.2454,a8w8_blockscale_1x128x128_256x16x64x256_16x16_16x16_1x1_16x16x1_16x16x1_1x16x1x16_4_1x1_intrawave_v1,92.81,284.86,0.0
256,512,512,7168,ck,8,0,20.7411,a8w8_blockscale_1x128x128_256x16x64x256_16x16_16x16_1x1_16x16x1_16x16x1_1x16x1x16_4_1x1_intrawave_v1,181.19,379.17,0.0
256,1024,512,7168,ck,18,0,23.1271,a8w8_blockscale_1x128x128_256x64x64x256_16x16_32x32_1x1_16x16x1_16x16x1_1x32x1x8_8_1x1_intrawave_v1,325.0,521.41,0.0
256,1536,512,7168,ck,18,0,23.4156,a8w8_blockscale_1x128x128_256x64x64x256_16x16_32x32_1x1_16x16x1_16x16x1_1x32x1x8_8_1x1_intrawave_v1,481.49,694.11,0.0
256,2048,512,7168,ck,18,0,24.9898,a8w8_blockscale_1x128x128_256x64x64x256_16x16_32x32_1x1_16x16x1_16x16x1_1x32x1x8_8_1x1_intrawave_v1,601.54,818.22,0.0
256,4096,512,7168,ck,18,0,43.5996,a8w8_blockscale_1x128x128_256x64x64x256_16x16_32x32_1x1_16x16x1_16x16x1_1x32x1x8_8_1x1_intrawave_v1,689.57,853.78,0.0
256,8192,512,7168,ck,0,0,66.7717,a8w8_blockscale_1x128x128_256x128x128x128_16x16_32x32_2x2_8x32x1_8x32x1_1x32x1x8_8_1x1_intrawave_v3,900.52,1060.01,0.0
256,16384,512,7168,ck,0,0,117.7852,a8w8_blockscale_1x128x128_256x128x128x128_16x16_32x32_2x2_8x32x1_8x32x1_1x32x1x8_8_1x1_intrawave_v3,1021.0,1170.67,0.0
256,20480,512,7168,ck,0,0,152.2349,a8w8_blockscale_1x128x128_256x128x128x128_16x16_32x32_2x2_8x32x1_8x32x1_1x32x1x8_8_1x1_intrawave_v3,987.45,1126.17,0.0
256,16,576,7168,ck,8,0,21.0859,a8w8_blockscale_1x128x128_256x16x64x256_16x16_16x16_1x1_16x16x1_16x16x1_1x16x1x16_4_1x1_intrawave_v1,6.27,202.12,0.0
256,32,576,7168,ck,8,0,20.9288,a8w8_blockscale_1x128x128_256x16x64x256_16x16_16x16_1x1_16x16x1_16x16x1_1x16x1x16_4_1x1_intrawave_v1,12.63,210.0,0.0
256,64,576,7168,ck,8,0,20.6157,a8w8_blockscale_1x128x128_256x16x64x256_16x16_16x16_1x1_16x16x1_16x16x1_1x16x1x16_4_1x1_intrawave_v1,25.63,226.1,0.0
256,128,576,7168,ck,8,0,20.0861,a8w8_blockscale_1x128x128_256x16x64x256_16x16_16x16_1x1_16x16x1_16x16x1_1x16x1x16_4_1x1_intrawave_v1,52.62,258.57,0.0
256,256,576,7168,ck,8,0,20.4152,a8w8_blockscale_1x128x128_256x16x64x256_16x16_16x16_1x1_16x16x1_16x16x1_1x16x1x16_4_1x1_intrawave_v1,103.55,306.57,0.0
256,512,576,7168,ck,18,0,23.0551,a8w8_blockscale_1x128x128_256x64x64x256_16x16_32x32_1x1_16x16x1_16x16x1_1x32x1x8_8_1x1_intrawave_v1,183.38,363.85,0.0
256,1024,576,7168,ck,18,0,23.0306,a8w8_blockscale_1x128x128_256x64x64x256_16x16_32x32_1x1_16x16x1_16x16x1_1x32x1x8_8_1x1_intrawave_v1,367.15,549.2,0.0
256,1536,576,7168,ck,18,0,24.2524,a8w8_blockscale_1x128x128_256x64x64x256_16x16_32x32_1x1_16x16x1_16x16x1_1x32x1x8_8_1x1_intrawave_v1,522.98,697.18,0.0
256,2048,576,7168,ck,18,0,34.4222,a8w8_blockscale_1x128x128_256x64x64x256_16x16_32x32_1x1_16x16x1_16x16x1_1x32x1x8_8_1x1_intrawave_v1,491.29,614.96,0.0
256,4096,576,7168,ck,18,0,54.8316,a8w8_blockscale_1x128x128_256x64x64x256_16x16_32x32_1x1_16x16x1_16x16x1_1x32x1x8_8_1x1_intrawave_v1,616.85,696.82,0.0
256,8192,576,7168,ck,0,0,87.2065,a8w8_blockscale_1x128x128_256x128x128x128_16x16_32x32_2x2_8x32x1_8x32x1_1x32x1x8_8_1x1_intrawave_v3,775.7,828.91,0.0
256,16384,576,7168,ck,0,0,152.274,a8w8_blockscale_1x128x128_256x128x128x128_16x16_32x32_2x2_8x32x1_8x32x1_1x32x1x8_8_1x1_intrawave_v3,888.47,922.31,0.0
256,20480,576,7168,ck,0,0,188.6292,a8w8_blockscale_1x128x128_256x128x128x128_16x16_32x32_2x2_8x32x1_8x32x1_1x32x1x8_8_1x1_intrawave_v3,896.54,925.21,0.0
256,16,1536,7168,ck,8,0,21.6147,a8w8_blockscale_1x128x128_256x16x64x256_16x16_16x16_1x1_16x16x1_16x16x1_1x16x1x16_4_1x1_intrawave_v1,16.3,516.96,0.0
256,32,1536,7168,ck,8,0,21.2799,a8w8_blockscale_1x128x128_256x16x64x256_16x16_16x16_1x1_16x16x1_16x16x1_1x16x1x16_4_1x1_intrawave_v1,33.11,532.79,0.0
256,64,1536,7168,ck,8,0,21.0947,a8w8_blockscale_1x128x128_256x16x64x256_16x16_16x16_1x1_16x16x1_16x16x1_1x16x1x16_4_1x1_intrawave_v1,66.81,553.0,0.0
256,128,1536,7168,ck,8,0,20.5469,a8w8_blockscale_1x128x128_256x16x64x256_16x16_16x16_1x1_16x16x1_16x16x1_1x16x1x16_4_1x1_intrawave_v1,137.18,599.64,0.0
256,256,1536,7168,ck,7,0,22.6093,a8w8_blockscale_1x128x128_256x16x128x256_16x16_16x16_1x2_16x16x1_16x16x1_1x16x1x16_8_1x2_intrawave_v1,249.33,602.92,0.0
256,512,1536,7168,ck,18,0,23.3971,a8w8_blockscale_1x128x128_256x64x64x256_16x16_32x32_1x1_16x16x1_16x16x1_1x32x1x8_8_1x1_intrawave_v1,481.87,694.66,0.0
256,1024,1536,7168,ck,18,0,37.0383,a8w8_blockscale_1x128x128_256x64x64x256_16x16_32x32_1x1_16x16x1_16x16x1_1x32x1x8_8_1x1_intrawave_v1,608.79,580.37,0.0
256,1536,1536,7168,ck,18,0,52.9404,a8w8_blockscale_1x128x128_256x64x64x256_16x16_32x32_1x1_16x16x1_16x16x1_1x32x1x8_8_1x1_intrawave_v1,638.89,505.07,0.0
256,2048,1536,7168,ck,0,0,58.3488,a8w8_blockscale_1x128x128_256x128x128x128_16x16_32x32_2x2_8x32x1_8x32x1_1x32x1x8_8_1x1_intrawave_v3,772.89,548.11,0.0
256,4096,1536,7168,ck,0,0,99.1466,a8w8_blockscale_1x128x128_256x128x128x128_16x16_32x32_2x2_8x32x1_8x32x1_1x32x1x8_8_1x1_intrawave_v3,909.71,534.09,0.0
256,8192,1536,7168,ck,0,0,172.6502,a8w8_blockscale_1x128x128_256x128x128x128_16x16_32x32_2x2_8x32x1_8x32x1_1x32x1x8_8_1x1_intrawave_v3,1044.82,549.64,0.0
256,16384,1536,7168,ck,0,0,311.0558,a8w8_blockscale_1x128x128_256x128x128x128_16x16_32x32_2x2_8x32x1_8x32x1_1x32x1x8_8_1x1_intrawave_v3,1159.85,574.76,0.0
256,20480,1536,7168,ck,0,0,385.8756,a8w8_blockscale_1x128x128_256x128x128x128_16x16_32x32_2x2_8x32x1_8x32x1_1x32x1x8_8_1x1_intrawave_v3,1168.7,572.01,0.0
256,1,2048,3072,ck,8,0,10.4868,a8w8_blockscale_1x128x128_256x16x64x256_16x16_16x16_1x1_16x16x1_16x16x1_1x16x1x16_4_1x1_intrawave_v1,1.2,600.62,0.0
256,2,2048,3072,ck,8,0,10.3468,a8w8_blockscale_1x128x128_256x16x64x256_16x16_16x16_1x1_16x16x1_16x16x1_1x16x1x16_4_1x1_intrawave_v1,2.43,609.44,0.0
256,4,2048,3072,ck,8,0,10.4824,a8w8_blockscale_1x128x128_256x16x64x256_16x16_16x16_1x1_16x16x1_16x16x1_1x16x1x16_4_1x1_intrawave_v1,4.8,602.93,0.0
256,8,2048,3072,ck,8,0,10.5507,a8w8_blockscale_1x128x128_256x16x64x256_16x16_16x16_1x1_16x16x1_16x16x1_1x16x1x16_4_1x1_intrawave_v1,9.54,601.74,0.0
256,16,2048,3072,ck,8,0,10.1281,a8w8_blockscale_1x128x128_256x16x64x256_16x16_16x16_1x1_16x16x1_16x16x1_1x16x1x16_4_1x1_intrawave_v1,19.88,632.51,0.0
256,24,2048,3072,ck,8,0,10.6723,a8w8_blockscale_1x128x128_256x16x64x256_16x16_16x16_1x1_16x16x1_16x16x1_1x16x1x16_4_1x1_intrawave_v1,28.3,605.63,0.0
256,32,2048,3072,ck,8,0,10.2894,a8w8_blockscale_1x128x128_256x16x64x256_16x16_16x16_1x1_16x16x1_16x16x1_1x16x1x16_4_1x1_intrawave_v1,39.13,633.74,0.0
256,40,2048,3072,ck,8,0,10.6366,a8w8_blockscale_1x128x128_256x16x64x256_16x16_16x16_1x1_16x16x1_16x16x1_1x16x1x16_4_1x1_intrawave_v1,47.32,618.45,0.0
256,48,2048,3072,ck,8,0,10.2615,a8w8_blockscale_1x128x128_256x16x64x256_16x16_16x16_1x1_16x16x1_16x16x1_1x16x1x16_4_1x1_intrawave_v1,58.86,646.64,0.0
256,56,2048,3072,ck,8,0,10.6558,a8w8_blockscale_1x128x128_256x16x64x256_16x16_16x16_1x1_16x16x1_16x16x1_1x16x1x16_4_1x1_intrawave_v1,66.13,628.1,0.0
256,64,2048,3072,ck,8,0,10.217,a8w8_blockscale_1x128x128_256x16x64x256_16x16_16x16_1x1_16x16x1_16x16x1_1x16x1x16_4_1x1_intrawave_v1,78.82,660.68,0.0
256,72,2048,3072,ck,8,0,10.6244,a8w8_blockscale_1x128x128_256x16x64x256_16x16_16x16_1x1_16x16x1_16x16x1_1x16x1x16_4_1x1_intrawave_v1,85.27,640.75,0.0
256,80,2048,3072,ck,8,0,10.2015,a8w8_blockscale_1x128x128_256x16x64x256_16x16_16x16_1x1_16x16x1_16x16x1_1x16x1x16_4_1x1_intrawave_v1,98.67,672.93,0.0
256,88,2048,3072,ck,8,0,10.6029,a8w8_blockscale_1x128x128_256x16x64x256_16x16_16x16_1x1_16x16x1_16x16x1_1x16x1x16_4_1x1_intrawave_v1,104.43,652.86,0.0
256,96,2048,3072,ck,8,0,10.1105,a8w8_blockscale_1x128x128_256x16x64x256_16x16_16x16_1x1_16x16x1_16x16x1_1x16x1x16_4_1x1_intrawave_v1,119.48,690.33,0.0
256,104,2048,3072,ck,8,0,10.6289,a8w8_blockscale_1x128x128_256x16x64x256_16x16_16x16_1x1_16x16x1_16x16x1_1x16x1x16_4_1x1_intrawave_v1,123.12,662.06,0.0
256,112,2048,3072,ck,8,0,10.1688,a8w8_blockscale_1x128x128_256x16x64x256_16x16_16x16_1x1_16x16x1_16x16x1_1x16x1x16_4_1x1_intrawave_v1,138.59,697.65,0.0
256,120,2048,3072,ck,8,0,10.6779,a8w8_blockscale_1x128x128_256x16x64x256_16x16_16x16_1x1_16x16x1_16x16x1_1x16x1x16_4_1x1_intrawave_v1,141.41,669.76,0.0
256,128,2048,3072,ck,8,0,10.2044,a8w8_blockscale_1x128x128_256x16x64x256_16x16_16x16_1x1_16x16x1_16x16x1_1x16x1x16_4_1x1_intrawave_v1,157.84,706.46,0.0
256,136,2048,3072,ck,7,0,12.9778,a8w8_blockscale_1x128x128_256x16x128x256_16x16_16x16_1x2_16x16x1_16x16x1_1x16x1x16_8_1x2_intrawave_v1,131.86,559.9,0.0
256,144,2048,3072,ck,7,0,12.8028,a8w8_blockscale_1x128x128_256x16x128x256_16x16_16x16_1x2_16x16x1_16x16x1_1x16x1x16_8_1x2_intrawave_v1,141.53,572.03,0.0
256,152,2048,3072,ck,7,0,13.0459,a8w8_blockscale_1x128x128_256x16x128x256_16x16_16x16_1x2_16x16x1_16x16x1_1x16x1x16_8_1x2_intrawave_v1,146.61,565.77,0.0
256,160,2048,3072,ck,7,0,12.8739,a8w8_blockscale_1x128x128_256x16x128x256_16x16_16x16_1x2_16x16x1_16x16x1_1x16x1x16_8_1x2_intrawave_v1,156.38,577.78,0.0
256,168,2048,3072,ck,7,0,13.0669,a8w8_blockscale_1x128x128_256x16x128x256_16x16_16x16_1x2_16x16x1_16x16x1_1x16x1x16_8_1x2_intrawave_v1,161.78,573.64,0.0
256,176,2048,3072,ck,7,0,12.8648,a8w8_blockscale_1x128x128_256x16x128x256_16x16_16x16_1x2_16x16x1_16x16x1_1x16x1x16_8_1x2_intrawave_v1,172.14,587.11,0.0
256,184,2048,3072,ck,7,0,13.1014,a8w8_blockscale_1x128x128_256x16x128x256_16x16_16x16_1x2_16x16x1_16x16x1_1x16x1x16_8_1x2_intrawave_v1,176.72,580.88,0.0
256,192,2048,3072,ck,18,0,12.816,a8w8_blockscale_1x128x128_256x64x64x256_16x16_32x32_1x1_16x16x1_16x16x1_1x32x1x8_8_1x1_intrawave_v1,188.51,598.29,0.0
256,200,2048,3072,ck,7,0,13.2198,a8w8_blockscale_1x128x128_256x16x128x256_16x16_16x16_1x2_16x16x1_16x16x1_1x16x1x16_8_1x2_intrawave_v1,190.36,584.35,0.0
256,208,2048,3072,ck,7,0,12.9835,a8w8_blockscale_1x128x128_256x16x128x256_16x16_16x16_1x2_16x16x1_16x16x1_1x16x1x16_8_1x2_intrawave_v1,201.58,599.41,0.0
256,216,2048,3072,ck,7,0,13.3199,a8w8_blockscale_1x128x128_256x16x128x256_16x16_16x16_1x2_16x16x1_16x16x1_1x16x1x16_8_1x2_intrawave_v1,204.05,588.57,0.0
256,224,2048,3072,ck,7,0,13.0732,a8w8_blockscale_1x128x128_256x16x128x256_16x16_16x16_1x2_16x16x1_16x16x1_1x16x1x16_8_1x2_intrawave_v1,215.6,604.07,0.0
256,232,2048,3072,ck,7,0,13.3742,a8w8_blockscale_1x128x128_256x16x128x256_16x16_16x16_1x2_16x16x1_16x16x1_1x16x1x16_8_1x2_intrawave_v1,218.27,594.76,0.0
256,240,2048,3072,ck,7,0,13.1074,a8w8_blockscale_1x128x128_256x16x128x256_16x16_16x16_1x2_16x16x1_16x16x1_1x16x1x16_8_1x2_intrawave_v1,230.4,611.24,0.0
256,248,2048,3072,ck,7,0,13.348,a8w8_blockscale_1x128x128_256x16x128x256_16x16_16x16_1x2_16x16x1_16x16x1_1x16x1x16_8_1x2_intrawave_v1,233.78,604.52,0.0
256,256,2048,3072,ck,18,0,12.9355,a8w8_blockscale_1x128x128_256x64x64x256_16x16_32x32_1x1_16x16x1_16x16x1_1x32x1x8_8_1x1_intrawave_v1,249.02,628.23,0.0
256,272,2048,3072,ck,18,0,16.043,a8w8_blockscale_1x128x128_256x64x64x256_16x16_32x32_1x1_16x16x1_16x16x1_1x32x1x8_8_1x1_intrawave_v1,213.34,513.69,0.0
256,288,2048,3072,ck,12,0,14.8628,a8w8_blockscale_1x128x128_256x32x128x256_16x16_32x32_1x1_16x16x1_16x16x1_1x32x1x8_8_1x1_intrawave_v1,243.82,562.2,0.0
256,304,2048,3072,ck,18,0,16.0968,a8w8_blockscale_1x128x128_256x64x64x256_16x16_32x32_1x1_16x16x1_16x16x1_1x32x1x8_8_1x1_intrawave_v1,237.64,526.22,0.0
256,320,2048,3072,ck,18,0,13.0892,a8w8_blockscale_1x128x128_256x64x64x256_16x16_32x32_1x1_16x16x1_16x16x1_1x32x1x8_8_1x1_intrawave_v1,307.62,655.9,0.0
256,336,2048,3072,ck,18,0,16.1114,a8w8_blockscale_1x128x128_256x64x64x256_16x16_32x32_1x1_16x16x1_16x16x1_1x32x1x8_8_1x1_intrawave_v1,262.41,539.98,0.0
256,352,2048,3072,ck,12,0,15.0102,a8w8_blockscale_1x128x128_256x32x128x256_16x16_32x32_1x1_16x16x1_16x16x1_1x32x1x8_8_1x1_intrawave_v1,295.08,587.24,0.0
256,368,2048,3072,ck,18,0,16.2052,a8w8_blockscale_1x128x128_256x64x64x256_16x16_32x32_1x1_16x16x1_16x16x1_1x32x1x8_8_1x1_intrawave_v1,285.74,551.01,0.0
256,384,2048,3072,ck,18,0,13.1312,a8w8_blockscale_1x128x128_256x64x64x256_16x16_32x32_1x1_16x16x1_16x16x1_1x32x1x8_8_1x1_intrawave_v1,367.97,688.74,0.0
256,400,2048,3072,ck,18,0,16.3503,a8w8_blockscale_1x128x128_256x64x64x256_16x16_32x32_1x1_16x16x1_16x16x1_1x32x1x8_8_1x1_intrawave_v1,307.83,560.15,0.0
256,416,2048,3072,ck,12,0,15.1624,a8w8_blockscale_1x128x128_256x32x128x256_16x16_32x32_1x1_16x16x1_16x16x1_1x32x1x8_8_1x1_intrawave_v1,345.23,611.6,0.0
256,432,2048,3072,ck,18,0,16.3243,a8w8_blockscale_1x128x128_256x64x64x256_16x16_32x32_1x1_16x16x1_16x16x1_1x32x1x8_8_1x1_intrawave_v1,332.99,575.1,0.0
256,448,2048,3072,ck,18,0,13.2898,a8w8_blockscale_1x128x128_256x64x64x256_16x16_32x32_1x1_16x16x1_16x16x1_1x32x1x8_8_1x1_intrawave_v1,424.17,715.04,0.0
256,464,2048,3072,ck,18,0,16.6129,a8w8_blockscale_1x128x128_256x64x64x256_16x16_32x32_1x1_16x16x1_16x16x1_1x32x1x8_8_1x1_intrawave_v1,351.44,578.91,0.0
256,480,2048,3072,ck,12,0,15.4255,a8w8_blockscale_1x128x128_256x32x128x256_16x16_32x32_1x1_16x16x1_16x16x1_1x32x1x8_8_1x1_intrawave_v1,391.55,630.91,0.0
256,496,2048,3072,ck,18,0,16.5844,a8w8_blockscale_1x128x128_256x64x64x256_16x16_32x32_1x1_16x16x1_16x16x1_1x32x1x8_8_1x1_intrawave_v1,376.33,593.74,0.0
256,512,2048,3072,ck,18,0,13.4133,a8w8_blockscale_1x128x128_256x64x64x256_16x16_32x32_1x1_16x16x1_16x16x1_1x32x1x8_8_1x1_intrawave_v1,480.3,742.66,0.0
256,1000,2048,3072,ck,2,0,21.3392,a8w8_blockscale_1x128x128_256x64x128x128_16x16_32x32_1x2_8x32x1_8x32x1_1x32x1x8_8_1x1_intrawave_v3,589.66,630.74,0.0
256,1001,2048,3072,ck,2,0,21.4064,a8w8_blockscale_1x128x128_256x64x128x128_16x16_32x32_1x2_8x32x1_8x32x1_1x32x1x8_8_1x1_intrawave_v3,588.4,629.09,0.0
256,1003,2048,3072,ck,2,0,21.1623,a8w8_blockscale_1x128x128_256x64x128x128_16x16_32x32_1x2_8x32x1_8x32x1_1x32x1x8_8_1x1_intrawave_v3,596.37,637.03,0.0
256,3000,2048,3072,ck,0,0,41.7856,a8w8_blockscale_1x128x128_256x128x128x128_16x16_32x32_2x2_8x32x1_8x32x1_1x32x1x8_8_1x1_intrawave_v3,903.39,665.19,0.0
256,4000,2048,3072,ck,0,0,47.971,a8w8_blockscale_1x128x128_256x128x128x128_16x16_32x32_2x2_8x32x1_8x32x1_1x32x1x8_8_1x1_intrawave_v3,1049.21,728.85,0.0
256,52101,2048,3072,cktile,11,0,436.787,a8w8_blockscale_cktile_128x128x128_2x2x1_32x32x16_intrawave_0x0x0x0_1,1500.92,869.42,0.0
256,53093,2048,3072,cktile,11,0,435.2641,a8w8_blockscale_cktile_128x128x128_2x2x1_32x32x16_intrawave_0x0x0x0_1,1534.85,888.8,0.0
256,65536,2048,3072,cktile,11,0,529.7654,a8w8_blockscale_cktile_128x128x128_2x2x1_32x32x16_intrawave_0x0x0x0_1,1556.6,898.61,0.0
256,1,3072,3072,ck,8,0,10.7166,a8w8_blockscale_1x128x128_256x16x64x256_16x16_16x16_1x1_16x16x1_16x16x1_1x16x1x16_4_1x1_intrawave_v1,1.76,881.47,0.0
256,1,3072,6144,ck,8,0,18.8682,a8w8_blockscale_1x128x128_256x16x64x256_16x16_16x16_1x1_16x16x1_16x16x1_1x16x1x16_4_1x1_intrawave_v1,2.0,1000.98,0.0
256,2,3072,3072,ck,8,0,10.6963,a8w8_blockscale_1x128x128_256x16x64x256_16x16_16x16_1x1_16x16x1_16x16x1_1x16x1x16_4_1x1_intrawave_v1,3.53,884.01,0.0
256,2,3072,6144,ck,8,0,18.8856,a8w8_blockscale_1x128x128_256x16x64x256_16x16_16x16_1x1_16x16x1_16x16x1_1x16x1x16_4_1x1_intrawave_v1,4.0,1000.71,0.0
256,4,3072,3072,ck,8,0,10.7134,a8w8_blockscale_1x128x128_256x16x64x256_16x16_16x16_1x1_16x16x1_16x16x1_1x16x1x16_4_1x1_intrawave_v1,7.05,884.32,0.0
256,4,3072,6144,ck,8,0,18.9282,a8w8_blockscale_1x128x128_256x16x64x256_16x16_16x16_1x1_16x16x1_16x16x1_1x16x1x16_4_1x1_intrawave_v1,7.98,999.75,0.0
256,8,3072,3072,ck,8,0,10.7898,a8w8_blockscale_1x128x128_256x16x64x256_16x16_16x16_1x1_16x16x1_16x16x1_1x16x1x16_4_1x1_intrawave_v1,13.99,881.47,0.0
256,8,3072,6144,ck,8,0,18.9939,a8w8_blockscale_1x128x128_256x16x64x256_16x16_16x16_1x1_16x16x1_16x16x1_1x16x1x16_4_1x1_intrawave_v1,15.9,998.88,0.0
256,16,3072,3072,ck,8,0,10.3995,a8w8_blockscale_1x128x128_256x16x64x256_16x16_16x16_1x1_16x16x1_16x16x1_1x16x1x16_4_1x1_intrawave_v1,29.04,921.64,0.0
256,16,3072,6144,ck,8,0,18.2106,a8w8_blockscale_1x128x128_256x16x64x256_16x16_16x16_1x1_16x16x1_16x16x1_1x16x1x16_4_1x1_intrawave_v1,33.17,1047.25,0.0
256,24,3072,3072,ck,8,0,10.8886,a8w8_blockscale_1x128x128_256x16x64x256_16x16_16x16_1x1_16x16x1_16x16x1_1x16x1x16_4_1x1_intrawave_v1,41.6,887.02,0.0
256,24,3072,6144,ck,8,0,19.0135,a8w8_blockscale_1x128x128_256x16x64x256_16x16_16x16_1x1_16x16x1_16x16x1_1x16x1x16_4_1x1_intrawave_v1,47.65,1008.19,0.0
256,32,3072,3072,ck,8,0,10.5915,a8w8_blockscale_1x128x128_256x16x64x256_16x16_16x16_1x1_16x16x1_16x16x1_1x16x1x16_4_1x1_intrawave_v1,57.02,918.86,0.0
256,32,3072,6144,ck,8,0,18.3057,a8w8_blockscale_1x128x128_256x16x64x256_16x16_16x16_1x1_16x16x1_16x16x1_1x16x1x16_4_1x1_intrawave_v1,65.99,1052.55,0.0
256,40,3072,3072,ck,8,0,10.8915,a8w8_blockscale_1x128x128_256x16x64x256_16x16_16x16_1x1_16x16x1_16x16x1_1x16x1x16_4_1x1_intrawave_v1,69.32,900.32,0.0
256,40,3072,6144,ck,8,0,19.0177,a8w8_blockscale_1x128x128_256x16x64x256_16x16_16x16_1x1_16x16x1_16x16x1_1x16x1x16_4_1x1_intrawave_v1,79.4,1018.31,0.0
256,48,3072,3072,ck,8,0,10.4746,a8w8_blockscale_1x128x128_256x16x64x256_16x16_16x16_1x1_16x16x1_16x16x1_1x16x1x16_4_1x1_intrawave_v1,86.49,943.19,0.0
256,48,3072,6144,ck,8,0,18.2528,a8w8_blockscale_1x128x128_256x16x64x256_16x16_16x16_1x1_16x16x1_16x16x1_1x16x1x16_4_1x1_intrawave_v1,99.27,1066.37,0.0
256,56,3072,3072,ck,8,0,10.8892,a8w8_blockscale_1x128x128_256x16x64x256_16x16_16x16_1x1_16x16x1_16x16x1_1x16x1x16_4_1x1_intrawave_v1,97.07,914.05,0.0
256,56,3072,6144,ck,8,0,19.124,a8w8_blockscale_1x128x128_256x16x64x256_16x16_16x16_1x1_16x16x1_16x16x1_1x16x1x16_4_1x1_intrawave_v1,110.54,1022.93,0.0
256,64,3072,3072,ck,8,0,10.4848,a8w8_blockscale_1x128x128_256x16x64x256_16x16_16x16_1x1_16x16x1_16x16x1_1x16x1x16_4_1x1_intrawave_v1,115.21,956.34,0.0
256,64,3072,6144,ck,8,0,18.3309,a8w8_blockscale_1x128x128_256x16x64x256_16x16_16x16_1x1_16x16x1_16x16x1_1x16x1x16_4_1x1_intrawave_v1,131.79,1072.55,0.0
256,72,3072,3072,ck,8,0,11.0155,a8w8_blockscale_1x128x128_256x16x64x256_16x16_16x16_1x1_16x16x1_16x16x1_1x16x1x16_4_1x1_intrawave_v1,123.37,916.96,0.0
256,72,3072,6144,ck,8,0,19.3832,a8w8_blockscale_1x128x128_256x16x64x256_16x16_16x16_1x1_16x16x1_16x16x1_1x16x1x16_4_1x1_intrawave_v1,140.22,1019.39,0.0
256,80,3072,3072,ck,8,0,10.6827,a8w8_blockscale_1x128x128_256x16x64x256_16x16_16x16_1x1_16x16x1_16x16x1_1x16x1x16_4_1x1_intrawave_v1,141.35,952.42,0.0
256,80,3072,6144,ck,8,0,18.6579,a8w8_blockscale_1x128x128_256x16x64x256_16x16_16x16_1x1_16x16x1_16x16x1_1x16x1x16_4_1x1_intrawave_v1,161.86,1064.29,0.0
256,88,3072,3072,ck,7,0,13.2137,a8w8_blockscale_1x128x128_256x16x128x256_16x16_16x16_1x2_16x16x1_16x16x1_1x16x1x16_8_1x2_intrawave_v1,125.7,775.57,0.0
256,88,3072,6144,ck,7,0,23.5073,a8w8_blockscale_1x128x128_256x16x128x256_16x16_16x16_1x2_16x16x1_16x16x1_1x16x1x16_8_1x2_intrawave_v1,141.31,848.92,0.0
256,96,3072,3072,ck,7,0,12.9797,a8w8_blockscale_1x128x128_256x16x128x256_16x16_16x16_1x2_16x16x1_16x16x1_1x16x1x16_8_1x2_intrawave_v1,139.6,795.24,0.0
256,96,3072,6144,ck,7,0,23.0397,a8w8_blockscale_1x128x128_256x16x128x256_16x16_16x16_1x2_16x16x1_16x16x1_1x16x1x16_8_1x2_intrawave_v1,157.29,870.41,0.0
256,104,3072,3072,ck,7,0,13.2224,a8w8_blockscale_1x128x128_256x16x128x256_16x16_16x16_1x2_16x16x1_16x16x1_1x16x1x16_8_1x2_intrawave_v1,148.46,786.21,0.0
256,104,3072,6144,ck,7,0,23.4662,a8w8_blockscale_1x128x128_256x16x128x256_16x16_16x16_1x2_16x16x1_16x16x1_1x16x1x16_8_1x2_intrawave_v1,167.3,858.78,0.0
256,112,3072,3072,ck,7,0,13.0403,a8w8_blockscale_1x128x128_256x16x128x256_16x16_16x16_1x2_16x16x1_16x16x1_1x16x1x16_8_1x2_intrawave_v1,162.11,802.85,0.0
256,112,3072,6144,ck,7,0,23.1685,a8w8_blockscale_1x128x128_256x16x128x256_16x16_16x16_1x2_16x16x1_16x16x1_1x16x1x16_8_1x2_intrawave_v1,182.48,874.06,0.0
256,120,3072,3072,ck,7,0,13.2553,a8w8_blockscale_1x128x128_256x16x128x256_16x16_16x16_1x2_16x16x1_16x16x1_1x16x1x16_8_1x2_intrawave_v1,170.87,795.39,0.0
256,120,3072,6144,ck,7,0,23.5272,a8w8_blockscale_1x128x128_256x16x128x256_16x16_16x16_1x2_16x16x1_16x16x1_1x16x1x16_8_1x2_intrawave_v1,192.54,864.91,0.0
256,128,3072,3072,ck,7,0,13.0333,a8w8_blockscale_1x128x128_256x16x128x256_16x16_16x16_1x2_16x16x1_16x16x1_1x16x1x16_8_1x2_intrawave_v1,185.37,814.59,0.0
256,128,3072,6144,ck,18,0,22.6071,a8w8_blockscale_1x128x128_256x64x64x256_16x16_32x32_1x1_16x16x1_16x16x1_1x32x1x8_8_1x1_intrawave_v1,213.73,904.46,0.0
256,136,3072,3072,ck,7,0,13.3358,a8w8_blockscale_1x128x128_256x16x128x256_16x16_16x16_1x2_16x16x1_16x16x1_1x16x1x16_8_1x2_intrawave_v1,192.48,801.64,0.0
256,136,3072,6144,ck,7,0,23.8382,a8w8_blockscale_1x128x128_256x16x128x256_16x16_16x16_1x2_16x16x1_16x16x1_1x16x1x16_8_1x2_intrawave_v1,215.36,861.87,0.0
256,144,3072,3072,ck,7,0,13.2358,a8w8_blockscale_1x128x128_256x16x128x256_16x16_16x16_1x2_16x16x1_16x16x1_1x16x1x16_8_1x2_intrawave_v1,205.35,813.27,0.0
256,144,3072,6144,ck,7,0,23.4382,a8w8_blockscale_1x128x128_256x16x128x256_16x16_16x16_1x2_16x16x1_16x16x1_1x16x1x16_8_1x2_intrawave_v1,231.92,880.78,0.0
256,152,3072,3072,ck,7,0,13.2253,a8w8_blockscale_1x128x128_256x16x128x256_16x16_16x16_1x2_16x16x1_16x16x1_1x16x1x16_8_1x2_intrawave_v1,216.93,819.49,0.0
256,152,3072,6144,ck,7,0,23.8948,a8w8_blockscale_1x128x128_256x16x128x256_16x16_16x16_1x2_16x16x1_16x16x1_1x16x1x16_8_1x2_intrawave_v1,240.13,868.06,0.0
256,160,3072,3072,ck,7,0,13.3044,a8w8_blockscale_1x128x128_256x16x128x256_16x16_16x16_1x2_16x16x1_16x16x1_1x16x1x16_8_1x2_intrawave_v1,226.98,820.16,0.0
256,160,3072,6144,ck,7,0,23.5528,a8w8_blockscale_1x128x128_256x16x128x256_16x16_16x16_1x2_16x16x1_16x16x1_1x16x1x16_8_1x2_intrawave_v1,256.44,884.84,0.0
256,168,3072,3072,ck,18,0,15.9336,a8w8_blockscale_1x128x128_256x64x64x256_16x16_32x32_1x1_16x16x1_16x16x1_1x32x1x8_8_1x1_intrawave_v1,199.01,689.45,0.0
256,168,3072,6144,ck,18,0,28.4272,a8w8_blockscale_1x128x128_256x64x64x256_16x16_32x32_1x1_16x16x1_16x16x1_1x32x1x8_8_1x1_intrawave_v1,223.09,736.57,0.0
256,176,3072,3072,ck,18,0,15.9953,a8w8_blockscale_1x128x128_256x64x64x256_16x16_32x32_1x1_16x16x1_16x16x1_1x32x1x8_8_1x1_intrawave_v1,207.68,691.4,0.0
256,176,3072,6144,ck,18,0,28.5246,a8w8_blockscale_1x128x128_256x64x64x256_16x16_32x32_1x1_16x16x1_16x16x1_1x32x1x8_8_1x1_intrawave_v1,232.91,737.51,0.0
256,184,3072,3072,ck,18,0,15.9974,a8w8_blockscale_1x128x128_256x64x64x256_16x16_32x32_1x1_16x16x1_16x16x1_1x32x1x8_8_1x1_intrawave_v1,217.09,695.92,0.0
256,184,3072,6144,ck,18,0,28.5801,a8w8_blockscale_1x128x128_256x64x64x256_16x16_32x32_1x1_16x16x1_16x16x1_1x32x1x8_8_1x1_intrawave_v1,243.03,739.51,0.0
256,192,3072,3072,ck,18,0,13.1151,a8w8_blockscale_1x128x128_256x64x64x256_16x16_32x32_1x1_16x16x1_16x16x1_1x32x1x8_8_1x1_intrawave_v1,276.31,854.48,0.0
256,192,3072,6144,ck,18,0,22.9125,a8w8_blockscale_1x128x128_256x64x64x256_16x16_32x32_1x1_16x16x1_16x16x1_1x32x1x8_8_1x1_intrawave_v1,316.32,926.73,0.0
256,200,3072,3072,ck,18,0,16.1507,a8w8_blockscale_1x128x128_256x64x64x256_16x16_32x32_1x1_16x16x1_16x16x1_1x32x1x8_8_1x1_intrawave_v1,233.73,698.45,0.0
256,200,3072,6144,ck,18,0,28.8195,a8w8_blockscale_1x128x128_256x64x64x256_16x16_32x32_1x1_16x16x1_16x16x1_1x32x1x8_8_1x1_intrawave_v1,261.97,740.19,0.0
256,208,3072,3072,ck,18,0,16.1849,a8w8_blockscale_1x128x128_256x64x64x256_16x16_32x32_1x1_16x16x1_16x16x1_1x32x1x8_8_1x1_intrawave_v1,242.56,701.53,0.0
256,208,3072,6144,ck,12,0,28.8628,a8w8_blockscale_1x128x128_256x32x128x256_16x16_32x32_1x1_16x16x1_16x16x1_1x32x1x8_8_1x1_intrawave_v1,272.04,742.49,0.0
256,216,3072,3072,ck,18,0,16.2459,a8w8_blockscale_1x128x128_256x64x64x256_16x16_32x32_1x1_16x16x1_16x16x1_1x32x1x8_8_1x1_intrawave_v1,250.95,703.43,0.0
256,216,3072,6144,ck,12,0,28.972,a8w8_blockscale_1x128x128_256x32x128x256_16x16_32x32_1x1_16x16x1_16x16x1_1x32x1x8_8_1x1_intrawave_v1,281.43,743.08,0.0
256,224,3072,3072,ck,12,0,14.9315,a8w8_blockscale_1x128x128_256x32x128x256_16x16_32x32_1x1_16x16x1_16x16x1_1x32x1x8_8_1x1_intrawave_v1,283.15,770.29,0.0
256,224,3072,6144,ck,12,0,26.1081,a8w8_blockscale_1x128x128_256x32x128x256_16x16_32x32_1x1_16x16x1_16x16x1_1x32x1x8_8_1x1_intrawave_v1,323.87,828.36,0.0
256,232,3072,3072,ck,18,0,16.2891,a8w8_blockscale_1x128x128_256x64x64x256_16x16_32x32_1x1_16x16x1_16x16x1_1x32x1x8_8_1x1_intrawave_v1,268.82,710.62,0.0
256,232,3072,6144,ck,18,0,29.0364,a8w8_blockscale_1x128x128_256x64x64x256_16x16_32x32_1x1_16x16x1_16x16x1_1x32x1x8_8_1x1_intrawave_v1,301.61,748.21,0.0
256,240,3072,3072,ck,18,0,16.2561,a8w8_blockscale_1x128x128_256x64x64x256_16x16_32x32_1x1_16x16x1_16x16x1_1x32x1x8_8_1x1_intrawave_v1,278.66,716.59,0.0
256,240,3072,6144,ck,18,0,29.1475,a8w8_blockscale_1x128x128_256x64x64x256_16x16_32x32_1x1_16x16x1_16x16x1_1x32x1x8_8_1x1_intrawave_v1,310.82,748.73,0.0
256,248,3072,3072,ck,18,0,16.3068,a8w8_blockscale_1x128x128_256x64x64x256_16x16_32x32_1x1_16x16x1_16x16x1_1x32x1x8_8_1x1_intrawave_v1,287.05,718.89,0.0
256,248,3072,6144,ck,12,0,28.9578,a8w8_blockscale_1x128x128_256x32x128x256_16x16_32x32_1x1_16x16x1_16x16x1_1x32x1x8_8_1x1_intrawave_v1,323.29,757.03,0.0
256,256,3072,3072,ck,18,0,13.2024,a8w8_blockscale_1x128x128_256x64x64x256_16x16_32x32_1x1_16x16x1_16x16x1_1x32x1x8_8_1x1_intrawave_v1,365.98,893.51,0.0
256,256,3072,6144,ck,18,0,23.1153,a8w8_blockscale_1x128x128_256x64x64x256_16x16_32x32_1x1_16x16x1_16x16x1_1x32x1x8_8_1x1_intrawave_v1,418.06,952.62,0.0
256,272,3072,3072,ck,18,0,16.517,a8w8_blockscale_1x128x128_256x64x64x256_16x16_32x32_1x1_16x16x1_16x16x1_1x32x1x8_8_1x1_intrawave_v1,310.82,723.13,0.0
256,272,3072,6144,ck,12,0,29.4102,a8w8_blockscale_1x128x128_256x32x128x256_16x16_32x32_1x1_16x16x1_16x16x1_1x32x1x8_8_1x1_intrawave_v1,349.12,755.41,0.0
256,288,3072,3072,ck,12,0,15.2994,a8w8_blockscale_1x128x128_256x32x128x256_16x16_32x32_1x1_16x16x1_16x16x1_1x32x1x8_8_1x1_intrawave_v1,355.3,790.32,0.0
256,288,3072,6144,ck,12,0,26.588,a8w8_blockscale_1x128x128_256x32x128x256_16x16_32x32_1x1_16x16x1_16x16x1_1x32x1x8_8_1x1_intrawave_v1,408.89,842.99,0.0
256,304,3072,3072,ck,18,0,16.5099,a8w8_blockscale_1x128x128_256x64x64x256_16x16_32x32_1x1_16x16x1_16x16x1_1x32x1x8_8_1x1_intrawave_v1,347.54,741.3,0.0
256,304,3072,6144,ck,18,0,29.3932,a8w8_blockscale_1x128x128_256x64x64x256_16x16_32x32_1x1_16x16x1_16x16x1_1x32x1x8_8_1x1_intrawave_v1,390.42,769.22,0.0
256,320,3072,3072,ck,18,0,13.455,a8w8_blockscale_1x128x128_256x64x64x256_16x16_32x32_1x1_16x16x1_16x16x1_1x32x1x8_8_1x1_intrawave_v1,448.89,920.57,0.0
256,320,3072,6144,ck,18,0,23.5304,a8w8_blockscale_1x128x128_256x64x64x256_16x16_32x32_1x1_16x16x1_16x16x1_1x32x1x8_8_1x1_intrawave_v1,513.36,969.24,0.0
256,336,3072,3072,ck,2,0,20.8719,a8w8_blockscale_1x128x128_256x64x128x128_16x16_32x32_1x2_8x32x1_8x32x1_1x32x1x8_8_1x1_intrawave_v3,303.84,600.51,0.0
256,336,3072,6144,ck,2,0,36.5758,a8w8_blockscale_1x128x128_256x64x128x128_16x16_32x32_1x2_8x32x1_8x32x1_1x32x1x8_8_1x1_intrawave_v3,346.78,628.92,0.0
256,352,3072,3072,ck,2,0,20.9636,a8w8_blockscale_1x128x128_256x64x128x128_16x16_32x32_1x2_8x32x1_8x32x1_1x32x1x8_8_1x1_intrawave_v3,316.92,604.92,0.0
256,352,3072,6144,ck,2,0,36.5045,a8w8_blockscale_1x128x128_256x64x128x128_16x16_32x32_1x2_8x32x1_8x32x1_1x32x1x8_8_1x1_intrawave_v3,364.0,635.53,0.0
256,368,3072,3072,ck,2,0,20.9326,a8w8_blockscale_1x128x128_256x64x128x128_16x16_32x32_1x2_8x32x1_8x32x1_1x32x1x8_8_1x1_intrawave_v3,331.82,612.86,0.0
256,368,3072,6144,ck,2,0,36.7353,a8w8_blockscale_1x128x128_256x64x128x128_16x16_32x32_1x2_8x32x1_8x32x1_1x32x1x8_8_1x1_intrawave_v3,378.15,636.89,0.0
256,384,3072,3072,ck,3,0,20.4472,a8w8_blockscale_1x128x128_256x64x64x128_16x16_32x32_1x1_8x32x1_8x32x1_1x32x1x8_8_1x1_intrawave_v3,354.46,634.62,0.0
256,384,3072,6144,ck,3,0,35.4643,a8w8_blockscale_1x128x128_256x64x64x128_16x16_32x32_1x1_8x32x1_8x32x1_1x32x1x8_8_1x1_intrawave_v3,408.74,665.26,0.0
256,400,3072,3072,ck,2,0,20.8808,a8w8_blockscale_1x128x128_256x64x128x128_16x16_32x32_1x2_8x32x1_8x32x1_1x32x1x8_8_1x1_intrawave_v3,361.56,628.5,0.0
256,400,3072,6144,ck,2,0,36.2015,a8w8_blockscale_1x128x128_256x64x128x128_16x16_32x32_1x2_8x32x1_8x32x1_1x32x1x8_8_1x1_intrawave_v3,417.1,657.14,0.0
256,416,3072,3072,ck,2,0,20.8524,a8w8_blockscale_1x128x128_256x64x128x128_16x16_32x32_1x2_8x32x1_8x32x1_1x32x1x8_8_1x1_intrawave_v3,376.54,636.43,0.0
256,416,3072,6144,ck,2,0,36.4273,a8w8_blockscale_1x128x128_256x64x128x128_16x16_32x32_1x2_8x32x1_8x32x1_1x32x1x8_8_1x1_intrawave_v3,431.09,658.47,0.0
256,432,3072,3072,ck,2,0,20.9903,a8w8_blockscale_1x128x128_256x64x128x128_16x16_32x32_1x2_8x32x1_8x32x1_1x32x1x8_8_1x1_intrawave_v3,388.45,639.27,0.0
256,432,3072,6144,ck,2,0,36.6995,a8w8_blockscale_1x128x128_256x64x128x128_16x16_32x32_1x2_8x32x1_8x32x1_1x32x1x8_8_1x1_intrawave_v3,444.35,658.94,0.0
256,448,3072,3072,ck,2,0,20.3992,a8w8_blockscale_1x128x128_256x64x128x128_16x16_32x32_1x2_8x32x1_8x32x1_1x32x1x8_8_1x1_intrawave_v3,414.51,665.02,0.0
256,448,3072,6144,ck,2,0,35.9118,a8w8_blockscale_1x128x128_256x64x128x128_16x16_32x32_1x2_8x32x1_8x32x1_1x32x1x8_8_1x1_intrawave_v3,470.92,678.87,0.0
256,464,3072,3072,ck,2,0,20.6835,a8w8_blockscale_1x128x128_256x64x128x128_16x16_32x32_1x2_8x32x1_8x32x1_1x32x1x8_8_1x1_intrawave_v3,423.42,663.01,0.0
256,464,3072,6144,ck,2,0,36.1651,a8w8_blockscale_1x128x128_256x64x128x128_16x16_32x32_1x2_8x32x1_8x32x1_1x32x1x8_8_1x1_intrawave_v3,484.32,679.55,0.0
256,480,3072,3072,ck,2,0,20.952,a8w8_blockscale_1x128x128_256x64x128x128_16x16_32x32_1x2_8x32x1_8x32x1_1x32x1x8_8_1x1_intrawave_v3,432.4,661.55,0.0
256,480,3072,6144,ck,2,0,36.2425,a8w8_blockscale_1x128x128_256x64x128x128_16x16_32x32_1x2_8x32x1_8x32x1_1x32x1x8_8_1x1_intrawave_v3,499.95,683.52,0.0
256,496,3072,3072,ck,2,0,21.058,a8w8_blockscale_1x128x128_256x64x128x128_16x16_32x32_1x2_8x32x1_8x32x1_1x32x1x8_8_1x1_intrawave_v3,444.57,665.23,0.0
256,496,3072,6144,ck,2,0,36.2516,a8w8_blockscale_1x128x128_256x64x128x128_16x16_32x32_1x2_8x32x1_8x32x1_1x32x1x8_8_1x1_intrawave_v3,516.48,688.78,0.0
256,512,3072,3072,ck,2,0,20.6346,a8w8_blockscale_1x128x128_256x64x128x128_16x16_32x32_1x2_8x32x1_8x32x1_1x32x1x8_8_1x1_intrawave_v3,468.32,686.02,0.0
256,512,3072,6144,ck,2,0,36.0545,a8w8_blockscale_1x128x128_256x64x128x128_16x16_32x32_1x2_8x32x1_8x32x1_1x32x1x8_8_1x1_intrawave_v3,536.06,697.99,0.0
256,1000,3072,3072,ck,0,0,27.321,a8w8_blockscale_1x128x128_256x128x128x128_16x16_32x32_2x2_8x32x1_8x32x1_1x32x1x8_8_1x1_intrawave_v3,690.84,682.74,0.0
256,1000,3072,6144,ck,0,0,47.1091,a8w8_blockscale_1x128x128_256x128x128x128_16x16_32x32_2x2_8x32x1_8x32x1_1x32x1x8_8_1x1_intrawave_v3,801.3,661.49,0.0
256,1001,3072,3072,ck,0,0,27.1676,a8w8_blockscale_1x128x128_256x128x128x128_16x16_32x32_2x2_8x32x1_8x32x1_1x32x1x8_8_1x1_intrawave_v3,695.43,686.94,0.0
256,1001,3072,6144,ck,0,0,47.2828,a8w8_blockscale_1x128x128_256x128x128x128_16x16_32x32_2x2_8x32x1_8x32x1_1x32x1x8_8_1x1_intrawave_v3,799.16,659.32,0.0
256,1169,3072,6144,ck,0,0,47.9594,a8w8_blockscale_1x128x128_256x128x128x128_16x16_32x32_2x2_8x32x1_8x32x1_1x32x1x8_8_1x1_intrawave_v3,920.12,693.07,0.0
256,1192,3072,6144,ck,0,0,48.5331,a8w8_blockscale_1x128x128_256x128x128x128_16x16_32x32_2x2_8x32x1_8x32x1_1x32x1x8_8_1x1_intrawave_v3,927.13,690.7,0.0
256,1200,3072,6144,ck,0,0,48.217,a8w8_blockscale_1x128x128_256x128x128x128_16x16_32x32_2x2_8x32x1_8x32x1_1x32x1x8_8_1x1_intrawave_v3,939.47,697.26,0.0
256,1202,3072,6144,ck,0,0,48.5266,a8w8_blockscale_1x128x128_256x128x128x128_16x16_32x32_2x2_8x32x1_8x32x1_1x32x1x8_8_1x1_intrawave_v3,935.03,693.32,0.0
256,1205,3072,6144,ck,0,0,48.1034,a8w8_blockscale_1x128x128_256x128x128x128_16x16_32x32_2x2_8x32x1_8x32x1_1x32x1x8_8_1x1_intrawave_v3,945.61,700.19,0.0
256,1216,3072,6144,ck,0,0,49.0283,a8w8_blockscale_1x128x128_256x128x128x128_16x16_32x32_2x2_8x32x1_8x32x1_1x32x1x8_8_1x1_intrawave_v3,936.24,689.74,0.0
256,1263,3072,6144,ck,0,0,49.617,a8w8_blockscale_1x128x128_256x128x128x128_16x16_32x32_2x2_8x32x1_8x32x1_1x32x1x8_8_1x1_intrawave_v3,960.89,693.19,0.0
256,2000,3072,3072,ck,2,0,43.5358,a8w8_blockscale_1x128x128_256x64x128x128_16x16_32x32_1x2_8x32x1_8x32x1_1x32x1x8_8_1x1_intrawave_v3,867.07,640.14,0.0
256,2002,3072,3072,ck,2,0,42.8854,a8w8_blockscale_1x128x128_256x64x128x128_16x16_32x32_1x2_8x32x1_8x32x1_1x32x1x8_8_1x1_intrawave_v3,881.1,650.28,0.0
256,2197,3072,6144,ck,0,0,78.9936,a8w8_blockscale_1x128x128_256x128x128x128_16x16_32x32_2x2_8x32x1_8x32x1_1x32x1x8_8_1x1_intrawave_v3,1049.88,580.69,0.0
256,2200,3072,6144,ck,0,0,79.0261,a8w8_blockscale_1x128x128_256x128x128x128_16x16_32x32_2x2_8x32x1_8x32x1_1x32x1x8_8_1x1_intrawave_v3,1050.88,580.92,0.0
256,2202,3072,6144,cktile,11,0,80.2151,a8w8_blockscale_cktile_128x128x128_2x2x1_32x32x16_intrawave_0x0x0x0_1,1036.25,572.62,0.0
256,2204,3072,6144,ck,0,0,77.0768,a8w8_blockscale_1x128x128_256x128x128x128_16x16_32x32_2x2_8x32x1_8x32x1_1x32x1x8_8_1x1_intrawave_v3,1079.42,596.25,0.0
256,2216,3072,6144,cktile,11,0,80.1039,a8w8_blockscale_cktile_128x128x128_2x2x1_32x32x16_intrawave_0x0x0x0_1,1044.28,575.56,0.0
256,2230,3072,6144,ck,0,0,79.3884,a8w8_blockscale_1x128x128_256x128x128x128_16x16_32x32_2x2_8x32x1_8x32x1_1x32x1x8_8_1x1_intrawave_v3,1060.35,582.91,0.0
256,3201,3072,6144,cktile,11,0,83.1245,a8w8_blockscale_cktile_128x128x128_2x2x1_32x32x16_intrawave_0x0x0x0_1,1453.65,700.25,0.0
256,3225,3072,6144,cktile,11,0,83.8191,a8w8_blockscale_cktile_128x128x128_2x2x1_32x32x16_intrawave_0x0x0x0_1,1452.41,697.97,0.0
256,3227,3072,6144,cktile,11,0,83.3772,a8w8_blockscale_cktile_128x128x128_2x2x1_32x32x16_intrawave_0x0x0x0_1,1461.01,701.96,0.0
256,3242,3072,6144,cktile,11,0,82.9657,a8w8_blockscale_cktile_128x128x128_2x2x1_32x32x16_intrawave_0x0x0x0_1,1475.08,707.67,0.0
256,4000,3072,3072,cktile,11,0,52.9663,a8w8_blockscale_cktile_128x128x128_2x2x1_32x32x16_intrawave_0x0x0x0_1,1425.39,874.16,0.0
256,4000,3072,6144,cktile,11,0,87.2827,a8w8_blockscale_cktile_128x128x128_2x2x1_32x32x16_intrawave_0x0x0x0_1,1729.95,779.38,0.0
256,4197,3072,6144,cktile,11,0,131.0024,a8w8_blockscale_cktile_128x128x128_2x2x1_32x32x16_intrawave_0x0x0x0_1,1209.38,537.75,0.0
256,4219,3072,6144,cktile,11,0,131.0292,a8w8_blockscale_cktile_128x128x128_2x2x1_32x32x16_intrawave_0x0x0x0_1,1215.47,539.71,0.0
256,4223,3072,6144,cktile,11,0,131.4595,a8w8_blockscale_cktile_128x128x128_2x2x1_32x32x16_intrawave_0x0x0x0_1,1212.64,538.31,0.0
256,4250,3072,6144,cktile,11,0,138.7402,a8w8_blockscale_cktile_128x128x128_2x2x1_32x32x16_intrawave_0x0x0x0_1,1156.35,512.46,0.0
256,5197,3072,6144,ck,0,0,154.6055,a8w8_blockscale_1x128x128_256x128x128x128_16x16_32x32_2x2_8x32x1_8x32x1_1x32x1x8_8_1x1_intrawave_v3,1268.91,535.14,0.0
256,6792,3072,6144,cktile,11,0,161.7816,a8w8_blockscale_cktile_128x128x128_2x2x1_32x32x16_intrawave_0x0x0x0_1,1584.79,632.55,0.0
256,6830,3072,6144,cktile,11,0,162.1549,a8w8_blockscale_cktile_128x128x128_2x2x1_32x32x16_intrawave_0x0x0x0_1,1589.99,633.97,0.0
256,7001,3072,6144,cktile,11,0,162.4835,a8w8_blockscale_cktile_128x128x128_2x2x1_32x32x16_intrawave_0x0x0x0_1,1626.5,645.62,0.0
256,7787,3072,6144,cktile,11,0,165.557,a8w8_blockscale_cktile_128x128x128_2x2x1_32x32x16_intrawave_0x0x0x0_1,1775.52,691.97,0.0
256,11001,3072,3072,cktile,11,0,145.4784,a8w8_blockscale_cktile_128x128x128_2x2x1_32x32x16_intrawave_0x0x0x0_1,1427.27,761.78,0.0
256,11636,3072,6144,cktile,11,0,243.5071,a8w8_blockscale_cktile_128x128x128_2x2x1_32x32x16_intrawave_0x0x0x0_1,1803.83,664.69,0.0
256,12909,3072,3072,cktile,11,0,186.084,a8w8_blockscale_cktile_128x128x128_2x2x1_32x32x16_intrawave_0x0x0x0_1,1309.35,690.05,0.0
256,30553,3072,3072,cktile,11,0,374.9371,a8w8_blockscale_cktile_128x128x128_2x2x1_32x32x16_intrawave_0x0x0x0_1,1538.04,776.17,0.0
256,30743,3072,6144,cktile,11,0,631.6465,a8w8_blockscale_cktile_128x128x128_2x2x1_32x32x16_intrawave_0x0x0x0_1,1837.28,627.95,0.0
256,31097,3072,6144,cktile,11,0,636.8461,a8w8_blockscale_cktile_128x128x128_2x2x1_32x32x16_intrawave_0x0x0x0_1,1843.26,629.66,0.0
256,32065,3072,6144,cktile,11,0,639.6025,a8w8_blockscale_cktile_128x128x128_2x2x1_32x32x16_intrawave_0x0x0x0_1,1892.45,645.54,0.0
256,35092,3072,6144,cktile,11,0,717.8088,a8w8_blockscale_cktile_128x128x128_2x2x1_32x32x16_intrawave_0x0x0x0_1,1845.45,627.03,0.0
256,39088,3072,6144,cktile,11,0,801.6347,a8w8_blockscale_cktile_128x128x128_2x2x1_32x32x16_intrawave_0x0x0x0_1,1840.64,622.71,0.0
256,42723,3072,6144,cktile,11,0,881.4219,a8w8_blockscale_cktile_128x128x128_2x2x1_32x32x16_intrawave_0x0x0x0_1,1829.7,617.02,0.0
256,48310,3072,6144,cktile,11,0,961.9017,a8w8_blockscale_cktile_128x128x128_2x2x1_32x32x16_intrawave_0x0x0x0_1,1895.87,636.77,0.0
256,53093,3072,3072,cktile,11,0,613.2164,a8w8_blockscale_cktile_128x128x128_2x2x1_32x32x16_intrawave_0x0x0x0_1,1634.17,813.32,0.0
256,55349,3072,6144,cktile,11,0,1111.2941,a8w8_blockscale_cktile_128x128x128_2x2x1_32x32x16_intrawave_0x0x0x0_1,1880.11,629.0,0.0
256,57008,3072,6144,cktile,11,0,1130.1704,a8w8_blockscale_cktile_128x128x128_2x2x1_32x32x16_intrawave_0x0x0x0_1,1904.12,636.53,0.0
256,64564,3072,6144,cktile,11,0,1290.199,a8w8_blockscale_cktile_128x128x128_2x2x1_32x32x16_intrawave_0x0x0x0_1,1889.02,629.54,0.0
256,65536,3072,3072,cktile,11,0,752.0076,a8w8_blockscale_cktile_128x128x128_2x2x1_32x32x16_intrawave_0x0x0x0_1,1644.86,815.71,0.0
256,65536,3072,6144,cktile,11,0,1267.1392,a8w8_blockscale_cktile_128x128x128_2x2x1_32x32x16_intrawave_0x0x0x0_1,1952.35,650.43,0.0
256,1,4096,3072,ck,8,0,10.3323,a8w8_blockscale_1x128x128_256x16x64x256_16x16_16x16_1x1_16x16x1_16x16x1_1x16x1x16_4_1x1_intrawave_v1,2.44,1218.91,0.0
256,2,4096,3072,ck,8,0,10.3738,a8w8_blockscale_1x128x128_256x16x64x256_16x16_16x16_1x1_16x16x1_16x16x1_1x16x1x16_4_1x1_intrawave_v1,4.85,1215.12,0.0
256,4,4096,3072,ck,8,0,10.3668,a8w8_blockscale_1x128x128_256x16x64x256_16x16_16x16_1x1_16x16x1_16x16x1_1x16x1x16_4_1x1_intrawave_v1,9.71,1218.12,0.0
256,8,4096,3072,ck,8,0,10.3965,a8w8_blockscale_1x128x128_256x16x64x256_16x16_16x16_1x1_16x16x1_16x16x1_1x16x1x16_4_1x1_intrawave_v1,19.36,1218.97,0.0
256,16,4096,3072,ck,8,0,9.9875,a8w8_blockscale_1x128x128_256x16x64x256_16x16_16x16_1x1_16x16x1_16x16x1_1x16x1x16_4_1x1_intrawave_v1,40.32,1277.91,0.0
256,24,4096,3072,ck,8,0,10.5911,a8w8_blockscale_1x128x128_256x16x64x256_16x16_16x16_1x1_16x16x1_16x16x1_1x16x1x16_4_1x1_intrawave_v1,57.03,1213.59,0.0
256,32,4096,3072,ck,8,0,10.1808,a8w8_blockscale_1x128x128_256x16x64x256_16x16_16x16_1x1_16x16x1_16x16x1_1x16x1x16_4_1x1_intrawave_v1,79.1,1271.35,0.0
256,40,4096,3072,ck,8,0,10.5706,a8w8_blockscale_1x128x128_256x16x64x256_16x16_16x16_1x1_16x16x1_16x16x1_1x16x1x16_4_1x1_intrawave_v1,95.23,1232.99,0.0
256,48,4096,3072,ck,8,0,10.2136,a8w8_blockscale_1x128x128_256x16x64x256_16x16_16x16_1x1_16x16x1_16x16x1_1x16x1x16_4_1x1_intrawave_v1,118.27,1284.91,0.0
256,56,4096,3072,ck,8,0,10.6604,a8w8_blockscale_1x128x128_256x16x64x256_16x16_16x16_1x1_16x16x1_16x16x1_1x16x1x16_4_1x1_intrawave_v1,132.2,1239.51,0.0
256,64,4096,3072,ck,8,0,10.197,a8w8_blockscale_1x128x128_256x16x64x256_16x16_16x16_1x1_16x16x1_16x16x1_1x16x1x16_4_1x1_intrawave_v1,157.95,1304.68,0.0
256,72,4096,3072,ck,7,0,13.1591,a8w8_blockscale_1x128x128_256x16x128x256_16x16_16x16_1x2_16x16x1_16x16x1_1x16x1x16_8_1x2_intrawave_v1,137.69,1017.84,0.0
256,80,4096,3072,ck,7,0,12.9471,a8w8_blockscale_1x128x128_256x16x128x256_16x16_16x16_1x2_16x16x1_16x16x1_1x16x1x16_8_1x2_intrawave_v1,155.5,1041.47,0.0
256,88,4096,3072,ck,7,0,13.1878,a8w8_blockscale_1x128x128_256x16x128x256_16x16_16x16_1x2_16x16x1_16x16x1_1x16x1x16_8_1x2_intrawave_v1,167.93,1029.3,0.0
256,96,4096,3072,ck,7,0,12.9517,a8w8_blockscale_1x128x128_256x16x128x256_16x16_16x16_1x2_16x16x1_16x16x1_1x16x1x16_8_1x2_intrawave_v1,186.53,1055.02,0.0
256,104,4096,3072,ck,7,0,13.1728,a8w8_blockscale_1x128x128_256x16x128x256_16x16_16x16_1x2_16x16x1_16x16x1_1x16x1x16_8_1x2_intrawave_v1,198.69,1044.15,0.0
256,112,4096,3072,ck,7,0,13.0021,a8w8_blockscale_1x128x128_256x16x128x256_16x16_16x16_1x2_16x16x1_16x16x1_1x16x1x16_8_1x2_intrawave_v1,216.78,1064.79,0.0
256,120,4096,3072,ck,7,0,13.2021,a8w8_blockscale_1x128x128_256x16x128x256_16x16_16x16_1x2_16x16x1_16x16x1_1x16x1x16_8_1x2_intrawave_v1,228.74,1055.48,0.0
256,128,4096,3072,ck,7,0,13.0141,a8w8_blockscale_1x128x128_256x16x128x256_16x16_16x16_1x2_16x16x1_16x16x1_1x16x1x16_8_1x2_intrawave_v1,247.52,1077.65,0.0
256,136,4096,3072,ck,18,0,16.0768,a8w8_blockscale_1x128x128_256x64x64x256_16x16_32x32_1x1_16x16x1_16x16x1_1x32x1x8_8_1x1_intrawave_v1,212.89,877.96,0.0
256,144,4096,3072,ck,18,0,16.1354,a8w8_blockscale_1x128x128_256x64x64x256_16x16_32x32_1x1_16x16x1_16x16x1_1x32x1x8_8_1x1_intrawave_v1,224.59,880.36,0.0
256,152,4096,3072,ck,18,0,16.1365,a8w8_blockscale_1x128x128_256x64x64x256_16x16_32x32_1x1_16x16x1_16x16x1_1x32x1x8_8_1x1_intrawave_v1,237.05,885.88,0.0
256,160,4096,3072,ck,12,0,14.9816,a8w8_blockscale_1x128x128_256x32x128x256_16x16_32x32_1x1_16x16x1_16x16x1_1x32x1x8_8_1x1_intrawave_v1,268.77,960.19,0.0
256,168,4096,3072,ck,18,0,16.1396,a8w8_blockscale_1x128x128_256x64x64x256_16x16_32x32_1x1_16x16x1_16x16x1_1x32x1x8_8_1x1_intrawave_v1,261.96,896.88,0.0
256,176,4096,3072,ck,18,0,16.1434,a8w8_blockscale_1x128x128_256x64x64x256_16x16_32x32_1x1_16x16x1_16x16x1_1x32x1x8_8_1x1_intrawave_v1,274.37,902.25,0.0
256,184,4096,3072,ck,18,0,16.191,a8w8_blockscale_1x128x128_256x64x64x256_16x16_32x32_1x1_16x16x1_16x16x1_1x32x1x8_8_1x1_intrawave_v1,285.99,905.16,0.0
256,192,4096,3072,ck,18,0,13.2096,a8w8_blockscale_1x128x128_256x64x64x256_16x16_32x32_1x1_16x16x1_16x16x1_1x32x1x8_8_1x1_intrawave_v1,365.78,1116.28,0.0
256,200,4096,3072,ck,18,0,16.5307,a8w8_blockscale_1x128x128_256x64x64x256_16x16_32x32_1x1_16x16x1_16x16x1_1x32x1x8_8_1x1_intrawave_v1,304.47,897.46,0.0
256,208,4096,3072,ck,18,0,16.5578,a8w8_blockscale_1x128x128_256x64x64x256_16x16_32x32_1x1_16x16x1_16x16x1_1x32x1x8_8_1x1_intrawave_v1,316.13,901.44,0.0
256,216,4096,3072,ck,18,0,16.5708,a8w8_blockscale_1x128x128_256x64x64x256_16x16_32x32_1x1_16x16x1_16x16x1_1x32x1x8_8_1x1_intrawave_v1,328.04,906.17,0.0
256,224,4096,3072,ck,12,0,15.2144,a8w8_blockscale_1x128x128_256x32x128x256_16x16_32x32_1x1_16x16x1_16x16x1_1x32x1x8_8_1x1_intrawave_v1,370.51,992.88,0.0
256,232,4096,3072,ck,18,0,16.6047,a8w8_blockscale_1x128x128_256x64x64x256_16x16_32x32_1x1_16x16x1_16x16x1_1x32x1x8_8_1x1_intrawave_v1,351.62,915.17,0.0
256,240,4096,3072,ck,18,0,16.5689,a8w8_blockscale_1x128x128_256x64x64x256_16x16_32x32_1x1_16x16x1_16x16x1_1x32x1x8_8_1x1_intrawave_v1,364.53,922.59,0.0
256,248,4096,3072,ck,18,0,16.5531,a8w8_blockscale_1x128x128_256x64x64x256_16x16_32x32_1x1_16x16x1_16x16x1_1x32x1x8_8_1x1_intrawave_v1,377.04,928.91,0.0
256,256,4096,3072,ck,18,0,13.4661,a8w8_blockscale_1x128x128_256x64x64x256_16x16_32x32_1x1_16x16x1_16x16x1_1x32x1x8_8_1x1_intrawave_v1,478.42,1148.55,0.0
256,272,4096,3072,ck,2,0,20.6699,a8w8_blockscale_1x128x128_256x64x128x128_16x16_32x32_1x2_8x32x1_8x32x1_1x32x1x8_8_1x1_intrawave_v3,331.16,756.98,0.0
256,288,4096,3072,ck,2,0,20.9717,a8w8_blockscale_1x128x128_256x64x128x128_16x16_32x32_1x2_8x32x1_8x32x1_1x32x1x8_8_1x1_intrawave_v3,345.6,754.68,0.0
256,304,4096,3072,ck,2,0,20.9611,a8w8_blockscale_1x128x128_256x64x128x128_16x16_32x32_1x2_8x32x1_8x32x1_1x32x1x8_8_1x1_intrawave_v3,364.98,763.66,0.0
256,320,4096,3072,ck,2,0,20.6538,a8w8_blockscale_1x128x128_256x64x128x128_16x16_32x32_1x2_8x32x1_8x32x1_1x32x1x8_8_1x1_intrawave_v3,389.91,783.75,0.0
256,336,4096,3072,ck,2,0,20.6292,a8w8_blockscale_1x128x128_256x64x128x128_16x16_32x32_1x2_8x32x1_8x32x1_1x32x1x8_8_1x1_intrawave_v3,409.89,793.42,0.0
256,352,4096,3072,ck,2,0,20.6856,a8w8_blockscale_1x128x128_256x64x128x128_16x16_32x32_1x2_8x32x1_8x32x1_1x32x1x8_8_1x1_intrawave_v3,428.24,799.97,0.0
256,368,4096,3072,ck,2,0,20.7794,a8w8_blockscale_1x128x128_256x64x128x128_16x16_32x32_1x2_8x32x1_8x32x1_1x32x1x8_8_1x1_intrawave_v3,445.68,805.03,0.0
256,384,4096,3072,ck,2,0,20.6682,a8w8_blockscale_1x128x128_256x64x128x128_16x16_32x32_1x2_8x32x1_8x32x1_1x32x1x8_8_1x1_intrawave_v3,467.56,818.08,0.0
256,400,4096,3072,ck,2,0,20.7627,a8w8_blockscale_1x128x128_256x64x128x128_16x16_32x32_1x2_8x32x1_8x32x1_1x32x1x8_8_1x1_intrawave_v3,484.83,823.04,0.0
256,416,4096,3072,ck,2,0,20.8205,a8w8_blockscale_1x128x128_256x64x128x128_16x16_32x32_1x2_8x32x1_8x32x1_1x32x1x8_8_1x1_intrawave_v3,502.82,829.41,0.0
256,432,4096,3072,ck,2,0,20.9262,a8w8_blockscale_1x128x128_256x64x128x128_16x16_32x32_1x2_8x32x1_8x32x1_1x32x1x8_8_1x1_intrawave_v3,519.52,833.83,0.0
256,448,4096,3072,ck,2,0,20.6907,a8w8_blockscale_1x128x128_256x64x128x128_16x16_32x32_1x2_8x32x1_8x32x1_1x32x1x8_8_1x1_intrawave_v3,544.9,852.03,0.0
256,464,4096,3072,ck,2,0,20.8888,a8w8_blockscale_1x128x128_256x64x128x128_16x16_32x32_1x2_8x32x1_8x32x1_1x32x1x8_8_1x1_intrawave_v3,559.0,852.58,0.0
256,480,4096,3072,ck,2,0,20.9128,a8w8_blockscale_1x128x128_256x64x128x128_16x16_32x32_1x2_8x32x1_8x32x1_1x32x1x8_8_1x1_intrawave_v3,577.62,860.22,0.0
256,496,4096,3072,ck,2,0,20.9939,a8w8_blockscale_1x128x128_256x64x128x128_16x16_32x32_1x2_8x32x1_8x32x1_1x32x1x8_8_1x1_intrawave_v3,594.57,865.48,0.0
256,512,4096,3072,ck,2,0,20.7649,a8w8_blockscale_1x128x128_256x64x128x128_16x16_32x32_1x2_8x32x1_8x32x1_1x32x1x8_8_1x1_intrawave_v3,620.51,883.71,0.0
256,1000,4096,3072,ck,0,0,28.4401,a8w8_blockscale_1x128x128_256x128x128x128_16x16_32x32_2x2_8x32x1_8x32x1_1x32x1x8_8_1x1_intrawave_v3,884.87,838.5,0.0
256,1001,4096,3072,ck,0,0,28.4036,a8w8_blockscale_1x128x128_256x128x128x128_16x16_32x32_2x2_8x32x1_8x32x1_1x32x1x8_8_1x1_intrawave_v3,886.89,839.97,0.0
256,2000,4096,3072,ck,0,0,47.1658,a8w8_blockscale_1x128x128_256x128x128x128_16x16_32x32_2x2_8x32x1_8x32x1_1x32x1x8_8_1x1_intrawave_v3,1067.12,744.41,0.0
256,2002,4096,3072,ck,0,0,47.7614,a8w8_blockscale_1x128x128_256x128x128x128_16x16_32x32_2x2_8x32x1_8x32x1_1x32x1x8_8_1x1_intrawave_v3,1054.87,735.6,0.0
256,4000,4096,3072,ck,0,0,88.3393,a8w8_blockscale_1x128x128_256x128x128x128_16x16_32x32_2x2_8x32x1_8x32x1_1x32x1x8_8_1x1_intrawave_v3,1139.51,652.47,0.0
256,11001,4096,3072,cktile,11,0,190.6172,a8w8_blockscale_cktile_128x128x128_2x2x1_32x32x16_intrawave_0x0x0x0_1,1452.38,716.09,0.0
256,12909,4096,3072,cktile,11,0,233.8367,a8w8_blockscale_cktile_128x128x128_2x2x1_32x32x16_intrawave_0x0x0x0_1,1389.28,675.64,0.0
256,30553,4096,3072,cktile,11,0,473.8674,a8w8_blockscale_cktile_128x128x128_2x2x1_32x32x16_intrawave_0x0x0x0_1,1622.59,752.81,0.0
256,53093,4096,3072,cktile,11,0,841.8863,a8w8_blockscale_cktile_128x128x128_2x2x1_32x32x16_intrawave_0x0x0x0_1,1587.07,725.3,0.0
256,65536,4096,3072,cktile,11,0,1029.6059,a8w8_blockscale_cktile_128x128x128_2x2x1_32x32x16_intrawave_0x0x0x0_1,1601.84,729.19,0.0
256,16,4608,7168,ck,8,0,21.4632,a8w8_blockscale_1x128x128_256x16x64x256_16x16_16x16_1x1_16x16x1_16x16x1_1x16x1x16_4_1x1_intrawave_v1,49.25,1551.13,0.0
256,32,4608,7168,ck,8,0,21.2795,a8w8_blockscale_1x128x128_256x16x64x256_16x16_16x16_1x1_16x16x1_16x16x1_1x16x1x16_4_1x1_intrawave_v1,99.34,1576.84,0.0
256,64,4608,7168,ck,7,0,23.0777,a8w8_blockscale_1x128x128_256x16x128x256_16x16_16x16_1x2_16x16x1_16x16x1_1x16x1x16_8_1x2_intrawave_v1,183.2,1476.69,0.0
256,128,4608,7168,ck,18,0,23.7809,a8w8_blockscale_1x128x128_256x64x64x256_16x16_32x32_1x1_16x16x1_16x16x1_1x32x1x8_8_1x1_intrawave_v1,355.57,1477.12,0.0
256,256,4608,7168,ck,18,0,36.301,a8w8_blockscale_1x128x128_256x64x64x256_16x16_32x32_1x1_16x16x1_16x16x1_1x32x1x8_8_1x1_intrawave_v1,465.87,1025.44,0.0
256,512,4608,7168,ck,18,0,54.8972,a8w8_blockscale_1x128x128_256x64x64x256_16x16_32x32_1x1_16x16x1_16x16x1_1x32x1x8_8_1x1_intrawave_v1,616.11,754.48,0.0
256,1024,4608,7168,ck,0,0,90.5685,a8w8_blockscale_1x128x128_256x128x128x128_16x16_32x32_2x2_8x32x1_8x32x1_1x32x1x8_8_1x1_intrawave_v3,746.9,549.94,0.0
256,1536,4608,7168,ck,0,0,104.829,a8w8_blockscale_1x128x128_256x128x128x128_16x16_32x32_2x2_8x32x1_8x32x1_1x32x1x8_8_1x1_intrawave_v3,967.94,555.15,0.0
256,2048,4608,7168,ck,0,0,147.1064,a8w8_blockscale_1x128x128_256x128x128x128_16x16_32x32_2x2_8x32x1_8x32x1_1x32x1x8_8_1x1_intrawave_v3,919.68,452.63,0.0
256,4096,4608,7168,ck,0,0,240.5825,a8w8_blockscale_1x128x128_256x128x128x128_16x16_32x32_2x2_8x32x1_8x32x1_1x32x1x8_8_1x1_intrawave_v3,1124.7,416.24,0.0
256,8192,4608,7168,ck,0,0,441.2084,a8w8_blockscale_1x128x128_256x128x128x128_16x16_32x32_2x2_8x32x1_8x32x1_1x32x1x8_8_1x1_intrawave_v3,1226.55,379.07,0.0
256,16384,4608,7168,ck,0,0,855.9478,a8w8_blockscale_1x128x128_256x128x128x128_16x16_32x32_2x2_8x32x1_8x32x1_1x32x1x8_8_1x1_intrawave_v3,1264.48,352.2,0.0
256,20480,4608,7168,ck,0,0,1076.9916,a8w8_blockscale_1x128x128_256x128x128x128_16x16_32x32_2x2_8x32x1_8x32x1_1x32x1x8_8_1x1_intrawave_v3,1256.2,342.23,0.0
256,16,7168,256,ck,8,0,2.9938,a8w8_blockscale_1x128x128_256x16x64x256_16x16_16x16_1x1_16x16x1_16x16x1_1x16x1x16_4_1x1_intrawave_v1,19.61,690.92,0.0
256,16,7168,2304,ck,8,0,8.8896,a8w8_blockscale_1x128x128_256x16x64x256_16x16_16x16_1x1_16x16x1_16x16x1_1x16x1x16_4_1x1_intrawave_v1,59.45,1887.75,0.0
256,32,7168,256,ck,8,0,3.3934,a8w8_blockscale_1x128x128_256x16x64x256_16x16_16x16_1x1_16x16x1_16x16x1_1x16x1x16_4_1x1_intrawave_v1,34.61,678.36,0.0
256,32,7168,2304,ck,8,0,8.7272,a8w8_blockscale_1x128x128_256x16x64x256_16x16_16x16_1x1_16x16x1_16x16x1_1x16x1x16_4_1x1_intrawave_v1,121.11,1953.38,0.0
256,64,7168,256,ck,13,0,3.7663,a8w8_blockscale_1x128x128_256x32x64x256_16x16_16x16_2x1_16x16x1_16x16x1_1x32x1x8_8_2x1_intrawave_v1,62.36,735.18,0.0
256,64,7168,2304,ck,7,0,9.7262,a8w8_blockscale_1x128x128_256x16x128x256_16x16_16x16_1x2_16x16x1_16x16x1_1x16x1x16_8_1x2_intrawave_v1,217.34,1807.49,0.0
256,128,7168,256,ck,7,0,4.495,a8w8_blockscale_1x128x128_256x16x128x256_16x16_16x16_1x2_16x16x1_16x16x1_1x16x1x16_8_1x2_intrawave_v1,104.51,823.76,0.0
256,128,7168,2304,ck,18,0,10.3294,a8w8_blockscale_1x128x128_256x64x64x256_16x16_32x32_1x1_16x16x1_16x16x1_1x32x1x8_8_1x1_intrawave_v1,409.3,1805.04,0.0
256,256,7168,256,ck,13,0,5.6263,a8w8_blockscale_1x128x128_256x32x64x256_16x16_16x16_2x1_16x16x1_16x16x1_1x32x1x8_8_2x1_intrawave_v1,166.99,990.09,0.0
256,256,7168,2304,ck,18,0,15.5447,a8w8_blockscale_1x128x128_256x64x64x256_16x16_32x32_1x1_16x16x1_16x16x1_1x32x1x8_8_1x1_intrawave_v1,543.96,1336.46,0.0
256,512,7168,256,ck,13,0,7.6578,a8w8_blockscale_1x128x128_256x32x64x256_16x16_16x16_2x1_16x16x1_16x16x1_1x32x1x8_8_2x1_intrawave_v1,245.38,1215.25,0.0
256,512,7168,2304,ck,0,0,21.1565,a8w8_blockscale_1x128x128_256x128x128x128_16x16_32x32_2x2_8x32x1_8x32x1_1x32x1x8_8_1x1_intrawave_v3,799.35,1183.31,0.0
256,1024,7168,256,ck,18,0,11.7764,a8w8_blockscale_1x128x128_256x64x64x256_16x16_32x32_1x1_16x16x1_16x16x1_1x32x1x8_8_1x1_intrawave_v1,319.12,1424.65,0.0
256,1024,7168,2304,ck,0,0,36.7479,a8w8_blockscale_1x128x128_256x128x128x128_16x16_32x32_2x2_8x32x1_8x32x1_1x32x1x8_8_1x1_intrawave_v3,920.4,913.1,0.0
256,1536,7168,256,ck,18,0,15.2456,a8w8_blockscale_1x128x128_256x64x64x256_16x16_32x32_1x1_16x16x1_16x16x1_1x32x1x8_8_1x1_intrawave_v1,369.76,1590.51,0.0
256,1536,7168,2304,ck,0,0,52.7484,a8w8_blockscale_1x128x128_256x128x128x128_16x16_32x32_2x2_8x32x1_8x32x1_1x32x1x8_8_1x1_intrawave_v3,961.82,797.64,0.0
256,2048,7168,256,cktile,10,0,19.6283,a8w8_blockscale_cktile_64x128x128_2x2x1_32x32x16_intrawave_0x0x0x0_1,382.93,1616.0,0.0
256,2048,7168,2304,ck,0,0,70.9389,a8w8_blockscale_1x128x128_256x128x128x128_16x16_32x32_2x2_8x32x1_8x32x1_1x32x1x8_8_1x1_intrawave_v3,953.58,713.2,0.0
256,4096,7168,256,ck,18,0,34.9763,a8w8_blockscale_1x128x128_256x64x64x256_16x16_32x32_1x1_16x16x1_16x16x1_1x32x1x8_8_1x1_intrawave_v1,429.79,1761.3,0.0
256,4096,7168,2304,ck,0,0,125.756,a8w8_blockscale_1x128x128_256x128x128x128_16x16_32x32_2x2_8x32x1_8x32x1_1x32x1x8_8_1x1_intrawave_v3,1075.83,673.31,0.0
256,8192,7168,256,ck,15,0,67.1313,a8w8_blockscale_1x128x128_256x64x128x128_16x16_32x32_2x1_8x32x1_8x32x1_1x32x1x8_8_1x1_intrawave_v1,447.85,1807.99,0.0
256,8192,7168,2304,ck,0,0,238.587,a8w8_blockscale_1x128x128_256x128x128x128_16x16_32x32_2x2_8x32x1_8x32x1_1x32x1x8_8_1x1_intrawave_v3,1134.11,640.56,0.0
256,16384,7168,256,cktile,6,0,122.7395,a8w8_blockscale_cktile_128x128x128_2x2x1_16x16x32_intrawave_0x0x0x0_1,489.9,1962.78,0.0
256,16384,7168,2304,ck,0,0,450.2119,a8w8_blockscale_1x128x128_256x128x128x128_16x16_32x32_2x2_8x32x1_8x32x1_1x32x1x8_8_1x1_intrawave_v3,1202.02,642.24,0.0
256,20480,7168,256,ck,15,0,151.072,a8w8_blockscale_1x128x128_256x64x128x128_16x16_32x32_2x1_8x32x1_8x32x1_1x32x1x8_8_1x1_intrawave_v1,497.52,1990.3,0.0
256,20480,7168,2304,ck,0,0,567.063,a8w8_blockscale_1x128x128_256x128x128x128_16x16_32x32_2x2_8x32x1_8x32x1_1x32x1x8_8_1x1_intrawave_v3,1192.91,630.09,0.0
256,1,8192,3072,ck,8,0,10.991,a8w8_blockscale_1x128x128_256x16x64x256_16x16_16x16_1x1_16x16x1_16x16x1_1x16x1x16_4_1x1_intrawave_v1,4.58,2291.45,0.0
256,2,8192,3072,ck,8,0,11.0207,a8w8_blockscale_1x128x128_256x16x64x256_16x16_16x16_1x1_16x16x1_16x16x1_1x16x1x16_4_1x1_intrawave_v1,9.13,2287.04,0.0
256,4,8192,3072,ck,8,0,11.0602,a8w8_blockscale_1x128x128_256x16x64x256_16x16_16x16_1x1_16x16x1_16x16x1_1x16x1x16_4_1x1_intrawave_v1,18.2,2282.39,0.0
256,8,8192,3072,ck,8,0,11.0476,a8w8_blockscale_1x128x128_256x16x64x256_16x16_16x16_1x1_16x16x1_16x16x1_1x16x1x16_4_1x1_intrawave_v1,36.45,2292.03,0.0
256,16,8192,3072,ck,8,0,10.6535,a8w8_blockscale_1x128x128_256x16x64x256_16x16_16x16_1x1_16x16x1_16x16x1_1x16x1x16_4_1x1_intrawave_v1,75.59,2391.43,0.0
256,24,8192,3072,ck,8,0,11.3004,a8w8_blockscale_1x128x128_256x16x64x256_16x16_16x16_1x1_16x16x1_16x16x1_1x16x1x16_4_1x1_intrawave_v1,106.9,2268.31,0.0
256,32,8192,3072,ck,8,0,10.8656,a8w8_blockscale_1x128x128_256x16x64x256_16x16_16x16_1x1_16x16x1_16x16x1_1x16x1x16_4_1x1_intrawave_v1,148.23,2373.4,0.0
256,40,8192,3072,ck,7,0,13.4878,a8w8_blockscale_1x128x128_256x16x128x256_16x16_16x16_1x2_16x16x1_16x16x1_1x16x1x16_8_1x2_intrawave_v1,149.27,1923.52,0.0
256,48,8192,3072,ck,7,0,13.3766,a8w8_blockscale_1x128x128_256x16x128x256_16x16_16x16_1x2_16x16x1_16x16x1_1x16x1x16_8_1x2_intrawave_v1,180.61,1951.15,0.0
256,56,8192,3072,ck,7,0,13.6679,a8w8_blockscale_1x128x128_256x16x128x256_16x16_16x16_1x2_16x16x1_16x16x1_1x16x1x16_8_1x2_intrawave_v1,206.22,1920.95,0.0
256,64,8192,3072,ck,18,0,13.24,a8w8_blockscale_1x128x128_256x64x64x256_16x16_32x32_1x1_16x16x1_16x16x1_1x32x1x8_8_1x1_intrawave_v1,243.29,1994.79,0.0
256,72,8192,3072,ck,18,0,16.2342,a8w8_blockscale_1x128x128_256x64x64x256_16x16_32x32_1x1_16x16x1_16x16x1_1x32x1x8_8_1x1_intrawave_v1,223.22,1636.46,0.0
256,80,8192,3072,ck,18,0,16.3668,a8w8_blockscale_1x128x128_256x64x64x256_16x16_32x32_1x1_16x16x1_16x16x1_1x32x1x8_8_1x1_intrawave_v1,246.02,1632.71,0.0
256,88,8192,3072,ck,18,0,16.3237,a8w8_blockscale_1x128x128_256x64x64x256_16x16_32x32_1x1_16x16x1_16x16x1_1x32x1x8_8_1x1_intrawave_v1,271.33,1646.56,0.0
256,96,8192,3072,ck,12,0,15.3638,a8w8_blockscale_1x128x128_256x32x128x256_16x16_32x32_1x1_16x16x1_16x16x1_1x32x1x8_8_1x1_intrawave_v1,314.49,1759.56,0.0
256,104,8192,3072,ck,18,0,16.4207,a8w8_blockscale_1x128x128_256x64x64x256_16x16_32x32_1x1_16x16x1_16x16x1_1x32x1x8_8_1x1_intrawave_v1,318.77,1655.79,0.0
256,112,8192,3072,ck,18,0,16.5791,a8w8_blockscale_1x128x128_256x64x64x256_16x16_32x32_1x1_16x16x1_16x16x1_1x32x1x8_8_1x1_intrawave_v1,340.02,1649.36,0.0
256,120,8192,3072,ck,18,0,16.5139,a8w8_blockscale_1x128x128_256x64x64x256_16x16_32x32_1x1_16x16x1_16x16x1_1x32x1x8_8_1x1_intrawave_v1,365.74,1665.3,0.0
256,128,8192,3072,ck,18,0,13.7079,a8w8_blockscale_1x128x128_256x64x64x256_16x16_32x32_1x1_16x16x1_16x16x1_1x32x1x8_8_1x1_intrawave_v1,469.98,2017.54,0.0
256,136,8192,3072,ck,2,0,21.1742,a8w8_blockscale_1x128x128_256x64x128x128_16x16_32x32_1x2_8x32x1_8x32x1_1x32x1x8_8_1x1_intrawave_v3,323.28,1313.48,0.0
256,144,8192,3072,ck,2,0,21.2749,a8w8_blockscale_1x128x128_256x64x128x128_16x16_32x32_1x2_8x32x1_8x32x1_1x32x1x8_8_1x1_intrawave_v3,340.67,1314.58,0.0
256,152,8192,3072,ck,2,0,21.315,a8w8_blockscale_1x128x128_256x64x128x128_16x16_32x32_1x2_8x32x1_8x32x1_1x32x1x8_8_1x1_intrawave_v3,358.92,1319.41,0.0
256,160,8192,3072,ck,2,0,21.3347,a8w8_blockscale_1x128x128_256x64x128x128_16x16_32x32_1x2_8x32x1_8x32x1_1x32x1x8_8_1x1_intrawave_v3,377.46,1325.48,0.0
256,168,8192,3072,ck,2,0,21.5169,a8w8_blockscale_1x128x128_256x64x128x128_16x16_32x32_1x2_8x32x1_8x32x1_1x32x1x8_8_1x1_intrawave_v3,392.98,1321.49,0.0
256,176,8192,3072,ck,2,0,21.5829,a8w8_blockscale_1x128x128_256x64x128x128_16x16_32x32_1x2_8x32x1_8x32x1_1x32x1x8_8_1x1_intrawave_v3,410.43,1324.66,0.0
256,184,8192,3072,ck,2,0,21.6042,a8w8_blockscale_1x128x128_256x64x128x128_16x16_32x32_1x2_8x32x1_8x32x1_1x32x1x8_8_1x1_intrawave_v3,428.67,1330.56,0.0
256,192,8192,3072,ck,2,0,21.4233,a8w8_blockscale_1x128x128_256x64x128x128_16x16_32x32_1x2_8x32x1_8x32x1_1x32x1x8_8_1x1_intrawave_v3,451.08,1349.06,0.0
256,200,8192,3072,ck,2,0,21.4479,a8w8_blockscale_1x128x128_256x64x128x128_16x16_32x32_1x2_8x32x1_8x32x1_1x32x1x8_8_1x1_intrawave_v3,469.34,1354.77,0.0
256,208,8192,3072,ck,2,0,21.4622,a8w8_blockscale_1x128x128_256x64x128x128_16x16_32x32_1x2_8x32x1_8x32x1_1x32x1x8_8_1x1_intrawave_v3,487.79,1361.12,0.0
256,216,8192,3072,ck,2,0,21.6634,a8w8_blockscale_1x128x128_256x64x128x128_16x16_32x32_1x2_8x32x1_8x32x1_1x32x1x8_8_1x1_intrawave_v3,501.84,1355.67,0.0
256,224,8192,3072,ck,2,0,21.6268,a8w8_blockscale_1x128x128_256x64x128x128_16x16_32x32_1x2_8x32x1_8x32x1_1x32x1x8_8_1x1_intrawave_v3,521.31,1365.16,0.0
256,232,8192,3072,ck,2,0,21.6368,a8w8_blockscale_1x128x128_256x64x128x128_16x16_32x32_1x2_8x32x1_8x32x1_1x32x1x8_8_1x1_intrawave_v3,539.68,1371.72,0.0
256,240,8192,3072,ck,2,0,21.7679,a8w8_blockscale_1x128x128_256x64x128x128_16x16_32x32_1x2_8x32x1_8x32x1_1x32x1x8_8_1x1_intrawave_v3,554.93,1370.61,0.0
256,248,8192,3072,ck,2,0,21.7168,a8w8_blockscale_1x128x128_256x64x128x128_16x16_32x32_1x2_8x32x1_8x32x1_1x32x1x8_8_1x1_intrawave_v3,574.77,1381.0,0.0
256,256,8192,3072,ck,2,0,21.591,a8w8_blockscale_1x128x128_256x64x128x128_16x16_32x32_1x2_8x32x1_8x32x1_1x32x1x8_8_1x1_intrawave_v3,596.77,1396.26,0.0
256,272,8192,3072,ck,0,0,26.5316,a8w8_blockscale_1x128x128_256x128x128x128_16x16_32x32_2x2_8x32x1_8x32x1_1x32x1x8_8_1x1_intrawave_v3,516.0,1147.98,0.0
256,288,8192,3072,ck,0,0,26.7611,a8w8_blockscale_1x128x128_256x128x128x128_16x16_32x32_2x2_8x32x1_8x32x1_1x32x1x8_8_1x1_intrawave_v3,541.66,1149.77,0.0
256,304,8192,3072,ck,0,0,27.0712,a8w8_blockscale_1x128x128_256x128x128x128_16x16_32x32_2x2_8x32x1_8x32x1_1x32x1x8_8_1x1_intrawave_v3,565.21,1148.1,0.0
256,320,8192,3072,ck,0,0,27.3316,a8w8_blockscale_1x128x128_256x128x128x128_16x16_32x32_2x2_8x32x1_8x32x1_1x32x1x8_8_1x1_intrawave_v3,589.29,1148.55,0.0
256,336,8192,3072,ck,0,0,27.6341,a8w8_blockscale_1x128x128_256x128x128x128_16x16_32x32_2x2_8x32x1_8x32x1_1x32x1x8_8_1x1_intrawave_v3,611.98,1147.24,0.0
256,352,8192,3072,ck,0,0,27.7661,a8w8_blockscale_1x128x128_256x128x128x128_16x16_32x32_2x2_8x32x1_8x32x1_1x32x1x8_8_1x1_intrawave_v3,638.07,1153.0,0.0
256,368,8192,3072,ck,0,0,28.1451,a8w8_blockscale_1x128x128_256x128x128x128_16x16_32x32_2x2_8x32x1_8x32x1_1x32x1x8_8_1x1_intrawave_v3,658.09,1148.53,0.0
256,384,8192,3072,ck,0,0,27.2872,a8w8_blockscale_1x128x128_256x128x128x128_16x16_32x32_2x2_8x32x1_8x32x1_1x32x1x8_8_1x1_intrawave_v3,708.29,1196.05,0.0
256,400,8192,3072,ck,0,0,27.6188,a8w8_blockscale_1x128x128_256x128x128x128_16x16_32x32_2x2_8x32x1_8x32x1_1x32x1x8_8_1x1_intrawave_v3,728.95,1192.96,0.0
256,416,8192,3072,ck,0,0,27.7838,a8w8_blockscale_1x128x128_256x128x128x128_16x16_32x32_2x2_8x32x1_8x32x1_1x32x1x8_8_1x1_intrawave_v3,753.6,1197.08,0.0
256,432,8192,3072,ck,0,0,28.4405,a8w8_blockscale_1x128x128_256x128x128x128_16x16_32x32_2x2_8x32x1_8x32x1_1x32x1x8_8_1x1_intrawave_v3,764.52,1180.39,0.0
256,448,8192,3072,ck,0,0,28.189,a8w8_blockscale_1x128x128_256x128x128x128_16x16_32x32_2x2_8x32x1_8x32x1_1x32x1x8_8_1x1_intrawave_v3,799.91,1201.96,0.0
256,464,8192,3072,ck,0,0,28.4828,a8w8_blockscale_1x128x128_256x128x128x128_16x16_32x32_2x2_8x32x1_8x32x1_1x32x1x8_8_1x1_intrawave_v3,819.93,1200.49,0.0
256,480,8192,3072,ck,0,0,28.575,a8w8_blockscale_1x128x128_256x128x128x128_16x16_32x32_2x2_8x32x1_8x32x1_1x32x1x8_8_1x1_intrawave_v3,845.47,1207.51,0.0
256,496,8192,3072,ck,0,0,29.5226,a8w8_blockscale_1x128x128_256x128x128x128_16x16_32x32_2x2_8x32x1_8x32x1_1x32x1x8_8_1x1_intrawave_v3,845.61,1179.3,0.0
256,512,8192,3072,ck,0,0,28.1133,a8w8_blockscale_1x128x128_256x128x128x128_16x16_32x32_2x2_8x32x1_8x32x1_1x32x1x8_8_1x1_intrawave_v3,916.64,1249.49,0.0
256,1000,8192,3072,ck,0,0,48.8794,a8w8_blockscale_1x128x128_256x128x128x128_16x16_32x32_2x2_8x32x1_8x32x1_1x32x1x8_8_1x1_intrawave_v3,1029.71,912.9,0.0
256,1001,8192,3072,ck,0,0,48.2658,a8w8_blockscale_1x128x128_256x128x128x128_16x16_32x32_2x2_8x32x1_8x32x1_1x32x1x8_8_1x1_intrawave_v3,1043.84,924.91,0.0
256,1169,8192,3072,cktile,11,0,51.1867,a8w8_blockscale_cktile_128x128x128_2x2x1_32x32x16_intrawave_0x0x0x0_1,1149.47,935.98,0.0
256,1192,8192,3072,cktile,11,0,51.5069,a8w8_blockscale_cktile_128x128x128_2x2x1_32x32x16_intrawave_0x0x0x0_1,1164.8,938.85,0.0
256,1200,8192,3072,cktile,11,0,51.6447,a8w8_blockscale_cktile_128x128x128_2x2x1_32x32x16_intrawave_0x0x0x0_1,1169.49,939.36,0.0
256,1202,8192,3072,cktile,11,0,51.8986,a8w8_blockscale_cktile_128x128x128_2x2x1_32x32x16_intrawave_0x0x0x0_1,1165.71,935.52,0.0
256,1205,8192,3072,cktile,11,0,51.3251,a8w8_blockscale_cktile_128x128x128_2x2x1_32x32x16_intrawave_0x0x0x0_1,1181.68,947.11,0.0
256,1216,8192,3072,cktile,11,0,51.2526,a8w8_blockscale_cktile_128x128x128_2x2x1_32x32x16_intrawave_0x0x0x0_1,1194.15,952.62,0.0
256,1263,8192,3072,cktile,11,0,51.3146,a8w8_blockscale_cktile_128x128x128_2x2x1_32x32x16_intrawave_0x0x0x0_1,1238.81,969.29,0.0
256,2197,8192,3072,cktile,11,0,95.0392,a8w8_blockscale_cktile_128x128x128_2x2x1_32x32x16_intrawave_0x0x0x0_1,1163.51,714.55,0.0
256,2200,8192,3072,cktile,11,0,95.0804,a8w8_blockscale_cktile_128x128x128_2x2x1_32x32x16_intrawave_0x0x0x0_1,1164.59,714.86,0.0
256,2202,8192,3072,cktile,11,0,95.2523,a8w8_blockscale_cktile_128x128x128_2x2x1_32x32x16_intrawave_0x0x0x0_1,1163.54,713.98,0.0
256,2204,8192,3072,cktile,11,0,95.2013,a8w8_blockscale_cktile_128x128x128_2x2x1_32x32x16_intrawave_0x0x0x0_1,1165.23,714.77,0.0
256,2216,8192,3072,cktile,11,0,95.0074,a8w8_blockscale_cktile_128x128x128_2x2x1_32x32x16_intrawave_0x0x0x0_1,1173.96,718.68,0.0
256,2230,8192,3072,cktile,11,0,95.2354,a8w8_blockscale_cktile_128x128x128_2x2x1_32x32x16_intrawave_0x0x0x0_1,1178.55,719.82,0.0
256,3201,8192,3072,cktile,11,0,137.7215,a8w8_blockscale_cktile_128x128x128_2x2x1_32x32x16_intrawave_0x0x0x0_1,1169.84,634.94,0.0
256,3225,8192,3072,cktile,11,0,139.1649,a8w8_blockscale_cktile_128x128x128_2x2x1_32x32x16_intrawave_0x0x0x0_1,1166.38,631.71,0.0
256,3227,8192,3072,cktile,11,0,139.3757,a8w8_blockscale_cktile_128x128x128_2x2x1_32x32x16_intrawave_0x0x0x0_1,1165.34,631.03,0.0
256,3242,8192,3072,cktile,11,0,139.7175,a8w8_blockscale_cktile_128x128x128_2x2x1_32x32x16_intrawave_0x0x0x0_1,1167.89,631.58,0.0
256,4000,8192,3072,cktile,11,0,141.8453,a8w8_blockscale_cktile_128x128x128_2x2x1_32x32x16_intrawave_0x0x0x0_1,1419.34,726.07,0.0
256,4197,8192,3072,cktile,11,0,142.1637,a8w8_blockscale_cktile_128x128x128_2x2x1_32x32x16_intrawave_0x0x0x0_1,1485.91,751.41,0.0
256,4219,8192,3072,cktile,11,0,142.3923,a8w8_blockscale_cktile_128x128x128_2x2x1_32x32x16_intrawave_0x0x0x0_1,1491.3,753.21,0.0
256,4223,8192,3072,cktile,11,0,142.9,a8w8_blockscale_cktile_128x128x128_2x2x1_32x32x16_intrawave_0x0x0x0_1,1487.41,751.07,0.0
256,4250,8192,3072,cktile,11,0,142.8257,a8w8_blockscale_cktile_128x128x128_2x2x1_32x32x16_intrawave_0x0x0x0_1,1497.7,755.14,0.0
256,5197,8192,3072,cktile,11,0,186.1983,a8w8_blockscale_cktile_128x128x128_2x2x1_32x32x16_intrawave_0x0x0x0_1,1404.81,678.19,0.0
256,6792,8192,3072,cktile,11,0,231.992,a8w8_blockscale_cktile_128x128x128_2x2x1_32x32x16_intrawave_0x0x0x0_1,1473.55,678.09,0.0
256,6830,8192,3072,cktile,11,0,232.4616,a8w8_blockscale_cktile_128x128x128_2x2x1_32x32x16_intrawave_0x0x0x0_1,1478.8,679.9,0.0
256,7001,8192,3072,cktile,11,0,233.9703,a8w8_blockscale_cktile_128x128x128_2x2x1_32x32x16_intrawave_0x0x0x0_1,1506.05,689.73,0.0
256,7787,8192,3072,cktile,11,0,274.5373,a8w8_blockscale_cktile_128x128x128_2x2x1_32x32x16_intrawave_0x0x0x0_1,1427.61,643.52,0.0
256,11636,8192,3072,cktile,11,0,372.6112,a8w8_blockscale_cktile_128x128x128_2x2x1_32x32x16_intrawave_0x0x0x0_1,1571.77,675.12,0.0
256,30743,8192,3072,cktile,11,0,960.3433,a8w8_blockscale_cktile_128x128x128_2x2x1_32x32x16_intrawave_0x0x0x0_1,1611.24,649.04,0.0
256,31097,8192,3072,cktile,11,0,968.8765,a8w8_blockscale_cktile_128x128x128_2x2x1_32x32x16_intrawave_0x0x0x0_1,1615.44,650.43,0.0
256,32065,8192,3072,cktile,11,0,974.0937,a8w8_blockscale_cktile_128x128x128_2x2x1_32x32x16_intrawave_0x0x0x0_1,1656.81,666.28,0.0
256,35092,8192,3072,cktile,11,0,1067.2538,a8w8_blockscale_cktile_128x128x128_2x2x1_32x32x16_intrawave_0x0x0x0_1,1654.94,663.31,0.0
256,39088,8192,3072,cktile,11,0,1203.6909,a8w8_blockscale_cktile_128x128x128_2x2x1_32x32x16_intrawave_0x0x0x0_1,1634.44,652.71,0.0
256,42723,8192,3072,cktile,11,0,1297.3613,a8w8_blockscale_cktile_128x128x128_2x2x1_32x32x16_intrawave_0x0x0x0_1,1657.46,660.1,0.0
256,48310,8192,3072,cktile,11,0,1483.1953,a8w8_blockscale_cktile_128x128x128_2x2x1_32x32x16_intrawave_0x0x0x0_1,1639.38,650.68,0.0
256,55349,8192,3072,cktile,11,0,1704.0131,a8w8_blockscale_cktile_128x128x128_2x2x1_32x32x16_intrawave_0x0x0x0_1,1634.85,646.73,0.0
256,57008,8192,3072,cktile,11,0,1757.0083,a8w8_blockscale_cktile_128x128x128_2x2x1_32x32x16_intrawave_0x0x0x0_1,1633.06,645.59,0.0
256,64564,8192,3072,cktile,11,0,1982.7219,a8w8_blockscale_cktile_128x128x128_2x2x1_32x32x16_intrawave_0x0x0x0_1,1638.97,646.24,0.0
256,65536,8192,3072,cktile,11,0,1989.2861,a8w8_blockscale_cktile_128x128x128_2x2x1_32x32x16_intrawave_0x0x0x0_1,1658.15,653.62,0.0
