aiter/configs/a8w8_blockscale_bpreshuffle_tuned_gemm.csv
gfx,cu_num,M,N,K,libtype,kernelId,splitK,us,kernelName,tflops,bw,errRatio
gfx950,256,16,512,7168,asm,6,7,7.9691,_ZN5aiter42fp8gemm_bf16_blockscale_BpreShuffle_32x128E,14.74,476.98,0.0029
gfx950,256,32,512,7168,asm,22,7,9.1625,_ZN5aiter42fp8gemm_bf16_blockscale_BpreShuffle_64x128E,25.64,429.16,0.0033
gfx950,256,64,512,7168,asm,15,8,8.5433,_ZN5aiter42fp8gemm_bf16_blockscale_BpreShuffle_48x128E,54.99,490.95,0.0078
gfx950,256,128,512,7168,asm,23,8,9.7489,_ZN5aiter42fp8gemm_bf16_blockscale_BpreShuffle_64x128E,96.37,484.01,0.0139
gfx950,256,256,512,7168,asm,6,7,9.7151,_ZN5aiter42fp8gemm_bf16_blockscale_BpreShuffle_32x128E,193.42,593.63,0.0036
gfx950,256,512,512,7168,asm,23,8,11.511,_ZN5aiter42fp8gemm_bf16_blockscale_BpreShuffle_64x128E,326.48,683.2,0.009
gfx950,256,1024,512,7168,asm,27,4,15.6429,_ZN5aiter42fp8gemm_bf16_blockscale_BpreShuffle_80x128E,480.49,770.87,0.0012
gfx950,256,1536,512,7168,asm,35,4,18.8821,_ZN5aiter42fp8gemm_bf16_blockscale_BpreShuffle_96x128E,597.09,860.76,0.0022
gfx950,256,2048,512,7168,ck,17,3,21.5224,a8w8_blockscale_bpreshuffle_1x128x128_256x64x64x256_16x16_16x16_16x16x1_16x16x1_1x32x1x8_8_2x1_intrawave_v1,698.45,950.04,0.0
gfx950,256,4096,512,7168,asm,16,1,32.8452,_ZN5aiter42fp8gemm_bf16_blockscale_BpreShuffle_64x128E,915.35,1133.33,0.0
gfx950,256,8192,512,7168,asm,40,1,47.2238,_ZN5aiter43fp8gemm_bf16_blockscale_BpreShuffle_128x128E,1273.29,1498.8,0.0
gfx950,256,16384,512,7168,ck,13,2,81.4869,a8w8_blockscale_bpreshuffle_1x128x128_256x64x256x128_16x16_16x16_8x32x1_8x32x1_1x32x1x8_8_2x1_intrawave_v1,1475.81,1692.15,0.0
gfx950,256,20480,512,7168,ck,13,2,111.424,a8w8_blockscale_bpreshuffle_1x128x128_256x64x256x128_16x16_16x16_8x32x1_8x32x1_1x32x1x8_8_2x1_intrawave_v1,1349.12,1538.65,0.0
gfx950,256,16,576,7168,ck,7,0,17.6513,a8w8_blockscale_bpreshuffle_1x128x128_256x16x64x256_16x16_16x16_16x16x1_16x16x1_1x16x1x16_4_1x1_intrawave_v1,7.49,241.45,0.0
gfx950,256,32,576,7168,ck,7,3,17.088,a8w8_blockscale_bpreshuffle_1x128x128_256x16x64x256_16x16_16x16_16x16x1_16x16x1_1x16x1x16_4_1x1_intrawave_v1,15.46,257.2,0.0
gfx950,256,64,576,7168,ck,7,2,17.5138,a8w8_blockscale_bpreshuffle_1x128x128_256x16x64x256_16x16_16x16_16x16x1_16x16x1_1x16x1x16_4_1x1_intrawave_v1,30.18,266.15,0.0
gfx950,256,128,576,7168,ck,7,3,16.4658,a8w8_blockscale_bpreshuffle_1x128x128_256x16x64x256_16x16_16x16_16x16x1_16x16x1_1x16x1x16_4_1x1_intrawave_v1,64.19,315.43,0.0
gfx950,256,256,576,7168,ck,7,2,16.9154,a8w8_blockscale_bpreshuffle_1x128x128_256x16x64x256_16x16_16x16_16x16x1_16x16x1_1x16x1x16_4_1x1_intrawave_v1,124.97,370.0,0.0
gfx950,256,512,576,7168,ck,12,3,18.0012,a8w8_blockscale_bpreshuffle_1x128x128_256x32x64x256_16x16_16x16_16x16x1_16x16x1_1x32x1x8_8_2x1_intrawave_v1,234.87,466.0,0.0
gfx950,256,1024,576,7168,ck,17,3,20.7538,a8w8_blockscale_bpreshuffle_1x128x128_256x64x64x256_16x16_16x16_16x16x1_16x16x1_1x32x1x8_8_2x1_intrawave_v1,407.43,609.45,0.0
gfx950,256,1536,576,7168,ck,17,2,21.2038,a8w8_blockscale_bpreshuffle_1x128x128_256x64x64x256_16x16_16x16_16x16x1_16x16x1_1x32x1x8_8_2x1_intrawave_v1,598.17,797.42,0.0
gfx950,256,2048,576,7168,ck,12,3,31.2412,a8w8_blockscale_bpreshuffle_1x128x128_256x32x64x256_16x16_16x16_16x16x1_16x16x1_1x32x1x8_8_2x1_intrawave_v1,541.32,677.57,0.0
gfx950,256,4096,576,7168,ck,15,0,43.7737,a8w8_blockscale_bpreshuffle_1x128x128_256x64x64x128_16x16_16x16_8x32x1_8x32x1_1x32x1x8_8_2x1_intrawave_v1,772.68,872.84,0.004
gfx950,256,8192,576,7168,ck,15,1,75.2384,a8w8_blockscale_bpreshuffle_1x128x128_256x64x64x128_16x16_16x16_8x32x1_8x32x1_1x32x1x8_8_2x1_intrawave_v1,899.09,960.76,0.0074
gfx950,256,16384,576,7168,ck,15,0,135.1229,a8w8_blockscale_bpreshuffle_1x128x128_256x64x64x128_16x16_16x16_8x32x1_8x32x1_1x32x1x8_8_2x1_intrawave_v1,1001.25,1039.38,0.0088
gfx950,256,20480,576,7168,ck,15,2,164.23,a8w8_blockscale_bpreshuffle_1x128x128_256x64x64x128_16x16_16x16_8x32x1_8x32x1_1x32x1x8_8_2x1_intrawave_v1,1029.74,1062.67,0.0089
gfx950,256,16,1536,7168,asm,15,8,8.9852,_ZN5aiter42fp8gemm_bf16_blockscale_BpreShuffle_48x128E,39.21,1243.59,0.0081
gfx950,256,32,1536,7168,asm,15,8,8.8914,_ZN5aiter42fp8gemm_bf16_blockscale_BpreShuffle_48x128E,79.25,1275.13,0.0089
gfx950,256,64,1536,7168,asm,15,8,9.5956,_ZN5aiter42fp8gemm_bf16_blockscale_BpreShuffle_48x128E,146.87,1215.7,0.0072
gfx950,256,128,1536,7168,asm,23,8,10.3811,_ZN5aiter42fp8gemm_bf16_blockscale_BpreShuffle_64x128E,271.51,1186.85,0.0094
gfx950,256,256,1536,7168,asm,20,5,13.4798,_ZN5aiter42fp8gemm_bf16_blockscale_BpreShuffle_64x128E,418.19,1011.25,0.0018
gfx950,256,512,1536,7168,asm,26,3,18.7023,_ZN5aiter42fp8gemm_bf16_blockscale_BpreShuffle_80x128E,602.83,869.03,0.0004
gfx950,256,1024,1536,7168,asm,16,1,30.4337,_ZN5aiter42fp8gemm_bf16_blockscale_BpreShuffle_64x128E,740.91,706.32,0.0
gfx950,256,1536,1536,7168,asm,24,1,33.7784,_ZN5aiter42fp8gemm_bf16_blockscale_BpreShuffle_80x128E,1001.32,791.59,0.0
gfx950,256,2048,1536,7168,ck,14,0,45.9207,a8w8_blockscale_bpreshuffle_1x128x128_256x64x128x128_16x16_16x16_8x32x1_8x32x1_1x32x1x8_8_2x1_intrawave_v1,982.07,696.45,0.0001
gfx950,256,4096,1536,7168,ck,14,3,69.9692,a8w8_blockscale_bpreshuffle_1x128x128_256x64x128x128_16x16_16x16_8x32x1_8x32x1_1x32x1x8_8_2x1_intrawave_v1,1289.06,756.81,0.0001
gfx950,256,8192,1536,7168,ck,13,1,115.7144,a8w8_blockscale_bpreshuffle_1x128x128_256x64x256x128_16x16_16x16_8x32x1_8x32x1_1x32x1x8_8_2x1_intrawave_v1,1558.91,820.09,0.0
gfx950,256,16384,1536,7168,ck,13,3,210.0224,a8w8_blockscale_bpreshuffle_1x128x128_256x64x256x128_16x16_16x16_8x32x1_8x32x1_1x32x1x8_8_2x1_intrawave_v1,1717.8,851.25,0.0
gfx950,256,20480,1536,7168,ck,13,1,262.5612,a8w8_blockscale_bpreshuffle_1x128x128_256x64x256x128_16x16_16x16_8x32x1_8x32x1_1x32x1x8_8_2x1_intrawave_v1,1717.59,840.66,0.0
gfx950,256,20480,3072,1536,ck,13,2,135.0665,a8w8_blockscale_bpreshuffle_1x128x128_256x64x256x128_16x16_16x16_8x32x1_8x32x1_1x32x1x8_8_2x1_intrawave_v1,1430.95,1199.45,0.0
gfx950,256,128,4096,1280,ck,6,3,6.4459,a8w8_blockscale_bpreshuffle_1x128x128_256x16x128x256_16x16_16x16_16x16x1_16x16x1_1x16x1x16_8_1x2_intrawave_v1,208.22,1001.46,0.0
gfx950,256,20480,4096,512,ck,16,0,91.452,a8w8_blockscale_bpreshuffle_1x128x128_256x64x128x256_16x16_16x16_16x16x1_16x16x1_1x32x1x8_8_2x1_intrawave_v1,939.28,1972.13,0.0
gfx950,256,20480,4608,7168,ck,13,3,706.1114,a8w8_blockscale_bpreshuffle_1x128x128_256x64x256x128_16x16_16x16_8x32x1_8x32x1_1x32x1x8_8_2x1_intrawave_v1,1916.01,521.98,0.0
gfx950,256,16,7168,256,ck,5,3,2.9065,a8w8_blockscale_bpreshuffle_1x128x128_256x16x64x128_8x16_16x16_16x16x1_8x32x1_1x16x1x16_4_1x1_intrawave_v1,20.2,711.67,0.0
gfx950,256,32,7168,256,ck,10,3,3.1777,a8w8_blockscale_bpreshuffle_1x128x128_256x32x64x128_16x16_16x16_8x32x1_8x32x1_1x32x1x8_8_2x1_intrawave_v1,36.96,724.41,0.0
gfx950,256,64,7168,256,ck,12,3,3.5803,a8w8_blockscale_bpreshuffle_1x128x128_256x32x64x256_16x16_16x16_16x16x1_16x16x1_1x32x1x8_8_2x1_intrawave_v1,65.6,773.37,0.0
gfx950,256,128,7168,256,ck,7,3,4.1898,a8w8_blockscale_bpreshuffle_1x128x128_256x16x64x256_16x16_16x16_16x16x1_16x16x1_1x16x1x16_4_1x1_intrawave_v1,112.12,883.76,0.0
gfx950,256,256,7168,256,ck,12,1,5.127,a8w8_blockscale_bpreshuffle_1x128x128_256x32x64x256_16x16_16x16_16x16x1_16x16x1_1x32x1x8_8_2x1_intrawave_v1,183.25,1086.51,0.0
gfx950,256,512,7168,256,ck,12,1,6.7969,a8w8_blockscale_bpreshuffle_1x128x128_256x32x64x256_16x16_16x16_16x16x1_16x16x1_1x32x1x8_8_2x1_intrawave_v1,276.46,1369.17,0.0
gfx950,256,1024,7168,256,ck,9,3,9.8023,a8w8_blockscale_bpreshuffle_1x128x128_256x32x128x128_16x16_16x16_8x32x1_8x32x1_1x32x1x8_8_2x1_intrawave_v1,383.39,1711.56,0.0
gfx950,256,1536,7168,256,ck,9,3,12.8461,a8w8_blockscale_bpreshuffle_1x128x128_256x32x128x128_16x16_16x16_8x32x1_8x32x1_1x32x1x8_8_2x1_intrawave_v1,438.82,1887.6,0.0
gfx950,256,2048,7168,256,ck,8,2,15.6196,a8w8_blockscale_bpreshuffle_1x128x128_256x32x256x128_16x16_16x16_8x32x1_8x32x1_1x32x1x8_8_2x1_intrawave_v1,481.2,2030.74,0.0
gfx950,256,4096,7168,256,ck,9,1,26.2565,a8w8_blockscale_bpreshuffle_1x128x128_256x32x128x128_16x16_16x16_8x32x1_8x32x1_1x32x1x8_8_2x1_intrawave_v1,572.52,2346.23,0.0
gfx950,256,8192,7168,256,ck,16,2,47.1578,a8w8_blockscale_bpreshuffle_1x128x128_256x64x128x256_16x16_16x16_16x16x1_16x16x1_1x32x1x8_8_2x1_intrawave_v1,637.54,2573.76,0.0
gfx950,256,16384,7168,256,ck,16,1,85.2357,a8w8_blockscale_bpreshuffle_1x128x128_256x64x128x256_16x16_16x16_16x16x1_16x16x1_1x32x1x8_8_2x1_intrawave_v1,705.45,2826.4,0.0
gfx950,256,20480,7168,256,ck,16,0,104.9379,a8w8_blockscale_bpreshuffle_1x128x128_256x64x128x256_16x16_16x16_16x16x1_16x16x1_1x32x1x8_8_2x1_intrawave_v1,716.25,2865.31,0.0
gfx950,256,20480,7168,2048,ck,13,0,362.869,a8w8_blockscale_bpreshuffle_1x128x128_256x64x256x128_16x16_16x16_8x32x1_8x32x1_1x32x1x8_8_2x1_intrawave_v1,1657.06,965.15,0.0
gfx950,256,20480,7168,2304,ck,13,2,395.8895,a8w8_blockscale_bpreshuffle_1x128x128_256x64x256x128_16x16_16x16_8x32x1_8x32x1_1x32x1x8_8_2x1_intrawave_v1,1708.7,902.53,0.0
gfx1250,256,16,1536,4096,flydsl,7,1,4.6663,flydsl_blockscale_bpreshuffle_wmma_t16x32x1024_mw1_nw2_nb4_sk1_cm1_cn1,43.14,1372.85,0.0
gfx1250,256,32,1536,4096,flydsl,7,1,4.6347,flydsl_blockscale_bpreshuffle_wmma_t16x32x1024_mw1_nw2_nb4_sk1_cm1_cn1,86.88,1406.96,0.0
gfx1250,256,64,1536,4096,flydsl,68,1,4.8581,flydsl_blockscale_bpreshuffle_wmma_t32x32x1024_mw2_nw2_nb3_sk1_cm1_cn1,165.77,1389.47,0.0
gfx1250,256,128,1536,4096,flydsl,53,1,5.9931,flydsl_blockscale_bpreshuffle_wmma_t32x32x1024_mw2_nw2_nb4_sk1_cm1_cn1,268.74,1202.88,0.0
gfx1250,256,256,1536,4096,flydsl,125,1,7.5286,flydsl_blockscale_bpreshuffle_wmma_t64x32x512_mw4_nw1_nb4_sk1_cm1_cn1,427.87,1079.41,0.0
gfx1250,256,512,1536,4096,flydsl,401,1,9.9151,flydsl_blockscale_bpreshuffle_wmma_t256x256x128_mw2_nw2_nb3_sk1_cm1_cn1,649.76,1004.68,0.0
gfx1250,256,1024,1536,4096,flydsl,401,1,9.7481,flydsl_blockscale_bpreshuffle_wmma_t256x256x128_mw2_nw2_nb3_sk1_cm1_cn1,1321.79,1398.37,0.0
gfx1250,256,2048,1536,4096,flydsl,401,1,13.2747,flydsl_blockscale_bpreshuffle_wmma_t256x256x128_mw2_nw2_nb3_sk1_cm1_cn1,1941.27,1579.81,0.0
gfx1250,256,4096,1536,4096,flydsl,401,1,16.5072,flydsl_blockscale_bpreshuffle_wmma_t256x256x128_mw2_nw2_nb3_sk1_cm1_cn1,3122.25,2159.76,0.0
gfx1250,256,8192,1536,4096,flydsl,401,1,26.022,flydsl_blockscale_bpreshuffle_wmma_t256x256x128_mw2_nw2_nb3_sk1_cm1_cn1,3961.23,2498.34,0.0
gfx1250,256,16384,1536,4096,flydsl,401,1,53.2465,flydsl_blockscale_bpreshuffle_wmma_t256x256x128_mw2_nw2_nb3_sk1_cm1_cn1,3871.77,2323.76,0.0
gfx1250,256,32768,1536,4096,flydsl,401,1,99.0265,flydsl_blockscale_bpreshuffle_wmma_t256x256x128_mw2_nw2_nb3_sk1_cm1_cn1,4163.7,2435.43,0.0
gfx1250,256,16,8192,1024,flydsl,6,1,3.8571,flydsl_blockscale_bpreshuffle_wmma_t16x32x512_mw1_nw2_nb2_sk1_cm1_cn1,69.6,2247.06,0.0
gfx1250,256,32,8192,1024,flydsl,83,1,3.9317,flydsl_blockscale_bpreshuffle_wmma_t32x32x512_mw2_nw2_nb2_sk1_cm1_cn1,136.55,2275.27,0.0
gfx1250,256,64,8192,1024,flydsl,204,1,4.4178,flydsl_blockscale_bpreshuffle_wmma_t64x32x512_mw4_nw1_nb2_sk1_cm1_cn1,243.05,2151.01,0.0
gfx1250,256,128,8192,1024,flydsl,217,1,4.959,flydsl_blockscale_bpreshuffle_wmma_t64x64x256_mw2_nw2_nb3_sk1_cm1_cn1,433.05,2140.92,0.0
gfx1250,256,256,8192,1024,flydsl,239,1,5.5279,flydsl_blockscale_bpreshuffle_wmma_t64x128x256_mw2_nw2_nb3_sk1_cm1_cn1,776.96,2323.68,0.0
gfx1250,256,512,8192,1024,flydsl,68,1,6.5392,flydsl_blockscale_bpreshuffle_wmma_t256x256x256_mw2_nw2_nb2_sk1_cm1_cn1,1313.61,2645.81,0.0
gfx1250,256,1024,8192,1024,flydsl,68,1,7.7965,flydsl_blockscale_bpreshuffle_wmma_t256x256x256_mw2_nw2_nb2_sk1_cm1_cn1,2203.54,3362.33,0.0
gfx1250,256,2048,8192,1024,flydsl,68,1,11.195,flydsl_blockscale_bpreshuffle_wmma_t256x256x256_mw2_nw2_nb2_sk1_cm1_cn1,3069.2,3933.92,0.0
gfx1250,256,4096,8192,1024,flydsl,68,1,19.4469,flydsl_blockscale_bpreshuffle_wmma_t256x256x256_mw2_nw2_nb2_sk1_cm1_cn1,3533.7,4097.92,0.0
gfx1250,256,8192,8192,1024,flydsl,68,1,39.7613,flydsl_blockscale_bpreshuffle_wmma_t256x256x256_mw2_nw2_nb2_sk1_cm1_cn1,3456.6,3797.54,0.0
gfx1250,256,16384,8192,1024,flydsl,68,1,82.6918,flydsl_blockscale_bpreshuffle_wmma_t256x256x256_mw2_nw2_nb2_sk1_cm1_cn1,3324.13,3550.55,0.0
gfx1250,256,32768,8192,1024,flydsl,68,1,158.1093,flydsl_blockscale_bpreshuffle_wmma_t256x256x256_mw2_nw2_nb2_sk1_cm1_cn1,3477.06,3660.85,0.0
gfx1250,256,16,32768,1024,flydsl,12,1,5.6385,flydsl_blockscale_bpreshuffle_wmma_t16x128x512_mw1_nw4_nb2_sk1_cm1_cn1,190.43,6139.82,0.0
gfx1250,256,32,32768,1024,flydsl,33,1,5.9593,flydsl_blockscale_bpreshuffle_wmma_t32x128x512_mw2_nw2_nb2_sk1_cm1_cn1,360.36,5988.01,0.0
gfx1250,256,64,32768,1024,flydsl,52,1,5.9207,flydsl_blockscale_bpreshuffle_wmma_t64x128x512_mw1_nw4_nb2_sk1_cm1_cn1,725.42,6386.79,0.0
gfx1250,256,128,32768,1024,flydsl,68,1,6.7286,flydsl_blockscale_bpreshuffle_wmma_t128x128x512_mw2_nw2_nb2_sk1_cm1_cn1,1276.63,6253.03,0.0
gfx1250,256,256,32768,1024,flydsl,68,1,11.8583,flydsl_blockscale_bpreshuffle_wmma_t128x128x512_mw2_nw2_nb2_sk1_cm1_cn1,1448.76,4266.53,0.0
gfx1250,256,512,32768,1024,flydsl,240,1,21.1117,flydsl_blockscale_bpreshuffle_wmma_t256x256x128_mw2_nw2_nb3_sk1_cm1_cn1,1627.52,3203.59,0.0
gfx1250,256,1024,32768,1024,flydsl,240,1,39.0765,flydsl_blockscale_bpreshuffle_wmma_t256x256x128_mw2_nw2_nb3_sk1_cm1_cn1,1758.59,2602.89,0.0
gfx1250,256,2048,32768,1024,flydsl,240,1,54.7002,flydsl_blockscale_bpreshuffle_wmma_t256x256x128_mw2_nw2_nb3_sk1_cm1_cn1,2512.59,3105.46,0.0
gfx1250,256,4096,32768,1024,flydsl,240,1,89.9499,flydsl_blockscale_bpreshuffle_wmma_t256x256x128_mw2_nw2_nb3_sk1_cm1_cn1,3055.9,3403.94,0.0
gfx1250,256,8192,32768,1024,flydsl,240,1,168.6879,flydsl_blockscale_bpreshuffle_wmma_t256x256x128_mw2_nw2_nb3_sk1_cm1_cn1,3259.01,3431.27,0.0
gfx1250,256,16384,32768,1024,flydsl,240,1,331.671,flydsl_blockscale_bpreshuffle_wmma_t256x256x128_mw2_nw2_nb3_sk1_cm1_cn1,3315.07,3389.12,0.0
gfx1250,256,32768,32768,1024,flydsl,240,1,664.9429,flydsl_blockscale_bpreshuffle_wmma_t256x256x128_mw2_nw2_nb3_sk1_cm1_cn1,3307.09,3330.5,0.0
gfx1250,256,16,4096,8192,flydsl,11,1,7.5142,flydsl_blockscale_bpreshuffle_wmma_t16x32x1024_mw1_nw2_nb4_sk1_cm1_cn1,142.9,4500.36,0.0
gfx1250,256,32,4096,8192,flydsl,87,1,7.2384,flydsl_blockscale_bpreshuffle_wmma_t32x32x1024_mw2_nw2_nb3_sk1_cm1_cn1,296.68,4708.05,0.0
gfx1250,256,64,4096,8192,flydsl,148,1,8.3039,flydsl_blockscale_bpreshuffle_wmma_t32x64x1024_mw2_nw2_nb3_sk1_cm1_cn1,517.22,4167.08,0.0
gfx1250,256,128,4096,8192,flydsl,121,1,10.4591,flydsl_blockscale_bpreshuffle_wmma_t32x64x1024_mw2_nw2_nb3_sk1_cm1_cn1,821.29,3408.67,0.0
gfx1250,256,256,4096,8192,flydsl,320,1,14.6544,flydsl_blockscale_bpreshuffle_wmma_t128x64x512_mw2_nw2_nb3_sk1_cm1_cn1,1172.34,2575.93,0.0
gfx1250,256,512,4096,8192,flydsl,401,1,21.2625,flydsl_blockscale_bpreshuffle_wmma_t256x256x128_mw2_nw2_nb3_sk1_cm1_cn1,1615.98,1972.63,0.0
gfx1250,256,1024,4096,8192,flydsl,401,1,25.3082,flydsl_blockscale_bpreshuffle_wmma_t256x256x128_mw2_nw2_nb3_sk1_cm1_cn1,2715.3,1988.75,0.0
gfx1250,256,2048,4096,8192,flydsl,401,1,33.6236,flydsl_blockscale_bpreshuffle_wmma_t256x256x128_mw2_nw2_nb3_sk1_cm1_cn1,4087.57,1995.89,0.0
gfx1250,256,4096,4096,8192,flydsl,401,1,61.8925,flydsl_blockscale_bpreshuffle_wmma_t256x256x128_mw2_nw2_nb3_sk1_cm1_cn1,4441.22,1626.42,0.0
gfx1250,256,8192,4096,8192,flydsl,401,1,112.6246,flydsl_blockscale_bpreshuffle_wmma_t256x256x128_mw2_nw2_nb3_sk1_cm1_cn1,4881.31,1489.66,0.0
gfx1250,256,16384,4096,8192,flydsl,401,1,215.0025,flydsl_blockscale_bpreshuffle_wmma_t256x256x128_mw2_nw2_nb3_sk1_cm1_cn1,5113.95,1404.59,0.0
gfx1250,256,32768,4096,8192,flydsl,401,1,477.0305,flydsl_blockscale_bpreshuffle_wmma_t256x256x128_mw2_nw2_nb3_sk1_cm1_cn1,4609.82,1195.78,0.0
gfx1250,256,16,4096,2048,flydsl,9,1,3.7073,flydsl_blockscale_bpreshuffle_wmma_t16x32x1024_mw1_nw2_nb2_sk1_cm1_cn1,72.41,2306.92,0.0
gfx1250,256,32,4096,2048,flydsl,86,1,3.8106,flydsl_blockscale_bpreshuffle_wmma_t32x32x1024_mw2_nw2_nb2_sk1_cm1_cn1,140.89,2287.38,0.0
gfx1250,256,64,4096,2048,flydsl,84,1,4.166,flydsl_blockscale_bpreshuffle_wmma_t32x32x512_mw2_nw2_nb3_sk1_cm1_cn1,257.74,2170.9,0.0
gfx1250,256,128,4096,2048,flydsl,206,1,4.7358,flydsl_blockscale_bpreshuffle_wmma_t64x32x512_mw4_nw1_nb4_sk1_cm1_cn1,453.46,2048.09,0.0
gfx1250,256,256,4096,2048,flydsl,220,1,5.5657,flydsl_blockscale_bpreshuffle_wmma_t64x64x512_mw2_nw2_nb3_sk1_cm1_cn1,771.69,1978.2,0.0
gfx1250,256,512,4096,2048,flydsl,301,1,7.2304,flydsl_blockscale_bpreshuffle_wmma_t256x256x256_mw2_nw2_nb2_sk1_cm1_cn1,1188.03,1885.3,0.0
gfx1250,256,1024,4096,2048,flydsl,301,1,9.8755,flydsl_blockscale_bpreshuffle_wmma_t256x256x256_mw2_nw2_nb2_sk1_cm1_cn1,1739.65,1911.23,0.0
gfx1250,256,2048,4096,2048,flydsl,301,1,12.5131,flydsl_blockscale_bpreshuffle_wmma_t256x256x256_mw2_nw2_nb2_sk1_cm1_cn1,2745.9,2346.35,0.0
gfx1250,256,4096,4096,2048,flydsl,301,1,18.4318,flydsl_blockscale_bpreshuffle_wmma_t256x256x256_mw2_nw2_nb2_sk1_cm1_cn1,3728.31,2730.7,0.0
gfx1250,256,8192,4096,2048,flydsl,301,1,33.4789,flydsl_blockscale_bpreshuffle_wmma_t256x256x256_mw2_nw2_nb2_sk1_cm1_cn1,4105.24,2756.2,0.0
gfx1250,256,16384,4096,2048,flydsl,301,1,69.5116,flydsl_blockscale_bpreshuffle_wmma_t256x256x256_mw2_nw2_nb2_sk1_cm1_cn1,3954.42,2534.26,0.0
gfx1250,256,32768,4096,2048,flydsl,301,1,130.5539,flydsl_blockscale_bpreshuffle_wmma_t256x256x256_mw2_nw2_nb2_sk1_cm1_cn1,4210.95,2634.41,0.0
gfx1250,256,16,4096,4096,flydsl,11,1,4.8236,flydsl_blockscale_bpreshuffle_wmma_t16x32x1024_mw1_nw2_nb4_sk1_cm1_cn1,111.3,3518.91,0.0
gfx1250,256,32,4096,4096,flydsl,87,1,4.7351,flydsl_blockscale_bpreshuffle_wmma_t32x32x1024_mw2_nw2_nb3_sk1_cm1_cn1,226.76,3626.2,0.0
gfx1250,256,64,4096,4096,flydsl,206,1,6.2966,flydsl_blockscale_bpreshuffle_wmma_t64x32x512_mw4_nw1_nb4_sk1_cm1_cn1,341.05,2789.39,0.0
gfx1250,256,128,4096,4096,flydsl,220,1,7.3873,flydsl_blockscale_bpreshuffle_wmma_t64x64x512_mw2_nw2_nb3_sk1_cm1_cn1,581.4,2484.0,0.0
gfx1250,256,256,4096,4096,flydsl,239,1,8.4429,flydsl_blockscale_bpreshuffle_wmma_t128x64x512_mw2_nw2_nb3_sk1_cm1_cn1,1017.42,2359.73,0.0
gfx1250,256,512,4096,4096,flydsl,401,1,26.7344,flydsl_blockscale_bpreshuffle_wmma_t256x256x128_mw2_nw2_nb3_sk1_cm1_cn1,642.61,862.88,0.0
gfx1250,256,1024,4096,4096,flydsl,401,1,25.7227,flydsl_blockscale_bpreshuffle_wmma_t256x256x128_mw2_nw2_nb3_sk1_cm1_cn1,1335.77,1141.41,0.0
gfx1250,256,2048,4096,4096,flydsl,401,1,27.3513,flydsl_blockscale_bpreshuffle_wmma_t256x256x128_mw2_nw2_nb3_sk1_cm1_cn1,2512.48,1533.49,0.0
gfx1250,256,4096,4096,4096,flydsl,401,1,53.9348,flydsl_blockscale_bpreshuffle_wmma_t256x256x128_mw2_nw2_nb3_sk1_cm1_cn1,2548.24,1244.26,0.0
gfx1250,256,8192,4096,4096,flydsl,401,1,75.7626,flydsl_blockscale_bpreshuffle_wmma_t256x256x128_mw2_nw2_nb3_sk1_cm1_cn1,3628.15,1550.11,0.0
gfx1250,256,16384,4096,4096,flydsl,299,1,122.9699,flydsl_blockscale_bpreshuffle_wmma_t256x256x128_mw2_nw2_nb3_sk1_cm1_cn1,4470.65,1773.64,0.0
gfx1250,256,32768,4096,4096,flydsl,401,1,240.0343,flydsl_blockscale_bpreshuffle_wmma_t256x256x128_mw2_nw2_nb3_sk1_cm1_cn1,4580.64,1747.38,0.0
gfx1250,256,16,7168,768,flydsl,4,1,3.2568,flydsl_blockscale_bpreshuffle_wmma_t16x32x256_mw1_nw2_nb3_sk1_cm1_cn1,54.09,1764.52,0.0
gfx1250,256,32,7168,768,flydsl,28,1,3.4209,flydsl_blockscale_bpreshuffle_wmma_t16x64x256_mw1_nw4_nb3_sk1_cm1_cn1,102.99,1750.52,0.0
gfx1250,256,64,7168,768,flydsl,177,1,3.6056,flydsl_blockscale_bpreshuffle_wmma_t32x64x256_mw2_nw2_nb3_sk1_cm1_cn1,195.43,1794.9,0.0
gfx1250,256,128,7168,768,flydsl,228,1,3.9758,flydsl_blockscale_bpreshuffle_wmma_t32x128x256_mw2_nw2_nb3_sk1_cm1_cn1,354.47,1870.9,0.0
gfx1250,256,256,7168,768,flydsl,551,1,4.4411,flydsl_blockscale_bpreshuffle_wmma_t128x64x256_mw2_nw2_nb3_sk1_cm1_cn1,634.66,2110.21,0.0
gfx1250,256,512,7168,768,flydsl,701,1,7.3147,flydsl_blockscale_bpreshuffle_wmma_t256x256x128_mw2_nw2_nb4_sk1_cm1_cn1,770.66,1809.82,0.0
gfx1250,256,1024,7168,768,flydsl,701,1,11.7946,flydsl_blockscale_bpreshuffle_wmma_t256x256x128_mw2_nw2_nb4_sk1_cm1_cn1,955.89,1778.06,0.0
gfx1250,256,2048,7168,768,flydsl,701,1,12.0554,flydsl_blockscale_bpreshuffle_wmma_t256x256x128_mw2_nw2_nb4_sk1_cm1_cn1,1870.41,3022.55,0.0
gfx1250,256,4096,7168,768,flydsl,701,1,21.2522,flydsl_blockscale_bpreshuffle_wmma_t256x256x128_mw2_nw2_nb4_sk1_cm1_cn1,2122.0,3170.07,0.0
gfx1250,256,8192,7168,768,flydsl,701,1,36.9052,flydsl_blockscale_bpreshuffle_wmma_t256x256x128_mw2_nw2_nb4_sk1_cm1_cn1,2443.95,3501.86,0.0
gfx1250,256,16384,7168,768,flydsl,701,1,57.6409,flydsl_blockscale_bpreshuffle_wmma_t256x256x128_mw2_nw2_nb4_sk1_cm1_cn1,3129.52,4388.71,0.0
gfx1250,256,32768,7168,768,flydsl,701,1,111.1322,flydsl_blockscale_bpreshuffle_wmma_t256x256x128_mw2_nw2_nb4_sk1_cm1_cn1,3246.38,4503.04,0.0
gfx1250,256,16,2048,7168,flydsl,17,1,5.3369,flydsl_blockscale_bpreshuffle_wmma_t16x32x1024_mw1_nw2_nb4_sk1_cm1_cn1,88.02,2784.44,0.0
gfx1250,256,32,2048,7168,flydsl,11,1,5.4987,flydsl_blockscale_bpreshuffle_wmma_t16x32x1024_mw1_nw2_nb4_sk1_cm1_cn1,170.86,2735.29,0.0
gfx1250,256,64,2048,7168,flydsl,11,1,6.3157,flydsl_blockscale_bpreshuffle_wmma_t16x32x1024_mw1_nw2_nb4_sk1_cm1_cn1,297.52,2438.52,0.0
gfx1250,256,128,2048,7168,flydsl,88,1,7.87,flydsl_blockscale_bpreshuffle_wmma_t32x32x1024_mw2_nw2_nb4_sk1_cm1_cn1,477.52,2048.52,0.0
gfx1250,256,256,2048,7168,flydsl,206,1,9.893,flydsl_blockscale_bpreshuffle_wmma_t64x32x512_mw4_nw1_nb4_sk1_cm1_cn1,759.75,1775.36,0.0
gfx1250,256,512,2048,7168,flydsl,402,1,37.5272,flydsl_blockscale_bpreshuffle_wmma_t256x256x128_mw2_nw2_nb4_sk1_cm1_cn1,400.57,544.86,0.0
gfx1250,256,1024,2048,7168,flydsl,402,1,38.3773,flydsl_blockscale_bpreshuffle_wmma_t256x256x128_mw2_nw2_nb4_sk1_cm1_cn1,783.4,683.07,0.0
gfx1250,256,2048,2048,7168,flydsl,402,1,39.501,flydsl_blockscale_bpreshuffle_wmma_t256x256x128_mw2_nw2_nb4_sk1_cm1_cn1,1522.23,955.64,0.0
gfx1250,256,4096,2048,7168,flydsl,402,1,43.8736,flydsl_blockscale_bpreshuffle_wmma_t256x256x128_mw2_nw2_nb4_sk1_cm1_cn1,2741.04,1386.2,0.0
gfx1250,256,8192,2048,7168,flydsl,402,1,58.9603,flydsl_blockscale_bpreshuffle_wmma_t256x256x128_mw2_nw2_nb4_sk1_cm1_cn1,4079.32,1814.01,0.0
gfx1250,256,16384,2048,7168,flydsl,402,1,97.2704,flydsl_blockscale_bpreshuffle_wmma_t256x256x128_mw2_nw2_nb4_sk1_cm1_cn1,4945.35,2048.2,0.0
gfx1250,256,32768,2048,7168,flydsl,402,1,200.2066,flydsl_blockscale_bpreshuffle_wmma_t256x256x128_mw2_nw2_nb4_sk1_cm1_cn1,4805.4,1916.91,0.0
gfx1250,256,16,7168,4096,flydsl,33,1,5.0839,flydsl_blockscale_bpreshuffle_wmma_t16x64x1024_mw1_nw4_nb3_sk1_cm1_cn1,184.8,5833.13,0.0
gfx1250,256,32,7168,4096,flydsl,87,1,5.3092,flydsl_blockscale_bpreshuffle_wmma_t32x32x1024_mw2_nw2_nb3_sk1_cm1_cn1,353.92,5641.14,0.0
gfx1250,256,64,7168,4096,flydsl,206,1,6.846,flydsl_blockscale_bpreshuffle_wmma_t64x32x512_mw4_nw1_nb4_sk1_cm1_cn1,548.95,4460.97,0.0
gfx1250,256,128,7168,4096,flydsl,220,1,8.0218,flydsl_blockscale_bpreshuffle_wmma_t64x64x512_mw2_nw2_nb3_sk1_cm1_cn1,936.97,3954.15,0.0
gfx1250,256,256,7168,4096,flydsl,247,1,11.9636,flydsl_blockscale_bpreshuffle_wmma_t128x128x256_mw2_nw2_nb4_sk1_cm1_cn1,1256.51,2848.53,0.0
gfx1250,256,512,7168,4096,flydsl,401,1,28.4676,flydsl_blockscale_bpreshuffle_wmma_t256x256x128_mw2_nw2_nb3_sk1_cm1_cn1,1056.1,1362.86,0.0
gfx1250,256,1024,7168,4096,flydsl,401,1,27.6584,flydsl_blockscale_bpreshuffle_wmma_t256x256x128_mw2_nw2_nb3_sk1_cm1_cn1,2174.01,1743.94,0.0
gfx1250,256,2048,7168,4096,flydsl,401,1,36.3629,flydsl_blockscale_bpreshuffle_wmma_t256x256x128_mw2_nw2_nb3_sk1_cm1_cn1,3307.19,1845.53,0.0
gfx1250,256,4096,7168,4096,flydsl,401,1,63.3606,flydsl_blockscale_bpreshuffle_wmma_t256x256x128_mw2_nw2_nb3_sk1_cm1_cn1,3796.02,1654.93,0.0
gfx1250,256,8192,7168,4096,flydsl,401,1,107.8549,flydsl_blockscale_bpreshuffle_wmma_t256x256x128_mw2_nw2_nb3_sk1_cm1_cn1,4460.03,1672.2,0.0
gfx1250,256,16384,7168,4096,flydsl,401,1,190.5084,flydsl_blockscale_bpreshuffle_wmma_t256x256x128_mw2_nw2_nb3_sk1_cm1_cn1,5050.03,1739.29,0.0
gfx1250,256,32768,7168,4096,flydsl,401,1,383.4793,flydsl_blockscale_bpreshuffle_wmma_t256x256x128_mw2_nw2_nb3_sk1_cm1_cn1,5017.6,1651.56,0.0
gfx1250,256,16,1536,7168,flydsl,17,1,5.4804,flydsl_blockscale_bpreshuffle_wmma_t16x32x1024_mw1_nw2_nb4_sk1_cm1_cn1,64.29,2038.88,0.0
gfx1250,256,32,1536,7168,flydsl,160,1,5.6434,flydsl_blockscale_bpreshuffle_wmma_t32x32x1024_mw2_nw2_nb4_sk1_cm1_cn1,124.86,2009.02,0.0
gfx1250,256,64,1536,7168,flydsl,160,1,5.8597,flydsl_blockscale_bpreshuffle_wmma_t32x32x1024_mw2_nw2_nb4_sk1_cm1_cn1,240.5,1990.79,0.0
gfx1250,256,128,1536,7168,flydsl,160,1,6.9519,flydsl_blockscale_bpreshuffle_wmma_t32x32x1024_mw2_nw2_nb4_sk1_cm1_cn1,405.44,1772.29,0.0
gfx1250,256,256,1536,7168,flydsl,206,1,8.8451,flydsl_blockscale_bpreshuffle_wmma_t64x32x512_mw4_nw1_nb4_sk1_cm1_cn1,637.32,1541.13,0.0
gfx1250,256,512,1536,7168,flydsl,397,1,24.4989,flydsl_blockscale_bpreshuffle_wmma_t256x128x256_mw2_nw2_nb3_sk1_cm1_cn1,460.2,663.41,0.0
gfx1250,256,1024,1536,7168,flydsl,397,1,24.3326,flydsl_blockscale_bpreshuffle_wmma_t256x128x256_mw2_nw2_nb3_sk1_cm1_cn1,926.68,883.42,0.0
gfx1250,256,2048,1536,7168,flydsl,397,1,25.2428,flydsl_blockscale_bpreshuffle_wmma_t256x128x256_mw2_nw2_nb3_sk1_cm1_cn1,1786.54,1266.96,0.0
gfx1250,256,4096,1536,7168,flydsl,397,1,31.3573,flydsl_blockscale_bpreshuffle_wmma_t256x128x256_mw2_nw2_nb3_sk1_cm1_cn1,2876.34,1688.7,0.0
gfx1250,256,8192,1536,7168,flydsl,397,1,59.7275,flydsl_blockscale_bpreshuffle_wmma_t256x128x256_mw2_nw2_nb3_sk1_cm1_cn1,3020.19,1588.82,0.0
gfx1250,256,16384,1536,7168,flydsl,397,1,85.7277,flydsl_blockscale_bpreshuffle_wmma_t256x128x256_mw2_nw2_nb3_sk1_cm1_cn1,4208.41,2085.47,0.0
gfx1250,256,32768,1536,7168,flydsl,397,1,182.0166,flydsl_blockscale_bpreshuffle_wmma_t256x128x256_mw2_nw2_nb3_sk1_cm1_cn1,3964.22,1903.97,0.0
gfx1250,256,16,8192,1536,flydsl,7,1,4.2533,flydsl_blockscale_bpreshuffle_wmma_t16x32x512_mw1_nw2_nb3_sk1_cm1_cn1,94.67,3025.8,0.0
gfx1250,256,32,8192,1536,flydsl,84,1,4.7064,flydsl_blockscale_bpreshuffle_wmma_t32x32x512_mw2_nw2_nb3_sk1_cm1_cn1,171.11,2795.42,0.0
gfx1250,256,64,8192,1536,flydsl,106,1,5.0964,flydsl_blockscale_bpreshuffle_wmma_t32x64x256_mw2_nw2_nb4_sk1_cm1_cn1,316.03,2694.02,0.0
gfx1250,256,128,8192,1536,flydsl,161,1,5.9456,flydsl_blockscale_bpreshuffle_wmma_t64x64x256_mw2_nw2_nb4_sk1_cm1_cn1,541.78,2502.13,0.0
gfx1250,256,256,8192,1536,flydsl,248,1,6.7334,flydsl_blockscale_bpreshuffle_wmma_t128x128x512_mw2_nw2_nb2_sk1_cm1_cn1,956.79,2550.04,0.0
gfx1250,256,512,8192,1536,flydsl,702,1,15.1148,flydsl_blockscale_bpreshuffle_wmma_t256x256x256_mw2_nw2_nb2_sk1_cm1_cn1,852.47,1439.51,0.0
gfx1250,256,1024,8192,1536,flydsl,702,1,14.7586,flydsl_blockscale_bpreshuffle_wmma_t256x256x256_mw2_nw2_nb2_sk1_cm1_cn1,1746.09,2095.93,0.0
gfx1250,256,2048,8192,1536,flydsl,702,1,16.5398,flydsl_blockscale_bpreshuffle_wmma_t256x256x256_mw2_nw2_nb2_sk1_cm1_cn1,3116.1,2979.67,0.0
gfx1250,256,4096,8192,1536,flydsl,702,1,29.2636,flydsl_blockscale_bpreshuffle_wmma_t256x256x256_mw2_nw2_nb2_sk1_cm1_cn1,3522.44,2938.23,0.0
gfx1250,256,8192,8192,1536,flydsl,702,1,54.5029,flydsl_blockscale_bpreshuffle_wmma_t256x256x256_mw2_nw2_nb2_sk1_cm1_cn1,3782.52,2924.31,0.0
gfx1250,256,16384,8192,1536,flydsl,702,1,103.6649,flydsl_blockscale_bpreshuffle_wmma_t256x256x256_mw2_nw2_nb2_sk1_cm1_cn1,3977.4,2953.6,0.0
gfx1250,256,32768,8192,1536,flydsl,702,1,204.1905,flydsl_blockscale_bpreshuffle_wmma_t256x256x256_mw2_nw2_nb2_sk1_cm1_cn1,4038.55,2937.38,0.0
gfx1250,256,16,16384,1536,flydsl,45,1,4.8973,flydsl_blockscale_bpreshuffle_wmma_t16x128x256_mw1_nw4_nb4_sk1_cm1_cn1,164.44,5250.79,0.0
gfx1250,256,32,16384,1536,flydsl,60,1,5.5571,flydsl_blockscale_bpreshuffle_wmma_t32x128x256_mw2_nw2_nb4_sk1_cm1_cn1,289.83,4726.13,0.0
gfx1250,256,64,16384,1536,flydsl,115,1,6.0058,flydsl_blockscale_bpreshuffle_wmma_t64x128x256_mw1_nw4_nb4_sk1_cm1_cn1,536.35,4555.81,0.0
gfx1250,256,128,16384,1536,flydsl,159,1,7.0387,flydsl_blockscale_bpreshuffle_wmma_t128x128x512_mw2_nw2_nb2_sk1_cm1_cn1,915.29,4199.18,0.0
gfx1250,256,256,16384,1536,flydsl,193,1,8.7781,flydsl_blockscale_bpreshuffle_wmma_t256x128x256_mw4_nw1_nb3_sk1_cm1_cn1,1467.85,3867.31,0.0
gfx1250,256,512,16384,1536,flydsl,702,1,17.1129,flydsl_blockscale_bpreshuffle_wmma_t256x256x256_mw2_nw2_nb2_sk1_cm1_cn1,1505.87,2496.92,0.0
gfx1250,256,1024,16384,1536,flydsl,702,1,17.062,flydsl_blockscale_bpreshuffle_wmma_t256x256x256_mw2_nw2_nb2_sk1_cm1_cn1,3020.72,3533.77,0.0
gfx1250,256,2048,16384,1536,flydsl,702,1,30.2122,flydsl_blockscale_bpreshuffle_wmma_t256x256x256_mw2_nw2_nb2_sk1_cm1_cn1,3411.84,3158.34,0.0
gfx1250,256,4096,16384,1536,flydsl,702,1,54.9791,flydsl_blockscale_bpreshuffle_wmma_t256x256x256_mw2_nw2_nb2_sk1_cm1_cn1,3749.76,3013.42,0.0
gfx1250,256,8192,16384,1536,flydsl,702,1,105.495,flydsl_blockscale_bpreshuffle_wmma_t256x256x256_mw2_nw2_nb2_sk1_cm1_cn1,3908.4,2902.36,0.0
gfx1250,256,16384,16384,1536,flydsl,702,1,205.4995,flydsl_blockscale_bpreshuffle_wmma_t256x256x256_mw2_nw2_nb2_sk1_cm1_cn1,4012.83,2857.44,0.0
gfx1250,256,32768,16384,1536,flydsl,702,1,405.7711,flydsl_blockscale_bpreshuffle_wmma_t256x256x256_mw2_nw2_nb2_sk1_cm1_cn1,4064.53,2832.24,0.0
gfx1250,256,16,7168,16384,flydsl,22,1,12.0038,flydsl_blockscale_bpreshuffle_wmma_t16x32x1024_mw1_nw2_nb4_sk1_cm1_cn1,313.08,9824.56,0.0
gfx1250,256,32,7168,16384,flydsl,88,1,13.3233,flydsl_blockscale_bpreshuffle_wmma_t32x32x1024_mw2_nw2_nb4_sk1_cm1_cn1,564.14,8888.45,0.0
gfx1250,256,64,7168,16384,flydsl,412,1,17.4919,flydsl_blockscale_bpreshuffle_wmma_t64x32x512_mw4_nw1_nb4_sk1_cm1_cn1,859.39,6826.39,0.0
gfx1250,256,128,7168,16384,flydsl,222,1,23.6547,flydsl_blockscale_bpreshuffle_wmma_t64x64x1024_mw2_nw2_nb2_sk1_cm1_cn1,1270.99,5131.02,0.0
gfx1250,256,256,7168,16384,flydsl,448,1,28.1502,flydsl_blockscale_bpreshuffle_wmma_t128x64x512_mw2_nw2_nb3_sk1_cm1_cn1,2136.03,4451.29,0.0
gfx1250,256,512,7168,16384,flydsl,402,1,85.75,flydsl_blockscale_bpreshuffle_wmma_t256x256x128_mw2_nw2_nb4_sk1_cm1_cn1,1402.44,1552.99,0.0
gfx1250,256,1024,7168,16384,flydsl,402,1,90.4044,flydsl_blockscale_bpreshuffle_wmma_t256x256x128_mw2_nw2_nb4_sk1_cm1_cn1,2660.47,1647.02,0.0
gfx1250,256,2048,7168,16384,flydsl,402,1,109.5613,flydsl_blockscale_bpreshuffle_wmma_t256x256x128_mw2_nw2_nb4_sk1_cm1_cn1,4390.57,1646.16,0.0
gfx1250,256,4096,7168,16384,flydsl,402,1,211.2845,flydsl_blockscale_bpreshuffle_wmma_t256x256x128_mw2_nw2_nb4_sk1_cm1_cn1,4553.45,1151.38,0.0
gfx1250,256,8192,7168,16384,flydsl,402,1,408.3897,flydsl_blockscale_bpreshuffle_wmma_t256x256x128_mw2_nw2_nb4_sk1_cm1_cn1,4711.54,903.79,0.0
gfx1250,256,16384,7168,16384,flydsl,402,1,769.762,flydsl_blockscale_bpreshuffle_wmma_t256x256x128_mw2_nw2_nb4_sk1_cm1_cn1,4999.33,806.43,0.0
gfx1250,256,32768,7168,16384,flydsl,402,1,1582.614,flydsl_blockscale_bpreshuffle_wmma_t256x256x128_mw2_nw2_nb4_sk1_cm1_cn1,4863.21,710.26,0.0
gfx1250,256,16,6144,7168,flydsl,17,1,6.5218,flydsl_blockscale_bpreshuffle_wmma_t16x32x1024_mw1_nw2_nb4_sk1_cm1_cn1,216.09,6800.5,0.0
gfx1250,256,32,6144,7168,flydsl,124,1,8.7229,flydsl_blockscale_bpreshuffle_wmma_t32x32x1024_mw2_nw2_nb4_sk1_cm1_cn1,323.12,5120.18,0.0
gfx1250,256,64,6144,7168,flydsl,160,1,11.1308,flydsl_blockscale_bpreshuffle_wmma_t32x64x512_mw2_nw2_nb4_sk1_cm1_cn1,506.45,4068.47,0.0
gfx1250,256,128,6144,7168,flydsl,310,1,11.7148,flydsl_blockscale_bpreshuffle_wmma_t64x64x512_mw2_nw2_nb3_sk1_cm1_cn1,962.4,3971.95,0.0
gfx1250,256,256,6144,7168,flydsl,448,1,14.097,flydsl_blockscale_bpreshuffle_wmma_t128x64x512_mw2_nw2_nb3_sk1_cm1_cn1,1599.53,3477.4,0.0
gfx1250,256,512,6144,7168,flydsl,547,1,39.6946,flydsl_blockscale_bpreshuffle_wmma_t256x256x128_mw2_nw2_nb4_sk1_cm1_cn1,1136.1,1360.43,0.0
gfx1250,256,1024,6144,7168,flydsl,547,1,54.5059,flydsl_blockscale_bpreshuffle_wmma_t256x256x128_mw2_nw2_nb4_sk1_cm1_cn1,1654.76,1173.51,0.0
gfx1250,256,2048,6144,7168,flydsl,547,1,56.6869,flydsl_blockscale_bpreshuffle_wmma_t256x256x128_mw2_nw2_nb4_sk1_cm1_cn1,3182.19,1479.81,0.0
gfx1250,256,4096,6144,7168,flydsl,547,1,98.1883,flydsl_blockscale_bpreshuffle_wmma_t256x256x128_mw2_nw2_nb4_sk1_cm1_cn1,3674.34,1260.15,0.0
gfx1250,256,8192,6144,7168,flydsl,547,1,158.0575,flydsl_blockscale_bpreshuffle_wmma_t256x256x128_mw2_nw2_nb4_sk1_cm1_cn1,4565.14,1287.02,0.0
gfx1250,256,16384,6144,7168,flydsl,547,1,292.7459,flydsl_blockscale_bpreshuffle_wmma_t256x256x128_mw2_nw2_nb4_sk1_cm1_cn1,4929.56,1239.32,0.0
gfx1250,256,32768,6144,7168,flydsl,547,1,628.9287,flydsl_blockscale_bpreshuffle_wmma_t256x256x128_mw2_nw2_nb4_sk1_cm1_cn1,4589.1,1083.71,0.0
gfx1250,256,16,7168,3072,flydsl,16,1,4.3833,flydsl_blockscale_bpreshuffle_wmma_t16x32x1024_mw1_nw2_nb3_sk1_cm1_cn1,160.76,5087.18,0.0
gfx1250,256,32,7168,3072,flydsl,118,1,5.0085,flydsl_blockscale_bpreshuffle_wmma_t32x32x512_mw2_nw2_nb4_sk1_cm1_cn1,281.38,4507.77,0.0
gfx1250,256,64,7168,3072,flydsl,284,1,5.6681,flydsl_blockscale_bpreshuffle_wmma_t64x32x512_mw4_nw1_nb4_sk1_cm1_cn1,497.27,4081.47,0.0
gfx1250,256,128,7168,3072,flydsl,311,1,7.2144,flydsl_blockscale_bpreshuffle_wmma_t64x64x512_mw2_nw2_nb4_sk1_cm1_cn1,781.37,3361.1,0.0
gfx1250,256,256,7168,3072,flydsl,345,1,9.1935,flydsl_blockscale_bpreshuffle_wmma_t64x128x512_mw1_nw4_nb3_sk1_cm1_cn1,1226.33,2879.92,0.0
gfx1250,256,512,7168,3072,flydsl,547,1,22.7483,flydsl_blockscale_bpreshuffle_wmma_t256x256x128_mw2_nw2_nb4_sk1_cm1_cn1,991.22,1359.79,0.0
gfx1250,256,1024,7168,3072,flydsl,246,1,49.8023,flydsl_blockscale_bpreshuffle_wmma_t256x256x128_mw2_nw2_nb4_sk1_cm1_cn1,905.52,800.08,0.0
gfx1250,256,2048,7168,3072,flydsl,246,1,50.7433,flydsl_blockscale_bpreshuffle_wmma_t256x256x128_mw2_nw2_nb4_sk1_cm1_cn1,1777.46,1136.54,0.0
gfx1250,256,4096,7168,3072,flydsl,246,1,53.5002,flydsl_blockscale_bpreshuffle_wmma_t256x256x128_mw2_nw2_nb4_sk1_cm1_cn1,3371.74,1744.35,0.0
gfx1250,256,8192,7168,3072,flydsl,246,1,99.7492,flydsl_blockscale_bpreshuffle_wmma_t256x256x128_mw2_nw2_nb4_sk1_cm1_cn1,3616.84,1650.4,0.0
gfx1250,256,16384,7168,3072,flydsl,246,1,163.713,flydsl_blockscale_bpreshuffle_wmma_t256x256x128_mw2_nw2_nb4_sk1_cm1_cn1,4407.44,1876.65,0.0
gfx1250,256,32768,7168,3072,flydsl,246,1,325.1092,flydsl_blockscale_bpreshuffle_wmma_t256x256x128_mw2_nw2_nb4_sk1_cm1_cn1,4438.84,1822.3,0.0
gfx1250,256,16,65536,1536,flydsl,70,1,8.7234,flydsl_blockscale_bpreshuffle_wmma_t16x128x512_mw1_nw2_nb2_sk1_cm1_cn1,369.26,11782.68,0.0
gfx1250,256,32,65536,1536,flydsl,225,1,8.9173,flydsl_blockscale_bpreshuffle_wmma_t32x256x256_mw1_nw4_nb3_sk1_cm1_cn1,722.47,11764.41,0.0
gfx1250,256,64,65536,1536,flydsl,365,1,10.34,flydsl_blockscale_bpreshuffle_wmma_t64x256x256_mw2_nw2_nb3_sk1_cm1_cn1,1246.12,10556.11,0.0
gfx1250,256,128,65536,1536,flydsl,477,1,12.1536,flydsl_blockscale_bpreshuffle_wmma_t128x256x256_mw2_nw2_nb3_sk1_cm1_cn1,2120.34,9679.2,0.0
gfx1250,256,256,65536,1536,flydsl,548,1,16.416,flydsl_blockscale_bpreshuffle_wmma_t256x256x256_mw2_nw2_nb2_sk1_cm1_cn1,3139.6,8199.98,0.0
gfx1250,256,512,65536,1536,flydsl,548,1,56.2436,flydsl_blockscale_bpreshuffle_wmma_t256x256x256_mw2_nw2_nb2_sk1_cm1_cn1,1832.73,2996.94,0.0
gfx1250,256,1024,65536,1536,flydsl,247,1,81.5535,flydsl_blockscale_bpreshuffle_wmma_t256x256x256_mw2_nw2_nb2_sk1_cm1_cn1,2527.89,2899.37,0.0
gfx1250,256,2048,65536,1536,flydsl,247,1,122.3529,flydsl_blockscale_bpreshuffle_wmma_t256x256x256_mw2_nw2_nb2_sk1_cm1_cn1,3369.9,3042.38,0.0
gfx1250,256,4096,65536,1536,flydsl,247,1,216.6744,flydsl_blockscale_bpreshuffle_wmma_t256x256x256_mw2_nw2_nb2_sk1_cm1_cn1,3805.87,2971.4,0.0
gfx1250,256,8192,65536,1536,flydsl,247,1,422.5521,flydsl_blockscale_bpreshuffle_wmma_t256x256x256_mw2_nw2_nb2_sk1_cm1_cn1,3903.11,2809.09,0.0
gfx1250,256,16384,65536,1536,flydsl,247,1,841.9694,flydsl_blockscale_bpreshuffle_wmma_t256x256x256_mw2_nw2_nb2_sk1_cm1_cn1,3917.64,2699.99,0.0
gfx1250,256,32768,65536,1536,flydsl,247,1,1654.5578,flydsl_blockscale_bpreshuffle_wmma_t256x256x256_mw2_nw2_nb2_sk1_cm1_cn1,3987.21,2687.1,0.0
