aiter/configs/a8w8_blockscale_bpreshuffle_tuned_bmm.csv
gfx,cu_num,B,M,N,K,libtype,kernelId,splitK,us,kernelName,tflops,bw,errRatio
gfx1250,256,2,1,1024,4096,flydsl,57,1,7.7,flydsl_blockscale_bpreshuffle_bmm_t16x128x1024_mw1_nw4_nb2_sk1_cm1_cn1,2.17,1091.1003,0.0
gfx1250,256,2,2,1024,4096,flydsl,55,1,6.5,flydsl_blockscale_bpreshuffle_bmm_t16x128x512_mw1_nw4_nb3_sk1_cm1_cn1,5.18,1294.4345,0.0
gfx1250,256,2,4,1024,4096,flydsl,55,1,6.6,flydsl_blockscale_bpreshuffle_bmm_t16x128x512_mw1_nw4_nb3_sk1_cm1_cn1,10.22,1278.5648,0.0
gfx1250,256,2,8,1024,4096,flydsl,55,1,6.5,flydsl_blockscale_bpreshuffle_bmm_t16x128x512_mw1_nw4_nb3_sk1_cm1_cn1,20.69,1305.8363,0.0
gfx1250,256,2,16,1024,4096,flydsl,55,1,6.7,flydsl_blockscale_bpreshuffle_bmm_t16x128x512_mw1_nw4_nb3_sk1_cm1_cn1,40.09,1281.6048,0.0
gfx1250,256,2,32,1024,4096,flydsl,55,1,6.4,flydsl_blockscale_bpreshuffle_bmm_t16x128x512_mw1_nw4_nb3_sk1_cm1_cn1,83.8,1372.5600,0.0
gfx1250,256,2,64,1024,4096,flydsl,55,1,6.3,flydsl_blockscale_bpreshuffle_bmm_t16x128x512_mw1_nw4_nb3_sk1_cm1_cn1,171.5,1457.0870,0.0
gfx1250,256,2,128,1024,4096,flydsl,55,1,6.4,flydsl_blockscale_bpreshuffle_bmm_t16x128x512_mw1_nw4_nb3_sk1_cm1_cn1,334.99,1557.8400,0.0
gfx1250,256,2,192,1024,4096,flydsl,55,1,7.4,flydsl_blockscale_bpreshuffle_bmm_t16x128x512_mw1_nw4_nb3_sk1_cm1_cn1,432.49,1454.1492,0.0
gfx1250,256,2,256,1024,4096,flydsl,55,1,7.5,flydsl_blockscale_bpreshuffle_bmm_t16x128x512_mw1_nw4_nb3_sk1_cm1_cn1,570.04,1540.1643,0.0
gfx1250,256,2,384,1024,4096,flydsl,271,1,8.2,flydsl_blockscale_bpreshuffle_bmm_t32x128x512_mw2_nw2_nb3_sk1_cm1_cn1,784.99,1601.4985,0.0
gfx1250,256,2,512,1024,4096,flydsl,223,1,8.6,flydsl_blockscale_bpreshuffle_bmm_t32x128x512_mw1_nw4_nb3_sk1_cm1_cn1,1002.85,1710.8540,0.0
gfx1250,256,2,768,1024,4096,flydsl,487,1,9.9,flydsl_blockscale_bpreshuffle_bmm_t64x128x512_mw4_nw2_nb3_sk1_cm1_cn1,1306.77,1805.6016,0.0
gfx1250,256,2,1024,1024,4096,flydsl,439,1,10.7,flydsl_blockscale_bpreshuffle_bmm_t64x128x512_mw2_nw2_nb3_sk1_cm1_cn1,1607.3,1966.1279,0.0
gfx1250,256,2,1536,1024,4096,flydsl,604,1,13.3,flydsl_blockscale_bpreshuffle_bmm_t128x128x256_mw2_nw2_nb3_sk1_cm1_cn1,1932.84,2057.2776,0.0
gfx1250,256,2,2048,1024,4096,flydsl,604,1,14.1,flydsl_blockscale_bpreshuffle_bmm_t128x128x256_mw2_nw2_nb3_sk1_cm1_cn1,2430.3,2389.0791,0.0
gfx1250,256,2,3072,1024,4096,flydsl,566,1,22.5,flydsl_blockscale_bpreshuffle_bmm_t128x256x128_mw1_nw4_nb4_sk1_cm1_cn1,2288.29,2059.3095,0.0
gfx1250,256,2,4096,1024,4096,flydsl,614,1,26.0,flydsl_blockscale_bpreshuffle_bmm_t128x256x128_mw2_nw2_nb4_sk1_cm1_cn1,2640.08,2268.5735,0.0
gfx1250,256,2,8192,1024,4096,flydsl,782,1,43.6,flydsl_blockscale_bpreshuffle_bmm_t256x256x128_mw2_nw2_nb4_sk1_cm1_cn1,3153.72,2513.2272,0.0
gfx1250,256,2,16384,1024,4096,flydsl,758,1,82.8,flydsl_blockscale_bpreshuffle_bmm_t256x256x128_mw4_nw1_nb4_sk1_cm1_cn1,3320.6,2545.4624,0.0
gfx1250,256,16,1,1024,4096,flydsl,55,1,7.6,flydsl_blockscale_bpreshuffle_bmm_t16x128x512_mw1_nw4_nb3_sk1_cm1_cn1,17.55,8843.6547,0.0
gfx1250,256,16,2,1024,4096,flydsl,55,1,7.4,flydsl_blockscale_bpreshuffle_bmm_t16x128x512_mw1_nw4_nb3_sk1_cm1_cn1,36.36,9096.0259,0.0
gfx1250,256,16,4,1024,4096,flydsl,55,1,7.4,flydsl_blockscale_bpreshuffle_bmm_t16x128x512_mw1_nw4_nb3_sk1_cm1_cn1,72.7,9122.7330,0.0
gfx1250,256,16,8,1024,4096,flydsl,57,1,7.9,flydsl_blockscale_bpreshuffle_bmm_t16x128x1024_mw1_nw4_nb2_sk1_cm1_cn1,136.04,8595.3782,0.0
gfx1250,256,16,16,1024,4096,flydsl,55,1,7.5,flydsl_blockscale_bpreshuffle_bmm_t16x128x512_mw1_nw4_nb3_sk1_cm1_cn1,288.0,9159.2021,0.0
gfx1250,256,16,32,1024,4096,flydsl,223,1,8.4,flydsl_blockscale_bpreshuffle_bmm_t32x128x512_mw1_nw4_nb3_sk1_cm1_cn1,508.95,8366.0800,0.0
gfx1250,256,16,64,1024,4096,flydsl,487,1,9.7,flydsl_blockscale_bpreshuffle_bmm_t64x128x512_mw4_nw2_nb3_sk1_cm1_cn1,888.66,7570.8437,0.0
gfx1250,256,16,128,1024,4096,flydsl,582,1,12.9,flydsl_blockscale_bpreshuffle_bmm_t128x128x512_mw4_nw1_nb2_sk1_cm1_cn1,1331.97,6183.0549,0.0
gfx1250,256,16,192,1024,4096,flydsl,399,1,20.6,flydsl_blockscale_bpreshuffle_bmm_t64x256x256_mw1_nw4_nb2_sk1_cm1_cn1,1250.81,4178.9142,0.0
gfx1250,256,16,256,1024,4096,flydsl,747,1,23.2,flydsl_blockscale_bpreshuffle_bmm_t256x128x256_mw4_nw1_nb2_sk1_cm1_cn1,1484.1,3983.1834,0.0
gfx1250,256,16,384,1024,4096,flydsl,640,1,28.7,flydsl_blockscale_bpreshuffle_bmm_t128x256x256_mw2_nw4_nb3_sk1_cm1_cn1,1796.4,3660.5681,0.0
gfx1250,256,16,512,1024,4096,flydsl,700,1,34.5,flydsl_blockscale_bpreshuffle_bmm_t256x128x256_mw2_nw1_nb3_sk1_cm1_cn1,1989.97,3411.7899,0.0
gfx1250,256,16,768,1024,4096,flydsl,783,1,46.8,flydsl_blockscale_bpreshuffle_bmm_t256x256x256_mw2_nw2_nb2_sk1_cm1_cn1,2204.15,3055.6335,0.0
gfx1250,256,16,1024,1024,4096,flydsl,783,1,52.5,flydsl_blockscale_bpreshuffle_bmm_t256x256x256_mw2_nw2_nb2_sk1_cm1_cn1,2616.79,3205.7246,0.0
gfx1250,256,16,2048,1024,4096,flydsl,783,1,87.1,flydsl_blockscale_bpreshuffle_bmm_t256x256x256_mw2_nw2_nb2_sk1_cm1_cn1,3156.19,3094.0084,0.0
gfx1250,256,16,4096,1024,4096,flydsl,783,1,166.6,flydsl_blockscale_bpreshuffle_bmm_t256x256x256_mw2_nw2_nb2_sk1_cm1_cn1,3300.11,2832.3127,0.0
gfx1250,256,16,8192,1024,4096,flydsl,783,1,297.1,flydsl_blockscale_bpreshuffle_bmm_t256x256x256_mw2_nw2_nb2_sk1_cm1_cn1,3700.93,2950.5676,0.0
gfx1250,256,16,16384,1024,4096,flydsl,783,1,613.4,flydsl_blockscale_bpreshuffle_bmm_t256x256x256_mw2_nw2_nb2_sk1_cm1_cn1,3585.23,2748.8006,0.0
