aiter/configs/a8w8_bpreshuffle_tuned_gemm.csv
gfx,cu_num,M,N,K,q_dtype_w,libtype,kernelId,splitK,us,kernelName,tflops,bw,errRatio
gfx942,80,192,1536,5120,torch.float8_e4m3fnuz,cktile,9,0,18.9229,a8w8_bpreshuffle_cktile_0x0x8x4x1x0x0x0x0x1_32x64x512_1x4x1_16x16x64_default,159.59,498.72,0.0
gfx950,256,1,800,5120,torch.float8_e4m3fn,ck,10,0,11.3133,a8w8_bpreshuffle_128x16x32x512_16x16_16x16_32x4x1_32x4x1_1x16x1x8_4x4x1_1x1_intrawave_v1,0.72,362.65,0.0
gfx950,256,1,1280,8192,torch.float8_e4m3fn,ck,10,0,12.9809,a8w8_bpreshuffle_128x16x32x512_16x16_16x16_32x4x1_32x4x1_1x16x1x8_4x4x1_1x1_intrawave_v1,1.62,808.61,0.0
gfx950,256,1,2304,16384,torch.float8_e4m3fn,ck,10,0,28.7056,a8w8_bpreshuffle_128x16x32x512_16x16_16x16_32x4x1_32x4x1_1x16x1x8_4x4x1_1x1_intrawave_v1,2.63,1315.76,0.0
gfx950,256,1,2560,8192,torch.float8_e4m3fn,ck,10,0,12.8571,a8w8_bpreshuffle_128x16x32x512_16x16_16x16_32x4x1_32x4x1_1x16x1x8_4x4x1_1x1_intrawave_v1,3.26,1632.16,0.0
gfx950,256,1,4608,16384,torch.float8_e4m3fn,ck,10,0,29.8957,a8w8_bpreshuffle_128x16x32x512_16x16_16x16_32x4x1_32x4x1_1x16x1x8_4x4x1_1x1_intrawave_v1,5.05,2526.22,0.0
gfx950,256,1,5120,640,torch.float8_e4m3fn,ck,23,0,5.7466,a8w8_bpreshuffle_128x16x32x128_16x16_16x16_8x16x1_8x16x1_1x16x1x8_4x4x1_1x1_intrawave_v2,1.14,572.11,0.0
gfx950,256,1,5120,1280,torch.float8_e4m3fn,ck,108,0,6.8374,a8w8_bpreshuffle_256x16x64x256_16x16_16x16_16x16x1_16x16x1_1x16x1x16_4x4x1_1x1_intrawave_v1,1.92,960.18,0.0
gfx950,256,1,5120,3200,torch.float8_e4m3fn,ck,23,0,15.188,a8w8_bpreshuffle_128x16x32x128_16x16_16x16_8x16x1_8x16x1_1x16x1x8_4x4x1_1x1_intrawave_v2,2.16,1079.63,0.0
gfx950,256,1,5120,5120,torch.float8_e4m3fn,ck,10,0,11.7201,a8w8_bpreshuffle_128x16x32x512_16x16_16x16_32x4x1_32x4x1_1x16x1x8_4x4x1_1x1_intrawave_v1,4.47,2238.02,0.0
gfx950,256,1,5120,6400,torch.float8_e4m3fn,ck,108,0,19.1846,a8w8_bpreshuffle_256x16x64x256_16x16_16x16_16x16x1_16x16x1_1x16x1x16_4x4x1_1x1_intrawave_v1,3.42,1708.9,0.0
gfx950,256,1,5120,25600,torch.float8_e4m3fn,ck,10,0,46.1466,a8w8_bpreshuffle_128x16x32x512_16x16_16x16_32x4x1_32x4x1_1x16x1x8_4x4x1_1x1_intrawave_v1,5.68,2841.12,0.0
gfx950,256,1,6400,5120,torch.float8_e4m3fn,ck,24,0,12.5759,a8w8_bpreshuffle_128x16x32x512_16x16_16x16_32x4x1_32x4x1_1x16x1x8_4x4x1_1x1_intrawave_v2,5.21,2607.04,0.0
gfx950,256,1,7168,8192,torch.float8_e4m3fn,ck,24,0,15.0501,a8w8_bpreshuffle_128x16x32x512_16x16_16x16_32x4x1_32x4x1_1x16x1x8_4x4x1_1x1_intrawave_v2,7.8,3903.15,0.0
gfx950,256,1,8192,1024,torch.float8_e4m3fn,ck,108,0,5.9704,a8w8_bpreshuffle_256x16x64x256_16x16_16x16_16x16x1_16x16x1_1x16x1x16_4x4x1_1x1_intrawave_v1,2.81,1407.95,0.0
gfx950,256,1,8192,2048,torch.float8_e4m3fn,ck,10,0,5.8009,a8w8_bpreshuffle_128x16x32x512_16x16_16x16_32x4x1_32x4x1_1x16x1x8_4x4x1_1x1_intrawave_v1,5.78,2895.35,0.0
gfx950,256,1,8192,3584,torch.float8_e4m3fn,ck,10,0,7.8125,a8w8_bpreshuffle_128x16x32x512_16x16_16x16_32x4x1_32x4x1_1x16x1x8_4x4x1_1x1_intrawave_v1,7.52,3760.65,0.0
gfx950,256,1,8192,7168,torch.float8_e4m3fn,ck,24,0,13.9797,a8w8_bpreshuffle_128x16x32x512_16x16_16x16_32x4x1_32x4x1_1x16x1x8_4x4x1_1x1_intrawave_v2,8.4,4202.08,0.0
gfx950,256,1,8192,8192,torch.float8_e4m3fn,ck,10,0,14.8978,a8w8_bpreshuffle_128x16x32x512_16x16_16x16_32x4x1_32x4x1_1x16x1x8_4x4x1_1x1_intrawave_v1,9.01,4506.27,0.0
gfx950,256,1,8192,28672,torch.float8_e4m3fn,ck,10,0,46.0411,a8w8_bpreshuffle_128x16x32x512_16x16_16x16_32x4x1_32x4x1_1x16x1x8_4x4x1_1x1_intrawave_v1,10.2,5102.53,0.0
gfx950,256,1,9216,16384,torch.float8_e4m3fn,ck,10,0,35.2763,a8w8_bpreshuffle_128x16x32x512_16x16_16x16_32x4x1_32x4x1_1x16x1x8_4x4x1_1x1_intrawave_v1,8.56,4281.34,0.0
gfx950,256,1,10240,8192,torch.float8_e4m3fn,ck,10,0,16.9524,a8w8_bpreshuffle_128x16x32x512_16x16_16x16_32x4x1_32x4x1_1x16x1x8_4x4x1_1x1_intrawave_v1,9.9,4950.02,0.0
gfx950,256,1,12800,5120,torch.float8_e4m3fn,ck,10,0,14.7141,a8w8_bpreshuffle_128x16x32x512_16x16_16x16_32x4x1_32x4x1_1x16x1x8_4x4x1_1x1_intrawave_v1,8.91,4456.05,0.0
gfx950,256,1,13312,16384,torch.float8_e4m3fn,ck,10,0,40.7795,a8w8_bpreshuffle_128x16x32x512_16x16_16x16_32x4x1_32x4x1_1x16x1x8_4x4x1_1x1_intrawave_v1,10.7,5349.42,0.0
gfx950,256,1,14336,8192,torch.float8_e4m3fn,ck,10,0,21.766,a8w8_bpreshuffle_128x16x32x512_16x16_16x16_32x4x1_32x4x1_1x16x1x8_4x4x1_1x1_intrawave_v1,10.79,5397.29,0.0
gfx950,256,1,16384,2048,torch.float8_e4m3fn,ck,24,0,9.9256,a8w8_bpreshuffle_128x16x32x512_16x16_16x16_32x4x1_32x4x1_1x16x1x8_4x4x1_1x1_intrawave_v2,6.76,3384.1,0.0
gfx950,256,1,16384,4096,torch.float8_e4m3fn,ck,24,0,14.6481,a8w8_bpreshuffle_128x16x32x512_16x16_16x16_32x4x1_32x4x1_1x16x1x8_4x4x1_1x1_intrawave_v2,9.16,4583.92,0.0
gfx950,256,1,16384,6656,torch.float8_e4m3fn,ck,24,0,21.1312,a8w8_bpreshuffle_128x16x32x512_16x16_16x16_32x4x1_32x4x1_1x16x1x8_4x4x1_1x1_intrawave_v2,10.32,5162.57,0.0
gfx950,256,1,16384,8192,torch.float8_e4m3fn,ck,10,0,25.6037,a8w8_bpreshuffle_128x16x32x512_16x16_16x16_32x4x1_32x4x1_1x16x1x8_4x4x1_1x1_intrawave_v1,10.48,5243.72,0.0
gfx950,256,1,16384,13312,torch.float8_e4m3fn,ck,11,0,39.322,a8w8_bpreshuffle_256x16x64x512_16x16_16x16_32x8x1_32x8x1_1x16x1x16_4x4x1_1x1_intrawave_v1,11.09,5547.78,0.0
gfx950,256,1,16384,26624,torch.float8_e4m3fn,ck,5,0,73.9656,a8w8_bpreshuffle_256x16x64x512_16x16_16x16_32x8x1_32x8x1_1x16x1x16_4x4x1_1x1_intrawave_v1,11.79,5898.24,0.0
gfx950,256,1,26624,16384,torch.float8_e4m3fn,ck,6,0,76.8576,a8w8_bpreshuffle_256x16x128x512_16x16_16x16_32x8x1_32x8x1_1x16x1x16_8x8x1_1x2_intrawave_v1,11.35,5676.44,0.0
gfx950,256,1,51200,5120,torch.float8_e4m3fn,ck,16,0,45.1392,a8w8_bpreshuffle_256x16x128x256_16x16_16x16_16x16x1_16x16x1_1x16x1x16_8x8x1_1x2_intrawave_v1,11.61,5809.84,0.0
gfx950,256,1,53248,16384,torch.float8_e4m3fn,ck,23,0,150.2505,a8w8_bpreshuffle_128x16x32x128_16x16_16x16_8x16x1_8x16x1_1x16x1x8_4x4x1_1x1_intrawave_v2,11.61,5807.22,0.0
gfx950,256,1,57344,8192,torch.float8_e4m3fn,ck,9,0,77.922,a8w8_bpreshuffle_128x16x32x128_16x16_16x16_8x16x1_8x16x1_1x16x1x8_4x4x1_1x1_intrawave_v1,12.06,6030.2,0.0
gfx950,256,4,16384,6656,torch.float8_e4m3fn,ck,11,0,20.7235,a8w8_bpreshuffle_256x16x64x512_16x16_16x16_32x8x1_32x8x1_1x16x1x16_4x4x1_1x1_intrawave_v1,42.1,5269.84,0.0
gfx950,256,8,6656,16384,torch.float8_e4m3fn,ck,10,0,31.2392,a8w8_bpreshuffle_128x16x32x512_16x16_16x16_32x4x1_32x4x1_1x16x1x8_4x4x1_1x1_intrawave_v1,55.85,3498.47,0.0
gfx950,256,8,16384,6656,torch.float8_e4m3fn,ck,11,0,20.8171,a8w8_bpreshuffle_256x16x64x512_16x16_16x16_32x8x1_32x8x1_1x16x1x16_4x4x1_1x1_intrawave_v1,83.82,5253.72,0.0
gfx950,256,16,800,5120,torch.float8_e4m3fn,ck,24,0,10.5404,a8w8_bpreshuffle_128x16x32x512_16x16_16x16_32x4x1_32x4x1_1x16x1x8_4x4x1_1x1_intrawave_v2,12.44,398.8,0.0
gfx950,256,16,1280,8192,torch.float8_e4m3fn,ck,10,0,12.0223,a8w8_bpreshuffle_128x16x32x512_16x16_16x16_32x4x1_32x4x1_1x16x1x8_4x4x1_1x1_intrawave_v1,27.91,886.5,0.0
gfx950,256,16,2304,16384,torch.float8_e4m3fn,ck,24,0,24.7047,a8w8_bpreshuffle_128x16x32x512_16x16_16x16_32x4x1_32x4x1_1x16x1x8_4x4x1_1x1_intrawave_v2,48.9,1541.59,0.0
gfx950,256,16,2560,8192,torch.float8_e4m3fn,ck,10,0,11.95,a8w8_bpreshuffle_128x16x32x512_16x16_16x16_32x4x1_32x4x1_1x16x1x8_4x4x1_1x1_intrawave_v1,56.16,1772.76,0.0
gfx950,256,16,4608,16384,torch.float8_e4m3fn,ck,24,0,25.8456,a8w8_bpreshuffle_128x16x32x512_16x16_16x16_32x4x1_32x4x1_1x16x1x8_4x4x1_1x1_intrawave_v2,93.48,2936.94,0.0
gfx950,256,16,5120,640,torch.float8_e4m3fn,ck,23,0,5.7485,a8w8_bpreshuffle_128x16x32x128_16x16_16x16_8x16x1_8x16x1_1x16x1x8_4x4x1_1x1_intrawave_v2,18.24,600.31,0.0
gfx950,256,16,5120,1280,torch.float8_e4m3fn,ck,29,0,6.7718,a8w8_bpreshuffle_256x16x64x256_16x16_16x16_16x16x1_16x16x1_1x16x1x16_4x4x1_1x1_intrawave_v2,30.97,995.0,0.0
gfx950,256,16,5120,3200,torch.float8_e4m3fn,ck,23,0,14.71,a8w8_bpreshuffle_128x16x32x128_16x16_16x16_8x16x1_8x16x1_1x16x1x8_4x4x1_1x1_intrawave_v2,35.64,1128.42,0.0
gfx950,256,16,5120,5120,torch.float8_e4m3fn,ck,24,0,10.554,a8w8_bpreshuffle_128x16x32x512_16x16_16x16_32x4x1_32x4x1_1x16x1x8_4x4x1_1x1_intrawave_v2,79.48,2507.12,0.0
gfx950,256,16,5120,6400,torch.float8_e4m3fn,ck,15,0,19.3187,a8w8_bpreshuffle_256x16x64x256_16x16_16x16_16x16x1_16x16x1_1x16x1x16_4x4x1_1x1_intrawave_v1,54.28,1709.96,0.0
gfx950,256,16,5120,25600,torch.float8_e4m3fn,ck,24,0,39.1761,a8w8_bpreshuffle_128x16x32x512_16x16_16x16_32x4x1_32x4x1_1x16x1x8_4x4x1_1x1_intrawave_v2,107.06,3360.35,0.0
gfx950,256,16,6400,5120,torch.float8_e4m3fn,ck,10,0,11.3305,a8w8_bpreshuffle_128x16x32x512_16x16_16x16_32x4x1_32x4x1_1x16x1x8_4x4x1_1x1_intrawave_v1,92.54,2917.32,0.0
gfx950,256,16,7168,8192,torch.float8_e4m3fn,ck,10,0,13.6022,a8w8_bpreshuffle_128x16x32x512_16x16_16x16_32x4x1_32x4x1_1x16x1x8_4x4x1_1x1_intrawave_v1,138.14,4343.47,0.0
gfx950,256,16,8192,1024,torch.float8_e4m3fn,ck,15,0,5.9167,a8w8_bpreshuffle_256x16x64x256_16x16_16x16_16x16x1_16x16x1_1x16x1x16_4x4x1_1x1_intrawave_v1,45.37,1464.86,0.0
gfx950,256,16,8192,2048,torch.float8_e4m3fn,ck,10,0,5.6214,a8w8_bpreshuffle_128x16x32x512_16x16_16x16_32x4x1_32x4x1_1x16x1x8_4x4x1_1x1_intrawave_v1,95.5,3036.99,0.0
gfx950,256,16,8192,3584,torch.float8_e4m3fn,ck,10,0,7.8314,a8w8_bpreshuffle_128x16x32x512_16x16_16x16_32x4x1_32x4x1_1x16x1x8_4x4x1_1x1_intrawave_v1,119.97,3789.82,0.0
gfx950,256,16,8192,7168,torch.float8_e4m3fn,ck,10,0,12.5267,a8w8_bpreshuffle_128x16x32x512_16x16_16x16_32x4x1_32x4x1_1x16x1x8_4x4x1_1x1_intrawave_v1,150.0,4717.69,0.0
gfx950,256,16,8192,8192,torch.float8_e4m3fn,ck,10,0,13.9737,a8w8_bpreshuffle_128x16x32x512_16x16_16x16_32x4x1_32x4x1_1x16x1x8_4x4x1_1x1_intrawave_v1,153.68,4830.65,0.0
gfx950,256,16,8192,28672,torch.float8_e4m3fn,ck,10,0,41.1742,a8w8_bpreshuffle_128x16x32x512_16x16_16x16_32x4x1_32x4x1_1x16x1x8_4x4x1_1x1_intrawave_v1,182.55,5722.08,0.0
gfx950,256,16,9216,16384,torch.float8_e4m3fn,ck,24,0,32.3786,a8w8_bpreshuffle_128x16x32x512_16x16_16x16_32x4x1_32x4x1_1x16x1x8_4x4x1_1x1_intrawave_v2,149.23,4680.62,0.0
gfx950,256,16,10240,8192,torch.float8_e4m3fn,ck,10,0,17.892,a8w8_bpreshuffle_128x16x32x512_16x16_16x16_32x4x1_32x4x1_1x16x1x8_4x4x1_1x1_intrawave_v1,150.03,4714.11,0.0
gfx950,256,16,12800,5120,torch.float8_e4m3fn,ck,5,0,14.0716,a8w8_bpreshuffle_256x16x64x512_16x16_16x16_32x8x1_32x8x1_1x16x1x16_4x4x1_1x1_intrawave_v1,149.03,4692.25,0.0
gfx950,256,16,13312,16384,torch.float8_e4m3fn,ck,10,0,40.3808,a8w8_bpreshuffle_128x16x32x512_16x16_16x16_32x4x1_32x4x1_1x16x1x8_4x4x1_1x1_intrawave_v1,172.84,5418.22,0.0
gfx950,256,16,14336,8192,torch.float8_e4m3fn,ck,10,0,21.2685,a8w8_bpreshuffle_128x16x32x512_16x16_16x16_32x4x1_32x4x1_1x16x1x8_4x4x1_1x1_intrawave_v1,176.7,5549.54,0.0
gfx950,256,16,16384,2048,torch.float8_e4m3fn,ck,10,0,7.7604,a8w8_bpreshuffle_128x16x32x512_16x16_16x16_32x4x1_32x4x1_1x16x1x8_4x4x1_1x1_intrawave_v1,138.36,4395.58,0.0
gfx950,256,16,16384,4096,torch.float8_e4m3fn,ck,26,0,17.4151,a8w8_bpreshuffle_256x32x64x512_16x16_16x16_32x8x1_32x8x1_1x32x1x8_8x8x1_1x2_intrawave_v2,123.31,3887.36,0.0
gfx950,256,16,16384,6656,torch.float8_e4m3fn,ck,24,0,20.8707,a8w8_bpreshuffle_128x16x32x512_16x16_16x16_32x4x1_32x4x1_1x16x1x8_4x4x1_1x1_intrawave_v2,167.2,5255.34,0.0
gfx950,256,16,16384,8192,torch.float8_e4m3fn,ck,10,0,25.0145,a8w8_bpreshuffle_128x16x32x512_16x16_16x16_32x4x1_32x4x1_1x16x1x8_4x4x1_1x1_intrawave_v1,171.7,5391.8,0.0
gfx950,256,16,16384,13312,torch.float8_e4m3fn,ck,5,0,37.8531,a8w8_bpreshuffle_256x16x64x512_16x16_16x16_32x8x1_32x8x1_1x16x1x16_4x4x1_1x1_intrawave_v1,184.38,5781.33,0.0
gfx950,256,16,16384,26624,torch.float8_e4m3fn,ck,11,0,72.6906,a8w8_bpreshuffle_256x16x64x512_16x16_16x16_32x8x1_32x8x1_1x16x1x16_4x4x1_1x1_intrawave_v1,192.03,6013.95,0.0
gfx950,256,16,26624,16384,torch.float8_e4m3fn,ck,6,0,77.3342,a8w8_bpreshuffle_256x16x128x512_16x16_16x16_32x8x1_32x8x1_1x16x1x16_8x8x1_1x2_intrawave_v1,180.5,5654.96,0.0
gfx950,256,16,51200,5120,torch.float8_e4m3fn,ck,17,0,46.1585,a8w8_bpreshuffle_256x16x256x256_16x16_16x16_16x16x1_16x16x1_1x16x1x16_8x8x1_1x2_intrawave_v1,181.73,5716.48,0.0
gfx950,256,16,53248,16384,torch.float8_e4m3fn,ck,31,0,151.3677,a8w8_bpreshuffle_256x16x256x256_16x16_16x16_16x16x1_16x16x1_1x16x1x16_8x8x1_1x2_intrawave_v2,184.43,5776.54,0.0
gfx950,256,16,57344,8192,torch.float8_e4m3fn,ck,23,0,79.5497,a8w8_bpreshuffle_128x16x32x128_16x16_16x16_8x16x1_8x16x1_1x16x1x8_4x4x1_1x1_intrawave_v2,188.97,5929.98,0.0
gfx950,256,32,800,5120,torch.float8_e4m3fn,ck,24,0,10.2279,a8w8_bpreshuffle_128x16x32x512_16x16_16x16_32x4x1_32x4x1_1x16x1x8_4x4x1_1x1_intrawave_v2,25.63,421.5,0.0
gfx950,256,32,1280,8192,torch.float8_e4m3fn,ck,10,0,11.3752,a8w8_bpreshuffle_128x16x32x512_16x16_16x16_32x4x1_32x4x1_1x16x1x8_4x4x1_1x1_intrawave_v1,59.0,952.06,0.0
gfx950,256,32,2304,16384,torch.float8_e4m3fn,ck,24,0,25.2915,a8w8_bpreshuffle_128x16x32x512_16x16_16x16_32x4x1_32x4x1_1x16x1x8_4x4x1_1x1_intrawave_v2,95.52,1519.11,0.0
gfx950,256,32,2560,8192,torch.float8_e4m3fn,ck,10,0,12.0316,a8w8_bpreshuffle_128x16x32x512_16x16_16x16_32x4x1_32x4x1_1x16x1x8_4x4x1_1x1_intrawave_v1,111.55,1778.44,0.0
gfx950,256,32,4608,16384,torch.float8_e4m3fn,ck,24,0,29.2704,a8w8_bpreshuffle_128x16x32x512_16x16_16x16_32x4x1_32x4x1_1x16x1x8_4x4x1_1x1_intrawave_v2,165.08,2607.3,0.0
gfx950,256,32,5120,640,torch.float8_e4m3fn,ck,23,0,6.4386,a8w8_bpreshuffle_128x16x32x128_16x16_16x16_8x16x1_8x16x1_1x16x1x8_4x4x1_1x1_intrawave_v2,32.57,563.0,0.0
gfx950,256,32,5120,1280,torch.float8_e4m3fn,ck,29,0,6.9951,a8w8_bpreshuffle_256x16x64x256_16x16_16x16_16x16x1_16x16x1_1x16x1x16_4x4x1_1x1_intrawave_v2,59.96,989.58,0.0
gfx950,256,32,5120,3200,torch.float8_e4m3fn,ck,9,0,15.6619,a8w8_bpreshuffle_128x16x32x128_16x16_16x16_8x16x1_8x16x1_1x16x1x8_4x4x1_1x1_intrawave_v1,66.95,1073.57,0.0
gfx950,256,32,5120,5120,torch.float8_e4m3fn,ck,11,0,11.6951,a8w8_bpreshuffle_256x16x64x512_16x16_16x16_32x8x1_32x8x1_1x16x1x16_4x4x1_1x1_intrawave_v1,143.46,2283.51,0.0
gfx950,256,32,5120,6400,torch.float8_e4m3fn,ck,15,0,19.3178,a8w8_bpreshuffle_256x16x64x256_16x16_16x16_16x16x1_16x16x1_1x16x1x16_4x4x1_1x1_intrawave_v1,108.56,1723.82,0.0
gfx950,256,32,5120,25600,torch.float8_e4m3fn,ck,24,0,44.1556,a8w8_bpreshuffle_128x16x32x512_16x16_16x16_32x4x1_32x4x1_1x16x1x8_4x4x1_1x1_intrawave_v2,189.98,2994.39,0.0
gfx950,256,32,6400,5120,torch.float8_e4m3fn,ck,5,0,12.3982,a8w8_bpreshuffle_256x16x64x512_16x16_16x16_32x8x1_32x8x1_1x16x1x16_4x4x1_1x1_intrawave_v1,169.15,2689.22,0.0
gfx950,256,32,7168,8192,torch.float8_e4m3fn,ck,11,0,15.5322,a8w8_bpreshuffle_256x16x64x512_16x16_16x16_32x8x1_32x8x1_1x16x1x16_4x4x1_1x1_intrawave_v1,241.96,3826.96,0.0
gfx950,256,32,8192,1024,torch.float8_e4m3fn,ck,108,0,6.0451,a8w8_bpreshuffle_256x16x64x256_16x16_16x16_16x16x1_16x16x1_1x16x1x16_4x4x1_1x1_intrawave_v1,88.81,1479.82,0.0
gfx950,256,32,8192,2048,torch.float8_e4m3fn,ck,5,0,6.2663,a8w8_bpreshuffle_256x16x64x512_16x16_16x16_32x8x1_32x8x1_1x16x1x16_4x4x1_1x1_intrawave_v1,171.35,2771.5,0.0
gfx950,256,32,8192,3584,torch.float8_e4m3fn,ck,5,0,7.9538,a8w8_bpreshuffle_256x16x64x512_16x16_16x16_32x8x1_32x8x1_1x16x1x16_4x4x1_1x1_intrawave_v1,236.25,3771.67,0.0
gfx950,256,32,8192,7168,torch.float8_e4m3fn,ck,11,0,14.5895,a8w8_bpreshuffle_256x16x64x512_16x16_16x16_32x8x1_32x8x1_1x16x1x16_4x4x1_1x1_intrawave_v1,257.59,4076.49,0.0
gfx950,256,32,8192,8192,torch.float8_e4m3fn,ck,5,0,15.7818,a8w8_bpreshuffle_256x16x64x512_16x16_16x16_32x8x1_32x8x1_1x16x1x16_4x4x1_1x1_intrawave_v1,272.15,4302.13,0.0
gfx950,256,32,8192,28672,torch.float8_e4m3fn,ck,5,0,47.2548,a8w8_bpreshuffle_256x16x64x512_16x16_16x16_32x8x1_32x8x1_1x16x1x16_4x4x1_1x1_intrawave_v1,318.11,5001.03,0.0
gfx950,256,32,9216,16384,torch.float8_e4m3fn,ck,24,0,39.3729,a8w8_bpreshuffle_128x16x32x512_16x16_16x16_32x4x1_32x4x1_1x16x1x8_4x4x1_1x1_intrawave_v2,245.44,3863.29,0.0
gfx950,256,32,10240,8192,torch.float8_e4m3fn,ck,10,0,22.5861,a8w8_bpreshuffle_128x16x32x512_16x16_16x16_32x4x1_32x4x1_1x16x1x8_4x4x1_1x1_intrawave_v1,237.7,3754.68,0.0
gfx950,256,32,12800,5120,torch.float8_e4m3fn,ck,12,0,17.5533,a8w8_bpreshuffle_256x32x64x512_16x16_16x16_32x8x1_32x8x1_1x32x1x8_8x8x1_1x2_intrawave_v1,238.95,3789.55,0.0
gfx950,256,32,13312,16384,torch.float8_e4m3fn,ck,12,0,46.3062,a8w8_bpreshuffle_256x32x64x512_16x16_16x16_32x8x1_32x8x1_1x32x1x8_8x8x1_1x2_intrawave_v1,301.44,4739.76,0.0
gfx950,256,32,14336,8192,torch.float8_e4m3fn,ck,6,0,26.4468,a8w8_bpreshuffle_256x16x128x512_16x16_16x16_32x8x1_32x8x1_1x16x1x16_8x8x1_1x2_intrawave_v1,284.2,4485.24,0.0
gfx950,256,32,16384,2048,torch.float8_e4m3fn,ck,6,0,9.6867,a8w8_bpreshuffle_256x16x128x512_16x16_16x16_32x8x1_32x8x1_1x16x1x16_8x8x1_1x2_intrawave_v1,221.69,3578.98,0.0
gfx950,256,32,16384,4096,torch.float8_e4m3fn,ck,26,0,17.6799,a8w8_bpreshuffle_256x32x64x512_16x16_16x16_32x8x1_32x8x1_1x32x1x8_8x8x1_1x2_intrawave_v2,242.93,3862.49,0.0
gfx950,256,32,16384,6656,torch.float8_e4m3fn,ck,12,0,23.1146,a8w8_bpreshuffle_256x32x64x512_16x16_16x16_32x8x1_32x8x1_1x32x1x8_8x8x1_1x2_intrawave_v1,301.94,4772.46,0.0
gfx950,256,32,16384,8192,torch.float8_e4m3fn,ck,19,0,28.8166,a8w8_bpreshuffle_256x16x64x512_16x16_16x16_32x8x1_32x8x1_1x16x1x16_4x4x1_1x1_intrawave_v2,298.09,4703.14,0.0
gfx950,256,32,16384,13312,torch.float8_e4m3fn,ck,12,0,40.7803,a8w8_bpreshuffle_256x32x64x512_16x16_16x16_32x8x1_32x8x1_1x32x1x8_8x8x1_1x2_intrawave_v1,342.29,5384.42,0.0
gfx950,256,32,16384,26624,torch.float8_e4m3fn,ck,12,0,77.4146,a8w8_bpreshuffle_256x32x64x512_16x16_16x16_32x8x1_32x8x1_1x32x1x8_8x8x1_1x2_intrawave_v1,360.62,5659.24,0.0
gfx950,256,32,26624,16384,torch.float8_e4m3fn,ck,119,0,80.3452,a8w8_bpreshuffle_256x32x128x256_16x16_16x16_16x16x1_16x16x1_1x16x1x16_8x8x1_1x2_intrawave_v1,347.47,5456.9,0.0
gfx950,256,32,51200,5120,torch.float8_e4m3fn,ck,133,0,47.8343,a8w8_bpreshuffle_256x32x256x256_16x16_16x16_16x16x1_16x16x1_1x16x1x16_8x8x1_1x2_intrawave_v1,350.74,5552.18,0.0
gfx950,256,32,53248,16384,torch.float8_e4m3fn,ck,136,0,154.4861,a8w8_bpreshuffle_256x80x256x256_16x16_16x16_16x16x1_16x16x1_1x16x1x16_8x8x1_1x2_intrawave_v3,361.42,5672.66,0.0
gfx950,256,32,57344,8192,torch.float8_e4m3fn,ck,85,0,86.5188,a8w8_bpreshuffle_256x64x128x128_16x16_16x16_8x32x1_8x32x1_1x32x1x8_8x8x1_2x1_intrawave_v3,347.49,5475.04,0.0
gfx950,256,64,192,1024,torch.float8_e4m3fn,ck,15,0,4.5229,a8w8_bpreshuffle_256x16x64x256_16x16_16x16_16x16x1_16x16x1_1x16x1x16_4x4x1_1x1_intrawave_v1,5.56,63.39,0.0
gfx950,256,64,800,5120,torch.float8_e4m3fn,ck,10,0,10.5456,a8w8_bpreshuffle_128x16x32x512_16x16_16x16_32x4x1_32x4x1_1x16x1x8_4x4x1_1x1_intrawave_v1,49.72,429.19,0.0
gfx950,256,64,1280,8192,torch.float8_e4m3fn,ck,10,0,11.9979,a8w8_bpreshuffle_128x16x32x512_16x16_16x16_32x4x1_32x4x1_1x16x1x8_4x4x1_1x1_intrawave_v1,111.87,931.32,0.0
gfx950,256,64,2304,16384,torch.float8_e4m3fn,ck,19,0,27.9421,a8w8_bpreshuffle_256x16x64x512_16x16_16x16_32x8x1_32x8x1_1x16x1x16_4x4x1_1x1_intrawave_v2,172.92,1399.04,0.0
gfx950,256,64,2560,8192,torch.float8_e4m3fn,ck,5,0,12.8533,a8w8_bpreshuffle_256x16x64x512_16x16_16x16_32x8x1_32x8x1_1x16x1x16_4x4x1_1x1_intrawave_v1,208.85,1697.89,0.0
gfx950,256,64,4608,16384,torch.float8_e4m3fn,ck,10,0,36.4754,a8w8_bpreshuffle_128x16x32x512_16x16_16x16_32x4x1_32x4x1_1x16x1x8_4x4x1_1x1_intrawave_v1,264.94,2114.74,0.0
gfx950,256,64,5120,640,torch.float8_e4m3fn,ck,23,0,6.7207,a8w8_bpreshuffle_128x16x32x128_16x16_16x16_8x16x1_8x16x1_1x16x1x8_4x4x1_1x1_intrawave_v2,62.41,591.18,0.0
gfx950,256,64,5120,1280,torch.float8_e4m3fn,ck,29,0,7.6564,a8w8_bpreshuffle_256x16x64x256_16x16_16x16_16x16x1_16x16x1_1x16x1x16_4x4x1_1x1_intrawave_v2,109.56,952.26,0.0
gfx950,256,64,5120,3200,torch.float8_e4m3fn,ck,23,0,15.6284,a8w8_bpreshuffle_128x16x32x128_16x16_16x16_8x16x1_8x16x1_1x16x1x8_4x4x1_1x1_intrawave_v2,134.19,1103.39,0.0
gfx950,256,64,5120,5120,torch.float8_e4m3fn,ck,10,0,14.3407,a8w8_bpreshuffle_128x16x32x512_16x16_16x16_32x4x1_32x4x1_1x16x1x8_4x4x1_1x1_intrawave_v1,233.98,1896.52,0.0
gfx950,256,64,5120,6400,torch.float8_e4m3fn,ck,15,0,19.7146,a8w8_bpreshuffle_256x16x64x256_16x16_16x16_16x16x1_16x16x1_1x16x1x16_4x4x1_1x1_intrawave_v1,212.75,1716.14,0.0
gfx950,256,64,5120,25600,torch.float8_e4m3fn,ck,24,0,52.8565,a8w8_bpreshuffle_128x16x32x512_16x16_16x16_32x4x1_32x4x1_1x16x1x8_4x4x1_1x1_intrawave_v2,317.41,2523.17,0.0
gfx950,256,64,6400,5120,torch.float8_e4m3fn,ck,12,0,14.7961,a8w8_bpreshuffle_256x32x64x512_16x16_16x16_32x8x1_32x8x1_1x32x1x8_8x8x1_1x2_intrawave_v1,283.47,2292.15,0.0
gfx950,256,64,7168,8192,torch.float8_e4m3fn,ck,12,0,20.6714,a8w8_bpreshuffle_256x32x64x512_16x16_16x16_32x8x1_32x8x1_1x32x1x8_8x8x1_1x2_intrawave_v1,363.6,2910.4,0.0
gfx950,256,64,8192,2048,torch.float8_e4m3fn,ck,5,0,7.5112,a8w8_bpreshuffle_256x16x64x512_16x16_16x16_32x8x1_32x8x1_1x16x1x16_4x4x1_1x1_intrawave_v1,285.9,2390.68,0.0
gfx950,256,64,8192,3584,torch.float8_e4m3fn,ck,12,0,11.0813,a8w8_bpreshuffle_256x32x64x512_16x16_16x16_32x8x1_32x8x1_1x32x1x8_8x8x1_1x2_intrawave_v1,339.14,2764.85,0.0
gfx950,256,64,8192,7168,torch.float8_e4m3fn,ck,12,0,19.2039,a8w8_bpreshuffle_256x32x64x512_16x16_16x16_32x8x1_32x8x1_1x32x1x8_8x8x1_1x2_intrawave_v1,391.39,3136.22,0.0
gfx950,256,64,8192,8192,torch.float8_e4m3fn,ck,12,0,21.1081,a8w8_bpreshuffle_256x32x64x512_16x16_16x16_32x8x1_32x8x1_1x32x1x8_8x8x1_1x2_intrawave_v1,406.95,3253.81,0.0
gfx950,256,64,8192,28672,torch.float8_e4m3fn,ck,12,0,64.9256,a8w8_bpreshuffle_256x32x64x512_16x16_16x16_32x8x1_32x8x1_1x32x1x8_8x8x1_1x2_intrawave_v1,463.06,3662.11,0.0
gfx950,256,64,9216,16384,torch.float8_e4m3fn,ck,114,0,56.6696,a8w8_bpreshuffle_256x64x64x256_16x16_16x16_16x16x1_16x16x1_1x32x1x8_8x8x1_2x1_intrawave_v3,341.05,2703.8,0.0
gfx950,256,64,10240,8192,torch.float8_e4m3fn,ck,114,0,25.5687,a8w8_bpreshuffle_256x64x64x256_16x16_16x16_16x16x1_16x16x1_1x32x1x8_8x8x1_2x1_intrawave_v3,419.94,3352.58,0.0
gfx950,256,64,12800,5120,torch.float8_e4m3fn,ck,119,0,21.9262,a8w8_bpreshuffle_256x32x128x256_16x16_16x16_16x16x1_16x16x1_1x16x1x16_8x8x1_1x2_intrawave_v1,382.58,3078.6,0.0
gfx950,256,64,13312,16384,torch.float8_e4m3fn,ck,114,0,60.16,a8w8_bpreshuffle_256x64x64x256_16x16_16x16_16x16x1_16x16x1_1x32x1x8_8x8x1_2x1_intrawave_v3,464.05,3671.15,0.0
gfx950,256,64,14336,8192,torch.float8_e4m3fn,ck,114,0,29.5848,a8w8_bpreshuffle_256x64x64x256_16x16_16x16_16x16x1_16x16x1_1x32x1x8_8x8x1_2x1_intrawave_v3,508.11,4049.37,0.0
gfx950,256,64,16384,2048,torch.float8_e4m3fn,ck,119,0,11.4341,a8w8_bpreshuffle_256x32x128x256_16x16_16x16_16x16x1_16x16x1_1x16x1x16_8x8x1_1x2_intrawave_v1,375.63,3129.47,0.0
gfx950,256,64,16384,4096,torch.float8_e4m3fn,ck,119,0,20.8735,a8w8_bpreshuffle_256x32x128x256_16x16_16x16_16x16x1_16x16x1_1x16x1x16_8x8x1_1x2_intrawave_v1,411.52,3328.06,0.0
gfx950,256,64,16384,6656,torch.float8_e4m3fn,ck,119,0,29.3009,a8w8_bpreshuffle_256x32x128x256_16x16_16x16_16x16x1_16x16x1_1x16x1x16_8x8x1_1x2_intrawave_v1,476.39,3807.9,0.0
gfx950,256,64,16384,8192,torch.float8_e4m3fn,ck,119,0,35.6664,a8w8_bpreshuffle_256x32x128x256_16x16_16x16_16x16x1_16x16x1_1x16x1x16_8x8x1_1x2_intrawave_v1,481.68,3836.64,0.0
gfx950,256,64,16384,13312,torch.float8_e4m3fn,ck,119,0,53.1879,a8w8_bpreshuffle_256x32x128x256_16x16_16x16_16x16x1_16x16x1_1x16x1x16_8x8x1_1x2_intrawave_v1,524.88,4156.08,0.0
gfx950,256,64,16384,26624,torch.float8_e4m3fn,ck,119,0,102.4795,a8w8_bpreshuffle_256x32x128x256_16x16_16x16_16x16x1_16x16x1_1x16x1x16_8x8x1_1x2_intrawave_v1,544.84,4293.63,0.0
gfx950,256,64,26624,16384,torch.float8_e4m3fn,ck,121,0,91.6538,a8w8_bpreshuffle_256x64x128x256_16x16_16x16_16x16x1_16x16x1_1x16x1x16_8x8x1_1x2_intrawave_v3,609.19,4807.92,0.0
gfx950,256,64,51200,5120,torch.float8_e4m3fn,ck,135,0,54.3316,a8w8_bpreshuffle_256x64x256x256_16x16_16x16_16x16x1_16x16x1_1x16x1x16_8x8x1_1x2_intrawave_v3,617.59,4951.54,0.0
gfx950,256,64,53248,16384,torch.float8_e4m3fn,ck,135,0,156.5996,a8w8_bpreshuffle_256x64x256x256_16x16_16x16_16x16x1_16x16x1_1x16x1x16_8x8x1_1x2_intrawave_v3,713.09,5621.21,0.0
gfx950,256,64,57344,8192,torch.float8_e4m3fn,ck,85,0,87.6062,a8w8_bpreshuffle_256x64x128x128_16x16_16x16_8x32x1_8x32x1_1x32x1x8_8x8x1_2x1_intrawave_v3,686.36,5451.97,0.0
gfx950,256,128,800,5120,torch.float8_e4m3fn,ck,24,0,9.9852,a8w8_bpreshuffle_128x16x32x512_16x16_16x16_32x4x1_32x4x1_1x16x1x8_4x4x1_1x1_intrawave_v2,105.01,496.35,0.0
gfx950,256,128,1280,8192,torch.float8_e4m3fn,ck,5,0,12.228,a8w8_bpreshuffle_256x16x64x512_16x16_16x16_32x8x1_32x8x1_1x16x1x16_4x4x1_1x1_intrawave_v1,219.53,970.07,0.0
gfx950,256,128,2304,16384,torch.float8_e4m3fn,ck,24,0,33.0153,a8w8_bpreshuffle_128x16x32x512_16x16_16x16_32x4x1_32x4x1_1x16x1x8_4x4x1_1x1_intrawave_v2,292.7,1224.76,0.0
gfx950,256,128,2560,8192,torch.float8_e4m3fn,ck,10,0,17.8034,a8w8_bpreshuffle_128x16x32x512_16x16_16x16_32x4x1_32x4x1_1x16x1x8_4x4x1_1x1_intrawave_v1,301.56,1273.66,0.0
gfx950,256,128,4608,16384,torch.float8_e4m3fn,ck,108,0,54.3179,a8w8_bpreshuffle_256x16x64x256_16x16_16x16_16x16x1_16x16x1_1x16x1x16_4x4x1_1x1_intrawave_v1,355.82,1450.25,0.0
gfx950,256,128,5120,640,torch.float8_e4m3fn,ck,23,0,6.3513,a8w8_bpreshuffle_128x16x32x128_16x16_16x16_8x16x1_8x16x1_1x16x1x8_4x4x1_1x1_intrawave_v2,132.08,735.19,0.0
gfx950,256,128,5120,1280,torch.float8_e4m3fn,ck,29,0,7.7817,a8w8_bpreshuffle_256x16x64x256_16x16_16x16_16x16x1_16x16x1_1x16x1x16_4x4x1_1x1_intrawave_v2,215.6,1031.67,0.0
gfx950,256,128,5120,3200,torch.float8_e4m3fn,ck,23,0,16.0101,a8w8_bpreshuffle_128x16x32x128_16x16_16x16_8x16x1_8x16x1_1x16x1x8_4x4x1_1x1_intrawave_v2,261.98,1130.81,0.0
gfx950,256,128,5120,5120,torch.float8_e4m3fn,ck,108,0,19.63,a8w8_bpreshuffle_256x16x64x256_16x16_16x16_16x16x1_16x16x1_1x16x1x16_4x4x1_1x1_intrawave_v1,341.87,1435.58,0.0
gfx950,256,128,5120,6400,torch.float8_e4m3fn,ck,29,0,22.9859,a8w8_bpreshuffle_256x16x64x256_16x16_16x16_16x16x1_16x16x1_1x16x1x16_4x4x1_1x1_intrawave_v2,364.95,1518.23,0.0
gfx950,256,128,5120,25600,torch.float8_e4m3fn,ck,114,0,83.5847,a8w8_bpreshuffle_256x64x64x256_16x16_16x16_16x16x1_16x16x1_1x32x1x8_8x8x1_2x1_intrawave_v3,401.44,1623.02,0.0
gfx950,256,128,6400,5120,torch.float8_e4m3fn,ck,114,0,20.5908,a8w8_bpreshuffle_256x64x64x256_16x16_16x16_16x16x1_16x16x1_1x32x1x8_8x8x1_2x1_intrawave_v3,407.4,1702.79,0.0
gfx950,256,128,7168,8192,torch.float8_e4m3fn,ck,114,0,23.7352,a8w8_bpreshuffle_256x64x64x256_16x16_16x16_16x16x1_16x16x1_1x32x1x8_8x8x1_2x1_intrawave_v3,633.34,2595.46,0.0
gfx950,256,128,8192,1024,torch.float8_e4m3fn,ck,119,0,6.9407,a8w8_bpreshuffle_256x32x128x256_16x16_16x16_16x16x1_16x16x1_1x16x1x16_8x8x1_1x2_intrawave_v1,309.4,1529.65,0.0
gfx950,256,128,8192,2048,torch.float8_e4m3fn,ck,114,0,8.8614,a8w8_bpreshuffle_256x64x64x256_16x16_16x16_16x16x1_16x16x1_1x32x1x8_8x8x1_2x1_intrawave_v3,484.68,2159.54,0.0
gfx950,256,128,8192,3584,torch.float8_e4m3fn,ck,114,0,12.978,a8w8_bpreshuffle_256x64x64x256_16x16_16x16_16x16x1_16x16x1_1x32x1x8_8x8x1_2x1_intrawave_v3,579.15,2459.24,0.0
gfx950,256,128,8192,7168,torch.float8_e4m3fn,ck,114,0,21.6976,a8w8_bpreshuffle_256x64x64x256_16x16_16x16_16x16x1_16x16x1_1x32x1x8_8x8x1_2x1_intrawave_v3,692.81,2845.24,0.0
gfx950,256,128,8192,8192,torch.float8_e4m3fn,ck,114,0,24.8294,a8w8_bpreshuffle_256x64x64x256_16x16_16x16_16x16x1_16x16x1_1x32x1x8_8x8x1_2x1_intrawave_v3,691.92,2829.49,0.0
gfx950,256,128,8192,28672,torch.float8_e4m3fn,ck,114,0,75.1872,a8w8_bpreshuffle_256x64x64x256_16x16_16x16_16x16x1_16x16x1_1x32x1x8_8x8x1_2x1_intrawave_v3,799.73,3200.65,0.0
gfx950,256,128,9216,16384,torch.float8_e4m3fn,ck,126,0,72.8197,a8w8_bpreshuffle_256x32x192x256_16x16_16x16_16x16x1_16x16x1_1x32x1x8_8x8x1_2x1_intrawave_v1,530.83,2134.74,0.0
gfx950,256,128,10240,8192,torch.float8_e4m3fn,ck,113,0,30.4124,a8w8_bpreshuffle_256x48x64x256_16x16_16x16_16x16x1_16x16x1_1x16x1x16_4x4x1_1x1_intrawave_v1,706.12,2878.96,0.0
gfx950,256,128,12800,5120,torch.float8_e4m3fn,ck,65,0,28.9421,a8w8_bpreshuffle_256x128x64x256_16x16_16x16_16x16x1_16x16x1_1x32x1x8_8x8x1_2x1_intrawave_v3,579.68,2400.25,0.0
gfx950,256,128,13312,16384,torch.float8_e4m3fn,ck,144,0,79.9061,a8w8_bpreshuffle_256x128x64x256_16x16_16x16_16x16x1_16x16x1_1x32x1x8_8x8x1_2x1_intrawave_v3,698.75,2798.4,0.0
gfx950,256,128,14336,8192,torch.float8_e4m3fn,ck,144,0,36.1842,a8w8_bpreshuffle_256x128x64x256_16x16_16x16_16x16x1_16x16x1_1x32x1x8_8x8x1_2x1_intrawave_v3,830.88,3376.03,0.0
gfx950,256,128,16384,2048,torch.float8_e4m3fn,ck,119,0,15.5043,a8w8_bpreshuffle_256x32x128x256_16x16_16x16_16x16x1_16x16x1_1x16x1x16_8x8x1_1x2_intrawave_v1,554.04,2451.63,0.0
gfx950,256,128,16384,4096,torch.float8_e4m3fn,ck,121,0,26.5935,a8w8_bpreshuffle_256x64x128x256_16x16_16x16_16x16x1_16x16x1_1x16x1x16_8x8x1_1x2_intrawave_v3,646.02,2700.94,0.0
gfx950,256,128,16384,6656,torch.float8_e4m3fn,ck,65,0,39.0387,a8w8_bpreshuffle_256x128x64x256_16x16_16x16_16x16x1_16x16x1_1x32x1x8_8x8x1_2x1_intrawave_v3,715.12,2922.69,0.0
gfx950,256,128,16384,8192,torch.float8_e4m3fn,ck,121,0,45.9107,a8w8_bpreshuffle_256x64x128x256_16x16_16x16_16x16x1_16x16x1_1x16x1x16_8x8x1_1x2_intrawave_v3,748.4,3037.65,0.0
gfx950,256,128,16384,13312,torch.float8_e4m3fn,ck,65,0,70.6454,a8w8_bpreshuffle_256x128x64x256_16x16_16x16_16x16x1_16x16x1_1x32x1x8_8x8x1_2x1_intrawave_v3,790.35,3170.79,0.0
gfx950,256,128,16384,26624,torch.float8_e4m3fn,ck,144,0,134.0597,a8w8_bpreshuffle_256x128x64x256_16x16_16x16_16x16x1_16x16x1_1x32x1x8_8x8x1_2x1_intrawave_v3,832.98,3310.54,0.0
gfx950,256,128,26624,16384,torch.float8_e4m3fn,ck,139,0,108.1175,a8w8_bpreshuffle_256x128x128x256_16x16_16x16_16x16x1_16x16x1_1x16x1x16_8x8x1_1x2_intrawave_v3,1032.85,4117.01,0.0
gfx950,256,128,51200,5120,torch.float8_e4m3fn,ck,154,0,65.6842,a8w8_bpreshuffle_256x128x256x256_16x16_16x16_16x16x1_16x16x1_1x16x1x16_8x8x1_1x2_intrawave_v3,1021.69,4200.5,0.0
gfx950,256,128,53248,16384,torch.float8_e4m3fn,ck,154,0,184.7497,a8w8_bpreshuffle_256x128x256x256_16x16_16x16_16x16x1_16x16x1_1x16x1x16_8x8x1_1x2_intrawave_v3,1208.87,4807.28,0.0
gfx950,256,128,57344,8192,torch.float8_e4m3fn,ck,54,0,95.8445,a8w8_bpreshuffle_256x160x256x128_16x16_16x16_8x32x1_8x32x1_1x32x1x8_8x8x1_2x1_intrawave_v3,1254.73,5065.4,0.0
gfx950,256,256,800,5120,torch.float8_e4m3fn,ck,24,0,11.6817,a8w8_bpreshuffle_128x16x32x512_16x16_16x16_32x4x1_32x4x1_1x16x1x8_4x4x1_1x1_intrawave_v2,179.52,497.9,0.0
gfx950,256,256,1280,8192,torch.float8_e4m3fn,ck,12,0,17.1516,a8w8_bpreshuffle_256x32x64x512_16x16_16x16_32x8x1_32x8x1_1x32x1x8_8x8x1_1x2_intrawave_v1,313.02,771.84,0.0
gfx950,256,256,2304,16384,torch.float8_e4m3fn,ck,15,0,52.6426,a8w8_bpreshuffle_256x16x64x256_16x16_16x16_16x16x1_16x16x1_1x16x1x16_4x4x1_1x1_intrawave_v1,367.14,819.16,0.0
gfx950,256,256,2560,8192,torch.float8_e4m3fn,ck,114,0,21.4545,a8w8_bpreshuffle_256x64x64x256_16x16_16x16_16x16x1_16x16x1_1x32x1x8_8x8x1_2x1_intrawave_v3,500.47,1136.33,0.0
gfx950,256,256,4608,16384,torch.float8_e4m3fn,ck,116,0,68.5478,a8w8_bpreshuffle_256x96x64x256_16x16_16x16_16x16x1_16x16x1_1x32x1x8_8x8x1_2x1_intrawave_v3,563.91,1196.99,0.0
gfx950,256,256,5120,640,torch.float8_e4m3fn,ck,76,0,7.7921,a8w8_bpreshuffle_256x32x64x128_16x16_16x16_8x32x1_8x32x1_1x32x1x8_8x8x1_2x1_intrawave_v1,215.31,777.98,0.0
gfx950,256,256,5120,1280,torch.float8_e4m3fn,ck,119,0,10.1726,a8w8_bpreshuffle_256x32x128x256_16x16_16x16_16x16x1_16x16x1_1x16x1x16_8x8x1_1x2_intrawave_v1,329.85,934.15,0.0
gfx950,256,256,5120,3200,torch.float8_e4m3fn,ck,77,0,19.1458,a8w8_bpreshuffle_256x64x64x128_16x16_16x16_8x32x1_8x32x1_1x32x1x8_8x8x1_2x1_intrawave_v3,438.14,1035.46,0.0
gfx950,256,256,5120,5120,torch.float8_e4m3fn,ck,116,0,25.9267,a8w8_bpreshuffle_256x96x64x256_16x16_16x16_16x16x1_16x16x1_1x32x1x8_8x8x1_2x1_intrawave_v3,517.68,1162.76,0.0
gfx950,256,256,5120,6400,torch.float8_e4m3fn,ck,65,0,28.085,a8w8_bpreshuffle_256x128x64x256_16x16_16x16_16x16x1_16x16x1_1x32x1x8_8x8x1_2x1_intrawave_v3,597.37,1318.42,0.0
gfx950,256,256,5120,25600,torch.float8_e4m3fn,ck,116,0,106.6527,a8w8_bpreshuffle_256x96x64x256_16x16_16x16_16x16x1_16x16x1_1x32x1x8_8x8x1_2x1_intrawave_v3,629.23,1314.99,0.0
gfx950,256,256,6400,5120,torch.float8_e4m3fn,ck,65,0,26.9347,a8w8_bpreshuffle_256x128x64x256_16x16_16x16_16x16x1_16x16x1_1x32x1x8_8x8x1_2x1_intrawave_v3,622.88,1386.89,0.0
gfx950,256,256,7168,8192,torch.float8_e4m3fn,ck,65,0,29.6374,a8w8_bpreshuffle_256x128x64x256_16x16_16x16_16x16x1_16x16x1_1x32x1x8_8x8x1_2x1_intrawave_v3,1014.42,2175.88,0.0
gfx950,256,256,8192,1024,torch.float8_e4m3fn,ck,77,0,9.7085,a8w8_bpreshuffle_256x64x64x128_16x16_16x16_8x32x1_8x32x1_1x32x1x8_8x8x1_2x1_intrawave_v3,442.39,1323.07,0.0
gfx950,256,256,8192,2048,torch.float8_e4m3fn,ck,114,0,11.9681,a8w8_bpreshuffle_256x64x64x256_16x16_16x16_16x16x1_16x16x1_1x32x1x8_8x8x1_2x1_intrawave_v3,717.74,1796.09,0.0
gfx950,256,256,8192,3584,torch.float8_e4m3fn,ck,144,0,16.6491,a8w8_bpreshuffle_256x128x64x256_16x16_16x16_16x16x1_16x16x1_1x32x1x8_8x8x1_2x1_intrawave_v3,902.89,2070.5,0.0
gfx950,256,256,8192,7168,torch.float8_e4m3fn,ck,65,0,28.6205,a8w8_bpreshuffle_256x128x64x256_16x16_16x16_16x16x1_16x16x1_1x32x1x8_8x8x1_2x1_intrawave_v3,1050.46,2262.35,0.0
gfx950,256,256,8192,8192,torch.float8_e4m3fn,ck,144,0,30.9086,a8w8_bpreshuffle_256x128x64x256_16x16_16x16_16x16x1_16x16x1_1x32x1x8_8x8x1_2x1_intrawave_v3,1111.66,2374.75,0.0
gfx950,256,256,8192,28672,torch.float8_e4m3fn,ck,65,0,95.3629,a8w8_bpreshuffle_256x128x64x256_16x16_16x16_16x16x1_16x16x1_1x32x1x8_8x8x1_2x1_intrawave_v3,1261.07,2583.98,0.0
gfx950,256,256,9216,16384,torch.float8_e4m3fn,ck,124,0,84.3085,a8w8_bpreshuffle_256x112x128x256_16x16_16x16_16x16x1_16x16x1_1x16x1x16_8x8x1_1x2_intrawave_v3,916.98,1896.7,0.0
gfx950,256,256,10240,8192,torch.float8_e4m3fn,ck,123,0,38.8017,a8w8_bpreshuffle_256x96x128x256_16x16_16x16_16x16x1_16x16x1_1x16x1x16_8x8x1_1x2_intrawave_v3,1106.9,2351.09,0.0
gfx950,256,256,12800,5120,torch.float8_e4m3fn,ck,139,0,34.8457,a8w8_bpreshuffle_256x128x128x256_16x16_16x16_16x16x1_16x16x1_1x16x1x16_8x8x1_1x2_intrawave_v3,962.94,2106.44,0.0
gfx950,256,256,13312,16384,torch.float8_e4m3fn,ck,139,0,92.6483,a8w8_bpreshuffle_256x128x128x256_16x16_16x16_16x16x1_16x16x1_1x16x1x16_8x8x1_1x2_intrawave_v3,1205.3,2472.94,0.0
gfx950,256,256,14336,8192,torch.float8_e4m3fn,ck,139,0,45.4901,a8w8_bpreshuffle_256x128x128x256_16x16_16x16_16x16x1_16x16x1_1x16x1x16_8x8x1_1x2_intrawave_v3,1321.82,2789.13,0.0
gfx950,256,256,16384,2048,torch.float8_e4m3fn,ck,139,0,18.9985,a8w8_bpreshuffle_256x128x128x256_16x16_16x16_16x16x1_16x16x1_1x16x1x16_8x8x1_1x2_intrawave_v3,904.28,2235.3,0.0
gfx950,256,256,16384,4096,torch.float8_e4m3fn,ck,63,0,32.6482,a8w8_bpreshuffle_256x128x128x256_16x16_16x16_16x16x1_16x16x1_1x32x1x8_8x8x1_2x1_intrawave_v3,1052.42,2344.57,0.0
gfx950,256,256,16384,6656,torch.float8_e4m3fn,ck,139,0,46.695,a8w8_bpreshuffle_256x128x128x256_16x16_16x16_16x16x1_16x16x1_1x16x1x16_8x8x1_1x2_intrawave_v3,1195.73,2551.55,0.0
gfx950,256,256,16384,8192,torch.float8_e4m3fn,ck,139,0,55.672,a8w8_bpreshuffle_256x128x128x256_16x16_16x16_16x16x1_16x16x1_1x16x1x16_8x8x1_1x2_intrawave_v3,1234.36,2599.21,0.0
gfx950,256,256,16384,13312,torch.float8_e4m3fn,ck,139,0,83.1524,a8w8_bpreshuffle_256x128x128x256_16x16_16x16_16x16x1_16x16x1_1x16x1x16_8x8x1_1x2_intrawave_v3,1342.95,2764.81,0.0
gfx950,256,256,16384,26624,torch.float8_e4m3fn,ck,139,0,163.3311,a8w8_bpreshuffle_256x128x128x256_16x16_16x16_16x16x1_16x16x1_1x16x1x16_8x8x1_1x2_intrawave_v3,1367.4,2763.78,0.0
gfx950,256,256,26624,16384,torch.float8_e4m3fn,ck,154,0,141.6113,a8w8_bpreshuffle_256x128x256x256_16x16_16x16_16x16x1_16x16x1_1x16x1x16_8x8x1_1x2_intrawave_v3,1577.12,3206.19,0.0
gfx950,256,256,51200,5120,torch.float8_e4m3fn,ck,154,0,97.921,a8w8_bpreshuffle_256x128x256x256_16x16_16x16_16x16x1_16x16x1_1x16x1x16_8x8x1_1x2_intrawave_v3,1370.67,2958.19,0.0
gfx950,256,256,53248,16384,torch.float8_e4m3fn,ck,154,0,276.3785,a8w8_bpreshuffle_256x128x256x256_16x16_16x16_16x16x1_16x16x1_1x16x1x16_8x8x1_1x2_intrawave_v3,1616.18,3270.42,0.0
gfx950,256,256,57344,8192,torch.float8_e4m3fn,ck,33,0,129.4795,a8w8_bpreshuffle_256x256x256x128_16x16_16x16_8x32x1_8x32x1_1x32x1x8_8x8x1_2x1_intrawave_v3,1857.58,3871.03,0.0
gfx950,256,512,800,5120,torch.float8_e4m3fn,ck,10,0,15.082,a8w8_bpreshuffle_128x16x32x512_16x16_16x16_32x4x1_32x4x1_1x16x1x8_4x4x1_1x1_intrawave_v1,278.1,499.71,0.0
gfx950,256,512,1280,8192,torch.float8_e4m3fn,ck,114,0,21.033,a8w8_bpreshuffle_256x64x64x256_16x16_16x16_16x16x1_16x16x1_1x32x1x8_8x8x1_2x1_intrawave_v3,510.5,760.27,0.0
gfx950,256,512,2304,16384,torch.float8_e4m3fn,ck,115,0,63.7872,a8w8_bpreshuffle_256x80x64x256_16x16_16x16_16x16x1_16x16x1_1x16x1x16_4x4x1_1x1_intrawave_v3,605.99,760.29,0.0
gfx950,256,512,2560,8192,torch.float8_e4m3fn,ck,113,0,27.2155,a8w8_bpreshuffle_256x48x64x256_16x16_16x16_16x16x1_16x16x1_1x16x1x16_4x4x1_1x1_intrawave_v1,789.07,1021.01,0.0
gfx950,256,512,4608,16384,torch.float8_e4m3fn,ck,124,0,84.5982,a8w8_bpreshuffle_256x112x128x256_16x16_16x16_16x16x1_16x16x1_1x16x1x16_8x8x1_1x2_intrawave_v3,913.84,1047.36,0.0
gfx950,256,512,5120,640,torch.float8_e4m3fn,ck,77,0,9.0563,a8w8_bpreshuffle_256x64x64x128_16x16_16x16_8x32x1_8x32x1_1x32x1x8_8x8x1_2x1_intrawave_v3,370.51,976.93,0.0
gfx950,256,512,5120,1280,torch.float8_e4m3fn,ck,77,0,12.8224,a8w8_bpreshuffle_256x64x64x128_16x16_16x16_8x32x1_8x32x1_1x32x1x8_8x8x1_2x1_intrawave_v3,523.37,971.1,0.0
gfx950,256,512,5120,3200,torch.float8_e4m3fn,ck,85,0,23.0489,a8w8_bpreshuffle_256x64x128x128_16x16_16x16_8x32x1_8x32x1_1x32x1x8_8x8x1_2x1_intrawave_v3,727.9,1009.39,0.0
gfx950,256,512,5120,5120,torch.float8_e4m3fn,ck,124,0,31.9895,a8w8_bpreshuffle_256x112x128x256_16x16_16x16_16x16x1_16x16x1_1x16x1x16_8x8x1_1x2_intrawave_v3,839.14,1065.31,0.0
gfx950,256,512,5120,6400,torch.float8_e4m3fn,ck,139,0,36.8067,a8w8_bpreshuffle_256x128x128x256_16x16_16x16_16x16x1_16x16x1_1x16x1x16_8x8x1_1x2_intrawave_v3,911.64,1121.74,0.0
gfx950,256,512,5120,25600,torch.float8_e4m3fn,ck,124,0,128.0705,a8w8_bpreshuffle_256x112x128x256_16x16_16x16_16x16x1_16x16x1_1x16x1x16_8x8x1_1x2_intrawave_v3,1048.0,1166.72,0.0
gfx950,256,512,6400,5120,torch.float8_e4m3fn,ck,124,0,33.3791,a8w8_bpreshuffle_256x112x128x256_16x16_16x16_16x16x1_16x16x1_1x16x1x16_8x8x1_1x2_intrawave_v3,1005.25,1256.57,0.0
gfx950,256,512,7168,8192,torch.float8_e4m3fn,ck,63,0,42.0669,a8w8_bpreshuffle_256x128x128x256_16x16_16x16_16x16x1_16x16x1_1x32x1x8_8x8x1_2x1_intrawave_v3,1429.38,1670.07,0.0
gfx950,256,512,8192,1024,torch.float8_e4m3fn,ck,85,0,11.5306,a8w8_bpreshuffle_256x64x128x128_16x16_16x16_8x32x1_8x32x1_1x32x1x8_8x8x1_2x1_intrawave_v3,744.97,1500.49,0.0
gfx950,256,512,8192,2048,torch.float8_e4m3fn,ck,139,0,15.6554,a8w8_bpreshuffle_256x128x128x256_16x16_16x16_16x16x1_16x16x1_1x16x1x16_8x8x1_1x2_intrawave_v3,1097.38,1674.46,0.0
gfx950,256,512,8192,3584,torch.float8_e4m3fn,ck,139,0,22.7592,a8w8_bpreshuffle_256x128x128x256_16x16_16x16_16x16x1_16x16x1_1x16x1x16_8x8x1_1x2_intrawave_v3,1320.99,1739.24,0.0
gfx950,256,512,8192,7168,torch.float8_e4m3fn,ck,139,0,39.3552,a8w8_bpreshuffle_256x128x128x256_16x16_16x16_16x16x1_16x16x1_1x16x1x16_8x8x1_1x2_intrawave_v3,1527.87,1798.46,0.0
gfx950,256,512,8192,8192,torch.float8_e4m3fn,ck,139,0,43.6902,a8w8_bpreshuffle_256x128x128x256_16x16_16x16_16x16x1_16x16x1_1x16x1x16_8x8x1_1x2_intrawave_v3,1572.88,1824.02,0.0
gfx950,256,512,8192,28672,torch.float8_e4m3fn,ck,139,0,133.9721,a8w8_bpreshuffle_256x128x128x256_16x16_16x16_16x16x1_16x16x1_1x16x1x16_8x8x1_1x2_intrawave_v3,1795.29,1925.4,0.0
gfx950,256,512,9216,16384,torch.float8_e4m3fn,ck,149,0,104.8693,a8w8_bpreshuffle_256x128x192x256_16x16_16x16_16x16x1_16x16x1_1x32x1x8_8x8x1_2x1_intrawave_v3,1474.4,1609.82,0.0
gfx950,256,512,10240,8192,torch.float8_e4m3fn,ck,143,0,55.4465,a8w8_bpreshuffle_256x192x128x128_16x16_16x16_8x32x1_8x32x1_1x16x1x16_8x8x1_1x2_intrawave_v3,1549.23,1777.68,0.0
gfx950,256,512,12800,5120,torch.float8_e4m3fn,ck,138,0,46.2157,a8w8_bpreshuffle_256x112x256x256_16x16_16x16_16x16x1_16x16x1_1x16x1x16_8x8x1_1x2_intrawave_v3,1452.08,1758.38,0.0
gfx950,256,512,13312,16384,torch.float8_e4m3fn,ck,154,0,127.8746,a8w8_bpreshuffle_256x128x256x256_16x16_16x16_16x16x1_16x16x1_1x16x1x16_8x8x1_1x2_intrawave_v3,1746.54,1877.81,0.0
gfx950,256,512,14336,8192,torch.float8_e4m3fn,ck,154,0,63.6195,a8w8_bpreshuffle_256x128x256x256_16x16_16x16_16x16x1_16x16x1_1x16x1x16_8x8x1_1x2_intrawave_v3,1890.29,2142.66,0.0
gfx950,256,512,16384,2048,torch.float8_e4m3fn,ck,154,0,27.0054,a8w8_bpreshuffle_256x128x256x256_16x16_16x16_16x16x1_16x16x1_1x16x1x16_8x8x1_1x2_intrawave_v3,1272.33,1902.59,0.0
gfx950,256,512,16384,4096,torch.float8_e4m3fn,ck,154,0,43.8782,a8w8_bpreshuffle_256x128x256x256_16x16_16x16_16x16x1_16x16x1_1x16x1x16_8x8x1_1x2_intrawave_v3,1566.14,1959.59,0.0
gfx950,256,512,16384,6656,torch.float8_e4m3fn,ck,154,0,64.427,a8w8_bpreshuffle_256x128x256x256_16x16_16x16_16x16x1_16x16x1_1x16x1x16_8x8x1_1x2_intrawave_v3,1733.27,2005.94,0.0
gfx950,256,512,16384,8192,torch.float8_e4m3fn,ck,154,0,73.6131,a8w8_bpreshuffle_256x128x256x256_16x16_16x16_16x16x1_16x16x1_1x16x1x16_8x8x1_1x2_intrawave_v3,1867.04,2108.17,0.0
gfx950,256,512,16384,13312,torch.float8_e4m3fn,ck,154,0,114.1614,a8w8_bpreshuffle_256x128x256x256_16x16_16x16_16x16x1_16x16x1_1x16x1x16_8x8x1_1x2_intrawave_v3,1956.34,2117.15,0.0
gfx950,256,512,16384,26624,torch.float8_e4m3fn,ck,154,0,214.713,a8w8_bpreshuffle_256x128x256x256_16x16_16x16_16x16x1_16x16x1_1x16x1x16_8x8x1_1x2_intrawave_v3,2080.34,2173.21,0.0
gfx950,256,512,26624,16384,torch.float8_e4m3fn,ck,154,0,250.2793,a8w8_bpreshuffle_256x128x256x256_16x16_16x16_16x16x1_16x16x1_1x16x1x16_8x8x1_1x2_intrawave_v3,1784.71,1885.33,0.0
gfx950,256,512,51200,5120,torch.float8_e4m3fn,ck,158,0,174.8476,a8w8_bpreshuffle_256x192x256x128_16x16_16x16_8x32x1_8x32x1_1x16x1x16_8x8x1_1x2_intrawave_v3,1535.25,1814.12,0.0
gfx950,256,512,53248,16384,torch.float8_e4m3fn,ck,154,0,492.8785,a8w8_bpreshuffle_256x128x256x256_16x16_16x16_16x16x1_16x16x1_1x16x1x16_8x8x1_1x2_intrawave_v3,1812.52,1897.69,0.0
gfx950,256,512,57344,8192,torch.float8_e4m3fn,ck,33,0,227.0683,a8w8_bpreshuffle_256x256x256x128_16x16_16x16_8x32x1_8x32x1_1x32x1x8_8x8x1_2x1_intrawave_v3,2118.47,2345.89,0.0
gfx950,256,1024,800,5120,torch.float8_e4m3fn,ck,24,0,24.558,a8w8_bpreshuffle_128x16x32x512_16x16_16x16_32x4x1_32x4x1_1x16x1x8_4x4x1_1x1_intrawave_v2,341.58,446.99,0.0
gfx950,256,1024,1280,8192,torch.float8_e4m3fn,ck,113,0,26.819,a8w8_bpreshuffle_256x48x64x256_16x16_16x16_16x16x1_16x16x1_1x16x1x16_4x4x1_1x1_intrawave_v1,800.73,801.51,0.0
gfx950,256,1024,2304,16384,torch.float8_e4m3fn,ck,124,0,81.3585,a8w8_bpreshuffle_256x112x128x256_16x16_16x16_16x16x1_16x16x1_1x16x1x16_8x8x1_1x2_intrawave_v3,950.23,728.19,0.0
gfx950,256,1024,2560,8192,torch.float8_e4m3fn,ck,123,0,37.4372,a8w8_bpreshuffle_256x96x128x256_16x16_16x16_16x16x1_16x16x1_1x16x1x16_8x8x1_1x2_intrawave_v3,1147.25,924.29,0.0
gfx950,256,1024,4608,16384,torch.float8_e4m3fn,ck,149,0,104.0599,a8w8_bpreshuffle_256x128x192x256_16x16_16x16_16x16x1_16x16x1_1x32x1x8_8x8x1_2x1_intrawave_v3,1485.86,977.44,0.0
gfx950,256,1024,5120,640,torch.float8_e4m3fn,ck,86,0,11.1521,a8w8_bpreshuffle_256x96x128x128_16x16_16x16_8x32x1_8x32x1_1x32x1x8_8x8x1_2x1_intrawave_v3,601.76,1292.84,0.0
gfx950,256,1024,5120,1280,torch.float8_e4m3fn,ck,86,0,16.1465,a8w8_bpreshuffle_256x96x128x128_16x16_16x16_8x32x1_8x32x1_1x32x1x8_8x8x1_2x1_intrawave_v3,831.25,1136.47,0.0
gfx950,256,1024,5120,3200,torch.float8_e4m3fn,ck,51,0,29.1651,a8w8_bpreshuffle_256x192x128x128_16x16_16x16_8x32x1_8x32x1_1x32x1x8_8x8x1_2x1_intrawave_v3,1150.5,1033.65,0.0
gfx950,256,1024,5120,5120,torch.float8_e4m3fn,ck,137,0,40.2614,a8w8_bpreshuffle_256x96x256x256_16x16_16x16_16x16x1_16x16x1_1x16x1x16_8x8x1_1x2_intrawave_v3,1333.46,1041.77,0.0
gfx950,256,1024,5120,6400,torch.float8_e4m3fn,ck,137,0,48.5222,a8w8_bpreshuffle_256x96x256x256_16x16_16x16_16x16x1_16x16x1_1x16x1x16_8x8x1_1x2_intrawave_v3,1383.05,1026.49,0.0
gfx950,256,1024,5120,25600,torch.float8_e4m3fn,ck,137,0,162.5939,a8w8_bpreshuffle_256x96x256x256_16x16_16x16_16x16x1_16x16x1_1x16x1x16_8x8x1_1x2_intrawave_v3,1650.96,1031.85,0.0
gfx950,256,1024,6400,5120,torch.float8_e4m3fn,ck,138,0,45.101,a8w8_bpreshuffle_256x112x256x256_16x16_16x16_16x16x1_16x16x1_1x16x1x16_8x8x1_1x2_intrawave_v3,1487.97,1133.41,0.0
gfx950,256,1024,7168,8192,torch.float8_e4m3fn,ck,154,0,62.2696,a8w8_bpreshuffle_256x128x256x256_16x16_16x16_16x16x1_16x16x1_1x16x1x16_8x8x1_1x2_intrawave_v3,1931.26,1313.46,0.0
gfx950,256,1024,8192,1024,torch.float8_e4m3fn,ck,0,0,16.8199,a8w8_bpreshuffle_256x128x128x128_16x16_16x16_8x32x1_8x32x1_1x32x1x8_8x8x1_2x1_intrawave_v3,1021.4,1558.53,0.0
gfx950,256,1024,8192,2048,torch.float8_e4m3fn,ck,154,0,23.1654,a8w8_bpreshuffle_256x128x256x256_16x16_16x16_16x16x1_16x16x1_1x16x1x16_8x8x1_1x2_intrawave_v3,1483.24,1539.0,0.0
gfx950,256,1024,8192,3584,torch.float8_e4m3fn,ck,154,0,34.8454,a8w8_bpreshuffle_256x128x256x256_16x16_16x16_16x16x1_16x16x1_1x16x1x16_8x8x1_1x2_intrawave_v3,1725.61,1429.38,0.0
gfx950,256,1024,8192,7168,torch.float8_e4m3fn,ck,154,0,59.0054,a8w8_bpreshuffle_256x128x256x256_16x16_16x16_16x16x1_16x16x1_1x16x1x16_8x8x1_1x2_intrawave_v3,2038.1,1403.9,0.0
gfx950,256,1024,8192,8192,torch.float8_e4m3fn,ck,154,0,64.2479,a8w8_bpreshuffle_256x128x256x256_16x16_16x16_16x16x1_16x16x1_1x16x1x16_8x8x1_1x2_intrawave_v3,2139.2,1436.23,0.0
gfx950,256,1024,8192,28672,torch.float8_e4m3fn,ck,154,0,197.2769,a8w8_bpreshuffle_256x128x256x256_16x16_16x16_16x16x1_16x16x1_1x16x1x16_8x8x1_1x2_intrawave_v3,2438.38,1424.49,0.0
gfx950,256,1024,9216,16384,torch.float8_e4m3fn,ck,54,0,178.1558,a8w8_bpreshuffle_256x160x256x128_16x16_16x16_8x32x1_8x32x1_1x32x1x8_8x8x1_2x1_intrawave_v3,1735.77,1047.66,0.0
gfx950,256,1024,10240,8192,torch.float8_e4m3fn,ck,158,0,83.5863,a8w8_bpreshuffle_256x192x256x128_16x16_16x16_8x32x1_8x32x1_1x16x1x16_8x8x1_1x2_intrawave_v3,2055.35,1354.84,0.0
gfx950,256,1024,12800,5120,torch.float8_e4m3fn,ck,138,0,86.9605,a8w8_bpreshuffle_256x112x256x256_16x16_16x16_16x16x1_16x16x1_1x16x1x16_8x8x1_1x2_intrawave_v3,1543.43,1115.37,0.0
gfx950,256,1024,13312,16384,torch.float8_e4m3fn,ck,154,0,243.5736,a8w8_bpreshuffle_256x128x256x256_16x16_16x16_16x16x1_16x16x1_1x16x1x16_8x8x1_1x2_intrawave_v3,1833.85,1076.24,0.0
gfx950,256,1024,14336,8192,torch.float8_e4m3fn,ck,33,0,112.839,a8w8_bpreshuffle_256x256x256x128_16x16_16x16_8x32x1_8x32x1_1x32x1x8_8x8x1_2x1_intrawave_v3,2131.52,1375.32,0.0
gfx950,256,1024,16384,2048,torch.float8_e4m3fn,ck,33,0,49.7279,a8w8_bpreshuffle_256x256x256x128_16x16_16x16_8x32x1_8x32x1_1x32x1x8_8x8x1_2x1_intrawave_v3,1381.91,1391.69,0.0
gfx950,256,1024,16384,4096,torch.float8_e4m3fn,ck,33,0,81.4525,a8w8_bpreshuffle_256x256x256x128_16x16_16x16_8x32x1_8x32x1_1x32x1x8_8x8x1_2x1_intrawave_v3,1687.35,1287.35,0.0
gfx950,256,1024,16384,6656,torch.float8_e4m3fn,ck,2,0,120.523,a8w8_bpreshuffle_256x256x256x128_16x16_16x16_8x32x1_8x32x1_1x32x1x8_8x8x1_1x2_intrawave_v3,1853.08,1239.78,0.0
gfx950,256,1024,16384,8192,torch.float8_e4m3fn,ck,154,0,136.0178,a8w8_bpreshuffle_256x128x256x256_16x16_16x16_16x16x1_16x16x1_1x16x1x16_8x8x1_1x2_intrawave_v3,2020.9,1295.13,0.0
gfx950,256,1024,16384,13312,torch.float8_e4m3fn,ck,154,0,214.8294,a8w8_bpreshuffle_256x128x256x256_16x16_16x16_16x16x1_16x16x1_1x16x1x16_8x8x1_1x2_intrawave_v3,2079.22,1234.89,0.0
gfx950,256,1024,16384,26624,torch.float8_e4m3fn,ck,154,0,412.5087,a8w8_bpreshuffle_256x128x256x256_16x16_16x16_16x16x1_16x16x1_1x16x1x16_8x8x1_1x2_intrawave_v3,2165.66,1204.88,0.0
gfx950,256,1024,26624,16384,torch.float8_e4m3fn,ck,33,0,467.1211,a8w8_bpreshuffle_256x256x256x128_16x16_16x16_8x32x1_8x32x1_1x32x1x8_8x8x1_2x1_intrawave_v3,1912.47,1086.47,0.0
gfx950,256,1024,51200,5120,torch.float8_e4m3fn,ck,40,0,288.5662,a8w8_bpreshuffle_256x224x256x128_16x16_16x16_8x32x1_8x32x1_1x32x1x8_8x8x1_2x1_intrawave_v3,1860.48,1289.98,0.0
gfx950,256,1024,53248,16384,torch.float8_e4m3fn,ck,154,0,850.624,a8w8_bpreshuffle_256x128x256x256_16x16_16x16_16x16x1_16x16x1_1x16x1x16_8x8x1_1x2_intrawave_v3,2100.47,1173.54,0.0
gfx950,256,1024,57344,8192,torch.float8_e4m3fn,ck,33,0,409.7151,a8w8_bpreshuffle_256x256x256x128_16x16_16x16_8x32x1_8x32x1_1x32x1x8_8x8x1_2x1_intrawave_v3,2348.15,1453.67,0.0
gfx950,256,2048,800,5120,torch.float8_e4m3fn,ck,24,0,41.7422,a8w8_bpreshuffle_128x16x32x512_16x16_16x16_32x4x1_32x4x1_1x16x1x8_4x4x1_1x1_intrawave_v2,401.92,427.83,0.0
gfx950,256,2048,1280,8192,torch.float8_e4m3fn,ck,123,0,36.7116,a8w8_bpreshuffle_256x96x128x256_16x16_16x16_16x16x1_16x16x1_1x16x1x16_8x8x1_1x2_intrawave_v3,1169.92,885.44,0.0
gfx950,256,2048,2304,16384,torch.float8_e4m3fn,ck,131,0,101.2648,a8w8_bpreshuffle_256x112x192x256_16x16_16x16_16x16x1_16x16x1_1x16x1x16_4x4x1_1x1_intrawave_v3,1526.88,797.32,0.0
gfx950,256,2048,2560,8192,torch.float8_e4m3fn,ck,138,0,55.1683,a8w8_bpreshuffle_256x112x256x256_16x16_16x16_16x16x1_16x16x1_1x16x1x16_8x8x1_1x2_intrawave_v3,1557.04,874.32,0.0
gfx950,256,2048,4608,16384,torch.float8_e4m3fn,ck,68,0,176.1003,a8w8_bpreshuffle_256x128x192x128_16x16_16x16_8x32x1_8x32x1_1x32x1x8_8x8x1_2x1_intrawave_v3,1756.03,726.44,0.0
gfx950,256,2048,5120,640,torch.float8_e4m3fn,ck,102,0,16.8369,a8w8_bpreshuffle_256x96x256x128_16x16_16x16_8x32x1_8x32x1_1x32x1x8_8x8x1_2x1_intrawave_v3,797.16,1518.04,0.0
gfx950,256,2048,5120,1280,torch.float8_e4m3fn,ck,102,0,24.8167,a8w8_bpreshuffle_256x96x256x128_16x16_16x16_8x32x1_8x32x1_1x32x1x8_8x8x1_2x1_intrawave_v3,1081.67,1214.77,0.0
gfx950,256,2048,5120,3200,torch.float8_e4m3fn,ck,158,0,41.6304,a8w8_bpreshuffle_256x192x256x128_16x16_16x16_8x32x1_8x32x1_1x16x1x16_8x8x1_1x2_intrawave_v3,1612.02,1054.74,0.0
gfx950,256,2048,5120,5120,torch.float8_e4m3fn,ck,102,0,71.8612,a8w8_bpreshuffle_256x96x256x128_16x16_16x16_8x32x1_8x32x1_1x32x1x8_8x8x1_2x1_intrawave_v3,1494.19,802.54,0.0
gfx950,256,2048,5120,6400,torch.float8_e4m3fn,ck,158,0,76.511,a8w8_bpreshuffle_256x192x256x128_16x16_16x16_8x32x1_8x32x1_1x16x1x16_8x8x1_1x2_intrawave_v3,1754.23,873.69,0.0
gfx950,256,2048,5120,25600,torch.float8_e4m3fn,ck,137,0,301.0835,a8w8_bpreshuffle_256x96x256x256_16x16_16x16_16x16x1_16x16x1_1x16x1x16_8x8x1_1x2_intrawave_v3,1783.13,679.12,0.0
gfx950,256,2048,6400,5120,torch.float8_e4m3fn,ck,138,0,84.6213,a8w8_bpreshuffle_256x112x256x256_16x16_16x16_16x16x1_16x16x1_1x16x1x16_8x8x1_1x2_intrawave_v3,1586.1,820.93,0.0
gfx950,256,2048,7168,8192,torch.float8_e4m3fn,ck,33,0,112.617,a8w8_bpreshuffle_256x256x256x128_16x16_16x16_8x32x1_8x32x1_1x32x1x8_8x8x1_2x1_intrawave_v3,2135.72,931.1,0.0
gfx950,256,2048,8192,1024,torch.float8_e4m3fn,ck,86,0,28.9708,a8w8_bpreshuffle_256x96x128x128_16x16_16x16_8x32x1_8x32x1_1x32x1x8_8x8x1_2x1_intrawave_v3,1186.01,1520.16,0.0
gfx950,256,2048,8192,2048,torch.float8_e4m3fn,ck,33,0,42.2356,a8w8_bpreshuffle_256x256x256x128_16x16_16x16_8x32x1_8x32x1_1x32x1x8_8x8x1_2x1_intrawave_v3,1627.05,1291.0,0.0
gfx950,256,2048,8192,3584,torch.float8_e4m3fn,ck,33,0,61.9146,a8w8_bpreshuffle_256x256x256x128_16x16_16x16_8x32x1_8x32x1_1x32x1x8_8x8x1_2x1_intrawave_v3,1942.34,1134.7,0.0
gfx950,256,2048,8192,7168,torch.float8_e4m3fn,ck,33,0,105.8446,a8w8_bpreshuffle_256x256x256x128_16x16_16x16_8x32x1_8x32x1_1x32x1x8_8x8x1_2x1_intrawave_v3,2272.37,1010.49,0.0
gfx950,256,2048,8192,8192,torch.float8_e4m3fn,ck,33,0,117.6729,a8w8_bpreshuffle_256x256x256x128_16x16_16x16_8x32x1_8x32x1_1x32x1x8_8x8x1_2x1_intrawave_v3,2335.95,998.03,0.0
gfx950,256,2048,8192,28672,torch.float8_e4m3fn,ck,33,0,357.8032,a8w8_bpreshuffle_256x256x256x128_16x16_16x16_8x32x1_8x32x1_1x32x1x8_8x8x1_2x1_intrawave_v3,2688.83,914.35,0.0
gfx950,256,2048,9216,16384,torch.float8_e4m3fn,ck,68,0,305.2233,a8w8_bpreshuffle_256x128x192x128_16x16_16x16_8x32x1_8x32x1_1x32x1x8_8x8x1_2x1_intrawave_v3,2026.3,728.31,0.0
gfx950,256,2048,10240,8192,torch.float8_e4m3fn,ck,158,0,156.1052,a8w8_bpreshuffle_256x192x256x128_16x16_16x16_8x32x1_8x32x1_1x16x1x16_8x8x1_1x2_intrawave_v3,2201.06,913.53,0.0
gfx950,256,2048,12800,5120,torch.float8_e4m3fn,ck,40,0,154.2962,a8w8_bpreshuffle_256x224x256x128_16x16_16x16_8x32x1_8x32x1_1x32x1x8_8x8x1_2x1_intrawave_v3,1739.74,832.49,0.0
gfx950,256,2048,13312,16384,torch.float8_e4m3fn,ck,138,0,457.646,a8w8_bpreshuffle_256x112x256x256_16x16_16x16_16x16x1_16x16x1_1x16x1x16_8x8x1_1x2_intrawave_v3,1952.06,669.04,0.0
gfx950,256,2048,14336,8192,torch.float8_e4m3fn,ck,54,0,205.0365,a8w8_bpreshuffle_256x160x256x128_16x16_16x16_8x32x1_8x32x1_1x32x1x8_8x8x1_2x1_intrawave_v3,2346.1,940.99,0.0
gfx950,256,2048,16384,2048,torch.float8_e4m3fn,ck,33,0,89.7238,a8w8_bpreshuffle_256x256x256x128_16x16_16x16_8x32x1_8x32x1_1x32x1x8_8x8x1_2x1_intrawave_v3,1531.8,1168.67,0.0
gfx950,256,2048,16384,4096,torch.float8_e4m3fn,ck,33,0,146.1468,a8w8_bpreshuffle_256x256x256x128_16x16_16x16_8x32x1_8x32x1_1x32x1x8_8x8x1_2x1_intrawave_v3,1880.83,975.77,0.0
gfx950,256,2048,16384,6656,torch.float8_e4m3fn,ck,33,0,216.3109,a8w8_bpreshuffle_256x256x256x128_16x16_16x16_8x32x1_8x32x1_1x32x1x8_8x8x1_2x1_intrawave_v3,2064.97,877.4,0.0
gfx950,256,2048,16384,8192,torch.float8_e4m3fn,ck,33,0,253.8314,a8w8_bpreshuffle_256x256x256x128_16x16_16x16_8x32x1_8x32x1_1x32x1x8_8x8x1_2x1_intrawave_v3,2165.83,859.25,0.0
gfx950,256,2048,16384,13312,torch.float8_e4m3fn,ck,33,0,388.9416,a8w8_bpreshuffle_256x256x256x128_16x16_16x16_8x32x1_8x32x1_1x32x1x8_8x8x1_2x1_intrawave_v3,2296.88,803.4,0.0
gfx950,256,2048,16384,26624,torch.float8_e4m3fn,ck,154,0,777.8647,a8w8_bpreshuffle_256x128x256x256_16x16_16x16_16x16x1_16x16x1_1x16x1x16_8x8x1_1x2_intrawave_v3,2296.94,717.15,0.0
gfx950,256,2048,26624,16384,torch.float8_e4m3fn,ck,154,0,848.1746,a8w8_bpreshuffle_256x128x256x256_16x16_16x16_16x16x1_16x16x1_1x16x1x16_8x8x1_1x2_intrawave_v3,2106.53,682.42,0.0
gfx950,256,2048,51200,5120,torch.float8_e4m3fn,ck,33,0,524.9075,a8w8_bpreshuffle_256x256x256x128_16x16_16x16_8x32x1_8x32x1_1x32x1x8_8x8x1_2x1_intrawave_v3,2045.58,918.91,0.0
gfx950,256,2048,53248,16384,torch.float8_e4m3fn,ck,33,0,1541.2203,a8w8_bpreshuffle_256x256x256x128_16x16_16x16_8x32x1_8x32x1_1x32x1x8_8x8x1_2x1_intrawave_v3,2318.56,729.34,0.0
gfx950,256,2048,57344,8192,torch.float8_e4m3fn,ck,33,0,762.0358,a8w8_bpreshuffle_256x256x256x128_16x16_16x16_8x32x1_8x32x1_1x32x1x8_8x8x1_2x1_intrawave_v3,2525.01,946.7,0.0
gfx950,256,4096,800,5120,torch.float8_e4m3fn,ck,69,0,50.1312,a8w8_bpreshuffle_256x128x160x128_16x16_16x16_8x32x1_8x32x1_1x64x1x4_8x8x1_2x1_intrawave_v3,669.33,630.77,0.0
gfx950,256,4096,1280,8192,torch.float8_e4m3fn,ck,137,0,53.9659,a8w8_bpreshuffle_256x96x256x256_16x16_16x16_16x16x1_16x16x1_1x16x1x16_8x8x1_1x2_intrawave_v3,1591.73,1010.38,0.0
gfx950,256,4096,2304,16384,torch.float8_e4m3fn,ck,68,0,177.9892,a8w8_bpreshuffle_256x128x192x128_16x16_16x16_8x32x1_8x32x1_1x32x1x8_8x8x1_2x1_intrawave_v3,1737.4,695.17,0.0
gfx950,256,4096,2560,8192,torch.float8_e4m3fn,ck,158,0,83.4719,a8w8_bpreshuffle_256x192x256x128_16x16_16x16_8x32x1_8x32x1_1x16x1x16_8x8x1_1x2_intrawave_v3,2058.16,904.47,0.0
gfx950,256,4096,4608,16384,torch.float8_e4m3fn,ck,68,0,307.0339,a8w8_bpreshuffle_256x128x192x128_16x16_16x16_8x32x1_8x32x1_1x32x1x8_8x8x1_2x1_intrawave_v3,2014.36,587.41,0.0
gfx950,256,4096,5120,640,torch.float8_e4m3fn,ck,102,0,28.9248,a8w8_bpreshuffle_256x96x256x128_16x16_16x16_8x32x1_8x32x1_1x32x1x8_8x8x1_2x1_intrawave_v3,928.05,1653.99,0.0
gfx950,256,4096,5120,1280,torch.float8_e4m3fn,ck,102,0,42.5949,a8w8_bpreshuffle_256x96x256x128_16x16_16x16_8x32x1_8x32x1_1x32x1x8_8x8x1_2x1_intrawave_v3,1260.41,1261.64,0.0
gfx950,256,4096,5120,3200,torch.float8_e4m3fn,ck,47,0,80.2905,a8w8_bpreshuffle_256x192x256x128_16x16_16x16_8x32x1_8x32x1_1x32x1x8_8x8x1_2x1_intrawave_v3,1671.65,889.7,0.0
gfx950,256,4096,5120,5120,torch.float8_e4m3fn,ck,138,0,121.2408,a8w8_bpreshuffle_256x112x256x256_16x16_16x16_16x16x1_16x16x1_1x16x1x16_8x8x1_1x2_intrawave_v3,1771.25,735.14,0.0
gfx950,256,4096,5120,6400,torch.float8_e4m3fn,ck,158,0,135.91,a8w8_bpreshuffle_256x192x256x128_16x16_16x16_8x32x1_8x32x1_1x16x1x16_8x8x1_1x2_intrawave_v3,1975.1,742.59,0.0
gfx950,256,4096,5120,25600,torch.float8_e4m3fn,ck,138,0,505.012,a8w8_bpreshuffle_256x112x256x256_16x16_16x16_16x16x1_16x16x1_1x16x1x16_8x8x1_1x2_intrawave_v3,2126.17,550.23,0.0
gfx950,256,4096,6400,5120,torch.float8_e4m3fn,ck,40,0,148.8986,a8w8_bpreshuffle_256x224x256x128_16x16_16x16_8x32x1_8x32x1_1x32x1x8_8x8x1_2x1_intrawave_v3,1802.81,713.02,0.0
gfx950,256,4096,7168,8192,torch.float8_e4m3fn,ck,156,0,206.7372,a8w8_bpreshuffle_256x160x256x128_16x16_16x16_8x32x1_8x32x1_1x16x1x16_8x8x1_1x2_intrawave_v3,2326.8,730.37,0.0
gfx950,256,4096,8192,1024,torch.float8_e4m3fn,ck,86,0,49.3525,a8w8_bpreshuffle_256x96x128x128_16x16_16x16_8x32x1_8x32x1_1x32x1x8_8x8x1_2x1_intrawave_v3,1392.42,1614.75,0.0
gfx950,256,4096,8192,2048,torch.float8_e4m3fn,ck,143,0,80.1603,a8w8_bpreshuffle_256x192x128x128_16x16_16x16_8x32x1_8x32x1_1x16x1x16_8x8x1_1x2_intrawave_v3,1714.55,1151.13,0.0
gfx950,256,4096,8192,3584,torch.float8_e4m3fn,ck,33,0,117.1442,a8w8_bpreshuffle_256x256x256x128_16x16_16x16_8x32x1_8x32x1_1x32x1x8_8x8x1_2x1_intrawave_v3,2053.18,948.82,0.0
gfx950,256,4096,8192,7168,torch.float8_e4m3fn,ck,33,0,196.6543,a8w8_bpreshuffle_256x256x256x128_16x16_16x16_8x32x1_8x32x1_1x32x1x8_8x8x1_2x1_intrawave_v3,2446.1,789.15,0.0
gfx950,256,4096,8192,8192,torch.float8_e4m3fn,ck,33,0,221.6286,a8w8_bpreshuffle_256x256x256x128_16x16_16x16_8x32x1_8x32x1_1x32x1x8_8x8x1_2x1_intrawave_v3,2480.53,757.0,0.0
gfx950,256,4096,8192,28672,torch.float8_e4m3fn,ck,33,0,686.9896,a8w8_bpreshuffle_256x256x256x128_16x16_16x16_8x32x1_8x32x1_1x32x1x8_8x8x1_2x1_intrawave_v3,2800.84,610.53,0.0
gfx950,256,4096,9216,16384,torch.float8_e4m3fn,ck,95,0,554.8485,a8w8_bpreshuffle_256x128x192x128_16x16_16x16_8x32x1_8x32x1_1x16x1x16_4x4x1_1x1_intrawave_v3,2229.35,529.16,0.0
gfx950,256,4096,10240,8192,torch.float8_e4m3fn,ck,106,0,283.3828,a8w8_bpreshuffle_256x224x256x128_16x16_16x16_8x32x1_8x32x1_1x16x1x16_4x4x1_1x1_intrawave_v3,2424.97,710.44,0.0
gfx950,256,4096,12800,5120,torch.float8_e4m3fn,ck,40,0,270.4291,a8w8_bpreshuffle_256x224x256x128_16x16_16x16_8x32x1_8x32x1_1x32x1x8_8x8x1_2x1_intrawave_v3,1985.26,707.64,0.0
gfx950,256,4096,13312,16384,torch.float8_e4m3fn,ck,154,0,842.3709,a8w8_bpreshuffle_256x128x256x256_16x16_16x16_16x16x1_16x16x1_1x16x1x16_8x8x1_1x2_intrawave_v3,2121.04,468.04,0.0
gfx950,256,4096,14336,8192,torch.float8_e4m3fn,ck,158,0,387.5867,a8w8_bpreshuffle_256x192x256x128_16x16_16x16_8x32x1_8x32x1_1x16x1x16_8x8x1_1x2_intrawave_v3,2482.21,692.58,0.0
gfx950,256,4096,16384,2048,torch.float8_e4m3fn,ck,102,0,160.9167,a8w8_bpreshuffle_256x96x256x128_16x16_16x16_8x32x1_8x32x1_1x32x1x8_8x8x1_2x1_intrawave_v3,1708.2,1094.73,0.0
gfx950,256,4096,16384,4096,torch.float8_e4m3fn,ck,33,0,255.2978,a8w8_bpreshuffle_256x256x256x128_16x16_16x16_8x32x1_8x32x1_1x32x1x8_8x8x1_2x1_intrawave_v3,2153.39,854.31,0.0
gfx950,256,4096,16384,6656,torch.float8_e4m3fn,ck,33,0,407.5508,a8w8_bpreshuffle_256x256x256x128_16x16_16x16_8x32x1_8x32x1_1x32x1x8_8x8x1_2x1_intrawave_v3,2192.0,663.8,0.0
gfx950,256,4096,16384,8192,torch.float8_e4m3fn,ck,33,0,471.5371,a8w8_bpreshuffle_256x256x256x128_16x16_16x16_8x32x1_8x32x1_1x32x1x8_8x8x1_2x1_intrawave_v3,2331.76,640.44,0.0
gfx950,256,4096,16384,13312,torch.float8_e4m3fn,ck,33,0,740.5043,a8w8_bpreshuffle_256x256x256x128_16x16_16x16_8x32x1_8x32x1_1x32x1x8_8x8x1_2x1_intrawave_v3,2412.82,549.42,0.0
gfx950,256,4096,16384,26624,torch.float8_e4m3fn,ck,33,0,1511.0293,a8w8_bpreshuffle_256x256x256x128_16x16_16x16_8x32x1_8x32x1_1x32x1x8_8x8x1_2x1_intrawave_v3,2364.89,449.68,0.0
gfx950,256,4096,26624,16384,torch.float8_e4m3fn,ck,33,0,1553.947,a8w8_bpreshuffle_256x256x256x128_16x16_16x16_8x32x1_8x32x1_1x32x1x8_8x8x1_2x1_intrawave_v3,2299.57,464.25,0.0
gfx950,256,4096,51200,5120,torch.float8_e4m3fn,ck,33,0,979.1344,a8w8_bpreshuffle_256x256x256x128_16x16_16x16_8x32x1_8x32x1_1x32x1x8_8x8x1_2x1_intrawave_v3,2193.25,717.52,0.0
gfx950,256,4096,53248,16384,torch.float8_e4m3fn,ck,33,0,2910.6751,a8w8_bpreshuffle_256x256x256x128_16x16_16x16_8x32x1_8x32x1_1x32x1x8_8x8x1_2x1_intrawave_v3,2455.38,472.65,0.0
gfx950,256,4096,57344,8192,torch.float8_e4m3fn,ck,33,0,1497.7395,a8w8_bpreshuffle_256x256x256x128_16x16_16x16_8x32x1_8x32x1_1x32x1x8_8x8x1_2x1_intrawave_v3,2569.4,649.7,0.0
gfx950,256,8192,800,5120,torch.float8_e4m3fn,ck,69,0,67.6989,a8w8_bpreshuffle_256x128x160x128_16x16_16x16_8x32x1_8x32x1_1x64x1x4_8x8x1_2x1_intrawave_v3,991.28,873.67,0.0
gfx950,256,8192,1280,8192,torch.float8_e4m3fn,ck,158,0,83.0796,a8w8_bpreshuffle_256x192x256x128_16x16_16x16_8x32x1_8x32x1_1x16x1x16_8x8x1_1x2_intrawave_v3,2067.88,1186.41,0.0
gfx950,256,8192,2304,16384,torch.float8_e4m3fn,ck,149,0,311.0895,a8w8_bpreshuffle_256x128x192x256_16x16_16x16_16x16x1_16x16x1_1x32x1x8_8x8x1_2x1_intrawave_v3,1988.09,674.13,0.0
gfx950,256,8192,2560,8192,torch.float8_e4m3fn,ck,158,0,155.4584,a8w8_bpreshuffle_256x192x256x128_16x16_16x16_8x32x1_8x32x1_1x16x1x16_8x8x1_1x2_intrawave_v3,2210.22,836.39,0.0
gfx950,256,8192,4608,16384,torch.float8_e4m3fn,ck,154,0,561.2735,a8w8_bpreshuffle_256x128x256x256_16x16_16x16_16x16x1_16x16x1_1x16x1x16_8x8x1_1x2_intrawave_v3,2203.83,508.15,0.0
gfx950,256,8192,5120,640,torch.float8_e4m3fn,ck,143,0,50.4892,a8w8_bpreshuffle_256x192x128x128_16x16_16x16_8x32x1_8x32x1_1x16x1x16_8x8x1_1x2_intrawave_v3,1063.34,1830.21,0.0
gfx950,256,8192,5120,1280,torch.float8_e4m3fn,ck,143,0,77.0321,a8w8_bpreshuffle_256x192x128x128_16x16_16x16_8x32x1_8x32x1_1x16x1x16_8x8x1_1x2_intrawave_v3,1393.89,1310.17,0.0
gfx950,256,8192,5120,3200,torch.float8_e4m3fn,ck,40,0,139.3777,a8w8_bpreshuffle_256x224x256x128_16x16_16x16_8x32x1_8x32x1_1x32x1x8_8x8x1_2x1_intrawave_v3,1925.96,907.49,0.0
gfx950,256,8192,5120,5120,torch.float8_e4m3fn,ck,154,0,215.948,a8w8_bpreshuffle_256x128x256x256_16x16_16x16_16x16x1_16x16x1_1x16x1x16_8x8x1_1x2_intrawave_v3,1988.89,704.07,0.0
gfx950,256,8192,5120,6400,torch.float8_e4m3fn,ck,40,0,242.9206,a8w8_bpreshuffle_256x224x256x128_16x16_16x16_8x32x1_8x32x1_1x32x1x8_8x8x1_2x1_intrawave_v3,2210.07,696.04,0.0
gfx950,256,8192,5120,25600,torch.float8_e4m3fn,ck,154,0,938.5635,a8w8_bpreshuffle_256x128x256x256_16x16_16x16_16x16x1_16x16x1_1x16x1x16_8x8x1_1x2_intrawave_v3,2288.05,452.47,0.0
gfx950,256,8192,6400,5120,torch.float8_e4m3fn,ck,40,0,270.3545,a8w8_bpreshuffle_256x224x256x128_16x16_16x16_8x32x1_8x32x1_1x32x1x8_8x8x1_2x1_intrawave_v3,1985.8,664.2,0.0
gfx950,256,8192,7168,8192,torch.float8_e4m3fn,ck,158,0,385.4824,a8w8_bpreshuffle_256x192x256x128_16x16_16x16_8x32x1_8x32x1_1x16x1x16_8x8x1_1x2_intrawave_v3,2495.76,631.08,0.0
gfx950,256,8192,8192,1024,torch.float8_e4m3fn,ck,51,0,92.436,a8w8_bpreshuffle_256x192x128x128_16x16_16x16_8x32x1_8x32x1_1x32x1x8_8x8x1_2x1_intrawave_v3,1486.86,1633.51,0.0
gfx950,256,8192,8192,2048,torch.float8_e4m3fn,ck,51,0,141.6683,a8w8_bpreshuffle_256x192x128x128_16x16_16x16_8x32x1_8x32x1_1x32x1x8_8x8x1_2x1_intrawave_v3,1940.29,1184.26,0.0
gfx950,256,8192,8192,3584,torch.float8_e4m3fn,ck,143,0,222.4514,a8w8_bpreshuffle_256x192x128x128_16x16_16x16_8x32x1_8x32x1_1x16x1x16_8x8x1_1x2_intrawave_v3,2162.43,867.33,0.0
gfx950,256,8192,8192,7168,torch.float8_e4m3fn,ck,33,0,383.1227,a8w8_bpreshuffle_256x256x256x128_16x16_16x16_8x32x1_8x32x1_1x32x1x8_8x8x1_2x1_intrawave_v3,2511.13,656.86,0.0
gfx950,256,8192,8192,8192,torch.float8_e4m3fn,ck,33,0,424.8317,a8w8_bpreshuffle_256x256x256x128_16x16_16x16_8x32x1_8x32x1_1x32x1x8_8x8x1_2x1_intrawave_v3,2588.11,631.86,0.0
gfx950,256,8192,8192,28672,torch.float8_e4m3fn,ck,33,0,1389.0293,a8w8_bpreshuffle_256x256x256x128_16x16_16x16_8x32x1_8x32x1_1x32x1x8_8x8x1_2x1_intrawave_v3,2770.49,434.82,0.0
gfx950,256,8192,9216,16384,torch.float8_e4m3fn,ck,154,0,1095.3193,a8w8_bpreshuffle_256x128x256x256_16x16_16x16_16x16x1_16x16x1_1x16x1x16_8x8x1_1x2_intrawave_v3,2258.61,398.25,0.0
gfx950,256,8192,10240,8192,torch.float8_e4m3fn,ck,33,0,533.4106,a8w8_bpreshuffle_256x256x256x128_16x16_16x16_8x32x1_8x32x1_1x32x1x8_8x8x1_2x1_intrawave_v3,2576.61,597.6,0.0
gfx950,256,8192,12800,5120,torch.float8_e4m3fn,ck,158,0,519.2638,a8w8_bpreshuffle_256x192x256x128_16x16_16x16_8x32x1_8x32x1_1x16x1x16_8x8x1_1x2_intrawave_v3,2067.82,610.85,0.0
gfx950,256,8192,13312,16384,torch.float8_e4m3fn,ck,33,0,1546.1027,a8w8_bpreshuffle_256x256x256x128_16x16_16x16_8x32x1_8x32x1_1x32x1x8_8x8x1_2x1_intrawave_v3,2311.24,368.94,0.0
gfx950,256,8192,14336,8192,torch.float8_e4m3fn,ck,33,0,734.9548,a8w8_bpreshuffle_256x256x256x128_16x16_16x16_8x32x1_8x32x1_1x32x1x8_8x8x1_2x1_intrawave_v3,2618.05,570.69,0.0
gfx950,256,8192,16384,2048,torch.float8_e4m3fn,ck,102,0,303.9224,a8w8_bpreshuffle_256x96x256x128_16x16_16x16_8x32x1_8x32x1_1x32x1x8_8x8x1_2x1_intrawave_v3,1808.87,1048.84,0.0
gfx950,256,8192,16384,4096,torch.float8_e4m3fn,ck,33,0,497.9337,a8w8_bpreshuffle_256x256x256x128_16x16_16x16_8x32x1_8x32x1_1x32x1x8_8x8x1_2x1_intrawave_v3,2208.15,741.26,0.0
gfx950,256,8192,16384,6656,torch.float8_e4m3fn,ck,33,0,770.3086,a8w8_bpreshuffle_256x256x256x128_16x16_16x16_8x32x1_8x32x1_1x32x1x8_8x8x1_2x1_intrawave_v3,2319.47,560.83,0.0
gfx950,256,8192,16384,8192,torch.float8_e4m3fn,ck,33,0,903.531,a8w8_bpreshuffle_256x256x256x128_16x16_16x16_8x32x1_8x32x1_1x32x1x8_8x8x1_2x1_intrawave_v3,2433.81,519.92,0.0
gfx950,256,8192,16384,13312,torch.float8_e4m3fn,ck,107,0,1430.2158,a8w8_bpreshuffle_256x256x256x128_16x16_16x16_8x32x1_8x32x1_1x16x1x16_4x4x1_1x1_intrawave_v3,2498.51,416.43,0.0
gfx950,256,8192,16384,26624,torch.float8_e4m3fn,ck,154,0,3033.7821,a8w8_bpreshuffle_256x128x256x256_16x16_16x16_16x16x1_16x16x1_1x16x1x16_8x8x1_1x2_intrawave_v3,2355.75,304.16,0.0
gfx950,256,8192,26624,16384,torch.float8_e4m3fn,ck,33,0,2904.3718,a8w8_bpreshuffle_256x256x256x128_16x16_16x16_8x32x1_8x32x1_1x32x1x8_8x8x1_2x1_intrawave_v3,2460.71,346.59,0.0
gfx950,256,8192,51200,5120,torch.float8_e4m3fn,ck,33,0,1857.9691,a8w8_bpreshuffle_256x256x256x128_16x16_16x16_8x32x1_8x32x1_1x32x1x8_8x8x1_2x1_intrawave_v3,2311.65,615.16,0.0
gfx950,256,8192,53248,16384,torch.float8_e4m3fn,ck,33,0,5722.4616,a8w8_bpreshuffle_256x256x256x128_16x16_16x16_8x32x1_8x32x1_1x32x1x8_8x8x1_2x1_intrawave_v3,2497.82,328.36,0.0
gfx950,256,8192,57344,8192,torch.float8_e4m3fn,ck,33,0,2991.7292,a8w8_bpreshuffle_256x256x256x128_16x16_16x16_8x32x1_8x32x1_1x32x1x8_8x8x1_2x1_intrawave_v3,2572.62,493.49,0.0
gfx950,256,16384,800,5120,torch.float8_e4m3fn,ck,69,0,108.6586,a8w8_bpreshuffle_256x128x160x128_16x16_16x16_8x32x1_8x32x1_1x64x1x4_8x8x1_2x1_intrawave_v3,1235.22,1050.97,0.0
gfx950,256,16384,1280,8192,torch.float8_e4m3fn,ck,158,0,157.7142,a8w8_bpreshuffle_256x192x256x128_16x16_16x16_8x32x1_8x32x1_1x16x1x16_8x8x1_1x2_intrawave_v3,2178.61,1183.45,0.0
gfx950,256,16384,2304,16384,torch.float8_e4m3fn,ck,154,0,577.0581,a8w8_bpreshuffle_256x128x256x256_16x16_16x16_16x16x1_16x16x1_1x16x1x16_8x8x1_1x2_intrawave_v3,2143.55,661.43,0.0
gfx950,256,16384,2560,8192,torch.float8_e4m3fn,ck,154,0,283.4813,a8w8_bpreshuffle_256x128x256x256_16x16_16x16_16x16x1_16x16x1_1x16x1x16_8x8x1_1x2_intrawave_v3,2424.13,843.35,0.0
gfx950,256,16384,4608,16384,torch.float8_e4m3fn,ck,154,0,1050.0065,a8w8_bpreshuffle_256x128x256x256_16x16_16x16_16x16x1_16x16x1_1x16x1x16_8x8x1_1x2_intrawave_v3,2356.08,471.36,0.0
gfx950,256,16384,5120,640,torch.float8_e4m3fn,ck,143,0,91.8209,a8w8_bpreshuffle_256x192x128x128_16x16_16x16_8x32x1_8x32x1_1x16x1x16_8x8x1_1x2_intrawave_v3,1169.39,1977.05,0.0
gfx950,256,16384,5120,1280,torch.float8_e4m3fn,ck,143,0,139.3615,a8w8_bpreshuffle_256x192x128x128_16x16_16x16_8x32x1_8x32x1_1x16x1x16_8x8x1_1x2_intrawave_v3,1540.94,1401.37,0.0
gfx950,256,16384,5120,3200,torch.float8_e4m3fn,ck,33,0,250.8978,a8w8_bpreshuffle_256x256x256x128_16x16_16x16_8x32x1_8x32x1_1x32x1x8_8x8x1_2x1_intrawave_v3,2139.8,942.95,0.0
gfx950,256,16384,5120,5120,torch.float8_e4m3fn,ck,33,0,403.9327,a8w8_bpreshuffle_256x256x256x128_16x16_16x16_8x32x1_8x32x1_1x32x1x8_8x8x1_2x1_intrawave_v3,2126.58,687.92,0.0
gfx950,256,16384,5120,6400,torch.float8_e4m3fn,ck,107,0,443.5168,a8w8_bpreshuffle_256x256x256x128_16x16_16x16_8x32x1_8x32x1_1x16x1x16_4x4x1_1x1_intrawave_v3,2420.97,688.58,0.0
gfx950,256,16384,5120,25600,torch.float8_e4m3fn,ck,154,0,1817.1823,a8w8_bpreshuffle_256x128x256x256_16x16_16x16_16x16x1_16x16x1_1x16x1x16_8x8x1_1x2_intrawave_v3,2363.53,395.27,0.0
gfx950,256,16384,6400,5120,torch.float8_e4m3fn,ck,154,0,516.4428,a8w8_bpreshuffle_256x128x256x256_16x16_16x16_16x16x1_16x16x1_1x16x1x16_8x8x1_1x2_intrawave_v3,2079.11,631.96,0.0
gfx950,256,16384,7168,8192,torch.float8_e4m3fn,ck,154,0,761.2665,a8w8_bpreshuffle_256x128x256x256_16x16_16x16_16x16x1_16x16x1_1x16x1x16_8x8x1_1x2_intrawave_v3,2527.56,561.98,0.0
gfx950,256,16384,8192,1024,torch.float8_e4m3fn,ck,143,0,172.4777,a8w8_bpreshuffle_256x192x128x128_16x16_16x16_8x32x1_8x32x1_1x16x1x16_8x8x1_1x2_intrawave_v3,1593.7,1702.26,0.0
gfx950,256,16384,8192,2048,torch.float8_e4m3fn,ck,51,0,272.4657,a8w8_bpreshuffle_256x192x128x128_16x16_16x16_8x32x1_8x32x1_1x32x1x8_8x8x1_2x1_intrawave_v3,2017.71,1169.93,0.0
gfx950,256,16384,8192,3584,torch.float8_e4m3fn,ck,33,0,421.1579,a8w8_bpreshuffle_256x256x256x128_16x16_16x16_8x32x1_8x32x1_1x32x1x8_8x8x1_2x1_intrawave_v3,2284.35,846.51,0.0
gfx950,256,16384,8192,7168,torch.float8_e4m3fn,ck,158,0,753.6754,a8w8_bpreshuffle_256x192x256x128_16x16_16x16_8x32x1_8x32x1_1x16x1x16_8x8x1_1x2_intrawave_v3,2553.02,589.9,0.0
gfx950,256,16384,8192,8192,torch.float8_e4m3fn,ck,158,0,852.0249,a8w8_bpreshuffle_256x192x256x128_16x16_16x16_8x32x1_8x32x1_1x16x1x16_8x8x1_1x2_intrawave_v3,2580.94,551.35,0.0
gfx950,256,16384,8192,28672,torch.float8_e4m3fn,ck,33,0,2785.3542,a8w8_bpreshuffle_256x256x256x128_16x16_16x16_8x32x1_8x32x1_1x32x1x8_8x8x1_2x1_intrawave_v3,2763.23,349.36,0.0
gfx950,256,16384,9216,16384,torch.float8_e4m3fn,ck,33,0,2047.2744,a8w8_bpreshuffle_256x256x256x128_16x16_16x16_8x32x1_8x32x1_1x32x1x8_8x8x1_2x1_intrawave_v3,2416.78,352.38,0.0
gfx950,256,16384,10240,8192,torch.float8_e4m3fn,ck,33,0,1068.7185,a8w8_bpreshuffle_256x256x256x128_16x16_16x16_8x32x1_8x32x1_1x32x1x8_8x8x1_2x1_intrawave_v3,2572.03,518.05,0.0
gfx950,256,16384,12800,5120,torch.float8_e4m3fn,ck,33,0,974.5645,a8w8_bpreshuffle_256x256x256x128_16x16_16x16_8x32x1_8x32x1_1x32x1x8_8x8x1_2x1_intrawave_v3,2203.53,583.7,0.0
gfx950,256,16384,13312,16384,torch.float8_e4m3fn,ck,33,0,2958.4415,a8w8_bpreshuffle_256x256x256x128_16x16_16x16_8x32x1_8x32x1_1x32x1x8_8x8x1_2x1_intrawave_v3,2415.74,311.9,0.0
gfx950,256,16384,14336,8192,torch.float8_e4m3fn,ck,158,0,1477.5648,a8w8_bpreshuffle_256x192x256x128_16x16_16x16_8x32x1_8x32x1_1x16x1x16_8x8x1_1x2_intrawave_v3,2604.48,488.25,0.0
gfx950,256,16384,16384,2048,torch.float8_e4m3fn,ck,102,0,598.3663,a8w8_bpreshuffle_256x96x256x128_16x16_16x16_8x32x1_8x32x1_1x32x1x8_8x8x1_2x1_intrawave_v3,1837.52,1009.38,0.0
gfx950,256,16384,16384,4096,torch.float8_e4m3fn,ck,33,0,988.8674,a8w8_bpreshuffle_256x256x256x128_16x16_16x16_8x32x1_8x32x1_1x32x1x8_8x8x1_2x1_intrawave_v3,2223.78,678.64,0.0
gfx950,256,16384,16384,6656,torch.float8_e4m3fn,ck,33,0,1537.3785,a8w8_bpreshuffle_256x256x256x128_16x16_16x16_8x32x1_8x32x1_1x32x1x8_8x8x1_2x1_intrawave_v3,2324.35,491.08,0.0
gfx950,256,16384,16384,8192,torch.float8_e4m3fn,ck,33,0,1794.5054,a8w8_bpreshuffle_256x256x256x128_16x16_16x16_8x32x1_8x32x1_1x32x1x8_8x8x1_2x1_intrawave_v3,2450.84,448.76,0.0
gfx950,256,16384,16384,13312,torch.float8_e4m3fn,ck,33,0,2976.2278,a8w8_bpreshuffle_256x256x256x128_16x16_16x16_8x32x1_8x32x1_1x32x1x8_8x8x1_2x1_intrawave_v3,2401.3,326.95,0.0
gfx950,256,16384,16384,26624,torch.float8_e4m3fn,ck,154,0,6167.0855,a8w8_bpreshuffle_256x128x256x256_16x16_16x16_16x16x1_16x16x1_1x16x1x16_8x8x1_1x2_intrawave_v3,2317.73,228.52,0.0
gfx950,256,16384,26624,16384,torch.float8_e4m3fn,ck,33,0,5797.7818,a8w8_bpreshuffle_256x256x256x128_16x16_16x16_8x32x1_8x32x1_1x32x1x8_8x8x1_2x1_intrawave_v3,2465.37,272.01,0.0
gfx950,256,16384,51200,5120,torch.float8_e4m3fn,ck,33,0,3711.513,a8w8_bpreshuffle_256x256x256x128_16x16_16x16_8x32x1_8x32x1_1x32x1x8_8x8x1_2x1_intrawave_v3,2314.4,545.26,0.0
gfx950,256,16384,53248,16384,torch.float8_e4m3fn,ck,33,0,11284.2706,a8w8_bpreshuffle_256x256x256x128_16x16_16x16_8x32x1_8x32x1_1x32x1x8_8x8x1_2x1_intrawave_v3,2533.38,255.73,0.0
gfx950,256,16384,57344,8192,torch.float8_e4m3fn,ck,33,0,5984.2692,a8w8_bpreshuffle_256x256x256x128_16x16_16x16_8x32x1_8x32x1_1x32x1x8_8x8x1_2x1_intrawave_v3,2572.27,414.93,0.0
gfx950,256,32768,800,5120,torch.float8_e4m3fn,ck,69,0,196.771,a8w8_bpreshuffle_256x128x160x128_16x16_16x16_8x32x1_8x32x1_1x64x1x4_8x8x1_2x1_intrawave_v3,1364.2,1139.89,0.0
gfx950,256,32768,1280,8192,torch.float8_e4m3fn,ck,154,0,288.2725,a8w8_bpreshuffle_256x128x256x256_16x16_16x16_16x16x1_16x16x1_1x16x1x16_8x8x1_1x2_intrawave_v3,2383.84,1258.56,0.0
gfx950,256,32768,2304,16384,torch.float8_e4m3fn,ck,154,0,1073.694,a8w8_bpreshuffle_256x128x256x256_16x16_16x16_16x16x1_16x16x1_1x16x1x16_8x8x1_1x2_intrawave_v3,2304.1,675.81,0.0
gfx950,256,32768,2560,8192,torch.float8_e4m3fn,ck,158,0,549.7961,a8w8_bpreshuffle_256x192x256x128_16x16_16x16_8x32x1_8x32x1_1x16x1x16_8x8x1_1x2_intrawave_v3,2499.82,831.54,0.0
gfx950,256,32768,4608,16384,torch.float8_e4m3fn,ck,154,0,2120.2853,a8w8_bpreshuffle_256x128x256x256_16x16_16x16_16x16x1_16x16x1_1x16x1x16_8x8x1_1x2_intrawave_v3,2333.55,431.24,0.0
gfx950,256,32768,5120,640,torch.float8_e4m3fn,ck,143,0,181.1291,a8w8_bpreshuffle_256x192x128x128_16x16_16x16_8x32x1_8x32x1_1x16x1x16_8x8x1_1x2_intrawave_v3,1185.61,1986.39,0.0
gfx950,256,32768,5120,1280,torch.float8_e4m3fn,ck,102,0,269.995,a8w8_bpreshuffle_256x96x256x128_16x16_16x16_8x32x1_8x32x1_1x32x1x8_8x8x1_2x1_intrawave_v3,1590.76,1422.4,0.0
gfx950,256,32768,5120,3200,torch.float8_e4m3fn,ck,33,0,492.1153,a8w8_bpreshuffle_256x256x256x128_16x16_16x16_8x32x1_8x32x1_1x32x1x8_8x8x1_2x1_intrawave_v3,2181.89,928.21,0.0
gfx950,256,32768,5120,5120,torch.float8_e4m3fn,ck,33,0,764.8154,a8w8_bpreshuffle_256x256x256x128_16x16_16x16_8x32x1_8x32x1_1x32x1x8_8x8x1_2x1_intrawave_v3,2246.28,692.36,0.0
gfx950,256,32768,5120,6400,torch.float8_e4m3fn,ck,33,0,868.9521,a8w8_bpreshuffle_256x256x256x128_16x16_16x16_8x32x1_8x32x1_1x32x1x8_8x8x1_2x1_intrawave_v3,2471.35,665.2,0.0
gfx950,256,32768,5120,25600,torch.float8_e4m3fn,ck,154,0,3714.3301,a8w8_bpreshuffle_256x128x256x256_16x16_16x16_16x16x1_16x16x1_1x16x1x16_8x8x1_1x2_intrawave_v3,2312.65,351.47,0.0
gfx950,256,32768,6400,5120,torch.float8_e4m3fn,ck,33,0,980.8335,a8w8_bpreshuffle_256x256x256x128_16x16_16x16_8x32x1_8x32x1_1x32x1x8_8x8x1_2x1_intrawave_v3,2189.45,632.09,0.0
gfx950,256,32768,7168,8192,torch.float8_e4m3fn,ck,158,0,1484.7467,a8w8_bpreshuffle_256x192x256x128_16x16_16x16_8x32x1_8x32x1_1x16x1x16_8x8x1_1x2_intrawave_v3,2591.88,536.74,0.0
gfx950,256,32768,8192,1024,torch.float8_e4m3fn,ck,143,0,340.0384,a8w8_bpreshuffle_256x192x128x128_16x16_16x16_8x32x1_8x32x1_1x16x1x16_8x8x1_1x2_intrawave_v3,1616.75,1702.2,0.0
gfx950,256,32768,8192,2048,torch.float8_e4m3fn,ck,143,0,536.6149,a8w8_bpreshuffle_256x192x128x128_16x16_16x16_8x32x1_8x32x1_1x16x1x16_8x8x1_1x2_intrawave_v3,2048.98,1156.8,0.0
gfx950,256,32768,8192,3584,torch.float8_e4m3fn,ck,51,0,841.2106,a8w8_bpreshuffle_256x192x128x128_16x16_16x16_8x32x1_8x32x1_1x32x1x8_8x8x1_2x1_intrawave_v3,2287.35,812.72,0.0
gfx950,256,32768,8192,7168,torch.float8_e4m3fn,ck,158,0,1500.7026,a8w8_bpreshuffle_256x192x256x128_16x16_16x16_8x32x1_8x32x1_1x16x1x16_8x8x1_1x2_intrawave_v3,2564.33,553.39,0.0
gfx950,256,32768,8192,8192,torch.float8_e4m3fn,ck,158,0,1696.016,a8w8_bpreshuffle_256x192x256x128_16x16_16x16_8x32x1_8x32x1_1x16x1x16_8x8x1_1x2_intrawave_v3,2593.16,514.39,0.0
gfx950,256,32768,8192,28672,torch.float8_e4m3fn,ck,33,0,5558.3544,a8w8_bpreshuffle_256x256x256x128_16x16_16x16_8x32x1_8x32x1_1x32x1x8_8x8x1_2x1_intrawave_v3,2769.37,307.87,0.0
gfx950,256,32768,9216,16384,torch.float8_e4m3fn,ck,33,0,4103.0357,a8w8_bpreshuffle_256x256x256x128_16x16_16x16_8x32x1_8x32x1_1x32x1x8_8x8x1_2x1_intrawave_v3,2411.78,314.85,0.0
gfx950,256,32768,10240,8192,torch.float8_e4m3fn,ck,158,0,2102.9024,a8w8_bpreshuffle_256x192x256x128_16x16_16x16_8x32x1_8x32x1_1x16x1x16_8x8x1_1x2_intrawave_v3,2614.27,486.67,0.0
gfx950,256,32768,12800,5120,torch.float8_e4m3fn,ck,33,0,1888.3681,a8w8_bpreshuffle_256x256x256x128_16x16_16x16_8x32x1_8x32x1_1x32x1x8_8x8x1_2x1_intrawave_v3,2274.43,567.78,0.0
gfx950,256,32768,13312,16384,torch.float8_e4m3fn,ck,33,0,6036.8682,a8w8_bpreshuffle_256x256x256x128_16x16_16x16_8x32x1_8x32x1_1x32x1x8_8x8x1_2x1_intrawave_v3,2367.73,269.58,0.0
gfx950,256,32768,14336,8192,torch.float8_e4m3fn,ck,158,0,2945.0068,a8w8_bpreshuffle_256x192x256x128_16x16_16x16_8x32x1_8x32x1_1x16x1x16_8x8x1_1x2_intrawave_v3,2613.43,450.05,0.0
gfx950,256,32768,16384,2048,torch.float8_e4m3fn,ck,102,0,1180.9193,a8w8_bpreshuffle_256x96x256x128_16x16_16x16_8x32x1_8x32x1_1x32x1x8_8x8x1_2x1_intrawave_v3,1862.13,994.48,0.0
gfx950,256,32768,16384,4096,torch.float8_e4m3fn,ck,33,0,1989.9333,a8w8_bpreshuffle_256x256x256x128_16x16_16x16_8x32x1_8x32x1_1x32x1x8_8x8x1_2x1_intrawave_v3,2210.15,640.76,0.0
gfx950,256,32768,16384,6656,torch.float8_e4m3fn,ck,33,0,3099.1632,a8w8_bpreshuffle_256x256x256x128_16x16_16x16_8x32x1_8x32x1_1x32x1x8_8x8x1_2x1_intrawave_v3,2306.05,452.02,0.0
gfx950,256,32768,16384,8192,torch.float8_e4m3fn,ck,33,0,3588.7344,a8w8_bpreshuffle_256x256x256x128_16x16_16x16_8x32x1_8x32x1_1x32x1x8_8x8x1_2x1_intrawave_v3,2451.03,411.4,0.0
gfx950,256,32768,16384,13312,torch.float8_e4m3fn,ck,33,0,5598.3345,a8w8_bpreshuffle_256x256x256x128_16x16_16x16_8x32x1_8x32x1_1x32x1x8_8x8x1_2x1_intrawave_v3,2553.2,308.67,0.0
gfx950,256,32768,16384,26624,torch.float8_e4m3fn,ck,154,0,12187.7899,a8w8_bpreshuffle_256x128x256x256_16x16_16x16_16x16x1_16x16x1_1x16x1x16_8x8x1_1x2_intrawave_v3,2345.57,195.47,0.0
gfx950,256,32768,26624,16384,torch.float8_e4m3fn,ck,33,0,11524.899,a8w8_bpreshuffle_256x256x256x128_16x16_16x16_8x32x1_8x32x1_1x32x1x8_8x8x1_2x1_intrawave_v3,2480.48,235.83,0.0
gfx950,256,32768,51200,5120,torch.float8_e4m3fn,ck,33,0,7575.0119,a8w8_bpreshuffle_256x256x256x128_16x16_16x16_8x32x1_8x32x1_1x32x1x8_8x8x1_2x1_intrawave_v3,2267.97,499.72,0.0
gfx950,256,32768,53248,16384,torch.float8_e4m3fn,ck,33,0,22600.3968,a8w8_bpreshuffle_256x256x256x128_16x16_16x16_8x32x1_8x32x1_1x32x1x8_8x8x1_2x1_intrawave_v3,2529.81,216.76,0.0
gfx950,256,32768,57344,8192,torch.float8_e4m3fn,ck,158,0,11963.3054,a8w8_bpreshuffle_256x192x256x128_16x16_16x16_8x32x1_8x32x1_1x16x1x16_8x8x1_1x2_intrawave_v3,2573.4,375.84,0.0
gfx942,304,64,1536,5120,torch.int8,asm,0,1,16.7759,_ZN5aiter41I8gemm_bf16_perTokenI8_BpreShuffle_16x128E,60.0,500.04,0.0
gfx942,304,128,1536,5120,torch.int8,asm,0,1,17.9602,_ZN5aiter41I8gemm_bf16_perTokenI8_BpreShuffle_16x128E,112.1,496.26,0.0
gfx942,304,256,1536,5120,torch.int8,asm,0,1,17.6791,_ZN5aiter41I8gemm_bf16_perTokenI8_BpreShuffle_16x128E,227.76,563.46,0.0
gfx942,304,512,1536,5120,torch.int8,asm,1,1,18.7067,_ZN5aiter41I8gemm_bf16_perTokenI8_BpreShuffle_32x128E,430.49,644.62,0.0
gfx942,304,1024,1536,5120,torch.int8,asm,2,1,21.0125,_ZN5aiter41I8gemm_bf16_perTokenI8_BpreShuffle_48x128E,766.5,773.49,0.0
gfx942,304,1664,1536,5120,torch.int8,asm,4,1,27.6261,_ZN5aiter41I8gemm_bf16_perTokenI8_BpreShuffle_80x128E,947.38,778.1,0.0
gfx942,304,4096,1536,5120,torch.int8,asm,6,1,63.8361,_ZN5aiter42I8gemm_bf16_perTokenI8_BpreShuffle_112x256E,1009.22,648.83,0.0
gfx942,304,8192,1536,5120,torch.int8,asm,6,1,128.8567,_ZN5aiter42I8gemm_bf16_perTokenI8_BpreShuffle_112x256E,999.94,581.83,0.0
gfx942,304,10240,1536,5120,torch.int8,asm,6,1,142.1441,_ZN5aiter42I8gemm_bf16_perTokenI8_BpreShuffle_112x256E,1133.08,645.47,0.0
gfx942,304,12288,1536,5120,torch.int8,asm,7,1,185.0056,_ZN5aiter42I8gemm_bf16_perTokenI8_BpreShuffle_128x128E,1044.69,586.62,0.0
gfx942,304,16384,1536,5120,torch.int8,asm,6,1,211.7054,_ZN5aiter42I8gemm_bf16_perTokenI8_BpreShuffle_112x256E,1217.25,671.13,0.0
gfx942,304,20480,1536,5120,torch.int8,asm,6,1,271.7016,_ZN5aiter42I8gemm_bf16_perTokenI8_BpreShuffle_112x256E,1185.57,646.43,0.0
gfx942,304,24576,1536,5120,torch.int8,asm,6,1,328.3654,_ZN5aiter42I8gemm_bf16_perTokenI8_BpreShuffle_112x256E,1177.19,637.07,0.0
gfx942,304,30720,1536,5120,torch.int8,asm,6,1,402.8387,_ZN5aiter42I8gemm_bf16_perTokenI8_BpreShuffle_112x256E,1199.45,644.23,0.0
gfx942,304,32768,1536,5120,torch.int8,asm,6,1,406.391,_ZN5aiter42I8gemm_bf16_perTokenI8_BpreShuffle_112x256E,1268.23,679.89,0.0
gfx942,304,40960,1536,5120,torch.int8,asm,6,1,525.9013,_ZN5aiter42I8gemm_bf16_perTokenI8_BpreShuffle_112x256E,1225.03,652.99,0.0
gfx942,304,64,5120,1280,torch.int8,asm,0,1,7.7424,_ZN5aiter41I8gemm_bf16_perTokenI8_BpreShuffle_16x128E,108.35,941.68,0.0
gfx942,304,128,5120,1280,torch.int8,asm,1,1,8.5797,_ZN5aiter41I8gemm_bf16_perTokenI8_BpreShuffle_32x128E,195.55,935.72,0.0
gfx942,304,256,5120,1280,torch.int8,asm,2,1,9.2104,_ZN5aiter41I8gemm_bf16_perTokenI8_BpreShuffle_48x128E,364.31,1031.74,0.0
gfx942,304,512,5120,1280,torch.int8,asm,4,1,11.2508,_ZN5aiter41I8gemm_bf16_perTokenI8_BpreShuffle_80x128E,596.48,1106.75,0.0
gfx942,304,1024,5120,1280,torch.int8,asm,6,1,18.2637,_ZN5aiter42I8gemm_bf16_perTokenI8_BpreShuffle_112x256E,734.89,1004.73,0.0
gfx942,304,1664,5120,1280,torch.int8,asm,6,1,21.5241,_ZN5aiter42I8gemm_bf16_perTokenI8_BpreShuffle_112x256E,1013.3,1195.07,0.0
gfx942,304,4096,5120,1280,torch.int8,asm,6,1,58.5804,_ZN5aiter42I8gemm_bf16_perTokenI8_BpreShuffle_112x256E,916.47,917.36,0.0
gfx942,304,8192,5120,1280,torch.int8,asm,6,1,105.657,_ZN5aiter42I8gemm_bf16_perTokenI8_BpreShuffle_112x256E,1016.25,955.22,0.0
gfx942,304,10240,5120,1280,torch.int8,asm,6,1,133.9571,_ZN5aiter42I8gemm_bf16_perTokenI8_BpreShuffle_112x256E,1001.95,929.54,0.0
gfx942,304,12288,5120,1280,torch.int8,asm,6,1,153.8919,_ZN5aiter42I8gemm_bf16_perTokenI8_BpreShuffle_112x256E,1046.59,962.44,0.0
gfx942,304,16384,5120,1280,torch.int8,asm,6,1,195.4489,_ZN5aiter42I8gemm_bf16_perTokenI8_BpreShuffle_112x256E,1098.74,999.22,0.0
gfx942,304,20480,5120,1280,torch.int8,asm,6,1,245.7639,_ZN5aiter42I8gemm_bf16_perTokenI8_BpreShuffle_112x256E,1092.25,986.65,0.0
gfx942,304,24576,5120,1280,torch.int8,asm,6,1,290.5831,_ZN5aiter42I8gemm_bf16_perTokenI8_BpreShuffle_112x256E,1108.54,996.85,0.0
gfx942,304,30720,5120,1280,torch.int8,asm,6,1,361.4235,_ZN5aiter42I8gemm_bf16_perTokenI8_BpreShuffle_112x256E,1114.08,997.3,0.0
gfx942,304,32768,5120,1280,torch.int8,asm,6,1,379.1231,_ZN5aiter42I8gemm_bf16_perTokenI8_BpreShuffle_112x256E,1132.87,1012.97,0.0
gfx942,304,40960,5120,1280,torch.int8,asm,6,1,475.7676,_ZN5aiter42I8gemm_bf16_perTokenI8_BpreShuffle_112x256E,1128.43,1005.56,0.0
gfx942,80,128,128,5120,torch.int8,asm,0,8,7.3189,_ZN5aiter41I8gemm_bf16_perTokenI8_BpreShuffle_16x128E,22.92,183.56,0.182
gfx942,80,192,128,5120,torch.int8,asm,1,8,7.5835,_ZN5aiter41I8gemm_bf16_perTokenI8_BpreShuffle_32x128E,33.18,222.53,0.1825
gfx942,80,128,1280,8192,torch.int8,asm,3,4,14.7532,_ZN5aiter41I8gemm_bf16_perTokenI8_BpreShuffle_64x128E,181.95,804.03,0.1279
gfx942,80,192,1280,1024,torch.int8,asm,1,1,6.7934,_ZN5aiter41I8gemm_bf16_perTokenI8_BpreShuffle_32x128E,74.09,294.23,0.0
gfx942,80,192,1280,5120,torch.int8,asm,5,4,14.7099,_ZN5aiter41I8gemm_bf16_perTokenI8_BpreShuffle_96x128E,171.08,545.77,0.1266
gfx942,80,192,1280,8192,torch.int8,asm,5,4,19.1633,_ZN5aiter41I8gemm_bf16_perTokenI8_BpreShuffle_96x128E,210.12,654.91,0.1288
gfx942,80,256,1280,8192,torch.int8,asm,3,2,22.3885,_ZN5aiter41I8gemm_bf16_perTokenI8_BpreShuffle_64x128E,239.8,591.3,0.0662
gfx942,80,320,1280,8192,torch.int8,asm,4,2,25.8821,_ZN5aiter41I8gemm_bf16_perTokenI8_BpreShuffle_80x128E,259.29,538.07,0.0666
gfx942,80,512,1280,8192,torch.int8,asm,3,1,34.2419,_ZN5aiter41I8gemm_bf16_perTokenI8_BpreShuffle_64x128E,313.58,466.99,0.0
gfx942,80,1024,1280,8192,torch.int8,asm,7,1,60.6271,_ZN5aiter42I8gemm_bf16_perTokenI8_BpreShuffle_128x128E,354.21,354.56,0.0
gfx942,80,2048,1280,8192,torch.int8,asm,7,1,118.4251,_ZN5aiter42I8gemm_bf16_perTokenI8_BpreShuffle_128x128E,362.67,274.48,0.0
gfx942,80,4096,1280,8192,torch.int8,asm,7,1,233.2788,_ZN5aiter42I8gemm_bf16_perTokenI8_BpreShuffle_128x128E,368.23,233.74,0.0
gfx942,80,8192,1280,8192,torch.int8,asm,6,1,453.0835,_ZN5aiter42I8gemm_bf16_perTokenI8_BpreShuffle_112x256E,379.18,217.55,0.0
gfx942,80,16384,1280,8192,torch.int8,asm,7,1,926.2119,_ZN5aiter42I8gemm_bf16_perTokenI8_BpreShuffle_128x128E,370.97,201.52,0.0
gfx942,80,64,1536,5120,torch.int8,asm,3,6,10.6691,_ZN5aiter41I8gemm_bf16_perTokenI8_BpreShuffle_64x128E,94.35,786.25,0.1567
gfx942,80,80,1536,5120,torch.int8,asm,4,6,11.6667,_ZN5aiter41I8gemm_bf16_perTokenI8_BpreShuffle_80x128E,107.85,730.26,0.1588
gfx942,80,128,1536,5120,torch.int8,asm,3,3,14.8921,_ZN5aiter41I8gemm_bf16_perTokenI8_BpreShuffle_64x128E,135.19,598.5,0.1017
gfx942,80,150,1536,5120,torch.int8,asm,4,3,15.3652,_ZN5aiter41I8gemm_bf16_perTokenI8_BpreShuffle_80x128E,153.55,591.8,0.1017
gfx942,80,192,1536,1024,torch.int8,asm,1,1,6.9538,_ZN5aiter41I8gemm_bf16_perTokenI8_BpreShuffle_32x128E,86.86,339.28,0.0
gfx942,80,192,1536,5120,torch.int8,asm,3,2,17.2532,_ZN5aiter41I8gemm_bf16_perTokenI8_BpreShuffle_64x128E,175.03,546.98,0.0645
gfx942,80,220,1536,5120,torch.int8,asm,4,2,18.9054,_ZN5aiter41I8gemm_bf16_perTokenI8_BpreShuffle_80x128E,183.03,511.31,0.0653
gfx942,80,256,1536,5120,torch.int8,asm,5,2,20.7976,_ZN5aiter41I8gemm_bf16_perTokenI8_BpreShuffle_96x128E,193.61,478.97,0.0645
gfx942,80,384,1536,5120,torch.int8,asm,3,1,24.6804,_ZN5aiter41I8gemm_bf16_perTokenI8_BpreShuffle_64x128E,244.72,446.1,0.0
gfx942,80,448,1536,5120,torch.int8,asm,4,1,27.7779,_ZN5aiter41I8gemm_bf16_perTokenI8_BpreShuffle_80x128E,253.67,415.23,0.0
gfx942,80,512,1536,5120,torch.int8,asm,5,1,32.3204,_ZN5aiter41I8gemm_bf16_perTokenI8_BpreShuffle_96x128E,249.16,373.1,0.0
gfx942,80,128,8192,1024,torch.int8,asm,7,1,15.3831,_ZN5aiter42I8gemm_bf16_perTokenI8_BpreShuffle_128x128E,139.6,690.16,0.0
gfx942,80,192,8192,1024,torch.int8,asm,6,1,18.2548,_ZN5aiter42I8gemm_bf16_perTokenI8_BpreShuffle_112x256E,176.46,642.62,0.0
gfx942,80,192,8192,5120,torch.int8,asm,6,1,60.0549,_ZN5aiter42I8gemm_bf16_perTokenI8_BpreShuffle_112x256E,268.19,767.16,0.0
gfx942,80,256,8192,1024,torch.int8,asm,7,1,28.1363,_ZN5aiter42I8gemm_bf16_perTokenI8_BpreShuffle_128x128E,152.65,456.53,0.0
gfx942,80,320,8192,1024,torch.int8,asm,3,1,32.0764,_ZN5aiter41I8gemm_bf16_perTokenI8_BpreShuffle_64x128E,167.37,435.18,0.0
gfx942,80,512,8192,1024,torch.int8,asm,6,1,33.8085,_ZN5aiter42I8gemm_bf16_perTokenI8_BpreShuffle_112x256E,254.08,511.75,0.0
gfx942,80,1024,8192,1024,torch.int8,asm,6,1,64.2316,_ZN5aiter42I8gemm_bf16_perTokenI8_BpreShuffle_112x256E,267.47,408.12,0.0
gfx942,80,2048,8192,1024,torch.int8,asm,6,1,123.9609,_ZN5aiter42I8gemm_bf16_perTokenI8_BpreShuffle_112x256E,277.18,355.27,0.0
gfx942,80,4096,8192,1024,torch.int8,asm,6,1,232.1688,_ZN5aiter42I8gemm_bf16_perTokenI8_BpreShuffle_112x256E,295.99,343.25,0.0
gfx942,80,8192,8192,1024,torch.int8,asm,6,1,459.697,_ZN5aiter42I8gemm_bf16_perTokenI8_BpreShuffle_112x256E,298.98,328.47,0.0
gfx942,80,16384,8192,1024,torch.int8,asm,6,1,900.9508,_ZN5aiter42I8gemm_bf16_perTokenI8_BpreShuffle_112x256E,305.1,325.88,0.0
gfx950,256,64,192,1024,torch.float8_e4m3fn,flydsl,989,0,3.199,flydsl_bpreshuflle_16x64x512_F8_F8_B16_1x0x0x3_default,7.87,89.63,0.0
gfx950,256,32,384,7168,torch.float8_e4m3fn,ck,10,0,10.6799,a8w8_bpreshuffle_128x16x32x512_16x16_16x16_32x4x1_32x4x1_1x16x1x8_4x4x1_1x1_intrawave_v1,16.49,281.51,0.0
gfx950,256,64,384,7168,torch.float8_e4m3fn,ck,10,0,10.0171,a8w8_bpreshuffle_128x16x32x512_16x16_16x16_32x4x1_32x4x1_1x16x1x8_4x4x1_1x1_intrawave_v1,35.17,325.49,0.0
gfx950,256,96,384,7168,torch.float8_e4m3fn,ck,8,0,10.3046,a8w8_bpreshuffle_128x32x16x512_16x16_16x16_32x4x1_32x4x1_1x32x1x4_4x4x1_1x1_intrawave_v1,51.29,341.05,0.0
gfx950,256,256,384,7168,torch.float8_e4m3fn,ck,10,0,9.4593,a8w8_bpreshuffle_128x16x32x512_16x16_16x16_32x4x1_32x4x1_1x16x1x8_4x4x1_1x1_intrawave_v1,148.98,505.76,0.0
gfx950,256,512,384,7168,torch.float8_e4m3fn,flydsl,767,0,11.6866,flydsl_bpreshuflle_16x64x512_F8_F8_B16_2x0x1x2_default,241.18,583.21,0.0
gfx950,256,1024,384,7168,torch.float8_e4m3fn,flydsl,776,0,13.3134,flydsl_bpreshuflle_32x64x512_F8_F8_B16_2x0x1x2_default,423.42,817.14,0.0
gfx950,256,2048,384,7168,torch.float8_e4m3fn,cktile,152,0,18.6948,a8w8_bpreshuffle_cktile_0x0x8x4x1x0x0x0x0x4_32x64x512_1x4x1_16x16x128_default,603.07,1016.62,0.0
gfx950,256,4096,384,7168,torch.float8_e4m3fn,flydsl,458,0,25.4051,flydsl_bpreshuflle_64x64x256_F8_F8_B16_2x0x1x1_default,887.56,1387.85,0.0
gfx950,256,8192,384,7168,torch.float8_e4m3fn,flydsl,792,0,34.7994,flydsl_bpreshuflle_64x192x256_F8_F8_B16_2x0x1x2_default,1295.92,1947.28,0.0
gfx950,256,16384,384,7168,torch.float8_e4m3fn,ck,149,0,54.0722,a8w8_bpreshuffle_256x128x192x256_16x16_16x16_16x16x1_16x16x1_1x32x1x8_8x8x1_2x1_intrawave_v3,1668.03,2455.53,0.0
gfx950,256,1,800,5120,torch.float8_e4m3fn,ck,10,0,8.6917,a8w8_bpreshuffle_128x16x32x512_16x16_16x16_32x4x1_32x4x1_1x16x1x8_4x4x1_1x1_intrawave_v1,0.94,472.03,0.0
gfx950,256,16,800,5120,torch.float8_e4m3fn,ck,10,0,8.2944,a8w8_bpreshuffle_128x16x32x512_16x16_16x16_32x4x1_32x4x1_1x16x1x8_4x4x1_1x1_intrawave_v1,15.8,506.79,0.0
gfx950,256,32,800,5120,torch.float8_e4m3fn,ck,8,0,8.5999,a8w8_bpreshuffle_128x32x16x512_16x16_16x16_32x4x1_32x4x1_1x32x1x4_4x4x1_1x1_intrawave_v1,30.48,501.29,0.0
gfx950,256,64,800,5120,torch.float8_e4m3fn,ck,10,0,8.3239,a8w8_bpreshuffle_128x16x32x512_16x16_16x16_32x4x1_32x4x1_1x16x1x8_4x4x1_1x1_intrawave_v1,62.99,543.75,0.0
gfx950,256,128,800,5120,torch.float8_e4m3fn,ck,24,0,8.2591,a8w8_bpreshuffle_128x16x32x512_16x16_16x16_32x4x1_32x4x1_1x16x1x8_4x4x1_1x1_intrawave_v2,126.96,600.08,0.0
gfx950,256,256,800,5120,torch.float8_e4m3fn,ck,10,0,9.7206,a8w8_bpreshuffle_128x16x32x512_16x16_16x16_32x4x1_32x4x1_1x16x1x8_4x4x1_1x1_intrawave_v1,215.74,598.35,0.0
gfx950,256,512,800,5120,torch.float8_e4m3fn,ck,10,0,14.8326,a8w8_bpreshuffle_128x16x32x512_16x16_16x16_32x4x1_32x4x1_1x16x1x8_4x4x1_1x1_intrawave_v1,282.78,508.11,0.0
gfx950,256,1024,800,5120,torch.float8_e4m3fn,ck,10,0,22.0756,a8w8_bpreshuffle_128x16x32x512_16x16_16x16_32x4x1_32x4x1_1x16x1x8_4x4x1_1x1_intrawave_v1,379.99,497.26,0.0
gfx950,256,2048,800,5120,torch.float8_e4m3fn,ck,10,0,39.1074,a8w8_bpreshuffle_128x16x32x512_16x16_16x16_32x4x1_32x4x1_1x16x1x8_4x4x1_1x1_intrawave_v1,429.0,456.65,0.0
gfx950,256,4096,800,5120,torch.float8_e4m3fn,ck,69,0,42.7898,a8w8_bpreshuffle_256x128x160x128_16x16_16x16_8x32x1_8x32x1_1x64x1x4_8x8x1_2x1_intrawave_v3,784.17,738.99,0.0
gfx950,256,8192,800,5120,torch.float8_e4m3fn,ck,69,0,55.2653,a8w8_bpreshuffle_256x128x160x128_16x16_16x16_8x32x1_8x32x1_1x64x1x4_8x8x1_2x1_intrawave_v3,1214.3,1070.22,0.0
gfx950,256,16384,800,5120,torch.float8_e4m3fn,ck,69,0,96.4525,a8w8_bpreshuffle_256x128x160x128_16x16_16x16_8x32x1_8x32x1_1x64x1x4_8x8x1_2x1_intrawave_v3,1391.54,1183.97,0.0
gfx950,256,32768,800,5120,torch.float8_e4m3fn,ck,57,0,170.0227,a8w8_bpreshuffle_256x160x160x128_16x16_16x16_8x32x1_8x32x1_1x32x1x8_4x4x1_1x1_intrawave_v3,1578.82,1319.22,0.0
gfx950,256,96,1024,7168,torch.float8_e4m3fn,ck,10,0,10.9919,a8w8_bpreshuffle_128x16x32x512_16x16_16x16_32x4x1_32x4x1_1x16x1x8_4x4x1_1x1_intrawave_v1,128.21,748.26,0.0
gfx950,256,128,1024,7168,torch.float8_e4m3fn,ck,8,0,11.0339,a8w8_bpreshuffle_128x32x16x512_16x16_16x16_32x4x1_32x4x1_1x32x1x4_4x4x1_1x1_intrawave_v1,170.3,772.14,0.0
gfx950,256,256,1024,7168,torch.float8_e4m3fn,ck,11,0,11.9595,a8w8_bpreshuffle_256x16x64x512_16x16_16x16_32x8x1_32x8x1_1x16x1x16_4x4x1_1x1_intrawave_v1,314.24,811.01,0.0
gfx950,256,512,1024,7168,torch.float8_e4m3fn,cktile,9,0,13.7695,a8w8_bpreshuffle_cktile_0x0x8x4x1x0x0x0x0x1_32x64x512_1x4x1_16x16x128_default,545.86,875.75,0.0
gfx950,256,1024,1024,7168,torch.float8_e4m3fn,ck,114,0,19.6079,a8w8_bpreshuffle_256x64x64x256_16x16_16x16_16x16x1_16x16x1_1x32x1x8_8x8x1_2x1_intrawave_v3,766.65,855.64,0.0
gfx950,256,2048,1024,7168,torch.float8_e4m3fn,flydsl,626,0,27.5555,flydsl_bpreshuflle_64x128x256_F8_F8_B16_2x1x1x1_default,1091.06,951.33,0.0
gfx950,256,4096,1024,7168,torch.float8_e4m3fn,flydsl,1280,0,40.8095,flydsl_bpreshuflle_128x128x256_F8_F8_B16_2x1x1x3_default,1473.42,1104.86,0.0
gfx950,256,8192,1024,7168,torch.float8_e4m3fn,ck,154,0,62.6397,a8w8_bpreshuffle_256x128x256x256_16x16_16x16_16x16x1_16x16x1_1x16x1x16_8x8x1_1x2_intrawave_v3,1919.85,1322.44,0.0
gfx950,256,16384,1024,7168,torch.float8_e4m3fn,ck,33,0,110.6249,a8w8_bpreshuffle_256x256x256x128_16x16_16x16_8x32x1_8x32x1_1x32x1x8_8x8x1_2x1_intrawave_v3,2174.18,1431.28,0.0
gfx950,256,1,1280,8192,torch.float8_e4m3fn,ck,10,0,12.7699,a8w8_bpreshuffle_128x16x32x512_16x16_16x16_32x4x1_32x4x1_1x16x1x8_4x4x1_1x1_intrawave_v1,1.64,821.97,0.0
gfx950,256,16,1280,8192,torch.float8_e4m3fn,ck,10,0,12.5805,a8w8_bpreshuffle_128x16x32x512_16x16_16x16_32x4x1_32x4x1_1x16x1x8_4x4x1_1x1_intrawave_v1,26.67,847.17,0.0
gfx950,256,32,1280,8192,torch.float8_e4m3fn,ck,10,0,11.5596,a8w8_bpreshuffle_128x16x32x512_16x16_16x16_32x4x1_32x4x1_1x16x1x8_4x4x1_1x1_intrawave_v1,58.05,936.87,0.0
gfx950,256,64,1280,8192,torch.float8_e4m3fn,ck,8,0,11.6259,a8w8_bpreshuffle_128x32x16x512_16x16_16x16_32x4x1_32x4x1_1x32x1x4_4x4x1_1x1_intrawave_v1,115.45,961.12,0.0
gfx950,256,128,1280,8192,torch.float8_e4m3fn,ck,11,0,12.3468,a8w8_bpreshuffle_256x16x64x512_16x16_16x16_32x8x1_32x8x1_1x16x1x16_4x4x1_1x1_intrawave_v1,217.41,960.74,0.0
gfx950,256,256,1280,8192,torch.float8_e4m3fn,cktile,9,0,14.9227,a8w8_bpreshuffle_cktile_0x0x8x4x1x0x0x0x0x1_32x64x512_1x4x1_16x16x128_default,359.77,887.12,0.0
gfx950,256,512,1280,8192,torch.float8_e4m3fn,ck,114,0,20.8376,a8w8_bpreshuffle_256x64x64x256_16x16_16x16_16x16x1_16x16x1_1x32x1x8_8x8x1_2x1_intrawave_v3,515.29,767.4,0.0
gfx950,256,1024,1280,8192,torch.float8_e4m3fn,cktile,216,0,27.0331,a8w8_bpreshuffle_cktile_0x0x8x4x1x0x0x0x0x3_48x64x256_1x4x1_16x16x128_default,794.39,795.17,0.0
gfx950,256,2048,1280,8192,torch.float8_e4m3fn,cktile,99,0,36.1565,a8w8_bpreshuffle_cktile_0x0x8x4x1x0x0x0x0x1_96x128x256_1x4x1_16x16x128_default,1187.88,899.03,0.0
gfx950,256,4096,1280,8192,torch.float8_e4m3fn,ck,138,0,57.904,a8w8_bpreshuffle_256x112x256x256_16x16_16x16_16x16x1_16x16x1_1x16x1x16_8x8x1_1x2_intrawave_v3,1483.48,941.66,0.0
gfx950,256,8192,1280,8192,torch.float8_e4m3fn,ck,51,0,94.2147,a8w8_bpreshuffle_256x192x128x128_16x16_16x16_8x32x1_8x32x1_1x32x1x8_8x8x1_2x1_intrawave_v3,1823.48,1046.19,0.0
gfx950,256,16384,1280,8192,torch.float8_e4m3fn,ck,154,0,170.1443,a8w8_bpreshuffle_256x128x256x256_16x16_16x16_16x16x1_16x16x1_1x16x1x16_8x8x1_1x2_intrawave_v3,2019.45,1096.99,0.0
gfx950,256,32768,1280,8192,torch.float8_e4m3fn,ck,154,0,293.2178,a8w8_bpreshuffle_256x128x256x256_16x16_16x16_16x16x1_16x16x1_1x16x1x16_8x8x1_1x2_intrawave_v3,2343.63,1237.33,0.0
gfx950,256,32,2112,7168,torch.float8_e4m3fn,ck,8,0,10.4988,a8w8_bpreshuffle_128x32x16x512_16x16_16x16_32x4x1_32x4x1_1x32x1x4_4x4x1_1x1_intrawave_v1,92.29,1476.68,0.0
gfx950,256,96,2112,7168,torch.float8_e4m3fn,cktile,137,0,12.0882,a8w8_bpreshuffle_cktile_0x0x8x4x1x0x0x0x0x3_16x64x512_1x4x1_16x16x128_default,240.45,1342.83,0.0
gfx950,256,128,2112,7168,torch.float8_e4m3fn,ck,5,0,13.7387,a8w8_bpreshuffle_256x16x64x512_16x16_16x16_32x8x1_32x8x1_1x16x1x16_4x4x1_1x1_intrawave_v1,282.09,1208.05,0.0
gfx950,256,8192,2112,7168,torch.float8_e4m3fn,flydsl,485,0,119.6395,flydsl_bpreshuflle_128x192x128_F8_F8_B16_2x0x1x1_default,2073.18,906.57,0.0
gfx950,256,1,2304,16384,torch.float8_e4m3fn,cktile,2,0,23.5282,a8w8_bpreshuffle_cktile_0x0x8x4x1x0x0x0x0x1_16x64x512_1x4x1_16x16x128_default,3.21,1605.3,0.0
gfx950,256,16,2304,16384,torch.float8_e4m3fn,ck,10,0,21.4115,a8w8_bpreshuffle_128x16x32x512_16x16_16x16_32x4x1_32x4x1_1x16x1x8_4x4x1_1x1_intrawave_v1,56.42,1778.7,0.0
gfx950,256,32,2304,16384,torch.float8_e4m3fn,ck,10,0,21.3018,a8w8_bpreshuffle_128x16x32x512_16x16_16x16_32x4x1_32x4x1_1x16x1x8_4x4x1_1x1_intrawave_v1,113.41,1803.63,0.0
gfx950,256,64,2304,16384,torch.float8_e4m3fn,ck,5,0,23.2067,a8w8_bpreshuffle_256x16x64x512_16x16_16x16_32x8x1_32x8x1_1x16x1x16_4x4x1_1x1_intrawave_v1,208.21,1684.52,0.0
gfx950,256,128,2304,16384,torch.float8_e4m3fn,cktile,152,0,27.897,a8w8_bpreshuffle_cktile_0x0x8x4x1x0x0x0x0x4_32x64x512_1x4x1_16x16x128_default,346.41,1449.46,0.0
gfx950,256,256,2304,16384,torch.float8_e4m3fn,ck,114,0,39.2871,a8w8_bpreshuffle_256x64x64x256_16x16_16x16_16x16x1_16x16x1_1x32x1x8_8x8x1_2x1_intrawave_v3,491.95,1097.63,0.0
gfx950,256,512,2304,16384,torch.float8_e4m3fn,cktile,117,0,48.8917,a8w8_bpreshuffle_cktile_0x0x8x4x1x0x0x0x0x2_80x64x256_1x4x1_16x16x128_default,790.62,991.92,0.0
gfx950,256,1024,2304,16384,torch.float8_e4m3fn,cktile,92,0,64.6028,a8w8_bpreshuffle_cktile_0x0x8x4x1x0x0x0x0x1_80x128x256_1x4x1_16x16x128_default,1196.69,917.06,0.0
gfx950,256,2048,2304,16384,torch.float8_e4m3fn,cktile,132,0,93.6614,a8w8_bpreshuffle_cktile_0x0x8x4x1x0x0x0x0x2_96x128x256_1x4x1_16x16x128_default,1650.83,862.05,0.0
gfx950,256,4096,2304,16384,torch.float8_e4m3fn,cktile,89,0,140.171,a8w8_bpreshuffle_cktile_0x0x8x4x1x0x0x0x0x1_224x192x128_1x4x1_16x16x128_default,2206.15,882.72,0.0
gfx950,256,8192,2304,16384,torch.float8_e4m3fn,cktile,55,0,261.4037,a8w8_bpreshuffle_cktile_0x0x8x4x1x0x0x0x0x2_128x192x128_1x4x1_16x16x128_default,2365.98,802.27,0.0
gfx950,256,16384,2304,16384,torch.float8_e4m3fn,cktile,234,0,474.9339,a8w8_bpreshuffle_cktile_0x0x8x4x1x0x0x0x0x3_256x192x128_1x4x1_16x16x128_default,2604.47,803.65,0.0
gfx950,256,32768,2304,16384,torch.float8_e4m3fn,cktile,234,0,941.4041,a8w8_bpreshuffle_cktile_0x0x8x4x1x0x0x0x0x3_256x192x128_1x4x1_16x16x128_default,2627.88,770.78,0.0
gfx950,256,1,2560,8192,torch.float8_e4m3fn,ck,10,0,12.9563,a8w8_bpreshuffle_128x16x32x512_16x16_16x16_32x4x1_32x4x1_1x16x1x8_4x4x1_1x1_intrawave_v1,3.24,1619.66,0.0
gfx950,256,16,2560,8192,torch.float8_e4m3fn,ck,10,0,11.7435,a8w8_bpreshuffle_128x16x32x512_16x16_16x16_32x4x1_32x4x1_1x16x1x8_4x4x1_1x1_intrawave_v1,57.15,1803.94,0.0
gfx950,256,32,2560,8192,torch.float8_e4m3fn,ck,10,0,11.955,a8w8_bpreshuffle_128x16x32x512_16x16_16x16_32x4x1_32x4x1_1x16x1x8_4x4x1_1x1_intrawave_v1,112.27,1789.84,0.0
gfx950,256,64,2560,8192,torch.float8_e4m3fn,ck,11,0,12.9931,a8w8_bpreshuffle_256x16x64x512_16x16_16x16_32x8x1_32x8x1_1x16x1x16_4x4x1_1x1_intrawave_v1,206.6,1679.62,0.0
gfx950,256,128,2560,8192,torch.float8_e4m3fn,cktile,152,0,15.9038,a8w8_bpreshuffle_cktile_0x0x8x4x1x0x0x0x0x4_32x64x512_1x4x1_16x16x128_default,337.57,1425.79,0.0
gfx950,256,256,2560,8192,torch.float8_e4m3fn,ck,114,0,21.9372,a8w8_bpreshuffle_256x64x64x256_16x16_16x16_16x16x1_16x16x1_1x32x1x8_8x8x1_2x1_intrawave_v3,489.46,1111.33,0.0
gfx950,256,512,2560,8192,torch.float8_e4m3fn,cktile,217,0,27.7332,a8w8_bpreshuffle_cktile_0x0x8x4x1x0x0x0x0x4_48x64x256_1x4x1_16x16x128_default,774.34,1001.95,0.0
gfx950,256,1024,2560,8192,torch.float8_e4m3fn,cktile,253,0,36.6417,a8w8_bpreshuffle_cktile_0x0x8x4x1x0x0x0x0x4_96x128x256_1x4x1_16x16x128_default,1172.15,944.36,0.0
gfx950,256,2048,2560,8192,torch.float8_e4m3fn,cktile,119,0,57.5848,a8w8_bpreshuffle_cktile_0x0x8x4x1x0x0x0x0x2_112x128x256_1x4x1_16x16x128_default,1491.7,837.63,0.0
gfx950,256,4096,2560,8192,torch.float8_e4m3fn,ck,51,0,93.1071,a8w8_bpreshuffle_256x192x128x128_16x16_16x16_8x32x1_8x32x1_1x32x1x8_8x8x1_2x1_intrawave_v3,1845.17,810.87,0.0
gfx950,256,8192,2560,8192,torch.float8_e4m3fn,flydsl,976,0,163.6521,flydsl_bpreshuflle_128x128x256_F8_F8_B16_2x1x1x2_default,2099.56,794.51,0.0
gfx950,256,16384,2560,8192,torch.float8_e4m3fn,flydsl,979,0,284.3899,flydsl_bpreshuflle_128x256x128_F8_F8_B16_2x1x1x2_default,2416.38,840.66,0.0
gfx950,256,32768,2560,8192,torch.float8_e4m3fn,ck,33,0,548.7549,a8w8_bpreshuffle_256x256x256x128_16x16_16x16_8x32x1_8x32x1_1x32x1x8_8x8x1_2x1_intrawave_v3,2504.56,833.12,0.0
gfx950,256,32,3072,1536,torch.float8_e4m3fn,flydsl,499,0,4.9778,flydsl_bpreshuflle_16x64x512_F8_F8_B16_1x1x0x1_default,60.67,997.3,0.0
gfx950,256,64,3072,1536,torch.float8_e4m3fn,flydsl,1289,0,5.0902,flydsl_bpreshuflle_16x64x512_F8_F8_B16_1x0x0x4_default,118.66,1023.56,0.0
gfx950,256,96,3072,1536,torch.float8_e4m3fn,flydsl,424,0,5.3379,flydsl_bpreshuflle_32x64x512_F8_F8_B16_1x0x1x1_default,169.72,1022.1,0.0
gfx950,256,128,3072,1536,torch.float8_e4m3fn,flydsl,1318,0,5.7223,flydsl_bpreshuflle_32x64x512_F8_F8_B16_2x0x0x4_default,211.1,996.39,0.0
gfx950,256,512,3072,1536,torch.float8_e4m3fn,ck,112,0,8.925,a8w8_bpreshuffle_256x32x64x256_16x16_16x16_16x16x1_16x16x1_1x32x1x8_8x8x1_2x1_intrawave_v1,541.38,969.27,0.0
gfx950,256,1024,3072,1536,torch.float8_e4m3fn,flydsl,873,0,11.6927,flydsl_bpreshuflle_64x192x256_F8_F8_B16_2x1x0x2_default,826.47,1076.13,0.0
gfx950,256,2048,3072,1536,torch.float8_e4m3fn,flydsl,815,0,16.6873,flydsl_bpreshuflle_128x192x128_F8_F8_B16_2x0x1x2_default,1158.21,1225.32,0.0
gfx950,256,4096,3072,1536,torch.float8_e4m3fn,flydsl,651,0,24.8402,flydsl_bpreshuflle_128x192x128_F8_F8_B16_2x1x1x1_default,1556.14,1456.34,0.0
gfx950,256,8192,3072,1536,torch.float8_e4m3fn,flydsl,319,0,48.914,flydsl_bpreshuflle_128x192x128_F8_F8_B16_2x1x1x0_default,1580.52,1382.7,0.0
gfx950,256,16384,3072,1536,torch.float8_e4m3fn,flydsl,601,0,92.0763,flydsl_bpreshuflle_128x256x128_F8_F8_B16_1x1x1x1_default,1679.25,1417.82,0.0
gfx950,256,256,4096,512,torch.float8_e4m3fn,flydsl,758,0,4.5124,flydsl_bpreshuflle_64x64x256_F8_F8_B16_1x0x1x2_default,237.95,958.55,0.0
gfx950,256,1024,4096,512,torch.float8_e4m3fn,flydsl,16,0,8.0485,flydsl_bpreshuflle_64x256x128_F8_F8_B16_1x0x0x0_default,533.64,1367.96,0.0
gfx950,256,4096,4096,512,torch.float8_e4m3fn,flydsl,186,0,16.832,flydsl_bpreshuflle_128x256x128_F8_F8_B16_1x1x0x0_default,1020.67,2242.68,0.0
gfx950,256,16384,4096,512,torch.float8_e4m3fn,flydsl,269,0,63.474,flydsl_bpreshuflle_128x256x128_F8_F8_B16_1x1x1x0_default,1082.64,2279.73,0.0
gfx950,256,1,4608,16384,torch.float8_e4m3fn,flydsl,767,0,24.8086,flydsl_bpreshuflle_16x64x512_F8_F8_B16_2x0x1x2_default,6.09,3044.23,0.0
gfx950,256,16,4608,16384,torch.float8_e4m3fn,ck,10,0,22.6718,a8w8_bpreshuffle_128x16x32x512_16x16_16x16_32x4x1_32x4x1_1x16x1x8_4x4x1_1x1_intrawave_v1,106.56,3348.08,0.0
gfx950,256,32,4608,16384,torch.float8_e4m3fn,ck,11,0,25.5291,a8w8_bpreshuffle_256x16x64x512_16x16_16x16_32x8x1_32x8x1_1x16x1x16_4x4x1_1x1_intrawave_v1,189.27,2989.4,0.0
gfx950,256,64,4608,16384,torch.float8_e4m3fn,cktile,37,0,30.5476,a8w8_bpreshuffle_cktile_0x0x8x4x1x0x0x0x0x2_32x64x512_1x4x1_16x16x128_default,316.35,2525.1,0.0
gfx950,256,128,4608,16384,torch.float8_e4m3fn,ck,114,0,41.2697,a8w8_bpreshuffle_256x64x64x256_16x16_16x16_16x16x1_16x16x1_1x32x1x8_8x8x1_2x1_intrawave_v3,468.32,1908.77,0.0
gfx950,256,256,4608,16384,torch.float8_e4m3fn,cktile,226,0,50.4918,a8w8_bpreshuffle_cktile_0x0x8x4x1x0x0x0x0x3_96x64x256_1x4x1_16x16x128_default,765.56,1625.04,0.0
gfx950,256,512,4608,16384,torch.float8_e4m3fn,cktile,92,0,64.2676,a8w8_bpreshuffle_cktile_0x0x8x4x1x0x0x0x0x1_80x128x256_1x4x1_16x16x128_default,1202.93,1378.68,0.0
gfx950,256,1024,4608,16384,torch.float8_e4m3fn,ck,149,0,93.1125,a8w8_bpreshuffle_256x128x192x256_16x16_16x16_16x16x1_16x16x1_1x32x1x8_8x8x1_2x1_intrawave_v3,1660.56,1092.35,0.0
gfx950,256,2048,4608,16384,torch.float8_e4m3fn,cktile,232,0,142.0215,a8w8_bpreshuffle_cktile_0x0x8x4x1x0x0x0x0x3_224x192x128_1x4x1_16x16x128_default,2177.4,900.75,0.0
gfx950,256,4096,4608,16384,torch.float8_e4m3fn,flydsl,815,0,259.8623,flydsl_bpreshuflle_128x192x128_F8_F8_B16_2x0x1x2_default,2380.01,694.04,0.0
gfx950,256,8192,4608,16384,torch.float8_e4m3fn,cktile,235,0,472.9169,a8w8_bpreshuffle_cktile_0x0x8x4x1x0x0x0x0x4_256x192x128_1x4x1_16x16x128_default,2615.58,603.09,0.0
gfx950,256,16384,4608,16384,torch.float8_e4m3fn,cktile,121,0,915.2083,a8w8_bpreshuffle_cktile_0x0x8x4x1x0x0x0x0x2_160x192x128_1x4x1_16x16x128_default,2703.1,540.78,0.0
gfx950,256,32768,4608,16384,torch.float8_e4m3fn,cktile,10,0,1778.3005,a8w8_bpreshuffle_cktile_0x0x8x4x1x0x0x0x0x1_256x256x128_1x4x1_16x16x128_default,2782.32,514.18,0.0
gfx950,256,1,5120,640,torch.float8_e4m3fn,ck,9,0,5.2374,a8w8_bpreshuffle_128x16x32x128_16x16_16x16_8x16x1_8x16x1_1x16x1x8_4x4x1_1x1_intrawave_v1,1.25,627.73,0.0
gfx950,256,1,5120,1280,torch.float8_e4m3fn,flydsl,415,0,5.2116,flydsl_bpreshuflle_16x64x256_F8_F8_B16_1x0x1x1_default,2.52,1259.71,0.0
gfx950,256,1,5120,3200,torch.float8_e4m3fn,ck,9,0,13.8435,a8w8_bpreshuffle_128x16x32x128_16x16_16x16_8x16x1_8x16x1_1x16x1x8_4x4x1_1x1_intrawave_v1,2.37,1184.49,0.0
gfx950,256,1,5120,5120,torch.float8_e4m3fn,ck,10,0,8.9938,a8w8_bpreshuffle_128x16x32x512_16x16_16x16_32x4x1_32x4x1_1x16x1x8_4x4x1_1x1_intrawave_v1,5.83,2916.43,0.0
gfx950,256,1,5120,6400,torch.float8_e4m3fn,flydsl,1213,0,15.5391,flydsl_bpreshuflle_16x64x256_F8_F8_B16_1x1x1x3_default,4.22,2109.82,0.0
gfx950,256,1,5120,25600,torch.float8_e4m3fn,flydsl,1159,0,36.6584,flydsl_bpreshuflle_16x64x512_F8_F8_B16_2x1x0x3_default,7.15,3576.47,0.0
gfx950,256,16,5120,640,torch.float8_e4m3fn,ck,9,0,5.3278,a8w8_bpreshuffle_128x16x32x128_16x16_16x16_8x16x1_8x16x1_1x16x1x8_4x4x1_1x1_intrawave_v1,19.68,647.71,0.0
gfx950,256,16,5120,1280,torch.float8_e4m3fn,flydsl,83,0,5.3531,flydsl_bpreshuflle_16x64x256_F8_F8_B16_1x0x1x0_default,39.18,1258.69,0.0
gfx950,256,16,5120,3200,torch.float8_e4m3fn,ck,9,0,14.0198,a8w8_bpreshuffle_128x16x32x128_16x16_16x16_8x16x1_8x16x1_1x16x1x8_4x4x1_1x1_intrawave_v1,37.4,1183.97,0.0
gfx950,256,16,5120,5120,torch.float8_e4m3fn,ck,10,0,9.0428,a8w8_bpreshuffle_128x16x32x512_16x16_16x16_32x4x1_32x4x1_1x16x1x8_4x4x1_1x1_intrawave_v1,92.77,2926.1,0.0
gfx950,256,16,5120,6400,torch.float8_e4m3fn,flydsl,415,0,15.5054,flydsl_bpreshuflle_16x64x256_F8_F8_B16_1x0x1x1_default,67.63,2130.5,0.0
gfx950,256,16,5120,25600,torch.float8_e4m3fn,ck,10,0,36.6833,a8w8_bpreshuffle_128x16x32x512_16x16_16x16_32x4x1_32x4x1_1x16x1x8_4x4x1_1x1_intrawave_v1,114.34,3588.7,0.0
gfx950,256,32,5120,640,torch.float8_e4m3fn,flydsl,1316,0,4.9324,flydsl_bpreshuflle_32x64x128_F8_F8_B16_2x0x0x4_default,42.52,734.93,0.0
gfx950,256,32,5120,1280,torch.float8_e4m3fn,flydsl,664,0,5.4128,flydsl_bpreshuflle_16x64x256_F8_F8_B16_1x0x0x2_default,77.49,1278.86,0.0
gfx950,256,32,5120,3200,torch.float8_e4m3fn,ck,9,0,14.3633,a8w8_bpreshuffle_128x16x32x128_16x16_16x16_8x16x1_8x16x1_1x16x1x8_4x4x1_1x1_intrawave_v1,73.0,1170.63,0.0
gfx950,256,32,5120,5120,torch.float8_e4m3fn,ck,5,0,10.6609,a8w8_bpreshuffle_256x16x64x512_16x16_16x16_32x8x1_32x8x1_1x16x1x16_4x4x1_1x1_intrawave_v1,157.37,2505.03,0.0
gfx950,256,32,5120,6400,torch.float8_e4m3fn,flydsl,415,0,15.8728,flydsl_bpreshuflle_16x64x256_F8_F8_B16_1x0x1x1_default,132.12,2097.96,0.0
gfx950,256,32,5120,25600,torch.float8_e4m3fn,ck,11,0,39.0845,a8w8_bpreshuffle_256x16x64x512_16x16_16x16_32x8x1_32x8x1_1x16x1x16_4x4x1_1x1_intrawave_v1,214.63,3382.9,0.0
gfx950,256,64,5120,640,torch.float8_e4m3fn,flydsl,422,0,5.0513,flydsl_bpreshuflle_32x64x128_F8_F8_B16_1x0x1x1_default,83.03,786.55,0.0
gfx950,256,64,5120,1280,torch.float8_e4m3fn,flydsl,91,0,5.5934,flydsl_bpreshuflle_32x64x256_F8_F8_B16_1x0x1x0_default,149.97,1303.48,0.0
gfx950,256,64,5120,3200,torch.float8_e4m3fn,ck,9,0,14.7686,a8w8_bpreshuffle_128x16x32x128_16x16_16x16_8x16x1_8x16x1_1x16x1x8_4x4x1_1x1_intrawave_v1,142.0,1167.62,0.0
gfx950,256,64,5120,5120,torch.float8_e4m3fn,flydsl,529,0,12.134,flydsl_bpreshuflle_32x64x512_F8_F8_B16_2x1x0x1_default,276.53,2241.42,0.0
gfx950,256,64,5120,6400,torch.float8_e4m3fn,flydsl,506,0,17.9065,flydsl_bpreshuflle_32x64x256_F8_F8_B16_1x1x0x1_default,234.23,1889.42,0.0
gfx950,256,64,5120,25600,torch.float8_e4m3fn,cktile,37,0,46.4046,a8w8_bpreshuffle_cktile_0x0x8x4x1x0x0x0x0x2_32x64x512_1x4x1_16x16x128_default,361.54,2873.98,0.0
gfx950,256,128,5120,640,torch.float8_e4m3fn,flydsl,1365,0,5.5954,flydsl_bpreshuflle_32x128x128_F8_F8_B16_1x0x1x4_default,149.92,834.51,0.0
gfx950,256,128,5120,1280,torch.float8_e4m3fn,flydsl,541,0,6.5611,flydsl_bpreshuflle_64x64x256_F8_F8_B16_2x1x0x1_default,255.71,1223.6,0.0
gfx950,256,128,5120,3200,torch.float8_e4m3fn,ck,9,0,14.9077,a8w8_bpreshuffle_128x16x32x128_16x16_16x16_8x16x1_8x16x1_1x16x1x8_4x4x1_1x1_intrawave_v1,281.35,1214.43,0.0
gfx950,256,128,5120,5120,torch.float8_e4m3fn,ck,114,0,15.9196,a8w8_bpreshuffle_256x64x64x256_16x16_16x16_16x16x1_16x16x1_1x32x1x8_8x8x1_2x1_intrawave_v3,421.55,1770.18,0.0
gfx950,256,128,5120,6400,torch.float8_e4m3fn,ck,114,0,18.6977,a8w8_bpreshuffle_256x64x64x256_16x16_16x16_16x16x1_16x16x1_1x32x1x8_8x8x1_2x1_intrawave_v3,448.64,1866.43,0.0
gfx950,256,128,5120,25600,torch.float8_e4m3fn,ck,114,0,63.2614,a8w8_bpreshuffle_256x64x64x256_16x16_16x16_16x16x1_16x16x1_1x32x1x8_8x8x1_2x1_intrawave_v3,530.41,2144.43,0.0
gfx950,256,256,5120,640,torch.float8_e4m3fn,flydsl,1002,0,6.5154,flydsl_bpreshuflle_64x128x128_F8_F8_B16_1x0x0x3_default,257.5,930.42,0.0
gfx950,256,256,5120,1280,torch.float8_e4m3fn,ck,113,0,8.4096,a8w8_bpreshuffle_256x48x64x256_16x16_16x16_16x16x1_16x16x1_1x16x1x16_4x4x1_1x1_intrawave_v1,399.0,1129.98,0.0
gfx950,256,256,5120,3200,torch.float8_e4m3fn,ck,76,0,16.7712,a8w8_bpreshuffle_256x32x64x128_16x16_16x16_8x32x1_8x32x1_1x32x1x8_8x8x1_2x1_intrawave_v1,500.18,1182.06,0.0
gfx950,256,256,5120,5120,torch.float8_e4m3fn,ck,120,0,19.4182,a8w8_bpreshuffle_256x48x128x256_16x16_16x16_16x16x1_16x16x1_1x16x1x16_8x8x1_1x2_intrawave_v1,691.2,1552.49,0.0
gfx950,256,256,5120,6400,torch.float8_e4m3fn,ck,120,0,23.2983,a8w8_bpreshuffle_256x48x128x256_16x16_16x16_16x16x1_16x16x1_1x16x1x16_8x8x1_1x2_intrawave_v1,720.1,1589.29,0.0
gfx950,256,256,5120,25600,torch.float8_e4m3fn,cktile,227,0,77.1726,a8w8_bpreshuffle_cktile_0x0x8x4x1x0x0x0x0x4_96x64x256_1x4x1_16x16x128_default,869.59,1817.32,0.0
gfx950,256,512,5120,640,torch.float8_e4m3fn,flydsl,1179,0,7.8677,flydsl_bpreshuflle_64x64x128_F8_F8_B16_2x1x0x3_default,426.48,1124.52,0.0
gfx950,256,512,5120,1280,torch.float8_e4m3fn,flydsl,814,0,10.5382,flydsl_bpreshuflle_128x128x256_F8_F8_B16_2x0x1x2_default,636.82,1181.59,0.0
gfx950,256,512,5120,3200,torch.float8_e4m3fn,ck,86,0,21.8373,a8w8_bpreshuffle_256x96x128x128_16x16_16x16_8x32x1_8x32x1_1x32x1x8_8x8x1_2x1_intrawave_v3,768.28,1065.39,0.0
gfx950,256,512,5120,5120,torch.float8_e4m3fn,ck,123,0,26.3712,a8w8_bpreshuffle_256x96x128x256_16x16_16x16_16x16x1_16x16x1_1x16x1x16_8x8x1_1x2_intrawave_v3,1017.91,1292.27,0.0
gfx950,256,512,5120,6400,torch.float8_e4m3fn,ck,123,0,30.9752,a8w8_bpreshuffle_256x96x128x256_16x16_16x16_16x16x1_16x16x1_1x16x1x16_8x8x1_1x2_intrawave_v3,1083.27,1332.93,0.0
gfx950,256,512,5120,25600,torch.float8_e4m3fn,cktile,99,0,96.9889,a8w8_bpreshuffle_cktile_0x0x8x4x1x0x0x0x0x1_96x128x256_1x4x1_16x16x128_default,1383.85,1540.61,0.0
gfx950,256,1024,5120,640,torch.float8_e4m3fn,flydsl,376,0,10.9979,flydsl_bpreshuflle_64x128x128_F8_F8_B16_2x0x0x1_default,610.2,1310.97,0.0
gfx950,256,1024,5120,1280,torch.float8_e4m3fn,ck,123,0,15.4162,a8w8_bpreshuffle_256x96x128x256_16x16_16x16_16x16x1_16x16x1_1x16x1x16_8x8x1_1x2_intrawave_v3,870.63,1190.31,0.0
gfx950,256,1024,5120,3200,torch.float8_e4m3fn,ck,86,0,27.9273,a8w8_bpreshuffle_256x96x128x128_16x16_16x16_8x32x1_8x32x1_1x32x1x8_8x8x1_2x1_intrawave_v3,1201.49,1079.47,0.0
gfx950,256,1024,5120,5120,torch.float8_e4m3fn,ck,51,0,40.9005,a8w8_bpreshuffle_256x192x128x128_16x16_16x16_8x32x1_8x32x1_1x32x1x8_8x8x1_2x1_intrawave_v3,1312.63,1025.49,0.0
gfx950,256,1024,5120,6400,torch.float8_e4m3fn,ck,51,0,47.925,a8w8_bpreshuffle_256x192x128x128_16x16_16x16_8x32x1_8x32x1_1x32x1x8_8x8x1_2x1_intrawave_v3,1400.29,1039.28,0.0
gfx950,256,1024,5120,25600,torch.float8_e4m3fn,cktile,106,0,150.9142,a8w8_bpreshuffle_cktile_0x0x8x4x1x0x0x0x0x1_96x256x256_1x4x1_16x16x128_default,1778.73,1111.71,0.0
gfx950,256,2048,5120,640,torch.float8_e4m3fn,flydsl,151,0,15.6989,flydsl_bpreshuflle_128x128x128_F8_F8_B16_2x0x1x0_default,854.95,1628.08,0.0
gfx950,256,2048,5120,1280,torch.float8_e4m3fn,flydsl,814,0,22.7992,flydsl_bpreshuflle_128x128x256_F8_F8_B16_2x0x1x2_default,1177.39,1322.26,0.0
gfx950,256,2048,5120,3200,torch.float8_e4m3fn,ck,51,0,43.7434,a8w8_bpreshuffle_256x192x128x128_16x16_16x16_8x32x1_8x32x1_1x32x1x8_8x8x1_2x1_intrawave_v3,1534.15,1003.79,0.0
gfx950,256,2048,5120,5120,torch.float8_e4m3fn,ck,143,0,61.2716,a8w8_bpreshuffle_256x192x128x128_16x16_16x16_8x32x1_8x32x1_1x16x1x16_8x8x1_1x2_intrawave_v3,1752.43,941.25,0.0
gfx950,256,2048,5120,6400,torch.float8_e4m3fn,ck,143,0,74.2562,a8w8_bpreshuffle_256x192x128x128_16x16_16x16_8x32x1_8x32x1_1x16x1x16_8x8x1_1x2_intrawave_v3,1807.5,900.22,0.0
gfx950,256,2048,5120,25600,torch.float8_e4m3fn,cktile,10,0,244.7836,a8w8_bpreshuffle_cktile_0x0x8x4x1x0x0x0x0x1_256x256x128_1x4x1_16x16x128_default,2193.25,835.32,0.0
gfx950,256,4096,5120,640,torch.float8_e4m3fn,flydsl,267,0,24.8734,flydsl_bpreshuflle_128x128x128_F8_F8_B16_1x1x1x0_default,1079.21,1923.39,0.0
gfx950,256,4096,5120,1280,torch.float8_e4m3fn,flydsl,1204,0,37.3618,flydsl_bpreshuflle_128x128x128_F8_F8_B16_2x1x0x3_default,1436.95,1438.35,0.0
gfx950,256,4096,5120,3200,torch.float8_e4m3fn,flydsl,1279,0,75.9837,flydsl_bpreshuflle_128x128x128_F8_F8_B16_2x1x1x3_default,1766.4,940.13,0.0
gfx950,256,4096,5120,5120,torch.float8_e4m3fn,flydsl,814,0,111.8359,flydsl_bpreshuflle_128x128x256_F8_F8_B16_2x0x1x2_default,1920.21,796.96,0.0
gfx950,256,4096,5120,6400,torch.float8_e4m3fn,flydsl,152,0,133.987,flydsl_bpreshuflle_128x128x256_F8_F8_B16_2x0x1x0_default,2003.44,753.25,0.0
gfx950,256,4096,5120,25600,torch.float8_e4m3fn,cktile,130,0,453.567,a8w8_bpreshuffle_cktile_0x0x8x4x1x0x0x0x0x2_224x128x128_1x4x1_16x16x128_default,2367.33,612.64,0.0
gfx950,256,8192,5120,640,torch.float8_e4m3fn,flydsl,898,0,45.6191,flydsl_bpreshuflle_128x256x128_F8_F8_B16_2x1x0x2_default,1176.86,2025.59,0.0
gfx950,256,8192,5120,1280,torch.float8_e4m3fn,flydsl,825,0,71.4842,flydsl_bpreshuflle_256x128x128_F8_F8_B16_2x0x1x2_default,1502.07,1411.86,0.0
gfx950,256,8192,5120,3200,torch.float8_e4m3fn,flydsl,321,0,128.779,flydsl_bpreshuflle_128x256x128_F8_F8_B16_2x1x1x0_default,2084.47,982.18,0.0
gfx950,256,8192,5120,5120,torch.float8_e4m3fn,flydsl,825,0,192.9599,flydsl_bpreshuflle_256x128x128_F8_F8_B16_2x0x1x2_default,2225.83,787.95,0.0
gfx950,256,8192,5120,6400,torch.float8_e4m3fn,flydsl,825,0,229.0136,flydsl_bpreshuflle_256x128x128_F8_F8_B16_2x0x1x2_default,2344.28,738.31,0.0
gfx950,256,8192,5120,25600,torch.float8_e4m3fn,cktile,10,0,825.5439,a8w8_bpreshuffle_cktile_0x0x8x4x1x0x0x0x0x1_256x256x128_1x4x1_16x16x128_default,2601.3,514.42,0.0
gfx950,256,16384,5120,640,torch.float8_e4m3fn,flydsl,898,0,83.2532,flydsl_bpreshuflle_128x256x128_F8_F8_B16_2x1x0x2_default,1289.73,2180.51,0.0
gfx950,256,16384,5120,1280,torch.float8_e4m3fn,flydsl,435,0,130.1539,flydsl_bpreshuflle_128x256x128_F8_F8_B16_1x0x1x1_default,1649.96,1500.51,0.0
gfx950,256,16384,5120,3200,torch.float8_e4m3fn,flydsl,321,0,238.792,flydsl_bpreshuflle_128x256x128_F8_F8_B16_2x1x1x0_default,2248.28,990.76,0.0
gfx950,256,16384,5120,5120,torch.float8_e4m3fn,flydsl,825,0,371.1527,flydsl_bpreshuflle_256x128x128_F8_F8_B16_2x0x1x2_default,2314.39,748.67,0.0
gfx950,256,16384,5120,6400,torch.float8_e4m3fn,flydsl,825,0,439.5686,flydsl_bpreshuflle_256x128x128_F8_F8_B16_2x0x1x2_default,2442.72,694.77,0.0
gfx950,256,16384,5120,25600,torch.float8_e4m3fn,cktile,10,0,1510.0434,a8w8_bpreshuffle_cktile_0x0x8x4x1x0x0x0x0x1_256x256x128_1x4x1_16x16x128_default,2844.27,475.66,0.0
gfx950,256,32768,5120,640,torch.float8_e4m3fn,flydsl,736,0,161.3587,flydsl_bpreshuflle_128x256x128_F8_F8_B16_2x0x0x2_default,1330.88,2229.77,0.0
gfx950,256,32768,5120,1280,torch.float8_e4m3fn,flydsl,103,0,262.1888,flydsl_bpreshuflle_128x256x128_F8_F8_B16_1x0x1x0_default,1638.12,1464.75,0.0
gfx950,256,32768,5120,3200,torch.float8_e4m3fn,flydsl,653,0,489.6873,flydsl_bpreshuflle_128x256x128_F8_F8_B16_2x1x1x1_default,2192.71,932.81,0.0
gfx950,256,32768,5120,5120,torch.float8_e4m3fn,ck,33,0,741.3936,a8w8_bpreshuffle_256x256x256x128_16x16_16x16_8x32x1_8x32x1_1x32x1x8_8x8x1_2x1_intrawave_v3,2317.24,714.24,0.0
gfx950,256,32768,5120,6400,torch.float8_e4m3fn,ck,33,0,875.2866,a8w8_bpreshuffle_256x256x256x128_16x16_16x16_8x32x1_8x32x1_1x32x1x8_8x8x1_2x1_intrawave_v3,2453.46,660.39,0.0
gfx950,256,32768,5120,25600,torch.float8_e4m3fn,cktile,10,0,2964.8617,a8w8_bpreshuffle_cktile_0x0x8x4x1x0x0x0x0x1_256x256x128_1x4x1_16x16x128_default,2897.25,440.32,0.0
gfx950,256,1,6400,5120,torch.float8_e4m3fn,flydsl,1443,0,10.0031,flydsl_bpreshuflle_16x64x512_F8_F8_B16_2x1x0x4_default,6.55,3277.58,0.0
gfx950,256,16,6400,5120,torch.float8_e4m3fn,ck,10,0,9.0378,a8w8_bpreshuffle_128x16x32x512_16x16_16x16_32x4x1_32x4x1_1x16x1x8_4x4x1_1x1_intrawave_v1,116.02,3657.39,0.0
gfx950,256,32,6400,5120,torch.float8_e4m3fn,cktile,2,0,11.1359,a8w8_bpreshuffle_cktile_0x0x8x4x1x0x0x0x0x1_16x64x512_1x4x1_16x16x128_default,188.32,2994.05,0.0
gfx950,256,64,6400,5120,torch.float8_e4m3fn,cktile,152,0,12.8013,a8w8_bpreshuffle_cktile_0x0x8x4x1x0x0x0x0x4_32x64x512_1x4x1_16x16x128_default,327.65,2649.33,0.0
gfx950,256,128,6400,5120,torch.float8_e4m3fn,ck,114,0,16.3798,a8w8_bpreshuffle_256x64x64x256_16x16_16x16_16x16x1_16x16x1_1x32x1x8_8x8x1_2x1_intrawave_v3,512.13,2140.55,0.0
gfx950,256,256,6400,5120,torch.float8_e4m3fn,ck,65,0,21.7673,a8w8_bpreshuffle_256x128x64x256_16x16_16x16_16x16x1_16x16x1_1x32x1x8_8x8x1_2x1_intrawave_v3,770.75,1716.13,0.0
gfx950,256,512,6400,5120,torch.float8_e4m3fn,ck,139,0,29.5786,a8w8_bpreshuffle_256x128x128x256_16x16_16x16_16x16x1_16x16x1_1x16x1x16_8x8x1_1x2_intrawave_v3,1134.42,1418.02,0.0
gfx950,256,1024,6400,5120,torch.float8_e4m3fn,ck,138,0,45.3094,a8w8_bpreshuffle_256x112x256x256_16x16_16x16_16x16x1_16x16x1_1x16x1x16_8x8x1_1x2_intrawave_v3,1481.12,1128.2,0.0
gfx950,256,2048,6400,5120,torch.float8_e4m3fn,ck,138,0,81.0869,a8w8_bpreshuffle_256x112x256x256_16x16_16x16_16x16x1_16x16x1_1x16x1x16_8x8x1_1x2_intrawave_v3,1655.23,856.71,0.0
gfx950,256,4096,6400,5120,torch.float8_e4m3fn,ck,143,0,142.3021,a8w8_bpreshuffle_256x192x128x128_16x16_16x16_8x32x1_8x32x1_1x16x1x16_8x8x1_1x2_intrawave_v3,1886.38,746.08,0.0
gfx950,256,8192,6400,5120,torch.float8_e4m3fn,flydsl,825,0,248.0387,flydsl_bpreshuflle_256x128x128_F8_F8_B16_2x0x1x2_default,2164.46,723.95,0.0
gfx950,256,16384,6400,5120,torch.float8_e4m3fn,flydsl,825,0,466.6318,flydsl_bpreshuflle_256x128x128_F8_F8_B16_2x0x1x2_default,2301.05,699.41,0.0
gfx950,256,32768,6400,5120,torch.float8_e4m3fn,flydsl,825,0,932.2305,flydsl_bpreshuflle_256x128x128_F8_F8_B16_2x0x1x2_default,2303.6,665.04,0.0
gfx950,256,8,6656,16384,torch.float8_e4m3fn,ck,10,0,26.6859,a8w8_bpreshuffle_128x16x32x512_16x16_16x16_32x4x1_32x4x1_1x16x1x8_4x4x1_1x1_intrawave_v1,65.38,4095.4,0.0
gfx950,256,1,7168,8192,torch.float8_e4m3fn,ck,10,0,14.4987,a8w8_bpreshuffle_128x16x32x512_16x16_16x16_32x4x1_32x4x1_1x16x1x8_4x4x1_1x1_intrawave_v1,8.1,4051.59,0.0
gfx950,256,16,7168,8192,torch.float8_e4m3fn,ck,24,0,14.8554,a8w8_bpreshuffle_128x16x32x512_16x16_16x16_32x4x1_32x4x1_1x16x1x8_4x4x1_1x1_intrawave_v2,126.49,3977.05,0.0
gfx950,256,32,7168,256,torch.float8_e4m3fn,flydsl,1071,0,2.8866,flydsl_bpreshuflle_32x64x256_F8_F8_B16_1x0x1x3_default,40.68,797.46,0.0
gfx950,256,32,7168,8192,torch.float8_e4m3fn,ck,5,0,15.5595,a8w8_bpreshuffle_256x16x64x512_16x16_16x16_32x8x1_32x8x1_1x16x1x16_4x4x1_1x1_intrawave_v1,241.53,3820.25,0.0
gfx950,256,64,7168,256,torch.float8_e4m3fn,flydsl,1071,0,3.0972,flydsl_bpreshuflle_32x64x256_F8_F8_B16_1x0x1x3_default,75.84,894.0,0.0
gfx950,256,64,7168,8192,torch.float8_e4m3fn,cktile,152,0,18.9201,a8w8_bpreshuffle_cktile_0x0x8x4x1x0x0x0x0x4_32x64x512_1x4x1_16x16x128_default,397.26,3179.8,0.0
gfx950,256,96,7168,256,torch.float8_e4m3fn,flydsl,753,0,3.597,flydsl_bpreshuflle_32x64x256_F8_F8_B16_1x0x1x2_default,97.95,899.59,0.0
gfx950,256,96,7168,512,torch.float8_e4m3fn,flydsl,1299,0,4.5415,flydsl_bpreshuflle_32x128x256_F8_F8_B16_1x0x0x4_default,155.16,1121.97,0.0
gfx950,256,96,7168,2048,torch.float8_e4m3fn,ck,113,0,8.5986,a8w8_bpreshuffle_256x48x64x256_16x16_16x16_16x16x1_16x16x1_1x16x1x16_4x4x1_1x1_intrawave_v1,327.79,1890.18,0.0
gfx950,256,128,7168,256,torch.float8_e4m3fn,flydsl,428,0,3.563,flydsl_bpreshuflle_64x64x256_F8_F8_B16_1x0x1x1_default,131.84,1039.23,0.0
gfx950,256,128,7168,512,torch.float8_e4m3fn,flydsl,758,0,4.5422,flydsl_bpreshuflle_64x64x256_F8_F8_B16_1x0x1x2_default,206.84,1226.4,0.0
gfx950,256,128,7168,2048,torch.float8_e4m3fn,ck,114,0,8.3615,a8w8_bpreshuffle_256x64x64x256_16x16_16x16_16x16x1_16x16x1_1x32x1x8_8x8x1_2x1_intrawave_v3,449.45,2006.48,0.0
gfx950,256,128,7168,8192,torch.float8_e4m3fn,ck,114,0,24.0436,a8w8_bpreshuffle_256x64x64x256_16x16_16x16_16x16x1_16x16x1_1x32x1x8_8x8x1_2x1_intrawave_v3,625.21,2562.17,0.0
gfx950,256,256,7168,256,torch.float8_e4m3fn,flydsl,1368,0,4.5468,flydsl_bpreshuflle_64x64x256_F8_F8_B16_1x0x1x4_default,206.63,1225.16,0.0
gfx950,256,256,7168,512,torch.float8_e4m3fn,flydsl,1078,0,5.8237,flydsl_bpreshuflle_64x128x256_F8_F8_B16_1x0x1x3_default,322.66,1282.88,0.0
gfx950,256,256,7168,2048,torch.float8_e4m3fn,flydsl,565,0,11.2626,flydsl_bpreshuflle_128x64x256_F8_F8_B16_2x1x0x1_default,667.36,1675.84,0.0
gfx950,256,256,7168,8192,torch.float8_e4m3fn,ck,144,0,30.8344,a8w8_bpreshuffle_256x128x64x256_16x16_16x16_16x16x1_16x16x1_1x32x1x8_8x8x1_2x1_intrawave_v3,975.04,2091.41,0.0
gfx950,256,512,7168,256,torch.float8_e4m3fn,flydsl,1006,0,6.0654,flydsl_bpreshuflle_128x128x128_F8_F8_B16_1x0x0x3_default,309.8,1534.29,0.0
gfx950,256,512,7168,2048,torch.float8_e4m3fn,flydsl,152,0,15.7151,flydsl_bpreshuflle_128x128x256_F8_F8_B16_2x0x1x0_default,956.56,1467.93,0.0
gfx950,256,512,7168,8192,torch.float8_e4m3fn,ck,139,0,43.6511,a8w8_bpreshuffle_256x128x128x256_16x16_16x16_16x16x1_16x16x1_1x16x1x16_8x8x1_1x2_intrawave_v3,1377.5,1609.46,0.0
gfx950,256,1024,7168,256,torch.float8_e4m3fn,flydsl,1182,0,8.8106,flydsl_bpreshuflle_64x128x256_F8_F8_B16_2x1x0x3_default,426.54,1904.21,0.0
gfx950,256,1024,7168,512,torch.float8_e4m3fn,flydsl,16,0,11.3748,flydsl_bpreshuflle_64x256x128_F8_F8_B16_1x0x0x0_default,660.78,1659.31,0.0
gfx950,256,1024,7168,2048,torch.float8_e4m3fn,ck,70,0,24.0038,a8w8_bpreshuffle_256x128x128x128_16x16_16x16_8x32x1_8x32x1_1x32x1x8_8x8x1_2x1_intrawave_v3,1252.5,1310.51,0.0
gfx950,256,1024,7168,8192,torch.float8_e4m3fn,ck,154,0,65.1203,a8w8_bpreshuffle_256x128x256x256_16x16_16x16_16x16x1_16x16x1_1x16x1x16_8x8x1_1x2_intrawave_v3,1846.72,1255.97,0.0
gfx950,256,2048,7168,256,torch.float8_e4m3fn,flydsl,927,0,13.0037,flydsl_bpreshuflle_128x256x128_F8_F8_B16_1x1x1x2_default,578.0,2439.26,0.0
gfx950,256,2048,7168,2048,torch.float8_e4m3fn,flydsl,979,0,39.185,flydsl_bpreshuflle_128x256x128_F8_F8_B16_2x1x1x2_default,1534.5,1230.94,0.0
gfx950,256,2048,7168,8192,torch.float8_e4m3fn,cktile,155,0,113.909,a8w8_bpreshuffle_cktile_0x0x8x4x1x0x0x0x0x4_256x256x128_1x4x1_16x16x128_default,2111.49,920.54,0.0
gfx950,256,4096,7168,256,torch.float8_e4m3fn,flydsl,976,0,22.1568,flydsl_bpreshuflle_128x128x256_F8_F8_B16_2x1x1x2_default,678.45,2780.36,0.0
gfx950,256,4096,7168,512,torch.float8_e4m3fn,flydsl,186,0,31.9569,flydsl_bpreshuflle_128x256x128_F8_F8_B16_1x1x0x0_default,940.79,2017.95,0.0
gfx950,256,4096,7168,2048,torch.float8_e4m3fn,flydsl,979,0,73.2445,flydsl_bpreshuflle_128x256x128_F8_F8_B16_2x1x1x2_default,1641.89,1116.66,0.0
gfx950,256,4096,7168,8192,torch.float8_e4m3fn,flydsl,979,0,212.6801,flydsl_bpreshuflle_128x256x128_F8_F8_B16_2x1x1x2_default,2261.78,709.96,0.0
gfx950,256,8192,7168,256,torch.float8_e4m3fn,flydsl,650,0,40.7412,flydsl_bpreshuflle_128x128x256_F8_F8_B16_2x1x1x1_default,737.95,2979.11,0.0
gfx950,256,8192,7168,2048,torch.float8_e4m3fn,flydsl,979,0,130.9968,flydsl_bpreshuflle_128x256x128_F8_F8_B16_2x1x1x2_default,1836.06,1136.65,0.0
gfx950,256,8192,7168,8192,torch.float8_e4m3fn,flydsl,825,0,384.7901,flydsl_bpreshuflle_256x128x128_F8_F8_B16_2x0x1x2_default,2500.25,632.21,0.0
gfx950,256,16384,7168,256,torch.float8_e4m3fn,flydsl,1205,0,75.8308,flydsl_bpreshuflle_128x128x256_F8_F8_B16_2x1x0x3_default,792.94,3176.95,0.0
gfx950,256,16384,7168,512,torch.float8_e4m3fn,flydsl,1533,0,107.5937,flydsl_bpreshuflle_64x128x256_F8_F8_B16_2x1x1x4_default,1117.71,2295.11,0.0
gfx950,256,16384,7168,2048,torch.float8_e4m3fn,flydsl,186,0,246.697,flydsl_bpreshuflle_128x256x128_F8_F8_B16_1x1x0x0_default,1949.91,1147.62,0.0
gfx950,256,16384,7168,8192,torch.float8_e4m3fn,flydsl,979,0,746.7473,flydsl_bpreshuflle_128x256x128_F8_F8_B16_2x1x1x2_default,2576.7,572.91,0.0
gfx950,256,32768,7168,8192,torch.float8_e4m3fn,ck,33,0,1495.0753,a8w8_bpreshuffle_256x256x256x128_16x16_16x16_8x32x1_8x32x1_1x32x1x8_8x8x1_2x1_intrawave_v3,2573.98,533.03,0.0
gfx950,256,1,8192,1024,torch.float8_e4m3fn,flydsl,1,0,4.4273,flydsl_bpreshuflle_16x64x512_F8_F8_B16_1x0x0x0_default,3.79,1898.68,0.0
gfx950,256,1,8192,2048,torch.float8_e4m3fn,flydsl,827,0,5.6823,flydsl_bpreshuflle_16x64x512_F8_F8_B16_1x1x0x2_default,5.91,2955.78,0.0
gfx950,256,1,8192,3584,torch.float8_e4m3fn,ck,10,0,7.9608,a8w8_bpreshuffle_128x16x32x512_16x16_16x16_32x4x1_32x4x1_1x16x1x8_4x4x1_1x1_intrawave_v1,7.38,3690.6,0.0
gfx950,256,1,8192,7168,torch.float8_e4m3fn,flydsl,848,0,13.2795,flydsl_bpreshuflle_16x64x512_F8_F8_B16_2x1x0x2_default,8.84,4423.65,0.0
gfx950,256,1,8192,8192,torch.float8_e4m3fn,ck,24,0,15.2454,a8w8_bpreshuffle_128x16x32x512_16x16_16x16_32x4x1_32x4x1_1x16x1x8_4x4x1_1x1_intrawave_v2,8.8,4403.52,0.0
gfx950,256,1,8192,28672,torch.float8_e4m3fn,flydsl,1159,0,45.1638,flydsl_bpreshuflle_16x64x512_F8_F8_B16_2x1x0x3_default,10.4,5201.65,0.0
gfx950,256,16,8192,1024,torch.float8_e4m3fn,flydsl,1289,0,4.409,flydsl_bpreshuflle_16x64x512_F8_F8_B16_1x0x0x4_default,60.88,1965.78,0.0
gfx950,256,16,8192,2048,torch.float8_e4m3fn,flydsl,1,0,5.5976,flydsl_bpreshuflle_16x64x512_F8_F8_B16_1x0x0x0_default,95.91,3049.9,0.0
gfx950,256,16,8192,3584,torch.float8_e4m3fn,ck,10,0,7.841,a8w8_bpreshuffle_128x16x32x512_16x16_16x16_32x4x1_32x4x1_1x16x1x8_4x4x1_1x1_intrawave_v1,119.82,3785.18,0.0
gfx950,256,16,8192,7168,torch.float8_e4m3fn,ck,10,0,13.2832,a8w8_bpreshuffle_128x16x32x512_16x16_16x16_32x4x1_32x4x1_1x16x1x8_4x4x1_1x1_intrawave_v1,141.46,4449.01,0.0
gfx950,256,16,8192,8192,torch.float8_e4m3fn,ck,24,0,15.4927,a8w8_bpreshuffle_128x16x32x512_16x16_16x16_32x4x1_32x4x1_1x16x1x8_4x4x1_1x1_intrawave_v2,138.61,4357.02,0.0
gfx950,256,16,8192,28672,torch.float8_e4m3fn,ck,10,0,43.6421,a8w8_bpreshuffle_128x16x32x512_16x16_16x16_32x4x1_32x4x1_1x16x1x8_4x4x1_1x1_intrawave_v1,172.22,5398.5,0.0
gfx950,256,32,8192,1024,torch.float8_e4m3fn,flydsl,673,0,4.8647,flydsl_bpreshuflle_32x64x512_F8_F8_B16_1x0x0x2_default,110.36,1838.89,0.0
gfx950,256,32,8192,2048,torch.float8_e4m3fn,ck,5,0,6.3939,a8w8_bpreshuffle_256x16x64x512_16x16_16x16_32x8x1_32x8x1_1x16x1x16_4x4x1_1x1_intrawave_v1,167.93,2716.19,0.0
gfx950,256,32,8192,3584,torch.float8_e4m3fn,ck,5,0,8.8319,a8w8_bpreshuffle_256x16x64x512_16x16_16x16_32x8x1_32x8x1_1x16x1x16_4x4x1_1x1_intrawave_v1,212.76,3396.68,0.0
gfx950,256,32,8192,7168,torch.float8_e4m3fn,ck,11,0,14.6614,a8w8_bpreshuffle_256x16x64x512_16x16_16x16_32x8x1_32x8x1_1x16x1x16_4x4x1_1x1_intrawave_v1,256.33,4056.5,0.0
gfx950,256,32,8192,8192,torch.float8_e4m3fn,ck,5,0,16.4179,a8w8_bpreshuffle_256x16x64x512_16x16_16x16_32x8x1_32x8x1_1x16x1x16_4x4x1_1x1_intrawave_v1,261.6,4135.44,0.0
gfx950,256,32,8192,28672,torch.float8_e4m3fn,ck,5,0,48.1626,a8w8_bpreshuffle_256x16x64x512_16x16_16x16_32x8x1_32x8x1_1x16x1x16_4x4x1_1x1_intrawave_v1,312.12,4906.77,0.0
gfx950,256,64,8192,2048,torch.float8_e4m3fn,cktile,37,0,7.4625,a8w8_bpreshuffle_cktile_0x0x8x4x1x0x0x0x0x2_32x64x512_1x4x1_16x16x128_default,287.77,2406.28,0.0
gfx950,256,64,8192,3584,torch.float8_e4m3fn,cktile,37,0,10.8507,a8w8_bpreshuffle_cktile_0x0x8x4x1x0x0x0x0x2_32x64x512_1x4x1_16x16x128_default,346.35,2823.6,0.0
gfx950,256,64,8192,7168,torch.float8_e4m3fn,cktile,37,0,17.4069,a8w8_bpreshuffle_cktile_0x0x8x4x1x0x0x0x0x2_32x64x512_1x4x1_16x16x128_default,431.79,3459.98,0.0
gfx950,256,64,8192,8192,torch.float8_e4m3fn,cktile,37,0,19.3604,a8w8_bpreshuffle_cktile_0x0x8x4x1x0x0x0x0x2_32x64x512_1x4x1_16x16x128_default,443.69,3547.54,0.0
gfx950,256,64,8192,28672,torch.float8_e4m3fn,cktile,151,0,56.6791,a8w8_bpreshuffle_cktile_0x0x8x4x1x0x0x0x0x3_32x64x512_1x4x1_16x16x128_default,530.44,4194.93,0.0
gfx950,256,128,8192,1024,torch.float8_e4m3fn,flydsl,677,0,6.3283,flydsl_bpreshuflle_64x64x256_F8_F8_B16_1x0x0x2_default,339.35,1677.68,0.0
gfx950,256,128,8192,2048,torch.float8_e4m3fn,flydsl,869,0,9.304,flydsl_bpreshuflle_64x64x256_F8_F8_B16_2x1x0x2_default,461.63,2056.8,0.0
gfx950,256,128,8192,3584,torch.float8_e4m3fn,ck,114,0,13.2791,a8w8_bpreshuffle_256x64x64x256_16x16_16x16_16x16x1_16x16x1_1x32x1x8_8x8x1_2x1_intrawave_v3,566.02,2403.48,0.0
gfx950,256,128,8192,7168,torch.float8_e4m3fn,ck,114,0,22.4532,a8w8_bpreshuffle_256x64x64x256_16x16_16x16_16x16x1_16x16x1_1x32x1x8_8x8x1_2x1_intrawave_v3,669.5,2749.49,0.0
gfx950,256,128,8192,8192,torch.float8_e4m3fn,ck,114,0,25.4862,a8w8_bpreshuffle_256x64x64x256_16x16_16x16_16x16x1_16x16x1_1x32x1x8_8x8x1_2x1_intrawave_v3,674.09,2756.57,0.0
gfx950,256,128,8192,28672,torch.float8_e4m3fn,ck,114,0,75.9032,a8w8_bpreshuffle_256x64x64x256_16x16_16x16_16x16x1_16x16x1_1x32x1x8_8x8x1_2x1_intrawave_v3,792.19,3170.46,0.0
gfx950,256,256,8192,1024,torch.float8_e4m3fn,flydsl,1128,0,8.3043,flydsl_bpreshuflle_128x64x256_F8_F8_B16_2x0x1x3_default,517.2,1546.8,0.0
gfx950,256,256,8192,2048,torch.float8_e4m3fn,flydsl,1203,0,11.5596,flydsl_bpreshuflle_128x64x256_F8_F8_B16_2x1x0x3_default,743.1,1859.56,0.0
gfx950,256,256,8192,3584,torch.float8_e4m3fn,ck,65,0,17.0541,a8w8_bpreshuffle_256x128x64x256_16x16_16x16_16x16x1_16x16x1_1x32x1x8_8x8x1_2x1_intrawave_v3,881.45,2021.33,0.0
gfx950,256,256,8192,7168,torch.float8_e4m3fn,ck,65,0,28.8311,a8w8_bpreshuffle_256x128x64x256_16x16_16x16_16x16x1_16x16x1_1x32x1x8_8x8x1_2x1_intrawave_v3,1042.79,2245.82,0.0
gfx950,256,256,8192,8192,torch.float8_e4m3fn,ck,144,0,31.9715,a8w8_bpreshuffle_256x128x64x256_16x16_16x16_16x16x1_16x16x1_1x32x1x8_8x8x1_2x1_intrawave_v3,1074.7,2295.8,0.0
gfx950,256,256,8192,28672,torch.float8_e4m3fn,ck,144,0,97.4398,a8w8_bpreshuffle_256x128x64x256_16x16_16x16_16x16x1_16x16x1_1x32x1x8_8x8x1_2x1_intrawave_v3,1234.19,2528.9,0.0
gfx950,256,512,8192,1024,torch.float8_e4m3fn,flydsl,1418,0,11.2514,flydsl_bpreshuflle_128x128x256_F8_F8_B16_2x0x1x4_default,763.45,1537.72,0.0
gfx950,256,512,8192,2048,torch.float8_e4m3fn,ck,139,0,15.9434,a8w8_bpreshuffle_256x128x128x256_16x16_16x16_16x16x1_16x16x1_1x16x1x16_8x8x1_1x2_intrawave_v3,1077.55,1644.22,0.0
gfx950,256,512,8192,3584,torch.float8_e4m3fn,ck,139,0,23.5971,a8w8_bpreshuffle_256x128x128x256_16x16_16x16_16x16x1_16x16x1_1x16x1x16_8x8x1_1x2_intrawave_v3,1274.09,1677.48,0.0
gfx950,256,512,8192,7168,torch.float8_e4m3fn,cktile,135,0,40.5772,a8w8_bpreshuffle_cktile_0x0x8x4x1x0x0x0x0x3_128x128x256_1x4x1_16x16x128_default,1481.86,1744.3,0.0
gfx950,256,512,8192,8192,torch.float8_e4m3fn,cktile,135,0,45.0861,a8w8_bpreshuffle_cktile_0x0x8x4x1x0x0x0x0x3_128x128x256_1x4x1_16x16x128_default,1524.18,1767.55,0.0
gfx950,256,512,8192,28672,torch.float8_e4m3fn,cktile,135,0,129.391,a8w8_bpreshuffle_cktile_0x0x8x4x1x0x0x0x0x3_128x128x256_1x4x1_16x16x128_default,1858.85,1993.57,0.0
gfx950,256,1024,8192,1024,torch.float8_e4m3fn,flydsl,925,0,16.7804,flydsl_bpreshuflle_128x128x128_F8_F8_B16_1x1x1x2_default,1023.81,1562.2,0.0
gfx950,256,1024,8192,2048,torch.float8_e4m3fn,ck,154,0,25.4967,a8w8_bpreshuffle_256x128x256x256_16x16_16x16_16x16x1_16x16x1_1x16x1x16_8x8x1_1x2_intrawave_v3,1347.62,1398.28,0.0
gfx950,256,1024,8192,3584,torch.float8_e4m3fn,ck,154,0,36.3958,a8w8_bpreshuffle_256x128x256x256_16x16_16x16_16x16x1_16x16x1_1x16x1x16_8x8x1_1x2_intrawave_v3,1652.1,1368.49,0.0
gfx950,256,1024,8192,7168,torch.float8_e4m3fn,ck,154,0,61.9703,a8w8_bpreshuffle_256x128x256x256_16x16_16x16_16x16x1_16x16x1_1x16x1x16_8x8x1_1x2_intrawave_v3,1940.59,1336.73,0.0
gfx950,256,1024,8192,8192,torch.float8_e4m3fn,ck,154,0,69.8202,a8w8_bpreshuffle_256x128x256x256_16x16_16x16_16x16x1_16x16x1_1x16x1x16_8x8x1_1x2_intrawave_v3,1968.47,1321.6,0.0
gfx950,256,1024,8192,28672,torch.float8_e4m3fn,ck,154,0,201.8712,a8w8_bpreshuffle_256x128x256x256_16x16_16x16_16x16x1_16x16x1_1x16x1x16_8x8x1_1x2_intrawave_v3,2382.89,1392.07,0.0
gfx950,256,2048,8192,1024,torch.float8_e4m3fn,flydsl,846,0,23.7296,flydsl_bpreshuflle_128x256x128_F8_F8_B16_1x1x0x2_default,1447.97,1855.92,0.0
gfx950,256,2048,8192,2048,torch.float8_e4m3fn,flydsl,269,0,42.4634,flydsl_bpreshuflle_128x256x128_F8_F8_B16_1x1x1x0_default,1618.32,1284.07,0.0
gfx950,256,2048,8192,3584,torch.float8_e4m3fn,flydsl,684,0,66.9636,flydsl_bpreshuflle_128x256x128_F8_F8_B16_1x0x0x2_default,1795.89,1049.15,0.0
gfx950,256,2048,8192,7168,torch.float8_e4m3fn,ck,33,0,108.3244,a8w8_bpreshuffle_256x256x256x128_16x16_16x16_8x32x1_8x32x1_1x32x1x8_8x8x1_2x1_intrawave_v3,2220.35,987.36,0.0
gfx950,256,2048,8192,8192,torch.float8_e4m3fn,cktile,155,0,122.2729,a8w8_bpreshuffle_cktile_0x0x8x4x1x0x0x0x0x4_256x256x128_1x4x1_16x16x128_default,2248.07,960.48,0.0
gfx950,256,2048,8192,28672,torch.float8_e4m3fn,cktile,154,0,329.0964,a8w8_bpreshuffle_cktile_0x0x8x4x1x0x0x0x0x3_256x256x128_1x4x1_16x16x128_default,2923.38,994.1,0.0
gfx950,256,4096,8192,1024,torch.float8_e4m3fn,flydsl,518,0,47.2123,flydsl_bpreshuflle_128x256x128_F8_F8_B16_1x1x0x1_default,1455.54,1687.95,0.0
gfx950,256,4096,8192,2048,torch.float8_e4m3fn,flydsl,601,0,76.8953,flydsl_bpreshuflle_128x256x128_F8_F8_B16_1x1x1x1_default,1787.35,1200.0,0.0
gfx950,256,4096,8192,3584,torch.float8_e4m3fn,flydsl,825,0,119.4876,flydsl_bpreshuflle_256x128x128_F8_F8_B16_2x0x1x2_default,2012.91,930.21,0.0
gfx950,256,4096,8192,7168,torch.float8_e4m3fn,flydsl,825,0,206.4213,flydsl_bpreshuflle_256x128x128_F8_F8_B16_2x0x1x2_default,2330.36,751.81,0.0
gfx950,256,4096,8192,8192,torch.float8_e4m3fn,flydsl,979,0,228.5549,flydsl_bpreshuflle_128x256x128_F8_F8_B16_2x1x1x2_default,2405.36,734.06,0.0
gfx950,256,4096,8192,28672,torch.float8_e4m3fn,cktile,10,0,643.0461,a8w8_bpreshuffle_cktile_0x0x8x4x1x0x0x0x0x1_256x256x128_1x4x1_16x16x128_default,2992.24,652.26,0.0
gfx950,256,8192,8192,1024,torch.float8_e4m3fn,flydsl,186,0,95.7087,flydsl_bpreshuflle_128x256x128_F8_F8_B16_1x1x0x0_default,1436.01,1577.65,0.0
gfx950,256,8192,8192,2048,torch.float8_e4m3fn,flydsl,927,0,146.7966,flydsl_bpreshuflle_128x256x128_F8_F8_B16_1x1x1x2_default,1872.51,1142.89,0.0
gfx950,256,8192,8192,3584,torch.float8_e4m3fn,flydsl,825,0,216.5513,flydsl_bpreshuflle_256x128x128_F8_F8_B16_2x0x1x2_default,2221.35,890.96,0.0
gfx950,256,8192,8192,7168,torch.float8_e4m3fn,flydsl,825,0,387.3297,flydsl_bpreshuflle_256x128x128_F8_F8_B16_2x0x1x2_default,2483.86,649.73,0.0
gfx950,256,8192,8192,8192,torch.float8_e4m3fn,flydsl,979,0,435.3376,flydsl_bpreshuflle_128x256x128_F8_F8_B16_2x1x1x2_default,2525.65,616.61,0.0
gfx950,256,8192,8192,28672,torch.float8_e4m3fn,cktile,10,0,1294.8599,a8w8_bpreshuffle_cktile_0x0x8x4x1x0x0x0x0x1_256x256x128_1x4x1_16x16x128_default,2971.97,466.44,0.0
gfx950,256,16384,8192,1024,torch.float8_e4m3fn,flydsl,927,0,181.2201,flydsl_bpreshuflle_128x256x128_F8_F8_B16_1x1x1x2_default,1516.82,1620.14,0.0
gfx950,256,16384,8192,2048,torch.float8_e4m3fn,flydsl,103,0,287.1698,flydsl_bpreshuflle_128x256x128_F8_F8_B16_1x0x1x0_default,1914.39,1110.03,0.0
gfx950,256,16384,8192,3584,torch.float8_e4m3fn,flydsl,825,0,427.2274,flydsl_bpreshuflle_256x128x128_F8_F8_B16_2x0x1x2_default,2251.9,834.49,0.0
gfx950,256,16384,8192,7168,torch.float8_e4m3fn,flydsl,825,0,768.6011,flydsl_bpreshuflle_256x128x128_F8_F8_B16_2x0x1x2_default,2503.44,578.45,0.0
gfx950,256,16384,8192,8192,torch.float8_e4m3fn,flydsl,979,0,871.056,flydsl_bpreshuflle_128x256x128_F8_F8_B16_2x1x1x2_default,2524.55,539.3,0.0
gfx950,256,16384,8192,28672,torch.float8_e4m3fn,cktile,154,0,2614.7771,a8w8_bpreshuffle_cktile_0x0x8x4x1x0x0x0x0x3_256x256x128_1x4x1_16x16x128_default,2943.49,372.15,0.0
gfx950,256,32768,8192,1024,torch.float8_e4m3fn,ck,51,0,367.838,a8w8_bpreshuffle_256x192x128x128_16x16_16x16_8x32x1_8x32x1_1x32x1x8_8x8x1_2x1_intrawave_v3,1494.56,1573.56,0.0
gfx950,256,32768,8192,2048,torch.float8_e4m3fn,ck,143,0,576.9388,a8w8_bpreshuffle_256x192x128x128_16x16_16x16_8x32x1_8x32x1_1x16x1x16_8x8x1_1x2_intrawave_v3,1905.77,1075.95,0.0
gfx950,256,32768,8192,3584,torch.float8_e4m3fn,flydsl,825,0,864.7149,flydsl_bpreshuflle_256x128x128_F8_F8_B16_2x0x1x2_default,2225.18,790.63,0.0
gfx950,256,32768,8192,7168,torch.float8_e4m3fn,ck,33,0,1526.85,a8w8_bpreshuffle_256x256x256x128_16x16_16x16_8x32x1_8x32x1_1x32x1x8_8x8x1_2x1_intrawave_v3,2520.41,543.91,0.0
gfx950,256,32768,8192,8192,torch.float8_e4m3fn,cktile,115,0,1726.1188,a8w8_bpreshuffle_cktile_0x0x8x4x1x0x0x0x0x2_96x256x128_1x4x1_16x16x128_default,2547.94,505.42,0.0
gfx950,256,32768,8192,28672,torch.float8_e4m3fn,cktile,10,0,5232.9311,a8w8_bpreshuffle_cktile_0x0x8x4x1x0x0x0x0x1_256x256x128_1x4x1_16x16x128_default,2941.59,327.02,0.0
gfx950,256,1,9216,16384,torch.float8_e4m3fn,flydsl,1159,0,28.55,flydsl_bpreshuflle_16x64x512_F8_F8_B16_2x1x0x3_default,10.58,5290.01,0.0
gfx950,256,16,9216,16384,torch.float8_e4m3fn,ck,5,0,30.546,a8w8_bpreshuffle_256x16x64x512_16x16_16x16_32x8x1_32x8x1_1x16x1x16_4x4x1_1x1_intrawave_v1,158.18,4961.44,0.0
gfx950,256,32,9216,16384,torch.float8_e4m3fn,flydsl,857,0,34.613,flydsl_bpreshuflle_32x64x512_F8_F8_B16_2x1x0x2_default,279.19,4394.56,0.0
gfx950,256,64,9216,16384,torch.float8_e4m3fn,flydsl,624,0,45.6522,flydsl_bpreshuflle_64x64x256_F8_F8_B16_2x1x1x1_default,423.36,3356.32,0.0
gfx950,256,128,9216,16384,torch.float8_e4m3fn,cktile,75,0,53.8184,a8w8_bpreshuffle_cktile_0x0x8x4x1x0x0x0x0x1_48x128x256_1x4x1_16x16x128_default,718.24,2888.44,0.0
gfx950,256,256,9216,16384,torch.float8_e4m3fn,cktile,132,0,66.0848,a8w8_bpreshuffle_cktile_0x0x8x4x1x0x0x0x0x2_96x128x256_1x4x1_16x16x128_default,1169.85,2419.74,0.0
gfx950,256,512,9216,16384,torch.float8_e4m3fn,ck,149,0,92.2759,a8w8_bpreshuffle_256x128x192x256_16x16_16x16_16x16x1_16x16x1_1x32x1x8_8x8x1_2x1_intrawave_v3,1675.61,1829.52,0.0
gfx950,256,1024,9216,16384,torch.float8_e4m3fn,cktile,233,0,142.3588,a8w8_bpreshuffle_cktile_0x0x8x4x1x0x0x0x0x4_224x192x128_1x4x1_16x16x128_default,2172.24,1311.1,0.0
gfx950,256,2048,9216,16384,torch.float8_e4m3fn,cktile,55,0,265.8551,a8w8_bpreshuffle_cktile_0x0x8x4x1x0x0x0x0x2_128x192x128_1x4x1_16x16x128_default,2326.36,836.16,0.0
gfx950,256,4096,9216,16384,torch.float8_e4m3fn,cktile,121,0,464.1345,a8w8_bpreshuffle_cktile_0x0x8x4x1x0x0x0x0x2_160x192x128_1x4x1_16x16x128_default,2665.07,632.58,0.0
gfx950,256,8192,9216,16384,torch.float8_e4m3fn,cktile,235,0,919.8305,a8w8_bpreshuffle_cktile_0x0x8x4x1x0x0x0x0x4_256x192x128_1x4x1_16x16x128_default,2689.52,474.23,0.0
gfx950,256,16384,9216,16384,torch.float8_e4m3fn,cktile,10,0,1743.5349,a8w8_bpreshuffle_cktile_0x0x8x4x1x0x0x0x0x1_256x256x128_1x4x1_16x16x128_default,2837.8,413.77,0.0
gfx950,256,32768,9216,16384,torch.float8_e4m3fn,cktile,154,0,3492.6909,a8w8_bpreshuffle_cktile_0x0x8x4x1x0x0x0x0x3_256x256x128_1x4x1_16x16x128_default,2833.23,369.87,0.0
gfx950,256,1,10240,8192,torch.float8_e4m3fn,flydsl,929,0,17.3869,flydsl_bpreshuflle_16x64x512_F8_F8_B16_2x1x1x2_default,9.65,4826.32,0.0
gfx950,256,16,10240,8192,torch.float8_e4m3fn,ck,10,0,18.0502,a8w8_bpreshuffle_128x16x32x512_16x16_16x16_32x4x1_32x4x1_1x16x1x8_4x4x1_1x1_intrawave_v1,148.72,4672.79,0.0
gfx950,256,32,10240,8192,torch.float8_e4m3fn,cktile,37,0,20.9702,a8w8_bpreshuffle_cktile_0x0x8x4x1x0x0x0x0x2_32x64x512_1x4x1_16x16x128_default,256.02,4044.0,0.0
gfx950,256,64,10240,8192,torch.float8_e4m3fn,ck,114,0,25.7553,a8w8_bpreshuffle_256x64x64x256_16x16_16x16_16x16x1_16x16x1_1x32x1x8_8x8x1_2x1_intrawave_v3,416.9,3328.29,0.0
gfx950,256,128,10240,8192,torch.float8_e4m3fn,ck,120,0,31.1068,a8w8_bpreshuffle_256x48x128x256_16x16_16x16_16x16x1_16x16x1_1x16x1x16_8x8x1_1x2_intrawave_v1,690.36,2814.69,0.0
gfx950,256,256,10240,8192,torch.float8_e4m3fn,cktile,253,0,39.3727,a8w8_bpreshuffle_cktile_0x0x8x4x1x0x0x0x0x4_96x128x256_1x4x1_16x16x128_default,1090.85,2316.99,0.0
gfx950,256,512,10240,8192,torch.float8_e4m3fn,ck,143,0,56.8519,a8w8_bpreshuffle_256x192x128x128_16x16_16x16_8x32x1_8x32x1_1x16x1x16_8x8x1_1x2_intrawave_v3,1510.93,1733.74,0.0
gfx950,256,1024,10240,8192,torch.float8_e4m3fn,ck,51,0,95.1718,a8w8_bpreshuffle_256x192x128x128_16x16_16x16_8x32x1_8x32x1_1x32x1x8_8x8x1_2x1_intrawave_v3,1805.14,1189.91,0.0
gfx950,256,2048,10240,8192,torch.float8_e4m3fn,flydsl,1280,0,168.0196,flydsl_bpreshuflle_128x128x256_F8_F8_B16_2x1x1x3_default,2044.98,848.75,0.0
gfx950,256,4096,10240,8192,torch.float8_e4m3fn,flydsl,979,0,280.4078,flydsl_bpreshuflle_128x256x128_F8_F8_B16_2x1x1x2_default,2450.7,717.98,0.0
gfx950,256,8192,10240,8192,torch.float8_e4m3fn,flydsl,979,0,533.7477,flydsl_bpreshuflle_128x256x128_F8_F8_B16_2x1x1x2_default,2574.98,597.22,0.0
gfx950,256,16384,10240,8192,torch.float8_e4m3fn,flydsl,979,0,1059.2396,flydsl_bpreshuflle_128x256x128_F8_F8_B16_2x1x1x2_default,2595.05,522.68,0.0
gfx950,256,32768,10240,8192,torch.float8_e4m3fn,ck,154,0,2180.7525,a8w8_bpreshuffle_256x128x256x256_16x16_16x16_16x16x1_16x16x1_1x16x1x16_8x8x1_1x2_intrawave_v3,2520.95,469.29,0.0
gfx950,256,1,12800,5120,torch.float8_e4m3fn,flydsl,22,0,12.9565,flydsl_bpreshuflle_16x64x512_F8_F8_B16_2x0x0x0_default,10.12,5060.53,0.0
gfx950,256,16,12800,5120,torch.float8_e4m3fn,flydsl,848,0,13.1569,flydsl_bpreshuflle_16x64x512_F8_F8_B16_2x1x0x2_default,159.4,5018.47,0.0
gfx950,256,32,12800,5120,torch.float8_e4m3fn,flydsl,1018,0,14.4111,flydsl_bpreshuflle_32x64x512_F8_F8_B16_2x0x0x3_default,291.05,4615.82,0.0
gfx950,256,64,12800,5120,torch.float8_e4m3fn,flydsl,541,0,18.6039,flydsl_bpreshuflle_64x64x256_F8_F8_B16_2x1x0x1_default,450.91,3628.38,0.0
gfx950,256,128,12800,5120,torch.float8_e4m3fn,ck,65,0,22.6804,a8w8_bpreshuffle_256x128x64x256_16x16_16x16_16x16x1_16x16x1_1x32x1x8_8x8x1_2x1_intrawave_v3,739.72,3062.92,0.0
gfx950,256,256,12800,5120,torch.float8_e4m3fn,flydsl,152,0,31.0997,flydsl_bpreshuflle_128x128x256_F8_F8_B16_2x0x1x0_default,1078.93,2360.16,0.0
gfx950,256,512,12800,5120,torch.float8_e4m3fn,ck,138,0,46.4049,a8w8_bpreshuffle_256x112x256x256_16x16_16x16_16x16x1_16x16x1_1x16x1x16_8x8x1_1x2_intrawave_v3,1446.16,1751.21,0.0
gfx950,256,1024,12800,5120,torch.float8_e4m3fn,cktile,130,0,80.2052,a8w8_bpreshuffle_cktile_0x0x8x4x1x0x0x0x0x2_224x128x128_1x4x1_16x16x128_default,1673.43,1209.31,0.0
gfx950,256,2048,12800,5120,torch.float8_e4m3fn,ck,51,0,146.6395,a8w8_bpreshuffle_256x192x128x128_16x16_16x16_8x32x1_8x32x1_1x32x1x8_8x8x1_2x1_intrawave_v3,1830.58,875.96,0.0
gfx950,256,4096,12800,5120,torch.float8_e4m3fn,flydsl,825,0,249.1087,flydsl_bpreshuflle_256x128x128_F8_F8_B16_2x0x1x2_default,2155.17,768.2,0.0
gfx950,256,8192,12800,5120,torch.float8_e4m3fn,flydsl,825,0,456.4241,flydsl_bpreshuflle_256x128x128_F8_F8_B16_2x0x1x2_default,2352.51,694.96,0.0
gfx950,256,16384,12800,5120,torch.float8_e4m3fn,flydsl,825,0,882.1332,flydsl_bpreshuflle_256x128x128_F8_F8_B16_2x0x1x2_default,2434.42,644.86,0.0
gfx950,256,32768,12800,5120,torch.float8_e4m3fn,cktile,115,0,1784.2978,a8w8_bpreshuffle_cktile_0x0x8x4x1x0x0x0x0x2_96x256x128_1x4x1_16x16x128_default,2407.09,600.89,0.0
gfx950,256,1,13312,16384,torch.float8_e4m3fn,flydsl,686,0,39.3036,flydsl_bpreshuflle_16x64x512_F8_F8_B16_2x0x0x2_default,11.1,5550.3,0.0
gfx950,256,16,13312,16384,torch.float8_e4m3fn,ck,25,0,39.8372,a8w8_bpreshuffle_256x16x64x512_16x16_16x16_32x8x1_32x8x1_1x16x1x16_4x4x1_1x1_intrawave_v2,175.2,5492.15,0.0
gfx950,256,32,13312,16384,torch.float8_e4m3fn,flydsl,529,0,40.8319,flydsl_bpreshuflle_32x64x512_F8_F8_B16_2x1x0x1_default,341.86,5375.21,0.0
gfx950,256,64,13312,16384,torch.float8_e4m3fn,ck,114,0,50.5591,a8w8_bpreshuffle_256x64x64x256_16x16_16x16_16x16x1_16x16x1_1x32x1x8_8x8x1_2x1_intrawave_v3,552.17,4368.28,0.0
gfx950,256,128,13312,16384,torch.float8_e4m3fn,ck,65,0,61.0826,a8w8_bpreshuffle_256x128x64x256_16x16_16x16_16x16x1_16x16x1_1x32x1x8_8x8x1_2x1_intrawave_v3,914.08,3660.76,0.0
gfx950,256,256,13312,16384,torch.float8_e4m3fn,cktile,1,0,78.4817,a8w8_bpreshuffle_cktile_0x0x8x4x1x0x0x0x0x1_128x128x256_1x4x1_16x16x128_default,1422.87,2919.33,0.0
gfx950,256,512,13312,16384,torch.float8_e4m3fn,ck,154,0,119.7862,a8w8_bpreshuffle_256x128x256x256_16x16_16x16_16x16x1_16x16x1_1x16x1x16_8x8x1_1x2_intrawave_v3,1864.47,2004.6,0.0
gfx950,256,1024,13312,16384,torch.float8_e4m3fn,cktile,10,0,188.278,a8w8_bpreshuffle_cktile_0x0x8x4x1x0x0x0x0x1_256x256x128_1x4x1_16x16x128_default,2372.43,1392.32,0.0
gfx950,256,2048,13312,16384,torch.float8_e4m3fn,cktile,155,0,366.501,a8w8_bpreshuffle_cktile_0x0x8x4x1x0x0x0x0x4_256x256x128_1x4x1_16x16x128_default,2437.52,835.43,0.0
gfx950,256,4096,13312,16384,torch.float8_e4m3fn,flydsl,825,0,704.7777,flydsl_bpreshuflle_256x128x128_F8_F8_B16_2x0x1x2_default,2535.13,559.42,0.0
gfx950,256,8192,13312,16384,torch.float8_e4m3fn,cktile,10,0,1317.8416,a8w8_bpreshuffle_cktile_0x0x8x4x1x0x0x0x0x1_256x256x128_1x4x1_16x16x128_default,2711.56,432.85,0.0
gfx950,256,16384,13312,16384,torch.float8_e4m3fn,cktile,154,0,2517.5291,a8w8_bpreshuffle_cktile_0x0x8x4x1x0x0x0x0x3_256x256x128_1x4x1_16x16x128_default,2838.83,366.53,0.0
gfx950,256,32768,13312,16384,torch.float8_e4m3fn,cktile,10,0,5030.6118,a8w8_bpreshuffle_cktile_0x0x8x4x1x0x0x0x0x1_256x256x128_1x4x1_16x16x128_default,2841.33,323.5,0.0
gfx950,256,1,14336,8192,torch.float8_e4m3fn,ck,10,0,21.8553,a8w8_bpreshuffle_128x16x32x512_16x16_16x16_32x4x1_32x4x1_1x16x1x8_4x4x1_1x1_intrawave_v1,10.75,5375.24,0.0
gfx950,256,16,14336,8192,torch.float8_e4m3fn,ck,10,0,21.3952,a8w8_bpreshuffle_128x16x32x512_16x16_16x16_32x4x1_32x4x1_1x16x1x8_4x4x1_1x1_intrawave_v1,175.65,5516.67,0.0
gfx950,256,32,14336,8192,torch.float8_e4m3fn,flydsl,31,0,25.1546,flydsl_bpreshuflle_32x64x512_F8_F8_B16_2x0x0x0_default,298.8,4715.64,0.0
gfx950,256,64,14336,8192,torch.float8_e4m3fn,ck,114,0,29.5305,a8w8_bpreshuffle_256x64x64x256_16x16_16x16_16x16x1_16x16x1_1x32x1x8_8x8x1_2x1_intrawave_v3,509.05,4056.82,0.0
gfx950,256,128,14336,8192,torch.float8_e4m3fn,ck,144,0,37.2517,a8w8_bpreshuffle_256x128x64x256_16x16_16x16_16x16x1_16x16x1_1x32x1x8_8x8x1_2x1_intrawave_v3,807.07,3279.29,0.0
gfx950,256,256,14336,8192,torch.float8_e4m3fn,cktile,29,0,46.2123,a8w8_bpreshuffle_cktile_0x0x8x4x1x0x0x0x0x2_128x128x256_1x4x1_16x16x128_default,1301.16,2745.54,0.0
gfx950,256,512,14336,8192,torch.float8_e4m3fn,ck,154,0,65.8134,a8w8_bpreshuffle_256x128x256x256_16x16_16x16_16x16x1_16x16x1_1x16x1x16_8x8x1_1x2_intrawave_v3,1827.27,2071.23,0.0
gfx950,256,1024,14336,8192,torch.float8_e4m3fn,cktile,154,0,116.9719,a8w8_bpreshuffle_cktile_0x0x8x4x1x0x0x0x0x3_256x256x128_1x4x1_16x16x128_default,2056.2,1326.72,0.0
gfx950,256,2048,14336,8192,torch.float8_e4m3fn,cktile,115,0,218.7174,a8w8_bpreshuffle_cktile_0x0x8x4x1x0x0x0x0x2_96x256x128_1x4x1_16x16x128_default,2199.35,882.13,0.0
gfx950,256,4096,14336,8192,torch.float8_e4m3fn,flydsl,825,0,386.6129,flydsl_bpreshuflle_256x128x128_F8_F8_B16_2x0x1x2_default,2488.47,694.33,0.0
gfx950,256,8192,14336,8192,torch.float8_e4m3fn,flydsl,979,0,738.2272,flydsl_bpreshuflle_128x256x128_F8_F8_B16_2x1x1x2_default,2606.44,568.16,0.0
gfx950,256,16384,14336,8192,torch.float8_e4m3fn,flydsl,825,0,1489.9573,flydsl_bpreshuflle_256x128x128_F8_F8_B16_2x0x1x2_default,2582.82,484.19,0.0
gfx950,256,32768,14336,8192,torch.float8_e4m3fn,cktile,82,0,2971.0677,a8w8_bpreshuffle_cktile_0x0x8x4x1x0x0x0x0x1_96x256x128_1x4x1_16x16x128_default,2590.51,446.1,0.0
gfx950,256,1,16384,2048,torch.float8_e4m3fn,flydsl,333,0,7.7788,flydsl_bpreshuflle_16x64x512_F8_F8_B16_1x0x0x1_default,8.63,4318.05,0.0
gfx950,256,1,16384,4096,torch.float8_e4m3fn,flydsl,520,0,14.2993,flydsl_bpreshuflle_16x64x512_F8_F8_B16_2x1x0x1_default,9.39,4695.74,0.0
gfx950,256,1,16384,6656,torch.float8_e4m3fn,flydsl,1159,0,19.6315,flydsl_bpreshuflle_16x64x512_F8_F8_B16_2x1x0x3_default,11.11,5556.95,0.0
gfx950,256,1,16384,8192,torch.float8_e4m3fn,ck,24,0,25.4479,a8w8_bpreshuffle_128x16x32x512_16x16_16x16_32x4x1_32x4x1_1x16x1x8_4x4x1_1x1_intrawave_v2,10.55,5275.83,0.0
gfx950,256,1,16384,13312,torch.float8_e4m3fn,flydsl,745,0,37.3614,flydsl_bpreshuflle_16x64x256_F8_F8_B16_1x0x1x2_default,11.68,5838.91,0.0
gfx950,256,1,16384,26624,torch.float8_e4m3fn,cktile,144,0,71.1231,a8w8_bpreshuffle_cktile_0x0x8x4x1x0x0x0x0x4_16x64x256_1x4x1_16x16x128_default,12.27,6133.97,0.0
gfx950,256,4,16384,6656,torch.float8_e4m3fn,flydsl,1009,0,19.7247,flydsl_bpreshuflle_16x64x512_F8_F8_B16_2x0x0x3_default,44.23,5536.69,0.0
gfx950,256,8,16384,6656,torch.float8_e4m3fn,flydsl,848,0,19.7962,flydsl_bpreshuflle_16x64x512_F8_F8_B16_2x1x0x2_default,88.14,5524.66,0.0
gfx950,256,16,16384,2048,torch.float8_e4m3fn,flydsl,333,0,7.7788,flydsl_bpreshuflle_16x64x512_F8_F8_B16_1x0x0x1_default,138.03,4385.19,0.0
gfx950,256,16,16384,4096,torch.float8_e4m3fn,ck,10,0,14.0016,a8w8_bpreshuffle_128x16x32x512_16x16_16x16_32x4x1_32x4x1_1x16x1x8_4x4x1_1x1_intrawave_v1,153.37,4835.07,0.0
gfx950,256,16,16384,6656,torch.float8_e4m3fn,flydsl,686,0,19.8218,flydsl_bpreshuflle_16x64x512_F8_F8_B16_2x0x0x2_default,176.05,5533.44,0.0
gfx950,256,16,16384,8192,torch.float8_e4m3fn,ck,10,0,24.0843,a8w8_bpreshuffle_128x16x32x512_16x16_16x16_32x4x1_32x4x1_1x16x1x8_4x4x1_1x1_intrawave_v1,178.33,5600.04,0.0
gfx950,256,16,16384,13312,torch.float8_e4m3fn,flydsl,188,0,37.636,flydsl_bpreshuflle_16x64x512_F8_F8_B16_2x1x0x0_default,185.44,5814.67,0.0
gfx950,256,16,16384,26624,torch.float8_e4m3fn,flydsl,354,0,71.2847,flydsl_bpreshuflle_16x64x512_F8_F8_B16_2x0x0x1_default,195.82,6132.56,0.0
gfx950,256,32,16384,2048,torch.float8_e4m3fn,ck,12,0,8.8156,a8w8_bpreshuffle_256x32x64x512_16x16_16x16_32x8x1_32x8x1_1x32x1x8_8x8x1_1x2_intrawave_v1,243.6,3932.64,0.0
gfx950,256,32,16384,4096,torch.float8_e4m3fn,flydsl,1018,0,15.3879,flydsl_bpreshuflle_32x64x512_F8_F8_B16_2x0x0x3_default,279.11,4437.81,0.0
gfx950,256,32,16384,6656,torch.float8_e4m3fn,flydsl,197,0,20.6179,flydsl_bpreshuflle_32x64x512_F8_F8_B16_2x1x0x0_default,338.51,5350.37,0.0
gfx950,256,32,16384,8192,torch.float8_e4m3fn,cktile,9,0,27.6417,a8w8_bpreshuffle_cktile_0x0x8x4x1x0x0x0x0x1_32x64x512_1x4x1_16x16x128_default,310.76,4903.04,0.0
gfx950,256,32,16384,13312,torch.float8_e4m3fn,flydsl,363,0,38.3032,flydsl_bpreshuflle_32x64x512_F8_F8_B16_2x0x0x1_default,364.43,5732.64,0.0
gfx950,256,32,16384,26624,torch.float8_e4m3fn,flydsl,363,0,71.7202,flydsl_bpreshuflle_32x64x512_F8_F8_B16_2x0x0x1_default,389.25,6108.57,0.0
gfx950,256,64,16384,2048,torch.float8_e4m3fn,flydsl,869,0,10.0391,flydsl_bpreshuflle_64x64x256_F8_F8_B16_2x1x0x2_default,427.82,3564.33,0.0
gfx950,256,64,16384,4096,torch.float8_e4m3fn,ck,114,0,19.0594,a8w8_bpreshuffle_256x64x64x256_16x16_16x16_16x16x1_16x16x1_1x32x1x8_8x8x1_2x1_intrawave_v3,450.69,3644.82,0.0
gfx950,256,64,16384,6656,torch.float8_e4m3fn,ck,114,0,24.5126,a8w8_bpreshuffle_256x64x64x256_16x16_16x16_16x16x1_16x16x1_1x32x1x8_8x8x1_2x1_intrawave_v3,569.45,4551.74,0.0
gfx950,256,64,16384,8192,torch.float8_e4m3fn,ck,119,0,31.4037,a8w8_bpreshuffle_256x32x128x256_16x16_16x16_16x16x1_16x16x1_1x16x1x16_8x8x1_1x2_intrawave_v1,547.07,4357.42,0.0
gfx950,256,64,16384,13312,torch.float8_e4m3fn,ck,114,0,44.9751,a8w8_bpreshuffle_256x64x64x256_16x16_16x16_16x16x1_16x16x1_1x32x1x8_8x8x1_2x1_intrawave_v3,620.73,4915.01,0.0
gfx950,256,64,16384,26624,torch.float8_e4m3fn,ck,114,0,83.2724,a8w8_bpreshuffle_256x64x64x256_16x16_16x16_16x16x1_16x16x1_1x32x1x8_8x8x1_2x1_intrawave_v3,670.51,5283.97,0.0
gfx950,256,128,16384,2048,torch.float8_e4m3fn,flydsl,1483,0,12.3136,flydsl_bpreshuflle_128x64x256_F8_F8_B16_2x1x0x4_default,697.6,3086.9,0.0
gfx950,256,128,16384,4096,torch.float8_e4m3fn,ck,144,0,23.4825,a8w8_bpreshuffle_256x128x64x256_16x16_16x16_16x16x1_16x16x1_1x32x1x8_8x8x1_2x1_intrawave_v3,731.6,3058.77,0.0
gfx950,256,128,16384,6656,torch.float8_e4m3fn,ck,144,0,31.2393,a8w8_bpreshuffle_256x128x64x256_16x16_16x16_16x16x1_16x16x1_1x32x1x8_8x8x1_2x1_intrawave_v3,893.66,3652.39,0.0
gfx950,256,128,16384,8192,torch.float8_e4m3fn,cktile,24,0,38.2204,a8w8_bpreshuffle_cktile_0x0x8x4x1x0x0x0x0x1_64x128x256_1x4x1_16x16x128_default,898.99,3648.85,0.0
gfx950,256,128,16384,13312,torch.float8_e4m3fn,cktile,40,0,55.2899,a8w8_bpreshuffle_cktile_0x0x8x4x1x0x0x0x0x2_128x64x256_1x4x1_16x16x128_default,1009.85,4051.41,0.0
gfx950,256,128,16384,26624,torch.float8_e4m3fn,cktile,158,0,103.2711,a8w8_bpreshuffle_cktile_0x0x8x4x1x0x0x0x0x3_128x64x256_1x4x1_16x16x128_default,1081.32,4297.52,0.0
gfx950,256,256,16384,2048,torch.float8_e4m3fn,flydsl,1130,0,16.7273,flydsl_bpreshuflle_128x128x256_F8_F8_B16_2x0x1x3_default,1027.06,2538.8,0.0
gfx950,256,256,16384,4096,torch.float8_e4m3fn,ck,139,0,28.7093,a8w8_bpreshuffle_256x128x128x256_16x16_16x16_16x16x1_16x16x1_1x16x1x16_8x8x1_1x2_intrawave_v3,1196.82,2666.25,0.0
gfx950,256,256,16384,6656,torch.float8_e4m3fn,cktile,29,0,41.8226,a8w8_bpreshuffle_cktile_0x0x8x4x1x0x0x0x0x2_128x128x256_1x4x1_16x16x128_default,1335.03,2848.81,0.0
gfx950,256,256,16384,8192,torch.float8_e4m3fn,cktile,1,0,48.6422,a8w8_bpreshuffle_cktile_0x0x8x4x1x0x0x0x0x1_128x128x256_1x4x1_16x16x128_default,1412.75,2974.85,0.0
gfx950,256,256,16384,13312,torch.float8_e4m3fn,cktile,135,0,71.204,a8w8_bpreshuffle_cktile_0x0x8x4x1x0x0x0x0x3_128x128x256_1x4x1_16x16x128_default,1568.3,3228.76,0.0
gfx950,256,256,16384,26624,torch.float8_e4m3fn,cktile,29,0,131.8695,a8w8_bpreshuffle_cktile_0x0x8x4x1x0x0x0x0x2_128x128x256_1x4x1_16x16x128_default,1693.63,3423.17,0.0
gfx950,256,512,16384,2048,torch.float8_e4m3fn,flydsl,495,0,25.8961,flydsl_bpreshuflle_256x128x128_F8_F8_B16_2x0x1x1_default,1326.83,1984.09,0.0
gfx950,256,512,16384,4096,torch.float8_e4m3fn,ck,154,0,43.5445,a8w8_bpreshuffle_256x128x256x256_16x16_16x16_16x16x1_16x16x1_1x16x1x16_8x8x1_1x2_intrawave_v3,1578.14,1974.61,0.0
gfx950,256,512,16384,6656,torch.float8_e4m3fn,ck,154,0,60.6062,a8w8_bpreshuffle_256x128x256x256_16x16_16x16_16x16x1_16x16x1_1x16x1x16_8x8x1_1x2_intrawave_v3,1842.54,2132.41,0.0
gfx950,256,512,16384,8192,torch.float8_e4m3fn,ck,154,0,69.0175,a8w8_bpreshuffle_256x128x256x256_16x16_16x16_16x16x1_16x16x1_1x16x1x16_8x8x1_1x2_intrawave_v3,1991.36,2248.55,0.0
gfx950,256,512,16384,13312,torch.float8_e4m3fn,ck,154,0,106.2418,a8w8_bpreshuffle_256x128x256x256_16x16_16x16_16x16x1_16x16x1_1x16x1x16_8x8x1_1x2_intrawave_v3,2102.17,2274.97,0.0
gfx950,256,512,16384,26624,torch.float8_e4m3fn,ck,154,0,195.6027,a8w8_bpreshuffle_256x128x256x256_16x16_16x16_16x16x1_16x16x1_1x16x1x16_8x8x1_1x2_intrawave_v3,2283.59,2385.53,0.0
gfx950,256,1024,16384,2048,torch.float8_e4m3fn,flydsl,927,0,47.073,flydsl_bpreshuflle_128x256x128_F8_F8_B16_1x1x1x2_default,1459.85,1470.18,0.0
gfx950,256,1024,16384,4096,torch.float8_e4m3fn,ck,107,0,77.2916,a8w8_bpreshuffle_256x256x256x128_16x16_16x16_8x32x1_8x32x1_1x16x1x16_4x4x1_1x1_intrawave_v3,1778.19,1356.65,0.0
gfx950,256,1024,16384,6656,torch.float8_e4m3fn,ck,33,0,104.7702,a8w8_bpreshuffle_256x256x256x128_16x16_16x16_8x32x1_8x32x1_1x32x1x8_8x8x1_2x1_intrawave_v3,2131.7,1426.19,0.0
gfx950,256,1024,16384,8192,torch.float8_e4m3fn,cktile,154,0,121.4869,a8w8_bpreshuffle_cktile_0x0x8x4x1x0x0x0x0x3_256x256x128_1x4x1_16x16x128_default,2262.61,1450.04,0.0
gfx950,256,1024,16384,13312,torch.float8_e4m3fn,cktile,155,0,176.2123,a8w8_bpreshuffle_cktile_0x0x8x4x1x0x0x0x0x4_256x256x128_1x4x1_16x16x128_default,2534.88,1505.51,0.0
gfx950,256,1024,16384,26624,torch.float8_e4m3fn,cktile,155,0,314.8139,a8w8_bpreshuffle_cktile_0x0x8x4x1x0x0x0x0x4_256x256x128_1x4x1_16x16x128_default,2837.72,1578.79,0.0
gfx950,256,2048,16384,2048,torch.float8_e4m3fn,flydsl,601,0,80.3525,flydsl_bpreshuflle_128x256x128_F8_F8_B16_1x1x1x1_default,1710.45,1304.97,0.0
gfx950,256,2048,16384,4096,torch.float8_e4m3fn,flydsl,979,0,134.1836,flydsl_bpreshuflle_128x256x128_F8_F8_B16_2x1x1x2_default,2048.52,1062.77,0.0
gfx950,256,2048,16384,6656,torch.float8_e4m3fn,ck,33,0,194.6083,a8w8_bpreshuffle_256x256x256x128_16x16_16x16_8x32x1_8x32x1_1x32x1x8_8x8x1_2x1_intrawave_v3,2295.26,975.25,0.0
gfx950,256,2048,16384,8192,torch.float8_e4m3fn,ck,33,0,230.0845,a8w8_bpreshuffle_256x256x256x128_16x16_16x16_8x32x1_8x32x1_1x32x1x8_8x8x1_2x1_intrawave_v3,2389.36,947.93,0.0
gfx950,256,2048,16384,13312,torch.float8_e4m3fn,cktile,155,0,339.3213,a8w8_bpreshuffle_cktile_0x0x8x4x1x0x0x0x0x4_256x256x128_1x4x1_16x16x128_default,2632.76,920.88,0.0
gfx950,256,2048,16384,26624,torch.float8_e4m3fn,cktile,154,0,604.2855,a8w8_bpreshuffle_cktile_0x0x8x4x1x0x0x0x0x3_256x256x128_1x4x1_16x16x128_default,2956.73,923.14,0.0
gfx950,256,4096,16384,2048,torch.float8_e4m3fn,flydsl,601,0,147.6909,flydsl_bpreshuflle_128x256x128_F8_F8_B16_1x1x1x1_default,1861.17,1192.77,0.0
gfx950,256,4096,16384,4096,torch.float8_e4m3fn,flydsl,979,0,241.7976,flydsl_bpreshuflle_128x256x128_F8_F8_B16_2x1x1x2_default,2273.62,902.01,0.0
gfx950,256,4096,16384,6656,torch.float8_e4m3fn,flydsl,825,0,365.2692,flydsl_bpreshuflle_256x128x128_F8_F8_B16_2x0x1x2_default,2445.74,740.64,0.0
gfx950,256,4096,16384,8192,torch.float8_e4m3fn,flydsl,979,0,432.8399,flydsl_bpreshuflle_128x256x128_F8_F8_B16_2x1x1x2_default,2540.23,697.69,0.0
gfx950,256,4096,16384,13312,torch.float8_e4m3fn,cktile,155,0,665.018,a8w8_bpreshuffle_cktile_0x0x8x4x1x0x0x0x0x4_256x256x128_1x4x1_16x16x128_default,2686.7,611.78,0.0
gfx950,256,4096,16384,26624,torch.float8_e4m3fn,cktile,155,0,1192.4676,a8w8_bpreshuffle_cktile_0x0x8x4x1x0x0x0x0x4_256x256x128_1x4x1_16x16x128_default,2996.65,569.81,0.0
gfx950,256,8192,16384,2048,torch.float8_e4m3fn,flydsl,979,0,292.9922,flydsl_bpreshuflle_128x256x128_F8_F8_B16_2x1x1x2_default,1876.35,1087.97,0.0
gfx950,256,8192,16384,4096,torch.float8_e4m3fn,flydsl,979,0,467.2444,flydsl_bpreshuflle_128x256x128_F8_F8_B16_2x1x1x2_default,2353.18,789.95,0.0
gfx950,256,8192,16384,6656,torch.float8_e4m3fn,flydsl,825,0,720.0273,flydsl_bpreshuflle_256x128x128_F8_F8_B16_2x0x1x2_default,2481.44,600.0,0.0
gfx950,256,8192,16384,8192,torch.float8_e4m3fn,flydsl,825,0,855.8274,flydsl_bpreshuflle_256x128x128_F8_F8_B16_2x0x1x2_default,2569.47,548.9,0.0
gfx950,256,8192,16384,13312,torch.float8_e4m3fn,cktile,155,0,1317.2113,a8w8_bpreshuffle_cktile_0x0x8x4x1x0x0x0x0x4_256x256x128_1x4x1_16x16x128_default,2712.86,452.16,0.0
gfx950,256,8192,16384,26624,torch.float8_e4m3fn,cktile,10,0,2446.191,a8w8_bpreshuffle_cktile_0x0x8x4x1x0x0x0x0x1_256x256x128_1x4x1_16x16x128_default,2921.61,377.22,0.0
gfx950,256,16384,16384,2048,torch.float8_e4m3fn,flydsl,979,0,573.0956,flydsl_bpreshuflle_128x256x128_F8_F8_B16_2x1x1x2_default,1918.55,1053.89,0.0
gfx950,256,16384,16384,4096,torch.float8_e4m3fn,flydsl,979,0,945.5081,flydsl_bpreshuflle_128x256x128_F8_F8_B16_2x1x1x2_default,2325.76,709.77,0.0
gfx950,256,16384,16384,6656,torch.float8_e4m3fn,flydsl,825,0,1434.0728,flydsl_bpreshuflle_256x128x128_F8_F8_B16_2x0x1x2_default,2491.79,526.45,0.0
gfx950,256,16384,16384,8192,torch.float8_e4m3fn,cktile,115,0,1706.7491,a8w8_bpreshuffle_cktile_0x0x8x4x1x0x0x0x0x2_96x256x128_1x4x1_16x16x128_default,2576.86,471.84,0.0
gfx950,256,16384,16384,13312,torch.float8_e4m3fn,cktile,10,0,2589.7115,a8w8_bpreshuffle_cktile_0x0x8x4x1x0x0x0x0x1_256x256x128_1x4x1_16x16x128_default,2759.7,375.75,0.0
gfx950,256,16384,16384,26624,torch.float8_e4m3fn,cktile,155,0,4846.7561,a8w8_bpreshuffle_cktile_0x0x8x4x1x0x0x0x0x4_256x256x128_1x4x1_16x16x128_default,2949.12,290.77,0.0
gfx950,256,32768,16384,2048,torch.float8_e4m3fn,ck,143,0,1121.2198,a8w8_bpreshuffle_256x192x128x128_16x16_16x16_8x32x1_8x32x1_1x16x1x16_8x8x1_1x2_intrawave_v3,1961.28,1047.44,0.0
gfx950,256,32768,16384,4096,torch.float8_e4m3fn,flydsl,979,0,1893.374,flydsl_bpreshuflle_128x256x128_F8_F8_B16_2x1x1x2_default,2322.86,673.44,0.0
gfx950,256,32768,16384,6656,torch.float8_e4m3fn,cktile,115,0,2831.5792,a8w8_bpreshuffle_cktile_0x0x8x4x1x0x0x0x0x2_96x256x128_1x4x1_16x16x128_default,2523.97,494.74,0.0
gfx950,256,32768,16384,8192,torch.float8_e4m3fn,cktile,115,0,3423.2243,a8w8_bpreshuffle_cktile_0x0x8x4x1x0x0x0x0x2_96x256x128_1x4x1_16x16x128_default,2569.53,431.29,0.0
gfx950,256,32768,16384,13312,torch.float8_e4m3fn,cktile,10,0,5107.7843,a8w8_bpreshuffle_cktile_0x0x8x4x1x0x0x0x0x1_256x256x128_1x4x1_16x16x128_default,2798.41,338.32,0.0
gfx950,256,32768,16384,26624,torch.float8_e4m3fn,cktile,155,0,9941.6576,a8w8_bpreshuffle_cktile_0x0x8x4x1x0x0x0x0x4_256x256x128_1x4x1_16x16x128_default,2875.51,239.63,0.0
gfx950,256,1,26624,16384,torch.float8_e4m3fn,flydsl,1138,0,75.2625,flydsl_bpreshuflle_16x64x256_F8_F8_B16_1x1x0x3_default,11.59,5796.74,0.0
gfx950,256,16,26624,16384,torch.float8_e4m3fn,flydsl,0,0,75.7716,flydsl_bpreshuflle_16x64x256_F8_F8_B16_1x0x0x0_default,184.22,5771.58,0.0
gfx950,256,32,26624,16384,torch.float8_e4m3fn,flydsl,1317,0,77.5854,flydsl_bpreshuflle_32x64x256_F8_F8_B16_2x0x0x4_default,359.83,5651.01,0.0
gfx950,256,64,26624,16384,torch.float8_e4m3fn,flydsl,377,0,79.7028,flydsl_bpreshuflle_64x128x256_F8_F8_B16_2x0x0x1_default,700.53,5528.84,0.0
gfx950,256,128,26624,16384,torch.float8_e4m3fn,flydsl,1418,0,97.1275,flydsl_bpreshuflle_128x128x256_F8_F8_B16_2x0x1x4_default,1149.72,4582.85,0.0
gfx950,256,256,26624,16384,torch.float8_e4m3fn,ck,154,0,131.4447,a8w8_bpreshuffle_256x128x256x256_16x16_16x16_16x16x1_16x16x1_1x16x1x16_8x8x1_1x2_intrawave_v3,1699.1,3454.18,0.0
gfx950,256,512,26624,16384,torch.float8_e4m3fn,cktile,155,0,195.1564,a8w8_bpreshuffle_cktile_0x0x8x4x1x0x0x0x0x4_256x256x128_1x4x1_16x16x128_default,2288.81,2417.85,0.0
gfx950,256,1024,26624,16384,torch.float8_e4m3fn,cktile,154,0,369.4329,a8w8_bpreshuffle_cktile_0x0x8x4x1x0x0x0x0x3_256x256x128_1x4x1_16x16x128_default,2418.17,1373.76,0.0
gfx950,256,2048,26624,16384,torch.float8_e4m3fn,cktile,13,0,731.002,a8w8_bpreshuffle_cktile_0x0x8x4x1x0x0x0x0x2_256x128x128_1x4x1_16x16x128_default,2444.19,791.81,0.0
gfx950,256,4096,26624,16384,torch.float8_e4m3fn,cktile,10,0,1328.8625,a8w8_bpreshuffle_cktile_0x0x8x4x1x0x0x0x0x1_256x256x128_1x4x1_16x16x128_default,2689.08,542.89,0.0
gfx950,256,8192,26624,16384,torch.float8_e4m3fn,cktile,155,0,2500.8282,a8w8_bpreshuffle_cktile_0x0x8x4x1x0x0x0x0x4_256x256x128_1x4x1_16x16x128_default,2857.78,402.52,0.0
gfx950,256,16384,26624,16384,torch.float8_e4m3fn,cktile,10,0,4993.8298,a8w8_bpreshuffle_cktile_0x0x8x4x1x0x0x0x0x1_256x256x128_1x4x1_16x16x128_default,2862.26,315.8,0.0
gfx942,304,128,1536,5120,torch.int8,asm,0,1,17.9602,_ZN5aiter41I8gemm_bf16_perTokenI8_BpreShuffle_16x128E,112.1,496.26,0.0
gfx942,304,256,1536,5120,torch.int8,asm,0,1,17.6791,_ZN5aiter41I8gemm_bf16_perTokenI8_BpreShuffle_16x128E,227.76,563.46,0.0
gfx942,304,512,1536,5120,torch.int8,asm,1,1,18.7067,_ZN5aiter41I8gemm_bf16_perTokenI8_BpreShuffle_32x128E,430.49,644.62,0.0
gfx942,304,1024,1536,5120,torch.int8,asm,2,1,21.0125,_ZN5aiter41I8gemm_bf16_perTokenI8_BpreShuffle_48x128E,766.5,773.49,0.0
gfx942,304,1664,1536,5120,torch.int8,asm,4,1,27.6261,_ZN5aiter41I8gemm_bf16_perTokenI8_BpreShuffle_80x128E,947.38,778.1,0.0
gfx942,304,4096,1536,5120,torch.int8,asm,6,1,63.8361,_ZN5aiter42I8gemm_bf16_perTokenI8_BpreShuffle_112x256E,1009.22,648.83,0.0
gfx942,304,8192,1536,5120,torch.int8,asm,6,1,128.8567,_ZN5aiter42I8gemm_bf16_perTokenI8_BpreShuffle_112x256E,999.94,581.83,0.0
gfx942,304,10240,1536,5120,torch.int8,asm,6,1,142.1441,_ZN5aiter42I8gemm_bf16_perTokenI8_BpreShuffle_112x256E,1133.08,645.47,0.0
gfx942,304,12288,1536,5120,torch.int8,asm,7,1,185.0056,_ZN5aiter42I8gemm_bf16_perTokenI8_BpreShuffle_128x128E,1044.69,586.62,0.0
gfx942,304,16384,1536,5120,torch.int8,asm,6,1,211.7054,_ZN5aiter42I8gemm_bf16_perTokenI8_BpreShuffle_112x256E,1217.25,671.13,0.0
gfx942,304,20480,1536,5120,torch.int8,asm,6,1,271.7016,_ZN5aiter42I8gemm_bf16_perTokenI8_BpreShuffle_112x256E,1185.57,646.43,0.0
gfx942,304,24576,1536,5120,torch.int8,asm,6,1,328.3654,_ZN5aiter42I8gemm_bf16_perTokenI8_BpreShuffle_112x256E,1177.19,637.07,0.0
gfx942,304,30720,1536,5120,torch.int8,asm,6,1,402.8387,_ZN5aiter42I8gemm_bf16_perTokenI8_BpreShuffle_112x256E,1199.45,644.23,0.0
gfx942,304,32768,1536,5120,torch.int8,asm,6,1,406.391,_ZN5aiter42I8gemm_bf16_perTokenI8_BpreShuffle_112x256E,1268.23,679.89,0.0
gfx942,304,40960,1536,5120,torch.int8,asm,6,1,525.9013,_ZN5aiter42I8gemm_bf16_perTokenI8_BpreShuffle_112x256E,1225.03,652.99,0.0
gfx950,256,32768,26624,16384,torch.float8_e4m3fn,cktile,10,0,10041.205,a8w8_bpreshuffle_cktile_0x0x8x4x1x0x0x0x0x1_256x256x128_1x4x1_16x16x128_default,2847.0,270.68,0.0
gfx950,256,1,51200,5120,torch.float8_e4m3fn,flydsl,26,0,44.5486,flydsl_bpreshuflle_16x256x512_F8_F8_B16_2x0x0x0_default,11.77,5886.86,0.0
gfx950,256,16,51200,5120,torch.float8_e4m3fn,flydsl,26,0,45.3929,flydsl_bpreshuflle_16x256x512_F8_F8_B16_2x0x0x0_default,184.8,5812.9,0.0
gfx950,256,32,51200,5120,torch.float8_e4m3fn,flydsl,918,0,47.6289,flydsl_bpreshuflle_32x128x256_F8_F8_B16_1x1x1x2_default,352.25,5576.12,0.0
gfx950,256,64,51200,5120,torch.float8_e4m3fn,flydsl,463,0,50.7771,flydsl_bpreshuflle_64x256x128_F8_F8_B16_2x0x1x1_default,660.82,5298.16,0.0
gfx950,256,128,51200,5120,torch.float8_e4m3fn,flydsl,155,0,60.4343,flydsl_bpreshuflle_128x256x128_F8_F8_B16_2x0x1x0_default,1110.44,4565.4,0.0
gfx950,256,256,51200,5120,torch.float8_e4m3fn,flydsl,825,0,88.2861,flydsl_bpreshuflle_256x128x128_F8_F8_B16_2x0x1x2_default,1520.26,3281.03,0.0
gfx950,256,512,51200,5120,torch.float8_e4m3fn,flydsl,825,0,154.5155,flydsl_bpreshuflle_256x128x128_F8_F8_B16_2x0x1x2_default,1737.27,2052.83,0.0
gfx950,256,1024,51200,5120,torch.float8_e4m3fn,flydsl,825,0,258.4335,flydsl_bpreshuflle_256x128x128_F8_F8_B16_2x0x1x2_default,2077.4,1440.39,0.0
gfx950,256,2048,51200,5120,torch.float8_e4m3fn,flydsl,825,0,484.2625,flydsl_bpreshuflle_256x128x128_F8_F8_B16_2x0x1x2_default,2217.27,996.04,0.0
gfx950,256,4096,51200,5120,torch.float8_e4m3fn,flydsl,825,0,896.4303,flydsl_bpreshuflle_256x128x128_F8_F8_B16_2x0x1x2_default,2395.59,783.72,0.0
gfx950,256,8192,51200,5120,torch.float8_e4m3fn,flydsl,825,0,1732.5641,flydsl_bpreshuflle_256x128x128_F8_F8_B16_2x0x1x2_default,2478.97,659.69,0.0
gfx950,256,16384,51200,5120,torch.float8_e4m3fn,flydsl,825,0,3450.4561,flydsl_bpreshuflle_256x128x128_F8_F8_B16_2x0x1x2_default,2489.51,586.52,0.0
gfx950,256,32768,51200,5120,torch.float8_e4m3fn,flydsl,825,0,7359.6237,flydsl_bpreshuflle_256x128x128_F8_F8_B16_2x0x1x2_default,2334.34,514.34,0.0
gfx950,256,1,53248,16384,torch.float8_e4m3fn,ck,7,0,149.1782,a8w8_bpreshuffle_256x16x256x512_16x16_16x16_32x8x1_32x8x1_1x16x1x16_8x8x1_1x2_intrawave_v1,11.7,5848.97,0.0
gfx950,256,16,53248,16384,torch.float8_e4m3fn,ck,7,0,149.5025,a8w8_bpreshuffle_256x16x256x512_16x16_16x16_32x8x1_32x8x1_1x16x1x16_8x8x1_1x2_intrawave_v1,186.73,5848.61,0.0
gfx950,256,32,53248,16384,torch.float8_e4m3fn,flydsl,1023,0,149.5234,flydsl_bpreshuflle_32x256x128_F8_F8_B16_2x0x0x3_default,373.42,5860.94,0.0
gfx950,256,64,53248,16384,torch.float8_e4m3fn,flydsl,48,0,152.6856,flydsl_bpreshuflle_64x256x128_F8_F8_B16_2x0x0x0_default,731.37,5765.31,0.0
gfx950,256,128,53248,16384,torch.float8_e4m3fn,flydsl,155,0,169.9609,flydsl_bpreshuflle_128x256x128_F8_F8_B16_2x0x1x0_default,1314.06,5225.58,0.0
gfx950,256,256,53248,16384,torch.float8_e4m3fn,cktile,154,0,225.5251,a8w8_bpreshuffle_cktile_0x0x8x4x1x0x0x0x0x3_256x256x128_1x4x1_16x16x128_default,1980.61,4007.86,0.0
gfx950,256,512,53248,16384,torch.float8_e4m3fn,cktile,155,0,382.9747,a8w8_bpreshuffle_cktile_0x0x8x4x1x0x0x0x0x4_256x256x128_1x4x1_16x16x128_default,2332.67,2442.28,0.0
gfx950,256,1024,53248,16384,torch.float8_e4m3fn,cktile,13,0,751.8658,a8w8_bpreshuffle_cktile_0x0x8x4x1x0x0x0x0x2_256x128x128_1x4x1_16x16x128_default,2376.36,1327.69,0.0
gfx950,256,2048,53248,16384,torch.float8_e4m3fn,cktile,10,0,1326.5153,a8w8_bpreshuffle_cktile_0x0x8x4x1x0x0x0x0x1_256x256x128_1x4x1_16x16x128_default,2693.83,847.39,0.0
gfx950,256,4096,53248,16384,torch.float8_e4m3fn,cktile,155,0,2515.1053,a8w8_bpreshuffle_cktile_0x0x8x4x1x0x0x0x0x4_256x256x128_1x4x1_16x16x128_default,2841.56,546.99,0.0
gfx950,256,8192,53248,16384,torch.float8_e4m3fn,cktile,10,0,4995.5375,a8w8_bpreshuffle_cktile_0x0x8x4x1x0x0x0x0x1_256x256x128_1x4x1_16x16x128_default,2861.28,376.15,0.0
gfx950,256,16384,53248,16384,torch.float8_e4m3fn,cktile,10,0,10019.6764,a8w8_bpreshuffle_cktile_0x0x8x4x1x0x0x0x0x1_256x256x128_1x4x1_16x16x128_default,2853.12,288.0,0.0
gfx950,256,32768,53248,16384,torch.float8_e4m3fn,ck,107,0,20797.6873,a8w8_bpreshuffle_256x256x256x128_16x16_16x16_8x32x1_8x32x1_1x16x1x16_4x4x1_1x1_intrawave_v3,2749.08,235.55,0.0
gfx950,256,1,57344,8192,torch.float8_e4m3fn,flydsl,254,0,77.9504,flydsl_bpreshuflle_16x256x512_F8_F8_B16_1x1x1x0_default,12.05,6028.0,0.0
gfx950,256,16,57344,8192,torch.float8_e4m3fn,flydsl,88,0,78.2705,flydsl_bpreshuflle_16x256x512_F8_F8_B16_1x0x1x0_default,192.06,6026.9,0.0
gfx950,256,32,57344,8192,torch.float8_e4m3fn,flydsl,1499,0,81.879,flydsl_bpreshuflle_32x128x128_F8_F8_B16_1x1x1x4_default,367.19,5785.3,0.0
gfx950,256,64,57344,8192,torch.float8_e4m3fn,flydsl,381,0,83.2587,flydsl_bpreshuflle_64x256x256_F8_F8_B16_2x0x0x1_default,722.2,5736.65,0.0
gfx950,256,128,57344,8192,torch.float8_e4m3fn,flydsl,72,0,93.9295,flydsl_bpreshuflle_128x256x128_F8_F8_B16_2x0x0x0_default,1280.31,5168.67,0.0
gfx950,256,256,57344,8192,torch.float8_e4m3fn,ck,33,0,134.0184,a8w8_bpreshuffle_256x256x256x128_16x16_16x16_8x32x1_8x32x1_1x32x1x8_8x8x1_2x1_intrawave_v3,1794.67,3739.93,0.0
gfx950,256,512,57344,8192,torch.float8_e4m3fn,ck,33,0,225.9295,a8w8_bpreshuffle_256x256x256x128_16x16_16x16_8x32x1_8x32x1_1x32x1x8_8x8x1_2x1_intrawave_v3,2129.14,2357.71,0.0
gfx950,256,1024,57344,8192,torch.float8_e4m3fn,flydsl,825,0,419.9967,flydsl_bpreshuflle_256x128x128_F8_F8_B16_2x0x1x2_default,2290.67,1418.09,0.0
gfx950,256,2048,57344,8192,torch.float8_e4m3fn,ck,33,0,782.0667,a8w8_bpreshuffle_256x256x256x128_16x16_16x16_8x32x1_8x32x1_1x32x1x8_8x8x1_2x1_intrawave_v3,2460.33,922.45,0.0
gfx950,256,4096,57344,8192,torch.float8_e4m3fn,flydsl,979,0,1486.3101,flydsl_bpreshuflle_128x256x128_F8_F8_B16_2x1x1x2_default,2589.16,654.69,0.0
gfx950,256,8192,57344,8192,torch.float8_e4m3fn,flydsl,825,0,2916.8532,flydsl_bpreshuflle_256x128x128_F8_F8_B16_2x0x1x2_default,2638.66,506.16,0.0
gfx950,256,16384,57344,8192,torch.float8_e4m3fn,flydsl,825,0,5899.997,flydsl_bpreshuflle_256x128x128_F8_F8_B16_2x0x1x2_default,2609.01,420.85,0.0
gfx950,256,32768,57344,8192,torch.float8_e4m3fn,ck,33,0,12218.2137,a8w8_bpreshuffle_256x256x256x128_16x16_16x16_8x32x1_8x32x1_1x32x1x8_8x8x1_2x1_intrawave_v3,2519.71,368.0,0.0
