aiter/configs/a8w8_bpreshuffle_tuned_gemm.csv
cu_num,M,N,K,q_dtype_w,libtype,kernelId,splitK,us,kernelName,tflops,bw,errRatio
80,192,1536,5120,torch.float8_e4m3fnuz,cktile,9,0,18.9229,a8w8_bpreshuffle_cktile_0x0x8x4x1x0x0x0x0x1_32x64x512_1x4x1_16x16x64_default,159.59,498.72,0.0
256,1,800,5120,torch.float8_e4m3fn,ck,10,0,8.7891,a8w8_bpreshuffle_128x16x32x512_16x16_16x16_32x4x1_32x4x1_1x16x1x8_4x4x1_1x1_intrawave_v1,0.93,466.8,0.0
256,1,1280,8192,torch.float8_e4m3fn,flydsl,603,0,12.6525,flydsl_bpreshuflle_16x64x512_F8_F8_B16_2x1x1x1_default,1.66,829.6,0.0
256,1,2304,16384,torch.float8_e4m3fn,flydsl,1433,0,22.7957,flydsl_bpreshuflle_16x64x512_F8_F8_B16_2x0x1x4_default,3.31,1656.88,0.0
256,1,2560,8192,torch.float8_e4m3fn,ck,10,0,12.977,a8w8_bpreshuffle_128x16x32x512_16x16_16x16_32x4x1_32x4x1_1x16x1x8_4x4x1_1x1_intrawave_v1,3.23,1617.08,0.0
256,1,4608,16384,torch.float8_e4m3fn,flydsl,1101,0,24.4023,flydsl_bpreshuflle_16x64x512_F8_F8_B16_2x0x1x3_default,6.19,3094.92,0.0
256,1,5120,640,torch.float8_e4m3fn,ck,23,0,5.4653,a8w8_bpreshuffle_128x16x32x128_16x16_16x16_8x16x1_8x16x1_1x16x1x8_4x4x1_1x1_intrawave_v2,1.2,601.56,0.0
256,1,5120,1280,torch.float8_e4m3fn,flydsl,332,0,5.3562,flydsl_bpreshuflle_16x64x256_F8_F8_B16_1x0x0x1_default,2.45,1225.7,0.0
256,1,5120,3200,torch.float8_e4m3fn,ck,9,0,14.061,a8w8_bpreshuffle_128x16x32x128_16x16_16x16_8x16x1_8x16x1_1x16x1x8_4x4x1_1x1_intrawave_v1,2.33,1166.16,0.0
256,1,5120,5120,torch.float8_e4m3fn,ck,10,0,9.2493,a8w8_bpreshuffle_128x16x32x512_16x16_16x16_32x4x1_32x4x1_1x16x1x8_4x4x1_1x1_intrawave_v1,5.67,2835.86,0.0
256,1,5120,6400,torch.float8_e4m3fn,flydsl,747,0,15.2525,flydsl_bpreshuflle_16x64x256_F8_F8_B16_1x0x1x2_default,4.3,2149.46,0.0
256,1,5120,25600,torch.float8_e4m3fn,flydsl,852,0,36.6543,flydsl_bpreshuflle_16x64x512_F8_F8_B16_2x1x0x2_default,7.15,3576.87,0.0
256,1,6400,5120,torch.float8_e4m3fn,flydsl,852,0,9.9117,flydsl_bpreshuflle_16x64x512_F8_F8_B16_2x1x0x2_default,6.61,3307.8,0.0
256,1,7168,8192,torch.float8_e4m3fn,ck,10,0,14.4923,a8w8_bpreshuffle_128x16x32x512_16x16_16x16_32x4x1_32x4x1_1x16x1x8_4x4x1_1x1_intrawave_v1,8.1,4053.38,0.0
256,1,8192,1024,torch.float8_e4m3fn,flydsl,997,0,4.4398,flydsl_bpreshuflle_16x64x512_F8_F8_B16_1x0x0x3_default,3.78,1893.33,0.0
256,1,8192,2048,torch.float8_e4m3fn,flydsl,1,0,5.744,flydsl_bpreshuflle_16x64x512_F8_F8_B16_1x0x0x0_default,5.84,2924.03,0.0
256,1,8192,3584,torch.float8_e4m3fn,ck,10,0,8.1982,a8w8_bpreshuffle_128x16x32x512_16x16_16x16_32x4x1_32x4x1_1x16x1x8_4x4x1_1x1_intrawave_v1,7.16,3583.73,0.0
256,1,8192,7168,torch.float8_e4m3fn,flydsl,1184,0,13.3313,flydsl_bpreshuflle_16x64x512_F8_F8_B16_2x1x0x3_default,8.81,4406.46,0.0
256,1,8192,8192,torch.float8_e4m3fn,ck,24,0,15.4382,a8w8_bpreshuffle_128x16x32x512_16x16_16x16_32x4x1_32x4x1_1x16x1x8_4x4x1_1x1_intrawave_v2,8.69,4348.53,0.0
256,1,8192,28672,torch.float8_e4m3fn,flydsl,1184,0,45.2384,flydsl_bpreshuflle_16x64x512_F8_F8_B16_2x1x0x3_default,10.38,5193.07,0.0
256,1,9216,16384,torch.float8_e4m3fn,flydsl,852,0,28.5494,flydsl_bpreshuflle_16x64x512_F8_F8_B16_2x1x0x2_default,10.58,5290.12,0.0
256,1,10240,8192,torch.float8_e4m3fn,ck,10,0,17.1535,a8w8_bpreshuffle_128x16x32x512_16x16_16x16_32x4x1_32x4x1_1x16x1x8_4x4x1_1x1_intrawave_v1,9.78,4891.99,0.0
256,1,12800,5120,torch.float8_e4m3fn,flydsl,1018,0,12.9753,flydsl_bpreshuflle_16x64x512_F8_F8_B16_2x0x0x3_default,10.1,5053.19,0.0
256,1,13312,16384,torch.float8_e4m3fn,ck,10,0,39.0348,a8w8_bpreshuffle_128x16x32x512_16x16_16x16_32x4x1_32x4x1_1x16x1x8_4x4x1_1x1_intrawave_v1,11.17,5588.52,0.0
256,1,14336,8192,torch.float8_e4m3fn,ck,10,0,21.8613,a8w8_bpreshuffle_128x16x32x512_16x16_16x16_32x4x1_32x4x1_1x16x1x8_4x4x1_1x1_intrawave_v1,10.74,5373.76,0.0
256,1,16384,2048,torch.float8_e4m3fn,flydsl,1329,0,7.8338,flydsl_bpreshuflle_16x64x512_F8_F8_B16_1x0x0x4_default,8.57,4287.73,0.0
256,1,16384,4096,torch.float8_e4m3fn,flydsl,520,0,13.8877,flydsl_bpreshuflle_16x64x512_F8_F8_B16_2x1x0x1_default,9.66,4834.91,0.0
256,1,16384,6656,torch.float8_e4m3fn,flydsl,1516,0,19.6787,flydsl_bpreshuflle_16x64x512_F8_F8_B16_2x1x0x4_default,11.08,5543.62,0.0
256,1,16384,8192,torch.float8_e4m3fn,ck,24,0,25.2062,a8w8_bpreshuffle_128x16x32x512_16x16_16x16_32x4x1_32x4x1_1x16x1x8_4x4x1_1x1_intrawave_v2,10.65,5326.42,0.0
256,1,16384,13312,torch.float8_e4m3fn,flydsl,747,0,37.3141,flydsl_bpreshuflle_16x64x256_F8_F8_B16_1x0x1x2_default,11.69,5846.31,0.0
256,1,16384,26624,torch.float8_e4m3fn,cktile,5,0,71.4157,a8w8_bpreshuffle_cktile_0x0x8x4x1x0x0x0x0x1_16x64x256_1x4x1_16x16x128_default,12.22,6108.84,0.0
256,1,26624,16384,torch.float8_e4m3fn,flydsl,1162,0,75.2732,flydsl_bpreshuflle_16x64x256_F8_F8_B16_1x1x0x3_default,11.59,5795.92,0.0
256,1,51200,5120,torch.float8_e4m3fn,flydsl,690,0,44.517,flydsl_bpreshuflle_16x256x512_F8_F8_B16_2x0x0x2_default,11.78,5891.04,0.0
256,1,53248,16384,torch.float8_e4m3fn,flydsl,690,0,151.4881,flydsl_bpreshuflle_16x256x512_F8_F8_B16_2x0x0x2_default,11.52,5759.78,0.0
256,1,57344,8192,torch.float8_e4m3fn,flydsl,88,0,78.0465,flydsl_bpreshuflle_16x256x512_F8_F8_B16_1x0x1x0_default,12.04,6020.58,0.0
256,4,16384,6656,torch.float8_e4m3fn,flydsl,354,0,19.6105,flydsl_bpreshuflle_16x64x512_F8_F8_B16_2x0x0x1_default,44.49,5568.94,0.0
256,8,6656,16384,torch.float8_e4m3fn,ck,10,0,26.61,a8w8_bpreshuffle_128x16x32x512_16x16_16x16_32x4x1_32x4x1_1x16x1x8_4x4x1_1x1_intrawave_v1,65.57,4107.08,0.0
256,8,16384,6656,torch.float8_e4m3fn,flydsl,188,0,19.7614,flydsl_bpreshuflle_16x64x512_F8_F8_B16_2x1x0x0_default,88.29,5534.39,0.0
256,16,800,5120,torch.float8_e4m3fn,ck,10,0,8.4156,a8w8_bpreshuffle_128x16x32x512_16x16_16x16_32x4x1_32x4x1_1x16x1x8_4x4x1_1x1_intrawave_v1,15.57,499.49,0.0
256,16,1280,8192,torch.float8_e4m3fn,ck,10,0,12.0099,a8w8_bpreshuffle_128x16x32x512_16x16_16x16_32x4x1_32x4x1_1x16x1x8_4x4x1_1x1_intrawave_v1,27.94,887.42,0.0
256,16,2304,16384,torch.float8_e4m3fn,ck,10,0,21.1421,a8w8_bpreshuffle_128x16x32x512_16x16_16x16_32x4x1_32x4x1_1x16x1x8_4x4x1_1x1_intrawave_v1,57.14,1801.36,0.0
256,16,2560,8192,torch.float8_e4m3fn,ck,10,0,11.7308,a8w8_bpreshuffle_128x16x32x512_16x16_16x16_32x4x1_32x4x1_1x16x1x8_4x4x1_1x1_intrawave_v1,57.21,1805.89,0.0
256,16,4608,16384,torch.float8_e4m3fn,ck,10,0,22.6414,a8w8_bpreshuffle_128x16x32x512_16x16_16x16_32x4x1_32x4x1_1x16x1x8_4x4x1_1x1_intrawave_v1,106.7,3352.58,0.0
256,16,5120,640,torch.float8_e4m3fn,ck,23,0,5.4891,a8w8_bpreshuffle_128x16x32x128_16x16_16x16_8x16x1_8x16x1_1x16x1x8_4x4x1_1x1_intrawave_v2,19.1,628.68,0.0
256,16,5120,1280,torch.float8_e4m3fn,flydsl,0,0,5.3606,flydsl_bpreshuflle_16x64x256_F8_F8_B16_1x0x0x0_default,39.12,1256.93,0.0
256,16,5120,3200,torch.float8_e4m3fn,ck,9,0,13.9104,a8w8_bpreshuffle_128x16x32x128_16x16_16x16_8x16x1_8x16x1_1x16x1x8_4x4x1_1x1_intrawave_v1,37.69,1193.28,0.0
256,16,5120,5120,torch.float8_e4m3fn,ck,10,0,8.9856,a8w8_bpreshuffle_128x16x32x512_16x16_16x16_32x4x1_32x4x1_1x16x1x8_4x4x1_1x1_intrawave_v1,93.36,2944.73,0.0
256,16,5120,6400,torch.float8_e4m3fn,flydsl,765,0,15.5796,flydsl_bpreshuflle_16x64x256_F8_F8_B16_1x0x1x2_default,67.3,2120.35,0.0
256,16,5120,25600,torch.float8_e4m3fn,ck,10,0,34.0693,a8w8_bpreshuffle_128x16x32x512_16x16_16x16_32x4x1_32x4x1_1x16x1x8_4x4x1_1x1_intrawave_v1,123.11,3864.05,0.0
256,16,6400,5120,torch.float8_e4m3fn,ck,10,0,9.6905,a8w8_bpreshuffle_128x16x32x512_16x16_16x16_32x4x1_32x4x1_1x16x1x8_4x4x1_1x1_intrawave_v1,108.21,3411.04,0.0
256,16,7168,8192,torch.float8_e4m3fn,ck,10,0,13.7134,a8w8_bpreshuffle_128x16x32x512_16x16_16x16_32x4x1_32x4x1_1x16x1x8_4x4x1_1x1_intrawave_v1,137.02,4308.25,0.0
256,16,8192,1024,torch.float8_e4m3fn,flydsl,86,0,4.5497,flydsl_bpreshuflle_16x64x512_F8_F8_B16_1x0x1x0_default,59.0,1904.99,0.0
256,16,8192,2048,torch.float8_e4m3fn,flydsl,1361,0,5.8875,flydsl_bpreshuflle_16x64x512_F8_F8_B16_1x0x0x4_default,91.19,2899.72,0.0
256,16,8192,3584,torch.float8_e4m3fn,ck,24,0,8.4376,a8w8_bpreshuffle_128x16x32x512_16x16_16x16_32x4x1_32x4x1_1x16x1x8_4x4x1_1x1_intrawave_v2,111.35,3517.54,0.0
256,16,8192,7168,torch.float8_e4m3fn,ck,10,0,13.0555,a8w8_bpreshuffle_128x16x32x512_16x16_16x16_32x4x1_32x4x1_1x16x1x8_4x4x1_1x1_intrawave_v1,143.93,4526.6,0.0
256,16,8192,8192,torch.float8_e4m3fn,ck,24,0,15.4512,a8w8_bpreshuffle_128x16x32x512_16x16_16x16_32x4x1_32x4x1_1x16x1x8_4x4x1_1x1_intrawave_v2,138.98,4368.73,0.0
256,16,8192,28672,torch.float8_e4m3fn,ck,10,0,41.3843,a8w8_bpreshuffle_128x16x32x512_16x16_16x16_32x4x1_32x4x1_1x16x1x8_4x4x1_1x1_intrawave_v1,181.62,5693.03,0.0
256,16,9216,16384,torch.float8_e4m3fn,ck,5,0,30.6678,a8w8_bpreshuffle_256x16x64x512_16x16_16x16_32x8x1_32x8x1_1x16x1x16_4x4x1_1x1_intrawave_v1,157.55,4941.73,0.0
256,16,10240,8192,torch.float8_e4m3fn,flydsl,1212,0,18.4633,flydsl_bpreshuflle_16x64x512_F8_F8_B16_2x1x0x3_default,145.39,4568.24,0.0
256,16,12800,5120,torch.float8_e4m3fn,ck,5,0,13.0939,a8w8_bpreshuffle_256x16x64x512_16x16_16x16_32x8x1_32x8x1_1x16x1x16_4x4x1_1x1_intrawave_v1,160.16,5042.62,0.0
256,16,13312,16384,torch.float8_e4m3fn,ck,25,0,39.9441,a8w8_bpreshuffle_256x16x64x512_16x16_16x16_32x8x1_32x8x1_1x16x1x16_4x4x1_1x1_intrawave_v2,174.73,5477.45,0.0
256,16,14336,8192,torch.float8_e4m3fn,ck,10,0,21.5653,a8w8_bpreshuffle_128x16x32x512_16x16_16x16_32x4x1_32x4x1_1x16x1x8_4x4x1_1x1_intrawave_v1,174.27,5473.16,0.0
256,16,16384,2048,torch.float8_e4m3fn,flydsl,1,0,7.7091,flydsl_bpreshuflle_16x64x512_F8_F8_B16_1x0x0x0_default,139.28,4424.83,0.0
256,16,16384,4096,torch.float8_e4m3fn,ck,10,0,14.1831,a8w8_bpreshuffle_128x16x32x512_16x16_16x16_32x4x1_32x4x1_1x16x1x8_4x4x1_1x1_intrawave_v1,151.41,4773.19,0.0
256,16,16384,6656,torch.float8_e4m3fn,flydsl,1382,0,19.7693,flydsl_bpreshuflle_16x64x512_F8_F8_B16_2x0x0x4_default,176.52,5548.13,0.0
256,16,16384,8192,torch.float8_e4m3fn,ck,10,0,25.2429,a8w8_bpreshuffle_128x16x32x512_16x16_16x16_32x4x1_32x4x1_1x16x1x8_4x4x1_1x1_intrawave_v1,170.15,5343.01,0.0
256,16,16384,13312,torch.float8_e4m3fn,flydsl,532,0,37.417,flydsl_bpreshuflle_16x64x512_F8_F8_B16_2x1x0x1_default,186.53,5848.71,0.0
256,16,16384,26624,torch.float8_e4m3fn,flydsl,532,0,71.3986,flydsl_bpreshuflle_16x64x512_F8_F8_B16_2x1x0x1_default,195.5,6122.78,0.0
256,16,26624,16384,torch.float8_e4m3fn,flydsl,1360,0,76.1829,flydsl_bpreshuflle_16x64x256_F8_F8_B16_1x0x0x4_default,183.23,5740.42,0.0
256,16,51200,5120,torch.float8_e4m3fn,flydsl,26,0,45.2645,flydsl_bpreshuflle_16x256x512_F8_F8_B16_2x0x0x0_default,185.32,5829.39,0.0
256,16,53248,16384,torch.float8_e4m3fn,flydsl,600,0,151.6455,flydsl_bpreshuflle_16x256x512_F8_F8_B16_1x1x1x1_default,184.1,5765.96,0.0
256,16,57344,8192,torch.float8_e4m3fn,flydsl,90,0,79.1645,flydsl_bpreshuflle_16x256x512_F8_F8_B16_1x0x1x0_default,189.89,5958.83,0.0
256,32,800,5120,torch.float8_e4m3fn,ck,10,0,8.8635,a8w8_bpreshuffle_128x16x32x512_16x16_16x16_32x4x1_32x4x1_1x16x1x8_4x4x1_1x1_intrawave_v1,29.58,486.38,0.0
256,32,1280,8192,torch.float8_e4m3fn,ck,22,0,12.7222,a8w8_bpreshuffle_128x32x16x512_16x16_16x16_32x4x1_32x4x1_1x32x1x4_4x4x1_1x1_intrawave_v2,52.75,851.25,0.0
256,32,2304,16384,torch.float8_e4m3fn,ck,10,0,21.4233,a8w8_bpreshuffle_128x16x32x512_16x16_16x16_32x4x1_32x4x1_1x16x1x8_4x4x1_1x1_intrawave_v1,112.77,1793.4,0.0
256,32,2560,8192,torch.float8_e4m3fn,ck,8,0,12.1318,a8w8_bpreshuffle_128x32x16x512_16x16_16x16_32x4x1_32x4x1_1x32x1x4_4x4x1_1x1_intrawave_v1,110.63,1763.75,0.0
256,32,3072,1536,torch.float8_e4m3fn,flydsl,681,0,4.7937,flydsl_bpreshuflle_16x64x512_F8_F8_B16_1x0x0x2_default,63.0,1035.6,0.0
256,32,4608,16384,torch.float8_e4m3fn,ck,11,0,25.5562,a8w8_bpreshuffle_256x16x64x512_16x16_16x16_32x8x1_32x8x1_1x16x1x16_4x4x1_1x1_intrawave_v1,189.07,2986.23,0.0
256,32,5120,640,torch.float8_e4m3fn,flydsl,1112,0,4.9425,flydsl_bpreshuflle_32x64x128_F8_F8_B16_1x0x1x3_default,42.43,733.43,0.0
256,32,5120,1280,torch.float8_e4m3fn,flydsl,0,0,5.3685,flydsl_bpreshuflle_16x64x256_F8_F8_B16_1x0x0x0_default,78.13,1289.42,0.0
256,32,5120,3200,torch.float8_e4m3fn,ck,9,0,14.5435,a8w8_bpreshuffle_128x16x32x128_16x16_16x16_8x16x1_8x16x1_1x16x1x8_4x4x1_1x1_intrawave_v1,72.1,1156.12,0.0
256,32,5120,5120,torch.float8_e4m3fn,ck,11,0,9.7924,a8w8_bpreshuffle_256x16x64x512_16x16_16x16_32x8x1_32x8x1_1x16x1x16_4x4x1_1x1_intrawave_v1,171.33,2727.21,0.0
256,32,5120,6400,torch.float8_e4m3fn,flydsl,85,0,15.8557,flydsl_bpreshuflle_16x64x256_F8_F8_B16_1x0x1x0_default,132.26,2100.22,0.0
256,32,5120,25600,torch.float8_e4m3fn,ck,5,0,38.8741,a8w8_bpreshuffle_256x16x64x512_16x16_16x16_32x8x1_32x8x1_1x16x1x16_4x4x1_1x1_intrawave_v1,215.79,3401.21,0.0
256,32,6400,5120,torch.float8_e4m3fn,cktile,138,0,11.2606,a8w8_bpreshuffle_cktile_0x0x8x4x1x0x0x0x0x4_16x64x512_1x4x1_16x16x128_default,186.24,2960.89,0.0
256,32,7168,256,torch.float8_e4m3fn,cktile,144,0,2.8574,a8w8_bpreshuffle_cktile_0x0x8x4x1x0x0x0x0x4_16x64x256_1x4x1_16x16x128_default,41.1,805.61,0.0
256,32,7168,2048,torch.float8_e4m3fn,ck,11,0,6.1623,a8w8_bpreshuffle_256x16x64x512_16x16_16x16_32x8x1_32x8x1_1x16x1x16_4x4x1_1x1_intrawave_v1,152.46,2467.32,0.0
256,32,7168,8192,torch.float8_e4m3fn,ck,5,0,15.892,a8w8_bpreshuffle_256x16x64x512_16x16_16x16_32x8x1_32x8x1_1x16x1x16_4x4x1_1x1_intrawave_v1,236.48,3740.32,0.0
256,32,8192,1024,torch.float8_e4m3fn,flydsl,349,0,4.7234,flydsl_bpreshuflle_32x64x512_F8_F8_B16_1x0x0x1_default,113.66,1893.9,0.0
256,32,8192,2048,torch.float8_e4m3fn,cktile,2,0,6.4842,a8w8_bpreshuffle_cktile_0x0x8x4x1x0x0x0x0x1_16x64x512_1x4x1_16x16x128_default,165.59,2678.36,0.0
256,32,8192,3584,torch.float8_e4m3fn,ck,5,0,9.0586,a8w8_bpreshuffle_256x16x64x512_16x16_16x16_32x8x1_32x8x1_1x16x1x16_4x4x1_1x1_intrawave_v1,207.43,3311.67,0.0
256,32,8192,7168,torch.float8_e4m3fn,ck,5,0,14.9484,a8w8_bpreshuffle_256x16x64x512_16x16_16x16_32x8x1_32x8x1_1x16x1x16_4x4x1_1x1_intrawave_v1,251.4,3978.61,0.0
256,32,8192,8192,torch.float8_e4m3fn,cktile,137,0,16.895,a8w8_bpreshuffle_cktile_0x0x8x4x1x0x0x0x0x3_16x64x512_1x4x1_16x16x128_default,254.22,4018.66,0.0
256,32,8192,28672,torch.float8_e4m3fn,ck,5,0,47.6208,a8w8_bpreshuffle_256x16x64x512_16x16_16x16_32x8x1_32x8x1_1x16x1x16_4x4x1_1x1_intrawave_v1,315.67,4962.6,0.0
256,32,9216,16384,torch.float8_e4m3fn,flydsl,541,0,34.4159,flydsl_bpreshuflle_32x64x512_F8_F8_B16_2x1x0x1_default,280.79,4419.73,0.0
256,32,10240,8192,torch.float8_e4m3fn,cktile,151,0,20.9716,a8w8_bpreshuffle_cktile_0x0x8x4x1x0x0x0x0x3_32x64x512_1x4x1_16x16x128_default,256.0,4043.73,0.0
256,32,12800,5120,torch.float8_e4m3fn,flydsl,371,0,14.4147,flydsl_bpreshuflle_32x64x512_F8_F8_B16_2x0x0x1_default,290.97,4614.67,0.0
256,32,13312,16384,torch.float8_e4m3fn,flydsl,881,0,40.5149,flydsl_bpreshuflle_32x64x512_F8_F8_B16_2x1x0x2_default,344.53,5417.27,0.0
256,32,14336,8192,torch.float8_e4m3fn,flydsl,1051,0,25.3617,flydsl_bpreshuflle_32x64x512_F8_F8_B16_2x0x0x3_default,296.36,4677.14,0.0
256,32,16384,2048,torch.float8_e4m3fn,flydsl,541,0,8.9779,flydsl_bpreshuflle_32x64x512_F8_F8_B16_2x1x0x1_default,239.2,3861.54,0.0
256,32,16384,4096,torch.float8_e4m3fn,flydsl,1051,0,15.1382,flydsl_bpreshuflle_32x64x512_F8_F8_B16_2x0x0x3_default,283.72,4511.01,0.0
256,32,16384,6656,torch.float8_e4m3fn,flydsl,1051,0,20.4014,flydsl_bpreshuflle_32x64x512_F8_F8_B16_2x0x0x3_default,342.1,5407.15,0.0
256,32,16384,8192,torch.float8_e4m3fn,cktile,152,0,27.5138,a8w8_bpreshuffle_cktile_0x0x8x4x1x0x0x0x0x4_32x64x512_1x4x1_16x16x128_default,312.2,4925.84,0.0
256,32,16384,13312,torch.float8_e4m3fn,flydsl,1561,0,38.2507,flydsl_bpreshuflle_32x64x512_F8_F8_B16_2x1x0x4_default,364.93,5740.51,0.0
256,32,16384,26624,torch.float8_e4m3fn,flydsl,1051,0,71.7293,flydsl_bpreshuflle_32x64x512_F8_F8_B16_2x0x0x3_default,389.2,6107.8,0.0
256,32,26624,16384,torch.float8_e4m3fn,flydsl,30,0,77.1213,flydsl_bpreshuflle_32x64x256_F8_F8_B16_2x0x0x0_default,361.99,5685.02,0.0
256,32,51200,5120,torch.float8_e4m3fn,flydsl,1286,0,47.5994,flydsl_bpreshuflle_32x128x256_F8_F8_B16_1x1x1x3_default,352.47,5579.58,0.0
256,32,53248,16384,torch.float8_e4m3fn,flydsl,376,0,150.1428,flydsl_bpreshuflle_32x256x128_F8_F8_B16_2x0x0x1_default,371.88,5836.76,0.0
256,32,57344,8192,torch.float8_e4m3fn,flydsl,1370,0,81.6955,flydsl_bpreshuflle_32x128x128_F8_F8_B16_1x0x0x4_default,368.01,5798.29,0.0
256,64,192,1024,torch.float8_e4m3fn,flydsl,1361,0,3.1534,flydsl_bpreshuflle_16x64x512_F8_F8_B16_1x0x0x4_default,7.98,90.92,0.0
256,64,800,5120,torch.float8_e4m3fn,ck,10,0,8.5591,a8w8_bpreshuffle_128x16x32x512_16x16_16x16_32x4x1_32x4x1_1x16x1x8_4x4x1_1x1_intrawave_v1,61.26,528.8,0.0
256,64,1280,8192,torch.float8_e4m3fn,ck,10,0,12.2819,a8w8_bpreshuffle_128x16x32x512_16x16_16x16_32x4x1_32x4x1_1x16x1x8_4x4x1_1x1_intrawave_v1,109.28,909.78,0.0
256,64,2304,16384,torch.float8_e4m3fn,ck,11,0,23.2392,a8w8_bpreshuffle_256x16x64x512_16x16_16x16_32x8x1_32x8x1_1x16x1x16_4x4x1_1x1_intrawave_v1,207.92,1682.17,0.0
256,64,2560,8192,torch.float8_e4m3fn,ck,11,0,13.0367,a8w8_bpreshuffle_256x16x64x512_16x16_16x16_32x8x1_32x8x1_1x16x1x16_4x4x1_1x1_intrawave_v1,205.91,1674.0,0.0
256,64,3072,1536,torch.float8_e4m3fn,flydsl,1,0,5.0902,flydsl_bpreshuflle_16x64x512_F8_F8_B16_1x0x0x0_default,118.66,1023.56,0.0
256,64,4608,16384,torch.float8_e4m3fn,cktile,151,0,30.6156,a8w8_bpreshuffle_cktile_0x0x8x4x1x0x0x0x0x3_32x64x512_1x4x1_16x16x128_default,315.65,2519.5,0.0
256,64,5120,640,torch.float8_e4m3fn,flydsl,1474,0,5.1137,flydsl_bpreshuflle_32x64x128_F8_F8_B16_2x0x1x4_default,82.02,776.96,0.0
256,64,5120,1280,torch.float8_e4m3fn,flydsl,348,0,5.5679,flydsl_bpreshuflle_32x64x256_F8_F8_B16_1x0x0x1_default,150.66,1309.45,0.0
256,64,5120,3200,torch.float8_e4m3fn,ck,9,0,14.8233,a8w8_bpreshuffle_128x16x32x128_16x16_16x16_8x16x1_8x16x1_1x16x1x8_4x4x1_1x1_intrawave_v1,141.48,1163.31,0.0
256,64,5120,5120,torch.float8_e4m3fn,flydsl,371,0,12.0536,flydsl_bpreshuflle_32x64x512_F8_F8_B16_2x0x0x1_default,278.38,2256.37,0.0
256,64,5120,6400,torch.float8_e4m3fn,flydsl,688,0,17.6254,flydsl_bpreshuflle_32x64x256_F8_F8_B16_1x0x0x2_default,237.97,1919.56,0.0
256,64,5120,25600,torch.float8_e4m3fn,cktile,37,0,46.6172,a8w8_bpreshuffle_cktile_0x0x8x4x1x0x0x0x0x2_32x64x512_1x4x1_16x16x128_default,359.89,2860.87,0.0
256,64,6400,5120,torch.float8_e4m3fn,cktile,152,0,12.84,a8w8_bpreshuffle_cktile_0x0x8x4x1x0x0x0x0x4_32x64x512_1x4x1_16x16x128_default,326.66,2641.35,0.0
256,64,7168,256,torch.float8_e4m3fn,flydsl,1113,0,3.1231,flydsl_bpreshuflle_32x64x256_F8_F8_B16_1x0x1x3_default,75.21,886.59,0.0
256,64,7168,2048,torch.float8_e4m3fn,cktile,152,0,7.4068,a8w8_bpreshuffle_cktile_0x0x8x4x1x0x0x0x0x4_32x64x512_1x4x1_16x16x128_default,253.69,2123.54,0.0
256,64,7168,8192,torch.float8_e4m3fn,cktile,152,0,18.75,a8w8_bpreshuffle_cktile_0x0x8x4x1x0x0x0x0x4_32x64x512_1x4x1_16x16x128_default,400.86,3208.64,0.0
256,64,8192,2048,torch.float8_e4m3fn,cktile,37,0,7.4198,a8w8_bpreshuffle_cktile_0x0x8x4x1x0x0x0x0x2_32x64x512_1x4x1_16x16x128_default,289.43,2420.13,0.0
256,64,8192,3584,torch.float8_e4m3fn,cktile,37,0,10.9653,a8w8_bpreshuffle_cktile_0x0x8x4x1x0x0x0x0x2_32x64x512_1x4x1_16x16x128_default,342.73,2794.09,0.0
256,64,8192,7168,torch.float8_e4m3fn,cktile,151,0,17.5187,a8w8_bpreshuffle_cktile_0x0x8x4x1x0x0x0x0x3_32x64x512_1x4x1_16x16x128_default,429.04,3437.9,0.0
256,64,8192,8192,torch.float8_e4m3fn,cktile,37,0,19.3058,a8w8_bpreshuffle_cktile_0x0x8x4x1x0x0x0x0x2_32x64x512_1x4x1_16x16x128_default,444.94,3557.57,0.0
256,64,8192,28672,torch.float8_e4m3fn,cktile,151,0,56.3435,a8w8_bpreshuffle_cktile_0x0x8x4x1x0x0x0x0x3_32x64x512_1x4x1_16x16x128_default,533.6,4219.91,0.0
256,64,9216,16384,torch.float8_e4m3fn,flydsl,468,0,45.5485,flydsl_bpreshuflle_64x64x256_F8_F8_B16_2x0x1x1_default,424.32,3363.96,0.0
256,64,10240,8192,torch.float8_e4m3fn,ck,114,0,25.803,a8w8_bpreshuffle_256x64x64x256_16x16_16x16_16x16x1_16x16x1_1x32x1x8_8x8x1_2x1_intrawave_v3,416.13,3322.14,0.0
256,64,12800,5120,torch.float8_e4m3fn,flydsl,723,0,18.276,flydsl_bpreshuflle_64x64x256_F8_F8_B16_2x0x0x2_default,459.0,3693.48,0.0
256,64,13312,16384,torch.float8_e4m3fn,flydsl,298,0,50.3537,flydsl_bpreshuflle_64x64x256_F8_F8_B16_2x1x1x0_default,554.42,4386.1,0.0
256,64,14336,8192,torch.float8_e4m3fn,ck,114,0,29.3115,a8w8_bpreshuffle_256x64x64x256_16x16_16x16_16x16x1_16x16x1_1x32x1x8_8x8x1_2x1_intrawave_v3,512.85,4087.13,0.0
256,64,16384,2048,torch.float8_e4m3fn,flydsl,383,0,9.9577,flydsl_bpreshuflle_64x64x256_F8_F8_B16_2x0x0x1_default,431.32,3593.47,0.0
256,64,16384,4096,torch.float8_e4m3fn,ck,114,0,19.0379,a8w8_bpreshuffle_256x64x64x256_16x16_16x16_16x16x1_16x16x1_1x32x1x8_8x8x1_2x1_intrawave_v3,451.2,3648.94,0.0
256,64,16384,6656,torch.float8_e4m3fn,flydsl,43,0,24.754,flydsl_bpreshuflle_64x64x256_F8_F8_B16_2x0x0x0_default,563.89,4507.35,0.0
256,64,16384,8192,torch.float8_e4m3fn,ck,119,0,31.3938,a8w8_bpreshuffle_256x32x128x256_16x16_16x16_16x16x1_16x16x1_1x16x1x16_8x8x1_1x2_intrawave_v1,547.24,4358.8,0.0
256,64,16384,13312,torch.float8_e4m3fn,ck,114,0,44.2712,a8w8_bpreshuffle_256x64x64x256_16x16_16x16_16x16x1_16x16x1_1x32x1x8_8x8x1_2x1_intrawave_v3,630.6,4993.15,0.0
256,64,16384,26624,torch.float8_e4m3fn,ck,114,0,82.8544,a8w8_bpreshuffle_256x64x64x256_16x16_16x16_16x16x1_16x16x1_1x32x1x8_8x8x1_2x1_intrawave_v3,673.89,5310.63,0.0
256,64,26624,16384,torch.float8_e4m3fn,flydsl,555,0,79.2947,flydsl_bpreshuflle_64x128x256_F8_F8_B16_2x1x0x1_default,704.14,5557.3,0.0
256,64,51200,5120,torch.float8_e4m3fn,flydsl,49,0,50.7068,flydsl_bpreshuflle_64x256x128_F8_F8_B16_2x0x0x0_default,661.73,5305.51,0.0
256,64,53248,16384,torch.float8_e4m3fn,flydsl,729,0,153.8393,flydsl_bpreshuflle_64x256x128_F8_F8_B16_2x0x0x2_default,725.88,5722.07,0.0
256,64,57344,8192,torch.float8_e4m3fn,flydsl,1629,0,84.1498,flydsl_bpreshuflle_64x128x128_F8_F8_B16_1x1x1x4_default,714.55,5675.91,0.0
256,96,2112,7168,torch.float8_e4m3fn,ck,11,0,11.5698,a8w8_bpreshuffle_256x16x64x512_16x16_16x16_32x8x1_32x8x1_1x16x1x16_4x4x1_1x1_intrawave_v1,251.23,1403.0,0.0
256,96,3072,1536,torch.float8_e4m3fn,flydsl,9,0,5.3821,flydsl_bpreshuflle_32x64x512_F8_F8_B16_1x0x0x0_default,168.33,1013.71,0.0
256,96,7168,256,torch.float8_e4m3fn,flydsl,436,0,3.5833,flydsl_bpreshuflle_32x128x256_F8_F8_B16_1x0x1x1_default,98.32,903.03,0.0
256,96,7168,2048,torch.float8_e4m3fn,ck,113,0,8.4501,a8w8_bpreshuffle_256x48x64x256_16x16_16x16_16x16x1_16x16x1_1x16x1x16_4x4x1_1x1_intrawave_v1,333.55,1923.4,0.0
256,128,800,5120,torch.float8_e4m3fn,ck,10,0,8.3841,a8w8_bpreshuffle_128x16x32x512_16x16_16x16_32x4x1_32x4x1_1x16x1x8_4x4x1_1x1_intrawave_v1,125.07,591.14,0.0
256,128,1280,8192,torch.float8_e4m3fn,ck,5,0,12.4268,a8w8_bpreshuffle_256x16x64x512_16x16_16x16_32x8x1_32x8x1_1x16x1x16_4x4x1_1x1_intrawave_v1,216.01,954.55,0.0
256,128,2112,7168,torch.float8_e4m3fn,ck,5,0,13.7515,a8w8_bpreshuffle_256x16x64x512_16x16_16x16_32x8x1_32x8x1_1x16x1x16_4x4x1_1x1_intrawave_v1,281.83,1206.92,0.0
256,128,2304,16384,torch.float8_e4m3fn,cktile,152,0,28.0619,a8w8_bpreshuffle_cktile_0x0x8x4x1x0x0x0x0x4_32x64x512_1x4x1_16x16x128_default,344.37,1440.95,0.0
256,128,2560,8192,torch.float8_e4m3fn,cktile,37,0,15.9433,a8w8_bpreshuffle_cktile_0x0x8x4x1x0x0x0x0x2_32x64x512_1x4x1_16x16x128_default,336.74,1422.26,0.0
256,128,3072,1536,torch.float8_e4m3fn,flydsl,434,0,5.8105,flydsl_bpreshuflle_32x64x512_F8_F8_B16_1x0x1x1_default,207.89,981.26,0.0
256,128,4608,16384,torch.float8_e4m3fn,ck,114,0,41.2539,a8w8_bpreshuffle_256x64x64x256_16x16_16x16_16x16x1_16x16x1_1x32x1x8_8x8x1_2x1_intrawave_v3,468.5,1909.5,0.0
256,128,5120,640,torch.float8_e4m3fn,flydsl,1115,0,5.5631,flydsl_bpreshuflle_32x128x128_F8_F8_B16_1x0x1x3_default,150.79,839.36,0.0
256,128,5120,1280,torch.float8_e4m3fn,flydsl,723,0,6.465,flydsl_bpreshuflle_64x64x256_F8_F8_B16_2x0x0x2_default,259.51,1241.79,0.0
256,128,5120,3200,torch.float8_e4m3fn,ck,9,0,14.8154,a8w8_bpreshuffle_128x16x32x128_16x16_16x16_8x16x1_8x16x1_1x16x1x8_4x4x1_1x1_intrawave_v1,283.1,1221.99,0.0
256,128,5120,5120,torch.float8_e4m3fn,ck,114,0,15.9685,a8w8_bpreshuffle_256x64x64x256_16x16_16x16_16x16x1_16x16x1_1x32x1x8_8x8x1_2x1_intrawave_v3,420.26,1764.75,0.0
256,128,5120,6400,torch.float8_e4m3fn,ck,114,0,18.6675,a8w8_bpreshuffle_256x64x64x256_16x16_16x16_16x16x1_16x16x1_1x32x1x8_8x8x1_2x1_intrawave_v3,449.37,1869.45,0.0
256,128,5120,25600,torch.float8_e4m3fn,ck,114,0,62.6884,a8w8_bpreshuffle_256x64x64x256_16x16_16x16_16x16x1_16x16x1_1x32x1x8_8x8x1_2x1_intrawave_v3,535.26,2164.03,0.0
256,128,6400,5120,torch.float8_e4m3fn,ck,114,0,16.2853,a8w8_bpreshuffle_256x64x64x256_16x16_16x16_16x16x1_16x16x1_1x32x1x8_8x8x1_2x1_intrawave_v3,515.1,2152.97,0.0
256,128,7168,256,torch.float8_e4m3fn,flydsl,693,0,3.5894,flydsl_bpreshuflle_64x64x256_F8_F8_B16_1x0x0x2_default,130.87,1031.59,0.0
256,128,7168,2048,torch.float8_e4m3fn,flydsl,383,0,8.7991,flydsl_bpreshuflle_64x64x256_F8_F8_B16_2x0x0x1_default,427.1,1906.7,0.0
256,128,7168,8192,torch.float8_e4m3fn,ck,114,0,24.1304,a8w8_bpreshuffle_256x64x64x256_16x16_16x16_16x16x1_16x16x1_1x32x1x8_8x8x1_2x1_intrawave_v3,622.96,2552.96,0.0
256,128,8192,1024,torch.float8_e4m3fn,flydsl,778,0,6.3251,flydsl_bpreshuflle_64x64x256_F8_F8_B16_1x0x1x2_default,339.52,1678.52,0.0
256,128,8192,2048,torch.float8_e4m3fn,ck,119,0,8.9195,a8w8_bpreshuffle_256x32x128x256_16x16_16x16_16x16x1_16x16x1_1x16x1x16_8x8x1_1x2_intrawave_v1,481.53,2145.47,0.0
256,128,8192,3584,torch.float8_e4m3fn,ck,114,0,12.9982,a8w8_bpreshuffle_256x64x64x256_16x16_16x16_16x16x1_16x16x1_1x32x1x8_8x8x1_2x1_intrawave_v3,578.25,2455.42,0.0
256,128,8192,7168,torch.float8_e4m3fn,ck,114,0,21.8198,a8w8_bpreshuffle_256x64x64x256_16x16_16x16_16x16x1_16x16x1_1x32x1x8_8x8x1_2x1_intrawave_v3,688.93,2829.31,0.0
256,128,8192,8192,torch.float8_e4m3fn,ck,114,0,24.9863,a8w8_bpreshuffle_256x64x64x256_16x16_16x16_16x16x1_16x16x1_1x32x1x8_8x8x1_2x1_intrawave_v3,687.57,2811.72,0.0
256,128,8192,28672,torch.float8_e4m3fn,ck,114,0,75.3441,a8w8_bpreshuffle_256x64x64x256_16x16_16x16_16x16x1_16x16x1_1x32x1x8_8x8x1_2x1_intrawave_v3,798.07,3193.99,0.0
256,128,9216,16384,torch.float8_e4m3fn,cktile,75,0,54.0994,a8w8_bpreshuffle_cktile_0x0x8x4x1x0x0x0x0x1_48x128x256_1x4x1_16x16x128_default,714.51,2873.44,0.0
256,128,10240,8192,torch.float8_e4m3fn,ck,113,0,30.8675,a8w8_bpreshuffle_256x48x64x256_16x16_16x16_16x16x1_16x16x1_1x16x1x16_4x4x1_1x1_intrawave_v1,695.71,2836.51,0.0
256,128,12800,5120,torch.float8_e4m3fn,ck,65,0,23.1385,a8w8_bpreshuffle_256x128x64x256_16x16_16x16_16x16x1_16x16x1_1x32x1x8_8x8x1_2x1_intrawave_v3,725.08,3002.28,0.0
256,128,13312,16384,torch.float8_e4m3fn,ck,65,0,61.3767,a8w8_bpreshuffle_256x128x64x256_16x16_16x16_16x16x1_16x16x1_1x32x1x8_8x8x1_2x1_intrawave_v3,909.7,3643.22,0.0
256,128,14336,8192,torch.float8_e4m3fn,ck,144,0,37.1409,a8w8_bpreshuffle_256x128x64x256_16x16_16x16_16x16x1_16x16x1_1x32x1x8_8x8x1_2x1_intrawave_v3,809.48,3289.07,0.0
256,128,16384,2048,torch.float8_e4m3fn,flydsl,1428,0,12.123,flydsl_bpreshuflle_128x64x256_F8_F8_B16_2x0x0x4_default,708.57,3135.44,0.0
256,128,16384,4096,torch.float8_e4m3fn,ck,144,0,23.3979,a8w8_bpreshuffle_256x128x64x256_16x16_16x16_16x16x1_16x16x1_1x32x1x8_8x8x1_2x1_intrawave_v3,734.25,3069.82,0.0
256,128,16384,6656,torch.float8_e4m3fn,ck,144,0,30.7671,a8w8_bpreshuffle_256x128x64x256_16x16_16x16_16x16x1_16x16x1_1x32x1x8_8x8x1_2x1_intrawave_v3,907.37,3708.45,0.0
256,128,16384,8192,torch.float8_e4m3fn,cktile,52,0,38.8353,a8w8_bpreshuffle_cktile_0x0x8x4x1x0x0x0x0x2_64x128x256_1x4x1_16x16x128_default,884.76,3591.08,0.0
256,128,16384,13312,torch.float8_e4m3fn,cktile,40,0,55.871,a8w8_bpreshuffle_cktile_0x0x8x4x1x0x0x0x0x2_128x64x256_1x4x1_16x16x128_default,999.35,4009.27,0.0
256,128,16384,26624,torch.float8_e4m3fn,cktile,159,0,102.0298,a8w8_bpreshuffle_cktile_0x0x8x4x1x0x0x0x0x4_128x64x256_1x4x1_16x16x128_default,1094.48,4349.81,0.0
256,128,26624,16384,torch.float8_e4m3fn,flydsl,496,0,97.8935,flydsl_bpreshuflle_128x128x256_F8_F8_B16_2x0x1x1_default,1140.72,4546.99,0.0
256,128,51200,5120,torch.float8_e4m3fn,flydsl,159,0,59.7187,flydsl_bpreshuflle_128x256x128_F8_F8_B16_2x0x1x0_default,1123.75,4620.1,0.0
256,128,53248,16384,torch.float8_e4m3fn,ck,154,0,166.5605,a8w8_bpreshuffle_256x128x256x256_16x16_16x16_16x16x1_16x16x1_1x16x1x16_8x8x1_1x2_intrawave_v3,1340.88,5332.26,0.0
256,128,57344,8192,torch.float8_e4m3fn,flydsl,499,0,94.2152,flydsl_bpreshuflle_128x256x128_F8_F8_B16_2x0x1x1_default,1276.43,5153.0,0.0
256,256,800,5120,torch.float8_e4m3fn,ck,10,0,9.755,a8w8_bpreshuffle_128x16x32x512_16x16_16x16_32x4x1_32x4x1_1x16x1x8_4x4x1_1x1_intrawave_v1,214.98,596.24,0.0
256,256,1280,8192,torch.float8_e4m3fn,cktile,9,0,15.0073,a8w8_bpreshuffle_cktile_0x0x8x4x1x0x0x0x0x1_32x64x512_1x4x1_16x16x128_default,357.74,882.12,0.0
256,256,2304,16384,torch.float8_e4m3fn,ck,114,0,39.5009,a8w8_bpreshuffle_256x64x64x256_16x16_16x16_16x16x1_16x16x1_1x32x1x8_8x8x1_2x1_intrawave_v3,489.29,1091.69,0.0
256,256,2560,8192,torch.float8_e4m3fn,ck,114,0,21.9456,a8w8_bpreshuffle_256x64x64x256_16x16_16x16_16x16x1_16x16x1_1x32x1x8_8x8x1_2x1_intrawave_v3,489.27,1110.9,0.0
256,256,4608,16384,torch.float8_e4m3fn,cktile,118,0,50.3462,a8w8_bpreshuffle_cktile_0x0x8x4x1x0x0x0x0x2_96x64x256_1x4x1_16x16x128_default,767.78,1629.74,0.0
256,256,5120,640,torch.float8_e4m3fn,flydsl,1457,0,6.4891,flydsl_bpreshuflle_64x64x128_F8_F8_B16_1x0x1x4_default,258.54,934.19,0.0
256,256,5120,1280,torch.float8_e4m3fn,flydsl,68,0,8.1874,flydsl_bpreshuflle_128x64x256_F8_F8_B16_2x0x0x0_default,409.83,1160.65,0.0
256,256,5120,3200,torch.float8_e4m3fn,ck,76,0,16.8613,a8w8_bpreshuffle_256x32x64x128_16x16_16x16_8x32x1_8x32x1_1x32x1x8_8x8x1_2x1_intrawave_v1,497.51,1175.75,0.0
256,256,5120,5120,torch.float8_e4m3fn,ck,113,0,19.7081,a8w8_bpreshuffle_256x48x64x256_16x16_16x16_16x16x1_16x16x1_1x16x1x16_4x4x1_1x1_intrawave_v1,681.03,1529.65,0.0
256,256,5120,6400,torch.float8_e4m3fn,ck,120,0,23.3272,a8w8_bpreshuffle_256x48x128x256_16x16_16x16_16x16x1_16x16x1_1x16x1x16_8x8x1_1x2_intrawave_v1,719.21,1587.32,0.0
256,256,5120,25600,torch.float8_e4m3fn,cktile,231,0,78.0982,a8w8_bpreshuffle_cktile_0x0x8x4x1x0x0x0x0x4_112x64x256_1x4x1_16x16x128_default,859.29,1795.78,0.0
256,256,6400,5120,torch.float8_e4m3fn,ck,65,0,21.7958,a8w8_bpreshuffle_256x128x64x256_16x16_16x16_16x16x1_16x16x1_1x32x1x8_8x8x1_2x1_intrawave_v3,769.75,1713.89,0.0
256,256,7168,256,torch.float8_e4m3fn,flydsl,353,0,4.5678,flydsl_bpreshuflle_64x64x256_F8_F8_B16_1x0x0x1_default,205.68,1219.53,0.0
256,256,7168,2048,torch.float8_e4m3fn,flydsl,408,0,11.0105,flydsl_bpreshuflle_128x64x256_F8_F8_B16_2x0x0x1_default,682.64,1714.22,0.0
256,256,7168,8192,torch.float8_e4m3fn,ck,65,0,30.2141,a8w8_bpreshuffle_256x128x64x256_16x16_16x16_16x16x1_16x16x1_1x32x1x8_8x8x1_2x1_intrawave_v3,995.06,2134.35,0.0
256,256,8192,1024,torch.float8_e4m3fn,flydsl,153,0,8.1482,flydsl_bpreshuflle_128x64x256_F8_F8_B16_2x0x1x0_default,527.11,1576.43,0.0
256,256,8192,2048,torch.float8_e4m3fn,flydsl,68,0,11.3782,flydsl_bpreshuflle_128x64x256_F8_F8_B16_2x0x0x0_default,754.95,1889.21,0.0
256,256,8192,3584,torch.float8_e4m3fn,ck,144,0,16.9979,a8w8_bpreshuffle_256x128x64x256_16x16_16x16_16x16x1_16x16x1_1x32x1x8_8x8x1_2x1_intrawave_v3,884.37,2028.01,0.0
256,256,8192,7168,torch.float8_e4m3fn,ck,144,0,29.2425,a8w8_bpreshuffle_256x128x64x256_16x16_16x16_16x16x1_16x16x1_1x32x1x8_8x8x1_2x1_intrawave_v3,1028.12,2214.23,0.0
256,256,8192,8192,torch.float8_e4m3fn,ck,144,0,32.3334,a8w8_bpreshuffle_256x128x64x256_16x16_16x16_16x16x1_16x16x1_1x32x1x8_8x8x1_2x1_intrawave_v3,1062.67,2270.11,0.0
256,256,8192,28672,torch.float8_e4m3fn,ck,65,0,97.2528,a8w8_bpreshuffle_256x128x64x256_16x16_16x16_16x16x1_16x16x1_1x32x1x8_8x8x1_2x1_intrawave_v3,1236.56,2533.76,0.0
256,256,9216,16384,torch.float8_e4m3fn,cktile,132,0,66.2368,a8w8_bpreshuffle_cktile_0x0x8x4x1x0x0x0x0x2_96x128x256_1x4x1_16x16x128_default,1167.17,2414.18,0.0
256,256,10240,8192,torch.float8_e4m3fn,cktile,99,0,39.9436,a8w8_bpreshuffle_cktile_0x0x8x4x1x0x0x0x0x1_96x128x256_1x4x1_16x16x128_default,1075.26,2283.87,0.0
256,256,12800,5120,torch.float8_e4m3fn,flydsl,1176,0,30.8657,flydsl_bpreshuflle_128x128x256_F8_F8_B16_2x0x1x3_default,1087.11,2378.05,0.0
256,256,13312,16384,torch.float8_e4m3fn,cktile,29,0,78.8031,a8w8_bpreshuffle_cktile_0x0x8x4x1x0x0x0x0x2_128x128x256_1x4x1_16x16x128_default,1417.07,2907.42,0.0
256,256,14336,8192,torch.float8_e4m3fn,cktile,29,0,46.6075,a8w8_bpreshuffle_cktile_0x0x8x4x1x0x0x0x0x2_128x128x256_1x4x1_16x16x128_default,1290.13,2722.26,0.0
256,256,16384,2048,torch.float8_e4m3fn,flydsl,1091,0,16.1482,flydsl_bpreshuflle_128x128x256_F8_F8_B16_2x0x0x3_default,1063.89,2629.85,0.0
256,256,16384,4096,torch.float8_e4m3fn,ck,139,0,29.3209,a8w8_bpreshuffle_256x128x128x256_16x16_16x16_16x16x1_16x16x1_1x16x1x16_8x8x1_1x2_intrawave_v3,1171.85,2610.63,0.0
256,256,16384,6656,torch.float8_e4m3fn,ck,63,0,42.0922,a8w8_bpreshuffle_256x128x128x256_16x16_16x16_16x16x1_16x16x1_1x32x1x8_8x8x1_2x1_intrawave_v3,1326.48,2830.56,0.0
256,256,16384,8192,torch.float8_e4m3fn,cktile,29,0,47.9655,a8w8_bpreshuffle_cktile_0x0x8x4x1x0x0x0x0x2_128x128x256_1x4x1_16x16x128_default,1432.69,3016.82,0.0
256,256,16384,13312,torch.float8_e4m3fn,cktile,29,0,72.454,a8w8_bpreshuffle_cktile_0x0x8x4x1x0x0x0x0x2_128x128x256_1x4x1_16x16x128_default,1541.24,3173.05,0.0
256,256,16384,26624,torch.float8_e4m3fn,cktile,29,0,131.2409,a8w8_bpreshuffle_cktile_0x0x8x4x1x0x0x0x0x2_128x128x256_1x4x1_16x16x128_default,1701.74,3439.57,0.0
256,256,26624,16384,torch.float8_e4m3fn,ck,154,0,131.1125,a8w8_bpreshuffle_256x128x256x256_16x16_16x16_16x16x1_16x16x1_1x16x1x16_8x8x1_1x2_intrawave_v3,1703.41,3462.93,0.0
256,256,51200,5120,torch.float8_e4m3fn,ck,33,0,88.3748,a8w8_bpreshuffle_256x256x256x128_16x16_16x16_8x32x1_8x32x1_1x32x1x8_8x8x1_2x1_intrawave_v3,1518.73,3277.73,0.0
256,256,53248,16384,torch.float8_e4m3fn,cktile,10,0,228.3049,a8w8_bpreshuffle_cktile_0x0x8x4x1x0x0x0x0x1_256x256x128_1x4x1_16x16x128_default,1956.49,3959.06,0.0
256,256,57344,8192,torch.float8_e4m3fn,ck,33,0,132.4486,a8w8_bpreshuffle_256x256x256x128_16x16_16x16_8x32x1_8x32x1_1x32x1x8_8x8x1_2x1_intrawave_v3,1815.94,3784.26,0.0
256,512,800,5120,torch.float8_e4m3fn,ck,24,0,15.3012,a8w8_bpreshuffle_128x16x32x512_16x16_16x16_32x4x1_32x4x1_1x16x1x8_4x4x1_1x1_intrawave_v2,274.12,492.55,0.0
256,512,1280,8192,torch.float8_e4m3fn,ck,114,0,20.8733,a8w8_bpreshuffle_256x64x64x256_16x16_16x16_16x16x1_16x16x1_1x32x1x8_8x8x1_2x1_intrawave_v3,514.41,766.09,0.0
256,512,2112,7168,torch.float8_e4m3fn,cktile,178,0,22.7485,a8w8_bpreshuffle_cktile_0x0x8x4x1x0x0x0x0x3_64x64x256_1x4x1_16x16x128_default,681.46,921.89,0.0
256,512,2304,16384,torch.float8_e4m3fn,cktile,225,0,49.0803,a8w8_bpreshuffle_cktile_0x0x8x4x1x0x0x0x0x4_80x64x256_1x4x1_16x16x128_default,787.58,988.11,0.0
256,512,2560,8192,torch.float8_e4m3fn,cktile,78,0,27.1663,a8w8_bpreshuffle_cktile_0x0x8x4x1x0x0x0x0x1_48x64x256_1x4x1_16x16x128_default,790.5,1022.86,0.0
256,512,3072,1536,torch.float8_e4m3fn,ck,126,0,8.9122,a8w8_bpreshuffle_256x32x192x256_16x16_16x16_16x16x1_16x16x1_1x32x1x8_8x8x1_2x1_intrawave_v1,542.16,970.66,0.0
256,512,4608,16384,torch.float8_e4m3fn,cktile,125,0,64.703,a8w8_bpreshuffle_cktile_0x0x8x4x1x0x0x0x0x2_80x128x256_1x4x1_16x16x128_default,1194.84,1369.41,0.0
256,512,5120,640,torch.float8_e4m3fn,flydsl,1202,0,7.8851,flydsl_bpreshuflle_64x64x128_F8_F8_B16_1x1x0x3_default,425.54,1122.04,0.0
256,512,5120,1280,torch.float8_e4m3fn,flydsl,1431,0,10.4559,flydsl_bpreshuflle_128x128x256_F8_F8_B16_2x0x0x4_default,641.83,1190.89,0.0
256,512,5120,3200,torch.float8_e4m3fn,cktile,219,0,21.7459,a8w8_bpreshuffle_cktile_0x0x8x4x1x0x0x0x0x4_96x64x128_1x4x1_16x16x128_default,771.51,1069.87,0.0
256,512,5120,5120,torch.float8_e4m3fn,cktile,132,0,25.9588,a8w8_bpreshuffle_cktile_0x0x8x4x1x0x0x0x0x2_96x128x256_1x4x1_16x16x128_default,1034.08,1312.8,0.0
256,512,5120,6400,torch.float8_e4m3fn,ck,123,0,29.7745,a8w8_bpreshuffle_256x96x128x256_16x16_16x16_16x16x1_16x16x1_1x16x1x16_8x8x1_1x2_intrawave_v3,1126.95,1386.68,0.0
256,512,5120,25600,torch.float8_e4m3fn,cktile,253,0,97.3918,a8w8_bpreshuffle_cktile_0x0x8x4x1x0x0x0x0x4_96x128x256_1x4x1_16x16x128_default,1378.12,1534.24,0.0
256,512,6400,5120,torch.float8_e4m3fn,ck,63,0,29.5933,a8w8_bpreshuffle_256x128x128x256_16x16_16x16_16x16x1_16x16x1_1x32x1x8_8x8x1_2x1_intrawave_v3,1133.85,1417.32,0.0
256,512,7168,256,torch.float8_e4m3fn,flydsl,1038,0,6.0917,flydsl_bpreshuflle_128x128x128_F8_F8_B16_1x0x0x3_default,308.46,1527.67,0.0
256,512,7168,2048,torch.float8_e4m3fn,flydsl,1431,0,15.4032,flydsl_bpreshuflle_128x128x256_F8_F8_B16_2x0x0x4_default,975.93,1497.65,0.0
256,512,7168,8192,torch.float8_e4m3fn,ck,139,0,43.0693,a8w8_bpreshuffle_256x128x128x256_16x16_16x16_16x16x1_16x16x1_1x16x1x16_8x8x1_1x2_intrawave_v3,1396.11,1631.2,0.0
256,512,8192,1024,torch.float8_e4m3fn,flydsl,1516,0,11.1804,flydsl_bpreshuflle_128x128x256_F8_F8_B16_2x0x1x4_default,768.3,1547.49,0.0
256,512,8192,2048,torch.float8_e4m3fn,flydsl,1431,0,15.8041,flydsl_bpreshuflle_128x128x256_F8_F8_B16_2x0x0x4_default,1087.05,1658.71,0.0
256,512,8192,3584,torch.float8_e4m3fn,ck,139,0,23.729,a8w8_bpreshuffle_256x128x128x256_16x16_16x16_16x16x1_16x16x1_1x16x1x16_8x8x1_1x2_intrawave_v3,1267.01,1668.16,0.0
256,512,8192,7168,torch.float8_e4m3fn,cktile,29,0,40.8846,a8w8_bpreshuffle_cktile_0x0x8x4x1x0x0x0x0x2_128x128x256_1x4x1_16x16x128_default,1470.71,1731.19,0.0
256,512,8192,8192,torch.float8_e4m3fn,cktile,135,0,45.626,a8w8_bpreshuffle_cktile_0x0x8x4x1x0x0x0x0x3_128x128x256_1x4x1_16x16x128_default,1506.15,1746.63,0.0
256,512,8192,28672,torch.float8_e4m3fn,cktile,29,0,130.4084,a8w8_bpreshuffle_cktile_0x0x8x4x1x0x0x0x0x2_128x128x256_1x4x1_16x16x128_default,1844.35,1978.01,0.0
256,512,9216,16384,torch.float8_e4m3fn,ck,149,0,93.863,a8w8_bpreshuffle_256x128x192x256_16x16_16x16_16x16x1_16x16x1_1x32x1x8_8x8x1_2x1_intrawave_v3,1647.28,1798.59,0.0
256,512,10240,8192,torch.float8_e4m3fn,ck,143,0,57.9667,a8w8_bpreshuffle_256x192x128x128_16x16_16x16_8x32x1_8x32x1_1x16x1x16_8x8x1_1x2_intrawave_v3,1481.87,1700.39,0.0
256,512,12800,5120,torch.float8_e4m3fn,ck,154,0,47.1032,a8w8_bpreshuffle_256x128x256x256_16x16_16x16_16x16x1_16x16x1_1x16x1x16_8x8x1_1x2_intrawave_v3,1424.72,1725.25,0.0
256,512,13312,16384,torch.float8_e4m3fn,ck,154,0,118.7228,a8w8_bpreshuffle_256x128x256x256_16x16_16x16_16x16x1_16x16x1_1x16x1x16_8x8x1_1x2_intrawave_v3,1881.17,2022.56,0.0
256,512,14336,8192,torch.float8_e4m3fn,ck,154,0,66.1126,a8w8_bpreshuffle_256x128x256x256_16x16_16x16_16x16x1_16x16x1_1x16x1x16_8x8x1_1x2_intrawave_v3,1819.0,2061.86,0.0
256,512,16384,2048,torch.float8_e4m3fn,flydsl,1187,0,26.217,flydsl_bpreshuflle_256x128x128_F8_F8_B16_2x0x1x3_default,1310.59,1959.81,0.0
256,512,16384,4096,torch.float8_e4m3fn,ck,154,0,43.3686,a8w8_bpreshuffle_256x128x256x256_16x16_16x16_16x16x1_16x16x1_1x16x1x16_8x8x1_1x2_intrawave_v3,1584.54,1982.61,0.0
256,512,16384,6656,torch.float8_e4m3fn,ck,154,0,60.2915,a8w8_bpreshuffle_256x128x256x256_16x16_16x16_16x16x1_16x16x1_1x16x1x16_8x8x1_1x2_intrawave_v3,1852.15,2143.54,0.0
256,512,16384,8192,torch.float8_e4m3fn,ck,154,0,67.7404,a8w8_bpreshuffle_256x128x256x256_16x16_16x16_16x16x1_16x16x1_1x16x1x16_8x8x1_1x2_intrawave_v3,2028.91,2290.94,0.0
256,512,16384,13312,torch.float8_e4m3fn,ck,154,0,110.0363,a8w8_bpreshuffle_256x128x256x256_16x16_16x16_16x16x1_16x16x1_1x16x1x16_8x8x1_1x2_intrawave_v3,2029.68,2196.52,0.0
256,512,16384,26624,torch.float8_e4m3fn,ck,154,0,197.4411,a8w8_bpreshuffle_256x128x256x256_16x16_16x16_16x16x1_16x16x1_1x16x1x16_8x8x1_1x2_intrawave_v3,2262.33,2363.32,0.0
256,512,26624,16384,torch.float8_e4m3fn,cktile,154,0,195.1941,a8w8_bpreshuffle_cktile_0x0x8x4x1x0x0x0x0x3_256x256x128_1x4x1_16x16x128_default,2288.37,2417.38,0.0
256,512,51200,5120,torch.float8_e4m3fn,ck,51,0,154.1446,a8w8_bpreshuffle_256x192x128x128_16x16_16x16_8x32x1_8x32x1_1x32x1x8_8x8x1_2x1_intrawave_v3,1741.45,2057.77,0.0
256,512,53248,16384,torch.float8_e4m3fn,cktile,155,0,380.7134,a8w8_bpreshuffle_cktile_0x0x8x4x1x0x0x0x0x4_256x256x128_1x4x1_16x16x128_default,2346.52,2456.78,0.0
256,512,57344,8192,torch.float8_e4m3fn,cktile,155,0,227.5653,a8w8_bpreshuffle_cktile_0x0x8x4x1x0x0x0x0x4_256x256x128_1x4x1_16x16x128_default,2113.84,2340.76,0.0
256,1024,800,5120,torch.float8_e4m3fn,ck,10,0,22.2608,a8w8_bpreshuffle_128x16x32x512_16x16_16x16_32x4x1_32x4x1_1x16x1x8_4x4x1_1x1_intrawave_v1,376.83,493.12,0.0
256,1024,1280,8192,torch.float8_e4m3fn,cktile,216,0,26.9422,a8w8_bpreshuffle_cktile_0x0x8x4x1x0x0x0x0x3_48x64x256_1x4x1_16x16x128_default,797.07,797.85,0.0
256,1024,2304,16384,torch.float8_e4m3fn,cktile,92,0,64.1257,a8w8_bpreshuffle_cktile_0x0x8x4x1x0x0x0x0x1_80x128x256_1x4x1_16x16x128_default,1205.59,923.88,0.0
256,1024,2560,8192,torch.float8_e4m3fn,cktile,132,0,37.6078,a8w8_bpreshuffle_cktile_0x0x8x4x1x0x0x0x0x2_96x128x256_1x4x1_16x16x128_default,1142.04,920.1,0.0
256,1024,4608,16384,torch.float8_e4m3fn,ck,149,0,92.9934,a8w8_bpreshuffle_256x128x192x256_16x16_16x16_16x16x1_16x16x1_1x32x1x8_8x8x1_2x1_intrawave_v3,1662.69,1093.75,0.0
256,1024,5120,640,torch.float8_e4m3fn,flydsl,724,0,11.0374,flydsl_bpreshuflle_64x128x128_F8_F8_B16_2x0x0x2_default,608.01,1306.28,0.0
256,1024,5120,1280,torch.float8_e4m3fn,ck,86,0,15.6234,a8w8_bpreshuffle_256x96x128x128_16x16_16x16_8x32x1_8x32x1_1x32x1x8_8x8x1_2x1_intrawave_v3,859.08,1174.53,0.0
256,1024,5120,3200,torch.float8_e4m3fn,ck,86,0,27.9341,a8w8_bpreshuffle_256x96x128x128_16x16_16x16_8x32x1_8x32x1_1x32x1x8_8x8x1_2x1_intrawave_v3,1201.2,1079.2,0.0
256,1024,5120,5120,torch.float8_e4m3fn,ck,137,0,40.5202,a8w8_bpreshuffle_256x96x256x256_16x16_16x16_16x16x1_16x16x1_1x16x1x16_8x8x1_1x2_intrawave_v3,1324.95,1035.11,0.0
256,1024,5120,6400,torch.float8_e4m3fn,ck,123,0,48.2874,a8w8_bpreshuffle_256x96x128x256_16x16_16x16_16x16x1_16x16x1_1x16x1x16_8x8x1_1x2_intrawave_v3,1389.78,1031.48,0.0
256,1024,5120,25600,torch.float8_e4m3fn,cktile,106,0,149.8235,a8w8_bpreshuffle_cktile_0x0x8x4x1x0x0x0x0x1_96x256x256_1x4x1_16x16x128_default,1791.68,1119.8,0.0
256,1024,6400,5120,torch.float8_e4m3fn,ck,154,0,44.8656,a8w8_bpreshuffle_256x128x256x256_16x16_16x16_16x16x1_16x16x1_1x16x1x16_8x8x1_1x2_intrawave_v3,1495.78,1139.36,0.0
256,1024,7168,256,torch.float8_e4m3fn,flydsl,865,0,8.9199,flydsl_bpreshuflle_64x128x256_F8_F8_B16_1x1x0x2_default,421.32,1880.87,0.0
256,1024,7168,2048,torch.float8_e4m3fn,ck,70,0,23.9215,a8w8_bpreshuffle_256x128x128x128_16x16_16x16_8x32x1_8x32x1_1x32x1x8_8x8x1_2x1_intrawave_v3,1256.81,1315.02,0.0
256,1024,7168,8192,torch.float8_e4m3fn,ck,154,0,65.8642,a8w8_bpreshuffle_256x128x256x256_16x16_16x16_16x16x1_16x16x1_1x16x1x16_8x8x1_1x2_intrawave_v3,1825.86,1241.78,0.0
256,1024,8192,1024,torch.float8_e4m3fn,flydsl,70,0,16.6458,flydsl_bpreshuflle_128x128x128_F8_F8_B16_2x0x0x0_default,1032.08,1574.84,0.0
256,1024,8192,2048,torch.float8_e4m3fn,flydsl,580,0,25.4266,flydsl_bpreshuflle_128x128x128_F8_F8_B16_2x1x0x1_default,1351.33,1402.14,0.0
256,1024,8192,3584,torch.float8_e4m3fn,ck,70,0,39.1061,a8w8_bpreshuffle_256x128x128x128_16x16_16x16_8x32x1_8x32x1_1x32x1x8_8x8x1_2x1_intrawave_v3,1537.6,1273.65,0.0
256,1024,8192,7168,torch.float8_e4m3fn,ck,154,0,62.9699,a8w8_bpreshuffle_256x128x256x256_16x16_16x16_16x16x1_16x16x1_1x16x1x16_8x8x1_1x2_intrawave_v3,1909.79,1315.51,0.0
256,1024,8192,8192,torch.float8_e4m3fn,ck,154,0,69.5632,a8w8_bpreshuffle_256x128x256x256_16x16_16x16_16x16x1_16x16x1_1x16x1x16_8x8x1_1x2_intrawave_v3,1975.74,1326.49,0.0
256,1024,8192,28672,torch.float8_e4m3fn,ck,154,0,200.4774,a8w8_bpreshuffle_256x128x256x256_16x16_16x16_16x16x1_16x16x1_1x16x1x16_8x8x1_1x2_intrawave_v3,2399.45,1401.75,0.0
256,1024,9216,16384,torch.float8_e4m3fn,cktile,89,0,142.9751,a8w8_bpreshuffle_cktile_0x0x8x4x1x0x0x0x0x1_224x192x128_1x4x1_16x16x128_default,2162.88,1305.45,0.0
256,1024,10240,8192,torch.float8_e4m3fn,ck,51,0,95.631,a8w8_bpreshuffle_256x192x128x128_16x16_16x16_8x32x1_8x32x1_1x32x1x8_8x8x1_2x1_intrawave_v3,1796.47,1184.2,0.0
256,1024,12800,5120,torch.float8_e4m3fn,ck,40,0,78.7017,a8w8_bpreshuffle_256x224x256x128_16x16_16x16_8x32x1_8x32x1_1x32x1x8_8x8x1_2x1_intrawave_v3,1705.4,1232.42,0.0
256,1024,13312,16384,torch.float8_e4m3fn,cktile,10,0,193.42,a8w8_bpreshuffle_cktile_0x0x8x4x1x0x0x0x0x1_256x256x128_1x4x1_16x16x128_default,2309.36,1355.31,0.0
256,1024,14336,8192,torch.float8_e4m3fn,cktile,154,0,114.6158,a8w8_bpreshuffle_cktile_0x0x8x4x1x0x0x0x0x3_256x256x128_1x4x1_16x16x128_default,2098.47,1354.0,0.0
256,1024,16384,2048,torch.float8_e4m3fn,flydsl,700,0,46.7719,flydsl_bpreshuflle_128x256x128_F8_F8_B16_1x0x0x2_default,1469.25,1479.65,0.0
256,1024,16384,4096,torch.float8_e4m3fn,ck,33,0,73.4893,a8w8_bpreshuffle_256x256x256x128_16x16_16x16_8x32x1_8x32x1_1x32x1x8_8x8x1_2x1_intrawave_v3,1870.19,1426.84,0.0
256,1024,16384,6656,torch.float8_e4m3fn,ck,33,0,107.4228,a8w8_bpreshuffle_256x256x256x128_16x16_16x16_8x32x1_8x32x1_1x32x1x8_8x8x1_2x1_intrawave_v3,2079.06,1390.97,0.0
256,1024,16384,8192,torch.float8_e4m3fn,cktile,154,0,121.1845,a8w8_bpreshuffle_cktile_0x0x8x4x1x0x0x0x0x3_256x256x128_1x4x1_16x16x128_default,2268.26,1453.66,0.0
256,1024,16384,13312,torch.float8_e4m3fn,cktile,154,0,174.99,a8w8_bpreshuffle_cktile_0x0x8x4x1x0x0x0x0x3_256x256x128_1x4x1_16x16x128_default,2552.58,1516.03,0.0
256,1024,16384,26624,torch.float8_e4m3fn,cktile,10,0,318.9309,a8w8_bpreshuffle_cktile_0x0x8x4x1x0x0x0x0x1_256x256x128_1x4x1_16x16x128_default,2801.09,1558.41,0.0
256,1024,26624,16384,torch.float8_e4m3fn,cktile,154,0,367.851,a8w8_bpreshuffle_cktile_0x0x8x4x1x0x0x0x0x3_256x256x128_1x4x1_16x16x128_default,2428.57,1379.66,0.0
256,1024,51200,5120,torch.float8_e4m3fn,flydsl,847,0,262.9387,flydsl_bpreshuflle_256x128x128_F8_F8_B16_2x0x1x2_default,2041.81,1415.71,0.0
256,1024,53248,16384,torch.float8_e4m3fn,cktile,13,0,740.4299,a8w8_bpreshuffle_cktile_0x0x8x4x1x0x0x0x0x2_256x128x128_1x4x1_16x16x128_default,2413.07,1348.2,0.0
256,1024,57344,8192,torch.float8_e4m3fn,cktile,13,0,414.5922,a8w8_bpreshuffle_cktile_0x0x8x4x1x0x0x0x0x2_256x128x128_1x4x1_16x16x128_default,2320.53,1436.57,0.0
256,2048,800,5120,torch.float8_e4m3fn,ck,10,0,38.353,a8w8_bpreshuffle_128x16x32x512_16x16_16x16_32x4x1_32x4x1_1x16x1x8_4x4x1_1x1_intrawave_v1,437.44,465.64,0.0
256,2048,1280,8192,torch.float8_e4m3fn,cktile,253,0,36.2897,a8w8_bpreshuffle_cktile_0x0x8x4x1x0x0x0x0x4_96x128x256_1x4x1_16x16x128_default,1183.52,895.73,0.0
256,2048,2112,7168,torch.float8_e4m3fn,cktile,251,0,44.9405,a8w8_bpreshuffle_cktile_0x0x8x4x1x0x0x0x0x4_96x192x256_1x4x1_16x16x128_default,1379.79,856.01,0.0
256,2048,2304,16384,torch.float8_e4m3fn,ck,149,0,93.6926,a8w8_bpreshuffle_256x128x192x256_16x16_16x16_16x16x1_16x16x1_1x32x1x8_8x8x1_2x1_intrawave_v3,1650.28,861.76,0.0
256,2048,2560,8192,torch.float8_e4m3fn,cktile,99,0,57.9949,a8w8_bpreshuffle_cktile_0x0x8x4x1x0x0x0x0x1_96x128x256_1x4x1_16x16x128_default,1481.15,831.7,0.0
256,2048,3072,1536,torch.float8_e4m3fn,flydsl,837,0,16.6621,flydsl_bpreshuflle_128x192x128_F8_F8_B16_2x0x1x2_default,1159.96,1227.17,0.0
256,2048,4608,16384,torch.float8_e4m3fn,cktile,233,0,144.6114,a8w8_bpreshuffle_cktile_0x0x8x4x1x0x0x0x0x4_224x192x128_1x4x1_16x16x128_default,2138.4,884.62,0.0
256,2048,5120,640,torch.float8_e4m3fn,flydsl,155,0,15.4892,flydsl_bpreshuflle_128x128x128_F8_F8_B16_2x0x1x0_default,866.52,1650.12,0.0
256,2048,5120,1280,torch.float8_e4m3fn,flydsl,836,0,22.438,flydsl_bpreshuflle_128x128x256_F8_F8_B16_2x0x1x2_default,1196.34,1343.55,0.0
256,2048,5120,3200,torch.float8_e4m3fn,ck,143,0,43.9099,a8w8_bpreshuffle_256x192x128x128_16x16_16x16_8x32x1_8x32x1_1x16x1x16_8x8x1_1x2_intrawave_v3,1528.33,999.98,0.0
256,2048,5120,5120,torch.float8_e4m3fn,ck,51,0,63.4389,a8w8_bpreshuffle_256x192x128x128_16x16_16x16_8x32x1_8x32x1_1x32x1x8_8x8x1_2x1_intrawave_v3,1692.56,909.09,0.0
256,2048,5120,6400,torch.float8_e4m3fn,ck,143,0,76.5032,a8w8_bpreshuffle_256x192x128x128_16x16_16x16_8x32x1_8x32x1_1x16x1x16_8x8x1_1x2_intrawave_v3,1754.41,873.78,0.0
256,2048,5120,25600,torch.float8_e4m3fn,cktile,154,0,245.3491,a8w8_bpreshuffle_cktile_0x0x8x4x1x0x0x0x0x3_256x256x128_1x4x1_16x16x128_default,2188.19,833.39,0.0
256,2048,6400,5120,torch.float8_e4m3fn,flydsl,847,0,79.8223,flydsl_bpreshuflle_256x128x128_F8_F8_B16_2x0x1x2_default,1681.46,870.29,0.0
256,2048,7168,256,torch.float8_e4m3fn,flydsl,955,0,12.9791,flydsl_bpreshuflle_128x256x128_F8_F8_B16_1x1x1x2_default,579.1,2443.88,0.0
256,2048,7168,2048,torch.float8_e4m3fn,flydsl,1009,0,39.5332,flydsl_bpreshuflle_128x256x128_F8_F8_B16_2x1x1x2_default,1520.99,1220.1,0.0
256,2048,7168,8192,torch.float8_e4m3fn,cktile,154,0,113.8801,a8w8_bpreshuffle_cktile_0x0x8x4x1x0x0x0x0x3_256x256x128_1x4x1_16x16x128_default,2112.03,920.77,0.0
256,2048,8192,1024,torch.float8_e4m3fn,flydsl,190,0,24.2745,flydsl_bpreshuflle_128x256x128_F8_F8_B16_1x1x0x0_default,1415.47,1814.26,0.0
256,2048,8192,2048,torch.float8_e4m3fn,flydsl,1009,0,41.4214,flydsl_bpreshuflle_128x256x128_F8_F8_B16_2x1x1x2_default,1659.03,1316.37,0.0
256,2048,8192,3584,torch.float8_e4m3fn,flydsl,1295,0,65.894,flydsl_bpreshuflle_128x256x128_F8_F8_B16_1x1x1x3_default,1825.04,1066.18,0.0
256,2048,8192,7168,torch.float8_e4m3fn,cktile,10,0,111.2588,a8w8_bpreshuffle_cktile_0x0x8x4x1x0x0x0x0x1_256x256x128_1x4x1_16x16x128_default,2161.79,961.31,0.0
256,2048,8192,8192,torch.float8_e4m3fn,ck,33,0,121.0787,a8w8_bpreshuffle_256x256x256x128_16x16_16x16_8x32x1_8x32x1_1x32x1x8_8x8x1_2x1_intrawave_v3,2270.24,969.95,0.0
256,2048,8192,28672,torch.float8_e4m3fn,cktile,154,0,327.7204,a8w8_bpreshuffle_cktile_0x0x8x4x1x0x0x0x0x3_256x256x128_1x4x1_16x16x128_default,2935.65,998.28,0.0
256,2048,9216,16384,torch.float8_e4m3fn,cktile,27,0,267.0864,a8w8_bpreshuffle_cktile_0x0x8x4x1x0x0x0x0x1_128x192x128_1x4x1_16x16x128_default,2315.64,832.31,0.0
256,2048,10240,8192,torch.float8_e4m3fn,flydsl,156,0,167.381,flydsl_bpreshuflle_128x128x256_F8_F8_B16_2x0x1x0_default,2052.79,851.99,0.0
256,2048,12800,5120,torch.float8_e4m3fn,ck,143,0,145.3128,a8w8_bpreshuffle_256x192x128x128_16x16_16x16_8x32x1_8x32x1_1x16x1x16_8x8x1_1x2_intrawave_v3,1847.29,883.96,0.0
256,2048,13312,16384,torch.float8_e4m3fn,cktile,155,0,363.771,a8w8_bpreshuffle_cktile_0x0x8x4x1x0x0x0x0x4_256x256x128_1x4x1_16x16x128_default,2455.81,841.69,0.0
256,2048,14336,8192,torch.float8_e4m3fn,ck,33,0,217.5644,a8w8_bpreshuffle_256x256x256x128_16x16_16x16_8x32x1_8x32x1_1x32x1x8_8x8x1_2x1_intrawave_v3,2211.01,886.81,0.0
256,2048,16384,2048,torch.float8_e4m3fn,flydsl,1295,0,80.4818,flydsl_bpreshuflle_128x256x128_F8_F8_B16_1x1x1x3_default,1707.7,1302.87,0.0
256,2048,16384,4096,torch.float8_e4m3fn,flydsl,1009,0,136.18,flydsl_bpreshuflle_128x256x128_F8_F8_B16_2x1x1x2_default,2018.49,1047.19,0.0
256,2048,16384,6656,torch.float8_e4m3fn,ck,33,0,196.0166,a8w8_bpreshuffle_256x256x256x128_16x16_16x16_8x32x1_8x32x1_1x32x1x8_8x8x1_2x1_intrawave_v3,2278.77,968.25,0.0
256,2048,16384,8192,torch.float8_e4m3fn,cktile,154,0,236.0033,a8w8_bpreshuffle_cktile_0x0x8x4x1x0x0x0x0x3_256x256x128_1x4x1_16x16x128_default,2329.44,924.16,0.0
256,2048,16384,13312,torch.float8_e4m3fn,cktile,154,0,343.0127,a8w8_bpreshuffle_cktile_0x0x8x4x1x0x0x0x0x3_256x256x128_1x4x1_16x16x128_default,2604.43,910.97,0.0
256,2048,16384,26624,torch.float8_e4m3fn,cktile,10,0,604.3339,a8w8_bpreshuffle_cktile_0x0x8x4x1x0x0x0x0x1_256x256x128_1x4x1_16x16x128_default,2956.49,923.07,0.0
256,2048,26624,16384,torch.float8_e4m3fn,flydsl,847,0,735.9744,flydsl_bpreshuflle_256x128x128_F8_F8_B16_2x0x1x2_default,2427.67,786.46,0.0
256,2048,51200,5120,torch.float8_e4m3fn,flydsl,847,0,483.778,flydsl_bpreshuflle_256x128x128_F8_F8_B16_2x0x1x2_default,2219.49,997.04,0.0
256,2048,53248,16384,torch.float8_e4m3fn,cktile,155,0,1329.6218,a8w8_bpreshuffle_cktile_0x0x8x4x1x0x0x0x0x4_256x256x128_1x4x1_16x16x128_default,2687.54,845.41,0.0
256,2048,57344,8192,torch.float8_e4m3fn,ck,33,0,765.8954,a8w8_bpreshuffle_256x256x256x128_16x16_16x16_8x32x1_8x32x1_1x32x1x8_8x8x1_2x1_intrawave_v3,2512.28,941.93,0.0
256,4096,800,5120,torch.float8_e4m3fn,ck,69,0,42.9959,a8w8_bpreshuffle_256x128x160x128_16x16_16x16_8x32x1_8x32x1_1x64x1x4_8x8x1_2x1_intrawave_v3,780.41,735.45,0.0
256,4096,1280,8192,torch.float8_e4m3fn,cktile,99,0,57.8302,a8w8_bpreshuffle_cktile_0x0x8x4x1x0x0x0x0x1_96x128x256_1x4x1_16x16x128_default,1485.37,942.86,0.0
256,4096,2304,16384,torch.float8_e4m3fn,cktile,89,0,142.8354,a8w8_bpreshuffle_cktile_0x0x8x4x1x0x0x0x0x1_224x192x128_1x4x1_16x16x128_default,2164.99,866.26,0.0
256,4096,2560,8192,torch.float8_e4m3fn,ck,51,0,89.5715,a8w8_bpreshuffle_256x192x128x128_16x16_16x16_8x32x1_8x32x1_1x32x1x8_8x8x1_2x1_intrawave_v3,1918.01,842.87,0.0
256,4096,4608,16384,torch.float8_e4m3fn,flydsl,157,0,260.4337,flydsl_bpreshuflle_128x192x128_F8_F8_B16_2x0x1x0_default,2374.79,692.52,0.0
256,4096,5120,640,torch.float8_e4m3fn,flydsl,580,0,25.2018,flydsl_bpreshuflle_128x128x128_F8_F8_B16_2x1x0x1_default,1065.14,1898.33,0.0
256,4096,5120,1280,torch.float8_e4m3fn,flydsl,836,0,38.399,flydsl_bpreshuflle_128x128x256_F8_F8_B16_2x0x1x2_default,1398.14,1399.5,0.0
256,4096,5120,3200,torch.float8_e4m3fn,flydsl,835,0,75.7989,flydsl_bpreshuflle_128x128x128_F8_F8_B16_2x0x1x2_default,1770.71,942.42,0.0
256,4096,5120,5120,torch.float8_e4m3fn,flydsl,836,0,111.3413,flydsl_bpreshuflle_128x128x256_F8_F8_B16_2x0x1x2_default,1928.74,800.5,0.0
256,4096,5120,6400,torch.float8_e4m3fn,flydsl,496,0,132.8956,flydsl_bpreshuflle_128x128x256_F8_F8_B16_2x0x1x1_default,2019.9,759.43,0.0
256,4096,5120,25600,torch.float8_e4m3fn,cktile,130,0,450.9053,a8w8_bpreshuffle_cktile_0x0x8x4x1x0x0x0x0x2_224x128x128_1x4x1_16x16x128_default,2381.3,616.25,0.0
256,4096,6400,5120,torch.float8_e4m3fn,flydsl,1005,0,143.867,flydsl_bpreshuflle_128x128x128_F8_F8_B16_2x1x1x2_default,1865.86,737.96,0.0
256,4096,7168,256,torch.float8_e4m3fn,flydsl,1346,0,21.8953,flydsl_bpreshuflle_128x128x256_F8_F8_B16_2x1x1x3_default,686.56,2813.56,0.0
256,4096,7168,2048,torch.float8_e4m3fn,flydsl,1009,0,71.3942,flydsl_bpreshuflle_128x256x128_F8_F8_B16_2x1x1x2_default,1684.44,1145.6,0.0
256,4096,7168,8192,torch.float8_e4m3fn,flydsl,847,0,212.9994,flydsl_bpreshuflle_256x128x128_F8_F8_B16_2x0x1x2_default,2258.39,708.9,0.0
256,4096,8192,1024,torch.float8_e4m3fn,flydsl,955,0,47.3711,flydsl_bpreshuflle_128x256x128_F8_F8_B16_1x1x1x2_default,1450.66,1682.29,0.0
256,4096,8192,2048,torch.float8_e4m3fn,flydsl,1009,0,76.7402,flydsl_bpreshuflle_128x256x128_F8_F8_B16_2x1x1x2_default,1790.96,1202.43,0.0
256,4096,8192,3584,torch.float8_e4m3fn,flydsl,847,0,117.1681,flydsl_bpreshuflle_256x128x128_F8_F8_B16_2x0x1x2_default,2052.76,948.63,0.0
256,4096,8192,7168,torch.float8_e4m3fn,flydsl,847,0,206.7151,flydsl_bpreshuflle_256x128x128_F8_F8_B16_2x0x1x2_default,2327.05,750.74,0.0
256,4096,8192,8192,torch.float8_e4m3fn,flydsl,1009,0,227.2283,flydsl_bpreshuflle_128x256x128_F8_F8_B16_2x1x1x2_default,2419.4,738.34,0.0
256,4096,8192,28672,torch.float8_e4m3fn,cktile,10,0,665.0066,a8w8_bpreshuffle_cktile_0x0x8x4x1x0x0x0x0x1_256x256x128_1x4x1_16x16x128_default,2893.42,630.72,0.0
256,4096,9216,16384,torch.float8_e4m3fn,cktile,90,0,467.9332,a8w8_bpreshuffle_cktile_0x0x8x4x1x0x0x0x0x1_256x192x128_1x4x1_16x16x128_default,2643.43,627.44,0.0
256,4096,10240,8192,torch.float8_e4m3fn,flydsl,847,0,280.8477,flydsl_bpreshuflle_256x128x128_F8_F8_B16_2x0x1x2_default,2446.86,716.85,0.0
256,4096,12800,5120,torch.float8_e4m3fn,flydsl,847,0,244.9403,flydsl_bpreshuflle_256x128x128_F8_F8_B16_2x0x1x2_default,2191.84,781.27,0.0
256,4096,13312,16384,torch.float8_e4m3fn,flydsl,847,0,699.9449,flydsl_bpreshuflle_256x128x128_F8_F8_B16_2x0x1x2_default,2552.64,563.28,0.0
256,4096,14336,8192,torch.float8_e4m3fn,flydsl,1009,0,384.2601,flydsl_bpreshuflle_128x256x128_F8_F8_B16_2x1x1x2_default,2503.7,698.58,0.0
256,4096,16384,2048,torch.float8_e4m3fn,flydsl,615,0,147.7867,flydsl_bpreshuflle_128x256x128_F8_F8_B16_1x1x1x1_default,1859.96,1191.99,0.0
256,4096,16384,4096,torch.float8_e4m3fn,flydsl,1009,0,244.9901,flydsl_bpreshuflle_128x256x128_F8_F8_B16_2x1x1x2_default,2243.99,890.26,0.0
256,4096,16384,6656,torch.float8_e4m3fn,flydsl,847,0,372.5503,flydsl_bpreshuflle_256x128x128_F8_F8_B16_2x0x1x2_default,2397.94,726.16,0.0
256,4096,16384,8192,torch.float8_e4m3fn,flydsl,1009,0,433.8226,flydsl_bpreshuflle_128x256x128_F8_F8_B16_2x1x1x2_default,2534.47,696.11,0.0
256,4096,16384,13312,torch.float8_e4m3fn,cktile,154,0,671.8771,a8w8_bpreshuffle_cktile_0x0x8x4x1x0x0x0x0x3_256x256x128_1x4x1_16x16x128_default,2659.28,605.54,0.0
256,4096,16384,26624,torch.float8_e4m3fn,cktile,10,0,1191.5262,a8w8_bpreshuffle_cktile_0x0x8x4x1x0x0x0x0x1_256x256x128_1x4x1_16x16x128_default,2999.02,570.26,0.0
256,4096,26624,16384,torch.float8_e4m3fn,cktile,10,0,1322.1533,a8w8_bpreshuffle_cktile_0x0x8x4x1x0x0x0x0x1_256x256x128_1x4x1_16x16x128_default,2702.72,545.64,0.0
256,4096,51200,5120,torch.float8_e4m3fn,flydsl,847,0,889.3275,flydsl_bpreshuflle_256x128x128_F8_F8_B16_2x0x1x2_default,2414.73,789.97,0.0
256,4096,53248,16384,torch.float8_e4m3fn,cktile,154,0,2515.303,a8w8_bpreshuffle_cktile_0x0x8x4x1x0x0x0x0x3_256x256x128_1x4x1_16x16x128_default,2841.34,546.94,0.0
256,4096,57344,8192,torch.float8_e4m3fn,flydsl,847,0,1475.165,flydsl_bpreshuflle_256x128x128_F8_F8_B16_2x0x1x2_default,2608.72,659.64,0.0
256,8192,800,5120,torch.float8_e4m3fn,ck,69,0,56.7929,a8w8_bpreshuffle_256x128x160x128_16x16_16x16_8x32x1_8x32x1_1x64x1x4_8x8x1_2x1_intrawave_v3,1181.64,1041.44,0.0
256,8192,1280,8192,torch.float8_e4m3fn,cktile,129,0,94.6099,a8w8_bpreshuffle_cktile_0x0x8x4x1x0x0x0x0x2_192x128x128_1x4x1_16x16x128_default,1815.86,1041.82,0.0
256,8192,2112,7168,torch.float8_e4m3fn,flydsl,1007,0,120.9632,flydsl_bpreshuflle_128x192x128_F8_F8_B16_2x1x1x2_default,2050.49,896.65,0.0
256,8192,2304,16384,torch.float8_e4m3fn,cktile,55,0,260.4806,a8w8_bpreshuffle_cktile_0x0x8x4x1x0x0x0x0x2_128x192x128_1x4x1_16x16x128_default,2374.36,805.11,0.0
256,8192,2560,8192,torch.float8_e4m3fn,flydsl,1176,0,163.2695,flydsl_bpreshuflle_128x128x256_F8_F8_B16_2x0x1x3_default,2104.48,796.37,0.0
256,8192,3072,1536,torch.float8_e4m3fn,flydsl,1687,0,49.0249,flydsl_bpreshuflle_128x192x128_F8_F8_B16_2x1x1x4_default,1576.94,1379.57,0.0
256,8192,4608,16384,torch.float8_e4m3fn,cktile,121,0,464.8772,a8w8_bpreshuffle_cktile_0x0x8x4x1x0x0x0x0x2_160x192x128_1x4x1_16x16x128_default,2660.81,613.52,0.0
256,8192,5120,640,torch.float8_e4m3fn,flydsl,924,0,45.1099,flydsl_bpreshuflle_128x256x128_F8_F8_B16_2x1x0x2_default,1190.14,2048.46,0.0
256,8192,5120,1280,torch.float8_e4m3fn,flydsl,156,0,70.9138,flydsl_bpreshuflle_128x128x256_F8_F8_B16_2x0x1x0_default,1514.15,1423.21,0.0
256,8192,5120,3200,torch.float8_e4m3fn,flydsl,1009,0,128.9597,flydsl_bpreshuflle_128x256x128_F8_F8_B16_2x1x1x2_default,2081.55,980.81,0.0
256,8192,5120,5120,torch.float8_e4m3fn,flydsl,847,0,193.4785,flydsl_bpreshuflle_256x128x128_F8_F8_B16_2x0x1x2_default,2219.87,785.84,0.0
256,8192,5120,6400,torch.float8_e4m3fn,flydsl,847,0,228.4524,flydsl_bpreshuflle_256x128x128_F8_F8_B16_2x0x1x2_default,2350.03,740.12,0.0
256,8192,5120,25600,torch.float8_e4m3fn,cktile,10,0,818.501,a8w8_bpreshuffle_cktile_0x0x8x4x1x0x0x0x0x1_256x256x128_1x4x1_16x16x128_default,2623.68,518.84,0.0
256,8192,6400,5120,torch.float8_e4m3fn,flydsl,847,0,246.449,flydsl_bpreshuflle_256x128x128_F8_F8_B16_2x0x1x2_default,2178.43,728.62,0.0
256,8192,7168,256,torch.float8_e4m3fn,flydsl,1294,0,40.2728,flydsl_bpreshuflle_128x128x256_F8_F8_B16_1x1x1x3_default,746.53,3013.76,0.0
256,8192,7168,2048,torch.float8_e4m3fn,flydsl,754,0,131.2694,flydsl_bpreshuflle_128x256x128_F8_F8_B16_2x0x0x2_default,1832.25,1134.29,0.0
256,8192,7168,8192,torch.float8_e4m3fn,flydsl,847,0,383.1587,flydsl_bpreshuflle_256x128x128_F8_F8_B16_2x0x1x2_default,2510.9,634.91,0.0
256,8192,8192,1024,torch.float8_e4m3fn,flydsl,1635,0,94.7658,flydsl_bpreshuflle_128x256x128_F8_F8_B16_1x1x1x4_default,1450.3,1593.35,0.0
256,8192,8192,2048,torch.float8_e4m3fn,flydsl,1009,0,146.7191,flydsl_bpreshuflle_128x256x128_F8_F8_B16_2x1x1x2_default,1873.5,1143.49,0.0
256,8192,8192,3584,torch.float8_e4m3fn,flydsl,847,0,217.8314,flydsl_bpreshuflle_256x128x128_F8_F8_B16_2x0x1x2_default,2208.3,885.72,0.0
256,8192,8192,7168,torch.float8_e4m3fn,flydsl,847,0,391.6761,flydsl_bpreshuflle_256x128x128_F8_F8_B16_2x0x1x2_default,2456.3,642.52,0.0
256,8192,8192,28672,torch.float8_e4m3fn,cktile,154,0,1314.8678,a8w8_bpreshuffle_cktile_0x0x8x4x1x0x0x0x0x3_256x256x128_1x4x1_16x16x128_default,2926.75,459.35,0.0
256,8192,9216,16384,torch.float8_e4m3fn,flydsl,847,0,917.7027,flydsl_bpreshuflle_256x128x128_F8_F8_B16_2x0x1x2_default,2695.75,475.33,0.0
256,8192,10240,8192,torch.float8_e4m3fn,flydsl,847,0,535.5048,flydsl_bpreshuflle_256x128x128_F8_F8_B16_2x0x1x2_default,2566.53,595.26,0.0
256,8192,12800,5120,torch.float8_e4m3fn,flydsl,847,0,447.408,flydsl_bpreshuflle_256x128x128_F8_F8_B16_2x0x1x2_default,2399.92,708.96,0.0
256,8192,13312,16384,torch.float8_e4m3fn,flydsl,847,0,1308.9652,flydsl_bpreshuflle_256x128x128_F8_F8_B16_2x0x1x2_default,2729.95,435.78,0.0
256,8192,14336,8192,torch.float8_e4m3fn,flydsl,1009,0,735.1217,flydsl_bpreshuflle_128x256x128_F8_F8_B16_2x1x1x2_default,2617.45,570.56,0.0
256,8192,16384,2048,torch.float8_e4m3fn,flydsl,1009,0,290.7567,flydsl_bpreshuflle_128x256x128_F8_F8_B16_2x1x1x2_default,1890.78,1096.34,0.0
256,8192,16384,4096,torch.float8_e4m3fn,flydsl,847,0,461.4074,flydsl_bpreshuflle_256x128x128_F8_F8_B16_2x0x1x2_default,2382.95,799.94,0.0
256,8192,16384,6656,torch.float8_e4m3fn,flydsl,847,0,727.1951,flydsl_bpreshuflle_256x128x128_F8_F8_B16_2x0x1x2_default,2456.98,594.08,0.0
256,8192,16384,8192,torch.float8_e4m3fn,flydsl,847,0,852.5388,flydsl_bpreshuflle_256x128x128_F8_F8_B16_2x0x1x2_default,2579.38,551.02,0.0
256,8192,16384,13312,torch.float8_e4m3fn,ck,33,0,1329.3571,a8w8_bpreshuffle_256x256x256x128_16x16_16x16_8x32x1_8x32x1_1x32x1x8_8x8x1_2x1_intrawave_v3,2688.08,448.03,0.0
256,8192,16384,26624,torch.float8_e4m3fn,cktile,10,0,2437.4822,a8w8_bpreshuffle_cktile_0x0x8x4x1x0x0x0x0x1_256x256x128_1x4x1_16x16x128_default,2932.05,378.57,0.0
256,8192,26624,16384,torch.float8_e4m3fn,cktile,155,0,2515.6753,a8w8_bpreshuffle_cktile_0x0x8x4x1x0x0x0x0x4_256x256x128_1x4x1_16x16x128_default,2840.92,400.14,0.0
256,8192,51200,5120,torch.float8_e4m3fn,flydsl,847,0,1712.0951,flydsl_bpreshuflle_256x128x128_F8_F8_B16_2x0x1x2_default,2508.6,667.57,0.0
256,8192,53248,16384,torch.float8_e4m3fn,cktile,154,0,4998.3795,a8w8_bpreshuffle_cktile_0x0x8x4x1x0x0x0x0x3_256x256x128_1x4x1_16x16x128_default,2859.66,375.93,0.0
256,8192,57344,8192,torch.float8_e4m3fn,flydsl,847,0,2871.9606,flydsl_bpreshuflle_256x128x128_F8_F8_B16_2x0x1x2_default,2679.9,514.07,0.0
256,16384,800,5120,torch.float8_e4m3fn,ck,69,0,96.9433,a8w8_bpreshuffle_256x128x160x128_16x16_16x16_8x32x1_8x32x1_1x64x1x4_8x8x1_2x1_intrawave_v3,1384.5,1177.97,0.0
256,16384,1280,8192,torch.float8_e4m3fn,ck,154,0,167.8529,a8w8_bpreshuffle_256x128x256x256_16x16_16x16_16x16x1_16x16x1_1x16x1x16_8x8x1_1x2_intrawave_v3,2047.01,1111.96,0.0
256,16384,2304,16384,torch.float8_e4m3fn,cktile,234,0,470.1625,a8w8_bpreshuffle_cktile_0x0x8x4x1x0x0x0x0x3_256x192x128_1x4x1_16x16x128_default,2630.9,811.81,0.0
256,16384,2560,8192,torch.float8_e4m3fn,flydsl,847,0,284.5169,flydsl_bpreshuflle_256x128x128_F8_F8_B16_2x0x1x2_default,2415.3,840.29,0.0
256,16384,4608,16384,torch.float8_e4m3fn,cktile,90,0,929.0821,a8w8_bpreshuffle_cktile_0x0x8x4x1x0x0x0x0x1_256x192x128_1x4x1_16x16x128_default,2662.74,532.71,0.0
256,16384,5120,640,torch.float8_e4m3fn,flydsl,754,0,83.7099,flydsl_bpreshuflle_128x256x128_F8_F8_B16_2x0x0x2_default,1282.69,2168.62,0.0
256,16384,5120,1280,torch.float8_e4m3fn,flydsl,785,0,129.6292,flydsl_bpreshuflle_128x256x128_F8_F8_B16_1x0x1x2_default,1656.64,1506.58,0.0
256,16384,5120,3200,torch.float8_e4m3fn,flydsl,1009,0,238.3485,flydsl_bpreshuflle_128x256x128_F8_F8_B16_2x1x1x2_default,2252.46,992.6,0.0
256,16384,5120,5120,torch.float8_e4m3fn,flydsl,847,0,364.9751,flydsl_bpreshuflle_256x128x128_F8_F8_B16_2x0x1x2_default,2353.57,761.35,0.0
256,16384,5120,6400,torch.float8_e4m3fn,ck,33,0,444.0837,a8w8_bpreshuffle_256x256x256x128_16x16_16x16_8x32x1_8x32x1_1x32x1x8_8x8x1_2x1_intrawave_v3,2417.88,687.7,0.0
256,16384,5120,25600,torch.float8_e4m3fn,cktile,155,0,1481.9429,a8w8_bpreshuffle_cktile_0x0x8x4x1x0x0x0x0x4_256x256x128_1x4x1_16x16x128_default,2898.2,484.68,0.0
256,16384,6400,5120,torch.float8_e4m3fn,flydsl,847,0,465.5398,flydsl_bpreshuflle_256x128x128_F8_F8_B16_2x0x1x2_default,2306.44,701.06,0.0
256,16384,7168,256,torch.float8_e4m3fn,flydsl,1261,0,73.9327,flydsl_bpreshuflle_128x128x256_F8_F8_B16_2x1x0x3_default,813.3,3258.51,0.0
256,16384,7168,2048,torch.float8_e4m3fn,flydsl,1635,0,246.5642,flydsl_bpreshuflle_128x256x128_F8_F8_B16_1x1x1x4_default,1950.96,1148.24,0.0
256,16384,7168,8192,torch.float8_e4m3fn,flydsl,1009,0,746.3752,flydsl_bpreshuflle_128x256x128_F8_F8_B16_2x1x1x2_default,2577.99,573.2,0.0
256,16384,8192,1024,torch.float8_e4m3fn,flydsl,955,0,182.8411,flydsl_bpreshuflle_128x256x128_F8_F8_B16_1x1x1x2_default,1503.37,1605.77,0.0
256,16384,8192,2048,torch.float8_e4m3fn,flydsl,275,0,284.2726,flydsl_bpreshuflle_128x256x128_F8_F8_B16_1x1x1x0_default,1933.9,1121.34,0.0
256,16384,8192,3584,torch.float8_e4m3fn,flydsl,847,0,425.8097,flydsl_bpreshuflle_256x128x128_F8_F8_B16_2x0x1x2_default,2259.4,837.27,0.0
256,16384,8192,7168,torch.float8_e4m3fn,ck,33,0,775.0547,a8w8_bpreshuffle_256x256x256x128_16x16_16x16_8x32x1_8x32x1_1x32x1x8_8x8x1_2x1_intrawave_v3,2482.59,573.63,0.0
256,16384,8192,8192,torch.float8_e4m3fn,ck,33,0,858.6845,a8w8_bpreshuffle_256x256x256x128_16x16_16x16_8x32x1_8x32x1_1x32x1x8_8x8x1_2x1_intrawave_v3,2560.92,547.07,0.0
256,16384,8192,28672,torch.float8_e4m3fn,cktile,10,0,2594.4299,a8w8_bpreshuffle_cktile_0x0x8x4x1x0x0x0x0x1_256x256x128_1x4x1_16x16x128_default,2966.58,375.06,0.0
256,16384,9216,16384,torch.float8_e4m3fn,cktile,10,0,1751.5815,a8w8_bpreshuffle_cktile_0x0x8x4x1x0x0x0x0x1_256x256x128_1x4x1_16x16x128_default,2824.76,411.87,0.0
256,16384,10240,8192,torch.float8_e4m3fn,flydsl,1009,0,1054.5886,flydsl_bpreshuflle_128x256x128_F8_F8_B16_2x1x1x2_default,2606.49,524.99,0.0
256,16384,12800,5120,torch.float8_e4m3fn,flydsl,847,0,879.8002,flydsl_bpreshuflle_256x128x128_F8_F8_B16_2x0x1x2_default,2440.88,646.57,0.0
256,16384,13312,16384,torch.float8_e4m3fn,cktile,10,0,2501.3018,a8w8_bpreshuffle_cktile_0x0x8x4x1x0x0x0x0x1_256x256x128_1x4x1_16x16x128_default,2857.24,368.91,0.0
256,16384,14336,8192,torch.float8_e4m3fn,flydsl,847,0,1497.1723,flydsl_bpreshuflle_256x128x128_F8_F8_B16_2x0x1x2_default,2570.37,481.86,0.0
256,16384,16384,2048,torch.float8_e4m3fn,ck,141,0,570.8764,a8w8_bpreshuffle_256x160x128x128_16x16_16x16_8x32x1_8x32x1_1x16x1x16_8x8x1_1x2_intrawave_v3,1926.01,1057.99,0.0
256,16384,16384,4096,torch.float8_e4m3fn,flydsl,1009,0,939.8102,flydsl_bpreshuflle_128x256x128_F8_F8_B16_2x1x1x2_default,2339.86,714.07,0.0
256,16384,16384,6656,torch.float8_e4m3fn,flydsl,847,0,1413.0626,flydsl_bpreshuflle_256x128x128_F8_F8_B16_2x0x1x2_default,2528.84,534.28,0.0
256,16384,16384,8192,torch.float8_e4m3fn,flydsl,1009,0,1678.8926,flydsl_bpreshuflle_128x256x128_F8_F8_B16_2x1x1x2_default,2619.61,479.67,0.0
256,16384,16384,13312,torch.float8_e4m3fn,cktile,10,0,2585.8762,a8w8_bpreshuffle_cktile_0x0x8x4x1x0x0x0x0x1_256x256x128_1x4x1_16x16x128_default,2763.79,376.31,0.0
256,16384,16384,26624,torch.float8_e4m3fn,cktile,10,0,4905.4826,a8w8_bpreshuffle_cktile_0x0x8x4x1x0x0x0x0x1_256x256x128_1x4x1_16x16x128_default,2913.81,287.29,0.0
256,16384,26624,16384,torch.float8_e4m3fn,cktile,10,0,5001.224,a8w8_bpreshuffle_cktile_0x0x8x4x1x0x0x0x0x1_256x256x128_1x4x1_16x16x128_default,2858.03,315.33,0.0
256,16384,51200,5120,torch.float8_e4m3fn,flydsl,847,0,3457.1487,flydsl_bpreshuflle_256x128x128_F8_F8_B16_2x0x1x2_default,2484.69,585.38,0.0
256,16384,53248,16384,torch.float8_e4m3fn,cktile,155,0,9998.6325,a8w8_bpreshuffle_cktile_0x0x8x4x1x0x0x0x0x4_256x256x128_1x4x1_16x16x128_default,2859.12,288.61,0.0
256,16384,57344,8192,torch.float8_e4m3fn,flydsl,1009,0,5804.2903,flydsl_bpreshuflle_128x256x128_F8_F8_B16_2x1x1x2_default,2652.03,427.79,0.0
256,32768,800,5120,torch.float8_e4m3fn,ck,57,0,171.234,a8w8_bpreshuffle_256x160x160x128_16x16_16x16_8x32x1_8x32x1_1x32x1x8_4x4x1_1x1_intrawave_v3,1567.65,1309.89,0.0
256,32768,1280,8192,torch.float8_e4m3fn,ck,154,0,294.8131,a8w8_bpreshuffle_256x128x256x256_16x16_16x16_16x16x1_16x16x1_1x16x1x16_8x8x1_1x2_intrawave_v3,2330.95,1230.63,0.0
256,32768,2304,16384,torch.float8_e4m3fn,cktile,90,0,939.4282,a8w8_bpreshuffle_cktile_0x0x8x4x1x0x0x0x0x1_256x192x128_1x4x1_16x16x128_default,2633.41,772.4,0.0
256,32768,2560,8192,torch.float8_e4m3fn,ck,33,0,553.7958,a8w8_bpreshuffle_256x256x256x128_16x16_16x16_8x32x1_8x32x1_1x32x1x8_8x8x1_2x1_intrawave_v3,2481.76,825.54,0.0
256,32768,4608,16384,torch.float8_e4m3fn,cktile,154,0,1766.5887,a8w8_bpreshuffle_cktile_0x0x8x4x1x0x0x0x0x3_256x256x128_1x4x1_16x16x128_default,2800.77,517.58,0.0
256,32768,5120,640,torch.float8_e4m3fn,flydsl,932,0,163.9443,flydsl_bpreshuflle_256x128x128_F8_F8_B16_2x1x0x2_default,1309.89,2194.6,0.0
256,32768,5120,1280,torch.float8_e4m3fn,flydsl,20,0,261.1502,flydsl_bpreshuflle_128x256x128_F8_F8_B16_1x0x0x0_default,1644.63,1470.58,0.0
256,32768,5120,3200,torch.float8_e4m3fn,flydsl,1009,0,486.2706,flydsl_bpreshuflle_128x256x128_F8_F8_B16_2x1x1x2_default,2208.12,939.37,0.0
256,32768,5120,5120,torch.float8_e4m3fn,ck,33,0,742.2505,a8w8_bpreshuffle_256x256x256x128_16x16_16x16_8x32x1_8x32x1_1x32x1x8_8x8x1_2x1_intrawave_v3,2314.56,713.41,0.0
256,32768,5120,6400,torch.float8_e4m3fn,ck,33,0,878.5708,a8w8_bpreshuffle_256x256x256x128_16x16_16x16_8x32x1_8x32x1_1x32x1x8_8x8x1_2x1_intrawave_v3,2444.29,657.92,0.0
256,32768,5120,25600,torch.float8_e4m3fn,cktile,155,0,2977.7045,a8w8_bpreshuffle_cktile_0x0x8x4x1x0x0x0x0x4_256x256x128_1x4x1_16x16x128_default,2884.75,438.42,0.0
256,32768,6400,5120,torch.float8_e4m3fn,flydsl,847,0,923.4617,flydsl_bpreshuflle_256x128x128_F8_F8_B16_2x0x1x2_default,2325.47,671.35,0.0
256,32768,7168,8192,torch.float8_e4m3fn,cktile,115,0,1520.7759,a8w8_bpreshuffle_cktile_0x0x8x4x1x0x0x0x0x2_96x256x128_1x4x1_16x16x128_default,2530.48,524.02,0.0
256,32768,8192,1024,torch.float8_e4m3fn,ck,143,0,360.2792,a8w8_bpreshuffle_256x192x128x128_16x16_16x16_8x32x1_8x32x1_1x16x1x16_8x8x1_1x2_intrawave_v3,1525.92,1606.57,0.0
256,32768,8192,2048,torch.float8_e4m3fn,ck,143,0,572.0564,a8w8_bpreshuffle_256x192x128x128_16x16_16x16_8x32x1_8x32x1_1x16x1x16_8x8x1_1x2_intrawave_v3,1922.03,1085.13,0.0
256,32768,8192,3584,torch.float8_e4m3fn,ck,143,0,877.4729,a8w8_bpreshuffle_256x192x128x128_16x16_16x16_8x32x1_8x32x1_1x16x1x16_8x8x1_1x2_intrawave_v3,2192.83,779.14,0.0
256,32768,8192,7168,torch.float8_e4m3fn,ck,33,0,1526.6504,a8w8_bpreshuffle_256x256x256x128_16x16_16x16_8x32x1_8x32x1_1x32x1x8_8x8x1_2x1_intrawave_v3,2520.74,543.98,0.0
256,32768,8192,8192,torch.float8_e4m3fn,ck,33,0,1700.5016,a8w8_bpreshuffle_256x256x256x128_16x16_16x16_8x32x1_8x32x1_1x32x1x8_8x8x1_2x1_intrawave_v3,2586.32,513.03,0.0
256,32768,8192,28672,torch.float8_e4m3fn,cktile,154,0,5180.9722,a8w8_bpreshuffle_cktile_0x0x8x4x1x0x0x0x0x3_256x256x128_1x4x1_16x16x128_default,2971.1,330.3,0.0
256,32768,9216,16384,torch.float8_e4m3fn,cktile,10,0,3498.2101,a8w8_bpreshuffle_cktile_0x0x8x4x1x0x0x0x0x1_256x256x128_1x4x1_16x16x128_default,2828.76,369.29,0.0
256,32768,10240,8192,torch.float8_e4m3fn,cktile,115,0,2159.2831,a8w8_bpreshuffle_cktile_0x0x8x4x1x0x0x0x0x2_96x256x128_1x4x1_16x16x128_default,2546.01,473.96,0.0
256,32768,12800,5120,torch.float8_e4m3fn,cktile,82,0,1810.0897,a8w8_bpreshuffle_cktile_0x0x8x4x1x0x0x0x0x1_96x256x128_1x4x1_16x16x128_default,2372.79,592.33,0.0
256,32768,13312,16384,torch.float8_e4m3fn,cktile,155,0,5018.3857,a8w8_bpreshuffle_cktile_0x0x8x4x1x0x0x0x0x4_256x256x128_1x4x1_16x16x128_default,2848.26,324.29,0.0
256,32768,14336,8192,torch.float8_e4m3fn,cktile,82,0,2969.7628,a8w8_bpreshuffle_cktile_0x0x8x4x1x0x0x0x0x1_96x256x128_1x4x1_16x16x128_default,2591.65,446.3,0.0
256,32768,16384,2048,torch.float8_e4m3fn,ck,143,0,1123.3568,a8w8_bpreshuffle_256x192x128x128_16x16_16x16_8x32x1_8x32x1_1x16x1x16_8x8x1_1x2_intrawave_v3,1957.55,1045.44,0.0
256,32768,16384,4096,torch.float8_e4m3fn,flydsl,1009,0,1913.0391,flydsl_bpreshuflle_128x256x128_F8_F8_B16_2x1x1x2_default,2298.98,666.51,0.0
256,32768,16384,6656,torch.float8_e4m3fn,cktile,82,0,2816.5182,a8w8_bpreshuffle_cktile_0x0x8x4x1x0x0x0x0x1_96x256x128_1x4x1_16x16x128_default,2537.47,497.39,0.0
256,32768,16384,8192,torch.float8_e4m3fn,cktile,115,0,3411.1808,a8w8_bpreshuffle_cktile_0x0x8x4x1x0x0x0x0x2_96x256x128_1x4x1_16x16x128_default,2578.61,432.81,0.0
256,32768,16384,13312,torch.float8_e4m3fn,cktile,155,0,5157.3356,a8w8_bpreshuffle_cktile_0x0x8x4x1x0x0x0x0x4_256x256x128_1x4x1_16x16x128_default,2771.52,335.07,0.0
256,32768,16384,26624,torch.float8_e4m3fn,cktile,155,0,9716.3275,a8w8_bpreshuffle_cktile_0x0x8x4x1x0x0x0x0x4_256x256x128_1x4x1_16x16x128_default,2942.19,245.19,0.0
256,32768,26624,16384,torch.float8_e4m3fn,cktile,10,0,10029.8648,a8w8_bpreshuffle_cktile_0x0x8x4x1x0x0x0x0x1_256x256x128_1x4x1_16x16x128_default,2850.22,270.98,0.0
256,32768,51200,5120,torch.float8_e4m3fn,flydsl,754,0,7424.9519,flydsl_bpreshuflle_128x256x128_F8_F8_B16_2x0x0x2_default,2313.8,509.82,0.0
256,32768,53248,16384,torch.float8_e4m3fn,cktile,154,0,20118.9933,a8w8_bpreshuffle_cktile_0x0x8x4x1x0x0x0x0x3_256x256x128_1x4x1_16x16x128_default,2841.82,243.5,0.0
256,32768,57344,8192,torch.float8_e4m3fn,cktile,155,0,12167.0949,a8w8_bpreshuffle_cktile_0x0x8x4x1x0x0x0x0x4_256x256x128_1x4x1_16x16x128_default,2530.29,369.55,0.0
304,64,1536,5120,torch.int8,asm,0,1,16.7759,_ZN5aiter41I8gemm_bf16_perTokenI8_BpreShuffle_16x128E,60.0,500.04,0.0
304,64,5120,1280,torch.int8,asm,0,1,7.7424,_ZN5aiter41I8gemm_bf16_perTokenI8_BpreShuffle_16x128E,108.35,941.68,0.0
304,128,1536,5120,torch.int8,asm,0,1,17.9602,_ZN5aiter41I8gemm_bf16_perTokenI8_BpreShuffle_16x128E,112.1,496.26,0.0
304,128,5120,1280,torch.int8,asm,1,1,8.5797,_ZN5aiter41I8gemm_bf16_perTokenI8_BpreShuffle_32x128E,195.55,935.72,0.0
304,256,1536,5120,torch.int8,asm,0,1,17.6791,_ZN5aiter41I8gemm_bf16_perTokenI8_BpreShuffle_16x128E,227.76,563.46,0.0
304,256,5120,1280,torch.int8,asm,2,1,9.2104,_ZN5aiter41I8gemm_bf16_perTokenI8_BpreShuffle_48x128E,364.31,1031.74,0.0
304,512,1536,5120,torch.int8,asm,1,1,18.7067,_ZN5aiter41I8gemm_bf16_perTokenI8_BpreShuffle_32x128E,430.49,644.62,0.0
304,512,5120,1280,torch.int8,asm,4,1,11.2508,_ZN5aiter41I8gemm_bf16_perTokenI8_BpreShuffle_80x128E,596.48,1106.75,0.0
304,1024,1536,5120,torch.int8,asm,2,1,21.0125,_ZN5aiter41I8gemm_bf16_perTokenI8_BpreShuffle_48x128E,766.5,773.49,0.0
304,1024,5120,1280,torch.int8,asm,6,1,18.2637,_ZN5aiter42I8gemm_bf16_perTokenI8_BpreShuffle_112x256E,734.89,1004.73,0.0
304,1664,1536,5120,torch.int8,asm,4,1,27.6261,_ZN5aiter41I8gemm_bf16_perTokenI8_BpreShuffle_80x128E,947.38,778.1,0.0
304,1664,5120,1280,torch.int8,asm,6,1,21.5241,_ZN5aiter42I8gemm_bf16_perTokenI8_BpreShuffle_112x256E,1013.3,1195.07,0.0
304,4096,1536,5120,torch.int8,asm,6,1,63.8361,_ZN5aiter42I8gemm_bf16_perTokenI8_BpreShuffle_112x256E,1009.22,648.83,0.0
304,4096,5120,1280,torch.int8,asm,6,1,58.5804,_ZN5aiter42I8gemm_bf16_perTokenI8_BpreShuffle_112x256E,916.47,917.36,0.0
304,8192,1536,5120,torch.int8,asm,6,1,128.8567,_ZN5aiter42I8gemm_bf16_perTokenI8_BpreShuffle_112x256E,999.94,581.83,0.0
304,8192,5120,1280,torch.int8,asm,6,1,105.657,_ZN5aiter42I8gemm_bf16_perTokenI8_BpreShuffle_112x256E,1016.25,955.22,0.0
304,10240,1536,5120,torch.int8,asm,6,1,142.1441,_ZN5aiter42I8gemm_bf16_perTokenI8_BpreShuffle_112x256E,1133.08,645.47,0.0
304,10240,5120,1280,torch.int8,asm,6,1,133.9571,_ZN5aiter42I8gemm_bf16_perTokenI8_BpreShuffle_112x256E,1001.95,929.54,0.0
304,12288,1536,5120,torch.int8,asm,7,1,185.0056,_ZN5aiter42I8gemm_bf16_perTokenI8_BpreShuffle_128x128E,1044.69,586.62,0.0
304,12288,5120,1280,torch.int8,asm,6,1,153.8919,_ZN5aiter42I8gemm_bf16_perTokenI8_BpreShuffle_112x256E,1046.59,962.44,0.0
304,16384,1536,5120,torch.int8,asm,6,1,211.7054,_ZN5aiter42I8gemm_bf16_perTokenI8_BpreShuffle_112x256E,1217.25,671.13,0.0
304,16384,5120,1280,torch.int8,asm,6,1,195.4489,_ZN5aiter42I8gemm_bf16_perTokenI8_BpreShuffle_112x256E,1098.74,999.22,0.0
304,20480,1536,5120,torch.int8,asm,6,1,271.7016,_ZN5aiter42I8gemm_bf16_perTokenI8_BpreShuffle_112x256E,1185.57,646.43,0.0
304,20480,5120,1280,torch.int8,asm,6,1,245.7639,_ZN5aiter42I8gemm_bf16_perTokenI8_BpreShuffle_112x256E,1092.25,986.65,0.0
304,24576,1536,5120,torch.int8,asm,6,1,328.3654,_ZN5aiter42I8gemm_bf16_perTokenI8_BpreShuffle_112x256E,1177.19,637.07,0.0
304,24576,5120,1280,torch.int8,asm,6,1,290.5831,_ZN5aiter42I8gemm_bf16_perTokenI8_BpreShuffle_112x256E,1108.54,996.85,0.0
304,30720,1536,5120,torch.int8,asm,6,1,402.8387,_ZN5aiter42I8gemm_bf16_perTokenI8_BpreShuffle_112x256E,1199.45,644.23,0.0
304,30720,5120,1280,torch.int8,asm,6,1,361.4235,_ZN5aiter42I8gemm_bf16_perTokenI8_BpreShuffle_112x256E,1114.08,997.3,0.0
304,32768,1536,5120,torch.int8,asm,6,1,406.391,_ZN5aiter42I8gemm_bf16_perTokenI8_BpreShuffle_112x256E,1268.23,679.89,0.0
304,32768,5120,1280,torch.int8,asm,6,1,379.1231,_ZN5aiter42I8gemm_bf16_perTokenI8_BpreShuffle_112x256E,1132.87,1012.97,0.0
304,40960,1536,5120,torch.int8,asm,6,1,525.9013,_ZN5aiter42I8gemm_bf16_perTokenI8_BpreShuffle_112x256E,1225.03,652.99,0.0
304,40960,5120,1280,torch.int8,asm,6,1,475.7676,_ZN5aiter42I8gemm_bf16_perTokenI8_BpreShuffle_112x256E,1128.43,1005.56,0.0
256,32,384,7168,torch.float8_e4m3fn,ck,10,0,10.3714,a8w8_bpreshuffle_128x16x32x512_16x16_16x16_32x4x1_32x4x1_1x16x1x8_4x4x1_1x1_intrawave_v1,16.99,289.88,0.0
256,64,384,7168,torch.float8_e4m3fn,ck,8,0,10.1237,a8w8_bpreshuffle_128x32x16x512_16x16_16x16_32x4x1_32x4x1_1x32x1x4_4x4x1_1x1_intrawave_v1,34.8,322.06,0.0
256,96,384,7168,torch.float8_e4m3fn,ck,5,0,10.444,a8w8_bpreshuffle_256x16x64x512_16x16_16x16_32x8x1_32x8x1_1x16x1x16_4x4x1_1x1_intrawave_v1,50.6,336.5,0.0
256,256,384,7168,torch.float8_e4m3fn,ck,10,0,10.0207,a8w8_bpreshuffle_128x16x32x512_16x16_16x16_32x4x1_32x4x1_1x16x1x8_4x4x1_1x1_intrawave_v1,140.64,477.42,0.0
256,512,384,7168,torch.float8_e4m3fn,cktile,137,0,11.6726,a8w8_bpreshuffle_cktile_0x0x8x4x1x0x0x0x0x3_16x64x512_1x4x1_16x16x128_default,241.47,583.91,0.0
256,1024,384,7168,torch.float8_e4m3fn,flydsl,612,0,13.4339,flydsl_bpreshuflle_32x64x512_F8_F8_B16_2x1x1x1_default,419.62,809.82,0.0
256,2048,384,7168,torch.float8_e4m3fn,cktile,9,0,18.6572,a8w8_bpreshuffle_cktile_0x0x8x4x1x0x0x0x0x1_32x64x512_1x4x1_16x16x128_default,604.29,1018.67,0.0
256,4096,384,7168,torch.float8_e4m3fn,flydsl,458,0,26.0265,flydsl_bpreshuflle_64x64x256_F8_F8_B16_2x0x1x1_default,866.37,1354.71,0.0
256,8192,384,7168,torch.float8_e4m3fn,flydsl,794,0,34.9323,flydsl_bpreshuflle_64x192x256_F8_F8_B16_2x0x1x2_default,1290.99,1939.87,0.0
256,16384,384,7168,torch.float8_e4m3fn,ck,149,0,53.8242,a8w8_bpreshuffle_256x128x192x256_16x16_16x16_16x16x1_16x16x1_1x32x1x8_8x8x1_2x1_intrawave_v3,1675.72,2466.84,0.0
256,96,1024,7168,torch.float8_e4m3fn,ck,10,0,10.8967,a8w8_bpreshuffle_128x16x32x512_16x16_16x16_32x4x1_32x4x1_1x16x1x8_4x4x1_1x1_intrawave_v1,129.33,754.79,0.0
256,128,1024,7168,torch.float8_e4m3fn,ck,10,0,10.9119,a8w8_bpreshuffle_128x16x32x512_16x16_16x16_32x4x1_32x4x1_1x16x1x8_4x4x1_1x1_intrawave_v1,172.2,780.77,0.0
256,256,1024,7168,torch.float8_e4m3fn,ck,11,0,11.7987,a8w8_bpreshuffle_256x16x64x512_16x16_16x16_32x8x1_32x8x1_1x16x1x16_4x4x1_1x1_intrawave_v1,318.52,822.07,0.0
256,512,1024,7168,torch.float8_e4m3fn,cktile,152,0,13.8637,a8w8_bpreshuffle_cktile_0x0x8x4x1x0x0x0x0x4_32x64x512_1x4x1_16x16x128_default,542.15,869.8,0.0
256,1024,1024,7168,torch.float8_e4m3fn,ck,114,0,19.9766,a8w8_bpreshuffle_256x64x64x256_16x16_16x16_16x16x1_16x16x1_1x32x1x8_8x8x1_2x1_intrawave_v3,752.5,839.84,0.0
256,2048,1024,7168,torch.float8_e4m3fn,flydsl,875,0,27.4693,flydsl_bpreshuflle_64x128x256_F8_F8_B16_2x1x0x2_default,1094.49,954.32,0.0
256,4096,1024,7168,torch.float8_e4m3fn,flydsl,982,0,40.6073,flydsl_bpreshuflle_128x128x256_F8_F8_B16_2x1x1x2_default,1480.76,1110.36,0.0
256,8192,1024,7168,torch.float8_e4m3fn,ck,154,0,63.5166,a8w8_bpreshuffle_256x128x256x256_16x16_16x16_16x16x1_16x16x1_1x16x1x16_8x8x1_1x2_intrawave_v3,1893.35,1304.19,0.0
256,16384,1024,7168,torch.float8_e4m3fn,ck,33,0,109.7657,a8w8_bpreshuffle_256x256x256x128_16x16_16x16_8x32x1_8x32x1_1x32x1x8_8x8x1_2x1_intrawave_v3,2191.2,1442.48,0.0
256,32,2112,7168,torch.float8_e4m3fn,ck,8,0,10.46,a8w8_bpreshuffle_128x32x16x512_16x16_16x16_32x4x1_32x4x1_1x32x1x4_4x4x1_1x1_intrawave_v1,92.63,1482.16,0.0
256,64,2112,7168,torch.float8_e4m3fn,ck,24,0,11.6292,a8w8_bpreshuffle_128x16x32x512_16x16_16x16_32x4x1_32x4x1_1x16x1x8_4x4x1_1x1_intrawave_v2,166.63,1364.49,0.0
256,256,2112,7168,torch.float8_e4m3fn,cktile,151,0,16.5455,a8w8_bpreshuffle_cktile_0x0x8x4x1x0x0x0x0x3_32x64x512_1x4x1_16x16x128_default,468.47,1091.24,0.0
256,1024,2112,7168,torch.float8_e4m3fn,cktile,84,0,31.8968,a8w8_bpreshuffle_cktile_0x0x8x4x1x0x0x0x0x1_80x64x256_1x4x1_16x16x128_default,972.02,840.34,0.0
256,4096,2112,7168,torch.float8_e4m3fn,cktile,81,0,69.1831,a8w8_bpreshuffle_cktile_0x0x8x4x1x0x0x0x0x1_96x192x128_1x4x1_16x16x128_default,1792.59,893.29,0.0
256,16384,2112,7168,torch.float8_e4m3fn,cktile,121,0,220.5881,a8w8_bpreshuffle_cktile_0x0x8x4x1x0x0x0x0x2_160x192x128_1x4x1_16x16x128_default,2248.85,914.76,0.0
256,256,3072,1536,torch.float8_e4m3fn,ck,114,0,7.4106,a8w8_bpreshuffle_256x64x64x256_16x16_16x16_16x16x1_16x16x1_1x32x1x8_8x8x1_2x1_intrawave_v3,326.01,902.04,0.0
256,1024,3072,1536,torch.float8_e4m3fn,flydsl,379,0,11.3237,flydsl_bpreshuflle_64x192x256_F8_F8_B16_2x0x0x1_default,853.4,1111.2,0.0
256,4096,3072,1536,torch.float8_e4m3fn,flydsl,734,0,24.7012,flydsl_bpreshuflle_128x192x128_F8_F8_B16_2x0x0x2_default,1564.89,1464.54,0.0
256,16384,3072,1536,torch.float8_e4m3fn,flydsl,734,0,92.227,flydsl_bpreshuflle_128x192x128_F8_F8_B16_2x0x0x2_default,1676.5,1415.5,0.0
256,256,4096,512,torch.float8_e4m3fn,flydsl,96,0,4.5006,flydsl_bpreshuflle_64x64x256_F8_F8_B16_1x0x1x0_default,238.58,961.07,0.0
256,1024,4096,512,torch.float8_e4m3fn,ck,77,0,7.9448,a8w8_bpreshuffle_256x64x64x128_16x16_16x16_8x32x1_8x32x1_1x32x1x8_8x8x1_2x1_intrawave_v3,540.6,1385.82,0.0
256,4096,4096,512,torch.float8_e4m3fn,flydsl,1182,0,16.9617,flydsl_bpreshuflle_128x256x128_F8_F8_B16_1x1x0x3_default,1012.86,2225.53,0.0
256,16384,4096,512,torch.float8_e4m3fn,flydsl,601,0,62.5141,flydsl_bpreshuflle_128x256x128_F8_F8_B16_1x1x1x1_default,1099.26,2314.73,0.0
256,96,7168,512,torch.float8_e4m3fn,flydsl,1449,0,4.4317,flydsl_bpreshuflle_48x64x256_F8_F8_B16_2x0x1x4_default,159.0,1149.77,0.0
256,128,7168,512,torch.float8_e4m3fn,flydsl,677,0,4.547,flydsl_bpreshuflle_64x64x256_F8_F8_B16_1x0x0x2_default,206.63,1225.11,0.0
256,256,7168,512,torch.float8_e4m3fn,flydsl,762,0,5.9474,flydsl_bpreshuflle_64x128x256_F8_F8_B16_1x0x1x2_default,315.94,1256.2,0.0
256,1024,7168,512,torch.float8_e4m3fn,flydsl,348,0,11.4886,flydsl_bpreshuflle_64x256x128_F8_F8_B16_1x0x0x1_default,654.23,1642.88,0.0
256,4096,7168,512,torch.float8_e4m3fn,flydsl,269,0,31.9701,flydsl_bpreshuflle_128x256x128_F8_F8_B16_1x1x1x0_default,940.4,2017.12,0.0
256,16384,7168,512,torch.float8_e4m3fn,flydsl,1161,0,106.2053,flydsl_bpreshuflle_256x256x128_F8_F8_B16_2x0x1x3_default,1132.33,2325.12,0.0
256,8192,8192,8192,torch.float8_e4m3fn,flydsl,985,0,431.7209,flydsl_bpreshuflle_128x256x128_F8_F8_B16_2x1x1x2_default,2546.81,621.78,0.0
