aiter/configs/a8w8_blockscale_tuned_gemm.csv
cu_num,M,N,K,libtype,kernelId,splitK,us,kernelName,tflops,bw,errRatio
256,1,256,2048,ck,8,0,7.2164,a8w8_blockscale_1x128x128_256x16x64x256_16x16_16x16_1x1_16x16x1_16x16x1_1x16x1x16_4_1x1_intrawave_v1,0.15,73.01,0.0
256,2,256,2048,ck,8,0,7.0379,a8w8_blockscale_1x128x128_256x16x64x256_16x16_16x16_1x1_16x16x1_16x16x1_1x16x1x16_4_1x1_intrawave_v1,0.3,75.22,0.0
256,4,256,2048,ck,8,0,7.2054,a8w8_blockscale_1x128x128_256x16x64x256_16x16_16x16_1x1_16x16x1_16x16x1_1x16x1x16_4_1x1_intrawave_v1,0.58,74.18,0.0
256,8,256,2048,ck,8,0,7.6339,a8w8_blockscale_1x128x128_256x16x64x256_16x16_16x16_1x1_16x16x1_16x16x1_1x16x1x16_4_1x1_intrawave_v1,1.1,71.36,0.0
256,16,256,2048,ck,8,0,6.7459,a8w8_blockscale_1x128x128_256x16x64x256_16x16_16x16_1x1_16x16x1_16x16x1_1x16x1x16_4_1x1_intrawave_v1,2.49,83.79,0.0
256,32,256,2048,ck,13,0,8.0166,a8w8_blockscale_1x128x128_256x32x64x256_16x16_16x16_2x1_16x16x1_16x16x1_1x32x1x8_8_2x1_intrawave_v1,4.19,75.62,0.0
256,48,256,2048,ck,8,0,8.2692,a8w8_blockscale_1x128x128_256x16x64x256_16x16_16x16_1x1_16x16x1_16x16x1_1x16x1x16_4_1x1_intrawave_v1,6.09,78.26,0.0
256,64,256,2048,ck,8,0,8.1308,a8w8_blockscale_1x128x128_256x16x64x256_16x16_16x16_1x1_16x16x1_16x16x1_1x16x1x16_4_1x1_intrawave_v1,8.25,84.63,0.0
256,80,256,2048,ck,8,0,7.8428,a8w8_blockscale_1x128x128_256x16x64x256_16x16_16x16_1x1_16x16x1_16x16x1_1x16x1x16_4_1x1_intrawave_v1,10.7,92.96,0.0
256,96,256,2048,ck,8,0,7.8336,a8w8_blockscale_1x128x128_256x16x64x256_16x16_16x16_1x1_16x16x1_16x16x1_1x16x1x16_4_1x1_intrawave_v1,12.85,98.3,0.0
256,112,256,2048,ck,8,0,6.7771,a8w8_blockscale_1x128x128_256x16x64x256_16x16_16x16_1x1_16x16x1_16x16x1_1x16x1x16_4_1x1_intrawave_v1,17.33,119.67,0.0
256,128,256,2048,ck,8,0,6.8988,a8w8_blockscale_1x128x128_256x16x64x256_16x16_16x16_1x1_16x16x1_16x16x1_1x16x1x16_4_1x1_intrawave_v1,19.46,123.5,0.0
256,256,256,2048,ck,8,0,7.9899,a8w8_blockscale_1x128x128_256x16x64x256_16x16_16x16_1x1_16x16x1_16x16x1_1x16x1x16_4_1x1_intrawave_v1,33.6,147.64,0.0
256,512,256,2048,ck,13,0,8.4611,a8w8_blockscale_1x128x128_256x32x64x256_16x16_16x16_2x1_16x16x1_16x16x1_1x32x1x8_8_2x1_intrawave_v1,63.45,216.88,0.0
256,588,256,2048,ck,8,0,7.9595,a8w8_blockscale_1x128x128_256x16x64x256_16x16_16x16_1x1_16x16x1_16x16x1_1x16x1x16_4_1x1_intrawave_v1,77.46,254.99,0.0
256,773,256,2048,ck,8,0,7.9776,a8w8_blockscale_1x128x128_256x16x64x256_16x16_16x16_1x1_16x16x1_16x16x1_1x16x1x16_4_1x1_intrawave_v1,101.6,313.77,0.0
256,822,256,2048,ck,8,0,8.0795,a8w8_blockscale_1x128x128_256x16x64x256_16x16_16x16_1x1_16x16x1_16x16x1_1x16x1x16_4_1x1_intrawave_v1,106.68,325.34,0.0
256,1024,256,2048,ck,8,0,8.5521,a8w8_blockscale_1x128x128_256x16x64x256_16x16_16x16_1x1_16x16x1_16x16x1_1x16x1x16_4_1x1_intrawave_v1,125.55,367.83,0.0
256,1025,256,2048,ck,7,0,9.4512,a8w8_blockscale_1x128x128_256x16x128x256_16x16_16x16_1x2_16x16x1_16x16x1_1x16x1x16_8_1x2_intrawave_v1,113.72,333.11,0.0
256,1027,256,2048,ck,7,0,9.2391,a8w8_blockscale_1x128x128_256x16x128x256_16x16_16x16_1x2_16x16x1_16x16x1_1x16x1x16_8_1x2_intrawave_v1,116.56,341.31,0.0
256,1042,256,2048,ck,7,0,9.2641,a8w8_blockscale_1x128x128_256x16x128x256_16x16_16x16_1x2_16x16x1_16x16x1_1x16x1x16_8_1x2_intrawave_v1,117.94,344.54,0.0
256,1051,256,2048,ck,7,0,9.1566,a8w8_blockscale_1x128x128_256x16x128x256_16x16_16x16_1x2_16x16x1_16x16x1_1x16x1x16_8_1x2_intrawave_v1,120.36,351.1,0.0
256,1055,256,2048,ck,7,0,9.1203,a8w8_blockscale_1x128x128_256x16x128x256_16x16_16x16_1x2_16x16x1_16x16x1_1x16x1x16_8_1x2_intrawave_v1,121.3,353.62,0.0
256,1057,256,2048,ck,7,0,9.1308,a8w8_blockscale_1x128x128_256x16x128x256_16x16_16x16_1x2_16x16x1_16x16x1_1x16x1x16_8_1x2_intrawave_v1,121.39,353.77,0.0
256,1069,256,2048,ck,7,0,9.1587,a8w8_blockscale_1x128x128_256x16x128x256_16x16_16x16_1x2_16x16x1_16x16x1_1x16x1x16_8_1x2_intrawave_v1,122.39,356.05,0.0
256,1072,256,2048,ck,7,0,8.9999,a8w8_blockscale_1x128x128_256x16x128x256_16x16_16x16_1x2_16x16x1_16x16x1_1x16x1x16_8_1x2_intrawave_v1,124.9,363.18,0.0
256,1074,256,2048,ck,7,0,9.1953,a8w8_blockscale_1x128x128_256x16x128x256_16x16_16x16_1x2_16x16x1_16x16x1_1x16x1x16_8_1x2_intrawave_v1,122.47,356.02,0.0
256,1091,256,2048,ck,7,0,9.0928,a8w8_blockscale_1x128x128_256x16x128x256_16x16_16x16_1x2_16x16x1_16x16x1_1x16x1x16_8_1x2_intrawave_v1,125.81,364.82,0.0
256,1128,256,2048,ck,7,0,9.1823,a8w8_blockscale_1x128x128_256x16x128x256_16x16_16x16_1x2_16x16x1_16x16x1_1x16x1x16_8_1x2_intrawave_v1,128.81,371.58,0.0
256,1136,256,2048,ck,7,0,9.0513,a8w8_blockscale_1x128x128_256x16x128x256_16x16_16x16_1x2_16x16x1_16x16x1_1x16x1x16_8_1x2_intrawave_v1,131.6,379.22,0.0
256,1514,256,2048,ck,7,0,9.3298,a8w8_blockscale_1x128x128_256x16x128x256_16x16_16x16_1x2_16x16x1_16x16x1_1x16x1x16_8_1x2_intrawave_v1,170.16,471.62,0.0
256,2017,256,2048,ck,7,0,9.5599,a8w8_blockscale_1x128x128_256x16x128x256_16x16_16x16_1x2_16x16x1_16x16x1_1x16x1x16_8_1x2_intrawave_v1,221.23,594.97,0.0
256,2048,256,2048,ck,7,0,9.4865,a8w8_blockscale_1x128x128_256x16x128x256_16x16_16x16_1x2_16x16x1_16x16x1_1x16x1x16_8_1x2_intrawave_v1,226.37,607.93,0.0
256,2151,256,2048,ck,18,0,11.5811,a8w8_blockscale_1x128x128_256x64x64x256_16x16_32x32_1x1_16x16x1_16x16x1_1x32x1x8_8_1x1_intrawave_v1,194.76,520.75,0.0
256,2332,256,2048,ck,18,0,11.6332,a8w8_blockscale_1x128x128_256x64x64x256_16x16_32x32_1x1_16x16x1_16x16x1_1x32x1x8_8_1x1_intrawave_v1,210.2,558.25,0.0
256,2341,256,2048,ck,18,0,11.6456,a8w8_blockscale_1x128x128_256x64x64x256_16x16_32x32_1x1_16x16x1_16x16x1_1x32x1x8_8_1x1_intrawave_v1,210.78,559.63,0.0
256,3072,256,2048,ck,18,0,9.9121,a8w8_blockscale_1x128x128_256x64x64x256_16x16_32x32_1x1_16x16x1_16x16x1_1x32x1x8_8_1x1_intrawave_v1,324.98,846.3,0.0
256,3073,256,2048,ck,18,0,11.8783,a8w8_blockscale_1x128x128_256x64x64x256_16x16_32x32_1x1_16x16x1_16x16x1_1x32x1x8_8_1x1_intrawave_v1,271.27,706.43,0.0
256,3089,256,2048,ck,18,0,11.9387,a8w8_blockscale_1x128x128_256x64x64x256_16x16_32x32_1x1_16x16x1_16x16x1_1x32x1x8_8_1x1_intrawave_v1,271.31,706.29,0.0
256,3110,256,2048,ck,18,0,11.9494,a8w8_blockscale_1x128x128_256x64x64x256_16x16_32x32_1x1_16x16x1_16x16x1_1x32x1x8_8_1x1_intrawave_v1,272.91,710.15,0.0
256,3137,256,2048,ck,18,0,11.8593,a8w8_blockscale_1x128x128_256x64x64x256_16x16_32x32_1x1_16x16x1_16x16x1_1x32x1x8_8_1x1_intrawave_v1,277.37,721.38,0.0
256,3613,256,2048,ck,18,0,12.0457,a8w8_blockscale_1x128x128_256x64x64x256_16x16_32x32_1x1_16x16x1_16x16x1_1x32x1x8_8_1x1_intrawave_v1,314.51,811.37,0.0
256,4096,256,2048,ck,18,0,10.1182,a8w8_blockscale_1x128x128_256x64x64x256_16x16_32x32_1x1_16x16x1_16x16x1_1x32x1x8_8_1x1_intrawave_v1,424.48,1088.14,0.0
256,4097,256,2048,ck,3,0,15.3935,a8w8_blockscale_1x128x128_256x64x64x128_16x16_32x32_1x1_8x32x1_8x32x1_1x32x1x8_8_1x1_intrawave_v3,279.08,715.41,0.0
256,4109,256,2048,ck,2,0,15.186,a8w8_blockscale_1x128x128_256x64x128x128_16x16_32x32_1x2_8x32x1_8x32x1_1x32x1x8_8_1x1_intrawave_v3,283.72,727.2,0.0
256,4143,256,2048,ck,3,0,15.3861,a8w8_blockscale_1x128x128_256x64x64x128_16x16_32x32_1x1_8x32x1_8x32x1_1x32x1x8_8_1x1_intrawave_v3,282.35,723.4,0.0
256,4345,256,2048,ck,2,0,15.2432,a8w8_blockscale_1x128x128_256x64x128x128_16x16_32x32_1x2_8x32x1_8x32x1_1x32x1x8_8_1x1_intrawave_v3,298.89,764.11,0.0
256,4413,256,2048,ck,2,0,15.5082,a8w8_blockscale_1x128x128_256x64x128x128_16x16_32x32_1x2_8x32x1_8x32x1_1x32x1x8_8_1x1_intrawave_v3,298.38,762.28,0.0
256,5121,256,2048,ck,2,0,15.6672,a8w8_blockscale_1x128x128_256x64x128x128_16x16_32x32_1x2_8x32x1_8x32x1_1x32x1x8_8_1x1_intrawave_v3,342.74,870.23,0.0
256,5123,256,2048,ck,2,0,15.3411,a8w8_blockscale_1x128x128_256x64x128x128_16x16_32x32_1x2_8x32x1_8x32x1_1x32x1x8_8_1x1_intrawave_v3,350.16,889.06,0.0
256,5133,256,2048,ck,2,0,15.6404,a8w8_blockscale_1x128x128_256x64x128x128_16x16_32x32_1x2_8x32x1_8x32x1_1x32x1x8_8_1x1_intrawave_v3,344.13,873.68,0.0
256,5185,256,2048,ck,2,0,15.3528,a8w8_blockscale_1x128x128_256x64x128x128_16x16_32x32_1x2_8x32x1_8x32x1_1x32x1x8_8_1x1_intrawave_v3,354.13,898.72,0.0
256,5191,256,2048,ck,2,0,15.3904,a8w8_blockscale_1x128x128_256x64x128x128_16x16_32x32_1x2_8x32x1_8x32x1_1x32x1x8_8_1x1_intrawave_v3,353.67,897.52,0.0
256,6146,256,2048,ck,2,0,15.5501,a8w8_blockscale_1x128x128_256x64x128x128_16x16_32x32_1x2_8x32x1_8x32x1_1x32x1x8_8_1x1_intrawave_v3,414.44,1045.53,0.0
256,6147,256,2048,ck,2,0,15.5832,a8w8_blockscale_1x128x128_256x64x128x128_16x16_32x32_1x2_8x32x1_8x32x1_1x32x1x8_8_1x1_intrawave_v3,413.62,1043.47,0.0
256,6155,256,2048,ck,2,0,15.5784,a8w8_blockscale_1x128x128_256x64x128x128_16x16_32x32_1x2_8x32x1_8x32x1_1x32x1x8_8_1x1_intrawave_v3,414.29,1045.11,0.0
256,6377,256,2048,ck,2,0,15.5668,a8w8_blockscale_1x128x128_256x64x128x128_16x16_32x32_1x2_8x32x1_8x32x1_1x32x1x8_8_1x1_intrawave_v3,429.55,1082.39,0.0
256,6401,256,2048,ck,2,0,15.5447,a8w8_blockscale_1x128x128_256x64x128x128_16x16_32x32_1x2_8x32x1_8x32x1_1x32x1x8_8_1x1_intrawave_v3,431.78,1087.89,0.0
256,7121,256,2048,ck,2,0,15.7761,a8w8_blockscale_1x128x128_256x64x128x128_16x16_32x32_1x2_8x32x1_8x32x1_1x32x1x8_8_1x1_intrawave_v3,473.31,1188.76,0.0
256,7169,256,2048,ck,2,0,15.7201,a8w8_blockscale_1x128x128_256x64x128x128_16x16_32x32_1x2_8x32x1_8x32x1_1x32x1x8_8_1x1_intrawave_v3,478.19,1200.81,0.0
256,7170,256,2048,ck,2,0,15.7105,a8w8_blockscale_1x128x128_256x64x128x128_16x16_32x32_1x2_8x32x1_8x32x1_1x32x1x8_8_1x1_intrawave_v3,478.55,1201.71,0.0
256,7176,256,2048,ck,2,0,15.8234,a8w8_blockscale_1x128x128_256x64x128x128_16x16_32x32_1x2_8x32x1_8x32x1_1x32x1x8_8_1x1_intrawave_v3,475.54,1194.11,0.0
256,7177,256,2048,ck,2,0,15.7029,a8w8_blockscale_1x128x128_256x64x128x128_16x16_32x32_1x2_8x32x1_8x32x1_1x32x1x8_8_1x1_intrawave_v3,479.25,1203.43,0.0
256,7185,256,2048,ck,2,0,15.7001,a8w8_blockscale_1x128x128_256x64x128x128_16x16_32x32_1x2_8x32x1_8x32x1_1x32x1x8_8_1x1_intrawave_v3,479.87,1204.95,0.0
256,7206,256,2048,ck,2,0,15.7345,a8w8_blockscale_1x128x128_256x64x128x128_16x16_32x32_1x2_8x32x1_8x32x1_1x32x1x8_8_1x1_intrawave_v3,480.22,1205.74,0.0
256,7217,256,2048,ck,2,0,15.7986,a8w8_blockscale_1x128x128_256x64x128x128_16x16_32x32_1x2_8x32x1_8x32x1_1x32x1x8_8_1x1_intrawave_v3,479.0,1202.63,0.0
256,7257,256,2048,ck,2,0,15.7534,a8w8_blockscale_1x128x128_256x64x128x128_16x16_32x32_1x2_8x32x1_8x32x1_1x32x1x8_8_1x1_intrawave_v3,483.04,1212.58,0.0
256,7265,256,2048,ck,2,0,15.7558,a8w8_blockscale_1x128x128_256x64x128x128_16x16_32x32_1x2_8x32x1_8x32x1_1x32x1x8_8_1x1_intrawave_v3,483.5,1213.69,0.0
256,7393,256,2048,ck,2,0,15.8448,a8w8_blockscale_1x128x128_256x64x128x128_16x16_32x32_1x2_8x32x1_8x32x1_1x32x1x8_8_1x1_intrawave_v3,489.25,1227.56,0.0
256,7461,256,2048,ck,2,0,15.7968,a8w8_blockscale_1x128x128_256x64x128x128_16x16_32x32_1x2_8x32x1_8x32x1_1x32x1x8_8_1x1_intrawave_v3,495.25,1242.31,0.0
256,7634,256,2048,ck,2,0,15.8234,a8w8_blockscale_1x128x128_256x64x128x128_16x16_32x32_1x2_8x32x1_8x32x1_1x32x1x8_8_1x1_intrawave_v3,505.89,1268.21,0.0
256,8129,256,2048,ck,2,0,15.9103,a8w8_blockscale_1x128x128_256x64x128x128_16x16_32x32_1x2_8x32x1_8x32x1_1x32x1x8_8_1x1_intrawave_v3,535.75,1340.93,0.0
256,8192,256,2048,ck,2,0,15.4582,a8w8_blockscale_1x128x128_256x64x128x128_16x16_32x32_1x2_8x32x1_8x32x1_1x32x1x8_8_1x1_intrawave_v3,555.69,1390.58,0.0
256,16,512,7168,ck,8,0,20.9978,a8w8_blockscale_1x128x128_256x16x64x256_16x16_16x16_1x1_16x16x1_16x16x1_1x16x1x16_4_1x1_intrawave_v1,5.59,181.02,0.0
256,32,512,7168,ck,8,0,20.8949,a8w8_blockscale_1x128x128_256x16x64x256_16x16_16x16_1x1_16x16x1_16x16x1_1x16x1x16_4_1x1_intrawave_v1,11.24,188.19,0.0
256,64,512,7168,ck,8,0,20.5506,a8w8_blockscale_1x128x128_256x16x64x256_16x16_16x16_1x1_16x16x1_16x16x1_1x16x1x16_4_1x1_intrawave_v1,22.86,204.1,0.0
256,128,512,7168,ck,8,0,19.8412,a8w8_blockscale_1x128x128_256x16x64x256_16x16_16x16_1x1_16x16x1_16x16x1_1x16x1x16_4_1x1_intrawave_v1,47.35,237.82,0.0
256,256,512,7168,ck,8,0,20.2454,a8w8_blockscale_1x128x128_256x16x64x256_16x16_16x16_1x1_16x16x1_16x16x1_1x16x1x16_4_1x1_intrawave_v1,92.81,284.86,0.0
256,512,512,7168,ck,8,0,20.7411,a8w8_blockscale_1x128x128_256x16x64x256_16x16_16x16_1x1_16x16x1_16x16x1_1x16x1x16_4_1x1_intrawave_v1,181.19,379.17,0.0
256,1024,512,7168,ck,18,0,23.1271,a8w8_blockscale_1x128x128_256x64x64x256_16x16_32x32_1x1_16x16x1_16x16x1_1x32x1x8_8_1x1_intrawave_v1,325.0,521.41,0.0
256,1536,512,7168,ck,18,0,23.4156,a8w8_blockscale_1x128x128_256x64x64x256_16x16_32x32_1x1_16x16x1_16x16x1_1x32x1x8_8_1x1_intrawave_v1,481.49,694.11,0.0
256,2048,512,7168,ck,18,0,24.9898,a8w8_blockscale_1x128x128_256x64x64x256_16x16_32x32_1x1_16x16x1_16x16x1_1x32x1x8_8_1x1_intrawave_v1,601.54,818.22,0.0
256,4096,512,7168,ck,18,0,43.5996,a8w8_blockscale_1x128x128_256x64x64x256_16x16_32x32_1x1_16x16x1_16x16x1_1x32x1x8_8_1x1_intrawave_v1,689.57,853.78,0.0
256,8192,512,7168,ck,0,0,66.7717,a8w8_blockscale_1x128x128_256x128x128x128_16x16_32x32_2x2_8x32x1_8x32x1_1x32x1x8_8_1x1_intrawave_v3,900.52,1060.01,0.0
256,16384,512,7168,ck,0,0,117.7852,a8w8_blockscale_1x128x128_256x128x128x128_16x16_32x32_2x2_8x32x1_8x32x1_1x32x1x8_8_1x1_intrawave_v3,1021.0,1170.67,0.0
256,20480,512,7168,ck,0,0,152.2349,a8w8_blockscale_1x128x128_256x128x128x128_16x16_32x32_2x2_8x32x1_8x32x1_1x32x1x8_8_1x1_intrawave_v3,987.45,1126.17,0.0
256,16,576,7168,ck,8,0,21.0859,a8w8_blockscale_1x128x128_256x16x64x256_16x16_16x16_1x1_16x16x1_16x16x1_1x16x1x16_4_1x1_intrawave_v1,6.27,202.12,0.0
256,32,576,7168,ck,8,0,20.9288,a8w8_blockscale_1x128x128_256x16x64x256_16x16_16x16_1x1_16x16x1_16x16x1_1x16x1x16_4_1x1_intrawave_v1,12.63,210.0,0.0
256,64,576,7168,ck,8,0,20.6157,a8w8_blockscale_1x128x128_256x16x64x256_16x16_16x16_1x1_16x16x1_16x16x1_1x16x1x16_4_1x1_intrawave_v1,25.63,226.1,0.0
256,128,576,7168,ck,8,0,20.0861,a8w8_blockscale_1x128x128_256x16x64x256_16x16_16x16_1x1_16x16x1_16x16x1_1x16x1x16_4_1x1_intrawave_v1,52.62,258.57,0.0
256,256,576,7168,ck,8,0,20.4152,a8w8_blockscale_1x128x128_256x16x64x256_16x16_16x16_1x1_16x16x1_16x16x1_1x16x1x16_4_1x1_intrawave_v1,103.55,306.57,0.0
256,512,576,7168,ck,18,0,23.0551,a8w8_blockscale_1x128x128_256x64x64x256_16x16_32x32_1x1_16x16x1_16x16x1_1x32x1x8_8_1x1_intrawave_v1,183.38,363.85,0.0
256,1024,576,7168,ck,18,0,23.0306,a8w8_blockscale_1x128x128_256x64x64x256_16x16_32x32_1x1_16x16x1_16x16x1_1x32x1x8_8_1x1_intrawave_v1,367.15,549.2,0.0
256,1536,576,7168,ck,18,0,24.2524,a8w8_blockscale_1x128x128_256x64x64x256_16x16_32x32_1x1_16x16x1_16x16x1_1x32x1x8_8_1x1_intrawave_v1,522.98,697.18,0.0
256,2048,576,7168,ck,18,0,34.4222,a8w8_blockscale_1x128x128_256x64x64x256_16x16_32x32_1x1_16x16x1_16x16x1_1x32x1x8_8_1x1_intrawave_v1,491.29,614.96,0.0
256,4096,576,7168,ck,18,0,54.8316,a8w8_blockscale_1x128x128_256x64x64x256_16x16_32x32_1x1_16x16x1_16x16x1_1x32x1x8_8_1x1_intrawave_v1,616.85,696.82,0.0
256,8192,576,7168,ck,0,0,87.2065,a8w8_blockscale_1x128x128_256x128x128x128_16x16_32x32_2x2_8x32x1_8x32x1_1x32x1x8_8_1x1_intrawave_v3,775.7,828.91,0.0
256,16384,576,7168,ck,0,0,152.274,a8w8_blockscale_1x128x128_256x128x128x128_16x16_32x32_2x2_8x32x1_8x32x1_1x32x1x8_8_1x1_intrawave_v3,888.47,922.31,0.0
256,20480,576,7168,ck,0,0,188.6292,a8w8_blockscale_1x128x128_256x128x128x128_16x16_32x32_2x2_8x32x1_8x32x1_1x32x1x8_8_1x1_intrawave_v3,896.54,925.21,0.0
256,1,1024,2048,ck,8,0,7.3247,a8w8_blockscale_1x128x128_256x16x64x256_16x16_16x16_1x1_16x16x1_16x16x1_1x16x1x16_4_1x1_intrawave_v1,0.57,286.87,0.0
256,2,1024,2048,ck,8,0,8.2914,a8w8_blockscale_1x128x128_256x16x64x256_16x16_16x16_1x1_16x16x1_16x16x1_1x16x1x16_4_1x1_intrawave_v1,1.01,253.92,0.0
256,4,1024,2048,ck,8,0,7.5836,a8w8_blockscale_1x128x128_256x16x64x256_16x16_16x16_1x1_16x16x1_16x16x1_1x16x1x16_4_1x1_intrawave_v1,2.21,278.7,0.0
256,8,1024,2048,ck,8,0,7.3451,a8w8_blockscale_1x128x128_256x16x64x256_16x16_16x16_1x1_16x16x1_16x16x1_1x16x1x16_4_1x1_intrawave_v1,4.57,289.98,0.0
256,16,1024,2048,ck,8,0,7.7465,a8w8_blockscale_1x128x128_256x16x64x256_16x16_16x16_1x1_16x16x1_16x16x1_1x16x1x16_4_1x1_intrawave_v1,8.66,279.18,0.0
256,32,1024,2048,ck,8,0,7.6527,a8w8_blockscale_1x128x128_256x16x64x256_16x16_16x16_1x1_16x16x1_16x16x1_1x16x1x16_4_1x1_intrawave_v1,17.54,291.17,0.0
256,48,1024,2048,ck,8,0,7.4324,a8w8_blockscale_1x128x128_256x16x64x256_16x16_16x16_1x1_16x16x1_16x16x1_1x16x1x16_4_1x1_intrawave_v1,27.09,308.62,0.0
256,64,1024,2048,ck,8,0,7.0868,a8w8_blockscale_1x128x128_256x16x64x256_16x16_16x16_1x1_16x16x1_16x16x1_1x16x1x16_4_1x1_intrawave_v1,37.88,332.91,0.0
256,80,1024,2048,ck,8,0,7.9027,a8w8_blockscale_1x128x128_256x16x64x256_16x16_16x16_1x1_16x16x1_16x16x1_1x16x1x16_4_1x1_intrawave_v1,42.46,306.84,0.0
256,96,1024,2048,ck,8,0,8.194,a8w8_blockscale_1x128x128_256x16x64x256_16x16_16x16_1x1_16x16x1_16x16x1_1x16x1x16_4_1x1_intrawave_v1,49.14,303.93,0.0
256,112,1024,2048,ck,8,0,8.0395,a8w8_blockscale_1x128x128_256x16x64x256_16x16_16x16_1x1_16x16x1_16x16x1_1x16x1x16_4_1x1_intrawave_v1,58.43,317.92,0.0
256,128,1024,2048,ck,8,0,7.4188,a8w8_blockscale_1x128x128_256x16x64x256_16x16_16x16_1x1_16x16x1_16x16x1_1x16x1x16_4_1x1_intrawave_v1,72.37,353.35,0.0
256,256,1024,2048,ck,8,0,7.685,a8w8_blockscale_1x128x128_256x16x64x256_16x16_16x16_1x1_16x16x1_16x16x1_1x16x1x16_4_1x1_intrawave_v1,139.72,409.33,0.0
256,512,1024,2048,ck,18,0,9.4,a8w8_blockscale_1x128x128_256x64x64x256_16x16_32x32_1x1_16x16x1_16x16x1_1x32x1x8_8_1x1_intrawave_v1,228.46,446.2,0.0
256,667,1024,2048,ck,18,0,11.6619,a8w8_blockscale_1x128x128_256x64x64x256_16x16_32x32_1x1_16x16x1_16x16x1_1x32x1x8_8_1x1_intrawave_v1,239.89,414.1,0.0
256,671,1024,2048,ck,18,0,11.6163,a8w8_blockscale_1x128x128_256x64x64x256_16x16_32x32_1x1_16x16x1_16x16x1_1x32x1x8_8_1x1_intrawave_v1,242.28,417.14,0.0
256,931,1024,2048,ck,18,0,11.889,a8w8_blockscale_1x128x128_256x64x64x256_16x16_32x32_1x1_16x16x1_16x16x1_1x32x1x8_8_1x1_intrawave_v1,328.45,497.14,0.0
256,1024,1024,2048,ck,18,0,9.9669,a8w8_blockscale_1x128x128_256x64x64x256_16x16_32x32_1x1_16x16x1_16x16x1_1x32x1x8_8_1x1_intrawave_v1,430.92,631.23,0.0
256,1025,1024,2048,ck,2,0,14.8695,a8w8_blockscale_1x128x128_256x64x128x128_16x16_32x32_1x2_8x32x1_8x32x1_1x32x1x8_8_1x1_intrawave_v3,289.13,423.39,0.0
256,1027,1024,2048,ck,2,0,15.1514,a8w8_blockscale_1x128x128_256x64x128x128_16x16_32x32_1x2_8x32x1_8x32x1_1x32x1x8_8_1x1_intrawave_v3,284.3,416.05,0.0
256,1031,1024,2048,ck,2,0,15.1506,a8w8_blockscale_1x128x128_256x64x128x128_16x16_32x32_1x2_8x32x1_8x32x1_1x32x1x8_8_1x1_intrawave_v3,285.42,417.15,0.0
256,1039,1024,2048,ck,2,0,14.9406,a8w8_blockscale_1x128x128_256x64x128x128_16x16_32x32_1x2_8x32x1_8x32x1_1x32x1x8_8_1x1_intrawave_v3,291.68,425.21,0.0
256,1040,1024,2048,ck,2,0,15.0273,a8w8_blockscale_1x128x128_256x64x128x128_16x16_32x32_1x2_8x32x1_8x32x1_1x32x1x8_8_1x1_intrawave_v3,290.28,423.03,0.0
256,1041,1024,2048,ck,2,0,15.2202,a8w8_blockscale_1x128x128_256x64x128x128_16x16_32x32_1x2_8x32x1_8x32x1_1x32x1x8_8_1x1_intrawave_v3,286.87,417.94,0.0
256,1072,1024,2048,ck,2,0,15.2339,a8w8_blockscale_1x128x128_256x64x128x128_16x16_32x32_1x2_8x32x1_8x32x1_1x32x1x8_8_1x1_intrawave_v3,295.15,425.9,0.0
256,1073,1024,2048,ck,3,0,15.289,a8w8_blockscale_1x128x128_256x64x64x128_16x16_32x32_1x1_8x32x1_8x32x1_1x32x1x8_8_1x1_intrawave_v3,294.36,424.63,0.0
256,1077,1024,2048,ck,3,0,15.2791,a8w8_blockscale_1x128x128_256x64x64x128_16x16_32x32_1x1_8x32x1_8x32x1_1x32x1x8_8_1x1_intrawave_v3,295.65,425.98,0.0
256,1091,1024,2048,ck,2,0,14.997,a8w8_blockscale_1x128x128_256x64x128x128_16x16_32x32_1x2_8x32x1_8x32x1_1x32x1x8_8_1x1_intrawave_v3,305.13,437.81,0.0
256,1343,1024,2048,ck,2,0,15.2723,a8w8_blockscale_1x128x128_256x64x128x128_16x16_32x32_1x2_8x32x1_8x32x1_1x32x1x8_8_1x1_intrawave_v3,368.83,497.51,0.0
256,1688,1024,2048,ck,2,0,15.4982,a8w8_blockscale_1x128x128_256x64x128x128_16x16_32x32_1x2_8x32x1_8x32x1_1x32x1x8_8_1x1_intrawave_v3,456.83,581.44,0.0
256,2017,1024,2048,ck,2,0,15.7918,a8w8_blockscale_1x128x128_256x64x128x128_16x16_32x32_1x2_8x32x1_8x32x1_1x32x1x8_8_1x1_intrawave_v3,535.72,655.96,0.0
256,2048,1024,2048,ck,2,0,15.5333,a8w8_blockscale_1x128x128_256x64x128x128_16x16_32x32_1x2_8x32x1_8x32x1_1x32x1x8_8_1x1_intrawave_v3,553.0,675.05,0.0
256,2050,1024,2048,ck,3,0,19.1466,a8w8_blockscale_1x128x128_256x64x64x128_16x16_32x32_1x1_8x32x1_8x32x1_1x32x1x8_8_1x1_intrawave_v3,449.08,548.08,0.0
256,2063,1024,2048,ck,3,0,18.9591,a8w8_blockscale_1x128x128_256x64x64x128_16x16_32x32_1x1_8x32x1_8x32x1_1x32x1x8_8_1x1_intrawave_v3,456.4,556.31,0.0
256,2064,1024,2048,ck,3,0,19.1734,a8w8_blockscale_1x128x128_256x64x64x128_16x16_32x32_1x1_8x32x1_8x32x1_1x32x1x8_8_1x1_intrawave_v3,451.51,550.31,0.0
256,2099,1024,2048,ck,3,0,19.1265,a8w8_blockscale_1x128x128_256x64x64x128_16x16_32x32_1x1_8x32x1_8x32x1_1x32x1x8_8_1x1_intrawave_v3,460.3,559.15,0.0
256,2159,1024,2048,ck,3,0,19.2408,a8w8_blockscale_1x128x128_256x64x64x128_16x16_32x32_1x1_8x32x1_8x32x1_1x32x1x8_8_1x1_intrawave_v3,470.64,568.61,0.0
256,2160,1024,2048,ck,3,0,19.2202,a8w8_blockscale_1x128x128_256x64x64x128_16x16_32x32_1x1_8x32x1_8x32x1_1x32x1x8_8_1x1_intrawave_v3,471.36,569.43,0.0
256,2313,1024,2048,ck,3,0,19.2929,a8w8_blockscale_1x128x128_256x64x64x128_16x16_32x32_1x1_8x32x1_8x32x1_1x32x1x8_8_1x1_intrawave_v3,502.85,599.76,0.0
256,2325,1024,2048,ck,3,0,19.4547,a8w8_blockscale_1x128x128_256x64x64x128_16x16_32x32_1x1_8x32x1_8x32x1_1x32x1x8_8_1x1_intrawave_v3,501.25,597.3,0.0
256,3072,1024,2048,ck,0,0,19.6692,a8w8_blockscale_1x128x128_256x128x128x128_16x16_32x32_2x2_8x32x1_8x32x1_1x32x1x8_8_1x1_intrawave_v3,655.08,746.35,0.0
256,3073,1024,2048,ck,0,0,20.4577,a8w8_blockscale_1x128x128_256x128x128x128_16x16_32x32_2x2_8x32x1_8x32x1_1x32x1x8_8_1x1_intrawave_v3,630.04,717.78,0.0
256,3182,1024,2048,ck,0,0,20.711,a8w8_blockscale_1x128x128_256x128x128x128_16x16_32x32_2x2_8x32x1_8x32x1_1x32x1x8_8_1x1_intrawave_v3,644.41,730.56,0.0
256,3183,1024,2048,ck,0,0,20.7783,a8w8_blockscale_1x128x128_256x128x128x128_16x16_32x32_2x2_8x32x1_8x32x1_1x32x1x8_8_1x1_intrawave_v3,642.52,728.39,0.0
256,3847,1024,2048,ck,0,0,21.086,a8w8_blockscale_1x128x128_256x128x128x128_16x16_32x32_2x2_8x32x1_8x32x1_1x32x1x8_8_1x1_intrawave_v3,765.22,846.74,0.0
256,4096,1024,2048,ck,0,0,20.265,a8w8_blockscale_1x128x128_256x128x128x128_16x16_32x32_2x2_8x32x1_8x32x1_1x32x1x8_8_1x1_intrawave_v3,847.76,931.38,0.0
256,4111,1024,2048,ck,2,0,28.0172,a8w8_blockscale_1x128x128_256x64x128x128_16x16_32x32_1x2_8x32x1_8x32x1_1x32x1x8_8_1x1_intrawave_v3,615.44,675.86,0.0
256,4141,1024,2048,ck,2,0,27.948,a8w8_blockscale_1x128x128_256x64x128x128_16x16_32x32_1x2_8x32x1_8x32x1_1x32x1x8_8_1x1_intrawave_v3,621.46,681.93,0.0
256,4142,1024,2048,ck,2,0,27.8527,a8w8_blockscale_1x128x128_256x64x128x128_16x16_32x32_1x2_8x32x1_8x32x1_1x32x1x8_8_1x1_intrawave_v3,623.74,684.41,0.0
256,4345,1024,2048,ck,2,0,28.505,a8w8_blockscale_1x128x128_256x64x128x128_16x16_32x32_1x2_8x32x1_8x32x1_1x32x1x8_8_1x1_intrawave_v3,639.34,697.92,0.0
256,5105,1024,2048,ck,2,0,29.184,a8w8_blockscale_1x128x128_256x64x128x128_16x16_32x32_1x2_8x32x1_8x32x1_1x32x1x8_8_1x1_intrawave_v3,733.69,788.35,0.0
256,5121,1024,2048,ck,2,0,28.8972,a8w8_blockscale_1x128x128_256x64x128x128_16x16_32x32_1x2_8x32x1_8x32x1_1x32x1x8_8_1x1_intrawave_v3,743.29,798.44,0.0
256,5123,1024,2048,ck,2,0,29.1112,a8w8_blockscale_1x128x128_256x64x128x128_16x16_32x32_1x2_8x32x1_8x32x1_1x32x1x8_8_1x1_intrawave_v3,738.12,792.85,0.0
256,5131,1024,2048,ck,2,0,28.9774,a8w8_blockscale_1x128x128_256x64x128x128_16x16_32x32_1x2_8x32x1_8x32x1_1x32x1x8_8_1x1_intrawave_v3,742.68,797.65,0.0
256,5427,1024,2048,ck,2,0,29.5528,a8w8_blockscale_1x128x128_256x64x128x128_16x16_32x32_1x2_8x32x1_8x32x1_1x32x1x8_8_1x1_intrawave_v3,770.23,823.14,0.0
256,6113,1024,2048,ck,2,0,30.8881,a8w8_blockscale_1x128x128_256x64x128x128_16x16_32x32_1x2_8x32x1_8x32x1_1x32x1x8_8_1x1_intrawave_v3,830.09,878.53,0.0
256,6197,1024,2048,ck,0,0,31.5562,a8w8_blockscale_1x128x128_256x128x128x128_16x16_32x32_2x2_8x32x1_8x32x1_1x32x1x8_8_1x1_intrawave_v3,823.68,870.83,0.0
256,6409,1024,2048,ck,0,0,31.7179,a8w8_blockscale_1x128x128_256x128x128x128_16x16_32x32_2x2_8x32x1_8x32x1_1x32x1x8_8_1x1_intrawave_v3,847.51,893.77,0.0
256,7121,1024,2048,ck,0,0,33.3753,a8w8_blockscale_1x128x128_256x128x128x128_16x16_32x32_2x2_8x32x1_8x32x1_1x32x1x8_8_1x1_intrawave_v3,894.9,936.76,0.0
256,7168,1024,2048,ck,0,0,31.8502,a8w8_blockscale_1x128x128_256x128x128x128_16x16_32x32_2x2_8x32x1_8x32x1_1x32x1x8_8_1x1_intrawave_v3,943.94,987.66,0.0
256,7169,1024,2048,ck,0,0,33.2869,a8w8_blockscale_1x128x128_256x128x128x128_16x16_32x32_2x2_8x32x1_8x32x1_1x32x1x8_8_1x1_intrawave_v3,903.33,945.16,0.0
256,7172,1024,2048,ck,0,0,33.6523,a8w8_blockscale_1x128x128_256x128x128x128_16x16_32x32_2x2_8x32x1_8x32x1_1x32x1x8_8_1x1_intrawave_v3,893.89,935.26,0.0
256,7176,1024,2048,ck,0,0,33.0666,a8w8_blockscale_1x128x128_256x128x128x128_16x16_32x32_2x2_8x32x1_8x32x1_1x32x1x8_8_1x1_intrawave_v3,910.23,952.32,0.0
256,7177,1024,2048,ck,0,0,33.6311,a8w8_blockscale_1x128x128_256x128x128x128_16x16_32x32_2x2_8x32x1_8x32x1_1x32x1x8_8_1x1_intrawave_v3,895.08,936.46,0.0
256,7178,1024,2048,ck,0,0,33.2437,a8w8_blockscale_1x128x128_256x128x128x128_16x16_32x32_2x2_8x32x1_8x32x1_1x32x1x8_8_1x1_intrawave_v3,905.64,947.5,0.0
256,7179,1024,2048,ck,0,0,32.7719,a8w8_blockscale_1x128x128_256x128x128x128_16x16_32x32_2x2_8x32x1_8x32x1_1x32x1x8_8_1x1_intrawave_v3,918.8,961.26,0.0
256,7183,1024,2048,ck,0,0,32.8276,a8w8_blockscale_1x128x128_256x128x128x128_16x16_32x32_2x2_8x32x1_8x32x1_1x32x1x8_8_1x1_intrawave_v3,917.75,960.13,0.0
256,7184,1024,2048,ck,0,0,32.5946,a8w8_blockscale_1x128x128_256x128x128x128_16x16_32x32_2x2_8x32x1_8x32x1_1x32x1x8_8_1x1_intrawave_v3,924.44,967.12,0.0
256,7209,1024,2048,ck,0,0,33.4989,a8w8_blockscale_1x128x128_256x128x128x128_16x16_32x32_2x2_8x32x1_8x32x1_1x32x1x8_8_1x1_intrawave_v3,902.62,944.07,0.0
256,7210,1024,2048,ck,0,0,33.4499,a8w8_blockscale_1x128x128_256x128x128x128_16x16_32x32_2x2_8x32x1_8x32x1_1x32x1x8_8_1x1_intrawave_v3,904.07,945.57,0.0
256,7211,1024,2048,ck,0,0,33.5884,a8w8_blockscale_1x128x128_256x128x128x128_16x16_32x32_2x2_8x32x1_8x32x1_1x32x1x8_8_1x1_intrawave_v3,900.46,941.8,0.0
256,7217,1024,2048,ck,0,0,33.4125,a8w8_blockscale_1x128x128_256x128x128x128_16x16_32x32_2x2_8x32x1_8x32x1_1x32x1x8_8_1x1_intrawave_v3,905.96,947.49,0.0
256,7273,1024,2048,ck,0,0,33.2849,a8w8_blockscale_1x128x128_256x128x128x128_16x16_32x32_2x2_8x32x1_8x32x1_1x32x1x8_8_1x1_intrawave_v3,916.49,958.01,0.0
256,7274,1024,2048,ck,0,0,33.2466,a8w8_blockscale_1x128x128_256x128x128x128_16x16_32x32_2x2_8x32x1_8x32x1_1x32x1x8_8_1x1_intrawave_v3,917.67,959.24,0.0
256,7391,1024,2048,ck,0,0,33.2909,a8w8_blockscale_1x128x128_256x128x128x128_16x16_32x32_2x2_8x32x1_8x32x1_1x32x1x8_8_1x1_intrawave_v3,931.19,972.36,0.0
256,7393,1024,2048,ck,0,0,33.747,a8w8_blockscale_1x128x128_256x128x128x128_16x16_32x32_2x2_8x32x1_8x32x1_1x32x1x8_8_1x1_intrawave_v3,918.85,959.46,0.0
256,7715,1024,2048,ck,0,0,33.8709,a8w8_blockscale_1x128x128_256x128x128x128_16x16_32x32_2x2_8x32x1_8x32x1_1x32x1x8_8_1x1_intrawave_v3,955.36,994.89,0.0
256,7753,1024,2048,ck,0,0,33.9617,a8w8_blockscale_1x128x128_256x128x128x128_16x16_32x32_2x2_8x32x1_8x32x1_1x32x1x8_8_1x1_intrawave_v3,957.5,996.81,0.0
256,7819,1024,2048,ck,0,0,33.9314,a8w8_blockscale_1x128x128_256x128x128x128_16x16_32x32_2x2_8x32x1_8x32x1_1x32x1x8_8_1x1_intrawave_v3,966.52,1005.67,0.0
256,8099,1024,2048,ck,0,0,34.1323,a8w8_blockscale_1x128x128_256x128x128x128_16x16_32x32_2x2_8x32x1_8x32x1_1x32x1x8_8_1x1_intrawave_v3,995.24,1033.35,0.0
256,8129,1024,2048,ck,0,0,35.3313,a8w8_blockscale_1x128x128_256x128x128x128_16x16_32x32_2x2_8x32x1_8x32x1_1x32x1x8_8_1x1_intrawave_v3,965.02,1001.76,0.0
256,8188,1024,2048,ck,0,0,34.251,a8w8_blockscale_1x128x128_256x128x128x128_16x16_32x32_2x2_8x32x1_8x32x1_1x32x1x8_8_1x1_intrawave_v3,1002.68,1040.41,0.0
256,8192,1024,2048,ck,0,0,34.7865,a8w8_blockscale_1x128x128_256x128x128x128_16x16_32x32_2x2_8x32x1_8x32x1_1x32x1x8_8_1x1_intrawave_v3,987.73,1024.87,0.0
256,16,1536,7168,ck,8,0,21.6147,a8w8_blockscale_1x128x128_256x16x64x256_16x16_16x16_1x1_16x16x1_16x16x1_1x16x1x16_4_1x1_intrawave_v1,16.3,516.96,0.0
256,32,1536,7168,ck,8,0,21.2799,a8w8_blockscale_1x128x128_256x16x64x256_16x16_16x16_1x1_16x16x1_16x16x1_1x16x1x16_4_1x1_intrawave_v1,33.11,532.79,0.0
256,64,1536,7168,ck,8,0,21.0947,a8w8_blockscale_1x128x128_256x16x64x256_16x16_16x16_1x1_16x16x1_16x16x1_1x16x1x16_4_1x1_intrawave_v1,66.81,553.0,0.0
256,128,1536,7168,ck,8,0,20.5469,a8w8_blockscale_1x128x128_256x16x64x256_16x16_16x16_1x1_16x16x1_16x16x1_1x16x1x16_4_1x1_intrawave_v1,137.18,599.64,0.0
256,256,1536,7168,ck,7,0,22.6093,a8w8_blockscale_1x128x128_256x16x128x256_16x16_16x16_1x2_16x16x1_16x16x1_1x16x1x16_8_1x2_intrawave_v1,249.33,602.92,0.0
256,512,1536,7168,ck,18,0,23.3971,a8w8_blockscale_1x128x128_256x64x64x256_16x16_32x32_1x1_16x16x1_16x16x1_1x32x1x8_8_1x1_intrawave_v1,481.87,694.66,0.0
256,1024,1536,7168,ck,18,0,37.0383,a8w8_blockscale_1x128x128_256x64x64x256_16x16_32x32_1x1_16x16x1_16x16x1_1x32x1x8_8_1x1_intrawave_v1,608.79,580.37,0.0
256,1536,1536,7168,ck,18,0,52.9404,a8w8_blockscale_1x128x128_256x64x64x256_16x16_32x32_1x1_16x16x1_16x16x1_1x32x1x8_8_1x1_intrawave_v1,638.89,505.07,0.0
256,2048,1536,7168,ck,0,0,58.3488,a8w8_blockscale_1x128x128_256x128x128x128_16x16_32x32_2x2_8x32x1_8x32x1_1x32x1x8_8_1x1_intrawave_v3,772.89,548.11,0.0
256,4096,1536,7168,ck,0,0,99.1466,a8w8_blockscale_1x128x128_256x128x128x128_16x16_32x32_2x2_8x32x1_8x32x1_1x32x1x8_8_1x1_intrawave_v3,909.71,534.09,0.0
256,8192,1536,7168,ck,0,0,172.6502,a8w8_blockscale_1x128x128_256x128x128x128_16x16_32x32_2x2_8x32x1_8x32x1_1x32x1x8_8_1x1_intrawave_v3,1044.82,549.64,0.0
256,16384,1536,7168,ck,0,0,311.0558,a8w8_blockscale_1x128x128_256x128x128x128_16x16_32x32_2x2_8x32x1_8x32x1_1x32x1x8_8_1x1_intrawave_v3,1159.85,574.76,0.0
256,20480,1536,7168,ck,0,0,385.8756,a8w8_blockscale_1x128x128_256x128x128x128_16x16_32x32_2x2_8x32x1_8x32x1_1x32x1x8_8_1x1_intrawave_v3,1168.7,572.01,0.0
256,1,2048,128,ck,6,0,2.6184,a8w8_blockscale_1x128x128_256x16x64x128_8x16_16x16_1x1_16x16x1_8x32x1_1x16x1x16_4_1x1_intrawave_v1,0.2,101.73,0.0
256,1,2048,512,ck,8,0,3.2395,a8w8_blockscale_1x128x128_256x16x64x256_16x16_16x16_1x1_16x16x1_16x16x1_1x16x1x16_4_1x1_intrawave_v1,0.65,325.11,0.0
256,1,2048,1024,ck,8,0,4.4526,a8w8_blockscale_1x128x128_256x16x64x256_16x16_16x16_1x1_16x16x1_16x16x1_1x16x1x16_4_1x1_intrawave_v1,0.94,472.14,0.0
256,1,2048,4096,ck,8,0,13.5667,a8w8_blockscale_1x128x128_256x16x64x256_16x16_16x16_1x1_16x16x1_16x16x1_1x16x1x16_4_1x1_intrawave_v1,1.24,618.93,0.0
256,2,2048,128,ck,6,0,2.7194,a8w8_blockscale_1x128x128_256x16x64x128_8x16_16x16_1x1_16x16x1_8x32x1_1x16x1x16_4_1x1_intrawave_v1,0.39,99.5,0.0
256,2,2048,512,ck,8,0,3.2048,a8w8_blockscale_1x128x128_256x16x64x256_16x16_16x16_1x1_16x16x1_16x16x1_1x16x1x16_4_1x1_intrawave_v1,1.31,330.06,0.0
256,2,2048,1024,ck,8,0,3.7,a8w8_blockscale_1x128x128_256x16x64x256_16x16_16x16_1x1_16x16x1_16x16x1_1x16x1x16_4_1x1_intrawave_v1,2.27,569.57,0.0
256,2,2048,4096,ck,8,0,13.3926,a8w8_blockscale_1x128x128_256x16x64x256_16x16_16x16_1x1_16x16x1_16x16x1_1x16x1x16_4_1x1_intrawave_v1,2.51,627.58,0.0
256,4,2048,128,ck,8,0,2.8829,a8w8_blockscale_1x128x128_256x16x64x256_16x16_16x16_1x1_16x16x1_16x16x1_1x16x1x16_4_1x1_intrawave_v1,0.73,96.79,0.0
256,4,2048,512,ck,7,0,3.7353,a8w8_blockscale_1x128x128_256x16x128x256_16x16_16x16_1x2_16x16x1_16x16x1_1x16x1x16_8_1x2_intrawave_v1,2.25,285.66,0.0
256,4,2048,1024,ck,8,0,4.3247,a8w8_blockscale_1x128x128_256x16x64x256_16x16_16x16_1x1_16x16x1_16x16x1_1x16x1x16_4_1x1_intrawave_v1,3.88,489.66,0.0
256,4,2048,4096,ck,8,0,13.6003,a8w8_blockscale_1x128x128_256x16x64x256_16x16_16x16_1x1_16x16x1_16x16x1_1x16x1x16_4_1x1_intrawave_v1,4.93,619.21,0.0
256,8,2048,128,ck,8,0,2.8959,a8w8_blockscale_1x128x128_256x16x64x256_16x16_16x16_1x1_16x16x1_16x16x1_1x16x1x16_4_1x1_intrawave_v1,1.45,102.19,0.0
256,8,2048,512,ck,8,0,3.2669,a8w8_blockscale_1x128x128_256x16x64x256_16x16_16x16_1x1_16x16x1_16x16x1_1x16x1x16_4_1x1_intrawave_v1,5.14,332.25,0.0
256,8,2048,1024,ck,8,0,4.7215,a8w8_blockscale_1x128x128_256x16x64x256_16x16_16x16_1x1_16x16x1_16x16x1_1x16x1x16_4_1x1_intrawave_v1,7.11,452.85,0.0
256,8,2048,4096,ck,8,0,13.6735,a8w8_blockscale_1x128x128_256x16x64x256_16x16_16x16_1x1_16x16x1_16x16x1_1x16x1x16_4_1x1_intrawave_v1,9.82,618.29,0.0
256,16,2048,128,ck,8,0,2.8936,a8w8_blockscale_1x128x128_256x16x64x256_16x16_16x16_1x1_16x16x1_16x16x1_1x16x1x16_4_1x1_intrawave_v1,2.9,113.95,0.0
256,16,2048,512,ck,8,0,3.2235,a8w8_blockscale_1x128x128_256x16x64x256_16x16_16x16_1x1_16x16x1_16x16x1_1x16x1x16_4_1x1_intrawave_v1,10.41,348.16,0.0
256,16,2048,1024,ck,8,0,4.9363,a8w8_blockscale_1x128x128_256x16x64x256_16x16_16x16_1x1_16x16x1_16x16x1_1x16x1x16_4_1x1_intrawave_v1,13.59,441.44,0.0
256,16,2048,4096,ck,8,0,13.2342,a8w8_blockscale_1x128x128_256x16x64x256_16x16_16x16_1x1_16x16x1_16x16x1_1x16x1x16_4_1x1_intrawave_v1,20.28,643.76,0.0
256,32,2048,128,cktile,10,0,3.2994,a8w8_blockscale_cktile_64x128x128_2x2x1_32x32x16_intrawave_0x0x0x0_1,5.08,120.42,0.0
256,32,2048,512,ck,8,0,3.5,a8w8_blockscale_1x128x128_256x16x64x256_16x16_16x16_1x1_16x16x1_16x16x1_1x16x1x16_4_1x1_intrawave_v1,19.17,341.72,0.0
256,32,2048,1024,ck,8,0,4.7566,a8w8_blockscale_1x128x128_256x16x64x256_16x16_16x16_1x1_16x16x1_16x16x1_1x16x1x16_4_1x1_intrawave_v1,28.22,475.34,0.0
256,32,2048,4096,ck,8,0,13.347,a8w8_blockscale_1x128x128_256x16x64x256_16x16_16x16_1x1_16x16x1_16x16x1_1x16x1x16_4_1x1_intrawave_v1,40.22,648.14,0.0
256,48,2048,128,ck,6,0,3.0119,a8w8_blockscale_1x128x128_256x16x64x128_8x16_16x16_1x1_16x16x1_8x32x1_1x16x1x16_4_1x1_intrawave_v1,8.36,154.35,0.0
256,48,2048,512,ck,8,0,3.4965,a8w8_blockscale_1x128x128_256x16x64x256_16x16_16x16_1x1_16x16x1_16x16x1_1x16x1x16_4_1x1_intrawave_v1,28.79,363.15,0.0
256,48,2048,1024,ck,8,0,4.9909,a8w8_blockscale_1x128x128_256x16x64x256_16x16_16x16_1x1_16x16x1_16x16x1_1x16x1x16_4_1x1_intrawave_v1,40.34,469.44,0.0
256,48,2048,4096,ck,8,0,13.6071,a8w8_blockscale_1x128x128_256x16x64x256_16x16_16x16_1x1_16x16x1_16x16x1_1x16x1x16_4_1x1_intrawave_v1,59.18,645.39,0.0
256,64,2048,128,ck,8,0,3.1326,a8w8_blockscale_1x128x128_256x16x64x256_16x16_16x16_1x1_16x16x1_16x16x1_1x16x1x16_4_1x1_intrawave_v1,10.71,169.98,0.0
256,64,2048,512,ck,8,0,3.5295,a8w8_blockscale_1x128x128_256x16x64x256_16x16_16x16_1x1_16x16x1_16x16x1_1x16x1x16_4_1x1_intrawave_v1,38.03,380.65,0.0
256,64,2048,1024,ck,8,0,4.6314,a8w8_blockscale_1x128x128_256x16x64x256_16x16_16x16_1x1_16x16x1_16x16x1_1x16x1x16_4_1x1_intrawave_v1,57.96,523.56,0.0
256,64,2048,4096,ck,8,0,13.3669,a8w8_blockscale_1x128x128_256x16x64x256_16x16_16x16_1x1_16x16x1_16x16x1_1x16x1x16_4_1x1_intrawave_v1,80.33,666.79,0.0
256,80,2048,128,ck,6,0,2.9586,a8w8_blockscale_1x128x128_256x16x64x128_8x16_16x16_1x1_16x16x1_8x32x1_1x16x1x16_4_1x1_intrawave_v1,14.18,202.82,0.0
256,80,2048,512,ck,8,0,3.5504,a8w8_blockscale_1x128x128_256x16x64x256_16x16_16x16_1x1_16x16x1_16x16x1_1x16x1x16_4_1x1_intrawave_v1,47.25,399.17,0.0
256,80,2048,1024,ck,8,0,4.489,a8w8_blockscale_1x128x128_256x16x64x256_16x16_16x16_1x1_16x16x1_16x16x1_1x16x1x16_4_1x1_intrawave_v1,74.75,558.42,0.0
256,80,2048,4096,ck,8,0,13.3876,a8w8_blockscale_1x128x128_256x16x64x256_16x16_16x16_1x1_16x16x1_16x16x1_1x16x1x16_4_1x1_intrawave_v1,100.26,675.55,0.0
256,96,2048,128,cktile,0,0,2.9622,a8w8_blockscale_cktile_16x128x128_1x4x1_16x16x32_intrawave_0x0x0x0_1,16.99,225.39,0.0
256,96,2048,512,cktile,12,0,3.9245,a8w8_blockscale_cktile_16x128x256_1x4x1_16x16x32_intrawave_0x0x0x0_1,51.3,379.91,0.0
256,96,2048,1024,ck,8,0,4.557,a8w8_blockscale_1x128x128_256x16x64x256_16x16_16x16_1x1_16x16x1_16x16x1_1x16x1x16_4_1x1_intrawave_v1,88.36,568.06,0.0
256,96,2048,4096,ck,8,0,13.3547,a8w8_blockscale_1x128x128_256x16x64x256_16x16_16x16_1x1_16x16x1_16x16x1_1x16x1x16_4_1x1_intrawave_v1,120.6,687.03,0.0
256,112,2048,128,ck,5,0,3.3388,a8w8_blockscale_1x128x128_256x16x128x128_8x16_16x16_1x2_16x16x1_8x32x1_1x16x1x16_8_1x2_intrawave_v1,17.59,220.21,0.0
256,112,2048,512,ck,18,0,4.0131,a8w8_blockscale_1x128x128_256x64x64x256_16x16_32x32_1x1_16x16x1_16x16x1_1x32x1x8_8_1x1_intrawave_v1,58.53,389.89,0.0
256,112,2048,1024,ck,8,0,4.1728,a8w8_blockscale_1x128x128_256x16x64x256_16x16_16x16_1x1_16x16x1_16x16x1_1x16x1x16_4_1x1_intrawave_v1,112.58,640.0,0.0
256,112,2048,4096,ck,8,0,13.3764,a8w8_blockscale_1x128x128_256x16x64x256_16x16_16x16_1x1_16x16x1_16x16x1_1x16x1x16_4_1x1_intrawave_v1,140.47,695.71,0.0
256,128,2048,128,cktile,1,0,3.0088,a8w8_blockscale_cktile_32x128x128_1x4x1_16x16x32_intrawave_0x0x0x0_1,22.3,266.82,0.0
256,128,2048,512,ck,6,0,4.1406,a8w8_blockscale_1x128x128_256x16x64x128_8x16_16x16_1x1_16x16x1_8x32x1_1x16x1x16_4_1x1_intrawave_v1,64.83,395.69,0.0
256,128,2048,1024,ck,8,0,4.9831,a8w8_blockscale_1x128x128_256x16x64x256_16x16_16x16_1x1_16x16x1_16x16x1_1x16x1x16_4_1x1_intrawave_v1,107.74,552.37,0.0
256,128,2048,4096,ck,8,0,13.3137,a8w8_blockscale_1x128x128_256x16x64x256_16x16_16x16_1x1_16x16x1_16x16x1_1x16x1x16_4_1x1_intrawave_v1,161.3,708.83,0.0
256,256,2048,128,cktile,0,0,2.8911,a8w8_blockscale_cktile_16x128x128_1x4x1_16x16x32_intrawave_0x0x0x0_1,46.42,464.7,0.0
256,256,2048,512,ck,8,0,4.1758,a8w8_blockscale_1x128x128_256x16x64x256_16x16_16x16_1x1_16x16x1_16x16x1_1x16x1x16_4_1x1_intrawave_v1,128.57,533.6,0.0
256,256,2048,1024,ck,13,0,6.221,a8w8_blockscale_1x128x128_256x32x64x256_16x16_16x16_2x1_16x16x1_16x16x1_1x32x1x8_8_2x1_intrawave_v1,172.6,547.8,0.0
256,256,2048,4096,ck,18,0,16.2342,a8w8_blockscale_1x128x128_256x64x64x256_16x16_32x32_1x1_16x16x1_16x16x1_1x32x1x8_8_1x1_intrawave_v1,264.56,645.91,0.0
256,512,2048,128,cktile,1,0,3.4334,a8w8_blockscale_cktile_32x128x128_1x4x1_16x16x32_intrawave_0x0x0x0_1,78.18,706.25,0.0
256,512,2048,512,ck,3,0,4.839,a8w8_blockscale_1x128x128_256x64x64x128_16x16_32x32_1x1_8x32x1_8x32x1_1x32x1x8_8_1x1_intrawave_v3,221.89,704.25,0.0
256,512,2048,1024,ck,18,0,7.8908,a8w8_blockscale_1x128x128_256x64x64x256_16x16_32x32_1x1_16x16x1_16x16x1_1x32x1x8_8_1x1_intrawave_v1,272.15,597.99,0.0
256,512,2048,4096,ck,18,0,16.8679,a8w8_blockscale_1x128x128_256x64x64x256_16x16_32x32_1x1_16x16x1_16x16x1_1x32x1x8_8_1x1_intrawave_v1,509.25,745.97,0.0
256,588,2048,128,cktile,0,0,3.5924,a8w8_blockscale_cktile_16x128x128_1x4x1_16x16x32_intrawave_0x0x0x0_1,85.81,764.35,0.0
256,588,2048,1024,ck,2,0,9.6606,a8w8_blockscale_1x128x128_256x64x128x128_16x16_32x32_1x2_8x32x1_8x32x1_1x32x1x8_8_1x1_intrawave_v3,255.29,528.72,0.0
256,667,2048,512,ck,13,0,7.1231,a8w8_blockscale_1x128x128_256x32x64x256_16x16_16x16_2x1_16x16x1_16x16x1_1x32x1x8_8_2x1_intrawave_v1,196.38,578.7,0.0
256,667,2048,4096,ck,2,0,25.4417,a8w8_blockscale_1x128x128_256x64x128x128_16x16_32x32_1x2_8x32x1_8x32x1_1x32x1x8_8_1x1_intrawave_v3,439.84,544.49,0.0
256,671,2048,512,ck,13,0,7.0882,a8w8_blockscale_1x128x128_256x32x64x256_16x16_16x16_2x1_16x16x1_16x16x1_1x32x1x8_8_2x1_intrawave_v1,198.53,584.15,0.0
256,671,2048,4096,ck,2,0,26.0417,a8w8_blockscale_1x128x128_256x64x128x128_16x16_32x32_1x2_8x32x1_8x32x1_1x32x1x8_8_1x1_intrawave_v3,432.29,533.2,0.0
256,773,2048,128,cktile,4,0,4.4858,a8w8_blockscale_cktile_32x128x128_2x2x1_16x16x32_intrawave_0x0x0x0_1,90.35,786.32,0.0
256,773,2048,1024,ck,2,0,9.9835,a8w8_blockscale_1x128x128_256x64x128x128_16x16_32x32_1x2_8x32x1_8x32x1_1x32x1x8_8_1x1_intrawave_v3,324.76,606.49,0.0
256,822,2048,128,cktile,1,0,4.099,a8w8_blockscale_cktile_32x128x128_1x4x1_16x16x32_intrawave_0x0x0x0_1,105.14,911.02,0.0
256,822,2048,1024,ck,2,0,10.0043,a8w8_blockscale_1x128x128_256x64x128x128_16x16_32x32_1x2_8x32x1_8x32x1_1x32x1x8_8_1x1_intrawave_v3,344.62,630.31,0.0
256,931,2048,512,cktile,22,0,7.5228,a8w8_blockscale_cktile_64x128x256_2x2x1_32x32x16_intrawave_0x0x0x0_1,259.54,709.66,0.0
256,931,2048,4096,ck,2,0,26.5584,a8w8_blockscale_1x128x128_256x64x128x128_16x16_32x32_1x2_8x32x1_8x32x1_1x32x1x8_8_1x1_intrawave_v3,588.12,603.02,0.0
256,1024,2048,128,cktile,1,0,4.0335,a8w8_blockscale_cktile_32x128x128_1x4x1_16x16x32_intrawave_0x0x0x0_1,133.1,1137.35,0.0
256,1024,2048,512,ck,2,0,7.3637,a8w8_blockscale_1x128x128_256x64x128x128_16x16_32x32_1x2_8x32x1_8x32x1_1x32x1x8_8_1x1_intrawave_v3,291.63,783.19,0.0
256,1024,2048,1024,ck,2,0,9.9158,a8w8_blockscale_1x128x128_256x64x128x128_16x16_32x32_1x2_8x32x1_8x32x1_1x32x1x8_8_1x1_intrawave_v3,433.14,740.24,0.0
256,1024,2048,4096,ck,2,0,26.014,a8w8_blockscale_1x128x128_256x64x128x128_16x16_32x32_1x2_8x32x1_8x32x1_1x32x1x8_8_1x1_intrawave_v3,660.41,644.93,0.0
256,1025,2048,128,cktile,0,0,5.3514,a8w8_blockscale_cktile_16x128x128_1x4x1_16x16x32_intrawave_0x0x0x0_1,100.42,858.05,0.0
256,1025,2048,512,ck,18,0,8.234,a8w8_blockscale_1x128x128_256x64x64x256_16x16_32x32_1x1_16x16x1_16x16x1_1x32x1x8_8_1x1_intrawave_v1,261.06,700.97,0.0
256,1025,2048,1024,ck,3,0,12.1187,a8w8_blockscale_1x128x128_256x64x64x128_16x16_32x32_1x1_8x32x1_8x32x1_1x32x1x8_8_1x1_intrawave_v3,354.75,606.1,0.0
256,1025,2048,4096,ck,2,0,32.3197,a8w8_blockscale_1x128x128_256x64x128x128_16x16_32x32_1x2_8x32x1_8x32x1_1x32x1x8_8_1x1_intrawave_v3,532.08,519.36,0.0
256,1027,2048,128,ck,6,0,5.7779,a8w8_blockscale_1x128x128_256x16x64x128_8x16_16x16_1x1_16x16x1_8x32x1_1x16x1x16_4_1x1_intrawave_v1,93.19,796.17,0.0
256,1027,2048,512,ck,13,0,8.0114,a8w8_blockscale_1x128x128_256x32x64x256_16x16_16x16_2x1_16x16x1_16x16x1_1x32x1x8_8_2x1_intrawave_v1,268.84,721.6,0.0
256,1027,2048,1024,ck,3,0,12.1154,a8w8_blockscale_1x128x128_256x64x64x128_16x16_32x32_1x1_8x32x1_8x32x1_1x32x1x8_8_1x1_intrawave_v3,355.54,607.11,0.0
256,1027,2048,4096,ck,0,0,32.2797,a8w8_blockscale_1x128x128_256x128x128x128_16x16_32x32_2x2_8x32x1_8x32x1_1x32x1x8_8_1x1_intrawave_v3,533.78,520.51,0.0
256,1031,2048,512,ck,13,0,8.1288,a8w8_blockscale_1x128x128_256x32x64x256_16x16_16x16_2x1_16x16x1_16x16x1_1x32x1x8_8_2x1_intrawave_v1,265.99,713.44,0.0
256,1031,2048,4096,ck,0,0,32.0974,a8w8_blockscale_1x128x128_256x128x128x128_16x16_32x32_2x2_8x32x1_8x32x1_1x32x1x8_8_1x1_intrawave_v3,538.9,524.48,0.0
256,1039,2048,512,ck,13,0,7.9611,a8w8_blockscale_1x128x128_256x32x64x256_16x16_16x16_2x1_16x16x1_16x16x1_1x32x1x8_8_2x1_intrawave_v1,273.7,733.1,0.0
256,1039,2048,4096,ck,0,0,32.0793,a8w8_blockscale_1x128x128_256x128x128x128_16x16_32x32_2x2_8x32x1_8x32x1_1x32x1x8_8_1x1_intrawave_v3,543.39,526.82,0.0
256,1040,2048,512,ck,18,0,8.1809,a8w8_blockscale_1x128x128_256x64x64x256_16x16_32x32_1x1_16x16x1_16x16x1_1x32x1x8_8_1x1_intrawave_v1,266.6,713.97,0.0
256,1040,2048,4096,ck,0,0,32.1318,a8w8_blockscale_1x128x128_256x128x128x128_16x16_32x32_2x2_8x32x1_8x32x1_1x32x1x8_8_1x1_intrawave_v3,543.02,526.22,0.0
256,1041,2048,512,ck,13,0,7.9714,a8w8_blockscale_1x128x128_256x32x64x256_16x16_16x16_2x1_16x16x1_16x16x1_1x32x1x8_8_2x1_intrawave_v1,273.87,733.31,0.0
256,1041,2048,4096,ck,2,0,32.0416,a8w8_blockscale_1x128x128_256x64x128x128_16x16_32x32_1x2_8x32x1_8x32x1_1x32x1x8_8_1x1_intrawave_v3,545.08,527.95,0.0
256,1042,2048,128,cktile,1,0,5.7578,a8w8_blockscale_cktile_32x128x128_1x4x1_16x16x32_intrawave_0x0x0x0_1,94.88,809.95,0.0
256,1042,2048,1024,ck,3,0,12.1334,a8w8_blockscale_1x128x128_256x64x64x128_16x16_32x32_1x1_8x32x1_8x32x1_1x32x1x8_8_1x1_intrawave_v3,360.2,612.54,0.0
256,1051,2048,128,cktile,1,0,5.8374,a8w8_blockscale_cktile_32x128x128_1x4x1_16x16x32_intrawave_0x0x0x0_1,94.4,805.42,0.0
256,1051,2048,1024,ck,3,0,12.1096,a8w8_blockscale_1x128x128_256x64x64x128_16x16_32x32_1x1_8x32x1_8x32x1_1x32x1x8_8_1x1_intrawave_v3,364.03,617.55,0.0
256,1055,2048,128,ck,11,0,5.6731,a8w8_blockscale_1x128x128_256x32x64x128_16x16_16x16_2x1_8x32x1_8x32x1_1x32x1x8_8_2x1_intrawave_v1,97.5,831.73,0.0
256,1055,2048,1024,ck,3,0,12.1987,a8w8_blockscale_1x128x128_256x64x64x128_16x16_32x32_1x1_8x32x1_8x32x1_1x32x1x8_8_1x1_intrawave_v3,362.74,614.72,0.0
256,1057,2048,128,cktile,1,0,5.715,a8w8_blockscale_cktile_32x128x128_1x4x1_16x16x32_intrawave_0x0x0x0_1,96.97,827.11,0.0
256,1057,2048,1024,ck,3,0,12.1397,a8w8_blockscale_1x128x128_256x64x64x128_16x16_32x32_1x1_8x32x1_8x32x1_1x32x1x8_8_1x1_intrawave_v3,365.2,618.55,0.0
256,1069,2048,128,cktile,1,0,5.2842,a8w8_blockscale_cktile_32x128x128_1x4x1_16x16x32_intrawave_0x0x0x0_1,106.06,904.13,0.0
256,1069,2048,1024,ck,3,0,12.286,a8w8_blockscale_1x128x128_256x64x64x128_16x16_32x32_1x1_8x32x1_8x32x1_1x32x1x8_8_1x1_intrawave_v3,364.94,616.18,0.0
256,1072,2048,128,cktile,2,0,5.7194,a8w8_blockscale_cktile_64x128x128_1x4x1_16x16x32_intrawave_0x0x0x0_1,98.27,837.55,0.0
256,1072,2048,512,ck,13,0,8.0893,a8w8_blockscale_1x128x128_256x32x64x256_16x16_16x16_2x1_16x16x1_16x16x1_1x32x1x8_8_2x1_intrawave_v1,277.92,740.28,0.0
256,1072,2048,1024,ck,3,0,12.1523,a8w8_blockscale_1x128x128_256x64x64x128_16x16_32x32_1x1_8x32x1_8x32x1_1x32x1x8_8_1x1_intrawave_v3,370.0,624.23,0.0
256,1072,2048,4096,ck,0,0,32.2706,a8w8_blockscale_1x128x128_256x128x128x128_16x16_32x32_2x2_8x32x1_8x32x1_1x32x1x8_8_1x1_intrawave_v3,557.32,532.08,0.0
256,1073,2048,512,ck,13,0,8.0791,a8w8_blockscale_1x128x128_256x32x64x256_16x16_16x16_2x1_16x16x1_16x16x1_1x32x1x8_8_2x1_intrawave_v1,278.53,741.79,0.0
256,1073,2048,4096,ck,0,0,32.2335,a8w8_blockscale_1x128x128_256x128x128x128_16x16_32x32_2x2_8x32x1_8x32x1_1x32x1x8_8_1x1_intrawave_v3,558.49,532.94,0.0
256,1074,2048,128,cktile,7,0,5.6931,a8w8_blockscale_cktile_32x128x128_1x4x1_32x32x16_intrawave_0x0x0x0_1,98.91,842.9,0.0
256,1074,2048,1024,ck,3,0,12.204,a8w8_blockscale_1x128x128_256x64x64x128_16x16_32x32_1x1_8x32x1_8x32x1_1x32x1x8_8_1x1_intrawave_v3,369.12,622.42,0.0
256,1077,2048,512,ck,13,0,8.0491,a8w8_blockscale_1x128x128_256x32x64x256_16x16_16x16_2x1_16x16x1_16x16x1_1x32x1x8_8_2x1_intrawave_v1,280.61,746.84,0.0
256,1077,2048,4096,ck,2,0,32.231,a8w8_blockscale_1x128x128_256x64x128x128_16x16_32x32_1x2_8x32x1_8x32x1_1x32x1x8_8_1x1_intrawave_v3,560.61,534.0,0.0
256,1091,2048,128,cktile,11,0,5.8344,a8w8_blockscale_cktile_128x128x128_2x2x1_32x32x16_intrawave_0x0x0x0_1,98.04,834.8,0.0
256,1091,2048,512,ck,13,0,8.1807,a8w8_blockscale_1x128x128_256x32x64x256_16x16_16x16_2x1_16x16x1_16x16x1_1x32x1x8_8_2x1_intrawave_v1,279.68,742.71,0.0
256,1091,2048,1024,ck,3,0,12.089,a8w8_blockscale_1x128x128_256x64x64x128_16x16_32x32_1x1_8x32x1_8x32x1_1x32x1x8_8_1x1_intrawave_v3,378.52,635.54,0.0
256,1091,2048,4096,ck,0,0,32.4443,a8w8_blockscale_1x128x128_256x128x128x128_16x16_32x32_2x2_8x32x1_8x32x1_1x32x1x8_8_1x1_intrawave_v3,564.17,534.03,0.0
256,1128,2048,128,cktile,10,0,5.8427,a8w8_blockscale_cktile_64x128x128_2x2x1_32x32x16_intrawave_0x0x0x0_1,101.22,860.36,0.0
256,1128,2048,1024,ck,3,0,12.0851,a8w8_blockscale_1x128x128_256x64x64x128_16x16_32x32_1x1_8x32x1_8x32x1_1x32x1x8_8_1x1_intrawave_v3,391.49,651.42,0.0
256,1136,2048,128,cktile,10,0,5.7378,a8w8_blockscale_cktile_64x128x128_2x2x1_32x32x16_intrawave_0x0x0x0_1,103.8,881.98,0.0
256,1136,2048,1024,ck,3,0,12.0684,a8w8_blockscale_1x128x128_256x64x64x128_16x16_32x32_1x1_8x32x1_8x32x1_1x32x1x8_8_1x1_intrawave_v3,394.81,655.72,0.0
256,1343,2048,512,ck,18,0,8.4358,a8w8_blockscale_1x128x128_256x64x64x256_16x16_32x32_1x1_16x16x1_16x16x1_1x32x1x8_8_1x1_intrawave_v1,333.87,857.91,0.0
256,1343,2048,4096,ck,0,0,32.6637,a8w8_blockscale_1x128x128_256x128x128x128_16x16_32x32_2x2_8x32x1_8x32x1_1x32x1x8_8_1x1_intrawave_v3,689.81,593.64,0.0
256,1514,2048,128,cktile,10,0,6.1182,a8w8_blockscale_cktile_64x128x128_2x2x1_32x32x16_intrawave_0x0x0x0_1,129.74,1088.11,0.0
256,1514,2048,1024,ck,3,0,13.0956,a8w8_blockscale_1x128x128_256x64x64x128_16x16_32x32_1x1_8x32x1_8x32x1_1x32x1x8_8_1x1_intrawave_v3,484.91,752.07,0.0
256,1688,2048,512,ck,18,0,10.1551,a8w8_blockscale_1x128x128_256x64x64x256_16x16_32x32_1x1_16x16x1_16x16x1_1x32x1x8_8_1x1_intrawave_v1,348.59,869.21,0.0
256,1688,2048,4096,ck,0,0,33.6369,a8w8_blockscale_1x128x128_256x128x128x128_16x16_32x32_2x2_8x32x1_8x32x1_1x32x1x8_8_1x1_intrawave_v3,841.93,660.49,0.0
256,2017,2048,128,cktile,1,0,6.0211,a8w8_blockscale_cktile_32x128x128_1x4x1_16x16x32_intrawave_0x0x0x0_1,175.63,1458.53,0.0
256,2017,2048,512,ck,18,0,10.489,a8w8_blockscale_1x128x128_256x64x64x256_16x16_32x32_1x1_16x16x1_16x16x1_1x32x1x8_8_1x1_intrawave_v1,403.28,986.07,0.0
256,2017,2048,1024,ck,0,0,14.2755,a8w8_blockscale_1x128x128_256x128x128x128_16x16_32x32_2x2_8x32x1_8x32x1_1x32x1x8_8_1x1_intrawave_v3,592.62,870.32,0.0
256,2017,2048,4096,ck,0,0,35.2982,a8w8_blockscale_1x128x128_256x128x128x128_16x16_32x32_2x2_8x32x1_8x32x1_1x32x1x8_8_1x1_intrawave_v3,958.68,705.75,0.0
256,2048,2048,128,cktile,1,0,6.5178,a8w8_blockscale_cktile_32x128x128_1x4x1_16x16x32_intrawave_0x0x0x0_1,164.74,1367.47,0.0
256,2048,2048,512,ck,0,0,10.3677,a8w8_blockscale_1x128x128_256x128x128x128_16x16_32x32_2x2_8x32x1_8x32x1_1x32x1x8_8_1x1_intrawave_v3,414.26,1011.39,0.0
256,2048,2048,1024,ck,0,0,13.8459,a8w8_blockscale_1x128x128_256x128x128x128_16x16_32x32_2x2_8x32x1_8x32x1_1x32x1x8_8_1x1_intrawave_v3,620.4,908.78,0.0
256,2048,2048,4096,ck,0,0,34.0678,a8w8_blockscale_1x128x128_256x128x128x128_16x16_32x32_2x2_8x32x1_8x32x1_1x32x1x8_8_1x1_intrawave_v3,1008.57,738.7,0.0
256,2050,2048,512,ck,18,0,11.804,a8w8_blockscale_1x128x128_256x64x64x256_16x16_32x32_1x1_16x16x1_16x16x1_1x32x1x8_8_1x1_intrawave_v1,364.21,889.1,0.0
256,2050,2048,4096,ck,2,0,48.3435,a8w8_blockscale_1x128x128_256x64x128x128_16x16_32x32_1x2_8x32x1_8x32x1_1x32x1x8_8_1x1_intrawave_v3,711.44,520.9,0.0
256,2063,2048,512,ck,18,0,11.8854,a8w8_blockscale_1x128x128_256x64x64x256_16x16_32x32_1x1_16x16x1_16x16x1_1x32x1x8_8_1x1_intrawave_v1,364.01,888.05,0.0
256,2063,2048,4096,ck,2,0,48.2097,a8w8_blockscale_1x128x128_256x64x128x128_16x16_32x32_1x2_8x32x1_8x32x1_1x32x1x8_8_1x1_intrawave_v3,717.93,524.56,0.0
256,2064,2048,512,ck,18,0,11.7628,a8w8_blockscale_1x128x128_256x64x64x256_16x16_32x32_1x1_16x16x1_16x16x1_1x32x1x8_8_1x1_intrawave_v1,367.98,897.7,0.0
256,2064,2048,4096,ck,2,0,48.9726,a8w8_blockscale_1x128x128_256x64x128x128_16x16_32x32_1x2_8x32x1_8x32x1_1x32x1x8_8_1x1_intrawave_v3,707.09,516.55,0.0
256,2099,2048,512,ck,18,0,11.8565,a8w8_blockscale_1x128x128_256x64x64x256_16x16_32x32_1x1_16x16x1_16x16x1_1x32x1x8_8_1x1_intrawave_v1,371.27,904.21,0.0
256,2099,2048,4096,ck,2,0,48.5218,a8w8_blockscale_1x128x128_256x64x128x128_16x16_32x32_1x2_8x32x1_8x32x1_1x32x1x8_8_1x1_intrawave_v3,725.76,527.26,0.0
256,2151,2048,128,cktile,1,0,6.5648,a8w8_blockscale_cktile_32x128x128_1x4x1_16x16x32_intrawave_0x0x0x0_1,171.79,1423.95,0.0
256,2151,2048,1024,ck,2,0,18.7035,a8w8_blockscale_1x128x128_256x64x128x128_16x16_32x32_1x2_8x32x1_8x32x1_1x32x1x8_8_1x1_intrawave_v3,482.37,700.95,0.0
256,2159,2048,512,ck,18,0,11.8473,a8w8_blockscale_1x128x128_256x64x64x256_16x16_32x32_1x1_16x16x1_16x16x1_1x32x1x8_8_1x1_intrawave_v1,382.18,928.25,0.0
256,2159,2048,4096,ck,0,0,49.1111,a8w8_blockscale_1x128x128_256x128x128x128_16x16_32x32_2x2_8x32x1_8x32x1_1x32x1x8_8_1x1_intrawave_v3,737.55,530.94,0.0
256,2160,2048,512,ck,18,0,11.8105,a8w8_blockscale_1x128x128_256x64x64x256_16x16_32x32_1x1_16x16x1_16x16x1_1x32x1x8_8_1x1_intrawave_v1,383.54,931.53,0.0
256,2160,2048,4096,ck,2,0,49.4067,a8w8_blockscale_1x128x128_256x64x128x128_16x16_32x32_1x2_8x32x1_8x32x1_1x32x1x8_8_1x1_intrawave_v3,733.48,527.93,0.0
256,2313,2048,512,ck,18,0,12.0892,a8w8_blockscale_1x128x128_256x64x64x256_16x16_32x32_1x1_16x16x1_16x16x1_1x32x1x8_8_1x1_intrawave_v1,401.24,968.38,0.0
256,2313,2048,4096,ck,0,0,49.1598,a8w8_blockscale_1x128x128_256x128x128x128_16x16_32x32_2x2_8x32x1_8x32x1_1x32x1x8_8_1x1_intrawave_v3,789.38,556.08,0.0
256,2325,2048,512,ck,18,0,12.1146,a8w8_blockscale_1x128x128_256x64x64x256_16x16_32x32_1x1_16x16x1_16x16x1_1x32x1x8_8_1x1_intrawave_v1,402.48,970.91,0.0
256,2325,2048,4096,ck,2,0,49.2382,a8w8_blockscale_1x128x128_256x64x128x128_16x16_32x32_1x2_8x32x1_8x32x1_1x32x1x8_8_1x1_intrawave_v3,792.21,557.19,0.0
256,2332,2048,128,cktile,10,0,6.8496,a8w8_blockscale_cktile_64x128x128_2x2x1_32x32x16_intrawave_0x0x0x0_1,178.5,1476.37,0.0
256,2332,2048,1024,ck,2,0,18.7283,a8w8_blockscale_1x128x128_256x64x128x128_16x16_32x32_1x2_8x32x1_8x32x1_1x32x1x8_8_1x1_intrawave_v3,522.26,749.51,0.0
256,2341,2048,128,cktile,4,0,6.7582,a8w8_blockscale_cktile_32x128x128_2x2x1_16x16x32_intrawave_0x0x0x0_1,181.61,1501.96,0.0
256,2341,2048,1024,ck,2,0,18.6995,a8w8_blockscale_1x128x128_256x64x128x128_16x16_32x32_1x2_8x32x1_8x32x1_1x32x1x8_8_1x1_intrawave_v3,525.09,753.13,0.0
256,3072,2048,128,cktile,5,0,7.4774,a8w8_blockscale_cktile_64x128x128_2x2x1_16x16x32_intrawave_0x0x0x0_1,215.4,1770.44,0.0
256,3072,2048,512,ck,18,0,13.7962,a8w8_blockscale_1x128x128_256x64x64x256_16x16_32x32_1x1_16x16x1_16x16x1_1x32x1x8_8_1x1_intrawave_v1,466.97,1102.07,0.0
256,3072,2048,1024,ck,2,0,19.6077,a8w8_blockscale_1x128x128_256x64x128x128_16x16_32x32_1x2_8x32x1_8x32x1_1x32x1x8_8_1x1_intrawave_v3,657.13,909.12,0.0
256,3072,2048,4096,ck,0,0,50.8426,a8w8_blockscale_1x128x128_256x128x128x128_16x16_32x32_2x2_8x32x1_8x32x1_1x32x1x8_8_1x1_intrawave_v3,1013.71,659.97,0.0
256,3073,2048,128,cktile,5,0,7.9199,a8w8_blockscale_cktile_64x128x128_2x2x1_16x16x32_intrawave_0x0x0x0_1,203.43,1672.05,0.0
256,3073,2048,512,ck,18,0,15.3406,a8w8_blockscale_1x128x128_256x64x64x256_16x16_32x32_1x1_16x16x1_16x16x1_1x32x1x8_8_1x1_intrawave_v1,420.1,991.42,0.0
256,3073,2048,1024,ck,0,0,21.242,a8w8_blockscale_1x128x128_256x128x128x128_16x16_32x32_2x2_8x32x1_8x32x1_1x32x1x8_8_1x1_intrawave_v3,606.77,839.42,0.0
256,3073,2048,4096,ck,0,0,52.9814,a8w8_blockscale_1x128x128_256x128x128x128_16x16_32x32_2x2_8x32x1_8x32x1_1x32x1x8_8_1x1_intrawave_v3,973.1,633.48,0.0
256,3089,2048,128,cktile,5,0,7.8448,a8w8_blockscale_cktile_64x128x128_2x2x1_16x16x32_intrawave_0x0x0x0_1,206.45,1696.68,0.0
256,3089,2048,1024,ck,0,0,21.3379,a8w8_blockscale_1x128x128_256x128x128x128_16x16_32x32_2x2_8x32x1_8x32x1_1x32x1x8_8_1x1_intrawave_v3,607.19,839.48,0.0
256,3110,2048,128,cktile,5,0,7.9793,a8w8_blockscale_cktile_64x128x128_2x2x1_16x16x32_intrawave_0x0x0x0_1,204.35,1679.19,0.0
256,3110,2048,1024,ck,0,0,21.2329,a8w8_blockscale_1x128x128_256x128x128x128_16x16_32x32_2x2_8x32x1_8x32x1_1x32x1x8_8_1x1_intrawave_v3,614.34,848.7,0.0
256,3137,2048,128,cktile,5,0,8.0738,a8w8_blockscale_cktile_64x128x128_2x2x1_16x16x32_intrawave_0x0x0x0_1,203.71,1673.66,0.0
256,3137,2048,1024,ck,0,0,21.2728,a8w8_blockscale_1x128x128_256x128x128x128_16x16_32x32_2x2_8x32x1_8x32x1_1x32x1x8_8_1x1_intrawave_v3,618.51,853.61,0.0
256,3182,2048,512,ck,18,0,15.3668,a8w8_blockscale_1x128x128_256x64x64x256_16x16_32x32_1x1_16x16x1_16x16x1_1x32x1x8_8_1x1_intrawave_v1,434.26,1022.41,0.0
256,3182,2048,4096,ck,0,0,53.0261,a8w8_blockscale_1x128x128_256x128x128x128_16x16_32x32_2x2_8x32x1_8x32x1_1x32x1x8_8_1x1_intrawave_v3,1006.77,649.78,0.0
256,3183,2048,512,ck,18,0,15.3313,a8w8_blockscale_1x128x128_256x64x64x256_16x16_32x32_1x1_16x16x1_16x16x1_1x32x1x8_8_1x1_intrawave_v1,435.4,1025.08,0.0
256,3183,2048,4096,ck,0,0,53.2662,a8w8_blockscale_1x128x128_256x128x128x128_16x16_32x32_2x2_8x32x1_8x32x1_1x32x1x8_8_1x1_intrawave_v3,1002.55,647.01,0.0
256,3613,2048,128,cktile,5,0,8.5555,a8w8_blockscale_cktile_64x128x128_2x2x1_16x16x32_intrawave_0x0x0x0_1,221.41,1814.44,0.0
256,3613,2048,1024,ck,0,0,21.7937,a8w8_blockscale_1x128x128_256x128x128x128_16x16_32x32_2x2_8x32x1_8x32x1_1x32x1x8_8_1x1_intrawave_v3,695.34,945.03,0.0
256,3847,2048,512,ck,0,0,16.7971,a8w8_blockscale_1x128x128_256x128x128x128_16x16_32x32_2x2_8x32x1_8x32x1_1x32x1x8_8_1x1_intrawave_v3,480.31,1117.79,0.0
256,3847,2048,4096,ck,0,0,59.0015,a8w8_blockscale_1x128x128_256x128x128x128_16x16_32x32_2x2_8x32x1_8x32x1_1x32x1x8_8_1x1_intrawave_v3,1093.9,676.31,0.0
256,4096,2048,128,cktile,5,0,8.8613,a8w8_blockscale_cktile_64x128x128_2x2x1_16x16x32_intrawave_0x0x0x0_1,242.34,1982.06,0.0
256,4096,2048,512,ck,18,0,16.9925,a8w8_blockscale_1x128x128_256x64x64x256_16x16_32x32_1x1_16x16x1_16x16x1_1x32x1x8_8_1x1_intrawave_v1,505.51,1172.46,0.0
256,4096,2048,1024,ck,0,0,22.5703,a8w8_blockscale_1x128x128_256x128x128x128_16x16_32x32_2x2_8x32x1_8x32x1_1x32x1x8_8_1x1_intrawave_v3,761.17,1022.08,0.0
256,4096,2048,4096,ck,0,0,58.3498,a8w8_blockscale_1x128x128_256x128x128x128_16x16_32x32_2x2_8x32x1_8x32x1_1x32x1x8_8_1x1_intrawave_v3,1177.72,718.82,0.0
256,4097,2048,128,cktile,10,0,9.4603,a8w8_blockscale_cktile_64x128x128_2x2x1_32x32x16_intrawave_0x0x0x0_1,227.05,1857.01,0.0
256,4097,2048,1024,ck,2,0,28.2256,a8w8_blockscale_1x128x128_256x64x128x128_16x16_32x32_1x2_8x32x1_8x32x1_1x32x1x8_8_1x1_intrawave_v3,608.81,817.48,0.0
256,4109,2048,128,cktile,5,0,9.4694,a8w8_blockscale_cktile_64x128x128_2x2x1_16x16x32_intrawave_0x0x0x0_1,227.5,1860.58,0.0
256,4109,2048,1024,ck,2,0,28.433,a8w8_blockscale_1x128x128_256x64x128x128_16x16_32x32_1x2_8x32x1_8x32x1_1x32x1x8_8_1x1_intrawave_v3,606.14,813.68,0.0
256,4111,2048,512,ck,18,0,18.4416,a8w8_blockscale_1x128x128_256x64x64x256_16x16_32x32_1x1_16x16x1_16x16x1_1x32x1x8_8_1x1_intrawave_v1,467.5,1084.07,0.0
256,4111,2048,4096,ck,0,0,77.4206,a8w8_blockscale_1x128x128_256x128x128x128_16x16_32x32_2x2_8x32x1_8x32x1_1x32x1x8_8_1x1_intrawave_v3,890.86,543.34,0.0
256,4141,2048,512,ck,18,0,18.3501,a8w8_blockscale_1x128x128_256x64x64x256_16x16_32x32_1x1_16x16x1_16x16x1_1x32x1x8_8_1x1_intrawave_v1,473.26,1097.01,0.0
256,4141,2048,4096,ck,0,0,76.9304,a8w8_blockscale_1x128x128_256x128x128x128_16x16_32x32_2x2_8x32x1_8x32x1_1x32x1x8_8_1x1_intrawave_v3,903.08,550.0,0.0
256,4142,2048,512,ck,18,0,18.302,a8w8_blockscale_1x128x128_256x64x64x256_16x16_32x32_1x1_16x16x1_16x16x1_1x32x1x8_8_1x1_intrawave_v1,474.61,1100.15,0.0
256,4142,2048,4096,ck,0,0,77.4893,a8w8_blockscale_1x128x128_256x128x128x128_16x16_32x32_2x2_8x32x1_8x32x1_1x32x1x8_8_1x1_intrawave_v3,896.78,546.14,0.0
256,4143,2048,128,cktile,5,0,9.5804,a8w8_blockscale_cktile_64x128x128_2x2x1_16x16x32_intrawave_0x0x0x0_1,226.73,1854.01,0.0
256,4143,2048,1024,ck,2,0,28.5408,a8w8_blockscale_1x128x128_256x64x128x128_16x16_32x32_1x2_8x32x1_8x32x1_1x32x1x8_8_1x1_intrawave_v3,608.85,816.7,0.0
256,4345,2048,128,cktile,5,0,9.5441,a8w8_blockscale_cktile_64x128x128_2x2x1_16x16x32_intrawave_0x0x0x0_1,238.68,1950.46,0.0
256,4345,2048,512,ck,18,0,18.6571,a8w8_blockscale_1x128x128_256x64x64x256_16x16_32x32_1x1_16x16x1_16x16x1_1x32x1x8_8_1x1_intrawave_v1,488.4,1129.35,0.0
256,4345,2048,1024,ck,2,0,28.3782,a8w8_blockscale_1x128x128_256x64x128x128_16x16_32x32_1x2_8x32x1_8x32x1_1x32x1x8_8_1x1_intrawave_v3,642.19,857.83,0.0
256,4345,2048,4096,ck,0,0,78.0232,a8w8_blockscale_1x128x128_256x128x128x128_16x16_32x32_2x2_8x32x1_8x32x1_1x32x1x8_8_1x1_intrawave_v3,934.3,563.71,0.0
256,4413,2048,128,cktile,5,0,9.582,a8w8_blockscale_cktile_64x128x128_2x2x1_16x16x32_intrawave_0x0x0x0_1,241.46,1972.73,0.0
256,4413,2048,1024,ck,2,0,28.5023,a8w8_blockscale_1x128x128_256x64x128x128_16x16_32x32_1x2_8x32x1_8x32x1_1x32x1x8_8_1x1_intrawave_v3,649.4,866.31,0.0
256,5105,2048,512,ck,18,0,20.5486,a8w8_blockscale_1x128x128_256x64x64x256_16x16_32x32_1x1_16x16x1_16x16x1_1x32x1x8_8_1x1_intrawave_v1,521.01,1195.82,0.0
256,5105,2048,4096,ck,0,0,80.848,a8w8_blockscale_1x128x128_256x128x128x128_16x16_32x32_2x2_8x32x1_8x32x1_1x32x1x8_8_1x1_intrawave_v3,1059.37,621.03,0.0
256,5121,2048,128,cktile,5,0,10.3268,a8w8_blockscale_cktile_64x128x128_2x2x1_16x16x32_intrawave_0x0x0x0_1,259.99,2120.04,0.0
256,5121,2048,512,ck,18,0,21.5232,a8w8_blockscale_1x128x128_256x64x64x256_16x16_32x32_1x1_16x16x1_16x16x1_1x32x1x8_8_1x1_intrawave_v1,498.97,1145.1,0.0
256,5121,2048,1024,ck,0,0,30.2783,a8w8_blockscale_1x128x128_256x128x128x128_16x16_32x32_2x2_8x32x1_8x32x1_1x32x1x8_8_1x1_intrawave_v3,709.39,935.21,0.0
256,5121,2048,4096,ck,0,0,80.5796,a8w8_blockscale_1x128x128_256x128x128x128_16x16_32x32_2x2_8x32x1_8x32x1_1x32x1x8_8_1x1_intrawave_v3,1066.23,624.72,0.0
256,5123,2048,128,cktile,5,0,10.468,a8w8_blockscale_cktile_64x128x128_2x2x1_16x16x32_intrawave_0x0x0x0_1,256.58,2092.25,0.0
256,5123,2048,512,ck,18,0,21.4362,a8w8_blockscale_1x128x128_256x64x64x256_16x16_32x32_1x1_16x16x1_16x16x1_1x32x1x8_8_1x1_intrawave_v1,501.19,1150.17,0.0
256,5123,2048,1024,ck,0,0,30.0652,a8w8_blockscale_1x128x128_256x128x128x128_16x16_32x32_2x2_8x32x1_8x32x1_1x32x1x8_8_1x1_intrawave_v3,714.69,942.18,0.0
256,5123,2048,4096,ck,0,0,80.6796,a8w8_blockscale_1x128x128_256x128x128x128_16x16_32x32_2x2_8x32x1_8x32x1_1x32x1x8_8_1x1_intrawave_v3,1065.32,624.15,0.0
256,5131,2048,512,ck,18,0,21.541,a8w8_blockscale_1x128x128_256x64x64x256_16x16_32x32_1x1_16x16x1_16x16x1_1x32x1x8_8_1x1_intrawave_v1,499.54,1146.29,0.0
256,5131,2048,4096,ck,0,0,80.9396,a8w8_blockscale_1x128x128_256x128x128x128_16x16_32x32_2x2_8x32x1_8x32x1_1x32x1x8_8_1x1_intrawave_v3,1063.56,622.96,0.0
256,5133,2048,128,cktile,5,0,10.3524,a8w8_blockscale_cktile_64x128x128_2x2x1_16x16x32_intrawave_0x0x0x0_1,259.96,2119.7,0.0
256,5133,2048,1024,ck,0,0,30.4986,a8w8_blockscale_1x128x128_256x128x128x128_16x16_32x32_2x2_8x32x1_8x32x1_1x32x1x8_8_1x1_intrawave_v3,705.91,930.47,0.0
256,5185,2048,128,cktile,5,0,10.5498,a8w8_blockscale_cktile_64x128x128_2x2x1_16x16x32_intrawave_0x0x0x0_1,257.68,2100.85,0.0
256,5185,2048,1024,ck,0,0,30.4532,a8w8_blockscale_1x128x128_256x128x128x128_16x16_32x32_2x2_8x32x1_8x32x1_1x32x1x8_8_1x1_intrawave_v3,714.13,940.6,0.0
256,5191,2048,128,cktile,5,0,10.4643,a8w8_blockscale_cktile_64x128x128_2x2x1_16x16x32_intrawave_0x0x0x0_1,260.08,2120.44,0.0
256,5191,2048,1024,ck,0,0,30.2259,a8w8_blockscale_1x128x128_256x128x128x128_16x16_32x32_2x2_8x32x1_8x32x1_1x32x1x8_8_1x1_intrawave_v3,720.33,948.69,0.0
256,5427,2048,512,ck,18,0,21.6992,a8w8_blockscale_1x128x128_256x64x64x256_16x16_32x32_1x1_16x16x1_16x16x1_1x32x1x8_8_1x1_intrawave_v1,524.5,1200.79,0.0
256,5427,2048,4096,ck,0,0,83.1948,a8w8_blockscale_1x128x128_256x128x128x128_16x16_32x32_2x2_8x32x1_8x32x1_1x32x1x8_8_1x1_intrawave_v3,1094.42,635.22,0.0
256,6113,2048,512,ck,0,0,22.9263,a8w8_blockscale_1x128x128_256x128x128x128_16x16_32x32_2x2_8x32x1_8x32x1_1x32x1x8_8_1x1_intrawave_v3,559.18,1274.4,0.0
256,6113,2048,4096,ck,0,0,88.3985,a8w8_blockscale_1x128x128_256x128x128x128_16x16_32x32_2x2_8x32x1_8x32x1_1x32x1x8_8_1x1_intrawave_v3,1160.19,661.39,0.0
256,6146,2048,128,cktile,5,0,11.3117,a8w8_blockscale_cktile_64x128x128_2x2x1_16x16x32_intrawave_0x0x0x0_1,284.86,2318.21,0.0
256,6146,2048,1024,ck,0,0,37.4634,a8w8_blockscale_1x128x128_256x128x128x128_16x16_32x32_2x2_8x32x1_8x32x1_1x32x1x8_8_1x1_intrawave_v3,688.09,895.93,0.0
256,6147,2048,128,cktile,5,0,11.3842,a8w8_blockscale_cktile_64x128x128_2x2x1_16x16x32_intrawave_0x0x0x0_1,283.09,2303.81,0.0
256,6147,2048,1024,ck,0,0,37.4826,a8w8_blockscale_1x128x128_256x128x128x128_16x16_32x32_2x2_8x32x1_8x32x1_1x32x1x8_8_1x1_intrawave_v3,687.85,895.61,0.0
256,6155,2048,128,cktile,5,0,11.3801,a8w8_blockscale_cktile_64x128x128_2x2x1_16x16x32_intrawave_0x0x0x0_1,283.56,2307.61,0.0
256,6155,2048,1024,ck,0,0,37.6373,a8w8_blockscale_1x128x128_256x128x128x128_16x16_32x32_2x2_8x32x1_8x32x1_1x32x1x8_8_1x1_intrawave_v3,685.91,893.02,0.0
256,6197,2048,512,ck,18,0,24.3953,a8w8_blockscale_1x128x128_256x64x64x256_16x16_32x32_1x1_16x16x1_16x16x1_1x32x1x8_8_1x1_intrawave_v1,532.73,1213.53,0.0
256,6197,2048,4096,ck,0,0,99.6676,a8w8_blockscale_1x128x128_256x128x128x128_16x16_32x32_2x2_8x32x1_8x32x1_1x32x1x8_8_1x1_intrawave_v3,1043.15,593.52,0.0
256,6377,2048,128,cktile,5,0,11.4689,a8w8_blockscale_cktile_64x128x128_2x2x1_16x16x32_intrawave_0x0x0x0_1,291.52,2371.51,0.0
256,6377,2048,1024,ck,0,0,37.6526,a8w8_blockscale_1x128x128_256x128x128x128_16x16_32x32_2x2_8x32x1_8x32x1_1x32x1x8_8_1x1_intrawave_v3,710.36,922.84,0.0
256,6401,2048,128,cktile,5,0,11.4684,a8w8_blockscale_cktile_64x128x128_2x2x1_16x16x32_intrawave_0x0x0x0_1,292.63,2380.45,0.0
256,6401,2048,1024,ck,0,0,37.7933,a8w8_blockscale_1x128x128_256x128x128x128_16x16_32x32_2x2_8x32x1_8x32x1_1x32x1x8_8_1x1_intrawave_v3,710.38,922.66,0.0
256,6409,2048,512,ck,18,0,24.8416,a8w8_blockscale_1x128x128_256x64x64x256_16x16_32x32_1x1_16x16x1_16x16x1_1x32x1x8_8_1x1_intrawave_v1,541.05,1231.05,0.0
256,6409,2048,4096,ck,0,0,100.3046,a8w8_blockscale_1x128x128_256x128x128x128_16x16_32x32_2x2_8x32x1_8x32x1_1x32x1x8_8_1x1_intrawave_v3,1071.99,607.06,0.0
256,7121,2048,128,cktile,5,0,11.7092,a8w8_blockscale_cktile_64x128x128_2x2x1_16x16x32_intrawave_0x0x0x0_1,318.85,2591.23,0.0
256,7121,2048,512,ck,18,0,26.9612,a8w8_blockscale_1x128x128_256x64x64x256_16x16_32x32_1x1_16x16x1_16x16x1_1x32x1x8_8_1x1_intrawave_v1,553.9,1255.96,0.0
256,7121,2048,1024,ck,0,0,38.8094,a8w8_blockscale_1x128x128_256x128x128x128_16x16_32x32_2x2_8x32x1_8x32x1_1x32x1x8_8_1x1_intrawave_v3,769.6,993.49,0.0
256,7121,2048,4096,ck,0,0,104.0254,a8w8_blockscale_1x128x128_256x128x128x128_16x16_32x32_2x2_8x32x1_8x32x1_1x32x1x8_8_1x1_intrawave_v3,1148.47,641.42,0.0
256,7168,2048,512,ck,18,0,26.3415,a8w8_blockscale_1x128x128_256x64x64x256_16x16_32x32_1x1_16x16x1_16x16x1_1x32x1x8_8_1x1_intrawave_v1,570.67,1293.73,0.0
256,7168,2048,4096,ck,0,0,100.4594,a8w8_blockscale_1x128x128_256x128x128x128_16x16_32x32_2x2_8x32x1_8x32x1_1x32x1x8_8_1x1_intrawave_v3,1197.09,668.02,0.0
256,7169,2048,128,cktile,5,0,12.213,a8w8_blockscale_cktile_64x128x128_2x2x1_16x16x32_intrawave_0x0x0x0_1,307.76,2500.94,0.0
256,7169,2048,512,ck,18,0,27.7376,a8w8_blockscale_1x128x128_256x64x64x256_16x16_32x32_1x1_16x16x1_16x16x1_1x32x1x8_8_1x1_intrawave_v1,542.03,1228.78,0.0
256,7169,2048,1024,ck,0,0,38.5915,a8w8_blockscale_1x128x128_256x128x128x128_16x16_32x32_2x2_8x32x1_8x32x1_1x32x1x8_8_1x1_intrawave_v3,779.16,1005.47,0.0
256,7169,2048,4096,ck,0,0,105.3834,a8w8_blockscale_1x128x128_256x128x128x128_16x16_32x32_2x2_8x32x1_8x32x1_1x32x1x8_8_1x1_intrawave_v3,1141.32,636.88,0.0
256,7170,2048,128,cktile,5,0,12.3603,a8w8_blockscale_cktile_64x128x128_2x2x1_16x16x32_intrawave_0x0x0x0_1,304.13,2471.48,0.0
256,7170,2048,1024,ck,0,0,38.9379,a8w8_blockscale_1x128x128_256x128x128x128_16x16_32x32_2x2_8x32x1_8x32x1_1x32x1x8_8_1x1_intrawave_v3,772.34,996.65,0.0
256,7172,2048,512,ck,18,0,27.9688,a8w8_blockscale_1x128x128_256x64x64x256_16x16_32x32_1x1_16x16x1_16x16x1_1x32x1x8_8_1x1_intrawave_v1,537.77,1219.11,0.0
256,7172,2048,4096,ck,0,0,106.4906,a8w8_blockscale_1x128x128_256x128x128x128_16x16_32x32_2x2_8x32x1_8x32x1_1x32x1x8_8_1x1_intrawave_v3,1129.92,630.49,0.0
256,7176,2048,128,cktile,5,0,12.3183,a8w8_blockscale_cktile_64x128x128_2x2x1_16x16x32_intrawave_0x0x0x0_1,305.42,2481.96,0.0
256,7176,2048,512,ck,18,0,27.7029,a8w8_blockscale_1x128x128_256x64x64x256_16x16_32x32_1x1_16x16x1_16x16x1_1x32x1x8_8_1x1_intrawave_v1,543.23,1231.48,0.0
256,7176,2048,1024,ck,0,0,38.6481,a8w8_blockscale_1x128x128_256x128x128x128_16x16_32x32_2x2_8x32x1_8x32x1_1x32x1x8_8_1x1_intrawave_v3,778.78,1004.92,0.0
256,7176,2048,4096,ck,0,0,104.6122,a8w8_blockscale_1x128x128_256x128x128x128_16x16_32x32_2x2_8x32x1_8x32x1_1x32x1x8_8_1x1_intrawave_v3,1150.85,642.13,0.0
256,7177,2048,128,cktile,5,0,12.3573,a8w8_blockscale_cktile_64x128x128_2x2x1_16x16x32_intrawave_0x0x0x0_1,304.5,2474.47,0.0
256,7177,2048,512,ck,18,0,27.967,a8w8_blockscale_1x128x128_256x64x64x256_16x16_32x32_1x1_16x16x1_16x16x1_1x32x1x8_8_1x1_intrawave_v1,538.18,1220.02,0.0
256,7177,2048,1024,ck,0,0,38.8144,a8w8_blockscale_1x128x128_256x128x128x128_16x16_32x32_2x2_8x32x1_8x32x1_1x32x1x8_8_1x1_intrawave_v3,775.55,1000.75,0.0
256,7177,2048,4096,ck,0,0,105.1398,a8w8_blockscale_1x128x128_256x128x128x128_16x16_32x32_2x2_8x32x1_8x32x1_1x32x1x8_8_1x1_intrawave_v3,1145.24,638.98,0.0
256,7178,2048,512,ck,18,0,27.7108,a8w8_blockscale_1x128x128_256x64x64x256_16x16_32x32_1x1_16x16x1_16x16x1_1x32x1x8_8_1x1_intrawave_v1,543.23,1231.46,0.0
256,7178,2048,4096,ck,0,0,104.1598,a8w8_blockscale_1x128x128_256x128x128x128_16x16_32x32_2x2_8x32x1_8x32x1_1x32x1x8_8_1x1_intrawave_v3,1156.17,645.07,0.0
256,7179,2048,512,ck,18,0,27.9033,a8w8_blockscale_1x128x128_256x64x64x256_16x16_32x32_1x1_16x16x1_16x16x1_1x32x1x8_8_1x1_intrawave_v1,539.56,1223.13,0.0
256,7179,2048,4096,ck,0,0,104.2182,a8w8_blockscale_1x128x128_256x128x128x128_16x16_32x32_2x2_8x32x1_8x32x1_1x32x1x8_8_1x1_intrawave_v3,1155.69,644.79,0.0
256,7183,2048,512,ck,18,0,27.6123,a8w8_blockscale_1x128x128_256x64x64x256_16x16_32x32_1x1_16x16x1_16x16x1_1x32x1x8_8_1x1_intrawave_v1,545.55,1236.69,0.0
256,7183,2048,4096,ck,0,0,105.217,a8w8_blockscale_1x128x128_256x128x128x128_16x16_32x32_2x2_8x32x1_8x32x1_1x32x1x8_8_1x1_intrawave_v3,1145.35,638.98,0.0
256,7184,2048,512,ck,0,0,28.1347,a8w8_blockscale_1x128x128_256x128x128x128_16x16_32x32_2x2_8x32x1_8x32x1_1x32x1x8_8_1x1_intrawave_v3,535.49,1213.89,0.0
256,7184,2048,4096,ck,0,0,103.4854,a8w8_blockscale_1x128x128_256x128x128x128_16x16_32x32_2x2_8x32x1_8x32x1_1x32x1x8_8_1x1_intrawave_v3,1164.68,649.75,0.0
256,7185,2048,128,cktile,5,0,12.2581,a8w8_blockscale_cktile_64x128x128_2x2x1_16x16x32_intrawave_0x0x0x0_1,307.31,2497.25,0.0
256,7185,2048,1024,ck,0,0,38.8121,a8w8_blockscale_1x128x128_256x128x128x128_16x16_32x32_2x2_8x32x1_8x32x1_1x32x1x8_8_1x1_intrawave_v3,776.46,1001.86,0.0
256,7206,2048,128,cktile,5,0,12.3947,a8w8_blockscale_cktile_64x128x128_2x2x1_16x16x32_intrawave_0x0x0x0_1,304.81,2476.89,0.0
256,7206,2048,1024,ck,0,0,39.0862,a8w8_blockscale_1x128x128_256x128x128x128_16x16_32x32_2x2_8x32x1_8x32x1_1x32x1x8_8_1x1_intrawave_v3,773.27,997.59,0.0
256,7209,2048,512,ck,18,0,27.648,a8w8_blockscale_1x128x128_256x64x64x256_16x16_32x32_1x1_16x16x1_16x16x1_1x32x1x8_8_1x1_intrawave_v1,546.82,1239.43,0.0
256,7209,2048,4096,ck,0,0,103.6566,a8w8_blockscale_1x128x128_256x128x128x128_16x16_32x32_2x2_8x32x1_8x32x1_1x32x1x8_8_1x1_intrawave_v3,1166.8,650.66,0.0
256,7210,2048,512,ck,18,0,27.5624,a8w8_blockscale_1x128x128_256x64x64x256_16x16_32x32_1x1_16x16x1_16x16x1_1x32x1x8_8_1x1_intrawave_v1,548.59,1243.44,0.0
256,7210,2048,4096,ck,0,0,105.8187,a8w8_blockscale_1x128x128_256x128x128x128_16x16_32x32_2x2_8x32x1_8x32x1_1x32x1x8_8_1x1_intrawave_v3,1143.12,637.44,0.0
256,7211,2048,512,ck,18,0,27.818,a8w8_blockscale_1x128x128_256x64x64x256_16x16_32x32_1x1_16x16x1_16x16x1_1x32x1x8_8_1x1_intrawave_v1,543.63,1232.18,0.0
256,7211,2048,4096,ck,0,0,106.6427,a8w8_blockscale_1x128x128_256x128x128x128_16x16_32x32_2x2_8x32x1_8x32x1_1x32x1x8_8_1x1_intrawave_v3,1134.45,632.59,0.0
256,7217,2048,128,cktile,5,0,12.4358,a8w8_blockscale_cktile_64x128x128_2x2x1_16x16x32_intrawave_0x0x0x0_1,304.27,2472.44,0.0
256,7217,2048,512,ck,18,0,27.7312,a8w8_blockscale_1x128x128_256x64x64x256_16x16_32x32_1x1_16x16x1_16x16x1_1x32x1x8_8_1x1_intrawave_v1,545.78,1237.04,0.0
256,7217,2048,1024,ck,0,0,39.5685,a8w8_blockscale_1x128x128_256x128x128x128_16x16_32x32_2x2_8x32x1_8x32x1_1x32x1x8_8_1x1_intrawave_v3,765.01,986.85,0.0
256,7217,2048,4096,ck,0,0,105.5195,a8w8_blockscale_1x128x128_256x128x128x128_16x16_32x32_2x2_8x32x1_8x32x1_1x32x1x8_8_1x1_intrawave_v3,1147.48,639.79,0.0
256,7257,2048,128,cktile,5,0,12.4627,a8w8_blockscale_cktile_64x128x128_2x2x1_16x16x32_intrawave_0x0x0x0_1,305.29,2480.66,0.0
256,7257,2048,1024,ck,0,0,38.4541,a8w8_blockscale_1x128x128_256x128x128x128_16x16_32x32_2x2_8x32x1_8x32x1_1x32x1x8_8_1x1_intrawave_v3,791.54,1020.78,0.0
256,7265,2048,128,cktile,5,0,12.406,a8w8_blockscale_cktile_64x128x128_2x2x1_16x16x32_intrawave_0x0x0x0_1,307.03,2494.72,0.0
256,7265,2048,1024,ck,0,0,38.8979,a8w8_blockscale_1x128x128_256x128x128x128_16x16_32x32_2x2_8x32x1_8x32x1_1x32x1x8_8_1x1_intrawave_v3,783.37,1010.18,0.0
256,7273,2048,512,ck,0,0,28.0943,a8w8_blockscale_1x128x128_256x128x128x128_16x16_32x32_2x2_8x32x1_8x32x1_1x32x1x8_8_1x1_intrawave_v3,542.91,1230.23,0.0
256,7273,2048,4096,ck,0,0,103.8443,a8w8_blockscale_1x128x128_256x128x128x128_16x16_32x32_2x2_8x32x1_8x32x1_1x32x1x8_8_1x1_intrawave_v3,1175.04,654.53,0.0
256,7274,2048,512,ck,0,0,28.0926,a8w8_blockscale_1x128x128_256x128x128x128_16x16_32x32_2x2_8x32x1_8x32x1_1x32x1x8_8_1x1_intrawave_v3,543.01,1230.47,0.0
256,7274,2048,4096,ck,0,0,105.7471,a8w8_blockscale_1x128x128_256x128x128x128_16x16_32x32_2x2_8x32x1_8x32x1_1x32x1x8_8_1x1_intrawave_v3,1154.05,642.83,0.0
256,7391,2048,512,ck,18,0,28.238,a8w8_blockscale_1x128x128_256x64x64x256_16x16_32x32_1x1_16x16x1_16x16x1_1x32x1x8_8_1x1_intrawave_v1,548.91,1243.23,0.0
256,7391,2048,4096,ck,0,0,104.2359,a8w8_blockscale_1x128x128_256x128x128x128_16x16_32x32_2x2_8x32x1_8x32x1_1x32x1x8_8_1x1_intrawave_v3,1189.61,661.34,0.0
256,7393,2048,128,cktile,5,0,12.5604,a8w8_blockscale_cktile_64x128x128_2x2x1_16x16x32_intrawave_0x0x0x0_1,308.59,2507.1,0.0
256,7393,2048,512,ck,18,0,28.0101,a8w8_blockscale_1x128x128_256x64x64x256_16x16_32x32_1x1_16x16x1_16x16x1_1x32x1x8_8_1x1_intrawave_v1,553.52,1253.67,0.0
256,7393,2048,1024,ck,0,0,39.09,a8w8_blockscale_1x128x128_256x128x128x128_16x16_32x32_2x2_8x32x1_8x32x1_1x32x1x8_8_1x1_intrawave_v3,793.26,1021.98,0.0
256,7393,2048,4096,ck,0,0,105.3007,a8w8_blockscale_1x128x128_256x128x128x128_16x16_32x32_2x2_8x32x1_8x32x1_1x32x1x8_8_1x1_intrawave_v3,1177.9,654.81,0.0
256,7461,2048,128,cktile,5,0,12.5947,a8w8_blockscale_cktile_64x128x128_2x2x1_16x16x32_intrawave_0x0x0x0_1,310.58,2523.08,0.0
256,7461,2048,1024,ck,0,0,39.3688,a8w8_blockscale_1x128x128_256x128x128x128_16x16_32x32_2x2_8x32x1_8x32x1_1x32x1x8_8_1x1_intrawave_v3,794.89,1023.59,0.0
256,7634,2048,128,cktile,5,0,12.5738,a8w8_blockscale_cktile_64x128x128_2x2x1_16x16x32_intrawave_0x0x0x0_1,318.31,2585.39,0.0
256,7634,2048,1024,ck,0,0,39.5419,a8w8_blockscale_1x128x128_256x128x128x128_16x16_32x32_2x2_8x32x1_8x32x1_1x32x1x8_8_1x1_intrawave_v3,809.76,1041.51,0.0
256,7715,2048,512,ck,0,0,28.3704,a8w8_blockscale_1x128x128_256x128x128x128_16x16_32x32_2x2_8x32x1_8x32x1_1x32x1x8_8_1x1_intrawave_v3,570.3,1290.05,0.0
256,7715,2048,4096,ck,0,0,107.3971,a8w8_blockscale_1x128x128_256x128x128x128_16x16_32x32_2x2_8x32x1_8x32x1_1x32x1x8_8_1x1_intrawave_v3,1205.21,666.59,0.0
256,7753,2048,512,ck,0,0,28.3504,a8w8_blockscale_1x128x128_256x128x128x128_16x16_32x32_2x2_8x32x1_8x32x1_1x32x1x8_8_1x1_intrawave_v3,573.51,1297.14,0.0
256,7753,2048,4096,ck,0,0,108.2199,a8w8_blockscale_1x128x128_256x128x128x128_16x16_32x32_2x2_8x32x1_8x32x1_1x32x1x8_8_1x1_intrawave_v3,1201.94,664.4,0.0
256,7819,2048,512,ck,0,0,28.6732,a8w8_blockscale_1x128x128_256x128x128x128_16x16_32x32_2x2_8x32x1_8x32x1_1x32x1x8_8_1x1_intrawave_v3,571.88,1293.14,0.0
256,7819,2048,4096,ck,0,0,110.2915,a8w8_blockscale_1x128x128_256x128x128x128_16x16_32x32_2x2_8x32x1_8x32x1_1x32x1x8_8_1x1_intrawave_v3,1189.4,656.82,0.0
256,8099,2048,512,ck,0,0,29.2764,a8w8_blockscale_1x128x128_256x128x128x128_16x16_32x32_2x2_8x32x1_8x32x1_1x32x1x8_8_1x1_intrawave_v3,580.15,1310.57,0.0
256,8099,2048,4096,ck,0,0,112.3687,a8w8_blockscale_1x128x128_256x128x128x128_16x16_32x32_2x2_8x32x1_8x32x1_1x32x1x8_8_1x1_intrawave_v3,1209.22,665.09,0.0
256,8129,2048,128,cktile,5,0,13.3763,a8w8_blockscale_cktile_64x128x128_2x2x1_16x16x32_intrawave_0x0x0x0_1,318.62,2586.59,0.0
256,8129,2048,512,ck,0,0,29.3361,a8w8_blockscale_1x128x128_256x128x128x128_16x16_32x32_2x2_8x32x1_8x32x1_1x32x1x8_8_1x1_intrawave_v3,581.12,1312.62,0.0
256,8129,2048,1024,ck,0,0,41.3617,a8w8_blockscale_1x128x128_256x128x128x128_16x16_32x32_2x2_8x32x1_8x32x1_1x32x1x8_8_1x1_intrawave_v3,824.33,1056.96,0.0
256,8129,2048,4096,ck,0,0,111.5663,a8w8_blockscale_1x128x128_256x128x128x128_16x16_32x32_2x2_8x32x1_8x32x1_1x32x1x8_8_1x1_intrawave_v3,1222.43,672.08,0.0
256,8188,2048,512,ck,0,0,29.5674,a8w8_blockscale_1x128x128_256x128x128x128_16x16_32x32_2x2_8x32x1_8x32x1_1x32x1x8_8_1x1_intrawave_v3,580.76,1311.54,0.0
256,8188,2048,4096,ck,0,0,110.8163,a8w8_blockscale_1x128x128_256x128x128x128_16x16_32x32_2x2_8x32x1_8x32x1_1x32x1x8_8_1x1_intrawave_v3,1239.64,680.99,0.0
256,8192,2048,128,cktile,3,0,13.508,a8w8_blockscale_cktile_128x128x128_1x4x1_16x16x32_intrawave_0x0x0x0_1,317.96,2581.07,0.0
256,8192,2048,512,ck,0,0,29.245,a8w8_blockscale_1x128x128_256x128x128x128_16x16_32x32_2x2_8x32x1_8x32x1_1x32x1x8_8_1x1_intrawave_v3,587.45,1326.63,0.0
256,8192,2048,1024,ck,0,0,42.0053,a8w8_blockscale_1x128x128_256x128x128x128_16x16_32x32_2x2_8x32x1_8x32x1_1x32x1x8_8_1x1_intrawave_v3,817.99,1048.44,0.0
256,8192,2048,4096,ck,0,0,109.0819,a8w8_blockscale_1x128x128_256x128x128x128_16x16_32x32_2x2_8x32x1_8x32x1_1x32x1x8_8_1x1_intrawave_v3,1259.96,692.12,0.0
256,1,2560,2048,ck,8,0,7.5029,a8w8_blockscale_1x128x128_256x16x64x256_16x16_16x16_1x1_16x16x1_16x16x1_1x16x1x16_4_1x1_intrawave_v1,1.4,699.74,0.0
256,2,2560,2048,ck,8,0,8.3271,a8w8_blockscale_1x128x128_256x16x64x256_16x16_16x16_1x1_16x16x1_16x16x1_1x16x1x16_4_1x1_intrawave_v1,2.52,631.34,0.0
256,4,2560,2048,ck,8,0,8.1935,a8w8_blockscale_1x128x128_256x16x64x256_16x16_16x16_1x1_16x16x1_16x16x1_1x16x1x16_4_1x1_intrawave_v1,5.12,643.38,0.0
256,8,2560,2048,ck,8,0,7.5241,a8w8_blockscale_1x128x128_256x16x64x256_16x16_16x16_1x1_16x16x1_16x16x1_1x16x1x16_4_1x1_intrawave_v1,11.15,704.43,0.0
256,16,2560,2048,ck,8,0,7.426,a8w8_blockscale_1x128x128_256x16x64x256_16x16_16x16_1x1_16x16x1_16x16x1_1x16x1x16_4_1x1_intrawave_v1,22.59,721.46,0.0
256,32,2560,2048,ck,8,0,8.2538,a8w8_blockscale_1x128x128_256x16x64x256_16x16_16x16_1x1_16x16x1_16x16x1_1x16x1x16_4_1x1_intrawave_v1,40.65,663.0,0.0
256,48,2560,2048,ck,8,0,8.018,a8w8_blockscale_1x128x128_256x16x64x256_16x16_16x16_1x1_16x16x1_16x16x1_1x16x1x16_4_1x1_intrawave_v1,62.77,696.8,0.0
256,64,2560,2048,ck,8,0,7.9137,a8w8_blockscale_1x128x128_256x16x64x256_16x16_16x16_1x1_16x16x1_16x16x1_1x16x1x16_4_1x1_intrawave_v1,84.8,720.48,0.0
256,80,2560,2048,ck,8,0,7.9016,a8w8_blockscale_1x128x128_256x16x64x256_16x16_16x16_1x1_16x16x1_16x16x1_1x16x1x16_4_1x1_intrawave_v1,106.16,736.09,0.0
256,96,2560,2048,ck,8,0,8.782,a8w8_blockscale_1x128x128_256x16x64x256_16x16_16x16_1x1_16x16x1_16x16x1_1x16x1x16_4_1x1_intrawave_v1,114.62,675.36,0.0
256,112,2560,2048,ck,7,0,9.3263,a8w8_blockscale_1x128x128_256x16x128x256_16x16_16x16_1x2_16x16x1_16x16x1_1x16x1x16_8_1x2_intrawave_v1,125.92,648.24,0.0
256,128,2560,2048,ck,7,0,9.266,a8w8_blockscale_1x128x128_256x16x128x256_16x16_16x16_1x2_16x16x1_16x16x1_1x16x1x16_8_1x2_intrawave_v1,144.85,664.84,0.0
256,256,2560,2048,ck,18,0,9.7611,a8w8_blockscale_1x128x128_256x64x64x256_16x16_32x32_1x1_16x16x1_16x16x1_1x32x1x8_8_1x1_intrawave_v1,275.01,725.11,0.0
256,512,2560,2048,ck,2,0,15.1044,a8w8_blockscale_1x128x128_256x64x128x128_16x16_32x32_1x2_8x32x1_8x32x1_1x32x1x8_8_1x1_intrawave_v3,355.44,590.09,0.0
256,588,2560,2048,ck,2,0,15.4151,a8w8_blockscale_1x128x128_256x64x128x128_16x16_32x32_1x2_8x32x1_8x32x1_1x32x1x8_8_1x1_intrawave_v3,399.97,613.53,0.0
256,773,2560,2048,ck,3,0,18.7151,a8w8_blockscale_1x128x128_256x64x64x128_16x16_32x32_1x1_8x32x1_8x32x1_1x32x1x8_8_1x1_intrawave_v3,433.1,576.21,0.0
256,822,2560,2048,ck,3,0,18.6608,a8w8_blockscale_1x128x128_256x64x64x128_16x16_32x32_1x1_8x32x1_8x32x1_1x32x1x8_8_1x1_intrawave_v3,461.89,596.7,0.0
256,1024,2560,2048,ck,0,0,19.245,a8w8_blockscale_1x128x128_256x128x128x128_16x16_32x32_2x2_8x32x1_8x32x1_1x32x1x8_8_1x1_intrawave_v3,557.93,653.83,0.0
256,1025,2560,2048,ck,0,0,19.9861,a8w8_blockscale_1x128x128_256x128x128x128_16x16_32x32_2x2_8x32x1_8x32x1_1x32x1x8_8_1x1_intrawave_v3,537.77,629.94,0.0
256,1027,2560,2048,ck,3,0,20.1021,a8w8_blockscale_1x128x128_256x64x64x128_16x16_32x32_1x1_8x32x1_8x32x1_1x32x1x8_8_1x1_intrawave_v3,535.71,627.02,0.0
256,1042,2560,2048,ck,0,0,20.1587,a8w8_blockscale_1x128x128_256x128x128x128_16x16_32x32_2x2_8x32x1_8x32x1_1x32x1x8_8_1x1_intrawave_v3,542.01,630.59,0.0
256,1051,2560,2048,ck,3,0,20.0742,a8w8_blockscale_1x128x128_256x64x64x128_16x16_32x32_1x1_8x32x1_8x32x1_1x32x1x8_8_1x1_intrawave_v3,548.99,636.46,0.0
256,1055,2560,2048,ck,3,0,20.2246,a8w8_blockscale_1x128x128_256x64x64x128_16x16_32x32_1x1_8x32x1_8x32x1_1x32x1x8_8_1x1_intrawave_v3,546.98,633.15,0.0
256,1057,2560,2048,ck,3,0,20.1722,a8w8_blockscale_1x128x128_256x64x64x128_16x16_32x32_1x1_8x32x1_8x32x1_1x32x1x8_8_1x1_intrawave_v3,549.44,635.5,0.0
256,1069,2560,2048,ck,3,0,20.2036,a8w8_blockscale_1x128x128_256x64x64x128_16x16_32x32_1x1_8x32x1_8x32x1_1x32x1x8_8_1x1_intrawave_v3,554.82,638.77,0.0
256,1072,2560,2048,ck,0,0,20.2478,a8w8_blockscale_1x128x128_256x128x128x128_16x16_32x32_2x2_8x32x1_8x32x1_1x32x1x8_8_1x1_intrawave_v3,555.16,638.44,0.0
256,1074,2560,2048,ck,3,0,20.1092,a8w8_blockscale_1x128x128_256x64x64x128_16x16_32x32_1x1_8x32x1_8x32x1_1x32x1x8_8_1x1_intrawave_v3,560.03,643.55,0.0
256,1091,2560,2048,ck,3,0,20.193,a8w8_blockscale_1x128x128_256x64x64x128_16x16_32x32_1x1_8x32x1_8x32x1_1x32x1x8_8_1x1_intrawave_v3,566.53,646.92,0.0
256,1128,2560,2048,ck,0,0,20.3729,a8w8_blockscale_1x128x128_256x128x128x128_16x16_32x32_2x2_8x32x1_8x32x1_1x32x1x8_8_1x1_intrawave_v3,580.57,654.22,0.0
256,1136,2560,2048,ck,0,0,20.3497,a8w8_blockscale_1x128x128_256x128x128x128_16x16_32x32_2x2_8x32x1_8x32x1_1x32x1x8_8_1x1_intrawave_v3,585.36,657.79,0.0
256,1514,2560,2048,ck,0,0,20.9818,a8w8_blockscale_1x128x128_256x128x128x128_16x16_32x32_2x2_8x32x1_8x32x1_1x32x1x8_8_1x1_intrawave_v3,756.63,767.1,0.0
256,2017,2560,2048,ck,2,0,29.8104,a8w8_blockscale_1x128x128_256x64x128x128_16x16_32x32_1x2_8x32x1_8x32x1_1x32x1x8_8_1x1_intrawave_v3,709.48,660.87,0.0
256,2048,2560,2048,ck,2,0,29.5204,a8w8_blockscale_1x128x128_256x64x128x128_16x16_32x32_1x2_8x32x1_8x32x1_1x32x1x8_8_1x1_intrawave_v3,727.46,674.89,0.0
256,2151,2560,2048,ck,2,0,29.7629,a8w8_blockscale_1x128x128_256x64x128x128_16x16_32x32_1x2_8x32x1_8x32x1_1x32x1x8_8_1x1_intrawave_v3,757.82,694.19,0.0
256,2332,2560,2048,ck,0,0,30.3056,a8w8_blockscale_1x128x128_256x128x128x128_16x16_32x32_2x2_8x32x1_8x32x1_1x32x1x8_8_1x1_intrawave_v3,806.87,724.57,0.0
256,2341,2560,2048,ck,2,0,29.7604,a8w8_blockscale_1x128x128_256x64x128x128_16x16_32x32_1x2_8x32x1_8x32x1_1x32x1x8_8_1x1_intrawave_v3,824.83,740.02,0.0
256,3072,2560,2048,ck,0,0,32.9016,a8w8_blockscale_1x128x128_256x128x128x128_16x16_32x32_2x2_8x32x1_8x32x1_1x32x1x8_8_1x1_intrawave_v3,979.05,828.62,0.0
256,3073,2560,2048,ck,0,0,33.7487,a8w8_blockscale_1x128x128_256x128x128x128_16x16_32x32_2x2_8x32x1_8x32x1_1x32x1x8_8_1x1_intrawave_v3,954.78,808.04,0.0
256,3089,2560,2048,ck,0,0,33.4108,a8w8_blockscale_1x128x128_256x128x128x128_16x16_32x32_2x2_8x32x1_8x32x1_1x32x1x8_8_1x1_intrawave_v3,969.46,819.64,0.0
256,3110,2560,2048,ck,0,0,33.286,a8w8_blockscale_1x128x128_256x128x128x128_16x16_32x32_2x2_8x32x1_8x32x1_1x32x1x8_8_1x1_intrawave_v3,979.71,827.24,0.0
256,3137,2560,2048,ck,0,0,34.1843,a8w8_blockscale_1x128x128_256x128x128x128_16x16_32x32_2x2_8x32x1_8x32x1_1x32x1x8_8_1x1_intrawave_v3,962.25,811.16,0.0
256,3613,2560,2048,ck,0,0,45.2636,a8w8_blockscale_1x128x128_256x128x128x128_16x16_32x32_2x2_8x32x1_8x32x1_1x32x1x8_8_1x1_intrawave_v3,836.99,687.99,0.0
256,4096,2560,2048,ck,0,0,46.1494,a8w8_blockscale_1x128x128_256x128x128x128_16x16_32x32_2x2_8x32x1_8x32x1_1x32x1x8_8_1x1_intrawave_v3,930.67,749.8,0.0
256,4097,2560,2048,ck,0,0,46.569,a8w8_blockscale_1x128x128_256x128x128x128_16x16_32x32_2x2_8x32x1_8x32x1_1x32x1x8_8_1x1_intrawave_v3,922.51,743.2,0.0
256,4109,2560,2048,ck,0,0,47.8573,a8w8_blockscale_1x128x128_256x128x128x128_16x16_32x32_2x2_8x32x1_8x32x1_1x32x1x8_8_1x1_intrawave_v3,900.3,724.99,0.0
256,4143,2560,2048,ck,0,0,46.5241,a8w8_blockscale_1x128x128_256x128x128x128_16x16_32x32_2x2_8x32x1_8x32x1_1x32x1x8_8_1x1_intrawave_v3,933.76,751.01,0.0
256,4345,2560,2048,ck,0,0,47.1795,a8w8_blockscale_1x128x128_256x128x128x128_16x16_32x32_2x2_8x32x1_8x32x1_1x32x1x8_8_1x1_intrawave_v3,965.69,771.26,0.0
256,4413,2560,2048,ck,0,0,48.205,a8w8_blockscale_1x128x128_256x128x128x128_16x16_32x32_2x2_8x32x1_8x32x1_1x32x1x8_8_1x1_intrawave_v3,959.93,764.97,0.0
256,5121,2560,2048,ck,0,0,58.0642,a8w8_blockscale_1x128x128_256x128x128x128_16x16_32x32_2x2_8x32x1_8x32x1_1x32x1x8_8_1x1_intrawave_v3,924.8,722.48,0.0
256,5123,2560,2048,ck,0,0,57.5215,a8w8_blockscale_1x128x128_256x128x128x128_16x16_32x32_2x2_8x32x1_8x32x1_1x32x1x8_8_1x1_intrawave_v3,933.89,729.55,0.0
256,5133,2560,2048,ck,0,0,57.8082,a8w8_blockscale_1x128x128_256x128x128x128_16x16_32x32_2x2_8x32x1_8x32x1_1x32x1x8_8_1x1_intrawave_v3,931.07,727.17,0.0
256,5185,2560,2048,ck,0,0,58.3866,a8w8_blockscale_1x128x128_256x128x128x128_16x16_32x32_2x2_8x32x1_8x32x1_1x32x1x8_8_1x1_intrawave_v3,931.18,726.35,0.0
256,5191,2560,2048,ck,0,0,58.1494,a8w8_blockscale_1x128x128_256x128x128x128_16x16_32x32_2x2_8x32x1_8x32x1_1x32x1x8_8_1x1_intrawave_v3,936.06,730.05,0.0
256,6146,2560,2048,ck,0,0,62.8391,a8w8_blockscale_1x128x128_256x128x128x128_16x16_32x32_2x2_8x32x1_8x32x1_1x32x1x8_8_1x1_intrawave_v3,1025.56,784.5,0.0
256,6147,2560,2048,ck,0,0,60.8431,a8w8_blockscale_1x128x128_256x128x128x128_16x16_32x32_2x2_8x32x1_8x32x1_1x32x1x8_8_1x1_intrawave_v3,1059.38,810.36,0.0
256,6155,2560,2048,ck,0,0,63.1607,a8w8_blockscale_1x128x128_256x128x128x128_16x16_32x32_2x2_8x32x1_8x32x1_1x32x1x8_8_1x1_intrawave_v3,1021.84,781.53,0.0
256,6377,2560,2048,ck,0,0,64.0775,a8w8_blockscale_1x128x128_256x128x128x128_16x16_32x32_2x2_8x32x1_8x32x1_1x32x1x8_8_1x1_intrawave_v3,1043.54,795.18,0.0
256,6401,2560,2048,ck,0,0,63.8255,a8w8_blockscale_1x128x128_256x128x128x128_16x16_32x32_2x2_8x32x1_8x32x1_1x32x1x8_8_1x1_intrawave_v3,1051.61,801.02,0.0
256,7121,2560,2048,ck,0,0,74.8532,a8w8_blockscale_1x128x128_256x128x128x128_16x16_32x32_2x2_8x32x1_8x32x1_1x32x1x8_8_1x1_intrawave_v3,997.54,751.95,0.0
256,7169,2560,2048,ck,0,0,74.4051,a8w8_blockscale_1x128x128_256x128x128x128_16x16_32x32_2x2_8x32x1_8x32x1_1x32x1x8_8_1x1_intrawave_v3,1010.31,761.11,0.0
256,7170,2560,2048,ck,0,0,73.6163,a8w8_blockscale_1x128x128_256x128x128x128_16x16_32x32_2x2_8x32x1_8x32x1_1x32x1x8_8_1x1_intrawave_v3,1021.28,769.36,0.0
256,7176,2560,2048,ck,0,0,75.9968,a8w8_blockscale_1x128x128_256x128x128x128_16x16_32x32_2x2_8x32x1_8x32x1_1x32x1x8_8_1x1_intrawave_v3,990.12,745.83,0.0
256,7177,2560,2048,ck,0,0,75.2295,a8w8_blockscale_1x128x128_256x128x128x128_16x16_32x32_2x2_8x32x1_8x32x1_1x32x1x8_8_1x1_intrawave_v3,1000.36,753.53,0.0
256,7185,2560,2048,ck,0,0,74.4363,a8w8_blockscale_1x128x128_256x128x128x128_16x16_32x32_2x2_8x32x1_8x32x1_1x32x1x8_8_1x1_intrawave_v3,1012.14,762.33,0.0
256,7206,2560,2048,ck,0,0,73.1235,a8w8_blockscale_1x128x128_256x128x128x128_16x16_32x32_2x2_8x32x1_8x32x1_1x32x1x8_8_1x1_intrawave_v3,1033.33,778.07,0.0
256,7217,2560,2048,ck,0,0,73.6211,a8w8_blockscale_1x128x128_256x128x128x128_16x16_32x32_2x2_8x32x1_8x32x1_1x32x1x8_8_1x1_intrawave_v3,1027.91,773.89,0.0
256,7257,2560,2048,ck,0,0,72.7451,a8w8_blockscale_1x128x128_256x128x128x128_16x16_32x32_2x2_8x32x1_8x32x1_1x32x1x8_8_1x1_intrawave_v3,1046.05,787.15,0.0
256,7265,2560,2048,ck,0,0,73.7791,a8w8_blockscale_1x128x128_256x128x128x128_16x16_32x32_2x2_8x32x1_8x32x1_1x32x1x8_8_1x1_intrawave_v3,1032.53,776.89,0.0
256,7393,2560,2048,ck,0,0,74.2232,a8w8_blockscale_1x128x128_256x128x128x128_16x16_32x32_2x2_8x32x1_8x32x1_1x32x1x8_8_1x1_intrawave_v3,1044.43,784.61,0.0
256,7461,2560,2048,ck,0,0,73.7775,a8w8_blockscale_1x128x128_256x128x128x128_16x16_32x32_2x2_8x32x1_8x32x1_1x32x1x8_8_1x1_intrawave_v3,1060.41,795.95,0.0
256,7634,2560,2048,ck,0,0,76.638,a8w8_blockscale_1x128x128_256x128x128x128_16x16_32x32_2x2_8x32x1_8x32x1_1x32x1x8_8_1x1_intrawave_v3,1044.5,782.42,0.0
256,8129,2560,2048,ck,0,0,79.8204,a8w8_blockscale_1x128x128_256x128x128x128_16x16_32x32_2x2_8x32x1_8x32x1_1x32x1x8_8_1x1_intrawave_v3,1067.88,795.68,0.0
256,8192,2560,2048,ck,0,0,76.6308,a8w8_blockscale_1x128x128_256x128x128x128_16x16_32x32_2x2_8x32x1_8x32x1_1x32x1x8_8_1x1_intrawave_v3,1120.95,834.69,0.0
256,1,3072,2048,ck,8,0,7.5583,a8w8_blockscale_1x128x128_256x16x64x256_16x16_16x16_1x1_16x16x1_16x16x1_1x16x1x16_4_1x1_intrawave_v1,1.66,833.47,0.0
256,2,3072,2048,ck,8,0,8.5738,a8w8_blockscale_1x128x128_256x16x64x256_16x16_16x16_1x1_16x16x1_16x16x1_1x16x1x16_4_1x1_intrawave_v1,2.94,735.71,0.0
256,4,3072,2048,ck,8,0,7.9842,a8w8_blockscale_1x128x128_256x16x64x256_16x16_16x16_1x1_16x16x1_16x16x1_1x16x1x16_4_1x1_intrawave_v1,6.3,792.09,0.0
256,8,3072,2048,ck,8,0,7.6411,a8w8_blockscale_1x128x128_256x16x64x256_16x16_16x16_1x1_16x16x1_16x16x1_1x16x1x16_4_1x1_intrawave_v1,13.17,831.95,0.0
256,16,3072,2048,ck,8,0,7.456,a8w8_blockscale_1x128x128_256x16x64x256_16x16_16x16_1x1_16x16x1_16x16x1_1x16x1x16_4_1x1_intrawave_v1,27.0,861.39,0.0
256,32,3072,2048,ck,8,0,8.277,a8w8_blockscale_1x128x128_256x16x64x256_16x16_16x16_1x1_16x16x1_16x16x1_1x16x1x16_4_1x1_intrawave_v1,48.65,791.78,0.0
256,48,3072,2048,ck,8,0,8.3427,a8w8_blockscale_1x128x128_256x16x64x256_16x16_16x16_1x1_16x16x1_16x16x1_1x16x1x16_4_1x1_intrawave_v1,72.4,801.26,0.0
256,64,3072,2048,ck,8,0,7.8363,a8w8_blockscale_1x128x128_256x16x64x256_16x16_16x16_1x1_16x16x1_16x16x1_1x16x1x16_4_1x1_intrawave_v1,102.77,869.77,0.0
256,80,3072,2048,ck,8,0,7.7782,a8w8_blockscale_1x128x128_256x16x64x256_16x16_16x16_1x1_16x16x1_16x16x1_1x16x1x16_4_1x1_intrawave_v1,129.42,893.11,0.0
256,96,3072,2048,ck,7,0,9.3389,a8w8_blockscale_1x128x128_256x16x128x256_16x16_16x16_1x2_16x16x1_16x16x1_1x16x1x16_8_1x2_intrawave_v1,129.35,757.89,0.0
256,112,3072,2048,ck,7,0,9.364,a8w8_blockscale_1x128x128_256x16x128x256_16x16_16x16_1x2_16x16x1_16x16x1_1x16x1x16_8_1x2_intrawave_v1,150.5,769.86,0.0
256,128,3072,2048,ck,7,0,9.395,a8w8_blockscale_1x128x128_256x16x128x256_16x16_16x16_1x2_16x16x1_16x16x1_1x16x1x16_8_1x2_intrawave_v1,171.43,781.27,0.0
256,256,3072,2048,ck,18,0,9.7962,a8w8_blockscale_1x128x128_256x64x64x256_16x16_32x32_1x1_16x16x1_16x16x1_1x32x1x8_8_1x1_intrawave_v1,328.82,856.31,0.0
256,512,3072,2048,ck,2,0,15.2318,a8w8_blockscale_1x128x128_256x64x128x128_16x16_32x32_1x2_8x32x1_8x32x1_1x32x1x8_8_1x1_intrawave_v3,422.96,688.41,0.0
256,588,3072,2048,ck,2,0,15.6904,a8w8_blockscale_1x128x128_256x64x128x128_16x16_32x32_1x2_8x32x1_8x32x1_1x32x1x8_8_1x1_intrawave_v3,471.55,707.97,0.0
256,773,3072,2048,ck,0,0,19.8783,a8w8_blockscale_1x128x128_256x128x128x128_16x16_32x32_2x2_8x32x1_8x32x1_1x32x1x8_8_1x1_intrawave_v3,489.31,635.06,0.0
256,822,3072,2048,ck,0,0,20.0942,a8w8_blockscale_1x128x128_256x128x128x128_16x16_32x32_2x2_8x32x1_8x32x1_1x32x1x8_8_1x1_intrawave_v3,514.73,648.21,0.0
256,1024,3072,2048,ck,0,0,19.6775,a8w8_blockscale_1x128x128_256x128x128x128_16x16_32x32_2x2_8x32x1_8x32x1_1x32x1x8_8_1x1_intrawave_v3,654.8,746.03,0.0
256,1025,3072,2048,ck,0,0,20.4956,a8w8_blockscale_1x128x128_256x128x128x128_16x16_32x32_2x2_8x32x1_8x32x1_1x32x1x8_8_1x1_intrawave_v3,629.28,716.65,0.0
256,1027,3072,2048,ck,0,0,20.4893,a8w8_blockscale_1x128x128_256x128x128x128_16x16_32x32_2x2_8x32x1_8x32x1_1x32x1x8_8_1x1_intrawave_v3,630.7,717.67,0.0
256,1042,3072,2048,ck,0,0,20.44,a8w8_blockscale_1x128x128_256x128x128x128_16x16_32x32_2x2_8x32x1_8x32x1_1x32x1x8_8_1x1_intrawave_v3,641.46,725.42,0.0
256,1051,3072,2048,ck,0,0,20.4609,a8w8_blockscale_1x128x128_256x128x128x128_16x16_32x32_2x2_8x32x1_8x32x1_1x32x1x8_8_1x1_intrawave_v3,646.34,728.28,0.0
256,1055,3072,2048,ck,0,0,20.5853,a8w8_blockscale_1x128x128_256x128x128x128_16x16_32x32_2x2_8x32x1_8x32x1_1x32x1x8_8_1x1_intrawave_v3,644.88,725.47,0.0
256,1057,3072,2048,ck,0,0,20.4657,a8w8_blockscale_1x128x128_256x128x128x128_16x16_32x32_2x2_8x32x1_8x32x1_1x32x1x8_8_1x1_intrawave_v3,649.87,730.51,0.0
256,1069,3072,2048,ck,0,0,20.6196,a8w8_blockscale_1x128x128_256x128x128x128_16x16_32x32_2x2_8x32x1_8x32x1_1x32x1x8_8_1x1_intrawave_v3,652.35,729.83,0.0
256,1072,3072,2048,ck,0,0,20.5696,a8w8_blockscale_1x128x128_256x128x128x128_16x16_32x32_2x2_8x32x1_8x32x1_1x32x1x8_8_1x1_intrawave_v3,655.77,732.79,0.0
256,1074,3072,2048,ck,0,0,20.4767,a8w8_blockscale_1x128x128_256x128x128x128_16x16_32x32_2x2_8x32x1_8x32x1_1x32x1x8_8_1x1_intrawave_v3,659.97,736.92,0.0
256,1091,3072,2048,ck,0,0,20.6739,a8w8_blockscale_1x128x128_256x128x128x128_16x16_32x32_2x2_8x32x1_8x32x1_1x32x1x8_8_1x1_intrawave_v3,664.02,736.63,0.0
256,1128,3072,2048,ck,0,0,20.6805,a8w8_blockscale_1x128x128_256x128x128x128_16x16_32x32_2x2_8x32x1_8x32x1_1x32x1x8_8_1x1_intrawave_v3,686.32,751.05,0.0
256,1136,3072,2048,ck,0,0,20.6735,a8w8_blockscale_1x128x128_256x128x128x128_16x16_32x32_2x2_8x32x1_8x32x1_1x32x1x8_8_1x1_intrawave_v3,691.43,754.47,0.0
256,1514,3072,2048,ck,2,0,28.2783,a8w8_blockscale_1x128x128_256x64x128x128_16x16_32x32_1x2_8x32x1_8x32x1_1x32x1x8_8_1x1_intrawave_v3,673.68,661.08,0.0
256,2017,3072,2048,ck,2,0,30.9108,a8w8_blockscale_1x128x128_256x64x128x128_16x16_32x32_1x2_8x32x1_8x32x1_1x32x1x8_8_1x1_intrawave_v3,821.06,738.08,0.0
256,2048,3072,2048,ck,2,0,30.1848,a8w8_blockscale_1x128x128_256x64x128x128_16x16_32x32_1x2_8x32x1_8x32x1_1x32x1x8_8_1x1_intrawave_v3,853.73,764.25,0.0
256,2151,3072,2048,ck,0,0,31.9764,a8w8_blockscale_1x128x128_256x128x128x128_16x16_32x32_2x2_8x32x1_8x32x1_1x32x1x8_8_1x1_intrawave_v3,846.43,747.82,0.0
256,2332,3072,2048,ck,0,0,33.1084,a8w8_blockscale_1x128x128_256x128x128x128_16x16_32x32_2x2_8x32x1_8x32x1_1x32x1x8_8_1x1_intrawave_v3,886.28,767.03,0.0
256,2341,3072,2048,ck,0,0,32.3288,a8w8_blockscale_1x128x128_256x128x128x128_16x16_32x32_2x2_8x32x1_8x32x1_1x32x1x8_8_1x1_intrawave_v3,911.16,787.81,0.0
256,3072,3072,2048,ck,0,0,44.0005,a8w8_blockscale_1x128x128_256x128x128x128_16x16_32x32_2x2_8x32x1_8x32x1_1x32x1x8_8_1x1_intrawave_v3,878.51,714.93,0.0
256,3073,3072,2048,ck,0,0,45.9464,a8w8_blockscale_1x128x128_256x128x128x128_16x16_32x32_2x2_8x32x1_8x32x1_1x32x1x8_8_1x1_intrawave_v3,841.57,684.83,0.0
256,3089,3072,2048,ck,0,0,45.7189,a8w8_blockscale_1x128x128_256x128x128x128_16x16_32x32_2x2_8x32x1_8x32x1_1x32x1x8_8_1x1_intrawave_v3,850.17,691.1,0.0
256,3110,3072,2048,ck,0,0,45.708,a8w8_blockscale_1x128x128_256x128x128x128_16x16_32x32_2x2_8x32x1_8x32x1_1x32x1x8_8_1x1_intrawave_v3,856.15,695.03,0.0
256,3137,3072,2048,ck,0,0,45.5117,a8w8_blockscale_1x128x128_256x128x128x128_16x16_32x32_2x2_8x32x1_8x32x1_1x32x1x8_8_1x1_intrawave_v3,867.31,702.89,0.0
256,3613,3072,2048,ck,0,0,47.461,a8w8_blockscale_1x128x128_256x128x128x128_16x16_32x32_2x2_8x32x1_8x32x1_1x32x1x8_8_1x1_intrawave_v3,957.88,756.18,0.0
256,4096,3072,2048,ck,0,0,50.4598,a8w8_blockscale_1x128x128_256x128x128x128_16x16_32x32_2x2_8x32x1_8x32x1_1x32x1x8_8_1x1_intrawave_v3,1021.4,789.66,0.0
256,4097,3072,2048,ck,0,0,58.3258,a8w8_blockscale_1x128x128_256x128x128x128_16x16_32x32_2x2_8x32x1_8x32x1_1x32x1x8_8_1x1_intrawave_v3,883.87,683.3,0.0
256,4109,3072,2048,ck,0,0,58.6994,a8w8_blockscale_1x128x128_256x128x128x128_16x16_32x32_2x2_8x32x1_8x32x1_1x32x1x8_8_1x1_intrawave_v3,880.81,680.63,0.0
256,4143,3072,2048,ck,0,0,58.0654,a8w8_blockscale_1x128x128_256x128x128x128_16x16_32x32_2x2_8x32x1_8x32x1_1x32x1x8_8_1x1_intrawave_v3,897.8,692.86,0.0
256,4345,3072,2048,ck,0,0,58.0249,a8w8_blockscale_1x128x128_256x128x128x128_16x16_32x32_2x2_8x32x1_8x32x1_1x32x1x8_8_1x1_intrawave_v3,942.23,721.86,0.0
256,4413,3072,2048,ck,0,0,57.9214,a8w8_blockscale_1x128x128_256x128x128x128_16x16_32x32_2x2_8x32x1_8x32x1_1x32x1x8_8_1x1_intrawave_v3,958.69,732.76,0.0
256,5121,3072,2048,ck,0,0,61.8986,a8w8_blockscale_1x128x128_256x128x128x128_16x16_32x32_2x2_8x32x1_8x32x1_1x32x1x8_8_1x1_intrawave_v3,1041.01,779.38,0.0
256,5123,3072,2048,ck,0,0,61.227,a8w8_blockscale_1x128x128_256x128x128x128_16x16_32x32_2x2_8x32x1_8x32x1_1x32x1x8_8_1x1_intrawave_v3,1052.84,788.2,0.0
256,5133,3072,2048,ck,0,0,61.5003,a8w8_blockscale_1x128x128_256x128x128x128_16x16_32x32_2x2_8x32x1_8x32x1_1x32x1x8_8_1x1_intrawave_v3,1050.21,786.03,0.0
256,5185,3072,2048,ck,0,0,61.413,a8w8_blockscale_1x128x128_256x128x128x128_16x16_32x32_2x2_8x32x1_8x32x1_1x32x1x8_8_1x1_intrawave_v3,1062.35,794.08,0.0
256,5191,3072,2048,ck,0,0,61.7679,a8w8_blockscale_1x128x128_256x128x128x128_16x16_32x32_2x2_8x32x1_8x32x1_1x32x1x8_8_1x1_intrawave_v3,1057.47,790.32,0.0
256,6146,3072,2048,ck,0,0,75.0216,a8w8_blockscale_1x128x128_256x128x128x128_16x16_32x32_2x2_8x32x1_8x32x1_1x32x1x8_8_1x1_intrawave_v3,1030.83,754.98,0.0
256,6147,3072,2048,ck,0,0,76.1524,a8w8_blockscale_1x128x128_256x128x128x128_16x16_32x32_2x2_8x32x1_8x32x1_1x32x1x8_8_1x1_intrawave_v3,1015.69,743.87,0.0
256,6155,3072,2048,ck,0,0,74.0491,a8w8_blockscale_1x128x128_256x128x128x128_16x16_32x32_2x2_8x32x1_8x32x1_1x32x1x8_8_1x1_intrawave_v3,1045.9,765.89,0.0
256,6377,3072,2048,ck,0,0,74.9459,a8w8_blockscale_1x128x128_256x128x128x128_16x16_32x32_2x2_8x32x1_8x32x1_1x32x1x8_8_1x1_intrawave_v3,1070.66,780.99,0.0
256,6401,3072,2048,ck,0,0,75.4616,a8w8_blockscale_1x128x128_256x128x128x128_16x16_32x32_2x2_8x32x1_8x32x1_1x32x1x8_8_1x1_intrawave_v3,1067.34,778.26,0.0
256,7121,3072,2048,ck,0,0,84.4032,a8w8_blockscale_1x128x128_256x128x128x128_16x16_32x32_2x2_8x32x1_8x32x1_1x32x1x8_8_1x1_intrawave_v3,1061.61,765.69,0.0
256,7169,3072,2048,ck,0,0,86.2956,a8w8_blockscale_1x128x128_256x128x128x128_16x16_32x32_2x2_8x32x1_8x32x1_1x32x1x8_8_1x1_intrawave_v3,1045.32,753.46,0.0
256,7170,3072,2048,ck,0,0,85.4132,a8w8_blockscale_1x128x128_256x128x128x128_16x16_32x32_2x2_8x32x1_8x32x1_1x32x1x8_8_1x1_intrawave_v3,1056.27,761.34,0.0
256,7176,3072,2048,ck,0,0,86.622,a8w8_blockscale_1x128x128_256x128x128x128_16x16_32x32_2x2_8x32x1_8x32x1_1x32x1x8_8_1x1_intrawave_v3,1042.4,751.28,0.0
256,7177,3072,2048,ck,0,0,84.6448,a8w8_blockscale_1x128x128_256x128x128x128_16x16_32x32_2x2_8x32x1_8x32x1_1x32x1x8_8_1x1_intrawave_v3,1066.9,768.92,0.0
256,7185,3072,2048,ck,0,0,86.7348,a8w8_blockscale_1x128x128_256x128x128x128_16x16_32x32_2x2_8x32x1_8x32x1_1x32x1x8_8_1x1_intrawave_v3,1042.35,751.15,0.0
256,7206,3072,2048,ck,0,0,89.0424,a8w8_blockscale_1x128x128_256x128x128x128_16x16_32x32_2x2_8x32x1_8x32x1_1x32x1x8_8_1x1_intrawave_v3,1018.31,733.62,0.0
256,7217,3072,2048,ck,0,0,85.8636,a8w8_blockscale_1x128x128_256x128x128x128_16x16_32x32_2x2_8x32x1_8x32x1_1x32x1x8_8_1x1_intrawave_v3,1057.62,761.83,0.0
256,7257,3072,2048,ck,0,0,85.4268,a8w8_blockscale_1x128x128_256x128x128x128_16x16_32x32_2x2_8x32x1_8x32x1_1x32x1x8_8_1x1_intrawave_v3,1068.92,769.56,0.0
256,7265,3072,2048,ck,0,0,86.1909,a8w8_blockscale_1x128x128_256x128x128x128_16x16_32x32_2x2_8x32x1_8x32x1_1x32x1x8_8_1x1_intrawave_v3,1060.61,763.5,0.0
256,7393,3072,2048,ck,0,0,85.9741,a8w8_blockscale_1x128x128_256x128x128x128_16x16_32x32_2x2_8x32x1_8x32x1_1x32x1x8_8_1x1_intrawave_v3,1082.02,777.62,0.0
256,7461,3072,2048,ck,0,0,86.712,a8w8_blockscale_1x128x128_256x128x128x128_16x16_32x32_2x2_8x32x1_8x32x1_1x32x1x8_8_1x1_intrawave_v3,1082.68,777.42,0.0
256,7634,3072,2048,ck,0,0,86.7436,a8w8_blockscale_1x128x128_256x128x128x128_16x16_32x32_2x2_8x32x1_8x32x1_1x32x1x8_8_1x1_intrawave_v3,1107.38,793.48,0.0
256,8129,3072,2048,ck,0,0,90.8145,a8w8_blockscale_1x128x128_256x128x128x128_16x16_32x32_2x2_8x32x1_8x32x1_1x32x1x8_8_1x1_intrawave_v3,1126.32,802.56,0.0
256,8192,3072,2048,ck,0,0,88.2437,a8w8_blockscale_1x128x128_256x128x128x128_16x16_32x32_2x2_8x32x1_8x32x1_1x32x1x8_8_1x1_intrawave_v3,1168.12,831.79,0.0
256,16,4608,7168,ck,8,0,21.4632,a8w8_blockscale_1x128x128_256x16x64x256_16x16_16x16_1x1_16x16x1_16x16x1_1x16x1x16_4_1x1_intrawave_v1,49.25,1551.13,0.0
256,32,4608,7168,ck,8,0,21.2795,a8w8_blockscale_1x128x128_256x16x64x256_16x16_16x16_1x1_16x16x1_16x16x1_1x16x1x16_4_1x1_intrawave_v1,99.34,1576.84,0.0
256,64,4608,7168,ck,7,0,23.0777,a8w8_blockscale_1x128x128_256x16x128x256_16x16_16x16_1x2_16x16x1_16x16x1_1x16x1x16_8_1x2_intrawave_v1,183.2,1476.69,0.0
256,128,4608,7168,ck,18,0,23.7809,a8w8_blockscale_1x128x128_256x64x64x256_16x16_32x32_1x1_16x16x1_16x16x1_1x32x1x8_8_1x1_intrawave_v1,355.57,1477.12,0.0
256,256,4608,7168,ck,18,0,36.301,a8w8_blockscale_1x128x128_256x64x64x256_16x16_32x32_1x1_16x16x1_16x16x1_1x32x1x8_8_1x1_intrawave_v1,465.87,1025.44,0.0
256,512,4608,7168,ck,18,0,54.8972,a8w8_blockscale_1x128x128_256x64x64x256_16x16_32x32_1x1_16x16x1_16x16x1_1x32x1x8_8_1x1_intrawave_v1,616.11,754.48,0.0
256,1024,4608,7168,ck,0,0,90.5685,a8w8_blockscale_1x128x128_256x128x128x128_16x16_32x32_2x2_8x32x1_8x32x1_1x32x1x8_8_1x1_intrawave_v3,746.9,549.94,0.0
256,1536,4608,7168,ck,0,0,104.829,a8w8_blockscale_1x128x128_256x128x128x128_16x16_32x32_2x2_8x32x1_8x32x1_1x32x1x8_8_1x1_intrawave_v3,967.94,555.15,0.0
256,2048,4608,7168,ck,0,0,147.1064,a8w8_blockscale_1x128x128_256x128x128x128_16x16_32x32_2x2_8x32x1_8x32x1_1x32x1x8_8_1x1_intrawave_v3,919.68,452.63,0.0
256,4096,4608,7168,ck,0,0,240.5825,a8w8_blockscale_1x128x128_256x128x128x128_16x16_32x32_2x2_8x32x1_8x32x1_1x32x1x8_8_1x1_intrawave_v3,1124.7,416.24,0.0
256,8192,4608,7168,ck,0,0,441.2084,a8w8_blockscale_1x128x128_256x128x128x128_16x16_32x32_2x2_8x32x1_8x32x1_1x32x1x8_8_1x1_intrawave_v3,1226.55,379.07,0.0
256,16384,4608,7168,ck,0,0,855.9478,a8w8_blockscale_1x128x128_256x128x128x128_16x16_32x32_2x2_8x32x1_8x32x1_1x32x1x8_8_1x1_intrawave_v3,1264.48,352.2,0.0
256,20480,4608,7168,ck,0,0,1076.9916,a8w8_blockscale_1x128x128_256x128x128x128_16x16_32x32_2x2_8x32x1_8x32x1_1x32x1x8_8_1x1_intrawave_v3,1256.2,342.23,0.0
256,16,7168,256,ck,8,0,2.9938,a8w8_blockscale_1x128x128_256x16x64x256_16x16_16x16_1x1_16x16x1_16x16x1_1x16x1x16_4_1x1_intrawave_v1,19.61,690.92,0.0
256,16,7168,2304,ck,8,0,8.8896,a8w8_blockscale_1x128x128_256x16x64x256_16x16_16x16_1x1_16x16x1_16x16x1_1x16x1x16_4_1x1_intrawave_v1,59.45,1887.75,0.0
256,32,7168,256,ck,8,0,3.3934,a8w8_blockscale_1x128x128_256x16x64x256_16x16_16x16_1x1_16x16x1_16x16x1_1x16x1x16_4_1x1_intrawave_v1,34.61,678.36,0.0
256,32,7168,2304,ck,8,0,8.7272,a8w8_blockscale_1x128x128_256x16x64x256_16x16_16x16_1x1_16x16x1_16x16x1_1x16x1x16_4_1x1_intrawave_v1,121.11,1953.38,0.0
256,64,7168,256,ck,13,0,3.7663,a8w8_blockscale_1x128x128_256x32x64x256_16x16_16x16_2x1_16x16x1_16x16x1_1x32x1x8_8_2x1_intrawave_v1,62.36,735.18,0.0
256,64,7168,2304,ck,7,0,9.7262,a8w8_blockscale_1x128x128_256x16x128x256_16x16_16x16_1x2_16x16x1_16x16x1_1x16x1x16_8_1x2_intrawave_v1,217.34,1807.49,0.0
256,128,7168,256,ck,7,0,4.495,a8w8_blockscale_1x128x128_256x16x128x256_16x16_16x16_1x2_16x16x1_16x16x1_1x16x1x16_8_1x2_intrawave_v1,104.51,823.76,0.0
256,128,7168,2304,ck,18,0,10.3294,a8w8_blockscale_1x128x128_256x64x64x256_16x16_32x32_1x1_16x16x1_16x16x1_1x32x1x8_8_1x1_intrawave_v1,409.3,1805.04,0.0
256,256,7168,256,ck,13,0,5.6263,a8w8_blockscale_1x128x128_256x32x64x256_16x16_16x16_2x1_16x16x1_16x16x1_1x32x1x8_8_2x1_intrawave_v1,166.99,990.09,0.0
256,256,7168,2304,ck,18,0,15.5447,a8w8_blockscale_1x128x128_256x64x64x256_16x16_32x32_1x1_16x16x1_16x16x1_1x32x1x8_8_1x1_intrawave_v1,543.96,1336.46,0.0
256,512,7168,256,ck,13,0,7.6578,a8w8_blockscale_1x128x128_256x32x64x256_16x16_16x16_2x1_16x16x1_16x16x1_1x32x1x8_8_2x1_intrawave_v1,245.38,1215.25,0.0
256,512,7168,2304,ck,0,0,21.1565,a8w8_blockscale_1x128x128_256x128x128x128_16x16_32x32_2x2_8x32x1_8x32x1_1x32x1x8_8_1x1_intrawave_v3,799.35,1183.31,0.0
256,1024,7168,256,ck,18,0,11.7764,a8w8_blockscale_1x128x128_256x64x64x256_16x16_32x32_1x1_16x16x1_16x16x1_1x32x1x8_8_1x1_intrawave_v1,319.12,1424.65,0.0
256,1024,7168,2304,ck,0,0,36.7479,a8w8_blockscale_1x128x128_256x128x128x128_16x16_32x32_2x2_8x32x1_8x32x1_1x32x1x8_8_1x1_intrawave_v3,920.4,913.1,0.0
256,1536,7168,256,ck,18,0,15.2456,a8w8_blockscale_1x128x128_256x64x64x256_16x16_32x32_1x1_16x16x1_16x16x1_1x32x1x8_8_1x1_intrawave_v1,369.76,1590.51,0.0
256,1536,7168,2304,ck,0,0,52.7484,a8w8_blockscale_1x128x128_256x128x128x128_16x16_32x32_2x2_8x32x1_8x32x1_1x32x1x8_8_1x1_intrawave_v3,961.82,797.64,0.0
256,2048,7168,256,cktile,10,0,19.6283,a8w8_blockscale_cktile_64x128x128_2x2x1_32x32x16_intrawave_0x0x0x0_1,382.93,1616.0,0.0
256,2048,7168,2304,ck,0,0,70.9389,a8w8_blockscale_1x128x128_256x128x128x128_16x16_32x32_2x2_8x32x1_8x32x1_1x32x1x8_8_1x1_intrawave_v3,953.58,713.2,0.0
256,4096,7168,256,ck,18,0,34.9763,a8w8_blockscale_1x128x128_256x64x64x256_16x16_32x32_1x1_16x16x1_16x16x1_1x32x1x8_8_1x1_intrawave_v1,429.79,1761.3,0.0
256,4096,7168,2304,ck,0,0,125.756,a8w8_blockscale_1x128x128_256x128x128x128_16x16_32x32_2x2_8x32x1_8x32x1_1x32x1x8_8_1x1_intrawave_v3,1075.83,673.31,0.0
256,8192,7168,256,ck,15,0,67.1313,a8w8_blockscale_1x128x128_256x64x128x128_16x16_32x32_2x1_8x32x1_8x32x1_1x32x1x8_8_1x1_intrawave_v1,447.85,1807.99,0.0
256,8192,7168,2304,ck,0,0,238.587,a8w8_blockscale_1x128x128_256x128x128x128_16x16_32x32_2x2_8x32x1_8x32x1_1x32x1x8_8_1x1_intrawave_v3,1134.11,640.56,0.0
256,16384,7168,256,cktile,6,0,122.7395,a8w8_blockscale_cktile_128x128x128_2x2x1_16x16x32_intrawave_0x0x0x0_1,489.9,1962.78,0.0
256,16384,7168,2304,ck,0,0,450.2119,a8w8_blockscale_1x128x128_256x128x128x128_16x16_32x32_2x2_8x32x1_8x32x1_1x32x1x8_8_1x1_intrawave_v3,1202.02,642.24,0.0
256,20480,7168,256,ck,15,0,151.072,a8w8_blockscale_1x128x128_256x64x128x128_16x16_32x32_2x1_8x32x1_8x32x1_1x32x1x8_8_1x1_intrawave_v1,497.52,1990.3,0.0
256,20480,7168,2304,ck,0,0,567.063,a8w8_blockscale_1x128x128_256x128x128x128_16x16_32x32_2x2_8x32x1_8x32x1_1x32x1x8_8_1x1_intrawave_v3,1192.91,630.09,0.0
256,1,9216,2048,ck,8,0,8.9595,a8w8_blockscale_1x128x128_256x16x64x256_16x16_16x16_1x1_16x16x1_16x16x1_1x16x1x16_4_1x1_intrawave_v1,4.21,2108.92,0.0
256,2,9216,2048,ck,8,0,8.4191,a8w8_blockscale_1x128x128_256x16x64x256_16x16_16x16_1x1_16x16x1_16x16x1_1x16x1x16_4_1x1_intrawave_v1,8.97,2246.72,0.0
256,4,9216,2048,ck,8,0,7.8735,a8w8_blockscale_1x128x128_256x16x64x256_16x16_16x16_1x1_16x16x1_16x16x1_1x16x1x16_4_1x1_intrawave_v1,19.18,2407.61,0.0
256,8,9216,2048,ck,8,0,7.8446,a8w8_blockscale_1x128x128_256x16x64x256_16x16_16x16_1x1_16x16x1_16x16x1_1x16x1x16_4_1x1_intrawave_v1,38.5,2426.92,0.0
256,16,9216,2048,ck,8,0,7.6418,a8w8_blockscale_1x128x128_256x16x64x256_16x16_16x16_1x1_16x16x1_16x16x1_1x16x1x16_4_1x1_intrawave_v1,79.04,2512.77,0.0
256,32,9216,2048,ck,7,0,9.5053,a8w8_blockscale_1x128x128_256x16x128x256_16x16_16x16_1x2_16x16x1_16x16x1_1x16x1x16_8_1x2_intrawave_v1,127.08,2054.61,0.0
256,48,9216,2048,ck,7,0,9.5878,a8w8_blockscale_1x128x128_256x16x128x256_16x16_16x16_1x2_16x16x1_16x16x1_1x16x1x16_8_1x2_intrawave_v1,188.98,2071.11,0.0
256,64,9216,2048,ck,18,0,9.6874,a8w8_blockscale_1x128x128_256x64x64x256_16x16_32x32_1x1_16x16x1_16x16x1_1x32x1x8_8_1x1_intrawave_v1,249.39,2083.64,0.0
256,80,9216,2048,ck,12,0,12.0834,a8w8_blockscale_1x128x128_256x32x128x256_16x16_32x32_1x1_16x16x1_16x16x1_1x32x1x8_8_1x1_intrawave_v1,249.92,1697.6,0.0
256,96,9216,2048,ck,12,0,11.3729,a8w8_blockscale_1x128x128_256x32x128x256_16x16_32x32_1x1_16x16x1_16x16x1_1x32x1x8_8_1x1_intrawave_v1,318.64,1832.47,0.0
256,112,9216,2048,ck,5,0,15.0268,a8w8_blockscale_1x128x128_256x16x128x128_8x16_16x16_1x2_16x16x1_8x32x1_1x16x1x16_8_1x2_intrawave_v1,281.35,1408.69,0.0
256,128,9216,2048,ck,2,0,15.5954,a8w8_blockscale_1x128x128_256x64x128x128_16x16_32x32_1x2_8x32x1_8x32x1_1x32x1x8_8_1x1_intrawave_v3,309.82,1378.34,0.0
256,256,9216,2048,ck,0,0,19.486,a8w8_blockscale_1x128x128_256x128x128x128_16x16_32x32_2x2_8x32x1_8x32x1_1x32x1x8_8_1x1_intrawave_v3,495.93,1237.67,0.0
256,512,9216,2048,ck,2,0,29.5764,a8w8_blockscale_1x128x128_256x64x128x128_16x16_32x32_1x2_8x32x1_8x32x1_1x32x1x8_8_1x1_intrawave_v3,653.47,992.69,0.0
256,667,9216,2048,ck,0,0,32.7232,a8w8_blockscale_1x128x128_256x128x128x128_16x16_32x32_2x2_8x32x1_8x32x1_1x32x1x8_8_1x1_intrawave_v3,769.44,994.23,0.0
256,671,9216,2048,ck,0,0,32.9127,a8w8_blockscale_1x128x128_256x128x128x128_16x16_32x32_2x2_8x32x1_8x32x1_1x32x1x8_8_1x1_intrawave_v3,769.59,991.0,0.0
256,931,9216,2048,ck,0,0,46.1736,a8w8_blockscale_1x128x128_256x128x128x128_16x16_32x32_2x2_8x32x1_8x32x1_1x32x1x8_8_1x1_intrawave_v3,761.13,821.71,0.0
256,1024,9216,2048,ck,0,0,46.3969,a8w8_blockscale_1x128x128_256x128x128x128_16x16_32x32_2x2_8x32x1_8x32x1_1x32x1x8_8_1x1_intrawave_v3,833.13,858.8,0.0
256,1025,9216,2048,ck,0,0,46.0155,a8w8_blockscale_1x128x128_256x128x128x128_16x16_32x32_2x2_8x32x1_8x32x1_1x32x1x8_8_1x1_intrawave_v3,840.86,866.37,0.0
256,1027,9216,2048,ck,0,0,46.4058,a8w8_blockscale_1x128x128_256x128x128x128_16x16_32x32_2x2_8x32x1_8x32x1_1x32x1x8_8_1x1_intrawave_v3,835.41,859.96,0.0
256,1031,9216,2048,ck,0,0,46.8955,a8w8_blockscale_1x128x128_256x128x128x128_16x16_32x32_2x2_8x32x1_8x32x1_1x32x1x8_8_1x1_intrawave_v3,829.91,852.73,0.0
256,1039,9216,2048,ck,0,0,46.8814,a8w8_blockscale_1x128x128_256x128x128x128_16x16_32x32_2x2_8x32x1_8x32x1_1x32x1x8_8_1x1_intrawave_v3,836.6,856.48,0.0
256,1040,9216,2048,ck,0,0,46.3823,a8w8_blockscale_1x128x128_256x128x128x128_16x16_32x32_2x2_8x32x1_8x32x1_1x32x1x8_8_1x1_intrawave_v3,846.42,866.14,0.0
256,1041,9216,2048,ck,0,0,46.0815,a8w8_blockscale_1x128x128_256x128x128x128_16x16_32x32_2x2_8x32x1_8x32x1_1x32x1x8_8_1x1_intrawave_v3,852.76,872.24,0.0
256,1072,9216,2048,ck,0,0,47.2656,a8w8_blockscale_1x128x128_256x128x128x128_16x16_32x32_2x2_8x32x1_8x32x1_1x32x1x8_8_1x1_intrawave_v3,856.15,863.82,0.0
256,1073,9216,2048,ck,0,0,46.8741,a8w8_blockscale_1x128x128_256x128x128x128_16x16_32x32_2x2_8x32x1_8x32x1_1x32x1x8_8_1x1_intrawave_v3,864.11,871.47,0.0
256,1077,9216,2048,ck,0,0,46.6883,a8w8_blockscale_1x128x128_256x128x128x128_16x16_32x32_2x2_8x32x1_8x32x1_1x32x1x8_8_1x1_intrawave_v3,870.78,876.69,0.0
256,1091,9216,2048,ck,0,0,46.2475,a8w8_blockscale_1x128x128_256x128x128x128_16x16_32x32_2x2_8x32x1_8x32x1_1x32x1x8_8_1x1_intrawave_v3,890.51,891.25,0.0
256,1343,9216,2048,ck,2,0,57.0523,a8w8_blockscale_1x128x128_256x64x128x128_16x16_32x32_1x2_8x32x1_8x32x1_1x32x1x8_8_1x1_intrawave_v3,888.6,812.92,0.0
256,1688,9216,2048,ck,0,0,63.0511,a8w8_blockscale_1x128x128_256x128x128x128_16x16_32x32_2x2_8x32x1_8x32x1_1x32x1x8_8_1x1_intrawave_v3,1010.61,847.64,0.0
256,2017,9216,2048,ck,0,0,75.0372,a8w8_blockscale_1x128x128_256x128x128x128_16x16_32x32_2x2_8x32x1_8x32x1_1x32x1x8_8_1x1_intrawave_v3,1014.69,802.04,0.0
256,2048,9216,2048,ck,0,0,74.7564,a8w8_blockscale_1x128x128_256x128x128x128_16x16_32x32_2x2_8x32x1_8x32x1_1x32x1x8_8_1x1_intrawave_v3,1034.15,813.54,0.0
256,2050,9216,2048,ck,0,0,78.2972,a8w8_blockscale_1x128x128_256x128x128x128_16x16_32x32_2x2_8x32x1_8x32x1_1x32x1x8_8_1x1_intrawave_v3,988.35,777.27,0.0
256,2063,9216,2048,ck,0,0,76.9128,a8w8_blockscale_1x128x128_256x128x128x128_16x16_32x32_2x2_8x32x1_8x32x1_1x32x1x8_8_1x1_intrawave_v3,1012.52,794.73,0.0
256,2064,9216,2048,ck,0,0,76.118,a8w8_blockscale_1x128x128_256x128x128x128_16x16_32x32_2x2_8x32x1_8x32x1_1x32x1x8_8_1x1_intrawave_v3,1023.59,803.29,0.0
256,2099,9216,2048,ck,0,0,77.1708,a8w8_blockscale_1x128x128_256x128x128x128_16x16_32x32_2x2_8x32x1_8x32x1_1x32x1x8_8_1x1_intrawave_v3,1026.74,801.62,0.0
256,2159,9216,2048,ck,0,0,76.6376,a8w8_blockscale_1x128x128_256x128x128x128_16x16_32x32_2x2_8x32x1_8x32x1_1x32x1x8_8_1x1_intrawave_v3,1063.44,823.23,0.0
256,2160,9216,2048,ck,0,0,75.4436,a8w8_blockscale_1x128x128_256x128x128x128_16x16_32x32_2x2_8x32x1_8x32x1_1x32x1x8_8_1x1_intrawave_v3,1080.77,836.53,0.0
256,2313,9216,2048,ck,0,0,84.8269,a8w8_blockscale_1x128x128_256x128x128x128_16x16_32x32_2x2_8x32x1_8x32x1_1x32x1x8_8_1x1_intrawave_v3,1029.31,780.94,0.0
256,2325,9216,2048,ck,0,0,85.6545,a8w8_blockscale_1x128x128_256x128x128x128_16x16_32x32_2x2_8x32x1_8x32x1_1x32x1x8_8_1x1_intrawave_v3,1024.65,776.26,0.0
256,3072,9216,2048,ck,0,0,100.4706,a8w8_blockscale_1x128x128_256x128x128x128_16x16_32x32_2x2_8x32x1_8x32x1_1x32x1x8_8_1x1_intrawave_v3,1154.21,814.06,0.0
256,3073,9216,2048,ck,0,0,110.4527,a8w8_blockscale_1x128x128_256x128x128x128_16x16_32x32_2x2_8x32x1_8x32x1_1x32x1x8_8_1x1_intrawave_v3,1050.24,740.67,0.0
256,3182,9216,2048,ck,0,0,112.1959,a8w8_blockscale_1x128x128_256x128x128x128_16x16_32x32_2x2_8x32x1_8x32x1_1x32x1x8_8_1x1_intrawave_v3,1070.6,749.06,0.0
256,3183,9216,2048,ck,0,0,110.2171,a8w8_blockscale_1x128x128_256x128x128x128_16x16_32x32_2x2_8x32x1_8x32x1_1x32x1x8_8_1x1_intrawave_v3,1090.16,762.7,0.0
256,3847,9216,2048,ck,0,0,130.8829,a8w8_blockscale_1x128x128_256x128x128x128_16x16_32x32_2x2_8x32x1_8x32x1_1x32x1x8_8_1x1_intrawave_v3,1109.54,746.17,0.0
256,4096,9216,2048,ck,0,0,130.1794,a8w8_blockscale_1x128x128_256x128x128x128_16x16_32x32_2x2_8x32x1_8x32x1_1x32x1x8_8_1x1_intrawave_v3,1187.74,789.38,0.0
256,4111,9216,2048,ck,0,0,135.4781,a8w8_blockscale_1x128x128_256x128x128x128_16x16_32x32_2x2_8x32x1_8x32x1_1x32x1x8_8_1x1_intrawave_v3,1145.46,760.77,0.0
256,4141,9216,2048,ck,0,0,140.0997,a8w8_blockscale_1x128x128_256x128x128x128_16x16_32x32_2x2_8x32x1_8x32x1_1x32x1x8_8_1x1_intrawave_v3,1115.76,740.06,0.0
256,4142,9216,2048,ck,0,0,139.2869,a8w8_blockscale_1x128x128_256x128x128x128_16x16_32x32_2x2_8x32x1_8x32x1_1x32x1x8_8_1x1_intrawave_v3,1122.54,744.52,0.0
256,4345,9216,2048,ck,0,0,140.8588,a8w8_blockscale_1x128x128_256x128x128x128_16x16_32x32_2x2_8x32x1_8x32x1_1x32x1x8_8_1x1_intrawave_v3,1164.42,765.73,0.0
256,5105,9216,2048,ck,0,0,161.3644,a8w8_blockscale_1x128x128_256x128x128x128_16x16_32x32_2x2_8x32x1_8x32x1_1x32x1x8_8_1x1_intrawave_v3,1194.24,764.88,0.0
256,5121,9216,2048,ck,0,0,163.7022,a8w8_blockscale_1x128x128_256x128x128x128_16x16_32x32_2x2_8x32x1_8x32x1_1x32x1x8_8_1x1_intrawave_v3,1180.87,755.96,0.0
256,5123,9216,2048,ck,0,0,165.4571,a8w8_blockscale_1x128x128_256x128x128x128_16x16_32x32_2x2_8x32x1_8x32x1_1x32x1x8_8_1x1_intrawave_v3,1168.8,748.19,0.0
256,5131,9216,2048,ck,0,0,162.1933,a8w8_blockscale_1x128x128_256x128x128x128_16x16_32x32_2x2_8x32x1_8x32x1_1x32x1x8_8_1x1_intrawave_v3,1194.18,764.26,0.0
256,5427,9216,2048,ck,0,0,175.3527,a8w8_blockscale_1x128x128_256x128x128x128_16x16_32x32_2x2_8x32x1_8x32x1_1x32x1x8_8_1x1_intrawave_v3,1168.29,741.47,0.0
256,6113,9216,2048,ck,0,0,188.0648,a8w8_blockscale_1x128x128_256x128x128x128_16x16_32x32_2x2_8x32x1_8x32x1_1x32x1x8_8_1x1_intrawave_v3,1227.01,766.06,0.0
256,6197,9216,2048,ck,0,0,191.1127,a8w8_blockscale_1x128x128_256x128x128x128_16x16_32x32_2x2_8x32x1_8x32x1_1x32x1x8_8_1x1_intrawave_v3,1224.04,762.84,0.0
256,6409,9216,2048,ck,0,0,200.4163,a8w8_blockscale_1x128x128_256x128x128x128_16x16_32x32_2x2_8x32x1_8x32x1_1x32x1x8_8_1x1_intrawave_v3,1207.15,749.09,0.0
256,7121,9216,2048,ck,0,0,211.4224,a8w8_blockscale_1x128x128_256x128x128x128_16x16_32x32_2x2_8x32x1_8x32x1_1x32x1x8_8_1x1_intrawave_v3,1271.43,779.07,0.0
256,7168,9216,2048,ck,0,0,206.9236,a8w8_blockscale_1x128x128_256x128x128x128_16x16_32x32_2x2_8x32x1_8x32x1_1x32x1x8_8_1x1_intrawave_v3,1307.65,800.66,0.0
256,7169,9216,2048,ck,0,0,217.1004,a8w8_blockscale_1x128x128_256x128x128x128_16x16_32x32_2x2_8x32x1_8x32x1_1x32x1x8_8_1x1_intrawave_v3,1246.52,763.22,0.0
256,7172,9216,2048,ck,0,0,216.3851,a8w8_blockscale_1x128x128_256x128x128x128_16x16_32x32_2x2_8x32x1_8x32x1_1x32x1x8_8_1x1_intrawave_v3,1251.17,766.03,0.0
256,7176,9216,2048,ck,0,0,220.6855,a8w8_blockscale_1x128x128_256x128x128x128_16x16_32x32_2x2_8x32x1_8x32x1_1x32x1x8_8_1x1_intrawave_v3,1227.47,751.47,0.0
256,7177,9216,2048,ck,0,0,223.5303,a8w8_blockscale_1x128x128_256x128x128x128_16x16_32x32_2x2_8x32x1_8x32x1_1x32x1x8_8_1x1_intrawave_v3,1212.02,742.0,0.0
256,7178,9216,2048,ck,0,0,219.2688,a8w8_blockscale_1x128x128_256x128x128x128_16x16_32x32_2x2_8x32x1_8x32x1_1x32x1x8_8_1x1_intrawave_v3,1235.75,756.51,0.0
256,7179,9216,2048,ck,0,0,219.9529,a8w8_blockscale_1x128x128_256x128x128x128_16x16_32x32_2x2_8x32x1_8x32x1_1x32x1x8_8_1x1_intrawave_v3,1232.07,754.25,0.0
256,7183,9216,2048,ck,0,0,218.3672,a8w8_blockscale_1x128x128_256x128x128x128_16x16_32x32_2x2_8x32x1_8x32x1_1x32x1x8_8_1x1_intrawave_v3,1241.71,760.11,0.0
256,7184,9216,2048,ck,0,0,221.6012,a8w8_blockscale_1x128x128_256x128x128x128_16x16_32x32_2x2_8x32x1_8x32x1_1x32x1x8_8_1x1_intrawave_v3,1223.76,749.11,0.0
256,7209,9216,2048,ck,0,0,217.8816,a8w8_blockscale_1x128x128_256x128x128x128_16x16_32x32_2x2_8x32x1_8x32x1_1x32x1x8_8_1x1_intrawave_v3,1248.98,764.24,0.0
256,7210,9216,2048,ck,0,0,219.8194,a8w8_blockscale_1x128x128_256x128x128x128_16x16_32x32_2x2_8x32x1_8x32x1_1x32x1x8_8_1x1_intrawave_v3,1238.15,757.6,0.0
256,7211,9216,2048,ck,0,0,217.6988,a8w8_blockscale_1x128x128_256x128x128x128_16x16_32x32_2x2_8x32x1_8x32x1_1x32x1x8_8_1x1_intrawave_v3,1250.38,765.07,0.0
256,7217,9216,2048,ck,0,0,220.5636,a8w8_blockscale_1x128x128_256x128x128x128_16x16_32x32_2x2_8x32x1_8x32x1_1x32x1x8_8_1x1_intrawave_v3,1235.17,755.69,0.0
256,7273,9216,2048,ck,0,0,222.0853,a8w8_blockscale_1x128x128_256x128x128x128_16x16_32x32_2x2_8x32x1_8x32x1_1x32x1x8_8_1x1_intrawave_v3,1236.22,755.68,0.0
256,7274,9216,2048,ck,0,0,218.974,a8w8_blockscale_1x128x128_256x128x128x128_16x16_32x32_2x2_8x32x1_8x32x1_1x32x1x8_8_1x1_intrawave_v3,1253.96,766.51,0.0
256,7391,9216,2048,ck,0,0,222.34,a8w8_blockscale_1x128x128_256x128x128x128_16x16_32x32_2x2_8x32x1_8x32x1_1x32x1x8_8_1x1_intrawave_v3,1254.84,765.68,0.0
256,7393,9216,2048,ck,0,0,221.0556,a8w8_blockscale_1x128x128_256x128x128x128_16x16_32x32_2x2_8x32x1_8x32x1_1x32x1x8_8_1x1_intrawave_v3,1262.47,770.32,0.0
256,7715,9216,2048,ck,0,0,232.9057,a8w8_blockscale_1x128x128_256x128x128x128_16x16_32x32_2x2_8x32x1_8x32x1_1x32x1x8_8_1x1_intrawave_v3,1250.43,759.44,0.0
256,7753,9216,2048,ck,0,0,233.0877,a8w8_blockscale_1x128x128_256x128x128x128_16x16_32x32_2x2_8x32x1_8x32x1_1x32x1x8_8_1x1_intrawave_v3,1255.6,762.18,0.0
256,7819,9216,2048,ck,0,0,235.4838,a8w8_blockscale_1x128x128_256x128x128x128_16x16_32x32_2x2_8x32x1_8x32x1_1x32x1x8_8_1x1_intrawave_v3,1253.41,760.17,0.0
256,8099,9216,2048,ck,0,0,241.9854,a8w8_blockscale_1x128x128_256x128x128x128_16x16_32x32_2x2_8x32x1_8x32x1_1x32x1x8_8_1x1_intrawave_v3,1263.41,763.44,0.0
256,8129,9216,2048,ck,0,0,242.3222,a8w8_blockscale_1x128x128_256x128x128x128_16x16_32x32_2x2_8x32x1_8x32x1_1x32x1x8_8_1x1_intrawave_v3,1266.33,764.92,0.0
256,8188,9216,2048,ck,0,0,241.2454,a8w8_blockscale_1x128x128_256x128x128x128_16x16_32x32_2x2_8x32x1_8x32x1_1x32x1x8_8_1x1_intrawave_v3,1281.21,773.34,0.0
256,8192,9216,2048,ck,0,0,234.4942,a8w8_blockscale_1x128x128_256x128x128x128_16x16_32x32_2x2_8x32x1_8x32x1_1x32x1x8_8_1x1_intrawave_v3,1318.74,795.95,0.0
256,1,12288,2048,ck,8,0,8.7946,a8w8_blockscale_1x128x128_256x16x64x256_16x16_16x16_1x1_16x16x1_16x16x1_1x16x1x16_4_1x1_intrawave_v1,5.72,2864.54,0.0
256,2,12288,2048,ck,8,0,8.3447,a8w8_blockscale_1x128x128_256x16x64x256_16x16_16x16_1x1_16x16x1_16x16x1_1x16x1x16_4_1x1_intrawave_v1,12.06,3022.17,0.0
256,4,12288,2048,ck,8,0,8.364,a8w8_blockscale_1x128x128_256x16x64x256_16x16_16x16_1x1_16x16x1_16x16x1_1x16x1x16_4_1x1_intrawave_v1,24.07,3021.56,0.0
256,8,12288,2048,ck,8,0,8.4116,a8w8_blockscale_1x128x128_256x16x64x256_16x16_16x16_1x1_16x16x1_16x16x1_1x16x1x16_4_1x1_intrawave_v1,47.87,3017.12,0.0
256,16,12288,2048,ck,8,0,7.9937,a8w8_blockscale_1x128x128_256x16x64x256_16x16_16x16_1x1_16x16x1_16x16x1_1x16x1x16_4_1x1_intrawave_v1,100.74,3201.5,0.0
256,32,12288,2048,ck,7,0,9.8977,a8w8_blockscale_1x128x128_256x16x128x256_16x16_16x16_1x2_16x16x1_16x16x1_1x16x1x16_8_1x2_intrawave_v1,162.73,2628.67,0.0
256,48,12288,2048,ck,18,0,11.5843,a8w8_blockscale_1x128x128_256x64x64x256_16x16_32x32_1x1_16x16x1_16x16x1_1x32x1x8_8_1x1_intrawave_v1,208.55,2282.73,0.0
256,64,12288,2048,ck,18,0,10.2408,a8w8_blockscale_1x128x128_256x64x64x256_16x16_32x32_1x1_16x16x1_16x16x1_1x32x1x8_8_1x1_intrawave_v1,314.55,2623.8,0.0
256,80,12288,2048,ck,5,0,15.5756,a8w8_blockscale_1x128x128_256x16x128x128_8x16_16x16_1x2_16x16x1_8x32x1_1x16x1x16_8_1x2_intrawave_v1,258.52,1752.47,0.0
256,96,12288,2048,ck,2,0,15.8263,a8w8_blockscale_1x128x128_256x64x128x128_16x16_32x32_1x2_8x32x1_8x32x1_1x32x1x8_8_1x1_intrawave_v3,305.3,1751.62,0.0
256,112,12288,2048,ck,2,0,15.9461,a8w8_blockscale_1x128x128_256x64x128x128_16x16_32x32_1x2_8x32x1_8x32x1_1x32x1x8_8_1x1_intrawave_v3,353.51,1765.18,0.0
256,128,12288,2048,ck,2,0,15.8405,a8w8_blockscale_1x128x128_256x64x128x128_16x16_32x32_1x2_8x32x1_8x32x1_1x32x1x8_8_1x1_intrawave_v3,406.71,1803.84,0.0
256,256,12288,2048,ck,0,0,19.9211,a8w8_blockscale_1x128x128_256x128x128x128_16x16_32x32_2x2_8x32x1_8x32x1_1x32x1x8_8_1x1_intrawave_v3,646.8,1605.41,0.0
256,512,12288,2048,ck,2,0,31.4351,a8w8_blockscale_1x128x128_256x64x128x128_16x16_32x32_1x2_8x32x1_8x32x1_1x32x1x8_8_1x1_intrawave_v3,819.78,1234.2,0.0
256,667,12288,2048,ck,0,0,45.0878,a8w8_blockscale_1x128x128_256x128x128x128_16x16_32x32_2x2_8x32x1_8x32x1_1x32x1x8_8_1x1_intrawave_v3,744.57,952.01,0.0
256,671,12288,2048,ck,2,0,45.4758,a8w8_blockscale_1x128x128_256x64x128x128_16x16_32x32_1x2_8x32x1_8x32x1_1x32x1x8_8_1x1_intrawave_v3,742.65,946.23,0.0
256,931,12288,2048,ck,0,0,49.9586,a8w8_blockscale_1x128x128_256x128x128x128_16x16_32x32_2x2_8x32x1_8x32x1_1x32x1x8_8_1x1_intrawave_v3,937.95,999.88,0.0
256,1024,12288,2048,ck,0,0,50.347,a8w8_blockscale_1x128x128_256x128x128x128_16x16_32x32_2x2_8x32x1_8x32x1_1x32x1x8_8_1x1_intrawave_v3,1023.69,1041.35,0.0
256,1025,12288,2048,ck,0,0,58.2671,a8w8_blockscale_1x128x128_256x128x128x128_16x16_32x32_2x2_8x32x1_8x32x1_1x32x1x8_8_1x1_intrawave_v3,885.4,900.26,0.0
256,1027,12288,2048,ck,0,0,58.6743,a8w8_blockscale_1x128x128_256x128x128x128_16x16_32x32_2x2_8x32x1_8x32x1_1x32x1x8_8_1x1_intrawave_v3,880.98,894.92,0.0
256,1031,12288,2048,ck,0,0,59.0327,a8w8_blockscale_1x128x128_256x128x128x128_16x16_32x32_2x2_8x32x1_8x32x1_1x32x1x8_8_1x1_intrawave_v3,879.04,891.29,0.0
256,1039,12288,2048,ck,0,0,58.5319,a8w8_blockscale_1x128x128_256x128x128x128_16x16_32x32_2x2_8x32x1_8x32x1_1x32x1x8_8_1x1_intrawave_v3,893.44,902.55,0.0
256,1040,12288,2048,ck,0,0,59.3051,a8w8_blockscale_1x128x128_256x128x128x128_16x16_32x32_2x2_8x32x1_8x32x1_1x32x1x8_8_1x1_intrawave_v3,882.64,891.24,0.0
256,1041,12288,2048,ck,0,0,59.5491,a8w8_blockscale_1x128x128_256x128x128x128_16x16_32x32_2x2_8x32x1_8x32x1_1x32x1x8_8_1x1_intrawave_v3,879.87,888.03,0.0
256,1072,12288,2048,ck,0,0,59.2991,a8w8_blockscale_1x128x128_256x128x128x128_16x16_32x32_2x2_8x32x1_8x32x1_1x32x1x8_8_1x1_intrawave_v3,909.89,905.69,0.0
256,1073,12288,2048,ck,0,0,59.0703,a8w8_blockscale_1x128x128_256x128x128x128_16x16_32x32_2x2_8x32x1_8x32x1_1x32x1x8_8_1x1_intrawave_v3,914.26,909.65,0.0
256,1077,12288,2048,ck,0,0,58.713,a8w8_blockscale_1x128x128_256x128x128x128_16x16_32x32_2x2_8x32x1_8x32x1_1x32x1x8_8_1x1_intrawave_v3,923.26,917.0,0.0
256,1091,12288,2048,ck,0,0,59.5867,a8w8_blockscale_1x128x128_256x128x128x128_16x16_32x32_2x2_8x32x1_8x32x1_1x32x1x8_8_1x1_intrawave_v3,921.55,909.81,0.0
256,1343,12288,2048,ck,0,0,72.544,a8w8_blockscale_1x128x128_256x128x128x128_16x16_32x32_2x2_8x32x1_8x32x1_1x32x1x8_8_1x1_intrawave_v3,931.78,839.79,0.0
256,1688,12288,2048,ck,0,0,87.5345,a8w8_blockscale_1x128x128_256x128x128x128_16x16_32x32_2x2_8x32x1_8x32x1_1x32x1x8_8_1x1_intrawave_v3,970.59,800.91,0.0
256,2017,12288,2048,ck,0,0,92.3241,a8w8_blockscale_1x128x128_256x128x128x128_16x16_32x32_2x2_8x32x1_8x32x1_1x32x1x8_8_1x1_intrawave_v3,1099.59,854.23,0.0
256,2048,12288,2048,ck,0,0,92.1561,a8w8_blockscale_1x128x128_256x128x128x128_16x16_32x32_2x2_8x32x1_8x32x1_1x32x1x8_8_1x1_intrawave_v3,1118.53,864.75,0.0
256,2050,12288,2048,ck,0,0,99.4961,a8w8_blockscale_1x128x128_256x128x128x128_16x16_32x32_2x2_8x32x1_8x32x1_1x32x1x8_8_1x1_intrawave_v3,1037.02,801.49,0.0
256,2063,12288,2048,ck,0,0,101.3862,a8w8_blockscale_1x128x128_256x128x128x128_16x16_32x32_2x2_8x32x1_8x32x1_1x32x1x8_8_1x1_intrawave_v3,1024.15,789.96,0.0
256,2064,12288,2048,ck,0,0,99.8378,a8w8_blockscale_1x128x128_256x128x128x128_16x16_32x32_2x2_8x32x1_8x32x1_1x32x1x8_8_1x1_intrawave_v3,1040.53,802.48,0.0
256,2099,12288,2048,ck,0,0,101.1162,a8w8_blockscale_1x128x128_256x128x128x128_16x16_32x32_2x2_8x32x1_8x32x1_1x32x1x8_8_1x1_intrawave_v3,1044.8,801.55,0.0
256,2159,12288,2048,ck,0,0,101.4334,a8w8_blockscale_1x128x128_256x128x128x128_16x16_32x32_2x2_8x32x1_8x32x1_1x32x1x8_8_1x1_intrawave_v3,1071.3,814.79,0.0
256,2160,12288,2048,ck,0,0,100.601,a8w8_blockscale_1x128x128_256x128x128x128_16x16_32x32_2x2_8x32x1_8x32x1_1x32x1x8_8_1x1_intrawave_v3,1080.67,821.8,0.0
256,2313,12288,2048,ck,0,0,110.2091,a8w8_blockscale_1x128x128_256x128x128x128_16x16_32x32_2x2_8x32x1_8x32x1_1x32x1x8_8_1x1_intrawave_v3,1056.33,787.11,0.0
256,2325,12288,2048,ck,0,0,109.4811,a8w8_blockscale_1x128x128_256x128x128x128_16x16_32x32_2x2_8x32x1_8x32x1_1x32x1x8_8_1x1_intrawave_v3,1068.87,795.27,0.0
256,3072,12288,2048,ck,0,0,127.5057,a8w8_blockscale_1x128x128_256x128x128x128_16x16_32x32_2x2_8x32x1_8x32x1_1x32x1x8_8_1x1_intrawave_v3,1212.64,838.82,0.0
256,3073,12288,2048,ck,0,0,137.0584,a8w8_blockscale_1x128x128_256x128x128x128_16x16_32x32_2x2_8x32x1_8x32x1_1x32x1x8_8_1x1_intrawave_v3,1128.49,780.55,0.0
256,3182,12288,2048,ck,0,0,139.9765,a8w8_blockscale_1x128x128_256x128x128x128_16x16_32x32_2x2_8x32x1_8x32x1_1x32x1x8_8_1x1_intrawave_v3,1144.16,785.01,0.0
256,3183,12288,2048,ck,0,0,137.7377,a8w8_blockscale_1x128x128_256x128x128x128_16x16_32x32_2x2_8x32x1_8x32x1_1x32x1x8_8_1x1_intrawave_v3,1163.12,797.97,0.0
256,3847,12288,2048,ck,0,0,169.0274,a8w8_blockscale_1x128x128_256x128x128x128_16x16_32x32_2x2_8x32x1_8x32x1_1x32x1x8_8_1x1_intrawave_v3,1145.53,754.84,0.0
256,4096,12288,2048,ck,0,0,169.2003,a8w8_blockscale_1x128x128_256x128x128x128_16x16_32x32_2x2_8x32x1_8x32x1_1x32x1x8_8_1x1_intrawave_v3,1218.43,793.25,0.0
256,4111,12288,2048,ck,0,0,180.4175,a8w8_blockscale_1x128x128_256x128x128x128_16x16_32x32_2x2_8x32x1_8x32x1_1x32x1x8_8_1x1_intrawave_v3,1146.86,746.14,0.0
256,4141,12288,2048,ck,0,0,177.1429,a8w8_blockscale_1x128x128_256x128x128x128_16x16_32x32_2x2_8x32x1_8x32x1_1x32x1x8_8_1x1_intrawave_v3,1176.58,764.44,0.0
256,4142,12288,2048,ck,0,0,177.5236,a8w8_blockscale_1x128x128_256x128x128x128_16x16_32x32_2x2_8x32x1_8x32x1_1x32x1x8_8_1x1_intrawave_v3,1174.34,762.95,0.0
256,4345,12288,2048,ck,0,0,181.0002,a8w8_blockscale_1x128x128_256x128x128x128_16x16_32x32_2x2_8x32x1_8x32x1_1x32x1x8_8_1x1_intrawave_v3,1208.24,778.16,0.0
256,5105,12288,2048,ck,0,0,201.7451,a8w8_blockscale_1x128x128_256x128x128x128_16x16_32x32_2x2_8x32x1_8x32x1_1x32x1x8_8_1x1_intrawave_v3,1273.6,798.44,0.0
256,5121,12288,2048,ck,0,0,210.1055,a8w8_blockscale_1x128x128_256x128x128x128_16x16_32x32_2x2_8x32x1_8x32x1_1x32x1x8_8_1x1_intrawave_v3,1226.76,768.7,0.0
256,5123,12288,2048,ck,0,0,208.1718,a8w8_blockscale_1x128x128_256x128x128x128_16x16_32x32_2x2_8x32x1_8x32x1_1x32x1x8_8_1x1_intrawave_v3,1238.64,776.09,0.0
256,5131,12288,2048,ck,0,0,208.3615,a8w8_blockscale_1x128x128_256x128x128x128_16x16_32x32_2x2_8x32x1_8x32x1_1x32x1x8_8_1x1_intrawave_v3,1239.44,776.41,0.0
256,5427,12288,2048,ck,0,0,222.7879,a8w8_blockscale_1x128x128_256x128x128x128_16x16_32x32_2x2_8x32x1_8x32x1_1x32x1x8_8_1x1_intrawave_v3,1226.05,761.51,0.0
256,6113,12288,2048,ck,0,0,242.9849,a8w8_blockscale_1x128x128_256x128x128x128_16x16_32x32_2x2_8x32x1_8x32x1_1x32x1x8_8_1x1_intrawave_v3,1266.24,773.37,0.0
256,6197,12288,2048,ck,0,0,245.8805,a8w8_blockscale_1x128x128_256x128x128x128_16x16_32x32_2x2_8x32x1_8x32x1_1x32x1x8_8_1x1_intrawave_v3,1268.52,773.36,0.0
256,6409,12288,2048,ck,0,0,254.1489,a8w8_blockscale_1x128x128_256x128x128x128_16x16_32x32_2x2_8x32x1_8x32x1_1x32x1x8_8_1x1_intrawave_v3,1269.24,770.41,0.0
256,7121,12288,2048,ck,0,0,276.5103,a8w8_blockscale_1x128x128_256x128x128x128_16x16_32x32_2x2_8x32x1_8x32x1_1x32x1x8_8_1x1_intrawave_v3,1296.2,776.66,0.0
256,7168,12288,2048,ck,0,0,266.1718,a8w8_blockscale_1x128x128_256x128x128x128_16x16_32x32_2x2_8x32x1_8x32x1_1x32x1x8_8_1x1_intrawave_v3,1355.43,811.53,0.0
256,7169,12288,2048,ck,0,0,280.4567,a8w8_blockscale_1x128x128_256x128x128x128_16x16_32x32_2x2_8x32x1_8x32x1_1x32x1x8_8_1x1_intrawave_v3,1286.57,770.29,0.0
256,7172,12288,2048,ck,0,0,278.7496,a8w8_blockscale_1x128x128_256x128x128x128_16x16_32x32_2x2_8x32x1_8x32x1_1x32x1x8_8_1x1_intrawave_v3,1294.99,775.29,0.0
256,7176,12288,2048,ck,0,0,282.1684,a8w8_blockscale_1x128x128_256x128x128x128_16x16_32x32_2x2_8x32x1_8x32x1_1x32x1x8_8_1x1_intrawave_v3,1280.02,766.28,0.0
256,7177,12288,2048,ck,0,0,276.3543,a8w8_blockscale_1x128x128_256x128x128x128_16x16_32x32_2x2_8x32x1_8x32x1_1x32x1x8_8_1x1_intrawave_v3,1307.13,782.5,0.0
256,7178,12288,2048,ck,0,0,275.7755,a8w8_blockscale_1x128x128_256x128x128x128_16x16_32x32_2x2_8x32x1_8x32x1_1x32x1x8_8_1x1_intrawave_v3,1310.05,784.24,0.0
256,7179,12288,2048,ck,0,0,283.5272,a8w8_blockscale_1x128x128_256x128x128x128_16x16_32x32_2x2_8x32x1_8x32x1_1x32x1x8_8_1x1_intrawave_v3,1274.41,762.89,0.0
256,7183,12288,2048,ck,0,0,278.7506,a8w8_blockscale_1x128x128_256x128x128x128_16x16_32x32_2x2_8x32x1_8x32x1_1x32x1x8_8_1x1_intrawave_v3,1296.97,776.34,0.0
256,7184,12288,2048,ck,0,0,279.4897,a8w8_blockscale_1x128x128_256x128x128x128_16x16_32x32_2x2_8x32x1_8x32x1_1x32x1x8_8_1x1_intrawave_v3,1293.72,774.39,0.0
256,7209,12288,2048,ck,0,0,279.3979,a8w8_blockscale_1x128x128_256x128x128x128_16x16_32x32_2x2_8x32x1_8x32x1_1x32x1x8_8_1x1_intrawave_v3,1298.65,777.02,0.0
256,7210,12288,2048,ck,0,0,284.7929,a8w8_blockscale_1x128x128_256x128x128x128_16x16_32x32_2x2_8x32x1_8x32x1_1x32x1x8_8_1x1_intrawave_v3,1274.23,762.4,0.0
256,7211,12288,2048,ck,0,0,279.5989,a8w8_blockscale_1x128x128_256x128x128x128_16x16_32x32_2x2_8x32x1_8x32x1_1x32x1x8_8_1x1_intrawave_v3,1298.08,776.65,0.0
256,7217,12288,2048,ck,0,0,282.3685,a8w8_blockscale_1x128x128_256x128x128x128_16x16_32x32_2x2_8x32x1_8x32x1_1x32x1x8_8_1x1_intrawave_v3,1286.42,769.6,0.0
256,7273,12288,2048,ck,0,0,279.6173,a8w8_blockscale_1x128x128_256x128x128x128_16x16_32x32_2x2_8x32x1_8x32x1_1x32x1x8_8_1x1_intrawave_v3,1309.15,782.51,0.0
256,7274,12288,2048,ck,0,0,294.961,a8w8_blockscale_1x128x128_256x128x128x128_16x16_32x32_2x2_8x32x1_8x32x1_1x32x1x8_8_1x1_intrawave_v3,1241.22,741.89,0.0
256,7391,12288,2048,ck,0,0,282.5109,a8w8_blockscale_1x128x128_256x128x128x128_16x16_32x32_2x2_8x32x1_8x32x1_1x32x1x8_8_1x1_intrawave_v3,1316.77,785.61,0.0
256,7393,12288,2048,ck,0,0,278.3221,a8w8_blockscale_1x128x128_256x128x128x128_16x16_32x32_2x2_8x32x1_8x32x1_1x32x1x8_8_1x1_intrawave_v3,1336.95,797.63,0.0
256,7715,12288,2048,ck,0,0,294.6011,a8w8_blockscale_1x128x128_256x128x128x128_16x16_32x32_2x2_8x32x1_8x32x1_1x32x1x8_8_1x1_intrawave_v3,1318.08,782.65,0.0
256,7753,12288,2048,ck,0,0,297.3272,a8w8_blockscale_1x128x128_256x128x128x128_16x16_32x32_2x2_8x32x1_8x32x1_1x32x1x8_8_1x1_intrawave_v3,1312.43,778.88,0.0
256,7819,12288,2048,ck,0,0,305.3475,a8w8_blockscale_1x128x128_256x128x128x128_16x16_32x32_2x2_8x32x1_8x32x1_1x32x1x8_8_1x1_intrawave_v3,1288.84,764.17,0.0
256,8099,12288,2048,ck,0,0,312.5376,a8w8_blockscale_1x128x128_256x128x128x128_16x16_32x32_2x2_8x32x1_8x32x1_1x32x1x8_8_1x1_intrawave_v3,1304.28,770.45,0.0
256,8129,12288,2048,ck,0,0,314.4772,a8w8_blockscale_1x128x128_256x128x128x128_16x16_32x32_2x2_8x32x1_8x32x1_1x32x1x8_8_1x1_intrawave_v3,1301.04,768.23,0.0
256,8188,12288,2048,ck,0,0,320.1821,a8w8_blockscale_1x128x128_256x128x128x128_16x16_32x32_2x2_8x32x1_8x32x1_1x32x1x8_8_1x1_intrawave_v3,1287.13,759.45,0.0
256,8192,12288,2048,ck,0,0,310.6354,a8w8_blockscale_1x128x128_256x128x128x128_16x16_32x32_2x2_8x32x1_8x32x1_1x32x1x8_8_1x1_intrawave_v3,1327.33,783.14,0.0
