aiter/configs/a8w8_bpreshuffle_tuned_gemm.csv
cu_num,M,N,K,q_dtype_w,kernelId,splitK,us,kernelName,tflops,bw,errRatio
80,192,1536,5120,torch.float8_e4m3fnuz,0,0,50.9249,a8w8_bpreshuffle_256x128x128x128_16x16_16x16_8x32x1_8x32x1_1x32x1x8_8x8x1_2x1_intrawave_v3,59.3,185.32,0.0
80,1,512,7168,torch.float8_e4m3fnuz,10,1,11.5805,a8w8_bpreshuffle_128x16x32x512_16x16_16x16_32x4x1_32x4x1_1x16x1x8_4x4x1_1x1_intrawave_v1,0.63,317.62,0.0
80,1,1280,8192,torch.float8_e4m3fnuz,11,0,14.3155,a8w8_bpreshuffle_256x16x64x512_16x16_16x16_32x8x1_32x8x1_1x16x1x16_4x4x1_1x1_intrawave_v1,1.46,733.23,0.0
80,1,2112,7168,torch.float8_e4m3fnuz,11,0,13.4147,a8w8_bpreshuffle_256x16x64x512_16x16_16x16_32x8x1_32x8x1_1x16x1x16_4x4x1_1x1_intrawave_v1,2.26,1129.37,0.0
80,1,4096,512,torch.float8_e4m3fnuz,9,0,4.2138,a8w8_bpreshuffle_128x16x32x128_16x16_16x16_8x16x1_8x16x1_1x16x1x8_4x4x1_1x1_intrawave_v1,1.0,499.75,0.0
80,1,4608,4096,torch.float8_e4m3fnuz,11,0,10.5838,a8w8_bpreshuffle_256x16x64x512_16x16_16x16_32x8x1_32x8x1_1x16x1x16_4x4x1_1x1_intrawave_v1,3.57,1784.58,0.0
80,1,4608,7168,torch.float8_e4m3fnuz,5,0,13.8515,a8w8_bpreshuffle_256x16x64x512_16x16_16x16_32x8x1_32x8x1_1x16x1x16_4x4x1_1x1_intrawave_v1,4.77,2385.77,0.0
80,1,7168,256,torch.float8_e4m3fnuz,75,0,6.4606,a8w8_bpreshuffle_128x16x256x64_16x16_16x16_4x16x1_4x32x1_1x16x1x8_8x8x1_1x2_intrawave_v1,0.57,286.29,0.0
80,1,7168,2304,torch.float8_e4m3fnuz,29,0,10.1762,a8w8_bpreshuffle_256x16x64x256_16x16_16x16_16x16x1_16x16x1_1x16x1x16_4x4x1_1x1_intrawave_v2,3.25,1624.55,0.0
80,1,8192,1024,torch.float8_e4m3fnuz,15,0,6.4482,a8w8_bpreshuffle_256x16x64x256_16x16_16x16_16x16x1_16x16x1_1x16x1x16_4x4x1_1x1_intrawave_v1,2.6,1303.62,0.0
80,1,9216,4096,torch.float8_e4m3fnuz,19,0,14.4331,a8w8_bpreshuffle_256x16x64x512_16x16_16x16_32x8x1_32x8x1_1x16x1x16_4x4x1_1x1_intrawave_v2,5.23,2616.99,0.0
80,2,4608,4096,torch.float8_e4m3fnuz,5,0,10.661,a8w8_bpreshuffle_256x16x64x512_16x16_16x16_32x8x1_32x8x1_1x16x1x16_4x4x1_1x1_intrawave_v1,7.08,1772.91,0.0
80,2,9216,4096,torch.float8_e4m3fnuz,5,0,14.4331,a8w8_bpreshuffle_256x16x64x512_16x16_16x16_32x8x1_32x8x1_1x16x1x16_4x4x1_1x1_intrawave_v1,10.46,2618.55,0.0
80,4,4608,4096,torch.float8_e4m3fnuz,5,0,10.4863,a8w8_bpreshuffle_256x16x64x512_16x16_16x16_32x8x1_32x8x1_1x16x1x16_4x4x1_1x1_intrawave_v1,14.4,1804.99,0.0
80,4,9216,4096,torch.float8_e4m3fnuz,11,0,14.6151,a8w8_bpreshuffle_256x16x64x512_16x16_16x16_32x8x1_32x8x1_1x16x1x16_4x4x1_1x1_intrawave_v1,20.66,2589.02,0.0
80,8,4608,4096,torch.float8_e4m3fnuz,5,0,10.8626,a8w8_bpreshuffle_256x16x64x512_16x16_16x16_32x8x1_32x8x1_1x16x1x16_4x4x1_1x1_intrawave_v1,27.8,1747.36,0.0
80,8,9216,4096,torch.float8_e4m3fnuz,5,0,15.0571,a8w8_bpreshuffle_256x16x64x512_16x16_16x16_32x8x1_32x8x1_1x16x1x16_4x4x1_1x1_intrawave_v1,40.11,2519.01,0.0
80,16,512,7168,torch.float8_e4m3fnuz,24,0,10.7923,a8w8_bpreshuffle_128x16x32x512_16x16_16x16_32x4x1_32x4x1_1x16x1x8_4x4x1_1x1_intrawave_v2,10.88,352.2,0.0
80,16,576,7168,torch.float8_e4m3fnuz,10,0,11.091,a8w8_bpreshuffle_128x16x32x512_16x16_16x16_32x4x1_32x4x1_1x16x1x8_4x4x1_1x1_intrawave_v1,11.91,384.27,0.0
80,16,1536,7168,torch.float8_e4m3fnuz,10,0,11.2927,a8w8_bpreshuffle_128x16x32x512_16x16_16x16_32x4x1_32x4x1_1x16x1x8_4x4x1_1x1_intrawave_v1,31.2,989.48,0.0
80,16,2112,7168,torch.float8_e4m3fnuz,24,0,11.7534,a8w8_bpreshuffle_128x16x32x512_16x16_16x16_32x4x1_32x4x1_1x16x1x8_4x4x1_1x1_intrawave_v2,41.22,1303.55,0.0
80,16,3072,1536,torch.float8_e4m3fnuz,11,0,5.8974,a8w8_bpreshuffle_256x16x64x512_16x16_16x16_32x8x1_32x8x1_1x16x1x16_4x4x1_1x1_intrawave_v1,25.6,820.95,0.0
80,16,4096,512,torch.float8_e4m3fnuz,9,0,4.939,a8w8_bpreshuffle_128x16x32x128_16x16_16x16_8x16x1_8x16x1_1x16x1x8_4x4x1_1x1_intrawave_v1,13.59,452.81,0.0
80,16,4608,4096,torch.float8_e4m3fnuz,24,0,10.8403,a8w8_bpreshuffle_128x16x32x512_16x16_16x16_32x4x1_32x4x1_1x16x1x8_4x4x1_1x1_intrawave_v2,55.72,1760.78,0.0
80,16,4608,7168,torch.float8_e4m3fnuz,5,0,14.1863,a8w8_bpreshuffle_256x16x64x512_16x16_16x16_32x8x1_32x8x1_1x16x1x16_4x4x1_1x1_intrawave_v1,74.51,2346.79,0.0
80,16,7168,256,torch.float8_e4m3fnuz,75,0,6.629,a8w8_bpreshuffle_128x16x256x64_16x16_16x16_4x16x1_4x32x1_1x16x1x8_8x8x1_1x2_intrawave_v1,8.86,312.03,0.0
80,16,7168,2048,torch.float8_e4m3fnuz,10,0,8.769,a8w8_bpreshuffle_128x16x32x512_16x16_16x16_32x4x1_32x4x1_1x16x1x8_4x4x1_1x1_intrawave_v1,53.57,1703.98,0.0
80,16,7168,2304,torch.float8_e4m3fnuz,15,0,10.491,a8w8_bpreshuffle_256x16x64x256_16x16_16x16_16x16x1_16x16x1_1x16x1x16_4x4x1_1x1_intrawave_v1,50.37,1599.59,0.0
80,16,9216,4096,torch.float8_e4m3fnuz,11,0,15.5867,a8w8_bpreshuffle_256x16x64x512_16x16_16x16_32x8x1_32x8x1_1x16x1x16_4x4x1_1x1_intrawave_v1,77.5,2444.98,0.0
80,32,512,7168,torch.float8_e4m3fnuz,10,0,11.1022,a8w8_bpreshuffle_128x16x32x512_16x16_16x16_32x4x1_32x4x1_1x16x1x8_4x4x1_1x1_intrawave_v1,21.16,354.18,0.0
80,32,576,7168,torch.float8_e4m3fnuz,10,0,11.199,a8w8_bpreshuffle_128x16x32x512_16x16_16x16_32x4x1_32x4x1_1x16x1x8_4x4x1_1x1_intrawave_v1,23.6,392.45,0.0
80,32,1280,8192,torch.float8_e4m3fnuz,24,0,12.4575,a8w8_bpreshuffle_128x16x32x512_16x16_16x16_32x4x1_32x4x1_1x16x1x8_4x4x1_1x1_intrawave_v2,53.87,869.34,0.0
80,32,1536,7168,torch.float8_e4m3fnuz,19,0,12.6967,a8w8_bpreshuffle_256x16x64x512_16x16_16x16_32x8x1_32x8x1_1x16x1x16_4x4x1_1x1_intrawave_v2,55.5,892.97,0.0
80,32,2112,7168,torch.float8_e4m3fnuz,5,0,13.1607,a8w8_bpreshuffle_256x16x64x512_16x16_16x16_32x8x1_32x8x1_1x16x1x16_4x4x1_1x1_intrawave_v1,73.62,1178.0,0.0
80,32,3072,1536,torch.float8_e4m3fnuz,112,0,6.9922,a8w8_bpreshuffle_256x32x64x256_16x16_16x16_16x16x1_16x16x1_1x32x1x8_8x8x1_2x1_intrawave_v1,43.19,709.98,0.0
80,32,4096,512,torch.float8_e4m3fnuz,9,0,4.8822,a8w8_bpreshuffle_128x16x32x128_16x16_16x16_8x16x1_8x16x1_1x16x1x8_4x4x1_1x1_intrawave_v1,27.49,486.6,0.0
80,32,4608,4096,torch.float8_e4m3fnuz,6,0,13.4935,a8w8_bpreshuffle_256x16x128x512_16x16_16x16_32x8x1_32x8x1_1x16x1x16_8x8x1_1x2_intrawave_v1,89.52,1430.34,0.0
80,32,4608,7168,torch.float8_e4m3fnuz,12,0,19.4019,a8w8_bpreshuffle_256x32x64x512_16x16_16x16_32x8x1_32x8x1_1x32x1x8_8x8x1_1x2_intrawave_v1,108.95,1729.44,0.0
80,32,7168,256,torch.float8_e4m3fnuz,75,0,6.8302,a8w8_bpreshuffle_128x16x256x64_16x16_16x16_4x16x1_4x32x1_1x16x1x8_8x8x1_1x2_intrawave_v1,17.19,337.03,0.0
80,32,7168,2048,torch.float8_e4m3fnuz,119,0,11.0711,a8w8_bpreshuffle_256x32x128x256_16x16_16x16_16x16x1_16x16x1_1x16x1x16_8x8x1_1x2_intrawave_v1,84.86,1373.34,0.0
80,32,7168,2304,torch.float8_e4m3fnuz,119,0,11.6614,a8w8_bpreshuffle_256x32x128x256_16x16_16x16_16x16x1_16x16x1_1x16x1x16_8x8x1_1x2_intrawave_v1,90.64,1461.88,0.0
80,32,8192,1024,torch.float8_e4m3fnuz,119,0,7.4863,a8w8_bpreshuffle_256x32x128x256_16x16_16x16_16x16x1_16x16x1_1x16x1x16_8x8x1_1x2_intrawave_v1,71.71,1194.94,0.0
80,32,9216,4096,torch.float8_e4m3fnuz,119,0,18.4783,a8w8_bpreshuffle_256x32x128x256_16x16_16x16_16x16x1_16x16x1_1x16x1x16_8x8x1_1x2_intrawave_v1,130.74,2081.88,0.0
80,48,512,7168,torch.float8_e4m3fnuz,10,0,11.2279,a8w8_bpreshuffle_128x16x32x512_16x16_16x16_32x4x1_32x4x1_1x16x1x8_4x4x1_1x1_intrawave_v1,31.38,361.89,0.0
80,48,2112,7168,torch.float8_e4m3fnuz,10,0,18.4707,a8w8_bpreshuffle_128x16x32x512_16x16_16x16_32x4x1_32x4x1_1x16x1x8_4x4x1_1x1_intrawave_v1,78.68,849.22,0.0
80,48,4096,512,torch.float8_e4m3fnuz,9,0,5.3534,a8w8_bpreshuffle_128x16x32x128_16x16_16x16_8x16x1_8x16x1_1x16x1x8_4x4x1_1x1_intrawave_v1,37.61,469.78,0.0
80,48,4608,7168,torch.float8_e4m3fnuz,113,0,22.5027,a8w8_bpreshuffle_256x48x64x256_16x16_16x16_16x16x1_16x16x1_1x16x1x16_4x4x1_1x1_intrawave_v1,140.91,1502.78,0.0
80,48,7168,256,torch.float8_e4m3fnuz,75,0,7.0126,a8w8_bpreshuffle_128x16x256x64_16x16_16x16_4x16x1_4x32x1_1x16x1x8_8x8x1_1x2_intrawave_v1,25.12,361.55,0.0
80,48,7168,2304,torch.float8_e4m3fnuz,113,0,13.6727,a8w8_bpreshuffle_256x48x64x256_16x16_16x16_16x16x1_16x16x1_1x16x1x16_4x4x1_1x1_intrawave_v1,115.96,1266.3,0.0
80,64,512,7168,torch.float8_e4m3fnuz,10,0,11.1263,a8w8_bpreshuffle_128x16x32x512_16x16_16x16_32x4x1_32x4x1_1x16x1x8_4x4x1_1x1_intrawave_v1,42.22,376.97,0.0
80,64,576,7168,torch.float8_e4m3fnuz,24,0,11.163,a8w8_bpreshuffle_128x16x32x512_16x16_16x16_32x4x1_32x4x1_1x16x1x8_4x4x1_1x1_intrawave_v2,47.34,417.56,0.0
80,64,1280,8192,torch.float8_e4m3fnuz,19,0,13.7807,a8w8_bpreshuffle_256x16x64x512_16x16_16x16_32x8x1_32x8x1_1x16x1x16_4x4x1_1x1_intrawave_v2,97.4,810.84,0.0
80,64,1536,7168,torch.float8_e4m3fnuz,19,0,16.9363,a8w8_bpreshuffle_256x16x64x512_16x16_16x16_32x8x1_32x8x1_1x16x1x16_4x4x1_1x1_intrawave_v2,83.21,688.78,0.0
80,64,2112,7168,torch.float8_e4m3fnuz,112,0,18.9179,a8w8_bpreshuffle_256x32x64x256_16x16_16x16_16x16x1_16x16x1_1x32x1x8_8x8x1_2x1_intrawave_v1,102.43,838.78,0.0
80,64,3072,1536,torch.float8_e4m3fnuz,114,0,9.0146,a8w8_bpreshuffle_256x64x64x256_16x16_16x16_16x16x1_16x16x1_1x32x1x8_8x8x1_2x1_intrawave_v3,67.0,577.96,0.0
80,64,4096,512,torch.float8_e4m3fnuz,77,0,5.8414,a8w8_bpreshuffle_256x64x64x128_16x16_16x16_8x32x1_8x32x1_1x32x1x8_8x8x1_2x1_intrawave_v3,45.95,454.38,0.0
80,64,4608,4096,torch.float8_e4m3fnuz,114,0,16.3715,a8w8_bpreshuffle_256x64x64x256_16x16_16x16_16x16x1_16x16x1_1x32x1x8_8x8x1_2x1_intrawave_v3,147.57,1204.92,0.0
80,64,4608,7168,torch.float8_e4m3fnuz,114,0,24.7999,a8w8_bpreshuffle_256x64x64x256_16x16_16x16_16x16x1_16x16x1_1x32x1x8_8x8x1_2x1_intrawave_v3,170.48,1374.15,0.0
80,64,7168,256,torch.float8_e4m3fnuz,75,0,7.6886,a8w8_bpreshuffle_128x16x256x64_16x16_16x16_4x16x1_4x32x1_1x16x1x8_8x8x1_1x2_intrawave_v1,30.55,360.13,0.0
80,64,7168,2048,torch.float8_e4m3fnuz,112,0,14.2819,a8w8_bpreshuffle_256x32x64x256_16x16_16x16_16x16x1_16x16x1_1x32x1x8_8x8x1_2x1_intrawave_v1,131.57,1101.3,0.0
80,64,7168,2304,torch.float8_e4m3fnuz,112,0,15.5151,a8w8_bpreshuffle_256x32x64x256_16x16_16x16_16x16x1_16x16x1_1x32x1x8_8x8x1_2x1_intrawave_v1,136.25,1133.09,0.0
80,64,8192,1024,torch.float8_e4m3fnuz,114,0,10.9842,a8w8_bpreshuffle_256x64x64x256_16x16_16x16_16x16x1_16x16x1_1x32x1x8_8x8x1_2x1_intrawave_v3,97.75,865.13,0.0
80,64,9216,4096,torch.float8_e4m3fnuz,114,0,25.0703,a8w8_bpreshuffle_256x64x64x256_16x16_16x16_16x16x1_16x16x1_1x32x1x8_8x8x1_2x1_intrawave_v3,192.73,1563.23,0.0
80,80,512,7168,torch.float8_e4m3fnuz,24,0,11.2303,a8w8_bpreshuffle_128x16x32x512_16x16_16x16_32x4x1_32x4x1_1x16x1x8_4x4x1_1x1_intrawave_v2,52.29,385.15,0.0
80,80,2112,7168,torch.float8_e4m3fnuz,113,0,24.3931,a8w8_bpreshuffle_256x48x64x256_16x16_16x16_16x16x1_16x16x1_1x16x1x16_4x4x1_1x1_intrawave_v1,99.3,657.98,0.0
80,80,4096,512,torch.float8_e4m3fnuz,76,0,6.8102,a8w8_bpreshuffle_256x32x64x128_16x16_16x16_8x32x1_8x32x1_1x32x1x8_8x8x1_2x1_intrawave_v1,49.27,410.19,0.0
80,80,4608,7168,torch.float8_e4m3fnuz,115,0,28.9995,a8w8_bpreshuffle_256x80x64x256_16x16_16x16_16x16x1_16x16x1_1x16x1x16_4x4x1_1x1_intrawave_v3,182.24,1184.19,0.0
80,80,7168,256,torch.float8_e4m3fnuz,75,0,8.2998,a8w8_bpreshuffle_128x16x256x64_16x16_16x16_4x16x1_4x32x1_1x16x1x8_8x8x1_1x2_intrawave_v1,35.37,361.74,0.0
80,80,7168,2304,torch.float8_e4m3fnuz,113,0,18.9055,a8w8_bpreshuffle_256x48x64x256_16x16_16x16_16x16x1_16x16x1_1x16x1x16_4x4x1_1x1_intrawave_v1,139.77,943.97,0.0
80,96,512,7168,torch.float8_e4m3fnuz,10,0,11.6635,a8w8_bpreshuffle_128x16x32x512_16x16_16x16_32x4x1_32x4x1_1x16x1x8_4x4x1_1x1_intrawave_v1,60.41,382.08,0.0
80,96,2112,7168,torch.float8_e4m3fnuz,113,0,22.3255,a8w8_bpreshuffle_256x48x64x256_16x16_16x16_16x16x1_16x16x1_1x16x1x16_4x4x1_1x1_intrawave_v1,130.19,727.08,0.0
80,96,4096,512,torch.float8_e4m3fnuz,76,0,6.6322,a8w8_bpreshuffle_256x32x64x128_16x16_16x16_8x32x1_8x32x1_1x32x1x8_8x8x1_2x1_intrawave_v1,60.71,442.2,0.0
80,96,4608,7168,torch.float8_e4m3fnuz,120,0,29.4707,a8w8_bpreshuffle_256x48x128x256_16x16_16x16_16x16x1_16x16x1_1x16x1x16_8x8x1_1x2_intrawave_v1,215.19,1174.15,0.0
80,96,7168,256,torch.float8_e4m3fnuz,75,0,8.6194,a8w8_bpreshuffle_128x16x256x64_16x16_16x16_4x16x1_4x32x1_1x16x1x8_8x8x1_1x2_intrawave_v1,40.88,375.41,0.0
80,96,7168,2304,torch.float8_e4m3fnuz,84,0,19.1495,a8w8_bpreshuffle_256x32x128x128_16x16_16x16_8x32x1_8x32x1_1x32x1x8_8x8x1_2x1_intrawave_v1,165.59,945.85,0.0
80,112,512,7168,torch.float8_e4m3fnuz,10,0,11.9903,a8w8_bpreshuffle_128x16x32x512_16x16_16x16_32x4x1_32x4x1_1x16x1x8_4x4x1_1x1_intrawave_v1,68.56,382.6,0.0
80,112,2112,7168,torch.float8_e4m3fnuz,112,0,25.9619,a8w8_bpreshuffle_256x32x64x256_16x16_16x16_16x16x1_16x16x1_1x32x1x8_8x8x1_2x1_intrawave_v1,130.62,632.26,0.0
80,112,4096,512,torch.float8_e4m3fnuz,76,0,7.3154,a8w8_bpreshuffle_256x32x64x128_16x16_16x16_8x32x1_8x32x1_1x32x1x8_8x8x1_2x1_intrawave_v1,64.22,419.94,0.0
80,112,4608,7168,torch.float8_e4m3fnuz,117,0,37.2568,a8w8_bpreshuffle_256x112x64x256_16x16_16x16_16x16x1_16x16x1_1x16x1x16_4x4x1_1x1_intrawave_v3,198.59,935.81,0.0
80,112,7168,256,torch.float8_e4m3fnuz,75,0,9.207,a8w8_bpreshuffle_128x16x256x64_16x16_16x16_4x16x1_4x32x1_1x16x1x8_8x8x1_1x2_intrawave_v1,44.64,376.81,0.0
80,112,7168,2304,torch.float8_e4m3fnuz,119,0,21.7835,a8w8_bpreshuffle_256x32x128x256_16x16_16x16_16x16x1_16x16x1_1x16x1x16_8x8x1_1x2_intrawave_v1,169.82,843.7,0.0
80,128,512,7168,torch.float8_e4m3fnuz,19,0,12.3367,a8w8_bpreshuffle_256x16x64x512_16x16_16x16_32x8x1_32x8x1_1x16x1x16_4x4x1_1x1_intrawave_v2,76.16,382.48,0.0
80,128,576,7168,torch.float8_e4m3fnuz,25,0,12.3755,a8w8_bpreshuffle_256x16x64x512_16x16_16x16_32x8x1_32x8x1_1x16x1x16_4x4x1_1x1_intrawave_v2,85.41,419.68,0.0
80,128,1280,8192,torch.float8_e4m3fnuz,6,0,20.0,a8w8_bpreshuffle_256x16x128x512_16x16_16x16_32x8x1_32x8x1_1x16x1x16_8x8x1_1x2_intrawave_v1,134.22,593.1,0.0
80,128,1536,7168,torch.float8_e4m3fnuz,112,0,22.8955,a8w8_bpreshuffle_256x32x64x256_16x16_16x16_16x16x1_16x16x1_1x32x1x8_8x8x1_2x1_intrawave_v1,123.11,538.13,0.0
80,128,2112,7168,torch.float8_e4m3fnuz,114,0,24.5755,a8w8_bpreshuffle_256x64x64x256_16x16_16x16_16x16x1_16x16x1_1x32x1x8_8x8x1_2x1_intrawave_v3,157.7,675.35,0.0
80,128,3072,1536,torch.float8_e4m3fnuz,112,0,11.1838,a8w8_bpreshuffle_256x32x64x256_16x16_16x16_16x16x1_16x16x1_1x32x1x8_8x8x1_2x1_intrawave_v1,108.01,509.81,0.0
80,128,4096,512,torch.float8_e4m3fnuz,76,0,7.2018,a8w8_bpreshuffle_256x32x64x128_16x16_16x16_8x32x1_8x32x1_1x32x1x8_8x8x1_2x1_intrawave_v1,74.55,445.9,0.0
80,128,4608,4096,torch.float8_e4m3fnuz,121,0,24.6387,a8w8_bpreshuffle_256x64x128x256_16x16_16x16_16x16x1_16x16x1_1x16x1x16_8x8x1_1x2_intrawave_v3,196.11,835.2,0.0
80,128,4608,7168,torch.float8_e4m3fnuz,114,0,38.7224,a8w8_bpreshuffle_256x64x64x256_16x16_16x16_16x16x1_16x16x1_1x32x1x8_8x8x1_2x1_intrawave_v3,218.37,907.16,0.0
80,128,7168,256,torch.float8_e4m3fnuz,73,0,10.1406,a8w8_bpreshuffle_256x32x256x64_16x16_16x16_4x32x1_4x64x1_1x32x1x8_8x8x1_2x1_intrawave_v1,46.32,365.14,0.0
80,128,7168,2048,torch.float8_e4m3fnuz,119,0,20.5111,a8w8_bpreshuffle_256x32x128x256_16x16_16x16_16x16x1_16x16x1_1x16x1x16_8x8x1_1x2_intrawave_v1,183.22,817.96,0.0
80,128,7168,2304,torch.float8_e4m3fnuz,84,0,21.9275,a8w8_bpreshuffle_256x32x128x128_16x16_16x16_8x32x1_8x32x1_1x32x1x8_8x8x1_2x1_intrawave_v1,192.81,850.3,0.0
80,128,8192,1024,torch.float8_e4m3fnuz,121,0,14.9703,a8w8_bpreshuffle_256x64x128x256_16x16_16x16_16x16x1_16x16x1_1x16x1x16_8x8x1_1x2_intrawave_v3,143.45,709.19,0.0
80,128,9216,4096,torch.float8_e4m3fnuz,121,0,39.1328,a8w8_bpreshuffle_256x64x128x256_16x16_16x16_16x16x1_16x16x1_1x16x1x16_8x8x1_1x2_intrawave_v3,246.95,1038.32,0.0
80,192,1280,8192,torch.float8_e4m3fnuz,113,0,24.3731,a8w8_bpreshuffle_256x48x64x256_16x16_16x16_16x16x1_16x16x1_1x16x1x16_4x4x1_1x1_intrawave_v1,165.2,514.92,0.0
80,192,8192,1024,torch.float8_e4m3fnuz,85,0,18.7963,a8w8_bpreshuffle_256x64x128x128_16x16_16x16_8x32x1_8x32x1_1x32x1x8_8x8x1_2x1_intrawave_v3,171.38,624.11,0.0
80,256,512,7168,torch.float8_e4m3fnuz,6,0,17.5859,a8w8_bpreshuffle_256x16x128x512_16x16_16x16_32x8x1_32x8x1_1x16x1x16_8x8x1_1x2_intrawave_v1,106.85,327.94,0.0
80,256,576,7168,torch.float8_e4m3fnuz,112,0,18.3779,a8w8_bpreshuffle_256x32x64x256_16x16_16x16_16x16x1_16x16x1_1x32x1x8_8x8x1_2x1_intrawave_v1,115.03,340.56,0.0
80,256,1280,8192,torch.float8_e4m3fnuz,114,0,26.7743,a8w8_bpreshuffle_256x64x64x256_16x16_16x16_16x16x1_16x16x1_1x32x1x8_8x8x1_2x1_intrawave_v3,200.52,494.44,0.0
80,256,1536,7168,torch.float8_e4m3fnuz,120,0,31.1851,a8w8_bpreshuffle_256x48x128x256_16x16_16x16_16x16x1_16x16x1_1x16x1x16_8x8x1_1x2_intrawave_v1,180.76,437.12,0.0
80,256,2112,7168,torch.float8_e4m3fnuz,114,0,37.3908,a8w8_bpreshuffle_256x64x64x256_16x16_16x16_16x16x1_16x16x1_1x32x1x8_8x8x1_2x1_intrawave_v3,207.3,482.88,0.0
80,256,3072,1536,torch.float8_e4m3fnuz,120,0,16.0983,a8w8_bpreshuffle_256x48x128x256_16x16_16x16_16x16x1_16x16x1_1x16x1x16_8x8x1_1x2_intrawave_v1,150.07,415.24,0.0
80,256,4096,512,torch.float8_e4m3fnuz,76,0,10.9814,a8w8_bpreshuffle_256x32x64x128_16x16_16x16_8x32x1_8x32x1_1x32x1x8_8x8x1_2x1_intrawave_v1,97.78,393.88,0.0
80,256,4608,4096,torch.float8_e4m3fnuz,85,0,37.982,a8w8_bpreshuffle_256x64x128x128_16x16_16x16_8x32x1_8x32x1_1x32x1x8_8x8x1_2x1_intrawave_v3,254.43,586.65,0.0
80,256,4608,7168,torch.float8_e4m3fnuz,121,0,62.2609,a8w8_bpreshuffle_256x64x128x256_16x16_16x16_16x16x1_16x16x1_1x16x1x16_8x8x1_1x2_intrawave_v3,271.62,597.88,0.0
80,256,7168,256,torch.float8_e4m3fnuz,73,0,11.5078,a8w8_bpreshuffle_256x32x256x64_16x16_16x16_4x32x1_4x64x1_1x32x1x8_8x8x1_2x1_intrawave_v1,81.64,484.07,0.0
80,256,7168,2048,torch.float8_e4m3fnuz,85,0,30.5235,a8w8_bpreshuffle_256x64x128x128_16x16_16x16_8x32x1_8x32x1_1x32x1x8_8x8x1_2x1_intrawave_v3,246.24,618.36,0.0
80,256,7168,2304,torch.float8_e4m3fnuz,85,0,32.0436,a8w8_bpreshuffle_256x64x128x128_16x16_16x16_8x32x1_8x32x1_1x32x1x8_8x8x1_2x1_intrawave_v3,263.88,648.33,0.0
80,256,8192,1024,torch.float8_e4m3fnuz,70,0,23.9267,a8w8_bpreshuffle_256x128x128x128_16x16_16x16_8x32x1_8x32x1_1x32x1x8_8x8x1_2x1_intrawave_v3,179.51,536.85,0.0
80,256,9216,4096,torch.float8_e4m3fnuz,70,0,64.6741,a8w8_bpreshuffle_256x128x128x128_16x16_16x16_8x32x1_8x32x1_1x32x1x8_8x8x1_2x1_intrawave_v3,298.84,672.85,0.0
80,320,1280,8192,torch.float8_e4m3fnuz,115,0,32.2959,a8w8_bpreshuffle_256x80x64x256_16x16_16x16_16x16x1_16x16x1_1x16x1x16_4x4x1_1x1_intrawave_v3,207.79,431.21,0.0
80,320,8192,1024,torch.float8_e4m3fnuz,85,0,24.7583,a8w8_bpreshuffle_256x64x128x128_16x16_16x16_8x32x1_8x32x1_1x32x1x8_8x8x1_2x1_intrawave_v3,216.84,563.82,0.0
80,512,512,7168,torch.float8_e4m3fnuz,119,0,23.6639,a8w8_bpreshuffle_256x32x128x256_16x16_16x16_16x16x1_16x16x1_1x16x1x16_8x8x1_1x2_intrawave_v1,158.81,332.33,0.0
80,512,576,7168,torch.float8_e4m3fnuz,114,0,23.9199,a8w8_bpreshuffle_256x64x64x256_16x16_16x16_16x16x1_16x16x1_1x32x1x8_8x8x1_2x1_intrawave_v3,176.75,350.7,0.0
80,512,1280,8192,torch.float8_e4m3fnuz,114,0,42.3216,a8w8_bpreshuffle_256x64x64x256_16x16_16x16_16x16x1_16x16x1_1x32x1x8_8x8x1_2x1_intrawave_v3,253.71,377.84,0.0
80,512,1536,7168,torch.float8_e4m3fnuz,128,0,47.65,a8w8_bpreshuffle_256x64x192x256_16x16_16x16_16x16x1_16x16x1_1x32x1x8_8x8x1_2x1_intrawave_v3,236.61,341.09,0.0
80,512,2112,7168,torch.float8_e4m3fnuz,129,0,60.4509,a8w8_bpreshuffle_256x80x192x256_16x16_16x16_16x16x1_16x16x1_1x16x1x16_4x4x1_1x1_intrawave_v3,256.44,346.92,0.0
80,512,3072,1536,torch.float8_e4m3fnuz,85,0,24.3751,a8w8_bpreshuffle_256x64x128x128_16x16_16x16_8x32x1_8x32x1_1x32x1x8_8x8x1_2x1_intrawave_v3,198.23,354.9,0.0
80,512,4096,512,torch.float8_e4m3fnuz,85,0,15.7231,a8w8_bpreshuffle_256x64x128x128_16x16_16x16_8x32x1_8x32x1_1x32x1x8_8x8x1_2x1_intrawave_v3,136.58,416.81,0.0
80,512,4608,7168,torch.float8_e4m3fnuz,70,0,105.5819,a8w8_bpreshuffle_256x128x128x128_16x16_16x16_8x32x1_8x32x1_1x32x1x8_8x8x1_2x1_intrawave_v3,320.35,392.29,0.0
80,512,7168,256,torch.float8_e4m3fnuz,72,0,16.1951,a8w8_bpreshuffle_256x64x256x64_16x16_16x16_4x64x1_4x64x1_1x16x1x16_8x8x1_1x2_intrawave_v1,116.03,574.63,0.0
80,512,7168,2048,torch.float8_e4m3fnuz,71,0,53.438,a8w8_bpreshuffle_256x128x128x64_16x16_16x16_4x64x1_4x64x1_1x32x1x8_8x8x1_2x1_intrawave_v3,281.31,431.69,0.0
80,512,7168,2304,torch.float8_e4m3fnuz,72,0,57.4769,a8w8_bpreshuffle_256x64x256x64_16x16_16x16_4x64x1_4x64x1_1x16x1x16_8x8x1_1x2_intrawave_v1,294.23,435.56,0.0
80,512,8192,1024,torch.float8_e4m3fnuz,85,0,37.882,a8w8_bpreshuffle_256x64x128x128_16x16_16x16_8x32x1_8x32x1_1x32x1x8_8x8x1_2x1_intrawave_v3,226.76,456.72,0.0
80,1024,512,7168,torch.float8_e4m3fnuz,114,0,36.6616,a8w8_bpreshuffle_256x64x64x256_16x16_16x16_16x16x1_16x16x1_1x32x1x8_8x8x1_2x1_intrawave_v3,205.02,328.92,0.0
80,1024,576,7168,torch.float8_e4m3fnuz,114,0,37.1872,a8w8_bpreshuffle_256x64x64x256_16x16_16x16_16x16x1_16x16x1_1x32x1x8_8x8x1_2x1_intrawave_v3,227.38,340.13,0.0
80,1024,1280,8192,torch.float8_e4m3fnuz,85,0,68.1209,a8w8_bpreshuffle_256x64x128x128_16x16_16x16_8x32x1_8x32x1_1x32x1x8_8x8x1_2x1_intrawave_v3,315.25,315.55,0.0
80,1024,1536,7168,torch.float8_e4m3fnuz,136,0,74.0965,a8w8_bpreshuffle_256x80x256x256_16x16_16x16_16x16x1_16x16x1_1x16x1x16_8x8x1_1x2_intrawave_v3,304.31,290.11,0.0
80,1024,2112,7168,torch.float8_e4m3fnuz,93,0,115.8099,a8w8_bpreshuffle_256x64x192x128_16x16_16x16_8x32x1_8x32x1_1x32x1x8_8x8x1_2x1_intrawave_v3,267.72,231.45,0.0
80,1024,3072,1536,torch.float8_e4m3fnuz,85,0,38.8336,a8w8_bpreshuffle_256x64x128x128_16x16_16x16_8x32x1_8x32x1_1x32x1x8_8x8x1_2x1_intrawave_v3,248.85,324.02,0.0
80,1024,4096,512,torch.float8_e4m3fnuz,85,0,24.9039,a8w8_bpreshuffle_256x64x128x128_16x16_16x16_8x32x1_8x32x1_1x32x1x8_8x8x1_2x1_intrawave_v3,172.46,442.1,0.0
80,1024,4608,4096,torch.float8_e4m3fnuz,71,0,120.44,a8w8_bpreshuffle_256x128x128x64_16x16_16x16_4x64x1_4x64x1_1x32x1x8_8x8x1_2x1_intrawave_v3,320.95,269.89,0.0
80,1024,4608,7168,torch.float8_e4m3fnuz,93,0,189.1551,a8w8_bpreshuffle_256x64x192x128_16x16_16x16_8x32x1_8x32x1_1x32x1x8_8x8x1_2x1_intrawave_v3,357.62,263.31,0.0
80,1024,7168,256,torch.float8_e4m3fnuz,71,0,27.7779,a8w8_bpreshuffle_256x128x128x64_16x16_16x16_4x64x1_4x64x1_1x32x1x8_8x8x1_2x1_intrawave_v3,135.29,603.98,0.0
80,1024,7168,2048,torch.float8_e4m3fnuz,71,0,98.0567,a8w8_bpreshuffle_256x128x128x64_16x16_16x16_4x64x1_4x64x1_1x32x1x8_8x8x1_2x1_intrawave_v3,306.61,320.81,0.0
80,1024,7168,2304,torch.float8_e4m3fnuz,85,0,107.3839,a8w8_bpreshuffle_256x64x128x128_16x16_16x16_8x32x1_8x32x1_1x32x1x8_8x8x1_2x1_intrawave_v3,314.97,312.47,0.0
80,1024,8192,1024,torch.float8_e4m3fnuz,71,0,67.0889,a8w8_bpreshuffle_256x128x128x64_16x16_16x16_4x64x1_4x64x1_1x32x1x8_8x8x1_2x1_intrawave_v3,256.08,390.74,0.0
80,1024,9216,4096,torch.float8_e4m3fnuz,93,0,219.0276,a8w8_bpreshuffle_256x64x192x128_16x16_16x16_8x32x1_8x32x1_1x32x1x8_8x8x1_2x1_intrawave_v3,352.97,277.67,0.0
80,1536,512,7168,torch.float8_e4m3fnuz,120,0,48.0728,a8w8_bpreshuffle_256x48x128x256_16x16_16x16_16x16x1_16x16x1_1x16x1x16_8x8x1_1x2_intrawave_v1,234.53,338.09,0.0
80,1536,576,7168,torch.float8_e4m3fnuz,128,0,47.2304,a8w8_bpreshuffle_256x64x192x256_16x16_16x16_16x16x1_16x16x1_1x32x1x8_8x8x1_2x1_intrawave_v3,268.55,358.0,0.0
80,1536,1536,7168,torch.float8_e4m3fnuz,0,0,105.4423,a8w8_bpreshuffle_256x128x128x128_16x16_16x16_8x32x1_8x32x1_1x32x1x8_8x8x1_2x1_intrawave_v3,320.77,253.59,0.0
80,1536,2112,7168,torch.float8_e4m3fnuz,68,0,148.9129,a8w8_bpreshuffle_256x128x192x128_16x16_16x16_8x32x1_8x32x1_1x32x1x8_8x8x1_2x1_intrawave_v3,312.31,219.17,0.0
80,1536,3072,1536,torch.float8_e4m3fnuz,93,0,51.4668,a8w8_bpreshuffle_256x64x192x128_16x16_16x16_8x32x1_8x32x1_1x32x1x8_8x8x1_2x1_intrawave_v3,281.65,320.89,0.0
80,1536,4096,512,torch.float8_e4m3fnuz,85,0,33.2015,a8w8_bpreshuffle_256x64x128x128_16x16_16x16_8x32x1_8x32x1_1x32x1x8_8x8x1_2x1_intrawave_v3,194.04,465.84,0.0
80,1536,4608,7168,torch.float8_e4m3fnuz,85,0,279.9019,a8w8_bpreshuffle_256x64x128x128_16x16_16x16_8x32x1_8x32x1_1x32x1x8_8x8x1_2x1_intrawave_v3,362.51,207.92,0.0
80,1536,7168,256,torch.float8_e4m3fnuz,71,0,37.3284,a8w8_bpreshuffle_256x128x128x64_16x16_16x16_4x64x1_4x64x1_1x32x1x8_8x8x1_2x1_intrawave_v3,151.01,649.59,0.0
80,1536,7168,2048,torch.float8_e4m3fnuz,85,0,138.0452,a8w8_bpreshuffle_256x64x128x128_16x16_16x16_8x32x1_8x32x1_1x32x1x8_8x8x1_2x1_intrawave_v3,326.68,288.64,0.0
80,1536,7168,2304,torch.float8_e4m3fnuz,85,0,150.2725,a8w8_bpreshuffle_256x64x128x128_16x16_16x16_8x32x1_8x32x1_1x32x1x8_8x8x1_2x1_intrawave_v3,337.62,279.99,0.0
80,2048,512,7168,torch.float8_e4m3fnuz,85,0,58.1113,a8w8_bpreshuffle_256x64x128x128_16x16_16x16_8x32x1_8x32x1_1x32x1x8_8x8x1_2x1_intrawave_v3,258.68,351.86,0.0
80,2048,576,7168,torch.float8_e4m3fnuz,129,0,60.7837,a8w8_bpreshuffle_256x80x192x256_16x16_16x16_16x16x1_16x16x1_1x16x1x16_4x4x1_1x1_intrawave_v3,278.22,348.25,0.0
80,2048,1280,8192,torch.float8_e4m3fnuz,0,0,119.2848,a8w8_bpreshuffle_256x128x128x128_16x16_16x16_8x32x1_8x32x1_1x32x1x8_8x8x1_2x1_intrawave_v3,360.06,272.51,0.0
80,2048,1536,7168,torch.float8_e4m3fnuz,85,0,138.8692,a8w8_bpreshuffle_256x64x128x128_16x16_16x16_8x32x1_8x32x1_1x32x1x8_8x8x1_2x1_intrawave_v3,324.75,230.3,0.0
80,2048,2112,7168,torch.float8_e4m3fnuz,93,0,186.5271,a8w8_bpreshuffle_256x64x192x128_16x16_16x16_8x32x1_8x32x1_1x32x1x8_8x8x1_2x1_intrawave_v3,332.44,206.24,0.0
80,2048,3072,1536,torch.float8_e4m3fnuz,72,0,69.8541,a8w8_bpreshuffle_256x64x256x64_16x16_16x16_4x64x1_4x64x1_1x16x1x16_8x8x1_1x2_intrawave_v1,276.68,292.71,0.0
80,2048,4096,512,torch.float8_e4m3fnuz,71,0,43.6672,a8w8_bpreshuffle_256x128x128x64_16x16_16x16_4x64x1_4x64x1_1x32x1x8_8x8x1_2x1_intrawave_v3,196.71,456.25,0.0
80,2048,4608,4096,torch.float8_e4m3fnuz,68,0,218.9032,a8w8_bpreshuffle_256x128x192x128_16x16_16x16_8x32x1_8x32x1_1x32x1x8_8x8x1_2x1_intrawave_v3,353.17,210.77,0.0
80,2048,4608,7168,torch.float8_e4m3fnuz,93,0,366.0791,a8w8_bpreshuffle_256x64x192x128_16x16_16x16_8x32x1_8x32x1_1x32x1x8_8x8x1_2x1_intrawave_v3,369.57,181.89,0.0
80,2048,7168,256,torch.float8_e4m3fnuz,71,0,48.0096,a8w8_bpreshuffle_256x128x128x64_16x16_16x16_4x64x1_4x64x1_1x32x1x8_8x8x1_2x1_intrawave_v3,156.56,660.69,0.0
80,2048,7168,2048,torch.float8_e4m3fnuz,85,0,186.7051,a8w8_bpreshuffle_256x64x128x128_16x16_16x16_8x32x1_8x32x1_1x32x1x8_8x8x1_2x1_intrawave_v3,322.06,258.35,0.0
80,2048,7168,2304,torch.float8_e4m3fnuz,85,0,199.0359,a8w8_bpreshuffle_256x64x128x128_16x16_16x16_8x32x1_8x32x1_1x32x1x8_8x8x1_2x1_intrawave_v3,339.87,254.19,0.0
80,2048,8192,1024,torch.float8_e4m3fnuz,71,0,120.4715,a8w8_bpreshuffle_256x128x128x64_16x16_16x16_4x64x1_4x64x1_1x32x1x8_8x8x1_2x1_intrawave_v3,285.21,365.57,0.0
80,2048,9216,4096,torch.float8_e4m3fnuz,68,0,425.2314,a8w8_bpreshuffle_256x128x192x128_16x16_16x16_8x32x1_8x32x1_1x32x1x8_8x8x1_2x1_intrawave_v3,363.61,197.27,0.0
80,4096,512,7168,torch.float8_e4m3fnuz,85,0,101.7067,a8w8_bpreshuffle_256x64x128x128_16x16_16x16_8x32x1_8x32x1_1x32x1x8_8x8x1_2x1_intrawave_v3,295.6,366.0,0.0
80,4096,576,7168,torch.float8_e4m3fnuz,93,0,113.3711,a8w8_bpreshuffle_256x64x192x128_16x16_16x16_8x32x1_8x32x1_1x32x1x8_8x8x1_2x1_intrawave_v3,298.34,337.01,0.0
80,4096,1280,8192,torch.float8_e4m3fnuz,71,0,234.5689,a8w8_bpreshuffle_256x128x128x64_16x16_16x16_4x64x1_4x64x1_1x32x1x8_8x8x1_2x1_intrawave_v3,366.2,232.45,0.0
80,4096,1536,7168,torch.float8_e4m3fnuz,85,0,256.917,a8w8_bpreshuffle_256x64x128x128_16x16_16x16_8x32x1_8x32x1_1x32x1x8_8x8x1_2x1_intrawave_v3,351.06,206.11,0.0
80,4096,2112,7168,torch.float8_e4m3fnuz,93,0,329.2957,a8w8_bpreshuffle_256x64x192x128_16x16_16x16_8x32x1_8x32x1_1x32x1x8_8x8x1_2x1_intrawave_v3,376.61,187.67,0.0
80,4096,3072,1536,torch.float8_e4m3fnuz,93,0,123.6652,a8w8_bpreshuffle_256x64x192x128_16x16_16x16_8x32x1_8x32x1_1x32x1x8_8x8x1_2x1_intrawave_v3,312.58,292.53,0.0
80,4096,4096,512,torch.float8_e4m3fnuz,71,0,75.7421,a8w8_bpreshuffle_256x128x128x64_16x16_16x16_4x64x1_4x64x1_1x32x1x8_8x8x1_2x1_intrawave_v3,226.82,498.39,0.0
80,4096,4608,4096,torch.float8_e4m3fnuz,85,0,420.6946,a8w8_bpreshuffle_256x64x128x128_16x16_16x16_8x32x1_8x32x1_1x32x1x8_8x8x1_2x1_intrawave_v3,367.53,174.47,0.0
80,4096,4608,7168,torch.float8_e4m3fnuz,85,0,715.7879,a8w8_bpreshuffle_256x64x128x128_16x16_16x16_8x32x1_8x32x1_1x32x1x8_8x8x1_2x1_intrawave_v3,378.02,139.9,0.0
80,4096,7168,256,torch.float8_e4m3fnuz,71,0,85.7258,a8w8_bpreshuffle_256x128x128x64_16x16_16x16_4x64x1_4x64x1_1x32x1x8_8x8x1_2x1_intrawave_v3,175.35,718.61,0.0
80,4096,7168,2048,torch.float8_e4m3fnuz,71,0,345.3094,a8w8_bpreshuffle_256x128x128x64_16x16_16x16_4x64x1_4x64x1_1x32x1x8_8x8x1_2x1_intrawave_v3,348.26,236.86,0.0
80,4096,7168,2304,torch.float8_e4m3fnuz,71,0,379.4759,a8w8_bpreshuffle_256x128x128x64_16x16_16x16_4x64x1_4x64x1_1x32x1x8_8x8x1_2x1_intrawave_v3,356.52,223.13,0.0
80,4096,8192,1024,torch.float8_e4m3fnuz,71,0,227.2969,a8w8_bpreshuffle_256x128x128x64_16x16_16x16_4x64x1_4x64x1_1x32x1x8_8x8x1_2x1_intrawave_v3,302.33,350.61,0.0
80,4096,9216,4096,torch.float8_e4m3fnuz,71,0,812.5832,a8w8_bpreshuffle_256x128x128x64_16x16_16x16_4x64x1_4x64x1_1x32x1x8_8x8x1_2x1_intrawave_v3,380.56,160.01,0.0
80,4240,9216,4096,torch.float8_e4m3fnuz,93,0,903.6056,a8w8_bpreshuffle_256x64x192x128_16x16_16x16_8x32x1_8x32x1_1x32x1x8_8x8x1_2x1_intrawave_v3,354.26,147.48,0.0
80,8192,512,7168,torch.float8_e4m3fnuz,85,0,195.7643,a8w8_bpreshuffle_256x64x128x128_16x16_16x16_8x32x1_8x32x1_1x32x1x8_8x8x1_2x1_intrawave_v3,307.15,361.55,0.0
80,8192,576,7168,torch.float8_e4m3fnuz,93,0,191.4823,a8w8_bpreshuffle_256x64x192x128_16x16_16x16_8x32x1_8x32x1_1x32x1x8_8x8x1_2x1_intrawave_v3,353.27,377.51,0.0
80,8192,1280,8192,torch.float8_e4m3fnuz,71,0,452.4299,a8w8_bpreshuffle_256x128x128x64_16x16_16x16_4x64x1_4x64x1_1x32x1x8_8x8x1_2x1_intrawave_v3,379.72,217.86,0.0
80,8192,1536,7168,torch.float8_e4m3fnuz,72,0,501.1581,a8w8_bpreshuffle_256x64x256x64_16x16_16x16_4x64x1_4x64x1_1x16x1x16_8x8x1_1x2_intrawave_v1,359.94,189.35,0.0
80,8192,2112,7168,torch.float8_e4m3fnuz,68,0,649.3748,a8w8_bpreshuffle_256x128x192x128_16x16_16x16_8x32x1_8x32x1_1x32x1x8_8x8x1_2x1_intrawave_v3,381.96,167.03,0.0
80,8192,3072,1536,torch.float8_e4m3fnuz,71,0,235.4545,a8w8_bpreshuffle_256x128x128x64_16x16_16x16_4x64x1_4x64x1_1x32x1x8_8x8x1_2x1_intrawave_v3,328.34,287.25,0.0
80,8192,4096,512,torch.float8_e4m3fnuz,71,0,140.1016,a8w8_bpreshuffle_256x128x128x64_16x16_16x16_4x64x1_4x64x1_1x32x1x8_8x8x1_2x1_intrawave_v3,245.25,523.91,0.0
80,8192,4608,7168,torch.float8_e4m3fnuz,93,0,1405.0902,a8w8_bpreshuffle_256x64x192x128_16x16_16x16_8x32x1_8x32x1_1x32x1x8_8x8x1_2x1_intrawave_v3,385.15,119.03,0.0
80,8192,7168,256,torch.float8_e4m3fnuz,71,0,158.8437,a8w8_bpreshuffle_256x128x128x64_16x16_16x16_4x64x1_4x64x1_1x32x1x8_8x8x1_2x1_intrawave_v3,189.27,764.1,0.0
80,8192,7168,2048,torch.float8_e4m3fnuz,71,0,665.8308,a8w8_bpreshuffle_256x128x128x64_16x16_16x16_4x64x1_4x64x1_1x32x1x8_8x8x1_2x1_intrawave_v3,361.23,223.63,0.0
80,8192,7168,2304,torch.float8_e4m3fnuz,71,0,736.4592,a8w8_bpreshuffle_256x128x128x64_16x16_16x16_4x64x1_4x64x1_1x32x1x8_8x8x1_2x1_intrawave_v3,367.41,207.52,0.0
80,8192,8192,1024,torch.float8_e4m3fnuz,71,0,434.801,a8w8_bpreshuffle_256x128x128x64_16x16_16x16_4x64x1_4x64x1_1x32x1x8_8x8x1_2x1_intrawave_v3,316.1,347.27,0.0
80,16384,512,7168,torch.float8_e4m3fnuz,85,0,354.1062,a8w8_bpreshuffle_256x64x128x128_16x16_16x16_8x32x1_8x32x1_1x32x1x8_8x8x1_2x1_intrawave_v3,339.61,389.4,0.0
80,16384,576,7168,torch.float8_e4m3fnuz,68,0,372.1747,a8w8_bpreshuffle_256x128x192x128_16x16_16x16_8x32x1_8x32x1_1x32x1x8_8x8x1_2x1_intrawave_v3,363.52,377.36,0.0
80,16384,1280,8192,torch.float8_e4m3fnuz,71,0,902.6619,a8w8_bpreshuffle_256x128x128x64_16x16_16x16_4x64x1_4x64x1_1x32x1x8_8x8x1_2x1_intrawave_v3,380.65,206.77,0.0
80,16384,1536,7168,torch.float8_e4m3fnuz,68,0,940.0969,a8w8_bpreshuffle_256x128x192x128_16x16_16x16_8x32x1_8x32x1_1x32x1x8_8x8x1_2x1_intrawave_v3,383.77,190.17,0.0
80,16384,2112,7168,torch.float8_e4m3fnuz,93,0,1284.8613,a8w8_bpreshuffle_256x64x192x128_16x16_16x16_8x32x1_8x32x1_1x32x1x8_8x8x1_2x1_intrawave_v3,386.09,157.05,0.0
80,16384,3072,1536,torch.float8_e4m3fnuz,71,0,450.9699,a8w8_bpreshuffle_256x128x128x64_16x16_16x16_4x64x1_4x64x1_1x32x1x8_8x8x1_2x1_intrawave_v3,342.86,289.48,0.0
80,16384,4096,512,torch.float8_e4m3fnuz,71,0,268.2002,a8w8_bpreshuffle_256x128x128x64_16x16_16x16_4x64x1_4x64x1_1x32x1x8_8x8x1_2x1_intrawave_v3,256.22,539.54,0.0
80,16384,4608,4096,torch.float8_e4m3fnuz,93,0,1613.6388,a8w8_bpreshuffle_256x64x192x128_16x16_16x16_8x32x1_8x32x1_1x32x1x8_8x8x1_2x1_intrawave_v3,383.28,146.86,0.0
80,16384,4608,7168,torch.float8_e4m3fnuz,93,0,2770.8265,a8w8_bpreshuffle_256x64x192x128_16x16_16x16_8x32x1_8x32x1_1x32x1x8_8x8x1_2x1_intrawave_v3,390.62,108.8,0.0
80,16384,7168,256,torch.float8_e4m3fnuz,71,0,306.2344,a8w8_bpreshuffle_256x128x128x64_16x16_16x16_4x64x1_4x64x1_1x32x1x8_8x8x1_2x1_intrawave_v3,196.35,786.69,0.0
80,16384,7168,2048,torch.float8_e4m3fnuz,71,0,1322.9659,a8w8_bpreshuffle_256x128x128x64_16x16_16x16_4x64x1_4x64x1_1x32x1x8_8x8x1_2x1_intrawave_v3,363.6,214.0,0.0
80,16384,7168,2304,torch.float8_e4m3fnuz,71,0,1464.8949,a8w8_bpreshuffle_256x128x128x64_16x16_16x16_4x64x1_4x64x1_1x32x1x8_8x8x1_2x1_intrawave_v3,369.42,197.38,0.0
80,16384,8192,1024,torch.float8_e4m3fnuz,71,0,849.5169,a8w8_bpreshuffle_256x128x128x64_16x16_16x16_4x64x1_4x64x1_1x32x1x8_8x8x1_2x1_intrawave_v3,323.57,345.61,0.0
80,16384,9216,4096,torch.float8_e4m3fnuz,71,0,3218.0651,a8w8_bpreshuffle_256x128x128x64_16x16_16x16_4x64x1_4x64x1_1x32x1x8_8x8x1_2x1_intrawave_v3,384.38,126.43,0.0
80,20480,512,7168,torch.float8_e4m3fnuz,70,0,411.9813,a8w8_bpreshuffle_256x128x128x128_16x16_16x16_8x32x1_8x32x1_1x32x1x8_8x8x1_2x1_intrawave_v3,364.88,416.14,0.0
80,20480,576,7168,torch.float8_e4m3fnuz,68,0,439.759,a8w8_bpreshuffle_256x128x192x128_16x16_16x16_8x32x1_8x32x1_1x32x1x8_8x8x1_2x1_intrawave_v3,384.56,396.86,0.0
80,20480,1536,7168,torch.float8_e4m3fnuz,93,0,1157.9543,a8w8_bpreshuffle_256x64x192x128_16x16_16x16_8x32x1_8x32x1_1x32x1x8_8x8x1_2x1_intrawave_v3,389.46,190.62,0.0
80,20480,3072,1536,torch.float8_e4m3fnuz,71,0,557.954,a8w8_bpreshuffle_256x128x128x64_16x16_16x16_4x64x1_4x64x1_1x32x1x8_8x8x1_2x1_intrawave_v3,346.4,290.36,0.0
80,20480,4096,512,torch.float8_e4m3fnuz,71,0,331.5621,a8w8_bpreshuffle_256x128x128x64_16x16_16x16_4x64x1_4x64x1_1x32x1x8_8x8x1_2x1_intrawave_v3,259.07,543.96,0.0
80,20480,4608,7168,torch.float8_e4m3fnuz,68,0,3421.2891,a8w8_bpreshuffle_256x128x192x128_16x16_16x16_8x32x1_8x32x1_1x32x1x8_8x8x1_2x1_intrawave_v3,395.44,107.73,0.0
80,20480,7168,256,torch.float8_e4m3fnuz,71,0,381.5807,a8w8_bpreshuffle_256x128x128x64_16x16_16x16_4x64x1_4x64x1_1x32x1x8_8x8x1_2x1_intrawave_v3,196.98,787.98,0.0
80,20480,7168,2048,torch.float8_e4m3fnuz,71,0,1639.9077,a8w8_bpreshuffle_256x128x128x64_16x16_16x16_4x64x1_4x64x1_1x32x1x8_8x8x1_2x1_intrawave_v3,366.66,213.56,0.0
80,20480,7168,2304,torch.float8_e4m3fnuz,71,0,1805.4245,a8w8_bpreshuffle_256x128x128x64_16x16_16x16_4x64x1_4x64x1_1x32x1x8_8x8x1_2x1_intrawave_v3,374.68,197.9,0.0
80,32768,512,7168,torch.float8_e4m3fnuz,70,0,664.7692,a8w8_bpreshuffle_256x128x128x128_16x16_16x16_8x32x1_8x32x1_1x32x1x8_8x8x1_2x1_intrawave_v3,361.81,409.32,0.0
80,32768,2112,7168,torch.float8_e4m3fnuz,93,0,2566.2639,a8w8_bpreshuffle_256x64x192x128_16x16_16x16_8x32x1_8x32x1_1x32x1x8_8x8x1_2x1_intrawave_v3,386.61,151.36,0.0
80,32768,4096,512,torch.float8_e4m3fnuz,71,0,523.3298,a8w8_bpreshuffle_256x128x128x64_16x16_16x16_4x64x1_4x64x1_1x32x1x8_8x8x1_2x1_intrawave_v3,262.62,549.0,0.0
80,32768,4608,4096,torch.float8_e4m3fnuz,93,0,3207.2182,a8w8_bpreshuffle_256x64x192x128_16x16_16x16_8x32x1_8x32x1_1x32x1x8_8x8x1_2x1_intrawave_v3,385.68,141.89,0.0
80,32768,4608,7168,torch.float8_e4m3fnuz,68,0,5527.6346,a8w8_bpreshuffle_256x128x192x128_16x16_16x16_8x32x1_8x32x1_1x32x1x8_8x8x1_2x1_intrawave_v3,391.61,103.1,0.0
80,32768,7168,256,torch.float8_e4m3fnuz,71,0,600.9077,a8w8_bpreshuffle_256x128x128x64_16x16_16x16_4x64x1_4x64x1_1x32x1x8_8x8x1_2x1_intrawave_v3,200.13,798.77,0.0
80,32768,7168,2304,torch.float8_e4m3fnuz,71,0,2907.7206,a8w8_bpreshuffle_256x128x128x64_16x16_16x16_4x64x1_4x64x1_1x32x1x8_8x8x1_2x1_intrawave_v3,372.23,193.2,0.0
80,32768,9216,4096,torch.float8_e4m3fnuz,68,0,6437.3643,a8w8_bpreshuffle_256x128x192x128_16x16_16x16_8x32x1_8x32x1_1x32x1x8_8x8x1_2x1_intrawave_v3,384.3,120.54,0.0
256,1,800,5120,torch.float8_e4m3fn,10,0,11.3133,a8w8_bpreshuffle_128x16x32x512_16x16_16x16_32x4x1_32x4x1_1x16x1x8_4x4x1_1x1_intrawave_v1,0.72,362.65,0.0
256,1,1280,8192,torch.float8_e4m3fn,10,0,12.9809,a8w8_bpreshuffle_128x16x32x512_16x16_16x16_32x4x1_32x4x1_1x16x1x8_4x4x1_1x1_intrawave_v1,1.62,808.61,0.0
256,1,2304,16384,torch.float8_e4m3fn,10,0,28.7056,a8w8_bpreshuffle_128x16x32x512_16x16_16x16_32x4x1_32x4x1_1x16x1x8_4x4x1_1x1_intrawave_v1,2.63,1315.76,0.0
256,1,2560,8192,torch.float8_e4m3fn,10,0,12.8571,a8w8_bpreshuffle_128x16x32x512_16x16_16x16_32x4x1_32x4x1_1x16x1x8_4x4x1_1x1_intrawave_v1,3.26,1632.16,0.0
256,1,4608,16384,torch.float8_e4m3fn,10,0,29.8957,a8w8_bpreshuffle_128x16x32x512_16x16_16x16_32x4x1_32x4x1_1x16x1x8_4x4x1_1x1_intrawave_v1,5.05,2526.22,0.0
256,1,5120,640,torch.float8_e4m3fn,23,0,5.7466,a8w8_bpreshuffle_128x16x32x128_16x16_16x16_8x16x1_8x16x1_1x16x1x8_4x4x1_1x1_intrawave_v2,1.14,572.11,0.0
256,1,5120,1280,torch.float8_e4m3fn,108,0,6.8374,a8w8_bpreshuffle_256x16x64x256_16x16_16x16_16x16x1_16x16x1_1x16x1x16_4x4x1_1x1_intrawave_v1,1.92,960.18,0.0
256,1,5120,3200,torch.float8_e4m3fn,23,0,15.188,a8w8_bpreshuffle_128x16x32x128_16x16_16x16_8x16x1_8x16x1_1x16x1x8_4x4x1_1x1_intrawave_v2,2.16,1079.63,0.0
256,1,5120,5120,torch.float8_e4m3fn,10,0,11.7201,a8w8_bpreshuffle_128x16x32x512_16x16_16x16_32x4x1_32x4x1_1x16x1x8_4x4x1_1x1_intrawave_v1,4.47,2238.02,0.0
256,1,5120,6400,torch.float8_e4m3fn,108,0,19.1846,a8w8_bpreshuffle_256x16x64x256_16x16_16x16_16x16x1_16x16x1_1x16x1x16_4x4x1_1x1_intrawave_v1,3.42,1708.9,0.0
256,1,5120,25600,torch.float8_e4m3fn,10,0,46.1466,a8w8_bpreshuffle_128x16x32x512_16x16_16x16_32x4x1_32x4x1_1x16x1x8_4x4x1_1x1_intrawave_v1,5.68,2841.12,0.0
256,1,6400,5120,torch.float8_e4m3fn,24,0,12.5759,a8w8_bpreshuffle_128x16x32x512_16x16_16x16_32x4x1_32x4x1_1x16x1x8_4x4x1_1x1_intrawave_v2,5.21,2607.04,0.0
256,1,7168,8192,torch.float8_e4m3fn,24,0,15.0501,a8w8_bpreshuffle_128x16x32x512_16x16_16x16_32x4x1_32x4x1_1x16x1x8_4x4x1_1x1_intrawave_v2,7.8,3903.15,0.0
256,1,8192,1024,torch.float8_e4m3fn,108,0,5.9704,a8w8_bpreshuffle_256x16x64x256_16x16_16x16_16x16x1_16x16x1_1x16x1x16_4x4x1_1x1_intrawave_v1,2.81,1407.95,0.0
256,1,8192,2048,torch.float8_e4m3fn,10,0,5.8009,a8w8_bpreshuffle_128x16x32x512_16x16_16x16_32x4x1_32x4x1_1x16x1x8_4x4x1_1x1_intrawave_v1,5.78,2895.35,0.0
256,1,8192,3584,torch.float8_e4m3fn,10,0,7.8125,a8w8_bpreshuffle_128x16x32x512_16x16_16x16_32x4x1_32x4x1_1x16x1x8_4x4x1_1x1_intrawave_v1,7.52,3760.65,0.0
256,1,8192,7168,torch.float8_e4m3fn,24,0,13.9797,a8w8_bpreshuffle_128x16x32x512_16x16_16x16_32x4x1_32x4x1_1x16x1x8_4x4x1_1x1_intrawave_v2,8.4,4202.08,0.0
256,1,8192,8192,torch.float8_e4m3fn,10,0,14.8978,a8w8_bpreshuffle_128x16x32x512_16x16_16x16_32x4x1_32x4x1_1x16x1x8_4x4x1_1x1_intrawave_v1,9.01,4506.27,0.0
256,1,8192,28672,torch.float8_e4m3fn,10,0,46.0411,a8w8_bpreshuffle_128x16x32x512_16x16_16x16_32x4x1_32x4x1_1x16x1x8_4x4x1_1x1_intrawave_v1,10.2,5102.53,0.0
256,1,9216,16384,torch.float8_e4m3fn,10,0,35.2763,a8w8_bpreshuffle_128x16x32x512_16x16_16x16_32x4x1_32x4x1_1x16x1x8_4x4x1_1x1_intrawave_v1,8.56,4281.34,0.0
256,1,10240,8192,torch.float8_e4m3fn,10,0,16.9524,a8w8_bpreshuffle_128x16x32x512_16x16_16x16_32x4x1_32x4x1_1x16x1x8_4x4x1_1x1_intrawave_v1,9.9,4950.02,0.0
256,1,12800,5120,torch.float8_e4m3fn,10,0,14.7141,a8w8_bpreshuffle_128x16x32x512_16x16_16x16_32x4x1_32x4x1_1x16x1x8_4x4x1_1x1_intrawave_v1,8.91,4456.05,0.0
256,1,13312,16384,torch.float8_e4m3fn,10,0,40.7795,a8w8_bpreshuffle_128x16x32x512_16x16_16x16_32x4x1_32x4x1_1x16x1x8_4x4x1_1x1_intrawave_v1,10.7,5349.42,0.0
256,1,14336,8192,torch.float8_e4m3fn,10,0,21.766,a8w8_bpreshuffle_128x16x32x512_16x16_16x16_32x4x1_32x4x1_1x16x1x8_4x4x1_1x1_intrawave_v1,10.79,5397.29,0.0
256,1,16384,2048,torch.float8_e4m3fn,24,0,9.9256,a8w8_bpreshuffle_128x16x32x512_16x16_16x16_32x4x1_32x4x1_1x16x1x8_4x4x1_1x1_intrawave_v2,6.76,3384.1,0.0
256,1,16384,4096,torch.float8_e4m3fn,24,0,14.6481,a8w8_bpreshuffle_128x16x32x512_16x16_16x16_32x4x1_32x4x1_1x16x1x8_4x4x1_1x1_intrawave_v2,9.16,4583.92,0.0
256,1,16384,6656,torch.float8_e4m3fn,24,0,21.1312,a8w8_bpreshuffle_128x16x32x512_16x16_16x16_32x4x1_32x4x1_1x16x1x8_4x4x1_1x1_intrawave_v2,10.32,5162.57,0.0
256,1,16384,8192,torch.float8_e4m3fn,10,0,25.6037,a8w8_bpreshuffle_128x16x32x512_16x16_16x16_32x4x1_32x4x1_1x16x1x8_4x4x1_1x1_intrawave_v1,10.48,5243.72,0.0
256,1,16384,13312,torch.float8_e4m3fn,11,0,39.322,a8w8_bpreshuffle_256x16x64x512_16x16_16x16_32x8x1_32x8x1_1x16x1x16_4x4x1_1x1_intrawave_v1,11.09,5547.78,0.0
256,1,16384,26624,torch.float8_e4m3fn,5,0,73.9656,a8w8_bpreshuffle_256x16x64x512_16x16_16x16_32x8x1_32x8x1_1x16x1x16_4x4x1_1x1_intrawave_v1,11.79,5898.24,0.0
256,1,26624,16384,torch.float8_e4m3fn,6,0,76.8576,a8w8_bpreshuffle_256x16x128x512_16x16_16x16_32x8x1_32x8x1_1x16x1x16_8x8x1_1x2_intrawave_v1,11.35,5676.44,0.0
256,1,51200,5120,torch.float8_e4m3fn,16,0,45.1392,a8w8_bpreshuffle_256x16x128x256_16x16_16x16_16x16x1_16x16x1_1x16x1x16_8x8x1_1x2_intrawave_v1,11.61,5809.84,0.0
256,1,53248,16384,torch.float8_e4m3fn,23,0,150.2505,a8w8_bpreshuffle_128x16x32x128_16x16_16x16_8x16x1_8x16x1_1x16x1x8_4x4x1_1x1_intrawave_v2,11.61,5807.22,0.0
256,1,57344,8192,torch.float8_e4m3fn,9,0,77.922,a8w8_bpreshuffle_128x16x32x128_16x16_16x16_8x16x1_8x16x1_1x16x1x8_4x4x1_1x1_intrawave_v1,12.06,6030.2,0.0
256,4,16384,6656,torch.float8_e4m3fn,11,0,20.7235,a8w8_bpreshuffle_256x16x64x512_16x16_16x16_32x8x1_32x8x1_1x16x1x16_4x4x1_1x1_intrawave_v1,42.1,5269.84,0.0
256,8,6656,16384,torch.float8_e4m3fn,10,0,31.2392,a8w8_bpreshuffle_128x16x32x512_16x16_16x16_32x4x1_32x4x1_1x16x1x8_4x4x1_1x1_intrawave_v1,55.85,3498.47,0.0
256,8,16384,6656,torch.float8_e4m3fn,11,0,20.8171,a8w8_bpreshuffle_256x16x64x512_16x16_16x16_32x8x1_32x8x1_1x16x1x16_4x4x1_1x1_intrawave_v1,83.82,5253.72,0.0
256,16,800,5120,torch.float8_e4m3fn,24,0,10.5404,a8w8_bpreshuffle_128x16x32x512_16x16_16x16_32x4x1_32x4x1_1x16x1x8_4x4x1_1x1_intrawave_v2,12.44,398.8,0.0
256,16,1280,8192,torch.float8_e4m3fn,10,0,12.0223,a8w8_bpreshuffle_128x16x32x512_16x16_16x16_32x4x1_32x4x1_1x16x1x8_4x4x1_1x1_intrawave_v1,27.91,886.5,0.0
256,16,2304,16384,torch.float8_e4m3fn,24,0,24.7047,a8w8_bpreshuffle_128x16x32x512_16x16_16x16_32x4x1_32x4x1_1x16x1x8_4x4x1_1x1_intrawave_v2,48.9,1541.59,0.0
256,16,2560,8192,torch.float8_e4m3fn,10,0,11.95,a8w8_bpreshuffle_128x16x32x512_16x16_16x16_32x4x1_32x4x1_1x16x1x8_4x4x1_1x1_intrawave_v1,56.16,1772.76,0.0
256,16,4608,16384,torch.float8_e4m3fn,24,0,25.8456,a8w8_bpreshuffle_128x16x32x512_16x16_16x16_32x4x1_32x4x1_1x16x1x8_4x4x1_1x1_intrawave_v2,93.48,2936.94,0.0
256,16,5120,640,torch.float8_e4m3fn,23,0,5.7485,a8w8_bpreshuffle_128x16x32x128_16x16_16x16_8x16x1_8x16x1_1x16x1x8_4x4x1_1x1_intrawave_v2,18.24,600.31,0.0
256,16,5120,1280,torch.float8_e4m3fn,29,0,6.7718,a8w8_bpreshuffle_256x16x64x256_16x16_16x16_16x16x1_16x16x1_1x16x1x16_4x4x1_1x1_intrawave_v2,30.97,995.0,0.0
256,16,5120,3200,torch.float8_e4m3fn,23,0,14.71,a8w8_bpreshuffle_128x16x32x128_16x16_16x16_8x16x1_8x16x1_1x16x1x8_4x4x1_1x1_intrawave_v2,35.64,1128.42,0.0
256,16,5120,5120,torch.float8_e4m3fn,24,0,10.554,a8w8_bpreshuffle_128x16x32x512_16x16_16x16_32x4x1_32x4x1_1x16x1x8_4x4x1_1x1_intrawave_v2,79.48,2507.12,0.0
256,16,5120,6400,torch.float8_e4m3fn,15,0,19.3187,a8w8_bpreshuffle_256x16x64x256_16x16_16x16_16x16x1_16x16x1_1x16x1x16_4x4x1_1x1_intrawave_v1,54.28,1709.96,0.0
256,16,5120,25600,torch.float8_e4m3fn,24,0,39.1761,a8w8_bpreshuffle_128x16x32x512_16x16_16x16_32x4x1_32x4x1_1x16x1x8_4x4x1_1x1_intrawave_v2,107.06,3360.35,0.0
256,16,6400,5120,torch.float8_e4m3fn,10,0,11.3305,a8w8_bpreshuffle_128x16x32x512_16x16_16x16_32x4x1_32x4x1_1x16x1x8_4x4x1_1x1_intrawave_v1,92.54,2917.32,0.0
256,16,7168,8192,torch.float8_e4m3fn,10,0,13.6022,a8w8_bpreshuffle_128x16x32x512_16x16_16x16_32x4x1_32x4x1_1x16x1x8_4x4x1_1x1_intrawave_v1,138.14,4343.47,0.0
256,16,8192,1024,torch.float8_e4m3fn,15,0,5.9167,a8w8_bpreshuffle_256x16x64x256_16x16_16x16_16x16x1_16x16x1_1x16x1x16_4x4x1_1x1_intrawave_v1,45.37,1464.86,0.0
256,16,8192,2048,torch.float8_e4m3fn,10,0,5.6214,a8w8_bpreshuffle_128x16x32x512_16x16_16x16_32x4x1_32x4x1_1x16x1x8_4x4x1_1x1_intrawave_v1,95.5,3036.99,0.0
256,16,8192,3584,torch.float8_e4m3fn,10,0,7.8314,a8w8_bpreshuffle_128x16x32x512_16x16_16x16_32x4x1_32x4x1_1x16x1x8_4x4x1_1x1_intrawave_v1,119.97,3789.82,0.0
256,16,8192,7168,torch.float8_e4m3fn,10,0,12.5267,a8w8_bpreshuffle_128x16x32x512_16x16_16x16_32x4x1_32x4x1_1x16x1x8_4x4x1_1x1_intrawave_v1,150.0,4717.69,0.0
256,16,8192,8192,torch.float8_e4m3fn,10,0,13.9737,a8w8_bpreshuffle_128x16x32x512_16x16_16x16_32x4x1_32x4x1_1x16x1x8_4x4x1_1x1_intrawave_v1,153.68,4830.65,0.0
256,16,8192,28672,torch.float8_e4m3fn,10,0,41.1742,a8w8_bpreshuffle_128x16x32x512_16x16_16x16_32x4x1_32x4x1_1x16x1x8_4x4x1_1x1_intrawave_v1,182.55,5722.08,0.0
256,16,9216,16384,torch.float8_e4m3fn,24,0,32.3786,a8w8_bpreshuffle_128x16x32x512_16x16_16x16_32x4x1_32x4x1_1x16x1x8_4x4x1_1x1_intrawave_v2,149.23,4680.62,0.0
256,16,10240,8192,torch.float8_e4m3fn,10,0,17.892,a8w8_bpreshuffle_128x16x32x512_16x16_16x16_32x4x1_32x4x1_1x16x1x8_4x4x1_1x1_intrawave_v1,150.03,4714.11,0.0
256,16,12800,5120,torch.float8_e4m3fn,5,0,14.0716,a8w8_bpreshuffle_256x16x64x512_16x16_16x16_32x8x1_32x8x1_1x16x1x16_4x4x1_1x1_intrawave_v1,149.03,4692.25,0.0
256,16,13312,16384,torch.float8_e4m3fn,10,0,40.3808,a8w8_bpreshuffle_128x16x32x512_16x16_16x16_32x4x1_32x4x1_1x16x1x8_4x4x1_1x1_intrawave_v1,172.84,5418.22,0.0
256,16,14336,8192,torch.float8_e4m3fn,10,0,21.2685,a8w8_bpreshuffle_128x16x32x512_16x16_16x16_32x4x1_32x4x1_1x16x1x8_4x4x1_1x1_intrawave_v1,176.7,5549.54,0.0
256,16,16384,2048,torch.float8_e4m3fn,10,0,7.7604,a8w8_bpreshuffle_128x16x32x512_16x16_16x16_32x4x1_32x4x1_1x16x1x8_4x4x1_1x1_intrawave_v1,138.36,4395.58,0.0
256,16,16384,4096,torch.float8_e4m3fn,26,0,17.4151,a8w8_bpreshuffle_256x32x64x512_16x16_16x16_32x8x1_32x8x1_1x32x1x8_8x8x1_1x2_intrawave_v2,123.31,3887.36,0.0
256,16,16384,6656,torch.float8_e4m3fn,24,0,20.8707,a8w8_bpreshuffle_128x16x32x512_16x16_16x16_32x4x1_32x4x1_1x16x1x8_4x4x1_1x1_intrawave_v2,167.2,5255.34,0.0
256,16,16384,8192,torch.float8_e4m3fn,10,0,25.0145,a8w8_bpreshuffle_128x16x32x512_16x16_16x16_32x4x1_32x4x1_1x16x1x8_4x4x1_1x1_intrawave_v1,171.7,5391.8,0.0
256,16,16384,13312,torch.float8_e4m3fn,5,0,37.8531,a8w8_bpreshuffle_256x16x64x512_16x16_16x16_32x8x1_32x8x1_1x16x1x16_4x4x1_1x1_intrawave_v1,184.38,5781.33,0.0
256,16,16384,26624,torch.float8_e4m3fn,11,0,72.6906,a8w8_bpreshuffle_256x16x64x512_16x16_16x16_32x8x1_32x8x1_1x16x1x16_4x4x1_1x1_intrawave_v1,192.03,6013.95,0.0
256,16,26624,16384,torch.float8_e4m3fn,6,0,77.3342,a8w8_bpreshuffle_256x16x128x512_16x16_16x16_32x8x1_32x8x1_1x16x1x16_8x8x1_1x2_intrawave_v1,180.5,5654.96,0.0
256,16,51200,5120,torch.float8_e4m3fn,17,0,46.1585,a8w8_bpreshuffle_256x16x256x256_16x16_16x16_16x16x1_16x16x1_1x16x1x16_8x8x1_1x2_intrawave_v1,181.73,5716.48,0.0
256,16,53248,16384,torch.float8_e4m3fn,31,0,151.3677,a8w8_bpreshuffle_256x16x256x256_16x16_16x16_16x16x1_16x16x1_1x16x1x16_8x8x1_1x2_intrawave_v2,184.43,5776.54,0.0
256,16,57344,8192,torch.float8_e4m3fn,23,0,79.5497,a8w8_bpreshuffle_128x16x32x128_16x16_16x16_8x16x1_8x16x1_1x16x1x8_4x4x1_1x1_intrawave_v2,188.97,5929.98,0.0
256,32,800,5120,torch.float8_e4m3fn,24,0,10.2279,a8w8_bpreshuffle_128x16x32x512_16x16_16x16_32x4x1_32x4x1_1x16x1x8_4x4x1_1x1_intrawave_v2,25.63,421.5,0.0
256,32,1280,8192,torch.float8_e4m3fn,10,0,11.3752,a8w8_bpreshuffle_128x16x32x512_16x16_16x16_32x4x1_32x4x1_1x16x1x8_4x4x1_1x1_intrawave_v1,59.0,952.06,0.0
256,32,2304,16384,torch.float8_e4m3fn,24,0,25.2915,a8w8_bpreshuffle_128x16x32x512_16x16_16x16_32x4x1_32x4x1_1x16x1x8_4x4x1_1x1_intrawave_v2,95.52,1519.11,0.0
256,32,2560,8192,torch.float8_e4m3fn,10,0,12.0316,a8w8_bpreshuffle_128x16x32x512_16x16_16x16_32x4x1_32x4x1_1x16x1x8_4x4x1_1x1_intrawave_v1,111.55,1778.44,0.0
256,32,4608,16384,torch.float8_e4m3fn,24,0,29.2704,a8w8_bpreshuffle_128x16x32x512_16x16_16x16_32x4x1_32x4x1_1x16x1x8_4x4x1_1x1_intrawave_v2,165.08,2607.3,0.0
256,32,5120,640,torch.float8_e4m3fn,23,0,6.4386,a8w8_bpreshuffle_128x16x32x128_16x16_16x16_8x16x1_8x16x1_1x16x1x8_4x4x1_1x1_intrawave_v2,32.57,563.0,0.0
256,32,5120,1280,torch.float8_e4m3fn,29,0,6.9951,a8w8_bpreshuffle_256x16x64x256_16x16_16x16_16x16x1_16x16x1_1x16x1x16_4x4x1_1x1_intrawave_v2,59.96,989.58,0.0
256,32,5120,3200,torch.float8_e4m3fn,9,0,15.6619,a8w8_bpreshuffle_128x16x32x128_16x16_16x16_8x16x1_8x16x1_1x16x1x8_4x4x1_1x1_intrawave_v1,66.95,1073.57,0.0
256,32,5120,5120,torch.float8_e4m3fn,11,0,11.6951,a8w8_bpreshuffle_256x16x64x512_16x16_16x16_32x8x1_32x8x1_1x16x1x16_4x4x1_1x1_intrawave_v1,143.46,2283.51,0.0
256,32,5120,6400,torch.float8_e4m3fn,15,0,19.3178,a8w8_bpreshuffle_256x16x64x256_16x16_16x16_16x16x1_16x16x1_1x16x1x16_4x4x1_1x1_intrawave_v1,108.56,1723.82,0.0
256,32,5120,25600,torch.float8_e4m3fn,24,0,44.1556,a8w8_bpreshuffle_128x16x32x512_16x16_16x16_32x4x1_32x4x1_1x16x1x8_4x4x1_1x1_intrawave_v2,189.98,2994.39,0.0
256,32,6400,5120,torch.float8_e4m3fn,5,0,12.3982,a8w8_bpreshuffle_256x16x64x512_16x16_16x16_32x8x1_32x8x1_1x16x1x16_4x4x1_1x1_intrawave_v1,169.15,2689.22,0.0
256,32,7168,8192,torch.float8_e4m3fn,11,0,15.5322,a8w8_bpreshuffle_256x16x64x512_16x16_16x16_32x8x1_32x8x1_1x16x1x16_4x4x1_1x1_intrawave_v1,241.96,3826.96,0.0
256,32,8192,1024,torch.float8_e4m3fn,108,0,6.0451,a8w8_bpreshuffle_256x16x64x256_16x16_16x16_16x16x1_16x16x1_1x16x1x16_4x4x1_1x1_intrawave_v1,88.81,1479.82,0.0
256,32,8192,2048,torch.float8_e4m3fn,5,0,6.2663,a8w8_bpreshuffle_256x16x64x512_16x16_16x16_32x8x1_32x8x1_1x16x1x16_4x4x1_1x1_intrawave_v1,171.35,2771.5,0.0
256,32,8192,3584,torch.float8_e4m3fn,5,0,7.9538,a8w8_bpreshuffle_256x16x64x512_16x16_16x16_32x8x1_32x8x1_1x16x1x16_4x4x1_1x1_intrawave_v1,236.25,3771.67,0.0
256,32,8192,7168,torch.float8_e4m3fn,11,0,14.5895,a8w8_bpreshuffle_256x16x64x512_16x16_16x16_32x8x1_32x8x1_1x16x1x16_4x4x1_1x1_intrawave_v1,257.59,4076.49,0.0
256,32,8192,8192,torch.float8_e4m3fn,5,0,15.7818,a8w8_bpreshuffle_256x16x64x512_16x16_16x16_32x8x1_32x8x1_1x16x1x16_4x4x1_1x1_intrawave_v1,272.15,4302.13,0.0
256,32,8192,28672,torch.float8_e4m3fn,5,0,47.2548,a8w8_bpreshuffle_256x16x64x512_16x16_16x16_32x8x1_32x8x1_1x16x1x16_4x4x1_1x1_intrawave_v1,318.11,5001.03,0.0
256,32,9216,16384,torch.float8_e4m3fn,24,0,39.3729,a8w8_bpreshuffle_128x16x32x512_16x16_16x16_32x4x1_32x4x1_1x16x1x8_4x4x1_1x1_intrawave_v2,245.44,3863.29,0.0
256,32,10240,8192,torch.float8_e4m3fn,10,0,22.5861,a8w8_bpreshuffle_128x16x32x512_16x16_16x16_32x4x1_32x4x1_1x16x1x8_4x4x1_1x1_intrawave_v1,237.7,3754.68,0.0
256,32,12800,5120,torch.float8_e4m3fn,12,0,17.5533,a8w8_bpreshuffle_256x32x64x512_16x16_16x16_32x8x1_32x8x1_1x32x1x8_8x8x1_1x2_intrawave_v1,238.95,3789.55,0.0
256,32,13312,16384,torch.float8_e4m3fn,12,0,46.3062,a8w8_bpreshuffle_256x32x64x512_16x16_16x16_32x8x1_32x8x1_1x32x1x8_8x8x1_1x2_intrawave_v1,301.44,4739.76,0.0
256,32,14336,8192,torch.float8_e4m3fn,6,0,26.4468,a8w8_bpreshuffle_256x16x128x512_16x16_16x16_32x8x1_32x8x1_1x16x1x16_8x8x1_1x2_intrawave_v1,284.2,4485.24,0.0
256,32,16384,2048,torch.float8_e4m3fn,6,0,9.6867,a8w8_bpreshuffle_256x16x128x512_16x16_16x16_32x8x1_32x8x1_1x16x1x16_8x8x1_1x2_intrawave_v1,221.69,3578.98,0.0
256,32,16384,4096,torch.float8_e4m3fn,26,0,17.6799,a8w8_bpreshuffle_256x32x64x512_16x16_16x16_32x8x1_32x8x1_1x32x1x8_8x8x1_1x2_intrawave_v2,242.93,3862.49,0.0
256,32,16384,6656,torch.float8_e4m3fn,12,0,23.1146,a8w8_bpreshuffle_256x32x64x512_16x16_16x16_32x8x1_32x8x1_1x32x1x8_8x8x1_1x2_intrawave_v1,301.94,4772.46,0.0
256,32,16384,8192,torch.float8_e4m3fn,19,0,28.8166,a8w8_bpreshuffle_256x16x64x512_16x16_16x16_32x8x1_32x8x1_1x16x1x16_4x4x1_1x1_intrawave_v2,298.09,4703.14,0.0
256,32,16384,13312,torch.float8_e4m3fn,12,0,40.7803,a8w8_bpreshuffle_256x32x64x512_16x16_16x16_32x8x1_32x8x1_1x32x1x8_8x8x1_1x2_intrawave_v1,342.29,5384.42,0.0
256,32,16384,26624,torch.float8_e4m3fn,12,0,77.4146,a8w8_bpreshuffle_256x32x64x512_16x16_16x16_32x8x1_32x8x1_1x32x1x8_8x8x1_1x2_intrawave_v1,360.62,5659.24,0.0
256,32,26624,16384,torch.float8_e4m3fn,119,0,80.3452,a8w8_bpreshuffle_256x32x128x256_16x16_16x16_16x16x1_16x16x1_1x16x1x16_8x8x1_1x2_intrawave_v1,347.47,5456.9,0.0
256,32,51200,5120,torch.float8_e4m3fn,133,0,47.8343,a8w8_bpreshuffle_256x32x256x256_16x16_16x16_16x16x1_16x16x1_1x16x1x16_8x8x1_1x2_intrawave_v1,350.74,5552.18,0.0
256,32,53248,16384,torch.float8_e4m3fn,136,0,154.4861,a8w8_bpreshuffle_256x80x256x256_16x16_16x16_16x16x1_16x16x1_1x16x1x16_8x8x1_1x2_intrawave_v3,361.42,5672.66,0.0
256,32,57344,8192,torch.float8_e4m3fn,85,0,86.5188,a8w8_bpreshuffle_256x64x128x128_16x16_16x16_8x32x1_8x32x1_1x32x1x8_8x8x1_2x1_intrawave_v3,347.49,5475.04,0.0
256,64,192,1024,torch.float8_e4m3fn,15,0,4.5229,a8w8_bpreshuffle_256x16x64x256_16x16_16x16_16x16x1_16x16x1_1x16x1x16_4x4x1_1x1_intrawave_v1,5.56,63.39,0.0
256,64,800,5120,torch.float8_e4m3fn,10,0,10.5456,a8w8_bpreshuffle_128x16x32x512_16x16_16x16_32x4x1_32x4x1_1x16x1x8_4x4x1_1x1_intrawave_v1,49.72,429.19,0.0
256,64,1280,8192,torch.float8_e4m3fn,10,0,11.9979,a8w8_bpreshuffle_128x16x32x512_16x16_16x16_32x4x1_32x4x1_1x16x1x8_4x4x1_1x1_intrawave_v1,111.87,931.32,0.0
256,64,2304,16384,torch.float8_e4m3fn,19,0,27.9421,a8w8_bpreshuffle_256x16x64x512_16x16_16x16_32x8x1_32x8x1_1x16x1x16_4x4x1_1x1_intrawave_v2,172.92,1399.04,0.0
256,64,2560,8192,torch.float8_e4m3fn,5,0,12.8533,a8w8_bpreshuffle_256x16x64x512_16x16_16x16_32x8x1_32x8x1_1x16x1x16_4x4x1_1x1_intrawave_v1,208.85,1697.89,0.0
256,64,4608,16384,torch.float8_e4m3fn,10,0,36.4754,a8w8_bpreshuffle_128x16x32x512_16x16_16x16_32x4x1_32x4x1_1x16x1x8_4x4x1_1x1_intrawave_v1,264.94,2114.74,0.0
256,64,5120,640,torch.float8_e4m3fn,23,0,6.7207,a8w8_bpreshuffle_128x16x32x128_16x16_16x16_8x16x1_8x16x1_1x16x1x8_4x4x1_1x1_intrawave_v2,62.41,591.18,0.0
256,64,5120,1280,torch.float8_e4m3fn,29,0,7.6564,a8w8_bpreshuffle_256x16x64x256_16x16_16x16_16x16x1_16x16x1_1x16x1x16_4x4x1_1x1_intrawave_v2,109.56,952.26,0.0
256,64,5120,3200,torch.float8_e4m3fn,23,0,15.6284,a8w8_bpreshuffle_128x16x32x128_16x16_16x16_8x16x1_8x16x1_1x16x1x8_4x4x1_1x1_intrawave_v2,134.19,1103.39,0.0
256,64,5120,5120,torch.float8_e4m3fn,10,0,14.3407,a8w8_bpreshuffle_128x16x32x512_16x16_16x16_32x4x1_32x4x1_1x16x1x8_4x4x1_1x1_intrawave_v1,233.98,1896.52,0.0
256,64,5120,6400,torch.float8_e4m3fn,15,0,19.7146,a8w8_bpreshuffle_256x16x64x256_16x16_16x16_16x16x1_16x16x1_1x16x1x16_4x4x1_1x1_intrawave_v1,212.75,1716.14,0.0
256,64,5120,25600,torch.float8_e4m3fn,24,0,52.8565,a8w8_bpreshuffle_128x16x32x512_16x16_16x16_32x4x1_32x4x1_1x16x1x8_4x4x1_1x1_intrawave_v2,317.41,2523.17,0.0
256,64,6400,5120,torch.float8_e4m3fn,12,0,14.7961,a8w8_bpreshuffle_256x32x64x512_16x16_16x16_32x8x1_32x8x1_1x32x1x8_8x8x1_1x2_intrawave_v1,283.47,2292.15,0.0
256,64,7168,8192,torch.float8_e4m3fn,12,0,20.6714,a8w8_bpreshuffle_256x32x64x512_16x16_16x16_32x8x1_32x8x1_1x32x1x8_8x8x1_1x2_intrawave_v1,363.6,2910.4,0.0
256,64,8192,2048,torch.float8_e4m3fn,5,0,7.5112,a8w8_bpreshuffle_256x16x64x512_16x16_16x16_32x8x1_32x8x1_1x16x1x16_4x4x1_1x1_intrawave_v1,285.9,2390.68,0.0
256,64,8192,3584,torch.float8_e4m3fn,12,0,11.0813,a8w8_bpreshuffle_256x32x64x512_16x16_16x16_32x8x1_32x8x1_1x32x1x8_8x8x1_1x2_intrawave_v1,339.14,2764.85,0.0
256,64,8192,7168,torch.float8_e4m3fn,12,0,19.2039,a8w8_bpreshuffle_256x32x64x512_16x16_16x16_32x8x1_32x8x1_1x32x1x8_8x8x1_1x2_intrawave_v1,391.39,3136.22,0.0
256,64,8192,8192,torch.float8_e4m3fn,12,0,21.1081,a8w8_bpreshuffle_256x32x64x512_16x16_16x16_32x8x1_32x8x1_1x32x1x8_8x8x1_1x2_intrawave_v1,406.95,3253.81,0.0
256,64,8192,28672,torch.float8_e4m3fn,12,0,64.9256,a8w8_bpreshuffle_256x32x64x512_16x16_16x16_32x8x1_32x8x1_1x32x1x8_8x8x1_1x2_intrawave_v1,463.06,3662.11,0.0
256,64,9216,16384,torch.float8_e4m3fn,114,0,56.6696,a8w8_bpreshuffle_256x64x64x256_16x16_16x16_16x16x1_16x16x1_1x32x1x8_8x8x1_2x1_intrawave_v3,341.05,2703.8,0.0
256,64,10240,8192,torch.float8_e4m3fn,114,0,25.5687,a8w8_bpreshuffle_256x64x64x256_16x16_16x16_16x16x1_16x16x1_1x32x1x8_8x8x1_2x1_intrawave_v3,419.94,3352.58,0.0
256,64,12800,5120,torch.float8_e4m3fn,119,0,21.9262,a8w8_bpreshuffle_256x32x128x256_16x16_16x16_16x16x1_16x16x1_1x16x1x16_8x8x1_1x2_intrawave_v1,382.58,3078.6,0.0
256,64,13312,16384,torch.float8_e4m3fn,114,0,60.16,a8w8_bpreshuffle_256x64x64x256_16x16_16x16_16x16x1_16x16x1_1x32x1x8_8x8x1_2x1_intrawave_v3,464.05,3671.15,0.0
256,64,14336,8192,torch.float8_e4m3fn,114,0,29.5848,a8w8_bpreshuffle_256x64x64x256_16x16_16x16_16x16x1_16x16x1_1x32x1x8_8x8x1_2x1_intrawave_v3,508.11,4049.37,0.0
256,64,16384,2048,torch.float8_e4m3fn,119,0,11.4341,a8w8_bpreshuffle_256x32x128x256_16x16_16x16_16x16x1_16x16x1_1x16x1x16_8x8x1_1x2_intrawave_v1,375.63,3129.47,0.0
256,64,16384,4096,torch.float8_e4m3fn,119,0,20.8735,a8w8_bpreshuffle_256x32x128x256_16x16_16x16_16x16x1_16x16x1_1x16x1x16_8x8x1_1x2_intrawave_v1,411.52,3328.06,0.0
256,64,16384,6656,torch.float8_e4m3fn,119,0,29.3009,a8w8_bpreshuffle_256x32x128x256_16x16_16x16_16x16x1_16x16x1_1x16x1x16_8x8x1_1x2_intrawave_v1,476.39,3807.9,0.0
256,64,16384,8192,torch.float8_e4m3fn,119,0,35.6664,a8w8_bpreshuffle_256x32x128x256_16x16_16x16_16x16x1_16x16x1_1x16x1x16_8x8x1_1x2_intrawave_v1,481.68,3836.64,0.0
256,64,16384,13312,torch.float8_e4m3fn,119,0,53.1879,a8w8_bpreshuffle_256x32x128x256_16x16_16x16_16x16x1_16x16x1_1x16x1x16_8x8x1_1x2_intrawave_v1,524.88,4156.08,0.0
256,64,16384,26624,torch.float8_e4m3fn,119,0,102.4795,a8w8_bpreshuffle_256x32x128x256_16x16_16x16_16x16x1_16x16x1_1x16x1x16_8x8x1_1x2_intrawave_v1,544.84,4293.63,0.0
256,64,26624,16384,torch.float8_e4m3fn,121,0,91.6538,a8w8_bpreshuffle_256x64x128x256_16x16_16x16_16x16x1_16x16x1_1x16x1x16_8x8x1_1x2_intrawave_v3,609.19,4807.92,0.0
256,64,51200,5120,torch.float8_e4m3fn,135,0,54.3316,a8w8_bpreshuffle_256x64x256x256_16x16_16x16_16x16x1_16x16x1_1x16x1x16_8x8x1_1x2_intrawave_v3,617.59,4951.54,0.0
256,64,53248,16384,torch.float8_e4m3fn,135,0,156.5996,a8w8_bpreshuffle_256x64x256x256_16x16_16x16_16x16x1_16x16x1_1x16x1x16_8x8x1_1x2_intrawave_v3,713.09,5621.21,0.0
256,64,57344,8192,torch.float8_e4m3fn,85,0,87.6062,a8w8_bpreshuffle_256x64x128x128_16x16_16x16_8x32x1_8x32x1_1x32x1x8_8x8x1_2x1_intrawave_v3,686.36,5451.97,0.0
256,128,800,5120,torch.float8_e4m3fn,24,0,9.9852,a8w8_bpreshuffle_128x16x32x512_16x16_16x16_32x4x1_32x4x1_1x16x1x8_4x4x1_1x1_intrawave_v2,105.01,496.35,0.0
256,128,1280,8192,torch.float8_e4m3fn,5,0,12.228,a8w8_bpreshuffle_256x16x64x512_16x16_16x16_32x8x1_32x8x1_1x16x1x16_4x4x1_1x1_intrawave_v1,219.53,970.07,0.0
256,128,2304,16384,torch.float8_e4m3fn,24,0,33.0153,a8w8_bpreshuffle_128x16x32x512_16x16_16x16_32x4x1_32x4x1_1x16x1x8_4x4x1_1x1_intrawave_v2,292.7,1224.76,0.0
256,128,2560,8192,torch.float8_e4m3fn,10,0,17.8034,a8w8_bpreshuffle_128x16x32x512_16x16_16x16_32x4x1_32x4x1_1x16x1x8_4x4x1_1x1_intrawave_v1,301.56,1273.66,0.0
256,128,4608,16384,torch.float8_e4m3fn,108,0,54.3179,a8w8_bpreshuffle_256x16x64x256_16x16_16x16_16x16x1_16x16x1_1x16x1x16_4x4x1_1x1_intrawave_v1,355.82,1450.25,0.0
256,128,5120,640,torch.float8_e4m3fn,23,0,6.3513,a8w8_bpreshuffle_128x16x32x128_16x16_16x16_8x16x1_8x16x1_1x16x1x8_4x4x1_1x1_intrawave_v2,132.08,735.19,0.0
256,128,5120,1280,torch.float8_e4m3fn,29,0,7.7817,a8w8_bpreshuffle_256x16x64x256_16x16_16x16_16x16x1_16x16x1_1x16x1x16_4x4x1_1x1_intrawave_v2,215.6,1031.67,0.0
256,128,5120,3200,torch.float8_e4m3fn,23,0,16.0101,a8w8_bpreshuffle_128x16x32x128_16x16_16x16_8x16x1_8x16x1_1x16x1x8_4x4x1_1x1_intrawave_v2,261.98,1130.81,0.0
256,128,5120,5120,torch.float8_e4m3fn,108,0,19.63,a8w8_bpreshuffle_256x16x64x256_16x16_16x16_16x16x1_16x16x1_1x16x1x16_4x4x1_1x1_intrawave_v1,341.87,1435.58,0.0
256,128,5120,6400,torch.float8_e4m3fn,29,0,22.9859,a8w8_bpreshuffle_256x16x64x256_16x16_16x16_16x16x1_16x16x1_1x16x1x16_4x4x1_1x1_intrawave_v2,364.95,1518.23,0.0
256,128,5120,25600,torch.float8_e4m3fn,114,0,83.5847,a8w8_bpreshuffle_256x64x64x256_16x16_16x16_16x16x1_16x16x1_1x32x1x8_8x8x1_2x1_intrawave_v3,401.44,1623.02,0.0
256,128,6400,5120,torch.float8_e4m3fn,114,0,20.5908,a8w8_bpreshuffle_256x64x64x256_16x16_16x16_16x16x1_16x16x1_1x32x1x8_8x8x1_2x1_intrawave_v3,407.4,1702.79,0.0
256,128,7168,8192,torch.float8_e4m3fn,114,0,23.7352,a8w8_bpreshuffle_256x64x64x256_16x16_16x16_16x16x1_16x16x1_1x32x1x8_8x8x1_2x1_intrawave_v3,633.34,2595.46,0.0
256,128,8192,1024,torch.float8_e4m3fn,119,0,6.9407,a8w8_bpreshuffle_256x32x128x256_16x16_16x16_16x16x1_16x16x1_1x16x1x16_8x8x1_1x2_intrawave_v1,309.4,1529.65,0.0
256,128,8192,2048,torch.float8_e4m3fn,114,0,8.8614,a8w8_bpreshuffle_256x64x64x256_16x16_16x16_16x16x1_16x16x1_1x32x1x8_8x8x1_2x1_intrawave_v3,484.68,2159.54,0.0
256,128,8192,3584,torch.float8_e4m3fn,114,0,12.978,a8w8_bpreshuffle_256x64x64x256_16x16_16x16_16x16x1_16x16x1_1x32x1x8_8x8x1_2x1_intrawave_v3,579.15,2459.24,0.0
256,128,8192,7168,torch.float8_e4m3fn,114,0,21.6976,a8w8_bpreshuffle_256x64x64x256_16x16_16x16_16x16x1_16x16x1_1x32x1x8_8x8x1_2x1_intrawave_v3,692.81,2845.24,0.0
256,128,8192,8192,torch.float8_e4m3fn,114,0,24.8294,a8w8_bpreshuffle_256x64x64x256_16x16_16x16_16x16x1_16x16x1_1x32x1x8_8x8x1_2x1_intrawave_v3,691.92,2829.49,0.0
256,128,8192,28672,torch.float8_e4m3fn,114,0,75.1872,a8w8_bpreshuffle_256x64x64x256_16x16_16x16_16x16x1_16x16x1_1x32x1x8_8x8x1_2x1_intrawave_v3,799.73,3200.65,0.0
256,128,9216,16384,torch.float8_e4m3fn,126,0,72.8197,a8w8_bpreshuffle_256x32x192x256_16x16_16x16_16x16x1_16x16x1_1x32x1x8_8x8x1_2x1_intrawave_v1,530.83,2134.74,0.0
256,128,10240,8192,torch.float8_e4m3fn,113,0,30.4124,a8w8_bpreshuffle_256x48x64x256_16x16_16x16_16x16x1_16x16x1_1x16x1x16_4x4x1_1x1_intrawave_v1,706.12,2878.96,0.0
256,128,12800,5120,torch.float8_e4m3fn,65,0,28.9421,a8w8_bpreshuffle_256x128x64x256_16x16_16x16_16x16x1_16x16x1_1x32x1x8_8x8x1_2x1_intrawave_v3,579.68,2400.25,0.0
256,128,13312,16384,torch.float8_e4m3fn,144,0,79.9061,a8w8_bpreshuffle_256x128x64x256_16x16_16x16_16x16x1_16x16x1_1x32x1x8_8x8x1_2x1_intrawave_v3,698.75,2798.4,0.0
256,128,14336,8192,torch.float8_e4m3fn,144,0,36.1842,a8w8_bpreshuffle_256x128x64x256_16x16_16x16_16x16x1_16x16x1_1x32x1x8_8x8x1_2x1_intrawave_v3,830.88,3376.03,0.0
256,128,16384,2048,torch.float8_e4m3fn,119,0,15.5043,a8w8_bpreshuffle_256x32x128x256_16x16_16x16_16x16x1_16x16x1_1x16x1x16_8x8x1_1x2_intrawave_v1,554.04,2451.63,0.0
256,128,16384,4096,torch.float8_e4m3fn,121,0,26.5935,a8w8_bpreshuffle_256x64x128x256_16x16_16x16_16x16x1_16x16x1_1x16x1x16_8x8x1_1x2_intrawave_v3,646.02,2700.94,0.0
256,128,16384,6656,torch.float8_e4m3fn,65,0,39.0387,a8w8_bpreshuffle_256x128x64x256_16x16_16x16_16x16x1_16x16x1_1x32x1x8_8x8x1_2x1_intrawave_v3,715.12,2922.69,0.0
256,128,16384,8192,torch.float8_e4m3fn,121,0,45.9107,a8w8_bpreshuffle_256x64x128x256_16x16_16x16_16x16x1_16x16x1_1x16x1x16_8x8x1_1x2_intrawave_v3,748.4,3037.65,0.0
256,128,16384,13312,torch.float8_e4m3fn,65,0,70.6454,a8w8_bpreshuffle_256x128x64x256_16x16_16x16_16x16x1_16x16x1_1x32x1x8_8x8x1_2x1_intrawave_v3,790.35,3170.79,0.0
256,128,16384,26624,torch.float8_e4m3fn,144,0,134.0597,a8w8_bpreshuffle_256x128x64x256_16x16_16x16_16x16x1_16x16x1_1x32x1x8_8x8x1_2x1_intrawave_v3,832.98,3310.54,0.0
256,128,26624,16384,torch.float8_e4m3fn,139,0,108.1175,a8w8_bpreshuffle_256x128x128x256_16x16_16x16_16x16x1_16x16x1_1x16x1x16_8x8x1_1x2_intrawave_v3,1032.85,4117.01,0.0
256,128,51200,5120,torch.float8_e4m3fn,154,0,65.6842,a8w8_bpreshuffle_256x128x256x256_16x16_16x16_16x16x1_16x16x1_1x16x1x16_8x8x1_1x2_intrawave_v3,1021.69,4200.5,0.0
256,128,53248,16384,torch.float8_e4m3fn,154,0,184.7497,a8w8_bpreshuffle_256x128x256x256_16x16_16x16_16x16x1_16x16x1_1x16x1x16_8x8x1_1x2_intrawave_v3,1208.87,4807.28,0.0
256,128,57344,8192,torch.float8_e4m3fn,54,0,95.8445,a8w8_bpreshuffle_256x160x256x128_16x16_16x16_8x32x1_8x32x1_1x32x1x8_8x8x1_2x1_intrawave_v3,1254.73,5065.4,0.0
256,256,800,5120,torch.float8_e4m3fn,24,0,11.6817,a8w8_bpreshuffle_128x16x32x512_16x16_16x16_32x4x1_32x4x1_1x16x1x8_4x4x1_1x1_intrawave_v2,179.52,497.9,0.0
256,256,1280,8192,torch.float8_e4m3fn,12,0,17.1516,a8w8_bpreshuffle_256x32x64x512_16x16_16x16_32x8x1_32x8x1_1x32x1x8_8x8x1_1x2_intrawave_v1,313.02,771.84,0.0
256,256,2304,16384,torch.float8_e4m3fn,15,0,52.6426,a8w8_bpreshuffle_256x16x64x256_16x16_16x16_16x16x1_16x16x1_1x16x1x16_4x4x1_1x1_intrawave_v1,367.14,819.16,0.0
256,256,2560,8192,torch.float8_e4m3fn,114,0,21.4545,a8w8_bpreshuffle_256x64x64x256_16x16_16x16_16x16x1_16x16x1_1x32x1x8_8x8x1_2x1_intrawave_v3,500.47,1136.33,0.0
256,256,4608,16384,torch.float8_e4m3fn,116,0,68.5478,a8w8_bpreshuffle_256x96x64x256_16x16_16x16_16x16x1_16x16x1_1x32x1x8_8x8x1_2x1_intrawave_v3,563.91,1196.99,0.0
256,256,5120,640,torch.float8_e4m3fn,76,0,7.7921,a8w8_bpreshuffle_256x32x64x128_16x16_16x16_8x32x1_8x32x1_1x32x1x8_8x8x1_2x1_intrawave_v1,215.31,777.98,0.0
256,256,5120,1280,torch.float8_e4m3fn,119,0,10.1726,a8w8_bpreshuffle_256x32x128x256_16x16_16x16_16x16x1_16x16x1_1x16x1x16_8x8x1_1x2_intrawave_v1,329.85,934.15,0.0
256,256,5120,3200,torch.float8_e4m3fn,77,0,19.1458,a8w8_bpreshuffle_256x64x64x128_16x16_16x16_8x32x1_8x32x1_1x32x1x8_8x8x1_2x1_intrawave_v3,438.14,1035.46,0.0
256,256,5120,5120,torch.float8_e4m3fn,116,0,25.9267,a8w8_bpreshuffle_256x96x64x256_16x16_16x16_16x16x1_16x16x1_1x32x1x8_8x8x1_2x1_intrawave_v3,517.68,1162.76,0.0
256,256,5120,6400,torch.float8_e4m3fn,65,0,28.085,a8w8_bpreshuffle_256x128x64x256_16x16_16x16_16x16x1_16x16x1_1x32x1x8_8x8x1_2x1_intrawave_v3,597.37,1318.42,0.0
256,256,5120,25600,torch.float8_e4m3fn,116,0,106.6527,a8w8_bpreshuffle_256x96x64x256_16x16_16x16_16x16x1_16x16x1_1x32x1x8_8x8x1_2x1_intrawave_v3,629.23,1314.99,0.0
256,256,6400,5120,torch.float8_e4m3fn,65,0,26.9347,a8w8_bpreshuffle_256x128x64x256_16x16_16x16_16x16x1_16x16x1_1x32x1x8_8x8x1_2x1_intrawave_v3,622.88,1386.89,0.0
256,256,7168,8192,torch.float8_e4m3fn,65,0,29.6374,a8w8_bpreshuffle_256x128x64x256_16x16_16x16_16x16x1_16x16x1_1x32x1x8_8x8x1_2x1_intrawave_v3,1014.42,2175.88,0.0
256,256,8192,1024,torch.float8_e4m3fn,77,0,9.7085,a8w8_bpreshuffle_256x64x64x128_16x16_16x16_8x32x1_8x32x1_1x32x1x8_8x8x1_2x1_intrawave_v3,442.39,1323.07,0.0
256,256,8192,2048,torch.float8_e4m3fn,114,0,11.9681,a8w8_bpreshuffle_256x64x64x256_16x16_16x16_16x16x1_16x16x1_1x32x1x8_8x8x1_2x1_intrawave_v3,717.74,1796.09,0.0
256,256,8192,3584,torch.float8_e4m3fn,144,0,16.6491,a8w8_bpreshuffle_256x128x64x256_16x16_16x16_16x16x1_16x16x1_1x32x1x8_8x8x1_2x1_intrawave_v3,902.89,2070.5,0.0
256,256,8192,7168,torch.float8_e4m3fn,65,0,28.6205,a8w8_bpreshuffle_256x128x64x256_16x16_16x16_16x16x1_16x16x1_1x32x1x8_8x8x1_2x1_intrawave_v3,1050.46,2262.35,0.0
256,256,8192,8192,torch.float8_e4m3fn,144,0,30.9086,a8w8_bpreshuffle_256x128x64x256_16x16_16x16_16x16x1_16x16x1_1x32x1x8_8x8x1_2x1_intrawave_v3,1111.66,2374.75,0.0
256,256,8192,28672,torch.float8_e4m3fn,65,0,95.3629,a8w8_bpreshuffle_256x128x64x256_16x16_16x16_16x16x1_16x16x1_1x32x1x8_8x8x1_2x1_intrawave_v3,1261.07,2583.98,0.0
256,256,9216,16384,torch.float8_e4m3fn,124,0,84.3085,a8w8_bpreshuffle_256x112x128x256_16x16_16x16_16x16x1_16x16x1_1x16x1x16_8x8x1_1x2_intrawave_v3,916.98,1896.7,0.0
256,256,10240,8192,torch.float8_e4m3fn,123,0,38.8017,a8w8_bpreshuffle_256x96x128x256_16x16_16x16_16x16x1_16x16x1_1x16x1x16_8x8x1_1x2_intrawave_v3,1106.9,2351.09,0.0
256,256,12800,5120,torch.float8_e4m3fn,139,0,34.8457,a8w8_bpreshuffle_256x128x128x256_16x16_16x16_16x16x1_16x16x1_1x16x1x16_8x8x1_1x2_intrawave_v3,962.94,2106.44,0.0
256,256,13312,16384,torch.float8_e4m3fn,139,0,92.6483,a8w8_bpreshuffle_256x128x128x256_16x16_16x16_16x16x1_16x16x1_1x16x1x16_8x8x1_1x2_intrawave_v3,1205.3,2472.94,0.0
256,256,14336,8192,torch.float8_e4m3fn,139,0,45.4901,a8w8_bpreshuffle_256x128x128x256_16x16_16x16_16x16x1_16x16x1_1x16x1x16_8x8x1_1x2_intrawave_v3,1321.82,2789.13,0.0
256,256,16384,2048,torch.float8_e4m3fn,139,0,18.9985,a8w8_bpreshuffle_256x128x128x256_16x16_16x16_16x16x1_16x16x1_1x16x1x16_8x8x1_1x2_intrawave_v3,904.28,2235.3,0.0
256,256,16384,4096,torch.float8_e4m3fn,63,0,32.6482,a8w8_bpreshuffle_256x128x128x256_16x16_16x16_16x16x1_16x16x1_1x32x1x8_8x8x1_2x1_intrawave_v3,1052.42,2344.57,0.0
256,256,16384,6656,torch.float8_e4m3fn,139,0,46.695,a8w8_bpreshuffle_256x128x128x256_16x16_16x16_16x16x1_16x16x1_1x16x1x16_8x8x1_1x2_intrawave_v3,1195.73,2551.55,0.0
256,256,16384,8192,torch.float8_e4m3fn,139,0,55.672,a8w8_bpreshuffle_256x128x128x256_16x16_16x16_16x16x1_16x16x1_1x16x1x16_8x8x1_1x2_intrawave_v3,1234.36,2599.21,0.0
256,256,16384,13312,torch.float8_e4m3fn,139,0,83.1524,a8w8_bpreshuffle_256x128x128x256_16x16_16x16_16x16x1_16x16x1_1x16x1x16_8x8x1_1x2_intrawave_v3,1342.95,2764.81,0.0
256,256,16384,26624,torch.float8_e4m3fn,139,0,163.3311,a8w8_bpreshuffle_256x128x128x256_16x16_16x16_16x16x1_16x16x1_1x16x1x16_8x8x1_1x2_intrawave_v3,1367.4,2763.78,0.0
256,256,26624,16384,torch.float8_e4m3fn,154,0,141.6113,a8w8_bpreshuffle_256x128x256x256_16x16_16x16_16x16x1_16x16x1_1x16x1x16_8x8x1_1x2_intrawave_v3,1577.12,3206.19,0.0
256,256,51200,5120,torch.float8_e4m3fn,154,0,97.921,a8w8_bpreshuffle_256x128x256x256_16x16_16x16_16x16x1_16x16x1_1x16x1x16_8x8x1_1x2_intrawave_v3,1370.67,2958.19,0.0
256,256,53248,16384,torch.float8_e4m3fn,154,0,276.3785,a8w8_bpreshuffle_256x128x256x256_16x16_16x16_16x16x1_16x16x1_1x16x1x16_8x8x1_1x2_intrawave_v3,1616.18,3270.42,0.0
256,256,57344,8192,torch.float8_e4m3fn,33,0,129.4795,a8w8_bpreshuffle_256x256x256x128_16x16_16x16_8x32x1_8x32x1_1x32x1x8_8x8x1_2x1_intrawave_v3,1857.58,3871.03,0.0
256,512,800,5120,torch.float8_e4m3fn,10,0,15.082,a8w8_bpreshuffle_128x16x32x512_16x16_16x16_32x4x1_32x4x1_1x16x1x8_4x4x1_1x1_intrawave_v1,278.1,499.71,0.0
256,512,1280,8192,torch.float8_e4m3fn,114,0,21.033,a8w8_bpreshuffle_256x64x64x256_16x16_16x16_16x16x1_16x16x1_1x32x1x8_8x8x1_2x1_intrawave_v3,510.5,760.27,0.0
256,512,2304,16384,torch.float8_e4m3fn,115,0,63.7872,a8w8_bpreshuffle_256x80x64x256_16x16_16x16_16x16x1_16x16x1_1x16x1x16_4x4x1_1x1_intrawave_v3,605.99,760.29,0.0
256,512,2560,8192,torch.float8_e4m3fn,113,0,27.2155,a8w8_bpreshuffle_256x48x64x256_16x16_16x16_16x16x1_16x16x1_1x16x1x16_4x4x1_1x1_intrawave_v1,789.07,1021.01,0.0
256,512,4608,16384,torch.float8_e4m3fn,124,0,84.5982,a8w8_bpreshuffle_256x112x128x256_16x16_16x16_16x16x1_16x16x1_1x16x1x16_8x8x1_1x2_intrawave_v3,913.84,1047.36,0.0
256,512,5120,640,torch.float8_e4m3fn,77,0,9.0563,a8w8_bpreshuffle_256x64x64x128_16x16_16x16_8x32x1_8x32x1_1x32x1x8_8x8x1_2x1_intrawave_v3,370.51,976.93,0.0
256,512,5120,1280,torch.float8_e4m3fn,77,0,12.8224,a8w8_bpreshuffle_256x64x64x128_16x16_16x16_8x32x1_8x32x1_1x32x1x8_8x8x1_2x1_intrawave_v3,523.37,971.1,0.0
256,512,5120,3200,torch.float8_e4m3fn,85,0,23.0489,a8w8_bpreshuffle_256x64x128x128_16x16_16x16_8x32x1_8x32x1_1x32x1x8_8x8x1_2x1_intrawave_v3,727.9,1009.39,0.0
256,512,5120,5120,torch.float8_e4m3fn,124,0,31.9895,a8w8_bpreshuffle_256x112x128x256_16x16_16x16_16x16x1_16x16x1_1x16x1x16_8x8x1_1x2_intrawave_v3,839.14,1065.31,0.0
256,512,5120,6400,torch.float8_e4m3fn,139,0,36.8067,a8w8_bpreshuffle_256x128x128x256_16x16_16x16_16x16x1_16x16x1_1x16x1x16_8x8x1_1x2_intrawave_v3,911.64,1121.74,0.0
256,512,5120,25600,torch.float8_e4m3fn,124,0,128.0705,a8w8_bpreshuffle_256x112x128x256_16x16_16x16_16x16x1_16x16x1_1x16x1x16_8x8x1_1x2_intrawave_v3,1048.0,1166.72,0.0
256,512,6400,5120,torch.float8_e4m3fn,124,0,33.3791,a8w8_bpreshuffle_256x112x128x256_16x16_16x16_16x16x1_16x16x1_1x16x1x16_8x8x1_1x2_intrawave_v3,1005.25,1256.57,0.0
256,512,7168,8192,torch.float8_e4m3fn,63,0,42.0669,a8w8_bpreshuffle_256x128x128x256_16x16_16x16_16x16x1_16x16x1_1x32x1x8_8x8x1_2x1_intrawave_v3,1429.38,1670.07,0.0
256,512,8192,1024,torch.float8_e4m3fn,85,0,11.5306,a8w8_bpreshuffle_256x64x128x128_16x16_16x16_8x32x1_8x32x1_1x32x1x8_8x8x1_2x1_intrawave_v3,744.97,1500.49,0.0
256,512,8192,2048,torch.float8_e4m3fn,139,0,15.6554,a8w8_bpreshuffle_256x128x128x256_16x16_16x16_16x16x1_16x16x1_1x16x1x16_8x8x1_1x2_intrawave_v3,1097.38,1674.46,0.0
256,512,8192,3584,torch.float8_e4m3fn,139,0,22.7592,a8w8_bpreshuffle_256x128x128x256_16x16_16x16_16x16x1_16x16x1_1x16x1x16_8x8x1_1x2_intrawave_v3,1320.99,1739.24,0.0
256,512,8192,7168,torch.float8_e4m3fn,139,0,39.3552,a8w8_bpreshuffle_256x128x128x256_16x16_16x16_16x16x1_16x16x1_1x16x1x16_8x8x1_1x2_intrawave_v3,1527.87,1798.46,0.0
256,512,8192,8192,torch.float8_e4m3fn,139,0,43.6902,a8w8_bpreshuffle_256x128x128x256_16x16_16x16_16x16x1_16x16x1_1x16x1x16_8x8x1_1x2_intrawave_v3,1572.88,1824.02,0.0
256,512,8192,28672,torch.float8_e4m3fn,139,0,133.9721,a8w8_bpreshuffle_256x128x128x256_16x16_16x16_16x16x1_16x16x1_1x16x1x16_8x8x1_1x2_intrawave_v3,1795.29,1925.4,0.0
256,512,9216,16384,torch.float8_e4m3fn,149,0,104.8693,a8w8_bpreshuffle_256x128x192x256_16x16_16x16_16x16x1_16x16x1_1x32x1x8_8x8x1_2x1_intrawave_v3,1474.4,1609.82,0.0
256,512,10240,8192,torch.float8_e4m3fn,143,0,55.4465,a8w8_bpreshuffle_256x192x128x128_16x16_16x16_8x32x1_8x32x1_1x16x1x16_8x8x1_1x2_intrawave_v3,1549.23,1777.68,0.0
256,512,12800,5120,torch.float8_e4m3fn,138,0,46.2157,a8w8_bpreshuffle_256x112x256x256_16x16_16x16_16x16x1_16x16x1_1x16x1x16_8x8x1_1x2_intrawave_v3,1452.08,1758.38,0.0
256,512,13312,16384,torch.float8_e4m3fn,154,0,127.8746,a8w8_bpreshuffle_256x128x256x256_16x16_16x16_16x16x1_16x16x1_1x16x1x16_8x8x1_1x2_intrawave_v3,1746.54,1877.81,0.0
256,512,14336,8192,torch.float8_e4m3fn,154,0,63.6195,a8w8_bpreshuffle_256x128x256x256_16x16_16x16_16x16x1_16x16x1_1x16x1x16_8x8x1_1x2_intrawave_v3,1890.29,2142.66,0.0
256,512,16384,2048,torch.float8_e4m3fn,154,0,27.0054,a8w8_bpreshuffle_256x128x256x256_16x16_16x16_16x16x1_16x16x1_1x16x1x16_8x8x1_1x2_intrawave_v3,1272.33,1902.59,0.0
256,512,16384,4096,torch.float8_e4m3fn,154,0,43.8782,a8w8_bpreshuffle_256x128x256x256_16x16_16x16_16x16x1_16x16x1_1x16x1x16_8x8x1_1x2_intrawave_v3,1566.14,1959.59,0.0
256,512,16384,6656,torch.float8_e4m3fn,154,0,64.427,a8w8_bpreshuffle_256x128x256x256_16x16_16x16_16x16x1_16x16x1_1x16x1x16_8x8x1_1x2_intrawave_v3,1733.27,2005.94,0.0
256,512,16384,8192,torch.float8_e4m3fn,154,0,73.6131,a8w8_bpreshuffle_256x128x256x256_16x16_16x16_16x16x1_16x16x1_1x16x1x16_8x8x1_1x2_intrawave_v3,1867.04,2108.17,0.0
256,512,16384,13312,torch.float8_e4m3fn,154,0,114.1614,a8w8_bpreshuffle_256x128x256x256_16x16_16x16_16x16x1_16x16x1_1x16x1x16_8x8x1_1x2_intrawave_v3,1956.34,2117.15,0.0
256,512,16384,26624,torch.float8_e4m3fn,154,0,214.713,a8w8_bpreshuffle_256x128x256x256_16x16_16x16_16x16x1_16x16x1_1x16x1x16_8x8x1_1x2_intrawave_v3,2080.34,2173.21,0.0
256,512,26624,16384,torch.float8_e4m3fn,154,0,250.2793,a8w8_bpreshuffle_256x128x256x256_16x16_16x16_16x16x1_16x16x1_1x16x1x16_8x8x1_1x2_intrawave_v3,1784.71,1885.33,0.0
256,512,51200,5120,torch.float8_e4m3fn,158,0,174.8476,a8w8_bpreshuffle_256x192x256x128_16x16_16x16_8x32x1_8x32x1_1x16x1x16_8x8x1_1x2_intrawave_v3,1535.25,1814.12,0.0
256,512,53248,16384,torch.float8_e4m3fn,154,0,492.8785,a8w8_bpreshuffle_256x128x256x256_16x16_16x16_16x16x1_16x16x1_1x16x1x16_8x8x1_1x2_intrawave_v3,1812.52,1897.69,0.0
256,512,57344,8192,torch.float8_e4m3fn,33,0,227.0683,a8w8_bpreshuffle_256x256x256x128_16x16_16x16_8x32x1_8x32x1_1x32x1x8_8x8x1_2x1_intrawave_v3,2118.47,2345.89,0.0
256,1024,800,5120,torch.float8_e4m3fn,24,0,24.558,a8w8_bpreshuffle_128x16x32x512_16x16_16x16_32x4x1_32x4x1_1x16x1x8_4x4x1_1x1_intrawave_v2,341.58,446.99,0.0
256,1024,1280,8192,torch.float8_e4m3fn,113,0,26.819,a8w8_bpreshuffle_256x48x64x256_16x16_16x16_16x16x1_16x16x1_1x16x1x16_4x4x1_1x1_intrawave_v1,800.73,801.51,0.0
256,1024,2304,16384,torch.float8_e4m3fn,124,0,81.3585,a8w8_bpreshuffle_256x112x128x256_16x16_16x16_16x16x1_16x16x1_1x16x1x16_8x8x1_1x2_intrawave_v3,950.23,728.19,0.0
256,1024,2560,8192,torch.float8_e4m3fn,123,0,37.4372,a8w8_bpreshuffle_256x96x128x256_16x16_16x16_16x16x1_16x16x1_1x16x1x16_8x8x1_1x2_intrawave_v3,1147.25,924.29,0.0
256,1024,4608,16384,torch.float8_e4m3fn,149,0,104.0599,a8w8_bpreshuffle_256x128x192x256_16x16_16x16_16x16x1_16x16x1_1x32x1x8_8x8x1_2x1_intrawave_v3,1485.86,977.44,0.0
256,1024,5120,640,torch.float8_e4m3fn,86,0,11.1521,a8w8_bpreshuffle_256x96x128x128_16x16_16x16_8x32x1_8x32x1_1x32x1x8_8x8x1_2x1_intrawave_v3,601.76,1292.84,0.0
256,1024,5120,1280,torch.float8_e4m3fn,86,0,16.1465,a8w8_bpreshuffle_256x96x128x128_16x16_16x16_8x32x1_8x32x1_1x32x1x8_8x8x1_2x1_intrawave_v3,831.25,1136.47,0.0
256,1024,5120,3200,torch.float8_e4m3fn,51,0,29.1651,a8w8_bpreshuffle_256x192x128x128_16x16_16x16_8x32x1_8x32x1_1x32x1x8_8x8x1_2x1_intrawave_v3,1150.5,1033.65,0.0
256,1024,5120,5120,torch.float8_e4m3fn,137,0,40.2614,a8w8_bpreshuffle_256x96x256x256_16x16_16x16_16x16x1_16x16x1_1x16x1x16_8x8x1_1x2_intrawave_v3,1333.46,1041.77,0.0
256,1024,5120,6400,torch.float8_e4m3fn,137,0,48.5222,a8w8_bpreshuffle_256x96x256x256_16x16_16x16_16x16x1_16x16x1_1x16x1x16_8x8x1_1x2_intrawave_v3,1383.05,1026.49,0.0
256,1024,5120,25600,torch.float8_e4m3fn,137,0,162.5939,a8w8_bpreshuffle_256x96x256x256_16x16_16x16_16x16x1_16x16x1_1x16x1x16_8x8x1_1x2_intrawave_v3,1650.96,1031.85,0.0
256,1024,6400,5120,torch.float8_e4m3fn,138,0,45.101,a8w8_bpreshuffle_256x112x256x256_16x16_16x16_16x16x1_16x16x1_1x16x1x16_8x8x1_1x2_intrawave_v3,1487.97,1133.41,0.0
256,1024,7168,8192,torch.float8_e4m3fn,154,0,62.2696,a8w8_bpreshuffle_256x128x256x256_16x16_16x16_16x16x1_16x16x1_1x16x1x16_8x8x1_1x2_intrawave_v3,1931.26,1313.46,0.0
256,1024,8192,1024,torch.float8_e4m3fn,0,0,16.8199,a8w8_bpreshuffle_256x128x128x128_16x16_16x16_8x32x1_8x32x1_1x32x1x8_8x8x1_2x1_intrawave_v3,1021.4,1558.53,0.0
256,1024,8192,2048,torch.float8_e4m3fn,154,0,23.1654,a8w8_bpreshuffle_256x128x256x256_16x16_16x16_16x16x1_16x16x1_1x16x1x16_8x8x1_1x2_intrawave_v3,1483.24,1539.0,0.0
256,1024,8192,3584,torch.float8_e4m3fn,154,0,34.8454,a8w8_bpreshuffle_256x128x256x256_16x16_16x16_16x16x1_16x16x1_1x16x1x16_8x8x1_1x2_intrawave_v3,1725.61,1429.38,0.0
256,1024,8192,7168,torch.float8_e4m3fn,154,0,59.0054,a8w8_bpreshuffle_256x128x256x256_16x16_16x16_16x16x1_16x16x1_1x16x1x16_8x8x1_1x2_intrawave_v3,2038.1,1403.9,0.0
256,1024,8192,8192,torch.float8_e4m3fn,154,0,64.2479,a8w8_bpreshuffle_256x128x256x256_16x16_16x16_16x16x1_16x16x1_1x16x1x16_8x8x1_1x2_intrawave_v3,2139.2,1436.23,0.0
256,1024,8192,28672,torch.float8_e4m3fn,154,0,197.2769,a8w8_bpreshuffle_256x128x256x256_16x16_16x16_16x16x1_16x16x1_1x16x1x16_8x8x1_1x2_intrawave_v3,2438.38,1424.49,0.0
256,1024,9216,16384,torch.float8_e4m3fn,54,0,178.1558,a8w8_bpreshuffle_256x160x256x128_16x16_16x16_8x32x1_8x32x1_1x32x1x8_8x8x1_2x1_intrawave_v3,1735.77,1047.66,0.0
256,1024,10240,8192,torch.float8_e4m3fn,158,0,83.5863,a8w8_bpreshuffle_256x192x256x128_16x16_16x16_8x32x1_8x32x1_1x16x1x16_8x8x1_1x2_intrawave_v3,2055.35,1354.84,0.0
256,1024,12800,5120,torch.float8_e4m3fn,138,0,86.9605,a8w8_bpreshuffle_256x112x256x256_16x16_16x16_16x16x1_16x16x1_1x16x1x16_8x8x1_1x2_intrawave_v3,1543.43,1115.37,0.0
256,1024,13312,16384,torch.float8_e4m3fn,154,0,243.5736,a8w8_bpreshuffle_256x128x256x256_16x16_16x16_16x16x1_16x16x1_1x16x1x16_8x8x1_1x2_intrawave_v3,1833.85,1076.24,0.0
256,1024,14336,8192,torch.float8_e4m3fn,33,0,112.839,a8w8_bpreshuffle_256x256x256x128_16x16_16x16_8x32x1_8x32x1_1x32x1x8_8x8x1_2x1_intrawave_v3,2131.52,1375.32,0.0
256,1024,16384,2048,torch.float8_e4m3fn,33,0,49.7279,a8w8_bpreshuffle_256x256x256x128_16x16_16x16_8x32x1_8x32x1_1x32x1x8_8x8x1_2x1_intrawave_v3,1381.91,1391.69,0.0
256,1024,16384,4096,torch.float8_e4m3fn,33,0,81.4525,a8w8_bpreshuffle_256x256x256x128_16x16_16x16_8x32x1_8x32x1_1x32x1x8_8x8x1_2x1_intrawave_v3,1687.35,1287.35,0.0
256,1024,16384,6656,torch.float8_e4m3fn,2,0,120.523,a8w8_bpreshuffle_256x256x256x128_16x16_16x16_8x32x1_8x32x1_1x32x1x8_8x8x1_1x2_intrawave_v3,1853.08,1239.78,0.0
256,1024,16384,8192,torch.float8_e4m3fn,154,0,136.0178,a8w8_bpreshuffle_256x128x256x256_16x16_16x16_16x16x1_16x16x1_1x16x1x16_8x8x1_1x2_intrawave_v3,2020.9,1295.13,0.0
256,1024,16384,13312,torch.float8_e4m3fn,154,0,214.8294,a8w8_bpreshuffle_256x128x256x256_16x16_16x16_16x16x1_16x16x1_1x16x1x16_8x8x1_1x2_intrawave_v3,2079.22,1234.89,0.0
256,1024,16384,26624,torch.float8_e4m3fn,154,0,412.5087,a8w8_bpreshuffle_256x128x256x256_16x16_16x16_16x16x1_16x16x1_1x16x1x16_8x8x1_1x2_intrawave_v3,2165.66,1204.88,0.0
256,1024,26624,16384,torch.float8_e4m3fn,33,0,467.1211,a8w8_bpreshuffle_256x256x256x128_16x16_16x16_8x32x1_8x32x1_1x32x1x8_8x8x1_2x1_intrawave_v3,1912.47,1086.47,0.0
256,1024,51200,5120,torch.float8_e4m3fn,40,0,288.5662,a8w8_bpreshuffle_256x224x256x128_16x16_16x16_8x32x1_8x32x1_1x32x1x8_8x8x1_2x1_intrawave_v3,1860.48,1289.98,0.0
256,1024,53248,16384,torch.float8_e4m3fn,154,0,850.624,a8w8_bpreshuffle_256x128x256x256_16x16_16x16_16x16x1_16x16x1_1x16x1x16_8x8x1_1x2_intrawave_v3,2100.47,1173.54,0.0
256,1024,57344,8192,torch.float8_e4m3fn,33,0,409.7151,a8w8_bpreshuffle_256x256x256x128_16x16_16x16_8x32x1_8x32x1_1x32x1x8_8x8x1_2x1_intrawave_v3,2348.15,1453.67,0.0
256,2048,800,5120,torch.float8_e4m3fn,24,0,41.7422,a8w8_bpreshuffle_128x16x32x512_16x16_16x16_32x4x1_32x4x1_1x16x1x8_4x4x1_1x1_intrawave_v2,401.92,427.83,0.0
256,2048,1280,8192,torch.float8_e4m3fn,123,0,36.7116,a8w8_bpreshuffle_256x96x128x256_16x16_16x16_16x16x1_16x16x1_1x16x1x16_8x8x1_1x2_intrawave_v3,1169.92,885.44,0.0
256,2048,2304,16384,torch.float8_e4m3fn,131,0,101.2648,a8w8_bpreshuffle_256x112x192x256_16x16_16x16_16x16x1_16x16x1_1x16x1x16_4x4x1_1x1_intrawave_v3,1526.88,797.32,0.0
256,2048,2560,8192,torch.float8_e4m3fn,138,0,55.1683,a8w8_bpreshuffle_256x112x256x256_16x16_16x16_16x16x1_16x16x1_1x16x1x16_8x8x1_1x2_intrawave_v3,1557.04,874.32,0.0
256,2048,4608,16384,torch.float8_e4m3fn,68,0,176.1003,a8w8_bpreshuffle_256x128x192x128_16x16_16x16_8x32x1_8x32x1_1x32x1x8_8x8x1_2x1_intrawave_v3,1756.03,726.44,0.0
256,2048,5120,640,torch.float8_e4m3fn,102,0,16.8369,a8w8_bpreshuffle_256x96x256x128_16x16_16x16_8x32x1_8x32x1_1x32x1x8_8x8x1_2x1_intrawave_v3,797.16,1518.04,0.0
256,2048,5120,1280,torch.float8_e4m3fn,102,0,24.8167,a8w8_bpreshuffle_256x96x256x128_16x16_16x16_8x32x1_8x32x1_1x32x1x8_8x8x1_2x1_intrawave_v3,1081.67,1214.77,0.0
256,2048,5120,3200,torch.float8_e4m3fn,158,0,41.6304,a8w8_bpreshuffle_256x192x256x128_16x16_16x16_8x32x1_8x32x1_1x16x1x16_8x8x1_1x2_intrawave_v3,1612.02,1054.74,0.0
256,2048,5120,5120,torch.float8_e4m3fn,102,0,71.8612,a8w8_bpreshuffle_256x96x256x128_16x16_16x16_8x32x1_8x32x1_1x32x1x8_8x8x1_2x1_intrawave_v3,1494.19,802.54,0.0
256,2048,5120,6400,torch.float8_e4m3fn,158,0,76.511,a8w8_bpreshuffle_256x192x256x128_16x16_16x16_8x32x1_8x32x1_1x16x1x16_8x8x1_1x2_intrawave_v3,1754.23,873.69,0.0
256,2048,5120,25600,torch.float8_e4m3fn,137,0,301.0835,a8w8_bpreshuffle_256x96x256x256_16x16_16x16_16x16x1_16x16x1_1x16x1x16_8x8x1_1x2_intrawave_v3,1783.13,679.12,0.0
256,2048,6400,5120,torch.float8_e4m3fn,138,0,84.6213,a8w8_bpreshuffle_256x112x256x256_16x16_16x16_16x16x1_16x16x1_1x16x1x16_8x8x1_1x2_intrawave_v3,1586.1,820.93,0.0
256,2048,7168,8192,torch.float8_e4m3fn,33,0,112.617,a8w8_bpreshuffle_256x256x256x128_16x16_16x16_8x32x1_8x32x1_1x32x1x8_8x8x1_2x1_intrawave_v3,2135.72,931.1,0.0
256,2048,8192,1024,torch.float8_e4m3fn,86,0,28.9708,a8w8_bpreshuffle_256x96x128x128_16x16_16x16_8x32x1_8x32x1_1x32x1x8_8x8x1_2x1_intrawave_v3,1186.01,1520.16,0.0
256,2048,8192,2048,torch.float8_e4m3fn,33,0,42.2356,a8w8_bpreshuffle_256x256x256x128_16x16_16x16_8x32x1_8x32x1_1x32x1x8_8x8x1_2x1_intrawave_v3,1627.05,1291.0,0.0
256,2048,8192,3584,torch.float8_e4m3fn,33,0,61.9146,a8w8_bpreshuffle_256x256x256x128_16x16_16x16_8x32x1_8x32x1_1x32x1x8_8x8x1_2x1_intrawave_v3,1942.34,1134.7,0.0
256,2048,8192,7168,torch.float8_e4m3fn,33,0,105.8446,a8w8_bpreshuffle_256x256x256x128_16x16_16x16_8x32x1_8x32x1_1x32x1x8_8x8x1_2x1_intrawave_v3,2272.37,1010.49,0.0
256,2048,8192,8192,torch.float8_e4m3fn,33,0,117.6729,a8w8_bpreshuffle_256x256x256x128_16x16_16x16_8x32x1_8x32x1_1x32x1x8_8x8x1_2x1_intrawave_v3,2335.95,998.03,0.0
256,2048,8192,28672,torch.float8_e4m3fn,33,0,357.8032,a8w8_bpreshuffle_256x256x256x128_16x16_16x16_8x32x1_8x32x1_1x32x1x8_8x8x1_2x1_intrawave_v3,2688.83,914.35,0.0
256,2048,9216,16384,torch.float8_e4m3fn,68,0,305.2233,a8w8_bpreshuffle_256x128x192x128_16x16_16x16_8x32x1_8x32x1_1x32x1x8_8x8x1_2x1_intrawave_v3,2026.3,728.31,0.0
256,2048,10240,8192,torch.float8_e4m3fn,158,0,156.1052,a8w8_bpreshuffle_256x192x256x128_16x16_16x16_8x32x1_8x32x1_1x16x1x16_8x8x1_1x2_intrawave_v3,2201.06,913.53,0.0
256,2048,12800,5120,torch.float8_e4m3fn,40,0,154.2962,a8w8_bpreshuffle_256x224x256x128_16x16_16x16_8x32x1_8x32x1_1x32x1x8_8x8x1_2x1_intrawave_v3,1739.74,832.49,0.0
256,2048,13312,16384,torch.float8_e4m3fn,138,0,457.646,a8w8_bpreshuffle_256x112x256x256_16x16_16x16_16x16x1_16x16x1_1x16x1x16_8x8x1_1x2_intrawave_v3,1952.06,669.04,0.0
256,2048,14336,8192,torch.float8_e4m3fn,54,0,205.0365,a8w8_bpreshuffle_256x160x256x128_16x16_16x16_8x32x1_8x32x1_1x32x1x8_8x8x1_2x1_intrawave_v3,2346.1,940.99,0.0
256,2048,16384,2048,torch.float8_e4m3fn,33,0,89.7238,a8w8_bpreshuffle_256x256x256x128_16x16_16x16_8x32x1_8x32x1_1x32x1x8_8x8x1_2x1_intrawave_v3,1531.8,1168.67,0.0
256,2048,16384,4096,torch.float8_e4m3fn,33,0,146.1468,a8w8_bpreshuffle_256x256x256x128_16x16_16x16_8x32x1_8x32x1_1x32x1x8_8x8x1_2x1_intrawave_v3,1880.83,975.77,0.0
256,2048,16384,6656,torch.float8_e4m3fn,33,0,216.3109,a8w8_bpreshuffle_256x256x256x128_16x16_16x16_8x32x1_8x32x1_1x32x1x8_8x8x1_2x1_intrawave_v3,2064.97,877.4,0.0
256,2048,16384,8192,torch.float8_e4m3fn,33,0,253.8314,a8w8_bpreshuffle_256x256x256x128_16x16_16x16_8x32x1_8x32x1_1x32x1x8_8x8x1_2x1_intrawave_v3,2165.83,859.25,0.0
256,2048,16384,13312,torch.float8_e4m3fn,33,0,388.9416,a8w8_bpreshuffle_256x256x256x128_16x16_16x16_8x32x1_8x32x1_1x32x1x8_8x8x1_2x1_intrawave_v3,2296.88,803.4,0.0
256,2048,16384,26624,torch.float8_e4m3fn,154,0,777.8647,a8w8_bpreshuffle_256x128x256x256_16x16_16x16_16x16x1_16x16x1_1x16x1x16_8x8x1_1x2_intrawave_v3,2296.94,717.15,0.0
256,2048,26624,16384,torch.float8_e4m3fn,154,0,848.1746,a8w8_bpreshuffle_256x128x256x256_16x16_16x16_16x16x1_16x16x1_1x16x1x16_8x8x1_1x2_intrawave_v3,2106.53,682.42,0.0
256,2048,51200,5120,torch.float8_e4m3fn,33,0,524.9075,a8w8_bpreshuffle_256x256x256x128_16x16_16x16_8x32x1_8x32x1_1x32x1x8_8x8x1_2x1_intrawave_v3,2045.58,918.91,0.0
256,2048,53248,16384,torch.float8_e4m3fn,33,0,1541.2203,a8w8_bpreshuffle_256x256x256x128_16x16_16x16_8x32x1_8x32x1_1x32x1x8_8x8x1_2x1_intrawave_v3,2318.56,729.34,0.0
256,2048,57344,8192,torch.float8_e4m3fn,33,0,762.0358,a8w8_bpreshuffle_256x256x256x128_16x16_16x16_8x32x1_8x32x1_1x32x1x8_8x8x1_2x1_intrawave_v3,2525.01,946.7,0.0
256,4096,800,5120,torch.float8_e4m3fn,69,0,50.1312,a8w8_bpreshuffle_256x128x160x128_16x16_16x16_8x32x1_8x32x1_1x64x1x4_8x8x1_2x1_intrawave_v3,669.33,630.77,0.0
256,4096,1280,8192,torch.float8_e4m3fn,137,0,53.9659,a8w8_bpreshuffle_256x96x256x256_16x16_16x16_16x16x1_16x16x1_1x16x1x16_8x8x1_1x2_intrawave_v3,1591.73,1010.38,0.0
256,4096,2304,16384,torch.float8_e4m3fn,68,0,177.9892,a8w8_bpreshuffle_256x128x192x128_16x16_16x16_8x32x1_8x32x1_1x32x1x8_8x8x1_2x1_intrawave_v3,1737.4,695.17,0.0
256,4096,2560,8192,torch.float8_e4m3fn,158,0,83.4719,a8w8_bpreshuffle_256x192x256x128_16x16_16x16_8x32x1_8x32x1_1x16x1x16_8x8x1_1x2_intrawave_v3,2058.16,904.47,0.0
256,4096,4608,16384,torch.float8_e4m3fn,68,0,307.0339,a8w8_bpreshuffle_256x128x192x128_16x16_16x16_8x32x1_8x32x1_1x32x1x8_8x8x1_2x1_intrawave_v3,2014.36,587.41,0.0
256,4096,5120,640,torch.float8_e4m3fn,102,0,28.9248,a8w8_bpreshuffle_256x96x256x128_16x16_16x16_8x32x1_8x32x1_1x32x1x8_8x8x1_2x1_intrawave_v3,928.05,1653.99,0.0
256,4096,5120,1280,torch.float8_e4m3fn,102,0,42.5949,a8w8_bpreshuffle_256x96x256x128_16x16_16x16_8x32x1_8x32x1_1x32x1x8_8x8x1_2x1_intrawave_v3,1260.41,1261.64,0.0
256,4096,5120,3200,torch.float8_e4m3fn,47,0,80.2905,a8w8_bpreshuffle_256x192x256x128_16x16_16x16_8x32x1_8x32x1_1x32x1x8_8x8x1_2x1_intrawave_v3,1671.65,889.7,0.0
256,4096,5120,5120,torch.float8_e4m3fn,138,0,121.2408,a8w8_bpreshuffle_256x112x256x256_16x16_16x16_16x16x1_16x16x1_1x16x1x16_8x8x1_1x2_intrawave_v3,1771.25,735.14,0.0
256,4096,5120,6400,torch.float8_e4m3fn,158,0,135.91,a8w8_bpreshuffle_256x192x256x128_16x16_16x16_8x32x1_8x32x1_1x16x1x16_8x8x1_1x2_intrawave_v3,1975.1,742.59,0.0
256,4096,5120,25600,torch.float8_e4m3fn,138,0,505.012,a8w8_bpreshuffle_256x112x256x256_16x16_16x16_16x16x1_16x16x1_1x16x1x16_8x8x1_1x2_intrawave_v3,2126.17,550.23,0.0
256,4096,6400,5120,torch.float8_e4m3fn,40,0,148.8986,a8w8_bpreshuffle_256x224x256x128_16x16_16x16_8x32x1_8x32x1_1x32x1x8_8x8x1_2x1_intrawave_v3,1802.81,713.02,0.0
256,4096,7168,8192,torch.float8_e4m3fn,156,0,206.7372,a8w8_bpreshuffle_256x160x256x128_16x16_16x16_8x32x1_8x32x1_1x16x1x16_8x8x1_1x2_intrawave_v3,2326.8,730.37,0.0
256,4096,8192,1024,torch.float8_e4m3fn,86,0,49.3525,a8w8_bpreshuffle_256x96x128x128_16x16_16x16_8x32x1_8x32x1_1x32x1x8_8x8x1_2x1_intrawave_v3,1392.42,1614.75,0.0
256,4096,8192,2048,torch.float8_e4m3fn,143,0,80.1603,a8w8_bpreshuffle_256x192x128x128_16x16_16x16_8x32x1_8x32x1_1x16x1x16_8x8x1_1x2_intrawave_v3,1714.55,1151.13,0.0
256,4096,8192,3584,torch.float8_e4m3fn,33,0,117.1442,a8w8_bpreshuffle_256x256x256x128_16x16_16x16_8x32x1_8x32x1_1x32x1x8_8x8x1_2x1_intrawave_v3,2053.18,948.82,0.0
256,4096,8192,7168,torch.float8_e4m3fn,33,0,196.6543,a8w8_bpreshuffle_256x256x256x128_16x16_16x16_8x32x1_8x32x1_1x32x1x8_8x8x1_2x1_intrawave_v3,2446.1,789.15,0.0
256,4096,8192,8192,torch.float8_e4m3fn,33,0,221.6286,a8w8_bpreshuffle_256x256x256x128_16x16_16x16_8x32x1_8x32x1_1x32x1x8_8x8x1_2x1_intrawave_v3,2480.53,757.0,0.0
256,4096,8192,28672,torch.float8_e4m3fn,33,0,686.9896,a8w8_bpreshuffle_256x256x256x128_16x16_16x16_8x32x1_8x32x1_1x32x1x8_8x8x1_2x1_intrawave_v3,2800.84,610.53,0.0
256,4096,9216,16384,torch.float8_e4m3fn,95,0,554.8485,a8w8_bpreshuffle_256x128x192x128_16x16_16x16_8x32x1_8x32x1_1x16x1x16_4x4x1_1x1_intrawave_v3,2229.35,529.16,0.0
256,4096,10240,8192,torch.float8_e4m3fn,106,0,283.3828,a8w8_bpreshuffle_256x224x256x128_16x16_16x16_8x32x1_8x32x1_1x16x1x16_4x4x1_1x1_intrawave_v3,2424.97,710.44,0.0
256,4096,12800,5120,torch.float8_e4m3fn,40,0,270.4291,a8w8_bpreshuffle_256x224x256x128_16x16_16x16_8x32x1_8x32x1_1x32x1x8_8x8x1_2x1_intrawave_v3,1985.26,707.64,0.0
256,4096,13312,16384,torch.float8_e4m3fn,154,0,842.3709,a8w8_bpreshuffle_256x128x256x256_16x16_16x16_16x16x1_16x16x1_1x16x1x16_8x8x1_1x2_intrawave_v3,2121.04,468.04,0.0
256,4096,14336,8192,torch.float8_e4m3fn,158,0,387.5867,a8w8_bpreshuffle_256x192x256x128_16x16_16x16_8x32x1_8x32x1_1x16x1x16_8x8x1_1x2_intrawave_v3,2482.21,692.58,0.0
256,4096,16384,2048,torch.float8_e4m3fn,102,0,160.9167,a8w8_bpreshuffle_256x96x256x128_16x16_16x16_8x32x1_8x32x1_1x32x1x8_8x8x1_2x1_intrawave_v3,1708.2,1094.73,0.0
256,4096,16384,4096,torch.float8_e4m3fn,33,0,255.2978,a8w8_bpreshuffle_256x256x256x128_16x16_16x16_8x32x1_8x32x1_1x32x1x8_8x8x1_2x1_intrawave_v3,2153.39,854.31,0.0
256,4096,16384,6656,torch.float8_e4m3fn,33,0,407.5508,a8w8_bpreshuffle_256x256x256x128_16x16_16x16_8x32x1_8x32x1_1x32x1x8_8x8x1_2x1_intrawave_v3,2192.0,663.8,0.0
256,4096,16384,8192,torch.float8_e4m3fn,33,0,471.5371,a8w8_bpreshuffle_256x256x256x128_16x16_16x16_8x32x1_8x32x1_1x32x1x8_8x8x1_2x1_intrawave_v3,2331.76,640.44,0.0
256,4096,16384,13312,torch.float8_e4m3fn,33,0,740.5043,a8w8_bpreshuffle_256x256x256x128_16x16_16x16_8x32x1_8x32x1_1x32x1x8_8x8x1_2x1_intrawave_v3,2412.82,549.42,0.0
256,4096,16384,26624,torch.float8_e4m3fn,33,0,1511.0293,a8w8_bpreshuffle_256x256x256x128_16x16_16x16_8x32x1_8x32x1_1x32x1x8_8x8x1_2x1_intrawave_v3,2364.89,449.68,0.0
256,4096,26624,16384,torch.float8_e4m3fn,33,0,1553.947,a8w8_bpreshuffle_256x256x256x128_16x16_16x16_8x32x1_8x32x1_1x32x1x8_8x8x1_2x1_intrawave_v3,2299.57,464.25,0.0
256,4096,51200,5120,torch.float8_e4m3fn,33,0,979.1344,a8w8_bpreshuffle_256x256x256x128_16x16_16x16_8x32x1_8x32x1_1x32x1x8_8x8x1_2x1_intrawave_v3,2193.25,717.52,0.0
256,4096,53248,16384,torch.float8_e4m3fn,33,0,2910.6751,a8w8_bpreshuffle_256x256x256x128_16x16_16x16_8x32x1_8x32x1_1x32x1x8_8x8x1_2x1_intrawave_v3,2455.38,472.65,0.0
256,4096,57344,8192,torch.float8_e4m3fn,33,0,1497.7395,a8w8_bpreshuffle_256x256x256x128_16x16_16x16_8x32x1_8x32x1_1x32x1x8_8x8x1_2x1_intrawave_v3,2569.4,649.7,0.0
256,8192,800,5120,torch.float8_e4m3fn,69,0,67.6989,a8w8_bpreshuffle_256x128x160x128_16x16_16x16_8x32x1_8x32x1_1x64x1x4_8x8x1_2x1_intrawave_v3,991.28,873.67,0.0
256,8192,1280,8192,torch.float8_e4m3fn,158,0,83.0796,a8w8_bpreshuffle_256x192x256x128_16x16_16x16_8x32x1_8x32x1_1x16x1x16_8x8x1_1x2_intrawave_v3,2067.88,1186.41,0.0
256,8192,2304,16384,torch.float8_e4m3fn,149,0,311.0895,a8w8_bpreshuffle_256x128x192x256_16x16_16x16_16x16x1_16x16x1_1x32x1x8_8x8x1_2x1_intrawave_v3,1988.09,674.13,0.0
256,8192,2560,8192,torch.float8_e4m3fn,158,0,155.4584,a8w8_bpreshuffle_256x192x256x128_16x16_16x16_8x32x1_8x32x1_1x16x1x16_8x8x1_1x2_intrawave_v3,2210.22,836.39,0.0
256,8192,4608,16384,torch.float8_e4m3fn,154,0,561.2735,a8w8_bpreshuffle_256x128x256x256_16x16_16x16_16x16x1_16x16x1_1x16x1x16_8x8x1_1x2_intrawave_v3,2203.83,508.15,0.0
256,8192,5120,640,torch.float8_e4m3fn,143,0,50.4892,a8w8_bpreshuffle_256x192x128x128_16x16_16x16_8x32x1_8x32x1_1x16x1x16_8x8x1_1x2_intrawave_v3,1063.34,1830.21,0.0
256,8192,5120,1280,torch.float8_e4m3fn,143,0,77.0321,a8w8_bpreshuffle_256x192x128x128_16x16_16x16_8x32x1_8x32x1_1x16x1x16_8x8x1_1x2_intrawave_v3,1393.89,1310.17,0.0
256,8192,5120,3200,torch.float8_e4m3fn,40,0,139.3777,a8w8_bpreshuffle_256x224x256x128_16x16_16x16_8x32x1_8x32x1_1x32x1x8_8x8x1_2x1_intrawave_v3,1925.96,907.49,0.0
256,8192,5120,5120,torch.float8_e4m3fn,154,0,215.948,a8w8_bpreshuffle_256x128x256x256_16x16_16x16_16x16x1_16x16x1_1x16x1x16_8x8x1_1x2_intrawave_v3,1988.89,704.07,0.0
256,8192,5120,6400,torch.float8_e4m3fn,40,0,242.9206,a8w8_bpreshuffle_256x224x256x128_16x16_16x16_8x32x1_8x32x1_1x32x1x8_8x8x1_2x1_intrawave_v3,2210.07,696.04,0.0
256,8192,5120,25600,torch.float8_e4m3fn,154,0,938.5635,a8w8_bpreshuffle_256x128x256x256_16x16_16x16_16x16x1_16x16x1_1x16x1x16_8x8x1_1x2_intrawave_v3,2288.05,452.47,0.0
256,8192,6400,5120,torch.float8_e4m3fn,40,0,270.3545,a8w8_bpreshuffle_256x224x256x128_16x16_16x16_8x32x1_8x32x1_1x32x1x8_8x8x1_2x1_intrawave_v3,1985.8,664.2,0.0
256,8192,7168,8192,torch.float8_e4m3fn,158,0,385.4824,a8w8_bpreshuffle_256x192x256x128_16x16_16x16_8x32x1_8x32x1_1x16x1x16_8x8x1_1x2_intrawave_v3,2495.76,631.08,0.0
256,8192,8192,1024,torch.float8_e4m3fn,51,0,92.436,a8w8_bpreshuffle_256x192x128x128_16x16_16x16_8x32x1_8x32x1_1x32x1x8_8x8x1_2x1_intrawave_v3,1486.86,1633.51,0.0
256,8192,8192,2048,torch.float8_e4m3fn,51,0,141.6683,a8w8_bpreshuffle_256x192x128x128_16x16_16x16_8x32x1_8x32x1_1x32x1x8_8x8x1_2x1_intrawave_v3,1940.29,1184.26,0.0
256,8192,8192,3584,torch.float8_e4m3fn,143,0,222.4514,a8w8_bpreshuffle_256x192x128x128_16x16_16x16_8x32x1_8x32x1_1x16x1x16_8x8x1_1x2_intrawave_v3,2162.43,867.33,0.0
256,8192,8192,7168,torch.float8_e4m3fn,33,0,383.1227,a8w8_bpreshuffle_256x256x256x128_16x16_16x16_8x32x1_8x32x1_1x32x1x8_8x8x1_2x1_intrawave_v3,2511.13,656.86,0.0
256,8192,8192,8192,torch.float8_e4m3fn,33,0,424.8317,a8w8_bpreshuffle_256x256x256x128_16x16_16x16_8x32x1_8x32x1_1x32x1x8_8x8x1_2x1_intrawave_v3,2588.11,631.86,0.0
256,8192,8192,28672,torch.float8_e4m3fn,33,0,1389.0293,a8w8_bpreshuffle_256x256x256x128_16x16_16x16_8x32x1_8x32x1_1x32x1x8_8x8x1_2x1_intrawave_v3,2770.49,434.82,0.0
256,8192,9216,16384,torch.float8_e4m3fn,154,0,1095.3193,a8w8_bpreshuffle_256x128x256x256_16x16_16x16_16x16x1_16x16x1_1x16x1x16_8x8x1_1x2_intrawave_v3,2258.61,398.25,0.0
256,8192,10240,8192,torch.float8_e4m3fn,33,0,533.4106,a8w8_bpreshuffle_256x256x256x128_16x16_16x16_8x32x1_8x32x1_1x32x1x8_8x8x1_2x1_intrawave_v3,2576.61,597.6,0.0
256,8192,12800,5120,torch.float8_e4m3fn,158,0,519.2638,a8w8_bpreshuffle_256x192x256x128_16x16_16x16_8x32x1_8x32x1_1x16x1x16_8x8x1_1x2_intrawave_v3,2067.82,610.85,0.0
256,8192,13312,16384,torch.float8_e4m3fn,33,0,1546.1027,a8w8_bpreshuffle_256x256x256x128_16x16_16x16_8x32x1_8x32x1_1x32x1x8_8x8x1_2x1_intrawave_v3,2311.24,368.94,0.0
256,8192,14336,8192,torch.float8_e4m3fn,33,0,734.9548,a8w8_bpreshuffle_256x256x256x128_16x16_16x16_8x32x1_8x32x1_1x32x1x8_8x8x1_2x1_intrawave_v3,2618.05,570.69,0.0
256,8192,16384,2048,torch.float8_e4m3fn,102,0,303.9224,a8w8_bpreshuffle_256x96x256x128_16x16_16x16_8x32x1_8x32x1_1x32x1x8_8x8x1_2x1_intrawave_v3,1808.87,1048.84,0.0
256,8192,16384,4096,torch.float8_e4m3fn,33,0,497.9337,a8w8_bpreshuffle_256x256x256x128_16x16_16x16_8x32x1_8x32x1_1x32x1x8_8x8x1_2x1_intrawave_v3,2208.15,741.26,0.0
256,8192,16384,6656,torch.float8_e4m3fn,33,0,770.3086,a8w8_bpreshuffle_256x256x256x128_16x16_16x16_8x32x1_8x32x1_1x32x1x8_8x8x1_2x1_intrawave_v3,2319.47,560.83,0.0
256,8192,16384,8192,torch.float8_e4m3fn,33,0,903.531,a8w8_bpreshuffle_256x256x256x128_16x16_16x16_8x32x1_8x32x1_1x32x1x8_8x8x1_2x1_intrawave_v3,2433.81,519.92,0.0
256,8192,16384,13312,torch.float8_e4m3fn,107,0,1430.2158,a8w8_bpreshuffle_256x256x256x128_16x16_16x16_8x32x1_8x32x1_1x16x1x16_4x4x1_1x1_intrawave_v3,2498.51,416.43,0.0
256,8192,16384,26624,torch.float8_e4m3fn,154,0,3033.7821,a8w8_bpreshuffle_256x128x256x256_16x16_16x16_16x16x1_16x16x1_1x16x1x16_8x8x1_1x2_intrawave_v3,2355.75,304.16,0.0
256,8192,26624,16384,torch.float8_e4m3fn,33,0,2904.3718,a8w8_bpreshuffle_256x256x256x128_16x16_16x16_8x32x1_8x32x1_1x32x1x8_8x8x1_2x1_intrawave_v3,2460.71,346.59,0.0
256,8192,51200,5120,torch.float8_e4m3fn,33,0,1857.9691,a8w8_bpreshuffle_256x256x256x128_16x16_16x16_8x32x1_8x32x1_1x32x1x8_8x8x1_2x1_intrawave_v3,2311.65,615.16,0.0
256,8192,53248,16384,torch.float8_e4m3fn,33,0,5722.4616,a8w8_bpreshuffle_256x256x256x128_16x16_16x16_8x32x1_8x32x1_1x32x1x8_8x8x1_2x1_intrawave_v3,2497.82,328.36,0.0
256,8192,57344,8192,torch.float8_e4m3fn,33,0,2991.7292,a8w8_bpreshuffle_256x256x256x128_16x16_16x16_8x32x1_8x32x1_1x32x1x8_8x8x1_2x1_intrawave_v3,2572.62,493.49,0.0
256,16384,800,5120,torch.float8_e4m3fn,69,0,108.6586,a8w8_bpreshuffle_256x128x160x128_16x16_16x16_8x32x1_8x32x1_1x64x1x4_8x8x1_2x1_intrawave_v3,1235.22,1050.97,0.0
256,16384,1280,8192,torch.float8_e4m3fn,158,0,157.7142,a8w8_bpreshuffle_256x192x256x128_16x16_16x16_8x32x1_8x32x1_1x16x1x16_8x8x1_1x2_intrawave_v3,2178.61,1183.45,0.0
256,16384,2304,16384,torch.float8_e4m3fn,154,0,577.0581,a8w8_bpreshuffle_256x128x256x256_16x16_16x16_16x16x1_16x16x1_1x16x1x16_8x8x1_1x2_intrawave_v3,2143.55,661.43,0.0
256,16384,2560,8192,torch.float8_e4m3fn,154,0,283.4813,a8w8_bpreshuffle_256x128x256x256_16x16_16x16_16x16x1_16x16x1_1x16x1x16_8x8x1_1x2_intrawave_v3,2424.13,843.35,0.0
256,16384,4608,16384,torch.float8_e4m3fn,154,0,1050.0065,a8w8_bpreshuffle_256x128x256x256_16x16_16x16_16x16x1_16x16x1_1x16x1x16_8x8x1_1x2_intrawave_v3,2356.08,471.36,0.0
256,16384,5120,640,torch.float8_e4m3fn,143,0,91.8209,a8w8_bpreshuffle_256x192x128x128_16x16_16x16_8x32x1_8x32x1_1x16x1x16_8x8x1_1x2_intrawave_v3,1169.39,1977.05,0.0
256,16384,5120,1280,torch.float8_e4m3fn,143,0,139.3615,a8w8_bpreshuffle_256x192x128x128_16x16_16x16_8x32x1_8x32x1_1x16x1x16_8x8x1_1x2_intrawave_v3,1540.94,1401.37,0.0
256,16384,5120,3200,torch.float8_e4m3fn,33,0,250.8978,a8w8_bpreshuffle_256x256x256x128_16x16_16x16_8x32x1_8x32x1_1x32x1x8_8x8x1_2x1_intrawave_v3,2139.8,942.95,0.0
256,16384,5120,5120,torch.float8_e4m3fn,33,0,403.9327,a8w8_bpreshuffle_256x256x256x128_16x16_16x16_8x32x1_8x32x1_1x32x1x8_8x8x1_2x1_intrawave_v3,2126.58,687.92,0.0
256,16384,5120,6400,torch.float8_e4m3fn,107,0,443.5168,a8w8_bpreshuffle_256x256x256x128_16x16_16x16_8x32x1_8x32x1_1x16x1x16_4x4x1_1x1_intrawave_v3,2420.97,688.58,0.0
256,16384,5120,25600,torch.float8_e4m3fn,154,0,1817.1823,a8w8_bpreshuffle_256x128x256x256_16x16_16x16_16x16x1_16x16x1_1x16x1x16_8x8x1_1x2_intrawave_v3,2363.53,395.27,0.0
256,16384,6400,5120,torch.float8_e4m3fn,154,0,516.4428,a8w8_bpreshuffle_256x128x256x256_16x16_16x16_16x16x1_16x16x1_1x16x1x16_8x8x1_1x2_intrawave_v3,2079.11,631.96,0.0
256,16384,7168,8192,torch.float8_e4m3fn,154,0,761.2665,a8w8_bpreshuffle_256x128x256x256_16x16_16x16_16x16x1_16x16x1_1x16x1x16_8x8x1_1x2_intrawave_v3,2527.56,561.98,0.0
256,16384,8192,1024,torch.float8_e4m3fn,143,0,172.4777,a8w8_bpreshuffle_256x192x128x128_16x16_16x16_8x32x1_8x32x1_1x16x1x16_8x8x1_1x2_intrawave_v3,1593.7,1702.26,0.0
256,16384,8192,2048,torch.float8_e4m3fn,51,0,272.4657,a8w8_bpreshuffle_256x192x128x128_16x16_16x16_8x32x1_8x32x1_1x32x1x8_8x8x1_2x1_intrawave_v3,2017.71,1169.93,0.0
256,16384,8192,3584,torch.float8_e4m3fn,33,0,421.1579,a8w8_bpreshuffle_256x256x256x128_16x16_16x16_8x32x1_8x32x1_1x32x1x8_8x8x1_2x1_intrawave_v3,2284.35,846.51,0.0
256,16384,8192,7168,torch.float8_e4m3fn,158,0,753.6754,a8w8_bpreshuffle_256x192x256x128_16x16_16x16_8x32x1_8x32x1_1x16x1x16_8x8x1_1x2_intrawave_v3,2553.02,589.9,0.0
256,16384,8192,8192,torch.float8_e4m3fn,158,0,852.0249,a8w8_bpreshuffle_256x192x256x128_16x16_16x16_8x32x1_8x32x1_1x16x1x16_8x8x1_1x2_intrawave_v3,2580.94,551.35,0.0
256,16384,8192,28672,torch.float8_e4m3fn,33,0,2785.3542,a8w8_bpreshuffle_256x256x256x128_16x16_16x16_8x32x1_8x32x1_1x32x1x8_8x8x1_2x1_intrawave_v3,2763.23,349.36,0.0
256,16384,9216,16384,torch.float8_e4m3fn,33,0,2047.2744,a8w8_bpreshuffle_256x256x256x128_16x16_16x16_8x32x1_8x32x1_1x32x1x8_8x8x1_2x1_intrawave_v3,2416.78,352.38,0.0
256,16384,10240,8192,torch.float8_e4m3fn,33,0,1068.7185,a8w8_bpreshuffle_256x256x256x128_16x16_16x16_8x32x1_8x32x1_1x32x1x8_8x8x1_2x1_intrawave_v3,2572.03,518.05,0.0
256,16384,12800,5120,torch.float8_e4m3fn,33,0,974.5645,a8w8_bpreshuffle_256x256x256x128_16x16_16x16_8x32x1_8x32x1_1x32x1x8_8x8x1_2x1_intrawave_v3,2203.53,583.7,0.0
256,16384,13312,16384,torch.float8_e4m3fn,33,0,2958.4415,a8w8_bpreshuffle_256x256x256x128_16x16_16x16_8x32x1_8x32x1_1x32x1x8_8x8x1_2x1_intrawave_v3,2415.74,311.9,0.0
256,16384,14336,8192,torch.float8_e4m3fn,158,0,1477.5648,a8w8_bpreshuffle_256x192x256x128_16x16_16x16_8x32x1_8x32x1_1x16x1x16_8x8x1_1x2_intrawave_v3,2604.48,488.25,0.0
256,16384,16384,2048,torch.float8_e4m3fn,102,0,598.3663,a8w8_bpreshuffle_256x96x256x128_16x16_16x16_8x32x1_8x32x1_1x32x1x8_8x8x1_2x1_intrawave_v3,1837.52,1009.38,0.0
256,16384,16384,4096,torch.float8_e4m3fn,33,0,988.8674,a8w8_bpreshuffle_256x256x256x128_16x16_16x16_8x32x1_8x32x1_1x32x1x8_8x8x1_2x1_intrawave_v3,2223.78,678.64,0.0
256,16384,16384,6656,torch.float8_e4m3fn,33,0,1537.3785,a8w8_bpreshuffle_256x256x256x128_16x16_16x16_8x32x1_8x32x1_1x32x1x8_8x8x1_2x1_intrawave_v3,2324.35,491.08,0.0
256,16384,16384,8192,torch.float8_e4m3fn,33,0,1794.5054,a8w8_bpreshuffle_256x256x256x128_16x16_16x16_8x32x1_8x32x1_1x32x1x8_8x8x1_2x1_intrawave_v3,2450.84,448.76,0.0
256,16384,16384,13312,torch.float8_e4m3fn,33,0,2976.2278,a8w8_bpreshuffle_256x256x256x128_16x16_16x16_8x32x1_8x32x1_1x32x1x8_8x8x1_2x1_intrawave_v3,2401.3,326.95,0.0
256,16384,16384,26624,torch.float8_e4m3fn,154,0,6167.0855,a8w8_bpreshuffle_256x128x256x256_16x16_16x16_16x16x1_16x16x1_1x16x1x16_8x8x1_1x2_intrawave_v3,2317.73,228.52,0.0
256,16384,26624,16384,torch.float8_e4m3fn,33,0,5797.7818,a8w8_bpreshuffle_256x256x256x128_16x16_16x16_8x32x1_8x32x1_1x32x1x8_8x8x1_2x1_intrawave_v3,2465.37,272.01,0.0
256,16384,51200,5120,torch.float8_e4m3fn,33,0,3711.513,a8w8_bpreshuffle_256x256x256x128_16x16_16x16_8x32x1_8x32x1_1x32x1x8_8x8x1_2x1_intrawave_v3,2314.4,545.26,0.0
256,16384,53248,16384,torch.float8_e4m3fn,33,0,11284.2706,a8w8_bpreshuffle_256x256x256x128_16x16_16x16_8x32x1_8x32x1_1x32x1x8_8x8x1_2x1_intrawave_v3,2533.38,255.73,0.0
256,16384,57344,8192,torch.float8_e4m3fn,33,0,5984.2692,a8w8_bpreshuffle_256x256x256x128_16x16_16x16_8x32x1_8x32x1_1x32x1x8_8x8x1_2x1_intrawave_v3,2572.27,414.93,0.0
256,32768,800,5120,torch.float8_e4m3fn,69,0,196.771,a8w8_bpreshuffle_256x128x160x128_16x16_16x16_8x32x1_8x32x1_1x64x1x4_8x8x1_2x1_intrawave_v3,1364.2,1139.89,0.0
256,32768,1280,8192,torch.float8_e4m3fn,154,0,288.2725,a8w8_bpreshuffle_256x128x256x256_16x16_16x16_16x16x1_16x16x1_1x16x1x16_8x8x1_1x2_intrawave_v3,2383.84,1258.56,0.0
256,32768,2304,16384,torch.float8_e4m3fn,154,0,1073.694,a8w8_bpreshuffle_256x128x256x256_16x16_16x16_16x16x1_16x16x1_1x16x1x16_8x8x1_1x2_intrawave_v3,2304.1,675.81,0.0
256,32768,2560,8192,torch.float8_e4m3fn,158,0,549.7961,a8w8_bpreshuffle_256x192x256x128_16x16_16x16_8x32x1_8x32x1_1x16x1x16_8x8x1_1x2_intrawave_v3,2499.82,831.54,0.0
256,32768,4608,16384,torch.float8_e4m3fn,154,0,2120.2853,a8w8_bpreshuffle_256x128x256x256_16x16_16x16_16x16x1_16x16x1_1x16x1x16_8x8x1_1x2_intrawave_v3,2333.55,431.24,0.0
256,32768,5120,640,torch.float8_e4m3fn,143,0,181.1291,a8w8_bpreshuffle_256x192x128x128_16x16_16x16_8x32x1_8x32x1_1x16x1x16_8x8x1_1x2_intrawave_v3,1185.61,1986.39,0.0
256,32768,5120,1280,torch.float8_e4m3fn,102,0,269.995,a8w8_bpreshuffle_256x96x256x128_16x16_16x16_8x32x1_8x32x1_1x32x1x8_8x8x1_2x1_intrawave_v3,1590.76,1422.4,0.0
256,32768,5120,3200,torch.float8_e4m3fn,33,0,492.1153,a8w8_bpreshuffle_256x256x256x128_16x16_16x16_8x32x1_8x32x1_1x32x1x8_8x8x1_2x1_intrawave_v3,2181.89,928.21,0.0
256,32768,5120,5120,torch.float8_e4m3fn,33,0,764.8154,a8w8_bpreshuffle_256x256x256x128_16x16_16x16_8x32x1_8x32x1_1x32x1x8_8x8x1_2x1_intrawave_v3,2246.28,692.36,0.0
256,32768,5120,6400,torch.float8_e4m3fn,33,0,868.9521,a8w8_bpreshuffle_256x256x256x128_16x16_16x16_8x32x1_8x32x1_1x32x1x8_8x8x1_2x1_intrawave_v3,2471.35,665.2,0.0
256,32768,5120,25600,torch.float8_e4m3fn,154,0,3714.3301,a8w8_bpreshuffle_256x128x256x256_16x16_16x16_16x16x1_16x16x1_1x16x1x16_8x8x1_1x2_intrawave_v3,2312.65,351.47,0.0
256,32768,6400,5120,torch.float8_e4m3fn,33,0,980.8335,a8w8_bpreshuffle_256x256x256x128_16x16_16x16_8x32x1_8x32x1_1x32x1x8_8x8x1_2x1_intrawave_v3,2189.45,632.09,0.0
256,32768,7168,8192,torch.float8_e4m3fn,158,0,1484.7467,a8w8_bpreshuffle_256x192x256x128_16x16_16x16_8x32x1_8x32x1_1x16x1x16_8x8x1_1x2_intrawave_v3,2591.88,536.74,0.0
256,32768,8192,1024,torch.float8_e4m3fn,143,0,340.0384,a8w8_bpreshuffle_256x192x128x128_16x16_16x16_8x32x1_8x32x1_1x16x1x16_8x8x1_1x2_intrawave_v3,1616.75,1702.2,0.0
256,32768,8192,2048,torch.float8_e4m3fn,143,0,536.6149,a8w8_bpreshuffle_256x192x128x128_16x16_16x16_8x32x1_8x32x1_1x16x1x16_8x8x1_1x2_intrawave_v3,2048.98,1156.8,0.0
256,32768,8192,3584,torch.float8_e4m3fn,51,0,841.2106,a8w8_bpreshuffle_256x192x128x128_16x16_16x16_8x32x1_8x32x1_1x32x1x8_8x8x1_2x1_intrawave_v3,2287.35,812.72,0.0
256,32768,8192,7168,torch.float8_e4m3fn,158,0,1500.7026,a8w8_bpreshuffle_256x192x256x128_16x16_16x16_8x32x1_8x32x1_1x16x1x16_8x8x1_1x2_intrawave_v3,2564.33,553.39,0.0
256,32768,8192,8192,torch.float8_e4m3fn,158,0,1696.016,a8w8_bpreshuffle_256x192x256x128_16x16_16x16_8x32x1_8x32x1_1x16x1x16_8x8x1_1x2_intrawave_v3,2593.16,514.39,0.0
256,32768,8192,28672,torch.float8_e4m3fn,33,0,5558.3544,a8w8_bpreshuffle_256x256x256x128_16x16_16x16_8x32x1_8x32x1_1x32x1x8_8x8x1_2x1_intrawave_v3,2769.37,307.87,0.0
256,32768,9216,16384,torch.float8_e4m3fn,33,0,4103.0357,a8w8_bpreshuffle_256x256x256x128_16x16_16x16_8x32x1_8x32x1_1x32x1x8_8x8x1_2x1_intrawave_v3,2411.78,314.85,0.0
256,32768,10240,8192,torch.float8_e4m3fn,158,0,2102.9024,a8w8_bpreshuffle_256x192x256x128_16x16_16x16_8x32x1_8x32x1_1x16x1x16_8x8x1_1x2_intrawave_v3,2614.27,486.67,0.0
256,32768,12800,5120,torch.float8_e4m3fn,33,0,1888.3681,a8w8_bpreshuffle_256x256x256x128_16x16_16x16_8x32x1_8x32x1_1x32x1x8_8x8x1_2x1_intrawave_v3,2274.43,567.78,0.0
256,32768,13312,16384,torch.float8_e4m3fn,33,0,6036.8682,a8w8_bpreshuffle_256x256x256x128_16x16_16x16_8x32x1_8x32x1_1x32x1x8_8x8x1_2x1_intrawave_v3,2367.73,269.58,0.0
256,32768,14336,8192,torch.float8_e4m3fn,158,0,2945.0068,a8w8_bpreshuffle_256x192x256x128_16x16_16x16_8x32x1_8x32x1_1x16x1x16_8x8x1_1x2_intrawave_v3,2613.43,450.05,0.0
256,32768,16384,2048,torch.float8_e4m3fn,102,0,1180.9193,a8w8_bpreshuffle_256x96x256x128_16x16_16x16_8x32x1_8x32x1_1x32x1x8_8x8x1_2x1_intrawave_v3,1862.13,994.48,0.0
256,32768,16384,4096,torch.float8_e4m3fn,33,0,1989.9333,a8w8_bpreshuffle_256x256x256x128_16x16_16x16_8x32x1_8x32x1_1x32x1x8_8x8x1_2x1_intrawave_v3,2210.15,640.76,0.0
256,32768,16384,6656,torch.float8_e4m3fn,33,0,3099.1632,a8w8_bpreshuffle_256x256x256x128_16x16_16x16_8x32x1_8x32x1_1x32x1x8_8x8x1_2x1_intrawave_v3,2306.05,452.02,0.0
256,32768,16384,8192,torch.float8_e4m3fn,33,0,3588.7344,a8w8_bpreshuffle_256x256x256x128_16x16_16x16_8x32x1_8x32x1_1x32x1x8_8x8x1_2x1_intrawave_v3,2451.03,411.4,0.0
256,32768,16384,13312,torch.float8_e4m3fn,33,0,5598.3345,a8w8_bpreshuffle_256x256x256x128_16x16_16x16_8x32x1_8x32x1_1x32x1x8_8x8x1_2x1_intrawave_v3,2553.2,308.67,0.0
256,32768,16384,26624,torch.float8_e4m3fn,154,0,12187.7899,a8w8_bpreshuffle_256x128x256x256_16x16_16x16_16x16x1_16x16x1_1x16x1x16_8x8x1_1x2_intrawave_v3,2345.57,195.47,0.0
256,32768,26624,16384,torch.float8_e4m3fn,33,0,11524.899,a8w8_bpreshuffle_256x256x256x128_16x16_16x16_8x32x1_8x32x1_1x32x1x8_8x8x1_2x1_intrawave_v3,2480.48,235.83,0.0
256,32768,51200,5120,torch.float8_e4m3fn,33,0,7575.0119,a8w8_bpreshuffle_256x256x256x128_16x16_16x16_8x32x1_8x32x1_1x32x1x8_8x8x1_2x1_intrawave_v3,2267.97,499.72,0.0
256,32768,53248,16384,torch.float8_e4m3fn,33,0,22600.3968,a8w8_bpreshuffle_256x256x256x128_16x16_16x16_8x32x1_8x32x1_1x32x1x8_8x8x1_2x1_intrawave_v3,2529.81,216.76,0.0
256,32768,57344,8192,torch.float8_e4m3fn,158,0,11963.3054,a8w8_bpreshuffle_256x192x256x128_16x16_16x16_8x32x1_8x32x1_1x16x1x16_8x8x1_1x2_intrawave_v3,2573.4,375.84,0.0
80,192,128,5120,torch.int8,160,8,12.1485,_ZN5aiter42I8gemm_bf16_perTokenI8_BpreShuffle_128x128E,20.72,138.91,0.1606
80,64,1536,5120,torch.int8,160,6,12.9215,_ZN5aiter42I8gemm_bf16_perTokenI8_BpreShuffle_128x128E,77.9,649.2,0.1336
80,80,1536,5120,torch.int8,160,6,13.5695,_ZN5aiter42I8gemm_bf16_perTokenI8_BpreShuffle_128x128E,92.73,627.86,0.135
80,128,1536,5120,torch.int8,160,6,14.3572,_ZN5aiter42I8gemm_bf16_perTokenI8_BpreShuffle_128x128E,140.23,620.8,0.1335
80,150,1536,5120,torch.int8,161,6,18.1719,_ZN5aiter42I8gemm_bf16_perTokenI8_BpreShuffle_192x128E,129.83,500.39,0.1344
80,192,1536,5120,torch.int8,161,6,18.2027,_ZN5aiter42I8gemm_bf16_perTokenI8_BpreShuffle_192x128E,165.9,518.45,0.1342
80,220,1536,5120,torch.int8,160,3,21.1629,_ZN5aiter42I8gemm_bf16_perTokenI8_BpreShuffle_128x128E,163.51,456.77,0.0857
80,256,1536,5120,torch.int8,160,3,21.3733,_ZN5aiter42I8gemm_bf16_perTokenI8_BpreShuffle_128x128E,188.39,466.07,0.0853
80,384,1536,5120,torch.int8,161,3,26.9758,_ZN5aiter42I8gemm_bf16_perTokenI8_BpreShuffle_192x128E,223.9,408.15,0.0875
80,448,1536,5120,torch.int8,161,2,33.1084,_ZN5aiter42I8gemm_bf16_perTokenI8_BpreShuffle_192x128E,212.83,348.38,0.0523
80,512,1536,5120,torch.int8,161,2,33.5781,_ZN5aiter42I8gemm_bf16_perTokenI8_BpreShuffle_192x128E,239.83,359.12,0.0534
80,128,8192,1024,torch.int8,160,1,14.9178,_ZN5aiter42I8gemm_bf16_perTokenI8_BpreShuffle_128x128E,143.95,711.69,0.0
80,192,8192,1024,torch.int8,161,1,19.5799,_ZN5aiter42I8gemm_bf16_perTokenI8_BpreShuffle_192x128E,164.52,599.13,0.0007
80,256,8192,1024,torch.int8,160,1,27.0157,_ZN5aiter42I8gemm_bf16_perTokenI8_BpreShuffle_128x128E,158.98,475.47,0.0
80,320,8192,1024,torch.int8,161,1,34.1636,_ZN5aiter42I8gemm_bf16_perTokenI8_BpreShuffle_192x128E,157.15,408.6,0.0
80,512,8192,1024,torch.int8,161,1,49.4192,_ZN5aiter42I8gemm_bf16_perTokenI8_BpreShuffle_192x128E,173.82,350.1,0.0003
80,1024,8192,1024,torch.int8,161,1,82.0338,_ZN5aiter42I8gemm_bf16_perTokenI8_BpreShuffle_192x128E,209.42,319.56,0.0
80,2048,8192,1024,torch.int8,161,1,147.0079,_ZN5aiter42I8gemm_bf16_perTokenI8_BpreShuffle_192x128E,233.73,299.58,0.0003
80,4096,8192,1024,torch.int8,161,1,288.7332,_ZN5aiter42I8gemm_bf16_perTokenI8_BpreShuffle_192x128E,238.0,276.0,0.0003
80,8192,8192,1024,torch.int8,161,1,563.934,_ZN5aiter42I8gemm_bf16_perTokenI8_BpreShuffle_192x128E,243.71,267.75,0.0006
80,16384,8192,1024,torch.int8,161,1,1104.9189,_ZN5aiter42I8gemm_bf16_perTokenI8_BpreShuffle_192x128E,248.78,265.72,0.0004
80,128,1280,8192,torch.int8,161,8,18.4707,_ZN5aiter42I8gemm_bf16_perTokenI8_BpreShuffle_192x128E,145.33,642.21,0.1588
80,192,1280,5120,torch.int8,161,8,16.3619,_ZN5aiter42I8gemm_bf16_perTokenI8_BpreShuffle_192x128E,153.81,490.66,0.1651
80,192,1280,8192,torch.int8,161,8,19.5141,_ZN5aiter42I8gemm_bf16_perTokenI8_BpreShuffle_192x128E,206.34,643.13,0.1637
80,192,1280,1024,torch.int8,160,6,9.0346,_ZN5aiter42I8gemm_bf16_perTokenI8_BpreShuffle_128x128E,55.71,221.24,0.0914
80,192,1536,1024,torch.int8,160,3,10.3979,_ZN5aiter42I8gemm_bf16_perTokenI8_BpreShuffle_128x128E,58.09,226.9,0.0725
80,256,1280,8192,torch.int8,160,4,23.0901,_ZN5aiter42I8gemm_bf16_perTokenI8_BpreShuffle_128x128E,232.51,573.33,0.1074
80,320,1280,8192,torch.int8,161,4,29.0859,_ZN5aiter42I8gemm_bf16_perTokenI8_BpreShuffle_192x128E,230.73,478.8,0.107
80,512,1280,8192,torch.int8,160,2,38.6745,_ZN5aiter42I8gemm_bf16_perTokenI8_BpreShuffle_128x128E,277.64,413.47,0.0542
80,1024,1280,8192,torch.int8,160,1,69.7841,_ZN5aiter42I8gemm_bf16_perTokenI8_BpreShuffle_128x128E,307.73,308.03,0.0
80,2048,1280,8192,torch.int8,160,1,132.2413,_ZN5aiter42I8gemm_bf16_perTokenI8_BpreShuffle_128x128E,324.78,245.81,0.0
80,4096,1280,8192,torch.int8,161,1,251.3328,_ZN5aiter42I8gemm_bf16_perTokenI8_BpreShuffle_192x128E,341.78,216.95,0.0021
80,8192,1280,8192,torch.int8,161,1,496.6916,_ZN5aiter42I8gemm_bf16_perTokenI8_BpreShuffle_192x128E,345.89,198.45,0.0016
80,16384,1280,8192,torch.int8,161,1,906.8273,_ZN5aiter42I8gemm_bf16_perTokenI8_BpreShuffle_192x128E,378.9,205.82,0.0021
80,192,8192,5120,torch.int8,161,1,60.0426,_ZN5aiter42I8gemm_bf16_perTokenI8_BpreShuffle_192x128E,268.25,767.32,0.0026
80,1,128,7168,torch.float8_e4m3fn,25,0,10.735,a8w8_bpreshuffle_256x16x64x512_16x16_16x16_32x8x1_32x8x1_1x16x1x16_4x4x1_1x1_intrawave_v2,0,0,0
80,1,576,7168,torch.float8_e4m3fn,10,0,11.2398,a8w8_bpreshuffle_128x16x32x512_16x16_16x16_32x4x1_32x4x1_1x16x1x8_4x4x1_1x1_intrawave_v1,0,0,0
80,1,1536,7168,torch.float8_e4m3fn,10,0,11.721,a8w8_bpreshuffle_128x16x32x512_16x16_16x16_32x4x1_32x4x1_1x16x1x8_4x4x1_1x1_intrawave_v1,0,0,0
80,1,2240,7168,torch.float8_e4m3fn,10,0,11.8963,a8w8_bpreshuffle_128x16x32x512_16x16_16x16_32x4x1_32x4x1_1x16x1x8_4x4x1_1x1_intrawave_v1,0,0,0
80,1,3072,1536,torch.float8_e4m3fn,5,0,5.6562,a8w8_bpreshuffle_256x16x64x512_16x16_16x16_32x8x1_32x8x1_1x16x1x16_4x4x1_1x1_intrawave_v1,0,0,0
80,1,4096,7168,torch.float8_e4m3fn,11,0,13.4343,a8w8_bpreshuffle_256x16x64x512_16x16_16x16_32x8x1_32x8x1_1x16x1x16_4x4x1_1x1_intrawave_v1,0,0,0
80,1,7168,2048,torch.float8_e4m3fn,10,0,9.1526,a8w8_bpreshuffle_128x16x32x512_16x16_16x16_32x4x1_32x4x1_1x16x1x8_4x4x1_1x1_intrawave_v1,0,0,0
80,1,7168,16384,torch.float8_e4m3fn,24,0,39.678,a8w8_bpreshuffle_128x16x32x512_16x16_16x16_32x4x1_32x4x1_1x16x1x8_4x4x1_1x1_intrawave_v2,0,0,0
80,1,7168,18432,torch.float8_e4m3fn,10,0,42.556,a8w8_bpreshuffle_128x16x32x512_16x16_16x16_32x4x1_32x4x1_1x16x1x8_4x4x1_1x1_intrawave_v1,0,0,0
80,1,8192,1536,torch.float8_e4m3fn,11,0,7.6538,a8w8_bpreshuffle_256x16x64x512_16x16_16x16_32x8x1_32x8x1_1x16x1x16_4x4x1_1x1_intrawave_v1,0,0,0
80,1,11264,1536,torch.float8_e4m3fn,108,0,9.3388,a8w8_bpreshuffle_256x16x64x256_16x16_16x16_16x16x1_16x16x1_1x16x1x16_4x4x1_1x1_intrawave_v1,0,0,0
80,1,24576,1536,torch.float8_e4m3fn,15,0,13.5093,a8w8_bpreshuffle_256x16x64x256_16x16_16x16_16x16x1_16x16x1_1x16x1x16_4x4x1_1x1_intrawave_v1,0,0,0
80,1,32768,512,torch.float8_e4m3fn,9,0,9.7066,a8w8_bpreshuffle_128x16x32x128_16x16_16x16_8x16x1_8x16x1_1x16x1x8_4x4x1_1x1_intrawave_v1,0,0,0
80,1,32768,1536,torch.float8_e4m3fn,15,0,17.5611,a8w8_bpreshuffle_256x16x64x256_16x16_16x16_16x16x1_16x16x1_1x16x1x16_4x4x1_1x1_intrawave_v1,0,0,0
80,1,36864,7168,torch.float8_e4m3fn,6,0,76.2189,a8w8_bpreshuffle_256x16x128x512_16x16_16x16_32x8x1_32x8x1_1x16x1x16_8x8x1_1x2_intrawave_v1,0,0,0
80,2,128,7168,torch.float8_e4m3fn,10,0,10.1434,a8w8_bpreshuffle_128x16x32x512_16x16_16x16_32x4x1_32x4x1_1x16x1x8_4x4x1_1x1_intrawave_v1,0,0,0
80,2,512,7168,torch.float8_e4m3fn,10,0,11.2907,a8w8_bpreshuffle_128x16x32x512_16x16_16x16_32x4x1_32x4x1_1x16x1x8_4x4x1_1x1_intrawave_v1,0,0,0
80,2,576,7168,torch.float8_e4m3fn,10,0,11.5102,a8w8_bpreshuffle_128x16x32x512_16x16_16x16_32x4x1_32x4x1_1x16x1x8_4x4x1_1x1_intrawave_v1,0,0,0
80,2,1536,7168,torch.float8_e4m3fn,10,0,12.1679,a8w8_bpreshuffle_128x16x32x512_16x16_16x16_32x4x1_32x4x1_1x16x1x8_4x4x1_1x1_intrawave_v1,0,0,0
80,2,2240,7168,torch.float8_e4m3fn,10,0,12.1906,a8w8_bpreshuffle_128x16x32x512_16x16_16x16_32x4x1_32x4x1_1x16x1x8_4x4x1_1x1_intrawave_v1,0,0,0
80,2,3072,1536,torch.float8_e4m3fn,11,0,5.911,a8w8_bpreshuffle_256x16x64x512_16x16_16x16_32x8x1_32x8x1_1x16x1x16_4x4x1_1x1_intrawave_v1,0,0,0
80,2,4096,512,torch.float8_e4m3fn,23,0,4.4526,a8w8_bpreshuffle_128x16x32x128_16x16_16x16_8x16x1_8x16x1_1x16x1x8_4x4x1_1x1_intrawave_v2,0,0,0
80,2,4096,7168,torch.float8_e4m3fn,11,0,13.2939,a8w8_bpreshuffle_256x16x64x512_16x16_16x16_32x8x1_32x8x1_1x16x1x16_4x4x1_1x1_intrawave_v1,0,0,0
80,2,4608,7168,torch.float8_e4m3fn,5,0,13.597,a8w8_bpreshuffle_256x16x64x512_16x16_16x16_32x8x1_32x8x1_1x16x1x16_4x4x1_1x1_intrawave_v1,0,0,0
80,2,7168,256,torch.float8_e4m3fn,75,0,6.3266,a8w8_bpreshuffle_128x16x256x64_16x16_16x16_4x16x1_4x32x1_1x16x1x8_8x8x1_1x2_intrawave_v1,0,0,0
80,2,7168,2048,torch.float8_e4m3fn,5,0,8.5166,a8w8_bpreshuffle_256x16x64x512_16x16_16x16_32x8x1_32x8x1_1x16x1x16_4x4x1_1x1_intrawave_v1,0,0,0
80,2,7168,2304,torch.float8_e4m3fn,29,0,9.905,a8w8_bpreshuffle_256x16x64x256_16x16_16x16_16x16x1_16x16x1_1x16x1x16_4x4x1_1x1_intrawave_v2,0,0,0
80,2,7168,16384,torch.float8_e4m3fn,10,0,37.3783,a8w8_bpreshuffle_128x16x32x512_16x16_16x16_32x4x1_32x4x1_1x16x1x8_4x4x1_1x1_intrawave_v1,0,0,0
80,2,7168,18432,torch.float8_e4m3fn,10,0,42.2924,a8w8_bpreshuffle_128x16x32x512_16x16_16x16_32x4x1_32x4x1_1x16x1x8_4x4x1_1x1_intrawave_v1,0,0,0
80,2,8192,1536,torch.float8_e4m3fn,5,0,7.8006,a8w8_bpreshuffle_256x16x64x512_16x16_16x16_32x8x1_32x8x1_1x16x1x16_4x4x1_1x1_intrawave_v1,0,0,0
80,2,11264,1536,torch.float8_e4m3fn,15,0,9.4898,a8w8_bpreshuffle_256x16x64x256_16x16_16x16_16x16x1_16x16x1_1x16x1x16_4x4x1_1x1_intrawave_v1,0,0,0
80,2,24576,1536,torch.float8_e4m3fn,108,0,13.6777,a8w8_bpreshuffle_256x16x64x256_16x16_16x16_16x16x1_16x16x1_1x16x1x16_4x4x1_1x1_intrawave_v1,0,0,0
80,2,32768,512,torch.float8_e4m3fn,9,0,9.513,a8w8_bpreshuffle_128x16x32x128_16x16_16x16_8x16x1_8x16x1_1x16x1x8_4x4x1_1x1_intrawave_v1,0,0,0
80,2,32768,1536,torch.float8_e4m3fn,108,0,17.4059,a8w8_bpreshuffle_256x16x64x256_16x16_16x16_16x16x1_16x16x1_1x16x1x16_4x4x1_1x1_intrawave_v1,0,0,0
80,2,36864,7168,torch.float8_e4m3fn,20,0,78.3165,a8w8_bpreshuffle_256x16x128x512_16x16_16x16_32x8x1_32x8x1_1x16x1x16_8x8x1_1x2_intrawave_v2,0,0,0
80,4,128,7168,torch.float8_e4m3fn,10,0,10.0606,a8w8_bpreshuffle_128x16x32x512_16x16_16x16_32x4x1_32x4x1_1x16x1x8_4x4x1_1x1_intrawave_v1,0,0,0
80,4,512,7168,torch.float8_e4m3fn,10,0,11.6471,a8w8_bpreshuffle_128x16x32x512_16x16_16x16_32x4x1_32x4x1_1x16x1x8_4x4x1_1x1_intrawave_v1,0,0,0
80,4,576,7168,torch.float8_e4m3fn,10,0,11.6411,a8w8_bpreshuffle_128x16x32x512_16x16_16x16_32x4x1_32x4x1_1x16x1x8_4x4x1_1x1_intrawave_v1,0,0,0
80,4,1536,7168,torch.float8_e4m3fn,10,0,12.2579,a8w8_bpreshuffle_128x16x32x512_16x16_16x16_32x4x1_32x4x1_1x16x1x8_4x4x1_1x1_intrawave_v1,0,0,0
80,4,2240,7168,torch.float8_e4m3fn,10,0,12.3558,a8w8_bpreshuffle_128x16x32x512_16x16_16x16_32x4x1_32x4x1_1x16x1x8_4x4x1_1x1_intrawave_v1,0,0,0
80,4,3072,1536,torch.float8_e4m3fn,11,0,5.8834,a8w8_bpreshuffle_256x16x64x512_16x16_16x16_32x8x1_32x8x1_1x16x1x16_4x4x1_1x1_intrawave_v1,0,0,0
80,4,4096,512,torch.float8_e4m3fn,23,0,4.5342,a8w8_bpreshuffle_128x16x32x128_16x16_16x16_8x16x1_8x16x1_1x16x1x8_4x4x1_1x1_intrawave_v2,0,0,0
80,4,4096,7168,torch.float8_e4m3fn,5,0,13.5363,a8w8_bpreshuffle_256x16x64x512_16x16_16x16_32x8x1_32x8x1_1x16x1x16_4x4x1_1x1_intrawave_v1,0,0,0
80,4,4608,7168,torch.float8_e4m3fn,5,0,13.6563,a8w8_bpreshuffle_256x16x64x512_16x16_16x16_32x8x1_32x8x1_1x16x1x16_4x4x1_1x1_intrawave_v1,0,0,0
80,4,7168,256,torch.float8_e4m3fn,73,0,6.9558,a8w8_bpreshuffle_256x32x256x64_16x16_16x16_4x32x1_4x64x1_1x32x1x8_8x8x1_2x1_intrawave_v1,0,0,0
80,4,7168,2048,torch.float8_e4m3fn,108,0,8.5722,a8w8_bpreshuffle_256x16x64x256_16x16_16x16_16x16x1_16x16x1_1x16x1x16_4x4x1_1x1_intrawave_v1,0,0,0
80,4,7168,2304,torch.float8_e4m3fn,108,0,9.9551,a8w8_bpreshuffle_256x16x64x256_16x16_16x16_16x16x1_16x16x1_1x16x1x16_4x4x1_1x1_intrawave_v1,0,0,0
80,4,7168,16384,torch.float8_e4m3fn,10,0,37.6428,a8w8_bpreshuffle_128x16x32x512_16x16_16x16_32x4x1_32x4x1_1x16x1x8_4x4x1_1x1_intrawave_v1,0,0,0
80,4,7168,18432,torch.float8_e4m3fn,10,0,42.1052,a8w8_bpreshuffle_128x16x32x512_16x16_16x16_32x4x1_32x4x1_1x16x1x8_4x4x1_1x1_intrawave_v1,0,0,0
80,4,8192,1536,torch.float8_e4m3fn,6,0,8.0606,a8w8_bpreshuffle_256x16x128x512_16x16_16x16_32x8x1_32x8x1_1x16x1x16_8x8x1_1x2_intrawave_v1,0,0,0
80,4,11264,1536,torch.float8_e4m3fn,10,0,9.667,a8w8_bpreshuffle_128x16x32x512_16x16_16x16_32x4x1_32x4x1_1x16x1x8_4x4x1_1x1_intrawave_v1,0,0,0
80,4,24576,1536,torch.float8_e4m3fn,15,0,13.9333,a8w8_bpreshuffle_256x16x64x256_16x16_16x16_16x16x1_16x16x1_1x16x1x16_4x4x1_1x1_intrawave_v1,0,0,0
80,4,32768,512,torch.float8_e4m3fn,23,0,9.1702,a8w8_bpreshuffle_128x16x32x128_16x16_16x16_8x16x1_8x16x1_1x16x1x8_4x4x1_1x1_intrawave_v2,0,0,0
80,4,32768,1536,torch.float8_e4m3fn,109,0,18.3707,a8w8_bpreshuffle_256x16x128x256_16x16_16x16_16x16x1_16x16x1_1x16x1x16_8x8x1_1x2_intrawave_v1,0,0,0
80,4,36864,7168,torch.float8_e4m3fn,32,0,78.8657,a8w8_bpreshuffle_256x16x512x256_16x16_16x16_16x16x1_16x16x1_1x16x1x16_8x8x1_1x2_intrawave_v2,0,0,0
80,8,128,7168,torch.float8_e4m3fn,10,0,10.4198,a8w8_bpreshuffle_128x16x32x512_16x16_16x16_32x4x1_32x4x1_1x16x1x8_4x4x1_1x1_intrawave_v1,0,0,0
80,8,512,7168,torch.float8_e4m3fn,10,0,11.7575,a8w8_bpreshuffle_128x16x32x512_16x16_16x16_32x4x1_32x4x1_1x16x1x8_4x4x1_1x1_intrawave_v1,0,0,0
80,8,576,7168,torch.float8_e4m3fn,10,0,11.871,a8w8_bpreshuffle_128x16x32x512_16x16_16x16_32x4x1_32x4x1_1x16x1x8_4x4x1_1x1_intrawave_v1,0,0,0
80,8,1536,7168,torch.float8_e4m3fn,10,0,12.559,a8w8_bpreshuffle_128x16x32x512_16x16_16x16_32x4x1_32x4x1_1x16x1x8_4x4x1_1x1_intrawave_v1,0,0,0
80,8,2240,7168,torch.float8_e4m3fn,10,0,12.6438,a8w8_bpreshuffle_128x16x32x512_16x16_16x16_32x4x1_32x4x1_1x16x1x8_4x4x1_1x1_intrawave_v1,0,0,0
80,8,3072,1536,torch.float8_e4m3fn,10,0,5.8254,a8w8_bpreshuffle_128x16x32x512_16x16_16x16_32x4x1_32x4x1_1x16x1x8_4x4x1_1x1_intrawave_v1,0,0,0
80,8,4096,512,torch.float8_e4m3fn,9,0,4.1858,a8w8_bpreshuffle_128x16x32x128_16x16_16x16_8x16x1_8x16x1_1x16x1x8_4x4x1_1x1_intrawave_v1,0,0,0
80,8,4096,7168,torch.float8_e4m3fn,11,0,13.6103,a8w8_bpreshuffle_256x16x64x512_16x16_16x16_32x8x1_32x8x1_1x16x1x16_4x4x1_1x1_intrawave_v1,0,0,0
80,8,4608,7168,torch.float8_e4m3fn,5,0,13.8099,a8w8_bpreshuffle_256x16x64x512_16x16_16x16_32x8x1_32x8x1_1x16x1x16_4x4x1_1x1_intrawave_v1,0,0,0
80,8,7168,256,torch.float8_e4m3fn,75,0,6.2842,a8w8_bpreshuffle_128x16x256x64_16x16_16x16_4x16x1_4x32x1_1x16x1x8_8x8x1_1x2_intrawave_v1,0,0,0
80,8,7168,2048,torch.float8_e4m3fn,24,0,8.685,a8w8_bpreshuffle_128x16x32x512_16x16_16x16_32x4x1_32x4x1_1x16x1x8_4x4x1_1x1_intrawave_v2,0,0,0
80,8,7168,2304,torch.float8_e4m3fn,108,0,10.0038,a8w8_bpreshuffle_256x16x64x256_16x16_16x16_16x16x1_16x16x1_1x16x1x16_4x4x1_1x1_intrawave_v1,0,0,0
80,8,7168,16384,torch.float8_e4m3fn,10,0,39.2255,a8w8_bpreshuffle_128x16x32x512_16x16_16x16_32x4x1_32x4x1_1x16x1x8_4x4x1_1x1_intrawave_v1,0,0,0
80,8,7168,18432,torch.float8_e4m3fn,24,0,45.0508,a8w8_bpreshuffle_128x16x32x512_16x16_16x16_32x4x1_32x4x1_1x16x1x8_4x4x1_1x1_intrawave_v2,0,0,0
80,8,8192,1536,torch.float8_e4m3fn,5,0,8.1558,a8w8_bpreshuffle_256x16x64x512_16x16_16x16_32x8x1_32x8x1_1x16x1x16_4x4x1_1x1_intrawave_v1,0,0,0
80,8,11264,1536,torch.float8_e4m3fn,10,0,10.0366,a8w8_bpreshuffle_128x16x32x512_16x16_16x16_32x4x1_32x4x1_1x16x1x8_4x4x1_1x1_intrawave_v1,0,0,0
80,8,24576,1536,torch.float8_e4m3fn,9,0,14.5085,a8w8_bpreshuffle_128x16x32x128_16x16_16x16_8x16x1_8x16x1_1x16x1x8_4x4x1_1x1_intrawave_v1,0,0,0
80,8,32768,512,torch.float8_e4m3fn,9,0,9.9258,a8w8_bpreshuffle_128x16x32x128_16x16_16x16_8x16x1_8x16x1_1x16x1x8_4x4x1_1x1_intrawave_v1,0,0,0
80,8,32768,1536,torch.float8_e4m3fn,5,0,18.2531,a8w8_bpreshuffle_256x16x64x512_16x16_16x16_32x8x1_32x8x1_1x16x1x16_4x4x1_1x1_intrawave_v1,0,0,0
80,8,36864,7168,torch.float8_e4m3fn,111,0,79.5469,a8w8_bpreshuffle_256x16x512x256_16x16_16x16_16x16x1_16x16x1_1x16x1x16_8x8x1_1x2_intrawave_v1,0,0,0
80,16,128,7168,torch.float8_e4m3fn,19,0,10.0946,a8w8_bpreshuffle_256x16x64x512_16x16_16x16_32x8x1_32x8x1_1x16x1x16_4x4x1_1x1_intrawave_v2,0,0,0
80,16,2240,7168,torch.float8_e4m3fn,10,0,11.1279,a8w8_bpreshuffle_128x16x32x512_16x16_16x16_32x4x1_32x4x1_1x16x1x8_4x4x1_1x1_intrawave_v1,0,0,0
80,16,4096,7168,torch.float8_e4m3fn,11,0,13.1683,a8w8_bpreshuffle_256x16x64x512_16x16_16x16_32x8x1_32x8x1_1x16x1x16_4x4x1_1x1_intrawave_v1,0,0,0
80,16,7168,16384,torch.float8_e4m3fn,6,0,42.1056,a8w8_bpreshuffle_256x16x128x512_16x16_16x16_32x8x1_32x8x1_1x16x1x16_8x8x1_1x2_intrawave_v1,0,0,0
80,16,7168,18432,torch.float8_e4m3fn,6,0,45.8424,a8w8_bpreshuffle_256x16x128x512_16x16_16x16_32x8x1_32x8x1_1x16x1x16_8x8x1_1x2_intrawave_v1,0,0,0
80,16,8192,1536,torch.float8_e4m3fn,6,0,7.9894,a8w8_bpreshuffle_256x16x128x512_16x16_16x16_32x8x1_32x8x1_1x16x1x16_8x8x1_1x2_intrawave_v1,0,0,0
80,16,11264,1536,torch.float8_e4m3fn,10,0,9.7876,a8w8_bpreshuffle_128x16x32x512_16x16_16x16_32x4x1_32x4x1_1x16x1x8_4x4x1_1x1_intrawave_v1,0,0,0
80,16,24576,1536,torch.float8_e4m3fn,5,0,15.7929,a8w8_bpreshuffle_256x16x64x512_16x16_16x16_32x8x1_32x8x1_1x16x1x16_4x4x1_1x1_intrawave_v1,0,0,0
80,16,32768,512,torch.float8_e4m3fn,9,0,10.2342,a8w8_bpreshuffle_128x16x32x128_16x16_16x16_8x16x1_8x16x1_1x16x1x8_4x4x1_1x1_intrawave_v1,0,0,0
80,16,32768,1536,torch.float8_e4m3fn,5,0,19.2975,a8w8_bpreshuffle_256x16x64x512_16x16_16x16_32x8x1_32x8x1_1x16x1x16_4x4x1_1x1_intrawave_v1,0,0,0
80,16,36864,7168,torch.float8_e4m3fn,6,0,80.7001,a8w8_bpreshuffle_256x16x128x512_16x16_16x16_32x8x1_32x8x1_1x16x1x16_8x8x1_1x2_intrawave_v1,0,0,0
80,32,128,7168,torch.float8_e4m3fn,10,0,10.0298,a8w8_bpreshuffle_128x16x32x512_16x16_16x16_32x4x1_32x4x1_1x16x1x8_4x4x1_1x1_intrawave_v1,0,0,0
80,32,2240,7168,torch.float8_e4m3fn,11,0,12.8275,a8w8_bpreshuffle_256x16x64x512_16x16_16x16_32x8x1_32x8x1_1x16x1x16_4x4x1_1x1_intrawave_v1,0,0,0
80,32,4096,7168,torch.float8_e4m3fn,12,0,18.5983,a8w8_bpreshuffle_256x32x64x512_16x16_16x16_32x8x1_32x8x1_1x32x1x8_8x8x1_1x2_intrawave_v1,0,0,0
80,32,7168,16384,torch.float8_e4m3fn,119,0,53.2367,a8w8_bpreshuffle_256x32x128x256_16x16_16x16_16x16x1_16x16x1_1x16x1x16_8x8x1_1x2_intrawave_v1,0,0,0
80,32,7168,18432,torch.float8_e4m3fn,119,0,58.5048,a8w8_bpreshuffle_256x32x128x256_16x16_16x16_16x16x1_16x16x1_1x16x1x16_8x8x1_1x2_intrawave_v1,0,0,0
80,32,8192,1536,torch.float8_e4m3fn,112,0,10.3018,a8w8_bpreshuffle_256x32x64x256_16x16_16x16_16x16x1_16x16x1_1x32x1x8_8x8x1_2x1_intrawave_v1,0,0,0
80,32,11264,1536,torch.float8_e4m3fn,76,0,12.5451,a8w8_bpreshuffle_256x32x64x128_16x16_16x16_8x32x1_8x32x1_1x32x1x8_8x8x1_2x1_intrawave_v1,0,0,0
80,32,24576,1536,torch.float8_e4m3fn,112,0,19.3781,a8w8_bpreshuffle_256x32x64x256_16x16_16x16_16x16x1_16x16x1_1x32x1x8_8x8x1_2x1_intrawave_v1,0,0,0
80,32,32768,512,torch.float8_e4m3fn,76,0,12.0918,a8w8_bpreshuffle_256x32x64x128_16x16_16x16_8x32x1_8x32x1_1x32x1x8_8x8x1_2x1_intrawave_v1,0,0,0
80,32,32768,1536,torch.float8_e4m3fn,119,0,24.3999,a8w8_bpreshuffle_256x32x128x256_16x16_16x16_16x16x1_16x16x1_1x16x1x16_8x8x1_1x2_intrawave_v1,0,0,0
80,32,36864,7168,torch.float8_e4m3fn,133,0,93.517,a8w8_bpreshuffle_256x32x256x256_16x16_16x16_16x16x1_16x16x1_1x16x1x16_8x8x1_1x2_intrawave_v1,0,0,0
80,48,2240,7168,torch.float8_e4m3fn,10,0,18.3626,a8w8_bpreshuffle_128x16x32x512_16x16_16x16_32x4x1_32x4x1_1x16x1x8_4x4x1_1x1_intrawave_v1,0,0,0
80,48,11264,1536,torch.float8_e4m3fn,113,0,15.2534,a8w8_bpreshuffle_256x48x64x256_16x16_16x16_16x16x1_16x16x1_1x16x1x16_4x4x1_1x1_intrawave_v1,0,0,0
80,64,128,7168,torch.float8_e4m3fn,24,0,9.9198,a8w8_bpreshuffle_128x16x32x512_16x16_16x16_32x4x1_32x4x1_1x16x1x8_4x4x1_1x1_intrawave_v2,0,0,0
80,64,2240,7168,torch.float8_e4m3fn,12,0,18.6485,a8w8_bpreshuffle_256x32x64x512_16x16_16x16_32x8x1_32x8x1_1x32x1x8_8x8x1_1x2_intrawave_v1,0,0,0
80,64,4096,7168,torch.float8_e4m3fn,114,0,23.8807,a8w8_bpreshuffle_256x64x64x256_16x16_16x16_16x16x1_16x16x1_1x32x1x8_8x8x1_2x1_intrawave_v3,0,0,0
80,64,7168,16384,torch.float8_e4m3fn,121,0,81.4496,a8w8_bpreshuffle_256x64x128x256_16x16_16x16_16x16x1_16x16x1_1x16x1x16_8x8x1_1x2_intrawave_v3,0,0,0
80,64,7168,18432,torch.float8_e4m3fn,121,0,89.7754,a8w8_bpreshuffle_256x64x128x256_16x16_16x16_16x16x1_16x16x1_1x16x1x16_8x8x1_1x2_intrawave_v3,0,0,0
80,64,8192,1536,torch.float8_e4m3fn,114,0,12.7978,a8w8_bpreshuffle_256x64x64x256_16x16_16x16_16x16x1_16x16x1_1x32x1x8_8x8x1_2x1_intrawave_v3,0,0,0
80,64,11264,1536,torch.float8_e4m3fn,112,0,17.4734,a8w8_bpreshuffle_256x32x64x256_16x16_16x16_16x16x1_16x16x1_1x32x1x8_8x8x1_2x1_intrawave_v1,0,0,0
80,64,24576,1536,torch.float8_e4m3fn,93,0,27.4074,a8w8_bpreshuffle_256x64x192x128_16x16_16x16_8x32x1_8x32x1_1x32x1x8_8x8x1_2x1_intrawave_v3,0,0,0
80,64,32768,512,torch.float8_e4m3fn,85,0,18.7478,a8w8_bpreshuffle_256x64x128x128_16x16_16x16_8x32x1_8x32x1_1x32x1x8_8x8x1_2x1_intrawave_v3,0,0,0
80,64,32768,1536,torch.float8_e4m3fn,101,0,34.2699,a8w8_bpreshuffle_256x64x256x128_16x16_16x16_8x32x1_8x32x1_1x32x1x8_8x8x1_2x1_intrawave_v3,0,0,0
80,64,36864,7168,torch.float8_e4m3fn,121,0,129.978,a8w8_bpreshuffle_256x64x128x256_16x16_16x16_16x16x1_16x16x1_1x16x1x16_8x8x1_1x2_intrawave_v3,0,0,0
80,80,2240,7168,torch.float8_e4m3fn,113,0,23.5984,a8w8_bpreshuffle_256x48x64x256_16x16_16x16_16x16x1_16x16x1_1x16x1x16_4x4x1_1x1_intrawave_v1,0,0,0
80,80,11264,1536,torch.float8_e4m3fn,100,0,21.6601,a8w8_bpreshuffle_256x32x256x128_16x16_16x16_8x32x1_8x32x1_1x32x1x8_8x8x1_2x1_intrawave_v1,0,0,0
80,96,128,7168,torch.float8_e4m3fn,25,0,10.3566,a8w8_bpreshuffle_256x16x64x512_16x16_16x16_32x8x1_32x8x1_1x16x1x16_4x4x1_1x1_intrawave_v2,0,0,0
80,96,576,7168,torch.float8_e4m3fn,10,0,12.065,a8w8_bpreshuffle_128x16x32x512_16x16_16x16_32x4x1_32x4x1_1x16x1x8_4x4x1_1x1_intrawave_v1,0,0,0
80,96,1536,7168,torch.float8_e4m3fn,6,0,18.0262,a8w8_bpreshuffle_256x16x128x512_16x16_16x16_32x8x1_32x8x1_1x16x1x16_8x8x1_1x2_intrawave_v1,0,0,0
80,96,2240,7168,torch.float8_e4m3fn,113,0,21.7057,a8w8_bpreshuffle_256x48x64x256_16x16_16x16_16x16x1_16x16x1_1x16x1x16_4x4x1_1x1_intrawave_v1,0,0,0
80,96,3072,1536,torch.float8_e4m3fn,112,0,9.6664,a8w8_bpreshuffle_256x32x64x256_16x16_16x16_16x16x1_16x16x1_1x32x1x8_8x8x1_2x1_intrawave_v1,0,0,0
80,96,4096,7168,torch.float8_e4m3fn,120,0,29.6988,a8w8_bpreshuffle_256x48x128x256_16x16_16x16_16x16x1_16x16x1_1x16x1x16_8x8x1_1x2_intrawave_v1,0,0,0
80,96,7168,2048,torch.float8_e4m3fn,113,0,17.6925,a8w8_bpreshuffle_256x48x64x256_16x16_16x16_16x16x1_16x16x1_1x16x1x16_4x4x1_1x1_intrawave_v1,0,0,0
80,96,7168,16384,torch.float8_e4m3fn,113,0,98.4525,a8w8_bpreshuffle_256x48x64x256_16x16_16x16_16x16x1_16x16x1_1x16x1x16_4x4x1_1x1_intrawave_v1,0,0,0
80,96,7168,18432,torch.float8_e4m3fn,113,0,109.8187,a8w8_bpreshuffle_256x48x64x256_16x16_16x16_16x16x1_16x16x1_1x16x1x16_4x4x1_1x1_intrawave_v1,0,0,0
80,96,8192,1536,torch.float8_e4m3fn,120,0,16.253,a8w8_bpreshuffle_256x48x128x256_16x16_16x16_16x16x1_16x16x1_1x16x1x16_8x8x1_1x2_intrawave_v1,0,0,0
80,96,11264,1536,torch.float8_e4m3fn,119,0,21.7177,a8w8_bpreshuffle_256x32x128x256_16x16_16x16_16x16x1_16x16x1_1x16x1x16_8x8x1_1x2_intrawave_v1,0,0,0
80,96,24576,1536,torch.float8_e4m3fn,94,0,34.225,a8w8_bpreshuffle_256x96x192x128_16x16_16x16_8x32x1_8x32x1_1x32x1x8_8x8x1_2x1_intrawave_v3,0,0,0
80,96,32768,512,torch.float8_e4m3fn,84,0,23.8023,a8w8_bpreshuffle_256x32x128x128_16x16_16x16_8x32x1_8x32x1_1x32x1x8_8x8x1_2x1_intrawave_v1,0,0,0
80,96,32768,1536,torch.float8_e4m3fn,102,0,43.5312,a8w8_bpreshuffle_256x96x256x128_16x16_16x16_8x32x1_8x32x1_1x32x1x8_8x8x1_2x1_intrawave_v3,0,0,0
80,96,36864,7168,torch.float8_e4m3fn,102,0,155.5081,a8w8_bpreshuffle_256x96x256x128_16x16_16x16_8x32x1_8x32x1_1x32x1x8_8x8x1_2x1_intrawave_v3,0,0,0
80,112,2240,7168,torch.float8_e4m3fn,112,0,26.1124,a8w8_bpreshuffle_256x32x64x256_16x16_16x16_16x16x1_16x16x1_1x32x1x8_8x8x1_2x1_intrawave_v1,0,0,0
80,112,11264,1536,torch.float8_e4m3fn,85,0,25.6868,a8w8_bpreshuffle_256x64x128x128_16x16_16x16_8x32x1_8x32x1_1x32x1x8_8x8x1_2x1_intrawave_v3,0,0,0
80,128,128,7168,torch.float8_e4m3fn,10,0,9.909,a8w8_bpreshuffle_128x16x32x512_16x16_16x16_32x4x1_32x4x1_1x16x1x8_4x4x1_1x1_intrawave_v1,0,0,0
80,128,2240,7168,torch.float8_e4m3fn,114,0,23.9804,a8w8_bpreshuffle_256x64x64x256_16x16_16x16_16x16x1_16x16x1_1x32x1x8_8x8x1_2x1_intrawave_v3,0,0,0
80,128,4096,7168,torch.float8_e4m3fn,121,0,38.8588,a8w8_bpreshuffle_256x64x128x256_16x16_16x16_16x16x1_16x16x1_1x16x1x16_8x8x1_1x2_intrawave_v3,0,0,0
80,128,7168,16384,torch.float8_e4m3fn,114,0,119.9291,a8w8_bpreshuffle_256x64x64x256_16x16_16x16_16x16x1_16x16x1_1x32x1x8_8x8x1_2x1_intrawave_v3,0,0,0
80,128,7168,18432,torch.float8_e4m3fn,114,0,133.6804,a8w8_bpreshuffle_256x64x64x256_16x16_16x16_16x16x1_16x16x1_1x32x1x8_8x8x1_2x1_intrawave_v3,0,0,0
80,128,8192,1536,torch.float8_e4m3fn,121,0,19.1559,a8w8_bpreshuffle_256x64x128x256_16x16_16x16_16x16x1_16x16x1_1x16x1x16_8x8x1_1x2_intrawave_v3,0,0,0
80,128,11264,1536,torch.float8_e4m3fn,85,0,26.4316,a8w8_bpreshuffle_256x64x128x128_16x16_16x16_8x32x1_8x32x1_1x32x1x8_8x8x1_2x1_intrawave_v3,0,0,0
80,128,24576,1536,torch.float8_e4m3fn,85,0,42.5762,a8w8_bpreshuffle_256x64x128x128_16x16_16x16_8x32x1_8x32x1_1x32x1x8_8x8x1_2x1_intrawave_v3,0,0,0
80,128,32768,512,torch.float8_e4m3fn,85,0,28.3083,a8w8_bpreshuffle_256x64x128x128_16x16_16x16_8x32x1_8x32x1_1x32x1x8_8x8x1_2x1_intrawave_v3,0,0,0
80,128,32768,1536,torch.float8_e4m3fn,85,0,54.7332,a8w8_bpreshuffle_256x64x128x128_16x16_16x16_8x32x1_8x32x1_1x32x1x8_8x8x1_2x1_intrawave_v3,0,0,0
80,128,36864,7168,torch.float8_e4m3fn,93,0,201.1007,a8w8_bpreshuffle_256x64x192x128_16x16_16x16_8x32x1_8x32x1_1x32x1x8_8x8x1_2x1_intrawave_v3,0,0,0
80,160,128,7168,torch.float8_e4m3fn,10,0,10.2346,a8w8_bpreshuffle_128x16x32x512_16x16_16x16_32x4x1_32x4x1_1x16x1x8_4x4x1_1x1_intrawave_v1,0,0,0
80,160,512,7168,torch.float8_e4m3fn,25,0,12.1467,a8w8_bpreshuffle_256x16x64x512_16x16_16x16_32x8x1_32x8x1_1x16x1x16_4x4x1_1x1_intrawave_v2,0,0,0
80,160,576,7168,torch.float8_e4m3fn,10,0,16.0783,a8w8_bpreshuffle_128x16x32x512_16x16_16x16_32x4x1_32x4x1_1x16x1x8_4x4x1_1x1_intrawave_v1,0,0,0
80,160,1536,7168,torch.float8_e4m3fn,119,0,24.4126,a8w8_bpreshuffle_256x32x128x256_16x16_16x16_16x16x1_16x16x1_1x16x1x16_8x8x1_1x2_intrawave_v1,0,0,0
80,160,2112,7168,torch.float8_e4m3fn,115,0,28.9398,a8w8_bpreshuffle_256x80x64x256_16x16_16x16_16x16x1_16x16x1_1x16x1x16_4x4x1_1x1_intrawave_v3,0,0,0
80,160,2240,7168,torch.float8_e4m3fn,115,0,28.9759,a8w8_bpreshuffle_256x80x64x256_16x16_16x16_16x16x1_16x16x1_1x16x1x16_4x4x1_1x1_intrawave_v3,0,0,0
80,160,3072,1536,torch.float8_e4m3fn,112,0,11.4913,a8w8_bpreshuffle_256x32x64x256_16x16_16x16_16x16x1_16x16x1_1x32x1x8_8x8x1_2x1_intrawave_v1,0,0,0
80,160,4096,512,torch.float8_e4m3fn,84,0,7.7118,a8w8_bpreshuffle_256x32x128x128_16x16_16x16_8x32x1_8x32x1_1x32x1x8_8x8x1_2x1_intrawave_v1,0,0,0
80,160,4096,7168,torch.float8_e4m3fn,119,0,40.6369,a8w8_bpreshuffle_256x32x128x256_16x16_16x16_16x16x1_16x16x1_1x16x1x16_8x8x1_1x2_intrawave_v1,0,0,0
80,160,4608,7168,torch.float8_e4m3fn,122,0,46.244,a8w8_bpreshuffle_256x80x128x256_16x16_16x16_16x16x1_16x16x1_1x16x1x16_8x8x1_1x2_intrawave_v3,0,0,0
80,160,7168,256,torch.float8_e4m3fn,75,0,10.251,a8w8_bpreshuffle_128x16x256x64_16x16_16x16_4x16x1_4x32x1_1x16x1x8_8x8x1_1x2_intrawave_v1,0,0,0
80,160,7168,2048,torch.float8_e4m3fn,119,0,25.3574,a8w8_bpreshuffle_256x32x128x256_16x16_16x16_16x16x1_16x16x1_1x16x1x16_8x8x1_1x2_intrawave_v1,0,0,0
80,160,7168,2304,torch.float8_e4m3fn,119,0,27.2747,a8w8_bpreshuffle_256x32x128x256_16x16_16x16_16x16x1_16x16x1_1x16x1x16_8x8x1_1x2_intrawave_v1,0,0,0
80,160,7168,16384,torch.float8_e4m3fn,136,0,150.746,a8w8_bpreshuffle_256x80x256x256_16x16_16x16_16x16x1_16x16x1_1x16x1x16_8x8x1_1x2_intrawave_v3,0,0,0
80,160,7168,18432,torch.float8_e4m3fn,136,0,168.4653,a8w8_bpreshuffle_256x80x256x256_16x16_16x16_16x16x1_16x16x1_1x16x1x16_8x8x1_1x2_intrawave_v3,0,0,0
80,160,8192,1536,torch.float8_e4m3fn,100,0,21.719,a8w8_bpreshuffle_256x32x256x128_16x16_16x16_8x32x1_8x32x1_1x32x1x8_8x8x1_2x1_intrawave_v1,0,0,0
80,160,11264,1536,torch.float8_e4m3fn,100,0,30.1239,a8w8_bpreshuffle_256x32x256x128_16x16_16x16_8x32x1_8x32x1_1x32x1x8_8x8x1_2x1_intrawave_v1,0,0,0
80,160,24576,1536,torch.float8_e4m3fn,93,0,55.5159,a8w8_bpreshuffle_256x64x192x128_16x16_16x16_8x32x1_8x32x1_1x32x1x8_8x8x1_2x1_intrawave_v3,0,0,0
80,160,32768,512,torch.float8_e4m3fn,84,0,34.3591,a8w8_bpreshuffle_256x32x128x128_16x16_16x16_8x32x1_8x32x1_1x32x1x8_8x8x1_2x1_intrawave_v1,0,0,0
80,160,32768,1536,torch.float8_e4m3fn,100,0,73.0357,a8w8_bpreshuffle_256x32x256x128_16x16_16x16_8x32x1_8x32x1_1x32x1x8_8x8x1_2x1_intrawave_v1,0,0,0
80,160,36864,7168,torch.float8_e4m3fn,156,0,267.3258,a8w8_bpreshuffle_256x160x256x128_16x16_16x16_8x32x1_8x32x1_1x16x1x16_8x8x1_1x2_intrawave_v3,0,0,0
80,192,128,7168,torch.float8_e4m3fn,10,0,10.2034,a8w8_bpreshuffle_128x16x32x512_16x16_16x16_32x4x1_32x4x1_1x16x1x8_4x4x1_1x1_intrawave_v1,0,0,0
80,192,512,7168,torch.float8_e4m3fn,10,0,16.0911,a8w8_bpreshuffle_128x16x32x512_16x16_16x16_32x4x1_32x4x1_1x16x1x8_4x4x1_1x1_intrawave_v1,0,0,0
80,192,576,7168,torch.float8_e4m3fn,10,0,17.0079,a8w8_bpreshuffle_128x16x32x512_16x16_16x16_32x4x1_32x4x1_1x16x1x8_4x4x1_1x1_intrawave_v1,0,0,0
80,192,1536,7168,torch.float8_e4m3fn,114,0,24.0194,a8w8_bpreshuffle_256x64x64x256_16x16_16x16_16x16x1_16x16x1_1x32x1x8_8x8x1_2x1_intrawave_v3,0,0,0
80,192,2112,7168,torch.float8_e4m3fn,126,0,32.1086,a8w8_bpreshuffle_256x32x192x256_16x16_16x16_16x16x1_16x16x1_1x32x1x8_8x8x1_2x1_intrawave_v1,0,0,0
80,192,2240,7168,torch.float8_e4m3fn,113,0,32.2862,a8w8_bpreshuffle_256x48x64x256_16x16_16x16_16x16x1_16x16x1_1x16x1x16_4x4x1_1x1_intrawave_v1,0,0,0
80,192,3072,1536,torch.float8_e4m3fn,119,0,12.4325,a8w8_bpreshuffle_256x32x128x256_16x16_16x16_16x16x1_16x16x1_1x16x1x16_8x8x1_1x2_intrawave_v1,0,0,0
80,192,4096,512,torch.float8_e4m3fn,84,0,9.9422,a8w8_bpreshuffle_256x32x128x128_16x16_16x16_8x32x1_8x32x1_1x32x1x8_8x8x1_2x1_intrawave_v1,0,0,0
80,192,4096,7168,torch.float8_e4m3fn,123,0,49.1457,a8w8_bpreshuffle_256x96x128x256_16x16_16x16_16x16x1_16x16x1_1x16x1x16_8x8x1_1x2_intrawave_v3,0,0,0
80,192,4608,7168,torch.float8_e4m3fn,128,0,47.9264,a8w8_bpreshuffle_256x64x192x256_16x16_16x16_16x16x1_16x16x1_1x32x1x8_8x8x1_2x1_intrawave_v3,0,0,0
80,192,7168,256,torch.float8_e4m3fn,73,0,10.5659,a8w8_bpreshuffle_256x32x256x64_16x16_16x16_4x32x1_4x64x1_1x32x1x8_8x8x1_2x1_intrawave_v1,0,0,0
80,192,7168,2048,torch.float8_e4m3fn,120,0,28.1354,a8w8_bpreshuffle_256x48x128x256_16x16_16x16_16x16x1_16x16x1_1x16x1x16_8x8x1_1x2_intrawave_v1,0,0,0
80,192,7168,2304,torch.float8_e4m3fn,120,0,29.5015,a8w8_bpreshuffle_256x48x128x256_16x16_16x16_16x16x1_16x16x1_1x16x1x16_8x8x1_1x2_intrawave_v1,0,0,0
80,192,7168,16384,torch.float8_e4m3fn,120,0,162.2601,a8w8_bpreshuffle_256x48x128x256_16x16_16x16_16x16x1_16x16x1_1x16x1x16_8x8x1_1x2_intrawave_v1,0,0,0
80,192,7168,18432,torch.float8_e4m3fn,120,0,181.5802,a8w8_bpreshuffle_256x48x128x256_16x16_16x16_16x16x1_16x16x1_1x16x1x16_8x8x1_1x2_intrawave_v1,0,0,0
80,192,8192,1536,torch.float8_e4m3fn,86,0,24.7435,a8w8_bpreshuffle_256x96x128x128_16x16_16x16_8x32x1_8x32x1_1x32x1x8_8x8x1_2x1_intrawave_v3,0,0,0
80,192,11264,1536,torch.float8_e4m3fn,85,0,31.3634,a8w8_bpreshuffle_256x64x128x128_16x16_16x16_8x32x1_8x32x1_1x32x1x8_8x8x1_2x1_intrawave_v3,0,0,0
80,192,24576,1536,torch.float8_e4m3fn,93,0,55.8139,a8w8_bpreshuffle_256x64x192x128_16x16_16x16_8x32x1_8x32x1_1x32x1x8_8x8x1_2x1_intrawave_v3,0,0,0
80,192,32768,512,torch.float8_e4m3fn,85,0,37.0759,a8w8_bpreshuffle_256x64x128x128_16x16_16x16_8x32x1_8x32x1_1x32x1x8_8x8x1_2x1_intrawave_v3,0,0,0
80,192,32768,1536,torch.float8_e4m3fn,85,0,73.3389,a8w8_bpreshuffle_256x64x128x128_16x16_16x16_8x32x1_8x32x1_1x32x1x8_8x8x1_2x1_intrawave_v3,0,0,0
80,192,36864,7168,torch.float8_e4m3fn,94,0,286.0543,a8w8_bpreshuffle_256x96x192x128_16x16_16x16_8x32x1_8x32x1_1x32x1x8_8x8x1_2x1_intrawave_v3,0,0,0
80,224,128,7168,torch.float8_e4m3fn,24,0,10.2858,a8w8_bpreshuffle_128x16x32x512_16x16_16x16_32x4x1_32x4x1_1x16x1x8_4x4x1_1x1_intrawave_v2,0,0,0
80,224,512,7168,torch.float8_e4m3fn,19,0,17.1051,a8w8_bpreshuffle_256x16x64x512_16x16_16x16_32x8x1_32x8x1_1x16x1x16_4x4x1_1x1_intrawave_v2,0,0,0
80,224,576,7168,torch.float8_e4m3fn,25,0,17.1379,a8w8_bpreshuffle_256x16x64x512_16x16_16x16_32x8x1_32x8x1_1x16x1x16_4x4x1_1x1_intrawave_v2,0,0,0
80,224,1536,7168,torch.float8_e4m3fn,115,0,31.7078,a8w8_bpreshuffle_256x80x64x256_16x16_16x16_16x16x1_16x16x1_1x16x1x16_4x4x1_1x1_intrawave_v3,0,0,0
80,224,2112,7168,torch.float8_e4m3fn,126,0,32.5198,a8w8_bpreshuffle_256x32x192x256_16x16_16x16_16x16x1_16x16x1_1x32x1x8_8x8x1_2x1_intrawave_v1,0,0,0
80,224,2240,7168,torch.float8_e4m3fn,117,0,37.5099,a8w8_bpreshuffle_256x112x64x256_16x16_16x16_16x16x1_16x16x1_1x16x1x16_4x4x1_1x1_intrawave_v3,0,0,0
80,224,3072,1536,torch.float8_e4m3fn,113,0,14.6673,a8w8_bpreshuffle_256x48x64x256_16x16_16x16_16x16x1_16x16x1_1x16x1x16_4x4x1_1x1_intrawave_v1,0,0,0
80,224,4096,512,torch.float8_e4m3fn,76,0,10.187,a8w8_bpreshuffle_256x32x64x128_16x16_16x16_8x32x1_8x32x1_1x32x1x8_8x8x1_2x1_intrawave_v1,0,0,0
80,224,4096,7168,torch.float8_e4m3fn,120,0,52.8765,a8w8_bpreshuffle_256x48x128x256_16x16_16x16_16x16x1_16x16x1_1x16x1x16_8x8x1_1x2_intrawave_v1,0,0,0
80,224,4608,7168,torch.float8_e4m3fn,124,0,56.3824,a8w8_bpreshuffle_256x112x128x256_16x16_16x16_16x16x1_16x16x1_1x16x1x16_8x8x1_1x2_intrawave_v3,0,0,0
80,224,7168,256,torch.float8_e4m3fn,73,0,10.9003,a8w8_bpreshuffle_256x32x256x64_16x16_16x16_4x32x1_4x64x1_1x32x1x8_8x8x1_2x1_intrawave_v1,0,0,0
80,224,7168,2048,torch.float8_e4m3fn,85,0,30.5218,a8w8_bpreshuffle_256x64x128x128_16x16_16x16_8x32x1_8x32x1_1x32x1x8_8x8x1_2x1_intrawave_v3,0,0,0
80,224,7168,2304,torch.float8_e4m3fn,85,0,32.8835,a8w8_bpreshuffle_256x64x128x128_16x16_16x16_8x32x1_8x32x1_1x32x1x8_8x8x1_2x1_intrawave_v3,0,0,0
80,224,7168,16384,torch.float8_e4m3fn,85,0,185.5598,a8w8_bpreshuffle_256x64x128x128_16x16_16x16_8x32x1_8x32x1_1x32x1x8_8x8x1_2x1_intrawave_v3,0,0,0
80,224,7168,18432,torch.float8_e4m3fn,85,0,207.6011,a8w8_bpreshuffle_256x64x128x128_16x16_16x16_8x32x1_8x32x1_1x32x1x8_8x8x1_2x1_intrawave_v3,0,0,0
80,224,8192,1536,torch.float8_e4m3fn,100,0,28.8459,a8w8_bpreshuffle_256x32x256x128_16x16_16x16_8x32x1_8x32x1_1x32x1x8_8x8x1_2x1_intrawave_v1,0,0,0
80,224,11264,1536,torch.float8_e4m3fn,100,0,37.6656,a8w8_bpreshuffle_256x32x256x128_16x16_16x16_8x32x1_8x32x1_1x32x1x8_8x8x1_2x1_intrawave_v1,0,0,0
80,224,24576,1536,torch.float8_e4m3fn,85,0,71.3416,a8w8_bpreshuffle_256x64x128x128_16x16_16x16_8x32x1_8x32x1_1x32x1x8_8x8x1_2x1_intrawave_v3,0,0,0
80,224,32768,512,torch.float8_e4m3fn,84,0,45.0439,a8w8_bpreshuffle_256x32x128x128_16x16_16x16_8x32x1_8x32x1_1x32x1x8_8x8x1_2x1_intrawave_v1,0,0,0
80,224,32768,1536,torch.float8_e4m3fn,85,0,91.0766,a8w8_bpreshuffle_256x64x128x128_16x16_16x16_8x32x1_8x32x1_1x32x1x8_8x8x1_2x1_intrawave_v3,0,0,0
80,224,36864,7168,torch.float8_e4m3fn,40,0,377.2671,a8w8_bpreshuffle_256x224x256x128_16x16_16x16_8x32x1_8x32x1_1x32x1x8_8x8x1_2x1_intrawave_v3,0,0,0
80,256,128,7168,torch.float8_e4m3fn,10,0,10.8778,a8w8_bpreshuffle_128x16x32x512_16x16_16x16_32x4x1_32x4x1_1x16x1x8_4x4x1_1x1_intrawave_v1,0,0,0
80,256,2240,7168,torch.float8_e4m3fn,114,0,37.1525,a8w8_bpreshuffle_256x64x64x256_16x16_16x16_16x16x1_16x16x1_1x32x1x8_8x8x1_2x1_intrawave_v3,0,0,0
80,256,4096,7168,torch.float8_e4m3fn,85,0,60.0334,a8w8_bpreshuffle_256x64x128x128_16x16_16x16_8x32x1_8x32x1_1x32x1x8_8x8x1_2x1_intrawave_v3,0,0,0
80,256,7168,16384,torch.float8_e4m3fn,85,0,186.0958,a8w8_bpreshuffle_256x64x128x128_16x16_16x16_8x32x1_8x32x1_1x32x1x8_8x8x1_2x1_intrawave_v3,0,0,0
80,256,7168,18432,torch.float8_e4m3fn,85,0,209.5107,a8w8_bpreshuffle_256x64x128x128_16x16_16x16_8x32x1_8x32x1_1x32x1x8_8x8x1_2x1_intrawave_v3,0,0,0
80,256,8192,1536,torch.float8_e4m3fn,85,0,30.3059,a8w8_bpreshuffle_256x64x128x128_16x16_16x16_8x32x1_8x32x1_1x32x1x8_8x8x1_2x1_intrawave_v3,0,0,0
80,256,11264,1536,torch.float8_e4m3fn,85,0,41.1,a8w8_bpreshuffle_256x64x128x128_16x16_16x16_8x32x1_8x32x1_1x32x1x8_8x8x1_2x1_intrawave_v3,0,0,0
80,256,24576,1536,torch.float8_e4m3fn,85,0,72.5312,a8w8_bpreshuffle_256x64x128x128_16x16_16x16_8x32x1_8x32x1_1x32x1x8_8x8x1_2x1_intrawave_v3,0,0,0
80,256,32768,512,torch.float8_e4m3fn,85,0,46.3119,a8w8_bpreshuffle_256x64x128x128_16x16_16x16_8x32x1_8x32x1_1x32x1x8_8x8x1_2x1_intrawave_v3,0,0,0
80,256,32768,1536,torch.float8_e4m3fn,85,0,92.2438,a8w8_bpreshuffle_256x64x128x128_16x16_16x16_8x32x1_8x32x1_1x32x1x8_8x8x1_2x1_intrawave_v3,0,0,0
80,256,36864,7168,torch.float8_e4m3fn,68,0,371.2046,a8w8_bpreshuffle_256x128x192x128_16x16_16x16_8x32x1_8x32x1_1x32x1x8_8x8x1_2x1_intrawave_v3,0,0,0
80,288,128,7168,torch.float8_e4m3fn,10,0,10.7298,a8w8_bpreshuffle_128x16x32x512_16x16_16x16_32x4x1_32x4x1_1x16x1x8_4x4x1_1x1_intrawave_v1,0,0,0
80,288,512,7168,torch.float8_e4m3fn,6,0,17.6475,a8w8_bpreshuffle_256x16x128x512_16x16_16x16_32x8x1_32x8x1_1x16x1x16_8x8x1_1x2_intrawave_v1,0,0,0
80,288,576,7168,torch.float8_e4m3fn,113,0,21.2123,a8w8_bpreshuffle_256x48x64x256_16x16_16x16_16x16x1_16x16x1_1x16x1x16_4x4x1_1x1_intrawave_v1,0,0,0
80,288,1536,7168,torch.float8_e4m3fn,120,0,29.6846,a8w8_bpreshuffle_256x48x128x256_16x16_16x16_16x16x1_16x16x1_1x16x1x16_8x8x1_1x2_intrawave_v1,0,0,0
80,288,2112,7168,torch.float8_e4m3fn,113,0,44.2402,a8w8_bpreshuffle_256x48x64x256_16x16_16x16_16x16x1_16x16x1_1x16x1x16_4x4x1_1x1_intrawave_v1,0,0,0
80,288,2240,7168,torch.float8_e4m3fn,113,0,44.5,a8w8_bpreshuffle_256x48x64x256_16x16_16x16_16x16x1_16x16x1_1x16x1x16_4x4x1_1x1_intrawave_v1,0,0,0
80,288,3072,1536,torch.float8_e4m3fn,120,0,16.2173,a8w8_bpreshuffle_256x48x128x256_16x16_16x16_16x16x1_16x16x1_1x16x1x16_8x8x1_1x2_intrawave_v1,0,0,0
80,288,4096,512,torch.float8_e4m3fn,85,0,10.8502,a8w8_bpreshuffle_256x64x128x128_16x16_16x16_8x32x1_8x32x1_1x32x1x8_8x8x1_2x1_intrawave_v3,0,0,0
80,288,4096,7168,torch.float8_e4m3fn,85,0,62.9998,a8w8_bpreshuffle_256x64x128x128_16x16_16x16_8x32x1_8x32x1_1x32x1x8_8x8x1_2x1_intrawave_v3,0,0,0
80,288,4608,7168,torch.float8_e4m3fn,130,0,66.7012,a8w8_bpreshuffle_256x96x192x256_16x16_16x16_16x16x1_16x16x1_1x32x1x8_8x8x1_2x1_intrawave_v3,0,0,0
80,288,7168,256,torch.float8_e4m3fn,72,0,12.7115,a8w8_bpreshuffle_256x64x256x64_16x16_16x16_4x64x1_4x64x1_1x16x1x16_8x8x1_1x2_intrawave_v1,0,0,0
80,288,7168,2048,torch.float8_e4m3fn,85,0,38.1402,a8w8_bpreshuffle_256x64x128x128_16x16_16x16_8x32x1_8x32x1_1x32x1x8_8x8x1_2x1_intrawave_v3,0,0,0
80,288,7168,2304,torch.float8_e4m3fn,85,0,40.9768,a8w8_bpreshuffle_256x64x128x128_16x16_16x16_8x32x1_8x32x1_1x32x1x8_8x8x1_2x1_intrawave_v3,0,0,0
80,288,7168,16384,torch.float8_e4m3fn,85,0,243.1421,a8w8_bpreshuffle_256x64x128x128_16x16_16x16_8x32x1_8x32x1_1x32x1x8_8x8x1_2x1_intrawave_v3,0,0,0
80,288,7168,18432,torch.float8_e4m3fn,85,0,272.1414,a8w8_bpreshuffle_256x64x128x128_16x16_16x16_8x32x1_8x32x1_1x32x1x8_8x8x1_2x1_intrawave_v3,0,0,0
80,288,8192,1536,torch.float8_e4m3fn,85,0,32.0963,a8w8_bpreshuffle_256x64x128x128_16x16_16x16_8x32x1_8x32x1_1x32x1x8_8x8x1_2x1_intrawave_v3,0,0,0
80,288,11264,1536,torch.float8_e4m3fn,102,0,42.7952,a8w8_bpreshuffle_256x96x256x128_16x16_16x16_8x32x1_8x32x1_1x32x1x8_8x8x1_2x1_intrawave_v3,0,0,0
80,288,24576,1536,torch.float8_e4m3fn,94,0,79.4368,a8w8_bpreshuffle_256x96x192x128_16x16_16x16_8x32x1_8x32x1_1x32x1x8_8x8x1_2x1_intrawave_v3,0,0,0
80,288,32768,512,torch.float8_e4m3fn,84,0,53.506,a8w8_bpreshuffle_256x32x128x128_16x16_16x16_8x32x1_8x32x1_1x32x1x8_8x8x1_2x1_intrawave_v1,0,0,0
80,288,32768,1536,torch.float8_e4m3fn,102,0,101.9306,a8w8_bpreshuffle_256x96x256x128_16x16_16x16_8x32x1_8x32x1_1x32x1x8_8x8x1_2x1_intrawave_v3,0,0,0
80,288,36864,7168,torch.float8_e4m3fn,102,0,437.3066,a8w8_bpreshuffle_256x96x256x128_16x16_16x16_8x32x1_8x32x1_1x32x1x8_8x8x1_2x1_intrawave_v3,0,0,0
80,320,128,7168,torch.float8_e4m3fn,24,0,10.9094,a8w8_bpreshuffle_128x16x32x512_16x16_16x16_32x4x1_32x4x1_1x16x1x8_4x4x1_1x1_intrawave_v2,0,0,0
80,320,512,7168,torch.float8_e4m3fn,6,0,17.8315,a8w8_bpreshuffle_256x16x128x512_16x16_16x16_32x8x1_32x8x1_1x16x1x16_8x8x1_1x2_intrawave_v1,0,0,0
80,320,576,7168,torch.float8_e4m3fn,112,0,22.5067,a8w8_bpreshuffle_256x32x64x256_16x16_16x16_16x16x1_16x16x1_1x32x1x8_8x8x1_2x1_intrawave_v1,0,0,0
80,320,1536,7168,torch.float8_e4m3fn,126,0,32.1157,a8w8_bpreshuffle_256x32x192x256_16x16_16x16_16x16x1_16x16x1_1x32x1x8_8x8x1_2x1_intrawave_v1,0,0,0
80,320,2112,7168,torch.float8_e4m3fn,113,0,45.9122,a8w8_bpreshuffle_256x48x64x256_16x16_16x16_16x16x1_16x16x1_1x16x1x16_4x4x1_1x1_intrawave_v1,0,0,0
80,320,2240,7168,torch.float8_e4m3fn,78,0,53.8992,a8w8_bpreshuffle_256x96x64x128_16x16_16x16_8x32x1_8x32x1_1x32x1x8_8x8x1_2x1_intrawave_v3,0,0,0
80,320,3072,1536,torch.float8_e4m3fn,119,0,16.7997,a8w8_bpreshuffle_256x32x128x256_16x16_16x16_16x16x1_16x16x1_1x16x1x16_8x8x1_1x2_intrawave_v1,0,0,0
80,320,4096,512,torch.float8_e4m3fn,84,0,10.783,a8w8_bpreshuffle_256x32x128x128_16x16_16x16_8x32x1_8x32x1_1x32x1x8_8x8x1_2x1_intrawave_v1,0,0,0
80,320,4096,7168,torch.float8_e4m3fn,121,0,63.2822,a8w8_bpreshuffle_256x64x128x256_16x16_16x16_16x16x1_16x16x1_1x16x1x16_8x8x1_1x2_intrawave_v3,0,0,0
80,320,4608,7168,torch.float8_e4m3fn,136,0,72.1189,a8w8_bpreshuffle_256x80x256x256_16x16_16x16_16x16x1_16x16x1_1x16x1x16_8x8x1_1x2_intrawave_v3,0,0,0
80,320,7168,256,torch.float8_e4m3fn,74,0,13.0231,a8w8_bpreshuffle_256x64x256x64_16x16_16x16_4x64x1_4x64x1_1x32x1x8_8x8x1_2x1_intrawave_v1,0,0,0
80,320,7168,2048,torch.float8_e4m3fn,85,0,38.8094,a8w8_bpreshuffle_256x64x128x128_16x16_16x16_8x32x1_8x32x1_1x32x1x8_8x8x1_2x1_intrawave_v3,0,0,0
80,320,7168,2304,torch.float8_e4m3fn,85,0,40.2392,a8w8_bpreshuffle_256x64x128x128_16x16_16x16_8x32x1_8x32x1_1x32x1x8_8x8x1_2x1_intrawave_v3,0,0,0
80,320,7168,16384,torch.float8_e4m3fn,101,0,239.9889,a8w8_bpreshuffle_256x64x256x128_16x16_16x16_8x32x1_8x32x1_1x32x1x8_8x8x1_2x1_intrawave_v3,0,0,0
80,320,7168,18432,torch.float8_e4m3fn,101,0,270.4958,a8w8_bpreshuffle_256x64x256x128_16x16_16x16_8x32x1_8x32x1_1x32x1x8_8x8x1_2x1_intrawave_v3,0,0,0
80,320,8192,1536,torch.float8_e4m3fn,101,0,32.6299,a8w8_bpreshuffle_256x64x256x128_16x16_16x16_8x32x1_8x32x1_1x32x1x8_8x8x1_2x1_intrawave_v3,0,0,0
80,320,11264,1536,torch.float8_e4m3fn,85,0,45.0808,a8w8_bpreshuffle_256x64x128x128_16x16_16x16_8x32x1_8x32x1_1x32x1x8_8x8x1_2x1_intrawave_v3,0,0,0
80,320,24576,1536,torch.float8_e4m3fn,93,0,84.1633,a8w8_bpreshuffle_256x64x192x128_16x16_16x16_8x32x1_8x32x1_1x32x1x8_8x8x1_2x1_intrawave_v3,0,0,0
80,320,32768,512,torch.float8_e4m3fn,85,0,55.0543,a8w8_bpreshuffle_256x64x128x128_16x16_16x16_8x32x1_8x32x1_1x32x1x8_8x8x1_2x1_intrawave_v3,0,0,0
80,320,32768,1536,torch.float8_e4m3fn,85,0,114.3911,a8w8_bpreshuffle_256x64x128x128_16x16_16x16_8x32x1_8x32x1_1x32x1x8_8x8x1_2x1_intrawave_v3,0,0,0
80,320,36864,7168,torch.float8_e4m3fn,128,0,476.2091,a8w8_bpreshuffle_256x64x192x256_16x16_16x16_16x16x1_16x16x1_1x32x1x8_8x8x1_2x1_intrawave_v3,0,0,0
80,352,128,7168,torch.float8_e4m3fn,10,0,11.2254,a8w8_bpreshuffle_128x16x32x512_16x16_16x16_32x4x1_32x4x1_1x16x1x8_4x4x1_1x1_intrawave_v1,0,0,0
80,352,512,7168,torch.float8_e4m3fn,112,0,22.2763,a8w8_bpreshuffle_256x32x64x256_16x16_16x16_16x16x1_16x16x1_1x32x1x8_8x8x1_2x1_intrawave_v1,0,0,0
80,352,576,7168,torch.float8_e4m3fn,112,0,22.5607,a8w8_bpreshuffle_256x32x64x256_16x16_16x16_16x16x1_16x16x1_1x32x1x8_8x8x1_2x1_intrawave_v1,0,0,0
80,352,1536,7168,torch.float8_e4m3fn,133,0,39.9737,a8w8_bpreshuffle_256x32x256x256_16x16_16x16_16x16x1_16x16x1_1x16x1x16_8x8x1_1x2_intrawave_v1,0,0,0
80,352,2112,7168,torch.float8_e4m3fn,128,0,49.7251,a8w8_bpreshuffle_256x64x192x256_16x16_16x16_16x16x1_16x16x1_1x32x1x8_8x8x1_2x1_intrawave_v3,0,0,0
80,352,2240,7168,torch.float8_e4m3fn,78,0,54.0168,a8w8_bpreshuffle_256x96x64x128_16x16_16x16_8x32x1_8x32x1_1x32x1x8_8x8x1_2x1_intrawave_v3,0,0,0
80,352,3072,1536,torch.float8_e4m3fn,85,0,18.9609,a8w8_bpreshuffle_256x64x128x128_16x16_16x16_8x32x1_8x32x1_1x32x1x8_8x8x1_2x1_intrawave_v3,0,0,0
80,352,4096,512,torch.float8_e4m3fn,84,0,12.0603,a8w8_bpreshuffle_256x32x128x128_16x16_16x16_8x32x1_8x32x1_1x32x1x8_8x8x1_2x1_intrawave_v1,0,0,0
80,352,4096,7168,torch.float8_e4m3fn,136,0,74.9351,a8w8_bpreshuffle_256x80x256x256_16x16_16x16_16x16x1_16x16x1_1x16x1x16_8x8x1_1x2_intrawave_v3,0,0,0
80,352,4608,7168,torch.float8_e4m3fn,128,0,84.2541,a8w8_bpreshuffle_256x64x192x256_16x16_16x16_16x16x1_16x16x1_1x32x1x8_8x8x1_2x1_intrawave_v3,0,0,0
80,352,7168,256,torch.float8_e4m3fn,75,0,15.1695,a8w8_bpreshuffle_128x16x256x64_16x16_16x16_4x16x1_4x32x1_1x16x1x8_8x8x1_1x2_intrawave_v1,0,0,0
80,352,7168,2048,torch.float8_e4m3fn,100,0,45.5887,a8w8_bpreshuffle_256x32x256x128_16x16_16x16_8x32x1_8x32x1_1x32x1x8_8x8x1_2x1_intrawave_v1,0,0,0
80,352,7168,2304,torch.float8_e4m3fn,100,0,49.1372,a8w8_bpreshuffle_256x32x256x128_16x16_16x16_8x32x1_8x32x1_1x32x1x8_8x8x1_2x1_intrawave_v1,0,0,0
80,352,7168,16384,torch.float8_e4m3fn,86,0,289.7112,a8w8_bpreshuffle_256x96x128x128_16x16_16x16_8x32x1_8x32x1_1x32x1x8_8x8x1_2x1_intrawave_v3,0,0,0
80,352,7168,18432,torch.float8_e4m3fn,86,0,324.6944,a8w8_bpreshuffle_256x96x128x128_16x16_16x16_8x32x1_8x32x1_1x32x1x8_8x8x1_2x1_intrawave_v3,0,0,0
80,352,8192,1536,torch.float8_e4m3fn,85,0,38.7583,a8w8_bpreshuffle_256x64x128x128_16x16_16x16_8x32x1_8x32x1_1x32x1x8_8x8x1_2x1_intrawave_v3,0,0,0
80,352,11264,1536,torch.float8_e4m3fn,85,0,51.422,a8w8_bpreshuffle_256x64x128x128_16x16_16x16_8x32x1_8x32x1_1x32x1x8_8x8x1_2x1_intrawave_v3,0,0,0
80,352,24576,1536,torch.float8_e4m3fn,93,0,101.4118,a8w8_bpreshuffle_256x64x192x128_16x16_16x16_8x32x1_8x32x1_1x32x1x8_8x8x1_2x1_intrawave_v3,0,0,0
80,352,32768,512,torch.float8_e4m3fn,72,0,64.3624,a8w8_bpreshuffle_256x64x256x64_16x16_16x16_4x64x1_4x64x1_1x16x1x16_8x8x1_1x2_intrawave_v1,0,0,0
80,352,32768,1536,torch.float8_e4m3fn,71,0,132.552,a8w8_bpreshuffle_256x128x128x64_16x16_16x16_4x64x1_4x64x1_1x32x1x8_8x8x1_2x1_intrawave_v3,0,0,0
80,352,36864,7168,torch.float8_e4m3fn,71,0,568.6663,a8w8_bpreshuffle_256x128x128x64_16x16_16x16_4x64x1_4x64x1_1x32x1x8_8x8x1_2x1_intrawave_v3,0,0,0
80,384,128,7168,torch.float8_e4m3fn,10,0,11.3822,a8w8_bpreshuffle_128x16x32x512_16x16_16x16_32x4x1_32x4x1_1x16x1x8_4x4x1_1x1_intrawave_v1,0,0,0
80,384,512,7168,torch.float8_e4m3fn,113,0,21.2655,a8w8_bpreshuffle_256x48x64x256_16x16_16x16_16x16x1_16x16x1_1x16x1x16_4x4x1_1x1_intrawave_v1,0,0,0
80,384,576,7168,torch.float8_e4m3fn,113,0,21.2619,a8w8_bpreshuffle_256x48x64x256_16x16_16x16_16x16x1_16x16x1_1x16x1x16_4x4x1_1x1_intrawave_v1,0,0,0
80,384,1536,7168,torch.float8_e4m3fn,114,0,37.6905,a8w8_bpreshuffle_256x64x64x256_16x16_16x16_16x16x1_16x16x1_1x32x1x8_8x8x1_2x1_intrawave_v3,0,0,0
80,384,2112,7168,torch.float8_e4m3fn,128,0,47.5375,a8w8_bpreshuffle_256x64x192x256_16x16_16x16_16x16x1_16x16x1_1x32x1x8_8x8x1_2x1_intrawave_v3,0,0,0
80,384,2240,7168,torch.float8_e4m3fn,78,0,53.062,a8w8_bpreshuffle_256x96x64x128_16x16_16x16_8x32x1_8x32x1_1x32x1x8_8x8x1_2x1_intrawave_v3,0,0,0
80,384,3072,1536,torch.float8_e4m3fn,85,0,18.7893,a8w8_bpreshuffle_256x64x128x128_16x16_16x16_8x32x1_8x32x1_1x32x1x8_8x8x1_2x1_intrawave_v3,0,0,0
80,384,4096,512,torch.float8_e4m3fn,84,0,12.2599,a8w8_bpreshuffle_256x32x128x128_16x16_16x16_8x32x1_8x32x1_1x32x1x8_8x8x1_2x1_intrawave_v1,0,0,0
80,384,4096,7168,torch.float8_e4m3fn,86,0,81.866,a8w8_bpreshuffle_256x96x128x128_16x16_16x16_8x32x1_8x32x1_1x32x1x8_8x8x1_2x1_intrawave_v3,0,0,0
80,384,4608,7168,torch.float8_e4m3fn,93,0,81.9457,a8w8_bpreshuffle_256x64x192x128_16x16_16x16_8x32x1_8x32x1_1x32x1x8_8x8x1_2x1_intrawave_v3,0,0,0
80,384,7168,256,torch.float8_e4m3fn,72,0,15.1515,a8w8_bpreshuffle_256x64x256x64_16x16_16x16_4x64x1_4x64x1_1x16x1x16_8x8x1_1x2_intrawave_v1,0,0,0
80,384,7168,2048,torch.float8_e4m3fn,86,0,45.0074,a8w8_bpreshuffle_256x96x128x128_16x16_16x16_8x32x1_8x32x1_1x32x1x8_8x8x1_2x1_intrawave_v3,0,0,0
80,384,7168,2304,torch.float8_e4m3fn,86,0,48.0036,a8w8_bpreshuffle_256x96x128x128_16x16_16x16_8x32x1_8x32x1_1x32x1x8_8x8x1_2x1_intrawave_v3,0,0,0
80,384,7168,16384,torch.float8_e4m3fn,86,0,268.8438,a8w8_bpreshuffle_256x96x128x128_16x16_16x16_8x32x1_8x32x1_1x32x1x8_8x8x1_2x1_intrawave_v3,0,0,0
80,384,7168,18432,torch.float8_e4m3fn,86,0,300.0663,a8w8_bpreshuffle_256x96x128x128_16x16_16x16_8x32x1_8x32x1_1x32x1x8_8x8x1_2x1_intrawave_v3,0,0,0
80,384,8192,1536,torch.float8_e4m3fn,85,0,38.4623,a8w8_bpreshuffle_256x64x128x128_16x16_16x16_8x32x1_8x32x1_1x32x1x8_8x8x1_2x1_intrawave_v3,0,0,0
80,384,11264,1536,torch.float8_e4m3fn,85,0,51.3588,a8w8_bpreshuffle_256x64x128x128_16x16_16x16_8x32x1_8x32x1_1x32x1x8_8x8x1_2x1_intrawave_v3,0,0,0
80,384,24576,1536,torch.float8_e4m3fn,93,0,99.8625,a8w8_bpreshuffle_256x64x192x128_16x16_16x16_8x32x1_8x32x1_1x32x1x8_8x8x1_2x1_intrawave_v3,0,0,0
80,384,32768,512,torch.float8_e4m3fn,85,0,63.438,a8w8_bpreshuffle_256x64x128x128_16x16_16x16_8x32x1_8x32x1_1x32x1x8_8x8x1_2x1_intrawave_v3,0,0,0
80,384,32768,1536,torch.float8_e4m3fn,71,0,132.9488,a8w8_bpreshuffle_256x128x128x64_16x16_16x16_4x64x1_4x64x1_1x32x1x8_8x8x1_2x1_intrawave_v3,0,0,0
80,384,36864,7168,torch.float8_e4m3fn,94,0,555.2415,a8w8_bpreshuffle_256x96x192x128_16x16_16x16_8x32x1_8x32x1_1x32x1x8_8x8x1_2x1_intrawave_v3,0,0,0
80,416,128,7168,torch.float8_e4m3fn,24,0,11.6798,a8w8_bpreshuffle_128x16x32x512_16x16_16x16_32x4x1_32x4x1_1x16x1x8_4x4x1_1x1_intrawave_v2,0,0,0
80,416,512,7168,torch.float8_e4m3fn,112,0,22.5591,a8w8_bpreshuffle_256x32x64x256_16x16_16x16_16x16x1_16x16x1_1x32x1x8_8x8x1_2x1_intrawave_v1,0,0,0
80,416,576,7168,torch.float8_e4m3fn,112,0,22.8351,a8w8_bpreshuffle_256x32x64x256_16x16_16x16_16x16x1_16x16x1_1x32x1x8_8x8x1_2x1_intrawave_v1,0,0,0
80,416,1536,7168,torch.float8_e4m3fn,119,0,38.3401,a8w8_bpreshuffle_256x32x128x256_16x16_16x16_16x16x1_16x16x1_1x16x1x16_8x8x1_1x2_intrawave_v1,0,0,0
80,416,2240,7168,torch.float8_e4m3fn,113,0,62.1588,a8w8_bpreshuffle_256x48x64x256_16x16_16x16_16x16x1_16x16x1_1x16x1x16_4x4x1_1x1_intrawave_v1,0,0,0
80,416,3072,1536,torch.float8_e4m3fn,100,0,20.7247,a8w8_bpreshuffle_256x32x256x128_16x16_16x16_8x32x1_8x32x1_1x32x1x8_8x8x1_2x1_intrawave_v1,0,0,0
80,416,4096,512,torch.float8_e4m3fn,85,0,13.5035,a8w8_bpreshuffle_256x64x128x128_16x16_16x16_8x32x1_8x32x1_1x32x1x8_8x8x1_2x1_intrawave_v3,0,0,0
80,416,4096,7168,torch.float8_e4m3fn,85,0,86.134,a8w8_bpreshuffle_256x64x128x128_16x16_16x16_8x32x1_8x32x1_1x32x1x8_8x8x1_2x1_intrawave_v3,0,0,0
80,416,4608,7168,torch.float8_e4m3fn,138,0,101.4186,a8w8_bpreshuffle_256x112x256x256_16x16_16x16_16x16x1_16x16x1_1x16x1x16_8x8x1_1x2_intrawave_v3,0,0,0
80,416,7168,256,torch.float8_e4m3fn,74,0,15.9059,a8w8_bpreshuffle_256x64x256x64_16x16_16x16_4x64x1_4x64x1_1x32x1x8_8x8x1_2x1_intrawave_v1,0,0,0
80,416,7168,2048,torch.float8_e4m3fn,85,0,48.1552,a8w8_bpreshuffle_256x64x128x128_16x16_16x16_8x32x1_8x32x1_1x32x1x8_8x8x1_2x1_intrawave_v3,0,0,0
80,416,7168,2304,torch.float8_e4m3fn,85,0,51.2564,a8w8_bpreshuffle_256x64x128x128_16x16_16x16_8x32x1_8x32x1_1x32x1x8_8x8x1_2x1_intrawave_v3,0,0,0
80,416,7168,16384,torch.float8_e4m3fn,85,0,310.2738,a8w8_bpreshuffle_256x64x128x128_16x16_16x16_8x32x1_8x32x1_1x32x1x8_8x8x1_2x1_intrawave_v3,0,0,0
80,416,7168,18432,torch.float8_e4m3fn,85,0,352.9218,a8w8_bpreshuffle_256x64x128x128_16x16_16x16_8x32x1_8x32x1_1x32x1x8_8x8x1_2x1_intrawave_v3,0,0,0
80,416,8192,1536,torch.float8_e4m3fn,72,0,43.8675,a8w8_bpreshuffle_256x64x256x64_16x16_16x16_4x64x1_4x64x1_1x16x1x16_8x8x1_1x2_intrawave_v1,0,0,0
80,416,11264,1536,torch.float8_e4m3fn,85,0,58.2264,a8w8_bpreshuffle_256x64x128x128_16x16_16x16_8x32x1_8x32x1_1x32x1x8_8x8x1_2x1_intrawave_v3,0,0,0
80,416,24576,1536,torch.float8_e4m3fn,102,0,122.5387,a8w8_bpreshuffle_256x96x256x128_16x16_16x16_8x32x1_8x32x1_1x32x1x8_8x8x1_2x1_intrawave_v3,0,0,0
80,416,32768,512,torch.float8_e4m3fn,84,0,73.9008,a8w8_bpreshuffle_256x32x128x128_16x16_16x16_8x32x1_8x32x1_1x32x1x8_8x8x1_2x1_intrawave_v1,0,0,0
80,416,32768,1536,torch.float8_e4m3fn,85,0,155.3704,a8w8_bpreshuffle_256x64x128x128_16x16_16x16_8x32x1_8x32x1_1x32x1x8_8x8x1_2x1_intrawave_v3,0,0,0
80,416,36864,7168,torch.float8_e4m3fn,93,0,649.7863,a8w8_bpreshuffle_256x64x192x128_16x16_16x16_8x32x1_8x32x1_1x32x1x8_8x8x1_2x1_intrawave_v3,0,0,0
80,448,128,7168,torch.float8_e4m3fn,10,0,11.523,a8w8_bpreshuffle_128x16x32x512_16x16_16x16_32x4x1_32x4x1_1x16x1x8_4x4x1_1x1_intrawave_v1,0,0,0
80,448,512,7168,torch.float8_e4m3fn,112,0,22.7188,a8w8_bpreshuffle_256x32x64x256_16x16_16x16_16x16x1_16x16x1_1x32x1x8_8x8x1_2x1_intrawave_v1,0,0,0
80,448,576,7168,torch.float8_e4m3fn,112,0,22.8423,a8w8_bpreshuffle_256x32x64x256_16x16_16x16_16x16x1_16x16x1_1x32x1x8_8x8x1_2x1_intrawave_v1,0,0,0
80,448,1536,7168,torch.float8_e4m3fn,113,0,46.246,a8w8_bpreshuffle_256x48x64x256_16x16_16x16_16x16x1_16x16x1_1x16x1x16_4x4x1_1x1_intrawave_v1,0,0,0
80,448,2240,7168,torch.float8_e4m3fn,114,0,70.1253,a8w8_bpreshuffle_256x64x64x256_16x16_16x16_16x16x1_16x16x1_1x32x1x8_8x8x1_2x1_intrawave_v3,0,0,0
80,448,3072,1536,torch.float8_e4m3fn,92,0,22.3115,a8w8_bpreshuffle_256x32x192x128_16x16_16x16_8x32x1_8x32x1_1x32x1x8_8x8x1_2x1_intrawave_v1,0,0,0
80,448,4096,512,torch.float8_e4m3fn,85,0,13.3723,a8w8_bpreshuffle_256x64x128x128_16x16_16x16_8x32x1_8x32x1_1x32x1x8_8x8x1_2x1_intrawave_v3,0,0,0
80,448,4096,7168,torch.float8_e4m3fn,85,0,84.5872,a8w8_bpreshuffle_256x64x128x128_16x16_16x16_8x32x1_8x32x1_1x32x1x8_8x8x1_2x1_intrawave_v3,0,0,0
80,448,4608,7168,torch.float8_e4m3fn,138,0,97.0854,a8w8_bpreshuffle_256x112x256x256_16x16_16x16_16x16x1_16x16x1_1x16x1x16_8x8x1_1x2_intrawave_v3,0,0,0
80,448,7168,256,torch.float8_e4m3fn,72,0,15.6539,a8w8_bpreshuffle_256x64x256x64_16x16_16x16_4x64x1_4x64x1_1x16x1x16_8x8x1_1x2_intrawave_v1,0,0,0
80,448,7168,2048,torch.float8_e4m3fn,85,0,47.8488,a8w8_bpreshuffle_256x64x128x128_16x16_16x16_8x32x1_8x32x1_1x32x1x8_8x8x1_2x1_intrawave_v3,0,0,0
80,448,7168,2304,torch.float8_e4m3fn,85,0,49.72,a8w8_bpreshuffle_256x64x128x128_16x16_16x16_8x32x1_8x32x1_1x32x1x8_8x8x1_2x1_intrawave_v3,0,0,0
80,448,7168,16384,torch.float8_e4m3fn,85,0,316.355,a8w8_bpreshuffle_256x64x128x128_16x16_16x16_8x32x1_8x32x1_1x32x1x8_8x8x1_2x1_intrawave_v3,0,0,0
80,448,7168,18432,torch.float8_e4m3fn,85,0,356.7658,a8w8_bpreshuffle_256x64x128x128_16x16_16x16_8x32x1_8x32x1_1x32x1x8_8x8x1_2x1_intrawave_v3,0,0,0
80,448,8192,1536,torch.float8_e4m3fn,72,0,43.8247,a8w8_bpreshuffle_256x64x256x64_16x16_16x16_4x64x1_4x64x1_1x16x1x16_8x8x1_1x2_intrawave_v1,0,0,0
80,448,11264,1536,torch.float8_e4m3fn,85,0,57.7888,a8w8_bpreshuffle_256x64x128x128_16x16_16x16_8x32x1_8x32x1_1x32x1x8_8x8x1_2x1_intrawave_v3,0,0,0
80,448,24576,1536,torch.float8_e4m3fn,93,0,117.3539,a8w8_bpreshuffle_256x64x192x128_16x16_16x16_8x32x1_8x32x1_1x32x1x8_8x8x1_2x1_intrawave_v3,0,0,0
80,448,32768,512,torch.float8_e4m3fn,85,0,72.2692,a8w8_bpreshuffle_256x64x128x128_16x16_16x16_8x32x1_8x32x1_1x32x1x8_8x8x1_2x1_intrawave_v3,0,0,0
80,448,32768,1536,torch.float8_e4m3fn,85,0,153.3388,a8w8_bpreshuffle_256x64x128x128_16x16_16x16_8x32x1_8x32x1_1x32x1x8_8x8x1_2x1_intrawave_v3,0,0,0
80,448,36864,7168,torch.float8_e4m3fn,93,0,631.7091,a8w8_bpreshuffle_256x64x192x128_16x16_16x16_8x32x1_8x32x1_1x32x1x8_8x8x1_2x1_intrawave_v3,0,0,0
80,480,128,7168,torch.float8_e4m3fn,10,0,11.607,a8w8_bpreshuffle_128x16x32x512_16x16_16x16_32x4x1_32x4x1_1x16x1x8_4x4x1_1x1_intrawave_v1,0,0,0
80,480,512,7168,torch.float8_e4m3fn,113,0,21.5703,a8w8_bpreshuffle_256x48x64x256_16x16_16x16_16x16x1_16x16x1_1x16x1x16_4x4x1_1x1_intrawave_v1,0,0,0
80,480,576,7168,torch.float8_e4m3fn,112,0,24.5819,a8w8_bpreshuffle_256x32x64x256_16x16_16x16_16x16x1_16x16x1_1x32x1x8_8x8x1_2x1_intrawave_v1,0,0,0
80,480,1536,7168,torch.float8_e4m3fn,113,0,45.4048,a8w8_bpreshuffle_256x48x64x256_16x16_16x16_16x16x1_16x16x1_1x16x1x16_4x4x1_1x1_intrawave_v1,0,0,0
80,480,2240,7168,torch.float8_e4m3fn,62,0,70.4585,a8w8_bpreshuffle_256x128x64x128_16x16_16x16_8x32x1_8x32x1_1x32x1x8_8x8x1_2x1_intrawave_v3,0,0,0
80,480,3072,1536,torch.float8_e4m3fn,94,0,22.3915,a8w8_bpreshuffle_256x96x192x128_16x16_16x16_8x32x1_8x32x1_1x32x1x8_8x8x1_2x1_intrawave_v3,0,0,0
80,480,4096,512,torch.float8_e4m3fn,86,0,14.0771,a8w8_bpreshuffle_256x96x128x128_16x16_16x16_8x32x1_8x32x1_1x32x1x8_8x8x1_2x1_intrawave_v3,0,0,0
80,480,4096,7168,torch.float8_e4m3fn,86,0,82.8028,a8w8_bpreshuffle_256x96x128x128_16x16_16x16_8x32x1_8x32x1_1x32x1x8_8x8x1_2x1_intrawave_v3,0,0,0
80,480,4608,7168,torch.float8_e4m3fn,56,0,105.9346,a8w8_bpreshuffle_256x160x192x128_16x16_16x16_8x32x1_8x32x1_1x32x1x8_8x8x1_2x1_intrawave_v3,0,0,0
80,480,7168,256,torch.float8_e4m3fn,72,0,16.1387,a8w8_bpreshuffle_256x64x256x64_16x16_16x16_4x64x1_4x64x1_1x16x1x16_8x8x1_1x2_intrawave_v1,0,0,0
80,480,7168,2048,torch.float8_e4m3fn,102,0,52.4824,a8w8_bpreshuffle_256x96x256x128_16x16_16x16_8x32x1_8x32x1_1x32x1x8_8x8x1_2x1_intrawave_v3,0,0,0
80,480,7168,2304,torch.float8_e4m3fn,102,0,56.9516,a8w8_bpreshuffle_256x96x256x128_16x16_16x16_8x32x1_8x32x1_1x32x1x8_8x8x1_2x1_intrawave_v3,0,0,0
80,480,7168,16384,torch.float8_e4m3fn,86,0,346.0471,a8w8_bpreshuffle_256x96x128x128_16x16_16x16_8x32x1_8x32x1_1x32x1x8_8x8x1_2x1_intrawave_v3,0,0,0
80,480,7168,18432,torch.float8_e4m3fn,102,0,379.6631,a8w8_bpreshuffle_256x96x256x128_16x16_16x16_8x32x1_8x32x1_1x32x1x8_8x8x1_2x1_intrawave_v3,0,0,0
80,480,8192,1536,torch.float8_e4m3fn,102,0,43.0079,a8w8_bpreshuffle_256x96x256x128_16x16_16x16_8x32x1_8x32x1_1x32x1x8_8x8x1_2x1_intrawave_v3,0,0,0
80,480,11264,1536,torch.float8_e4m3fn,102,0,64.1117,a8w8_bpreshuffle_256x96x256x128_16x16_16x16_8x32x1_8x32x1_1x32x1x8_8x8x1_2x1_intrawave_v3,0,0,0
80,480,24576,1536,torch.float8_e4m3fn,102,0,119.4687,a8w8_bpreshuffle_256x96x256x128_16x16_16x16_8x32x1_8x32x1_1x32x1x8_8x8x1_2x1_intrawave_v3,0,0,0
80,480,32768,512,torch.float8_e4m3fn,102,0,81.2012,a8w8_bpreshuffle_256x96x256x128_16x16_16x16_8x32x1_8x32x1_1x32x1x8_8x8x1_2x1_intrawave_v3,0,0,0
80,480,32768,1536,torch.float8_e4m3fn,102,0,155.1241,a8w8_bpreshuffle_256x96x256x128_16x16_16x16_8x32x1_8x32x1_1x32x1x8_8x8x1_2x1_intrawave_v3,0,0,0
80,480,36864,7168,torch.float8_e4m3fn,102,0,655.0492,a8w8_bpreshuffle_256x96x256x128_16x16_16x16_8x32x1_8x32x1_1x32x1x8_8x8x1_2x1_intrawave_v3,0,0,0
80,512,128,7168,torch.float8_e4m3fn,11,0,12.1131,a8w8_bpreshuffle_256x16x64x512_16x16_16x16_32x8x1_32x8x1_1x16x1x16_4x4x1_1x1_intrawave_v1,0,0,0
80,512,2240,7168,torch.float8_e4m3fn,62,0,66.3638,a8w8_bpreshuffle_256x128x64x128_16x16_16x16_8x32x1_8x32x1_1x32x1x8_8x8x1_2x1_intrawave_v3,0,0,0
80,512,4096,7168,torch.float8_e4m3fn,138,0,102.7541,a8w8_bpreshuffle_256x112x256x256_16x16_16x16_16x16x1_16x16x1_1x16x1x16_8x8x1_1x2_intrawave_v3,0,0,0
80,512,7168,16384,torch.float8_e4m3fn,71,0,346.2792,a8w8_bpreshuffle_256x128x128x64_16x16_16x16_4x64x1_4x64x1_1x32x1x8_8x8x1_2x1_intrawave_v3,0,0,0
80,512,7168,18432,torch.float8_e4m3fn,70,0,389.6687,a8w8_bpreshuffle_256x128x128x128_16x16_16x16_8x32x1_8x32x1_1x32x1x8_8x8x1_2x1_intrawave_v3,0,0,0
80,512,8192,1536,torch.float8_e4m3fn,85,0,50.0471,a8w8_bpreshuffle_256x64x128x128_16x16_16x16_8x32x1_8x32x1_1x32x1x8_8x8x1_2x1_intrawave_v3,0,0,0
80,512,11264,1536,torch.float8_e4m3fn,85,0,63.9678,a8w8_bpreshuffle_256x64x128x128_16x16_16x16_8x32x1_8x32x1_1x32x1x8_8x8x1_2x1_intrawave_v3,0,0,0
80,512,24576,1536,torch.float8_e4m3fn,93,0,126.7363,a8w8_bpreshuffle_256x64x192x128_16x16_16x16_8x32x1_8x32x1_1x32x1x8_8x8x1_2x1_intrawave_v3,0,0,0
80,512,32768,512,torch.float8_e4m3fn,85,0,82.7804,a8w8_bpreshuffle_256x64x128x128_16x16_16x16_8x32x1_8x32x1_1x32x1x8_8x8x1_2x1_intrawave_v3,0,0,0
80,512,32768,1536,torch.float8_e4m3fn,71,0,167.8113,a8w8_bpreshuffle_256x128x128x64_16x16_16x16_4x64x1_4x64x1_1x32x1x8_8x8x1_2x1_intrawave_v3,0,0,0
80,512,36864,7168,torch.float8_e4m3fn,68,0,726.0635,a8w8_bpreshuffle_256x128x192x128_16x16_16x16_8x32x1_8x32x1_1x32x1x8_8x8x1_2x1_intrawave_v3,0,0,0
80,1024,128,7168,torch.float8_e4m3fn,6,0,17.8979,a8w8_bpreshuffle_256x16x128x512_16x16_16x16_32x8x1_32x8x1_1x16x1x16_8x8x1_1x2_intrawave_v1,0,0,0
80,1024,2240,7168,torch.float8_e4m3fn,114,0,120.7469,a8w8_bpreshuffle_256x64x64x256_16x16_16x16_16x16x1_16x16x1_1x32x1x8_8x8x1_2x1_intrawave_v3,0,0,0
80,1024,4096,7168,torch.float8_e4m3fn,85,0,179.0322,a8w8_bpreshuffle_256x64x128x128_16x16_16x16_8x32x1_8x32x1_1x32x1x8_8x8x1_2x1_intrawave_v3,0,0,0
80,1024,7168,16384,torch.float8_e4m3fn,85,0,661.406,a8w8_bpreshuffle_256x64x128x128_16x16_16x16_8x32x1_8x32x1_1x32x1x8_8x8x1_2x1_intrawave_v3,0,0,0
80,1024,7168,18432,torch.float8_e4m3fn,85,0,745.9611,a8w8_bpreshuffle_256x64x128x128_16x16_16x16_8x32x1_8x32x1_1x32x1x8_8x8x1_2x1_intrawave_v3,0,0,0
80,1024,8192,1536,torch.float8_e4m3fn,71,0,90.3089,a8w8_bpreshuffle_256x128x128x64_16x16_16x16_4x64x1_4x64x1_1x32x1x8_8x8x1_2x1_intrawave_v3,0,0,0
80,1024,11264,1536,torch.float8_e4m3fn,85,0,116.8538,a8w8_bpreshuffle_256x64x128x128_16x16_16x16_8x32x1_8x32x1_1x32x1x8_8x8x1_2x1_intrawave_v3,0,0,0
80,1024,24576,1536,torch.float8_e4m3fn,68,0,241.8128,a8w8_bpreshuffle_256x128x192x128_16x16_16x16_8x32x1_8x32x1_1x32x1x8_8x8x1_2x1_intrawave_v3,0,0,0
80,1024,32768,512,torch.float8_e4m3fn,71,0,148.0686,a8w8_bpreshuffle_256x128x128x64_16x16_16x16_4x64x1_4x64x1_1x32x1x8_8x8x1_2x1_intrawave_v3,0,0,0
80,1024,32768,1536,torch.float8_e4m3fn,71,0,317.4319,a8w8_bpreshuffle_256x128x128x64_16x16_16x16_4x64x1_4x64x1_1x32x1x8_8x8x1_2x1_intrawave_v3,0,0,0
80,1024,36864,7168,torch.float8_e4m3fn,93,0,1406.3674,a8w8_bpreshuffle_256x64x192x128_16x16_16x16_8x32x1_8x32x1_1x32x1x8_8x8x1_2x1_intrawave_v3,0,0,0
80,1536,2240,7168,torch.float8_e4m3fn,48,0,177.0619,a8w8_bpreshuffle_256x192x224x128_16x16_16x16_8x32x1_8x32x1_1x64x1x4_8x8x1_2x1_intrawave_v3,0,0,0
80,1536,11264,1536,torch.float8_e4m3fn,85,0,168.9501,a8w8_bpreshuffle_256x64x128x128_16x16_16x16_8x32x1_8x32x1_1x32x1x8_8x8x1_2x1_intrawave_v3,0,0,0
80,2048,128,7168,torch.float8_e4m3fn,119,0,24.0187,a8w8_bpreshuffle_256x32x128x256_16x16_16x16_16x16x1_16x16x1_1x16x1x16_8x8x1_1x2_intrawave_v1,0,0,0
80,2048,2240,7168,torch.float8_e4m3fn,79,0,230.9106,a8w8_bpreshuffle_256x128x64x128_16x16_16x16_8x32x1_8x32x1_1x16x1x16_4x4x1_1x1_intrawave_v3,0,0,0
80,2048,4096,7168,torch.float8_e4m3fn,85,0,328.802,a8w8_bpreshuffle_256x64x128x128_16x16_16x16_8x32x1_8x32x1_1x32x1x8_8x8x1_2x1_intrawave_v3,0,0,0
80,2048,7168,16384,torch.float8_e4m3fn,85,0,1256.6524,a8w8_bpreshuffle_256x64x128x128_16x16_16x16_8x32x1_8x32x1_1x32x1x8_8x8x1_2x1_intrawave_v3,0,0,0
80,2048,7168,18432,torch.float8_e4m3fn,85,0,1411.2909,a8w8_bpreshuffle_256x64x128x128_16x16_16x16_8x32x1_8x32x1_1x32x1x8_8x8x1_2x1_intrawave_v3,0,0,0
80,2048,8192,1536,torch.float8_e4m3fn,71,0,160.9323,a8w8_bpreshuffle_256x128x128x64_16x16_16x16_4x64x1_4x64x1_1x32x1x8_8x8x1_2x1_intrawave_v3,0,0,0
80,2048,11264,1536,torch.float8_e4m3fn,71,0,217.6677,a8w8_bpreshuffle_256x128x128x64_16x16_16x16_4x64x1_4x64x1_1x32x1x8_8x8x1_2x1_intrawave_v3,0,0,0
80,2048,24576,1536,torch.float8_e4m3fn,71,0,459.7917,a8w8_bpreshuffle_256x128x128x64_16x16_16x16_4x64x1_4x64x1_1x32x1x8_8x8x1_2x1_intrawave_v3,0,0,0
80,2048,32768,512,torch.float8_e4m3fn,71,0,283.8954,a8w8_bpreshuffle_256x128x128x64_16x16_16x16_4x64x1_4x64x1_1x32x1x8_8x8x1_2x1_intrawave_v3,0,0,0
80,2048,32768,1536,torch.float8_e4m3fn,71,0,610.8983,a8w8_bpreshuffle_256x128x128x64_16x16_16x16_4x64x1_4x64x1_1x32x1x8_8x8x1_2x1_intrawave_v3,0,0,0
80,2048,36864,7168,torch.float8_e4m3fn,93,0,2759.912,a8w8_bpreshuffle_256x64x192x128_16x16_16x16_8x32x1_8x32x1_1x32x1x8_8x8x1_2x1_intrawave_v3,0,0,0
80,4096,128,7168,torch.float8_e4m3fn,121,0,38.9415,a8w8_bpreshuffle_256x64x128x256_16x16_16x16_16x16x1_16x16x1_1x16x1x16_8x8x1_1x2_intrawave_v3,0,0,0
80,4096,2240,7168,torch.float8_e4m3fn,69,0,437.1832,a8w8_bpreshuffle_256x128x160x128_16x16_16x16_8x32x1_8x32x1_1x64x1x4_8x8x1_2x1_intrawave_v3,0,0,0
80,4096,4096,7168,torch.float8_e4m3fn,85,0,645.3373,a8w8_bpreshuffle_256x64x128x128_16x16_16x16_8x32x1_8x32x1_1x32x1x8_8x8x1_2x1_intrawave_v3,0,0,0
80,4096,7168,16384,torch.float8_e4m3fn,85,0,2443.998,a8w8_bpreshuffle_256x64x128x128_16x16_16x16_8x32x1_8x32x1_1x32x1x8_8x8x1_2x1_intrawave_v3,0,0,0
80,4096,7168,18432,torch.float8_e4m3fn,85,0,2773.2274,a8w8_bpreshuffle_256x64x128x128_16x16_16x16_8x32x1_8x32x1_1x32x1x8_8x8x1_2x1_intrawave_v3,0,0,0
80,4096,8192,1536,torch.float8_e4m3fn,71,0,307.3715,a8w8_bpreshuffle_256x128x128x64_16x16_16x16_4x64x1_4x64x1_1x32x1x8_8x8x1_2x1_intrawave_v3,0,0,0
80,4096,11264,1536,torch.float8_e4m3fn,71,0,417.0421,a8w8_bpreshuffle_256x128x128x64_16x16_16x16_4x64x1_4x64x1_1x32x1x8_8x8x1_2x1_intrawave_v3,0,0,0
80,4096,24576,1536,torch.float8_e4m3fn,72,0,920.9012,a8w8_bpreshuffle_256x64x256x64_16x16_16x16_4x64x1_4x64x1_1x16x1x16_8x8x1_1x2_intrawave_v1,0,0,0
80,4096,32768,512,torch.float8_e4m3fn,71,0,554.3222,a8w8_bpreshuffle_256x128x128x64_16x16_16x16_4x64x1_4x64x1_1x32x1x8_8x8x1_2x1_intrawave_v3,0,0,0
80,4096,32768,1536,torch.float8_e4m3fn,71,0,1193.686,a8w8_bpreshuffle_256x128x128x64_16x16_16x16_4x64x1_4x64x1_1x32x1x8_8x8x1_2x1_intrawave_v3,0,0,0
80,4096,36864,7168,torch.float8_e4m3fn,93,0,5492.6804,a8w8_bpreshuffle_256x64x192x128_16x16_16x16_8x32x1_8x32x1_1x32x1x8_8x8x1_2x1_intrawave_v3,0,0,0
80,6144,128,7168,torch.float8_e4m3fn,123,0,49.1848,a8w8_bpreshuffle_256x96x128x256_16x16_16x16_16x16x1_16x16x1_1x16x1x16_8x8x1_1x2_intrawave_v3,0,0,0
80,6144,512,7168,torch.float8_e4m3fn,85,0,143.4871,a8w8_bpreshuffle_256x64x128x128_16x16_16x16_8x32x1_8x32x1_1x32x1x8_8x8x1_2x1_intrawave_v3,0,0,0
80,6144,576,7168,torch.float8_e4m3fn,68,0,151.638,a8w8_bpreshuffle_256x128x192x128_16x16_16x16_8x32x1_8x32x1_1x32x1x8_8x8x1_2x1_intrawave_v3,0,0,0
80,6144,1536,7168,torch.float8_e4m3fn,93,0,368.8956,a8w8_bpreshuffle_256x64x192x128_16x16_16x16_8x32x1_8x32x1_1x32x1x8_8x8x1_2x1_intrawave_v3,0,0,0
80,6144,2240,7168,torch.float8_e4m3fn,69,0,662.2802,a8w8_bpreshuffle_256x128x160x128_16x16_16x16_8x32x1_8x32x1_1x64x1x4_8x8x1_2x1_intrawave_v3,0,0,0
80,6144,3072,1536,torch.float8_e4m3fn,85,0,183.0209,a8w8_bpreshuffle_256x64x128x128_16x16_16x16_8x32x1_8x32x1_1x32x1x8_8x8x1_2x1_intrawave_v3,0,0,0
80,6144,4096,512,torch.float8_e4m3fn,71,0,109.7738,a8w8_bpreshuffle_256x128x128x64_16x16_16x16_4x64x1_4x64x1_1x32x1x8_8x8x1_2x1_intrawave_v3,0,0,0
80,6144,4096,7168,torch.float8_e4m3fn,102,0,937.0884,a8w8_bpreshuffle_256x96x256x128_16x16_16x16_8x32x1_8x32x1_1x32x1x8_8x8x1_2x1_intrawave_v3,0,0,0
80,6144,4608,7168,torch.float8_e4m3fn,102,0,1071.1237,a8w8_bpreshuffle_256x96x256x128_16x16_16x16_8x32x1_8x32x1_1x32x1x8_8x8x1_2x1_intrawave_v3,0,0,0
80,6144,7168,256,torch.float8_e4m3fn,71,0,123.4161,a8w8_bpreshuffle_256x128x128x64_16x16_16x16_4x64x1_4x64x1_1x32x1x8_8x8x1_2x1_intrawave_v3,0,0,0
80,6144,7168,2048,torch.float8_e4m3fn,71,0,509.0789,a8w8_bpreshuffle_256x128x128x64_16x16_16x16_4x64x1_4x64x1_1x32x1x8_8x8x1_2x1_intrawave_v3,0,0,0
80,6144,7168,2304,torch.float8_e4m3fn,71,0,560.4929,a8w8_bpreshuffle_256x128x128x64_16x16_16x16_4x64x1_4x64x1_1x32x1x8_8x8x1_2x1_intrawave_v3,0,0,0
80,6144,7168,16384,torch.float8_e4m3fn,85,0,3671.969,a8w8_bpreshuffle_256x64x128x128_16x16_16x16_8x32x1_8x32x1_1x32x1x8_8x8x1_2x1_intrawave_v3,0,0,0
80,6144,7168,18432,torch.float8_e4m3fn,85,0,4139.4899,a8w8_bpreshuffle_256x64x128x128_16x16_16x16_8x32x1_8x32x1_1x32x1x8_8x8x1_2x1_intrawave_v3,0,0,0
80,6144,8192,1536,torch.float8_e4m3fn,71,0,455.0275,a8w8_bpreshuffle_256x128x128x64_16x16_16x16_4x64x1_4x64x1_1x32x1x8_8x8x1_2x1_intrawave_v3,0,0,0
80,6144,11264,1536,torch.float8_e4m3fn,71,0,614.8496,a8w8_bpreshuffle_256x128x128x64_16x16_16x16_4x64x1_4x64x1_1x32x1x8_8x8x1_2x1_intrawave_v3,0,0,0
80,6144,24576,1536,torch.float8_e4m3fn,71,0,1348.8178,a8w8_bpreshuffle_256x128x128x64_16x16_16x16_4x64x1_4x64x1_1x32x1x8_8x8x1_2x1_intrawave_v3,0,0,0
80,6144,32768,512,torch.float8_e4m3fn,71,0,793.4262,a8w8_bpreshuffle_256x128x128x64_16x16_16x16_4x64x1_4x64x1_1x32x1x8_8x8x1_2x1_intrawave_v3,0,0,0
80,6144,32768,1536,torch.float8_e4m3fn,102,0,1794.6908,a8w8_bpreshuffle_256x96x256x128_16x16_16x16_8x32x1_8x32x1_1x32x1x8_8x8x1_2x1_intrawave_v3,0,0,0
80,6144,36864,7168,torch.float8_e4m3fn,93,0,8229.8778,a8w8_bpreshuffle_256x64x192x128_16x16_16x16_8x32x1_8x32x1_1x32x1x8_8x8x1_2x1_intrawave_v3,0,0,0
80,8192,128,7168,torch.float8_e4m3fn,124,0,61.8924,a8w8_bpreshuffle_256x112x128x256_16x16_16x16_16x16x1_16x16x1_1x16x1x16_8x8x1_1x2_intrawave_v3,0,0,0
80,8192,2240,7168,torch.float8_e4m3fn,69,0,857.9718,a8w8_bpreshuffle_256x128x160x128_16x16_16x16_8x32x1_8x32x1_1x64x1x4_8x8x1_2x1_intrawave_v3,0,0,0
80,8192,4096,7168,torch.float8_e4m3fn,85,0,1259.5274,a8w8_bpreshuffle_256x64x128x128_16x16_16x16_8x32x1_8x32x1_1x32x1x8_8x8x1_2x1_intrawave_v3,0,0,0
80,8192,7168,16384,torch.float8_e4m3fn,85,0,4942.7227,a8w8_bpreshuffle_256x64x128x128_16x16_16x16_8x32x1_8x32x1_1x32x1x8_8x8x1_2x1_intrawave_v3,0,0,0
80,8192,7168,18432,torch.float8_e4m3fn,85,0,5501.8021,a8w8_bpreshuffle_256x64x128x128_16x16_16x16_8x32x1_8x32x1_1x32x1x8_8x8x1_2x1_intrawave_v3,0,0,0
80,8192,8192,1536,torch.float8_e4m3fn,72,0,621.3308,a8w8_bpreshuffle_256x64x256x64_16x16_16x16_4x64x1_4x64x1_1x16x1x16_8x8x1_1x2_intrawave_v1,0,0,0
80,8192,11264,1536,torch.float8_e4m3fn,71,0,818.2792,a8w8_bpreshuffle_256x128x128x64_16x16_16x16_4x64x1_4x64x1_1x32x1x8_8x8x1_2x1_intrawave_v3,0,0,0
80,8192,24576,1536,torch.float8_e4m3fn,71,0,1786.9965,a8w8_bpreshuffle_256x128x128x64_16x16_16x16_4x64x1_4x64x1_1x32x1x8_8x8x1_2x1_intrawave_v3,0,0,0
80,8192,32768,512,torch.float8_e4m3fn,71,0,1053.245,a8w8_bpreshuffle_256x128x128x64_16x16_16x16_4x64x1_4x64x1_1x32x1x8_8x8x1_2x1_intrawave_v3,0,0,0
80,8192,32768,1536,torch.float8_e4m3fn,71,0,2345.8711,a8w8_bpreshuffle_256x128x128x64_16x16_16x16_4x64x1_4x64x1_1x32x1x8_8x8x1_2x1_intrawave_v3,0,0,0
80,8192,36864,7168,torch.float8_e4m3fn,93,0,10983.7146,a8w8_bpreshuffle_256x64x192x128_16x16_16x16_8x32x1_8x32x1_1x32x1x8_8x8x1_2x1_intrawave_v3,0,0,0
80,10240,128,7168,torch.float8_e4m3fn,121,0,63.2764,a8w8_bpreshuffle_256x64x128x256_16x16_16x16_16x16x1_16x16x1_1x16x1x16_8x8x1_1x2_intrawave_v3,0,0,0
80,10240,512,7168,torch.float8_e4m3fn,0,0,211.3264,a8w8_bpreshuffle_256x128x128x128_16x16_16x16_8x32x1_8x32x1_1x32x1x8_8x8x1_2x1_intrawave_v3,0,0,0
80,10240,576,7168,torch.float8_e4m3fn,68,0,230.3376,a8w8_bpreshuffle_256x128x192x128_16x16_16x16_8x32x1_8x32x1_1x32x1x8_8x8x1_2x1_intrawave_v3,0,0,0
80,10240,1536,7168,torch.float8_e4m3fn,68,0,583.4998,a8w8_bpreshuffle_256x128x192x128_16x16_16x16_8x32x1_8x32x1_1x32x1x8_8x8x1_2x1_intrawave_v3,0,0,0
80,10240,2240,7168,torch.float8_e4m3fn,69,0,1018.0438,a8w8_bpreshuffle_256x128x160x128_16x16_16x16_8x32x1_8x32x1_1x64x1x4_8x8x1_2x1_intrawave_v3,0,0,0
80,10240,3072,1536,torch.float8_e4m3fn,71,0,290.0173,a8w8_bpreshuffle_256x128x128x64_16x16_16x16_4x64x1_4x64x1_1x32x1x8_8x8x1_2x1_intrawave_v3,0,0,0
80,10240,4096,512,torch.float8_e4m3fn,71,0,173.8713,a8w8_bpreshuffle_256x128x128x64_16x16_16x16_4x64x1_4x64x1_1x32x1x8_8x8x1_2x1_intrawave_v3,0,0,0
80,10240,4096,7168,torch.float8_e4m3fn,85,0,1574.2695,a8w8_bpreshuffle_256x64x128x128_16x16_16x16_8x32x1_8x32x1_1x32x1x8_8x8x1_2x1_intrawave_v3,0,0,0
80,10240,4608,7168,torch.float8_e4m3fn,93,0,1722.172,a8w8_bpreshuffle_256x64x192x128_16x16_16x16_8x32x1_8x32x1_1x32x1x8_8x8x1_2x1_intrawave_v3,0,0,0
80,10240,7168,256,torch.float8_e4m3fn,71,0,199.187,a8w8_bpreshuffle_256x128x128x64_16x16_16x16_4x64x1_4x64x1_1x32x1x8_8x8x1_2x1_intrawave_v3,0,0,0
80,10240,7168,2048,torch.float8_e4m3fn,71,0,843.0746,a8w8_bpreshuffle_256x128x128x64_16x16_16x16_4x64x1_4x64x1_1x32x1x8_8x8x1_2x1_intrawave_v3,0,0,0
80,10240,7168,2304,torch.float8_e4m3fn,71,0,913.7132,a8w8_bpreshuffle_256x128x128x64_16x16_16x16_4x64x1_4x64x1_1x32x1x8_8x8x1_2x1_intrawave_v3,0,0,0
80,10240,7168,16384,torch.float8_e4m3fn,85,0,6072.4257,a8w8_bpreshuffle_256x64x128x128_16x16_16x16_8x32x1_8x32x1_1x32x1x8_8x8x1_2x1_intrawave_v3,0,0,0
80,10240,7168,18432,torch.float8_e4m3fn,85,0,6834.6666,a8w8_bpreshuffle_256x64x128x128_16x16_16x16_8x32x1_8x32x1_1x32x1x8_8x8x1_2x1_intrawave_v3,0,0,0
80,10240,8192,1536,torch.float8_e4m3fn,71,0,754.6592,a8w8_bpreshuffle_256x128x128x64_16x16_16x16_4x64x1_4x64x1_1x32x1x8_8x8x1_2x1_intrawave_v3,0,0,0
80,10240,11264,1536,torch.float8_e4m3fn,71,0,1039.4493,a8w8_bpreshuffle_256x128x128x64_16x16_16x16_4x64x1_4x64x1_1x32x1x8_8x8x1_2x1_intrawave_v3,0,0,0
80,10240,24576,1536,torch.float8_e4m3fn,71,0,2209.3759,a8w8_bpreshuffle_256x128x128x64_16x16_16x16_4x64x1_4x64x1_1x32x1x8_8x8x1_2x1_intrawave_v3,0,0,0
80,10240,32768,512,torch.float8_e4m3fn,72,0,1357.7711,a8w8_bpreshuffle_256x64x256x64_16x16_16x16_4x64x1_4x64x1_1x16x1x16_8x8x1_1x2_intrawave_v1,0,0,0
80,10240,32768,1536,torch.float8_e4m3fn,71,0,2923.8951,a8w8_bpreshuffle_256x128x128x64_16x16_16x16_4x64x1_4x64x1_1x32x1x8_8x8x1_2x1_intrawave_v3,0,0,0
80,10240,36864,7168,torch.float8_e4m3fn,93,0,13738.3404,a8w8_bpreshuffle_256x64x192x128_16x16_16x16_8x32x1_8x32x1_1x32x1x8_8x8x1_2x1_intrawave_v3,0,0,0
80,12288,128,7168,torch.float8_e4m3fn,141,0,84.5069,a8w8_bpreshuffle_256x160x128x128_16x16_16x16_8x32x1_8x32x1_1x16x1x16_8x8x1_1x2_intrawave_v3,0,0,0
80,12288,512,7168,torch.float8_e4m3fn,0,0,262.6171,a8w8_bpreshuffle_256x128x128x128_16x16_16x16_8x32x1_8x32x1_1x32x1x8_8x8x1_2x1_intrawave_v3,0,0,0
80,12288,576,7168,torch.float8_e4m3fn,94,0,285.6522,a8w8_bpreshuffle_256x96x192x128_16x16_16x16_8x32x1_8x32x1_1x32x1x8_8x8x1_2x1_intrawave_v3,0,0,0
80,12288,1536,7168,torch.float8_e4m3fn,94,0,718.7933,a8w8_bpreshuffle_256x96x192x128_16x16_16x16_8x32x1_8x32x1_1x32x1x8_8x8x1_2x1_intrawave_v3,0,0,0
80,12288,2240,7168,torch.float8_e4m3fn,69,0,1231.0498,a8w8_bpreshuffle_256x128x160x128_16x16_16x16_8x32x1_8x32x1_1x64x1x4_8x8x1_2x1_intrawave_v3,0,0,0
80,12288,3072,1536,torch.float8_e4m3fn,72,0,352.0628,a8w8_bpreshuffle_256x64x256x64_16x16_16x16_4x64x1_4x64x1_1x16x1x16_8x8x1_1x2_intrawave_v1,0,0,0
80,12288,4096,512,torch.float8_e4m3fn,71,0,207.219,a8w8_bpreshuffle_256x128x128x64_16x16_16x16_4x64x1_4x64x1_1x32x1x8_8x8x1_2x1_intrawave_v3,0,0,0
80,12288,4096,7168,torch.float8_e4m3fn,102,0,1858.9016,a8w8_bpreshuffle_256x96x256x128_16x16_16x16_8x32x1_8x32x1_1x32x1x8_8x8x1_2x1_intrawave_v3,0,0,0
80,12288,4608,7168,torch.float8_e4m3fn,68,0,2079.1883,a8w8_bpreshuffle_256x128x192x128_16x16_16x16_8x32x1_8x32x1_1x32x1x8_8x8x1_2x1_intrawave_v3,0,0,0
80,12288,7168,256,torch.float8_e4m3fn,71,0,243.398,a8w8_bpreshuffle_256x128x128x64_16x16_16x16_4x64x1_4x64x1_1x32x1x8_8x8x1_2x1_intrawave_v3,0,0,0
80,12288,7168,2048,torch.float8_e4m3fn,71,0,1001.5776,a8w8_bpreshuffle_256x128x128x64_16x16_16x16_4x64x1_4x64x1_1x32x1x8_8x8x1_2x1_intrawave_v3,0,0,0
80,12288,7168,2304,torch.float8_e4m3fn,72,0,1134.7441,a8w8_bpreshuffle_256x64x256x64_16x16_16x16_4x64x1_4x64x1_1x16x1x16_8x8x1_1x2_intrawave_v1,0,0,0
80,12288,7168,16384,torch.float8_e4m3fn,102,0,7272.8109,a8w8_bpreshuffle_256x96x256x128_16x16_16x16_8x32x1_8x32x1_1x32x1x8_8x8x1_2x1_intrawave_v3,0,0,0
80,12288,7168,18432,torch.float8_e4m3fn,102,0,8054.046,a8w8_bpreshuffle_256x96x256x128_16x16_16x16_8x32x1_8x32x1_1x32x1x8_8x8x1_2x1_intrawave_v3,0,0,0
80,12288,8192,1536,torch.float8_e4m3fn,102,0,912.1361,a8w8_bpreshuffle_256x96x256x128_16x16_16x16_8x32x1_8x32x1_1x32x1x8_8x8x1_2x1_intrawave_v3,0,0,0
80,12288,11264,1536,torch.float8_e4m3fn,71,0,1221.6133,a8w8_bpreshuffle_256x128x128x64_16x16_16x16_4x64x1_4x64x1_1x32x1x8_8x8x1_2x1_intrawave_v3,0,0,0
80,12288,24576,1536,torch.float8_e4m3fn,71,0,2656.0688,a8w8_bpreshuffle_256x128x128x64_16x16_16x16_4x64x1_4x64x1_1x32x1x8_8x8x1_2x1_intrawave_v3,0,0,0
80,12288,32768,512,torch.float8_e4m3fn,71,0,1573.8691,a8w8_bpreshuffle_256x128x128x64_16x16_16x16_4x64x1_4x64x1_1x32x1x8_8x8x1_2x1_intrawave_v3,0,0,0
80,12288,32768,1536,torch.float8_e4m3fn,71,0,3526.7572,a8w8_bpreshuffle_256x128x128x64_16x16_16x16_4x64x1_4x64x1_1x32x1x8_8x8x1_2x1_intrawave_v3,0,0,0
80,12288,36864,7168,torch.float8_e4m3fn,93,0,16426.5845,a8w8_bpreshuffle_256x64x192x128_16x16_16x16_8x32x1_8x32x1_1x32x1x8_8x8x1_2x1_intrawave_v3,0,0,0
80,14336,128,7168,torch.float8_e4m3fn,86,0,91.5501,a8w8_bpreshuffle_256x96x128x128_16x16_16x16_8x32x1_8x32x1_1x32x1x8_8x8x1_2x1_intrawave_v3,0,0,0
80,14336,512,7168,torch.float8_e4m3fn,102,0,306.9194,a8w8_bpreshuffle_256x96x256x128_16x16_16x16_8x32x1_8x32x1_1x32x1x8_8x8x1_2x1_intrawave_v3,0,0,0
80,14336,576,7168,torch.float8_e4m3fn,93,0,341.468,a8w8_bpreshuffle_256x64x192x128_16x16_16x16_8x32x1_8x32x1_1x32x1x8_8x8x1_2x1_intrawave_v3,0,0,0
80,14336,1536,7168,torch.float8_e4m3fn,93,0,830.4984,a8w8_bpreshuffle_256x64x192x128_16x16_16x16_8x32x1_8x32x1_1x32x1x8_8x8x1_2x1_intrawave_v3,0,0,0
80,14336,2240,7168,torch.float8_e4m3fn,69,0,1461.7946,a8w8_bpreshuffle_256x128x160x128_16x16_16x16_8x32x1_8x32x1_1x64x1x4_8x8x1_2x1_intrawave_v3,0,0,0
80,14336,3072,1536,torch.float8_e4m3fn,93,0,405.8954,a8w8_bpreshuffle_256x64x192x128_16x16_16x16_8x32x1_8x32x1_1x32x1x8_8x8x1_2x1_intrawave_v3,0,0,0
80,14336,4096,512,torch.float8_e4m3fn,71,0,239.3595,a8w8_bpreshuffle_256x128x128x64_16x16_16x16_4x64x1_4x64x1_1x32x1x8_8x8x1_2x1_intrawave_v3,0,0,0
80,14336,4096,7168,torch.float8_e4m3fn,85,0,2197.8676,a8w8_bpreshuffle_256x64x128x128_16x16_16x16_8x32x1_8x32x1_1x32x1x8_8x8x1_2x1_intrawave_v3,0,0,0
80,14336,4608,7168,torch.float8_e4m3fn,93,0,2431.1066,a8w8_bpreshuffle_256x64x192x128_16x16_16x16_8x32x1_8x32x1_1x32x1x8_8x8x1_2x1_intrawave_v3,0,0,0
80,14336,7168,256,torch.float8_e4m3fn,72,0,297.7928,a8w8_bpreshuffle_256x64x256x64_16x16_16x16_4x64x1_4x64x1_1x16x1x16_8x8x1_1x2_intrawave_v1,0,0,0
80,14336,7168,2048,torch.float8_e4m3fn,74,0,1199.9511,a8w8_bpreshuffle_256x64x256x64_16x16_16x16_4x64x1_4x64x1_1x32x1x8_8x8x1_2x1_intrawave_v1,0,0,0
80,14336,7168,2304,torch.float8_e4m3fn,71,0,1310.3925,a8w8_bpreshuffle_256x128x128x64_16x16_16x16_4x64x1_4x64x1_1x32x1x8_8x8x1_2x1_intrawave_v3,0,0,0
80,14336,7168,16384,torch.float8_e4m3fn,85,0,8455.8581,a8w8_bpreshuffle_256x64x128x128_16x16_16x16_8x32x1_8x32x1_1x32x1x8_8x8x1_2x1_intrawave_v3,0,0,0
80,14336,7168,18432,torch.float8_e4m3fn,85,0,9585.3754,a8w8_bpreshuffle_256x64x128x128_16x16_16x16_8x32x1_8x32x1_1x32x1x8_8x8x1_2x1_intrawave_v3,0,0,0
80,14336,8192,1536,torch.float8_e4m3fn,71,0,1039.5469,a8w8_bpreshuffle_256x128x128x64_16x16_16x16_4x64x1_4x64x1_1x32x1x8_8x8x1_2x1_intrawave_v3,0,0,0
80,14336,11264,1536,torch.float8_e4m3fn,71,0,1422.2274,a8w8_bpreshuffle_256x128x128x64_16x16_16x16_4x64x1_4x64x1_1x32x1x8_8x8x1_2x1_intrawave_v3,0,0,0
80,14336,24576,1536,torch.float8_e4m3fn,71,0,3089.1315,a8w8_bpreshuffle_256x128x128x64_16x16_16x16_4x64x1_4x64x1_1x32x1x8_8x8x1_2x1_intrawave_v3,0,0,0
80,14336,32768,512,torch.float8_e4m3fn,71,0,1827.3845,a8w8_bpreshuffle_256x128x128x64_16x16_16x16_4x64x1_4x64x1_1x32x1x8_8x8x1_2x1_intrawave_v3,0,0,0
80,14336,32768,1536,torch.float8_e4m3fn,71,0,4108.8811,a8w8_bpreshuffle_256x128x128x64_16x16_16x16_4x64x1_4x64x1_1x32x1x8_8x8x1_2x1_intrawave_v3,0,0,0
80,14336,36864,7168,torch.float8_e4m3fn,93,0,19165.8682,a8w8_bpreshuffle_256x64x192x128_16x16_16x16_8x32x1_8x32x1_1x32x1x8_8x8x1_2x1_intrawave_v3,0,0,0
80,16384,128,7168,torch.float8_e4m3fn,0,0,114.6838,a8w8_bpreshuffle_256x128x128x128_16x16_16x16_8x32x1_8x32x1_1x32x1x8_8x8x1_2x1_intrawave_v3,0,0,0
80,16384,2240,7168,torch.float8_e4m3fn,69,0,1644.8521,a8w8_bpreshuffle_256x128x160x128_16x16_16x16_8x32x1_8x32x1_1x64x1x4_8x8x1_2x1_intrawave_v3,0,0,0
80,16384,4096,7168,torch.float8_e4m3fn,85,0,2498.7773,a8w8_bpreshuffle_256x64x128x128_16x16_16x16_8x32x1_8x32x1_1x32x1x8_8x8x1_2x1_intrawave_v3,0,0,0
80,16384,7168,16384,torch.float8_e4m3fn,85,0,9679.208,a8w8_bpreshuffle_256x64x128x128_16x16_16x16_8x32x1_8x32x1_1x32x1x8_8x8x1_2x1_intrawave_v3,0,0,0
80,16384,7168,18432,torch.float8_e4m3fn,85,0,10922.6859,a8w8_bpreshuffle_256x64x128x128_16x16_16x16_8x32x1_8x32x1_1x32x1x8_8x8x1_2x1_intrawave_v3,0,0,0
80,16384,8192,1536,torch.float8_e4m3fn,71,0,1182.4869,a8w8_bpreshuffle_256x128x128x64_16x16_16x16_4x64x1_4x64x1_1x32x1x8_8x8x1_2x1_intrawave_v3,0,0,0
80,16384,11264,1536,torch.float8_e4m3fn,72,0,1650.9527,a8w8_bpreshuffle_256x64x256x64_16x16_16x16_4x64x1_4x64x1_1x16x1x16_8x8x1_1x2_intrawave_v1,0,0,0
80,16384,24576,1536,torch.float8_e4m3fn,71,0,3536.4999,a8w8_bpreshuffle_256x128x128x64_16x16_16x16_4x64x1_4x64x1_1x32x1x8_8x8x1_2x1_intrawave_v3,0,0,0
80,16384,32768,512,torch.float8_e4m3fn,71,0,2090.8366,a8w8_bpreshuffle_256x128x128x64_16x16_16x16_4x64x1_4x64x1_1x32x1x8_8x8x1_2x1_intrawave_v3,0,0,0
80,16384,32768,1536,torch.float8_e4m3fn,71,0,4672.9569,a8w8_bpreshuffle_256x128x128x64_16x16_16x16_4x64x1_4x64x1_1x32x1x8_8x8x1_2x1_intrawave_v3,0,0,0
80,16384,36864,7168,torch.float8_e4m3fn,71,0,21975.6028,a8w8_bpreshuffle_256x128x128x64_16x16_16x16_4x64x1_4x64x1_1x32x1x8_8x8x1_2x1_intrawave_v3,0,0,0
80,32768,128,7168,torch.float8_e4m3fn,121,0,208.4886,a8w8_bpreshuffle_256x64x128x256_16x16_16x16_16x16x1_16x16x1_1x16x1x16_8x8x1_1x2_intrawave_v3,0,0,0
80,32768,576,7168,torch.float8_e4m3fn,68,0,729.7961,a8w8_bpreshuffle_256x128x192x128_16x16_16x16_8x32x1_8x32x1_1x32x1x8_8x8x1_2x1_intrawave_v3,0,0,0
80,32768,1536,7168,torch.float8_e4m3fn,68,0,1872.4274,a8w8_bpreshuffle_256x128x192x128_16x16_16x16_8x32x1_8x32x1_1x32x1x8_8x8x1_2x1_intrawave_v3,0,0,0
80,32768,2240,7168,torch.float8_e4m3fn,69,0,3196.032,a8w8_bpreshuffle_256x128x160x128_16x16_16x16_8x32x1_8x32x1_1x64x1x4_8x8x1_2x1_intrawave_v3,0,0,0
80,32768,3072,1536,torch.float8_e4m3fn,71,0,909.865,a8w8_bpreshuffle_256x128x128x64_16x16_16x16_4x64x1_4x64x1_1x32x1x8_8x8x1_2x1_intrawave_v3,0,0,0
80,32768,4096,7168,torch.float8_e4m3fn,74,0,5016.1101,a8w8_bpreshuffle_256x64x256x64_16x16_16x16_4x64x1_4x64x1_1x32x1x8_8x8x1_2x1_intrawave_v1,0,0,0
80,32768,7168,2048,torch.float8_e4m3fn,72,0,2704.1764,a8w8_bpreshuffle_256x64x256x64_16x16_16x16_4x64x1_4x64x1_1x16x1x16_8x8x1_1x2_intrawave_v1,0,0,0
80,32768,7168,16384,torch.float8_e4m3fn,85,0,19294.1288,a8w8_bpreshuffle_256x64x128x128_16x16_16x16_8x32x1_8x32x1_1x32x1x8_8x8x1_2x1_intrawave_v3,0,0,0
80,32768,7168,18432,torch.float8_e4m3fn,85,0,21856.5731,a8w8_bpreshuffle_256x64x128x128_16x16_16x16_8x32x1_8x32x1_1x32x1x8_8x8x1_2x1_intrawave_v3,0,0,0
80,32768,8192,1536,torch.float8_e4m3fn,71,0,2344.2068,a8w8_bpreshuffle_256x128x128x64_16x16_16x16_4x64x1_4x64x1_1x32x1x8_8x8x1_2x1_intrawave_v3,0,0,0
80,32768,11264,1536,torch.float8_e4m3fn,72,0,3296.9348,a8w8_bpreshuffle_256x64x256x64_16x16_16x16_4x64x1_4x64x1_1x16x1x16_8x8x1_1x2_intrawave_v1,0,0,0
80,32768,24576,1536,torch.float8_e4m3fn,71,0,7017.8836,a8w8_bpreshuffle_256x128x128x64_16x16_16x16_4x64x1_4x64x1_1x32x1x8_8x8x1_2x1_intrawave_v3,0,0,0
80,32768,32768,512,torch.float8_e4m3fn,71,0,4165.6734,a8w8_bpreshuffle_256x128x128x64_16x16_16x16_4x64x1_4x64x1_1x32x1x8_8x8x1_2x1_intrawave_v3,0,0,0
80,32768,32768,1536,torch.float8_e4m3fn,71,0,9432.9791,a8w8_bpreshuffle_256x128x128x64_16x16_16x16_4x64x1_4x64x1_1x32x1x8_8x8x1_2x1_intrawave_v3,0,0,0
80,32768,36864,7168,torch.float8_e4m3fn,93,0,43711.479,a8w8_bpreshuffle_256x64x192x128_16x16_16x16_8x32x1_8x32x1_1x32x1x8_8x8x1_2x1_intrawave_v3,0,0,0
80,49152,2112,7168,torch.float8_e4m3fn,93,0,3805.7733,a8w8_bpreshuffle_256x64x192x128_16x16_16x16_8x32x1_8x32x1_1x32x1x8_8x8x1_2x1_intrawave_v3,0,0,0
80,49152,2240,7168,torch.float8_e4m3fn,69,0,4812.8899,a8w8_bpreshuffle_256x128x160x128_16x16_16x16_8x32x1_8x32x1_1x64x1x4_8x8x1_2x1_intrawave_v3,0,0,0
80,49152,11264,1536,torch.float8_e4m3fn,71,0,4796.016,a8w8_bpreshuffle_256x128x128x64_16x16_16x16_4x64x1_4x64x1_1x32x1x8_8x8x1_2x1_intrawave_v3,0,0,0
80,65536,128,7168,torch.float8_e4m3fn,121,0,383.2232,a8w8_bpreshuffle_256x64x128x256_16x16_16x16_16x16x1_16x16x1_1x16x1x16_8x8x1_1x2_intrawave_v3,0,0,0
80,65536,512,7168,torch.float8_e4m3fn,70,0,1327.0618,a8w8_bpreshuffle_256x128x128x128_16x16_16x16_8x32x1_8x32x1_1x32x1x8_8x8x1_2x1_intrawave_v3,0,0,0
80,65536,576,7168,torch.float8_e4m3fn,93,0,1429.9239,a8w8_bpreshuffle_256x64x192x128_16x16_16x16_8x32x1_8x32x1_1x32x1x8_8x8x1_2x1_intrawave_v3,0,0,0
80,65536,1536,7168,torch.float8_e4m3fn,93,0,3736.9156,a8w8_bpreshuffle_256x64x192x128_16x16_16x16_8x32x1_8x32x1_1x32x1x8_8x8x1_2x1_intrawave_v3,0,0,0
80,65536,2112,7168,torch.float8_e4m3fn,93,0,5062.5452,a8w8_bpreshuffle_256x64x192x128_16x16_16x16_8x32x1_8x32x1_1x32x1x8_8x8x1_2x1_intrawave_v3,0,0,0
80,65536,2240,7168,torch.float8_e4m3fn,69,0,6365.1402,a8w8_bpreshuffle_256x128x160x128_16x16_16x16_8x32x1_8x32x1_1x64x1x4_8x8x1_2x1_intrawave_v3,0,0,0
80,65536,3072,1536,torch.float8_e4m3fn,71,0,1787.3796,a8w8_bpreshuffle_256x128x128x64_16x16_16x16_4x64x1_4x64x1_1x32x1x8_8x8x1_2x1_intrawave_v3,0,0,0
80,65536,4096,512,torch.float8_e4m3fn,71,0,1055.1661,a8w8_bpreshuffle_256x128x128x64_16x16_16x16_4x64x1_4x64x1_1x32x1x8_8x8x1_2x1_intrawave_v3,0,0,0
80,65536,4096,7168,torch.float8_e4m3fn,85,0,9976.6212,a8w8_bpreshuffle_256x64x128x128_16x16_16x16_8x32x1_8x32x1_1x32x1x8_8x8x1_2x1_intrawave_v3,0,0,0
80,65536,4608,7168,torch.float8_e4m3fn,68,0,11016.6648,a8w8_bpreshuffle_256x128x192x128_16x16_16x16_8x32x1_8x32x1_1x32x1x8_8x8x1_2x1_intrawave_v3,0,0,0
80,65536,7168,256,torch.float8_e4m3fn,71,0,1212.7558,a8w8_bpreshuffle_256x128x128x64_16x16_16x16_4x64x1_4x64x1_1x32x1x8_8x8x1_2x1_intrawave_v3,0,0,0
80,65536,7168,2048,torch.float8_e4m3fn,71,0,5287.9696,a8w8_bpreshuffle_256x128x128x64_16x16_16x16_4x64x1_4x64x1_1x32x1x8_8x8x1_2x1_intrawave_v3,0,0,0
80,65536,7168,2304,torch.float8_e4m3fn,71,0,5871.5636,a8w8_bpreshuffle_256x128x128x64_16x16_16x16_4x64x1_4x64x1_1x32x1x8_8x8x1_2x1_intrawave_v3,0,0,0
80,65536,7168,16384,torch.float8_e4m3fn,85,0,38748.1812,a8w8_bpreshuffle_256x64x128x128_16x16_16x16_8x32x1_8x32x1_1x32x1x8_8x8x1_2x1_intrawave_v3,0,0,0
80,65536,7168,18432,torch.float8_e4m3fn,85,0,43467.0784,a8w8_bpreshuffle_256x64x128x128_16x16_16x16_8x32x1_8x32x1_1x32x1x8_8x8x1_2x1_intrawave_v3,0,0,0
80,65536,8192,1536,torch.float8_e4m3fn,71,0,4684.7126,a8w8_bpreshuffle_256x128x128x64_16x16_16x16_4x64x1_4x64x1_1x32x1x8_8x8x1_2x1_intrawave_v3,0,0,0
80,65536,11264,1536,torch.float8_e4m3fn,71,0,6394.7949,a8w8_bpreshuffle_256x128x128x64_16x16_16x16_4x64x1_4x64x1_1x32x1x8_8x8x1_2x1_intrawave_v3,0,0,0
80,65536,24576,1536,torch.float8_e4m3fn,0,0,inf,a8w8_bpreshuffle_256x128x128x128_16x16_16x16_8x32x1_8x32x1_1x32x1x8_8x8x1_2x1_intrawave_v3,0,0,0
80,65536,32768,512,torch.float8_e4m3fn,74,0,,a8w8_bpreshuffle_256x64x256x64_16x16_16x16_4x64x1_4x64x1_1x32x1x8_8x8x1_2x1_intrawave_v1,0,0,0
80,65536,32768,1536,torch.float8_e4m3fn,0,0,,a8w8_bpreshuffle_256x128x128x128_16x16_16x16_8x32x1_8x32x1_1x32x1x8_8x8x1_2x1_intrawave_v3,0,0,0
80,65536,36864,7168,torch.float8_e4m3fn,0,0,,a8w8_bpreshuffle_256x128x128x128_16x16_16x16_8x32x1_8x32x1_1x32x1x8_8x8x1_2x1_intrawave_v3,0,0,0
80,73728,2112,7168,torch.float8_e4m3fn,93,0,5700.3689,a8w8_bpreshuffle_256x64x192x128_16x16_16x16_8x32x1_8x32x1_1x32x1x8_8x8x1_2x1_intrawave_v3,0,0,0
80,73728,2240,7168,torch.float8_e4m3fn,69,0,7155.8623,a8w8_bpreshuffle_256x128x160x128_16x16_16x16_8x32x1_8x32x1_1x64x1x4_8x8x1_2x1_intrawave_v3,0,0,0
80,73728,11264,1536,torch.float8_e4m3fn,71,0,7197.2388,a8w8_bpreshuffle_256x128x128x64_16x16_16x16_4x64x1_4x64x1_1x32x1x8_8x8x1_2x1_intrawave_v3,0,0,0
80,98304,128,7168,torch.float8_e4m3fn,87,0,561.5334,a8w8_bpreshuffle_256x128x128x128_16x16_16x16_8x32x1_8x32x1_1x16x1x16_4x4x1_1x1_intrawave_v3,0,0,0
80,98304,512,7168,torch.float8_e4m3fn,102,0,1866.4062,a8w8_bpreshuffle_256x96x256x128_16x16_16x16_8x32x1_8x32x1_1x32x1x8_8x8x1_2x1_intrawave_v3,0,0,0
80,98304,576,7168,torch.float8_e4m3fn,95,0,2112.9835,a8w8_bpreshuffle_256x128x192x128_16x16_16x16_8x32x1_8x32x1_1x16x1x16_4x4x1_1x1_intrawave_v3,0,0,0
80,98304,1536,7168,torch.float8_e4m3fn,102,0,5497.497,a8w8_bpreshuffle_256x96x256x128_16x16_16x16_8x32x1_8x32x1_1x32x1x8_8x8x1_2x1_intrawave_v3,0,0,0
80,98304,2240,7168,torch.float8_e4m3fn,69,0,9755.5399,a8w8_bpreshuffle_256x128x160x128_16x16_16x16_8x32x1_8x32x1_1x64x1x4_8x8x1_2x1_intrawave_v3,0,0,0
80,98304,3072,1536,torch.float8_e4m3fn,102,0,2698.4705,a8w8_bpreshuffle_256x96x256x128_16x16_16x16_8x32x1_8x32x1_1x32x1x8_8x8x1_2x1_intrawave_v3,0,0,0
80,98304,4096,512,torch.float8_e4m3fn,71,0,1607.6098,a8w8_bpreshuffle_256x128x128x64_16x16_16x16_4x64x1_4x64x1_1x32x1x8_8x8x1_2x1_intrawave_v3,0,0,0
80,98304,4096,7168,torch.float8_e4m3fn,102,0,14573.0079,a8w8_bpreshuffle_256x96x256x128_16x16_16x16_8x32x1_8x32x1_1x32x1x8_8x8x1_2x1_intrawave_v3,0,0,0
80,98304,4608,7168,torch.float8_e4m3fn,102,0,16377.2032,a8w8_bpreshuffle_256x96x256x128_16x16_16x16_8x32x1_8x32x1_1x32x1x8_8x8x1_2x1_intrawave_v3,0,0,0
80,98304,7168,256,torch.float8_e4m3fn,72,0,1997.5301,a8w8_bpreshuffle_256x64x256x64_16x16_16x16_4x64x1_4x64x1_1x16x1x16_8x8x1_1x2_intrawave_v1,0,0,0
80,98304,7168,2048,torch.float8_e4m3fn,72,0,8086.5215,a8w8_bpreshuffle_256x64x256x64_16x16_16x16_4x64x1_4x64x1_1x16x1x16_8x8x1_1x2_intrawave_v1,0,0,0
80,98304,7168,2304,torch.float8_e4m3fn,71,0,8879.3992,a8w8_bpreshuffle_256x128x128x64_16x16_16x16_4x64x1_4x64x1_1x32x1x8_8x8x1_2x1_intrawave_v3,0,0,0
80,98304,7168,16384,torch.float8_e4m3fn,102,0,57025.1637,a8w8_bpreshuffle_256x96x256x128_16x16_16x16_8x32x1_8x32x1_1x32x1x8_8x8x1_2x1_intrawave_v3,0,0,0
80,98304,7168,18432,torch.float8_e4m3fn,102,0,63990.1906,a8w8_bpreshuffle_256x96x256x128_16x16_16x16_8x32x1_8x32x1_1x32x1x8_8x8x1_2x1_intrawave_v3,0,0,0
80,98304,8192,1536,torch.float8_e4m3fn,71,0,7034.6763,a8w8_bpreshuffle_256x128x128x64_16x16_16x16_4x64x1_4x64x1_1x32x1x8_8x8x1_2x1_intrawave_v3,0,0,0
80,98304,11264,1536,torch.float8_e4m3fn,71,0,9673.3902,a8w8_bpreshuffle_256x128x128x64_16x16_16x16_4x64x1_4x64x1_1x32x1x8_8x8x1_2x1_intrawave_v3,0,0,0
80,98304,24576,1536,torch.float8_e4m3fn,0,0,,a8w8_bpreshuffle_256x128x128x128_16x16_16x16_8x32x1_8x32x1_1x32x1x8_8x8x1_2x1_intrawave_v3,0,0,0
80,98304,32768,1536,torch.float8_e4m3fn,0,0,,a8w8_bpreshuffle_256x128x128x128_16x16_16x16_8x32x1_8x32x1_1x32x1x8_8x8x1_2x1_intrawave_v3,0,0,0
80,131072,128,7168,torch.float8_e4m3fn,0,0,719.3472,a8w8_bpreshuffle_256x128x128x128_16x16_16x16_8x32x1_8x32x1_1x32x1x8_8x8x1_2x1_intrawave_v3,0,0,0
80,131072,512,7168,torch.float8_e4m3fn,102,0,2615.157,a8w8_bpreshuffle_256x96x256x128_16x16_16x16_8x32x1_8x32x1_1x32x1x8_8x8x1_2x1_intrawave_v3,0,0,0
80,131072,576,7168,torch.float8_e4m3fn,93,0,2822.5197,a8w8_bpreshuffle_256x64x192x128_16x16_16x16_8x32x1_8x32x1_1x32x1x8_8x8x1_2x1_intrawave_v3,0,0,0
80,131072,1536,7168,torch.float8_e4m3fn,68,0,7429.8789,a8w8_bpreshuffle_256x128x192x128_16x16_16x16_8x32x1_8x32x1_1x32x1x8_8x8x1_2x1_intrawave_v3,0,0,0
80,131072,2112,7168,torch.float8_e4m3fn,93,0,10093.2233,a8w8_bpreshuffle_256x64x192x128_16x16_16x16_8x32x1_8x32x1_1x32x1x8_8x8x1_2x1_intrawave_v3,0,0,0
80,131072,2240,7168,torch.float8_e4m3fn,69,0,12728.0402,a8w8_bpreshuffle_256x128x160x128_16x16_16x16_8x32x1_8x32x1_1x64x1x4_8x8x1_2x1_intrawave_v3,0,0,0
80,131072,3072,1536,torch.float8_e4m3fn,71,0,3559.9187,a8w8_bpreshuffle_256x128x128x64_16x16_16x16_4x64x1_4x64x1_1x32x1x8_8x8x1_2x1_intrawave_v3,0,0,0
80,131072,4096,512,torch.float8_e4m3fn,71,0,2125.6078,a8w8_bpreshuffle_256x128x128x64_16x16_16x16_4x64x1_4x64x1_1x32x1x8_8x8x1_2x1_intrawave_v3,0,0,0
80,131072,4096,7168,torch.float8_e4m3fn,85,0,19941.3998,a8w8_bpreshuffle_256x64x128x128_16x16_16x16_8x32x1_8x32x1_1x32x1x8_8x8x1_2x1_intrawave_v3,0,0,0
80,131072,4608,7168,torch.float8_e4m3fn,93,0,21987.1209,a8w8_bpreshuffle_256x64x192x128_16x16_16x16_8x32x1_8x32x1_1x32x1x8_8x8x1_2x1_intrawave_v3,0,0,0
80,131072,7168,256,torch.float8_e4m3fn,71,0,2444.3347,a8w8_bpreshuffle_256x128x128x64_16x16_16x16_4x64x1_4x64x1_1x32x1x8_8x8x1_2x1_intrawave_v3,0,0,0
80,131072,7168,2048,torch.float8_e4m3fn,71,0,10519.7293,a8w8_bpreshuffle_256x128x128x64_16x16_16x16_4x64x1_4x64x1_1x32x1x8_8x8x1_2x1_intrawave_v3,0,0,0
80,131072,7168,2304,torch.float8_e4m3fn,71,0,11621.1373,a8w8_bpreshuffle_256x128x128x64_16x16_16x16_4x64x1_4x64x1_1x32x1x8_8x8x1_2x1_intrawave_v3,0,0,0
80,131072,7168,16384,torch.float8_e4m3fn,85,0,77358.0635,a8w8_bpreshuffle_256x64x128x128_16x16_16x16_8x32x1_8x32x1_1x32x1x8_8x8x1_2x1_intrawave_v3,0,0,0
80,131072,7168,18432,torch.float8_e4m3fn,85,0,87126.4572,a8w8_bpreshuffle_256x64x128x128_16x16_16x16_8x32x1_8x32x1_1x32x1x8_8x8x1_2x1_intrawave_v3,0,0,0
80,131072,8192,1536,torch.float8_e4m3fn,71,0,9394.7156,a8w8_bpreshuffle_256x128x128x64_16x16_16x16_4x64x1_4x64x1_1x32x1x8_8x8x1_2x1_intrawave_v3,0,0,0
80,131072,11264,1536,torch.float8_e4m3fn,71,0,12851.8716,a8w8_bpreshuffle_256x128x128x64_16x16_16x16_4x64x1_4x64x1_1x32x1x8_8x8x1_2x1_intrawave_v3,0,0,0
80,131072,24576,1536,torch.float8_e4m3fn,0,0,,a8w8_bpreshuffle_256x128x128x128_16x16_16x16_8x32x1_8x32x1_1x32x1x8_8x8x1_2x1_intrawave_v3,0,0,0
