aiter/configs/a8w8_bpreshuffle_mxfp8_tuned_gemm.csv
gfx,cu_num,M,N,K,q_dtype_w,libtype,kernelId,splitK,us,kernelName,tflops,bw,errRatio
gfx950,256,1,768,7168,mxfp8,flydsl_mxfp8,180,1,22.4587,flydsl_bpreshuflle_32x128x256_MXF8_MXF8_B16_2x0x0x1x0_default,0.49,245.51,0.0
gfx950,256,2,768,7168,mxfp8,flydsl_mxfp8,398,1,22.4389,flydsl_bpreshuflle_32x128x256_MXF8_MXF8_B16_2x0x1x2x0_default,0.98,246.11,0.0
gfx950,256,4,768,7168,mxfp8,flydsl_mxfp8,736,1,22.3767,flydsl_bpreshuflle_32x128x256_MXF8_MXF8_B16_2x1x0x4x0_default,1.97,247.57,0.0
gfx950,256,8,768,7168,mxfp8,flydsl_mxfp8,736,1,22.5618,flydsl_bpreshuflle_32x128x256_MXF8_MXF8_B16_2x1x0x4x0_default,3.9,247.08,0.0
gfx950,256,16,768,7168,mxfp8,flydsl_mxfp8,268,1,23.0185,flydsl_bpreshuflle_32x128x256_MXF8_MXF8_B16_2x1x0x1x0_default,7.65,245.21,0.0
gfx950,256,32,768,7168,mxfp8,flydsl_mxfp8,736,1,24.2486,flydsl_bpreshuflle_32x128x256_MXF8_MXF8_B16_2x1x0x4x0_default,14.53,238.51,0.0
gfx950,256,48,768,7168,mxfp8,flydsl_mxfp8,524,1,22.5221,flydsl_bpreshuflle_32x128x256_MXF8_MXF8_B16_2x0x0x3x0_default,23.47,262.98,0.0
gfx950,256,64,768,7168,mxfp8,flydsl_mxfp8,736,1,22.92,flydsl_bpreshuflle_32x128x256_MXF8_MXF8_B16_2x1x0x4x0_default,30.74,264.49,0.0
gfx950,256,80,768,7168,mxfp8,flydsl_mxfp8,4,1,22.151,flydsl_bpreshuflle_32x128x256_MXF8_MXF8_B16_2x0x0x0x0_default,39.76,279.96,0.0
gfx950,256,96,768,7168,mxfp8,flydsl_mxfp8,48,1,22.3555,flydsl_bpreshuflle_32x128x256_MXF8_MXF8_B16_2x0x1x0x0_default,47.28,283.63,0.0
gfx950,256,112,768,7168,mxfp8,flydsl_mxfp8,92,1,22.0823,flydsl_bpreshuflle_32x128x256_MXF8_MXF8_B16_2x1x0x0x0_default,55.84,293.44,0.0
gfx950,256,128,768,7168,mxfp8,flydsl_mxfp8,224,1,22.0619,flydsl_bpreshuflle_32x128x256_MXF8_MXF8_B16_2x0x1x1x0_default,63.88,300.03,0.0
gfx950,256,144,768,7168,mxfp8,flydsl_mxfp8,562,1,21.9297,flydsl_bpreshuflle_32x128x256_MXF8_MXF8_B16_2x0x1x3x0_default,72.3,308.18,0.0
gfx950,256,160,768,7168,mxfp8,flydsl_mxfp8,440,1,21.9883,flydsl_bpreshuflle_32x128x256_MXF8_MXF8_B16_2x1x0x2x0_default,80.12,313.7,0.0
gfx950,256,176,768,7168,mxfp8,flydsl_mxfp8,356,1,21.9137,flydsl_bpreshuflle_32x128x256_MXF8_MXF8_B16_2x0x0x2x0_default,88.43,321.12,0.0
gfx950,256,192,768,7168,mxfp8,flydsl_mxfp8,562,1,21.9707,flydsl_bpreshuflle_32x128x256_MXF8_MXF8_B16_2x0x1x3x0_default,96.22,326.63,0.0
gfx950,256,208,768,7168,mxfp8,flydsl_mxfp8,224,1,22.0592,flydsl_bpreshuflle_32x128x256_MXF8_MXF8_B16_2x0x1x1x0_default,103.82,331.63,0.0
gfx950,256,224,768,7168,mxfp8,flydsl_mxfp8,524,1,22.1073,flydsl_bpreshuflle_32x128x256_MXF8_MXF8_B16_2x0x0x3x0_default,111.56,337.21,0.0
gfx950,256,240,768,7168,mxfp8,flydsl_mxfp8,524,1,21.9596,flydsl_bpreshuflle_32x128x256_MXF8_MXF8_B16_2x0x0x3x0_default,120.33,345.82,0.0
gfx950,256,256,768,7168,mxfp8,flydsl_mxfp8,224,1,22.1668,flydsl_bpreshuflle_32x128x256_MXF8_MXF8_B16_2x0x1x1x0_default,127.15,348.87,0.0
gfx950,256,288,768,7168,mxfp8,flydsl_mxfp8,180,1,22.2721,flydsl_bpreshuflle_32x128x256_MXF8_MXF8_B16_2x0x0x1x0_default,142.37,359.72,0.0
gfx950,256,320,768,7168,mxfp8,flydsl_mxfp8,398,1,22.1085,flydsl_bpreshuflle_32x128x256_MXF8_MXF8_B16_2x0x1x2x0_default,159.36,374.98,0.0
gfx950,256,352,768,7168,mxfp8,flydsl_mxfp8,721,1,20.9095,flydsl_bpreshuflle_32x128x256_MXF8_MXF8_B16_2x0x1x4x4_default,185.35,409.81,0.0
gfx950,256,384,768,7168,mxfp8,flydsl_mxfp8,721,1,20.8884,flydsl_bpreshuflle_32x128x256_MXF8_MXF8_B16_2x0x1x4x4_default,202.4,423.55,0.0
gfx950,256,416,768,7168,mxfp8,flydsl_mxfp8,721,1,21.171,flydsl_bpreshuflle_32x128x256_MXF8_MXF8_B16_2x0x1x4x4_default,216.34,431.06,0.0
gfx950,256,448,768,7168,mxfp8,flydsl_mxfp8,721,1,20.7656,flydsl_bpreshuflle_32x128x256_MXF8_MXF8_B16_2x0x1x4x4_default,237.53,452.88,0.0
gfx950,256,480,768,7168,mxfp8,flydsl_mxfp8,721,1,20.8527,flydsl_bpreshuflle_32x128x256_MXF8_MXF8_B16_2x0x1x4x4_default,253.44,464.35,0.0
gfx950,256,512,768,7168,mxfp8,flydsl_mxfp8,721,1,20.8077,flydsl_bpreshuflle_32x128x256_MXF8_MXF8_B16_2x0x1x4x4_default,270.92,478.74,0.0
gfx950,256,544,768,7168,mxfp8,flydsl_mxfp8,721,1,21.2287,flydsl_bpreshuflle_32x128x256_MXF8_MXF8_B16_2x0x1x4x4_default,282.14,482.37,0.0
gfx950,256,576,768,7168,mxfp8,flydsl_mxfp8,721,1,21.1895,flydsl_bpreshuflle_32x128x256_MXF8_MXF8_B16_2x0x1x4x4_default,299.29,496.4,0.0
gfx950,256,608,768,7168,mxfp8,flydsl_mxfp8,721,1,20.856,flydsl_bpreshuflle_32x128x256_MXF8_MXF8_B16_2x0x1x4x4_default,320.97,517.7,0.0
gfx950,256,640,768,7168,mxfp8,flydsl_mxfp8,721,1,20.7992,flydsl_bpreshuflle_32x128x256_MXF8_MXF8_B16_2x0x1x4x4_default,338.78,532.5,0.0
gfx950,256,672,768,7168,mxfp8,flydsl_mxfp8,721,1,20.7941,flydsl_bpreshuflle_32x128x256_MXF8_MXF8_B16_2x0x1x4x4_default,355.81,546.03,0.0
gfx950,256,704,768,7168,mxfp8,flydsl_mxfp8,721,1,21.1706,flydsl_bpreshuflle_32x128x256_MXF8_MXF8_B16_2x0x1x4x4_default,366.12,549.47,0.0
gfx950,256,736,768,7168,mxfp8,flydsl_mxfp8,721,1,20.7038,flydsl_bpreshuflle_32x128x256_MXF8_MXF8_B16_2x0x1x4x4_default,391.4,575.31,0.0
gfx950,256,768,768,7168,mxfp8,flydsl_mxfp8,721,1,20.395,flydsl_bpreshuflle_32x128x256_MXF8_MXF8_B16_2x0x1x4x4_default,414.6,597.68,0.0
gfx950,256,800,768,7168,mxfp8,flydsl_mxfp8,721,1,20.8975,flydsl_bpreshuflle_32x128x256_MXF8_MXF8_B16_2x0x1x4x4_default,421.49,596.64,0.0
gfx950,256,832,768,7168,mxfp8,flydsl_mxfp8,721,1,21.3452,flydsl_bpreshuflle_32x128x256_MXF8_MXF8_B16_2x0x1x4x4_default,429.15,597.17,0.0
gfx950,256,864,768,7168,mxfp8,flydsl_mxfp8,721,1,21.0917,flydsl_bpreshuflle_32x128x256_MXF8_MXF8_B16_2x0x1x4x4_default,451.02,617.55,0.0
gfx950,256,896,768,7168,mxfp8,flydsl_mxfp8,721,1,21.018,flydsl_bpreshuflle_32x128x256_MXF8_MXF8_B16_2x0x1x4x4_default,469.36,632.97,0.0
gfx950,256,928,768,7168,mxfp8,flydsl_mxfp8,721,1,21.0654,flydsl_bpreshuflle_32x128x256_MXF8_MXF8_B16_2x0x1x4x4_default,485.03,644.77,0.0
gfx950,256,960,768,7168,mxfp8,flydsl_mxfp8,721,1,21.2636,flydsl_bpreshuflle_32x128x256_MXF8_MXF8_B16_2x0x1x4x4_default,497.08,651.86,0.0
gfx950,256,992,768,7168,mxfp8,flydsl_mxfp8,721,1,20.8042,flydsl_bpreshuflle_32x128x256_MXF8_MXF8_B16_2x0x1x4x4_default,524.99,679.64,0.0
gfx950,256,1024,768,7168,mxfp8,flydsl_mxfp8,721,1,20.6088,flydsl_bpreshuflle_32x128x256_MXF8_MXF8_B16_2x0x1x4x4_default,547.06,699.6,0.0
gfx950,256,1088,768,7168,mxfp8,flydsl_mxfp8,721,1,21.3067,flydsl_bpreshuflle_32x128x256_MXF8_MXF8_B16_2x0x1x4x4_default,562.21,702.83,0.0
gfx950,256,1152,768,7168,mxfp8,flydsl_mxfp8,721,1,20.8614,flydsl_bpreshuflle_32x128x256_MXF8_MXF8_B16_2x0x1x4x4_default,607.99,744.53,0.0
gfx950,256,1216,768,7168,mxfp8,flydsl_mxfp8,562,1,22.0489,flydsl_bpreshuflle_32x128x256_MXF8_MXF8_B16_2x0x1x3x0_default,607.21,729.7,0.0
gfx950,256,1280,768,7168,mxfp8,flydsl_mxfp8,721,1,21.1612,flydsl_bpreshuflle_32x128x256_MXF8_MXF8_B16_2x0x1x4x4_default,665.98,786.64,0.0
gfx950,256,1344,768,7168,mxfp8,flydsl_mxfp8,721,1,21.7088,flydsl_bpreshuflle_32x128x256_MXF8_MXF8_B16_2x0x1x4x4_default,681.64,792.45,0.0
gfx950,256,1408,768,7168,mxfp8,flydsl_mxfp8,721,1,27.5629,flydsl_bpreshuflle_32x128x256_MXF8_MXF8_B16_2x0x1x4x4_default,562.43,644.35,0.0
gfx950,256,1472,768,7168,mxfp8,flydsl_mxfp8,721,1,28.2607,flydsl_bpreshuflle_32x128x256_MXF8_MXF8_B16_2x0x1x4x4_default,573.47,648.15,0.0
gfx950,256,1536,768,7168,mxfp8,flydsl_mxfp8,721,1,27.701,flydsl_bpreshuflle_32x128x256_MXF8_MXF8_B16_2x0x1x4x4_default,610.5,681.36,0.0
gfx950,256,1600,768,7168,mxfp8,flydsl_mxfp8,721,1,29.019,flydsl_bpreshuflle_32x128x256_MXF8_MXF8_B16_2x0x1x4x4_default,607.05,669.61,0.0
gfx950,256,1664,768,7168,mxfp8,flydsl_mxfp8,721,1,28.8565,flydsl_bpreshuflle_32x128x256_MXF8_MXF8_B16_2x0x1x4x4_default,634.89,692.69,0.0
gfx950,256,1728,768,7168,mxfp8,flydsl_mxfp8,721,1,28.875,flydsl_bpreshuflle_32x128x256_MXF8_MXF8_B16_2x0x1x4x4_default,658.89,711.53,0.0
gfx950,256,1792,768,7168,mxfp8,flydsl_mxfp8,721,1,29.1127,flydsl_bpreshuflle_32x128x256_MXF8_MXF8_B16_2x0x1x4x4_default,677.71,724.86,0.0
gfx950,256,1856,768,7168,mxfp8,flydsl_mxfp8,721,1,29.5237,flydsl_bpreshuflle_32x128x256_MXF8_MXF8_B16_2x0x1x4x4_default,692.14,733.64,0.0
gfx950,256,1920,768,7168,mxfp8,flydsl_mxfp8,721,1,28.8946,flydsl_bpreshuflle_32x128x256_MXF8_MXF8_B16_2x0x1x4x4_default,731.6,768.89,0.0
gfx950,256,1984,768,7168,mxfp8,flydsl_mxfp8,721,1,29.8275,flydsl_bpreshuflle_32x128x256_MXF8_MXF8_B16_2x0x1x4x4_default,732.34,763.52,0.0
gfx950,256,2048,768,7168,mxfp8,flydsl_mxfp8,316,1,30.1959,flydsl_bpreshuflle_64x128x256_MXF8_MXF8_B16_2x1x1x1x0_default,746.74,772.65,0.0
gfx950,256,4096,768,7168,mxfp8,flydsl_mxfp8,162,1,38.3561,flydsl_bpreshuflle_64x128x256_MXF8_MXF8_B16_2x1x1x0x4_default,1175.75,1073.01,0.0
gfx950,256,6144,768,7168,mxfp8,flydsl_mxfp8,774,1,48.945,flydsl_bpreshuflle_96x128x256_MXF8_MXF8_B16_2x1x1x4x0_default,1382.08,1205.08,0.0
gfx950,256,8192,768,7168,mxfp8,flydsl_mxfp8,346,1,58.3391,flydsl_bpreshuflle_128x128x256_MXF8_MXF8_B16_2x1x1x1x4_default,1546.04,1316.58,0.0
gfx950,256,10240,768,7168,mxfp8,flydsl_mxfp8,148,1,64.4463,flydsl_bpreshuflle_128x128x256_MXF8_MXF8_B16_2x1x1x0x0_default,1749.41,1468.42,0.0
gfx950,256,12288,768,7168,mxfp8,flydsl_mxfp8,167,1,79.6806,flydsl_bpreshuflle_96x256x128_MXF8_MXF8_B16_2x1x1x0x4_default,1697.92,1411.38,0.0
gfx950,256,14336,768,7168,mxfp8,flydsl_mxfp8,321,1,87.9093,flydsl_bpreshuflle_96x256x128_MXF8_MXF8_B16_2x1x1x1x0_default,1795.49,1482.05,0.0
gfx950,256,16384,768,7168,mxfp8,flydsl_mxfp8,573,1,100.8674,flydsl_bpreshuflle_128x128x128_MXF8_MXF8_B16_2x0x1x3x0_default,1788.37,1468.38,0.0
gfx950,256,32768,768,7168,mxfp8,flydsl_mxfp8,411,1,185.7488,flydsl_bpreshuflle_128x256x128_MXF8_MXF8_B16_2x0x1x2x0_default,1942.29,1565.11,0.0
gfx950,256,1,2048,7168,mxfp8,flydsl_mxfp8,524,1,22.6746,flydsl_bpreshuflle_32x128x256_MXF8_MXF8_B16_2x0x0x3x0_default,1.29,647.92,0.0
gfx950,256,2,2048,7168,mxfp8,flydsl_mxfp8,92,1,22.434,flydsl_bpreshuflle_32x128x256_MXF8_MXF8_B16_2x1x0x0x0_default,2.62,655.37,0.0
gfx950,256,4,2048,7168,mxfp8,flydsl_mxfp8,736,1,22.6116,flydsl_bpreshuflle_32x128x256_MXF8_MXF8_B16_2x1x0x4x0_default,5.19,651.22,0.0
gfx950,256,8,2048,7168,mxfp8,flydsl_mxfp8,736,1,23.0296,flydsl_bpreshuflle_32x128x256_MXF8_MXF8_B16_2x1x0x4x0_default,10.2,641.36,0.0
gfx950,256,16,2048,7168,mxfp8,flydsl_mxfp8,92,1,22.8043,flydsl_bpreshuflle_32x128x256_MXF8_MXF8_B16_2x1x0x0x0_default,20.6,651.64,0.0
gfx950,256,32,2048,7168,mxfp8,flydsl_mxfp8,180,1,23.6324,flydsl_bpreshuflle_32x128x256_MXF8_MXF8_B16_2x0x0x1x0_default,39.76,636.44,0.0
gfx950,256,48,2048,7168,mxfp8,flydsl_mxfp8,48,1,21.9319,flydsl_bpreshuflle_32x128x256_MXF8_MXF8_B16_2x0x1x0x0_default,64.26,694.0,0.0
gfx950,256,64,2048,7168,mxfp8,flydsl_mxfp8,440,1,22.1655,flydsl_bpreshuflle_32x128x256_MXF8_MXF8_B16_2x1x0x2x0_default,84.77,694.82,0.0
gfx950,256,80,2048,7168,mxfp8,flydsl_mxfp8,356,1,22.1085,flydsl_bpreshuflle_32x128x256_MXF8_MXF8_B16_2x0x0x2x0_default,106.24,704.76,0.0
gfx950,256,96,2048,7168,mxfp8,flydsl_mxfp8,48,1,22.256,flydsl_bpreshuflle_32x128x256_MXF8_MXF8_B16_2x0x1x0x0_default,126.64,708.19,0.0
gfx950,256,112,2048,7168,mxfp8,flydsl_mxfp8,721,1,20.249,flydsl_bpreshuflle_32x128x256_MXF8_MXF8_B16_2x0x1x4x4_default,162.39,787.28,0.0
gfx950,256,128,2048,7168,mxfp8,flydsl_mxfp8,721,1,21.1372,flydsl_bpreshuflle_32x128x256_MXF8_MXF8_B16_2x0x1x4x4_default,177.8,762.72,0.0
gfx950,256,144,2048,7168,mxfp8,flydsl_mxfp8,721,1,20.4713,flydsl_bpreshuflle_32x128x256_MXF8_MXF8_B16_2x0x1x4x4_default,206.53,796.34,0.0
gfx950,256,160,2048,7168,mxfp8,flydsl_mxfp8,721,1,20.8574,flydsl_bpreshuflle_32x128x256_MXF8_MXF8_B16_2x0x1x4x4_default,225.23,790.24,0.0
gfx950,256,176,2048,7168,mxfp8,flydsl_mxfp8,721,1,20.5196,flydsl_bpreshuflle_32x128x256_MXF8_MXF8_B16_2x0x1x4x4_default,251.83,812.03,0.0
gfx950,256,192,2048,7168,mxfp8,flydsl_mxfp8,721,1,20.5692,flydsl_bpreshuflle_32x128x256_MXF8_MXF8_B16_2x0x1x4x4_default,274.06,818.83,0.0
gfx950,256,208,2048,7168,mxfp8,flydsl_mxfp8,721,1,20.4673,flydsl_bpreshuflle_32x128x256_MXF8_MXF8_B16_2x0x1x4x4_default,298.37,831.72,0.0
gfx950,256,224,2048,7168,mxfp8,flydsl_mxfp8,721,1,20.8031,flydsl_bpreshuflle_32x128x256_MXF8_MXF8_B16_2x0x1x4x4_default,316.14,826.95,0.0
gfx950,256,240,2048,7168,mxfp8,flydsl_mxfp8,721,1,20.1187,flydsl_bpreshuflle_32x128x256_MXF8_MXF8_B16_2x0x1x4x4_default,350.24,864.04,0.0
gfx950,256,256,2048,7168,mxfp8,flydsl_mxfp8,721,1,20.7822,flydsl_bpreshuflle_32x128x256_MXF8_MXF8_B16_2x0x1x4x4_default,361.66,845.13,0.0
gfx950,256,288,2048,7168,mxfp8,flydsl_mxfp8,721,1,20.4179,flydsl_bpreshuflle_32x128x256_MXF8_MXF8_B16_2x0x1x4x4_default,414.13,877.86,0.0
gfx950,256,320,2048,7168,mxfp8,flydsl_mxfp8,721,1,20.5181,flydsl_bpreshuflle_32x128x256_MXF8_MXF8_B16_2x0x1x4x4_default,457.9,891.14,0.0
gfx950,256,352,2048,7168,mxfp8,flydsl_mxfp8,721,1,20.733,flydsl_bpreshuflle_32x128x256_MXF8_MXF8_B16_2x0x1x4x4_default,498.47,899.29,0.0
gfx950,256,384,2048,7168,mxfp8,flydsl_mxfp8,721,1,20.5747,flydsl_bpreshuflle_32x128x256_MXF8_MXF8_B16_2x0x1x4x4_default,547.97,923.73,0.0
gfx950,256,416,2048,7168,mxfp8,flydsl_mxfp8,721,1,20.9301,flydsl_bpreshuflle_32x128x256_MXF8_MXF8_B16_2x0x1x4x4_default,583.55,925.26,0.0
gfx950,256,448,2048,7168,mxfp8,flydsl_mxfp8,721,1,20.8522,flydsl_bpreshuflle_32x128x256_MXF8_MXF8_B16_2x0x1x4x4_default,630.79,946.01,0.0
gfx950,256,480,2048,7168,mxfp8,flydsl_mxfp8,721,1,21.3856,flydsl_bpreshuflle_32x128x256_MXF8_MXF8_B16_2x0x1x4x4_default,658.99,939.27,0.0
gfx950,256,512,2048,7168,mxfp8,flydsl_mxfp8,721,1,21.0044,flydsl_bpreshuflle_32x128x256_MXF8_MXF8_B16_2x0x1x4x4_default,715.68,973.47,0.0
gfx950,256,544,2048,7168,mxfp8,flydsl_mxfp8,721,1,27.4359,flydsl_bpreshuflle_32x128x256_MXF8_MXF8_B16_2x0x1x4x4_default,582.15,758.41,0.0
gfx950,256,576,2048,7168,mxfp8,flydsl_mxfp8,338,1,30.1281,flydsl_bpreshuflle_64x128x256_MXF8_MXF8_B16_2x1x1x1x4_default,561.32,702.6,0.0
gfx950,256,608,2048,7168,mxfp8,flydsl_mxfp8,619,1,29.6049,flydsl_bpreshuflle_32x128x256_MXF8_MXF8_B16_2x1x0x3x4_default,602.97,727.2,0.0
gfx950,256,640,2048,7168,mxfp8,flydsl_mxfp8,338,1,30.4904,flydsl_bpreshuflle_64x128x256_MXF8_MXF8_B16_2x1x1x1x4_default,616.28,717.9,0.0
gfx950,256,672,2048,7168,mxfp8,flydsl_mxfp8,162,1,30.4937,flydsl_bpreshuflle_64x128x256_MXF8_MXF8_B16_2x1x1x0x4_default,647.02,729.64,0.0
gfx950,256,704,2048,7168,mxfp8,flydsl_mxfp8,162,1,30.5864,flydsl_bpreshuflle_64x128x256_MXF8_MXF8_B16_2x1x1x0x4_default,675.78,739.21,0.0
gfx950,256,736,2048,7168,mxfp8,flydsl_mxfp8,338,1,30.51,flydsl_bpreshuflle_64x128x256_MXF8_MXF8_B16_2x1x1x1x4_default,708.26,752.88,0.0
gfx950,256,768,2048,7168,mxfp8,flydsl_mxfp8,338,1,30.7197,flydsl_bpreshuflle_64x128x256_MXF8_MXF8_B16_2x1x1x1x4_default,734.01,759.47,0.0
gfx950,256,800,2048,7168,mxfp8,flydsl_mxfp8,585,1,30.8012,flydsl_bpreshuflle_64x128x256_MXF8_MXF8_B16_2x0x1x3x4_default,762.57,769.17,0.0
gfx950,256,832,2048,7168,mxfp8,flydsl_mxfp8,338,1,31.0041,flydsl_bpreshuflle_64x128x256_MXF8_MXF8_B16_2x1x1x1x4_default,787.88,775.76,0.0
gfx950,256,864,2048,7168,mxfp8,flydsl_mxfp8,162,1,31.2015,flydsl_bpreshuflle_64x128x256_MXF8_MXF8_B16_2x1x1x0x4_default,813.01,782.4,0.0
gfx950,256,896,2048,7168,mxfp8,flydsl_mxfp8,585,1,31.0276,flydsl_bpreshuflle_64x128x256_MXF8_MXF8_B16_2x0x1x3x4_default,847.85,798.41,0.0
gfx950,256,928,2048,7168,mxfp8,flydsl_mxfp8,338,1,31.7334,flydsl_bpreshuflle_64x128x256_MXF8_MXF8_B16_2x1x1x1x4_default,858.6,792.01,0.0
gfx950,256,960,2048,7168,mxfp8,flydsl_mxfp8,585,1,31.9085,flydsl_bpreshuflle_64x128x256_MXF8_MXF8_B16_2x0x1x3x4_default,883.33,798.96,0.0
gfx950,256,992,2048,7168,mxfp8,flydsl_mxfp8,585,1,31.4641,flydsl_bpreshuflle_64x128x256_MXF8_MXF8_B16_2x0x1x3x4_default,925.67,821.7,0.0
gfx950,256,1024,2048,7168,mxfp8,flydsl_mxfp8,338,1,31.5643,flydsl_bpreshuflle_64x128x256_MXF8_MXF8_B16_2x1x1x1x4_default,952.49,830.51,0.0
gfx950,256,1088,2048,7168,mxfp8,flydsl_mxfp8,162,1,34.5255,flydsl_bpreshuflle_64x128x256_MXF8_MXF8_B16_2x1x1x0x4_default,925.22,780.16,0.0
gfx950,256,1152,2048,7168,mxfp8,flydsl_mxfp8,507,1,35.9143,flydsl_bpreshuflle_64x128x256_MXF8_MXF8_B16_2x1x1x2x4_default,941.77,770.06,0.0
gfx950,256,1216,2048,7168,mxfp8,flydsl_mxfp8,729,1,36.6068,flydsl_bpreshuflle_96x128x256_MXF8_MXF8_B16_2x0x1x4x4_default,975.28,775.19,0.0
gfx950,256,1280,2048,7168,mxfp8,flydsl_mxfp8,254,1,36.354,flydsl_bpreshuflle_96x128x256_MXF8_MXF8_B16_2x0x1x1x4_default,1033.75,800.41,0.0
gfx950,256,1344,2048,7168,mxfp8,flydsl_mxfp8,162,1,36.0168,flydsl_bpreshuflle_64x128x256_MXF8_MXF8_B16_2x1x1x0x4_default,1095.6,827.92,0.0
gfx950,256,1408,2048,7168,mxfp8,flydsl_mxfp8,254,1,37.9902,flydsl_bpreshuflle_96x128x256_MXF8_MXF8_B16_2x0x1x1x4_default,1088.15,803.89,0.0
gfx950,256,1472,2048,7168,mxfp8,flydsl_mxfp8,427,1,37.3906,flydsl_bpreshuflle_96x128x256_MXF8_MXF8_B16_2x0x1x2x4_default,1155.85,836.06,0.0
gfx950,256,1536,2048,7168,mxfp8,flydsl_mxfp8,78,1,38.3927,flydsl_bpreshuflle_96x128x256_MXF8_MXF8_B16_2x0x1x0x4_default,1174.63,833.01,0.0
gfx950,256,1600,2048,7168,mxfp8,flydsl_mxfp8,338,1,39.6121,flydsl_bpreshuflle_64x128x256_MXF8_MXF8_B16_2x1x1x1x4_default,1185.91,825.57,0.0
gfx950,256,1664,2048,7168,mxfp8,flydsl_mxfp8,162,1,40.3237,flydsl_bpreshuflle_64x128x256_MXF8_MXF8_B16_2x1x1x0x4_default,1211.58,828.88,0.0
gfx950,256,1728,2048,7168,mxfp8,flydsl_mxfp8,338,1,41.0469,flydsl_bpreshuflle_64x128x256_MXF8_MXF8_B16_2x1x1x1x4_default,1236.01,831.84,0.0
gfx950,256,1792,2048,7168,mxfp8,flydsl_mxfp8,661,1,40.8873,flydsl_bpreshuflle_64x128x256_MXF8_MXF8_B16_2x1x1x3x4_default,1286.79,852.71,0.0
gfx950,256,1856,2048,7168,mxfp8,flydsl_mxfp8,338,1,41.6625,flydsl_bpreshuflle_64x128x256_MXF8_MXF8_B16_2x1x1x1x4_default,1307.95,854.15,0.0
gfx950,256,1920,2048,7168,mxfp8,flydsl_mxfp8,74,1,42.6793,flydsl_bpreshuflle_64x128x256_MXF8_MXF8_B16_2x0x1x0x4_default,1320.81,850.69,0.0
gfx950,256,1984,2048,7168,mxfp8,flydsl_mxfp8,661,1,43.6817,flydsl_bpreshuflle_64x128x256_MXF8_MXF8_B16_2x1x1x3x4_default,1333.52,847.67,0.0
gfx950,256,2048,2048,7168,mxfp8,flydsl_mxfp8,338,1,44.6193,flydsl_bpreshuflle_64x128x256_MXF8_MXF8_B16_2x1x1x1x4_default,1347.61,846.02,0.0
gfx950,256,4096,2048,7168,mxfp8,flydsl_mxfp8,791,1,66.2583,flydsl_bpreshuflle_128x128x256_MXF8_MXF8_B16_2x1x1x4x4_default,1815.0,917.88,0.0
gfx950,256,6144,2048,7168,mxfp8,flydsl_mxfp8,123,1,90.5104,flydsl_bpreshuflle_96x256x128_MXF8_MXF8_B16_2x1x0x0x4_default,1993.02,926.81,0.0
gfx950,256,8192,2048,7168,mxfp8,flydsl_mxfp8,432,1,117.2884,flydsl_bpreshuflle_128x256x128_MXF8_MXF8_B16_2x0x1x2x4_default,2050.66,911.9,0.0
gfx950,256,10240,2048,7168,mxfp8,flydsl_mxfp8,573,1,153.2955,flydsl_bpreshuflle_128x128x128_MXF8_MXF8_B16_2x0x1x3x0_default,1961.23,848.19,0.0
gfx950,256,12288,2048,7168,mxfp8,flydsl_mxfp8,343,1,164.9788,flydsl_bpreshuflle_96x256x128_MXF8_MXF8_B16_2x1x1x1x4_default,2186.81,927.95,0.0
gfx950,256,14336,2048,7168,mxfp8,flydsl_mxfp8,413,1,194.6132,flydsl_bpreshuflle_224x128x128_MXF8_MXF8_B16_2x0x1x2x0_default,2162.79,905.18,0.0
gfx950,256,16384,2048,7168,mxfp8,flydsl_mxfp8,411,1,212.8779,flydsl_bpreshuflle_128x256x128_MXF8_MXF8_B16_2x0x1x2x0_default,2259.68,935.89,0.0
gfx950,256,32768,2048,7168,mxfp8,flydsl_mxfp8,432,1,410.729,flydsl_bpreshuflle_128x256x128_MXF8_MXF8_B16_2x0x1x2x4_default,2342.35,934.38,0.0
gfx950,256,1,6144,7168,mxfp8,flydsl_mxfp8,600,1,23.0765,flydsl_bpreshuflle_32x128x256_MXF8_MXF8_B16_2x1x0x3x0_default,3.82,1909.29,0.0
gfx950,256,2,6144,7168,mxfp8,flydsl_mxfp8,600,1,23.5209,flydsl_bpreshuflle_32x128x256_MXF8_MXF8_B16_2x1x0x3x0_default,7.49,1874.04,0.0
gfx950,256,4,6144,7168,mxfp8,flydsl_mxfp8,736,1,23.4613,flydsl_bpreshuflle_32x128x256_MXF8_MXF8_B16_2x1x0x4x0_default,15.02,1880.46,0.0
gfx950,256,8,6144,7168,mxfp8,flydsl_mxfp8,356,1,23.1609,flydsl_bpreshuflle_32x128x256_MXF8_MXF8_B16_2x0x0x2x0_default,30.42,1908.21,0.0
gfx950,256,16,6144,7168,mxfp8,flydsl_mxfp8,356,1,23.3596,flydsl_bpreshuflle_32x128x256_MXF8_MXF8_B16_2x0x0x2x0_default,60.33,1898.64,0.0
gfx950,256,32,6144,7168,mxfp8,flydsl_mxfp8,440,1,24.493,flydsl_bpreshuflle_32x128x256_MXF8_MXF8_B16_2x1x0x2x0_default,115.08,1823.49,0.0
gfx950,256,48,6144,7168,mxfp8,flydsl_mxfp8,721,1,22.298,flydsl_bpreshuflle_32x128x256_MXF8_MXF8_B16_2x0x1x4x4_default,189.61,2016.96,0.0
gfx950,256,64,6144,7168,mxfp8,flydsl_mxfp8,721,1,22.6396,flydsl_bpreshuflle_32x128x256_MXF8_MXF8_B16_2x0x1x4x4_default,248.99,2000.27,0.0
gfx950,256,80,6144,7168,mxfp8,flydsl_mxfp8,721,1,21.7906,flydsl_bpreshuflle_32x128x256_MXF8_MXF8_B16_2x0x1x4x4_default,323.37,2092.49,0.0
gfx950,256,96,6144,7168,mxfp8,flydsl_mxfp8,721,1,22.455,flydsl_bpreshuflle_32x128x256_MXF8_MXF8_B16_2x0x1x4x4_default,376.56,2044.44,0.0
gfx950,256,112,6144,7168,mxfp8,flydsl_mxfp8,721,1,21.7265,flydsl_bpreshuflle_32x128x256_MXF8_MXF8_B16_2x0x1x4x4_default,454.05,2127.32,0.0
gfx950,256,128,6144,7168,mxfp8,flydsl_mxfp8,721,1,22.4783,flydsl_bpreshuflle_32x128x256_MXF8_MXF8_B16_2x0x1x4x4_default,501.56,2070.02,0.0
gfx950,256,144,6144,7168,mxfp8,flydsl_mxfp8,721,1,22.2999,flydsl_bpreshuflle_32x128x256_MXF8_MXF8_B16_2x0x1x4x4_default,568.77,2100.54,0.0
gfx950,256,160,6144,7168,mxfp8,flydsl_mxfp8,721,1,22.085,flydsl_bpreshuflle_32x128x256_MXF8_MXF8_B16_2x0x1x4x4_default,638.12,2135.08,0.0
gfx950,256,176,6144,7168,mxfp8,flydsl_mxfp8,721,1,30.0221,flydsl_bpreshuflle_32x128x256_MXF8_MXF8_B16_2x0x1x4x4_default,516.36,1580.98,0.0
gfx950,256,192,6144,7168,mxfp8,flydsl_mxfp8,721,1,30.0995,flydsl_bpreshuflle_32x128x256_MXF8_MXF8_B16_2x0x1x4x4_default,561.85,1587.26,0.0
gfx950,256,208,6144,7168,mxfp8,flydsl_mxfp8,721,1,31.0588,flydsl_bpreshuflle_32x128x256_MXF8_MXF8_B16_2x0x1x4x4_default,589.87,1548.26,0.0
gfx950,256,224,6144,7168,mxfp8,flydsl_mxfp8,721,1,31.1213,flydsl_bpreshuflle_32x128x256_MXF8_MXF8_B16_2x0x1x4x4_default,633.97,1555.15,0.0
gfx950,256,240,6144,7168,mxfp8,flydsl_mxfp8,246,1,31.6341,flydsl_bpreshuflle_32x128x256_MXF8_MXF8_B16_2x0x1x1x4_default,668.24,1539.78,0.0
gfx950,256,256,6144,7168,mxfp8,flydsl_mxfp8,334,1,32.1553,flydsl_bpreshuflle_32x128x256_MXF8_MXF8_B16_2x1x1x1x4_default,701.24,1524.51,0.0
gfx950,256,288,6144,7168,mxfp8,flydsl_mxfp8,338,1,33.0533,flydsl_bpreshuflle_64x128x256_MXF8_MXF8_B16_2x1x1x1x4_default,767.46,1501.92,0.0
gfx950,256,320,6144,7168,mxfp8,flydsl_mxfp8,423,1,33.4242,flydsl_bpreshuflle_64x128x256_MXF8_MXF8_B16_2x0x1x2x4_default,843.27,1503.88,0.0
gfx950,256,352,6144,7168,mxfp8,flydsl_mxfp8,661,1,35.8018,flydsl_bpreshuflle_64x128x256_MXF8_MXF8_B16_2x1x1x3x4_default,866.0,1421.4,0.0
gfx950,256,384,6144,7168,mxfp8,flydsl_mxfp8,661,1,35.9013,flydsl_bpreshuflle_64x128x256_MXF8_MXF8_B16_2x1x1x3x4_default,942.11,1434.8,0.0
gfx950,256,416,6144,7168,mxfp8,flydsl_mxfp8,729,1,36.8094,flydsl_bpreshuflle_96x128x256_MXF8_MXF8_B16_2x0x1x4x4_default,995.44,1416.32,0.0
gfx950,256,448,6144,7168,mxfp8,flydsl_mxfp8,729,1,37.6475,flydsl_bpreshuflle_96x128x256_MXF8_MXF8_B16_2x0x1x4x4_default,1048.14,1401.33,0.0
gfx950,256,480,6144,7168,mxfp8,flydsl_mxfp8,427,1,38.2191,flydsl_bpreshuflle_96x128x256_MXF8_MXF8_B16_2x0x1x2x4_default,1106.22,1396.66,0.0
gfx950,256,512,6144,7168,mxfp8,flydsl_mxfp8,250,1,40.0348,flydsl_bpreshuflle_64x128x256_MXF8_MXF8_B16_2x0x1x1x4_default,1126.45,1348.87,0.0
gfx950,256,544,6144,7168,mxfp8,flydsl_mxfp8,162,1,41.6837,flydsl_bpreshuflle_64x128x256_MXF8_MXF8_B16_2x1x1x0x4_default,1149.51,1310.45,0.0
gfx950,256,576,6144,7168,mxfp8,flydsl_mxfp8,338,1,42.5893,flydsl_bpreshuflle_64x128x256_MXF8_MXF8_B16_2x1x1x1x4_default,1191.25,1297.2,0.0
gfx950,256,608,6144,7168,mxfp8,flydsl_mxfp8,74,1,43.6409,flydsl_bpreshuflle_64x128x256_MXF8_MXF8_B16_2x0x1x0x4_default,1227.13,1280.21,0.0
gfx950,256,640,6144,7168,mxfp8,flydsl_mxfp8,338,1,44.6249,flydsl_bpreshuflle_64x128x256_MXF8_MXF8_B16_2x1x1x1x4_default,1263.23,1265.93,0.0
gfx950,256,672,6144,7168,mxfp8,flydsl_mxfp8,254,1,46.8413,flydsl_bpreshuflle_96x128x256_MXF8_MXF8_B16_2x0x1x1x4_default,1263.63,1219.32,0.0
gfx950,256,704,6144,7168,mxfp8,flydsl_mxfp8,342,1,47.6762,flydsl_bpreshuflle_96x128x256_MXF8_MXF8_B16_2x1x1x1x4_default,1300.62,1211.03,0.0
gfx950,256,736,6144,7168,mxfp8,flydsl_mxfp8,254,1,48.0618,flydsl_bpreshuflle_96x128x256_MXF8_MXF8_B16_2x0x1x1x4_default,1348.83,1214.27,0.0
gfx950,256,768,6144,7168,mxfp8,flydsl_mxfp8,789,1,49.6242,flydsl_bpreshuflle_96x128x256_MXF8_MXF8_B16_2x1x1x4x4_default,1363.16,1188.58,0.0
gfx950,256,800,6144,7168,mxfp8,flydsl_mxfp8,78,1,50.939,flydsl_bpreshuflle_96x128x256_MXF8_MXF8_B16_2x0x1x0x4_default,1383.31,1170.12,0.0
gfx950,256,832,6144,7168,mxfp8,flydsl_mxfp8,342,1,51.6742,flydsl_bpreshuflle_96x128x256_MXF8_MXF8_B16_2x1x1x1x4_default,1418.17,1165.53,0.0
gfx950,256,864,6144,7168,mxfp8,flydsl_mxfp8,789,1,51.6834,flydsl_bpreshuflle_96x128x256_MXF8_MXF8_B16_2x1x1x4x4_default,1472.45,1177.36,0.0
gfx950,256,896,6144,7168,mxfp8,flydsl_mxfp8,342,1,54.3918,flydsl_bpreshuflle_96x128x256_MXF8_MXF8_B16_2x1x1x1x4_default,1450.95,1130.18,0.0
gfx950,256,928,6144,7168,mxfp8,flydsl_mxfp8,342,1,52.461,flydsl_bpreshuflle_96x128x256_MXF8_MXF8_B16_2x1x1x1x4_default,1558.08,1183.65,0.0
gfx950,256,960,6144,7168,mxfp8,flydsl_mxfp8,78,1,54.2738,flydsl_bpreshuflle_96x128x256_MXF8_MXF8_B16_2x0x1x0x4_default,1557.97,1155.58,0.0
gfx950,256,992,6144,7168,mxfp8,flydsl_mxfp8,669,1,58.4654,flydsl_bpreshuflle_128x128x256_MXF8_MXF8_B16_2x1x1x3x4_default,1494.49,1083.39,0.0
gfx950,256,1024,6144,7168,mxfp8,flydsl_mxfp8,791,1,59.3695,flydsl_bpreshuflle_128x128x256_MXF8_MXF8_B16_2x1x1x4x4_default,1519.2,1077.37,0.0
gfx950,256,1088,6144,7168,mxfp8,flydsl_mxfp8,170,1,62.1075,flydsl_bpreshuflle_128x128x256_MXF8_MXF8_B16_2x1x1x0x4_default,1542.99,1049.93,0.0
gfx950,256,1152,6144,7168,mxfp8,flydsl_mxfp8,515,1,62.5587,flydsl_bpreshuflle_128x128x256_MXF8_MXF8_B16_2x1x1x2x4_default,1621.97,1062.26,0.0
gfx950,256,1216,6144,7168,mxfp8,flydsl_mxfp8,170,1,64.3071,flydsl_bpreshuflle_128x128x256_MXF8_MXF8_B16_2x1x1x0x4_default,1665.54,1052.74,0.0
gfx950,256,1280,6144,7168,mxfp8,flydsl_mxfp8,593,1,66.4575,flydsl_bpreshuflle_128x128x256_MXF8_MXF8_B16_2x0x1x3x4_default,1696.47,1037.41,0.0
gfx950,256,1344,6144,7168,mxfp8,flydsl_mxfp8,343,1,72.1407,flydsl_bpreshuflle_96x256x128_MXF8_MXF8_B16_2x1x1x1x4_default,1640.96,972.95,0.0
gfx950,256,1408,6144,7168,mxfp8,flydsl_mxfp8,626,1,76.6852,flydsl_bpreshuflle_96x128x128_MXF8_MXF8_B16_2x1x0x3x4_default,1617.22,931.53,0.0
gfx950,256,1472,6144,7168,mxfp8,flydsl_mxfp8,512,1,76.1087,flydsl_bpreshuflle_96x256x128_MXF8_MXF8_B16_2x1x1x2x4_default,1703.54,954.94,0.0
gfx950,256,1536,6144,7168,mxfp8,flydsl_mxfp8,512,1,75.8704,flydsl_bpreshuflle_96x256x128_MXF8_MXF8_B16_2x1x1x2x4_default,1783.19,974.35,0.0
gfx950,256,1600,6144,7168,mxfp8,flydsl_mxfp8,167,1,80.1988,flydsl_bpreshuflle_96x256x128_MXF8_MXF8_B16_2x1x1x0x4_default,1757.24,937.29,0.0
gfx950,256,1664,6144,7168,mxfp8,flydsl_mxfp8,167,1,80.1885,flydsl_bpreshuflle_96x256x128_MXF8_MXF8_B16_2x1x1x0x4_default,1827.77,952.94,0.0
gfx950,256,1728,6144,7168,mxfp8,flydsl_mxfp8,343,1,82.3636,flydsl_bpreshuflle_96x256x128_MXF8_MXF8_B16_2x1x1x1x4_default,1847.94,942.89,0.0
gfx950,256,1792,6144,7168,mxfp8,flydsl_mxfp8,167,1,84.2768,flydsl_bpreshuflle_96x256x128_MXF8_MXF8_B16_2x1x1x0x4_default,1872.88,936.26,0.0
gfx950,256,1856,6144,7168,mxfp8,flydsl_mxfp8,512,1,83.9504,flydsl_bpreshuflle_96x256x128_MXF8_MXF8_B16_2x1x1x2x4_default,1947.31,954.74,0.0
gfx950,256,1920,6144,7168,mxfp8,flydsl_mxfp8,167,1,85.2587,flydsl_bpreshuflle_96x256x128_MXF8_MXF8_B16_2x1x1x0x4_default,1983.54,954.69,0.0
gfx950,256,1984,6144,7168,mxfp8,flydsl_mxfp8,512,1,88.5266,flydsl_bpreshuflle_96x256x128_MXF8_MXF8_B16_2x1x1x2x4_default,1974.0,933.51,0.0
gfx950,256,2048,6144,7168,mxfp8,flydsl_mxfp8,592,1,97.6753,flydsl_bpreshuflle_128x128x128_MXF8_MXF8_B16_2x0x1x3x4_default,1846.82,858.83,0.0
gfx950,256,4096,6144,7168,mxfp8,flydsl_mxfp8,432,1,165.8923,flydsl_bpreshuflle_128x256x128_MXF8_MXF8_B16_2x0x1x2x4_default,2174.77,745.86,0.0
gfx950,256,6144,6144,7168,mxfp8,flydsl_mxfp8,167,1,228.9566,flydsl_bpreshuflle_96x256x128_MXF8_MXF8_B16_2x1x1x0x4_default,2363.62,714.45,0.0
gfx950,256,8192,6144,7168,mxfp8,flydsl_mxfp8,432,1,313.603,flydsl_bpreshuflle_128x256x128_MXF8_MXF8_B16_2x0x1x2x4_default,2300.85,648.67,0.0
gfx950,256,10240,6144,7168,mxfp8,flydsl_mxfp8,432,1,383.4182,flydsl_bpreshuflle_128x256x128_MXF8_MXF8_B16_2x0x1x2x4_default,2352.37,634.48,0.0
gfx950,256,12288,6144,7168,mxfp8,flydsl_mxfp8,167,1,441.0074,flydsl_bpreshuflle_96x256x128_MXF8_MXF8_B16_2x1x1x0x4_default,2454.23,641.97,0.0
gfx950,256,14336,6144,7168,mxfp8,flydsl_mxfp8,432,1,525.9485,flydsl_bpreshuflle_128x256x128_MXF8_MXF8_B16_2x0x1x2x4_default,2400.84,614.06,0.0
gfx950,256,16384,6144,7168,mxfp8,flydsl_mxfp8,432,1,586.1202,flydsl_bpreshuflle_128x256x128_MXF8_MXF8_B16_2x0x1x2x4_default,2462.14,619.0,0.0
gfx950,256,20480,6144,7168,mxfp8,flydsl_mxfp8,411,1,747.2474,flydsl_bpreshuflle_128x256x128_MXF8_MXF8_B16_2x0x1x2x0_default,2414.04,592.17,0.0
gfx950,256,24576,6144,7168,mxfp8,flydsl_mxfp8,411,1,908.1824,flydsl_bpreshuflle_128x256x128_MXF8_MXF8_B16_2x0x1x2x0_default,2383.51,574.98,0.0
gfx950,256,28672,6144,7168,mxfp8,flydsl_mxfp8,432,1,1056.6254,flydsl_bpreshuflle_128x256x128_MXF8_MXF8_B16_2x0x1x2x4_default,2390.1,569.63,0.0
gfx950,256,32768,6144,7168,mxfp8,flydsl_mxfp8,432,1,1210.0,flydsl_bpreshuflle_128x256x128_MXF8_MXF8_B16_2x0x1x2x4_default,2385.3,563.28,0.0
gfx950,256,40960,6144,7168,mxfp8,flydsl_mxfp8,167,1,1542.4747,flydsl_bpreshuflle_96x256x128_MXF8_MXF8_B16_2x1x1x0x4_default,2338.95,545.2,0.0
gfx950,256,49152,6144,7168,mxfp8,flydsl_mxfp8,432,1,1804.5208,flydsl_bpreshuflle_128x256x128_MXF8_MXF8_B16_2x0x1x2x4_default,2399.16,554.35,0.0
gfx950,256,57344,6144,7168,mxfp8,flydsl_mxfp8,432,1,2100.277,flydsl_bpreshuflle_128x256x128_MXF8_MXF8_B16_2x0x1x2x4_default,2404.86,552.18,0.0
gfx950,256,65536,6144,7168,mxfp8,flydsl_mxfp8,512,1,2446.1306,flydsl_bpreshuflle_96x256x128_MXF8_MXF8_B16_2x1x1x2x4_default,2359.82,539.26,0.0
gfx950,256,1,7168,384,mxfp8,flydsl_mxfp8,675,1,3.9281,flydsl_bpreshuflle_32x128x128_MXF8_MXF8_B16_2x0x0x4x0_default,1.4,704.47,0.0
gfx950,256,1,7168,3072,mxfp8,flydsl_mxfp8,524,1,11.6099,flydsl_bpreshuflle_32x128x256_MXF8_MXF8_B16_2x0x0x3x0_default,3.79,1898.16,0.0
gfx950,256,1,7168,7168,mxfp8,flydsl_mxfp8,4,1,23.314,flydsl_bpreshuflle_32x128x256_MXF8_MXF8_B16_2x0x0x0x0_default,4.41,2204.76,0.0
gfx950,256,1,7168,16384,mxfp8,flydsl_mxfp8,356,1,49.9683,flydsl_bpreshuflle_32x128x256_MXF8_MXF8_B16_2x0x0x2x0_default,4.7,2350.92,0.0
gfx950,256,2,7168,384,mxfp8,flydsl_mxfp8,355,1,3.8582,flydsl_bpreshuflle_32x128x128_MXF8_MXF8_B16_2x0x0x2x0_default,2.85,721.05,0.0
gfx950,256,2,7168,3072,mxfp8,flydsl_mxfp8,224,1,11.9573,flydsl_bpreshuflle_32x128x256_MXF8_MXF8_B16_2x0x1x1x0_default,7.37,1844.47,0.0
gfx950,256,2,7168,7168,mxfp8,flydsl_mxfp8,180,1,23.5271,flydsl_bpreshuflle_32x128x256_MXF8_MXF8_B16_2x0x0x1x0_default,8.74,2185.7,0.0
gfx950,256,2,7168,16384,mxfp8,flydsl_mxfp8,524,1,50.0274,flydsl_bpreshuflle_32x128x256_MXF8_MXF8_B16_2x0x0x3x0_default,9.39,2348.75,0.0
gfx950,256,4,7168,384,mxfp8,flydsl_mxfp8,675,1,4.0221,flydsl_bpreshuflle_32x128x128_MXF8_MXF8_B16_2x0x0x4x0_default,5.47,698.99,0.0
gfx950,256,4,7168,3072,mxfp8,flydsl_mxfp8,356,1,11.6124,flydsl_bpreshuflle_32x128x256_MXF8_MXF8_B16_2x0x0x2x0_default,15.17,1902.25,0.0
gfx950,256,4,7168,7168,mxfp8,flydsl_mxfp8,92,1,24.0121,flydsl_bpreshuflle_32x128x256_MXF8_MXF8_B16_2x1x0x0x0_default,17.12,2143.35,0.0
gfx950,256,4,7168,16384,mxfp8,flydsl_mxfp8,356,1,50.1241,flydsl_bpreshuflle_32x128x256_MXF8_MXF8_B16_2x0x0x2x0_default,18.74,2345.45,0.0
gfx950,256,8,7168,384,mxfp8,flydsl_mxfp8,355,1,4.0866,flydsl_bpreshuflle_32x128x128_MXF8_MXF8_B16_2x0x0x2x0_default,10.78,702.36,0.0
gfx950,256,8,7168,3072,mxfp8,flydsl_mxfp8,736,1,11.6001,flydsl_bpreshuflle_32x128x256_MXF8_MXF8_B16_2x1x0x4x0_default,30.37,1910.27,0.0
gfx950,256,8,7168,7168,mxfp8,flydsl_mxfp8,600,1,23.5086,flydsl_bpreshuflle_32x128x256_MXF8_MXF8_B16_2x1x0x3x0_default,34.97,2192.91,0.0
gfx950,256,8,7168,16384,mxfp8,flydsl_mxfp8,180,1,50.2742,flydsl_bpreshuflle_32x128x256_MXF8_MXF8_B16_2x0x0x1x0_default,37.38,2340.89,0.0
gfx950,256,16,7168,384,mxfp8,flydsl_mxfp8,355,1,4.1514,flydsl_bpreshuflle_32x128x128_MXF8_MXF8_B16_2x0x0x2x0_default,21.22,719.76,0.0
gfx950,256,16,7168,3072,mxfp8,flydsl_mxfp8,180,1,11.8277,flydsl_bpreshuflle_32x128x256_MXF8_MXF8_B16_2x0x0x1x0_default,59.58,1885.29,0.0
gfx950,256,16,7168,7168,mxfp8,flydsl_mxfp8,524,1,17.3583,flydsl_bpreshuflle_32x128x256_MXF8_MXF8_B16_2x0x0x3x0_default,94.72,2979.8,0.0
gfx950,256,16,7168,16384,mxfp8,flydsl_mxfp8,4,1,51.1124,flydsl_bpreshuflle_32x128x256_MXF8_MXF8_B16_2x0x0x0x0_default,73.53,2307.31,0.0
gfx950,256,32,7168,384,mxfp8,flydsl_mxfp8,675,1,4.1978,flydsl_bpreshuflle_32x128x128_MXF8_MXF8_B16_2x0x0x4x0_default,41.97,767.91,0.0
gfx950,256,32,7168,3072,mxfp8,flydsl_mxfp8,180,1,12.2128,flydsl_bpreshuflle_32x128x256_MXF8_MXF8_B16_2x0x0x1x0_default,115.39,1848.65,0.0
gfx950,256,32,7168,7168,mxfp8,flydsl_mxfp8,268,1,24.9188,flydsl_bpreshuflle_32x128x256_MXF8_MXF8_B16_2x1x0x1x0_default,131.96,2089.52,0.0
gfx950,256,32,7168,16384,mxfp8,flydsl_mxfp8,180,1,52.5538,flydsl_bpreshuflle_32x128x256_MXF8_MXF8_B16_2x0x0x1x0_default,143.02,2253.38,0.0
gfx950,256,48,7168,384,mxfp8,flydsl_mxfp8,675,1,4.2207,flydsl_bpreshuflle_32x128x128_MXF8_MXF8_B16_2x0x0x4x0_default,62.61,819.55,0.0
gfx950,256,48,7168,3072,mxfp8,flydsl_mxfp8,356,1,11.9422,flydsl_bpreshuflle_32x128x256_MXF8_MXF8_B16_2x0x0x2x0_default,177.01,1913.86,0.0
gfx950,256,48,7168,7168,mxfp8,flydsl_mxfp8,721,1,22.3362,flydsl_bpreshuflle_32x128x256_MXF8_MXF8_B16_2x0x1x4x4_default,220.83,2346.52,0.0
gfx950,256,48,7168,16384,mxfp8,flydsl_mxfp8,721,1,49.5541,flydsl_bpreshuflle_32x128x256_MXF8_MXF8_B16_2x0x1x4x4_default,227.51,2399.7,0.0
gfx950,256,64,7168,384,mxfp8,flydsl_mxfp8,523,1,4.2798,flydsl_bpreshuflle_32x128x128_MXF8_MXF8_B16_2x0x0x3x0_default,82.32,863.26,0.0
gfx950,256,64,7168,3072,mxfp8,flydsl_mxfp8,721,1,11.772,flydsl_bpreshuflle_32x128x256_MXF8_MXF8_B16_2x0x1x4x4_default,239.43,1965.19,0.0
gfx950,256,64,7168,7168,mxfp8,flydsl_mxfp8,721,1,22.9225,flydsl_bpreshuflle_32x128x256_MXF8_MXF8_B16_2x0x1x4x4_default,286.91,2301.52,0.0
gfx950,256,64,7168,16384,mxfp8,flydsl_mxfp8,721,1,50.4315,flydsl_bpreshuflle_32x128x256_MXF8_MXF8_B16_2x0x1x4x4_default,298.08,2367.7,0.0
gfx950,256,80,7168,384,mxfp8,flydsl_mxfp8,523,1,4.2521,flydsl_bpreshuflle_32x128x128_MXF8_MXF8_B16_2x0x0x3x0_default,103.57,924.28,0.0
gfx950,256,80,7168,3072,mxfp8,flydsl_mxfp8,721,1,11.5007,flydsl_bpreshuflle_32x128x256_MXF8_MXF8_B16_2x0x1x4x4_default,306.35,2035.77,0.0
gfx950,256,80,7168,7168,mxfp8,flydsl_mxfp8,721,1,21.7535,flydsl_bpreshuflle_32x128x256_MXF8_MXF8_B16_2x0x1x4x4_default,377.91,2441.01,0.0
gfx950,256,80,7168,16384,mxfp8,flydsl_mxfp8,721,1,48.7882,flydsl_bpreshuflle_32x128x256_MXF8_MXF8_B16_2x0x1x4x4_default,385.14,2457.52,0.0
gfx950,256,96,7168,384,mxfp8,flydsl_mxfp8,675,1,4.3186,flydsl_bpreshuflle_32x128x128_MXF8_MXF8_B16_2x0x0x4x0_default,122.37,964.58,0.0
gfx950,256,96,7168,3072,mxfp8,flydsl_mxfp8,721,1,12.1382,flydsl_bpreshuflle_32x128x256_MXF8_MXF8_B16_2x0x1x4x4_default,348.31,1951.79,0.0
gfx950,256,96,7168,7168,mxfp8,flydsl_mxfp8,721,1,22.2875,flydsl_bpreshuflle_32x128x256_MXF8_MXF8_B16_2x0x1x4x4_default,442.62,2397.96,0.0
gfx950,256,96,7168,16384,mxfp8,flydsl_mxfp8,721,1,49.2238,flydsl_bpreshuflle_32x128x256_MXF8_MXF8_B16_2x0x1x4x4_default,458.08,2445.76,0.0
gfx950,256,112,7168,384,mxfp8,flydsl_mxfp8,542,1,4.5764,flydsl_bpreshuflle_32x128x128_MXF8_MXF8_B16_2x0x0x3x4_default,134.73,961.71,0.0
gfx950,256,112,7168,3072,mxfp8,flydsl_mxfp8,70,1,12.3378,flydsl_bpreshuflle_32x128x256_MXF8_MXF8_B16_2x0x1x0x4_default,399.79,1942.79,0.0
gfx950,256,112,7168,7168,mxfp8,flydsl_mxfp8,721,1,22.4339,flydsl_bpreshuflle_32x128x256_MXF8_MXF8_B16_2x0x1x4x4_default,513.03,2397.65,0.0
gfx950,256,112,7168,16384,mxfp8,flydsl_mxfp8,721,1,49.0599,flydsl_bpreshuflle_32x128x256_MXF8_MXF8_B16_2x0x1x4x4_default,536.22,2463.95,0.0
gfx950,256,128,7168,384,mxfp8,flydsl_mxfp8,690,1,4.6168,flydsl_bpreshuflle_32x128x128_MXF8_MXF8_B16_2x0x0x4x4_default,152.63,1004.3,0.0
gfx950,256,128,7168,3072,mxfp8,flydsl_mxfp8,721,1,11.8978,flydsl_bpreshuflle_32x128x256_MXF8_MXF8_B16_2x0x1x4x4_default,473.8,2038.05,0.0
gfx950,256,128,7168,7168,mxfp8,flydsl_mxfp8,721,1,23.1456,flydsl_bpreshuflle_32x128x256_MXF8_MXF8_B16_2x0x1x4x4_default,568.29,2338.79,0.0
gfx950,256,128,7168,16384,mxfp8,flydsl_mxfp8,721,1,49.8844,flydsl_bpreshuflle_32x128x256_MXF8_MXF8_B16_2x0x1x4x4_default,602.69,2433.08,0.0
gfx950,256,144,7168,384,mxfp8,flydsl_mxfp8,542,1,4.7298,flydsl_bpreshuflle_32x128x128_MXF8_MXF8_B16_2x0x0x3x4_default,167.6,1030.11,0.0
gfx950,256,144,7168,3072,mxfp8,flydsl_mxfp8,290,1,14.9858,flydsl_bpreshuflle_32x128x256_MXF8_MXF8_B16_2x1x0x1x4_default,423.19,1636.67,0.0
gfx950,256,144,7168,7168,mxfp8,flydsl_mxfp8,721,1,30.4751,flydsl_bpreshuflle_32x128x256_MXF8_MXF8_B16_2x0x1x4x4_default,485.56,1787.58,0.0
gfx950,256,144,7168,16384,mxfp8,flydsl_mxfp8,74,1,65.5126,flydsl_bpreshuflle_64x128x256_MXF8_MXF8_B16_2x0x1x0x4_default,516.28,1860.16,0.0
gfx950,256,160,7168,384,mxfp8,flydsl_mxfp8,25,1,4.8115,flydsl_bpreshuflle_32x128x128_MXF8_MXF8_B16_2x0x0x0x4_default,183.06,1061.56,0.0
gfx950,256,160,7168,3072,mxfp8,flydsl_mxfp8,721,1,15.1316,flydsl_bpreshuflle_32x128x256_MXF8_MXF8_B16_2x0x1x4x4_default,465.68,1639.31,0.0
gfx950,256,160,7168,7168,mxfp8,flydsl_mxfp8,721,1,30.7189,flydsl_bpreshuflle_32x128x256_MXF8_MXF8_B16_2x0x1x4x4_default,535.23,1784.6,0.0
gfx950,256,160,7168,16384,mxfp8,flydsl_mxfp8,250,1,65.6939,flydsl_bpreshuflle_64x128x256_MXF8_MXF8_B16_2x0x1x1x4_default,572.06,1862.51,0.0
gfx950,256,176,7168,384,mxfp8,flydsl_mxfp8,460,1,5.1289,flydsl_bpreshuflle_32x128x128_MXF8_MXF8_B16_2x1x0x2x4_default,188.91,1041.79,0.0
gfx950,256,176,7168,3072,mxfp8,flydsl_mxfp8,26,1,16.0787,flydsl_bpreshuflle_32x128x256_MXF8_MXF8_B16_2x0x0x0x4_default,482.07,1560.07,0.0
gfx950,256,176,7168,7168,mxfp8,flydsl_mxfp8,585,1,32.222,flydsl_bpreshuflle_64x128x256_MXF8_MXF8_B16_2x0x1x3x4_default,561.29,1712.03,0.0
gfx950,256,176,7168,16384,mxfp8,flydsl_mxfp8,250,1,65.7242,flydsl_bpreshuflle_64x128x256_MXF8_MXF8_B16_2x0x1x1x4_default,628.98,1869.13,0.0
gfx950,256,192,7168,384,mxfp8,flydsl_mxfp8,201,1,5.0286,flydsl_bpreshuflle_32x128x128_MXF8_MXF8_B16_2x0x0x1x4_default,210.19,1109.4,0.0
gfx950,256,192,7168,3072,mxfp8,flydsl_mxfp8,585,1,16.1296,flydsl_bpreshuflle_64x128x256_MXF8_MXF8_B16_2x0x1x3x4_default,524.24,1572.42,0.0
gfx950,256,192,7168,7168,mxfp8,flydsl_mxfp8,585,1,32.422,flydsl_bpreshuflle_64x128x256_MXF8_MXF8_B16_2x0x1x3x4_default,608.54,1712.08,0.0
gfx950,256,192,7168,16384,mxfp8,flydsl_mxfp8,74,1,66.5098,flydsl_bpreshuflle_64x128x256_MXF8_MXF8_B16_2x0x1x0x4_default,678.05,1854.44,0.0
gfx950,256,208,7168,384,mxfp8,flydsl_mxfp8,542,1,5.0605,flydsl_bpreshuflle_32x128x128_MXF8_MXF8_B16_2x0x0x3x4_default,226.27,1148.95,0.0
gfx950,256,208,7168,3072,mxfp8,flydsl_mxfp8,461,1,15.5313,flydsl_bpreshuflle_32x128x256_MXF8_MXF8_B16_2x1x0x2x4_default,589.8,1650.92,0.0
gfx950,256,208,7168,7168,mxfp8,flydsl_mxfp8,585,1,32.3525,flydsl_bpreshuflle_64x128x256_MXF8_MXF8_B16_2x0x1x3x4_default,660.67,1726.39,0.0
gfx950,256,208,7168,16384,mxfp8,flydsl_mxfp8,585,1,66.3624,flydsl_bpreshuflle_64x128x256_MXF8_MXF8_B16_2x0x1x3x4_default,736.19,1865.97,0.0
gfx950,256,224,7168,384,mxfp8,flydsl_mxfp8,201,1,5.1538,flydsl_bpreshuflle_32x128x128_MXF8_MXF8_B16_2x0x0x1x4_default,239.27,1173.85,0.0
gfx950,256,224,7168,3072,mxfp8,flydsl_mxfp8,461,1,15.6182,flydsl_bpreshuflle_32x128x256_MXF8_MXF8_B16_2x1x0x2x4_default,631.64,1659.57,0.0
gfx950,256,224,7168,7168,mxfp8,flydsl_mxfp8,423,1,32.9831,flydsl_bpreshuflle_64x128x256_MXF8_MXF8_B16_2x0x1x2x4_default,697.88,1703.82,0.0
gfx950,256,224,7168,16384,mxfp8,flydsl_mxfp8,585,1,66.6565,flydsl_bpreshuflle_64x128x256_MXF8_MXF8_B16_2x0x1x3x4_default,789.32,1865.11,0.0
gfx950,256,240,7168,384,mxfp8,flydsl_mxfp8,376,1,5.3692,flydsl_bpreshuflle_32x128x128_MXF8_MXF8_B16_2x0x0x2x4_default,246.07,1170.62,0.0
gfx950,256,240,7168,3072,mxfp8,flydsl_mxfp8,419,1,16.1807,flydsl_bpreshuflle_32x128x256_MXF8_MXF8_B16_2x0x1x2x4_default,653.23,1619.09,0.0
gfx950,256,240,7168,7168,mxfp8,flydsl_mxfp8,585,1,32.7629,flydsl_bpreshuflle_64x128x256_MXF8_MXF8_B16_2x0x1x3x4_default,752.76,1725.77,0.0
gfx950,256,240,7168,16384,mxfp8,flydsl_mxfp8,423,1,67.2651,flydsl_bpreshuflle_64x128x256_MXF8_MXF8_B16_2x0x1x2x4_default,838.05,1855.54,0.0
gfx950,256,256,7168,384,mxfp8,flydsl_mxfp8,376,1,5.4499,flydsl_bpreshuflle_32x128x128_MXF8_MXF8_B16_2x0x0x2x4_default,258.59,1196.5,0.0
gfx950,256,256,7168,3072,mxfp8,flydsl_mxfp8,419,1,16.2543,flydsl_bpreshuflle_32x128x256_MXF8_MXF8_B16_2x0x1x2x4_default,693.62,1628.89,0.0
gfx950,256,256,7168,7168,mxfp8,flydsl_mxfp8,585,1,33.5292,flydsl_bpreshuflle_64x128x256_MXF8_MXF8_B16_2x0x1x3x4_default,784.59,1696.59,0.0
gfx950,256,256,7168,16384,mxfp8,flydsl_mxfp8,423,1,67.6205,flydsl_bpreshuflle_64x128x256_MXF8_MXF8_B16_2x0x1x2x4_default,889.22,1853.06,0.0
gfx950,256,288,7168,384,mxfp8,flydsl_mxfp8,203,1,5.498,flydsl_bpreshuflle_32x256x128_MXF8_MXF8_B16_2x0x0x1x4_default,288.37,1271.71,0.0
gfx950,256,288,7168,3072,mxfp8,flydsl_mxfp8,70,1,17.5761,flydsl_bpreshuflle_32x128x256_MXF8_MXF8_B16_2x0x1x0x4_default,721.64,1538.09,0.0
gfx950,256,288,7168,7168,mxfp8,flydsl_mxfp8,202,1,32.1573,flydsl_bpreshuflle_32x128x256_MXF8_MXF8_B16_2x0x0x1x4_default,920.32,1790.37,0.0
gfx950,256,288,7168,16384,mxfp8,flydsl_mxfp8,427,1,74.3145,flydsl_bpreshuflle_96x128x256_MXF8_MXF8_B16_2x0x1x2x4_default,910.26,1699.37,0.0
gfx950,256,320,7168,384,mxfp8,flydsl_mxfp8,157,1,6.0323,flydsl_bpreshuflle_32x128x128_MXF8_MXF8_B16_2x1x1x0x4_default,292.03,1237.16,0.0
gfx950,256,320,7168,3072,mxfp8,flydsl_mxfp8,427,1,18.0295,flydsl_bpreshuflle_96x128x256_MXF8_MXF8_B16_2x0x1x2x4_default,781.66,1530.31,0.0
gfx950,256,320,7168,7168,mxfp8,flydsl_mxfp8,162,1,37.4821,flydsl_bpreshuflle_64x128x256_MXF8_MXF8_B16_2x1x1x0x4_default,877.31,1554.38,0.0
gfx950,256,320,7168,16384,mxfp8,flydsl_mxfp8,585,1,75.8991,flydsl_bpreshuflle_64x128x256_MXF8_MXF8_B16_2x0x1x3x4_default,990.29,1676.84,0.0
gfx950,256,352,7168,384,mxfp8,flydsl_mxfp8,245,1,6.1953,flydsl_bpreshuflle_32x128x128_MXF8_MXF8_B16_2x0x1x1x4_default,312.78,1280.64,0.0
gfx950,256,352,7168,3072,mxfp8,flydsl_mxfp8,729,1,18.361,flydsl_bpreshuflle_96x128x256_MXF8_MXF8_B16_2x0x1x4x4_default,844.3,1533.02,0.0
gfx950,256,352,7168,7168,mxfp8,flydsl_mxfp8,427,1,37.7738,flydsl_bpreshuflle_96x128x256_MXF8_MXF8_B16_2x0x1x2x4_default,957.59,1560.6,0.0
gfx950,256,352,7168,16384,mxfp8,flydsl_mxfp8,254,1,78.7383,flydsl_bpreshuflle_96x128x256_MXF8_MXF8_B16_2x0x1x1x4_default,1050.04,1628.86,0.0
gfx950,256,384,7168,384,mxfp8,flydsl_mxfp8,780,1,6.4023,flydsl_bpreshuflle_32x128x128_MXF8_MXF8_B16_2x1x1x4x4_default,330.18,1312.81,0.0
gfx950,256,384,7168,3072,mxfp8,flydsl_mxfp8,78,1,18.7705,flydsl_bpreshuflle_96x128x256_MXF8_MXF8_B16_2x0x1x0x4_default,900.96,1529.25,0.0
gfx950,256,384,7168,7168,mxfp8,flydsl_mxfp8,78,1,37.802,flydsl_bpreshuflle_96x128x256_MXF8_MXF8_B16_2x0x1x0x4_default,1043.86,1577.64,0.0
gfx950,256,384,7168,16384,mxfp8,flydsl_mxfp8,427,1,77.9861,flydsl_bpreshuflle_96x128x256_MXF8_MXF8_B16_2x0x1x2x4_default,1156.54,1657.18,0.0
gfx950,256,416,7168,384,mxfp8,flydsl_mxfp8,656,1,6.5686,flydsl_bpreshuflle_32x128x128_MXF8_MXF8_B16_2x1x1x3x4_default,348.64,1351.28,0.0
gfx950,256,416,7168,3072,mxfp8,flydsl_mxfp8,423,1,18.8646,flydsl_bpreshuflle_64x128x256_MXF8_MXF8_B16_2x0x1x2x4_default,971.17,1551.15,0.0
gfx950,256,416,7168,7168,mxfp8,flydsl_mxfp8,585,1,40.3434,flydsl_bpreshuflle_64x128x256_MXF8_MXF8_B16_2x0x1x3x4_default,1059.61,1495.31,0.0
gfx950,256,416,7168,16384,mxfp8,flydsl_mxfp8,250,1,83.4717,flydsl_bpreshuflle_64x128x256_MXF8_MXF8_B16_2x0x1x1x4_default,1170.58,1560.05,0.0
gfx950,256,448,7168,384,mxfp8,flydsl_mxfp8,73,1,6.7464,flydsl_bpreshuflle_64x128x128_MXF8_MXF8_B16_2x0x1x0x4_default,365.57,1385.49,0.0
gfx950,256,448,7168,3072,mxfp8,flydsl_mxfp8,338,1,19.2489,flydsl_bpreshuflle_64x128x256_MXF8_MXF8_B16_2x1x1x1x4_default,1024.99,1549.12,0.0
gfx950,256,448,7168,7168,mxfp8,flydsl_mxfp8,338,1,40.9329,flydsl_bpreshuflle_64x128x256_MXF8_MXF8_B16_2x1x1x1x4_default,1124.69,1490.59,0.0
gfx950,256,448,7168,16384,mxfp8,flydsl_mxfp8,250,1,83.4344,flydsl_bpreshuflle_64x128x256_MXF8_MXF8_B16_2x0x1x1x4_default,1261.19,1572.53,0.0
gfx950,256,480,7168,384,mxfp8,flydsl_mxfp8,291,1,6.9562,flydsl_bpreshuflle_32x256x128_MXF8_MXF8_B16_2x1x0x1x4_default,379.86,1411.42,0.0
gfx950,256,480,7168,3072,mxfp8,flydsl_mxfp8,250,1,20.1246,flydsl_bpreshuflle_64x128x256_MXF8_MXF8_B16_2x0x1x1x4_default,1050.42,1509.39,0.0
gfx950,256,480,7168,7168,mxfp8,flydsl_mxfp8,661,1,42.1517,flydsl_bpreshuflle_64x128x256_MXF8_MXF8_B16_2x1x1x3x4_default,1170.18,1463.81,0.0
gfx950,256,480,7168,16384,mxfp8,flydsl_mxfp8,661,1,85.9408,flydsl_bpreshuflle_64x128x256_MXF8_MXF8_B16_2x1x1x3x4_default,1311.87,1538.11,0.0
gfx950,256,512,7168,384,mxfp8,flydsl_mxfp8,422,1,7.124,flydsl_bpreshuflle_64x128x128_MXF8_MXF8_B16_2x0x1x2x4_default,395.64,1444.29,0.0
gfx950,256,512,7168,3072,mxfp8,flydsl_mxfp8,585,1,20.2157,flydsl_bpreshuflle_64x128x256_MXF8_MXF8_B16_2x0x1x3x4_default,1115.4,1530.15,0.0
gfx950,256,512,7168,7168,mxfp8,flydsl_mxfp8,661,1,42.4797,flydsl_bpreshuflle_64x128x256_MXF8_MXF8_B16_2x1x1x3x4_default,1238.55,1468.71,0.0
gfx950,256,512,7168,16384,mxfp8,flydsl_mxfp8,507,1,87.9544,flydsl_bpreshuflle_64x128x256_MXF8_MXF8_B16_2x1x1x2x4_default,1367.29,1514.07,0.0
gfx950,256,544,7168,384,mxfp8,flydsl_mxfp8,115,1,7.265,flydsl_bpreshuflle_32x256x128_MXF8_MXF8_B16_2x1x0x0x4_default,412.21,1481.1,0.0
gfx950,256,544,7168,3072,mxfp8,flydsl_mxfp8,250,1,21.0983,flydsl_bpreshuflle_64x128x256_MXF8_MXF8_B16_2x0x1x1x4_default,1135.54,1492.54,0.0
gfx950,256,544,7168,7168,mxfp8,flydsl_mxfp8,250,1,45.4477,flydsl_bpreshuflle_64x128x256_MXF8_MXF8_B16_2x0x1x1x4_default,1230.02,1387.93,0.0
gfx950,256,544,7168,16384,mxfp8,flydsl_mxfp8,507,1,92.4181,flydsl_bpreshuflle_64x128x256_MXF8_MXF8_B16_2x1x1x2x4_default,1382.58,1451.58,0.0
gfx950,256,576,7168,384,mxfp8,flydsl_mxfp8,422,1,7.2993,flydsl_bpreshuflle_64x128x128_MXF8_MXF8_B16_2x0x1x2x4_default,434.41,1538.67,0.0
gfx950,256,576,7168,3072,mxfp8,flydsl_mxfp8,74,1,21.4262,flydsl_bpreshuflle_64x128x256_MXF8_MXF8_B16_2x0x1x0x4_default,1183.93,1495.7,0.0
gfx950,256,576,7168,7168,mxfp8,flydsl_mxfp8,661,1,46.1737,flydsl_bpreshuflle_64x128x256_MXF8_MXF8_B16_2x1x1x3x4_default,1281.9,1381.01,0.0
gfx950,256,576,7168,16384,mxfp8,flydsl_mxfp8,162,1,94.742,flydsl_bpreshuflle_64x128x256_MXF8_MXF8_B16_2x1x1x0x4_default,1428.0,1426.35,0.0
gfx950,256,608,7168,384,mxfp8,flydsl_mxfp8,464,1,8.1969,flydsl_bpreshuflle_64x128x128_MXF8_MXF8_B16_2x1x0x2x4_default,408.33,1427.65,0.0
gfx950,256,608,7168,3072,mxfp8,flydsl_mxfp8,78,1,22.2622,flydsl_bpreshuflle_96x128x256_MXF8_MXF8_B16_2x0x1x0x4_default,1202.78,1464.55,0.0
gfx950,256,608,7168,7168,mxfp8,flydsl_mxfp8,78,1,49.683,flydsl_bpreshuflle_96x128x256_MXF8_MXF8_B16_2x0x1x0x4_default,1257.54,1297.32,0.0
gfx950,256,608,7168,16384,mxfp8,flydsl_mxfp8,166,1,100.3402,flydsl_bpreshuflle_96x128x256_MXF8_MXF8_B16_2x1x1x0x4_default,1423.23,1356.57,0.0
gfx950,256,640,7168,384,mxfp8,flydsl_mxfp8,121,1,8.1173,flydsl_bpreshuflle_96x128x128_MXF8_MXF8_B16_2x1x0x0x4_default,434.04,1499.68,0.0
gfx950,256,640,7168,3072,mxfp8,flydsl_mxfp8,729,1,22.7983,flydsl_bpreshuflle_96x128x256_MXF8_MXF8_B16_2x0x1x4x4_default,1236.31,1454.55,0.0
gfx950,256,640,7168,7168,mxfp8,flydsl_mxfp8,789,1,50.0698,flydsl_bpreshuflle_96x128x256_MXF8_MXF8_B16_2x1x1x4x4_default,1313.5,1301.04,0.0
gfx950,256,640,7168,16384,mxfp8,flydsl_mxfp8,511,1,99.1618,flydsl_bpreshuflle_96x128x256_MXF8_MXF8_B16_2x1x1x2x4_default,1515.95,1382.6,0.0
gfx950,256,672,7168,384,mxfp8,flydsl_mxfp8,464,1,8.1719,flydsl_bpreshuflle_64x128x128_MXF8_MXF8_B16_2x1x0x2x4_default,452.69,1547.3,0.0
gfx950,256,672,7168,3072,mxfp8,flydsl_mxfp8,254,1,22.9929,flydsl_bpreshuflle_96x128x256_MXF8_MXF8_B16_2x0x1x1x4_default,1287.14,1466.46,0.0
gfx950,256,672,7168,7168,mxfp8,flydsl_mxfp8,166,1,50.2718,flydsl_bpreshuflle_96x128x256_MXF8_MXF8_B16_2x1x1x0x4_default,1373.63,1309.5,0.0
gfx950,256,672,7168,16384,mxfp8,flydsl_mxfp8,511,1,100.8026,flydsl_bpreshuflle_96x128x256_MXF8_MXF8_B16_2x1x1x2x4_default,1565.83,1369.85,0.0
gfx950,256,704,7168,384,mxfp8,flydsl_mxfp8,622,1,8.4704,flydsl_bpreshuflle_64x128x128_MXF8_MXF8_B16_2x1x0x3x4_default,457.54,1548.38,0.0
gfx950,256,704,7168,3072,mxfp8,flydsl_mxfp8,427,1,24.6056,flydsl_bpreshuflle_96x128x256_MXF8_MXF8_B16_2x0x1x2x4_default,1260.05,1392.99,0.0
gfx950,256,704,7168,7168,mxfp8,flydsl_mxfp8,342,1,50.4058,flydsl_bpreshuflle_96x128x256_MXF8_MXF8_B16_2x1x1x1x4_default,1435.22,1319.67,0.0
gfx950,256,704,7168,16384,mxfp8,flydsl_mxfp8,342,1,104.1814,flydsl_bpreshuflle_96x128x256_MXF8_MXF8_B16_2x1x1x1x4_default,1587.2,1334.86,0.0
gfx950,256,736,7168,384,mxfp8,flydsl_mxfp8,249,1,8.5114,flydsl_bpreshuflle_64x128x128_MXF8_MXF8_B16_2x0x1x1x4_default,476.03,1596.26,0.0
gfx950,256,736,7168,3072,mxfp8,flydsl_mxfp8,427,1,24.8536,flydsl_bpreshuflle_96x128x256_MXF8_MXF8_B16_2x0x1x2x4_default,1304.18,1401.5,0.0
gfx950,256,736,7168,7168,mxfp8,flydsl_mxfp8,789,1,53.2106,flydsl_bpreshuflle_96x128x256_MXF8_MXF8_B16_2x1x1x4x4_default,1421.37,1263.04,0.0
gfx950,256,736,7168,16384,mxfp8,flydsl_mxfp8,511,1,104.4182,flydsl_bpreshuflle_96x128x256_MXF8_MXF8_B16_2x1x1x2x4_default,1655.58,1341.25,0.0
gfx950,256,768,7168,384,mxfp8,flydsl_mxfp8,121,1,8.517,flydsl_bpreshuflle_96x128x128_MXF8_MXF8_B16_2x1x0x0x4_default,496.4,1650.52,0.0
gfx950,256,768,7168,3072,mxfp8,flydsl_mxfp8,78,1,25.0127,flydsl_bpreshuflle_96x128x256_MXF8_MXF8_B16_2x0x1x0x4_default,1352.23,1414.86,0.0
gfx950,256,768,7168,7168,mxfp8,flydsl_mxfp8,78,1,52.5358,flydsl_bpreshuflle_96x128x256_MXF8_MXF8_B16_2x0x1x0x4_default,1502.21,1292.36,0.0
gfx950,256,768,7168,16384,mxfp8,flydsl_mxfp8,789,1,106.9139,flydsl_bpreshuflle_96x128x256_MXF8_MXF8_B16_2x1x1x4x4_default,1687.23,1319.13,0.0
gfx950,256,800,7168,384,mxfp8,flydsl_mxfp8,121,1,8.6275,flydsl_bpreshuflle_96x128x128_MXF8_MXF8_B16_2x1x0x0x4_default,510.46,1683.98,0.0
gfx950,256,800,7168,3072,mxfp8,flydsl_mxfp8,166,1,26.3708,flydsl_bpreshuflle_96x128x256_MXF8_MXF8_B16_2x1x1x0x4_default,1336.03,1363.12,0.0
gfx950,256,800,7168,7168,mxfp8,flydsl_mxfp8,511,1,55.6255,flydsl_bpreshuflle_96x128x256_MXF8_MXF8_B16_2x1x1x2x4_default,1477.89,1232.95,0.0
gfx950,256,800,7168,16384,mxfp8,flydsl_mxfp8,166,1,111.7151,flydsl_bpreshuflle_96x128x256_MXF8_MXF8_B16_2x1x1x0x4_default,1682.0,1271.24,0.0
gfx950,256,832,7168,384,mxfp8,flydsl_mxfp8,784,1,8.7481,flydsl_bpreshuflle_64x128x128_MXF8_MXF8_B16_2x1x1x4x4_default,523.56,1714.61,0.0
gfx950,256,832,7168,3072,mxfp8,flydsl_mxfp8,78,1,26.2644,flydsl_bpreshuflle_96x128x256_MXF8_MXF8_B16_2x0x1x0x4_default,1395.1,1389.85,0.0
gfx950,256,832,7168,7168,mxfp8,flydsl_mxfp8,254,1,56.2419,flydsl_bpreshuflle_96x128x256_MXF8_MXF8_B16_2x0x1x1x4_default,1520.16,1231.67,0.0
gfx950,256,832,7168,16384,mxfp8,flydsl_mxfp8,511,1,113.7074,flydsl_bpreshuflle_96x128x256_MXF8_MXF8_B16_2x1x1x2x4_default,1718.63,1257.61,0.0
gfx950,256,864,7168,384,mxfp8,flydsl_mxfp8,645,1,9.1337,flydsl_bpreshuflle_96x128x128_MXF8_MXF8_B16_2x1x1x3x0_default,520.75,1693.79,0.0
gfx950,256,864,7168,3072,mxfp8,flydsl_mxfp8,729,1,26.1703,flydsl_bpreshuflle_96x128x256_MXF8_MXF8_B16_2x0x1x4x4_default,1453.97,1416.13,0.0
gfx950,256,864,7168,7168,mxfp8,flydsl_mxfp8,789,1,57.1507,flydsl_bpreshuflle_96x128x256_MXF8_MXF8_B16_2x1x1x4x4_default,1553.52,1224.13,0.0
gfx950,256,864,7168,16384,mxfp8,flydsl_mxfp8,511,1,114.8278,flydsl_bpreshuflle_96x128x256_MXF8_MXF8_B16_2x1x1x2x4_default,1767.32,1253.9,0.0
gfx950,256,896,7168,384,mxfp8,flydsl_mxfp8,293,1,9.5174,flydsl_bpreshuflle_64x128x128_MXF8_MXF8_B16_2x1x0x1x4_default,518.26,1675.0,0.0
gfx950,256,896,7168,3072,mxfp8,flydsl_mxfp8,731,1,28.196,flydsl_bpreshuflle_128x128x256_MXF8_MXF8_B16_2x0x1x4x4_default,1399.49,1334.15,0.0
gfx950,256,896,7168,7168,mxfp8,flydsl_mxfp8,669,1,60.6119,flydsl_bpreshuflle_128x128x256_MXF8_MXF8_B16_2x1x1x3x4_default,1519.06,1165.58,0.0
gfx950,256,896,7168,16384,mxfp8,flydsl_mxfp8,170,1,123.6568,flydsl_bpreshuflle_128x128x256_MXF8_MXF8_B16_2x1x1x0x4_default,1701.92,1172.32,0.0
gfx950,256,928,7168,384,mxfp8,flydsl_mxfp8,508,1,9.6799,flydsl_bpreshuflle_64x256x128_MXF8_MXF8_B16_2x1x1x2x4_default,527.76,1695.54,0.0
gfx950,256,928,7168,3072,mxfp8,flydsl_mxfp8,731,1,28.1461,flydsl_bpreshuflle_128x128x256_MXF8_MXF8_B16_2x0x1x4x4_default,1452.04,1356.31,0.0
gfx950,256,928,7168,7168,mxfp8,flydsl_mxfp8,431,1,61.8499,flydsl_bpreshuflle_128x128x256_MXF8_MXF8_B16_2x0x1x2x4_default,1541.82,1153.37,0.0
gfx950,256,928,7168,16384,mxfp8,flydsl_mxfp8,515,1,127.4312,flydsl_bpreshuflle_128x128x256_MXF8_MXF8_B16_2x1x1x2x4_default,1710.49,1145.31,0.0
gfx950,256,960,7168,384,mxfp8,flydsl_mxfp8,75,1,9.6007,flydsl_bpreshuflle_64x256x128_MXF8_MXF8_B16_2x0x1x0x4_default,550.46,1758.59,0.0
gfx950,256,960,7168,3072,mxfp8,flydsl_mxfp8,731,1,28.3848,flydsl_bpreshuflle_128x128x256_MXF8_MXF8_B16_2x0x1x4x4_default,1489.48,1364.53,0.0
gfx950,256,960,7168,7168,mxfp8,flydsl_mxfp8,515,1,61.5339,flydsl_bpreshuflle_128x128x256_MXF8_MXF8_B16_2x1x1x2x4_default,1603.18,1170.48,0.0
gfx950,256,960,7168,16384,mxfp8,flydsl_mxfp8,515,1,126.0461,flydsl_bpreshuflle_128x128x256_MXF8_MXF8_B16_2x1x1x2x4_default,1788.92,1165.7,0.0
gfx950,256,992,7168,384,mxfp8,flydsl_mxfp8,424,1,9.9999,flydsl_bpreshuflle_64x256x128_MXF8_MXF8_B16_2x0x1x2x4_default,546.1,1735.49,0.0
gfx950,256,992,7168,3072,mxfp8,flydsl_mxfp8,593,1,29.1724,flydsl_bpreshuflle_128x128x256_MXF8_MXF8_B16_2x0x1x3x4_default,1497.58,1346.78,0.0
gfx950,256,992,7168,7168,mxfp8,flydsl_mxfp8,791,1,63.3379,flydsl_bpreshuflle_128x128x256_MXF8_MXF8_B16_2x1x1x4x4_default,1609.44,1148.0,0.0
gfx950,256,992,7168,16384,mxfp8,flydsl_mxfp8,346,1,127.8727,flydsl_bpreshuflle_128x128x256_MXF8_MXF8_B16_2x1x1x1x4_default,1822.14,1156.73,0.0
gfx950,256,1024,7168,384,mxfp8,flydsl_mxfp8,668,1,10.0116,flydsl_bpreshuflle_128x128x128_MXF8_MXF8_B16_2x1x1x3x4_default,563.06,1780.51,0.0
gfx950,256,1024,7168,3072,mxfp8,flydsl_mxfp8,431,1,29.9608,flydsl_bpreshuflle_128x128x256_MXF8_MXF8_B16_2x0x1x2x4_default,1505.21,1329.93,0.0
gfx950,256,1024,7168,7168,mxfp8,flydsl_mxfp8,170,1,62.8283,flydsl_bpreshuflle_128x128x256_MXF8_MXF8_B16_2x1x1x0x4_default,1674.83,1168.27,0.0
gfx950,256,1024,7168,16384,mxfp8,flydsl_mxfp8,669,1,130.9992,flydsl_bpreshuflle_128x128x256_MXF8_MXF8_B16_2x1x1x3x4_default,1836.03,1136.63,0.0
gfx950,256,1088,7168,384,mxfp8,flydsl_mxfp8,293,1,10.2287,flydsl_bpreshuflle_64x128x128_MXF8_MXF8_B16_2x1x0x1x4_default,585.55,1834.82,0.0
gfx950,256,1088,7168,3072,mxfp8,flydsl_mxfp8,731,1,31.2673,flydsl_bpreshuflle_128x128x256_MXF8_MXF8_B16_2x0x1x4x4_default,1532.45,1309.99,0.0
gfx950,256,1088,7168,7168,mxfp8,flydsl_mxfp8,669,1,67.064,flydsl_bpreshuflle_128x128x256_MXF8_MXF8_B16_2x1x1x3x4_default,1667.11,1115.0,0.0
gfx950,256,1088,7168,16384,mxfp8,flydsl_mxfp8,791,1,135.8219,flydsl_bpreshuflle_128x128x256_MXF8_MXF8_B16_2x1x1x4x4_default,1881.51,1110.75,0.0
gfx950,256,1152,7168,384,mxfp8,flydsl_mxfp8,117,1,10.3712,flydsl_bpreshuflle_64x128x128_MXF8_MXF8_B16_2x1x0x0x4_default,611.48,1900.45,0.0
gfx950,256,1152,7168,3072,mxfp8,flydsl_mxfp8,593,1,31.4781,flydsl_bpreshuflle_128x128x256_MXF8_MXF8_B16_2x0x1x3x4_default,1611.73,1336.62,0.0
gfx950,256,1152,7168,7168,mxfp8,flydsl_mxfp8,515,1,69.5567,flydsl_bpreshuflle_128x128x256_MXF8_MXF8_B16_2x1x1x2x4_default,1701.92,1094.83,0.0
gfx950,256,1152,7168,16384,mxfp8,flydsl_mxfp8,791,1,138.7594,flydsl_bpreshuflle_128x128x256_MXF8_MXF8_B16_2x1x1x4x4_default,1950.02,1101.4,0.0
gfx950,256,1216,7168,384,mxfp8,flydsl_mxfp8,645,1,10.7515,flydsl_bpreshuflle_96x128x128_MXF8_MXF8_B16_2x1x1x3x0_default,622.62,1920.85,0.0
gfx950,256,1216,7168,3072,mxfp8,flydsl_mxfp8,512,1,36.0987,flydsl_bpreshuflle_96x256x128_MXF8_MXF8_B16_2x1x1x2x4_default,1483.51,1196.39,0.0
gfx950,256,1216,7168,7168,mxfp8,flydsl_mxfp8,468,1,77.0997,flydsl_bpreshuflle_96x128x128_MXF8_MXF8_B16_2x1x0x2x4_default,1620.72,1005.57,0.0
gfx950,256,1216,7168,16384,mxfp8,flydsl_mxfp8,77,1,158.4638,flydsl_bpreshuflle_96x128x128_MXF8_MXF8_B16_2x0x1x0x4_default,1802.4,976.85,0.0
gfx950,256,1280,7168,384,mxfp8,flydsl_mxfp8,668,1,11.2813,flydsl_bpreshuflle_128x128x128_MXF8_MXF8_B16_2x1x1x3x4_default,624.61,1914.15,0.0
gfx950,256,1280,7168,3072,mxfp8,flydsl_mxfp8,123,1,35.1566,flydsl_bpreshuflle_96x256x128_MXF8_MXF8_B16_2x1x0x0x4_default,1603.44,1260.14,0.0
gfx950,256,1280,7168,7168,mxfp8,flydsl_mxfp8,512,1,78.4894,flydsl_bpreshuflle_96x256x128_MXF8_MXF8_B16_2x1x1x2x4_default,1675.81,1005.3,0.0
gfx950,256,1280,7168,16384,mxfp8,flydsl_mxfp8,512,1,163.7678,flydsl_bpreshuflle_96x256x128_MXF8_MXF8_B16_2x1x1x2x4_default,1835.82,957.22,0.0
gfx950,256,1344,7168,384,mxfp8,flydsl_mxfp8,664,1,11.6652,flydsl_bpreshuflle_96x128x128_MXF8_MXF8_B16_2x1x1x3x4_default,634.26,1931.92,0.0
gfx950,256,1344,7168,3072,mxfp8,flydsl_mxfp8,512,1,35.3896,flydsl_bpreshuflle_96x256x128_MXF8_MXF8_B16_2x1x1x2x4_default,1672.53,1283.33,0.0
gfx950,256,1344,7168,7168,mxfp8,flydsl_mxfp8,470,1,80.9969,flydsl_bpreshuflle_96x256x128_MXF8_MXF8_B16_2x1x0x2x4_default,1705.13,991.17,0.0
gfx950,256,1344,7168,16384,mxfp8,flydsl_mxfp8,343,1,163.6804,flydsl_bpreshuflle_96x256x128_MXF8_MXF8_B16_2x1x1x1x4_default,1928.64,969.74,0.0
gfx950,256,1408,7168,384,mxfp8,flydsl_mxfp8,165,1,11.7455,flydsl_bpreshuflle_96x128x128_MXF8_MXF8_B16_2x1x1x0x4_default,659.92,1998.92,0.0
gfx950,256,1408,7168,3072,mxfp8,flydsl_mxfp8,167,1,39.4289,flydsl_bpreshuflle_96x256x128_MXF8_MXF8_B16_2x1x1x0x4_default,1572.67,1180.11,0.0
gfx950,256,1408,7168,7168,mxfp8,flydsl_mxfp8,343,1,83.5585,flydsl_bpreshuflle_96x256x128_MXF8_MXF8_B16_2x1x1x1x4_default,1731.56,977.25,0.0
gfx950,256,1408,7168,16384,mxfp8,flydsl_mxfp8,512,1,170.7665,flydsl_bpreshuflle_96x256x128_MXF8_MXF8_B16_2x1x1x2x4_default,1936.64,941.02,0.0
gfx950,256,1472,7168,384,mxfp8,flydsl_mxfp8,668,1,11.8513,flydsl_bpreshuflle_128x128x128_MXF8_MXF8_B16_2x1x1x3x4_default,683.76,2060.56,0.0
gfx950,256,1472,7168,3072,mxfp8,flydsl_mxfp8,343,1,38.3881,flydsl_bpreshuflle_96x256x128_MXF8_MXF8_B16_2x1x1x1x4_default,1688.73,1241.13,0.0
gfx950,256,1472,7168,7168,mxfp8,flydsl_mxfp8,167,1,83.3524,flydsl_bpreshuflle_96x256x128_MXF8_MXF8_B16_2x1x1x0x4_default,1814.75,996.18,0.0
gfx950,256,1472,7168,16384,mxfp8,flydsl_mxfp8,167,1,166.716,flydsl_bpreshuflle_96x256x128_MXF8_MXF8_B16_2x1x1x0x4_default,2073.86,975.67,0.0
gfx950,256,1536,7168,384,mxfp8,flydsl_mxfp8,664,1,11.9647,flydsl_bpreshuflle_96x128x128_MXF8_MXF8_B16_2x1x1x3x4_default,706.72,2119.77,0.0
gfx950,256,1536,7168,3072,mxfp8,flydsl_mxfp8,512,1,38.6117,flydsl_bpreshuflle_96x256x128_MXF8_MXF8_B16_2x1x1x2x4_default,1751.95,1262.8,0.0
gfx950,256,1536,7168,7168,mxfp8,flydsl_mxfp8,167,1,80.6449,flydsl_bpreshuflle_96x256x128_MXF8_MXF8_B16_2x1x1x0x4_default,1957.22,1046.69,0.0
gfx950,256,1536,7168,16384,mxfp8,flydsl_mxfp8,343,1,167.8525,flydsl_bpreshuflle_96x256x128_MXF8_MXF8_B16_2x1x1x1x4_default,2149.37,980.78,0.0
gfx950,256,1600,7168,384,mxfp8,flydsl_mxfp8,645,1,12.3789,flydsl_bpreshuflle_96x128x128_MXF8_MXF8_B16_2x1x1x3x0_default,711.54,2124.95,0.0
gfx950,256,1600,7168,3072,mxfp8,flydsl_mxfp8,123,1,43.1634,flydsl_bpreshuflle_96x256x128_MXF8_MXF8_B16_2x1x0x0x4_default,1632.5,1155.44,0.0
gfx950,256,1600,7168,7168,mxfp8,flydsl_mxfp8,512,1,90.2269,flydsl_bpreshuflle_96x256x128_MXF8_MXF8_B16_2x1x1x2x4_default,1822.26,950.79,0.0
gfx950,256,1600,7168,16384,mxfp8,flydsl_mxfp8,517,1,183.0094,flydsl_bpreshuflle_192x128x128_MXF8_MXF8_B16_2x1x1x2x4_default,2053.5,910.29,0.0
gfx950,256,1664,7168,384,mxfp8,flydsl_mxfp8,645,1,12.2487,flydsl_bpreshuflle_96x128x128_MXF8_MXF8_B16_2x1x1x3x0_default,747.86,2224.45,0.0
gfx950,256,1664,7168,3072,mxfp8,flydsl_mxfp8,512,1,43.5894,flydsl_bpreshuflle_96x256x128_MXF8_MXF8_B16_2x1x1x2x4_default,1681.21,1169.71,0.0
gfx950,256,1664,7168,7168,mxfp8,flydsl_mxfp8,343,1,87.4689,flydsl_bpreshuflle_96x256x128_MXF8_MXF8_B16_2x1x1x1x4_default,1954.9,996.5,0.0
gfx950,256,1664,7168,16384,mxfp8,flydsl_mxfp8,84,1,184.3715,flydsl_bpreshuflle_192x128x128_MXF8_MXF8_B16_2x0x1x0x4_default,2119.86,914.23,0.0
gfx950,256,1728,7168,384,mxfp8,flydsl_mxfp8,645,1,12.5021,flydsl_bpreshuflle_96x128x128_MXF8_MXF8_B16_2x1x1x3x0_default,760.89,2254.71,0.0
gfx950,256,1728,7168,3072,mxfp8,flydsl_mxfp8,167,1,42.9322,flydsl_bpreshuflle_96x256x128_MXF8_MXF8_B16_2x1x1x0x4_default,1772.6,1213.57,0.0
gfx950,256,1728,7168,7168,mxfp8,flydsl_mxfp8,299,1,89.7393,flydsl_bpreshuflle_96x256x128_MXF8_MXF8_B16_2x1x0x1x4_default,1978.73,986.63,0.0
gfx950,256,1728,7168,16384,mxfp8,flydsl_mxfp8,167,1,184.7294,flydsl_bpreshuflle_96x256x128_MXF8_MXF8_B16_2x1x1x0x4_default,2197.13,923.11,0.0
gfx950,256,1792,7168,384,mxfp8,flydsl_mxfp8,337,1,13.5745,flydsl_bpreshuflle_64x128x128_MXF8_MXF8_B16_2x1x1x1x4_default,726.73,2145.99,0.0
gfx950,256,1792,7168,3072,mxfp8,flydsl_mxfp8,434,1,48.7426,flydsl_bpreshuflle_224x128x128_MXF8_MXF8_B16_2x0x1x2x4_default,1619.12,1091.76,0.0
gfx950,256,1792,7168,7168,mxfp8,flydsl_mxfp8,173,1,97.1502,flydsl_bpreshuflle_224x128x128_MXF8_MXF8_B16_2x1x1x0x4_default,1895.48,925.53,0.0
gfx950,256,1792,7168,16384,mxfp8,flydsl_mxfp8,173,1,199.6779,flydsl_bpreshuflle_224x128x128_MXF8_MXF8_B16_2x1x1x0x4_default,2107.93,863.84,0.0
gfx950,256,1856,7168,384,mxfp8,flydsl_mxfp8,117,1,13.7238,flydsl_bpreshuflle_64x128x128_MXF8_MXF8_B16_2x1x0x0x4_default,744.5,2191.29,0.0
gfx950,256,1856,7168,3072,mxfp8,flydsl_mxfp8,349,1,49.9426,flydsl_bpreshuflle_224x128x128_MXF8_MXF8_B16_2x1x1x1x4_default,1636.65,1087.84,0.0
gfx950,256,1856,7168,7168,mxfp8,flydsl_mxfp8,349,1,102.941,flydsl_bpreshuflle_224x128x128_MXF8_MXF8_B16_2x1x1x1x4_default,1852.74,886.83,0.0
gfx950,256,1856,7168,16384,mxfp8,flydsl_mxfp8,173,1,211.2746,flydsl_bpreshuflle_224x128x128_MXF8_MXF8_B16_2x1x1x0x4_default,2063.38,825.74,0.0
gfx950,256,1920,7168,384,mxfp8,flydsl_mxfp8,293,1,14.1107,flydsl_bpreshuflle_64x128x128_MXF8_MXF8_B16_2x1x0x1x4_default,749.05,2197.97,0.0
gfx950,256,1920,7168,3072,mxfp8,flydsl_mxfp8,652,1,50.8522,flydsl_bpreshuflle_224x128x128_MXF8_MXF8_B16_2x1x1x3x0_default,1662.8,1090.29,0.0
gfx950,256,1920,7168,7168,mxfp8,flydsl_mxfp8,671,1,103.3466,flydsl_bpreshuflle_224x128x128_MXF8_MXF8_B16_2x1x1x3x4_default,1909.11,896.67,0.0
gfx950,256,1920,7168,16384,mxfp8,flydsl_mxfp8,349,1,214.0436,flydsl_bpreshuflle_224x128x128_MXF8_MXF8_B16_2x1x1x1x4_default,2106.91,824.24,0.0
gfx950,256,1984,7168,384,mxfp8,flydsl_mxfp8,784,1,13.8086,flydsl_bpreshuflle_64x128x128_MXF8_MXF8_B16_2x1x1x4x4_default,790.95,2314.28,0.0
gfx950,256,1984,7168,3072,mxfp8,flydsl_mxfp8,261,1,51.2486,flydsl_bpreshuflle_224x128x128_MXF8_MXF8_B16_2x0x1x1x4_default,1704.94,1103.59,0.0
gfx950,256,1984,7168,7168,mxfp8,flydsl_mxfp8,173,1,103.1932,flydsl_bpreshuflle_224x128x128_MXF8_MXF8_B16_2x1x1x0x4_default,1975.68,911.34,0.0
gfx950,256,1984,7168,16384,mxfp8,flydsl_mxfp8,261,1,215.1308,flydsl_bpreshuflle_224x128x128_MXF8_MXF8_B16_2x0x1x1x4_default,2166.14,829.21,0.0
gfx950,256,2048,7168,384,mxfp8,flydsl_mxfp8,506,1,14.3637,flydsl_bpreshuflle_64x128x128_MXF8_MXF8_B16_2x1x1x2x4_default,784.92,2290.43,0.0
gfx950,256,2048,7168,3072,mxfp8,flydsl_mxfp8,432,1,54.6022,flydsl_bpreshuflle_128x256x128_MXF8_MXF8_B16_2x0x1x2x4_default,1651.84,1056.22,0.0
gfx950,256,2048,7168,7168,mxfp8,flydsl_mxfp8,432,1,112.5265,flydsl_bpreshuflle_128x256x128_MXF8_MXF8_B16_2x0x1x2x4_default,1870.26,847.98,0.0
gfx950,256,2048,7168,16384,mxfp8,flydsl_mxfp8,432,1,217.6571,flydsl_bpreshuflle_128x256x128_MXF8_MXF8_B16_2x0x1x2x4_default,2210.06,828.62,0.0
gfx950,256,4096,7168,384,mxfp8,flydsl_mxfp8,508,1,25.4084,flydsl_bpreshuflle_64x256x128_MXF8_MXF8_B16_2x1x1x2x4_default,887.45,2481.29,0.0
gfx950,256,4096,7168,3072,mxfp8,flydsl_mxfp8,432,1,99.8322,flydsl_bpreshuflle_128x256x128_MXF8_MXF8_B16_2x0x1x2x4_default,1806.92,934.8,0.0
gfx950,256,4096,7168,7168,mxfp8,flydsl_mxfp8,432,1,198.2359,flydsl_bpreshuflle_128x256x128_MXF8_MXF8_B16_2x0x1x2x4_default,2123.26,703.51,0.0
gfx950,256,4096,7168,16384,mxfp8,flydsl_mxfp8,516,1,418.4116,flydsl_bpreshuflle_128x256x128_MXF8_MXF8_B16_2x1x1x2x4_default,2299.35,581.41,0.0
gfx950,256,6144,7168,384,mxfp8,flydsl_mxfp8,428,1,33.3841,flydsl_bpreshuflle_96x256x128_MXF8_MXF8_B16_2x0x1x2x4_default,1013.14,2791.51,0.0
gfx950,256,6144,7168,3072,mxfp8,flydsl_mxfp8,343,1,129.7517,flydsl_bpreshuflle_96x256x128_MXF8_MXF8_B16_2x1x1x1x4_default,2085.39,994.01,0.0
gfx950,256,6144,7168,7168,mxfp8,flydsl_mxfp8,167,1,266.2036,flydsl_bpreshuflle_96x256x128_MXF8_MXF8_B16_2x1x1x0x4_default,2371.72,689.33,0.0
gfx950,256,6144,7168,16384,mxfp8,flydsl_mxfp8,512,1,575.9212,flydsl_bpreshuflle_96x256x128_MXF8_MXF8_B16_2x1x1x2x4_default,2505.74,531.64,0.0
gfx950,256,8192,7168,384,mxfp8,flydsl_mxfp8,428,1,44.0905,flydsl_bpreshuflle_96x256x128_MXF8_MXF8_B16_2x0x1x2x4_default,1022.83,2797.4,0.0
gfx950,256,8192,7168,3072,mxfp8,flydsl_mxfp8,432,1,174.2612,flydsl_bpreshuflle_128x256x128_MXF8_MXF8_B16_2x0x1x2x4_default,2070.32,944.71,0.0
gfx950,256,8192,7168,7168,mxfp8,flydsl_mxfp8,432,1,349.938,flydsl_bpreshuflle_128x256x128_MXF8_MXF8_B16_2x0x1x2x4_default,2405.61,650.23,0.0
gfx950,256,8192,7168,16384,mxfp8,flydsl_mxfp8,61,1,743.2913,flydsl_bpreshuflle_128x256x128_MXF8_MXF8_B16_2x0x1x0x0_default,2588.68,496.57,0.0
gfx950,256,10240,7168,384,mxfp8,flydsl_mxfp8,297,1,52.7998,flydsl_bpreshuflle_96x128x128_MXF8_MXF8_B16_2x1x0x1x4_default,1067.65,2906.93,0.0
gfx950,256,10240,7168,3072,mxfp8,flydsl_mxfp8,432,1,210.8786,flydsl_bpreshuflle_128x256x128_MXF8_MXF8_B16_2x0x1x2x4_default,2138.54,949.73,0.0
gfx950,256,10240,7168,7168,mxfp8,flydsl_mxfp8,432,1,438.4426,flydsl_bpreshuflle_128x256x128_MXF8_MXF8_B16_2x0x1x2x4_default,2400.01,619.42,0.0
gfx950,256,10240,7168,16384,mxfp8,flydsl_mxfp8,61,1,935.5407,flydsl_bpreshuflle_128x256x128_MXF8_MXF8_B16_2x0x1x0x0_default,2570.9,461.78,0.0
gfx950,256,12288,7168,384,mxfp8,flydsl_mxfp8,165,1,61.4895,flydsl_bpreshuflle_96x128x128_MXF8_MXF8_B16_2x1x1x0x4_default,1100.12,2986.39,0.0
gfx950,256,12288,7168,3072,mxfp8,flydsl_mxfp8,512,1,241.1308,flydsl_bpreshuflle_96x256x128_MXF8_MXF8_B16_2x1x1x2x4_default,2244.28,978.43,0.0
gfx950,256,12288,7168,7168,mxfp8,flydsl_mxfp8,343,1,511.9088,flydsl_bpreshuflle_96x256x128_MXF8_MXF8_B16_2x1x1x1x4_default,2466.69,616.56,0.0
gfx950,256,12288,7168,16384,mxfp8,flydsl_mxfp8,61,1,1149.2305,flydsl_bpreshuflle_128x256x128_MXF8_MXF8_B16_2x0x1x0x0_default,2511.44,430.66,0.0
gfx950,256,14336,7168,384,mxfp8,flydsl_mxfp8,428,1,69.4816,flydsl_bpreshuflle_96x256x128_MXF8_MXF8_B16_2x0x1x2x4_default,1135.84,3076.76,0.0
gfx950,256,14336,7168,3072,mxfp8,flydsl_mxfp8,512,1,286.9993,flydsl_bpreshuflle_96x256x128_MXF8_MXF8_B16_2x1x1x2x4_default,2199.87,946.28,0.0
gfx950,256,14336,7168,7168,mxfp8,flydsl_mxfp8,167,1,612.0501,flydsl_bpreshuflle_96x256x128_MXF8_MXF8_B16_2x1x1x0x4_default,2406.95,587.63,0.0
gfx950,256,14336,7168,16384,mxfp8,flydsl_mxfp8,411,1,1385.1522,flydsl_bpreshuflle_128x256x128_MXF8_MXF8_B16_2x0x1x2x0_default,2430.96,402.73,0.0
gfx950,256,16384,7168,384,mxfp8,flydsl_mxfp8,255,1,78.9451,flydsl_bpreshuflle_96x256x128_MXF8_MXF8_B16_2x0x1x1x4_default,1142.49,3089.81,0.0
gfx950,256,16384,7168,3072,mxfp8,flydsl_mxfp8,432,1,328.0489,flydsl_bpreshuflle_128x256x128_MXF8_MXF8_B16_2x0x1x2x4_default,2199.53,936.55,0.0
gfx950,256,16384,7168,7168,mxfp8,flydsl_mxfp8,432,1,686.687,flydsl_bpreshuflle_128x256x128_MXF8_MXF8_B16_2x0x1x2x4_default,2451.81,587.9,0.0
gfx950,256,16384,7168,16384,mxfp8,flydsl_mxfp8,432,1,1599.9815,flydsl_bpreshuflle_128x256x128_MXF8_MXF8_B16_2x0x1x2x4_default,2405.21,387.98,0.0
gfx950,256,20480,7168,3072,mxfp8,flydsl_mxfp8,343,1,401.2622,flydsl_bpreshuflle_96x256x128_MXF8_MXF8_B16_2x1x1x1x4_default,2247.77,943.36,0.0
gfx950,256,20480,7168,7168,mxfp8,flydsl_mxfp8,343,1,870.3921,flydsl_bpreshuflle_96x256x128_MXF8_MXF8_B16_2x1x1x1x4_default,2417.91,565.01,0.0
gfx950,256,20480,7168,16384,mxfp8,flydsl_mxfp8,432,1,2008.1489,flydsl_bpreshuflle_128x256x128_MXF8_MXF8_B16_2x0x1x2x4_default,2395.42,371.78,0.0
gfx950,256,24576,7168,3072,mxfp8,flydsl_mxfp8,512,1,474.2882,flydsl_bpreshuflle_96x256x128_MXF8_MXF8_B16_2x1x1x2x4_default,2282.01,948.45,0.0
gfx950,256,24576,7168,7168,mxfp8,flydsl_mxfp8,167,1,1071.7696,flydsl_bpreshuflle_96x256x128_MXF8_MXF8_B16_2x1x1x0x4_default,2356.33,541.03,0.0
gfx950,256,24576,7168,16384,mxfp8,flydsl_mxfp8,167,1,2387.1621,flydsl_bpreshuflle_96x256x128_MXF8_MXF8_B16_2x1x1x0x4_default,2418.12,365.46,0.0
gfx950,256,28672,7168,3072,mxfp8,flydsl_mxfp8,432,1,571.7694,flydsl_bpreshuflle_128x256x128_MXF8_MXF8_B16_2x0x1x2x4_default,2208.44,911.46,0.0
gfx950,256,28672,7168,7168,mxfp8,flydsl_mxfp8,145,1,1257.5942,flydsl_bpreshuflle_96x256x128_MXF8_MXF8_B16_2x1x1x0x0_default,2342.84,531.13,0.0
gfx950,256,28672,7168,16384,mxfp8,flydsl_mxfp8,516,1,2837.1026,flydsl_bpreshuflle_128x256x128_MXF8_MXF8_B16_2x1x1x2x4_default,2373.73,351.85,0.0
gfx950,256,32768,7168,384,mxfp8,flydsl_mxfp8,664,1,153.9357,flydsl_bpreshuflle_96x128x128_MXF8_MXF8_B16_2x1x1x3x4_default,1171.84,3151.3,0.0
gfx950,256,32768,7168,3072,mxfp8,flydsl_mxfp8,512,1,633.7879,flydsl_bpreshuflle_96x256x128_MXF8_MXF8_B16_2x1x1x2x4_default,2276.96,934.77,0.0
gfx950,256,32768,7168,7168,mxfp8,flydsl_mxfp8,491,1,1486.2554,flydsl_bpreshuflle_96x256x128_MXF8_MXF8_B16_2x1x1x2x0_default,2265.6,508.68,0.0
gfx950,256,32768,7168,16384,mxfp8,flydsl_mxfp8,432,1,3169.6142,flydsl_bpreshuflle_128x256x128_MXF8_MXF8_B16_2x0x1x2x4_default,2428.24,354.64,0.0
gfx950,256,40960,7168,3072,mxfp8,flydsl_mxfp8,343,1,810.0667,flydsl_bpreshuflle_96x256x128_MXF8_MXF8_B16_2x1x1x1x4_default,2226.84,907.4,0.0
gfx950,256,40960,7168,7168,mxfp8,flydsl_mxfp8,470,1,1903.0514,flydsl_bpreshuflle_96x256x128_MXF8_MXF8_B16_2x1x0x2x4_default,2211.75,489.84,0.0
gfx950,256,40960,7168,16384,mxfp8,flydsl_mxfp8,432,1,3953.1869,flydsl_bpreshuflle_128x256x128_MXF8_MXF8_B16_2x0x1x2x4_default,2433.66,348.01,0.0
gfx950,256,49152,7168,3072,mxfp8,flydsl_mxfp8,167,1,1012.863,flydsl_bpreshuflle_96x256x128_MXF8_MXF8_B16_2x1x1x0x4_default,2137.17,866.51,0.0
gfx950,256,49152,7168,7168,mxfp8,flydsl_mxfp8,343,1,2201.2993,flydsl_bpreshuflle_96x256x128_MXF8_MXF8_B16_2x1x1x1x4_default,2294.5,503.5,0.0
gfx950,256,49152,7168,16384,mxfp8,flydsl_mxfp8,343,1,4763.1812,flydsl_bpreshuflle_96x256x128_MXF8_MXF8_B16_2x1x1x1x4_default,2423.77,341.66,0.0
gfx950,256,57344,7168,3072,mxfp8,flydsl_mxfp8,321,1,1159.489,flydsl_bpreshuflle_96x256x128_MXF8_MXF8_B16_2x1x1x1x0_default,2178.06,879.93,0.0
gfx950,256,57344,7168,7168,mxfp8,flydsl_mxfp8,512,1,2585.0007,flydsl_bpreshuflle_96x256x128_MXF8_MXF8_B16_2x1x1x2x4_default,2279.57,496.91,0.0
gfx950,256,57344,7168,16384,mxfp8,flydsl_mxfp8,516,1,5609.0823,flydsl_bpreshuflle_128x256x128_MXF8_MXF8_B16_2x1x1x2x4_default,2401.29,335.0,0.0
gfx950,256,65536,7168,3072,mxfp8,flydsl_mxfp8,491,1,1380.9798,flydsl_bpreshuflle_96x256x128_MXF8_MXF8_B16_2x1x1x2x0_default,2089.98,842.06,0.0
gfx950,256,65536,7168,7168,mxfp8,flydsl_mxfp8,167,1,2958.8204,flydsl_bpreshuflle_96x256x128_MXF8_MXF8_B16_2x1x1x0x4_default,2276.08,493.67,0.0
gfx950,256,65536,7168,16384,mxfp8,flydsl_mxfp8,432,1,6328.6413,flydsl_bpreshuflle_128x256x128_MXF8_MXF8_B16_2x0x1x2x4_default,2432.3,336.68,0.0
gfx950,256,1,65536,1536,mxfp8,flydsl_mxfp8,4,1,18.3106,flydsl_bpreshuflle_32x128x256_MXF8_MXF8_B16_2x0x0x0x0_default,11.0,5504.78,0.0
gfx950,256,2,65536,1536,mxfp8,flydsl_mxfp8,180,1,18.3316,flydsl_bpreshuflle_32x128x256_MXF8_MXF8_B16_2x0x0x1x0_default,21.96,5505.71,0.0
gfx950,256,4,65536,1536,mxfp8,flydsl_mxfp8,48,1,18.2455,flydsl_bpreshuflle_32x128x256_MXF8_MXF8_B16_2x0x1x0x0_default,44.14,5546.23,0.0
gfx950,256,8,65536,1536,mxfp8,flydsl_mxfp8,706,1,18.4851,flydsl_bpreshuflle_32x128x256_MXF8_MXF8_B16_2x0x1x4x0_default,87.13,5503.04,0.0
gfx950,256,16,65536,1536,mxfp8,flydsl_mxfp8,48,1,19.2563,flydsl_bpreshuflle_32x128x256_MXF8_MXF8_B16_2x0x1x0x0_default,167.28,5337.73,0.0
gfx950,256,32,65536,1536,mxfp8,flydsl_mxfp8,47,1,20.1111,flydsl_bpreshuflle_32x128x128_MXF8_MXF8_B16_2x0x1x0x0_default,320.34,5216.36,0.0
gfx950,256,48,65536,1536,mxfp8,flydsl_mxfp8,402,1,21.8409,flydsl_bpreshuflle_64x128x256_MXF8_MXF8_B16_2x0x1x2x0_default,442.46,4900.37,0.0
gfx950,256,64,65536,1536,mxfp8,flydsl_mxfp8,315,1,22.3859,flydsl_bpreshuflle_64x128x128_MXF8_MXF8_B16_2x1x1x1x0_default,575.58,4875.85,0.0
gfx950,256,80,65536,1536,mxfp8,flydsl_mxfp8,31,1,27.7157,flydsl_bpreshuflle_64x256x128_MXF8_MXF8_B16_2x0x0x0x4_default,581.12,4014.76,0.0
gfx950,256,96,65536,1536,mxfp8,flydsl_mxfp8,510,1,25.171,flydsl_bpreshuflle_96x128x128_MXF8_MXF8_B16_2x1x1x2x4_default,767.84,4504.93,0.0
gfx950,256,112,65536,1536,mxfp8,flydsl_mxfp8,255,1,29.9116,flydsl_bpreshuflle_96x256x128_MXF8_MXF8_B16_2x0x1x1x4_default,753.84,3861.89,0.0
gfx950,256,128,65536,1536,mxfp8,flydsl_mxfp8,367,1,27.7681,flydsl_bpreshuflle_128x128x128_MXF8_MXF8_B16_2x0x0x2x0_default,928.04,4236.41,0.0
gfx950,256,144,65536,1536,mxfp8,flydsl_mxfp8,512,1,32.1701,flydsl_bpreshuflle_96x256x128_MXF8_MXF8_B16_2x1x1x2x4_default,901.18,3722.68,0.0
gfx950,256,160,65536,1536,mxfp8,flydsl_mxfp8,343,1,33.3785,flydsl_bpreshuflle_96x256x128_MXF8_MXF8_B16_2x1x1x1x4_default,965.06,3651.47,0.0
gfx950,256,176,65536,1536,mxfp8,flydsl_mxfp8,470,1,34.5705,flydsl_bpreshuflle_96x256x128_MXF8_MXF8_B16_2x1x0x2x4_default,1024.96,3586.94,0.0
gfx950,256,192,65536,1536,mxfp8,flydsl_mxfp8,517,1,32.1487,flydsl_bpreshuflle_192x128x128_MXF8_MXF8_B16_2x1x1x2x4_default,1202.37,3923.15,0.0
gfx950,256,208,65536,1536,mxfp8,flydsl_mxfp8,302,1,40.3966,flydsl_bpreshuflle_128x128x256_MXF8_MXF8_B16_2x1x0x1x4_default,1036.62,3174.67,0.0
gfx950,256,224,65536,1536,mxfp8,flydsl_mxfp8,327,1,35.4592,flydsl_bpreshuflle_224x128x128_MXF8_MXF8_B16_2x1x1x1x0_default,1271.8,3676.55,0.0
gfx950,256,240,65536,1536,mxfp8,flydsl_mxfp8,432,1,41.4222,flydsl_bpreshuflle_128x256x128_MXF8_MXF8_B16_2x0x1x2x4_default,1166.49,3198.51,0.0
gfx950,256,256,65536,1536,mxfp8,flydsl_mxfp8,414,1,41.581,flydsl_bpreshuflle_256x128x128_MXF8_MXF8_B16_2x0x1x2x0_default,1239.5,3237.32,0.0
gfx950,256,288,65536,1536,mxfp8,flydsl_mxfp8,167,1,46.8603,flydsl_bpreshuflle_96x256x128_MXF8_MXF8_B16_2x1x1x0x4_default,1237.34,2963.16,0.0
gfx950,256,320,65536,1536,mxfp8,flydsl_mxfp8,343,1,51.4687,flydsl_bpreshuflle_96x256x128_MXF8_MXF8_B16_2x1x1x1x4_default,1251.72,2780.29,0.0
gfx950,256,352,65536,1536,mxfp8,flydsl_mxfp8,496,1,52.0667,flydsl_bpreshuflle_192x128x128_MXF8_MXF8_B16_2x1x1x2x0_default,1361.08,2829.86,0.0
gfx950,256,384,65536,1536,mxfp8,flydsl_mxfp8,172,1,53.3887,flydsl_bpreshuflle_192x128x128_MXF8_MXF8_B16_2x1x1x0x4_default,1448.05,2839.27,0.0
gfx950,256,416,65536,1536,mxfp8,flydsl_mxfp8,327,1,59.1859,flydsl_bpreshuflle_224x128x128_MXF8_MXF8_B16_2x1x1x1x0_default,1415.06,2632.86,0.0
gfx950,256,448,65536,1536,mxfp8,flydsl_mxfp8,518,1,61.3404,flydsl_bpreshuflle_224x128x128_MXF8_MXF8_B16_2x1x1x2x4_default,1470.39,2609.56,0.0
gfx950,256,480,65536,1536,mxfp8,flydsl_mxfp8,123,1,67.788,flydsl_bpreshuflle_96x256x128_MXF8_MXF8_B16_2x1x0x0x4_default,1425.57,2423.96,0.0
gfx950,256,512,65536,1536,mxfp8,flydsl_mxfp8,263,1,69.3108,flydsl_bpreshuflle_256x256x128_MXF8_MXF8_B16_2x0x1x1x4_default,1487.2,2431.92,0.0
gfx950,256,544,65536,1536,mxfp8,flydsl_mxfp8,517,1,74.2377,flydsl_bpreshuflle_192x128x128_MXF8_MXF8_B16_2x1x1x2x4_default,1475.28,2327.69,0.0
gfx950,256,576,65536,1536,mxfp8,flydsl_mxfp8,84,1,76.9497,flydsl_bpreshuflle_192x128x128_MXF8_MXF8_B16_2x0x1x0x4_default,1507.01,2300.8,0.0
gfx950,256,608,65536,1536,mxfp8,flydsl_mxfp8,671,1,82.189,flydsl_bpreshuflle_224x128x128_MXF8_MXF8_B16_2x1x1x3x4_default,1489.33,2205.76,0.0
gfx950,256,640,65536,1536,mxfp8,flydsl_mxfp8,173,1,84.0842,flydsl_bpreshuflle_224x128x128_MXF8_MXF8_B16_2x1x1x0x4_default,1532.38,2206.51,0.0
gfx950,256,672,65536,1536,mxfp8,flydsl_mxfp8,518,1,84.6078,flydsl_bpreshuflle_224x128x128_MXF8_MXF8_B16_2x1x1x2x4_default,1599.04,2243.01,0.0
gfx950,256,704,65536,1536,mxfp8,flydsl_mxfp8,517,1,94.7835,flydsl_bpreshuflle_192x128x128_MXF8_MXF8_B16_2x1x1x2x4_default,1495.34,2046.97,0.0
gfx950,256,736,65536,1536,mxfp8,flydsl_mxfp8,348,1,98.3731,flydsl_bpreshuflle_192x128x128_MXF8_MXF8_B16_2x1x1x1x4_default,1506.27,2015.42,0.0
gfx950,256,768,65536,1536,mxfp8,flydsl_mxfp8,172,1,99.5183,flydsl_bpreshuflle_192x128x128_MXF8_MXF8_B16_2x1x1x0x4_default,1553.67,2034.86,0.0
gfx950,256,800,65536,1536,mxfp8,flydsl_mxfp8,671,1,107.7352,flydsl_bpreshuflle_224x128x128_MXF8_MXF8_B16_2x1x1x3x4_default,1494.97,1919.05,0.0
gfx950,256,832,65536,1536,mxfp8,flydsl_mxfp8,671,1,106.9101,flydsl_bpreshuflle_224x128x128_MXF8_MXF8_B16_2x1x1x3x4_default,1566.77,1973.56,0.0
gfx950,256,864,65536,1536,mxfp8,flydsl_mxfp8,349,1,107.7879,flydsl_bpreshuflle_224x128x128_MXF8_MXF8_B16_2x1x1x1x4_default,1613.78,1996.85,0.0
gfx950,256,896,65536,1536,mxfp8,flydsl_mxfp8,349,1,110.3824,flydsl_bpreshuflle_224x128x128_MXF8_MXF8_B16_2x1x1x1x4_default,1634.22,1988.36,0.0
gfx950,256,928,65536,1536,mxfp8,flydsl_mxfp8,343,1,119.0849,flydsl_bpreshuflle_96x256x128_MXF8_MXF8_B16_2x1x1x1x4_default,1568.89,1878.69,0.0
gfx950,256,960,65536,1536,mxfp8,flydsl_mxfp8,343,1,119.4388,flydsl_bpreshuflle_96x256x128_MXF8_MXF8_B16_2x1x1x1x4_default,1618.18,1908.65,0.0
gfx950,256,992,65536,1536,mxfp8,flydsl_mxfp8,167,1,128.2834,flydsl_bpreshuflle_96x256x128_MXF8_MXF8_B16_2x1x1x0x4_default,1556.83,1810.14,0.0
gfx950,256,1024,65536,1536,mxfp8,flydsl_mxfp8,87,1,128.459,flydsl_bpreshuflle_256x256x128_MXF8_MXF8_B16_2x0x1x0x4_default,1604.86,1840.7,0.0
gfx950,256,1088,65536,1536,mxfp8,flydsl_mxfp8,167,1,133.7218,flydsl_bpreshuflle_96x256x128_MXF8_MXF8_B16_2x1x1x0x4_default,1638.05,1831.72,0.0
gfx950,256,1152,65536,1536,mxfp8,flydsl_mxfp8,512,1,136.4258,flydsl_bpreshuflle_96x256x128_MXF8_MXF8_B16_2x1x1x2x4_default,1700.03,1857.62,0.0
gfx950,256,1216,65536,1536,mxfp8,flydsl_mxfp8,470,1,145.6163,flydsl_bpreshuflle_96x256x128_MXF8_MXF8_B16_2x1x0x2x4_default,1681.22,1798.66,0.0
gfx950,256,1280,65536,1536,mxfp8,flydsl_mxfp8,343,1,152.7312,flydsl_bpreshuflle_96x256x128_MXF8_MXF8_B16_2x1x1x1x4_default,1687.27,1770.44,0.0
gfx950,256,1344,65536,1536,mxfp8,flydsl_mxfp8,512,1,154.5832,flydsl_bpreshuflle_96x256x128_MXF8_MXF8_B16_2x1x1x2x4_default,1750.4,1804.13,0.0
gfx950,256,1408,65536,1536,mxfp8,flydsl_mxfp8,512,1,165.8029,flydsl_bpreshuflle_96x256x128_MXF8_MXF8_B16_2x1x1x2x4_default,1709.67,1733.23,0.0
gfx950,256,1472,65536,1536,mxfp8,flydsl_mxfp8,343,1,175.1078,flydsl_bpreshuflle_96x256x128_MXF8_MXF8_B16_2x1x1x1x4_default,1692.4,1689.6,0.0
gfx950,256,1536,65536,1536,mxfp8,flydsl_mxfp8,349,1,180.3104,flydsl_bpreshuflle_224x128x128_MXF8_MXF8_B16_2x1x1x1x4_default,1715.03,1687.92,0.0
gfx950,256,1600,65536,1536,mxfp8,flydsl_mxfp8,432,1,188.4398,flydsl_bpreshuflle_128x256x128_MXF8_MXF8_B16_2x0x1x2x4_default,1709.42,1660.14,0.0
gfx950,256,1664,65536,1536,mxfp8,flydsl_mxfp8,432,1,190.9838,flydsl_bpreshuflle_128x256x128_MXF8_MXF8_B16_2x0x1x2x4_default,1754.11,1682.46,0.0
gfx950,256,1728,65536,1536,mxfp8,flydsl_mxfp8,343,1,199.0911,flydsl_bpreshuflle_96x256x128_MXF8_MXF8_B16_2x1x1x1x4_default,1747.4,1656.58,0.0
gfx950,256,1792,65536,1536,mxfp8,flydsl_mxfp8,167,1,207.2549,flydsl_bpreshuflle_96x256x128_MXF8_MXF8_B16_2x1x1x0x4_default,1740.74,1632.27,0.0
gfx950,256,1856,65536,1536,mxfp8,flydsl_mxfp8,343,1,207.5617,flydsl_bpreshuflle_96x256x128_MXF8_MXF8_B16_2x1x1x1x4_default,1800.25,1670.75,0.0
gfx950,256,1920,65536,1536,mxfp8,flydsl_mxfp8,512,1,211.2773,flydsl_bpreshuflle_96x256x128_MXF8_MXF8_B16_2x1x1x2x4_default,1829.57,1681.54,0.0
gfx950,256,1984,65536,1536,mxfp8,flydsl_mxfp8,167,1,220.752,flydsl_bpreshuflle_96x256x128_MXF8_MXF8_B16_2x1x1x0x4_default,1809.41,1647.81,0.0
gfx950,256,2048,65536,1536,mxfp8,flydsl_mxfp8,343,1,231.3546,flydsl_bpreshuflle_96x256x128_MXF8_MXF8_B16_2x1x1x1x4_default,1782.19,1608.98,0.0
gfx950,256,4096,65536,1536,mxfp8,flydsl_mxfp8,167,1,442.7122,flydsl_bpreshuflle_96x256x128_MXF8_MXF8_B16_2x1x1x0x4_default,1862.69,1454.28,0.0
gfx950,256,6144,65536,1536,mxfp8,flydsl_mxfp8,512,1,625.5782,flydsl_bpreshuflle_96x256x128_MXF8_MXF8_B16_2x1x1x2x4_default,1977.29,1463.3,0.0
gfx950,256,8192,65536,1536,mxfp8,flydsl_mxfp8,512,1,825.4752,flydsl_bpreshuflle_96x256x128_MXF8_MXF8_B16_2x1x1x2x4_default,1997.96,1437.95,0.0
gfx950,256,10240,65536,1536,mxfp8,flydsl_mxfp8,512,1,1025.3931,flydsl_bpreshuflle_96x256x128_MXF8_MXF8_B16_2x1x1x2x4_default,2010.53,1422.45,0.0
gfx950,256,12288,65536,1536,mxfp8,flydsl_mxfp8,343,1,1204.9086,flydsl_bpreshuflle_96x256x128_MXF8_MXF8_B16_2x1x1x1x4_default,2053.19,1435.92,0.0
gfx950,256,14336,65536,1536,mxfp8,flydsl_mxfp8,512,1,1419.3524,flydsl_bpreshuflle_96x256x128_MXF8_MXF8_B16_2x1x1x2x4_default,2033.48,1410.31,0.0
gfx950,256,16384,65536,1536,mxfp8,flydsl_mxfp8,512,1,1655.9096,flydsl_bpreshuflle_96x256x128_MXF8_MXF8_B16_2x1x1x2x4_default,1991.98,1372.85,0.0
gfx950,256,20480,65536,1536,mxfp8,flydsl_mxfp8,512,1,2144.5325,flydsl_bpreshuflle_96x256x128_MXF8_MXF8_B16_2x1x1x2x4_default,1922.64,1313.33,0.0
gfx950,256,24576,65536,1536,mxfp8,flydsl_mxfp8,343,1,2608.9648,flydsl_bpreshuflle_96x256x128_MXF8_MXF8_B16_2x1x1x1x4_default,1896.46,1287.73,0.0
gfx950,256,28672,65536,1536,mxfp8,flydsl_mxfp8,411,1,2972.4672,flydsl_bpreshuflle_128x256x128_MXF8_MXF8_B16_2x0x1x2x0_default,1941.97,1312.98,0.0
gfx950,256,32768,65536,1536,mxfp8,flydsl_mxfp8,167,1,3457.1093,flydsl_bpreshuflle_96x256x128_MXF8_MXF8_B16_2x1x1x0x4_default,1908.26,1286.03,0.0
gfx950,256,40960,65536,1536,mxfp8,flydsl_mxfp8,145,1,4286.4293,flydsl_bpreshuflle_96x256x128_MXF8_MXF8_B16_2x1x1x0x0_default,1923.82,1290.65,0.0
gfx950,256,49152,65536,1536,mxfp8,flydsl_mxfp8,167,1,5212.2984,flydsl_bpreshuflle_96x256x128_MXF8_MXF8_B16_2x1x1x0x4_default,1898.51,1269.81,0.0
gfx950,256,57344,65536,1536,mxfp8,flydsl_mxfp8,101,1,6004.096,flydsl_bpreshuflle_96x256x128_MXF8_MXF8_B16_2x1x0x0x0_default,1922.83,1283.28,0.0
gfx950,256,65536,65536,1536,mxfp8,flydsl_mxfp8,321,1,6779.3776,flydsl_bpreshuflle_96x256x128_MXF8_MXF8_B16_2x1x1x1x0_default,1946.22,1296.77,0.0
