aiter/configs/bf16_tuned_gemm.csv
M,N,K,bias,dtype,outdtype,scaleAB,cu_num,libtype,solidx,splitK,us,kernelName,err_ratio,tflops,bw
64,256,5120,False,torch.bfloat16,torch.float32,False,80,asm,1,10,8.3,_ZN5aiter28bf16gemm_outf32_tn_32x64_pf3E,0.0,20.21,402.69
80,256,5120,False,torch.bfloat16,torch.float32,False,80,asm,2,10,8.8,_ZN5aiter28bf16gemm_outf32_tn_48x64_pf3E,0.0,23.83,400.29
128,256,5120,False,torch.bfloat16,torch.float32,False,80,asm,3,10,11.2,_ZN5aiter28bf16gemm_outf32_tn_64x64_pf3E,0.0,29.96,362.79
150,256,5120,False,torch.bfloat16,torch.float32,False,80,asm,2,5,11.7,_ZN5aiter28bf16gemm_outf32_tn_48x64_pf3E,0.0,33.61,368.46
192,256,5120,False,torch.bfloat16,torch.float32,False,80,asm,5,10,12.8,_ZN5aiter28bf16gemm_outf32_tn_96x64_pf3E,0.0,39.32,373.76
220,256,5120,False,torch.bfloat16,torch.float32,False,80,asm,3,5,13.1,_ZN5aiter28bf16gemm_outf32_tn_64x64_pf3E,0.0,44.02,389.28
256,256,5120,False,torch.bfloat16,torch.float32,False,80,asm,3,5,14.4,_ZN5aiter28bf16gemm_outf32_tn_64x64_pf3E,0.0,46.6,382.29
384,256,5120,False,torch.bfloat16,torch.float32,False,80,asm,5,5,19.7,_ZN5aiter28bf16gemm_outf32_tn_96x64_pf3E,0.0,51.1,352.63
1,5120,2880,True,torch.bfloat16,torch.bfloat16,False,256,hipblaslt,387755,0,11.5569,Cijk_Alik_Bljk_BBS_BH_Bias_HA_S_SAV_UserArgs_MT64x16x64_MI16x16x1_SN_LDSB0_AFC1_AFEM1_AFEM1_ASEM1_CLR1_CADS0_DTLA1_DTLB1_DTVA0_DTVB0_EPS0_FDSI0_GRPM1_GRVWA8_GRVWB2_GSU0_GSUAMB_GLS0_ISA950_IU1_K1_LBSPPA1024_LBSPPB256_LBSPPM0_LPA16_LPB16_LPM0_LRVW8_LWPMn1_MIAV1_MIWT2_1_MO40_NTn1_NTA4_NTB3_NTC0_NTD1_NTM0_NEPBS4_NLCA1_NLCB1_ONLL1_PGR2_PLR1_PKA1_SIA3_SS1_SPO0_SRVW0_SSO0_SVW2_SK3_SKXCCM0_TLDS2_ULSGRO0_USL1_UIOFGRO0_USFGROn1_VSn1_VWA2_VWB1_WSGRA0_WSGRB0_WS64_WG32_4_1,0.0,2.55,2553.21
1,2880,4096,True,torch.bfloat16,torch.bfloat16,False,256,hipblaslt,387862,0,8.4264,Cijk_Alik_Bljk_BBS_BH_Bias_HA_S_SAV_UserArgs_MT16x16x512_MI16x16x1_SN_LDSB0_AFC1_AFEM1_AFEM1_ASEM1_CLR1_CADS0_DTLA1_DTLB1_DTVA0_DTVB0_EPS0_FDSI0_GRPM1_GRVWA8_GRVWB8_GSU0_GSUAMB_GLS0_ISA950_IU1_K1_LBSPPA1024_LBSPPB1024_LBSPPM0_LPA16_LPB16_LPM0_LRVW8_LWPMn1_MIAV0_MIWT1_1_MO40_NTn1_NTA7_NTB0_NTC2_NTD2_NTM0_NEPBS4_NLCA1_NLCB1_ONLL1_PGR2_PLR1_PKA1_SIA3_SS1_SPO1_SRVW0_SSO1_SVW1_SK3_SKXCCM8_TLDS2_ULSGRO0_USL1_UIOFGRO0_USFGROn1_VSn1_VWA1_VWB1_WSGRA0_WSGRB0_WS64_WG16_4_4,0.0,2.8,2801.54
1,128,2880,True,torch.bfloat16,torch.bfloat16,False,256,hipblaslt,388470,0,7.4137,Cijk_Alik_Bljk_BBS_BH_Bias_HA_S_SAV_UserArgs_MT16x16x512_MI16x16x1_SN_LDSB0_AFC1_AFEM1_AFEM1_ASEM1_CLR0_CADS0_DTLA0_DTLB0_DTVA0_DTVB0_EPS0_FDSI0_GRPM1_GRVWA8_GRVWB8_GSU0_GSUAMB_GLS0_ISA950_IU1_K1_LBSPPA1024_LBSPPB1024_LBSPPM0_LPA16_LPB16_LPM0_LRVW8_LWPMn1_MIAV1_MIWT1_1_MO40_NTn1_NTA0_NTB0_NTC0_NTD0_NTM0_NEPBS16_NLCA1_NLCB1_ONLL1_PGR2_PLR1_PKA1_SIA3_SS1_SPO0_SRVW0_SSO0_SVW1_SK3_SKXCCM8_TLDS1_ULSGRO0_USL1_UIOFGRO0_USFGRO1_VSn1_VWA1_VWB1_WSGRA0_WSGRB0_WS64_WG16_4_4,0.0,0.1,100.26
1,201088,2880,False,torch.bfloat16,torch.bfloat16,False,256,hipblaslt,387565,0,173.0748,Cijk_Alik_Bljk_BBS_BH_Bias_HA_S_SAV_UserArgs_MT448x16x64_MI16x16x1_SN_LDSB1_AFC1_AFEM1_AFEM1_ASEM1_CLR0_CADS0_DTLA0_DTLB0_DTVA0_DTVB0_EPS0_FDSI0_GRPM1_GRVWA8_GRVWB4_GSU0_GSUAMB_GLS0_ISA950_IU1_K1_LBSPPA128_LBSPPB128_LBSPPM0_LPA16_LPB16_LPM0_LRVW8_LWPMn1_MIAV0_MIWT7_1_MO40_NTn1_NTA4_NTB0_NTC0_NTD0_NTM0_NEPBS14_NLCA1_NLCB1_ONLL1_PGR2_PLR1_PKA1_SIA3_SS0_SPO1_SRVW0_SSO0_SVW4_SK3_SKXCCM0_TLDS1_ULSGRO0_USL1_UIOFGRO0_USFGRO0_VSn1_VWA1_VWB1_WSGRA0_WSGRB0_WS64_WG64_4_1,0.0,6.69,6694.65
2,5120,2880,True,torch.bfloat16,torch.bfloat16,False,256,hipblaslt,387755,0,11.719,Cijk_Alik_Bljk_BBS_BH_Bias_HA_S_SAV_UserArgs_MT64x16x64_MI16x16x1_SN_LDSB0_AFC1_AFEM1_AFEM1_ASEM1_CLR1_CADS0_DTLA1_DTLB1_DTVA0_DTVB0_EPS0_FDSI0_GRPM1_GRVWA8_GRVWB2_GSU0_GSUAMB_GLS0_ISA950_IU1_K1_LBSPPA1024_LBSPPB256_LBSPPM0_LPA16_LPB16_LPM0_LRVW8_LWPMn1_MIAV1_MIWT2_1_MO40_NTn1_NTA4_NTB3_NTC0_NTD1_NTM0_NEPBS4_NLCA1_NLCB1_ONLL1_PGR2_PLR1_PKA1_SIA3_SS1_SPO0_SRVW0_SSO0_SVW2_SK3_SKXCCM0_TLDS2_ULSGRO0_USL1_UIOFGRO0_USFGROn1_VSn1_VWA2_VWB1_WSGRA0_WSGRB0_WS64_WG32_4_1,0.0,5.03,2519.26
2,2880,4096,True,torch.bfloat16,torch.bfloat16,False,256,hipblaslt,387862,0,8.2011,Cijk_Alik_Bljk_BBS_BH_Bias_HA_S_SAV_UserArgs_MT16x16x512_MI16x16x1_SN_LDSB0_AFC1_AFEM1_AFEM1_ASEM1_CLR1_CADS0_DTLA1_DTLB1_DTVA0_DTVB0_EPS0_FDSI0_GRPM1_GRVWA8_GRVWB8_GSU0_GSUAMB_GLS0_ISA950_IU1_K1_LBSPPA1024_LBSPPB1024_LBSPPM0_LPA16_LPB16_LPM0_LRVW8_LWPMn1_MIAV0_MIWT1_1_MO40_NTn1_NTA7_NTB0_NTC2_NTD2_NTM0_NEPBS4_NLCA1_NLCB1_ONLL1_PGR2_PLR1_PKA1_SIA3_SS1_SPO1_SRVW0_SSO1_SVW1_SK3_SKXCCM8_TLDS2_ULSGRO0_USL1_UIOFGRO0_USFGROn1_VSn1_VWA1_VWB1_WSGRA0_WSGRB0_WS64_WG16_4_4,0.0,5.75,2880.21
2,128,2880,True,torch.bfloat16,torch.bfloat16,False,256,hipblaslt,388470,0,6.7527,Cijk_Alik_Bljk_BBS_BH_Bias_HA_S_SAV_UserArgs_MT16x16x512_MI16x16x1_SN_LDSB0_AFC1_AFEM1_AFEM1_ASEM1_CLR0_CADS0_DTLA0_DTLB0_DTVA0_DTVB0_EPS0_FDSI0_GRPM1_GRVWA8_GRVWB8_GSU0_GSUAMB_GLS0_ISA950_IU1_K1_LBSPPA1024_LBSPPB1024_LBSPPM0_LPA16_LPB16_LPM0_LRVW8_LWPMn1_MIAV1_MIWT1_1_MO40_NTn1_NTA0_NTB0_NTC0_NTD0_NTM0_NEPBS16_NLCA1_NLCB1_ONLL1_PGR2_PLR1_PKA1_SIA3_SS1_SPO0_SRVW0_SSO0_SVW1_SK3_SKXCCM8_TLDS1_ULSGRO0_USL1_UIOFGRO0_USFGRO1_VSn1_VWA1_VWB1_WSGRA0_WSGRB0_WS64_WG16_4_4,0.0,0.22,110.96
2,201088,2880,False,torch.bfloat16,torch.bfloat16,False,256,hipblaslt,387839,0,173.7192,Cijk_Alik_Bljk_BBS_BH_Bias_HA_S_SAV_UserArgs_MT448x16x64_MI16x16x1_SN_LDSB1_AFC1_AFEM1_AFEM1_ASEM1_CLR0_CADS0_DTLA0_DTLB0_DTVA0_DTVB0_EPS0_FDSI0_GRPM1_GRVWA8_GRVWB4_GSU0_GSUAMB_GLS0_ISA950_IU1_K1_LBSPPA128_LBSPPB128_LBSPPM0_LPA16_LPB16_LPM0_LRVW8_LWPMn1_MIAV0_MIWT7_1_MO40_NTn1_NTA4_NTB2_NTC1_NTD1_NTM0_NEPBS16_NLCA1_NLCB1_ONLL1_PGR2_PLR1_PKA1_SIA3_SS0_SPO1_SRVW0_SSO0_SVW4_SK3_SKXCCM8_TLDS1_ULSGRO0_USL1_UIOFGRO0_USFGRO0_VSn1_VWA1_VWB1_WSGRA0_WSGRB0_WS64_WG64_4_1,0.0,13.33,6672.16
4,5120,2880,True,torch.bfloat16,torch.bfloat16,False,256,hipblaslt,387616,0,11.9337,Cijk_Alik_Bljk_BBS_BH_Bias_HA_S_SAV_UserArgs_MT64x16x64_MI16x16x1_SN_LDSB0_AFC1_AFEM1_AFEM1_ASEM1_CLR1_CADS0_DTLA1_DTLB1_DTVA0_DTVB0_EPS0_FDSI0_GRPM1_GRVWA8_GRVWB2_GSU0_GSUAMB_GLS0_ISA950_IU1_K1_LBSPPA1024_LBSPPB256_LBSPPM0_LPA16_LPB16_LPM0_LRVW8_LWPMn1_MIAV0_MIWT2_1_MO40_NTn1_NTA5_NTB0_NTC1_NTD2_NTM0_NEPBS12_NLCA1_NLCB1_ONLL1_PGR2_PLR1_PKA1_SIA3_SS1_SPO0_SRVW0_SSO0_SVW2_SK3_SKXCCM8_TLDS2_ULSGRO0_USL1_UIOFGRO0_USFGROn1_VSn1_VWA2_VWB1_WSGRA0_WSGRB0_WS64_WG32_4_1,0.0,9.89,2476.62
4,2880,4096,True,torch.bfloat16,torch.bfloat16,False,256,hipblaslt,387662,0,8.6685,Cijk_Alik_Bljk_BBS_BH_Bias_HA_S_SAV_UserArgs_MT16x16x512_MI16x16x1_SN_LDSB0_AFC1_AFEM1_AFEM1_ASEM1_CLR1_CADS0_DTLA1_DTLB1_DTVA0_DTVB0_EPS0_FDSI0_GRPM1_GRVWA8_GRVWB8_GSU0_GSUAMB_GLS0_ISA950_IU1_K1_LBSPPA1024_LBSPPB1024_LBSPPM0_LPA16_LPB16_LPM0_LRVW8_LWPMn1_MIAV0_MIWT1_1_MO40_NTn1_NTA6_NTB1_NTC3_NTD0_NTM0_NEPBS14_NLCA1_NLCB1_ONLL1_PGR2_PLR1_PKA1_SIA3_SS1_SPO1_SRVW0_SSO0_SVW1_SK3_SKXCCM0_TLDS1_ULSGRO0_USL1_UIOFGRO0_USFGRO1_VSn1_VWA1_VWB1_WSGRA0_WSGRB0_WS64_WG16_4_4,0.0,10.89,2728.13
4,128,2880,True,torch.bfloat16,torch.bfloat16,False,256,hipblaslt,388470,0,7.4558,Cijk_Alik_Bljk_BBS_BH_Bias_HA_S_SAV_UserArgs_MT16x16x512_MI16x16x1_SN_LDSB0_AFC1_AFEM1_AFEM1_ASEM1_CLR0_CADS0_DTLA0_DTLB0_DTVA0_DTVB0_EPS0_FDSI0_GRPM1_GRVWA8_GRVWB8_GSU0_GSUAMB_GLS0_ISA950_IU1_K1_LBSPPA1024_LBSPPB1024_LBSPPM0_LPA16_LPB16_LPM0_LRVW8_LWPMn1_MIAV1_MIWT1_1_MO40_NTn1_NTA0_NTB0_NTC0_NTD0_NTM0_NEPBS16_NLCA1_NLCB1_ONLL1_PGR2_PLR1_PKA1_SIA3_SS1_SPO0_SRVW0_SSO0_SVW1_SK3_SKXCCM8_TLDS1_ULSGRO0_USL1_UIOFGRO0_USFGRO1_VSn1_VWA1_VWB1_WSGRA0_WSGRB0_WS64_WG16_4_4,0.0,0.4,102.11
4,201088,2880,False,torch.bfloat16,torch.bfloat16,False,256,hipblaslt,387774,0,173.5718,Cijk_Alik_Bljk_BBS_BH_Bias_HA_S_SAV_UserArgs_MT416x16x64_MI16x16x1_SN_LDSB1_AFC1_AFEM1_AFEM1_ASEM1_CLR0_CADS0_DTLA0_DTLB0_DTVA0_DTVB0_EPS1_FDSI0_GRPM1_GRVWA8_GRVWB8_GSU0_GSUAMB_GLS0_ISA950_IU1_K1_LBSPPA128_LBSPPB128_LBSPPM0_LPA16_LPB16_LPM0_LRVW8_LWPMn1_MIAV0_MIWT13_1_MO40_NTn1_NTA4_NTB2_NTC1_NTD0_NTM0_NEPBS14_NLCA1_NLCB1_ONLL1_PGR1_PLR1_PKA1_SIA3_SS0_SPO1_SRVW0_SSO0_SVW4_SK3_SKXCCM0_TLDS1_ULSGRO0_USL1_UIOFGRO0_USFGRO0_VSn1_VWA1_VWB1_WSGRA0_WSGRB0_WS64_WG32_4_1,0.0,26.69,6682.53
8,5120,2880,True,torch.bfloat16,torch.bfloat16,False,256,hipblaslt,387477,0,12.3022,Cijk_Alik_Bljk_BBS_BH_Bias_HA_S_SAV_UserArgs_MT64x16x64_MI16x16x1_SN_LDSB0_AFC1_AFEM1_AFEM1_ASEM1_CLR0_CADS0_DTLA1_DTLB1_DTVA0_DTVB0_EPS0_FDSI0_GRPM1_GRVWA8_GRVWB2_GSU0_GSUAMB_GLS0_ISA950_IU1_K1_LBSPPA1024_LBSPPB256_LBSPPM0_LPA16_LPB16_LPM0_LRVW8_LWPMn1_MIAV1_MIWT4_1_MO40_NTn1_NTA4_NTB1_NTC1_NTD0_NTM0_NEPBS0_NLCA1_NLCB1_ONLL1_PGR2_PLR1_PKA1_SIA3_SS0_SPO0_SRVW0_SSO0_SVW4_SK3_SKXCCM0_TLDS1_ULSGRO0_USL1_UIOFGRO0_USFGROn1_VSn1_VWA4_VWB1_WSGRA0_WSGRB0_WS64_WG16_4_2,0.0,19.18,2407.63
8,2880,4096,True,torch.bfloat16,torch.bfloat16,False,256,hipblaslt,387862,0,8.6895,Cijk_Alik_Bljk_BBS_BH_Bias_HA_S_SAV_UserArgs_MT16x16x512_MI16x16x1_SN_LDSB0_AFC1_AFEM1_AFEM1_ASEM1_CLR1_CADS0_DTLA1_DTLB1_DTVA0_DTVB0_EPS0_FDSI0_GRPM1_GRVWA8_GRVWB8_GSU0_GSUAMB_GLS0_ISA950_IU1_K1_LBSPPA1024_LBSPPB1024_LBSPPM0_LPA16_LPB16_LPM0_LRVW8_LWPMn1_MIAV0_MIWT1_1_MO40_NTn1_NTA7_NTB0_NTC2_NTD2_NTM0_NEPBS4_NLCA1_NLCB1_ONLL1_PGR2_PLR1_PKA1_SIA3_SS1_SPO1_SRVW0_SSO1_SVW1_SK3_SKXCCM8_TLDS2_ULSGRO0_USL1_UIOFGRO0_USFGROn1_VSn1_VWA1_VWB1_WSGRA0_WSGRB0_WS64_WG16_4_4,0.0,21.72,2727.96
8,128,2880,True,torch.bfloat16,torch.bfloat16,False,256,hipblaslt,388470,0,7.1043,Cijk_Alik_Bljk_BBS_BH_Bias_HA_S_SAV_UserArgs_MT16x16x512_MI16x16x1_SN_LDSB0_AFC1_AFEM1_AFEM1_ASEM1_CLR0_CADS0_DTLA0_DTLB0_DTVA0_DTVB0_EPS0_FDSI0_GRPM1_GRVWA8_GRVWB8_GSU0_GSUAMB_GLS0_ISA950_IU1_K1_LBSPPA1024_LBSPPB1024_LBSPPM0_LPA16_LPB16_LPM0_LRVW8_LWPMn1_MIAV1_MIWT1_1_MO40_NTn1_NTA0_NTB0_NTC0_NTD0_NTM0_NEPBS16_NLCA1_NLCB1_ONLL1_PGR2_PLR1_PKA1_SIA3_SS1_SPO0_SRVW0_SSO0_SVW1_SK3_SKXCCM8_TLDS1_ULSGRO0_USL1_UIOFGRO0_USFGRO1_VSn1_VWA1_VWB1_WSGRA0_WSGRB0_WS64_WG16_4_4,0.0,0.83,110.55
8,201088,2880,False,torch.bfloat16,torch.bfloat16,False,256,hipblaslt,387496,0,174.5802,Cijk_Alik_Bljk_BBS_BH_Bias_HA_S_SAV_UserArgs_MT448x32x64_MI16x16x1_SN_LDSB1_AFC1_AFEM1_AFEM1_ASEM1_CLR0_CADS0_DTLA0_DTLB0_DTVA0_DTVB0_EPS0_FDSI0_GRPM1_GRVWA8_GRVWB8_GSU0_GSUAMB_GLS0_ISA950_IU1_K1_LBSPPA256_LBSPPB128_LBSPPM0_LPA16_LPB16_LPM0_LRVW8_LWPMn1_MIAV0_MIWT14_1_MO40_NTn1_NTA5_NTB0_NTC4_NTD1_NTM0_NEPBS8_NLCA1_NLCB1_ONLL1_PGR2_PLR1_PKA1_SIA3_SS0_SPO1_SRVW0_SSO0_SVW8_SK3_SKXCCM0_TLDS1_ULSGRO0_USL1_UIOFGRO0_USFGROn1_VSn1_VWA2_VWB1_WSGRA0_WSGRB0_WS64_WG32_8_1,0.0,53.08,6653.28
16,5120,2880,True,torch.bfloat16,torch.bfloat16,False,256,hipblaslt,387755,0,11.8706,Cijk_Alik_Bljk_BBS_BH_Bias_HA_S_SAV_UserArgs_MT64x16x64_MI16x16x1_SN_LDSB0_AFC1_AFEM1_AFEM1_ASEM1_CLR1_CADS0_DTLA1_DTLB1_DTVA0_DTVB0_EPS0_FDSI0_GRPM1_GRVWA8_GRVWB2_GSU0_GSUAMB_GLS0_ISA950_IU1_K1_LBSPPA1024_LBSPPB256_LBSPPM0_LPA16_LPB16_LPM0_LRVW8_LWPMn1_MIAV1_MIWT2_1_MO40_NTn1_NTA4_NTB3_NTC0_NTD1_NTM0_NEPBS4_NLCA1_NLCB1_ONLL1_PGR2_PLR1_PKA1_SIA3_SS1_SPO0_SRVW0_SSO0_SVW2_SK3_SKXCCM0_TLDS2_ULSGRO0_USL1_UIOFGRO0_USFGROn1_VSn1_VWA2_VWB1_WSGRA0_WSGRB0_WS64_WG32_4_1,0.0,39.75,2505.96
16,2880,4096,True,torch.bfloat16,torch.bfloat16,False,256,hipblaslt,387862,0,9.0264,Cijk_Alik_Bljk_BBS_BH_Bias_HA_S_SAV_UserArgs_MT16x16x512_MI16x16x1_SN_LDSB0_AFC1_AFEM1_AFEM1_ASEM1_CLR1_CADS0_DTLA1_DTLB1_DTVA0_DTVB0_EPS0_FDSI0_GRPM1_GRVWA8_GRVWB8_GSU0_GSUAMB_GLS0_ISA950_IU1_K1_LBSPPA1024_LBSPPB1024_LBSPPM0_LPA16_LPB16_LPM0_LRVW8_LWPMn1_MIAV0_MIWT1_1_MO40_NTn1_NTA7_NTB0_NTC2_NTD2_NTM0_NEPBS4_NLCA1_NLCB1_ONLL1_PGR2_PLR1_PKA1_SIA3_SS1_SPO1_SRVW0_SSO1_SVW1_SK3_SKXCCM8_TLDS2_ULSGRO0_USL1_UIOFGRO0_USFGROn1_VSn1_VWA1_VWB1_WSGRA0_WSGRB0_WS64_WG16_4_4,0.0,41.82,2638.5
16,128,2880,True,torch.bfloat16,torch.bfloat16,False,256,hipblaslt,388470,0,7.7737,Cijk_Alik_Bljk_BBS_BH_Bias_HA_S_SAV_UserArgs_MT16x16x512_MI16x16x1_SN_LDSB0_AFC1_AFEM1_AFEM1_ASEM1_CLR0_CADS0_DTLA0_DTLB0_DTVA0_DTVB0_EPS0_FDSI0_GRPM1_GRVWA8_GRVWB8_GSU0_GSUAMB_GLS0_ISA950_IU1_K1_LBSPPA1024_LBSPPB1024_LBSPPM0_LPA16_LPB16_LPM0_LRVW8_LWPMn1_MIAV1_MIWT1_1_MO40_NTn1_NTA0_NTB0_NTC0_NTD0_NTM0_NEPBS16_NLCA1_NLCB1_ONLL1_PGR2_PLR1_PKA1_SIA3_SS1_SPO0_SRVW0_SSO0_SVW1_SK3_SKXCCM8_TLDS1_ULSGRO0_USL1_UIOFGRO0_USFGRO1_VSn1_VWA1_VWB1_WSGRA0_WSGRB0_WS64_WG16_4_4,0.0,1.52,107.23
16,201088,2880,False,torch.bfloat16,torch.bfloat16,False,256,hipblaslt,387774,0,174.8981,Cijk_Alik_Bljk_BBS_BH_Bias_HA_S_SAV_UserArgs_MT416x16x64_MI16x16x1_SN_LDSB1_AFC1_AFEM1_AFEM1_ASEM1_CLR0_CADS0_DTLA0_DTLB0_DTVA0_DTVB0_EPS1_FDSI0_GRPM1_GRVWA8_GRVWB8_GSU0_GSUAMB_GLS0_ISA950_IU1_K1_LBSPPA128_LBSPPB128_LBSPPM0_LPA16_LPB16_LPM0_LRVW8_LWPMn1_MIAV0_MIWT13_1_MO40_NTn1_NTA4_NTB2_NTC1_NTD0_NTM0_NEPBS14_NLCA1_NLCB1_ONLL1_PGR1_PLR1_PKA1_SIA3_SS0_SPO1_SRVW0_SSO0_SVW4_SK3_SKXCCM0_TLDS1_ULSGRO0_USL1_UIOFGRO0_USFGRO0_VSn1_VWA1_VWB1_WSGRA0_WSGRB0_WS64_WG32_4_1,0.0,105.96,6659.84
32,5120,2880,True,torch.bfloat16,torch.bfloat16,False,256,hipblaslt,387548,0,13.3169,Cijk_Alik_Bljk_BBS_BH_Bias_HA_S_SAV_UserArgs_MT64x32x64_MI16x16x1_SN_LDSB0_AFC1_AFEM1_AFEM1_ASEM1_CLR1_CADS0_DTLA1_DTLB1_DTVA0_DTVB0_EPS0_FDSI0_GRPM1_GRVWA8_GRVWB8_GSU0_GSUAMB_GLS0_ISA950_IU1_K1_LBSPPA1024_LBSPPB1024_LBSPPM0_LPA16_LPB16_LPM0_LRVW8_LWPMn1_MIAV1_MIWT4_1_MO40_NTn1_NTA4_NTB0_NTC0_NTD3_NTM0_NEPBS0_NLCA1_NLCB1_ONLL1_PGR2_PLR1_PKA1_SIA3_SS1_SPO0_SRVW0_SSO0_SVW4_SK3_SKXCCM0_TLDS1_ULSGRO0_USL1_UIOFGRO0_USFGRO1_VSn1_VWA4_VWB1_WSGRA0_WSGRB0_WS64_WG16_8_1,0.0,70.87,2253.02
32,2880,4096,True,torch.bfloat16,torch.bfloat16,False,256,hipblaslt,387732,0,9.8979,Cijk_Alik_Bljk_BBS_BH_Bias_HA_S_SAV_UserArgs_MT16x32x512_MI16x16x1_SN_LDSB0_AFC1_AFEM1_AFEM1_ASEM1_CLR0_CADS0_DTLA1_DTLB1_DTVA0_DTVB0_EPS0_FDSI0_GRPM1_GRVWA8_GRVWB8_GSU0_GSUAMB_GLS0_ISA950_IU1_K1_LBSPPA1024_LBSPPB2048_LBSPPM0_LPA16_LPB16_LPM0_LRVW8_LWPMn1_MIAV0_MIWT1_2_MO40_NTn1_NTA4_NTB2_NTC3_NTD2_NTM0_NEPBS10_NLCA1_NLCB1_ONLL1_PGR2_PLR1_PKA1_SIA3_SS1_SPO0_SRVW0_SSO0_SVW1_SK3_SKXCCM4_TLDS1_ULSGRO0_USL1_UIOFGRO0_USFGRO1_VSn1_VWA1_VWB2_WSGRA0_WSGRB0_WS64_WG16_4_4,0.0,76.28,2428.74
32,128,2880,True,torch.bfloat16,torch.bfloat16,False,256,hipblaslt,388470,0,7.359,Cijk_Alik_Bljk_BBS_BH_Bias_HA_S_SAV_UserArgs_MT16x16x512_MI16x16x1_SN_LDSB0_AFC1_AFEM1_AFEM1_ASEM1_CLR0_CADS0_DTLA0_DTLB0_DTVA0_DTVB0_EPS0_FDSI0_GRPM1_GRVWA8_GRVWB8_GSU0_GSUAMB_GLS0_ISA950_IU1_K1_LBSPPA1024_LBSPPB1024_LBSPPM0_LPA16_LPB16_LPM0_LRVW8_LWPMn1_MIAV1_MIWT1_1_MO40_NTn1_NTA0_NTB0_NTC0_NTD0_NTM0_NEPBS16_NLCA1_NLCB1_ONLL1_PGR2_PLR1_PKA1_SIA3_SS1_SPO0_SRVW0_SSO0_SVW1_SK3_SKXCCM8_TLDS1_ULSGRO0_USL1_UIOFGRO0_USFGRO1_VSn1_VWA1_VWB1_WSGRA0_WSGRB0_WS64_WG16_4_4,0.0,3.21,126.35
32,201088,2880,False,torch.bfloat16,torch.bfloat16,False,256,hipblaslt,387972,0,180.1254,Cijk_Alik_Bljk_BBS_BH_Bias_HA_S_SAV_UserArgs_MT416x32x64_MI16x16x1_SN_LDSB0_AFC1_AFEM1_AFEM1_ASEM1_CLR1_CADS0_DTLA1_DTLB1_DTVA0_DTVB0_EPS0_FDSI0_GRPM1_GRVWA8_GRVWB8_GSU0_GSUAMB_GLS0_ISA950_IU1_K1_LBSPPA1024_LBSPPB1024_LBSPPM0_LPA16_LPB16_LPM0_LRVW8_LWPMn1_MIAV1_MIWT13_1_MO40_NTn1_NTA5_NTB1_NTC1_NTD5_NTM0_NEPBS0_NLCA1_NLCB1_ONLL1_PGR2_PLR1_PKA1_SIA3_SS1_SPO0_SRVW0_SSO0_SVW1_SK3_SKXCCM8_TLDS1_ULSGRO0_USL1_UIOFGRO0_USFGRO0_VSn1_VWA1_VWB1_WSGRA0_WSGRB0_WS64_WG32_8_1,0.0,205.77,6502.81
64,5120,2880,True,torch.bfloat16,torch.bfloat16,False,256,hipblaslt,387856,0,16.0201,Cijk_Alik_Bljk_BBS_BH_Bias_HA_S_SAV_UserArgs_MT64x64x64_MI16x16x1_SN_LDSB0_AFC1_AFEM1_AFEM1_ASEM1_CLR1_CADS0_DTLA1_DTLB1_DTVA0_DTVB0_EPS0_FDSI0_GRPM1_GRVWA2_GRVWB2_GSU0_GSUAMB_GLS0_ISA950_IU1_K1_LBSPPA512_LBSPPB256_LBSPPM0_LPA16_LPB16_LPM0_LRVW8_LWPMn1_MIAV1_MIWT4_1_MO40_NTn1_NTA1_NTB2_NTC4_NTD1_NTM0_NEPBS4_NLCA1_NLCB1_ONLL1_PGR2_PLR1_PKA1_SIA3_SS1_SPO0_SRVW0_SSO0_SVW4_SK3_SKXCCM5_TLDS1_ULSGRO0_USL1_UIOFGRO0_USFGRO0_VSn1_VWA4_VWB1_WSGRA0_WSGRB0_WS64_WG16_16_1,0.0,117.82,1904.81
64,2880,4096,True,torch.bfloat16,torch.bfloat16,False,256,hipblaslt,387733,0,11.9969,Cijk_Alik_Bljk_BBS_BH_Bias_HA_S_SAV_UserArgs_MT48x32x256_MI16x16x1_SN_LDSB0_AFC1_AFEM1_AFEM1_ASEM1_CLR1_CADS0_DTLA1_DTLB1_DTVA0_DTVB0_EPS0_FDSI0_GRPM1_GRVWA8_GRVWB8_GSU0_GSUAMB_GLS0_ISA950_IU1_K1_LBSPPA1024_LBSPPB1024_LBSPPM0_LPA16_LPB16_LPM0_LRVW8_LWPMn1_MIAV0_MIWT3_1_MO40_NTn1_NTA4_NTB3_NTC2_NTD2_NTM0_NEPBS0_NLCA1_NLCB1_ONLL1_PGR2_PLR1_PKA1_SIA3_SS0_SPO1_SRVW0_SSO0_SVW4_SK3_SKXCCM0_TLDS2_ULSGRO0_USL1_UIOFGRO0_USFGRO0_VSn1_VWA1_VWB1_WSGRA0_WSGRB0_WS64_WG16_8_1,0.0,125.86,2041.02
64,128,2880,True,torch.bfloat16,torch.bfloat16,False,256,hipblaslt,388470,0,7.2916,Cijk_Alik_Bljk_BBS_BH_Bias_HA_S_SAV_UserArgs_MT16x16x512_MI16x16x1_SN_LDSB0_AFC1_AFEM1_AFEM1_ASEM1_CLR0_CADS0_DTLA0_DTLB0_DTVA0_DTVB0_EPS0_FDSI0_GRPM1_GRVWA8_GRVWB8_GSU0_GSUAMB_GLS0_ISA950_IU1_K1_LBSPPA1024_LBSPPB1024_LBSPPM0_LPA16_LPB16_LPM0_LRVW8_LWPMn1_MIAV1_MIWT1_1_MO40_NTn1_NTA0_NTB0_NTC0_NTD0_NTM0_NEPBS16_NLCA1_NLCB1_ONLL1_PGR2_PLR1_PKA1_SIA3_SS1_SPO0_SRVW0_SSO0_SVW1_SK3_SKXCCM8_TLDS1_ULSGRO0_USL1_UIOFGRO0_USFGRO1_VSn1_VWA1_VWB1_WSGRA0_WSGRB0_WS64_WG16_4_4,0.0,6.47,153.92
64,201088,2880,False,torch.bfloat16,torch.bfloat16,False,256,hipblaslt,387567,0,187.0728,Cijk_Alik_Bljk_BBS_BH_Bias_HA_S_SAV_UserArgs_MT416x64x64_MI16x16x1_SN_LDSB0_AFC1_AFEM1_AFEM1_ASEM1_CLR0_CADS0_DTLA0_DTLB0_DTVA0_DTVB0_EPS0_FDSI0_GRPM1_GRVWA8_GRVWB8_GSU0_GSUAMB_GLS0_ISA950_IU1_K1_LBSPPA128_LBSPPB256_LBSPPM0_LPA16_LPB16_LPM0_LRVW8_LWPMn1_MIAV0_MIWT13_2_MO40_NTn1_NTA6_NTB2_NTC1_NTD5_NTM0_NEPBS0_NLCA1_NLCB1_ONLL1_PGR2_PLR1_PKA1_SIA3_SS1_SPO0_SRVW0_SSO0_SVW1_SK3_SKXCCM0_TLDS1_ULSGRO0_USL1_UIOFGRO0_USFGRO1_VSn1_VWA1_VWB2_WSGRA0_WSGRB0_WS64_WG32_8_1,0.0,396.26,6331.09
128,5120,2880,True,torch.bfloat16,torch.bfloat16,False,256,hipblaslt,387523,0,17.6706,Cijk_Alik_Bljk_BBS_BH_Bias_HA_S_SAV_UserArgs_MT128x64x64_MI16x16x1_SN_LDSB0_AFC1_AFEM1_AFEM1_ASEM1_CLR1_CADS0_DTLA1_DTLB1_DTVA0_DTVB0_EPS0_FDSI0_GRPM1_GRVWA8_GRVWB2_GSU0_GSUAMB_GLS0_ISA950_IU1_K1_LBSPPA1024_LBSPPB256_LBSPPM0_LPA16_LPB16_LPM0_LRVW8_LWPMn1_MIAV1_MIWT4_2_MO40_NTn1_NTA1_NTB1_NTC6_NTD1_NTM0_NEPBS10_NLCA1_NLCB1_ONLL1_PGR2_PLR1_PKA1_SIA3_SS1_SPO0_SRVW0_SSO0_SVW4_SK3_SKXCCM8_TLDS1_ULSGRO0_USL1_UIOFGRO0_USFGRO1_VSn1_VWA4_VWB2_WSGRA0_WSGRB0_WS64_WG32_8_1,0.0,213.62,1784.84
128,2880,4096,True,torch.bfloat16,torch.bfloat16,False,256,hipblaslt,387457,0,16.0264,Cijk_Alik_Bljk_BBS_BH_Bias_HA_S_SAV_UserArgs_MT48x64x256_MI16x16x1_SN_LDSB0_AFC1_AFEM1_AFEM1_ASEM1_CLR0_CADS0_DTLA0_DTLB0_DTVA0_DTVB0_EPS0_FDSI0_GRPM1_GRVWA8_GRVWB8_GSU0_GSUAMB_GLS0_ISA950_IU1_K1_LBSPPA512_LBSPPB512_LBSPPM0_LPA16_LPB16_LPM0_LRVW8_LWPMn1_MIAV1_MIWT3_1_MO40_NTn1_NTA4_NTB2_NTC3_NTD2_NTM0_NEPBS0_NLCA1_NLCB1_ONLL1_PGR2_PLR1_PKA1_SIA3_SS0_SPO0_SRVW0_SSO0_SVW4_SK3_SKXCCM0_TLDS1_ULSGRO0_USL1_UIOFGRO0_USFGRO0_VSn1_VWA1_VWB1_WSGRA0_WSGRB0_WS64_WG16_16_1,0.0,188.43,1583.56
128,128,2880,True,torch.bfloat16,torch.bfloat16,False,256,hipblaslt,388470,0,7.3779,Cijk_Alik_Bljk_BBS_BH_Bias_HA_S_SAV_UserArgs_MT16x16x512_MI16x16x1_SN_LDSB0_AFC1_AFEM1_AFEM1_ASEM1_CLR0_CADS0_DTLA0_DTLB0_DTVA0_DTVB0_EPS0_FDSI0_GRPM1_GRVWA8_GRVWB8_GSU0_GSUAMB_GLS0_ISA950_IU1_K1_LBSPPA1024_LBSPPB1024_LBSPPM0_LPA16_LPB16_LPM0_LRVW8_LWPMn1_MIAV1_MIWT1_1_MO40_NTn1_NTA0_NTB0_NTC0_NTD0_NTM0_NEPBS16_NLCA1_NLCB1_ONLL1_PGR2_PLR1_PKA1_SIA3_SS1_SPO0_SRVW0_SSO0_SVW1_SK3_SKXCCM8_TLDS1_ULSGRO0_USL1_UIOFGRO0_USFGRO1_VSn1_VWA1_VWB1_WSGRA0_WSGRB0_WS64_WG16_4_4,0.0,12.79,204.3
128,201088,2880,False,torch.bfloat16,torch.bfloat16,False,256,hipblaslt,387906,0,212.1655,Cijk_Alik_Bljk_BBS_BH_Bias_HA_S_SAV_UserArgs_MT448x128x64_MI16x16x1_SN_LDSB0_AFC1_AFEM1_AFEM1_ASEM1_CLR0_CADS0_DTLA0_DTLB0_DTVA0_DTVB0_EPS0_FDSI0_GRPM1_GRVWA8_GRVWB8_GSU0_GSUAMB_GLS0_ISA950_IU1_K1_LBSPPA256_LBSPPB512_LBSPPM0_LPA16_LPB16_LPM0_LRVW8_LWPMn1_MIAV0_MIWT14_4_MO40_NTn1_NTA6_NTB0_NTC0_NTD5_NTM0_NEPBS0_NLCA1_NLCB1_ONLL1_PGR2_PLR1_PKA1_SIA3_SS1_SPO1_SRVW0_SSO0_SVW2_SK3_SKXCCM0_TLDS1_ULSGRO0_USL1_UIOFGRO0_USFGRO0_VSn1_VWA2_VWB4_WSGRA0_WSGRB0_WS64_WG32_8_1,0.0,698.79,5705.37
