aiter/configs/bf16_tuned_gemm.csv
gfx,cu_num,M,N,K,bias,dtype,outdtype,scaleAB,bpreshuffle,libtype,solidx,splitK,us,kernelName,err_ratio,tflops,bw
gfx950,256,16,32,4096,False,torch.bfloat16,torch.bfloat16,False,False,hipblaslt,439841,0,6.0282,Cijk_Alik_Bljk_BBS_BH_Bias_HA_S_SAV_UserArgs_MT16x16x512_MI16x16x1_SN_LDSB0_AFC0_AFEM1_AFEM1_ASEM1_CLR1_CADS0_DTLA1_DTLB1_DTVA0_DTVB0_EPS0_FDSI0_GRPM1_GRVWA8_GRVWB8_GSU0_GSUAMB_GLS0_ISA950_IU1_K1_LDSTI0_LBSPPA1024_LBSPPB1024_LBSPPM0_LPA16_LPB16_LPM0_LRVW8_LWPMn1_MIAV0_MIWT1_1_MO40_NTn1_NTA6_NTB1_NTC3_NTD0_NTM0_NEPBS14_NLCA1_NLCB1_ONLL1_PGR2_PLR1_PKA1_SIA3_SS1_SPO1_SRVW0_SSO0_SVW1_SK3_SKFTR0_SKXCCM0_TLDS1_ULSGRO0_USL1_UIOFGRO0_USFGRO1_VSn1_VWA1_VWB1_WSGRA0_WSGRB0_WS64_WG16_4_4,0.0,0.7,65.4
gfx950,256,16,4096,256,False,torch.bfloat16,torch.bfloat16,False,False,flydsl,820,1,3.5575,flydsl_gemm3_abf16_wbf16_bf16_t16x64x64_split_k1_block_m_warp1_block_n_warp1_block_k_warp1_async_copyTrue_b_to_ldsTrue_b_preshuffleFalse_c_to_ldsFalse_gfx950,0.0,9.43,628.65
gfx950,256,16,4608,4096,False,torch.bfloat16,torch.bfloat16,False,False,flydsl,2449,2,11.3005,flydsl_gemm4_abf16_wbf16_bf16_t16x64x128_split_k2_block_m_warp1_block_n_warp2_block_k_warp1_async_copyTrue_b_to_ldsTrue_b_preshuffleFalse_c_to_ldsFalse_gfx950,0.005,53.45,3365.1
gfx950,256,16,5120,4096,False,torch.bfloat16,torch.bfloat16,False,False,flydsl,4264,2,11.899,flydsl_gemm8_abf16_wbf16_bf16_t16x64x64_split_k2_block_m_warp1_block_n_warp1_block_k_warp2_async_copyTrue_b_to_ldsTrue_b_preshuffleFalse_c_to_ldsFalse_gfx950,0.013,56.4,3549.71
gfx950,256,1,512,4096,False,torch.bfloat16,torch.bfloat16,False,False,skinny,2,0,3.8322,sol2,0.0,1.09,1096.89
gfx950,256,2,512,4096,False,torch.bfloat16,torch.bfloat16,False,False,flydsl,3659,8,5.4775,flydsl_gemm6_abf16_wbf16_bf16_t16x64x64_split_k8_block_m_warp1_block_n_warp2_block_k_warp1_async_copyTrue_b_to_ldsTrue_b_preshuffleFalse_c_to_ldsFalse_gfx950,0.0146,1.53,769.1
gfx950,256,4,512,4096,False,torch.bfloat16,torch.bfloat16,False,False,flydsl,4023,8,5.5093,flydsl_gemm7_abf16_wbf16_bf16_t16x64x64_split_k8_block_m_warp1_block_n_warp2_block_k_warp1_async_copyTrue_b_to_ldsTrue_b_preshuffleFalse_c_to_ldsFalse_gfx950,0.0205,3.05,768.0
gfx950,256,8,512,4096,False,torch.bfloat16,torch.bfloat16,False,False,flydsl,3659,8,5.5692,flydsl_gemm6_abf16_wbf16_bf16_t16x64x64_split_k8_block_m_warp1_block_n_warp2_block_k_warp1_async_copyTrue_b_to_ldsTrue_b_preshuffleFalse_c_to_ldsFalse_gfx950,0.0212,6.03,766.36
gfx950,256,12,512,4096,False,torch.bfloat16,torch.bfloat16,False,False,flydsl,4271,8,5.6551,flydsl_gemm8_abf16_wbf16_bf16_t16x64x64_split_k8_block_m_warp1_block_n_warp2_block_k_warp1_async_copyTrue_b_to_ldsTrue_b_preshuffleFalse_c_to_ldsFalse_gfx950,0.02,8.9,761.24
gfx950,256,16,512,4096,False,torch.bfloat16,torch.bfloat16,False,False,flydsl,3659,8,5.7514,flydsl_gemm6_abf16_wbf16_bf16_t16x64x64_split_k8_block_m_warp1_block_n_warp2_block_k_warp1_async_copyTrue_b_to_ldsTrue_b_preshuffleFalse_c_to_ldsFalse_gfx950,0.0208,11.67,754.9
gfx950,256,32,512,4096,False,torch.bfloat16,torch.bfloat16,False,False,flydsl,4021,8,6.2463,flydsl_gemm7_abf16_wbf16_bf16_t16x64x64_split_k8_block_m_warp1_block_n_warp1_block_k_warp1_async_copyTrue_b_to_ldsTrue_b_preshuffleFalse_c_to_ldsFalse_gfx950,0.0187,21.49,718.7
gfx950,256,1,1024,4096,False,torch.bfloat16,torch.bfloat16,False,False,flydsl,4023,8,6.2088,flydsl_gemm7_abf16_wbf16_bf16_t16x64x64_split_k8_block_m_warp1_block_n_warp2_block_k_warp1_async_copyTrue_b_to_ldsTrue_b_preshuffleFalse_c_to_ldsFalse_gfx950,0.0303,1.35,1352.73
gfx950,256,2,1024,4096,False,torch.bfloat16,torch.bfloat16,False,False,flydsl,4023,8,6.1878,flydsl_gemm7_abf16_wbf16_bf16_t16x64x64_split_k8_block_m_warp1_block_n_warp2_block_k_warp1_async_copyTrue_b_to_ldsTrue_b_preshuffleFalse_c_to_ldsFalse_gfx950,0.02,2.71,1358.98
gfx950,256,4,1024,4096,False,torch.bfloat16,torch.bfloat16,False,False,flydsl,4269,8,6.2987,flydsl_gemm8_abf16_wbf16_bf16_t16x64x64_split_k8_block_m_warp1_block_n_warp1_block_k_warp1_async_copyTrue_b_to_ldsTrue_b_preshuffleFalse_c_to_ldsFalse_gfx950,0.0183,5.33,1338.3
gfx950,256,8,1024,4096,False,torch.bfloat16,torch.bfloat16,False,False,flydsl,3659,8,6.5299,flydsl_gemm6_abf16_wbf16_bf16_t16x64x64_split_k8_block_m_warp1_block_n_warp2_block_k_warp1_async_copyTrue_b_to_ldsTrue_b_preshuffleFalse_c_to_ldsFalse_gfx950,0.0183,10.28,1297.19
gfx950,256,12,1024,4096,False,torch.bfloat16,torch.bfloat16,False,False,flydsl,3659,8,6.4379,flydsl_gemm6_abf16_wbf16_bf16_t16x64x64_split_k8_block_m_warp1_block_n_warp2_block_k_warp1_async_copyTrue_b_to_ldsTrue_b_preshuffleFalse_c_to_ldsFalse_gfx950,0.0201,15.64,1322.09
gfx950,256,16,1024,4096,False,torch.bfloat16,torch.bfloat16,False,False,flydsl,4271,8,6.5211,flydsl_gemm8_abf16_wbf16_bf16_t16x64x64_split_k8_block_m_warp1_block_n_warp2_block_k_warp1_async_copyTrue_b_to_ldsTrue_b_preshuffleFalse_c_to_ldsFalse_gfx950,0.0201,20.58,1311.5
gfx950,256,32,1024,4096,False,torch.bfloat16,torch.bfloat16,False,False,flydsl,3164,4,7.3639,flydsl_gemm5_abf16_wbf16_bf16_t16x64x128_split_k4_block_m_warp1_block_n_warp2_block_k_warp1_async_copyTrue_b_to_ldsTrue_b_preshuffleFalse_c_to_ldsFalse_gfx950,0.0116,36.45,1183.65
gfx950,256,1,4096,512,False,torch.bfloat16,torch.bfloat16,False,False,flydsl,3484,1,4.2815,flydsl_gemm7_abf16_wbf16_bf16_t16x64x64_split_k1_block_m_warp1_block_n_warp2_block_k_warp1_async_copyTrue_b_to_ldsTrue_b_preshuffleFalse_c_to_ldsFalse_gfx950,0.0,0.98,981.79
gfx950,256,1,4096,4096,False,torch.bfloat16,torch.bfloat16,False,False,flydsl,1484,4,9.4538,flydsl_gemm3_abf16_wbf16_bf16_t16x64x128_split_k4_block_m_warp1_block_n_warp2_block_k_warp1_async_copyTrue_b_to_ldsTrue_b_preshuffleFalse_c_to_ldsFalse_gfx950,0.0142,3.55,3551.04
gfx950,256,2,4096,512,False,torch.bfloat16,torch.bfloat16,False,False,flydsl,3484,1,4.2719,flydsl_gemm7_abf16_wbf16_bf16_t16x64x64_split_k1_block_m_warp1_block_n_warp2_block_k_warp1_async_copyTrue_b_to_ldsTrue_b_preshuffleFalse_c_to_ldsFalse_gfx950,0.0,1.96,986.15
gfx950,256,2,4096,4096,False,torch.bfloat16,torch.bfloat16,False,False,flydsl,4268,4,9.5102,flydsl_gemm8_abf16_wbf16_bf16_t16x64x64_split_k4_block_m_warp1_block_n_warp2_block_k_warp1_async_copyTrue_b_to_ldsTrue_b_preshuffleFalse_c_to_ldsFalse_gfx950,0.012,7.06,3531.7
gfx950,256,4,4096,512,False,torch.bfloat16,torch.bfloat16,False,False,flydsl,3729,1,4.3086,flydsl_gemm8_abf16_wbf16_bf16_t16x64x64_split_k1_block_m_warp1_block_n_warp2_block_k_warp1_async_copyTrue_b_to_ldsTrue_b_preshuffleFalse_c_to_ldsFalse_gfx950,0.0,3.89,982.03
gfx950,256,4,4096,4096,False,torch.bfloat16,torch.bfloat16,False,False,flydsl,4268,4,9.7657,flydsl_gemm8_abf16_wbf16_bf16_t16x64x64_split_k4_block_m_warp1_block_n_warp2_block_k_warp1_async_copyTrue_b_to_ldsTrue_b_preshuffleFalse_c_to_ldsFalse_gfx950,0.0131,13.74,3442.66
gfx950,256,8,4096,512,False,torch.bfloat16,torch.bfloat16,False,False,flydsl,3132,1,4.3328,flydsl_gemm6_abf16_wbf16_bf16_t16x64x64_split_k1_block_m_warp1_block_n_warp2_block_k_warp1_async_copyTrue_b_to_ldsTrue_b_preshuffleFalse_c_to_ldsFalse_gfx950,0.0,7.74,985.05
gfx950,256,8,4096,4096,False,torch.bfloat16,torch.bfloat16,False,False,flydsl,4268,4,10.0332,flydsl_gemm8_abf16_wbf16_bf16_t16x64x64_split_k4_block_m_warp1_block_n_warp2_block_k_warp1_async_copyTrue_b_to_ldsTrue_b_preshuffleFalse_c_to_ldsFalse_gfx950,0.0123,26.75,3357.4
gfx950,256,12,4096,512,False,torch.bfloat16,torch.bfloat16,False,False,flydsl,3132,1,4.4242,flydsl_gemm6_abf16_wbf16_bf16_t16x64x64_split_k1_block_m_warp1_block_n_warp2_block_k_warp1_async_copyTrue_b_to_ldsTrue_b_preshuffleFalse_c_to_ldsFalse_gfx950,0.0,11.38,973.03
gfx950,256,12,4096,4096,False,torch.bfloat16,torch.bfloat16,False,False,flydsl,3644,4,10.2634,flydsl_gemm6_abf16_wbf16_bf16_t16x64x128_split_k4_block_m_warp1_block_n_warp2_block_k_warp1_async_copyTrue_b_to_ldsTrue_b_preshuffleFalse_c_to_ldsFalse_gfx950,0.0117,39.23,3288.49
gfx950,256,16,4096,512,False,torch.bfloat16,torch.bfloat16,False,False,triton,0,0,4.2758,auto,0.0,15.7,1015.43
gfx950,256,16,4096,4096,False,torch.bfloat16,torch.bfloat16,False,False,flydsl,3164,4,10.8362,flydsl_gemm5_abf16_wbf16_bf16_t16x64x128_split_k4_block_m_warp1_block_n_warp2_block_k_warp1_async_copyTrue_b_to_ldsTrue_b_preshuffleFalse_c_to_ldsFalse_gfx950,0.0122,49.54,3120.7
gfx950,256,32,4096,512,False,torch.bfloat16,torch.bfloat16,False,False,flydsl,3484,1,4.4651,flydsl_gemm7_abf16_wbf16_bf16_t16x64x64_split_k1_block_m_warp1_block_n_warp2_block_k_warp1_async_copyTrue_b_to_ldsTrue_b_preshuffleFalse_c_to_ldsFalse_gfx950,0.0,30.06,1005.4
gfx950,256,32,4096,4096,False,torch.bfloat16,torch.bfloat16,False,False,flydsl,4004,2,11.7218,flydsl_gemm7_abf16_wbf16_bf16_t16x64x128_split_k2_block_m_warp1_block_n_warp1_block_k_warp2_async_copyTrue_b_to_ldsTrue_b_preshuffleFalse_c_to_ldsFalse_gfx950,0.0123,91.6,2907.29
gfx950,256,1,8704,4096,False,torch.bfloat16,torch.bfloat16,False,False,flydsl,2445,1,15.6418,flydsl_gemm4_abf16_wbf16_bf16_t16x64x128_split_k1_block_m_warp1_block_n_warp1_block_k_warp2_async_copyTrue_b_to_ldsTrue_b_preshuffleFalse_c_to_ldsFalse_gfx950,0.0051,4.56,4560.14
gfx950,256,2,8704,4096,False,torch.bfloat16,torch.bfloat16,False,False,flydsl,2446,1,15.6961,flydsl_gemm4_abf16_wbf16_bf16_t16x64x128_split_k1_block_m_warp1_block_n_warp2_block_k_warp1_async_copyTrue_b_to_ldsTrue_b_preshuffleFalse_c_to_ldsFalse_gfx950,0.0,9.09,4545.99
gfx950,256,4,8704,4096,False,torch.bfloat16,torch.bfloat16,False,False,flydsl,2446,1,15.677,flydsl_gemm4_abf16_wbf16_bf16_t16x64x128_split_k1_block_m_warp1_block_n_warp2_block_k_warp1_async_copyTrue_b_to_ldsTrue_b_preshuffleFalse_c_to_ldsFalse_gfx950,0.0,18.19,4554.8
gfx950,256,8,8704,4096,False,torch.bfloat16,torch.bfloat16,False,False,flydsl,4262,1,15.7823,flydsl_gemm8_abf16_wbf16_bf16_t16x64x64_split_k1_block_m_warp1_block_n_warp2_block_k_warp1_async_copyTrue_b_to_ldsTrue_b_preshuffleFalse_c_to_ldsFalse_gfx950,0.0,36.14,4530.9
gfx950,256,12,8704,4096,False,torch.bfloat16,torch.bfloat16,False,False,flydsl,4262,1,16.087,flydsl_gemm8_abf16_wbf16_bf16_t16x64x64_split_k1_block_m_warp1_block_n_warp2_block_k_warp1_async_copyTrue_b_to_ldsTrue_b_preshuffleFalse_c_to_ldsFalse_gfx950,0.0,53.19,4451.44
gfx950,256,16,8704,4096,False,torch.bfloat16,torch.bfloat16,False,False,flydsl,2446,1,16.3646,flydsl_gemm4_abf16_wbf16_bf16_t16x64x128_split_k1_block_m_warp1_block_n_warp2_block_k_warp1_async_copyTrue_b_to_ldsTrue_b_preshuffleFalse_c_to_ldsFalse_gfx950,0.0,69.71,4382.19
gfx950,256,32,8704,4096,False,torch.bfloat16,torch.bfloat16,False,False,flydsl,2446,1,16.5579,flydsl_gemm4_abf16_wbf16_bf16_t16x64x128_split_k1_block_m_warp1_block_n_warp2_block_k_warp1_async_copyTrue_b_to_ldsTrue_b_preshuffleFalse_c_to_ldsFalse_gfx950,0.0,137.8,4355.77
gfx950,256,1,10240,4096,False,torch.bfloat16,torch.bfloat16,False,False,flydsl,4249,1,17.2195,flydsl_gemm8_abf16_wbf16_bf16_t16x64x128_split_k1_block_m_warp1_block_n_warp1_block_k_warp2_async_copyTrue_b_to_ldsTrue_b_preshuffleFalse_c_to_ldsFalse_gfx950,0.0049,4.87,4873.24
gfx950,256,2,10240,4096,False,torch.bfloat16,torch.bfloat16,False,False,flydsl,4262,1,16.9602,flydsl_gemm8_abf16_wbf16_bf16_t16x64x64_split_k1_block_m_warp1_block_n_warp2_block_k_warp1_async_copyTrue_b_to_ldsTrue_b_preshuffleFalse_c_to_ldsFalse_gfx950,0.0,9.89,4949.44
gfx950,256,4,10240,4096,False,torch.bfloat16,torch.bfloat16,False,False,flydsl,4262,1,17.5029,flydsl_gemm8_abf16_wbf16_bf16_t16x64x64_split_k1_block_m_warp1_block_n_warp2_block_k_warp1_async_copyTrue_b_to_ldsTrue_b_preshuffleFalse_c_to_ldsFalse_gfx950,0.0,19.17,4799.25
gfx950,256,8,10240,4096,False,torch.bfloat16,torch.bfloat16,False,False,flydsl,2445,1,17.5784,flydsl_gemm4_abf16_wbf16_bf16_t16x64x128_split_k1_block_m_warp1_block_n_warp1_block_k_warp2_async_copyTrue_b_to_ldsTrue_b_preshuffleFalse_c_to_ldsFalse_gfx950,0.0044,38.18,4785.16
gfx950,256,12,10240,4096,False,torch.bfloat16,torch.bfloat16,False,False,flydsl,4261,1,17.5929,flydsl_gemm8_abf16_wbf16_bf16_t16x64x64_split_k1_block_m_warp1_block_n_warp1_block_k_warp2_async_copyTrue_b_to_ldsTrue_b_preshuffleFalse_c_to_ldsFalse_gfx950,0.0049,57.22,4787.74
gfx950,256,16,10240,4096,False,torch.bfloat16,torch.bfloat16,False,False,flydsl,2457,1,17.8501,flydsl_gemm4_abf16_wbf16_bf16_t16x64x256_split_k1_block_m_warp1_block_n_warp1_block_k_warp2_async_copyTrue_b_to_ldsTrue_b_preshuffleFalse_c_to_ldsFalse_gfx950,0.0049,75.19,4725.17
gfx950,256,32,10240,4096,False,torch.bfloat16,torch.bfloat16,False,False,flydsl,2446,1,18.0907,flydsl_gemm4_abf16_wbf16_bf16_t16x64x128_split_k1_block_m_warp1_block_n_warp2_block_k_warp1_async_copyTrue_b_to_ldsTrue_b_preshuffleFalse_c_to_ldsFalse_gfx950,0.0,148.38,4687.69
gfx950,256,1,256,4096,False,torch.bfloat16,torch.bfloat16,False,False,skinny,2,0,3.4412,sol2,0.0,0.61,611.95
gfx950,256,2,256,4096,False,torch.bfloat16,torch.bfloat16,False,False,skinny,2,0,3.9675,sol2,0.0,1.06,532.97
gfx950,256,4,256,4096,False,torch.bfloat16,torch.bfloat16,False,False,flydsl,3659,8,4.544,flydsl_gemm6_abf16_wbf16_bf16_t16x64x64_split_k8_block_m_warp1_block_n_warp2_block_k_warp1_async_copyTrue_b_to_ldsTrue_b_preshuffleFalse_c_to_ldsFalse_gfx950,0.0156,1.85,469.18
gfx950,256,8,256,4096,False,torch.bfloat16,torch.bfloat16,False,False,flydsl,4023,8,4.5738,flydsl_gemm7_abf16_wbf16_bf16_t16x64x64_split_k8_block_m_warp1_block_n_warp2_block_k_warp1_async_copyTrue_b_to_ldsTrue_b_preshuffleFalse_c_to_ldsFalse_gfx950,0.0176,3.67,473.74
gfx950,256,12,256,4096,False,torch.bfloat16,torch.bfloat16,False,False,flydsl,4023,8,4.7034,flydsl_gemm7_abf16_wbf16_bf16_t16x64x64_split_k8_block_m_warp1_block_n_warp2_block_k_warp1_async_copyTrue_b_to_ldsTrue_b_preshuffleFalse_c_to_ldsFalse_gfx950,0.0202,5.35,468.09
gfx950,256,16,256,4096,False,torch.bfloat16,torch.bfloat16,False,False,flydsl,3659,8,4.7894,flydsl_gemm6_abf16_wbf16_bf16_t16x64x64_split_k8_block_m_warp1_block_n_warp2_block_k_warp1_async_copyTrue_b_to_ldsTrue_b_preshuffleFalse_c_to_ldsFalse_gfx950,0.0227,7.01,466.95
gfx950,256,32,256,4096,False,torch.bfloat16,torch.bfloat16,False,False,flydsl,4023,8,5.3195,flydsl_gemm7_abf16_wbf16_bf16_t16x64x64_split_k8_block_m_warp1_block_n_warp2_block_k_warp1_async_copyTrue_b_to_ldsTrue_b_preshuffleFalse_c_to_ldsFalse_gfx950,0.0206,12.62,446.6
gfx950,256,1,2560,4096,False,torch.bfloat16,torch.bfloat16,False,False,flydsl,2452,4,7.2861,flydsl_gemm4_abf16_wbf16_bf16_t16x64x128_split_k4_block_m_warp1_block_n_warp2_block_k_warp1_async_copyTrue_b_to_ldsTrue_b_preshuffleFalse_c_to_ldsFalse_gfx950,0.0164,2.88,2880.12
gfx950,256,2,2560,4096,False,torch.bfloat16,torch.bfloat16,False,False,flydsl,4268,4,7.2465,flydsl_gemm8_abf16_wbf16_bf16_t16x64x64_split_k4_block_m_warp1_block_n_warp2_block_k_warp1_async_copyTrue_b_to_ldsTrue_b_preshuffleFalse_c_to_ldsFalse_gfx950,0.0145,5.79,2897.69
gfx950,256,4,2560,4096,False,torch.bfloat16,torch.bfloat16,False,False,flydsl,3164,4,7.4274,flydsl_gemm5_abf16_wbf16_bf16_t16x64x128_split_k4_block_m_warp1_block_n_warp2_block_k_warp1_async_copyTrue_b_to_ldsTrue_b_preshuffleFalse_c_to_ldsFalse_gfx950,0.0133,11.29,2830.7
gfx950,256,8,2560,4096,False,torch.bfloat16,torch.bfloat16,False,False,flydsl,4268,4,7.6636,flydsl_gemm8_abf16_wbf16_bf16_t16x64x64_split_k4_block_m_warp1_block_n_warp2_block_k_warp1_async_copyTrue_b_to_ldsTrue_b_preshuffleFalse_c_to_ldsFalse_gfx950,0.0123,21.89,2750.41
gfx950,256,12,2560,4096,False,torch.bfloat16,torch.bfloat16,False,False,flydsl,3164,4,8.0344,flydsl_gemm5_abf16_wbf16_bf16_t16x64x128_split_k4_block_m_warp1_block_n_warp2_block_k_warp1_async_copyTrue_b_to_ldsTrue_b_preshuffleFalse_c_to_ldsFalse_gfx950,0.012,31.32,2630.1
gfx950,256,16,2560,4096,False,torch.bfloat16,torch.bfloat16,False,False,flydsl,3164,4,8.2596,flydsl_gemm5_abf16_wbf16_bf16_t16x64x128_split_k4_block_m_warp1_block_n_warp2_block_k_warp1_async_copyTrue_b_to_ldsTrue_b_preshuffleFalse_c_to_ldsFalse_gfx950,0.0123,40.62,2564.84
gfx950,256,32,2560,4096,False,torch.bfloat16,torch.bfloat16,False,False,flydsl,2632,4,9.5996,flydsl_gemm4_abf16_wbf16_bf16_t32x64x128_split_k4_block_m_warp2_block_n_warp1_block_k_warp1_async_copyTrue_b_to_ldsTrue_b_preshuffleFalse_c_to_ldsFalse_gfx950,0.0118,69.91,2229.0
gfx950,256,1,4096,128,False,torch.bfloat16,torch.bfloat16,False,False,flydsl,27,1,3.0558,flydsl_gemm2_abf16_wbf16_bf16_t16x64x64_split_k1_block_m_warp1_block_n_warp1_block_k_warp1_async_copyTrue_b_to_ldsTrue_b_preshuffleFalse_c_to_ldsFalse_gfx950,0.0,0.34,345.91
gfx950,256,1,4096,1024,False,torch.bfloat16,torch.bfloat16,False,False,flydsl,4183,1,5.5819,flydsl_gemm8_abf16_wbf16_bf16_t16x64x64_split_k1_block_m_warp1_block_n_warp2_block_k_warp1_async_copyTrue_b_to_ldsTrue_b_preshuffleFalse_c_to_ldsFalse_gfx950,0.0,1.5,1504.66
gfx950,256,2,4096,128,False,torch.bfloat16,torch.bfloat16,False,False,flydsl,29,1,3.122,flydsl_gemm2_abf16_wbf16_bf16_t16x64x64_split_k1_block_m_warp1_block_n_warp2_block_k_warp1_async_copyTrue_b_to_ldsTrue_b_preshuffleFalse_c_to_ldsFalse_gfx950,0.0,0.67,341.28
gfx950,256,2,4096,1024,False,torch.bfloat16,torch.bfloat16,False,False,flydsl,3938,2,5.5071,flydsl_gemm7_abf16_wbf16_bf16_t16x64x64_split_k2_block_m_warp1_block_n_warp2_block_k_warp1_async_copyTrue_b_to_ldsTrue_b_preshuffleFalse_c_to_ldsFalse_gfx950,0.0017,3.05,1526.95
gfx950,256,4,4096,128,False,torch.bfloat16,torch.bfloat16,False,False,flydsl,27,1,3.0666,flydsl_gemm2_abf16_wbf16_bf16_t16x64x64_split_k1_block_m_warp1_block_n_warp1_block_k_warp1_async_copyTrue_b_to_ldsTrue_b_preshuffleFalse_c_to_ldsFalse_gfx950,0.0,1.37,352.95
gfx950,256,4,4096,1024,False,torch.bfloat16,torch.bfloat16,False,False,flydsl,4186,2,5.6229,flydsl_gemm8_abf16_wbf16_bf16_t16x64x64_split_k2_block_m_warp1_block_n_warp2_block_k_warp1_async_copyTrue_b_to_ldsTrue_b_preshuffleFalse_c_to_ldsFalse_gfx950,0.0024,5.97,1499.15
gfx950,256,8,4096,128,False,torch.bfloat16,torch.bfloat16,False,False,flydsl,29,1,3.0803,flydsl_gemm2_abf16_wbf16_bf16_t16x64x64_split_k1_block_m_warp1_block_n_warp2_block_k_warp1_async_copyTrue_b_to_ldsTrue_b_preshuffleFalse_c_to_ldsFalse_gfx950,0.0,2.72,362.35
gfx950,256,8,4096,1024,False,torch.bfloat16,torch.bfloat16,False,False,flydsl,4183,1,5.789,flydsl_gemm8_abf16_wbf16_bf16_t16x64x64_split_k1_block_m_warp1_block_n_warp2_block_k_warp1_async_copyTrue_b_to_ldsTrue_b_preshuffleFalse_c_to_ldsFalse_gfx950,0.0,11.59,1463.21
gfx950,256,12,4096,128,False,torch.bfloat16,torch.bfloat16,False,False,flydsl,29,1,3.0899,flydsl_gemm2_abf16_wbf16_bf16_t16x64x64_split_k1_block_m_warp1_block_n_warp2_block_k_warp1_async_copyTrue_b_to_ldsTrue_b_preshuffleFalse_c_to_ldsFalse_gfx950,0.0,4.07,372.16
gfx950,256,12,4096,1024,False,torch.bfloat16,torch.bfloat16,False,False,flydsl,3079,1,5.8831,flydsl_gemm5_abf16_wbf16_bf16_t16x64x128_split_k1_block_m_warp1_block_n_warp2_block_k_warp1_async_copyTrue_b_to_ldsTrue_b_preshuffleFalse_c_to_ldsFalse_gfx950,0.0,17.11,1446.77
gfx950,256,16,4096,128,False,torch.bfloat16,torch.bfloat16,False,False,flydsl,29,1,3.0887,flydsl_gemm2_abf16_wbf16_bf16_t16x64x64_split_k1_block_m_warp1_block_n_warp2_block_k_warp1_async_copyTrue_b_to_ldsTrue_b_preshuffleFalse_c_to_ldsFalse_gfx950,0.0,5.43,383.25
gfx950,256,16,4096,1024,False,torch.bfloat16,torch.bfloat16,False,False,torch,0,0,6.0278,native,0.0,22.27,1418.83
gfx950,256,32,4096,128,False,torch.bfloat16,torch.bfloat16,False,False,flydsl,111,1,3.1966,flydsl_gemm2_abf16_wbf16_bf16_t32x64x64_split_k1_block_m_warp1_block_n_warp4_block_k_warp1_async_copyTrue_b_to_ldsTrue_b_preshuffleFalse_c_to_ldsFalse_gfx950,0.0,10.5,412.6
gfx950,256,32,4096,1024,False,torch.bfloat16,torch.bfloat16,False,False,flydsl,3079,1,5.9938,flydsl_gemm5_abf16_wbf16_bf16_t16x64x128_split_k1_block_m_warp1_block_n_warp2_block_k_warp1_async_copyTrue_b_to_ldsTrue_b_preshuffleFalse_c_to_ldsFalse_gfx950,0.0,44.79,1454.22
