aiter/configs/bf16_tuned_gemm.csv
gfx,cu_num,M,N,K,bias,dtype,outdtype,scaleAB,bpreshuffle,libtype,solidx,splitK,us,kernelName,err_ratio,tflops,bw
gfx1250,256,1,128,2880,True,torch.bfloat16,torch.bfloat16,False,False,triton,0,0,0.0,auto,0.0,0.0,0.0
gfx1250,256,2,128,2880,True,torch.bfloat16,torch.bfloat16,False,False,triton,0,0,0.0,auto,0.0,0.0,0.0
gfx1250,256,4,128,2880,True,torch.bfloat16,torch.bfloat16,False,False,triton,0,0,0.0,auto,0.0,0.0,0.0
gfx1250,256,8,128,2880,True,torch.bfloat16,torch.bfloat16,False,False,triton,0,0,0.0,auto,0.0,0.0,0.0
gfx1250,256,16,128,2880,True,torch.bfloat16,torch.bfloat16,False,False,triton,0,0,0.0,auto,0.0,0.0,0.0
gfx1250,256,32,128,2880,True,torch.bfloat16,torch.bfloat16,False,False,triton,0,0,0.0,auto,0.0,0.0,0.0
gfx1250,256,48,128,2880,True,torch.bfloat16,torch.bfloat16,False,False,triton,0,0,0.0,auto,0.0,0.0,0.0
gfx1250,256,64,128,2880,True,torch.bfloat16,torch.bfloat16,False,False,triton,0,0,0.0,auto,0.0,0.0,0.0
gfx1250,256,128,128,2880,True,torch.bfloat16,torch.bfloat16,False,False,triton,0,0,0.0,auto,0.0,0.0,0.0
gfx1250,256,256,128,2880,True,torch.bfloat16,torch.bfloat16,False,False,triton,0,0,0.0,auto,0.0,0.0,0.0
gfx1250,256,512,128,2880,True,torch.bfloat16,torch.bfloat16,False,False,triton,0,0,0.0,auto,0.0,0.0,0.0
gfx1250,256,1024,128,2880,True,torch.bfloat16,torch.bfloat16,False,False,triton,0,0,0.0,auto,0.0,0.0,0.0
gfx1250,256,2048,128,2880,True,torch.bfloat16,torch.bfloat16,False,False,triton,0,0,0.0,auto,0.0,0.0,0.0
gfx1250,256,4096,128,2880,True,torch.bfloat16,torch.bfloat16,False,False,triton,0,0,0.0,auto,0.0,0.0,0.0
gfx1250,256,8192,128,2880,True,torch.bfloat16,torch.bfloat16,False,False,triton,0,0,0.0,auto,0.0,0.0,0.0
gfx1250,256,16384,128,2880,True,torch.bfloat16,torch.bfloat16,False,False,triton,0,0,0.0,auto,0.0,0.0,0.0
gfx1250,256,1,256,7168,False,torch.bfloat16,torch.bfloat16,False,False,triton,0,0,0.0,auto,0.0,0.0,0.0
gfx1250,256,2,256,7168,False,torch.bfloat16,torch.bfloat16,False,False,triton,0,0,0.0,auto,0.0,0.0,0.0
gfx1250,256,4,256,7168,False,torch.bfloat16,torch.bfloat16,False,False,triton,0,0,0.0,auto,0.0,0.0,0.0
gfx1250,256,8,256,7168,False,torch.bfloat16,torch.bfloat16,False,False,triton,0,0,0.0,auto,0.0,0.0,0.0
gfx1250,256,16,256,7168,False,torch.bfloat16,torch.bfloat16,False,False,triton,0,0,0.0,auto,0.0,0.0,0.0
gfx1250,256,32,256,7168,False,torch.bfloat16,torch.bfloat16,False,False,triton,0,0,0.0,auto,0.0,0.0,0.0
gfx1250,256,48,256,7168,False,torch.bfloat16,torch.bfloat16,False,False,triton,0,0,0.0,auto,0.0,0.0,0.0
gfx1250,256,64,256,7168,False,torch.bfloat16,torch.bfloat16,False,False,triton,0,0,0.0,auto,0.0,0.0,0.0
gfx1250,256,80,256,7168,False,torch.bfloat16,torch.bfloat16,False,False,triton,0,0,0.0,auto,0.0,0.0,0.0
gfx1250,256,96,256,7168,False,torch.bfloat16,torch.bfloat16,False,False,triton,0,0,0.0,auto,0.0,0.0,0.0
gfx1250,256,112,256,7168,False,torch.bfloat16,torch.bfloat16,False,False,triton,0,0,0.0,auto,0.0,0.0,0.0
gfx1250,256,128,256,7168,False,torch.bfloat16,torch.bfloat16,False,False,triton,0,0,0.0,auto,0.0,0.0,0.0
gfx1250,256,256,256,7168,False,torch.bfloat16,torch.bfloat16,False,False,triton,0,0,0.0,auto,0.0,0.0,0.0
gfx1250,256,512,256,7168,False,torch.bfloat16,torch.bfloat16,False,False,triton,0,0,0.0,auto,0.0,0.0,0.0
gfx1250,256,1024,256,7168,False,torch.bfloat16,torch.bfloat16,False,False,triton,0,0,0.0,auto,0.0,0.0,0.0
gfx1250,256,2048,256,7168,False,torch.bfloat16,torch.bfloat16,False,False,triton,0,0,0.0,auto,0.0,0.0,0.0
gfx1250,256,4096,256,7168,False,torch.bfloat16,torch.bfloat16,False,False,triton,0,0,0.0,auto,0.0,0.0,0.0
gfx1250,256,8192,256,7168,False,torch.bfloat16,torch.bfloat16,False,False,triton,0,0,0.0,auto,0.0,0.0,0.0
gfx1250,256,16384,256,7168,False,torch.bfloat16,torch.bfloat16,False,False,triton,0,0,0.0,auto,0.0,0.0,0.0
gfx1250,256,1,2112,7168,False,torch.bfloat16,torch.bfloat16,False,False,triton,0,0,0.0,auto,0.0,0.0,0.0
gfx1250,256,2,2112,7168,False,torch.bfloat16,torch.bfloat16,False,False,triton,0,0,0.0,auto,0.0,0.0,0.0
gfx1250,256,4,2112,7168,False,torch.bfloat16,torch.bfloat16,False,False,triton,0,0,0.0,auto,0.0,0.0,0.0
gfx1250,256,8,2112,7168,False,torch.bfloat16,torch.bfloat16,False,False,triton,0,0,0.0,auto,0.0,0.0,0.0
gfx1250,256,16,2112,7168,False,torch.bfloat16,torch.bfloat16,False,False,triton,0,0,0.0,auto,0.0,0.0,0.0
gfx1250,256,32,2112,7168,False,torch.bfloat16,torch.bfloat16,False,False,triton,0,0,0.0,auto,0.0,0.0,0.0
gfx1250,256,48,2112,7168,False,torch.bfloat16,torch.bfloat16,False,False,triton,0,0,0.0,auto,0.0,0.0,0.0
gfx1250,256,64,2112,7168,False,torch.bfloat16,torch.bfloat16,False,False,triton,0,0,0.0,auto,0.0,0.0,0.0
gfx1250,256,80,2112,7168,False,torch.bfloat16,torch.bfloat16,False,False,triton,0,0,0.0,auto,0.0,0.0,0.0
gfx1250,256,96,2112,7168,False,torch.bfloat16,torch.bfloat16,False,False,triton,0,0,0.0,auto,0.0,0.0,0.0
gfx1250,256,112,2112,7168,False,torch.bfloat16,torch.bfloat16,False,False,triton,0,0,0.0,auto,0.0,0.0,0.0
gfx1250,256,128,2112,7168,False,torch.bfloat16,torch.bfloat16,False,False,triton,0,0,0.0,auto,0.0,0.0,0.0
gfx1250,256,256,2112,7168,False,torch.bfloat16,torch.bfloat16,False,False,triton,0,0,0.0,auto,0.0,0.0,0.0
gfx1250,256,512,2112,7168,False,torch.bfloat16,torch.bfloat16,False,False,triton,0,0,0.0,auto,0.0,0.0,0.0
gfx1250,256,1024,2112,7168,False,torch.bfloat16,torch.bfloat16,False,False,triton,0,0,0.0,auto,0.0,0.0,0.0
gfx1250,256,2048,2112,7168,False,torch.bfloat16,torch.bfloat16,False,False,triton,0,0,0.0,auto,0.0,0.0,0.0
gfx1250,256,4096,2112,7168,False,torch.bfloat16,torch.bfloat16,False,False,triton,0,0,0.0,auto,0.0,0.0,0.0
gfx1250,256,8192,2112,7168,False,torch.bfloat16,torch.bfloat16,False,False,triton,0,0,0.0,auto,0.0,0.0,0.0
gfx1250,256,16384,2112,7168,False,torch.bfloat16,torch.bfloat16,False,False,triton,0,0,0.0,auto,0.0,0.0,0.0
gfx1250,256,1,2880,4096,True,torch.bfloat16,torch.bfloat16,False,False,triton,0,0,0.0,auto,0.0,0.0,0.0
gfx1250,256,2,2880,4096,True,torch.bfloat16,torch.bfloat16,False,False,triton,0,0,0.0,auto,0.0,0.0,0.0
gfx1250,256,4,2880,4096,True,torch.bfloat16,torch.bfloat16,False,False,triton,0,0,0.0,auto,0.0,0.0,0.0
gfx1250,256,8,2880,4096,True,torch.bfloat16,torch.bfloat16,False,False,triton,0,0,0.0,auto,0.0,0.0,0.0
gfx1250,256,16,2880,4096,True,torch.bfloat16,torch.bfloat16,False,False,triton,0,0,0.0,auto,0.0,0.0,0.0
gfx1250,256,32,2880,4096,True,torch.bfloat16,torch.bfloat16,False,False,triton,0,0,0.0,auto,0.0,0.0,0.0
gfx1250,256,48,2880,4096,True,torch.bfloat16,torch.bfloat16,False,False,triton,0,0,0.0,auto,0.0,0.0,0.0
gfx1250,256,64,2880,4096,True,torch.bfloat16,torch.bfloat16,False,False,triton,0,0,0.0,auto,0.0,0.0,0.0
gfx1250,256,128,2880,4096,True,torch.bfloat16,torch.bfloat16,False,False,triton,0,0,0.0,auto,0.0,0.0,0.0
gfx1250,256,256,2880,4096,True,torch.bfloat16,torch.bfloat16,False,False,triton,0,0,0.0,auto,0.0,0.0,0.0
gfx1250,256,512,2880,4096,True,torch.bfloat16,torch.bfloat16,False,False,triton,0,0,0.0,auto,0.0,0.0,0.0
gfx1250,256,1024,2880,4096,True,torch.bfloat16,torch.bfloat16,False,False,triton,0,0,0.0,auto,0.0,0.0,0.0
gfx1250,256,2048,2880,4096,True,torch.bfloat16,torch.bfloat16,False,False,triton,0,0,0.0,auto,0.0,0.0,0.0
gfx1250,256,4096,2880,4096,True,torch.bfloat16,torch.bfloat16,False,False,triton,0,0,0.0,auto,0.0,0.0,0.0
gfx1250,256,8192,2880,4096,True,torch.bfloat16,torch.bfloat16,False,False,triton,0,0,0.0,auto,0.0,0.0,0.0
gfx1250,256,16384,2880,4096,True,torch.bfloat16,torch.bfloat16,False,False,triton,0,0,0.0,auto,0.0,0.0,0.0
gfx1250,256,1,3072,1536,False,torch.bfloat16,torch.bfloat16,False,False,triton,0,0,0.0,auto,0.0,0.0,0.0
gfx1250,256,2,3072,1536,False,torch.bfloat16,torch.bfloat16,False,False,triton,0,0,0.0,auto,0.0,0.0,0.0
gfx1250,256,4,3072,1536,False,torch.bfloat16,torch.bfloat16,False,False,triton,0,0,0.0,auto,0.0,0.0,0.0
gfx1250,256,8,3072,1536,False,torch.bfloat16,torch.bfloat16,False,False,triton,0,0,0.0,auto,0.0,0.0,0.0
gfx1250,256,16,3072,1536,False,torch.bfloat16,torch.bfloat16,False,False,triton,0,0,0.0,auto,0.0,0.0,0.0
gfx1250,256,32,3072,1536,False,torch.bfloat16,torch.bfloat16,False,False,triton,0,0,0.0,auto,0.0,0.0,0.0
gfx1250,256,48,3072,1536,False,torch.bfloat16,torch.bfloat16,False,False,triton,0,0,0.0,auto,0.0,0.0,0.0
gfx1250,256,64,3072,1536,False,torch.bfloat16,torch.bfloat16,False,False,triton,0,0,0.0,auto,0.0,0.0,0.0
gfx1250,256,80,3072,1536,False,torch.bfloat16,torch.bfloat16,False,False,triton,0,0,0.0,auto,0.0,0.0,0.0
gfx1250,256,96,3072,1536,False,torch.bfloat16,torch.bfloat16,False,False,triton,0,0,0.0,auto,0.0,0.0,0.0
gfx1250,256,112,3072,1536,False,torch.bfloat16,torch.bfloat16,False,False,triton,0,0,0.0,auto,0.0,0.0,0.0
gfx1250,256,128,3072,1536,False,torch.bfloat16,torch.bfloat16,False,False,triton,0,0,0.0,auto,0.0,0.0,0.0
gfx1250,256,256,3072,1536,False,torch.bfloat16,torch.bfloat16,False,False,triton,0,0,0.0,auto,0.0,0.0,0.0
gfx1250,256,512,3072,1536,False,torch.bfloat16,torch.bfloat16,False,False,triton,0,0,0.0,auto,0.0,0.0,0.0
gfx1250,256,1024,3072,1536,False,torch.bfloat16,torch.bfloat16,False,False,triton,0,0,0.0,auto,0.0,0.0,0.0
gfx1250,256,2048,3072,1536,False,torch.bfloat16,torch.bfloat16,False,False,triton,0,0,0.0,auto,0.0,0.0,0.0
gfx1250,256,4096,3072,1536,False,torch.bfloat16,torch.bfloat16,False,False,triton,0,0,0.0,auto,0.0,0.0,0.0
gfx1250,256,8192,3072,1536,False,torch.bfloat16,torch.bfloat16,False,False,triton,0,0,0.0,auto,0.0,0.0,0.0
gfx1250,256,16384,3072,1536,False,torch.bfloat16,torch.bfloat16,False,False,triton,0,0,0.0,auto,0.0,0.0,0.0
gfx1250,256,1,5120,2880,True,torch.bfloat16,torch.bfloat16,False,False,triton,0,0,0.0,auto,0.0,0.0,0.0
gfx1250,256,2,5120,2880,True,torch.bfloat16,torch.bfloat16,False,False,triton,0,0,0.0,auto,0.0,0.0,0.0
gfx1250,256,4,5120,2880,True,torch.bfloat16,torch.bfloat16,False,False,triton,0,0,0.0,auto,0.0,0.0,0.0
gfx1250,256,8,5120,2880,True,torch.bfloat16,torch.bfloat16,False,False,triton,0,0,0.0,auto,0.0,0.0,0.0
gfx1250,256,16,5120,2880,True,torch.bfloat16,torch.bfloat16,False,False,triton,0,0,0.0,auto,0.0,0.0,0.0
gfx1250,256,32,5120,2880,True,torch.bfloat16,torch.bfloat16,False,False,triton,0,0,0.0,auto,0.0,0.0,0.0
gfx1250,256,48,5120,2880,True,torch.bfloat16,torch.bfloat16,False,False,triton,0,0,0.0,auto,0.0,0.0,0.0
gfx1250,256,64,5120,2880,True,torch.bfloat16,torch.bfloat16,False,False,triton,0,0,0.0,auto,0.0,0.0,0.0
gfx1250,256,128,5120,2880,True,torch.bfloat16,torch.bfloat16,False,False,triton,0,0,0.0,auto,0.0,0.0,0.0
gfx1250,256,256,5120,2880,True,torch.bfloat16,torch.bfloat16,False,False,triton,0,0,0.0,auto,0.0,0.0,0.0
gfx1250,256,512,5120,2880,True,torch.bfloat16,torch.bfloat16,False,False,triton,0,0,0.0,auto,0.0,0.0,0.0
gfx1250,256,1024,5120,2880,True,torch.bfloat16,torch.bfloat16,False,False,triton,0,0,0.0,auto,0.0,0.0,0.0
gfx1250,256,2048,5120,2880,True,torch.bfloat16,torch.bfloat16,False,False,triton,0,0,0.0,auto,0.0,0.0,0.0
gfx1250,256,4096,5120,2880,True,torch.bfloat16,torch.bfloat16,False,False,triton,0,0,0.0,auto,0.0,0.0,0.0
gfx1250,256,8192,5120,2880,True,torch.bfloat16,torch.bfloat16,False,False,triton,0,0,0.0,auto,0.0,0.0,0.0
gfx1250,256,16384,5120,2880,True,torch.bfloat16,torch.bfloat16,False,False,triton,0,0,0.0,auto,0.0,0.0,0.0
gfx1250,256,1,7168,2048,False,torch.bfloat16,torch.bfloat16,False,False,triton,0,0,0.0,auto,0.0,0.0,0.0
gfx1250,256,2,7168,2048,False,torch.bfloat16,torch.bfloat16,False,False,triton,0,0,0.0,auto,0.0,0.0,0.0
gfx1250,256,4,7168,2048,False,torch.bfloat16,torch.bfloat16,False,False,triton,0,0,0.0,auto,0.0,0.0,0.0
gfx1250,256,8,7168,2048,False,torch.bfloat16,torch.bfloat16,False,False,triton,0,0,0.0,auto,0.0,0.0,0.0
gfx1250,256,16,7168,2048,False,torch.bfloat16,torch.bfloat16,False,False,triton,0,0,0.0,auto,0.0,0.0,0.0
gfx1250,256,32,7168,2048,False,torch.bfloat16,torch.bfloat16,False,False,triton,0,0,0.0,auto,0.0,0.0,0.0
gfx1250,256,48,7168,2048,False,torch.bfloat16,torch.bfloat16,False,False,triton,0,0,0.0,auto,0.0,0.0,0.0
gfx1250,256,64,7168,2048,False,torch.bfloat16,torch.bfloat16,False,False,triton,0,0,0.0,auto,0.0,0.0,0.0
gfx1250,256,80,7168,2048,False,torch.bfloat16,torch.bfloat16,False,False,triton,0,0,0.0,auto,0.0,0.0,0.0
gfx1250,256,96,7168,2048,False,torch.bfloat16,torch.bfloat16,False,False,triton,0,0,0.0,auto,0.0,0.0,0.0
gfx1250,256,112,7168,2048,False,torch.bfloat16,torch.bfloat16,False,False,triton,0,0,0.0,auto,0.0,0.0,0.0
gfx1250,256,128,7168,2048,False,torch.bfloat16,torch.bfloat16,False,False,triton,0,0,0.0,auto,0.0,0.0,0.0
gfx1250,256,256,7168,2048,False,torch.bfloat16,torch.bfloat16,False,False,triton,0,0,0.0,auto,0.0,0.0,0.0
gfx1250,256,512,7168,2048,False,torch.bfloat16,torch.bfloat16,False,False,triton,0,0,0.0,auto,0.0,0.0,0.0
gfx1250,256,1024,7168,2048,False,torch.bfloat16,torch.bfloat16,False,False,triton,0,0,0.0,auto,0.0,0.0,0.0
gfx1250,256,2048,7168,2048,False,torch.bfloat16,torch.bfloat16,False,False,triton,0,0,0.0,auto,0.0,0.0,0.0
gfx1250,256,4096,7168,2048,False,torch.bfloat16,torch.bfloat16,False,False,triton,0,0,0.0,auto,0.0,0.0,0.0
gfx1250,256,8192,7168,2048,False,torch.bfloat16,torch.bfloat16,False,False,triton,0,0,0.0,auto,0.0,0.0,0.0
gfx1250,256,16384,7168,2048,False,torch.bfloat16,torch.bfloat16,False,False,triton,0,0,0.0,auto,0.0,0.0,0.0
gfx1250,256,1,16160,7168,False,torch.bfloat16,torch.bfloat16,False,False,triton,0,0,0.0,auto,0.0,0.0,0.0
gfx1250,256,2,16160,7168,False,torch.bfloat16,torch.bfloat16,False,False,triton,0,0,0.0,auto,0.0,0.0,0.0
gfx1250,256,4,16160,7168,False,torch.bfloat16,torch.bfloat16,False,False,triton,0,0,0.0,auto,0.0,0.0,0.0
gfx1250,256,8,16160,7168,False,torch.bfloat16,torch.bfloat16,False,False,triton,0,0,0.0,auto,0.0,0.0,0.0
gfx1250,256,16,16160,7168,False,torch.bfloat16,torch.bfloat16,False,False,triton,0,0,0.0,auto,0.0,0.0,0.0
gfx1250,256,32,16160,7168,False,torch.bfloat16,torch.bfloat16,False,False,triton,0,0,0.0,auto,0.0,0.0,0.0
gfx1250,256,48,16160,7168,False,torch.bfloat16,torch.bfloat16,False,False,triton,0,0,0.0,auto,0.0,0.0,0.0
gfx1250,256,64,16160,7168,False,torch.bfloat16,torch.bfloat16,False,False,triton,0,0,0.0,auto,0.0,0.0,0.0
gfx1250,256,80,16160,7168,False,torch.bfloat16,torch.bfloat16,False,False,triton,0,0,0.0,auto,0.0,0.0,0.0
gfx1250,256,96,16160,7168,False,torch.bfloat16,torch.bfloat16,False,False,triton,0,0,0.0,auto,0.0,0.0,0.0
gfx1250,256,112,16160,7168,False,torch.bfloat16,torch.bfloat16,False,False,triton,0,0,0.0,auto,0.0,0.0,0.0
gfx1250,256,128,16160,7168,False,torch.bfloat16,torch.bfloat16,False,False,triton,0,0,0.0,auto,0.0,0.0,0.0
gfx1250,256,256,16160,7168,False,torch.bfloat16,torch.bfloat16,False,False,triton,0,0,0.0,auto,0.0,0.0,0.0
gfx1250,256,512,16160,7168,False,torch.bfloat16,torch.bfloat16,False,False,triton,0,0,0.0,auto,0.0,0.0,0.0
gfx1250,256,1024,16160,7168,False,torch.bfloat16,torch.bfloat16,False,False,triton,0,0,0.0,auto,0.0,0.0,0.0
gfx1250,256,2048,16160,7168,False,torch.bfloat16,torch.bfloat16,False,False,triton,0,0,0.0,auto,0.0,0.0,0.0
gfx1250,256,4096,16160,7168,False,torch.bfloat16,torch.bfloat16,False,False,triton,0,0,0.0,auto,0.0,0.0,0.0
gfx1250,256,8192,16160,7168,False,torch.bfloat16,torch.bfloat16,False,False,triton,0,0,0.0,auto,0.0,0.0,0.0
gfx1250,256,16384,16160,7168,False,torch.bfloat16,torch.bfloat16,False,False,triton,0,0,0.0,auto,0.0,0.0,0.0
gfx1250,256,1,129280,7168,False,torch.bfloat16,torch.bfloat16,False,False,triton,0,0,0.0,auto,0.0,0.0,0.0
gfx1250,256,2,129280,7168,False,torch.bfloat16,torch.bfloat16,False,False,triton,0,0,0.0,auto,0.0,0.0,0.0
gfx1250,256,4,129280,7168,False,torch.bfloat16,torch.bfloat16,False,False,triton,0,0,0.0,auto,0.0,0.0,0.0
gfx1250,256,8,129280,7168,False,torch.bfloat16,torch.bfloat16,False,False,triton,0,0,0.0,auto,0.0,0.0,0.0
gfx1250,256,16,129280,7168,False,torch.bfloat16,torch.bfloat16,False,False,triton,0,0,0.0,auto,0.0,0.0,0.0
gfx1250,256,32,129280,7168,False,torch.bfloat16,torch.bfloat16,False,False,triton,0,0,0.0,auto,0.0,0.0,0.0
gfx1250,256,48,129280,7168,False,torch.bfloat16,torch.bfloat16,False,False,triton,0,0,0.0,auto,0.0,0.0,0.0
gfx1250,256,64,129280,7168,False,torch.bfloat16,torch.bfloat16,False,False,triton,0,0,0.0,auto,0.0,0.0,0.0
gfx1250,256,80,129280,7168,False,torch.bfloat16,torch.bfloat16,False,False,triton,0,0,0.0,auto,0.0,0.0,0.0
gfx1250,256,96,129280,7168,False,torch.bfloat16,torch.bfloat16,False,False,triton,0,0,0.0,auto,0.0,0.0,0.0
gfx1250,256,112,129280,7168,False,torch.bfloat16,torch.bfloat16,False,False,triton,0,0,0.0,auto,0.0,0.0,0.0
gfx1250,256,128,129280,7168,False,torch.bfloat16,torch.bfloat16,False,False,triton,0,0,0.0,auto,0.0,0.0,0.0
gfx1250,256,256,129280,7168,False,torch.bfloat16,torch.bfloat16,False,False,triton,0,0,0.0,auto,0.0,0.0,0.0
gfx1250,256,512,129280,7168,False,torch.bfloat16,torch.bfloat16,False,False,triton,0,0,0.0,auto,0.0,0.0,0.0
gfx1250,256,1024,129280,7168,False,torch.bfloat16,torch.bfloat16,False,False,triton,0,0,0.0,auto,0.0,0.0,0.0
gfx1250,256,2048,129280,7168,False,torch.bfloat16,torch.bfloat16,False,False,triton,0,0,0.0,auto,0.0,0.0,0.0
gfx1250,256,4096,129280,7168,False,torch.bfloat16,torch.bfloat16,False,False,triton,0,0,0.0,auto,0.0,0.0,0.0
gfx1250,256,8192,129280,7168,False,torch.bfloat16,torch.bfloat16,False,False,triton,0,0,0.0,auto,0.0,0.0,0.0
gfx1250,256,16384,129280,7168,False,torch.bfloat16,torch.bfloat16,False,False,triton,0,0,0.0,auto,0.0,0.0,0.0
gfx1250,256,1,201088,2880,False,torch.bfloat16,torch.bfloat16,False,False,triton,0,0,0.0,auto,0.0,0.0,0.0
gfx1250,256,2,201088,2880,False,torch.bfloat16,torch.bfloat16,False,False,triton,0,0,0.0,auto,0.0,0.0,0.0
gfx1250,256,4,201088,2880,False,torch.bfloat16,torch.bfloat16,False,False,triton,0,0,0.0,auto,0.0,0.0,0.0
gfx1250,256,8,201088,2880,False,torch.bfloat16,torch.bfloat16,False,False,triton,0,0,0.0,auto,0.0,0.0,0.0
gfx1250,256,16,201088,2880,False,torch.bfloat16,torch.bfloat16,False,False,triton,0,0,0.0,auto,0.0,0.0,0.0
gfx1250,256,32,201088,2880,False,torch.bfloat16,torch.bfloat16,False,False,triton,0,0,0.0,auto,0.0,0.0,0.0
gfx1250,256,48,201088,2880,False,torch.bfloat16,torch.bfloat16,False,False,triton,0,0,0.0,auto,0.0,0.0,0.0
gfx1250,256,64,201088,2880,False,torch.bfloat16,torch.bfloat16,False,False,triton,0,0,0.0,auto,0.0,0.0,0.0
gfx1250,256,128,201088,2880,False,torch.bfloat16,torch.bfloat16,False,False,triton,0,0,0.0,auto,0.0,0.0,0.0
gfx1250,256,256,201088,2880,False,torch.bfloat16,torch.bfloat16,False,False,triton,0,0,0.0,auto,0.0,0.0,0.0
gfx1250,256,512,201088,2880,False,torch.bfloat16,torch.bfloat16,False,False,triton,0,0,0.0,auto,0.0,0.0,0.0
gfx1250,256,1024,201088,2880,False,torch.bfloat16,torch.bfloat16,False,False,triton,0,0,0.0,auto,0.0,0.0,0.0
gfx1250,256,2048,201088,2880,False,torch.bfloat16,torch.bfloat16,False,False,triton,0,0,0.0,auto,0.0,0.0,0.0
gfx1250,256,4096,201088,2880,False,torch.bfloat16,torch.bfloat16,False,False,triton,0,0,0.0,auto,0.0,0.0,0.0
gfx1250,256,8192,201088,2880,False,torch.bfloat16,torch.bfloat16,False,False,triton,0,0,0.0,auto,0.0,0.0,0.0
gfx1250,256,16384,201088,2880,False,torch.bfloat16,torch.bfloat16,False,False,triton,0,0,0.0,auto,0.0,0.0,0.0
gfx942,80,8,32,6144,False,torch.bfloat16,torch.bfloat16,False,False,opus,10300,0,8.4056,opus_gemm_gfx942_wkc_512x16x16x64_1x1_16x16x16_0x0x0,0.0,0.37,58.54
gfx942,80,16,32,6144,False,torch.bfloat16,torch.bfloat16,False,False,opus,10300,0,8.8163,opus_gemm_gfx942_wkc_512x16x16x64_1x1_16x16x16_0x0x0,0.0,0.71,67.02
gfx942,80,48,32,6144,False,torch.bfloat16,torch.bfloat16,False,False,opus,10300,0,9.7083,opus_gemm_gfx942_wkc_512x16x16x64_1x1_16x16x16_0x0x0,0.0,1.94,101.57
gfx942,80,64,32,6144,False,torch.bfloat16,torch.bfloat16,False,False,opus,10300,0,9.5767,opus_gemm_gfx942_wkc_512x16x16x64_1x1_16x16x16_0x0x0,0.0,2.63,123.61
gfx942,80,128,32,6144,False,torch.bfloat16,torch.bfloat16,False,False,opus,10300,0,10.2587,opus_gemm_gfx942_wkc_512x16x16x64_1x1_16x16x16_0x0x0,0.0,4.91,192.45
gfx942,80,16384,32,6144,False,torch.bfloat16,torch.bfloat16,False,False,opus,10302,0,156.3505,opus_gemm_gfx942_wkc_512x32x16x64_1x1_16x16x16_0x0x0,0.0,41.21,1296.88
gfx942,80,16,64,4096,False,torch.bfloat16,torch.bfloat16,False,False,asm,1,16,6.1751,_ZN5aiter39bf16gemm_fp32bf16_tn_32x64_splitk_cleanE,0.0264,1.36,106.46
gfx942,80,32,64,4096,False,torch.bfloat16,torch.bfloat16,False,False,asm,1,16,5.7186,_ZN5aiter39bf16gemm_fp32bf16_tn_32x64_splitk_cleanE,0.0283,2.93,138.24
gfx942,80,48,64,4096,False,torch.bfloat16,torch.bfloat16,False,False,asm,1,16,6.0843,_ZN5aiter39bf16gemm_fp32bf16_tn_32x64_splitk_cleanE,0.0283,4.14,151.81
gfx942,80,64,64,4096,False,torch.bfloat16,torch.bfloat16,False,False,asm,1,16,6.0838,_ZN5aiter39bf16gemm_fp32bf16_tn_32x64_splitk_cleanE,0.0288,5.52,173.7
gfx942,80,128,64,4096,False,torch.bfloat16,torch.bfloat16,False,False,asm,3,16,7.1149,_ZN5aiter39bf16gemm_fp32bf16_tn_48x64_splitk_cleanE,0.0269,9.43,223.37
gfx942,80,256,64,4096,False,torch.bfloat16,torch.bfloat16,False,False,asm,5,16,8.1263,_ZN5aiter39bf16gemm_fp32bf16_tn_64x64_splitk_cleanE,0.0281,16.52,326.62
gfx942,80,512,64,4096,False,torch.bfloat16,torch.bfloat16,False,False,opus,10302,0,10.5756,opus_gemm_gfx942_wkc_512x32x16x64_1x1_16x16x16_0x0x0,0.0,25.38,452.37
gfx942,80,16,100,5120,False,torch.bfloat16,torch.bfloat16,False,False,opus,10300,0,8.4774,opus_gemm_gfx942_wkc_512x16x16x64_1x1_16x16x16_0x0x0,0.0,1.93,140.5
gfx942,80,32,100,5120,False,torch.bfloat16,torch.bfloat16,False,False,opus,10300,0,8.9239,opus_gemm_gfx942_wkc_512x16x16x64_1x1_16x16x16_0x0x0,0.0,3.67,152.18
gfx942,80,64,100,5120,False,torch.bfloat16,torch.bfloat16,False,False,opus,10300,0,9.477,opus_gemm_gfx942_wkc_512x16x16x64_1x1_16x16x16_0x0x0,0.0,6.92,178.55
gfx942,80,128,100,5120,False,torch.bfloat16,torch.bfloat16,False,False,opus,10300,0,9.4055,opus_gemm_gfx942_wkc_512x16x16x64_1x1_16x16x16_0x0x0,0.0,13.94,250.95
gfx942,80,256,100,5120,False,torch.bfloat16,torch.bfloat16,False,False,opus,10302,0,11.9346,opus_gemm_gfx942_wkc_512x32x16x64_1x1_16x16x16_0x0x0,0.0,21.97,309.74
gfx942,80,64,192,1024,False,torch.bfloat16,torch.bfloat16,False,False,opus,10300,0,4.2782,opus_gemm_gfx942_wkc_512x16x16x64_1x1_16x16x16_0x0x0,0.0,5.88,128.29
gfx942,80,16,200,5120,False,torch.bfloat16,torch.bfloat16,False,False,opus,10300,0,8.6776,opus_gemm_gfx942_wkc_512x16x16x64_1x1_16x16x16_0x0x0,0.0,3.78,255.63
gfx942,80,32,200,5120,False,torch.bfloat16,torch.bfloat16,False,False,opus,10300,0,8.8999,opus_gemm_gfx942_wkc_512x16x16x64_1x1_16x16x16_0x0x0,0.0,7.36,268.37
gfx942,80,128,200,5120,False,torch.bfloat16,torch.bfloat16,False,False,opus,10302,0,12.0274,opus_gemm_gfx942_wkc_512x32x16x64_1x1_16x16x16_0x0x0,0.0,21.8,283.51
gfx942,80,1024,200,5120,False,torch.bfloat16,torch.bfloat16,False,False,opus,10200,0,33.6852,opus_gemm_gfx942_splitk_legacy_512x128x128x64_2x4_16x16x16_0x0x0,0.0,62.26,384.24
gfx942,80,4096,200,5120,False,torch.bfloat16,torch.bfloat16,False,False,opus,10200,0,124.617,opus_gemm_gfx942_splitk_legacy_512x128x128x64_2x4_16x16x16_0x0x0,0.0,67.32,366.16
gfx942,80,1,256,4096,False,torch.bfloat16,torch.bfloat16,False,False,asm,1,16,6.6138,_ZN5aiter39bf16gemm_fp32bf16_tn_32x64_splitk_cleanE,0.0352,0.32,318.4
gfx942,80,2,256,4096,False,torch.bfloat16,torch.bfloat16,False,False,asm,1,16,6.5562,_ZN5aiter39bf16gemm_fp32bf16_tn_32x64_splitk_cleanE,0.0273,0.64,322.53
gfx942,80,4,256,4096,False,torch.bfloat16,torch.bfloat16,False,False,asm,1,16,6.7999,_ZN5aiter39bf16gemm_fp32bf16_tn_32x64_splitk_cleanE,0.0303,1.23,313.53
gfx942,80,8,256,4096,False,torch.bfloat16,torch.bfloat16,False,False,asm,1,16,6.9061,_ZN5aiter39bf16gemm_fp32bf16_tn_32x64_splitk_cleanE,0.0288,2.43,313.75
gfx942,80,16,256,4096,False,torch.bfloat16,torch.bfloat16,False,False,asm,1,16,6.9642,_ZN5aiter39bf16gemm_fp32bf16_tn_32x64_splitk_cleanE,0.0312,4.82,321.13
gfx942,80,32,256,4096,False,torch.bfloat16,torch.bfloat16,False,False,asm,1,16,7.1542,_ZN5aiter39bf16gemm_fp32bf16_tn_32x64_splitk_cleanE,0.0292,9.38,332.07
gfx942,80,48,256,4096,False,torch.bfloat16,torch.bfloat16,False,False,opus,10300,0,7.45,opus_gemm_gfx942_wkc_512x16x16x64_1x1_16x16x16_0x0x0,0.0,13.51,337.58
gfx942,80,64,256,4096,False,torch.bfloat16,torch.bfloat16,False,False,opus,10300,0,7.9398,opus_gemm_gfx942_wkc_512x16x16x64_1x1_16x16x16_0x0x0,0.0,16.9,334.29
gfx942,80,128,256,4096,False,torch.bfloat16,torch.bfloat16,False,False,opus,10302,0,10.1493,opus_gemm_gfx942_wkc_512x32x16x64_1x1_16x16x16_0x0x0,0.0,26.45,316.4
gfx942,80,256,256,4096,False,torch.bfloat16,torch.bfloat16,False,False,asm,5,5,14.1963,_ZN5aiter39bf16gemm_fp32bf16_tn_64x64_splitk_cleanE,0.0146,37.82,304.68
gfx942,80,256,256,7168,False,torch.bfloat16,torch.bfloat16,False,False,opus,10203,10,19.9736,opus_gemm_gfx942_splitk_p1_bk128_256x64x64x128_2x2_16x16x16_0x0x0,0.0,47.04,374.05
gfx942,80,512,256,4096,False,torch.bfloat16,torch.bfloat16,False,False,opus,10210,0,23.7273,opus_gemm_gfx942_splitk_legacy_bf16ws_512x128x128x64_2x4_16x16x16_0x0x0,0.0,45.25,276.21
gfx942,80,80,384,7168,False,torch.bfloat16,torch.bfloat16,False,False,opus,10302,0,15.0256,opus_gemm_gfx942_wkc_512x32x16x64_1x1_16x16x16_0x0x0,0.0,29.31,446.79
gfx942,80,88,384,7168,False,torch.bfloat16,torch.bfloat16,False,False,opus,10302,0,15.2238,opus_gemm_gfx942_wkc_512x32x16x64_1x1_16x16x16_0x0x0,0.0,31.82,448.91
gfx942,80,96,384,7168,False,torch.bfloat16,torch.bfloat16,False,False,opus,10302,0,15.5162,opus_gemm_gfx942_wkc_512x32x16x64_1x1_16x16x16_0x0x0,0.0,34.06,448.24
gfx942,80,160,384,7168,False,torch.bfloat16,torch.bfloat16,False,False,opus,10201,8,20.2282,opus_gemm_gfx942_splitk_p1_256x64x64x64_2x2_16x16x16_0x0x0,0.0,43.54,391.61
gfx942,80,168,384,7168,False,torch.bfloat16,torch.bfloat16,False,False,opus,10201,8,20.8034,opus_gemm_gfx942_splitk_p1_256x64x64x64_2x2_16x16x16_0x0x0,0.0,44.46,386.6
gfx942,80,176,384,7168,False,torch.bfloat16,torch.bfloat16,False,False,opus,10201,8,20.632,opus_gemm_gfx942_splitk_p1_256x64x64x64_2x2_16x16x16_0x0x0,0.0,46.96,395.66
gfx942,80,184,384,7168,False,torch.bfloat16,torch.bfloat16,False,False,opus,10201,8,21.0217,opus_gemm_gfx942_splitk_p1_256x64x64x64_2x2_16x16x16_0x0x0,0.0,48.18,394.08
gfx942,80,192,384,7168,False,torch.bfloat16,torch.bfloat16,False,False,opus,10201,8,21.2254,opus_gemm_gfx942_splitk_p1_256x64x64x64_2x2_16x16x16_0x0x0,0.0,49.8,395.99
gfx942,80,328,384,7168,False,torch.bfloat16,torch.bfloat16,False,False,opus,10200,8,29.3805,opus_gemm_gfx942_splitk_legacy_512x128x128x64_2x4_16x16x16_0x0x0,0.0,61.46,355.99
gfx942,80,336,384,7168,False,torch.bfloat16,torch.bfloat16,False,False,opus,10200,8,29.5682,opus_gemm_gfx942_splitk_legacy_512x128x128x64_2x4_16x16x16_0x0x0,0.0,62.56,357.82
gfx942,80,344,384,7168,False,torch.bfloat16,torch.bfloat16,False,False,opus,10200,8,29.6615,opus_gemm_gfx942_splitk_legacy_512x128x128x64_2x4_16x16x16_0x0x0,0.0,63.84,360.76
gfx942,80,352,384,7168,False,torch.bfloat16,torch.bfloat16,False,False,opus,10200,8,29.7817,opus_gemm_gfx942_splitk_legacy_512x128x128x64_2x4_16x16x16_0x0x0,0.0,65.07,363.37
gfx942,80,360,384,7168,False,torch.bfloat16,torch.bfloat16,False,False,opus,10200,8,29.8782,opus_gemm_gfx942_splitk_legacy_512x128x128x64_2x4_16x16x16_0x0x0,0.0,66.33,366.24
gfx942,80,368,384,7168,False,torch.bfloat16,torch.bfloat16,False,False,opus,10200,8,30.0582,opus_gemm_gfx942_splitk_legacy_512x128x128x64_2x4_16x16x16_0x0x0,0.0,67.4,368.06
gfx942,80,376,384,7168,False,torch.bfloat16,torch.bfloat16,False,False,opus,10200,8,30.2422,opus_gemm_gfx942_splitk_legacy_512x128x128x64_2x4_16x16x16_0x0x0,0.0,68.44,369.82
gfx942,80,384,384,7168,False,torch.bfloat16,torch.bfloat16,False,False,opus,10200,8,30.5541,opus_gemm_gfx942_splitk_legacy_512x128x128x64_2x4_16x16x16_0x0x0,0.0,69.19,370.0
gfx942,80,392,384,7168,False,torch.bfloat16,torch.bfloat16,False,False,opus,10204,0,34.2927,opus_gemm_gfx942_splitk_em3en4_lds1_pgr2_256x128x96x128_2x2_16x16x16_0x0x0,0.0,62.93,333.18
gfx942,80,400,384,7168,False,torch.bfloat16,torch.bfloat16,False,False,opus,10204,0,34.1729,opus_gemm_gfx942_splitk_em3en4_lds1_pgr2_256x128x96x128_2x2_16x16x16_0x0x0,0.0,64.44,337.89
gfx942,80,408,384,7168,False,torch.bfloat16,torch.bfloat16,False,False,opus,10204,0,34.7779,opus_gemm_gfx942_splitk_em3en4_lds1_pgr2_256x128x96x128_2x2_16x16x16_0x0x0,0.0,64.58,335.48
gfx942,80,416,384,7168,False,torch.bfloat16,torch.bfloat16,False,False,opus,10204,0,35.4087,opus_gemm_gfx942_splitk_em3en4_lds1_pgr2_256x128x96x128_2x2_16x16x16_0x0x0,0.0,64.68,332.92
gfx942,80,424,384,7168,False,torch.bfloat16,torch.bfloat16,False,False,opus,10204,0,34.9512,opus_gemm_gfx942_splitk_em3en4_lds1_pgr2_256x128x96x128_2x2_16x16x16_0x0x0,0.0,66.78,340.74
gfx942,80,432,384,7168,False,torch.bfloat16,torch.bfloat16,False,False,opus,10200,6,34.8201,opus_gemm_gfx942_splitk_legacy_512x128x128x64_2x4_16x16x16_0x0x0,0.0,68.3,345.49
gfx942,80,440,384,7168,False,torch.bfloat16,torch.bfloat16,False,False,opus,10200,6,35.0038,opus_gemm_gfx942_splitk_legacy_512x128x128x64_2x4_16x16x16_0x0x0,0.0,69.2,347.13
gfx942,80,448,384,7168,False,torch.bfloat16,torch.bfloat16,False,False,opus,10200,6,35.004,opus_gemm_gfx942_splitk_legacy_512x128x128x64_2x4_16x16x16_0x0x0,0.0,70.46,350.58
gfx942,80,456,384,7168,False,torch.bfloat16,torch.bfloat16,False,False,opus,10200,6,35.1986,opus_gemm_gfx942_splitk_legacy_512x128x128x64_2x4_16x16x16_0x0x0,0.0,71.32,352.07
gfx942,80,464,384,7168,False,torch.bfloat16,torch.bfloat16,False,False,opus,10200,6,35.1434,opus_gemm_gfx942_splitk_legacy_512x128x128x64_2x4_16x16x16_0x0x0,0.0,72.68,356.06
gfx942,80,472,384,7168,False,torch.bfloat16,torch.bfloat16,False,False,opus,10200,6,35.3493,opus_gemm_gfx942_splitk_legacy_512x128x128x64_2x4_16x16x16_0x0x0,0.0,73.51,357.41
gfx942,80,488,384,7168,False,torch.bfloat16,torch.bfloat16,False,False,opus,10200,6,35.6812,opus_gemm_gfx942_splitk_legacy_512x128x128x64_2x4_16x16x16_0x0x0,0.0,75.29,360.86
gfx942,80,504,384,7168,False,torch.bfloat16,torch.bfloat16,False,False,opus,10204,0,37.3063,opus_gemm_gfx942_splitk_em3en4_lds1_pgr2_256x128x96x128_2x2_16x16x16_0x0x0,0.0,74.37,351.61
gfx942,80,512,384,7168,False,torch.bfloat16,torch.bfloat16,False,False,opus,10204,0,37.4748,opus_gemm_gfx942_splitk_em3en4_lds1_pgr2_256x128x96x128_2x2_16x16x16_0x0x0,0.0,75.21,353.26
gfx942,80,768,384,7168,False,torch.bfloat16,torch.bfloat16,False,False,opus,10200,4,51.6252,opus_gemm_gfx942_splitk_legacy_512x128x128x64_2x4_16x16x16_0x0x0,0.0,81.9,331.33
gfx942,80,1,512,4096,False,torch.bfloat16,torch.bfloat16,False,False,opus,10300,0,8.0662,opus_gemm_gfx942_wkc_512x16x16x64_1x1_16x16x16_0x0x0,0.0,0.52,521.13
gfx942,80,2,512,4096,False,torch.bfloat16,torch.bfloat16,False,False,opus,10300,0,8.3322,opus_gemm_gfx942_wkc_512x16x16x64_1x1_16x16x16_0x0x0,0.0,1.01,505.6
gfx942,80,4,512,4096,False,torch.bfloat16,torch.bfloat16,False,False,opus,10300,0,8.1018,opus_gemm_gfx942_wkc_512x16x16x64_1x1_16x16x16_0x0x0,0.0,2.07,522.25
gfx942,80,8,512,4096,False,torch.bfloat16,torch.bfloat16,False,False,opus,10300,0,8.1931,opus_gemm_gfx942_wkc_512x16x16x64_1x1_16x16x16_0x0x0,0.0,4.1,520.93
gfx942,80,16,512,4096,False,torch.bfloat16,torch.bfloat16,False,False,flydsl,723,8,8.6374,flydsl_gemm4_abf16_wbf16_bf16_t16x64x64_split_k8_block_m_warp1_block_n_warp2_block_k_warp1_async_copyFalse_b_to_ldsTrue_b_preshuffleFalse_c_to_ldsFalse_gfx942,0.0204,7.77,502.67
gfx942,80,32,512,4096,False,torch.bfloat16,torch.bfloat16,False,False,flydsl,759,8,9.2194,flydsl_gemm4_abf16_wbf16_bf16_t32x64x64_split_k8_block_m_warp2_block_n_warp2_block_k_warp1_async_copyFalse_b_to_ldsTrue_b_preshuffleFalse_c_to_ldsFalse_gfx942,0.0198,14.56,486.93
gfx942,80,48,512,4096,False,torch.bfloat16,torch.bfloat16,False,False,asm,3,10,10.4683,_ZN5aiter39bf16gemm_fp32bf16_tn_48x64_splitk_cleanE,0.0228,19.23,442.93
gfx942,80,64,512,4096,False,torch.bfloat16,torch.bfloat16,False,False,opus,10302,0,10.7679,opus_gemm_gfx942_wkc_512x32x16x64_1x1_16x16x16_0x0x0,0.0,24.93,444.3
gfx942,80,128,512,4096,False,torch.bfloat16,torch.bfloat16,False,False,asm,5,5,14.5712,_ZN5aiter39bf16gemm_fp32bf16_tn_64x64_splitk_cleanE,0.0148,36.84,368.81
gfx942,80,128,512,7168,False,torch.bfloat16,torch.bfloat16,False,False,opus,10201,10,19.7843,opus_gemm_gfx942_splitk_p1_256x64x64x64_2x2_16x16x16_0x0x0,0.0,47.49,470.38
gfx942,80,208,512,7168,False,torch.bfloat16,torch.bfloat16,False,False,opus,10210,0,27.7763,opus_gemm_gfx942_splitk_legacy_bf16ws_512x128x128x64_2x4_16x16x16_0x0x0,0.0,54.97,379.28
gfx942,80,224,512,7168,False,torch.bfloat16,torch.bfloat16,False,False,opus,10210,0,27.8194,opus_gemm_gfx942_splitk_legacy_bf16ws_512x128x128x64_2x4_16x16x16_0x0x0,0.0,59.1,387.52
gfx942,80,240,512,7168,False,torch.bfloat16,torch.bfloat16,False,False,opus,10210,0,28.0936,opus_gemm_gfx942_splitk_legacy_bf16ws_512x128x128x64_2x4_16x16x16_0x0x0,0.0,62.7,392.49
gfx942,80,256,512,4096,False,torch.bfloat16,torch.bfloat16,False,False,opus,10210,0,23.6674,opus_gemm_gfx942_splitk_legacy_bf16ws_512x128x128x64_2x4_16x16x16_0x0x0,0.0,45.37,276.9
gfx942,80,256,512,7168,False,torch.bfloat16,torch.bfloat16,False,False,opus,10210,0,28.3166,opus_gemm_gfx942_splitk_legacy_bf16ws_512x128x128x64_2x4_16x16x16_0x0x0,0.0,66.36,398.08
gfx942,80,352,512,7168,False,torch.bfloat16,torch.bfloat16,False,False,opus,10200,6,32.1674,opus_gemm_gfx942_splitk_legacy_512x128x128x64_2x4_16x16x16_0x0x0,0.0,80.32,396.26
gfx942,80,384,512,7168,False,torch.bfloat16,torch.bfloat16,False,False,opus,10200,6,32.3477,opus_gemm_gfx942_splitk_legacy_512x128x128x64_2x4_16x16x16_0x0x0,0.0,87.13,409.25
gfx942,80,448,512,7168,False,torch.bfloat16,torch.bfloat16,False,False,opus,10200,0,36.729,opus_gemm_gfx942_splitk_legacy_512x128x128x64_2x4_16x16x16_0x0x0,0.0,89.53,387.2
gfx942,80,480,512,7168,False,torch.bfloat16,torch.bfloat16,False,False,opus,10210,0,42.1268,opus_gemm_gfx942_splitk_legacy_bf16ws_512x128x128x64_2x4_16x16x16_0x0x0,0.0,83.63,349.25
gfx942,80,512,512,4096,False,torch.bfloat16,torch.bfloat16,False,False,opus,10210,0,29.1965,opus_gemm_gfx942_splitk_legacy_bf16ws_512x128x128x64_2x4_16x16x16_0x0x0,0.0,73.55,305.27
gfx942,80,512,512,7168,False,torch.bfloat16,torch.bfloat16,False,False,opus,10210,0,42.8344,opus_gemm_gfx942_splitk_legacy_bf16ws_512x128x128x64_2x4_16x16x16_0x0x0,0.0,87.74,354.96
gfx942,80,608,512,7168,False,torch.bfloat16,torch.bfloat16,False,False,opus,10210,0,49.5677,opus_gemm_gfx942_splitk_legacy_bf16ws_512x128x128x64_2x4_16x16x16_0x0x0,0.0,90.03,336.49
gfx942,80,640,512,7168,False,torch.bfloat16,torch.bfloat16,False,False,opus,10200,0,50.224,opus_gemm_gfx942_splitk_legacy_512x128x128x64_2x4_16x16x16_0x0x0,0.0,93.53,341.88
gfx942,80,736,512,7168,False,torch.bfloat16,torch.bfloat16,False,False,opus,10200,3,60.7273,opus_gemm_gfx942_splitk_legacy_512x128x128x64_2x4_16x16x16_0x0x0,0.0,88.96,307.03
gfx942,80,768,512,7168,False,torch.bfloat16,torch.bfloat16,False,False,opus,10200,3,61.6035,opus_gemm_gfx942_splitk_legacy_512x128x128x64_2x4_16x16x16_0x0x0,0.0,91.51,310.64
gfx942,80,1,800,5120,False,torch.bfloat16,torch.bfloat16,False,False,opus,10300,0,9.9099,opus_gemm_gfx942_wkc_512x16x16x64_1x1_16x16x16_0x0x0,0.0,0.83,827.84
gfx942,80,16,800,5120,False,torch.bfloat16,torch.bfloat16,False,False,opus,10300,0,12.4963,opus_gemm_gfx942_wkc_512x16x16x64_1x1_16x16x16_0x0x0,0.0,10.49,670.71
gfx942,80,32,800,5120,False,torch.bfloat16,torch.bfloat16,False,False,opus,10302,0,13.8459,opus_gemm_gfx942_wkc_512x32x16x64_1x1_16x16x16_0x0x0,0.0,18.93,619.02
gfx942,80,64,800,5120,False,torch.bfloat16,torch.bfloat16,False,False,opus,10201,6,17.6001,opus_gemm_gfx942_splitk_p1_256x64x64x64_2x2_16x16x16_0x0x0,0.0,29.79,508.51
gfx942,80,1,1024,4096,False,torch.bfloat16,torch.bfloat16,False,False,opus,10300,0,9.1734,opus_gemm_gfx942_wkc_512x16x16x64_1x1_16x16x16_0x0x0,0.0,0.91,915.57
gfx942,80,1,1024,7168,False,torch.bfloat16,torch.bfloat16,False,False,opus,10300,0,11.7745,opus_gemm_gfx942_wkc_512x16x16x64_1x1_16x16x16_0x0x0,0.0,1.25,1248.16
gfx942,80,2,1024,4096,False,torch.bfloat16,torch.bfloat16,False,False,opus,10300,0,9.4623,opus_gemm_gfx942_wkc_512x16x16x64_1x1_16x16x16_0x0x0,0.0,1.77,888.69
gfx942,80,4,1024,4096,False,torch.bfloat16,torch.bfloat16,False,False,opus,10300,0,9.5499,opus_gemm_gfx942_wkc_512x16x16x64_1x1_16x16x16_0x0x0,0.0,3.51,882.69
gfx942,80,4,1024,7168,False,torch.bfloat16,torch.bfloat16,False,False,opus,10300,0,11.8598,opus_gemm_gfx942_wkc_512x16x16x64_1x1_16x16x16_0x0x0,0.0,4.95,1243.33
gfx942,80,8,1024,4096,False,torch.bfloat16,torch.bfloat16,False,False,opus,10300,0,9.6515,opus_gemm_gfx942_wkc_512x16x16x64_1x1_16x16x16_0x0x0,0.0,6.95,877.64
gfx942,80,8,1024,7168,False,torch.bfloat16,torch.bfloat16,False,False,opus,10300,0,11.9403,opus_gemm_gfx942_wkc_512x16x16x64_1x1_16x16x16_0x0x0,0.0,9.84,1240.43
gfx942,80,16,1024,4096,False,torch.bfloat16,torch.bfloat16,False,False,opus,10302,0,11.2766,opus_gemm_gfx942_wkc_512x32x16x64_1x1_16x16x16_0x0x0,0.0,11.9,758.42
gfx942,80,32,1024,4096,False,torch.bfloat16,torch.bfloat16,False,False,opus,10302,0,11.8246,opus_gemm_gfx942_wkc_512x32x16x64_1x1_16x16x16_0x0x0,0.0,22.7,737.13
gfx942,80,48,1024,4096,False,torch.bfloat16,torch.bfloat16,False,False,asm,3,5,13.8806,_ZN5aiter39bf16gemm_fp32bf16_tn_48x64_splitk_cleanE,0.0146,29.01,639.75
gfx942,80,64,1024,4096,False,torch.bfloat16,torch.bfloat16,False,False,asm,5,5,15.1527,_ZN5aiter39bf16gemm_fp32bf16_tn_64x64_splitk_cleanE,0.0141,35.43,596.86
gfx942,80,104,1024,7168,False,torch.bfloat16,torch.bfloat16,False,False,opus,10210,0,28.0462,opus_gemm_gfx942_splitk_legacy_bf16ws_512x128x128x64_2x4_16x16x16_0x0x0,0.0,54.44,584.18
gfx942,80,112,1024,7168,False,torch.bfloat16,torch.bfloat16,False,False,opus,10210,0,28.5379,opus_gemm_gfx942_splitk_legacy_bf16ws_512x128x128x64_2x4_16x16x16_0x0x0,0.0,57.61,578.71
gfx942,80,120,1024,7168,False,torch.bfloat16,torch.bfloat16,False,False,opus,10210,0,28.6248,opus_gemm_gfx942_splitk_legacy_bf16ws_512x128x128x64_2x4_16x16x16_0x0x0,0.0,61.54,581.53
gfx942,80,128,1024,4096,False,torch.bfloat16,torch.bfloat16,False,False,torch,0,0,19.8904,native,0.0,53.98,487.64
gfx942,80,128,1024,7168,False,torch.bfloat16,torch.bfloat16,False,False,opus,10210,0,28.7869,opus_gemm_gfx942_splitk_legacy_bf16ws_512x128x128x64_2x4_16x16x16_0x0x0,0.0,65.27,582.81
gfx942,80,200,1024,7168,False,torch.bfloat16,torch.bfloat16,False,False,opus,10200,5,40.5018,opus_gemm_gfx942_splitk_legacy_512x128x128x64_2x4_16x16x16_0x0x0,0.0,72.49,443.36
gfx942,80,208,1024,7168,False,torch.bfloat16,torch.bfloat16,False,False,opus,10210,0,41.1359,opus_gemm_gfx942_splitk_legacy_bf16ws_512x128x128x64_2x4_16x16x16_0x0x0,0.0,74.23,439.71
gfx942,80,216,1024,7168,False,torch.bfloat16,torch.bfloat16,False,False,opus,10210,0,41.3267,opus_gemm_gfx942_splitk_legacy_bf16ws_512x128x128x64_2x4_16x16x16_0x0x0,0.0,76.73,440.85
gfx942,80,224,1024,7168,False,torch.bfloat16,torch.bfloat16,False,False,opus,10210,0,41.3224,opus_gemm_gfx942_splitk_legacy_bf16ws_512x128x128x64_2x4_16x16x16_0x0x0,0.0,79.58,444.07
gfx942,80,232,1024,7168,False,torch.bfloat16,torch.bfloat16,False,False,opus,10210,0,41.7262,opus_gemm_gfx942_splitk_legacy_bf16ws_512x128x128x64_2x4_16x16x16_0x0x0,0.0,81.62,442.91
gfx942,80,240,1024,7168,False,torch.bfloat16,torch.bfloat16,False,False,opus,10210,0,42.0916,opus_gemm_gfx942_splitk_legacy_bf16ws_512x128x128x64_2x4_16x16x16_0x0x0,0.0,83.7,442.18
gfx942,80,248,1024,7168,False,torch.bfloat16,torch.bfloat16,False,False,opus,10210,0,42.5615,opus_gemm_gfx942_splitk_legacy_bf16ws_512x128x128x64_2x4_16x16x16_0x0x0,0.0,85.54,440.38
gfx942,80,256,1024,4096,False,torch.bfloat16,torch.bfloat16,False,False,opus,10210,0,29.3736,opus_gemm_gfx942_splitk_legacy_bf16ws_512x128x128x64_2x4_16x16x16_0x0x0,0.0,73.11,374.83
gfx942,80,256,1024,7168,False,torch.bfloat16,torch.bfloat16,False,False,opus,10210,0,42.823,opus_gemm_gfx942_splitk_legacy_bf16ws_512x128x128x64_2x4_16x16x16_0x0x0,0.0,87.76,440.75
gfx942,80,512,1024,4096,False,torch.bfloat16,torch.bfloat16,False,False,torch,0,0,42.5719,native,0.0,100.89,320.2
gfx942,80,1,1280,8192,False,torch.bfloat16,torch.bfloat16,False,False,opus,10300,0,12.9122,opus_gemm_gfx942_wkc_512x16x16x64_1x1_16x16x16_0x0x0,0.0,1.62,1625.63
gfx942,80,1,2048,4096,False,torch.bfloat16,torch.bfloat16,False,False,opus,10301,0,13.0372,opus_gemm_gfx942_wkc_512x16x32x32_1x1_16x16x16_0x0x0,0.0,1.29,1287.82
gfx942,80,2,2048,4096,False,torch.bfloat16,torch.bfloat16,False,False,opus,10301,0,12.9907,opus_gemm_gfx942_wkc_512x16x32x32_1x1_16x16x16_0x0x0,0.0,2.58,1293.37
gfx942,80,4,2048,4096,False,torch.bfloat16,torch.bfloat16,False,False,torch,0,0,14.1186,native,0.0,4.75,1191.79
gfx942,80,4,2048,7168,False,torch.bfloat16,torch.bfloat16,False,False,opus,10301,0,20.483,opus_gemm_gfx942_wkc_512x16x32x32_1x1_16x16x16_0x0x0,0.0,5.73,1436.99
gfx942,80,8,2048,4096,False,torch.bfloat16,torch.bfloat16,False,False,opus,10301,0,13.0097,opus_gemm_gfx942_wkc_512x16x32x32_1x1_16x16x16_0x0x0,0.0,10.32,1297.15
gfx942,80,8,2048,7168,False,torch.bfloat16,torch.bfloat16,False,False,opus,10301,0,20.5934,opus_gemm_gfx942_wkc_512x16x32x32_1x1_16x16x16_0x0x0,0.0,11.41,1432.87
gfx942,80,16,2048,4096,False,torch.bfloat16,torch.bfloat16,False,False,opus,10301,0,13.3916,opus_gemm_gfx942_wkc_512x16x32x32_1x1_16x16x16_0x0x0,0.0,20.05,1267.5
gfx942,80,16,2048,7168,False,torch.bfloat16,torch.bfloat16,False,False,opus,10301,0,20.8499,opus_gemm_gfx942_wkc_512x16x32x32_1x1_16x16x16_0x0x0,0.0,22.53,1422.31
gfx942,80,32,2048,4096,False,torch.bfloat16,torch.bfloat16,False,False,torch,0,0,17.4838,native,0.0,30.71,982.08
gfx942,80,48,2048,4096,False,torch.bfloat16,torch.bfloat16,False,False,asm,3,2,22.906,_ZN5aiter39bf16gemm_fp32bf16_tn_48x64_splitk_cleanE,0.0049,35.16,758.19
gfx942,80,64,2048,4096,False,torch.bfloat16,torch.bfloat16,False,False,torch,0,0,23.5578,native,0.0,45.58,745.56
gfx942,80,112,2048,7168,False,torch.bfloat16,torch.bfloat16,False,False,opus,10210,0,42.9434,opus_gemm_gfx942_splitk_legacy_bf16ws_512x128x128x64_2x4_16x16x16_0x0x0,0.0,76.57,731.77
gfx942,80,128,2048,4096,False,torch.bfloat16,torch.bfloat16,False,False,opus,10210,0,29.7021,opus_gemm_gfx942_splitk_legacy_bf16ws_512x128x128x64_2x4_16x16x16_0x0x0,0.0,72.3,617.8
gfx942,80,128,2048,7168,False,torch.bfloat16,torch.bfloat16,False,False,opus,10210,0,44.0662,opus_gemm_gfx942_splitk_legacy_bf16ws_512x128x128x64_2x4_16x16x16_0x0x0,0.0,85.28,719.81
gfx942,80,256,2048,4096,False,torch.bfloat16,torch.bfloat16,False,False,torch,0,0,49.4487,native,0.0,86.86,402.9
gfx942,80,512,2048,4096,False,torch.bfloat16,torch.bfloat16,False,False,triton,0,0,83.034,auto,0.0,103.45,277.82
gfx942,80,640,2048,7168,False,torch.bfloat16,torch.bfloat16,False,False,opus,10000,0,151.0107,opus_gemm_gfx942_512x128x128x64_2x4_16x16x16_0x0x0,0.0,124.43,272.54
gfx942,80,24,2112,7168,False,torch.bfloat16,torch.bfloat16,False,False,opus,10303,0,24.4933,opus_gemm_gfx942_wkc_256x32x32x64_1x1_16x16x16_0x0x0,0.0,29.67,1254.35
gfx942,80,64,3072,1536,False,torch.bfloat16,torch.bfloat16,False,False,opus,10003,0,16.2504,opus_gemm_gfx942_p1_bk128_256x64x64x128_2x2_16x16x16_0x0x0,0.0,37.17,617.03
gfx942,80,360,4096,512,False,torch.bfloat16,torch.bfloat16,False,False,opus,10001,0,24.4607,opus_gemm_gfx942_p1_256x64x64x64_2x2_16x16x16_0x0x0,0.0,61.73,307.11
gfx942,80,64,5120,640,False,torch.bfloat16,torch.bfloat16,False,False,opus,10001,0,8.7885,opus_gemm_gfx942_p1_256x64x64x64_2x2_16x16x16_0x0x0,0.0,47.72,829.59
gfx942,80,128,5120,640,False,torch.bfloat16,torch.bfloat16,False,False,opus,10001,0,12.6054,opus_gemm_gfx942_p1_256x64x64x64_2x2_16x16x16_0x0x0,0.0,66.55,636.88
gfx942,80,256,5120,640,False,torch.bfloat16,torch.bfloat16,False,False,opus,10000,0,15.4867,opus_gemm_gfx942_512x128x128x64_2x4_16x16x16_0x0x0,0.0,108.33,613.61
gfx942,80,256,5120,1280,False,torch.bfloat16,torch.bfloat16,False,False,opus,10000,0,27.2009,opus_gemm_gfx942_512x128x128x64_2x4_16x16x16_0x0x0,0.0,123.36,602.33
gfx942,80,256,5120,3200,False,torch.bfloat16,torch.bfloat16,False,False,opus,10000,0,54.2552,opus_gemm_gfx942_512x128x128x64_2x4_16x16x16_0x0x0,0.0,154.61,682.48
gfx942,80,4,6144,6144,False,torch.bfloat16,torch.bfloat16,False,False,opus,10300,0,47.3828,opus_gemm_gfx942_wkc_512x16x16x64_1x1_16x16x16_0x0x0,0.0,6.37,1595.43
gfx942,80,8,6144,4096,False,torch.bfloat16,torch.bfloat16,False,False,opus,10301,0,34.4629,opus_gemm_gfx942_wkc_512x16x32x32_1x1_16x16x16_0x0x0,0.0,11.68,1465.21
gfx942,80,16,6144,3072,False,torch.bfloat16,torch.bfloat16,False,False,opus,10301,0,27.883,opus_gemm_gfx942_wkc_512x16x32x32_1x1_16x16x16_0x0x0,0.0,21.66,1364.4
gfx942,80,16,6144,4096,False,torch.bfloat16,torch.bfloat16,False,False,opus,10301,0,34.8629,opus_gemm_gfx942_wkc_512x16x32x32_1x1_16x16x16_0x0x0,0.0,23.1,1453.1
gfx942,80,1,7168,512,False,torch.bfloat16,torch.bfloat16,False,False,opus,10001,0,9.6876,opus_gemm_gfx942_p1_256x64x64x64_2x2_16x16x16_0x0x0,0.0,0.76,759.26
gfx942,80,48,7168,512,False,torch.bfloat16,torch.bfloat16,False,False,opus,10003,0,10.7835,opus_gemm_gfx942_p1_bk128_256x64x64x128_2x2_16x16x16_0x0x0,0.0,32.67,749.04
gfx942,80,72,7168,512,False,torch.bfloat16,torch.bfloat16,False,False,opus,10000,0,14.5067,opus_gemm_gfx942_512x128x128x64_2x4_16x16x16_0x0x0,0.0,36.43,582.21
gfx942,80,80,7168,512,False,torch.bfloat16,torch.bfloat16,False,False,opus,10000,0,16.2923,opus_gemm_gfx942_512x128x128x64_2x4_16x16x16_0x0x0,0.0,36.04,525.94
gfx942,80,80,7168,2048,False,torch.bfloat16,torch.bfloat16,False,False,opus,10000,0,42.8315,opus_gemm_gfx942_512x128x128x64_2x4_16x16x16_0x0x0,0.0,54.84,719.91
gfx942,80,112,7168,2048,False,torch.bfloat16,torch.bfloat16,False,False,opus,10000,0,49.8753,opus_gemm_gfx942_512x128x128x64_2x4_16x16x16_0x0x0,0.0,65.93,630.06
gfx942,80,120,7168,512,False,torch.bfloat16,torch.bfloat16,False,False,opus,10000,0,18.7699,opus_gemm_gfx942_512x128x128x64_2x4_16x16x16_0x0x0,0.0,46.93,489.25
gfx942,80,128,7168,512,False,torch.bfloat16,torch.bfloat16,False,False,opus,10000,0,14.1933,opus_gemm_gfx942_512x128x128x64_2x4_16x16x16_0x0x0,0.0,66.19,655.67
gfx942,80,256,7168,512,False,torch.bfloat16,torch.bfloat16,False,False,opus,10000,0,27.0618,opus_gemm_gfx942_512x128x128x64_2x4_16x16x16_0x0x0,0.0,69.44,416.54
gfx942,80,1024,7168,512,False,torch.bfloat16,torch.bfloat16,False,False,opus,10000,0,74.6028,opus_gemm_gfx942_512x128x128x64_2x4_16x16x16_0x0x0,0.0,100.75,309.22
gfx950,256,1,32,6144,False,torch.bfloat16,torch.bfloat16,False,False,skinny,2,0,3.4721,sol2,0.0,0.11,116.81
gfx950,256,2,32,6144,False,torch.bfloat16,torch.bfloat16,False,False,skinny,2,0,4.7249,sol2,0.0,0.17,88.45
gfx950,256,4,32,6144,False,torch.bfloat16,torch.bfloat16,False,False,skinny,2,0,5.8368,sol2,0.0,0.27,75.83
gfx950,256,8,32,6144,False,torch.bfloat16,torch.bfloat16,False,False,torch,0,0,8.9937,native,0.0,0.35,54.71
gfx950,256,16,32,6144,False,torch.bfloat16,torch.bfloat16,False,False,torch,0,0,7.4959,native,0.0,0.84,78.82
gfx950,256,32,32,6144,False,torch.bfloat16,torch.bfloat16,False,False,torch,0,0,7.8162,native,0.0,1.61,100.88
gfx950,256,48,32,6144,False,torch.bfloat16,torch.bfloat16,False,False,torch,0,0,8.0695,native,0.0,2.34,122.2
gfx950,256,64,32,6144,False,torch.bfloat16,torch.bfloat16,False,False,torch,0,0,8.1827,native,0.0,3.08,144.66
gfx950,256,128,32,6144,False,torch.bfloat16,torch.bfloat16,False,False,torch,0,0,8.2742,native,0.0,6.08,238.61
gfx950,256,256,32,6144,False,torch.bfloat16,torch.bfloat16,False,False,torch,0,0,11.6185,native,0.0,8.66,306.01
gfx950,256,16384,32,6144,False,torch.bfloat16,torch.bfloat16,False,False,torch,0,0,43.456,native,0.0,148.25,4666.06
gfx950,256,1,64,7168,False,torch.bfloat16,torch.bfloat16,False,False,flydsl,1949,8,4.6345,flydsl_gemm6_abf16_wbf16_bf16_t16x64x128_split_k8_block_m_warp1_block_n_warp1_block_k_warp2_async_copyTrue_b_to_ldsTrue_b_preshuffleFalse_c_to_ldsFalse_gfx950,0.0156,0.2,201.09
gfx950,256,2,64,7168,False,torch.bfloat16,torch.bfloat16,False,False,flydsl,2229,8,4.9674,flydsl_gemm7_abf16_wbf16_bf16_t16x64x128_split_k8_block_m_warp1_block_n_warp1_block_k_warp2_async_copyTrue_b_to_ldsTrue_b_preshuffleFalse_c_to_ldsFalse_gfx950,0.0078,0.37,190.53
gfx950,256,4,64,7168,False,torch.bfloat16,torch.bfloat16,False,False,asm,1,14,5.2346,_ZN5aiter39bf16gemm_fp32bf16_tn_32x64_splitk_cleanE,0.0195,0.7,186.33
gfx950,256,16,64,7168,False,torch.bfloat16,torch.bfloat16,False,False,flydsl,1950,8,5.1764,flydsl_gemm6_abf16_wbf16_bf16_t16x64x128_split_k8_block_m_warp1_block_n_warp2_block_k_warp1_async_copyTrue_b_to_ldsTrue_b_preshuffleFalse_c_to_ldsFalse_gfx950,0.0273,2.84,221.96
gfx950,256,32,64,7168,False,torch.bfloat16,torch.bfloat16,False,False,flydsl,2226,7,5.2257,flydsl_gemm7_abf16_wbf16_bf16_t16x64x128_split_k7_block_m_warp1_block_n_warp1_block_k_warp2_async_copyTrue_b_to_ldsTrue_b_preshuffleFalse_c_to_ldsFalse_gfx950,0.0254,5.62,264.15
gfx950,256,48,64,7168,False,torch.bfloat16,torch.bfloat16,False,False,flydsl,1949,8,5.2045,flydsl_gemm6_abf16_wbf16_bf16_t16x64x128_split_k8_block_m_warp1_block_n_warp1_block_k_warp2_async_copyTrue_b_to_ldsTrue_b_preshuffleFalse_c_to_ldsFalse_gfx950,0.0303,8.46,309.69
gfx950,256,64,64,7168,False,torch.bfloat16,torch.bfloat16,False,False,flydsl,2884,8,5.3558,flydsl_gemm7_abf16_wbf16_bf16_t16x64x128_split_k8_block_m_warp1_block_n_warp1_block_k_warp2_async_copyTrue_b_to_ldsTrue_b_preshuffleFalse_c_to_ldsFalse_gfx950,0.03,10.96,344.15
gfx950,256,80,64,7168,False,torch.bfloat16,torch.bfloat16,False,False,flydsl,2885,8,5.2201,flydsl_gemm7_abf16_wbf16_bf16_t16x64x128_split_k8_block_m_warp1_block_n_warp2_block_k_warp1_async_copyTrue_b_to_ldsTrue_b_preshuffleFalse_c_to_ldsFalse_gfx950,0.0211,14.06,397.43
gfx950,256,96,64,7168,False,torch.bfloat16,torch.bfloat16,False,False,flydsl,2605,8,5.5938,flydsl_gemm6_abf16_wbf16_bf16_t16x64x128_split_k8_block_m_warp1_block_n_warp2_block_k_warp1_async_copyTrue_b_to_ldsTrue_b_preshuffleFalse_c_to_ldsFalse_gfx950,0.02,15.75,412.25
gfx950,256,112,64,7168,False,torch.bfloat16,torch.bfloat16,False,False,flydsl,2605,8,5.6367,flydsl_gemm6_abf16_wbf16_bf16_t16x64x128_split_k8_block_m_warp1_block_n_warp2_block_k_warp1_async_copyTrue_b_to_ldsTrue_b_preshuffleFalse_c_to_ldsFalse_gfx950,0.0209,18.23,450.17
gfx950,256,128,64,7168,False,torch.bfloat16,torch.bfloat16,False,False,flydsl,2974,8,5.9966,flydsl_gemm6_abf16_wbf16_bf16_t16x64x128_split_k8_block_m_warp1_block_n_warp1_block_k_warp2_async_copyTrue_b_to_ldsTrue_b_preshuffleFalse_c_to_ldsFalse_gfx950,0.0284,19.58,461.74
gfx950,256,136,64,7168,False,torch.bfloat16,torch.bfloat16,False,False,asm,7,16,7.4413,_ZN5aiter39bf16gemm_fp32bf16_tn_80x64_splitk_cleanE,0.0315,16.77,387.65
gfx950,256,152,64,7168,False,torch.bfloat16,torch.bfloat16,False,False,asm,3,14,7.9176,_ZN5aiter39bf16gemm_fp32bf16_tn_48x64_splitk_cleanE,0.0287,17.61,393.56
gfx950,256,168,64,7168,False,torch.bfloat16,torch.bfloat16,False,False,asm,5,16,7.8153,_ZN5aiter39bf16gemm_fp32bf16_tn_64x64_splitk_cleanE,0.0294,19.72,428.32
gfx950,256,184,64,7168,False,torch.bfloat16,torch.bfloat16,False,False,asm,5,14,8.0598,_ZN5aiter39bf16gemm_fp32bf16_tn_64x64_splitk_cleanE,0.028,20.95,444.04
gfx950,256,200,64,7168,False,torch.bfloat16,torch.bfloat16,False,False,asm,7,16,8.4365,_ZN5aiter39bf16gemm_fp32bf16_tn_80x64_splitk_cleanE,0.0313,21.75,451.65
gfx950,256,216,64,7168,False,torch.bfloat16,torch.bfloat16,False,False,asm,7,14,8.2612,_ZN5aiter39bf16gemm_fp32bf16_tn_80x64_splitk_cleanE,0.0277,23.99,489.24
gfx950,256,232,64,7168,False,torch.bfloat16,torch.bfloat16,False,False,asm,7,16,8.2896,_ZN5aiter39bf16gemm_fp32bf16_tn_80x64_splitk_cleanE,0.032,25.68,515.48
gfx950,256,248,64,7168,False,torch.bfloat16,torch.bfloat16,False,False,asm,8,16,8.578,_ZN5aiter39bf16gemm_fp32bf16_tn_96x64_splitk_cleanE,0.0341,26.53,525.13
gfx950,256,272,64,7168,False,torch.bfloat16,torch.bfloat16,False,False,asm,8,16,8.7847,_ZN5aiter39bf16gemm_fp32bf16_tn_96x64_splitk_cleanE,0.0301,28.41,552.29
gfx950,256,304,64,7168,False,torch.bfloat16,torch.bfloat16,False,False,asm,7,16,9.6816,_ZN5aiter39bf16gemm_fp32bf16_tn_80x64_splitk_cleanE,0.0312,28.81,548.93
gfx950,256,336,64,7168,False,torch.bfloat16,torch.bfloat16,False,False,asm,8,16,9.3696,_ZN5aiter39bf16gemm_fp32bf16_tn_96x64_splitk_cleanE,0.0304,32.9,616.61
gfx950,256,368,64,7168,False,torch.bfloat16,torch.bfloat16,False,False,asm,8,16,9.4457,_ZN5aiter39bf16gemm_fp32bf16_tn_96x64_splitk_cleanE,0.0294,35.75,660.65
gfx950,256,400,64,7168,False,torch.bfloat16,torch.bfloat16,False,False,asm,7,16,9.6093,_ZN5aiter39bf16gemm_fp32bf16_tn_80x64_splitk_cleanE,0.0307,38.19,697.56
gfx950,256,432,64,7168,False,torch.bfloat16,torch.bfloat16,False,False,asm,8,16,9.9904,_ZN5aiter39bf16gemm_fp32bf16_tn_96x64_splitk_cleanE,0.0296,39.67,717.28
gfx950,256,464,64,7168,False,torch.bfloat16,torch.bfloat16,False,False,asm,7,16,10.1968,_ZN5aiter39bf16gemm_fp32bf16_tn_80x64_splitk_cleanE,0.0297,41.75,748.16
gfx950,256,496,64,7168,False,torch.bfloat16,torch.bfloat16,False,False,asm,7,14,10.7217,_ZN5aiter39bf16gemm_fp32bf16_tn_80x64_splitk_cleanE,0.0285,42.44,754.7
gfx950,256,544,64,7168,False,torch.bfloat16,torch.bfloat16,False,False,flydsl,3502,7,8.0423,flydsl_gemm8_abf16_wbf16_bf16_t16x64x64_split_k7_block_m_warp1_block_n_warp2_block_k_warp1_async_copyTrue_b_to_ldsTrue_b_preshuffleFalse_c_to_ldsFalse_gfx950,0.0205,62.06,1092.46
gfx950,256,576,64,7168,False,torch.bfloat16,torch.bfloat16,False,False,flydsl,2987,7,8.0971,flydsl_gemm6_abf16_wbf16_bf16_t16x64x64_split_k7_block_m_warp1_block_n_warp2_block_k_warp1_async_copyTrue_b_to_ldsTrue_b_preshuffleFalse_c_to_ldsFalse_gfx950,0.019,65.27,1142.23
gfx950,256,608,64,7168,False,torch.bfloat16,torch.bfloat16,False,False,flydsl,2042,8,8.2383,flydsl_gemm4_abf16_wbf16_bf16_t32x64x128_split_k8_block_m_warp1_block_n_warp4_block_k_warp1_async_copyTrue_b_to_ldsTrue_b_preshuffleFalse_c_to_ldsFalse_gfx950,0.0215,67.71,1178.84
gfx950,256,640,64,7168,False,torch.bfloat16,torch.bfloat16,False,False,flydsl,3312,8,8.5049,flydsl_gemm7_abf16_wbf16_bf16_t32x64x64_split_k8_block_m_warp1_block_n_warp4_block_k_warp1_async_copyTrue_b_to_ldsTrue_b_preshuffleFalse_c_to_ldsFalse_gfx950,0.021,69.04,1196.31
gfx950,256,672,64,7168,False,torch.bfloat16,torch.bfloat16,False,False,flydsl,3538,7,8.503,flydsl_gemm8_abf16_wbf16_bf16_t32x64x64_split_k7_block_m_warp1_block_n_warp4_block_k_warp1_async_copyTrue_b_to_ldsTrue_b_preshuffleFalse_c_to_ldsFalse_gfx950,0.0197,72.51,1251.01
gfx950,256,704,64,7168,False,torch.bfloat16,torch.bfloat16,False,False,flydsl,2033,7,8.3665,flydsl_gemm4_abf16_wbf16_bf16_t32x64x128_split_k7_block_m_warp1_block_n_warp4_block_k_warp1_async_copyTrue_b_to_ldsTrue_b_preshuffleFalse_c_to_ldsFalse_gfx950,0.0195,77.2,1326.74
gfx950,256,736,64,7168,False,torch.bfloat16,torch.bfloat16,False,False,flydsl,2033,7,8.3686,flydsl_gemm4_abf16_wbf16_bf16_t32x64x128_split_k7_block_m_warp1_block_n_warp4_block_k_warp1_async_copyTrue_b_to_ldsTrue_b_preshuffleFalse_c_to_ldsFalse_gfx950,0.0198,80.69,1381.71
gfx950,256,768,64,7168,False,torch.bfloat16,torch.bfloat16,False,False,flydsl,2033,7,8.7819,flydsl_gemm4_abf16_wbf16_bf16_t32x64x128_split_k7_block_m_warp1_block_n_warp4_block_k_warp1_async_copyTrue_b_to_ldsTrue_b_preshuffleFalse_c_to_ldsFalse_gfx950,0.0198,80.24,1369.39
gfx950,256,800,64,7168,False,torch.bfloat16,torch.bfloat16,False,False,flydsl,2042,8,8.7626,flydsl_gemm4_abf16_wbf16_bf16_t32x64x128_split_k8_block_m_warp1_block_n_warp4_block_k_warp1_async_copyTrue_b_to_ldsTrue_b_preshuffleFalse_c_to_ldsFalse_gfx950,0.022,83.77,1425.23
gfx950,256,832,64,7168,False,torch.bfloat16,torch.bfloat16,False,False,flydsl,2560,7,9.1384,flydsl_gemm5_abf16_wbf16_bf16_t32x64x128_split_k7_block_m_warp2_block_n_warp1_block_k_warp2_async_copyTrue_b_to_ldsTrue_b_preshuffleFalse_c_to_ldsFalse_gfx950,0.0265,83.53,1417.27
gfx950,256,864,64,7168,False,torch.bfloat16,torch.bfloat16,False,False,flydsl,2036,7,9.0782,flydsl_gemm4_abf16_wbf16_bf16_t32x64x128_split_k7_block_m_warp2_block_n_warp2_block_k_warp1_async_copyTrue_b_to_ldsTrue_b_preshuffleFalse_c_to_ldsFalse_gfx950,0.0196,87.32,1477.65
gfx950,256,896,64,7168,False,torch.bfloat16,torch.bfloat16,False,False,flydsl,2036,7,9.162,flydsl_gemm4_abf16_wbf16_bf16_t32x64x128_split_k7_block_m_warp2_block_n_warp2_block_k_warp1_async_copyTrue_b_to_ldsTrue_b_preshuffleFalse_c_to_ldsFalse_gfx950,0.0194,89.73,1514.65
gfx950,256,928,64,7168,False,torch.bfloat16,torch.bfloat16,False,False,flydsl,2035,7,9.2709,flydsl_gemm4_abf16_wbf16_bf16_t32x64x128_split_k7_block_m_warp2_block_n_warp1_block_k_warp2_async_copyTrue_b_to_ldsTrue_b_preshuffleFalse_c_to_ldsFalse_gfx950,0.0266,91.84,1546.79
gfx950,256,960,64,7168,False,torch.bfloat16,torch.bfloat16,False,False,flydsl,2557,7,9.5174,flydsl_gemm5_abf16_wbf16_bf16_t32x64x128_split_k7_block_m_warp1_block_n_warp2_block_k_warp2_async_copyTrue_b_to_ldsTrue_b_preshuffleFalse_c_to_ldsFalse_gfx950,0.0266,92.55,1555.36
gfx950,256,992,64,7168,False,torch.bfloat16,torch.bfloat16,False,False,flydsl,2036,7,9.501,flydsl_gemm4_abf16_wbf16_bf16_t32x64x128_split_k7_block_m_warp2_block_n_warp2_block_k_warp1_async_copyTrue_b_to_ldsTrue_b_preshuffleFalse_c_to_ldsFalse_gfx950,0.0195,95.8,1606.76
gfx950,256,996,64,7168,False,torch.bfloat16,torch.bfloat16,False,False,asm,8,10,13.0932,_ZN5aiter39bf16gemm_fp32bf16_tn_96x64_splitk_cleanE,0.0239,69.79,1170.35
gfx950,256,1088,64,7168,False,torch.bfloat16,torch.bfloat16,False,False,flydsl,2036,7,9.952,flydsl_gemm4_abf16_wbf16_bf16_t32x64x128_split_k7_block_m_warp2_block_n_warp2_block_k_warp1_async_copyTrue_b_to_ldsTrue_b_preshuffleFalse_c_to_ldsFalse_gfx950,0.02,100.31,1673.47
gfx950,256,1152,64,7168,False,torch.bfloat16,torch.bfloat16,False,False,flydsl,2036,7,10.195,flydsl_gemm4_abf16_wbf16_bf16_t32x64x128_split_k7_block_m_warp2_block_n_warp2_block_k_warp1_async_copyTrue_b_to_ldsTrue_b_preshuffleFalse_c_to_ldsFalse_gfx950,0.0195,103.67,1724.38
gfx950,256,1216,64,7168,False,torch.bfloat16,torch.bfloat16,False,False,flydsl,1411,4,10.8133,flydsl_gemm3_abf16_wbf16_bf16_t32x64x256_split_k4_block_m_warp1_block_n_warp4_block_k_warp1_async_copyTrue_b_to_ldsTrue_b_preshuffleFalse_c_to_ldsFalse_gfx950,0.0136,103.18,1711.39
gfx950,256,1280,64,7168,False,torch.bfloat16,torch.bfloat16,False,False,flydsl,3562,7,11.087,flydsl_gemm8_abf16_wbf16_bf16_t48x64x64_split_k7_block_m_warp1_block_n_warp2_block_k_warp1_async_copyTrue_b_to_ldsTrue_b_preshuffleFalse_c_to_ldsFalse_gfx950,0.0197,105.93,1752.63
gfx950,256,1344,64,7168,False,torch.bfloat16,torch.bfloat16,False,False,flydsl,2551,4,11.006,flydsl_gemm5_abf16_wbf16_bf16_t32x64x128_split_k4_block_m_warp2_block_n_warp1_block_k_warp2_async_copyTrue_b_to_ldsTrue_b_preshuffleFalse_c_to_ldsFalse_gfx950,0.0212,112.04,1849.64
gfx950,256,1408,64,7168,False,torch.bfloat16,torch.bfloat16,False,False,flydsl,2551,4,11.3798,flydsl_gemm5_abf16_wbf16_bf16_t32x64x128_split_k4_block_m_warp2_block_n_warp1_block_k_warp2_async_copyTrue_b_to_ldsTrue_b_preshuffleFalse_c_to_ldsFalse_gfx950,0.022,113.52,1870.23
gfx950,256,1472,64,7168,False,torch.bfloat16,torch.bfloat16,False,False,flydsl,2027,4,11.2311,flydsl_gemm4_abf16_wbf16_bf16_t32x64x128_split_k4_block_m_warp2_block_n_warp2_block_k_warp1_async_copyTrue_b_to_ldsTrue_b_preshuffleFalse_c_to_ldsFalse_gfx950,0.0144,120.25,1977.41
gfx950,256,1536,64,7168,False,torch.bfloat16,torch.bfloat16,False,False,flydsl,2023,4,11.5785,flydsl_gemm4_abf16_wbf16_bf16_t32x64x128_split_k4_block_m_warp1_block_n_warp2_block_k_warp2_async_copyTrue_b_to_ldsTrue_b_preshuffleFalse_c_to_ldsFalse_gfx950,0.0215,121.72,1998.03
gfx950,256,1600,64,7168,False,torch.bfloat16,torch.bfloat16,False,False,flydsl,2024,4,11.6405,flydsl_gemm4_abf16_wbf16_bf16_t32x64x128_split_k4_block_m_warp1_block_n_warp4_block_k_warp1_async_copyTrue_b_to_ldsTrue_b_preshuffleFalse_c_to_ldsFalse_gfx950,0.0139,126.11,2066.91
gfx950,256,1664,64,7168,False,torch.bfloat16,torch.bfloat16,False,False,flydsl,2551,4,11.9241,flydsl_gemm5_abf16_wbf16_bf16_t32x64x128_split_k4_block_m_warp2_block_n_warp1_block_k_warp2_async_copyTrue_b_to_ldsTrue_b_preshuffleFalse_c_to_ldsFalse_gfx950,0.0218,128.04,2095.39
gfx950,256,1728,64,7168,False,torch.bfloat16,torch.bfloat16,False,False,flydsl,2548,4,11.831,flydsl_gemm5_abf16_wbf16_bf16_t32x64x128_split_k4_block_m_warp1_block_n_warp2_block_k_warp2_async_copyTrue_b_to_ldsTrue_b_preshuffleFalse_c_to_ldsFalse_gfx950,0.0217,134.01,2190.12
gfx950,256,1792,64,7168,False,torch.bfloat16,torch.bfloat16,False,False,flydsl,2548,4,12.3336,flydsl_gemm5_abf16_wbf16_bf16_t32x64x128_split_k4_block_m_warp1_block_n_warp2_block_k_warp2_async_copyTrue_b_to_ldsTrue_b_preshuffleFalse_c_to_ldsFalse_gfx950,0.0208,133.31,2175.93
gfx950,256,1856,64,7168,False,torch.bfloat16,torch.bfloat16,False,False,flydsl,2023,4,12.2171,flydsl_gemm4_abf16_wbf16_bf16_t32x64x128_split_k4_block_m_warp1_block_n_warp2_block_k_warp2_async_copyTrue_b_to_ldsTrue_b_preshuffleFalse_c_to_ldsFalse_gfx950,0.0209,139.39,2272.45
gfx950,256,1920,64,7168,False,torch.bfloat16,torch.bfloat16,False,False,flydsl,2024,4,12.5809,flydsl_gemm4_abf16_wbf16_bf16_t32x64x128_split_k4_block_m_warp1_block_n_warp4_block_k_warp1_async_copyTrue_b_to_ldsTrue_b_preshuffleFalse_c_to_ldsFalse_gfx950,0.0134,140.02,2280.31
gfx950,256,1984,64,7168,False,torch.bfloat16,torch.bfloat16,False,False,flydsl,2548,4,12.7049,flydsl_gemm5_abf16_wbf16_bf16_t32x64x128_split_k4_block_m_warp1_block_n_warp2_block_k_warp2_async_copyTrue_b_to_ldsTrue_b_preshuffleFalse_c_to_ldsFalse_gfx950,0.021,143.28,2330.92
gfx950,256,2048,64,7168,False,torch.bfloat16,torch.bfloat16,False,False,flydsl,2024,4,13.0756,flydsl_gemm4_abf16_wbf16_bf16_t32x64x128_split_k4_block_m_warp1_block_n_warp4_block_k_warp1_async_copyTrue_b_to_ldsTrue_b_preshuffleFalse_c_to_ldsFalse_gfx950,0.0133,143.71,2335.63
gfx950,256,2767,64,7168,False,torch.bfloat16,torch.bfloat16,False,False,torch,0,0,0.0,native,0.0,0.0,0.0
gfx950,256,4096,64,7168,False,torch.bfloat16,torch.bfloat16,False,False,asm,8,5,18.6483,_ZN5aiter39bf16gemm_fp32bf16_tn_96x64_splitk_cleanE,0.0161,201.52,3226.14
gfx950,256,4955,64,7168,False,torch.bfloat16,torch.bfloat16,False,False,asm,8,4,21.9901,_ZN5aiter39bf16gemm_fp32bf16_tn_96x64_splitk_cleanE,0.0135,206.74,3300.88
gfx950,256,6144,64,7168,False,torch.bfloat16,torch.bfloat16,False,False,asm,8,4,23.4754,_ZN5aiter39bf16gemm_fp32bf16_tn_96x64_splitk_cleanE,0.0136,240.13,3824.61
gfx950,256,7160,64,7168,False,torch.bfloat16,torch.bfloat16,False,False,asm,8,3,27.0845,_ZN5aiter39bf16gemm_fp32bf16_tn_96x64_splitk_cleanE,0.0106,242.55,3857.55
gfx950,256,8192,64,7168,False,torch.bfloat16,torch.bfloat16,False,False,asm,5,2,32.7898,_ZN5aiter39bf16gemm_fp32bf16_tn_64x64_splitk_cleanE,0.006,229.22,3641.58
gfx950,256,10240,64,7168,False,torch.bfloat16,torch.bfloat16,False,False,torch,0,0,31.9022,native,0.0,294.5,4671.43
gfx950,256,12288,64,7168,False,torch.bfloat16,torch.bfloat16,False,False,asm,8,2,37.7359,_ZN5aiter39bf16gemm_fp32bf16_tn_96x64_splitk_cleanE,0.0061,298.77,4734.25
gfx950,256,14336,64,7168,False,torch.bfloat16,torch.bfloat16,False,False,flydsl,2661,1,42.8973,flydsl_gemm5_abf16_wbf16_bf16_t64x64x128_split_k1_block_m_warp4_block_n_warp1_block_k_warp2_async_copyTrue_b_to_ldsTrue_b_preshuffleFalse_c_to_ldsFalse_gfx950,0.0059,306.62,4855.16
gfx950,256,16384,64,7168,False,torch.bfloat16,torch.bfloat16,False,False,flydsl,2137,1,45.0666,flydsl_gemm4_abf16_wbf16_bf16_t64x64x128_split_k1_block_m_warp4_block_n_warp2_block_k_warp1_async_copyTrue_b_to_ldsTrue_b_preshuffleFalse_c_to_ldsFalse_gfx950,0.0,333.56,5278.76
gfx950,256,32768,64,7168,False,torch.bfloat16,torch.bfloat16,False,False,flydsl,1803,1,80.6804,flydsl_gemm4_abf16_wbf16_bf16_t128x64x64_split_k1_block_m_warp4_block_n_warp1_block_k_warp1_async_copyTrue_b_to_ldsTrue_b_preshuffleFalse_c_to_ldsFalse_gfx950,0.0,372.64,5885.86
gfx950,256,1,100,5120,False,torch.bfloat16,torch.bfloat16,False,False,triton,0,0,24.2594,auto,0.0,0.04,42.64
gfx950,256,16,100,5120,False,torch.bfloat16,torch.bfloat16,False,False,triton,0,0,18.9179,auto,0.0,0.87,62.96
gfx950,256,32,100,5120,False,torch.bfloat16,torch.bfloat16,False,False,triton,0,0,20.665,auto,0.0,1.59,65.72
gfx950,256,64,100,5120,False,torch.bfloat16,torch.bfloat16,False,False,triton,0,0,21.9084,auto,0.0,2.99,77.24
gfx950,256,128,100,5120,False,torch.bfloat16,torch.bfloat16,False,False,triton,0,0,31.8414,auto,0.0,4.12,74.13
gfx950,256,256,100,5120,False,torch.bfloat16,torch.bfloat16,False,False,triton,0,0,49.0384,auto,0.0,5.35,75.38
gfx950,256,512,100,5120,False,torch.bfloat16,torch.bfloat16,False,False,triton,0,0,50.1618,auto,0.0,10.45,126.97
gfx950,256,1024,100,5120,False,torch.bfloat16,torch.bfloat16,False,False,triton,0,0,132.7156,auto,0.0,7.9,88.27
gfx950,256,2048,100,5120,False,torch.bfloat16,torch.bfloat16,False,False,triton,0,0,131.8115,auto,0.0,15.91,169.98
gfx950,256,4096,100,5120,False,torch.bfloat16,torch.bfloat16,False,False,triton,0,0,101.6103,auto,0.0,41.28,430.92
gfx950,256,8192,100,5120,False,torch.bfloat16,torch.bfloat16,False,False,triton,0,0,101.715,auto,0.0,82.47,850.89
gfx950,256,16384,100,5120,False,torch.bfloat16,torch.bfloat16,False,False,triton,0,0,103.0716,auto,0.0,162.77,1669.45
gfx950,256,32768,100,5120,False,torch.bfloat16,torch.bfloat16,False,False,triton,0,0,110.6268,auto,0.0,303.31,3101.62
gfx950,256,1,128,2880,True,torch.bfloat16,torch.bfloat16,False,False,flydsl,3837,5,4.1114,flydsl_gemm8_abf16_wbf16_bf16_t16x64x64_split_k5_block_m_warp1_block_n_warp2_block_k_warp1_async_copyTrue_b_to_ldsTrue_b_preshuffleFalse_c_to_ldsFalse_gfx950,0.0312,0.18,180.79
gfx950,256,1,128,6144,False,torch.bfloat16,torch.bfloat16,False,False,skinny,2,0,3.5904,sol2,0.0,0.44,441.57
gfx950,256,2,128,2880,True,torch.bfloat16,torch.bfloat16,False,False,flydsl,2015,9,4.0342,flydsl_gemm5_abf16_wbf16_bf16_t16x64x64_split_k9_block_m_warp1_block_n_warp2_block_k_warp1_async_copyTrue_b_to_ldsTrue_b_preshuffleFalse_c_to_ldsFalse_gfx950,0.0117,0.37,185.74
gfx950,256,2,128,6144,False,torch.bfloat16,torch.bfloat16,False,False,flydsl,5475,12,4.6306,flydsl_gemm7_abf16_wbf16_bf16_t16x64x64_split_k12_block_m_warp1_block_n_warp1_block_k_warp2_async_copyTrue_b_to_ldsTrue_b_preshuffleFalse_c_to_ldsFalse_gfx950,0.0273,0.68,345.09
gfx950,256,4,128,2880,True,torch.bfloat16,torch.bfloat16,False,False,flydsl,2015,9,4.1748,flydsl_gemm5_abf16_wbf16_bf16_t16x64x64_split_k9_block_m_warp1_block_n_warp2_block_k_warp1_async_copyTrue_b_to_ldsTrue_b_preshuffleFalse_c_to_ldsFalse_gfx950,0.0195,0.71,182.37
gfx950,256,4,128,6144,False,torch.bfloat16,torch.bfloat16,False,False,flydsl,4881,12,4.5863,flydsl_gemm6_abf16_wbf16_bf16_t16x64x64_split_k12_block_m_warp1_block_n_warp2_block_k_warp1_async_copyTrue_b_to_ldsTrue_b_preshuffleFalse_c_to_ldsFalse_gfx950,0.0215,1.37,353.89
gfx950,256,8,128,2880,True,torch.bfloat16,torch.bfloat16,False,False,flydsl,2013,9,4.1051,flydsl_gemm5_abf16_wbf16_bf16_t16x64x64_split_k9_block_m_warp1_block_n_warp1_block_k_warp2_async_copyTrue_b_to_ldsTrue_b_preshuffleFalse_c_to_ldsFalse_gfx950,0.0186,1.44,191.32
gfx950,256,8,128,6144,False,torch.bfloat16,torch.bfloat16,False,False,flydsl,4881,12,4.5522,flydsl_gemm6_abf16_wbf16_bf16_t16x64x64_split_k12_block_m_warp1_block_n_warp2_block_k_warp1_async_copyTrue_b_to_ldsTrue_b_preshuffleFalse_c_to_ldsFalse_gfx950,0.0205,2.76,367.56
gfx950,256,16,128,2880,True,torch.bfloat16,torch.bfloat16,False,False,flydsl,1357,9,4.3162,flydsl_gemm4_abf16_wbf16_bf16_t16x64x64_split_k9_block_m_warp1_block_n_warp1_block_k_warp2_async_copyTrue_b_to_ldsTrue_b_preshuffleFalse_c_to_ldsFalse_gfx950,0.0229,2.73,193.12
gfx950,256,16,128,6144,False,torch.bfloat16,torch.bfloat16,False,False,flydsl,5888,12,4.7249,flydsl_gemm8_abf16_wbf16_bf16_t16x64x64_split_k12_block_m_warp1_block_n_warp1_block_k_warp2_async_copyTrue_b_to_ldsTrue_b_preshuffleFalse_c_to_ldsFalse_gfx950,0.0342,5.33,375.37
gfx950,256,32,128,2880,True,torch.bfloat16,torch.bfloat16,False,False,flydsl,2015,9,4.1715,flydsl_gemm5_abf16_wbf16_bf16_t16x64x64_split_k9_block_m_warp1_block_n_warp2_block_k_warp1_async_copyTrue_b_to_ldsTrue_b_preshuffleFalse_c_to_ldsFalse_gfx950,0.0164,5.66,222.89
gfx950,256,32,128,6144,False,torch.bfloat16,torch.bfloat16,False,False,flydsl,3082,12,4.7031,flydsl_gemm4_abf16_wbf16_bf16_t16x64x128_split_k12_block_m_warp1_block_n_warp2_block_k_warp1_async_copyTrue_b_to_ldsTrue_b_preshuffleFalse_c_to_ldsFalse_gfx950,0.0244,10.7,419.78
gfx950,256,48,128,2880,True,torch.bfloat16,torch.bfloat16,False,False,flydsl,2159,9,4.3526,flydsl_gemm5_abf16_wbf16_bf16_t32x64x64_split_k9_block_m_warp2_block_n_warp2_block_k_warp1_async_copyTrue_b_to_ldsTrue_b_preshuffleFalse_c_to_ldsFalse_gfx950,0.0184,8.13,235.73
gfx950,256,48,128,6144,False,torch.bfloat16,torch.bfloat16,False,False,flydsl,4080,8,4.7738,flydsl_gemm5_abf16_wbf16_bf16_t16x64x128_split_k8_block_m_warp1_block_n_warp2_block_k_warp1_async_copyTrue_b_to_ldsTrue_b_preshuffleFalse_c_to_ldsFalse_gfx950,0.02,15.81,455.61
gfx950,256,64,128,2880,True,torch.bfloat16,torch.bfloat16,False,False,flydsl,3433,9,4.397,flydsl_gemm5_abf16_wbf16_bf16_t32x64x64_split_k9_block_m_warp1_block_n_warp4_block_k_warp1_async_copyTrue_b_to_ldsTrue_b_preshuffleFalse_c_to_ldsFalse_gfx950,0.0164,10.73,255.24
gfx950,256,64,128,6144,False,torch.bfloat16,torch.bfloat16,False,False,flydsl,3063,12,5.0616,flydsl_gemm3_abf16_wbf16_bf16_t32x64x128_split_k12_block_m_warp1_block_n_warp2_block_k_warp2_async_copyTrue_b_to_ldsTrue_b_preshuffleFalse_c_to_ldsFalse_gfx950,0.0328,19.89,469.35
gfx950,256,80,128,2880,True,torch.bfloat16,torch.bfloat16,False,False,flydsl,3433,9,4.3684,flydsl_gemm5_abf16_wbf16_bf16_t32x64x64_split_k9_block_m_warp1_block_n_warp4_block_k_warp1_async_copyTrue_b_to_ldsTrue_b_preshuffleFalse_c_to_ldsFalse_gfx950,0.0174,13.5,278.95
gfx950,256,96,128,2880,True,torch.bfloat16,torch.bfloat16,False,False,flydsl,3431,9,4.5682,flydsl_gemm5_abf16_wbf16_bf16_t32x64x64_split_k9_block_m_warp1_block_n_warp2_block_k_warp2_async_copyTrue_b_to_ldsTrue_b_preshuffleFalse_c_to_ldsFalse_gfx950,0.023,15.49,287.82
gfx950,256,112,128,2880,True,torch.bfloat16,torch.bfloat16,False,False,flydsl,4953,5,4.5743,flydsl_gemm7_abf16_wbf16_bf16_t16x64x64_split_k5_block_m_warp1_block_n_warp2_block_k_warp1_async_copyTrue_b_to_ldsTrue_b_preshuffleFalse_c_to_ldsFalse_gfx950,0.0115,18.05,308.48
gfx950,256,128,128,2880,True,torch.bfloat16,torch.bfloat16,False,False,flydsl,5835,5,4.7799,flydsl_gemm7_abf16_wbf16_bf16_t16x64x64_split_k5_block_m_warp1_block_n_warp1_block_k_warp2_async_copyTrue_b_to_ldsTrue_b_preshuffleFalse_c_to_ldsFalse_gfx950,0.0208,19.74,315.35
gfx950,256,128,128,6144,False,torch.bfloat16,torch.bfloat16,False,False,flydsl,19522,8,6.3659,flydsl_gemm6_abf16_wbf16_bf16_t16x64x128_split_k8_block_m_warp1_block_n_warp2_block_k_warp1_async_copyTrue_b_to_ldsTrue_b_preshuffleFalse_c_to_ldsFalse_gfx950,0.0206,31.63,499.3
gfx950,256,256,128,2880,True,torch.bfloat16,torch.bfloat16,False,False,flydsl,6673,5,5.3465,flydsl_gemm8_abf16_wbf16_bf16_t32x64x64_split_k5_block_m_warp1_block_n_warp2_block_k_warp2_async_copyTrue_b_to_ldsTrue_b_preshuffleFalse_c_to_ldsFalse_gfx950,0.0184,35.3,425.96
gfx950,256,256,128,6144,False,torch.bfloat16,torch.bfloat16,False,False,flydsl,6439,8,7.1962,flydsl_gemm5_abf16_wbf16_bf16_t16x64x128_split_k8_block_m_warp1_block_n_warp2_block_k_warp1_async_copyTrue_b_to_ldsTrue_b_preshuffleFalse_c_to_ldsFalse_gfx950,0.0221,55.95,664.81
gfx950,256,16384,128,6144,False,torch.bfloat16,torch.bfloat16,False,False,flydsl,4028,1,55.4299,flydsl_gemm3_abf16_wbf16_bf16_t64x128x128_split_k1_block_m_warp2_block_n_warp4_block_k_warp1_async_copyTrue_b_to_ldsTrue_b_preshuffleFalse_c_to_ldsFalse_gfx950,0.0,464.91,3736.14
gfx950,256,64,192,1024,False,torch.bfloat16,torch.bfloat16,False,False,flydsl,2571,4,3.8278,flydsl_gemm4_abf16_wbf16_bf16_t16x64x64_split_k4_block_m_warp1_block_n_warp1_block_k_warp1_async_copyTrue_b_to_ldsTrue_b_preshuffleFalse_c_to_ldsFalse_gfx950,0.0065,6.57,143.39
gfx950,256,1,200,5120,False,torch.bfloat16,torch.bfloat16,False,False,triton,0,0,24.9311,auto,0.0,0.08,82.57
gfx950,256,16,200,5120,False,torch.bfloat16,torch.bfloat16,False,False,triton,0,0,19.4155,auto,0.0,1.69,114.25
gfx950,256,32,200,5120,False,torch.bfloat16,torch.bfloat16,False,False,triton,0,0,21.489,auto,0.0,3.05,111.15
gfx950,256,64,200,5120,False,torch.bfloat16,torch.bfloat16,False,False,triton,0,0,22.9195,auto,0.0,5.72,119.07
gfx950,256,128,200,5120,False,torch.bfloat16,torch.bfloat16,False,False,triton,0,0,33.6484,auto,0.0,7.79,101.34
gfx950,256,256,200,5120,False,torch.bfloat16,torch.bfloat16,False,False,triton,0,0,48.3964,auto,0.0,10.83,98.6
gfx950,256,512,200,5120,False,torch.bfloat16,torch.bfloat16,False,False,triton,0,0,46.1295,auto,0.0,22.73,162.49
gfx950,256,1024,200,5120,False,torch.bfloat16,torch.bfloat16,False,False,triton,0,0,153.9655,auto,0.0,13.62,84.07
gfx950,256,2048,200,5120,False,torch.bfloat16,torch.bfloat16,False,False,triton,0,0,152.8232,auto,0.0,27.45,155.99
gfx950,256,4096,200,5120,False,torch.bfloat16,torch.bfloat16,False,False,triton,0,0,106.0943,auto,0.0,79.07,430.08
gfx950,256,8192,200,5120,False,torch.bfloat16,torch.bfloat16,False,False,triton,0,0,107.2911,auto,0.0,156.37,831.48
gfx950,256,16384,200,5120,False,torch.bfloat16,torch.bfloat16,False,False,triton,0,0,109.2356,auto,0.0,307.17,1614.62
gfx950,256,32768,200,5120,False,torch.bfloat16,torch.bfloat16,False,False,triton,0,0,120.4976,auto,0.0,556.93,2910.43
gfx950,256,1,256,6144,False,torch.bfloat16,torch.bfloat16,False,False,skinny,2,0,4.397,sol2,0.0,0.72,718.34
gfx950,256,1,256,7168,False,torch.bfloat16,torch.bfloat16,False,False,skinny,2,0,5.2154,sol2,0.0,0.7,706.54
gfx950,256,2,256,6144,False,torch.bfloat16,torch.bfloat16,False,False,skinny,2,0,4.9859,sol2,0.0,1.26,636.06
gfx950,256,2,256,7168,False,torch.bfloat16,torch.bfloat16,False,False,skinny,2,0,5.2821,sol2,0.0,1.39,700.42
gfx950,256,4,256,6144,False,torch.bfloat16,torch.bfloat16,False,False,flydsl,6008,12,5.178,flydsl_gemm6_abf16_wbf16_bf16_t16x64x64_split_k12_block_m_warp1_block_n_warp2_block_k_warp1_async_copyTrue_b_to_ldsTrue_b_preshuffleFalse_c_to_ldsFalse_gfx950,0.0205,2.43,617.41
gfx950,256,4,256,7168,False,torch.bfloat16,torch.bfloat16,False,False,flydsl,16542,8,5.9909,flydsl_gemm8_abf16_wbf16_bf16_t16x64x64_split_k8_block_m_warp1_block_n_warp2_block_k_warp1_async_copyTrue_b_to_ldsTrue_b_preshuffleFalse_c_to_ldsFalse_gfx950,0.0332,2.45,622.51
gfx950,256,8,256,6144,False,torch.bfloat16,torch.bfloat16,False,False,flydsl,6603,12,5.2817,flydsl_gemm7_abf16_wbf16_bf16_t16x64x64_split_k12_block_m_warp1_block_n_warp2_block_k_warp1_async_copyTrue_b_to_ldsTrue_b_preshuffleFalse_c_to_ldsFalse_gfx950,0.0239,4.76,614.98
gfx950,256,8,256,7168,False,torch.bfloat16,torch.bfloat16,False,False,flydsl,16542,8,6.0395,flydsl_gemm8_abf16_wbf16_bf16_t16x64x64_split_k8_block_m_warp1_block_n_warp2_block_k_warp1_async_copyTrue_b_to_ldsTrue_b_preshuffleFalse_c_to_ldsFalse_gfx950,0.0273,4.86,627.34
gfx950,256,16,256,6144,False,torch.bfloat16,torch.bfloat16,False,False,flydsl,6603,12,5.3141,flydsl_gemm7_abf16_wbf16_bf16_t16x64x64_split_k12_block_m_warp1_block_n_warp2_block_k_warp1_async_copyTrue_b_to_ldsTrue_b_preshuffleFalse_c_to_ldsFalse_gfx950,0.0256,9.47,630.5
gfx950,256,16,256,7168,False,torch.bfloat16,torch.bfloat16,False,False,triton,0,0,5.9976,auto,0.0,9.79,651.52
gfx950,256,32,256,6144,False,torch.bfloat16,torch.bfloat16,False,False,flydsl,2731,12,5.77,flydsl_gemm3_abf16_wbf16_bf16_t32x64x128_split_k12_block_m_warp2_block_n_warp2_block_k_warp1_async_copyTrue_b_to_ldsTrue_b_preshuffleFalse_c_to_ldsFalse_gfx950,0.0256,17.45,616.17
gfx950,256,32,256,7168,False,torch.bfloat16,torch.bfloat16,False,False,flydsl,12566,8,6.4144,flydsl_gemm6_abf16_wbf16_bf16_t16x64x128_split_k8_block_m_warp1_block_n_warp2_block_k_warp1_async_copyTrue_b_to_ldsTrue_b_preshuffleFalse_c_to_ldsFalse_gfx950,0.0221,18.31,646.23
gfx950,256,48,256,6144,False,torch.bfloat16,torch.bfloat16,False,False,flydsl,2477,8,6.1851,flydsl_gemm3_abf16_wbf16_bf16_t16x64x256_split_k8_block_m_warp1_block_n_warp2_block_k_warp1_async_copyTrue_b_to_ldsTrue_b_preshuffleFalse_c_to_ldsFalse_gfx950,0.0193,24.41,607.93
gfx950,256,48,256,7168,False,torch.bfloat16,torch.bfloat16,False,False,flydsl,14715,8,6.4943,flydsl_gemm7_abf16_wbf16_bf16_t16x64x128_split_k8_block_m_warp1_block_n_warp1_block_k_warp2_async_copyTrue_b_to_ldsTrue_b_preshuffleFalse_c_to_ldsFalse_gfx950,0.0297,27.13,674.86
gfx950,256,64,256,5120,False,torch.bfloat16,torch.float32,False,False,asm,5,16,8.1065,_ZN5aiter39bf16gemm_fp32bf16_tn_64x64_splitk_cleanE,0.0,20.7,408.26
gfx950,256,64,256,6144,False,torch.bfloat16,torch.bfloat16,False,False,flydsl,7192,8,6.6031,flydsl_gemm5_abf16_wbf16_bf16_t32x64x128_split_k8_block_m_warp1_block_n_warp4_block_k_warp1_async_copyTrue_b_to_ldsTrue_b_preshuffleFalse_c_to_ldsFalse_gfx950,0.0217,30.49,600.46
gfx950,256,64,256,7168,False,torch.bfloat16,torch.bfloat16,False,False,flydsl,10365,8,7.0559,flydsl_gemm4_abf16_wbf16_bf16_t16x64x128_split_k8_block_m_warp1_block_n_warp2_block_k_warp1_async_copyTrue_b_to_ldsTrue_b_preshuffleFalse_c_to_ldsFalse_gfx950,0.0219,33.29,654.81
gfx950,256,80,256,5120,False,torch.bfloat16,torch.float32,False,False,asm,7,16,8.1094,_ZN5aiter39bf16gemm_fp32bf16_tn_80x64_splitk_cleanE,0.0,25.86,429.33
gfx950,256,80,256,7168,False,torch.bfloat16,torch.bfloat16,False,False,flydsl,16903,8,6.9983,flydsl_gemm6_abf16_wbf16_bf16_t16x64x128_split_k8_block_m_warp1_block_n_warp2_block_k_warp1_async_copyTrue_b_to_ldsTrue_b_preshuffleFalse_c_to_ldsFalse_gfx950,0.0228,41.95,694.15
gfx950,256,96,256,7168,False,torch.bfloat16,torch.bfloat16,False,False,flydsl,19337,8,7.2274,flydsl_gemm7_abf16_wbf16_bf16_t16x64x128_split_k8_block_m_warp1_block_n_warp1_block_k_warp2_async_copyTrue_b_to_ldsTrue_b_preshuffleFalse_c_to_ldsFalse_gfx950,0.0296,48.75,705.01
gfx950,256,112,256,7168,False,torch.bfloat16,torch.bfloat16,False,False,flydsl,16901,8,7.2367,flydsl_gemm6_abf16_wbf16_bf16_t16x64x128_split_k8_block_m_warp1_block_n_warp1_block_k_warp2_async_copyTrue_b_to_ldsTrue_b_preshuffleFalse_c_to_ldsFalse_gfx950,0.0283,56.8,736.94
gfx950,256,128,256,5120,False,torch.bfloat16,torch.float32,False,False,asm,5,10,9.358,_ZN5aiter39bf16gemm_fp32bf16_tn_64x64_splitk_cleanE,0.0,35.86,427.2
gfx950,256,128,256,6144,False,torch.bfloat16,torch.bfloat16,False,False,flydsl,8720,8,7.2167,flydsl_gemm6_abf16_wbf16_bf16_t16x64x128_split_k8_block_m_warp1_block_n_warp1_block_k_warp2_async_copyTrue_b_to_ldsTrue_b_preshuffleFalse_c_to_ldsFalse_gfx950,0.0277,55.79,662.92
gfx950,256,128,256,7168,False,torch.bfloat16,torch.bfloat16,False,False,flydsl,11493,8,7.5664,flydsl_gemm4_abf16_wbf16_bf16_t16x64x128_split_k8_block_m_warp1_block_n_warp1_block_k_warp2_async_copyTrue_b_to_ldsTrue_b_preshuffleFalse_c_to_ldsFalse_gfx950,0.0299,62.09,736.22
gfx950,256,150,256,5120,False,torch.bfloat16,torch.float32,False,False,asm,7,10,9.6339,_ZN5aiter39bf16gemm_fp32bf16_tn_80x64_splitk_cleanE,0.0,40.82,439.51
gfx950,256,192,256,5120,False,torch.bfloat16,torch.float32,False,False,asm,8,10,10.1712,_ZN5aiter39bf16gemm_fp32bf16_tn_96x64_splitk_cleanE,0.0,49.48,460.7
gfx950,256,220,256,5120,False,torch.bfloat16,torch.float32,False,False,asm,7,8,11.1521,_ZN5aiter39bf16gemm_fp32bf16_tn_80x64_splitk_cleanE,0.0,51.71,447.17
gfx950,256,256,256,5120,False,torch.bfloat16,torch.float32,False,False,opus,1202,4,11.1942,opus_gemm_flatmm_splitk_256x32x32x128_2x1_16x16x32_0x0x0_wgpcu2_nooob,0.0,59.95,480.07
gfx950,256,256,256,6144,False,torch.bfloat16,torch.bfloat16,False,False,flydsl,6661,6,9.1244,flydsl_gemm4_abf16_wbf16_bf16_t32x64x128_split_k6_block_m_warp2_block_n_warp2_block_k_warp1_async_copyTrue_b_to_ldsTrue_b_preshuffleFalse_c_to_ldsFalse_gfx950,0.0173,88.26,703.88
gfx950,256,256,256,7168,False,torch.bfloat16,torch.bfloat16,False,False,flydsl,16137,7,9.7832,flydsl_gemm5_abf16_wbf16_bf16_t32x64x128_split_k7_block_m_warp1_block_n_warp4_block_k_warp1_async_copyTrue_b_to_ldsTrue_b_preshuffleFalse_c_to_ldsFalse_gfx950,0.0202,96.03,763.67
gfx950,256,384,256,5120,False,torch.bfloat16,torch.float32,False,False,asm,3,6,12.2105,_ZN5aiter39bf16gemm_fp32bf16_tn_48x64_splitk_cleanE,0.0,82.44,552.82
gfx950,256,448,256,5120,False,torch.bfloat16,torch.float32,False,False,asm,3,6,12.3613,_ZN5aiter39bf16gemm_fp32bf16_tn_48x64_splitk_cleanE,0.0,95.01,601.74
gfx950,256,512,256,5120,False,torch.bfloat16,torch.float32,False,False,asm,3,5,12.7677,_ZN5aiter39bf16gemm_fp32bf16_tn_48x64_splitk_cleanE,0.0,105.12,636.49
gfx950,256,16384,256,6144,False,torch.bfloat16,torch.bfloat16,False,False,flydsl,5883,1,75.3376,flydsl_gemm4_abf16_wbf16_bf16_t128x128x64_split_k1_block_m_warp4_block_n_warp4_block_k_warp1_async_copyTrue_b_to_ldsTrue_b_preshuffleFalse_c_to_ldsFalse_gfx950,0.0,684.12,2825.43
gfx950,256,1,384,7168,False,torch.bfloat16,torch.bfloat16,False,False,flydsl,3645,8,5.9534,flydsl_gemm6_abf16_wbf16_bf16_t16x64x128_split_k8_block_m_warp1_block_n_warp2_block_k_warp1_async_copyTrue_b_to_ldsTrue_b_preshuffleFalse_c_to_ldsFalse_gfx950,0.013,0.92,927.22
gfx950,256,2,384,7168,False,torch.bfloat16,torch.bfloat16,False,False,flydsl,2303,8,6.0359,flydsl_gemm4_abf16_wbf16_bf16_t16x64x128_split_k8_block_m_warp1_block_n_warp2_block_k_warp1_async_copyTrue_b_to_ldsTrue_b_preshuffleFalse_c_to_ldsFalse_gfx950,0.0156,1.82,917.05
gfx950,256,4,384,7168,False,torch.bfloat16,torch.bfloat16,False,False,flydsl,4099,8,6.003,flydsl_gemm7_abf16_wbf16_bf16_t16x64x128_split_k8_block_m_warp1_block_n_warp1_block_k_warp2_async_copyTrue_b_to_ldsTrue_b_preshuffleFalse_c_to_ldsFalse_gfx950,0.0326,3.67,927.11
gfx950,256,8,384,7168,False,torch.bfloat16,torch.bfloat16,False,False,flydsl,3408,8,6.0719,flydsl_gemm6_abf16_wbf16_bf16_t16x64x128_split_k8_block_m_warp1_block_n_warp2_block_k_warp1_async_copyTrue_b_to_ldsTrue_b_preshuffleFalse_c_to_ldsFalse_gfx950,0.0189,7.25,926.54
gfx950,256,16,384,7168,False,torch.bfloat16,torch.bfloat16,False,False,flydsl,3423,8,6.2911,flydsl_gemm6_abf16_wbf16_bf16_t16x64x64_split_k8_block_m_warp1_block_n_warp2_block_k_warp1_async_copyTrue_b_to_ldsTrue_b_preshuffleFalse_c_to_ldsFalse_gfx950,0.0236,14.0,913.46
gfx950,256,24,384,7168,False,torch.bfloat16,torch.bfloat16,False,False,flydsl,3833,8,6.5755,flydsl_gemm7_abf16_wbf16_bf16_t16x64x128_split_k8_block_m_warp1_block_n_warp2_block_k_warp1_async_copyTrue_b_to_ldsTrue_b_preshuffleFalse_c_to_ldsFalse_gfx950,0.0229,20.09,892.33
gfx950,256,32,384,7168,False,torch.bfloat16,torch.bfloat16,False,False,flydsl,2838,8,6.8076,flydsl_gemm5_abf16_wbf16_bf16_t16x64x128_split_k8_block_m_warp1_block_n_warp2_block_k_warp1_async_copyTrue_b_to_ldsTrue_b_preshuffleFalse_c_to_ldsFalse_gfx950,0.0218,25.88,879.66
gfx950,256,40,384,7168,False,torch.bfloat16,torch.bfloat16,False,False,flydsl,2328,8,6.9619,flydsl_gemm4_abf16_wbf16_bf16_t32x64x128_split_k8_block_m_warp2_block_n_warp2_block_k_warp1_async_copyTrue_b_to_ldsTrue_b_preshuffleFalse_c_to_ldsFalse_gfx950,0.021,31.63,877.52
gfx950,256,48,384,7168,False,torch.bfloat16,torch.bfloat16,False,False,flydsl,2325,8,7.2221,flydsl_gemm4_abf16_wbf16_bf16_t32x64x128_split_k8_block_m_warp1_block_n_warp4_block_k_warp1_async_copyTrue_b_to_ldsTrue_b_preshuffleFalse_c_to_ldsFalse_gfx950,0.0225,36.59,862.63
gfx950,256,56,384,7168,False,torch.bfloat16,torch.bfloat16,False,False,flydsl,2943,8,7.5631,flydsl_gemm5_abf16_wbf16_bf16_t32x64x128_split_k8_block_m_warp2_block_n_warp2_block_k_warp1_async_copyTrue_b_to_ldsTrue_b_preshuffleFalse_c_to_ldsFalse_gfx950,0.0193,40.76,839.71
gfx950,256,64,384,7168,False,torch.bfloat16,torch.bfloat16,False,False,flydsl,4088,8,7.6895,flydsl_gemm5_abf16_wbf16_bf16_t32x64x128_split_k8_block_m_warp2_block_n_warp2_block_k_warp1_async_copyTrue_b_to_ldsTrue_b_preshuffleFalse_c_to_ldsFalse_gfx950,0.0226,45.82,841.63
gfx950,256,72,384,7168,False,torch.bfloat16,torch.bfloat16,False,False,flydsl,5460,8,7.762,flydsl_gemm8_abf16_wbf16_bf16_t32x64x64_split_k8_block_m_warp1_block_n_warp4_block_k_warp1_async_copyTrue_b_to_ldsTrue_b_preshuffleFalse_c_to_ldsFalse_gfx950,0.0224,51.06,849.33
gfx950,256,80,384,7168,False,torch.bfloat16,torch.bfloat16,False,False,flydsl,3270,8,7.8985,flydsl_gemm4_abf16_wbf16_bf16_t32x64x128_split_k8_block_m_warp1_block_n_warp4_block_k_warp1_async_copyTrue_b_to_ldsTrue_b_preshuffleFalse_c_to_ldsFalse_gfx950,0.0221,55.76,849.95
gfx950,256,88,384,7168,False,torch.bfloat16,torch.bfloat16,False,False,flydsl,5168,8,8.3955,flydsl_gemm7_abf16_wbf16_bf16_t32x64x64_split_k8_block_m_warp2_block_n_warp2_block_k_warp1_async_copyTrue_b_to_ldsTrue_b_preshuffleFalse_c_to_ldsFalse_gfx950,0.0214,57.7,814.03
gfx950,256,96,384,7168,False,torch.bfloat16,torch.bfloat16,False,False,flydsl,3261,7,8.5424,flydsl_gemm4_abf16_wbf16_bf16_t32x64x128_split_k7_block_m_warp1_block_n_warp4_block_k_warp1_async_copyTrue_b_to_ldsTrue_b_preshuffleFalse_c_to_ldsFalse_gfx950,0.0192,61.87,814.17
gfx950,256,104,384,7168,False,torch.bfloat16,torch.bfloat16,False,False,flydsl,5159,7,8.9433,flydsl_gemm7_abf16_wbf16_bf16_t32x64x64_split_k7_block_m_warp2_block_n_warp2_block_k_warp1_async_copyTrue_b_to_ldsTrue_b_preshuffleFalse_c_to_ldsFalse_gfx950,0.0201,64.02,791.19
gfx950,256,112,384,7168,False,torch.bfloat16,torch.bfloat16,False,False,flydsl,3261,7,9.046,flydsl_gemm4_abf16_wbf16_bf16_t32x64x128_split_k7_block_m_warp1_block_n_warp4_block_k_warp1_async_copyTrue_b_to_ldsTrue_b_preshuffleFalse_c_to_ldsFalse_gfx950,0.02,68.16,795.56
gfx950,256,120,384,7168,False,torch.bfloat16,torch.bfloat16,False,False,flydsl,3079,4,9.3329,flydsl_gemm4_abf16_wbf16_bf16_t16x64x128_split_k4_block_m_warp1_block_n_warp1_block_k_warp2_async_copyTrue_b_to_ldsTrue_b_preshuffleFalse_c_to_ldsFalse_gfx950,0.0211,70.78,784.05
gfx950,256,128,384,7168,False,torch.bfloat16,torch.bfloat16,False,False,flydsl,3535,4,9.7019,flydsl_gemm4_abf16_wbf16_bf16_t16x64x128_split_k4_block_m_warp1_block_n_warp2_block_k_warp1_async_copyTrue_b_to_ldsTrue_b_preshuffleFalse_c_to_ldsFalse_gfx950,0.0142,72.63,766.69
gfx950,256,136,384,7168,False,torch.bfloat16,torch.bfloat16,False,False,flydsl,4661,7,9.5652,flydsl_gemm5_abf16_wbf16_bf16_t32x64x64_split_k7_block_m_warp1_block_n_warp4_block_k_warp1_async_copyTrue_b_to_ldsTrue_b_preshuffleFalse_c_to_ldsFalse_gfx950,0.0204,78.27,790.28
gfx950,256,144,384,7168,False,torch.bfloat16,torch.bfloat16,False,False,flydsl,5989,7,9.5867,flydsl_gemm8_abf16_wbf16_bf16_t32x64x64_split_k7_block_m_warp1_block_n_warp2_block_k_warp1_async_copyTrue_b_to_ldsTrue_b_preshuffleFalse_c_to_ldsFalse_gfx950,0.0201,82.69,801.11
gfx950,256,160,384,7168,False,torch.bfloat16,torch.bfloat16,False,False,flydsl,3697,4,10.0995,flydsl_gemm4_abf16_wbf16_bf16_t16x64x128_split_k4_block_m_warp1_block_n_warp2_block_k_warp1_async_copyTrue_b_to_ldsTrue_b_preshuffleFalse_c_to_ldsFalse_gfx950,0.0151,87.21,784.36
gfx950,256,168,384,7168,False,torch.bfloat16,torch.bfloat16,False,False,flydsl,3792,4,10.2315,flydsl_gemm4_abf16_wbf16_bf16_t32x64x128_split_k4_block_m_warp1_block_n_warp4_block_k_warp1_async_copyTrue_b_to_ldsTrue_b_preshuffleFalse_c_to_ldsFalse_gfx950,0.0142,90.39,786.05
gfx950,256,176,384,7168,False,torch.bfloat16,torch.bfloat16,False,False,flydsl,5696,7,10.6808,flydsl_gemm7_abf16_wbf16_bf16_t32x64x64_split_k7_block_m_warp1_block_n_warp4_block_k_warp1_async_copyTrue_b_to_ldsTrue_b_preshuffleFalse_c_to_ldsFalse_gfx950,0.0198,90.71,764.3
gfx950,256,184,384,7168,False,torch.bfloat16,torch.bfloat16,False,False,flydsl,5262,4,10.9946,flydsl_gemm6_abf16_wbf16_bf16_t32x64x128_split_k4_block_m_warp1_block_n_warp4_block_k_warp1_async_copyTrue_b_to_ldsTrue_b_preshuffleFalse_c_to_ldsFalse_gfx950,0.0145,92.13,753.48
gfx950,256,192,384,7168,False,torch.bfloat16,torch.bfloat16,False,False,flydsl,4607,4,11.076,flydsl_gemm5_abf16_wbf16_bf16_t32x64x128_split_k4_block_m_warp1_block_n_warp4_block_k_warp1_async_copyTrue_b_to_ldsTrue_b_preshuffleFalse_c_to_ldsFalse_gfx950,0.0143,95.43,758.85
gfx950,256,200,384,7168,False,torch.bfloat16,torch.bfloat16,False,False,flydsl,3792,4,10.6953,flydsl_gemm4_abf16_wbf16_bf16_t32x64x128_split_k4_block_m_warp1_block_n_warp4_block_k_warp1_async_copyTrue_b_to_ldsTrue_b_preshuffleFalse_c_to_ldsFalse_gfx950,0.014,102.94,797.16
gfx950,256,208,384,7168,False,torch.bfloat16,torch.bfloat16,False,False,flydsl,3795,4,11.1048,flydsl_gemm4_abf16_wbf16_bf16_t32x64x128_split_k4_block_m_warp2_block_n_warp2_block_k_warp1_async_copyTrue_b_to_ldsTrue_b_preshuffleFalse_c_to_ldsFalse_gfx950,0.0146,103.11,778.64
gfx950,256,216,384,7168,False,torch.bfloat16,torch.bfloat16,False,False,flydsl,4652,4,11.2712,flydsl_gemm5_abf16_wbf16_bf16_t32x64x64_split_k4_block_m_warp1_block_n_warp4_block_k_warp1_async_copyTrue_b_to_ldsTrue_b_preshuffleFalse_c_to_ldsFalse_gfx950,0.0145,105.5,777.87
gfx950,256,224,384,7168,False,torch.bfloat16,torch.bfloat16,False,False,flydsl,4606,4,11.574,flydsl_gemm5_abf16_wbf16_bf16_t32x64x128_split_k4_block_m_warp1_block_n_warp2_block_k_warp2_async_copyTrue_b_to_ldsTrue_b_preshuffleFalse_c_to_ldsFalse_gfx950,0.0215,106.54,767.96
gfx950,256,232,384,7168,False,torch.bfloat16,torch.bfloat16,False,False,flydsl,3795,4,11.3172,flydsl_gemm4_abf16_wbf16_bf16_t32x64x128_split_k4_block_m_warp2_block_n_warp2_block_k_warp1_async_copyTrue_b_to_ldsTrue_b_preshuffleFalse_c_to_ldsFalse_gfx950,0.0141,112.85,796.06
gfx950,256,240,384,7168,False,torch.bfloat16,torch.bfloat16,False,False,flydsl,3792,4,11.3047,flydsl_gemm4_abf16_wbf16_bf16_t32x64x128_split_k4_block_m_warp1_block_n_warp4_block_k_warp1_async_copyTrue_b_to_ldsTrue_b_preshuffleFalse_c_to_ldsFalse_gfx950,0.0142,116.87,807.63
gfx950,256,248,384,7168,False,torch.bfloat16,torch.bfloat16,False,False,flydsl,3792,4,11.8748,flydsl_gemm4_abf16_wbf16_bf16_t32x64x128_split_k4_block_m_warp1_block_n_warp4_block_k_warp1_async_copyTrue_b_to_ldsTrue_b_preshuffleFalse_c_to_ldsFalse_gfx950,0.014,114.97,779.03
gfx950,256,256,384,7168,False,torch.bfloat16,torch.bfloat16,False,False,flydsl,4607,4,11.8211,flydsl_gemm5_abf16_wbf16_bf16_t32x64x128_split_k4_block_m_warp1_block_n_warp4_block_k_warp1_async_copyTrue_b_to_ldsTrue_b_preshuffleFalse_c_to_ldsFalse_gfx950,0.0141,119.22,792.79
gfx950,256,264,384,7168,False,torch.bfloat16,torch.bfloat16,False,False,flydsl,3792,4,11.6101,flydsl_gemm4_abf16_wbf16_bf16_t32x64x128_split_k4_block_m_warp1_block_n_warp4_block_k_warp1_async_copyTrue_b_to_ldsTrue_b_preshuffleFalse_c_to_ldsFalse_gfx950,0.0139,125.18,817.61
gfx950,256,272,384,7168,False,torch.bfloat16,torch.bfloat16,False,False,flydsl,4652,4,12.0606,flydsl_gemm5_abf16_wbf16_bf16_t32x64x64_split_k4_block_m_warp1_block_n_warp4_block_k_warp1_async_copyTrue_b_to_ldsTrue_b_preshuffleFalse_c_to_ldsFalse_gfx950,0.0144,124.15,797.08
gfx950,256,280,384,7168,False,torch.bfloat16,torch.bfloat16,False,False,flydsl,4652,4,11.9098,flydsl_gemm5_abf16_wbf16_bf16_t32x64x64_split_k4_block_m_warp1_block_n_warp4_block_k_warp1_async_copyTrue_b_to_ldsTrue_b_preshuffleFalse_c_to_ldsFalse_gfx950,0.0145,129.42,817.32
gfx950,256,288,384,7168,False,torch.bfloat16,torch.bfloat16,False,False,flydsl,3791,4,12.3571,flydsl_gemm4_abf16_wbf16_bf16_t32x64x128_split_k4_block_m_warp1_block_n_warp2_block_k_warp2_async_copyTrue_b_to_ldsTrue_b_preshuffleFalse_c_to_ldsFalse_gfx950,0.0216,128.3,797.52
gfx950,256,296,384,7168,False,torch.bfloat16,torch.bfloat16,False,False,flydsl,4606,4,12.088,flydsl_gemm5_abf16_wbf16_bf16_t32x64x128_split_k4_block_m_warp1_block_n_warp2_block_k_warp2_async_copyTrue_b_to_ldsTrue_b_preshuffleFalse_c_to_ldsFalse_gfx950,0.0217,134.8,825.27
gfx950,256,304,384,7168,False,torch.bfloat16,torch.bfloat16,False,False,flydsl,4610,4,12.2884,flydsl_gemm5_abf16_wbf16_bf16_t32x64x128_split_k4_block_m_warp2_block_n_warp2_block_k_warp1_async_copyTrue_b_to_ldsTrue_b_preshuffleFalse_c_to_ldsFalse_gfx950,0.0134,136.19,821.64
gfx950,256,312,384,7168,False,torch.bfloat16,torch.bfloat16,False,False,flydsl,4606,4,12.6938,flydsl_gemm5_abf16_wbf16_bf16_t32x64x128_split_k4_block_m_warp1_block_n_warp2_block_k_warp2_async_copyTrue_b_to_ldsTrue_b_preshuffleFalse_c_to_ldsFalse_gfx950,0.0215,135.31,804.92
gfx950,256,320,384,7168,False,torch.bfloat16,torch.bfloat16,False,False,flydsl,3791,4,12.7384,flydsl_gemm4_abf16_wbf16_bf16_t32x64x128_split_k4_block_m_warp1_block_n_warp2_block_k_warp2_async_copyTrue_b_to_ldsTrue_b_preshuffleFalse_c_to_ldsFalse_gfx950,0.0215,138.29,811.59
gfx950,256,328,384,7168,False,torch.bfloat16,torch.bfloat16,False,False,flydsl,4035,4,13.2757,flydsl_gemm4_abf16_wbf16_bf16_t64x64x128_split_k4_block_m_warp2_block_n_warp2_block_k_warp2_async_copyTrue_b_to_ldsTrue_b_preshuffleFalse_c_to_ldsFalse_gfx950,0.0217,136.01,787.84
gfx950,256,336,384,7168,False,torch.bfloat16,torch.bfloat16,False,False,flydsl,3023,4,13.2613,flydsl_gemm3_abf16_wbf16_bf16_t64x64x128_split_k4_block_m_warp2_block_n_warp2_block_k_warp2_async_copyTrue_b_to_ldsTrue_b_preshuffleFalse_c_to_ldsFalse_gfx950,0.0221,139.48,797.81
gfx950,256,344,384,7168,False,torch.bfloat16,torch.bfloat16,False,False,flydsl,4929,4,13.0662,flydsl_gemm5_abf16_wbf16_bf16_t64x64x64_split_k4_block_m_warp1_block_n_warp4_block_k_warp1_async_copyTrue_b_to_ldsTrue_b_preshuffleFalse_c_to_ldsFalse_gfx950,0.0137,144.93,818.97
gfx950,256,352,384,7168,False,torch.bfloat16,torch.bfloat16,False,False,flydsl,3111,4,13.1158,flydsl_gemm3_abf16_wbf16_bf16_t64x64x128_split_k4_block_m_warp2_block_n_warp4_block_k_warp1_async_copyTrue_b_to_ldsTrue_b_preshuffleFalse_c_to_ldsFalse_gfx950,0.0137,147.74,825.08
gfx950,256,360,384,7168,False,torch.bfloat16,torch.bfloat16,False,False,flydsl,6064,4,13.2725,flydsl_gemm8_abf16_wbf16_bf16_t64x64x64_split_k4_block_m_warp2_block_n_warp2_block_k_warp1_async_copyTrue_b_to_ldsTrue_b_preshuffleFalse_c_to_ldsFalse_gfx950,0.0139,149.32,824.45
gfx950,256,368,384,7168,False,torch.bfloat16,torch.bfloat16,False,False,flydsl,6012,4,13.131,flydsl_gemm8_abf16_wbf16_bf16_t48x64x64_split_k4_block_m_warp1_block_n_warp2_block_k_warp1_async_copyTrue_b_to_ldsTrue_b_preshuffleFalse_c_to_ldsFalse_gfx950,0.0141,154.28,842.53
gfx950,256,376,384,7168,False,torch.bfloat16,torch.bfloat16,False,False,flydsl,4929,4,14.0708,flydsl_gemm5_abf16_wbf16_bf16_t64x64x64_split_k4_block_m_warp1_block_n_warp4_block_k_warp1_async_copyTrue_b_to_ldsTrue_b_preshuffleFalse_c_to_ldsFalse_gfx950,0.0139,147.11,794.85
gfx950,256,384,384,7168,False,torch.bfloat16,torch.bfloat16,False,False,flydsl,3882,4,13.4553,flydsl_gemm4_abf16_wbf16_bf16_t48x64x128_split_k4_block_m_warp1_block_n_warp2_block_k_warp1_async_copyTrue_b_to_ldsTrue_b_preshuffleFalse_c_to_ldsFalse_gfx950,0.0141,157.11,840.19
gfx950,256,392,384,7168,False,torch.bfloat16,torch.bfloat16,False,False,flydsl,4036,4,13.5819,flydsl_gemm4_abf16_wbf16_bf16_t64x64x128_split_k4_block_m_warp2_block_n_warp4_block_k_warp1_async_copyTrue_b_to_ldsTrue_b_preshuffleFalse_c_to_ldsFalse_gfx950,0.0138,158.89,841.25
gfx950,256,400,384,7168,False,torch.bfloat16,torch.bfloat16,False,False,flydsl,3897,4,13.3051,flydsl_gemm4_abf16_wbf16_bf16_t48x64x64_split_k4_block_m_warp1_block_n_warp2_block_k_warp1_async_copyTrue_b_to_ldsTrue_b_preshuffleFalse_c_to_ldsFalse_gfx950,0.0137,165.5,867.83
gfx950,256,408,384,7168,False,torch.bfloat16,torch.bfloat16,False,False,flydsl,3882,4,13.2528,flydsl_gemm4_abf16_wbf16_bf16_t48x64x128_split_k4_block_m_warp1_block_n_warp2_block_k_warp1_async_copyTrue_b_to_ldsTrue_b_preshuffleFalse_c_to_ldsFalse_gfx950,0.0139,169.48,880.38
gfx950,256,416,384,7168,False,torch.bfloat16,torch.bfloat16,False,False,flydsl,4201,4,14.1797,flydsl_gemm4_abf16_wbf16_bf16_t64x64x128_split_k4_block_m_warp4_block_n_warp2_block_k_warp1_async_copyTrue_b_to_ldsTrue_b_preshuffleFalse_c_to_ldsFalse_gfx950,0.0139,161.5,831.35
gfx950,256,424,384,7168,False,torch.bfloat16,torch.bfloat16,False,False,flydsl,2599,4,14.6523,flydsl_gemm3_abf16_wbf16_bf16_t32x64x128_split_k4_block_m_warp1_block_n_warp4_block_k_warp1_async_copyTrue_b_to_ldsTrue_b_preshuffleFalse_c_to_ldsFalse_gfx950,0.0138,159.3,812.78
gfx950,256,432,384,7168,False,torch.bfloat16,torch.bfloat16,False,False,flydsl,3017,4,14.2718,flydsl_gemm3_abf16_wbf16_bf16_t64x64x128_split_k4_block_m_warp1_block_n_warp4_block_k_warp1_async_copyTrue_b_to_ldsTrue_b_preshuffleFalse_c_to_ldsFalse_gfx950,0.0141,166.63,842.92
gfx950,256,440,384,7168,False,torch.bfloat16,torch.bfloat16,False,False,flydsl,4712,4,14.7879,flydsl_gemm5_abf16_wbf16_bf16_t48x64x64_split_k4_block_m_warp1_block_n_warp2_block_k_warp1_async_copyTrue_b_to_ldsTrue_b_preshuffleFalse_c_to_ldsFalse_gfx950,0.0137,163.8,821.67
gfx950,256,448,384,7168,False,torch.bfloat16,torch.bfloat16,False,False,flydsl,3882,4,14.363,flydsl_gemm4_abf16_wbf16_bf16_t48x64x128_split_k4_block_m_warp1_block_n_warp2_block_k_warp1_async_copyTrue_b_to_ldsTrue_b_preshuffleFalse_c_to_ldsFalse_gfx950,0.0141,171.71,854.39
gfx950,256,456,384,7168,False,torch.bfloat16,torch.bfloat16,False,False,flydsl,3785,2,14.6049,flydsl_gemm4_abf16_wbf16_bf16_t32x64x128_split_k2_block_m_warp2_block_n_warp1_block_k_warp2_async_copyTrue_b_to_ldsTrue_b_preshuffleFalse_c_to_ldsFalse_gfx950,0.0141,171.88,848.51
gfx950,256,464,384,7168,False,torch.bfloat16,torch.bfloat16,False,False,flydsl,5489,4,14.5018,flydsl_gemm6_abf16_wbf16_bf16_t64x64x64_split_k4_block_m_warp2_block_n_warp2_block_k_warp1_async_copyTrue_b_to_ldsTrue_b_preshuffleFalse_c_to_ldsFalse_gfx950,0.0141,176.14,862.88
gfx950,256,472,384,7168,False,torch.bfloat16,torch.bfloat16,False,False,flydsl,6059,4,14.8414,flydsl_gemm8_abf16_wbf16_bf16_t64x64x64_split_k4_block_m_warp1_block_n_warp4_block_k_warp1_async_copyTrue_b_to_ldsTrue_b_preshuffleFalse_c_to_ldsFalse_gfx950,0.0141,175.08,851.27
gfx950,256,480,384,7168,False,torch.bfloat16,torch.bfloat16,False,False,flydsl,3104,4,15.0036,flydsl_gemm3_abf16_wbf16_bf16_t64x64x128_split_k4_block_m_warp1_block_n_warp4_block_k_warp1_async_copyTrue_b_to_ldsTrue_b_preshuffleFalse_c_to_ldsFalse_gfx950,0.014,176.12,850.13
gfx950,256,488,384,7168,False,torch.bfloat16,torch.bfloat16,False,False,flydsl,4597,2,14.9883,flydsl_gemm5_abf16_wbf16_bf16_t32x64x128_split_k2_block_m_warp1_block_n_warp2_block_k_warp2_async_copyTrue_b_to_ldsTrue_b_preshuffleFalse_c_to_ldsFalse_gfx950,0.0142,179.24,859.06
gfx950,256,496,384,7168,False,torch.bfloat16,torch.bfloat16,False,False,flydsl,3780,2,15.2268,flydsl_gemm4_abf16_wbf16_bf16_t32x64x128_split_k2_block_m_warp1_block_n_warp1_block_k_warp4_async_copyTrue_b_to_ldsTrue_b_preshuffleFalse_c_to_ldsFalse_gfx950,0.0226,179.32,853.54
gfx950,256,504,384,7168,False,torch.bfloat16,torch.bfloat16,False,False,asm,7,5,15.7495,_ZN5aiter39bf16gemm_fp32bf16_tn_80x64_splitk_cleanE,0.0163,176.17,832.88
gfx950,256,512,384,7168,False,torch.bfloat16,torch.bfloat16,False,False,asm,7,5,15.73,_ZN5aiter39bf16gemm_fp32bf16_tn_80x64_splitk_cleanE,0.016,179.18,841.59
gfx950,256,544,384,7168,False,torch.bfloat16,torch.bfloat16,False,False,asm,7,5,15.7162,_ZN5aiter39bf16gemm_fp32bf16_tn_80x64_splitk_cleanE,0.0162,190.55,873.09
gfx950,256,576,384,7168,False,torch.bfloat16,torch.bfloat16,False,False,asm,7,5,16.2445,_ZN5aiter39bf16gemm_fp32bf16_tn_80x64_splitk_cleanE,0.016,195.2,874.45
gfx950,256,608,384,7168,False,torch.bfloat16,torch.bfloat16,False,False,asm,5,4,16.5819,_ZN5aiter39bf16gemm_fp32bf16_tn_64x64_splitk_cleanE,0.0134,201.85,885.8
gfx950,256,640,384,7168,False,torch.bfloat16,torch.bfloat16,False,False,asm,8,5,16.8416,_ZN5aiter39bf16gemm_fp32bf16_tn_96x64_splitk_cleanE,0.0158,209.2,900.84
gfx950,256,672,384,7168,False,torch.bfloat16,torch.bfloat16,False,False,asm,7,4,17.031,_ZN5aiter39bf16gemm_fp32bf16_tn_80x64_splitk_cleanE,0.0136,217.21,919.2
gfx950,256,704,384,7168,False,torch.bfloat16,torch.bfloat16,False,False,asm,7,4,17.4535,_ZN5aiter39bf16gemm_fp32bf16_tn_80x64_splitk_cleanE,0.0136,222.05,924.64
gfx950,256,736,384,7168,False,torch.bfloat16,torch.bfloat16,False,False,asm,7,4,17.6903,_ZN5aiter39bf16gemm_fp32bf16_tn_80x64_splitk_cleanE,0.0135,229.03,939.59
gfx950,256,768,384,7168,False,torch.bfloat16,torch.bfloat16,False,False,asm,7,4,18.2453,_ZN5aiter39bf16gemm_fp32bf16_tn_80x64_splitk_cleanE,0.0136,231.72,937.5
gfx950,256,800,384,7168,False,torch.bfloat16,torch.bfloat16,False,False,asm,8,4,18.4739,_ZN5aiter39bf16gemm_fp32bf16_tn_96x64_splitk_cleanE,0.0133,238.39,952.06
gfx950,256,832,384,7168,False,torch.bfloat16,torch.bfloat16,False,False,asm,8,4,18.7409,_ZN5aiter39bf16gemm_fp32bf16_tn_96x64_splitk_cleanE,0.0135,244.39,964.28
gfx950,256,864,384,7168,False,torch.bfloat16,torch.bfloat16,False,False,asm,8,4,19.191,_ZN5aiter39bf16gemm_fp32bf16_tn_96x64_splitk_cleanE,0.0135,247.84,966.85
gfx950,256,896,384,7168,False,torch.bfloat16,torch.bfloat16,False,False,asm,8,4,19.6485,_ZN5aiter39bf16gemm_fp32bf16_tn_96x64_splitk_cleanE,0.0138,251.04,968.94
gfx950,256,928,384,7168,False,torch.bfloat16,torch.bfloat16,False,False,asm,7,3,19.7295,_ZN5aiter39bf16gemm_fp32bf16_tn_80x64_splitk_cleanE,0.0103,258.94,989.46
gfx950,256,960,384,7168,False,torch.bfloat16,torch.bfloat16,False,False,asm,8,4,20.3116,_ZN5aiter39bf16gemm_fp32bf16_tn_96x64_splitk_cleanE,0.0135,260.19,984.9
gfx950,256,992,384,7168,False,torch.bfloat16,torch.bfloat16,False,False,asm,7,3,20.1248,_ZN5aiter39bf16gemm_fp32bf16_tn_80x64_splitk_cleanE,0.0104,271.36,1018.06
gfx950,256,996,384,7168,False,torch.bfloat16,torch.bfloat16,False,False,asm,7,3,22.2116,_ZN5aiter39bf16gemm_fp32bf16_tn_80x64_splitk_cleanE,0.0104,246.85,925.13
gfx950,256,1024,384,7168,False,torch.bfloat16,torch.bfloat16,False,False,asm,7,3,21.2312,_ZN5aiter39bf16gemm_fp32bf16_tn_80x64_splitk_cleanE,0.0104,265.51,987.77
gfx950,256,1088,384,7168,False,torch.bfloat16,torch.bfloat16,False,False,torch,0,0,21.0138,native,0.0,285.03,1043.99
gfx950,256,1152,384,7168,False,torch.bfloat16,torch.bfloat16,False,False,torch,0,0,21.1881,native,0.0,299.31,1081.02
gfx950,256,1216,384,7168,False,torch.bfloat16,torch.bfloat16,False,False,asm,8,3,23.7224,_ZN5aiter39bf16gemm_fp32bf16_tn_96x64_splitk_cleanE,0.0103,282.19,1006.28
gfx950,256,1280,384,7168,False,torch.bfloat16,torch.bfloat16,False,False,asm,8,3,24.2314,_ZN5aiter39bf16gemm_fp32bf16_tn_96x64_splitk_cleanE,0.0103,290.8,1025.04
gfx950,256,1344,384,7168,False,torch.bfloat16,torch.bfloat16,False,False,opus,1215,4,24.7665,opus_gemm_flatmm_splitk_256x64x96x64_2x1_16x16x32_0x0x0_wgpcu2_nooob,0.0,298.74,1041.92
gfx950,256,1408,384,7168,False,torch.bfloat16,torch.bfloat16,False,False,torch,0,0,23.136,native,0.0,335.02,1157.13
gfx950,256,1472,384,7168,False,torch.bfloat16,torch.bfloat16,False,False,torch,0,0,22.7728,native,0.0,355.84,1218.04
gfx950,256,1536,384,7168,False,torch.bfloat16,torch.bfloat16,False,False,torch,0,0,22.9835,native,0.0,367.9,1248.93
gfx950,256,1600,384,7168,False,torch.bfloat16,torch.bfloat16,False,False,torch,0,0,24.0987,native,0.0,365.5,1231.25
gfx950,256,1664,384,7168,False,torch.bfloat16,torch.bfloat16,False,False,torch,0,0,24.5493,native,0.0,373.14,1248.02
gfx950,256,1728,384,7168,False,torch.bfloat16,torch.bfloat16,False,False,opus,1221,4,28.9455,opus_gemm_flatmm_splitk_256x96x64x64_2x1_16x16x32_0x0x0_wgpcu2_nooob,0.0,328.64,1091.87
gfx950,256,1792,384,7168,False,torch.bfloat16,torch.bfloat16,False,False,opus,1214,2,30.7184,opus_gemm_flatmm_splitk_256x64x96x64_2x1_16x16x32_0x0x0_wgpcu1_nooob,0.0,321.14,1060.32
gfx950,256,1856,384,7168,False,torch.bfloat16,torch.bfloat16,False,False,opus,222,2,30.4958,opus_gemm_flatmm_splitk_256x96x64x128_2x1_16x16x32_0x0x0_wgpcu1,0.0,335.04,1099.76
gfx950,256,1920,384,7168,False,torch.bfloat16,torch.bfloat16,False,False,opus,1220,2,30.6877,opus_gemm_flatmm_splitk_256x96x64x64_2x1_16x16x32_0x0x0_wgpcu1_nooob,0.0,344.43,1124.38
gfx950,256,1984,384,7168,False,torch.bfloat16,torch.bfloat16,False,False,opus,220,2,31.9476,opus_gemm_flatmm_splitk_256x96x64x64_2x1_16x16x32_0x0x0_wgpcu1,0.0,341.87,1110.3
gfx950,256,2048,384,7168,False,torch.bfloat16,torch.bfloat16,False,False,torch,0,0,27.9932,native,0.0,402.75,1301.67
gfx950,256,2765,384,7168,False,torch.bfloat16,torch.bfloat16,False,False,torch,0,0,0.0,native,0.0,0.0,0.0
gfx950,256,2767,384,7168,False,torch.bfloat16,torch.bfloat16,False,False,torch,0,0,0.0,native,0.0,0.0,0.0
gfx950,256,4096,384,7168,False,torch.bfloat16,torch.bfloat16,False,False,torch,0,0,46.8307,native,0.0,481.49,1438.61
gfx950,256,4955,384,7168,False,torch.bfloat16,torch.bfloat16,False,False,triton,0,0,84.2387,auto,0.0,323.81,953.78
gfx950,256,6144,384,7168,False,torch.bfloat16,torch.bfloat16,False,False,torch,0,0,55.0052,native,0.0,614.9,1787.18
gfx950,256,7160,384,7168,False,torch.bfloat16,torch.bfloat16,False,False,triton,0,0,88.2854,auto,0.0,446.46,1287.3
gfx950,256,8192,384,7168,False,torch.bfloat16,torch.bfloat16,False,False,opus,6403,0,84.5964,opus_gemm_mono_tile_512x128x128x64_2x4_16x16x32_0x0x0_nooob_4g_safe,0.0,533.09,1527.69
gfx950,256,10240,384,7168,False,torch.bfloat16,torch.bfloat16,False,False,flydsl,3464,1,79.9404,flydsl_gemm4_abf16_wbf16_bf16_t128x128x64_split_k1_block_m_warp4_block_n_warp2_block_k_warp1_async_copyTrue_b_to_ldsTrue_b_preshuffleFalse_c_to_ldsFalse_gfx950,0.0,705.17,2003.62
gfx950,256,12288,384,7168,False,torch.bfloat16,torch.bfloat16,False,False,torch,0,0,83.1459,native,0.0,813.58,2298.41
gfx950,256,14336,384,7168,False,torch.bfloat16,torch.bfloat16,False,False,torch,0,0,92.1367,native,0.0,856.55,2409.85
gfx950,256,16384,384,7168,False,torch.bfloat16,torch.bfloat16,False,False,torch,0,0,100.5218,native,0.0,897.26,2516.56
gfx950,256,1,512,7168,False,torch.bfloat16,torch.bfloat16,False,False,flydsl,2993,8,6.3389,flydsl_gemm4_abf16_wbf16_bf16_t16x64x128_split_k8_block_m_warp1_block_n_warp2_block_k_warp1_async_copyTrue_b_to_ldsTrue_b_preshuffleFalse_c_to_ldsFalse_gfx950,0.0137,1.16,1160.36
gfx950,256,2,512,7168,False,torch.bfloat16,torch.bfloat16,False,False,flydsl,5260,8,6.2961,flydsl_gemm8_abf16_wbf16_bf16_t16x64x64_split_k8_block_m_warp1_block_n_warp2_block_k_warp1_async_copyTrue_b_to_ldsTrue_b_preshuffleFalse_c_to_ldsFalse_gfx950,0.0186,2.33,1170.69
gfx950,256,4,512,7168,False,torch.bfloat16,torch.bfloat16,False,False,flydsl,3880,8,6.2147,flydsl_gemm5_abf16_wbf16_bf16_t16x64x128_split_k8_block_m_warp1_block_n_warp2_block_k_warp1_async_copyTrue_b_to_ldsTrue_b_preshuffleFalse_c_to_ldsFalse_gfx950,0.0239,4.72,1190.96
gfx950,256,8,512,7168,False,torch.bfloat16,torch.bfloat16,False,False,flydsl,4934,8,6.4259,flydsl_gemm7_abf16_wbf16_bf16_t16x64x128_split_k8_block_m_warp1_block_n_warp1_block_k_warp2_async_copyTrue_b_to_ldsTrue_b_preshuffleFalse_c_to_ldsFalse_gfx950,0.0269,9.14,1161.38
gfx950,256,16,512,7168,False,torch.bfloat16,torch.bfloat16,False,False,flydsl,4934,8,6.7231,flydsl_gemm7_abf16_wbf16_bf16_t16x64x128_split_k8_block_m_warp1_block_n_warp1_block_k_warp2_async_copyTrue_b_to_ldsTrue_b_preshuffleFalse_c_to_ldsFalse_gfx950,0.0308,17.47,1128.32
gfx950,256,32,512,7168,False,torch.bfloat16,torch.bfloat16,False,False,flydsl,4480,8,7.0084,flydsl_gemm6_abf16_wbf16_bf16_t16x64x128_split_k8_block_m_warp1_block_n_warp2_block_k_warp1_async_copyTrue_b_to_ldsTrue_b_preshuffleFalse_c_to_ldsFalse_gfx950,0.0214,33.51,1117.45
gfx950,256,48,512,7168,False,torch.bfloat16,torch.bfloat16,False,False,flydsl,2993,8,7.4987,flydsl_gemm4_abf16_wbf16_bf16_t16x64x128_split_k8_block_m_warp1_block_n_warp2_block_k_warp1_async_copyTrue_b_to_ldsTrue_b_preshuffleFalse_c_to_ldsFalse_gfx950,0.0215,46.98,1077.16
gfx950,256,64,512,7168,False,torch.bfloat16,torch.bfloat16,False,False,flydsl,5880,8,7.7907,flydsl_gemm6_abf16_wbf16_bf16_t16x64x128_split_k8_block_m_warp1_block_n_warp2_block_k_warp1_async_copyTrue_b_to_ldsTrue_b_preshuffleFalse_c_to_ldsFalse_gfx950,0.0219,60.3,1068.33
gfx950,256,80,512,7168,False,torch.bfloat16,torch.bfloat16,False,False,flydsl,4340,8,8.2343,flydsl_gemm4_abf16_wbf16_bf16_t32x64x128_split_k8_block_m_warp2_block_n_warp2_block_k_warp1_async_copyTrue_b_to_ldsTrue_b_preshuffleFalse_c_to_ldsFalse_gfx950,0.0218,71.31,1040.63
gfx950,256,96,512,7168,False,torch.bfloat16,torch.bfloat16,False,False,flydsl,4331,7,9.206,flydsl_gemm4_abf16_wbf16_bf16_t32x64x128_split_k7_block_m_warp2_block_n_warp2_block_k_warp1_async_copyTrue_b_to_ldsTrue_b_preshuffleFalse_c_to_ldsFalse_gfx950,0.0198,76.54,957.48
gfx950,256,112,512,7168,False,torch.bfloat16,torch.bfloat16,False,False,flydsl,4328,7,8.8739,flydsl_gemm4_abf16_wbf16_bf16_t32x64x128_split_k7_block_m_warp1_block_n_warp4_block_k_warp1_async_copyTrue_b_to_ldsTrue_b_preshuffleFalse_c_to_ldsFalse_gfx950,0.0206,92.64,1021.01
gfx950,256,128,512,7168,False,torch.bfloat16,torch.bfloat16,False,False,flydsl,4871,7,9.6964,flydsl_gemm4_abf16_wbf16_bf16_t32x64x128_split_k7_block_m_warp2_block_n_warp2_block_k_warp1_async_copyTrue_b_to_ldsTrue_b_preshuffleFalse_c_to_ldsFalse_gfx950,0.0201,96.89,959.75
gfx950,256,144,512,7168,False,torch.bfloat16,torch.bfloat16,False,False,flydsl,4862,4,10.5003,flydsl_gemm4_abf16_wbf16_bf16_t32x64x128_split_k4_block_m_warp2_block_n_warp2_block_k_warp1_async_copyTrue_b_to_ldsTrue_b_preshuffleFalse_c_to_ldsFalse_gfx950,0.0142,100.66,909.68
gfx950,256,160,512,7168,False,torch.bfloat16,torch.bfloat16,False,False,flydsl,4859,4,11.0323,flydsl_gemm4_abf16_wbf16_bf16_t32x64x128_split_k4_block_m_warp1_block_n_warp4_block_k_warp1_async_copyTrue_b_to_ldsTrue_b_preshuffleFalse_c_to_ldsFalse_gfx950,0.0141,106.45,888.09
gfx950,256,176,512,7168,False,torch.bfloat16,torch.bfloat16,False,False,flydsl,4859,4,11.0278,flydsl_gemm4_abf16_wbf16_bf16_t32x64x128_split_k4_block_m_warp1_block_n_warp4_block_k_warp1_async_copyTrue_b_to_ldsTrue_b_preshuffleFalse_c_to_ldsFalse_gfx950,0.0144,117.14,910.73
gfx950,256,192,512,7168,False,torch.bfloat16,torch.bfloat16,False,False,flydsl,3420,4,11.2639,flydsl_gemm3_abf16_wbf16_bf16_t32x64x256_split_k4_block_m_warp1_block_n_warp2_block_k_warp2_async_copyTrue_b_to_ldsTrue_b_preshuffleFalse_c_to_ldsFalse_gfx950,0.0215,125.12,913.46
gfx950,256,208,512,7168,False,torch.bfloat16,torch.bfloat16,False,False,flydsl,4859,4,11.0807,flydsl_gemm4_abf16_wbf16_bf16_t32x64x128_split_k4_block_m_warp1_block_n_warp4_block_k_warp1_async_copyTrue_b_to_ldsTrue_b_preshuffleFalse_c_to_ldsFalse_gfx950,0.0142,137.78,950.74
gfx950,256,224,512,7168,False,torch.bfloat16,torch.bfloat16,False,False,flydsl,5818,4,11.6007,flydsl_gemm5_abf16_wbf16_bf16_t32x64x128_split_k4_block_m_warp1_block_n_warp2_block_k_warp2_async_copyTrue_b_to_ldsTrue_b_preshuffleFalse_c_to_ldsFalse_gfx950,0.0218,141.73,929.31
gfx950,256,240,512,7168,False,torch.bfloat16,torch.bfloat16,False,False,flydsl,4858,4,11.8587,flydsl_gemm4_abf16_wbf16_bf16_t32x64x128_split_k4_block_m_warp1_block_n_warp2_block_k_warp2_async_copyTrue_b_to_ldsTrue_b_preshuffleFalse_c_to_ldsFalse_gfx950,0.0216,148.55,929.82
gfx950,256,256,512,7168,False,torch.bfloat16,torch.bfloat16,False,False,flydsl,4859,4,12.1913,flydsl_gemm4_abf16_wbf16_bf16_t32x64x128_split_k4_block_m_warp1_block_n_warp4_block_k_warp1_async_copyTrue_b_to_ldsTrue_b_preshuffleFalse_c_to_ldsFalse_gfx950,0.0142,154.13,924.61
gfx950,256,288,512,7168,False,torch.bfloat16,torch.bfloat16,False,False,flydsl,5289,4,13.1141,flydsl_gemm4_abf16_wbf16_bf16_t64x64x64_split_k4_block_m_warp4_block_n_warp1_block_k_warp1_async_copyTrue_b_to_ldsTrue_b_preshuffleFalse_c_to_ldsFalse_gfx950,0.0143,161.2,897.03
gfx950,256,320,512,7168,False,torch.bfloat16,torch.bfloat16,False,False,flydsl,5206,4,13.8894,flydsl_gemm4_abf16_wbf16_bf16_t64x64x128_split_k4_block_m_warp4_block_n_warp2_block_k_warp1_async_copyTrue_b_to_ldsTrue_b_preshuffleFalse_c_to_ldsFalse_gfx950,0.0142,169.11,882.34
gfx950,256,352,512,7168,False,torch.bfloat16,torch.bfloat16,False,False,flydsl,5202,4,14.1962,flydsl_gemm4_abf16_wbf16_bf16_t64x64x128_split_k4_block_m_warp2_block_n_warp2_block_k_warp2_async_copyTrue_b_to_ldsTrue_b_preshuffleFalse_c_to_ldsFalse_gfx950,0.0217,182.0,897.9
gfx950,256,384,512,7168,False,torch.bfloat16,torch.bfloat16,False,False,flydsl,3375,4,14.5811,flydsl_gemm3_abf16_wbf16_bf16_t32x64x128_split_k4_block_m_warp1_block_n_warp2_block_k_warp2_async_copyTrue_b_to_ldsTrue_b_preshuffleFalse_c_to_ldsFalse_gfx950,0.0219,193.3,907.91
gfx950,256,416,512,7168,False,torch.bfloat16,torch.bfloat16,False,False,flydsl,5202,4,15.2007,flydsl_gemm4_abf16_wbf16_bf16_t64x64x128_split_k4_block_m_warp2_block_n_warp2_block_k_warp2_async_copyTrue_b_to_ldsTrue_b_preshuffleFalse_c_to_ldsFalse_gfx950,0.0215,200.88,903.23
gfx950,256,448,512,7168,False,torch.bfloat16,torch.bfloat16,False,False,asm,8,6,15.7353,_ZN5aiter39bf16gemm_fp32bf16_tn_96x64_splitk_cleanE,0.0185,208.98,903.78
gfx950,256,480,512,7168,False,torch.bfloat16,torch.bfloat16,False,False,asm,8,6,16.0338,_ZN5aiter39bf16gemm_fp32bf16_tn_96x64_splitk_cleanE,0.0184,219.74,917.61
gfx950,256,512,512,7168,False,torch.bfloat16,torch.bfloat16,False,False,asm,8,5,16.6535,_ZN5aiter39bf16gemm_fp32bf16_tn_96x64_splitk_cleanE,0.0161,225.66,912.98
gfx950,256,544,512,7168,False,torch.bfloat16,torch.bfloat16,False,False,asm,8,5,16.6876,_ZN5aiter39bf16gemm_fp32bf16_tn_96x64_splitk_cleanE,0.0161,239.28,940.57
gfx950,256,576,512,7168,False,torch.bfloat16,torch.bfloat16,False,False,asm,8,5,17.3033,_ZN5aiter39bf16gemm_fp32bf16_tn_96x64_splitk_cleanE,0.0164,244.34,935.51
gfx950,256,608,512,7168,False,torch.bfloat16,torch.bfloat16,False,False,asm,7,4,17.7661,_ZN5aiter39bf16gemm_fp32bf16_tn_80x64_splitk_cleanE,0.0135,251.19,938.81
gfx950,256,640,512,7168,False,torch.bfloat16,torch.bfloat16,False,False,asm,7,4,18.0717,_ZN5aiter39bf16gemm_fp32bf16_tn_80x64_splitk_cleanE,0.0135,259.94,950.13
gfx950,256,672,512,7168,False,torch.bfloat16,torch.bfloat16,False,False,asm,8,4,18.596,_ZN5aiter39bf16gemm_fp32bf16_tn_96x64_splitk_cleanE,0.0133,265.25,949.77
gfx950,256,704,512,7168,False,torch.bfloat16,torch.bfloat16,False,False,asm,8,4,19.0025,_ZN5aiter39bf16gemm_fp32bf16_tn_96x64_splitk_cleanE,0.0135,271.93,955.32
gfx950,256,736,512,7168,False,torch.bfloat16,torch.bfloat16,False,False,asm,8,4,19.3904,_ZN5aiter39bf16gemm_fp32bf16_tn_96x64_splitk_cleanE,0.0135,278.61,961.56
gfx950,256,768,512,7168,False,torch.bfloat16,torch.bfloat16,False,False,asm,8,4,19.7528,_ZN5aiter39bf16gemm_fp32bf16_tn_96x64_splitk_cleanE,0.0135,285.38,968.8
gfx950,256,800,512,7168,False,torch.bfloat16,torch.bfloat16,False,False,asm,7,3,20.2908,_ZN5aiter39bf16gemm_fp32bf16_tn_80x64_splitk_cleanE,0.0104,289.39,967.34
gfx950,256,832,512,7168,False,torch.bfloat16,torch.bfloat16,False,False,asm,8,3,21.7223,_ZN5aiter39bf16gemm_fp32bf16_tn_96x64_splitk_cleanE,0.0103,281.14,926.22
gfx950,256,864,512,7168,False,torch.bfloat16,torch.bfloat16,False,False,asm,8,3,21.5825,_ZN5aiter39bf16gemm_fp32bf16_tn_96x64_splitk_cleanE,0.0103,293.84,954.99
gfx950,256,896,512,7168,False,torch.bfloat16,torch.bfloat16,False,False,torch,0,0,21.7453,native,0.0,302.44,970.44
gfx950,256,928,512,7168,False,torch.bfloat16,torch.bfloat16,False,False,torch,0,0,21.2379,native,0.0,320.73,1016.77
gfx950,256,960,512,7168,False,torch.bfloat16,torch.bfloat16,False,False,torch,0,0,21.4742,native,0.0,328.13,1028.47
gfx950,256,992,512,7168,False,torch.bfloat16,torch.bfloat16,False,False,opus,200,2,24.7054,opus_gemm_flatmm_splitk_256x64x64x64_2x1_16x16x32_0x0x0_wgpcu2,0.0,294.73,913.85
gfx950,256,1024,512,7168,False,torch.bfloat16,torch.bfloat16,False,False,opus,1208,2,24.7265,opus_gemm_flatmm_splitk_256x64x64x128_2x1_16x16x32_0x0x0_wgpcu1_nooob,0.0,303.97,932.95
gfx950,256,1088,512,7168,False,torch.bfloat16,torch.bfloat16,False,False,opus,1200,2,26.0717,opus_gemm_flatmm_splitk_256x64x64x64_2x1_16x16x32_0x0x0_wgpcu2_nooob,0.0,306.31,922.52
gfx950,256,1152,512,7168,False,torch.bfloat16,torch.bfloat16,False,False,torch,0,0,26.7083,native,0.0,316.6,937.34
gfx950,256,1216,512,7168,False,torch.bfloat16,torch.bfloat16,False,False,torch,0,0,25.964,native,0.0,343.76,1002.07
gfx950,256,1280,512,7168,False,torch.bfloat16,torch.bfloat16,False,False,torch,0,0,25.9095,native,0.0,362.62,1042.12
gfx950,256,1344,512,7168,False,torch.bfloat16,torch.bfloat16,False,False,opus,1221,4,28.0523,opus_gemm_flatmm_splitk_256x96x64x64_2x1_16x16x32_0x0x0_wgpcu2_nooob,0.0,351.66,997.56
gfx950,256,1408,512,7168,False,torch.bfloat16,torch.bfloat16,False,False,torch,0,0,27.1365,native,0.0,380.84,1067.45
gfx950,256,1472,512,7168,False,torch.bfloat16,torch.bfloat16,False,False,torch,0,0,27.4256,native,0.0,393.96,1092.04
gfx950,256,1536,512,7168,False,torch.bfloat16,torch.bfloat16,False,False,torch,0,0,28.7155,native,0.0,392.62,1077.22
gfx950,256,1600,512,7168,False,torch.bfloat16,torch.bfloat16,False,False,flydsl,3866,1,32.9541,flydsl_gemm3_abf16_wbf16_bf16_t64x64x128_split_k1_block_m_warp2_block_n_warp2_block_k_warp2_async_copyTrue_b_to_ldsTrue_b_preshuffleFalse_c_to_ldsFalse_gfx950,0.0062,356.38,968.5
gfx950,256,1664,512,7168,False,torch.bfloat16,torch.bfloat16,False,False,torch,0,0,30.0061,native,0.0,407.04,1096.41
gfx950,256,1728,512,7168,False,torch.bfloat16,torch.bfloat16,False,False,torch,0,0,30.5405,native,0.0,415.3,1109.42
gfx950,256,1792,512,7168,False,torch.bfloat16,torch.bfloat16,False,False,torch,0,0,29.9245,native,0.0,439.55,1165.1
gfx950,256,1856,512,7168,False,torch.bfloat16,torch.bfloat16,False,False,torch,0,0,31.8762,native,0.0,427.38,1124.61
gfx950,256,1920,512,7168,False,torch.bfloat16,torch.bfloat16,False,False,torch,0,0,31.9929,native,0.0,440.5,1151.23
gfx950,256,1984,512,7168,False,torch.bfloat16,torch.bfloat16,False,False,torch,0,0,32.2367,native,0.0,451.74,1173.02
gfx950,256,2048,512,7168,False,torch.bfloat16,torch.bfloat16,False,False,torch,0,0,29.9664,native,0.0,501.64,1294.69
gfx950,256,4096,512,7168,False,torch.bfloat16,torch.bfloat16,False,False,torch,0,0,51.5776,native,0.0,582.9,1362.11
gfx950,256,6144,512,7168,False,torch.bfloat16,torch.bfloat16,False,False,flydsl,5376,1,67.5094,flydsl_gemm4_abf16_wbf16_bf16_t96x128x64_split_k1_block_m_warp1_block_n_warp4_block_k_warp1_async_copyTrue_b_to_ldsTrue_b_preshuffleFalse_c_to_ldsFalse_gfx950,0.0,668.01,1506.63
gfx950,256,8192,512,7168,False,torch.bfloat16,torch.bfloat16,False,False,flydsl,4309,1,80.1688,flydsl_gemm4_abf16_wbf16_bf16_t128x128x64_split_k1_block_m_warp4_block_n_warp2_block_k_warp1_async_copyTrue_b_to_ldsTrue_b_preshuffleFalse_c_to_ldsFalse_gfx950,0.0,750.04,1661.11
gfx950,256,10240,512,7168,False,torch.bfloat16,torch.bfloat16,False,False,torch,0,0,92.0272,native,0.0,816.74,1788.89
gfx950,256,12288,512,7168,False,torch.bfloat16,torch.bfloat16,False,False,flydsl,2647,1,107.1619,flydsl_gemm3_abf16_wbf16_bf16_t128x256x64_split_k1_block_m_warp2_block_n_warp4_block_k_warp2_async_copyTrue_b_to_ldsTrue_b_preshuffleFalse_c_to_ldsFalse_gfx950,0.0061,841.66,1829.79
gfx950,256,14336,512,7168,False,torch.bfloat16,torch.bfloat16,False,False,flydsl,2647,1,112.7228,flydsl_gemm3_abf16_wbf16_bf16_t128x256x64_split_k1_block_m_warp2_block_n_warp4_block_k_warp2_async_copyTrue_b_to_ldsTrue_b_preshuffleFalse_c_to_ldsFalse_gfx950,0.006,933.5,2018.59
gfx950,256,16384,512,7168,False,torch.bfloat16,torch.bfloat16,False,False,opus,1401,0,110.8881,opus_gemm_mono_tile_512x128x256x64_2x4_16x16x32_0x0x0_nooob,0.0,1084.51,2335.67
gfx950,256,32768,512,7168,False,torch.bfloat16,torch.bfloat16,False,False,torch,0,0,175.3448,native,0.0,1371.69,2912.3
gfx950,256,1,640,2880,True,torch.bfloat16,torch.bfloat16,False,False,flydsl,2015,9,4.8827,flydsl_gemm5_abf16_wbf16_bf16_t16x64x64_split_k9_block_m_warp1_block_n_warp2_block_k_warp1_async_copyTrue_b_to_ldsTrue_b_preshuffleFalse_c_to_ldsFalse_gfx950,0.0203,0.75,756.43
gfx950,256,2,640,2880,True,torch.bfloat16,torch.bfloat16,False,False,flydsl,2015,9,4.8427,flydsl_gemm5_abf16_wbf16_bf16_t16x64x64_split_k9_block_m_warp1_block_n_warp2_block_k_warp1_async_copyTrue_b_to_ldsTrue_b_preshuffleFalse_c_to_ldsFalse_gfx950,0.0164,1.52,764.14
gfx950,256,4,640,2880,True,torch.bfloat16,torch.bfloat16,False,False,flydsl,2015,9,5.0595,flydsl_gemm5_abf16_wbf16_bf16_t16x64x64_split_k9_block_m_warp1_block_n_warp2_block_k_warp1_async_copyTrue_b_to_ldsTrue_b_preshuffleFalse_c_to_ldsFalse_gfx950,0.0188,2.91,734.18
gfx950,256,8,640,2880,True,torch.bfloat16,torch.bfloat16,False,False,flydsl,1357,9,5.2253,flydsl_gemm4_abf16_wbf16_bf16_t16x64x64_split_k9_block_m_warp1_block_n_warp1_block_k_warp2_async_copyTrue_b_to_ldsTrue_b_preshuffleFalse_c_to_ldsFalse_gfx950,0.026,5.64,716.27
gfx950,256,16,640,2880,True,torch.bfloat16,torch.bfloat16,False,False,flydsl,2015,9,5.1791,flydsl_gemm5_abf16_wbf16_bf16_t16x64x64_split_k9_block_m_warp1_block_n_warp2_block_k_warp1_async_copyTrue_b_to_ldsTrue_b_preshuffleFalse_c_to_ldsFalse_gfx950,0.0183,11.39,733.53
gfx950,256,32,640,2880,True,torch.bfloat16,torch.bfloat16,False,False,flydsl,3837,5,5.8205,flydsl_gemm8_abf16_wbf16_bf16_t16x64x64_split_k5_block_m_warp1_block_n_warp2_block_k_warp1_async_copyTrue_b_to_ldsTrue_b_preshuffleFalse_c_to_ldsFalse_gfx950,0.014,20.27,672.05
gfx950,256,48,640,2880,True,torch.bfloat16,torch.bfloat16,False,False,flydsl,3837,5,5.9651,flydsl_gemm8_abf16_wbf16_bf16_t16x64x64_split_k5_block_m_warp1_block_n_warp2_block_k_warp1_async_copyTrue_b_to_ldsTrue_b_preshuffleFalse_c_to_ldsFalse_gfx950,0.0137,29.66,674.64
gfx950,256,64,640,2880,True,torch.bfloat16,torch.bfloat16,False,False,flydsl,5079,5,6.5393,flydsl_gemm7_abf16_wbf16_bf16_t32x64x64_split_k5_block_m_warp1_block_n_warp4_block_k_warp1_async_copyTrue_b_to_ldsTrue_b_preshuffleFalse_c_to_ldsFalse_gfx950,0.0135,36.08,632.63
gfx950,256,80,640,2880,True,torch.bfloat16,torch.bfloat16,False,False,flydsl,5793,5,6.7244,flydsl_gemm8_abf16_wbf16_bf16_t32x64x64_split_k5_block_m_warp2_block_n_warp1_block_k_warp1_async_copyTrue_b_to_ldsTrue_b_preshuffleFalse_c_to_ldsFalse_gfx950,0.0135,43.86,631.97
gfx950,256,96,640,2880,True,torch.bfloat16,torch.bfloat16,False,False,flydsl,5793,5,7.0863,flydsl_gemm8_abf16_wbf16_bf16_t32x64x64_split_k5_block_m_warp2_block_n_warp1_block_k_warp1_async_copyTrue_b_to_ldsTrue_b_preshuffleFalse_c_to_ldsFalse_gfx950,0.0133,49.94,615.59
gfx950,256,112,640,2880,True,torch.bfloat16,torch.bfloat16,False,False,flydsl,5657,3,7.4238,flydsl_gemm8_abf16_wbf16_bf16_t16x64x64_split_k3_block_m_warp1_block_n_warp1_block_k_warp2_async_copyTrue_b_to_ldsTrue_b_preshuffleFalse_c_to_ldsFalse_gfx950,0.0165,55.62,602.77
gfx950,256,128,640,2880,True,torch.bfloat16,torch.bfloat16,False,False,flydsl,5049,3,7.6578,flydsl_gemm6_abf16_wbf16_bf16_t16x64x64_split_k3_block_m_warp1_block_n_warp1_block_k_warp2_async_copyTrue_b_to_ldsTrue_b_preshuffleFalse_c_to_ldsFalse_gfx950,0.0162,61.62,599.07
gfx950,256,256,640,2880,True,torch.bfloat16,torch.bfloat16,False,False,flydsl,4281,3,9.6702,flydsl_gemm5_abf16_wbf16_bf16_t32x64x64_split_k3_block_m_warp1_block_n_warp4_block_k_warp1_async_copyTrue_b_to_ldsTrue_b_preshuffleFalse_c_to_ldsFalse_gfx950,0.0091,97.59,567.58
gfx950,256,1,800,5120,False,torch.bfloat16,torch.bfloat16,False,False,triton,0,0,23.9988,auto,0.0,0.34,341.84
gfx950,256,16,800,5120,False,torch.bfloat16,torch.bfloat16,False,False,triton,0,0,19.3848,auto,0.0,6.76,432.37
gfx950,256,32,800,5120,False,torch.bfloat16,torch.bfloat16,False,False,triton,0,0,21.7693,auto,0.0,12.04,393.71
gfx950,256,64,800,5120,False,torch.bfloat16,torch.bfloat16,False,False,triton,0,0,23.8795,auto,0.0,21.96,374.79
gfx950,256,128,800,5120,False,torch.bfloat16,torch.bfloat16,False,False,triton,0,0,33.711,auto,0.0,31.1,287.96
gfx950,256,256,800,5120,False,torch.bfloat16,torch.bfloat16,False,False,triton,0,0,47.7622,auto,0.0,43.91,234.98
gfx950,256,512,800,5120,False,torch.bfloat16,torch.bfloat16,False,False,triton,0,0,45.1338,auto,0.0,92.93,315.82
gfx950,256,1024,800,5120,False,torch.bfloat16,torch.bfloat16,False,False,triton,0,0,169.7397,auto,0.0,49.42,119.69
gfx950,256,2048,800,5120,False,torch.bfloat16,torch.bfloat16,False,False,triton,0,0,170.1752,auto,0.0,98.59,190.63
gfx950,256,4096,800,5120,False,torch.bfloat16,torch.bfloat16,False,False,triton,0,0,111.1677,auto,0.0,301.84,509.94
gfx950,256,8192,800,5120,False,torch.bfloat16,torch.bfloat16,False,False,triton,0,0,117.7072,auto,0.0,570.13,893.62
gfx950,256,16384,800,5120,False,torch.bfloat16,torch.bfloat16,False,False,triton,0,0,227.3613,auto,0.0,590.33,889.24
gfx950,256,32768,800,5120,False,torch.bfloat16,torch.bfloat16,False,False,triton,0,0,433.4434,auto,0.0,619.31,914.0
gfx950,256,1,1024,7168,False,torch.bfloat16,torch.bfloat16,False,False,flydsl,5260,8,6.6039,flydsl_gemm8_abf16_wbf16_bf16_t16x64x64_split_k8_block_m_warp1_block_n_warp2_block_k_warp1_async_copyTrue_b_to_ldsTrue_b_preshuffleFalse_c_to_ldsFalse_gfx950,0.0254,2.22,2225.42
gfx950,256,2,1024,7168,False,torch.bfloat16,torch.bfloat16,False,False,flydsl,3880,8,6.6637,flydsl_gemm5_abf16_wbf16_bf16_t16x64x128_split_k8_block_m_warp1_block_n_warp2_block_k_warp1_async_copyTrue_b_to_ldsTrue_b_preshuffleFalse_c_to_ldsFalse_gfx950,0.0171,4.41,2207.91
gfx950,256,4,1024,7168,False,torch.bfloat16,torch.bfloat16,False,False,flydsl,5260,8,6.6574,flydsl_gemm8_abf16_wbf16_bf16_t16x64x64_split_k8_block_m_warp1_block_n_warp2_block_k_warp1_async_copyTrue_b_to_ldsTrue_b_preshuffleFalse_c_to_ldsFalse_gfx950,0.0247,8.82,2214.92
gfx950,256,8,1024,7168,False,torch.bfloat16,torch.bfloat16,False,False,flydsl,5260,8,6.7832,flydsl_gemm8_abf16_wbf16_bf16_t16x64x64_split_k8_block_m_warp1_block_n_warp2_block_k_warp1_async_copyTrue_b_to_ldsTrue_b_preshuffleFalse_c_to_ldsFalse_gfx950,0.0198,17.31,2183.5
gfx950,256,16,1024,7168,False,torch.bfloat16,torch.bfloat16,False,False,flydsl,3643,8,7.0733,flydsl_gemm5_abf16_wbf16_bf16_t16x64x128_split_k8_block_m_warp1_block_n_warp2_block_k_warp1_async_copyTrue_b_to_ldsTrue_b_preshuffleFalse_c_to_ldsFalse_gfx950,0.0219,33.21,2112.48
gfx950,256,24,1024,7168,False,torch.bfloat16,torch.bfloat16,False,False,flydsl,4212,8,7.6267,flydsl_gemm6_abf16_wbf16_bf16_t16x64x128_split_k8_block_m_warp1_block_n_warp1_block_k_warp2_async_copyTrue_b_to_ldsTrue_b_preshuffleFalse_c_to_ldsFalse_gfx950,0.0291,46.2,1976.38
gfx950,256,32,1024,7168,False,torch.bfloat16,torch.bfloat16,False,False,flydsl,2993,8,8.0729,flydsl_gemm4_abf16_wbf16_bf16_t16x64x128_split_k8_block_m_warp1_block_n_warp2_block_k_warp1_async_copyTrue_b_to_ldsTrue_b_preshuffleFalse_c_to_ldsFalse_gfx950,0.0215,58.19,1883.38
gfx950,256,40,1024,7168,False,torch.bfloat16,torch.bfloat16,False,False,flydsl,3736,7,8.2562,flydsl_gemm5_abf16_wbf16_bf16_t32x64x128_split_k7_block_m_warp1_block_n_warp4_block_k_warp1_async_copyTrue_b_to_ldsTrue_b_preshuffleFalse_c_to_ldsFalse_gfx950,0.0196,71.12,1857.44
gfx950,256,48,1024,7168,False,torch.bfloat16,torch.bfloat16,False,False,flydsl,3973,7,8.708,flydsl_gemm5_abf16_wbf16_bf16_t32x64x128_split_k7_block_m_warp1_block_n_warp4_block_k_warp1_async_copyTrue_b_to_ldsTrue_b_preshuffleFalse_c_to_ldsFalse_gfx950,0.0193,80.92,1776.12
gfx950,256,56,1024,7168,False,torch.bfloat16,torch.bfloat16,False,False,flydsl,3735,7,9.2053,flydsl_gemm5_abf16_wbf16_bf16_t32x64x128_split_k7_block_m_warp1_block_n_warp2_block_k_warp2_async_copyTrue_b_to_ldsTrue_b_preshuffleFalse_c_to_ldsFalse_gfx950,0.0261,89.31,1694.41
gfx950,256,64,1024,7168,False,torch.bfloat16,torch.bfloat16,False,False,flydsl,4331,7,9.5498,flydsl_gemm4_abf16_wbf16_bf16_t32x64x128_split_k7_block_m_warp2_block_n_warp2_block_k_warp1_async_copyTrue_b_to_ldsTrue_b_preshuffleFalse_c_to_ldsFalse_gfx950,0.0199,98.38,1647.01
gfx950,256,72,1024,7168,False,torch.bfloat16,torch.bfloat16,False,False,flydsl,4319,4,10.0605,flydsl_gemm4_abf16_wbf16_bf16_t32x64x128_split_k4_block_m_warp1_block_n_warp4_block_k_warp1_async_copyTrue_b_to_ldsTrue_b_preshuffleFalse_c_to_ldsFalse_gfx950,0.0142,105.06,1576.43
gfx950,256,80,1024,7168,False,torch.bfloat16,torch.bfloat16,False,False,flydsl,4319,4,10.3519,flydsl_gemm4_abf16_wbf16_bf16_t32x64x128_split_k4_block_m_warp1_block_n_warp4_block_k_warp1_async_copyTrue_b_to_ldsTrue_b_preshuffleFalse_c_to_ldsFalse_gfx950,0.014,113.45,1544.72
gfx950,256,88,1024,7168,False,torch.bfloat16,torch.bfloat16,False,False,flydsl,4322,4,10.7844,flydsl_gemm4_abf16_wbf16_bf16_t32x64x128_split_k4_block_m_warp2_block_n_warp2_block_k_warp1_async_copyTrue_b_to_ldsTrue_b_preshuffleFalse_c_to_ldsFalse_gfx950,0.0138,119.79,1494.92
gfx950,256,96,1024,7168,False,torch.bfloat16,torch.bfloat16,False,False,flydsl,4127,4,11.0603,flydsl_gemm4_abf16_wbf16_bf16_t32x64x128_split_k4_block_m_warp1_block_n_warp4_block_k_warp1_async_copyTrue_b_to_ldsTrue_b_preshuffleFalse_c_to_ldsFalse_gfx950,0.0142,127.42,1469.48
gfx950,256,104,1024,7168,False,torch.bfloat16,torch.bfloat16,False,False,flydsl,4318,4,10.9568,flydsl_gemm4_abf16_wbf16_bf16_t32x64x128_split_k4_block_m_warp1_block_n_warp2_block_k_warp2_async_copyTrue_b_to_ldsTrue_b_preshuffleFalse_c_to_ldsFalse_gfx950,0.0215,139.34,1495.33
gfx950,256,112,1024,7168,False,torch.bfloat16,torch.bfloat16,False,False,flydsl,4319,4,11.3875,flydsl_gemm4_abf16_wbf16_bf16_t32x64x128_split_k4_block_m_warp1_block_n_warp4_block_k_warp1_async_copyTrue_b_to_ldsTrue_b_preshuffleFalse_c_to_ldsFalse_gfx950,0.0135,144.38,1450.28
gfx950,256,120,1024,7168,False,torch.bfloat16,torch.bfloat16,False,False,flydsl,4127,4,11.7996,flydsl_gemm4_abf16_wbf16_bf16_t32x64x128_split_k4_block_m_warp1_block_n_warp4_block_k_warp1_async_copyTrue_b_to_ldsTrue_b_preshuffleFalse_c_to_ldsFalse_gfx950,0.0139,149.29,1410.74
gfx950,256,128,1024,7168,False,torch.bfloat16,torch.bfloat16,False,False,flydsl,4859,4,12.093,flydsl_gemm4_abf16_wbf16_bf16_t32x64x128_split_k4_block_m_warp1_block_n_warp4_block_k_warp1_async_copyTrue_b_to_ldsTrue_b_preshuffleFalse_c_to_ldsFalse_gfx950,0.0143,155.38,1387.35
gfx950,256,136,1024,7168,False,torch.bfloat16,torch.bfloat16,False,False,flydsl,5199,4,13.0145,flydsl_gemm4_abf16_wbf16_bf16_t64x64x128_split_k4_block_m_warp2_block_n_warp1_block_k_warp2_async_copyTrue_b_to_ldsTrue_b_preshuffleFalse_c_to_ldsFalse_gfx950,0.0219,153.4,1299.19
gfx950,256,144,1024,7168,False,torch.bfloat16,torch.bfloat16,False,False,flydsl,5829,4,12.7936,flydsl_gemm5_abf16_wbf16_bf16_t64x64x128_split_k4_block_m_warp4_block_n_warp2_block_k_warp1_async_copyTrue_b_to_ldsTrue_b_preshuffleFalse_c_to_ldsFalse_gfx950,0.0145,165.23,1331.87
gfx950,256,152,1024,7168,False,torch.bfloat16,torch.bfloat16,False,False,flydsl,3899,4,13.2001,flydsl_gemm3_abf16_wbf16_bf16_t64x64x128_split_k4_block_m_warp2_block_n_warp2_block_k_warp1_async_copyTrue_b_to_ldsTrue_b_preshuffleFalse_c_to_ldsFalse_gfx950,0.0142,169.04,1300.78
gfx950,256,160,1024,7168,False,torch.bfloat16,torch.bfloat16,False,False,flydsl,5201,4,13.0061,flydsl_gemm4_abf16_wbf16_bf16_t64x64x128_split_k4_block_m_warp2_block_n_warp2_block_k_warp1_async_copyTrue_b_to_ldsTrue_b_preshuffleFalse_c_to_ldsFalse_gfx950,0.0139,180.59,1330.26
gfx950,256,168,1024,7168,False,torch.bfloat16,torch.bfloat16,False,False,flydsl,7299,4,13.2493,flydsl_gemm8_abf16_wbf16_bf16_t48x64x64_split_k4_block_m_warp1_block_n_warp2_block_k_warp1_async_copyTrue_b_to_ldsTrue_b_preshuffleFalse_c_to_ldsFalse_gfx950,0.0144,186.14,1315.74
gfx950,256,176,1024,7168,False,torch.bfloat16,torch.bfloat16,False,False,flydsl,5203,4,13.8817,flydsl_gemm4_abf16_wbf16_bf16_t64x64x128_split_k4_block_m_warp2_block_n_warp4_block_k_warp1_async_copyTrue_b_to_ldsTrue_b_preshuffleFalse_c_to_ldsFalse_gfx950,0.0143,186.12,1265.24
gfx950,256,184,1024,7168,False,torch.bfloat16,torch.bfloat16,False,False,flydsl,3376,4,13.7773,flydsl_gemm3_abf16_wbf16_bf16_t32x64x128_split_k4_block_m_warp1_block_n_warp4_block_k_warp1_async_copyTrue_b_to_ldsTrue_b_preshuffleFalse_c_to_ldsFalse_gfx950,0.0145,196.06,1284.34
gfx950,256,192,1024,7168,False,torch.bfloat16,torch.bfloat16,False,False,flydsl,3276,4,14.5624,flydsl_gemm3_abf16_wbf16_bf16_t32x64x128_split_k4_block_m_warp2_block_n_warp1_block_k_warp2_async_copyTrue_b_to_ldsTrue_b_preshuffleFalse_c_to_ldsFalse_gfx950,0.0216,193.55,1224.1
gfx950,256,200,1024,7168,False,torch.bfloat16,torch.bfloat16,False,False,flydsl,5010,4,14.5289,flydsl_gemm4_abf16_wbf16_bf16_t64x64x128_split_k4_block_m_warp2_block_n_warp2_block_k_warp2_async_copyTrue_b_to_ldsTrue_b_preshuffleFalse_c_to_ldsFalse_gfx950,0.0216,202.08,1235.94
gfx950,256,208,1024,7168,False,torch.bfloat16,torch.bfloat16,False,False,flydsl,5008,4,14.7296,flydsl_gemm4_abf16_wbf16_bf16_t64x64x128_split_k4_block_m_warp2_block_n_warp1_block_k_warp4_async_copyTrue_b_to_ldsTrue_b_preshuffleFalse_c_to_ldsFalse_gfx950,0.0294,207.3,1228.0
gfx950,256,216,1024,7168,False,torch.bfloat16,torch.bfloat16,False,False,flydsl,3793,4,15.5173,flydsl_gemm3_abf16_wbf16_bf16_t64x64x128_split_k4_block_m_warp1_block_n_warp4_block_k_warp2_async_copyTrue_b_to_ldsTrue_b_preshuffleFalse_c_to_ldsFalse_gfx950,0.022,204.35,1174.11
gfx950,256,224,1024,7168,False,torch.bfloat16,torch.bfloat16,False,False,flydsl,6057,4,15.4442,flydsl_gemm5_abf16_wbf16_bf16_t64x64x128_split_k4_block_m_warp1_block_n_warp4_block_k_warp2_async_copyTrue_b_to_ldsTrue_b_preshuffleFalse_c_to_ldsFalse_gfx950,0.0218,212.92,1188.15
gfx950,256,232,1024,7168,False,torch.bfloat16,torch.bfloat16,False,False,flydsl,4849,2,15.2406,flydsl_gemm4_abf16_wbf16_bf16_t32x64x128_split_k2_block_m_warp1_block_n_warp2_block_k_warp2_async_copyTrue_b_to_ldsTrue_b_preshuffleFalse_c_to_ldsFalse_gfx950,0.0138,223.47,1212.63
gfx950,256,240,1024,7168,False,torch.bfloat16,torch.bfloat16,False,False,flydsl,4850,2,15.562,flydsl_gemm4_abf16_wbf16_bf16_t32x64x128_split_k2_block_m_warp1_block_n_warp4_block_k_warp1_async_copyTrue_b_to_ldsTrue_b_preshuffleFalse_c_to_ldsFalse_gfx950,0.0059,226.4,1196.0
gfx950,256,248,1024,7168,False,torch.bfloat16,torch.bfloat16,False,False,asm,8,5,16.2802,_ZN5aiter39bf16gemm_fp32bf16_tn_96x64_splitk_cleanE,0.0163,223.62,1151.29
gfx950,256,256,1024,7168,False,torch.bfloat16,torch.bfloat16,False,False,asm,8,5,16.2056,_ZN5aiter39bf16gemm_fp32bf16_tn_96x64_splitk_cleanE,0.0162,231.9,1164.68
gfx950,256,264,1024,7168,False,torch.bfloat16,torch.bfloat16,False,False,asm,8,5,16.4273,_ZN5aiter39bf16gemm_fp32bf16_tn_96x64_splitk_cleanE,0.0162,235.92,1156.94
gfx950,256,272,1024,7168,False,torch.bfloat16,torch.bfloat16,False,False,asm,8,5,16.4801,_ZN5aiter39bf16gemm_fp32bf16_tn_96x64_splitk_cleanE,0.0163,242.29,1161.19
gfx950,256,280,1024,7168,False,torch.bfloat16,torch.bfloat16,False,False,asm,8,5,16.5537,_ZN5aiter39bf16gemm_fp32bf16_tn_96x64_splitk_cleanE,0.0164,248.31,1163.94
gfx950,256,288,1024,7168,False,torch.bfloat16,torch.bfloat16,False,False,asm,8,5,16.761,_ZN5aiter39bf16gemm_fp32bf16_tn_96x64_splitk_cleanE,0.0164,252.24,1157.37
gfx950,256,296,1024,7168,False,torch.bfloat16,torch.bfloat16,False,False,asm,7,4,17.4462,_ZN5aiter39bf16gemm_fp32bf16_tn_80x64_splitk_cleanE,0.0137,249.07,1119.43
gfx950,256,304,1024,7168,False,torch.bfloat16,torch.bfloat16,False,False,asm,7,4,17.5321,_ZN5aiter39bf16gemm_fp32bf16_tn_80x64_splitk_cleanE,0.0138,254.55,1121.42
gfx950,256,312,1024,7168,False,torch.bfloat16,torch.bfloat16,False,False,asm,7,4,17.6715,_ZN5aiter39bf16gemm_fp32bf16_tn_80x64_splitk_cleanE,0.0138,259.18,1119.99
gfx950,256,320,1024,7168,False,torch.bfloat16,torch.bfloat16,False,False,asm,7,4,17.6429,_ZN5aiter39bf16gemm_fp32bf16_tn_80x64_splitk_cleanE,0.0138,266.26,1129.23
gfx950,256,328,1024,7168,False,torch.bfloat16,torch.bfloat16,False,False,asm,8,4,17.9591,_ZN5aiter39bf16gemm_fp32bf16_tn_96x64_splitk_cleanE,0.0138,268.11,1116.65
gfx950,256,336,1024,7168,False,torch.bfloat16,torch.bfloat16,False,False,asm,8,4,18.1806,_ZN5aiter39bf16gemm_fp32bf16_tn_96x64_splitk_cleanE,0.0136,271.31,1110.25
gfx950,256,344,1024,7168,False,torch.bfloat16,torch.bfloat16,False,False,asm,8,4,18.1371,_ZN5aiter39bf16gemm_fp32bf16_tn_96x64_splitk_cleanE,0.0137,278.43,1120.14
gfx950,256,352,1024,7168,False,torch.bfloat16,torch.bfloat16,False,False,asm,8,4,18.2424,_ZN5aiter39bf16gemm_fp32bf16_tn_96x64_splitk_cleanE,0.0137,283.26,1120.86
gfx950,256,376,1024,7168,False,torch.bfloat16,torch.bfloat16,False,False,asm,8,4,18.7006,_ZN5aiter39bf16gemm_fp32bf16_tn_96x64_splitk_cleanE,0.0138,295.16,1114.43
gfx950,256,384,1024,7168,False,torch.bfloat16,torch.bfloat16,False,False,asm,8,4,18.7156,_ZN5aiter39bf16gemm_fp32bf16_tn_96x64_splitk_cleanE,0.0136,301.2,1120.54
gfx950,256,416,1024,7168,False,torch.bfloat16,torch.bfloat16,False,False,torch,0,0,20.9479,native,0.0,291.53,1026.16
gfx950,256,448,1024,7168,False,torch.bfloat16,torch.bfloat16,False,False,asm,8,3,21.4441,_ZN5aiter39bf16gemm_fp32bf16_tn_96x64_splitk_cleanE,0.0107,306.69,1026.86
gfx950,256,480,1024,7168,False,torch.bfloat16,torch.bfloat16,False,False,asm,8,3,21.6426,_ZN5aiter39bf16gemm_fp32bf16_tn_96x64_splitk_cleanE,0.0107,325.58,1041.67
gfx950,256,512,1024,7168,False,torch.bfloat16,torch.bfloat16,False,False,torch,0,0,19.268,native,0.0,390.09,1197.25
gfx950,256,544,1024,7168,False,torch.bfloat16,torch.bfloat16,False,False,asm,7,2,26.831,_ZN5aiter39bf16gemm_fp32bf16_tn_80x64_splitk_cleanE,0.0061,297.64,879.32
gfx950,256,576,1024,7168,False,torch.bfloat16,torch.bfloat16,False,False,torch,0,0,21.1005,native,0.0,400.74,1142.97
gfx950,256,608,1024,7168,False,torch.bfloat16,torch.bfloat16,False,False,torch,0,0,26.6675,native,0.0,334.69,924.03
gfx950,256,640,1024,7168,False,torch.bfloat16,torch.bfloat16,False,False,torch,0,0,26.8357,native,0.0,350.1,937.77
gfx950,256,672,1024,7168,False,torch.bfloat16,torch.bfloat16,False,False,opus,1221,4,28.4151,opus_gemm_flatmm_splitk_256x96x64x64_2x1_16x16x32_0x0x0_wgpcu2_nooob,0.0,347.17,904.1
gfx950,256,704,1024,7168,False,torch.bfloat16,torch.bfloat16,False,False,torch,0,0,27.5298,native,0.0,375.4,952.22
gfx950,256,736,1024,7168,False,torch.bfloat16,torch.bfloat16,False,False,torch,0,0,27.8659,native,0.0,387.73,959.55
gfx950,256,768,1024,7168,False,torch.bfloat16,torch.bfloat16,False,False,torch,0,0,28.5208,native,0.0,395.3,955.9
gfx950,256,800,1024,7168,False,torch.bfloat16,torch.bfloat16,False,False,flydsl,6031,1,30.9258,flydsl_gemm5_abf16_wbf16_bf16_t64x64x128_split_k1_block_m_warp4_block_n_warp1_block_k_warp2_async_copyTrue_b_to_ldsTrue_b_preshuffleFalse_c_to_ldsFalse_gfx950,0.006,379.75,898.51
gfx950,256,832,1024,7168,False,torch.bfloat16,torch.bfloat16,False,False,torch,0,0,29.921,native,0.0,408.2,946.21
gfx950,256,864,1024,7168,False,torch.bfloat16,torch.bfloat16,False,False,torch,0,0,30.642,native,0.0,413.93,941.06
gfx950,256,896,1024,7168,False,torch.bfloat16,torch.bfloat16,False,False,torch,0,0,30.3297,native,0.0,433.68,968.03
gfx950,256,928,1024,7168,False,torch.bfloat16,torch.bfloat16,False,False,flydsl,3866,1,31.292,flydsl_gemm3_abf16_wbf16_bf16_t64x64x128_split_k1_block_m_warp2_block_n_warp2_block_k_warp2_async_copyTrue_b_to_ldsTrue_b_preshuffleFalse_c_to_ldsFalse_gfx950,0.006,435.35,955.02
gfx950,256,960,1024,7168,False,torch.bfloat16,torch.bfloat16,False,False,flydsl,3866,1,31.6494,flydsl_gemm3_abf16_wbf16_bf16_t64x64x128_split_k1_block_m_warp2_block_n_warp2_block_k_warp2_async_copyTrue_b_to_ldsTrue_b_preshuffleFalse_c_to_ldsFalse_gfx950,0.0061,445.28,960.8
gfx950,256,992,1024,7168,False,torch.bfloat16,torch.bfloat16,False,False,flydsl,3866,1,31.6368,flydsl_gemm3_abf16_wbf16_bf16_t64x64x128_split_k1_block_m_warp2_block_n_warp2_block_k_warp2_async_copyTrue_b_to_ldsTrue_b_preshuffleFalse_c_to_ldsFalse_gfx950,0.0061,460.31,977.75
gfx950,256,1024,1024,7168,False,torch.bfloat16,torch.bfloat16,False,False,torch,0,0,28.1669,native,0.0,533.69,1116.82
gfx950,256,1088,1024,7168,False,torch.bfloat16,torch.bfloat16,False,False,torch,0,0,34.5866,native,0.0,461.79,939.84
gfx950,256,1152,1024,7168,False,torch.bfloat16,torch.bfloat16,False,False,torch,0,0,34.7148,native,0.0,487.15,966.57
gfx950,256,1216,1024,7168,False,torch.bfloat16,torch.bfloat16,False,False,torch,0,0,36.1446,native,0.0,493.88,957.35
gfx950,256,1280,1024,7168,False,torch.bfloat16,torch.bfloat16,False,False,torch,0,0,35.8657,native,0.0,523.91,994.03
gfx950,256,1344,1024,7168,False,torch.bfloat16,torch.bfloat16,False,False,torch,0,0,38.9633,native,0.0,506.37,941.92
gfx950,256,1408,1024,7168,False,torch.bfloat16,torch.bfloat16,False,False,torch,0,0,40.0609,native,0.0,515.95,942.28
gfx950,256,1472,1024,7168,False,torch.bfloat16,torch.bfloat16,False,False,torch,0,0,39.5428,native,0.0,546.47,981.15
gfx950,256,1536,1024,7168,False,torch.bfloat16,torch.bfloat16,False,False,torch,0,0,36.906,native,0.0,610.97,1079.66
gfx950,256,1600,1024,7168,False,torch.bfloat16,torch.bfloat16,False,False,torch,0,0,43.3333,native,0.0,542.03,943.72
gfx950,256,1664,1024,7168,False,torch.bfloat16,torch.bfloat16,False,False,flydsl,2742,1,46.6312,flydsl_gemm3_abf16_wbf16_bf16_t128x64x128_split_k1_block_m_warp4_block_n_warp2_block_k_warp2_async_copyTrue_b_to_ldsTrue_b_preshuffleFalse_c_to_ldsFalse_gfx950,0.0061,523.85,899.46
gfx950,256,1728,1024,7168,False,torch.bfloat16,torch.bfloat16,False,False,torch,0,0,44.2477,native,0.0,573.3,971.61
gfx950,256,1792,1024,7168,False,torch.bfloat16,torch.bfloat16,False,False,torch,0,0,46.3957,native,0.0,567.01,949.23
gfx950,256,1856,1024,7168,False,torch.bfloat16,torch.bfloat16,False,False,flydsl,2737,1,48.4636,flydsl_gemm3_abf16_wbf16_bf16_t128x64x128_split_k1_block_m_warp2_block_n_warp4_block_k_warp2_async_copyTrue_b_to_ldsTrue_b_preshuffleFalse_c_to_ldsFalse_gfx950,0.006,562.2,930.36
gfx950,256,1920,1024,7168,False,torch.bfloat16,torch.bfloat16,False,False,torch,0,0,46.4962,native,0.0,606.19,992.28
gfx950,256,1984,1024,7168,False,torch.bfloat16,torch.bfloat16,False,False,flydsl,2737,1,49.5636,flydsl_gemm3_abf16_wbf16_bf16_t128x64x128_split_k1_block_m_warp2_block_n_warp4_block_k_warp2_async_copyTrue_b_to_ldsTrue_b_preshuffleFalse_c_to_ldsFalse_gfx950,0.006,587.63,952.03
gfx950,256,2048,1024,7168,False,torch.bfloat16,torch.bfloat16,False,False,torch,0,0,43.7099,native,0.0,687.83,1103.51
gfx950,256,4096,1024,7168,False,torch.bfloat16,torch.bfloat16,False,False,torch,0,0,69.5626,native,0.0,864.39,1175.76
gfx950,256,6144,1024,7168,False,torch.bfloat16,torch.bfloat16,False,False,torch,0,0,103.6631,native,0.0,870.07,1112.68
gfx950,256,8192,1024,7168,False,torch.bfloat16,torch.bfloat16,False,False,opus,1401,0,106.3943,opus_gemm_mono_tile_512x128x256x64_2x4_16x16x32_0x0x0_nooob,0.0,1130.32,1399.49
gfx950,256,10240,1024,7168,False,torch.bfloat16,torch.bfloat16,False,False,torch,0,0,127.5259,native,0.0,1178.77,1430.71
gfx950,256,12288,1024,7168,False,torch.bfloat16,torch.bfloat16,False,False,opus,1400,0,137.8139,opus_gemm_mono_tile_512x192x256x64_2x4_16x16x32_0x0x0_nooob,0.0,1308.93,1567.38
gfx950,256,14336,1024,7168,False,torch.bfloat16,torch.bfloat16,False,False,torch,0,0,165.0953,native,0.0,1274.74,1511.62
gfx950,256,16384,1024,7168,False,torch.bfloat16,torch.bfloat16,False,False,torch,0,0,171.4178,native,0.0,1403.11,1651.61
gfx950,256,32768,1024,7168,False,torch.bfloat16,torch.bfloat16,False,False,torch,0,0,327.2819,native,0.0,1469.79,1685.25
gfx950,256,1,1280,8192,False,torch.bfloat16,torch.bfloat16,False,False,flydsl,5871,8,6.9848,flydsl_gemm4_abf16_wbf16_bf16_t16x64x128_split_k8_block_m_warp1_block_n_warp2_block_k_warp1_async_copyTrue_b_to_ldsTrue_b_preshuffleFalse_c_to_ldsFalse_gfx950,0.0219,3.0,3005.16
gfx950,256,16,1280,8192,False,torch.bfloat16,torch.bfloat16,False,False,flydsl,8147,8,7.5374,flydsl_gemm5_abf16_wbf16_bf16_t16x64x128_split_k8_block_m_warp1_block_n_warp2_block_k_warp1_async_copyTrue_b_to_ldsTrue_b_preshuffleFalse_c_to_ldsFalse_gfx950,0.0204,44.52,2822.54
gfx950,256,32,1280,8192,False,torch.bfloat16,torch.bfloat16,False,False,flydsl,6407,8,8.7685,flydsl_gemm4_abf16_wbf16_bf16_t32x64x128_split_k8_block_m_warp1_block_n_warp2_block_k_warp2_async_copyTrue_b_to_ldsTrue_b_preshuffleFalse_c_to_ldsFalse_gfx950,0.028,76.53,2460.82
gfx950,256,64,1280,8192,False,torch.bfloat16,torch.bfloat16,False,False,flydsl,8567,4,11.5331,flydsl_gemm4_abf16_wbf16_bf16_t32x64x128_split_k4_block_m_warp1_block_n_warp4_block_k_warp1_async_copyTrue_b_to_ldsTrue_b_preshuffleFalse_c_to_ldsFalse_gfx950,0.0143,116.38,1923.5
gfx950,256,128,1280,8192,False,torch.bfloat16,torch.bfloat16,False,False,asm,5,6,15.0329,_ZN5aiter39bf16gemm_fp32bf16_tn_64x64_splitk_cleanE,0.0179,178.57,1556.34
gfx950,256,256,1280,8192,False,torch.bfloat16,torch.bfloat16,False,False,asm,8,4,18.8414,_ZN5aiter39bf16gemm_fp32bf16_tn_96x64_splitk_cleanE,0.0141,284.94,1370.45
gfx950,256,512,1280,8192,False,torch.bfloat16,torch.bfloat16,False,False,asm,8,2,29.8384,_ZN5aiter39bf16gemm_fp32bf16_tn_96x64_splitk_cleanE,0.0061,359.85,1027.9
gfx950,256,1024,1280,8192,False,torch.bfloat16,torch.bfloat16,False,False,asm,9,1,52.4555,_ZN5aiter37bf16gemm_fp32bf16_tn_96x64_pf3_splitkE,0.0,409.39,769.61
gfx950,256,2048,1280,8192,False,torch.bfloat16,torch.bfloat16,False,False,torch,0,0,63.0195,native,0.0,681.53,948.42
gfx950,256,4096,1280,8192,False,torch.bfloat16,torch.bfloat16,False,False,torch,0,0,94.9953,native,0.0,904.25,1037.59
gfx950,256,8192,1280,8192,False,torch.bfloat16,torch.bfloat16,False,False,asm,10,1,170.9303,_ZN5aiter24bf16gemm_bf16_tn_256x256E,0.0,1005.08,1030.6
gfx950,256,16384,1280,8192,False,torch.bfloat16,torch.bfloat16,False,False,asm,10,1,319.2235,_ZN5aiter24bf16gemm_bf16_tn_256x256E,0.0,1076.35,1037.99
gfx950,256,32768,1280,8192,False,torch.bfloat16,torch.bfloat16,False,False,asm,10,1,539.6049,_ZN5aiter24bf16gemm_bf16_tn_256x256E,0.0,1273.51,1189.26
gfx950,256,1,2048,7168,False,torch.bfloat16,torch.bfloat16,False,False,flydsl,3892,7,8.0321,flydsl_gemm5_abf16_wbf16_bf16_t16x64x64_split_k7_block_m_warp1_block_n_warp2_block_k_warp1_async_copyTrue_b_to_ldsTrue_b_preshuffleFalse_c_to_ldsFalse_gfx950,0.0127,3.66,3657.64
gfx950,256,2,2048,7168,False,torch.bfloat16,torch.bfloat16,False,False,flydsl,1792,7,8.1807,flydsl_gemm3_abf16_wbf16_bf16_t16x64x128_split_k7_block_m_warp1_block_n_warp2_block_k_warp1_async_copyTrue_b_to_ldsTrue_b_preshuffleFalse_c_to_ldsFalse_gfx950,0.0173,7.18,3593.46
gfx950,256,4,2048,7168,False,torch.bfloat16,torch.bfloat16,False,False,flydsl,4947,7,8.2993,flydsl_gemm7_abf16_wbf16_bf16_t16x64x64_split_k7_block_m_warp1_block_n_warp2_block_k_warp1_async_copyTrue_b_to_ldsTrue_b_preshuffleFalse_c_to_ldsFalse_gfx950,0.0178,14.15,3546.55
gfx950,256,8,2048,7168,False,torch.bfloat16,torch.bfloat16,False,False,flydsl,3892,7,8.5192,flydsl_gemm5_abf16_wbf16_bf16_t16x64x64_split_k7_block_m_warp1_block_n_warp2_block_k_warp1_async_copyTrue_b_to_ldsTrue_b_preshuffleFalse_c_to_ldsFalse_gfx950,0.019,27.57,3463.66
gfx950,256,16,2048,7168,False,torch.bfloat16,torch.bfloat16,False,False,flydsl,3892,7,8.9187,flydsl_gemm5_abf16_wbf16_bf16_t16x64x64_split_k7_block_m_warp1_block_n_warp2_block_k_warp1_async_copyTrue_b_to_ldsTrue_b_preshuffleFalse_c_to_ldsFalse_gfx950,0.0205,52.67,3325.04
gfx950,256,32,2048,7168,False,torch.bfloat16,torch.bfloat16,False,False,flydsl,4618,7,10.3766,flydsl_gemm6_abf16_wbf16_bf16_t32x64x64_split_k7_block_m_warp1_block_n_warp4_block_k_warp1_async_copyTrue_b_to_ldsTrue_b_preshuffleFalse_c_to_ldsFalse_gfx950,0.0202,90.54,2886.3
gfx950,256,48,2048,7168,False,torch.bfloat16,torch.bfloat16,False,False,flydsl,3203,4,11.6173,flydsl_gemm4_abf16_wbf16_bf16_t32x64x128_split_k4_block_m_warp1_block_n_warp2_block_k_warp2_async_copyTrue_b_to_ldsTrue_b_preshuffleFalse_c_to_ldsFalse_gfx950,0.0216,121.31,2603.43
gfx950,256,64,2048,7168,False,torch.bfloat16,torch.bfloat16,False,False,flydsl,4319,4,12.868,flydsl_gemm4_abf16_wbf16_bf16_t32x64x128_split_k4_block_m_warp1_block_n_warp4_block_k_warp1_async_copyTrue_b_to_ldsTrue_b_preshuffleFalse_c_to_ldsFalse_gfx950,0.0138,146.02,2373.31
gfx950,256,80,2048,7168,False,torch.bfloat16,torch.bfloat16,False,False,flydsl,6806,4,13.3774,flydsl_gemm8_abf16_wbf16_bf16_t64x64x64_split_k4_block_m_warp1_block_n_warp4_block_k_warp1_async_copyTrue_b_to_ldsTrue_b_preshuffleFalse_c_to_ldsFalse_gfx950,0.0142,175.58,2304.98
gfx950,256,96,2048,7168,False,torch.bfloat16,torch.bfloat16,False,False,flydsl,4659,4,14.3113,flydsl_gemm4_abf16_wbf16_bf16_t64x64x128_split_k4_block_m_warp2_block_n_warp1_block_k_warp2_async_copyTrue_b_to_ldsTrue_b_preshuffleFalse_c_to_ldsFalse_gfx950,0.0216,196.95,2175.18
gfx950,256,112,2048,7168,False,torch.bfloat16,torch.bfloat16,False,False,flydsl,4310,2,15.4236,flydsl_gemm4_abf16_wbf16_bf16_t32x64x128_split_k2_block_m_warp1_block_n_warp4_block_k_warp1_async_copyTrue_b_to_ldsTrue_b_preshuffleFalse_c_to_ldsFalse_gfx950,0.0058,213.2,2037.43
gfx950,256,128,2048,7168,False,torch.bfloat16,torch.bfloat16,False,False,asm,5,4,17.1162,_ZN5aiter39bf16gemm_fp32bf16_tn_64x64_splitk_cleanE,0.0139,219.56,1853.18
gfx950,256,144,2048,7168,False,torch.bfloat16,torch.bfloat16,False,False,asm,7,4,17.7038,_ZN5aiter39bf16gemm_fp32bf16_tn_80x64_splitk_cleanE,0.0141,238.81,1808.33
gfx950,256,160,2048,7168,False,torch.bfloat16,torch.bfloat16,False,False,asm,7,4,17.9192,_ZN5aiter39bf16gemm_fp32bf16_tn_80x64_splitk_cleanE,0.0142,262.16,1803.05
gfx950,256,176,2048,7168,False,torch.bfloat16,torch.bfloat16,False,False,asm,8,4,18.8339,_ZN5aiter39bf16gemm_fp32bf16_tn_96x64_splitk_cleanE,0.014,274.37,1731.14
gfx950,256,192,2048,7168,False,torch.bfloat16,torch.bfloat16,False,False,asm,8,4,19.0188,_ZN5aiter39bf16gemm_fp32bf16_tn_96x64_splitk_cleanE,0.014,296.4,1729.82
gfx950,256,208,2048,7168,False,torch.bfloat16,torch.bfloat16,False,False,flydsl,3878,2,22.0336,flydsl_gemm3_abf16_wbf16_bf16_t64x64x128_split_k2_block_m_warp1_block_n_warp4_block_k_warp2_async_copyTrue_b_to_ldsTrue_b_preshuffleFalse_c_to_ldsFalse_gfx950,0.0141,277.16,1506.52
gfx950,256,224,2048,7168,False,torch.bfloat16,torch.bfloat16,False,False,flydsl,6040,2,22.2215,flydsl_gemm5_abf16_wbf16_bf16_t64x64x128_split_k2_block_m_warp1_block_n_warp4_block_k_warp2_async_copyTrue_b_to_ldsTrue_b_preshuffleFalse_c_to_ldsFalse_gfx950,0.0141,295.96,1507.05
gfx950,256,240,2048,7168,False,torch.bfloat16,torch.bfloat16,False,False,flydsl,4838,1,23.4538,flydsl_gemm4_abf16_wbf16_bf16_t32x64x128_split_k1_block_m_warp1_block_n_warp1_block_k_warp4_async_copyTrue_b_to_ldsTrue_b_preshuffleFalse_c_to_ldsFalse_gfx950,0.0138,300.44,1440.44
gfx950,256,256,2048,7168,False,torch.bfloat16,torch.bfloat16,False,False,torch,0,0,21.3173,native,0.0,352.59,1598.64
gfx950,256,288,2048,7168,False,torch.bfloat16,torch.bfloat16,False,False,asm,7,2,26.7437,_ZN5aiter39bf16gemm_fp32bf16_tn_80x64_splitk_cleanE,0.0061,316.18,1296.33
gfx950,256,320,2048,7168,False,torch.bfloat16,torch.bfloat16,False,False,torch,0,0,25.9992,native,0.0,361.37,1356.13
gfx950,256,352,2048,7168,False,torch.bfloat16,torch.bfloat16,False,False,torch,0,0,27.5807,native,0.0,374.71,1299.76
gfx950,256,384,2048,7168,False,torch.bfloat16,torch.bfloat16,False,False,torch,0,0,28.0173,native,0.0,402.4,1300.55
gfx950,256,416,2048,7168,False,torch.bfloat16,torch.bfloat16,False,False,flydsl,3866,1,29.8441,flydsl_gemm3_abf16_wbf16_bf16_t64x64x128_split_k1_block_m_warp2_block_n_warp2_block_k_warp2_async_copyTrue_b_to_ldsTrue_b_preshuffleFalse_c_to_ldsFalse_gfx950,0.0058,409.25,1240.71
gfx950,256,448,2048,7168,False,torch.bfloat16,torch.bfloat16,False,False,torch,0,0,30.5558,native,0.0,430.47,1231.11
gfx950,256,480,2048,7168,False,torch.bfloat16,torch.bfloat16,False,False,flydsl,3866,1,30.7825,flydsl_gemm3_abf16_wbf16_bf16_t64x64x128_split_k1_block_m_warp2_block_n_warp2_block_k_warp2_async_copyTrue_b_to_ldsTrue_b_preshuffleFalse_c_to_ldsFalse_gfx950,0.0058,457.82,1241.21
gfx950,256,512,2048,7168,False,torch.bfloat16,torch.bfloat16,False,False,torch,0,0,28.8314,native,0.0,521.39,1345.66
gfx950,256,544,2048,7168,False,torch.bfloat16,torch.bfloat16,False,False,torch,0,0,35.4463,native,0.0,450.59,1111.18
gfx950,256,576,2048,7168,False,torch.bfloat16,torch.bfloat16,False,False,torch,0,0,29.8177,native,0.0,567.16,1340.71
gfx950,256,608,2048,7168,False,torch.bfloat16,torch.bfloat16,False,False,torch,0,0,36.0915,native,0.0,494.6,1124.0
gfx950,256,640,2048,7168,False,torch.bfloat16,torch.bfloat16,False,False,torch,0,0,36.6466,native,0.0,512.75,1123.07
gfx950,256,672,2048,7168,False,torch.bfloat16,torch.bfloat16,False,False,flydsl,5420,1,39.7793,flydsl_gemm4_abf16_wbf16_bf16_t96x64x128_split_k1_block_m_warp1_block_n_warp2_block_k_warp2_async_copyTrue_b_to_ldsTrue_b_preshuffleFalse_c_to_ldsFalse_gfx950,0.006,495.99,1049.45
gfx950,256,704,2048,7168,False,torch.bfloat16,torch.bfloat16,False,False,torch,0,0,39.4673,native,0.0,523.71,1072.69
gfx950,256,736,2048,7168,False,torch.bfloat16,torch.bfloat16,False,False,torch,0,0,40.5077,native,0.0,533.46,1059.7
gfx950,256,768,2048,7168,False,torch.bfloat16,torch.bfloat16,False,False,torch,0,0,40.4881,native,0.0,556.92,1074.78
gfx950,256,800,2048,7168,False,torch.bfloat16,torch.bfloat16,False,False,torch,0,0,42.8657,native,0.0,547.95,1028.93
gfx950,256,832,2048,7168,False,torch.bfloat16,torch.bfloat16,False,False,torch,0,0,44.9941,native,0.0,542.91,993.36
gfx950,256,864,2048,7168,False,torch.bfloat16,torch.bfloat16,False,False,flydsl,3585,1,44.8346,flydsl_gemm3_abf16_wbf16_bf16_t64x128x128_split_k1_block_m_warp2_block_n_warp4_block_k_warp2_async_copyTrue_b_to_ldsTrue_b_preshuffleFalse_c_to_ldsFalse_gfx950,0.006,565.79,1010.05
gfx950,256,896,2048,7168,False,torch.bfloat16,torch.bfloat16,False,False,torch,0,0,45.3161,native,0.0,580.51,1012.34
gfx950,256,928,2048,7168,False,torch.bfloat16,torch.bfloat16,False,False,flydsl,3585,1,46.8232,flydsl_gemm3_abf16_wbf16_bf16_t64x128x128_split_k1_block_m_warp2_block_n_warp4_block_k_warp2_async_copyTrue_b_to_ldsTrue_b_preshuffleFalse_c_to_ldsFalse_gfx950,0.006,581.9,992.35
gfx950,256,960,2048,7168,False,torch.bfloat16,torch.bfloat16,False,False,flydsl,2737,1,46.9104,flydsl_gemm3_abf16_wbf16_bf16_t128x64x128_split_k1_block_m_warp2_block_n_warp4_block_k_warp2_async_copyTrue_b_to_ldsTrue_b_preshuffleFalse_c_to_ldsFalse_gfx950,0.0061,600.84,1003.08
gfx950,256,992,2048,7168,False,torch.bfloat16,torch.bfloat16,False,False,flydsl,2742,1,48.5232,flydsl_gemm3_abf16_wbf16_bf16_t128x64x128_split_k1_block_m_warp4_block_n_warp2_block_k_warp2_async_copyTrue_b_to_ldsTrue_b_preshuffleFalse_c_to_ldsFalse_gfx950,0.0061,600.23,981.89
gfx950,256,1088,2048,7168,False,torch.bfloat16,torch.bfloat16,False,False,torch,0,0,50.7802,native,0.0,629.06,973.1
gfx950,256,1152,2048,7168,False,torch.bfloat16,torch.bfloat16,False,False,torch,0,0,53.7026,native,0.0,629.82,942.11
gfx950,256,1216,2048,7168,False,torch.bfloat16,torch.bfloat16,False,False,torch,0,0,56.0263,native,0.0,637.23,924.09
gfx950,256,1280,2048,7168,False,torch.bfloat16,torch.bfloat16,False,False,torch,0,0,53.7533,native,0.0,699.14,985.11
gfx950,256,1344,2048,7168,False,torch.bfloat16,torch.bfloat16,False,False,torch,0,0,59.1407,native,0.0,667.22,915.32
gfx950,256,1408,2048,7168,False,torch.bfloat16,torch.bfloat16,False,False,torch,0,0,60.0731,native,0.0,688.15,920.75
gfx950,256,1472,2048,7168,False,torch.bfloat16,torch.bfloat16,False,False,flydsl,5376,1,63.1922,flydsl_gemm4_abf16_wbf16_bf16_t96x128x64_split_k1_block_m_warp1_block_n_warp4_block_k_warp1_async_copyTrue_b_to_ldsTrue_b_preshuffleFalse_c_to_ldsFalse_gfx950,0.0,683.92,893.97
gfx950,256,1536,2048,7168,False,torch.bfloat16,torch.bfloat16,False,False,torch,0,0,56.9249,native,0.0,792.22,1013.12
gfx950,256,1600,2048,7168,False,torch.bfloat16,torch.bfloat16,False,False,flydsl,4311,1,67.399,flydsl_gemm4_abf16_wbf16_bf16_t128x128x64_split_k1_block_m_warp4_block_n_warp4_block_k_warp1_async_copyTrue_b_to_ldsTrue_b_preshuffleFalse_c_to_ldsFalse_gfx950,0.0,696.99,873.18
gfx950,256,1664,2048,7168,False,torch.bfloat16,torch.bfloat16,False,False,flydsl,2537,1,67.959,flydsl_gemm3_abf16_wbf16_bf16_t128x128x64_split_k1_block_m_warp2_block_n_warp4_block_k_warp2_async_copyTrue_b_to_ldsTrue_b_preshuffleFalse_c_to_ldsFalse_gfx950,0.006,718.89,883.34
gfx950,256,1728,2048,7168,False,torch.bfloat16,torch.bfloat16,False,False,flydsl,4310,1,69.453,flydsl_gemm4_abf16_wbf16_bf16_t128x128x64_split_k1_block_m_warp4_block_n_warp2_block_k_warp2_async_copyTrue_b_to_ldsTrue_b_preshuffleFalse_c_to_ldsFalse_gfx950,0.006,730.48,881.32
gfx950,256,1792,2048,7168,False,torch.bfloat16,torch.bfloat16,False,False,flydsl,4304,1,70.5297,flydsl_gemm4_abf16_wbf16_bf16_t128x128x64_split_k1_block_m_warp2_block_n_warp4_block_k_warp1_async_copyTrue_b_to_ldsTrue_b_preshuffleFalse_c_to_ldsFalse_gfx950,0.0,745.97,884.6
gfx950,256,1856,2048,7168,False,torch.bfloat16,torch.bfloat16,False,False,flydsl,4302,1,69.9945,flydsl_gemm4_abf16_wbf16_bf16_t128x128x64_split_k1_block_m_warp2_block_n_warp2_block_k_warp2_async_copyTrue_b_to_ldsTrue_b_preshuffleFalse_c_to_ldsFalse_gfx950,0.006,778.52,908.21
gfx950,256,1920,2048,7168,False,torch.bfloat16,torch.bfloat16,False,False,flydsl,4310,1,72.4751,flydsl_gemm4_abf16_wbf16_bf16_t128x128x64_split_k1_block_m_warp4_block_n_warp2_block_k_warp2_async_copyTrue_b_to_ldsTrue_b_preshuffleFalse_c_to_ldsFalse_gfx950,0.006,777.8,893.4
gfx950,256,1984,2048,7168,False,torch.bfloat16,torch.bfloat16,False,False,flydsl,4302,1,72.1623,flydsl_gemm4_abf16_wbf16_bf16_t128x128x64_split_k1_block_m_warp2_block_n_warp2_block_k_warp2_async_copyTrue_b_to_ldsTrue_b_preshuffleFalse_c_to_ldsFalse_gfx950,0.006,807.22,913.62
gfx950,256,2048,2048,7168,False,torch.bfloat16,torch.bfloat16,False,False,flydsl,5522,1,72.9495,flydsl_gemm5_abf16_wbf16_bf16_t128x128x64_split_k1_block_m_warp2_block_n_warp4_block_k_warp2_async_copyTrue_b_to_ldsTrue_b_preshuffleFalse_c_to_ldsFalse_gfx950,0.006,824.26,919.94
gfx950,256,4096,2048,7168,False,torch.bfloat16,torch.bfloat16,False,False,torch,0,0,108.2119,native,0.0,1111.33,969.0
gfx950,256,6144,2048,7168,False,torch.bfloat16,torch.bfloat16,False,False,opus,1400,0,137.8671,opus_gemm_mono_tile_512x192x256x64_2x4_16x16x32_0x0x0_nooob,0.0,1308.42,1034.38
gfx950,256,8192,2048,7168,False,torch.bfloat16,torch.bfloat16,False,False,torch,0,0,173.0731,native,0.0,1389.69,1042.07
gfx950,256,10240,2048,7168,False,torch.bfloat16,torch.bfloat16,False,False,torch,0,0,238.7187,native,0.0,1259.42,913.64
gfx950,256,12288,2048,7168,False,torch.bfloat16,torch.bfloat16,False,False,opus,1400,0,264.4713,opus_gemm_mono_tile_512x192x256x64_2x4_16x16x32_0x0x0_nooob,0.0,1364.15,967.41
gfx950,256,14336,2048,7168,False,torch.bfloat16,torch.bfloat16,False,False,torch,0,0,310.4236,native,0.0,1355.91,945.81
gfx950,256,16384,2048,7168,False,torch.bfloat16,torch.bfloat16,False,False,torch,0,0,322.9938,native,0.0,1489.31,1025.87
gfx950,256,32768,2048,7168,False,torch.bfloat16,torch.bfloat16,False,False,torch,0,0,633.2713,native,0.0,1519.21,1000.11
gfx950,256,1,2112,7168,False,torch.bfloat16,torch.bfloat16,False,False,flydsl,4843,7,8.1069,flydsl_gemm7_abf16_wbf16_bf16_t16x64x64_split_k7_block_m_warp1_block_n_warp2_block_k_warp1_async_copyTrue_b_to_ldsTrue_b_preshuffleFalse_c_to_ldsFalse_gfx950,0.0175,3.73,3737.09
gfx950,256,2,2112,7168,False,torch.bfloat16,torch.bfloat16,False,False,flydsl,2203,7,8.27,flydsl_gemm4_abf16_wbf16_bf16_t16x64x128_split_k7_block_m_warp1_block_n_warp2_block_k_warp1_async_copyTrue_b_to_ldsTrue_b_preshuffleFalse_c_to_ldsFalse_gfx950,0.0161,7.32,3665.63
gfx950,256,4,2112,7168,False,torch.bfloat16,torch.bfloat16,False,False,flydsl,2110,7,8.3707,flydsl_gemm7_abf16_wbf16_bf16_t16x64x64_split_k7_block_m_warp1_block_n_warp2_block_k_warp1_async_copyTrue_b_to_ldsTrue_b_preshuffleFalse_c_to_ldsFalse_gfx950,0.0183,14.47,3625.97
gfx950,256,8,2112,7168,False,torch.bfloat16,torch.bfloat16,False,False,flydsl,2110,7,8.5527,flydsl_gemm7_abf16_wbf16_bf16_t16x64x64_split_k7_block_m_warp1_block_n_warp2_block_k_warp1_async_copyTrue_b_to_ldsTrue_b_preshuffleFalse_c_to_ldsFalse_gfx950,0.0188,28.32,3557.49
gfx950,256,16,2112,7168,False,torch.bfloat16,torch.bfloat16,False,False,flydsl,1845,7,9.0733,flydsl_gemm6_abf16_wbf16_bf16_t16x64x64_split_k7_block_m_warp1_block_n_warp2_block_k_warp1_async_copyTrue_b_to_ldsTrue_b_preshuffleFalse_c_to_ldsFalse_gfx950,0.0195,53.39,3369.73
gfx950,256,24,2112,7168,False,torch.bfloat16,torch.bfloat16,False,False,flydsl,1823,2,12.96,flydsl_gemm6_abf16_wbf16_bf16_t16x64x128_split_k2_block_m_warp1_block_n_warp1_block_k_warp2_async_copyTrue_b_to_ldsTrue_b_preshuffleFalse_c_to_ldsFalse_gfx950,0.0143,56.07,2370.61
gfx950,256,32,2112,7168,False,torch.bfloat16,torch.bfloat16,False,False,flydsl,1926,7,10.6796,flydsl_gemm6_abf16_wbf16_bf16_t32x64x64_split_k7_block_m_warp1_block_n_warp4_block_k_warp1_async_copyTrue_b_to_ldsTrue_b_preshuffleFalse_c_to_ldsFalse_gfx950,0.0199,90.72,2890.7
gfx950,256,40,2112,7168,False,torch.bfloat16,torch.bfloat16,False,False,flydsl,1501,2,13.9908,flydsl_gemm5_abf16_wbf16_bf16_t32x64x128_split_k2_block_m_warp2_block_n_warp2_block_k_warp1_async_copyTrue_b_to_ldsTrue_b_preshuffleFalse_c_to_ldsFalse_gfx950,0.0057,86.56,2217.17
gfx950,256,48,2112,7168,False,torch.bfloat16,torch.bfloat16,False,False,flydsl,2170,7,12.8757,flydsl_gemm7_abf16_wbf16_bf16_t48x64x64_split_k7_block_m_warp1_block_n_warp2_block_k_warp1_async_copyTrue_b_to_ldsTrue_b_preshuffleFalse_c_to_ldsFalse_gfx950,0.0196,112.87,2420.72
gfx950,256,56,2112,7168,False,torch.bfloat16,torch.bfloat16,False,False,asm,5,7,15.0592,_ZN5aiter39bf16gemm_fp32bf16_tn_64x64_splitk_cleanE,0.0198,112.59,2079.59
gfx950,256,64,2112,7168,False,torch.bfloat16,torch.bfloat16,False,False,flydsl,2321,7,13.7074,flydsl_gemm5_abf16_wbf16_bf16_t64x64x64_split_k7_block_m_warp2_block_n_warp2_block_k_warp1_async_copyTrue_b_to_ldsTrue_b_preshuffleFalse_c_to_ldsFalse_gfx950,0.0199,141.37,2295.51
gfx950,256,72,2112,7168,False,torch.bfloat16,torch.bfloat16,False,False,asm,7,7,15.7765,_ZN5aiter39bf16gemm_fp32bf16_tn_80x64_splitk_cleanE,0.02,138.18,2003.86
gfx950,256,80,2112,7168,False,torch.bfloat16,torch.bfloat16,False,False,asm,7,6,15.5939,_ZN5aiter39bf16gemm_fp32bf16_tn_80x64_splitk_cleanE,0.0182,155.33,2036.85
gfx950,256,88,2112,7168,False,torch.bfloat16,torch.bfloat16,False,False,asm,8,6,16.0752,_ZN5aiter39bf16gemm_fp32bf16_tn_96x64_splitk_cleanE,0.0179,165.75,1985.1
gfx950,256,112,2112,7168,False,torch.bfloat16,torch.bfloat16,False,False,asm,5,3,19.6739,_ZN5aiter39bf16gemm_fp32bf16_tn_64x64_splitk_cleanE,0.0105,172.37,1644.63
gfx950,256,128,2112,7168,False,torch.bfloat16,torch.bfloat16,False,False,asm,5,3,19.4968,_ZN5aiter39bf16gemm_fp32bf16_tn_64x64_splitk_cleanE,0.0106,198.78,1674.8
gfx950,256,256,2112,7168,False,torch.bfloat16,torch.bfloat16,False,False,flydsl,5002,2,27.6397,flydsl_gemm4_abf16_wbf16_bf16_t96x64x64_split_k2_block_m_warp2_block_n_warp2_block_k_warp1_async_copyTrue_b_to_ldsTrue_b_preshuffleFalse_c_to_ldsFalse_gfx950,0.006,280.43,1267.34
gfx950,256,1024,2112,7168,False,torch.bfloat16,torch.bfloat16,False,False,flydsl,1542,1,68.5856,flydsl_gemm3_abf16_wbf16_bf16_t64x64x64_split_k1_block_m_warp1_block_n_warp1_block_k_warp1_async_copyTrue_b_to_ldsTrue_b_preshuffleFalse_c_to_ldsFalse_gfx950,0.0,452.05,718.56
gfx950,256,4096,2112,7168,False,torch.bfloat16,torch.bfloat16,False,False,torch,0,0,117.8273,native,0.0,1052.53,902.16
gfx950,256,16384,2112,7168,False,torch.bfloat16,torch.bfloat16,False,False,torch,0,0,480.3821,native,0.0,1032.65,696.04
gfx950,256,1,2304,16384,False,torch.bfloat16,torch.bfloat16,False,False,flydsl,5887,4,16.3134,flydsl_gemm4_abf16_wbf16_bf16_t16x64x256_split_k4_block_m_warp1_block_n_warp1_block_k_warp2_async_copyTrue_b_to_ldsTrue_b_preshuffleFalse_c_to_ldsFalse_gfx950,0.0247,4.63,4630.23
gfx950,256,16,2304,16384,False,torch.bfloat16,torch.bfloat16,False,False,flydsl,5887,4,17.5138,flydsl_gemm4_abf16_wbf16_bf16_t16x64x256_split_k4_block_m_warp1_block_n_warp1_block_k_warp2_async_copyTrue_b_to_ldsTrue_b_preshuffleFalse_c_to_ldsFalse_gfx950,0.0227,68.97,4344.89
gfx950,256,32,2304,16384,False,torch.bfloat16,torch.bfloat16,False,False,asm,1,7,21.9085,_ZN5aiter39bf16gemm_fp32bf16_tn_32x64_splitk_cleanE,0.0224,110.27,3500.63
gfx950,256,64,2304,16384,False,torch.bfloat16,torch.bfloat16,False,False,asm,5,7,23.9613,_ZN5aiter39bf16gemm_fp32bf16_tn_64x64_splitk_cleanE,0.0226,201.65,3250.64
gfx950,256,128,2304,16384,False,torch.bfloat16,torch.bfloat16,False,False,asm,5,3,35.5248,_ZN5aiter39bf16gemm_fp32bf16_tn_64x64_splitk_cleanE,0.013,272.03,2259.87
gfx950,256,256,2304,16384,False,torch.bfloat16,torch.bfloat16,False,False,torch,0,0,41.8777,native,0.0,461.52,2031.29
gfx950,256,512,2304,16384,False,torch.bfloat16,torch.bfloat16,False,False,asm,9,1,98.3036,_ZN5aiter37bf16gemm_fp32bf16_tn_96x64_pf3_splitkE,0.0,393.22,962.67
gfx950,256,1024,2304,16384,False,torch.bfloat16,torch.bfloat16,False,False,torch,0,0,91.2487,native,0.0,847.24,1246.82
gfx950,256,2048,2304,16384,False,torch.bfloat16,torch.bfloat16,False,False,torch,0,0,179.1167,native,0.0,863.23,848.85
gfx950,256,4096,2304,16384,False,torch.bfloat16,torch.bfloat16,False,False,asm,10,1,327.4554,_ZN5aiter24bf16gemm_bf16_tn_256x256E,0.0,944.37,698.08
gfx950,256,8192,2304,16384,False,torch.bfloat16,torch.bfloat16,False,False,asm,10,1,677.7405,_ZN5aiter24bf16gemm_bf16_tn_256x256E,0.0,912.55,563.17
gfx950,256,16384,2304,16384,False,torch.bfloat16,torch.bfloat16,False,False,asm,10,1,1109.5955,_ZN5aiter24bf16gemm_bf16_tn_256x256E,0.0,1114.78,619.92
gfx950,256,32768,2304,16384,False,torch.bfloat16,torch.bfloat16,False,False,asm,10,1,1981.8193,_ZN5aiter24bf16gemm_bf16_tn_256x256E,0.0,1248.3,656.08
gfx950,256,1,2560,2880,True,torch.bfloat16,torch.bfloat16,False,False,flydsl,4545,5,5.8449,flydsl_gemm7_abf16_wbf16_bf16_t16x64x64_split_k5_block_m_warp1_block_n_warp2_block_k_warp1_async_copyTrue_b_to_ldsTrue_b_preshuffleFalse_c_to_ldsFalse_gfx950,0.0148,2.52,2524.68
gfx950,256,1,2560,8192,False,torch.bfloat16,torch.bfloat16,False,False,flydsl,8055,8,10.1617,flydsl_gemm5_abf16_wbf16_bf16_t16x128x64_split_k8_block_m_warp1_block_n_warp2_block_k_warp1_async_copyTrue_b_to_ldsTrue_b_preshuffleFalse_c_to_ldsFalse_gfx950,0.0203,4.13,4129.68
gfx950,256,2,2560,2880,True,torch.bfloat16,torch.bfloat16,False,False,flydsl,3761,5,6.1856,flydsl_gemm6_abf16_wbf16_bf16_t16x64x64_split_k5_block_m_warp1_block_n_warp1_block_k_warp1_async_copyTrue_b_to_ldsTrue_b_preshuffleFalse_c_to_ldsFalse_gfx950,0.0129,4.77,2387.38
gfx950,256,4,2560,2880,True,torch.bfloat16,torch.bfloat16,False,False,flydsl,4545,5,6.0998,flydsl_gemm7_abf16_wbf16_bf16_t16x64x64_split_k5_block_m_warp1_block_n_warp2_block_k_warp1_async_copyTrue_b_to_ldsTrue_b_preshuffleFalse_c_to_ldsFalse_gfx950,0.0129,9.67,2424.53
gfx950,256,8,2560,2880,True,torch.bfloat16,torch.bfloat16,False,False,flydsl,2947,5,6.1546,flydsl_gemm5_abf16_wbf16_bf16_t16x64x64_split_k5_block_m_warp1_block_n_warp1_block_k_warp2_async_copyTrue_b_to_ldsTrue_b_preshuffleFalse_c_to_ldsFalse_gfx950,0.0203,19.17,2410.01
gfx950,256,16,2560,2880,True,torch.bfloat16,torch.bfloat16,False,False,flydsl,3763,5,6.8198,flydsl_gemm6_abf16_wbf16_bf16_t16x64x64_split_k5_block_m_warp1_block_n_warp1_block_k_warp2_async_copyTrue_b_to_ldsTrue_b_preshuffleFalse_c_to_ldsFalse_gfx950,0.0197,34.59,2187.7
gfx950,256,16,2560,8192,False,torch.bfloat16,torch.bfloat16,False,False,flydsl,3095,8,11.207,flydsl_gemm3_abf16_wbf16_bf16_t16x128x128_split_k8_block_m_warp1_block_n_warp4_block_k_warp1_async_copyTrue_b_to_ldsTrue_b_preshuffleFalse_c_to_ldsFalse_gfx950,0.0216,59.88,3773.28
gfx950,256,32,2560,2880,True,torch.bfloat16,torch.bfloat16,False,False,flydsl,3757,3,7.9143,flydsl_gemm6_abf16_wbf16_bf16_t16x64x64_split_k3_block_m_warp1_block_n_warp1_block_k_warp2_async_copyTrue_b_to_ldsTrue_b_preshuffleFalse_c_to_ldsFalse_gfx950,0.0157,59.62,1907.15
gfx950,256,32,2560,8192,False,torch.bfloat16,torch.bfloat16,False,False,asm,1,6,14.9318,_ZN5aiter39bf16gemm_fp32bf16_tn_32x64_splitk_cleanE,0.0186,89.89,2855.06
gfx950,256,48,2560,2880,True,torch.bfloat16,torch.bfloat16,False,False,flydsl,5401,3,8.5571,flydsl_gemm8_abf16_wbf16_bf16_t32x64x64_split_k3_block_m_warp1_block_n_warp4_block_k_warp1_async_copyTrue_b_to_ldsTrue_b_preshuffleFalse_c_to_ldsFalse_gfx950,0.0092,82.71,1784.23
gfx950,256,64,2560,2880,True,torch.bfloat16,torch.bfloat16,False,False,flydsl,6901,3,9.6049,flydsl_gemm7_abf16_wbf16_bf16_t32x64x64_split_k3_block_m_warp1_block_n_warp4_block_k_warp1_async_copyTrue_b_to_ldsTrue_b_preshuffleFalse_c_to_ldsFalse_gfx950,0.0092,98.25,1607.71
gfx950,256,64,2560,8192,False,torch.bfloat16,torch.bfloat16,False,False,asm,5,6,16.2682,_ZN5aiter39bf16gemm_fp32bf16_tn_64x64_splitk_cleanE,0.0185,165.01,2662.82
gfx950,256,80,2560,2880,True,torch.bfloat16,torch.bfloat16,False,False,flydsl,5899,3,10.8801,flydsl_gemm6_abf16_wbf16_bf16_t32x64x64_split_k3_block_m_warp2_block_n_warp2_block_k_warp1_async_copyTrue_b_to_ldsTrue_b_preshuffleFalse_c_to_ldsFalse_gfx950,0.0093,108.42,1435.28
gfx950,256,96,2560,2880,True,torch.bfloat16,torch.bfloat16,False,False,flydsl,3290,1,11.1774,flydsl_gemm8_abf16_wbf16_bf16_t16x64x64_split_k1_block_m_warp1_block_n_warp2_block_k_warp1_async_copyTrue_b_to_ldsTrue_b_preshuffleFalse_c_to_ldsFalse_gfx950,0.0,126.65,1412.68
gfx950,256,112,2560,2880,True,torch.bfloat16,torch.bfloat16,False,False,flydsl,7821,1,11.8488,flydsl_gemm8_abf16_wbf16_bf16_t32x64x64_split_k1_block_m_warp1_block_n_warp2_block_k_warp2_async_copyTrue_b_to_ldsTrue_b_preshuffleFalse_c_to_ldsFalse_gfx950,0.0041,139.38,1347.32
gfx950,256,128,2560,2880,True,torch.bfloat16,torch.bfloat16,False,False,flydsl,3129,1,12.1148,flydsl_gemm6_abf16_wbf16_bf16_t32x64x64_split_k1_block_m_warp1_block_n_warp4_block_k_warp1_async_copyTrue_b_to_ldsTrue_b_preshuffleFalse_c_to_ldsFalse_gfx950,0.0,155.8,1332.11
gfx950,256,128,2560,8192,False,torch.bfloat16,torch.bfloat16,False,False,asm,5,3,21.6899,_ZN5aiter39bf16gemm_fp32bf16_tn_64x64_splitk_cleanE,0.0107,247.52,2060.66
gfx950,256,256,2560,2880,True,torch.bfloat16,torch.bfloat16,False,False,flydsl,9121,1,15.0155,flydsl_gemm8_abf16_wbf16_bf16_t64x64x64_split_k1_block_m_warp2_block_n_warp2_block_k_warp2_async_copyTrue_b_to_ldsTrue_b_preshuffleFalse_c_to_ldsFalse_gfx950,0.0042,251.4,1167.52
gfx950,256,256,2560,8192,False,torch.bfloat16,torch.bfloat16,False,False,asm,8,2,31.7649,_ZN5aiter39bf16gemm_fp32bf16_tn_96x64_splitk_cleanE,0.0061,338.03,1493.73
gfx950,256,512,2560,8192,False,torch.bfloat16,torch.bfloat16,False,False,asm,9,1,53.2462,_ZN5aiter37bf16gemm_fp32bf16_tn_96x64_pf3_splitkE,0.0,403.31,994.5
gfx950,256,1024,2560,8192,False,torch.bfloat16,torch.bfloat16,False,False,torch,0,0,60.5913,native,0.0,708.84,1055.65
gfx950,256,2048,2560,8192,False,torch.bfloat16,torch.bfloat16,False,False,torch,0,0,93.2705,native,0.0,920.97,921.87
gfx950,256,4096,2560,8192,False,torch.bfloat16,torch.bfloat16,False,False,asm,10,1,163.7211,_ZN5aiter24bf16gemm_bf16_tn_256x256E,0.0,1049.34,794.18
gfx950,256,8192,2560,8192,False,torch.bfloat16,torch.bfloat16,False,False,asm,10,1,312.7178,_ZN5aiter24bf16gemm_bf16_tn_256x256E,0.0,1098.75,697.45
gfx950,256,16384,2560,8192,False,torch.bfloat16,torch.bfloat16,False,False,asm,10,1,515.5546,_ZN5aiter24bf16gemm_bf16_tn_256x256E,0.0,1332.92,764.74
gfx950,256,32768,2560,8192,False,torch.bfloat16,torch.bfloat16,False,False,asm,10,1,965.4849,_ZN5aiter24bf16gemm_bf16_tn_256x256E,0.0,1423.52,773.28
gfx950,256,1,2624,6144,False,torch.bfloat16,torch.bfloat16,False,False,flydsl,878,6,8.3361,flydsl_gemm3_abf16_wbf16_bf16_t16x64x128_split_k6_block_m_warp1_block_n_warp2_block_k_warp1_async_copyTrue_b_to_ldsTrue_b_preshuffleFalse_c_to_ldsFalse_gfx950,0.0179,3.87,3870.06
gfx950,256,2,2624,6144,False,torch.bfloat16,torch.bfloat16,False,False,flydsl,878,6,8.3414,flydsl_gemm3_abf16_wbf16_bf16_t16x64x128_split_k6_block_m_warp1_block_n_warp2_block_k_warp1_async_copyTrue_b_to_ldsTrue_b_preshuffleFalse_c_to_ldsFalse_gfx950,0.0147,7.73,3869.71
gfx950,256,4,2624,6144,False,torch.bfloat16,torch.bfloat16,False,False,flydsl,3342,6,8.4475,flydsl_gemm8_abf16_wbf16_bf16_t16x64x64_split_k6_block_m_warp1_block_n_warp2_block_k_warp1_async_copyTrue_b_to_ldsTrue_b_preshuffleFalse_c_to_ldsFalse_gfx950,0.0169,15.27,3825.26
gfx950,256,8,2624,6144,False,torch.bfloat16,torch.bfloat16,False,False,flydsl,2151,6,8.8699,flydsl_gemm5_abf16_wbf16_bf16_t16x64x64_split_k6_block_m_warp1_block_n_warp1_block_k_warp2_async_copyTrue_b_to_ldsTrue_b_preshuffleFalse_c_to_ldsFalse_gfx950,0.0236,29.08,3651.0
gfx950,256,16,2624,6144,False,torch.bfloat16,torch.bfloat16,False,False,flydsl,2663,6,9.1755,flydsl_gemm6_abf16_wbf16_bf16_t16x64x64_split_k6_block_m_warp1_block_n_warp2_block_k_warp1_async_copyTrue_b_to_ldsTrue_b_preshuffleFalse_c_to_ldsFalse_gfx950,0.0182,56.23,3544.69
gfx950,256,32,2624,6144,False,torch.bfloat16,torch.bfloat16,False,False,flydsl,1623,4,11.2387,flydsl_gemm4_abf16_wbf16_bf16_t32x64x128_split_k4_block_m_warp1_block_n_warp4_block_k_warp1_async_copyTrue_b_to_ldsTrue_b_preshuffleFalse_c_to_ldsFalse_gfx950,0.0128,91.81,2918.92
gfx950,256,48,2624,6144,False,torch.bfloat16,torch.bfloat16,False,False,flydsl,1746,6,12.9622,flydsl_gemm4_abf16_wbf16_bf16_t48x64x64_split_k6_block_m_warp1_block_n_warp2_block_k_warp1_async_copyTrue_b_to_ldsTrue_b_preshuffleFalse_c_to_ldsFalse_gfx950,0.0173,119.4,2552.46
gfx950,256,64,2624,6144,False,torch.bfloat16,torch.bfloat16,False,False,flydsl,3985,3,14.1569,flydsl_gemm7_abf16_wbf16_bf16_t32x64x64_split_k3_block_m_warp1_block_n_warp2_block_k_warp1_async_copyTrue_b_to_ldsTrue_b_preshuffleFalse_c_to_ldsFalse_gfx950,0.0101,145.77,2356.87
gfx950,256,128,2624,6144,False,torch.bfloat16,torch.bfloat16,False,False,asm,5,3,18.3012,_ZN5aiter39bf16gemm_fp32bf16_tn_64x64_splitk_cleanE,0.0101,225.52,1884.48
gfx950,256,256,2624,6144,False,torch.bfloat16,torch.bfloat16,False,False,asm,8,2,26.1369,_ZN5aiter39bf16gemm_fp32bf16_tn_96x64_splitk_cleanE,0.0057,315.81,1405.4
gfx950,256,16384,2624,6144,False,torch.bfloat16,torch.bfloat16,False,False,torch,0,0,406.341,native,0.0,1300.09,786.42
gfx950,256,1,2880,512,True,torch.bfloat16,torch.bfloat16,False,False,triton,0,0,4.0943,auto,0.0,0.72,721.96
gfx950,256,1,2880,2048,True,torch.bfloat16,torch.bfloat16,False,False,flydsl,4561,4,5.5663,flydsl_gemm8_abf16_wbf16_bf16_t16x64x64_split_k4_block_m_warp1_block_n_warp1_block_k_warp1_async_copyTrue_b_to_ldsTrue_b_preshuffleFalse_c_to_ldsFalse_gfx950,0.0094,2.12,2121.04
gfx950,256,1,2880,4096,True,torch.bfloat16,torch.bfloat16,False,False,flydsl,4565,4,7.047,flydsl_gemm8_abf16_wbf16_bf16_t16x64x64_split_k4_block_m_warp1_block_n_warp2_block_k_warp1_async_copyTrue_b_to_ldsTrue_b_preshuffleFalse_c_to_ldsFalse_gfx950,0.0146,3.35,3349.92
gfx950,256,2,2880,512,True,torch.bfloat16,torch.bfloat16,False,False,flydsl,2702,1,4.1919,flydsl_gemm6_abf16_wbf16_bf16_t16x64x64_split_k1_block_m_warp1_block_n_warp2_block_k_warp1_async_copyTrue_b_to_ldsTrue_b_preshuffleFalse_c_to_ldsFalse_gfx950,0.0,1.41,706.76
gfx950,256,2,2880,2048,True,torch.bfloat16,torch.bfloat16,False,False,flydsl,4565,4,5.5641,flydsl_gemm8_abf16_wbf16_bf16_t16x64x64_split_k4_block_m_warp1_block_n_warp2_block_k_warp1_async_copyTrue_b_to_ldsTrue_b_preshuffleFalse_c_to_ldsFalse_gfx950,0.0106,4.24,2123.65
gfx950,256,2,2880,4096,True,torch.bfloat16,torch.bfloat16,False,False,flydsl,4563,4,7.2823,flydsl_gemm8_abf16_wbf16_bf16_t16x64x64_split_k4_block_m_warp1_block_n_warp1_block_k_warp2_async_copyTrue_b_to_ldsTrue_b_preshuffleFalse_c_to_ldsFalse_gfx950,0.0215,6.48,3243.6
gfx950,256,4,2880,512,True,torch.bfloat16,torch.bfloat16,False,False,triton,0,0,3.6821,auto,0.0,3.2,808.3
gfx950,256,4,2880,2048,True,torch.bfloat16,torch.bfloat16,False,False,flydsl,4565,4,5.7636,flydsl_gemm8_abf16_wbf16_bf16_t16x64x64_split_k4_block_m_warp1_block_n_warp2_block_k_warp1_async_copyTrue_b_to_ldsTrue_b_preshuffleFalse_c_to_ldsFalse_gfx950,0.0085,8.19,2053.56
gfx950,256,4,2880,4096,True,torch.bfloat16,torch.bfloat16,False,False,flydsl,3413,4,7.2101,flydsl_gemm6_abf16_wbf16_bf16_t16x64x128_split_k4_block_m_warp1_block_n_warp2_block_k_warp1_async_copyTrue_b_to_ldsTrue_b_preshuffleFalse_c_to_ldsFalse_gfx950,0.0135,13.09,3279.95
gfx950,256,8,2880,512,True,torch.bfloat16,torch.bfloat16,False,False,triton,0,0,4.147,auto,0.0,5.69,724.23
gfx950,256,8,2880,2048,True,torch.bfloat16,torch.bfloat16,False,False,flydsl,4045,4,5.8395,flydsl_gemm7_abf16_wbf16_bf16_t16x64x64_split_k4_block_m_warp1_block_n_warp1_block_k_warp1_async_copyTrue_b_to_ldsTrue_b_preshuffleFalse_c_to_ldsFalse_gfx950,0.0094,16.16,2033.62
gfx950,256,8,2880,4096,True,torch.bfloat16,torch.bfloat16,False,False,flydsl,3449,4,7.4832,flydsl_gemm6_abf16_wbf16_bf16_t16x64x64_split_k4_block_m_warp1_block_n_warp2_block_k_warp1_async_copyTrue_b_to_ldsTrue_b_preshuffleFalse_c_to_ldsFalse_gfx950,0.0128,25.22,3167.71
gfx950,256,16,2880,512,True,torch.bfloat16,torch.bfloat16,False,False,triton,0,0,2.9408,auto,0.0,16.05,1039.74
gfx950,256,16,2880,2048,True,torch.bfloat16,torch.bfloat16,False,False,flydsl,4047,4,6.3039,flydsl_gemm7_abf16_wbf16_bf16_t16x64x64_split_k4_block_m_warp1_block_n_warp1_block_k_warp2_async_copyTrue_b_to_ldsTrue_b_preshuffleFalse_c_to_ldsFalse_gfx950,0.0163,29.94,1896.31
gfx950,256,16,2880,4096,True,torch.bfloat16,torch.bfloat16,False,False,flydsl,2665,4,7.9284,flydsl_gemm5_abf16_wbf16_bf16_t16x64x128_split_k4_block_m_warp1_block_n_warp2_block_k_warp1_async_copyTrue_b_to_ldsTrue_b_preshuffleFalse_c_to_ldsFalse_gfx950,0.0135,47.61,3003.91
gfx950,256,32,2880,512,True,torch.bfloat16,torch.bfloat16,False,False,triton,0,0,3.5169,auto,0.0,26.83,900.28
gfx950,256,32,2880,2048,True,torch.bfloat16,torch.bfloat16,False,False,triton,0,0,7.3185,auto,0.0,51.58,1654.97
gfx950,256,32,2880,4096,True,torch.bfloat16,torch.bfloat16,False,False,flydsl,2869,4,9.2914,flydsl_gemm5_abf16_wbf16_bf16_t32x64x64_split_k4_block_m_warp2_block_n_warp2_block_k_warp1_async_copyTrue_b_to_ldsTrue_b_preshuffleFalse_c_to_ldsFalse_gfx950,0.0133,81.26,2587.28
gfx950,256,48,2880,512,True,torch.bfloat16,torch.bfloat16,False,False,flydsl,3676,1,4.283,flydsl_gemm8_abf16_wbf16_bf16_t16x64x64_split_k1_block_m_warp1_block_n_warp2_block_k_warp1_async_copyTrue_b_to_ldsTrue_b_preshuffleFalse_c_to_ldsFalse_gfx950,0.0,33.05,764.59
gfx950,256,48,2880,2048,True,torch.bfloat16,torch.bfloat16,False,False,flydsl,4155,2,8.129,flydsl_gemm7_abf16_wbf16_bf16_t32x64x64_split_k2_block_m_warp1_block_n_warp2_block_k_warp2_async_copyTrue_b_to_ldsTrue_b_preshuffleFalse_c_to_ldsFalse_gfx950,0.0108,69.66,1509.36
gfx950,256,48,2880,4096,True,torch.bfloat16,torch.bfloat16,False,False,flydsl,2941,4,11.2963,flydsl_gemm5_abf16_wbf16_bf16_t48x64x64_split_k4_block_m_warp1_block_n_warp2_block_k_warp1_async_copyTrue_b_to_ldsTrue_b_preshuffleFalse_c_to_ldsFalse_gfx950,0.013,100.25,2147.84
gfx950,256,64,2880,512,True,torch.bfloat16,torch.bfloat16,False,False,triton,0,0,3.7445,auto,0.0,50.41,903.54
gfx950,256,64,2880,2048,True,torch.bfloat16,torch.bfloat16,False,False,flydsl,4917,2,8.6943,flydsl_gemm6_abf16_wbf16_bf16_t32x64x64_split_k2_block_m_warp1_block_n_warp4_block_k_warp1_async_copyTrue_b_to_ldsTrue_b_preshuffleFalse_c_to_ldsFalse_gfx950,0.0051,86.84,1429.36
gfx950,256,64,2880,4096,True,torch.bfloat16,torch.bfloat16,False,False,triton,0,0,11.4906,auto,0.0,131.41,2130.95
gfx950,256,80,2880,512,True,torch.bfloat16,torch.bfloat16,False,False,flydsl,5027,1,4.4823,flydsl_gemm8_abf16_wbf16_bf16_t32x64x64_split_k1_block_m_warp1_block_n_warp4_block_k_warp1_async_copyTrue_b_to_ldsTrue_b_preshuffleFalse_c_to_ldsFalse_gfx950,0.0,52.64,779.03
gfx950,256,80,2880,2048,True,torch.bfloat16,torch.bfloat16,False,False,flydsl,6119,1,9.1371,flydsl_gemm8_abf16_wbf16_bf16_t32x64x64_split_k1_block_m_warp2_block_n_warp1_block_k_warp2_async_copyTrue_b_to_ldsTrue_b_preshuffleFalse_c_to_ldsFalse_gfx950,0.0033,103.28,1377.35
gfx950,256,80,2880,4096,True,torch.bfloat16,torch.bfloat16,False,False,flydsl,1892,2,12.9555,flydsl_gemm5_abf16_wbf16_bf16_t64x64x128_split_k2_block_m_warp1_block_n_warp4_block_k_warp2_async_copyTrue_b_to_ldsTrue_b_preshuffleFalse_c_to_ldsFalse_gfx950,0.0138,145.69,1907.23
gfx950,256,96,2880,512,True,torch.bfloat16,torch.bfloat16,False,False,flydsl,5027,1,4.5643,flydsl_gemm8_abf16_wbf16_bf16_t32x64x64_split_k1_block_m_warp1_block_n_warp4_block_k_warp1_async_copyTrue_b_to_ldsTrue_b_preshuffleFalse_c_to_ldsFalse_gfx950,0.0,62.03,788.81
gfx950,256,96,2880,2048,True,torch.bfloat16,torch.bfloat16,False,False,flydsl,2895,1,9.404,flydsl_gemm4_abf16_wbf16_bf16_t32x64x128_split_k1_block_m_warp1_block_n_warp4_block_k_warp1_async_copyTrue_b_to_ldsTrue_b_preshuffleFalse_c_to_ldsFalse_gfx950,0.0,120.42,1355.03
gfx950,256,96,2880,4096,True,torch.bfloat16,torch.bfloat16,False,False,flydsl,1481,2,13.5796,flydsl_gemm4_abf16_wbf16_bf16_t64x64x128_split_k2_block_m_warp4_block_n_warp2_block_k_warp1_async_copyTrue_b_to_ldsTrue_b_preshuffleFalse_c_to_ldsFalse_gfx950,0.0066,166.79,1836.02
gfx950,256,112,2880,512,True,torch.bfloat16,torch.bfloat16,False,False,flydsl,4508,1,4.6583,flydsl_gemm7_abf16_wbf16_bf16_t32x64x64_split_k1_block_m_warp2_block_n_warp2_block_k_warp1_async_copyTrue_b_to_ldsTrue_b_preshuffleFalse_c_to_ldsFalse_gfx950,0.0,70.91,796.2
gfx950,256,112,2880,2048,True,torch.bfloat16,torch.bfloat16,False,False,flydsl,2895,1,9.665,flydsl_gemm4_abf16_wbf16_bf16_t32x64x128_split_k1_block_m_warp1_block_n_warp4_block_k_warp1_async_copyTrue_b_to_ldsTrue_b_preshuffleFalse_c_to_ldsFalse_gfx950,0.0,136.7,1334.75
gfx950,256,112,2880,4096,True,torch.bfloat16,torch.bfloat16,False,False,flydsl,3185,2,14.5345,flydsl_gemm4_abf16_wbf16_bf16_t64x64x128_split_k2_block_m_warp2_block_n_warp4_block_k_warp1_async_copyTrue_b_to_ldsTrue_b_preshuffleFalse_c_to_ldsFalse_gfx950,0.0067,181.8,1730.75
gfx950,256,128,2880,512,True,torch.bfloat16,torch.bfloat16,False,False,triton,0,0,4.5758,auto,0.0,82.5,834.27
gfx950,256,128,2880,2048,True,torch.bfloat16,torch.bfloat16,False,False,flydsl,5455,1,10.0113,flydsl_gemm6_abf16_wbf16_bf16_t32x64x128_split_k1_block_m_warp2_block_n_warp1_block_k_warp2_async_copyTrue_b_to_ldsTrue_b_preshuffleFalse_c_to_ldsFalse_gfx950,0.0034,150.82,1304.33
gfx950,256,128,2880,4096,True,torch.bfloat16,torch.bfloat16,False,False,torch,0,0,15.05,native,0.0,200.66,1686.3
gfx950,256,256,2880,512,True,torch.bfloat16,torch.bfloat16,False,False,flydsl,4089,1,5.2854,flydsl_gemm5_abf16_wbf16_bf16_t64x64x64_split_k1_block_m_warp4_block_n_warp2_block_k_warp1_async_copyTrue_b_to_ldsTrue_b_preshuffleFalse_c_to_ldsFalse_gfx950,0.0,142.84,886.56
gfx950,256,256,2880,2048,True,torch.bfloat16,torch.bfloat16,False,False,flydsl,3749,1,11.7801,flydsl_gemm4_abf16_wbf16_bf16_t64x64x128_split_k1_block_m_warp4_block_n_warp2_block_k_warp1_async_copyTrue_b_to_ldsTrue_b_preshuffleFalse_c_to_ldsFalse_gfx950,0.0,256.36,1215.58
gfx950,256,1,3072,1536,False,torch.bfloat16,torch.bfloat16,False,False,flydsl,15488,4,5.2802,flydsl_gemm6_abf16_wbf16_bf16_t16x64x64_split_k4_block_m_warp1_block_n_warp1_block_k_warp1_async_copyTrue_b_to_ldsTrue_b_preshuffleFalse_c_to_ldsFalse_gfx950,0.0062,1.79,1789.02
gfx950,256,2,3072,1536,False,torch.bfloat16,torch.bfloat16,False,False,flydsl,15492,4,5.4552,flydsl_gemm6_abf16_wbf16_bf16_t16x64x64_split_k4_block_m_warp1_block_n_warp2_block_k_warp1_async_copyTrue_b_to_ldsTrue_b_preshuffleFalse_c_to_ldsFalse_gfx950,0.0057,3.46,1733.32
gfx950,256,4,3072,1536,False,torch.bfloat16,torch.bfloat16,False,False,flydsl,20475,3,5.4182,flydsl_gemm8_abf16_wbf16_bf16_t16x64x64_split_k3_block_m_warp1_block_n_warp2_block_k_warp1_async_copyTrue_b_to_ldsTrue_b_preshuffleFalse_c_to_ldsFalse_gfx950,0.0052,6.97,1748.56
gfx950,256,8,3072,1536,False,torch.bfloat16,torch.bfloat16,False,False,flydsl,4819,4,5.701,flydsl_gemm3_abf16_wbf16_bf16_t16x64x128_split_k4_block_m_warp1_block_n_warp2_block_k_warp1_async_copyTrue_b_to_ldsTrue_b_preshuffleFalse_c_to_ldsFalse_gfx950,0.0069,13.24,1668.29
gfx950,256,16,3072,1536,False,torch.bfloat16,torch.bfloat16,False,False,triton,0,0,5.871,auto,0.0,25.72,1632.54
gfx950,256,32,3072,1536,False,torch.bfloat16,torch.bfloat16,False,False,flydsl,18197,2,6.6647,flydsl_gemm7_abf16_wbf16_bf16_t16x64x64_split_k2_block_m_warp1_block_n_warp2_block_k_warp1_async_copyTrue_b_to_ldsTrue_b_preshuffleFalse_c_to_ldsFalse_gfx950,0.0026,45.31,1460.25
gfx950,256,48,3072,1536,False,torch.bfloat16,torch.bfloat16,False,False,flydsl,18141,1,7.2987,flydsl_gemm7_abf16_wbf16_bf16_t16x64x128_split_k1_block_m_warp1_block_n_warp1_block_k_warp2_async_copyTrue_b_to_ldsTrue_b_preshuffleFalse_c_to_ldsFalse_gfx950,0.0029,62.06,1353.6
gfx950,256,64,3072,1536,False,torch.bfloat16,torch.bfloat16,False,False,flydsl,12844,1,7.1717,flydsl_gemm4_abf16_wbf16_bf16_t16x64x128_split_k1_block_m_warp1_block_n_warp2_block_k_warp1_async_copyTrue_b_to_ldsTrue_b_preshuffleFalse_c_to_ldsFalse_gfx950,0.0,84.22,1398.14
gfx950,256,80,3072,1536,False,torch.bfloat16,torch.bfloat16,False,False,flydsl,12842,1,7.2331,flydsl_gemm4_abf16_wbf16_bf16_t16x64x128_split_k1_block_m_warp1_block_n_warp1_block_k_warp2_async_copyTrue_b_to_ldsTrue_b_preshuffleFalse_c_to_ldsFalse_gfx950,0.0029,104.38,1406.65
gfx950,256,96,3072,1536,False,torch.bfloat16,torch.bfloat16,False,False,flydsl,12842,1,7.4662,flydsl_gemm4_abf16_wbf16_bf16_t16x64x128_split_k1_block_m_warp1_block_n_warp1_block_k_warp2_async_copyTrue_b_to_ldsTrue_b_preshuffleFalse_c_to_ldsFalse_gfx950,0.003,121.34,1382.49
gfx950,256,112,3072,1536,False,torch.bfloat16,torch.bfloat16,False,False,flydsl,13592,1,7.6496,flydsl_gemm4_abf16_wbf16_bf16_t32x64x128_split_k1_block_m_warp1_block_n_warp4_block_k_warp1_async_copyTrue_b_to_ldsTrue_b_preshuffleFalse_c_to_ldsFalse_gfx950,0.0,138.17,1368.62
gfx950,256,128,3072,1536,False,torch.bfloat16,torch.bfloat16,False,False,flydsl,15522,1,7.9799,flydsl_gemm4_abf16_wbf16_bf16_t32x64x128_split_k1_block_m_warp1_block_n_warp4_block_k_warp1_async_copyTrue_b_to_ldsTrue_b_preshuffleFalse_c_to_ldsFalse_gfx950,0.0,151.38,1330.45
gfx950,256,256,3072,1536,False,torch.bfloat16,torch.bfloat16,False,False,flydsl,21624,1,9.2994,flydsl_gemm5_abf16_wbf16_bf16_t64x64x128_split_k1_block_m_warp2_block_n_warp2_block_k_warp2_async_copyTrue_b_to_ldsTrue_b_preshuffleFalse_c_to_ldsFalse_gfx950,0.003,259.79,1268.52
gfx950,256,1024,3072,1536,False,torch.bfloat16,torch.bfloat16,False,False,flydsl,5322,1,17.6546,flydsl_gemm4_abf16_wbf16_bf16_t128x128x64_split_k1_block_m_warp2_block_n_warp4_block_k_warp1_async_copyTrue_b_to_ldsTrue_b_preshuffleFalse_c_to_ldsFalse_gfx950,0.0,547.37,1069.09
gfx950,256,4096,3072,1536,False,torch.bfloat16,torch.bfloat16,False,False,torch,0,0,40.3383,native,0.0,958.26,1169.75
gfx950,256,16384,3072,1536,False,torch.bfloat16,torch.bfloat16,False,False,torch,0,0,130.6942,native,0.0,1183.06,1227.54
gfx950,256,1,4096,2048,False,torch.bfloat16,torch.bfloat16,False,False,flydsl,2320,4,6.2343,flydsl_gemm4_abf16_wbf16_bf16_t16x64x64_split_k4_block_m_warp1_block_n_warp2_block_k_warp1_async_copyTrue_b_to_ldsTrue_b_preshuffleFalse_c_to_ldsFalse_gfx950,0.0066,2.69,2693.09
gfx950,256,2,4096,2048,False,torch.bfloat16,torch.bfloat16,False,False,flydsl,3780,4,6.1878,flydsl_gemm7_abf16_wbf16_bf16_t16x64x64_split_k4_block_m_warp1_block_n_warp2_block_k_warp1_async_copyTrue_b_to_ldsTrue_b_preshuffleFalse_c_to_ldsFalse_gfx950,0.0085,5.42,2715.31
gfx950,256,4,4096,2048,False,torch.bfloat16,torch.bfloat16,False,False,flydsl,1400,4,6.3172,flydsl_gemm3_abf16_wbf16_bf16_t16x64x128_split_k4_block_m_warp1_block_n_warp2_block_k_warp1_async_copyTrue_b_to_ldsTrue_b_preshuffleFalse_c_to_ldsFalse_gfx950,0.0086,10.62,2663.58
gfx950,256,8,4096,2048,False,torch.bfloat16,torch.bfloat16,False,False,flydsl,3780,4,6.5843,flydsl_gemm7_abf16_wbf16_bf16_t16x64x64_split_k4_block_m_warp1_block_n_warp2_block_k_warp1_async_copyTrue_b_to_ldsTrue_b_preshuffleFalse_c_to_ldsFalse_gfx950,0.0086,20.38,2562.99
gfx950,256,16,4096,2048,False,torch.bfloat16,torch.bfloat16,False,False,flydsl,1408,2,7.0314,flydsl_gemm3_abf16_wbf16_bf16_t16x64x256_split_k2_block_m_warp1_block_n_warp1_block_k_warp2_async_copyTrue_b_to_ldsTrue_b_preshuffleFalse_c_to_ldsFalse_gfx950,0.0092,38.18,2414.0
gfx950,256,32,4096,2048,False,torch.bfloat16,torch.bfloat16,False,False,flydsl,2293,2,7.6758,flydsl_gemm4_abf16_wbf16_bf16_t16x64x128_split_k2_block_m_warp1_block_n_warp2_block_k_warp1_async_copyTrue_b_to_ldsTrue_b_preshuffleFalse_c_to_ldsFalse_gfx950,0.0031,69.94,2236.96
gfx950,256,48,4096,2048,False,torch.bfloat16,torch.bfloat16,False,False,flydsl,3762,1,8.7313,flydsl_gemm7_abf16_wbf16_bf16_t16x64x128_split_k1_block_m_warp1_block_n_warp2_block_k_warp1_async_copyTrue_b_to_ldsTrue_b_preshuffleFalse_c_to_ldsFalse_gfx950,0.0,92.23,1989.06
gfx950,256,64,4096,2048,False,torch.bfloat16,torch.bfloat16,False,False,flydsl,3181,1,8.6927,flydsl_gemm4_abf16_wbf16_bf16_t16x64x128_split_k1_block_m_warp1_block_n_warp1_block_k_warp2_async_copyTrue_b_to_ldsTrue_b_preshuffleFalse_c_to_ldsFalse_gfx950,0.0034,123.52,2020.51
gfx950,256,128,4096,2048,False,torch.bfloat16,torch.bfloat16,False,False,flydsl,3781,1,9.5228,flydsl_gemm4_abf16_wbf16_bf16_t32x64x128_split_k1_block_m_warp1_block_n_warp4_block_k_warp1_async_copyTrue_b_to_ldsTrue_b_preshuffleFalse_c_to_ldsFalse_gfx950,0.0,225.51,1926.96
gfx950,256,256,4096,512,False,torch.bfloat16,torch.bfloat16,False,False,flydsl,4620,1,5.2609,flydsl_gemm6_abf16_wbf16_bf16_t64x64x64_split_k1_block_m_warp4_block_n_warp2_block_k_warp1_async_copyTrue_b_to_ldsTrue_b_preshuffleFalse_c_to_ldsFalse_gfx950,0.0,204.1,1245.72
gfx950,256,256,4096,2048,False,torch.bfloat16,torch.bfloat16,False,False,flydsl,4045,1,11.5834,flydsl_gemm4_abf16_wbf16_bf16_t64x64x128_split_k1_block_m_warp2_block_n_warp4_block_k_warp1_async_copyTrue_b_to_ldsTrue_b_preshuffleFalse_c_to_ldsFalse_gfx950,0.0,370.79,1719.96
gfx950,256,360,4096,512,False,torch.bfloat16,torch.bfloat16,False,False,flydsl,3700,1,5.9946,flydsl_gemm4_abf16_wbf16_bf16_t96x64x64_split_k1_block_m_warp2_block_n_warp2_block_k_warp1_async_copyTrue_b_to_ldsTrue_b_preshuffleFalse_c_to_ldsFalse_gfx950,0.0,251.88,1253.14
gfx950,256,1024,4096,512,False,torch.bfloat16,torch.bfloat16,False,False,flydsl,2875,1,9.5558,flydsl_gemm4_abf16_wbf16_bf16_t128x128x64_split_k1_block_m_warp4_block_n_warp2_block_k_warp1_async_copyTrue_b_to_ldsTrue_b_preshuffleFalse_c_to_ldsFalse_gfx950,0.0,449.46,1426.51
gfx950,256,4096,4096,512,False,torch.bfloat16,torch.bfloat16,False,False,torch,0,0,20.9336,native,0.0,820.68,2003.62
gfx950,256,16384,4096,512,False,torch.bfloat16,torch.bfloat16,False,False,torch,0,0,80.4652,native,0.0,854.03,1928.65
gfx950,256,16384,4096,2048,False,torch.bfloat16,torch.bfloat16,False,False,asm,10,1,212.3527,_ZN5aiter24bf16gemm_bf16_tn_256x256E,0.0,1294.44,1027.08
gfx950,256,1,4608,16384,False,torch.bfloat16,torch.bfloat16,False,False,torch,0,0,33.0274,native,0.0,4.57,4573.08
gfx950,256,16,4608,16384,False,torch.bfloat16,torch.bfloat16,False,False,torch,0,0,32.6252,native,0.0,74.05,4648.76
gfx950,256,32,4608,16384,False,torch.bfloat16,torch.bfloat16,False,False,torch,0,0,33.3117,native,0.0,145.05,4573.12
gfx950,256,64,4608,16384,False,torch.bfloat16,torch.bfloat16,False,False,asm,5,3,42.02,_ZN5aiter39bf16gemm_fp32bf16_tn_64x64_splitk_cleanE,0.0131,229.98,3657.35
gfx950,256,128,4608,16384,False,torch.bfloat16,torch.bfloat16,False,False,torch,0,0,46.5167,native,0.0,415.49,3361.56
gfx950,256,256,4608,16384,False,torch.bfloat16,torch.bfloat16,False,False,torch,0,0,62.6096,native,0.0,617.39,2583.36
gfx950,256,512,4608,16384,False,torch.bfloat16,torch.bfloat16,False,False,torch,0,0,100.869,native,0.0,766.43,1710.05
gfx950,256,1024,4608,16384,False,torch.bfloat16,torch.bfloat16,False,False,torch,0,0,150.7376,native,0.0,1025.75,1286.92
gfx950,256,2048,4608,16384,False,torch.bfloat16,torch.bfloat16,False,False,asm,10,1,298.7333,_ZN5aiter24bf16gemm_bf16_tn_256x256E,0.0,1035.16,793.28
gfx950,256,4096,4608,16384,False,torch.bfloat16,torch.bfloat16,False,False,asm,10,1,598.5374,_ZN5aiter24bf16gemm_bf16_tn_256x256E,0.0,1033.31,539.58
gfx950,256,8192,4608,16384,False,torch.bfloat16,torch.bfloat16,False,False,asm,10,1,953.3962,_ZN5aiter24bf16gemm_bf16_tn_256x256E,0.0,1297.42,519.12
gfx950,256,16384,4608,16384,False,torch.bfloat16,torch.bfloat16,False,False,asm,10,1,1739.3206,_ZN5aiter24bf16gemm_bf16_tn_256x256E,0.0,1422.34,482.29
gfx950,256,32768,4608,16384,False,torch.bfloat16,torch.bfloat16,False,False,asm,10,1,3408.2792,_ZN5aiter24bf16gemm_bf16_tn_256x256E,0.0,1451.7,447.95
gfx950,256,1,5120,640,False,torch.bfloat16,torch.bfloat16,False,False,asm,1,2,7.0164,_ZN5aiter39bf16gemm_fp32bf16_tn_32x64_splitk_cleanE,0.0012,0.93,935.68
gfx950,256,1,5120,1280,False,torch.bfloat16,torch.bfloat16,False,False,flydsl,7819,2,5.6405,flydsl_gemm5_abf16_wbf16_bf16_t16x64x128_split_k2_block_m_warp1_block_n_warp2_block_k_warp1_async_copyTrue_b_to_ldsTrue_b_preshuffleFalse_c_to_ldsFalse_gfx950,0.0033,2.32,2326.03
gfx950,256,1,5120,2880,True,torch.bfloat16,torch.bfloat16,False,False,flydsl,4539,3,7.8993,flydsl_gemm7_abf16_wbf16_bf16_t16x64x64_split_k3_block_m_warp1_block_n_warp2_block_k_warp1_async_copyTrue_b_to_ldsTrue_b_preshuffleFalse_c_to_ldsFalse_gfx950,0.0102,3.73,3735.42
gfx950,256,1,5120,3200,False,torch.bfloat16,torch.bfloat16,False,False,asm,1,3,11.5446,_ZN5aiter39bf16gemm_fp32bf16_tn_32x64_splitk_cleanE,0.008,2.84,2839.82
gfx950,256,1,5120,5120,False,torch.bfloat16,torch.bfloat16,False,False,flydsl,4411,5,11.4563,flydsl_gemm3_abf16_wbf16_bf16_t16x128x128_split_k5_block_m_warp1_block_n_warp4_block_k_warp1_async_copyTrue_b_to_ldsTrue_b_preshuffleFalse_c_to_ldsFalse_gfx950,0.0156,4.58,4578.2
gfx950,256,1,5120,6400,False,torch.bfloat16,torch.bfloat16,False,False,asm,1,3,17.8122,_ZN5aiter39bf16gemm_fp32bf16_tn_32x64_splitk_cleanE,0.0098,3.68,3680.57
gfx950,256,1,5120,25600,False,torch.bfloat16,torch.bfloat16,False,False,torch,0,0,46.8386,native,0.0,5.6,5598.06
gfx950,256,2,5120,2880,True,torch.bfloat16,torch.bfloat16,False,False,flydsl,2011,3,7.9632,flydsl_gemm4_abf16_wbf16_bf16_t16x64x64_split_k3_block_m_warp1_block_n_warp2_block_k_warp1_async_copyTrue_b_to_ldsTrue_b_preshuffleFalse_c_to_ldsFalse_gfx950,0.0081,7.41,3707.45
gfx950,256,4,5120,2880,True,torch.bfloat16,torch.bfloat16,False,False,flydsl,5251,3,7.9943,flydsl_gemm8_abf16_wbf16_bf16_t16x64x64_split_k3_block_m_warp1_block_n_warp2_block_k_warp1_async_copyTrue_b_to_ldsTrue_b_preshuffleFalse_c_to_ldsFalse_gfx950,0.0096,14.76,3697.03
gfx950,256,8,5120,2880,True,torch.bfloat16,torch.bfloat16,False,False,flydsl,5251,3,8.1986,flydsl_gemm8_abf16_wbf16_bf16_t16x64x64_split_k3_block_m_warp1_block_n_warp2_block_k_warp1_async_copyTrue_b_to_ldsTrue_b_preshuffleFalse_c_to_ldsFalse_gfx950,0.0088,28.78,3612.71
gfx950,256,16,5120,640,False,torch.bfloat16,torch.bfloat16,False,False,triton,0,0,5.9722,auto,0.0,17.56,1128.21
gfx950,256,16,5120,1280,False,torch.bfloat16,torch.bfloat16,False,False,triton,0,0,7.4685,auto,0.0,28.08,1782.42
gfx950,256,16,5120,2880,True,torch.bfloat16,torch.bfloat16,False,False,flydsl,5251,3,8.6447,flydsl_gemm8_abf16_wbf16_bf16_t16x64x64_split_k3_block_m_warp1_block_n_warp2_block_k_warp1_async_copyTrue_b_to_ldsTrue_b_preshuffleFalse_c_to_ldsFalse_gfx950,0.0095,54.58,3441.09
gfx950,256,16,5120,3200,False,torch.bfloat16,torch.bfloat16,False,False,asm,1,3,12.4765,_ZN5aiter39bf16gemm_fp32bf16_tn_32x64_splitk_cleanE,0.008,42.02,2647.72
gfx950,256,16,5120,5120,False,torch.bfloat16,torch.bfloat16,False,False,flydsl,8176,5,12.356,flydsl_gemm4_abf16_wbf16_bf16_t16x128x128_split_k5_block_m_warp1_block_n_warp4_block_k_warp1_async_copyTrue_b_to_ldsTrue_b_preshuffleFalse_c_to_ldsFalse_gfx950,0.0147,67.89,4269.71
gfx950,256,16,5120,6400,False,torch.bfloat16,torch.bfloat16,False,False,asm,1,3,18.6276,_ZN5aiter39bf16gemm_fp32bf16_tn_32x64_splitk_cleanE,0.0098,56.29,3538.01
gfx950,256,16,5120,25600,False,torch.bfloat16,torch.bfloat16,False,False,torch,0,0,48.3215,native,0.0,86.8,5445.34
gfx950,256,32,5120,640,False,torch.bfloat16,torch.bfloat16,False,False,flydsl,1665,1,4.991,flydsl_gemm3_abf16_wbf16_bf16_t16x64x128_split_k1_block_m_warp1_block_n_warp2_block_k_warp1_async_copyTrue_b_to_ldsTrue_b_preshuffleFalse_c_to_ldsFalse_gfx950,0.0,42.02,1386.94
gfx950,256,32,5120,1280,False,torch.bfloat16,torch.bfloat16,False,False,triton,0,0,8.159,auto,0.0,51.41,1656.67
gfx950,256,32,5120,2880,True,torch.bfloat16,torch.bfloat16,False,False,triton,0,0,10.473,auto,0.0,90.11,2864.81
gfx950,256,32,5120,3200,False,torch.bfloat16,torch.bfloat16,False,False,asm,1,3,12.575,_ZN5aiter39bf16gemm_fp32bf16_tn_32x64_splitk_cleanE,0.008,83.39,2648.15
gfx950,256,32,5120,5120,False,torch.bfloat16,torch.bfloat16,False,False,asm,1,3,16.2461,_ZN5aiter39bf16gemm_fp32bf16_tn_32x64_splitk_cleanE,0.0091,103.27,3267.5
gfx950,256,32,5120,6400,False,torch.bfloat16,torch.bfloat16,False,False,asm,1,3,18.8341,_ZN5aiter39bf16gemm_fp32bf16_tn_32x64_splitk_cleanE,0.01,111.35,3518.79
gfx950,256,32,5120,25600,False,torch.bfloat16,torch.bfloat16,False,False,torch,0,0,51.2104,native,0.0,163.81,5157.35
gfx950,256,48,5120,2880,True,torch.bfloat16,torch.bfloat16,False,False,flydsl,3183,3,12.281,flydsl_gemm5_abf16_wbf16_bf16_t48x64x64_split_k3_block_m_warp1_block_n_warp2_block_k_warp1_async_copyTrue_b_to_ldsTrue_b_preshuffleFalse_c_to_ldsFalse_gfx950,0.0091,115.27,2463.9
gfx950,256,64,5120,640,False,torch.bfloat16,torch.bfloat16,False,False,torch,0,0,6.5891,native,0.0,63.66,1106.51
gfx950,256,64,5120,1280,False,torch.bfloat16,torch.bfloat16,False,False,triton,0,0,8.6051,auto,0.0,97.48,1618.39
gfx950,256,64,5120,2880,True,torch.bfloat16,torch.bfloat16,False,False,flydsl,7683,1,12.5569,flydsl_gemm8_abf16_wbf16_bf16_t16x64x64_split_k1_block_m_warp1_block_n_warp1_block_k_warp2_async_copyTrue_b_to_ldsTrue_b_preshuffleFalse_c_to_ldsFalse_gfx950,0.0042,150.31,2430.15
gfx950,256,64,5120,3200,False,torch.bfloat16,torch.bfloat16,False,False,asm,5,3,13.7745,_ZN5aiter39bf16gemm_fp32bf16_tn_64x64_splitk_cleanE,0.0079,152.25,2456.2
gfx950,256,64,5120,5120,False,torch.bfloat16,torch.bfloat16,False,False,asm,5,3,17.7938,_ZN5aiter39bf16gemm_fp32bf16_tn_64x64_splitk_cleanE,0.0093,188.57,3020.13
gfx950,256,64,5120,6400,False,torch.bfloat16,torch.bfloat16,False,False,asm,5,3,20.3857,_ZN5aiter39bf16gemm_fp32bf16_tn_64x64_splitk_cleanE,0.01,205.75,3287.14
gfx950,256,64,5120,25600,False,torch.bfloat16,torch.bfloat16,False,False,asm,5,3,62.1629,_ZN5aiter39bf16gemm_fp32bf16_tn_64x64_splitk_cleanE,0.0134,269.89,4280.3
gfx950,256,80,5120,2880,True,torch.bfloat16,torch.bfloat16,False,False,flydsl,7823,1,12.386,flydsl_gemm8_abf16_wbf16_bf16_t32x64x64_split_k1_block_m_warp1_block_n_warp4_block_k_warp1_async_copyTrue_b_to_ldsTrue_b_preshuffleFalse_c_to_ldsFalse_gfx950,0.0,190.48,2484.35
gfx950,256,96,5120,2880,True,torch.bfloat16,torch.bfloat16,False,False,flydsl,7829,1,13.1754,flydsl_gemm8_abf16_wbf16_bf16_t32x64x64_split_k1_block_m_warp2_block_n_warp2_block_k_warp1_async_copyTrue_b_to_ldsTrue_b_preshuffleFalse_c_to_ldsFalse_gfx950,0.0,214.88,2354.93
gfx950,256,112,5120,2880,True,torch.bfloat16,torch.bfloat16,False,False,flydsl,3475,1,14.6942,flydsl_gemm4_abf16_wbf16_bf16_t32x64x64_split_k1_block_m_warp1_block_n_warp2_block_k_warp1_async_copyTrue_b_to_ldsTrue_b_preshuffleFalse_c_to_ldsFalse_gfx950,0.0,224.78,2128.95
gfx950,256,128,5120,640,False,torch.bfloat16,torch.bfloat16,False,False,triton,0,0,6.8391,auto,0.0,122.66,1173.86
gfx950,256,128,5120,1280,False,torch.bfloat16,torch.bfloat16,False,False,asm,4,1,10.461,_ZN5aiter37bf16gemm_fp32bf16_tn_48x64_pf3_splitkE,0.0,160.38,1409.58
gfx950,256,128,5120,2880,True,torch.bfloat16,torch.bfloat16,False,False,flydsl,4331,1,14.4701,flydsl_gemm4_abf16_wbf16_bf16_t32x64x64_split_k1_block_m_warp1_block_n_warp2_block_k_warp1_async_copyTrue_b_to_ldsTrue_b_preshuffleFalse_c_to_ldsFalse_gfx950,0.0,260.87,2179.61
gfx950,256,128,5120,3200,False,torch.bfloat16,torch.bfloat16,False,False,asm,4,1,20.7104,_ZN5aiter37bf16gemm_fp32bf16_tn_48x64_pf3_splitkE,0.0,202.52,1685.04
gfx950,256,128,5120,5120,False,torch.bfloat16,torch.bfloat16,False,False,asm,4,1,31.7222,_ZN5aiter37bf16gemm_fp32bf16_tn_48x64_pf3_splitkE,0.0,211.55,1735.39
gfx950,256,128,5120,6400,False,torch.bfloat16,torch.bfloat16,False,False,asm,4,1,38.2094,_ZN5aiter37bf16gemm_fp32bf16_tn_48x64_pf3_splitkE,0.0,219.54,1792.36
gfx950,256,128,5120,25600,False,torch.bfloat16,torch.bfloat16,False,False,torch,0,0,70.8968,native,0.0,473.29,3808.47
gfx950,256,256,5120,640,False,torch.bfloat16,torch.bfloat16,False,False,flydsl,7033,1,6.7935,flydsl_gemm4_abf16_wbf16_bf16_t96x64x64_split_k1_block_m_warp2_block_n_warp2_block_k_warp1_async_copyTrue_b_to_ldsTrue_b_preshuffleFalse_c_to_ldsFalse_gfx950,0.0,246.96,1398.8
gfx950,256,256,5120,1280,False,torch.bfloat16,torch.bfloat16,False,False,asm,9,1,12.1986,_ZN5aiter37bf16gemm_fp32bf16_tn_96x64_pf3_splitkE,0.0,275.07,1343.1
gfx950,256,256,5120,3200,False,torch.bfloat16,torch.bfloat16,False,False,asm,9,1,23.8446,_ZN5aiter37bf16gemm_fp32bf16_tn_96x64_pf3_splitkE,0.0,351.8,1552.88
gfx950,256,256,5120,5120,False,torch.bfloat16,torch.bfloat16,False,False,asm,9,1,35.5373,_ZN5aiter37bf16gemm_fp32bf16_tn_96x64_pf3_splitkE,0.0,377.68,1622.85
gfx950,256,256,5120,6400,False,torch.bfloat16,torch.bfloat16,False,False,asm,9,1,43.5663,_ZN5aiter37bf16gemm_fp32bf16_tn_96x64_pf3_splitkE,0.0,385.1,1639.67
gfx950,256,256,5120,25600,False,torch.bfloat16,torch.bfloat16,False,False,torch,0,0,92.8805,native,0.0,722.53,2991.72
gfx950,256,512,5120,640,False,torch.bfloat16,torch.bfloat16,False,False,flydsl,2539,1,9.4855,flydsl_gemm2_abf16_wbf16_bf16_t96x64x128_split_k1_block_m_warp2_block_n_warp2_block_k_warp1_async_copyTrue_b_to_ldsTrue_b_preshuffleFalse_c_to_ldsFalse_gfx950,0.0,353.74,1312.72
gfx950,256,512,5120,1280,False,torch.bfloat16,torch.bfloat16,False,False,flydsl,11182,1,13.6224,flydsl_gemm4_abf16_wbf16_bf16_t96x128x64_split_k1_block_m_warp1_block_n_warp4_block_k_warp1_async_copyTrue_b_to_ldsTrue_b_preshuffleFalse_c_to_ldsFalse_gfx950,0.0,492.64,1443.27
gfx950,256,512,5120,3200,False,torch.bfloat16,torch.bfloat16,False,False,torch,0,0,31.3294,native,0.0,535.51,1317.86
gfx950,256,512,5120,5120,False,torch.bfloat16,torch.bfloat16,False,False,torch,0,0,44.1935,native,0.0,607.41,1423.62
gfx950,256,512,5120,6400,False,torch.bfloat16,torch.bfloat16,False,False,torch,0,0,53.2263,native,0.0,630.41,1452.9
gfx950,256,512,5120,25600,False,torch.bfloat16,torch.bfloat16,False,False,torch,0,0,153.6073,native,0.0,873.77,1911.38
gfx950,256,1024,5120,640,False,torch.bfloat16,torch.bfloat16,False,False,flydsl,2385,1,12.985,flydsl_gemm2_abf16_wbf16_bf16_t96x128x64_split_k1_block_m_warp2_block_n_warp2_block_k_warp1_async_copyTrue_b_to_ldsTrue_b_preshuffleFalse_c_to_ldsFalse_gfx950,0.0,516.82,1413.18
gfx950,256,1024,5120,1280,False,torch.bfloat16,torch.bfloat16,False,False,torch,0,0,21.5448,native,0.0,622.97,1216.74
gfx950,256,1024,5120,3200,False,torch.bfloat16,torch.bfloat16,False,False,torch,0,0,43.0522,native,0.0,779.39,1156.91
gfx950,256,1024,5120,5120,False,torch.bfloat16,torch.bfloat16,False,False,torch,0,0,66.5681,native,0.0,806.5,1102.64
gfx950,256,1024,5120,6400,False,torch.bfloat16,torch.bfloat16,False,False,torch,0,0,82.6772,native,0.0,811.7,1078.04
gfx950,256,1024,5120,25600,False,torch.bfloat16,torch.bfloat16,False,False,torch,0,0,233.5463,native,0.0,1149.39,1391.84
gfx950,256,2048,5120,640,False,torch.bfloat16,torch.bfloat16,False,False,asm,10,1,22.9328,_ZN5aiter24bf16gemm_bf16_tn_256x256E,0.0,585.27,1314.56
gfx950,256,2048,5120,1280,False,torch.bfloat16,torch.bfloat16,False,False,asm,10,1,35.9027,_ZN5aiter24bf16gemm_bf16_tn_256x256E,0.0,747.67,1095.23
gfx950,256,2048,5120,3200,False,torch.bfloat16,torch.bfloat16,False,False,asm,10,1,70.0071,_ZN5aiter24bf16gemm_bf16_tn_256x256E,0.0,958.6,954.86
gfx950,256,2048,5120,5120,False,torch.bfloat16,torch.bfloat16,False,False,asm,10,1,108.3905,_ZN5aiter24bf16gemm_bf16_tn_256x256E,0.0,990.62,870.67
gfx950,256,2048,5120,6400,False,torch.bfloat16,torch.bfloat16,False,False,asm,10,1,126.7131,_ZN5aiter24bf16gemm_bf16_tn_256x256E,0.0,1059.23,889.58
gfx950,256,2048,5120,25600,False,torch.bfloat16,torch.bfloat16,False,False,asm,10,1,456.1972,_ZN5aiter24bf16gemm_bf16_tn_256x256E,0.0,1176.84,850.45
gfx950,256,4096,5120,640,False,torch.bfloat16,torch.bfloat16,False,False,asm,10,1,43.3636,_ZN5aiter24bf16gemm_bf16_tn_256x256E,0.0,619.03,1239.28
gfx950,256,4096,5120,1280,False,torch.bfloat16,torch.bfloat16,False,False,asm,10,1,69.4435,_ZN5aiter24bf16gemm_bf16_tn_256x256E,0.0,773.1,943.73
gfx950,256,4096,5120,3200,False,torch.bfloat16,torch.bfloat16,False,False,asm,10,1,134.616,_ZN5aiter24bf16gemm_bf16_tn_256x256E,0.0,997.04,749.73
gfx950,256,4096,5120,5120,False,torch.bfloat16,torch.bfloat16,False,False,asm,10,1,206.706,_ZN5aiter24bf16gemm_bf16_tn_256x256E,0.0,1038.91,659.46
gfx950,256,4096,5120,6400,False,torch.bfloat16,torch.bfloat16,False,False,asm,10,1,244.7736,_ZN5aiter24bf16gemm_bf16_tn_256x256E,0.0,1096.67,653.29
gfx950,256,4096,5120,25600,False,torch.bfloat16,torch.bfloat16,False,False,asm,10,1,968.3405,_ZN5aiter24bf16gemm_bf16_tn_256x256E,0.0,1108.85,530.6
gfx950,256,8192,5120,640,False,torch.bfloat16,torch.bfloat16,False,False,asm,10,1,67.9081,_ZN5aiter24bf16gemm_bf16_tn_256x256E,0.0,790.58,1486.21
gfx950,256,8192,5120,1280,False,torch.bfloat16,torch.bfloat16,False,False,asm,10,1,107.7181,_ZN5aiter24bf16gemm_bf16_tn_256x256E,0.0,996.81,1095.13
gfx950,256,8192,5120,3200,False,torch.bfloat16,torch.bfloat16,False,False,asm,10,1,214.2474,_ZN5aiter24bf16gemm_bf16_tn_256x256E,0.0,1252.92,789.19
gfx950,256,8192,5120,5120,False,torch.bfloat16,torch.bfloat16,False,False,asm,10,1,326.4603,_ZN5aiter24bf16gemm_bf16_tn_256x256E,0.0,1315.62,674.51
gfx950,256,8192,5120,6400,False,torch.bfloat16,torch.bfloat16,False,False,asm,10,1,392.5128,_ZN5aiter24bf16gemm_bf16_tn_256x256E,0.0,1367.78,647.83
gfx950,256,8192,5120,25600,False,torch.bfloat16,torch.bfloat16,False,False,asm,10,1,1518.2312,_ZN5aiter24bf16gemm_bf16_tn_256x256E,0.0,1414.46,504.18
gfx950,256,16384,5120,640,False,torch.bfloat16,torch.bfloat16,False,False,asm,10,1,114.5126,_ZN5aiter24bf16gemm_bf16_tn_256x256E,0.0,937.66,1705.47
gfx950,256,16384,5120,1280,False,torch.bfloat16,torch.bfloat16,False,False,asm,10,1,181.7006,_ZN5aiter24bf16gemm_bf16_tn_256x256E,0.0,1181.88,1226.32
gfx950,256,16384,5120,3200,False,torch.bfloat16,torch.bfloat16,False,False,asm,10,1,385.0646,_ZN5aiter24bf16gemm_bf16_tn_256x256E,0.0,1394.24,793.11
gfx950,256,16384,5120,5120,False,torch.bfloat16,torch.bfloat16,False,False,asm,10,1,587.1472,_ZN5aiter24bf16gemm_bf16_tn_256x256E,0.0,1463.0,660.78
gfx950,256,16384,5120,6400,False,torch.bfloat16,torch.bfloat16,False,False,asm,10,1,715.1868,_ZN5aiter24bf16gemm_bf16_tn_256x256E,0.0,1501.34,619.45
gfx950,256,16384,5120,25600,False,torch.bfloat16,torch.bfloat16,False,False,asm,10,1,2808.6562,_ZN5aiter24bf16gemm_bf16_tn_256x256E,0.0,1529.19,451.74
gfx950,256,32768,5120,640,False,torch.bfloat16,torch.bfloat16,False,False,asm,10,1,222.8413,_ZN5aiter24bf16gemm_bf16_tn_256x256E,0.0,963.68,1723.38
gfx950,256,32768,5120,1280,False,torch.bfloat16,torch.bfloat16,False,False,asm,10,1,358.6914,_ZN5aiter24bf16gemm_bf16_tn_256x256E,0.0,1197.4,1205.88
gfx950,256,32768,5120,3200,False,torch.bfloat16,torch.bfloat16,False,False,asm,10,1,758.3608,_ZN5aiter24bf16gemm_bf16_tn_256x256E,0.0,1415.87,762.21
gfx950,256,32768,5120,5120,False,torch.bfloat16,torch.bfloat16,False,False,asm,10,1,1171.8545,_ZN5aiter24bf16gemm_bf16_tn_256x256E,0.0,1466.04,617.41
gfx950,256,32768,5120,6400,False,torch.bfloat16,torch.bfloat16,False,False,asm,10,1,1431.8652,_ZN5aiter24bf16gemm_bf16_tn_256x256E,0.0,1499.78,573.04
gfx950,256,32768,5120,25600,False,torch.bfloat16,torch.bfloat16,False,False,asm,10,1,5625.3694,_ZN5aiter24bf16gemm_bf16_tn_256x256E,0.0,1527.0,404.49
gfx950,256,1,6144,3072,False,torch.bfloat16,torch.bfloat16,False,False,flydsl,5938,2,9.0656,flydsl_gemm6_abf16_wbf16_bf16_t16x64x64_split_k2_block_m_warp1_block_n_warp2_block_k_warp1_async_copyTrue_b_to_ldsTrue_b_preshuffleFalse_c_to_ldsFalse_gfx950,0.0042,4.16,4165.99
gfx950,256,1,6144,4096,False,torch.bfloat16,torch.bfloat16,False,False,flydsl,1361,4,10.9917,flydsl_gemm3_abf16_wbf16_bf16_t16x128x128_split_k4_block_m_warp1_block_n_warp4_block_k_warp1_async_copyTrue_b_to_ldsTrue_b_preshuffleFalse_c_to_ldsFalse_gfx950,0.0137,4.58,4580.92
gfx950,256,1,6144,6144,False,torch.bfloat16,torch.bfloat16,False,False,flydsl,4011,2,14.6247,flydsl_gemm4_abf16_wbf16_bf16_t16x64x128_split_k2_block_m_warp1_block_n_warp1_block_k_warp2_async_copyTrue_b_to_ldsTrue_b_preshuffleFalse_c_to_ldsFalse_gfx950,0.015,5.16,5164.01
gfx950,256,2,6144,3072,False,torch.bfloat16,torch.bfloat16,False,False,flydsl,6946,2,9.1248,flydsl_gemm8_abf16_wbf16_bf16_t16x64x64_split_k2_block_m_warp1_block_n_warp2_block_k_warp1_async_copyTrue_b_to_ldsTrue_b_preshuffleFalse_c_to_ldsFalse_gfx950,0.0042,8.27,4140.98
gfx950,256,2,6144,4096,False,torch.bfloat16,torch.bfloat16,False,False,flydsl,3416,4,11.2885,flydsl_gemm6_abf16_wbf16_bf16_t16x128x64_split_k4_block_m_warp1_block_n_warp2_block_k_warp1_async_copyTrue_b_to_ldsTrue_b_preshuffleFalse_c_to_ldsFalse_gfx950,0.0117,8.92,4462.29
gfx950,256,2,6144,6144,False,torch.bfloat16,torch.bfloat16,False,False,flydsl,5195,2,14.638,flydsl_gemm5_abf16_wbf16_bf16_t16x64x128_split_k2_block_m_warp1_block_n_warp2_block_k_warp1_async_copyTrue_b_to_ldsTrue_b_preshuffleFalse_c_to_ldsFalse_gfx950,0.0051,10.32,5160.99
gfx950,256,4,6144,3072,False,torch.bfloat16,torch.bfloat16,False,False,flydsl,6946,2,9.2369,flydsl_gemm8_abf16_wbf16_bf16_t16x64x64_split_k2_block_m_warp1_block_n_warp2_block_k_warp1_async_copyTrue_b_to_ldsTrue_b_preshuffleFalse_c_to_ldsFalse_gfx950,0.0042,16.35,4094.71
gfx950,256,4,6144,4096,False,torch.bfloat16,torch.bfloat16,False,False,flydsl,2272,4,11.4804,flydsl_gemm4_abf16_wbf16_bf16_t16x128x64_split_k4_block_m_warp1_block_n_warp2_block_k_warp1_async_copyTrue_b_to_ldsTrue_b_preshuffleFalse_c_to_ldsFalse_gfx950,0.0121,17.54,4391.27
gfx950,256,4,6144,6144,False,torch.bfloat16,torch.bfloat16,False,False,flydsl,6588,2,14.7237,flydsl_gemm7_abf16_wbf16_bf16_t16x64x128_split_k2_block_m_warp1_block_n_warp2_block_k_warp1_async_copyTrue_b_to_ldsTrue_b_preshuffleFalse_c_to_ldsFalse_gfx950,0.0057,20.51,5134.29
gfx950,256,8,6144,3072,False,torch.bfloat16,torch.bfloat16,False,False,flydsl,5119,2,9.6277,flydsl_gemm5_abf16_wbf16_bf16_t16x64x128_split_k2_block_m_warp1_block_n_warp2_block_k_warp1_async_copyTrue_b_to_ldsTrue_b_preshuffleFalse_c_to_ldsFalse_gfx950,0.0043,31.37,3936.16
gfx950,256,8,6144,4096,False,torch.bfloat16,torch.bfloat16,False,False,flydsl,1424,4,11.8444,flydsl_gemm3_abf16_wbf16_bf16_t16x64x64_split_k4_block_m_warp1_block_n_warp2_block_k_warp1_async_copyTrue_b_to_ldsTrue_b_preshuffleFalse_c_to_ldsFalse_gfx950,0.0117,34.0,4263.24
gfx950,256,16,6144,3072,False,torch.bfloat16,torch.bfloat16,False,False,flydsl,5938,2,10.1472,flydsl_gemm6_abf16_wbf16_bf16_t16x64x64_split_k2_block_m_warp1_block_n_warp2_block_k_warp1_async_copyTrue_b_to_ldsTrue_b_preshuffleFalse_c_to_ldsFalse_gfx950,0.0041,59.52,3749.18
gfx950,256,16,6144,4096,False,torch.bfloat16,torch.bfloat16,False,False,flydsl,1409,2,12.2944,flydsl_gemm3_abf16_wbf16_bf16_t16x64x256_split_k2_block_m_warp1_block_n_warp2_block_k_warp1_async_copyTrue_b_to_ldsTrue_b_preshuffleFalse_c_to_ldsFalse_gfx950,0.005,65.5,4120.52
gfx950,256,16,6144,6144,False,torch.bfloat16,torch.bfloat16,False,False,flydsl,5993,2,16.7296,flydsl_gemm6_abf16_wbf16_bf16_t16x64x128_split_k2_block_m_warp1_block_n_warp2_block_k_warp1_async_copyTrue_b_to_ldsTrue_b_preshuffleFalse_c_to_ldsFalse_gfx950,0.0054,72.2,4536.31
gfx950,256,32,6144,3072,False,torch.bfloat16,torch.bfloat16,False,False,flydsl,5239,2,11.6945,flydsl_gemm5_abf16_wbf16_bf16_t32x64x128_split_k2_block_m_warp1_block_n_warp4_block_k_warp1_async_copyTrue_b_to_ldsTrue_b_preshuffleFalse_c_to_ldsFalse_gfx950,0.0043,103.29,3278.34
gfx950,256,32,6144,4096,False,torch.bfloat16,torch.bfloat16,False,False,flydsl,1602,2,13.3074,flydsl_gemm3_abf16_wbf16_bf16_t32x64x256_split_k2_block_m_warp1_block_n_warp1_block_k_warp2_async_copyTrue_b_to_ldsTrue_b_preshuffleFalse_c_to_ldsFalse_gfx950,0.0124,121.03,3831.48
gfx950,256,32,6144,6144,False,torch.bfloat16,torch.bfloat16,False,False,flydsl,6116,2,17.9035,flydsl_gemm6_abf16_wbf16_bf16_t32x64x128_split_k2_block_m_warp2_block_n_warp2_block_k_warp1_async_copyTrue_b_to_ldsTrue_b_preshuffleFalse_c_to_ldsFalse_gfx950,0.0056,134.94,4260.84
gfx950,256,48,6144,3072,False,torch.bfloat16,torch.bfloat16,False,False,flydsl,4232,1,12.6081,flydsl_gemm4_abf16_wbf16_bf16_t32x64x128_split_k1_block_m_warp2_block_n_warp2_block_k_warp1_async_copyTrue_b_to_ldsTrue_b_preshuffleFalse_c_to_ldsFalse_gfx950,0.0,143.71,3064.18
gfx950,256,48,6144,4096,False,torch.bfloat16,torch.bfloat16,False,False,flydsl,4010,1,14.8495,flydsl_gemm8_abf16_wbf16_bf16_t16x64x64_split_k1_block_m_warp1_block_n_warp2_block_k_warp1_async_copyTrue_b_to_ldsTrue_b_preshuffleFalse_c_to_ldsFalse_gfx950,0.0,162.69,3455.65
gfx950,256,48,6144,6144,False,torch.bfloat16,torch.bfloat16,False,False,flydsl,4467,2,20.9099,flydsl_gemm4_abf16_wbf16_bf16_t48x64x128_split_k2_block_m_warp1_block_n_warp2_block_k_warp1_async_copyTrue_b_to_ldsTrue_b_preshuffleFalse_c_to_ldsFalse_gfx950,0.0056,173.31,3667.02
gfx950,256,64,6144,3072,False,torch.bfloat16,torch.bfloat16,False,False,flydsl,4016,1,13.2611,flydsl_gemm3_abf16_wbf16_bf16_t32x64x256_split_k1_block_m_warp1_block_n_warp2_block_k_warp2_async_copyTrue_b_to_ldsTrue_b_preshuffleFalse_c_to_ldsFalse_gfx950,0.0043,182.18,2935.53
gfx950,256,64,6144,4096,False,torch.bfloat16,torch.bfloat16,False,False,flydsl,2331,1,16.7063,flydsl_gemm3_abf16_wbf16_bf16_t32x64x256_split_k1_block_m_warp2_block_n_warp1_block_k_warp2_async_copyTrue_b_to_ldsTrue_b_preshuffleFalse_c_to_ldsFalse_gfx950,0.0047,192.82,3091.19
gfx950,256,64,6144,6144,False,torch.bfloat16,torch.bfloat16,False,False,flydsl,6346,2,22.8561,flydsl_gemm4_abf16_wbf16_bf16_t64x64x128_split_k2_block_m_warp2_block_n_warp2_block_k_warp2_async_copyTrue_b_to_ldsTrue_b_preshuffleFalse_c_to_ldsFalse_gfx950,0.0136,211.4,3371.98
gfx950,256,128,6144,3072,False,torch.bfloat16,torch.bfloat16,False,False,flydsl,5313,1,16.7209,flydsl_gemm3_abf16_wbf16_bf16_t64x64x128_split_k1_block_m_warp4_block_n_warp1_block_k_warp1_async_copyTrue_b_to_ldsTrue_b_preshuffleFalse_c_to_ldsFalse_gfx950,0.0,288.97,2398.68
gfx950,256,128,6144,4096,False,torch.bfloat16,torch.bfloat16,False,False,flydsl,4696,1,20.1542,flydsl_gemm5_abf16_wbf16_bf16_t64x64x128_split_k1_block_m_warp2_block_n_warp2_block_k_warp2_async_copyTrue_b_to_ldsTrue_b_preshuffleFalse_c_to_ldsFalse_gfx950,0.0049,319.66,2627.4
gfx950,256,128,6144,6144,False,torch.bfloat16,torch.bfloat16,False,False,flydsl,5384,1,30.6654,flydsl_gemm3_abf16_wbf16_bf16_t64x64x128_split_k1_block_m_warp2_block_n_warp2_block_k_warp2_async_copyTrue_b_to_ldsTrue_b_preshuffleFalse_c_to_ldsFalse_gfx950,0.0057,315.13,2564.56
gfx950,256,256,6144,3072,False,torch.bfloat16,torch.bfloat16,False,False,flydsl,7361,1,21.715,flydsl_gemm4_abf16_wbf16_bf16_t96x64x64_split_k1_block_m_warp2_block_n_warp2_block_k_warp1_async_copyTrue_b_to_ldsTrue_b_preshuffleFalse_c_to_ldsFalse_gfx950,0.0,445.02,1955.67
gfx950,256,256,6144,4096,False,torch.bfloat16,torch.bfloat16,False,False,torch,0,0,27.2042,native,0.0,473.64,2042.87
gfx950,256,256,6144,6144,False,torch.bfloat16,torch.bfloat16,False,False,torch,0,0,39.8281,native,0.0,485.27,2053.55
gfx950,256,16384,6144,3072,False,torch.bfloat16,torch.bfloat16,False,False,torch,0,0,426.5721,native,0.0,1449.87,796.44
gfx950,256,16384,6144,6144,False,torch.bfloat16,torch.bfloat16,False,False,torch,0,0,802.3853,native,0.0,1541.59,595.91
gfx950,256,1,6400,5120,False,torch.bfloat16,torch.bfloat16,False,False,flydsl,4411,5,12.729,flydsl_gemm3_abf16_wbf16_bf16_t16x128x128_split_k5_block_m_warp1_block_n_warp4_block_k_warp1_async_copyTrue_b_to_ldsTrue_b_preshuffleFalse_c_to_ldsFalse_gfx950,0.0161,5.15,5150.37
gfx950,256,16,6400,5120,False,torch.bfloat16,torch.bfloat16,False,False,torch,0,0,16.1692,native,0.0,64.85,4075.94
gfx950,256,32,6400,5120,False,torch.bfloat16,torch.bfloat16,False,False,torch,0,0,18.3958,native,0.0,114.0,3602.63
gfx950,256,64,6400,5120,False,torch.bfloat16,torch.bfloat16,False,False,asm,5,2,22.5849,_ZN5aiter39bf16gemm_fp32bf16_tn_64x64_splitk_cleanE,0.0052,185.71,2967.05
gfx950,256,128,6400,5120,False,torch.bfloat16,torch.bfloat16,False,False,triton,0,0,32.7099,auto,0.0,256.45,2093.71
gfx950,256,256,6400,5120,False,torch.bfloat16,torch.bfloat16,False,False,triton,0,0,46.8385,auto,0.0,358.19,1525.12
gfx950,256,512,6400,5120,False,torch.bfloat16,torch.bfloat16,False,False,torch,0,0,61.5251,native,0.0,545.38,1256.93
gfx950,256,1024,6400,5120,False,torch.bfloat16,torch.bfloat16,False,False,torch,0,0,87.4104,native,0.0,767.74,1019.66
gfx950,256,2048,6400,5120,False,torch.bfloat16,torch.bfloat16,False,False,asm,10,1,124.2504,_ZN5aiter24bf16gemm_bf16_tn_256x256E,0.0,1080.22,907.22
gfx950,256,4096,6400,5120,False,torch.bfloat16,torch.bfloat16,False,False,asm,10,1,227.3241,_ZN5aiter24bf16gemm_bf16_tn_256x256E,0.0,1180.85,703.44
gfx950,256,8192,6400,5120,False,torch.bfloat16,torch.bfloat16,False,False,asm,10,1,437.9952,_ZN5aiter24bf16gemm_bf16_tn_256x256E,0.0,1225.75,580.55
gfx950,256,16384,6400,5120,False,torch.bfloat16,torch.bfloat16,False,False,asm,10,1,799.8221,_ZN5aiter24bf16gemm_bf16_tn_256x256E,0.0,1342.48,553.9
gfx950,256,32768,6400,5120,False,torch.bfloat16,torch.bfloat16,False,False,asm,10,1,1604.0758,_ZN5aiter24bf16gemm_bf16_tn_256x256E,0.0,1338.77,511.52
gfx950,256,1,7168,512,False,torch.bfloat16,torch.bfloat16,False,False,flydsl,3271,1,4.3347,flydsl_gemm7_abf16_wbf16_bf16_t16x64x64_split_k1_block_m_warp1_block_n_warp2_block_k_warp1_async_copyTrue_b_to_ldsTrue_b_preshuffleFalse_c_to_ldsFalse_gfx950,0.0,1.69,1696.86
gfx950,256,1,7168,2048,False,torch.bfloat16,torch.bfloat16,False,False,triton,0,0,7.5772,auto,0.0,3.87,3877.23
gfx950,256,1,7168,8192,False,torch.bfloat16,torch.bfloat16,False,False,flydsl,3223,8,22.3009,flydsl_gemm3_abf16_wbf16_bf16_t16x256x64_split_k8_block_m_warp1_block_n_warp2_block_k_warp1_async_copyTrue_b_to_ldsTrue_b_preshuffleFalse_c_to_ldsFalse_gfx950,0.0227,5.27,5267.56
gfx950,256,2,7168,2048,False,torch.bfloat16,torch.bfloat16,False,False,flydsl,10607,2,7.6856,flydsl_gemm6_abf16_wbf16_bf16_t16x64x128_split_k2_block_m_warp1_block_n_warp2_block_k_warp1_async_copyTrue_b_to_ldsTrue_b_preshuffleFalse_c_to_ldsFalse_gfx950,0.0026,7.64,3824.94
gfx950,256,4,7168,2048,False,torch.bfloat16,torch.bfloat16,False,False,flydsl,13895,2,7.9299,flydsl_gemm8_abf16_wbf16_bf16_t16x64x64_split_k2_block_m_warp1_block_n_warp2_block_k_warp1_async_copyTrue_b_to_ldsTrue_b_preshuffleFalse_c_to_ldsFalse_gfx950,0.0028,14.81,3711.76
gfx950,256,8,7168,2048,False,torch.bfloat16,torch.bfloat16,False,False,triton,0,0,7.7452,auto,0.0,30.33,3809.79
gfx950,256,16,7168,2048,False,torch.bfloat16,torch.bfloat16,False,False,triton,0,0,8.2321,auto,0.0,57.06,3602.37
gfx950,256,16,7168,8192,False,torch.bfloat16,torch.bfloat16,False,False,torch,0,0,25.5968,native,0.0,73.41,4607.3
gfx950,256,32,7168,2048,False,torch.bfloat16,torch.bfloat16,False,False,triton,0,0,8.1123,auto,0.0,115.81,3691.92
gfx950,256,32,7168,8192,False,torch.bfloat16,torch.bfloat16,False,False,torch,0,0,26.4622,native,0.0,142.02,4475.2
gfx950,256,48,7168,512,False,torch.bfloat16,torch.bfloat16,False,False,flydsl,3024,1,4.665,flydsl_gemm6_abf16_wbf16_bf16_t32x64x64_split_k1_block_m_warp2_block_n_warp2_block_k_warp1_async_copyTrue_b_to_ldsTrue_b_preshuffleFalse_c_to_ldsFalse_gfx950,0.0,75.52,1731.47
gfx950,256,48,7168,2048,False,torch.bfloat16,torch.bfloat16,False,False,flydsl,8861,1,9.5569,flydsl_gemm5_abf16_wbf16_bf16_t32x64x128_split_k1_block_m_warp1_block_n_warp2_block_k_warp2_async_copyTrue_b_to_ldsTrue_b_preshuffleFalse_c_to_ldsFalse_gfx950,0.0034,147.46,3164.71
gfx950,256,64,7168,2048,False,torch.bfloat16,torch.bfloat16,False,False,flydsl,12087,1,10.1109,flydsl_gemm5_abf16_wbf16_bf16_t32x64x128_split_k1_block_m_warp1_block_n_warp4_block_k_warp1_async_copyTrue_b_to_ldsTrue_b_preshuffleFalse_c_to_ldsFalse_gfx950,0.0,185.84,3020.48
gfx950,256,64,7168,8192,False,torch.bfloat16,torch.bfloat16,False,False,asm,5,2,34.0572,_ZN5aiter39bf16gemm_fp32bf16_tn_64x64_splitk_cleanE,0.0062,220.69,3506.06
gfx950,256,72,7168,512,False,torch.bfloat16,torch.bfloat16,False,False,flydsl,4418,1,4.9825,flydsl_gemm7_abf16_wbf16_bf16_t48x64x64_split_k1_block_m_warp1_block_n_warp2_block_k_warp1_async_copyTrue_b_to_ldsTrue_b_preshuffleFalse_c_to_ldsFalse_gfx950,0.0,106.07,1695.12
gfx950,256,80,7168,512,False,torch.bfloat16,torch.bfloat16,False,False,flydsl,4434,1,4.9723,flydsl_gemm7_abf16_wbf16_bf16_t64x64x64_split_k1_block_m_warp1_block_n_warp4_block_k_warp1_async_copyTrue_b_to_ldsTrue_b_preshuffleFalse_c_to_ldsFalse_gfx950,0.0,118.09,1723.31
gfx950,256,80,7168,2048,False,torch.bfloat16,torch.bfloat16,False,False,flydsl,10235,1,10.7069,flydsl_gemm4_abf16_wbf16_bf16_t64x64x128_split_k1_block_m_warp4_block_n_warp1_block_k_warp2_async_copyTrue_b_to_ldsTrue_b_preshuffleFalse_c_to_ldsFalse_gfx950,0.0034,219.37,2879.89
gfx950,256,96,7168,512,False,torch.bfloat16,torch.bfloat16,False,False,flydsl,3107,1,5.2439,flydsl_gemm4_abf16_wbf16_bf16_t64x64x128_split_k1_block_m_warp1_block_n_warp4_block_k_warp1_async_copyTrue_b_to_ldsTrue_b_preshuffleFalse_c_to_ldsFalse_gfx950,0.0,134.37,1680.92
gfx950,256,96,7168,2048,False,torch.bfloat16,torch.bfloat16,False,False,flydsl,10229,1,10.985,flydsl_gemm4_abf16_wbf16_bf16_t64x64x128_split_k1_block_m_warp2_block_n_warp2_block_k_warp2_async_copyTrue_b_to_ldsTrue_b_preshuffleFalse_c_to_ldsFalse_gfx950,0.0033,256.58,2833.83
gfx950,256,112,7168,2048,False,torch.bfloat16,torch.bfloat16,False,False,flydsl,10231,1,11.5911,flydsl_gemm4_abf16_wbf16_bf16_t64x64x128_split_k1_block_m_warp2_block_n_warp4_block_k_warp1_async_copyTrue_b_to_ldsTrue_b_preshuffleFalse_c_to_ldsFalse_gfx950,0.0,283.69,2711.09
gfx950,256,120,7168,512,False,torch.bfloat16,torch.bfloat16,False,False,flydsl,4434,1,5.3391,flydsl_gemm7_abf16_wbf16_bf16_t64x64x64_split_k1_block_m_warp1_block_n_warp4_block_k_warp1_async_copyTrue_b_to_ldsTrue_b_preshuffleFalse_c_to_ldsFalse_gfx950,0.0,164.97,1720.0
gfx950,256,128,7168,512,False,torch.bfloat16,torch.bfloat16,False,False,flydsl,4843,1,5.4135,flydsl_gemm7_abf16_wbf16_bf16_t64x64x64_split_k1_block_m_warp1_block_n_warp4_block_k_warp1_async_copyTrue_b_to_ldsTrue_b_preshuffleFalse_c_to_ldsFalse_gfx950,0.0,173.55,1719.06
gfx950,256,128,7168,2048,False,torch.bfloat16,torch.bfloat16,False,False,flydsl,11375,1,12.1164,flydsl_gemm4_abf16_wbf16_bf16_t64x64x128_split_k1_block_m_warp2_block_n_warp4_block_k_warp1_async_copyTrue_b_to_ldsTrue_b_preshuffleFalse_c_to_ldsFalse_gfx950,0.0,310.17,2617.89
gfx950,256,128,7168,8192,False,torch.bfloat16,torch.bfloat16,False,False,triton,0,0,50.1861,auto,0.0,299.53,2418.45
gfx950,256,256,7168,512,False,torch.bfloat16,torch.bfloat16,False,False,flydsl,2961,1,6.9191,flydsl_gemm4_abf16_wbf16_bf16_t128x64x64_split_k1_block_m_warp4_block_n_warp1_block_k_warp1_async_copyTrue_b_to_ldsTrue_b_preshuffleFalse_c_to_ldsFalse_gfx950,0.0,271.57,1629.14
gfx950,256,256,7168,2048,False,torch.bfloat16,torch.bfloat16,False,False,triton,0,0,16.3917,auto,0.0,458.54,2079.02
gfx950,256,256,7168,8192,False,torch.bfloat16,torch.bfloat16,False,False,triton,0,0,72.0475,auto,0.0,417.29,1739.2
gfx950,256,512,7168,8192,False,torch.bfloat16,torch.bfloat16,False,False,torch,0,0,84.0112,native,0.0,715.73,1585.14
gfx950,256,1024,7168,512,False,torch.bfloat16,torch.bfloat16,False,False,flydsl,91,1,13.7628,flydsl_gemm2_abf16_wbf16_bf16_t128x128x64_split_k1_block_m_warp4_block_n_warp4_block_k_warp1_async_copyTrue_b_to_ldsTrue_b_preshuffleFalse_c_to_ldsFalse_gfx950,0.0,546.12,1676.16
gfx950,256,1024,7168,8192,False,torch.bfloat16,torch.bfloat16,False,False,asm,10,1,145.6016,_ZN5aiter24bf16gemm_bf16_tn_256x256E,0.0,825.95,1022.64
gfx950,256,2048,7168,8192,False,torch.bfloat16,torch.bfloat16,False,False,asm,10,1,180.6066,_ZN5aiter24bf16gemm_bf16_tn_256x256E,0.0,1331.72,998.61
gfx950,256,4096,7168,512,False,torch.bfloat16,torch.bfloat16,False,False,asm,10,1,40.9031,_ZN5aiter24bf16gemm_bf16_tn_256x256E,0.0,735.02,1717.59
gfx950,256,4096,7168,8192,False,torch.bfloat16,torch.bfloat16,False,False,asm,10,1,343.387,_ZN5aiter24bf16gemm_bf16_tn_256x256E,0.0,1400.86,708.44
gfx950,256,8192,7168,8192,False,torch.bfloat16,torch.bfloat16,False,False,asm,10,1,670.3004,_ZN5aiter24bf16gemm_bf16_tn_256x256E,0.0,1435.29,550.65
gfx950,256,16384,7168,512,False,torch.bfloat16,torch.bfloat16,False,False,torch,0,0,131.8454,native,0.0,912.12,1964.41
gfx950,256,16384,7168,8192,False,torch.bfloat16,torch.bfloat16,False,False,asm,10,1,1263.3316,_ZN5aiter24bf16gemm_bf16_tn_256x256E,0.0,1523.07,491.37
gfx950,256,32768,7168,8192,False,torch.bfloat16,torch.bfloat16,False,False,asm,10,1,2526.7126,_ZN5aiter24bf16gemm_bf16_tn_256x256E,0.0,1523.04,444.88
gfx950,256,1,8192,1024,False,torch.bfloat16,torch.bfloat16,False,False,flydsl,5454,2,6.041,flydsl_gemm4_abf16_wbf16_bf16_t16x64x128_split_k2_block_m_warp1_block_n_warp2_block_k_warp1_async_copyTrue_b_to_ldsTrue_b_preshuffleFalse_c_to_ldsFalse_gfx950,0.0013,2.78,2780.28
gfx950,256,1,8192,2048,False,torch.bfloat16,torch.bfloat16,False,False,flydsl,5907,2,8.0936,flydsl_gemm4_abf16_wbf16_bf16_t16x64x64_split_k2_block_m_warp1_block_n_warp2_block_k_warp1_async_copyTrue_b_to_ldsTrue_b_preshuffleFalse_c_to_ldsFalse_gfx950,0.0028,4.15,4148.33
gfx950,256,1,8192,3584,False,torch.bfloat16,torch.bfloat16,False,False,flydsl,47,7,12.4064,flydsl_gemm2_abf16_wbf16_bf16_t16x128x128_split_k7_block_m_warp1_block_n_warp4_block_k_warp1_async_copyTrue_b_to_ldsTrue_b_preshuffleFalse_c_to_ldsFalse_gfx950,0.017,4.73,4734.96
gfx950,256,1,8192,7168,False,torch.bfloat16,torch.bfloat16,False,False,flydsl,3807,2,21.5928,flydsl_gemm3_abf16_wbf16_bf16_t16x64x128_split_k2_block_m_warp1_block_n_warp2_block_k_warp1_async_copyTrue_b_to_ldsTrue_b_preshuffleFalse_c_to_ldsFalse_gfx950,0.0059,5.44,5440.3
gfx950,256,1,8192,8192,False,torch.bfloat16,torch.bfloat16,False,False,flydsl,243,8,25.75,flydsl_gemm2_abf16_wbf16_bf16_t16x64x128_split_k8_block_m_warp1_block_n_warp1_block_k_warp1_async_copyTrue_b_to_ldsTrue_b_preshuffleFalse_c_to_ldsFalse_gfx950,0.0233,5.21,5213.61
gfx950,256,1,8192,28672,False,torch.bfloat16,torch.bfloat16,False,False,torch,0,0,75.5237,native,0.0,6.22,6221.04
gfx950,256,16,8192,1024,False,torch.bfloat16,torch.bfloat16,False,False,triton,0,0,7.3003,auto,0.0,36.77,2338.55
gfx950,256,16,8192,2048,False,torch.bfloat16,torch.bfloat16,False,False,triton,0,0,11.2334,auto,0.0,47.79,3016.19
gfx950,256,16,8192,3584,False,torch.bfloat16,torch.bfloat16,False,False,flydsl,6000,2,12.8038,flydsl_gemm4_abf16_wbf16_bf16_t16x64x64_split_k2_block_m_warp1_block_n_warp2_block_k_warp1_async_copyTrue_b_to_ldsTrue_b_preshuffleFalse_c_to_ldsFalse_gfx950,0.0047,73.38,4615.59
gfx950,256,16,8192,7168,False,torch.bfloat16,torch.bfloat16,False,False,torch,0,0,23.18,native,0.0,81.06,5087.66
gfx950,256,16,8192,8192,False,torch.bfloat16,torch.bfloat16,False,False,torch,0,0,29.0183,native,0.0,74.0,4643.35
gfx950,256,16,8192,28672,False,torch.bfloat16,torch.bfloat16,False,False,torch,0,0,76.6302,native,0.0,98.08,6145.64
gfx950,256,32,8192,1024,False,torch.bfloat16,torch.bfloat16,False,False,triton,0,0,7.079,auto,0.0,75.84,2453.32
gfx950,256,32,8192,2048,False,torch.bfloat16,torch.bfloat16,False,False,triton,0,0,11.4,auto,0.0,94.19,3000.86
gfx950,256,32,8192,3584,False,torch.bfloat16,torch.bfloat16,False,False,asm,1,2,17.3213,_ZN5aiter39bf16gemm_fp32bf16_tn_32x64_splitk_cleanE,0.0048,108.48,3433.57
gfx950,256,32,8192,7168,False,torch.bfloat16,torch.bfloat16,False,False,torch,0,0,26.4739,native,0.0,141.95,4473.22
gfx950,256,32,8192,8192,False,torch.bfloat16,torch.bfloat16,False,False,torch,0,0,31.31,native,0.0,137.18,4320.23
gfx950,256,32,8192,28672,False,torch.bfloat16,torch.bfloat16,False,False,torch,0,0,79.2098,native,0.0,189.78,5960.39
gfx950,256,64,8192,2048,False,torch.bfloat16,torch.bfloat16,False,False,triton,0,0,12.4356,auto,0.0,172.69,2803.66
gfx950,256,64,8192,3584,False,torch.bfloat16,torch.bfloat16,False,False,asm,5,2,18.6886,_ZN5aiter39bf16gemm_fp32bf16_tn_64x64_splitk_cleanE,0.0048,201.09,3222.69
gfx950,256,64,8192,7168,False,torch.bfloat16,torch.bfloat16,False,False,asm,5,2,30.8218,_ZN5aiter39bf16gemm_fp32bf16_tn_64x64_splitk_cleanE,0.0061,243.86,3874.1
gfx950,256,64,8192,8192,False,torch.bfloat16,torch.bfloat16,False,False,asm,5,2,36.7821,_ZN5aiter39bf16gemm_fp32bf16_tn_64x64_splitk_cleanE,0.0062,233.54,3706.01
gfx950,256,64,8192,28672,False,torch.bfloat16,torch.bfloat16,False,False,torch,0,0,85.6082,native,0.0,351.19,5542.47
gfx950,256,128,8192,1024,False,torch.bfloat16,torch.bfloat16,False,False,triton,0,0,9.5917,auto,0.0,223.89,1995.11
gfx950,256,128,8192,2048,False,torch.bfloat16,torch.bfloat16,False,False,triton,0,0,16.0441,auto,0.0,267.7,2254.78
gfx950,256,128,8192,3584,False,torch.bfloat16,torch.bfloat16,False,False,triton,0,0,25.3581,auto,0.0,296.4,2434.52
gfx950,256,128,8192,7168,False,torch.bfloat16,torch.bfloat16,False,False,asm,6,1,46.4994,_ZN5aiter37bf16gemm_fp32bf16_tn_64x64_pf3_splitkE,0.0,323.28,2610.2
gfx950,256,128,8192,8192,False,torch.bfloat16,torch.bfloat16,False,False,triton,0,0,51.0973,auto,0.0,336.22,2708.79
gfx950,256,128,8192,28672,False,torch.bfloat16,torch.bfloat16,False,False,torch,0,0,93.8503,native,0.0,640.7,5106.0
gfx950,256,256,8192,1024,False,torch.bfloat16,torch.bfloat16,False,False,flydsl,8249,1,10.0931,flydsl_gemm4_abf16_wbf16_bf16_t128x64x64_split_k1_block_m_warp2_block_n_warp4_block_k_warp1_async_copyTrue_b_to_ldsTrue_b_preshuffleFalse_c_to_ldsFalse_gfx950,0.0,425.53,2129.75
gfx950,256,256,8192,2048,False,torch.bfloat16,torch.bfloat16,False,False,triton,0,0,21.9273,auto,0.0,391.75,1769.36
gfx950,256,256,8192,3584,False,torch.bfloat16,torch.bfloat16,False,False,triton,0,0,35.5211,auto,0.0,423.2,1822.85
gfx950,256,256,8192,7168,False,torch.bfloat16,torch.bfloat16,False,False,triton,0,0,67.4176,auto,0.0,445.95,1858.64
gfx950,256,256,8192,8192,False,torch.bfloat16,torch.bfloat16,False,False,triton,0,0,75.099,auto,0.0,457.53,1898.91
gfx950,256,256,8192,28672,False,torch.bfloat16,torch.bfloat16,False,False,torch,0,0,127.1531,native,0.0,945.78,3842.9
gfx950,256,512,8192,1024,False,torch.bfloat16,torch.bfloat16,False,False,torch,0,0,15.0792,native,0.0,569.65,1738.45
gfx950,256,512,8192,2048,False,torch.bfloat16,torch.bfloat16,False,False,flydsl,8351,1,23.0668,flydsl_gemm4_abf16_wbf16_bf16_t128x128x64_split_k1_block_m_warp2_block_n_warp4_block_k_warp1_async_copyTrue_b_to_ldsTrue_b_preshuffleFalse_c_to_ldsFalse_gfx950,0.0,744.79,1909.25
gfx950,256,512,8192,3584,False,torch.bfloat16,torch.bfloat16,False,False,torch,0,0,47.7304,native,0.0,629.89,1482.89
gfx950,256,512,8192,7168,False,torch.bfloat16,torch.bfloat16,False,False,torch,0,0,86.5288,native,0.0,694.91,1539.02
gfx950,256,512,8192,8192,False,torch.bfloat16,torch.bfloat16,False,False,torch,0,0,93.0417,native,0.0,738.59,1622.87
gfx950,256,512,8192,28672,False,torch.bfloat16,torch.bfloat16,False,False,torch,0,0,258.8524,native,0.0,929.17,1960.62
gfx950,256,1024,8192,1024,False,torch.bfloat16,torch.bfloat16,False,False,torch,0,0,22.2765,native,0.0,771.21,1600.41
gfx950,256,1024,8192,2048,False,torch.bfloat16,torch.bfloat16,False,False,flydsl,5565,1,37.2489,flydsl_gemm3_abf16_wbf16_bf16_t256x128x64_split_k1_block_m_warp2_block_n_warp2_block_k_warp2_async_copyTrue_b_to_ldsTrue_b_preshuffleFalse_c_to_ldsFalse_gfx950,0.0034,922.44,1463.83
gfx950,256,1024,8192,3584,False,torch.bfloat16,torch.bfloat16,False,False,asm,10,1,72.7344,_ZN5aiter24bf16gemm_bf16_tn_256x256E,0.0,826.7,1138.9
gfx950,256,1024,8192,7168,False,torch.bfloat16,torch.bfloat16,False,False,asm,10,1,132.1089,_ZN5aiter24bf16gemm_bf16_tn_256x256E,0.0,910.3,1127.08
gfx950,256,1024,8192,8192,False,torch.bfloat16,torch.bfloat16,False,False,asm,10,1,149.1713,_ZN5aiter24bf16gemm_bf16_tn_256x256E,0.0,921.35,1124.69
gfx950,256,1024,8192,28672,False,torch.bfloat16,torch.bfloat16,False,False,asm,10,1,482.3198,_ZN5aiter24bf16gemm_bf16_tn_256x256E,0.0,997.34,1130.49
gfx950,256,2048,8192,1024,False,torch.bfloat16,torch.bfloat16,False,False,asm,10,1,32.55,_ZN5aiter24bf16gemm_bf16_tn_256x256E,0.0,1055.6,1675.14
gfx950,256,2048,8192,2048,False,torch.bfloat16,torch.bfloat16,False,False,torch,0,0,59.9947,native,0.0,1145.43,1258.4
gfx950,256,2048,8192,3584,False,torch.bfloat16,torch.bfloat16,False,False,asm,10,1,95.4106,_ZN5aiter24bf16gemm_bf16_tn_256x256E,0.0,1260.44,1120.99
gfx950,256,2048,8192,7168,False,torch.bfloat16,torch.bfloat16,False,False,asm,10,1,171.7077,_ZN5aiter24bf16gemm_bf16_tn_256x256E,0.0,1400.74,1050.36
gfx950,256,2048,8192,8192,False,torch.bfloat16,torch.bfloat16,False,False,asm,10,1,192.9439,_ZN5aiter24bf16gemm_bf16_tn_256x256E,0.0,1424.65,1043.45
gfx950,256,2048,8192,28672,False,torch.bfloat16,torch.bfloat16,False,False,asm,10,1,627.237,_ZN5aiter24bf16gemm_bf16_tn_256x256E,0.0,1533.83,989.67
gfx950,256,4096,8192,1024,False,torch.bfloat16,torch.bfloat16,False,False,asm,10,1,65.1781,_ZN5aiter24bf16gemm_bf16_tn_256x256E,0.0,1054.33,1415.73
gfx950,256,4096,8192,2048,False,torch.bfloat16,torch.bfloat16,False,False,torch,0,0,122.1564,native,0.0,1125.11,961.39
gfx950,256,4096,8192,3584,False,torch.bfloat16,torch.bfloat16,False,False,asm,10,1,177.8346,_ZN5aiter24bf16gemm_bf16_tn_256x256E,0.0,1352.48,872.66
gfx950,256,4096,8192,7168,False,torch.bfloat16,torch.bfloat16,False,False,asm,10,1,326.7272,_ZN5aiter24bf16gemm_bf16_tn_256x256E,0.0,1472.29,744.56
gfx950,256,4096,8192,8192,False,torch.bfloat16,torch.bfloat16,False,False,asm,10,1,366.8778,_ZN5aiter24bf16gemm_bf16_tn_256x256E,0.0,1498.47,731.68
gfx950,256,4096,8192,28672,False,torch.bfloat16,torch.bfloat16,False,False,asm,10,1,1246.8325,_ZN5aiter24bf16gemm_bf16_tn_256x256E,0.0,1543.23,618.97
gfx950,256,8192,8192,1024,False,torch.bfloat16,torch.bfloat16,False,False,asm,10,1,121.9167,_ZN5aiter24bf16gemm_bf16_tn_256x256E,0.0,1127.32,1376.12
gfx950,256,8192,8192,2048,False,torch.bfloat16,torch.bfloat16,False,False,torch,0,0,212.0553,native,0.0,1296.26,949.41
gfx950,256,8192,8192,3584,False,torch.bfloat16,torch.bfloat16,False,False,asm,10,1,337.4416,_ZN5aiter24bf16gemm_bf16_tn_256x256E,0.0,1425.54,745.78
gfx950,256,8192,8192,7168,False,torch.bfloat16,torch.bfloat16,False,False,asm,10,1,630.3348,_ZN5aiter24bf16gemm_bf16_tn_256x256E,0.0,1526.29,585.56
gfx950,256,8192,8192,8192,False,torch.bfloat16,torch.bfloat16,False,False,asm,10,1,688.6517,_ZN5aiter24bf16gemm_bf16_tn_256x256E,0.0,1596.61,584.7
gfx950,256,8192,8192,28672,False,torch.bfloat16,torch.bfloat16,False,False,asm,10,1,2497.3336,_ZN5aiter24bf16gemm_bf16_tn_256x256E,0.0,1540.96,429.96
gfx950,256,16384,8192,1024,False,torch.bfloat16,torch.bfloat16,False,False,asm,10,1,236.8495,_ZN5aiter24bf16gemm_bf16_tn_256x256E,0.0,1160.56,1345.86
gfx950,256,16384,8192,2048,False,torch.bfloat16,torch.bfloat16,False,False,torch,0,0,395.4457,native,0.0,1390.22,933.37
gfx950,256,16384,8192,3584,False,torch.bfloat16,torch.bfloat16,False,False,asm,10,1,657.6327,_ZN5aiter24bf16gemm_bf16_tn_256x256E,0.0,1462.93,676.06
gfx950,256,16384,8192,7168,False,torch.bfloat16,torch.bfloat16,False,False,asm,10,1,1244.7931,_ZN5aiter24bf16gemm_bf16_tn_256x256E,0.0,1545.76,498.68
gfx950,256,16384,8192,8192,False,torch.bfloat16,torch.bfloat16,False,False,asm,10,1,1410.2403,_ZN5aiter24bf16gemm_bf16_tn_256x256E,0.0,1559.33,475.87
gfx950,256,16384,8192,28672,False,torch.bfloat16,torch.bfloat16,False,False,asm,10,1,5002.769,_ZN5aiter24bf16gemm_bf16_tn_256x256E,0.0,1538.46,335.36
gfx950,256,32768,8192,1024,False,torch.bfloat16,torch.bfloat16,False,False,asm,10,1,463.0824,_ZN5aiter24bf16gemm_bf16_tn_256x256E,0.0,1187.17,1340.49
gfx950,256,32768,8192,2048,False,torch.bfloat16,torch.bfloat16,False,False,torch,0,0,778.9316,native,0.0,1411.56,904.63
gfx950,256,32768,8192,3584,False,torch.bfloat16,torch.bfloat16,False,False,asm,10,1,1300.2138,_ZN5aiter24bf16gemm_bf16_tn_256x256E,0.0,1479.87,638.72
gfx950,256,32768,8192,7168,False,torch.bfloat16,torch.bfloat16,False,False,asm,10,1,2489.0786,_ZN5aiter24bf16gemm_bf16_tn_256x256E,0.0,1546.07,451.6
gfx950,256,32768,8192,8192,False,torch.bfloat16,torch.bfloat16,False,False,asm,10,1,2825.562,_ZN5aiter24bf16gemm_bf16_tn_256x256E,0.0,1556.52,427.51
gfx950,256,32768,8192,28672,False,torch.bfloat16,torch.bfloat16,False,False,asm,10,1,10090.83,_ZN5aiter24bf16gemm_bf16_tn_256x256E,0.0,1525.46,285.97
gfx950,256,1,9216,16384,False,torch.bfloat16,torch.bfloat16,False,False,torch,0,0,62.3414,native,0.0,4.84,4844.95
gfx950,256,16,9216,16384,False,torch.bfloat16,torch.bfloat16,False,False,triton,0,0,68.6305,auto,0.0,70.4,4412.16
gfx950,256,32,9216,16384,False,torch.bfloat16,torch.bfloat16,False,False,triton,0,0,73.2489,auto,0.0,131.93,4145.16
gfx950,256,64,9216,16384,False,torch.bfloat16,torch.bfloat16,False,False,torch,0,0,60.9628,native,0.0,317.04,5007.43
gfx950,256,128,9216,16384,False,torch.bfloat16,torch.bfloat16,False,False,torch,0,0,77.7145,native,0.0,497.39,3970.22
gfx950,256,256,9216,16384,False,torch.bfloat16,torch.bfloat16,False,False,torch,0,0,96.4623,native,0.0,801.45,3266.53
gfx950,256,512,9216,16384,False,torch.bfloat16,torch.bfloat16,False,False,torch,0,0,201.0914,native,0.0,768.9,1632.11
gfx950,256,1024,9216,16384,False,torch.bfloat16,torch.bfloat16,False,False,asm,10,1,286.2339,_ZN5aiter24bf16gemm_bf16_tn_256x256E,0.0,1080.37,1238.21
gfx950,256,2048,9216,16384,False,torch.bfloat16,torch.bfloat16,False,False,asm,10,1,597.7434,_ZN5aiter24bf16gemm_bf16_tn_256x256E,0.0,1034.68,680.64
gfx950,256,4096,9216,16384,False,torch.bfloat16,torch.bfloat16,False,False,asm,10,1,944.2369,_ZN5aiter24bf16gemm_bf16_tn_256x256E,0.0,1310.0,541.92
gfx950,256,8192,9216,16384,False,torch.bfloat16,torch.bfloat16,False,False,asm,10,1,1710.6163,_ZN5aiter24bf16gemm_bf16_tn_256x256E,0.0,1446.2,421.73
gfx950,256,16384,9216,16384,False,torch.bfloat16,torch.bfloat16,False,False,asm,10,1,3321.8968,_ZN5aiter24bf16gemm_bf16_tn_256x256E,0.0,1489.45,343.43
gfx950,256,32768,9216,16384,False,torch.bfloat16,torch.bfloat16,False,False,asm,10,1,6749.5084,_ZN5aiter24bf16gemm_bf16_tn_256x256E,0.0,1466.12,293.31
gfx950,256,1,10240,8192,False,torch.bfloat16,torch.bfloat16,False,False,torch,0,0,33.5535,native,0.0,5.0,5001.24
gfx950,256,16,10240,8192,False,torch.bfloat16,torch.bfloat16,False,False,torch,0,0,34.4974,native,0.0,77.81,4880.43
gfx950,256,32,10240,8192,False,torch.bfloat16,torch.bfloat16,False,False,triton,0,0,39.5825,auto,0.0,135.63,4268.35
gfx950,256,64,10240,8192,False,torch.bfloat16,torch.bfloat16,False,False,torch,0,0,38.9211,native,0.0,275.88,4371.19
gfx950,256,128,10240,8192,False,torch.bfloat16,torch.bfloat16,False,False,triton,0,0,69.083,auto,0.0,310.86,2496.86
gfx950,256,256,10240,8192,False,torch.bfloat16,torch.bfloat16,False,False,torch,0,0,64.46,native,0.0,666.3,2749.14
gfx950,256,512,10240,8192,False,torch.bfloat16,torch.bfloat16,False,False,flydsl,5567,1,112.7552,flydsl_gemm3_abf16_wbf16_bf16_t256x128x64_split_k1_block_m_warp2_block_n_warp4_block_k_warp1_async_copyTrue_b_to_ldsTrue_b_preshuffleFalse_c_to_ldsFalse_gfx950,0.0,761.82,1655.33
gfx950,256,1024,10240,8192,False,torch.bfloat16,torch.bfloat16,False,False,asm,10,1,156.5017,_ZN5aiter24bf16gemm_bf16_tn_256x256E,0.0,1097.74,1313.22
gfx950,256,2048,10240,8192,False,torch.bfloat16,torch.bfloat16,False,False,asm,10,1,314.5911,_ZN5aiter24bf16gemm_bf16_tn_256x256E,0.0,1092.2,773.29
gfx950,256,4096,10240,8192,False,torch.bfloat16,torch.bfloat16,False,False,asm,10,1,507.5975,_ZN5aiter24bf16gemm_bf16_tn_256x256E,0.0,1353.82,627.99
gfx950,256,8192,10240,8192,False,torch.bfloat16,torch.bfloat16,False,False,asm,10,1,973.6448,_ZN5aiter24bf16gemm_bf16_tn_256x256E,0.0,1411.59,482.48
gfx950,256,16384,10240,8192,False,torch.bfloat16,torch.bfloat16,False,False,asm,10,1,1927.7017,_ZN5aiter24bf16gemm_bf16_tn_256x256E,0.0,1425.94,400.35
gfx950,256,32768,10240,8192,False,torch.bfloat16,torch.bfloat16,False,False,asm,10,1,3846.6163,_ZN5aiter24bf16gemm_bf16_tn_256x256E,0.0,1429.19,357.65
gfx950,256,1,12800,5120,False,torch.bfloat16,torch.bfloat16,False,False,flydsl,11718,1,22.8228,flydsl_gemm5_abf16_wbf16_bf16_t16x64x64_split_k1_block_m_warp1_block_n_warp2_block_k_warp1_async_copyTrue_b_to_ldsTrue_b_preshuffleFalse_c_to_ldsFalse_gfx950,0.0,5.74,5744.6
gfx950,256,16,12800,5120,False,torch.bfloat16,torch.bfloat16,False,False,triton,0,0,27.453,auto,0.0,76.39,4795.3
gfx950,256,32,12800,5120,False,torch.bfloat16,torch.bfloat16,False,False,triton,0,0,29.9037,auto,0.0,140.26,4421.49
gfx950,256,64,12800,5120,False,torch.bfloat16,torch.bfloat16,False,False,asm,6,1,37.0414,_ZN5aiter37bf16gemm_fp32bf16_tn_64x64_pf3_splitkE,0.0,226.47,3600.45
gfx950,256,128,12800,5120,False,torch.bfloat16,torch.bfloat16,False,False,triton,0,0,51.7913,auto,0.0,323.94,2619.35
gfx950,256,256,12800,5120,False,torch.bfloat16,torch.bfloat16,False,False,flydsl,16678,1,59.4756,flydsl_gemm5_abf16_wbf16_bf16_t128x128x64_split_k1_block_m_warp4_block_n_warp2_block_k_warp1_async_copyTrue_b_to_ldsTrue_b_preshuffleFalse_c_to_ldsFalse_gfx950,0.0,564.17,2358.06
gfx950,256,512,12800,5120,False,torch.bfloat16,torch.bfloat16,False,False,asm,10,1,103.9297,_ZN5aiter24bf16gemm_bf16_tn_256x256E,0.0,645.71,1437.72
gfx950,256,1024,12800,5120,False,torch.bfloat16,torch.bfloat16,False,False,asm,10,1,115.6173,_ZN5aiter24bf16gemm_bf16_tn_256x256E,0.0,1160.88,1451.1
gfx950,256,2048,12800,5120,False,torch.bfloat16,torch.bfloat16,False,False,asm,10,1,218.7234,_ZN5aiter24bf16gemm_bf16_tn_256x256E,0.0,1227.28,934.84
gfx950,256,4096,12800,5120,False,torch.bfloat16,torch.bfloat16,False,False,asm,10,1,419.7581,_ZN5aiter24bf16gemm_bf16_tn_256x256E,0.0,1279.0,661.98
gfx950,256,8192,12800,5120,False,torch.bfloat16,torch.bfloat16,False,False,asm,10,1,757.9903,_ZN5aiter24bf16gemm_bf16_tn_256x256E,0.0,1416.56,560.26
gfx950,256,16384,12800,5120,False,torch.bfloat16,torch.bfloat16,False,False,asm,10,1,1489.2465,_ZN5aiter24bf16gemm_bf16_tn_256x256E,0.0,1441.99,482.31
gfx950,256,32768,12800,5120,False,torch.bfloat16,torch.bfloat16,False,False,asm,10,1,2902.235,_ZN5aiter24bf16gemm_bf16_tn_256x256E,0.0,1479.88,449.82
gfx950,256,1,13312,16384,False,torch.bfloat16,torch.bfloat16,False,False,flydsl,69,2,76.3036,flydsl_gemm2_abf16_wbf16_bf16_t16x128x256_split_k2_block_m_warp1_block_n_warp2_block_k_warp2_async_copyTrue_b_to_ldsTrue_b_preshuffleFalse_c_to_ldsFalse_gfx950,0.0157,5.72,5717.52
gfx950,256,16,13312,16384,False,torch.bfloat16,torch.bfloat16,False,False,triton,0,0,78.0998,auto,0.0,89.36,5597.43
gfx950,256,32,13312,16384,False,torch.bfloat16,torch.bfloat16,False,False,triton,0,0,81.5625,auto,0.0,171.14,5371.44
gfx950,256,64,13312,16384,False,torch.bfloat16,torch.bfloat16,False,False,torch,0,0,82.9359,native,0.0,336.61,5305.41
gfx950,256,128,13312,16384,False,torch.bfloat16,torch.bfloat16,False,False,torch,0,0,101.3723,native,0.0,550.79,4378.02
gfx950,256,256,13312,16384,False,torch.bfloat16,torch.bfloat16,False,False,torch,0,0,135.2778,native,0.0,825.48,3336.93
gfx950,256,512,13312,16384,False,torch.bfloat16,torch.bfloat16,False,False,asm,10,1,281.769,_ZN5aiter24bf16gemm_bf16_tn_256x256E,0.0,792.63,1656.02
gfx950,256,1024,13312,16384,False,torch.bfloat16,torch.bfloat16,False,False,asm,10,1,335.4867,_ZN5aiter24bf16gemm_bf16_tn_256x256E,0.0,1331.43,1481.5
gfx950,256,2048,13312,16384,False,torch.bfloat16,torch.bfloat16,False,False,asm,10,1,643.543,_ZN5aiter24bf16gemm_bf16_tn_256x256E,0.0,1388.18,866.83
gfx950,256,4096,13312,16384,False,torch.bfloat16,torch.bfloat16,False,False,asm,10,1,1298.0192,_ZN5aiter24bf16gemm_bf16_tn_256x256E,0.0,1376.49,523.47
gfx950,256,8192,13312,16384,False,torch.bfloat16,torch.bfloat16,False,False,asm,10,1,2452.1446,_ZN5aiter24bf16gemm_bf16_tn_256x256E,0.0,1457.26,376.3
gfx950,256,16384,13312,16384,False,torch.bfloat16,torch.bfloat16,False,False,asm,10,1,4823.026,_ZN5aiter24bf16gemm_bf16_tn_256x256E,0.0,1481.81,292.2
gfx950,256,32768,13312,16384,False,torch.bfloat16,torch.bfloat16,False,False,asm,10,1,9990.3785,_ZN5aiter24bf16gemm_bf16_tn_256x256E,0.0,1430.74,238.47
gfx950,256,1,14336,8192,False,torch.bfloat16,torch.bfloat16,False,False,torch,0,0,41.224,native,0.0,5.7,5698.77
gfx950,256,16,14336,8192,False,torch.bfloat16,torch.bfloat16,False,False,triton,0,0,41.3701,auto,0.0,90.84,5694.98
gfx950,256,32,14336,8192,False,torch.bfloat16,torch.bfloat16,False,False,triton,0,0,43.433,auto,0.0,173.05,5441.09
gfx950,256,64,14336,8192,False,torch.bfloat16,torch.bfloat16,False,False,asm,6,1,59.5058,_ZN5aiter37bf16gemm_fp32bf16_tn_64x64_pf3_splitkE,0.0,252.62,3995.65
gfx950,256,128,14336,8192,False,torch.bfloat16,torch.bfloat16,False,False,triton,0,0,77.6763,auto,0.0,387.05,3098.09
gfx950,256,256,14336,8192,False,torch.bfloat16,torch.bfloat16,False,False,flydsl,8349,1,84.4459,flydsl_gemm4_abf16_wbf16_bf16_t128x128x64_split_k1_block_m_warp2_block_n_warp2_block_k_warp2_async_copyTrue_b_to_ldsTrue_b_preshuffleFalse_c_to_ldsFalse_gfx950,0.0063,712.05,2918.03
gfx950,256,512,14336,8192,False,torch.bfloat16,torch.bfloat16,False,False,asm,10,1,147.9651,_ZN5aiter24bf16gemm_bf16_tn_256x256E,0.0,812.75,1743.31
gfx950,256,1024,14336,8192,False,torch.bfloat16,torch.bfloat16,False,False,asm,10,1,183.6583,_ZN5aiter24bf16gemm_bf16_tn_256x256E,0.0,1309.6,1530.12
gfx950,256,2048,14336,8192,False,torch.bfloat16,torch.bfloat16,False,False,asm,10,1,344.2741,_ZN5aiter24bf16gemm_bf16_tn_256x256E,0.0,1397.25,950.28
gfx950,256,4096,14336,8192,False,torch.bfloat16,torch.bfloat16,False,False,asm,10,1,672.6336,_ZN5aiter24bf16gemm_bf16_tn_256x256E,0.0,1430.31,623.56
gfx950,256,8192,14336,8192,False,torch.bfloat16,torch.bfloat16,False,False,asm,10,1,1250.6163,_ZN5aiter24bf16gemm_bf16_tn_256x256E,0.0,1538.56,482.95
gfx950,256,16384,14336,8192,False,torch.bfloat16,torch.bfloat16,False,False,asm,10,1,2489.7903,_ZN5aiter24bf16gemm_bf16_tn_256x256E,0.0,1545.63,390.83
gfx950,256,32768,14336,8192,False,torch.bfloat16,torch.bfloat16,False,False,asm,10,1,4995.7199,_ZN5aiter24bf16gemm_bf16_tn_256x256E,0.0,1540.64,342.55
gfx950,256,1,16160,7168,False,torch.bfloat16,torch.bfloat16,False,False,triton,0,0,36.5709,auto,0.0,6.33,6336.09
gfx950,256,2,16160,7168,False,torch.bfloat16,torch.bfloat16,False,False,triton,0,0,36.3116,auto,0.0,12.76,6382.62
gfx950,256,4,16160,7168,False,torch.bfloat16,torch.bfloat16,False,False,triton,0,0,36.368,auto,0.0,25.48,6375.29
gfx950,256,8,16160,7168,False,torch.bfloat16,torch.bfloat16,False,False,triton,0,0,36.3294,auto,0.0,51.02,6387.2
gfx950,256,16,16160,7168,False,torch.bfloat16,torch.bfloat16,False,False,triton,0,0,38.0303,auto,0.0,97.47,6111.34
gfx950,256,32,16160,7168,False,torch.bfloat16,torch.bfloat16,False,False,triton,0,0,41.8646,auto,0.0,177.08,5569.45
gfx950,256,48,16160,7168,False,torch.bfloat16,torch.bfloat16,False,False,torch,0,0,40.6258,native,0.0,273.72,5757.65
gfx950,256,64,16160,7168,False,torch.bfloat16,torch.bfloat16,False,False,torch,0,0,42.5903,native,0.0,348.13,5509.61
gfx950,256,80,16160,7168,False,torch.bfloat16,torch.bfloat16,False,False,torch,0,0,45.4957,native,0.0,407.37,5174.16
gfx950,256,96,16160,7168,False,torch.bfloat16,torch.bfloat16,False,False,torch,0,0,54.1354,native,0.0,410.83,4362.19
gfx950,256,112,16160,7168,False,torch.bfloat16,torch.bfloat16,False,False,torch,0,0,59.3633,native,0.0,437.09,3990.6
gfx950,256,128,16160,7168,False,torch.bfloat16,torch.bfloat16,False,False,torch,0,0,61.2209,native,0.0,484.37,3881.71
gfx950,256,256,16160,7168,False,torch.bfloat16,torch.bfloat16,False,False,torch,0,0,103.6958,native,0.0,571.94,2349.31
gfx950,256,1024,16160,7168,False,torch.bfloat16,torch.bfloat16,False,False,opus,5009,0,222.0124,opus_gemm_512x256x256x64_2x4_16x16x32_0x0x0_4g_safe,0.0,1068.54,1258.69
gfx950,256,1,16384,2048,False,torch.bfloat16,torch.bfloat16,False,False,flydsl,5695,2,13.8853,flydsl_gemm4_abf16_wbf16_bf16_t16x128x128_split_k2_block_m_warp1_block_n_warp4_block_k_warp1_async_copyTrue_b_to_ldsTrue_b_preshuffleFalse_c_to_ldsFalse_gfx950,0.0028,4.83,4835.74
gfx950,256,1,16384,4096,False,torch.bfloat16,torch.bfloat16,False,False,triton,0,0,25.1988,auto,0.0,5.33,5327.98
gfx950,256,1,16384,6656,False,torch.bfloat16,torch.bfloat16,False,False,flydsl,5958,1,37.0334,flydsl_gemm4_abf16_wbf16_bf16_t16x64x128_split_k1_block_m_warp1_block_n_warp2_block_k_warp1_async_copyTrue_b_to_ldsTrue_b_preshuffleFalse_c_to_ldsFalse_gfx950,0.0,5.89,5890.63
gfx950,256,1,16384,8192,False,torch.bfloat16,torch.bfloat16,False,False,triton,0,0,50.4794,auto,0.0,5.32,5318.7
gfx950,256,1,16384,13312,False,torch.bfloat16,torch.bfloat16,False,False,torch,0,0,67.5323,native,0.0,6.46,6460.12
gfx950,256,1,16384,26624,False,torch.bfloat16,torch.bfloat16,False,False,torch,0,0,137.4257,native,0.0,6.35,6348.89
gfx950,256,16,16384,2048,False,torch.bfloat16,torch.bfloat16,False,False,triton,0,0,14.4467,auto,0.0,74.32,4686.1
gfx950,256,16,16384,4096,False,torch.bfloat16,torch.bfloat16,False,False,triton,0,0,23.7443,auto,0.0,90.44,5680.23
gfx950,256,16,16384,6656,False,torch.bfloat16,torch.bfloat16,False,False,triton,0,0,37.3119,auto,0.0,93.53,5865.18
gfx950,256,16,16384,8192,False,torch.bfloat16,torch.bfloat16,False,False,triton,0,0,44.7779,auto,0.0,95.92,6012.38
gfx950,256,16,16384,13312,False,torch.bfloat16,torch.bfloat16,False,False,triton,0,0,70.9555,auto,0.0,98.36,6161.01
gfx950,256,16,16384,26624,False,torch.bfloat16,torch.bfloat16,False,False,torch,0,0,134.9243,native,0.0,103.46,6476.16
gfx950,256,32,16384,2048,False,torch.bfloat16,torch.bfloat16,False,False,triton,0,0,14.6697,auto,0.0,146.39,4655.07
gfx950,256,32,16384,4096,False,torch.bfloat16,torch.bfloat16,False,False,triton,0,0,24.9617,auto,0.0,172.06,5429.46
gfx950,256,32,16384,6656,False,torch.bfloat16,torch.bfloat16,False,False,triton,0,0,39.4472,auto,0.0,176.93,5566.39
gfx950,256,32,16384,8192,False,torch.bfloat16,torch.bfloat16,False,False,triton,0,0,47.1387,auto,0.0,182.23,5727.95
gfx950,256,32,16384,13312,False,torch.bfloat16,torch.bfloat16,False,False,triton,0,0,75.4473,auto,0.0,185.01,5806.81
gfx950,256,32,16384,26624,False,torch.bfloat16,torch.bfloat16,False,False,flydsl,7479,2,144.0969,flydsl_gemm4_abf16_wbf16_bf16_t32x128x128_split_k2_block_m_warp2_block_n_warp2_block_k_warp1_async_copyTrue_b_to_ldsTrue_b_preshuffleFalse_c_to_ldsFalse_gfx950,0.0085,193.74,6073.47
gfx950,256,64,16384,2048,False,torch.bfloat16,torch.bfloat16,False,False,asm,6,1,18.9896,_ZN5aiter37bf16gemm_fp32bf16_tn_64x64_pf3_splitkE,0.0,226.17,3658.22
gfx950,256,64,16384,4096,False,torch.bfloat16,torch.bfloat16,False,False,asm,6,1,33.4354,_ZN5aiter37bf16gemm_fp32bf16_tn_64x64_pf3_splitkE,0.0,256.91,4092.64
gfx950,256,64,16384,6656,False,torch.bfloat16,torch.bfloat16,False,False,asm,6,1,50.5166,_ZN5aiter37bf16gemm_fp32bf16_tn_64x64_pf3_splitkE,0.0,276.32,4375.85
gfx950,256,64,16384,8192,False,torch.bfloat16,torch.bfloat16,False,False,asm,6,1,66.9741,_ZN5aiter37bf16gemm_fp32bf16_tn_64x64_pf3_splitkE,0.0,256.52,4055.02
gfx950,256,64,16384,13312,False,torch.bfloat16,torch.bfloat16,False,False,asm,6,1,94.2083,_ZN5aiter37bf16gemm_fp32bf16_tn_64x64_pf3_splitkE,0.0,296.34,4670.59
gfx950,256,64,16384,26624,False,torch.bfloat16,torch.bfloat16,False,False,torch,0,0,154.8352,native,0.0,360.61,5670.03
gfx950,256,128,16384,2048,False,torch.bfloat16,torch.bfloat16,False,False,triton,0,0,23.3261,auto,0.0,368.25,3079.27
gfx950,256,128,16384,4096,False,torch.bfloat16,torch.bfloat16,False,False,triton,0,0,42.8585,auto,0.0,400.85,3253.98
gfx950,256,128,16384,6656,False,torch.bfloat16,torch.bfloat16,False,False,triton,0,0,69.0302,auto,0.0,404.42,3244.99
gfx950,256,128,16384,8192,False,torch.bfloat16,torch.bfloat16,False,False,triton,0,0,81.6344,auto,0.0,420.9,3365.33
gfx950,256,128,16384,13312,False,torch.bfloat16,torch.bfloat16,False,False,torch,0,0,97.575,native,0.0,572.22,4548.4
gfx950,256,128,16384,26624,False,torch.bfloat16,torch.bfloat16,False,False,torch,0,0,177.6589,native,0.0,628.56,4972.59
gfx950,256,256,16384,2048,False,torch.bfloat16,torch.bfloat16,False,False,flydsl,11479,1,24.7727,flydsl_gemm5_abf16_wbf16_bf16_t128x128x64_split_k1_block_m_warp2_block_n_warp4_block_k_warp1_async_copyTrue_b_to_ldsTrue_b_preshuffleFalse_c_to_ldsFalse_gfx950,0.0,693.5,3089.94
gfx950,256,256,16384,4096,False,torch.bfloat16,torch.bfloat16,False,False,flydsl,8351,1,48.6407,flydsl_gemm4_abf16_wbf16_bf16_t128x128x64_split_k1_block_m_warp2_block_n_warp4_block_k_warp1_async_copyTrue_b_to_ldsTrue_b_preshuffleFalse_c_to_ldsFalse_gfx950,0.0,706.4,2974.95
gfx950,256,256,16384,6656,False,torch.bfloat16,torch.bfloat16,False,False,flydsl,8815,1,73.9126,flydsl_gemm4_abf16_wbf16_bf16_t128x128x64_split_k1_block_m_warp4_block_n_warp2_block_k_warp1_async_copyTrue_b_to_ldsTrue_b_preshuffleFalse_c_to_ldsFalse_gfx950,0.0,755.41,3110.43
gfx950,256,256,16384,8192,False,torch.bfloat16,torch.bfloat16,False,False,flydsl,8339,1,89.3741,flydsl_gemm4_abf16_wbf16_bf16_t128x128x64_split_k1_block_m_warp1_block_n_warp4_block_k_warp2_async_copyTrue_b_to_ldsTrue_b_preshuffleFalse_c_to_ldsFalse_gfx950,0.0063,768.9,3144.29
gfx950,256,256,16384,13312,False,torch.bfloat16,torch.bfloat16,False,False,torch,0,0,163.4286,native,0.0,683.29,2762.14
gfx950,256,256,16384,26624,False,torch.bfloat16,torch.bfloat16,False,False,torch,0,0,234.2718,native,0.0,953.33,3817.94
gfx950,256,512,16384,2048,False,torch.bfloat16,torch.bfloat16,False,False,asm,10,1,47.2723,_ZN5aiter24bf16gemm_bf16_tn_256x256E,0.0,726.85,1818.89
gfx950,256,512,16384,4096,False,torch.bfloat16,torch.bfloat16,False,False,asm,10,1,83.3091,_ZN5aiter24bf16gemm_bf16_tn_256x256E,0.0,824.87,1862.81
gfx950,256,512,16384,6656,False,torch.bfloat16,torch.bfloat16,False,False,asm,10,1,127.3264,_ZN5aiter24bf16gemm_bf16_tn_256x256E,0.0,877.03,1898.25
gfx950,256,512,16384,8192,False,torch.bfloat16,torch.bfloat16,False,False,asm,10,1,155.7206,_ZN5aiter24bf16gemm_bf16_tn_256x256E,0.0,882.6,1885.44
gfx950,256,512,16384,13312,False,torch.bfloat16,torch.bfloat16,False,False,asm,10,1,235.6216,_ZN5aiter24bf16gemm_bf16_tn_256x256E,0.0,947.87,1980.36
gfx950,256,512,16384,26624,False,torch.bfloat16,torch.bfloat16,False,False,asm,10,1,459.4132,_ZN5aiter24bf16gemm_bf16_tn_256x256E,0.0,972.28,1994.84
gfx950,256,1024,16384,2048,False,torch.bfloat16,torch.bfloat16,False,False,asm,10,1,60.4762,_ZN5aiter24bf16gemm_bf16_tn_256x256E,0.0,1136.31,1733.87
gfx950,256,1024,16384,4096,False,torch.bfloat16,torch.bfloat16,False,False,asm,10,1,107.397,_ZN5aiter24bf16gemm_bf16_tn_256x256E,0.0,1279.73,1640.28
gfx950,256,1024,16384,6656,False,torch.bfloat16,torch.bfloat16,False,False,asm,10,1,164.2949,_ZN5aiter24bf16gemm_bf16_tn_256x256E,0.0,1359.37,1614.72
gfx950,256,1024,16384,8192,False,torch.bfloat16,torch.bfloat16,False,False,asm,10,1,197.3416,_ZN5aiter24bf16gemm_bf16_tn_256x256E,0.0,1392.9,1615.31
gfx950,256,1024,16384,13312,False,torch.bfloat16,torch.bfloat16,False,False,asm,10,1,312.555,_ZN5aiter24bf16gemm_bf16_tn_256x256E,0.0,1429.11,1590.2
gfx950,256,1024,16384,26624,False,torch.bfloat16,torch.bfloat16,False,False,asm,10,1,596.8639,_ZN5aiter24bf16gemm_bf16_tn_256x256E,0.0,1496.75,1609.24
gfx950,256,2048,16384,2048,False,torch.bfloat16,torch.bfloat16,False,False,asm,10,1,115.295,_ZN5aiter24bf16gemm_bf16_tn_256x256E,0.0,1192.06,1236.88
gfx950,256,2048,16384,4096,False,torch.bfloat16,torch.bfloat16,False,False,asm,10,1,201.0475,_ZN5aiter24bf16gemm_bf16_tn_256x256E,0.0,1367.23,1084.84
gfx950,256,2048,16384,6656,False,torch.bfloat16,torch.bfloat16,False,False,asm,10,1,312.2677,_ZN5aiter24bf16gemm_bf16_tn_256x256E,0.0,1430.43,1000.67
gfx950,256,2048,16384,8192,False,torch.bfloat16,torch.bfloat16,False,False,asm,10,1,370.4202,_ZN5aiter24bf16gemm_bf16_tn_256x256E,0.0,1484.14,996.43
gfx950,256,2048,16384,13312,False,torch.bfloat16,torch.bfloat16,False,False,asm,10,1,588.2507,_ZN5aiter24bf16gemm_bf16_tn_256x256E,0.0,1518.66,948.31
gfx950,256,2048,16384,26624,False,torch.bfloat16,torch.bfloat16,False,False,asm,10,1,1158.5257,_ZN5aiter24bf16gemm_bf16_tn_256x256E,0.0,1542.22,905.1
gfx950,256,4096,16384,2048,False,torch.bfloat16,torch.bfloat16,False,False,asm,10,1,209.7933,_ZN5aiter24bf16gemm_bf16_tn_256x256E,0.0,1310.23,1039.61
gfx950,256,4096,16384,4096,False,torch.bfloat16,torch.bfloat16,False,False,asm,10,1,384.44,_ZN5aiter24bf16gemm_bf16_tn_256x256E,0.0,1430.02,785.53
gfx950,256,4096,16384,6656,False,torch.bfloat16,torch.bfloat16,False,False,asm,10,1,594.3976,_ZN5aiter24bf16gemm_bf16_tn_256x256E,0.0,1502.96,684.47
gfx950,256,4096,16384,8192,False,torch.bfloat16,torch.bfloat16,False,False,asm,10,1,715.0195,_ZN5aiter24bf16gemm_bf16_tn_256x256E,0.0,1537.74,656.99
gfx950,256,4096,16384,13312,False,torch.bfloat16,torch.bfloat16,False,False,asm,10,1,1180.0684,_ZN5aiter24bf16gemm_bf16_tn_256x256E,0.0,1514.07,575.79
gfx950,256,4096,16384,26624,False,torch.bfloat16,torch.bfloat16,False,False,asm,10,1,2315.9959,_ZN5aiter24bf16gemm_bf16_tn_256x256E,0.0,1542.93,528.82
gfx950,256,8192,16384,2048,False,torch.bfloat16,torch.bfloat16,False,False,asm,10,1,402.4127,_ZN5aiter24bf16gemm_bf16_tn_256x256E,0.0,1366.15,917.21
gfx950,256,8192,16384,4096,False,torch.bfloat16,torch.bfloat16,False,False,asm,10,1,735.8522,_ZN5aiter24bf16gemm_bf16_tn_256x256E,0.0,1494.2,638.39
gfx950,256,8192,16384,6656,False,torch.bfloat16,torch.bfloat16,False,False,asm,10,1,1172.104,_ZN5aiter24bf16gemm_bf16_tn_256x256E,0.0,1524.36,508.14
gfx950,256,8192,16384,8192,False,torch.bfloat16,torch.bfloat16,False,False,asm,10,1,1418.3458,_ZN5aiter24bf16gemm_bf16_tn_256x256E,0.0,1550.41,473.15
gfx950,256,8192,16384,13312,False,torch.bfloat16,torch.bfloat16,False,False,asm,10,1,2350.1553,_ZN5aiter24bf16gemm_bf16_tn_256x256E,0.0,1520.5,392.63
gfx950,256,8192,16384,26624,False,torch.bfloat16,torch.bfloat16,False,False,asm,10,1,4679.1879,_ZN5aiter24bf16gemm_bf16_tn_256x256E,0.0,1527.36,337.04
gfx950,256,16384,16384,2048,False,torch.bfloat16,torch.bfloat16,False,False,asm,10,1,791.7086,_ZN5aiter24bf16gemm_bf16_tn_256x256E,0.0,1388.78,847.65
gfx950,256,16384,16384,4096,False,torch.bfloat16,torch.bfloat16,False,False,asm,10,1,1468.7844,_ZN5aiter24bf16gemm_bf16_tn_256x256E,0.0,1497.17,548.28
gfx950,256,16384,16384,6656,False,torch.bfloat16,torch.bfloat16,False,False,asm,10,1,2338.6747,_ZN5aiter24bf16gemm_bf16_tn_256x256E,0.0,1527.96,416.08
gfx950,256,16384,16384,8192,False,torch.bfloat16,torch.bfloat16,False,False,asm,10,1,2840.907,_ZN5aiter24bf16gemm_bf16_tn_256x256E,0.0,1548.11,377.96
gfx950,256,16384,16384,13312,False,torch.bfloat16,torch.bfloat16,False,False,asm,10,1,4751.9617,_ZN5aiter24bf16gemm_bf16_tn_256x256E,0.0,1503.97,296.57
gfx950,256,16384,16384,26624,False,torch.bfloat16,torch.bfloat16,False,False,asm,10,1,9811.8509,_ZN5aiter24bf16gemm_bf16_tn_256x256E,0.0,1456.77,232.55
gfx950,256,32768,16384,2048,False,torch.bfloat16,torch.bfloat16,False,False,asm,10,1,1567.4338,_ZN5aiter24bf16gemm_bf16_tn_256x256E,0.0,1402.94,813.48
gfx950,256,32768,16384,4096,False,torch.bfloat16,torch.bfloat16,False,False,asm,10,1,2904.4945,_ZN5aiter24bf16gemm_bf16_tn_256x256E,0.0,1514.22,508.31
gfx950,256,32768,16384,6656,False,torch.bfloat16,torch.bfloat16,False,False,asm,10,1,4677.1636,_ZN5aiter24bf16gemm_bf16_tn_256x256E,0.0,1528.03,369.47
gfx950,256,32768,16384,8192,False,torch.bfloat16,torch.bfloat16,False,False,asm,10,1,5762.8133,_ZN5aiter24bf16gemm_bf16_tn_256x256E,0.0,1526.35,326.06
gfx950,256,32768,16384,13312,False,torch.bfloat16,torch.bfloat16,False,False,asm,10,1,9939.0603,_ZN5aiter24bf16gemm_bf16_tn_256x256E,0.0,1438.13,239.7
