aiter/configs/mxscale_preshuffle_tuned_gemm.csv
gfx,cu_num,M,N,K,a_dtype,b_dtype,libtype,kernelId,splitK,us,kernelName,tflops,bw,errRatio
gfx950,256,1,768,7168,fp8,fp8,flydsl,2202,4,12.1088,flydsl_mxpsh_32x128x256_F8_F8_B16_w0_x0_sk4,0.91,455.35,0.0
gfx950,256,2,768,7168,fp8,fp8,flydsl,2234,4,12.6585,flydsl_mxpsh_32x128x256_F8_F8_B16_w4_x0_sk4,1.74,436.26,0.0
gfx950,256,4,768,7168,fp8,fp8,flydsl,2226,4,12.9085,flydsl_mxpsh_32x128x256_F8_F8_B16_w3_x0_sk4,3.41,429.16,0.0
gfx950,256,8,768,7168,fp8,fp8,flydsl,2210,4,13.0069,flydsl_mxpsh_32x128x256_F8_F8_B16_w1_x0_sk4,6.77,428.59,0.0
gfx950,256,16,768,7168,fp8,fp8,flydsl,2234,4,12.8205,flydsl_mxpsh_32x128x256_F8_F8_B16_w4_x0_sk4,13.74,440.25,0.0
gfx950,256,32,768,7168,fp8,fp8,flydsl,2230,4,13.3017,flydsl_mxpsh_32x128x256_F8_F8_B16_w3_x4_sk4,26.49,434.8,0.0
gfx950,256,48,768,7168,fp8,fp8,flydsl,2222,4,12.7896,flydsl_mxpsh_32x128x256_F8_F8_B16_w2_x4_sk4,41.32,463.1,0.0
gfx950,256,64,768,7168,fp8,fp8,flydsl,2238,4,12.8325,flydsl_mxpsh_32x128x256_F8_F8_B16_w4_x4_sk4,54.91,472.4,0.0
gfx950,256,80,768,7168,fp8,fp8,flydsl,2234,4,12.5933,flydsl_mxpsh_32x128x256_F8_F8_B16_w4_x0_sk4,69.94,492.43,0.0
gfx950,256,96,768,7168,fp8,fp8,flydsl,2234,4,12.7377,flydsl_mxpsh_32x128x256_F8_F8_B16_w4_x0_sk4,82.98,497.78,0.0
gfx950,256,112,768,7168,fp8,fp8,flydsl,2226,4,12.7707,flydsl_mxpsh_32x128x256_F8_F8_B16_w3_x0_sk4,96.56,507.4,0.0
gfx950,256,128,768,7168,fp8,fp8,flydsl,2234,4,12.8389,flydsl_mxpsh_32x128x256_F8_F8_B16_w4_x0_sk4,109.77,515.55,0.0
gfx950,256,144,768,7168,fp8,fp8,flydsl,2238,4,13.0737,flydsl_mxpsh_32x128x256_F8_F8_B16_w4_x4_sk4,121.27,516.95,0.0
gfx950,256,160,768,7168,fp8,fp8,flydsl,2210,4,13.2688,flydsl_mxpsh_32x128x256_F8_F8_B16_w1_x0_sk4,132.76,519.84,0.0
gfx950,256,176,768,7168,fp8,fp8,flydsl,2234,4,13.3351,flydsl_mxpsh_32x128x256_F8_F8_B16_w4_x0_sk4,145.31,527.7,0.0
gfx950,256,192,768,7168,fp8,fp8,flydsl,2238,4,13.346,flydsl_mxpsh_32x128x256_F8_F8_B16_w4_x4_sk4,158.39,537.7,0.0
gfx950,256,208,768,7168,fp8,fp8,flydsl,2238,4,13.5185,flydsl_mxpsh_32x128x256_F8_F8_B16_w4_x4_sk4,169.4,541.14,0.0
gfx950,256,224,768,7168,fp8,fp8,flydsl,2214,4,13.9435,flydsl_mxpsh_32x128x256_F8_F8_B16_w1_x4_sk4,176.87,534.64,0.0
gfx950,256,240,768,7168,fp8,fp8,flydsl,2222,4,13.8342,flydsl_mxpsh_32x128x256_F8_F8_B16_w2_x4_sk4,191.01,548.93,0.0
gfx950,256,256,768,7168,fp8,fp8,flydsl,2238,4,13.5945,flydsl_mxpsh_32x128x256_F8_F8_B16_w4_x4_sk4,207.33,568.85,0.0
gfx950,256,288,768,7168,fp8,fp8,flydsl,2230,4,14.2114,flydsl_mxpsh_32x128x256_F8_F8_B16_w3_x4_sk4,223.12,563.76,0.0
gfx950,256,320,768,7168,fp8,fp8,flydsl,2222,4,14.3889,flydsl_mxpsh_32x128x256_F8_F8_B16_w2_x4_sk4,244.86,576.16,0.0
gfx950,256,352,768,7168,fp8,fp8,flydsl,2466,4,14.9409,flydsl_mxpsh_64x128x256_F8_F8_B16_w3_x0_sk4,259.39,573.52,0.0
gfx950,256,384,768,7168,fp8,fp8,flydsl,2238,4,14.8836,flydsl_mxpsh_32x128x256_F8_F8_B16_w4_x4_sk4,284.06,594.44,0.0
gfx950,256,416,768,7168,fp8,fp8,flydsl,2470,4,15.2642,flydsl_mxpsh_64x128x256_F8_F8_B16_w3_x4_sk4,300.06,597.86,0.0
gfx950,256,448,768,7168,fp8,fp8,flydsl,2446,4,15.599,flydsl_mxpsh_64x128x256_F8_F8_B16_w0_x4_sk4,316.21,602.89,0.0
gfx950,256,480,768,7168,fp8,fp8,flydsl,2454,4,15.5548,flydsl_mxpsh_64x128x256_F8_F8_B16_w1_x4_sk4,339.76,622.51,0.0
gfx950,256,512,768,7168,fp8,fp8,flydsl,2462,4,15.3498,flydsl_mxpsh_64x128x256_F8_F8_B16_w2_x4_sk4,367.25,648.96,0.0
gfx950,256,544,768,7168,fp8,fp8,flydsl,2462,4,16.2715,flydsl_mxpsh_64x128x256_F8_F8_B16_w2_x4_sk4,368.1,629.32,0.0
gfx950,256,576,768,7168,fp8,fp8,flydsl,2470,4,16.2908,flydsl_mxpsh_64x128x256_F8_F8_B16_w3_x4_sk4,389.29,645.67,0.0
gfx950,256,608,768,7168,fp8,fp8,flydsl,2702,4,16.5022,flydsl_mxpsh_96x128x256_F8_F8_B16_w2_x4_sk4,405.65,654.28,0.0
gfx950,256,640,768,7168,fp8,fp8,flydsl,2230,4,16.172,flydsl_mxpsh_32x128x256_F8_F8_B16_w3_x4_sk4,435.72,684.86,0.0
gfx950,256,672,768,7168,fp8,fp8,flydsl,2702,4,17.0044,flydsl_mxpsh_96x128x256_F8_F8_B16_w2_x4_sk4,435.11,667.72,0.0
gfx950,256,704,768,7168,fp8,fp8,flydsl,2702,4,16.9289,flydsl_mxpsh_96x128x256_F8_F8_B16_w2_x4_sk4,457.86,687.15,0.0
gfx950,256,736,768,7168,fp8,fp8,flydsl,2718,4,17.1146,flydsl_mxpsh_96x128x256_F8_F8_B16_w4_x4_sk4,473.48,695.97,0.0
gfx950,256,768,768,7168,fp8,fp8,flydsl,2694,4,17.5957,flydsl_mxpsh_96x128x256_F8_F8_B16_w1_x4_sk4,480.56,692.77,0.0
gfx950,256,800,768,7168,fp8,fp8,flydsl,2718,4,18.0007,flydsl_mxpsh_96x128x256_F8_F8_B16_w4_x4_sk4,489.32,692.65,0.0
gfx950,256,832,768,7168,fp8,fp8,flydsl,2686,4,18.7502,flydsl_mxpsh_96x128x256_F8_F8_B16_w0_x4_sk4,488.55,679.82,0.0
gfx950,256,864,768,7168,fp8,fp8,flydsl,2694,4,18.801,flydsl_mxpsh_96x128x256_F8_F8_B16_w1_x4_sk4,505.97,692.8,0.0
gfx950,256,896,768,7168,fp8,fp8,flydsl,2694,4,18.8456,flydsl_mxpsh_96x128x256_F8_F8_B16_w1_x4_sk4,523.46,705.94,0.0
gfx950,256,928,768,7168,fp8,fp8,flydsl,2958,4,18.7125,flydsl_mxpsh_128x128x256_F8_F8_B16_w4_x4_sk4,546.02,725.84,0.0
gfx950,256,960,768,7168,fp8,fp8,flydsl,2958,4,19.0345,flydsl_mxpsh_128x128x256_F8_F8_B16_w4_x4_sk4,555.29,728.2,0.0
gfx950,256,992,768,7168,fp8,fp8,flydsl,2954,4,19.3803,flydsl_mxpsh_128x128x256_F8_F8_B16_w4_x0_sk4,563.56,729.58,0.0
gfx950,256,1024,768,7168,fp8,fp8,flydsl,2922,4,19.3893,flydsl_mxpsh_128x128x256_F8_F8_B16_w0_x0_sk4,581.47,743.6,0.0
gfx950,256,1088,768,7168,fp8,fp8,flydsl,2934,4,20.7278,flydsl_mxpsh_128x128x256_F8_F8_B16_w1_x4_sk4,577.92,722.46,0.0
gfx950,256,1152,768,7168,fp8,fp8,flydsl,2958,4,21.1032,flydsl_mxpsh_128x128x256_F8_F8_B16_w4_x4_sk4,601.03,736.0,0.0
gfx950,256,1216,768,7168,fp8,fp8,flydsl,2954,4,21.641,flydsl_mxpsh_128x128x256_F8_F8_B16_w4_x0_sk4,618.65,743.45,0.0
gfx950,256,1280,768,7168,fp8,fp8,flydsl,2458,4,21.0559,flydsl_mxpsh_64x128x256_F8_F8_B16_w2_x0_sk4,669.31,790.57,0.0
gfx950,256,1344,768,7168,fp8,fp8,flydsl,2522,4,23.474,flydsl_mxpsh_64x256x256_F8_F8_B16_w0_x0_sk4,630.38,732.86,0.0
gfx950,256,1408,768,7168,fp8,fp8,flydsl,2466,4,24.8332,flydsl_mxpsh_64x128x256_F8_F8_B16_w3_x0_sk4,624.25,715.18,0.0
gfx950,256,1472,768,7168,fp8,fp8,flydsl,2690,4,23.5729,flydsl_mxpsh_96x128x256_F8_F8_B16_w1_x0_sk4,687.52,777.05,0.0
gfx950,256,1536,768,7168,fp8,fp8,flydsl,2714,4,24.1554,flydsl_mxpsh_96x128x256_F8_F8_B16_w4_x0_sk4,700.11,781.37,0.0
gfx950,256,1600,768,7168,fp8,fp8,flydsl,2678,4,25.8816,flydsl_mxpsh_96x128x128_F8_F8_B16_w4_x4_sk4,680.64,750.78,0.0
gfx950,256,1664,768,7168,fp8,fp8,flydsl,2662,4,25.1131,flydsl_mxpsh_96x128x128_F8_F8_B16_w2_x4_sk4,729.53,795.94,0.0
gfx950,256,1728,768,7168,fp8,fp8,flydsl,2662,4,25.4869,flydsl_mxpsh_96x128x128_F8_F8_B16_w2_x4_sk4,746.48,806.12,0.0
gfx950,256,1792,768,7168,fp8,fp8,flydsl,2662,4,25.4554,flydsl_mxpsh_96x128x128_F8_F8_B16_w2_x4_sk4,775.08,829.0,0.0
gfx950,256,1856,768,7168,fp8,fp8,flydsl,2714,4,25.2029,flydsl_mxpsh_96x128x256_F8_F8_B16_w4_x0_sk4,810.81,859.41,0.0
gfx950,256,1920,768,7168,fp8,fp8,flydsl,2698,4,25.7155,flydsl_mxpsh_96x128x256_F8_F8_B16_w2_x0_sk4,822.04,863.94,0.0
gfx950,256,1984,768,7168,fp8,fp8,flydsl,2954,4,26.6401,flydsl_mxpsh_128x128x256_F8_F8_B16_w4_x0_sk4,819.96,854.87,0.0
gfx950,256,2048,768,7168,fp8,fp8,flydsl,2954,4,26.8667,flydsl_mxpsh_128x128x256_F8_F8_B16_w4_x0_sk4,839.28,868.39,0.0
gfx950,256,4096,768,7168,fp8,fp8,flydsl,2925,2,39.7546,flydsl_mxpsh_128x128x256_F8_F8_B16_w0_x4_sk2,1134.39,1035.27,0.0
gfx950,256,6144,768,7168,fp8,fp8,flydsl,2684,1,52.8139,flydsl_mxpsh_96x128x256_F8_F8_B16_w0_x4_sk1,1280.83,1116.8,0.0
gfx950,256,8192,768,7168,fp8,fp8,flydsl,2936,1,60.1107,flydsl_mxpsh_128x128x256_F8_F8_B16_w2_x0_sk1,1500.47,1277.78,0.0
gfx950,256,10240,768,7168,fp8,fp8,flydsl,2920,1,65.9173,flydsl_mxpsh_128x128x256_F8_F8_B16_w0_x0_sk1,1710.37,1435.65,0.0
gfx950,256,12288,768,7168,fp8,fp8,flydsl,2640,1,85.9611,flydsl_mxpsh_96x128x128_F8_F8_B16_w0_x0_sk1,1573.87,1308.26,0.0
gfx950,256,14336,768,7168,fp8,fp8,flydsl,2880,1,95.2092,flydsl_mxpsh_128x128x128_F8_F8_B16_w0_x0_sk1,1657.82,1368.41,0.0
gfx950,256,16384,768,7168,fp8,fp8,flydsl,2908,1,102.0079,flydsl_mxpsh_128x128x128_F8_F8_B16_w3_x4_sk1,1768.38,1451.96,0.0
gfx950,256,32768,768,7168,fp8,fp8,flydsl,2980,1,193.3425,flydsl_mxpsh_128x256x128_F8_F8_B16_w2_x4_sk1,1866.0,1503.64,0.0
gfx950,256,1,2048,7168,fp8,fp8,flydsl,2234,4,12.0595,flydsl_mxpsh_32x128x256_F8_F8_B16_w4_x0_sk4,2.43,1218.24,0.0
gfx950,256,2,2048,7168,fp8,fp8,flydsl,2210,4,12.7166,flydsl_mxpsh_32x128x256_F8_F8_B16_w1_x0_sk4,4.62,1156.17,0.0
gfx950,256,4,2048,7168,fp8,fp8,flydsl,2222,4,12.8899,flydsl_mxpsh_32x128x256_F8_F8_B16_w2_x4_sk4,9.11,1142.38,0.0
gfx950,256,8,2048,7168,fp8,fp8,flydsl,2234,4,12.5239,flydsl_mxpsh_32x128x256_F8_F8_B16_w4_x0_sk4,18.75,1179.36,0.0
gfx950,256,16,2048,7168,fp8,fp8,flydsl,2206,4,12.7903,flydsl_mxpsh_32x128x256_F8_F8_B16_w0_x4_sk4,36.73,1161.84,0.0
gfx950,256,32,2048,7168,fp8,fp8,flydsl,2202,4,12.9034,flydsl_mxpsh_32x128x256_F8_F8_B16_w0_x0_sk4,72.81,1165.62,0.0
gfx950,256,48,2048,7168,fp8,fp8,flydsl,2234,4,13.3715,flydsl_mxpsh_32x128x256_F8_F8_B16_w4_x0_sk4,105.39,1138.3,0.0
gfx950,256,64,2048,7168,fp8,fp8,flydsl,2214,4,12.9519,flydsl_mxpsh_32x128x256_F8_F8_B16_w1_x4_sk4,145.08,1189.09,0.0
gfx950,256,80,2048,7168,fp8,fp8,flydsl,2206,4,13.7147,flydsl_mxpsh_32x128x256_F8_F8_B16_w0_x4_sk4,171.26,1136.09,0.0
gfx950,256,96,2048,7168,fp8,fp8,flydsl,2238,4,13.3581,flydsl_mxpsh_32x128x256_F8_F8_B16_w4_x4_sk4,211.0,1179.91,0.0
gfx950,256,112,2048,7168,fp8,fp8,flydsl,2230,4,13.3514,flydsl_mxpsh_32x128x256_F8_F8_B16_w3_x4_sk4,246.29,1194.0,0.0
gfx950,256,128,2048,7168,fp8,fp8,flydsl,2222,4,14.0048,flydsl_mxpsh_32x128x256_F8_F8_B16_w2_x4_sk4,268.34,1151.17,0.0
gfx950,256,144,2048,7168,fp8,fp8,flydsl,2454,4,14.368,flydsl_mxpsh_64x128x256_F8_F8_B16_w1_x4_sk4,294.26,1134.61,0.0
gfx950,256,160,2048,7168,fp8,fp8,flydsl,2462,4,14.9344,flydsl_mxpsh_64x128x256_F8_F8_B16_w2_x4_sk4,314.55,1103.65,0.0
gfx950,256,176,2048,7168,fp8,fp8,flydsl,2462,4,15.3698,flydsl_mxpsh_64x128x256_F8_F8_B16_w2_x4_sk4,336.2,1084.11,0.0
gfx950,256,192,2048,7168,fp8,fp8,flydsl,2446,4,15.2953,flydsl_mxpsh_64x128x256_F8_F8_B16_w0_x4_sk4,368.55,1101.17,0.0
gfx950,256,208,2048,7168,fp8,fp8,flydsl,2454,4,15.2014,flydsl_mxpsh_64x128x256_F8_F8_B16_w1_x4_sk4,401.73,1119.83,0.0
gfx950,256,224,2048,7168,fp8,fp8,flydsl,2470,4,15.1242,flydsl_mxpsh_64x128x256_F8_F8_B16_w3_x4_sk4,434.84,1137.46,0.0
gfx950,256,240,2048,7168,fp8,fp8,flydsl,2454,4,16.4245,flydsl_mxpsh_64x128x256_F8_F8_B16_w1_x4_sk4,429.02,1058.38,0.0
gfx950,256,256,2048,7168,fp8,fp8,flydsl,2470,4,16.1777,flydsl_mxpsh_64x128x256_F8_F8_B16_w3_x4_sk4,464.6,1085.67,0.0
gfx950,256,288,2048,7168,fp8,fp8,flydsl,2718,4,17.0397,flydsl_mxpsh_96x128x256_F8_F8_B16_w4_x4_sk4,496.24,1051.9,0.0
gfx950,256,320,2048,7168,fp8,fp8,flydsl,2702,4,16.7738,flydsl_mxpsh_96x128x256_F8_F8_B16_w2_x4_sk4,560.11,1090.07,0.0
gfx950,256,352,2048,7168,fp8,fp8,flydsl,2718,4,17.5609,flydsl_mxpsh_96x128x256_F8_F8_B16_w4_x4_sk4,588.51,1061.73,0.0
gfx950,256,384,2048,7168,fp8,fp8,flydsl,2694,4,18.0386,flydsl_mxpsh_96x128x256_F8_F8_B16_w1_x4_sk4,625.01,1053.6,0.0
gfx950,256,416,2048,7168,fp8,fp8,flydsl,2942,4,19.465,flydsl_mxpsh_128x128x256_F8_F8_B16_w2_x4_sk4,627.48,994.91,0.0
gfx950,256,448,2048,7168,fp8,fp8,flydsl,2958,4,19.4595,flydsl_mxpsh_128x128x256_F8_F8_B16_w4_x4_sk4,675.93,1013.71,0.0
gfx950,256,480,2048,7168,fp8,fp8,flydsl,2950,4,20.2405,flydsl_mxpsh_128x128x256_F8_F8_B16_w3_x4_sk4,696.27,992.41,0.0
gfx950,256,512,2048,7168,fp8,fp8,flydsl,2950,4,20.3694,flydsl_mxpsh_128x128x256_F8_F8_B16_w3_x4_sk4,737.99,1003.82,0.0
gfx950,256,544,2048,7168,fp8,fp8,flydsl,2694,4,24.4675,flydsl_mxpsh_96x128x256_F8_F8_B16_w1_x4_sk4,652.78,850.42,0.0
gfx950,256,576,2048,7168,fp8,fp8,flydsl,2694,4,24.3723,flydsl_mxpsh_96x128x256_F8_F8_B16_w1_x4_sk4,693.88,868.53,0.0
gfx950,256,608,2048,7168,fp8,fp8,flydsl,2686,4,24.6814,flydsl_mxpsh_96x128x256_F8_F8_B16_w0_x4_sk4,723.26,872.26,0.0
gfx950,256,640,2048,7168,fp8,fp8,flydsl,2702,4,25.1318,flydsl_mxpsh_96x128x256_F8_F8_B16_w2_x4_sk4,747.68,870.97,0.0
gfx950,256,672,2048,7168,fp8,fp8,flydsl,2702,4,26.1514,flydsl_mxpsh_96x128x256_F8_F8_B16_w2_x4_sk4,754.45,850.79,0.0
gfx950,256,704,2048,7168,fp8,fp8,flydsl,2694,4,24.4742,flydsl_mxpsh_96x128x256_F8_F8_B16_w1_x4_sk4,844.54,923.83,0.0
gfx950,256,736,2048,7168,fp8,fp8,flydsl,2702,4,25.8153,flydsl_mxpsh_96x128x256_F8_F8_B16_w2_x4_sk4,837.06,889.8,0.0
gfx950,256,768,2048,7168,fp8,fp8,flydsl,2718,4,26.4651,flydsl_mxpsh_96x128x256_F8_F8_B16_w4_x4_sk4,852.01,881.57,0.0
gfx950,256,800,2048,7168,fp8,fp8,flydsl,2469,2,27.9196,flydsl_mxpsh_64x128x256_F8_F8_B16_w3_x4_sk2,841.28,848.55,0.0
gfx950,256,832,2048,7168,fp8,fp8,flydsl,2934,4,27.9574,flydsl_mxpsh_128x128x256_F8_F8_B16_w1_x4_sk4,873.74,860.3,0.0
gfx950,256,864,2048,7168,fp8,fp8,flydsl,2445,2,28.2263,flydsl_mxpsh_64x128x256_F8_F8_B16_w0_x4_sk2,898.71,864.87,0.0
gfx950,256,896,2048,7168,fp8,fp8,flydsl,2461,2,27.9822,flydsl_mxpsh_64x128x256_F8_F8_B16_w2_x4_sk2,940.12,885.3,0.0
gfx950,256,928,2048,7168,fp8,fp8,flydsl,2941,2,28.6124,flydsl_mxpsh_128x128x256_F8_F8_B16_w2_x4_sk2,952.25,878.4,0.0
gfx950,256,960,2048,7168,fp8,fp8,flydsl,2950,4,28.8014,flydsl_mxpsh_128x128x256_F8_F8_B16_w3_x4_sk4,978.62,885.15,0.0
gfx950,256,992,2048,7168,fp8,fp8,flydsl,2925,2,28.9684,flydsl_mxpsh_128x128x256_F8_F8_B16_w0_x4_sk2,1005.41,892.49,0.0
gfx950,256,1024,2048,7168,fp8,fp8,flydsl,2941,2,29.5692,flydsl_mxpsh_128x128x256_F8_F8_B16_w2_x4_sk2,1016.76,886.54,0.0
gfx950,256,1088,2048,7168,fp8,fp8,flydsl,2701,2,32.8835,flydsl_mxpsh_96x128x256_F8_F8_B16_w2_x4_sk2,971.42,819.11,0.0
gfx950,256,1152,2048,7168,fp8,fp8,flydsl,2693,2,32.1325,flydsl_mxpsh_96x128x256_F8_F8_B16_w1_x4_sk2,1052.61,860.69,0.0
gfx950,256,1216,2048,7168,fp8,fp8,flydsl,2717,2,33.296,flydsl_mxpsh_96x128x256_F8_F8_B16_w4_x4_sk2,1072.26,852.27,0.0
gfx950,256,1280,2048,7168,fp8,fp8,flydsl,2701,2,33.5409,flydsl_mxpsh_96x128x256_F8_F8_B16_w2_x4_sk2,1120.45,867.54,0.0
gfx950,256,1344,2048,7168,fp8,fp8,flydsl,2693,2,33.8105,flydsl_mxpsh_96x128x256_F8_F8_B16_w1_x4_sk2,1167.09,881.94,0.0
gfx950,256,1408,2048,7168,fp8,fp8,flydsl,2701,2,34.1725,flydsl_mxpsh_96x128x256_F8_F8_B16_w2_x4_sk2,1209.72,893.69,0.0
gfx950,256,1472,2048,7168,fp8,fp8,flydsl,2693,2,35.3875,flydsl_mxpsh_96x128x256_F8_F8_B16_w1_x4_sk2,1221.28,883.38,0.0
gfx950,256,1536,2048,7168,fp8,fp8,flydsl,2717,2,36.6817,flydsl_mxpsh_96x128x256_F8_F8_B16_w4_x4_sk2,1229.42,871.87,0.0
gfx950,256,1600,2048,7168,fp8,fp8,flydsl,2957,2,40.2166,flydsl_mxpsh_128x128x256_F8_F8_B16_w4_x4_sk2,1168.08,813.16,0.0
gfx950,256,1664,2048,7168,fp8,fp8,flydsl,2452,1,40.2931,flydsl_mxpsh_64x128x256_F8_F8_B16_w1_x4_sk1,1212.5,829.51,0.0
gfx950,256,1728,2048,7168,fp8,fp8,flydsl,2948,1,40.9735,flydsl_mxpsh_128x128x256_F8_F8_B16_w3_x4_sk1,1238.22,833.33,0.0
gfx950,256,1792,2048,7168,fp8,fp8,flydsl,2468,1,40.8514,flydsl_mxpsh_64x128x256_F8_F8_B16_w3_x4_sk1,1287.92,853.46,0.0
gfx950,256,1856,2048,7168,fp8,fp8,flydsl,2925,2,42.3276,flydsl_mxpsh_128x128x256_F8_F8_B16_w0_x4_sk2,1287.4,840.73,0.0
gfx950,256,1920,2048,7168,fp8,fp8,flydsl,2948,1,41.8785,flydsl_mxpsh_128x128x256_F8_F8_B16_w3_x4_sk1,1346.07,866.96,0.0
gfx950,256,1984,2048,7168,fp8,fp8,flydsl,2940,1,42.0922,flydsl_mxpsh_128x128x256_F8_F8_B16_w2_x4_sk1,1383.88,879.68,0.0
gfx950,256,2048,2048,7168,fp8,fp8,flydsl,2940,1,42.442,flydsl_mxpsh_128x128x256_F8_F8_B16_w2_x4_sk1,1416.75,889.42,0.0
gfx950,256,4096,2048,7168,fp8,fp8,flydsl,2944,1,69.6077,flydsl_mxpsh_128x128x256_F8_F8_B16_w3_x0_sk1,1727.67,873.72,0.0
gfx950,256,6144,2048,7168,fp8,fp8,flydsl,2732,1,97.1776,flydsl_mxpsh_96x256x128_F8_F8_B16_w1_x4_sk1,1856.28,863.22,0.0
gfx950,256,8192,2048,7168,fp8,fp8,flydsl,2980,1,114.2994,flydsl_mxpsh_128x256x128_F8_F8_B16_w2_x4_sk1,2104.28,935.74,0.0
gfx950,256,10240,2048,7168,fp8,fp8,flydsl,2928,1,155.5166,flydsl_mxpsh_128x128x256_F8_F8_B16_w1_x0_sk1,1933.22,836.07,0.0
gfx950,256,12288,2048,7168,fp8,fp8,flydsl,2972,1,176.0565,flydsl_mxpsh_128x256x128_F8_F8_B16_w1_x4_sk1,2049.21,869.56,0.0
gfx950,256,14336,2048,7168,fp8,fp8,flydsl,2972,1,198.9261,flydsl_mxpsh_128x256x128_F8_F8_B16_w1_x4_sk1,2115.9,885.56,0.0
gfx950,256,16384,2048,7168,fp8,fp8,flydsl,2964,1,213.3612,flydsl_mxpsh_128x256x128_F8_F8_B16_w0_x4_sk1,2254.56,933.77,0.0
gfx950,256,32768,2048,7168,fp8,fp8,flydsl,2980,1,404.2502,flydsl_mxpsh_128x256x128_F8_F8_B16_w2_x4_sk1,2379.89,949.36,0.0
gfx950,256,1,6144,7168,fp8,fp8,flydsl,2234,4,14.0421,flydsl_mxpsh_32x128x256_F8_F8_B16_w4_x0_sk4,6.27,3137.68,0.0
gfx950,256,2,6144,7168,fp8,fp8,flydsl,2234,4,15.0086,flydsl_mxpsh_32x128x256_F8_F8_B16_w4_x0_sk4,11.74,2936.92,0.0
gfx950,256,4,6144,7168,fp8,fp8,flydsl,2458,4,14.8284,flydsl_mxpsh_64x128x256_F8_F8_B16_w2_x0_sk4,23.76,2975.24,0.0
gfx950,256,8,6144,7168,fp8,fp8,flydsl,2210,4,14.5538,flydsl_mxpsh_32x128x256_F8_F8_B16_w1_x0_sk4,48.42,3036.72,0.0
gfx950,256,16,6144,7168,fp8,fp8,flydsl,2202,4,14.8372,flydsl_mxpsh_32x128x256_F8_F8_B16_w0_x0_sk4,94.98,2989.21,0.0
gfx950,256,32,6144,7168,fp8,fp8,flydsl,2202,4,15.5412,flydsl_mxpsh_32x128x256_F8_F8_B16_w0_x0_sk4,181.36,2873.83,0.0
gfx950,256,48,6144,7168,fp8,fp8,flydsl,2454,4,16.7177,flydsl_mxpsh_64x128x256_F8_F8_B16_w1_x4_sk4,252.9,2690.21,0.0
gfx950,256,64,6144,7168,fp8,fp8,flydsl,2470,4,17.4233,flydsl_mxpsh_64x128x256_F8_F8_B16_w3_x4_sk4,323.54,2599.13,0.0
gfx950,256,80,6144,7168,fp8,fp8,flydsl,2690,4,18.2172,flydsl_mxpsh_96x128x256_F8_F8_B16_w1_x0_sk4,386.8,2502.95,0.0
gfx950,256,96,6144,7168,fp8,fp8,flydsl,2694,4,18.8835,flydsl_mxpsh_96x128x256_F8_F8_B16_w1_x4_sk4,447.78,2431.12,0.0
gfx950,256,112,6144,7168,fp8,fp8,flydsl,2954,4,19.9948,flydsl_mxpsh_128x128x256_F8_F8_B16_w4_x0_sk4,493.38,2311.56,0.0
gfx950,256,128,6144,7168,fp8,fp8,flydsl,2922,4,20.8153,flydsl_mxpsh_128x128x256_F8_F8_B16_w0_x0_sk4,541.63,2235.4,0.0
gfx950,256,144,6144,7168,fp8,fp8,flydsl,2702,4,23.5386,flydsl_mxpsh_96x128x256_F8_F8_B16_w2_x4_sk4,538.84,1990.0,0.0
gfx950,256,160,6144,7168,fp8,fp8,flydsl,2718,4,24.5865,flydsl_mxpsh_96x128x256_F8_F8_B16_w4_x4_sk4,573.2,1917.85,0.0
gfx950,256,176,6144,7168,fp8,fp8,flydsl,2686,4,25.8343,flydsl_mxpsh_96x128x256_F8_F8_B16_w0_x4_sk4,600.06,1837.26,0.0
gfx950,256,192,6144,7168,fp8,fp8,flydsl,2469,2,25.9565,flydsl_mxpsh_64x128x256_F8_F8_B16_w3_x4_sk2,651.53,1840.61,0.0
gfx950,256,208,6144,7168,fp8,fp8,flydsl,2470,4,27.2989,flydsl_mxpsh_64x128x256_F8_F8_B16_w3_x4_sk4,671.12,1761.5,0.0
gfx950,256,224,6144,7168,fp8,fp8,flydsl,2949,2,28.0316,flydsl_mxpsh_128x128x256_F8_F8_B16_w3_x4_sk2,703.85,1726.56,0.0
gfx950,256,240,6144,7168,fp8,fp8,flydsl,2925,2,28.4665,flydsl_mxpsh_128x128x256_F8_F8_B16_w0_x4_sk2,742.6,1711.12,0.0
gfx950,256,256,6144,7168,fp8,fp8,flydsl,2925,2,28.6346,flydsl_mxpsh_128x128x256_F8_F8_B16_w0_x4_sk2,787.46,1711.95,0.0
gfx950,256,288,6144,7168,fp8,fp8,flydsl,2685,2,30.7361,flydsl_mxpsh_96x128x256_F8_F8_B16_w0_x4_sk2,825.32,1615.15,0.0
gfx950,256,320,6144,7168,fp8,fp8,flydsl,2469,2,32.1983,flydsl_mxpsh_64x128x256_F8_F8_B16_w3_x4_sk2,875.38,1561.14,0.0
gfx950,256,352,6144,7168,fp8,fp8,flydsl,2693,2,35.214,flydsl_mxpsh_96x128x256_F8_F8_B16_w1_x4_sk2,880.45,1445.13,0.0
gfx950,256,384,6144,7168,fp8,fp8,flydsl,2701,2,35.9829,flydsl_mxpsh_96x128x256_F8_F8_B16_w2_x4_sk2,939.97,1431.55,0.0
gfx950,256,416,6144,7168,fp8,fp8,flydsl,2693,2,36.5938,flydsl_mxpsh_96x128x256_F8_F8_B16_w1_x4_sk2,1001.3,1424.66,0.0
gfx950,256,448,6144,7168,fp8,fp8,flydsl,2693,2,38.1157,flydsl_mxpsh_96x128x256_F8_F8_B16_w1_x4_sk2,1035.27,1384.11,0.0
gfx950,256,480,6144,7168,fp8,fp8,flydsl,2685,2,38.174,flydsl_mxpsh_96x128x256_F8_F8_B16_w0_x4_sk2,1107.52,1398.31,0.0
gfx950,256,512,6144,7168,fp8,fp8,flydsl,2460,1,40.2514,flydsl_mxpsh_64x128x256_F8_F8_B16_w2_x4_sk1,1120.39,1341.61,0.0
gfx950,256,544,6144,7168,fp8,fp8,flydsl,2940,1,41.1602,flydsl_mxpsh_128x128x256_F8_F8_B16_w2_x4_sk1,1164.13,1327.11,0.0
gfx950,256,576,6144,7168,fp8,fp8,flydsl,2444,1,42.3929,flydsl_mxpsh_64x128x256_F8_F8_B16_w0_x4_sk1,1196.76,1303.21,0.0
gfx950,256,608,6144,7168,fp8,fp8,flydsl,2932,1,42.6403,flydsl_mxpsh_128x128x256_F8_F8_B16_w1_x4_sk1,1255.92,1310.25,0.0
gfx950,256,640,6144,7168,fp8,fp8,flydsl,2932,1,43.5376,flydsl_mxpsh_128x128x256_F8_F8_B16_w1_x4_sk1,1294.78,1297.55,0.0
gfx950,256,672,6144,7168,fp8,fp8,flydsl,2653,2,52.801,flydsl_mxpsh_96x128x128_F8_F8_B16_w1_x4_sk2,1121.0,1081.7,0.0
gfx950,256,704,6144,7168,fp8,fp8,flydsl,2684,1,51.8709,flydsl_mxpsh_96x128x256_F8_F8_B16_w0_x4_sk1,1195.44,1113.09,0.0
gfx950,256,736,6144,7168,fp8,fp8,flydsl,2716,1,52.3459,flydsl_mxpsh_96x128x256_F8_F8_B16_w4_x4_sk1,1238.44,1114.89,0.0
gfx950,256,768,6144,7168,fp8,fp8,flydsl,2716,1,52.7086,flydsl_mxpsh_96x128x256_F8_F8_B16_w4_x4_sk1,1283.39,1119.03,0.0
gfx950,256,800,6144,7168,fp8,fp8,flydsl,2700,1,55.1263,flydsl_mxpsh_96x128x256_F8_F8_B16_w2_x4_sk1,1278.23,1081.24,0.0
gfx950,256,832,6144,7168,fp8,fp8,flydsl,2684,1,55.9623,flydsl_mxpsh_96x128x256_F8_F8_B16_w0_x4_sk1,1309.5,1076.22,0.0
gfx950,256,864,6144,7168,fp8,fp8,flydsl,2692,1,55.6535,flydsl_mxpsh_96x128x256_F8_F8_B16_w1_x4_sk1,1367.42,1093.38,0.0
gfx950,256,896,6144,7168,fp8,fp8,flydsl,2716,1,57.7619,flydsl_mxpsh_96x128x256_F8_F8_B16_w4_x4_sk1,1366.3,1064.24,0.0
gfx950,256,928,6144,7168,fp8,fp8,flydsl,2692,1,58.9163,flydsl_mxpsh_96x128x256_F8_F8_B16_w1_x4_sk1,1387.37,1053.96,0.0
gfx950,256,960,6144,7168,fp8,fp8,flydsl,2684,1,58.8675,flydsl_mxpsh_96x128x256_F8_F8_B16_w0_x4_sk1,1436.4,1065.41,0.0
gfx950,256,992,6144,7168,fp8,fp8,flydsl,2940,1,62.5776,flydsl_mxpsh_128x128x256_F8_F8_B16_w2_x4_sk1,1396.28,1012.19,0.0
gfx950,256,1024,6144,7168,fp8,fp8,flydsl,2940,1,61.7856,flydsl_mxpsh_128x128x256_F8_F8_B16_w2_x4_sk1,1459.8,1035.24,0.0
gfx950,256,1088,6144,7168,fp8,fp8,flydsl,2956,1,66.2488,flydsl_mxpsh_128x128x256_F8_F8_B16_w4_x4_sk1,1446.54,984.29,0.0
gfx950,256,1152,6144,7168,fp8,fp8,flydsl,2948,1,67.0192,flydsl_mxpsh_128x128x256_F8_F8_B16_w3_x4_sk1,1514.02,991.56,0.0
gfx950,256,1216,6144,7168,fp8,fp8,flydsl,2940,1,69.1396,flydsl_mxpsh_128x128x256_F8_F8_B16_w2_x4_sk1,1549.12,979.16,0.0
gfx950,256,1280,6144,7168,fp8,fp8,flydsl,2940,1,67.5332,flydsl_mxpsh_128x128x256_F8_F8_B16_w2_x4_sk1,1669.44,1020.89,0.0
gfx950,256,1344,6144,7168,fp8,fp8,flydsl,2668,1,77.4253,flydsl_mxpsh_96x128x128_F8_F8_B16_w3_x4_sk1,1528.96,906.54,0.0
gfx950,256,1408,6144,7168,fp8,fp8,flydsl,2668,1,78.4541,flydsl_mxpsh_96x128x128_F8_F8_B16_w3_x4_sk1,1580.76,910.52,0.0
gfx950,256,1472,6144,7168,fp8,fp8,flydsl,2660,1,81.6522,flydsl_mxpsh_96x128x128_F8_F8_B16_w2_x4_sk1,1587.89,890.11,0.0
gfx950,256,1536,6144,7168,fp8,fp8,flydsl,2660,1,83.9198,flydsl_mxpsh_96x128x128_F8_F8_B16_w2_x4_sk1,1612.15,880.9,0.0
gfx950,256,1600,6144,7168,fp8,fp8,flydsl,2900,1,87.9726,flydsl_mxpsh_128x128x128_F8_F8_B16_w2_x4_sk1,1601.96,854.47,0.0
gfx950,256,1664,6144,7168,fp8,fp8,flydsl,2892,1,89.9275,flydsl_mxpsh_128x128x128_F8_F8_B16_w1_x4_sk1,1629.82,849.74,0.0
gfx950,256,1728,6144,7168,fp8,fp8,flydsl,2908,1,88.4926,flydsl_mxpsh_128x128x128_F8_F8_B16_w3_x4_sk1,1719.95,877.59,0.0
gfx950,256,1792,6144,7168,fp8,fp8,flydsl,2892,1,92.3407,flydsl_mxpsh_128x128x128_F8_F8_B16_w1_x4_sk1,1709.32,854.5,0.0
gfx950,256,1856,6144,7168,fp8,fp8,flydsl,2908,1,95.1131,flydsl_mxpsh_128x128x128_F8_F8_B16_w3_x4_sk1,1718.77,842.69,0.0
gfx950,256,1920,6144,7168,fp8,fp8,flydsl,2724,1,95.6306,flydsl_mxpsh_96x256x128_F8_F8_B16_w0_x4_sk1,1768.41,851.15,0.0
gfx950,256,1984,6144,7168,fp8,fp8,flydsl,2892,1,95.4667,flydsl_mxpsh_128x128x128_F8_F8_B16_w1_x4_sk1,1830.5,865.65,0.0
gfx950,256,2048,6144,7168,fp8,fp8,flydsl,2900,1,97.8423,flydsl_mxpsh_128x128x128_F8_F8_B16_w2_x4_sk1,1843.67,857.36,0.0
gfx950,256,4096,6144,7168,fp8,fp8,flydsl,2980,1,170.4339,flydsl_mxpsh_128x256x128_F8_F8_B16_w2_x4_sk1,2116.82,725.98,0.0
gfx950,256,6144,6144,7168,fp8,fp8,flydsl,2972,1,245.035,flydsl_mxpsh_128x256x128_F8_F8_B16_w1_x4_sk1,2208.52,667.57,0.0
gfx950,256,8192,6144,7168,fp8,fp8,flydsl,2972,1,293.9048,flydsl_mxpsh_128x256x128_F8_F8_B16_w1_x4_sk1,2455.06,692.14,0.0
gfx950,256,10240,6144,7168,fp8,fp8,flydsl,2980,1,373.2207,flydsl_mxpsh_128x256x128_F8_F8_B16_w2_x4_sk1,2416.65,651.81,0.0
gfx950,256,12288,6144,7168,fp8,fp8,flydsl,2980,1,436.529,flydsl_mxpsh_128x256x128_F8_F8_B16_w2_x4_sk1,2479.4,648.56,0.0
gfx950,256,14336,6144,7168,fp8,fp8,flydsl,2980,1,510.6809,flydsl_mxpsh_128x256x128_F8_F8_B16_w2_x4_sk1,2472.62,632.41,0.0
gfx950,256,16384,6144,7168,fp8,fp8,flydsl,2980,1,578.2956,flydsl_mxpsh_128x256x128_F8_F8_B16_w2_x4_sk1,2495.45,627.37,0.0
gfx950,256,20480,6144,7168,fp8,fp8,flydsl,2980,1,724.5511,flydsl_mxpsh_128x256x128_F8_F8_B16_w2_x4_sk1,2489.66,610.72,0.0
gfx950,256,24576,6144,7168,fp8,fp8,flydsl,2964,1,880.2002,flydsl_mxpsh_128x256x128_F8_F8_B16_w0_x4_sk1,2459.29,593.26,0.0
gfx950,256,28672,6144,7168,fp8,fp8,flydsl,2964,1,1050.7185,flydsl_mxpsh_128x256x128_F8_F8_B16_w0_x4_sk1,2403.54,572.83,0.0
gfx950,256,32768,6144,7168,fp8,fp8,flydsl,2972,1,1173.5063,flydsl_mxpsh_128x256x128_F8_F8_B16_w1_x4_sk1,2459.48,580.8,0.0
gfx950,256,40960,6144,7168,fp8,fp8,flydsl,2964,1,1475.0018,flydsl_mxpsh_128x256x128_F8_F8_B16_w0_x4_sk1,2445.94,570.14,0.0
gfx950,256,49152,6144,7168,fp8,fp8,flydsl,2972,1,1782.5876,flydsl_mxpsh_128x256x128_F8_F8_B16_w1_x4_sk1,2428.68,561.17,0.0
gfx950,256,57344,6144,7168,fp8,fp8,flydsl,2964,1,2153.3606,flydsl_mxpsh_128x256x128_F8_F8_B16_w0_x4_sk1,2345.58,538.57,0.0
gfx950,256,65536,6144,7168,fp8,fp8,flydsl,2964,1,2480.7318,flydsl_mxpsh_128x256x128_F8_F8_B16_w0_x4_sk1,2326.91,531.74,0.0
gfx950,256,1,7168,384,fp8,fp8,flydsl,2192,1,4.727,flydsl_mxpsh_32x128x128_F8_F8_B16_w4_x0_sk1,1.16,585.41,0.0
gfx950,256,1,7168,3072,fp8,fp8,flydsl,2210,4,9.7049,flydsl_mxpsh_32x128x256_F8_F8_B16_w1_x0_sk4,4.54,2270.76,0.0
gfx950,256,1,7168,7168,fp8,fp8,flydsl,2238,4,15.4299,flydsl_mxpsh_32x128x256_F8_F8_B16_w4_x4_sk4,6.66,3331.31,0.0
gfx950,256,1,7168,16384,fp8,fp8,flydsl,2223,8,24.7228,flydsl_mxpsh_32x128x256_F8_F8_B16_w2_x4_sk8,9.5,4751.53,0.0
gfx950,256,2,7168,384,fp8,fp8,flydsl,2176,1,4.8906,flydsl_mxpsh_32x128x128_F8_F8_B16_w2_x0_sk1,2.25,568.84,0.0
gfx950,256,2,7168,3072,fp8,fp8,flydsl,2206,4,9.8454,flydsl_mxpsh_32x128x256_F8_F8_B16_w0_x4_sk4,8.95,2240.12,0.0
gfx950,256,2,7168,7168,fp8,fp8,flydsl,2202,4,14.9823,flydsl_mxpsh_32x128x256_F8_F8_B16_w0_x0_sk4,13.72,3432.27,0.0
gfx950,256,2,7168,16384,fp8,fp8,flydsl,2239,8,24.4695,flydsl_mxpsh_32x128x256_F8_F8_B16_w4_x4_sk8,19.2,4801.98,0.0
gfx950,256,4,7168,384,fp8,fp8,flydsl,2176,1,4.9062,flydsl_mxpsh_32x128x128_F8_F8_B16_w2_x0_sk1,4.49,573.03,0.0
gfx950,256,4,7168,3072,fp8,fp8,flydsl,2234,4,9.536,flydsl_mxpsh_32x128x256_F8_F8_B16_w4_x0_sk4,18.47,2316.46,0.0
gfx950,256,4,7168,7168,fp8,fp8,flydsl,2218,4,15.1152,flydsl_mxpsh_32x128x256_F8_F8_B16_w2_x0_sk4,27.19,3404.93,0.0
gfx950,256,4,7168,16384,fp8,fp8,flydsl,2223,8,24.4959,flydsl_mxpsh_32x128x256_F8_F8_B16_w2_x4_sk8,38.35,4799.31,0.0
gfx950,256,8,7168,384,fp8,fp8,flydsl,2192,1,4.8773,flydsl_mxpsh_32x128x128_F8_F8_B16_w4_x0_sk1,9.03,588.5,0.0
gfx950,256,8,7168,3072,fp8,fp8,flydsl,2234,4,9.7003,flydsl_mxpsh_32x128x256_F8_F8_B16_w4_x0_sk4,36.32,2284.4,0.0
gfx950,256,8,7168,7168,fp8,fp8,flydsl,2234,4,15.2481,flydsl_mxpsh_32x128x256_F8_F8_B16_w4_x0_sk4,53.91,3380.9,0.0
gfx950,256,8,7168,16384,fp8,fp8,flydsl,2207,8,24.8421,flydsl_mxpsh_32x128x256_F8_F8_B16_w0_x4_sk8,75.64,4737.37,0.0
gfx950,256,16,7168,384,fp8,fp8,flydsl,2176,1,4.9352,flydsl_mxpsh_32x128x128_F8_F8_B16_w2_x0_sk1,17.85,605.45,0.0
gfx950,256,16,7168,3072,fp8,fp8,flydsl,2234,4,9.9139,flydsl_mxpsh_32x128x256_F8_F8_B16_w4_x0_sk4,71.08,2249.23,0.0
gfx950,256,16,7168,7168,fp8,fp8,flydsl,2214,4,16.1739,flydsl_mxpsh_32x128x256_F8_F8_B16_w1_x4_sk4,101.66,3198.01,0.0
gfx950,256,16,7168,16384,fp8,fp8,flydsl,2239,8,25.0803,flydsl_mxpsh_32x128x256_F8_F8_B16_w4_x4_sk8,149.84,4702.18,0.0
gfx950,256,32,7168,384,fp8,fp8,flydsl,2164,1,5.1413,flydsl_mxpsh_32x128x128_F8_F8_B16_w0_x4_sk1,34.26,626.99,0.0
gfx950,256,32,7168,3072,fp8,fp8,flydsl,2226,4,11.3627,flydsl_mxpsh_32x128x256_F8_F8_B16_w3_x0_sk4,124.03,1986.95,0.0
gfx950,256,32,7168,7168,fp8,fp8,flydsl,2234,4,16.5416,flydsl_mxpsh_32x128x256_F8_F8_B16_w4_x0_sk4,198.79,3147.72,0.0
gfx950,256,32,7168,16384,fp8,fp8,flydsl,2199,8,27.6946,flydsl_mxpsh_32x128x128_F8_F8_B16_w4_x4_sk8,271.4,4276.05,0.0
gfx950,256,48,7168,384,fp8,fp8,flydsl,2192,1,5.0063,flydsl_mxpsh_32x128x128_F8_F8_B16_w4_x0_sk1,52.78,690.94,0.0
gfx950,256,48,7168,3072,fp8,fp8,flydsl,2458,4,12.0276,flydsl_mxpsh_64x128x256_F8_F8_B16_w2_x0_sk4,175.76,1900.27,0.0
gfx950,256,48,7168,7168,fp8,fp8,flydsl,2466,4,17.6114,flydsl_mxpsh_64x128x256_F8_F8_B16_w3_x0_sk4,280.07,2976.05,0.0
gfx950,256,48,7168,16384,fp8,fp8,flydsl,2663,8,29.4787,flydsl_mxpsh_96x128x128_F8_F8_B16_w2_x4_sk8,382.46,4033.93,0.0
gfx950,256,64,7168,384,fp8,fp8,flydsl,2184,1,5.0702,flydsl_mxpsh_32x128x128_F8_F8_B16_w3_x0_sk1,69.49,728.69,0.0
gfx950,256,64,7168,3072,fp8,fp8,flydsl,2302,4,13.2081,flydsl_mxpsh_32x256x256_F8_F8_B16_w2_x4_sk4,213.4,1751.52,0.0
gfx950,256,64,7168,7168,fp8,fp8,flydsl,2458,4,18.5432,flydsl_mxpsh_64x128x256_F8_F8_B16_w2_x0_sk4,354.67,2845.06,0.0
gfx950,256,64,7168,16384,fp8,fp8,flydsl,2447,8,31.1718,flydsl_mxpsh_64x128x256_F8_F8_B16_w0_x4_sk8,482.24,3830.6,0.0
gfx950,256,80,7168,384,fp8,fp8,flydsl,2192,1,5.0733,flydsl_mxpsh_32x128x128_F8_F8_B16_w4_x0_sk1,86.81,774.67,0.0
gfx950,256,80,7168,3072,fp8,fp8,flydsl,2205,2,13.9434,flydsl_mxpsh_32x128x256_F8_F8_B16_w0_x4_sk2,252.68,1679.13,0.0
gfx950,256,80,7168,7168,fp8,fp8,flydsl,2690,4,19.6336,flydsl_mxpsh_96x128x256_F8_F8_B16_w1_x0_sk4,418.71,2704.58,0.0
gfx950,256,80,7168,16384,fp8,fp8,flydsl,2671,8,32.5001,flydsl_mxpsh_96x128x128_F8_F8_B16_w3_x4_sk8,578.17,3689.16,0.0
gfx950,256,96,7168,384,fp8,fp8,flydsl,2168,1,5.1586,flydsl_mxpsh_32x128x128_F8_F8_B16_w1_x0_sk1,102.45,807.51,0.0
gfx950,256,96,7168,3072,fp8,fp8,flydsl,2229,2,14.3624,flydsl_mxpsh_32x128x256_F8_F8_B16_w3_x4_sk2,294.37,1649.53,0.0
gfx950,256,96,7168,7168,fp8,fp8,flydsl,2698,4,20.2469,flydsl_mxpsh_96x128x256_F8_F8_B16_w2_x0_sk4,487.24,2639.64,0.0
gfx950,256,96,7168,16384,fp8,fp8,flydsl,2703,8,34.4223,flydsl_mxpsh_96x128x256_F8_F8_B16_w2_x4_sk8,655.06,3497.43,0.0
gfx950,256,112,7168,384,fp8,fp8,flydsl,2180,1,5.2911,flydsl_mxpsh_32x128x128_F8_F8_B16_w2_x4_sk1,116.53,831.8,0.0
gfx950,256,112,7168,3072,fp8,fp8,flydsl,2221,2,14.7212,flydsl_mxpsh_32x128x256_F8_F8_B16_w2_x4_sk2,335.06,1628.25,0.0
gfx950,256,112,7168,7168,fp8,fp8,flydsl,2930,4,21.7612,flydsl_mxpsh_128x128x256_F8_F8_B16_w1_x0_sk4,528.88,2471.77,0.0
gfx950,256,112,7168,16384,fp8,fp8,flydsl,2943,8,38.0951,flydsl_mxpsh_128x128x256_F8_F8_B16_w2_x4_sk8,690.55,3173.14,0.0
gfx950,256,128,7168,384,fp8,fp8,flydsl,2172,1,5.4122,flydsl_mxpsh_32x128x128_F8_F8_B16_w1_x4_sk1,130.2,856.71,0.0
gfx950,256,128,7168,3072,fp8,fp8,flydsl,2205,2,14.8248,flydsl_mxpsh_32x128x256_F8_F8_B16_w0_x4_sk2,380.25,1635.66,0.0
gfx950,256,128,7168,7168,fp8,fp8,flydsl,2938,4,22.5412,flydsl_mxpsh_128x128x256_F8_F8_B16_w2_x0_sk4,583.52,2401.5,0.0
gfx950,256,128,7168,16384,fp8,fp8,flydsl,2947,8,38.8248,flydsl_mxpsh_128x128x256_F8_F8_B16_w3_x0_sk8,774.37,3126.16,0.0
gfx950,256,144,7168,384,fp8,fp8,flydsl,2164,1,5.4658,flydsl_mxpsh_32x128x128_F8_F8_B16_w0_x4_sk1,145.03,891.4,0.0
gfx950,256,144,7168,3072,fp8,fp8,flydsl,2236,1,15.7136,flydsl_mxpsh_32x128x256_F8_F8_B16_w4_x4_sk1,403.59,1560.87,0.0
gfx950,256,144,7168,7168,fp8,fp8,flydsl,2685,2,26.314,flydsl_mxpsh_96x128x256_F8_F8_B16_w0_x4_sk2,562.34,2070.26,0.0
gfx950,256,144,7168,16384,fp8,fp8,flydsl,2718,4,43.0602,flydsl_mxpsh_96x128x256_F8_F8_B16_w4_x4_sk4,785.48,2830.09,0.0
gfx950,256,160,7168,384,fp8,fp8,flydsl,2188,1,5.5554,flydsl_mxpsh_32x128x128_F8_F8_B16_w3_x4_sk1,158.55,919.41,0.0
gfx950,256,160,7168,3072,fp8,fp8,flydsl,2236,1,15.9187,flydsl_mxpsh_32x128x256_F8_F8_B16_w4_x4_sk1,442.65,1558.25,0.0
gfx950,256,160,7168,7168,fp8,fp8,flydsl,2718,4,25.9811,flydsl_mxpsh_96x128x256_F8_F8_B16_w4_x4_sk4,632.83,2110.03,0.0
gfx950,256,160,7168,16384,fp8,fp8,flydsl,2686,4,43.5381,flydsl_mxpsh_96x128x256_F8_F8_B16_w0_x4_sk4,863.17,2810.31,0.0
gfx950,256,176,7168,384,fp8,fp8,flydsl,2188,1,5.5405,flydsl_mxpsh_32x128x128_F8_F8_B16_w3_x4_sk1,174.87,964.4,0.0
gfx950,256,176,7168,3072,fp8,fp8,flydsl,2220,1,16.0987,flydsl_mxpsh_32x128x256_F8_F8_B16_w2_x4_sk1,481.47,1558.13,0.0
gfx950,256,176,7168,7168,fp8,fp8,flydsl,2686,4,27.0991,flydsl_mxpsh_96x128x256_F8_F8_B16_w0_x4_sk4,667.4,2035.67,0.0
gfx950,256,176,7168,16384,fp8,fp8,flydsl,2718,4,44.6556,flydsl_mxpsh_96x128x256_F8_F8_B16_w4_x4_sk4,925.73,2750.99,0.0
gfx950,256,192,7168,384,fp8,fp8,flydsl,2172,1,5.615,flydsl_mxpsh_32x128x128_F8_F8_B16_w1_x4_sk1,188.24,993.54,0.0
gfx950,256,192,7168,3072,fp8,fp8,flydsl,2236,1,16.0926,flydsl_mxpsh_32x128x256_F8_F8_B16_w4_x4_sk1,525.44,1576.03,0.0
gfx950,256,192,7168,7168,fp8,fp8,flydsl,2686,4,27.4844,flydsl_mxpsh_96x128x256_F8_F8_B16_w0_x4_sk4,717.86,2019.65,0.0
gfx950,256,192,7168,16384,fp8,fp8,flydsl,2686,4,46.4174,flydsl_mxpsh_96x128x256_F8_F8_B16_w0_x4_sk4,971.56,2657.17,0.0
gfx950,256,208,7168,384,fp8,fp8,flydsl,2196,1,5.7178,flydsl_mxpsh_32x128x128_F8_F8_B16_w4_x4_sk1,200.26,1016.87,0.0
gfx950,256,208,7168,3072,fp8,fp8,flydsl,2236,1,16.2184,flydsl_mxpsh_32x128x256_F8_F8_B16_w4_x4_sk1,564.81,1580.98,0.0
gfx950,256,208,7168,7168,fp8,fp8,flydsl,2950,4,28.8503,flydsl_mxpsh_128x128x256_F8_F8_B16_w3_x4_sk4,740.86,1935.96,0.0
gfx950,256,208,7168,16384,fp8,fp8,flydsl,2942,4,49.0392,flydsl_mxpsh_128x128x256_F8_F8_B16_w2_x4_sk4,996.25,2525.13,0.0
gfx950,256,224,7168,384,fp8,fp8,flydsl,2172,1,5.7819,flydsl_mxpsh_32x128x128_F8_F8_B16_w1_x4_sk1,213.27,1046.33,0.0
gfx950,256,224,7168,3072,fp8,fp8,flydsl,2212,1,16.3641,flydsl_mxpsh_32x128x256_F8_F8_B16_w1_x4_sk1,602.84,1583.92,0.0
gfx950,256,224,7168,7168,fp8,fp8,flydsl,2949,2,29.8471,flydsl_mxpsh_128x128x256_F8_F8_B16_w3_x4_sk2,771.21,1882.83,0.0
gfx950,256,224,7168,16384,fp8,fp8,flydsl,2958,4,50.5507,flydsl_mxpsh_128x128x256_F8_F8_B16_w4_x4_sk4,1040.8,2459.35,0.0
gfx950,256,240,7168,384,fp8,fp8,flydsl,2172,1,5.9707,flydsl_mxpsh_32x128x128_F8_F8_B16_w1_x4_sk1,221.28,1052.69,0.0
gfx950,256,240,7168,3072,fp8,fp8,flydsl,2220,1,16.5054,flydsl_mxpsh_32x128x256_F8_F8_B16_w2_x4_sk1,640.38,1587.24,0.0
gfx950,256,240,7168,7168,fp8,fp8,flydsl,2925,2,29.7366,flydsl_mxpsh_128x128x256_F8_F8_B16_w0_x4_sk2,829.37,1901.4,0.0
gfx950,256,240,7168,16384,fp8,fp8,flydsl,2950,4,51.3008,flydsl_mxpsh_128x128x256_F8_F8_B16_w3_x4_sk4,1098.84,2432.97,0.0
gfx950,256,256,7168,384,fp8,fp8,flydsl,2164,1,6.1089,flydsl_mxpsh_32x128x128_F8_F8_B16_w0_x4_sk1,230.69,1067.43,0.0
gfx950,256,256,7168,3072,fp8,fp8,flydsl,2220,1,16.4125,flydsl_mxpsh_32x128x256_F8_F8_B16_w2_x4_sk1,686.93,1613.19,0.0
gfx950,256,256,7168,7168,fp8,fp8,flydsl,2941,2,30.4128,flydsl_mxpsh_128x128x256_F8_F8_B16_w2_x4_sk2,864.99,1870.44,0.0
gfx950,256,256,7168,16384,fp8,fp8,flydsl,2926,4,52.2845,flydsl_mxpsh_128x128x256_F8_F8_B16_w0_x4_sk4,1150.05,2396.6,0.0
gfx950,256,288,7168,384,fp8,fp8,flydsl,2164,1,6.0972,flydsl_mxpsh_32x128x128_F8_F8_B16_w0_x4_sk1,260.03,1146.73,0.0
gfx950,256,288,7168,3072,fp8,fp8,flydsl,2212,1,17.3841,flydsl_mxpsh_32x128x256_F8_F8_B16_w1_x4_sk1,729.61,1555.08,0.0
gfx950,256,288,7168,7168,fp8,fp8,flydsl,2212,1,34.9106,flydsl_mxpsh_32x128x256_F8_F8_B16_w1_x4_sk1,847.74,1649.17,0.0
gfx950,256,288,7168,16384,fp8,fp8,flydsl,2694,4,63.754,flydsl_mxpsh_96x128x256_F8_F8_B16_w1_x4_sk4,1061.04,1980.86,0.0
gfx950,256,320,7168,384,fp8,fp8,flydsl,2644,1,6.6529,flydsl_mxpsh_96x128x128_F8_F8_B16_w0_x4_sk1,264.79,1121.75,0.0
gfx950,256,320,7168,3072,fp8,fp8,flydsl,2700,1,19.5686,flydsl_mxpsh_96x128x256_F8_F8_B16_w2_x4_sk1,720.18,1409.95,0.0
gfx950,256,320,7168,7168,fp8,fp8,flydsl,2701,2,35.7397,flydsl_mxpsh_96x128x256_F8_F8_B16_w2_x4_sk2,920.08,1630.16,0.0
gfx950,256,320,7168,16384,fp8,fp8,flydsl,2693,2,64.9594,flydsl_mxpsh_96x128x256_F8_F8_B16_w1_x4_sk2,1157.06,1959.24,0.0
gfx950,256,352,7168,384,fp8,fp8,flydsl,2660,1,6.7594,flydsl_mxpsh_96x128x128_F8_F8_B16_w2_x4_sk1,286.68,1173.77,0.0
gfx950,256,352,7168,3072,fp8,fp8,flydsl,2692,1,19.5987,flydsl_mxpsh_96x128x256_F8_F8_B16_w1_x4_sk1,790.98,1436.2,0.0
gfx950,256,352,7168,7168,fp8,fp8,flydsl,2701,2,37.0967,flydsl_mxpsh_96x128x256_F8_F8_B16_w2_x4_sk2,975.06,1589.08,0.0
gfx950,256,352,7168,16384,fp8,fp8,flydsl,2693,2,66.2653,flydsl_mxpsh_96x128x256_F8_F8_B16_w1_x4_sk2,1247.68,1935.46,0.0
gfx950,256,384,7168,384,fp8,fp8,flydsl,2404,1,6.8993,flydsl_mxpsh_64x128x128_F8_F8_B16_w0_x4_sk1,306.4,1218.24,0.0
gfx950,256,384,7168,3072,fp8,fp8,flydsl,2716,1,19.6927,flydsl_mxpsh_96x128x256_F8_F8_B16_w4_x4_sk1,858.77,1457.63,0.0
gfx950,256,384,7168,7168,fp8,fp8,flydsl,2685,2,38.2472,flydsl_mxpsh_96x128x256_F8_F8_B16_w0_x4_sk2,1031.71,1559.27,0.0
gfx950,256,384,7168,16384,fp8,fp8,flydsl,2701,2,68.039,flydsl_mxpsh_96x128x256_F8_F8_B16_w2_x4_sk2,1325.63,1899.45,0.0
gfx950,256,416,7168,384,fp8,fp8,flydsl,2404,1,7.0653,flydsl_mxpsh_64x128x128_F8_F8_B16_w0_x4_sk1,324.13,1256.29,0.0
gfx950,256,416,7168,3072,fp8,fp8,flydsl,2948,1,20.4125,flydsl_mxpsh_128x128x256_F8_F8_B16_w3_x4_sk1,897.52,1433.52,0.0
gfx950,256,416,7168,7168,fp8,fp8,flydsl,2932,1,41.1544,flydsl_mxpsh_128x128x256_F8_F8_B16_w1_x4_sk1,1038.73,1465.84,0.0
gfx950,256,416,7168,16384,fp8,fp8,flydsl,2957,2,79.0795,flydsl_mxpsh_128x128x256_F8_F8_B16_w4_x4_sk2,1235.6,1646.7,0.0
gfx950,256,448,7168,384,fp8,fp8,flydsl,2644,1,7.3449,flydsl_mxpsh_96x128x128_F8_F8_B16_w0_x4_sk1,335.78,1272.59,0.0
gfx950,256,448,7168,3072,fp8,fp8,flydsl,2444,1,20.6592,flydsl_mxpsh_64x128x256_F8_F8_B16_w0_x4_sk1,955.02,1443.37,0.0
gfx950,256,448,7168,7168,fp8,fp8,flydsl,2956,1,41.4947,flydsl_mxpsh_128x128x256_F8_F8_B16_w4_x4_sk1,1109.46,1470.41,0.0
gfx950,256,448,7168,16384,fp8,fp8,flydsl,2957,2,83.3971,flydsl_mxpsh_128x128x256_F8_F8_B16_w4_x4_sk2,1261.75,1573.23,0.0
gfx950,256,480,7168,384,fp8,fp8,flydsl,2660,1,7.538,flydsl_mxpsh_96x128x128_F8_F8_B16_w2_x4_sk1,350.55,1302.48,0.0
gfx950,256,480,7168,3072,fp8,fp8,flydsl,2468,1,20.3645,flydsl_mxpsh_64x128x256_F8_F8_B16_w3_x4_sk1,1038.05,1491.61,0.0
gfx950,256,480,7168,7168,fp8,fp8,flydsl,2460,1,41.4323,flydsl_mxpsh_64x128x256_F8_F8_B16_w2_x4_sk1,1190.5,1489.23,0.0
gfx950,256,480,7168,16384,fp8,fp8,flydsl,2925,2,81.46,flydsl_mxpsh_128x128x256_F8_F8_B16_w0_x4_sk2,1384.03,1622.71,0.0
gfx950,256,512,7168,384,fp8,fp8,flydsl,2436,1,7.527,flydsl_mxpsh_64x128x128_F8_F8_B16_w4_x4_sk1,374.46,1366.97,0.0
gfx950,256,512,7168,3072,fp8,fp8,flydsl,2460,1,20.4313,flydsl_mxpsh_64x128x256_F8_F8_B16_w2_x4_sk1,1103.63,1514.0,0.0
gfx950,256,512,7168,7168,fp8,fp8,flydsl,2468,1,41.7985,flydsl_mxpsh_64x128x256_F8_F8_B16_w3_x4_sk1,1258.74,1492.64,0.0
gfx950,256,512,7168,16384,fp8,fp8,flydsl,2925,2,86.2956,flydsl_mxpsh_128x128x256_F8_F8_B16_w0_x4_sk2,1393.57,1543.17,0.0
gfx950,256,544,7168,384,fp8,fp8,flydsl,2404,1,7.6597,flydsl_mxpsh_64x128x128_F8_F8_B16_w0_x4_sk1,390.97,1404.78,0.0
gfx950,256,544,7168,3072,fp8,fp8,flydsl,2452,1,21.337,flydsl_mxpsh_64x128x256_F8_F8_B16_w1_x4_sk1,1122.83,1475.84,0.0
gfx950,256,544,7168,7168,fp8,fp8,flydsl,2444,1,45.2455,flydsl_mxpsh_64x128x256_F8_F8_B16_w0_x4_sk1,1235.52,1394.14,0.0
gfx950,256,544,7168,16384,fp8,fp8,flydsl,2452,1,99.4787,flydsl_mxpsh_64x128x256_F8_F8_B16_w1_x4_sk1,1284.45,1348.55,0.0
gfx950,256,576,7168,384,fp8,fp8,flydsl,2412,1,7.8167,flydsl_mxpsh_64x128x128_F8_F8_B16_w1_x4_sk1,405.66,1436.83,0.0
gfx950,256,576,7168,3072,fp8,fp8,flydsl,2468,1,21.7692,flydsl_mxpsh_64x128x256_F8_F8_B16_w3_x4_sk1,1165.28,1472.13,0.0
gfx950,256,576,7168,7168,fp8,fp8,flydsl,2468,1,46.4106,flydsl_mxpsh_64x128x256_F8_F8_B16_w3_x4_sk1,1275.36,1373.96,0.0
gfx950,256,576,7168,16384,fp8,fp8,flydsl,2468,1,100.4573,flydsl_mxpsh_64x128x256_F8_F8_B16_w3_x4_sk1,1346.76,1345.2,0.0
gfx950,256,608,7168,384,fp8,fp8,flydsl,2652,1,8.1171,flydsl_mxpsh_96x128x128_F8_F8_B16_w1_x4_sk1,412.35,1441.68,0.0
gfx950,256,608,7168,3072,fp8,fp8,flydsl,2692,1,25.085,flydsl_mxpsh_96x128x256_F8_F8_B16_w1_x4_sk1,1067.43,1299.75,0.0
gfx950,256,608,7168,7168,fp8,fp8,flydsl,2716,1,54.0795,flydsl_mxpsh_96x128x256_F8_F8_B16_w4_x4_sk1,1155.31,1191.85,0.0
gfx950,256,608,7168,16384,fp8,fp8,flydsl,2692,1,108.0856,flydsl_mxpsh_96x128x256_F8_F8_B16_w1_x4_sk1,1321.25,1259.36,0.0
gfx950,256,640,7168,384,fp8,fp8,flydsl,2644,1,8.1763,flydsl_mxpsh_96x128x128_F8_F8_B16_w0_x4_sk1,430.91,1488.85,0.0
gfx950,256,640,7168,3072,fp8,fp8,flydsl,2684,1,25.052,flydsl_mxpsh_96x128x256_F8_F8_B16_w0_x4_sk1,1125.09,1323.7,0.0
gfx950,256,640,7168,7168,fp8,fp8,flydsl,2684,1,55.5562,flydsl_mxpsh_96x128x256_F8_F8_B16_w0_x4_sk1,1183.79,1172.56,0.0
gfx950,256,640,7168,16384,fp8,fp8,flydsl,2684,1,109.4904,flydsl_mxpsh_96x128x256_F8_F8_B16_w0_x4_sk1,1372.94,1252.18,0.0
gfx950,256,672,7168,384,fp8,fp8,flydsl,2644,1,8.3182,flydsl_mxpsh_96x128x128_F8_F8_B16_w0_x4_sk1,444.73,1520.08,0.0
gfx950,256,672,7168,3072,fp8,fp8,flydsl,2700,1,25.401,flydsl_mxpsh_96x128x256_F8_F8_B16_w2_x4_sk1,1165.11,1327.44,0.0
gfx950,256,672,7168,7168,fp8,fp8,flydsl,2684,1,56.4105,flydsl_mxpsh_96x128x256_F8_F8_B16_w0_x4_sk1,1224.15,1167.0,0.0
gfx950,256,672,7168,16384,fp8,fp8,flydsl,2692,1,110.7748,flydsl_mxpsh_96x128x256_F8_F8_B16_w1_x4_sk1,1424.87,1246.53,0.0
gfx950,256,704,7168,384,fp8,fp8,flydsl,2652,1,8.5571,flydsl_mxpsh_96x128x128_F8_F8_B16_w1_x4_sk1,452.9,1532.69,0.0
gfx950,256,704,7168,3072,fp8,fp8,flydsl,2700,1,25.1014,flydsl_mxpsh_96x128x256_F8_F8_B16_w2_x4_sk1,1235.16,1365.47,0.0
gfx950,256,704,7168,7168,fp8,fp8,flydsl,2716,1,54.7355,flydsl_mxpsh_96x128x256_F8_F8_B16_w4_x4_sk1,1321.69,1215.28,0.0
gfx950,256,704,7168,16384,fp8,fp8,flydsl,2692,1,110.4929,flydsl_mxpsh_96x128x256_F8_F8_B16_w1_x4_sk1,1496.53,1258.61,0.0
gfx950,256,736,7168,384,fp8,fp8,flydsl,2668,1,8.6879,flydsl_mxpsh_96x128x128_F8_F8_B16_w3_x4_sk1,466.36,1563.83,0.0
gfx950,256,736,7168,3072,fp8,fp8,flydsl,2716,1,25.3487,flydsl_mxpsh_96x128x256_F8_F8_B16_w4_x4_sk1,1278.71,1374.13,0.0
gfx950,256,736,7168,7168,fp8,fp8,flydsl,2716,1,54.2884,flydsl_mxpsh_96x128x256_F8_F8_B16_w4_x4_sk1,1393.15,1237.97,0.0
gfx950,256,736,7168,16384,fp8,fp8,flydsl,2700,1,111.0244,flydsl_mxpsh_96x128x256_F8_F8_B16_w2_x4_sk1,1557.07,1261.44,0.0
gfx950,256,768,7168,384,fp8,fp8,flydsl,2644,1,8.8476,flydsl_mxpsh_96x128x128_F8_F8_B16_w0_x4_sk1,477.85,1588.85,0.0
gfx950,256,768,7168,3072,fp8,fp8,flydsl,2684,1,25.692,flydsl_mxpsh_96x128x256_F8_F8_B16_w0_x4_sk1,1316.47,1377.45,0.0
gfx950,256,768,7168,7168,fp8,fp8,flydsl,2716,1,56.1015,flydsl_mxpsh_96x128x256_F8_F8_B16_w4_x4_sk1,1406.74,1210.22,0.0
gfx950,256,768,7168,16384,fp8,fp8,flydsl,2684,1,111.6893,flydsl_mxpsh_96x128x256_F8_F8_B16_w0_x4_sk1,1615.09,1262.73,0.0
gfx950,256,800,7168,384,fp8,fp8,flydsl,2660,1,9.0399,flydsl_mxpsh_96x128x128_F8_F8_B16_w2_x4_sk1,487.18,1607.15,0.0
gfx950,256,800,7168,3072,fp8,fp8,flydsl,2684,1,26.459,flydsl_mxpsh_96x128x256_F8_F8_B16_w0_x4_sk1,1331.58,1358.57,0.0
gfx950,256,800,7168,7168,fp8,fp8,flydsl,2684,1,59.2351,flydsl_mxpsh_96x128x256_F8_F8_B16_w0_x4_sk1,1387.83,1157.82,0.0
gfx950,256,800,7168,16384,fp8,fp8,flydsl,2716,1,119.7921,flydsl_mxpsh_96x128x256_F8_F8_B16_w4_x4_sk1,1568.59,1185.52,0.0
gfx950,256,832,7168,384,fp8,fp8,flydsl,2652,1,9.1932,flydsl_mxpsh_96x128x128_F8_F8_B16_w1_x4_sk1,498.21,1631.59,0.0
gfx950,256,832,7168,3072,fp8,fp8,flydsl,2716,1,26.861,flydsl_mxpsh_96x128x256_F8_F8_B16_w4_x4_sk1,1364.11,1358.98,0.0
gfx950,256,832,7168,7168,fp8,fp8,flydsl,2684,1,60.6088,flydsl_mxpsh_96x128x256_F8_F8_B16_w0_x4_sk1,1410.63,1142.93,0.0
gfx950,256,832,7168,16384,fp8,fp8,flydsl,2684,1,120.9325,flydsl_mxpsh_96x128x256_F8_F8_B16_w0_x4_sk1,1615.95,1182.47,0.0
gfx950,256,864,7168,384,fp8,fp8,flydsl,2652,1,9.352,flydsl_mxpsh_96x128x128_F8_F8_B16_w1_x4_sk1,508.59,1654.25,0.0
gfx950,256,864,7168,3072,fp8,fp8,flydsl,2684,1,26.9412,flydsl_mxpsh_96x128x256_F8_F8_B16_w0_x4_sk1,1412.36,1375.61,0.0
gfx950,256,864,7168,7168,fp8,fp8,flydsl,2716,1,60.2147,flydsl_mxpsh_96x128x256_F8_F8_B16_w4_x4_sk1,1474.47,1161.84,0.0
gfx950,256,864,7168,16384,fp8,fp8,flydsl,2692,1,123.2013,flydsl_mxpsh_96x128x256_F8_F8_B16_w1_x4_sk1,1647.2,1168.68,0.0
gfx950,256,896,7168,384,fp8,fp8,flydsl,2884,1,9.6346,flydsl_mxpsh_128x128x128_F8_F8_B16_w0_x4_sk1,511.96,1654.62,0.0
gfx950,256,896,7168,3072,fp8,fp8,flydsl,2940,1,28.5096,flydsl_mxpsh_128x128x256_F8_F8_B16_w2_x4_sk1,1384.1,1319.47,0.0
gfx950,256,896,7168,7168,fp8,fp8,flydsl,2948,1,62.6104,flydsl_mxpsh_128x128x256_F8_F8_B16_w3_x4_sk1,1470.58,1128.37,0.0
gfx950,256,896,7168,16384,fp8,fp8,flydsl,2956,1,136.3698,flydsl_mxpsh_128x128x256_F8_F8_B16_w4_x4_sk1,1543.26,1063.03,0.0
gfx950,256,928,7168,384,fp8,fp8,flydsl,2484,1,9.9723,flydsl_mxpsh_64x256x128_F8_F8_B16_w0_x4_sk1,512.29,1645.83,0.0
gfx950,256,928,7168,3072,fp8,fp8,flydsl,2924,1,28.7461,flydsl_mxpsh_128x128x256_F8_F8_B16_w0_x4_sk1,1421.73,1328.0,0.0
gfx950,256,928,7168,7168,fp8,fp8,flydsl,2932,1,63.5816,flydsl_mxpsh_128x128x256_F8_F8_B16_w1_x4_sk1,1499.83,1121.96,0.0
gfx950,256,928,7168,16384,fp8,fp8,flydsl,2940,1,135.1478,flydsl_mxpsh_128x128x256_F8_F8_B16_w2_x4_sk1,1612.82,1079.92,0.0
gfx950,256,960,7168,384,fp8,fp8,flydsl,2884,1,9.9012,flydsl_mxpsh_128x128x128_F8_F8_B16_w0_x4_sk1,533.76,1705.22,0.0
gfx950,256,960,7168,3072,fp8,fp8,flydsl,2948,1,29.0711,flydsl_mxpsh_128x128x256_F8_F8_B16_w3_x4_sk1,1454.32,1332.31,0.0
gfx950,256,960,7168,7168,fp8,fp8,flydsl,2940,1,64.6732,flydsl_mxpsh_128x128x256_F8_F8_B16_w2_x4_sk1,1525.36,1113.66,0.0
gfx950,256,960,7168,16384,fp8,fp8,flydsl,2924,1,135.8778,flydsl_mxpsh_128x128x256_F8_F8_B16_w0_x4_sk1,1659.47,1081.35,0.0
gfx950,256,992,7168,384,fp8,fp8,flydsl,2884,1,10.011,flydsl_mxpsh_128x128x128_F8_F8_B16_w0_x4_sk1,545.5,1733.57,0.0
gfx950,256,992,7168,3072,fp8,fp8,flydsl,2940,1,29.1488,flydsl_mxpsh_128x128x256_F8_F8_B16_w2_x4_sk1,1498.79,1347.87,0.0
gfx950,256,992,7168,7168,fp8,fp8,flydsl,2948,1,65.2192,flydsl_mxpsh_128x128x256_F8_F8_B16_w3_x4_sk1,1563.01,1114.89,0.0
gfx950,256,992,7168,16384,fp8,fp8,flydsl,2908,1,140.3403,flydsl_mxpsh_128x128x128_F8_F8_B16_w3_x4_sk1,1660.26,1053.97,0.0
gfx950,256,1024,7168,384,fp8,fp8,flydsl,2892,1,10.0981,flydsl_mxpsh_128x128x128_F8_F8_B16_w1_x4_sk1,558.24,1765.26,0.0
gfx950,256,1024,7168,3072,fp8,fp8,flydsl,2956,1,29.6455,flydsl_mxpsh_128x128x256_F8_F8_B16_w4_x4_sk1,1521.21,1344.08,0.0
gfx950,256,1024,7168,7168,fp8,fp8,flydsl,2940,1,66.0876,flydsl_mxpsh_128x128x256_F8_F8_B16_w2_x4_sk1,1592.23,1110.65,0.0
gfx950,256,1024,7168,16384,fp8,fp8,flydsl,2924,1,139.9787,flydsl_mxpsh_128x128x256_F8_F8_B16_w0_x4_sk1,1718.25,1063.72,0.0
gfx950,256,1088,7168,384,fp8,fp8,flydsl,2500,1,10.4683,flydsl_mxpsh_64x256x128_F8_F8_B16_w2_x4_sk1,572.15,1792.83,0.0
gfx950,256,1088,7168,3072,fp8,fp8,flydsl,2956,1,30.6123,flydsl_mxpsh_128x128x256_F8_F8_B16_w4_x4_sk1,1565.24,1338.02,0.0
gfx950,256,1088,7168,7168,fp8,fp8,flydsl,2948,1,68.6732,flydsl_mxpsh_128x128x256_F8_F8_B16_w3_x4_sk1,1628.05,1088.88,0.0
gfx950,256,1088,7168,16384,fp8,fp8,flydsl,2924,1,148.5264,flydsl_mxpsh_128x128x256_F8_F8_B16_w0_x4_sk1,1720.57,1015.74,0.0
gfx950,256,1152,7168,384,fp8,fp8,flydsl,2892,1,10.6622,flydsl_mxpsh_128x128x128_F8_F8_B16_w1_x4_sk1,594.79,1848.58,0.0
gfx950,256,1152,7168,3072,fp8,fp8,flydsl,2940,1,30.9395,flydsl_mxpsh_128x128x256_F8_F8_B16_w2_x4_sk1,1639.79,1359.88,0.0
gfx950,256,1152,7168,7168,fp8,fp8,flydsl,2948,1,70.5876,flydsl_mxpsh_128x128x256_F8_F8_B16_w3_x4_sk1,1677.07,1078.84,0.0
gfx950,256,1152,7168,16384,fp8,fp8,flydsl,2940,1,149.3749,flydsl_mxpsh_128x128x256_F8_F8_B16_w2_x4_sk1,1811.44,1023.13,0.0
gfx950,256,1216,7168,384,fp8,fp8,flydsl,2652,1,11.0787,flydsl_mxpsh_96x128x128_F8_F8_B16_w1_x4_sk1,604.23,1864.12,0.0
gfx950,256,1216,7168,3072,fp8,fp8,flydsl,2668,1,35.2899,flydsl_mxpsh_96x128x128_F8_F8_B16_w3_x4_sk1,1517.51,1223.81,0.0
gfx950,256,1216,7168,7168,fp8,fp8,flydsl,2668,1,79.6505,flydsl_mxpsh_96x128x128_F8_F8_B16_w3_x4_sk1,1568.81,973.37,0.0
gfx950,256,1216,7168,16384,fp8,fp8,flydsl,2652,1,166.1377,flydsl_mxpsh_96x128x128_F8_F8_B16_w1_x4_sk1,1719.15,931.73,0.0
gfx950,256,1280,7168,384,fp8,fp8,flydsl,2732,1,11.6693,flydsl_mxpsh_96x256x128_F8_F8_B16_w1_x4_sk1,603.84,1850.51,0.0
gfx950,256,1280,7168,3072,fp8,fp8,flydsl,2908,1,40.343,flydsl_mxpsh_128x128x128_F8_F8_B16_w3_x4_sk1,1397.3,1098.14,0.0
gfx950,256,1280,7168,7168,fp8,fp8,flydsl,2892,1,86.9558,flydsl_mxpsh_128x128x128_F8_F8_B16_w1_x4_sk1,1512.65,907.42,0.0
gfx950,256,1280,7168,16384,fp8,fp8,flydsl,2908,1,182.7923,flydsl_mxpsh_128x128x128_F8_F8_B16_w3_x4_sk1,1644.75,857.6,0.0
gfx950,256,1344,7168,384,fp8,fp8,flydsl,2900,1,11.7284,flydsl_mxpsh_128x128x128_F8_F8_B16_w2_x4_sk1,630.84,1921.51,0.0
gfx950,256,1344,7168,3072,fp8,fp8,flydsl,2900,1,40.2916,flydsl_mxpsh_128x128x128_F8_F8_B16_w2_x4_sk1,1469.04,1127.19,0.0
gfx950,256,1344,7168,7168,fp8,fp8,flydsl,2892,1,88.6282,flydsl_mxpsh_128x128x128_F8_F8_B16_w1_x4_sk1,1558.31,905.82,0.0
gfx950,256,1344,7168,16384,fp8,fp8,flydsl,2908,1,192.7984,flydsl_mxpsh_128x128x128_F8_F8_B16_w3_x4_sk1,1637.36,823.29,0.0
gfx950,256,1408,7168,384,fp8,fp8,flydsl,2724,1,12.0085,flydsl_mxpsh_96x256x128_F8_F8_B16_w0_x4_sk1,645.47,1955.14,0.0
gfx950,256,1408,7168,3072,fp8,fp8,flydsl,2908,1,40.1819,flydsl_mxpsh_128x128x128_F8_F8_B16_w3_x4_sk1,1543.2,1158.0,0.0
gfx950,256,1408,7168,7168,fp8,fp8,flydsl,2908,1,90.0019,flydsl_mxpsh_128x128x128_F8_F8_B16_w3_x4_sk1,1607.6,907.29,0.0
gfx950,256,1408,7168,16384,fp8,fp8,flydsl,2908,1,192.0068,flydsl_mxpsh_128x128x128_F8_F8_B16_w3_x4_sk1,1722.4,836.92,0.0
gfx950,256,1472,7168,384,fp8,fp8,flydsl,2884,1,12.0658,flydsl_mxpsh_128x128x128_F8_F8_B16_w0_x4_sk1,671.6,2023.93,0.0
gfx950,256,1472,7168,3072,fp8,fp8,flydsl,2908,1,40.9149,flydsl_mxpsh_128x128x128_F8_F8_B16_w3_x4_sk1,1584.44,1164.48,0.0
gfx950,256,1472,7168,7168,fp8,fp8,flydsl,2892,1,88.963,flydsl_mxpsh_128x128x128_F8_F8_B16_w1_x4_sk1,1700.3,933.36,0.0
gfx950,256,1472,7168,16384,fp8,fp8,flydsl,2908,1,192.786,flydsl_mxpsh_128x128x128_F8_F8_B16_w3_x4_sk1,1793.41,843.74,0.0
gfx950,256,1536,7168,384,fp8,fp8,flydsl,2884,1,12.2547,flydsl_mxpsh_128x128x128_F8_F8_B16_w0_x4_sk1,690.0,2069.61,0.0
gfx950,256,1536,7168,3072,fp8,fp8,flydsl,2884,1,42.2947,flydsl_mxpsh_128x128x128_F8_F8_B16_w0_x4_sk1,1599.39,1152.83,0.0
gfx950,256,1536,7168,7168,fp8,fp8,flydsl,2900,1,90.2497,flydsl_mxpsh_128x128x128_F8_F8_B16_w2_x4_sk1,1748.93,935.3,0.0
gfx950,256,1536,7168,16384,fp8,fp8,flydsl,2908,1,192.3173,flydsl_mxpsh_128x128x128_F8_F8_B16_w3_x4_sk1,1875.95,856.01,0.0
gfx950,256,1600,7168,384,fp8,fp8,flydsl,2892,1,12.4674,flydsl_mxpsh_128x128x128_F8_F8_B16_w1_x4_sk1,706.49,2109.86,0.0
gfx950,256,1600,7168,3072,fp8,fp8,flydsl,2908,1,44.5486,flydsl_mxpsh_128x128x128_F8_F8_B16_w3_x4_sk1,1581.74,1119.52,0.0
gfx950,256,1600,7168,7168,fp8,fp8,flydsl,2900,1,94.0934,flydsl_mxpsh_128x128x128_F8_F8_B16_w2_x4_sk1,1747.38,911.72,0.0
gfx950,256,1600,7168,16384,fp8,fp8,flydsl,2908,1,204.6406,flydsl_mxpsh_128x128x128_F8_F8_B16_w3_x4_sk1,1836.44,814.07,0.0
gfx950,256,1664,7168,384,fp8,fp8,flydsl,2900,1,12.7054,flydsl_mxpsh_128x128x128_F8_F8_B16_w2_x4_sk1,720.98,2144.49,0.0
gfx950,256,1664,7168,3072,fp8,fp8,flydsl,2908,1,43.3094,flydsl_mxpsh_128x128x128_F8_F8_B16_w3_x4_sk1,1692.08,1177.27,0.0
gfx950,256,1664,7168,7168,fp8,fp8,flydsl,2908,1,96.3243,flydsl_mxpsh_128x128x128_F8_F8_B16_w3_x4_sk1,1775.18,904.89,0.0
gfx950,256,1664,7168,16384,fp8,fp8,flydsl,2908,1,203.7152,flydsl_mxpsh_128x128x128_F8_F8_B16_w3_x4_sk1,1918.57,827.42,0.0
gfx950,256,1728,7168,384,fp8,fp8,flydsl,2484,1,13.0258,flydsl_mxpsh_64x256x128_F8_F8_B16_w0_x4_sk1,730.3,2164.06,0.0
gfx950,256,1728,7168,3072,fp8,fp8,flydsl,2740,1,46.5182,flydsl_mxpsh_96x256x128_F8_F8_B16_w2_x4_sk1,1635.95,1120.02,0.0
gfx950,256,1728,7168,7168,fp8,fp8,flydsl,2732,1,97.9803,flydsl_mxpsh_96x256x128_F8_F8_B16_w1_x4_sk1,1812.3,903.64,0.0
gfx950,256,1728,7168,16384,fp8,fp8,flydsl,2724,1,213.4661,flydsl_mxpsh_96x256x128_F8_F8_B16_w0_x4_sk1,1901.35,798.84,0.0
gfx950,256,1792,7168,384,fp8,fp8,flydsl,2644,1,14.3549,flydsl_mxpsh_96x128x128_F8_F8_B16_w0_x4_sk1,687.22,2029.32,0.0
gfx950,256,1792,7168,3072,fp8,fp8,flydsl,2980,1,50.8031,flydsl_mxpsh_128x256x128_F8_F8_B16_w2_x4_sk1,1553.45,1047.48,0.0
gfx950,256,1792,7168,7168,fp8,fp8,flydsl,2972,1,108.4736,flydsl_mxpsh_128x256x128_F8_F8_B16_w1_x4_sk1,1697.62,828.91,0.0
gfx950,256,1792,7168,16384,fp8,fp8,flydsl,2964,1,227.9552,flydsl_mxpsh_128x256x128_F8_F8_B16_w0_x4_sk1,1846.45,756.69,0.0
gfx950,256,1856,7168,384,fp8,fp8,flydsl,2660,1,14.5725,flydsl_mxpsh_96x128x128_F8_F8_B16_w2_x4_sk1,701.14,2063.67,0.0
gfx950,256,1856,7168,3072,fp8,fp8,flydsl,2980,1,51.7071,flydsl_mxpsh_128x256x128_F8_F8_B16_w2_x4_sk1,1580.8,1050.71,0.0
gfx950,256,1856,7168,7168,fp8,fp8,flydsl,2972,1,111.7005,flydsl_mxpsh_128x256x128_F8_F8_B16_w1_x4_sk1,1707.45,817.29,0.0
gfx950,256,1856,7168,16384,fp8,fp8,flydsl,2972,1,242.0371,flydsl_mxpsh_128x256x128_F8_F8_B16_w1_x4_sk1,1801.13,720.79,0.0
gfx950,256,1920,7168,384,fp8,fp8,flydsl,2660,1,14.6168,flydsl_mxpsh_96x128x128_F8_F8_B16_w2_x4_sk1,723.12,2121.87,0.0
gfx950,256,1920,7168,3072,fp8,fp8,flydsl,2980,1,51.7591,flydsl_mxpsh_128x256x128_F8_F8_B16_w2_x4_sk1,1633.67,1071.18,0.0
gfx950,256,1920,7168,7168,fp8,fp8,flydsl,2964,1,111.1857,flydsl_mxpsh_128x256x128_F8_F8_B16_w0_x4_sk1,1774.51,833.45,0.0
gfx950,256,1920,7168,16384,fp8,fp8,flydsl,2980,1,243.6805,flydsl_mxpsh_128x256x128_F8_F8_B16_w2_x4_sk1,1850.67,723.99,0.0
gfx950,256,1984,7168,384,fp8,fp8,flydsl,2900,1,14.727,flydsl_mxpsh_128x128x128_F8_F8_B16_w2_x4_sk1,741.63,2169.96,0.0
gfx950,256,1984,7168,3072,fp8,fp8,flydsl,2972,1,51.6707,flydsl_mxpsh_128x256x128_F8_F8_B16_w1_x4_sk1,1691.01,1094.58,0.0
gfx950,256,1984,7168,7168,fp8,fp8,flydsl,2980,1,109.6609,flydsl_mxpsh_128x256x128_F8_F8_B16_w2_x4_sk1,1859.16,857.59,0.0
gfx950,256,1984,7168,16384,fp8,fp8,flydsl,2964,1,230.9268,flydsl_mxpsh_128x256x128_F8_F8_B16_w0_x4_sk1,2017.97,772.49,0.0
gfx950,256,2048,7168,384,fp8,fp8,flydsl,2884,1,14.8942,flydsl_mxpsh_128x128x128_F8_F8_B16_w0_x4_sk1,756.96,2208.85,0.0
gfx950,256,2048,7168,3072,fp8,fp8,flydsl,2964,1,52.2443,flydsl_mxpsh_128x256x128_F8_F8_B16_w0_x4_sk1,1726.4,1103.88,0.0
gfx950,256,2048,7168,7168,fp8,fp8,flydsl,2980,1,111.2517,flydsl_mxpsh_128x256x128_F8_F8_B16_w2_x4_sk1,1891.69,857.7,0.0
gfx950,256,2048,7168,16384,fp8,fp8,flydsl,2980,1,232.686,flydsl_mxpsh_128x256x128_F8_F8_B16_w2_x4_sk1,2067.32,775.1,0.0
gfx950,256,4096,7168,384,fp8,fp8,flydsl,2492,1,23.4489,flydsl_mxpsh_64x256x128_F8_F8_B16_w1_x4_sk1,961.6,2688.64,0.0
gfx950,256,4096,7168,3072,fp8,fp8,flydsl,2964,1,94.1915,flydsl_mxpsh_128x256x128_F8_F8_B16_w0_x4_sk1,1915.13,990.78,0.0
gfx950,256,4096,7168,7168,fp8,fp8,flydsl,2964,1,191.6491,flydsl_mxpsh_128x256x128_F8_F8_B16_w0_x4_sk1,2196.24,727.69,0.0
gfx950,256,4096,7168,16384,fp8,fp8,flydsl,2964,1,423.0779,flydsl_mxpsh_128x256x128_F8_F8_B16_w0_x4_sk1,2273.98,575.0,0.0
gfx950,256,6144,7168,384,fp8,fp8,flydsl,2732,1,32.1684,flydsl_mxpsh_96x256x128_F8_F8_B16_w1_x4_sk1,1051.43,2897.01,0.0
gfx950,256,6144,7168,3072,fp8,fp8,flydsl,2980,1,135.8024,flydsl_mxpsh_128x256x128_F8_F8_B16_w2_x4_sk1,1992.48,949.72,0.0
gfx950,256,6144,7168,7168,fp8,fp8,flydsl,2964,1,274.1378,flydsl_mxpsh_128x256x128_F8_F8_B16_w0_x4_sk1,2303.08,669.37,0.0
gfx950,256,6144,7168,16384,fp8,fp8,flydsl,2964,1,618.3914,flydsl_mxpsh_128x256x128_F8_F8_B16_w0_x4_sk1,2333.65,495.13,0.0
gfx950,256,8192,7168,384,fp8,fp8,flydsl,2740,1,42.3879,flydsl_mxpsh_96x256x128_F8_F8_B16_w2_x4_sk1,1063.92,2909.76,0.0
gfx950,256,8192,7168,3072,fp8,fp8,flydsl,2980,1,163.052,flydsl_mxpsh_128x256x128_F8_F8_B16_w2_x4_sk1,2212.65,1009.66,0.0
gfx950,256,8192,7168,7168,fp8,fp8,flydsl,2964,1,341.219,flydsl_mxpsh_128x256x128_F8_F8_B16_w0_x4_sk1,2467.08,666.85,0.0
gfx950,256,8192,7168,16384,fp8,fp8,flydsl,2968,1,758.0882,flydsl_mxpsh_128x256x128_F8_F8_B16_w1_x0_sk1,2538.15,486.88,0.0
gfx950,256,10240,7168,384,fp8,fp8,flydsl,2724,1,52.3916,flydsl_mxpsh_96x256x128_F8_F8_B16_w0_x4_sk1,1075.96,2929.58,0.0
gfx950,256,10240,7168,3072,fp8,fp8,flydsl,2972,1,200.7279,flydsl_mxpsh_128x256x128_F8_F8_B16_w1_x4_sk1,2246.68,997.76,0.0
gfx950,256,10240,7168,7168,fp8,fp8,flydsl,2972,1,428.8583,flydsl_mxpsh_128x256x128_F8_F8_B16_w1_x4_sk1,2453.65,633.27,0.0
gfx950,256,10240,7168,16384,fp8,fp8,flydsl,2968,1,968.9149,flydsl_mxpsh_128x256x128_F8_F8_B16_w1_x0_sk1,2482.35,445.87,0.0
gfx950,256,12288,7168,384,fp8,fp8,flydsl,2732,1,60.4233,flydsl_mxpsh_96x256x128_F8_F8_B16_w1_x4_sk1,1119.53,3039.09,0.0
gfx950,256,12288,7168,3072,fp8,fp8,flydsl,2980,1,238.372,flydsl_mxpsh_128x256x128_F8_F8_B16_w2_x4_sk1,2270.26,989.75,0.0
gfx950,256,12288,7168,7168,fp8,fp8,flydsl,2972,1,516.7663,flydsl_mxpsh_128x256x128_F8_F8_B16_w1_x4_sk1,2443.5,610.76,0.0
gfx950,256,12288,7168,16384,fp8,fp8,flydsl,2976,1,1207.1804,flydsl_mxpsh_128x256x128_F8_F8_B16_w2_x0_sk1,2390.88,409.99,0.0
gfx950,256,14336,7168,384,fp8,fp8,flydsl,2732,1,68.9811,flydsl_mxpsh_96x256x128_F8_F8_B16_w1_x4_sk1,1144.08,3099.09,0.0
gfx950,256,14336,7168,3072,fp8,fp8,flydsl,2964,1,277.2161,flydsl_mxpsh_128x256x128_F8_F8_B16_w0_x4_sk1,2277.5,979.67,0.0
gfx950,256,14336,7168,7168,fp8,fp8,flydsl,2964,1,598.2099,flydsl_mxpsh_128x256x128_F8_F8_B16_w0_x4_sk1,2462.64,601.23,0.0
gfx950,256,14336,7168,16384,fp8,fp8,flydsl,2976,1,1438.5701,flydsl_mxpsh_128x256x128_F8_F8_B16_w2_x0_sk1,2340.7,387.78,0.0
gfx950,256,16384,7168,384,fp8,fp8,flydsl,2732,1,79.188,flydsl_mxpsh_96x256x128_F8_F8_B16_w1_x4_sk1,1138.99,3080.33,0.0
gfx950,256,16384,7168,3072,fp8,fp8,flydsl,2980,1,307.3384,flydsl_mxpsh_128x256x128_F8_F8_B16_w2_x4_sk1,2347.75,999.66,0.0
gfx950,256,16384,7168,7168,fp8,fp8,flydsl,2972,1,683.9309,flydsl_mxpsh_128x256x128_F8_F8_B16_w1_x4_sk1,2461.69,590.27,0.0
gfx950,256,16384,7168,16384,fp8,fp8,flydsl,2968,1,1663.4666,flydsl_mxpsh_128x256x128_F8_F8_B16_w1_x0_sk1,2313.42,373.17,0.0
gfx950,256,20480,7168,3072,fp8,fp8,flydsl,2980,1,386.6006,flydsl_mxpsh_128x256x128_F8_F8_B16_w2_x4_sk1,2333.01,979.14,0.0
gfx950,256,20480,7168,7168,fp8,fp8,flydsl,2980,1,858.5799,flydsl_mxpsh_128x256x128_F8_F8_B16_w2_x4_sk1,2451.18,572.79,0.0
gfx950,256,20480,7168,16384,fp8,fp8,flydsl,2972,1,2184.5334,flydsl_mxpsh_128x256x128_F8_F8_B16_w1_x4_sk1,2202.01,341.76,0.0
gfx950,256,24576,7168,3072,fp8,fp8,flydsl,2980,1,455.998,flydsl_mxpsh_128x256x128_F8_F8_B16_w2_x4_sk1,2373.54,986.49,0.0
gfx950,256,24576,7168,7168,fp8,fp8,flydsl,2976,1,1059.1401,flydsl_mxpsh_128x256x128_F8_F8_B16_w2_x0_sk1,2384.43,547.48,0.0
gfx950,256,24576,7168,16384,fp8,fp8,flydsl,2980,1,2566.1931,flydsl_mxpsh_128x256x128_F8_F8_B16_w2_x4_sk1,2249.42,339.96,0.0
gfx950,256,28672,7168,3072,fp8,fp8,flydsl,2972,1,530.3466,flydsl_mxpsh_128x256x128_F8_F8_B16_w1_x4_sk1,2380.93,982.64,0.0
gfx950,256,28672,7168,7168,fp8,fp8,flydsl,2976,1,1232.4276,flydsl_mxpsh_128x256x128_F8_F8_B16_w2_x0_sk1,2390.69,541.97,0.0
gfx950,256,28672,7168,16384,fp8,fp8,flydsl,2980,1,3059.7688,flydsl_mxpsh_128x256x128_F8_F8_B16_w2_x4_sk1,2200.99,326.25,0.0
gfx950,256,32768,7168,384,fp8,fp8,flydsl,2740,1,157.515,flydsl_mxpsh_96x256x128_F8_F8_B16_w2_x4_sk1,1145.22,3079.69,0.0
gfx950,256,32768,7168,3072,fp8,fp8,flydsl,2972,1,603.9229,flydsl_mxpsh_128x256x128_F8_F8_B16_w1_x4_sk1,2389.56,981.0,0.0
gfx950,256,32768,7168,7168,fp8,fp8,flydsl,2964,1,1461.6015,flydsl_mxpsh_128x256x128_F8_F8_B16_w0_x4_sk1,2303.81,517.26,0.0
gfx950,256,32768,7168,16384,fp8,fp8,flydsl,2972,1,3434.0172,flydsl_mxpsh_128x256x128_F8_F8_B16_w1_x4_sk1,2241.28,327.33,0.0
gfx950,256,40960,7168,3072,fp8,fp8,flydsl,2972,1,759.8904,flydsl_mxpsh_128x256x128_F8_F8_B16_w1_x4_sk1,2373.88,967.31,0.0
gfx950,256,40960,7168,7168,fp8,fp8,flydsl,2964,1,1848.5805,flydsl_mxpsh_128x256x128_F8_F8_B16_w0_x4_sk1,2276.92,504.27,0.0
gfx950,256,40960,7168,16384,fp8,fp8,flydsl,2964,1,4263.1552,flydsl_mxpsh_128x256x128_F8_F8_B16_w0_x4_sk1,2256.72,322.7,0.0
gfx950,256,49152,7168,3072,fp8,fp8,flydsl,2964,1,938.4363,flydsl_mxpsh_128x256x128_F8_F8_B16_w0_x4_sk1,2306.67,935.23,0.0
gfx950,256,49152,7168,7168,fp8,fp8,flydsl,2972,1,2218.1138,flydsl_mxpsh_128x256x128_F8_F8_B16_w1_x4_sk1,2277.11,499.68,0.0
gfx950,256,49152,7168,16384,fp8,fp8,flydsl,2980,1,5103.5192,flydsl_mxpsh_128x256x128_F8_F8_B16_w2_x4_sk1,2262.14,318.88,0.0
gfx950,256,57344,7168,3072,fp8,fp8,flydsl,2968,1,1104.4591,flydsl_mxpsh_128x256x128_F8_F8_B16_w1_x0_sk1,2286.59,923.77,0.0
gfx950,256,57344,7168,7168,fp8,fp8,flydsl,2972,1,2584.0939,flydsl_mxpsh_128x256x128_F8_F8_B16_w1_x4_sk1,2280.37,497.08,0.0
gfx950,256,57344,7168,16384,fp8,fp8,flydsl,2980,1,6004.0379,flydsl_mxpsh_128x256x128_F8_F8_B16_w2_x4_sk1,2243.33,312.96,0.0
gfx950,256,65536,7168,3072,fp8,fp8,flydsl,2972,1,1291.0896,flydsl_mxpsh_128x256x128_F8_F8_B16_w1_x4_sk1,2235.49,900.69,0.0
gfx950,256,65536,7168,7168,fp8,fp8,flydsl,2964,1,2963.2798,flydsl_mxpsh_128x256x128_F8_F8_B16_w0_x4_sk1,2272.65,492.92,0.0
gfx950,256,65536,7168,16384,fp8,fp8,flydsl,2972,1,6822.9934,flydsl_mxpsh_128x256x128_F8_F8_B16_w1_x4_sk1,2256.07,312.28,0.0
gfx950,256,1,16384,1536,fp8,fp8,flydsl,2236,1,9.6791,flydsl_mxpsh_32x128x256_F8_F8_B16_w4_x4_sk1,5.2,2603.56,0.0
gfx950,256,4,16384,1536,fp8,fp8,flydsl,2204,1,9.8349,flydsl_mxpsh_32x128x256_F8_F8_B16_w0_x4_sk1,20.47,2572.78,0.0
gfx950,256,8,16384,1536,fp8,fp8,flydsl,2200,1,9.9177,flydsl_mxpsh_32x128x256_F8_F8_B16_w0_x0_sk1,40.6,2565.14,0.0
gfx950,256,16,16384,1536,fp8,fp8,flydsl,2236,1,9.929,flydsl_mxpsh_32x128x256_F8_F8_B16_w4_x4_sk1,81.11,2589.86,0.0
gfx950,256,1,65536,1536,fp8,fp8,flydsl,2216,1,19.048,flydsl_mxpsh_32x128x256_F8_F8_B16_w2_x0_sk1,10.57,5291.68,0.0
gfx950,256,2,65536,1536,fp8,fp8,flydsl,2160,1,19.5062,flydsl_mxpsh_32x128x128_F8_F8_B16_w0_x0_sk1,20.64,5174.18,0.0
gfx950,256,4,65536,1536,fp8,fp8,flydsl,2236,1,19.4057,flydsl_mxpsh_32x128x256_F8_F8_B16_w4_x4_sk1,41.5,5214.64,0.0
gfx950,256,8,65536,1536,fp8,fp8,flydsl,2232,1,19.6525,flydsl_mxpsh_32x128x256_F8_F8_B16_w4_x0_sk1,81.95,5176.14,0.0
gfx950,256,16,65536,1536,fp8,fp8,flydsl,2216,1,20.0668,flydsl_mxpsh_32x128x256_F8_F8_B16_w2_x0_sk1,160.53,5122.14,0.0
gfx950,256,32,65536,1536,fp8,fp8,flydsl,2224,1,20.802,flydsl_mxpsh_32x128x256_F8_F8_B16_w3_x0_sk1,309.7,5043.11,0.0
gfx950,256,48,65536,1536,fp8,fp8,flydsl,2660,1,22.5467,flydsl_mxpsh_96x128x128_F8_F8_B16_w2_x4_sk1,428.61,4746.97,0.0
gfx950,256,64,65536,1536,fp8,fp8,flydsl,2668,1,23.4935,flydsl_mxpsh_96x128x128_F8_F8_B16_w3_x4_sk1,548.45,4645.97,0.0
gfx950,256,80,65536,1536,fp8,fp8,flydsl,2656,1,24.3071,flydsl_mxpsh_96x128x128_F8_F8_B16_w2_x0_sk1,662.61,4577.75,0.0
gfx950,256,96,65536,1536,fp8,fp8,flydsl,2712,1,25.317,flydsl_mxpsh_96x128x256_F8_F8_B16_w4_x0_sk1,763.41,4478.95,0.0
gfx950,256,112,65536,1536,fp8,fp8,flydsl,2928,1,26.7314,flydsl_mxpsh_128x128x256_F8_F8_B16_w1_x0_sk1,843.52,4321.34,0.0
gfx950,256,128,65536,1536,fp8,fp8,flydsl,2944,1,27.1162,flydsl_mxpsh_128x128x256_F8_F8_B16_w3_x0_sk1,950.35,4338.26,0.0
gfx950,256,144,65536,1536,fp8,fp8,flydsl,2732,1,31.4144,flydsl_mxpsh_96x256x128_F8_F8_B16_w1_x4_sk1,922.86,3812.23,0.0
gfx950,256,160,65536,1536,fp8,fp8,flydsl,2740,1,32.6178,flydsl_mxpsh_96x256x128_F8_F8_B16_w2_x4_sk1,987.57,3736.63,0.0
gfx950,256,176,65536,1536,fp8,fp8,flydsl,2724,1,33.323,flydsl_mxpsh_96x256x128_F8_F8_B16_w0_x4_sk1,1063.33,3721.22,0.0
gfx950,256,192,65536,1536,fp8,fp8,flydsl,2740,1,34.1973,flydsl_mxpsh_96x256x128_F8_F8_B16_w2_x4_sk1,1130.34,3688.13,0.0
gfx950,256,208,65536,1536,fp8,fp8,flydsl,2964,1,35.6901,flydsl_mxpsh_128x256x128_F8_F8_B16_w0_x4_sk1,1173.32,3593.31,0.0
gfx950,256,224,65536,1536,fp8,fp8,flydsl,2964,1,36.6318,flydsl_mxpsh_128x256x128_F8_F8_B16_w0_x4_sk1,1231.09,3558.86,0.0
gfx950,256,240,65536,1536,fp8,fp8,flydsl,2980,1,37.8385,flydsl_mxpsh_128x256x128_F8_F8_B16_w2_x4_sk1,1276.96,3501.44,0.0
gfx950,256,256,65536,1536,fp8,fp8,flydsl,2964,1,38.205,flydsl_mxpsh_128x256x128_F8_F8_B16_w0_x4_sk1,1349.03,3523.39,0.0
gfx950,256,288,65536,1536,fp8,fp8,flydsl,2668,1,50.3374,flydsl_mxpsh_96x128x128_F8_F8_B16_w3_x4_sk1,1151.87,2758.47,0.0
gfx950,256,320,65536,1536,fp8,fp8,flydsl,2724,1,54.0527,flydsl_mxpsh_96x256x128_F8_F8_B16_w0_x4_sk1,1191.88,2647.38,0.0
gfx950,256,352,65536,1536,fp8,fp8,flydsl,2980,1,56.3615,flydsl_mxpsh_128x256x128_F8_F8_B16_w2_x4_sk1,1257.36,2614.22,0.0
gfx950,256,384,65536,1536,fp8,fp8,flydsl,2972,1,57.2092,flydsl_mxpsh_128x256x128_F8_F8_B16_w1_x4_sk1,1351.35,2649.66,0.0
gfx950,256,416,65536,1536,fp8,fp8,flydsl,2964,1,63.7692,flydsl_mxpsh_128x256x128_F8_F8_B16_w0_x4_sk1,1313.36,2443.63,0.0
gfx950,256,448,65536,1536,fp8,fp8,flydsl,2980,1,67.5176,flydsl_mxpsh_128x256x128_F8_F8_B16_w2_x4_sk1,1335.86,2370.81,0.0
gfx950,256,480,65536,1536,fp8,fp8,flydsl,2980,1,68.8468,flydsl_mxpsh_128x256x128_F8_F8_B16_w2_x4_sk1,1403.65,2386.68,0.0
gfx950,256,512,65536,1536,fp8,fp8,flydsl,2980,1,71.6053,flydsl_mxpsh_128x256x128_F8_F8_B16_w2_x4_sk1,1439.55,2354.0,0.0
gfx950,256,544,65536,1536,fp8,fp8,flydsl,2964,1,82.4559,flydsl_mxpsh_128x256x128_F8_F8_B16_w0_x4_sk1,1328.25,2095.69,0.0
gfx950,256,576,65536,1536,fp8,fp8,flydsl,2724,1,83.428,flydsl_mxpsh_96x256x128_F8_F8_B16_w0_x4_sk1,1389.99,2122.14,0.0
gfx950,256,608,65536,1536,fp8,fp8,flydsl,2964,1,85.827,flydsl_mxpsh_128x256x128_F8_F8_B16_w0_x4_sk1,1426.2,2112.26,0.0
gfx950,256,640,65536,1536,fp8,fp8,flydsl,2972,1,87.8454,flydsl_mxpsh_128x256x128_F8_F8_B16_w1_x4_sk1,1466.77,2112.03,0.0
gfx950,256,672,65536,1536,fp8,fp8,flydsl,2964,1,95.3238,flydsl_mxpsh_128x256x128_F8_F8_B16_w0_x4_sk1,1419.28,1990.86,0.0
gfx950,256,704,65536,1536,fp8,fp8,flydsl,2980,1,96.719,flydsl_mxpsh_128x256x128_F8_F8_B16_w2_x4_sk1,1465.42,2006.01,0.0
gfx950,256,736,65536,1536,fp8,fp8,flydsl,2972,1,97.757,flydsl_mxpsh_128x256x128_F8_F8_B16_w1_x4_sk1,1515.76,2028.12,0.0
gfx950,256,768,65536,1536,fp8,fp8,flydsl,2980,1,100.273,flydsl_mxpsh_128x256x128_F8_F8_B16_w2_x4_sk1,1541.98,2019.55,0.0
gfx950,256,800,65536,1536,fp8,fp8,flydsl,2964,1,108.2076,flydsl_mxpsh_128x256x128_F8_F8_B16_w0_x4_sk1,1488.45,1910.68,0.0
gfx950,256,832,65536,1536,fp8,fp8,flydsl,2964,1,110.5728,flydsl_mxpsh_128x256x128_F8_F8_B16_w0_x4_sk1,1514.87,1908.18,0.0
gfx950,256,864,65536,1536,fp8,fp8,flydsl,2972,1,111.1802,flydsl_mxpsh_128x256x128_F8_F8_B16_w1_x4_sk1,1564.54,1935.93,0.0
gfx950,256,896,65536,1536,fp8,fp8,flydsl,2980,1,113.7304,flydsl_mxpsh_128x256x128_F8_F8_B16_w2_x4_sk1,1586.11,1929.83,0.0
gfx950,256,928,65536,1536,fp8,fp8,flydsl,2740,1,126.8574,flydsl_mxpsh_96x256x128_F8_F8_B16_w2_x4_sk1,1472.76,1763.58,0.0
gfx950,256,960,65536,1536,fp8,fp8,flydsl,2732,1,127.9598,flydsl_mxpsh_96x256x128_F8_F8_B16_w1_x4_sk1,1510.42,1781.55,0.0
gfx950,256,992,65536,1536,fp8,fp8,flydsl,2740,1,133.293,flydsl_mxpsh_96x256x128_F8_F8_B16_w2_x4_sk1,1498.32,1742.11,0.0
gfx950,256,1024,65536,1536,fp8,fp8,flydsl,2740,1,136.2359,flydsl_mxpsh_96x256x128_F8_F8_B16_w2_x4_sk1,1513.25,1735.62,0.0
gfx950,256,1088,65536,1536,fp8,fp8,flydsl,2980,1,139.3607,flydsl_mxpsh_128x256x128_F8_F8_B16_w2_x4_sk1,1571.77,1757.6,0.0
gfx950,256,1152,65536,1536,fp8,fp8,flydsl,2972,1,143.8959,flydsl_mxpsh_128x256x128_F8_F8_B16_w1_x4_sk1,1611.78,1761.19,0.0
gfx950,256,1216,65536,1536,fp8,fp8,flydsl,2964,1,150.3716,flydsl_mxpsh_128x256x128_F8_F8_B16_w0_x4_sk1,1628.05,1741.78,0.0
gfx950,256,1280,65536,1536,fp8,fp8,flydsl,2972,1,152.429,flydsl_mxpsh_128x256x128_F8_F8_B16_w1_x4_sk1,1690.61,1773.95,0.0
gfx950,256,1344,65536,1536,fp8,fp8,flydsl,2972,1,163.2145,flydsl_mxpsh_128x256x128_F8_F8_B16_w1_x4_sk1,1657.84,1708.72,0.0
gfx950,256,1408,65536,1536,fp8,fp8,flydsl,2964,1,165.4781,flydsl_mxpsh_128x256x128_F8_F8_B16_w0_x4_sk1,1713.02,1736.64,0.0
gfx950,256,1472,65536,1536,fp8,fp8,flydsl,2964,1,176.8827,flydsl_mxpsh_128x256x128_F8_F8_B16_w0_x4_sk1,1675.42,1672.65,0.0
gfx950,256,1536,65536,1536,fp8,fp8,flydsl,2980,1,176.9275,flydsl_mxpsh_128x256x128_F8_F8_B16_w2_x4_sk1,1747.82,1720.19,0.0
gfx950,256,1600,65536,1536,fp8,fp8,flydsl,2972,1,185.9057,flydsl_mxpsh_128x256x128_F8_F8_B16_w1_x4_sk1,1732.72,1682.77,0.0
gfx950,256,1664,65536,1536,fp8,fp8,flydsl,2964,1,189.428,flydsl_mxpsh_128x256x128_F8_F8_B16_w0_x4_sk1,1768.52,1696.28,0.0
gfx950,256,1728,65536,1536,fp8,fp8,flydsl,2964,1,194.9177,flydsl_mxpsh_128x256x128_F8_F8_B16_w0_x4_sk1,1784.82,1692.05,0.0
gfx950,256,1792,65536,1536,fp8,fp8,flydsl,2964,1,198.9945,flydsl_mxpsh_128x256x128_F8_F8_B16_w0_x4_sk1,1813.0,1700.03,0.0
gfx950,256,1856,65536,1536,fp8,fp8,flydsl,2972,1,215.7865,flydsl_mxpsh_128x256x128_F8_F8_B16_w1_x4_sk1,1731.63,1607.07,0.0
gfx950,256,1920,65536,1536,fp8,fp8,flydsl,2972,1,217.2527,flydsl_mxpsh_128x256x128_F8_F8_B16_w1_x4_sk1,1779.25,1635.29,0.0
gfx950,256,1984,65536,1536,fp8,fp8,flydsl,2964,1,233.8257,flydsl_mxpsh_128x256x128_F8_F8_B16_w0_x4_sk1,1708.25,1555.68,0.0
gfx950,256,2048,65536,1536,fp8,fp8,flydsl,2980,1,251.6793,flydsl_mxpsh_128x256x128_F8_F8_B16_w2_x4_sk1,1638.26,1479.04,0.0
gfx950,256,4096,65536,1536,fp8,fp8,flydsl,2964,1,445.6575,flydsl_mxpsh_128x256x128_F8_F8_B16_w0_x4_sk1,1850.38,1444.66,0.0
gfx950,256,6144,65536,1536,fp8,fp8,flydsl,2980,1,620.5717,flydsl_mxpsh_128x256x128_F8_F8_B16_w2_x4_sk1,1993.24,1475.1,0.0
gfx950,256,8192,65536,1536,fp8,fp8,flydsl,2964,1,805.193,flydsl_mxpsh_128x256x128_F8_F8_B16_w0_x4_sk1,2048.29,1474.17,0.0
gfx950,256,10240,65536,1536,fp8,fp8,flydsl,2972,1,988.1442,flydsl_mxpsh_128x256x128_F8_F8_B16_w1_x4_sk1,2086.32,1476.07,0.0
gfx950,256,12288,65536,1536,fp8,fp8,flydsl,2972,1,1180.2513,flydsl_mxpsh_128x256x128_F8_F8_B16_w1_x4_sk1,2096.08,1465.92,0.0
gfx950,256,14336,65536,1536,fp8,fp8,flydsl,2980,1,1379.8048,flydsl_mxpsh_128x256x128_F8_F8_B16_w2_x4_sk1,2091.76,1450.74,0.0
gfx950,256,16384,65536,1536,fp8,fp8,flydsl,2980,1,1587.0377,flydsl_mxpsh_128x256x128_F8_F8_B16_w2_x4_sk1,2078.42,1432.43,0.0
gfx950,256,20480,65536,1536,fp8,fp8,flydsl,2964,1,2028.144,flydsl_mxpsh_128x256x128_F8_F8_B16_w0_x4_sk1,2032.98,1388.7,0.0
gfx950,256,24576,65536,1536,fp8,fp8,flydsl,2980,1,2484.7786,flydsl_mxpsh_128x256x128_F8_F8_B16_w2_x4_sk1,1991.24,1352.09,0.0
gfx950,256,28672,65536,1536,fp8,fp8,flydsl,2980,1,2892.3154,flydsl_mxpsh_128x256x128_F8_F8_B16_w2_x4_sk1,1995.78,1349.37,0.0
gfx950,256,32768,65536,1536,fp8,fp8,flydsl,2980,1,3329.9548,flydsl_mxpsh_128x256x128_F8_F8_B16_w2_x4_sk1,1981.13,1335.14,0.0
gfx950,256,40960,65536,1536,fp8,fp8,flydsl,2964,1,4101.71,flydsl_mxpsh_128x256x128_F8_F8_B16_w0_x4_sk1,2010.46,1348.78,0.0
gfx950,256,49152,65536,1536,fp8,fp8,flydsl,2964,1,4970.442,flydsl_mxpsh_128x256x128_F8_F8_B16_w0_x4_sk1,1990.89,1331.59,0.0
gfx950,256,57344,65536,1536,fp8,fp8,flydsl,2960,1,5601.1106,flydsl_mxpsh_128x256x128_F8_F8_B16_w0_x0_sk1,2061.18,1375.61,0.0
gfx950,256,65536,65536,1536,fp8,fp8,flydsl,2964,1,6545.7658,flydsl_mxpsh_128x256x128_F8_F8_B16_w0_x4_sk1,2015.68,1343.05,0.0
