aiter/configs/mxscale_preshuffle_tuned_gemm.csv
gfx,cu_num,M,N,K,a_dtype,b_dtype,libtype,kernelId,splitK,us,kernelName,tflops,bw,errRatio
gfx950,256,1,768,7168,fp8,fp8,flydsl,553,0,31.5323,flydsl_mxpsh_32x128x256_F8_F8_B16_w1_x4,0.35,174.86,0.0
gfx950,256,2,768,7168,fp8,fp8,flydsl,559,0,31.7323,flydsl_mxpsh_32x128x256_F8_F8_B16_w4_x4,0.69,174.03,0.0
gfx950,256,4,768,7168,fp8,fp8,flydsl,555,0,31.7108,flydsl_mxpsh_32x128x256_F8_F8_B16_w2_x4,1.39,174.7,0.0
gfx950,256,8,768,7168,fp8,fp8,flydsl,555,0,31.8335,flydsl_mxpsh_32x128x256_F8_F8_B16_w2_x4,2.77,175.12,0.0
gfx950,256,16,768,7168,fp8,fp8,flydsl,556,0,31.8773,flydsl_mxpsh_32x128x256_F8_F8_B16_w3_x0,5.53,177.06,0.0
gfx950,256,32,768,7168,fp8,fp8,flydsl,550,0,32.7848,flydsl_mxpsh_32x128x256_F8_F8_B16_w0_x0,10.75,176.41,0.0
gfx950,256,48,768,7168,fp8,fp8,flydsl,551,0,30.7044,flydsl_mxpsh_32x128x256_F8_F8_B16_w0_x4,17.21,192.9,0.0
gfx950,256,64,768,7168,fp8,fp8,flydsl,558,0,31.537,flydsl_mxpsh_32x128x256_F8_F8_B16_w4_x0,22.34,192.22,0.0
gfx950,256,80,768,7168,fp8,fp8,flydsl,553,0,30.7441,flydsl_mxpsh_32x128x256_F8_F8_B16_w1_x4,28.65,201.71,0.0
gfx950,256,96,768,7168,fp8,fp8,flydsl,559,0,31.3354,flydsl_mxpsh_32x128x256_F8_F8_B16_w4_x4,33.73,202.35,0.0
gfx950,256,112,768,7168,fp8,fp8,flydsl,558,0,29.9488,flydsl_mxpsh_32x128x256_F8_F8_B16_w4_x0,41.17,216.36,0.0
gfx950,256,128,768,7168,fp8,fp8,flydsl,550,0,30.2959,flydsl_mxpsh_32x128x256_F8_F8_B16_w0_x0,46.52,218.48,0.0
gfx950,256,144,768,7168,fp8,fp8,flydsl,553,0,30.6259,flydsl_mxpsh_32x128x256_F8_F8_B16_w1_x4,51.77,220.68,0.0
gfx950,256,160,768,7168,fp8,fp8,flydsl,556,0,31.1825,flydsl_mxpsh_32x128x256_F8_F8_B16_w3_x0,56.49,221.2,0.0
gfx950,256,176,768,7168,fp8,fp8,flydsl,559,0,30.2837,flydsl_mxpsh_32x128x256_F8_F8_B16_w4_x4,63.99,232.37,0.0
gfx950,256,192,768,7168,fp8,fp8,flydsl,559,0,30.6934,flydsl_mxpsh_32x128x256_F8_F8_B16_w4_x4,68.87,233.8,0.0
gfx950,256,208,768,7168,fp8,fp8,flydsl,556,0,30.8552,flydsl_mxpsh_32x128x256_F8_F8_B16_w3_x0,74.22,237.09,0.0
gfx950,256,224,768,7168,fp8,fp8,flydsl,551,0,31.186,flydsl_mxpsh_32x128x256_F8_F8_B16_w0_x4,79.08,239.04,0.0
gfx950,256,240,768,7168,fp8,fp8,flydsl,556,0,30.4081,flydsl_mxpsh_32x128x256_F8_F8_B16_w3_x0,86.9,249.74,0.0
gfx950,256,256,768,7168,fp8,fp8,flydsl,556,0,30.5517,flydsl_mxpsh_32x128x256_F8_F8_B16_w3_x0,92.26,253.12,0.0
gfx950,256,288,768,7168,fp8,fp8,flydsl,555,0,31.238,flydsl_mxpsh_32x128x256_F8_F8_B16_w2_x4,101.51,256.48,0.0
gfx950,256,320,768,7168,fp8,fp8,flydsl,559,0,30.7334,flydsl_mxpsh_32x128x256_F8_F8_B16_w4_x4,114.64,269.75,0.0
gfx950,256,352,768,7168,fp8,fp8,flydsl,551,0,31.1115,flydsl_mxpsh_32x128x256_F8_F8_B16_w0_x4,124.57,275.42,0.0
gfx950,256,384,768,7168,fp8,fp8,flydsl,558,0,30.1188,flydsl_mxpsh_32x128x256_F8_F8_B16_w4_x0,140.37,293.75,0.0
gfx950,256,416,768,7168,fp8,fp8,flydsl,553,0,31.0968,flydsl_mxpsh_32x128x256_F8_F8_B16_w1_x4,147.29,293.47,0.0
gfx950,256,448,768,7168,fp8,fp8,flydsl,553,0,30.5859,flydsl_mxpsh_32x128x256_F8_F8_B16_w1_x4,161.27,307.48,0.0
gfx950,256,480,768,7168,fp8,fp8,flydsl,554,0,30.699,flydsl_mxpsh_32x128x256_F8_F8_B16_w2_x0,172.15,315.42,0.0
gfx950,256,512,768,7168,fp8,fp8,flydsl,558,0,30.4494,flydsl_mxpsh_32x128x256_F8_F8_B16_w4_x0,185.13,327.15,0.0
gfx950,256,544,768,7168,fp8,fp8,flydsl,559,0,31.0293,flydsl_mxpsh_32x128x256_F8_F8_B16_w4_x4,193.03,330.01,0.0
gfx950,256,576,768,7168,fp8,fp8,flydsl,552,0,30.1313,flydsl_mxpsh_32x128x256_F8_F8_B16_w1_x0,210.47,349.09,0.0
gfx950,256,608,768,7168,fp8,fp8,flydsl,553,0,30.575,flydsl_mxpsh_32x128x256_F8_F8_B16_w1_x4,218.94,353.13,0.0
gfx950,256,640,768,7168,fp8,fp8,flydsl,558,0,29.4717,flydsl_mxpsh_32x128x256_F8_F8_B16_w4_x0,239.09,375.8,0.0
gfx950,256,672,768,7168,fp8,fp8,flydsl,557,0,30.4572,flydsl_mxpsh_32x128x256_F8_F8_B16_w3_x4,242.92,372.79,0.0
gfx950,256,704,768,7168,fp8,fp8,flydsl,555,0,30.0218,flydsl_mxpsh_32x128x256_F8_F8_B16_w2_x4,258.18,387.47,0.0
gfx950,256,736,768,7168,fp8,fp8,flydsl,556,0,30.5033,flydsl_mxpsh_32x128x256_F8_F8_B16_w3_x0,265.66,390.49,0.0
gfx950,256,768,768,7168,fp8,fp8,flydsl,555,0,29.9157,flydsl_mxpsh_32x128x256_F8_F8_B16_w2_x4,282.65,407.47,0.0
gfx950,256,800,768,7168,fp8,fp8,flydsl,558,0,30.5307,flydsl_mxpsh_32x128x256_F8_F8_B16_w4_x0,288.5,408.38,0.0
gfx950,256,832,768,7168,fp8,fp8,flydsl,551,0,29.9775,flydsl_mxpsh_32x128x256_F8_F8_B16_w0_x4,305.57,425.21,0.0
gfx950,256,864,768,7168,fp8,fp8,flydsl,554,0,30.6363,flydsl_mxpsh_32x128x256_F8_F8_B16_w2_x0,310.5,425.16,0.0
gfx950,256,896,768,7168,fp8,fp8,flydsl,559,0,29.4516,flydsl_mxpsh_32x128x256_F8_F8_B16_w4_x4,334.96,451.72,0.0
gfx950,256,928,768,7168,fp8,fp8,flydsl,557,0,30.6299,flydsl_mxpsh_32x128x256_F8_F8_B16_w3_x4,333.57,443.43,0.0
gfx950,256,960,768,7168,fp8,fp8,flydsl,555,0,30.0348,flydsl_mxpsh_32x128x256_F8_F8_B16_w2_x4,351.91,461.49,0.0
gfx950,256,992,768,7168,fp8,fp8,flydsl,555,0,30.734,flydsl_mxpsh_32x128x256_F8_F8_B16_w2_x4,355.37,460.06,0.0
gfx950,256,1024,768,7168,fp8,fp8,flydsl,558,0,30.209,flydsl_mxpsh_32x128x256_F8_F8_B16_w4_x0,373.21,477.27,0.0
gfx950,256,1088,768,7168,fp8,fp8,flydsl,559,0,30.2432,flydsl_mxpsh_32x128x256_F8_F8_B16_w4_x4,396.09,495.15,0.0
gfx950,256,1152,768,7168,fp8,fp8,flydsl,555,0,29.5564,flydsl_mxpsh_32x128x256_F8_F8_B16_w2_x4,429.13,525.5,0.0
gfx950,256,1216,768,7168,fp8,fp8,flydsl,554,0,30.3607,flydsl_mxpsh_32x128x256_F8_F8_B16_w2_x0,440.97,529.93,0.0
gfx950,256,1280,768,7168,fp8,fp8,flydsl,555,0,30.3598,flydsl_mxpsh_32x128x256_F8_F8_B16_w2_x4,464.19,548.3,0.0
gfx950,256,1344,768,7168,fp8,fp8,flydsl,557,0,30.5108,flydsl_mxpsh_32x128x256_F8_F8_B16_w3_x4,484.99,563.84,0.0
gfx950,256,1408,768,7168,fp8,fp8,flydsl,555,0,30.1154,flydsl_mxpsh_32x128x256_F8_F8_B16_w2_x4,514.76,589.74,0.0
gfx950,256,1472,768,7168,fp8,fp8,flydsl,554,0,30.9535,flydsl_mxpsh_32x128x256_F8_F8_B16_w2_x0,523.59,591.77,0.0
gfx950,256,1536,768,7168,fp8,fp8,flydsl,554,0,30.8178,flydsl_mxpsh_32x128x256_F8_F8_B16_w2_x0,548.76,612.45,0.0
gfx950,256,1600,768,7168,fp8,fp8,flydsl,559,0,31.3512,flydsl_mxpsh_32x128x256_F8_F8_B16_w4_x4,561.89,619.8,0.0
gfx950,256,1664,768,7168,fp8,fp8,flydsl,551,0,31.0802,flydsl_mxpsh_32x128x256_F8_F8_B16_w0_x4,589.47,643.13,0.0
gfx950,256,1728,768,7168,fp8,fp8,flydsl,557,0,31.9359,flydsl_mxpsh_32x128x256_F8_F8_B16_w3_x4,595.74,643.34,0.0
gfx950,256,1792,768,7168,fp8,fp8,flydsl,554,0,31.3395,flydsl_mxpsh_32x128x256_F8_F8_B16_w2_x0,629.56,673.35,0.0
gfx950,256,1856,768,7168,fp8,fp8,flydsl,555,0,32.0586,flydsl_mxpsh_32x128x256_F8_F8_B16_w2_x4,637.42,675.63,0.0
gfx950,256,1920,768,7168,fp8,fp8,flydsl,556,0,31.3917,flydsl_mxpsh_32x128x256_F8_F8_B16_w3_x0,673.4,707.73,0.0
gfx950,256,1984,768,7168,fp8,fp8,flydsl,559,0,32.366,flydsl_mxpsh_32x128x256_F8_F8_B16_w4_x4,674.9,703.63,0.0
gfx950,256,2048,768,7168,fp8,fp8,flydsl,614,0,34.3107,flydsl_mxpsh_64x128x256_F8_F8_B16_w2_x0,657.19,679.99,0.0
gfx950,256,4096,768,7168,fp8,fp8,flydsl,736,0,40.8764,flydsl_mxpsh_128x128x256_F8_F8_B16_w3_x0,1103.26,1006.86,0.0
gfx950,256,6144,768,7168,fp8,fp8,flydsl,671,0,52.1743,flydsl_mxpsh_96x128x256_F8_F8_B16_w0_x4,1296.53,1130.49,0.0
gfx950,256,8192,768,7168,fp8,fp8,flydsl,736,0,60.5029,flydsl_mxpsh_128x128x256_F8_F8_B16_w3_x0,1490.74,1269.5,0.0
gfx950,256,10240,768,7168,fp8,fp8,flydsl,730,0,65.7841,flydsl_mxpsh_128x128x256_F8_F8_B16_w0_x0,1713.83,1438.55,0.0
gfx950,256,12288,768,7168,fp8,fp8,flydsl,663,0,85.4576,flydsl_mxpsh_96x128x128_F8_F8_B16_w1_x4,1583.14,1315.97,0.0
gfx950,256,14336,768,7168,fp8,fp8,flydsl,727,0,95.5274,flydsl_mxpsh_128x128x128_F8_F8_B16_w3_x4,1652.3,1363.86,0.0
gfx950,256,16384,768,7168,fp8,fp8,flydsl,720,0,102.38,flydsl_mxpsh_128x128x128_F8_F8_B16_w0_x0,1761.95,1446.68,0.0
gfx950,256,32768,768,7168,fp8,fp8,flydsl,740,0,195.5481,flydsl_mxpsh_128x256x128_F8_F8_B16_w0_x0,1844.95,1486.68,0.0
gfx950,256,1,2048,7168,fp8,fp8,flydsl,555,0,31.2926,flydsl_mxpsh_32x128x256_F8_F8_B16_w2_x4,0.94,469.48,0.0
gfx950,256,2,2048,7168,fp8,fp8,flydsl,551,0,31.43,flydsl_mxpsh_32x128x256_F8_F8_B16_w0_x4,1.87,467.79,0.0
gfx950,256,4,2048,7168,fp8,fp8,flydsl,558,0,31.4649,flydsl_mxpsh_32x128x256_F8_F8_B16_w4_x0,3.73,467.99,0.0
gfx950,256,8,2048,7168,fp8,fp8,flydsl,558,0,31.5392,flydsl_mxpsh_32x128x256_F8_F8_B16_w4_x0,7.45,468.31,0.0
gfx950,256,16,2048,7168,fp8,fp8,flydsl,553,0,31.5044,flydsl_mxpsh_32x128x256_F8_F8_B16_w1_x4,14.91,471.69,0.0
gfx950,256,32,2048,7168,fp8,fp8,flydsl,559,0,31.9292,flydsl_mxpsh_32x128x256_F8_F8_B16_w4_x4,29.43,471.06,0.0
gfx950,256,48,2048,7168,fp8,fp8,flydsl,557,0,29.8422,flydsl_mxpsh_32x128x256_F8_F8_B16_w3_x4,47.22,510.04,0.0
gfx950,256,64,2048,7168,fp8,fp8,flydsl,558,0,30.4995,flydsl_mxpsh_32x128x256_F8_F8_B16_w4_x0,61.61,504.96,0.0
gfx950,256,80,2048,7168,fp8,fp8,flydsl,550,0,30.1866,flydsl_mxpsh_32x128x256_F8_F8_B16_w0_x0,77.81,516.16,0.0
gfx950,256,96,2048,7168,fp8,fp8,flydsl,552,0,30.7451,flydsl_mxpsh_32x128x256_F8_F8_B16_w1_x0,91.68,512.65,0.0
gfx950,256,112,2048,7168,fp8,fp8,flydsl,551,0,29.3365,flydsl_mxpsh_32x128x256_F8_F8_B16_w0_x4,112.09,543.41,0.0
gfx950,256,128,2048,7168,fp8,fp8,flydsl,557,0,29.7839,flydsl_mxpsh_32x128x256_F8_F8_B16_w3_x4,126.18,541.29,0.0
gfx950,256,144,2048,7168,fp8,fp8,flydsl,554,0,30.4016,flydsl_mxpsh_32x128x256_F8_F8_B16_w2_x0,139.07,536.22,0.0
gfx950,256,160,2048,7168,fp8,fp8,flydsl,556,0,30.765,flydsl_mxpsh_32x128x256_F8_F8_B16_w3_x0,152.69,535.75,0.0
gfx950,256,176,2048,7168,fp8,fp8,flydsl,557,0,30.3982,flydsl_mxpsh_32x128x256_F8_F8_B16_w3_x4,169.99,548.14,0.0
gfx950,256,192,2048,7168,fp8,fp8,flydsl,552,0,30.8171,flydsl_mxpsh_32x128x256_F8_F8_B16_w1_x0,182.92,546.54,0.0
gfx950,256,208,2048,7168,fp8,fp8,flydsl,557,0,31.2561,flydsl_mxpsh_32x128x256_F8_F8_B16_w3_x4,195.38,544.63,0.0
gfx950,256,224,2048,7168,fp8,fp8,flydsl,554,0,31.6617,flydsl_mxpsh_32x128x256_F8_F8_B16_w2_x0,207.72,543.34,0.0
gfx950,256,240,2048,7168,fp8,fp8,flydsl,553,0,31.8067,flydsl_mxpsh_32x128x256_F8_F8_B16_w1_x4,221.54,546.53,0.0
gfx950,256,256,2048,7168,fp8,fp8,flydsl,558,0,31.9254,flydsl_mxpsh_32x128x256_F8_F8_B16_w4_x0,235.43,550.15,0.0
gfx950,256,288,2048,7168,fp8,fp8,flydsl,553,0,32.471,flydsl_mxpsh_32x128x256_F8_F8_B16_w1_x4,260.41,552.0,0.0
gfx950,256,320,2048,7168,fp8,fp8,flydsl,557,0,32.0549,flydsl_mxpsh_32x128x256_F8_F8_B16_w3_x4,293.1,570.41,0.0
gfx950,256,352,2048,7168,fp8,fp8,flydsl,554,0,32.5376,flydsl_mxpsh_32x128x256_F8_F8_B16_w2_x0,317.63,573.03,0.0
gfx950,256,384,2048,7168,fp8,fp8,flydsl,554,0,31.8412,flydsl_mxpsh_32x128x256_F8_F8_B16_w2_x0,354.08,596.88,0.0
gfx950,256,416,2048,7168,fp8,fp8,flydsl,555,0,32.7373,flydsl_mxpsh_32x128x256_F8_F8_B16_w2_x4,373.09,591.55,0.0
gfx950,256,448,2048,7168,fp8,fp8,flydsl,554,0,32.5183,flydsl_mxpsh_32x128x256_F8_F8_B16_w2_x0,404.49,606.62,0.0
gfx950,256,480,2048,7168,fp8,fp8,flydsl,553,0,33.076,flydsl_mxpsh_32x128x256_F8_F8_B16_w1_x4,426.08,607.29,0.0
gfx950,256,512,2048,7168,fp8,fp8,flydsl,556,0,32.7928,flydsl_mxpsh_32x128x256_F8_F8_B16_w3_x0,458.41,623.53,0.0
gfx950,256,544,2048,7168,fp8,fp8,flydsl,552,0,33.6571,flydsl_mxpsh_32x128x256_F8_F8_B16_w1_x0,474.55,618.23,0.0
gfx950,256,576,2048,7168,fp8,fp8,flydsl,554,0,33.0397,flydsl_mxpsh_32x128x256_F8_F8_B16_w2_x0,511.85,640.69,0.0
gfx950,256,608,2048,7168,fp8,fp8,flydsl,551,0,33.285,flydsl_mxpsh_32x128x256_F8_F8_B16_w0_x4,536.31,646.8,0.0
gfx950,256,640,2048,7168,fp8,fp8,flydsl,556,0,33.3904,flydsl_mxpsh_32x128x256_F8_F8_B16_w3_x0,562.75,655.55,0.0
gfx950,256,672,2048,7168,fp8,fp8,flydsl,558,0,33.4938,flydsl_mxpsh_32x128x256_F8_F8_B16_w4_x0,589.06,664.29,0.0
gfx950,256,704,2048,7168,fp8,fp8,flydsl,552,0,33.2618,flydsl_mxpsh_32x128x256_F8_F8_B16_w1_x0,621.42,679.76,0.0
gfx950,256,736,2048,7168,fp8,fp8,flydsl,555,0,34.2122,flydsl_mxpsh_32x128x256_F8_F8_B16_w2_x4,631.62,671.41,0.0
gfx950,256,768,2048,7168,fp8,fp8,flydsl,554,0,33.1549,flydsl_mxpsh_32x128x256_F8_F8_B16_w2_x0,680.1,703.69,0.0
gfx950,256,800,2048,7168,fp8,fp8,flydsl,552,0,34.5207,flydsl_mxpsh_32x128x256_F8_F8_B16_w1_x0,680.41,686.29,0.0
gfx950,256,832,2048,7168,fp8,fp8,flydsl,554,0,33.9546,flydsl_mxpsh_32x128x256_F8_F8_B16_w2_x0,719.42,708.35,0.0
gfx950,256,864,2048,7168,fp8,fp8,flydsl,554,0,34.5231,flydsl_mxpsh_32x128x256_F8_F8_B16_w2_x0,734.79,707.13,0.0
gfx950,256,896,2048,7168,fp8,fp8,flydsl,552,0,34.1202,flydsl_mxpsh_32x128x256_F8_F8_B16_w1_x0,771.0,726.04,0.0
gfx950,256,928,2048,7168,fp8,fp8,flydsl,551,0,35.2849,flydsl_mxpsh_32x128x256_F8_F8_B16_w0_x4,772.18,712.29,0.0
gfx950,256,960,2048,7168,fp8,fp8,flydsl,559,0,34.7408,flydsl_mxpsh_32x128x256_F8_F8_B16_w4_x4,811.31,733.82,0.0
gfx950,256,992,2048,7168,fp8,fp8,flydsl,551,0,36.0609,flydsl_mxpsh_32x128x256_F8_F8_B16_w0_x4,807.67,716.95,0.0
gfx950,256,1024,2048,7168,fp8,fp8,flydsl,614,0,37.2569,flydsl_mxpsh_64x128x256_F8_F8_B16_w2_x0,806.96,703.61,0.0
gfx950,256,1088,2048,7168,fp8,fp8,flydsl,673,0,40.2587,flydsl_mxpsh_96x128x256_F8_F8_B16_w1_x4,793.46,669.06,0.0
gfx950,256,1152,2048,7168,fp8,fp8,flydsl,670,0,40.9725,flydsl_mxpsh_96x128x256_F8_F8_B16_w0_x0,825.5,674.99,0.0
gfx950,256,1216,2048,7168,fp8,fp8,flydsl,735,0,40.8798,flydsl_mxpsh_128x128x256_F8_F8_B16_w2_x4,873.34,694.16,0.0
gfx950,256,1280,2048,7168,fp8,fp8,flydsl,673,0,41.2573,flydsl_mxpsh_96x128x256_F8_F8_B16_w1_x4,910.89,705.28,0.0
gfx950,256,1344,2048,7168,fp8,fp8,flydsl,672,0,42.151,flydsl_mxpsh_96x128x256_F8_F8_B16_w1_x0,936.16,707.43,0.0
gfx950,256,1408,2048,7168,fp8,fp8,flydsl,675,0,42.6385,flydsl_mxpsh_96x128x256_F8_F8_B16_w2_x4,969.52,716.25,0.0
gfx950,256,1472,2048,7168,fp8,fp8,flydsl,731,0,41.0739,flydsl_mxpsh_128x128x256_F8_F8_B16_w0_x4,1052.2,761.08,0.0
gfx950,256,1536,2048,7168,fp8,fp8,flydsl,738,0,41.8772,flydsl_mxpsh_128x128x256_F8_F8_B16_w4_x0,1076.89,763.7,0.0
gfx950,256,1600,2048,7168,fp8,fp8,flydsl,733,0,43.9081,flydsl_mxpsh_128x128x256_F8_F8_B16_w1_x4,1069.88,744.79,0.0
gfx950,256,1664,2048,7168,fp8,fp8,flydsl,614,0,43.904,flydsl_mxpsh_64x128x256_F8_F8_B16_w2_x0,1112.77,761.28,0.0
gfx950,256,1728,2048,7168,fp8,fp8,flydsl,736,0,42.7669,flydsl_mxpsh_128x128x256_F8_F8_B16_w3_x0,1186.3,798.38,0.0
gfx950,256,1792,2048,7168,fp8,fp8,flydsl,731,0,43.8901,flydsl_mxpsh_128x128x256_F8_F8_B16_w0_x4,1198.75,794.37,0.0
gfx950,256,1856,2048,7168,fp8,fp8,flydsl,733,0,45.3358,flydsl_mxpsh_128x128x256_F8_F8_B16_w1_x4,1201.97,784.94,0.0
gfx950,256,1920,2048,7168,fp8,fp8,flydsl,613,0,46.2706,flydsl_mxpsh_64x128x256_F8_F8_B16_w1_x4,1218.3,784.67,0.0
gfx950,256,1984,2048,7168,fp8,fp8,flydsl,731,0,43.4243,flydsl_mxpsh_128x128x256_F8_F8_B16_w0_x4,1341.43,852.7,0.0
gfx950,256,2048,2048,7168,fp8,fp8,flydsl,736,0,44.2116,flydsl_mxpsh_128x128x256_F8_F8_B16_w3_x0,1360.04,853.82,0.0
gfx950,256,4096,2048,7168,fp8,fp8,flydsl,730,0,70.2428,flydsl_mxpsh_128x128x256_F8_F8_B16_w0_x0,1712.05,865.82,0.0
gfx950,256,6144,2048,7168,fp8,fp8,flydsl,739,0,100.0349,flydsl_mxpsh_128x128x256_F8_F8_B16_w4_x4,1803.26,838.57,0.0
gfx950,256,8192,2048,7168,fp8,fp8,flydsl,742,0,124.3608,flydsl_mxpsh_128x256x128_F8_F8_B16_w1_x0,1934.04,860.04,0.0
gfx950,256,10240,2048,7168,fp8,fp8,flydsl,732,0,154.2272,flydsl_mxpsh_128x128x256_F8_F8_B16_w1_x0,1949.38,843.06,0.0
gfx950,256,12288,2048,7168,fp8,fp8,flydsl,733,0,182.7864,flydsl_mxpsh_128x128x256_F8_F8_B16_w1_x4,1973.76,837.55,0.0
gfx950,256,14336,2048,7168,fp8,fp8,flydsl,742,0,206.735,flydsl_mxpsh_128x256x128_F8_F8_B16_w1_x0,2035.97,852.11,0.0
gfx950,256,16384,2048,7168,fp8,fp8,flydsl,743,0,225.2052,flydsl_mxpsh_128x256x128_F8_F8_B16_w1_x4,2135.99,884.66,0.0
gfx950,256,32768,2048,7168,fp8,fp8,flydsl,744,0,455.9088,flydsl_mxpsh_128x256x128_F8_F8_B16_w2_x0,2110.23,841.79,0.0
gfx950,256,1,6144,7168,fp8,fp8,flydsl,555,0,32.1988,flydsl_mxpsh_32x128x256_F8_F8_B16_w2_x4,2.74,1368.36,0.0
gfx950,256,2,6144,7168,fp8,fp8,flydsl,550,0,32.1759,flydsl_mxpsh_32x128x256_F8_F8_B16_w0_x0,5.47,1369.94,0.0
gfx950,256,4,6144,7168,fp8,fp8,flydsl,555,0,32.3693,flydsl_mxpsh_32x128x256_F8_F8_B16_w2_x4,10.88,1362.96,0.0
gfx950,256,8,6144,7168,fp8,fp8,flydsl,559,0,32.2173,flydsl_mxpsh_32x128x256_F8_F8_B16_w4_x4,21.87,1371.8,0.0
gfx950,256,16,6144,7168,fp8,fp8,flydsl,558,0,32.3008,flydsl_mxpsh_32x128x256_F8_F8_B16_w4_x0,43.63,1373.08,0.0
gfx950,256,32,6144,7168,fp8,fp8,flydsl,554,0,32.499,flydsl_mxpsh_32x128x256_F8_F8_B16_w2_x0,86.73,1374.28,0.0
gfx950,256,48,6144,7168,fp8,fp8,flydsl,550,0,31.0209,flydsl_mxpsh_32x128x256_F8_F8_B16_w0_x0,136.29,1449.8,0.0
gfx950,256,64,6144,7168,fp8,fp8,flydsl,559,0,31.3928,flydsl_mxpsh_32x128x256_F8_F8_B16_w4_x4,179.57,1442.54,0.0
gfx950,256,80,6144,7168,fp8,fp8,flydsl,553,0,33.3184,flydsl_mxpsh_32x128x256_F8_F8_B16_w1_x4,211.49,1368.51,0.0
gfx950,256,96,6144,7168,fp8,fp8,flydsl,552,0,33.6606,flydsl_mxpsh_32x128x256_F8_F8_B16_w1_x0,251.21,1363.85,0.0
gfx950,256,112,6144,7168,fp8,fp8,flydsl,559,0,36.3985,flydsl_mxpsh_32x128x256_F8_F8_B16_w4_x4,271.03,1269.81,0.0
gfx950,256,128,6144,7168,fp8,fp8,flydsl,617,0,36.1516,flydsl_mxpsh_64x128x256_F8_F8_B16_w3_x4,311.86,1287.1,0.0
gfx950,256,144,6144,7168,fp8,fp8,flydsl,611,0,37.1028,flydsl_mxpsh_64x128x256_F8_F8_B16_w0_x4,341.85,1262.49,0.0
gfx950,256,160,6144,7168,fp8,fp8,flydsl,611,0,37.4098,flydsl_mxpsh_64x128x256_F8_F8_B16_w0_x4,376.72,1260.45,0.0
gfx950,256,176,6144,7168,fp8,fp8,flydsl,610,0,37.747,flydsl_mxpsh_64x128x256_F8_F8_B16_w0_x0,410.69,1257.44,0.0
gfx950,256,192,6144,7168,fp8,fp8,flydsl,610,0,37.8427,flydsl_mxpsh_64x128x256_F8_F8_B16_w0_x0,446.89,1262.48,0.0
gfx950,256,208,6144,7168,fp8,fp8,flydsl,614,0,39.3053,flydsl_mxpsh_64x128x256_F8_F8_B16_w2_x0,466.11,1223.42,0.0
gfx950,256,224,6144,7168,fp8,fp8,flydsl,730,0,39.4703,flydsl_mxpsh_128x128x256_F8_F8_B16_w0_x0,499.87,1226.2,0.0
gfx950,256,240,6144,7168,fp8,fp8,flydsl,731,0,39.824,flydsl_mxpsh_128x128x256_F8_F8_B16_w0_x4,530.82,1223.12,0.0
gfx950,256,256,6144,7168,fp8,fp8,flydsl,730,0,40.242,flydsl_mxpsh_128x128x256_F8_F8_B16_w0_x0,560.32,1218.15,0.0
gfx950,256,288,6144,7168,fp8,fp8,flydsl,735,0,40.5223,flydsl_mxpsh_128x128x256_F8_F8_B16_w2_x4,626.0,1225.09,0.0
gfx950,256,320,6144,7168,fp8,fp8,flydsl,735,0,41.5892,flydsl_mxpsh_128x128x256_F8_F8_B16_w2_x4,677.72,1208.63,0.0
gfx950,256,352,6144,7168,fp8,fp8,flydsl,739,0,42.2087,flydsl_mxpsh_128x128x256_F8_F8_B16_w4_x4,734.55,1205.64,0.0
gfx950,256,384,6144,7168,fp8,fp8,flydsl,732,0,42.9074,flydsl_mxpsh_128x128x256_F8_F8_B16_w1_x0,788.28,1200.52,0.0
gfx950,256,416,6144,7168,fp8,fp8,flydsl,731,0,43.0847,flydsl_mxpsh_128x128x256_F8_F8_B16_w0_x4,850.45,1210.03,0.0
gfx950,256,448,6144,7168,fp8,fp8,flydsl,739,0,44.6695,flydsl_mxpsh_128x128x256_F8_F8_B16_w4_x4,883.38,1181.04,0.0
gfx950,256,480,6144,7168,fp8,fp8,flydsl,735,0,45.3898,flydsl_mxpsh_128x128x256_F8_F8_B16_w2_x4,931.46,1176.01,0.0
gfx950,256,512,6144,7168,fp8,fp8,flydsl,734,0,45.8509,flydsl_mxpsh_128x128x256_F8_F8_B16_w2_x0,983.56,1177.77,0.0
gfx950,256,544,6144,7168,fp8,fp8,flydsl,731,0,49.1215,flydsl_mxpsh_128x128x256_F8_F8_B16_w0_x4,975.45,1112.02,0.0
gfx950,256,576,6144,7168,fp8,fp8,flydsl,730,0,51.8366,flydsl_mxpsh_128x128x256_F8_F8_B16_w0_x0,978.74,1065.79,0.0
gfx950,256,608,6144,7168,fp8,fp8,flydsl,739,0,53.2466,flydsl_mxpsh_128x128x256_F8_F8_B16_w4_x4,1005.75,1049.26,0.0
gfx950,256,640,6144,7168,fp8,fp8,flydsl,737,0,53.8959,flydsl_mxpsh_128x128x256_F8_F8_B16_w3_x4,1045.93,1048.17,0.0
gfx950,256,672,6144,7168,fp8,fp8,flydsl,664,0,61.574,flydsl_mxpsh_96x128x128_F8_F8_B16_w2_x0,961.28,927.58,0.0
gfx950,256,704,6144,7168,fp8,fp8,flydsl,667,0,63.1787,flydsl_mxpsh_96x128x128_F8_F8_B16_w3_x4,981.48,913.87,0.0
gfx950,256,736,6144,7168,fp8,fp8,flydsl,666,0,63.3706,flydsl_mxpsh_96x128x128_F8_F8_B16_w3_x0,1022.98,920.93,0.0
gfx950,256,768,6144,7168,fp8,fp8,flydsl,669,0,64.1706,flydsl_mxpsh_96x128x128_F8_F8_B16_w4_x4,1054.15,919.15,0.0
gfx950,256,800,6144,7168,fp8,fp8,flydsl,666,0,64.6055,flydsl_mxpsh_96x128x128_F8_F8_B16_w3_x0,1090.69,922.6,0.0
gfx950,256,832,6144,7168,fp8,fp8,flydsl,666,0,64.9216,flydsl_mxpsh_96x128x128_F8_F8_B16_w3_x0,1128.79,927.7,0.0
gfx950,256,864,6144,7168,fp8,fp8,flydsl,669,0,65.6988,flydsl_mxpsh_96x128x128_F8_F8_B16_w4_x4,1158.34,926.2,0.0
gfx950,256,896,6144,7168,fp8,fp8,flydsl,668,0,65.7172,flydsl_mxpsh_96x128x128_F8_F8_B16_w4_x0,1200.9,935.41,0.0
gfx950,256,928,6144,7168,fp8,fp8,flydsl,665,0,65.7312,flydsl_mxpsh_96x128x128_F8_F8_B16_w2_x4,1243.53,944.69,0.0
gfx950,256,960,6144,7168,fp8,fp8,flydsl,665,0,65.8436,flydsl_mxpsh_96x128x128_F8_F8_B16_w2_x4,1284.21,952.53,0.0
gfx950,256,992,6144,7168,fp8,fp8,flydsl,730,0,67.2048,flydsl_mxpsh_128x128x256_F8_F8_B16_w0_x0,1300.14,942.5,0.0
gfx950,256,1024,6144,7168,fp8,fp8,flydsl,733,0,67.69,flydsl_mxpsh_128x128x256_F8_F8_B16_w1_x4,1332.46,944.94,0.0
gfx950,256,1088,6144,7168,fp8,fp8,flydsl,727,0,74.8029,flydsl_mxpsh_128x128x128_F8_F8_B16_w3_x4,1281.12,871.74,0.0
gfx950,256,1152,6144,7168,fp8,fp8,flydsl,727,0,75.9537,flydsl_mxpsh_128x128x128_F8_F8_B16_w3_x4,1335.93,874.92,0.0
gfx950,256,1216,6144,7168,fp8,fp8,flydsl,738,0,71.1576,flydsl_mxpsh_128x128x256_F8_F8_B16_w4_x0,1505.19,951.39,0.0
gfx950,256,1280,6144,7168,fp8,fp8,flydsl,733,0,73.7629,flydsl_mxpsh_128x128x256_F8_F8_B16_w1_x4,1528.45,934.67,0.0
gfx950,256,1344,6144,7168,fp8,fp8,flydsl,661,0,85.7482,flydsl_mxpsh_96x128x128_F8_F8_B16_w0_x4,1380.55,818.55,0.0
gfx950,256,1408,6144,7168,fp8,fp8,flydsl,660,0,88.1396,flydsl_mxpsh_96x128x128_F8_F8_B16_w0_x0,1407.05,810.47,0.0
gfx950,256,1472,6144,7168,fp8,fp8,flydsl,666,0,89.0246,flydsl_mxpsh_96x128x128_F8_F8_B16_w3_x0,1456.39,816.4,0.0
gfx950,256,1536,6144,7168,fp8,fp8,flydsl,661,0,90.6823,flydsl_mxpsh_96x128x128_F8_F8_B16_w0_x4,1491.93,815.2,0.0
gfx950,256,1600,6144,7168,fp8,fp8,flydsl,684,0,102.8868,flydsl_mxpsh_96x256x128_F8_F8_B16_w2_x0,1369.74,730.61,0.0
gfx950,256,1664,6144,7168,fp8,fp8,flydsl,684,0,101.6395,flydsl_mxpsh_96x256x128_F8_F8_B16_w2_x0,1442.02,751.82,0.0
gfx950,256,1728,6144,7168,fp8,fp8,flydsl,723,0,100.1957,flydsl_mxpsh_128x128x128_F8_F8_B16_w1_x4,1519.06,775.08,0.0
gfx950,256,1792,6144,7168,fp8,fp8,flydsl,721,0,100.8727,flydsl_mxpsh_128x128x128_F8_F8_B16_w0_x4,1564.74,782.23,0.0
gfx950,256,1856,6144,7168,fp8,fp8,flydsl,680,0,104.7603,flydsl_mxpsh_96x256x128_F8_F8_B16_w0_x0,1560.49,765.08,0.0
gfx950,256,1920,6144,7168,fp8,fp8,flydsl,684,0,105.5875,flydsl_mxpsh_96x256x128_F8_F8_B16_w2_x0,1601.65,770.88,0.0
gfx950,256,1984,6144,7168,fp8,fp8,flydsl,737,0,102.3279,flydsl_mxpsh_128x128x256_F8_F8_B16_w3_x4,1707.76,807.61,0.0
gfx950,256,2048,6144,7168,fp8,fp8,flydsl,734,0,104.1696,flydsl_mxpsh_128x128x256_F8_F8_B16_w2_x0,1731.68,805.28,0.0
gfx950,256,4096,6144,7168,fp8,fp8,flydsl,736,0,179.8663,flydsl_mxpsh_128x128x256_F8_F8_B16_w3_x0,2005.81,687.91,0.0
gfx950,256,6144,6144,7168,fp8,fp8,flydsl,737,0,257.4155,flydsl_mxpsh_128x128x256_F8_F8_B16_w3_x4,2102.3,635.46,0.0
gfx950,256,8192,6144,7168,fp8,fp8,flydsl,745,0,324.9195,flydsl_mxpsh_128x256x128_F8_F8_B16_w2_x4,2220.72,626.07,0.0
gfx950,256,10240,6144,7168,fp8,fp8,flydsl,745,0,399.162,flydsl_mxpsh_128x256x128_F8_F8_B16_w2_x4,2259.59,609.45,0.0
gfx950,256,12288,6144,7168,fp8,fp8,flydsl,742,0,472.3624,flydsl_mxpsh_128x256x128_F8_F8_B16_w1_x0,2291.32,599.36,0.0
gfx950,256,14336,6144,7168,fp8,fp8,flydsl,743,0,552.6245,flydsl_mxpsh_128x256x128_F8_F8_B16_w1_x4,2284.95,584.41,0.0
gfx950,256,16384,6144,7168,fp8,fp8,flydsl,745,0,629.4316,flydsl_mxpsh_128x256x128_F8_F8_B16_w2_x4,2292.72,576.4,0.0
gfx950,256,20480,6144,7168,fp8,fp8,flydsl,743,0,761.8678,flydsl_mxpsh_128x256x128_F8_F8_B16_w1_x4,2367.72,580.81,0.0
gfx950,256,24576,6144,7168,fp8,fp8,flydsl,740,0,915.6222,flydsl_mxpsh_128x256x128_F8_F8_B16_w0_x0,2364.14,570.31,0.0
gfx950,256,28672,6144,7168,fp8,fp8,flydsl,743,0,1053.7255,flydsl_mxpsh_128x256x128_F8_F8_B16_w1_x4,2396.68,571.19,0.0
gfx950,256,32768,6144,7168,fp8,fp8,flydsl,741,0,1321.8523,flydsl_mxpsh_128x256x128_F8_F8_B16_w0_x4,2183.46,515.62,0.0
gfx950,256,40960,6144,7168,fp8,fp8,flydsl,762,0,1786.3053,flydsl_mxpsh_128x512x128_F8_F8_B16_w1_x0,2019.68,470.78,0.0
gfx950,256,49152,6144,7168,fp8,fp8,flydsl,760,0,2143.3692,flydsl_mxpsh_128x512x128_F8_F8_B16_w0_x0,2019.87,466.71,0.0
gfx950,256,57344,6144,7168,fp8,fp8,flydsl,761,0,2487.5404,flydsl_mxpsh_128x512x128_F8_F8_B16_w0_x4,2030.47,466.21,0.0
gfx950,256,65536,6144,7168,fp8,fp8,flydsl,710,0,2874.8701,flydsl_mxpsh_96x512x256_F8_F8_B16_w0_x0,2007.89,458.84,0.0
gfx950,256,1,7168,384,fp8,fp8,flydsl,541,0,4.8386,flydsl_mxpsh_32x128x128_F8_F8_B16_w0_x4,1.14,571.91,0.0
gfx950,256,1,7168,3072,fp8,fp8,flydsl,555,0,15.05,flydsl_mxpsh_32x128x256_F8_F8_B16_w2_x4,2.93,1464.29,0.0
gfx950,256,1,7168,7168,fp8,fp8,flydsl,558,0,32.471,flydsl_mxpsh_32x128x256_F8_F8_B16_w4_x0,3.16,1583.0,0.0
gfx950,256,1,7168,16384,fp8,fp8,flydsl,553,0,72.0325,flydsl_mxpsh_32x128x256_F8_F8_B16_w1_x4,3.26,1630.81,0.0
gfx950,256,2,7168,384,fp8,fp8,flydsl,543,0,4.895,flydsl_mxpsh_32x128x128_F8_F8_B16_w1_x4,2.25,568.33,0.0
gfx950,256,2,7168,3072,fp8,fp8,flydsl,552,0,15.1527,flydsl_mxpsh_32x128x256_F8_F8_B16_w1_x0,5.81,1455.51,0.0
gfx950,256,2,7168,7168,fp8,fp8,flydsl,550,0,32.6375,flydsl_mxpsh_32x128x256_F8_F8_B16_w0_x0,6.3,1575.59,0.0
gfx950,256,2,7168,16384,fp8,fp8,flydsl,553,0,72.2029,flydsl_mxpsh_32x128x256_F8_F8_B16_w1_x4,6.51,1627.39,0.0
gfx950,256,4,7168,384,fp8,fp8,flydsl,549,0,4.7843,flydsl_mxpsh_32x128x128_F8_F8_B16_w4_x4,4.6,587.63,0.0
gfx950,256,4,7168,3072,fp8,fp8,flydsl,553,0,15.1803,flydsl_mxpsh_32x128x256_F8_F8_B16_w1_x4,11.6,1455.16,0.0
gfx950,256,4,7168,7168,fp8,fp8,flydsl,553,0,32.5316,flydsl_mxpsh_32x128x256_F8_F8_B16_w1_x4,12.64,1582.04,0.0
gfx950,256,4,7168,16384,fp8,fp8,flydsl,556,0,72.0627,flydsl_mxpsh_32x128x256_F8_F8_B16_w3_x0,13.04,1631.4,0.0
gfx950,256,8,7168,384,fp8,fp8,flydsl,546,0,4.8631,flydsl_mxpsh_32x128x128_F8_F8_B16_w3_x0,9.06,590.21,0.0
gfx950,256,8,7168,3072,fp8,fp8,flydsl,553,0,15.175,flydsl_mxpsh_32x128x256_F8_F8_B16_w1_x4,23.22,1460.25,0.0
gfx950,256,8,7168,7168,fp8,fp8,flydsl,555,0,32.6406,flydsl_mxpsh_32x128x256_F8_F8_B16_w2_x4,25.19,1579.39,0.0
gfx950,256,8,7168,16384,fp8,fp8,flydsl,552,0,72.4648,flydsl_mxpsh_32x128x256_F8_F8_B16_w1_x0,25.93,1624.05,0.0
gfx950,256,16,7168,384,fp8,fp8,flydsl,544,0,4.9011,flydsl_mxpsh_32x128x128_F8_F8_B16_w2_x0,17.97,609.67,0.0
gfx950,256,16,7168,3072,fp8,fp8,flydsl,554,0,15.2517,flydsl_mxpsh_32x128x256_F8_F8_B16_w2_x0,46.2,1462.04,0.0
gfx950,256,16,7168,7168,fp8,fp8,flydsl,558,0,32.6784,flydsl_mxpsh_32x128x256_F8_F8_B16_w4_x0,50.31,1582.83,0.0
gfx950,256,16,7168,16384,fp8,fp8,flydsl,556,0,72.3992,flydsl_mxpsh_32x128x256_F8_F8_B16_w3_x0,51.91,1628.91,0.0
gfx950,256,32,7168,384,fp8,fp8,flydsl,541,0,5.009,flydsl_mxpsh_32x128x128_F8_F8_B16_w0_x4,35.17,643.55,0.0
gfx950,256,32,7168,3072,fp8,fp8,flydsl,555,0,15.384,flydsl_mxpsh_32x128x256_F8_F8_B16_w2_x4,91.61,1467.57,0.0
gfx950,256,32,7168,7168,fp8,fp8,flydsl,557,0,32.8074,flydsl_mxpsh_32x128x256_F8_F8_B16_w3_x4,100.23,1587.09,0.0
gfx950,256,32,7168,16384,fp8,fp8,flydsl,553,0,72.6656,flydsl_mxpsh_32x128x256_F8_F8_B16_w1_x4,103.44,1629.71,0.0
gfx950,256,48,7168,384,fp8,fp8,flydsl,544,0,5.0381,flydsl_mxpsh_32x128x128_F8_F8_B16_w2_x0,52.45,686.58,0.0
gfx950,256,48,7168,3072,fp8,fp8,flydsl,559,0,15.2555,flydsl_mxpsh_32x128x256_F8_F8_B16_w4_x4,138.57,1498.19,0.0
gfx950,256,48,7168,7168,fp8,fp8,flydsl,559,0,31.5697,flydsl_mxpsh_32x128x256_F8_F8_B16_w4_x4,156.24,1660.21,0.0
gfx950,256,48,7168,16384,fp8,fp8,flydsl,557,0,71.3909,flydsl_mxpsh_32x128x256_F8_F8_B16_w3_x4,157.92,1665.69,0.0
gfx950,256,64,7168,384,fp8,fp8,flydsl,540,0,5.0724,flydsl_mxpsh_32x128x128_F8_F8_B16_w0_x0,69.46,728.37,0.0
gfx950,256,64,7168,3072,fp8,fp8,flydsl,557,0,15.6968,flydsl_mxpsh_32x128x256_F8_F8_B16_w3_x4,179.56,1473.82,0.0
gfx950,256,64,7168,7168,fp8,fp8,flydsl,557,0,32.0519,flydsl_mxpsh_32x128x256_F8_F8_B16_w3_x4,205.19,1645.97,0.0
gfx950,256,64,7168,16384,fp8,fp8,flydsl,557,0,71.4414,flydsl_mxpsh_32x128x256_F8_F8_B16_w3_x4,210.42,1671.39,0.0
gfx950,256,80,7168,384,fp8,fp8,flydsl,546,0,5.0588,flydsl_mxpsh_32x128x128_F8_F8_B16_w3_x0,87.06,776.89,0.0
gfx950,256,80,7168,3072,fp8,fp8,flydsl,551,0,16.7164,flydsl_mxpsh_32x128x256_F8_F8_B16_w0_x4,210.76,1400.58,0.0
gfx950,256,80,7168,7168,fp8,fp8,flydsl,550,0,35.4755,flydsl_mxpsh_32x128x256_F8_F8_B16_w0_x0,231.73,1496.82,0.0
gfx950,256,80,7168,16384,fp8,fp8,flydsl,556,0,74.6489,flydsl_mxpsh_32x128x256_F8_F8_B16_w3_x0,251.72,1606.16,0.0
gfx950,256,96,7168,384,fp8,fp8,flydsl,547,0,5.1479,flydsl_mxpsh_32x128x128_F8_F8_B16_w3_x4,102.66,809.19,0.0
gfx950,256,96,7168,3072,fp8,fp8,flydsl,553,0,16.9009,flydsl_mxpsh_32x128x256_F8_F8_B16_w1_x4,250.16,1401.78,0.0
gfx950,256,96,7168,7168,fp8,fp8,flydsl,558,0,35.7947,flydsl_mxpsh_32x128x256_F8_F8_B16_w4_x0,275.6,1493.09,0.0
gfx950,256,96,7168,16384,fp8,fp8,flydsl,552,0,75.1854,flydsl_mxpsh_32x128x256_F8_F8_B16_w1_x0,299.91,1601.24,0.0
gfx950,256,112,7168,384,fp8,fp8,flydsl,609,0,5.5413,flydsl_mxpsh_64x128x128_F8_F8_B16_w4_x4,111.27,794.25,0.0
gfx950,256,112,7168,3072,fp8,fp8,flydsl,616,0,17.4187,flydsl_mxpsh_64x128x256_F8_F8_B16_w3_x0,283.17,1376.1,0.0
gfx950,256,112,7168,7168,fp8,fp8,flydsl,612,0,36.8497,flydsl_mxpsh_64x128x256_F8_F8_B16_w1_x0,312.33,1459.68,0.0
gfx950,256,112,7168,16384,fp8,fp8,flydsl,612,0,76.2885,flydsl_mxpsh_64x128x256_F8_F8_B16_w1_x0,344.83,1584.53,0.0
gfx950,256,128,7168,384,fp8,fp8,flydsl,546,0,5.5825,flydsl_mxpsh_32x128x128_F8_F8_B16_w3_x0,126.22,830.57,0.0
gfx950,256,128,7168,3072,fp8,fp8,flydsl,610,0,17.5714,flydsl_mxpsh_64x128x256_F8_F8_B16_w0_x0,320.81,1379.99,0.0
gfx950,256,128,7168,7168,fp8,fp8,flydsl,610,0,36.9792,flydsl_mxpsh_64x128x256_F8_F8_B16_w0_x0,355.7,1463.87,0.0
gfx950,256,128,7168,16384,fp8,fp8,flydsl,614,0,77.0783,flydsl_mxpsh_64x128x256_F8_F8_B16_w2_x0,390.05,1574.67,0.0
gfx950,256,144,7168,384,fp8,fp8,flydsl,606,0,5.5999,flydsl_mxpsh_64x128x128_F8_F8_B16_w3_x0,141.56,870.05,0.0
gfx950,256,144,7168,3072,fp8,fp8,flydsl,738,0,18.8432,flydsl_mxpsh_128x128x256_F8_F8_B16_w4_x0,336.56,1301.63,0.0
gfx950,256,144,7168,7168,fp8,fp8,flydsl,737,0,38.47,flydsl_mxpsh_128x128x256_F8_F8_B16_w3_x4,384.65,1416.09,0.0
gfx950,256,144,7168,16384,fp8,fp8,flydsl,614,0,79.9509,flydsl_mxpsh_64x128x256_F8_F8_B16_w2_x0,423.05,1524.24,0.0
gfx950,256,160,7168,384,fp8,fp8,flydsl,609,0,5.7053,flydsl_mxpsh_64x128x128_F8_F8_B16_w4_x4,154.38,895.26,0.0
gfx950,256,160,7168,3072,fp8,fp8,flydsl,737,0,18.9477,flydsl_mxpsh_128x128x256_F8_F8_B16_w3_x4,371.89,1309.15,0.0
gfx950,256,160,7168,7168,fp8,fp8,flydsl,737,0,38.845,flydsl_mxpsh_128x128x256_F8_F8_B16_w3_x4,423.26,1411.27,0.0
gfx950,256,160,7168,16384,fp8,fp8,flydsl,616,0,81.5216,flydsl_mxpsh_64x128x256_F8_F8_B16_w3_x0,460.99,1500.9,0.0
gfx950,256,176,7168,384,fp8,fp8,flydsl,603,0,5.7935,flydsl_mxpsh_64x128x128_F8_F8_B16_w1_x4,167.24,922.28,0.0
gfx950,256,176,7168,3072,fp8,fp8,flydsl,734,0,19.1026,flydsl_mxpsh_128x128x256_F8_F8_B16_w2_x0,405.76,1313.11,0.0
gfx950,256,176,7168,7168,fp8,fp8,flydsl,739,0,39.0843,flydsl_mxpsh_128x128x256_F8_F8_B16_w4_x4,462.74,1411.43,0.0
gfx950,256,176,7168,16384,fp8,fp8,flydsl,617,0,83.0532,flydsl_mxpsh_64x128x256_F8_F8_B16_w3_x4,497.74,1479.14,0.0
gfx950,256,192,7168,384,fp8,fp8,flydsl,604,0,5.8988,flydsl_mxpsh_64x128x128_F8_F8_B16_w2_x0,179.18,945.74,0.0
gfx950,256,192,7168,3072,fp8,fp8,flydsl,739,0,19.207,flydsl_mxpsh_128x128x256_F8_F8_B16_w4_x4,440.24,1320.48,0.0
gfx950,256,192,7168,7168,fp8,fp8,flydsl,738,0,39.5037,flydsl_mxpsh_128x128x256_F8_F8_B16_w4_x0,499.45,1405.16,0.0
gfx950,256,192,7168,16384,fp8,fp8,flydsl,611,0,83.9405,flydsl_mxpsh_64x128x256_F8_F8_B16_w0_x4,537.25,1469.36,0.0
gfx950,256,208,7168,384,fp8,fp8,flydsl,664,0,6.0584,flydsl_mxpsh_96x128x128_F8_F8_B16_w2_x0,189.0,959.7,0.0
gfx950,256,208,7168,3072,fp8,fp8,flydsl,734,0,19.3272,flydsl_mxpsh_128x128x256_F8_F8_B16_w2_x0,473.96,1326.68,0.0
gfx950,256,208,7168,7168,fp8,fp8,flydsl,732,0,39.9343,flydsl_mxpsh_128x128x256_F8_F8_B16_w1_x0,535.23,1398.62,0.0
gfx950,256,208,7168,16384,fp8,fp8,flydsl,739,0,86.89,flydsl_mxpsh_128x128x256_F8_F8_B16_w4_x4,562.27,1425.14,0.0
gfx950,256,224,7168,384,fp8,fp8,flydsl,660,0,6.1298,flydsl_mxpsh_96x128x128_F8_F8_B16_w0_x0,201.17,986.95,0.0
gfx950,256,224,7168,3072,fp8,fp8,flydsl,738,0,19.4598,flydsl_mxpsh_128x128x256_F8_F8_B16_w4_x0,506.94,1331.95,0.0
gfx950,256,224,7168,7168,fp8,fp8,flydsl,730,0,40.2456,flydsl_mxpsh_128x128x256_F8_F8_B16_w0_x0,571.95,1396.35,0.0
gfx950,256,224,7168,16384,fp8,fp8,flydsl,736,0,87.9996,flydsl_mxpsh_128x128x256_F8_F8_B16_w3_x0,597.88,1412.75,0.0
gfx950,256,240,7168,384,fp8,fp8,flydsl,665,0,6.1793,flydsl_mxpsh_96x128x128_F8_F8_B16_w2_x4,213.81,1017.16,0.0
gfx950,256,240,7168,3072,fp8,fp8,flydsl,733,0,19.5655,flydsl_mxpsh_128x128x256_F8_F8_B16_w1_x4,540.22,1338.99,0.0
gfx950,256,240,7168,7168,fp8,fp8,flydsl,736,0,40.5278,flydsl_mxpsh_128x128x256_F8_F8_B16_w3_x0,608.53,1395.12,0.0
gfx950,256,240,7168,16384,fp8,fp8,flydsl,731,0,88.8009,flydsl_mxpsh_128x128x256_F8_F8_B16_w0_x4,634.81,1405.54,0.0
gfx950,256,256,7168,384,fp8,fp8,flydsl,665,0,6.2455,flydsl_mxpsh_96x128x128_F8_F8_B16_w2_x4,225.65,1044.08,0.0
gfx950,256,256,7168,3072,fp8,fp8,flydsl,737,0,19.6991,flydsl_mxpsh_128x128x256_F8_F8_B16_w3_x4,572.33,1344.05,0.0
gfx950,256,256,7168,7168,fp8,fp8,flydsl,732,0,40.9184,flydsl_mxpsh_128x128x256_F8_F8_B16_w1_x0,642.91,1390.21,0.0
gfx950,256,256,7168,16384,fp8,fp8,flydsl,735,0,89.6298,flydsl_mxpsh_128x128x256_F8_F8_B16_w2_x4,670.87,1398.03,0.0
gfx950,256,288,7168,384,fp8,fp8,flydsl,663,0,6.4222,flydsl_mxpsh_96x128x128_F8_F8_B16_w1_x4,246.87,1088.7,0.0
gfx950,256,288,7168,3072,fp8,fp8,flydsl,731,0,20.6642,flydsl_mxpsh_128x128x256_F8_F8_B16_w0_x4,613.79,1308.23,0.0
gfx950,256,288,7168,7168,fp8,fp8,flydsl,739,0,41.8243,flydsl_mxpsh_128x128x256_F8_F8_B16_w4_x4,707.6,1376.55,0.0
gfx950,256,288,7168,16384,fp8,fp8,flydsl,737,0,89.2784,flydsl_mxpsh_128x128x256_F8_F8_B16_w3_x4,757.69,1414.54,0.0
gfx950,256,320,7168,384,fp8,fp8,flydsl,722,0,6.8523,flydsl_mxpsh_128x128x128_F8_F8_B16_w1_x0,257.08,1089.11,0.0
gfx950,256,320,7168,3072,fp8,fp8,flydsl,736,0,21.3048,flydsl_mxpsh_128x128x256_F8_F8_B16_w3_x0,661.49,1295.04,0.0
gfx950,256,320,7168,7168,fp8,fp8,flydsl,730,0,43.3602,flydsl_mxpsh_128x128x256_F8_F8_B16_w0_x0,758.38,1343.66,0.0
gfx950,256,320,7168,16384,fp8,fp8,flydsl,737,0,91.4686,flydsl_mxpsh_128x128x256_F8_F8_B16_w3_x4,821.72,1391.42,0.0
gfx950,256,352,7168,384,fp8,fp8,flydsl,721,0,6.9607,flydsl_mxpsh_128x128x128_F8_F8_B16_w0_x4,278.39,1139.82,0.0
gfx950,256,352,7168,3072,fp8,fp8,flydsl,730,0,21.676,flydsl_mxpsh_128x128x256_F8_F8_B16_w0_x0,715.18,1298.57,0.0
gfx950,256,352,7168,7168,fp8,fp8,flydsl,733,0,44.3744,flydsl_mxpsh_128x128x256_F8_F8_B16_w1_x4,815.15,1328.46,0.0
gfx950,256,352,7168,16384,fp8,fp8,flydsl,733,0,94.6539,flydsl_mxpsh_128x128x256_F8_F8_B16_w1_x4,873.48,1354.98,0.0
gfx950,256,384,7168,384,fp8,fp8,flydsl,664,0,7.0201,flydsl_mxpsh_96x128x128_F8_F8_B16_w2_x0,301.13,1197.28,0.0
gfx950,256,384,7168,3072,fp8,fp8,flydsl,734,0,21.8423,flydsl_mxpsh_128x128x256_F8_F8_B16_w2_x0,774.25,1314.18,0.0
gfx950,256,384,7168,7168,fp8,fp8,flydsl,734,0,44.8303,flydsl_mxpsh_128x128x256_F8_F8_B16_w2_x0,880.21,1330.3,0.0
gfx950,256,384,7168,16384,fp8,fp8,flydsl,735,0,97.391,flydsl_mxpsh_128x128x256_F8_F8_B16_w2_x4,926.11,1326.99,0.0
gfx950,256,416,7168,384,fp8,fp8,flydsl,543,0,7.3476,flydsl_mxpsh_32x128x128_F8_F8_B16_w1_x4,311.68,1208.02,0.0
gfx950,256,416,7168,3072,fp8,fp8,flydsl,734,0,23.2027,flydsl_mxpsh_128x128x256_F8_F8_B16_w2_x0,789.59,1261.14,0.0
gfx950,256,416,7168,7168,fp8,fp8,flydsl,732,0,47.4855,flydsl_mxpsh_128x128x256_F8_F8_B16_w1_x0,900.24,1270.41,0.0
gfx950,256,416,7168,16384,fp8,fp8,flydsl,733,0,99.2798,flydsl_mxpsh_128x128x256_F8_F8_B16_w1_x4,984.19,1311.65,0.0
gfx950,256,448,7168,384,fp8,fp8,flydsl,604,0,7.5578,flydsl_mxpsh_64x128x128_F8_F8_B16_w2_x0,326.32,1236.75,0.0
gfx950,256,448,7168,3072,fp8,fp8,flydsl,735,0,23.4838,flydsl_mxpsh_128x128x256_F8_F8_B16_w2_x4,840.15,1269.76,0.0
gfx950,256,448,7168,7168,fp8,fp8,flydsl,730,0,48.7574,flydsl_mxpsh_128x128x256_F8_F8_B16_w0_x0,944.2,1251.38,0.0
gfx950,256,448,7168,16384,fp8,fp8,flydsl,734,0,100.2852,flydsl_mxpsh_128x128x256_F8_F8_B16_w2_x0,1049.27,1308.3,0.0
gfx950,256,480,7168,384,fp8,fp8,flydsl,724,0,7.8113,flydsl_mxpsh_128x128x128_F8_F8_B16_w2_x0,338.28,1256.91,0.0
gfx950,256,480,7168,3072,fp8,fp8,flydsl,735,0,23.7866,flydsl_mxpsh_128x128x256_F8_F8_B16_w2_x4,888.71,1277.02,0.0
gfx950,256,480,7168,7168,fp8,fp8,flydsl,735,0,50.5792,flydsl_mxpsh_128x128x256_F8_F8_B16_w2_x4,975.2,1219.91,0.0
gfx950,256,480,7168,16384,fp8,fp8,flydsl,738,0,101.8658,flydsl_mxpsh_128x128x256_F8_F8_B16_w4_x0,1106.78,1297.65,0.0
gfx950,256,512,7168,384,fp8,fp8,flydsl,724,0,7.8321,flydsl_mxpsh_128x128x128_F8_F8_B16_w2_x0,359.87,1313.72,0.0
gfx950,256,512,7168,3072,fp8,fp8,flydsl,739,0,23.9689,flydsl_mxpsh_128x128x256_F8_F8_B16_w4_x4,940.74,1290.55,0.0
gfx950,256,512,7168,7168,fp8,fp8,flydsl,731,0,51.3776,flydsl_mxpsh_128x128x256_F8_F8_B16_w0_x4,1024.05,1214.35,0.0
gfx950,256,512,7168,16384,fp8,fp8,flydsl,732,0,105.5923,flydsl_mxpsh_128x128x256_F8_F8_B16_w1_x0,1138.9,1261.16,0.0
gfx950,256,544,7168,384,fp8,fp8,flydsl,661,0,8.1277,flydsl_mxpsh_96x128x128_F8_F8_B16_w0_x4,368.46,1323.89,0.0
gfx950,256,544,7168,3072,fp8,fp8,flydsl,664,0,28.864,flydsl_mxpsh_96x128x128_F8_F8_B16_w2_x0,830.03,1090.98,0.0
gfx950,256,544,7168,7168,fp8,fp8,flydsl,664,0,60.7637,flydsl_mxpsh_96x128x128_F8_F8_B16_w2_x0,919.98,1038.09,0.0
gfx950,256,544,7168,16384,fp8,fp8,flydsl,674,0,130.925,flydsl_mxpsh_96x128x256_F8_F8_B16_w2_x0,975.94,1024.65,0.0
gfx950,256,576,7168,384,fp8,fp8,flydsl,660,0,8.2391,flydsl_mxpsh_96x128x128_F8_F8_B16_w0_x0,384.86,1363.16,0.0
gfx950,256,576,7168,3072,fp8,fp8,flydsl,665,0,29.3997,flydsl_mxpsh_96x128x128_F8_F8_B16_w2_x4,862.84,1090.05,0.0
gfx950,256,576,7168,7168,fp8,fp8,flydsl,669,0,61.6774,flydsl_mxpsh_96x128x128_F8_F8_B16_w4_x4,959.67,1033.87,0.0
gfx950,256,576,7168,16384,fp8,fp8,flydsl,670,0,132.8001,flydsl_mxpsh_96x128x256_F8_F8_B16_w0_x0,1018.76,1017.58,0.0
gfx950,256,608,7168,384,fp8,fp8,flydsl,661,0,8.4713,flydsl_mxpsh_96x128x128_F8_F8_B16_w0_x4,395.11,1381.4,0.0
gfx950,256,608,7168,3072,fp8,fp8,flydsl,665,0,30.2443,flydsl_mxpsh_96x128x128_F8_F8_B16_w2_x4,885.34,1078.03,0.0
gfx950,256,608,7168,7168,fp8,fp8,flydsl,665,0,63.4684,flydsl_mxpsh_96x128x128_F8_F8_B16_w2_x4,984.4,1015.54,0.0
gfx950,256,608,7168,16384,fp8,fp8,flydsl,668,0,139.8328,flydsl_mxpsh_96x128x128_F8_F8_B16_w4_x0,1021.27,973.44,0.0
gfx950,256,640,7168,384,fp8,fp8,flydsl,662,0,8.5594,flydsl_mxpsh_96x128x128_F8_F8_B16_w1_x0,411.62,1422.22,0.0
gfx950,256,640,7168,3072,fp8,fp8,flydsl,664,0,30.8887,flydsl_mxpsh_96x128x128_F8_F8_B16_w2_x0,912.49,1073.57,0.0
gfx950,256,640,7168,7168,fp8,fp8,flydsl,666,0,64.4632,flydsl_mxpsh_96x128x128_F8_F8_B16_w3_x0,1020.22,1010.54,0.0
gfx950,256,640,7168,16384,fp8,fp8,flydsl,669,0,142.0789,flydsl_mxpsh_96x128x128_F8_F8_B16_w4_x4,1058.03,964.97,0.0
gfx950,256,672,7168,384,fp8,fp8,flydsl,661,0,8.7263,flydsl_mxpsh_96x128x128_F8_F8_B16_w0_x4,423.93,1448.99,0.0
gfx950,256,672,7168,3072,fp8,fp8,flydsl,731,0,31.1162,flydsl_mxpsh_128x128x256_F8_F8_B16_w0_x4,951.11,1083.62,0.0
gfx950,256,672,7168,7168,fp8,fp8,flydsl,669,0,65.3199,flydsl_mxpsh_96x128x128_F8_F8_B16_w4_x4,1057.18,1007.82,0.0
gfx950,256,672,7168,16384,fp8,fp8,flydsl,669,0,143.1062,flydsl_mxpsh_96x128x128_F8_F8_B16_w4_x4,1102.96,964.91,0.0
gfx950,256,704,7168,384,fp8,fp8,flydsl,720,0,9.0633,flydsl_mxpsh_128x128x128_F8_F8_B16_w0_x0,427.61,1447.09,0.0
gfx950,256,704,7168,3072,fp8,fp8,flydsl,735,0,31.6345,flydsl_mxpsh_128x128x256_F8_F8_B16_w2_x4,980.08,1083.48,0.0
gfx950,256,704,7168,7168,fp8,fp8,flydsl,669,0,65.9991,flydsl_mxpsh_96x128x128_F8_F8_B16_w4_x4,1096.13,1007.88,0.0
gfx950,256,704,7168,16384,fp8,fp8,flydsl,668,0,141.515,flydsl_mxpsh_96x128x128_F8_F8_B16_w4_x0,1168.47,982.7,0.0
gfx950,256,736,7168,384,fp8,fp8,flydsl,725,0,9.1915,flydsl_mxpsh_128x128x128_F8_F8_B16_w2_x4,440.81,1478.15,0.0
gfx950,256,736,7168,3072,fp8,fp8,flydsl,664,0,32.1842,flydsl_mxpsh_96x128x128_F8_F8_B16_w2_x0,1007.13,1082.28,0.0
gfx950,256,736,7168,7168,fp8,fp8,flydsl,665,0,66.7632,flydsl_mxpsh_96x128x128_F8_F8_B16_w2_x4,1132.84,1006.65,0.0
gfx950,256,736,7168,16384,fp8,fp8,flydsl,670,0,143.9531,flydsl_mxpsh_96x128x256_F8_F8_B16_w0_x0,1200.89,972.89,0.0
gfx950,256,768,7168,384,fp8,fp8,flydsl,602,0,9.2662,flydsl_mxpsh_64x128x128_F8_F8_B16_w1_x0,456.27,1517.07,0.0
gfx950,256,768,7168,3072,fp8,fp8,flydsl,735,0,32.7141,flydsl_mxpsh_128x128x256_F8_F8_B16_w2_x4,1033.89,1081.78,0.0
gfx950,256,768,7168,7168,fp8,fp8,flydsl,665,0,67.8645,flydsl_mxpsh_96x128x128_F8_F8_B16_w2_x4,1162.91,1000.45,0.0
gfx950,256,768,7168,16384,fp8,fp8,flydsl,675,0,144.9998,flydsl_mxpsh_96x128x256_F8_F8_B16_w2_x4,1244.06,972.65,0.0
gfx950,256,800,7168,384,fp8,fp8,flydsl,722,0,9.4833,flydsl_mxpsh_128x128x128_F8_F8_B16_w1_x0,464.4,1532.01,0.0
gfx950,256,800,7168,3072,fp8,fp8,flydsl,669,0,33.1429,flydsl_mxpsh_96x128x128_F8_F8_B16_w4_x4,1063.04,1084.59,0.0
gfx950,256,800,7168,7168,fp8,fp8,flydsl,667,0,69.7236,flydsl_mxpsh_96x128x128_F8_F8_B16_w3_x4,1179.06,983.65,0.0
gfx950,256,800,7168,16384,fp8,fp8,flydsl,668,0,149.0697,flydsl_mxpsh_96x128x128_F8_F8_B16_w4_x0,1260.52,952.69,0.0
gfx950,256,832,7168,384,fp8,fp8,flydsl,724,0,9.606,flydsl_mxpsh_128x128x128_F8_F8_B16_w2_x0,476.8,1561.48,0.0
gfx950,256,832,7168,3072,fp8,fp8,flydsl,666,0,33.4151,flydsl_mxpsh_96x128x128_F8_F8_B16_w3_x0,1096.55,1092.43,0.0
gfx950,256,832,7168,7168,fp8,fp8,flydsl,665,0,69.828,flydsl_mxpsh_96x128x128_F8_F8_B16_w2_x4,1224.39,992.03,0.0
gfx950,256,832,7168,16384,fp8,fp8,flydsl,669,0,151.3635,flydsl_mxpsh_96x128x128_F8_F8_B16_w4_x4,1291.07,944.74,0.0
gfx950,256,864,7168,384,fp8,fp8,flydsl,722,0,9.7563,flydsl_mxpsh_128x128x128_F8_F8_B16_w1_x0,487.51,1585.7,0.0
gfx950,256,864,7168,3072,fp8,fp8,flydsl,667,0,33.7958,flydsl_mxpsh_96x128x128_F8_F8_B16_w3_x4,1125.9,1096.6,0.0
gfx950,256,864,7168,7168,fp8,fp8,flydsl,667,0,71.2876,flydsl_mxpsh_96x128x128_F8_F8_B16_w3_x4,1245.45,981.37,0.0
gfx950,256,864,7168,16384,fp8,fp8,flydsl,668,0,151.0527,flydsl_mxpsh_96x128x128_F8_F8_B16_w4_x0,1343.49,953.19,0.0
gfx950,256,896,7168,384,fp8,fp8,flydsl,720,0,9.9252,flydsl_mxpsh_128x128x128_F8_F8_B16_w0_x0,496.97,1606.18,0.0
gfx950,256,896,7168,3072,fp8,fp8,flydsl,726,0,35.2414,flydsl_mxpsh_128x128x128_F8_F8_B16_w3_x0,1119.71,1067.43,0.0
gfx950,256,896,7168,7168,fp8,fp8,flydsl,757,0,74.8936,flydsl_mxpsh_128x256x256_F8_F8_B16_w3_x4,1229.39,943.31,0.0
gfx950,256,896,7168,16384,fp8,fp8,flydsl,792,0,159.4779,flydsl_mxpsh_256x128x256_F8_F8_B16_w1_x0,1319.64,909.0,0.0
gfx950,256,928,7168,384,fp8,fp8,flydsl,622,0,10.4379,flydsl_mxpsh_64x256x128_F8_F8_B16_w1_x0,489.43,1572.41,0.0
gfx950,256,928,7168,3072,fp8,fp8,flydsl,734,0,33.946,flydsl_mxpsh_128x128x256_F8_F8_B16_w2_x0,1203.95,1124.57,0.0
gfx950,256,928,7168,7168,fp8,fp8,flydsl,737,0,71.1892,flydsl_mxpsh_128x128x256_F8_F8_B16_w3_x4,1339.55,1002.06,0.0
gfx950,256,928,7168,16384,fp8,fp8,flydsl,731,0,151.7062,flydsl_mxpsh_128x128x256_F8_F8_B16_w0_x4,1436.79,962.05,0.0
gfx950,256,960,7168,384,fp8,fp8,flydsl,622,0,10.482,flydsl_mxpsh_64x256x128_F8_F8_B16_w1_x0,504.18,1610.73,0.0
gfx950,256,960,7168,3072,fp8,fp8,flydsl,739,0,34.3367,flydsl_mxpsh_128x128x256_F8_F8_B16_w4_x4,1231.29,1128.0,0.0
gfx950,256,960,7168,7168,fp8,fp8,flydsl,732,0,72.2648,flydsl_mxpsh_128x128x256_F8_F8_B16_w1_x0,1365.12,996.67,0.0
gfx950,256,960,7168,16384,fp8,fp8,flydsl,738,0,155.6067,flydsl_mxpsh_128x128x256_F8_F8_B16_w4_x0,1449.08,944.25,0.0
gfx950,256,992,7168,384,fp8,fp8,flydsl,660,0,10.5958,flydsl_mxpsh_96x128x128_F8_F8_B16_w0_x0,515.39,1637.89,0.0
gfx950,256,992,7168,3072,fp8,fp8,flydsl,732,0,34.6459,flydsl_mxpsh_128x128x256_F8_F8_B16_w1_x0,1260.98,1134.01,0.0
gfx950,256,992,7168,7168,fp8,fp8,flydsl,732,0,72.6384,flydsl_mxpsh_128x128x256_F8_F8_B16_w1_x0,1403.37,1001.02,0.0
gfx950,256,992,7168,16384,fp8,fp8,flydsl,733,0,157.3587,flydsl_mxpsh_128x128x256_F8_F8_B16_w1_x4,1480.71,939.98,0.0
gfx950,256,1024,7168,384,fp8,fp8,flydsl,721,0,10.5481,flydsl_mxpsh_128x128x128_F8_F8_B16_w0_x4,534.42,1689.95,0.0
gfx950,256,1024,7168,3072,fp8,fp8,flydsl,738,0,35.2365,flydsl_mxpsh_128x128x256_F8_F8_B16_w4_x0,1279.84,1130.81,0.0
gfx950,256,1024,7168,7168,fp8,fp8,flydsl,733,0,72.6996,flydsl_mxpsh_128x128x256_F8_F8_B16_w1_x4,1447.42,1009.64,0.0
gfx950,256,1024,7168,16384,fp8,fp8,flydsl,736,0,158.4024,flydsl_mxpsh_128x128x256_F8_F8_B16_w3_x0,1518.4,940.0,0.0
gfx950,256,1088,7168,384,fp8,fp8,flydsl,622,0,10.8574,flydsl_mxpsh_64x256x128_F8_F8_B16_w1_x0,551.65,1728.58,0.0
gfx950,256,1088,7168,3072,fp8,fp8,flydsl,727,0,37.057,flydsl_mxpsh_128x128x128_F8_F8_B16_w3_x4,1293.03,1105.32,0.0
gfx950,256,1088,7168,7168,fp8,fp8,flydsl,726,0,79.6797,flydsl_mxpsh_128x128x128_F8_F8_B16_w3_x0,1403.16,938.46,0.0
gfx950,256,1088,7168,16384,fp8,fp8,flydsl,662,0,170.9961,flydsl_mxpsh_96x128x128_F8_F8_B16_w1_x0,1494.48,882.26,0.0
gfx950,256,1152,7168,384,fp8,fp8,flydsl,665,0,11.0629,flydsl_mxpsh_96x128x128_F8_F8_B16_w2_x4,573.25,1781.63,0.0
gfx950,256,1152,7168,3072,fp8,fp8,flydsl,726,0,37.6528,flydsl_mxpsh_128x128x128_F8_F8_B16_w3_x0,1347.42,1117.42,0.0
gfx950,256,1152,7168,7168,fp8,fp8,flydsl,726,0,80.5149,flydsl_mxpsh_128x128x128_F8_F8_B16_w3_x0,1470.29,945.82,0.0
gfx950,256,1152,7168,16384,fp8,fp8,flydsl,663,0,174.2389,flydsl_mxpsh_96x128x128_F8_F8_B16_w1_x4,1552.94,877.13,0.0
gfx950,256,1216,7168,384,fp8,fp8,flydsl,665,0,11.4053,flydsl_mxpsh_96x128x128_F8_F8_B16_w2_x4,586.93,1810.74,0.0
gfx950,256,1216,7168,3072,fp8,fp8,flydsl,662,0,42.3379,flydsl_mxpsh_96x128x128_F8_F8_B16_w1_x0,1264.89,1020.08,0.0
gfx950,256,1216,7168,7168,fp8,fp8,flydsl,661,0,90.1814,flydsl_mxpsh_96x128x128_F8_F8_B16_w0_x4,1385.62,859.7,0.0
gfx950,256,1216,7168,16384,fp8,fp8,flydsl,667,0,181.517,flydsl_mxpsh_96x128x128_F8_F8_B16_w3_x4,1573.49,852.79,0.0
gfx950,256,1280,7168,384,fp8,fp8,flydsl,680,0,12.0123,flydsl_mxpsh_96x256x128_F8_F8_B16_w0_x0,586.6,1797.67,0.0
gfx950,256,1280,7168,3072,fp8,fp8,flydsl,684,0,46.316,flydsl_mxpsh_96x256x128_F8_F8_B16_w2_x0,1217.11,956.52,0.0
gfx950,256,1280,7168,7168,fp8,fp8,flydsl,683,0,100.0944,flydsl_mxpsh_96x256x128_F8_F8_B16_w1_x4,1314.09,788.31,0.0
gfx950,256,1280,7168,16384,fp8,fp8,flydsl,736,0,220.3902,flydsl_mxpsh_128x128x256_F8_F8_B16_w3_x0,1364.16,711.29,0.0
gfx950,256,1344,7168,384,fp8,fp8,flydsl,721,0,12.1366,flydsl_mxpsh_128x128x128_F8_F8_B16_w0_x4,609.62,1856.88,0.0
gfx950,256,1344,7168,3072,fp8,fp8,flydsl,723,0,48.339,flydsl_mxpsh_128x128x128_F8_F8_B16_w1_x4,1224.48,939.54,0.0
gfx950,256,1344,7168,7168,fp8,fp8,flydsl,682,0,101.9987,flydsl_mxpsh_96x256x128_F8_F8_B16_w1_x0,1354.04,787.08,0.0
gfx950,256,1344,7168,16384,fp8,fp8,flydsl,680,0,224.0232,flydsl_mxpsh_96x256x128_F8_F8_B16_w0_x0,1409.14,708.53,0.0
gfx950,256,1408,7168,384,fp8,fp8,flydsl,724,0,12.4025,flydsl_mxpsh_128x128x128_F8_F8_B16_w2_x0,624.96,1893.03,0.0
gfx950,256,1408,7168,3072,fp8,fp8,flydsl,685,0,49.894,flydsl_mxpsh_96x256x128_F8_F8_B16_w2_x4,1242.81,932.59,0.0
gfx950,256,1408,7168,7168,fp8,fp8,flydsl,684,0,105.5459,flydsl_mxpsh_96x256x128_F8_F8_B16_w2_x0,1370.84,773.67,0.0
gfx950,256,1408,7168,16384,fp8,fp8,flydsl,682,0,234.8778,flydsl_mxpsh_96x256x128_F8_F8_B16_w1_x0,1408.02,684.16,0.0
gfx950,256,1472,7168,384,fp8,fp8,flydsl,722,0,12.4762,flydsl_mxpsh_128x128x128_F8_F8_B16_w1_x0,649.51,1957.35,0.0
gfx950,256,1472,7168,3072,fp8,fp8,flydsl,724,0,46.1639,flydsl_mxpsh_128x128x128_F8_F8_B16_w2_x0,1404.28,1032.08,0.0
gfx950,256,1472,7168,7168,fp8,fp8,flydsl,725,0,98.7555,flydsl_mxpsh_128x128x128_F8_F8_B16_w2_x4,1531.7,840.8,0.0
gfx950,256,1472,7168,16384,fp8,fp8,flydsl,732,0,213.0865,flydsl_mxpsh_128x128x256_F8_F8_B16_w1_x0,1622.56,763.35,0.0
gfx950,256,1536,7168,384,fp8,fp8,flydsl,722,0,12.5355,flydsl_mxpsh_128x128x128_F8_F8_B16_w1_x0,674.54,2023.25,0.0
gfx950,256,1536,7168,3072,fp8,fp8,flydsl,723,0,47.445,flydsl_mxpsh_128x128x128_F8_F8_B16_w1_x4,1425.77,1027.69,0.0
gfx950,256,1536,7168,7168,fp8,fp8,flydsl,723,0,100.9447,flydsl_mxpsh_128x128x128_F8_F8_B16_w1_x4,1563.63,836.2,0.0
gfx950,256,1536,7168,16384,fp8,fp8,flydsl,734,0,217.3681,flydsl_mxpsh_128x128x256_F8_F8_B16_w2_x0,1659.75,757.36,0.0
gfx950,256,1600,7168,384,fp8,fp8,flydsl,720,0,12.8527,flydsl_mxpsh_128x128x128_F8_F8_B16_w0_x0,685.31,2046.61,0.0
gfx950,256,1600,7168,3072,fp8,fp8,flydsl,724,0,50.7887,flydsl_mxpsh_128x128x128_F8_F8_B16_w2_x0,1387.4,981.97,0.0
gfx950,256,1600,7168,7168,fp8,fp8,flydsl,685,0,107.5064,flydsl_mxpsh_96x256x128_F8_F8_B16_w2_x4,1529.37,797.97,0.0
gfx950,256,1600,7168,16384,fp8,fp8,flydsl,710,0,237.7523,flydsl_mxpsh_96x512x256_F8_F8_B16_w0_x0,1580.68,700.7,0.0
gfx950,256,1664,7168,384,fp8,fp8,flydsl,721,0,13.0538,flydsl_mxpsh_128x128x128_F8_F8_B16_w0_x4,701.74,2087.25,0.0
gfx950,256,1664,7168,3072,fp8,fp8,flydsl,680,0,50.035,flydsl_mxpsh_96x256x128_F8_F8_B16_w0_x0,1464.63,1019.03,0.0
gfx950,256,1664,7168,7168,fp8,fp8,flydsl,682,0,106.5816,flydsl_mxpsh_96x256x128_F8_F8_B16_w1_x0,1604.34,817.8,0.0
gfx950,256,1664,7168,16384,fp8,fp8,flydsl,682,0,229.6871,flydsl_mxpsh_96x256x128_F8_F8_B16_w1_x0,1701.63,733.86,0.0
gfx950,256,1728,7168,384,fp8,fp8,flydsl,683,0,13.4836,flydsl_mxpsh_96x256x128_F8_F8_B16_w1_x4,705.5,2090.59,0.0
gfx950,256,1728,7168,3072,fp8,fp8,flydsl,682,0,51.0544,flydsl_mxpsh_96x256x128_F8_F8_B16_w1_x0,1490.6,1020.5,0.0
gfx950,256,1728,7168,7168,fp8,fp8,flydsl,681,0,108.7372,flydsl_mxpsh_96x256x128_F8_F8_B16_w0_x4,1633.02,814.25,0.0
gfx950,256,1728,7168,16384,fp8,fp8,flydsl,684,0,231.6276,flydsl_mxpsh_96x256x128_F8_F8_B16_w2_x0,1752.27,736.2,0.0
gfx950,256,1792,7168,384,fp8,fp8,flydsl,620,0,15.2541,flydsl_mxpsh_64x256x128_F8_F8_B16_w0_x0,646.71,1909.7,0.0
gfx950,256,1792,7168,3072,fp8,fp8,flydsl,743,0,55.7683,flydsl_mxpsh_128x256x128_F8_F8_B16_w1_x4,1415.14,954.22,0.0
gfx950,256,1792,7168,7168,fp8,fp8,flydsl,745,0,116.3138,flydsl_mxpsh_128x256x128_F8_F8_B16_w2_x4,1583.19,773.04,0.0
gfx950,256,1792,7168,16384,fp8,fp8,flydsl,744,0,254.5626,flydsl_mxpsh_128x256x128_F8_F8_B16_w2_x0,1653.45,677.6,0.0
gfx950,256,1856,7168,384,fp8,fp8,flydsl,645,0,16.5566,flydsl_mxpsh_64x512x128_F8_F8_B16_w2_x4,617.11,1816.37,0.0
gfx950,256,1856,7168,3072,fp8,fp8,flydsl,740,0,57.3711,flydsl_mxpsh_128x256x128_F8_F8_B16_w0_x0,1424.73,946.98,0.0
gfx950,256,1856,7168,7168,fp8,fp8,flydsl,742,0,119.5353,flydsl_mxpsh_128x256x128_F8_F8_B16_w1_x0,1595.54,763.72,0.0
gfx950,256,1856,7168,16384,fp8,fp8,flydsl,740,0,268.0134,flydsl_mxpsh_128x256x128_F8_F8_B16_w0_x0,1626.56,650.93,0.0
gfx950,256,1920,7168,384,fp8,fp8,flydsl,645,0,16.4217,flydsl_mxpsh_64x512x128_F8_F8_B16_w2_x4,643.64,1888.65,0.0
gfx950,256,1920,7168,3072,fp8,fp8,flydsl,741,0,58.5647,flydsl_mxpsh_128x256x128_F8_F8_B16_w0_x4,1443.82,946.7,0.0
gfx950,256,1920,7168,7168,fp8,fp8,flydsl,742,0,122.1496,flydsl_mxpsh_128x256x128_F8_F8_B16_w1_x0,1615.23,758.64,0.0
gfx950,256,1920,7168,16384,fp8,fp8,flydsl,744,0,270.2406,flydsl_mxpsh_128x256x128_F8_F8_B16_w2_x0,1668.78,652.84,0.0
gfx950,256,1984,7168,384,fp8,fp8,flydsl,723,0,16.8334,flydsl_mxpsh_128x128x128_F8_F8_B16_w1_x4,648.83,1898.43,0.0
gfx950,256,1984,7168,3072,fp8,fp8,flydsl,744,0,58.1519,flydsl_mxpsh_128x256x128_F8_F8_B16_w2_x0,1502.54,972.58,0.0
gfx950,256,1984,7168,7168,fp8,fp8,flydsl,734,0,118.7009,flydsl_mxpsh_128x128x256_F8_F8_B16_w2_x0,1717.57,792.28,0.0
gfx950,256,1984,7168,16384,fp8,fp8,flydsl,730,0,261.457,flydsl_mxpsh_128x128x256_F8_F8_B16_w0_x0,1782.33,682.29,0.0
gfx950,256,2048,7168,384,fp8,fp8,flydsl,645,0,16.9946,flydsl_mxpsh_64x512x128_F8_F8_B16_w2_x4,663.4,1935.85,0.0
gfx950,256,2048,7168,3072,fp8,fp8,flydsl,742,0,58.6311,flydsl_mxpsh_128x256x128_F8_F8_B16_w1_x0,1538.34,983.64,0.0
gfx950,256,2048,7168,7168,fp8,fp8,flydsl,733,0,120.7261,flydsl_mxpsh_128x128x256_F8_F8_B16_w1_x4,1743.23,790.39,0.0
gfx950,256,2048,7168,16384,fp8,fp8,flydsl,740,0,263.4059,flydsl_mxpsh_128x256x128_F8_F8_B16_w0_x0,1826.22,684.7,0.0
gfx950,256,4096,7168,384,fp8,fp8,flydsl,720,0,28.2314,flydsl_mxpsh_128x128x128_F8_F8_B16_w0_x0,798.71,2233.17,0.0
gfx950,256,4096,7168,3072,fp8,fp8,flydsl,730,0,102.1637,flydsl_mxpsh_128x128x256_F8_F8_B16_w0_x0,1765.68,913.47,0.0
gfx950,256,4096,7168,7168,fp8,fp8,flydsl,736,0,205.1466,flydsl_mxpsh_128x128x256_F8_F8_B16_w3_x0,2051.74,679.81,0.0
gfx950,256,4096,7168,16384,fp8,fp8,flydsl,737,0,443.4432,flydsl_mxpsh_128x128x256_F8_F8_B16_w3_x4,2169.55,548.59,0.0
gfx950,256,6144,7168,384,fp8,fp8,flydsl,721,0,40.2613,flydsl_mxpsh_128x128x128_F8_F8_B16_w0_x4,840.08,2314.68,0.0
gfx950,256,6144,7168,3072,fp8,fp8,flydsl,742,0,144.8802,flydsl_mxpsh_128x256x128_F8_F8_B16_w1_x0,1867.63,890.22,0.0
gfx950,256,6144,7168,7168,fp8,fp8,flydsl,731,0,298.5056,flydsl_mxpsh_128x128x256_F8_F8_B16_w0_x4,2115.07,614.73,0.0
gfx950,256,6144,7168,16384,fp8,fp8,flydsl,744,0,621.2063,flydsl_mxpsh_128x256x128_F8_F8_B16_w2_x0,2323.08,492.89,0.0
gfx950,256,8192,7168,384,fp8,fp8,flydsl,722,0,52.3135,flydsl_mxpsh_128x128x128_F8_F8_B16_w1_x0,862.06,2357.68,0.0
gfx950,256,8192,7168,3072,fp8,fp8,flydsl,741,0,186.0879,flydsl_mxpsh_128x256x128_F8_F8_B16_w0_x4,1938.75,884.67,0.0
gfx950,256,8192,7168,7168,fp8,fp8,flydsl,740,0,379.4834,flydsl_mxpsh_128x256x128_F8_F8_B16_w0_x0,2218.31,599.61,0.0
gfx950,256,8192,7168,16384,fp8,fp8,flydsl,740,0,760.2129,flydsl_mxpsh_128x256x128_F8_F8_B16_w0_x0,2531.06,485.52,0.0
gfx950,256,10240,7168,384,fp8,fp8,flydsl,761,0,60.5909,flydsl_mxpsh_128x512x128_F8_F8_B16_w0_x4,930.36,2533.14,0.0
gfx950,256,10240,7168,3072,fp8,fp8,flydsl,744,0,220.4155,flydsl_mxpsh_128x256x128_F8_F8_B16_w2_x0,2046.01,908.64,0.0
gfx950,256,10240,7168,7168,fp8,fp8,flydsl,740,0,462.8322,flydsl_mxpsh_128x256x128_F8_F8_B16_w0_x0,2273.54,586.78,0.0
gfx950,256,10240,7168,16384,fp8,fp8,flydsl,745,0,972.188,flydsl_mxpsh_128x256x128_F8_F8_B16_w2_x4,2473.99,444.37,0.0
gfx950,256,12288,7168,384,fp8,fp8,flydsl,760,0,73.2802,flydsl_mxpsh_128x512x128_F8_F8_B16_w0_x0,923.11,2505.89,0.0
gfx950,256,12288,7168,3072,fp8,fp8,flydsl,741,0,259.2443,flydsl_mxpsh_128x256x128_F8_F8_B16_w0_x4,2087.47,910.07,0.0
gfx950,256,12288,7168,7168,fp8,fp8,flydsl,740,0,547.988,flydsl_mxpsh_128x256x128_F8_F8_B16_w0_x0,2304.28,575.96,0.0
gfx950,256,12288,7168,16384,fp8,fp8,flydsl,745,0,1190.0216,flydsl_mxpsh_128x256x128_F8_F8_B16_w2_x4,2425.35,415.9,0.0
gfx950,256,14336,7168,384,fp8,fp8,flydsl,761,0,80.7595,flydsl_mxpsh_128x512x128_F8_F8_B16_w0_x4,977.22,2647.1,0.0
gfx950,256,14336,7168,3072,fp8,fp8,flydsl,743,0,299.9822,flydsl_mxpsh_128x256x128_F8_F8_B16_w1_x4,2104.66,905.32,0.0
gfx950,256,14336,7168,7168,fp8,fp8,flydsl,741,0,635.9407,flydsl_mxpsh_128x256x128_F8_F8_B16_w0_x4,2316.53,565.56,0.0
gfx950,256,14336,7168,16384,fp8,fp8,flydsl,744,0,1439.8654,flydsl_mxpsh_128x256x128_F8_F8_B16_w2_x0,2338.59,387.43,0.0
gfx950,256,16384,7168,384,fp8,fp8,flydsl,763,0,96.8409,flydsl_mxpsh_128x512x128_F8_F8_B16_w1_x4,931.37,2518.82,0.0
gfx950,256,16384,7168,3072,fp8,fp8,flydsl,741,0,351.1974,flydsl_mxpsh_128x256x128_F8_F8_B16_w0_x4,2054.56,874.82,0.0
gfx950,256,16384,7168,7168,fp8,fp8,flydsl,740,0,723.6783,flydsl_mxpsh_128x256x128_F8_F8_B16_w0_x0,2326.49,557.85,0.0
gfx950,256,16384,7168,16384,fp8,fp8,flydsl,741,0,1664.9818,flydsl_mxpsh_128x256x128_F8_F8_B16_w0_x4,2311.31,372.83,0.0
gfx950,256,20480,7168,3072,fp8,fp8,flydsl,742,0,411.715,flydsl_mxpsh_128x256x128_F8_F8_B16_w1_x0,2190.7,919.41,0.0
gfx950,256,20480,7168,7168,fp8,fp8,flydsl,743,0,883.5866,flydsl_mxpsh_128x256x128_F8_F8_B16_w1_x4,2381.81,556.57,0.0
gfx950,256,20480,7168,16384,fp8,fp8,flydsl,809,0,2241.932,flydsl_mxpsh_256x256x128_F8_F8_B16_w4_x4,2145.63,333.01,0.0
gfx950,256,24576,7168,3072,fp8,fp8,flydsl,743,0,496.0039,flydsl_mxpsh_128x256x128_F8_F8_B16_w1_x4,2182.1,906.93,0.0
gfx950,256,24576,7168,7168,fp8,fp8,flydsl,744,0,1060.9834,flydsl_mxpsh_128x256x128_F8_F8_B16_w2_x0,2380.28,546.53,0.0
gfx950,256,24576,7168,16384,fp8,fp8,flydsl,742,0,2789.5905,flydsl_mxpsh_128x256x128_F8_F8_B16_w1_x0,2069.28,312.74,0.0
gfx950,256,28672,7168,3072,fp8,fp8,flydsl,743,0,562.7272,flydsl_mxpsh_128x256x128_F8_F8_B16_w1_x4,2243.93,926.1,0.0
gfx950,256,28672,7168,7168,fp8,fp8,flydsl,743,0,1226.8712,flydsl_mxpsh_128x256x128_F8_F8_B16_w1_x4,2401.51,544.43,0.0
gfx950,256,28672,7168,16384,fp8,fp8,flydsl,801,0,3360.2441,flydsl_mxpsh_256x256x128_F8_F8_B16_w0_x4,2004.17,297.07,0.0
gfx950,256,32768,7168,384,fp8,fp8,flydsl,682,0,185.3907,flydsl_mxpsh_96x256x128_F8_F8_B16_w1_x0,973.02,2616.62,0.0
gfx950,256,32768,7168,3072,fp8,fp8,flydsl,744,0,706.85,flydsl_mxpsh_128x256x128_F8_F8_B16_w2_x0,2041.61,838.15,0.0
gfx950,256,32768,7168,7168,fp8,fp8,flydsl,745,0,1519.828,flydsl_mxpsh_128x256x128_F8_F8_B16_w2_x4,2215.55,497.44,0.0
gfx950,256,32768,7168,16384,fp8,fp8,flydsl,718,0,4012.026,flydsl_mxpsh_96x512x256_F8_F8_B16_w4_x0,1918.38,280.18,0.0
gfx950,256,40960,7168,3072,fp8,fp8,flydsl,743,0,804.0901,flydsl_mxpsh_128x256x128_F8_F8_B16_w1_x4,2243.39,914.14,0.0
gfx950,256,40960,7168,7168,fp8,fp8,flydsl,712,0,2052.5603,flydsl_mxpsh_96x512x256_F8_F8_B16_w1_x0,2050.64,454.16,0.0
gfx950,256,40960,7168,16384,fp8,fp8,flydsl,712,0,4981.1689,flydsl_mxpsh_96x512x256_F8_F8_B16_w1_x0,1931.42,276.19,0.0
gfx950,256,49152,7168,3072,fp8,fp8,flydsl,742,0,978.4286,flydsl_mxpsh_128x256x128_F8_F8_B16_w1_x0,2212.39,897.01,0.0
gfx950,256,49152,7168,7168,fp8,fp8,flydsl,762,0,2486.0651,flydsl_mxpsh_128x512x128_F8_F8_B16_w1_x0,2031.68,445.82,0.0
gfx950,256,49152,7168,16384,fp8,fp8,flydsl,718,0,5958.8753,flydsl_mxpsh_96x512x256_F8_F8_B16_w4_x0,1937.42,273.1,0.0
gfx950,256,57344,7168,3072,fp8,fp8,flydsl,741,0,1099.8192,flydsl_mxpsh_128x256x128_F8_F8_B16_w0_x4,2296.23,927.67,0.0
gfx950,256,57344,7168,7168,fp8,fp8,flydsl,761,0,2885.8929,flydsl_mxpsh_128x512x128_F8_F8_B16_w0_x4,2041.9,445.1,0.0
gfx950,256,57344,7168,16384,fp8,fp8,flydsl,719,0,6930.6955,flydsl_mxpsh_96x512x256_F8_F8_B16_w4_x4,1943.39,271.12,0.0
gfx950,256,65536,7168,3072,fp8,fp8,flydsl,740,0,1373.3568,flydsl_mxpsh_128x256x128_F8_F8_B16_w0_x0,2101.58,846.74,0.0
gfx950,256,65536,7168,7168,fp8,fp8,flydsl,710,0,3321.8717,flydsl_mxpsh_96x512x256_F8_F8_B16_w0_x0,2027.32,439.71,0.0
gfx950,256,65536,7168,16384,fp8,fp8,flydsl,711,0,7879.4814,flydsl_mxpsh_96x512x256_F8_F8_B16_w0_x4,1953.58,270.41,0.0
gfx950,256,1,16384,1536,fp8,fp8,flydsl,551,0,9.6995,flydsl_mxpsh_32x128x256_F8_F8_B16_w0_x4,5.19,2598.09,0.0
gfx950,256,4,16384,1536,fp8,fp8,flydsl,556,0,9.8153,flydsl_mxpsh_32x128x256_F8_F8_B16_w3_x0,20.51,2577.92,0.0
gfx950,256,8,16384,1536,fp8,fp8,flydsl,550,0,9.8882,flydsl_mxpsh_32x128x256_F8_F8_B16_w0_x0,40.72,2572.79,0.0
gfx950,256,16,16384,1536,fp8,fp8,flydsl,550,0,9.9596,flydsl_mxpsh_32x128x256_F8_F8_B16_w0_x0,80.86,2581.9,0.0
gfx950,256,1,65536,1536,fp8,fp8,flydsl,545,0,19.4215,flydsl_mxpsh_32x128x128_F8_F8_B16_w2_x4,10.37,5189.91,0.0
gfx950,256,2,65536,1536,fp8,fp8,flydsl,552,0,19.3136,flydsl_mxpsh_32x128x256_F8_F8_B16_w1_x0,20.85,5225.77,0.0
gfx950,256,4,65536,1536,fp8,fp8,flydsl,556,0,19.3166,flydsl_mxpsh_32x128x256_F8_F8_B16_w3_x0,41.69,5238.69,0.0
gfx950,256,8,65536,1536,fp8,fp8,flydsl,553,0,19.5192,flydsl_mxpsh_32x128x256_F8_F8_B16_w1_x4,82.51,5211.49,0.0
gfx950,256,16,65536,1536,fp8,fp8,flydsl,551,0,20.0437,flydsl_mxpsh_32x128x256_F8_F8_B16_w0_x4,160.71,5128.05,0.0
gfx950,256,32,65536,1536,fp8,fp8,flydsl,557,0,20.9344,flydsl_mxpsh_32x128x256_F8_F8_B16_w3_x4,307.74,5011.21,0.0
gfx950,256,48,65536,1536,fp8,fp8,flydsl,615,0,22.7245,flydsl_mxpsh_64x128x256_F8_F8_B16_w2_x4,425.25,4709.83,0.0
gfx950,256,64,65536,1536,fp8,fp8,flydsl,632,0,23.6771,flydsl_mxpsh_64x256x256_F8_F8_B16_w1_x0,544.19,4609.95,0.0
gfx950,256,80,65536,1536,fp8,fp8,flydsl,666,0,24.6458,flydsl_mxpsh_96x128x128_F8_F8_B16_w3_x0,653.5,4514.84,0.0
gfx950,256,96,65536,1536,fp8,fp8,flydsl,669,0,25.2953,flydsl_mxpsh_96x128x128_F8_F8_B16_w4_x4,764.07,4482.8,0.0
gfx950,256,112,65536,1536,fp8,fp8,flydsl,731,0,26.6708,flydsl_mxpsh_128x128x256_F8_F8_B16_w0_x4,845.44,4331.16,0.0
gfx950,256,128,65536,1536,fp8,fp8,flydsl,732,0,26.988,flydsl_mxpsh_128x128x256_F8_F8_B16_w1_x0,954.86,4358.87,0.0
gfx950,256,144,65536,1536,fp8,fp8,flydsl,668,0,36.4146,flydsl_mxpsh_96x128x128_F8_F8_B16_w4_x0,796.14,3288.76,0.0
gfx950,256,160,65536,1536,fp8,fp8,flydsl,685,0,37.0952,flydsl_mxpsh_96x256x128_F8_F8_B16_w2_x4,868.37,3285.62,0.0
gfx950,256,176,65536,1536,fp8,fp8,flydsl,683,0,37.6763,flydsl_mxpsh_96x256x128_F8_F8_B16_w1_x4,940.47,3291.25,0.0
gfx950,256,192,65536,1536,fp8,fp8,flydsl,685,0,38.5674,flydsl_mxpsh_96x256x128_F8_F8_B16_w2_x4,1002.26,3270.22,0.0
gfx950,256,208,65536,1536,fp8,fp8,flydsl,743,0,39.9517,flydsl_mxpsh_128x256x128_F8_F8_B16_w1_x4,1048.16,3210.02,0.0
gfx950,256,224,65536,1536,fp8,fp8,flydsl,743,0,40.5294,flydsl_mxpsh_128x256x128_F8_F8_B16_w1_x4,1112.7,3216.62,0.0
gfx950,256,240,65536,1536,fp8,fp8,flydsl,741,0,41.6101,flydsl_mxpsh_128x256x128_F8_F8_B16_w0_x4,1161.22,3184.06,0.0
gfx950,256,256,65536,1536,fp8,fp8,flydsl,742,0,42.6667,flydsl_mxpsh_128x256x128_F8_F8_B16_w1_x0,1207.96,3154.94,0.0
gfx950,256,288,65536,1536,fp8,fp8,flydsl,673,0,57.6007,flydsl_mxpsh_96x128x256_F8_F8_B16_w1_x4,1006.62,2410.64,0.0
gfx950,256,320,65536,1536,fp8,fp8,flydsl,730,0,61.2179,flydsl_mxpsh_128x128x256_F8_F8_B16_w0_x0,1052.38,2337.52,0.0
gfx950,256,352,65536,1536,fp8,fp8,flydsl,743,0,63.3243,flydsl_mxpsh_128x256x128_F8_F8_B16_w1_x4,1119.11,2326.77,0.0
gfx950,256,384,65536,1536,fp8,fp8,flydsl,744,0,64.4099,flydsl_mxpsh_128x256x128_F8_F8_B16_w2_x0,1200.27,2353.44,0.0
gfx950,256,416,65536,1536,fp8,fp8,flydsl,743,0,73.1152,flydsl_mxpsh_128x256x128_F8_F8_B16_w1_x4,1145.48,2131.27,0.0
gfx950,256,448,65536,1536,fp8,fp8,flydsl,742,0,74.6872,flydsl_mxpsh_128x256x128_F8_F8_B16_w1_x0,1207.63,2143.23,0.0
gfx950,256,480,65536,1536,fp8,fp8,flydsl,742,0,76.5727,flydsl_mxpsh_128x256x128_F8_F8_B16_w1_x0,1262.03,2145.87,0.0
gfx950,256,512,65536,1536,fp8,fp8,flydsl,740,0,78.1996,flydsl_mxpsh_128x256x128_F8_F8_B16_w0_x0,1318.16,2155.49,0.0
gfx950,256,544,65536,1536,fp8,fp8,flydsl,740,0,94.4348,flydsl_mxpsh_128x256x128_F8_F8_B16_w0_x0,1159.76,1829.86,0.0
gfx950,256,576,65536,1536,fp8,fp8,flydsl,745,0,96.2541,flydsl_mxpsh_128x256x128_F8_F8_B16_w2_x4,1204.77,1839.36,0.0
gfx950,256,608,65536,1536,fp8,fp8,flydsl,741,0,97.7962,flydsl_mxpsh_128x256x128_F8_F8_B16_w0_x4,1251.65,1853.74,0.0
gfx950,256,640,65536,1536,fp8,fp8,flydsl,743,0,98.704,flydsl_mxpsh_128x256x128_F8_F8_B16_w1_x4,1305.41,1879.68,0.0
gfx950,256,672,65536,1536,fp8,fp8,flydsl,743,0,108.5443,flydsl_mxpsh_128x256x128_F8_F8_B16_w1_x4,1246.42,1748.37,0.0
gfx950,256,704,65536,1536,fp8,fp8,flydsl,740,0,109.8654,flydsl_mxpsh_128x256x128_F8_F8_B16_w0_x0,1290.07,1765.97,0.0
gfx950,256,736,65536,1536,fp8,fp8,flydsl,740,0,111.5134,flydsl_mxpsh_128x256x128_F8_F8_B16_w0_x0,1328.78,1777.93,0.0
gfx950,256,768,65536,1536,fp8,fp8,flydsl,742,0,112.0677,flydsl_mxpsh_128x256x128_F8_F8_B16_w1_x0,1379.69,1807.0,0.0
gfx950,256,800,65536,1536,fp8,fp8,flydsl,743,0,130.307,flydsl_mxpsh_128x256x128_F8_F8_B16_w1_x4,1236.01,1586.64,0.0
gfx950,256,832,65536,1536,fp8,fp8,flydsl,742,0,131.729,flydsl_mxpsh_128x256x128_F8_F8_B16_w1_x0,1271.58,1601.72,0.0
gfx950,256,864,65536,1536,fp8,fp8,flydsl,743,0,134.4113,flydsl_mxpsh_128x256x128_F8_F8_B16_w1_x4,1294.13,1601.33,0.0
gfx950,256,896,65536,1536,fp8,fp8,flydsl,743,0,135.1638,flydsl_mxpsh_128x256x128_F8_F8_B16_w1_x4,1334.59,1623.81,0.0
gfx950,256,928,65536,1536,fp8,fp8,flydsl,742,0,137.7496,flydsl_mxpsh_128x256x128_F8_F8_B16_w1_x0,1356.31,1624.13,0.0
gfx950,256,960,65536,1536,fp8,fp8,flydsl,742,0,139.5973,flydsl_mxpsh_128x256x128_F8_F8_B16_w1_x0,1384.51,1633.03,0.0
gfx950,256,992,65536,1536,fp8,fp8,flydsl,743,0,144.1695,flydsl_mxpsh_128x256x128_F8_F8_B16_w1_x4,1385.29,1610.68,0.0
gfx950,256,1024,65536,1536,fp8,fp8,flydsl,741,0,145.8791,flydsl_mxpsh_128x256x128_F8_F8_B16_w0_x4,1413.21,1620.89,0.0
gfx950,256,1088,65536,1536,fp8,fp8,flydsl,740,0,160.6857,flydsl_mxpsh_128x256x128_F8_F8_B16_w0_x0,1363.18,1524.35,0.0
gfx950,256,1152,65536,1536,fp8,fp8,flydsl,740,0,164.278,flydsl_mxpsh_128x256x128_F8_F8_B16_w0_x0,1411.8,1542.68,0.0
gfx950,256,1216,65536,1536,fp8,fp8,flydsl,742,0,163.9535,flydsl_mxpsh_128x256x128_F8_F8_B16_w1_x0,1493.19,1597.49,0.0
gfx950,256,1280,65536,1536,fp8,fp8,flydsl,743,0,168.0709,flydsl_mxpsh_128x256x128_F8_F8_B16_w1_x4,1533.27,1608.85,0.0
gfx950,256,1344,65536,1536,fp8,fp8,flydsl,742,0,182.8406,flydsl_mxpsh_128x256x128_F8_F8_B16_w1_x0,1479.88,1525.31,0.0
gfx950,256,1408,65536,1536,fp8,fp8,flydsl,743,0,188.1978,flydsl_mxpsh_128x256x128_F8_F8_B16_w1_x4,1506.22,1526.99,0.0
gfx950,256,1472,65536,1536,fp8,fp8,flydsl,742,0,189.1856,flydsl_mxpsh_128x256x128_F8_F8_B16_w1_x0,1566.47,1563.87,0.0
gfx950,256,1536,65536,1536,fp8,fp8,flydsl,743,0,193.8503,flydsl_mxpsh_128x256x128_F8_F8_B16_w1_x4,1595.24,1570.02,0.0
gfx950,256,1600,65536,1536,fp8,fp8,flydsl,740,0,209.3405,flydsl_mxpsh_128x256x128_F8_F8_B16_w0_x0,1538.75,1494.39,0.0
gfx950,256,1664,65536,1536,fp8,fp8,flydsl,744,0,215.5341,flydsl_mxpsh_128x256x128_F8_F8_B16_w2_x0,1554.31,1490.82,0.0
gfx950,256,1728,65536,1536,fp8,fp8,flydsl,745,0,218.687,flydsl_mxpsh_128x256x128_F8_F8_B16_w2_x4,1590.82,1508.14,0.0
gfx950,256,1792,65536,1536,fp8,fp8,flydsl,741,0,223.7165,flydsl_mxpsh_128x256x128_F8_F8_B16_w0_x4,1612.65,1512.17,0.0
gfx950,256,1856,65536,1536,fp8,fp8,flydsl,740,0,239.9426,flydsl_mxpsh_128x256x128_F8_F8_B16_w0_x0,1557.3,1445.28,0.0
gfx950,256,1920,65536,1536,fp8,fp8,flydsl,745,0,244.6352,flydsl_mxpsh_128x256x128_F8_F8_B16_w2_x4,1580.1,1452.25,0.0
gfx950,256,1984,65536,1536,fp8,fp8,flydsl,744,0,246.9217,flydsl_mxpsh_128x256x128_F8_F8_B16_w2_x0,1617.65,1473.17,0.0
gfx950,256,2048,65536,1536,fp8,fp8,flydsl,741,0,256.3393,flydsl_mxpsh_128x256x128_F8_F8_B16_w0_x4,1608.48,1452.16,0.0
gfx950,256,4096,65536,1536,fp8,fp8,flydsl,741,0,485.2627,flydsl_mxpsh_128x256x128_F8_F8_B16_w0_x4,1699.36,1326.76,0.0
gfx950,256,6144,65536,1536,fp8,fp8,flydsl,743,0,692.6523,flydsl_mxpsh_128x256x128_F8_F8_B16_w1_x4,1785.82,1321.6,0.0
gfx950,256,8192,65536,1536,fp8,fp8,flydsl,740,0,954.6187,flydsl_mxpsh_128x256x128_F8_F8_B16_w0_x0,1727.67,1243.42,0.0
gfx950,256,10240,65536,1536,fp8,fp8,flydsl,742,0,1136.9558,flydsl_mxpsh_128x256x128_F8_F8_B16_w1_x0,1813.25,1282.87,0.0
gfx950,256,12288,65536,1536,fp8,fp8,flydsl,740,0,1329.2493,flydsl_mxpsh_128x256x128_F8_F8_B16_w0_x0,1861.13,1301.6,0.0
gfx950,256,14336,65536,1536,fp8,fp8,flydsl,744,0,1537.918,flydsl_mxpsh_128x256x128_F8_F8_B16_w2_x0,1876.7,1301.59,0.0
gfx950,256,16384,65536,1536,fp8,fp8,flydsl,744,0,1892.4277,flydsl_mxpsh_128x256x128_F8_F8_B16_w2_x0,1743.02,1201.27,0.0
gfx950,256,20480,65536,1536,fp8,fp8,flydsl,743,0,2139.3912,flydsl_mxpsh_128x256x128_F8_F8_B16_w1_x4,1927.26,1316.48,0.0
gfx950,256,24576,65536,1536,fp8,fp8,flydsl,743,0,2572.3668,flydsl_mxpsh_128x256x128_F8_F8_B16_w1_x4,1923.44,1306.05,0.0
gfx950,256,28672,65536,1536,fp8,fp8,flydsl,743,0,2897.8673,flydsl_mxpsh_128x256x128_F8_F8_B16_w1_x4,1991.96,1346.78,0.0
gfx950,256,32768,65536,1536,fp8,fp8,flydsl,683,0,3636.9853,flydsl_mxpsh_96x256x128_F8_F8_B16_w1_x4,1813.88,1222.43,0.0
gfx950,256,40960,65536,1536,fp8,fp8,flydsl,741,0,4211.3825,flydsl_mxpsh_128x256x128_F8_F8_B16_w0_x4,1958.11,1313.65,0.0
gfx950,256,49152,65536,1536,fp8,fp8,flydsl,742,0,5113.8032,flydsl_mxpsh_128x256x128_F8_F8_B16_w1_x0,1935.08,1294.26,0.0
gfx950,256,57344,65536,1536,fp8,fp8,flydsl,741,0,5570.4163,flydsl_mxpsh_128x256x128_F8_F8_B16_w0_x4,2072.53,1383.19,0.0
gfx950,256,65536,65536,1536,fp8,fp8,flydsl,682,0,6953.4073,flydsl_mxpsh_96x256x128_F8_F8_B16_w1_x0,1897.51,1264.31,0.0
