aiter/configs/mxscale_preshuffle_tuned_gemm.csv
gfx,cu_num,M,N,K,a_dtype,b_dtype,libtype,kernelId,splitK,us,kernelName,tflops,bw,errRatio
gfx950,256,1,768,7168,fp8,fp8,flydsl,17787,28,6.624,flydsl_mxpsh_32x128x256_F8_F8_B16_w2_x4_sk28,1.66,832.39,0.0
gfx950,256,2,768,7168,fp8,fp8,flydsl,17819,28,6.8552,flydsl_mxpsh_32x128x256_F8_F8_B16_w3_x0_sk28,3.21,805.58,0.0
gfx950,256,4,768,7168,fp8,fp8,flydsl,17883,28,7.5968,flydsl_mxpsh_32x128x256_F8_F8_B16_w4_x0_sk28,5.8,729.23,0.0
gfx950,256,8,768,7168,fp8,fp8,flydsl,17691,28,7.5485,flydsl_mxpsh_32x128x256_F8_F8_B16_w1_x0_sk28,11.67,738.51,0.0
gfx950,256,16,768,7168,fp8,fp8,flydsl,17755,28,7.7413,flydsl_mxpsh_32x128x256_F8_F8_B16_w2_x0_sk28,22.76,729.11,0.0
gfx950,256,32,768,7168,fp8,fp8,flydsl,17691,28,8.0488,flydsl_mxpsh_32x128x256_F8_F8_B16_w1_x0_sk28,43.77,718.56,0.0
gfx950,256,48,768,7168,fp8,fp8,flydsl,17709,14,8.8461,flydsl_mxpsh_32x128x256_F8_F8_B16_w1_x4_sk14,59.74,669.54,0.0
gfx950,256,64,768,7168,fp8,fp8,flydsl,19725,14,9.0275,flydsl_mxpsh_64x128x256_F8_F8_B16_w3_x0_sk14,78.06,671.51,0.0
gfx950,256,80,768,7168,fp8,fp8,flydsl,17805,14,9.6616,flydsl_mxpsh_32x128x256_F8_F8_B16_w3_x0_sk14,91.17,641.85,0.0
gfx950,256,96,768,7168,fp8,fp8,flydsl,21549,14,10.3775,flydsl_mxpsh_96x128x256_F8_F8_B16_w1_x4_sk14,101.85,611.0,0.0
gfx950,256,112,768,7168,fp8,fp8,flydsl,19686,7,10.6301,flydsl_mxpsh_64x128x256_F8_F8_B16_w2_x4_sk7,116.0,609.58,0.0
gfx950,256,128,768,7168,fp8,fp8,flydsl,19565,14,11.1313,flydsl_mxpsh_64x128x256_F8_F8_B16_w0_x4_sk14,126.61,594.64,0.0
gfx950,256,144,768,7168,fp8,fp8,flydsl,19661,14,10.9657,flydsl_mxpsh_64x128x256_F8_F8_B16_w2_x0_sk14,144.58,616.32,0.0
gfx950,256,160,768,7168,fp8,fp8,flydsl,19750,7,11.0901,flydsl_mxpsh_64x128x256_F8_F8_B16_w3_x4_sk7,158.85,621.97,0.0
gfx950,256,176,768,7168,fp8,fp8,flydsl,19565,14,11.5617,flydsl_mxpsh_64x128x256_F8_F8_B16_w0_x4_sk14,167.6,608.64,0.0
gfx950,256,192,768,7168,fp8,fp8,flydsl,19558,7,12.6425,flydsl_mxpsh_64x128x256_F8_F8_B16_w0_x4_sk7,167.21,567.62,0.0
gfx950,256,208,768,7168,fp8,fp8,flydsl,19558,7,12.6369,flydsl_mxpsh_64x128x256_F8_F8_B16_w0_x4_sk7,181.22,578.9,0.0
gfx950,256,224,768,7168,fp8,fp8,flydsl,21574,7,13.0418,flydsl_mxpsh_96x128x256_F8_F8_B16_w2_x0_sk7,189.1,571.6,0.0
gfx950,256,240,768,7168,fp8,fp8,flydsl,19686,7,13.0989,flydsl_mxpsh_64x128x256_F8_F8_B16_w2_x4_sk7,201.73,579.74,0.0
gfx950,256,256,768,7168,fp8,fp8,flydsl,19558,7,12.9701,flydsl_mxpsh_64x128x256_F8_F8_B16_w0_x4_sk7,217.31,596.24,0.0
gfx950,256,288,768,7168,fp8,fp8,flydsl,21517,14,13.9537,flydsl_mxpsh_96x128x256_F8_F8_B16_w1_x0_sk14,227.24,574.17,0.0
gfx950,256,320,768,7168,fp8,fp8,flydsl,18406,7,13.9369,flydsl_mxpsh_32x256x256_F8_F8_B16_w2_x4_sk7,252.8,594.85,0.0
gfx950,256,352,768,7168,fp8,fp8,flydsl,18406,7,14.3097,flydsl_mxpsh_32x256x256_F8_F8_B16_w2_x4_sk7,270.83,598.81,0.0
gfx950,256,384,768,7168,fp8,fp8,flydsl,17894,7,13.9723,flydsl_mxpsh_32x128x256_F8_F8_B16_w4_x4_sk7,302.59,633.21,0.0
gfx950,256,416,768,7168,fp8,fp8,flydsl,19747,4,15.1771,flydsl_mxpsh_64x128x256_F8_F8_B16_w3_x4_sk4,301.78,601.29,0.0
gfx950,256,448,768,7168,fp8,fp8,flydsl,19747,4,15.673,flydsl_mxpsh_64x128x256_F8_F8_B16_w3_x4_sk4,314.71,600.04,0.0
gfx950,256,480,768,7168,fp8,fp8,flydsl,19619,4,15.2822,flydsl_mxpsh_64x128x256_F8_F8_B16_w1_x4_sk4,345.82,633.61,0.0
gfx950,256,512,768,7168,fp8,fp8,flydsl,17699,4,15.5039,flydsl_mxpsh_32x128x256_F8_F8_B16_w1_x4_sk4,363.6,642.51,0.0
gfx950,256,544,768,7168,fp8,fp8,flydsl,19747,4,16.167,flydsl_mxpsh_64x128x256_F8_F8_B16_w3_x4_sk4,370.47,633.39,0.0
gfx950,256,576,768,7168,fp8,fp8,flydsl,17699,4,16.3053,flydsl_mxpsh_32x128x256_F8_F8_B16_w1_x4_sk4,388.94,645.1,0.0
gfx950,256,608,768,7168,fp8,fp8,flydsl,19683,4,16.4435,flydsl_mxpsh_64x128x256_F8_F8_B16_w2_x4_sk4,407.1,656.62,0.0
gfx950,256,640,768,7168,fp8,fp8,flydsl,17699,4,16.1294,flydsl_mxpsh_32x128x256_F8_F8_B16_w1_x4_sk4,436.87,686.67,0.0
gfx950,256,672,768,7168,fp8,fp8,flydsl,21603,4,16.8007,flydsl_mxpsh_96x128x256_F8_F8_B16_w2_x4_sk4,440.38,675.81,0.0
gfx950,256,704,768,7168,fp8,fp8,flydsl,21475,4,16.6525,flydsl_mxpsh_96x128x256_F8_F8_B16_w0_x4_sk4,465.46,698.55,0.0
gfx950,256,736,768,7168,fp8,fp8,flydsl,21603,4,17.0376,flydsl_mxpsh_96x128x256_F8_F8_B16_w2_x4_sk4,475.62,699.11,0.0
gfx950,256,768,768,7168,fp8,fp8,flydsl,21539,4,17.2662,flydsl_mxpsh_96x128x256_F8_F8_B16_w1_x4_sk4,489.73,705.99,0.0
gfx950,256,800,768,7168,fp8,fp8,flydsl,21475,4,17.7971,flydsl_mxpsh_96x128x256_F8_F8_B16_w0_x4_sk4,494.91,700.58,0.0
gfx950,256,832,768,7168,fp8,fp8,flydsl,21475,4,18.2964,flydsl_mxpsh_96x128x256_F8_F8_B16_w0_x4_sk4,500.66,696.68,0.0
gfx950,256,864,768,7168,fp8,fp8,flydsl,21539,4,18.6826,flydsl_mxpsh_96x128x256_F8_F8_B16_w1_x4_sk4,509.17,697.19,0.0
gfx950,256,896,768,7168,fp8,fp8,flydsl,21731,4,18.9734,flydsl_mxpsh_96x128x256_F8_F8_B16_w4_x4_sk4,519.94,701.18,0.0
gfx950,256,928,768,7168,fp8,fp8,flydsl,21539,4,18.756,flydsl_mxpsh_96x128x256_F8_F8_B16_w1_x4_sk4,544.75,724.16,0.0
gfx950,256,960,768,7168,fp8,fp8,flydsl,23363,4,19.0936,flydsl_mxpsh_128x128x256_F8_F8_B16_w0_x0_sk4,553.57,725.94,0.0
gfx950,256,992,768,7168,fp8,fp8,flydsl,23619,4,19.4341,flydsl_mxpsh_128x128x256_F8_F8_B16_w4_x0_sk4,562.0,727.56,0.0
gfx950,256,1024,768,7168,fp8,fp8,flydsl,23427,4,19.7619,flydsl_mxpsh_128x128x256_F8_F8_B16_w1_x0_sk4,570.51,729.58,0.0
gfx950,256,1088,768,7168,fp8,fp8,flydsl,21158,7,20.5519,flydsl_mxpsh_96x128x128_F8_F8_B16_w0_x4_sk7,582.86,728.64,0.0
gfx950,256,1152,768,7168,fp8,fp8,flydsl,19587,4,20.7963,flydsl_mxpsh_64x128x256_F8_F8_B16_w1_x0_sk4,609.9,746.87,0.0
gfx950,256,1216,768,7168,fp8,fp8,flydsl,23555,4,21.4505,flydsl_mxpsh_128x128x256_F8_F8_B16_w3_x0_sk4,624.14,750.06,0.0
gfx950,256,1280,768,7168,fp8,fp8,flydsl,19523,4,20.8943,flydsl_mxpsh_64x128x256_F8_F8_B16_w0_x0_sk4,674.48,796.68,0.0
gfx950,256,1344,768,7168,fp8,fp8,flydsl,19683,4,22.8174,flydsl_mxpsh_64x128x256_F8_F8_B16_w2_x4_sk4,648.52,753.95,0.0
gfx950,256,1408,768,7168,fp8,fp8,flydsl,21411,4,24.8999,flydsl_mxpsh_96x128x128_F8_F8_B16_w4_x4_sk4,622.58,713.27,0.0
gfx950,256,1472,768,7168,fp8,fp8,flydsl,21699,4,23.6504,flydsl_mxpsh_96x128x256_F8_F8_B16_w4_x0_sk4,685.26,774.5,0.0
gfx950,256,1536,768,7168,fp8,fp8,flydsl,21507,4,23.9257,flydsl_mxpsh_96x128x256_F8_F8_B16_w1_x0_sk4,706.83,788.87,0.0
gfx950,256,1600,768,7168,fp8,fp8,flydsl,21347,4,25.5436,flydsl_mxpsh_96x128x128_F8_F8_B16_w3_x4_sk4,689.65,760.72,0.0
gfx950,256,1664,768,7168,fp8,fp8,flydsl,21347,4,25.2196,flydsl_mxpsh_96x128x128_F8_F8_B16_w3_x4_sk4,726.45,792.58,0.0
gfx950,256,1728,768,7168,fp8,fp8,flydsl,21251,4,25.2484,flydsl_mxpsh_96x128x128_F8_F8_B16_w2_x0_sk4,753.53,813.74,0.0
gfx950,256,1792,768,7168,fp8,fp8,flydsl,21411,4,25.7321,flydsl_mxpsh_96x128x128_F8_F8_B16_w4_x4_sk4,766.75,820.09,0.0
gfx950,256,1856,768,7168,fp8,fp8,flydsl,21507,4,25.5907,flydsl_mxpsh_96x128x256_F8_F8_B16_w1_x0_sk4,798.52,846.39,0.0
gfx950,256,1920,768,7168,fp8,fp8,flydsl,21315,4,25.8713,flydsl_mxpsh_96x128x128_F8_F8_B16_w3_x0_sk4,817.09,858.74,0.0
gfx950,256,1984,768,7168,fp8,fp8,flydsl,23555,4,26.6132,flydsl_mxpsh_128x128x256_F8_F8_B16_w3_x0_sk4,820.79,855.73,0.0
gfx950,256,2048,768,7168,fp8,fp8,flydsl,23619,4,26.9697,flydsl_mxpsh_128x128x256_F8_F8_B16_w4_x0_sk4,836.07,865.08,0.0
gfx950,256,4096,768,7168,fp8,fp8,flydsl,23521,2,40.0005,flydsl_mxpsh_128x128x256_F8_F8_B16_w2_x4_sk2,1127.41,1028.9,0.0
gfx950,256,6144,768,7168,fp8,fp8,flydsl,21696,1,52.0967,flydsl_mxpsh_96x128x256_F8_F8_B16_w4_x0_sk1,1298.46,1132.17,0.0
gfx950,256,8192,768,7168,fp8,fp8,flydsl,23360,1,60.7561,flydsl_mxpsh_128x128x256_F8_F8_B16_w0_x0_sk1,1484.53,1264.21,0.0
gfx950,256,10240,768,7168,fp8,fp8,flydsl,23616,1,66.7174,flydsl_mxpsh_128x128x256_F8_F8_B16_w4_x0_sk1,1689.86,1418.43,0.0
gfx950,256,12288,768,7168,fp8,fp8,flydsl,21120,1,86.3227,flydsl_mxpsh_96x128x128_F8_F8_B16_w0_x0_sk1,1567.28,1302.78,0.0
gfx950,256,14336,768,7168,fp8,fp8,flydsl,23264,1,96.1633,flydsl_mxpsh_128x128x128_F8_F8_B16_w3_x4_sk1,1641.38,1354.84,0.0
gfx950,256,16384,768,7168,fp8,fp8,flydsl,23232,1,103.1397,flydsl_mxpsh_128x128x128_F8_F8_B16_w3_x0_sk1,1748.97,1436.03,0.0
gfx950,256,32768,768,7168,fp8,fp8,flydsl,23712,1,192.3637,flydsl_mxpsh_128x256x128_F8_F8_B16_w0_x4_sk1,1875.5,1511.29,0.0
gfx950,256,1,2048,7168,fp8,fp8,flydsl,17869,14,8.0284,flydsl_mxpsh_32x128x256_F8_F8_B16_w4_x0_sk14,3.66,1829.92,0.0
gfx950,256,2,2048,7168,fp8,fp8,flydsl,17563,28,8.4058,flydsl_mxpsh_32x128x128_F8_F8_B16_w4_x0_sk28,6.99,1749.1,0.0
gfx950,256,4,2048,7168,fp8,fp8,flydsl,17741,14,8.6708,flydsl_mxpsh_32x128x256_F8_F8_B16_w2_x0_sk14,13.54,1698.24,0.0
gfx950,256,8,2048,7168,fp8,fp8,flydsl,17773,14,8.6893,flydsl_mxpsh_32x128x256_F8_F8_B16_w2_x4_sk14,27.03,1699.81,0.0
gfx950,256,16,2048,7168,fp8,fp8,flydsl,17677,14,8.7658,flydsl_mxpsh_32x128x256_F8_F8_B16_w1_x0_sk14,53.59,1695.26,0.0
gfx950,256,32,2048,7168,fp8,fp8,flydsl,17869,14,9.7882,flydsl_mxpsh_32x128x256_F8_F8_B16_w4_x0_sk14,95.99,1536.6,0.0
gfx950,256,48,2048,7168,fp8,fp8,flydsl,19597,14,10.308,flydsl_mxpsh_64x128x256_F8_F8_B16_w1_x0_sk14,136.72,1476.59,0.0
gfx950,256,64,2048,7168,fp8,fp8,flydsl,17830,7,11.1061,flydsl_mxpsh_32x128x256_F8_F8_B16_w3_x4_sk7,169.19,1386.71,0.0
gfx950,256,80,2048,7168,fp8,fp8,flydsl,21574,7,11.9634,flydsl_mxpsh_96x128x256_F8_F8_B16_w2_x0_sk7,196.33,1302.4,0.0
gfx950,256,96,2048,7168,fp8,fp8,flydsl,19686,7,11.8197,flydsl_mxpsh_64x128x256_F8_F8_B16_w2_x4_sk7,238.46,1333.49,0.0
gfx950,256,112,2048,7168,fp8,fp8,flydsl,19622,7,12.7995,flydsl_mxpsh_64x128x256_F8_F8_B16_w1_x4_sk7,256.91,1245.49,0.0
gfx950,256,128,2048,7168,fp8,fp8,flydsl,17635,4,13.5562,flydsl_mxpsh_32x128x256_F8_F8_B16_w0_x4_sk4,277.22,1189.26,0.0
gfx950,256,144,2048,7168,fp8,fp8,flydsl,19747,4,14.783,flydsl_mxpsh_64x128x256_F8_F8_B16_w3_x4_sk4,285.99,1102.76,0.0
gfx950,256,160,2048,7168,fp8,fp8,flydsl,19555,4,15.2305,flydsl_mxpsh_64x128x256_F8_F8_B16_w0_x4_sk4,308.44,1082.19,0.0
gfx950,256,176,2048,7168,fp8,fp8,flydsl,19747,4,14.7976,flydsl_mxpsh_64x128x256_F8_F8_B16_w3_x4_sk4,349.2,1126.03,0.0
gfx950,256,192,2048,7168,fp8,fp8,flydsl,19683,4,15.3124,flydsl_mxpsh_64x128x256_F8_F8_B16_w2_x4_sk4,368.14,1099.94,0.0
gfx950,256,208,2048,7168,fp8,fp8,flydsl,19619,4,15.3644,flydsl_mxpsh_64x128x256_F8_F8_B16_w1_x4_sk4,397.47,1107.95,0.0
gfx950,256,224,2048,7168,fp8,fp8,flydsl,19555,4,15.3858,flydsl_mxpsh_64x128x256_F8_F8_B16_w0_x4_sk4,427.45,1118.12,0.0
gfx950,256,240,2048,7168,fp8,fp8,flydsl,19619,4,16.0289,flydsl_mxpsh_64x128x256_F8_F8_B16_w1_x4_sk4,439.61,1084.51,0.0
gfx950,256,256,2048,7168,fp8,fp8,flydsl,19747,4,16.0944,flydsl_mxpsh_64x128x256_F8_F8_B16_w3_x4_sk4,467.01,1091.29,0.0
gfx950,256,288,2048,7168,fp8,fp8,flydsl,23651,4,17.6435,flydsl_mxpsh_128x128x256_F8_F8_B16_w4_x4_sk4,479.25,1015.9,0.0
gfx950,256,320,2048,7168,fp8,fp8,flydsl,21539,4,17.032,flydsl_mxpsh_96x128x256_F8_F8_B16_w1_x4_sk4,551.62,1073.54,0.0
gfx950,256,352,2048,7168,fp8,fp8,flydsl,21731,4,17.2544,flydsl_mxpsh_96x128x256_F8_F8_B16_w4_x4_sk4,598.96,1080.59,0.0
gfx950,256,384,2048,7168,fp8,fp8,flydsl,21731,4,18.1862,flydsl_mxpsh_96x128x256_F8_F8_B16_w4_x4_sk4,619.94,1045.05,0.0
gfx950,256,416,2048,7168,fp8,fp8,flydsl,23395,4,19.3051,flydsl_mxpsh_128x128x256_F8_F8_B16_w0_x4_sk4,632.67,1003.15,0.0
gfx950,256,448,2048,7168,fp8,fp8,flydsl,23459,4,19.3134,flydsl_mxpsh_128x128x256_F8_F8_B16_w1_x4_sk4,681.05,1021.38,0.0
gfx950,256,480,2048,7168,fp8,fp8,flydsl,23459,4,19.5341,flydsl_mxpsh_128x128x256_F8_F8_B16_w1_x4_sk4,721.45,1028.29,0.0
gfx950,256,512,2048,7168,fp8,fp8,flydsl,23651,4,20.3849,flydsl_mxpsh_128x128x256_F8_F8_B16_w4_x4_sk4,737.43,1003.06,0.0
gfx950,256,544,2048,7168,fp8,fp8,flydsl,21731,4,23.9766,flydsl_mxpsh_96x128x256_F8_F8_B16_w4_x4_sk4,666.15,867.83,0.0
gfx950,256,576,2048,7168,fp8,fp8,flydsl,21731,4,24.0451,flydsl_mxpsh_96x128x256_F8_F8_B16_w4_x4_sk4,703.32,880.35,0.0
gfx950,256,608,2048,7168,fp8,fp8,flydsl,21347,4,25.3762,flydsl_mxpsh_96x128x128_F8_F8_B16_w3_x4_sk4,703.45,848.38,0.0
gfx950,256,640,2048,7168,fp8,fp8,flydsl,21539,4,25.5665,flydsl_mxpsh_96x128x256_F8_F8_B16_w1_x4_sk4,734.96,856.16,0.0
gfx950,256,672,2048,7168,fp8,fp8,flydsl,21603,4,25.3665,flydsl_mxpsh_96x128x256_F8_F8_B16_w2_x4_sk4,777.8,877.12,0.0
gfx950,256,704,2048,7168,fp8,fp8,flydsl,21603,4,24.4247,flydsl_mxpsh_96x128x256_F8_F8_B16_w2_x4_sk4,846.26,925.7,0.0
gfx950,256,736,2048,7168,fp8,fp8,flydsl,21539,4,25.6078,flydsl_mxpsh_96x128x256_F8_F8_B16_w1_x4_sk4,843.85,897.01,0.0
gfx950,256,768,2048,7168,fp8,fp8,flydsl,21731,4,26.3054,flydsl_mxpsh_96x128x256_F8_F8_B16_w4_x4_sk4,857.18,886.92,0.0
gfx950,256,800,2048,7168,fp8,fp8,flydsl,19553,2,27.725,flydsl_mxpsh_64x128x256_F8_F8_B16_w0_x4_sk2,847.18,854.51,0.0
gfx950,256,832,2048,7168,fp8,fp8,flydsl,19553,2,27.8973,flydsl_mxpsh_64x128x256_F8_F8_B16_w0_x4_sk2,875.63,862.15,0.0
gfx950,256,864,2048,7168,fp8,fp8,flydsl,19745,2,27.9081,flydsl_mxpsh_64x128x256_F8_F8_B16_w3_x4_sk2,908.95,874.73,0.0
gfx950,256,896,2048,7168,fp8,fp8,flydsl,19745,2,28.5627,flydsl_mxpsh_64x128x256_F8_F8_B16_w3_x4_sk2,921.01,867.31,0.0
gfx950,256,928,2048,7168,fp8,fp8,flydsl,23457,2,28.9818,flydsl_mxpsh_128x128x256_F8_F8_B16_w1_x4_sk2,940.11,867.2,0.0
gfx950,256,960,2048,7168,fp8,fp8,flydsl,23393,2,28.7146,flydsl_mxpsh_128x128x256_F8_F8_B16_w0_x4_sk2,981.58,887.82,0.0
gfx950,256,992,2048,7168,fp8,fp8,flydsl,23521,2,28.8225,flydsl_mxpsh_128x128x256_F8_F8_B16_w2_x4_sk2,1010.5,897.01,0.0
gfx950,256,1024,2048,7168,fp8,fp8,flydsl,23649,2,29.5169,flydsl_mxpsh_128x128x256_F8_F8_B16_w4_x4_sk2,1018.56,888.11,0.0
gfx950,256,1088,2048,7168,fp8,fp8,flydsl,21729,2,32.3267,flydsl_mxpsh_96x128x256_F8_F8_B16_w4_x4_sk2,988.16,833.22,0.0
gfx950,256,1152,2048,7168,fp8,fp8,flydsl,21537,2,32.1845,flydsl_mxpsh_96x128x256_F8_F8_B16_w1_x4_sk2,1050.91,859.3,0.0
gfx950,256,1216,2048,7168,fp8,fp8,flydsl,21601,2,33.2656,flydsl_mxpsh_96x128x256_F8_F8_B16_w2_x4_sk2,1073.24,853.05,0.0
gfx950,256,1280,2048,7168,fp8,fp8,flydsl,21729,2,33.3718,flydsl_mxpsh_96x128x256_F8_F8_B16_w4_x4_sk2,1126.13,871.93,0.0
gfx950,256,1344,2048,7168,fp8,fp8,flydsl,21729,2,33.2441,flydsl_mxpsh_96x128x256_F8_F8_B16_w4_x4_sk2,1186.98,896.97,0.0
gfx950,256,1408,2048,7168,fp8,fp8,flydsl,21729,2,34.8219,flydsl_mxpsh_96x128x256_F8_F8_B16_w4_x4_sk2,1187.16,877.03,0.0
gfx950,256,1472,2048,7168,fp8,fp8,flydsl,21472,1,37.9885,flydsl_mxpsh_96x128x256_F8_F8_B16_w0_x4_sk1,1137.66,822.9,0.0
gfx950,256,1536,2048,7168,fp8,fp8,flydsl,21472,1,38.143,flydsl_mxpsh_96x128x256_F8_F8_B16_w0_x4_sk1,1182.32,838.46,0.0
gfx950,256,1600,2048,7168,fp8,fp8,flydsl,23521,2,40.1782,flydsl_mxpsh_128x128x256_F8_F8_B16_w2_x4_sk2,1169.2,813.94,0.0
gfx950,256,1664,2048,7168,fp8,fp8,flydsl,23585,2,40.7114,flydsl_mxpsh_128x128x256_F8_F8_B16_w3_x4_sk2,1200.04,820.98,0.0
gfx950,256,1728,2048,7168,fp8,fp8,flydsl,23393,2,40.8625,flydsl_mxpsh_128x128x256_F8_F8_B16_w0_x4_sk2,1241.59,835.59,0.0
gfx950,256,1792,2048,7168,fp8,fp8,flydsl,23393,2,41.3131,flydsl_mxpsh_128x128x256_F8_F8_B16_w0_x4_sk2,1273.53,843.92,0.0
gfx950,256,1856,2048,7168,fp8,fp8,flydsl,23648,1,41.8981,flydsl_mxpsh_128x128x256_F8_F8_B16_w4_x4_sk1,1300.59,849.35,0.0
gfx950,256,1920,2048,7168,fp8,fp8,flydsl,23584,1,42.0042,flydsl_mxpsh_128x128x256_F8_F8_B16_w3_x4_sk1,1342.04,864.36,0.0
gfx950,256,1984,2048,7168,fp8,fp8,flydsl,23392,1,42.7431,flydsl_mxpsh_128x128x256_F8_F8_B16_w0_x4_sk1,1362.8,866.29,0.0
gfx950,256,2048,2048,7168,fp8,fp8,flydsl,23520,1,42.4477,flydsl_mxpsh_128x128x256_F8_F8_B16_w2_x4_sk1,1416.56,889.3,0.0
gfx950,256,4096,2048,7168,fp8,fp8,flydsl,23648,1,67.5225,flydsl_mxpsh_128x128x256_F8_F8_B16_w4_x4_sk1,1781.02,900.7,0.0
gfx950,256,6144,2048,7168,fp8,fp8,flydsl,21920,1,97.3328,flydsl_mxpsh_96x256x128_F8_F8_B16_w2_x4_sk1,1853.32,861.85,0.0
gfx950,256,8192,2048,7168,fp8,fp8,flydsl,23712,1,113.7658,flydsl_mxpsh_128x256x128_F8_F8_B16_w0_x4_sk1,2114.15,940.13,0.0
gfx950,256,10240,2048,7168,fp8,fp8,flydsl,23360,1,154.5022,flydsl_mxpsh_128x128x256_F8_F8_B16_w0_x0_sk1,1945.91,841.56,0.0
gfx950,256,12288,2048,7168,fp8,fp8,flydsl,23776,1,174.8805,flydsl_mxpsh_128x256x128_F8_F8_B16_w1_x4_sk1,2062.99,875.41,0.0
gfx950,256,14336,2048,7168,fp8,fp8,flydsl,23840,1,200.1312,flydsl_mxpsh_128x256x128_F8_F8_B16_w2_x4_sk1,2103.15,880.23,0.0
gfx950,256,16384,2048,7168,fp8,fp8,flydsl,23776,1,212.0434,flydsl_mxpsh_128x256x128_F8_F8_B16_w1_x4_sk1,2268.57,939.57,0.0
gfx950,256,32768,2048,7168,fp8,fp8,flydsl,23840,1,404.4995,flydsl_mxpsh_128x256x128_F8_F8_B16_w2_x4_sk1,2378.43,948.77,0.0
gfx950,256,1,6144,7168,fp8,fp8,flydsl,17869,14,13.2385,flydsl_mxpsh_32x128x256_F8_F8_B16_w4_x0_sk14,6.65,3328.15,0.0
gfx950,256,2,6144,7168,fp8,fp8,flydsl,17805,14,13.1416,flydsl_mxpsh_32x128x256_F8_F8_B16_w3_x0_sk14,13.4,3354.17,0.0
gfx950,256,4,6144,7168,fp8,fp8,flydsl,17421,14,13.3744,flydsl_mxpsh_32x128x128_F8_F8_B16_w2_x0_sk14,26.34,3298.69,0.0
gfx950,256,8,6144,7168,fp8,fp8,flydsl,17677,14,13.3704,flydsl_mxpsh_32x128x256_F8_F8_B16_w1_x0_sk14,52.7,3305.5,0.0
gfx950,256,16,6144,7168,fp8,fp8,flydsl,17606,7,14.2144,flydsl_mxpsh_32x128x256_F8_F8_B16_w0_x0_sk7,99.14,3120.18,0.0
gfx950,256,32,6144,7168,fp8,fp8,flydsl,17859,4,15.6126,flydsl_mxpsh_32x128x256_F8_F8_B16_w4_x0_sk4,180.53,2860.69,0.0
gfx950,256,48,6144,7168,fp8,fp8,flydsl,19715,4,16.6104,flydsl_mxpsh_64x128x256_F8_F8_B16_w3_x0_sk4,254.53,2707.59,0.0
gfx950,256,64,6144,7168,fp8,fp8,flydsl,19747,4,17.3181,flydsl_mxpsh_64x128x256_F8_F8_B16_w3_x4_sk4,325.51,2614.92,0.0
gfx950,256,80,6144,7168,fp8,fp8,flydsl,21443,4,18.3969,flydsl_mxpsh_96x128x256_F8_F8_B16_w0_x0_sk4,383.02,2478.5,0.0
gfx950,256,96,6144,7168,fp8,fp8,flydsl,21699,4,19.0591,flydsl_mxpsh_96x128x256_F8_F8_B16_w4_x0_sk4,443.66,2408.72,0.0
gfx950,256,112,6144,7168,fp8,fp8,flydsl,23363,4,20.0734,flydsl_mxpsh_128x128x256_F8_F8_B16_w0_x0_sk4,491.45,2302.51,0.0
gfx950,256,128,6144,7168,fp8,fp8,flydsl,23395,4,20.5067,flydsl_mxpsh_128x128x256_F8_F8_B16_w0_x4_sk4,549.79,2269.04,0.0
gfx950,256,144,6144,7168,fp8,fp8,flydsl,21603,4,23.9512,flydsl_mxpsh_96x128x256_F8_F8_B16_w2_x4_sk4,529.56,1955.72,0.0
gfx950,256,160,6144,7168,fp8,fp8,flydsl,21539,4,24.4763,flydsl_mxpsh_96x128x256_F8_F8_B16_w1_x4_sk4,575.78,1926.48,0.0
gfx950,256,176,6144,7168,fp8,fp8,flydsl,21475,4,26.0611,flydsl_mxpsh_96x128x256_F8_F8_B16_w0_x4_sk4,594.84,1821.28,0.0
gfx950,256,192,6144,7168,fp8,fp8,flydsl,19745,2,26.5295,flydsl_mxpsh_64x128x256_F8_F8_B16_w3_x4_sk2,637.46,1800.85,0.0
gfx950,256,208,6144,7168,fp8,fp8,flydsl,19747,4,27.083,flydsl_mxpsh_64x128x256_F8_F8_B16_w3_x4_sk4,676.47,1775.54,0.0
gfx950,256,224,6144,7168,fp8,fp8,flydsl,23585,2,28.1992,flydsl_mxpsh_128x128x256_F8_F8_B16_w3_x4_sk2,699.67,1716.3,0.0
gfx950,256,240,6144,7168,fp8,fp8,flydsl,23521,2,28.2758,flydsl_mxpsh_128x128x256_F8_F8_B16_w2_x4_sk2,747.61,1722.66,0.0
gfx950,256,256,6144,7168,fp8,fp8,flydsl,23457,2,28.7812,flydsl_mxpsh_128x128x256_F8_F8_B16_w1_x4_sk2,783.45,1703.23,0.0
gfx950,256,288,6144,7168,fp8,fp8,flydsl,21473,2,30.7773,flydsl_mxpsh_96x128x256_F8_F8_B16_w0_x4_sk2,824.22,1612.99,0.0
gfx950,256,320,6144,7168,fp8,fp8,flydsl,19745,2,31.7584,flydsl_mxpsh_64x128x256_F8_F8_B16_w3_x4_sk2,887.5,1582.77,0.0
gfx950,256,352,6144,7168,fp8,fp8,flydsl,21473,2,35.266,flydsl_mxpsh_96x128x256_F8_F8_B16_w0_x4_sk2,879.16,1443.0,0.0
gfx950,256,384,6144,7168,fp8,fp8,flydsl,21473,2,35.4469,flydsl_mxpsh_96x128x256_F8_F8_B16_w0_x4_sk2,954.18,1453.2,0.0
gfx950,256,416,6144,7168,fp8,fp8,flydsl,21537,2,36.6182,flydsl_mxpsh_96x128x256_F8_F8_B16_w1_x4_sk2,1000.63,1423.72,0.0
gfx950,256,448,6144,7168,fp8,fp8,flydsl,21601,2,37.8304,flydsl_mxpsh_96x128x256_F8_F8_B16_w2_x4_sk2,1043.08,1394.55,0.0
gfx950,256,480,6144,7168,fp8,fp8,flydsl,21537,2,38.4149,flydsl_mxpsh_96x128x256_F8_F8_B16_w1_x4_sk2,1100.58,1389.54,0.0
gfx950,256,512,6144,7168,fp8,fp8,flydsl,19552,1,40.2365,flydsl_mxpsh_64x128x256_F8_F8_B16_w0_x4_sk1,1120.8,1342.11,0.0
gfx950,256,544,6144,7168,fp8,fp8,flydsl,23648,1,41.5716,flydsl_mxpsh_128x128x256_F8_F8_B16_w4_x4_sk1,1152.61,1313.98,0.0
gfx950,256,576,6144,7168,fp8,fp8,flydsl,23584,1,42.0424,flydsl_mxpsh_128x128x256_F8_F8_B16_w3_x4_sk1,1206.74,1314.07,0.0
gfx950,256,608,6144,7168,fp8,fp8,flydsl,23520,1,43.2567,flydsl_mxpsh_128x128x256_F8_F8_B16_w2_x4_sk1,1238.02,1291.58,0.0
gfx950,256,640,6144,7168,fp8,fp8,flydsl,23456,1,43.4478,flydsl_mxpsh_128x128x256_F8_F8_B16_w1_x4_sk1,1297.45,1300.23,0.0
gfx950,256,672,6144,7168,fp8,fp8,flydsl,21600,1,53.2166,flydsl_mxpsh_96x128x256_F8_F8_B16_w2_x4_sk1,1112.25,1073.25,0.0
gfx950,256,704,6144,7168,fp8,fp8,flydsl,21728,1,50.9999,flydsl_mxpsh_96x128x256_F8_F8_B16_w4_x4_sk1,1215.86,1132.1,0.0
gfx950,256,736,6144,7168,fp8,fp8,flydsl,21728,1,52.3728,flydsl_mxpsh_96x128x256_F8_F8_B16_w4_x4_sk1,1237.8,1114.32,0.0
gfx950,256,768,6144,7168,fp8,fp8,flydsl,21472,1,51.8056,flydsl_mxpsh_96x128x256_F8_F8_B16_w0_x4_sk1,1305.76,1138.53,0.0
gfx950,256,800,6144,7168,fp8,fp8,flydsl,21472,1,53.0161,flydsl_mxpsh_96x128x256_F8_F8_B16_w0_x4_sk1,1329.11,1124.28,0.0
gfx950,256,832,6144,7168,fp8,fp8,flydsl,21728,1,55.397,flydsl_mxpsh_96x128x256_F8_F8_B16_w4_x4_sk1,1322.87,1087.2,0.0
gfx950,256,864,6144,7168,fp8,fp8,flydsl,21728,1,55.8146,flydsl_mxpsh_96x128x256_F8_F8_B16_w4_x4_sk1,1363.47,1090.22,0.0
gfx950,256,896,6144,7168,fp8,fp8,flydsl,21600,1,58.5127,flydsl_mxpsh_96x128x256_F8_F8_B16_w2_x4_sk1,1348.77,1050.59,0.0
gfx950,256,928,6144,7168,fp8,fp8,flydsl,21472,1,57.4615,flydsl_mxpsh_96x128x256_F8_F8_B16_w0_x4_sk1,1422.49,1080.64,0.0
gfx950,256,960,6144,7168,fp8,fp8,flydsl,21600,1,59.1079,flydsl_mxpsh_96x128x256_F8_F8_B16_w2_x4_sk1,1430.56,1061.08,0.0
gfx950,256,992,6144,7168,fp8,fp8,flydsl,23648,1,62.2548,flydsl_mxpsh_128x128x256_F8_F8_B16_w4_x4_sk1,1403.52,1017.44,0.0
gfx950,256,1024,6144,7168,fp8,fp8,flydsl,23520,1,62.8052,flydsl_mxpsh_128x128x256_F8_F8_B16_w2_x4_sk1,1436.1,1018.44,0.0
gfx950,256,1088,6144,7168,fp8,fp8,flydsl,23392,1,65.1232,flydsl_mxpsh_128x128x256_F8_F8_B16_w0_x4_sk1,1471.54,1001.31,0.0
gfx950,256,1152,6144,7168,fp8,fp8,flydsl,23584,1,65.0936,flydsl_mxpsh_128x128x256_F8_F8_B16_w3_x4_sk1,1558.81,1020.89,0.0
gfx950,256,1216,6144,7168,fp8,fp8,flydsl,23392,1,69.3713,flydsl_mxpsh_128x128x256_F8_F8_B16_w0_x4_sk1,1543.95,975.89,0.0
gfx950,256,1280,6144,7168,fp8,fp8,flydsl,23456,1,69.2033,flydsl_mxpsh_128x128x256_F8_F8_B16_w1_x4_sk1,1629.15,996.25,0.0
gfx950,256,1344,6144,7168,fp8,fp8,flydsl,21280,1,75.5893,flydsl_mxpsh_96x128x128_F8_F8_B16_w2_x4_sk1,1566.1,928.56,0.0
gfx950,256,1408,6144,7168,fp8,fp8,flydsl,21280,1,79.1382,flydsl_mxpsh_96x128x128_F8_F8_B16_w2_x4_sk1,1567.1,902.65,0.0
gfx950,256,1472,6144,7168,fp8,fp8,flydsl,21344,1,81.4798,flydsl_mxpsh_96x128x128_F8_F8_B16_w3_x4_sk1,1591.25,891.99,0.0
gfx950,256,1536,6144,7168,fp8,fp8,flydsl,21408,1,83.4554,flydsl_mxpsh_96x128x128_F8_F8_B16_w4_x4_sk1,1621.12,885.8,0.0
gfx950,256,1600,6144,7168,fp8,fp8,flydsl,23136,1,88.3862,flydsl_mxpsh_128x128x128_F8_F8_B16_w1_x4_sk1,1594.46,850.47,0.0
gfx950,256,1664,6144,7168,fp8,fp8,flydsl,23264,1,88.0891,flydsl_mxpsh_128x128x128_F8_F8_B16_w3_x4_sk1,1663.84,867.47,0.0
gfx950,256,1728,6144,7168,fp8,fp8,flydsl,23264,1,91.5971,flydsl_mxpsh_128x128x128_F8_F8_B16_w3_x4_sk1,1661.66,847.85,0.0
gfx950,256,1792,6144,7168,fp8,fp8,flydsl,23264,1,91.7507,flydsl_mxpsh_128x128x128_F8_F8_B16_w3_x4_sk1,1720.31,860.0,0.0
gfx950,256,1856,6144,7168,fp8,fp8,flydsl,23136,1,93.6854,flydsl_mxpsh_128x128x128_F8_F8_B16_w1_x4_sk1,1744.96,855.53,0.0
gfx950,256,1920,6144,7168,fp8,fp8,flydsl,21920,1,95.2387,flydsl_mxpsh_96x256x128_F8_F8_B16_w2_x4_sk1,1775.69,854.65,0.0
gfx950,256,1984,6144,7168,fp8,fp8,flydsl,23072,1,96.3112,flydsl_mxpsh_128x128x128_F8_F8_B16_w0_x4_sk1,1814.45,858.06,0.0
gfx950,256,2048,6144,7168,fp8,fp8,flydsl,23200,1,100.2504,flydsl_mxpsh_128x128x128_F8_F8_B16_w2_x4_sk1,1799.38,836.77,0.0
gfx950,256,4096,6144,7168,fp8,fp8,flydsl,23712,1,170.2924,flydsl_mxpsh_128x256x128_F8_F8_B16_w0_x4_sk1,2118.58,726.59,0.0
gfx950,256,6144,6144,7168,fp8,fp8,flydsl,23840,1,243.0283,flydsl_mxpsh_128x256x128_F8_F8_B16_w2_x4_sk1,2226.76,673.08,0.0
gfx950,256,8192,6144,7168,fp8,fp8,flydsl,23840,1,294.3785,flydsl_mxpsh_128x256x128_F8_F8_B16_w2_x4_sk1,2451.11,691.03,0.0
gfx950,256,10240,6144,7168,fp8,fp8,flydsl,23776,1,371.3344,flydsl_mxpsh_128x256x128_F8_F8_B16_w1_x4_sk1,2428.92,655.12,0.0
gfx950,256,12288,6144,7168,fp8,fp8,flydsl,23712,1,433.1379,flydsl_mxpsh_128x256x128_F8_F8_B16_w0_x4_sk1,2498.82,653.64,0.0
gfx950,256,14336,6144,7168,fp8,fp8,flydsl,23776,1,504.9175,flydsl_mxpsh_128x256x128_F8_F8_B16_w1_x4_sk1,2500.84,639.63,0.0
gfx950,256,16384,6144,7168,fp8,fp8,flydsl,23712,1,572.3477,flydsl_mxpsh_128x256x128_F8_F8_B16_w0_x4_sk1,2521.39,633.89,0.0
gfx950,256,20480,6144,7168,fp8,fp8,flydsl,23776,1,720.9398,flydsl_mxpsh_128x256x128_F8_F8_B16_w1_x4_sk1,2502.13,613.78,0.0
gfx950,256,24576,6144,7168,fp8,fp8,flydsl,23776,1,874.6121,flydsl_mxpsh_128x256x128_F8_F8_B16_w1_x4_sk1,2475.0,597.05,0.0
gfx950,256,28672,6144,7168,fp8,fp8,flydsl,23776,1,1025.9866,flydsl_mxpsh_128x256x128_F8_F8_B16_w1_x4_sk1,2461.48,586.64,0.0
gfx950,256,32768,6144,7168,fp8,fp8,flydsl,23712,1,1180.0637,flydsl_mxpsh_128x256x128_F8_F8_B16_w0_x4_sk1,2445.82,577.57,0.0
gfx950,256,40960,6144,7168,fp8,fp8,flydsl,23776,1,1479.5519,flydsl_mxpsh_128x256x128_F8_F8_B16_w1_x4_sk1,2438.42,568.39,0.0
gfx950,256,49152,6144,7168,fp8,fp8,flydsl,23776,1,1788.7767,flydsl_mxpsh_128x256x128_F8_F8_B16_w1_x4_sk1,2420.27,559.23,0.0
gfx950,256,57344,6144,7168,fp8,fp8,flydsl,23840,1,2096.1001,flydsl_mxpsh_128x256x128_F8_F8_B16_w2_x4_sk1,2409.66,553.28,0.0
gfx950,256,65536,6144,7168,fp8,fp8,flydsl,23776,1,2428.2009,flydsl_mxpsh_128x256x128_F8_F8_B16_w1_x4_sk1,2377.25,543.25,0.0
gfx950,256,1,7168,384,fp8,fp8,flydsl,17344,1,4.859,flydsl_mxpsh_32x128x128_F8_F8_B16_w1_x0_sk1,1.13,569.51,0.0
gfx950,256,1,7168,3072,fp8,fp8,flydsl,17803,12,9.5536,flydsl_mxpsh_32x128x256_F8_F8_B16_w3_x0_sk12,4.61,2306.72,0.0
gfx950,256,1,7168,7168,fp8,fp8,flydsl,17862,7,14.0291,flydsl_mxpsh_32x128x256_F8_F8_B16_w4_x0_sk7,7.32,3663.94,0.0
gfx950,256,1,7168,16384,fp8,fp8,flydsl,17767,8,24.5795,flydsl_mxpsh_32x128x256_F8_F8_B16_w2_x4_sk8,9.56,4779.24,0.0
gfx950,256,2,7168,384,fp8,fp8,flydsl,17280,1,4.8666,flydsl_mxpsh_32x128x128_F8_F8_B16_w0_x0_sk1,2.26,571.64,0.0
gfx950,256,2,7168,3072,fp8,fp8,flydsl,17611,12,9.525,flydsl_mxpsh_32x128x256_F8_F8_B16_w0_x0_sk12,9.25,2315.48,0.0
gfx950,256,2,7168,7168,fp8,fp8,flydsl,17894,7,14.0585,flydsl_mxpsh_32x128x256_F8_F8_B16_w4_x4_sk7,14.62,3657.8,0.0
gfx950,256,2,7168,16384,fp8,fp8,flydsl,17703,8,24.4081,flydsl_mxpsh_32x128x256_F8_F8_B16_w1_x4_sk8,19.25,4814.06,0.0
gfx950,256,4,7168,384,fp8,fp8,flydsl,17472,1,4.908,flydsl_mxpsh_32x128x128_F8_F8_B16_w3_x0_sk1,4.49,572.82,0.0
gfx950,256,4,7168,3072,fp8,fp8,flydsl,17611,12,9.4087,flydsl_mxpsh_32x128x256_F8_F8_B16_w0_x0_sk12,18.72,2347.8,0.0
gfx950,256,4,7168,7168,fp8,fp8,flydsl,17734,7,14.1577,flydsl_mxpsh_32x128x256_F8_F8_B16_w2_x0_sk7,29.03,3635.21,0.0
gfx950,256,4,7168,16384,fp8,fp8,flydsl,17767,8,24.3637,flydsl_mxpsh_32x128x256_F8_F8_B16_w2_x4_sk8,38.56,4825.35,0.0
gfx950,256,8,7168,384,fp8,fp8,flydsl,17280,1,4.8387,flydsl_mxpsh_32x128x128_F8_F8_B16_w0_x0_sk1,9.1,593.19,0.0
gfx950,256,8,7168,3072,fp8,fp8,flydsl,17573,6,9.8441,flydsl_mxpsh_32x128x128_F8_F8_B16_w4_x4_sk6,35.79,2251.03,0.0
gfx950,256,8,7168,7168,fp8,fp8,flydsl,17798,7,14.596,flydsl_mxpsh_32x128x256_F8_F8_B16_w3_x0_sk7,56.32,3531.94,0.0
gfx950,256,8,7168,16384,fp8,fp8,flydsl,17831,8,24.7299,flydsl_mxpsh_32x128x256_F8_F8_B16_w3_x4_sk8,75.98,4758.87,0.0
gfx950,256,16,7168,384,fp8,fp8,flydsl,17536,1,4.9447,flydsl_mxpsh_32x128x128_F8_F8_B16_w4_x0_sk1,17.81,604.29,0.0
gfx950,256,16,7168,3072,fp8,fp8,flydsl,17827,4,10.1233,flydsl_mxpsh_32x128x256_F8_F8_B16_w3_x4_sk4,69.61,2202.7,0.0
gfx950,256,16,7168,7168,fp8,fp8,flydsl,17702,7,14.9346,flydsl_mxpsh_32x128x256_F8_F8_B16_w1_x4_sk7,110.09,3463.39,0.0
gfx950,256,16,7168,16384,fp8,fp8,flydsl,17639,8,25.4133,flydsl_mxpsh_32x128x256_F8_F8_B16_w0_x4_sk8,147.88,4640.56,0.0
gfx950,256,32,7168,384,fp8,fp8,flydsl,17344,1,5.0236,flydsl_mxpsh_32x128x128_F8_F8_B16_w1_x0_sk1,35.07,641.68,0.0
gfx950,256,32,7168,3072,fp8,fp8,flydsl,17667,4,10.9977,flydsl_mxpsh_32x128x256_F8_F8_B16_w1_x0_sk4,128.14,2052.9,0.0
gfx950,256,32,7168,7168,fp8,fp8,flydsl,17318,7,16.2683,flydsl_mxpsh_32x128x128_F8_F8_B16_w0_x4_sk7,202.13,3200.6,0.0
gfx950,256,32,7168,16384,fp8,fp8,flydsl,17319,8,27.4824,flydsl_mxpsh_32x128x128_F8_F8_B16_w0_x4_sk8,273.49,4309.07,0.0
gfx950,256,48,7168,384,fp8,fp8,flydsl,17536,1,4.9905,flydsl_mxpsh_32x128x128_F8_F8_B16_w4_x0_sk1,52.95,693.13,0.0
gfx950,256,48,7168,3072,fp8,fp8,flydsl,19619,4,12.415,flydsl_mxpsh_64x128x256_F8_F8_B16_w1_x4_sk4,170.27,1840.97,0.0
gfx950,256,48,7168,7168,fp8,fp8,flydsl,19555,4,18.1521,flydsl_mxpsh_64x128x256_F8_F8_B16_w0_x4_sk4,271.73,2887.4,0.0
gfx950,256,48,7168,16384,fp8,fp8,flydsl,21255,8,29.7671,flydsl_mxpsh_96x128x128_F8_F8_B16_w2_x0_sk8,378.75,3994.85,0.0
gfx950,256,64,7168,384,fp8,fp8,flydsl,17408,1,5.0723,flydsl_mxpsh_32x128x128_F8_F8_B16_w2_x0_sk1,69.46,728.39,0.0
gfx950,256,64,7168,3072,fp8,fp8,flydsl,18339,4,12.8834,flydsl_mxpsh_32x256x256_F8_F8_B16_w1_x4_sk4,218.78,1795.66,0.0
gfx950,256,64,7168,7168,fp8,fp8,flydsl,19587,4,18.4996,flydsl_mxpsh_64x128x256_F8_F8_B16_w1_x0_sk4,355.5,2851.76,0.0
gfx950,256,64,7168,16384,fp8,fp8,flydsl,21287,8,31.0922,flydsl_mxpsh_96x128x128_F8_F8_B16_w2_x4_sk8,483.48,3840.4,0.0
gfx950,256,80,7168,384,fp8,fp8,flydsl,17280,1,5.0914,flydsl_mxpsh_32x128x128_F8_F8_B16_w0_x0_sk1,86.5,771.91,0.0
gfx950,256,80,7168,3072,fp8,fp8,flydsl,17826,3,13.759,flydsl_mxpsh_32x128x256_F8_F8_B16_w3_x4_sk3,256.07,1701.63,0.0
gfx950,256,80,7168,7168,fp8,fp8,flydsl,21443,4,19.6157,flydsl_mxpsh_96x128x256_F8_F8_B16_w0_x0_sk4,419.09,2707.04,0.0
gfx950,256,80,7168,16384,fp8,fp8,flydsl,21543,8,33.0178,flydsl_mxpsh_96x128x256_F8_F8_B16_w1_x4_sk8,569.1,3631.32,0.0
gfx950,256,96,7168,384,fp8,fp8,flydsl,17472,1,5.1505,flydsl_mxpsh_32x128x128_F8_F8_B16_w3_x0_sk1,102.61,808.78,0.0
gfx950,256,96,7168,3072,fp8,fp8,flydsl,17890,3,13.7393,flydsl_mxpsh_32x128x256_F8_F8_B16_w4_x4_sk3,307.72,1724.34,0.0
gfx950,256,96,7168,7168,fp8,fp8,flydsl,21507,4,20.4311,flydsl_mxpsh_96x128x256_F8_F8_B16_w1_x0_sk4,482.84,2615.85,0.0
gfx950,256,96,7168,16384,fp8,fp8,flydsl,21319,8,34.8879,flydsl_mxpsh_96x128x128_F8_F8_B16_w3_x0_sk8,646.32,3450.76,0.0
gfx950,256,112,7168,384,fp8,fp8,flydsl,17376,1,5.3462,flydsl_mxpsh_32x128x128_F8_F8_B16_w1_x4_sk1,115.33,823.23,0.0
gfx950,256,112,7168,3072,fp8,fp8,flydsl,17633,2,14.9822,flydsl_mxpsh_32x128x256_F8_F8_B16_w0_x4_sk2,329.22,1599.88,0.0
gfx950,256,112,7168,7168,fp8,fp8,flydsl,23587,4,21.631,flydsl_mxpsh_128x128x256_F8_F8_B16_w3_x4_sk4,532.07,2486.65,0.0
gfx950,256,112,7168,16384,fp8,fp8,flydsl,23527,8,38.0808,flydsl_mxpsh_128x128x256_F8_F8_B16_w2_x4_sk8,690.81,3174.33,0.0
gfx950,256,128,7168,384,fp8,fp8,flydsl,17504,1,5.4289,flydsl_mxpsh_32x128x128_F8_F8_B16_w3_x4_sk1,129.79,854.07,0.0
gfx950,256,128,7168,3072,fp8,fp8,flydsl,17825,2,15.1042,flydsl_mxpsh_32x128x256_F8_F8_B16_w3_x4_sk2,373.22,1605.4,0.0
gfx950,256,128,7168,7168,fp8,fp8,flydsl,23427,4,22.6828,flydsl_mxpsh_128x128x256_F8_F8_B16_w1_x0_sk4,579.88,2386.51,0.0
gfx950,256,128,7168,16384,fp8,fp8,flydsl,23463,8,39.0454,flydsl_mxpsh_128x128x256_F8_F8_B16_w1_x4_sk8,770.0,3108.5,0.0
gfx950,256,144,7168,384,fp8,fp8,flydsl,17312,1,5.4717,flydsl_mxpsh_32x128x128_F8_F8_B16_w0_x4_sk1,144.88,890.43,0.0
gfx950,256,144,7168,3072,fp8,fp8,flydsl,17760,1,15.8107,flydsl_mxpsh_32x128x256_F8_F8_B16_w2_x4_sk1,401.11,1551.28,0.0
gfx950,256,144,7168,7168,fp8,fp8,flydsl,21603,4,26.0315,flydsl_mxpsh_96x128x256_F8_F8_B16_w2_x4_sk4,568.45,2092.73,0.0
gfx950,256,144,7168,16384,fp8,fp8,flydsl,21603,4,42.4944,flydsl_mxpsh_96x128x256_F8_F8_B16_w2_x4_sk4,795.94,2867.77,0.0
gfx950,256,160,7168,384,fp8,fp8,flydsl,17376,1,5.5339,flydsl_mxpsh_32x128x128_F8_F8_B16_w1_x4_sk1,159.17,922.99,0.0
gfx950,256,160,7168,3072,fp8,fp8,flydsl,17632,1,15.8907,flydsl_mxpsh_32x128x256_F8_F8_B16_w0_x4_sk1,443.43,1561.0,0.0
gfx950,256,160,7168,7168,fp8,fp8,flydsl,21539,4,25.9728,flydsl_mxpsh_96x128x256_F8_F8_B16_w1_x4_sk4,633.03,2110.7,0.0
gfx950,256,160,7168,16384,fp8,fp8,flydsl,21475,4,43.3171,flydsl_mxpsh_96x128x256_F8_F8_B16_w0_x4_sk4,867.58,2824.65,0.0
gfx950,256,176,7168,384,fp8,fp8,flydsl,17440,1,5.6214,flydsl_mxpsh_32x128x128_F8_F8_B16_w2_x4_sk1,172.36,950.52,0.0
gfx950,256,176,7168,3072,fp8,fp8,flydsl,17632,1,16.0725,flydsl_mxpsh_32x128x256_F8_F8_B16_w0_x4_sk1,482.26,1560.67,0.0
gfx950,256,176,7168,7168,fp8,fp8,flydsl,21539,4,26.9742,flydsl_mxpsh_96x128x256_F8_F8_B16_w1_x4_sk4,670.49,2045.1,0.0
gfx950,256,176,7168,16384,fp8,fp8,flydsl,21603,4,44.5507,flydsl_mxpsh_96x128x256_F8_F8_B16_w2_x4_sk4,927.91,2757.47,0.0
gfx950,256,192,7168,384,fp8,fp8,flydsl,17504,1,5.6303,flydsl_mxpsh_32x128x128_F8_F8_B16_w3_x4_sk1,187.73,990.84,0.0
gfx950,256,192,7168,3072,fp8,fp8,flydsl,17824,1,16.2233,flydsl_mxpsh_32x128x256_F8_F8_B16_w3_x4_sk1,521.21,1563.33,0.0
gfx950,256,192,7168,7168,fp8,fp8,flydsl,21539,4,27.0973,flydsl_mxpsh_96x128x256_F8_F8_B16_w1_x4_sk4,728.12,2048.51,0.0
gfx950,256,192,7168,16384,fp8,fp8,flydsl,21603,4,46.6772,flydsl_mxpsh_96x128x256_F8_F8_B16_w2_x4_sk4,966.15,2642.38,0.0
gfx950,256,208,7168,384,fp8,fp8,flydsl,17312,1,5.7407,flydsl_mxpsh_32x128x128_F8_F8_B16_w0_x4_sk1,199.46,1012.82,0.0
gfx950,256,208,7168,3072,fp8,fp8,flydsl,17888,1,16.2383,flydsl_mxpsh_32x128x256_F8_F8_B16_w4_x4_sk1,564.12,1579.04,0.0
gfx950,256,208,7168,7168,fp8,fp8,flydsl,23649,2,28.7141,flydsl_mxpsh_128x128x256_F8_F8_B16_w4_x4_sk2,744.38,1945.14,0.0
gfx950,256,208,7168,16384,fp8,fp8,flydsl,23651,4,48.8721,flydsl_mxpsh_128x128x256_F8_F8_B16_w4_x4_sk4,999.66,2533.76,0.0
gfx950,256,224,7168,384,fp8,fp8,flydsl,17504,1,5.8027,flydsl_mxpsh_32x128x128_F8_F8_B16_w3_x4_sk1,212.51,1042.58,0.0
gfx950,256,224,7168,3072,fp8,fp8,flydsl,17888,1,16.3366,flydsl_mxpsh_32x128x256_F8_F8_B16_w4_x4_sk1,603.86,1586.59,0.0
gfx950,256,224,7168,7168,fp8,fp8,flydsl,23393,2,29.4048,flydsl_mxpsh_128x128x256_F8_F8_B16_w0_x4_sk2,782.81,1911.15,0.0
gfx950,256,224,7168,16384,fp8,fp8,flydsl,23523,4,50.2486,flydsl_mxpsh_128x128x256_F8_F8_B16_w2_x4_sk4,1047.06,2474.13,0.0
gfx950,256,240,7168,384,fp8,fp8,flydsl,17376,1,5.9957,flydsl_mxpsh_32x128x128_F8_F8_B16_w1_x4_sk1,220.36,1048.3,0.0
gfx950,256,240,7168,3072,fp8,fp8,flydsl,17696,1,16.2873,flydsl_mxpsh_32x128x256_F8_F8_B16_w1_x4_sk1,648.95,1608.49,0.0
gfx950,256,240,7168,7168,fp8,fp8,flydsl,23649,2,29.4992,flydsl_mxpsh_128x128x256_F8_F8_B16_w4_x4_sk2,836.04,1916.7,0.0
gfx950,256,240,7168,16384,fp8,fp8,flydsl,23459,4,51.1808,flydsl_mxpsh_128x128x256_F8_F8_B16_w1_x4_sk4,1101.42,2438.67,0.0
gfx950,256,256,7168,384,fp8,fp8,flydsl,17376,1,6.0576,flydsl_mxpsh_32x128x128_F8_F8_B16_w1_x4_sk1,232.65,1076.47,0.0
gfx950,256,256,7168,3072,fp8,fp8,flydsl,17888,1,16.7165,flydsl_mxpsh_32x128x256_F8_F8_B16_w4_x4_sk1,674.44,1583.86,0.0
gfx950,256,256,7168,7168,fp8,fp8,flydsl,23585,2,30.5345,flydsl_mxpsh_128x128x256_F8_F8_B16_w3_x4_sk2,861.54,1862.98,0.0
gfx950,256,256,7168,16384,fp8,fp8,flydsl,23459,4,52.2478,flydsl_mxpsh_128x128x256_F8_F8_B16_w1_x4_sk4,1150.85,2398.28,0.0
gfx950,256,288,7168,384,fp8,fp8,flydsl,17504,1,6.1034,flydsl_mxpsh_32x128x128_F8_F8_B16_w3_x4_sk1,259.76,1145.57,0.0
gfx950,256,288,7168,3072,fp8,fp8,flydsl,17696,1,17.356,flydsl_mxpsh_32x128x256_F8_F8_B16_w1_x4_sk1,730.79,1557.59,0.0
gfx950,256,288,7168,7168,fp8,fp8,flydsl,17760,1,34.8855,flydsl_mxpsh_32x128x256_F8_F8_B16_w2_x4_sk1,848.35,1650.35,0.0
gfx950,256,288,7168,16384,fp8,fp8,flydsl,21731,4,64.1517,flydsl_mxpsh_96x128x256_F8_F8_B16_w4_x4_sk4,1054.47,1968.58,0.0
gfx950,256,320,7168,384,fp8,fp8,flydsl,19360,1,6.6586,flydsl_mxpsh_64x128x128_F8_F8_B16_w2_x4_sk1,264.56,1120.79,0.0
gfx950,256,320,7168,3072,fp8,fp8,flydsl,23648,1,19.5368,flydsl_mxpsh_128x128x256_F8_F8_B16_w4_x4_sk1,721.35,1412.24,0.0
gfx950,256,320,7168,7168,fp8,fp8,flydsl,21473,2,35.968,flydsl_mxpsh_96x128x256_F8_F8_B16_w0_x4_sk2,914.24,1619.81,0.0
gfx950,256,320,7168,16384,fp8,fp8,flydsl,21537,2,64.7315,flydsl_mxpsh_96x128x256_F8_F8_B16_w1_x4_sk2,1161.13,1966.14,0.0
gfx950,256,352,7168,384,fp8,fp8,flydsl,19360,1,6.7999,flydsl_mxpsh_64x128x128_F8_F8_B16_w2_x4_sk1,284.97,1166.77,0.0
gfx950,256,352,7168,3072,fp8,fp8,flydsl,21536,1,19.4569,flydsl_mxpsh_96x128x256_F8_F8_B16_w1_x4_sk1,796.74,1446.67,0.0
gfx950,256,352,7168,7168,fp8,fp8,flydsl,21729,2,36.5482,flydsl_mxpsh_96x128x256_F8_F8_B16_w4_x4_sk2,989.7,1612.93,0.0
gfx950,256,352,7168,16384,fp8,fp8,flydsl,21537,2,67.1945,flydsl_mxpsh_96x128x256_F8_F8_B16_w1_x4_sk2,1230.43,1908.7,0.0
gfx950,256,384,7168,384,fp8,fp8,flydsl,21280,1,6.8952,flydsl_mxpsh_96x128x128_F8_F8_B16_w2_x4_sk1,306.58,1218.96,0.0
gfx950,256,384,7168,3072,fp8,fp8,flydsl,21536,1,19.6049,flydsl_mxpsh_96x128x256_F8_F8_B16_w1_x4_sk1,862.61,1464.16,0.0
gfx950,256,384,7168,7168,fp8,fp8,flydsl,21729,2,38.2709,flydsl_mxpsh_96x128x256_F8_F8_B16_w4_x4_sk2,1031.07,1558.31,0.0
gfx950,256,384,7168,16384,fp8,fp8,flydsl,21473,2,68.0576,flydsl_mxpsh_96x128x256_F8_F8_B16_w0_x4_sk2,1325.26,1898.94,0.0
gfx950,256,416,7168,384,fp8,fp8,flydsl,19424,1,7.0741,flydsl_mxpsh_64x128x128_F8_F8_B16_w3_x4_sk1,323.73,1254.72,0.0
gfx950,256,416,7168,3072,fp8,fp8,flydsl,23520,1,20.2397,flydsl_mxpsh_128x128x256_F8_F8_B16_w2_x4_sk1,905.19,1445.76,0.0
gfx950,256,416,7168,7168,fp8,fp8,flydsl,23584,1,41.6407,flydsl_mxpsh_128x128x256_F8_F8_B16_w3_x4_sk1,1026.6,1448.72,0.0
gfx950,256,416,7168,16384,fp8,fp8,flydsl,23585,2,78.1595,flydsl_mxpsh_128x128x256_F8_F8_B16_w3_x4_sk2,1250.14,1666.08,0.0
gfx950,256,448,7168,384,fp8,fp8,flydsl,19232,1,7.191,flydsl_mxpsh_64x128x128_F8_F8_B16_w0_x4_sk1,342.96,1299.83,0.0
gfx950,256,448,7168,3072,fp8,fp8,flydsl,23456,1,20.3101,flydsl_mxpsh_128x128x256_F8_F8_B16_w1_x4_sk1,971.44,1468.18,0.0
gfx950,256,448,7168,7168,fp8,fp8,flydsl,23520,1,41.7986,flydsl_mxpsh_128x128x256_F8_F8_B16_w2_x4_sk1,1101.39,1459.71,0.0
gfx950,256,448,7168,16384,fp8,fp8,flydsl,23585,2,82.0592,flydsl_mxpsh_128x128x256_F8_F8_B16_w3_x4_sk2,1282.33,1598.88,0.0
gfx950,256,480,7168,384,fp8,fp8,flydsl,19488,1,7.4154,flydsl_mxpsh_64x128x128_F8_F8_B16_w4_x4_sk1,356.34,1324.02,0.0
gfx950,256,480,7168,3072,fp8,fp8,flydsl,19616,1,20.2129,flydsl_mxpsh_64x128x256_F8_F8_B16_w1_x4_sk1,1045.83,1502.8,0.0
gfx950,256,480,7168,7168,fp8,fp8,flydsl,19744,1,41.6433,flydsl_mxpsh_64x128x256_F8_F8_B16_w3_x4_sk1,1184.46,1481.68,0.0
gfx950,256,480,7168,16384,fp8,fp8,flydsl,23585,2,82.318,flydsl_mxpsh_128x128x256_F8_F8_B16_w3_x4_sk2,1369.6,1605.8,0.0
gfx950,256,512,7168,384,fp8,fp8,flydsl,19424,1,7.5604,flydsl_mxpsh_64x128x128_F8_F8_B16_w3_x4_sk1,372.81,1360.93,0.0
gfx950,256,512,7168,3072,fp8,fp8,flydsl,19680,1,20.5228,flydsl_mxpsh_64x128x256_F8_F8_B16_w2_x4_sk1,1098.71,1507.25,0.0
gfx950,256,512,7168,7168,fp8,fp8,flydsl,19616,1,42.0113,flydsl_mxpsh_64x128x256_F8_F8_B16_w1_x4_sk1,1252.36,1485.08,0.0
gfx950,256,512,7168,16384,fp8,fp8,flydsl,23393,2,85.99,flydsl_mxpsh_128x128x256_F8_F8_B16_w0_x4_sk2,1398.52,1548.66,0.0
gfx950,256,544,7168,384,fp8,fp8,flydsl,19296,1,7.6452,flydsl_mxpsh_64x128x128_F8_F8_B16_w1_x4_sk1,391.71,1407.44,0.0
gfx950,256,544,7168,3072,fp8,fp8,flydsl,19744,1,21.3941,flydsl_mxpsh_64x128x256_F8_F8_B16_w3_x4_sk1,1119.84,1471.9,0.0
gfx950,256,544,7168,7168,fp8,fp8,flydsl,19680,1,46.0694,flydsl_mxpsh_64x128x256_F8_F8_B16_w2_x4_sk1,1213.42,1369.2,0.0
gfx950,256,544,7168,16384,fp8,fp8,flydsl,19744,1,99.1163,flydsl_mxpsh_64x128x256_F8_F8_B16_w3_x4_sk1,1289.14,1353.48,0.0
gfx950,256,576,7168,384,fp8,fp8,flydsl,19296,1,7.8136,flydsl_mxpsh_64x128x128_F8_F8_B16_w1_x4_sk1,405.82,1437.4,0.0
gfx950,256,576,7168,3072,fp8,fp8,flydsl,19552,1,21.801,flydsl_mxpsh_64x128x256_F8_F8_B16_w0_x4_sk1,1163.58,1469.98,0.0
gfx950,256,576,7168,7168,fp8,fp8,flydsl,19616,1,47.1423,flydsl_mxpsh_64x128x256_F8_F8_B16_w1_x4_sk1,1255.56,1352.64,0.0
gfx950,256,576,7168,16384,fp8,fp8,flydsl,19744,1,99.5315,flydsl_mxpsh_64x128x256_F8_F8_B16_w3_x4_sk1,1359.28,1357.71,0.0
gfx950,256,608,7168,384,fp8,fp8,flydsl,21280,1,8.0981,flydsl_mxpsh_96x128x128_F8_F8_B16_w2_x4_sk1,413.31,1445.06,0.0
gfx950,256,608,7168,3072,fp8,fp8,flydsl,21536,1,24.8383,flydsl_mxpsh_96x128x256_F8_F8_B16_w1_x4_sk1,1078.03,1312.66,0.0
gfx950,256,608,7168,7168,fp8,fp8,flydsl,21536,1,54.9753,flydsl_mxpsh_96x128x256_F8_F8_B16_w1_x4_sk1,1136.48,1172.43,0.0
gfx950,256,608,7168,16384,fp8,fp8,flydsl,21728,1,108.0584,flydsl_mxpsh_96x128x256_F8_F8_B16_w4_x4_sk1,1321.58,1259.67,0.0
gfx950,256,640,7168,384,fp8,fp8,flydsl,21280,1,8.1819,flydsl_mxpsh_96x128x128_F8_F8_B16_w2_x4_sk1,430.61,1487.83,0.0
gfx950,256,640,7168,3072,fp8,fp8,flydsl,21600,1,25.2371,flydsl_mxpsh_96x128x256_F8_F8_B16_w2_x4_sk1,1116.84,1313.99,0.0
gfx950,256,640,7168,7168,fp8,fp8,flydsl,21472,1,55.8535,flydsl_mxpsh_96x128x256_F8_F8_B16_w0_x4_sk1,1177.49,1166.32,0.0
gfx950,256,640,7168,16384,fp8,fp8,flydsl,21728,1,108.5564,flydsl_mxpsh_96x128x256_F8_F8_B16_w4_x4_sk1,1384.75,1262.95,0.0
gfx950,256,672,7168,384,fp8,fp8,flydsl,21152,1,8.3647,flydsl_mxpsh_96x128x128_F8_F8_B16_w0_x4_sk1,442.26,1511.63,0.0
gfx950,256,672,7168,3072,fp8,fp8,flydsl,21536,1,25.3812,flydsl_mxpsh_96x128x256_F8_F8_B16_w1_x4_sk1,1166.02,1328.47,0.0
gfx950,256,672,7168,7168,fp8,fp8,flydsl,21600,1,55.8987,flydsl_mxpsh_96x128x256_F8_F8_B16_w2_x4_sk1,1235.36,1177.68,0.0
gfx950,256,672,7168,16384,fp8,fp8,flydsl,21472,1,110.8312,flydsl_mxpsh_96x128x256_F8_F8_B16_w0_x4_sk1,1424.15,1245.9,0.0
gfx950,256,704,7168,384,fp8,fp8,flydsl,21152,1,8.5669,flydsl_mxpsh_96x128x128_F8_F8_B16_w0_x4_sk1,452.38,1530.94,0.0
gfx950,256,704,7168,3072,fp8,fp8,flydsl,21472,1,25.1235,flydsl_mxpsh_96x128x256_F8_F8_B16_w0_x4_sk1,1234.08,1364.27,0.0
gfx950,256,704,7168,7168,fp8,fp8,flydsl,21728,1,54.7067,flydsl_mxpsh_96x128x256_F8_F8_B16_w4_x4_sk1,1322.39,1215.92,0.0
gfx950,256,704,7168,16384,fp8,fp8,flydsl,21600,1,107.7192,flydsl_mxpsh_96x128x256_F8_F8_B16_w2_x4_sk1,1535.07,1291.02,0.0
gfx950,256,736,7168,384,fp8,fp8,flydsl,21216,1,8.6827,flydsl_mxpsh_96x128x128_F8_F8_B16_w1_x4_sk1,466.64,1564.77,0.0
gfx950,256,736,7168,3072,fp8,fp8,flydsl,21472,1,25.3128,flydsl_mxpsh_96x128x256_F8_F8_B16_w0_x4_sk1,1280.52,1376.08,0.0
gfx950,256,736,7168,7168,fp8,fp8,flydsl,21536,1,54.3163,flydsl_mxpsh_96x128x256_F8_F8_B16_w1_x4_sk1,1392.43,1237.33,0.0
gfx950,256,736,7168,16384,fp8,fp8,flydsl,21536,1,110.4736,flydsl_mxpsh_96x128x256_F8_F8_B16_w1_x4_sk1,1564.83,1267.73,0.0
gfx950,256,768,7168,384,fp8,fp8,flydsl,21344,1,8.9041,flydsl_mxpsh_96x128x128_F8_F8_B16_w3_x4_sk1,474.82,1578.76,0.0
gfx950,256,768,7168,3072,fp8,fp8,flydsl,21600,1,25.7526,flydsl_mxpsh_96x128x256_F8_F8_B16_w2_x4_sk1,1313.38,1374.21,0.0
gfx950,256,768,7168,7168,fp8,fp8,flydsl,21536,1,56.1035,flydsl_mxpsh_96x128x256_F8_F8_B16_w1_x4_sk1,1406.69,1210.18,0.0
gfx950,256,768,7168,16384,fp8,fp8,flydsl,21536,1,113.7193,flydsl_mxpsh_96x128x256_F8_F8_B16_w1_x4_sk1,1586.26,1240.19,0.0
gfx950,256,800,7168,384,fp8,fp8,flydsl,21152,1,9.0653,flydsl_mxpsh_96x128x128_F8_F8_B16_w0_x4_sk1,485.81,1602.65,0.0
gfx950,256,800,7168,3072,fp8,fp8,flydsl,21728,1,26.5786,flydsl_mxpsh_96x128x256_F8_F8_B16_w4_x4_sk1,1325.58,1352.46,0.0
gfx950,256,800,7168,7168,fp8,fp8,flydsl,21472,1,59.8931,flydsl_mxpsh_96x128x256_F8_F8_B16_w0_x4_sk1,1372.58,1145.1,0.0
gfx950,256,800,7168,16384,fp8,fp8,flydsl,21600,1,120.3108,flydsl_mxpsh_96x128x256_F8_F8_B16_w2_x4_sk1,1561.83,1180.41,0.0
gfx950,256,832,7168,384,fp8,fp8,flydsl,21344,1,9.206,flydsl_mxpsh_96x128x128_F8_F8_B16_w3_x4_sk1,497.52,1629.32,0.0
gfx950,256,832,7168,3072,fp8,fp8,flydsl,21600,1,26.7914,flydsl_mxpsh_96x128x256_F8_F8_B16_w2_x4_sk1,1367.66,1362.51,0.0
gfx950,256,832,7168,7168,fp8,fp8,flydsl,21536,1,60.4435,flydsl_mxpsh_96x128x256_F8_F8_B16_w1_x4_sk1,1414.49,1146.05,0.0
gfx950,256,832,7168,16384,fp8,fp8,flydsl,21728,1,119.2337,flydsl_mxpsh_96x128x256_F8_F8_B16_w4_x4_sk1,1638.97,1199.32,0.0
gfx950,256,864,7168,384,fp8,fp8,flydsl,21152,1,9.625,flydsl_mxpsh_96x128x128_F8_F8_B16_w0_x4_sk1,494.17,1607.33,0.0
gfx950,256,864,7168,3072,fp8,fp8,flydsl,21536,1,26.8347,flydsl_mxpsh_96x128x256_F8_F8_B16_w1_x4_sk1,1417.97,1381.07,0.0
gfx950,256,864,7168,7168,fp8,fp8,flydsl,21728,1,60.9527,flydsl_mxpsh_96x128x256_F8_F8_B16_w4_x4_sk1,1456.62,1147.77,0.0
gfx950,256,864,7168,16384,fp8,fp8,flydsl,21536,1,120.9181,flydsl_mxpsh_96x128x256_F8_F8_B16_w1_x4_sk1,1678.3,1190.74,0.0
gfx950,256,896,7168,384,fp8,fp8,flydsl,23136,1,9.8892,flydsl_mxpsh_128x128x128_F8_F8_B16_w1_x4_sk1,498.78,1612.02,0.0
gfx950,256,896,7168,3072,fp8,fp8,flydsl,23584,1,28.4442,flydsl_mxpsh_128x128x256_F8_F8_B16_w3_x4_sk1,1387.28,1322.51,0.0
gfx950,256,896,7168,7168,fp8,fp8,flydsl,23456,1,62.554,flydsl_mxpsh_128x128x256_F8_F8_B16_w1_x4_sk1,1471.9,1129.39,0.0
gfx950,256,896,7168,16384,fp8,fp8,flydsl,23648,1,136.9438,flydsl_mxpsh_128x128x256_F8_F8_B16_w4_x4_sk1,1536.79,1058.58,0.0
gfx950,256,928,7168,384,fp8,fp8,flydsl,23136,1,9.7841,flydsl_mxpsh_128x128x128_F8_F8_B16_w1_x4_sk1,522.14,1677.48,0.0
gfx950,256,928,7168,3072,fp8,fp8,flydsl,23520,1,28.8061,flydsl_mxpsh_128x128x256_F8_F8_B16_w2_x4_sk1,1418.77,1325.23,0.0
gfx950,256,928,7168,7168,fp8,fp8,flydsl,23392,1,63.4483,flydsl_mxpsh_128x128x256_F8_F8_B16_w0_x4_sk1,1502.98,1124.32,0.0
gfx950,256,928,7168,16384,fp8,fp8,flydsl,23456,1,135.8118,flydsl_mxpsh_128x128x256_F8_F8_B16_w1_x4_sk1,1604.94,1074.64,0.0
gfx950,256,960,7168,384,fp8,fp8,flydsl,23200,1,9.8961,flydsl_mxpsh_128x128x128_F8_F8_B16_w2_x4_sk1,534.03,1706.1,0.0
gfx950,256,960,7168,3072,fp8,fp8,flydsl,23648,1,29.2718,flydsl_mxpsh_128x128x256_F8_F8_B16_w4_x4_sk1,1444.35,1323.18,0.0
gfx950,256,960,7168,7168,fp8,fp8,flydsl,23456,1,64.5672,flydsl_mxpsh_128x128x256_F8_F8_B16_w1_x4_sk1,1527.87,1115.49,0.0
gfx950,256,960,7168,16384,fp8,fp8,flydsl,23584,1,137.5131,flydsl_mxpsh_128x128x256_F8_F8_B16_w3_x4_sk1,1639.74,1068.49,0.0
gfx950,256,992,7168,384,fp8,fp8,flydsl,23200,1,9.9632,flydsl_mxpsh_128x128x128_F8_F8_B16_w2_x4_sk1,548.12,1741.89,0.0
gfx950,256,992,7168,3072,fp8,fp8,flydsl,23648,1,29.4182,flydsl_mxpsh_128x128x256_F8_F8_B16_w4_x4_sk1,1485.06,1335.53,0.0
gfx950,256,992,7168,7168,fp8,fp8,flydsl,23520,1,66.6896,flydsl_mxpsh_128x128x256_F8_F8_B16_w2_x4_sk1,1528.55,1090.31,0.0
gfx950,256,992,7168,16384,fp8,fp8,flydsl,23520,1,137.7866,flydsl_mxpsh_128x128x256_F8_F8_B16_w2_x4_sk1,1691.04,1073.51,0.0
gfx950,256,1024,7168,384,fp8,fp8,flydsl,23200,1,10.1385,flydsl_mxpsh_128x128x128_F8_F8_B16_w2_x4_sk1,556.01,1758.23,0.0
gfx950,256,1024,7168,3072,fp8,fp8,flydsl,23392,1,29.3767,flydsl_mxpsh_128x128x256_F8_F8_B16_w0_x4_sk1,1535.13,1356.38,0.0
gfx950,256,1024,7168,7168,fp8,fp8,flydsl,23392,1,66.586,flydsl_mxpsh_128x128x256_F8_F8_B16_w0_x4_sk1,1580.31,1102.34,0.0
gfx950,256,1024,7168,16384,fp8,fp8,flydsl,23841,2,141.4685,flydsl_mxpsh_128x256x128_F8_F8_B16_w2_x4_sk2,1700.15,1052.52,0.0
gfx950,256,1088,7168,384,fp8,fp8,flydsl,23136,1,10.4631,flydsl_mxpsh_128x128x128_F8_F8_B16_w1_x4_sk1,572.44,1793.72,0.0
gfx950,256,1088,7168,3072,fp8,fp8,flydsl,23392,1,30.8854,flydsl_mxpsh_128x128x256_F8_F8_B16_w0_x4_sk1,1551.4,1326.19,0.0
gfx950,256,1088,7168,7168,fp8,fp8,flydsl,23520,1,70.3345,flydsl_mxpsh_128x128x256_F8_F8_B16_w2_x4_sk1,1589.59,1063.16,0.0
gfx950,256,1088,7168,16384,fp8,fp8,flydsl,23520,1,149.2304,flydsl_mxpsh_128x128x256_F8_F8_B16_w2_x4_sk1,1712.46,1010.95,0.0
gfx950,256,1152,7168,384,fp8,fp8,flydsl,23072,1,10.6624,flydsl_mxpsh_128x128x128_F8_F8_B16_w0_x4_sk1,594.78,1848.55,0.0
gfx950,256,1152,7168,3072,fp8,fp8,flydsl,23648,1,31.023,flydsl_mxpsh_128x128x256_F8_F8_B16_w4_x4_sk1,1635.38,1356.22,0.0
gfx950,256,1152,7168,7168,fp8,fp8,flydsl,23584,1,71.8229,flydsl_mxpsh_128x128x256_F8_F8_B16_w3_x4_sk1,1648.22,1060.29,0.0
gfx950,256,1152,7168,16384,fp8,fp8,flydsl,23648,1,148.5613,flydsl_mxpsh_128x128x256_F8_F8_B16_w4_x4_sk1,1821.36,1028.73,0.0
gfx950,256,1216,7168,384,fp8,fp8,flydsl,21152,1,11.0565,flydsl_mxpsh_96x128x128_F8_F8_B16_w0_x4_sk1,605.45,1867.86,0.0
gfx950,256,1216,7168,3072,fp8,fp8,flydsl,21344,1,35.4183,flydsl_mxpsh_96x128x128_F8_F8_B16_w3_x4_sk1,1512.01,1219.38,0.0
gfx950,256,1216,7168,7168,fp8,fp8,flydsl,21408,1,79.7449,flydsl_mxpsh_96x128x128_F8_F8_B16_w4_x4_sk1,1566.96,972.21,0.0
gfx950,256,1216,7168,16384,fp8,fp8,flydsl,21344,1,167.5778,flydsl_mxpsh_96x128x128_F8_F8_B16_w3_x4_sk1,1704.37,923.73,0.0
gfx950,256,1280,7168,384,fp8,fp8,flydsl,23072,1,11.6482,flydsl_mxpsh_128x128x128_F8_F8_B16_w0_x4_sk1,604.94,1853.86,0.0
gfx950,256,1280,7168,3072,fp8,fp8,flydsl,23264,1,39.636,flydsl_mxpsh_128x128x128_F8_F8_B16_w3_x4_sk1,1422.23,1117.73,0.0
gfx950,256,1280,7168,7168,fp8,fp8,flydsl,23264,1,87.091,flydsl_mxpsh_128x128x128_F8_F8_B16_w3_x4_sk1,1510.3,906.01,0.0
gfx950,256,1280,7168,16384,fp8,fp8,flydsl,23264,1,187.7056,flydsl_mxpsh_128x128x128_F8_F8_B16_w3_x4_sk1,1601.7,835.15,0.0
gfx950,256,1344,7168,384,fp8,fp8,flydsl,23136,1,11.7288,flydsl_mxpsh_128x128x128_F8_F8_B16_w1_x4_sk1,630.82,1921.44,0.0
gfx950,256,1344,7168,3072,fp8,fp8,flydsl,23072,1,40.4696,flydsl_mxpsh_128x128x128_F8_F8_B16_w0_x4_sk1,1462.58,1122.24,0.0
gfx950,256,1344,7168,7168,fp8,fp8,flydsl,23200,1,87.661,flydsl_mxpsh_128x128x128_F8_F8_B16_w2_x4_sk1,1575.5,915.82,0.0
gfx950,256,1344,7168,16384,fp8,fp8,flydsl,23264,1,189.2416,flydsl_mxpsh_128x128x128_F8_F8_B16_w3_x4_sk1,1668.13,838.76,0.0
gfx950,256,1408,7168,384,fp8,fp8,flydsl,23200,1,11.8456,flydsl_mxpsh_128x128x128_F8_F8_B16_w2_x4_sk1,654.34,1982.02,0.0
gfx950,256,1408,7168,3072,fp8,fp8,flydsl,23264,1,41.0338,flydsl_mxpsh_128x128x128_F8_F8_B16_w3_x4_sk1,1511.16,1133.96,0.0
gfx950,256,1408,7168,7168,fp8,fp8,flydsl,23200,1,88.7863,flydsl_mxpsh_128x128x128_F8_F8_B16_w2_x4_sk1,1629.61,919.71,0.0
gfx950,256,1408,7168,16384,fp8,fp8,flydsl,23264,1,191.9282,flydsl_mxpsh_128x128x128_F8_F8_B16_w3_x4_sk1,1723.11,837.26,0.0
gfx950,256,1472,7168,384,fp8,fp8,flydsl,23040,1,12.412,flydsl_mxpsh_128x128x128_F8_F8_B16_w0_x0_sk1,652.87,1967.48,0.0
gfx950,256,1472,7168,3072,fp8,fp8,flydsl,23072,1,41.3374,flydsl_mxpsh_128x128x128_F8_F8_B16_w0_x4_sk1,1568.24,1152.58,0.0
gfx950,256,1472,7168,7168,fp8,fp8,flydsl,23200,1,88.9259,flydsl_mxpsh_128x128x128_F8_F8_B16_w2_x4_sk1,1701.0,933.74,0.0
gfx950,256,1472,7168,16384,fp8,fp8,flydsl,23264,1,190.502,flydsl_mxpsh_128x128x128_F8_F8_B16_w3_x4_sk1,1814.91,853.85,0.0
gfx950,256,1536,7168,384,fp8,fp8,flydsl,23136,1,12.2517,flydsl_mxpsh_128x128x128_F8_F8_B16_w1_x4_sk1,690.17,2070.12,0.0
gfx950,256,1536,7168,3072,fp8,fp8,flydsl,23264,1,42.6586,flydsl_mxpsh_128x128x128_F8_F8_B16_w3_x4_sk1,1585.75,1143.0,0.0
gfx950,256,1536,7168,7168,fp8,fp8,flydsl,23264,1,90.7571,flydsl_mxpsh_128x128x128_F8_F8_B16_w3_x4_sk1,1739.15,930.07,0.0
gfx950,256,1536,7168,16384,fp8,fp8,flydsl,21920,1,195.0021,flydsl_mxpsh_96x256x128_F8_F8_B16_w2_x4_sk1,1850.12,844.23,0.0
gfx950,256,1600,7168,384,fp8,fp8,flydsl,23200,1,12.5515,flydsl_mxpsh_128x128x128_F8_F8_B16_w2_x4_sk1,701.75,2095.73,0.0
gfx950,256,1600,7168,3072,fp8,fp8,flydsl,23264,1,43.7558,flydsl_mxpsh_128x128x128_F8_F8_B16_w3_x4_sk1,1610.4,1139.8,0.0
gfx950,256,1600,7168,7168,fp8,fp8,flydsl,23200,1,93.6842,flydsl_mxpsh_128x128x128_F8_F8_B16_w2_x4_sk1,1755.01,915.7,0.0
gfx950,256,1600,7168,16384,fp8,fp8,flydsl,23264,1,202.5447,flydsl_mxpsh_128x128x128_F8_F8_B16_w3_x4_sk1,1855.44,822.5,0.0
gfx950,256,1664,7168,384,fp8,fp8,flydsl,23136,1,12.7291,flydsl_mxpsh_128x128x128_F8_F8_B16_w1_x4_sk1,719.64,2140.5,0.0
gfx950,256,1664,7168,3072,fp8,fp8,flydsl,21920,1,44.395,flydsl_mxpsh_96x256x128_F8_F8_B16_w2_x4_sk1,1650.7,1148.49,0.0
gfx950,256,1664,7168,7168,fp8,fp8,flydsl,23264,1,95.4575,flydsl_mxpsh_128x128x128_F8_F8_B16_w3_x4_sk1,1791.3,913.11,0.0
gfx950,256,1664,7168,16384,fp8,fp8,flydsl,23264,1,205.4594,flydsl_mxpsh_128x128x128_F8_F8_B16_w3_x4_sk1,1902.28,820.4,0.0
gfx950,256,1728,7168,384,fp8,fp8,flydsl,21920,1,13.0247,flydsl_mxpsh_96x256x128_F8_F8_B16_w2_x4_sk1,730.36,2164.25,0.0
gfx950,256,1728,7168,3072,fp8,fp8,flydsl,21856,1,46.5967,flydsl_mxpsh_96x256x128_F8_F8_B16_w1_x4_sk1,1633.19,1118.13,0.0
gfx950,256,1728,7168,7168,fp8,fp8,flydsl,21792,1,97.562,flydsl_mxpsh_96x256x128_F8_F8_B16_w0_x4_sk1,1820.07,907.52,0.0
gfx950,256,1728,7168,16384,fp8,fp8,flydsl,21856,1,213.5961,flydsl_mxpsh_96x256x128_F8_F8_B16_w1_x4_sk1,1900.2,798.35,0.0
gfx950,256,1792,7168,384,fp8,fp8,flydsl,21216,1,14.3483,flydsl_mxpsh_96x128x128_F8_F8_B16_w1_x4_sk1,687.54,2030.26,0.0
gfx950,256,1792,7168,3072,fp8,fp8,flydsl,23776,1,50.5987,flydsl_mxpsh_128x256x128_F8_F8_B16_w1_x4_sk1,1559.72,1051.71,0.0
gfx950,256,1792,7168,7168,fp8,fp8,flydsl,23776,1,107.5884,flydsl_mxpsh_128x256x128_F8_F8_B16_w1_x4_sk1,1711.59,835.74,0.0
gfx950,256,1792,7168,16384,fp8,fp8,flydsl,23776,1,230.5021,flydsl_mxpsh_128x256x128_F8_F8_B16_w1_x4_sk1,1826.04,748.33,0.0
gfx950,256,1856,7168,384,fp8,fp8,flydsl,21152,1,14.445,flydsl_mxpsh_96x128x128_F8_F8_B16_w0_x4_sk1,707.33,2081.89,0.0
gfx950,256,1856,7168,3072,fp8,fp8,flydsl,23776,1,52.0627,flydsl_mxpsh_128x256x128_F8_F8_B16_w1_x4_sk1,1570.0,1043.54,0.0
gfx950,256,1856,7168,7168,fp8,fp8,flydsl,23840,1,109.2201,flydsl_mxpsh_128x256x128_F8_F8_B16_w2_x4_sk1,1746.23,835.85,0.0
gfx950,256,1856,7168,16384,fp8,fp8,flydsl,23840,1,241.9143,flydsl_mxpsh_128x256x128_F8_F8_B16_w2_x4_sk1,1802.04,721.15,0.0
gfx950,256,1920,7168,384,fp8,fp8,flydsl,21280,1,14.7497,flydsl_mxpsh_96x128x128_F8_F8_B16_w2_x4_sk1,716.6,2102.75,0.0
gfx950,256,1920,7168,3072,fp8,fp8,flydsl,23776,1,52.7923,flydsl_mxpsh_128x256x128_F8_F8_B16_w1_x4_sk1,1601.7,1050.22,0.0
gfx950,256,1920,7168,7168,fp8,fp8,flydsl,23840,1,111.8801,flydsl_mxpsh_128x256x128_F8_F8_B16_w2_x4_sk1,1763.5,828.28,0.0
gfx950,256,1920,7168,16384,fp8,fp8,flydsl,23840,1,243.1643,flydsl_mxpsh_128x256x128_F8_F8_B16_w2_x4_sk1,1854.6,725.53,0.0
gfx950,256,1984,7168,384,fp8,fp8,flydsl,23072,1,14.7632,flydsl_mxpsh_128x128x128_F8_F8_B16_w0_x4_sk1,739.81,2164.64,0.0
gfx950,256,1984,7168,3072,fp8,fp8,flydsl,23840,1,51.8175,flydsl_mxpsh_128x256x128_F8_F8_B16_w2_x4_sk1,1686.22,1091.48,0.0
gfx950,256,1984,7168,7168,fp8,fp8,flydsl,23840,1,109.3737,flydsl_mxpsh_128x256x128_F8_F8_B16_w2_x4_sk1,1864.04,859.84,0.0
gfx950,256,1984,7168,16384,fp8,fp8,flydsl,23712,1,232.6029,flydsl_mxpsh_128x256x128_F8_F8_B16_w0_x4_sk1,2003.43,766.93,0.0
gfx950,256,2048,7168,384,fp8,fp8,flydsl,23136,1,14.8755,flydsl_mxpsh_128x128x128_F8_F8_B16_w1_x4_sk1,757.91,2211.63,0.0
gfx950,256,2048,7168,3072,fp8,fp8,flydsl,23776,1,51.6184,flydsl_mxpsh_128x256x128_F8_F8_B16_w1_x4_sk1,1747.33,1117.27,0.0
gfx950,256,2048,7168,7168,fp8,fp8,flydsl,23712,1,109.4454,flydsl_mxpsh_128x256x128_F8_F8_B16_w0_x4_sk1,1922.91,871.85,0.0
gfx950,256,2048,7168,16384,fp8,fp8,flydsl,23712,1,234.3367,flydsl_mxpsh_128x256x128_F8_F8_B16_w0_x4_sk1,2052.76,769.64,0.0
gfx950,256,4096,7168,384,fp8,fp8,flydsl,19872,1,23.615,flydsl_mxpsh_64x256x128_F8_F8_B16_w0_x4_sk1,954.84,2669.73,0.0
gfx950,256,4096,7168,3072,fp8,fp8,flydsl,23712,1,94.5688,flydsl_mxpsh_128x256x128_F8_F8_B16_w0_x4_sk1,1907.49,986.83,0.0
gfx950,256,4096,7168,7168,fp8,fp8,flydsl,23712,1,190.0108,flydsl_mxpsh_128x256x128_F8_F8_B16_w0_x4_sk1,2215.17,733.96,0.0
gfx950,256,4096,7168,16384,fp8,fp8,flydsl,23712,1,421.1651,flydsl_mxpsh_128x256x128_F8_F8_B16_w0_x4_sk1,2284.31,577.61,0.0
gfx950,256,6144,7168,384,fp8,fp8,flydsl,21856,1,31.9392,flydsl_mxpsh_96x256x128_F8_F8_B16_w1_x4_sk1,1058.98,2917.8,0.0
gfx950,256,6144,7168,3072,fp8,fp8,flydsl,23776,1,133.7753,flydsl_mxpsh_128x256x128_F8_F8_B16_w1_x4_sk1,2022.67,964.12,0.0
gfx950,256,6144,7168,7168,fp8,fp8,flydsl,23712,1,275.2805,flydsl_mxpsh_128x256x128_F8_F8_B16_w0_x4_sk1,2293.52,666.6,0.0
gfx950,256,6144,7168,16384,fp8,fp8,flydsl,23808,1,621.2381,flydsl_mxpsh_128x256x128_F8_F8_B16_w2_x0_sk1,2322.96,492.86,0.0
gfx950,256,8192,7168,384,fp8,fp8,flydsl,21792,1,42.307,flydsl_mxpsh_96x256x128_F8_F8_B16_w0_x4_sk1,1065.95,2915.33,0.0
gfx950,256,8192,7168,3072,fp8,fp8,flydsl,23840,1,163.7965,flydsl_mxpsh_128x256x128_F8_F8_B16_w2_x4_sk1,2202.59,1005.07,0.0
gfx950,256,8192,7168,7168,fp8,fp8,flydsl,23776,1,339.7212,flydsl_mxpsh_128x256x128_F8_F8_B16_w1_x4_sk1,2477.95,669.79,0.0
gfx950,256,8192,7168,16384,fp8,fp8,flydsl,23744,1,757.9995,flydsl_mxpsh_128x256x128_F8_F8_B16_w1_x0_sk1,2538.45,486.94,0.0
gfx950,256,10240,7168,384,fp8,fp8,flydsl,21856,1,53.91,flydsl_mxpsh_96x256x128_F8_F8_B16_w1_x4_sk1,1045.66,2847.07,0.0
gfx950,256,10240,7168,3072,fp8,fp8,flydsl,23776,1,201.5924,flydsl_mxpsh_128x256x128_F8_F8_B16_w1_x4_sk1,2237.05,993.48,0.0
gfx950,256,10240,7168,7168,fp8,fp8,flydsl,23840,1,426.1941,flydsl_mxpsh_128x256x128_F8_F8_B16_w2_x4_sk1,2468.99,637.22,0.0
gfx950,256,10240,7168,16384,fp8,fp8,flydsl,23680,1,970.6455,flydsl_mxpsh_128x256x128_F8_F8_B16_w0_x0_sk1,2477.92,445.08,0.0
gfx950,256,12288,7168,384,fp8,fp8,flydsl,21856,1,59.9641,flydsl_mxpsh_96x256x128_F8_F8_B16_w1_x4_sk1,1128.1,3062.36,0.0
gfx950,256,12288,7168,3072,fp8,fp8,flydsl,23712,1,239.2696,flydsl_mxpsh_128x256x128_F8_F8_B16_w0_x4_sk1,2261.74,986.04,0.0
gfx950,256,12288,7168,7168,fp8,fp8,flydsl,23776,1,508.8737,flydsl_mxpsh_128x256x128_F8_F8_B16_w1_x4_sk1,2481.4,620.24,0.0
gfx950,256,12288,7168,16384,fp8,fp8,flydsl,23680,1,1202.3432,flydsl_mxpsh_128x256x128_F8_F8_B16_w0_x0_sk1,2400.49,411.64,0.0
gfx950,256,14336,7168,384,fp8,fp8,flydsl,21792,1,71.425,flydsl_mxpsh_96x256x128_F8_F8_B16_w0_x4_sk1,1104.94,2993.05,0.0
gfx950,256,14336,7168,3072,fp8,fp8,flydsl,23840,1,276.405,flydsl_mxpsh_128x256x128_F8_F8_B16_w2_x4_sk1,2284.19,982.55,0.0
gfx950,256,14336,7168,7168,fp8,fp8,flydsl,23776,1,595.1261,flydsl_mxpsh_128x256x128_F8_F8_B16_w1_x4_sk1,2475.4,604.35,0.0
gfx950,256,14336,7168,16384,fp8,fp8,flydsl,23744,1,1440.2614,flydsl_mxpsh_128x256x128_F8_F8_B16_w1_x0_sk1,2337.95,387.32,0.0
gfx950,256,16384,7168,384,fp8,fp8,flydsl,21920,1,80.5891,flydsl_mxpsh_96x256x128_F8_F8_B16_w2_x4_sk1,1119.19,3026.77,0.0
gfx950,256,16384,7168,3072,fp8,fp8,flydsl,23840,1,308.7813,flydsl_mxpsh_128x256x128_F8_F8_B16_w2_x4_sk1,2336.78,994.99,0.0
gfx950,256,16384,7168,7168,fp8,fp8,flydsl,23712,1,672.3253,flydsl_mxpsh_128x256x128_F8_F8_B16_w0_x4_sk1,2504.19,600.46,0.0
gfx950,256,16384,7168,16384,fp8,fp8,flydsl,23744,1,1663.0271,flydsl_mxpsh_128x256x128_F8_F8_B16_w1_x0_sk1,2314.03,373.27,0.0
gfx950,256,20480,7168,3072,fp8,fp8,flydsl,23840,1,387.2059,flydsl_mxpsh_128x256x128_F8_F8_B16_w2_x4_sk1,2329.36,977.61,0.0
gfx950,256,20480,7168,7168,fp8,fp8,flydsl,23712,1,859.522,flydsl_mxpsh_128x256x128_F8_F8_B16_w0_x4_sk1,2448.49,572.16,0.0
gfx950,256,20480,7168,16384,fp8,fp8,flydsl,23776,1,2180.5236,flydsl_mxpsh_128x256x128_F8_F8_B16_w1_x4_sk1,2206.06,342.39,0.0
gfx950,256,24576,7168,3072,fp8,fp8,flydsl,23712,1,459.3183,flydsl_mxpsh_128x256x128_F8_F8_B16_w0_x4_sk1,2356.39,979.36,0.0
gfx950,256,24576,7168,7168,fp8,fp8,flydsl,23712,1,1055.8145,flydsl_mxpsh_128x256x128_F8_F8_B16_w0_x4_sk1,2391.94,549.21,0.0
gfx950,256,24576,7168,16384,fp8,fp8,flydsl,23712,1,2562.1495,flydsl_mxpsh_128x256x128_F8_F8_B16_w0_x4_sk1,2252.97,340.5,0.0
gfx950,256,28672,7168,3072,fp8,fp8,flydsl,23840,1,531.1944,flydsl_mxpsh_128x256x128_F8_F8_B16_w2_x4_sk1,2377.13,981.08,0.0
gfx950,256,28672,7168,7168,fp8,fp8,flydsl,23744,1,1233.5766,flydsl_mxpsh_128x256x128_F8_F8_B16_w1_x0_sk1,2388.46,541.47,0.0
gfx950,256,28672,7168,16384,fp8,fp8,flydsl,23840,1,3084.2216,flydsl_mxpsh_128x256x128_F8_F8_B16_w2_x4_sk1,2183.54,323.66,0.0
gfx950,256,32768,7168,384,fp8,fp8,flydsl,21920,1,154.5647,flydsl_mxpsh_96x256x128_F8_F8_B16_w2_x4_sk1,1167.08,3138.48,0.0
gfx950,256,32768,7168,3072,fp8,fp8,flydsl,23712,1,601.9721,flydsl_mxpsh_128x256x128_F8_F8_B16_w0_x4_sk1,2397.3,984.17,0.0
gfx950,256,32768,7168,7168,fp8,fp8,flydsl,23840,1,1456.5849,flydsl_mxpsh_128x256x128_F8_F8_B16_w2_x4_sk1,2311.75,519.04,0.0
gfx950,256,32768,7168,16384,fp8,fp8,flydsl,23840,1,3426.1287,flydsl_mxpsh_128x256x128_F8_F8_B16_w2_x4_sk1,2246.44,328.09,0.0
gfx950,256,40960,7168,3072,fp8,fp8,flydsl,23776,1,762.7089,flydsl_mxpsh_128x256x128_F8_F8_B16_w1_x4_sk1,2365.1,963.74,0.0
gfx950,256,40960,7168,7168,fp8,fp8,flydsl,23712,1,1839.1813,flydsl_mxpsh_128x256x128_F8_F8_B16_w0_x4_sk1,2288.56,506.85,0.0
gfx950,256,40960,7168,16384,fp8,fp8,flydsl,23712,1,4334.7016,flydsl_mxpsh_128x256x128_F8_F8_B16_w0_x4_sk1,2219.47,317.38,0.0
gfx950,256,49152,7168,3072,fp8,fp8,flydsl,23776,1,940.8663,flydsl_mxpsh_128x256x128_F8_F8_B16_w1_x4_sk1,2300.71,932.82,0.0
gfx950,256,49152,7168,7168,fp8,fp8,flydsl,23840,1,2212.2613,flydsl_mxpsh_128x256x128_F8_F8_B16_w2_x4_sk1,2283.13,501.0,0.0
gfx950,256,49152,7168,16384,fp8,fp8,flydsl,23712,1,5113.5878,flydsl_mxpsh_128x256x128_F8_F8_B16_w0_x4_sk1,2257.69,318.25,0.0
gfx950,256,57344,7168,3072,fp8,fp8,flydsl,23744,1,1111.1403,flydsl_mxpsh_128x256x128_F8_F8_B16_w1_x0_sk1,2272.84,918.21,0.0
gfx950,256,57344,7168,7168,fp8,fp8,flydsl,23840,1,2600.5804,flydsl_mxpsh_128x256x128_F8_F8_B16_w2_x4_sk1,2265.92,493.93,0.0
gfx950,256,57344,7168,16384,fp8,fp8,flydsl,23712,1,5973.4994,flydsl_mxpsh_128x256x128_F8_F8_B16_w0_x4_sk1,2254.8,314.56,0.0
gfx950,256,65536,7168,3072,fp8,fp8,flydsl,23712,1,1293.5443,flydsl_mxpsh_128x256x128_F8_F8_B16_w0_x4_sk1,2231.25,898.98,0.0
gfx950,256,65536,7168,7168,fp8,fp8,flydsl,23840,1,2967.8298,flydsl_mxpsh_128x256x128_F8_F8_B16_w2_x4_sk1,2269.17,492.17,0.0
gfx950,256,65536,7168,16384,fp8,fp8,flydsl,23840,1,6819.5653,flydsl_mxpsh_128x256x128_F8_F8_B16_w2_x4_sk1,2257.21,312.44,0.0
gfx950,256,1,16384,1536,fp8,fp8,flydsl,17669,6,9.5363,flydsl_mxpsh_32x128x256_F8_F8_B16_w1_x0_sk6,5.28,2642.55,0.0
gfx950,256,4,16384,1536,fp8,fp8,flydsl,17442,3,9.6716,flydsl_mxpsh_32x128x128_F8_F8_B16_w2_x4_sk3,20.82,2616.22,0.0
gfx950,256,8,16384,1536,fp8,fp8,flydsl,17888,1,9.7823,flydsl_mxpsh_32x128x256_F8_F8_B16_w4_x4_sk1,41.16,2600.64,0.0
gfx950,256,16,16384,1536,fp8,fp8,flydsl,17888,1,9.9217,flydsl_mxpsh_32x128x256_F8_F8_B16_w4_x4_sk1,81.17,2591.76,0.0
gfx950,256,1,65536,1536,fp8,fp8,flydsl,17728,1,19.0912,flydsl_mxpsh_32x128x256_F8_F8_B16_w2_x0_sk1,10.55,5279.7,0.0
gfx950,256,2,65536,1536,fp8,fp8,flydsl,17792,1,19.1449,flydsl_mxpsh_32x128x256_F8_F8_B16_w3_x0_sk1,21.03,5271.82,0.0
gfx950,256,4,65536,1536,fp8,fp8,flydsl,17600,1,19.3385,flydsl_mxpsh_32x128x256_F8_F8_B16_w0_x0_sk1,41.64,5232.76,0.0
gfx950,256,8,65536,1536,fp8,fp8,flydsl,17600,1,19.5251,flydsl_mxpsh_32x128x256_F8_F8_B16_w0_x0_sk1,82.49,5209.92,0.0
gfx950,256,16,65536,1536,fp8,fp8,flydsl,17600,1,19.9699,flydsl_mxpsh_32x128x256_F8_F8_B16_w0_x0_sk1,161.3,5147.0,0.0
gfx950,256,32,65536,1536,fp8,fp8,flydsl,17664,1,20.7766,flydsl_mxpsh_32x128x256_F8_F8_B16_w1_x0_sk1,310.08,5049.27,0.0
gfx950,256,48,65536,1536,fp8,fp8,flydsl,21408,1,22.694,flydsl_mxpsh_96x128x128_F8_F8_B16_w4_x4_sk1,425.83,4716.16,0.0
gfx950,256,64,65536,1536,fp8,fp8,flydsl,21280,1,23.1925,flydsl_mxpsh_96x128x128_F8_F8_B16_w2_x4_sk1,555.56,4706.27,0.0
gfx950,256,80,65536,1536,fp8,fp8,flydsl,21312,1,24.7919,flydsl_mxpsh_96x128x128_F8_F8_B16_w3_x0_sk1,649.65,4488.24,0.0
gfx950,256,96,65536,1536,fp8,fp8,flydsl,21280,1,25.4485,flydsl_mxpsh_96x128x128_F8_F8_B16_w2_x4_sk1,759.47,4455.81,0.0
gfx950,256,112,65536,1536,fp8,fp8,flydsl,23552,1,26.8547,flydsl_mxpsh_128x128x256_F8_F8_B16_w3_x0_sk1,839.65,4301.5,0.0
gfx950,256,128,65536,1536,fp8,fp8,flydsl,23552,1,27.1003,flydsl_mxpsh_128x128x256_F8_F8_B16_w3_x0_sk1,950.9,4340.81,0.0
gfx950,256,144,65536,1536,fp8,fp8,flydsl,21792,1,31.7206,flydsl_mxpsh_96x256x128_F8_F8_B16_w0_x4_sk1,913.95,3775.43,0.0
gfx950,256,160,65536,1536,fp8,fp8,flydsl,21792,1,32.6663,flydsl_mxpsh_96x256x128_F8_F8_B16_w0_x4_sk1,986.1,3731.08,0.0
gfx950,256,176,65536,1536,fp8,fp8,flydsl,21920,1,33.1554,flydsl_mxpsh_96x256x128_F8_F8_B16_w2_x4_sk1,1068.71,3740.03,0.0
gfx950,256,192,65536,1536,fp8,fp8,flydsl,21792,1,34.4313,flydsl_mxpsh_96x256x128_F8_F8_B16_w0_x4_sk1,1122.66,3663.06,0.0
gfx950,256,208,65536,1536,fp8,fp8,flydsl,23840,1,36.0703,flydsl_mxpsh_128x256x128_F8_F8_B16_w2_x4_sk1,1160.95,3555.44,0.0
gfx950,256,224,65536,1536,fp8,fp8,flydsl,23712,1,36.7582,flydsl_mxpsh_128x256x128_F8_F8_B16_w0_x4_sk1,1226.86,3546.62,0.0
gfx950,256,240,65536,1536,fp8,fp8,flydsl,23712,1,38.1053,flydsl_mxpsh_128x256x128_F8_F8_B16_w0_x4_sk1,1268.02,3476.92,0.0
gfx950,256,256,65536,1536,fp8,fp8,flydsl,23776,1,38.2228,flydsl_mxpsh_128x256x128_F8_F8_B16_w1_x4_sk1,1348.4,3521.74,0.0
gfx950,256,288,65536,1536,fp8,fp8,flydsl,21152,1,49.8651,flydsl_mxpsh_96x128x128_F8_F8_B16_w0_x4_sk1,1162.78,2784.6,0.0
gfx950,256,320,65536,1536,fp8,fp8,flydsl,21792,1,54.8177,flydsl_mxpsh_96x256x128_F8_F8_B16_w0_x4_sk1,1175.25,2610.43,0.0
gfx950,256,352,65536,1536,fp8,fp8,flydsl,23712,1,56.4716,flydsl_mxpsh_128x256x128_F8_F8_B16_w0_x4_sk1,1254.91,2609.12,0.0
gfx950,256,384,65536,1536,fp8,fp8,flydsl,23840,1,57.7636,flydsl_mxpsh_128x256x128_F8_F8_B16_w2_x4_sk1,1338.38,2624.23,0.0
gfx950,256,416,65536,1536,fp8,fp8,flydsl,23776,1,64.1272,flydsl_mxpsh_128x256x128_F8_F8_B16_w1_x4_sk1,1306.03,2429.99,0.0
gfx950,256,448,65536,1536,fp8,fp8,flydsl,23712,1,67.4554,flydsl_mxpsh_128x256x128_F8_F8_B16_w0_x4_sk1,1337.1,2373.0,0.0
gfx950,256,480,65536,1536,fp8,fp8,flydsl,23840,1,68.6576,flydsl_mxpsh_128x256x128_F8_F8_B16_w2_x4_sk1,1407.52,2393.25,0.0
gfx950,256,512,65536,1536,fp8,fp8,flydsl,23840,1,70.4477,flydsl_mxpsh_128x256x128_F8_F8_B16_w2_x4_sk1,1463.2,2392.68,0.0
gfx950,256,544,65536,1536,fp8,fp8,flydsl,21792,1,82.1074,flydsl_mxpsh_96x256x128_F8_F8_B16_w0_x4_sk1,1333.88,2104.59,0.0
gfx950,256,576,65536,1536,fp8,fp8,flydsl,23840,1,84.3278,flydsl_mxpsh_128x256x128_F8_F8_B16_w2_x4_sk1,1375.16,2099.49,0.0
gfx950,256,608,65536,1536,fp8,fp8,flydsl,23776,1,86.0966,flydsl_mxpsh_128x256x128_F8_F8_B16_w1_x4_sk1,1421.74,2105.65,0.0
gfx950,256,640,65536,1536,fp8,fp8,flydsl,23712,1,88.2031,flydsl_mxpsh_128x256x128_F8_F8_B16_w0_x4_sk1,1460.82,2103.47,0.0
gfx950,256,672,65536,1536,fp8,fp8,flydsl,23840,1,94.6471,flydsl_mxpsh_128x256x128_F8_F8_B16_w2_x4_sk1,1429.43,2005.09,0.0
gfx950,256,704,65536,1536,fp8,fp8,flydsl,23712,1,97.1787,flydsl_mxpsh_128x256x128_F8_F8_B16_w0_x4_sk1,1458.49,1996.52,0.0
gfx950,256,736,65536,1536,fp8,fp8,flydsl,23776,1,97.4819,flydsl_mxpsh_128x256x128_F8_F8_B16_w1_x4_sk1,1520.04,2033.84,0.0
gfx950,256,768,65536,1536,fp8,fp8,flydsl,23712,1,99.3914,flydsl_mxpsh_128x256x128_F8_F8_B16_w0_x4_sk1,1555.66,2037.46,0.0
gfx950,256,800,65536,1536,fp8,fp8,flydsl,23776,1,109.1127,flydsl_mxpsh_128x256x128_F8_F8_B16_w1_x4_sk1,1476.1,1894.83,0.0
gfx950,256,832,65536,1536,fp8,fp8,flydsl,23712,1,109.9816,flydsl_mxpsh_128x256x128_F8_F8_B16_w0_x4_sk1,1523.02,1918.44,0.0
gfx950,256,864,65536,1536,fp8,fp8,flydsl,23776,1,111.4928,flydsl_mxpsh_128x256x128_F8_F8_B16_w1_x4_sk1,1560.16,1930.5,0.0
gfx950,256,896,65536,1536,fp8,fp8,flydsl,23840,1,112.7346,flydsl_mxpsh_128x256x128_F8_F8_B16_w2_x4_sk1,1600.12,1946.87,0.0
gfx950,256,928,65536,1536,fp8,fp8,flydsl,21920,1,125.8757,flydsl_mxpsh_96x256x128_F8_F8_B16_w2_x4_sk1,1484.25,1777.34,0.0
gfx950,256,960,65536,1536,fp8,fp8,flydsl,21792,1,127.9354,flydsl_mxpsh_96x256x128_F8_F8_B16_w0_x4_sk1,1510.71,1781.89,0.0
gfx950,256,992,65536,1536,fp8,fp8,flydsl,21920,1,133.6773,flydsl_mxpsh_96x256x128_F8_F8_B16_w2_x4_sk1,1494.02,1737.1,0.0
gfx950,256,1024,65536,1536,fp8,fp8,flydsl,21920,1,136.5475,flydsl_mxpsh_96x256x128_F8_F8_B16_w2_x4_sk1,1509.79,1731.66,0.0
gfx950,256,1088,65536,1536,fp8,fp8,flydsl,23840,1,142.6267,flydsl_mxpsh_128x256x128_F8_F8_B16_w2_x4_sk1,1535.78,1717.36,0.0
gfx950,256,1152,65536,1536,fp8,fp8,flydsl,23776,1,144.8979,flydsl_mxpsh_128x256x128_F8_F8_B16_w1_x4_sk1,1600.63,1749.01,0.0
gfx950,256,1216,65536,1536,fp8,fp8,flydsl,23776,1,150.4527,flydsl_mxpsh_128x256x128_F8_F8_B16_w1_x4_sk1,1627.18,1740.84,0.0
gfx950,256,1280,65536,1536,fp8,fp8,flydsl,23776,1,153.4459,flydsl_mxpsh_128x256x128_F8_F8_B16_w1_x4_sk1,1679.41,1762.19,0.0
gfx950,256,1344,65536,1536,fp8,fp8,flydsl,23712,1,162.2677,flydsl_mxpsh_128x256x128_F8_F8_B16_w0_x4_sk1,1667.51,1718.69,0.0
gfx950,256,1408,65536,1536,fp8,fp8,flydsl,23776,1,165.5148,flydsl_mxpsh_128x256x128_F8_F8_B16_w1_x4_sk1,1712.64,1736.25,0.0
gfx950,256,1472,65536,1536,fp8,fp8,flydsl,23840,1,176.4383,flydsl_mxpsh_128x256x128_F8_F8_B16_w2_x4_sk1,1679.64,1676.86,0.0
gfx950,256,1536,65536,1536,fp8,fp8,flydsl,23776,1,176.7759,flydsl_mxpsh_128x256x128_F8_F8_B16_w1_x4_sk1,1749.32,1721.67,0.0
gfx950,256,1600,65536,1536,fp8,fp8,flydsl,23840,1,185.6064,flydsl_mxpsh_128x256x128_F8_F8_B16_w2_x4_sk1,1735.51,1685.48,0.0
gfx950,256,1664,65536,1536,fp8,fp8,flydsl,23776,1,188.6632,flydsl_mxpsh_128x256x128_F8_F8_B16_w1_x4_sk1,1775.69,1703.16,0.0
gfx950,256,1728,65536,1536,fp8,fp8,flydsl,23840,1,196.1137,flydsl_mxpsh_128x256x128_F8_F8_B16_w2_x4_sk1,1773.93,1681.73,0.0
gfx950,256,1792,65536,1536,fp8,fp8,flydsl,23712,1,199.4685,flydsl_mxpsh_128x256x128_F8_F8_B16_w0_x4_sk1,1808.69,1695.99,0.0
gfx950,256,1856,65536,1536,fp8,fp8,flydsl,23776,1,213.4771,flydsl_mxpsh_128x256x128_F8_F8_B16_w1_x4_sk1,1750.36,1624.45,0.0
gfx950,256,1920,65536,1536,fp8,fp8,flydsl,23840,1,217.5963,flydsl_mxpsh_128x256x128_F8_F8_B16_w2_x4_sk1,1776.44,1632.71,0.0
gfx950,256,1984,65536,1536,fp8,fp8,flydsl,23840,1,238.7155,flydsl_mxpsh_128x256x128_F8_F8_B16_w2_x4_sk1,1673.26,1523.81,0.0
gfx950,256,2048,65536,1536,fp8,fp8,flydsl,21856,1,252.0569,flydsl_mxpsh_96x256x128_F8_F8_B16_w1_x4_sk1,1635.81,1476.83,0.0
gfx950,256,4096,65536,1536,fp8,fp8,flydsl,23840,1,447.4046,flydsl_mxpsh_128x256x128_F8_F8_B16_w2_x4_sk1,1843.15,1439.02,0.0
gfx950,256,6144,65536,1536,fp8,fp8,flydsl,23840,1,622.0564,flydsl_mxpsh_128x256x128_F8_F8_B16_w2_x4_sk1,1988.49,1471.58,0.0
gfx950,256,8192,65536,1536,fp8,fp8,flydsl,23776,1,809.2783,flydsl_mxpsh_128x256x128_F8_F8_B16_w1_x4_sk1,2037.95,1466.72,0.0
gfx950,256,10240,65536,1536,fp8,fp8,flydsl,23840,1,997.7502,flydsl_mxpsh_128x256x128_F8_F8_B16_w2_x4_sk1,2066.23,1461.86,0.0
gfx950,256,12288,65536,1536,fp8,fp8,flydsl,23712,1,1180.9144,flydsl_mxpsh_128x256x128_F8_F8_B16_w0_x4_sk1,2094.9,1465.09,0.0
gfx950,256,14336,65536,1536,fp8,fp8,flydsl,23776,1,1370.7681,flydsl_mxpsh_128x256x128_F8_F8_B16_w1_x4_sk1,2105.55,1460.3,0.0
gfx950,256,16384,65536,1536,fp8,fp8,flydsl,23840,1,1584.5185,flydsl_mxpsh_128x256x128_F8_F8_B16_w2_x4_sk1,2081.73,1434.7,0.0
gfx950,256,20480,65536,1536,fp8,fp8,flydsl,23776,1,2037.4784,flydsl_mxpsh_128x256x128_F8_F8_B16_w1_x4_sk1,2023.66,1382.33,0.0
gfx950,256,24576,65536,1536,fp8,fp8,flydsl,23776,1,2468.1144,flydsl_mxpsh_128x256x128_F8_F8_B16_w1_x4_sk1,2004.69,1361.22,0.0
gfx950,256,28672,65536,1536,fp8,fp8,flydsl,23840,1,2899.8118,flydsl_mxpsh_128x256x128_F8_F8_B16_w2_x4_sk1,1990.62,1345.88,0.0
gfx950,256,32768,65536,1536,fp8,fp8,flydsl,23840,1,3315.8053,flydsl_mxpsh_128x256x128_F8_F8_B16_w2_x4_sk1,1989.58,1340.84,0.0
gfx950,256,40960,65536,1536,fp8,fp8,flydsl,23712,1,4097.6749,flydsl_mxpsh_128x256x128_F8_F8_B16_w0_x4_sk1,2012.44,1350.1,0.0
gfx950,256,49152,65536,1536,fp8,fp8,flydsl,23776,1,4884.0149,flydsl_mxpsh_128x256x128_F8_F8_B16_w1_x4_sk1,2026.12,1355.16,0.0
gfx950,256,57344,65536,1536,fp8,fp8,flydsl,23808,1,5573.4988,flydsl_mxpsh_128x256x128_F8_F8_B16_w2_x0_sk1,2071.39,1382.42,0.0
gfx950,256,65536,65536,1536,fp8,fp8,flydsl,23776,1,6528.7206,flydsl_mxpsh_128x256x128_F8_F8_B16_w1_x4_sk1,2020.94,1346.55,0.0
