aiter/configs/mxscale_preshuffle_tuned_gemm.csv
gfx,cu_num,M,N,K,a_dtype,b_dtype,libtype,kernelId,splitK,us,kernelName,tflops,bw,errRatio
gfx950,256,1,768,7168,fp8,fp8,flydsl,35835,28,6.4184,flydsl_mxpsh_32x32x256_F8_F8_B16_w4_x4_sk28,1.72,859.05,0.0
gfx950,256,2,768,7168,fp8,fp8,flydsl,35565,14,6.6195,flydsl_mxpsh_32x32x256_F8_F8_B16_w0_x4_sk14,3.33,834.27,0.0
gfx950,256,4,768,7168,fp8,fp8,flydsl,35547,28,7.3658,flydsl_mxpsh_32x32x256_F8_F8_B16_w0_x0_sk28,5.98,752.1,0.0
gfx950,256,8,768,7168,fp8,fp8,flydsl,35565,14,7.3576,flydsl_mxpsh_32x32x256_F8_F8_B16_w0_x4_sk14,11.97,757.67,0.0
gfx950,256,16,768,7168,fp8,fp8,flydsl,35629,14,7.3729,flydsl_mxpsh_32x32x256_F8_F8_B16_w1_x4_sk14,23.89,765.55,0.0
gfx950,256,32,768,7168,fp8,fp8,flydsl,35693,14,7.4581,flydsl_mxpsh_32x32x256_F8_F8_B16_w2_x4_sk14,47.24,775.47,0.0
gfx950,256,48,768,7168,fp8,fp8,flydsl,35629,14,8.2873,flydsl_mxpsh_32x32x256_F8_F8_B16_w1_x4_sk14,63.77,714.69,0.0
gfx950,256,64,768,7168,fp8,fp8,flydsl,35629,14,8.4372,flydsl_mxpsh_32x32x256_F8_F8_B16_w1_x4_sk14,83.52,718.49,0.0
gfx950,256,80,768,7168,fp8,fp8,flydsl,35750,7,8.8017,flydsl_mxpsh_32x32x256_F8_F8_B16_w3_x4_sk7,100.07,704.56,0.0
gfx950,256,96,768,7168,fp8,fp8,flydsl,35622,7,8.9576,flydsl_mxpsh_32x32x256_F8_F8_B16_w1_x4_sk7,118.0,707.85,0.0
gfx950,256,112,768,7168,fp8,fp8,flydsl,39462,7,9.5225,flydsl_mxpsh_64x32x256_F8_F8_B16_w1_x4_sk7,129.5,680.48,0.0
gfx950,256,128,768,7168,fp8,fp8,flydsl,39526,7,10.0456,flydsl_mxpsh_64x32x256_F8_F8_B16_w2_x4_sk7,140.29,658.91,0.0
gfx950,256,144,768,7168,fp8,fp8,flydsl,39462,7,10.5286,flydsl_mxpsh_64x32x256_F8_F8_B16_w1_x4_sk7,150.58,641.91,0.0
gfx950,256,160,768,7168,fp8,fp8,flydsl,39462,7,9.7556,flydsl_mxpsh_64x32x256_F8_F8_B16_w1_x4_sk7,180.57,707.05,0.0
gfx950,256,176,768,7168,fp8,fp8,flydsl,39590,7,10.8869,flydsl_mxpsh_64x32x256_F8_F8_B16_w3_x4_sk7,177.99,646.37,0.0
gfx950,256,192,768,7168,fp8,fp8,flydsl,39398,7,11.4272,flydsl_mxpsh_64x32x256_F8_F8_B16_w0_x4_sk7,184.99,627.99,0.0
gfx950,256,208,768,7168,fp8,fp8,flydsl,44038,7,12.1401,flydsl_mxpsh_96x64x256_F8_F8_B16_w3_x0_sk7,188.64,602.59,0.0
gfx950,256,224,768,7168,fp8,fp8,flydsl,40291,4,12.2356,flydsl_mxpsh_64x64x256_F8_F8_B16_w4_x4_sk4,201.56,609.26,0.0
gfx950,256,240,768,7168,fp8,fp8,flydsl,35683,4,12.15,flydsl_mxpsh_32x32x256_F8_F8_B16_w2_x4_sk4,217.48,625.02,0.0
gfx950,256,256,768,7168,fp8,fp8,flydsl,36454,7,12.3936,flydsl_mxpsh_32x64x256_F8_F8_B16_w4_x4_sk7,227.42,623.97,0.0
gfx950,256,288,768,7168,fp8,fp8,flydsl,40166,7,12.5332,flydsl_mxpsh_64x64x256_F8_F8_B16_w2_x4_sk7,253.0,639.24,0.0
gfx950,256,320,768,7168,fp8,fp8,flydsl,40166,7,13.1035,flydsl_mxpsh_64x64x256_F8_F8_B16_w2_x4_sk7,268.88,632.68,0.0
gfx950,256,352,768,7168,fp8,fp8,flydsl,40166,7,13.2802,flydsl_mxpsh_64x64x256_F8_F8_B16_w2_x4_sk7,291.83,645.23,0.0
gfx950,256,384,768,7168,fp8,fp8,flydsl,40166,7,13.5026,flydsl_mxpsh_64x64x256_F8_F8_B16_w2_x4_sk7,313.11,655.23,0.0
gfx950,256,416,768,7168,fp8,fp8,flydsl,44134,7,14.5722,flydsl_mxpsh_96x64x256_F8_F8_B16_w4_x4_sk7,314.31,626.25,0.0
gfx950,256,448,768,7168,fp8,fp8,flydsl,44003,4,14.6949,flydsl_mxpsh_96x64x256_F8_F8_B16_w2_x4_sk4,335.66,639.98,0.0
gfx950,256,480,768,7168,fp8,fp8,flydsl,40227,4,14.4657,flydsl_mxpsh_64x64x256_F8_F8_B16_w3_x4_sk4,365.33,669.37,0.0
gfx950,256,512,768,7168,fp8,fp8,flydsl,44070,7,14.7112,flydsl_mxpsh_96x64x256_F8_F8_B16_w3_x4_sk7,383.19,677.14,0.0
gfx950,256,544,768,7168,fp8,fp8,flydsl,44070,7,15.2533,flydsl_mxpsh_96x64x256_F8_F8_B16_w3_x4_sk7,392.67,671.33,0.0
gfx950,256,576,768,7168,fp8,fp8,flydsl,44070,7,15.5623,flydsl_mxpsh_96x64x256_F8_F8_B16_w3_x4_sk7,407.51,675.9,0.0
gfx950,256,608,768,7168,fp8,fp8,flydsl,40291,4,14.5824,flydsl_mxpsh_64x64x256_F8_F8_B16_w4_x4_sk4,459.05,740.42,0.0
gfx950,256,640,768,7168,fp8,fp8,flydsl,40099,4,14.9463,flydsl_mxpsh_64x64x256_F8_F8_B16_w1_x4_sk4,471.45,741.03,0.0
gfx950,256,672,768,7168,fp8,fp8,flydsl,36835,4,17.0386,flydsl_mxpsh_32x128x256_F8_F8_B16_w0_x4_sk4,434.23,666.38,0.0
gfx950,256,704,768,7168,fp8,fp8,flydsl,44131,4,16.2684,flydsl_mxpsh_96x64x256_F8_F8_B16_w4_x4_sk4,476.45,715.05,0.0
gfx950,256,736,768,7168,fp8,fp8,flydsl,40163,4,16.6979,flydsl_mxpsh_64x64x256_F8_F8_B16_w2_x4_sk4,485.29,713.33,0.0
gfx950,256,768,768,7168,fp8,fp8,flydsl,44131,4,16.4971,flydsl_mxpsh_96x64x256_F8_F8_B16_w4_x4_sk4,512.56,738.9,0.0
gfx950,256,800,768,7168,fp8,fp8,flydsl,44771,4,17.8329,flydsl_mxpsh_96x128x256_F8_F8_B16_w4_x4_sk4,493.92,699.17,0.0
gfx950,256,832,768,7168,fp8,fp8,flydsl,44515,4,18.4521,flydsl_mxpsh_96x128x256_F8_F8_B16_w0_x4_sk4,496.44,690.8,0.0
gfx950,256,864,768,7168,fp8,fp8,flydsl,40291,4,17.8835,flydsl_mxpsh_64x64x256_F8_F8_B16_w4_x4_sk4,531.93,728.34,0.0
gfx950,256,896,768,7168,fp8,fp8,flydsl,44003,4,17.0863,flydsl_mxpsh_96x64x256_F8_F8_B16_w2_x4_sk4,577.36,778.62,0.0
gfx950,256,928,768,7168,fp8,fp8,flydsl,43939,4,17.3888,flydsl_mxpsh_96x64x256_F8_F8_B16_w1_x4_sk4,587.58,781.1,0.0
gfx950,256,960,768,7168,fp8,fp8,flydsl,44003,4,17.4901,flydsl_mxpsh_96x64x256_F8_F8_B16_w2_x4_sk4,604.32,792.5,0.0
gfx950,256,992,768,7168,fp8,fp8,flydsl,40099,4,18.9326,flydsl_mxpsh_64x64x256_F8_F8_B16_w1_x4_sk4,576.89,746.83,0.0
gfx950,256,1024,768,7168,fp8,fp8,flydsl,40163,4,19.2754,flydsl_mxpsh_64x64x256_F8_F8_B16_w2_x4_sk4,584.91,748.0,0.0
gfx950,256,1088,768,7168,fp8,fp8,flydsl,43939,4,19.8536,flydsl_mxpsh_96x64x256_F8_F8_B16_w1_x4_sk4,603.36,754.27,0.0
gfx950,256,1152,768,7168,fp8,fp8,flydsl,43939,4,19.9363,flydsl_mxpsh_96x64x256_F8_F8_B16_w1_x4_sk4,636.21,779.08,0.0
gfx950,256,1216,768,7168,fp8,fp8,flydsl,47843,4,20.2874,flydsl_mxpsh_128x64x256_F8_F8_B16_w2_x4_sk4,659.93,793.06,0.0
gfx950,256,1280,768,7168,fp8,fp8,flydsl,40835,4,20.7269,flydsl_mxpsh_64x128x256_F8_F8_B16_w3_x0_sk4,679.93,803.12,0.0
gfx950,256,1344,768,7168,fp8,fp8,flydsl,43875,4,22.7634,flydsl_mxpsh_96x64x256_F8_F8_B16_w0_x4_sk4,650.06,755.74,0.0
gfx950,256,1408,768,7168,fp8,fp8,flydsl,44129,2,24.8882,flydsl_mxpsh_96x64x256_F8_F8_B16_w4_x4_sk2,622.87,713.6,0.0
gfx950,256,1472,768,7168,fp8,fp8,flydsl,44065,2,23.441,flydsl_mxpsh_96x64x256_F8_F8_B16_w3_x4_sk2,691.39,781.42,0.0
gfx950,256,1536,768,7168,fp8,fp8,flydsl,44483,4,24.1252,flydsl_mxpsh_96x128x256_F8_F8_B16_w0_x0_sk4,700.99,782.35,0.0
gfx950,256,1600,768,7168,fp8,fp8,flydsl,44451,4,25.7957,flydsl_mxpsh_96x128x128_F8_F8_B16_w4_x4_sk4,682.91,753.28,0.0
gfx950,256,1664,768,7168,fp8,fp8,flydsl,43873,2,24.9326,flydsl_mxpsh_96x64x256_F8_F8_B16_w0_x4_sk2,734.81,801.7,0.0
gfx950,256,1728,768,7168,fp8,fp8,flydsl,43873,2,25.2138,flydsl_mxpsh_96x64x256_F8_F8_B16_w0_x4_sk2,754.56,814.85,0.0
gfx950,256,1792,768,7168,fp8,fp8,flydsl,44451,4,25.9577,flydsl_mxpsh_96x128x128_F8_F8_B16_w4_x4_sk4,760.08,812.96,0.0
gfx950,256,1856,768,7168,fp8,fp8,flydsl,43873,2,25.4783,flydsl_mxpsh_96x64x256_F8_F8_B16_w0_x4_sk2,802.04,850.12,0.0
gfx950,256,1920,768,7168,fp8,fp8,flydsl,44419,4,26.0317,flydsl_mxpsh_96x128x128_F8_F8_B16_w4_x0_sk4,812.06,853.45,0.0
gfx950,256,1984,768,7168,fp8,fp8,flydsl,48579,4,26.5389,flydsl_mxpsh_128x128x256_F8_F8_B16_w4_x0_sk4,823.09,858.13,0.0
gfx950,256,2048,768,7168,fp8,fp8,flydsl,48515,4,26.8819,flydsl_mxpsh_128x128x256_F8_F8_B16_w3_x0_sk4,838.8,867.9,0.0
gfx950,256,4096,768,7168,fp8,fp8,flydsl,47680,1,39.1847,flydsl_mxpsh_128x64x256_F8_F8_B16_w0_x0_sk1,1150.89,1050.32,0.0
gfx950,256,6144,768,7168,fp8,fp8,flydsl,44608,1,52.6375,flydsl_mxpsh_96x128x256_F8_F8_B16_w2_x0_sk1,1285.12,1120.54,0.0
gfx950,256,8192,768,7168,fp8,fp8,flydsl,48384,1,61.2492,flydsl_mxpsh_128x128x256_F8_F8_B16_w1_x0_sk1,1472.58,1254.03,0.0
gfx950,256,10240,768,7168,fp8,fp8,flydsl,48448,1,67.9157,flydsl_mxpsh_128x128x256_F8_F8_B16_w2_x0_sk1,1660.04,1393.4,0.0
gfx950,256,12288,768,7168,fp8,fp8,flydsl,44224,1,86.5675,flydsl_mxpsh_96x128x128_F8_F8_B16_w1_x0_sk1,1562.84,1299.1,0.0
gfx950,256,14336,768,7168,fp8,fp8,flydsl,48192,1,95.0492,flydsl_mxpsh_128x128x128_F8_F8_B16_w3_x0_sk1,1660.61,1370.72,0.0
gfx950,256,16384,768,7168,fp8,fp8,flydsl,48192,1,101.488,flydsl_mxpsh_128x128x128_F8_F8_B16_w3_x0_sk1,1777.44,1459.4,0.0
gfx950,256,32768,768,7168,fp8,fp8,flydsl,48736,1,193.1086,flydsl_mxpsh_128x256x128_F8_F8_B16_w1_x4_sk1,1868.26,1505.46,0.0
gfx950,256,1,2048,7168,fp8,fp8,flydsl,34566,7,6.7218,flydsl_mxpsh_32x16x128_F8_F8_B16_w0_x0_sk7,4.37,2185.62,0.0
gfx950,256,2,2048,7168,fp8,fp8,flydsl,36429,14,8.1018,flydsl_mxpsh_32x64x256_F8_F8_B16_w4_x0_sk14,7.25,1814.73,0.0
gfx950,256,4,2048,7168,fp8,fp8,flydsl,36429,14,8.162,flydsl_mxpsh_32x64x256_F8_F8_B16_w4_x0_sk14,14.39,1804.11,0.0
gfx950,256,8,2048,7168,fp8,fp8,flydsl,36173,14,8.3049,flydsl_mxpsh_32x64x256_F8_F8_B16_w0_x0_sk14,28.28,1778.49,0.0
gfx950,256,16,2048,7168,fp8,fp8,flydsl,36429,14,8.4522,flydsl_mxpsh_32x64x256_F8_F8_B16_w4_x0_sk14,55.58,1758.16,0.0
gfx950,256,32,2048,7168,fp8,fp8,flydsl,35686,7,9.2872,flydsl_mxpsh_32x32x256_F8_F8_B16_w2_x4_sk7,101.16,1619.49,0.0
gfx950,256,48,2048,7168,fp8,fp8,flydsl,40038,7,10.2069,flydsl_mxpsh_64x64x256_F8_F8_B16_w0_x4_sk7,138.07,1491.22,0.0
gfx950,256,64,2048,7168,fp8,fp8,flydsl,35555,4,10.8332,flydsl_mxpsh_32x32x256_F8_F8_B16_w0_x4_sk4,173.45,1421.64,0.0
gfx950,256,80,2048,7168,fp8,fp8,flydsl,40294,7,11.285,flydsl_mxpsh_64x64x256_F8_F8_B16_w4_x4_sk7,208.14,1380.7,0.0
gfx950,256,96,2048,7168,fp8,fp8,flydsl,40294,7,11.969,flydsl_mxpsh_64x64x256_F8_F8_B16_w4_x4_sk7,235.49,1316.85,0.0
gfx950,256,112,2048,7168,fp8,fp8,flydsl,40070,7,12.6946,flydsl_mxpsh_64x64x256_F8_F8_B16_w1_x0_sk7,259.03,1255.78,0.0
gfx950,256,128,2048,7168,fp8,fp8,flydsl,40227,4,12.4598,flydsl_mxpsh_64x64x256_F8_F8_B16_w3_x4_sk4,301.62,1293.91,0.0
gfx950,256,144,2048,7168,fp8,fp8,flydsl,43875,4,13.2717,flydsl_mxpsh_96x64x256_F8_F8_B16_w0_x4_sk4,318.56,1228.33,0.0
gfx950,256,160,2048,7168,fp8,fp8,flydsl,43875,4,13.8063,flydsl_mxpsh_96x64x256_F8_F8_B16_w0_x4_sk4,340.25,1193.82,0.0
gfx950,256,176,2048,7168,fp8,fp8,flydsl,44131,4,14.1272,flydsl_mxpsh_96x64x256_F8_F8_B16_w4_x4_sk4,365.78,1179.46,0.0
gfx950,256,192,2048,7168,fp8,fp8,flydsl,40163,4,14.7814,flydsl_mxpsh_64x64x256_F8_F8_B16_w2_x4_sk4,381.37,1139.46,0.0
gfx950,256,208,2048,7168,fp8,fp8,flydsl,40867,4,15.3121,flydsl_mxpsh_64x128x256_F8_F8_B16_w3_x4_sk4,398.83,1111.73,0.0
gfx950,256,224,2048,7168,fp8,fp8,flydsl,40803,4,15.3519,flydsl_mxpsh_64x128x256_F8_F8_B16_w2_x4_sk4,428.39,1120.59,0.0
gfx950,256,240,2048,7168,fp8,fp8,flydsl,40227,4,15.9591,flydsl_mxpsh_64x64x256_F8_F8_B16_w3_x4_sk4,441.53,1089.25,0.0
gfx950,256,256,2048,7168,fp8,fp8,flydsl,40739,4,15.9529,flydsl_mxpsh_64x128x256_F8_F8_B16_w1_x4_sk4,471.15,1100.97,0.0
gfx950,256,288,2048,7168,fp8,fp8,flydsl,44579,4,17.4241,flydsl_mxpsh_96x128x256_F8_F8_B16_w1_x4_sk4,485.29,1028.7,0.0
gfx950,256,320,2048,7168,fp8,fp8,flydsl,44579,4,16.8526,flydsl_mxpsh_96x128x256_F8_F8_B16_w1_x4_sk4,557.5,1084.97,0.0
gfx950,256,352,2048,7168,fp8,fp8,flydsl,44515,4,17.3769,flydsl_mxpsh_96x128x256_F8_F8_B16_w0_x4_sk4,594.74,1072.98,0.0
gfx950,256,384,2048,7168,fp8,fp8,flydsl,44579,4,18.0397,flydsl_mxpsh_96x128x256_F8_F8_B16_w1_x4_sk4,624.97,1053.53,0.0
gfx950,256,416,2048,7168,fp8,fp8,flydsl,48611,4,19.3337,flydsl_mxpsh_128x128x256_F8_F8_B16_w4_x4_sk4,631.74,1001.66,0.0
gfx950,256,448,2048,7168,fp8,fp8,flydsl,48547,4,19.5354,flydsl_mxpsh_128x128x256_F8_F8_B16_w3_x4_sk4,673.31,1009.77,0.0
gfx950,256,480,2048,7168,fp8,fp8,flydsl,48611,4,19.9676,flydsl_mxpsh_128x128x256_F8_F8_B16_w4_x4_sk4,705.79,1005.97,0.0
gfx950,256,512,2048,7168,fp8,fp8,flydsl,48547,4,20.6033,flydsl_mxpsh_128x128x256_F8_F8_B16_w3_x4_sk4,729.61,992.43,0.0
gfx950,256,544,2048,7168,fp8,fp8,flydsl,44067,4,23.534,flydsl_mxpsh_96x64x256_F8_F8_B16_w3_x4_sk4,678.67,884.15,0.0
gfx950,256,576,2048,7168,fp8,fp8,flydsl,43875,4,24.2971,flydsl_mxpsh_96x64x256_F8_F8_B16_w0_x4_sk4,696.03,871.22,0.0
gfx950,256,608,2048,7168,fp8,fp8,flydsl,44643,4,24.7327,flydsl_mxpsh_96x128x256_F8_F8_B16_w2_x4_sk4,721.76,870.45,0.0
gfx950,256,640,2048,7168,fp8,fp8,flydsl,44065,2,25.0034,flydsl_mxpsh_96x64x256_F8_F8_B16_w3_x4_sk2,751.52,875.44,0.0
gfx950,256,672,2048,7168,fp8,fp8,flydsl,44515,4,25.4709,flydsl_mxpsh_96x128x256_F8_F8_B16_w0_x4_sk4,774.61,873.53,0.0
gfx950,256,704,2048,7168,fp8,fp8,flydsl,44643,4,24.4633,flydsl_mxpsh_96x128x256_F8_F8_B16_w2_x4_sk4,844.92,924.24,0.0
gfx950,256,736,2048,7168,fp8,fp8,flydsl,44643,4,25.3433,flydsl_mxpsh_96x128x256_F8_F8_B16_w2_x4_sk4,852.65,906.37,0.0
gfx950,256,768,2048,7168,fp8,fp8,flydsl,44771,4,26.5253,flydsl_mxpsh_96x128x256_F8_F8_B16_w4_x4_sk4,850.08,879.57,0.0
gfx950,256,800,2048,7168,fp8,fp8,flydsl,40865,2,27.7821,flydsl_mxpsh_64x128x256_F8_F8_B16_w3_x4_sk2,845.44,852.75,0.0
gfx950,256,832,2048,7168,fp8,fp8,flydsl,40737,2,27.5629,flydsl_mxpsh_64x128x256_F8_F8_B16_w1_x4_sk2,886.25,872.61,0.0
gfx950,256,864,2048,7168,fp8,fp8,flydsl,40737,2,28.061,flydsl_mxpsh_64x128x256_F8_F8_B16_w1_x4_sk2,904.0,869.97,0.0
gfx950,256,896,2048,7168,fp8,fp8,flydsl,40737,2,28.1363,flydsl_mxpsh_64x128x256_F8_F8_B16_w1_x4_sk2,934.97,880.45,0.0
gfx950,256,928,2048,7168,fp8,fp8,flydsl,48611,4,28.4278,flydsl_mxpsh_128x128x256_F8_F8_B16_w4_x4_sk4,958.44,884.1,0.0
gfx950,256,960,2048,7168,fp8,fp8,flydsl,48481,2,28.5033,flydsl_mxpsh_128x128x256_F8_F8_B16_w2_x4_sk2,988.86,894.41,0.0
gfx950,256,992,2048,7168,fp8,fp8,flydsl,48545,2,29.1116,flydsl_mxpsh_128x128x256_F8_F8_B16_w3_x4_sk2,1000.47,888.1,0.0
gfx950,256,1024,2048,7168,fp8,fp8,flydsl,23649,2,29.5169,flydsl_mxpsh_128x128x256_F8_F8_B16_w4_x4_sk2,1018.56,888.11,0.0
gfx950,256,1088,2048,7168,fp8,fp8,flydsl,44769,2,32.1391,flydsl_mxpsh_96x128x256_F8_F8_B16_w4_x4_sk2,993.92,838.08,0.0
gfx950,256,1152,2048,7168,fp8,fp8,flydsl,44577,2,32.1649,flydsl_mxpsh_96x128x256_F8_F8_B16_w1_x4_sk2,1051.55,859.83,0.0
gfx950,256,1216,2048,7168,fp8,fp8,flydsl,44769,2,33.7501,flydsl_mxpsh_96x128x256_F8_F8_B16_w4_x4_sk2,1057.83,840.8,0.0
gfx950,256,1280,2048,7168,fp8,fp8,flydsl,44577,2,32.9912,flydsl_mxpsh_96x128x256_F8_F8_B16_w1_x4_sk2,1139.12,881.99,0.0
gfx950,256,1344,2048,7168,fp8,fp8,flydsl,44513,2,33.7362,flydsl_mxpsh_96x128x256_F8_F8_B16_w0_x4_sk2,1169.66,883.88,0.0
gfx950,256,1408,2048,7168,fp8,fp8,flydsl,44513,2,34.6043,flydsl_mxpsh_96x128x256_F8_F8_B16_w0_x4_sk2,1194.62,882.54,0.0
gfx950,256,1472,2048,7168,fp8,fp8,flydsl,44576,1,37.9378,flydsl_mxpsh_96x128x256_F8_F8_B16_w1_x4_sk1,1139.18,824.0,0.0
gfx950,256,1536,2048,7168,fp8,fp8,flydsl,44512,1,38.4465,flydsl_mxpsh_96x128x256_F8_F8_B16_w0_x4_sk1,1172.98,831.85,0.0
gfx950,256,1600,2048,7168,fp8,fp8,flydsl,48609,2,40.1405,flydsl_mxpsh_128x128x256_F8_F8_B16_w4_x4_sk2,1170.29,814.7,0.0
gfx950,256,1664,2048,7168,fp8,fp8,flydsl,48545,2,40.5094,flydsl_mxpsh_128x128x256_F8_F8_B16_w3_x4_sk2,1206.02,825.08,0.0
gfx950,256,1728,2048,7168,fp8,fp8,flydsl,48416,1,40.9916,flydsl_mxpsh_128x128x256_F8_F8_B16_w1_x4_sk1,1237.68,832.96,0.0
gfx950,256,1792,2048,7168,fp8,fp8,flydsl,48481,2,41.1511,flydsl_mxpsh_128x128x256_F8_F8_B16_w2_x4_sk2,1278.54,847.25,0.0
gfx950,256,1856,2048,7168,fp8,fp8,flydsl,48416,1,41.9265,flydsl_mxpsh_128x128x256_F8_F8_B16_w1_x4_sk1,1299.71,848.77,0.0
gfx950,256,1920,2048,7168,fp8,fp8,flydsl,48480,1,42.783,flydsl_mxpsh_128x128x256_F8_F8_B16_w2_x4_sk1,1317.61,848.63,0.0
gfx950,256,1984,2048,7168,fp8,fp8,flydsl,48608,1,41.958,flydsl_mxpsh_128x128x256_F8_F8_B16_w4_x4_sk1,1388.3,882.5,0.0
gfx950,256,2048,2048,7168,fp8,fp8,flydsl,48416,1,42.413,flydsl_mxpsh_128x128x256_F8_F8_B16_w1_x4_sk1,1417.71,890.03,0.0
gfx950,256,4096,2048,7168,fp8,fp8,flydsl,23648,1,67.5225,flydsl_mxpsh_128x128x256_F8_F8_B16_w4_x4_sk1,1781.02,900.7,0.0
gfx950,256,6144,2048,7168,fp8,fp8,flydsl,44896,1,97.3239,flydsl_mxpsh_96x256x128_F8_F8_B16_w1_x4_sk1,1853.49,861.93,0.0
gfx950,256,8192,2048,7168,fp8,fp8,flydsl,48736,1,114.5824,flydsl_mxpsh_128x256x128_F8_F8_B16_w1_x4_sk1,2099.08,933.43,0.0
gfx950,256,10240,2048,7168,fp8,fp8,flydsl,48512,1,155.3148,flydsl_mxpsh_128x128x256_F8_F8_B16_w3_x0_sk1,1935.73,837.16,0.0
gfx950,256,12288,2048,7168,fp8,fp8,flydsl,48736,1,175.5857,flydsl_mxpsh_128x256x128_F8_F8_B16_w1_x4_sk1,2054.71,871.89,0.0
gfx950,256,14336,2048,7168,fp8,fp8,flydsl,48672,1,199.1573,flydsl_mxpsh_128x256x128_F8_F8_B16_w0_x4_sk1,2113.44,884.53,0.0
gfx950,256,16384,2048,7168,fp8,fp8,flydsl,48736,1,212.5862,flydsl_mxpsh_128x256x128_F8_F8_B16_w1_x4_sk1,2262.78,937.17,0.0
gfx950,256,32768,2048,7168,fp8,fp8,flydsl,48736,1,403.9355,flydsl_mxpsh_128x256x128_F8_F8_B16_w1_x4_sk1,2381.75,950.1,0.0
gfx950,256,1,6144,7168,fp8,fp8,flydsl,35523,4,12.5835,flydsl_mxpsh_32x32x256_F8_F8_B16_w0_x0_sk4,7.0,3501.38,0.0
gfx950,256,2,6144,7168,fp8,fp8,flydsl,36230,7,12.6855,flydsl_mxpsh_32x64x256_F8_F8_B16_w1_x0_sk7,13.89,3474.76,0.0
gfx950,256,4,6144,7168,fp8,fp8,flydsl,36230,7,12.7719,flydsl_mxpsh_32x64x256_F8_F8_B16_w1_x0_sk7,27.59,3454.3,0.0
gfx950,256,8,6144,7168,fp8,fp8,flydsl,35523,4,13.1373,flydsl_mxpsh_32x32x256_F8_F8_B16_w0_x0_sk4,53.64,3364.15,0.0
gfx950,256,16,6144,7168,fp8,fp8,flydsl,36262,7,14.2217,flydsl_mxpsh_32x64x256_F8_F8_B16_w1_x4_sk7,99.09,3118.58,0.0
gfx950,256,32,6144,7168,fp8,fp8,flydsl,35587,4,14.3522,flydsl_mxpsh_32x32x256_F8_F8_B16_w1_x0_sk4,196.39,3111.91,0.0
gfx950,256,48,6144,7168,fp8,fp8,flydsl,39395,4,16.3544,flydsl_mxpsh_64x32x256_F8_F8_B16_w0_x4_sk4,258.52,2749.97,0.0
gfx950,256,64,6144,7168,fp8,fp8,flydsl,40035,4,17.0951,flydsl_mxpsh_64x64x256_F8_F8_B16_w0_x4_sk4,329.75,2649.03,0.0
gfx950,256,80,6144,7168,fp8,fp8,flydsl,44515,4,18.3295,flydsl_mxpsh_96x128x256_F8_F8_B16_w0_x4_sk4,384.43,2487.61,0.0
gfx950,256,96,6144,7168,fp8,fp8,flydsl,44611,4,18.7184,flydsl_mxpsh_96x128x256_F8_F8_B16_w2_x0_sk4,451.73,2452.56,0.0
gfx950,256,112,6144,7168,fp8,fp8,flydsl,48515,4,20.2162,flydsl_mxpsh_128x128x256_F8_F8_B16_w3_x0_sk4,487.98,2286.25,0.0
gfx950,256,128,6144,7168,fp8,fp8,flydsl,48419,4,20.499,flydsl_mxpsh_128x128x256_F8_F8_B16_w1_x4_sk4,549.99,2269.89,0.0
gfx950,256,144,6144,7168,fp8,fp8,flydsl,44003,4,23.1483,flydsl_mxpsh_96x64x256_F8_F8_B16_w2_x4_sk4,547.93,2023.55,0.0
gfx950,256,160,6144,7168,fp8,fp8,flydsl,44003,4,24.6142,flydsl_mxpsh_96x64x256_F8_F8_B16_w2_x4_sk4,572.55,1915.69,0.0
gfx950,256,176,6144,7168,fp8,fp8,flydsl,40801,2,25.9892,flydsl_mxpsh_64x128x256_F8_F8_B16_w2_x4_sk2,596.48,1826.31,0.0
gfx950,256,192,6144,7168,fp8,fp8,flydsl,43875,4,26.1961,flydsl_mxpsh_96x64x256_F8_F8_B16_w0_x4_sk4,645.57,1823.77,0.0
gfx950,256,208,6144,7168,fp8,fp8,flydsl,40803,4,27.2435,flydsl_mxpsh_64x128x256_F8_F8_B16_w2_x4_sk4,672.48,1765.08,0.0
gfx950,256,224,6144,7168,fp8,fp8,flydsl,40867,4,27.5963,flydsl_mxpsh_64x128x256_F8_F8_B16_w3_x4_sk4,714.95,1753.8,0.0
gfx950,256,240,6144,7168,fp8,fp8,flydsl,48417,2,28.2657,flydsl_mxpsh_128x128x256_F8_F8_B16_w1_x4_sk2,747.88,1723.28,0.0
gfx950,256,256,6144,7168,fp8,fp8,flydsl,47841,2,28.8764,flydsl_mxpsh_128x64x256_F8_F8_B16_w2_x4_sk2,780.87,1697.61,0.0
gfx950,256,288,6144,7168,fp8,fp8,flydsl,44577,2,30.9881,flydsl_mxpsh_96x128x256_F8_F8_B16_w1_x4_sk2,818.61,1602.02,0.0
gfx950,256,320,6144,7168,fp8,fp8,flydsl,40737,2,31.8676,flydsl_mxpsh_64x128x256_F8_F8_B16_w1_x4_sk2,884.46,1577.34,0.0
gfx950,256,352,6144,7168,fp8,fp8,flydsl,44769,2,34.619,flydsl_mxpsh_96x128x256_F8_F8_B16_w4_x4_sk2,895.59,1469.96,0.0
gfx950,256,384,6144,7168,fp8,fp8,flydsl,43872,1,35.2618,flydsl_mxpsh_96x64x256_F8_F8_B16_w0_x4_sk1,959.19,1460.82,0.0
gfx950,256,416,6144,7168,fp8,fp8,flydsl,43936,1,36.2506,flydsl_mxpsh_96x64x256_F8_F8_B16_w1_x4_sk1,1010.78,1438.15,0.0
gfx950,256,448,6144,7168,fp8,fp8,flydsl,44000,1,37.0511,flydsl_mxpsh_96x64x256_F8_F8_B16_w2_x4_sk1,1065.02,1423.88,0.0
gfx950,256,480,6144,7168,fp8,fp8,flydsl,43872,1,37.9094,flydsl_mxpsh_96x64x256_F8_F8_B16_w0_x4_sk1,1115.25,1408.07,0.0
gfx950,256,512,6144,7168,fp8,fp8,flydsl,40864,1,39.9414,flydsl_mxpsh_64x128x256_F8_F8_B16_w3_x4_sk1,1129.08,1352.02,0.0
gfx950,256,544,6144,7168,fp8,fp8,flydsl,47712,1,40.9484,flydsl_mxpsh_128x64x256_F8_F8_B16_w0_x4_sk1,1170.15,1333.98,0.0
gfx950,256,576,6144,7168,fp8,fp8,flydsl,48416,1,41.9537,flydsl_mxpsh_128x128x256_F8_F8_B16_w1_x4_sk1,1209.29,1316.85,0.0
gfx950,256,608,6144,7168,fp8,fp8,flydsl,48480,1,42.7764,flydsl_mxpsh_128x128x256_F8_F8_B16_w2_x4_sk1,1251.93,1306.08,0.0
gfx950,256,640,6144,7168,fp8,fp8,flydsl,47840,1,42.8703,flydsl_mxpsh_128x64x256_F8_F8_B16_w2_x4_sk1,1314.93,1317.74,0.0
gfx950,256,672,6144,7168,fp8,fp8,flydsl,44064,1,52.0706,flydsl_mxpsh_96x64x256_F8_F8_B16_w3_x4_sk1,1136.73,1096.87,0.0
gfx950,256,704,6144,7168,fp8,fp8,flydsl,44768,1,51.4346,flydsl_mxpsh_96x128x256_F8_F8_B16_w4_x4_sk1,1205.58,1122.54,0.0
gfx950,256,736,6144,7168,fp8,fp8,flydsl,44768,1,51.9418,flydsl_mxpsh_96x128x256_F8_F8_B16_w4_x4_sk1,1248.07,1123.56,0.0
gfx950,256,768,6144,7168,fp8,fp8,flydsl,44512,1,51.7744,flydsl_mxpsh_96x128x256_F8_F8_B16_w0_x4_sk1,1306.55,1139.22,0.0
gfx950,256,800,6144,7168,fp8,fp8,flydsl,21472,1,53.0161,flydsl_mxpsh_96x128x256_F8_F8_B16_w0_x4_sk1,1329.11,1124.28,0.0
gfx950,256,832,6144,7168,fp8,fp8,flydsl,44576,1,54.8495,flydsl_mxpsh_96x128x256_F8_F8_B16_w1_x4_sk1,1336.07,1098.05,0.0
gfx950,256,864,6144,7168,fp8,fp8,flydsl,44640,1,54.9356,flydsl_mxpsh_96x128x256_F8_F8_B16_w2_x4_sk1,1385.28,1107.66,0.0
gfx950,256,896,6144,7168,fp8,fp8,flydsl,44512,1,57.4466,flydsl_mxpsh_96x128x256_F8_F8_B16_w0_x4_sk1,1373.8,1070.09,0.0
gfx950,256,928,6144,7168,fp8,fp8,flydsl,44512,1,57.8134,flydsl_mxpsh_96x128x256_F8_F8_B16_w0_x4_sk1,1413.83,1074.07,0.0
gfx950,256,960,6144,7168,fp8,fp8,flydsl,44640,1,59.061,flydsl_mxpsh_96x128x256_F8_F8_B16_w2_x4_sk1,1431.69,1061.92,0.0
gfx950,256,992,6144,7168,fp8,fp8,flydsl,48480,1,62.0922,flydsl_mxpsh_128x128x256_F8_F8_B16_w2_x4_sk1,1407.19,1020.1,0.0
gfx950,256,1024,6144,7168,fp8,fp8,flydsl,48480,1,63.1482,flydsl_mxpsh_128x128x256_F8_F8_B16_w2_x4_sk1,1428.3,1012.91,0.0
gfx950,256,1088,6144,7168,fp8,fp8,flydsl,48480,1,64.8258,flydsl_mxpsh_128x128x256_F8_F8_B16_w2_x4_sk1,1478.29,1005.9,0.0
gfx950,256,1152,6144,7168,fp8,fp8,flydsl,48480,1,66.0102,flydsl_mxpsh_128x128x256_F8_F8_B16_w2_x4_sk1,1537.17,1006.72,0.0
gfx950,256,1216,6144,7168,fp8,fp8,flydsl,48608,1,68.4714,flydsl_mxpsh_128x128x256_F8_F8_B16_w4_x4_sk1,1564.24,988.71,0.0
gfx950,256,1280,6144,7168,fp8,fp8,flydsl,48352,1,69.7518,flydsl_mxpsh_128x128x256_F8_F8_B16_w0_x4_sk1,1616.34,988.42,0.0
gfx950,256,1344,6144,7168,fp8,fp8,flydsl,21280,1,75.5893,flydsl_mxpsh_96x128x128_F8_F8_B16_w2_x4_sk1,1566.1,928.56,0.0
gfx950,256,1408,6144,7168,fp8,fp8,flydsl,44320,1,79.4147,flydsl_mxpsh_96x128x128_F8_F8_B16_w2_x4_sk1,1561.64,899.51,0.0
gfx950,256,1472,6144,7168,fp8,fp8,flydsl,44384,1,80.6071,flydsl_mxpsh_96x128x128_F8_F8_B16_w3_x4_sk1,1608.47,901.65,0.0
gfx950,256,1536,6144,7168,fp8,fp8,flydsl,44448,1,83.7188,flydsl_mxpsh_96x128x128_F8_F8_B16_w4_x4_sk1,1616.02,883.01,0.0
gfx950,256,1600,6144,7168,fp8,fp8,flydsl,48160,1,88.2451,flydsl_mxpsh_128x128x128_F8_F8_B16_w2_x4_sk1,1597.01,851.83,0.0
gfx950,256,1664,6144,7168,fp8,fp8,flydsl,48224,1,89.1809,flydsl_mxpsh_128x128x128_F8_F8_B16_w3_x4_sk1,1643.47,856.85,0.0
gfx950,256,1728,6144,7168,fp8,fp8,flydsl,48224,1,91.0108,flydsl_mxpsh_128x128x128_F8_F8_B16_w3_x4_sk1,1672.36,853.31,0.0
gfx950,256,1792,6144,7168,fp8,fp8,flydsl,48224,1,91.1353,flydsl_mxpsh_128x128x128_F8_F8_B16_w3_x4_sk1,1731.93,865.8,0.0
gfx950,256,1856,6144,7168,fp8,fp8,flydsl,48160,1,94.3138,flydsl_mxpsh_128x128x128_F8_F8_B16_w2_x4_sk1,1733.33,849.83,0.0
gfx950,256,1920,6144,7168,fp8,fp8,flydsl,48160,1,94.8891,flydsl_mxpsh_128x128x128_F8_F8_B16_w2_x4_sk1,1782.23,857.8,0.0
gfx950,256,1984,6144,7168,fp8,fp8,flydsl,48224,1,96.3807,flydsl_mxpsh_128x128x128_F8_F8_B16_w3_x4_sk1,1813.14,857.44,0.0
gfx950,256,2048,6144,7168,fp8,fp8,flydsl,48224,1,97.6771,flydsl_mxpsh_128x128x128_F8_F8_B16_w3_x4_sk1,1846.79,858.81,0.0
gfx950,256,4096,6144,7168,fp8,fp8,flydsl,48800,1,171.3338,flydsl_mxpsh_128x256x128_F8_F8_B16_w2_x4_sk1,2105.7,722.17,0.0
gfx950,256,6144,6144,7168,fp8,fp8,flydsl,48672,1,244.8842,flydsl_mxpsh_128x256x128_F8_F8_B16_w0_x4_sk1,2209.88,667.98,0.0
gfx950,256,8192,6144,7168,fp8,fp8,flydsl,48736,1,294.5734,flydsl_mxpsh_128x256x128_F8_F8_B16_w1_x4_sk1,2449.49,690.57,0.0
gfx950,256,10240,6144,7168,fp8,fp8,flydsl,48736,1,375.5078,flydsl_mxpsh_128x256x128_F8_F8_B16_w1_x4_sk1,2401.93,647.84,0.0
gfx950,256,12288,6144,7168,fp8,fp8,flydsl,48800,1,435.7939,flydsl_mxpsh_128x256x128_F8_F8_B16_w2_x4_sk1,2483.59,649.65,0.0
gfx950,256,14336,6144,7168,fp8,fp8,flydsl,48736,1,507.0286,flydsl_mxpsh_128x256x128_F8_F8_B16_w1_x4_sk1,2490.43,636.97,0.0
gfx950,256,16384,6144,7168,fp8,fp8,flydsl,48800,1,574.7928,flydsl_mxpsh_128x256x128_F8_F8_B16_w2_x4_sk1,2510.66,631.2,0.0
gfx950,256,20480,6144,7168,fp8,fp8,flydsl,48800,1,724.1846,flydsl_mxpsh_128x256x128_F8_F8_B16_w2_x4_sk1,2490.92,611.03,0.0
gfx950,256,24576,6144,7168,fp8,fp8,flydsl,48672,1,876.7847,flydsl_mxpsh_128x256x128_F8_F8_B16_w0_x4_sk1,2468.87,595.57,0.0
gfx950,256,28672,6144,7168,fp8,fp8,flydsl,48736,1,1027.1025,flydsl_mxpsh_128x256x128_F8_F8_B16_w1_x4_sk1,2458.8,586.0,0.0
gfx950,256,32768,6144,7168,fp8,fp8,flydsl,48800,1,1200.4905,flydsl_mxpsh_128x256x128_F8_F8_B16_w2_x4_sk1,2404.2,567.75,0.0
gfx950,256,40960,6144,7168,fp8,fp8,flydsl,48800,1,1475.2401,flydsl_mxpsh_128x256x128_F8_F8_B16_w2_x4_sk1,2445.55,570.05,0.0
gfx950,256,49152,6144,7168,fp8,fp8,flydsl,48672,1,1784.4565,flydsl_mxpsh_128x256x128_F8_F8_B16_w0_x4_sk1,2426.13,560.59,0.0
gfx950,256,57344,6144,7168,fp8,fp8,flydsl,48800,1,2097.2599,flydsl_mxpsh_128x256x128_F8_F8_B16_w2_x4_sk1,2408.32,552.97,0.0
gfx950,256,65536,6144,7168,fp8,fp8,flydsl,48800,1,2432.8113,flydsl_mxpsh_128x256x128_F8_F8_B16_w2_x4_sk1,2372.74,542.22,0.0
gfx950,256,1,7168,384,fp8,fp8,flydsl,35424,1,4.277,flydsl_mxpsh_32x32x128_F8_F8_B16_w3_x4_sk1,1.29,647.0,0.0
gfx950,256,1,7168,3072,fp8,fp8,flydsl,43107,4,9.0102,flydsl_mxpsh_96x32x128_F8_F8_B16_w3_x4_sk4,4.89,2445.84,0.0
gfx950,256,1,7168,7168,fp8,fp8,flydsl,17862,7,14.0291,flydsl_mxpsh_32x128x256_F8_F8_B16_w4_x0_sk7,7.32,3663.94,0.0
gfx950,256,1,7168,16384,fp8,fp8,flydsl,36999,8,24.4328,flydsl_mxpsh_32x128x256_F8_F8_B16_w3_x0_sk8,9.61,4807.93,0.0
gfx950,256,2,7168,384,fp8,fp8,flydsl,35328,1,4.3368,flydsl_mxpsh_32x32x128_F8_F8_B16_w2_x0_sk1,2.54,641.48,0.0
gfx950,256,2,7168,3072,fp8,fp8,flydsl,36421,6,9.3458,flydsl_mxpsh_32x64x256_F8_F8_B16_w4_x0_sk6,9.42,2359.87,0.0
gfx950,256,2,7168,7168,fp8,fp8,flydsl,36870,7,13.8802,flydsl_mxpsh_32x128x256_F8_F8_B16_w1_x0_sk7,14.81,3704.79,0.0
gfx950,256,2,7168,16384,fp8,fp8,flydsl,35239,8,24.2932,flydsl_mxpsh_32x32x128_F8_F8_B16_w0_x4_sk8,19.34,4836.82,0.0
gfx950,256,4,7168,384,fp8,fp8,flydsl,35456,1,4.3498,flydsl_mxpsh_32x32x128_F8_F8_B16_w4_x0_sk1,5.06,646.33,0.0
gfx950,256,4,7168,3072,fp8,fp8,flydsl,36293,6,9.2017,flydsl_mxpsh_32x64x256_F8_F8_B16_w2_x0_sk6,19.14,2400.61,0.0
gfx950,256,4,7168,7168,fp8,fp8,flydsl,36870,7,14.0979,flydsl_mxpsh_32x128x256_F8_F8_B16_w1_x0_sk7,29.16,3650.63,0.0
gfx950,256,4,7168,16384,fp8,fp8,flydsl,35431,8,24.4431,flydsl_mxpsh_32x32x128_F8_F8_B16_w3_x4_sk8,38.44,4809.68,0.0
gfx950,256,8,7168,384,fp8,fp8,flydsl,35392,1,4.3679,flydsl_mxpsh_32x32x128_F8_F8_B16_w3_x0_sk1,10.08,657.13,0.0
gfx950,256,8,7168,3072,fp8,fp8,flydsl,35781,6,9.4186,flydsl_mxpsh_32x32x256_F8_F8_B16_w4_x0_sk6,37.41,2352.72,0.0
gfx950,256,8,7168,7168,fp8,fp8,flydsl,37062,7,14.0595,flydsl_mxpsh_32x128x256_F8_F8_B16_w4_x0_sk7,58.47,3666.72,0.0
gfx950,256,8,7168,16384,fp8,fp8,flydsl,36903,8,24.7558,flydsl_mxpsh_32x128x256_F8_F8_B16_w1_x4_sk8,75.9,4753.89,0.0
gfx950,256,16,7168,384,fp8,fp8,flydsl,35264,1,4.4876,flydsl_mxpsh_32x32x128_F8_F8_B16_w1_x0_sk1,19.63,665.84,0.0
gfx950,256,16,7168,3072,fp8,fp8,flydsl,37059,4,10.0162,flydsl_mxpsh_32x128x256_F8_F8_B16_w4_x0_sk4,70.35,2226.26,0.0
gfx950,256,16,7168,7168,fp8,fp8,flydsl,36582,7,15.0621,flydsl_mxpsh_32x128x128_F8_F8_B16_w1_x4_sk7,109.16,3434.07,0.0
gfx950,256,16,7168,16384,fp8,fp8,flydsl,35431,8,25.6732,flydsl_mxpsh_32x32x128_F8_F8_B16_w3_x4_sk8,146.38,4593.59,0.0
gfx950,256,32,7168,384,fp8,fp8,flydsl,35328,1,4.4653,flydsl_mxpsh_32x32x128_F8_F8_B16_w2_x0_sk1,39.45,721.91,0.0
gfx950,256,32,7168,3072,fp8,fp8,flydsl,40067,4,10.768,flydsl_mxpsh_64x64x256_F8_F8_B16_w1_x0_sk4,130.88,2096.69,0.0
gfx950,256,32,7168,7168,fp8,fp8,flydsl,36163,4,15.9134,flydsl_mxpsh_32x64x256_F8_F8_B16_w0_x0_sk4,206.64,3271.98,0.0
gfx950,256,32,7168,16384,fp8,fp8,flydsl,36647,8,27.2281,flydsl_mxpsh_32x128x128_F8_F8_B16_w2_x4_sk8,276.05,4349.31,0.0
gfx950,256,48,7168,384,fp8,fp8,flydsl,39232,1,4.7288,flydsl_mxpsh_64x32x128_F8_F8_B16_w3_x0_sk1,55.88,731.49,0.0
gfx950,256,48,7168,3072,fp8,fp8,flydsl,35808,1,11.4481,flydsl_mxpsh_32x32x256_F8_F8_B16_w4_x4_sk1,184.65,1996.46,0.0
gfx950,256,48,7168,7168,fp8,fp8,flydsl,40227,4,17.3886,flydsl_mxpsh_64x64x256_F8_F8_B16_w3_x4_sk4,283.66,3014.18,0.0
gfx950,256,48,7168,16384,fp8,fp8,flydsl,44327,8,29.1929,flydsl_mxpsh_96x128x128_F8_F8_B16_w2_x4_sk8,386.2,4073.42,0.0
gfx950,256,64,7168,384,fp8,fp8,flydsl,35264,1,4.7689,flydsl_mxpsh_32x32x128_F8_F8_B16_w1_x0_sk1,73.88,774.73,0.0
gfx950,256,64,7168,3072,fp8,fp8,flydsl,35808,1,11.4409,flydsl_mxpsh_32x32x256_F8_F8_B16_w4_x4_sk1,246.36,2022.06,0.0
gfx950,256,64,7168,7168,fp8,fp8,flydsl,40003,4,18.1938,flydsl_mxpsh_64x64x256_F8_F8_B16_w0_x0_sk4,361.48,2899.7,0.0
gfx950,256,64,7168,16384,fp8,fp8,flydsl,44327,8,30.994,flydsl_mxpsh_96x128x128_F8_F8_B16_w2_x4_sk8,485.01,3852.57,0.0
gfx950,256,80,7168,384,fp8,fp8,flydsl,36096,1,4.8415,flydsl_mxpsh_32x64x128_F8_F8_B16_w4_x0_sk1,90.96,811.76,0.0
gfx950,256,80,7168,3072,fp8,fp8,flydsl,35616,1,12.3549,flydsl_mxpsh_32x32x256_F8_F8_B16_w1_x4_sk1,285.17,1895.02,0.0
gfx950,256,80,7168,7168,fp8,fp8,flydsl,44739,4,19.5712,flydsl_mxpsh_96x128x256_F8_F8_B16_w4_x0_sk4,420.05,2713.2,0.0
gfx950,256,80,7168,16384,fp8,fp8,flydsl,44295,8,32.3219,flydsl_mxpsh_96x128x128_F8_F8_B16_w2_x0_sk8,581.35,3709.5,0.0
gfx950,256,96,7168,384,fp8,fp8,flydsl,35904,1,4.9326,flydsl_mxpsh_32x64x128_F8_F8_B16_w1_x0_sk1,107.14,844.51,0.0
gfx950,256,96,7168,3072,fp8,fp8,flydsl,35808,1,12.4331,flydsl_mxpsh_32x32x256_F8_F8_B16_w4_x4_sk1,340.05,1905.5,0.0
gfx950,256,96,7168,7168,fp8,fp8,flydsl,44547,4,20.3973,flydsl_mxpsh_96x128x256_F8_F8_B16_w1_x0_sk4,483.64,2620.18,0.0
gfx950,256,96,7168,16384,fp8,fp8,flydsl,44327,8,34.633,flydsl_mxpsh_96x128x128_F8_F8_B16_w2_x4_sk8,651.07,3476.15,0.0
gfx950,256,112,7168,384,fp8,fp8,flydsl,36128,1,5.1343,flydsl_mxpsh_32x64x128_F8_F8_B16_w4_x4_sk1,120.09,857.21,0.0
gfx950,256,112,7168,3072,fp8,fp8,flydsl,40096,1,13.4341,flydsl_mxpsh_64x64x256_F8_F8_B16_w1_x4_sk1,367.16,1784.25,0.0
gfx950,256,112,7168,7168,fp8,fp8,flydsl,48579,4,21.7973,flydsl_mxpsh_128x128x256_F8_F8_B16_w4_x0_sk4,528.01,2467.68,0.0
gfx950,256,112,7168,16384,fp8,fp8,flydsl,48455,8,37.5828,flydsl_mxpsh_128x128x256_F8_F8_B16_w2_x0_sk8,699.97,3216.4,0.0
gfx950,256,128,7168,384,fp8,fp8,flydsl,35936,1,5.2082,flydsl_mxpsh_32x64x128_F8_F8_B16_w1_x4_sk1,135.29,890.26,0.0
gfx950,256,128,7168,3072,fp8,fp8,flydsl,40160,1,13.9849,flydsl_mxpsh_64x64x256_F8_F8_B16_w2_x4_sk1,403.09,1733.89,0.0
gfx950,256,128,7168,7168,fp8,fp8,flydsl,47747,4,22.6674,flydsl_mxpsh_128x64x256_F8_F8_B16_w1_x0_sk4,580.28,2388.13,0.0
gfx950,256,128,7168,16384,fp8,fp8,flydsl,48359,8,39.107,flydsl_mxpsh_128x128x256_F8_F8_B16_w0_x4_sk8,768.78,3103.6,0.0
gfx950,256,144,7168,384,fp8,fp8,flydsl,35968,1,5.3511,flydsl_mxpsh_32x64x128_F8_F8_B16_w2_x0_sk1,148.14,910.5,0.0
gfx950,256,144,7168,3072,fp8,fp8,flydsl,44064,1,14.8076,flydsl_mxpsh_96x64x256_F8_F8_B16_w3_x4_sk1,428.28,1656.37,0.0
gfx950,256,144,7168,7168,fp8,fp8,flydsl,44515,4,25.7057,flydsl_mxpsh_96x128x256_F8_F8_B16_w0_x4_sk4,575.65,2119.25,0.0
gfx950,256,144,7168,16384,fp8,fp8,flydsl,44515,4,42.7692,flydsl_mxpsh_96x128x256_F8_F8_B16_w0_x4_sk4,790.82,2849.34,0.0
gfx950,256,160,7168,384,fp8,fp8,flydsl,35936,1,5.3687,flydsl_mxpsh_32x64x128_F8_F8_B16_w1_x4_sk1,164.06,951.39,0.0
gfx950,256,160,7168,3072,fp8,fp8,flydsl,43936,1,15.0056,flydsl_mxpsh_96x64x256_F8_F8_B16_w1_x4_sk1,469.59,1653.07,0.0
gfx950,256,160,7168,7168,fp8,fp8,flydsl,21539,4,25.9728,flydsl_mxpsh_96x128x256_F8_F8_B16_w1_x4_sk4,633.03,2110.7,0.0
gfx950,256,160,7168,16384,fp8,fp8,flydsl,44643,4,43.7519,flydsl_mxpsh_96x128x256_F8_F8_B16_w2_x4_sk4,858.96,2796.58,0.0
gfx950,256,176,7168,384,fp8,fp8,flydsl,35872,1,5.4318,flydsl_mxpsh_32x64x128_F8_F8_B16_w0_x4_sk1,178.37,983.69,0.0
gfx950,256,176,7168,3072,fp8,fp8,flydsl,44128,1,15.1753,flydsl_mxpsh_96x64x256_F8_F8_B16_w4_x4_sk1,510.77,1652.94,0.0
gfx950,256,176,7168,7168,fp8,fp8,flydsl,44515,4,27.1035,flydsl_mxpsh_96x128x256_F8_F8_B16_w0_x4_sk4,667.29,2035.34,0.0
gfx950,256,176,7168,16384,fp8,fp8,flydsl,44579,4,45.2863,flydsl_mxpsh_96x128x256_F8_F8_B16_w1_x4_sk4,912.84,2712.68,0.0
gfx950,256,192,7168,384,fp8,fp8,flydsl,35936,1,5.4988,flydsl_mxpsh_32x64x128_F8_F8_B16_w1_x4_sk1,192.22,1014.54,0.0
gfx950,256,192,7168,3072,fp8,fp8,flydsl,44128,1,15.7346,flydsl_mxpsh_96x64x256_F8_F8_B16_w4_x4_sk1,537.4,1611.89,0.0
gfx950,256,192,7168,7168,fp8,fp8,flydsl,44515,4,27.1317,flydsl_mxpsh_96x128x256_F8_F8_B16_w0_x4_sk4,727.19,2045.91,0.0
gfx950,256,192,7168,16384,fp8,fp8,flydsl,44771,4,46.3256,flydsl_mxpsh_96x128x256_F8_F8_B16_w4_x4_sk4,973.48,2662.43,0.0
gfx950,256,208,7168,384,fp8,fp8,flydsl,36512,1,5.7285,flydsl_mxpsh_32x128x128_F8_F8_B16_w0_x4_sk1,199.89,1014.97,0.0
gfx950,256,208,7168,3072,fp8,fp8,flydsl,40032,1,15.9647,flydsl_mxpsh_64x64x256_F8_F8_B16_w0_x4_sk1,573.79,1606.1,0.0
gfx950,256,208,7168,7168,fp8,fp8,flydsl,48417,2,28.874,flydsl_mxpsh_128x128x256_F8_F8_B16_w1_x4_sk2,740.26,1934.37,0.0
gfx950,256,208,7168,16384,fp8,fp8,flydsl,48483,4,49.3411,flydsl_mxpsh_128x128x256_F8_F8_B16_w2_x4_sk4,990.15,2509.68,0.0
gfx950,256,224,7168,384,fp8,fp8,flydsl,36576,1,5.8416,flydsl_mxpsh_32x128x128_F8_F8_B16_w1_x4_sk1,211.09,1035.64,0.0
gfx950,256,224,7168,3072,fp8,fp8,flydsl,40160,1,15.9154,flydsl_mxpsh_64x64x256_F8_F8_B16_w2_x4_sk1,619.84,1628.58,0.0
gfx950,256,224,7168,7168,fp8,fp8,flydsl,48417,2,29.3639,flydsl_mxpsh_128x128x256_F8_F8_B16_w1_x4_sk2,783.9,1913.82,0.0
gfx950,256,224,7168,16384,fp8,fp8,flydsl,48483,4,50.46,flydsl_mxpsh_128x128x256_F8_F8_B16_w2_x4_sk4,1042.67,2463.77,0.0
gfx950,256,240,7168,384,fp8,fp8,flydsl,36640,1,5.9664,flydsl_mxpsh_32x128x128_F8_F8_B16_w2_x4_sk1,221.44,1053.45,0.0
gfx950,256,240,7168,3072,fp8,fp8,flydsl,40160,1,16.2256,flydsl_mxpsh_64x64x256_F8_F8_B16_w2_x4_sk1,651.42,1614.61,0.0
gfx950,256,240,7168,7168,fp8,fp8,flydsl,48417,2,29.5797,flydsl_mxpsh_128x128x256_F8_F8_B16_w1_x4_sk2,833.76,1911.49,0.0
gfx950,256,240,7168,16384,fp8,fp8,flydsl,48419,4,51.4268,flydsl_mxpsh_128x128x256_F8_F8_B16_w1_x4_sk4,1096.15,2427.01,0.0
gfx950,256,256,7168,384,fp8,fp8,flydsl,39904,1,6.0478,flydsl_mxpsh_64x64x128_F8_F8_B16_w3_x4_sk1,233.02,1078.22,0.0
gfx950,256,256,7168,3072,fp8,fp8,flydsl,40224,1,16.1881,flydsl_mxpsh_64x64x256_F8_F8_B16_w3_x4_sk1,696.46,1635.56,0.0
gfx950,256,256,7168,7168,fp8,fp8,flydsl,48353,2,30.4765,flydsl_mxpsh_128x128x256_F8_F8_B16_w0_x4_sk2,863.18,1866.53,0.0
gfx950,256,256,7168,16384,fp8,fp8,flydsl,48611,4,52.698,flydsl_mxpsh_128x128x256_F8_F8_B16_w4_x4_sk4,1141.02,2377.79,0.0
gfx950,256,288,7168,384,fp8,fp8,flydsl,36704,1,6.0839,flydsl_mxpsh_32x128x128_F8_F8_B16_w3_x4_sk1,260.6,1149.24,0.0
gfx950,256,288,7168,3072,fp8,fp8,flydsl,44064,1,17.1214,flydsl_mxpsh_96x64x256_F8_F8_B16_w3_x4_sk1,740.8,1578.94,0.0
gfx950,256,288,7168,7168,fp8,fp8,flydsl,36832,1,34.6336,flydsl_mxpsh_32x128x256_F8_F8_B16_w0_x4_sk1,854.52,1662.36,0.0
gfx950,256,288,7168,16384,fp8,fp8,flydsl,44579,4,63.9625,flydsl_mxpsh_96x128x256_F8_F8_B16_w1_x4_sk4,1057.58,1974.4,0.0
gfx950,256,320,7168,384,fp8,fp8,flydsl,39840,1,6.3894,flydsl_mxpsh_64x64x128_F8_F8_B16_w2_x4_sk1,275.71,1168.01,0.0
gfx950,256,320,7168,3072,fp8,fp8,flydsl,44064,1,17.4311,flydsl_mxpsh_96x64x256_F8_F8_B16_w3_x4_sk1,808.49,1582.84,0.0
gfx950,256,320,7168,7168,fp8,fp8,flydsl,44000,1,35.6084,flydsl_mxpsh_96x64x256_F8_F8_B16_w2_x4_sk1,923.47,1636.17,0.0
gfx950,256,320,7168,16384,fp8,fp8,flydsl,44577,2,65.3233,flydsl_mxpsh_96x128x256_F8_F8_B16_w1_x4_sk2,1150.61,1948.32,0.0
gfx950,256,352,7168,384,fp8,fp8,flydsl,39968,1,6.6471,flydsl_mxpsh_64x64x128_F8_F8_B16_w4_x4_sk1,291.52,1193.6,0.0
gfx950,256,352,7168,3072,fp8,fp8,flydsl,43872,1,17.6192,flydsl_mxpsh_96x64x256_F8_F8_B16_w0_x4_sk1,879.84,1597.56,0.0
gfx950,256,352,7168,7168,fp8,fp8,flydsl,43936,1,35.4549,flydsl_mxpsh_96x64x256_F8_F8_B16_w1_x4_sk1,1020.22,1662.67,0.0
gfx950,256,352,7168,16384,fp8,fp8,flydsl,44513,2,66.0757,flydsl_mxpsh_96x128x256_F8_F8_B16_w0_x4_sk2,1251.26,1941.02,0.0
gfx950,256,384,7168,384,fp8,fp8,flydsl,39776,1,6.7024,flydsl_mxpsh_64x64x128_F8_F8_B16_w1_x4_sk1,315.4,1254.03,0.0
gfx950,256,384,7168,3072,fp8,fp8,flydsl,43936,1,17.8828,flydsl_mxpsh_96x64x256_F8_F8_B16_w1_x4_sk1,945.68,1605.16,0.0
gfx950,256,384,7168,7168,fp8,fp8,flydsl,44000,1,36.0617,flydsl_mxpsh_96x64x256_F8_F8_B16_w2_x4_sk1,1094.24,1653.77,0.0
gfx950,256,384,7168,16384,fp8,fp8,flydsl,44577,2,67.5956,flydsl_mxpsh_96x128x256_F8_F8_B16_w1_x4_sk2,1334.32,1911.91,0.0
gfx950,256,416,7168,384,fp8,fp8,flydsl,40352,1,6.9866,flydsl_mxpsh_64x128x128_F8_F8_B16_w0_x4_sk1,327.78,1270.44,0.0
gfx950,256,416,7168,3072,fp8,fp8,flydsl,47840,1,19.681,flydsl_mxpsh_128x64x256_F8_F8_B16_w2_x4_sk1,930.88,1486.81,0.0
gfx950,256,416,7168,7168,fp8,fp8,flydsl,47968,1,40.9507,flydsl_mxpsh_128x64x256_F8_F8_B16_w4_x4_sk1,1043.9,1473.13,0.0
gfx950,256,416,7168,16384,fp8,fp8,flydsl,48609,2,79.4882,flydsl_mxpsh_128x128x256_F8_F8_B16_w4_x4_sk2,1229.25,1638.23,0.0
gfx950,256,448,7168,384,fp8,fp8,flydsl,40352,1,7.1231,flydsl_mxpsh_64x128x128_F8_F8_B16_w0_x4_sk1,346.23,1312.22,0.0
gfx950,256,448,7168,3072,fp8,fp8,flydsl,47840,1,20.1317,flydsl_mxpsh_128x64x256_F8_F8_B16_w2_x4_sk1,980.05,1481.19,0.0
gfx950,256,448,7168,7168,fp8,fp8,flydsl,47712,1,41.4566,flydsl_mxpsh_128x64x256_F8_F8_B16_w0_x4_sk1,1110.48,1471.76,0.0
gfx950,256,448,7168,16384,fp8,fp8,flydsl,48353,2,80.5442,flydsl_mxpsh_128x128x256_F8_F8_B16_w0_x4_sk2,1306.45,1628.96,0.0
gfx950,256,480,7168,384,fp8,fp8,flydsl,40544,1,7.4003,flydsl_mxpsh_64x128x128_F8_F8_B16_w3_x4_sk1,357.07,1326.72,0.0
gfx950,256,480,7168,3072,fp8,fp8,flydsl,47712,1,19.9262,flydsl_mxpsh_128x64x256_F8_F8_B16_w0_x4_sk1,1060.88,1524.42,0.0
gfx950,256,480,7168,7168,fp8,fp8,flydsl,40800,1,41.9231,flydsl_mxpsh_64x128x256_F8_F8_B16_w2_x4_sk1,1176.56,1471.79,0.0
gfx950,256,480,7168,16384,fp8,fp8,flydsl,48353,2,83.0061,flydsl_mxpsh_128x128x256_F8_F8_B16_w0_x4_sk2,1358.25,1592.49,0.0
gfx950,256,512,7168,384,fp8,fp8,flydsl,40352,1,7.4967,flydsl_mxpsh_64x128x128_F8_F8_B16_w0_x4_sk1,375.98,1372.49,0.0
gfx950,256,512,7168,3072,fp8,fp8,flydsl,40672,1,20.5218,flydsl_mxpsh_64x128x256_F8_F8_B16_w0_x4_sk1,1098.76,1507.32,0.0
gfx950,256,512,7168,7168,fp8,fp8,flydsl,47712,1,41.8594,flydsl_mxpsh_128x64x256_F8_F8_B16_w0_x4_sk1,1256.91,1490.47,0.0
gfx950,256,512,7168,16384,fp8,fp8,flydsl,48545,2,86.6471,flydsl_mxpsh_128x128x256_F8_F8_B16_w3_x4_sk2,1387.92,1536.91,0.0
gfx950,256,544,7168,384,fp8,fp8,flydsl,40352,1,7.615,flydsl_mxpsh_64x128x128_F8_F8_B16_w0_x4_sk1,393.27,1413.03,0.0
gfx950,256,544,7168,3072,fp8,fp8,flydsl,40800,1,21.5018,flydsl_mxpsh_64x128x256_F8_F8_B16_w2_x4_sk1,1114.23,1464.53,0.0
gfx950,256,544,7168,7168,fp8,fp8,flydsl,40864,1,44.8785,flydsl_mxpsh_64x128x256_F8_F8_B16_w3_x4_sk1,1245.62,1405.54,0.0
gfx950,256,544,7168,16384,fp8,fp8,flydsl,40800,1,99.6662,flydsl_mxpsh_64x128x256_F8_F8_B16_w2_x4_sk1,1282.03,1346.01,0.0
gfx950,256,576,7168,384,fp8,fp8,flydsl,40416,1,7.7574,flydsl_mxpsh_64x128x128_F8_F8_B16_w1_x4_sk1,408.76,1447.81,0.0
gfx950,256,576,7168,3072,fp8,fp8,flydsl,40800,1,21.7148,flydsl_mxpsh_64x128x256_F8_F8_B16_w2_x4_sk1,1168.2,1475.82,0.0
gfx950,256,576,7168,7168,fp8,fp8,flydsl,40864,1,47.523,flydsl_mxpsh_64x128x256_F8_F8_B16_w3_x4_sk1,1245.5,1341.8,0.0
gfx950,256,576,7168,16384,fp8,fp8,flydsl,40800,1,100.093,flydsl_mxpsh_64x128x256_F8_F8_B16_w2_x4_sk1,1351.66,1350.1,0.0
gfx950,256,608,7168,384,fp8,fp8,flydsl,44320,1,8.1105,flydsl_mxpsh_96x128x128_F8_F8_B16_w2_x4_sk1,412.68,1442.85,0.0
gfx950,256,608,7168,3072,fp8,fp8,flydsl,44576,1,24.9774,flydsl_mxpsh_96x128x256_F8_F8_B16_w1_x4_sk1,1072.03,1305.35,0.0
gfx950,256,608,7168,7168,fp8,fp8,flydsl,44768,1,53.6709,flydsl_mxpsh_96x128x256_F8_F8_B16_w4_x4_sk1,1164.1,1200.92,0.0
gfx950,256,608,7168,16384,fp8,fp8,flydsl,44640,1,109.4799,flydsl_mxpsh_96x128x256_F8_F8_B16_w2_x4_sk1,1304.42,1243.32,0.0
gfx950,256,640,7168,384,fp8,fp8,flydsl,44256,1,8.2374,flydsl_mxpsh_96x128x128_F8_F8_B16_w1_x4_sk1,427.71,1477.81,0.0
gfx950,256,640,7168,3072,fp8,fp8,flydsl,44768,1,25.3038,flydsl_mxpsh_96x128x256_F8_F8_B16_w4_x4_sk1,1113.89,1310.52,0.0
gfx950,256,640,7168,7168,fp8,fp8,flydsl,44512,1,55.4762,flydsl_mxpsh_96x128x256_F8_F8_B16_w0_x4_sk1,1185.49,1174.25,0.0
gfx950,256,640,7168,16384,fp8,fp8,flydsl,44512,1,109.5867,flydsl_mxpsh_96x128x256_F8_F8_B16_w0_x4_sk1,1371.73,1251.08,0.0
gfx950,256,672,7168,384,fp8,fp8,flydsl,44384,1,8.4378,flydsl_mxpsh_96x128x128_F8_F8_B16_w3_x4_sk1,438.43,1498.54,0.0
gfx950,256,672,7168,3072,fp8,fp8,flydsl,44576,1,25.4554,flydsl_mxpsh_96x128x256_F8_F8_B16_w1_x4_sk1,1162.62,1324.6,0.0
gfx950,256,672,7168,7168,fp8,fp8,flydsl,44768,1,55.7917,flydsl_mxpsh_96x128x256_F8_F8_B16_w4_x4_sk1,1237.73,1179.94,0.0
gfx950,256,672,7168,16384,fp8,fp8,flydsl,44576,1,109.2891,flydsl_mxpsh_96x128x256_F8_F8_B16_w1_x4_sk1,1444.24,1263.48,0.0
gfx950,256,704,7168,384,fp8,fp8,flydsl,44384,1,8.6051,flydsl_mxpsh_96x128x128_F8_F8_B16_w3_x4_sk1,450.38,1524.14,0.0
gfx950,256,704,7168,3072,fp8,fp8,flydsl,44576,1,25.0428,flydsl_mxpsh_96x128x256_F8_F8_B16_w1_x4_sk1,1238.05,1368.67,0.0
gfx950,256,704,7168,7168,fp8,fp8,flydsl,44768,1,54.1918,flydsl_mxpsh_96x128x256_F8_F8_B16_w4_x4_sk1,1334.95,1227.47,0.0
gfx950,256,704,7168,16384,fp8,fp8,flydsl,44640,1,109.3851,flydsl_mxpsh_96x128x256_F8_F8_B16_w2_x4_sk1,1511.69,1271.36,0.0
gfx950,256,736,7168,384,fp8,fp8,flydsl,44192,1,8.7042,flydsl_mxpsh_96x128x128_F8_F8_B16_w0_x4_sk1,465.49,1560.91,0.0
gfx950,256,736,7168,3072,fp8,fp8,flydsl,44768,1,25.2103,flydsl_mxpsh_96x128x256_F8_F8_B16_w4_x4_sk1,1285.73,1381.67,0.0
gfx950,256,736,7168,7168,fp8,fp8,flydsl,44576,1,54.757,flydsl_mxpsh_96x128x256_F8_F8_B16_w1_x4_sk1,1381.22,1227.37,0.0
gfx950,256,736,7168,16384,fp8,fp8,flydsl,44512,1,110.6279,flydsl_mxpsh_96x128x256_F8_F8_B16_w0_x4_sk1,1562.65,1265.96,0.0
gfx950,256,768,7168,384,fp8,fp8,flydsl,44256,1,8.9026,flydsl_mxpsh_96x128x128_F8_F8_B16_w1_x4_sk1,474.9,1579.03,0.0
gfx950,256,768,7168,3072,fp8,fp8,flydsl,44768,1,25.3288,flydsl_mxpsh_96x128x256_F8_F8_B16_w4_x4_sk1,1335.35,1397.2,0.0
gfx950,256,768,7168,7168,fp8,fp8,flydsl,44512,1,55.6877,flydsl_mxpsh_96x128x256_F8_F8_B16_w0_x4_sk1,1417.19,1219.22,0.0
gfx950,256,768,7168,16384,fp8,fp8,flydsl,44512,1,111.9527,flydsl_mxpsh_96x128x256_F8_F8_B16_w0_x4_sk1,1611.29,1259.76,0.0
gfx950,256,800,7168,384,fp8,fp8,flydsl,44384,1,9.1053,flydsl_mxpsh_96x128x128_F8_F8_B16_w3_x4_sk1,483.68,1595.61,0.0
gfx950,256,800,7168,3072,fp8,fp8,flydsl,44640,1,26.5899,flydsl_mxpsh_96x128x256_F8_F8_B16_w2_x4_sk1,1325.02,1351.89,0.0
gfx950,256,800,7168,7168,fp8,fp8,flydsl,44512,1,59.9273,flydsl_mxpsh_96x128x256_F8_F8_B16_w0_x4_sk1,1371.8,1144.44,0.0
gfx950,256,800,7168,16384,fp8,fp8,flydsl,44768,1,119.1019,flydsl_mxpsh_96x128x256_F8_F8_B16_w4_x4_sk1,1577.68,1192.4,0.0
gfx950,256,832,7168,384,fp8,fp8,flydsl,44256,1,9.2439,flydsl_mxpsh_96x128x128_F8_F8_B16_w1_x4_sk1,495.48,1622.64,0.0
gfx950,256,832,7168,3072,fp8,fp8,flydsl,44576,1,26.7681,flydsl_mxpsh_96x128x256_F8_F8_B16_w1_x4_sk1,1368.85,1363.7,0.0
gfx950,256,832,7168,7168,fp8,fp8,flydsl,44512,1,60.7472,flydsl_mxpsh_96x128x256_F8_F8_B16_w0_x4_sk1,1407.42,1140.33,0.0
gfx950,256,832,7168,16384,fp8,fp8,flydsl,44512,1,119.6429,flydsl_mxpsh_96x128x256_F8_F8_B16_w0_x4_sk1,1633.37,1195.22,0.0
gfx950,256,864,7168,384,fp8,fp8,flydsl,44384,1,9.3624,flydsl_mxpsh_96x128x128_F8_F8_B16_w3_x4_sk1,508.03,1652.42,0.0
gfx950,256,864,7168,3072,fp8,fp8,flydsl,44576,1,26.7581,flydsl_mxpsh_96x128x256_F8_F8_B16_w1_x4_sk1,1422.03,1385.02,0.0
gfx950,256,864,7168,7168,fp8,fp8,flydsl,44768,1,61.3255,flydsl_mxpsh_96x128x256_F8_F8_B16_w4_x4_sk1,1447.77,1140.79,0.0
gfx950,256,864,7168,16384,fp8,fp8,flydsl,44512,1,122.0699,flydsl_mxpsh_96x128x256_F8_F8_B16_w0_x4_sk1,1662.47,1179.51,0.0
gfx950,256,896,7168,384,fp8,fp8,flydsl,48160,1,9.6234,flydsl_mxpsh_128x128x128_F8_F8_B16_w2_x4_sk1,512.55,1656.55,0.0
gfx950,256,896,7168,3072,fp8,fp8,flydsl,48480,1,28.4933,flydsl_mxpsh_128x128x256_F8_F8_B16_w2_x4_sk1,1384.89,1320.23,0.0
gfx950,256,896,7168,7168,fp8,fp8,flydsl,48352,1,62.2115,flydsl_mxpsh_128x128x256_F8_F8_B16_w0_x4_sk1,1480.01,1135.61,0.0
gfx950,256,896,7168,16384,fp8,fp8,flydsl,48544,1,134.9411,flydsl_mxpsh_128x128x256_F8_F8_B16_w3_x4_sk1,1559.59,1074.29,0.0
gfx950,256,928,7168,384,fp8,fp8,flydsl,48032,1,9.8185,flydsl_mxpsh_128x128x128_F8_F8_B16_w0_x4_sk1,520.31,1671.61,0.0
gfx950,256,928,7168,3072,fp8,fp8,flydsl,48608,1,28.8258,flydsl_mxpsh_128x128x256_F8_F8_B16_w4_x4_sk1,1417.8,1324.32,0.0
gfx950,256,928,7168,7168,fp8,fp8,flydsl,48608,1,63.9067,flydsl_mxpsh_128x128x256_F8_F8_B16_w4_x4_sk1,1492.2,1116.25,0.0
gfx950,256,928,7168,16384,fp8,fp8,flydsl,48416,1,135.6424,flydsl_mxpsh_128x128x256_F8_F8_B16_w1_x4_sk1,1606.94,1075.98,0.0
gfx950,256,960,7168,384,fp8,fp8,flydsl,48160,1,9.9149,flydsl_mxpsh_128x128x128_F8_F8_B16_w2_x4_sk1,533.02,1702.86,0.0
gfx950,256,960,7168,3072,fp8,fp8,flydsl,48352,1,28.8575,flydsl_mxpsh_128x128x256_F8_F8_B16_w0_x4_sk1,1465.08,1342.17,0.0
gfx950,256,960,7168,7168,fp8,fp8,flydsl,48416,1,64.029,flydsl_mxpsh_128x128x256_F8_F8_B16_w1_x4_sk1,1540.71,1124.87,0.0
gfx950,256,960,7168,16384,fp8,fp8,flydsl,48608,1,137.5284,flydsl_mxpsh_128x128x256_F8_F8_B16_w4_x4_sk1,1639.56,1068.37,0.0
gfx950,256,992,7168,384,fp8,fp8,flydsl,48096,1,9.964,flydsl_mxpsh_128x128x128_F8_F8_B16_w1_x4_sk1,548.07,1741.75,0.0
gfx950,256,992,7168,3072,fp8,fp8,flydsl,48544,1,29.387,flydsl_mxpsh_128x128x256_F8_F8_B16_w3_x4_sk1,1486.64,1336.95,0.0
gfx950,256,992,7168,7168,fp8,fp8,flydsl,48352,1,64.6314,flydsl_mxpsh_128x128x256_F8_F8_B16_w0_x4_sk1,1577.23,1125.03,0.0
gfx950,256,992,7168,16384,fp8,fp8,flydsl,48416,1,138.764,flydsl_mxpsh_128x128x256_F8_F8_B16_w1_x4_sk1,1679.12,1065.94,0.0
gfx950,256,1024,7168,384,fp8,fp8,flydsl,48096,1,10.0856,flydsl_mxpsh_128x128x128_F8_F8_B16_w1_x4_sk1,558.93,1767.45,0.0
gfx950,256,1024,7168,3072,fp8,fp8,flydsl,48480,1,29.1076,flydsl_mxpsh_128x128x256_F8_F8_B16_w2_x4_sk1,1549.33,1368.92,0.0
gfx950,256,1024,7168,7168,fp8,fp8,flydsl,48352,1,65.3906,flydsl_mxpsh_128x128x256_F8_F8_B16_w0_x4_sk1,1609.2,1122.49,0.0
gfx950,256,1024,7168,16384,fp8,fp8,flydsl,48224,1,141.3899,flydsl_mxpsh_128x128x128_F8_F8_B16_w3_x4_sk1,1701.1,1053.1,0.0
gfx950,256,1088,7168,384,fp8,fp8,flydsl,48032,1,10.4254,flydsl_mxpsh_128x128x128_F8_F8_B16_w0_x4_sk1,574.51,1800.21,0.0
gfx950,256,1088,7168,3072,fp8,fp8,flydsl,48544,1,30.4754,flydsl_mxpsh_128x128x256_F8_F8_B16_w3_x4_sk1,1572.28,1344.03,0.0
gfx950,256,1088,7168,7168,fp8,fp8,flydsl,48480,1,69.4406,flydsl_mxpsh_128x128x256_F8_F8_B16_w2_x4_sk1,1610.06,1076.84,0.0
gfx950,256,1088,7168,16384,fp8,fp8,flydsl,48224,1,148.8964,flydsl_mxpsh_128x128x128_F8_F8_B16_w3_x4_sk1,1716.3,1013.21,0.0
gfx950,256,1152,7168,384,fp8,fp8,flydsl,48160,1,10.6763,flydsl_mxpsh_128x128x128_F8_F8_B16_w2_x4_sk1,594.01,1846.14,0.0
gfx950,256,1152,7168,3072,fp8,fp8,flydsl,48480,1,31.1282,flydsl_mxpsh_128x128x256_F8_F8_B16_w2_x4_sk1,1629.85,1351.64,0.0
gfx950,256,1152,7168,7168,fp8,fp8,flydsl,48544,1,71.715,flydsl_mxpsh_128x128x256_F8_F8_B16_w3_x4_sk1,1650.7,1061.88,0.0
gfx950,256,1152,7168,16384,fp8,fp8,flydsl,48480,1,150.6574,flydsl_mxpsh_128x128x256_F8_F8_B16_w2_x4_sk1,1796.01,1014.42,0.0
gfx950,256,1216,7168,384,fp8,fp8,flydsl,44192,1,11.1806,flydsl_mxpsh_96x128x128_F8_F8_B16_w0_x4_sk1,598.73,1847.13,0.0
gfx950,256,1216,7168,3072,fp8,fp8,flydsl,44320,1,35.1177,flydsl_mxpsh_96x128x128_F8_F8_B16_w2_x4_sk1,1524.95,1229.81,0.0
gfx950,256,1216,7168,7168,fp8,fp8,flydsl,44448,1,80.8291,flydsl_mxpsh_96x128x128_F8_F8_B16_w4_x4_sk1,1545.94,959.17,0.0
gfx950,256,1216,7168,16384,fp8,fp8,flydsl,44384,1,165.5965,flydsl_mxpsh_96x128x128_F8_F8_B16_w3_x4_sk1,1724.77,934.78,0.0
gfx950,256,1280,7168,384,fp8,fp8,flydsl,44832,1,11.6708,flydsl_mxpsh_96x256x128_F8_F8_B16_w0_x4_sk1,603.77,1850.27,0.0
gfx950,256,1280,7168,3072,fp8,fp8,flydsl,23264,1,39.636,flydsl_mxpsh_128x128x128_F8_F8_B16_w3_x4_sk1,1422.23,1117.73,0.0
gfx950,256,1280,7168,7168,fp8,fp8,flydsl,48032,1,86.3492,flydsl_mxpsh_128x128x128_F8_F8_B16_w0_x4_sk1,1523.27,913.79,0.0
gfx950,256,1280,7168,16384,fp8,fp8,flydsl,48224,1,185.5005,flydsl_mxpsh_128x128x128_F8_F8_B16_w3_x4_sk1,1620.74,845.08,0.0
gfx950,256,1344,7168,384,fp8,fp8,flydsl,44832,1,11.9046,flydsl_mxpsh_96x256x128_F8_F8_B16_w0_x4_sk1,621.5,1893.07,0.0
gfx950,256,1344,7168,3072,fp8,fp8,flydsl,48224,1,40.0443,flydsl_mxpsh_128x128x128_F8_F8_B16_w3_x4_sk1,1478.11,1134.16,0.0
gfx950,256,1344,7168,7168,fp8,fp8,flydsl,48224,1,88.37,flydsl_mxpsh_128x128x128_F8_F8_B16_w3_x4_sk1,1562.86,908.47,0.0
gfx950,256,1344,7168,16384,fp8,fp8,flydsl,48224,1,191.2456,flydsl_mxpsh_128x128x128_F8_F8_B16_w3_x4_sk1,1650.65,829.97,0.0
gfx950,256,1408,7168,384,fp8,fp8,flydsl,44896,1,11.8906,flydsl_mxpsh_96x256x128_F8_F8_B16_w1_x4_sk1,651.87,1974.52,0.0
gfx950,256,1408,7168,3072,fp8,fp8,flydsl,48224,1,41.4259,flydsl_mxpsh_128x128x128_F8_F8_B16_w3_x4_sk1,1496.86,1123.22,0.0
gfx950,256,1408,7168,7168,fp8,fp8,flydsl,48032,1,89.6908,flydsl_mxpsh_128x128x128_F8_F8_B16_w0_x4_sk1,1613.17,910.44,0.0
gfx950,256,1408,7168,16384,fp8,fp8,flydsl,48224,1,191.7645,flydsl_mxpsh_128x128x128_F8_F8_B16_w3_x4_sk1,1724.58,837.98,0.0
gfx950,256,1472,7168,384,fp8,fp8,flydsl,48032,1,12.1639,flydsl_mxpsh_128x128x128_F8_F8_B16_w0_x4_sk1,666.18,2007.61,0.0
gfx950,256,1472,7168,3072,fp8,fp8,flydsl,48224,1,41.0355,flydsl_mxpsh_128x128x128_F8_F8_B16_w3_x4_sk1,1579.78,1161.06,0.0
gfx950,256,1472,7168,7168,fp8,fp8,flydsl,48160,1,89.2252,flydsl_mxpsh_128x128x128_F8_F8_B16_w2_x4_sk1,1695.3,930.61,0.0
gfx950,256,1472,7168,16384,fp8,fp8,flydsl,48224,1,192.7628,flydsl_mxpsh_128x128x128_F8_F8_B16_w3_x4_sk1,1793.63,843.84,0.0
gfx950,256,1536,7168,384,fp8,fp8,flydsl,48032,1,12.3078,flydsl_mxpsh_128x128x128_F8_F8_B16_w0_x4_sk1,687.02,2060.68,0.0
gfx950,256,1536,7168,3072,fp8,fp8,flydsl,48224,1,40.7002,flydsl_mxpsh_128x128x128_F8_F8_B16_w3_x4_sk1,1662.05,1198.0,0.0
gfx950,256,1536,7168,7168,fp8,fp8,flydsl,48096,1,90.5686,flydsl_mxpsh_128x128x128_F8_F8_B16_w1_x4_sk1,1742.77,932.0,0.0
gfx950,256,1536,7168,16384,fp8,fp8,flydsl,48224,1,194.6628,flydsl_mxpsh_128x128x128_F8_F8_B16_w3_x4_sk1,1853.34,845.7,0.0
gfx950,256,1600,7168,384,fp8,fp8,flydsl,48160,1,12.5698,flydsl_mxpsh_128x128x128_F8_F8_B16_w2_x4_sk1,700.73,2092.68,0.0
gfx950,256,1600,7168,3072,fp8,fp8,flydsl,48160,1,43.6728,flydsl_mxpsh_128x128x128_F8_F8_B16_w2_x4_sk1,1613.46,1141.97,0.0
gfx950,256,1600,7168,7168,fp8,fp8,flydsl,48224,1,94.1833,flydsl_mxpsh_128x128x128_F8_F8_B16_w3_x4_sk1,1745.71,910.85,0.0
gfx950,256,1600,7168,16384,fp8,fp8,flydsl,48224,1,205.041,flydsl_mxpsh_128x128x128_F8_F8_B16_w3_x4_sk1,1832.85,812.48,0.0
gfx950,256,1664,7168,384,fp8,fp8,flydsl,48160,1,12.642,flydsl_mxpsh_128x128x128_F8_F8_B16_w2_x4_sk1,724.6,2155.24,0.0
gfx950,256,1664,7168,3072,fp8,fp8,flydsl,48160,1,44.4785,flydsl_mxpsh_128x128x128_F8_F8_B16_w2_x4_sk1,1647.6,1146.33,0.0
gfx950,256,1664,7168,7168,fp8,fp8,flydsl,48160,1,96.2752,flydsl_mxpsh_128x128x128_F8_F8_B16_w2_x4_sk1,1776.09,905.35,0.0
gfx950,256,1664,7168,16384,fp8,fp8,flydsl,48224,1,208.4773,flydsl_mxpsh_128x128x128_F8_F8_B16_w3_x4_sk1,1874.75,808.52,0.0
gfx950,256,1728,7168,384,fp8,fp8,flydsl,41056,1,13.0448,flydsl_mxpsh_64x256x128_F8_F8_B16_w1_x4_sk1,729.23,2160.91,0.0
gfx950,256,1728,7168,3072,fp8,fp8,flydsl,44896,1,46.0915,flydsl_mxpsh_96x256x128_F8_F8_B16_w1_x4_sk1,1651.1,1130.38,0.0
gfx950,256,1728,7168,7168,fp8,fp8,flydsl,44832,1,98.1573,flydsl_mxpsh_96x256x128_F8_F8_B16_w0_x4_sk1,1809.04,902.01,0.0
gfx950,256,1728,7168,16384,fp8,fp8,flydsl,44896,1,213.9952,flydsl_mxpsh_96x256x128_F8_F8_B16_w1_x4_sk1,1896.65,796.86,0.0
gfx950,256,1792,7168,384,fp8,fp8,flydsl,44256,1,14.3567,flydsl_mxpsh_96x128x128_F8_F8_B16_w1_x4_sk1,687.14,2029.07,0.0
gfx950,256,1792,7168,3072,fp8,fp8,flydsl,48672,1,50.8749,flydsl_mxpsh_128x256x128_F8_F8_B16_w0_x4_sk1,1551.26,1046.0,0.0
gfx950,256,1792,7168,7168,fp8,fp8,flydsl,48736,1,107.6726,flydsl_mxpsh_128x256x128_F8_F8_B16_w1_x4_sk1,1710.25,835.08,0.0
gfx950,256,1792,7168,16384,fp8,fp8,flydsl,48672,1,228.2213,flydsl_mxpsh_128x256x128_F8_F8_B16_w0_x4_sk1,1844.29,755.8,0.0
gfx950,256,1856,7168,384,fp8,fp8,flydsl,21152,1,14.445,flydsl_mxpsh_96x128x128_F8_F8_B16_w0_x4_sk1,707.33,2081.89,0.0
gfx950,256,1856,7168,3072,fp8,fp8,flydsl,48736,1,52.3607,flydsl_mxpsh_128x256x128_F8_F8_B16_w1_x4_sk1,1561.07,1037.6,0.0
gfx950,256,1856,7168,7168,fp8,fp8,flydsl,48672,1,111.04,flydsl_mxpsh_128x256x128_F8_F8_B16_w0_x4_sk1,1717.61,822.15,0.0
gfx950,256,1856,7168,16384,fp8,fp8,flydsl,48800,1,240.3559,flydsl_mxpsh_128x256x128_F8_F8_B16_w2_x4_sk1,1813.72,725.83,0.0
gfx950,256,1920,7168,384,fp8,fp8,flydsl,44384,1,14.5923,flydsl_mxpsh_96x128x128_F8_F8_B16_w3_x4_sk1,724.33,2125.43,0.0
gfx950,256,1920,7168,3072,fp8,fp8,flydsl,48672,1,52.7083,flydsl_mxpsh_128x256x128_F8_F8_B16_w0_x4_sk1,1604.25,1051.89,0.0
gfx950,256,1920,7168,7168,fp8,fp8,flydsl,48800,1,109.9854,flydsl_mxpsh_128x256x128_F8_F8_B16_w2_x4_sk1,1793.88,842.55,0.0
gfx950,256,1920,7168,16384,fp8,fp8,flydsl,48672,1,241.1696,flydsl_mxpsh_128x256x128_F8_F8_B16_w0_x4_sk1,1869.94,731.53,0.0
gfx950,256,1984,7168,384,fp8,fp8,flydsl,48032,1,14.6244,flydsl_mxpsh_128x128x128_F8_F8_B16_w0_x4_sk1,746.83,2185.18,0.0
gfx950,256,1984,7168,3072,fp8,fp8,flydsl,48736,1,51.8727,flydsl_mxpsh_128x256x128_F8_F8_B16_w1_x4_sk1,1684.43,1090.31,0.0
gfx950,256,1984,7168,7168,fp8,fp8,flydsl,48800,1,110.2424,flydsl_mxpsh_128x256x128_F8_F8_B16_w2_x4_sk1,1849.35,853.07,0.0
gfx950,256,1984,7168,16384,fp8,fp8,flydsl,48672,1,228.5071,flydsl_mxpsh_128x256x128_F8_F8_B16_w0_x4_sk1,2039.34,780.67,0.0
gfx950,256,2048,7168,384,fp8,fp8,flydsl,48032,1,14.8591,flydsl_mxpsh_128x128x128_F8_F8_B16_w0_x4_sk1,758.75,2214.07,0.0
gfx950,256,2048,7168,3072,fp8,fp8,flydsl,23776,1,51.6184,flydsl_mxpsh_128x256x128_F8_F8_B16_w1_x4_sk1,1747.33,1117.27,0.0
gfx950,256,2048,7168,7168,fp8,fp8,flydsl,48736,1,109.5381,flydsl_mxpsh_128x256x128_F8_F8_B16_w1_x4_sk1,1921.28,871.12,0.0
gfx950,256,2048,7168,16384,fp8,fp8,flydsl,48736,1,232.2047,flydsl_mxpsh_128x256x128_F8_F8_B16_w1_x4_sk1,2071.6,776.71,0.0
gfx950,256,4096,7168,384,fp8,fp8,flydsl,40992,1,23.6895,flydsl_mxpsh_64x256x128_F8_F8_B16_w0_x4_sk1,951.84,2661.33,0.0
gfx950,256,4096,7168,3072,fp8,fp8,flydsl,48800,1,95.3575,flydsl_mxpsh_128x256x128_F8_F8_B16_w2_x4_sk1,1891.71,978.67,0.0
gfx950,256,4096,7168,7168,fp8,fp8,flydsl,48800,1,190.412,flydsl_mxpsh_128x256x128_F8_F8_B16_w2_x4_sk1,2210.51,732.42,0.0
gfx950,256,4096,7168,16384,fp8,fp8,flydsl,48800,1,422.0761,flydsl_mxpsh_128x256x128_F8_F8_B16_w2_x4_sk1,2279.38,576.36,0.0
gfx950,256,6144,7168,384,fp8,fp8,flydsl,44960,1,32.1713,flydsl_mxpsh_96x256x128_F8_F8_B16_w2_x4_sk1,1051.34,2896.75,0.0
gfx950,256,6144,7168,3072,fp8,fp8,flydsl,48736,1,134.5866,flydsl_mxpsh_128x256x128_F8_F8_B16_w1_x4_sk1,2010.47,958.3,0.0
gfx950,256,6144,7168,7168,fp8,fp8,flydsl,48800,1,276.2652,flydsl_mxpsh_128x256x128_F8_F8_B16_w2_x4_sk1,2285.34,664.22,0.0
gfx950,256,6144,7168,16384,fp8,fp8,flydsl,48736,1,615.409,flydsl_mxpsh_128x256x128_F8_F8_B16_w1_x4_sk1,2344.96,497.53,0.0
gfx950,256,8192,7168,384,fp8,fp8,flydsl,44896,1,42.363,flydsl_mxpsh_96x256x128_F8_F8_B16_w1_x4_sk1,1064.54,2911.47,0.0
gfx950,256,8192,7168,3072,fp8,fp8,flydsl,48800,1,165.3518,flydsl_mxpsh_128x256x128_F8_F8_B16_w2_x4_sk1,2181.88,995.61,0.0
gfx950,256,8192,7168,7168,fp8,fp8,flydsl,48672,1,341.0206,flydsl_mxpsh_128x256x128_F8_F8_B16_w0_x4_sk1,2468.51,667.24,0.0
gfx950,256,8192,7168,16384,fp8,fp8,flydsl,48640,1,755.8367,flydsl_mxpsh_128x256x128_F8_F8_B16_w0_x0_sk1,2545.72,488.33,0.0
gfx950,256,10240,7168,384,fp8,fp8,flydsl,44960,1,53.8124,flydsl_mxpsh_96x256x128_F8_F8_B16_w2_x4_sk1,1047.55,2852.23,0.0
gfx950,256,10240,7168,3072,fp8,fp8,flydsl,48672,1,200.4203,flydsl_mxpsh_128x256x128_F8_F8_B16_w0_x4_sk1,2250.13,999.29,0.0
gfx950,256,10240,7168,7168,fp8,fp8,flydsl,48672,1,428.1117,flydsl_mxpsh_128x256x128_F8_F8_B16_w0_x4_sk1,2457.93,634.37,0.0
gfx950,256,10240,7168,16384,fp8,fp8,flydsl,48768,1,973.3037,flydsl_mxpsh_128x256x128_F8_F8_B16_w2_x0_sk1,2471.15,443.86,0.0
gfx950,256,12288,7168,384,fp8,fp8,flydsl,44832,1,60.6833,flydsl_mxpsh_96x256x128_F8_F8_B16_w0_x4_sk1,1114.73,3026.07,0.0
gfx950,256,12288,7168,3072,fp8,fp8,flydsl,48672,1,239.0455,flydsl_mxpsh_128x256x128_F8_F8_B16_w0_x4_sk1,2263.86,986.97,0.0
gfx950,256,12288,7168,7168,fp8,fp8,flydsl,48800,1,507.3275,flydsl_mxpsh_128x256x128_F8_F8_B16_w2_x4_sk1,2488.96,622.13,0.0
gfx950,256,12288,7168,16384,fp8,fp8,flydsl,48640,1,1194.6026,flydsl_mxpsh_128x256x128_F8_F8_B16_w0_x0_sk1,2416.05,414.3,0.0
gfx950,256,14336,7168,384,fp8,fp8,flydsl,44896,1,71.6414,flydsl_mxpsh_96x256x128_F8_F8_B16_w1_x4_sk1,1101.6,2984.01,0.0
gfx950,256,14336,7168,3072,fp8,fp8,flydsl,48672,1,277.2155,flydsl_mxpsh_128x256x128_F8_F8_B16_w0_x4_sk1,2277.51,979.68,0.0
gfx950,256,14336,7168,7168,fp8,fp8,flydsl,48672,1,598.1576,flydsl_mxpsh_128x256x128_F8_F8_B16_w0_x4_sk1,2462.85,601.28,0.0
gfx950,256,14336,7168,16384,fp8,fp8,flydsl,48704,1,1440.1636,flydsl_mxpsh_128x256x128_F8_F8_B16_w1_x0_sk1,2338.11,387.35,0.0
gfx950,256,16384,7168,384,fp8,fp8,flydsl,44896,1,80.2851,flydsl_mxpsh_96x256x128_F8_F8_B16_w1_x4_sk1,1123.43,3038.23,0.0
gfx950,256,16384,7168,3072,fp8,fp8,flydsl,48736,1,309.3735,flydsl_mxpsh_128x256x128_F8_F8_B16_w1_x4_sk1,2332.31,993.08,0.0
gfx950,256,16384,7168,7168,fp8,fp8,flydsl,48800,1,673.0503,flydsl_mxpsh_128x256x128_F8_F8_B16_w2_x4_sk1,2501.49,599.81,0.0
gfx950,256,16384,7168,16384,fp8,fp8,flydsl,48640,1,1663.7857,flydsl_mxpsh_128x256x128_F8_F8_B16_w0_x0_sk1,2312.97,373.1,0.0
gfx950,256,20480,7168,3072,fp8,fp8,flydsl,48800,1,385.5334,flydsl_mxpsh_128x256x128_F8_F8_B16_w2_x4_sk1,2339.47,981.85,0.0
gfx950,256,20480,7168,7168,fp8,fp8,flydsl,48672,1,859.2207,flydsl_mxpsh_128x256x128_F8_F8_B16_w0_x4_sk1,2449.35,572.36,0.0
gfx950,256,20480,7168,16384,fp8,fp8,flydsl,48800,1,2188.3985,flydsl_mxpsh_128x256x128_F8_F8_B16_w2_x4_sk1,2198.12,341.16,0.0
gfx950,256,24576,7168,3072,fp8,fp8,flydsl,48800,1,457.6674,flydsl_mxpsh_128x256x128_F8_F8_B16_w2_x4_sk1,2364.89,982.9,0.0
gfx950,256,24576,7168,7168,fp8,fp8,flydsl,48672,1,1055.201,flydsl_mxpsh_128x256x128_F8_F8_B16_w0_x4_sk1,2393.33,549.53,0.0
gfx950,256,24576,7168,16384,fp8,fp8,flydsl,48736,1,2566.3814,flydsl_mxpsh_128x256x128_F8_F8_B16_w1_x4_sk1,2249.25,339.94,0.0
gfx950,256,28672,7168,3072,fp8,fp8,flydsl,48672,1,530.3354,flydsl_mxpsh_128x256x128_F8_F8_B16_w0_x4_sk1,2380.98,982.67,0.0
gfx950,256,28672,7168,7168,fp8,fp8,flydsl,48704,1,1231.3193,flydsl_mxpsh_128x256x128_F8_F8_B16_w1_x0_sk1,2392.84,542.46,0.0
gfx950,256,28672,7168,16384,fp8,fp8,flydsl,48736,1,3040.0097,flydsl_mxpsh_128x256x128_F8_F8_B16_w1_x4_sk1,2215.29,328.37,0.0
gfx950,256,32768,7168,384,fp8,fp8,flydsl,44832,1,154.7838,flydsl_mxpsh_96x256x128_F8_F8_B16_w0_x4_sk1,1165.42,3134.03,0.0
gfx950,256,32768,7168,3072,fp8,fp8,flydsl,48736,1,603.1143,flydsl_mxpsh_128x256x128_F8_F8_B16_w1_x4_sk1,2392.76,982.31,0.0
gfx950,256,32768,7168,7168,fp8,fp8,flydsl,48672,1,1461.1701,flydsl_mxpsh_128x256x128_F8_F8_B16_w0_x4_sk1,2304.49,517.41,0.0
gfx950,256,32768,7168,16384,fp8,fp8,flydsl,48672,1,3430.9575,flydsl_mxpsh_128x256x128_F8_F8_B16_w0_x4_sk1,2243.28,327.63,0.0
gfx950,256,40960,7168,3072,fp8,fp8,flydsl,48736,1,759.4881,flydsl_mxpsh_128x256x128_F8_F8_B16_w1_x4_sk1,2375.13,967.83,0.0
gfx950,256,40960,7168,7168,fp8,fp8,flydsl,48800,1,1846.4168,flydsl_mxpsh_128x256x128_F8_F8_B16_w2_x4_sk1,2279.59,504.86,0.0
gfx950,256,40960,7168,16384,fp8,fp8,flydsl,48800,1,4257.3366,flydsl_mxpsh_128x256x128_F8_F8_B16_w2_x4_sk1,2259.8,323.14,0.0
gfx950,256,49152,7168,3072,fp8,fp8,flydsl,48736,1,941.3808,flydsl_mxpsh_128x256x128_F8_F8_B16_w1_x4_sk1,2299.46,932.31,0.0
gfx950,256,49152,7168,7168,fp8,fp8,flydsl,48736,1,2216.4395,flydsl_mxpsh_128x256x128_F8_F8_B16_w1_x4_sk1,2278.83,500.06,0.0
gfx950,256,49152,7168,16384,fp8,fp8,flydsl,48736,1,5094.1679,flydsl_mxpsh_128x256x128_F8_F8_B16_w1_x4_sk1,2266.29,319.46,0.0
gfx950,256,57344,7168,3072,fp8,fp8,flydsl,48640,1,1103.2575,flydsl_mxpsh_128x256x128_F8_F8_B16_w0_x0_sk1,2289.08,924.77,0.0
gfx950,256,57344,7168,7168,fp8,fp8,flydsl,48800,1,2640.9553,flydsl_mxpsh_128x256x128_F8_F8_B16_w2_x4_sk1,2231.27,486.38,0.0
gfx950,256,57344,7168,16384,fp8,fp8,flydsl,48736,1,5992.0987,flydsl_mxpsh_128x256x128_F8_F8_B16_w1_x4_sk1,2247.8,313.59,0.0
gfx950,256,65536,7168,3072,fp8,fp8,flydsl,48800,1,1293.3068,flydsl_mxpsh_128x256x128_F8_F8_B16_w2_x4_sk1,2231.66,899.15,0.0
gfx950,256,65536,7168,7168,fp8,fp8,flydsl,48736,1,2967.6111,flydsl_mxpsh_128x256x128_F8_F8_B16_w1_x4_sk1,2269.34,492.2,0.0
gfx950,256,65536,7168,16384,fp8,fp8,flydsl,48736,1,6822.8261,flydsl_mxpsh_128x256x128_F8_F8_B16_w1_x4_sk1,2256.13,312.29,0.0
gfx950,256,1,16384,1536,fp8,fp8,flydsl,35808,1,7.9108,flydsl_mxpsh_32x32x256_F8_F8_B16_w4_x4_sk1,6.36,3185.53,0.0
gfx950,256,4,16384,1536,fp8,fp8,flydsl,36160,1,8.1619,flydsl_mxpsh_32x64x256_F8_F8_B16_w0_x0_sk1,24.67,3100.14,0.0
gfx950,256,8,16384,1536,fp8,fp8,flydsl,35584,1,8.1209,flydsl_mxpsh_32x32x256_F8_F8_B16_w1_x0_sk1,49.58,3132.69,0.0
gfx950,256,16,16384,1536,fp8,fp8,flydsl,35648,1,8.2337,flydsl_mxpsh_32x32x256_F8_F8_B16_w2_x0_sk1,97.81,3123.1,0.0
gfx950,256,1,65536,1536,fp8,fp8,flydsl,36928,1,19.1749,flydsl_mxpsh_32x128x256_F8_F8_B16_w2_x0_sk1,10.5,5256.66,0.0
gfx950,256,2,65536,1536,fp8,fp8,flydsl,36800,1,19.1667,flydsl_mxpsh_32x128x256_F8_F8_B16_w0_x0_sk1,21.01,5265.83,0.0
gfx950,256,4,65536,1536,fp8,fp8,flydsl,37024,1,19.3124,flydsl_mxpsh_32x128x256_F8_F8_B16_w3_x4_sk1,41.7,5239.83,0.0
gfx950,256,8,65536,1536,fp8,fp8,flydsl,36992,1,19.6181,flydsl_mxpsh_32x128x256_F8_F8_B16_w3_x0_sk1,82.1,5185.22,0.0
gfx950,256,16,65536,1536,fp8,fp8,flydsl,37088,1,20.0707,flydsl_mxpsh_32x128x256_F8_F8_B16_w4_x4_sk1,160.49,5121.15,0.0
gfx950,256,32,65536,1536,fp8,fp8,flydsl,36352,1,20.7356,flydsl_mxpsh_32x64x256_F8_F8_B16_w3_x0_sk1,310.7,5059.26,0.0
gfx950,256,48,65536,1536,fp8,fp8,flydsl,44320,1,22.0608,flydsl_mxpsh_96x128x128_F8_F8_B16_w2_x4_sk1,438.05,4851.52,0.0
gfx950,256,64,65536,1536,fp8,fp8,flydsl,44448,1,23.3276,flydsl_mxpsh_96x128x128_F8_F8_B16_w4_x4_sk1,552.35,4679.02,0.0
gfx950,256,80,65536,1536,fp8,fp8,flydsl,44448,1,24.4829,flydsl_mxpsh_96x128x128_F8_F8_B16_w4_x4_sk1,657.85,4544.88,0.0
gfx950,256,96,65536,1536,fp8,fp8,flydsl,44416,1,25.5088,flydsl_mxpsh_96x128x128_F8_F8_B16_w4_x0_sk1,757.67,4445.28,0.0
gfx950,256,112,65536,1536,fp8,fp8,flydsl,48384,1,26.74,flydsl_mxpsh_128x128x256_F8_F8_B16_w1_x0_sk1,843.25,4319.95,0.0
gfx950,256,128,65536,1536,fp8,fp8,flydsl,48512,1,27.1005,flydsl_mxpsh_128x128x256_F8_F8_B16_w3_x0_sk1,950.9,4340.77,0.0
gfx950,256,144,65536,1536,fp8,fp8,flydsl,44896,1,31.2557,flydsl_mxpsh_96x256x128_F8_F8_B16_w1_x4_sk1,927.54,3831.58,0.0
gfx950,256,160,65536,1536,fp8,fp8,flydsl,44960,1,32.6348,flydsl_mxpsh_96x256x128_F8_F8_B16_w2_x4_sk1,987.05,3734.68,0.0
gfx950,256,176,65536,1536,fp8,fp8,flydsl,44960,1,33.2062,flydsl_mxpsh_96x256x128_F8_F8_B16_w2_x4_sk1,1067.07,3734.31,0.0
gfx950,256,192,65536,1536,fp8,fp8,flydsl,44832,1,34.2498,flydsl_mxpsh_96x256x128_F8_F8_B16_w0_x4_sk1,1128.61,3682.47,0.0
gfx950,256,208,65536,1536,fp8,fp8,flydsl,48800,1,36.0985,flydsl_mxpsh_128x256x128_F8_F8_B16_w2_x4_sk1,1160.05,3552.66,0.0
gfx950,256,224,65536,1536,fp8,fp8,flydsl,48800,1,36.2819,flydsl_mxpsh_128x256x128_F8_F8_B16_w2_x4_sk1,1242.97,3593.18,0.0
gfx950,256,240,65536,1536,fp8,fp8,flydsl,48672,1,37.3857,flydsl_mxpsh_128x256x128_F8_F8_B16_w0_x4_sk1,1292.43,3543.85,0.0
gfx950,256,256,65536,1536,fp8,fp8,flydsl,48672,1,38.3836,flydsl_mxpsh_128x256x128_F8_F8_B16_w0_x4_sk1,1342.75,3506.99,0.0
gfx950,256,288,65536,1536,fp8,fp8,flydsl,44192,1,50.3022,flydsl_mxpsh_96x128x128_F8_F8_B16_w0_x4_sk1,1152.67,2760.4,0.0
gfx950,256,320,65536,1536,fp8,fp8,flydsl,48032,1,54.4146,flydsl_mxpsh_128x128x128_F8_F8_B16_w0_x4_sk1,1183.96,2629.77,0.0
gfx950,256,352,65536,1536,fp8,fp8,flydsl,48160,1,56.7626,flydsl_mxpsh_128x128x128_F8_F8_B16_w2_x4_sk1,1248.48,2595.75,0.0
gfx950,256,384,65536,1536,fp8,fp8,flydsl,48736,1,57.7331,flydsl_mxpsh_128x256x128_F8_F8_B16_w1_x4_sk1,1339.08,2625.61,0.0
gfx950,256,416,65536,1536,fp8,fp8,flydsl,48800,1,63.9655,flydsl_mxpsh_128x256x128_F8_F8_B16_w2_x4_sk1,1309.33,2436.13,0.0
gfx950,256,448,65536,1536,fp8,fp8,flydsl,48800,1,66.9707,flydsl_mxpsh_128x256x128_F8_F8_B16_w2_x4_sk1,1346.77,2390.17,0.0
gfx950,256,480,65536,1536,fp8,fp8,flydsl,48736,1,69.3335,flydsl_mxpsh_128x256x128_F8_F8_B16_w1_x4_sk1,1393.8,2369.92,0.0
gfx950,256,512,65536,1536,fp8,fp8,flydsl,48736,1,71.3976,flydsl_mxpsh_128x256x128_F8_F8_B16_w1_x4_sk1,1443.74,2360.84,0.0
gfx950,256,544,65536,1536,fp8,fp8,flydsl,44960,1,82.696,flydsl_mxpsh_96x256x128_F8_F8_B16_w2_x4_sk1,1324.39,2089.61,0.0
gfx950,256,576,65536,1536,fp8,fp8,flydsl,48672,1,84.1549,flydsl_mxpsh_128x256x128_F8_F8_B16_w0_x4_sk1,1377.98,2103.81,0.0
gfx950,256,608,65536,1536,fp8,fp8,flydsl,48672,1,86.5469,flydsl_mxpsh_128x256x128_F8_F8_B16_w0_x4_sk1,1414.34,2094.69,0.0
gfx950,256,640,65536,1536,fp8,fp8,flydsl,48800,1,87.2773,flydsl_mxpsh_128x256x128_F8_F8_B16_w2_x4_sk1,1476.32,2125.78,0.0
gfx950,256,672,65536,1536,fp8,fp8,flydsl,48672,1,94.6798,flydsl_mxpsh_128x256x128_F8_F8_B16_w0_x4_sk1,1428.94,2004.4,0.0
gfx950,256,704,65536,1536,fp8,fp8,flydsl,48672,1,96.2677,flydsl_mxpsh_128x256x128_F8_F8_B16_w0_x4_sk1,1472.29,2015.41,0.0
gfx950,256,736,65536,1536,fp8,fp8,flydsl,48800,1,97.8164,flydsl_mxpsh_128x256x128_F8_F8_B16_w2_x4_sk1,1514.84,2026.89,0.0
gfx950,256,768,65536,1536,fp8,fp8,flydsl,48736,1,99.8615,flydsl_mxpsh_128x256x128_F8_F8_B16_w1_x4_sk1,1548.33,2027.87,0.0
gfx950,256,800,65536,1536,fp8,fp8,flydsl,48800,1,108.1453,flydsl_mxpsh_128x256x128_F8_F8_B16_w2_x4_sk1,1489.3,1911.78,0.0
gfx950,256,832,65536,1536,fp8,fp8,flydsl,48736,1,110.6948,flydsl_mxpsh_128x256x128_F8_F8_B16_w1_x4_sk1,1513.2,1906.08,0.0
gfx950,256,864,65536,1536,fp8,fp8,flydsl,48736,1,111.5206,flydsl_mxpsh_128x256x128_F8_F8_B16_w1_x4_sk1,1559.77,1930.02,0.0
gfx950,256,896,65536,1536,fp8,fp8,flydsl,48736,1,111.8686,flydsl_mxpsh_128x256x128_F8_F8_B16_w1_x4_sk1,1612.5,1961.95,0.0
gfx950,256,928,65536,1536,fp8,fp8,flydsl,44832,1,126.6943,flydsl_mxpsh_96x256x128_F8_F8_B16_w0_x4_sk1,1474.66,1765.85,0.0
gfx950,256,960,65536,1536,fp8,fp8,flydsl,44832,1,126.673,flydsl_mxpsh_96x256x128_F8_F8_B16_w0_x4_sk1,1525.77,1799.65,0.0
gfx950,256,992,65536,1536,fp8,fp8,flydsl,44832,1,134.8766,flydsl_mxpsh_96x256x128_F8_F8_B16_w0_x4_sk1,1480.73,1721.65,0.0
gfx950,256,1024,65536,1536,fp8,fp8,flydsl,44896,1,136.2903,flydsl_mxpsh_96x256x128_F8_F8_B16_w1_x4_sk1,1512.64,1734.93,0.0
gfx950,256,1088,65536,1536,fp8,fp8,flydsl,48672,1,141.8623,flydsl_mxpsh_128x256x128_F8_F8_B16_w0_x4_sk1,1544.06,1726.61,0.0
gfx950,256,1152,65536,1536,fp8,fp8,flydsl,48800,1,144.7263,flydsl_mxpsh_128x256x128_F8_F8_B16_w2_x4_sk1,1602.53,1751.08,0.0
gfx950,256,1216,65536,1536,fp8,fp8,flydsl,48672,1,149.2843,flydsl_mxpsh_128x256x128_F8_F8_B16_w0_x4_sk1,1639.91,1754.47,0.0
gfx950,256,1280,65536,1536,fp8,fp8,flydsl,48800,1,152.7467,flydsl_mxpsh_128x256x128_F8_F8_B16_w2_x4_sk1,1687.09,1770.26,0.0
gfx950,256,1344,65536,1536,fp8,fp8,flydsl,48800,1,162.3564,flydsl_mxpsh_128x256x128_F8_F8_B16_w2_x4_sk1,1666.6,1717.75,0.0
gfx950,256,1408,65536,1536,fp8,fp8,flydsl,48800,1,164.8029,flydsl_mxpsh_128x256x128_F8_F8_B16_w2_x4_sk1,1720.04,1743.75,0.0
gfx950,256,1472,65536,1536,fp8,fp8,flydsl,48800,1,173.8221,flydsl_mxpsh_128x256x128_F8_F8_B16_w2_x4_sk1,1704.92,1702.1,0.0
gfx950,256,1536,65536,1536,fp8,fp8,flydsl,48672,1,178.5055,flydsl_mxpsh_128x256x128_F8_F8_B16_w0_x4_sk1,1732.37,1704.98,0.0
gfx950,256,1600,65536,1536,fp8,fp8,flydsl,48800,1,183.851,flydsl_mxpsh_128x256x128_F8_F8_B16_w2_x4_sk1,1752.08,1701.57,0.0
gfx950,256,1664,65536,1536,fp8,fp8,flydsl,48800,1,187.0447,flydsl_mxpsh_128x256x128_F8_F8_B16_w2_x4_sk1,1791.06,1717.89,0.0
gfx950,256,1728,65536,1536,fp8,fp8,flydsl,48672,1,195.4058,flydsl_mxpsh_128x256x128_F8_F8_B16_w0_x4_sk1,1780.36,1687.82,0.0
gfx950,256,1792,65536,1536,fp8,fp8,flydsl,48800,1,198.9982,flydsl_mxpsh_128x256x128_F8_F8_B16_w2_x4_sk1,1812.97,1700.0,0.0
gfx950,256,1856,65536,1536,fp8,fp8,flydsl,48800,1,213.0788,flydsl_mxpsh_128x256x128_F8_F8_B16_w2_x4_sk1,1753.63,1627.49,0.0
gfx950,256,1920,65536,1536,fp8,fp8,flydsl,48672,1,215.6693,flydsl_mxpsh_128x256x128_F8_F8_B16_w0_x4_sk1,1792.31,1647.29,0.0
gfx950,256,1984,65536,1536,fp8,fp8,flydsl,48800,1,233.4591,flydsl_mxpsh_128x256x128_F8_F8_B16_w2_x4_sk1,1710.93,1558.12,0.0
gfx950,256,2048,65536,1536,fp8,fp8,flydsl,44832,1,251.1709,flydsl_mxpsh_96x256x128_F8_F8_B16_w0_x4_sk1,1641.58,1482.04,0.0
gfx950,256,4096,65536,1536,fp8,fp8,flydsl,48672,1,453.2249,flydsl_mxpsh_128x256x128_F8_F8_B16_w0_x4_sk1,1819.48,1420.54,0.0
gfx950,256,6144,65536,1536,fp8,fp8,flydsl,48800,1,623.0827,flydsl_mxpsh_128x256x128_F8_F8_B16_w2_x4_sk1,1985.21,1469.16,0.0
gfx950,256,8192,65536,1536,fp8,fp8,flydsl,48736,1,806.549,flydsl_mxpsh_128x256x128_F8_F8_B16_w1_x4_sk1,2044.84,1471.69,0.0
gfx950,256,10240,65536,1536,fp8,fp8,flydsl,48672,1,981.2539,flydsl_mxpsh_128x256x128_F8_F8_B16_w0_x4_sk1,2100.97,1486.43,0.0
gfx950,256,12288,65536,1536,fp8,fp8,flydsl,48672,1,1191.3344,flydsl_mxpsh_128x256x128_F8_F8_B16_w0_x4_sk1,2076.58,1452.28,0.0
gfx950,256,14336,65536,1536,fp8,fp8,flydsl,48672,1,1375.7566,flydsl_mxpsh_128x256x128_F8_F8_B16_w0_x4_sk1,2097.91,1455.0,0.0
gfx950,256,16384,65536,1536,fp8,fp8,flydsl,48800,1,1595.4048,flydsl_mxpsh_128x256x128_F8_F8_B16_w2_x4_sk1,2067.52,1424.91,0.0
gfx950,256,20480,65536,1536,fp8,fp8,flydsl,48672,1,2048.8841,flydsl_mxpsh_128x256x128_F8_F8_B16_w0_x4_sk1,2012.4,1374.64,0.0
gfx950,256,24576,65536,1536,fp8,fp8,flydsl,48672,1,2465.144,flydsl_mxpsh_128x256x128_F8_F8_B16_w0_x4_sk1,2007.1,1362.86,0.0
gfx950,256,28672,65536,1536,fp8,fp8,flydsl,48736,1,2893.6874,flydsl_mxpsh_128x256x128_F8_F8_B16_w1_x4_sk1,1994.84,1348.73,0.0
gfx950,256,32768,65536,1536,fp8,fp8,flydsl,48672,1,3304.939,flydsl_mxpsh_128x256x128_F8_F8_B16_w0_x4_sk1,1996.12,1345.25,0.0
gfx950,256,40960,65536,1536,fp8,fp8,flydsl,48672,1,4075.8716,flydsl_mxpsh_128x256x128_F8_F8_B16_w0_x4_sk1,2023.21,1357.33,0.0
gfx950,256,49152,65536,1536,fp8,fp8,flydsl,48800,1,4881.1259,flydsl_mxpsh_128x256x128_F8_F8_B16_w2_x4_sk1,2027.32,1355.96,0.0
gfx950,256,57344,65536,1536,fp8,fp8,flydsl,48768,1,5566.181,flydsl_mxpsh_128x256x128_F8_F8_B16_w2_x0_sk1,2074.11,1384.24,0.0
gfx950,256,65536,65536,1536,fp8,fp8,flydsl,48800,1,6560.1835,flydsl_mxpsh_128x256x128_F8_F8_B16_w2_x4_sk1,2011.25,1340.09,0.0
