aiter/configs/profile_fmoe.csv
stage,cu_num,token,model_dim,inter_dim,expert,topk,act_type,dtype,q_dtype_a,q_dtype_w,q_type,use_g1u1,doweight_stage1,block_m,ksplit,us,kernelName,err,tflops,bw
stage1,256,512,6144,4096,8,2,ActivationType.Silu,torch.bfloat16,torch.float8_e4m3fn,torch.float8_e4m3fn,QuantType.per_Token,1,0,16,0,206.5037,_ZN5aiter48fmoe_stage1_bf16_pertokenFp8_g1u1_16x128_4tg_pf2E,0.0%,748.75,2970.49
stage1,256,512,6144,4096,8,2,ActivationType.Silu,torch.bfloat16,torch.float8_e4m3fn,torch.float8_e4m3fn,QuantType.per_Token,1,0,16,0,200.2907,_ZN5aiter48fmoe_stage1_bf16_pertokenFp8_g1u1_16x128_4tg_pf3E,0.0%,771.97,3062.63
stage1,256,512,6144,4096,8,2,ActivationType.Silu,torch.bfloat16,torch.float8_e4m3fn,torch.float8_e4m3fn,QuantType.per_Token,1,0,16,0,201.9408,_ZN5aiter48fmoe_stage1_bf16_pertokenFp8_g1u1_16x256_3tg_pf2E,0.0%,765.66,3037.61
stage1,256,512,6144,4096,8,2,ActivationType.Silu,torch.bfloat16,torch.float8_e4m3fn,torch.float8_e4m3fn,QuantType.per_Token,1,0,16,0,218.0485,_ZN5aiter48fmoe_stage1_bf16_pertokenFp8_g1u1_16x256_2tg_pf3E,0.0%,709.1,2813.21
stage1,256,512,6144,4096,8,2,ActivationType.Silu,torch.bfloat16,torch.float8_e4m3fn,torch.float8_e4m3fn,QuantType.per_Token,1,0,16,0,241.5014,_ZN5aiter48fmoe_stage1_bf16_pertokenFp8_g1u1_16x512_2tg_pf2E,0.0%,640.24,2540.01
stage1,256,512,6144,4096,8,2,ActivationType.Silu,torch.bfloat16,torch.float8_e4m3fn,torch.float8_e4m3fn,QuantType.per_Token,1,0,16,0,264.2273,_ZN5aiter44fmoe_stage1_bf16_pertokenFp8_g1u1_16x512_pf3E,0.0%,585.17,2321.55
stage1,256,512,6144,4096,8,2,ActivationType.Silu,torch.bfloat16,torch.float8_e4m3fn,torch.float8_e4m3fn,QuantType.per_Token,1,0,16,0,199.3398,_ZN5aiter47fmoe_stage1_bf16_pertokenFp8_g1u1_16x64_6tg_pf2E,0.0%,775.65,3077.24
stage1,256,512,6144,4096,8,2,ActivationType.Silu,torch.bfloat16,torch.float8_e4m3fn,torch.float8_e4m3fn,QuantType.per_Token,1,0,16,0,221.9221,_ZN5aiter47fmoe_stage1_bf16_pertokenFp8_g1u1_16x64_5tg_pf3E,0.0%,696.73,2764.11
stage1,256,512,6144,4096,8,2,ActivationType.Silu,torch.bfloat16,torch.float8_e4m3fn,torch.float8_e4m3fn,QuantType.per_Token,1,0,32,0,146.5243,_ZN5aiter48fmoe_stage1_bf16_pertokenFp8_g1u1_32x128_3tg_pf2E,0.0%,1055.24,4186.45
stage1,256,512,6144,4096,8,2,ActivationType.Silu,torch.bfloat16,torch.float8_e4m3fn,torch.float8_e4m3fn,QuantType.per_Token,1,0,32,0,144.3743,_ZN5aiter48fmoe_stage1_bf16_pertokenFp8_g1u1_32x128_3tg_pf3E,0.1%,1070.96,4248.8
stage1,256,512,6144,4096,8,2,ActivationType.Silu,torch.bfloat16,torch.float8_e4m3fn,torch.float8_e4m3fn,QuantType.per_Token,1,0,32,0,157.4181,_ZN5aiter48fmoe_stage1_bf16_pertokenFp8_g1u1_32x256_2tg_pf2E,0.0%,982.22,3896.74
stage1,256,512,6144,4096,8,2,ActivationType.Silu,torch.bfloat16,torch.float8_e4m3fn,torch.float8_e4m3fn,QuantType.per_Token,1,0,32,0,150.2929,_ZN5aiter48fmoe_stage1_bf16_pertokenFp8_g1u1_32x256_2tg_pf3E,0.0%,1028.78,4081.48
stage1,256,512,6144,4096,8,2,ActivationType.Silu,torch.bfloat16,torch.float8_e4m3fn,torch.float8_e4m3fn,QuantType.per_Token,1,0,32,0,223.5656,_ZN5aiter44fmoe_stage1_bf16_pertokenFp8_g1u1_32x512_pf2E,0.0%,691.6,2743.79
stage1,256,512,6144,4096,8,2,ActivationType.Silu,torch.bfloat16,torch.float8_e4m3fn,torch.float8_e4m3fn,QuantType.per_Token,1,0,32,0,203.4135,_ZN5aiter44fmoe_stage1_bf16_pertokenFp8_g1u1_32x512_pf3E,0.0%,760.12,3015.62
stage1,256,512,6144,4096,8,2,ActivationType.Silu,torch.bfloat16,torch.float8_e4m3fn,torch.float8_e4m3fn,QuantType.per_Token,1,0,32,0,161.125,_ZN5aiter47fmoe_stage1_bf16_pertokenFp8_g1u1_32x64_4tg_pf2E,0.0%,959.62,3807.09
stage1,256,512,6144,4096,8,2,ActivationType.Silu,torch.bfloat16,torch.float8_e4m3fn,torch.float8_e4m3fn,QuantType.per_Token,1,0,32,0,154.0059,_ZN5aiter47fmoe_stage1_bf16_pertokenFp8_g1u1_32x64_4tg_pf3E,0.0%,1003.98,3983.07
stage1,256,512,6144,4096,8,2,ActivationType.Silu,torch.bfloat16,torch.float8_e4m3fn,torch.float8_e4m3fn,QuantType.per_Token,1,0,64,0,139.3216,_ZN5aiter48fmoe_stage1_bf16_pertokenFp8_g1u1_64x128_2tg_pf2E,0.0%,1109.8,4402.88
stage1,256,512,6144,4096,8,2,ActivationType.Silu,torch.bfloat16,torch.float8_e4m3fn,torch.float8_e4m3fn,QuantType.per_Token,1,0,64,0,111.3157,_ZN5aiter48fmoe_stage1_bf16_pertokenFp8_g1u1_64x128_2tg_pf3E,0.0%,1389.01,5510.61
stage1,256,512,6144,4096,8,2,ActivationType.Silu,torch.bfloat16,torch.float8_e4m3fn,torch.float8_e4m3fn,QuantType.per_Token,1,0,64,0,165.5142,_ZN5aiter44fmoe_stage1_bf16_pertokenFp8_g1u1_64x256_pf2E,0.0%,934.17,3706.13
stage1,256,512,6144,4096,8,2,ActivationType.Silu,torch.bfloat16,torch.float8_e4m3fn,torch.float8_e4m3fn,QuantType.per_Token,1,0,64,0,140.8974,_ZN5aiter44fmoe_stage1_bf16_pertokenFp8_g1u1_64x256_pf3E,0.0%,1097.39,4353.64
stage1,256,512,6144,4096,8,2,ActivationType.Silu,torch.bfloat16,torch.float8_e4m3fn,torch.float8_e4m3fn,QuantType.per_Token,1,0,64,0,130.5008,_ZN5aiter47fmoe_stage1_bf16_pertokenFp8_g1u1_64x64_3tg_pf2E,0.0%,1184.81,4700.48
stage1,256,512,6144,4096,8,2,ActivationType.Silu,torch.bfloat16,torch.float8_e4m3fn,torch.float8_e4m3fn,QuantType.per_Token,1,0,64,0,119.7386,_ZN5aiter47fmoe_stage1_bf16_pertokenFp8_g1u1_64x64_2tg_pf3E,0.0%,1291.3,5122.97
stage1,256,512,6144,4096,8,2,ActivationType.Silu,torch.bfloat16,torch.float8_e4m3fn,torch.float8_e4m3fn,QuantType.per_Token,1,0,128,0,137.2141,_ZN5aiter45fmoe_stage1_bf16_pertokenFp8_g1u1_128x128_pf2E,0.0%,1126.84,4470.51
stage1,256,512,6144,4096,8,2,ActivationType.Silu,torch.bfloat16,torch.float8_e4m3fn,torch.float8_e4m3fn,QuantType.per_Token,1,0,128,0,115.9174,_ZN5aiter45fmoe_stage1_bf16_pertokenFp8_g1u1_128x128_pf3E,0.0%,1333.87,5291.85
stage1,256,512,6144,4096,8,2,ActivationType.Silu,torch.bfloat16,torch.float8_e4m3fn,torch.float8_e4m3fn,QuantType.per_Token,1,0,128,0,175.8489,_ZN5aiter44fmoe_stage1_bf16_pertokenFp8_g1u1_128x64_pf2E,0.0%,879.27,3488.32
stage1,256,512,6144,4096,8,2,ActivationType.Silu,torch.bfloat16,torch.float8_e4m3fn,torch.float8_e4m3fn,QuantType.per_Token,1,0,128,0,117.9052,_ZN5aiter44fmoe_stage1_bf16_pertokenFp8_g1u1_128x64_pf3E,0.0%,1311.38,5202.63
stage1,256,512,6144,4096,8,2,ActivationType.Silu,torch.bfloat16,torch.float8_e4m3fn,torch.float8_e4m3fn,QuantType.per_Token,1,0,32,0,151.3999,moe_ck2stages_gemm1_256x32x64x256_1x4_TypeCast_v1_Nswizzle0_Quant2_MulRoutedWeight0_silu_F8_F8_B16,0.0%,1021.26,4051.63
stage1,256,512,6144,4096,8,2,ActivationType.Silu,torch.bfloat16,torch.float8_e4m3fn,torch.float8_e4m3fn,QuantType.per_Token,1,0,32,0,153.1935,moe_ck2stages_gemm1_256x32x64x128_1x4_TypeCast_v1_Nswizzle0_Quant2_MulRoutedWeight0_silu_F8_F8_B16,0.0%,1009.3,4004.2
stage2,256,512,6144,4096,8,2,ActivationType.Silu,torch.bfloat16,torch.float8_e4m3fn,torch.float8_e4m3fn,QuantType.per_Token,1,0,32,0,80.2438,moe_ck2stages_gemm2_256x32x128x256_1x4_TypeCast_v1_Nswizzle0_Quant2_MulRoutedWeight1_F8_F8_B16,2.3%,1926.86,7644.42
stage1,256,512,6144,4096,8,2,ActivationType.Silu,torch.bfloat16,torch.float8_e4m3fn,torch.float8_e4m3fn,QuantType.per_Token,1,0,64,0,113.1953,moe_ck2stages_gemm1_256x64x64x256_1x4_TypeCast_v1_Nswizzle0_Quant2_MulRoutedWeight0_silu_F8_F8_B16,0.0%,1365.95,5419.1
stage1,256,512,6144,4096,8,2,ActivationType.Silu,torch.bfloat16,torch.float8_e4m3fn,torch.float8_e4m3fn,QuantType.per_Token,1,0,64,0,114.7769,moe_ck2stages_gemm1_256x64x64x128_1x4_TypeCast_v1_Nswizzle0_Quant2_MulRoutedWeight0_silu_F8_F8_B16,0.0%,1347.12,5344.43
stage2,256,512,6144,4096,8,2,ActivationType.Silu,torch.bfloat16,torch.float8_e4m3fn,torch.float8_e4m3fn,QuantType.per_Token,1,0,64,0,74.5249,moe_ck2stages_gemm2_256x64x128x256_1x4_TypeCast_v1_Nswizzle0_Quant2_MulRoutedWeight1_F8_F8_B16,2.3%,2074.73,8231.03
stage1,256,512,6144,4096,8,2,ActivationType.Silu,torch.bfloat16,torch.float8_e4m3fn,torch.float8_e4m3fn,QuantType.per_Token,1,0,128,0,114.9296,moe_ck2stages_gemm1_256x128x64x128_1x4_TypeCast_v1_Nswizzle0_Quant2_MulRoutedWeight0_silu_F8_F8_B16,0.0%,1345.34,5337.33
stage1,256,512,6144,4096,8,2,ActivationType.Silu,torch.bfloat16,torch.float8_e4m3fn,torch.float8_e4m3fn,QuantType.per_Token,1,0,128,0,114.6458,moe_ck2stages_gemm1_256x128x128x128_1x4_TypeCast_v3_Nswizzle0_Quant2_MulRoutedWeight0_silu_F8_F8_B16,0.0%,1348.67,5350.54
stage2,256,512,6144,4096,8,2,ActivationType.Silu,torch.bfloat16,torch.float8_e4m3fn,torch.float8_e4m3fn,QuantType.per_Token,1,0,128,0,89.1625,moe_ck2stages_gemm2_256x128x128x128_1x4_TypeCast_v1_Nswizzle0_Quant2_MulRoutedWeight1_F8_F8_B16,2.3%,1734.12,6879.76
stage2,256,512,6144,4096,8,2,ActivationType.Silu,torch.bfloat16,torch.float8_e4m3fn,torch.float8_e4m3fn,QuantType.per_Token,1,0,128,0,85.5888,moe_ck2stages_gemm2_256x128x128x128_1x4_TypeCast_v3_Nswizzle0_Quant2_MulRoutedWeight1_F8_F8_B16,2.3%,1806.53,7167.02
asm_1stage,256,512,6144,4096,8,2,ActivationType.Silu,torch.bfloat16,torch.float8_e4m3fn,torch.float8_e4m3fn,QuantType.per_Token,1,0,32,0,542.5665,_ZN5aiter45fmoe_bf16_pertokenFp8_g1u1_vs_silu_1tg_32x128E,91.9%,284.98,1130.58
asm_1stage,256,512,6144,4096,8,2,ActivationType.Silu,torch.bfloat16,torch.float8_e4m3fn,torch.float8_e4m3fn,QuantType.per_Token,1,0,32,0,502.0666,_ZN5aiter48fmoe_bf16_pertokenFp8_g1u1_vs_silu_1tg_ps_32x128E,5.7%,307.96,1221.78
asm_1stage,256,512,6144,4096,8,2,ActivationType.Silu,torch.bfloat16,torch.float8_e4m3fn,torch.float8_e4m3fn,QuantType.per_Token,1,0,32,0,345.9737,_ZN5aiter48fmoe_bf16_pertokenFp8_g1u1_vs_silu_1tg_ps_32x256E,5.6%,446.91,1773.02
asm_1stage,256,512,6144,4096,8,2,ActivationType.Silu,torch.bfloat16,torch.float8_e4m3fn,torch.float8_e4m3fn,QuantType.per_Token,1,0,32,0,346.3684,_ZN5aiter45fmoe_bf16_pertokenFp8_g1u1_vs_silu_1tg_32x256E,5.6%,446.4,1771.0
asm_1stage,256,512,6144,4096,8,2,ActivationType.Silu,torch.bfloat16,torch.float8_e4m3fn,torch.float8_e4m3fn,QuantType.per_Token,1,0,32,0,339.859,_ZN5aiter45fmoe_bf16_pertokenFp8_g1u1_vs_silu_1tg_32x512E,5.1%,454.95,1804.92
asm_1stage,256,512,6144,4096,8,2,ActivationType.Silu,torch.bfloat16,torch.float8_e4m3fn,torch.float8_e4m3fn,QuantType.per_Token,1,0,32,0,345.0034,_ZN5aiter48fmoe_bf16_pertokenFp8_g1u1_vs_silu_1tg_ps_32x512E,5.1%,448.17,1778.0
stage1,256,512,6144,4096,8,2,ActivationType.Silu,torch.bfloat16,torch.int8,torch.int8,QuantType.per_Tensor,1,0,16,0,215.529,_ZN5aiter49fmoe_stage1_bf16_pertokenInt8_g1u1_16x128_4tg_pf2E,0.0%,717.39,2846.1
stage1,256,512,6144,4096,8,2,ActivationType.Silu,torch.bfloat16,torch.int8,torch.int8,QuantType.per_Tensor,1,0,16,0,208.6674,_ZN5aiter49fmoe_stage1_bf16_pertokenInt8_g1u1_16x128_4tg_pf3E,0.0%,740.98,2939.69
stage1,256,512,6144,4096,8,2,ActivationType.Silu,torch.bfloat16,torch.int8,torch.int8,QuantType.per_Tensor,1,0,16,0,210.3829,_ZN5aiter49fmoe_stage1_bf16_pertokenInt8_g1u1_16x256_3tg_pf2E,0.0%,734.94,2915.72
stage1,256,512,6144,4096,8,2,ActivationType.Silu,torch.bfloat16,torch.int8,torch.int8,QuantType.per_Tensor,1,0,16,0,227.1903,_ZN5aiter49fmoe_stage1_bf16_pertokenInt8_g1u1_16x256_2tg_pf3E,0.0%,680.57,2700.01
stage1,256,512,6144,4096,8,2,ActivationType.Silu,torch.bfloat16,torch.int8,torch.int8,QuantType.per_Tensor,1,0,16,0,248.3835,_ZN5aiter49fmoe_stage1_bf16_pertokenInt8_g1u1_16x512_2tg_pf2E,0.0%,622.5,2469.64
stage1,256,512,6144,4096,8,2,ActivationType.Silu,torch.bfloat16,torch.int8,torch.int8,QuantType.per_Tensor,1,0,16,0,272.9207,_ZN5aiter45fmoe_stage1_bf16_pertokenInt8_g1u1_16x512_pf3E,0.0%,566.53,2247.6
stage1,256,512,6144,4096,8,2,ActivationType.Silu,torch.bfloat16,torch.int8,torch.int8,QuantType.per_Tensor,1,0,32,0,153.8265,_ZN5aiter49fmoe_stage1_bf16_pertokenInt8_g1u1_32x128_3tg_pf2E,0.0%,1005.15,3987.72
stage1,256,512,6144,4096,8,2,ActivationType.Silu,torch.bfloat16,torch.int8,torch.int8,QuantType.per_Tensor,1,0,32,0,152.9885,_ZN5aiter49fmoe_stage1_bf16_pertokenInt8_g1u1_32x128_3tg_pf3E,0.0%,1010.66,4009.56
stage1,256,512,6144,4096,8,2,ActivationType.Silu,torch.bfloat16,torch.int8,torch.int8,QuantType.per_Tensor,1,0,32,0,165.9725,_ZN5aiter49fmoe_stage1_bf16_pertokenInt8_g1u1_32x256_2tg_pf2E,0.0%,931.59,3695.9
stage1,256,512,6144,4096,8,2,ActivationType.Silu,torch.bfloat16,torch.int8,torch.int8,QuantType.per_Tensor,1,0,32,0,159.077,_ZN5aiter49fmoe_stage1_bf16_pertokenInt8_g1u1_32x256_2tg_pf3E,0.0%,971.97,3856.1
stage1,256,512,6144,4096,8,2,ActivationType.Silu,torch.bfloat16,torch.int8,torch.int8,QuantType.per_Tensor,1,0,32,0,232.2781,_ZN5aiter45fmoe_stage1_bf16_pertokenInt8_g1u1_32x512_pf2E,0.0%,665.66,2640.87
stage1,256,512,6144,4096,8,2,ActivationType.Silu,torch.bfloat16,torch.int8,torch.int8,QuantType.per_Tensor,1,0,32,0,212.1054,_ZN5aiter45fmoe_stage1_bf16_pertokenInt8_g1u1_32x512_pf3E,0.0%,728.97,2892.04
stage1,256,512,6144,4096,8,2,ActivationType.Silu,torch.bfloat16,torch.int8,torch.int8,QuantType.per_Tensor,1,0,64,0,148.1775,_ZN5aiter49fmoe_stage1_bf16_pertokenInt8_g1u1_64x128_2tg_pf2E,0.0%,1043.47,4139.74
stage1,256,512,6144,4096,8,2,ActivationType.Silu,torch.bfloat16,torch.int8,torch.int8,QuantType.per_Tensor,1,0,64,0,119.25,_ZN5aiter49fmoe_stage1_bf16_pertokenInt8_g1u1_64x128_2tg_pf3E,0.0%,1296.59,5143.96
stage1,256,512,6144,4096,8,2,ActivationType.Silu,torch.bfloat16,torch.int8,torch.int8,QuantType.per_Tensor,1,0,64,0,174.704,_ZN5aiter45fmoe_stage1_bf16_pertokenInt8_g1u1_64x256_pf2E,0.0%,885.03,3511.18
stage1,256,512,6144,4096,8,2,ActivationType.Silu,torch.bfloat16,torch.int8,torch.int8,QuantType.per_Tensor,1,0,64,0,150.4068,_ZN5aiter45fmoe_stage1_bf16_pertokenInt8_g1u1_64x256_pf3E,0.0%,1028.0,4078.39
stage1,256,512,6144,4096,8,2,ActivationType.Silu,torch.bfloat16,torch.int8,torch.int8,QuantType.per_Tensor,1,0,128,0,144.886,_ZN5aiter46fmoe_stage1_bf16_pertokenInt8_g1u1_128x128_pf2E,0.0%,1067.18,4233.79
stage1,256,512,6144,4096,8,2,ActivationType.Silu,torch.bfloat16,torch.int8,torch.int8,QuantType.per_Tensor,1,0,128,0,123.5292,_ZN5aiter46fmoe_stage1_bf16_pertokenInt8_g1u1_128x128_pf3E,0.0%,1251.68,4965.76
stage1,256,512,6144,4096,8,2,ActivationType.Silu,torch.bfloat16,torch.int8,torch.int8,QuantType.per_Tensor,1,0,32,0,154.6207,moe_ck2stages_gemm1_256x32x64x256_1x4_TypeCast_v1_Nswizzle0_Quant1_MulRoutedWeight0_silu_I8_I8_B16,0.0%,999.99,3967.24
stage1,256,512,6144,4096,8,2,ActivationType.Silu,torch.bfloat16,torch.int8,torch.int8,QuantType.per_Tensor,1,0,32,0,152.0647,moe_ck2stages_gemm1_256x32x64x128_1x4_TypeCast_v1_Nswizzle0_Quant1_MulRoutedWeight0_silu_I8_I8_B16,0.0%,1016.8,4033.92
stage2,256,512,6144,4096,8,2,ActivationType.Silu,torch.bfloat16,torch.int8,torch.int8,QuantType.per_Tensor,1,0,32,0,79.4041,moe_ck2stages_gemm2_256x32x128x256_1x4_TypeCast_v1_Nswizzle0_Quant1_MulRoutedWeight1_I8_I8_B16,2.1%,1947.24,7725.26
stage1,256,512,6144,4096,8,2,ActivationType.Silu,torch.bfloat16,torch.int8,torch.int8,QuantType.per_Tensor,1,0,64,0,109.6601,moe_ck2stages_gemm1_256x64x64x256_1x4_TypeCast_v1_Nswizzle0_Quant1_MulRoutedWeight0_silu_I8_I8_B16,0.0%,1409.98,5593.8
stage1,256,512,6144,4096,8,2,ActivationType.Silu,torch.bfloat16,torch.int8,torch.int8,QuantType.per_Tensor,1,0,64,0,111.5369,moe_ck2stages_gemm1_256x64x64x128_1x4_TypeCast_v1_Nswizzle0_Quant1_MulRoutedWeight0_silu_I8_I8_B16,0.0%,1386.26,5499.68
stage2,256,512,6144,4096,8,2,ActivationType.Silu,torch.bfloat16,torch.int8,torch.int8,QuantType.per_Tensor,1,0,64,0,69.8756,moe_ck2stages_gemm2_256x64x128x256_1x4_TypeCast_v1_Nswizzle0_Quant1_MulRoutedWeight1_I8_I8_B16,2.1%,2212.77,8778.7
stage1,256,512,6144,4096,8,2,ActivationType.Silu,torch.bfloat16,torch.int8,torch.int8,QuantType.per_Tensor,1,0,128,0,112.8251,moe_ck2stages_gemm1_256x128x64x128_1x4_TypeCast_v1_Nswizzle0_Quant1_MulRoutedWeight0_silu_I8_I8_B16,0.0%,1370.43,5436.88
stage1,256,512,6144,4096,8,2,ActivationType.Silu,torch.bfloat16,torch.int8,torch.int8,QuantType.per_Tensor,1,0,128,0,110.0147,moe_ck2stages_gemm1_256x128x128x128_1x4_TypeCast_v3_Nswizzle0_Quant1_MulRoutedWeight0_silu_I8_I8_B16,0.0%,1405.44,5575.77
stage2,256,512,6144,4096,8,2,ActivationType.Silu,torch.bfloat16,torch.int8,torch.int8,QuantType.per_Tensor,1,0,128,0,80.9562,moe_ck2stages_gemm2_256x128x128x128_1x4_TypeCast_v1_Nswizzle0_Quant1_MulRoutedWeight1_I8_I8_B16,2.1%,1909.91,7577.15
stage2,256,512,6144,4096,8,2,ActivationType.Silu,torch.bfloat16,torch.int8,torch.int8,QuantType.per_Tensor,1,0,128,0,73.5737,moe_ck2stages_gemm2_256x128x128x128_1x4_TypeCast_v3_Nswizzle0_Quant1_MulRoutedWeight1_I8_I8_B16,2.1%,2101.55,8337.45
stage1,256,4,2304,1536,8,2,ActivationType.Gelu,torch.bfloat16,torch.float8_e4m3fn,torch.float8_e4m3fn,QuantType.per_Token,1,0,16,0,26.3667,_ZN5aiter48fmoe_stage1_bf16_pertokenFp8_g1u1_16x128_4tg_pf2E,0.0%,6.44,3222.33
stage1,256,4,2304,1536,8,2,ActivationType.Gelu,torch.bfloat16,torch.float8_e4m3fn,torch.float8_e4m3fn,QuantType.per_Token,1,0,16,0,16.6056,_ZN5aiter48fmoe_stage1_bf16_pertokenFp8_g1u1_16x128_4tg_pf3E,0.0%,10.23,5116.49
stage1,256,4,2304,1536,8,2,ActivationType.Gelu,torch.bfloat16,torch.float8_e4m3fn,torch.float8_e4m3fn,QuantType.per_Token,1,0,16,0,31.4751,_ZN5aiter48fmoe_stage1_bf16_pertokenFp8_g1u1_16x256_3tg_pf2E,0.0%,5.4,2699.35
stage1,256,4,2304,1536,8,2,ActivationType.Gelu,torch.bfloat16,torch.float8_e4m3fn,torch.float8_e4m3fn,QuantType.per_Token,1,0,16,0,25.0221,_ZN5aiter48fmoe_stage1_bf16_pertokenFp8_g1u1_16x256_2tg_pf3E,0.0%,6.79,3395.49
stage1,256,4,2304,1536,8,2,ActivationType.Gelu,torch.bfloat16,torch.float8_e4m3fn,torch.float8_e4m3fn,QuantType.per_Token,1,0,16,0,48.2434,_ZN5aiter48fmoe_stage1_bf16_pertokenFp8_g1u1_16x512_2tg_pf2E,0.0%,3.52,1761.12
stage1,256,4,2304,1536,8,2,ActivationType.Gelu,torch.bfloat16,torch.float8_e4m3fn,torch.float8_e4m3fn,QuantType.per_Token,1,0,16,0,45.4158,_ZN5aiter44fmoe_stage1_bf16_pertokenFp8_g1u1_16x512_pf3E,0.0%,3.74,1870.77
stage1,256,4,2304,1536,8,2,ActivationType.Gelu,torch.bfloat16,torch.float8_e4m3fn,torch.float8_e4m3fn,QuantType.per_Token,1,0,16,0,23.7027,_ZN5aiter47fmoe_stage1_bf16_pertokenFp8_g1u1_16x64_6tg_pf2E,0.0%,7.17,3584.5
stage1,256,4,2304,1536,8,2,ActivationType.Gelu,torch.bfloat16,torch.float8_e4m3fn,torch.float8_e4m3fn,QuantType.per_Token,1,0,16,0,15.2162,_ZN5aiter47fmoe_stage1_bf16_pertokenFp8_g1u1_16x64_5tg_pf3E,0.0%,11.16,5583.67
stage1,256,4,2304,1536,8,2,ActivationType.Gelu,torch.bfloat16,torch.float8_e4m3fn,torch.float8_e4m3fn,QuantType.per_Token,1,0,32,0,26.7425,_ZN5aiter48fmoe_stage1_bf16_pertokenFp8_g1u1_32x128_3tg_pf2E,0.0%,6.35,3177.05
stage1,256,4,2304,1536,8,2,ActivationType.Gelu,torch.bfloat16,torch.float8_e4m3fn,torch.float8_e4m3fn,QuantType.per_Token,1,0,32,0,17.662,_ZN5aiter48fmoe_stage1_bf16_pertokenFp8_g1u1_32x128_3tg_pf3E,0.0%,9.62,4810.46
stage1,256,4,2304,1536,8,2,ActivationType.Gelu,torch.bfloat16,torch.float8_e4m3fn,torch.float8_e4m3fn,QuantType.per_Token,1,0,32,0,32.5854,_ZN5aiter48fmoe_stage1_bf16_pertokenFp8_g1u1_32x256_2tg_pf2E,0.0%,5.21,2607.37
stage1,256,4,2304,1536,8,2,ActivationType.Gelu,torch.bfloat16,torch.float8_e4m3fn,torch.float8_e4m3fn,QuantType.per_Token,1,0,32,0,25.5013,_ZN5aiter48fmoe_stage1_bf16_pertokenFp8_g1u1_32x256_2tg_pf3E,0.0%,6.66,3331.69
stage1,256,4,2304,1536,8,2,ActivationType.Gelu,torch.bfloat16,torch.float8_e4m3fn,torch.float8_e4m3fn,QuantType.per_Token,1,0,32,0,52.6406,_ZN5aiter44fmoe_stage1_bf16_pertokenFp8_g1u1_32x512_pf2E,0.0%,3.23,1614.01
stage1,256,4,2304,1536,8,2,ActivationType.Gelu,torch.bfloat16,torch.float8_e4m3fn,torch.float8_e4m3fn,QuantType.per_Token,1,0,32,0,47.296,_ZN5aiter44fmoe_stage1_bf16_pertokenFp8_g1u1_32x512_pf3E,0.0%,3.59,1796.4
stage1,256,4,2304,1536,8,2,ActivationType.Gelu,torch.bfloat16,torch.float8_e4m3fn,torch.float8_e4m3fn,QuantType.per_Token,1,0,32,0,24.2184,_ZN5aiter47fmoe_stage1_bf16_pertokenFp8_g1u1_32x64_4tg_pf2E,0.0%,7.01,3508.17
stage1,256,4,2304,1536,8,2,ActivationType.Gelu,torch.bfloat16,torch.float8_e4m3fn,torch.float8_e4m3fn,QuantType.per_Token,1,0,32,0,15.0844,_ZN5aiter47fmoe_stage1_bf16_pertokenFp8_g1u1_32x64_4tg_pf3E,0.0%,11.26,5632.46
stage1,256,4,2304,1536,8,2,ActivationType.Gelu,torch.bfloat16,torch.float8_e4m3fn,torch.float8_e4m3fn,QuantType.per_Token,1,0,64,0,27.4391,_ZN5aiter48fmoe_stage1_bf16_pertokenFp8_g1u1_64x128_2tg_pf2E,0.0%,6.19,3096.4
stage1,256,4,2304,1536,8,2,ActivationType.Gelu,torch.bfloat16,torch.float8_e4m3fn,torch.float8_e4m3fn,QuantType.per_Token,1,0,64,0,18.034,_ZN5aiter48fmoe_stage1_bf16_pertokenFp8_g1u1_64x128_2tg_pf3E,0.0%,9.42,4711.23
stage1,256,4,2304,1536,8,2,ActivationType.Gelu,torch.bfloat16,torch.float8_e4m3fn,torch.float8_e4m3fn,QuantType.per_Token,1,0,64,0,34.1605,_ZN5aiter44fmoe_stage1_bf16_pertokenFp8_g1u1_64x256_pf2E,0.0%,4.97,2487.15
stage1,256,4,2304,1536,8,2,ActivationType.Gelu,torch.bfloat16,torch.float8_e4m3fn,torch.float8_e4m3fn,QuantType.per_Token,1,0,64,0,28.6124,_ZN5aiter44fmoe_stage1_bf16_pertokenFp8_g1u1_64x256_pf3E,0.0%,5.94,2969.42
stage1,256,4,2304,1536,8,2,ActivationType.Gelu,torch.bfloat16,torch.float8_e4m3fn,torch.float8_e4m3fn,QuantType.per_Token,1,0,64,0,25.0671,_ZN5aiter47fmoe_stage1_bf16_pertokenFp8_g1u1_64x64_3tg_pf2E,0.0%,6.78,3389.4
stage1,256,4,2304,1536,8,2,ActivationType.Gelu,torch.bfloat16,torch.float8_e4m3fn,torch.float8_e4m3fn,QuantType.per_Token,1,0,64,0,16.458,_ZN5aiter47fmoe_stage1_bf16_pertokenFp8_g1u1_64x64_2tg_pf3E,0.0%,10.32,5162.37
stage1,256,4,2304,1536,8,2,ActivationType.Gelu,torch.bfloat16,torch.float8_e4m3fn,torch.float8_e4m3fn,QuantType.per_Token,1,0,128,0,30.0353,_ZN5aiter45fmoe_stage1_bf16_pertokenFp8_g1u1_128x128_pf2E,0.0%,5.66,2828.75
stage1,256,4,2304,1536,8,2,ActivationType.Gelu,torch.bfloat16,torch.float8_e4m3fn,torch.float8_e4m3fn,QuantType.per_Token,1,0,128,0,23.483,_ZN5aiter45fmoe_stage1_bf16_pertokenFp8_g1u1_128x128_pf3E,0.0%,7.23,3618.03
stage1,256,4,2304,1536,8,2,ActivationType.Gelu,torch.bfloat16,torch.float8_e4m3fn,torch.float8_e4m3fn,QuantType.per_Token,1,0,128,0,26.8817,_ZN5aiter44fmoe_stage1_bf16_pertokenFp8_g1u1_128x64_pf2E,0.0%,6.32,3160.6
stage1,256,4,2304,1536,8,2,ActivationType.Gelu,torch.bfloat16,torch.float8_e4m3fn,torch.float8_e4m3fn,QuantType.per_Token,1,0,128,0,17.9413,_ZN5aiter44fmoe_stage1_bf16_pertokenFp8_g1u1_128x64_pf3E,0.0%,9.47,4735.57
stage1,256,4,2304,1536,8,2,ActivationType.Gelu,torch.bfloat16,torch.float8_e4m3fn,torch.float8_e4m3fn,QuantType.per_Token,1,0,32,0,12.4675,moe_ck2stages_gemm1_256x32x64x256_1x4_TypeCast_v1_Nswizzle0_Quant2_MulRoutedWeight0_gelu_F8_F8_B16,0.0%,13.62,6814.7
stage1,256,4,2304,1536,8,2,ActivationType.Gelu,torch.bfloat16,torch.float8_e4m3fn,torch.float8_e4m3fn,QuantType.per_Token,1,0,32,0,16.4848,moe_ck2stages_gemm1_256x32x64x128_1x4_TypeCast_v1_Nswizzle0_Quant2_MulRoutedWeight0_gelu_F8_F8_B16,0.0%,10.3,5153.98
stage2,256,4,2304,1536,8,2,ActivationType.Gelu,torch.bfloat16,torch.float8_e4m3fn,torch.float8_e4m3fn,QuantType.per_Token,1,0,32,0,12.0533,moe_ck2stages_gemm2_256x32x128x256_1x4_TypeCast_v1_Nswizzle0_Quant2_MulRoutedWeight1_F8_F8_B16,0.2%,14.09,7048.88
stage1,256,4,2304,1536,8,2,ActivationType.Gelu,torch.bfloat16,torch.float8_e4m3fn,torch.float8_e4m3fn,QuantType.per_Token,1,0,64,0,15.2025,moe_ck2stages_gemm1_256x64x64x256_1x4_TypeCast_v1_Nswizzle0_Quant2_MulRoutedWeight0_gelu_F8_F8_B16,0.0%,11.17,5588.71
stage1,256,4,2304,1536,8,2,ActivationType.Gelu,torch.bfloat16,torch.float8_e4m3fn,torch.float8_e4m3fn,QuantType.per_Token,1,0,64,0,18.5924,moe_ck2stages_gemm1_256x64x64x128_1x4_TypeCast_v1_Nswizzle0_Quant2_MulRoutedWeight0_gelu_F8_F8_B16,0.0%,9.14,4569.73
stage2,256,4,2304,1536,8,2,ActivationType.Gelu,torch.bfloat16,torch.float8_e4m3fn,torch.float8_e4m3fn,QuantType.per_Token,1,0,64,0,14.7872,moe_ck2stages_gemm2_256x64x128x256_1x4_TypeCast_v1_Nswizzle0_Quant2_MulRoutedWeight1_F8_F8_B16,0.2%,11.49,5745.67
stage1,256,4,2304,1536,8,2,ActivationType.Gelu,torch.bfloat16,torch.float8_e4m3fn,torch.float8_e4m3fn,QuantType.per_Token,1,0,128,0,22.1744,moe_ck2stages_gemm1_256x128x64x128_1x4_TypeCast_v1_Nswizzle0_Quant2_MulRoutedWeight0_gelu_F8_F8_B16,0.0%,7.66,3831.55
stage1,256,4,2304,1536,8,2,ActivationType.Gelu,torch.bfloat16,torch.float8_e4m3fn,torch.float8_e4m3fn,QuantType.per_Token,1,0,128,0,28.3531,moe_ck2stages_gemm1_256x128x128x128_1x4_TypeCast_v3_Nswizzle0_Quant2_MulRoutedWeight0_gelu_F8_F8_B16,0.0%,5.99,2996.58
stage2,256,4,2304,1536,8,2,ActivationType.Gelu,torch.bfloat16,torch.float8_e4m3fn,torch.float8_e4m3fn,QuantType.per_Token,1,0,128,0,20.999,moe_ck2stages_gemm2_256x128x128x128_1x4_TypeCast_v1_Nswizzle0_Quant2_MulRoutedWeight1_F8_F8_B16,0.2%,8.09,4046.02
stage2,256,4,2304,1536,8,2,ActivationType.Gelu,torch.bfloat16,torch.float8_e4m3fn,torch.float8_e4m3fn,QuantType.per_Token,1,0,128,0,20.1971,moe_ck2stages_gemm2_256x128x128x128_1x4_TypeCast_v3_Nswizzle0_Quant2_MulRoutedWeight1_F8_F8_B16,0.2%,8.41,4206.66
asm_1stage,256,4,2304,1536,8,2,ActivationType.Gelu,torch.bfloat16,torch.float8_e4m3fn,torch.float8_e4m3fn,QuantType.per_Token,1,0,32,0,37.4785,_ZN5aiter48fmoe_bf16_pertokenFp8_g1u1_vs_gelu_1tg_ps_32x128E,0.0%,4.53,2266.96
asm_1stage,256,4,2304,1536,8,2,ActivationType.Gelu,torch.bfloat16,torch.float8_e4m3fn,torch.float8_e4m3fn,QuantType.per_Token,1,0,32,0,34.7503,_ZN5aiter45fmoe_bf16_pertokenFp8_g1u1_vs_gelu_1tg_32x128E,81.5%,4.89,2444.94
asm_1stage,256,4,2304,1536,8,2,ActivationType.Gelu,torch.bfloat16,torch.float8_e4m3fn,torch.float8_e4m3fn,QuantType.per_Token,1,0,32,0,37.4213,_ZN5aiter45fmoe_bf16_pertokenFp8_g1u1_vs_gelu_1tg_32x192E,18.6%,4.54,2270.43
asm_1stage,256,4,2304,1536,8,2,ActivationType.Gelu,torch.bfloat16,torch.float8_e4m3fn,torch.float8_e4m3fn,QuantType.per_Token,1,0,32,0,41.4803,_ZN5aiter48fmoe_bf16_pertokenFp8_g1u1_vs_gelu_1tg_ps_32x192E,0.0%,4.1,2048.26
asm_1stage,256,4,2304,1536,8,2,ActivationType.Gelu,torch.bfloat16,torch.float8_e4m3fn,torch.float8_e4m3fn,QuantType.per_Token,1,0,32,0,42.3627,_ZN5aiter45fmoe_bf16_pertokenFp8_g1u1_vs_gelu_1tg_32x256E,18.6%,4.01,2005.59
asm_1stage,256,4,2304,1536,8,2,ActivationType.Gelu,torch.bfloat16,torch.float8_e4m3fn,torch.float8_e4m3fn,QuantType.per_Token,1,0,32,0,45.7244,_ZN5aiter48fmoe_bf16_pertokenFp8_g1u1_vs_gelu_1tg_ps_32x256E,0.0%,3.72,1858.14
asm_1stage,256,4,2304,1536,8,2,ActivationType.Gelu,torch.bfloat16,torch.float8_e4m3fn,torch.float8_e4m3fn,QuantType.per_Token,1,0,32,0,57.4157,_ZN5aiter45fmoe_bf16_pertokenFp8_g1u1_vs_gelu_1tg_32x384E,18.6%,2.96,1479.77
asm_1stage,256,4,2304,1536,8,2,ActivationType.Gelu,torch.bfloat16,torch.float8_e4m3fn,torch.float8_e4m3fn,QuantType.per_Token,1,0,32,0,60.6796,_ZN5aiter48fmoe_bf16_pertokenFp8_g1u1_vs_gelu_1tg_ps_32x384E,0.0%,2.8,1400.18
asm_1stage,256,4,2304,1536,8,2,ActivationType.Gelu,torch.bfloat16,torch.float8_e4m3fn,torch.float8_e4m3fn,QuantType.per_Token,1,0,32,0,75.9814,_ZN5aiter48fmoe_bf16_pertokenFp8_g1u1_vs_gelu_1tg_ps_32x512E,0.0%,2.24,1118.2
asm_1stage,256,4,2304,1536,8,2,ActivationType.Gelu,torch.bfloat16,torch.float8_e4m3fn,torch.float8_e4m3fn,QuantType.per_Token,1,0,32,0,73.1352,_ZN5aiter45fmoe_bf16_pertokenFp8_g1u1_vs_gelu_1tg_32x512E,18.5%,2.32,1161.72
stage1,256,4,2304,1536,8,2,ActivationType.Gelu,torch.bfloat16,torch.float8_e4m3fn,torch.float8_e4m3fn,QuantType.per_Token,1,1,16,0,26.6743,_ZN5aiter57fmoe_stage1_bf16_pertokenFp8_doweight_g1u1_16x128_4tg_pf2E,0.0%,6.37,3185.17
stage1,256,4,2304,1536,8,2,ActivationType.Gelu,torch.bfloat16,torch.float8_e4m3fn,torch.float8_e4m3fn,QuantType.per_Token,1,1,16,0,17.0106,_ZN5aiter57fmoe_stage1_bf16_pertokenFp8_doweight_g1u1_16x128_4tg_pf3E,0.0%,9.99,4994.67
stage1,256,4,2304,1536,8,2,ActivationType.Gelu,torch.bfloat16,torch.float8_e4m3fn,torch.float8_e4m3fn,QuantType.per_Token,1,1,16,0,31.2718,_ZN5aiter57fmoe_stage1_bf16_pertokenFp8_doweight_g1u1_16x256_3tg_pf2E,0.0%,5.43,2716.9
stage1,256,4,2304,1536,8,2,ActivationType.Gelu,torch.bfloat16,torch.float8_e4m3fn,torch.float8_e4m3fn,QuantType.per_Token,1,1,16,0,24.9314,_ZN5aiter57fmoe_stage1_bf16_pertokenFp8_doweight_g1u1_16x256_2tg_pf3E,0.0%,6.81,3407.84
stage1,256,4,2304,1536,8,2,ActivationType.Gelu,torch.bfloat16,torch.float8_e4m3fn,torch.float8_e4m3fn,QuantType.per_Token,1,1,16,0,48.1657,_ZN5aiter57fmoe_stage1_bf16_pertokenFp8_doweight_g1u1_16x512_2tg_pf2E,0.0%,3.53,1763.96
stage1,256,4,2304,1536,8,2,ActivationType.Gelu,torch.bfloat16,torch.float8_e4m3fn,torch.float8_e4m3fn,QuantType.per_Token,1,1,16,0,45.6532,_ZN5aiter53fmoe_stage1_bf16_pertokenFp8_doweight_g1u1_16x512_pf3E,0.0%,3.72,1861.04
stage1,256,4,2304,1536,8,2,ActivationType.Gelu,torch.bfloat16,torch.float8_e4m3fn,torch.float8_e4m3fn,QuantType.per_Token,1,1,16,0,23.7446,_ZN5aiter56fmoe_stage1_bf16_pertokenFp8_doweight_g1u1_16x64_6tg_pf2E,0.0%,7.15,3578.17
stage1,256,4,2304,1536,8,2,ActivationType.Gelu,torch.bfloat16,torch.float8_e4m3fn,torch.float8_e4m3fn,QuantType.per_Token,1,1,16,0,15.2263,_ZN5aiter56fmoe_stage1_bf16_pertokenFp8_doweight_g1u1_16x64_5tg_pf3E,0.0%,11.16,5579.97
stage1,256,4,2304,1536,8,2,ActivationType.Gelu,torch.bfloat16,torch.float8_e4m3fn,torch.float8_e4m3fn,QuantType.per_Token,1,1,32,0,26.6852,_ZN5aiter57fmoe_stage1_bf16_pertokenFp8_doweight_g1u1_32x128_3tg_pf2E,0.0%,6.37,3183.87
stage1,256,4,2304,1536,8,2,ActivationType.Gelu,torch.bfloat16,torch.float8_e4m3fn,torch.float8_e4m3fn,QuantType.per_Token,1,1,32,0,17.4721,_ZN5aiter57fmoe_stage1_bf16_pertokenFp8_doweight_g1u1_32x128_3tg_pf3E,0.0%,9.72,4862.74
stage1,256,4,2304,1536,8,2,ActivationType.Gelu,torch.bfloat16,torch.float8_e4m3fn,torch.float8_e4m3fn,QuantType.per_Token,1,1,32,0,32.445,_ZN5aiter57fmoe_stage1_bf16_pertokenFp8_doweight_g1u1_32x256_2tg_pf2E,0.0%,5.24,2618.66
stage1,256,4,2304,1536,8,2,ActivationType.Gelu,torch.bfloat16,torch.float8_e4m3fn,torch.float8_e4m3fn,QuantType.per_Token,1,1,32,0,25.7471,_ZN5aiter57fmoe_stage1_bf16_pertokenFp8_doweight_g1u1_32x256_2tg_pf3E,0.0%,6.6,3299.88
stage1,256,4,2304,1536,8,2,ActivationType.Gelu,torch.bfloat16,torch.float8_e4m3fn,torch.float8_e4m3fn,QuantType.per_Token,1,1,32,0,52.3719,_ZN5aiter53fmoe_stage1_bf16_pertokenFp8_doweight_g1u1_32x512_pf2E,0.0%,3.24,1622.29
stage1,256,4,2304,1536,8,2,ActivationType.Gelu,torch.bfloat16,torch.float8_e4m3fn,torch.float8_e4m3fn,QuantType.per_Token,1,1,32,0,46.9403,_ZN5aiter53fmoe_stage1_bf16_pertokenFp8_doweight_g1u1_32x512_pf3E,0.0%,3.62,1810.01
stage1,256,4,2304,1536,8,2,ActivationType.Gelu,torch.bfloat16,torch.float8_e4m3fn,torch.float8_e4m3fn,QuantType.per_Token,1,1,32,0,24.2706,_ZN5aiter56fmoe_stage1_bf16_pertokenFp8_doweight_g1u1_32x64_4tg_pf2E,0.0%,7.0,3500.63
stage1,256,4,2304,1536,8,2,ActivationType.Gelu,torch.bfloat16,torch.float8_e4m3fn,torch.float8_e4m3fn,QuantType.per_Token,1,1,32,0,15.5617,_ZN5aiter56fmoe_stage1_bf16_pertokenFp8_doweight_g1u1_32x64_4tg_pf3E,0.0%,10.92,5459.71
stage1,256,4,2304,1536,8,2,ActivationType.Gelu,torch.bfloat16,torch.float8_e4m3fn,torch.float8_e4m3fn,QuantType.per_Token,1,1,64,0,27.6329,_ZN5aiter57fmoe_stage1_bf16_pertokenFp8_doweight_g1u1_64x128_2tg_pf2E,0.0%,6.15,3074.68
stage1,256,4,2304,1536,8,2,ActivationType.Gelu,torch.bfloat16,torch.float8_e4m3fn,torch.float8_e4m3fn,QuantType.per_Token,1,1,64,0,18.6811,_ZN5aiter57fmoe_stage1_bf16_pertokenFp8_doweight_g1u1_64x128_2tg_pf3E,0.0%,9.09,4548.04
stage1,256,4,2304,1536,8,2,ActivationType.Gelu,torch.bfloat16,torch.float8_e4m3fn,torch.float8_e4m3fn,QuantType.per_Token,1,1,64,0,34.3237,_ZN5aiter53fmoe_stage1_bf16_pertokenFp8_doweight_g1u1_64x256_pf2E,0.0%,4.95,2475.32
stage1,256,4,2304,1536,8,2,ActivationType.Gelu,torch.bfloat16,torch.float8_e4m3fn,torch.float8_e4m3fn,QuantType.per_Token,1,1,64,0,28.6772,_ZN5aiter53fmoe_stage1_bf16_pertokenFp8_doweight_g1u1_64x256_pf3E,0.0%,5.92,2962.71
stage1,256,4,2304,1536,8,2,ActivationType.Gelu,torch.bfloat16,torch.float8_e4m3fn,torch.float8_e4m3fn,QuantType.per_Token,1,1,64,0,25.0846,_ZN5aiter56fmoe_stage1_bf16_pertokenFp8_doweight_g1u1_64x64_2tg_pf2E,0.0%,6.77,3387.03
stage1,256,4,2304,1536,8,2,ActivationType.Gelu,torch.bfloat16,torch.float8_e4m3fn,torch.float8_e4m3fn,QuantType.per_Token,1,1,64,0,16.3173,_ZN5aiter56fmoe_stage1_bf16_pertokenFp8_doweight_g1u1_64x64_2tg_pf3E,0.0%,10.41,5206.88
stage1,256,4,2304,1536,8,2,ActivationType.Gelu,torch.bfloat16,torch.float8_e4m3fn,torch.float8_e4m3fn,QuantType.per_Token,1,1,128,0,29.8738,_ZN5aiter54fmoe_stage1_bf16_pertokenFp8_doweight_g1u1_128x128_pf2E,0.0%,5.69,2844.04
stage1,256,4,2304,1536,8,2,ActivationType.Gelu,torch.bfloat16,torch.float8_e4m3fn,torch.float8_e4m3fn,QuantType.per_Token,1,1,128,0,24.0991,_ZN5aiter54fmoe_stage1_bf16_pertokenFp8_doweight_g1u1_128x128_pf3E,0.0%,7.05,3525.54
stage1,256,4,2304,1536,8,2,ActivationType.Gelu,torch.bfloat16,torch.float8_e4m3fn,torch.float8_e4m3fn,QuantType.per_Token,1,1,128,0,26.746,_ZN5aiter53fmoe_stage1_bf16_pertokenFp8_doweight_g1u1_128x64_pf2E,0.0%,6.35,3176.64
stage1,256,4,2304,1536,8,2,ActivationType.Gelu,torch.bfloat16,torch.float8_e4m3fn,torch.float8_e4m3fn,QuantType.per_Token,1,1,128,0,17.7261,_ZN5aiter53fmoe_stage1_bf16_pertokenFp8_doweight_g1u1_128x64_pf3E,0.0%,9.58,4793.06
stage1,256,4,2304,1536,8,2,ActivationType.Gelu,torch.bfloat16,torch.float8_e4m3fn,torch.float8_e4m3fn,QuantType.per_Token,1,1,32,0,12.646,moe_ck2stages_gemm1_256x32x64x256_1x4_TypeCast_v1_Nswizzle0_Quant2_MulRoutedWeight1_gelu_F8_F8_B16,0.0%,13.43,6718.51
stage1,256,4,2304,1536,8,2,ActivationType.Gelu,torch.bfloat16,torch.float8_e4m3fn,torch.float8_e4m3fn,QuantType.per_Token,1,1,32,0,16.5038,moe_ck2stages_gemm1_256x32x64x128_1x4_TypeCast_v1_Nswizzle0_Quant2_MulRoutedWeight1_gelu_F8_F8_B16,0.0%,10.29,5148.04
stage2,256,4,2304,1536,8,2,ActivationType.Gelu,torch.bfloat16,torch.float8_e4m3fn,torch.float8_e4m3fn,QuantType.per_Token,1,1,32,0,12.9424,moe_ck2stages_gemm2_256x32x128x256_1x4_TypeCast_v1_Nswizzle0_Quant2_MulRoutedWeight0_F8_F8_B16,0.0%,13.13,6564.65
stage1,256,4,2304,1536,8,2,ActivationType.Gelu,torch.bfloat16,torch.float8_e4m3fn,torch.float8_e4m3fn,QuantType.per_Token,1,1,64,0,15.3085,moe_ck2stages_gemm1_256x64x64x256_1x4_TypeCast_v1_Nswizzle0_Quant2_MulRoutedWeight1_gelu_F8_F8_B16,0.0%,11.1,5550.01
stage1,256,4,2304,1536,8,2,ActivationType.Gelu,torch.bfloat16,torch.float8_e4m3fn,torch.float8_e4m3fn,QuantType.per_Token,1,1,64,0,18.8235,moe_ck2stages_gemm1_256x64x64x128_1x4_TypeCast_v1_Nswizzle0_Quant2_MulRoutedWeight1_gelu_F8_F8_B16,0.0%,9.02,4513.63
stage2,256,4,2304,1536,8,2,ActivationType.Gelu,torch.bfloat16,torch.float8_e4m3fn,torch.float8_e4m3fn,QuantType.per_Token,1,1,64,0,13.7167,moe_ck2stages_gemm2_256x64x128x256_1x4_TypeCast_v1_Nswizzle0_Quant2_MulRoutedWeight0_F8_F8_B16,0.0%,12.38,6194.08
stage1,256,4,2304,1536,8,2,ActivationType.Gelu,torch.bfloat16,torch.float8_e4m3fn,torch.float8_e4m3fn,QuantType.per_Token,1,1,128,0,22.2464,moe_ck2stages_gemm1_256x128x64x128_1x4_TypeCast_v1_Nswizzle0_Quant2_MulRoutedWeight1_gelu_F8_F8_B16,0.0%,7.64,3819.15
stage1,256,4,2304,1536,8,2,ActivationType.Gelu,torch.bfloat16,torch.float8_e4m3fn,torch.float8_e4m3fn,QuantType.per_Token,1,1,128,0,28.3186,moe_ck2stages_gemm1_256x128x128x128_1x4_TypeCast_v3_Nswizzle0_Quant2_MulRoutedWeight1_gelu_F8_F8_B16,0.0%,6.0,3000.23
stage2,256,4,2304,1536,8,2,ActivationType.Gelu,torch.bfloat16,torch.float8_e4m3fn,torch.float8_e4m3fn,QuantType.per_Token,1,1,128,0,20.5961,moe_ck2stages_gemm2_256x128x128x128_1x4_TypeCast_v1_Nswizzle0_Quant2_MulRoutedWeight0_F8_F8_B16,0.0%,8.25,4125.16
stage2,256,4,2304,1536,8,2,ActivationType.Gelu,torch.bfloat16,torch.float8_e4m3fn,torch.float8_e4m3fn,QuantType.per_Token,1,1,128,0,19.7261,moe_ck2stages_gemm2_256x128x128x128_1x4_TypeCast_v3_Nswizzle0_Quant2_MulRoutedWeight0_F8_F8_B16,0.0%,8.61,4307.1
asm_1stage,256,4,2304,1536,8,2,ActivationType.Gelu,torch.bfloat16,torch.float8_e4m3fn,torch.float8_e4m3fn,QuantType.per_Token,1,1,32,0,30.3514,_ZN5aiter46fmoe_bf16_pertokenFp8_g1u1_tkw1_gelu_1tg_32x64E,0.0%,5.6,2799.29
asm_1stage,256,4,2304,1536,8,2,ActivationType.Gelu,torch.bfloat16,torch.float8_e4m3fn,torch.float8_e4m3fn,QuantType.per_Token,1,1,32,0,36.6132,_ZN5aiter50fmoe_bf16_pertokenFp8_g1u1_vs_tkw1_gelu_1tg_32x128E,0.0%,4.64,2320.54
asm_1stage,256,4,2304,1536,8,2,ActivationType.Gelu,torch.bfloat16,torch.float8_e4m3fn,torch.float8_e4m3fn,QuantType.per_Token,1,1,32,0,37.1577,_ZN5aiter53fmoe_bf16_pertokenFp8_g1u1_vs_tkw1_gelu_1tg_ps_32x128E,0.0%,4.57,2286.53
asm_1stage,256,4,2304,1536,8,2,ActivationType.Gelu,torch.bfloat16,torch.float8_e4m3fn,torch.float8_e4m3fn,QuantType.per_Token,1,1,32,0,40.0124,_ZN5aiter50fmoe_bf16_pertokenFp8_g1u1_vs_tkw1_gelu_1tg_32x192E,0.0%,4.25,2123.4
asm_1stage,256,4,2304,1536,8,2,ActivationType.Gelu,torch.bfloat16,torch.float8_e4m3fn,torch.float8_e4m3fn,QuantType.per_Token,1,1,32,0,41.2421,_ZN5aiter53fmoe_bf16_pertokenFp8_g1u1_vs_tkw1_gelu_1tg_ps_32x192E,0.0%,4.12,2060.09
asm_1stage,256,4,2304,1536,8,2,ActivationType.Gelu,torch.bfloat16,torch.float8_e4m3fn,torch.float8_e4m3fn,QuantType.per_Token,1,1,32,0,45.6321,_ZN5aiter53fmoe_bf16_pertokenFp8_g1u1_vs_tkw1_gelu_1tg_ps_32x256E,0.0%,3.72,1861.9
asm_1stage,256,4,2304,1536,8,2,ActivationType.Gelu,torch.bfloat16,torch.float8_e4m3fn,torch.float8_e4m3fn,QuantType.per_Token,1,1,32,0,44.4977,_ZN5aiter50fmoe_bf16_pertokenFp8_g1u1_vs_tkw1_gelu_1tg_32x256E,0.0%,3.82,1909.36
asm_1stage,256,4,2304,1536,8,2,ActivationType.Gelu,torch.bfloat16,torch.float8_e4m3fn,torch.float8_e4m3fn,QuantType.per_Token,1,1,32,0,60.7709,_ZN5aiter53fmoe_bf16_pertokenFp8_g1u1_vs_tkw1_gelu_1tg_ps_32x384E,0.0%,2.8,1398.08
asm_1stage,256,4,2304,1536,8,2,ActivationType.Gelu,torch.bfloat16,torch.float8_e4m3fn,torch.float8_e4m3fn,QuantType.per_Token,1,1,32,0,59.9182,_ZN5aiter50fmoe_bf16_pertokenFp8_g1u1_vs_tkw1_gelu_1tg_32x384E,0.0%,2.84,1417.97
asm_1stage,256,4,2304,1536,8,2,ActivationType.Gelu,torch.bfloat16,torch.float8_e4m3fn,torch.float8_e4m3fn,QuantType.per_Token,1,1,32,0,75.867,_ZN5aiter53fmoe_bf16_pertokenFp8_g1u1_vs_tkw1_gelu_1tg_ps_32x512E,0.0%,2.24,1119.88
asm_1stage,256,4,2304,1536,8,2,ActivationType.Gelu,torch.bfloat16,torch.float8_e4m3fn,torch.float8_e4m3fn,QuantType.per_Token,1,1,32,0,75.1995,_ZN5aiter50fmoe_bf16_pertokenFp8_g1u1_vs_tkw1_gelu_1tg_32x512E,0.0%,2.26,1129.83
stage1,256,56,6144,4096,8,2,ActivationType.Silu,torch.bfloat16,torch.float8_e4m3fn,torch.float8_e4m3fn,QuantType.per_1x128,1,0,16,0,91.3065,_ZN5aiter59fmoe_stage1_bf16_pertokenFp8_blockscale_g1u1_16x128_4tg_pf2E,98.7%,185.22,6626.17
stage1,256,56,6144,4096,8,2,ActivationType.Silu,torch.bfloat16,torch.float8_e4m3fn,torch.float8_e4m3fn,QuantType.per_1x128,1,0,16,0,95.0611,_ZN5aiter59fmoe_stage1_bf16_pertokenFp8_blockscale_g1u1_16x128_4tg_pf3E,98.6%,177.9,6364.45
stage1,256,56,6144,4096,8,2,ActivationType.Silu,torch.bfloat16,torch.float8_e4m3fn,torch.float8_e4m3fn,QuantType.per_1x128,1,0,16,0,99.6593,_ZN5aiter59fmoe_stage1_bf16_pertokenFp8_blockscale_g1u1_16x256_3tg_pf2E,99.0%,169.69,6070.8
stage1,256,56,6144,4096,8,2,ActivationType.Silu,torch.bfloat16,torch.float8_e4m3fn,torch.float8_e4m3fn,QuantType.per_1x128,1,0,16,0,89.5529,_ZN5aiter59fmoe_stage1_bf16_pertokenFp8_blockscale_g1u1_16x256_2tg_pf3E,98.9%,188.84,6755.92
stage1,256,56,6144,4096,8,2,ActivationType.Silu,torch.bfloat16,torch.float8_e4m3fn,torch.float8_e4m3fn,QuantType.per_1x128,1,0,16,0,141.6314,_ZN5aiter59fmoe_stage1_bf16_pertokenFp8_blockscale_g1u1_16x512_2tg_pf2E,99.1%,119.4,4271.74
stage1,256,56,6144,4096,8,2,ActivationType.Silu,torch.bfloat16,torch.float8_e4m3fn,torch.float8_e4m3fn,QuantType.per_1x128,1,0,16,0,136.4927,_ZN5aiter55fmoe_stage1_bf16_pertokenFp8_blockscale_g1u1_16x512_pf3E,99.1%,123.9,4432.56
stage1,256,56,6144,4096,8,2,ActivationType.Silu,torch.bfloat16,torch.float8_e4m3fn,torch.float8_e4m3fn,QuantType.per_1x128,1,0,32,0,83.5482,_ZN5aiter59fmoe_stage1_bf16_pertokenFp8_blockscale_g1u1_32x128_3tg_pf2E,99.3%,202.42,7241.47
stage1,256,56,6144,4096,8,2,ActivationType.Silu,torch.bfloat16,torch.float8_e4m3fn,torch.float8_e4m3fn,QuantType.per_1x128,1,0,32,0,71.3249,_ZN5aiter59fmoe_stage1_bf16_pertokenFp8_blockscale_g1u1_32x128_3tg_pf3E,99.2%,237.1,8482.48
stage1,256,56,6144,4096,8,2,ActivationType.Silu,torch.bfloat16,torch.float8_e4m3fn,torch.float8_e4m3fn,QuantType.per_1x128,1,0,32,0,102.6807,_ZN5aiter59fmoe_stage1_bf16_pertokenFp8_blockscale_g1u1_32x256_2tg_pf2E,99.3%,164.7,5892.17
stage1,256,56,6144,4096,8,2,ActivationType.Silu,torch.bfloat16,torch.float8_e4m3fn,torch.float8_e4m3fn,QuantType.per_1x128,1,0,32,0,90.043,_ZN5aiter59fmoe_stage1_bf16_pertokenFp8_blockscale_g1u1_32x256_2tg_pf3E,99.3%,187.82,6719.14
stage1,256,56,6144,4096,8,2,ActivationType.Silu,torch.bfloat16,torch.float8_e4m3fn,torch.float8_e4m3fn,QuantType.per_1x128,1,0,32,0,144.4631,_ZN5aiter55fmoe_stage1_bf16_pertokenFp8_blockscale_g1u1_32x512_pf2E,99.3%,117.06,4188.0
stage1,256,56,6144,4096,8,2,ActivationType.Silu,torch.bfloat16,torch.float8_e4m3fn,torch.float8_e4m3fn,QuantType.per_1x128,1,0,32,0,133.9974,_ZN5aiter55fmoe_stage1_bf16_pertokenFp8_blockscale_g1u1_32x512_pf3E,99.3%,126.21,4515.1
stage1,256,56,6144,4096,8,2,ActivationType.Silu,torch.bfloat16,torch.float8_e4m3fn,torch.float8_e4m3fn,QuantType.per_1x128,1,0,64,0,84.4018,_ZN5aiter59fmoe_stage1_bf16_pertokenFp8_blockscale_g1u1_64x128_2tg_pf2E,99.3%,200.37,7168.24
stage1,256,56,6144,4096,8,2,ActivationType.Silu,torch.bfloat16,torch.float8_e4m3fn,torch.float8_e4m3fn,QuantType.per_1x128,1,0,64,0,72.4251,_ZN5aiter59fmoe_stage1_bf16_pertokenFp8_blockscale_g1u1_64x128_2tg_pf3E,99.3%,233.5,8353.62
stage1,256,56,6144,4096,8,2,ActivationType.Silu,torch.bfloat16,torch.float8_e4m3fn,torch.float8_e4m3fn,QuantType.per_1x128,1,0,64,0,102.8333,_ZN5aiter55fmoe_stage1_bf16_pertokenFp8_blockscale_g1u1_64x256_pf2E,99.3%,164.45,5883.42
stage1,256,56,6144,4096,8,2,ActivationType.Silu,torch.bfloat16,torch.float8_e4m3fn,torch.float8_e4m3fn,QuantType.per_1x128,1,0,64,0,94.9547,_ZN5aiter55fmoe_stage1_bf16_pertokenFp8_blockscale_g1u1_64x256_pf3E,99.3%,178.1,6371.59
stage1,256,56,6144,4096,8,2,ActivationType.Silu,torch.bfloat16,torch.float8_e4m3fn,torch.float8_e4m3fn,QuantType.per_1x128,1,0,128,0,90.3148,_ZN5aiter56fmoe_stage1_bf16_pertokenFp8_blockscale_g1u1_128x128_pf2E,99.3%,187.25,6698.92
stage1,256,56,6144,4096,8,2,ActivationType.Silu,torch.bfloat16,torch.float8_e4m3fn,torch.float8_e4m3fn,QuantType.per_1x128,1,0,128,0,79.7557,_ZN5aiter56fmoe_stage1_bf16_pertokenFp8_blockscale_g1u1_128x128_pf3E,99.3%,212.04,7585.81
stage1,256,56,6144,4096,8,2,ActivationType.Silu,torch.bfloat16,torch.float8_e4m3fn,torch.float8_e4m3fn,QuantType.per_1x128,1,0,16,0,95.689,moe_ck2stages_gemm1_256x16x128x256_1x4_MulABScaleExpertWeightA8W8blkscale_v1_Nswizzle0_Quant4_MulRoutedWeight0_silu_F8_F8_B16,0.1%,176.73,6322.69
stage1,256,56,6144,4096,8,2,ActivationType.Silu,torch.bfloat16,torch.float8_e4m3fn,torch.float8_e4m3fn,QuantType.per_1x128,1,0,16,0,90.5884,moe_ck2stages_gemm1_128x16x128x128_1x2_MulABScaleExpertWeightA8W8blkscale_v1_Nswizzle0_Quant4_MulRoutedWeight0_silu_F8_F8_B16,0.1%,186.68,6678.69
stage2,256,56,6144,4096,8,2,ActivationType.Silu,torch.bfloat16,torch.float8_e4m3fn,torch.float8_e4m3fn,QuantType.per_1x128,1,0,16,0,54.6297,moe_ck2stages_gemm2_256x16x128x256_1x4_MulABScaleExpertWeightA8W8blkscale_v1_Nswizzle0_Quant4_MulRoutedWeight1_F8_F8_B16,5.2%,309.56,11074.78
stage2,256,56,6144,4096,8,2,ActivationType.Silu,torch.bfloat16,torch.float8_e4m3fn,torch.float8_e4m3fn,QuantType.per_1x128,1,0,16,0,47.5798,moe_ck2stages_gemm2_128x16x128x128_1x2_MulABScaleExpertWeightA8W8blkscale_v1_Nswizzle0_Quant4_MulRoutedWeight1_F8_F8_B16,5.2%,355.43,12715.73
stage1,256,56,6144,4096,8,2,ActivationType.Silu,torch.bfloat16,torch.float8_e4m3fn,torch.float8_e4m3fn,QuantType.per_1x128,1,0,32,0,74.295,moe_ck2stages_gemm1_256x32x128x128_1x4_MulABScaleExpertWeightA8W8blkscale_v1_Nswizzle0_Quant4_MulRoutedWeight0_silu_F8_F8_B16,0.1%,227.63,8143.37
stage2,256,56,6144,4096,8,2,ActivationType.Silu,torch.bfloat16,torch.float8_e4m3fn,torch.float8_e4m3fn,QuantType.per_1x128,1,0,32,0,54.4161,moe_ck2stages_gemm2_256x32x128x128_1x4_MulABScaleExpertWeightA8W8blkscale_v1_Nswizzle0_Quant4_MulRoutedWeight1_F8_F8_B16,5.2%,310.78,11118.25
stage1,256,56,6144,4096,8,2,ActivationType.Silu,torch.bfloat16,torch.float8_e4m3fn,torch.float8_e4m3fn,QuantType.per_1x128,1,0,64,0,90.8206,moe_ck2stages_gemm1_256x64x128x128_1x4_MulABScaleExpertWeightA8W8blkscale_v3_Nswizzle0_Quant4_MulRoutedWeight0_silu_F8_F8_B16,0.1%,186.21,6661.62
stage2,256,56,6144,4096,8,2,ActivationType.Silu,torch.bfloat16,torch.float8_e4m3fn,torch.float8_e4m3fn,QuantType.per_1x128,1,0,64,0,55.2118,moe_ck2stages_gemm2_256x64x128x128_1x4_MulABScaleExpertWeightA8W8blkscale_v3_Nswizzle0_Quant4_MulRoutedWeight1_F8_F8_B16,5.2%,306.3,10958.02
asm_1stage,256,56,6144,4096,8,2,ActivationType.Silu,torch.bfloat16,torch.float8_e4m3fn,torch.float8_e4m3fn,QuantType.per_1x128,1,0,32,0,132.7201,_ZN5aiter52fmoe_bf16_blockscaleFp8_g1u1_novs_silu_1tg_ps_32x256E,0.4%,127.42,4558.56
asm_1stage,256,56,6144,4096,8,2,ActivationType.Silu,torch.bfloat16,torch.float8_e4m3fn,torch.float8_e4m3fn,QuantType.per_1x128,1,0,32,0,131.4108,_ZN5aiter50fmoe_bf16_blockscaleFp8_g1u1_vs_silu_1tg_ps_32x256E,0.4%,128.69,4603.97
asm_1stage,256,56,6144,4096,8,2,ActivationType.Silu,torch.bfloat16,torch.float8_e4m3fn,torch.float8_e4m3fn,QuantType.per_1x128,1,0,32,0,132.3956,_ZN5aiter49fmoe_bf16_blockscaleFp8_g1u1_novs_silu_1tg_32x256E,0.5%,127.73,4569.73
asm_1stage,256,56,6144,4096,8,2,ActivationType.Silu,torch.bfloat16,torch.float8_e4m3fn,torch.float8_e4m3fn,QuantType.per_1x128,1,0,32,0,130.1526,_ZN5aiter47fmoe_bf16_blockscaleFp8_g1u1_vs_silu_1tg_32x256E,0.4%,129.94,4648.48
stage1,256,512,6144,4096,8,2,ActivationType.Silu,torch.bfloat16,torch.bfloat16,torch.bfloat16,QuantType.No,1,0,32,0,327.3857,moe_ck2stages_gemm1_256x32x64x128_1x4_TypeCast_v1_Nswizzle0_Quant0_MulRoutedWeight0_silu_B16_B16_B16,0.0%,472.28,3728.15
stage1,256,512,6144,4096,8,2,ActivationType.Silu,torch.bfloat16,torch.bfloat16,torch.bfloat16,QuantType.No,1,0,32,0,311.8642,moe_ck2stages_gemm1_256x32x64x64_1x4_TypeCast_v1_Nswizzle0_Quant0_MulRoutedWeight0_silu_B16_B16_B16,0.0%,495.79,3913.7
stage2,256,512,6144,4096,8,2,ActivationType.Silu,torch.bfloat16,torch.bfloat16,torch.bfloat16,QuantType.No,1,0,32,0,156.0154,moe_ck2stages_gemm2_256x32x128x128_1x4_TypeCast_v1_Nswizzle0_Quant0_MulRoutedWeight1_B16_B16_B16,2.4%,991.05,7823.22
stage2,256,512,6144,4096,8,2,ActivationType.Silu,torch.bfloat16,torch.bfloat16,torch.bfloat16,QuantType.No,1,0,32,0,178.2126,moe_ck2stages_gemm2_256x32x64x64_1x4_TypeCast_v1_Nswizzle0_Quant0_MulRoutedWeight1_B16_B16_B16,2.4%,867.61,6848.8
stage1,256,512,6144,4096,8,2,ActivationType.Silu,torch.bfloat16,torch.bfloat16,torch.bfloat16,QuantType.No,1,0,64,0,225.9771,moe_ck2stages_gemm1_256x64x64x128_1x4_TypeCast_v1_Nswizzle0_Quant0_MulRoutedWeight0_silu_B16_B16_B16,0.0%,684.22,5401.18
stage1,256,512,6144,4096,8,2,ActivationType.Silu,torch.bfloat16,torch.bfloat16,torch.bfloat16,QuantType.No,1,0,64,0,232.0261,moe_ck2stages_gemm1_256x64x64x64_1x4_TypeCast_v1_Nswizzle0_Quant0_MulRoutedWeight0_silu_B16_B16_B16,0.0%,666.39,5260.37
stage2,256,512,6144,4096,8,2,ActivationType.Silu,torch.bfloat16,torch.bfloat16,torch.bfloat16,QuantType.No,1,0,64,0,120.2501,moe_ck2stages_gemm2_256x64x128x128_1x4_TypeCast_v1_Nswizzle0_Quant0_MulRoutedWeight1_B16_B16_B16,2.4%,1285.81,10150.03
stage2,256,512,6144,4096,8,2,ActivationType.Silu,torch.bfloat16,torch.bfloat16,torch.bfloat16,QuantType.No,1,0,64,0,139.6392,moe_ck2stages_gemm2_256x64x64x64_1x4_TypeCast_v1_Nswizzle0_Quant0_MulRoutedWeight1_B16_B16_B16,2.4%,1107.27,8740.69
stage2,256,512,6144,4096,8,2,ActivationType.Silu,torch.bfloat16,torch.bfloat16,torch.bfloat16,QuantType.No,1,0,64,0,128.3515,moe_ck2stages_gemm2_256x64x128x64_1x4_TypeCast_v1_Nswizzle0_Quant0_MulRoutedWeight1_B16_B16_B16,2.4%,1204.65,9509.37
stage1,256,512,6144,4096,8,2,ActivationType.Silu,torch.bfloat16,torch.bfloat16,torch.bfloat16,QuantType.No,1,0,128,0,223.1913,moe_ck2stages_gemm1_256x128x64x64_1x4_TypeCast_v1_Nswizzle0_Quant0_MulRoutedWeight0_silu_B16_B16_B16,0.0%,692.76,5468.59
stage1,256,512,6144,4096,8,2,ActivationType.Silu,torch.bfloat16,torch.bfloat16,torch.bfloat16,QuantType.No,1,0,128,0,212.7468,moe_ck2stages_gemm1_256x128x128x64_1x4_TypeCast_v3_Nswizzle0_Quant0_MulRoutedWeight0_silu_B16_B16_B16,0.0%,726.77,5737.07
stage2,256,512,6144,4096,8,2,ActivationType.Silu,torch.bfloat16,torch.bfloat16,torch.bfloat16,QuantType.No,1,0,128,0,136.9248,moe_ck2stages_gemm2_256x128x128x64_1x4_TypeCast_v1_Nswizzle0_Quant0_MulRoutedWeight1_B16_B16_B16,2.4%,1129.22,8913.96
stage2,256,512,6144,4096,8,2,ActivationType.Silu,torch.bfloat16,torch.bfloat16,torch.bfloat16,QuantType.No,1,0,128,0,134.5256,moe_ck2stages_gemm2_256x128x128x64_1x4_TypeCast_v3_Nswizzle0_Quant0_MulRoutedWeight1_B16_B16_B16,2.4%,1149.36,9072.94
stage2,256,512,6144,4096,8,2,ActivationType.Silu,torch.bfloat16,torch.bfloat16,torch.bfloat16,QuantType.No,1,0,128,0,140.6584,moe_ck2stages_gemm2_256x128x64x64_1x4_TypeCast_v3_Nswizzle0_Quant0_MulRoutedWeight1_B16_B16_B16,2.4%,1099.25,8677.35
stage2,256,512,6144,4096,8,2,ActivationType.Silu,torch.bfloat16,torch.bfloat16,torch.bfloat16,QuantType.No,1,0,128,0,136.5127,moe_ck2stages_gemm2_256x128x64x64_1x4_TypeCast_v1_Nswizzle0_Quant0_MulRoutedWeight1_B16_B16_B16,2.4%,1132.63,8940.87
