aiter/configs/profile_fmoe.csv
stage,cu_num,token,model_dim,inter_dim,expert,topk,act_type,dtype,q_dtype_a,q_dtype_w,q_type,use_g1u1,doweight_stage1,block_m,ksplit,us,kernelName,err,tflops,bw,flat
stage1,80,1,6144,384,128,4,ActivationType.Swiglu,torch.bfloat16,torch.float8_e4m3fnuz,torch.float8_e4m3fnuz,QuantType.per_Token,1,0,16,0,63.2051,_ZN5aiter48fmoe_stage1_bf16_pertokenFp8_g1u1_16x128_4tg_pf2E,97.1%,0.9,14334.1,0
stage1,80,1,6144,384,128,4,ActivationType.Swiglu,torch.bfloat16,torch.float8_e4m3fnuz,torch.float8_e4m3fnuz,QuantType.per_Token,1,0,16,0,36.1064,_ZN5aiter48fmoe_stage1_bf16_pertokenFp8_g1u1_16x128_4tg_pf3E,97.1%,1.57,25092.17,0
stage1,80,1,6144,384,128,4,ActivationType.Swiglu,torch.bfloat16,torch.float8_e4m3fnuz,torch.float8_e4m3fnuz,QuantType.per_Token,1,0,16,0,-1.0,_ZN5aiter48fmoe_stage1_bf16_pertokenFp8_g1u1_16x256_3tg_pf2E,100.0%,0.0,0.0,0
stage1,80,1,6144,384,128,4,ActivationType.Swiglu,torch.bfloat16,torch.float8_e4m3fnuz,torch.float8_e4m3fnuz,QuantType.per_Token,1,0,16,0,-1.0,_ZN5aiter48fmoe_stage1_bf16_pertokenFp8_g1u1_16x256_2tg_pf3E,100.0%,0.0,0.0,0
stage1,80,1,6144,384,128,4,ActivationType.Swiglu,torch.bfloat16,torch.float8_e4m3fnuz,torch.float8_e4m3fnuz,QuantType.per_Token,1,0,16,0,-1.0,_ZN5aiter48fmoe_stage1_bf16_pertokenFp8_g1u1_16x512_2tg_pf2E,100.0%,0.0,0.0,0
stage1,80,1,6144,384,128,4,ActivationType.Swiglu,torch.bfloat16,torch.float8_e4m3fnuz,torch.float8_e4m3fnuz,QuantType.per_Token,1,0,16,0,-1.0,_ZN5aiter44fmoe_stage1_bf16_pertokenFp8_g1u1_16x512_pf3E,100.0%,0.0,0.0,0
stage1,80,1,6144,384,128,4,ActivationType.Swiglu,torch.bfloat16,torch.float8_e4m3fnuz,torch.float8_e4m3fnuz,QuantType.per_Token,1,0,16,0,55.0921,_ZN5aiter47fmoe_stage1_bf16_pertokenFp8_g1u1_16x64_6tg_pf2E,97.1%,1.03,16444.97,0
stage1,80,1,6144,384,128,4,ActivationType.Swiglu,torch.bfloat16,torch.float8_e4m3fnuz,torch.float8_e4m3fnuz,QuantType.per_Token,1,0,16,0,30.6806,_ZN5aiter47fmoe_stage1_bf16_pertokenFp8_g1u1_16x64_5tg_pf3E,97.1%,1.85,29529.67,0
stage1,80,1,6144,384,128,4,ActivationType.Swiglu,torch.bfloat16,torch.float8_e4m3fnuz,torch.float8_e4m3fnuz,QuantType.per_Token,1,0,32,0,63.0337,_ZN5aiter48fmoe_stage1_bf16_pertokenFp8_g1u1_32x128_3tg_pf2E,97.1%,0.9,14373.07,0
stage1,80,1,6144,384,128,4,ActivationType.Swiglu,torch.bfloat16,torch.float8_e4m3fnuz,torch.float8_e4m3fnuz,QuantType.per_Token,1,0,32,0,37.3816,_ZN5aiter48fmoe_stage1_bf16_pertokenFp8_g1u1_32x128_3tg_pf3E,97.1%,1.51,24236.2,0
stage1,80,1,6144,384,128,4,ActivationType.Swiglu,torch.bfloat16,torch.float8_e4m3fnuz,torch.float8_e4m3fnuz,QuantType.per_Token,1,0,32,0,-1.0,_ZN5aiter48fmoe_stage1_bf16_pertokenFp8_g1u1_32x256_2tg_pf2E,100.0%,0.0,0.0,0
stage1,80,1,6144,384,128,4,ActivationType.Swiglu,torch.bfloat16,torch.float8_e4m3fnuz,torch.float8_e4m3fnuz,QuantType.per_Token,1,0,32,0,-1.0,_ZN5aiter48fmoe_stage1_bf16_pertokenFp8_g1u1_32x256_2tg_pf3E,100.0%,0.0,0.0,0
stage1,80,1,6144,384,128,4,ActivationType.Swiglu,torch.bfloat16,torch.float8_e4m3fnuz,torch.float8_e4m3fnuz,QuantType.per_Token,1,0,32,0,-1.0,_ZN5aiter44fmoe_stage1_bf16_pertokenFp8_g1u1_32x512_pf2E,100.0%,0.0,0.0,0
stage1,80,1,6144,384,128,4,ActivationType.Swiglu,torch.bfloat16,torch.float8_e4m3fnuz,torch.float8_e4m3fnuz,QuantType.per_Token,1,0,32,0,-1.0,_ZN5aiter44fmoe_stage1_bf16_pertokenFp8_g1u1_32x512_pf3E,100.0%,0.0,0.0,0
stage1,80,1,6144,384,128,4,ActivationType.Swiglu,torch.bfloat16,torch.float8_e4m3fnuz,torch.float8_e4m3fnuz,QuantType.per_Token,1,0,32,0,56.0599,_ZN5aiter47fmoe_stage1_bf16_pertokenFp8_g1u1_32x64_4tg_pf2E,97.1%,1.01,16161.07,0
stage1,80,1,6144,384,128,4,ActivationType.Swiglu,torch.bfloat16,torch.float8_e4m3fnuz,torch.float8_e4m3fnuz,QuantType.per_Token,1,0,32,0,31.4916,_ZN5aiter47fmoe_stage1_bf16_pertokenFp8_g1u1_32x64_4tg_pf3E,97.1%,1.8,28769.2,0
stage1,80,1,6144,384,128,4,ActivationType.Swiglu,torch.bfloat16,torch.float8_e4m3fnuz,torch.float8_e4m3fnuz,QuantType.per_Token,1,0,64,0,64.1424,_ZN5aiter48fmoe_stage1_bf16_pertokenFp8_g1u1_64x128_2tg_pf2E,97.1%,0.88,14124.64,0
stage1,80,1,6144,384,128,4,ActivationType.Swiglu,torch.bfloat16,torch.float8_e4m3fnuz,torch.float8_e4m3fnuz,QuantType.per_Token,1,0,64,0,44.0527,_ZN5aiter48fmoe_stage1_bf16_pertokenFp8_g1u1_64x128_2tg_pf3E,97.1%,1.29,20566.01,0
stage1,80,1,6144,384,128,4,ActivationType.Swiglu,torch.bfloat16,torch.float8_e4m3fnuz,torch.float8_e4m3fnuz,QuantType.per_Token,1,0,64,0,-1.0,_ZN5aiter44fmoe_stage1_bf16_pertokenFp8_g1u1_64x256_pf2E,100.0%,0.0,0.0,0
stage1,80,1,6144,384,128,4,ActivationType.Swiglu,torch.bfloat16,torch.float8_e4m3fnuz,torch.float8_e4m3fnuz,QuantType.per_Token,1,0,64,0,-1.0,_ZN5aiter44fmoe_stage1_bf16_pertokenFp8_g1u1_64x256_pf3E,100.0%,0.0,0.0,0
stage1,80,1,6144,384,128,4,ActivationType.Swiglu,torch.bfloat16,torch.float8_e4m3fnuz,torch.float8_e4m3fnuz,QuantType.per_Token,1,0,64,0,56.6788,_ZN5aiter47fmoe_stage1_bf16_pertokenFp8_g1u1_64x64_3tg_pf2E,97.1%,1.0,15984.6,0
stage1,80,1,6144,384,128,4,ActivationType.Swiglu,torch.bfloat16,torch.float8_e4m3fnuz,torch.float8_e4m3fnuz,QuantType.per_Token,1,0,64,0,33.3469,_ZN5aiter47fmoe_stage1_bf16_pertokenFp8_g1u1_64x64_2tg_pf3E,97.1%,1.7,27168.59,0
stage1,80,1,6144,384,128,4,ActivationType.Swiglu,torch.bfloat16,torch.float8_e4m3fnuz,torch.float8_e4m3fnuz,QuantType.per_Token,1,0,128,0,83.0726,_ZN5aiter45fmoe_stage1_bf16_pertokenFp8_g1u1_128x128_pf2E,97.1%,0.68,10905.98,0
stage1,80,1,6144,384,128,4,ActivationType.Swiglu,torch.bfloat16,torch.float8_e4m3fnuz,torch.float8_e4m3fnuz,QuantType.per_Token,1,0,128,0,81.3108,_ZN5aiter45fmoe_stage1_bf16_pertokenFp8_g1u1_128x128_pf3E,97.1%,0.7,11142.28,0
stage1,80,1,6144,384,128,4,ActivationType.Swiglu,torch.bfloat16,torch.float8_e4m3fnuz,torch.float8_e4m3fnuz,QuantType.per_Token,1,0,128,0,60.2078,_ZN5aiter44fmoe_stage1_bf16_pertokenFp8_g1u1_128x64_pf2E,97.1%,0.94,15047.69,0
stage1,80,1,6144,384,128,4,ActivationType.Swiglu,torch.bfloat16,torch.float8_e4m3fnuz,torch.float8_e4m3fnuz,QuantType.per_Token,1,0,128,0,50.3357,_ZN5aiter44fmoe_stage1_bf16_pertokenFp8_g1u1_128x64_pf3E,97.1%,1.12,17998.92,0
stage1,80,1,6144,384,128,4,ActivationType.Swiglu,torch.bfloat16,torch.float8_e4m3fnuz,torch.float8_e4m3fnuz,QuantType.per_Token,1,0,16,0,36.7483,moe_ck2stages_gemm1_128x16x64x128_1x2_MulABScale_v1_Nswizzle0_Quant2_MulRoutedWeight0_swiglu_F8_F8_B16,0.0%,1.54,24653.88,0
stage1,80,1,6144,384,128,4,ActivationType.Swiglu,torch.bfloat16,torch.float8_e4m3fnuz,torch.float8_e4m3fnuz,QuantType.per_Token,1,0,16,0,29.9009,moe_ck2stages_gemm1_256x16x128x256_1x4_MulABScale_v1_Nswizzle0_Quant2_MulRoutedWeight0_swiglu_F8_F8_B16,0.0%,1.89,30299.69,0
stage1,80,1,6144,384,128,4,ActivationType.Swiglu,torch.bfloat16,torch.float8_e4m3fnuz,torch.float8_e4m3fnuz,QuantType.per_Token,1,0,16,0,21.4041,moe_ck2stages_gemm1_256x16x64x256_1x4_MulABScale_v1_Nswizzle0_Quant2_MulRoutedWeight0_swiglu_F8_F8_B16,0.0%,2.65,42327.78,0
stage2,80,1,6144,384,128,4,ActivationType.Swiglu,torch.bfloat16,torch.float8_e4m3fnuz,torch.float8_e4m3fnuz,QuantType.per_Token,1,0,16,0,-1.0,moe_ck2stages_gemm2_256x16x128x256_1x4_MulABScaleExpertWeight_v1_Nswizzle0_Quant2_MulRoutedWeight1_F8_F8_B16,100.0%,0.0,0.0,0
stage2,80,1,6144,384,128,4,ActivationType.Swiglu,torch.bfloat16,torch.float8_e4m3fnuz,torch.float8_e4m3fnuz,QuantType.per_Token,1,0,16,0,12.1381,moe_ck2stages_gemm2_128x16x128x128_1x2_MulABScaleExpertWeight_v1_Nswizzle0_Quant2_MulRoutedWeight1_F8_F8_B16,2.3%,4.66,74640.03,0
stage2,80,1,6144,384,128,4,ActivationType.Swiglu,torch.bfloat16,torch.float8_e4m3fnuz,torch.float8_e4m3fnuz,QuantType.per_Token,1,0,16,0,12.9661,moe_ck2stages_gemm2_64x16x64x64_1x1_MulABScaleExpertWeight_v1_Nswizzle0_Quant2_MulRoutedWeight1_F8_F8_B16,2.6%,4.37,69873.6,0
stage1,80,1,6144,384,128,4,ActivationType.Swiglu,torch.bfloat16,torch.float8_e4m3fnuz,torch.float8_e4m3fnuz,QuantType.per_Token,1,0,32,0,24.4335,moe_ck2stages_gemm1_256x32x64x256_1x4_MulABScale_v1_Nswizzle0_Quant2_MulRoutedWeight0_swiglu_F8_F8_B16,0.0%,2.32,37079.75,0
stage1,80,1,6144,384,128,4,ActivationType.Swiglu,torch.bfloat16,torch.float8_e4m3fnuz,torch.float8_e4m3fnuz,QuantType.per_Token,1,0,32,0,33.0965,moe_ck2stages_gemm1_256x32x64x128_1x4_MulABScale_v1_Nswizzle0_Quant2_MulRoutedWeight0_swiglu_F8_F8_B16,0.0%,1.71,27374.14,0
stage2,80,1,6144,384,128,4,ActivationType.Swiglu,torch.bfloat16,torch.float8_e4m3fnuz,torch.float8_e4m3fnuz,QuantType.per_Token,1,0,32,0,-1.0,moe_ck2stages_gemm2_256x32x64x256_1x4_MulABScaleExpertWeight_v1_Nswizzle0_Quant2_MulRoutedWeight1_F8_F8_B16,100.0%,0.0,0.0,0
stage2,80,1,6144,384,128,4,ActivationType.Swiglu,torch.bfloat16,torch.float8_e4m3fnuz,torch.float8_e4m3fnuz,QuantType.per_Token,1,0,32,0,12.8034,moe_ck2stages_gemm2_256x32x64x128_1x4_MulABScaleExpertWeight_v1_Nswizzle0_Quant2_MulRoutedWeight1_F8_F8_B16,2.5%,4.42,70761.52,0
stage2,80,1,6144,384,128,4,ActivationType.Swiglu,torch.bfloat16,torch.float8_e4m3fnuz,torch.float8_e4m3fnuz,QuantType.per_Token,1,0,32,0,18.2885,moe_ck2stages_gemm2_256x32x64x64_1x4_MulABScaleExpertWeight_v1_Nswizzle0_Quant2_MulRoutedWeight1_F8_F8_B16,99.5%,3.1,49538.68,0
stage1,80,1,6144,384,128,4,ActivationType.Swiglu,torch.bfloat16,torch.float8_e4m3fnuz,torch.float8_e4m3fnuz,QuantType.per_Token,1,0,64,0,36.7876,moe_ck2stages_gemm1_256x64x64x256_1x4_MulABScale_v1_Nswizzle0_Quant2_MulRoutedWeight0_swiglu_F8_F8_B16,0.0%,1.54,24627.54,0
stage1,80,1,6144,384,128,4,ActivationType.Swiglu,torch.bfloat16,torch.float8_e4m3fnuz,torch.float8_e4m3fnuz,QuantType.per_Token,1,0,64,0,40.1918,moe_ck2stages_gemm1_256x64x64x128_1x4_MulABScale_v1_Nswizzle0_Quant2_MulRoutedWeight0_swiglu_F8_F8_B16,0.0%,1.41,22541.62,0
stage1,80,1,6144,384,128,4,ActivationType.Swiglu,torch.bfloat16,torch.float8_e4m3fnuz,torch.float8_e4m3fnuz,QuantType.per_Token,1,0,64,0,56.7115,moe_ck2stages_gemm1_256x64x128x256_1x4_MulABScale_v3_Nswizzle0_Quant2_MulRoutedWeight0_swiglu_F8_F8_B16,0.0%,1.0,15975.39,0
stage1,80,1,6144,384,128,4,ActivationType.Swiglu,torch.bfloat16,torch.float8_e4m3fnuz,torch.float8_e4m3fnuz,QuantType.per_Token,1,0,64,0,60.4236,moe_ck2stages_gemm1_256x64x128x128_1x4_MulABScale_v3_Nswizzle0_Quant2_MulRoutedWeight0_swiglu_F8_F8_B16,0.0%,0.94,14993.94,0
stage2,80,1,6144,384,128,4,ActivationType.Swiglu,torch.bfloat16,torch.float8_e4m3fnuz,torch.float8_e4m3fnuz,QuantType.per_Token,1,0,64,0,-1.0,moe_ck2stages_gemm2_256x64x64x256_1x4_MulABScaleExpertWeight_v1_Nswizzle0_Quant2_MulRoutedWeight1_F8_F8_B16,100.0%,0.0,0.0,0
stage2,80,1,6144,384,128,4,ActivationType.Swiglu,torch.bfloat16,torch.float8_e4m3fnuz,torch.float8_e4m3fnuz,QuantType.per_Token,1,0,64,0,-1.0,moe_ck2stages_gemm2_256x64x128x256_1x4_MulABScaleExpertWeight_v3_Nswizzle0_Quant2_MulRoutedWeight1_F8_F8_B16,100.0%,0.0,0.0,0
stage2,80,1,6144,384,128,4,ActivationType.Swiglu,torch.bfloat16,torch.float8_e4m3fnuz,torch.float8_e4m3fnuz,QuantType.per_Token,1,0,64,0,23.7589,moe_ck2stages_gemm2_256x64x128x128_1x4_MulABScaleExpertWeight_v3_Nswizzle0_Quant2_MulRoutedWeight1_F8_F8_B16,2.3%,2.38,38132.58,0
stage2,80,1,6144,384,128,4,ActivationType.Swiglu,torch.bfloat16,torch.float8_e4m3fnuz,torch.float8_e4m3fnuz,QuantType.per_Token,1,0,64,0,33.0646,moe_ck2stages_gemm2_256x64x128x64_1x4_MulABScaleExpertWeight_v3_Nswizzle0_Quant2_MulRoutedWeight1_F8_F8_B16,99.5%,1.71,27400.55,0
stage2,80,1,6144,384,128,4,ActivationType.Swiglu,torch.bfloat16,torch.float8_e4m3fnuz,torch.float8_e4m3fnuz,QuantType.per_Token,1,0,64,0,27.6519,moe_ck2stages_gemm2_256x64x64x64_1x4_MulABScaleExpertWeight_v1_Nswizzle0_Quant2_MulRoutedWeight1_F8_F8_B16,99.5%,2.05,32764.05,0
stage1,80,1,6144,384,128,4,ActivationType.Swiglu,torch.bfloat16,torch.float8_e4m3fnuz,torch.float8_e4m3fnuz,QuantType.per_Token,1,0,128,0,66.0687,moe_ck2stages_gemm1_256x128x64x128_1x4_MulABScale_v1_Nswizzle0_Quant2_MulRoutedWeight0_swiglu_F8_F8_B16,0.0%,0.86,13712.82,0
stage1,80,1,6144,384,128,4,ActivationType.Swiglu,torch.bfloat16,torch.float8_e4m3fnuz,torch.float8_e4m3fnuz,QuantType.per_Token,1,0,128,0,106.5791,moe_ck2stages_gemm1_256x128x128x256_1x4_MulABScale_v3_Nswizzle0_Quant2_MulRoutedWeight0_swiglu_F8_F8_B16,0.0%,0.53,8500.62,0
stage1,80,1,6144,384,128,4,ActivationType.Swiglu,torch.bfloat16,torch.float8_e4m3fnuz,torch.float8_e4m3fnuz,QuantType.per_Token,1,0,128,0,105.8754,moe_ck2stages_gemm1_256x128x128x128_1x4_MulABScale_v3_Nswizzle0_Quant2_MulRoutedWeight0_swiglu_F8_F8_B16,0.0%,0.53,8557.12,0
stage2,80,1,6144,384,128,4,ActivationType.Swiglu,torch.bfloat16,torch.float8_e4m3fnuz,torch.float8_e4m3fnuz,QuantType.per_Token,1,0,128,0,40.4658,moe_ck2stages_gemm2_256x128x64x128_1x4_MulABScaleExpertWeight_v1_Nswizzle0_Quant2_MulRoutedWeight1_F8_F8_B16,2.5%,1.4,22388.98,0
stage2,80,1,6144,384,128,4,ActivationType.Swiglu,torch.bfloat16,torch.float8_e4m3fnuz,torch.float8_e4m3fnuz,QuantType.per_Token,1,0,128,0,36.4625,moe_ck2stages_gemm2_256x128x128x128_1x4_MulABScaleExpertWeight_v3_Nswizzle0_Quant2_MulRoutedWeight1_F8_F8_B16,2.4%,1.55,24847.12,0
stage2,80,1,6144,384,128,4,ActivationType.Swiglu,torch.bfloat16,torch.float8_e4m3fnuz,torch.float8_e4m3fnuz,QuantType.per_Token,1,0,128,0,47.6922,moe_ck2stages_gemm2_256x128x128x64_1x4_MulABScaleExpertWeight_v3_Nswizzle0_Quant2_MulRoutedWeight1_F8_F8_B16,99.5%,1.19,18996.57,0
stage2,80,1,6144,384,128,4,ActivationType.Swiglu,torch.bfloat16,torch.float8_e4m3fnuz,torch.float8_e4m3fnuz,QuantType.per_Token,1,0,128,0,45.3533,moe_ck2stages_gemm2_256x128x64x64_1x4_MulABScaleExpertWeight_v3_Nswizzle0_Quant2_MulRoutedWeight1_F8_F8_B16,99.5%,1.25,19976.23,0
stage1,80,2,6144,384,128,4,ActivationType.Swiglu,torch.bfloat16,torch.float8_e4m3fnuz,torch.float8_e4m3fnuz,QuantType.per_Token,1,0,16,0,64.6991,_ZN5aiter48fmoe_stage1_bf16_pertokenFp8_g1u1_16x128_4tg_pf2E,97.8%,1.75,14003.39,0
stage1,80,2,6144,384,128,4,ActivationType.Swiglu,torch.bfloat16,torch.float8_e4m3fnuz,torch.float8_e4m3fnuz,QuantType.per_Token,1,0,16,0,37.4555,_ZN5aiter48fmoe_stage1_bf16_pertokenFp8_g1u1_16x128_4tg_pf3E,97.8%,3.02,24188.88,0
stage1,80,2,6144,384,128,4,ActivationType.Swiglu,torch.bfloat16,torch.float8_e4m3fnuz,torch.float8_e4m3fnuz,QuantType.per_Token,1,0,16,0,-1.0,_ZN5aiter48fmoe_stage1_bf16_pertokenFp8_g1u1_16x256_3tg_pf2E,100.0%,0.0,0.0,0
stage1,80,2,6144,384,128,4,ActivationType.Swiglu,torch.bfloat16,torch.float8_e4m3fnuz,torch.float8_e4m3fnuz,QuantType.per_Token,1,0,16,0,-1.0,_ZN5aiter48fmoe_stage1_bf16_pertokenFp8_g1u1_16x256_2tg_pf3E,100.0%,0.0,0.0,0
stage1,80,2,6144,384,128,4,ActivationType.Swiglu,torch.bfloat16,torch.float8_e4m3fnuz,torch.float8_e4m3fnuz,QuantType.per_Token,1,0,16,0,-1.0,_ZN5aiter48fmoe_stage1_bf16_pertokenFp8_g1u1_16x512_2tg_pf2E,100.0%,0.0,0.0,0
stage1,80,2,6144,384,128,4,ActivationType.Swiglu,torch.bfloat16,torch.float8_e4m3fnuz,torch.float8_e4m3fnuz,QuantType.per_Token,1,0,16,0,-1.0,_ZN5aiter44fmoe_stage1_bf16_pertokenFp8_g1u1_16x512_pf3E,100.0%,0.0,0.0,0
stage1,80,2,6144,384,128,4,ActivationType.Swiglu,torch.bfloat16,torch.float8_e4m3fnuz,torch.float8_e4m3fnuz,QuantType.per_Token,1,0,16,0,56.27,_ZN5aiter47fmoe_stage1_bf16_pertokenFp8_g1u1_16x64_6tg_pf2E,97.8%,2.01,16101.06,0
stage1,80,2,6144,384,128,4,ActivationType.Swiglu,torch.bfloat16,torch.float8_e4m3fnuz,torch.float8_e4m3fnuz,QuantType.per_Token,1,0,16,0,31.4701,_ZN5aiter47fmoe_stage1_bf16_pertokenFp8_g1u1_16x64_5tg_pf3E,97.8%,3.6,28789.44,0
stage1,80,2,6144,384,128,4,ActivationType.Swiglu,torch.bfloat16,torch.float8_e4m3fnuz,torch.float8_e4m3fnuz,QuantType.per_Token,1,0,32,0,63.4863,_ZN5aiter48fmoe_stage1_bf16_pertokenFp8_g1u1_32x128_3tg_pf2E,97.8%,1.78,14270.9,0
stage1,80,2,6144,384,128,4,ActivationType.Swiglu,torch.bfloat16,torch.float8_e4m3fnuz,torch.float8_e4m3fnuz,QuantType.per_Token,1,0,32,0,38.3768,_ZN5aiter48fmoe_stage1_bf16_pertokenFp8_g1u1_32x128_3tg_pf3E,97.8%,2.95,23608.18,0
stage1,80,2,6144,384,128,4,ActivationType.Swiglu,torch.bfloat16,torch.float8_e4m3fnuz,torch.float8_e4m3fnuz,QuantType.per_Token,1,0,32,0,-1.0,_ZN5aiter48fmoe_stage1_bf16_pertokenFp8_g1u1_32x256_2tg_pf2E,100.0%,0.0,0.0,0
stage1,80,2,6144,384,128,4,ActivationType.Swiglu,torch.bfloat16,torch.float8_e4m3fnuz,torch.float8_e4m3fnuz,QuantType.per_Token,1,0,32,0,-1.0,_ZN5aiter48fmoe_stage1_bf16_pertokenFp8_g1u1_32x256_2tg_pf3E,100.0%,0.0,0.0,0
stage1,80,2,6144,384,128,4,ActivationType.Swiglu,torch.bfloat16,torch.float8_e4m3fnuz,torch.float8_e4m3fnuz,QuantType.per_Token,1,0,32,0,-1.0,_ZN5aiter44fmoe_stage1_bf16_pertokenFp8_g1u1_32x512_pf2E,100.0%,0.0,0.0,0
stage1,80,2,6144,384,128,4,ActivationType.Swiglu,torch.bfloat16,torch.float8_e4m3fnuz,torch.float8_e4m3fnuz,QuantType.per_Token,1,0,32,0,-1.0,_ZN5aiter44fmoe_stage1_bf16_pertokenFp8_g1u1_32x512_pf3E,100.0%,0.0,0.0,0
stage1,80,2,6144,384,128,4,ActivationType.Swiglu,torch.bfloat16,torch.float8_e4m3fnuz,torch.float8_e4m3fnuz,QuantType.per_Token,1,0,32,0,56.7829,_ZN5aiter47fmoe_stage1_bf16_pertokenFp8_g1u1_32x64_4tg_pf2E,97.8%,1.99,15955.62,0
stage1,80,2,6144,384,128,4,ActivationType.Swiglu,torch.bfloat16,torch.float8_e4m3fnuz,torch.float8_e4m3fnuz,QuantType.per_Token,1,0,32,0,32.6513,_ZN5aiter47fmoe_stage1_bf16_pertokenFp8_g1u1_32x64_4tg_pf3E,97.8%,3.47,27747.95,0
stage1,80,2,6144,384,128,4,ActivationType.Swiglu,torch.bfloat16,torch.float8_e4m3fnuz,torch.float8_e4m3fnuz,QuantType.per_Token,1,0,64,0,65.4393,_ZN5aiter48fmoe_stage1_bf16_pertokenFp8_g1u1_64x128_2tg_pf2E,97.8%,1.73,13844.99,0
stage1,80,2,6144,384,128,4,ActivationType.Swiglu,torch.bfloat16,torch.float8_e4m3fnuz,torch.float8_e4m3fnuz,QuantType.per_Token,1,0,64,0,44.5656,_ZN5aiter48fmoe_stage1_bf16_pertokenFp8_g1u1_64x128_2tg_pf3E,97.8%,2.54,20329.73,0
stage1,80,2,6144,384,128,4,ActivationType.Swiglu,torch.bfloat16,torch.float8_e4m3fnuz,torch.float8_e4m3fnuz,QuantType.per_Token,1,0,64,0,-1.0,_ZN5aiter44fmoe_stage1_bf16_pertokenFp8_g1u1_64x256_pf2E,100.0%,0.0,0.0,0
stage1,80,2,6144,384,128,4,ActivationType.Swiglu,torch.bfloat16,torch.float8_e4m3fnuz,torch.float8_e4m3fnuz,QuantType.per_Token,1,0,64,0,-1.0,_ZN5aiter44fmoe_stage1_bf16_pertokenFp8_g1u1_64x256_pf3E,100.0%,0.0,0.0,0
stage1,80,2,6144,384,128,4,ActivationType.Swiglu,torch.bfloat16,torch.float8_e4m3fnuz,torch.float8_e4m3fnuz,QuantType.per_Token,1,0,64,0,58.1352,_ZN5aiter47fmoe_stage1_bf16_pertokenFp8_g1u1_64x64_3tg_pf2E,97.8%,1.95,15584.47,0
stage1,80,2,6144,384,128,4,ActivationType.Swiglu,torch.bfloat16,torch.float8_e4m3fnuz,torch.float8_e4m3fnuz,QuantType.per_Token,1,0,64,0,34.3626,_ZN5aiter47fmoe_stage1_bf16_pertokenFp8_g1u1_64x64_2tg_pf3E,97.8%,3.3,26366.06,0
stage1,80,2,6144,384,128,4,ActivationType.Swiglu,torch.bfloat16,torch.float8_e4m3fnuz,torch.float8_e4m3fnuz,QuantType.per_Token,1,0,128,0,83.4237,_ZN5aiter45fmoe_stage1_bf16_pertokenFp8_g1u1_128x128_pf2E,97.8%,1.36,10860.3,0
stage1,80,2,6144,384,128,4,ActivationType.Swiglu,torch.bfloat16,torch.float8_e4m3fnuz,torch.float8_e4m3fnuz,QuantType.per_Token,1,0,128,0,82.2123,_ZN5aiter45fmoe_stage1_bf16_pertokenFp8_g1u1_128x128_pf3E,97.8%,1.38,11020.33,0
stage1,80,2,6144,384,128,4,ActivationType.Swiglu,torch.bfloat16,torch.float8_e4m3fnuz,torch.float8_e4m3fnuz,QuantType.per_Token,1,0,128,0,61.3726,_ZN5aiter44fmoe_stage1_bf16_pertokenFp8_g1u1_128x64_pf2E,97.8%,1.85,14762.39,0
stage1,80,2,6144,384,128,4,ActivationType.Swiglu,torch.bfloat16,torch.float8_e4m3fnuz,torch.float8_e4m3fnuz,QuantType.per_Token,1,0,128,0,50.6957,_ZN5aiter44fmoe_stage1_bf16_pertokenFp8_g1u1_128x64_pf3E,97.8%,2.23,17871.47,0
stage1,80,2,6144,384,128,4,ActivationType.Swiglu,torch.bfloat16,torch.float8_e4m3fnuz,torch.float8_e4m3fnuz,QuantType.per_Token,1,0,16,0,37.7704,moe_ck2stages_gemm1_128x16x64x128_1x2_MulABScale_v1_Nswizzle0_Quant2_MulRoutedWeight0_swiglu_F8_F8_B16,0.0%,3.0,23987.21,0
stage1,80,2,6144,384,128,4,ActivationType.Swiglu,torch.bfloat16,torch.float8_e4m3fnuz,torch.float8_e4m3fnuz,QuantType.per_Token,1,0,16,0,31.0683,moe_ck2stages_gemm1_256x16x128x256_1x4_MulABScale_v1_Nswizzle0_Quant2_MulRoutedWeight0_swiglu_F8_F8_B16,0.0%,3.65,29161.77,0
stage1,80,2,6144,384,128,4,ActivationType.Swiglu,torch.bfloat16,torch.float8_e4m3fnuz,torch.float8_e4m3fnuz,QuantType.per_Token,1,0,16,0,22.0855,moe_ck2stages_gemm1_256x16x64x256_1x4_MulABScale_v1_Nswizzle0_Quant2_MulRoutedWeight0_swiglu_F8_F8_B16,0.0%,5.13,41022.69,0
stage2,80,2,6144,384,128,4,ActivationType.Swiglu,torch.bfloat16,torch.float8_e4m3fnuz,torch.float8_e4m3fnuz,QuantType.per_Token,1,0,16,0,-1.0,moe_ck2stages_gemm2_256x16x128x256_1x4_MulABScaleExpertWeight_v1_Nswizzle0_Quant2_MulRoutedWeight1_F8_F8_B16,100.0%,0.0,0.0,0
stage2,80,2,6144,384,128,4,ActivationType.Swiglu,torch.bfloat16,torch.float8_e4m3fnuz,torch.float8_e4m3fnuz,QuantType.per_Token,1,0,16,0,13.8892,moe_ck2stages_gemm2_128x16x128x128_1x2_MulABScaleExpertWeight_v1_Nswizzle0_Quant2_MulRoutedWeight1_F8_F8_B16,2.4%,8.15,65231.01,0
stage2,80,2,6144,384,128,4,ActivationType.Swiglu,torch.bfloat16,torch.float8_e4m3fnuz,torch.float8_e4m3fnuz,QuantType.per_Token,1,0,16,0,14.7214,moe_ck2stages_gemm2_64x16x64x64_1x1_MulABScaleExpertWeight_v1_Nswizzle0_Quant2_MulRoutedWeight1_F8_F8_B16,2.4%,7.69,61543.5,0
stage1,80,2,6144,384,128,4,ActivationType.Swiglu,torch.bfloat16,torch.float8_e4m3fnuz,torch.float8_e4m3fnuz,QuantType.per_Token,1,0,32,0,25.4457,moe_ck2stages_gemm1_256x32x64x256_1x4_MulABScale_v1_Nswizzle0_Quant2_MulRoutedWeight0_swiglu_F8_F8_B16,0.0%,4.45,35605.49,0
stage1,80,2,6144,384,128,4,ActivationType.Swiglu,torch.bfloat16,torch.float8_e4m3fnuz,torch.float8_e4m3fnuz,QuantType.per_Token,1,0,32,0,34.0264,moe_ck2stages_gemm1_256x32x64x128_1x4_MulABScale_v1_Nswizzle0_Quant2_MulRoutedWeight0_swiglu_F8_F8_B16,0.0%,3.33,26626.58,0
stage2,80,2,6144,384,128,4,ActivationType.Swiglu,torch.bfloat16,torch.float8_e4m3fnuz,torch.float8_e4m3fnuz,QuantType.per_Token,1,0,32,0,-1.0,moe_ck2stages_gemm2_256x32x64x256_1x4_MulABScaleExpertWeight_v1_Nswizzle0_Quant2_MulRoutedWeight1_F8_F8_B16,100.0%,0.0,0.0,0
stage2,80,2,6144,384,128,4,ActivationType.Swiglu,torch.bfloat16,torch.float8_e4m3fnuz,torch.float8_e4m3fnuz,QuantType.per_Token,1,0,32,0,18.0654,moe_ck2stages_gemm2_256x32x64x128_1x4_MulABScaleExpertWeight_v1_Nswizzle0_Quant2_MulRoutedWeight1_F8_F8_B16,2.4%,6.27,50151.48,0
stage2,80,2,6144,384,128,4,ActivationType.Swiglu,torch.bfloat16,torch.float8_e4m3fnuz,torch.float8_e4m3fnuz,QuantType.per_Token,1,0,32,0,29.2136,moe_ck2stages_gemm2_256x32x64x64_1x4_MulABScaleExpertWeight_v1_Nswizzle0_Quant2_MulRoutedWeight1_F8_F8_B16,99.5%,3.88,31013.18,0
stage1,80,2,6144,384,128,4,ActivationType.Swiglu,torch.bfloat16,torch.float8_e4m3fnuz,torch.float8_e4m3fnuz,QuantType.per_Token,1,0,64,0,37.1179,moe_ck2stages_gemm1_256x64x64x256_1x4_MulABScale_v1_Nswizzle0_Quant2_MulRoutedWeight0_swiglu_F8_F8_B16,0.0%,3.05,24408.88,0
stage1,80,2,6144,384,128,4,ActivationType.Swiglu,torch.bfloat16,torch.float8_e4m3fnuz,torch.float8_e4m3fnuz,QuantType.per_Token,1,0,64,0,40.9885,moe_ck2stages_gemm1_256x64x64x128_1x4_MulABScale_v1_Nswizzle0_Quant2_MulRoutedWeight0_swiglu_F8_F8_B16,0.0%,2.76,22103.92,0
stage1,80,2,6144,384,128,4,ActivationType.Swiglu,torch.bfloat16,torch.float8_e4m3fnuz,torch.float8_e4m3fnuz,QuantType.per_Token,1,0,64,0,57.2526,moe_ck2stages_gemm1_256x64x128x256_1x4_MulABScale_v3_Nswizzle0_Quant2_MulRoutedWeight0_swiglu_F8_F8_B16,0.0%,1.98,15824.72,0
stage1,80,2,6144,384,128,4,ActivationType.Swiglu,torch.bfloat16,torch.float8_e4m3fnuz,torch.float8_e4m3fnuz,QuantType.per_Token,1,0,64,0,60.7766,moe_ck2stages_gemm1_256x64x128x128_1x4_MulABScale_v3_Nswizzle0_Quant2_MulRoutedWeight0_swiglu_F8_F8_B16,0.0%,1.86,14907.16,0
stage2,80,2,6144,384,128,4,ActivationType.Swiglu,torch.bfloat16,torch.float8_e4m3fnuz,torch.float8_e4m3fnuz,QuantType.per_Token,1,0,64,0,-1.0,moe_ck2stages_gemm2_256x64x64x256_1x4_MulABScaleExpertWeight_v1_Nswizzle0_Quant2_MulRoutedWeight1_F8_F8_B16,100.0%,0.0,0.0,0
stage2,80,2,6144,384,128,4,ActivationType.Swiglu,torch.bfloat16,torch.float8_e4m3fnuz,torch.float8_e4m3fnuz,QuantType.per_Token,1,0,64,0,-1.0,moe_ck2stages_gemm2_256x64x128x256_1x4_MulABScaleExpertWeight_v3_Nswizzle0_Quant2_MulRoutedWeight1_F8_F8_B16,100.0%,0.0,0.0,0
stage2,80,2,6144,384,128,4,ActivationType.Swiglu,torch.bfloat16,torch.float8_e4m3fnuz,torch.float8_e4m3fnuz,QuantType.per_Token,1,0,64,0,34.4808,moe_ck2stages_gemm2_256x64x128x128_1x4_MulABScaleExpertWeight_v3_Nswizzle0_Quant2_MulRoutedWeight1_F8_F8_B16,2.5%,3.28,26275.68,0
stage2,80,2,6144,384,128,4,ActivationType.Swiglu,torch.bfloat16,torch.float8_e4m3fnuz,torch.float8_e4m3fnuz,QuantType.per_Token,1,0,64,0,48.6854,moe_ck2stages_gemm2_256x64x128x64_1x4_MulABScaleExpertWeight_v3_Nswizzle0_Quant2_MulRoutedWeight1_F8_F8_B16,99.5%,2.33,18609.41,0
stage2,80,2,6144,384,128,4,ActivationType.Swiglu,torch.bfloat16,torch.float8_e4m3fnuz,torch.float8_e4m3fnuz,QuantType.per_Token,1,0,64,0,45.4653,moe_ck2stages_gemm2_256x64x64x64_1x4_MulABScaleExpertWeight_v1_Nswizzle0_Quant2_MulRoutedWeight1_F8_F8_B16,99.5%,2.49,19927.43,0
stage1,80,2,6144,384,128,4,ActivationType.Swiglu,torch.bfloat16,torch.float8_e4m3fnuz,torch.float8_e4m3fnuz,QuantType.per_Token,1,0,128,0,66.2906,moe_ck2stages_gemm1_256x128x64x128_1x4_MulABScale_v1_Nswizzle0_Quant2_MulRoutedWeight0_swiglu_F8_F8_B16,0.0%,1.71,13667.19,0
stage1,80,2,6144,384,128,4,ActivationType.Swiglu,torch.bfloat16,torch.float8_e4m3fnuz,torch.float8_e4m3fnuz,QuantType.per_Token,1,0,128,0,106.635,moe_ck2stages_gemm1_256x128x128x256_1x4_MulABScale_v3_Nswizzle0_Quant2_MulRoutedWeight0_swiglu_F8_F8_B16,0.0%,1.06,8496.33,0
stage1,80,2,6144,384,128,4,ActivationType.Swiglu,torch.bfloat16,torch.float8_e4m3fnuz,torch.float8_e4m3fnuz,QuantType.per_Token,1,0,128,0,105.7979,moe_ck2stages_gemm1_256x128x128x128_1x4_MulABScale_v3_Nswizzle0_Quant2_MulRoutedWeight0_swiglu_F8_F8_B16,0.0%,1.07,8563.56,0
stage2,80,2,6144,384,128,4,ActivationType.Swiglu,torch.bfloat16,torch.float8_e4m3fnuz,torch.float8_e4m3fnuz,QuantType.per_Token,1,0,128,0,64.4844,moe_ck2stages_gemm2_256x128x64x128_1x4_MulABScaleExpertWeight_v1_Nswizzle0_Quant2_MulRoutedWeight1_F8_F8_B16,2.4%,1.76,14050.01,0
stage2,80,2,6144,384,128,4,ActivationType.Swiglu,torch.bfloat16,torch.float8_e4m3fnuz,torch.float8_e4m3fnuz,QuantType.per_Token,1,0,128,0,53.5059,moe_ck2stages_gemm2_256x128x128x128_1x4_MulABScaleExpertWeight_v3_Nswizzle0_Quant2_MulRoutedWeight1_F8_F8_B16,2.4%,2.12,16932.83,0
stage2,80,2,6144,384,128,4,ActivationType.Swiglu,torch.bfloat16,torch.float8_e4m3fnuz,torch.float8_e4m3fnuz,QuantType.per_Token,1,0,128,0,70.7931,moe_ck2stages_gemm2_256x128x128x64_1x4_MulABScaleExpertWeight_v3_Nswizzle0_Quant2_MulRoutedWeight1_F8_F8_B16,99.5%,1.6,12797.95,0
stage2,80,2,6144,384,128,4,ActivationType.Swiglu,torch.bfloat16,torch.float8_e4m3fnuz,torch.float8_e4m3fnuz,QuantType.per_Token,1,0,128,0,78.8013,moe_ck2stages_gemm2_256x128x64x64_1x4_MulABScaleExpertWeight_v3_Nswizzle0_Quant2_MulRoutedWeight1_F8_F8_B16,99.5%,1.44,11497.36,0
stage1,80,4,6144,384,128,4,ActivationType.Swiglu,torch.bfloat16,torch.float8_e4m3fnuz,torch.float8_e4m3fnuz,QuantType.per_Token,1,0,16,0,66.287,_ZN5aiter48fmoe_stage1_bf16_pertokenFp8_g1u1_16x128_4tg_pf2E,98.0%,3.42,13668.49,0
stage1,80,4,6144,384,128,4,ActivationType.Swiglu,torch.bfloat16,torch.float8_e4m3fnuz,torch.float8_e4m3fnuz,QuantType.per_Token,1,0,16,0,39.4264,_ZN5aiter48fmoe_stage1_bf16_pertokenFp8_g1u1_16x128_4tg_pf3E,98.0%,5.74,22980.63,0
stage1,80,4,6144,384,128,4,ActivationType.Swiglu,torch.bfloat16,torch.float8_e4m3fnuz,torch.float8_e4m3fnuz,QuantType.per_Token,1,0,16,0,-1.0,_ZN5aiter48fmoe_stage1_bf16_pertokenFp8_g1u1_16x256_3tg_pf2E,100.0%,0.0,0.0,0
stage1,80,4,6144,384,128,4,ActivationType.Swiglu,torch.bfloat16,torch.float8_e4m3fnuz,torch.float8_e4m3fnuz,QuantType.per_Token,1,0,16,0,-1.0,_ZN5aiter48fmoe_stage1_bf16_pertokenFp8_g1u1_16x256_2tg_pf3E,100.0%,0.0,0.0,0
stage1,80,4,6144,384,128,4,ActivationType.Swiglu,torch.bfloat16,torch.float8_e4m3fnuz,torch.float8_e4m3fnuz,QuantType.per_Token,1,0,16,0,-1.0,_ZN5aiter48fmoe_stage1_bf16_pertokenFp8_g1u1_16x512_2tg_pf2E,100.0%,0.0,0.0,0
stage1,80,4,6144,384,128,4,ActivationType.Swiglu,torch.bfloat16,torch.float8_e4m3fnuz,torch.float8_e4m3fnuz,QuantType.per_Token,1,0,16,0,-1.0,_ZN5aiter44fmoe_stage1_bf16_pertokenFp8_g1u1_16x512_pf3E,100.0%,0.0,0.0,0
stage1,80,4,6144,384,128,4,ActivationType.Swiglu,torch.bfloat16,torch.float8_e4m3fnuz,torch.float8_e4m3fnuz,QuantType.per_Token,1,0,16,0,57.7021,_ZN5aiter47fmoe_stage1_bf16_pertokenFp8_g1u1_16x64_6tg_pf2E,98.0%,3.93,15702.09,0
stage1,80,4,6144,384,128,4,ActivationType.Swiglu,torch.bfloat16,torch.float8_e4m3fnuz,torch.float8_e4m3fnuz,QuantType.per_Token,1,0,16,0,34.3928,_ZN5aiter47fmoe_stage1_bf16_pertokenFp8_g1u1_16x64_5tg_pf3E,98.0%,6.59,26343.98,0
stage1,80,4,6144,384,128,4,ActivationType.Swiglu,torch.bfloat16,torch.float8_e4m3fnuz,torch.float8_e4m3fnuz,QuantType.per_Token,1,0,32,0,65.6106,_ZN5aiter48fmoe_stage1_bf16_pertokenFp8_g1u1_32x128_3tg_pf2E,98.0%,3.45,13809.41,0
stage1,80,4,6144,384,128,4,ActivationType.Swiglu,torch.bfloat16,torch.float8_e4m3fnuz,torch.float8_e4m3fnuz,QuantType.per_Token,1,0,32,0,40.0892,_ZN5aiter48fmoe_stage1_bf16_pertokenFp8_g1u1_32x128_3tg_pf3E,98.0%,5.65,22600.69,0
stage1,80,4,6144,384,128,4,ActivationType.Swiglu,torch.bfloat16,torch.float8_e4m3fnuz,torch.float8_e4m3fnuz,QuantType.per_Token,1,0,32,0,-1.0,_ZN5aiter48fmoe_stage1_bf16_pertokenFp8_g1u1_32x256_2tg_pf2E,100.0%,0.0,0.0,0
stage1,80,4,6144,384,128,4,ActivationType.Swiglu,torch.bfloat16,torch.float8_e4m3fnuz,torch.float8_e4m3fnuz,QuantType.per_Token,1,0,32,0,-1.0,_ZN5aiter48fmoe_stage1_bf16_pertokenFp8_g1u1_32x256_2tg_pf3E,100.0%,0.0,0.0,0
stage1,80,4,6144,384,128,4,ActivationType.Swiglu,torch.bfloat16,torch.float8_e4m3fnuz,torch.float8_e4m3fnuz,QuantType.per_Token,1,0,32,0,-1.0,_ZN5aiter44fmoe_stage1_bf16_pertokenFp8_g1u1_32x512_pf2E,100.0%,0.0,0.0,0
stage1,80,4,6144,384,128,4,ActivationType.Swiglu,torch.bfloat16,torch.float8_e4m3fnuz,torch.float8_e4m3fnuz,QuantType.per_Token,1,0,32,0,-1.0,_ZN5aiter44fmoe_stage1_bf16_pertokenFp8_g1u1_32x512_pf3E,100.0%,0.0,0.0,0
stage1,80,4,6144,384,128,4,ActivationType.Swiglu,torch.bfloat16,torch.float8_e4m3fnuz,torch.float8_e4m3fnuz,QuantType.per_Token,1,0,32,0,59.0432,_ZN5aiter47fmoe_stage1_bf16_pertokenFp8_g1u1_32x64_4tg_pf2E,98.0%,3.84,15345.43,0
stage1,80,4,6144,384,128,4,ActivationType.Swiglu,torch.bfloat16,torch.float8_e4m3fnuz,torch.float8_e4m3fnuz,QuantType.per_Token,1,0,32,0,36.4895,_ZN5aiter47fmoe_stage1_bf16_pertokenFp8_g1u1_32x64_4tg_pf3E,98.0%,6.21,24830.25,0
stage1,80,4,6144,384,128,4,ActivationType.Swiglu,torch.bfloat16,torch.float8_e4m3fnuz,torch.float8_e4m3fnuz,QuantType.per_Token,1,0,64,0,67.0798,_ZN5aiter48fmoe_stage1_bf16_pertokenFp8_g1u1_64x128_2tg_pf2E,98.0%,3.38,13506.95,0
stage1,80,4,6144,384,128,4,ActivationType.Swiglu,torch.bfloat16,torch.float8_e4m3fnuz,torch.float8_e4m3fnuz,QuantType.per_Token,1,0,64,0,45.5345,_ZN5aiter48fmoe_stage1_bf16_pertokenFp8_g1u1_64x128_2tg_pf3E,98.0%,4.97,19897.95,0
stage1,80,4,6144,384,128,4,ActivationType.Swiglu,torch.bfloat16,torch.float8_e4m3fnuz,torch.float8_e4m3fnuz,QuantType.per_Token,1,0,64,0,-1.0,_ZN5aiter44fmoe_stage1_bf16_pertokenFp8_g1u1_64x256_pf2E,100.0%,0.0,0.0,0
stage1,80,4,6144,384,128,4,ActivationType.Swiglu,torch.bfloat16,torch.float8_e4m3fnuz,torch.float8_e4m3fnuz,QuantType.per_Token,1,0,64,0,-1.0,_ZN5aiter44fmoe_stage1_bf16_pertokenFp8_g1u1_64x256_pf3E,100.0%,0.0,0.0,0
stage1,80,4,6144,384,128,4,ActivationType.Swiglu,torch.bfloat16,torch.float8_e4m3fnuz,torch.float8_e4m3fnuz,QuantType.per_Token,1,0,64,0,61.0414,_ZN5aiter47fmoe_stage1_bf16_pertokenFp8_g1u1_64x64_3tg_pf2E,98.0%,3.71,14843.1,0
stage1,80,4,6144,384,128,4,ActivationType.Swiglu,torch.bfloat16,torch.float8_e4m3fnuz,torch.float8_e4m3fnuz,QuantType.per_Token,1,0,64,0,48.2433,_ZN5aiter47fmoe_stage1_bf16_pertokenFp8_g1u1_64x64_2tg_pf3E,98.0%,4.69,18780.71,0
stage1,80,4,6144,384,128,4,ActivationType.Swiglu,torch.bfloat16,torch.float8_e4m3fnuz,torch.float8_e4m3fnuz,QuantType.per_Token,1,0,128,0,83.9266,_ZN5aiter45fmoe_stage1_bf16_pertokenFp8_g1u1_128x128_pf2E,98.0%,2.7,10795.66,0
stage1,80,4,6144,384,128,4,ActivationType.Swiglu,torch.bfloat16,torch.float8_e4m3fnuz,torch.float8_e4m3fnuz,QuantType.per_Token,1,0,128,0,82.688,_ZN5aiter45fmoe_stage1_bf16_pertokenFp8_g1u1_128x128_pf3E,98.0%,2.74,10957.37,0
stage1,80,4,6144,384,128,4,ActivationType.Swiglu,torch.bfloat16,torch.float8_e4m3fnuz,torch.float8_e4m3fnuz,QuantType.per_Token,1,0,128,0,118.4181,_ZN5aiter44fmoe_stage1_bf16_pertokenFp8_g1u1_128x64_pf2E,98.0%,1.91,7651.22,0
stage1,80,4,6144,384,128,4,ActivationType.Swiglu,torch.bfloat16,torch.float8_e4m3fnuz,torch.float8_e4m3fnuz,QuantType.per_Token,1,0,128,0,98.5578,_ZN5aiter44fmoe_stage1_bf16_pertokenFp8_g1u1_128x64_pf3E,98.0%,2.3,9193.02,0
stage1,80,4,6144,384,128,4,ActivationType.Swiglu,torch.bfloat16,torch.float8_e4m3fnuz,torch.float8_e4m3fnuz,QuantType.per_Token,1,0,16,0,39.9758,moe_ck2stages_gemm1_128x16x64x128_1x2_MulABScale_v1_Nswizzle0_Quant2_MulRoutedWeight0_swiglu_F8_F8_B16,0.0%,5.67,22664.8,0
stage1,80,4,6144,384,128,4,ActivationType.Swiglu,torch.bfloat16,torch.float8_e4m3fnuz,torch.float8_e4m3fnuz,QuantType.per_Token,1,0,16,0,32.7289,moe_ck2stages_gemm1_256x16x128x256_1x4_MulABScale_v1_Nswizzle0_Quant2_MulRoutedWeight0_swiglu_F8_F8_B16,0.0%,6.92,27683.28,0
stage1,80,4,6144,384,128,4,ActivationType.Swiglu,torch.bfloat16,torch.float8_e4m3fnuz,torch.float8_e4m3fnuz,QuantType.per_Token,1,0,16,0,32.0091,moe_ck2stages_gemm1_256x16x64x256_1x4_MulABScale_v1_Nswizzle0_Quant2_MulRoutedWeight0_swiglu_F8_F8_B16,0.0%,7.08,28305.81,0
stage2,80,4,6144,384,128,4,ActivationType.Swiglu,torch.bfloat16,torch.float8_e4m3fnuz,torch.float8_e4m3fnuz,QuantType.per_Token,1,0,16,0,-1.0,moe_ck2stages_gemm2_256x16x128x256_1x4_MulABScaleExpertWeight_v1_Nswizzle0_Quant2_MulRoutedWeight1_F8_F8_B16,100.0%,0.0,0.0,0
stage2,80,4,6144,384,128,4,ActivationType.Swiglu,torch.bfloat16,torch.float8_e4m3fnuz,torch.float8_e4m3fnuz,QuantType.per_Token,1,0,16,0,26.0946,moe_ck2stages_gemm2_128x16x128x128_1x2_MulABScaleExpertWeight_v1_Nswizzle0_Quant2_MulRoutedWeight1_F8_F8_B16,2.3%,8.68,34721.49,0
stage2,80,4,6144,384,128,4,ActivationType.Swiglu,torch.bfloat16,torch.float8_e4m3fnuz,torch.float8_e4m3fnuz,QuantType.per_Token,1,0,16,0,26.2289,moe_ck2stages_gemm2_64x16x64x64_1x1_MulABScaleExpertWeight_v1_Nswizzle0_Quant2_MulRoutedWeight1_F8_F8_B16,2.4%,8.64,34543.71,0
stage1,80,4,6144,384,128,4,ActivationType.Swiglu,torch.bfloat16,torch.float8_e4m3fnuz,torch.float8_e4m3fnuz,QuantType.per_Token,1,0,32,0,38.772,moe_ck2stages_gemm1_256x32x64x256_1x4_MulABScale_v1_Nswizzle0_Quant2_MulRoutedWeight0_swiglu_F8_F8_B16,0.0%,5.84,23368.5,0
stage1,80,4,6144,384,128,4,ActivationType.Swiglu,torch.bfloat16,torch.float8_e4m3fnuz,torch.float8_e4m3fnuz,QuantType.per_Token,1,0,32,0,39.3898,moe_ck2stages_gemm1_256x32x64x128_1x4_MulABScale_v1_Nswizzle0_Quant2_MulRoutedWeight0_swiglu_F8_F8_B16,0.0%,5.75,23001.98,0
stage2,80,4,6144,384,128,4,ActivationType.Swiglu,torch.bfloat16,torch.float8_e4m3fnuz,torch.float8_e4m3fnuz,QuantType.per_Token,1,0,32,0,-1.0,moe_ck2stages_gemm2_256x32x64x256_1x4_MulABScaleExpertWeight_v1_Nswizzle0_Quant2_MulRoutedWeight1_F8_F8_B16,100.0%,0.0,0.0,0
stage2,80,4,6144,384,128,4,ActivationType.Swiglu,torch.bfloat16,torch.float8_e4m3fnuz,torch.float8_e4m3fnuz,QuantType.per_Token,1,0,32,0,29.0181,moe_ck2stages_gemm2_256x32x64x128_1x4_MulABScaleExpertWeight_v1_Nswizzle0_Quant2_MulRoutedWeight1_F8_F8_B16,2.3%,7.81,31223.39,0
stage2,80,4,6144,384,128,4,ActivationType.Swiglu,torch.bfloat16,torch.float8_e4m3fnuz,torch.float8_e4m3fnuz,QuantType.per_Token,1,0,32,0,46.8394,moe_ck2stages_gemm2_256x32x64x64_1x4_MulABScaleExpertWeight_v1_Nswizzle0_Quant2_MulRoutedWeight1_F8_F8_B16,99.5%,4.84,19343.62,0
stage1,80,4,6144,384,128,4,ActivationType.Swiglu,torch.bfloat16,torch.float8_e4m3fnuz,torch.float8_e4m3fnuz,QuantType.per_Token,1,0,64,0,60.5585,moe_ck2stages_gemm1_256x64x64x256_1x4_MulABScale_v1_Nswizzle0_Quant2_MulRoutedWeight0_swiglu_F8_F8_B16,0.0%,3.74,14961.46,0
stage1,80,4,6144,384,128,4,ActivationType.Swiglu,torch.bfloat16,torch.float8_e4m3fnuz,torch.float8_e4m3fnuz,QuantType.per_Token,1,0,64,0,57.6654,moe_ck2stages_gemm1_256x64x64x128_1x4_MulABScale_v1_Nswizzle0_Quant2_MulRoutedWeight0_swiglu_F8_F8_B16,0.0%,3.93,15712.08,0
stage1,80,4,6144,384,128,4,ActivationType.Swiglu,torch.bfloat16,torch.float8_e4m3fnuz,torch.float8_e4m3fnuz,QuantType.per_Token,1,0,64,0,58.0348,moe_ck2stages_gemm1_256x64x128x256_1x4_MulABScale_v3_Nswizzle0_Quant2_MulRoutedWeight0_swiglu_F8_F8_B16,0.0%,3.9,15612.07,0
stage1,80,4,6144,384,128,4,ActivationType.Swiglu,torch.bfloat16,torch.float8_e4m3fnuz,torch.float8_e4m3fnuz,QuantType.per_Token,1,0,64,0,61.4172,moe_ck2stages_gemm1_256x64x128x128_1x4_MulABScale_v3_Nswizzle0_Quant2_MulRoutedWeight0_swiglu_F8_F8_B16,0.0%,3.69,14752.27,0
stage2,80,4,6144,384,128,4,ActivationType.Swiglu,torch.bfloat16,torch.float8_e4m3fnuz,torch.float8_e4m3fnuz,QuantType.per_Token,1,0,64,0,-1.0,moe_ck2stages_gemm2_256x64x64x256_1x4_MulABScaleExpertWeight_v1_Nswizzle0_Quant2_MulRoutedWeight1_F8_F8_B16,100.0%,0.0,0.0,0
stage2,80,4,6144,384,128,4,ActivationType.Swiglu,torch.bfloat16,torch.float8_e4m3fnuz,torch.float8_e4m3fnuz,QuantType.per_Token,1,0,64,0,-1.0,moe_ck2stages_gemm2_256x64x128x256_1x4_MulABScaleExpertWeight_v3_Nswizzle0_Quant2_MulRoutedWeight1_F8_F8_B16,100.0%,0.0,0.0,0
stage2,80,4,6144,384,128,4,ActivationType.Swiglu,torch.bfloat16,torch.float8_e4m3fnuz,torch.float8_e4m3fnuz,QuantType.per_Token,1,0,64,0,57.8459,moe_ck2stages_gemm2_256x64x128x128_1x4_MulABScaleExpertWeight_v3_Nswizzle0_Quant2_MulRoutedWeight1_F8_F8_B16,2.3%,3.92,15663.05,0
stage2,80,4,6144,384,128,4,ActivationType.Swiglu,torch.bfloat16,torch.float8_e4m3fnuz,torch.float8_e4m3fnuz,QuantType.per_Token,1,0,64,0,83.5711,moe_ck2stages_gemm2_256x64x128x64_1x4_MulABScaleExpertWeight_v3_Nswizzle0_Quant2_MulRoutedWeight1_F8_F8_B16,99.5%,2.71,10841.59,0
stage2,80,4,6144,384,128,4,ActivationType.Swiglu,torch.bfloat16,torch.float8_e4m3fnuz,torch.float8_e4m3fnuz,QuantType.per_Token,1,0,64,0,78.595,moe_ck2stages_gemm2_256x64x64x64_1x4_MulABScaleExpertWeight_v1_Nswizzle0_Quant2_MulRoutedWeight1_F8_F8_B16,99.5%,2.88,11528.0,0
stage1,80,4,6144,384,128,4,ActivationType.Swiglu,torch.bfloat16,torch.float8_e4m3fnuz,torch.float8_e4m3fnuz,QuantType.per_Token,1,0,128,0,106.6795,moe_ck2stages_gemm1_256x128x64x128_1x4_MulABScale_v1_Nswizzle0_Quant2_MulRoutedWeight0_swiglu_F8_F8_B16,0.0%,2.12,8493.13,0
stage1,80,4,6144,384,128,4,ActivationType.Swiglu,torch.bfloat16,torch.float8_e4m3fnuz,torch.float8_e4m3fnuz,QuantType.per_Token,1,0,128,0,107.0064,moe_ck2stages_gemm1_256x128x128x256_1x4_MulABScale_v3_Nswizzle0_Quant2_MulRoutedWeight0_swiglu_F8_F8_B16,0.0%,2.12,8467.19,0
stage1,80,4,6144,384,128,4,ActivationType.Swiglu,torch.bfloat16,torch.float8_e4m3fnuz,torch.float8_e4m3fnuz,QuantType.per_Token,1,0,128,0,106.635,moe_ck2stages_gemm1_256x128x128x128_1x4_MulABScale_v3_Nswizzle0_Quant2_MulRoutedWeight0_swiglu_F8_F8_B16,0.0%,2.12,8496.68,0
stage2,80,4,6144,384,128,4,ActivationType.Swiglu,torch.bfloat16,torch.float8_e4m3fnuz,torch.float8_e4m3fnuz,QuantType.per_Token,1,0,128,0,119.5303,moe_ck2stages_gemm2_256x128x64x128_1x4_MulABScaleExpertWeight_v1_Nswizzle0_Quant2_MulRoutedWeight1_F8_F8_B16,2.3%,1.89,7580.03,0
stage2,80,4,6144,384,128,4,ActivationType.Swiglu,torch.bfloat16,torch.float8_e4m3fnuz,torch.float8_e4m3fnuz,QuantType.per_Token,1,0,128,0,90.8992,moe_ck2stages_gemm2_256x128x128x128_1x4_MulABScaleExpertWeight_v3_Nswizzle0_Quant2_MulRoutedWeight1_F8_F8_B16,2.3%,2.49,9967.56,0
stage2,80,4,6144,384,128,4,ActivationType.Swiglu,torch.bfloat16,torch.float8_e4m3fnuz,torch.float8_e4m3fnuz,QuantType.per_Token,1,0,128,0,126.6717,moe_ck2stages_gemm2_256x128x128x64_1x4_MulABScaleExpertWeight_v3_Nswizzle0_Quant2_MulRoutedWeight1_F8_F8_B16,99.5%,1.79,7152.69,0
stage2,80,4,6144,384,128,4,ActivationType.Swiglu,torch.bfloat16,torch.float8_e4m3fnuz,torch.float8_e4m3fnuz,QuantType.per_Token,1,0,128,0,145.4591,moe_ck2stages_gemm2_256x128x64x64_1x4_MulABScaleExpertWeight_v3_Nswizzle0_Quant2_MulRoutedWeight1_F8_F8_B16,99.5%,1.56,6228.85,0
stage1,80,8,6144,384,128,4,ActivationType.Swiglu,torch.bfloat16,torch.float8_e4m3fnuz,torch.float8_e4m3fnuz,QuantType.per_Token,1,0,16,0,68.332,_ZN5aiter48fmoe_stage1_bf16_pertokenFp8_g1u1_16x128_4tg_pf2E,98.1%,6.63,13260.51,0
stage1,80,8,6144,384,128,4,ActivationType.Swiglu,torch.bfloat16,torch.float8_e4m3fnuz,torch.float8_e4m3fnuz,QuantType.per_Token,1,0,16,0,53.6854,_ZN5aiter48fmoe_stage1_bf16_pertokenFp8_g1u1_16x128_4tg_pf3E,98.1%,8.44,16878.28,0
stage1,80,8,6144,384,128,4,ActivationType.Swiglu,torch.bfloat16,torch.float8_e4m3fnuz,torch.float8_e4m3fnuz,QuantType.per_Token,1,0,16,0,-1.0,_ZN5aiter48fmoe_stage1_bf16_pertokenFp8_g1u1_16x256_3tg_pf2E,100.0%,0.0,0.0,0
stage1,80,8,6144,384,128,4,ActivationType.Swiglu,torch.bfloat16,torch.float8_e4m3fnuz,torch.float8_e4m3fnuz,QuantType.per_Token,1,0,16,0,-1.0,_ZN5aiter48fmoe_stage1_bf16_pertokenFp8_g1u1_16x256_2tg_pf3E,100.0%,0.0,0.0,0
stage1,80,8,6144,384,128,4,ActivationType.Swiglu,torch.bfloat16,torch.float8_e4m3fnuz,torch.float8_e4m3fnuz,QuantType.per_Token,1,0,16,0,-1.0,_ZN5aiter48fmoe_stage1_bf16_pertokenFp8_g1u1_16x512_2tg_pf2E,100.0%,0.0,0.0,0
stage1,80,8,6144,384,128,4,ActivationType.Swiglu,torch.bfloat16,torch.float8_e4m3fnuz,torch.float8_e4m3fnuz,QuantType.per_Token,1,0,16,0,-1.0,_ZN5aiter44fmoe_stage1_bf16_pertokenFp8_g1u1_16x512_pf3E,100.0%,0.0,0.0,0
stage1,80,8,6144,384,128,4,ActivationType.Swiglu,torch.bfloat16,torch.float8_e4m3fnuz,torch.float8_e4m3fnuz,QuantType.per_Token,1,0,16,0,60.8127,_ZN5aiter47fmoe_stage1_bf16_pertokenFp8_g1u1_16x64_6tg_pf2E,98.1%,7.45,14900.13,0
stage1,80,8,6144,384,128,4,ActivationType.Swiglu,torch.bfloat16,torch.float8_e4m3fnuz,torch.float8_e4m3fnuz,QuantType.per_Token,1,0,16,0,44.8132,_ZN5aiter47fmoe_stage1_bf16_pertokenFp8_g1u1_16x64_5tg_pf3E,98.1%,10.11,20219.87,0
stage1,80,8,6144,384,128,4,ActivationType.Swiglu,torch.bfloat16,torch.float8_e4m3fnuz,torch.float8_e4m3fnuz,QuantType.per_Token,1,0,32,0,68.6159,_ZN5aiter48fmoe_stage1_bf16_pertokenFp8_g1u1_32x128_3tg_pf2E,98.1%,6.6,13205.64,0
stage1,80,8,6144,384,128,4,ActivationType.Swiglu,torch.bfloat16,torch.float8_e4m3fnuz,torch.float8_e4m3fnuz,QuantType.per_Token,1,0,32,0,58.0119,_ZN5aiter48fmoe_stage1_bf16_pertokenFp8_g1u1_32x128_3tg_pf3E,98.1%,7.81,15619.5,0
stage1,80,8,6144,384,128,4,ActivationType.Swiglu,torch.bfloat16,torch.float8_e4m3fnuz,torch.float8_e4m3fnuz,QuantType.per_Token,1,0,32,0,-1.0,_ZN5aiter48fmoe_stage1_bf16_pertokenFp8_g1u1_32x256_2tg_pf2E,100.0%,0.0,0.0,0
stage1,80,8,6144,384,128,4,ActivationType.Swiglu,torch.bfloat16,torch.float8_e4m3fnuz,torch.float8_e4m3fnuz,QuantType.per_Token,1,0,32,0,-1.0,_ZN5aiter48fmoe_stage1_bf16_pertokenFp8_g1u1_32x256_2tg_pf3E,100.0%,0.0,0.0,0
stage1,80,8,6144,384,128,4,ActivationType.Swiglu,torch.bfloat16,torch.float8_e4m3fnuz,torch.float8_e4m3fnuz,QuantType.per_Token,1,0,32,0,-1.0,_ZN5aiter44fmoe_stage1_bf16_pertokenFp8_g1u1_32x512_pf2E,100.0%,0.0,0.0,0
stage1,80,8,6144,384,128,4,ActivationType.Swiglu,torch.bfloat16,torch.float8_e4m3fnuz,torch.float8_e4m3fnuz,QuantType.per_Token,1,0,32,0,-1.0,_ZN5aiter44fmoe_stage1_bf16_pertokenFp8_g1u1_32x512_pf3E,100.0%,0.0,0.0,0
stage1,80,8,6144,384,128,4,ActivationType.Swiglu,torch.bfloat16,torch.float8_e4m3fnuz,torch.float8_e4m3fnuz,QuantType.per_Token,1,0,32,0,63.0932,_ZN5aiter47fmoe_stage1_bf16_pertokenFp8_g1u1_32x64_4tg_pf2E,98.1%,7.18,14361.57,0
stage1,80,8,6144,384,128,4,ActivationType.Swiglu,torch.bfloat16,torch.float8_e4m3fnuz,torch.float8_e4m3fnuz,QuantType.per_Token,1,0,32,0,47.7923,_ZN5aiter47fmoe_stage1_bf16_pertokenFp8_g1u1_32x64_4tg_pf3E,98.1%,9.48,18959.48,0
stage1,80,8,6144,384,128,4,ActivationType.Swiglu,torch.bfloat16,torch.float8_e4m3fnuz,torch.float8_e4m3fnuz,QuantType.per_Token,1,0,64,0,86.5945,_ZN5aiter48fmoe_stage1_bf16_pertokenFp8_g1u1_64x128_2tg_pf2E,98.1%,5.23,10463.91,0
stage1,80,8,6144,384,128,4,ActivationType.Swiglu,torch.bfloat16,torch.float8_e4m3fnuz,torch.float8_e4m3fnuz,QuantType.per_Token,1,0,64,0,81.2624,_ZN5aiter48fmoe_stage1_bf16_pertokenFp8_g1u1_64x128_2tg_pf3E,98.1%,5.57,11150.51,0
stage1,80,8,6144,384,128,4,ActivationType.Swiglu,torch.bfloat16,torch.float8_e4m3fnuz,torch.float8_e4m3fnuz,QuantType.per_Token,1,0,64,0,-1.0,_ZN5aiter44fmoe_stage1_bf16_pertokenFp8_g1u1_64x256_pf2E,100.0%,0.0,0.0,0
stage1,80,8,6144,384,128,4,ActivationType.Swiglu,torch.bfloat16,torch.float8_e4m3fnuz,torch.float8_e4m3fnuz,QuantType.per_Token,1,0,64,0,-1.0,_ZN5aiter44fmoe_stage1_bf16_pertokenFp8_g1u1_64x256_pf3E,100.0%,0.0,0.0,0
stage1,80,8,6144,384,128,4,ActivationType.Swiglu,torch.bfloat16,torch.float8_e4m3fnuz,torch.float8_e4m3fnuz,QuantType.per_Token,1,0,64,0,73.3942,_ZN5aiter47fmoe_stage1_bf16_pertokenFp8_g1u1_64x64_3tg_pf2E,98.1%,6.17,12345.9,0
stage1,80,8,6144,384,128,4,ActivationType.Swiglu,torch.bfloat16,torch.float8_e4m3fnuz,torch.float8_e4m3fnuz,QuantType.per_Token,1,0,64,0,74.9796,_ZN5aiter47fmoe_stage1_bf16_pertokenFp8_g1u1_64x64_2tg_pf3E,98.1%,6.04,12084.85,0
stage1,80,8,6144,384,128,4,ActivationType.Swiglu,torch.bfloat16,torch.float8_e4m3fnuz,torch.float8_e4m3fnuz,QuantType.per_Token,1,0,128,0,165.0006,_ZN5aiter45fmoe_stage1_bf16_pertokenFp8_g1u1_128x128_pf2E,98.1%,2.75,5491.6,0
stage1,80,8,6144,384,128,4,ActivationType.Swiglu,torch.bfloat16,torch.float8_e4m3fnuz,torch.float8_e4m3fnuz,QuantType.per_Token,1,0,128,0,162.587,_ZN5aiter45fmoe_stage1_bf16_pertokenFp8_g1u1_128x128_pf3E,98.1%,2.79,5573.12,0
stage1,80,8,6144,384,128,4,ActivationType.Swiglu,torch.bfloat16,torch.float8_e4m3fnuz,torch.float8_e4m3fnuz,QuantType.per_Token,1,0,128,0,176.2109,_ZN5aiter44fmoe_stage1_bf16_pertokenFp8_g1u1_128x64_pf2E,98.1%,2.57,5142.23,0
stage1,80,8,6144,384,128,4,ActivationType.Swiglu,torch.bfloat16,torch.float8_e4m3fnuz,torch.float8_e4m3fnuz,QuantType.per_Token,1,0,128,0,146.394,_ZN5aiter44fmoe_stage1_bf16_pertokenFp8_g1u1_128x64_pf3E,98.1%,3.09,6189.58,0
stage1,80,8,6144,384,128,4,ActivationType.Swiglu,torch.bfloat16,torch.float8_e4m3fnuz,torch.float8_e4m3fnuz,QuantType.per_Token,1,0,16,0,48.2982,moe_ck2stages_gemm1_128x16x64x128_1x2_MulABScale_v1_Nswizzle0_Quant2_MulRoutedWeight0_swiglu_F8_F8_B16,0.0%,9.38,18760.89,0
stage1,80,8,6144,384,128,4,ActivationType.Swiglu,torch.bfloat16,torch.float8_e4m3fnuz,torch.float8_e4m3fnuz,QuantType.per_Token,1,0,16,0,58.8659,moe_ck2stages_gemm1_256x16x128x256_1x4_MulABScale_v1_Nswizzle0_Quant2_MulRoutedWeight0_swiglu_F8_F8_B16,0.0%,7.7,15392.9,0
stage1,80,8,6144,384,128,4,ActivationType.Swiglu,torch.bfloat16,torch.float8_e4m3fnuz,torch.float8_e4m3fnuz,QuantType.per_Token,1,0,16,0,49.4703,moe_ck2stages_gemm1_256x16x64x256_1x4_MulABScale_v1_Nswizzle0_Quant2_MulRoutedWeight0_swiglu_F8_F8_B16,0.0%,9.16,18316.39,0
stage2,80,8,6144,384,128,4,ActivationType.Swiglu,torch.bfloat16,torch.float8_e4m3fnuz,torch.float8_e4m3fnuz,QuantType.per_Token,1,0,16,0,-1.0,moe_ck2stages_gemm2_256x16x128x256_1x4_MulABScaleExpertWeight_v1_Nswizzle0_Quant2_MulRoutedWeight1_F8_F8_B16,100.0%,0.0,0.0,0
stage2,80,8,6144,384,128,4,ActivationType.Swiglu,torch.bfloat16,torch.float8_e4m3fnuz,torch.float8_e4m3fnuz,QuantType.per_Token,1,0,16,0,36.7089,moe_ck2stages_gemm2_128x16x128x128_1x2_MulABScaleExpertWeight_v1_Nswizzle0_Quant2_MulRoutedWeight1_F8_F8_B16,2.5%,12.34,24683.85,0
stage2,80,8,6144,384,128,4,ActivationType.Swiglu,torch.bfloat16,torch.float8_e4m3fnuz,torch.float8_e4m3fnuz,QuantType.per_Token,1,0,16,0,37.5082,moe_ck2stages_gemm2_64x16x64x64_1x1_MulABScaleExpertWeight_v1_Nswizzle0_Quant2_MulRoutedWeight1_F8_F8_B16,2.6%,12.08,24157.84,0
stage1,80,8,6144,384,128,4,ActivationType.Swiglu,torch.bfloat16,torch.float8_e4m3fnuz,torch.float8_e4m3fnuz,QuantType.per_Token,1,0,32,0,54.4237,moe_ck2stages_gemm1_256x32x64x256_1x4_MulABScale_v1_Nswizzle0_Quant2_MulRoutedWeight0_swiglu_F8_F8_B16,0.0%,8.32,16649.31,0
stage1,80,8,6144,384,128,4,ActivationType.Swiglu,torch.bfloat16,torch.float8_e4m3fnuz,torch.float8_e4m3fnuz,QuantType.per_Token,1,0,32,0,51.8616,moe_ck2stages_gemm1_256x32x64x128_1x4_MulABScale_v1_Nswizzle0_Quant2_MulRoutedWeight0_swiglu_F8_F8_B16,0.0%,8.73,17471.83,0
stage2,80,8,6144,384,128,4,ActivationType.Swiglu,torch.bfloat16,torch.float8_e4m3fnuz,torch.float8_e4m3fnuz,QuantType.per_Token,1,0,32,0,-1.0,moe_ck2stages_gemm2_256x32x64x256_1x4_MulABScaleExpertWeight_v1_Nswizzle0_Quant2_MulRoutedWeight1_F8_F8_B16,100.0%,0.0,0.0,0
stage2,80,8,6144,384,128,4,ActivationType.Swiglu,torch.bfloat16,torch.float8_e4m3fnuz,torch.float8_e4m3fnuz,QuantType.per_Token,1,0,32,0,45.2817,moe_ck2stages_gemm2_256x32x64x128_1x4_MulABScaleExpertWeight_v1_Nswizzle0_Quant2_MulRoutedWeight1_F8_F8_B16,2.6%,10.0,20010.67,0
stage2,80,8,6144,384,128,4,ActivationType.Swiglu,torch.bfloat16,torch.float8_e4m3fnuz,torch.float8_e4m3fnuz,QuantType.per_Token,1,0,32,0,74.1143,moe_ck2stages_gemm2_256x32x64x64_1x4_MulABScaleExpertWeight_v1_Nswizzle0_Quant2_MulRoutedWeight1_F8_F8_B16,99.6%,6.11,12225.94,0
stage1,80,8,6144,384,128,4,ActivationType.Swiglu,torch.bfloat16,torch.float8_e4m3fnuz,torch.float8_e4m3fnuz,QuantType.per_Token,1,0,64,0,89.6847,moe_ck2stages_gemm1_256x64x64x256_1x4_MulABScale_v1_Nswizzle0_Quant2_MulRoutedWeight0_swiglu_F8_F8_B16,0.0%,5.05,10103.36,0
stage1,80,8,6144,384,128,4,ActivationType.Swiglu,torch.bfloat16,torch.float8_e4m3fnuz,torch.float8_e4m3fnuz,QuantType.per_Token,1,0,64,0,79.0485,moe_ck2stages_gemm1_256x64x64x128_1x4_MulABScale_v1_Nswizzle0_Quant2_MulRoutedWeight0_swiglu_F8_F8_B16,0.0%,5.73,11462.8,0
stage1,80,8,6144,384,128,4,ActivationType.Swiglu,torch.bfloat16,torch.float8_e4m3fnuz,torch.float8_e4m3fnuz,QuantType.per_Token,1,0,64,0,112.3951,moe_ck2stages_gemm1_256x64x128x256_1x4_MulABScale_v3_Nswizzle0_Quant2_MulRoutedWeight0_swiglu_F8_F8_B16,0.0%,4.03,8061.89,0
stage1,80,8,6144,384,128,4,ActivationType.Swiglu,torch.bfloat16,torch.float8_e4m3fnuz,torch.float8_e4m3fnuz,QuantType.per_Token,1,0,64,0,99.3635,moe_ck2stages_gemm1_256x64x128x128_1x4_MulABScale_v3_Nswizzle0_Quant2_MulRoutedWeight0_swiglu_F8_F8_B16,0.0%,4.56,9119.22,0
stage2,80,8,6144,384,128,4,ActivationType.Swiglu,torch.bfloat16,torch.float8_e4m3fnuz,torch.float8_e4m3fnuz,QuantType.per_Token,1,0,64,0,-1.0,moe_ck2stages_gemm2_256x64x64x256_1x4_MulABScaleExpertWeight_v1_Nswizzle0_Quant2_MulRoutedWeight1_F8_F8_B16,100.0%,0.0,0.0,0
stage2,80,8,6144,384,128,4,ActivationType.Swiglu,torch.bfloat16,torch.float8_e4m3fnuz,torch.float8_e4m3fnuz,QuantType.per_Token,1,0,64,0,-1.0,moe_ck2stages_gemm2_256x64x128x256_1x4_MulABScaleExpertWeight_v3_Nswizzle0_Quant2_MulRoutedWeight1_F8_F8_B16,100.0%,0.0,0.0,0
stage2,80,8,6144,384,128,4,ActivationType.Swiglu,torch.bfloat16,torch.float8_e4m3fnuz,torch.float8_e4m3fnuz,QuantType.per_Token,1,0,64,0,97.1659,moe_ck2stages_gemm2_256x64x128x128_1x4_MulABScaleExpertWeight_v3_Nswizzle0_Quant2_MulRoutedWeight1_F8_F8_B16,2.6%,4.66,9325.46,0
stage2,80,8,6144,384,128,4,ActivationType.Swiglu,torch.bfloat16,torch.float8_e4m3fnuz,torch.float8_e4m3fnuz,QuantType.per_Token,1,0,64,0,143.9191,moe_ck2stages_gemm2_256x64x128x64_1x4_MulABScaleExpertWeight_v3_Nswizzle0_Quant2_MulRoutedWeight1_F8_F8_B16,99.6%,3.15,6296.02,0
stage2,80,8,6144,384,128,4,ActivationType.Swiglu,torch.bfloat16,torch.float8_e4m3fnuz,torch.float8_e4m3fnuz,QuantType.per_Token,1,0,64,0,130.1076,moe_ck2stages_gemm2_256x64x64x64_1x4_MulABScaleExpertWeight_v1_Nswizzle0_Quant2_MulRoutedWeight1_F8_F8_B16,99.6%,3.48,6964.37,0
stage1,80,8,6144,384,128,4,ActivationType.Swiglu,torch.bfloat16,torch.float8_e4m3fnuz,torch.float8_e4m3fnuz,QuantType.per_Token,1,0,128,0,164.1969,moe_ck2stages_gemm1_256x128x64x128_1x4_MulABScale_v1_Nswizzle0_Quant2_MulRoutedWeight0_swiglu_F8_F8_B16,0.0%,2.76,5518.48,0
stage1,80,8,6144,384,128,4,ActivationType.Swiglu,torch.bfloat16,torch.float8_e4m3fnuz,torch.float8_e4m3fnuz,QuantType.per_Token,1,0,128,0,211.2343,moe_ck2stages_gemm1_256x128x128x256_1x4_MulABScale_v3_Nswizzle0_Quant2_MulRoutedWeight0_swiglu_F8_F8_B16,0.0%,2.14,4289.63,0
stage1,80,8,6144,384,128,4,ActivationType.Swiglu,torch.bfloat16,torch.float8_e4m3fnuz,torch.float8_e4m3fnuz,QuantType.per_Token,1,0,128,0,209.8151,moe_ck2stages_gemm1_256x128x128x128_1x4_MulABScale_v3_Nswizzle0_Quant2_MulRoutedWeight0_swiglu_F8_F8_B16,0.0%,2.16,4318.65,0
stage2,80,8,6144,384,128,4,ActivationType.Swiglu,torch.bfloat16,torch.float8_e4m3fnuz,torch.float8_e4m3fnuz,QuantType.per_Token,1,0,128,0,208.1785,moe_ck2stages_gemm2_256x128x64x128_1x4_MulABScaleExpertWeight_v1_Nswizzle0_Quant2_MulRoutedWeight1_F8_F8_B16,2.6%,2.18,4352.6,0
stage2,80,8,6144,384,128,4,ActivationType.Swiglu,torch.bfloat16,torch.float8_e4m3fnuz,torch.float8_e4m3fnuz,QuantType.per_Token,1,0,128,0,155.7938,moe_ck2stages_gemm2_256x128x128x128_1x4_MulABScaleExpertWeight_v3_Nswizzle0_Quant2_MulRoutedWeight1_F8_F8_B16,2.6%,2.91,5816.13,0
stage2,80,8,6144,384,128,4,ActivationType.Swiglu,torch.bfloat16,torch.float8_e4m3fnuz,torch.float8_e4m3fnuz,QuantType.per_Token,1,0,128,0,220.5231,moe_ck2stages_gemm2_256x128x128x64_1x4_MulABScaleExpertWeight_v3_Nswizzle0_Quant2_MulRoutedWeight1_F8_F8_B16,99.6%,2.05,4108.94,0
stage2,80,8,6144,384,128,4,ActivationType.Swiglu,torch.bfloat16,torch.float8_e4m3fnuz,torch.float8_e4m3fnuz,QuantType.per_Token,1,0,128,0,245.2689,moe_ck2stages_gemm2_256x128x64x64_1x4_MulABScaleExpertWeight_v3_Nswizzle0_Quant2_MulRoutedWeight1_F8_F8_B16,99.6%,1.85,3694.38,0
stage1,80,16,6144,384,128,4,ActivationType.Swiglu,torch.bfloat16,torch.float8_e4m3fnuz,torch.float8_e4m3fnuz,QuantType.per_Token,1,0,16,0,75.0776,_ZN5aiter48fmoe_stage1_bf16_pertokenFp8_g1u1_16x128_4tg_pf2E,98.0%,12.07,12071.04,0
stage1,80,16,6144,384,128,4,ActivationType.Swiglu,torch.bfloat16,torch.float8_e4m3fnuz,torch.float8_e4m3fnuz,QuantType.per_Token,1,0,16,0,64.1562,_ZN5aiter48fmoe_stage1_bf16_pertokenFp8_g1u1_16x128_4tg_pf3E,98.0%,14.12,14125.91,0
stage1,80,16,6144,384,128,4,ActivationType.Swiglu,torch.bfloat16,torch.float8_e4m3fnuz,torch.float8_e4m3fnuz,QuantType.per_Token,1,0,16,0,-1.0,_ZN5aiter48fmoe_stage1_bf16_pertokenFp8_g1u1_16x256_3tg_pf2E,100.0%,0.0,0.0,0
stage1,80,16,6144,384,128,4,ActivationType.Swiglu,torch.bfloat16,torch.float8_e4m3fnuz,torch.float8_e4m3fnuz,QuantType.per_Token,1,0,16,0,-1.0,_ZN5aiter48fmoe_stage1_bf16_pertokenFp8_g1u1_16x256_2tg_pf3E,100.0%,0.0,0.0,0
stage1,80,16,6144,384,128,4,ActivationType.Swiglu,torch.bfloat16,torch.float8_e4m3fnuz,torch.float8_e4m3fnuz,QuantType.per_Token,1,0,16,0,-1.0,_ZN5aiter48fmoe_stage1_bf16_pertokenFp8_g1u1_16x512_2tg_pf2E,100.0%,0.0,0.0,0
stage1,80,16,6144,384,128,4,ActivationType.Swiglu,torch.bfloat16,torch.float8_e4m3fnuz,torch.float8_e4m3fnuz,QuantType.per_Token,1,0,16,0,-1.0,_ZN5aiter44fmoe_stage1_bf16_pertokenFp8_g1u1_16x512_pf3E,100.0%,0.0,0.0,0
stage1,80,16,6144,384,128,4,ActivationType.Swiglu,torch.bfloat16,torch.float8_e4m3fnuz,torch.float8_e4m3fnuz,QuantType.per_Token,1,0,16,0,70.311,_ZN5aiter47fmoe_stage1_bf16_pertokenFp8_g1u1_16x64_6tg_pf2E,98.0%,12.89,12889.37,0
stage1,80,16,6144,384,128,4,ActivationType.Swiglu,torch.bfloat16,torch.float8_e4m3fnuz,torch.float8_e4m3fnuz,QuantType.per_Token,1,0,16,0,70.3886,_ZN5aiter47fmoe_stage1_bf16_pertokenFp8_g1u1_16x64_5tg_pf3E,98.0%,12.87,12875.16,0
stage1,80,16,6144,384,128,4,ActivationType.Swiglu,torch.bfloat16,torch.float8_e4m3fnuz,torch.float8_e4m3fnuz,QuantType.per_Token,1,0,32,0,75.2992,_ZN5aiter48fmoe_stage1_bf16_pertokenFp8_g1u1_32x128_3tg_pf2E,98.0%,12.03,12035.51,0
stage1,80,16,6144,384,128,4,ActivationType.Swiglu,torch.bfloat16,torch.float8_e4m3fnuz,torch.float8_e4m3fnuz,QuantType.per_Token,1,0,32,0,67.1607,_ZN5aiter48fmoe_stage1_bf16_pertokenFp8_g1u1_32x128_3tg_pf3E,98.0%,13.49,13493.97,0
stage1,80,16,6144,384,128,4,ActivationType.Swiglu,torch.bfloat16,torch.float8_e4m3fnuz,torch.float8_e4m3fnuz,QuantType.per_Token,1,0,32,0,-1.0,_ZN5aiter48fmoe_stage1_bf16_pertokenFp8_g1u1_32x256_2tg_pf2E,100.0%,0.0,0.0,0
stage1,80,16,6144,384,128,4,ActivationType.Swiglu,torch.bfloat16,torch.float8_e4m3fnuz,torch.float8_e4m3fnuz,QuantType.per_Token,1,0,32,0,-1.0,_ZN5aiter48fmoe_stage1_bf16_pertokenFp8_g1u1_32x256_2tg_pf3E,100.0%,0.0,0.0,0
stage1,80,16,6144,384,128,4,ActivationType.Swiglu,torch.bfloat16,torch.float8_e4m3fnuz,torch.float8_e4m3fnuz,QuantType.per_Token,1,0,32,0,-1.0,_ZN5aiter44fmoe_stage1_bf16_pertokenFp8_g1u1_32x512_pf2E,100.0%,0.0,0.0,0
stage1,80,16,6144,384,128,4,ActivationType.Swiglu,torch.bfloat16,torch.float8_e4m3fnuz,torch.float8_e4m3fnuz,QuantType.per_Token,1,0,32,0,-1.0,_ZN5aiter44fmoe_stage1_bf16_pertokenFp8_g1u1_32x512_pf3E,100.0%,0.0,0.0,0
stage1,80,16,6144,384,128,4,ActivationType.Swiglu,torch.bfloat16,torch.float8_e4m3fnuz,torch.float8_e4m3fnuz,QuantType.per_Token,1,0,32,0,73.8295,_ZN5aiter47fmoe_stage1_bf16_pertokenFp8_g1u1_32x64_4tg_pf2E,98.0%,12.27,12275.1,0
stage1,80,16,6144,384,128,4,ActivationType.Swiglu,torch.bfloat16,torch.float8_e4m3fnuz,torch.float8_e4m3fnuz,QuantType.per_Token,1,0,32,0,72.2434,_ZN5aiter47fmoe_stage1_bf16_pertokenFp8_g1u1_32x64_4tg_pf3E,98.0%,12.54,12544.6,0
stage1,80,16,6144,384,128,4,ActivationType.Swiglu,torch.bfloat16,torch.float8_e4m3fnuz,torch.float8_e4m3fnuz,QuantType.per_Token,1,0,64,0,89.0144,_ZN5aiter48fmoe_stage1_bf16_pertokenFp8_g1u1_64x128_2tg_pf2E,98.0%,10.18,10181.1,0
stage1,80,16,6144,384,128,4,ActivationType.Swiglu,torch.bfloat16,torch.float8_e4m3fnuz,torch.float8_e4m3fnuz,QuantType.per_Token,1,0,64,0,82.6067,_ZN5aiter48fmoe_stage1_bf16_pertokenFp8_g1u1_64x128_2tg_pf3E,98.0%,10.97,10970.84,0
stage1,80,16,6144,384,128,4,ActivationType.Swiglu,torch.bfloat16,torch.float8_e4m3fnuz,torch.float8_e4m3fnuz,QuantType.per_Token,1,0,64,0,-1.0,_ZN5aiter44fmoe_stage1_bf16_pertokenFp8_g1u1_64x256_pf2E,100.0%,0.0,0.0,0
stage1,80,16,6144,384,128,4,ActivationType.Swiglu,torch.bfloat16,torch.float8_e4m3fnuz,torch.float8_e4m3fnuz,QuantType.per_Token,1,0,64,0,-1.0,_ZN5aiter44fmoe_stage1_bf16_pertokenFp8_g1u1_64x256_pf3E,100.0%,0.0,0.0,0
stage1,80,16,6144,384,128,4,ActivationType.Swiglu,torch.bfloat16,torch.float8_e4m3fnuz,torch.float8_e4m3fnuz,QuantType.per_Token,1,0,64,0,125.6779,_ZN5aiter47fmoe_stage1_bf16_pertokenFp8_g1u1_64x64_3tg_pf2E,98.0%,7.21,7211.01,0
stage1,80,16,6144,384,128,4,ActivationType.Swiglu,torch.bfloat16,torch.float8_e4m3fnuz,torch.float8_e4m3fnuz,QuantType.per_Token,1,0,64,0,97.3659,_ZN5aiter47fmoe_stage1_bf16_pertokenFp8_g1u1_64x64_2tg_pf3E,98.0%,9.3,9307.82,0
stage1,80,16,6144,384,128,4,ActivationType.Swiglu,torch.bfloat16,torch.float8_e4m3fnuz,torch.float8_e4m3fnuz,QuantType.per_Token,1,0,128,0,168.7767,_ZN5aiter45fmoe_stage1_bf16_pertokenFp8_g1u1_128x128_pf2E,98.0%,5.37,5369.61,0
stage1,80,16,6144,384,128,4,ActivationType.Swiglu,torch.bfloat16,torch.float8_e4m3fnuz,torch.float8_e4m3fnuz,QuantType.per_Token,1,0,128,0,166.1194,_ZN5aiter45fmoe_stage1_bf16_pertokenFp8_g1u1_128x128_pf3E,98.0%,5.45,5455.5,0
stage1,80,16,6144,384,128,4,ActivationType.Swiglu,torch.bfloat16,torch.float8_e4m3fnuz,torch.float8_e4m3fnuz,QuantType.per_Token,1,0,128,0,239.7026,_ZN5aiter44fmoe_stage1_bf16_pertokenFp8_g1u1_128x64_pf2E,98.0%,3.78,3780.79,0
stage1,80,16,6144,384,128,4,ActivationType.Swiglu,torch.bfloat16,torch.float8_e4m3fnuz,torch.float8_e4m3fnuz,QuantType.per_Token,1,0,128,0,199.7807,_ZN5aiter44fmoe_stage1_bf16_pertokenFp8_g1u1_128x64_pf3E,98.0%,4.53,4536.3,0
stage1,80,16,6144,384,128,4,ActivationType.Swiglu,torch.bfloat16,torch.float8_e4m3fnuz,torch.float8_e4m3fnuz,QuantType.per_Token,1,0,16,0,72.344,moe_ck2stages_gemm1_128x16x64x128_1x2_MulABScale_v1_Nswizzle0_Quant2_MulRoutedWeight0_swiglu_F8_F8_B16,0.0%,12.52,12527.16,0
stage1,80,16,6144,384,128,4,ActivationType.Swiglu,torch.bfloat16,torch.float8_e4m3fnuz,torch.float8_e4m3fnuz,QuantType.per_Token,1,0,16,0,72.3521,moe_ck2stages_gemm1_256x16x128x256_1x4_MulABScale_v1_Nswizzle0_Quant2_MulRoutedWeight0_swiglu_F8_F8_B16,0.0%,12.52,12525.75,0
stage1,80,16,6144,384,128,4,ActivationType.Swiglu,torch.bfloat16,torch.float8_e4m3fnuz,torch.float8_e4m3fnuz,QuantType.per_Token,1,0,16,0,70.9084,moe_ck2stages_gemm1_256x16x64x256_1x4_MulABScale_v1_Nswizzle0_Quant2_MulRoutedWeight0_swiglu_F8_F8_B16,0.0%,12.78,12780.78,0
stage2,80,16,6144,384,128,4,ActivationType.Swiglu,torch.bfloat16,torch.float8_e4m3fnuz,torch.float8_e4m3fnuz,QuantType.per_Token,1,0,16,0,-1.0,moe_ck2stages_gemm2_256x16x128x256_1x4_MulABScaleExpertWeight_v1_Nswizzle0_Quant2_MulRoutedWeight1_F8_F8_B16,100.0%,0.0,0.0,0
stage2,80,16,6144,384,128,4,ActivationType.Swiglu,torch.bfloat16,torch.float8_e4m3fnuz,torch.float8_e4m3fnuz,QuantType.per_Token,1,0,16,0,54.6834,moe_ck2stages_gemm2_128x16x128x128_1x2_MulABScaleExpertWeight_v1_Nswizzle0_Quant2_MulRoutedWeight1_F8_F8_B16,2.7%,16.57,16572.94,0
stage2,80,16,6144,384,128,4,ActivationType.Swiglu,torch.bfloat16,torch.float8_e4m3fnuz,torch.float8_e4m3fnuz,QuantType.per_Token,1,0,16,0,59.2957,moe_ck2stages_gemm2_64x16x64x64_1x1_MulABScaleExpertWeight_v1_Nswizzle0_Quant2_MulRoutedWeight1_F8_F8_B16,2.6%,15.28,15283.82,0
stage1,80,16,6144,384,128,4,ActivationType.Swiglu,torch.bfloat16,torch.float8_e4m3fnuz,torch.float8_e4m3fnuz,QuantType.per_Token,1,0,32,0,78.0963,moe_ck2stages_gemm1_256x32x64x256_1x4_MulABScale_v1_Nswizzle0_Quant2_MulRoutedWeight0_swiglu_F8_F8_B16,0.0%,11.6,11604.45,0
stage1,80,16,6144,384,128,4,ActivationType.Swiglu,torch.bfloat16,torch.float8_e4m3fnuz,torch.float8_e4m3fnuz,QuantType.per_Token,1,0,32,0,78.1808,moe_ck2stages_gemm1_256x32x64x128_1x4_MulABScale_v1_Nswizzle0_Quant2_MulRoutedWeight0_swiglu_F8_F8_B16,0.0%,11.59,11591.91,0
stage2,80,16,6144,384,128,4,ActivationType.Swiglu,torch.bfloat16,torch.float8_e4m3fnuz,torch.float8_e4m3fnuz,QuantType.per_Token,1,0,32,0,-1.0,moe_ck2stages_gemm2_256x32x64x256_1x4_MulABScaleExpertWeight_v1_Nswizzle0_Quant2_MulRoutedWeight1_F8_F8_B16,100.0%,0.0,0.0,0
stage2,80,16,6144,384,128,4,ActivationType.Swiglu,torch.bfloat16,torch.float8_e4m3fnuz,torch.float8_e4m3fnuz,QuantType.per_Token,1,0,32,0,71.6266,moe_ck2stages_gemm2_256x32x64x128_1x4_MulABScaleExpertWeight_v1_Nswizzle0_Quant2_MulRoutedWeight1_F8_F8_B16,2.7%,12.65,12652.63,0
stage2,80,16,6144,384,128,4,ActivationType.Swiglu,torch.bfloat16,torch.float8_e4m3fnuz,torch.float8_e4m3fnuz,QuantType.per_Token,1,0,32,0,122.9026,moe_ck2stages_gemm2_256x32x64x64_1x4_MulABScaleExpertWeight_v1_Nswizzle0_Quant2_MulRoutedWeight1_F8_F8_B16,99.5%,7.37,7373.84,0
stage1,80,16,6144,384,128,4,ActivationType.Swiglu,torch.bfloat16,torch.float8_e4m3fnuz,torch.float8_e4m3fnuz,QuantType.per_Token,1,0,64,0,117.2127,moe_ck2stages_gemm1_256x64x64x256_1x4_MulABScale_v1_Nswizzle0_Quant2_MulRoutedWeight0_swiglu_F8_F8_B16,0.0%,7.73,7731.8,0
stage1,80,16,6144,384,128,4,ActivationType.Swiglu,torch.bfloat16,torch.float8_e4m3fnuz,torch.float8_e4m3fnuz,QuantType.per_Token,1,0,64,0,110.6951,moe_ck2stages_gemm1_256x64x64x128_1x4_MulABScale_v1_Nswizzle0_Quant2_MulRoutedWeight0_swiglu_F8_F8_B16,0.0%,8.18,8187.03,0
stage1,80,16,6144,384,128,4,ActivationType.Swiglu,torch.bfloat16,torch.float8_e4m3fnuz,torch.float8_e4m3fnuz,QuantType.per_Token,1,0,64,0,115.854,moe_ck2stages_gemm1_256x64x128x256_1x4_MulABScale_v3_Nswizzle0_Quant2_MulRoutedWeight0_swiglu_F8_F8_B16,0.0%,7.82,7822.47,0
stage1,80,16,6144,384,128,4,ActivationType.Swiglu,torch.bfloat16,torch.float8_e4m3fnuz,torch.float8_e4m3fnuz,QuantType.per_Token,1,0,64,0,103.6326,moe_ck2stages_gemm1_256x64x128x128_1x4_MulABScale_v3_Nswizzle0_Quant2_MulRoutedWeight0_swiglu_F8_F8_B16,0.0%,8.74,8744.98,0
stage2,80,16,6144,384,128,4,ActivationType.Swiglu,torch.bfloat16,torch.float8_e4m3fnuz,torch.float8_e4m3fnuz,QuantType.per_Token,1,0,64,0,-1.0,moe_ck2stages_gemm2_256x64x64x256_1x4_MulABScaleExpertWeight_v1_Nswizzle0_Quant2_MulRoutedWeight1_F8_F8_B16,100.0%,0.0,0.0,0
stage2,80,16,6144,384,128,4,ActivationType.Swiglu,torch.bfloat16,torch.float8_e4m3fnuz,torch.float8_e4m3fnuz,QuantType.per_Token,1,0,64,0,-1.0,moe_ck2stages_gemm2_256x64x128x256_1x4_MulABScaleExpertWeight_v3_Nswizzle0_Quant2_MulRoutedWeight1_F8_F8_B16,100.0%,0.0,0.0,0
stage2,80,16,6144,384,128,4,ActivationType.Swiglu,torch.bfloat16,torch.float8_e4m3fnuz,torch.float8_e4m3fnuz,QuantType.per_Token,1,0,64,0,166.8539,moe_ck2stages_gemm2_256x64x128x128_1x4_MulABScaleExpertWeight_v3_Nswizzle0_Quant2_MulRoutedWeight1_F8_F8_B16,2.7%,5.43,5431.49,0
stage2,80,16,6144,384,128,4,ActivationType.Swiglu,torch.bfloat16,torch.float8_e4m3fnuz,torch.float8_e4m3fnuz,QuantType.per_Token,1,0,64,0,248.3806,moe_ck2stages_gemm2_256x64x128x64_1x4_MulABScaleExpertWeight_v3_Nswizzle0_Quant2_MulRoutedWeight1_F8_F8_B16,99.5%,3.65,3648.69,0
stage2,80,16,6144,384,128,4,ActivationType.Swiglu,torch.bfloat16,torch.float8_e4m3fnuz,torch.float8_e4m3fnuz,QuantType.per_Token,1,0,64,0,223.4984,moe_ck2stages_gemm2_256x64x64x64_1x4_MulABScaleExpertWeight_v1_Nswizzle0_Quant2_MulRoutedWeight1_F8_F8_B16,99.5%,4.05,4054.9,0
stage1,80,16,6144,384,128,4,ActivationType.Swiglu,torch.bfloat16,torch.float8_e4m3fnuz,torch.float8_e4m3fnuz,QuantType.per_Token,1,0,128,0,208.8649,moe_ck2stages_gemm1_256x128x64x128_1x4_MulABScale_v1_Nswizzle0_Quant2_MulRoutedWeight0_swiglu_F8_F8_B16,0.0%,4.34,4339.0,0
stage1,80,16,6144,384,128,4,ActivationType.Swiglu,torch.bfloat16,torch.float8_e4m3fnuz,torch.float8_e4m3fnuz,QuantType.per_Token,1,0,128,0,213.4529,moe_ck2stages_gemm1_256x128x128x256_1x4_MulABScale_v3_Nswizzle0_Quant2_MulRoutedWeight0_swiglu_F8_F8_B16,0.0%,4.24,4245.74,0
stage1,80,16,6144,384,128,4,ActivationType.Swiglu,torch.bfloat16,torch.float8_e4m3fnuz,torch.float8_e4m3fnuz,QuantType.per_Token,1,0,128,0,213.0331,moe_ck2stages_gemm1_256x128x128x128_1x4_MulABScale_v3_Nswizzle0_Quant2_MulRoutedWeight0_swiglu_F8_F8_B16,0.0%,4.25,4254.1,0
stage2,80,16,6144,384,128,4,ActivationType.Swiglu,torch.bfloat16,torch.float8_e4m3fnuz,torch.float8_e4m3fnuz,QuantType.per_Token,1,0,128,0,362.8122,moe_ck2stages_gemm2_256x128x64x128_1x4_MulABScaleExpertWeight_v1_Nswizzle0_Quant2_MulRoutedWeight1_F8_F8_B16,2.7%,2.5,2497.89,0
stage2,80,16,6144,384,128,4,ActivationType.Swiglu,torch.bfloat16,torch.float8_e4m3fnuz,torch.float8_e4m3fnuz,QuantType.per_Token,1,0,128,0,271.4288,moe_ck2stages_gemm2_256x128x128x128_1x4_MulABScaleExpertWeight_v3_Nswizzle0_Quant2_MulRoutedWeight1_F8_F8_B16,2.7%,3.34,3338.87,0
stage2,80,16,6144,384,128,4,ActivationType.Swiglu,torch.bfloat16,torch.float8_e4m3fnuz,torch.float8_e4m3fnuz,QuantType.per_Token,1,0,128,0,384.0302,moe_ck2stages_gemm2_256x128x128x64_1x4_MulABScaleExpertWeight_v3_Nswizzle0_Quant2_MulRoutedWeight1_F8_F8_B16,99.5%,2.36,2359.88,0
stage2,80,16,6144,384,128,4,ActivationType.Swiglu,torch.bfloat16,torch.float8_e4m3fnuz,torch.float8_e4m3fnuz,QuantType.per_Token,1,0,128,0,431.9768,moe_ck2stages_gemm2_256x128x64x64_1x4_MulABScaleExpertWeight_v3_Nswizzle0_Quant2_MulRoutedWeight1_F8_F8_B16,99.5%,2.1,2097.95,0
stage1,80,32,6144,384,128,4,ActivationType.Swiglu,torch.bfloat16,torch.float8_e4m3fnuz,torch.float8_e4m3fnuz,QuantType.per_Token,1,0,16,0,96.9417,_ZN5aiter48fmoe_stage1_bf16_pertokenFp8_g1u1_16x128_4tg_pf2E,98.0%,18.69,9351.59,0
stage1,80,32,6144,384,128,4,ActivationType.Swiglu,torch.bfloat16,torch.float8_e4m3fnuz,torch.float8_e4m3fnuz,QuantType.per_Token,1,0,16,0,105.0725,_ZN5aiter48fmoe_stage1_bf16_pertokenFp8_g1u1_16x128_4tg_pf3E,98.0%,17.24,8627.94,0
stage1,80,32,6144,384,128,4,ActivationType.Swiglu,torch.bfloat16,torch.float8_e4m3fnuz,torch.float8_e4m3fnuz,QuantType.per_Token,1,0,16,0,-1.0,_ZN5aiter48fmoe_stage1_bf16_pertokenFp8_g1u1_16x256_3tg_pf2E,100.0%,0.0,0.0,0
stage1,80,32,6144,384,128,4,ActivationType.Swiglu,torch.bfloat16,torch.float8_e4m3fnuz,torch.float8_e4m3fnuz,QuantType.per_Token,1,0,16,0,-1.0,_ZN5aiter48fmoe_stage1_bf16_pertokenFp8_g1u1_16x256_2tg_pf3E,100.0%,0.0,0.0,0
stage1,80,32,6144,384,128,4,ActivationType.Swiglu,torch.bfloat16,torch.float8_e4m3fnuz,torch.float8_e4m3fnuz,QuantType.per_Token,1,0,16,0,-1.0,_ZN5aiter48fmoe_stage1_bf16_pertokenFp8_g1u1_16x512_2tg_pf2E,100.0%,0.0,0.0,0
stage1,80,32,6144,384,128,4,ActivationType.Swiglu,torch.bfloat16,torch.float8_e4m3fnuz,torch.float8_e4m3fnuz,QuantType.per_Token,1,0,16,0,-1.0,_ZN5aiter44fmoe_stage1_bf16_pertokenFp8_g1u1_16x512_pf3E,100.0%,0.0,0.0,0
stage1,80,32,6144,384,128,4,ActivationType.Swiglu,torch.bfloat16,torch.float8_e4m3fnuz,torch.float8_e4m3fnuz,QuantType.per_Token,1,0,16,0,99.5307,_ZN5aiter47fmoe_stage1_bf16_pertokenFp8_g1u1_16x64_6tg_pf2E,98.0%,18.2,9108.34,0
stage1,80,32,6144,384,128,4,ActivationType.Swiglu,torch.bfloat16,torch.float8_e4m3fnuz,torch.float8_e4m3fnuz,QuantType.per_Token,1,0,16,0,113.3426,_ZN5aiter47fmoe_stage1_bf16_pertokenFp8_g1u1_16x64_5tg_pf3E,98.0%,15.99,7998.4,0
stage1,80,32,6144,384,128,4,ActivationType.Swiglu,torch.bfloat16,torch.float8_e4m3fnuz,torch.float8_e4m3fnuz,QuantType.per_Token,1,0,32,0,103.0823,_ZN5aiter48fmoe_stage1_bf16_pertokenFp8_g1u1_32x128_3tg_pf2E,98.0%,17.58,8794.52,0
stage1,80,32,6144,384,128,4,ActivationType.Swiglu,torch.bfloat16,torch.float8_e4m3fnuz,torch.float8_e4m3fnuz,QuantType.per_Token,1,0,32,0,106.2476,_ZN5aiter48fmoe_stage1_bf16_pertokenFp8_g1u1_32x128_3tg_pf3E,98.0%,17.05,8532.52,0
stage1,80,32,6144,384,128,4,ActivationType.Swiglu,torch.bfloat16,torch.float8_e4m3fnuz,torch.float8_e4m3fnuz,QuantType.per_Token,1,0,32,0,-1.0,_ZN5aiter48fmoe_stage1_bf16_pertokenFp8_g1u1_32x256_2tg_pf2E,100.0%,0.0,0.0,0
stage1,80,32,6144,384,128,4,ActivationType.Swiglu,torch.bfloat16,torch.float8_e4m3fnuz,torch.float8_e4m3fnuz,QuantType.per_Token,1,0,32,0,-1.0,_ZN5aiter48fmoe_stage1_bf16_pertokenFp8_g1u1_32x256_2tg_pf3E,100.0%,0.0,0.0,0
stage1,80,32,6144,384,128,4,ActivationType.Swiglu,torch.bfloat16,torch.float8_e4m3fnuz,torch.float8_e4m3fnuz,QuantType.per_Token,1,0,32,0,-1.0,_ZN5aiter44fmoe_stage1_bf16_pertokenFp8_g1u1_32x512_pf2E,100.0%,0.0,0.0,0
stage1,80,32,6144,384,128,4,ActivationType.Swiglu,torch.bfloat16,torch.float8_e4m3fnuz,torch.float8_e4m3fnuz,QuantType.per_Token,1,0,32,0,-1.0,_ZN5aiter44fmoe_stage1_bf16_pertokenFp8_g1u1_32x512_pf3E,100.0%,0.0,0.0,0
stage1,80,32,6144,384,128,4,ActivationType.Swiglu,torch.bfloat16,torch.float8_e4m3fnuz,torch.float8_e4m3fnuz,QuantType.per_Token,1,0,32,0,135.5384,_ZN5aiter47fmoe_stage1_bf16_pertokenFp8_g1u1_32x64_4tg_pf2E,98.0%,13.37,6688.58,0
stage1,80,32,6144,384,128,4,ActivationType.Swiglu,torch.bfloat16,torch.float8_e4m3fnuz,torch.float8_e4m3fnuz,QuantType.per_Token,1,0,32,0,113.6036,_ZN5aiter47fmoe_stage1_bf16_pertokenFp8_g1u1_32x64_4tg_pf3E,98.0%,15.95,7980.02,0
stage1,80,32,6144,384,128,4,ActivationType.Swiglu,torch.bfloat16,torch.float8_e4m3fnuz,torch.float8_e4m3fnuz,QuantType.per_Token,1,0,64,0,149.5769,_ZN5aiter48fmoe_stage1_bf16_pertokenFp8_g1u1_64x128_2tg_pf2E,98.0%,12.11,6060.83,0
stage1,80,32,6144,384,128,4,ActivationType.Swiglu,torch.bfloat16,torch.float8_e4m3fnuz,torch.float8_e4m3fnuz,QuantType.per_Token,1,0,64,0,130.358,_ZN5aiter48fmoe_stage1_bf16_pertokenFp8_g1u1_64x128_2tg_pf3E,98.0%,13.9,6954.38,0
stage1,80,32,6144,384,128,4,ActivationType.Swiglu,torch.bfloat16,torch.float8_e4m3fnuz,torch.float8_e4m3fnuz,QuantType.per_Token,1,0,64,0,-1.0,_ZN5aiter44fmoe_stage1_bf16_pertokenFp8_g1u1_64x256_pf2E,100.0%,0.0,0.0,0
stage1,80,32,6144,384,128,4,ActivationType.Swiglu,torch.bfloat16,torch.float8_e4m3fnuz,torch.float8_e4m3fnuz,QuantType.per_Token,1,0,64,0,-1.0,_ZN5aiter44fmoe_stage1_bf16_pertokenFp8_g1u1_64x256_pf3E,100.0%,0.0,0.0,0
stage1,80,32,6144,384,128,4,ActivationType.Swiglu,torch.bfloat16,torch.float8_e4m3fnuz,torch.float8_e4m3fnuz,QuantType.per_Token,1,0,64,0,148.8701,_ZN5aiter47fmoe_stage1_bf16_pertokenFp8_g1u1_64x64_3tg_pf2E,98.0%,12.17,6089.6,0
stage1,80,32,6144,384,128,4,ActivationType.Swiglu,torch.bfloat16,torch.float8_e4m3fnuz,torch.float8_e4m3fnuz,QuantType.per_Token,1,0,64,0,145.3249,_ZN5aiter47fmoe_stage1_bf16_pertokenFp8_g1u1_64x64_2tg_pf3E,98.0%,12.47,6238.16,0
stage1,80,32,6144,384,128,4,ActivationType.Swiglu,torch.bfloat16,torch.float8_e4m3fnuz,torch.float8_e4m3fnuz,QuantType.per_Token,1,0,128,0,250.881,_ZN5aiter45fmoe_stage1_bf16_pertokenFp8_g1u1_128x128_pf2E,98.0%,7.22,3613.5,0
stage1,80,32,6144,384,128,4,ActivationType.Swiglu,torch.bfloat16,torch.float8_e4m3fnuz,torch.float8_e4m3fnuz,QuantType.per_Token,1,0,128,0,246.3686,_ZN5aiter45fmoe_stage1_bf16_pertokenFp8_g1u1_128x128_pf3E,98.0%,7.35,3679.69,0
stage1,80,32,6144,384,128,4,ActivationType.Swiglu,torch.bfloat16,torch.float8_e4m3fnuz,torch.float8_e4m3fnuz,QuantType.per_Token,1,0,128,0,355.1647,_ZN5aiter44fmoe_stage1_bf16_pertokenFp8_g1u1_128x64_pf2E,98.0%,5.1,2552.5,0
stage1,80,32,6144,384,128,4,ActivationType.Swiglu,torch.bfloat16,torch.float8_e4m3fnuz,torch.float8_e4m3fnuz,QuantType.per_Token,1,0,128,0,294.0665,_ZN5aiter44fmoe_stage1_bf16_pertokenFp8_g1u1_128x64_pf3E,98.0%,6.16,3082.84,0
stage1,80,32,6144,384,128,4,ActivationType.Swiglu,torch.bfloat16,torch.float8_e4m3fnuz,torch.float8_e4m3fnuz,QuantType.per_Token,1,0,16,0,109.8937,moe_ck2stages_gemm1_128x16x64x128_1x2_MulABScale_v1_Nswizzle0_Quant2_MulRoutedWeight0_swiglu_F8_F8_B16,0.0%,16.49,8249.42,0
stage1,80,32,6144,384,128,4,ActivationType.Swiglu,torch.bfloat16,torch.float8_e4m3fnuz,torch.float8_e4m3fnuz,QuantType.per_Token,1,0,16,0,103.2464,moe_ck2stages_gemm1_256x16x128x256_1x4_MulABScale_v1_Nswizzle0_Quant2_MulRoutedWeight0_swiglu_F8_F8_B16,0.0%,17.55,8780.54,0
stage1,80,32,6144,384,128,4,ActivationType.Swiglu,torch.bfloat16,torch.float8_e4m3fnuz,torch.float8_e4m3fnuz,QuantType.per_Token,1,0,16,0,112.0227,moe_ck2stages_gemm1_256x16x64x256_1x4_MulABScale_v1_Nswizzle0_Quant2_MulRoutedWeight0_swiglu_F8_F8_B16,0.0%,16.17,8092.64,0
stage2,80,32,6144,384,128,4,ActivationType.Swiglu,torch.bfloat16,torch.float8_e4m3fnuz,torch.float8_e4m3fnuz,QuantType.per_Token,1,0,16,0,-1.0,moe_ck2stages_gemm2_256x16x128x256_1x4_MulABScaleExpertWeight_v1_Nswizzle0_Quant2_MulRoutedWeight1_F8_F8_B16,100.0%,0.0,0.0,0
stage2,80,32,6144,384,128,4,ActivationType.Swiglu,torch.bfloat16,torch.float8_e4m3fnuz,torch.float8_e4m3fnuz,QuantType.per_Token,1,0,16,0,77.5171,moe_ck2stages_gemm2_128x16x128x128_1x2_MulABScaleExpertWeight_v1_Nswizzle0_Quant2_MulRoutedWeight1_F8_F8_B16,2.7%,23.37,11694.96,0
stage2,80,32,6144,384,128,4,ActivationType.Swiglu,torch.bfloat16,torch.float8_e4m3fnuz,torch.float8_e4m3fnuz,QuantType.per_Token,1,0,16,0,80.1684,moe_ck2stages_gemm2_64x16x64x64_1x1_MulABScaleExpertWeight_v1_Nswizzle0_Quant2_MulRoutedWeight1_F8_F8_B16,2.7%,22.6,11308.19,0
stage1,80,32,6144,384,128,4,ActivationType.Swiglu,torch.bfloat16,torch.float8_e4m3fnuz,torch.float8_e4m3fnuz,QuantType.per_Token,1,0,32,0,114.3729,moe_ck2stages_gemm1_256x32x64x256_1x4_MulABScale_v1_Nswizzle0_Quant2_MulRoutedWeight0_swiglu_F8_F8_B16,0.0%,15.84,7926.35,0
stage1,80,32,6144,384,128,4,ActivationType.Swiglu,torch.bfloat16,torch.float8_e4m3fnuz,torch.float8_e4m3fnuz,QuantType.per_Token,1,0,32,0,114.6747,moe_ck2stages_gemm1_256x32x64x128_1x4_MulABScale_v1_Nswizzle0_Quant2_MulRoutedWeight0_swiglu_F8_F8_B16,0.0%,15.8,7905.49,0
stage2,80,32,6144,384,128,4,ActivationType.Swiglu,torch.bfloat16,torch.float8_e4m3fnuz,torch.float8_e4m3fnuz,QuantType.per_Token,1,0,32,0,-1.0,moe_ck2stages_gemm2_256x32x64x256_1x4_MulABScaleExpertWeight_v1_Nswizzle0_Quant2_MulRoutedWeight1_F8_F8_B16,100.0%,0.0,0.0,0
stage2,80,32,6144,384,128,4,ActivationType.Swiglu,torch.bfloat16,torch.float8_e4m3fnuz,torch.float8_e4m3fnuz,QuantType.per_Token,1,0,32,0,100.1745,moe_ck2stages_gemm2_256x32x64x128_1x4_MulABScaleExpertWeight_v1_Nswizzle0_Quant2_MulRoutedWeight1_F8_F8_B16,2.7%,18.09,9049.8,0
stage2,80,32,6144,384,128,4,ActivationType.Swiglu,torch.bfloat16,torch.float8_e4m3fnuz,torch.float8_e4m3fnuz,QuantType.per_Token,1,0,32,0,172.2471,moe_ck2stages_gemm2_256x32x64x64_1x4_MulABScaleExpertWeight_v1_Nswizzle0_Quant2_MulRoutedWeight1_F8_F8_B16,99.6%,10.52,5263.13,0
stage1,80,32,6144,384,128,4,ActivationType.Swiglu,torch.bfloat16,torch.float8_e4m3fnuz,torch.float8_e4m3fnuz,QuantType.per_Token,1,0,64,0,171.7431,moe_ck2stages_gemm1_256x64x64x256_1x4_MulABScale_v1_Nswizzle0_Quant2_MulRoutedWeight0_swiglu_F8_F8_B16,0.0%,10.55,5278.58,0
stage1,80,32,6144,384,128,4,ActivationType.Swiglu,torch.bfloat16,torch.float8_e4m3fnuz,torch.float8_e4m3fnuz,QuantType.per_Token,1,0,64,0,155.2109,moe_ck2stages_gemm1_256x64x64x128_1x4_MulABScale_v1_Nswizzle0_Quant2_MulRoutedWeight0_swiglu_F8_F8_B16,0.0%,11.67,5840.82,0
stage1,80,32,6144,384,128,4,ActivationType.Swiglu,torch.bfloat16,torch.float8_e4m3fnuz,torch.float8_e4m3fnuz,QuantType.per_Token,1,0,64,0,171.8698,moe_ck2stages_gemm1_256x64x128x256_1x4_MulABScale_v3_Nswizzle0_Quant2_MulRoutedWeight0_swiglu_F8_F8_B16,0.0%,10.54,5274.69,0
stage1,80,32,6144,384,128,4,ActivationType.Swiglu,torch.bfloat16,torch.float8_e4m3fnuz,torch.float8_e4m3fnuz,QuantType.per_Token,1,0,64,0,156.1358,moe_ck2stages_gemm1_256x64x128x128_1x4_MulABScale_v3_Nswizzle0_Quant2_MulRoutedWeight0_swiglu_F8_F8_B16,0.0%,11.6,5806.22,0
stage2,80,32,6144,384,128,4,ActivationType.Swiglu,torch.bfloat16,torch.float8_e4m3fnuz,torch.float8_e4m3fnuz,QuantType.per_Token,1,0,64,0,-1.0,moe_ck2stages_gemm2_256x64x64x256_1x4_MulABScaleExpertWeight_v1_Nswizzle0_Quant2_MulRoutedWeight1_F8_F8_B16,100.0%,0.0,0.0,0
stage2,80,32,6144,384,128,4,ActivationType.Swiglu,torch.bfloat16,torch.float8_e4m3fnuz,torch.float8_e4m3fnuz,QuantType.per_Token,1,0,64,0,-1.0,moe_ck2stages_gemm2_256x64x128x256_1x4_MulABScaleExpertWeight_v3_Nswizzle0_Quant2_MulRoutedWeight1_F8_F8_B16,100.0%,0.0,0.0,0
stage2,80,32,6144,384,128,4,ActivationType.Swiglu,torch.bfloat16,torch.float8_e4m3fnuz,torch.float8_e4m3fnuz,QuantType.per_Token,1,0,64,0,240.3291,moe_ck2stages_gemm2_256x64x128x128_1x4_MulABScaleExpertWeight_v3_Nswizzle0_Quant2_MulRoutedWeight1_F8_F8_B16,2.7%,7.54,3772.16,0
stage2,80,32,6144,384,128,4,ActivationType.Swiglu,torch.bfloat16,torch.float8_e4m3fnuz,torch.float8_e4m3fnuz,QuantType.per_Token,1,0,64,0,350.5655,moe_ck2stages_gemm2_256x64x128x64_1x4_MulABScaleExpertWeight_v3_Nswizzle0_Quant2_MulRoutedWeight1_F8_F8_B16,99.6%,5.17,2585.99,0
stage2,80,32,6144,384,128,4,ActivationType.Swiglu,torch.bfloat16,torch.float8_e4m3fnuz,torch.float8_e4m3fnuz,QuantType.per_Token,1,0,64,0,315.4991,moe_ck2stages_gemm2_256x64x64x64_1x4_MulABScaleExpertWeight_v1_Nswizzle0_Quant2_MulRoutedWeight1_F8_F8_B16,99.6%,5.74,2873.41,0
stage1,80,32,6144,384,128,4,ActivationType.Swiglu,torch.bfloat16,torch.float8_e4m3fnuz,torch.float8_e4m3fnuz,QuantType.per_Token,1,0,128,0,311.3326,moe_ck2stages_gemm1_256x128x64x128_1x4_MulABScale_v1_Nswizzle0_Quant2_MulRoutedWeight0_swiglu_F8_F8_B16,0.0%,5.82,2911.87,0
stage1,80,32,6144,384,128,4,ActivationType.Swiglu,torch.bfloat16,torch.float8_e4m3fnuz,torch.float8_e4m3fnuz,QuantType.per_Token,1,0,128,0,318.5471,moe_ck2stages_gemm1_256x128x128x256_1x4_MulABScale_v3_Nswizzle0_Quant2_MulRoutedWeight0_swiglu_F8_F8_B16,0.0%,5.69,2845.92,0
stage1,80,32,6144,384,128,4,ActivationType.Swiglu,torch.bfloat16,torch.float8_e4m3fnuz,torch.float8_e4m3fnuz,QuantType.per_Token,1,0,128,0,316.3584,moe_ck2stages_gemm1_256x128x128x128_1x4_MulABScale_v3_Nswizzle0_Quant2_MulRoutedWeight0_swiglu_F8_F8_B16,0.0%,5.73,2865.61,0
stage2,80,32,6144,384,128,4,ActivationType.Swiglu,torch.bfloat16,torch.float8_e4m3fnuz,torch.float8_e4m3fnuz,QuantType.per_Token,1,0,128,0,518.3396,moe_ck2stages_gemm2_256x128x64x128_1x4_MulABScaleExpertWeight_v1_Nswizzle0_Quant2_MulRoutedWeight1_F8_F8_B16,2.7%,3.5,1748.97,0
stage2,80,32,6144,384,128,4,ActivationType.Swiglu,torch.bfloat16,torch.float8_e4m3fnuz,torch.float8_e4m3fnuz,QuantType.per_Token,1,0,128,0,388.9722,moe_ck2stages_gemm2_256x128x128x128_1x4_MulABScaleExpertWeight_v3_Nswizzle0_Quant2_MulRoutedWeight1_F8_F8_B16,2.7%,4.66,2330.65,0
stage2,80,32,6144,384,128,4,ActivationType.Swiglu,torch.bfloat16,torch.float8_e4m3fnuz,torch.float8_e4m3fnuz,QuantType.per_Token,1,0,128,0,547.2179,moe_ck2stages_gemm2_256x128x128x64_1x4_MulABScaleExpertWeight_v3_Nswizzle0_Quant2_MulRoutedWeight1_F8_F8_B16,99.6%,3.31,1656.67,0
stage2,80,32,6144,384,128,4,ActivationType.Swiglu,torch.bfloat16,torch.float8_e4m3fnuz,torch.float8_e4m3fnuz,QuantType.per_Token,1,0,128,0,617.5366,moe_ck2stages_gemm2_256x128x64x64_1x4_MulABScaleExpertWeight_v3_Nswizzle0_Quant2_MulRoutedWeight1_F8_F8_B16,99.6%,2.93,1468.03,0
stage1,80,64,6144,384,128,4,ActivationType.Swiglu,torch.bfloat16,torch.float8_e4m3fnuz,torch.float8_e4m3fnuz,QuantType.per_Token,1,0,16,0,182.8204,_ZN5aiter48fmoe_stage1_bf16_pertokenFp8_g1u1_16x128_4tg_pf2E,98.0%,19.82,4961.97,0
stage1,80,64,6144,384,128,4,ActivationType.Swiglu,torch.bfloat16,torch.float8_e4m3fnuz,torch.float8_e4m3fnuz,QuantType.per_Token,1,0,16,0,166.98,_ZN5aiter48fmoe_stage1_bf16_pertokenFp8_g1u1_16x128_4tg_pf3E,98.0%,21.7,5432.68,0
stage1,80,64,6144,384,128,4,ActivationType.Swiglu,torch.bfloat16,torch.float8_e4m3fnuz,torch.float8_e4m3fnuz,QuantType.per_Token,1,0,16,0,-1.0,_ZN5aiter48fmoe_stage1_bf16_pertokenFp8_g1u1_16x256_3tg_pf2E,100.0%,0.0,0.0,0
stage1,80,64,6144,384,128,4,ActivationType.Swiglu,torch.bfloat16,torch.float8_e4m3fnuz,torch.float8_e4m3fnuz,QuantType.per_Token,1,0,16,0,-1.0,_ZN5aiter48fmoe_stage1_bf16_pertokenFp8_g1u1_16x256_2tg_pf3E,100.0%,0.0,0.0,0
stage1,80,64,6144,384,128,4,ActivationType.Swiglu,torch.bfloat16,torch.float8_e4m3fnuz,torch.float8_e4m3fnuz,QuantType.per_Token,1,0,16,0,-1.0,_ZN5aiter48fmoe_stage1_bf16_pertokenFp8_g1u1_16x512_2tg_pf2E,100.0%,0.0,0.0,0
stage1,80,64,6144,384,128,4,ActivationType.Swiglu,torch.bfloat16,torch.float8_e4m3fnuz,torch.float8_e4m3fnuz,QuantType.per_Token,1,0,16,0,-1.0,_ZN5aiter44fmoe_stage1_bf16_pertokenFp8_g1u1_16x512_pf3E,100.0%,0.0,0.0,0
stage1,80,64,6144,384,128,4,ActivationType.Swiglu,torch.bfloat16,torch.float8_e4m3fnuz,torch.float8_e4m3fnuz,QuantType.per_Token,1,0,16,0,173.3679,_ZN5aiter47fmoe_stage1_bf16_pertokenFp8_g1u1_16x64_6tg_pf2E,98.0%,20.9,5232.51,0
stage1,80,64,6144,384,128,4,ActivationType.Swiglu,torch.bfloat16,torch.float8_e4m3fnuz,torch.float8_e4m3fnuz,QuantType.per_Token,1,0,16,0,163.935,_ZN5aiter47fmoe_stage1_bf16_pertokenFp8_g1u1_16x64_5tg_pf3E,98.0%,22.11,5533.59,0
stage1,80,64,6144,384,128,4,ActivationType.Swiglu,torch.bfloat16,torch.float8_e4m3fnuz,torch.float8_e4m3fnuz,QuantType.per_Token,1,0,32,0,181.833,_ZN5aiter48fmoe_stage1_bf16_pertokenFp8_g1u1_32x128_3tg_pf2E,98.0%,19.93,4988.91,0
stage1,80,64,6144,384,128,4,ActivationType.Swiglu,torch.bfloat16,torch.float8_e4m3fnuz,torch.float8_e4m3fnuz,QuantType.per_Token,1,0,32,0,170.3686,_ZN5aiter48fmoe_stage1_bf16_pertokenFp8_g1u1_32x128_3tg_pf3E,98.0%,21.27,5324.63,0
stage1,80,64,6144,384,128,4,ActivationType.Swiglu,torch.bfloat16,torch.float8_e4m3fnuz,torch.float8_e4m3fnuz,QuantType.per_Token,1,0,32,0,-1.0,_ZN5aiter48fmoe_stage1_bf16_pertokenFp8_g1u1_32x256_2tg_pf2E,100.0%,0.0,0.0,0
stage1,80,64,6144,384,128,4,ActivationType.Swiglu,torch.bfloat16,torch.float8_e4m3fnuz,torch.float8_e4m3fnuz,QuantType.per_Token,1,0,32,0,-1.0,_ZN5aiter48fmoe_stage1_bf16_pertokenFp8_g1u1_32x256_2tg_pf3E,100.0%,0.0,0.0,0
stage1,80,64,6144,384,128,4,ActivationType.Swiglu,torch.bfloat16,torch.float8_e4m3fnuz,torch.float8_e4m3fnuz,QuantType.per_Token,1,0,32,0,-1.0,_ZN5aiter44fmoe_stage1_bf16_pertokenFp8_g1u1_32x512_pf2E,100.0%,0.0,0.0,0
stage1,80,64,6144,384,128,4,ActivationType.Swiglu,torch.bfloat16,torch.float8_e4m3fnuz,torch.float8_e4m3fnuz,QuantType.per_Token,1,0,32,0,-1.0,_ZN5aiter44fmoe_stage1_bf16_pertokenFp8_g1u1_32x512_pf3E,100.0%,0.0,0.0,0
stage1,80,64,6144,384,128,4,ActivationType.Swiglu,torch.bfloat16,torch.float8_e4m3fnuz,torch.float8_e4m3fnuz,QuantType.per_Token,1,0,32,0,198.3902,_ZN5aiter47fmoe_stage1_bf16_pertokenFp8_g1u1_32x64_4tg_pf2E,98.0%,18.27,4572.55,0
stage1,80,64,6144,384,128,4,ActivationType.Swiglu,torch.bfloat16,torch.float8_e4m3fnuz,torch.float8_e4m3fnuz,QuantType.per_Token,1,0,32,0,171.1298,_ZN5aiter47fmoe_stage1_bf16_pertokenFp8_g1u1_32x64_4tg_pf3E,98.0%,21.18,5300.94,0
stage1,80,64,6144,384,128,4,ActivationType.Swiglu,torch.bfloat16,torch.float8_e4m3fnuz,torch.float8_e4m3fnuz,QuantType.per_Token,1,0,64,0,228.1273,_ZN5aiter48fmoe_stage1_bf16_pertokenFp8_g1u1_64x128_2tg_pf2E,98.0%,15.89,3976.5,0
stage1,80,64,6144,384,128,4,ActivationType.Swiglu,torch.bfloat16,torch.float8_e4m3fnuz,torch.float8_e4m3fnuz,QuantType.per_Token,1,0,64,0,206.3341,_ZN5aiter48fmoe_stage1_bf16_pertokenFp8_g1u1_64x128_2tg_pf3E,98.0%,17.56,4396.51,0
stage1,80,64,6144,384,128,4,ActivationType.Swiglu,torch.bfloat16,torch.float8_e4m3fnuz,torch.float8_e4m3fnuz,QuantType.per_Token,1,0,64,0,-1.0,_ZN5aiter44fmoe_stage1_bf16_pertokenFp8_g1u1_64x256_pf2E,100.0%,0.0,0.0,0
stage1,80,64,6144,384,128,4,ActivationType.Swiglu,torch.bfloat16,torch.float8_e4m3fnuz,torch.float8_e4m3fnuz,QuantType.per_Token,1,0,64,0,-1.0,_ZN5aiter44fmoe_stage1_bf16_pertokenFp8_g1u1_64x256_pf3E,100.0%,0.0,0.0,0
stage1,80,64,6144,384,128,4,ActivationType.Swiglu,torch.bfloat16,torch.float8_e4m3fnuz,torch.float8_e4m3fnuz,QuantType.per_Token,1,0,64,0,220.9917,_ZN5aiter47fmoe_stage1_bf16_pertokenFp8_g1u1_64x64_3tg_pf2E,98.0%,16.4,4104.9,0
stage1,80,64,6144,384,128,4,ActivationType.Swiglu,torch.bfloat16,torch.float8_e4m3fnuz,torch.float8_e4m3fnuz,QuantType.per_Token,1,0,64,0,213.9131,_ZN5aiter47fmoe_stage1_bf16_pertokenFp8_g1u1_64x64_2tg_pf3E,98.0%,16.94,4240.74,0
stage1,80,64,6144,384,128,4,ActivationType.Swiglu,torch.bfloat16,torch.float8_e4m3fnuz,torch.float8_e4m3fnuz,QuantType.per_Token,1,0,128,0,414.8352,_ZN5aiter45fmoe_stage1_bf16_pertokenFp8_g1u1_128x128_pf2E,98.0%,8.74,2186.77,0
stage1,80,64,6144,384,128,4,ActivationType.Swiglu,torch.bfloat16,torch.float8_e4m3fnuz,torch.float8_e4m3fnuz,QuantType.per_Token,1,0,128,0,407.4493,_ZN5aiter45fmoe_stage1_bf16_pertokenFp8_g1u1_128x128_pf3E,98.0%,8.89,2226.41,0
stage1,80,64,6144,384,128,4,ActivationType.Swiglu,torch.bfloat16,torch.float8_e4m3fnuz,torch.float8_e4m3fnuz,QuantType.per_Token,1,0,128,0,530.4677,_ZN5aiter44fmoe_stage1_bf16_pertokenFp8_g1u1_128x64_pf2E,98.0%,6.83,1710.09,0
stage1,80,64,6144,384,128,4,ActivationType.Swiglu,torch.bfloat16,torch.float8_e4m3fnuz,torch.float8_e4m3fnuz,QuantType.per_Token,1,0,128,0,441.6337,_ZN5aiter44fmoe_stage1_bf16_pertokenFp8_g1u1_128x64_pf3E,98.0%,8.21,2054.08,0
stage1,80,64,6144,384,128,4,ActivationType.Swiglu,torch.bfloat16,torch.float8_e4m3fnuz,torch.float8_e4m3fnuz,QuantType.per_Token,1,0,16,0,165.2083,moe_ck2stages_gemm1_128x16x64x128_1x2_MulABScale_v1_Nswizzle0_Quant2_MulRoutedWeight0_swiglu_F8_F8_B16,0.0%,21.94,5490.94,0
stage1,80,64,6144,384,128,4,ActivationType.Swiglu,torch.bfloat16,torch.float8_e4m3fnuz,torch.float8_e4m3fnuz,QuantType.per_Token,1,0,16,0,165.6216,moe_ck2stages_gemm1_256x16x128x256_1x4_MulABScale_v1_Nswizzle0_Quant2_MulRoutedWeight0_swiglu_F8_F8_B16,0.0%,21.88,5477.24,0
stage1,80,64,6144,384,128,4,ActivationType.Swiglu,torch.bfloat16,torch.float8_e4m3fnuz,torch.float8_e4m3fnuz,QuantType.per_Token,1,0,16,0,164.3338,moe_ck2stages_gemm1_256x16x64x256_1x4_MulABScale_v1_Nswizzle0_Quant2_MulRoutedWeight0_swiglu_F8_F8_B16,0.0%,22.05,5520.16,0
stage2,80,64,6144,384,128,4,ActivationType.Swiglu,torch.bfloat16,torch.float8_e4m3fnuz,torch.float8_e4m3fnuz,QuantType.per_Token,1,0,16,0,-1.0,moe_ck2stages_gemm2_256x16x128x256_1x4_MulABScaleExpertWeight_v1_Nswizzle0_Quant2_MulRoutedWeight1_F8_F8_B16,100.0%,0.0,0.0,0
stage2,80,64,6144,384,128,4,ActivationType.Swiglu,torch.bfloat16,torch.float8_e4m3fnuz,torch.float8_e4m3fnuz,QuantType.per_Token,1,0,16,0,112.7105,moe_ck2stages_gemm2_128x16x128x128_1x2_MulABScaleExpertWeight_v1_Nswizzle0_Quant2_MulRoutedWeight1_F8_F8_B16,2.8%,32.15,8048.49,0
stage2,80,64,6144,384,128,4,ActivationType.Swiglu,torch.bfloat16,torch.float8_e4m3fnuz,torch.float8_e4m3fnuz,QuantType.per_Token,1,0,16,0,118.9634,moe_ck2stages_gemm2_64x16x64x64_1x1_MulABScaleExpertWeight_v1_Nswizzle0_Quant2_MulRoutedWeight1_F8_F8_B16,2.8%,30.46,7625.45,0
stage1,80,64,6144,384,128,4,ActivationType.Swiglu,torch.bfloat16,torch.float8_e4m3fnuz,torch.float8_e4m3fnuz,QuantType.per_Token,1,0,32,0,171.8305,moe_ck2stages_gemm1_256x32x64x256_1x4_MulABScale_v1_Nswizzle0_Quant2_MulRoutedWeight0_swiglu_F8_F8_B16,0.0%,21.09,5279.33,0
stage1,80,64,6144,384,128,4,ActivationType.Swiglu,torch.bfloat16,torch.float8_e4m3fnuz,torch.float8_e4m3fnuz,QuantType.per_Token,1,0,32,0,166.3739,moe_ck2stages_gemm1_256x32x64x128_1x4_MulABScale_v1_Nswizzle0_Quant2_MulRoutedWeight0_swiglu_F8_F8_B16,0.0%,21.78,5452.47,0
stage2,80,64,6144,384,128,4,ActivationType.Swiglu,torch.bfloat16,torch.float8_e4m3fnuz,torch.float8_e4m3fnuz,QuantType.per_Token,1,0,32,0,-1.0,moe_ck2stages_gemm2_256x32x64x256_1x4_MulABScaleExpertWeight_v1_Nswizzle0_Quant2_MulRoutedWeight1_F8_F8_B16,100.0%,0.0,0.0,0
stage2,80,64,6144,384,128,4,ActivationType.Swiglu,torch.bfloat16,torch.float8_e4m3fnuz,torch.float8_e4m3fnuz,QuantType.per_Token,1,0,32,0,147.1366,moe_ck2stages_gemm2_256x32x64x128_1x4_MulABScaleExpertWeight_v1_Nswizzle0_Quant2_MulRoutedWeight1_F8_F8_B16,2.8%,24.63,6165.35,0
stage2,80,64,6144,384,128,4,ActivationType.Swiglu,torch.bfloat16,torch.float8_e4m3fnuz,torch.float8_e4m3fnuz,QuantType.per_Token,1,0,32,0,254.9523,moe_ck2stages_gemm2_256x32x64x64_1x4_MulABScaleExpertWeight_v1_Nswizzle0_Quant2_MulRoutedWeight1_F8_F8_B16,99.6%,14.21,3558.11,0
stage1,80,64,6144,384,128,4,ActivationType.Swiglu,torch.bfloat16,torch.float8_e4m3fnuz,torch.float8_e4m3fnuz,QuantType.per_Token,1,0,64,0,251.9731,moe_ck2stages_gemm1_256x64x64x256_1x4_MulABScale_v1_Nswizzle0_Quant2_MulRoutedWeight0_swiglu_F8_F8_B16,0.0%,14.38,3600.18,0
stage1,80,64,6144,384,128,4,ActivationType.Swiglu,torch.bfloat16,torch.float8_e4m3fnuz,torch.float8_e4m3fnuz,QuantType.per_Token,1,0,64,0,231.9926,moe_ck2stages_gemm1_256x64x64x128_1x4_MulABScale_v1_Nswizzle0_Quant2_MulRoutedWeight0_swiglu_F8_F8_B16,0.0%,15.62,3910.25,0
stage1,80,64,6144,384,128,4,ActivationType.Swiglu,torch.bfloat16,torch.float8_e4m3fnuz,torch.float8_e4m3fnuz,QuantType.per_Token,1,0,64,0,282.5639,moe_ck2stages_gemm1_256x64x128x256_1x4_MulABScale_v3_Nswizzle0_Quant2_MulRoutedWeight0_swiglu_F8_F8_B16,0.0%,12.82,3210.42,0
stage1,80,64,6144,384,128,4,ActivationType.Swiglu,torch.bfloat16,torch.float8_e4m3fnuz,torch.float8_e4m3fnuz,QuantType.per_Token,1,0,64,0,249.8247,moe_ck2stages_gemm1_256x64x128x128_1x4_MulABScale_v3_Nswizzle0_Quant2_MulRoutedWeight0_swiglu_F8_F8_B16,0.0%,14.51,3631.14,0
stage2,80,64,6144,384,128,4,ActivationType.Swiglu,torch.bfloat16,torch.float8_e4m3fnuz,torch.float8_e4m3fnuz,QuantType.per_Token,1,0,64,0,-1.0,moe_ck2stages_gemm2_256x64x64x256_1x4_MulABScaleExpertWeight_v1_Nswizzle0_Quant2_MulRoutedWeight1_F8_F8_B16,100.0%,0.0,0.0,0
stage2,80,64,6144,384,128,4,ActivationType.Swiglu,torch.bfloat16,torch.float8_e4m3fnuz,torch.float8_e4m3fnuz,QuantType.per_Token,1,0,64,0,-1.0,moe_ck2stages_gemm2_256x64x128x256_1x4_MulABScaleExpertWeight_v3_Nswizzle0_Quant2_MulRoutedWeight1_F8_F8_B16,100.0%,0.0,0.0,0
stage2,80,64,6144,384,128,4,ActivationType.Swiglu,torch.bfloat16,torch.float8_e4m3fnuz,torch.float8_e4m3fnuz,QuantType.per_Token,1,0,64,0,358.6732,moe_ck2stages_gemm2_256x64x128x128_1x4_MulABScaleExpertWeight_v3_Nswizzle0_Quant2_MulRoutedWeight1_F8_F8_B16,2.8%,10.1,2529.18,0
stage2,80,64,6144,384,128,4,ActivationType.Swiglu,torch.bfloat16,torch.float8_e4m3fnuz,torch.float8_e4m3fnuz,QuantType.per_Token,1,0,64,0,525.3244,moe_ck2stages_gemm2_256x64x128x64_1x4_MulABScaleExpertWeight_v3_Nswizzle0_Quant2_MulRoutedWeight1_F8_F8_B16,99.6%,6.9,1726.84,0
stage2,80,64,6144,384,128,4,ActivationType.Swiglu,torch.bfloat16,torch.float8_e4m3fnuz,torch.float8_e4m3fnuz,QuantType.per_Token,1,0,64,0,470.8967,moe_ck2stages_gemm2_256x64x64x64_1x4_MulABScaleExpertWeight_v1_Nswizzle0_Quant2_MulRoutedWeight1_F8_F8_B16,99.6%,7.7,1926.43,0
stage1,80,64,6144,384,128,4,ActivationType.Swiglu,torch.bfloat16,torch.float8_e4m3fnuz,torch.float8_e4m3fnuz,QuantType.per_Token,1,0,128,0,464.7554,moe_ck2stages_gemm1_256x128x64x128_1x4_MulABScale_v1_Nswizzle0_Quant2_MulRoutedWeight0_swiglu_F8_F8_B16,0.0%,7.8,1951.89,0
stage1,80,64,6144,384,128,4,ActivationType.Swiglu,torch.bfloat16,torch.float8_e4m3fnuz,torch.float8_e4m3fnuz,QuantType.per_Token,1,0,128,0,526.6123,moe_ck2stages_gemm1_256x128x128x256_1x4_MulABScale_v3_Nswizzle0_Quant2_MulRoutedWeight0_swiglu_F8_F8_B16,0.0%,6.88,1722.61,0
stage1,80,64,6144,384,128,4,ActivationType.Swiglu,torch.bfloat16,torch.float8_e4m3fnuz,torch.float8_e4m3fnuz,QuantType.per_Token,1,0,128,0,526.5919,moe_ck2stages_gemm1_256x128x128x128_1x4_MulABScale_v3_Nswizzle0_Quant2_MulRoutedWeight0_swiglu_F8_F8_B16,0.0%,6.88,1722.68,0
stage2,80,64,6144,384,128,4,ActivationType.Swiglu,torch.bfloat16,torch.float8_e4m3fnuz,torch.float8_e4m3fnuz,QuantType.per_Token,1,0,128,0,779.9673,moe_ck2stages_gemm2_256x128x64x128_1x4_MulABScaleExpertWeight_v1_Nswizzle0_Quant2_MulRoutedWeight1_F8_F8_B16,2.8%,4.65,1163.06,0
stage2,80,64,6144,384,128,4,ActivationType.Swiglu,torch.bfloat16,torch.float8_e4m3fnuz,torch.float8_e4m3fnuz,QuantType.per_Token,1,0,128,0,581.2923,moe_ck2stages_gemm2_256x128x128x128_1x4_MulABScaleExpertWeight_v3_Nswizzle0_Quant2_MulRoutedWeight1_F8_F8_B16,2.8%,6.23,1560.57,0
stage2,80,64,6144,384,128,4,ActivationType.Swiglu,torch.bfloat16,torch.float8_e4m3fnuz,torch.float8_e4m3fnuz,QuantType.per_Token,1,0,128,0,820.8642,moe_ck2stages_gemm2_256x128x128x64_1x4_MulABScaleExpertWeight_v3_Nswizzle0_Quant2_MulRoutedWeight1_F8_F8_B16,99.6%,4.41,1105.11,0
stage2,80,64,6144,384,128,4,ActivationType.Swiglu,torch.bfloat16,torch.float8_e4m3fnuz,torch.float8_e4m3fnuz,QuantType.per_Token,1,0,128,0,926.3635,moe_ck2stages_gemm2_256x128x64x64_1x4_MulABScaleExpertWeight_v3_Nswizzle0_Quant2_MulRoutedWeight1_F8_F8_B16,99.6%,3.91,979.26,0
stage1,80,128,6144,384,128,4,ActivationType.Swiglu,torch.bfloat16,torch.float8_e4m3fnuz,torch.float8_e4m3fnuz,QuantType.per_Token,1,0,16,0,200.3681,_ZN5aiter48fmoe_stage1_bf16_pertokenFp8_g1u1_16x128_4tg_pf2E,97.9%,36.17,4533.3,0
stage1,80,128,6144,384,128,4,ActivationType.Swiglu,torch.bfloat16,torch.float8_e4m3fnuz,torch.float8_e4m3fnuz,QuantType.per_Token,1,0,16,0,179.5274,_ZN5aiter48fmoe_stage1_bf16_pertokenFp8_g1u1_16x128_4tg_pf3E,97.9%,40.37,5059.56,0
stage1,80,128,6144,384,128,4,ActivationType.Swiglu,torch.bfloat16,torch.float8_e4m3fnuz,torch.float8_e4m3fnuz,QuantType.per_Token,1,0,16,0,-1.0,_ZN5aiter48fmoe_stage1_bf16_pertokenFp8_g1u1_16x256_3tg_pf2E,100.0%,0.0,0.0,0
stage1,80,128,6144,384,128,4,ActivationType.Swiglu,torch.bfloat16,torch.float8_e4m3fnuz,torch.float8_e4m3fnuz,QuantType.per_Token,1,0,16,0,-1.0,_ZN5aiter48fmoe_stage1_bf16_pertokenFp8_g1u1_16x256_2tg_pf3E,100.0%,0.0,0.0,0
stage1,80,128,6144,384,128,4,ActivationType.Swiglu,torch.bfloat16,torch.float8_e4m3fnuz,torch.float8_e4m3fnuz,QuantType.per_Token,1,0,16,0,-1.0,_ZN5aiter48fmoe_stage1_bf16_pertokenFp8_g1u1_16x512_2tg_pf2E,100.0%,0.0,0.0,0
stage1,80,128,6144,384,128,4,ActivationType.Swiglu,torch.bfloat16,torch.float8_e4m3fnuz,torch.float8_e4m3fnuz,QuantType.per_Token,1,0,16,0,-1.0,_ZN5aiter44fmoe_stage1_bf16_pertokenFp8_g1u1_16x512_pf3E,100.0%,0.0,0.0,0
stage1,80,128,6144,384,128,4,ActivationType.Swiglu,torch.bfloat16,torch.float8_e4m3fnuz,torch.float8_e4m3fnuz,QuantType.per_Token,1,0,16,0,193.0539,_ZN5aiter47fmoe_stage1_bf16_pertokenFp8_g1u1_16x64_6tg_pf2E,97.9%,37.54,4705.05,0
stage1,80,128,6144,384,128,4,ActivationType.Swiglu,torch.bfloat16,torch.float8_e4m3fnuz,torch.float8_e4m3fnuz,QuantType.per_Token,1,0,16,0,187.7571,_ZN5aiter47fmoe_stage1_bf16_pertokenFp8_g1u1_16x64_5tg_pf3E,97.9%,38.6,4837.79,0
stage1,80,128,6144,384,128,4,ActivationType.Swiglu,torch.bfloat16,torch.float8_e4m3fnuz,torch.float8_e4m3fnuz,QuantType.per_Token,1,0,32,0,195.636,_ZN5aiter48fmoe_stage1_bf16_pertokenFp8_g1u1_32x128_3tg_pf2E,97.9%,37.05,4642.95,0
stage1,80,128,6144,384,128,4,ActivationType.Swiglu,torch.bfloat16,torch.float8_e4m3fnuz,torch.float8_e4m3fnuz,QuantType.per_Token,1,0,32,0,192.7643,_ZN5aiter48fmoe_stage1_bf16_pertokenFp8_g1u1_32x128_3tg_pf3E,97.9%,37.6,4712.12,0
stage1,80,128,6144,384,128,4,ActivationType.Swiglu,torch.bfloat16,torch.float8_e4m3fnuz,torch.float8_e4m3fnuz,QuantType.per_Token,1,0,32,0,-1.0,_ZN5aiter48fmoe_stage1_bf16_pertokenFp8_g1u1_32x256_2tg_pf2E,100.0%,0.0,0.0,0
stage1,80,128,6144,384,128,4,ActivationType.Swiglu,torch.bfloat16,torch.float8_e4m3fnuz,torch.float8_e4m3fnuz,QuantType.per_Token,1,0,32,0,-1.0,_ZN5aiter48fmoe_stage1_bf16_pertokenFp8_g1u1_32x256_2tg_pf3E,100.0%,0.0,0.0,0
stage1,80,128,6144,384,128,4,ActivationType.Swiglu,torch.bfloat16,torch.float8_e4m3fnuz,torch.float8_e4m3fnuz,QuantType.per_Token,1,0,32,0,-1.0,_ZN5aiter44fmoe_stage1_bf16_pertokenFp8_g1u1_32x512_pf2E,100.0%,0.0,0.0,0
stage1,80,128,6144,384,128,4,ActivationType.Swiglu,torch.bfloat16,torch.float8_e4m3fnuz,torch.float8_e4m3fnuz,QuantType.per_Token,1,0,32,0,-1.0,_ZN5aiter44fmoe_stage1_bf16_pertokenFp8_g1u1_32x512_pf3E,100.0%,0.0,0.0,0
stage1,80,128,6144,384,128,4,ActivationType.Swiglu,torch.bfloat16,torch.float8_e4m3fnuz,torch.float8_e4m3fnuz,QuantType.per_Token,1,0,32,0,212.1095,_ZN5aiter47fmoe_stage1_bf16_pertokenFp8_g1u1_32x64_4tg_pf2E,97.9%,34.17,4282.36,0
stage1,80,128,6144,384,128,4,ActivationType.Swiglu,torch.bfloat16,torch.float8_e4m3fnuz,torch.float8_e4m3fnuz,QuantType.per_Token,1,0,32,0,188.1963,_ZN5aiter47fmoe_stage1_bf16_pertokenFp8_g1u1_32x64_4tg_pf3E,97.9%,38.51,4826.5,0
stage1,80,128,6144,384,128,4,ActivationType.Swiglu,torch.bfloat16,torch.float8_e4m3fnuz,torch.float8_e4m3fnuz,QuantType.per_Token,1,0,64,0,238.8641,_ZN5aiter48fmoe_stage1_bf16_pertokenFp8_g1u1_64x128_2tg_pf2E,97.9%,30.34,3802.7,0
stage1,80,128,6144,384,128,4,ActivationType.Swiglu,torch.bfloat16,torch.float8_e4m3fnuz,torch.float8_e4m3fnuz,QuantType.per_Token,1,0,64,0,215.5191,_ZN5aiter48fmoe_stage1_bf16_pertokenFp8_g1u1_64x128_2tg_pf3E,97.9%,33.63,4214.61,0
stage1,80,128,6144,384,128,4,ActivationType.Swiglu,torch.bfloat16,torch.float8_e4m3fnuz,torch.float8_e4m3fnuz,QuantType.per_Token,1,0,64,0,-1.0,_ZN5aiter44fmoe_stage1_bf16_pertokenFp8_g1u1_64x256_pf2E,100.0%,0.0,0.0,0
stage1,80,128,6144,384,128,4,ActivationType.Swiglu,torch.bfloat16,torch.float8_e4m3fnuz,torch.float8_e4m3fnuz,QuantType.per_Token,1,0,64,0,-1.0,_ZN5aiter44fmoe_stage1_bf16_pertokenFp8_g1u1_64x256_pf3E,100.0%,0.0,0.0,0
stage1,80,128,6144,384,128,4,ActivationType.Swiglu,torch.bfloat16,torch.float8_e4m3fnuz,torch.float8_e4m3fnuz,QuantType.per_Token,1,0,64,0,265.7103,_ZN5aiter47fmoe_stage1_bf16_pertokenFp8_g1u1_64x64_3tg_pf2E,97.9%,27.28,3418.49,0
stage1,80,128,6144,384,128,4,ActivationType.Swiglu,torch.bfloat16,torch.float8_e4m3fnuz,torch.float8_e4m3fnuz,QuantType.per_Token,1,0,64,0,238.1354,_ZN5aiter47fmoe_stage1_bf16_pertokenFp8_g1u1_64x64_2tg_pf3E,97.9%,30.44,3814.34,0
stage1,80,128,6144,384,128,4,ActivationType.Swiglu,torch.bfloat16,torch.float8_e4m3fnuz,torch.float8_e4m3fnuz,QuantType.per_Token,1,0,128,0,415.2905,_ZN5aiter45fmoe_stage1_bf16_pertokenFp8_g1u1_128x128_pf2E,97.9%,17.45,2187.21,0
stage1,80,128,6144,384,128,4,ActivationType.Swiglu,torch.bfloat16,torch.float8_e4m3fnuz,torch.float8_e4m3fnuz,QuantType.per_Token,1,0,128,0,408.7669,_ZN5aiter45fmoe_stage1_bf16_pertokenFp8_g1u1_128x128_pf3E,97.9%,17.73,2222.12,0
stage1,80,128,6144,384,128,4,ActivationType.Swiglu,torch.bfloat16,torch.float8_e4m3fnuz,torch.float8_e4m3fnuz,QuantType.per_Token,1,0,128,0,586.3766,_ZN5aiter44fmoe_stage1_bf16_pertokenFp8_g1u1_128x64_pf2E,97.9%,12.36,1549.05,0
stage1,80,128,6144,384,128,4,ActivationType.Swiglu,torch.bfloat16,torch.float8_e4m3fnuz,torch.float8_e4m3fnuz,QuantType.per_Token,1,0,128,0,490.8732,_ZN5aiter44fmoe_stage1_bf16_pertokenFp8_g1u1_128x64_pf3E,97.9%,14.77,1850.44,0
stage1,80,128,6144,384,128,4,ActivationType.Swiglu,torch.bfloat16,torch.float8_e4m3fnuz,torch.float8_e4m3fnuz,QuantType.per_Token,1,0,16,0,185.0194,moe_ck2stages_gemm1_128x16x64x128_1x2_MulABScale_v1_Nswizzle0_Quant2_MulRoutedWeight0_swiglu_F8_F8_B16,0.0%,39.17,4909.37,0
stage1,80,128,6144,384,128,4,ActivationType.Swiglu,torch.bfloat16,torch.float8_e4m3fnuz,torch.float8_e4m3fnuz,QuantType.per_Token,1,0,16,0,179.803,moe_ck2stages_gemm1_256x16x128x256_1x4_MulABScale_v1_Nswizzle0_Quant2_MulRoutedWeight0_swiglu_F8_F8_B16,0.0%,40.31,5051.8,0
stage1,80,128,6144,384,128,4,ActivationType.Swiglu,torch.bfloat16,torch.float8_e4m3fnuz,torch.float8_e4m3fnuz,QuantType.per_Token,1,0,16,0,176.4767,moe_ck2stages_gemm1_256x16x64x256_1x4_MulABScale_v1_Nswizzle0_Quant2_MulRoutedWeight0_swiglu_F8_F8_B16,0.0%,41.07,5147.02,0
stage2,80,128,6144,384,128,4,ActivationType.Swiglu,torch.bfloat16,torch.float8_e4m3fnuz,torch.float8_e4m3fnuz,QuantType.per_Token,1,0,16,0,-1.0,moe_ck2stages_gemm2_256x16x128x256_1x4_MulABScaleExpertWeight_v1_Nswizzle0_Quant2_MulRoutedWeight1_F8_F8_B16,100.0%,0.0,0.0,0
stage2,80,128,6144,384,128,4,ActivationType.Swiglu,torch.bfloat16,torch.float8_e4m3fnuz,torch.float8_e4m3fnuz,QuantType.per_Token,1,0,16,0,137.1918,moe_ck2stages_gemm2_128x16x128x128_1x2_MulABScaleExpertWeight_v1_Nswizzle0_Quant2_MulRoutedWeight1_F8_F8_B16,2.9%,52.83,6620.87,0
stage2,80,128,6144,384,128,4,ActivationType.Swiglu,torch.bfloat16,torch.float8_e4m3fnuz,torch.float8_e4m3fnuz,QuantType.per_Token,1,0,16,0,147.2525,moe_ck2stages_gemm2_64x16x64x64_1x1_MulABScaleExpertWeight_v1_Nswizzle0_Quant2_MulRoutedWeight1_F8_F8_B16,2.9%,49.22,6168.51,0
stage1,80,128,6144,384,128,4,ActivationType.Swiglu,torch.bfloat16,torch.float8_e4m3fnuz,torch.float8_e4m3fnuz,QuantType.per_Token,1,0,32,0,195.9389,moe_ck2stages_gemm1_256x32x64x256_1x4_MulABScale_v1_Nswizzle0_Quant2_MulRoutedWeight0_swiglu_F8_F8_B16,0.0%,36.99,4635.78,0
stage1,80,128,6144,384,128,4,ActivationType.Swiglu,torch.bfloat16,torch.float8_e4m3fnuz,torch.float8_e4m3fnuz,QuantType.per_Token,1,0,32,0,197.3299,moe_ck2stages_gemm1_256x32x64x128_1x4_MulABScale_v1_Nswizzle0_Quant2_MulRoutedWeight0_swiglu_F8_F8_B16,0.0%,36.73,4603.1,0
stage2,80,128,6144,384,128,4,ActivationType.Swiglu,torch.bfloat16,torch.float8_e4m3fnuz,torch.float8_e4m3fnuz,QuantType.per_Token,1,0,32,0,-1.0,moe_ck2stages_gemm2_256x32x64x256_1x4_MulABScaleExpertWeight_v1_Nswizzle0_Quant2_MulRoutedWeight1_F8_F8_B16,100.0%,0.0,0.0,0
stage2,80,128,6144,384,128,4,ActivationType.Swiglu,torch.bfloat16,torch.float8_e4m3fnuz,torch.float8_e4m3fnuz,QuantType.per_Token,1,0,32,0,168.1872,moe_ck2stages_gemm2_256x32x64x128_1x4_MulABScaleExpertWeight_v1_Nswizzle0_Quant2_MulRoutedWeight1_F8_F8_B16,2.9%,43.09,5400.7,0
stage2,80,128,6144,384,128,4,ActivationType.Swiglu,torch.bfloat16,torch.float8_e4m3fnuz,torch.float8_e4m3fnuz,QuantType.per_Token,1,0,32,0,288.3323,moe_ck2stages_gemm2_256x32x64x64_1x4_MulABScaleExpertWeight_v1_Nswizzle0_Quant2_MulRoutedWeight1_F8_F8_B16,99.6%,25.14,3150.29,0
stage1,80,128,6144,384,128,4,ActivationType.Swiglu,torch.bfloat16,torch.float8_e4m3fnuz,torch.float8_e4m3fnuz,QuantType.per_Token,1,0,64,0,278.6391,moe_ck2stages_gemm1_256x64x64x256_1x4_MulABScale_v1_Nswizzle0_Quant2_MulRoutedWeight0_swiglu_F8_F8_B16,0.0%,26.01,3259.88,0
stage1,80,128,6144,384,128,4,ActivationType.Swiglu,torch.bfloat16,torch.float8_e4m3fnuz,torch.float8_e4m3fnuz,QuantType.per_Token,1,0,64,0,258.3218,moe_ck2stages_gemm1_256x64x64x128_1x4_MulABScale_v1_Nswizzle0_Quant2_MulRoutedWeight0_swiglu_F8_F8_B16,0.0%,28.06,3516.27,0
stage1,80,128,6144,384,128,4,ActivationType.Swiglu,torch.bfloat16,torch.float8_e4m3fnuz,torch.float8_e4m3fnuz,QuantType.per_Token,1,0,64,0,284.8178,moe_ck2stages_gemm1_256x64x128x256_1x4_MulABScale_v3_Nswizzle0_Quant2_MulRoutedWeight0_swiglu_F8_F8_B16,0.0%,25.45,3189.16,0
stage1,80,128,6144,384,128,4,ActivationType.Swiglu,torch.bfloat16,torch.float8_e4m3fnuz,torch.float8_e4m3fnuz,QuantType.per_Token,1,0,64,0,255.229,moe_ck2stages_gemm1_256x64x128x128_1x4_MulABScale_v3_Nswizzle0_Quant2_MulRoutedWeight0_swiglu_F8_F8_B16,0.0%,28.4,3558.88,0
stage2,80,128,6144,384,128,4,ActivationType.Swiglu,torch.bfloat16,torch.float8_e4m3fnuz,torch.float8_e4m3fnuz,QuantType.per_Token,1,0,64,0,-1.0,moe_ck2stages_gemm2_256x64x64x256_1x4_MulABScaleExpertWeight_v1_Nswizzle0_Quant2_MulRoutedWeight1_F8_F8_B16,100.0%,0.0,0.0,0
stage2,80,128,6144,384,128,4,ActivationType.Swiglu,torch.bfloat16,torch.float8_e4m3fnuz,torch.float8_e4m3fnuz,QuantType.per_Token,1,0,64,0,-1.0,moe_ck2stages_gemm2_256x64x128x256_1x4_MulABScaleExpertWeight_v3_Nswizzle0_Quant2_MulRoutedWeight1_F8_F8_B16,100.0%,0.0,0.0,0
stage2,80,128,6144,384,128,4,ActivationType.Swiglu,torch.bfloat16,torch.float8_e4m3fnuz,torch.float8_e4m3fnuz,QuantType.per_Token,1,0,64,0,414.0937,moe_ck2stages_gemm2_256x64x128x128_1x4_MulABScaleExpertWeight_v3_Nswizzle0_Quant2_MulRoutedWeight1_F8_F8_B16,2.9%,17.5,2193.53,0
stage2,80,128,6144,384,128,4,ActivationType.Swiglu,torch.bfloat16,torch.float8_e4m3fnuz,torch.float8_e4m3fnuz,QuantType.per_Token,1,0,64,0,595.8743,moe_ck2stages_gemm2_256x64x128x64_1x4_MulABScaleExpertWeight_v3_Nswizzle0_Quant2_MulRoutedWeight1_F8_F8_B16,99.6%,12.16,1524.36,0
stage2,80,128,6144,384,128,4,ActivationType.Swiglu,torch.bfloat16,torch.float8_e4m3fnuz,torch.float8_e4m3fnuz,QuantType.per_Token,1,0,64,0,529.3146,moe_ck2stages_gemm2_256x64x64x64_1x4_MulABScaleExpertWeight_v1_Nswizzle0_Quant2_MulRoutedWeight1_F8_F8_B16,99.6%,13.69,1716.05,0
stage1,80,128,6144,384,128,4,ActivationType.Swiglu,torch.bfloat16,torch.float8_e4m3fnuz,torch.float8_e4m3fnuz,QuantType.per_Token,1,0,128,0,512.6254,moe_ck2stages_gemm1_256x128x64x128_1x4_MulABScale_v1_Nswizzle0_Quant2_MulRoutedWeight0_swiglu_F8_F8_B16,0.0%,14.14,1771.92,0
stage1,80,128,6144,384,128,4,ActivationType.Swiglu,torch.bfloat16,torch.float8_e4m3fnuz,torch.float8_e4m3fnuz,QuantType.per_Token,1,0,128,0,528.481,moe_ck2stages_gemm1_256x128x128x256_1x4_MulABScale_v3_Nswizzle0_Quant2_MulRoutedWeight0_swiglu_F8_F8_B16,0.0%,13.71,1718.75,0
stage1,80,128,6144,384,128,4,ActivationType.Swiglu,torch.bfloat16,torch.float8_e4m3fnuz,torch.float8_e4m3fnuz,QuantType.per_Token,1,0,128,0,528.2718,moe_ck2stages_gemm1_256x128x128x128_1x4_MulABScale_v3_Nswizzle0_Quant2_MulRoutedWeight0_swiglu_F8_F8_B16,0.0%,13.72,1719.43,0
stage2,80,128,6144,384,128,4,ActivationType.Swiglu,torch.bfloat16,torch.float8_e4m3fnuz,torch.float8_e4m3fnuz,QuantType.per_Token,1,0,128,0,888.5681,moe_ck2stages_gemm2_256x128x64x128_1x4_MulABScaleExpertWeight_v1_Nswizzle0_Quant2_MulRoutedWeight1_F8_F8_B16,2.9%,8.16,1022.24,0
stage2,80,128,6144,384,128,4,ActivationType.Swiglu,torch.bfloat16,torch.float8_e4m3fnuz,torch.float8_e4m3fnuz,QuantType.per_Token,1,0,128,0,659.9958,moe_ck2stages_gemm2_256x128x128x128_1x4_MulABScaleExpertWeight_v3_Nswizzle0_Quant2_MulRoutedWeight1_F8_F8_B16,2.9%,10.98,1376.26,0
stage2,80,128,6144,384,128,4,ActivationType.Swiglu,torch.bfloat16,torch.float8_e4m3fnuz,torch.float8_e4m3fnuz,QuantType.per_Token,1,0,128,0,915.1454,moe_ck2stages_gemm2_256x128x128x64_1x4_MulABScaleExpertWeight_v3_Nswizzle0_Quant2_MulRoutedWeight1_F8_F8_B16,99.6%,7.92,992.55,0
stage2,80,128,6144,384,128,4,ActivationType.Swiglu,torch.bfloat16,torch.float8_e4m3fnuz,torch.float8_e4m3fnuz,QuantType.per_Token,1,0,128,0,1034.3534,moe_ck2stages_gemm2_256x128x64x64_1x4_MulABScaleExpertWeight_v3_Nswizzle0_Quant2_MulRoutedWeight1_F8_F8_B16,99.6%,7.01,878.16,0
stage1,80,256,6144,384,128,4,ActivationType.Swiglu,torch.bfloat16,torch.float8_e4m3fnuz,torch.float8_e4m3fnuz,QuantType.per_Token,1,0,16,0,203.3991,_ZN5aiter48fmoe_stage1_bf16_pertokenFp8_g1u1_16x128_4tg_pf2E,97.9%,71.27,4477.35,0
stage1,80,256,6144,384,128,4,ActivationType.Swiglu,torch.bfloat16,torch.float8_e4m3fnuz,torch.float8_e4m3fnuz,QuantType.per_Token,1,0,16,0,184.849,_ZN5aiter48fmoe_stage1_bf16_pertokenFp8_g1u1_16x128_4tg_pf3E,97.9%,78.42,4926.66,0
stage1,80,256,6144,384,128,4,ActivationType.Swiglu,torch.bfloat16,torch.float8_e4m3fnuz,torch.float8_e4m3fnuz,QuantType.per_Token,1,0,16,0,-1.0,_ZN5aiter48fmoe_stage1_bf16_pertokenFp8_g1u1_16x256_3tg_pf2E,100.0%,0.0,0.0,0
stage1,80,256,6144,384,128,4,ActivationType.Swiglu,torch.bfloat16,torch.float8_e4m3fnuz,torch.float8_e4m3fnuz,QuantType.per_Token,1,0,16,0,-1.0,_ZN5aiter48fmoe_stage1_bf16_pertokenFp8_g1u1_16x256_2tg_pf3E,100.0%,0.0,0.0,0
stage1,80,256,6144,384,128,4,ActivationType.Swiglu,torch.bfloat16,torch.float8_e4m3fnuz,torch.float8_e4m3fnuz,QuantType.per_Token,1,0,16,0,-1.0,_ZN5aiter48fmoe_stage1_bf16_pertokenFp8_g1u1_16x512_2tg_pf2E,100.0%,0.0,0.0,0
stage1,80,256,6144,384,128,4,ActivationType.Swiglu,torch.bfloat16,torch.float8_e4m3fnuz,torch.float8_e4m3fnuz,QuantType.per_Token,1,0,16,0,-1.0,_ZN5aiter44fmoe_stage1_bf16_pertokenFp8_g1u1_16x512_pf3E,100.0%,0.0,0.0,0
stage1,80,256,6144,384,128,4,ActivationType.Swiglu,torch.bfloat16,torch.float8_e4m3fnuz,torch.float8_e4m3fnuz,QuantType.per_Token,1,0,16,0,197.4643,_ZN5aiter47fmoe_stage1_bf16_pertokenFp8_g1u1_16x64_6tg_pf2E,97.9%,73.41,4611.91,0
stage1,80,256,6144,384,128,4,ActivationType.Swiglu,torch.bfloat16,torch.float8_e4m3fnuz,torch.float8_e4m3fnuz,QuantType.per_Token,1,0,16,0,187.6159,_ZN5aiter47fmoe_stage1_bf16_pertokenFp8_g1u1_16x64_5tg_pf3E,97.9%,77.26,4854.0,0
stage1,80,256,6144,384,128,4,ActivationType.Swiglu,torch.bfloat16,torch.float8_e4m3fnuz,torch.float8_e4m3fnuz,QuantType.per_Token,1,0,32,0,204.3849,_ZN5aiter48fmoe_stage1_bf16_pertokenFp8_g1u1_32x128_3tg_pf2E,97.9%,70.92,4455.75,0
stage1,80,256,6144,384,128,4,ActivationType.Swiglu,torch.bfloat16,torch.float8_e4m3fnuz,torch.float8_e4m3fnuz,QuantType.per_Token,1,0,32,0,191.7323,_ZN5aiter48fmoe_stage1_bf16_pertokenFp8_g1u1_32x128_3tg_pf3E,97.9%,75.6,4749.79,0
stage1,80,256,6144,384,128,4,ActivationType.Swiglu,torch.bfloat16,torch.float8_e4m3fnuz,torch.float8_e4m3fnuz,QuantType.per_Token,1,0,32,0,-1.0,_ZN5aiter48fmoe_stage1_bf16_pertokenFp8_g1u1_32x256_2tg_pf2E,100.0%,0.0,0.0,0
stage1,80,256,6144,384,128,4,ActivationType.Swiglu,torch.bfloat16,torch.float8_e4m3fnuz,torch.float8_e4m3fnuz,QuantType.per_Token,1,0,32,0,-1.0,_ZN5aiter48fmoe_stage1_bf16_pertokenFp8_g1u1_32x256_2tg_pf3E,100.0%,0.0,0.0,0
stage1,80,256,6144,384,128,4,ActivationType.Swiglu,torch.bfloat16,torch.float8_e4m3fnuz,torch.float8_e4m3fnuz,QuantType.per_Token,1,0,32,0,-1.0,_ZN5aiter44fmoe_stage1_bf16_pertokenFp8_g1u1_32x512_pf2E,100.0%,0.0,0.0,0
stage1,80,256,6144,384,128,4,ActivationType.Swiglu,torch.bfloat16,torch.float8_e4m3fnuz,torch.float8_e4m3fnuz,QuantType.per_Token,1,0,32,0,-1.0,_ZN5aiter44fmoe_stage1_bf16_pertokenFp8_g1u1_32x512_pf3E,100.0%,0.0,0.0,0
stage1,80,256,6144,384,128,4,ActivationType.Swiglu,torch.bfloat16,torch.float8_e4m3fnuz,torch.float8_e4m3fnuz,QuantType.per_Token,1,0,32,0,216.7214,_ZN5aiter47fmoe_stage1_bf16_pertokenFp8_g1u1_32x64_4tg_pf2E,97.9%,66.89,4202.12,0
stage1,80,256,6144,384,128,4,ActivationType.Swiglu,torch.bfloat16,torch.float8_e4m3fnuz,torch.float8_e4m3fnuz,QuantType.per_Token,1,0,32,0,200.5419,_ZN5aiter47fmoe_stage1_bf16_pertokenFp8_g1u1_32x64_4tg_pf3E,97.9%,72.28,4541.14,0
stage1,80,256,6144,384,128,4,ActivationType.Swiglu,torch.bfloat16,torch.float8_e4m3fnuz,torch.float8_e4m3fnuz,QuantType.per_Token,1,0,64,0,241.0821,_ZN5aiter48fmoe_stage1_bf16_pertokenFp8_g1u1_64x128_2tg_pf2E,97.9%,60.13,3777.5,0
stage1,80,256,6144,384,128,4,ActivationType.Swiglu,torch.bfloat16,torch.float8_e4m3fnuz,torch.float8_e4m3fnuz,QuantType.per_Token,1,0,64,0,221.5659,_ZN5aiter48fmoe_stage1_bf16_pertokenFp8_g1u1_64x128_2tg_pf3E,97.9%,65.42,4110.24,0
stage1,80,256,6144,384,128,4,ActivationType.Swiglu,torch.bfloat16,torch.float8_e4m3fnuz,torch.float8_e4m3fnuz,QuantType.per_Token,1,0,64,0,-1.0,_ZN5aiter44fmoe_stage1_bf16_pertokenFp8_g1u1_64x256_pf2E,100.0%,0.0,0.0,0
stage1,80,256,6144,384,128,4,ActivationType.Swiglu,torch.bfloat16,torch.float8_e4m3fnuz,torch.float8_e4m3fnuz,QuantType.per_Token,1,0,64,0,-1.0,_ZN5aiter44fmoe_stage1_bf16_pertokenFp8_g1u1_64x256_pf3E,100.0%,0.0,0.0,0
stage1,80,256,6144,384,128,4,ActivationType.Swiglu,torch.bfloat16,torch.float8_e4m3fnuz,torch.float8_e4m3fnuz,QuantType.per_Token,1,0,64,0,268.0076,_ZN5aiter47fmoe_stage1_bf16_pertokenFp8_g1u1_64x64_3tg_pf2E,97.9%,54.09,3397.99,0
stage1,80,256,6144,384,128,4,ActivationType.Swiglu,torch.bfloat16,torch.float8_e4m3fnuz,torch.float8_e4m3fnuz,QuantType.per_Token,1,0,64,0,241.9702,_ZN5aiter47fmoe_stage1_bf16_pertokenFp8_g1u1_64x64_2tg_pf3E,97.9%,59.91,3763.64,0
stage1,80,256,6144,384,128,4,ActivationType.Swiglu,torch.bfloat16,torch.float8_e4m3fnuz,torch.float8_e4m3fnuz,QuantType.per_Token,1,0,128,0,416.5238,_ZN5aiter45fmoe_stage1_bf16_pertokenFp8_g1u1_128x128_pf2E,97.9%,34.8,2186.4,0
stage1,80,256,6144,384,128,4,ActivationType.Swiglu,torch.bfloat16,torch.float8_e4m3fnuz,torch.float8_e4m3fnuz,QuantType.per_Token,1,0,128,0,408.9142,_ZN5aiter45fmoe_stage1_bf16_pertokenFp8_g1u1_128x128_pf3E,97.9%,35.45,2227.09,0
stage1,80,256,6144,384,128,4,ActivationType.Swiglu,torch.bfloat16,torch.float8_e4m3fnuz,torch.float8_e4m3fnuz,QuantType.per_Token,1,0,128,0,590.6305,_ZN5aiter44fmoe_stage1_bf16_pertokenFp8_g1u1_128x64_pf2E,97.9%,24.54,1541.89,0
stage1,80,256,6144,384,128,4,ActivationType.Swiglu,torch.bfloat16,torch.float8_e4m3fnuz,torch.float8_e4m3fnuz,QuantType.per_Token,1,0,128,0,488.5144,_ZN5aiter44fmoe_stage1_bf16_pertokenFp8_g1u1_128x64_pf3E,97.9%,29.67,1864.2,0
stage1,80,256,6144,384,128,4,ActivationType.Swiglu,torch.bfloat16,torch.float8_e4m3fnuz,torch.float8_e4m3fnuz,QuantType.per_Token,1,0,16,0,193.5574,moe_ck2stages_gemm1_128x16x64x128_1x2_MulABScale_v1_Nswizzle0_Quant2_MulRoutedWeight0_swiglu_F8_F8_B16,0.0%,74.89,4705.0,0
stage1,80,256,6144,384,128,4,ActivationType.Swiglu,torch.bfloat16,torch.float8_e4m3fnuz,torch.float8_e4m3fnuz,QuantType.per_Token,1,0,16,0,186.2519,moe_ck2stages_gemm1_256x16x128x256_1x4_MulABScale_v1_Nswizzle0_Quant2_MulRoutedWeight0_swiglu_F8_F8_B16,0.0%,77.83,4889.55,0
stage1,80,256,6144,384,128,4,ActivationType.Swiglu,torch.bfloat16,torch.float8_e4m3fnuz,torch.float8_e4m3fnuz,QuantType.per_Token,1,0,16,0,189.5803,moe_ck2stages_gemm1_256x16x64x256_1x4_MulABScale_v1_Nswizzle0_Quant2_MulRoutedWeight0_swiglu_F8_F8_B16,0.0%,76.46,4803.71,0
stage2,80,256,6144,384,128,4,ActivationType.Swiglu,torch.bfloat16,torch.float8_e4m3fnuz,torch.float8_e4m3fnuz,QuantType.per_Token,1,0,16,0,-1.0,moe_ck2stages_gemm2_256x16x128x256_1x4_MulABScaleExpertWeight_v1_Nswizzle0_Quant2_MulRoutedWeight1_F8_F8_B16,100.0%,0.0,0.0,0
stage2,80,256,6144,384,128,4,ActivationType.Swiglu,torch.bfloat16,torch.float8_e4m3fnuz,torch.float8_e4m3fnuz,QuantType.per_Token,1,0,16,0,152.6392,moe_ck2stages_gemm2_128x16x128x128_1x2_MulABScaleExpertWeight_v1_Nswizzle0_Quant2_MulRoutedWeight1_F8_F8_B16,2.9%,94.97,5966.28,0
stage2,80,256,6144,384,128,4,ActivationType.Swiglu,torch.bfloat16,torch.float8_e4m3fnuz,torch.float8_e4m3fnuz,QuantType.per_Token,1,0,16,0,161.1231,moe_ck2stages_gemm2_64x16x64x64_1x1_MulABScaleExpertWeight_v1_Nswizzle0_Quant2_MulRoutedWeight1_F8_F8_B16,2.9%,89.97,5652.13,0
stage1,80,256,6144,384,128,4,ActivationType.Swiglu,torch.bfloat16,torch.float8_e4m3fnuz,torch.float8_e4m3fnuz,QuantType.per_Token,1,0,32,0,205.6128,moe_ck2stages_gemm1_256x32x64x256_1x4_MulABScale_v1_Nswizzle0_Quant2_MulRoutedWeight0_swiglu_F8_F8_B16,0.0%,70.5,4429.14,0
stage1,80,256,6144,384,128,4,ActivationType.Swiglu,torch.bfloat16,torch.float8_e4m3fnuz,torch.float8_e4m3fnuz,QuantType.per_Token,1,0,32,0,202.3327,moe_ck2stages_gemm1_256x32x64x128_1x4_MulABScale_v1_Nswizzle0_Quant2_MulRoutedWeight0_swiglu_F8_F8_B16,0.0%,71.64,4500.94,0
stage2,80,256,6144,384,128,4,ActivationType.Swiglu,torch.bfloat16,torch.float8_e4m3fnuz,torch.float8_e4m3fnuz,QuantType.per_Token,1,0,32,0,-1.0,moe_ck2stages_gemm2_256x32x64x256_1x4_MulABScaleExpertWeight_v1_Nswizzle0_Quant2_MulRoutedWeight1_F8_F8_B16,100.0%,0.0,0.0,0
stage2,80,256,6144,384,128,4,ActivationType.Swiglu,torch.bfloat16,torch.float8_e4m3fnuz,torch.float8_e4m3fnuz,QuantType.per_Token,1,0,32,0,174.8416,moe_ck2stages_gemm2_256x32x64x128_1x4_MulABScaleExpertWeight_v1_Nswizzle0_Quant2_MulRoutedWeight1_F8_F8_B16,2.9%,82.91,5208.65,0
stage2,80,256,6144,384,128,4,ActivationType.Swiglu,torch.bfloat16,torch.float8_e4m3fnuz,torch.float8_e4m3fnuz,QuantType.per_Token,1,0,32,0,296.178,moe_ck2stages_gemm2_256x32x64x64_1x4_MulABScaleExpertWeight_v1_Nswizzle0_Quant2_MulRoutedWeight1_F8_F8_B16,99.6%,48.94,3074.8,0
stage1,80,256,6144,384,128,4,ActivationType.Swiglu,torch.bfloat16,torch.float8_e4m3fnuz,torch.float8_e4m3fnuz,QuantType.per_Token,1,0,64,0,281.7691,moe_ck2stages_gemm1_256x64x64x256_1x4_MulABScale_v1_Nswizzle0_Quant2_MulRoutedWeight0_swiglu_F8_F8_B16,0.0%,51.44,3232.04,0
stage1,80,256,6144,384,128,4,ActivationType.Swiglu,torch.bfloat16,torch.float8_e4m3fnuz,torch.float8_e4m3fnuz,QuantType.per_Token,1,0,64,0,257.4143,moe_ck2stages_gemm1_256x64x64x128_1x4_MulABScale_v1_Nswizzle0_Quant2_MulRoutedWeight0_swiglu_F8_F8_B16,0.0%,56.31,3537.83,0
stage1,80,256,6144,384,128,4,ActivationType.Swiglu,torch.bfloat16,torch.float8_e4m3fnuz,torch.float8_e4m3fnuz,QuantType.per_Token,1,0,64,0,284.619,moe_ck2stages_gemm1_256x64x128x256_1x4_MulABScale_v3_Nswizzle0_Quant2_MulRoutedWeight0_swiglu_F8_F8_B16,0.0%,50.93,3199.67,0
stage1,80,256,6144,384,128,4,ActivationType.Swiglu,torch.bfloat16,torch.float8_e4m3fnuz,torch.float8_e4m3fnuz,QuantType.per_Token,1,0,64,0,258.9347,moe_ck2stages_gemm1_256x64x128x128_1x4_MulABScale_v3_Nswizzle0_Quant2_MulRoutedWeight0_swiglu_F8_F8_B16,0.0%,55.98,3517.06,0
stage2,80,256,6144,384,128,4,ActivationType.Swiglu,torch.bfloat16,torch.float8_e4m3fnuz,torch.float8_e4m3fnuz,QuantType.per_Token,1,0,64,0,-1.0,moe_ck2stages_gemm2_256x64x64x256_1x4_MulABScaleExpertWeight_v1_Nswizzle0_Quant2_MulRoutedWeight1_F8_F8_B16,100.0%,0.0,0.0,0
stage2,80,256,6144,384,128,4,ActivationType.Swiglu,torch.bfloat16,torch.float8_e4m3fnuz,torch.float8_e4m3fnuz,QuantType.per_Token,1,0,64,0,-1.0,moe_ck2stages_gemm2_256x64x128x256_1x4_MulABScaleExpertWeight_v3_Nswizzle0_Quant2_MulRoutedWeight1_F8_F8_B16,100.0%,0.0,0.0,0
stage2,80,256,6144,384,128,4,ActivationType.Swiglu,torch.bfloat16,torch.float8_e4m3fnuz,torch.float8_e4m3fnuz,QuantType.per_Token,1,0,64,0,429.9229,moe_ck2stages_gemm2_256x64x128x128_1x4_MulABScaleExpertWeight_v3_Nswizzle0_Quant2_MulRoutedWeight1_F8_F8_B16,2.9%,33.72,2118.26,0
stage2,80,256,6144,384,128,4,ActivationType.Swiglu,torch.bfloat16,torch.float8_e4m3fnuz,torch.float8_e4m3fnuz,QuantType.per_Token,1,0,64,0,612.5039,moe_ck2stages_gemm2_256x64x128x64_1x4_MulABScaleExpertWeight_v3_Nswizzle0_Quant2_MulRoutedWeight1_F8_F8_B16,99.6%,23.67,1486.83,0
stage2,80,256,6144,384,128,4,ActivationType.Swiglu,torch.bfloat16,torch.float8_e4m3fnuz,torch.float8_e4m3fnuz,QuantType.per_Token,1,0,64,0,540.4009,moe_ck2stages_gemm2_256x64x64x64_1x4_MulABScaleExpertWeight_v1_Nswizzle0_Quant2_MulRoutedWeight1_F8_F8_B16,99.6%,26.82,1685.21,0
stage1,80,256,6144,384,128,4,ActivationType.Swiglu,torch.bfloat16,torch.float8_e4m3fnuz,torch.float8_e4m3fnuz,QuantType.per_Token,1,0,128,0,514.5562,moe_ck2stages_gemm1_256x128x64x128_1x4_MulABScale_v1_Nswizzle0_Quant2_MulRoutedWeight0_swiglu_F8_F8_B16,0.0%,28.17,1769.85,0
stage1,80,256,6144,384,128,4,ActivationType.Swiglu,torch.bfloat16,torch.float8_e4m3fnuz,torch.float8_e4m3fnuz,QuantType.per_Token,1,0,128,0,531.537,moe_ck2stages_gemm1_256x128x128x256_1x4_MulABScale_v3_Nswizzle0_Quant2_MulRoutedWeight0_swiglu_F8_F8_B16,0.0%,27.27,1713.31,0
stage1,80,256,6144,384,128,4,ActivationType.Swiglu,torch.bfloat16,torch.float8_e4m3fnuz,torch.float8_e4m3fnuz,QuantType.per_Token,1,0,128,0,527.3316,moe_ck2stages_gemm1_256x128x128x128_1x4_MulABScale_v3_Nswizzle0_Quant2_MulRoutedWeight0_swiglu_F8_F8_B16,0.0%,27.49,1726.97,0
stage2,80,256,6144,384,128,4,ActivationType.Swiglu,torch.bfloat16,torch.float8_e4m3fnuz,torch.float8_e4m3fnuz,QuantType.per_Token,1,0,128,0,908.9388,moe_ck2stages_gemm2_256x128x64x128_1x4_MulABScaleExpertWeight_v1_Nswizzle0_Quant2_MulRoutedWeight1_F8_F8_B16,2.9%,15.95,1001.92,0
stage2,80,256,6144,384,128,4,ActivationType.Swiglu,torch.bfloat16,torch.float8_e4m3fnuz,torch.float8_e4m3fnuz,QuantType.per_Token,1,0,128,0,684.0912,moe_ck2stages_gemm2_256x128x128x128_1x4_MulABScaleExpertWeight_v3_Nswizzle0_Quant2_MulRoutedWeight1_F8_F8_B16,2.9%,21.19,1331.24,0
stage2,80,256,6144,384,128,4,ActivationType.Swiglu,torch.bfloat16,torch.float8_e4m3fnuz,torch.float8_e4m3fnuz,QuantType.per_Token,1,0,128,0,933.412,moe_ck2stages_gemm2_256x128x128x64_1x4_MulABScaleExpertWeight_v3_Nswizzle0_Quant2_MulRoutedWeight1_F8_F8_B16,99.6%,15.53,975.66,0
stage2,80,256,6144,384,128,4,ActivationType.Swiglu,torch.bfloat16,torch.float8_e4m3fnuz,torch.float8_e4m3fnuz,QuantType.per_Token,1,0,128,0,1053.4521,moe_ck2stages_gemm2_256x128x64x64_1x4_MulABScaleExpertWeight_v3_Nswizzle0_Quant2_MulRoutedWeight1_F8_F8_B16,99.6%,13.76,864.48,0
stage1,80,512,6144,384,128,4,ActivationType.Swiglu,torch.bfloat16,torch.float8_e4m3fnuz,torch.float8_e4m3fnuz,QuantType.per_Token,1,0,16,0,236.5128,_ZN5aiter48fmoe_stage1_bf16_pertokenFp8_g1u1_16x128_4tg_pf2E,97.9%,122.58,3870.43,0
stage1,80,512,6144,384,128,4,ActivationType.Swiglu,torch.bfloat16,torch.float8_e4m3fnuz,torch.float8_e4m3fnuz,QuantType.per_Token,1,0,16,0,236.8069,_ZN5aiter48fmoe_stage1_bf16_pertokenFp8_g1u1_16x128_4tg_pf3E,97.9%,122.42,3865.63,0
stage1,80,512,6144,384,128,4,ActivationType.Swiglu,torch.bfloat16,torch.float8_e4m3fnuz,torch.float8_e4m3fnuz,QuantType.per_Token,1,0,16,0,-1.0,_ZN5aiter48fmoe_stage1_bf16_pertokenFp8_g1u1_16x256_3tg_pf2E,100.0%,0.0,0.0,0
stage1,80,512,6144,384,128,4,ActivationType.Swiglu,torch.bfloat16,torch.float8_e4m3fnuz,torch.float8_e4m3fnuz,QuantType.per_Token,1,0,16,0,-1.0,_ZN5aiter48fmoe_stage1_bf16_pertokenFp8_g1u1_16x256_2tg_pf3E,100.0%,0.0,0.0,0
stage1,80,512,6144,384,128,4,ActivationType.Swiglu,torch.bfloat16,torch.float8_e4m3fnuz,torch.float8_e4m3fnuz,QuantType.per_Token,1,0,16,0,-1.0,_ZN5aiter48fmoe_stage1_bf16_pertokenFp8_g1u1_16x512_2tg_pf2E,100.0%,0.0,0.0,0
stage1,80,512,6144,384,128,4,ActivationType.Swiglu,torch.bfloat16,torch.float8_e4m3fnuz,torch.float8_e4m3fnuz,QuantType.per_Token,1,0,16,0,-1.0,_ZN5aiter44fmoe_stage1_bf16_pertokenFp8_g1u1_16x512_pf3E,100.0%,0.0,0.0,0
stage1,80,512,6144,384,128,4,ActivationType.Swiglu,torch.bfloat16,torch.float8_e4m3fnuz,torch.float8_e4m3fnuz,QuantType.per_Token,1,0,16,0,254.2397,_ZN5aiter47fmoe_stage1_bf16_pertokenFp8_g1u1_16x64_6tg_pf2E,97.9%,114.03,3600.57,0
stage1,80,512,6144,384,128,4,ActivationType.Swiglu,torch.bfloat16,torch.float8_e4m3fnuz,torch.float8_e4m3fnuz,QuantType.per_Token,1,0,16,0,244.6706,_ZN5aiter47fmoe_stage1_bf16_pertokenFp8_g1u1_16x64_5tg_pf3E,97.9%,118.49,3741.38,0
stage1,80,512,6144,384,128,4,ActivationType.Swiglu,torch.bfloat16,torch.float8_e4m3fnuz,torch.float8_e4m3fnuz,QuantType.per_Token,1,0,32,0,215.9787,_ZN5aiter48fmoe_stage1_bf16_pertokenFp8_g1u1_32x128_3tg_pf2E,97.9%,134.23,4238.41,0
stage1,80,512,6144,384,128,4,ActivationType.Swiglu,torch.bfloat16,torch.float8_e4m3fnuz,torch.float8_e4m3fnuz,QuantType.per_Token,1,0,32,0,200.2912,_ZN5aiter48fmoe_stage1_bf16_pertokenFp8_g1u1_32x128_3tg_pf3E,97.9%,144.74,4570.38,0
stage1,80,512,6144,384,128,4,ActivationType.Swiglu,torch.bfloat16,torch.float8_e4m3fnuz,torch.float8_e4m3fnuz,QuantType.per_Token,1,0,32,0,-1.0,_ZN5aiter48fmoe_stage1_bf16_pertokenFp8_g1u1_32x256_2tg_pf2E,100.0%,0.0,0.0,0
stage1,80,512,6144,384,128,4,ActivationType.Swiglu,torch.bfloat16,torch.float8_e4m3fnuz,torch.float8_e4m3fnuz,QuantType.per_Token,1,0,32,0,-1.0,_ZN5aiter48fmoe_stage1_bf16_pertokenFp8_g1u1_32x256_2tg_pf3E,100.0%,0.0,0.0,0
stage1,80,512,6144,384,128,4,ActivationType.Swiglu,torch.bfloat16,torch.float8_e4m3fnuz,torch.float8_e4m3fnuz,QuantType.per_Token,1,0,32,0,-1.0,_ZN5aiter44fmoe_stage1_bf16_pertokenFp8_g1u1_32x512_pf2E,100.0%,0.0,0.0,0
stage1,80,512,6144,384,128,4,ActivationType.Swiglu,torch.bfloat16,torch.float8_e4m3fnuz,torch.float8_e4m3fnuz,QuantType.per_Token,1,0,32,0,-1.0,_ZN5aiter44fmoe_stage1_bf16_pertokenFp8_g1u1_32x512_pf3E,100.0%,0.0,0.0,0
stage1,80,512,6144,384,128,4,ActivationType.Swiglu,torch.bfloat16,torch.float8_e4m3fnuz,torch.float8_e4m3fnuz,QuantType.per_Token,1,0,32,0,229.681,_ZN5aiter47fmoe_stage1_bf16_pertokenFp8_g1u1_32x64_4tg_pf2E,97.9%,126.22,3985.56,0
stage1,80,512,6144,384,128,4,ActivationType.Swiglu,torch.bfloat16,torch.float8_e4m3fnuz,torch.float8_e4m3fnuz,QuantType.per_Token,1,0,32,0,211.3605,_ZN5aiter47fmoe_stage1_bf16_pertokenFp8_g1u1_32x64_4tg_pf3E,97.9%,137.16,4331.02,0
stage1,80,512,6144,384,128,4,ActivationType.Swiglu,torch.bfloat16,torch.float8_e4m3fnuz,torch.float8_e4m3fnuz,QuantType.per_Token,1,0,64,0,243.631,_ZN5aiter48fmoe_stage1_bf16_pertokenFp8_g1u1_64x128_2tg_pf2E,97.9%,119.0,3757.35,0
stage1,80,512,6144,384,128,4,ActivationType.Swiglu,torch.bfloat16,torch.float8_e4m3fnuz,torch.float8_e4m3fnuz,QuantType.per_Token,1,0,64,0,230.0856,_ZN5aiter48fmoe_stage1_bf16_pertokenFp8_g1u1_64x128_2tg_pf3E,97.9%,126.0,3978.55,0
stage1,80,512,6144,384,128,4,ActivationType.Swiglu,torch.bfloat16,torch.float8_e4m3fnuz,torch.float8_e4m3fnuz,QuantType.per_Token,1,0,64,0,-1.0,_ZN5aiter44fmoe_stage1_bf16_pertokenFp8_g1u1_64x256_pf2E,100.0%,0.0,0.0,0
stage1,80,512,6144,384,128,4,ActivationType.Swiglu,torch.bfloat16,torch.float8_e4m3fnuz,torch.float8_e4m3fnuz,QuantType.per_Token,1,0,64,0,-1.0,_ZN5aiter44fmoe_stage1_bf16_pertokenFp8_g1u1_64x256_pf3E,100.0%,0.0,0.0,0
stage1,80,512,6144,384,128,4,ActivationType.Swiglu,torch.bfloat16,torch.float8_e4m3fnuz,torch.float8_e4m3fnuz,QuantType.per_Token,1,0,64,0,271.7145,_ZN5aiter47fmoe_stage1_bf16_pertokenFp8_g1u1_64x64_3tg_pf2E,97.9%,106.7,3369.0,0
stage1,80,512,6144,384,128,4,ActivationType.Swiglu,torch.bfloat16,torch.float8_e4m3fnuz,torch.float8_e4m3fnuz,QuantType.per_Token,1,0,64,0,248.8506,_ZN5aiter47fmoe_stage1_bf16_pertokenFp8_g1u1_64x64_2tg_pf3E,97.9%,116.5,3678.54,0
stage1,80,512,6144,384,128,4,ActivationType.Swiglu,torch.bfloat16,torch.float8_e4m3fnuz,torch.float8_e4m3fnuz,QuantType.per_Token,1,0,128,0,416.9234,_ZN5aiter45fmoe_stage1_bf16_pertokenFp8_g1u1_128x128_pf2E,97.9%,69.54,2195.62,0
stage1,80,512,6144,384,128,4,ActivationType.Swiglu,torch.bfloat16,torch.float8_e4m3fnuz,torch.float8_e4m3fnuz,QuantType.per_Token,1,0,128,0,410.8304,_ZN5aiter45fmoe_stage1_bf16_pertokenFp8_g1u1_128x128_pf3E,97.9%,70.57,2228.19,0
stage1,80,512,6144,384,128,4,ActivationType.Swiglu,torch.bfloat16,torch.float8_e4m3fnuz,torch.float8_e4m3fnuz,QuantType.per_Token,1,0,128,0,591.7726,_ZN5aiter44fmoe_stage1_bf16_pertokenFp8_g1u1_128x64_pf2E,97.9%,48.99,1546.89,0
stage1,80,512,6144,384,128,4,ActivationType.Swiglu,torch.bfloat16,torch.float8_e4m3fnuz,torch.float8_e4m3fnuz,QuantType.per_Token,1,0,128,0,492.7322,_ZN5aiter44fmoe_stage1_bf16_pertokenFp8_g1u1_128x64_pf3E,97.9%,58.84,1857.82,0
stage1,80,512,6144,384,128,4,ActivationType.Swiglu,torch.bfloat16,torch.float8_e4m3fnuz,torch.float8_e4m3fnuz,QuantType.per_Token,1,0,16,0,258.58,moe_ck2stages_gemm1_128x16x64x128_1x2_MulABScale_v1_Nswizzle0_Quant2_MulRoutedWeight0_swiglu_F8_F8_B16,0.0%,112.12,3540.13,0
stage1,80,512,6144,384,128,4,ActivationType.Swiglu,torch.bfloat16,torch.float8_e4m3fnuz,torch.float8_e4m3fnuz,QuantType.per_Token,1,0,16,0,230.8212,moe_ck2stages_gemm1_256x16x128x256_1x4_MulABScale_v1_Nswizzle0_Quant2_MulRoutedWeight0_swiglu_F8_F8_B16,0.0%,125.6,3965.87,0
stage1,80,512,6144,384,128,4,ActivationType.Swiglu,torch.bfloat16,torch.float8_e4m3fnuz,torch.float8_e4m3fnuz,QuantType.per_Token,1,0,16,0,237.2196,moe_ck2stages_gemm1_256x16x64x256_1x4_MulABScale_v1_Nswizzle0_Quant2_MulRoutedWeight0_swiglu_F8_F8_B16,0.0%,122.21,3858.9,0
stage2,80,512,6144,384,128,4,ActivationType.Swiglu,torch.bfloat16,torch.float8_e4m3fnuz,torch.float8_e4m3fnuz,QuantType.per_Token,1,0,16,0,-1.0,moe_ck2stages_gemm2_256x16x128x256_1x4_MulABScaleExpertWeight_v1_Nswizzle0_Quant2_MulRoutedWeight1_F8_F8_B16,100.0%,0.0,0.0,0
stage2,80,512,6144,384,128,4,ActivationType.Swiglu,torch.bfloat16,torch.float8_e4m3fnuz,torch.float8_e4m3fnuz,QuantType.per_Token,1,0,16,0,204.5469,moe_ck2stages_gemm2_128x16x128x128_1x2_MulABScaleExpertWeight_v1_Nswizzle0_Quant2_MulRoutedWeight1_F8_F8_B16,2.9%,141.73,4475.29,0
stage2,80,512,6144,384,128,4,ActivationType.Swiglu,torch.bfloat16,torch.float8_e4m3fnuz,torch.float8_e4m3fnuz,QuantType.per_Token,1,0,16,0,232.2297,moe_ck2stages_gemm2_64x16x64x64_1x1_MulABScaleExpertWeight_v1_Nswizzle0_Quant2_MulRoutedWeight1_F8_F8_B16,2.9%,124.84,3941.82,0
stage1,80,512,6144,384,128,4,ActivationType.Swiglu,torch.bfloat16,torch.float8_e4m3fnuz,torch.float8_e4m3fnuz,QuantType.per_Token,1,0,32,0,207.4024,moe_ck2stages_gemm1_256x32x64x256_1x4_MulABScale_v1_Nswizzle0_Quant2_MulRoutedWeight0_swiglu_F8_F8_B16,0.0%,139.78,4413.68,0
stage1,80,512,6144,384,128,4,ActivationType.Swiglu,torch.bfloat16,torch.float8_e4m3fnuz,torch.float8_e4m3fnuz,QuantType.per_Token,1,0,32,0,215.3402,moe_ck2stages_gemm1_256x32x64x128_1x4_MulABScale_v1_Nswizzle0_Quant2_MulRoutedWeight0_swiglu_F8_F8_B16,0.0%,134.63,4250.98,0
stage2,80,512,6144,384,128,4,ActivationType.Swiglu,torch.bfloat16,torch.float8_e4m3fnuz,torch.float8_e4m3fnuz,QuantType.per_Token,1,0,32,0,-1.0,moe_ck2stages_gemm2_256x32x64x256_1x4_MulABScaleExpertWeight_v1_Nswizzle0_Quant2_MulRoutedWeight1_F8_F8_B16,100.0%,0.0,0.0,0
stage2,80,512,6144,384,128,4,ActivationType.Swiglu,torch.bfloat16,torch.float8_e4m3fnuz,torch.float8_e4m3fnuz,QuantType.per_Token,1,0,32,0,186.7553,moe_ck2stages_gemm2_256x32x64x128_1x4_MulABScaleExpertWeight_v1_Nswizzle0_Quant2_MulRoutedWeight1_F8_F8_B16,2.9%,155.24,4901.64,0
stage2,80,512,6144,384,128,4,ActivationType.Swiglu,torch.bfloat16,torch.float8_e4m3fnuz,torch.float8_e4m3fnuz,QuantType.per_Token,1,0,32,0,305.6293,moe_ck2stages_gemm2_256x32x64x64_1x4_MulABScaleExpertWeight_v1_Nswizzle0_Quant2_MulRoutedWeight1_F8_F8_B16,99.6%,94.86,2995.15,0
stage1,80,512,6144,384,128,4,ActivationType.Swiglu,torch.bfloat16,torch.float8_e4m3fnuz,torch.float8_e4m3fnuz,QuantType.per_Token,1,0,64,0,284.6355,moe_ck2stages_gemm1_256x64x64x256_1x4_MulABScale_v1_Nswizzle0_Quant2_MulRoutedWeight0_swiglu_F8_F8_B16,0.0%,101.85,3216.07,0
stage1,80,512,6144,384,128,4,ActivationType.Swiglu,torch.bfloat16,torch.float8_e4m3fnuz,torch.float8_e4m3fnuz,QuantType.per_Token,1,0,64,0,260.3675,moe_ck2stages_gemm1_256x64x64x128_1x4_MulABScale_v1_Nswizzle0_Quant2_MulRoutedWeight0_swiglu_F8_F8_B16,0.0%,111.35,3515.83,0
stage1,80,512,6144,384,128,4,ActivationType.Swiglu,torch.bfloat16,torch.float8_e4m3fnuz,torch.float8_e4m3fnuz,QuantType.per_Token,1,0,64,0,285.8506,moe_ck2stages_gemm1_256x64x128x256_1x4_MulABScale_v3_Nswizzle0_Quant2_MulRoutedWeight0_swiglu_F8_F8_B16,0.0%,101.42,3202.4,0
stage1,80,512,6144,384,128,4,ActivationType.Swiglu,torch.bfloat16,torch.float8_e4m3fnuz,torch.float8_e4m3fnuz,QuantType.per_Token,1,0,64,0,257.7808,moe_ck2stages_gemm1_256x64x128x128_1x4_MulABScale_v3_Nswizzle0_Quant2_MulRoutedWeight0_swiglu_F8_F8_B16,0.0%,112.46,3551.11,0
stage2,80,512,6144,384,128,4,ActivationType.Swiglu,torch.bfloat16,torch.float8_e4m3fnuz,torch.float8_e4m3fnuz,QuantType.per_Token,1,0,64,0,-1.0,moe_ck2stages_gemm2_256x64x64x256_1x4_MulABScaleExpertWeight_v1_Nswizzle0_Quant2_MulRoutedWeight1_F8_F8_B16,100.0%,0.0,0.0,0
stage2,80,512,6144,384,128,4,ActivationType.Swiglu,torch.bfloat16,torch.float8_e4m3fnuz,torch.float8_e4m3fnuz,QuantType.per_Token,1,0,64,0,-1.0,moe_ck2stages_gemm2_256x64x128x256_1x4_MulABScaleExpertWeight_v3_Nswizzle0_Quant2_MulRoutedWeight1_F8_F8_B16,100.0%,0.0,0.0,0
stage2,80,512,6144,384,128,4,ActivationType.Swiglu,torch.bfloat16,torch.float8_e4m3fnuz,torch.float8_e4m3fnuz,QuantType.per_Token,1,0,64,0,439.0813,moe_ck2stages_gemm2_256x64x128x128_1x4_MulABScaleExpertWeight_v3_Nswizzle0_Quant2_MulRoutedWeight1_F8_F8_B16,2.9%,66.03,2084.82,0
stage2,80,512,6144,384,128,4,ActivationType.Swiglu,torch.bfloat16,torch.float8_e4m3fnuz,torch.float8_e4m3fnuz,QuantType.per_Token,1,0,64,0,621.9685,moe_ck2stages_gemm2_256x64x128x64_1x4_MulABScaleExpertWeight_v3_Nswizzle0_Quant2_MulRoutedWeight1_F8_F8_B16,99.6%,46.61,1471.79,0
stage2,80,512,6144,384,128,4,ActivationType.Swiglu,torch.bfloat16,torch.float8_e4m3fnuz,torch.float8_e4m3fnuz,QuantType.per_Token,1,0,64,0,548.3667,moe_ck2stages_gemm2_256x64x64x64_1x4_MulABScaleExpertWeight_v1_Nswizzle0_Quant2_MulRoutedWeight1_F8_F8_B16,99.6%,52.87,1669.33,0
stage1,80,512,6144,384,128,4,ActivationType.Swiglu,torch.bfloat16,torch.float8_e4m3fnuz,torch.float8_e4m3fnuz,QuantType.per_Token,1,0,128,0,514.7534,moe_ck2stages_gemm1_256x128x64x128_1x4_MulABScale_v1_Nswizzle0_Quant2_MulRoutedWeight0_swiglu_F8_F8_B16,0.0%,56.32,1778.34,0
stage1,80,512,6144,384,128,4,ActivationType.Swiglu,torch.bfloat16,torch.float8_e4m3fnuz,torch.float8_e4m3fnuz,QuantType.per_Token,1,0,128,0,530.9498,moe_ck2stages_gemm1_256x128x128x256_1x4_MulABScale_v3_Nswizzle0_Quant2_MulRoutedWeight0_swiglu_F8_F8_B16,0.0%,54.6,1724.09,0
stage1,80,512,6144,384,128,4,ActivationType.Swiglu,torch.bfloat16,torch.float8_e4m3fnuz,torch.float8_e4m3fnuz,QuantType.per_Token,1,0,128,0,529.8253,moe_ck2stages_gemm1_256x128x128x128_1x4_MulABScale_v3_Nswizzle0_Quant2_MulRoutedWeight0_swiglu_F8_F8_B16,0.0%,54.72,1727.75,0
stage2,80,512,6144,384,128,4,ActivationType.Swiglu,torch.bfloat16,torch.float8_e4m3fnuz,torch.float8_e4m3fnuz,QuantType.per_Token,1,0,128,0,920.0186,moe_ck2stages_gemm2_256x128x64x128_1x4_MulABScaleExpertWeight_v1_Nswizzle0_Quant2_MulRoutedWeight1_F8_F8_B16,2.9%,31.51,994.99,0
stage2,80,512,6144,384,128,4,ActivationType.Swiglu,torch.bfloat16,torch.float8_e4m3fnuz,torch.float8_e4m3fnuz,QuantType.per_Token,1,0,128,0,693.024,moe_ck2stages_gemm2_256x128x128x128_1x4_MulABScaleExpertWeight_v3_Nswizzle0_Quant2_MulRoutedWeight1_F8_F8_B16,2.9%,41.83,1320.89,0
stage2,80,512,6144,384,128,4,ActivationType.Swiglu,torch.bfloat16,torch.float8_e4m3fnuz,torch.float8_e4m3fnuz,QuantType.per_Token,1,0,128,0,941.6918,moe_ck2stages_gemm2_256x128x128x64_1x4_MulABScaleExpertWeight_v3_Nswizzle0_Quant2_MulRoutedWeight1_F8_F8_B16,99.6%,30.79,972.09,0
stage2,80,512,6144,384,128,4,ActivationType.Swiglu,torch.bfloat16,torch.float8_e4m3fnuz,torch.float8_e4m3fnuz,QuantType.per_Token,1,0,128,0,1060.3076,moe_ck2stages_gemm2_256x128x64x64_1x4_MulABScaleExpertWeight_v3_Nswizzle0_Quant2_MulRoutedWeight1_F8_F8_B16,99.6%,27.34,863.34,0
stage1,80,1024,6144,384,128,4,ActivationType.Swiglu,torch.bfloat16,torch.float8_e4m3fnuz,torch.float8_e4m3fnuz,QuantType.per_Token,1,0,16,0,376.7764,_ZN5aiter48fmoe_stage1_bf16_pertokenFp8_g1u1_16x128_4tg_pf2E,97.9%,153.89,2454.62,0
stage1,80,1024,6144,384,128,4,ActivationType.Swiglu,torch.bfloat16,torch.float8_e4m3fnuz,torch.float8_e4m3fnuz,QuantType.per_Token,1,0,16,0,366.0621,_ZN5aiter48fmoe_stage1_bf16_pertokenFp8_g1u1_16x128_4tg_pf3E,97.9%,158.39,2526.47,0
stage1,80,1024,6144,384,128,4,ActivationType.Swiglu,torch.bfloat16,torch.float8_e4m3fnuz,torch.float8_e4m3fnuz,QuantType.per_Token,1,0,16,0,-1.0,_ZN5aiter48fmoe_stage1_bf16_pertokenFp8_g1u1_16x256_3tg_pf2E,100.0%,0.0,0.0,0
stage1,80,1024,6144,384,128,4,ActivationType.Swiglu,torch.bfloat16,torch.float8_e4m3fnuz,torch.float8_e4m3fnuz,QuantType.per_Token,1,0,16,0,-1.0,_ZN5aiter48fmoe_stage1_bf16_pertokenFp8_g1u1_16x256_2tg_pf3E,100.0%,0.0,0.0,0
stage1,80,1024,6144,384,128,4,ActivationType.Swiglu,torch.bfloat16,torch.float8_e4m3fnuz,torch.float8_e4m3fnuz,QuantType.per_Token,1,0,16,0,-1.0,_ZN5aiter48fmoe_stage1_bf16_pertokenFp8_g1u1_16x512_2tg_pf2E,100.0%,0.0,0.0,0
stage1,80,1024,6144,384,128,4,ActivationType.Swiglu,torch.bfloat16,torch.float8_e4m3fnuz,torch.float8_e4m3fnuz,QuantType.per_Token,1,0,16,0,-1.0,_ZN5aiter44fmoe_stage1_bf16_pertokenFp8_g1u1_16x512_pf3E,100.0%,0.0,0.0,0
stage1,80,1024,6144,384,128,4,ActivationType.Swiglu,torch.bfloat16,torch.float8_e4m3fnuz,torch.float8_e4m3fnuz,QuantType.per_Token,1,0,16,0,359.7254,_ZN5aiter47fmoe_stage1_bf16_pertokenFp8_g1u1_16x64_6tg_pf2E,97.9%,161.18,2570.97,0
stage1,80,1024,6144,384,128,4,ActivationType.Swiglu,torch.bfloat16,torch.float8_e4m3fnuz,torch.float8_e4m3fnuz,QuantType.per_Token,1,0,16,0,364.4426,_ZN5aiter47fmoe_stage1_bf16_pertokenFp8_g1u1_16x64_5tg_pf3E,97.9%,159.1,2537.69,0
stage1,80,1024,6144,384,128,4,ActivationType.Swiglu,torch.bfloat16,torch.float8_e4m3fnuz,torch.float8_e4m3fnuz,QuantType.per_Token,1,0,32,0,286.8135,_ZN5aiter48fmoe_stage1_bf16_pertokenFp8_g1u1_32x128_3tg_pf2E,97.9%,202.16,3224.55,0
stage1,80,1024,6144,384,128,4,ActivationType.Swiglu,torch.bfloat16,torch.float8_e4m3fnuz,torch.float8_e4m3fnuz,QuantType.per_Token,1,0,32,0,269.2925,_ZN5aiter48fmoe_stage1_bf16_pertokenFp8_g1u1_32x128_3tg_pf3E,97.9%,215.31,3434.35,0
stage1,80,1024,6144,384,128,4,ActivationType.Swiglu,torch.bfloat16,torch.float8_e4m3fnuz,torch.float8_e4m3fnuz,QuantType.per_Token,1,0,32,0,-1.0,_ZN5aiter48fmoe_stage1_bf16_pertokenFp8_g1u1_32x256_2tg_pf2E,100.0%,0.0,0.0,0
stage1,80,1024,6144,384,128,4,ActivationType.Swiglu,torch.bfloat16,torch.float8_e4m3fnuz,torch.float8_e4m3fnuz,QuantType.per_Token,1,0,32,0,-1.0,_ZN5aiter48fmoe_stage1_bf16_pertokenFp8_g1u1_32x256_2tg_pf3E,100.0%,0.0,0.0,0
stage1,80,1024,6144,384,128,4,ActivationType.Swiglu,torch.bfloat16,torch.float8_e4m3fnuz,torch.float8_e4m3fnuz,QuantType.per_Token,1,0,32,0,-1.0,_ZN5aiter44fmoe_stage1_bf16_pertokenFp8_g1u1_32x512_pf2E,100.0%,0.0,0.0,0
stage1,80,1024,6144,384,128,4,ActivationType.Swiglu,torch.bfloat16,torch.float8_e4m3fnuz,torch.float8_e4m3fnuz,QuantType.per_Token,1,0,32,0,-1.0,_ZN5aiter44fmoe_stage1_bf16_pertokenFp8_g1u1_32x512_pf3E,100.0%,0.0,0.0,0
stage1,80,1024,6144,384,128,4,ActivationType.Swiglu,torch.bfloat16,torch.float8_e4m3fnuz,torch.float8_e4m3fnuz,QuantType.per_Token,1,0,32,0,310.32,_ZN5aiter47fmoe_stage1_bf16_pertokenFp8_g1u1_32x64_4tg_pf2E,97.9%,186.85,2980.29,0
stage1,80,1024,6144,384,128,4,ActivationType.Swiglu,torch.bfloat16,torch.float8_e4m3fnuz,torch.float8_e4m3fnuz,QuantType.per_Token,1,0,32,0,290.7335,_ZN5aiter47fmoe_stage1_bf16_pertokenFp8_g1u1_32x64_4tg_pf3E,97.9%,199.43,3181.07,0
stage1,80,1024,6144,384,128,4,ActivationType.Swiglu,torch.bfloat16,torch.float8_e4m3fnuz,torch.float8_e4m3fnuz,QuantType.per_Token,1,0,64,0,267.3356,_ZN5aiter48fmoe_stage1_bf16_pertokenFp8_g1u1_64x128_2tg_pf2E,97.9%,216.89,3459.49,0
stage1,80,1024,6144,384,128,4,ActivationType.Swiglu,torch.bfloat16,torch.float8_e4m3fnuz,torch.float8_e4m3fnuz,QuantType.per_Token,1,0,64,0,235.8715,_ZN5aiter48fmoe_stage1_bf16_pertokenFp8_g1u1_64x128_2tg_pf3E,97.9%,245.82,3920.97,0
stage1,80,1024,6144,384,128,4,ActivationType.Swiglu,torch.bfloat16,torch.float8_e4m3fnuz,torch.float8_e4m3fnuz,QuantType.per_Token,1,0,64,0,-1.0,_ZN5aiter44fmoe_stage1_bf16_pertokenFp8_g1u1_64x256_pf2E,100.0%,0.0,0.0,0
stage1,80,1024,6144,384,128,4,ActivationType.Swiglu,torch.bfloat16,torch.float8_e4m3fnuz,torch.float8_e4m3fnuz,QuantType.per_Token,1,0,64,0,-1.0,_ZN5aiter44fmoe_stage1_bf16_pertokenFp8_g1u1_64x256_pf3E,100.0%,0.0,0.0,0
stage1,80,1024,6144,384,128,4,ActivationType.Swiglu,torch.bfloat16,torch.float8_e4m3fnuz,torch.float8_e4m3fnuz,QuantType.per_Token,1,0,64,0,291.2061,_ZN5aiter47fmoe_stage1_bf16_pertokenFp8_g1u1_64x64_3tg_pf2E,97.9%,199.11,3175.91,0
stage1,80,1024,6144,384,128,4,ActivationType.Swiglu,torch.bfloat16,torch.float8_e4m3fnuz,torch.float8_e4m3fnuz,QuantType.per_Token,1,0,64,0,262.7478,_ZN5aiter47fmoe_stage1_bf16_pertokenFp8_g1u1_64x64_2tg_pf3E,97.9%,220.68,3519.89,0
stage1,80,1024,6144,384,128,4,ActivationType.Swiglu,torch.bfloat16,torch.float8_e4m3fnuz,torch.float8_e4m3fnuz,QuantType.per_Token,1,0,128,0,418.7316,_ZN5aiter45fmoe_stage1_bf16_pertokenFp8_g1u1_128x128_pf2E,97.9%,138.47,2208.68,0
stage1,80,1024,6144,384,128,4,ActivationType.Swiglu,torch.bfloat16,torch.float8_e4m3fnuz,torch.float8_e4m3fnuz,QuantType.per_Token,1,0,128,0,414.6635,_ZN5aiter45fmoe_stage1_bf16_pertokenFp8_g1u1_128x128_pf3E,97.9%,139.83,2230.35,0
stage1,80,1024,6144,384,128,4,ActivationType.Swiglu,torch.bfloat16,torch.float8_e4m3fnuz,torch.float8_e4m3fnuz,QuantType.per_Token,1,0,128,0,595.2874,_ZN5aiter44fmoe_stage1_bf16_pertokenFp8_g1u1_128x64_pf2E,97.9%,97.4,1553.61,0
stage1,80,1024,6144,384,128,4,ActivationType.Swiglu,torch.bfloat16,torch.float8_e4m3fnuz,torch.float8_e4m3fnuz,QuantType.per_Token,1,0,128,0,491.9213,_ZN5aiter44fmoe_stage1_bf16_pertokenFp8_g1u1_128x64_pf3E,97.9%,117.87,1880.07,0
stage1,80,1024,6144,384,128,4,ActivationType.Swiglu,torch.bfloat16,torch.float8_e4m3fnuz,torch.float8_e4m3fnuz,QuantType.per_Token,1,0,16,0,371.9792,moe_ck2stages_gemm1_128x16x64x128_1x2_MulABScale_v1_Nswizzle0_Quant2_MulRoutedWeight0_swiglu_F8_F8_B16,0.0%,155.87,2486.28,0
stage1,80,1024,6144,384,128,4,ActivationType.Swiglu,torch.bfloat16,torch.float8_e4m3fnuz,torch.float8_e4m3fnuz,QuantType.per_Token,1,0,16,0,363.7634,moe_ck2stages_gemm1_256x16x128x256_1x4_MulABScale_v1_Nswizzle0_Quant2_MulRoutedWeight0_swiglu_F8_F8_B16,0.0%,159.39,2542.43,0
stage1,80,1024,6144,384,128,4,ActivationType.Swiglu,torch.bfloat16,torch.float8_e4m3fnuz,torch.float8_e4m3fnuz,QuantType.per_Token,1,0,16,0,344.1098,moe_ck2stages_gemm1_256x16x64x256_1x4_MulABScale_v1_Nswizzle0_Quant2_MulRoutedWeight0_swiglu_F8_F8_B16,0.0%,168.5,2687.64,0
stage2,80,1024,6144,384,128,4,ActivationType.Swiglu,torch.bfloat16,torch.float8_e4m3fnuz,torch.float8_e4m3fnuz,QuantType.per_Token,1,0,16,0,-1.0,moe_ck2stages_gemm2_256x16x128x256_1x4_MulABScaleExpertWeight_v1_Nswizzle0_Quant2_MulRoutedWeight1_F8_F8_B16,100.0%,0.0,0.0,0
stage2,80,1024,6144,384,128,4,ActivationType.Swiglu,torch.bfloat16,torch.float8_e4m3fnuz,torch.float8_e4m3fnuz,QuantType.per_Token,1,0,16,0,345.684,moe_ck2stages_gemm2_128x16x128x128_1x2_MulABScaleExpertWeight_v1_Nswizzle0_Quant2_MulRoutedWeight1_F8_F8_B16,2.9%,167.73,2675.4,0
stage2,80,1024,6144,384,128,4,ActivationType.Swiglu,torch.bfloat16,torch.float8_e4m3fnuz,torch.float8_e4m3fnuz,QuantType.per_Token,1,0,16,0,391.9126,moe_ck2stages_gemm2_64x16x64x64_1x1_MulABScaleExpertWeight_v1_Nswizzle0_Quant2_MulRoutedWeight1_F8_F8_B16,2.9%,147.95,2359.82,0
stage1,80,1024,6144,384,128,4,ActivationType.Swiglu,torch.bfloat16,torch.float8_e4m3fnuz,torch.float8_e4m3fnuz,QuantType.per_Token,1,0,32,0,276.3688,moe_ck2stages_gemm1_256x32x64x256_1x4_MulABScale_v1_Nswizzle0_Quant2_MulRoutedWeight0_swiglu_F8_F8_B16,0.0%,209.8,3346.41,0
stage1,80,1024,6144,384,128,4,ActivationType.Swiglu,torch.bfloat16,torch.float8_e4m3fnuz,torch.float8_e4m3fnuz,QuantType.per_Token,1,0,32,0,294.0745,moe_ck2stages_gemm1_256x32x64x128_1x4_MulABScale_v1_Nswizzle0_Quant2_MulRoutedWeight0_swiglu_F8_F8_B16,0.0%,197.17,3144.93,0
stage2,80,1024,6144,384,128,4,ActivationType.Swiglu,torch.bfloat16,torch.float8_e4m3fnuz,torch.float8_e4m3fnuz,QuantType.per_Token,1,0,32,0,-1.0,moe_ck2stages_gemm2_256x32x64x256_1x4_MulABScaleExpertWeight_v1_Nswizzle0_Quant2_MulRoutedWeight1_F8_F8_B16,100.0%,0.0,0.0,0
stage2,80,1024,6144,384,128,4,ActivationType.Swiglu,torch.bfloat16,torch.float8_e4m3fnuz,torch.float8_e4m3fnuz,QuantType.per_Token,1,0,32,0,279.0888,moe_ck2stages_gemm2_256x32x64x128_1x4_MulABScaleExpertWeight_v1_Nswizzle0_Quant2_MulRoutedWeight1_F8_F8_B16,2.9%,207.75,3313.8,0
stage2,80,1024,6144,384,128,4,ActivationType.Swiglu,torch.bfloat16,torch.float8_e4m3fnuz,torch.float8_e4m3fnuz,QuantType.per_Token,1,0,32,0,448.5629,moe_ck2stages_gemm2_256x32x64x64_1x4_MulABScaleExpertWeight_v1_Nswizzle0_Quant2_MulRoutedWeight1_F8_F8_B16,99.6%,129.26,2061.79,0
stage1,80,1024,6144,384,128,4,ActivationType.Swiglu,torch.bfloat16,torch.float8_e4m3fnuz,torch.float8_e4m3fnuz,QuantType.per_Token,1,0,64,0,289.3357,moe_ck2stages_gemm1_256x64x64x256_1x4_MulABScale_v1_Nswizzle0_Quant2_MulRoutedWeight0_swiglu_F8_F8_B16,0.0%,200.4,3196.44,0
stage1,80,1024,6144,384,128,4,ActivationType.Swiglu,torch.bfloat16,torch.float8_e4m3fnuz,torch.float8_e4m3fnuz,QuantType.per_Token,1,0,64,0,271.6152,moe_ck2stages_gemm1_256x64x64x128_1x4_MulABScale_v1_Nswizzle0_Quant2_MulRoutedWeight0_swiglu_F8_F8_B16,0.0%,213.47,3404.98,0
stage1,80,1024,6144,384,128,4,ActivationType.Swiglu,torch.bfloat16,torch.float8_e4m3fnuz,torch.float8_e4m3fnuz,QuantType.per_Token,1,0,64,0,289.6587,moe_ck2stages_gemm1_256x64x128x256_1x4_MulABScale_v3_Nswizzle0_Quant2_MulRoutedWeight0_swiglu_F8_F8_B16,0.0%,200.17,3192.88,0
stage1,80,1024,6144,384,128,4,ActivationType.Swiglu,torch.bfloat16,torch.float8_e4m3fnuz,torch.float8_e4m3fnuz,QuantType.per_Token,1,0,64,0,264.1622,moe_ck2stages_gemm1_256x64x128x128_1x4_MulABScale_v3_Nswizzle0_Quant2_MulRoutedWeight0_swiglu_F8_F8_B16,0.0%,219.49,3501.05,0
stage2,80,1024,6144,384,128,4,ActivationType.Swiglu,torch.bfloat16,torch.float8_e4m3fnuz,torch.float8_e4m3fnuz,QuantType.per_Token,1,0,64,0,-1.0,moe_ck2stages_gemm2_256x64x64x256_1x4_MulABScaleExpertWeight_v1_Nswizzle0_Quant2_MulRoutedWeight1_F8_F8_B16,100.0%,0.0,0.0,0
stage2,80,1024,6144,384,128,4,ActivationType.Swiglu,torch.bfloat16,torch.float8_e4m3fnuz,torch.float8_e4m3fnuz,QuantType.per_Token,1,0,64,0,-1.0,moe_ck2stages_gemm2_256x64x128x256_1x4_MulABScaleExpertWeight_v3_Nswizzle0_Quant2_MulRoutedWeight1_F8_F8_B16,100.0%,0.0,0.0,0
stage2,80,1024,6144,384,128,4,ActivationType.Swiglu,torch.bfloat16,torch.float8_e4m3fnuz,torch.float8_e4m3fnuz,QuantType.per_Token,1,0,64,0,470.0519,moe_ck2stages_gemm2_256x64x128x128_1x4_MulABScaleExpertWeight_v3_Nswizzle0_Quant2_MulRoutedWeight1_F8_F8_B16,2.9%,123.35,1967.54,0
stage2,80,1024,6144,384,128,4,ActivationType.Swiglu,torch.bfloat16,torch.float8_e4m3fnuz,torch.float8_e4m3fnuz,QuantType.per_Token,1,0,64,0,656.4663,moe_ck2stages_gemm2_256x64x128x64_1x4_MulABScaleExpertWeight_v3_Nswizzle0_Quant2_MulRoutedWeight1_F8_F8_B16,99.6%,88.32,1408.82,0
stage2,80,1024,6144,384,128,4,ActivationType.Swiglu,torch.bfloat16,torch.float8_e4m3fnuz,torch.float8_e4m3fnuz,QuantType.per_Token,1,0,64,0,568.9615,moe_ck2stages_gemm2_256x64x64x64_1x4_MulABScaleExpertWeight_v1_Nswizzle0_Quant2_MulRoutedWeight1_F8_F8_B16,99.6%,101.91,1625.49,0
stage1,80,1024,6144,384,128,4,ActivationType.Swiglu,torch.bfloat16,torch.float8_e4m3fnuz,torch.float8_e4m3fnuz,QuantType.per_Token,1,0,128,0,514.9931,moe_ck2stages_gemm1_256x128x64x128_1x4_MulABScale_v1_Nswizzle0_Quant2_MulRoutedWeight0_swiglu_F8_F8_B16,0.0%,112.59,1795.84,0
stage1,80,1024,6144,384,128,4,ActivationType.Swiglu,torch.bfloat16,torch.float8_e4m3fnuz,torch.float8_e4m3fnuz,QuantType.per_Token,1,0,128,0,534.8358,moe_ck2stages_gemm1_256x128x128x256_1x4_MulABScale_v3_Nswizzle0_Quant2_MulRoutedWeight0_swiglu_F8_F8_B16,0.0%,108.41,1729.21,0
stage1,80,1024,6144,384,128,4,ActivationType.Swiglu,torch.bfloat16,torch.float8_e4m3fnuz,torch.float8_e4m3fnuz,QuantType.per_Token,1,0,128,0,531.8595,moe_ck2stages_gemm1_256x128x128x128_1x4_MulABScale_v3_Nswizzle0_Quant2_MulRoutedWeight0_swiglu_F8_F8_B16,0.0%,109.02,1738.89,0
stage2,80,1024,6144,384,128,4,ActivationType.Swiglu,torch.bfloat16,torch.float8_e4m3fnuz,torch.float8_e4m3fnuz,QuantType.per_Token,1,0,128,0,956.4428,moe_ck2stages_gemm2_256x128x64x128_1x4_MulABScaleExpertWeight_v1_Nswizzle0_Quant2_MulRoutedWeight1_F8_F8_B16,2.9%,60.62,966.96,0
stage2,80,1024,6144,384,128,4,ActivationType.Swiglu,torch.bfloat16,torch.float8_e4m3fnuz,torch.float8_e4m3fnuz,QuantType.per_Token,1,0,128,0,716.3193,moe_ck2stages_gemm2_256x128x128x128_1x4_MulABScaleExpertWeight_v3_Nswizzle0_Quant2_MulRoutedWeight1_F8_F8_B16,2.9%,80.94,1291.11,0
stage2,80,1024,6144,384,128,4,ActivationType.Swiglu,torch.bfloat16,torch.float8_e4m3fnuz,torch.float8_e4m3fnuz,QuantType.per_Token,1,0,128,0,977.5405,moe_ck2stages_gemm2_256x128x128x64_1x4_MulABScaleExpertWeight_v3_Nswizzle0_Quant2_MulRoutedWeight1_F8_F8_B16,99.6%,59.31,946.09,0
stage2,80,1024,6144,384,128,4,ActivationType.Swiglu,torch.bfloat16,torch.float8_e4m3fnuz,torch.float8_e4m3fnuz,QuantType.per_Token,1,0,128,0,1085.8702,moe_ck2stages_gemm2_256x128x64x64_1x4_MulABScaleExpertWeight_v3_Nswizzle0_Quant2_MulRoutedWeight1_F8_F8_B16,99.6%,53.4,851.71,0
stage1,80,2048,6144,384,128,4,ActivationType.Swiglu,torch.bfloat16,torch.float8_e4m3fnuz,torch.float8_e4m3fnuz,QuantType.per_Token,1,0,16,0,581.0868,_ZN5aiter48fmoe_stage1_bf16_pertokenFp8_g1u1_16x128_4tg_pf2E,97.9%,199.56,1624.06,0
stage1,80,2048,6144,384,128,4,ActivationType.Swiglu,torch.bfloat16,torch.float8_e4m3fnuz,torch.float8_e4m3fnuz,QuantType.per_Token,1,0,16,0,571.8645,_ZN5aiter48fmoe_stage1_bf16_pertokenFp8_g1u1_16x128_4tg_pf3E,97.9%,202.78,1650.25,0
stage1,80,2048,6144,384,128,4,ActivationType.Swiglu,torch.bfloat16,torch.float8_e4m3fnuz,torch.float8_e4m3fnuz,QuantType.per_Token,1,0,16,0,-1.0,_ZN5aiter48fmoe_stage1_bf16_pertokenFp8_g1u1_16x256_3tg_pf2E,100.0%,0.0,0.0,0
stage1,80,2048,6144,384,128,4,ActivationType.Swiglu,torch.bfloat16,torch.float8_e4m3fnuz,torch.float8_e4m3fnuz,QuantType.per_Token,1,0,16,0,-1.0,_ZN5aiter48fmoe_stage1_bf16_pertokenFp8_g1u1_16x256_2tg_pf3E,100.0%,0.0,0.0,0
stage1,80,2048,6144,384,128,4,ActivationType.Swiglu,torch.bfloat16,torch.float8_e4m3fnuz,torch.float8_e4m3fnuz,QuantType.per_Token,1,0,16,0,-1.0,_ZN5aiter48fmoe_stage1_bf16_pertokenFp8_g1u1_16x512_2tg_pf2E,100.0%,0.0,0.0,0
stage1,80,2048,6144,384,128,4,ActivationType.Swiglu,torch.bfloat16,torch.float8_e4m3fnuz,torch.float8_e4m3fnuz,QuantType.per_Token,1,0,16,0,-1.0,_ZN5aiter44fmoe_stage1_bf16_pertokenFp8_g1u1_16x512_pf3E,100.0%,0.0,0.0,0
stage1,80,2048,6144,384,128,4,ActivationType.Swiglu,torch.bfloat16,torch.float8_e4m3fnuz,torch.float8_e4m3fnuz,QuantType.per_Token,1,0,16,0,588.2463,_ZN5aiter47fmoe_stage1_bf16_pertokenFp8_g1u1_16x64_6tg_pf2E,97.9%,197.14,1604.29,0
stage1,80,2048,6144,384,128,4,ActivationType.Swiglu,torch.bfloat16,torch.float8_e4m3fnuz,torch.float8_e4m3fnuz,QuantType.per_Token,1,0,16,0,578.4657,_ZN5aiter47fmoe_stage1_bf16_pertokenFp8_g1u1_16x64_5tg_pf3E,97.9%,200.47,1631.42,0
stage1,80,2048,6144,384,128,4,ActivationType.Swiglu,torch.bfloat16,torch.float8_e4m3fnuz,torch.float8_e4m3fnuz,QuantType.per_Token,1,0,32,0,422.7549,_ZN5aiter48fmoe_stage1_bf16_pertokenFp8_g1u1_32x128_3tg_pf2E,97.9%,274.31,2232.31,0
stage1,80,2048,6144,384,128,4,ActivationType.Swiglu,torch.bfloat16,torch.float8_e4m3fnuz,torch.float8_e4m3fnuz,QuantType.per_Token,1,0,32,0,406.6409,_ZN5aiter48fmoe_stage1_bf16_pertokenFp8_g1u1_32x128_3tg_pf3E,97.9%,285.18,2320.77,0
stage1,80,2048,6144,384,128,4,ActivationType.Swiglu,torch.bfloat16,torch.float8_e4m3fnuz,torch.float8_e4m3fnuz,QuantType.per_Token,1,0,32,0,-1.0,_ZN5aiter48fmoe_stage1_bf16_pertokenFp8_g1u1_32x256_2tg_pf2E,100.0%,0.0,0.0,0
stage1,80,2048,6144,384,128,4,ActivationType.Swiglu,torch.bfloat16,torch.float8_e4m3fnuz,torch.float8_e4m3fnuz,QuantType.per_Token,1,0,32,0,-1.0,_ZN5aiter48fmoe_stage1_bf16_pertokenFp8_g1u1_32x256_2tg_pf3E,100.0%,0.0,0.0,0
stage1,80,2048,6144,384,128,4,ActivationType.Swiglu,torch.bfloat16,torch.float8_e4m3fnuz,torch.float8_e4m3fnuz,QuantType.per_Token,1,0,32,0,-1.0,_ZN5aiter44fmoe_stage1_bf16_pertokenFp8_g1u1_32x512_pf2E,100.0%,0.0,0.0,0
stage1,80,2048,6144,384,128,4,ActivationType.Swiglu,torch.bfloat16,torch.float8_e4m3fnuz,torch.float8_e4m3fnuz,QuantType.per_Token,1,0,32,0,-1.0,_ZN5aiter44fmoe_stage1_bf16_pertokenFp8_g1u1_32x512_pf3E,100.0%,0.0,0.0,0
stage1,80,2048,6144,384,128,4,ActivationType.Swiglu,torch.bfloat16,torch.float8_e4m3fnuz,torch.float8_e4m3fnuz,QuantType.per_Token,1,0,32,0,450.9262,_ZN5aiter47fmoe_stage1_bf16_pertokenFp8_g1u1_32x64_4tg_pf2E,97.9%,257.17,2092.84,0
stage1,80,2048,6144,384,128,4,ActivationType.Swiglu,torch.bfloat16,torch.float8_e4m3fnuz,torch.float8_e4m3fnuz,QuantType.per_Token,1,0,32,0,438.2405,_ZN5aiter47fmoe_stage1_bf16_pertokenFp8_g1u1_32x64_4tg_pf3E,97.9%,264.61,2153.43,0
stage1,80,2048,6144,384,128,4,ActivationType.Swiglu,torch.bfloat16,torch.float8_e4m3fnuz,torch.float8_e4m3fnuz,QuantType.per_Token,1,0,64,0,370.9859,_ZN5aiter48fmoe_stage1_bf16_pertokenFp8_g1u1_64x128_2tg_pf2E,97.9%,312.58,2543.81,0
stage1,80,2048,6144,384,128,4,ActivationType.Swiglu,torch.bfloat16,torch.float8_e4m3fnuz,torch.float8_e4m3fnuz,QuantType.per_Token,1,0,64,0,350.3234,_ZN5aiter48fmoe_stage1_bf16_pertokenFp8_g1u1_64x128_2tg_pf3E,97.9%,331.02,2693.85,0
stage1,80,2048,6144,384,128,4,ActivationType.Swiglu,torch.bfloat16,torch.float8_e4m3fnuz,torch.float8_e4m3fnuz,QuantType.per_Token,1,0,64,0,-1.0,_ZN5aiter44fmoe_stage1_bf16_pertokenFp8_g1u1_64x256_pf2E,100.0%,0.0,0.0,0
stage1,80,2048,6144,384,128,4,ActivationType.Swiglu,torch.bfloat16,torch.float8_e4m3fnuz,torch.float8_e4m3fnuz,QuantType.per_Token,1,0,64,0,-1.0,_ZN5aiter44fmoe_stage1_bf16_pertokenFp8_g1u1_64x256_pf3E,100.0%,0.0,0.0,0
stage1,80,2048,6144,384,128,4,ActivationType.Swiglu,torch.bfloat16,torch.float8_e4m3fnuz,torch.float8_e4m3fnuz,QuantType.per_Token,1,0,64,0,409.5825,_ZN5aiter47fmoe_stage1_bf16_pertokenFp8_g1u1_64x64_3tg_pf2E,97.9%,283.13,2304.1,0
stage1,80,2048,6144,384,128,4,ActivationType.Swiglu,torch.bfloat16,torch.float8_e4m3fnuz,torch.float8_e4m3fnuz,QuantType.per_Token,1,0,64,0,407.6026,_ZN5aiter47fmoe_stage1_bf16_pertokenFp8_g1u1_64x64_2tg_pf3E,97.9%,284.5,2315.29,0
stage1,80,2048,6144,384,128,4,ActivationType.Swiglu,torch.bfloat16,torch.float8_e4m3fnuz,torch.float8_e4m3fnuz,QuantType.per_Token,1,0,128,0,424.605,_ZN5aiter45fmoe_stage1_bf16_pertokenFp8_g1u1_128x128_pf2E,97.9%,273.11,2222.58,0
stage1,80,2048,6144,384,128,4,ActivationType.Swiglu,torch.bfloat16,torch.float8_e4m3fnuz,torch.float8_e4m3fnuz,QuantType.per_Token,1,0,128,0,419.9819,_ZN5aiter45fmoe_stage1_bf16_pertokenFp8_g1u1_128x128_pf3E,97.9%,276.12,2247.05,0
stage1,80,2048,6144,384,128,4,ActivationType.Swiglu,torch.bfloat16,torch.float8_e4m3fnuz,torch.float8_e4m3fnuz,QuantType.per_Token,1,0,128,0,616.3682,_ZN5aiter44fmoe_stage1_bf16_pertokenFp8_g1u1_128x64_pf2E,97.9%,188.14,1531.1,0
stage1,80,2048,6144,384,128,4,ActivationType.Swiglu,torch.bfloat16,torch.float8_e4m3fnuz,torch.float8_e4m3fnuz,QuantType.per_Token,1,0,128,0,524.6553,_ZN5aiter44fmoe_stage1_bf16_pertokenFp8_g1u1_128x64_pf3E,97.9%,221.03,1798.74,0
stage1,80,2048,6144,384,128,4,ActivationType.Swiglu,torch.bfloat16,torch.float8_e4m3fnuz,torch.float8_e4m3fnuz,QuantType.per_Token,1,0,16,0,581.9964,moe_ck2stages_gemm1_128x16x64x128_1x2_MulABScale_v1_Nswizzle0_Quant2_MulRoutedWeight0_swiglu_F8_F8_B16,0.0%,199.25,1621.52,0
stage1,80,2048,6144,384,128,4,ActivationType.Swiglu,torch.bfloat16,torch.float8_e4m3fnuz,torch.float8_e4m3fnuz,QuantType.per_Token,1,0,16,0,586.0973,moe_ck2stages_gemm1_256x16x128x256_1x4_MulABScale_v1_Nswizzle0_Quant2_MulRoutedWeight0_swiglu_F8_F8_B16,0.0%,197.86,1610.17,0
stage1,80,2048,6144,384,128,4,ActivationType.Swiglu,torch.bfloat16,torch.float8_e4m3fnuz,torch.float8_e4m3fnuz,QuantType.per_Token,1,0,16,0,535.3829,moe_ck2stages_gemm1_256x16x64x256_1x4_MulABScale_v1_Nswizzle0_Quant2_MulRoutedWeight0_swiglu_F8_F8_B16,0.0%,216.6,1762.7,0
stage2,80,2048,6144,384,128,4,ActivationType.Swiglu,torch.bfloat16,torch.float8_e4m3fnuz,torch.float8_e4m3fnuz,QuantType.per_Token,1,0,16,0,-1.0,moe_ck2stages_gemm2_256x16x128x256_1x4_MulABScaleExpertWeight_v1_Nswizzle0_Quant2_MulRoutedWeight1_F8_F8_B16,100.0%,0.0,0.0,0
stage2,80,2048,6144,384,128,4,ActivationType.Swiglu,torch.bfloat16,torch.float8_e4m3fnuz,torch.float8_e4m3fnuz,QuantType.per_Token,1,0,16,0,619.6721,moe_ck2stages_gemm2_128x16x128x128_1x2_MulABScaleExpertWeight_v1_Nswizzle0_Quant2_MulRoutedWeight1_F8_F8_B16,2.9%,187.14,1522.93,0
stage2,80,2048,6144,384,128,4,ActivationType.Swiglu,torch.bfloat16,torch.float8_e4m3fnuz,torch.float8_e4m3fnuz,QuantType.per_Token,1,0,16,0,711.1037,moe_ck2stages_gemm2_64x16x64x64_1x1_MulABScaleExpertWeight_v1_Nswizzle0_Quant2_MulRoutedWeight1_F8_F8_B16,2.9%,163.08,1327.12,0
stage1,80,2048,6144,384,128,4,ActivationType.Swiglu,torch.bfloat16,torch.float8_e4m3fnuz,torch.float8_e4m3fnuz,QuantType.per_Token,1,0,32,0,401.8065,moe_ck2stages_gemm1_256x32x64x256_1x4_MulABScale_v1_Nswizzle0_Quant2_MulRoutedWeight0_swiglu_F8_F8_B16,0.0%,288.61,2348.69,0
stage1,80,2048,6144,384,128,4,ActivationType.Swiglu,torch.bfloat16,torch.float8_e4m3fnuz,torch.float8_e4m3fnuz,QuantType.per_Token,1,0,32,0,440.7559,moe_ck2stages_gemm1_256x32x64x128_1x4_MulABScale_v1_Nswizzle0_Quant2_MulRoutedWeight0_swiglu_F8_F8_B16,0.0%,263.1,2141.14,0
stage2,80,2048,6144,384,128,4,ActivationType.Swiglu,torch.bfloat16,torch.float8_e4m3fnuz,torch.float8_e4m3fnuz,QuantType.per_Token,1,0,32,0,-1.0,moe_ck2stages_gemm2_256x32x64x256_1x4_MulABScaleExpertWeight_v1_Nswizzle0_Quant2_MulRoutedWeight1_F8_F8_B16,100.0%,0.0,0.0,0
stage2,80,2048,6144,384,128,4,ActivationType.Swiglu,torch.bfloat16,torch.float8_e4m3fnuz,torch.float8_e4m3fnuz,QuantType.per_Token,1,0,32,0,464.0326,moe_ck2stages_gemm2_256x32x64x128_1x4_MulABScaleExpertWeight_v1_Nswizzle0_Quant2_MulRoutedWeight1_F8_F8_B16,2.9%,249.91,2033.73,0
stage2,80,2048,6144,384,128,4,ActivationType.Swiglu,torch.bfloat16,torch.float8_e4m3fnuz,torch.float8_e4m3fnuz,QuantType.per_Token,1,0,32,0,748.6443,moe_ck2stages_gemm2_256x32x64x64_1x4_MulABScaleExpertWeight_v1_Nswizzle0_Quant2_MulRoutedWeight1_F8_F8_B16,99.6%,154.9,1260.57,0
stage1,80,2048,6144,384,128,4,ActivationType.Swiglu,torch.bfloat16,torch.float8_e4m3fnuz,torch.float8_e4m3fnuz,QuantType.per_Token,1,0,64,0,427.7234,moe_ck2stages_gemm1_256x64x64x256_1x4_MulABScale_v1_Nswizzle0_Quant2_MulRoutedWeight0_swiglu_F8_F8_B16,0.0%,271.12,2206.38,0
stage1,80,2048,6144,384,128,4,ActivationType.Swiglu,torch.bfloat16,torch.float8_e4m3fnuz,torch.float8_e4m3fnuz,QuantType.per_Token,1,0,64,0,401.894,moe_ck2stages_gemm1_256x64x64x128_1x4_MulABScale_v1_Nswizzle0_Quant2_MulRoutedWeight0_swiglu_F8_F8_B16,0.0%,288.54,2348.18,0
stage1,80,2048,6144,384,128,4,ActivationType.Swiglu,torch.bfloat16,torch.float8_e4m3fnuz,torch.float8_e4m3fnuz,QuantType.per_Token,1,0,64,0,459.1636,moe_ck2stages_gemm1_256x64x128x256_1x4_MulABScale_v3_Nswizzle0_Quant2_MulRoutedWeight0_swiglu_F8_F8_B16,0.0%,252.56,2055.3,0
stage1,80,2048,6144,384,128,4,ActivationType.Swiglu,torch.bfloat16,torch.float8_e4m3fnuz,torch.float8_e4m3fnuz,QuantType.per_Token,1,0,64,0,403.3549,moe_ck2stages_gemm1_256x64x128x128_1x4_MulABScale_v3_Nswizzle0_Quant2_MulRoutedWeight0_swiglu_F8_F8_B16,0.0%,287.5,2339.67,0
stage2,80,2048,6144,384,128,4,ActivationType.Swiglu,torch.bfloat16,torch.float8_e4m3fnuz,torch.float8_e4m3fnuz,QuantType.per_Token,1,0,64,0,-1.0,moe_ck2stages_gemm2_256x64x64x256_1x4_MulABScaleExpertWeight_v1_Nswizzle0_Quant2_MulRoutedWeight1_F8_F8_B16,100.0%,0.0,0.0,0
stage2,80,2048,6144,384,128,4,ActivationType.Swiglu,torch.bfloat16,torch.float8_e4m3fnuz,torch.float8_e4m3fnuz,QuantType.per_Token,1,0,64,0,-1.0,moe_ck2stages_gemm2_256x64x128x256_1x4_MulABScaleExpertWeight_v3_Nswizzle0_Quant2_MulRoutedWeight1_F8_F8_B16,100.0%,0.0,0.0,0
stage2,80,2048,6144,384,128,4,ActivationType.Swiglu,torch.bfloat16,torch.float8_e4m3fnuz,torch.float8_e4m3fnuz,QuantType.per_Token,1,0,64,0,711.7153,moe_ck2stages_gemm2_256x64x128x128_1x4_MulABScaleExpertWeight_v3_Nswizzle0_Quant2_MulRoutedWeight1_F8_F8_B16,2.9%,162.94,1325.98,0
stage2,80,2048,6144,384,128,4,ActivationType.Swiglu,torch.bfloat16,torch.float8_e4m3fnuz,torch.float8_e4m3fnuz,QuantType.per_Token,1,0,64,0,987.3761,moe_ck2stages_gemm2_256x64x128x64_1x4_MulABScaleExpertWeight_v3_Nswizzle0_Quant2_MulRoutedWeight1_F8_F8_B16,99.6%,117.45,955.78,0
stage2,80,2048,6144,384,128,4,ActivationType.Swiglu,torch.bfloat16,torch.float8_e4m3fnuz,torch.float8_e4m3fnuz,QuantType.per_Token,1,0,64,0,845.9459,moe_ck2stages_gemm2_256x64x64x64_1x4_MulABScaleExpertWeight_v1_Nswizzle0_Quant2_MulRoutedWeight1_F8_F8_B16,99.6%,137.08,1115.58,0
stage1,80,2048,6144,384,128,4,ActivationType.Swiglu,torch.bfloat16,torch.float8_e4m3fnuz,torch.float8_e4m3fnuz,QuantType.per_Token,1,0,128,0,522.7824,moe_ck2stages_gemm1_256x128x64x128_1x4_MulABScale_v1_Nswizzle0_Quant2_MulRoutedWeight0_swiglu_F8_F8_B16,0.0%,221.82,1805.18,0
stage1,80,2048,6144,384,128,4,ActivationType.Swiglu,torch.bfloat16,torch.float8_e4m3fnuz,torch.float8_e4m3fnuz,QuantType.per_Token,1,0,128,0,540.4573,moe_ck2stages_gemm1_256x128x128x256_1x4_MulABScale_v3_Nswizzle0_Quant2_MulRoutedWeight0_swiglu_F8_F8_B16,0.0%,214.57,1746.15,0
stage1,80,2048,6144,384,128,4,ActivationType.Swiglu,torch.bfloat16,torch.float8_e4m3fnuz,torch.float8_e4m3fnuz,QuantType.per_Token,1,0,128,0,533.5456,moe_ck2stages_gemm1_256x128x128x128_1x4_MulABScale_v3_Nswizzle0_Quant2_MulRoutedWeight0_swiglu_F8_F8_B16,0.0%,217.35,1768.77,0
stage2,80,2048,6144,384,128,4,ActivationType.Swiglu,torch.bfloat16,torch.float8_e4m3fnuz,torch.float8_e4m3fnuz,QuantType.per_Token,1,0,128,0,1026.3979,moe_ck2stages_gemm2_256x128x64x128_1x4_MulABScaleExpertWeight_v1_Nswizzle0_Quant2_MulRoutedWeight1_F8_F8_B16,2.9%,112.98,919.45,0
stage2,80,2048,6144,384,128,4,ActivationType.Swiglu,torch.bfloat16,torch.float8_e4m3fnuz,torch.float8_e4m3fnuz,QuantType.per_Token,1,0,128,0,781.1164,moe_ck2stages_gemm2_256x128x128x128_1x4_MulABScaleExpertWeight_v3_Nswizzle0_Quant2_MulRoutedWeight1_F8_F8_B16,2.9%,148.46,1208.17,0
stage2,80,2048,6144,384,128,4,ActivationType.Swiglu,torch.bfloat16,torch.float8_e4m3fnuz,torch.float8_e4m3fnuz,QuantType.per_Token,1,0,128,0,1062.6639,moe_ck2stages_gemm2_256x128x128x64_1x4_MulABScaleExpertWeight_v3_Nswizzle0_Quant2_MulRoutedWeight1_F8_F8_B16,99.6%,109.13,888.07,0
stage2,80,2048,6144,384,128,4,ActivationType.Swiglu,torch.bfloat16,torch.float8_e4m3fnuz,torch.float8_e4m3fnuz,QuantType.per_Token,1,0,128,0,1141.3761,moe_ck2stages_gemm2_256x128x64x64_1x4_MulABScaleExpertWeight_v3_Nswizzle0_Quant2_MulRoutedWeight1_F8_F8_B16,99.6%,101.6,826.83,0
stage1,80,4096,6144,384,128,4,ActivationType.Swiglu,torch.bfloat16,torch.float8_e4m3fnuz,torch.float8_e4m3fnuz,QuantType.per_Token,1,0,16,0,977.4728,_ZN5aiter48fmoe_stage1_bf16_pertokenFp8_g1u1_16x128_4tg_pf2E,97.9%,237.27,1004.09,0
stage1,80,4096,6144,384,128,4,ActivationType.Swiglu,torch.bfloat16,torch.float8_e4m3fnuz,torch.float8_e4m3fnuz,QuantType.per_Token,1,0,16,0,975.7348,_ZN5aiter48fmoe_stage1_bf16_pertokenFp8_g1u1_16x128_4tg_pf3E,97.9%,237.7,1005.87,0
stage1,80,4096,6144,384,128,4,ActivationType.Swiglu,torch.bfloat16,torch.float8_e4m3fnuz,torch.float8_e4m3fnuz,QuantType.per_Token,1,0,16,0,-1.0,_ZN5aiter48fmoe_stage1_bf16_pertokenFp8_g1u1_16x256_3tg_pf2E,100.0%,0.0,0.0,0
stage1,80,4096,6144,384,128,4,ActivationType.Swiglu,torch.bfloat16,torch.float8_e4m3fnuz,torch.float8_e4m3fnuz,QuantType.per_Token,1,0,16,0,-1.0,_ZN5aiter48fmoe_stage1_bf16_pertokenFp8_g1u1_16x256_2tg_pf3E,100.0%,0.0,0.0,0
stage1,80,4096,6144,384,128,4,ActivationType.Swiglu,torch.bfloat16,torch.float8_e4m3fnuz,torch.float8_e4m3fnuz,QuantType.per_Token,1,0,16,0,-1.0,_ZN5aiter48fmoe_stage1_bf16_pertokenFp8_g1u1_16x512_2tg_pf2E,100.0%,0.0,0.0,0
stage1,80,4096,6144,384,128,4,ActivationType.Swiglu,torch.bfloat16,torch.float8_e4m3fnuz,torch.float8_e4m3fnuz,QuantType.per_Token,1,0,16,0,-1.0,_ZN5aiter44fmoe_stage1_bf16_pertokenFp8_g1u1_16x512_pf3E,100.0%,0.0,0.0,0
stage1,80,4096,6144,384,128,4,ActivationType.Swiglu,torch.bfloat16,torch.float8_e4m3fnuz,torch.float8_e4m3fnuz,QuantType.per_Token,1,0,16,0,1054.9471,_ZN5aiter47fmoe_stage1_bf16_pertokenFp8_g1u1_16x64_6tg_pf2E,97.9%,219.85,930.35,0
stage1,80,4096,6144,384,128,4,ActivationType.Swiglu,torch.bfloat16,torch.float8_e4m3fnuz,torch.float8_e4m3fnuz,QuantType.per_Token,1,0,16,0,1034.0849,_ZN5aiter47fmoe_stage1_bf16_pertokenFp8_g1u1_16x64_5tg_pf3E,97.9%,224.28,949.12,0
stage1,80,4096,6144,384,128,4,ActivationType.Swiglu,torch.bfloat16,torch.float8_e4m3fnuz,torch.float8_e4m3fnuz,QuantType.per_Token,1,0,32,0,673.2107,_ZN5aiter48fmoe_stage1_bf16_pertokenFp8_g1u1_32x128_3tg_pf2E,97.9%,344.51,1457.89,0
stage1,80,4096,6144,384,128,4,ActivationType.Swiglu,torch.bfloat16,torch.float8_e4m3fnuz,torch.float8_e4m3fnuz,QuantType.per_Token,1,0,32,0,692.2142,_ZN5aiter48fmoe_stage1_bf16_pertokenFp8_g1u1_32x128_3tg_pf3E,97.9%,335.05,1417.87,0
stage1,80,4096,6144,384,128,4,ActivationType.Swiglu,torch.bfloat16,torch.float8_e4m3fnuz,torch.float8_e4m3fnuz,QuantType.per_Token,1,0,32,0,-1.0,_ZN5aiter48fmoe_stage1_bf16_pertokenFp8_g1u1_32x256_2tg_pf2E,100.0%,0.0,0.0,0
stage1,80,4096,6144,384,128,4,ActivationType.Swiglu,torch.bfloat16,torch.float8_e4m3fnuz,torch.float8_e4m3fnuz,QuantType.per_Token,1,0,32,0,-1.0,_ZN5aiter48fmoe_stage1_bf16_pertokenFp8_g1u1_32x256_2tg_pf3E,100.0%,0.0,0.0,0
stage1,80,4096,6144,384,128,4,ActivationType.Swiglu,torch.bfloat16,torch.float8_e4m3fnuz,torch.float8_e4m3fnuz,QuantType.per_Token,1,0,32,0,-1.0,_ZN5aiter44fmoe_stage1_bf16_pertokenFp8_g1u1_32x512_pf2E,100.0%,0.0,0.0,0
stage1,80,4096,6144,384,128,4,ActivationType.Swiglu,torch.bfloat16,torch.float8_e4m3fnuz,torch.float8_e4m3fnuz,QuantType.per_Token,1,0,32,0,-1.0,_ZN5aiter44fmoe_stage1_bf16_pertokenFp8_g1u1_32x512_pf3E,100.0%,0.0,0.0,0
stage1,80,4096,6144,384,128,4,ActivationType.Swiglu,torch.bfloat16,torch.float8_e4m3fnuz,torch.float8_e4m3fnuz,QuantType.per_Token,1,0,32,0,755.5864,_ZN5aiter47fmoe_stage1_bf16_pertokenFp8_g1u1_32x64_4tg_pf2E,97.9%,306.95,1298.95,0
stage1,80,4096,6144,384,128,4,ActivationType.Swiglu,torch.bfloat16,torch.float8_e4m3fnuz,torch.float8_e4m3fnuz,QuantType.per_Token,1,0,32,0,706.1739,_ZN5aiter47fmoe_stage1_bf16_pertokenFp8_g1u1_32x64_4tg_pf3E,97.9%,328.43,1389.84,0
stage1,80,4096,6144,384,128,4,ActivationType.Swiglu,torch.bfloat16,torch.float8_e4m3fnuz,torch.float8_e4m3fnuz,QuantType.per_Token,1,0,64,0,560.7388,_ZN5aiter48fmoe_stage1_bf16_pertokenFp8_g1u1_64x128_2tg_pf2E,97.9%,413.61,1750.31,0
stage1,80,4096,6144,384,128,4,ActivationType.Swiglu,torch.bfloat16,torch.float8_e4m3fnuz,torch.float8_e4m3fnuz,QuantType.per_Token,1,0,64,0,545.2534,_ZN5aiter48fmoe_stage1_bf16_pertokenFp8_g1u1_64x128_2tg_pf3E,97.9%,425.36,1800.02,0
stage1,80,4096,6144,384,128,4,ActivationType.Swiglu,torch.bfloat16,torch.float8_e4m3fnuz,torch.float8_e4m3fnuz,QuantType.per_Token,1,0,64,0,-1.0,_ZN5aiter44fmoe_stage1_bf16_pertokenFp8_g1u1_64x256_pf2E,100.0%,0.0,0.0,0
stage1,80,4096,6144,384,128,4,ActivationType.Swiglu,torch.bfloat16,torch.float8_e4m3fnuz,torch.float8_e4m3fnuz,QuantType.per_Token,1,0,64,0,-1.0,_ZN5aiter44fmoe_stage1_bf16_pertokenFp8_g1u1_64x256_pf3E,100.0%,0.0,0.0,0
stage1,80,4096,6144,384,128,4,ActivationType.Swiglu,torch.bfloat16,torch.float8_e4m3fnuz,torch.float8_e4m3fnuz,QuantType.per_Token,1,0,64,0,644.8859,_ZN5aiter47fmoe_stage1_bf16_pertokenFp8_g1u1_64x64_3tg_pf2E,97.9%,359.64,1521.92,0
stage1,80,4096,6144,384,128,4,ActivationType.Swiglu,torch.bfloat16,torch.float8_e4m3fnuz,torch.float8_e4m3fnuz,QuantType.per_Token,1,0,64,0,625.5736,_ZN5aiter47fmoe_stage1_bf16_pertokenFp8_g1u1_64x64_2tg_pf3E,97.9%,370.74,1568.91,0
stage1,80,4096,6144,384,128,4,ActivationType.Swiglu,torch.bfloat16,torch.float8_e4m3fnuz,torch.float8_e4m3fnuz,QuantType.per_Token,1,0,128,0,676.9956,_ZN5aiter45fmoe_stage1_bf16_pertokenFp8_g1u1_128x128_pf2E,97.9%,342.58,1449.74,0
stage1,80,4096,6144,384,128,4,ActivationType.Swiglu,torch.bfloat16,torch.float8_e4m3fnuz,torch.float8_e4m3fnuz,QuantType.per_Token,1,0,128,0,668.7023,_ZN5aiter45fmoe_stage1_bf16_pertokenFp8_g1u1_128x128_pf3E,97.9%,346.83,1467.72,0
stage1,80,4096,6144,384,128,4,ActivationType.Swiglu,torch.bfloat16,torch.float8_e4m3fnuz,torch.float8_e4m3fnuz,QuantType.per_Token,1,0,128,0,954.4017,_ZN5aiter44fmoe_stage1_bf16_pertokenFp8_g1u1_128x64_pf2E,97.9%,243.01,1028.36,0
stage1,80,4096,6144,384,128,4,ActivationType.Swiglu,torch.bfloat16,torch.float8_e4m3fnuz,torch.float8_e4m3fnuz,QuantType.per_Token,1,0,128,0,774.2633,_ZN5aiter44fmoe_stage1_bf16_pertokenFp8_g1u1_128x64_pf3E,97.9%,299.55,1267.61,0
stage1,80,4096,6144,384,128,4,ActivationType.Swiglu,torch.bfloat16,torch.float8_e4m3fnuz,torch.float8_e4m3fnuz,QuantType.per_Token,1,0,16,0,1031.3686,moe_ck2stages_gemm1_128x16x64x128_1x2_MulABScale_v1_Nswizzle0_Quant2_MulRoutedWeight0_swiglu_F8_F8_B16,0.0%,224.87,951.62,0
stage1,80,4096,6144,384,128,4,ActivationType.Swiglu,torch.bfloat16,torch.float8_e4m3fnuz,torch.float8_e4m3fnuz,QuantType.per_Token,1,0,16,0,915.9816,moe_ck2stages_gemm1_256x16x128x256_1x4_MulABScale_v1_Nswizzle0_Quant2_MulRoutedWeight0_swiglu_F8_F8_B16,0.0%,253.2,1071.49,0
stage1,80,4096,6144,384,128,4,ActivationType.Swiglu,torch.bfloat16,torch.float8_e4m3fnuz,torch.float8_e4m3fnuz,QuantType.per_Token,1,0,16,0,957.0149,moe_ck2stages_gemm1_256x16x64x256_1x4_MulABScale_v1_Nswizzle0_Quant2_MulRoutedWeight0_swiglu_F8_F8_B16,0.0%,242.35,1025.55,0
stage2,80,4096,6144,384,128,4,ActivationType.Swiglu,torch.bfloat16,torch.float8_e4m3fnuz,torch.float8_e4m3fnuz,QuantType.per_Token,1,0,16,0,-1.0,moe_ck2stages_gemm2_256x16x128x256_1x4_MulABScaleExpertWeight_v1_Nswizzle0_Quant2_MulRoutedWeight1_F8_F8_B16,100.0%,0.0,0.0,0
stage2,80,4096,6144,384,128,4,ActivationType.Swiglu,torch.bfloat16,torch.float8_e4m3fnuz,torch.float8_e4m3fnuz,QuantType.per_Token,1,0,16,0,1159.265,moe_ck2stages_gemm2_128x16x128x128_1x2_MulABScaleExpertWeight_v1_Nswizzle0_Quant2_MulRoutedWeight1_F8_F8_B16,2.9%,200.06,846.63,0
stage2,80,4096,6144,384,128,4,ActivationType.Swiglu,torch.bfloat16,torch.float8_e4m3fnuz,torch.float8_e4m3fnuz,QuantType.per_Token,1,0,16,0,1308.0773,moe_ck2stages_gemm2_64x16x64x64_1x1_MulABScaleExpertWeight_v1_Nswizzle0_Quant2_MulRoutedWeight1_F8_F8_B16,2.9%,177.3,750.31,0
stage1,80,4096,6144,384,128,4,ActivationType.Swiglu,torch.bfloat16,torch.float8_e4m3fnuz,torch.float8_e4m3fnuz,QuantType.per_Token,1,0,32,0,666.4529,moe_ck2stages_gemm1_256x32x64x256_1x4_MulABScale_v1_Nswizzle0_Quant2_MulRoutedWeight0_swiglu_F8_F8_B16,0.0%,348.0,1472.67,0
stage1,80,4096,6144,384,128,4,ActivationType.Swiglu,torch.bfloat16,torch.float8_e4m3fnuz,torch.float8_e4m3fnuz,QuantType.per_Token,1,0,32,0,707.2706,moe_ck2stages_gemm1_256x32x64x128_1x4_MulABScale_v1_Nswizzle0_Quant2_MulRoutedWeight0_swiglu_F8_F8_B16,0.0%,327.92,1387.68,0
stage2,80,4096,6144,384,128,4,ActivationType.Swiglu,torch.bfloat16,torch.float8_e4m3fnuz,torch.float8_e4m3fnuz,QuantType.per_Token,1,0,32,0,-1.0,moe_ck2stages_gemm2_256x32x64x256_1x4_MulABScaleExpertWeight_v1_Nswizzle0_Quant2_MulRoutedWeight1_F8_F8_B16,100.0%,0.0,0.0,0
stage2,80,4096,6144,384,128,4,ActivationType.Swiglu,torch.bfloat16,torch.float8_e4m3fnuz,torch.float8_e4m3fnuz,QuantType.per_Token,1,0,32,0,846.1419,moe_ck2stages_gemm2_256x32x64x128_1x4_MulABScaleExpertWeight_v1_Nswizzle0_Quant2_MulRoutedWeight1_F8_F8_B16,2.9%,274.1,1159.93,0
stage2,80,4096,6144,384,128,4,ActivationType.Swiglu,torch.bfloat16,torch.float8_e4m3fnuz,torch.float8_e4m3fnuz,QuantType.per_Token,1,0,32,0,1363.0931,moe_ck2stages_gemm2_256x32x64x64_1x4_MulABScaleExpertWeight_v1_Nswizzle0_Quant2_MulRoutedWeight1_F8_F8_B16,99.6%,170.15,720.03,0
stage1,80,4096,6144,384,128,4,ActivationType.Swiglu,torch.bfloat16,torch.float8_e4m3fnuz,torch.float8_e4m3fnuz,QuantType.per_Token,1,0,64,0,671.2451,moe_ck2stages_gemm1_256x64x64x256_1x4_MulABScale_v1_Nswizzle0_Quant2_MulRoutedWeight0_swiglu_F8_F8_B16,0.0%,345.52,1462.16,0
stage1,80,4096,6144,384,128,4,ActivationType.Swiglu,torch.bfloat16,torch.float8_e4m3fnuz,torch.float8_e4m3fnuz,QuantType.per_Token,1,0,64,0,622.9,moe_ck2stages_gemm1_256x64x64x128_1x4_MulABScale_v1_Nswizzle0_Quant2_MulRoutedWeight0_swiglu_F8_F8_B16,0.0%,372.34,1575.64,0
stage1,80,4096,6144,384,128,4,ActivationType.Swiglu,torch.bfloat16,torch.float8_e4m3fnuz,torch.float8_e4m3fnuz,QuantType.per_Token,1,0,64,0,698.0208,moe_ck2stages_gemm1_256x64x128x256_1x4_MulABScale_v3_Nswizzle0_Quant2_MulRoutedWeight0_swiglu_F8_F8_B16,0.0%,332.27,1406.07,0
stage1,80,4096,6144,384,128,4,ActivationType.Swiglu,torch.bfloat16,torch.float8_e4m3fnuz,torch.float8_e4m3fnuz,QuantType.per_Token,1,0,64,0,607.8685,moe_ck2stages_gemm1_256x64x128x128_1x4_MulABScale_v3_Nswizzle0_Quant2_MulRoutedWeight0_swiglu_F8_F8_B16,0.0%,381.54,1614.6,0
stage2,80,4096,6144,384,128,4,ActivationType.Swiglu,torch.bfloat16,torch.float8_e4m3fnuz,torch.float8_e4m3fnuz,QuantType.per_Token,1,0,64,0,-1.0,moe_ck2stages_gemm2_256x64x64x256_1x4_MulABScaleExpertWeight_v1_Nswizzle0_Quant2_MulRoutedWeight1_F8_F8_B16,100.0%,0.0,0.0,0
stage2,80,4096,6144,384,128,4,ActivationType.Swiglu,torch.bfloat16,torch.float8_e4m3fnuz,torch.float8_e4m3fnuz,QuantType.per_Token,1,0,64,0,-1.0,moe_ck2stages_gemm2_256x64x128x256_1x4_MulABScaleExpertWeight_v3_Nswizzle0_Quant2_MulRoutedWeight1_F8_F8_B16,100.0%,0.0,0.0,0
stage2,80,4096,6144,384,128,4,ActivationType.Swiglu,torch.bfloat16,torch.float8_e4m3fnuz,torch.float8_e4m3fnuz,QuantType.per_Token,1,0,64,0,1209.854,moe_ck2stages_gemm2_256x64x128x128_1x4_MulABScaleExpertWeight_v3_Nswizzle0_Quant2_MulRoutedWeight1_F8_F8_B16,2.9%,191.7,811.23,0
stage2,80,4096,6144,384,128,4,ActivationType.Swiglu,torch.bfloat16,torch.float8_e4m3fnuz,torch.float8_e4m3fnuz,QuantType.per_Token,1,0,64,0,1652.4764,moe_ck2stages_gemm2_256x64x128x64_1x4_MulABScaleExpertWeight_v3_Nswizzle0_Quant2_MulRoutedWeight1_F8_F8_B16,99.6%,140.35,593.94,0
stage2,80,4096,6144,384,128,4,ActivationType.Swiglu,torch.bfloat16,torch.float8_e4m3fnuz,torch.float8_e4m3fnuz,QuantType.per_Token,1,0,64,0,1435.8691,moe_ck2stages_gemm2_256x64x64x64_1x4_MulABScaleExpertWeight_v1_Nswizzle0_Quant2_MulRoutedWeight1_F8_F8_B16,99.6%,161.52,683.54,0
stage1,80,4096,6144,384,128,4,ActivationType.Swiglu,torch.bfloat16,torch.float8_e4m3fnuz,torch.float8_e4m3fnuz,QuantType.per_Token,1,0,128,0,780.961,moe_ck2stages_gemm1_256x128x64x128_1x4_MulABScale_v1_Nswizzle0_Quant2_MulRoutedWeight0_swiglu_F8_F8_B16,0.0%,296.98,1256.74,0
stage1,80,4096,6144,384,128,4,ActivationType.Swiglu,torch.bfloat16,torch.float8_e4m3fnuz,torch.float8_e4m3fnuz,QuantType.per_Token,1,0,128,0,862.9331,moe_ck2stages_gemm1_256x128x128x256_1x4_MulABScale_v3_Nswizzle0_Quant2_MulRoutedWeight0_swiglu_F8_F8_B16,0.0%,268.77,1137.36,0
stage1,80,4096,6144,384,128,4,ActivationType.Swiglu,torch.bfloat16,torch.float8_e4m3fnuz,torch.float8_e4m3fnuz,QuantType.per_Token,1,0,128,0,856.4756,moe_ck2stages_gemm1_256x128x128x128_1x4_MulABScale_v3_Nswizzle0_Quant2_MulRoutedWeight0_swiglu_F8_F8_B16,0.0%,270.79,1145.94,0
stage2,80,4096,6144,384,128,4,ActivationType.Swiglu,torch.bfloat16,torch.float8_e4m3fnuz,torch.float8_e4m3fnuz,QuantType.per_Token,1,0,128,0,1592.6128,moe_ck2stages_gemm2_256x128x64x128_1x4_MulABScaleExpertWeight_v1_Nswizzle0_Quant2_MulRoutedWeight1_F8_F8_B16,2.9%,145.63,616.26,0
stage2,80,4096,6144,384,128,4,ActivationType.Swiglu,torch.bfloat16,torch.float8_e4m3fnuz,torch.float8_e4m3fnuz,QuantType.per_Token,1,0,128,0,1231.47,moe_ck2stages_gemm2_256x128x128x128_1x4_MulABScaleExpertWeight_v3_Nswizzle0_Quant2_MulRoutedWeight1_F8_F8_B16,2.9%,188.33,796.99,0
stage2,80,4096,6144,384,128,4,ActivationType.Swiglu,torch.bfloat16,torch.float8_e4m3fnuz,torch.float8_e4m3fnuz,QuantType.per_Token,1,0,128,0,1633.3172,moe_ck2stages_gemm2_256x128x128x64_1x4_MulABScaleExpertWeight_v3_Nswizzle0_Quant2_MulRoutedWeight1_F8_F8_B16,99.6%,142.0,600.9,0
stage2,80,4096,6144,384,128,4,ActivationType.Swiglu,torch.bfloat16,torch.float8_e4m3fnuz,torch.float8_e4m3fnuz,QuantType.per_Token,1,0,128,0,1716.4072,moe_ck2stages_gemm2_256x128x64x64_1x4_MulABScaleExpertWeight_v3_Nswizzle0_Quant2_MulRoutedWeight1_F8_F8_B16,99.6%,135.12,571.81,0
stage1,80,8192,6144,384,128,4,ActivationType.Swiglu,torch.bfloat16,torch.float8_e4m3fnuz,torch.float8_e4m3fnuz,QuantType.per_Token,1,0,16,0,1808.8297,_ZN5aiter48fmoe_stage1_bf16_pertokenFp8_g1u1_16x128_4tg_pf2E,97.9%,256.44,584.34,0
stage1,80,8192,6144,384,128,4,ActivationType.Swiglu,torch.bfloat16,torch.float8_e4m3fnuz,torch.float8_e4m3fnuz,QuantType.per_Token,1,0,16,0,1804.6661,_ZN5aiter48fmoe_stage1_bf16_pertokenFp8_g1u1_16x128_4tg_pf3E,97.9%,257.03,585.68,0
stage1,80,8192,6144,384,128,4,ActivationType.Swiglu,torch.bfloat16,torch.float8_e4m3fnuz,torch.float8_e4m3fnuz,QuantType.per_Token,1,0,16,0,-1.0,_ZN5aiter48fmoe_stage1_bf16_pertokenFp8_g1u1_16x256_3tg_pf2E,100.0%,0.0,0.0,0
stage1,80,8192,6144,384,128,4,ActivationType.Swiglu,torch.bfloat16,torch.float8_e4m3fnuz,torch.float8_e4m3fnuz,QuantType.per_Token,1,0,16,0,-1.0,_ZN5aiter48fmoe_stage1_bf16_pertokenFp8_g1u1_16x256_2tg_pf3E,100.0%,0.0,0.0,0
stage1,80,8192,6144,384,128,4,ActivationType.Swiglu,torch.bfloat16,torch.float8_e4m3fnuz,torch.float8_e4m3fnuz,QuantType.per_Token,1,0,16,0,-1.0,_ZN5aiter48fmoe_stage1_bf16_pertokenFp8_g1u1_16x512_2tg_pf2E,100.0%,0.0,0.0,0
stage1,80,8192,6144,384,128,4,ActivationType.Swiglu,torch.bfloat16,torch.float8_e4m3fnuz,torch.float8_e4m3fnuz,QuantType.per_Token,1,0,16,0,-1.0,_ZN5aiter44fmoe_stage1_bf16_pertokenFp8_g1u1_16x512_pf3E,100.0%,0.0,0.0,0
stage1,80,8192,6144,384,128,4,ActivationType.Swiglu,torch.bfloat16,torch.float8_e4m3fnuz,torch.float8_e4m3fnuz,QuantType.per_Token,1,0,16,0,1968.0464,_ZN5aiter47fmoe_stage1_bf16_pertokenFp8_g1u1_16x64_6tg_pf2E,97.9%,235.69,537.06,0
stage1,80,8192,6144,384,128,4,ActivationType.Swiglu,torch.bfloat16,torch.float8_e4m3fnuz,torch.float8_e4m3fnuz,QuantType.per_Token,1,0,16,0,1936.5982,_ZN5aiter47fmoe_stage1_bf16_pertokenFp8_g1u1_16x64_5tg_pf3E,97.9%,239.52,545.78,0
stage1,80,8192,6144,384,128,4,ActivationType.Swiglu,torch.bfloat16,torch.float8_e4m3fnuz,torch.float8_e4m3fnuz,QuantType.per_Token,1,0,32,0,1157.5595,_ZN5aiter48fmoe_stage1_bf16_pertokenFp8_g1u1_32x128_3tg_pf2E,97.9%,400.72,913.1,0
stage1,80,8192,6144,384,128,4,ActivationType.Swiglu,torch.bfloat16,torch.float8_e4m3fnuz,torch.float8_e4m3fnuz,QuantType.per_Token,1,0,32,0,1128.1115,_ZN5aiter48fmoe_stage1_bf16_pertokenFp8_g1u1_32x128_3tg_pf3E,97.9%,411.18,936.93,0
stage1,80,8192,6144,384,128,4,ActivationType.Swiglu,torch.bfloat16,torch.float8_e4m3fnuz,torch.float8_e4m3fnuz,QuantType.per_Token,1,0,32,0,-1.0,_ZN5aiter48fmoe_stage1_bf16_pertokenFp8_g1u1_32x256_2tg_pf2E,100.0%,0.0,0.0,0
stage1,80,8192,6144,384,128,4,ActivationType.Swiglu,torch.bfloat16,torch.float8_e4m3fnuz,torch.float8_e4m3fnuz,QuantType.per_Token,1,0,32,0,-1.0,_ZN5aiter48fmoe_stage1_bf16_pertokenFp8_g1u1_32x256_2tg_pf3E,100.0%,0.0,0.0,0
stage1,80,8192,6144,384,128,4,ActivationType.Swiglu,torch.bfloat16,torch.float8_e4m3fnuz,torch.float8_e4m3fnuz,QuantType.per_Token,1,0,32,0,-1.0,_ZN5aiter44fmoe_stage1_bf16_pertokenFp8_g1u1_32x512_pf2E,100.0%,0.0,0.0,0
stage1,80,8192,6144,384,128,4,ActivationType.Swiglu,torch.bfloat16,torch.float8_e4m3fnuz,torch.float8_e4m3fnuz,QuantType.per_Token,1,0,32,0,-1.0,_ZN5aiter44fmoe_stage1_bf16_pertokenFp8_g1u1_32x512_pf3E,100.0%,0.0,0.0,0
stage1,80,8192,6144,384,128,4,ActivationType.Swiglu,torch.bfloat16,torch.float8_e4m3fnuz,torch.float8_e4m3fnuz,QuantType.per_Token,1,0,32,0,1360.1541,_ZN5aiter47fmoe_stage1_bf16_pertokenFp8_g1u1_32x64_4tg_pf2E,97.9%,341.03,777.09,0
stage1,80,8192,6144,384,128,4,ActivationType.Swiglu,torch.bfloat16,torch.float8_e4m3fnuz,torch.float8_e4m3fnuz,QuantType.per_Token,1,0,32,0,1287.8586,_ZN5aiter47fmoe_stage1_bf16_pertokenFp8_g1u1_32x64_4tg_pf3E,97.9%,360.18,820.71,0
stage1,80,8192,6144,384,128,4,ActivationType.Swiglu,torch.bfloat16,torch.float8_e4m3fnuz,torch.float8_e4m3fnuz,QuantType.per_Token,1,0,64,0,975.1075,_ZN5aiter48fmoe_stage1_bf16_pertokenFp8_g1u1_64x128_2tg_pf2E,97.9%,475.7,1083.95,0
stage1,80,8192,6144,384,128,4,ActivationType.Swiglu,torch.bfloat16,torch.float8_e4m3fnuz,torch.float8_e4m3fnuz,QuantType.per_Token,1,0,64,0,925.7788,_ZN5aiter48fmoe_stage1_bf16_pertokenFp8_g1u1_64x128_2tg_pf3E,97.9%,501.04,1141.7,0
stage1,80,8192,6144,384,128,4,ActivationType.Swiglu,torch.bfloat16,torch.float8_e4m3fnuz,torch.float8_e4m3fnuz,QuantType.per_Token,1,0,64,0,-1.0,_ZN5aiter44fmoe_stage1_bf16_pertokenFp8_g1u1_64x256_pf2E,100.0%,0.0,0.0,0
stage1,80,8192,6144,384,128,4,ActivationType.Swiglu,torch.bfloat16,torch.float8_e4m3fnuz,torch.float8_e4m3fnuz,QuantType.per_Token,1,0,64,0,-1.0,_ZN5aiter44fmoe_stage1_bf16_pertokenFp8_g1u1_64x256_pf3E,100.0%,0.0,0.0,0
stage1,80,8192,6144,384,128,4,ActivationType.Swiglu,torch.bfloat16,torch.float8_e4m3fnuz,torch.float8_e4m3fnuz,QuantType.per_Token,1,0,64,0,1120.6792,_ZN5aiter47fmoe_stage1_bf16_pertokenFp8_g1u1_64x64_3tg_pf2E,97.9%,413.91,943.15,0
stage1,80,8192,6144,384,128,4,ActivationType.Swiglu,torch.bfloat16,torch.float8_e4m3fnuz,torch.float8_e4m3fnuz,QuantType.per_Token,1,0,64,0,1090.166,_ZN5aiter47fmoe_stage1_bf16_pertokenFp8_g1u1_64x64_2tg_pf3E,97.9%,425.49,969.54,0
stage1,80,8192,6144,384,128,4,ActivationType.Swiglu,torch.bfloat16,torch.float8_e4m3fnuz,torch.float8_e4m3fnuz,QuantType.per_Token,1,0,128,0,1026.7309,_ZN5aiter45fmoe_stage1_bf16_pertokenFp8_g1u1_128x128_pf2E,97.9%,451.78,1029.45,0
stage1,80,8192,6144,384,128,4,ActivationType.Swiglu,torch.bfloat16,torch.float8_e4m3fnuz,torch.float8_e4m3fnuz,QuantType.per_Token,1,0,128,0,1015.1394,_ZN5aiter45fmoe_stage1_bf16_pertokenFp8_g1u1_128x128_pf3E,97.9%,456.94,1041.2,0
stage1,80,8192,6144,384,128,4,ActivationType.Swiglu,torch.bfloat16,torch.float8_e4m3fnuz,torch.float8_e4m3fnuz,QuantType.per_Token,1,0,128,0,1572.7374,_ZN5aiter44fmoe_stage1_bf16_pertokenFp8_g1u1_128x64_pf2E,97.9%,294.94,672.05,0
stage1,80,8192,6144,384,128,4,ActivationType.Swiglu,torch.bfloat16,torch.float8_e4m3fnuz,torch.float8_e4m3fnuz,QuantType.per_Token,1,0,128,0,1256.1532,_ZN5aiter44fmoe_stage1_bf16_pertokenFp8_g1u1_128x64_pf3E,97.9%,369.27,841.43,0
stage1,80,8192,6144,384,128,4,ActivationType.Swiglu,torch.bfloat16,torch.float8_e4m3fnuz,torch.float8_e4m3fnuz,QuantType.per_Token,1,0,16,0,1934.5916,moe_ck2stages_gemm1_128x16x64x128_1x2_MulABScale_v1_Nswizzle0_Quant2_MulRoutedWeight0_swiglu_F8_F8_B16,0.0%,239.77,546.35,0
stage1,80,8192,6144,384,128,4,ActivationType.Swiglu,torch.bfloat16,torch.float8_e4m3fnuz,torch.float8_e4m3fnuz,QuantType.per_Token,1,0,16,0,1692.977,moe_ck2stages_gemm1_256x16x128x256_1x4_MulABScale_v1_Nswizzle0_Quant2_MulRoutedWeight0_swiglu_F8_F8_B16,0.0%,273.99,624.32,0
stage1,80,8192,6144,384,128,4,ActivationType.Swiglu,torch.bfloat16,torch.float8_e4m3fnuz,torch.float8_e4m3fnuz,QuantType.per_Token,1,0,16,0,1794.9621,moe_ck2stages_gemm1_256x16x64x256_1x4_MulABScale_v1_Nswizzle0_Quant2_MulRoutedWeight0_swiglu_F8_F8_B16,0.0%,258.42,588.85,0
stage2,80,8192,6144,384,128,4,ActivationType.Swiglu,torch.bfloat16,torch.float8_e4m3fnuz,torch.float8_e4m3fnuz,QuantType.per_Token,1,0,16,0,-1.0,moe_ck2stages_gemm2_256x16x128x256_1x4_MulABScaleExpertWeight_v1_Nswizzle0_Quant2_MulRoutedWeight1_F8_F8_B16,100.0%,0.0,0.0,0
stage2,80,8192,6144,384,128,4,ActivationType.Swiglu,torch.bfloat16,torch.float8_e4m3fnuz,torch.float8_e4m3fnuz,QuantType.per_Token,1,0,16,0,2186.2741,moe_ck2stages_gemm2_128x16x128x128_1x2_MulABScaleExpertWeight_v1_Nswizzle0_Quant2_MulRoutedWeight1_F8_F8_B16,2.9%,212.17,483.45,0
stage2,80,8192,6144,384,128,4,ActivationType.Swiglu,torch.bfloat16,torch.float8_e4m3fnuz,torch.float8_e4m3fnuz,QuantType.per_Token,1,0,16,0,2471.9955,moe_ck2stages_gemm2_64x16x64x64_1x1_MulABScaleExpertWeight_v1_Nswizzle0_Quant2_MulRoutedWeight1_F8_F8_B16,2.9%,187.64,427.58,0
stage1,80,8192,6144,384,128,4,ActivationType.Swiglu,torch.bfloat16,torch.float8_e4m3fnuz,torch.float8_e4m3fnuz,QuantType.per_Token,1,0,32,0,1188.1767,moe_ck2stages_gemm1_256x32x64x256_1x4_MulABScale_v1_Nswizzle0_Quant2_MulRoutedWeight0_swiglu_F8_F8_B16,0.0%,390.39,889.57,0
stage1,80,8192,6144,384,128,4,ActivationType.Swiglu,torch.bfloat16,torch.float8_e4m3fnuz,torch.float8_e4m3fnuz,QuantType.per_Token,1,0,32,0,1274.7588,moe_ck2stages_gemm1_256x32x64x128_1x4_MulABScale_v1_Nswizzle0_Quant2_MulRoutedWeight0_swiglu_F8_F8_B16,0.0%,363.88,829.15,0
stage2,80,8192,6144,384,128,4,ActivationType.Swiglu,torch.bfloat16,torch.float8_e4m3fnuz,torch.float8_e4m3fnuz,QuantType.per_Token,1,0,32,0,-1.0,moe_ck2stages_gemm2_256x32x64x256_1x4_MulABScaleExpertWeight_v1_Nswizzle0_Quant2_MulRoutedWeight1_F8_F8_B16,100.0%,0.0,0.0,0
stage2,80,8192,6144,384,128,4,ActivationType.Swiglu,torch.bfloat16,torch.float8_e4m3fnuz,torch.float8_e4m3fnuz,QuantType.per_Token,1,0,32,0,1719.1475,moe_ck2stages_gemm2_256x32x64x128_1x4_MulABScaleExpertWeight_v1_Nswizzle0_Quant2_MulRoutedWeight1_F8_F8_B16,2.9%,269.82,614.82,0
stage2,80,8192,6144,384,128,4,ActivationType.Swiglu,torch.bfloat16,torch.float8_e4m3fnuz,torch.float8_e4m3fnuz,QuantType.per_Token,1,0,32,0,2609.0653,moe_ck2stages_gemm2_256x32x64x64_1x4_MulABScaleExpertWeight_v1_Nswizzle0_Quant2_MulRoutedWeight1_F8_F8_B16,99.6%,177.79,405.11,0
stage1,80,8192,6144,384,128,4,ActivationType.Swiglu,torch.bfloat16,torch.float8_e4m3fnuz,torch.float8_e4m3fnuz,QuantType.per_Token,1,0,64,0,1193.8964,moe_ck2stages_gemm1_256x64x64x256_1x4_MulABScale_v1_Nswizzle0_Quant2_MulRoutedWeight0_swiglu_F8_F8_B16,0.0%,388.52,885.31,0
stage1,80,8192,6144,384,128,4,ActivationType.Swiglu,torch.bfloat16,torch.float8_e4m3fnuz,torch.float8_e4m3fnuz,QuantType.per_Token,1,0,64,0,1100.2343,moe_ck2stages_gemm1_256x64x64x128_1x4_MulABScale_v1_Nswizzle0_Quant2_MulRoutedWeight0_swiglu_F8_F8_B16,0.0%,421.6,960.67,0
stage1,80,8192,6144,384,128,4,ActivationType.Swiglu,torch.bfloat16,torch.float8_e4m3fnuz,torch.float8_e4m3fnuz,QuantType.per_Token,1,0,64,0,1273.6517,moe_ck2stages_gemm1_256x64x128x256_1x4_MulABScale_v3_Nswizzle0_Quant2_MulRoutedWeight0_swiglu_F8_F8_B16,0.0%,364.19,829.87,0
stage1,80,8192,6144,384,128,4,ActivationType.Swiglu,torch.bfloat16,torch.float8_e4m3fnuz,torch.float8_e4m3fnuz,QuantType.per_Token,1,0,64,0,1090.9306,moe_ck2stages_gemm1_256x64x128x128_1x4_MulABScale_v3_Nswizzle0_Quant2_MulRoutedWeight0_swiglu_F8_F8_B16,0.0%,425.19,968.87,0
stage2,80,8192,6144,384,128,4,ActivationType.Swiglu,torch.bfloat16,torch.float8_e4m3fnuz,torch.float8_e4m3fnuz,QuantType.per_Token,1,0,64,0,-1.0,moe_ck2stages_gemm2_256x64x64x256_1x4_MulABScaleExpertWeight_v1_Nswizzle0_Quant2_MulRoutedWeight1_F8_F8_B16,100.0%,0.0,0.0,0
stage2,80,8192,6144,384,128,4,ActivationType.Swiglu,torch.bfloat16,torch.float8_e4m3fnuz,torch.float8_e4m3fnuz,QuantType.per_Token,1,0,64,0,-1.0,moe_ck2stages_gemm2_256x64x128x256_1x4_MulABScaleExpertWeight_v3_Nswizzle0_Quant2_MulRoutedWeight1_F8_F8_B16,100.0%,0.0,0.0,0
stage2,80,8192,6144,384,128,4,ActivationType.Swiglu,torch.bfloat16,torch.float8_e4m3fnuz,torch.float8_e4m3fnuz,QuantType.per_Token,1,0,64,0,2233.7963,moe_ck2stages_gemm2_256x64x128x128_1x4_MulABScaleExpertWeight_v3_Nswizzle0_Quant2_MulRoutedWeight1_F8_F8_B16,2.9%,207.65,473.17,0
stage2,80,8192,6144,384,128,4,ActivationType.Swiglu,torch.bfloat16,torch.float8_e4m3fnuz,torch.float8_e4m3fnuz,QuantType.per_Token,1,0,64,0,2987.729,moe_ck2stages_gemm2_256x64x128x64_1x4_MulABScaleExpertWeight_v3_Nswizzle0_Quant2_MulRoutedWeight1_F8_F8_B16,99.6%,155.25,353.77,0
stage2,80,8192,6144,384,128,4,ActivationType.Swiglu,torch.bfloat16,torch.float8_e4m3fnuz,torch.float8_e4m3fnuz,QuantType.per_Token,1,0,64,0,2660.3139,moe_ck2stages_gemm2_256x64x64x64_1x4_MulABScaleExpertWeight_v1_Nswizzle0_Quant2_MulRoutedWeight1_F8_F8_B16,99.6%,174.36,397.31,0
stage1,80,8192,6144,384,128,4,ActivationType.Swiglu,torch.bfloat16,torch.float8_e4m3fnuz,torch.float8_e4m3fnuz,QuantType.per_Token,1,0,128,0,1255.242,moe_ck2stages_gemm1_256x128x64x128_1x4_MulABScale_v1_Nswizzle0_Quant2_MulRoutedWeight0_swiglu_F8_F8_B16,0.0%,369.54,842.04,0
stage1,80,8192,6144,384,128,4,ActivationType.Swiglu,torch.bfloat16,torch.float8_e4m3fnuz,torch.float8_e4m3fnuz,QuantType.per_Token,1,0,128,0,1303.7034,moe_ck2stages_gemm1_256x128x128x256_1x4_MulABScale_v3_Nswizzle0_Quant2_MulRoutedWeight0_swiglu_F8_F8_B16,0.0%,355.8,810.74,0
stage1,80,8192,6144,384,128,4,ActivationType.Swiglu,torch.bfloat16,torch.float8_e4m3fnuz,torch.float8_e4m3fnuz,QuantType.per_Token,1,0,128,0,1296.4862,moe_ck2stages_gemm1_256x128x128x128_1x4_MulABScale_v3_Nswizzle0_Quant2_MulRoutedWeight0_swiglu_F8_F8_B16,0.0%,357.78,815.25,0
stage2,80,8192,6144,384,128,4,ActivationType.Swiglu,torch.bfloat16,torch.float8_e4m3fnuz,torch.float8_e4m3fnuz,QuantType.per_Token,1,0,128,0,2806.5653,moe_ck2stages_gemm2_256x128x64x128_1x4_MulABScaleExpertWeight_v1_Nswizzle0_Quant2_MulRoutedWeight1_F8_F8_B16,2.9%,165.28,376.6,0
stage2,80,8192,6144,384,128,4,ActivationType.Swiglu,torch.bfloat16,torch.float8_e4m3fnuz,torch.float8_e4m3fnuz,QuantType.per_Token,1,0,128,0,2149.0741,moe_ck2stages_gemm2_256x128x128x128_1x4_MulABScaleExpertWeight_v3_Nswizzle0_Quant2_MulRoutedWeight1_F8_F8_B16,2.9%,215.84,491.82,0
stage2,80,8192,6144,384,128,4,ActivationType.Swiglu,torch.bfloat16,torch.float8_e4m3fnuz,torch.float8_e4m3fnuz,QuantType.per_Token,1,0,128,0,2812.3943,moe_ck2stages_gemm2_256x128x128x64_1x4_MulABScaleExpertWeight_v3_Nswizzle0_Quant2_MulRoutedWeight1_F8_F8_B16,99.6%,164.93,375.82,0
stage2,80,8192,6144,384,128,4,ActivationType.Swiglu,torch.bfloat16,torch.float8_e4m3fnuz,torch.float8_e4m3fnuz,QuantType.per_Token,1,0,128,0,2968.2837,moe_ck2stages_gemm2_256x128x64x64_1x4_MulABScaleExpertWeight_v3_Nswizzle0_Quant2_MulRoutedWeight1_F8_F8_B16,99.6%,156.27,356.09,0
stage1,80,16384,6144,384,128,4,ActivationType.Swiglu,torch.bfloat16,torch.float8_e4m3fnuz,torch.float8_e4m3fnuz,QuantType.per_Token,1,0,16,0,3461.0693,_ZN5aiter48fmoe_stage1_bf16_pertokenFp8_g1u1_16x128_4tg_pf2E,97.9%,268.04,349.01,0
stage1,80,16384,6144,384,128,4,ActivationType.Swiglu,torch.bfloat16,torch.float8_e4m3fnuz,torch.float8_e4m3fnuz,QuantType.per_Token,1,0,16,0,3464.5517,_ZN5aiter48fmoe_stage1_bf16_pertokenFp8_g1u1_16x128_4tg_pf3E,97.9%,267.77,348.66,0
stage1,80,16384,6144,384,128,4,ActivationType.Swiglu,torch.bfloat16,torch.float8_e4m3fnuz,torch.float8_e4m3fnuz,QuantType.per_Token,1,0,16,0,-1.0,_ZN5aiter48fmoe_stage1_bf16_pertokenFp8_g1u1_16x256_3tg_pf2E,100.0%,0.0,0.0,0
stage1,80,16384,6144,384,128,4,ActivationType.Swiglu,torch.bfloat16,torch.float8_e4m3fnuz,torch.float8_e4m3fnuz,QuantType.per_Token,1,0,16,0,-1.0,_ZN5aiter48fmoe_stage1_bf16_pertokenFp8_g1u1_16x256_2tg_pf3E,100.0%,0.0,0.0,0
stage1,80,16384,6144,384,128,4,ActivationType.Swiglu,torch.bfloat16,torch.float8_e4m3fnuz,torch.float8_e4m3fnuz,QuantType.per_Token,1,0,16,0,-1.0,_ZN5aiter48fmoe_stage1_bf16_pertokenFp8_g1u1_16x512_2tg_pf2E,100.0%,0.0,0.0,0
stage1,80,16384,6144,384,128,4,ActivationType.Swiglu,torch.bfloat16,torch.float8_e4m3fnuz,torch.float8_e4m3fnuz,QuantType.per_Token,1,0,16,0,-1.0,_ZN5aiter44fmoe_stage1_bf16_pertokenFp8_g1u1_16x512_pf3E,100.0%,0.0,0.0,0
stage1,80,16384,6144,384,128,4,ActivationType.Swiglu,torch.bfloat16,torch.float8_e4m3fnuz,torch.float8_e4m3fnuz,QuantType.per_Token,1,0,16,0,3758.6723,_ZN5aiter47fmoe_stage1_bf16_pertokenFp8_g1u1_16x64_6tg_pf2E,97.9%,246.82,321.38,0
stage1,80,16384,6144,384,128,4,ActivationType.Swiglu,torch.bfloat16,torch.float8_e4m3fnuz,torch.float8_e4m3fnuz,QuantType.per_Token,1,0,16,0,3740.0865,_ZN5aiter47fmoe_stage1_bf16_pertokenFp8_g1u1_16x64_5tg_pf3E,97.9%,248.05,322.98,0
stage1,80,16384,6144,384,128,4,ActivationType.Swiglu,torch.bfloat16,torch.float8_e4m3fnuz,torch.float8_e4m3fnuz,QuantType.per_Token,1,0,32,0,2171.4575,_ZN5aiter48fmoe_stage1_bf16_pertokenFp8_g1u1_32x128_3tg_pf2E,97.9%,427.23,556.29,0
stage1,80,16384,6144,384,128,4,ActivationType.Swiglu,torch.bfloat16,torch.float8_e4m3fnuz,torch.float8_e4m3fnuz,QuantType.per_Token,1,0,32,0,2126.8196,_ZN5aiter48fmoe_stage1_bf16_pertokenFp8_g1u1_32x128_3tg_pf3E,97.9%,436.2,567.97,0
stage1,80,16384,6144,384,128,4,ActivationType.Swiglu,torch.bfloat16,torch.float8_e4m3fnuz,torch.float8_e4m3fnuz,QuantType.per_Token,1,0,32,0,-1.0,_ZN5aiter48fmoe_stage1_bf16_pertokenFp8_g1u1_32x256_2tg_pf2E,100.0%,0.0,0.0,0
stage1,80,16384,6144,384,128,4,ActivationType.Swiglu,torch.bfloat16,torch.float8_e4m3fnuz,torch.float8_e4m3fnuz,QuantType.per_Token,1,0,32,0,-1.0,_ZN5aiter48fmoe_stage1_bf16_pertokenFp8_g1u1_32x256_2tg_pf3E,100.0%,0.0,0.0,0
stage1,80,16384,6144,384,128,4,ActivationType.Swiglu,torch.bfloat16,torch.float8_e4m3fnuz,torch.float8_e4m3fnuz,QuantType.per_Token,1,0,32,0,-1.0,_ZN5aiter44fmoe_stage1_bf16_pertokenFp8_g1u1_32x512_pf2E,100.0%,0.0,0.0,0
stage1,80,16384,6144,384,128,4,ActivationType.Swiglu,torch.bfloat16,torch.float8_e4m3fnuz,torch.float8_e4m3fnuz,QuantType.per_Token,1,0,32,0,-1.0,_ZN5aiter44fmoe_stage1_bf16_pertokenFp8_g1u1_32x512_pf3E,100.0%,0.0,0.0,0
stage1,80,16384,6144,384,128,4,ActivationType.Swiglu,torch.bfloat16,torch.float8_e4m3fnuz,torch.float8_e4m3fnuz,QuantType.per_Token,1,0,32,0,2545.353,_ZN5aiter47fmoe_stage1_bf16_pertokenFp8_g1u1_32x64_4tg_pf2E,97.9%,364.47,474.57,0
stage1,80,16384,6144,384,128,4,ActivationType.Swiglu,torch.bfloat16,torch.float8_e4m3fnuz,torch.float8_e4m3fnuz,QuantType.per_Token,1,0,32,0,2439.7843,_ZN5aiter47fmoe_stage1_bf16_pertokenFp8_g1u1_32x64_4tg_pf3E,97.9%,380.24,495.11,0
stage1,80,16384,6144,384,128,4,ActivationType.Swiglu,torch.bfloat16,torch.float8_e4m3fnuz,torch.float8_e4m3fnuz,QuantType.per_Token,1,0,64,0,1788.338,_ZN5aiter48fmoe_stage1_bf16_pertokenFp8_g1u1_64x128_2tg_pf2E,97.9%,518.76,675.46,0
stage1,80,16384,6144,384,128,4,ActivationType.Swiglu,torch.bfloat16,torch.float8_e4m3fnuz,torch.float8_e4m3fnuz,QuantType.per_Token,1,0,64,0,1724.4275,_ZN5aiter48fmoe_stage1_bf16_pertokenFp8_g1u1_64x128_2tg_pf3E,97.9%,537.98,700.5,0
stage1,80,16384,6144,384,128,4,ActivationType.Swiglu,torch.bfloat16,torch.float8_e4m3fnuz,torch.float8_e4m3fnuz,QuantType.per_Token,1,0,64,0,-1.0,_ZN5aiter44fmoe_stage1_bf16_pertokenFp8_g1u1_64x256_pf2E,100.0%,0.0,0.0,0
stage1,80,16384,6144,384,128,4,ActivationType.Swiglu,torch.bfloat16,torch.float8_e4m3fnuz,torch.float8_e4m3fnuz,QuantType.per_Token,1,0,64,0,-1.0,_ZN5aiter44fmoe_stage1_bf16_pertokenFp8_g1u1_64x256_pf3E,100.0%,0.0,0.0,0
stage1,80,16384,6144,384,128,4,ActivationType.Swiglu,torch.bfloat16,torch.float8_e4m3fnuz,torch.float8_e4m3fnuz,QuantType.per_Token,1,0,64,0,2054.581,_ZN5aiter47fmoe_stage1_bf16_pertokenFp8_g1u1_64x64_3tg_pf2E,97.9%,451.53,587.93,0
stage1,80,16384,6144,384,128,4,ActivationType.Swiglu,torch.bfloat16,torch.float8_e4m3fnuz,torch.float8_e4m3fnuz,QuantType.per_Token,1,0,64,0,2019.4787,_ZN5aiter47fmoe_stage1_bf16_pertokenFp8_g1u1_64x64_2tg_pf3E,97.9%,459.38,598.15,0
stage1,80,16384,6144,384,128,4,ActivationType.Swiglu,torch.bfloat16,torch.float8_e4m3fnuz,torch.float8_e4m3fnuz,QuantType.per_Token,1,0,128,0,1875.8612,_ZN5aiter45fmoe_stage1_bf16_pertokenFp8_g1u1_128x128_pf2E,97.9%,494.55,643.95,0
stage1,80,16384,6144,384,128,4,ActivationType.Swiglu,torch.bfloat16,torch.float8_e4m3fnuz,torch.float8_e4m3fnuz,QuantType.per_Token,1,0,128,0,1855.7397,_ZN5aiter45fmoe_stage1_bf16_pertokenFp8_g1u1_128x128_pf3E,97.9%,499.92,650.93,0
stage1,80,16384,6144,384,128,4,ActivationType.Swiglu,torch.bfloat16,torch.float8_e4m3fnuz,torch.float8_e4m3fnuz,QuantType.per_Token,1,0,128,0,2791.9616,_ZN5aiter44fmoe_stage1_bf16_pertokenFp8_g1u1_128x64_pf2E,97.9%,332.28,432.66,0
stage1,80,16384,6144,384,128,4,ActivationType.Swiglu,torch.bfloat16,torch.float8_e4m3fnuz,torch.float8_e4m3fnuz,QuantType.per_Token,1,0,128,0,2257.9972,_ZN5aiter44fmoe_stage1_bf16_pertokenFp8_g1u1_128x64_pf3E,97.9%,410.86,534.97,0
stage1,80,16384,6144,384,128,4,ActivationType.Swiglu,torch.bfloat16,torch.float8_e4m3fnuz,torch.float8_e4m3fnuz,QuantType.per_Token,1,0,16,0,3698.017,moe_ck2stages_gemm1_128x16x64x128_1x2_MulABScale_v1_Nswizzle0_Quant2_MulRoutedWeight0_swiglu_F8_F8_B16,0.0%,250.87,326.65,0
stage1,80,16384,6144,384,128,4,ActivationType.Swiglu,torch.bfloat16,torch.float8_e4m3fnuz,torch.float8_e4m3fnuz,QuantType.per_Token,1,0,16,0,3252.4373,moe_ck2stages_gemm1_256x16x128x256_1x4_MulABScale_v1_Nswizzle0_Quant2_MulRoutedWeight0_swiglu_F8_F8_B16,0.0%,285.24,371.4,0
stage1,80,16384,6144,384,128,4,ActivationType.Swiglu,torch.bfloat16,torch.float8_e4m3fnuz,torch.float8_e4m3fnuz,QuantType.per_Token,1,0,16,0,3470.2619,moe_ck2stages_gemm1_256x16x64x256_1x4_MulABScale_v1_Nswizzle0_Quant2_MulRoutedWeight0_swiglu_F8_F8_B16,0.0%,267.33,348.09,0
stage2,80,16384,6144,384,128,4,ActivationType.Swiglu,torch.bfloat16,torch.float8_e4m3fnuz,torch.float8_e4m3fnuz,QuantType.per_Token,1,0,16,0,-1.0,moe_ck2stages_gemm2_256x16x128x256_1x4_MulABScaleExpertWeight_v1_Nswizzle0_Quant2_MulRoutedWeight1_F8_F8_B16,100.0%,0.0,0.0,0
stage2,80,16384,6144,384,128,4,ActivationType.Swiglu,torch.bfloat16,torch.float8_e4m3fnuz,torch.float8_e4m3fnuz,QuantType.per_Token,1,0,16,0,4263.5843,moe_ck2stages_gemm2_128x16x128x128_1x2_MulABScaleExpertWeight_v1_Nswizzle0_Quant2_MulRoutedWeight1_F8_F8_B16,2.9%,217.59,283.32,0
stage2,80,16384,6144,384,128,4,ActivationType.Swiglu,torch.bfloat16,torch.float8_e4m3fnuz,torch.float8_e4m3fnuz,QuantType.per_Token,1,0,16,0,4970.4651,moe_ck2stages_gemm2_64x16x64x64_1x1_MulABScaleExpertWeight_v1_Nswizzle0_Quant2_MulRoutedWeight1_F8_F8_B16,2.9%,186.65,243.03,0
stage1,80,16384,6144,384,128,4,ActivationType.Swiglu,torch.bfloat16,torch.float8_e4m3fnuz,torch.float8_e4m3fnuz,QuantType.per_Token,1,0,32,0,2279.3308,moe_ck2stages_gemm1_256x32x64x256_1x4_MulABScale_v1_Nswizzle0_Quant2_MulRoutedWeight0_swiglu_F8_F8_B16,0.0%,407.01,529.96,0
stage1,80,16384,6144,384,128,4,ActivationType.Swiglu,torch.bfloat16,torch.float8_e4m3fnuz,torch.float8_e4m3fnuz,QuantType.per_Token,1,0,32,0,2409.2027,moe_ck2stages_gemm1_256x32x64x128_1x4_MulABScale_v1_Nswizzle0_Quant2_MulRoutedWeight0_swiglu_F8_F8_B16,0.0%,385.07,501.39,0
stage2,80,16384,6144,384,128,4,ActivationType.Swiglu,torch.bfloat16,torch.float8_e4m3fnuz,torch.float8_e4m3fnuz,QuantType.per_Token,1,0,32,0,-1.0,moe_ck2stages_gemm2_256x32x64x256_1x4_MulABScaleExpertWeight_v1_Nswizzle0_Quant2_MulRoutedWeight1_F8_F8_B16,100.0%,0.0,0.0,0
stage2,80,16384,6144,384,128,4,ActivationType.Swiglu,torch.bfloat16,torch.float8_e4m3fnuz,torch.float8_e4m3fnuz,QuantType.per_Token,1,0,32,0,3404.7902,moe_ck2stages_gemm2_256x32x64x128_1x4_MulABScaleExpertWeight_v1_Nswizzle0_Quant2_MulRoutedWeight1_F8_F8_B16,2.9%,272.47,354.78,0
stage2,80,16384,6144,384,128,4,ActivationType.Swiglu,torch.bfloat16,torch.float8_e4m3fnuz,torch.float8_e4m3fnuz,QuantType.per_Token,1,0,32,0,5115.8157,moe_ck2stages_gemm2_256x32x64x64_1x4_MulABScaleExpertWeight_v1_Nswizzle0_Quant2_MulRoutedWeight1_F8_F8_B16,99.6%,181.34,236.12,0
stage1,80,16384,6144,384,128,4,ActivationType.Swiglu,torch.bfloat16,torch.float8_e4m3fnuz,torch.float8_e4m3fnuz,QuantType.per_Token,1,0,64,0,2260.9221,moe_ck2stages_gemm1_256x64x64x256_1x4_MulABScale_v1_Nswizzle0_Quant2_MulRoutedWeight0_swiglu_F8_F8_B16,0.0%,410.33,534.28,0
stage1,80,16384,6144,384,128,4,ActivationType.Swiglu,torch.bfloat16,torch.float8_e4m3fnuz,torch.float8_e4m3fnuz,QuantType.per_Token,1,0,64,0,2067.2817,moe_ck2stages_gemm1_256x64x64x128_1x4_MulABScale_v1_Nswizzle0_Quant2_MulRoutedWeight0_swiglu_F8_F8_B16,0.0%,448.76,584.32,0
stage1,80,16384,6144,384,128,4,ActivationType.Swiglu,torch.bfloat16,torch.float8_e4m3fnuz,torch.float8_e4m3fnuz,QuantType.per_Token,1,0,64,0,2368.9336,moe_ck2stages_gemm1_256x64x128x256_1x4_MulABScale_v3_Nswizzle0_Quant2_MulRoutedWeight0_swiglu_F8_F8_B16,0.0%,391.62,509.92,0
stage1,80,16384,6144,384,128,4,ActivationType.Swiglu,torch.bfloat16,torch.float8_e4m3fnuz,torch.float8_e4m3fnuz,QuantType.per_Token,1,0,64,0,2030.3045,moe_ck2stages_gemm1_256x64x128x128_1x4_MulABScale_v3_Nswizzle0_Quant2_MulRoutedWeight0_swiglu_F8_F8_B16,0.0%,456.93,594.96,0
stage2,80,16384,6144,384,128,4,ActivationType.Swiglu,torch.bfloat16,torch.float8_e4m3fnuz,torch.float8_e4m3fnuz,QuantType.per_Token,1,0,64,0,-1.0,moe_ck2stages_gemm2_256x64x64x256_1x4_MulABScaleExpertWeight_v1_Nswizzle0_Quant2_MulRoutedWeight1_F8_F8_B16,100.0%,0.0,0.0,0
stage2,80,16384,6144,384,128,4,ActivationType.Swiglu,torch.bfloat16,torch.float8_e4m3fnuz,torch.float8_e4m3fnuz,QuantType.per_Token,1,0,64,0,-1.0,moe_ck2stages_gemm2_256x64x128x256_1x4_MulABScaleExpertWeight_v3_Nswizzle0_Quant2_MulRoutedWeight1_F8_F8_B16,100.0%,0.0,0.0,0
stage2,80,16384,6144,384,128,4,ActivationType.Swiglu,torch.bfloat16,torch.float8_e4m3fnuz,torch.float8_e4m3fnuz,QuantType.per_Token,1,0,64,0,4304.4564,moe_ck2stages_gemm2_256x64x128x128_1x4_MulABScaleExpertWeight_v3_Nswizzle0_Quant2_MulRoutedWeight1_F8_F8_B16,2.9%,215.52,280.63,0
stage2,80,16384,6144,384,128,4,ActivationType.Swiglu,torch.bfloat16,torch.float8_e4m3fnuz,torch.float8_e4m3fnuz,QuantType.per_Token,1,0,64,0,5678.4551,moe_ck2stages_gemm2_256x64x128x64_1x4_MulABScaleExpertWeight_v3_Nswizzle0_Quant2_MulRoutedWeight1_F8_F8_B16,99.6%,163.37,212.73,0
stage2,80,16384,6144,384,128,4,ActivationType.Swiglu,torch.bfloat16,torch.float8_e4m3fnuz,torch.float8_e4m3fnuz,QuantType.per_Token,1,0,64,0,5116.0613,moe_ck2stages_gemm2_256x64x64x64_1x4_MulABScaleExpertWeight_v1_Nswizzle0_Quant2_MulRoutedWeight1_F8_F8_B16,99.6%,181.33,236.11,0
stage1,80,16384,6144,384,128,4,ActivationType.Swiglu,torch.bfloat16,torch.float8_e4m3fnuz,torch.float8_e4m3fnuz,QuantType.per_Token,1,0,128,0,2232.463,moe_ck2stages_gemm1_256x128x64x128_1x4_MulABScale_v1_Nswizzle0_Quant2_MulRoutedWeight0_swiglu_F8_F8_B16,0.0%,415.56,541.09,0
stage1,80,16384,6144,384,128,4,ActivationType.Swiglu,torch.bfloat16,torch.float8_e4m3fnuz,torch.float8_e4m3fnuz,QuantType.per_Token,1,0,128,0,2396.3117,moe_ck2stages_gemm1_256x128x128x256_1x4_MulABScale_v3_Nswizzle0_Quant2_MulRoutedWeight0_swiglu_F8_F8_B16,0.0%,387.14,504.09,0
stage1,80,16384,6144,384,128,4,ActivationType.Swiglu,torch.bfloat16,torch.float8_e4m3fnuz,torch.float8_e4m3fnuz,QuantType.per_Token,1,0,128,0,2376.3825,moe_ck2stages_gemm1_256x128x128x128_1x4_MulABScale_v3_Nswizzle0_Quant2_MulRoutedWeight0_swiglu_F8_F8_B16,0.0%,390.39,508.32,0
stage2,80,16384,6144,384,128,4,ActivationType.Swiglu,torch.bfloat16,torch.float8_e4m3fnuz,torch.float8_e4m3fnuz,QuantType.per_Token,1,0,128,0,5268.9508,moe_ck2stages_gemm2_256x128x64x128_1x4_MulABScaleExpertWeight_v1_Nswizzle0_Quant2_MulRoutedWeight1_F8_F8_B16,2.9%,176.07,229.26,0
stage2,80,16384,6144,384,128,4,ActivationType.Swiglu,torch.bfloat16,torch.float8_e4m3fnuz,torch.float8_e4m3fnuz,QuantType.per_Token,1,0,128,0,4034.9935,moe_ck2stages_gemm2_256x128x128x128_1x4_MulABScaleExpertWeight_v3_Nswizzle0_Quant2_MulRoutedWeight1_F8_F8_B16,2.9%,229.92,299.37,0
stage2,80,16384,6144,384,128,4,ActivationType.Swiglu,torch.bfloat16,torch.float8_e4m3fnuz,torch.float8_e4m3fnuz,QuantType.per_Token,1,0,128,0,5252.3601,moe_ck2stages_gemm2_256x128x128x64_1x4_MulABScaleExpertWeight_v3_Nswizzle0_Quant2_MulRoutedWeight1_F8_F8_B16,99.6%,176.63,229.98,0
stage2,80,16384,6144,384,128,4,ActivationType.Swiglu,torch.bfloat16,torch.float8_e4m3fnuz,torch.float8_e4m3fnuz,QuantType.per_Token,1,0,128,0,5452.5978,moe_ck2stages_gemm2_256x128x64x64_1x4_MulABScaleExpertWeight_v3_Nswizzle0_Quant2_MulRoutedWeight1_F8_F8_B16,99.6%,170.14,221.54,0
stage1,80,32768,6144,384,128,4,ActivationType.Swiglu,torch.bfloat16,torch.float8_e4m3fnuz,torch.float8_e4m3fnuz,QuantType.per_Token,1,0,16,0,6777.3016,_ZN5aiter48fmoe_stage1_bf16_pertokenFp8_g1u1_16x128_4tg_pf2E,97.9%,273.77,222.8,0
stage1,80,32768,6144,384,128,4,ActivationType.Swiglu,torch.bfloat16,torch.float8_e4m3fnuz,torch.float8_e4m3fnuz,QuantType.per_Token,1,0,16,0,6806.4884,_ZN5aiter48fmoe_stage1_bf16_pertokenFp8_g1u1_16x128_4tg_pf3E,97.9%,272.6,221.84,0
stage1,80,32768,6144,384,128,4,ActivationType.Swiglu,torch.bfloat16,torch.float8_e4m3fnuz,torch.float8_e4m3fnuz,QuantType.per_Token,1,0,16,0,-1.0,_ZN5aiter48fmoe_stage1_bf16_pertokenFp8_g1u1_16x256_3tg_pf2E,100.0%,0.0,0.0,0
stage1,80,32768,6144,384,128,4,ActivationType.Swiglu,torch.bfloat16,torch.float8_e4m3fnuz,torch.float8_e4m3fnuz,QuantType.per_Token,1,0,16,0,-1.0,_ZN5aiter48fmoe_stage1_bf16_pertokenFp8_g1u1_16x256_2tg_pf3E,100.0%,0.0,0.0,0
stage1,80,32768,6144,384,128,4,ActivationType.Swiglu,torch.bfloat16,torch.float8_e4m3fnuz,torch.float8_e4m3fnuz,QuantType.per_Token,1,0,16,0,-1.0,_ZN5aiter48fmoe_stage1_bf16_pertokenFp8_g1u1_16x512_2tg_pf2E,100.0%,0.0,0.0,0
stage1,80,32768,6144,384,128,4,ActivationType.Swiglu,torch.bfloat16,torch.float8_e4m3fnuz,torch.float8_e4m3fnuz,QuantType.per_Token,1,0,16,0,-1.0,_ZN5aiter44fmoe_stage1_bf16_pertokenFp8_g1u1_16x512_pf3E,100.0%,0.0,0.0,0
stage1,80,32768,6144,384,128,4,ActivationType.Swiglu,torch.bfloat16,torch.float8_e4m3fnuz,torch.float8_e4m3fnuz,QuantType.per_Token,1,0,16,0,7351.7743,_ZN5aiter47fmoe_stage1_bf16_pertokenFp8_g1u1_16x64_6tg_pf2E,97.9%,252.38,205.39,0
stage1,80,32768,6144,384,128,4,ActivationType.Swiglu,torch.bfloat16,torch.float8_e4m3fnuz,torch.float8_e4m3fnuz,QuantType.per_Token,1,0,16,0,7392.3477,_ZN5aiter47fmoe_stage1_bf16_pertokenFp8_g1u1_16x64_5tg_pf3E,97.9%,250.99,204.26,0
stage1,80,32768,6144,384,128,4,ActivationType.Swiglu,torch.bfloat16,torch.float8_e4m3fnuz,torch.float8_e4m3fnuz,QuantType.per_Token,1,0,32,0,4168.7835,_ZN5aiter48fmoe_stage1_bf16_pertokenFp8_g1u1_32x128_3tg_pf2E,97.9%,445.08,362.2,0
stage1,80,32768,6144,384,128,4,ActivationType.Swiglu,torch.bfloat16,torch.float8_e4m3fnuz,torch.float8_e4m3fnuz,QuantType.per_Token,1,0,32,0,4093.4357,_ZN5aiter48fmoe_stage1_bf16_pertokenFp8_g1u1_32x128_3tg_pf3E,97.9%,453.27,368.87,0
stage1,80,32768,6144,384,128,4,ActivationType.Swiglu,torch.bfloat16,torch.float8_e4m3fnuz,torch.float8_e4m3fnuz,QuantType.per_Token,1,0,32,0,-1.0,_ZN5aiter48fmoe_stage1_bf16_pertokenFp8_g1u1_32x256_2tg_pf2E,100.0%,0.0,0.0,0
stage1,80,32768,6144,384,128,4,ActivationType.Swiglu,torch.bfloat16,torch.float8_e4m3fnuz,torch.float8_e4m3fnuz,QuantType.per_Token,1,0,32,0,-1.0,_ZN5aiter48fmoe_stage1_bf16_pertokenFp8_g1u1_32x256_2tg_pf3E,100.0%,0.0,0.0,0
stage1,80,32768,6144,384,128,4,ActivationType.Swiglu,torch.bfloat16,torch.float8_e4m3fnuz,torch.float8_e4m3fnuz,QuantType.per_Token,1,0,32,0,-1.0,_ZN5aiter44fmoe_stage1_bf16_pertokenFp8_g1u1_32x512_pf2E,100.0%,0.0,0.0,0
stage1,80,32768,6144,384,128,4,ActivationType.Swiglu,torch.bfloat16,torch.float8_e4m3fnuz,torch.float8_e4m3fnuz,QuantType.per_Token,1,0,32,0,-1.0,_ZN5aiter44fmoe_stage1_bf16_pertokenFp8_g1u1_32x512_pf3E,100.0%,0.0,0.0,0
stage1,80,32768,6144,384,128,4,ActivationType.Swiglu,torch.bfloat16,torch.float8_e4m3fnuz,torch.float8_e4m3fnuz,QuantType.per_Token,1,0,32,0,4897.9342,_ZN5aiter47fmoe_stage1_bf16_pertokenFp8_g1u1_32x64_4tg_pf2E,97.9%,378.82,308.28,0
stage1,80,32768,6144,384,128,4,ActivationType.Swiglu,torch.bfloat16,torch.float8_e4m3fnuz,torch.float8_e4m3fnuz,QuantType.per_Token,1,0,32,0,4747.769,_ZN5aiter47fmoe_stage1_bf16_pertokenFp8_g1u1_32x64_4tg_pf3E,97.9%,390.8,318.03,0
stage1,80,32768,6144,384,128,4,ActivationType.Swiglu,torch.bfloat16,torch.float8_e4m3fnuz,torch.float8_e4m3fnuz,QuantType.per_Token,1,0,64,0,3448.3621,_ZN5aiter48fmoe_stage1_bf16_pertokenFp8_g1u1_64x128_2tg_pf2E,97.9%,538.06,437.87,0
stage1,80,32768,6144,384,128,4,ActivationType.Swiglu,torch.bfloat16,torch.float8_e4m3fnuz,torch.float8_e4m3fnuz,QuantType.per_Token,1,0,64,0,3288.2266,_ZN5aiter48fmoe_stage1_bf16_pertokenFp8_g1u1_64x128_2tg_pf3E,97.9%,564.26,459.2,0
stage1,80,32768,6144,384,128,4,ActivationType.Swiglu,torch.bfloat16,torch.float8_e4m3fnuz,torch.float8_e4m3fnuz,QuantType.per_Token,1,0,64,0,-1.0,_ZN5aiter44fmoe_stage1_bf16_pertokenFp8_g1u1_64x256_pf2E,100.0%,0.0,0.0,0
stage1,80,32768,6144,384,128,4,ActivationType.Swiglu,torch.bfloat16,torch.float8_e4m3fnuz,torch.float8_e4m3fnuz,QuantType.per_Token,1,0,64,0,-1.0,_ZN5aiter44fmoe_stage1_bf16_pertokenFp8_g1u1_64x256_pf3E,100.0%,0.0,0.0,0
stage1,80,32768,6144,384,128,4,ActivationType.Swiglu,torch.bfloat16,torch.float8_e4m3fnuz,torch.float8_e4m3fnuz,QuantType.per_Token,1,0,64,0,3937.4766,_ZN5aiter47fmoe_stage1_bf16_pertokenFp8_g1u1_64x64_3tg_pf2E,97.9%,471.22,383.48,0
stage1,80,32768,6144,384,128,4,ActivationType.Swiglu,torch.bfloat16,torch.float8_e4m3fnuz,torch.float8_e4m3fnuz,QuantType.per_Token,1,0,64,0,3934.4183,_ZN5aiter47fmoe_stage1_bf16_pertokenFp8_g1u1_64x64_2tg_pf3E,97.9%,471.59,383.78,0
stage1,80,32768,6144,384,128,4,ActivationType.Swiglu,torch.bfloat16,torch.float8_e4m3fnuz,torch.float8_e4m3fnuz,QuantType.per_Token,1,0,128,0,3493.554,_ZN5aiter45fmoe_stage1_bf16_pertokenFp8_g1u1_128x128_pf2E,97.9%,531.1,432.21,0
stage1,80,32768,6144,384,128,4,ActivationType.Swiglu,torch.bfloat16,torch.float8_e4m3fnuz,torch.float8_e4m3fnuz,QuantType.per_Token,1,0,128,0,3468.4166,_ZN5aiter45fmoe_stage1_bf16_pertokenFp8_g1u1_128x128_pf3E,97.9%,534.95,435.34,0
stage1,80,32768,6144,384,128,4,ActivationType.Swiglu,torch.bfloat16,torch.float8_e4m3fnuz,torch.float8_e4m3fnuz,QuantType.per_Token,1,0,128,0,5269.9564,_ZN5aiter44fmoe_stage1_bf16_pertokenFp8_g1u1_128x64_pf2E,97.9%,352.08,286.52,0
stage1,80,32768,6144,384,128,4,ActivationType.Swiglu,torch.bfloat16,torch.float8_e4m3fnuz,torch.float8_e4m3fnuz,QuantType.per_Token,1,0,128,0,4254.5104,_ZN5aiter44fmoe_stage1_bf16_pertokenFp8_g1u1_128x64_pf3E,97.9%,436.11,354.91,0
stage1,80,32768,6144,384,128,4,ActivationType.Swiglu,torch.bfloat16,torch.float8_e4m3fnuz,torch.float8_e4m3fnuz,QuantType.per_Token,1,0,16,0,7246.0882,moe_ck2stages_gemm1_128x16x64x128_1x2_MulABScale_v1_Nswizzle0_Quant2_MulRoutedWeight0_swiglu_F8_F8_B16,0.0%,256.06,208.38,0
stage1,80,32768,6144,384,128,4,ActivationType.Swiglu,torch.bfloat16,torch.float8_e4m3fnuz,torch.float8_e4m3fnuz,QuantType.per_Token,1,0,16,0,6387.1906,moe_ck2stages_gemm1_256x16x128x256_1x4_MulABScale_v1_Nswizzle0_Quant2_MulRoutedWeight0_swiglu_F8_F8_B16,0.0%,290.49,236.4,0
stage1,80,32768,6144,384,128,4,ActivationType.Swiglu,torch.bfloat16,torch.float8_e4m3fnuz,torch.float8_e4m3fnuz,QuantType.per_Token,1,0,16,0,6863.4624,moe_ck2stages_gemm1_256x16x64x256_1x4_MulABScale_v1_Nswizzle0_Quant2_MulRoutedWeight0_swiglu_F8_F8_B16,0.0%,270.33,220.0,0
stage2,80,32768,6144,384,128,4,ActivationType.Swiglu,torch.bfloat16,torch.float8_e4m3fnuz,torch.float8_e4m3fnuz,QuantType.per_Token,1,0,16,0,-1.0,moe_ck2stages_gemm2_256x16x128x256_1x4_MulABScaleExpertWeight_v1_Nswizzle0_Quant2_MulRoutedWeight1_F8_F8_B16,100.0%,0.0,0.0,0
stage2,80,32768,6144,384,128,4,ActivationType.Swiglu,torch.bfloat16,torch.float8_e4m3fnuz,torch.float8_e4m3fnuz,QuantType.per_Token,1,0,16,0,8594.8583,moe_ck2stages_gemm2_128x16x128x128_1x2_MulABScaleExpertWeight_v1_Nswizzle0_Quant2_MulRoutedWeight1_F8_F8_B16,2.9%,215.88,175.68,0
stage2,80,32768,6144,384,128,4,ActivationType.Swiglu,torch.bfloat16,torch.float8_e4m3fnuz,torch.float8_e4m3fnuz,QuantType.per_Token,1,0,16,0,10405.3358,moe_ck2stages_gemm2_64x16x64x64_1x1_MulABScaleExpertWeight_v1_Nswizzle0_Quant2_MulRoutedWeight1_F8_F8_B16,2.9%,178.31,145.11,0
stage1,80,32768,6144,384,128,4,ActivationType.Swiglu,torch.bfloat16,torch.float8_e4m3fnuz,torch.float8_e4m3fnuz,QuantType.per_Token,1,0,32,0,4445.5833,moe_ck2stages_gemm1_256x32x64x256_1x4_MulABScale_v1_Nswizzle0_Quant2_MulRoutedWeight0_swiglu_F8_F8_B16,0.0%,417.36,339.65,0
stage1,80,32768,6144,384,128,4,ActivationType.Swiglu,torch.bfloat16,torch.float8_e4m3fnuz,torch.float8_e4m3fnuz,QuantType.per_Token,1,0,32,0,4668.4064,moe_ck2stages_gemm1_256x32x64x128_1x4_MulABScale_v1_Nswizzle0_Quant2_MulRoutedWeight0_swiglu_F8_F8_B16,0.0%,397.44,323.44,0
stage2,80,32768,6144,384,128,4,ActivationType.Swiglu,torch.bfloat16,torch.float8_e4m3fnuz,torch.float8_e4m3fnuz,QuantType.per_Token,1,0,32,0,-1.0,moe_ck2stages_gemm2_256x32x64x256_1x4_MulABScaleExpertWeight_v1_Nswizzle0_Quant2_MulRoutedWeight1_F8_F8_B16,100.0%,0.0,0.0,0
stage2,80,32768,6144,384,128,4,ActivationType.Swiglu,torch.bfloat16,torch.float8_e4m3fnuz,torch.float8_e4m3fnuz,QuantType.per_Token,1,0,32,0,6847.6455,moe_ck2stages_gemm2_256x32x64x128_1x4_MulABScaleExpertWeight_v1_Nswizzle0_Quant2_MulRoutedWeight1_F8_F8_B16,2.9%,270.96,220.51,0
stage2,80,32768,6144,384,128,4,ActivationType.Swiglu,torch.bfloat16,torch.float8_e4m3fnuz,torch.float8_e4m3fnuz,QuantType.per_Token,1,0,32,0,10210.1738,moe_ck2stages_gemm2_256x32x64x64_1x4_MulABScaleExpertWeight_v1_Nswizzle0_Quant2_MulRoutedWeight1_F8_F8_B16,99.6%,181.72,147.89,0
stage1,80,32768,6144,384,128,4,ActivationType.Swiglu,torch.bfloat16,torch.float8_e4m3fnuz,torch.float8_e4m3fnuz,QuantType.per_Token,1,0,64,0,4378.088,moe_ck2stages_gemm1_256x64x64x256_1x4_MulABScale_v1_Nswizzle0_Quant2_MulRoutedWeight0_swiglu_F8_F8_B16,0.0%,423.8,344.89,0
stage1,80,32768,6144,384,128,4,ActivationType.Swiglu,torch.bfloat16,torch.float8_e4m3fnuz,torch.float8_e4m3fnuz,QuantType.per_Token,1,0,64,0,4004.8756,moe_ck2stages_gemm1_256x64x64x128_1x4_MulABScale_v1_Nswizzle0_Quant2_MulRoutedWeight0_swiglu_F8_F8_B16,0.0%,463.29,377.03,0
stage1,80,32768,6144,384,128,4,ActivationType.Swiglu,torch.bfloat16,torch.float8_e4m3fnuz,torch.float8_e4m3fnuz,QuantType.per_Token,1,0,64,0,4593.3856,moe_ck2stages_gemm1_256x64x128x256_1x4_MulABScale_v3_Nswizzle0_Quant2_MulRoutedWeight0_swiglu_F8_F8_B16,0.0%,403.93,328.72,0
stage1,80,32768,6144,384,128,4,ActivationType.Swiglu,torch.bfloat16,torch.float8_e4m3fnuz,torch.float8_e4m3fnuz,QuantType.per_Token,1,0,64,0,3935.7522,moe_ck2stages_gemm1_256x64x128x128_1x4_MulABScale_v3_Nswizzle0_Quant2_MulRoutedWeight0_swiglu_F8_F8_B16,0.0%,471.43,383.65,0
stage2,80,32768,6144,384,128,4,ActivationType.Swiglu,torch.bfloat16,torch.float8_e4m3fnuz,torch.float8_e4m3fnuz,QuantType.per_Token,1,0,64,0,-1.0,moe_ck2stages_gemm2_256x64x64x256_1x4_MulABScaleExpertWeight_v1_Nswizzle0_Quant2_MulRoutedWeight1_F8_F8_B16,100.0%,0.0,0.0,0
stage2,80,32768,6144,384,128,4,ActivationType.Swiglu,torch.bfloat16,torch.float8_e4m3fnuz,torch.float8_e4m3fnuz,QuantType.per_Token,1,0,64,0,-1.0,moe_ck2stages_gemm2_256x64x128x256_1x4_MulABScaleExpertWeight_v3_Nswizzle0_Quant2_MulRoutedWeight1_F8_F8_B16,100.0%,0.0,0.0,0
stage2,80,32768,6144,384,128,4,ActivationType.Swiglu,torch.bfloat16,torch.float8_e4m3fnuz,torch.float8_e4m3fnuz,QuantType.per_Token,1,0,64,0,8512.1935,moe_ck2stages_gemm2_256x64x128x128_1x4_MulABScaleExpertWeight_v3_Nswizzle0_Quant2_MulRoutedWeight1_F8_F8_B16,2.9%,217.97,177.39,0
stage2,80,32768,6144,384,128,4,ActivationType.Swiglu,torch.bfloat16,torch.float8_e4m3fnuz,torch.float8_e4m3fnuz,QuantType.per_Token,1,0,64,0,11106.1787,moe_ck2stages_gemm2_256x64x128x64_1x4_MulABScaleExpertWeight_v3_Nswizzle0_Quant2_MulRoutedWeight1_F8_F8_B16,99.6%,167.06,135.96,0
stage2,80,32768,6144,384,128,4,ActivationType.Swiglu,torch.bfloat16,torch.float8_e4m3fnuz,torch.float8_e4m3fnuz,QuantType.per_Token,1,0,64,0,10123.1353,moe_ck2stages_gemm2_256x64x64x64_1x4_MulABScaleExpertWeight_v1_Nswizzle0_Quant2_MulRoutedWeight1_F8_F8_B16,99.6%,183.29,149.16,0
stage1,80,32768,6144,384,128,4,ActivationType.Swiglu,torch.bfloat16,torch.float8_e4m3fnuz,torch.float8_e4m3fnuz,QuantType.per_Token,1,0,128,0,4229.0233,moe_ck2stages_gemm1_256x128x64x128_1x4_MulABScale_v1_Nswizzle0_Quant2_MulRoutedWeight0_swiglu_F8_F8_B16,0.0%,438.74,357.04,0
stage1,80,32768,6144,384,128,4,ActivationType.Swiglu,torch.bfloat16,torch.float8_e4m3fnuz,torch.float8_e4m3fnuz,QuantType.per_Token,1,0,128,0,4469.1146,moe_ck2stages_gemm1_256x128x128x256_1x4_MulABScale_v3_Nswizzle0_Quant2_MulRoutedWeight0_swiglu_F8_F8_B16,0.0%,415.17,337.86,0
stage1,80,32768,6144,384,128,4,ActivationType.Swiglu,torch.bfloat16,torch.float8_e4m3fnuz,torch.float8_e4m3fnuz,QuantType.per_Token,1,0,128,0,4465.0861,moe_ck2stages_gemm1_256x128x128x128_1x4_MulABScale_v3_Nswizzle0_Quant2_MulRoutedWeight0_swiglu_F8_F8_B16,0.0%,415.54,338.17,0
stage2,80,32768,6144,384,128,4,ActivationType.Swiglu,torch.bfloat16,torch.float8_e4m3fnuz,torch.float8_e4m3fnuz,QuantType.per_Token,1,0,128,0,10380.7558,moe_ck2stages_gemm2_256x128x64x128_1x4_MulABScaleExpertWeight_v1_Nswizzle0_Quant2_MulRoutedWeight1_F8_F8_B16,2.9%,178.74,145.46,0
stage2,80,32768,6144,384,128,4,ActivationType.Swiglu,torch.bfloat16,torch.float8_e4m3fnuz,torch.float8_e4m3fnuz,QuantType.per_Token,1,0,128,0,7817.5219,moe_ck2stages_gemm2_256x128x128x128_1x4_MulABScaleExpertWeight_v3_Nswizzle0_Quant2_MulRoutedWeight1_F8_F8_B16,2.9%,237.34,193.15,0
stage2,80,32768,6144,384,128,4,ActivationType.Swiglu,torch.bfloat16,torch.float8_e4m3fnuz,torch.float8_e4m3fnuz,QuantType.per_Token,1,0,128,0,10156.2851,moe_ck2stages_gemm2_256x128x128x64_1x4_MulABScaleExpertWeight_v3_Nswizzle0_Quant2_MulRoutedWeight1_F8_F8_B16,99.6%,182.69,148.67,0
stage2,80,32768,6144,384,128,4,ActivationType.Swiglu,torch.bfloat16,torch.float8_e4m3fnuz,torch.float8_e4m3fnuz,QuantType.per_Token,1,0,128,0,10496.0347,moe_ck2stages_gemm2_256x128x64x64_1x4_MulABScaleExpertWeight_v3_Nswizzle0_Quant2_MulRoutedWeight1_F8_F8_B16,99.6%,176.77,143.86,0
stage1,80,1,6144,384,129,5,ActivationType.Swiglu,torch.bfloat16,torch.float8_e4m3fnuz,torch.float8_e4m3fnuz,QuantType.per_Token,1,0,16,0,63.6612,_ZN5aiter48fmoe_stage1_bf16_pertokenFp8_g1u1_16x128_4tg_pf2E,97.5%,1.11,14342.58,0
stage1,80,1,6144,384,129,5,ActivationType.Swiglu,torch.bfloat16,torch.float8_e4m3fnuz,torch.float8_e4m3fnuz,QuantType.per_Token,1,0,16,0,37.0018,_ZN5aiter48fmoe_stage1_bf16_pertokenFp8_g1u1_16x128_4tg_pf3E,97.5%,1.91,24676.26,0
stage1,80,1,6144,384,129,5,ActivationType.Swiglu,torch.bfloat16,torch.float8_e4m3fnuz,torch.float8_e4m3fnuz,QuantType.per_Token,1,0,16,0,-1.0,_ZN5aiter48fmoe_stage1_bf16_pertokenFp8_g1u1_16x256_3tg_pf2E,100.0%,0.0,0.0,0
stage1,80,1,6144,384,129,5,ActivationType.Swiglu,torch.bfloat16,torch.float8_e4m3fnuz,torch.float8_e4m3fnuz,QuantType.per_Token,1,0,16,0,-1.0,_ZN5aiter48fmoe_stage1_bf16_pertokenFp8_g1u1_16x256_2tg_pf3E,100.0%,0.0,0.0,0
stage1,80,1,6144,384,129,5,ActivationType.Swiglu,torch.bfloat16,torch.float8_e4m3fnuz,torch.float8_e4m3fnuz,QuantType.per_Token,1,0,16,0,-1.0,_ZN5aiter48fmoe_stage1_bf16_pertokenFp8_g1u1_16x512_2tg_pf2E,100.0%,0.0,0.0,0
stage1,80,1,6144,384,129,5,ActivationType.Swiglu,torch.bfloat16,torch.float8_e4m3fnuz,torch.float8_e4m3fnuz,QuantType.per_Token,1,0,16,0,-1.0,_ZN5aiter44fmoe_stage1_bf16_pertokenFp8_g1u1_16x512_pf3E,100.0%,0.0,0.0,0
stage1,80,1,6144,384,129,5,ActivationType.Swiglu,torch.bfloat16,torch.float8_e4m3fnuz,torch.float8_e4m3fnuz,QuantType.per_Token,1,0,16,0,55.2706,_ZN5aiter47fmoe_stage1_bf16_pertokenFp8_g1u1_16x64_6tg_pf2E,97.5%,1.28,16519.92,0
stage1,80,1,6144,384,129,5,ActivationType.Swiglu,torch.bfloat16,torch.float8_e4m3fnuz,torch.float8_e4m3fnuz,QuantType.per_Token,1,0,16,0,30.7935,_ZN5aiter47fmoe_stage1_bf16_pertokenFp8_g1u1_16x64_5tg_pf3E,97.5%,2.3,29651.26,0
stage1,80,1,6144,384,129,5,ActivationType.Swiglu,torch.bfloat16,torch.float8_e4m3fnuz,torch.float8_e4m3fnuz,QuantType.per_Token,1,0,32,0,62.7774,_ZN5aiter48fmoe_stage1_bf16_pertokenFp8_g1u1_32x128_3tg_pf2E,97.5%,1.13,14544.5,0
stage1,80,1,6144,384,129,5,ActivationType.Swiglu,torch.bfloat16,torch.float8_e4m3fnuz,torch.float8_e4m3fnuz,QuantType.per_Token,1,0,32,0,37.3046,_ZN5aiter48fmoe_stage1_bf16_pertokenFp8_g1u1_32x128_3tg_pf3E,97.5%,1.9,24475.96,0
stage1,80,1,6144,384,129,5,ActivationType.Swiglu,torch.bfloat16,torch.float8_e4m3fnuz,torch.float8_e4m3fnuz,QuantType.per_Token,1,0,32,0,-1.0,_ZN5aiter48fmoe_stage1_bf16_pertokenFp8_g1u1_32x256_2tg_pf2E,100.0%,0.0,0.0,0
stage1,80,1,6144,384,129,5,ActivationType.Swiglu,torch.bfloat16,torch.float8_e4m3fnuz,torch.float8_e4m3fnuz,QuantType.per_Token,1,0,32,0,-1.0,_ZN5aiter48fmoe_stage1_bf16_pertokenFp8_g1u1_32x256_2tg_pf3E,100.0%,0.0,0.0,0
stage1,80,1,6144,384,129,5,ActivationType.Swiglu,torch.bfloat16,torch.float8_e4m3fnuz,torch.float8_e4m3fnuz,QuantType.per_Token,1,0,32,0,-1.0,_ZN5aiter44fmoe_stage1_bf16_pertokenFp8_g1u1_32x512_pf2E,100.0%,0.0,0.0,0
stage1,80,1,6144,384,129,5,ActivationType.Swiglu,torch.bfloat16,torch.float8_e4m3fnuz,torch.float8_e4m3fnuz,QuantType.per_Token,1,0,32,0,-1.0,_ZN5aiter44fmoe_stage1_bf16_pertokenFp8_g1u1_32x512_pf3E,100.0%,0.0,0.0,0
stage1,80,1,6144,384,129,5,ActivationType.Swiglu,torch.bfloat16,torch.float8_e4m3fnuz,torch.float8_e4m3fnuz,QuantType.per_Token,1,0,32,0,56.3335,_ZN5aiter47fmoe_stage1_bf16_pertokenFp8_g1u1_32x64_4tg_pf2E,97.5%,1.26,16208.22,0
stage1,80,1,6144,384,129,5,ActivationType.Swiglu,torch.bfloat16,torch.float8_e4m3fnuz,torch.float8_e4m3fnuz,QuantType.per_Token,1,0,32,0,32.2949,_ZN5aiter47fmoe_stage1_bf16_pertokenFp8_g1u1_32x64_4tg_pf3E,97.5%,2.19,28272.76,0
stage1,80,1,6144,384,129,5,ActivationType.Swiglu,torch.bfloat16,torch.float8_e4m3fnuz,torch.float8_e4m3fnuz,QuantType.per_Token,1,0,64,0,64.7588,_ZN5aiter48fmoe_stage1_bf16_pertokenFp8_g1u1_64x128_2tg_pf2E,97.5%,1.09,14099.49,0
stage1,80,1,6144,384,129,5,ActivationType.Swiglu,torch.bfloat16,torch.float8_e4m3fnuz,torch.float8_e4m3fnuz,QuantType.per_Token,1,0,64,0,44.0658,_ZN5aiter48fmoe_stage1_bf16_pertokenFp8_g1u1_64x128_2tg_pf3E,97.5%,1.61,20720.51,0
stage1,80,1,6144,384,129,5,ActivationType.Swiglu,torch.bfloat16,torch.float8_e4m3fnuz,torch.float8_e4m3fnuz,QuantType.per_Token,1,0,64,0,-1.0,_ZN5aiter44fmoe_stage1_bf16_pertokenFp8_g1u1_64x256_pf2E,100.0%,0.0,0.0,0
stage1,80,1,6144,384,129,5,ActivationType.Swiglu,torch.bfloat16,torch.float8_e4m3fnuz,torch.float8_e4m3fnuz,QuantType.per_Token,1,0,64,0,-1.0,_ZN5aiter44fmoe_stage1_bf16_pertokenFp8_g1u1_64x256_pf3E,100.0%,0.0,0.0,0
stage1,80,1,6144,384,129,5,ActivationType.Swiglu,torch.bfloat16,torch.float8_e4m3fnuz,torch.float8_e4m3fnuz,QuantType.per_Token,1,0,64,0,57.2923,_ZN5aiter47fmoe_stage1_bf16_pertokenFp8_g1u1_64x64_3tg_pf2E,97.5%,1.24,15936.98,0
stage1,80,1,6144,384,129,5,ActivationType.Swiglu,torch.bfloat16,torch.float8_e4m3fnuz,torch.float8_e4m3fnuz,QuantType.per_Token,1,0,64,0,33.7505,_ZN5aiter47fmoe_stage1_bf16_pertokenFp8_g1u1_64x64_2tg_pf3E,97.5%,2.1,27053.41,0
stage1,80,1,6144,384,129,5,ActivationType.Swiglu,torch.bfloat16,torch.float8_e4m3fnuz,torch.float8_e4m3fnuz,QuantType.per_Token,1,0,128,0,83.2212,_ZN5aiter45fmoe_stage1_bf16_pertokenFp8_g1u1_128x128_pf2E,97.5%,0.85,10971.56,0
stage1,80,1,6144,384,129,5,ActivationType.Swiglu,torch.bfloat16,torch.float8_e4m3fnuz,torch.float8_e4m3fnuz,QuantType.per_Token,1,0,128,0,82.2923,_ZN5aiter45fmoe_stage1_bf16_pertokenFp8_g1u1_128x128_pf3E,97.5%,0.86,11095.4,0
stage1,80,1,6144,384,129,5,ActivationType.Swiglu,torch.bfloat16,torch.float8_e4m3fnuz,torch.float8_e4m3fnuz,QuantType.per_Token,1,0,128,0,60.6919,_ZN5aiter44fmoe_stage1_bf16_pertokenFp8_g1u1_128x64_pf2E,97.5%,1.17,15044.28,0
stage1,80,1,6144,384,129,5,ActivationType.Swiglu,torch.bfloat16,torch.float8_e4m3fnuz,torch.float8_e4m3fnuz,QuantType.per_Token,1,0,128,0,50.3154,_ZN5aiter44fmoe_stage1_bf16_pertokenFp8_g1u1_128x64_pf3E,97.5%,1.41,18146.85,0
stage1,80,1,6144,384,129,5,ActivationType.Swiglu,torch.bfloat16,torch.float8_e4m3fnuz,torch.float8_e4m3fnuz,QuantType.per_Token,1,0,16,0,36.2472,moe_ck2stages_gemm1_128x16x64x128_1x2_MulABScale_v1_Nswizzle0_Quant2_MulRoutedWeight0_swiglu_F8_F8_B16,0.0%,1.95,25189.97,0
stage1,80,1,6144,384,129,5,ActivationType.Swiglu,torch.bfloat16,torch.float8_e4m3fnuz,torch.float8_e4m3fnuz,QuantType.per_Token,1,0,16,0,30.1057,moe_ck2stages_gemm1_256x16x128x256_1x4_MulABScale_v1_Nswizzle0_Quant2_MulRoutedWeight0_swiglu_F8_F8_B16,0.0%,2.35,30328.67,0
stage1,80,1,6144,384,129,5,ActivationType.Swiglu,torch.bfloat16,torch.float8_e4m3fnuz,torch.float8_e4m3fnuz,QuantType.per_Token,1,0,16,0,21.3819,moe_ck2stages_gemm1_256x16x64x256_1x4_MulABScale_v1_Nswizzle0_Quant2_MulRoutedWeight0_swiglu_F8_F8_B16,0.0%,3.31,42702.75,0
stage2,80,1,6144,384,129,5,ActivationType.Swiglu,torch.bfloat16,torch.float8_e4m3fnuz,torch.float8_e4m3fnuz,QuantType.per_Token,1,0,16,0,-1.0,moe_ck2stages_gemm2_256x16x128x256_1x4_MulABScaleExpertWeight_v1_Nswizzle0_Quant2_MulRoutedWeight1_F8_F8_B16,100.0%,0.0,0.0,0
stage2,80,1,6144,384,129,5,ActivationType.Swiglu,torch.bfloat16,torch.float8_e4m3fnuz,torch.float8_e4m3fnuz,QuantType.per_Token,1,0,16,0,12.463,moe_ck2stages_gemm2_128x16x128x128_1x2_MulABScaleExpertWeight_v1_Nswizzle0_Quant2_MulRoutedWeight1_F8_F8_B16,3.1%,5.68,73262.13,0
stage2,80,1,6144,384,129,5,ActivationType.Swiglu,torch.bfloat16,torch.float8_e4m3fnuz,torch.float8_e4m3fnuz,QuantType.per_Token,1,0,16,0,13.3669,moe_ck2stages_gemm2_64x16x64x64_1x1_MulABScaleExpertWeight_v1_Nswizzle0_Quant2_MulRoutedWeight1_F8_F8_B16,3.5%,5.3,68307.98,0
stage1,80,1,6144,384,129,5,ActivationType.Swiglu,torch.bfloat16,torch.float8_e4m3fnuz,torch.float8_e4m3fnuz,QuantType.per_Token,1,0,32,0,24.5614,moe_ck2stages_gemm1_256x32x64x256_1x4_MulABScale_v1_Nswizzle0_Quant2_MulRoutedWeight0_swiglu_F8_F8_B16,0.0%,2.88,37174.83,0
stage1,80,1,6144,384,129,5,ActivationType.Swiglu,torch.bfloat16,torch.float8_e4m3fnuz,torch.float8_e4m3fnuz,QuantType.per_Token,1,0,32,0,33.0805,moe_ck2stages_gemm1_256x32x64x128_1x4_MulABScale_v1_Nswizzle0_Quant2_MulRoutedWeight0_swiglu_F8_F8_B16,0.0%,2.14,27601.34,0
stage2,80,1,6144,384,129,5,ActivationType.Swiglu,torch.bfloat16,torch.float8_e4m3fnuz,torch.float8_e4m3fnuz,QuantType.per_Token,1,0,32,0,-1.0,moe_ck2stages_gemm2_256x32x64x256_1x4_MulABScaleExpertWeight_v1_Nswizzle0_Quant2_MulRoutedWeight1_F8_F8_B16,100.0%,0.0,0.0,0
stage2,80,1,6144,384,129,5,ActivationType.Swiglu,torch.bfloat16,torch.float8_e4m3fnuz,torch.float8_e4m3fnuz,QuantType.per_Token,1,0,32,0,13.0184,moe_ck2stages_gemm2_256x32x64x128_1x4_MulABScaleExpertWeight_v1_Nswizzle0_Quant2_MulRoutedWeight1_F8_F8_B16,3.5%,5.44,70136.57,0
stage2,80,1,6144,384,129,5,ActivationType.Swiglu,torch.bfloat16,torch.float8_e4m3fnuz,torch.float8_e4m3fnuz,QuantType.per_Token,1,0,32,0,19.6055,moe_ck2stages_gemm2_256x32x64x64_1x4_MulABScaleExpertWeight_v1_Nswizzle0_Quant2_MulRoutedWeight1_F8_F8_B16,99.4%,3.61,46571.93,0
stage1,80,1,6144,384,129,5,ActivationType.Swiglu,torch.bfloat16,torch.float8_e4m3fnuz,torch.float8_e4m3fnuz,QuantType.per_Token,1,0,64,0,37.5876,moe_ck2stages_gemm1_256x64x64x256_1x4_MulABScale_v1_Nswizzle0_Quant2_MulRoutedWeight0_swiglu_F8_F8_B16,0.0%,1.88,24291.68,0
stage1,80,1,6144,384,129,5,ActivationType.Swiglu,torch.bfloat16,torch.float8_e4m3fnuz,torch.float8_e4m3fnuz,QuantType.per_Token,1,0,64,0,40.3133,moe_ck2stages_gemm1_256x64x64x128_1x4_MulABScale_v1_Nswizzle0_Quant2_MulRoutedWeight0_swiglu_F8_F8_B16,0.0%,1.76,22649.25,0
stage1,80,1,6144,384,129,5,ActivationType.Swiglu,torch.bfloat16,torch.float8_e4m3fnuz,torch.float8_e4m3fnuz,QuantType.per_Token,1,0,64,0,56.7773,moe_ck2stages_gemm1_256x64x128x256_1x4_MulABScale_v3_Nswizzle0_Quant2_MulRoutedWeight0_swiglu_F8_F8_B16,0.0%,1.25,16081.53,0
stage1,80,1,6144,384,129,5,ActivationType.Swiglu,torch.bfloat16,torch.float8_e4m3fnuz,torch.float8_e4m3fnuz,QuantType.per_Token,1,0,64,0,60.3065,moe_ck2stages_gemm1_256x64x128x128_1x4_MulABScale_v3_Nswizzle0_Quant2_MulRoutedWeight0_swiglu_F8_F8_B16,0.0%,1.17,15140.42,0
stage2,80,1,6144,384,129,5,ActivationType.Swiglu,torch.bfloat16,torch.float8_e4m3fnuz,torch.float8_e4m3fnuz,QuantType.per_Token,1,0,64,0,-1.0,moe_ck2stages_gemm2_256x64x64x256_1x4_MulABScaleExpertWeight_v1_Nswizzle0_Quant2_MulRoutedWeight1_F8_F8_B16,100.0%,0.0,0.0,0
stage2,80,1,6144,384,129,5,ActivationType.Swiglu,torch.bfloat16,torch.float8_e4m3fnuz,torch.float8_e4m3fnuz,QuantType.per_Token,1,0,64,0,-1.0,moe_ck2stages_gemm2_256x64x128x256_1x4_MulABScaleExpertWeight_v3_Nswizzle0_Quant2_MulRoutedWeight1_F8_F8_B16,100.0%,0.0,0.0,0
stage2,80,1,6144,384,129,5,ActivationType.Swiglu,torch.bfloat16,torch.float8_e4m3fnuz,torch.float8_e4m3fnuz,QuantType.per_Token,1,0,64,0,26.5944,moe_ck2stages_gemm2_256x64x128x128_1x4_MulABScaleExpertWeight_v3_Nswizzle0_Quant2_MulRoutedWeight1_F8_F8_B16,3.7%,2.66,34333.02,0
stage2,80,1,6144,384,129,5,ActivationType.Swiglu,torch.bfloat16,torch.float8_e4m3fnuz,torch.float8_e4m3fnuz,QuantType.per_Token,1,0,64,0,33.5402,moe_ck2stages_gemm2_256x64x128x64_1x4_MulABScaleExpertWeight_v3_Nswizzle0_Quant2_MulRoutedWeight1_F8_F8_B16,99.4%,2.11,27223.03,0
stage2,80,1,6144,384,129,5,ActivationType.Swiglu,torch.bfloat16,torch.float8_e4m3fnuz,torch.float8_e4m3fnuz,QuantType.per_Token,1,0,64,0,34.9121,moe_ck2stages_gemm2_256x64x64x64_1x4_MulABScaleExpertWeight_v1_Nswizzle0_Quant2_MulRoutedWeight1_F8_F8_B16,99.4%,2.03,26153.28,0
stage1,80,1,6144,384,129,5,ActivationType.Swiglu,torch.bfloat16,torch.float8_e4m3fnuz,torch.float8_e4m3fnuz,QuantType.per_Token,1,0,128,0,66.2043,moe_ck2stages_gemm1_256x128x64x128_1x4_MulABScale_v1_Nswizzle0_Quant2_MulRoutedWeight0_swiglu_F8_F8_B16,0.0%,1.07,13791.64,0
stage1,80,1,6144,384,129,5,ActivationType.Swiglu,torch.bfloat16,torch.float8_e4m3fnuz,torch.float8_e4m3fnuz,QuantType.per_Token,1,0,128,0,106.5803,moe_ck2stages_gemm1_256x128x128x256_1x4_MulABScale_v3_Nswizzle0_Quant2_MulRoutedWeight0_swiglu_F8_F8_B16,0.0%,0.66,8566.93,0
stage1,80,1,6144,384,129,5,ActivationType.Swiglu,torch.bfloat16,torch.float8_e4m3fnuz,torch.float8_e4m3fnuz,QuantType.per_Token,1,0,128,0,105.5283,moe_ck2stages_gemm1_256x128x128x128_1x4_MulABScale_v3_Nswizzle0_Quant2_MulRoutedWeight0_swiglu_F8_F8_B16,0.0%,0.67,8652.33,0
stage2,80,1,6144,384,129,5,ActivationType.Swiglu,torch.bfloat16,torch.float8_e4m3fnuz,torch.float8_e4m3fnuz,QuantType.per_Token,1,0,128,0,42.4694,moe_ck2stages_gemm2_256x128x64x128_1x4_MulABScaleExpertWeight_v1_Nswizzle0_Quant2_MulRoutedWeight1_F8_F8_B16,3.6%,1.67,21499.39,0
stage2,80,1,6144,384,129,5,ActivationType.Swiglu,torch.bfloat16,torch.float8_e4m3fnuz,torch.float8_e4m3fnuz,QuantType.per_Token,1,0,128,0,36.9116,moe_ck2stages_gemm2_256x128x128x128_1x4_MulABScaleExpertWeight_v3_Nswizzle0_Quant2_MulRoutedWeight1_F8_F8_B16,3.5%,1.92,24736.56,0
stage2,80,1,6144,384,129,5,ActivationType.Swiglu,torch.bfloat16,torch.float8_e4m3fnuz,torch.float8_e4m3fnuz,QuantType.per_Token,1,0,128,0,48.6725,moe_ck2stages_gemm2_256x128x128x64_1x4_MulABScaleExpertWeight_v3_Nswizzle0_Quant2_MulRoutedWeight1_F8_F8_B16,99.4%,1.45,18759.38,0
stage2,80,1,6144,384,129,5,ActivationType.Swiglu,torch.bfloat16,torch.float8_e4m3fnuz,torch.float8_e4m3fnuz,QuantType.per_Token,1,0,128,0,51.9692,moe_ck2stages_gemm2_256x128x64x64_1x4_MulABScaleExpertWeight_v3_Nswizzle0_Quant2_MulRoutedWeight1_F8_F8_B16,99.4%,1.36,17569.37,0
stage1,80,2,6144,384,129,5,ActivationType.Swiglu,torch.bfloat16,torch.float8_e4m3fnuz,torch.float8_e4m3fnuz,QuantType.per_Token,1,0,16,0,63.9379,_ZN5aiter48fmoe_stage1_bf16_pertokenFp8_g1u1_16x128_4tg_pf2E,97.9%,2.21,14280.8,0
stage1,80,2,6144,384,129,5,ActivationType.Swiglu,torch.bfloat16,torch.float8_e4m3fnuz,torch.float8_e4m3fnuz,QuantType.per_Token,1,0,16,0,37.247,_ZN5aiter48fmoe_stage1_bf16_pertokenFp8_g1u1_16x128_4tg_pf3E,97.9%,3.8,24514.31,0
stage1,80,2,6144,384,129,5,ActivationType.Swiglu,torch.bfloat16,torch.float8_e4m3fnuz,torch.float8_e4m3fnuz,QuantType.per_Token,1,0,16,0,-1.0,_ZN5aiter48fmoe_stage1_bf16_pertokenFp8_g1u1_16x256_3tg_pf2E,100.0%,0.0,0.0,0
stage1,80,2,6144,384,129,5,ActivationType.Swiglu,torch.bfloat16,torch.float8_e4m3fnuz,torch.float8_e4m3fnuz,QuantType.per_Token,1,0,16,0,-1.0,_ZN5aiter48fmoe_stage1_bf16_pertokenFp8_g1u1_16x256_2tg_pf3E,100.0%,0.0,0.0,0
stage1,80,2,6144,384,129,5,ActivationType.Swiglu,torch.bfloat16,torch.float8_e4m3fnuz,torch.float8_e4m3fnuz,QuantType.per_Token,1,0,16,0,-1.0,_ZN5aiter48fmoe_stage1_bf16_pertokenFp8_g1u1_16x512_2tg_pf2E,100.0%,0.0,0.0,0
stage1,80,2,6144,384,129,5,ActivationType.Swiglu,torch.bfloat16,torch.float8_e4m3fnuz,torch.float8_e4m3fnuz,QuantType.per_Token,1,0,16,0,-1.0,_ZN5aiter44fmoe_stage1_bf16_pertokenFp8_g1u1_16x512_pf3E,100.0%,0.0,0.0,0
stage1,80,2,6144,384,129,5,ActivationType.Swiglu,torch.bfloat16,torch.float8_e4m3fnuz,torch.float8_e4m3fnuz,QuantType.per_Token,1,0,16,0,56.2012,_ZN5aiter47fmoe_stage1_bf16_pertokenFp8_g1u1_16x64_6tg_pf2E,97.9%,2.52,16246.71,0
stage1,80,2,6144,384,129,5,ActivationType.Swiglu,torch.bfloat16,torch.float8_e4m3fnuz,torch.float8_e4m3fnuz,QuantType.per_Token,1,0,16,0,31.7387,_ZN5aiter47fmoe_stage1_bf16_pertokenFp8_g1u1_16x64_5tg_pf3E,97.9%,4.46,28768.8,0
stage1,80,2,6144,384,129,5,ActivationType.Swiglu,torch.bfloat16,torch.float8_e4m3fnuz,torch.float8_e4m3fnuz,QuantType.per_Token,1,0,32,0,63.8566,_ZN5aiter48fmoe_stage1_bf16_pertokenFp8_g1u1_32x128_3tg_pf2E,97.9%,2.22,14298.98,0
stage1,80,2,6144,384,129,5,ActivationType.Swiglu,torch.bfloat16,torch.float8_e4m3fnuz,torch.float8_e4m3fnuz,QuantType.per_Token,1,0,32,0,38.3712,_ZN5aiter48fmoe_stage1_bf16_pertokenFp8_g1u1_32x128_3tg_pf3E,97.9%,3.69,23796.09,0
stage1,80,2,6144,384,129,5,ActivationType.Swiglu,torch.bfloat16,torch.float8_e4m3fnuz,torch.float8_e4m3fnuz,QuantType.per_Token,1,0,32,0,-1.0,_ZN5aiter48fmoe_stage1_bf16_pertokenFp8_g1u1_32x256_2tg_pf2E,100.0%,0.0,0.0,0
stage1,80,2,6144,384,129,5,ActivationType.Swiglu,torch.bfloat16,torch.float8_e4m3fnuz,torch.float8_e4m3fnuz,QuantType.per_Token,1,0,32,0,-1.0,_ZN5aiter48fmoe_stage1_bf16_pertokenFp8_g1u1_32x256_2tg_pf3E,100.0%,0.0,0.0,0
stage1,80,2,6144,384,129,5,ActivationType.Swiglu,torch.bfloat16,torch.float8_e4m3fnuz,torch.float8_e4m3fnuz,QuantType.per_Token,1,0,32,0,-1.0,_ZN5aiter44fmoe_stage1_bf16_pertokenFp8_g1u1_32x512_pf2E,100.0%,0.0,0.0,0
stage1,80,2,6144,384,129,5,ActivationType.Swiglu,torch.bfloat16,torch.float8_e4m3fnuz,torch.float8_e4m3fnuz,QuantType.per_Token,1,0,32,0,-1.0,_ZN5aiter44fmoe_stage1_bf16_pertokenFp8_g1u1_32x512_pf3E,100.0%,0.0,0.0,0
stage1,80,2,6144,384,129,5,ActivationType.Swiglu,torch.bfloat16,torch.float8_e4m3fnuz,torch.float8_e4m3fnuz,QuantType.per_Token,1,0,32,0,56.8618,_ZN5aiter47fmoe_stage1_bf16_pertokenFp8_g1u1_32x64_4tg_pf2E,97.9%,2.49,16057.96,0
stage1,80,2,6144,384,129,5,ActivationType.Swiglu,torch.bfloat16,torch.float8_e4m3fnuz,torch.float8_e4m3fnuz,QuantType.per_Token,1,0,32,0,32.6596,_ZN5aiter47fmoe_stage1_bf16_pertokenFp8_g1u1_32x64_4tg_pf3E,97.9%,4.33,27957.61,0
stage1,80,2,6144,384,129,5,ActivationType.Swiglu,torch.bfloat16,torch.float8_e4m3fnuz,torch.float8_e4m3fnuz,QuantType.per_Token,1,0,64,0,64.8219,_ZN5aiter48fmoe_stage1_bf16_pertokenFp8_g1u1_64x128_2tg_pf2E,97.9%,2.18,14086.05,0
stage1,80,2,6144,384,129,5,ActivationType.Swiglu,torch.bfloat16,torch.float8_e4m3fnuz,torch.float8_e4m3fnuz,QuantType.per_Token,1,0,64,0,44.4463,_ZN5aiter48fmoe_stage1_bf16_pertokenFp8_g1u1_64x128_2tg_pf3E,97.9%,3.18,20543.54,0
stage1,80,2,6144,384,129,5,ActivationType.Swiglu,torch.bfloat16,torch.float8_e4m3fnuz,torch.float8_e4m3fnuz,QuantType.per_Token,1,0,64,0,-1.0,_ZN5aiter44fmoe_stage1_bf16_pertokenFp8_g1u1_64x256_pf2E,100.0%,0.0,0.0,0
stage1,80,2,6144,384,129,5,ActivationType.Swiglu,torch.bfloat16,torch.float8_e4m3fnuz,torch.float8_e4m3fnuz,QuantType.per_Token,1,0,64,0,-1.0,_ZN5aiter44fmoe_stage1_bf16_pertokenFp8_g1u1_64x256_pf3E,100.0%,0.0,0.0,0
stage1,80,2,6144,384,129,5,ActivationType.Swiglu,torch.bfloat16,torch.float8_e4m3fnuz,torch.float8_e4m3fnuz,QuantType.per_Token,1,0,64,0,58.4461,_ZN5aiter47fmoe_stage1_bf16_pertokenFp8_g1u1_64x64_3tg_pf2E,97.9%,2.42,15622.67,0
stage1,80,2,6144,384,129,5,ActivationType.Swiglu,torch.bfloat16,torch.float8_e4m3fnuz,torch.float8_e4m3fnuz,QuantType.per_Token,1,0,64,0,34.3127,_ZN5aiter47fmoe_stage1_bf16_pertokenFp8_g1u1_64x64_2tg_pf3E,97.9%,4.13,26610.68,0
stage1,80,2,6144,384,129,5,ActivationType.Swiglu,torch.bfloat16,torch.float8_e4m3fnuz,torch.float8_e4m3fnuz,QuantType.per_Token,1,0,128,0,83.7206,_ZN5aiter45fmoe_stage1_bf16_pertokenFp8_g1u1_128x128_pf2E,97.9%,1.69,10906.33,0
stage1,80,2,6144,384,129,5,ActivationType.Swiglu,torch.bfloat16,torch.float8_e4m3fnuz,torch.float8_e4m3fnuz,QuantType.per_Token,1,0,128,0,82.5329,_ZN5aiter45fmoe_stage1_bf16_pertokenFp8_g1u1_128x128_pf3E,97.9%,1.72,11063.28,0
stage1,80,2,6144,384,129,5,ActivationType.Swiglu,torch.bfloat16,torch.float8_e4m3fnuz,torch.float8_e4m3fnuz,QuantType.per_Token,1,0,128,0,61.1682,_ZN5aiter44fmoe_stage1_bf16_pertokenFp8_g1u1_128x64_pf2E,97.9%,2.31,14927.44,0
stage1,80,2,6144,384,129,5,ActivationType.Swiglu,torch.bfloat16,torch.float8_e4m3fnuz,torch.float8_e4m3fnuz,QuantType.per_Token,1,0,128,0,50.3689,_ZN5aiter44fmoe_stage1_bf16_pertokenFp8_g1u1_128x64_pf3E,97.9%,2.81,18127.94,0
stage1,80,2,6144,384,129,5,ActivationType.Swiglu,torch.bfloat16,torch.float8_e4m3fnuz,torch.float8_e4m3fnuz,QuantType.per_Token,1,0,16,0,37.7688,moe_ck2stages_gemm1_128x16x64x128_1x2_MulABScale_v1_Nswizzle0_Quant2_MulRoutedWeight0_swiglu_F8_F8_B16,0.0%,3.75,24175.63,0
stage1,80,2,6144,384,129,5,ActivationType.Swiglu,torch.bfloat16,torch.float8_e4m3fnuz,torch.float8_e4m3fnuz,QuantType.per_Token,1,0,16,0,30.651,moe_ck2stages_gemm1_256x16x128x256_1x4_MulABScale_v1_Nswizzle0_Quant2_MulRoutedWeight0_swiglu_F8_F8_B16,0.0%,4.62,29789.71,0
stage1,80,2,6144,384,129,5,ActivationType.Swiglu,torch.bfloat16,torch.float8_e4m3fnuz,torch.float8_e4m3fnuz,QuantType.per_Token,1,0,16,0,22.0559,moe_ck2stages_gemm1_256x16x64x256_1x4_MulABScale_v1_Nswizzle0_Quant2_MulRoutedWeight0_swiglu_F8_F8_B16,0.0%,6.42,41398.65,0
stage2,80,2,6144,384,129,5,ActivationType.Swiglu,torch.bfloat16,torch.float8_e4m3fnuz,torch.float8_e4m3fnuz,QuantType.per_Token,1,0,16,0,-1.0,moe_ck2stages_gemm2_256x16x128x256_1x4_MulABScaleExpertWeight_v1_Nswizzle0_Quant2_MulRoutedWeight1_F8_F8_B16,100.0%,0.0,0.0,0
stage2,80,2,6144,384,129,5,ActivationType.Swiglu,torch.bfloat16,torch.float8_e4m3fnuz,torch.float8_e4m3fnuz,QuantType.per_Token,1,0,16,0,16.0729,moe_ck2stages_gemm2_128x16x128x128_1x2_MulABScaleExpertWeight_v1_Nswizzle0_Quant2_MulRoutedWeight1_F8_F8_B16,3.6%,8.81,56808.94,0
stage2,80,2,6144,384,129,5,ActivationType.Swiglu,torch.bfloat16,torch.float8_e4m3fnuz,torch.float8_e4m3fnuz,QuantType.per_Token,1,0,16,0,14.6944,moe_ck2stages_gemm2_64x16x64x64_1x1_MulABScaleExpertWeight_v1_Nswizzle0_Quant2_MulRoutedWeight1_F8_F8_B16,3.8%,9.63,62138.26,0
stage1,80,2,6144,384,129,5,ActivationType.Swiglu,torch.bfloat16,torch.float8_e4m3fnuz,torch.float8_e4m3fnuz,QuantType.per_Token,1,0,32,0,25.0344,moe_ck2stages_gemm1_256x32x64x256_1x4_MulABScale_v1_Nswizzle0_Quant2_MulRoutedWeight0_swiglu_F8_F8_B16,0.0%,5.65,36473.19,0
stage1,80,2,6144,384,129,5,ActivationType.Swiglu,torch.bfloat16,torch.float8_e4m3fnuz,torch.float8_e4m3fnuz,QuantType.per_Token,1,0,32,0,33.7273,moe_ck2stages_gemm1_256x32x64x128_1x4_MulABScale_v1_Nswizzle0_Quant2_MulRoutedWeight0_swiglu_F8_F8_B16,0.0%,4.2,27072.56,0
stage2,80,2,6144,384,129,5,ActivationType.Swiglu,torch.bfloat16,torch.float8_e4m3fnuz,torch.float8_e4m3fnuz,QuantType.per_Token,1,0,32,0,-1.0,moe_ck2stages_gemm2_256x32x64x256_1x4_MulABScaleExpertWeight_v1_Nswizzle0_Quant2_MulRoutedWeight1_F8_F8_B16,100.0%,0.0,0.0,0
stage2,80,2,6144,384,129,5,ActivationType.Swiglu,torch.bfloat16,torch.float8_e4m3fnuz,torch.float8_e4m3fnuz,QuantType.per_Token,1,0,32,0,18.9005,moe_ck2stages_gemm2_256x32x64x128_1x4_MulABScaleExpertWeight_v1_Nswizzle0_Quant2_MulRoutedWeight1_F8_F8_B16,3.7%,7.49,48310.07,0
stage2,80,2,6144,384,129,5,ActivationType.Swiglu,torch.bfloat16,torch.float8_e4m3fnuz,torch.float8_e4m3fnuz,QuantType.per_Token,1,0,32,0,30.9985,moe_ck2stages_gemm2_256x32x64x64_1x4_MulABScaleExpertWeight_v1_Nswizzle0_Quant2_MulRoutedWeight1_F8_F8_B16,99.4%,4.57,29455.76,0
stage1,80,2,6144,384,129,5,ActivationType.Swiglu,torch.bfloat16,torch.float8_e4m3fnuz,torch.float8_e4m3fnuz,QuantType.per_Token,1,0,64,0,37.9624,moe_ck2stages_gemm1_256x64x64x256_1x4_MulABScale_v1_Nswizzle0_Quant2_MulRoutedWeight0_swiglu_F8_F8_B16,0.0%,3.73,24052.34,0
stage1,80,2,6144,384,129,5,ActivationType.Swiglu,torch.bfloat16,torch.float8_e4m3fnuz,torch.float8_e4m3fnuz,QuantType.per_Token,1,0,64,0,41.0651,moe_ck2stages_gemm1_256x64x64x128_1x4_MulABScale_v1_Nswizzle0_Quant2_MulRoutedWeight0_swiglu_F8_F8_B16,0.0%,3.45,22235.05,0
stage1,80,2,6144,384,129,5,ActivationType.Swiglu,torch.bfloat16,torch.float8_e4m3fnuz,torch.float8_e4m3fnuz,QuantType.per_Token,1,0,64,0,57.0814,moe_ck2stages_gemm1_256x64x128x256_1x4_MulABScale_v3_Nswizzle0_Quant2_MulRoutedWeight0_swiglu_F8_F8_B16,0.0%,2.48,15996.18,0
stage1,80,2,6144,384,129,5,ActivationType.Swiglu,torch.bfloat16,torch.float8_e4m3fnuz,torch.float8_e4m3fnuz,QuantType.per_Token,1,0,64,0,60.4908,moe_ck2stages_gemm1_256x64x128x128_1x4_MulABScale_v3_Nswizzle0_Quant2_MulRoutedWeight0_swiglu_F8_F8_B16,0.0%,2.34,15094.6,0
stage2,80,2,6144,384,129,5,ActivationType.Swiglu,torch.bfloat16,torch.float8_e4m3fnuz,torch.float8_e4m3fnuz,QuantType.per_Token,1,0,64,0,-1.0,moe_ck2stages_gemm2_256x64x64x256_1x4_MulABScaleExpertWeight_v1_Nswizzle0_Quant2_MulRoutedWeight1_F8_F8_B16,100.0%,0.0,0.0,0
stage2,80,2,6144,384,129,5,ActivationType.Swiglu,torch.bfloat16,torch.float8_e4m3fnuz,torch.float8_e4m3fnuz,QuantType.per_Token,1,0,64,0,-1.0,moe_ck2stages_gemm2_256x64x128x256_1x4_MulABScaleExpertWeight_v3_Nswizzle0_Quant2_MulRoutedWeight1_F8_F8_B16,100.0%,0.0,0.0,0
stage2,80,2,6144,384,129,5,ActivationType.Swiglu,torch.bfloat16,torch.float8_e4m3fnuz,torch.float8_e4m3fnuz,QuantType.per_Token,1,0,64,0,37.5532,moe_ck2stages_gemm2_256x64x128x128_1x4_MulABScaleExpertWeight_v3_Nswizzle0_Quant2_MulRoutedWeight1_F8_F8_B16,3.7%,3.77,24314.42,0
stage2,80,2,6144,384,129,5,ActivationType.Swiglu,torch.bfloat16,torch.float8_e4m3fnuz,torch.float8_e4m3fnuz,QuantType.per_Token,1,0,64,0,53.4921,moe_ck2stages_gemm2_256x64x128x64_1x4_MulABScaleExpertWeight_v3_Nswizzle0_Quant2_MulRoutedWeight1_F8_F8_B16,99.4%,2.65,17069.52,0
stage2,80,2,6144,384,129,5,ActivationType.Swiglu,torch.bfloat16,torch.float8_e4m3fnuz,torch.float8_e4m3fnuz,QuantType.per_Token,1,0,64,0,49.8105,moe_ck2stages_gemm2_256x64x64x64_1x4_MulABScaleExpertWeight_v1_Nswizzle0_Quant2_MulRoutedWeight1_F8_F8_B16,99.4%,2.84,18331.16,0
stage1,80,2,6144,384,129,5,ActivationType.Swiglu,torch.bfloat16,torch.float8_e4m3fnuz,torch.float8_e4m3fnuz,QuantType.per_Token,1,0,128,0,66.4365,moe_ck2stages_gemm1_256x128x64x128_1x4_MulABScale_v1_Nswizzle0_Quant2_MulRoutedWeight0_swiglu_F8_F8_B16,0.0%,2.13,13743.72,0
stage1,80,2,6144,384,129,5,ActivationType.Swiglu,torch.bfloat16,torch.float8_e4m3fnuz,torch.float8_e4m3fnuz,QuantType.per_Token,1,0,128,0,106.8103,moe_ck2stages_gemm1_256x128x128x256_1x4_MulABScale_v3_Nswizzle0_Quant2_MulRoutedWeight0_swiglu_F8_F8_B16,0.0%,1.33,8548.66,0
stage1,80,2,6144,384,129,5,ActivationType.Swiglu,torch.bfloat16,torch.float8_e4m3fnuz,torch.float8_e4m3fnuz,QuantType.per_Token,1,0,128,0,105.9797,moe_ck2stages_gemm1_256x128x128x128_1x4_MulABScale_v3_Nswizzle0_Quant2_MulRoutedWeight0_swiglu_F8_F8_B16,0.0%,1.34,8615.65,0
stage2,80,2,6144,384,129,5,ActivationType.Swiglu,torch.bfloat16,torch.float8_e4m3fnuz,torch.float8_e4m3fnuz,QuantType.per_Token,1,0,128,0,74.2796,moe_ck2stages_gemm2_256x128x64x128_1x4_MulABScaleExpertWeight_v1_Nswizzle0_Quant2_MulRoutedWeight1_F8_F8_B16,3.7%,1.91,12292.53,0
stage2,80,2,6144,384,129,5,ActivationType.Swiglu,torch.bfloat16,torch.float8_e4m3fnuz,torch.float8_e4m3fnuz,QuantType.per_Token,1,0,128,0,58.0791,moe_ck2stages_gemm2_256x128x128x128_1x4_MulABScaleExpertWeight_v3_Nswizzle0_Quant2_MulRoutedWeight1_F8_F8_B16,3.7%,2.44,15721.39,0
stage2,80,2,6144,384,129,5,ActivationType.Swiglu,torch.bfloat16,torch.float8_e4m3fnuz,torch.float8_e4m3fnuz,QuantType.per_Token,1,0,128,0,79.7697,moe_ck2stages_gemm2_256x128x128x64_1x4_MulABScaleExpertWeight_v3_Nswizzle0_Quant2_MulRoutedWeight1_F8_F8_B16,99.4%,1.77,11446.51,0
stage2,80,2,6144,384,129,5,ActivationType.Swiglu,torch.bfloat16,torch.float8_e4m3fnuz,torch.float8_e4m3fnuz,QuantType.per_Token,1,0,128,0,85.4598,moe_ck2stages_gemm2_256x128x64x64_1x4_MulABScaleExpertWeight_v3_Nswizzle0_Quant2_MulRoutedWeight1_F8_F8_B16,99.4%,1.66,10684.37,0
stage1,80,4,6144,384,129,5,ActivationType.Swiglu,torch.bfloat16,torch.float8_e4m3fnuz,torch.float8_e4m3fnuz,QuantType.per_Token,1,0,16,0,66.2398,_ZN5aiter48fmoe_stage1_bf16_pertokenFp8_g1u1_16x128_4tg_pf2E,98.0%,4.27,13785.09,0
stage1,80,4,6144,384,129,5,ActivationType.Swiglu,torch.bfloat16,torch.float8_e4m3fnuz,torch.float8_e4m3fnuz,QuantType.per_Token,1,0,16,0,39.1964,_ZN5aiter48fmoe_stage1_bf16_pertokenFp8_g1u1_16x128_4tg_pf3E,98.0%,7.22,23296.05,0
stage1,80,4,6144,384,129,5,ActivationType.Swiglu,torch.bfloat16,torch.float8_e4m3fnuz,torch.float8_e4m3fnuz,QuantType.per_Token,1,0,16,0,-1.0,_ZN5aiter48fmoe_stage1_bf16_pertokenFp8_g1u1_16x256_3tg_pf2E,100.0%,0.0,0.0,0
stage1,80,4,6144,384,129,5,ActivationType.Swiglu,torch.bfloat16,torch.float8_e4m3fnuz,torch.float8_e4m3fnuz,QuantType.per_Token,1,0,16,0,-1.0,_ZN5aiter48fmoe_stage1_bf16_pertokenFp8_g1u1_16x256_2tg_pf3E,100.0%,0.0,0.0,0
stage1,80,4,6144,384,129,5,ActivationType.Swiglu,torch.bfloat16,torch.float8_e4m3fnuz,torch.float8_e4m3fnuz,QuantType.per_Token,1,0,16,0,-1.0,_ZN5aiter48fmoe_stage1_bf16_pertokenFp8_g1u1_16x512_2tg_pf2E,100.0%,0.0,0.0,0
stage1,80,4,6144,384,129,5,ActivationType.Swiglu,torch.bfloat16,torch.float8_e4m3fnuz,torch.float8_e4m3fnuz,QuantType.per_Token,1,0,16,0,-1.0,_ZN5aiter44fmoe_stage1_bf16_pertokenFp8_g1u1_16x512_pf3E,100.0%,0.0,0.0,0
stage1,80,4,6144,384,129,5,ActivationType.Swiglu,torch.bfloat16,torch.float8_e4m3fnuz,torch.float8_e4m3fnuz,QuantType.per_Token,1,0,16,0,58.0924,_ZN5aiter47fmoe_stage1_bf16_pertokenFp8_g1u1_16x64_6tg_pf2E,98.0%,4.87,15718.43,0
stage1,80,4,6144,384,129,5,ActivationType.Swiglu,torch.bfloat16,torch.float8_e4m3fnuz,torch.float8_e4m3fnuz,QuantType.per_Token,1,0,16,0,34.5633,_ZN5aiter47fmoe_stage1_bf16_pertokenFp8_g1u1_16x64_5tg_pf3E,98.0%,8.19,26418.81,0
stage1,80,4,6144,384,129,5,ActivationType.Swiglu,torch.bfloat16,torch.float8_e4m3fnuz,torch.float8_e4m3fnuz,QuantType.per_Token,1,0,32,0,65.5271,_ZN5aiter48fmoe_stage1_bf16_pertokenFp8_g1u1_32x128_3tg_pf2E,98.0%,4.32,13935.02,0
stage1,80,4,6144,384,129,5,ActivationType.Swiglu,torch.bfloat16,torch.float8_e4m3fnuz,torch.float8_e4m3fnuz,QuantType.per_Token,1,0,32,0,39.8091,_ZN5aiter48fmoe_stage1_bf16_pertokenFp8_g1u1_32x128_3tg_pf3E,98.0%,7.11,22937.5,0
stage1,80,4,6144,384,129,5,ActivationType.Swiglu,torch.bfloat16,torch.float8_e4m3fnuz,torch.float8_e4m3fnuz,QuantType.per_Token,1,0,32,0,-1.0,_ZN5aiter48fmoe_stage1_bf16_pertokenFp8_g1u1_32x256_2tg_pf2E,100.0%,0.0,0.0,0
stage1,80,4,6144,384,129,5,ActivationType.Swiglu,torch.bfloat16,torch.float8_e4m3fnuz,torch.float8_e4m3fnuz,QuantType.per_Token,1,0,32,0,-1.0,_ZN5aiter48fmoe_stage1_bf16_pertokenFp8_g1u1_32x256_2tg_pf3E,100.0%,0.0,0.0,0
stage1,80,4,6144,384,129,5,ActivationType.Swiglu,torch.bfloat16,torch.float8_e4m3fnuz,torch.float8_e4m3fnuz,QuantType.per_Token,1,0,32,0,-1.0,_ZN5aiter44fmoe_stage1_bf16_pertokenFp8_g1u1_32x512_pf2E,100.0%,0.0,0.0,0
stage1,80,4,6144,384,129,5,ActivationType.Swiglu,torch.bfloat16,torch.float8_e4m3fnuz,torch.float8_e4m3fnuz,QuantType.per_Token,1,0,32,0,-1.0,_ZN5aiter44fmoe_stage1_bf16_pertokenFp8_g1u1_32x512_pf3E,100.0%,0.0,0.0,0
stage1,80,4,6144,384,129,5,ActivationType.Swiglu,torch.bfloat16,torch.float8_e4m3fnuz,torch.float8_e4m3fnuz,QuantType.per_Token,1,0,32,0,59.5266,_ZN5aiter47fmoe_stage1_bf16_pertokenFp8_g1u1_32x64_4tg_pf2E,98.0%,4.76,15339.72,0
stage1,80,4,6144,384,129,5,ActivationType.Swiglu,torch.bfloat16,torch.float8_e4m3fnuz,torch.float8_e4m3fnuz,QuantType.per_Token,1,0,32,0,36.8613,_ZN5aiter47fmoe_stage1_bf16_pertokenFp8_g1u1_32x64_4tg_pf3E,98.0%,7.68,24771.81,0
stage1,80,4,6144,384,129,5,ActivationType.Swiglu,torch.bfloat16,torch.float8_e4m3fnuz,torch.float8_e4m3fnuz,QuantType.per_Token,1,0,64,0,67.2256,_ZN5aiter48fmoe_stage1_bf16_pertokenFp8_g1u1_64x128_2tg_pf2E,98.0%,4.21,13582.94,0
stage1,80,4,6144,384,129,5,ActivationType.Swiglu,torch.bfloat16,torch.float8_e4m3fnuz,torch.float8_e4m3fnuz,QuantType.per_Token,1,0,64,0,45.4656,_ZN5aiter48fmoe_stage1_bf16_pertokenFp8_g1u1_64x128_2tg_pf3E,98.0%,6.23,20083.78,0
stage1,80,4,6144,384,129,5,ActivationType.Swiglu,torch.bfloat16,torch.float8_e4m3fnuz,torch.float8_e4m3fnuz,QuantType.per_Token,1,0,64,0,-1.0,_ZN5aiter44fmoe_stage1_bf16_pertokenFp8_g1u1_64x256_pf2E,100.0%,0.0,0.0,0
stage1,80,4,6144,384,129,5,ActivationType.Swiglu,torch.bfloat16,torch.float8_e4m3fnuz,torch.float8_e4m3fnuz,QuantType.per_Token,1,0,64,0,-1.0,_ZN5aiter44fmoe_stage1_bf16_pertokenFp8_g1u1_64x256_pf3E,100.0%,0.0,0.0,0
stage1,80,4,6144,384,129,5,ActivationType.Swiglu,torch.bfloat16,torch.float8_e4m3fnuz,torch.float8_e4m3fnuz,QuantType.per_Token,1,0,64,0,61.5547,_ZN5aiter47fmoe_stage1_bf16_pertokenFp8_g1u1_64x64_3tg_pf2E,98.0%,4.6,14834.31,0
stage1,80,4,6144,384,129,5,ActivationType.Swiglu,torch.bfloat16,torch.float8_e4m3fnuz,torch.float8_e4m3fnuz,QuantType.per_Token,1,0,64,0,48.0706,_ZN5aiter47fmoe_stage1_bf16_pertokenFp8_g1u1_64x64_2tg_pf3E,98.0%,5.89,18995.42,0
stage1,80,4,6144,384,129,5,ActivationType.Swiglu,torch.bfloat16,torch.float8_e4m3fnuz,torch.float8_e4m3fnuz,QuantType.per_Token,1,0,128,0,84.0569,_ZN5aiter45fmoe_stage1_bf16_pertokenFp8_g1u1_128x128_pf2E,98.0%,3.37,10863.13,0
stage1,80,4,6144,384,129,5,ActivationType.Swiglu,torch.bfloat16,torch.float8_e4m3fnuz,torch.float8_e4m3fnuz,QuantType.per_Token,1,0,128,0,83.0998,_ZN5aiter45fmoe_stage1_bf16_pertokenFp8_g1u1_128x128_pf3E,98.0%,3.41,10988.25,0
stage1,80,4,6144,384,129,5,ActivationType.Swiglu,torch.bfloat16,torch.float8_e4m3fnuz,torch.float8_e4m3fnuz,QuantType.per_Token,1,0,128,0,119.0317,_ZN5aiter44fmoe_stage1_bf16_pertokenFp8_g1u1_128x64_pf2E,98.0%,2.38,7671.24,0
stage1,80,4,6144,384,129,5,ActivationType.Swiglu,torch.bfloat16,torch.float8_e4m3fnuz,torch.float8_e4m3fnuz,QuantType.per_Token,1,0,128,0,98.9937,_ZN5aiter44fmoe_stage1_bf16_pertokenFp8_g1u1_128x64_pf3E,98.0%,2.86,9224.03,0
stage1,80,4,6144,384,129,5,ActivationType.Swiglu,torch.bfloat16,torch.float8_e4m3fnuz,torch.float8_e4m3fnuz,QuantType.per_Token,1,0,16,0,39.9808,moe_ck2stages_gemm1_128x16x64x128_1x2_MulABScale_v1_Nswizzle0_Quant2_MulRoutedWeight0_swiglu_F8_F8_B16,0.0%,7.08,22838.99,0
stage1,80,4,6144,384,129,5,ActivationType.Swiglu,torch.bfloat16,torch.float8_e4m3fnuz,torch.float8_e4m3fnuz,QuantType.per_Token,1,0,16,0,33.3201,moe_ck2stages_gemm1_256x16x128x256_1x4_MulABScale_v1_Nswizzle0_Quant2_MulRoutedWeight0_swiglu_F8_F8_B16,0.0%,8.5,27404.52,0
stage1,80,4,6144,384,129,5,ActivationType.Swiglu,torch.bfloat16,torch.float8_e4m3fnuz,torch.float8_e4m3fnuz,QuantType.per_Token,1,0,16,0,32.4108,moe_ck2stages_gemm1_256x16x64x256_1x4_MulABScale_v1_Nswizzle0_Quant2_MulRoutedWeight0_swiglu_F8_F8_B16,0.0%,8.74,28173.36,0
stage2,80,4,6144,384,129,5,ActivationType.Swiglu,torch.bfloat16,torch.float8_e4m3fnuz,torch.float8_e4m3fnuz,QuantType.per_Token,1,0,16,0,-1.0,moe_ck2stages_gemm2_256x16x128x256_1x4_MulABScaleExpertWeight_v1_Nswizzle0_Quant2_MulRoutedWeight1_F8_F8_B16,100.0%,0.0,0.0,0
stage2,80,4,6144,384,129,5,ActivationType.Swiglu,torch.bfloat16,torch.float8_e4m3fnuz,torch.float8_e4m3fnuz,QuantType.per_Token,1,0,16,0,27.4709,moe_ck2stages_gemm2_128x16x128x128_1x2_MulABScaleExpertWeight_v1_Nswizzle0_Quant2_MulRoutedWeight1_F8_F8_B16,3.6%,10.31,33239.58,0
stage2,80,4,6144,384,129,5,ActivationType.Swiglu,torch.bfloat16,torch.float8_e4m3fnuz,torch.float8_e4m3fnuz,QuantType.per_Token,1,0,16,0,27.8768,moe_ck2stages_gemm2_64x16x64x64_1x1_MulABScaleExpertWeight_v1_Nswizzle0_Quant2_MulRoutedWeight1_F8_F8_B16,3.6%,10.16,32755.6,0
stage1,80,4,6144,384,129,5,ActivationType.Swiglu,torch.bfloat16,torch.float8_e4m3fnuz,torch.float8_e4m3fnuz,QuantType.per_Token,1,0,32,0,38.7567,moe_ck2stages_gemm1_256x32x64x256_1x4_MulABScale_v1_Nswizzle0_Quant2_MulRoutedWeight0_swiglu_F8_F8_B16,0.0%,7.3,23560.35,0
stage1,80,4,6144,384,129,5,ActivationType.Swiglu,torch.bfloat16,torch.float8_e4m3fnuz,torch.float8_e4m3fnuz,QuantType.per_Token,1,0,32,0,39.6588,moe_ck2stages_gemm1_256x32x64x128_1x4_MulABScale_v1_Nswizzle0_Quant2_MulRoutedWeight0_swiglu_F8_F8_B16,0.0%,7.14,23024.43,0
stage2,80,4,6144,384,129,5,ActivationType.Swiglu,torch.bfloat16,torch.float8_e4m3fnuz,torch.float8_e4m3fnuz,QuantType.per_Token,1,0,32,0,-1.0,moe_ck2stages_gemm2_256x32x64x256_1x4_MulABScaleExpertWeight_v1_Nswizzle0_Quant2_MulRoutedWeight1_F8_F8_B16,100.0%,0.0,0.0,0
stage2,80,4,6144,384,129,5,ActivationType.Swiglu,torch.bfloat16,torch.float8_e4m3fnuz,torch.float8_e4m3fnuz,QuantType.per_Token,1,0,32,0,32.784,moe_ck2stages_gemm2_256x32x64x128_1x4_MulABScaleExpertWeight_v1_Nswizzle0_Quant2_MulRoutedWeight1_F8_F8_B16,3.6%,8.64,27852.65,0
stage2,80,4,6144,384,129,5,ActivationType.Swiglu,torch.bfloat16,torch.float8_e4m3fnuz,torch.float8_e4m3fnuz,QuantType.per_Token,1,0,32,0,53.0803,moe_ck2stages_gemm2_256x32x64x64_1x4_MulABScaleExpertWeight_v1_Nswizzle0_Quant2_MulRoutedWeight1_F8_F8_B16,99.5%,5.33,17202.64,0
stage1,80,4,6144,384,129,5,ActivationType.Swiglu,torch.bfloat16,torch.float8_e4m3fnuz,torch.float8_e4m3fnuz,QuantType.per_Token,1,0,64,0,61.0215,moe_ck2stages_gemm1_256x64x64x256_1x4_MulABScale_v1_Nswizzle0_Quant2_MulRoutedWeight0_swiglu_F8_F8_B16,0.0%,4.64,14963.93,0
stage1,80,4,6144,384,129,5,ActivationType.Swiglu,torch.bfloat16,torch.float8_e4m3fnuz,torch.float8_e4m3fnuz,QuantType.per_Token,1,0,64,0,57.7829,moe_ck2stages_gemm1_256x64x64x128_1x4_MulABScale_v1_Nswizzle0_Quant2_MulRoutedWeight0_swiglu_F8_F8_B16,0.0%,4.9,15802.62,0
stage1,80,4,6144,384,129,5,ActivationType.Swiglu,torch.bfloat16,torch.float8_e4m3fnuz,torch.float8_e4m3fnuz,QuantType.per_Token,1,0,64,0,58.0292,moe_ck2stages_gemm1_256x64x128x256_1x4_MulABScale_v3_Nswizzle0_Quant2_MulRoutedWeight0_swiglu_F8_F8_B16,0.0%,4.88,15735.55,0
stage1,80,4,6144,384,129,5,ActivationType.Swiglu,torch.bfloat16,torch.float8_e4m3fnuz,torch.float8_e4m3fnuz,QuantType.per_Token,1,0,64,0,61.3883,moe_ck2stages_gemm1_256x64x128x128_1x4_MulABScale_v3_Nswizzle0_Quant2_MulRoutedWeight0_swiglu_F8_F8_B16,0.0%,4.61,14874.52,0
stage2,80,4,6144,384,129,5,ActivationType.Swiglu,torch.bfloat16,torch.float8_e4m3fnuz,torch.float8_e4m3fnuz,QuantType.per_Token,1,0,64,0,-1.0,moe_ck2stages_gemm2_256x64x64x256_1x4_MulABScaleExpertWeight_v1_Nswizzle0_Quant2_MulRoutedWeight1_F8_F8_B16,100.0%,0.0,0.0,0
stage2,80,4,6144,384,129,5,ActivationType.Swiglu,torch.bfloat16,torch.float8_e4m3fnuz,torch.float8_e4m3fnuz,QuantType.per_Token,1,0,64,0,-1.0,moe_ck2stages_gemm2_256x64x128x256_1x4_MulABScaleExpertWeight_v3_Nswizzle0_Quant2_MulRoutedWeight1_F8_F8_B16,100.0%,0.0,0.0,0
stage2,80,4,6144,384,129,5,ActivationType.Swiglu,torch.bfloat16,torch.float8_e4m3fnuz,torch.float8_e4m3fnuz,QuantType.per_Token,1,0,64,0,67.539,moe_ck2stages_gemm2_256x64x128x128_1x4_MulABScaleExpertWeight_v3_Nswizzle0_Quant2_MulRoutedWeight1_F8_F8_B16,3.7%,4.19,13519.91,0
stage2,80,4,6144,384,129,5,ActivationType.Swiglu,torch.bfloat16,torch.float8_e4m3fnuz,torch.float8_e4m3fnuz,QuantType.per_Token,1,0,64,0,98.4248,moe_ck2stages_gemm2_256x64x128x64_1x4_MulABScaleExpertWeight_v3_Nswizzle0_Quant2_MulRoutedWeight1_F8_F8_B16,99.5%,2.88,9277.35,0
stage2,80,4,6144,384,129,5,ActivationType.Swiglu,torch.bfloat16,torch.float8_e4m3fnuz,torch.float8_e4m3fnuz,QuantType.per_Token,1,0,64,0,89.8465,moe_ck2stages_gemm2_256x64x64x64_1x4_MulABScaleExpertWeight_v1_Nswizzle0_Quant2_MulRoutedWeight1_F8_F8_B16,99.5%,3.15,10163.13,0
stage1,80,4,6144,384,129,5,ActivationType.Swiglu,torch.bfloat16,torch.float8_e4m3fnuz,torch.float8_e4m3fnuz,QuantType.per_Token,1,0,128,0,106.8795,moe_ck2stages_gemm1_256x128x64x128_1x4_MulABScale_v1_Nswizzle0_Quant2_MulRoutedWeight0_swiglu_F8_F8_B16,0.0%,2.65,8543.47,0
stage1,80,4,6144,384,129,5,ActivationType.Swiglu,torch.bfloat16,torch.float8_e4m3fnuz,torch.float8_e4m3fnuz,QuantType.per_Token,1,0,128,0,107.2185,moe_ck2stages_gemm1_256x128x128x256_1x4_MulABScale_v3_Nswizzle0_Quant2_MulRoutedWeight0_swiglu_F8_F8_B16,0.0%,2.64,8516.45,0
stage1,80,4,6144,384,129,5,ActivationType.Swiglu,torch.bfloat16,torch.float8_e4m3fnuz,torch.float8_e4m3fnuz,QuantType.per_Token,1,0,128,0,106.8656,moe_ck2stages_gemm1_256x128x128x128_1x4_MulABScale_v3_Nswizzle0_Quant2_MulRoutedWeight0_swiglu_F8_F8_B16,0.0%,2.65,8544.58,0
stage2,80,4,6144,384,129,5,ActivationType.Swiglu,torch.bfloat16,torch.float8_e4m3fnuz,torch.float8_e4m3fnuz,QuantType.per_Token,1,0,128,0,140.7071,moe_ck2stages_gemm2_256x128x64x128_1x4_MulABScaleExpertWeight_v1_Nswizzle0_Quant2_MulRoutedWeight1_F8_F8_B16,3.7%,2.01,6489.52,0
stage2,80,4,6144,384,129,5,ActivationType.Swiglu,torch.bfloat16,torch.float8_e4m3fnuz,torch.float8_e4m3fnuz,QuantType.per_Token,1,0,128,0,107.1573,moe_ck2stages_gemm2_256x128x128x128_1x4_MulABScaleExpertWeight_v3_Nswizzle0_Quant2_MulRoutedWeight1_F8_F8_B16,3.7%,2.64,8521.32,0
stage2,80,4,6144,384,129,5,ActivationType.Swiglu,torch.bfloat16,torch.float8_e4m3fnuz,torch.float8_e4m3fnuz,QuantType.per_Token,1,0,128,0,149.4888,moe_ck2stages_gemm2_256x128x128x64_1x4_MulABScaleExpertWeight_v3_Nswizzle0_Quant2_MulRoutedWeight1_F8_F8_B16,99.5%,1.89,6108.29,0
stage2,80,4,6144,384,129,5,ActivationType.Swiglu,torch.bfloat16,torch.float8_e4m3fnuz,torch.float8_e4m3fnuz,QuantType.per_Token,1,0,128,0,165.5221,moe_ck2stages_gemm2_256x128x64x64_1x4_MulABScaleExpertWeight_v3_Nswizzle0_Quant2_MulRoutedWeight1_F8_F8_B16,99.5%,1.71,5516.61,0
stage1,80,8,6144,384,129,5,ActivationType.Swiglu,torch.bfloat16,torch.float8_e4m3fnuz,torch.float8_e4m3fnuz,QuantType.per_Token,1,0,16,0,69.7378,_ZN5aiter48fmoe_stage1_bf16_pertokenFp8_g1u1_16x128_4tg_pf2E,98.1%,8.12,13094.69,0
stage1,80,8,6144,384,129,5,ActivationType.Swiglu,torch.bfloat16,torch.float8_e4m3fnuz,torch.float8_e4m3fnuz,QuantType.per_Token,1,0,16,0,55.3908,_ZN5aiter48fmoe_stage1_bf16_pertokenFp8_g1u1_16x128_4tg_pf3E,98.1%,10.22,16486.4,0
stage1,80,8,6144,384,129,5,ActivationType.Swiglu,torch.bfloat16,torch.float8_e4m3fnuz,torch.float8_e4m3fnuz,QuantType.per_Token,1,0,16,0,-1.0,_ZN5aiter48fmoe_stage1_bf16_pertokenFp8_g1u1_16x256_3tg_pf2E,100.0%,0.0,0.0,0
stage1,80,8,6144,384,129,5,ActivationType.Swiglu,torch.bfloat16,torch.float8_e4m3fnuz,torch.float8_e4m3fnuz,QuantType.per_Token,1,0,16,0,-1.0,_ZN5aiter48fmoe_stage1_bf16_pertokenFp8_g1u1_16x256_2tg_pf3E,100.0%,0.0,0.0,0
stage1,80,8,6144,384,129,5,ActivationType.Swiglu,torch.bfloat16,torch.float8_e4m3fnuz,torch.float8_e4m3fnuz,QuantType.per_Token,1,0,16,0,-1.0,_ZN5aiter48fmoe_stage1_bf16_pertokenFp8_g1u1_16x512_2tg_pf2E,100.0%,0.0,0.0,0
stage1,80,8,6144,384,129,5,ActivationType.Swiglu,torch.bfloat16,torch.float8_e4m3fnuz,torch.float8_e4m3fnuz,QuantType.per_Token,1,0,16,0,-1.0,_ZN5aiter44fmoe_stage1_bf16_pertokenFp8_g1u1_16x512_pf3E,100.0%,0.0,0.0,0
stage1,80,8,6144,384,129,5,ActivationType.Swiglu,torch.bfloat16,torch.float8_e4m3fnuz,torch.float8_e4m3fnuz,QuantType.per_Token,1,0,16,0,62.6609,_ZN5aiter47fmoe_stage1_bf16_pertokenFp8_g1u1_16x64_6tg_pf2E,98.1%,9.04,14573.6,0
stage1,80,8,6144,384,129,5,ActivationType.Swiglu,torch.bfloat16,torch.float8_e4m3fnuz,torch.float8_e4m3fnuz,QuantType.per_Token,1,0,16,0,46.7219,_ZN5aiter47fmoe_stage1_bf16_pertokenFp8_g1u1_16x64_5tg_pf3E,98.1%,12.12,19545.33,0
stage1,80,8,6144,384,129,5,ActivationType.Swiglu,torch.bfloat16,torch.float8_e4m3fnuz,torch.float8_e4m3fnuz,QuantType.per_Token,1,0,32,0,70.0932,_ZN5aiter48fmoe_stage1_bf16_pertokenFp8_g1u1_32x128_3tg_pf2E,98.1%,8.08,13028.3,0
stage1,80,8,6144,384,129,5,ActivationType.Swiglu,torch.bfloat16,torch.float8_e4m3fnuz,torch.float8_e4m3fnuz,QuantType.per_Token,1,0,32,0,59.3131,_ZN5aiter48fmoe_stage1_bf16_pertokenFp8_g1u1_32x128_3tg_pf3E,98.1%,9.55,15396.18,0
stage1,80,8,6144,384,129,5,ActivationType.Swiglu,torch.bfloat16,torch.float8_e4m3fnuz,torch.float8_e4m3fnuz,QuantType.per_Token,1,0,32,0,-1.0,_ZN5aiter48fmoe_stage1_bf16_pertokenFp8_g1u1_32x256_2tg_pf2E,100.0%,0.0,0.0,0
stage1,80,8,6144,384,129,5,ActivationType.Swiglu,torch.bfloat16,torch.float8_e4m3fnuz,torch.float8_e4m3fnuz,QuantType.per_Token,1,0,32,0,-1.0,_ZN5aiter48fmoe_stage1_bf16_pertokenFp8_g1u1_32x256_2tg_pf3E,100.0%,0.0,0.0,0
stage1,80,8,6144,384,129,5,ActivationType.Swiglu,torch.bfloat16,torch.float8_e4m3fnuz,torch.float8_e4m3fnuz,QuantType.per_Token,1,0,32,0,-1.0,_ZN5aiter44fmoe_stage1_bf16_pertokenFp8_g1u1_32x512_pf2E,100.0%,0.0,0.0,0
stage1,80,8,6144,384,129,5,ActivationType.Swiglu,torch.bfloat16,torch.float8_e4m3fnuz,torch.float8_e4m3fnuz,QuantType.per_Token,1,0,32,0,-1.0,_ZN5aiter44fmoe_stage1_bf16_pertokenFp8_g1u1_32x512_pf3E,100.0%,0.0,0.0,0
stage1,80,8,6144,384,129,5,ActivationType.Swiglu,torch.bfloat16,torch.float8_e4m3fnuz,torch.float8_e4m3fnuz,QuantType.per_Token,1,0,32,0,64.426,_ZN5aiter47fmoe_stage1_bf16_pertokenFp8_g1u1_32x64_4tg_pf2E,98.1%,8.79,14174.32,0
stage1,80,8,6144,384,129,5,ActivationType.Swiglu,torch.bfloat16,torch.float8_e4m3fnuz,torch.float8_e4m3fnuz,QuantType.per_Token,1,0,32,0,49.2308,_ZN5aiter47fmoe_stage1_bf16_pertokenFp8_g1u1_32x64_4tg_pf3E,98.1%,11.5,18549.26,0
stage1,80,8,6144,384,129,5,ActivationType.Swiglu,torch.bfloat16,torch.float8_e4m3fnuz,torch.float8_e4m3fnuz,QuantType.per_Token,1,0,64,0,87.8576,_ZN5aiter48fmoe_stage1_bf16_pertokenFp8_g1u1_64x128_2tg_pf2E,98.1%,6.44,10394.04,0
stage1,80,8,6144,384,129,5,ActivationType.Swiglu,torch.bfloat16,torch.float8_e4m3fnuz,torch.float8_e4m3fnuz,QuantType.per_Token,1,0,64,0,80.5197,_ZN5aiter48fmoe_stage1_bf16_pertokenFp8_g1u1_64x128_2tg_pf3E,98.1%,7.03,11341.26,0
