aiter/configs/profile_fmoe.csv
cu_num,token,model_dim,inter_dim,expert,topk,act_type,dtype,q_dtype_a,q_dtype_w,q_type,use_g1u1,doweight_stage1,block_m,ksplit,us1,kernelName1,err1,us2,kernelName2,err2,us,run_1stage,tflops,bw,stage,kernelName,err
256,1,3072,512,128,4,ActivationType.Swiglu,torch.bfloat16,torch.bfloat16,torch.float4_e2m1fn_x2,QuantType.per_1x32,1,0,32,0,20.0949,moe_cktile2stages_gemm1_256x32x256x256_1x4_16x16x32_2perCU_1x32_HasBias_swiglu,0.0%,12.99,moe_cktile2stages_gemm2_256x32x256x256_1x4_16x16x32_3perCU_1x32_MulRoutedWeight_HasBias,1.5%,33.0849,0.0,1.14,18255.82,,,
256,1,3072,512,128,4,ActivationType.Swiglu,torch.bfloat16,torch.bfloat16,torch.float4_e2m1fn_x2,QuantType.per_1x32,1,0,64,0,28.6928,moe_cktile2stages_gemm1_256x64x256x256_1x4_16x16x32_3perCU_1x32_HasBias_swiglu,0.0%,14.3538,moe_cktile2stages_gemm2_256x64x256x256_1x4_16x16x32_2perCU_1x32_MulRoutedWeight_HasBias,1.5%,43.0466,0.0,0.88,14031.12,,,
256,1,3072,1536,128,4,ActivationType.Swiglu,torch.bfloat16,torch.bfloat16,torch.float4_e2m1fn_x2,QuantType.per_1x32,1,0,32,0,21.3396,moe_cktile2stages_gemm1_256x32x256x256_1x4_16x16x32_2perCU_1x32_HasBias_swiglu,0.0%,16.1318,moe_cktile2stages_gemm2_256x32x256x256_1x4_16x16x32_2perCU_1x32_MulRoutedWeight_HasBias,3.7%,37.4714,0.0,3.02,48355.59,,,
256,1,3072,1536,128,4,ActivationType.Swiglu,torch.bfloat16,torch.bfloat16,torch.float4_e2m1fn_x2,QuantType.per_1x32,1,0,64,0,29.5922,moe_cktile2stages_gemm1_256x64x256x256_1x4_16x16x32_3perCU_1x32_HasBias_swiglu,0.0%,21.1024,moe_cktile2stages_gemm2_256x64x256x256_1x4_16x16x32_4perCU_1x32_MulRoutedWeight_HasBias,3.4%,50.6946,0.0,2.23,35742.5,,,
256,1,3072,3072,128,4,ActivationType.Swiglu,torch.bfloat16,torch.bfloat16,torch.float4_e2m1fn_x2,QuantType.per_1x32,1,0,32,0,21.5307,moe_cktile2stages_gemm1_256x32x256x256_1x4_16x16x32_1perCU_1x32_HasBias_swiglu,0.0%,22.9923,moe_cktile2stages_gemm2_256x32x256x256_1x4_16x16x32_2perCU_1x32_MulRoutedWeight_HasBias,4.9%,44.523,0.0,5.09,81393.68,,,
256,1,3072,3072,128,4,ActivationType.Swiglu,torch.bfloat16,torch.bfloat16,torch.float4_e2m1fn_x2,QuantType.per_1x32,1,0,64,0,30.1049,moe_cktile2stages_gemm1_256x64x256x256_1x4_16x16x32_1perCU_1x32_HasBias_swiglu,0.0%,33.1252,moe_cktile2stages_gemm2_256x64x256x256_1x4_16x16x32_3perCU_1x32_MulRoutedWeight_HasBias,4.9%,63.2301,0.0,3.58,57312.75,,,
256,2,3072,512,128,4,ActivationType.Swiglu,torch.bfloat16,torch.bfloat16,torch.float4_e2m1fn_x2,QuantType.per_1x32,1,0,32,0,20.3295,moe_cktile2stages_gemm1_256x32x256x256_1x4_16x16x32_1perCU_1x32_HasBias_swiglu,0.0%,12.2052,moe_cktile2stages_gemm2_256x32x256x256_1x4_16x16x32_1perCU_1x32_MulRoutedWeight_HasBias,1.7%,32.5347,0.0,2.32,18564.93,,,
256,2,3072,512,128,4,ActivationType.Swiglu,torch.bfloat16,torch.bfloat16,torch.float4_e2m1fn_x2,QuantType.per_1x32,1,0,64,0,29.1904,moe_cktile2stages_gemm1_256x64x256x256_1x4_16x16x32_1perCU_1x32_HasBias_swiglu,0.0%,14.4522,moe_cktile2stages_gemm2_256x64x256x256_1x4_16x16x32_1perCU_1x32_MulRoutedWeight_HasBias,1.5%,43.6426,0.0,1.73,13839.79,,,
256,2,3072,1536,128,4,ActivationType.Swiglu,torch.bfloat16,torch.bfloat16,torch.float4_e2m1fn_x2,QuantType.per_1x32,1,0,32,0,22.0343,moe_cktile2stages_gemm1_256x32x256x256_1x4_16x16x32_1perCU_1x32_HasBias_swiglu,0.0%,16.933,moe_cktile2stages_gemm2_256x32x256x256_1x4_16x16x32_1perCU_1x32_MulRoutedWeight_HasBias,2.5%,38.9673,0.0,5.81,46499.6,,,
256,2,3072,1536,128,4,ActivationType.Swiglu,torch.bfloat16,torch.bfloat16,torch.float4_e2m1fn_x2,QuantType.per_1x32,1,0,64,0,29.9462,moe_cktile2stages_gemm1_256x64x256x256_1x4_16x16x32_4perCU_1x32_HasBias_swiglu,0.0%,21.3296,moe_cktile2stages_gemm2_256x64x256x256_1x4_16x16x32_4perCU_1x32_MulRoutedWeight_HasBias,2.4%,51.2758,0.0,4.42,35337.6,,,
256,2,3072,3072,128,4,ActivationType.Swiglu,torch.bfloat16,torch.bfloat16,torch.float4_e2m1fn_x2,QuantType.per_1x32,1,0,32,0,24.3525,moe_cktile2stages_gemm1_256x32x256x256_1x4_16x16x32_2perCU_1x32_HasBias_swiglu,0.0%,22.242,moe_cktile2stages_gemm2_256x32x256x256_1x4_16x16x32_1perCU_1x32_MulRoutedWeight_HasBias,4.4%,46.5945,0.0,9.72,77775.34,,,
256,2,3072,3072,128,4,ActivationType.Swiglu,torch.bfloat16,torch.bfloat16,torch.float4_e2m1fn_x2,QuantType.per_1x32,1,0,64,0,32.5153,moe_cktile2stages_gemm1_256x64x256x256_1x4_16x16x32_4perCU_1x32_HasBias_swiglu,0.0%,33.0412,moe_cktile2stages_gemm2_256x64x256x256_1x4_16x16x32_4perCU_1x32_MulRoutedWeight_HasBias,4.0%,65.5565,0.0,6.91,55279.08,,,
256,4,3072,512,128,4,ActivationType.Swiglu,torch.bfloat16,torch.bfloat16,torch.float4_e2m1fn_x2,QuantType.per_1x32,1,0,32,0,20.6052,moe_cktile2stages_gemm1_256x32x256x256_1x4_16x16x32_2perCU_1x32_HasBias_swiglu,0.0%,13.2302,moe_cktile2stages_gemm2_256x32x256x256_1x4_16x16x32_2perCU_1x32_MulRoutedWeight_HasBias,1.5%,33.8354,0.0,4.46,17851.98,,,
256,4,3072,512,128,4,ActivationType.Swiglu,torch.bfloat16,torch.bfloat16,torch.float4_e2m1fn_x2,QuantType.per_1x32,1,0,64,0,29.6817,moe_cktile2stages_gemm1_256x64x256x256_1x4_16x16x32_4perCU_1x32_HasBias_swiglu,0.0%,15.4975,moe_cktile2stages_gemm2_256x64x256x256_1x4_16x16x32_2perCU_1x32_MulRoutedWeight_HasBias,1.5%,45.1792,0.0,3.34,13369.62,,,
256,4,3072,1536,128,4,ActivationType.Swiglu,torch.bfloat16,torch.bfloat16,torch.float4_e2m1fn_x2,QuantType.per_1x32,1,0,32,0,24.3529,moe_cktile2stages_gemm1_256x32x256x256_1x4_16x16x32_1perCU_1x32_HasBias_swiglu,0.0%,19.8646,moe_cktile2stages_gemm2_256x32x256x256_1x4_16x16x32_1perCU_1x32_MulRoutedWeight_HasBias,3.1%,44.2175,0.0,10.24,40978.99,,,
256,4,3072,1536,128,4,ActivationType.Swiglu,torch.bfloat16,torch.bfloat16,torch.float4_e2m1fn_x2,QuantType.per_1x32,1,0,64,0,32.0902,moe_cktile2stages_gemm1_256x64x256x256_1x4_16x16x32_3perCU_1x32_HasBias_swiglu,0.0%,23.1325,moe_cktile2stages_gemm2_256x64x256x256_1x4_16x16x32_3perCU_1x32_MulRoutedWeight_HasBias,3.0%,55.2227,0.0,8.2,32812.38,,,
256,4,3072,3072,128,4,ActivationType.Swiglu,torch.bfloat16,torch.bfloat16,torch.float4_e2m1fn_x2,QuantType.per_1x32,1,0,32,0,38.7654,moe_cktile2stages_gemm1_256x32x256x256_1x4_16x16x32_2perCU_1x32_HasBias_swiglu,0.0%,25.1914,moe_cktile2stages_gemm2_256x32x256x256_1x4_16x16x32_2perCU_1x32_MulRoutedWeight_HasBias,4.9%,63.9568,0.0,14.17,56662.12,,,
256,4,3072,3072,128,4,ActivationType.Swiglu,torch.bfloat16,torch.bfloat16,torch.float4_e2m1fn_x2,QuantType.per_1x32,1,0,64,0,58.5062,moe_cktile2stages_gemm1_256x64x256x256_1x4_16x16x32_3perCU_1x32_HasBias_swiglu,0.0%,35.5564,moe_cktile2stages_gemm2_256x64x256x256_1x4_16x16x32_1perCU_1x32_MulRoutedWeight_HasBias,4.9%,94.0626,0.0,9.63,38526.77,,,
256,8,3072,512,128,4,ActivationType.Swiglu,torch.bfloat16,torch.bfloat16,torch.float4_e2m1fn_x2,QuantType.per_1x32,1,0,32,0,22.0404,moe_cktile2stages_gemm1_256x32x256x256_1x4_16x16x32_2perCU_1x32_HasBias_swiglu,0.0%,16.5516,moe_cktile2stages_gemm2_256x32x256x256_1x4_16x16x32_2perCU_1x32_MulRoutedWeight_HasBias,1.5%,38.592,0.0,7.83,15652.94,,,
256,8,3072,512,128,4,ActivationType.Swiglu,torch.bfloat16,torch.bfloat16,torch.float4_e2m1fn_x2,QuantType.per_1x32,1,0,64,0,30.1244,moe_cktile2stages_gemm1_256x64x256x256_1x4_16x16x32_1perCU_1x32_HasBias_swiglu,0.0%,21.2334,moe_cktile2stages_gemm2_256x64x256x256_1x4_16x16x32_2perCU_1x32_MulRoutedWeight_HasBias,1.6%,51.3578,0.0,5.88,11762.15,,,
256,8,3072,1536,128,4,ActivationType.Swiglu,torch.bfloat16,torch.bfloat16,torch.float4_e2m1fn_x2,QuantType.per_1x32,1,0,32,0,37.3129,moe_cktile2stages_gemm1_256x32x256x256_1x4_16x16x32_2perCU_1x32_HasBias_swiglu,0.0%,25.8317,moe_cktile2stages_gemm2_256x32x256x256_1x4_16x16x32_2perCU_1x32_MulRoutedWeight_HasBias,3.5%,63.1446,0.0,14.35,28696.64,,,
256,8,3072,1536,128,4,ActivationType.Swiglu,torch.bfloat16,torch.bfloat16,torch.float4_e2m1fn_x2,QuantType.per_1x32,1,0,64,0,58.5646,moe_cktile2stages_gemm1_256x64x256x256_1x4_16x16x32_1perCU_1x32_HasBias_swiglu,0.0%,40.3956,moe_cktile2stages_gemm2_256x64x256x256_1x4_16x16x32_2perCU_1x32_MulRoutedWeight_HasBias,3.5%,98.9602,0.0,9.15,18310.77,,,
256,8,3072,3072,128,4,ActivationType.Swiglu,torch.bfloat16,torch.bfloat16,torch.float4_e2m1fn_x2,QuantType.per_1x32,1,0,32,0,57.9578,moe_cktile2stages_gemm1_256x32x256x256_1x4_16x16x32_1perCU_1x32_HasBias_swiglu,0.0%,41.4371,moe_cktile2stages_gemm2_256x32x256x256_1x4_16x16x32_1perCU_1x32_MulRoutedWeight_HasBias,4.7%,99.3949,0.0,18.23,36460.39,,,
256,8,3072,3072,128,4,ActivationType.Swiglu,torch.bfloat16,torch.bfloat16,torch.float4_e2m1fn_x2,QuantType.per_1x32,1,0,64,0,88.2001,moe_cktile2stages_gemm1_256x64x256x256_1x4_16x16x32_4perCU_1x32_HasBias_swiglu,0.0%,61.4498,moe_cktile2stages_gemm2_256x64x256x256_1x4_16x16x32_4perCU_1x32_MulRoutedWeight_HasBias,4.7%,149.6499,0.0,12.11,24216.37,,,
256,16,3072,512,128,4,ActivationType.Swiglu,torch.bfloat16,torch.bfloat16,torch.float4_e2m1fn_x2,QuantType.per_1x32,1,0,32,0,24.8585,moe_cktile2stages_gemm1_256x32x256x256_1x4_16x16x32_2perCU_1x32_HasBias_swiglu,0.0%,21.3628,moe_cktile2stages_gemm2_256x32x256x256_1x4_16x16x32_1perCU_1x32_MulRoutedWeight_HasBias,1.5%,46.2213,0.0,13.07,13071.38,,,
256,16,3072,512,128,4,ActivationType.Swiglu,torch.bfloat16,torch.bfloat16,torch.float4_e2m1fn_x2,QuantType.per_1x32,1,0,64,0,33.5296,moe_cktile2stages_gemm1_256x64x256x256_1x4_16x16x32_1perCU_1x32_HasBias_swiglu,0.0%,27.2475,moe_cktile2stages_gemm2_256x64x256x256_1x4_16x16x32_2perCU_1x32_MulRoutedWeight_HasBias,1.5%,60.7771,0.0,9.94,9940.86,,,
256,16,3072,1536,128,4,ActivationType.Swiglu,torch.bfloat16,torch.bfloat16,torch.float4_e2m1fn_x2,QuantType.per_1x32,1,0,32,0,56.1759,moe_cktile2stages_gemm1_256x32x256x256_1x4_16x16x32_2perCU_1x32_HasBias_swiglu,0.0%,38.2648,moe_cktile2stages_gemm2_256x32x256x256_1x4_16x16x32_1perCU_1x32_MulRoutedWeight_HasBias,3.5%,94.4407,0.0,19.19,19188.08,,,
256,16,3072,1536,128,4,ActivationType.Swiglu,torch.bfloat16,torch.bfloat16,torch.float4_e2m1fn_x2,QuantType.per_1x32,1,0,64,0,85.1168,moe_cktile2stages_gemm1_256x64x256x256_1x4_16x16x32_4perCU_1x32_HasBias_swiglu,0.0%,57.2585,moe_cktile2stages_gemm2_256x64x256x256_1x4_16x16x32_3perCU_1x32_MulRoutedWeight_HasBias,3.5%,142.3753,0.0,12.73,12727.88,,,
256,16,3072,3072,128,4,ActivationType.Swiglu,torch.bfloat16,torch.bfloat16,torch.float4_e2m1fn_x2,QuantType.per_1x32,1,0,32,0,93.1417,moe_cktile2stages_gemm1_256x32x256x256_1x4_16x16x32_2perCU_1x32_HasBias_swiglu,0.0%,60.0841,moe_cktile2stages_gemm2_256x32x256x256_1x4_16x16x32_2perCU_1x32_MulRoutedWeight_HasBias,5.1%,153.2258,0.0,23.65,23651.86,,,
256,16,3072,3072,128,4,ActivationType.Swiglu,torch.bfloat16,torch.bfloat16,torch.float4_e2m1fn_x2,QuantType.per_1x32,1,0,64,0,141.6662,moe_cktile2stages_gemm1_256x64x256x256_1x4_16x16x32_4perCU_1x32_HasBias_swiglu,0.0%,87.903,moe_cktile2stages_gemm2_256x64x256x256_1x4_16x16x32_3perCU_1x32_MulRoutedWeight_HasBias,5.0%,229.5692,0.0,15.79,15786.42,,,
256,32,3072,512,128,4,ActivationType.Swiglu,torch.bfloat16,torch.bfloat16,torch.float4_e2m1fn_x2,QuantType.per_1x32,1,0,32,0,37.1769,moe_cktile2stages_gemm1_256x32x256x256_1x4_16x16x32_2perCU_1x32_HasBias_swiglu,0.0%,27.9199,moe_cktile2stages_gemm2_256x32x256x256_1x4_16x16x32_1perCU_1x32_MulRoutedWeight_HasBias,1.5%,65.0968,0.0,18.56,9284.22,,,
256,32,3072,512,128,4,ActivationType.Swiglu,torch.bfloat16,torch.bfloat16,torch.float4_e2m1fn_x2,QuantType.per_1x32,1,0,64,0,58.8468,moe_cktile2stages_gemm1_256x64x256x256_1x4_16x16x32_1perCU_1x32_HasBias_swiglu,0.0%,38.5006,moe_cktile2stages_gemm2_256x64x256x256_1x4_16x16x32_2perCU_1x32_MulRoutedWeight_HasBias,1.5%,97.3474,0.0,12.41,6208.41,,,
256,32,3072,1536,128,4,ActivationType.Swiglu,torch.bfloat16,torch.bfloat16,torch.float4_e2m1fn_x2,QuantType.per_1x32,1,0,32,0,73.8714,moe_cktile2stages_gemm1_256x32x256x256_1x4_16x16x32_2perCU_1x32_HasBias_swiglu,0.0%,48.8575,moe_cktile2stages_gemm2_256x32x256x256_1x4_16x16x32_1perCU_1x32_MulRoutedWeight_HasBias,3.6%,122.7289,0.0,29.53,14766.96,,,
256,32,3072,1536,128,4,ActivationType.Swiglu,torch.bfloat16,torch.bfloat16,torch.float4_e2m1fn_x2,QuantType.per_1x32,1,0,64,0,112.127,moe_cktile2stages_gemm1_256x64x256x256_1x4_16x16x32_1perCU_1x32_HasBias_swiglu,0.0%,74.0018,moe_cktile2stages_gemm2_256x64x256x256_1x4_16x16x32_4perCU_1x32_MulRoutedWeight_HasBias,3.7%,186.1288,0.0,19.47,9736.98,,,
256,32,3072,3072,128,4,ActivationType.Swiglu,torch.bfloat16,torch.bfloat16,torch.float4_e2m1fn_x2,QuantType.per_1x32,1,0,32,0,152.8735,moe_cktile2stages_gemm1_256x32x256x256_1x4_16x16x32_2perCU_1x32_HasBias_swiglu,0.0%,90.6918,moe_cktile2stages_gemm2_256x32x256x256_1x4_16x16x32_2perCU_1x32_MulRoutedWeight_HasBias,5.2%,243.5653,0.0,29.76,14880.08,,,
256,32,3072,3072,128,4,ActivationType.Swiglu,torch.bfloat16,torch.bfloat16,torch.float4_e2m1fn_x2,QuantType.per_1x32,1,0,64,0,241.8984,moe_cktile2stages_gemm1_256x64x256x256_1x4_16x16x32_3perCU_1x32_HasBias_swiglu,0.0%,137.2409,moe_cktile2stages_gemm2_256x64x256x256_1x4_16x16x32_4perCU_1x32_MulRoutedWeight_HasBias,5.1%,379.1393,0.0,19.12,9559.21,,,
256,64,3072,512,128,4,ActivationType.Swiglu,torch.bfloat16,torch.bfloat16,torch.float4_e2m1fn_x2,QuantType.per_1x32,1,0,32,0,39.4048,moe_cktile2stages_gemm1_256x32x256x256_1x4_16x16x32_2perCU_1x32_HasBias_swiglu,0.0%,31.0879,moe_cktile2stages_gemm2_256x32x256x256_1x4_16x16x32_2perCU_1x32_MulRoutedWeight_HasBias,1.6%,70.4927,0.0,34.27,8579.13,,,
256,64,3072,512,128,4,ActivationType.Swiglu,torch.bfloat16,torch.bfloat16,torch.float4_e2m1fn_x2,QuantType.per_1x32,1,0,64,0,59.8899,moe_cktile2stages_gemm1_256x64x256x256_1x4_16x16x32_3perCU_1x32_HasBias_swiglu,0.0%,40.4752,moe_cktile2stages_gemm2_256x64x256x256_1x4_16x16x32_2perCU_1x32_MulRoutedWeight_HasBias,1.6%,100.3651,0.0,24.07,6025.66,,,
256,64,3072,1536,128,4,ActivationType.Swiglu,torch.bfloat16,torch.bfloat16,torch.float4_e2m1fn_x2,QuantType.per_1x32,1,0,32,0,104.6981,moe_cktile2stages_gemm1_256x32x256x256_1x4_16x16x32_1perCU_1x32_HasBias_swiglu,0.0%,66.5081,moe_cktile2stages_gemm2_256x32x256x256_1x4_16x16x32_1perCU_1x32_MulRoutedWeight_HasBias,3.6%,171.2062,0.0,42.33,10587.97,,,
256,64,3072,1536,128,4,ActivationType.Swiglu,torch.bfloat16,torch.bfloat16,torch.float4_e2m1fn_x2,QuantType.per_1x32,1,0,64,0,163.442,moe_cktile2stages_gemm1_256x64x256x256_1x4_16x16x32_3perCU_1x32_HasBias_swiglu,0.0%,102.132,moe_cktile2stages_gemm2_256x64x256x256_1x4_16x16x32_2perCU_1x32_MulRoutedWeight_HasBias,3.6%,265.574,0.0,27.29,6825.69,,,
256,64,3072,3072,128,4,ActivationType.Swiglu,torch.bfloat16,torch.bfloat16,torch.float4_e2m1fn_x2,QuantType.per_1x32,1,0,32,0,189.6557,moe_cktile2stages_gemm1_256x32x256x256_1x4_16x16x32_2perCU_1x32_HasBias_swiglu,0.0%,107.9392,moe_cktile2stages_gemm2_256x32x256x256_1x4_16x16x32_1perCU_1x32_MulRoutedWeight_HasBias,5.1%,297.5949,0.0,48.71,12179.86,,,
256,64,3072,3072,128,4,ActivationType.Swiglu,torch.bfloat16,torch.bfloat16,torch.float4_e2m1fn_x2,QuantType.per_1x32,1,0,64,0,295.555,moe_cktile2stages_gemm1_256x64x256x256_1x4_16x16x32_4perCU_1x32_HasBias_swiglu,0.0%,162.6198,moe_cktile2stages_gemm2_256x64x256x256_1x4_16x16x32_4perCU_1x32_MulRoutedWeight_HasBias,5.1%,458.1748,0.0,31.64,7911.1,,,
256,128,3072,512,128,4,ActivationType.Swiglu,torch.bfloat16,torch.bfloat16,torch.float4_e2m1fn_x2,QuantType.per_1x32,1,0,32,0,44.2655,moe_cktile2stages_gemm1_256x32x256x256_1x4_16x16x32_2perCU_1x32_HasBias_swiglu,0.0%,36.3031,moe_cktile2stages_gemm2_256x32x256x256_1x4_16x16x32_2perCU_1x32_MulRoutedWeight_HasBias,1.6%,80.5686,0.0,59.97,7515.99,,,
256,128,3072,512,128,4,ActivationType.Swiglu,torch.bfloat16,torch.bfloat16,torch.float4_e2m1fn_x2,QuantType.per_1x32,1,0,64,0,63.3299,moe_cktile2stages_gemm1_256x64x256x256_1x4_16x16x32_1perCU_1x32_HasBias_swiglu,0.0%,46.1506,moe_cktile2stages_gemm2_256x64x256x256_1x4_16x16x32_2perCU_1x32_MulRoutedWeight_HasBias,1.5%,109.4805,0.0,44.13,5531.15,,,
256,128,3072,1536,128,4,ActivationType.Swiglu,torch.bfloat16,torch.bfloat16,torch.float4_e2m1fn_x2,QuantType.per_1x32,1,0,32,0,113.1344,moe_cktile2stages_gemm1_256x32x256x256_1x4_16x16x32_2perCU_1x32_HasBias_swiglu,0.0%,68.503,moe_cktile2stages_gemm2_256x32x256x256_1x4_16x16x32_2perCU_1x32_MulRoutedWeight_HasBias,3.7%,181.6374,0.0,79.8,9984.24,,,
256,128,3072,1536,128,4,ActivationType.Swiglu,torch.bfloat16,torch.bfloat16,torch.float4_e2m1fn_x2,QuantType.per_1x32,1,0,64,0,169.7695,moe_cktile2stages_gemm1_256x64x256x256_1x4_16x16x32_3perCU_1x32_HasBias_swiglu,0.0%,105.8331,moe_cktile2stages_gemm2_256x64x256x256_1x4_16x16x32_4perCU_1x32_MulRoutedWeight_HasBias,3.7%,275.6026,0.0,52.6,6580.17,,,
256,128,3072,3072,128,4,ActivationType.Swiglu,torch.bfloat16,torch.bfloat16,torch.float4_e2m1fn_x2,QuantType.per_1x32,1,0,32,0,207.2096,moe_cktile2stages_gemm1_256x32x256x256_1x4_16x16x32_2perCU_1x32_HasBias_swiglu,0.0%,113.0333,moe_cktile2stages_gemm2_256x32x256x256_1x4_16x16x32_2perCU_1x32_MulRoutedWeight_HasBias,5.0%,320.2429,0.0,90.53,11320.94,,,
256,128,3072,3072,128,4,ActivationType.Swiglu,torch.bfloat16,torch.bfloat16,torch.float4_e2m1fn_x2,QuantType.per_1x32,1,0,64,0,325.0731,moe_cktile2stages_gemm1_256x64x256x256_1x4_16x16x32_4perCU_1x32_HasBias_swiglu,0.0%,170.3918,moe_cktile2stages_gemm2_256x64x256x256_1x4_16x16x32_4perCU_1x32_MulRoutedWeight_HasBias,5.0%,495.4649,0.0,58.51,7317.27,,,
256,256,3072,512,128,4,ActivationType.Swiglu,torch.bfloat16,torch.bfloat16,torch.float4_e2m1fn_x2,QuantType.per_1x32,1,0,32,0,43.9785,moe_cktile2stages_gemm1_256x32x256x256_1x4_16x16x32_1perCU_1x32_HasBias_swiglu,0.0%,36.3279,moe_cktile2stages_gemm2_256x32x256x256_1x4_16x16x32_2perCU_1x32_MulRoutedWeight_HasBias,1.5%,80.3064,0.0,120.34,7560.11,,,
256,256,3072,512,128,4,ActivationType.Swiglu,torch.bfloat16,torch.bfloat16,torch.float4_e2m1fn_x2,QuantType.per_1x32,1,0,64,0,62.3207,moe_cktile2stages_gemm1_256x64x256x256_1x4_16x16x32_1perCU_1x32_HasBias_swiglu,0.0%,47.2265,moe_cktile2stages_gemm2_256x64x256x256_1x4_16x16x32_2perCU_1x32_MulRoutedWeight_HasBias,1.5%,109.5472,0.0,88.21,5542.14,,,
256,256,3072,1536,128,4,ActivationType.Swiglu,torch.bfloat16,torch.bfloat16,torch.float4_e2m1fn_x2,QuantType.per_1x32,1,0,32,0,113.9164,moe_cktile2stages_gemm1_256x32x256x256_1x4_16x16x32_1perCU_1x32_HasBias_swiglu,0.0%,71.1144,moe_cktile2stages_gemm2_256x32x256x256_1x4_16x16x32_2perCU_1x32_MulRoutedWeight_HasBias,3.7%,185.0308,0.0,156.68,9809.64,,,
256,256,3072,1536,128,4,ActivationType.Swiglu,torch.bfloat16,torch.bfloat16,torch.float4_e2m1fn_x2,QuantType.per_1x32,1,0,64,0,173.0619,moe_cktile2stages_gemm1_256x64x256x256_1x4_16x16x32_1perCU_1x32_HasBias_swiglu,0.0%,107.4549,moe_cktile2stages_gemm2_256x64x256x256_1x4_16x16x32_4perCU_1x32_MulRoutedWeight_HasBias,3.7%,280.5168,0.0,103.35,6470.5,,,
256,256,3072,3072,128,4,ActivationType.Swiglu,torch.bfloat16,torch.bfloat16,torch.float4_e2m1fn_x2,QuantType.per_1x32,1,0,32,0,215.6205,moe_cktile2stages_gemm1_256x32x256x256_1x4_16x16x32_1perCU_1x32_HasBias_swiglu,0.0%,118.0917,moe_cktile2stages_gemm2_256x32x256x256_1x4_16x16x32_1perCU_1x32_MulRoutedWeight_HasBias,5.1%,333.7122,0.0,173.75,10868.72,,,
256,256,3072,3072,128,4,ActivationType.Swiglu,torch.bfloat16,torch.bfloat16,torch.float4_e2m1fn_x2,QuantType.per_1x32,1,0,64,0,329.056,moe_cktile2stages_gemm1_256x64x256x256_1x4_16x16x32_3perCU_1x32_HasBias_swiglu,0.0%,174.5214,moe_cktile2stages_gemm2_256x64x256x256_1x4_16x16x32_4perCU_1x32_MulRoutedWeight_HasBias,5.1%,503.5774,0.0,115.14,7202.52,,,
256,512,3072,512,128,4,ActivationType.Swiglu,torch.bfloat16,torch.bfloat16,torch.float4_e2m1fn_x2,QuantType.per_1x32,1,0,32,0,48.5191,moe_cktile2stages_gemm1_256x32x256x256_1x4_16x16x32_2perCU_1x32_HasBias_swiglu,0.0%,37.2825,moe_cktile2stages_gemm2_256x32x256x256_1x4_16x16x32_1perCU_1x32_MulRoutedWeight_HasBias,1.5%,85.8016,0.0,225.26,7112.59,,,
256,512,3072,512,128,4,ActivationType.Swiglu,torch.bfloat16,torch.bfloat16,torch.float4_e2m1fn_x2,QuantType.per_1x32,1,0,64,0,64.7392,moe_cktile2stages_gemm1_256x64x256x256_1x4_16x16x32_3perCU_1x32_HasBias_swiglu,0.0%,48.0488,moe_cktile2stages_gemm2_256x64x256x256_1x4_16x16x32_2perCU_1x32_MulRoutedWeight_HasBias,1.5%,112.788,0.0,171.36,5410.78,,,
256,512,3072,512,128,4,ActivationType.Swiglu,torch.bfloat16,torch.float8_e4m3fn,torch.float4_e2m1fn_x2,QuantType.per_1x32,1,0,32,0,46.6092,moe_cktile2stages_gemm1_256x32x256x256_1x4_16x16x128_2perCU_1x32_HasBias_swiglu,0.0%,36.0367,moe_cktile2stages_gemm2_256x32x256x256_1x4_16x16x128_3perCU_1x32_MulRoutedWeight_HasBias,1.5%,82.6459,0.0,233.86,7365.14,,,
256,512,3072,1536,128,4,ActivationType.Swiglu,torch.bfloat16,torch.bfloat16,torch.float4_e2m1fn_x2,QuantType.per_1x32,1,0,32,0,123.0378,moe_cktile2stages_gemm1_256x32x256x256_1x4_16x16x32_2perCU_1x32_HasBias_swiglu,0.0%,76.1463,moe_cktile2stages_gemm2_256x32x256x256_1x4_16x16x32_2perCU_1x32_MulRoutedWeight_HasBias,3.7%,199.1841,0.0,291.1,9128.39,,,
256,512,3072,1536,128,4,ActivationType.Swiglu,torch.bfloat16,torch.bfloat16,torch.float4_e2m1fn_x2,QuantType.per_1x32,1,0,64,0,174.065,moe_cktile2stages_gemm1_256x64x256x256_1x4_16x16x32_3perCU_1x32_HasBias_swiglu,0.0%,109.6517,moe_cktile2stages_gemm2_256x64x256x256_1x4_16x16x32_1perCU_1x32_MulRoutedWeight_HasBias,3.7%,283.7167,0.0,204.37,6408.61,,,
256,512,3072,1536,128,4,ActivationType.Swiglu,torch.bfloat16,torch.float8_e4m3fn,torch.float4_e2m1fn_x2,QuantType.per_1x32,1,0,32,0,118.4108,moe_cktile2stages_gemm1_256x32x256x256_1x4_16x16x128_2perCU_1x32_HasBias_swiglu,0.0%,72.7812,moe_cktile2stages_gemm2_256x32x256x256_1x4_16x16x128_1perCU_1x32_MulRoutedWeight_HasBias,3.7%,191.192,0.0,303.27,9501.75,,,
256,512,3072,3072,128,4,ActivationType.Swiglu,torch.bfloat16,torch.bfloat16,torch.float4_e2m1fn_x2,QuantType.per_1x32,1,0,32,0,236.3575,moe_cktile2stages_gemm1_256x32x256x256_1x4_16x16x32_1perCU_1x32_HasBias_swiglu,0.0%,129.5908,moe_cktile2stages_gemm2_256x32x256x256_1x4_16x16x32_1perCU_1x32_MulRoutedWeight_HasBias,5.1%,365.9483,0.0,316.89,9919.9,,,
256,512,3072,3072,128,4,ActivationType.Swiglu,torch.bfloat16,torch.bfloat16,torch.float4_e2m1fn_x2,QuantType.per_1x32,1,0,64,0,339.031,moe_cktile2stages_gemm1_256x64x256x256_1x4_16x16x32_4perCU_1x32_HasBias_swiglu,0.0%,177.0539,moe_cktile2stages_gemm2_256x64x256x256_1x4_16x16x32_4perCU_1x32_MulRoutedWeight_HasBias,5.1%,516.0849,0.0,224.7,7034.06,,,
256,512,3072,3072,128,4,ActivationType.Swiglu,torch.bfloat16,torch.float8_e4m3fn,torch.float4_e2m1fn_x2,QuantType.per_1x32,1,0,32,0,233.4283,moe_cktile2stages_gemm1_256x32x256x256_1x4_16x16x128_1perCU_1x32_HasBias_swiglu,0.0%,124.396,moe_cktile2stages_gemm2_256x32x256x256_1x4_16x16x128_2perCU_1x32_MulRoutedWeight_HasBias,5.1%,357.8243,0.0,324.08,10140.72,,,
256,1024,3072,512,128,4,ActivationType.Swiglu,torch.bfloat16,torch.float8_e4m3fn,torch.float4_e2m1fn_x2,QuantType.per_1x32,1,0,32,0,53.2787,moe_cktile2stages_gemm1_256x32x256x256_1x4_16x16x128_3perCU_1x32_HasBias_swiglu,0.0%,42.6624,moe_cktile2stages_gemm2_256x32x256x256_1x4_16x16x128_3perCU_1x32_MulRoutedWeight_HasBias,1.6%,95.9411,0.0,402.9,6393.68,,,
256,1024,3072,1536,128,4,ActivationType.Swiglu,torch.bfloat16,torch.float8_e4m3fn,torch.float4_e2m1fn_x2,QuantType.per_1x32,1,0,32,0,134.8966,moe_cktile2stages_gemm1_256x32x256x256_1x4_16x16x128_1perCU_1x32_HasBias_swiglu,0.0%,82.7725,moe_cktile2stages_gemm2_256x32x256x256_1x4_16x16x128_2perCU_1x32_MulRoutedWeight_HasBias,3.5%,217.6691,0.0,532.75,8367.64,,,
256,1024,3072,3072,128,4,ActivationType.Swiglu,torch.bfloat16,torch.float8_e4m3fn,torch.float4_e2m1fn_x2,QuantType.per_1x32,1,0,32,0,271.3981,moe_cktile2stages_gemm1_256x32x256x256_1x4_16x16x128_2perCU_1x32_HasBias_swiglu,0.0%,144.0189,moe_cktile2stages_gemm2_256x32x256x256_1x4_16x16x128_1perCU_1x32_MulRoutedWeight_HasBias,5.1%,415.417,0.0,558.3,8746.19,,,
256,2048,3072,512,128,4,ActivationType.Swiglu,torch.bfloat16,torch.float8_e4m3fn,torch.float4_e2m1fn_x2,QuantType.per_1x32,1,0,32,0,63.4821,moe_cktile2stages_gemm1_256x32x256x256_1x4_16x16x128_2perCU_1x32_HasBias_swiglu,0.0%,62.9825,moe_cktile2stages_gemm2_256x32x256x256_1x4_16x16x128_3perCU_1x32_MulRoutedWeight_HasBias,1.6%,126.4646,0.0,611.31,4925.13,,,
256,2048,3072,1536,128,4,ActivationType.Swiglu,torch.bfloat16,torch.float8_e4m3fn,torch.float4_e2m1fn_x2,QuantType.per_1x32,1,0,32,0,173.5116,moe_cktile2stages_gemm1_256x32x256x256_1x4_16x16x128_3perCU_1x32_HasBias_swiglu,0.0%,107.4579,moe_cktile2stages_gemm2_256x32x256x256_1x4_16x16x128_3perCU_1x32_MulRoutedWeight_HasBias,3.6%,280.9695,0.0,825.46,6516.06,,,
256,2048,3072,3072,128,4,ActivationType.Swiglu,torch.bfloat16,torch.float8_e4m3fn,torch.float4_e2m1fn_x2,QuantType.per_1x32,1,0,32,0,426.2582,moe_cktile2stages_gemm1_256x32x256x256_1x4_16x16x128_1perCU_1x32_HasBias_swiglu,0.0%,184.1827,moe_cktile2stages_gemm2_256x32x256x256_1x4_16x16x128_2perCU_1x32_MulRoutedWeight_HasBias,5.0%,610.4409,0.0,759.87,5967.41,,,
256,1,3072,512,128,4,ActivationType.Swiglu,torch.bfloat16,torch.bfloat16,torch.float4_e2m1fn_x2,QuantType.per_1x32,1,0,32,0,,,,,,,-1.0,,0.0,0.0,stage1,flydsl_moe1_afp16_wfp4_bf16_t32x256x256,100.0%
256,1,3072,512,128,4,ActivationType.Swiglu,torch.bfloat16,torch.bfloat16,torch.float4_e2m1fn_x2,QuantType.per_1x32,1,0,32,0,,,,,,,-1.0,,0.0,0.0,stage2,flydsl_moe2_afp16_wfp4_bf16_t32x128x256_atomic,100.0%
256,1,3072,512,128,4,ActivationType.Swiglu,torch.bfloat16,torch.bfloat16,torch.float4_e2m1fn_x2,QuantType.per_1x32,1,0,32,0,,,,,,,-1.0,,0.0,0.0,stage2,flydsl_moe2_afp16_wfp4_bf16_t32x128x256_reduce,100.0%
256,1,3072,512,128,4,ActivationType.Swiglu,torch.bfloat16,torch.bfloat16,torch.float4_e2m1fn_x2,QuantType.per_1x32,1,0,32,0,,,,,,,-1.0,,0.0,0.0,stage2,flydsl_moe2_afp16_wfp4_bf16_t32x256x256_atomic,100.0%
256,1,3072,512,128,4,ActivationType.Swiglu,torch.bfloat16,torch.bfloat16,torch.float4_e2m1fn_x2,QuantType.per_1x32,1,0,32,0,,,,,,,-1.0,,0.0,0.0,stage2,flydsl_moe2_afp16_wfp4_bf16_t32x256x256_reduce,100.0%
256,1,3072,512,128,4,ActivationType.Swiglu,torch.bfloat16,torch.bfloat16,torch.float4_e2m1fn_x2,QuantType.per_1x32,1,0,64,0,,,,,,,-1.0,,0.0,0.0,stage1,flydsl_moe1_afp16_wfp4_bf16_t64x256x256,100.0%
256,1,3072,512,128,4,ActivationType.Swiglu,torch.bfloat16,torch.bfloat16,torch.float4_e2m1fn_x2,QuantType.per_1x32,1,0,64,0,,,,,,,-1.0,,0.0,0.0,stage2,flydsl_moe2_afp16_wfp4_bf16_t64x128x256_atomic,100.0%
256,1,3072,512,128,4,ActivationType.Swiglu,torch.bfloat16,torch.bfloat16,torch.float4_e2m1fn_x2,QuantType.per_1x32,1,0,64,0,,,,,,,-1.0,,0.0,0.0,stage2,flydsl_moe2_afp16_wfp4_bf16_t64x128x256_reduce,100.0%
256,1,3072,512,128,4,ActivationType.Swiglu,torch.bfloat16,torch.bfloat16,torch.float4_e2m1fn_x2,QuantType.per_1x32,1,0,64,0,,,,,,,-1.0,,0.0,0.0,stage2,flydsl_moe2_afp16_wfp4_bf16_t64x256x256_atomic,100.0%
256,1,3072,512,128,4,ActivationType.Swiglu,torch.bfloat16,torch.bfloat16,torch.float4_e2m1fn_x2,QuantType.per_1x32,1,0,64,0,,,,,,,-1.0,,0.0,0.0,stage2,flydsl_moe2_afp16_wfp4_bf16_t64x256x256_reduce,100.0%
256,1,3072,512,128,4,ActivationType.Swiglu,torch.bfloat16,torch.bfloat16,torch.float4_e2m1fn_x2,QuantType.per_1x32,1,0,128,0,,,,,,,-1.0,,0.0,0.0,stage2,flydsl_moe2_afp16_wfp4_bf16_t128x128x256_atomic,100.0%
256,1,3072,512,128,4,ActivationType.Swiglu,torch.bfloat16,torch.bfloat16,torch.float4_e2m1fn_x2,QuantType.per_1x32,1,0,128,0,,,,,,,-1.0,,0.0,0.0,stage2,flydsl_moe2_afp16_wfp4_bf16_t128x128x256_reduce,100.0%
256,1,3072,512,128,4,ActivationType.Swiglu,torch.bfloat16,torch.bfloat16,torch.float4_e2m1fn_x2,QuantType.per_1x32,1,0,128,0,,,,,,,-1.0,,0.0,0.0,stage2,flydsl_moe2_afp16_wfp4_bf16_t128x256x256_atomic,100.0%
256,1,3072,512,128,4,ActivationType.Swiglu,torch.bfloat16,torch.bfloat16,torch.float4_e2m1fn_x2,QuantType.per_1x32,1,0,128,0,,,,,,,-1.0,,0.0,0.0,stage2,flydsl_moe2_afp16_wfp4_bf16_t128x256x256_reduce,100.0%
256,1,3072,512,128,4,ActivationType.Swiglu,torch.bfloat16,torch.bfloat16,torch.float4_e2m1fn_x2,QuantType.per_1x32,1,0,32,0,,,,,,,20.0949,,1.88,30056.98,stage1,moe_cktile2stages_gemm1_256x32x256x256_1x4_16x16x32_2perCU_1x32_HasBias_swiglu,0.0%
256,1,3072,512,128,4,ActivationType.Swiglu,torch.bfloat16,torch.bfloat16,torch.float4_e2m1fn_x2,QuantType.per_1x32,1,0,32,0,,,,,,,20.3061,,1.86,29744.37,stage1,moe_cktile2stages_gemm1_256x32x256x256_1x4_16x16x32_1perCU_1x32_HasBias_swiglu,0.0%
256,1,3072,512,128,4,ActivationType.Swiglu,torch.bfloat16,torch.bfloat16,torch.float4_e2m1fn_x2,QuantType.per_1x32,1,0,32,0,,,,,,,51.0757,,0.74,11825.43,stage1,moe_cktile2stages_gemm1_256x32x256x256_1x4_16x16x32_3perCU_1x32_HasBias_swiglu,0.0%
256,1,3072,512,128,4,ActivationType.Swiglu,torch.bfloat16,torch.bfloat16,torch.float4_e2m1fn_x2,QuantType.per_1x32,1,0,32,0,,,,,,,91.8317,,0.41,6577.16,stage1,moe_cktile2stages_gemm1_256x32x256x256_1x4_16x16x32_4perCU_1x32_HasBias_swiglu,0.0%
256,1,3072,512,128,4,ActivationType.Swiglu,torch.bfloat16,torch.bfloat16,torch.float4_e2m1fn_x2,QuantType.per_1x32,1,0,32,0,,,,,,,13.4454,,2.81,44921.84,stage2,moe_cktile2stages_gemm2_256x32x256x256_1x4_16x16x32_2perCU_1x32_MulRoutedWeight_HasBias,1.5%
256,1,3072,512,128,4,ActivationType.Swiglu,torch.bfloat16,torch.bfloat16,torch.float4_e2m1fn_x2,QuantType.per_1x32,1,0,32,0,,,,,,,13.3885,,2.82,45112.75,stage2,moe_cktile2stages_gemm2_256x32x256x256_1x4_16x16x32_1perCU_1x32_MulRoutedWeight_HasBias,1.5%
256,1,3072,512,128,4,ActivationType.Swiglu,torch.bfloat16,torch.bfloat16,torch.float4_e2m1fn_x2,QuantType.per_1x32,1,0,32,0,,,,,,,12.99,,2.91,46496.69,stage2,moe_cktile2stages_gemm2_256x32x256x256_1x4_16x16x32_3perCU_1x32_MulRoutedWeight_HasBias,1.5%
256,1,3072,512,128,4,ActivationType.Swiglu,torch.bfloat16,torch.bfloat16,torch.float4_e2m1fn_x2,QuantType.per_1x32,1,0,32,0,,,,,,,19.2261,,1.96,31415.21,stage2,moe_cktile2stages_gemm2_256x32x256x256_1x4_16x16x32_4perCU_1x32_MulRoutedWeight_HasBias,1.7%
256,1,3072,512,128,4,ActivationType.Swiglu,torch.bfloat16,torch.bfloat16,torch.float4_e2m1fn_x2,QuantType.per_1x32,1,0,64,0,,,,,,,29.0917,,1.3,20761.66,stage1,moe_cktile2stages_gemm1_256x64x256x256_1x4_16x16x32_1perCU_1x32_HasBias_swiglu,0.0%
256,1,3072,512,128,4,ActivationType.Swiglu,torch.bfloat16,torch.bfloat16,torch.float4_e2m1fn_x2,QuantType.per_1x32,1,0,64,0,,,,,,,44.7632,,0.84,13493.05,stage1,moe_cktile2stages_gemm1_256x64x256x256_1x4_16x16x32_2perCU_1x32_HasBias_swiglu,0.0%
256,1,3072,512,128,4,ActivationType.Swiglu,torch.bfloat16,torch.bfloat16,torch.float4_e2m1fn_x2,QuantType.per_1x32,1,0,64,0,,,,,,,28.6928,,1.32,21050.3,stage1,moe_cktile2stages_gemm1_256x64x256x256_1x4_16x16x32_3perCU_1x32_HasBias_swiglu,0.0%
256,1,3072,512,128,4,ActivationType.Swiglu,torch.bfloat16,torch.bfloat16,torch.float4_e2m1fn_x2,QuantType.per_1x32,1,0,64,0,,,,,,,31.189,,1.21,19365.55,stage1,moe_cktile2stages_gemm1_256x64x256x256_1x4_16x16x32_4perCU_1x32_HasBias_swiglu,0.0%
256,1,3072,512,128,4,ActivationType.Swiglu,torch.bfloat16,torch.bfloat16,torch.float4_e2m1fn_x2,QuantType.per_1x32,1,0,64,0,,,,,,,15.7361,,2.4,38382.58,stage2,moe_cktile2stages_gemm2_256x64x256x256_1x4_16x16x32_1perCU_1x32_MulRoutedWeight_HasBias,1.5%
256,1,3072,512,128,4,ActivationType.Swiglu,torch.bfloat16,torch.bfloat16,torch.float4_e2m1fn_x2,QuantType.per_1x32,1,0,64,0,,,,,,,14.3538,,2.63,42078.9,stage2,moe_cktile2stages_gemm2_256x64x256x256_1x4_16x16x32_2perCU_1x32_MulRoutedWeight_HasBias,1.5%
256,1,3072,512,128,4,ActivationType.Swiglu,torch.bfloat16,torch.bfloat16,torch.float4_e2m1fn_x2,QuantType.per_1x32,1,0,64,0,,,,,,,15.783,,2.39,38268.52,stage2,moe_cktile2stages_gemm2_256x64x256x256_1x4_16x16x32_3perCU_1x32_MulRoutedWeight_HasBias,1.6%
256,1,3072,512,128,4,ActivationType.Swiglu,torch.bfloat16,torch.bfloat16,torch.float4_e2m1fn_x2,QuantType.per_1x32,1,0,64,0,,,,,,,15.6546,,2.41,38582.4,stage2,moe_cktile2stages_gemm2_256x64x256x256_1x4_16x16x32_4perCU_1x32_MulRoutedWeight_HasBias,1.5%
256,1,3072,1536,128,4,ActivationType.Swiglu,torch.bfloat16,torch.bfloat16,torch.float4_e2m1fn_x2,QuantType.per_1x32,1,0,32,0,,,,,,,-1.0,,0.0,0.0,stage1,flydsl_moe1_afp16_wfp4_bf16_t32x256x256,100.0%
256,1,3072,1536,128,4,ActivationType.Swiglu,torch.bfloat16,torch.bfloat16,torch.float4_e2m1fn_x2,QuantType.per_1x32,1,0,32,0,,,,,,,-1.0,,0.0,0.0,stage2,flydsl_moe2_afp16_wfp4_bf16_t32x128x256_atomic,100.0%
256,1,3072,1536,128,4,ActivationType.Swiglu,torch.bfloat16,torch.bfloat16,torch.float4_e2m1fn_x2,QuantType.per_1x32,1,0,32,0,,,,,,,-1.0,,0.0,0.0,stage2,flydsl_moe2_afp16_wfp4_bf16_t32x128x256_reduce,100.0%
256,1,3072,1536,128,4,ActivationType.Swiglu,torch.bfloat16,torch.bfloat16,torch.float4_e2m1fn_x2,QuantType.per_1x32,1,0,32,0,,,,,,,-1.0,,0.0,0.0,stage2,flydsl_moe2_afp16_wfp4_bf16_t32x256x256_atomic,100.0%
256,1,3072,1536,128,4,ActivationType.Swiglu,torch.bfloat16,torch.bfloat16,torch.float4_e2m1fn_x2,QuantType.per_1x32,1,0,32,0,,,,,,,-1.0,,0.0,0.0,stage2,flydsl_moe2_afp16_wfp4_bf16_t32x256x256_reduce,100.0%
256,1,3072,1536,128,4,ActivationType.Swiglu,torch.bfloat16,torch.bfloat16,torch.float4_e2m1fn_x2,QuantType.per_1x32,1,0,64,0,,,,,,,-1.0,,0.0,0.0,stage1,flydsl_moe1_afp16_wfp4_bf16_t64x256x256,100.0%
256,1,3072,1536,128,4,ActivationType.Swiglu,torch.bfloat16,torch.bfloat16,torch.float4_e2m1fn_x2,QuantType.per_1x32,1,0,64,0,,,,,,,-1.0,,0.0,0.0,stage2,flydsl_moe2_afp16_wfp4_bf16_t64x128x256_atomic,100.0%
256,1,3072,1536,128,4,ActivationType.Swiglu,torch.bfloat16,torch.bfloat16,torch.float4_e2m1fn_x2,QuantType.per_1x32,1,0,64,0,,,,,,,-1.0,,0.0,0.0,stage2,flydsl_moe2_afp16_wfp4_bf16_t64x128x256_reduce,100.0%
256,1,3072,1536,128,4,ActivationType.Swiglu,torch.bfloat16,torch.bfloat16,torch.float4_e2m1fn_x2,QuantType.per_1x32,1,0,64,0,,,,,,,-1.0,,0.0,0.0,stage2,flydsl_moe2_afp16_wfp4_bf16_t64x256x256_atomic,100.0%
256,1,3072,1536,128,4,ActivationType.Swiglu,torch.bfloat16,torch.bfloat16,torch.float4_e2m1fn_x2,QuantType.per_1x32,1,0,64,0,,,,,,,-1.0,,0.0,0.0,stage2,flydsl_moe2_afp16_wfp4_bf16_t64x256x256_reduce,100.0%
256,1,3072,1536,128,4,ActivationType.Swiglu,torch.bfloat16,torch.bfloat16,torch.float4_e2m1fn_x2,QuantType.per_1x32,1,0,128,0,,,,,,,-1.0,,0.0,0.0,stage2,flydsl_moe2_afp16_wfp4_bf16_t128x128x256_atomic,100.0%
256,1,3072,1536,128,4,ActivationType.Swiglu,torch.bfloat16,torch.bfloat16,torch.float4_e2m1fn_x2,QuantType.per_1x32,1,0,128,0,,,,,,,-1.0,,0.0,0.0,stage2,flydsl_moe2_afp16_wfp4_bf16_t128x128x256_reduce,100.0%
256,1,3072,1536,128,4,ActivationType.Swiglu,torch.bfloat16,torch.bfloat16,torch.float4_e2m1fn_x2,QuantType.per_1x32,1,0,128,0,,,,,,,-1.0,,0.0,0.0,stage2,flydsl_moe2_afp16_wfp4_bf16_t128x256x256_atomic,100.0%
256,1,3072,1536,128,4,ActivationType.Swiglu,torch.bfloat16,torch.bfloat16,torch.float4_e2m1fn_x2,QuantType.per_1x32,1,0,128,0,,,,,,,-1.0,,0.0,0.0,stage2,flydsl_moe2_afp16_wfp4_bf16_t128x256x256_reduce,100.0%
256,1,3072,1536,128,4,ActivationType.Swiglu,torch.bfloat16,torch.bfloat16,torch.float4_e2m1fn_x2,QuantType.per_1x32,1,0,32,0,,,,,,,21.3396,,5.31,84910.29,stage1,moe_cktile2stages_gemm1_256x32x256x256_1x4_16x16x32_2perCU_1x32_HasBias_swiglu,0.0%
256,1,3072,1536,128,4,ActivationType.Swiglu,torch.bfloat16,torch.bfloat16,torch.float4_e2m1fn_x2,QuantType.per_1x32,1,0,32,0,,,,,,,21.4594,,5.28,84436.27,stage1,moe_cktile2stages_gemm1_256x32x256x256_1x4_16x16x32_1perCU_1x32_HasBias_swiglu,0.0%
256,1,3072,1536,128,4,ActivationType.Swiglu,torch.bfloat16,torch.bfloat16,torch.float4_e2m1fn_x2,QuantType.per_1x32,1,0,32,0,,,,,,,50.451,,2.24,35915.08,stage1,moe_cktile2stages_gemm1_256x32x256x256_1x4_16x16x32_3perCU_1x32_HasBias_swiglu,0.0%
256,1,3072,1536,128,4,ActivationType.Swiglu,torch.bfloat16,torch.bfloat16,torch.float4_e2m1fn_x2,QuantType.per_1x32,1,0,32,0,,,,,,,90.896,,1.25,19934.34,stage1,moe_cktile2stages_gemm1_256x32x256x256_1x4_16x16x32_4perCU_1x32_HasBias_swiglu,0.0%
256,1,3072,1536,128,4,ActivationType.Swiglu,torch.bfloat16,torch.bfloat16,torch.float4_e2m1fn_x2,QuantType.per_1x32,1,0,32,0,,,,,,,16.1318,,7.02,112321.73,stage2,moe_cktile2stages_gemm2_256x32x256x256_1x4_16x16x32_2perCU_1x32_MulRoutedWeight_HasBias,3.7%
256,1,3072,1536,128,4,ActivationType.Swiglu,torch.bfloat16,torch.bfloat16,torch.float4_e2m1fn_x2,QuantType.per_1x32,1,0,32,0,,,,,,,16.216,,6.98,111738.51,stage2,moe_cktile2stages_gemm2_256x32x256x256_1x4_16x16x32_1perCU_1x32_MulRoutedWeight_HasBias,3.3%
256,1,3072,1536,128,4,ActivationType.Swiglu,torch.bfloat16,torch.bfloat16,torch.float4_e2m1fn_x2,QuantType.per_1x32,1,0,32,0,,,,,,,32.9216,,3.44,55038.38,stage2,moe_cktile2stages_gemm2_256x32x256x256_1x4_16x16x32_3perCU_1x32_MulRoutedWeight_HasBias,3.3%
256,1,3072,1536,128,4,ActivationType.Swiglu,torch.bfloat16,torch.bfloat16,torch.float4_e2m1fn_x2,QuantType.per_1x32,1,0,32,0,,,,,,,54.2259,,2.09,33414.87,stage2,moe_cktile2stages_gemm2_256x32x256x256_1x4_16x16x32_4perCU_1x32_MulRoutedWeight_HasBias,3.1%
256,1,3072,1536,128,4,ActivationType.Swiglu,torch.bfloat16,torch.bfloat16,torch.float4_e2m1fn_x2,QuantType.per_1x32,1,0,64,0,,,,,,,30.2727,,3.74,59854.31,stage1,moe_cktile2stages_gemm1_256x64x256x256_1x4_16x16x32_1perCU_1x32_HasBias_swiglu,0.0%
256,1,3072,1536,128,4,ActivationType.Swiglu,torch.bfloat16,torch.bfloat16,torch.float4_e2m1fn_x2,QuantType.per_1x32,1,0,64,0,,,,,,,45.2721,,2.5,40023.58,stage1,moe_cktile2stages_gemm1_256x64x256x256_1x4_16x16x32_2perCU_1x32_HasBias_swiglu,0.0%
256,1,3072,1536,128,4,ActivationType.Swiglu,torch.bfloat16,torch.bfloat16,torch.float4_e2m1fn_x2,QuantType.per_1x32,1,0,64,0,,,,,,,29.5922,,3.83,61230.72,stage1,moe_cktile2stages_gemm1_256x64x256x256_1x4_16x16x32_3perCU_1x32_HasBias_swiglu,0.0%
256,1,3072,1536,128,4,ActivationType.Swiglu,torch.bfloat16,torch.bfloat16,torch.float4_e2m1fn_x2,QuantType.per_1x32,1,0,64,0,,,,,,,30.659,,3.69,59100.15,stage1,moe_cktile2stages_gemm1_256x64x256x256_1x4_16x16x32_4perCU_1x32_HasBias_swiglu,0.0%
256,1,3072,1536,128,4,ActivationType.Swiglu,torch.bfloat16,torch.bfloat16,torch.float4_e2m1fn_x2,QuantType.per_1x32,1,0,64,0,,,,,,,22.4793,,5.04,80605.34,stage2,moe_cktile2stages_gemm2_256x64x256x256_1x4_16x16x32_1perCU_1x32_MulRoutedWeight_HasBias,3.3%
256,1,3072,1536,128,4,ActivationType.Swiglu,torch.bfloat16,torch.bfloat16,torch.float4_e2m1fn_x2,QuantType.per_1x32,1,0,64,0,,,,,,,25.5912,,4.43,70803.7,stage2,moe_cktile2stages_gemm2_256x64x256x256_1x4_16x16x32_2perCU_1x32_MulRoutedWeight_HasBias,2.7%
256,1,3072,1536,128,4,ActivationType.Swiglu,torch.bfloat16,torch.bfloat16,torch.float4_e2m1fn_x2,QuantType.per_1x32,1,0,64,0,,,,,,,22.3332,,5.07,81132.65,stage2,moe_cktile2stages_gemm2_256x64x256x256_1x4_16x16x32_3perCU_1x32_MulRoutedWeight_HasBias,3.4%
256,1,3072,1536,128,4,ActivationType.Swiglu,torch.bfloat16,torch.bfloat16,torch.float4_e2m1fn_x2,QuantType.per_1x32,1,0,64,0,,,,,,,21.1024,,5.37,85864.72,stage2,moe_cktile2stages_gemm2_256x64x256x256_1x4_16x16x32_4perCU_1x32_MulRoutedWeight_HasBias,3.4%
256,1,3072,3072,128,4,ActivationType.Swiglu,torch.bfloat16,torch.bfloat16,torch.float4_e2m1fn_x2,QuantType.per_1x32,1,0,32,0,,,,,,,-1.0,,0.0,0.0,stage1,flydsl_moe1_afp16_wfp4_bf16_t32x256x256,100.0%
256,1,3072,3072,128,4,ActivationType.Swiglu,torch.bfloat16,torch.bfloat16,torch.float4_e2m1fn_x2,QuantType.per_1x32,1,0,32,0,,,,,,,-1.0,,0.0,0.0,stage2,flydsl_moe2_afp16_wfp4_bf16_t32x128x256_atomic,100.0%
256,1,3072,3072,128,4,ActivationType.Swiglu,torch.bfloat16,torch.bfloat16,torch.float4_e2m1fn_x2,QuantType.per_1x32,1,0,32,0,,,,,,,-1.0,,0.0,0.0,stage2,flydsl_moe2_afp16_wfp4_bf16_t32x128x256_reduce,100.0%
256,1,3072,3072,128,4,ActivationType.Swiglu,torch.bfloat16,torch.bfloat16,torch.float4_e2m1fn_x2,QuantType.per_1x32,1,0,32,0,,,,,,,-1.0,,0.0,0.0,stage2,flydsl_moe2_afp16_wfp4_bf16_t32x256x256_atomic,100.0%
256,1,3072,3072,128,4,ActivationType.Swiglu,torch.bfloat16,torch.bfloat16,torch.float4_e2m1fn_x2,QuantType.per_1x32,1,0,32,0,,,,,,,-1.0,,0.0,0.0,stage2,flydsl_moe2_afp16_wfp4_bf16_t32x256x256_reduce,100.0%
256,1,3072,3072,128,4,ActivationType.Swiglu,torch.bfloat16,torch.bfloat16,torch.float4_e2m1fn_x2,QuantType.per_1x32,1,0,64,0,,,,,,,-1.0,,0.0,0.0,stage1,flydsl_moe1_afp16_wfp4_bf16_t64x256x256,100.0%
256,1,3072,3072,128,4,ActivationType.Swiglu,torch.bfloat16,torch.bfloat16,torch.float4_e2m1fn_x2,QuantType.per_1x32,1,0,64,0,,,,,,,-1.0,,0.0,0.0,stage2,flydsl_moe2_afp16_wfp4_bf16_t64x128x256_atomic,100.0%
256,1,3072,3072,128,4,ActivationType.Swiglu,torch.bfloat16,torch.bfloat16,torch.float4_e2m1fn_x2,QuantType.per_1x32,1,0,64,0,,,,,,,-1.0,,0.0,0.0,stage2,flydsl_moe2_afp16_wfp4_bf16_t64x128x256_reduce,100.0%
256,1,3072,3072,128,4,ActivationType.Swiglu,torch.bfloat16,torch.bfloat16,torch.float4_e2m1fn_x2,QuantType.per_1x32,1,0,64,0,,,,,,,-1.0,,0.0,0.0,stage2,flydsl_moe2_afp16_wfp4_bf16_t64x256x256_atomic,100.0%
256,1,3072,3072,128,4,ActivationType.Swiglu,torch.bfloat16,torch.bfloat16,torch.float4_e2m1fn_x2,QuantType.per_1x32,1,0,64,0,,,,,,,-1.0,,0.0,0.0,stage2,flydsl_moe2_afp16_wfp4_bf16_t64x256x256_reduce,100.0%
256,1,3072,3072,128,4,ActivationType.Swiglu,torch.bfloat16,torch.bfloat16,torch.float4_e2m1fn_x2,QuantType.per_1x32,1,0,128,0,,,,,,,-1.0,,0.0,0.0,stage2,flydsl_moe2_afp16_wfp4_bf16_t128x128x256_atomic,100.0%
256,1,3072,3072,128,4,ActivationType.Swiglu,torch.bfloat16,torch.bfloat16,torch.float4_e2m1fn_x2,QuantType.per_1x32,1,0,128,0,,,,,,,-1.0,,0.0,0.0,stage2,flydsl_moe2_afp16_wfp4_bf16_t128x128x256_reduce,100.0%
256,1,3072,3072,128,4,ActivationType.Swiglu,torch.bfloat16,torch.bfloat16,torch.float4_e2m1fn_x2,QuantType.per_1x32,1,0,128,0,,,,,,,-1.0,,0.0,0.0,stage2,flydsl_moe2_afp16_wfp4_bf16_t128x256x256_atomic,100.0%
256,1,3072,3072,128,4,ActivationType.Swiglu,torch.bfloat16,torch.bfloat16,torch.float4_e2m1fn_x2,QuantType.per_1x32,1,0,128,0,,,,,,,-1.0,,0.0,0.0,stage2,flydsl_moe2_afp16_wfp4_bf16_t128x256x256_reduce,100.0%
256,1,3072,3072,128,4,ActivationType.Swiglu,torch.bfloat16,torch.bfloat16,torch.float4_e2m1fn_x2,QuantType.per_1x32,1,0,32,0,,,,,,,22.0963,,10.25,164004.42,stage1,moe_cktile2stages_gemm1_256x32x256x256_1x4_16x16x32_2perCU_1x32_HasBias_swiglu,0.0%
256,1,3072,3072,128,4,ActivationType.Swiglu,torch.bfloat16,torch.bfloat16,torch.float4_e2m1fn_x2,QuantType.per_1x32,1,0,32,0,,,,,,,21.5307,,10.52,168312.73,stage1,moe_cktile2stages_gemm1_256x32x256x256_1x4_16x16x32_1perCU_1x32_HasBias_swiglu,0.0%
256,1,3072,3072,128,4,ActivationType.Swiglu,torch.bfloat16,torch.bfloat16,torch.float4_e2m1fn_x2,QuantType.per_1x32,1,0,32,0,,,,,,,50.9113,,4.45,71180.48,stage1,moe_cktile2stages_gemm1_256x32x256x256_1x4_16x16x32_3perCU_1x32_HasBias_swiglu,0.0%
256,1,3072,3072,128,4,ActivationType.Swiglu,torch.bfloat16,torch.bfloat16,torch.float4_e2m1fn_x2,QuantType.per_1x32,1,0,32,0,,,,,,,91.056,,2.49,39798.49,stage1,moe_cktile2stages_gemm1_256x32x256x256_1x4_16x16x32_4perCU_1x32_HasBias_swiglu,0.0%
256,1,3072,3072,128,4,ActivationType.Swiglu,torch.bfloat16,torch.bfloat16,torch.float4_e2m1fn_x2,QuantType.per_1x32,1,0,32,0,,,,,,,22.9923,,9.85,157613.24,stage2,moe_cktile2stages_gemm2_256x32x256x256_1x4_16x16x32_2perCU_1x32_MulRoutedWeight_HasBias,4.9%
256,1,3072,3072,128,4,ActivationType.Swiglu,torch.bfloat16,torch.bfloat16,torch.float4_e2m1fn_x2,QuantType.per_1x32,1,0,32,0,,,,,,,23.44,,9.66,154602.86,stage2,moe_cktile2stages_gemm2_256x32x256x256_1x4_16x16x32_1perCU_1x32_MulRoutedWeight_HasBias,4.8%
256,1,3072,3072,128,4,ActivationType.Swiglu,torch.bfloat16,torch.bfloat16,torch.float4_e2m1fn_x2,QuantType.per_1x32,1,0,32,0,,,,,,,55.9053,,4.05,64821.96,stage2,moe_cktile2stages_gemm2_256x32x256x256_1x4_16x16x32_3perCU_1x32_MulRoutedWeight_HasBias,5.4%
256,1,3072,3072,128,4,ActivationType.Swiglu,torch.bfloat16,torch.bfloat16,torch.float4_e2m1fn_x2,QuantType.per_1x32,1,0,32,0,,,,,,,95.7066,,2.37,37864.59,stage2,moe_cktile2stages_gemm2_256x32x256x256_1x4_16x16x32_4perCU_1x32_MulRoutedWeight_HasBias,5.0%
256,1,3072,3072,128,4,ActivationType.Swiglu,torch.bfloat16,torch.bfloat16,torch.float4_e2m1fn_x2,QuantType.per_1x32,1,0,64,0,,,,,,,30.1049,,7.52,120375.45,stage1,moe_cktile2stages_gemm1_256x64x256x256_1x4_16x16x32_1perCU_1x32_HasBias_swiglu,0.0%
256,1,3072,3072,128,4,ActivationType.Swiglu,torch.bfloat16,torch.bfloat16,torch.float4_e2m1fn_x2,QuantType.per_1x32,1,0,64,0,,,,,,,45.8595,,4.94,79021.6,stage1,moe_cktile2stages_gemm1_256x64x256x256_1x4_16x16x32_2perCU_1x32_HasBias_swiglu,0.0%
256,1,3072,3072,128,4,ActivationType.Swiglu,torch.bfloat16,torch.bfloat16,torch.float4_e2m1fn_x2,QuantType.per_1x32,1,0,64,0,,,,,,,30.4656,,7.43,118950.26,stage1,moe_cktile2stages_gemm1_256x64x256x256_1x4_16x16x32_3perCU_1x32_HasBias_swiglu,0.0%
256,1,3072,3072,128,4,ActivationType.Swiglu,torch.bfloat16,torch.bfloat16,torch.float4_e2m1fn_x2,QuantType.per_1x32,1,0,64,0,,,,,,,31.7675,,7.13,114075.42,stage1,moe_cktile2stages_gemm1_256x64x256x256_1x4_16x16x32_4perCU_1x32_HasBias_swiglu,0.0%
256,1,3072,3072,128,4,ActivationType.Swiglu,torch.bfloat16,torch.bfloat16,torch.float4_e2m1fn_x2,QuantType.per_1x32,1,0,64,0,,,,,,,34.2082,,6.62,105936.32,stage2,moe_cktile2stages_gemm2_256x64x256x256_1x4_16x16x32_1perCU_1x32_MulRoutedWeight_HasBias,4.8%
256,1,3072,3072,128,4,ActivationType.Swiglu,torch.bfloat16,torch.bfloat16,torch.float4_e2m1fn_x2,QuantType.per_1x32,1,0,64,0,,,,,,,45.4129,,4.99,79798.71,stage2,moe_cktile2stages_gemm2_256x64x256x256_1x4_16x16x32_2perCU_1x32_MulRoutedWeight_HasBias,4.8%
256,1,3072,3072,128,4,ActivationType.Swiglu,torch.bfloat16,torch.bfloat16,torch.float4_e2m1fn_x2,QuantType.per_1x32,1,0,64,0,,,,,,,33.1252,,6.84,109399.82,stage2,moe_cktile2stages_gemm2_256x64x256x256_1x4_16x16x32_3perCU_1x32_MulRoutedWeight_HasBias,4.9%
256,1,3072,3072,128,4,ActivationType.Swiglu,torch.bfloat16,torch.bfloat16,torch.float4_e2m1fn_x2,QuantType.per_1x32,1,0,64,0,,,,,,,33.2616,,6.81,108951.19,stage2,moe_cktile2stages_gemm2_256x64x256x256_1x4_16x16x32_4perCU_1x32_MulRoutedWeight_HasBias,4.7%
256,2,3072,512,128,4,ActivationType.Swiglu,torch.bfloat16,torch.bfloat16,torch.float4_e2m1fn_x2,QuantType.per_1x32,1,0,32,0,,,,,,,-1.0,,0.0,0.0,stage1,flydsl_moe1_afp16_wfp4_bf16_t32x256x256,100.0%
256,2,3072,512,128,4,ActivationType.Swiglu,torch.bfloat16,torch.bfloat16,torch.float4_e2m1fn_x2,QuantType.per_1x32,1,0,32,0,,,,,,,-1.0,,0.0,0.0,stage2,flydsl_moe2_afp16_wfp4_bf16_t32x128x256_atomic,100.0%
256,2,3072,512,128,4,ActivationType.Swiglu,torch.bfloat16,torch.bfloat16,torch.float4_e2m1fn_x2,QuantType.per_1x32,1,0,32,0,,,,,,,-1.0,,0.0,0.0,stage2,flydsl_moe2_afp16_wfp4_bf16_t32x128x256_reduce,100.0%
256,2,3072,512,128,4,ActivationType.Swiglu,torch.bfloat16,torch.bfloat16,torch.float4_e2m1fn_x2,QuantType.per_1x32,1,0,32,0,,,,,,,-1.0,,0.0,0.0,stage2,flydsl_moe2_afp16_wfp4_bf16_t32x256x256_atomic,100.0%
256,2,3072,512,128,4,ActivationType.Swiglu,torch.bfloat16,torch.bfloat16,torch.float4_e2m1fn_x2,QuantType.per_1x32,1,0,32,0,,,,,,,-1.0,,0.0,0.0,stage2,flydsl_moe2_afp16_wfp4_bf16_t32x256x256_reduce,100.0%
256,2,3072,512,128,4,ActivationType.Swiglu,torch.bfloat16,torch.bfloat16,torch.float4_e2m1fn_x2,QuantType.per_1x32,1,0,64,0,,,,,,,-1.0,,0.0,0.0,stage1,flydsl_moe1_afp16_wfp4_bf16_t64x256x256,100.0%
256,2,3072,512,128,4,ActivationType.Swiglu,torch.bfloat16,torch.bfloat16,torch.float4_e2m1fn_x2,QuantType.per_1x32,1,0,64,0,,,,,,,-1.0,,0.0,0.0,stage2,flydsl_moe2_afp16_wfp4_bf16_t64x128x256_atomic,100.0%
256,2,3072,512,128,4,ActivationType.Swiglu,torch.bfloat16,torch.bfloat16,torch.float4_e2m1fn_x2,QuantType.per_1x32,1,0,64,0,,,,,,,-1.0,,0.0,0.0,stage2,flydsl_moe2_afp16_wfp4_bf16_t64x128x256_reduce,100.0%
256,2,3072,512,128,4,ActivationType.Swiglu,torch.bfloat16,torch.bfloat16,torch.float4_e2m1fn_x2,QuantType.per_1x32,1,0,64,0,,,,,,,-1.0,,0.0,0.0,stage2,flydsl_moe2_afp16_wfp4_bf16_t64x256x256_atomic,100.0%
256,2,3072,512,128,4,ActivationType.Swiglu,torch.bfloat16,torch.bfloat16,torch.float4_e2m1fn_x2,QuantType.per_1x32,1,0,64,0,,,,,,,-1.0,,0.0,0.0,stage2,flydsl_moe2_afp16_wfp4_bf16_t64x256x256_reduce,100.0%
256,2,3072,512,128,4,ActivationType.Swiglu,torch.bfloat16,torch.bfloat16,torch.float4_e2m1fn_x2,QuantType.per_1x32,1,0,128,0,,,,,,,-1.0,,0.0,0.0,stage2,flydsl_moe2_afp16_wfp4_bf16_t128x128x256_atomic,100.0%
256,2,3072,512,128,4,ActivationType.Swiglu,torch.bfloat16,torch.bfloat16,torch.float4_e2m1fn_x2,QuantType.per_1x32,1,0,128,0,,,,,,,-1.0,,0.0,0.0,stage2,flydsl_moe2_afp16_wfp4_bf16_t128x128x256_reduce,100.0%
256,2,3072,512,128,4,ActivationType.Swiglu,torch.bfloat16,torch.bfloat16,torch.float4_e2m1fn_x2,QuantType.per_1x32,1,0,128,0,,,,,,,-1.0,,0.0,0.0,stage2,flydsl_moe2_afp16_wfp4_bf16_t128x256x256_atomic,100.0%
256,2,3072,512,128,4,ActivationType.Swiglu,torch.bfloat16,torch.bfloat16,torch.float4_e2m1fn_x2,QuantType.per_1x32,1,0,128,0,,,,,,,-1.0,,0.0,0.0,stage2,flydsl_moe2_afp16_wfp4_bf16_t128x256x256_reduce,100.0%
256,2,3072,512,128,4,ActivationType.Swiglu,torch.bfloat16,torch.bfloat16,torch.float4_e2m1fn_x2,QuantType.per_1x32,1,0,32,0,,,,,,,21.3129,,3.54,28339.85,stage1,moe_cktile2stages_gemm1_256x32x256x256_1x4_16x16x32_2perCU_1x32_HasBias_swiglu,0.0%
256,2,3072,512,128,4,ActivationType.Swiglu,torch.bfloat16,torch.bfloat16,torch.float4_e2m1fn_x2,QuantType.per_1x32,1,0,32,0,,,,,,,20.3295,,3.71,29710.73,stage1,moe_cktile2stages_gemm1_256x32x256x256_1x4_16x16x32_1perCU_1x32_HasBias_swiglu,0.0%
256,2,3072,512,128,4,ActivationType.Swiglu,torch.bfloat16,torch.bfloat16,torch.float4_e2m1fn_x2,QuantType.per_1x32,1,0,32,0,,,,,,,51.177,,1.48,11802.26,stage1,moe_cktile2stages_gemm1_256x32x256x256_1x4_16x16x32_3perCU_1x32_HasBias_swiglu,0.0%
256,2,3072,512,128,4,ActivationType.Swiglu,torch.bfloat16,torch.bfloat16,torch.float4_e2m1fn_x2,QuantType.per_1x32,1,0,32,0,,,,,,,93.3037,,0.81,6473.53,stage1,moe_cktile2stages_gemm1_256x32x256x256_1x4_16x16x32_4perCU_1x32_HasBias_swiglu,0.0%
256,2,3072,512,128,4,ActivationType.Swiglu,torch.bfloat16,torch.bfloat16,torch.float4_e2m1fn_x2,QuantType.per_1x32,1,0,32,0,,,,,,,12.2475,,6.16,49316.54,stage2,moe_cktile2stages_gemm2_256x32x256x256_1x4_16x16x32_2perCU_1x32_MulRoutedWeight_HasBias,1.6%
256,2,3072,512,128,4,ActivationType.Swiglu,torch.bfloat16,torch.bfloat16,torch.float4_e2m1fn_x2,QuantType.per_1x32,1,0,32,0,,,,,,,12.2052,,6.19,49487.46,stage2,moe_cktile2stages_gemm2_256x32x256x256_1x4_16x16x32_1perCU_1x32_MulRoutedWeight_HasBias,1.7%
256,2,3072,512,128,4,ActivationType.Swiglu,torch.bfloat16,torch.bfloat16,torch.float4_e2m1fn_x2,QuantType.per_1x32,1,0,32,0,,,,,,,14.4702,,5.22,41741.26,stage2,moe_cktile2stages_gemm2_256x32x256x256_1x4_16x16x32_3perCU_1x32_MulRoutedWeight_HasBias,1.5%
256,2,3072,512,128,4,ActivationType.Swiglu,torch.bfloat16,torch.bfloat16,torch.float4_e2m1fn_x2,QuantType.per_1x32,1,0,32,0,,,,,,,21.07,,3.58,28666.56,stage2,moe_cktile2stages_gemm2_256x32x256x256_1x4_16x16x32_4perCU_1x32_MulRoutedWeight_HasBias,1.6%
256,2,3072,512,128,4,ActivationType.Swiglu,torch.bfloat16,torch.bfloat16,torch.float4_e2m1fn_x2,QuantType.per_1x32,1,0,64,0,,,,,,,29.1904,,2.59,20691.88,stage1,moe_cktile2stages_gemm1_256x64x256x256_1x4_16x16x32_1perCU_1x32_HasBias_swiglu,0.0%
256,2,3072,512,128,4,ActivationType.Swiglu,torch.bfloat16,torch.bfloat16,torch.float4_e2m1fn_x2,QuantType.per_1x32,1,0,64,0,,,,,,,45.3712,,1.66,13312.51,stage1,moe_cktile2stages_gemm1_256x64x256x256_1x4_16x16x32_2perCU_1x32_HasBias_swiglu,0.0%
256,2,3072,512,128,4,ActivationType.Swiglu,torch.bfloat16,torch.bfloat16,torch.float4_e2m1fn_x2,QuantType.per_1x32,1,0,64,0,,,,,,,29.3906,,2.57,20550.94,stage1,moe_cktile2stages_gemm1_256x64x256x256_1x4_16x16x32_3perCU_1x32_HasBias_swiglu,0.0%
256,2,3072,512,128,4,ActivationType.Swiglu,torch.bfloat16,torch.bfloat16,torch.float4_e2m1fn_x2,QuantType.per_1x32,1,0,64,0,,,,,,,30.4795,,2.48,19816.74,stage1,moe_cktile2stages_gemm1_256x64x256x256_1x4_16x16x32_4perCU_1x32_HasBias_swiglu,0.0%
256,2,3072,512,128,4,ActivationType.Swiglu,torch.bfloat16,torch.bfloat16,torch.float4_e2m1fn_x2,QuantType.per_1x32,1,0,64,0,,,,,,,14.4522,,5.22,41793.25,stage2,moe_cktile2stages_gemm2_256x64x256x256_1x4_16x16x32_1perCU_1x32_MulRoutedWeight_HasBias,1.5%
256,2,3072,512,128,4,ActivationType.Swiglu,torch.bfloat16,torch.bfloat16,torch.float4_e2m1fn_x2,QuantType.per_1x32,1,0,64,0,,,,,,,14.612,,5.17,41336.19,stage2,moe_cktile2stages_gemm2_256x64x256x256_1x4_16x16x32_2perCU_1x32_MulRoutedWeight_HasBias,1.5%
256,2,3072,512,128,4,ActivationType.Swiglu,torch.bfloat16,torch.bfloat16,torch.float4_e2m1fn_x2,QuantType.per_1x32,1,0,64,0,,,,,,,15.9245,,4.74,37929.25,stage2,moe_cktile2stages_gemm2_256x64x256x256_1x4_16x16x32_3perCU_1x32_MulRoutedWeight_HasBias,1.6%
256,2,3072,512,128,4,ActivationType.Swiglu,torch.bfloat16,torch.bfloat16,torch.float4_e2m1fn_x2,QuantType.per_1x32,1,0,64,0,,,,,,,14.583,,5.18,41418.39,stage2,moe_cktile2stages_gemm2_256x64x256x256_1x4_16x16x32_4perCU_1x32_MulRoutedWeight_HasBias,1.7%
256,2,3072,1536,128,4,ActivationType.Swiglu,torch.bfloat16,torch.bfloat16,torch.float4_e2m1fn_x2,QuantType.per_1x32,1,0,32,0,,,,,,,-1.0,,0.0,0.0,stage1,flydsl_moe1_afp16_wfp4_bf16_t32x256x256,100.0%
256,2,3072,1536,128,4,ActivationType.Swiglu,torch.bfloat16,torch.bfloat16,torch.float4_e2m1fn_x2,QuantType.per_1x32,1,0,32,0,,,,,,,-1.0,,0.0,0.0,stage2,flydsl_moe2_afp16_wfp4_bf16_t32x128x256_atomic,100.0%
256,2,3072,1536,128,4,ActivationType.Swiglu,torch.bfloat16,torch.bfloat16,torch.float4_e2m1fn_x2,QuantType.per_1x32,1,0,32,0,,,,,,,-1.0,,0.0,0.0,stage2,flydsl_moe2_afp16_wfp4_bf16_t32x128x256_reduce,100.0%
256,2,3072,1536,128,4,ActivationType.Swiglu,torch.bfloat16,torch.bfloat16,torch.float4_e2m1fn_x2,QuantType.per_1x32,1,0,32,0,,,,,,,-1.0,,0.0,0.0,stage2,flydsl_moe2_afp16_wfp4_bf16_t32x256x256_atomic,100.0%
256,2,3072,1536,128,4,ActivationType.Swiglu,torch.bfloat16,torch.bfloat16,torch.float4_e2m1fn_x2,QuantType.per_1x32,1,0,32,0,,,,,,,-1.0,,0.0,0.0,stage2,flydsl_moe2_afp16_wfp4_bf16_t32x256x256_reduce,100.0%
256,2,3072,1536,128,4,ActivationType.Swiglu,torch.bfloat16,torch.bfloat16,torch.float4_e2m1fn_x2,QuantType.per_1x32,1,0,64,0,,,,,,,-1.0,,0.0,0.0,stage1,flydsl_moe1_afp16_wfp4_bf16_t64x256x256,100.0%
256,2,3072,1536,128,4,ActivationType.Swiglu,torch.bfloat16,torch.bfloat16,torch.float4_e2m1fn_x2,QuantType.per_1x32,1,0,64,0,,,,,,,-1.0,,0.0,0.0,stage2,flydsl_moe2_afp16_wfp4_bf16_t64x128x256_atomic,100.0%
256,2,3072,1536,128,4,ActivationType.Swiglu,torch.bfloat16,torch.bfloat16,torch.float4_e2m1fn_x2,QuantType.per_1x32,1,0,64,0,,,,,,,-1.0,,0.0,0.0,stage2,flydsl_moe2_afp16_wfp4_bf16_t64x128x256_reduce,100.0%
256,2,3072,1536,128,4,ActivationType.Swiglu,torch.bfloat16,torch.bfloat16,torch.float4_e2m1fn_x2,QuantType.per_1x32,1,0,64,0,,,,,,,-1.0,,0.0,0.0,stage2,flydsl_moe2_afp16_wfp4_bf16_t64x256x256_atomic,100.0%
256,2,3072,1536,128,4,ActivationType.Swiglu,torch.bfloat16,torch.bfloat16,torch.float4_e2m1fn_x2,QuantType.per_1x32,1,0,64,0,,,,,,,-1.0,,0.0,0.0,stage2,flydsl_moe2_afp16_wfp4_bf16_t64x256x256_reduce,100.0%
256,2,3072,1536,128,4,ActivationType.Swiglu,torch.bfloat16,torch.bfloat16,torch.float4_e2m1fn_x2,QuantType.per_1x32,1,0,128,0,,,,,,,-1.0,,0.0,0.0,stage2,flydsl_moe2_afp16_wfp4_bf16_t128x128x256_atomic,100.0%
256,2,3072,1536,128,4,ActivationType.Swiglu,torch.bfloat16,torch.bfloat16,torch.float4_e2m1fn_x2,QuantType.per_1x32,1,0,128,0,,,,,,,-1.0,,0.0,0.0,stage2,flydsl_moe2_afp16_wfp4_bf16_t128x128x256_reduce,100.0%
256,2,3072,1536,128,4,ActivationType.Swiglu,torch.bfloat16,torch.bfloat16,torch.float4_e2m1fn_x2,QuantType.per_1x32,1,0,128,0,,,,,,,-1.0,,0.0,0.0,stage2,flydsl_moe2_afp16_wfp4_bf16_t128x256x256_atomic,100.0%
256,2,3072,1536,128,4,ActivationType.Swiglu,torch.bfloat16,torch.bfloat16,torch.float4_e2m1fn_x2,QuantType.per_1x32,1,0,128,0,,,,,,,-1.0,,0.0,0.0,stage2,flydsl_moe2_afp16_wfp4_bf16_t128x256x256_reduce,100.0%
256,2,3072,1536,128,4,ActivationType.Swiglu,torch.bfloat16,torch.bfloat16,torch.float4_e2m1fn_x2,QuantType.per_1x32,1,0,32,0,,,,,,,22.3882,,10.12,80933.88,stage1,moe_cktile2stages_gemm1_256x32x256x256_1x4_16x16x32_2perCU_1x32_HasBias_swiglu,0.0%
256,2,3072,1536,128,4,ActivationType.Swiglu,torch.bfloat16,torch.bfloat16,torch.float4_e2m1fn_x2,QuantType.per_1x32,1,0,32,0,,,,,,,22.0343,,10.28,82233.79,stage1,moe_cktile2stages_gemm1_256x32x256x256_1x4_16x16x32_1perCU_1x32_HasBias_swiglu,0.0%
256,2,3072,1536,128,4,ActivationType.Swiglu,torch.bfloat16,torch.bfloat16,torch.float4_e2m1fn_x2,QuantType.per_1x32,1,0,32,0,,,,,,,51.3174,,4.41,35308.96,stage1,moe_cktile2stages_gemm1_256x32x256x256_1x4_16x16x32_3perCU_1x32_HasBias_swiglu,0.0%
256,2,3072,1536,128,4,ActivationType.Swiglu,torch.bfloat16,torch.bfloat16,torch.float4_e2m1fn_x2,QuantType.per_1x32,1,0,32,0,,,,,,,94.1769,,2.4,19240.0,stage1,moe_cktile2stages_gemm1_256x32x256x256_1x4_16x16x32_4perCU_1x32_HasBias_swiglu,0.0%
256,2,3072,1536,128,4,ActivationType.Swiglu,torch.bfloat16,torch.bfloat16,torch.float4_e2m1fn_x2,QuantType.per_1x32,1,0,32,0,,,,,,,18.3108,,12.37,98956.02,stage2,moe_cktile2stages_gemm2_256x32x256x256_1x4_16x16x32_2perCU_1x32_MulRoutedWeight_HasBias,2.4%
256,2,3072,1536,128,4,ActivationType.Swiglu,torch.bfloat16,torch.bfloat16,torch.float4_e2m1fn_x2,QuantType.per_1x32,1,0,32,0,,,,,,,16.933,,13.38,107007.85,stage2,moe_cktile2stages_gemm2_256x32x256x256_1x4_16x16x32_1perCU_1x32_MulRoutedWeight_HasBias,2.5%
256,2,3072,1536,128,4,ActivationType.Swiglu,torch.bfloat16,torch.bfloat16,torch.float4_e2m1fn_x2,QuantType.per_1x32,1,0,32,0,,,,,,,32.0568,,7.07,56523.54,stage2,moe_cktile2stages_gemm2_256x32x256x256_1x4_16x16x32_3perCU_1x32_MulRoutedWeight_HasBias,2.5%
256,2,3072,1536,128,4,ActivationType.Swiglu,torch.bfloat16,torch.bfloat16,torch.float4_e2m1fn_x2,QuantType.per_1x32,1,0,32,0,,,,,,,55.6575,,4.07,32555.61,stage2,moe_cktile2stages_gemm2_256x32x256x256_1x4_16x16x32_4perCU_1x32_MulRoutedWeight_HasBias,2.6%
256,2,3072,1536,128,4,ActivationType.Swiglu,torch.bfloat16,torch.bfloat16,torch.float4_e2m1fn_x2,QuantType.per_1x32,1,0,64,0,,,,,,,31.1058,,7.28,58251.64,stage1,moe_cktile2stages_gemm1_256x64x256x256_1x4_16x16x32_1perCU_1x32_HasBias_swiglu,0.0%
256,2,3072,1536,128,4,ActivationType.Swiglu,torch.bfloat16,torch.bfloat16,torch.float4_e2m1fn_x2,QuantType.per_1x32,1,0,64,0,,,,,,,46.2939,,4.89,39140.45,stage1,moe_cktile2stages_gemm1_256x64x256x256_1x4_16x16x32_2perCU_1x32_HasBias_swiglu,0.0%
256,2,3072,1536,128,4,ActivationType.Swiglu,torch.bfloat16,torch.bfloat16,torch.float4_e2m1fn_x2,QuantType.per_1x32,1,0,64,0,,,,,,,31.8887,,7.1,56821.5,stage1,moe_cktile2stages_gemm1_256x64x256x256_1x4_16x16x32_3perCU_1x32_HasBias_swiglu,0.0%
256,2,3072,1536,128,4,ActivationType.Swiglu,torch.bfloat16,torch.bfloat16,torch.float4_e2m1fn_x2,QuantType.per_1x32,1,0,64,0,,,,,,,29.9462,,7.56,60507.31,stage1,moe_cktile2stages_gemm1_256x64x256x256_1x4_16x16x32_4perCU_1x32_HasBias_swiglu,0.0%
256,2,3072,1536,128,4,ActivationType.Swiglu,torch.bfloat16,torch.bfloat16,torch.float4_e2m1fn_x2,QuantType.per_1x32,1,0,64,0,,,,,,,22.8669,,9.9,79239.6,stage2,moe_cktile2stages_gemm2_256x64x256x256_1x4_16x16x32_1perCU_1x32_MulRoutedWeight_HasBias,2.5%
256,2,3072,1536,128,4,ActivationType.Swiglu,torch.bfloat16,torch.bfloat16,torch.float4_e2m1fn_x2,QuantType.per_1x32,1,0,64,0,,,,,,,27.1067,,8.36,66845.61,stage2,moe_cktile2stages_gemm2_256x64x256x256_1x4_16x16x32_2perCU_1x32_MulRoutedWeight_HasBias,2.3%
256,2,3072,1536,128,4,ActivationType.Swiglu,torch.bfloat16,torch.bfloat16,torch.float4_e2m1fn_x2,QuantType.per_1x32,1,0,64,0,,,,,,,22.8709,,9.9,79225.74,stage2,moe_cktile2stages_gemm2_256x64x256x256_1x4_16x16x32_3perCU_1x32_MulRoutedWeight_HasBias,2.4%
256,2,3072,1536,128,4,ActivationType.Swiglu,torch.bfloat16,torch.bfloat16,torch.float4_e2m1fn_x2,QuantType.per_1x32,1,0,64,0,,,,,,,21.3296,,10.62,84950.67,stage2,moe_cktile2stages_gemm2_256x64x256x256_1x4_16x16x32_4perCU_1x32_MulRoutedWeight_HasBias,2.4%
256,2,3072,3072,128,4,ActivationType.Swiglu,torch.bfloat16,torch.bfloat16,torch.float4_e2m1fn_x2,QuantType.per_1x32,1,0,32,0,,,,,,,-1.0,,0.0,0.0,stage1,flydsl_moe1_afp16_wfp4_bf16_t32x256x256,100.0%
256,2,3072,3072,128,4,ActivationType.Swiglu,torch.bfloat16,torch.bfloat16,torch.float4_e2m1fn_x2,QuantType.per_1x32,1,0,32,0,,,,,,,-1.0,,0.0,0.0,stage2,flydsl_moe2_afp16_wfp4_bf16_t32x128x256_atomic,100.0%
256,2,3072,3072,128,4,ActivationType.Swiglu,torch.bfloat16,torch.bfloat16,torch.float4_e2m1fn_x2,QuantType.per_1x32,1,0,32,0,,,,,,,-1.0,,0.0,0.0,stage2,flydsl_moe2_afp16_wfp4_bf16_t32x128x256_reduce,100.0%
256,2,3072,3072,128,4,ActivationType.Swiglu,torch.bfloat16,torch.bfloat16,torch.float4_e2m1fn_x2,QuantType.per_1x32,1,0,32,0,,,,,,,-1.0,,0.0,0.0,stage2,flydsl_moe2_afp16_wfp4_bf16_t32x256x256_atomic,100.0%
256,2,3072,3072,128,4,ActivationType.Swiglu,torch.bfloat16,torch.bfloat16,torch.float4_e2m1fn_x2,QuantType.per_1x32,1,0,32,0,,,,,,,-1.0,,0.0,0.0,stage2,flydsl_moe2_afp16_wfp4_bf16_t32x256x256_reduce,100.0%
256,2,3072,3072,128,4,ActivationType.Swiglu,torch.bfloat16,torch.bfloat16,torch.float4_e2m1fn_x2,QuantType.per_1x32,1,0,64,0,,,,,,,-1.0,,0.0,0.0,stage1,flydsl_moe1_afp16_wfp4_bf16_t64x256x256,100.0%
256,2,3072,3072,128,4,ActivationType.Swiglu,torch.bfloat16,torch.bfloat16,torch.float4_e2m1fn_x2,QuantType.per_1x32,1,0,64,0,,,,,,,-1.0,,0.0,0.0,stage2,flydsl_moe2_afp16_wfp4_bf16_t64x128x256_atomic,100.0%
256,2,3072,3072,128,4,ActivationType.Swiglu,torch.bfloat16,torch.bfloat16,torch.float4_e2m1fn_x2,QuantType.per_1x32,1,0,64,0,,,,,,,-1.0,,0.0,0.0,stage2,flydsl_moe2_afp16_wfp4_bf16_t64x128x256_reduce,100.0%
256,2,3072,3072,128,4,ActivationType.Swiglu,torch.bfloat16,torch.bfloat16,torch.float4_e2m1fn_x2,QuantType.per_1x32,1,0,64,0,,,,,,,-1.0,,0.0,0.0,stage2,flydsl_moe2_afp16_wfp4_bf16_t64x256x256_atomic,100.0%
256,2,3072,3072,128,4,ActivationType.Swiglu,torch.bfloat16,torch.bfloat16,torch.float4_e2m1fn_x2,QuantType.per_1x32,1,0,64,0,,,,,,,-1.0,,0.0,0.0,stage2,flydsl_moe2_afp16_wfp4_bf16_t64x256x256_reduce,100.0%
256,2,3072,3072,128,4,ActivationType.Swiglu,torch.bfloat16,torch.bfloat16,torch.float4_e2m1fn_x2,QuantType.per_1x32,1,0,128,0,,,,,,,-1.0,,0.0,0.0,stage2,flydsl_moe2_afp16_wfp4_bf16_t128x128x256_atomic,100.0%
256,2,3072,3072,128,4,ActivationType.Swiglu,torch.bfloat16,torch.bfloat16,torch.float4_e2m1fn_x2,QuantType.per_1x32,1,0,128,0,,,,,,,-1.0,,0.0,0.0,stage2,flydsl_moe2_afp16_wfp4_bf16_t128x128x256_reduce,100.0%
256,2,3072,3072,128,4,ActivationType.Swiglu,torch.bfloat16,torch.bfloat16,torch.float4_e2m1fn_x2,QuantType.per_1x32,1,0,128,0,,,,,,,-1.0,,0.0,0.0,stage2,flydsl_moe2_afp16_wfp4_bf16_t128x256x256_atomic,100.0%
256,2,3072,3072,128,4,ActivationType.Swiglu,torch.bfloat16,torch.bfloat16,torch.float4_e2m1fn_x2,QuantType.per_1x32,1,0,128,0,,,,,,,-1.0,,0.0,0.0,stage2,flydsl_moe2_afp16_wfp4_bf16_t128x256x256_reduce,100.0%
256,2,3072,3072,128,4,ActivationType.Swiglu,torch.bfloat16,torch.bfloat16,torch.float4_e2m1fn_x2,QuantType.per_1x32,1,0,32,0,,,,,,,24.3525,,18.6,148810.32,stage1,moe_cktile2stages_gemm1_256x32x256x256_1x4_16x16x32_2perCU_1x32_HasBias_swiglu,0.0%
256,2,3072,3072,128,4,ActivationType.Swiglu,torch.bfloat16,torch.bfloat16,torch.float4_e2m1fn_x2,QuantType.per_1x32,1,0,32,0,,,,,,,24.9012,,18.19,145531.27,stage1,moe_cktile2stages_gemm1_256x32x256x256_1x4_16x16x32_1perCU_1x32_HasBias_swiglu,0.0%
256,2,3072,3072,128,4,ActivationType.Swiglu,torch.bfloat16,torch.bfloat16,torch.float4_e2m1fn_x2,QuantType.per_1x32,1,0,32,0,,,,,,,52.7943,,8.58,68641.94,stage1,moe_cktile2stages_gemm1_256x32x256x256_1x4_16x16x32_3perCU_1x32_HasBias_swiglu,0.0%
256,2,3072,3072,128,4,ActivationType.Swiglu,torch.bfloat16,torch.bfloat16,torch.float4_e2m1fn_x2,QuantType.per_1x32,1,0,32,0,,,,,,,95.392,,4.75,37989.59,stage1,moe_cktile2stages_gemm1_256x32x256x256_1x4_16x16x32_4perCU_1x32_HasBias_swiglu,0.0%
256,2,3072,3072,128,4,ActivationType.Swiglu,torch.bfloat16,torch.bfloat16,torch.float4_e2m1fn_x2,QuantType.per_1x32,1,0,32,0,,,,,,,22.3399,,20.28,162216.63,stage2,moe_cktile2stages_gemm2_256x32x256x256_1x4_16x16x32_2perCU_1x32_MulRoutedWeight_HasBias,4.1%
256,2,3072,3072,128,4,ActivationType.Swiglu,torch.bfloat16,torch.bfloat16,torch.float4_e2m1fn_x2,QuantType.per_1x32,1,0,32,0,,,,,,,22.242,,20.37,162930.64,stage2,moe_cktile2stages_gemm2_256x32x256x256_1x4_16x16x32_1perCU_1x32_MulRoutedWeight_HasBias,4.4%
256,2,3072,3072,128,4,ActivationType.Swiglu,torch.bfloat16,torch.bfloat16,torch.float4_e2m1fn_x2,QuantType.per_1x32,1,0,32,0,,,,,,,56.4989,,8.02,64141.13,stage2,moe_cktile2stages_gemm2_256x32x256x256_1x4_16x16x32_3perCU_1x32_MulRoutedWeight_HasBias,4.0%
256,2,3072,3072,128,4,ActivationType.Swiglu,torch.bfloat16,torch.bfloat16,torch.float4_e2m1fn_x2,QuantType.per_1x32,1,0,32,0,,,,,,,97.5743,,4.64,37139.94,stage2,moe_cktile2stages_gemm2_256x32x256x256_1x4_16x16x32_4perCU_1x32_MulRoutedWeight_HasBias,4.6%
256,2,3072,3072,128,4,ActivationType.Swiglu,torch.bfloat16,torch.bfloat16,torch.float4_e2m1fn_x2,QuantType.per_1x32,1,0,64,0,,,,,,,32.6179,,13.89,111101.67,stage1,moe_cktile2stages_gemm1_256x64x256x256_1x4_16x16x32_1perCU_1x32_HasBias_swiglu,0.0%
256,2,3072,3072,128,4,ActivationType.Swiglu,torch.bfloat16,torch.bfloat16,torch.float4_e2m1fn_x2,QuantType.per_1x32,1,0,64,0,,,,,,,48.479,,9.34,74752.02,stage1,moe_cktile2stages_gemm1_256x64x256x256_1x4_16x16x32_2perCU_1x32_HasBias_swiglu,0.0%
256,2,3072,3072,128,4,ActivationType.Swiglu,torch.bfloat16,torch.bfloat16,torch.float4_e2m1fn_x2,QuantType.per_1x32,1,0,64,0,,,,,,,32.6982,,13.85,110828.83,stage1,moe_cktile2stages_gemm1_256x64x256x256_1x4_16x16x32_3perCU_1x32_HasBias_swiglu,0.0%
256,2,3072,3072,128,4,ActivationType.Swiglu,torch.bfloat16,torch.bfloat16,torch.float4_e2m1fn_x2,QuantType.per_1x32,1,0,64,0,,,,,,,32.5153,,13.93,111452.25,stage1,moe_cktile2stages_gemm1_256x64x256x256_1x4_16x16x32_4perCU_1x32_HasBias_swiglu,0.0%
256,2,3072,3072,128,4,ActivationType.Swiglu,torch.bfloat16,torch.bfloat16,torch.float4_e2m1fn_x2,QuantType.per_1x32,1,0,64,0,,,,,,,33.1563,,13.66,109297.58,stage2,moe_cktile2stages_gemm2_256x64x256x256_1x4_16x16x32_1perCU_1x32_MulRoutedWeight_HasBias,4.1%
256,2,3072,3072,128,4,ActivationType.Swiglu,torch.bfloat16,torch.bfloat16,torch.float4_e2m1fn_x2,QuantType.per_1x32,1,0,64,0,,,,,,,45.8981,,9.87,78955.41,stage2,moe_cktile2stages_gemm2_256x64x256x256_1x4_16x16x32_2perCU_1x32_MulRoutedWeight_HasBias,4.3%
256,2,3072,3072,128,4,ActivationType.Swiglu,torch.bfloat16,torch.bfloat16,torch.float4_e2m1fn_x2,QuantType.per_1x32,1,0,64,0,,,,,,,34.2976,,13.21,105660.55,stage2,moe_cktile2stages_gemm2_256x64x256x256_1x4_16x16x32_3perCU_1x32_MulRoutedWeight_HasBias,3.9%
256,2,3072,3072,128,4,ActivationType.Swiglu,torch.bfloat16,torch.bfloat16,torch.float4_e2m1fn_x2,QuantType.per_1x32,1,0,64,0,,,,,,,33.0412,,13.71,109678.32,stage2,moe_cktile2stages_gemm2_256x64x256x256_1x4_16x16x32_4perCU_1x32_MulRoutedWeight_HasBias,4.0%
256,4,3072,512,128,4,ActivationType.Swiglu,torch.bfloat16,torch.bfloat16,torch.float4_e2m1fn_x2,QuantType.per_1x32,1,0,32,0,,,,,,,-1.0,,0.0,0.0,stage1,flydsl_moe1_afp16_wfp4_bf16_t32x256x256,100.0%
256,4,3072,512,128,4,ActivationType.Swiglu,torch.bfloat16,torch.bfloat16,torch.float4_e2m1fn_x2,QuantType.per_1x32,1,0,32,0,,,,,,,-1.0,,0.0,0.0,stage2,flydsl_moe2_afp16_wfp4_bf16_t32x128x256_atomic,100.0%
256,4,3072,512,128,4,ActivationType.Swiglu,torch.bfloat16,torch.bfloat16,torch.float4_e2m1fn_x2,QuantType.per_1x32,1,0,32,0,,,,,,,-1.0,,0.0,0.0,stage2,flydsl_moe2_afp16_wfp4_bf16_t32x128x256_reduce,100.0%
256,4,3072,512,128,4,ActivationType.Swiglu,torch.bfloat16,torch.bfloat16,torch.float4_e2m1fn_x2,QuantType.per_1x32,1,0,32,0,,,,,,,-1.0,,0.0,0.0,stage2,flydsl_moe2_afp16_wfp4_bf16_t32x256x256_atomic,100.0%
256,4,3072,512,128,4,ActivationType.Swiglu,torch.bfloat16,torch.bfloat16,torch.float4_e2m1fn_x2,QuantType.per_1x32,1,0,32,0,,,,,,,-1.0,,0.0,0.0,stage2,flydsl_moe2_afp16_wfp4_bf16_t32x256x256_reduce,100.0%
256,4,3072,512,128,4,ActivationType.Swiglu,torch.bfloat16,torch.bfloat16,torch.float4_e2m1fn_x2,QuantType.per_1x32,1,0,64,0,,,,,,,-1.0,,0.0,0.0,stage1,flydsl_moe1_afp16_wfp4_bf16_t64x256x256,100.0%
256,4,3072,512,128,4,ActivationType.Swiglu,torch.bfloat16,torch.bfloat16,torch.float4_e2m1fn_x2,QuantType.per_1x32,1,0,64,0,,,,,,,-1.0,,0.0,0.0,stage2,flydsl_moe2_afp16_wfp4_bf16_t64x128x256_atomic,100.0%
256,4,3072,512,128,4,ActivationType.Swiglu,torch.bfloat16,torch.bfloat16,torch.float4_e2m1fn_x2,QuantType.per_1x32,1,0,64,0,,,,,,,-1.0,,0.0,0.0,stage2,flydsl_moe2_afp16_wfp4_bf16_t64x128x256_reduce,100.0%
256,4,3072,512,128,4,ActivationType.Swiglu,torch.bfloat16,torch.bfloat16,torch.float4_e2m1fn_x2,QuantType.per_1x32,1,0,64,0,,,,,,,-1.0,,0.0,0.0,stage2,flydsl_moe2_afp16_wfp4_bf16_t64x256x256_atomic,100.0%
256,4,3072,512,128,4,ActivationType.Swiglu,torch.bfloat16,torch.bfloat16,torch.float4_e2m1fn_x2,QuantType.per_1x32,1,0,64,0,,,,,,,-1.0,,0.0,0.0,stage2,flydsl_moe2_afp16_wfp4_bf16_t64x256x256_reduce,100.0%
256,4,3072,512,128,4,ActivationType.Swiglu,torch.bfloat16,torch.bfloat16,torch.float4_e2m1fn_x2,QuantType.per_1x32,1,0,128,0,,,,,,,-1.0,,0.0,0.0,stage2,flydsl_moe2_afp16_wfp4_bf16_t128x128x256_atomic,100.0%
256,4,3072,512,128,4,ActivationType.Swiglu,torch.bfloat16,torch.bfloat16,torch.float4_e2m1fn_x2,QuantType.per_1x32,1,0,128,0,,,,,,,-1.0,,0.0,0.0,stage2,flydsl_moe2_afp16_wfp4_bf16_t128x128x256_reduce,100.0%
256,4,3072,512,128,4,ActivationType.Swiglu,torch.bfloat16,torch.bfloat16,torch.float4_e2m1fn_x2,QuantType.per_1x32,1,0,128,0,,,,,,,-1.0,,0.0,0.0,stage2,flydsl_moe2_afp16_wfp4_bf16_t128x256x256_atomic,100.0%
256,4,3072,512,128,4,ActivationType.Swiglu,torch.bfloat16,torch.bfloat16,torch.float4_e2m1fn_x2,QuantType.per_1x32,1,0,128,0,,,,,,,-1.0,,0.0,0.0,stage2,flydsl_moe2_afp16_wfp4_bf16_t128x256x256_reduce,100.0%
256,4,3072,512,128,4,ActivationType.Swiglu,torch.bfloat16,torch.bfloat16,torch.float4_e2m1fn_x2,QuantType.per_1x32,1,0,32,0,,,,,,,20.6052,,7.33,29314.39,stage1,moe_cktile2stages_gemm1_256x32x256x256_1x4_16x16x32_2perCU_1x32_HasBias_swiglu,0.0%
256,4,3072,512,128,4,ActivationType.Swiglu,torch.bfloat16,torch.bfloat16,torch.float4_e2m1fn_x2,QuantType.per_1x32,1,0,32,0,,,,,,,21.5581,,7.0,28018.65,stage1,moe_cktile2stages_gemm1_256x32x256x256_1x4_16x16x32_1perCU_1x32_HasBias_swiglu,0.0%
256,4,3072,512,128,4,ActivationType.Swiglu,torch.bfloat16,torch.bfloat16,torch.float4_e2m1fn_x2,QuantType.per_1x32,1,0,32,0,,,,,,,52.2338,,2.89,11563.95,stage1,moe_cktile2stages_gemm1_256x32x256x256_1x4_16x16x32_3perCU_1x32_HasBias_swiglu,0.0%
256,4,3072,512,128,4,ActivationType.Swiglu,torch.bfloat16,torch.bfloat16,torch.float4_e2m1fn_x2,QuantType.per_1x32,1,0,32,0,,,,,,,93.0793,,1.62,6489.4,stage1,moe_cktile2stages_gemm1_256x32x256x256_1x4_16x16x32_4perCU_1x32_HasBias_swiglu,0.0%
256,4,3072,512,128,4,ActivationType.Swiglu,torch.bfloat16,torch.bfloat16,torch.float4_e2m1fn_x2,QuantType.per_1x32,1,0,32,0,,,,,,,13.2302,,11.41,45655.31,stage2,moe_cktile2stages_gemm2_256x32x256x256_1x4_16x16x32_2perCU_1x32_MulRoutedWeight_HasBias,1.5%
256,4,3072,512,128,4,ActivationType.Swiglu,torch.bfloat16,torch.bfloat16,torch.float4_e2m1fn_x2,QuantType.per_1x32,1,0,32,0,,,,,,,13.3846,,11.28,45128.65,stage2,moe_cktile2stages_gemm2_256x32x256x256_1x4_16x16x32_1perCU_1x32_MulRoutedWeight_HasBias,1.5%
256,4,3072,512,128,4,ActivationType.Swiglu,torch.bfloat16,torch.bfloat16,torch.float4_e2m1fn_x2,QuantType.per_1x32,1,0,32,0,,,,,,,15.4952,,9.74,38981.68,stage2,moe_cktile2stages_gemm2_256x32x256x256_1x4_16x16x32_3perCU_1x32_MulRoutedWeight_HasBias,1.5%
256,4,3072,512,128,4,ActivationType.Swiglu,torch.bfloat16,torch.bfloat16,torch.float4_e2m1fn_x2,QuantType.per_1x32,1,0,32,0,,,,,,,20.9245,,7.22,28867.07,stage2,moe_cktile2stages_gemm2_256x32x256x256_1x4_16x16x32_4perCU_1x32_MulRoutedWeight_HasBias,1.5%
256,4,3072,512,128,4,ActivationType.Swiglu,torch.bfloat16,torch.bfloat16,torch.float4_e2m1fn_x2,QuantType.per_1x32,1,0,64,0,,,,,,,30.9522,,4.88,19514.89,stage1,moe_cktile2stages_gemm1_256x64x256x256_1x4_16x16x32_1perCU_1x32_HasBias_swiglu,0.0%
256,4,3072,512,128,4,ActivationType.Swiglu,torch.bfloat16,torch.bfloat16,torch.float4_e2m1fn_x2,QuantType.per_1x32,1,0,64,0,,,,,,,45.5319,,3.32,13266.06,stage1,moe_cktile2stages_gemm1_256x64x256x256_1x4_16x16x32_2perCU_1x32_HasBias_swiglu,0.0%
256,4,3072,512,128,4,ActivationType.Swiglu,torch.bfloat16,torch.bfloat16,torch.float4_e2m1fn_x2,QuantType.per_1x32,1,0,64,0,,,,,,,30.9186,,4.88,19536.1,stage1,moe_cktile2stages_gemm1_256x64x256x256_1x4_16x16x32_3perCU_1x32_HasBias_swiglu,0.0%
256,4,3072,512,128,4,ActivationType.Swiglu,torch.bfloat16,torch.bfloat16,torch.float4_e2m1fn_x2,QuantType.per_1x32,1,0,64,0,,,,,,,29.6817,,5.09,20350.21,stage1,moe_cktile2stages_gemm1_256x64x256x256_1x4_16x16x32_4perCU_1x32_HasBias_swiglu,0.0%
256,4,3072,512,128,4,ActivationType.Swiglu,torch.bfloat16,torch.bfloat16,torch.float4_e2m1fn_x2,QuantType.per_1x32,1,0,64,0,,,,,,,16.9316,,8.92,35674.65,stage2,moe_cktile2stages_gemm2_256x64x256x256_1x4_16x16x32_1perCU_1x32_MulRoutedWeight_HasBias,1.5%
256,4,3072,512,128,4,ActivationType.Swiglu,torch.bfloat16,torch.bfloat16,torch.float4_e2m1fn_x2,QuantType.per_1x32,1,0,64,0,,,,,,,15.4975,,9.74,38975.89,stage2,moe_cktile2stages_gemm2_256x64x256x256_1x4_16x16x32_2perCU_1x32_MulRoutedWeight_HasBias,1.5%
256,4,3072,512,128,4,ActivationType.Swiglu,torch.bfloat16,torch.bfloat16,torch.float4_e2m1fn_x2,QuantType.per_1x32,1,0,64,0,,,,,,,16.8531,,8.96,35840.82,stage2,moe_cktile2stages_gemm2_256x64x256x256_1x4_16x16x32_3perCU_1x32_MulRoutedWeight_HasBias,1.5%
256,4,3072,512,128,4,ActivationType.Swiglu,torch.bfloat16,torch.bfloat16,torch.float4_e2m1fn_x2,QuantType.per_1x32,1,0,64,0,,,,,,,15.5082,,9.74,38949.0,stage2,moe_cktile2stages_gemm2_256x64x256x256_1x4_16x16x32_4perCU_1x32_MulRoutedWeight_HasBias,1.4%
256,4,3072,1536,128,4,ActivationType.Swiglu,torch.bfloat16,torch.bfloat16,torch.float4_e2m1fn_x2,QuantType.per_1x32,1,0,32,0,,,,,,,-1.0,,0.0,0.0,stage1,flydsl_moe1_afp16_wfp4_bf16_t32x256x256,100.0%
256,4,3072,1536,128,4,ActivationType.Swiglu,torch.bfloat16,torch.bfloat16,torch.float4_e2m1fn_x2,QuantType.per_1x32,1,0,32,0,,,,,,,-1.0,,0.0,0.0,stage2,flydsl_moe2_afp16_wfp4_bf16_t32x128x256_atomic,100.0%
256,4,3072,1536,128,4,ActivationType.Swiglu,torch.bfloat16,torch.bfloat16,torch.float4_e2m1fn_x2,QuantType.per_1x32,1,0,32,0,,,,,,,-1.0,,0.0,0.0,stage2,flydsl_moe2_afp16_wfp4_bf16_t32x128x256_reduce,100.0%
256,4,3072,1536,128,4,ActivationType.Swiglu,torch.bfloat16,torch.bfloat16,torch.float4_e2m1fn_x2,QuantType.per_1x32,1,0,32,0,,,,,,,-1.0,,0.0,0.0,stage2,flydsl_moe2_afp16_wfp4_bf16_t32x256x256_atomic,100.0%
256,4,3072,1536,128,4,ActivationType.Swiglu,torch.bfloat16,torch.bfloat16,torch.float4_e2m1fn_x2,QuantType.per_1x32,1,0,32,0,,,,,,,-1.0,,0.0,0.0,stage2,flydsl_moe2_afp16_wfp4_bf16_t32x256x256_reduce,100.0%
256,4,3072,1536,128,4,ActivationType.Swiglu,torch.bfloat16,torch.bfloat16,torch.float4_e2m1fn_x2,QuantType.per_1x32,1,0,64,0,,,,,,,-1.0,,0.0,0.0,stage1,flydsl_moe1_afp16_wfp4_bf16_t64x256x256,100.0%
256,4,3072,1536,128,4,ActivationType.Swiglu,torch.bfloat16,torch.bfloat16,torch.float4_e2m1fn_x2,QuantType.per_1x32,1,0,64,0,,,,,,,-1.0,,0.0,0.0,stage2,flydsl_moe2_afp16_wfp4_bf16_t64x128x256_atomic,100.0%
256,4,3072,1536,128,4,ActivationType.Swiglu,torch.bfloat16,torch.bfloat16,torch.float4_e2m1fn_x2,QuantType.per_1x32,1,0,64,0,,,,,,,-1.0,,0.0,0.0,stage2,flydsl_moe2_afp16_wfp4_bf16_t64x128x256_reduce,100.0%
256,4,3072,1536,128,4,ActivationType.Swiglu,torch.bfloat16,torch.bfloat16,torch.float4_e2m1fn_x2,QuantType.per_1x32,1,0,64,0,,,,,,,-1.0,,0.0,0.0,stage2,flydsl_moe2_afp16_wfp4_bf16_t64x256x256_atomic,100.0%
256,4,3072,1536,128,4,ActivationType.Swiglu,torch.bfloat16,torch.bfloat16,torch.float4_e2m1fn_x2,QuantType.per_1x32,1,0,64,0,,,,,,,-1.0,,0.0,0.0,stage2,flydsl_moe2_afp16_wfp4_bf16_t64x256x256_reduce,100.0%
256,4,3072,1536,128,4,ActivationType.Swiglu,torch.bfloat16,torch.bfloat16,torch.float4_e2m1fn_x2,QuantType.per_1x32,1,0,128,0,,,,,,,-1.0,,0.0,0.0,stage2,flydsl_moe2_afp16_wfp4_bf16_t128x128x256_atomic,100.0%
256,4,3072,1536,128,4,ActivationType.Swiglu,torch.bfloat16,torch.bfloat16,torch.float4_e2m1fn_x2,QuantType.per_1x32,1,0,128,0,,,,,,,-1.0,,0.0,0.0,stage2,flydsl_moe2_afp16_wfp4_bf16_t128x128x256_reduce,100.0%
256,4,3072,1536,128,4,ActivationType.Swiglu,torch.bfloat16,torch.bfloat16,torch.float4_e2m1fn_x2,QuantType.per_1x32,1,0,128,0,,,,,,,-1.0,,0.0,0.0,stage2,flydsl_moe2_afp16_wfp4_bf16_t128x256x256_atomic,100.0%
256,4,3072,1536,128,4,ActivationType.Swiglu,torch.bfloat16,torch.bfloat16,torch.float4_e2m1fn_x2,QuantType.per_1x32,1,0,128,0,,,,,,,-1.0,,0.0,0.0,stage2,flydsl_moe2_afp16_wfp4_bf16_t128x256x256_reduce,100.0%
256,4,3072,1536,128,4,ActivationType.Swiglu,torch.bfloat16,torch.bfloat16,torch.float4_e2m1fn_x2,QuantType.per_1x32,1,0,32,0,,,,,,,25.2117,,17.97,71870.94,stage1,moe_cktile2stages_gemm1_256x32x256x256_1x4_16x16x32_2perCU_1x32_HasBias_swiglu,0.0%
256,4,3072,1536,128,4,ActivationType.Swiglu,torch.bfloat16,torch.bfloat16,torch.float4_e2m1fn_x2,QuantType.per_1x32,1,0,32,0,,,,,,,24.3529,,18.6,74405.45,stage1,moe_cktile2stages_gemm1_256x32x256x256_1x4_16x16x32_1perCU_1x32_HasBias_swiglu,0.0%
256,4,3072,1536,128,4,ActivationType.Swiglu,torch.bfloat16,torch.bfloat16,torch.float4_e2m1fn_x2,QuantType.per_1x32,1,0,32,0,,,,,,,52.8957,,8.56,34255.87,stage1,moe_cktile2stages_gemm1_256x32x256x256_1x4_16x16x32_3perCU_1x32_HasBias_swiglu,0.0%
256,4,3072,1536,128,4,ActivationType.Swiglu,torch.bfloat16,torch.bfloat16,torch.float4_e2m1fn_x2,QuantType.per_1x32,1,0,32,0,,,,,,,97.3964,,4.65,18604.27,stage1,moe_cktile2stages_gemm1_256x32x256x256_1x4_16x16x32_4perCU_1x32_HasBias_swiglu,0.0%
256,4,3072,1536,128,4,ActivationType.Swiglu,torch.bfloat16,torch.bfloat16,torch.float4_e2m1fn_x2,QuantType.per_1x32,1,0,32,0,,,,,,,20.885,,21.69,86760.28,stage2,moe_cktile2stages_gemm2_256x32x256x256_1x4_16x16x32_2perCU_1x32_MulRoutedWeight_HasBias,3.1%
256,4,3072,1536,128,4,ActivationType.Swiglu,torch.bfloat16,torch.bfloat16,torch.float4_e2m1fn_x2,QuantType.per_1x32,1,0,32,0,,,,,,,19.8646,,22.8,91216.96,stage2,moe_cktile2stages_gemm2_256x32x256x256_1x4_16x16x32_1perCU_1x32_MulRoutedWeight_HasBias,3.1%
256,4,3072,1536,128,4,ActivationType.Swiglu,torch.bfloat16,torch.bfloat16,torch.float4_e2m1fn_x2,QuantType.per_1x32,1,0,32,0,,,,,,,34.0351,,13.31,53238.82,stage2,moe_cktile2stages_gemm2_256x32x256x256_1x4_16x16x32_3perCU_1x32_MulRoutedWeight_HasBias,3.0%
256,4,3072,1536,128,4,ActivationType.Swiglu,torch.bfloat16,torch.bfloat16,torch.float4_e2m1fn_x2,QuantType.per_1x32,1,0,32,0,,,,,,,57.5956,,7.86,31460.54,stage2,moe_cktile2stages_gemm2_256x32x256x256_1x4_16x16x32_4perCU_1x32_MulRoutedWeight_HasBias,3.0%
256,4,3072,1536,128,4,ActivationType.Swiglu,torch.bfloat16,torch.bfloat16,torch.float4_e2m1fn_x2,QuantType.per_1x32,1,0,64,0,,,,,,,32.225,,14.06,56229.28,stage1,moe_cktile2stages_gemm1_256x64x256x256_1x4_16x16x32_1perCU_1x32_HasBias_swiglu,0.0%
256,4,3072,1536,128,4,ActivationType.Swiglu,torch.bfloat16,torch.bfloat16,torch.float4_e2m1fn_x2,QuantType.per_1x32,1,0,64,0,,,,,,,47.964,,9.44,37778.09,stage1,moe_cktile2stages_gemm1_256x64x256x256_1x4_16x16x32_2perCU_1x32_HasBias_swiglu,0.0%
256,4,3072,1536,128,4,ActivationType.Swiglu,torch.bfloat16,torch.bfloat16,torch.float4_e2m1fn_x2,QuantType.per_1x32,1,0,64,0,,,,,,,32.0902,,14.12,56465.48,stage1,moe_cktile2stages_gemm1_256x64x256x256_1x4_16x16x32_3perCU_1x32_HasBias_swiglu,0.0%
256,4,3072,1536,128,4,ActivationType.Swiglu,torch.bfloat16,torch.bfloat16,torch.float4_e2m1fn_x2,QuantType.per_1x32,1,0,64,0,,,,,,,32.6785,,13.86,55448.95,stage1,moe_cktile2stages_gemm1_256x64x256x256_1x4_16x16x32_4perCU_1x32_HasBias_swiglu,0.0%
256,4,3072,1536,128,4,ActivationType.Swiglu,torch.bfloat16,torch.bfloat16,torch.float4_e2m1fn_x2,QuantType.per_1x32,1,0,64,0,,,,,,,24.3226,,18.62,74498.14,stage2,moe_cktile2stages_gemm2_256x64x256x256_1x4_16x16x32_1perCU_1x32_MulRoutedWeight_HasBias,3.1%
256,4,3072,1536,128,4,ActivationType.Swiglu,torch.bfloat16,torch.bfloat16,torch.float4_e2m1fn_x2,QuantType.per_1x32,1,0,64,0,,,,,,,29.8736,,15.16,60655.18,stage2,moe_cktile2stages_gemm2_256x64x256x256_1x4_16x16x32_2perCU_1x32_MulRoutedWeight_HasBias,2.9%
256,4,3072,1536,128,4,ActivationType.Swiglu,torch.bfloat16,torch.bfloat16,torch.float4_e2m1fn_x2,QuantType.per_1x32,1,0,64,0,,,,,,,23.1325,,19.58,78330.85,stage2,moe_cktile2stages_gemm2_256x64x256x256_1x4_16x16x32_3perCU_1x32_MulRoutedWeight_HasBias,3.0%
256,4,3072,1536,128,4,ActivationType.Swiglu,torch.bfloat16,torch.bfloat16,torch.float4_e2m1fn_x2,QuantType.per_1x32,1,0,64,0,,,,,,,24.3171,,18.63,74514.99,stage2,moe_cktile2stages_gemm2_256x64x256x256_1x4_16x16x32_4perCU_1x32_MulRoutedWeight_HasBias,2.9%
256,4,3072,3072,128,4,ActivationType.Swiglu,torch.bfloat16,torch.bfloat16,torch.float4_e2m1fn_x2,QuantType.per_1x32,1,0,32,0,,,,,,,-1.0,,0.0,0.0,stage1,flydsl_moe1_afp16_wfp4_bf16_t32x256x256,100.0%
256,4,3072,3072,128,4,ActivationType.Swiglu,torch.bfloat16,torch.bfloat16,torch.float4_e2m1fn_x2,QuantType.per_1x32,1,0,32,0,,,,,,,-1.0,,0.0,0.0,stage2,flydsl_moe2_afp16_wfp4_bf16_t32x128x256_atomic,100.0%
256,4,3072,3072,128,4,ActivationType.Swiglu,torch.bfloat16,torch.bfloat16,torch.float4_e2m1fn_x2,QuantType.per_1x32,1,0,32,0,,,,,,,-1.0,,0.0,0.0,stage2,flydsl_moe2_afp16_wfp4_bf16_t32x128x256_reduce,100.0%
256,4,3072,3072,128,4,ActivationType.Swiglu,torch.bfloat16,torch.bfloat16,torch.float4_e2m1fn_x2,QuantType.per_1x32,1,0,32,0,,,,,,,-1.0,,0.0,0.0,stage2,flydsl_moe2_afp16_wfp4_bf16_t32x256x256_atomic,100.0%
256,4,3072,3072,128,4,ActivationType.Swiglu,torch.bfloat16,torch.bfloat16,torch.float4_e2m1fn_x2,QuantType.per_1x32,1,0,32,0,,,,,,,-1.0,,0.0,0.0,stage2,flydsl_moe2_afp16_wfp4_bf16_t32x256x256_reduce,100.0%
256,4,3072,3072,128,4,ActivationType.Swiglu,torch.bfloat16,torch.bfloat16,torch.float4_e2m1fn_x2,QuantType.per_1x32,1,0,64,0,,,,,,,-1.0,,0.0,0.0,stage1,flydsl_moe1_afp16_wfp4_bf16_t64x256x256,100.0%
256,4,3072,3072,128,4,ActivationType.Swiglu,torch.bfloat16,torch.bfloat16,torch.float4_e2m1fn_x2,QuantType.per_1x32,1,0,64,0,,,,,,,-1.0,,0.0,0.0,stage2,flydsl_moe2_afp16_wfp4_bf16_t64x128x256_atomic,100.0%
256,4,3072,3072,128,4,ActivationType.Swiglu,torch.bfloat16,torch.bfloat16,torch.float4_e2m1fn_x2,QuantType.per_1x32,1,0,64,0,,,,,,,-1.0,,0.0,0.0,stage2,flydsl_moe2_afp16_wfp4_bf16_t64x128x256_reduce,100.0%
256,4,3072,3072,128,4,ActivationType.Swiglu,torch.bfloat16,torch.bfloat16,torch.float4_e2m1fn_x2,QuantType.per_1x32,1,0,64,0,,,,,,,-1.0,,0.0,0.0,stage2,flydsl_moe2_afp16_wfp4_bf16_t64x256x256_atomic,100.0%
256,4,3072,3072,128,4,ActivationType.Swiglu,torch.bfloat16,torch.bfloat16,torch.float4_e2m1fn_x2,QuantType.per_1x32,1,0,64,0,,,,,,,-1.0,,0.0,0.0,stage2,flydsl_moe2_afp16_wfp4_bf16_t64x256x256_reduce,100.0%
256,4,3072,3072,128,4,ActivationType.Swiglu,torch.bfloat16,torch.bfloat16,torch.float4_e2m1fn_x2,QuantType.per_1x32,1,0,128,0,,,,,,,-1.0,,0.0,0.0,stage2,flydsl_moe2_afp16_wfp4_bf16_t128x128x256_atomic,100.0%
256,4,3072,3072,128,4,ActivationType.Swiglu,torch.bfloat16,torch.bfloat16,torch.float4_e2m1fn_x2,QuantType.per_1x32,1,0,128,0,,,,,,,-1.0,,0.0,0.0,stage2,flydsl_moe2_afp16_wfp4_bf16_t128x128x256_reduce,100.0%
256,4,3072,3072,128,4,ActivationType.Swiglu,torch.bfloat16,torch.bfloat16,torch.float4_e2m1fn_x2,QuantType.per_1x32,1,0,128,0,,,,,,,-1.0,,0.0,0.0,stage2,flydsl_moe2_afp16_wfp4_bf16_t128x256x256_atomic,100.0%
256,4,3072,3072,128,4,ActivationType.Swiglu,torch.bfloat16,torch.bfloat16,torch.float4_e2m1fn_x2,QuantType.per_1x32,1,0,128,0,,,,,,,-1.0,,0.0,0.0,stage2,flydsl_moe2_afp16_wfp4_bf16_t128x256x256_reduce,100.0%
256,4,3072,3072,128,4,ActivationType.Swiglu,torch.bfloat16,torch.bfloat16,torch.float4_e2m1fn_x2,QuantType.per_1x32,1,0,32,0,,,,,,,38.7654,,23.37,93483.57,stage1,moe_cktile2stages_gemm1_256x32x256x256_1x4_16x16x32_2perCU_1x32_HasBias_swiglu,0.0%
256,4,3072,3072,128,4,ActivationType.Swiglu,torch.bfloat16,torch.bfloat16,torch.float4_e2m1fn_x2,QuantType.per_1x32,1,0,32,0,,,,,,,38.7903,,23.36,93423.56,stage1,moe_cktile2stages_gemm1_256x32x256x256_1x4_16x16x32_1perCU_1x32_HasBias_swiglu,0.0%
256,4,3072,3072,128,4,ActivationType.Swiglu,torch.bfloat16,torch.bfloat16,torch.float4_e2m1fn_x2,QuantType.per_1x32,1,0,32,0,,,,,,,71.4412,,12.68,50726.02,stage1,moe_cktile2stages_gemm1_256x32x256x256_1x4_16x16x32_3perCU_1x32_HasBias_swiglu,0.0%
256,4,3072,3072,128,4,ActivationType.Swiglu,torch.bfloat16,torch.bfloat16,torch.float4_e2m1fn_x2,QuantType.per_1x32,1,0,32,0,,,,,,,158.5944,,5.71,22850.29,stage1,moe_cktile2stages_gemm1_256x32x256x256_1x4_16x16x32_4perCU_1x32_HasBias_swiglu,0.0%
256,4,3072,3072,128,4,ActivationType.Swiglu,torch.bfloat16,torch.bfloat16,torch.float4_e2m1fn_x2,QuantType.per_1x32,1,0,32,0,,,,,,,25.1914,,35.96,143855.75,stage2,moe_cktile2stages_gemm2_256x32x256x256_1x4_16x16x32_2perCU_1x32_MulRoutedWeight_HasBias,4.9%
256,4,3072,3072,128,4,ActivationType.Swiglu,torch.bfloat16,torch.bfloat16,torch.float4_e2m1fn_x2,QuantType.per_1x32,1,0,32,0,,,,,,,25.7267,,35.22,140862.52,stage2,moe_cktile2stages_gemm2_256x32x256x256_1x4_16x16x32_1perCU_1x32_MulRoutedWeight_HasBias,4.8%
256,4,3072,3072,128,4,ActivationType.Swiglu,torch.bfloat16,torch.bfloat16,torch.float4_e2m1fn_x2,QuantType.per_1x32,1,0,32,0,,,,,,,59.2087,,15.3,61206.0,stage2,moe_cktile2stages_gemm2_256x32x256x256_1x4_16x16x32_3perCU_1x32_MulRoutedWeight_HasBias,5.3%
256,4,3072,3072,128,4,ActivationType.Swiglu,torch.bfloat16,torch.bfloat16,torch.float4_e2m1fn_x2,QuantType.per_1x32,1,0,32,0,,,,,,,102.1791,,8.87,35466.43,stage2,moe_cktile2stages_gemm2_256x32x256x256_1x4_16x16x32_4perCU_1x32_MulRoutedWeight_HasBias,5.2%
256,4,3072,3072,128,4,ActivationType.Swiglu,torch.bfloat16,torch.bfloat16,torch.float4_e2m1fn_x2,QuantType.per_1x32,1,0,64,0,,,,,,,59.4127,,15.25,60995.84,stage1,moe_cktile2stages_gemm1_256x64x256x256_1x4_16x16x32_1perCU_1x32_HasBias_swiglu,0.0%
256,4,3072,3072,128,4,ActivationType.Swiglu,torch.bfloat16,torch.bfloat16,torch.float4_e2m1fn_x2,QuantType.per_1x32,1,0,64,0,,,,,,,67.9396,,13.33,53340.43,stage1,moe_cktile2stages_gemm1_256x64x256x256_1x4_16x16x32_2perCU_1x32_HasBias_swiglu,0.0%
256,4,3072,3072,128,4,ActivationType.Swiglu,torch.bfloat16,torch.bfloat16,torch.float4_e2m1fn_x2,QuantType.per_1x32,1,0,64,0,,,,,,,58.5062,,15.49,61940.92,stage1,moe_cktile2stages_gemm1_256x64x256x256_1x4_16x16x32_3perCU_1x32_HasBias_swiglu,0.0%
256,4,3072,3072,128,4,ActivationType.Swiglu,torch.bfloat16,torch.bfloat16,torch.float4_e2m1fn_x2,QuantType.per_1x32,1,0,64,0,,,,,,,59.0116,,15.35,61410.43,stage1,moe_cktile2stages_gemm1_256x64x256x256_1x4_16x16x32_4perCU_1x32_HasBias_swiglu,0.0%
256,4,3072,3072,128,4,ActivationType.Swiglu,torch.bfloat16,torch.bfloat16,torch.float4_e2m1fn_x2,QuantType.per_1x32,1,0,64,0,,,,,,,35.5564,,25.48,101920.55,stage2,moe_cktile2stages_gemm2_256x64x256x256_1x4_16x16x32_1perCU_1x32_MulRoutedWeight_HasBias,4.9%
256,4,3072,3072,128,4,ActivationType.Swiglu,torch.bfloat16,torch.bfloat16,torch.float4_e2m1fn_x2,QuantType.per_1x32,1,0,64,0,,,,,,,48.2234,,18.79,75148.74,stage2,moe_cktile2stages_gemm2_256x64x256x256_1x4_16x16x32_2perCU_1x32_MulRoutedWeight_HasBias,5.0%
256,4,3072,3072,128,4,ActivationType.Swiglu,torch.bfloat16,torch.bfloat16,torch.float4_e2m1fn_x2,QuantType.per_1x32,1,0,64,0,,,,,,,36.2812,,24.97,99884.45,stage2,moe_cktile2stages_gemm2_256x64x256x256_1x4_16x16x32_3perCU_1x32_MulRoutedWeight_HasBias,4.9%
256,4,3072,3072,128,4,ActivationType.Swiglu,torch.bfloat16,torch.bfloat16,torch.float4_e2m1fn_x2,QuantType.per_1x32,1,0,64,0,,,,,,,35.8789,,25.25,101004.43,stage2,moe_cktile2stages_gemm2_256x64x256x256_1x4_16x16x32_4perCU_1x32_MulRoutedWeight_HasBias,4.6%
256,8,3072,512,128,4,ActivationType.Swiglu,torch.bfloat16,torch.bfloat16,torch.float4_e2m1fn_x2,QuantType.per_1x32,1,0,32,0,,,,,,,-1.0,,0.0,0.0,stage1,flydsl_moe1_afp16_wfp4_bf16_t32x256x256,100.0%
256,8,3072,512,128,4,ActivationType.Swiglu,torch.bfloat16,torch.bfloat16,torch.float4_e2m1fn_x2,QuantType.per_1x32,1,0,32,0,,,,,,,-1.0,,0.0,0.0,stage2,flydsl_moe2_afp16_wfp4_bf16_t32x128x256_atomic,100.0%
256,8,3072,512,128,4,ActivationType.Swiglu,torch.bfloat16,torch.bfloat16,torch.float4_e2m1fn_x2,QuantType.per_1x32,1,0,32,0,,,,,,,-1.0,,0.0,0.0,stage2,flydsl_moe2_afp16_wfp4_bf16_t32x128x256_reduce,100.0%
256,8,3072,512,128,4,ActivationType.Swiglu,torch.bfloat16,torch.bfloat16,torch.float4_e2m1fn_x2,QuantType.per_1x32,1,0,32,0,,,,,,,-1.0,,0.0,0.0,stage2,flydsl_moe2_afp16_wfp4_bf16_t32x256x256_atomic,100.0%
256,8,3072,512,128,4,ActivationType.Swiglu,torch.bfloat16,torch.bfloat16,torch.float4_e2m1fn_x2,QuantType.per_1x32,1,0,32,0,,,,,,,-1.0,,0.0,0.0,stage2,flydsl_moe2_afp16_wfp4_bf16_t32x256x256_reduce,100.0%
256,8,3072,512,128,4,ActivationType.Swiglu,torch.bfloat16,torch.bfloat16,torch.float4_e2m1fn_x2,QuantType.per_1x32,1,0,64,0,,,,,,,-1.0,,0.0,0.0,stage1,flydsl_moe1_afp16_wfp4_bf16_t64x256x256,100.0%
256,8,3072,512,128,4,ActivationType.Swiglu,torch.bfloat16,torch.bfloat16,torch.float4_e2m1fn_x2,QuantType.per_1x32,1,0,64,0,,,,,,,-1.0,,0.0,0.0,stage2,flydsl_moe2_afp16_wfp4_bf16_t64x128x256_atomic,100.0%
256,8,3072,512,128,4,ActivationType.Swiglu,torch.bfloat16,torch.bfloat16,torch.float4_e2m1fn_x2,QuantType.per_1x32,1,0,64,0,,,,,,,-1.0,,0.0,0.0,stage2,flydsl_moe2_afp16_wfp4_bf16_t64x128x256_reduce,100.0%
256,8,3072,512,128,4,ActivationType.Swiglu,torch.bfloat16,torch.bfloat16,torch.float4_e2m1fn_x2,QuantType.per_1x32,1,0,64,0,,,,,,,-1.0,,0.0,0.0,stage2,flydsl_moe2_afp16_wfp4_bf16_t64x256x256_atomic,100.0%
256,8,3072,512,128,4,ActivationType.Swiglu,torch.bfloat16,torch.bfloat16,torch.float4_e2m1fn_x2,QuantType.per_1x32,1,0,64,0,,,,,,,-1.0,,0.0,0.0,stage2,flydsl_moe2_afp16_wfp4_bf16_t64x256x256_reduce,100.0%
256,8,3072,512,128,4,ActivationType.Swiglu,torch.bfloat16,torch.bfloat16,torch.float4_e2m1fn_x2,QuantType.per_1x32,1,0,128,0,,,,,,,-1.0,,0.0,0.0,stage2,flydsl_moe2_afp16_wfp4_bf16_t128x128x256_atomic,100.0%
256,8,3072,512,128,4,ActivationType.Swiglu,torch.bfloat16,torch.bfloat16,torch.float4_e2m1fn_x2,QuantType.per_1x32,1,0,128,0,,,,,,,-1.0,,0.0,0.0,stage2,flydsl_moe2_afp16_wfp4_bf16_t128x128x256_reduce,100.0%
256,8,3072,512,128,4,ActivationType.Swiglu,torch.bfloat16,torch.bfloat16,torch.float4_e2m1fn_x2,QuantType.per_1x32,1,0,128,0,,,,,,,-1.0,,0.0,0.0,stage2,flydsl_moe2_afp16_wfp4_bf16_t128x256x256_atomic,100.0%
256,8,3072,512,128,4,ActivationType.Swiglu,torch.bfloat16,torch.bfloat16,torch.float4_e2m1fn_x2,QuantType.per_1x32,1,0,128,0,,,,,,,-1.0,,0.0,0.0,stage2,flydsl_moe2_afp16_wfp4_bf16_t128x256x256_reduce,100.0%
256,8,3072,512,128,4,ActivationType.Swiglu,torch.bfloat16,torch.bfloat16,torch.float4_e2m1fn_x2,QuantType.per_1x32,1,0,32,0,,,,,,,22.0404,,13.7,27407.76,stage1,moe_cktile2stages_gemm1_256x32x256x256_1x4_16x16x32_2perCU_1x32_HasBias_swiglu,0.0%
256,8,3072,512,128,4,ActivationType.Swiglu,torch.bfloat16,torch.bfloat16,torch.float4_e2m1fn_x2,QuantType.per_1x32,1,0,32,0,,,,,,,22.945,,13.16,26327.22,stage1,moe_cktile2stages_gemm1_256x32x256x256_1x4_16x16x32_1perCU_1x32_HasBias_swiglu,0.0%
256,8,3072,512,128,4,ActivationType.Swiglu,torch.bfloat16,torch.bfloat16,torch.float4_e2m1fn_x2,QuantType.per_1x32,1,0,32,0,,,,,,,52.4807,,5.75,11510.48,stage1,moe_cktile2stages_gemm1_256x32x256x256_1x4_16x16x32_3perCU_1x32_HasBias_swiglu,0.0%
256,8,3072,512,128,4,ActivationType.Swiglu,torch.bfloat16,torch.bfloat16,torch.float4_e2m1fn_x2,QuantType.per_1x32,1,0,32,0,,,,,,,94.6119,,3.19,6384.8,stage1,moe_cktile2stages_gemm1_256x32x256x256_1x4_16x16x32_4perCU_1x32_HasBias_swiglu,0.0%
256,8,3072,512,128,4,ActivationType.Swiglu,torch.bfloat16,torch.bfloat16,torch.float4_e2m1fn_x2,QuantType.per_1x32,1,0,32,0,,,,,,,16.5516,,18.25,36496.66,stage2,moe_cktile2stages_gemm2_256x32x256x256_1x4_16x16x32_2perCU_1x32_MulRoutedWeight_HasBias,1.5%
256,8,3072,512,128,4,ActivationType.Swiglu,torch.bfloat16,torch.bfloat16,torch.float4_e2m1fn_x2,QuantType.per_1x32,1,0,32,0,,,,,,,16.7626,,18.02,36037.25,stage2,moe_cktile2stages_gemm2_256x32x256x256_1x4_16x16x32_1perCU_1x32_MulRoutedWeight_HasBias,1.5%
256,8,3072,512,128,4,ActivationType.Swiglu,torch.bfloat16,torch.bfloat16,torch.float4_e2m1fn_x2,QuantType.per_1x32,1,0,32,0,,,,,,,19.0068,,15.89,31782.21,stage2,moe_cktile2stages_gemm2_256x32x256x256_1x4_16x16x32_3perCU_1x32_MulRoutedWeight_HasBias,1.6%
256,8,3072,512,128,4,ActivationType.Swiglu,torch.bfloat16,torch.bfloat16,torch.float4_e2m1fn_x2,QuantType.per_1x32,1,0,32,0,,,,,,,29.7295,,10.16,20319.15,stage2,moe_cktile2stages_gemm2_256x32x256x256_1x4_16x16x32_4perCU_1x32_MulRoutedWeight_HasBias,1.6%
256,8,3072,512,128,4,ActivationType.Swiglu,torch.bfloat16,torch.bfloat16,torch.float4_e2m1fn_x2,QuantType.per_1x32,1,0,64,0,,,,,,,30.1244,,10.02,20052.78,stage1,moe_cktile2stages_gemm1_256x64x256x256_1x4_16x16x32_1perCU_1x32_HasBias_swiglu,0.0%
256,8,3072,512,128,4,ActivationType.Swiglu,torch.bfloat16,torch.bfloat16,torch.float4_e2m1fn_x2,QuantType.per_1x32,1,0,64,0,,,,,,,46.3828,,6.51,13023.75,stage1,moe_cktile2stages_gemm1_256x64x256x256_1x4_16x16x32_2perCU_1x32_HasBias_swiglu,0.0%
256,8,3072,512,128,4,ActivationType.Swiglu,torch.bfloat16,torch.bfloat16,torch.float4_e2m1fn_x2,QuantType.per_1x32,1,0,64,0,,,,,,,30.89,,9.78,19555.78,stage1,moe_cktile2stages_gemm1_256x64x256x256_1x4_16x16x32_3perCU_1x32_HasBias_swiglu,0.0%
256,8,3072,512,128,4,ActivationType.Swiglu,torch.bfloat16,torch.bfloat16,torch.float4_e2m1fn_x2,QuantType.per_1x32,1,0,64,0,,,,,,,30.1292,,10.02,20049.59,stage1,moe_cktile2stages_gemm1_256x64x256x256_1x4_16x16x32_4perCU_1x32_HasBias_swiglu,0.0%
256,8,3072,512,128,4,ActivationType.Swiglu,torch.bfloat16,torch.bfloat16,torch.float4_e2m1fn_x2,QuantType.per_1x32,1,0,64,0,,,,,,,23.6071,,12.79,25588.83,stage2,moe_cktile2stages_gemm2_256x64x256x256_1x4_16x16x32_1perCU_1x32_MulRoutedWeight_HasBias,1.6%
256,8,3072,512,128,4,ActivationType.Swiglu,torch.bfloat16,torch.bfloat16,torch.float4_e2m1fn_x2,QuantType.per_1x32,1,0,64,0,,,,,,,21.2334,,14.22,28449.43,stage2,moe_cktile2stages_gemm2_256x64x256x256_1x4_16x16x32_2perCU_1x32_MulRoutedWeight_HasBias,1.6%
256,8,3072,512,128,4,ActivationType.Swiglu,torch.bfloat16,torch.bfloat16,torch.float4_e2m1fn_x2,QuantType.per_1x32,1,0,64,0,,,,,,,23.4689,,12.87,25739.51,stage2,moe_cktile2stages_gemm2_256x64x256x256_1x4_16x16x32_3perCU_1x32_MulRoutedWeight_HasBias,1.6%
256,8,3072,512,128,4,ActivationType.Swiglu,torch.bfloat16,torch.bfloat16,torch.float4_e2m1fn_x2,QuantType.per_1x32,1,0,64,0,,,,,,,24.9479,,12.1,24213.58,stage2,moe_cktile2stages_gemm2_256x64x256x256_1x4_16x16x32_4perCU_1x32_MulRoutedWeight_HasBias,1.5%
256,8,3072,1536,128,4,ActivationType.Swiglu,torch.bfloat16,torch.bfloat16,torch.float4_e2m1fn_x2,QuantType.per_1x32,1,0,32,0,,,,,,,-1.0,,0.0,0.0,stage1,flydsl_moe1_afp16_wfp4_bf16_t32x256x256,100.0%
256,8,3072,1536,128,4,ActivationType.Swiglu,torch.bfloat16,torch.bfloat16,torch.float4_e2m1fn_x2,QuantType.per_1x32,1,0,32,0,,,,,,,-1.0,,0.0,0.0,stage2,flydsl_moe2_afp16_wfp4_bf16_t32x128x256_atomic,100.0%
256,8,3072,1536,128,4,ActivationType.Swiglu,torch.bfloat16,torch.bfloat16,torch.float4_e2m1fn_x2,QuantType.per_1x32,1,0,32,0,,,,,,,-1.0,,0.0,0.0,stage2,flydsl_moe2_afp16_wfp4_bf16_t32x128x256_reduce,100.0%
256,8,3072,1536,128,4,ActivationType.Swiglu,torch.bfloat16,torch.bfloat16,torch.float4_e2m1fn_x2,QuantType.per_1x32,1,0,32,0,,,,,,,-1.0,,0.0,0.0,stage2,flydsl_moe2_afp16_wfp4_bf16_t32x256x256_atomic,100.0%
256,8,3072,1536,128,4,ActivationType.Swiglu,torch.bfloat16,torch.bfloat16,torch.float4_e2m1fn_x2,QuantType.per_1x32,1,0,32,0,,,,,,,-1.0,,0.0,0.0,stage2,flydsl_moe2_afp16_wfp4_bf16_t32x256x256_reduce,100.0%
256,8,3072,1536,128,4,ActivationType.Swiglu,torch.bfloat16,torch.bfloat16,torch.float4_e2m1fn_x2,QuantType.per_1x32,1,0,64,0,,,,,,,-1.0,,0.0,0.0,stage1,flydsl_moe1_afp16_wfp4_bf16_t64x256x256,100.0%
256,8,3072,1536,128,4,ActivationType.Swiglu,torch.bfloat16,torch.bfloat16,torch.float4_e2m1fn_x2,QuantType.per_1x32,1,0,64,0,,,,,,,-1.0,,0.0,0.0,stage2,flydsl_moe2_afp16_wfp4_bf16_t64x128x256_atomic,100.0%
256,8,3072,1536,128,4,ActivationType.Swiglu,torch.bfloat16,torch.bfloat16,torch.float4_e2m1fn_x2,QuantType.per_1x32,1,0,64,0,,,,,,,-1.0,,0.0,0.0,stage2,flydsl_moe2_afp16_wfp4_bf16_t64x128x256_reduce,100.0%
256,8,3072,1536,128,4,ActivationType.Swiglu,torch.bfloat16,torch.bfloat16,torch.float4_e2m1fn_x2,QuantType.per_1x32,1,0,64,0,,,,,,,-1.0,,0.0,0.0,stage2,flydsl_moe2_afp16_wfp4_bf16_t64x256x256_atomic,100.0%
256,8,3072,1536,128,4,ActivationType.Swiglu,torch.bfloat16,torch.bfloat16,torch.float4_e2m1fn_x2,QuantType.per_1x32,1,0,64,0,,,,,,,-1.0,,0.0,0.0,stage2,flydsl_moe2_afp16_wfp4_bf16_t64x256x256_reduce,100.0%
256,8,3072,1536,128,4,ActivationType.Swiglu,torch.bfloat16,torch.bfloat16,torch.float4_e2m1fn_x2,QuantType.per_1x32,1,0,128,0,,,,,,,-1.0,,0.0,0.0,stage2,flydsl_moe2_afp16_wfp4_bf16_t128x128x256_atomic,100.0%
256,8,3072,1536,128,4,ActivationType.Swiglu,torch.bfloat16,torch.bfloat16,torch.float4_e2m1fn_x2,QuantType.per_1x32,1,0,128,0,,,,,,,-1.0,,0.0,0.0,stage2,flydsl_moe2_afp16_wfp4_bf16_t128x128x256_reduce,100.0%
256,8,3072,1536,128,4,ActivationType.Swiglu,torch.bfloat16,torch.bfloat16,torch.float4_e2m1fn_x2,QuantType.per_1x32,1,0,128,0,,,,,,,-1.0,,0.0,0.0,stage2,flydsl_moe2_afp16_wfp4_bf16_t128x256x256_atomic,100.0%
256,8,3072,1536,128,4,ActivationType.Swiglu,torch.bfloat16,torch.bfloat16,torch.float4_e2m1fn_x2,QuantType.per_1x32,1,0,128,0,,,,,,,-1.0,,0.0,0.0,stage2,flydsl_moe2_afp16_wfp4_bf16_t128x256x256_reduce,100.0%
256,8,3072,1536,128,4,ActivationType.Swiglu,torch.bfloat16,torch.bfloat16,torch.float4_e2m1fn_x2,QuantType.per_1x32,1,0,32,0,,,,,,,37.3129,,24.28,48563.3,stage1,moe_cktile2stages_gemm1_256x32x256x256_1x4_16x16x32_2perCU_1x32_HasBias_swiglu,0.0%
256,8,3072,1536,128,4,ActivationType.Swiglu,torch.bfloat16,torch.bfloat16,torch.float4_e2m1fn_x2,QuantType.per_1x32,1,0,32,0,,,,,,,38.0141,,23.83,47667.51,stage1,moe_cktile2stages_gemm1_256x32x256x256_1x4_16x16x32_1perCU_1x32_HasBias_swiglu,0.0%
256,8,3072,1536,128,4,ActivationType.Swiglu,torch.bfloat16,torch.bfloat16,torch.float4_e2m1fn_x2,QuantType.per_1x32,1,0,32,0,,,,,,,70.5347,,12.84,25690.02,stage1,moe_cktile2stages_gemm1_256x32x256x256_1x4_16x16x32_3perCU_1x32_HasBias_swiglu,0.0%
256,8,3072,1536,128,4,ActivationType.Swiglu,torch.bfloat16,torch.bfloat16,torch.float4_e2m1fn_x2,QuantType.per_1x32,1,0,32,0,,,,,,,149.9824,,6.04,12081.67,stage1,moe_cktile2stages_gemm1_256x32x256x256_1x4_16x16x32_4perCU_1x32_HasBias_swiglu,0.0%
256,8,3072,1536,128,4,ActivationType.Swiglu,torch.bfloat16,torch.bfloat16,torch.float4_e2m1fn_x2,QuantType.per_1x32,1,0,32,0,,,,,,,25.8317,,35.07,70147.83,stage2,moe_cktile2stages_gemm2_256x32x256x256_1x4_16x16x32_2perCU_1x32_MulRoutedWeight_HasBias,3.5%
256,8,3072,1536,128,4,ActivationType.Swiglu,torch.bfloat16,torch.bfloat16,torch.float4_e2m1fn_x2,QuantType.per_1x32,1,0,32,0,,,,,,,26.8767,,33.71,67420.39,stage2,moe_cktile2stages_gemm2_256x32x256x256_1x4_16x16x32_1perCU_1x32_MulRoutedWeight_HasBias,3.4%
256,8,3072,1536,128,4,ActivationType.Swiglu,torch.bfloat16,torch.bfloat16,torch.float4_e2m1fn_x2,QuantType.per_1x32,1,0,32,0,,,,,,,42.7136,,21.21,42422.97,stage2,moe_cktile2stages_gemm2_256x32x256x256_1x4_16x16x32_3perCU_1x32_MulRoutedWeight_HasBias,3.5%
256,8,3072,1536,128,4,ActivationType.Swiglu,torch.bfloat16,torch.bfloat16,torch.float4_e2m1fn_x2,QuantType.per_1x32,1,0,32,0,,,,,,,85.9853,,10.54,21073.81,stage2,moe_cktile2stages_gemm2_256x32x256x256_1x4_16x16x32_4perCU_1x32_MulRoutedWeight_HasBias,3.5%
256,8,3072,1536,128,4,ActivationType.Swiglu,torch.bfloat16,torch.bfloat16,torch.float4_e2m1fn_x2,QuantType.per_1x32,1,0,64,0,,,,,,,58.5646,,15.47,30940.84,stage1,moe_cktile2stages_gemm1_256x64x256x256_1x4_16x16x32_1perCU_1x32_HasBias_swiglu,0.0%
256,8,3072,1536,128,4,ActivationType.Swiglu,torch.bfloat16,torch.bfloat16,torch.float4_e2m1fn_x2,QuantType.per_1x32,1,0,64,0,,,,,,,67.2105,,13.48,26960.63,stage1,moe_cktile2stages_gemm1_256x64x256x256_1x4_16x16x32_2perCU_1x32_HasBias_swiglu,0.0%
256,8,3072,1536,128,4,ActivationType.Swiglu,torch.bfloat16,torch.bfloat16,torch.float4_e2m1fn_x2,QuantType.per_1x32,1,0,64,0,,,,,,,58.6915,,15.44,30873.94,stage1,moe_cktile2stages_gemm1_256x64x256x256_1x4_16x16x32_3perCU_1x32_HasBias_swiglu,0.0%
256,8,3072,1536,128,4,ActivationType.Swiglu,torch.bfloat16,torch.bfloat16,torch.float4_e2m1fn_x2,QuantType.per_1x32,1,0,64,0,,,,,,,58.8819,,15.39,30774.1,stage1,moe_cktile2stages_gemm1_256x64x256x256_1x4_16x16x32_4perCU_1x32_HasBias_swiglu,0.0%
256,8,3072,1536,128,4,ActivationType.Swiglu,torch.bfloat16,torch.bfloat16,torch.float4_e2m1fn_x2,QuantType.per_1x32,1,0,64,0,,,,,,,40.4702,,22.39,44774.62,stage2,moe_cktile2stages_gemm2_256x64x256x256_1x4_16x16x32_1perCU_1x32_MulRoutedWeight_HasBias,3.5%
256,8,3072,1536,128,4,ActivationType.Swiglu,torch.bfloat16,torch.bfloat16,torch.float4_e2m1fn_x2,QuantType.per_1x32,1,0,64,0,,,,,,,40.3956,,22.43,44857.3,stage2,moe_cktile2stages_gemm2_256x64x256x256_1x4_16x16x32_2perCU_1x32_MulRoutedWeight_HasBias,3.5%
256,8,3072,1536,128,4,ActivationType.Swiglu,torch.bfloat16,torch.bfloat16,torch.float4_e2m1fn_x2,QuantType.per_1x32,1,0,64,0,,,,,,,41.0308,,22.08,44162.86,stage2,moe_cktile2stages_gemm2_256x64x256x256_1x4_16x16x32_3perCU_1x32_MulRoutedWeight_HasBias,3.5%
256,8,3072,1536,128,4,ActivationType.Swiglu,torch.bfloat16,torch.bfloat16,torch.float4_e2m1fn_x2,QuantType.per_1x32,1,0,64,0,,,,,,,40.5899,,22.32,44642.57,stage2,moe_cktile2stages_gemm2_256x64x256x256_1x4_16x16x32_4perCU_1x32_MulRoutedWeight_HasBias,3.5%
256,8,3072,3072,128,4,ActivationType.Swiglu,torch.bfloat16,torch.bfloat16,torch.float4_e2m1fn_x2,QuantType.per_1x32,1,0,32,0,,,,,,,-1.0,,0.0,0.0,stage1,flydsl_moe1_afp16_wfp4_bf16_t32x256x256,100.0%
256,8,3072,3072,128,4,ActivationType.Swiglu,torch.bfloat16,torch.bfloat16,torch.float4_e2m1fn_x2,QuantType.per_1x32,1,0,32,0,,,,,,,-1.0,,0.0,0.0,stage2,flydsl_moe2_afp16_wfp4_bf16_t32x128x256_atomic,100.0%
256,8,3072,3072,128,4,ActivationType.Swiglu,torch.bfloat16,torch.bfloat16,torch.float4_e2m1fn_x2,QuantType.per_1x32,1,0,32,0,,,,,,,-1.0,,0.0,0.0,stage2,flydsl_moe2_afp16_wfp4_bf16_t32x128x256_reduce,100.0%
256,8,3072,3072,128,4,ActivationType.Swiglu,torch.bfloat16,torch.bfloat16,torch.float4_e2m1fn_x2,QuantType.per_1x32,1,0,32,0,,,,,,,-1.0,,0.0,0.0,stage2,flydsl_moe2_afp16_wfp4_bf16_t32x256x256_atomic,100.0%
256,8,3072,3072,128,4,ActivationType.Swiglu,torch.bfloat16,torch.bfloat16,torch.float4_e2m1fn_x2,QuantType.per_1x32,1,0,32,0,,,,,,,-1.0,,0.0,0.0,stage2,flydsl_moe2_afp16_wfp4_bf16_t32x256x256_reduce,100.0%
256,8,3072,3072,128,4,ActivationType.Swiglu,torch.bfloat16,torch.bfloat16,torch.float4_e2m1fn_x2,QuantType.per_1x32,1,0,64,0,,,,,,,-1.0,,0.0,0.0,stage1,flydsl_moe1_afp16_wfp4_bf16_t64x256x256,100.0%
256,8,3072,3072,128,4,ActivationType.Swiglu,torch.bfloat16,torch.bfloat16,torch.float4_e2m1fn_x2,QuantType.per_1x32,1,0,64,0,,,,,,,-1.0,,0.0,0.0,stage2,flydsl_moe2_afp16_wfp4_bf16_t64x128x256_atomic,100.0%
256,8,3072,3072,128,4,ActivationType.Swiglu,torch.bfloat16,torch.bfloat16,torch.float4_e2m1fn_x2,QuantType.per_1x32,1,0,64,0,,,,,,,-1.0,,0.0,0.0,stage2,flydsl_moe2_afp16_wfp4_bf16_t64x128x256_reduce,100.0%
256,8,3072,3072,128,4,ActivationType.Swiglu,torch.bfloat16,torch.bfloat16,torch.float4_e2m1fn_x2,QuantType.per_1x32,1,0,64,0,,,,,,,-1.0,,0.0,0.0,stage2,flydsl_moe2_afp16_wfp4_bf16_t64x256x256_atomic,100.0%
256,8,3072,3072,128,4,ActivationType.Swiglu,torch.bfloat16,torch.bfloat16,torch.float4_e2m1fn_x2,QuantType.per_1x32,1,0,64,0,,,,,,,-1.0,,0.0,0.0,stage2,flydsl_moe2_afp16_wfp4_bf16_t64x256x256_reduce,100.0%
256,8,3072,3072,128,4,ActivationType.Swiglu,torch.bfloat16,torch.bfloat16,torch.float4_e2m1fn_x2,QuantType.per_1x32,1,0,128,0,,,,,,,-1.0,,0.0,0.0,stage2,flydsl_moe2_afp16_wfp4_bf16_t128x128x256_atomic,100.0%
256,8,3072,3072,128,4,ActivationType.Swiglu,torch.bfloat16,torch.bfloat16,torch.float4_e2m1fn_x2,QuantType.per_1x32,1,0,128,0,,,,,,,-1.0,,0.0,0.0,stage2,flydsl_moe2_afp16_wfp4_bf16_t128x128x256_reduce,100.0%
256,8,3072,3072,128,4,ActivationType.Swiglu,torch.bfloat16,torch.bfloat16,torch.float4_e2m1fn_x2,QuantType.per_1x32,1,0,128,0,,,,,,,-1.0,,0.0,0.0,stage2,flydsl_moe2_afp16_wfp4_bf16_t128x256x256_atomic,100.0%
256,8,3072,3072,128,4,ActivationType.Swiglu,torch.bfloat16,torch.bfloat16,torch.float4_e2m1fn_x2,QuantType.per_1x32,1,0,128,0,,,,,,,-1.0,,0.0,0.0,stage2,flydsl_moe2_afp16_wfp4_bf16_t128x256x256_reduce,100.0%
256,8,3072,3072,128,4,ActivationType.Swiglu,torch.bfloat16,torch.bfloat16,torch.float4_e2m1fn_x2,QuantType.per_1x32,1,0,32,0,,,,,,,58.7122,,30.86,61724.43,stage1,moe_cktile2stages_gemm1_256x32x256x256_1x4_16x16x32_2perCU_1x32_HasBias_swiglu,0.0%
256,8,3072,3072,128,4,ActivationType.Swiglu,torch.bfloat16,torch.bfloat16,torch.float4_e2m1fn_x2,QuantType.per_1x32,1,0,32,0,,,,,,,57.9578,,31.26,62527.86,stage1,moe_cktile2stages_gemm1_256x32x256x256_1x4_16x16x32_1perCU_1x32_HasBias_swiglu,0.0%
256,8,3072,3072,128,4,ActivationType.Swiglu,torch.bfloat16,torch.bfloat16,torch.float4_e2m1fn_x2,QuantType.per_1x32,1,0,32,0,,,,,,,96.5625,,18.76,37529.86,stage1,moe_cktile2stages_gemm1_256x32x256x256_1x4_16x16x32_3perCU_1x32_HasBias_swiglu,0.0%
256,8,3072,3072,128,4,ActivationType.Swiglu,torch.bfloat16,torch.bfloat16,torch.float4_e2m1fn_x2,QuantType.per_1x32,1,0,32,0,,,,,,,214.3094,,8.45,16910.02,stage1,moe_cktile2stages_gemm1_256x32x256x256_1x4_16x16x32_4perCU_1x32_HasBias_swiglu,0.0%
256,8,3072,3072,128,4,ActivationType.Swiglu,torch.bfloat16,torch.bfloat16,torch.float4_e2m1fn_x2,QuantType.per_1x32,1,0,32,0,,,,,,,41.5932,,43.56,87129.07,stage2,moe_cktile2stages_gemm2_256x32x256x256_1x4_16x16x32_2perCU_1x32_MulRoutedWeight_HasBias,4.8%
256,8,3072,3072,128,4,ActivationType.Swiglu,torch.bfloat16,torch.bfloat16,torch.float4_e2m1fn_x2,QuantType.per_1x32,1,0,32,0,,,,,,,41.4371,,43.73,87457.3,stage2,moe_cktile2stages_gemm2_256x32x256x256_1x4_16x16x32_1perCU_1x32_MulRoutedWeight_HasBias,4.7%
256,8,3072,3072,128,4,ActivationType.Swiglu,torch.bfloat16,torch.bfloat16,torch.float4_e2m1fn_x2,QuantType.per_1x32,1,0,32,0,,,,,,,74.5121,,24.32,48636.09,stage2,moe_cktile2stages_gemm2_256x32x256x256_1x4_16x16x32_3perCU_1x32_MulRoutedWeight_HasBias,4.7%
256,8,3072,3072,128,4,ActivationType.Swiglu,torch.bfloat16,torch.bfloat16,torch.float4_e2m1fn_x2,QuantType.per_1x32,1,0,32,0,,,,,,,159.4062,,11.37,22734.23,stage2,moe_cktile2stages_gemm2_256x32x256x256_1x4_16x16x32_4perCU_1x32_MulRoutedWeight_HasBias,4.8%
256,8,3072,3072,128,4,ActivationType.Swiglu,torch.bfloat16,torch.bfloat16,torch.float4_e2m1fn_x2,QuantType.per_1x32,1,0,64,0,,,,,,,88.4037,,20.5,40993.5,stage1,moe_cktile2stages_gemm1_256x64x256x256_1x4_16x16x32_1perCU_1x32_HasBias_swiglu,0.0%
256,8,3072,3072,128,4,ActivationType.Swiglu,torch.bfloat16,torch.bfloat16,torch.float4_e2m1fn_x2,QuantType.per_1x32,1,0,64,0,,,,,,,111.2646,,16.28,32570.8,stage1,moe_cktile2stages_gemm1_256x64x256x256_1x4_16x16x32_2perCU_1x32_HasBias_swiglu,0.0%
256,8,3072,3072,128,4,ActivationType.Swiglu,torch.bfloat16,torch.bfloat16,torch.float4_e2m1fn_x2,QuantType.per_1x32,1,0,64,0,,,,,,,88.378,,20.5,41005.42,stage1,moe_cktile2stages_gemm1_256x64x256x256_1x4_16x16x32_3perCU_1x32_HasBias_swiglu,0.0%
256,8,3072,3072,128,4,ActivationType.Swiglu,torch.bfloat16,torch.bfloat16,torch.float4_e2m1fn_x2,QuantType.per_1x32,1,0,64,0,,,,,,,88.2001,,20.54,41088.13,stage1,moe_cktile2stages_gemm1_256x64x256x256_1x4_16x16x32_4perCU_1x32_HasBias_swiglu,0.0%
256,8,3072,3072,128,4,ActivationType.Swiglu,torch.bfloat16,torch.bfloat16,torch.float4_e2m1fn_x2,QuantType.per_1x32,1,0,64,0,,,,,,,62.3009,,29.08,58168.93,stage2,moe_cktile2stages_gemm2_256x64x256x256_1x4_16x16x32_1perCU_1x32_MulRoutedWeight_HasBias,4.8%
256,8,3072,3072,128,4,ActivationType.Swiglu,torch.bfloat16,torch.bfloat16,torch.float4_e2m1fn_x2,QuantType.per_1x32,1,0,64,0,,,,,,,66.645,,27.19,54377.33,stage2,moe_cktile2stages_gemm2_256x64x256x256_1x4_16x16x32_2perCU_1x32_MulRoutedWeight_HasBias,4.8%
256,8,3072,3072,128,4,ActivationType.Swiglu,torch.bfloat16,torch.bfloat16,torch.float4_e2m1fn_x2,QuantType.per_1x32,1,0,64,0,,,,,,,62.8991,,28.81,57615.72,stage2,moe_cktile2stages_gemm2_256x64x256x256_1x4_16x16x32_3perCU_1x32_MulRoutedWeight_HasBias,4.8%
256,8,3072,3072,128,4,ActivationType.Swiglu,torch.bfloat16,torch.bfloat16,torch.float4_e2m1fn_x2,QuantType.per_1x32,1,0,64,0,,,,,,,61.4498,,29.49,58974.59,stage2,moe_cktile2stages_gemm2_256x64x256x256_1x4_16x16x32_4perCU_1x32_MulRoutedWeight_HasBias,4.7%
256,16,3072,512,128,4,ActivationType.Swiglu,torch.bfloat16,torch.bfloat16,torch.float4_e2m1fn_x2,QuantType.per_1x32,1,0,32,0,,,,,,,-1.0,,0.0,0.0,stage1,flydsl_moe1_afp16_wfp4_bf16_t32x256x256,100.0%
256,16,3072,512,128,4,ActivationType.Swiglu,torch.bfloat16,torch.bfloat16,torch.float4_e2m1fn_x2,QuantType.per_1x32,1,0,32,0,,,,,,,-1.0,,0.0,0.0,stage2,flydsl_moe2_afp16_wfp4_bf16_t32x128x256_atomic,100.0%
256,16,3072,512,128,4,ActivationType.Swiglu,torch.bfloat16,torch.bfloat16,torch.float4_e2m1fn_x2,QuantType.per_1x32,1,0,32,0,,,,,,,-1.0,,0.0,0.0,stage2,flydsl_moe2_afp16_wfp4_bf16_t32x128x256_reduce,100.0%
256,16,3072,512,128,4,ActivationType.Swiglu,torch.bfloat16,torch.bfloat16,torch.float4_e2m1fn_x2,QuantType.per_1x32,1,0,32,0,,,,,,,-1.0,,0.0,0.0,stage2,flydsl_moe2_afp16_wfp4_bf16_t32x256x256_atomic,100.0%
256,16,3072,512,128,4,ActivationType.Swiglu,torch.bfloat16,torch.bfloat16,torch.float4_e2m1fn_x2,QuantType.per_1x32,1,0,32,0,,,,,,,-1.0,,0.0,0.0,stage2,flydsl_moe2_afp16_wfp4_bf16_t32x256x256_reduce,100.0%
256,16,3072,512,128,4,ActivationType.Swiglu,torch.bfloat16,torch.bfloat16,torch.float4_e2m1fn_x2,QuantType.per_1x32,1,0,64,0,,,,,,,-1.0,,0.0,0.0,stage1,flydsl_moe1_afp16_wfp4_bf16_t64x256x256,100.0%
256,16,3072,512,128,4,ActivationType.Swiglu,torch.bfloat16,torch.bfloat16,torch.float4_e2m1fn_x2,QuantType.per_1x32,1,0,64,0,,,,,,,-1.0,,0.0,0.0,stage2,flydsl_moe2_afp16_wfp4_bf16_t64x128x256_atomic,100.0%
256,16,3072,512,128,4,ActivationType.Swiglu,torch.bfloat16,torch.bfloat16,torch.float4_e2m1fn_x2,QuantType.per_1x32,1,0,64,0,,,,,,,-1.0,,0.0,0.0,stage2,flydsl_moe2_afp16_wfp4_bf16_t64x128x256_reduce,100.0%
256,16,3072,512,128,4,ActivationType.Swiglu,torch.bfloat16,torch.bfloat16,torch.float4_e2m1fn_x2,QuantType.per_1x32,1,0,64,0,,,,,,,-1.0,,0.0,0.0,stage2,flydsl_moe2_afp16_wfp4_bf16_t64x256x256_atomic,100.0%
256,16,3072,512,128,4,ActivationType.Swiglu,torch.bfloat16,torch.bfloat16,torch.float4_e2m1fn_x2,QuantType.per_1x32,1,0,64,0,,,,,,,-1.0,,0.0,0.0,stage2,flydsl_moe2_afp16_wfp4_bf16_t64x256x256_reduce,100.0%
256,16,3072,512,128,4,ActivationType.Swiglu,torch.bfloat16,torch.bfloat16,torch.float4_e2m1fn_x2,QuantType.per_1x32,1,0,128,0,,,,,,,-1.0,,0.0,0.0,stage2,flydsl_moe2_afp16_wfp4_bf16_t128x128x256_atomic,100.0%
256,16,3072,512,128,4,ActivationType.Swiglu,torch.bfloat16,torch.bfloat16,torch.float4_e2m1fn_x2,QuantType.per_1x32,1,0,128,0,,,,,,,-1.0,,0.0,0.0,stage2,flydsl_moe2_afp16_wfp4_bf16_t128x128x256_reduce,100.0%
256,16,3072,512,128,4,ActivationType.Swiglu,torch.bfloat16,torch.bfloat16,torch.float4_e2m1fn_x2,QuantType.per_1x32,1,0,128,0,,,,,,,-1.0,,0.0,0.0,stage2,flydsl_moe2_afp16_wfp4_bf16_t128x256x256_atomic,100.0%
256,16,3072,512,128,4,ActivationType.Swiglu,torch.bfloat16,torch.bfloat16,torch.float4_e2m1fn_x2,QuantType.per_1x32,1,0,128,0,,,,,,,-1.0,,0.0,0.0,stage2,flydsl_moe2_afp16_wfp4_bf16_t128x256x256_reduce,100.0%
256,16,3072,512,128,4,ActivationType.Swiglu,torch.bfloat16,torch.bfloat16,torch.float4_e2m1fn_x2,QuantType.per_1x32,1,0,32,0,,,,,,,24.8585,,24.3,24304.62,stage1,moe_cktile2stages_gemm1_256x32x256x256_1x4_16x16x32_2perCU_1x32_HasBias_swiglu,0.0%
256,16,3072,512,128,4,ActivationType.Swiglu,torch.bfloat16,torch.bfloat16,torch.float4_e2m1fn_x2,QuantType.per_1x32,1,0,32,0,,,,,,,25.0329,,24.13,24135.29,stage1,moe_cktile2stages_gemm1_256x32x256x256_1x4_16x16x32_1perCU_1x32_HasBias_swiglu,0.0%
256,16,3072,512,128,4,ActivationType.Swiglu,torch.bfloat16,torch.bfloat16,torch.float4_e2m1fn_x2,QuantType.per_1x32,1,0,32,0,,,,,,,54.7264,,11.04,11039.94,stage1,moe_cktile2stages_gemm1_256x32x256x256_1x4_16x16x32_3perCU_1x32_HasBias_swiglu,0.0%
256,16,3072,512,128,4,ActivationType.Swiglu,torch.bfloat16,torch.bfloat16,torch.float4_e2m1fn_x2,QuantType.per_1x32,1,0,32,0,,,,,,,100.5339,,6.01,6009.68,stage1,moe_cktile2stages_gemm1_256x32x256x256_1x4_16x16x32_4perCU_1x32_HasBias_swiglu,0.0%
256,16,3072,512,128,4,ActivationType.Swiglu,torch.bfloat16,torch.bfloat16,torch.float4_e2m1fn_x2,QuantType.per_1x32,1,0,32,0,,,,,,,21.4821,,28.12,28124.64,stage2,moe_cktile2stages_gemm2_256x32x256x256_1x4_16x16x32_2perCU_1x32_MulRoutedWeight_HasBias,1.5%
256,16,3072,512,128,4,ActivationType.Swiglu,torch.bfloat16,torch.bfloat16,torch.float4_e2m1fn_x2,QuantType.per_1x32,1,0,32,0,,,,,,,21.3628,,28.27,28281.7,stage2,moe_cktile2stages_gemm2_256x32x256x256_1x4_16x16x32_1perCU_1x32_MulRoutedWeight_HasBias,1.5%
256,16,3072,512,128,4,ActivationType.Swiglu,torch.bfloat16,torch.bfloat16,torch.float4_e2m1fn_x2,QuantType.per_1x32,1,0,32,0,,,,,,,23.422,,25.79,25795.25,stage2,moe_cktile2stages_gemm2_256x32x256x256_1x4_16x16x32_3perCU_1x32_MulRoutedWeight_HasBias,1.6%
256,16,3072,512,128,4,ActivationType.Swiglu,torch.bfloat16,torch.bfloat16,torch.float4_e2m1fn_x2,QuantType.per_1x32,1,0,32,0,,,,,,,44.3496,,13.62,13623.04,stage2,moe_cktile2stages_gemm2_256x32x256x256_1x4_16x16x32_4perCU_1x32_MulRoutedWeight_HasBias,1.5%
256,16,3072,512,128,4,ActivationType.Swiglu,torch.bfloat16,torch.bfloat16,torch.float4_e2m1fn_x2,QuantType.per_1x32,1,0,64,0,,,,,,,33.5296,,18.01,18019.19,stage1,moe_cktile2stages_gemm1_256x64x256x256_1x4_16x16x32_1perCU_1x32_HasBias_swiglu,0.0%
256,16,3072,512,128,4,ActivationType.Swiglu,torch.bfloat16,torch.bfloat16,torch.float4_e2m1fn_x2,QuantType.per_1x32,1,0,64,0,,,,,,,49.0064,,12.32,12328.52,stage1,moe_cktile2stages_gemm1_256x64x256x256_1x4_16x16x32_2perCU_1x32_HasBias_swiglu,0.0%
256,16,3072,512,128,4,ActivationType.Swiglu,torch.bfloat16,torch.bfloat16,torch.float4_e2m1fn_x2,QuantType.per_1x32,1,0,64,0,,,,,,,33.6785,,17.93,17939.53,stage1,moe_cktile2stages_gemm1_256x64x256x256_1x4_16x16x32_3perCU_1x32_HasBias_swiglu,0.0%
256,16,3072,512,128,4,ActivationType.Swiglu,torch.bfloat16,torch.bfloat16,torch.float4_e2m1fn_x2,QuantType.per_1x32,1,0,64,0,,,,,,,33.559,,18.0,18003.41,stage1,moe_cktile2stages_gemm1_256x64x256x256_1x4_16x16x32_4perCU_1x32_HasBias_swiglu,0.0%
256,16,3072,512,128,4,ActivationType.Swiglu,torch.bfloat16,torch.bfloat16,torch.float4_e2m1fn_x2,QuantType.per_1x32,1,0,64,0,,,,,,,33.8061,,17.87,17871.82,stage2,moe_cktile2stages_gemm2_256x64x256x256_1x4_16x16x32_1perCU_1x32_MulRoutedWeight_HasBias,1.5%
256,16,3072,512,128,4,ActivationType.Swiglu,torch.bfloat16,torch.bfloat16,torch.float4_e2m1fn_x2,QuantType.per_1x32,1,0,64,0,,,,,,,27.2475,,22.17,22173.64,stage2,moe_cktile2stages_gemm2_256x64x256x256_1x4_16x16x32_2perCU_1x32_MulRoutedWeight_HasBias,1.5%
256,16,3072,512,128,4,ActivationType.Swiglu,torch.bfloat16,torch.bfloat16,torch.float4_e2m1fn_x2,QuantType.per_1x32,1,0,64,0,,,,,,,34.9805,,17.27,17271.81,stage2,moe_cktile2stages_gemm2_256x64x256x256_1x4_16x16x32_3perCU_1x32_MulRoutedWeight_HasBias,1.5%
256,16,3072,512,128,4,ActivationType.Swiglu,torch.bfloat16,torch.bfloat16,torch.float4_e2m1fn_x2,QuantType.per_1x32,1,0,64,0,,,,,,,35.0364,,17.24,17244.25,stage2,moe_cktile2stages_gemm2_256x64x256x256_1x4_16x16x32_4perCU_1x32_MulRoutedWeight_HasBias,1.5%
256,16,3072,1536,128,4,ActivationType.Swiglu,torch.bfloat16,torch.bfloat16,torch.float4_e2m1fn_x2,QuantType.per_1x32,1,0,32,0,,,,,,,-1.0,,0.0,0.0,stage1,flydsl_moe1_afp16_wfp4_bf16_t32x256x256,100.0%
256,16,3072,1536,128,4,ActivationType.Swiglu,torch.bfloat16,torch.bfloat16,torch.float4_e2m1fn_x2,QuantType.per_1x32,1,0,32,0,,,,,,,-1.0,,0.0,0.0,stage2,flydsl_moe2_afp16_wfp4_bf16_t32x128x256_atomic,100.0%
256,16,3072,1536,128,4,ActivationType.Swiglu,torch.bfloat16,torch.bfloat16,torch.float4_e2m1fn_x2,QuantType.per_1x32,1,0,32,0,,,,,,,-1.0,,0.0,0.0,stage2,flydsl_moe2_afp16_wfp4_bf16_t32x128x256_reduce,100.0%
256,16,3072,1536,128,4,ActivationType.Swiglu,torch.bfloat16,torch.bfloat16,torch.float4_e2m1fn_x2,QuantType.per_1x32,1,0,32,0,,,,,,,-1.0,,0.0,0.0,stage2,flydsl_moe2_afp16_wfp4_bf16_t32x256x256_atomic,100.0%
256,16,3072,1536,128,4,ActivationType.Swiglu,torch.bfloat16,torch.bfloat16,torch.float4_e2m1fn_x2,QuantType.per_1x32,1,0,32,0,,,,,,,-1.0,,0.0,0.0,stage2,flydsl_moe2_afp16_wfp4_bf16_t32x256x256_reduce,100.0%
256,16,3072,1536,128,4,ActivationType.Swiglu,torch.bfloat16,torch.bfloat16,torch.float4_e2m1fn_x2,QuantType.per_1x32,1,0,64,0,,,,,,,-1.0,,0.0,0.0,stage1,flydsl_moe1_afp16_wfp4_bf16_t64x256x256,100.0%
256,16,3072,1536,128,4,ActivationType.Swiglu,torch.bfloat16,torch.bfloat16,torch.float4_e2m1fn_x2,QuantType.per_1x32,1,0,64,0,,,,,,,-1.0,,0.0,0.0,stage2,flydsl_moe2_afp16_wfp4_bf16_t64x128x256_atomic,100.0%
256,16,3072,1536,128,4,ActivationType.Swiglu,torch.bfloat16,torch.bfloat16,torch.float4_e2m1fn_x2,QuantType.per_1x32,1,0,64,0,,,,,,,-1.0,,0.0,0.0,stage2,flydsl_moe2_afp16_wfp4_bf16_t64x128x256_reduce,100.0%
256,16,3072,1536,128,4,ActivationType.Swiglu,torch.bfloat16,torch.bfloat16,torch.float4_e2m1fn_x2,QuantType.per_1x32,1,0,64,0,,,,,,,-1.0,,0.0,0.0,stage2,flydsl_moe2_afp16_wfp4_bf16_t64x256x256_atomic,100.0%
256,16,3072,1536,128,4,ActivationType.Swiglu,torch.bfloat16,torch.bfloat16,torch.float4_e2m1fn_x2,QuantType.per_1x32,1,0,64,0,,,,,,,-1.0,,0.0,0.0,stage2,flydsl_moe2_afp16_wfp4_bf16_t64x256x256_reduce,100.0%
256,16,3072,1536,128,4,ActivationType.Swiglu,torch.bfloat16,torch.bfloat16,torch.float4_e2m1fn_x2,QuantType.per_1x32,1,0,128,0,,,,,,,-1.0,,0.0,0.0,stage2,flydsl_moe2_afp16_wfp4_bf16_t128x128x256_atomic,100.0%
256,16,3072,1536,128,4,ActivationType.Swiglu,torch.bfloat16,torch.bfloat16,torch.float4_e2m1fn_x2,QuantType.per_1x32,1,0,128,0,,,,,,,-1.0,,0.0,0.0,stage2,flydsl_moe2_afp16_wfp4_bf16_t128x128x256_reduce,100.0%
256,16,3072,1536,128,4,ActivationType.Swiglu,torch.bfloat16,torch.bfloat16,torch.float4_e2m1fn_x2,QuantType.per_1x32,1,0,128,0,,,,,,,-1.0,,0.0,0.0,stage2,flydsl_moe2_afp16_wfp4_bf16_t128x256x256_atomic,100.0%
256,16,3072,1536,128,4,ActivationType.Swiglu,torch.bfloat16,torch.bfloat16,torch.float4_e2m1fn_x2,QuantType.per_1x32,1,0,128,0,,,,,,,-1.0,,0.0,0.0,stage2,flydsl_moe2_afp16_wfp4_bf16_t128x256x256_reduce,100.0%
256,16,3072,1536,128,4,ActivationType.Swiglu,torch.bfloat16,torch.bfloat16,torch.float4_e2m1fn_x2,QuantType.per_1x32,1,0,32,0,,,,,,,56.1759,,32.25,32258.24,stage1,moe_cktile2stages_gemm1_256x32x256x256_1x4_16x16x32_2perCU_1x32_HasBias_swiglu,0.0%
256,16,3072,1536,128,4,ActivationType.Swiglu,torch.bfloat16,torch.bfloat16,torch.float4_e2m1fn_x2,QuantType.per_1x32,1,0,32,0,,,,,,,56.9672,,31.81,31810.16,stage1,moe_cktile2stages_gemm1_256x32x256x256_1x4_16x16x32_1perCU_1x32_HasBias_swiglu,0.0%
256,16,3072,1536,128,4,ActivationType.Swiglu,torch.bfloat16,torch.bfloat16,torch.float4_e2m1fn_x2,QuantType.per_1x32,1,0,32,0,,,,,,,89.2776,,20.3,20297.77,stage1,moe_cktile2stages_gemm1_256x32x256x256_1x4_16x16x32_3perCU_1x32_HasBias_swiglu,0.0%
256,16,3072,1536,128,4,ActivationType.Swiglu,torch.bfloat16,torch.bfloat16,torch.float4_e2m1fn_x2,QuantType.per_1x32,1,0,32,0,,,,,,,202.9013,,8.93,8931.12,stage1,moe_cktile2stages_gemm1_256x32x256x256_1x4_16x16x32_4perCU_1x32_HasBias_swiglu,0.0%
256,16,3072,1536,128,4,ActivationType.Swiglu,torch.bfloat16,torch.bfloat16,torch.float4_e2m1fn_x2,QuantType.per_1x32,1,0,32,0,,,,,,,38.74,,46.77,46776.87,stage2,moe_cktile2stages_gemm2_256x32x256x256_1x4_16x16x32_2perCU_1x32_MulRoutedWeight_HasBias,3.6%
256,16,3072,1536,128,4,ActivationType.Swiglu,torch.bfloat16,torch.bfloat16,torch.float4_e2m1fn_x2,QuantType.per_1x32,1,0,32,0,,,,,,,38.2648,,47.35,47357.78,stage2,moe_cktile2stages_gemm2_256x32x256x256_1x4_16x16x32_1perCU_1x32_MulRoutedWeight_HasBias,3.5%
256,16,3072,1536,128,4,ActivationType.Swiglu,torch.bfloat16,torch.bfloat16,torch.float4_e2m1fn_x2,QuantType.per_1x32,1,0,32,0,,,,,,,54.28,,33.38,33384.97,stage2,moe_cktile2stages_gemm2_256x32x256x256_1x4_16x16x32_3perCU_1x32_MulRoutedWeight_HasBias,3.5%
256,16,3072,1536,128,4,ActivationType.Swiglu,torch.bfloat16,torch.bfloat16,torch.float4_e2m1fn_x2,QuantType.per_1x32,1,0,32,0,,,,,,,112.5043,,16.11,16107.26,stage2,moe_cktile2stages_gemm2_256x32x256x256_1x4_16x16x32_4perCU_1x32_MulRoutedWeight_HasBias,3.6%
256,16,3072,1536,128,4,ActivationType.Swiglu,torch.bfloat16,torch.bfloat16,torch.float4_e2m1fn_x2,QuantType.per_1x32,1,0,64,0,,,,,,,85.258,,21.25,21254.73,stage1,moe_cktile2stages_gemm1_256x64x256x256_1x4_16x16x32_1perCU_1x32_HasBias_swiglu,0.0%
256,16,3072,1536,128,4,ActivationType.Swiglu,torch.bfloat16,torch.bfloat16,torch.float4_e2m1fn_x2,QuantType.per_1x32,1,0,64,0,,,,,,,107.5985,,16.84,16841.65,stage1,moe_cktile2stages_gemm1_256x64x256x256_1x4_16x16x32_2perCU_1x32_HasBias_swiglu,0.0%
256,16,3072,1536,128,4,ActivationType.Swiglu,torch.bfloat16,torch.bfloat16,torch.float4_e2m1fn_x2,QuantType.per_1x32,1,0,64,0,,,,,,,86.0172,,21.06,21067.13,stage1,moe_cktile2stages_gemm1_256x64x256x256_1x4_16x16x32_3perCU_1x32_HasBias_swiglu,0.0%
256,16,3072,1536,128,4,ActivationType.Swiglu,torch.bfloat16,torch.bfloat16,torch.float4_e2m1fn_x2,QuantType.per_1x32,1,0,64,0,,,,,,,85.1168,,21.29,21289.99,stage1,moe_cktile2stages_gemm1_256x64x256x256_1x4_16x16x32_4perCU_1x32_HasBias_swiglu,0.0%
256,16,3072,1536,128,4,ActivationType.Swiglu,torch.bfloat16,torch.bfloat16,torch.float4_e2m1fn_x2,QuantType.per_1x32,1,0,64,0,,,,,,,57.7217,,31.39,31394.36,stage2,moe_cktile2stages_gemm2_256x64x256x256_1x4_16x16x32_1perCU_1x32_MulRoutedWeight_HasBias,3.5%
256,16,3072,1536,128,4,ActivationType.Swiglu,torch.bfloat16,torch.bfloat16,torch.float4_e2m1fn_x2,QuantType.per_1x32,1,0,64,0,,,,,,,62.2777,,29.09,29097.67,stage2,moe_cktile2stages_gemm2_256x64x256x256_1x4_16x16x32_2perCU_1x32_MulRoutedWeight_HasBias,3.6%
256,16,3072,1536,128,4,ActivationType.Swiglu,torch.bfloat16,torch.bfloat16,torch.float4_e2m1fn_x2,QuantType.per_1x32,1,0,64,0,,,,,,,57.2585,,31.64,31648.33,stage2,moe_cktile2stages_gemm2_256x64x256x256_1x4_16x16x32_3perCU_1x32_MulRoutedWeight_HasBias,3.5%
256,16,3072,1536,128,4,ActivationType.Swiglu,torch.bfloat16,torch.bfloat16,torch.float4_e2m1fn_x2,QuantType.per_1x32,1,0,64,0,,,,,,,57.9375,,31.27,31277.43,stage2,moe_cktile2stages_gemm2_256x64x256x256_1x4_16x16x32_4perCU_1x32_MulRoutedWeight_HasBias,3.5%
256,16,3072,3072,128,4,ActivationType.Swiglu,torch.bfloat16,torch.bfloat16,torch.float4_e2m1fn_x2,QuantType.per_1x32,1,0,32,0,,,,,,,-1.0,,0.0,0.0,stage1,flydsl_moe1_afp16_wfp4_bf16_t32x256x256,100.0%
256,16,3072,3072,128,4,ActivationType.Swiglu,torch.bfloat16,torch.bfloat16,torch.float4_e2m1fn_x2,QuantType.per_1x32,1,0,32,0,,,,,,,-1.0,,0.0,0.0,stage2,flydsl_moe2_afp16_wfp4_bf16_t32x128x256_atomic,100.0%
256,16,3072,3072,128,4,ActivationType.Swiglu,torch.bfloat16,torch.bfloat16,torch.float4_e2m1fn_x2,QuantType.per_1x32,1,0,32,0,,,,,,,-1.0,,0.0,0.0,stage2,flydsl_moe2_afp16_wfp4_bf16_t32x128x256_reduce,100.0%
256,16,3072,3072,128,4,ActivationType.Swiglu,torch.bfloat16,torch.bfloat16,torch.float4_e2m1fn_x2,QuantType.per_1x32,1,0,32,0,,,,,,,-1.0,,0.0,0.0,stage2,flydsl_moe2_afp16_wfp4_bf16_t32x256x256_atomic,100.0%
256,16,3072,3072,128,4,ActivationType.Swiglu,torch.bfloat16,torch.bfloat16,torch.float4_e2m1fn_x2,QuantType.per_1x32,1,0,32,0,,,,,,,-1.0,,0.0,0.0,stage2,flydsl_moe2_afp16_wfp4_bf16_t32x256x256_reduce,100.0%
256,16,3072,3072,128,4,ActivationType.Swiglu,torch.bfloat16,torch.bfloat16,torch.float4_e2m1fn_x2,QuantType.per_1x32,1,0,64,0,,,,,,,-1.0,,0.0,0.0,stage1,flydsl_moe1_afp16_wfp4_bf16_t64x256x256,100.0%
256,16,3072,3072,128,4,ActivationType.Swiglu,torch.bfloat16,torch.bfloat16,torch.float4_e2m1fn_x2,QuantType.per_1x32,1,0,64,0,,,,,,,-1.0,,0.0,0.0,stage2,flydsl_moe2_afp16_wfp4_bf16_t64x128x256_atomic,100.0%
256,16,3072,3072,128,4,ActivationType.Swiglu,torch.bfloat16,torch.bfloat16,torch.float4_e2m1fn_x2,QuantType.per_1x32,1,0,64,0,,,,,,,-1.0,,0.0,0.0,stage2,flydsl_moe2_afp16_wfp4_bf16_t64x128x256_reduce,100.0%
256,16,3072,3072,128,4,ActivationType.Swiglu,torch.bfloat16,torch.bfloat16,torch.float4_e2m1fn_x2,QuantType.per_1x32,1,0,64,0,,,,,,,-1.0,,0.0,0.0,stage2,flydsl_moe2_afp16_wfp4_bf16_t64x256x256_atomic,100.0%
256,16,3072,3072,128,4,ActivationType.Swiglu,torch.bfloat16,torch.bfloat16,torch.float4_e2m1fn_x2,QuantType.per_1x32,1,0,64,0,,,,,,,-1.0,,0.0,0.0,stage2,flydsl_moe2_afp16_wfp4_bf16_t64x256x256_reduce,100.0%
256,16,3072,3072,128,4,ActivationType.Swiglu,torch.bfloat16,torch.bfloat16,torch.float4_e2m1fn_x2,QuantType.per_1x32,1,0,128,0,,,,,,,-1.0,,0.0,0.0,stage2,flydsl_moe2_afp16_wfp4_bf16_t128x128x256_atomic,100.0%
256,16,3072,3072,128,4,ActivationType.Swiglu,torch.bfloat16,torch.bfloat16,torch.float4_e2m1fn_x2,QuantType.per_1x32,1,0,128,0,,,,,,,-1.0,,0.0,0.0,stage2,flydsl_moe2_afp16_wfp4_bf16_t128x128x256_reduce,100.0%
256,16,3072,3072,128,4,ActivationType.Swiglu,torch.bfloat16,torch.bfloat16,torch.float4_e2m1fn_x2,QuantType.per_1x32,1,0,128,0,,,,,,,-1.0,,0.0,0.0,stage2,flydsl_moe2_afp16_wfp4_bf16_t128x256x256_atomic,100.0%
256,16,3072,3072,128,4,ActivationType.Swiglu,torch.bfloat16,torch.bfloat16,torch.float4_e2m1fn_x2,QuantType.per_1x32,1,0,128,0,,,,,,,-1.0,,0.0,0.0,stage2,flydsl_moe2_afp16_wfp4_bf16_t128x256x256_reduce,100.0%
256,16,3072,3072,128,4,ActivationType.Swiglu,torch.bfloat16,torch.bfloat16,torch.float4_e2m1fn_x2,QuantType.per_1x32,1,0,32,0,,,,,,,93.1417,,38.91,38909.27,stage1,moe_cktile2stages_gemm1_256x32x256x256_1x4_16x16x32_2perCU_1x32_HasBias_swiglu,0.0%
256,16,3072,3072,128,4,ActivationType.Swiglu,torch.bfloat16,torch.bfloat16,torch.float4_e2m1fn_x2,QuantType.per_1x32,1,0,32,0,,,,,,,93.1447,,38.91,38908.01,stage1,moe_cktile2stages_gemm1_256x32x256x256_1x4_16x16x32_1perCU_1x32_HasBias_swiglu,0.0%
256,16,3072,3072,128,4,ActivationType.Swiglu,torch.bfloat16,torch.bfloat16,torch.float4_e2m1fn_x2,QuantType.per_1x32,1,0,32,0,,,,,,,166.0968,,21.82,21819.06,stage1,moe_cktile2stages_gemm1_256x32x256x256_1x4_16x16x32_3perCU_1x32_HasBias_swiglu,0.0%
256,16,3072,3072,128,4,ActivationType.Swiglu,torch.bfloat16,torch.bfloat16,torch.float4_e2m1fn_x2,QuantType.per_1x32,1,0,32,0,,,,,,,355.2296,,10.2,10202.06,stage1,moe_cktile2stages_gemm1_256x32x256x256_1x4_16x16x32_4perCU_1x32_HasBias_swiglu,0.0%
256,16,3072,3072,128,4,ActivationType.Swiglu,torch.bfloat16,torch.bfloat16,torch.float4_e2m1fn_x2,QuantType.per_1x32,1,0,32,0,,,,,,,60.0841,,60.31,60316.71,stage2,moe_cktile2stages_gemm2_256x32x256x256_1x4_16x16x32_2perCU_1x32_MulRoutedWeight_HasBias,5.1%
256,16,3072,3072,128,4,ActivationType.Swiglu,torch.bfloat16,torch.bfloat16,torch.float4_e2m1fn_x2,QuantType.per_1x32,1,0,32,0,,,,,,,60.6377,,59.76,59766.04,stage2,moe_cktile2stages_gemm2_256x32x256x256_1x4_16x16x32_1perCU_1x32_MulRoutedWeight_HasBias,5.1%
256,16,3072,3072,128,4,ActivationType.Swiglu,torch.bfloat16,torch.bfloat16,torch.float4_e2m1fn_x2,QuantType.per_1x32,1,0,32,0,,,,,,,90.5694,,40.01,40014.35,stage2,moe_cktile2stages_gemm2_256x32x256x256_1x4_16x16x32_3perCU_1x32_MulRoutedWeight_HasBias,4.8%
256,16,3072,3072,128,4,ActivationType.Swiglu,torch.bfloat16,torch.bfloat16,torch.float4_e2m1fn_x2,QuantType.per_1x32,1,0,32,0,,,,,,,206.4104,,17.56,17557.62,stage2,moe_cktile2stages_gemm2_256x32x256x256_1x4_16x16x32_4perCU_1x32_MulRoutedWeight_HasBias,5.0%
256,16,3072,3072,128,4,ActivationType.Swiglu,torch.bfloat16,torch.bfloat16,torch.float4_e2m1fn_x2,QuantType.per_1x32,1,0,64,0,,,,,,,142.4993,,25.43,25432.23,stage1,moe_cktile2stages_gemm1_256x64x256x256_1x4_16x16x32_1perCU_1x32_HasBias_swiglu,0.0%
256,16,3072,3072,128,4,ActivationType.Swiglu,torch.bfloat16,torch.bfloat16,torch.float4_e2m1fn_x2,QuantType.per_1x32,1,0,64,0,,,,,,,172.3555,,21.03,21026.75,stage1,moe_cktile2stages_gemm1_256x64x256x256_1x4_16x16x32_2perCU_1x32_HasBias_swiglu,0.0%
256,16,3072,3072,128,4,ActivationType.Swiglu,torch.bfloat16,torch.bfloat16,torch.float4_e2m1fn_x2,QuantType.per_1x32,1,0,64,0,,,,,,,142.1769,,25.49,25489.9,stage1,moe_cktile2stages_gemm1_256x64x256x256_1x4_16x16x32_3perCU_1x32_HasBias_swiglu,0.0%
256,16,3072,3072,128,4,ActivationType.Swiglu,torch.bfloat16,torch.bfloat16,torch.float4_e2m1fn_x2,QuantType.per_1x32,1,0,64,0,,,,,,,141.6662,,25.58,25581.79,stage1,moe_cktile2stages_gemm1_256x64x256x256_1x4_16x16x32_4perCU_1x32_HasBias_swiglu,0.0%
256,16,3072,3072,128,4,ActivationType.Swiglu,torch.bfloat16,torch.bfloat16,torch.float4_e2m1fn_x2,QuantType.per_1x32,1,0,64,0,,,,,,,89.8976,,40.31,40313.37,stage2,moe_cktile2stages_gemm2_256x64x256x256_1x4_16x16x32_1perCU_1x32_MulRoutedWeight_HasBias,5.0%
256,16,3072,3072,128,4,ActivationType.Swiglu,torch.bfloat16,torch.bfloat16,torch.float4_e2m1fn_x2,QuantType.per_1x32,1,0,64,0,,,,,,,101.1271,,35.83,35836.84,stage2,moe_cktile2stages_gemm2_256x64x256x256_1x4_16x16x32_2perCU_1x32_MulRoutedWeight_HasBias,4.9%
256,16,3072,3072,128,4,ActivationType.Swiglu,torch.bfloat16,torch.bfloat16,torch.float4_e2m1fn_x2,QuantType.per_1x32,1,0,64,0,,,,,,,87.903,,41.23,41228.12,stage2,moe_cktile2stages_gemm2_256x64x256x256_1x4_16x16x32_3perCU_1x32_MulRoutedWeight_HasBias,5.0%
256,16,3072,3072,128,4,ActivationType.Swiglu,torch.bfloat16,torch.bfloat16,torch.float4_e2m1fn_x2,QuantType.per_1x32,1,0,64,0,,,,,,,89.2974,,40.58,40584.33,stage2,moe_cktile2stages_gemm2_256x64x256x256_1x4_16x16x32_4perCU_1x32_MulRoutedWeight_HasBias,5.0%
256,32,3072,512,128,4,ActivationType.Swiglu,torch.bfloat16,torch.bfloat16,torch.float4_e2m1fn_x2,QuantType.per_1x32,1,0,32,0,,,,,,,-1.0,,0.0,0.0,stage1,flydsl_moe1_afp16_wfp4_bf16_t32x256x256,100.0%
256,32,3072,512,128,4,ActivationType.Swiglu,torch.bfloat16,torch.bfloat16,torch.float4_e2m1fn_x2,QuantType.per_1x32,1,0,32,0,,,,,,,-1.0,,0.0,0.0,stage2,flydsl_moe2_afp16_wfp4_bf16_t32x128x256_atomic,100.0%
256,32,3072,512,128,4,ActivationType.Swiglu,torch.bfloat16,torch.bfloat16,torch.float4_e2m1fn_x2,QuantType.per_1x32,1,0,32,0,,,,,,,-1.0,,0.0,0.0,stage2,flydsl_moe2_afp16_wfp4_bf16_t32x128x256_reduce,100.0%
256,32,3072,512,128,4,ActivationType.Swiglu,torch.bfloat16,torch.bfloat16,torch.float4_e2m1fn_x2,QuantType.per_1x32,1,0,32,0,,,,,,,-1.0,,0.0,0.0,stage2,flydsl_moe2_afp16_wfp4_bf16_t32x256x256_atomic,100.0%
256,32,3072,512,128,4,ActivationType.Swiglu,torch.bfloat16,torch.bfloat16,torch.float4_e2m1fn_x2,QuantType.per_1x32,1,0,32,0,,,,,,,-1.0,,0.0,0.0,stage2,flydsl_moe2_afp16_wfp4_bf16_t32x256x256_reduce,100.0%
256,32,3072,512,128,4,ActivationType.Swiglu,torch.bfloat16,torch.bfloat16,torch.float4_e2m1fn_x2,QuantType.per_1x32,1,0,64,0,,,,,,,-1.0,,0.0,0.0,stage1,flydsl_moe1_afp16_wfp4_bf16_t64x256x256,100.0%
256,32,3072,512,128,4,ActivationType.Swiglu,torch.bfloat16,torch.bfloat16,torch.float4_e2m1fn_x2,QuantType.per_1x32,1,0,64,0,,,,,,,-1.0,,0.0,0.0,stage2,flydsl_moe2_afp16_wfp4_bf16_t64x128x256_atomic,100.0%
256,32,3072,512,128,4,ActivationType.Swiglu,torch.bfloat16,torch.bfloat16,torch.float4_e2m1fn_x2,QuantType.per_1x32,1,0,64,0,,,,,,,-1.0,,0.0,0.0,stage2,flydsl_moe2_afp16_wfp4_bf16_t64x128x256_reduce,100.0%
256,32,3072,512,128,4,ActivationType.Swiglu,torch.bfloat16,torch.bfloat16,torch.float4_e2m1fn_x2,QuantType.per_1x32,1,0,64,0,,,,,,,-1.0,,0.0,0.0,stage2,flydsl_moe2_afp16_wfp4_bf16_t64x256x256_atomic,100.0%
256,32,3072,512,128,4,ActivationType.Swiglu,torch.bfloat16,torch.bfloat16,torch.float4_e2m1fn_x2,QuantType.per_1x32,1,0,64,0,,,,,,,-1.0,,0.0,0.0,stage2,flydsl_moe2_afp16_wfp4_bf16_t64x256x256_reduce,100.0%
256,32,3072,512,128,4,ActivationType.Swiglu,torch.bfloat16,torch.bfloat16,torch.float4_e2m1fn_x2,QuantType.per_1x32,1,0,128,0,,,,,,,-1.0,,0.0,0.0,stage2,flydsl_moe2_afp16_wfp4_bf16_t128x128x256_atomic,100.0%
256,32,3072,512,128,4,ActivationType.Swiglu,torch.bfloat16,torch.bfloat16,torch.float4_e2m1fn_x2,QuantType.per_1x32,1,0,128,0,,,,,,,-1.0,,0.0,0.0,stage2,flydsl_moe2_afp16_wfp4_bf16_t128x128x256_reduce,100.0%
256,32,3072,512,128,4,ActivationType.Swiglu,torch.bfloat16,torch.bfloat16,torch.float4_e2m1fn_x2,QuantType.per_1x32,1,0,128,0,,,,,,,-1.0,,0.0,0.0,stage2,flydsl_moe2_afp16_wfp4_bf16_t128x256x256_atomic,100.0%
256,32,3072,512,128,4,ActivationType.Swiglu,torch.bfloat16,torch.bfloat16,torch.float4_e2m1fn_x2,QuantType.per_1x32,1,0,128,0,,,,,,,-1.0,,0.0,0.0,stage2,flydsl_moe2_afp16_wfp4_bf16_t128x256x256_reduce,100.0%
256,32,3072,512,128,4,ActivationType.Swiglu,torch.bfloat16,torch.bfloat16,torch.float4_e2m1fn_x2,QuantType.per_1x32,1,0,32,0,,,,,,,37.1769,,32.49,16256.68,stage1,moe_cktile2stages_gemm1_256x32x256x256_1x4_16x16x32_2perCU_1x32_HasBias_swiglu,0.0%
256,32,3072,512,128,4,ActivationType.Swiglu,torch.bfloat16,torch.bfloat16,torch.float4_e2m1fn_x2,QuantType.per_1x32,1,0,32,0,,,,,,,38.8698,,31.08,15548.65,stage1,moe_cktile2stages_gemm1_256x32x256x256_1x4_16x16x32_1perCU_1x32_HasBias_swiglu,0.0%
256,32,3072,512,128,4,ActivationType.Swiglu,torch.bfloat16,torch.bfloat16,torch.float4_e2m1fn_x2,QuantType.per_1x32,1,0,32,0,,,,,,,71.7724,,16.83,8420.69,stage1,moe_cktile2stages_gemm1_256x32x256x256_1x4_16x16x32_3perCU_1x32_HasBias_swiglu,0.0%
256,32,3072,512,128,4,ActivationType.Swiglu,torch.bfloat16,torch.bfloat16,torch.float4_e2m1fn_x2,QuantType.per_1x32,1,0,32,0,,,,,,,155.1487,,7.79,3895.44,stage1,moe_cktile2stages_gemm1_256x32x256x256_1x4_16x16x32_4perCU_1x32_HasBias_swiglu,0.0%
256,32,3072,512,128,4,ActivationType.Swiglu,torch.bfloat16,torch.bfloat16,torch.float4_e2m1fn_x2,QuantType.per_1x32,1,0,32,0,,,,,,,30.8747,,39.12,19575.02,stage2,moe_cktile2stages_gemm2_256x32x256x256_1x4_16x16x32_2perCU_1x32_MulRoutedWeight_HasBias,1.6%
256,32,3072,512,128,4,ActivationType.Swiglu,torch.bfloat16,torch.bfloat16,torch.float4_e2m1fn_x2,QuantType.per_1x32,1,0,32,0,,,,,,,27.9199,,43.27,21646.67,stage2,moe_cktile2stages_gemm2_256x32x256x256_1x4_16x16x32_1perCU_1x32_MulRoutedWeight_HasBias,1.5%
256,32,3072,512,128,4,ActivationType.Swiglu,torch.bfloat16,torch.bfloat16,torch.float4_e2m1fn_x2,QuantType.per_1x32,1,0,32,0,,,,,,,31.192,,38.73,19375.9,stage2,moe_cktile2stages_gemm2_256x32x256x256_1x4_16x16x32_3perCU_1x32_MulRoutedWeight_HasBias,1.5%
256,32,3072,512,128,4,ActivationType.Swiglu,torch.bfloat16,torch.bfloat16,torch.float4_e2m1fn_x2,QuantType.per_1x32,1,0,32,0,,,,,,,63.2194,,19.11,9559.93,stage2,moe_cktile2stages_gemm2_256x32x256x256_1x4_16x16x32_4perCU_1x32_MulRoutedWeight_HasBias,1.6%
256,32,3072,512,128,4,ActivationType.Swiglu,torch.bfloat16,torch.bfloat16,torch.float4_e2m1fn_x2,QuantType.per_1x32,1,0,64,0,,,,,,,58.8468,,20.53,10270.28,stage1,moe_cktile2stages_gemm1_256x64x256x256_1x4_16x16x32_1perCU_1x32_HasBias_swiglu,0.0%
256,32,3072,512,128,4,ActivationType.Swiglu,torch.bfloat16,torch.bfloat16,torch.float4_e2m1fn_x2,QuantType.per_1x32,1,0,64,0,,,,,,,68.0129,,17.76,8886.15,stage1,moe_cktile2stages_gemm1_256x64x256x256_1x4_16x16x32_2perCU_1x32_HasBias_swiglu,0.0%
256,32,3072,512,128,4,ActivationType.Swiglu,torch.bfloat16,torch.bfloat16,torch.float4_e2m1fn_x2,QuantType.per_1x32,1,0,64,0,,,,,,,58.9011,,20.51,10260.81,stage1,moe_cktile2stages_gemm1_256x64x256x256_1x4_16x16x32_3perCU_1x32_HasBias_swiglu,0.0%
256,32,3072,512,128,4,ActivationType.Swiglu,torch.bfloat16,torch.bfloat16,torch.float4_e2m1fn_x2,QuantType.per_1x32,1,0,64,0,,,,,,,59.189,,20.41,10210.9,stage1,moe_cktile2stages_gemm1_256x64x256x256_1x4_16x16x32_4perCU_1x32_HasBias_swiglu,0.0%
256,32,3072,512,128,4,ActivationType.Swiglu,torch.bfloat16,torch.bfloat16,torch.float4_e2m1fn_x2,QuantType.per_1x32,1,0,64,0,,,,,,,52.0724,,23.2,11606.4,stage2,moe_cktile2stages_gemm2_256x64x256x256_1x4_16x16x32_1perCU_1x32_MulRoutedWeight_HasBias,1.5%
256,32,3072,512,128,4,ActivationType.Swiglu,torch.bfloat16,torch.bfloat16,torch.float4_e2m1fn_x2,QuantType.per_1x32,1,0,64,0,,,,,,,38.5006,,31.38,15697.76,stage2,moe_cktile2stages_gemm2_256x64x256x256_1x4_16x16x32_2perCU_1x32_MulRoutedWeight_HasBias,1.5%
256,32,3072,512,128,4,ActivationType.Swiglu,torch.bfloat16,torch.bfloat16,torch.float4_e2m1fn_x2,QuantType.per_1x32,1,0,64,0,,,,,,,52.3046,,23.09,11554.87,stage2,moe_cktile2stages_gemm2_256x64x256x256_1x4_16x16x32_3perCU_1x32_MulRoutedWeight_HasBias,1.5%
256,32,3072,512,128,4,ActivationType.Swiglu,torch.bfloat16,torch.bfloat16,torch.float4_e2m1fn_x2,QuantType.per_1x32,1,0,64,0,,,,,,,51.8474,,23.3,11656.77,stage2,moe_cktile2stages_gemm2_256x64x256x256_1x4_16x16x32_4perCU_1x32_MulRoutedWeight_HasBias,1.5%
256,32,3072,1536,128,4,ActivationType.Swiglu,torch.bfloat16,torch.bfloat16,torch.float4_e2m1fn_x2,QuantType.per_1x32,1,0,32,0,,,,,,,-1.0,,0.0,0.0,stage1,flydsl_moe1_afp16_wfp4_bf16_t32x256x256,100.0%
256,32,3072,1536,128,4,ActivationType.Swiglu,torch.bfloat16,torch.bfloat16,torch.float4_e2m1fn_x2,QuantType.per_1x32,1,0,32,0,,,,,,,-1.0,,0.0,0.0,stage2,flydsl_moe2_afp16_wfp4_bf16_t32x128x256_atomic,100.0%
256,32,3072,1536,128,4,ActivationType.Swiglu,torch.bfloat16,torch.bfloat16,torch.float4_e2m1fn_x2,QuantType.per_1x32,1,0,32,0,,,,,,,-1.0,,0.0,0.0,stage2,flydsl_moe2_afp16_wfp4_bf16_t32x128x256_reduce,100.0%
256,32,3072,1536,128,4,ActivationType.Swiglu,torch.bfloat16,torch.bfloat16,torch.float4_e2m1fn_x2,QuantType.per_1x32,1,0,32,0,,,,,,,-1.0,,0.0,0.0,stage2,flydsl_moe2_afp16_wfp4_bf16_t32x256x256_atomic,100.0%
256,32,3072,1536,128,4,ActivationType.Swiglu,torch.bfloat16,torch.bfloat16,torch.float4_e2m1fn_x2,QuantType.per_1x32,1,0,32,0,,,,,,,-1.0,,0.0,0.0,stage2,flydsl_moe2_afp16_wfp4_bf16_t32x256x256_reduce,100.0%
256,32,3072,1536,128,4,ActivationType.Swiglu,torch.bfloat16,torch.bfloat16,torch.float4_e2m1fn_x2,QuantType.per_1x32,1,0,64,0,,,,,,,-1.0,,0.0,0.0,stage1,flydsl_moe1_afp16_wfp4_bf16_t64x256x256,100.0%
256,32,3072,1536,128,4,ActivationType.Swiglu,torch.bfloat16,torch.bfloat16,torch.float4_e2m1fn_x2,QuantType.per_1x32,1,0,64,0,,,,,,,-1.0,,0.0,0.0,stage2,flydsl_moe2_afp16_wfp4_bf16_t64x128x256_atomic,100.0%
256,32,3072,1536,128,4,ActivationType.Swiglu,torch.bfloat16,torch.bfloat16,torch.float4_e2m1fn_x2,QuantType.per_1x32,1,0,64,0,,,,,,,-1.0,,0.0,0.0,stage2,flydsl_moe2_afp16_wfp4_bf16_t64x128x256_reduce,100.0%
256,32,3072,1536,128,4,ActivationType.Swiglu,torch.bfloat16,torch.bfloat16,torch.float4_e2m1fn_x2,QuantType.per_1x32,1,0,64,0,,,,,,,-1.0,,0.0,0.0,stage2,flydsl_moe2_afp16_wfp4_bf16_t64x256x256_atomic,100.0%
256,32,3072,1536,128,4,ActivationType.Swiglu,torch.bfloat16,torch.bfloat16,torch.float4_e2m1fn_x2,QuantType.per_1x32,1,0,64,0,,,,,,,-1.0,,0.0,0.0,stage2,flydsl_moe2_afp16_wfp4_bf16_t64x256x256_reduce,100.0%
256,32,3072,1536,128,4,ActivationType.Swiglu,torch.bfloat16,torch.bfloat16,torch.float4_e2m1fn_x2,QuantType.per_1x32,1,0,128,0,,,,,,,-1.0,,0.0,0.0,stage2,flydsl_moe2_afp16_wfp4_bf16_t128x128x256_atomic,100.0%
256,32,3072,1536,128,4,ActivationType.Swiglu,torch.bfloat16,torch.bfloat16,torch.float4_e2m1fn_x2,QuantType.per_1x32,1,0,128,0,,,,,,,-1.0,,0.0,0.0,stage2,flydsl_moe2_afp16_wfp4_bf16_t128x128x256_reduce,100.0%
256,32,3072,1536,128,4,ActivationType.Swiglu,torch.bfloat16,torch.bfloat16,torch.float4_e2m1fn_x2,QuantType.per_1x32,1,0,128,0,,,,,,,-1.0,,0.0,0.0,stage2,flydsl_moe2_afp16_wfp4_bf16_t128x256x256_atomic,100.0%
256,32,3072,1536,128,4,ActivationType.Swiglu,torch.bfloat16,torch.bfloat16,torch.float4_e2m1fn_x2,QuantType.per_1x32,1,0,128,0,,,,,,,-1.0,,0.0,0.0,stage2,flydsl_moe2_afp16_wfp4_bf16_t128x256x256_reduce,100.0%
256,32,3072,1536,128,4,ActivationType.Swiglu,torch.bfloat16,torch.bfloat16,torch.float4_e2m1fn_x2,QuantType.per_1x32,1,0,32,0,,,,,,,73.8714,,49.06,24533.62,stage1,moe_cktile2stages_gemm1_256x32x256x256_1x4_16x16x32_2perCU_1x32_HasBias_swiglu,0.0%
256,32,3072,1536,128,4,ActivationType.Swiglu,torch.bfloat16,torch.bfloat16,torch.float4_e2m1fn_x2,QuantType.per_1x32,1,0,32,0,,,,,,,73.8783,,49.05,24531.32,stage1,moe_cktile2stages_gemm1_256x32x256x256_1x4_16x16x32_1perCU_1x32_HasBias_swiglu,0.0%
256,32,3072,1536,128,4,ActivationType.Swiglu,torch.bfloat16,torch.bfloat16,torch.float4_e2m1fn_x2,QuantType.per_1x32,1,0,32,0,,,,,,,142.6607,,25.4,12703.8,stage1,moe_cktile2stages_gemm1_256x32x256x256_1x4_16x16x32_3perCU_1x32_HasBias_swiglu,0.0%
256,32,3072,1536,128,4,ActivationType.Swiglu,torch.bfloat16,torch.bfloat16,torch.float4_e2m1fn_x2,QuantType.per_1x32,1,0,32,0,,,,,,,236.1227,,15.35,7675.38,stage1,moe_cktile2stages_gemm1_256x32x256x256_1x4_16x16x32_4perCU_1x32_HasBias_swiglu,0.0%
256,32,3072,1536,128,4,ActivationType.Swiglu,torch.bfloat16,torch.bfloat16,torch.float4_e2m1fn_x2,QuantType.per_1x32,1,0,32,0,,,,,,,49.125,,73.77,36892.27,stage2,moe_cktile2stages_gemm2_256x32x256x256_1x4_16x16x32_2perCU_1x32_MulRoutedWeight_HasBias,3.7%
256,32,3072,1536,128,4,ActivationType.Swiglu,torch.bfloat16,torch.bfloat16,torch.float4_e2m1fn_x2,QuantType.per_1x32,1,0,32,0,,,,,,,48.8575,,74.17,37094.25,stage2,moe_cktile2stages_gemm2_256x32x256x256_1x4_16x16x32_1perCU_1x32_MulRoutedWeight_HasBias,3.6%
256,32,3072,1536,128,4,ActivationType.Swiglu,torch.bfloat16,torch.bfloat16,torch.float4_e2m1fn_x2,QuantType.per_1x32,1,0,32,0,,,,,,,86.9174,,41.69,20851.21,stage2,moe_cktile2stages_gemm2_256x32x256x256_1x4_16x16x32_3perCU_1x32_MulRoutedWeight_HasBias,3.6%
256,32,3072,1536,128,4,ActivationType.Swiglu,torch.bfloat16,torch.bfloat16,torch.float4_e2m1fn_x2,QuantType.per_1x32,1,0,32,0,,,,,,,134.8892,,26.87,13435.71,stage2,moe_cktile2stages_gemm2_256x32x256x256_1x4_16x16x32_4perCU_1x32_MulRoutedWeight_HasBias,3.7%
256,32,3072,1536,128,4,ActivationType.Swiglu,torch.bfloat16,torch.bfloat16,torch.float4_e2m1fn_x2,QuantType.per_1x32,1,0,64,0,,,,,,,112.127,,32.32,16163.21,stage1,moe_cktile2stages_gemm1_256x64x256x256_1x4_16x16x32_1perCU_1x32_HasBias_swiglu,0.0%
256,32,3072,1536,128,4,ActivationType.Swiglu,torch.bfloat16,torch.bfloat16,torch.float4_e2m1fn_x2,QuantType.per_1x32,1,0,64,0,,,,,,,133.2446,,27.2,13601.55,stage1,moe_cktile2stages_gemm1_256x64x256x256_1x4_16x16x32_2perCU_1x32_HasBias_swiglu,0.0%
256,32,3072,1536,128,4,ActivationType.Swiglu,torch.bfloat16,torch.bfloat16,torch.float4_e2m1fn_x2,QuantType.per_1x32,1,0,64,0,,,,,,,113.8585,,31.83,15917.41,stage1,moe_cktile2stages_gemm1_256x64x256x256_1x4_16x16x32_3perCU_1x32_HasBias_swiglu,0.0%
256,32,3072,1536,128,4,ActivationType.Swiglu,torch.bfloat16,torch.bfloat16,torch.float4_e2m1fn_x2,QuantType.per_1x32,1,0,64,0,,,,,,,115.4334,,31.39,15700.24,stage1,moe_cktile2stages_gemm1_256x64x256x256_1x4_16x16x32_4perCU_1x32_HasBias_swiglu,0.0%
256,32,3072,1536,128,4,ActivationType.Swiglu,torch.bfloat16,torch.bfloat16,torch.float4_e2m1fn_x2,QuantType.per_1x32,1,0,64,0,,,,,,,74.902,,48.38,24196.05,stage2,moe_cktile2stages_gemm2_256x64x256x256_1x4_16x16x32_1perCU_1x32_MulRoutedWeight_HasBias,3.7%
256,32,3072,1536,128,4,ActivationType.Swiglu,torch.bfloat16,torch.bfloat16,torch.float4_e2m1fn_x2,QuantType.per_1x32,1,0,64,0,,,,,,,75.9182,,47.73,23872.17,stage2,moe_cktile2stages_gemm2_256x64x256x256_1x4_16x16x32_2perCU_1x32_MulRoutedWeight_HasBias,3.6%
256,32,3072,1536,128,4,ActivationType.Swiglu,torch.bfloat16,torch.bfloat16,torch.float4_e2m1fn_x2,QuantType.per_1x32,1,0,64,0,,,,,,,74.5439,,48.61,24312.29,stage2,moe_cktile2stages_gemm2_256x64x256x256_1x4_16x16x32_3perCU_1x32_MulRoutedWeight_HasBias,3.7%
256,32,3072,1536,128,4,ActivationType.Swiglu,torch.bfloat16,torch.bfloat16,torch.float4_e2m1fn_x2,QuantType.per_1x32,1,0,64,0,,,,,,,74.0018,,48.97,24490.38,stage2,moe_cktile2stages_gemm2_256x64x256x256_1x4_16x16x32_4perCU_1x32_MulRoutedWeight_HasBias,3.7%
256,32,3072,3072,128,4,ActivationType.Swiglu,torch.bfloat16,torch.bfloat16,torch.float4_e2m1fn_x2,QuantType.per_1x32,1,0,32,0,,,,,,,-1.0,,0.0,0.0,stage1,flydsl_moe1_afp16_wfp4_bf16_t32x256x256,100.0%
256,32,3072,3072,128,4,ActivationType.Swiglu,torch.bfloat16,torch.bfloat16,torch.float4_e2m1fn_x2,QuantType.per_1x32,1,0,32,0,,,,,,,-1.0,,0.0,0.0,stage2,flydsl_moe2_afp16_wfp4_bf16_t32x128x256_atomic,100.0%
256,32,3072,3072,128,4,ActivationType.Swiglu,torch.bfloat16,torch.bfloat16,torch.float4_e2m1fn_x2,QuantType.per_1x32,1,0,32,0,,,,,,,-1.0,,0.0,0.0,stage2,flydsl_moe2_afp16_wfp4_bf16_t32x128x256_reduce,100.0%
256,32,3072,3072,128,4,ActivationType.Swiglu,torch.bfloat16,torch.bfloat16,torch.float4_e2m1fn_x2,QuantType.per_1x32,1,0,32,0,,,,,,,-1.0,,0.0,0.0,stage2,flydsl_moe2_afp16_wfp4_bf16_t32x256x256_atomic,100.0%
256,32,3072,3072,128,4,ActivationType.Swiglu,torch.bfloat16,torch.bfloat16,torch.float4_e2m1fn_x2,QuantType.per_1x32,1,0,32,0,,,,,,,-1.0,,0.0,0.0,stage2,flydsl_moe2_afp16_wfp4_bf16_t32x256x256_reduce,100.0%
256,32,3072,3072,128,4,ActivationType.Swiglu,torch.bfloat16,torch.bfloat16,torch.float4_e2m1fn_x2,QuantType.per_1x32,1,0,64,0,,,,,,,-1.0,,0.0,0.0,stage1,flydsl_moe1_afp16_wfp4_bf16_t64x256x256,100.0%
256,32,3072,3072,128,4,ActivationType.Swiglu,torch.bfloat16,torch.bfloat16,torch.float4_e2m1fn_x2,QuantType.per_1x32,1,0,64,0,,,,,,,-1.0,,0.0,0.0,stage2,flydsl_moe2_afp16_wfp4_bf16_t64x128x256_atomic,100.0%
256,32,3072,3072,128,4,ActivationType.Swiglu,torch.bfloat16,torch.bfloat16,torch.float4_e2m1fn_x2,QuantType.per_1x32,1,0,64,0,,,,,,,-1.0,,0.0,0.0,stage2,flydsl_moe2_afp16_wfp4_bf16_t64x128x256_reduce,100.0%
256,32,3072,3072,128,4,ActivationType.Swiglu,torch.bfloat16,torch.bfloat16,torch.float4_e2m1fn_x2,QuantType.per_1x32,1,0,64,0,,,,,,,-1.0,,0.0,0.0,stage2,flydsl_moe2_afp16_wfp4_bf16_t64x256x256_atomic,100.0%
256,32,3072,3072,128,4,ActivationType.Swiglu,torch.bfloat16,torch.bfloat16,torch.float4_e2m1fn_x2,QuantType.per_1x32,1,0,64,0,,,,,,,-1.0,,0.0,0.0,stage2,flydsl_moe2_afp16_wfp4_bf16_t64x256x256_reduce,100.0%
256,32,3072,3072,128,4,ActivationType.Swiglu,torch.bfloat16,torch.bfloat16,torch.float4_e2m1fn_x2,QuantType.per_1x32,1,0,128,0,,,,,,,-1.0,,0.0,0.0,stage2,flydsl_moe2_afp16_wfp4_bf16_t128x128x256_atomic,100.0%
256,32,3072,3072,128,4,ActivationType.Swiglu,torch.bfloat16,torch.bfloat16,torch.float4_e2m1fn_x2,QuantType.per_1x32,1,0,128,0,,,,,,,-1.0,,0.0,0.0,stage2,flydsl_moe2_afp16_wfp4_bf16_t128x128x256_reduce,100.0%
256,32,3072,3072,128,4,ActivationType.Swiglu,torch.bfloat16,torch.bfloat16,torch.float4_e2m1fn_x2,QuantType.per_1x32,1,0,128,0,,,,,,,-1.0,,0.0,0.0,stage2,flydsl_moe2_afp16_wfp4_bf16_t128x256x256_atomic,100.0%
256,32,3072,3072,128,4,ActivationType.Swiglu,torch.bfloat16,torch.bfloat16,torch.float4_e2m1fn_x2,QuantType.per_1x32,1,0,128,0,,,,,,,-1.0,,0.0,0.0,stage2,flydsl_moe2_afp16_wfp4_bf16_t128x256x256_reduce,100.0%
256,32,3072,3072,128,4,ActivationType.Swiglu,torch.bfloat16,torch.bfloat16,torch.float4_e2m1fn_x2,QuantType.per_1x32,1,0,32,0,,,,,,,152.8735,,47.41,23707.65,stage1,moe_cktile2stages_gemm1_256x32x256x256_1x4_16x16x32_2perCU_1x32_HasBias_swiglu,0.0%
256,32,3072,3072,128,4,ActivationType.Swiglu,torch.bfloat16,torch.bfloat16,torch.float4_e2m1fn_x2,QuantType.per_1x32,1,0,32,0,,,,,,,153.8161,,47.12,23562.37,stage1,moe_cktile2stages_gemm1_256x32x256x256_1x4_16x16x32_1perCU_1x32_HasBias_swiglu,0.0%
256,32,3072,3072,128,4,ActivationType.Swiglu,torch.bfloat16,torch.bfloat16,torch.float4_e2m1fn_x2,QuantType.per_1x32,1,0,32,0,,,,,,,252.0256,,28.76,14380.57,stage1,moe_cktile2stages_gemm1_256x32x256x256_1x4_16x16x32_3perCU_1x32_HasBias_swiglu,0.0%
256,32,3072,3072,128,4,ActivationType.Swiglu,torch.bfloat16,torch.bfloat16,torch.float4_e2m1fn_x2,QuantType.per_1x32,1,0,32,0,,,,,,,532.5387,,13.61,6805.65,stage1,moe_cktile2stages_gemm1_256x32x256x256_1x4_16x16x32_4perCU_1x32_HasBias_swiglu,0.0%
256,32,3072,3072,128,4,ActivationType.Swiglu,torch.bfloat16,torch.bfloat16,torch.float4_e2m1fn_x2,QuantType.per_1x32,1,0,32,0,,,,,,,90.6918,,79.92,39962.51,stage2,moe_cktile2stages_gemm2_256x32x256x256_1x4_16x16x32_2perCU_1x32_MulRoutedWeight_HasBias,5.2%
256,32,3072,3072,128,4,ActivationType.Swiglu,torch.bfloat16,torch.bfloat16,torch.float4_e2m1fn_x2,QuantType.per_1x32,1,0,32,0,,,,,,,91.6129,,79.11,39560.72,stage2,moe_cktile2stages_gemm2_256x32x256x256_1x4_16x16x32_1perCU_1x32_MulRoutedWeight_HasBias,5.2%
256,32,3072,3072,128,4,ActivationType.Swiglu,torch.bfloat16,torch.bfloat16,torch.float4_e2m1fn_x2,QuantType.per_1x32,1,0,32,0,,,,,,,156.3714,,46.35,23177.33,stage2,moe_cktile2stages_gemm2_256x32x256x256_1x4_16x16x32_3perCU_1x32_MulRoutedWeight_HasBias,5.1%
256,32,3072,3072,128,4,ActivationType.Swiglu,torch.bfloat16,torch.bfloat16,torch.float4_e2m1fn_x2,QuantType.per_1x32,1,0,32,0,,,,,,,317.0513,,22.86,11431.18,stage2,moe_cktile2stages_gemm2_256x32x256x256_1x4_16x16x32_4perCU_1x32_MulRoutedWeight_HasBias,5.1%
256,32,3072,3072,128,4,ActivationType.Swiglu,torch.bfloat16,torch.bfloat16,torch.float4_e2m1fn_x2,QuantType.per_1x32,1,0,64,0,,,,,,,246.8866,,29.36,14679.91,stage1,moe_cktile2stages_gemm1_256x64x256x256_1x4_16x16x32_1perCU_1x32_HasBias_swiglu,0.0%
256,32,3072,3072,128,4,ActivationType.Swiglu,torch.bfloat16,torch.bfloat16,torch.float4_e2m1fn_x2,QuantType.per_1x32,1,0,64,0,,,,,,,284.7686,,25.45,12727.08,stage1,moe_cktile2stages_gemm1_256x64x256x256_1x4_16x16x32_2perCU_1x32_HasBias_swiglu,0.0%
256,32,3072,3072,128,4,ActivationType.Swiglu,torch.bfloat16,torch.bfloat16,torch.float4_e2m1fn_x2,QuantType.per_1x32,1,0,64,0,,,,,,,241.8984,,29.96,14982.62,stage1,moe_cktile2stages_gemm1_256x64x256x256_1x4_16x16x32_3perCU_1x32_HasBias_swiglu,0.0%
256,32,3072,3072,128,4,ActivationType.Swiglu,torch.bfloat16,torch.bfloat16,torch.float4_e2m1fn_x2,QuantType.per_1x32,1,0,64,0,,,,,,,247.8892,,29.24,14620.53,stage1,moe_cktile2stages_gemm1_256x64x256x256_1x4_16x16x32_4perCU_1x32_HasBias_swiglu,0.0%
256,32,3072,3072,128,4,ActivationType.Swiglu,torch.bfloat16,torch.bfloat16,torch.float4_e2m1fn_x2,QuantType.per_1x32,1,0,64,0,,,,,,,138.7714,,52.23,26116.85,stage2,moe_cktile2stages_gemm2_256x64x256x256_1x4_16x16x32_1perCU_1x32_MulRoutedWeight_HasBias,5.1%
256,32,3072,3072,128,4,ActivationType.Swiglu,torch.bfloat16,torch.bfloat16,torch.float4_e2m1fn_x2,QuantType.per_1x32,1,0,64,0,,,,,,,150.2655,,48.23,24119.12,stage2,moe_cktile2stages_gemm2_256x64x256x256_1x4_16x16x32_2perCU_1x32_MulRoutedWeight_HasBias,5.2%
256,32,3072,3072,128,4,ActivationType.Swiglu,torch.bfloat16,torch.bfloat16,torch.float4_e2m1fn_x2,QuantType.per_1x32,1,0,64,0,,,,,,,141.8413,,51.1,25551.6,stage2,moe_cktile2stages_gemm2_256x64x256x256_1x4_16x16x32_3perCU_1x32_MulRoutedWeight_HasBias,5.1%
256,32,3072,3072,128,4,ActivationType.Swiglu,torch.bfloat16,torch.bfloat16,torch.float4_e2m1fn_x2,QuantType.per_1x32,1,0,64,0,,,,,,,137.2409,,52.81,26408.1,stage2,moe_cktile2stages_gemm2_256x64x256x256_1x4_16x16x32_4perCU_1x32_MulRoutedWeight_HasBias,5.1%
256,64,3072,512,128,4,ActivationType.Swiglu,torch.bfloat16,torch.bfloat16,torch.float4_e2m1fn_x2,QuantType.per_1x32,1,0,32,0,,,,,,,-1.0,,0.0,0.0,stage1,flydsl_moe1_afp16_wfp4_bf16_t32x256x256,100.0%
256,64,3072,512,128,4,ActivationType.Swiglu,torch.bfloat16,torch.bfloat16,torch.float4_e2m1fn_x2,QuantType.per_1x32,1,0,32,0,,,,,,,-1.0,,0.0,0.0,stage2,flydsl_moe2_afp16_wfp4_bf16_t32x128x256_atomic,100.0%
256,64,3072,512,128,4,ActivationType.Swiglu,torch.bfloat16,torch.bfloat16,torch.float4_e2m1fn_x2,QuantType.per_1x32,1,0,32,0,,,,,,,-1.0,,0.0,0.0,stage2,flydsl_moe2_afp16_wfp4_bf16_t32x128x256_reduce,100.0%
256,64,3072,512,128,4,ActivationType.Swiglu,torch.bfloat16,torch.bfloat16,torch.float4_e2m1fn_x2,QuantType.per_1x32,1,0,32,0,,,,,,,-1.0,,0.0,0.0,stage2,flydsl_moe2_afp16_wfp4_bf16_t32x256x256_atomic,100.0%
256,64,3072,512,128,4,ActivationType.Swiglu,torch.bfloat16,torch.bfloat16,torch.float4_e2m1fn_x2,QuantType.per_1x32,1,0,32,0,,,,,,,-1.0,,0.0,0.0,stage2,flydsl_moe2_afp16_wfp4_bf16_t32x256x256_reduce,100.0%
256,64,3072,512,128,4,ActivationType.Swiglu,torch.bfloat16,torch.bfloat16,torch.float4_e2m1fn_x2,QuantType.per_1x32,1,0,64,0,,,,,,,-1.0,,0.0,0.0,stage1,flydsl_moe1_afp16_wfp4_bf16_t64x256x256,100.0%
256,64,3072,512,128,4,ActivationType.Swiglu,torch.bfloat16,torch.bfloat16,torch.float4_e2m1fn_x2,QuantType.per_1x32,1,0,64,0,,,,,,,-1.0,,0.0,0.0,stage2,flydsl_moe2_afp16_wfp4_bf16_t64x128x256_atomic,100.0%
256,64,3072,512,128,4,ActivationType.Swiglu,torch.bfloat16,torch.bfloat16,torch.float4_e2m1fn_x2,QuantType.per_1x32,1,0,64,0,,,,,,,-1.0,,0.0,0.0,stage2,flydsl_moe2_afp16_wfp4_bf16_t64x128x256_reduce,100.0%
256,64,3072,512,128,4,ActivationType.Swiglu,torch.bfloat16,torch.bfloat16,torch.float4_e2m1fn_x2,QuantType.per_1x32,1,0,64,0,,,,,,,-1.0,,0.0,0.0,stage2,flydsl_moe2_afp16_wfp4_bf16_t64x256x256_atomic,100.0%
256,64,3072,512,128,4,ActivationType.Swiglu,torch.bfloat16,torch.bfloat16,torch.float4_e2m1fn_x2,QuantType.per_1x32,1,0,64,0,,,,,,,-1.0,,0.0,0.0,stage2,flydsl_moe2_afp16_wfp4_bf16_t64x256x256_reduce,100.0%
256,64,3072,512,128,4,ActivationType.Swiglu,torch.bfloat16,torch.bfloat16,torch.float4_e2m1fn_x2,QuantType.per_1x32,1,0,128,0,,,,,,,-1.0,,0.0,0.0,stage2,flydsl_moe2_afp16_wfp4_bf16_t128x128x256_atomic,100.0%
256,64,3072,512,128,4,ActivationType.Swiglu,torch.bfloat16,torch.bfloat16,torch.float4_e2m1fn_x2,QuantType.per_1x32,1,0,128,0,,,,,,,-1.0,,0.0,0.0,stage2,flydsl_moe2_afp16_wfp4_bf16_t128x128x256_reduce,100.0%
256,64,3072,512,128,4,ActivationType.Swiglu,torch.bfloat16,torch.bfloat16,torch.float4_e2m1fn_x2,QuantType.per_1x32,1,0,128,0,,,,,,,-1.0,,0.0,0.0,stage2,flydsl_moe2_afp16_wfp4_bf16_t128x256x256_atomic,100.0%
256,64,3072,512,128,4,ActivationType.Swiglu,torch.bfloat16,torch.bfloat16,torch.float4_e2m1fn_x2,QuantType.per_1x32,1,0,128,0,,,,,,,-1.0,,0.0,0.0,stage2,flydsl_moe2_afp16_wfp4_bf16_t128x256x256_reduce,100.0%
256,64,3072,512,128,4,ActivationType.Swiglu,torch.bfloat16,torch.bfloat16,torch.float4_e2m1fn_x2,QuantType.per_1x32,1,0,32,0,,,,,,,39.4048,,61.31,15347.53,stage1,moe_cktile2stages_gemm1_256x32x256x256_1x4_16x16x32_2perCU_1x32_HasBias_swiglu,0.0%
256,64,3072,512,128,4,ActivationType.Swiglu,torch.bfloat16,torch.bfloat16,torch.float4_e2m1fn_x2,QuantType.per_1x32,1,0,32,0,,,,,,,40.5849,,59.53,14901.26,stage1,moe_cktile2stages_gemm1_256x32x256x256_1x4_16x16x32_1perCU_1x32_HasBias_swiglu,0.0%
256,64,3072,512,128,4,ActivationType.Swiglu,torch.bfloat16,torch.bfloat16,torch.float4_e2m1fn_x2,QuantType.per_1x32,1,0,32,0,,,,,,,73.6066,,32.82,8216.2,stage1,moe_cktile2stages_gemm1_256x32x256x256_1x4_16x16x32_3perCU_1x32_HasBias_swiglu,0.0%
256,64,3072,512,128,4,ActivationType.Swiglu,torch.bfloat16,torch.bfloat16,torch.float4_e2m1fn_x2,QuantType.per_1x32,1,0,32,0,,,,,,,167.0943,,14.46,3619.31,stage1,moe_cktile2stages_gemm1_256x32x256x256_1x4_16x16x32_4perCU_1x32_HasBias_swiglu,0.0%
256,64,3072,512,128,4,ActivationType.Swiglu,torch.bfloat16,torch.bfloat16,torch.float4_e2m1fn_x2,QuantType.per_1x32,1,0,32,0,,,,,,,31.0879,,77.71,19453.43,stage2,moe_cktile2stages_gemm2_256x32x256x256_1x4_16x16x32_2perCU_1x32_MulRoutedWeight_HasBias,1.6%
256,64,3072,512,128,4,ActivationType.Swiglu,torch.bfloat16,torch.bfloat16,torch.float4_e2m1fn_x2,QuantType.per_1x32,1,0,32,0,,,,,,,32.1213,,75.21,18827.58,stage2,moe_cktile2stages_gemm2_256x32x256x256_1x4_16x16x32_1perCU_1x32_MulRoutedWeight_HasBias,1.6%
256,64,3072,512,128,4,ActivationType.Swiglu,torch.bfloat16,torch.bfloat16,torch.float4_e2m1fn_x2,QuantType.per_1x32,1,0,32,0,,,,,,,33.7732,,71.53,17906.69,stage2,moe_cktile2stages_gemm2_256x32x256x256_1x4_16x16x32_3perCU_1x32_MulRoutedWeight_HasBias,1.6%
256,64,3072,512,128,4,ActivationType.Swiglu,torch.bfloat16,torch.bfloat16,torch.float4_e2m1fn_x2,QuantType.per_1x32,1,0,32,0,,,,,,,70.1806,,34.42,8617.28,stage2,moe_cktile2stages_gemm2_256x32x256x256_1x4_16x16x32_4perCU_1x32_MulRoutedWeight_HasBias,1.6%
256,64,3072,512,128,4,ActivationType.Swiglu,torch.bfloat16,torch.bfloat16,torch.float4_e2m1fn_x2,QuantType.per_1x32,1,0,64,0,,,,,,,60.7223,,39.79,9959.54,stage1,moe_cktile2stages_gemm1_256x64x256x256_1x4_16x16x32_1perCU_1x32_HasBias_swiglu,0.0%
256,64,3072,512,128,4,ActivationType.Swiglu,torch.bfloat16,torch.bfloat16,torch.float4_e2m1fn_x2,QuantType.per_1x32,1,0,64,0,,,,,,,71.9456,,33.58,8405.88,stage1,moe_cktile2stages_gemm1_256x64x256x256_1x4_16x16x32_2perCU_1x32_HasBias_swiglu,0.0%
256,64,3072,512,128,4,ActivationType.Swiglu,torch.bfloat16,torch.bfloat16,torch.float4_e2m1fn_x2,QuantType.per_1x32,1,0,64,0,,,,,,,59.8899,,40.34,10097.97,stage1,moe_cktile2stages_gemm1_256x64x256x256_1x4_16x16x32_3perCU_1x32_HasBias_swiglu,0.0%
256,64,3072,512,128,4,ActivationType.Swiglu,torch.bfloat16,torch.bfloat16,torch.float4_e2m1fn_x2,QuantType.per_1x32,1,0,64,0,,,,,,,60.9211,,39.66,9927.04,stage1,moe_cktile2stages_gemm1_256x64x256x256_1x4_16x16x32_4perCU_1x32_HasBias_swiglu,0.0%
256,64,3072,512,128,4,ActivationType.Swiglu,torch.bfloat16,torch.bfloat16,torch.float4_e2m1fn_x2,QuantType.per_1x32,1,0,64,0,,,,,,,54.9598,,43.96,11003.79,stage2,moe_cktile2stages_gemm2_256x64x256x256_1x4_16x16x32_1perCU_1x32_MulRoutedWeight_HasBias,1.6%
256,64,3072,512,128,4,ActivationType.Swiglu,torch.bfloat16,torch.bfloat16,torch.float4_e2m1fn_x2,QuantType.per_1x32,1,0,64,0,,,,,,,40.4752,,59.69,14941.65,stage2,moe_cktile2stages_gemm2_256x64x256x256_1x4_16x16x32_2perCU_1x32_MulRoutedWeight_HasBias,1.6%
256,64,3072,512,128,4,ActivationType.Swiglu,torch.bfloat16,torch.bfloat16,torch.float4_e2m1fn_x2,QuantType.per_1x32,1,0,64,0,,,,,,,54.7657,,44.11,11042.79,stage2,moe_cktile2stages_gemm2_256x64x256x256_1x4_16x16x32_3perCU_1x32_MulRoutedWeight_HasBias,1.6%
256,64,3072,512,128,4,ActivationType.Swiglu,torch.bfloat16,torch.bfloat16,torch.float4_e2m1fn_x2,QuantType.per_1x32,1,0,64,0,,,,,,,54.8108,,44.08,11033.71,stage2,moe_cktile2stages_gemm2_256x64x256x256_1x4_16x16x32_4perCU_1x32_MulRoutedWeight_HasBias,1.6%
256,64,3072,1536,128,4,ActivationType.Swiglu,torch.bfloat16,torch.bfloat16,torch.float4_e2m1fn_x2,QuantType.per_1x32,1,0,32,0,,,,,,,-1.0,,0.0,0.0,stage1,flydsl_moe1_afp16_wfp4_bf16_t32x256x256,100.0%
256,64,3072,1536,128,4,ActivationType.Swiglu,torch.bfloat16,torch.bfloat16,torch.float4_e2m1fn_x2,QuantType.per_1x32,1,0,32,0,,,,,,,-1.0,,0.0,0.0,stage2,flydsl_moe2_afp16_wfp4_bf16_t32x128x256_atomic,100.0%
256,64,3072,1536,128,4,ActivationType.Swiglu,torch.bfloat16,torch.bfloat16,torch.float4_e2m1fn_x2,QuantType.per_1x32,1,0,32,0,,,,,,,-1.0,,0.0,0.0,stage2,flydsl_moe2_afp16_wfp4_bf16_t32x128x256_reduce,100.0%
256,64,3072,1536,128,4,ActivationType.Swiglu,torch.bfloat16,torch.bfloat16,torch.float4_e2m1fn_x2,QuantType.per_1x32,1,0,32,0,,,,,,,-1.0,,0.0,0.0,stage2,flydsl_moe2_afp16_wfp4_bf16_t32x256x256_atomic,100.0%
256,64,3072,1536,128,4,ActivationType.Swiglu,torch.bfloat16,torch.bfloat16,torch.float4_e2m1fn_x2,QuantType.per_1x32,1,0,32,0,,,,,,,-1.0,,0.0,0.0,stage2,flydsl_moe2_afp16_wfp4_bf16_t32x256x256_reduce,100.0%
256,64,3072,1536,128,4,ActivationType.Swiglu,torch.bfloat16,torch.bfloat16,torch.float4_e2m1fn_x2,QuantType.per_1x32,1,0,64,0,,,,,,,-1.0,,0.0,0.0,stage1,flydsl_moe1_afp16_wfp4_bf16_t64x256x256,100.0%
256,64,3072,1536,128,4,ActivationType.Swiglu,torch.bfloat16,torch.bfloat16,torch.float4_e2m1fn_x2,QuantType.per_1x32,1,0,64,0,,,,,,,-1.0,,0.0,0.0,stage2,flydsl_moe2_afp16_wfp4_bf16_t64x128x256_atomic,100.0%
256,64,3072,1536,128,4,ActivationType.Swiglu,torch.bfloat16,torch.bfloat16,torch.float4_e2m1fn_x2,QuantType.per_1x32,1,0,64,0,,,,,,,-1.0,,0.0,0.0,stage2,flydsl_moe2_afp16_wfp4_bf16_t64x128x256_reduce,100.0%
256,64,3072,1536,128,4,ActivationType.Swiglu,torch.bfloat16,torch.bfloat16,torch.float4_e2m1fn_x2,QuantType.per_1x32,1,0,64,0,,,,,,,-1.0,,0.0,0.0,stage2,flydsl_moe2_afp16_wfp4_bf16_t64x256x256_atomic,100.0%
256,64,3072,1536,128,4,ActivationType.Swiglu,torch.bfloat16,torch.bfloat16,torch.float4_e2m1fn_x2,QuantType.per_1x32,1,0,64,0,,,,,,,-1.0,,0.0,0.0,stage2,flydsl_moe2_afp16_wfp4_bf16_t64x256x256_reduce,100.0%
256,64,3072,1536,128,4,ActivationType.Swiglu,torch.bfloat16,torch.bfloat16,torch.float4_e2m1fn_x2,QuantType.per_1x32,1,0,128,0,,,,,,,-1.0,,0.0,0.0,stage2,flydsl_moe2_afp16_wfp4_bf16_t128x128x256_atomic,100.0%
256,64,3072,1536,128,4,ActivationType.Swiglu,torch.bfloat16,torch.bfloat16,torch.float4_e2m1fn_x2,QuantType.per_1x32,1,0,128,0,,,,,,,-1.0,,0.0,0.0,stage2,flydsl_moe2_afp16_wfp4_bf16_t128x128x256_reduce,100.0%
256,64,3072,1536,128,4,ActivationType.Swiglu,torch.bfloat16,torch.bfloat16,torch.float4_e2m1fn_x2,QuantType.per_1x32,1,0,128,0,,,,,,,-1.0,,0.0,0.0,stage2,flydsl_moe2_afp16_wfp4_bf16_t128x256x256_atomic,100.0%
256,64,3072,1536,128,4,ActivationType.Swiglu,torch.bfloat16,torch.bfloat16,torch.float4_e2m1fn_x2,QuantType.per_1x32,1,0,128,0,,,,,,,-1.0,,0.0,0.0,stage2,flydsl_moe2_afp16_wfp4_bf16_t128x256x256_reduce,100.0%
256,64,3072,1536,128,4,ActivationType.Swiglu,torch.bfloat16,torch.bfloat16,torch.float4_e2m1fn_x2,QuantType.per_1x32,1,0,32,0,,,,,,,109.1465,,66.4,16608.19,stage1,moe_cktile2stages_gemm1_256x32x256x256_1x4_16x16x32_2perCU_1x32_HasBias_swiglu,0.0%
256,64,3072,1536,128,4,ActivationType.Swiglu,torch.bfloat16,torch.bfloat16,torch.float4_e2m1fn_x2,QuantType.per_1x32,1,0,32,0,,,,,,,104.6981,,69.23,17313.84,stage1,moe_cktile2stages_gemm1_256x32x256x256_1x4_16x16x32_1perCU_1x32_HasBias_swiglu,0.0%
256,64,3072,1536,128,4,ActivationType.Swiglu,torch.bfloat16,torch.bfloat16,torch.float4_e2m1fn_x2,QuantType.per_1x32,1,0,32,0,,,,,,,172.6748,,41.97,10497.92,stage1,moe_cktile2stages_gemm1_256x32x256x256_1x4_16x16x32_3perCU_1x32_HasBias_swiglu,0.0%
256,64,3072,1536,128,4,ActivationType.Swiglu,torch.bfloat16,torch.bfloat16,torch.float4_e2m1fn_x2,QuantType.per_1x32,1,0,32,0,,,,,,,383.2822,,18.91,4729.48,stage1,moe_cktile2stages_gemm1_256x32x256x256_1x4_16x16x32_4perCU_1x32_HasBias_swiglu,0.0%
256,64,3072,1536,128,4,ActivationType.Swiglu,torch.bfloat16,torch.bfloat16,torch.float4_e2m1fn_x2,QuantType.per_1x32,1,0,32,0,,,,,,,66.7773,,108.54,27145.84,stage2,moe_cktile2stages_gemm2_256x32x256x256_1x4_16x16x32_2perCU_1x32_MulRoutedWeight_HasBias,3.6%
256,64,3072,1536,128,4,ActivationType.Swiglu,torch.bfloat16,torch.bfloat16,torch.float4_e2m1fn_x2,QuantType.per_1x32,1,0,32,0,,,,,,,66.5081,,108.98,27255.71,stage2,moe_cktile2stages_gemm2_256x32x256x256_1x4_16x16x32_1perCU_1x32_MulRoutedWeight_HasBias,3.6%
256,64,3072,1536,128,4,ActivationType.Swiglu,torch.bfloat16,torch.bfloat16,torch.float4_e2m1fn_x2,QuantType.per_1x32,1,0,32,0,,,,,,,98.6359,,73.48,18377.95,stage2,moe_cktile2stages_gemm2_256x32x256x256_1x4_16x16x32_3perCU_1x32_MulRoutedWeight_HasBias,3.6%
256,64,3072,1536,128,4,ActivationType.Swiglu,torch.bfloat16,torch.bfloat16,torch.float4_e2m1fn_x2,QuantType.per_1x32,1,0,32,0,,,,,,,206.4772,,35.1,8779.3,stage2,moe_cktile2stages_gemm2_256x32x256x256_1x4_16x16x32_4perCU_1x32_MulRoutedWeight_HasBias,3.6%
256,64,3072,1536,128,4,ActivationType.Swiglu,torch.bfloat16,torch.bfloat16,torch.float4_e2m1fn_x2,QuantType.per_1x32,1,0,64,0,,,,,,,167.2223,,43.34,10840.22,stage1,moe_cktile2stages_gemm1_256x64x256x256_1x4_16x16x32_1perCU_1x32_HasBias_swiglu,0.0%
256,64,3072,1536,128,4,ActivationType.Swiglu,torch.bfloat16,torch.bfloat16,torch.float4_e2m1fn_x2,QuantType.per_1x32,1,0,64,0,,,,,,,190.5053,,38.04,9515.36,stage1,moe_cktile2stages_gemm1_256x64x256x256_1x4_16x16x32_2perCU_1x32_HasBias_swiglu,0.0%
256,64,3072,1536,128,4,ActivationType.Swiglu,torch.bfloat16,torch.bfloat16,torch.float4_e2m1fn_x2,QuantType.per_1x32,1,0,64,0,,,,,,,163.442,,44.34,11090.94,stage1,moe_cktile2stages_gemm1_256x64x256x256_1x4_16x16x32_3perCU_1x32_HasBias_swiglu,0.0%
256,64,3072,1536,128,4,ActivationType.Swiglu,torch.bfloat16,torch.bfloat16,torch.float4_e2m1fn_x2,QuantType.per_1x32,1,0,64,0,,,,,,,165.7868,,43.72,10934.08,stage1,moe_cktile2stages_gemm1_256x64x256x256_1x4_16x16x32_4perCU_1x32_HasBias_swiglu,0.0%
256,64,3072,1536,128,4,ActivationType.Swiglu,torch.bfloat16,torch.bfloat16,torch.float4_e2m1fn_x2,QuantType.per_1x32,1,0,64,0,,,,,,,106.0963,,68.31,17085.66,stage2,moe_cktile2stages_gemm2_256x64x256x256_1x4_16x16x32_1perCU_1x32_MulRoutedWeight_HasBias,3.6%
256,64,3072,1536,128,4,ActivationType.Swiglu,torch.bfloat16,torch.bfloat16,torch.float4_e2m1fn_x2,QuantType.per_1x32,1,0,64,0,,,,,,,102.132,,70.96,17748.85,stage2,moe_cktile2stages_gemm2_256x64x256x256_1x4_16x16x32_2perCU_1x32_MulRoutedWeight_HasBias,3.6%
256,64,3072,1536,128,4,ActivationType.Swiglu,torch.bfloat16,torch.bfloat16,torch.float4_e2m1fn_x2,QuantType.per_1x32,1,0,64,0,,,,,,,105.1062,,68.96,17246.61,stage2,moe_cktile2stages_gemm2_256x64x256x256_1x4_16x16x32_3perCU_1x32_MulRoutedWeight_HasBias,3.6%
256,64,3072,1536,128,4,ActivationType.Swiglu,torch.bfloat16,torch.bfloat16,torch.float4_e2m1fn_x2,QuantType.per_1x32,1,0,64,0,,,,,,,105.6118,,68.63,17164.05,stage2,moe_cktile2stages_gemm2_256x64x256x256_1x4_16x16x32_4perCU_1x32_MulRoutedWeight_HasBias,3.6%
256,64,3072,3072,128,4,ActivationType.Swiglu,torch.bfloat16,torch.bfloat16,torch.float4_e2m1fn_x2,QuantType.per_1x32,1,0,32,0,,,,,,,-1.0,,0.0,0.0,stage1,flydsl_moe1_afp16_wfp4_bf16_t32x256x256,100.0%
256,64,3072,3072,128,4,ActivationType.Swiglu,torch.bfloat16,torch.bfloat16,torch.float4_e2m1fn_x2,QuantType.per_1x32,1,0,32,0,,,,,,,-1.0,,0.0,0.0,stage2,flydsl_moe2_afp16_wfp4_bf16_t32x128x256_atomic,100.0%
256,64,3072,3072,128,4,ActivationType.Swiglu,torch.bfloat16,torch.bfloat16,torch.float4_e2m1fn_x2,QuantType.per_1x32,1,0,32,0,,,,,,,-1.0,,0.0,0.0,stage2,flydsl_moe2_afp16_wfp4_bf16_t32x128x256_reduce,100.0%
256,64,3072,3072,128,4,ActivationType.Swiglu,torch.bfloat16,torch.bfloat16,torch.float4_e2m1fn_x2,QuantType.per_1x32,1,0,32,0,,,,,,,-1.0,,0.0,0.0,stage2,flydsl_moe2_afp16_wfp4_bf16_t32x256x256_atomic,100.0%
256,64,3072,3072,128,4,ActivationType.Swiglu,torch.bfloat16,torch.bfloat16,torch.float4_e2m1fn_x2,QuantType.per_1x32,1,0,32,0,,,,,,,-1.0,,0.0,0.0,stage2,flydsl_moe2_afp16_wfp4_bf16_t32x256x256_reduce,100.0%
256,64,3072,3072,128,4,ActivationType.Swiglu,torch.bfloat16,torch.bfloat16,torch.float4_e2m1fn_x2,QuantType.per_1x32,1,0,64,0,,,,,,,-1.0,,0.0,0.0,stage1,flydsl_moe1_afp16_wfp4_bf16_t64x256x256,100.0%
256,64,3072,3072,128,4,ActivationType.Swiglu,torch.bfloat16,torch.bfloat16,torch.float4_e2m1fn_x2,QuantType.per_1x32,1,0,64,0,,,,,,,-1.0,,0.0,0.0,stage2,flydsl_moe2_afp16_wfp4_bf16_t64x128x256_atomic,100.0%
256,64,3072,3072,128,4,ActivationType.Swiglu,torch.bfloat16,torch.bfloat16,torch.float4_e2m1fn_x2,QuantType.per_1x32,1,0,64,0,,,,,,,-1.0,,0.0,0.0,stage2,flydsl_moe2_afp16_wfp4_bf16_t64x128x256_reduce,100.0%
256,64,3072,3072,128,4,ActivationType.Swiglu,torch.bfloat16,torch.bfloat16,torch.float4_e2m1fn_x2,QuantType.per_1x32,1,0,64,0,,,,,,,-1.0,,0.0,0.0,stage2,flydsl_moe2_afp16_wfp4_bf16_t64x256x256_atomic,100.0%
256,64,3072,3072,128,4,ActivationType.Swiglu,torch.bfloat16,torch.bfloat16,torch.float4_e2m1fn_x2,QuantType.per_1x32,1,0,64,0,,,,,,,-1.0,,0.0,0.0,stage2,flydsl_moe2_afp16_wfp4_bf16_t64x256x256_reduce,100.0%
256,64,3072,3072,128,4,ActivationType.Swiglu,torch.bfloat16,torch.bfloat16,torch.float4_e2m1fn_x2,QuantType.per_1x32,1,0,128,0,,,,,,,-1.0,,0.0,0.0,stage2,flydsl_moe2_afp16_wfp4_bf16_t128x128x256_atomic,100.0%
256,64,3072,3072,128,4,ActivationType.Swiglu,torch.bfloat16,torch.bfloat16,torch.float4_e2m1fn_x2,QuantType.per_1x32,1,0,128,0,,,,,,,-1.0,,0.0,0.0,stage2,flydsl_moe2_afp16_wfp4_bf16_t128x128x256_reduce,100.0%
256,64,3072,3072,128,4,ActivationType.Swiglu,torch.bfloat16,torch.bfloat16,torch.float4_e2m1fn_x2,QuantType.per_1x32,1,0,128,0,,,,,,,-1.0,,0.0,0.0,stage2,flydsl_moe2_afp16_wfp4_bf16_t128x256x256_atomic,100.0%
256,64,3072,3072,128,4,ActivationType.Swiglu,torch.bfloat16,torch.bfloat16,torch.float4_e2m1fn_x2,QuantType.per_1x32,1,0,128,0,,,,,,,-1.0,,0.0,0.0,stage2,flydsl_moe2_afp16_wfp4_bf16_t128x256x256_reduce,100.0%
256,64,3072,3072,128,4,ActivationType.Swiglu,torch.bfloat16,torch.bfloat16,torch.float4_e2m1fn_x2,QuantType.per_1x32,1,0,32,0,,,,,,,189.6557,,76.43,19111.82,stage1,moe_cktile2stages_gemm1_256x32x256x256_1x4_16x16x32_2perCU_1x32_HasBias_swiglu,0.0%
256,64,3072,3072,128,4,ActivationType.Swiglu,torch.bfloat16,torch.bfloat16,torch.float4_e2m1fn_x2,QuantType.per_1x32,1,0,32,0,,,,,,,189.7328,,76.4,19104.05,stage1,moe_cktile2stages_gemm1_256x32x256x256_1x4_16x16x32_1perCU_1x32_HasBias_swiglu,0.0%
256,64,3072,3072,128,4,ActivationType.Swiglu,torch.bfloat16,torch.bfloat16,torch.float4_e2m1fn_x2,QuantType.per_1x32,1,0,32,0,,,,,,,326.76,,44.36,11092.74,stage1,moe_cktile2stages_gemm1_256x32x256x256_1x4_16x16x32_3perCU_1x32_HasBias_swiglu,0.0%
256,64,3072,3072,128,4,ActivationType.Swiglu,torch.bfloat16,torch.bfloat16,torch.float4_e2m1fn_x2,QuantType.per_1x32,1,0,32,0,,,,,,,656.0343,,22.1,5525.12,stage1,moe_cktile2stages_gemm1_256x32x256x256_1x4_16x16x32_4perCU_1x32_HasBias_swiglu,0.0%
256,64,3072,3072,128,4,ActivationType.Swiglu,torch.bfloat16,torch.bfloat16,torch.float4_e2m1fn_x2,QuantType.per_1x32,1,0,32,0,,,,,,,108.4586,,133.65,33419.8,stage2,moe_cktile2stages_gemm2_256x32x256x256_1x4_16x16x32_2perCU_1x32_MulRoutedWeight_HasBias,5.1%
256,64,3072,3072,128,4,ActivationType.Swiglu,torch.bfloat16,torch.bfloat16,torch.float4_e2m1fn_x2,QuantType.per_1x32,1,0,32,0,,,,,,,107.9392,,134.29,33580.62,stage2,moe_cktile2stages_gemm2_256x32x256x256_1x4_16x16x32_1perCU_1x32_MulRoutedWeight_HasBias,5.1%
256,64,3072,3072,128,4,ActivationType.Swiglu,torch.bfloat16,torch.bfloat16,torch.float4_e2m1fn_x2,QuantType.per_1x32,1,0,32,0,,,,,,,176.0791,,82.32,20585.44,stage2,moe_cktile2stages_gemm2_256x32x256x256_1x4_16x16x32_3perCU_1x32_MulRoutedWeight_HasBias,5.1%
256,64,3072,3072,128,4,ActivationType.Swiglu,torch.bfloat16,torch.bfloat16,torch.float4_e2m1fn_x2,QuantType.per_1x32,1,0,32,0,,,,,,,389.6933,,37.2,9301.33,stage2,moe_cktile2stages_gemm2_256x32x256x256_1x4_16x16x32_4perCU_1x32_MulRoutedWeight_HasBias,5.1%
256,64,3072,3072,128,4,ActivationType.Swiglu,torch.bfloat16,torch.bfloat16,torch.float4_e2m1fn_x2,QuantType.per_1x32,1,0,64,0,,,,,,,301.2898,,48.11,12030.49,stage1,moe_cktile2stages_gemm1_256x64x256x256_1x4_16x16x32_1perCU_1x32_HasBias_swiglu,0.0%
256,64,3072,3072,128,4,ActivationType.Swiglu,torch.bfloat16,torch.bfloat16,torch.float4_e2m1fn_x2,QuantType.per_1x32,1,0,64,0,,,,,,,349.1577,,41.52,10381.17,stage1,moe_cktile2stages_gemm1_256x64x256x256_1x4_16x16x32_2perCU_1x32_HasBias_swiglu,0.0%
256,64,3072,3072,128,4,ActivationType.Swiglu,torch.bfloat16,torch.bfloat16,torch.float4_e2m1fn_x2,QuantType.per_1x32,1,0,64,0,,,,,,,302.4655,,47.92,11983.73,stage1,moe_cktile2stages_gemm1_256x64x256x256_1x4_16x16x32_3perCU_1x32_HasBias_swiglu,0.0%
256,64,3072,3072,128,4,ActivationType.Swiglu,torch.bfloat16,torch.bfloat16,torch.float4_e2m1fn_x2,QuantType.per_1x32,1,0,64,0,,,,,,,295.555,,49.05,12263.93,stage1,moe_cktile2stages_gemm1_256x64x256x256_1x4_16x16x32_4perCU_1x32_HasBias_swiglu,0.0%
256,64,3072,3072,128,4,ActivationType.Swiglu,torch.bfloat16,torch.bfloat16,torch.float4_e2m1fn_x2,QuantType.per_1x32,1,0,64,0,,,,,,,166.8726,,86.87,21721.15,stage2,moe_cktile2stages_gemm2_256x64x256x256_1x4_16x16x32_1perCU_1x32_MulRoutedWeight_HasBias,5.1%
256,64,3072,3072,128,4,ActivationType.Swiglu,torch.bfloat16,torch.bfloat16,torch.float4_e2m1fn_x2,QuantType.per_1x32,1,0,64,0,,,,,,,174.275,,83.18,20798.54,stage2,moe_cktile2stages_gemm2_256x64x256x256_1x4_16x16x32_2perCU_1x32_MulRoutedWeight_HasBias,5.1%
256,64,3072,3072,128,4,ActivationType.Swiglu,torch.bfloat16,torch.bfloat16,torch.float4_e2m1fn_x2,QuantType.per_1x32,1,0,64,0,,,,,,,167.1974,,86.7,21678.96,stage2,moe_cktile2stages_gemm2_256x64x256x256_1x4_16x16x32_3perCU_1x32_MulRoutedWeight_HasBias,5.1%
256,64,3072,3072,128,4,ActivationType.Swiglu,torch.bfloat16,torch.bfloat16,torch.float4_e2m1fn_x2,QuantType.per_1x32,1,0,64,0,,,,,,,162.6198,,89.14,22289.2,stage2,moe_cktile2stages_gemm2_256x64x256x256_1x4_16x16x32_4perCU_1x32_MulRoutedWeight_HasBias,5.1%
256,128,3072,512,128,4,ActivationType.Swiglu,torch.bfloat16,torch.bfloat16,torch.float4_e2m1fn_x2,QuantType.per_1x32,1,0,32,0,,,,,,,-1.0,,0.0,0.0,stage1,flydsl_moe1_afp16_wfp4_bf16_t32x256x256,100.0%
256,128,3072,512,128,4,ActivationType.Swiglu,torch.bfloat16,torch.bfloat16,torch.float4_e2m1fn_x2,QuantType.per_1x32,1,0,32,0,,,,,,,-1.0,,0.0,0.0,stage2,flydsl_moe2_afp16_wfp4_bf16_t32x128x256_atomic,100.0%
256,128,3072,512,128,4,ActivationType.Swiglu,torch.bfloat16,torch.bfloat16,torch.float4_e2m1fn_x2,QuantType.per_1x32,1,0,32,0,,,,,,,-1.0,,0.0,0.0,stage2,flydsl_moe2_afp16_wfp4_bf16_t32x128x256_reduce,100.0%
256,128,3072,512,128,4,ActivationType.Swiglu,torch.bfloat16,torch.bfloat16,torch.float4_e2m1fn_x2,QuantType.per_1x32,1,0,32,0,,,,,,,-1.0,,0.0,0.0,stage2,flydsl_moe2_afp16_wfp4_bf16_t32x256x256_atomic,100.0%
256,128,3072,512,128,4,ActivationType.Swiglu,torch.bfloat16,torch.bfloat16,torch.float4_e2m1fn_x2,QuantType.per_1x32,1,0,32,0,,,,,,,-1.0,,0.0,0.0,stage2,flydsl_moe2_afp16_wfp4_bf16_t32x256x256_reduce,100.0%
256,128,3072,512,128,4,ActivationType.Swiglu,torch.bfloat16,torch.bfloat16,torch.float4_e2m1fn_x2,QuantType.per_1x32,1,0,64,0,,,,,,,-1.0,,0.0,0.0,stage1,flydsl_moe1_afp16_wfp4_bf16_t64x256x256,100.0%
256,128,3072,512,128,4,ActivationType.Swiglu,torch.bfloat16,torch.bfloat16,torch.float4_e2m1fn_x2,QuantType.per_1x32,1,0,64,0,,,,,,,-1.0,,0.0,0.0,stage2,flydsl_moe2_afp16_wfp4_bf16_t64x128x256_atomic,100.0%
256,128,3072,512,128,4,ActivationType.Swiglu,torch.bfloat16,torch.bfloat16,torch.float4_e2m1fn_x2,QuantType.per_1x32,1,0,64,0,,,,,,,-1.0,,0.0,0.0,stage2,flydsl_moe2_afp16_wfp4_bf16_t64x128x256_reduce,100.0%
256,128,3072,512,128,4,ActivationType.Swiglu,torch.bfloat16,torch.bfloat16,torch.float4_e2m1fn_x2,QuantType.per_1x32,1,0,64,0,,,,,,,-1.0,,0.0,0.0,stage2,flydsl_moe2_afp16_wfp4_bf16_t64x256x256_atomic,100.0%
256,128,3072,512,128,4,ActivationType.Swiglu,torch.bfloat16,torch.bfloat16,torch.float4_e2m1fn_x2,QuantType.per_1x32,1,0,64,0,,,,,,,-1.0,,0.0,0.0,stage2,flydsl_moe2_afp16_wfp4_bf16_t64x256x256_reduce,100.0%
256,128,3072,512,128,4,ActivationType.Swiglu,torch.bfloat16,torch.bfloat16,torch.float4_e2m1fn_x2,QuantType.per_1x32,1,0,128,0,,,,,,,-1.0,,0.0,0.0,stage2,flydsl_moe2_afp16_wfp4_bf16_t128x128x256_atomic,100.0%
256,128,3072,512,128,4,ActivationType.Swiglu,torch.bfloat16,torch.bfloat16,torch.float4_e2m1fn_x2,QuantType.per_1x32,1,0,128,0,,,,,,,-1.0,,0.0,0.0,stage2,flydsl_moe2_afp16_wfp4_bf16_t128x128x256_reduce,100.0%
256,128,3072,512,128,4,ActivationType.Swiglu,torch.bfloat16,torch.bfloat16,torch.float4_e2m1fn_x2,QuantType.per_1x32,1,0,128,0,,,,,,,-1.0,,0.0,0.0,stage2,flydsl_moe2_afp16_wfp4_bf16_t128x256x256_atomic,100.0%
256,128,3072,512,128,4,ActivationType.Swiglu,torch.bfloat16,torch.bfloat16,torch.float4_e2m1fn_x2,QuantType.per_1x32,1,0,128,0,,,,,,,-1.0,,0.0,0.0,stage2,flydsl_moe2_afp16_wfp4_bf16_t128x256x256_reduce,100.0%
256,128,3072,512,128,4,ActivationType.Swiglu,torch.bfloat16,torch.bfloat16,torch.float4_e2m1fn_x2,QuantType.per_1x32,1,0,32,0,,,,,,,44.2655,,109.16,13680.01,stage1,moe_cktile2stages_gemm1_256x32x256x256_1x4_16x16x32_2perCU_1x32_HasBias_swiglu,0.0%
256,128,3072,512,128,4,ActivationType.Swiglu,torch.bfloat16,torch.bfloat16,torch.float4_e2m1fn_x2,QuantType.per_1x32,1,0,32,0,,,,,,,44.3091,,109.05,13666.55,stage1,moe_cktile2stages_gemm1_256x32x256x256_1x4_16x16x32_1perCU_1x32_HasBias_swiglu,0.0%
256,128,3072,512,128,4,ActivationType.Swiglu,torch.bfloat16,torch.bfloat16,torch.float4_e2m1fn_x2,QuantType.per_1x32,1,0,32,0,,,,,,,78.6848,,61.41,7695.93,stage1,moe_cktile2stages_gemm1_256x32x256x256_1x4_16x16x32_3perCU_1x32_HasBias_swiglu,0.0%
256,128,3072,512,128,4,ActivationType.Swiglu,torch.bfloat16,torch.bfloat16,torch.float4_e2m1fn_x2,QuantType.per_1x32,1,0,32,0,,,,,,,180.2557,,26.81,3359.41,stage1,moe_cktile2stages_gemm1_256x32x256x256_1x4_16x16x32_4perCU_1x32_HasBias_swiglu,0.0%
256,128,3072,512,128,4,ActivationType.Swiglu,torch.bfloat16,torch.bfloat16,torch.float4_e2m1fn_x2,QuantType.per_1x32,1,0,32,0,,,,,,,36.3031,,133.1,16680.47,stage2,moe_cktile2stages_gemm2_256x32x256x256_1x4_16x16x32_2perCU_1x32_MulRoutedWeight_HasBias,1.6%
256,128,3072,512,128,4,ActivationType.Swiglu,torch.bfloat16,torch.bfloat16,torch.float4_e2m1fn_x2,QuantType.per_1x32,1,0,32,0,,,,,,,36.6073,,131.99,16541.85,stage2,moe_cktile2stages_gemm2_256x32x256x256_1x4_16x16x32_1perCU_1x32_MulRoutedWeight_HasBias,1.6%
256,128,3072,512,128,4,ActivationType.Swiglu,torch.bfloat16,torch.bfloat16,torch.float4_e2m1fn_x2,QuantType.per_1x32,1,0,32,0,,,,,,,37.026,,130.5,16354.8,stage2,moe_cktile2stages_gemm2_256x32x256x256_1x4_16x16x32_3perCU_1x32_MulRoutedWeight_HasBias,1.6%
256,128,3072,512,128,4,ActivationType.Swiglu,torch.bfloat16,torch.bfloat16,torch.float4_e2m1fn_x2,QuantType.per_1x32,1,0,32,0,,,,,,,78.091,,61.87,7754.45,stage2,moe_cktile2stages_gemm2_256x32x256x256_1x4_16x16x32_4perCU_1x32_MulRoutedWeight_HasBias,1.5%
256,128,3072,512,128,4,ActivationType.Swiglu,torch.bfloat16,torch.bfloat16,torch.float4_e2m1fn_x2,QuantType.per_1x32,1,0,64,0,,,,,,,63.3299,,76.3,9561.88,stage1,moe_cktile2stages_gemm1_256x64x256x256_1x4_16x16x32_1perCU_1x32_HasBias_swiglu,0.0%
256,128,3072,512,128,4,ActivationType.Swiglu,torch.bfloat16,torch.bfloat16,torch.float4_e2m1fn_x2,QuantType.per_1x32,1,0,64,0,,,,,,,77.0701,,62.69,7857.17,stage1,moe_cktile2stages_gemm1_256x64x256x256_1x4_16x16x32_2perCU_1x32_HasBias_swiglu,0.0%
256,128,3072,512,128,4,ActivationType.Swiglu,torch.bfloat16,torch.bfloat16,torch.float4_e2m1fn_x2,QuantType.per_1x32,1,0,64,0,,,,,,,64.2003,,75.26,9432.24,stage1,moe_cktile2stages_gemm1_256x64x256x256_1x4_16x16x32_3perCU_1x32_HasBias_swiglu,0.0%
256,128,3072,512,128,4,ActivationType.Swiglu,torch.bfloat16,torch.bfloat16,torch.float4_e2m1fn_x2,QuantType.per_1x32,1,0,64,0,,,,,,,63.5612,,76.02,9527.08,stage1,moe_cktile2stages_gemm1_256x64x256x256_1x4_16x16x32_4perCU_1x32_HasBias_swiglu,0.0%
256,128,3072,512,128,4,ActivationType.Swiglu,torch.bfloat16,torch.bfloat16,torch.float4_e2m1fn_x2,QuantType.per_1x32,1,0,64,0,,,,,,,63.3617,,76.26,9557.08,stage2,moe_cktile2stages_gemm2_256x64x256x256_1x4_16x16x32_1perCU_1x32_MulRoutedWeight_HasBias,1.6%
256,128,3072,512,128,4,ActivationType.Swiglu,torch.bfloat16,torch.bfloat16,torch.float4_e2m1fn_x2,QuantType.per_1x32,1,0,64,0,,,,,,,46.1506,,104.7,13121.23,stage2,moe_cktile2stages_gemm2_256x64x256x256_1x4_16x16x32_2perCU_1x32_MulRoutedWeight_HasBias,1.5%
256,128,3072,512,128,4,ActivationType.Swiglu,torch.bfloat16,torch.bfloat16,torch.float4_e2m1fn_x2,QuantType.per_1x32,1,0,64,0,,,,,,,62.9605,,76.74,9617.98,stage2,moe_cktile2stages_gemm2_256x64x256x256_1x4_16x16x32_3perCU_1x32_MulRoutedWeight_HasBias,1.5%
256,128,3072,512,128,4,ActivationType.Swiglu,torch.bfloat16,torch.bfloat16,torch.float4_e2m1fn_x2,QuantType.per_1x32,1,0,64,0,,,,,,,63.0289,,76.66,9607.54,stage2,moe_cktile2stages_gemm2_256x64x256x256_1x4_16x16x32_4perCU_1x32_MulRoutedWeight_HasBias,1.5%
256,128,3072,1536,128,4,ActivationType.Swiglu,torch.bfloat16,torch.bfloat16,torch.float4_e2m1fn_x2,QuantType.per_1x32,1,0,32,0,,,,,,,-1.0,,0.0,0.0,stage1,flydsl_moe1_afp16_wfp4_bf16_t32x256x256,100.0%
256,128,3072,1536,128,4,ActivationType.Swiglu,torch.bfloat16,torch.bfloat16,torch.float4_e2m1fn_x2,QuantType.per_1x32,1,0,32,0,,,,,,,-1.0,,0.0,0.0,stage2,flydsl_moe2_afp16_wfp4_bf16_t32x128x256_atomic,100.0%
256,128,3072,1536,128,4,ActivationType.Swiglu,torch.bfloat16,torch.bfloat16,torch.float4_e2m1fn_x2,QuantType.per_1x32,1,0,32,0,,,,,,,-1.0,,0.0,0.0,stage2,flydsl_moe2_afp16_wfp4_bf16_t32x128x256_reduce,100.0%
256,128,3072,1536,128,4,ActivationType.Swiglu,torch.bfloat16,torch.bfloat16,torch.float4_e2m1fn_x2,QuantType.per_1x32,1,0,32,0,,,,,,,-1.0,,0.0,0.0,stage2,flydsl_moe2_afp16_wfp4_bf16_t32x256x256_atomic,100.0%
256,128,3072,1536,128,4,ActivationType.Swiglu,torch.bfloat16,torch.bfloat16,torch.float4_e2m1fn_x2,QuantType.per_1x32,1,0,32,0,,,,,,,-1.0,,0.0,0.0,stage2,flydsl_moe2_afp16_wfp4_bf16_t32x256x256_reduce,100.0%
256,128,3072,1536,128,4,ActivationType.Swiglu,torch.bfloat16,torch.bfloat16,torch.float4_e2m1fn_x2,QuantType.per_1x32,1,0,64,0,,,,,,,-1.0,,0.0,0.0,stage1,flydsl_moe1_afp16_wfp4_bf16_t64x256x256,100.0%
256,128,3072,1536,128,4,ActivationType.Swiglu,torch.bfloat16,torch.bfloat16,torch.float4_e2m1fn_x2,QuantType.per_1x32,1,0,64,0,,,,,,,-1.0,,0.0,0.0,stage2,flydsl_moe2_afp16_wfp4_bf16_t64x128x256_atomic,100.0%
256,128,3072,1536,128,4,ActivationType.Swiglu,torch.bfloat16,torch.bfloat16,torch.float4_e2m1fn_x2,QuantType.per_1x32,1,0,64,0,,,,,,,-1.0,,0.0,0.0,stage2,flydsl_moe2_afp16_wfp4_bf16_t64x128x256_reduce,100.0%
256,128,3072,1536,128,4,ActivationType.Swiglu,torch.bfloat16,torch.bfloat16,torch.float4_e2m1fn_x2,QuantType.per_1x32,1,0,64,0,,,,,,,-1.0,,0.0,0.0,stage2,flydsl_moe2_afp16_wfp4_bf16_t64x256x256_atomic,100.0%
256,128,3072,1536,128,4,ActivationType.Swiglu,torch.bfloat16,torch.bfloat16,torch.float4_e2m1fn_x2,QuantType.per_1x32,1,0,64,0,,,,,,,-1.0,,0.0,0.0,stage2,flydsl_moe2_afp16_wfp4_bf16_t64x256x256_reduce,100.0%
256,128,3072,1536,128,4,ActivationType.Swiglu,torch.bfloat16,torch.bfloat16,torch.float4_e2m1fn_x2,QuantType.per_1x32,1,0,128,0,,,,,,,-1.0,,0.0,0.0,stage2,flydsl_moe2_afp16_wfp4_bf16_t128x128x256_atomic,100.0%
256,128,3072,1536,128,4,ActivationType.Swiglu,torch.bfloat16,torch.bfloat16,torch.float4_e2m1fn_x2,QuantType.per_1x32,1,0,128,0,,,,,,,-1.0,,0.0,0.0,stage2,flydsl_moe2_afp16_wfp4_bf16_t128x128x256_reduce,100.0%
256,128,3072,1536,128,4,ActivationType.Swiglu,torch.bfloat16,torch.bfloat16,torch.float4_e2m1fn_x2,QuantType.per_1x32,1,0,128,0,,,,,,,-1.0,,0.0,0.0,stage2,flydsl_moe2_afp16_wfp4_bf16_t128x256x256_atomic,100.0%
256,128,3072,1536,128,4,ActivationType.Swiglu,torch.bfloat16,torch.bfloat16,torch.float4_e2m1fn_x2,QuantType.per_1x32,1,0,128,0,,,,,,,-1.0,,0.0,0.0,stage2,flydsl_moe2_afp16_wfp4_bf16_t128x256x256_reduce,100.0%
256,128,3072,1536,128,4,ActivationType.Swiglu,torch.bfloat16,torch.bfloat16,torch.float4_e2m1fn_x2,QuantType.per_1x32,1,0,32,0,,,,,,,113.1344,,128.13,16029.72,stage1,moe_cktile2stages_gemm1_256x32x256x256_1x4_16x16x32_2perCU_1x32_HasBias_swiglu,0.0%
256,128,3072,1536,128,4,ActivationType.Swiglu,torch.bfloat16,torch.bfloat16,torch.float4_e2m1fn_x2,QuantType.per_1x32,1,0,32,0,,,,,,,115.5371,,125.46,15696.36,stage1,moe_cktile2stages_gemm1_256x32x256x256_1x4_16x16x32_1perCU_1x32_HasBias_swiglu,0.0%
256,128,3072,1536,128,4,ActivationType.Swiglu,torch.bfloat16,torch.bfloat16,torch.float4_e2m1fn_x2,QuantType.per_1x32,1,0,32,0,,,,,,,180.1841,,80.45,10064.77,stage1,moe_cktile2stages_gemm1_256x32x256x256_1x4_16x16x32_3perCU_1x32_HasBias_swiglu,0.0%
256,128,3072,1536,128,4,ActivationType.Swiglu,torch.bfloat16,torch.bfloat16,torch.float4_e2m1fn_x2,QuantType.per_1x32,1,0,32,0,,,,,,,415.2328,,34.91,4367.46,stage1,moe_cktile2stages_gemm1_256x32x256x256_1x4_16x16x32_4perCU_1x32_HasBias_swiglu,0.0%
256,128,3072,1536,128,4,ActivationType.Swiglu,torch.bfloat16,torch.bfloat16,torch.float4_e2m1fn_x2,QuantType.per_1x32,1,0,32,0,,,,,,,68.503,,211.6,26473.47,stage2,moe_cktile2stages_gemm2_256x32x256x256_1x4_16x16x32_2perCU_1x32_MulRoutedWeight_HasBias,3.7%
256,128,3072,1536,128,4,ActivationType.Swiglu,torch.bfloat16,torch.bfloat16,torch.float4_e2m1fn_x2,QuantType.per_1x32,1,0,32,0,,,,,,,70.7928,,204.76,25617.18,stage2,moe_cktile2stages_gemm2_256x32x256x256_1x4_16x16x32_1perCU_1x32_MulRoutedWeight_HasBias,3.7%
256,128,3072,1536,128,4,ActivationType.Swiglu,torch.bfloat16,torch.bfloat16,torch.float4_e2m1fn_x2,QuantType.per_1x32,1,0,32,0,,,,,,,105.8527,,136.94,17132.41,stage2,moe_cktile2stages_gemm2_256x32x256x256_1x4_16x16x32_3perCU_1x32_MulRoutedWeight_HasBias,3.7%
256,128,3072,1536,128,4,ActivationType.Swiglu,torch.bfloat16,torch.bfloat16,torch.float4_e2m1fn_x2,QuantType.per_1x32,1,0,32,0,,,,,,,223.0245,,65.0,8131.45,stage2,moe_cktile2stages_gemm2_256x32x256x256_1x4_16x16x32_4perCU_1x32_MulRoutedWeight_HasBias,3.7%
256,128,3072,1536,128,4,ActivationType.Swiglu,torch.bfloat16,torch.bfloat16,torch.float4_e2m1fn_x2,QuantType.per_1x32,1,0,64,0,,,,,,,172.9647,,83.81,10484.87,stage1,moe_cktile2stages_gemm1_256x64x256x256_1x4_16x16x32_1perCU_1x32_HasBias_swiglu,0.0%
256,128,3072,1536,128,4,ActivationType.Swiglu,torch.bfloat16,torch.bfloat16,torch.float4_e2m1fn_x2,QuantType.per_1x32,1,0,64,0,,,,,,,198.0006,,73.21,9159.12,stage1,moe_cktile2stages_gemm1_256x64x256x256_1x4_16x16x32_2perCU_1x32_HasBias_swiglu,0.0%
256,128,3072,1536,128,4,ActivationType.Swiglu,torch.bfloat16,torch.bfloat16,torch.float4_e2m1fn_x2,QuantType.per_1x32,1,0,64,0,,,,,,,169.7695,,85.38,10682.2,stage1,moe_cktile2stages_gemm1_256x64x256x256_1x4_16x16x32_3perCU_1x32_HasBias_swiglu,0.0%
256,128,3072,1536,128,4,ActivationType.Swiglu,torch.bfloat16,torch.bfloat16,torch.float4_e2m1fn_x2,QuantType.per_1x32,1,0,64,0,,,,,,,174.4488,,83.09,10395.67,stage1,moe_cktile2stages_gemm1_256x64x256x256_1x4_16x16x32_4perCU_1x32_HasBias_swiglu,0.0%
256,128,3072,1536,128,4,ActivationType.Swiglu,torch.bfloat16,torch.bfloat16,torch.float4_e2m1fn_x2,QuantType.per_1x32,1,0,64,0,,,,,,,108.0984,,134.1,16776.49,stage2,moe_cktile2stages_gemm2_256x64x256x256_1x4_16x16x32_1perCU_1x32_MulRoutedWeight_HasBias,3.7%
256,128,3072,1536,128,4,ActivationType.Swiglu,torch.bfloat16,torch.bfloat16,torch.float4_e2m1fn_x2,QuantType.per_1x32,1,0,64,0,,,,,,,106.6227,,135.95,17008.69,stage2,moe_cktile2stages_gemm2_256x64x256x256_1x4_16x16x32_2perCU_1x32_MulRoutedWeight_HasBias,3.7%
256,128,3072,1536,128,4,ActivationType.Swiglu,torch.bfloat16,torch.bfloat16,torch.float4_e2m1fn_x2,QuantType.per_1x32,1,0,64,0,,,,,,,109.5671,,132.3,16551.61,stage2,moe_cktile2stages_gemm2_256x64x256x256_1x4_16x16x32_3perCU_1x32_MulRoutedWeight_HasBias,3.7%
256,128,3072,1536,128,4,ActivationType.Swiglu,torch.bfloat16,torch.bfloat16,torch.float4_e2m1fn_x2,QuantType.per_1x32,1,0,64,0,,,,,,,105.8331,,136.97,17135.59,stage2,moe_cktile2stages_gemm2_256x64x256x256_1x4_16x16x32_4perCU_1x32_MulRoutedWeight_HasBias,3.7%
256,128,3072,3072,128,4,ActivationType.Swiglu,torch.bfloat16,torch.bfloat16,torch.float4_e2m1fn_x2,QuantType.per_1x32,1,0,32,0,,,,,,,-1.0,,0.0,0.0,stage1,flydsl_moe1_afp16_wfp4_bf16_t32x256x256,100.0%
256,128,3072,3072,128,4,ActivationType.Swiglu,torch.bfloat16,torch.bfloat16,torch.float4_e2m1fn_x2,QuantType.per_1x32,1,0,32,0,,,,,,,-1.0,,0.0,0.0,stage2,flydsl_moe2_afp16_wfp4_bf16_t32x128x256_atomic,100.0%
256,128,3072,3072,128,4,ActivationType.Swiglu,torch.bfloat16,torch.bfloat16,torch.float4_e2m1fn_x2,QuantType.per_1x32,1,0,32,0,,,,,,,-1.0,,0.0,0.0,stage2,flydsl_moe2_afp16_wfp4_bf16_t32x128x256_reduce,100.0%
256,128,3072,3072,128,4,ActivationType.Swiglu,torch.bfloat16,torch.bfloat16,torch.float4_e2m1fn_x2,QuantType.per_1x32,1,0,32,0,,,,,,,-1.0,,0.0,0.0,stage2,flydsl_moe2_afp16_wfp4_bf16_t32x256x256_atomic,100.0%
256,128,3072,3072,128,4,ActivationType.Swiglu,torch.bfloat16,torch.bfloat16,torch.float4_e2m1fn_x2,QuantType.per_1x32,1,0,32,0,,,,,,,-1.0,,0.0,0.0,stage2,flydsl_moe2_afp16_wfp4_bf16_t32x256x256_reduce,100.0%
256,128,3072,3072,128,4,ActivationType.Swiglu,torch.bfloat16,torch.bfloat16,torch.float4_e2m1fn_x2,QuantType.per_1x32,1,0,64,0,,,,,,,-1.0,,0.0,0.0,stage1,flydsl_moe1_afp16_wfp4_bf16_t64x256x256,100.0%
256,128,3072,3072,128,4,ActivationType.Swiglu,torch.bfloat16,torch.bfloat16,torch.float4_e2m1fn_x2,QuantType.per_1x32,1,0,64,0,,,,,,,-1.0,,0.0,0.0,stage2,flydsl_moe2_afp16_wfp4_bf16_t64x128x256_atomic,100.0%
256,128,3072,3072,128,4,ActivationType.Swiglu,torch.bfloat16,torch.bfloat16,torch.float4_e2m1fn_x2,QuantType.per_1x32,1,0,64,0,,,,,,,-1.0,,0.0,0.0,stage2,flydsl_moe2_afp16_wfp4_bf16_t64x128x256_reduce,100.0%
256,128,3072,3072,128,4,ActivationType.Swiglu,torch.bfloat16,torch.bfloat16,torch.float4_e2m1fn_x2,QuantType.per_1x32,1,0,64,0,,,,,,,-1.0,,0.0,0.0,stage2,flydsl_moe2_afp16_wfp4_bf16_t64x256x256_atomic,100.0%
256,128,3072,3072,128,4,ActivationType.Swiglu,torch.bfloat16,torch.bfloat16,torch.float4_e2m1fn_x2,QuantType.per_1x32,1,0,64,0,,,,,,,-1.0,,0.0,0.0,stage2,flydsl_moe2_afp16_wfp4_bf16_t64x256x256_reduce,100.0%
256,128,3072,3072,128,4,ActivationType.Swiglu,torch.bfloat16,torch.bfloat16,torch.float4_e2m1fn_x2,QuantType.per_1x32,1,0,128,0,,,,,,,-1.0,,0.0,0.0,stage2,flydsl_moe2_afp16_wfp4_bf16_t128x128x256_atomic,100.0%
256,128,3072,3072,128,4,ActivationType.Swiglu,torch.bfloat16,torch.bfloat16,torch.float4_e2m1fn_x2,QuantType.per_1x32,1,0,128,0,,,,,,,-1.0,,0.0,0.0,stage2,flydsl_moe2_afp16_wfp4_bf16_t128x128x256_reduce,100.0%
256,128,3072,3072,128,4,ActivationType.Swiglu,torch.bfloat16,torch.bfloat16,torch.float4_e2m1fn_x2,QuantType.per_1x32,1,0,128,0,,,,,,,-1.0,,0.0,0.0,stage2,flydsl_moe2_afp16_wfp4_bf16_t128x256x256_atomic,100.0%
256,128,3072,3072,128,4,ActivationType.Swiglu,torch.bfloat16,torch.bfloat16,torch.float4_e2m1fn_x2,QuantType.per_1x32,1,0,128,0,,,,,,,-1.0,,0.0,0.0,stage2,flydsl_moe2_afp16_wfp4_bf16_t128x256x256_reduce,100.0%
256,128,3072,3072,128,4,ActivationType.Swiglu,torch.bfloat16,torch.bfloat16,torch.float4_e2m1fn_x2,QuantType.per_1x32,1,0,32,0,,,,,,,207.2096,,139.91,17496.54,stage1,moe_cktile2stages_gemm1_256x32x256x256_1x4_16x16x32_2perCU_1x32_HasBias_swiglu,0.0%
256,128,3072,3072,128,4,ActivationType.Swiglu,torch.bfloat16,torch.bfloat16,torch.float4_e2m1fn_x2,QuantType.per_1x32,1,0,32,0,,,,,,,208.1341,,139.29,17418.83,stage1,moe_cktile2stages_gemm1_256x32x256x256_1x4_16x16x32_1perCU_1x32_HasBias_swiglu,0.0%
256,128,3072,3072,128,4,ActivationType.Swiglu,torch.bfloat16,torch.bfloat16,torch.float4_e2m1fn_x2,QuantType.per_1x32,1,0,32,0,,,,,,,340.0268,,85.26,10662.25,stage1,moe_cktile2stages_gemm1_256x32x256x256_1x4_16x16x32_3perCU_1x32_HasBias_swiglu,0.0%
256,128,3072,3072,128,4,ActivationType.Swiglu,torch.bfloat16,torch.bfloat16,torch.float4_e2m1fn_x2,QuantType.per_1x32,1,0,32,0,,,,,,,682.9129,,42.45,5308.81,stage1,moe_cktile2stages_gemm1_256x32x256x256_1x4_16x16x32_4perCU_1x32_HasBias_swiglu,0.0%
256,128,3072,3072,128,4,ActivationType.Swiglu,torch.bfloat16,torch.bfloat16,torch.float4_e2m1fn_x2,QuantType.per_1x32,1,0,32,0,,,,,,,113.0333,,256.48,32074.19,stage2,moe_cktile2stages_gemm2_256x32x256x256_1x4_16x16x32_2perCU_1x32_MulRoutedWeight_HasBias,5.0%
256,128,3072,3072,128,4,ActivationType.Swiglu,torch.bfloat16,torch.bfloat16,torch.float4_e2m1fn_x2,QuantType.per_1x32,1,0,32,0,,,,,,,114.5846,,253.01,31639.95,stage2,moe_cktile2stages_gemm2_256x32x256x256_1x4_16x16x32_1perCU_1x32_MulRoutedWeight_HasBias,5.0%
256,128,3072,3072,128,4,ActivationType.Swiglu,torch.bfloat16,torch.bfloat16,torch.float4_e2m1fn_x2,QuantType.per_1x32,1,0,32,0,,,,,,,180.8607,,160.29,20045.55,stage2,moe_cktile2stages_gemm2_256x32x256x256_1x4_16x16x32_3perCU_1x32_MulRoutedWeight_HasBias,5.0%
256,128,3072,3072,128,4,ActivationType.Swiglu,torch.bfloat16,torch.bfloat16,torch.float4_e2m1fn_x2,QuantType.per_1x32,1,0,32,0,,,,,,,411.451,,70.46,8811.38,stage2,moe_cktile2stages_gemm2_256x32x256x256_1x4_16x16x32_4perCU_1x32_MulRoutedWeight_HasBias,5.0%
256,128,3072,3072,128,4,ActivationType.Swiglu,torch.bfloat16,torch.bfloat16,torch.float4_e2m1fn_x2,QuantType.per_1x32,1,0,64,0,,,,,,,329.2752,,88.04,11010.4,stage1,moe_cktile2stages_gemm1_256x64x256x256_1x4_16x16x32_1perCU_1x32_HasBias_swiglu,0.0%
256,128,3072,3072,128,4,ActivationType.Swiglu,torch.bfloat16,torch.bfloat16,torch.float4_e2m1fn_x2,QuantType.per_1x32,1,0,64,0,,,,,,,376.4798,,77.01,9629.87,stage1,moe_cktile2stages_gemm1_256x64x256x256_1x4_16x16x32_2perCU_1x32_HasBias_swiglu,0.0%
256,128,3072,3072,128,4,ActivationType.Swiglu,torch.bfloat16,torch.bfloat16,torch.float4_e2m1fn_x2,QuantType.per_1x32,1,0,64,0,,,,,,,330.738,,87.66,10961.7,stage1,moe_cktile2stages_gemm1_256x64x256x256_1x4_16x16x32_3perCU_1x32_HasBias_swiglu,0.0%
256,128,3072,3072,128,4,ActivationType.Swiglu,torch.bfloat16,torch.bfloat16,torch.float4_e2m1fn_x2,QuantType.per_1x32,1,0,64,0,,,,,,,325.0731,,89.18,11152.73,stage1,moe_cktile2stages_gemm1_256x64x256x256_1x4_16x16x32_4perCU_1x32_HasBias_swiglu,0.0%
256,128,3072,3072,128,4,ActivationType.Swiglu,torch.bfloat16,torch.bfloat16,torch.float4_e2m1fn_x2,QuantType.per_1x32,1,0,64,0,,,,,,,173.9602,,166.65,20840.7,stage2,moe_cktile2stages_gemm2_256x64x256x256_1x4_16x16x32_1perCU_1x32_MulRoutedWeight_HasBias,5.0%
256,128,3072,3072,128,4,ActivationType.Swiglu,torch.bfloat16,torch.bfloat16,torch.float4_e2m1fn_x2,QuantType.per_1x32,1,0,64,0,,,,,,,179.3751,,161.62,20211.57,stage2,moe_cktile2stages_gemm2_256x64x256x256_1x4_16x16x32_2perCU_1x32_MulRoutedWeight_HasBias,5.0%
256,128,3072,3072,128,4,ActivationType.Swiglu,torch.bfloat16,torch.bfloat16,torch.float4_e2m1fn_x2,QuantType.per_1x32,1,0,64,0,,,,,,,174.191,,166.43,20813.08,stage2,moe_cktile2stages_gemm2_256x64x256x256_1x4_16x16x32_3perCU_1x32_MulRoutedWeight_HasBias,5.0%
256,128,3072,3072,128,4,ActivationType.Swiglu,torch.bfloat16,torch.bfloat16,torch.float4_e2m1fn_x2,QuantType.per_1x32,1,0,64,0,,,,,,,170.3918,,170.14,21277.15,stage2,moe_cktile2stages_gemm2_256x64x256x256_1x4_16x16x32_4perCU_1x32_MulRoutedWeight_HasBias,5.0%
256,256,3072,512,128,4,ActivationType.Swiglu,torch.bfloat16,torch.bfloat16,torch.float4_e2m1fn_x2,QuantType.per_1x32,1,0,32,0,,,,,,,-1.0,,0.0,0.0,stage1,flydsl_moe1_afp16_wfp4_bf16_t32x256x256,100.0%
256,256,3072,512,128,4,ActivationType.Swiglu,torch.bfloat16,torch.bfloat16,torch.float4_e2m1fn_x2,QuantType.per_1x32,1,0,32,0,,,,,,,-1.0,,0.0,0.0,stage2,flydsl_moe2_afp16_wfp4_bf16_t32x128x256_atomic,100.0%
256,256,3072,512,128,4,ActivationType.Swiglu,torch.bfloat16,torch.bfloat16,torch.float4_e2m1fn_x2,QuantType.per_1x32,1,0,32,0,,,,,,,-1.0,,0.0,0.0,stage2,flydsl_moe2_afp16_wfp4_bf16_t32x128x256_reduce,100.0%
256,256,3072,512,128,4,ActivationType.Swiglu,torch.bfloat16,torch.bfloat16,torch.float4_e2m1fn_x2,QuantType.per_1x32,1,0,32,0,,,,,,,-1.0,,0.0,0.0,stage2,flydsl_moe2_afp16_wfp4_bf16_t32x256x256_atomic,100.0%
256,256,3072,512,128,4,ActivationType.Swiglu,torch.bfloat16,torch.bfloat16,torch.float4_e2m1fn_x2,QuantType.per_1x32,1,0,32,0,,,,,,,-1.0,,0.0,0.0,stage2,flydsl_moe2_afp16_wfp4_bf16_t32x256x256_reduce,100.0%
256,256,3072,512,128,4,ActivationType.Swiglu,torch.bfloat16,torch.bfloat16,torch.float4_e2m1fn_x2,QuantType.per_1x32,1,0,64,0,,,,,,,-1.0,,0.0,0.0,stage1,flydsl_moe1_afp16_wfp4_bf16_t64x256x256,100.0%
256,256,3072,512,128,4,ActivationType.Swiglu,torch.bfloat16,torch.bfloat16,torch.float4_e2m1fn_x2,QuantType.per_1x32,1,0,64,0,,,,,,,-1.0,,0.0,0.0,stage2,flydsl_moe2_afp16_wfp4_bf16_t64x128x256_atomic,100.0%
256,256,3072,512,128,4,ActivationType.Swiglu,torch.bfloat16,torch.bfloat16,torch.float4_e2m1fn_x2,QuantType.per_1x32,1,0,64,0,,,,,,,-1.0,,0.0,0.0,stage2,flydsl_moe2_afp16_wfp4_bf16_t64x128x256_reduce,100.0%
256,256,3072,512,128,4,ActivationType.Swiglu,torch.bfloat16,torch.bfloat16,torch.float4_e2m1fn_x2,QuantType.per_1x32,1,0,64,0,,,,,,,-1.0,,0.0,0.0,stage2,flydsl_moe2_afp16_wfp4_bf16_t64x256x256_atomic,100.0%
256,256,3072,512,128,4,ActivationType.Swiglu,torch.bfloat16,torch.bfloat16,torch.float4_e2m1fn_x2,QuantType.per_1x32,1,0,64,0,,,,,,,-1.0,,0.0,0.0,stage2,flydsl_moe2_afp16_wfp4_bf16_t64x256x256_reduce,100.0%
256,256,3072,512,128,4,ActivationType.Swiglu,torch.bfloat16,torch.bfloat16,torch.float4_e2m1fn_x2,QuantType.per_1x32,1,0,128,0,,,,,,,-1.0,,0.0,0.0,stage2,flydsl_moe2_afp16_wfp4_bf16_t128x128x256_atomic,100.0%
256,256,3072,512,128,4,ActivationType.Swiglu,torch.bfloat16,torch.bfloat16,torch.float4_e2m1fn_x2,QuantType.per_1x32,1,0,128,0,,,,,,,-1.0,,0.0,0.0,stage2,flydsl_moe2_afp16_wfp4_bf16_t128x128x256_reduce,100.0%
256,256,3072,512,128,4,ActivationType.Swiglu,torch.bfloat16,torch.bfloat16,torch.float4_e2m1fn_x2,QuantType.per_1x32,1,0,128,0,,,,,,,-1.0,,0.0,0.0,stage2,flydsl_moe2_afp16_wfp4_bf16_t128x256x256_atomic,100.0%
256,256,3072,512,128,4,ActivationType.Swiglu,torch.bfloat16,torch.bfloat16,torch.float4_e2m1fn_x2,QuantType.per_1x32,1,0,128,0,,,,,,,-1.0,,0.0,0.0,stage2,flydsl_moe2_afp16_wfp4_bf16_t128x256x256_reduce,100.0%
256,256,3072,512,128,4,ActivationType.Swiglu,torch.bfloat16,torch.bfloat16,torch.float4_e2m1fn_x2,QuantType.per_1x32,1,0,32,0,,,,,,,44.6043,,216.65,13611.37,stage1,moe_cktile2stages_gemm1_256x32x256x256_1x4_16x16x32_2perCU_1x32_HasBias_swiglu,0.0%
256,256,3072,512,128,4,ActivationType.Swiglu,torch.bfloat16,torch.bfloat16,torch.float4_e2m1fn_x2,QuantType.per_1x32,1,0,32,0,,,,,,,43.9785,,219.74,13805.05,stage1,moe_cktile2stages_gemm1_256x32x256x256_1x4_16x16x32_1perCU_1x32_HasBias_swiglu,0.0%
256,256,3072,512,128,4,ActivationType.Swiglu,torch.bfloat16,torch.bfloat16,torch.float4_e2m1fn_x2,QuantType.per_1x32,1,0,32,0,,,,,,,80.086,,120.67,7580.92,stage1,moe_cktile2stages_gemm1_256x32x256x256_1x4_16x16x32_3perCU_1x32_HasBias_swiglu,0.0%
256,256,3072,512,128,4,ActivationType.Swiglu,torch.bfloat16,torch.bfloat16,torch.float4_e2m1fn_x2,QuantType.per_1x32,1,0,32,0,,,,,,,181.4232,,53.27,3346.46,stage1,moe_cktile2stages_gemm1_256x32x256x256_1x4_16x16x32_4perCU_1x32_HasBias_swiglu,0.0%
256,256,3072,512,128,4,ActivationType.Swiglu,torch.bfloat16,torch.bfloat16,torch.float4_e2m1fn_x2,QuantType.per_1x32,1,0,32,0,,,,,,,36.3279,,266.01,16712.38,stage2,moe_cktile2stages_gemm2_256x32x256x256_1x4_16x16x32_2perCU_1x32_MulRoutedWeight_HasBias,1.5%
256,256,3072,512,128,4,ActivationType.Swiglu,torch.bfloat16,torch.bfloat16,torch.float4_e2m1fn_x2,QuantType.per_1x32,1,0,32,0,,,,,,,36.3822,,265.62,16687.43,stage2,moe_cktile2stages_gemm2_256x32x256x256_1x4_16x16x32_1perCU_1x32_MulRoutedWeight_HasBias,1.5%
256,256,3072,512,128,4,ActivationType.Swiglu,torch.bfloat16,torch.bfloat16,torch.float4_e2m1fn_x2,QuantType.per_1x32,1,0,32,0,,,,,,,37.4165,,258.27,16226.14,stage2,moe_cktile2stages_gemm2_256x32x256x256_1x4_16x16x32_3perCU_1x32_MulRoutedWeight_HasBias,1.5%
256,256,3072,512,128,4,ActivationType.Swiglu,torch.bfloat16,torch.bfloat16,torch.float4_e2m1fn_x2,QuantType.per_1x32,1,0,32,0,,,,,,,78.7875,,122.65,7705.86,stage2,moe_cktile2stages_gemm2_256x32x256x256_1x4_16x16x32_4perCU_1x32_MulRoutedWeight_HasBias,1.5%
256,256,3072,512,128,4,ActivationType.Swiglu,torch.bfloat16,torch.bfloat16,torch.float4_e2m1fn_x2,QuantType.per_1x32,1,0,64,0,,,,,,,62.3207,,155.06,9741.96,stage1,moe_cktile2stages_gemm1_256x64x256x256_1x4_16x16x32_1perCU_1x32_HasBias_swiglu,0.0%
256,256,3072,512,128,4,ActivationType.Swiglu,torch.bfloat16,torch.bfloat16,torch.float4_e2m1fn_x2,QuantType.per_1x32,1,0,64,0,,,,,,,77.7308,,124.32,7810.62,stage1,moe_cktile2stages_gemm1_256x64x256x256_1x4_16x16x32_2perCU_1x32_HasBias_swiglu,0.0%
256,256,3072,512,128,4,ActivationType.Swiglu,torch.bfloat16,torch.bfloat16,torch.float4_e2m1fn_x2,QuantType.per_1x32,1,0,64,0,,,,,,,64.4835,,149.86,9415.21,stage1,moe_cktile2stages_gemm1_256x64x256x256_1x4_16x16x32_3perCU_1x32_HasBias_swiglu,0.0%
256,256,3072,512,128,4,ActivationType.Swiglu,torch.bfloat16,torch.bfloat16,torch.float4_e2m1fn_x2,QuantType.per_1x32,1,0,64,0,,,,,,,64.5883,,149.62,9399.93,stage1,moe_cktile2stages_gemm1_256x64x256x256_1x4_16x16x32_4perCU_1x32_HasBias_swiglu,0.0%
256,256,3072,512,128,4,ActivationType.Swiglu,torch.bfloat16,torch.bfloat16,torch.float4_e2m1fn_x2,QuantType.per_1x32,1,0,64,0,,,,,,,63.9169,,151.19,9498.67,stage2,moe_cktile2stages_gemm2_256x64x256x256_1x4_16x16x32_1perCU_1x32_MulRoutedWeight_HasBias,1.5%
256,256,3072,512,128,4,ActivationType.Swiglu,torch.bfloat16,torch.bfloat16,torch.float4_e2m1fn_x2,QuantType.per_1x32,1,0,64,0,,,,,,,47.2265,,204.62,12855.61,stage2,moe_cktile2stages_gemm2_256x64x256x256_1x4_16x16x32_2perCU_1x32_MulRoutedWeight_HasBias,1.5%
256,256,3072,512,128,4,ActivationType.Swiglu,torch.bfloat16,torch.bfloat16,torch.float4_e2m1fn_x2,QuantType.per_1x32,1,0,64,0,,,,,,,63.6987,,151.71,9531.21,stage2,moe_cktile2stages_gemm2_256x64x256x256_1x4_16x16x32_3perCU_1x32_MulRoutedWeight_HasBias,1.5%
256,256,3072,512,128,4,ActivationType.Swiglu,torch.bfloat16,torch.bfloat16,torch.float4_e2m1fn_x2,QuantType.per_1x32,1,0,64,0,,,,,,,64.3614,,150.15,9433.07,stage2,moe_cktile2stages_gemm2_256x64x256x256_1x4_16x16x32_4perCU_1x32_MulRoutedWeight_HasBias,1.5%
256,256,3072,1536,128,4,ActivationType.Swiglu,torch.bfloat16,torch.bfloat16,torch.float4_e2m1fn_x2,QuantType.per_1x32,1,0,32,0,,,,,,,-1.0,,0.0,0.0,stage1,flydsl_moe1_afp16_wfp4_bf16_t32x256x256,100.0%
256,256,3072,1536,128,4,ActivationType.Swiglu,torch.bfloat16,torch.bfloat16,torch.float4_e2m1fn_x2,QuantType.per_1x32,1,0,32,0,,,,,,,-1.0,,0.0,0.0,stage2,flydsl_moe2_afp16_wfp4_bf16_t32x128x256_atomic,100.0%
256,256,3072,1536,128,4,ActivationType.Swiglu,torch.bfloat16,torch.bfloat16,torch.float4_e2m1fn_x2,QuantType.per_1x32,1,0,32,0,,,,,,,-1.0,,0.0,0.0,stage2,flydsl_moe2_afp16_wfp4_bf16_t32x128x256_reduce,100.0%
256,256,3072,1536,128,4,ActivationType.Swiglu,torch.bfloat16,torch.bfloat16,torch.float4_e2m1fn_x2,QuantType.per_1x32,1,0,32,0,,,,,,,-1.0,,0.0,0.0,stage2,flydsl_moe2_afp16_wfp4_bf16_t32x256x256_atomic,100.0%
256,256,3072,1536,128,4,ActivationType.Swiglu,torch.bfloat16,torch.bfloat16,torch.float4_e2m1fn_x2,QuantType.per_1x32,1,0,32,0,,,,,,,-1.0,,0.0,0.0,stage2,flydsl_moe2_afp16_wfp4_bf16_t32x256x256_reduce,100.0%
256,256,3072,1536,128,4,ActivationType.Swiglu,torch.bfloat16,torch.bfloat16,torch.float4_e2m1fn_x2,QuantType.per_1x32,1,0,64,0,,,,,,,-1.0,,0.0,0.0,stage1,flydsl_moe1_afp16_wfp4_bf16_t64x256x256,100.0%
256,256,3072,1536,128,4,ActivationType.Swiglu,torch.bfloat16,torch.bfloat16,torch.float4_e2m1fn_x2,QuantType.per_1x32,1,0,64,0,,,,,,,-1.0,,0.0,0.0,stage2,flydsl_moe2_afp16_wfp4_bf16_t64x128x256_atomic,100.0%
256,256,3072,1536,128,4,ActivationType.Swiglu,torch.bfloat16,torch.bfloat16,torch.float4_e2m1fn_x2,QuantType.per_1x32,1,0,64,0,,,,,,,-1.0,,0.0,0.0,stage2,flydsl_moe2_afp16_wfp4_bf16_t64x128x256_reduce,100.0%
256,256,3072,1536,128,4,ActivationType.Swiglu,torch.bfloat16,torch.bfloat16,torch.float4_e2m1fn_x2,QuantType.per_1x32,1,0,64,0,,,,,,,-1.0,,0.0,0.0,stage2,flydsl_moe2_afp16_wfp4_bf16_t64x256x256_atomic,100.0%
256,256,3072,1536,128,4,ActivationType.Swiglu,torch.bfloat16,torch.bfloat16,torch.float4_e2m1fn_x2,QuantType.per_1x32,1,0,64,0,,,,,,,-1.0,,0.0,0.0,stage2,flydsl_moe2_afp16_wfp4_bf16_t64x256x256_reduce,100.0%
256,256,3072,1536,128,4,ActivationType.Swiglu,torch.bfloat16,torch.bfloat16,torch.float4_e2m1fn_x2,QuantType.per_1x32,1,0,128,0,,,,,,,-1.0,,0.0,0.0,stage2,flydsl_moe2_afp16_wfp4_bf16_t128x128x256_atomic,100.0%
256,256,3072,1536,128,4,ActivationType.Swiglu,torch.bfloat16,torch.bfloat16,torch.float4_e2m1fn_x2,QuantType.per_1x32,1,0,128,0,,,,,,,-1.0,,0.0,0.0,stage2,flydsl_moe2_afp16_wfp4_bf16_t128x128x256_reduce,100.0%
256,256,3072,1536,128,4,ActivationType.Swiglu,torch.bfloat16,torch.bfloat16,torch.float4_e2m1fn_x2,QuantType.per_1x32,1,0,128,0,,,,,,,-1.0,,0.0,0.0,stage2,flydsl_moe2_afp16_wfp4_bf16_t128x256x256_atomic,100.0%
256,256,3072,1536,128,4,ActivationType.Swiglu,torch.bfloat16,torch.bfloat16,torch.float4_e2m1fn_x2,QuantType.per_1x32,1,0,128,0,,,,,,,-1.0,,0.0,0.0,stage2,flydsl_moe2_afp16_wfp4_bf16_t128x256x256_reduce,100.0%
256,256,3072,1536,128,4,ActivationType.Swiglu,torch.bfloat16,torch.bfloat16,torch.float4_e2m1fn_x2,QuantType.per_1x32,1,0,32,0,,,,,,,115.7462,,250.47,15681.6,stage1,moe_cktile2stages_gemm1_256x32x256x256_1x4_16x16x32_2perCU_1x32_HasBias_swiglu,0.0%
256,256,3072,1536,128,4,ActivationType.Swiglu,torch.bfloat16,torch.bfloat16,torch.float4_e2m1fn_x2,QuantType.per_1x32,1,0,32,0,,,,,,,113.9164,,254.49,15933.48,stage1,moe_cktile2stages_gemm1_256x32x256x256_1x4_16x16x32_1perCU_1x32_HasBias_swiglu,0.0%
256,256,3072,1536,128,4,ActivationType.Swiglu,torch.bfloat16,torch.bfloat16,torch.float4_e2m1fn_x2,QuantType.per_1x32,1,0,32,0,,,,,,,185.883,,155.96,9764.66,stage1,moe_cktile2stages_gemm1_256x32x256x256_1x4_16x16x32_3perCU_1x32_HasBias_swiglu,0.0%
256,256,3072,1536,128,4,ActivationType.Swiglu,torch.bfloat16,torch.bfloat16,torch.float4_e2m1fn_x2,QuantType.per_1x32,1,0,32,0,,,,,,,411.5596,,70.44,4410.26,stage1,moe_cktile2stages_gemm1_256x32x256x256_1x4_16x16x32_4perCU_1x32_HasBias_swiglu,0.0%
256,256,3072,1536,128,4,ActivationType.Swiglu,torch.bfloat16,torch.bfloat16,torch.float4_e2m1fn_x2,QuantType.per_1x32,1,0,32,0,,,,,,,71.1144,,407.67,25523.45,stage2,moe_cktile2stages_gemm2_256x32x256x256_1x4_16x16x32_2perCU_1x32_MulRoutedWeight_HasBias,3.7%
256,256,3072,1536,128,4,ActivationType.Swiglu,torch.bfloat16,torch.bfloat16,torch.float4_e2m1fn_x2,QuantType.per_1x32,1,0,32,0,,,,,,,74.957,,386.77,24215.02,stage2,moe_cktile2stages_gemm2_256x32x256x256_1x4_16x16x32_1perCU_1x32_MulRoutedWeight_HasBias,3.7%
256,256,3072,1536,128,4,ActivationType.Swiglu,torch.bfloat16,torch.bfloat16,torch.float4_e2m1fn_x2,QuantType.per_1x32,1,0,32,0,,,,,,,107.4395,,269.84,16894.02,stage2,moe_cktile2stages_gemm2_256x32x256x256_1x4_16x16x32_3perCU_1x32_MulRoutedWeight_HasBias,3.7%
256,256,3072,1536,128,4,ActivationType.Swiglu,torch.bfloat16,torch.bfloat16,torch.float4_e2m1fn_x2,QuantType.per_1x32,1,0,32,0,,,,,,,228.6537,,126.79,7938.14,stage2,moe_cktile2stages_gemm2_256x32x256x256_1x4_16x16x32_4perCU_1x32_MulRoutedWeight_HasBias,3.7%
256,256,3072,1536,128,4,ActivationType.Swiglu,torch.bfloat16,torch.bfloat16,torch.float4_e2m1fn_x2,QuantType.per_1x32,1,0,64,0,,,,,,,173.0619,,167.52,10488.07,stage1,moe_cktile2stages_gemm1_256x64x256x256_1x4_16x16x32_1perCU_1x32_HasBias_swiglu,0.0%
256,256,3072,1536,128,4,ActivationType.Swiglu,torch.bfloat16,torch.bfloat16,torch.float4_e2m1fn_x2,QuantType.per_1x32,1,0,64,0,,,,,,,203.6218,,142.38,8914.0,stage1,moe_cktile2stages_gemm1_256x64x256x256_1x4_16x16x32_2perCU_1x32_HasBias_swiglu,0.0%
256,256,3072,1536,128,4,ActivationType.Swiglu,torch.bfloat16,torch.bfloat16,torch.float4_e2m1fn_x2,QuantType.per_1x32,1,0,64,0,,,,,,,175.4261,,165.26,10346.72,stage1,moe_cktile2stages_gemm1_256x64x256x256_1x4_16x16x32_3perCU_1x32_HasBias_swiglu,0.0%
256,256,3072,1536,128,4,ActivationType.Swiglu,torch.bfloat16,torch.bfloat16,torch.float4_e2m1fn_x2,QuantType.per_1x32,1,0,64,0,,,,,,,174.1503,,166.47,10422.52,stage1,moe_cktile2stages_gemm1_256x64x256x256_1x4_16x16x32_4perCU_1x32_HasBias_swiglu,0.0%
256,256,3072,1536,128,4,ActivationType.Swiglu,torch.bfloat16,torch.bfloat16,torch.float4_e2m1fn_x2,QuantType.per_1x32,1,0,64,0,,,,,,,108.2615,,267.79,16765.75,stage2,moe_cktile2stages_gemm2_256x64x256x256_1x4_16x16x32_1perCU_1x32_MulRoutedWeight_HasBias,3.7%
256,256,3072,1536,128,4,ActivationType.Swiglu,torch.bfloat16,torch.bfloat16,torch.float4_e2m1fn_x2,QuantType.per_1x32,1,0,64,0,,,,,,,108.3329,,267.61,16754.7,stage2,moe_cktile2stages_gemm2_256x64x256x256_1x4_16x16x32_2perCU_1x32_MulRoutedWeight_HasBias,3.7%
256,256,3072,1536,128,4,ActivationType.Swiglu,torch.bfloat16,torch.bfloat16,torch.float4_e2m1fn_x2,QuantType.per_1x32,1,0,64,0,,,,,,,107.8283,,268.86,16833.1,stage2,moe_cktile2stages_gemm2_256x64x256x256_1x4_16x16x32_3perCU_1x32_MulRoutedWeight_HasBias,3.7%
256,256,3072,1536,128,4,ActivationType.Swiglu,torch.bfloat16,torch.bfloat16,torch.float4_e2m1fn_x2,QuantType.per_1x32,1,0,64,0,,,,,,,107.4549,,269.8,16891.6,stage2,moe_cktile2stages_gemm2_256x64x256x256_1x4_16x16x32_4perCU_1x32_MulRoutedWeight_HasBias,3.7%
256,256,3072,3072,128,4,ActivationType.Swiglu,torch.bfloat16,torch.bfloat16,torch.float4_e2m1fn_x2,QuantType.per_1x32,1,0,32,0,,,,,,,-1.0,,0.0,0.0,stage1,flydsl_moe1_afp16_wfp4_bf16_t32x256x256,100.0%
256,256,3072,3072,128,4,ActivationType.Swiglu,torch.bfloat16,torch.bfloat16,torch.float4_e2m1fn_x2,QuantType.per_1x32,1,0,32,0,,,,,,,-1.0,,0.0,0.0,stage2,flydsl_moe2_afp16_wfp4_bf16_t32x128x256_atomic,100.0%
256,256,3072,3072,128,4,ActivationType.Swiglu,torch.bfloat16,torch.bfloat16,torch.float4_e2m1fn_x2,QuantType.per_1x32,1,0,32,0,,,,,,,-1.0,,0.0,0.0,stage2,flydsl_moe2_afp16_wfp4_bf16_t32x128x256_reduce,100.0%
256,256,3072,3072,128,4,ActivationType.Swiglu,torch.bfloat16,torch.bfloat16,torch.float4_e2m1fn_x2,QuantType.per_1x32,1,0,32,0,,,,,,,-1.0,,0.0,0.0,stage2,flydsl_moe2_afp16_wfp4_bf16_t32x256x256_atomic,100.0%
256,256,3072,3072,128,4,ActivationType.Swiglu,torch.bfloat16,torch.bfloat16,torch.float4_e2m1fn_x2,QuantType.per_1x32,1,0,32,0,,,,,,,-1.0,,0.0,0.0,stage2,flydsl_moe2_afp16_wfp4_bf16_t32x256x256_reduce,100.0%
256,256,3072,3072,128,4,ActivationType.Swiglu,torch.bfloat16,torch.bfloat16,torch.float4_e2m1fn_x2,QuantType.per_1x32,1,0,64,0,,,,,,,-1.0,,0.0,0.0,stage1,flydsl_moe1_afp16_wfp4_bf16_t64x256x256,100.0%
256,256,3072,3072,128,4,ActivationType.Swiglu,torch.bfloat16,torch.bfloat16,torch.float4_e2m1fn_x2,QuantType.per_1x32,1,0,64,0,,,,,,,-1.0,,0.0,0.0,stage2,flydsl_moe2_afp16_wfp4_bf16_t64x128x256_atomic,100.0%
256,256,3072,3072,128,4,ActivationType.Swiglu,torch.bfloat16,torch.bfloat16,torch.float4_e2m1fn_x2,QuantType.per_1x32,1,0,64,0,,,,,,,-1.0,,0.0,0.0,stage2,flydsl_moe2_afp16_wfp4_bf16_t64x128x256_reduce,100.0%
256,256,3072,3072,128,4,ActivationType.Swiglu,torch.bfloat16,torch.bfloat16,torch.float4_e2m1fn_x2,QuantType.per_1x32,1,0,64,0,,,,,,,-1.0,,0.0,0.0,stage2,flydsl_moe2_afp16_wfp4_bf16_t64x256x256_atomic,100.0%
256,256,3072,3072,128,4,ActivationType.Swiglu,torch.bfloat16,torch.bfloat16,torch.float4_e2m1fn_x2,QuantType.per_1x32,1,0,64,0,,,,,,,-1.0,,0.0,0.0,stage2,flydsl_moe2_afp16_wfp4_bf16_t64x256x256_reduce,100.0%
256,256,3072,3072,128,4,ActivationType.Swiglu,torch.bfloat16,torch.bfloat16,torch.float4_e2m1fn_x2,QuantType.per_1x32,1,0,128,0,,,,,,,-1.0,,0.0,0.0,stage2,flydsl_moe2_afp16_wfp4_bf16_t128x128x256_atomic,100.0%
256,256,3072,3072,128,4,ActivationType.Swiglu,torch.bfloat16,torch.bfloat16,torch.float4_e2m1fn_x2,QuantType.per_1x32,1,0,128,0,,,,,,,-1.0,,0.0,0.0,stage2,flydsl_moe2_afp16_wfp4_bf16_t128x128x256_reduce,100.0%
256,256,3072,3072,128,4,ActivationType.Swiglu,torch.bfloat16,torch.bfloat16,torch.float4_e2m1fn_x2,QuantType.per_1x32,1,0,128,0,,,,,,,-1.0,,0.0,0.0,stage2,flydsl_moe2_afp16_wfp4_bf16_t128x256x256_atomic,100.0%
256,256,3072,3072,128,4,ActivationType.Swiglu,torch.bfloat16,torch.bfloat16,torch.float4_e2m1fn_x2,QuantType.per_1x32,1,0,128,0,,,,,,,-1.0,,0.0,0.0,stage2,flydsl_moe2_afp16_wfp4_bf16_t128x256x256_reduce,100.0%
256,256,3072,3072,128,4,ActivationType.Swiglu,torch.bfloat16,torch.bfloat16,torch.float4_e2m1fn_x2,QuantType.per_1x32,1,0,32,0,,,,,,,216.8055,,267.44,16729.39,stage1,moe_cktile2stages_gemm1_256x32x256x256_1x4_16x16x32_2perCU_1x32_HasBias_swiglu,0.0%
256,256,3072,3072,128,4,ActivationType.Swiglu,torch.bfloat16,torch.bfloat16,torch.float4_e2m1fn_x2,QuantType.per_1x32,1,0,32,0,,,,,,,215.6205,,268.91,16821.33,stage1,moe_cktile2stages_gemm1_256x32x256x256_1x4_16x16x32_1perCU_1x32_HasBias_swiglu,0.0%
256,256,3072,3072,128,4,ActivationType.Swiglu,torch.bfloat16,torch.bfloat16,torch.float4_e2m1fn_x2,QuantType.per_1x32,1,0,32,0,,,,,,,349.1541,,166.06,10388.03,stage1,moe_cktile2stages_gemm1_256x32x256x256_1x4_16x16x32_3perCU_1x32_HasBias_swiglu,0.0%
256,256,3072,3072,128,4,ActivationType.Swiglu,torch.bfloat16,torch.bfloat16,torch.float4_e2m1fn_x2,QuantType.per_1x32,1,0,32,0,,,,,,,693.1929,,83.64,5232.34,stage1,moe_cktile2stages_gemm1_256x32x256x256_1x4_16x16x32_4perCU_1x32_HasBias_swiglu,0.0%
256,256,3072,3072,128,4,ActivationType.Swiglu,torch.bfloat16,torch.bfloat16,torch.float4_e2m1fn_x2,QuantType.per_1x32,1,0,32,0,,,,,,,118.5359,,489.15,30598.53,stage2,moe_cktile2stages_gemm2_256x32x256x256_1x4_16x16x32_2perCU_1x32_MulRoutedWeight_HasBias,5.1%
256,256,3072,3072,128,4,ActivationType.Swiglu,torch.bfloat16,torch.bfloat16,torch.float4_e2m1fn_x2,QuantType.per_1x32,1,0,32,0,,,,,,,118.0917,,490.99,30713.63,stage2,moe_cktile2stages_gemm2_256x32x256x256_1x4_16x16x32_1perCU_1x32_MulRoutedWeight_HasBias,5.1%
256,256,3072,3072,128,4,ActivationType.Swiglu,torch.bfloat16,torch.bfloat16,torch.float4_e2m1fn_x2,QuantType.per_1x32,1,0,32,0,,,,,,,188.5901,,307.45,19232.32,stage2,moe_cktile2stages_gemm2_256x32x256x256_1x4_16x16x32_3perCU_1x32_MulRoutedWeight_HasBias,5.1%
256,256,3072,3072,128,4,ActivationType.Swiglu,torch.bfloat16,torch.bfloat16,torch.float4_e2m1fn_x2,QuantType.per_1x32,1,0,32,0,,,,,,,418.497,,138.55,8666.79,stage2,moe_cktile2stages_gemm2_256x32x256x256_1x4_16x16x32_4perCU_1x32_MulRoutedWeight_HasBias,5.0%
256,256,3072,3072,128,4,ActivationType.Swiglu,torch.bfloat16,torch.bfloat16,torch.float4_e2m1fn_x2,QuantType.per_1x32,1,0,64,0,,,,,,,333.758,,173.72,10867.23,stage1,moe_cktile2stages_gemm1_256x64x256x256_1x4_16x16x32_1perCU_1x32_HasBias_swiglu,0.0%
256,256,3072,3072,128,4,ActivationType.Swiglu,torch.bfloat16,torch.bfloat16,torch.float4_e2m1fn_x2,QuantType.per_1x32,1,0,64,0,,,,,,,389.4262,,148.89,9313.77,stage1,moe_cktile2stages_gemm1_256x64x256x256_1x4_16x16x32_2perCU_1x32_HasBias_swiglu,0.0%
256,256,3072,3072,128,4,ActivationType.Swiglu,torch.bfloat16,torch.bfloat16,torch.float4_e2m1fn_x2,QuantType.per_1x32,1,0,64,0,,,,,,,329.056,,176.21,11022.51,stage1,moe_cktile2stages_gemm1_256x64x256x256_1x4_16x16x32_3perCU_1x32_HasBias_swiglu,0.0%
256,256,3072,3072,128,4,ActivationType.Swiglu,torch.bfloat16,torch.bfloat16,torch.float4_e2m1fn_x2,QuantType.per_1x32,1,0,64,0,,,,,,,338.7579,,171.16,10706.83,stage1,moe_cktile2stages_gemm1_256x64x256x256_1x4_16x16x32_4perCU_1x32_HasBias_swiglu,0.0%
256,256,3072,3072,128,4,ActivationType.Swiglu,torch.bfloat16,torch.bfloat16,torch.float4_e2m1fn_x2,QuantType.per_1x32,1,0,64,0,,,,,,,177.459,,326.73,20438.66,stage2,moe_cktile2stages_gemm2_256x64x256x256_1x4_16x16x32_1perCU_1x32_MulRoutedWeight_HasBias,5.1%
256,256,3072,3072,128,4,ActivationType.Swiglu,torch.bfloat16,torch.bfloat16,torch.float4_e2m1fn_x2,QuantType.per_1x32,1,0,64,0,,,,,,,186.1039,,311.56,19489.24,stage2,moe_cktile2stages_gemm2_256x64x256x256_1x4_16x16x32_2perCU_1x32_MulRoutedWeight_HasBias,5.0%
256,256,3072,3072,128,4,ActivationType.Swiglu,torch.bfloat16,torch.bfloat16,torch.float4_e2m1fn_x2,QuantType.per_1x32,1,0,64,0,,,,,,,176.2431,,328.99,20579.67,stage2,moe_cktile2stages_gemm2_256x64x256x256_1x4_16x16x32_3perCU_1x32_MulRoutedWeight_HasBias,5.1%
256,256,3072,3072,128,4,ActivationType.Swiglu,torch.bfloat16,torch.bfloat16,torch.float4_e2m1fn_x2,QuantType.per_1x32,1,0,64,0,,,,,,,174.5214,,332.23,20782.69,stage2,moe_cktile2stages_gemm2_256x64x256x256_1x4_16x16x32_4perCU_1x32_MulRoutedWeight_HasBias,5.1%
256,512,3072,512,128,4,ActivationType.Swiglu,torch.bfloat16,torch.bfloat16,torch.float4_e2m1fn_x2,QuantType.per_1x32,1,0,32,0,,,,,,,-1.0,,0.0,0.0,stage1,flydsl_moe1_afp16_wfp4_bf16_t32x256x256,100.0%
256,512,3072,512,128,4,ActivationType.Swiglu,torch.bfloat16,torch.bfloat16,torch.float4_e2m1fn_x2,QuantType.per_1x32,1,0,32,0,,,,,,,-1.0,,0.0,0.0,stage2,flydsl_moe2_afp16_wfp4_bf16_t32x128x256_atomic,100.0%
256,512,3072,512,128,4,ActivationType.Swiglu,torch.bfloat16,torch.bfloat16,torch.float4_e2m1fn_x2,QuantType.per_1x32,1,0,32,0,,,,,,,-1.0,,0.0,0.0,stage2,flydsl_moe2_afp16_wfp4_bf16_t32x128x256_reduce,100.0%
256,512,3072,512,128,4,ActivationType.Swiglu,torch.bfloat16,torch.bfloat16,torch.float4_e2m1fn_x2,QuantType.per_1x32,1,0,32,0,,,,,,,-1.0,,0.0,0.0,stage2,flydsl_moe2_afp16_wfp4_bf16_t32x256x256_atomic,100.0%
256,512,3072,512,128,4,ActivationType.Swiglu,torch.bfloat16,torch.bfloat16,torch.float4_e2m1fn_x2,QuantType.per_1x32,1,0,32,0,,,,,,,-1.0,,0.0,0.0,stage2,flydsl_moe2_afp16_wfp4_bf16_t32x256x256_reduce,100.0%
256,512,3072,512,128,4,ActivationType.Swiglu,torch.bfloat16,torch.bfloat16,torch.float4_e2m1fn_x2,QuantType.per_1x32,1,0,64,0,,,,,,,-1.0,,0.0,0.0,stage1,flydsl_moe1_afp16_wfp4_bf16_t64x256x256,100.0%
256,512,3072,512,128,4,ActivationType.Swiglu,torch.bfloat16,torch.bfloat16,torch.float4_e2m1fn_x2,QuantType.per_1x32,1,0,64,0,,,,,,,-1.0,,0.0,0.0,stage2,flydsl_moe2_afp16_wfp4_bf16_t64x128x256_atomic,100.0%
256,512,3072,512,128,4,ActivationType.Swiglu,torch.bfloat16,torch.bfloat16,torch.float4_e2m1fn_x2,QuantType.per_1x32,1,0,64,0,,,,,,,-1.0,,0.0,0.0,stage2,flydsl_moe2_afp16_wfp4_bf16_t64x128x256_reduce,100.0%
256,512,3072,512,128,4,ActivationType.Swiglu,torch.bfloat16,torch.bfloat16,torch.float4_e2m1fn_x2,QuantType.per_1x32,1,0,64,0,,,,,,,-1.0,,0.0,0.0,stage2,flydsl_moe2_afp16_wfp4_bf16_t64x256x256_atomic,100.0%
256,512,3072,512,128,4,ActivationType.Swiglu,torch.bfloat16,torch.bfloat16,torch.float4_e2m1fn_x2,QuantType.per_1x32,1,0,64,0,,,,,,,-1.0,,0.0,0.0,stage2,flydsl_moe2_afp16_wfp4_bf16_t64x256x256_reduce,100.0%
256,512,3072,512,128,4,ActivationType.Swiglu,torch.bfloat16,torch.bfloat16,torch.float4_e2m1fn_x2,QuantType.per_1x32,1,0,128,0,,,,,,,-1.0,,0.0,0.0,stage2,flydsl_moe2_afp16_wfp4_bf16_t128x128x256_atomic,100.0%
256,512,3072,512,128,4,ActivationType.Swiglu,torch.bfloat16,torch.bfloat16,torch.float4_e2m1fn_x2,QuantType.per_1x32,1,0,128,0,,,,,,,-1.0,,0.0,0.0,stage2,flydsl_moe2_afp16_wfp4_bf16_t128x128x256_reduce,100.0%
256,512,3072,512,128,4,ActivationType.Swiglu,torch.bfloat16,torch.bfloat16,torch.float4_e2m1fn_x2,QuantType.per_1x32,1,0,128,0,,,,,,,-1.0,,0.0,0.0,stage2,flydsl_moe2_afp16_wfp4_bf16_t128x256x256_atomic,100.0%
256,512,3072,512,128,4,ActivationType.Swiglu,torch.bfloat16,torch.bfloat16,torch.float4_e2m1fn_x2,QuantType.per_1x32,1,0,128,0,,,,,,,-1.0,,0.0,0.0,stage2,flydsl_moe2_afp16_wfp4_bf16_t128x256x256_reduce,100.0%
256,512,3072,512,128,4,ActivationType.Swiglu,torch.bfloat16,torch.bfloat16,torch.float4_e2m1fn_x2,QuantType.per_1x32,1,0,32,0,,,,,,,48.5191,,398.35,12577.96,stage1,moe_cktile2stages_gemm1_256x32x256x256_1x4_16x16x32_2perCU_1x32_HasBias_swiglu,0.0%
256,512,3072,512,128,4,ActivationType.Swiglu,torch.bfloat16,torch.bfloat16,torch.float4_e2m1fn_x2,QuantType.per_1x32,1,0,32,0,,,,,,,48.8182,,395.9,12500.9,stage1,moe_cktile2stages_gemm1_256x32x256x256_1x4_16x16x32_1perCU_1x32_HasBias_swiglu,0.0%
256,512,3072,512,128,4,ActivationType.Swiglu,torch.bfloat16,torch.bfloat16,torch.float4_e2m1fn_x2,QuantType.per_1x32,1,0,32,0,,,,,,,88.1024,,219.37,6926.84,stage1,moe_cktile2stages_gemm1_256x32x256x256_1x4_16x16x32_3perCU_1x32_HasBias_swiglu,0.0%
256,512,3072,512,128,4,ActivationType.Swiglu,torch.bfloat16,torch.bfloat16,torch.float4_e2m1fn_x2,QuantType.per_1x32,1,0,32,0,,,,,,,186.5949,,103.58,3270.57,stage1,moe_cktile2stages_gemm1_256x32x256x256_1x4_16x16x32_4perCU_1x32_HasBias_swiglu,0.0%
256,512,3072,512,128,4,ActivationType.Swiglu,torch.bfloat16,torch.bfloat16,torch.float4_e2m1fn_x2,QuantType.per_1x32,1,0,32,0,,,,,,,38.2319,,505.53,15962.36,stage2,moe_cktile2stages_gemm2_256x32x256x256_1x4_16x16x32_2perCU_1x32_MulRoutedWeight_HasBias,1.5%
256,512,3072,512,128,4,ActivationType.Swiglu,torch.bfloat16,torch.bfloat16,torch.float4_e2m1fn_x2,QuantType.per_1x32,1,0,32,0,,,,,,,37.2825,,518.4,16368.84,stage2,moe_cktile2stages_gemm2_256x32x256x256_1x4_16x16x32_1perCU_1x32_MulRoutedWeight_HasBias,1.5%
256,512,3072,512,128,4,ActivationType.Swiglu,torch.bfloat16,torch.bfloat16,torch.float4_e2m1fn_x2,QuantType.per_1x32,1,0,32,0,,,,,,,41.1225,,469.99,14840.32,stage2,moe_cktile2stages_gemm2_256x32x256x256_1x4_16x16x32_3perCU_1x32_MulRoutedWeight_HasBias,1.5%
256,512,3072,512,128,4,ActivationType.Swiglu,torch.bfloat16,torch.bfloat16,torch.float4_e2m1fn_x2,QuantType.per_1x32,1,0,32,0,,,,,,,80.6472,,239.65,7567.17,stage2,moe_cktile2stages_gemm2_256x32x256x256_1x4_16x16x32_4perCU_1x32_MulRoutedWeight_HasBias,1.5%
256,512,3072,512,128,4,ActivationType.Swiglu,torch.bfloat16,torch.bfloat16,torch.float4_e2m1fn_x2,QuantType.per_1x32,1,0,64,0,,,,,,,65.4031,,295.51,9330.92,stage1,moe_cktile2stages_gemm1_256x64x256x256_1x4_16x16x32_1perCU_1x32_HasBias_swiglu,0.0%
256,512,3072,512,128,4,ActivationType.Swiglu,torch.bfloat16,torch.bfloat16,torch.float4_e2m1fn_x2,QuantType.per_1x32,1,0,64,0,,,,,,,93.8936,,205.84,6499.6,stage1,moe_cktile2stages_gemm1_256x64x256x256_1x4_16x16x32_2perCU_1x32_HasBias_swiglu,0.0%
256,512,3072,512,128,4,ActivationType.Swiglu,torch.bfloat16,torch.bfloat16,torch.float4_e2m1fn_x2,QuantType.per_1x32,1,0,64,0,,,,,,,64.7392,,298.54,9426.61,stage1,moe_cktile2stages_gemm1_256x64x256x256_1x4_16x16x32_3perCU_1x32_HasBias_swiglu,0.0%
256,512,3072,512,128,4,ActivationType.Swiglu,torch.bfloat16,torch.bfloat16,torch.float4_e2m1fn_x2,QuantType.per_1x32,1,0,64,0,,,,,,,65.1315,,296.74,9369.83,stage1,moe_cktile2stages_gemm1_256x64x256x256_1x4_16x16x32_4perCU_1x32_HasBias_swiglu,0.0%
256,512,3072,512,128,4,ActivationType.Swiglu,torch.bfloat16,torch.bfloat16,torch.float4_e2m1fn_x2,QuantType.per_1x32,1,0,64,0,,,,,,,65.2939,,296.01,9346.53,stage2,moe_cktile2stages_gemm2_256x64x256x256_1x4_16x16x32_1perCU_1x32_MulRoutedWeight_HasBias,1.5%
256,512,3072,512,128,4,ActivationType.Swiglu,torch.bfloat16,torch.bfloat16,torch.float4_e2m1fn_x2,QuantType.per_1x32,1,0,64,0,,,,,,,48.0488,,402.24,12701.07,stage2,moe_cktile2stages_gemm2_256x64x256x256_1x4_16x16x32_2perCU_1x32_MulRoutedWeight_HasBias,1.5%
256,512,3072,512,128,4,ActivationType.Swiglu,torch.bfloat16,torch.bfloat16,torch.float4_e2m1fn_x2,QuantType.per_1x32,1,0,64,0,,,,,,,64.6588,,298.91,9438.33,stage2,moe_cktile2stages_gemm2_256x64x256x256_1x4_16x16x32_3perCU_1x32_MulRoutedWeight_HasBias,1.6%
256,512,3072,512,128,4,ActivationType.Swiglu,torch.bfloat16,torch.bfloat16,torch.float4_e2m1fn_x2,QuantType.per_1x32,1,0,64,0,,,,,,,63.7666,,303.1,9570.39,stage2,moe_cktile2stages_gemm2_256x64x256x256_1x4_16x16x32_4perCU_1x32_MulRoutedWeight_HasBias,1.5%
256,512,3072,512,128,4,ActivationType.Swiglu,torch.bfloat16,torch.float8_e4m3fn,torch.float4_e2m1fn_x2,QuantType.per_1x32,1,0,32,0,,,,,,,-1.0,,0.0,0.0,stage1,flydsl_moe1_afp8_wfp4_bf16_t32x256x256,100.0%
256,512,3072,512,128,4,ActivationType.Swiglu,torch.bfloat16,torch.float8_e4m3fn,torch.float4_e2m1fn_x2,QuantType.per_1x32,1,0,32,0,,,,,,,-1.0,,0.0,0.0,stage2,flydsl_moe2_afp8_wfp4_bf16_t32x128x256_atomic,100.0%
256,512,3072,512,128,4,ActivationType.Swiglu,torch.bfloat16,torch.float8_e4m3fn,torch.float4_e2m1fn_x2,QuantType.per_1x32,1,0,32,0,,,,,,,-1.0,,0.0,0.0,stage2,flydsl_moe2_afp8_wfp4_bf16_t32x128x256_reduce,100.0%
256,512,3072,512,128,4,ActivationType.Swiglu,torch.bfloat16,torch.float8_e4m3fn,torch.float4_e2m1fn_x2,QuantType.per_1x32,1,0,32,0,,,,,,,-1.0,,0.0,0.0,stage2,flydsl_moe2_afp8_wfp4_bf16_t32x256x256_atomic,100.0%
256,512,3072,512,128,4,ActivationType.Swiglu,torch.bfloat16,torch.float8_e4m3fn,torch.float4_e2m1fn_x2,QuantType.per_1x32,1,0,32,0,,,,,,,-1.0,,0.0,0.0,stage2,flydsl_moe2_afp8_wfp4_bf16_t32x256x256_reduce,100.0%
256,512,3072,512,128,4,ActivationType.Swiglu,torch.bfloat16,torch.float8_e4m3fn,torch.float4_e2m1fn_x2,QuantType.per_1x32,1,0,64,0,,,,,,,-1.0,,0.0,0.0,stage1,flydsl_moe1_afp8_wfp4_bf16_t64x256x256,100.0%
256,512,3072,512,128,4,ActivationType.Swiglu,torch.bfloat16,torch.float8_e4m3fn,torch.float4_e2m1fn_x2,QuantType.per_1x32,1,0,64,0,,,,,,,-1.0,,0.0,0.0,stage2,flydsl_moe2_afp8_wfp4_bf16_t64x128x256_atomic,100.0%
256,512,3072,512,128,4,ActivationType.Swiglu,torch.bfloat16,torch.float8_e4m3fn,torch.float4_e2m1fn_x2,QuantType.per_1x32,1,0,64,0,,,,,,,-1.0,,0.0,0.0,stage2,flydsl_moe2_afp8_wfp4_bf16_t64x128x256_reduce,100.0%
256,512,3072,512,128,4,ActivationType.Swiglu,torch.bfloat16,torch.float8_e4m3fn,torch.float4_e2m1fn_x2,QuantType.per_1x32,1,0,64,0,,,,,,,-1.0,,0.0,0.0,stage2,flydsl_moe2_afp8_wfp4_bf16_t64x256x256_atomic,100.0%
256,512,3072,512,128,4,ActivationType.Swiglu,torch.bfloat16,torch.float8_e4m3fn,torch.float4_e2m1fn_x2,QuantType.per_1x32,1,0,64,0,,,,,,,-1.0,,0.0,0.0,stage2,flydsl_moe2_afp8_wfp4_bf16_t64x256x256_reduce,100.0%
256,512,3072,512,128,4,ActivationType.Swiglu,torch.bfloat16,torch.float8_e4m3fn,torch.float4_e2m1fn_x2,QuantType.per_1x32,1,0,128,0,,,,,,,-1.0,,0.0,0.0,stage2,flydsl_moe2_afp8_wfp4_bf16_t128x128x256_atomic,100.0%
256,512,3072,512,128,4,ActivationType.Swiglu,torch.bfloat16,torch.float8_e4m3fn,torch.float4_e2m1fn_x2,QuantType.per_1x32,1,0,128,0,,,,,,,-1.0,,0.0,0.0,stage2,flydsl_moe2_afp8_wfp4_bf16_t128x128x256_reduce,100.0%
256,512,3072,512,128,4,ActivationType.Swiglu,torch.bfloat16,torch.float8_e4m3fn,torch.float4_e2m1fn_x2,QuantType.per_1x32,1,0,128,0,,,,,,,-1.0,,0.0,0.0,stage2,flydsl_moe2_afp8_wfp4_bf16_t128x256x256_atomic,100.0%
256,512,3072,512,128,4,ActivationType.Swiglu,torch.bfloat16,torch.float8_e4m3fn,torch.float4_e2m1fn_x2,QuantType.per_1x32,1,0,128,0,,,,,,,-1.0,,0.0,0.0,stage2,flydsl_moe2_afp8_wfp4_bf16_t128x256x256_reduce,100.0%
256,512,3072,512,128,4,ActivationType.Swiglu,torch.bfloat16,torch.float8_e4m3fn,torch.float4_e2m1fn_x2,QuantType.per_1x32,1,0,32,0,,,,,,,46.6092,,414.67,13059.62,stage1,moe_cktile2stages_gemm1_256x32x256x256_1x4_16x16x128_2perCU_1x32_HasBias_swiglu,0.0%
256,512,3072,512,128,4,ActivationType.Swiglu,torch.bfloat16,torch.float8_e4m3fn,torch.float4_e2m1fn_x2,QuantType.per_1x32,1,0,32,0,,,,,,,46.9426,,411.72,12966.87,stage1,moe_cktile2stages_gemm1_256x32x256x256_1x4_16x16x128_1perCU_1x32_HasBias_swiglu,0.0%
256,512,3072,512,128,4,ActivationType.Swiglu,torch.bfloat16,torch.float8_e4m3fn,torch.float4_e2m1fn_x2,QuantType.per_1x32,1,0,32,0,,,,,,,48.4851,,398.62,12554.34,stage1,moe_cktile2stages_gemm1_256x32x256x256_1x4_16x16x128_3perCU_1x32_HasBias_swiglu,0.0%
256,512,3072,512,128,4,ActivationType.Swiglu,torch.bfloat16,torch.float8_e4m3fn,torch.float4_e2m1fn_x2,QuantType.per_1x32,1,0,32,0,,,,,,,107.8279,,179.24,5645.09,stage1,moe_cktile2stages_gemm1_256x32x256x256_1x4_16x16x128_4perCU_1x32_HasBias_swiglu,0.0%
256,512,3072,512,128,4,ActivationType.Swiglu,torch.bfloat16,torch.float8_e4m3fn,torch.float4_e2m1fn_x2,QuantType.per_1x32,1,0,32,0,,,,,,,36.1711,,534.33,16828.31,stage2,moe_cktile2stages_gemm2_256x32x256x256_1x4_16x16x128_2perCU_1x32_MulRoutedWeight_HasBias,1.5%
256,512,3072,512,128,4,ActivationType.Swiglu,torch.bfloat16,torch.float8_e4m3fn,torch.float4_e2m1fn_x2,QuantType.per_1x32,1,0,32,0,,,,,,,37.5542,,514.65,16208.53,stage2,moe_cktile2stages_gemm2_256x32x256x256_1x4_16x16x128_1perCU_1x32_MulRoutedWeight_HasBias,1.5%
256,512,3072,512,128,4,ActivationType.Swiglu,torch.bfloat16,torch.float8_e4m3fn,torch.float4_e2m1fn_x2,QuantType.per_1x32,1,0,32,0,,,,,,,36.0367,,536.32,16891.07,stage2,moe_cktile2stages_gemm2_256x32x256x256_1x4_16x16x128_3perCU_1x32_MulRoutedWeight_HasBias,1.5%
256,512,3072,512,128,4,ActivationType.Swiglu,torch.bfloat16,torch.float8_e4m3fn,torch.float4_e2m1fn_x2,QuantType.per_1x32,1,0,32,0,,,,,,,52.4747,,368.32,11599.84,stage2,moe_cktile2stages_gemm2_256x32x256x256_1x4_16x16x128_4perCU_1x32_MulRoutedWeight_HasBias,1.5%
256,512,3072,512,128,4,ActivationType.Swiglu,torch.bfloat16,torch.float8_e4m3fn,torch.float4_e2m1fn_x2,QuantType.per_1x32,1,0,64,0,,,,,,,52.3474,,369.21,11628.05,stage1,moe_cktile2stages_gemm1_256x64x256x256_1x4_16x16x128_1perCU_1x32_HasBias_swiglu,94.1%
256,512,3072,512,128,4,ActivationType.Swiglu,torch.bfloat16,torch.float8_e4m3fn,torch.float4_e2m1fn_x2,QuantType.per_1x32,1,0,64,0,,,,,,,49.0203,,394.27,12417.27,stage1,moe_cktile2stages_gemm1_256x64x256x256_1x4_16x16x128_2perCU_1x32_HasBias_swiglu,94.1%
256,512,3072,512,128,4,ActivationType.Swiglu,torch.bfloat16,torch.float8_e4m3fn,torch.float4_e2m1fn_x2,QuantType.per_1x32,1,0,64,0,,,,,,,144.3227,,133.92,4217.62,stage1,moe_cktile2stages_gemm1_256x64x256x256_1x4_16x16x128_3perCU_1x32_HasBias_swiglu,94.1%
256,512,3072,512,128,4,ActivationType.Swiglu,torch.bfloat16,torch.float8_e4m3fn,torch.float4_e2m1fn_x2,QuantType.per_1x32,1,0,64,0,,,,,,,249.0988,,77.59,2443.6,stage1,moe_cktile2stages_gemm1_256x64x256x256_1x4_16x16x128_4perCU_1x32_HasBias_swiglu,94.1%
256,512,3072,512,128,4,ActivationType.Swiglu,torch.bfloat16,torch.float8_e4m3fn,torch.float4_e2m1fn_x2,QuantType.per_1x32,1,0,64,0,,,,,,,56.5684,,341.66,10760.4,stage2,moe_cktile2stages_gemm2_256x64x256x256_1x4_16x16x128_1perCU_1x32_MulRoutedWeight_HasBias,99.8%
256,512,3072,512,128,4,ActivationType.Swiglu,torch.bfloat16,torch.float8_e4m3fn,torch.float4_e2m1fn_x2,QuantType.per_1x32,1,0,64,0,,,,,,,52.9666,,364.9,11492.12,stage2,moe_cktile2stages_gemm2_256x64x256x256_1x4_16x16x128_2perCU_1x32_MulRoutedWeight_HasBias,99.8%
256,512,3072,512,128,4,ActivationType.Swiglu,torch.bfloat16,torch.float8_e4m3fn,torch.float4_e2m1fn_x2,QuantType.per_1x32,1,0,64,0,,,,,,,64.1528,,301.27,9488.26,stage2,moe_cktile2stages_gemm2_256x64x256x256_1x4_16x16x128_3perCU_1x32_MulRoutedWeight_HasBias,99.8%
256,512,3072,512,128,4,ActivationType.Swiglu,torch.bfloat16,torch.float8_e4m3fn,torch.float4_e2m1fn_x2,QuantType.per_1x32,1,0,64,0,,,,,,,94.8218,,203.83,6419.39,stage2,moe_cktile2stages_gemm2_256x64x256x256_1x4_16x16x128_4perCU_1x32_MulRoutedWeight_HasBias,99.8%
256,512,3072,1536,128,4,ActivationType.Swiglu,torch.bfloat16,torch.bfloat16,torch.float4_e2m1fn_x2,QuantType.per_1x32,1,0,32,0,,,,,,,-1.0,,0.0,0.0,stage1,flydsl_moe1_afp16_wfp4_bf16_t32x256x256,100.0%
256,512,3072,1536,128,4,ActivationType.Swiglu,torch.bfloat16,torch.bfloat16,torch.float4_e2m1fn_x2,QuantType.per_1x32,1,0,32,0,,,,,,,-1.0,,0.0,0.0,stage2,flydsl_moe2_afp16_wfp4_bf16_t32x128x256_atomic,100.0%
256,512,3072,1536,128,4,ActivationType.Swiglu,torch.bfloat16,torch.bfloat16,torch.float4_e2m1fn_x2,QuantType.per_1x32,1,0,32,0,,,,,,,-1.0,,0.0,0.0,stage2,flydsl_moe2_afp16_wfp4_bf16_t32x128x256_reduce,100.0%
256,512,3072,1536,128,4,ActivationType.Swiglu,torch.bfloat16,torch.bfloat16,torch.float4_e2m1fn_x2,QuantType.per_1x32,1,0,32,0,,,,,,,-1.0,,0.0,0.0,stage2,flydsl_moe2_afp16_wfp4_bf16_t32x256x256_atomic,100.0%
256,512,3072,1536,128,4,ActivationType.Swiglu,torch.bfloat16,torch.bfloat16,torch.float4_e2m1fn_x2,QuantType.per_1x32,1,0,32,0,,,,,,,-1.0,,0.0,0.0,stage2,flydsl_moe2_afp16_wfp4_bf16_t32x256x256_reduce,100.0%
256,512,3072,1536,128,4,ActivationType.Swiglu,torch.bfloat16,torch.bfloat16,torch.float4_e2m1fn_x2,QuantType.per_1x32,1,0,64,0,,,,,,,-1.0,,0.0,0.0,stage1,flydsl_moe1_afp16_wfp4_bf16_t64x256x256,100.0%
256,512,3072,1536,128,4,ActivationType.Swiglu,torch.bfloat16,torch.bfloat16,torch.float4_e2m1fn_x2,QuantType.per_1x32,1,0,64,0,,,,,,,-1.0,,0.0,0.0,stage2,flydsl_moe2_afp16_wfp4_bf16_t64x128x256_atomic,100.0%
256,512,3072,1536,128,4,ActivationType.Swiglu,torch.bfloat16,torch.bfloat16,torch.float4_e2m1fn_x2,QuantType.per_1x32,1,0,64,0,,,,,,,-1.0,,0.0,0.0,stage2,flydsl_moe2_afp16_wfp4_bf16_t64x128x256_reduce,100.0%
256,512,3072,1536,128,4,ActivationType.Swiglu,torch.bfloat16,torch.bfloat16,torch.float4_e2m1fn_x2,QuantType.per_1x32,1,0,64,0,,,,,,,-1.0,,0.0,0.0,stage2,flydsl_moe2_afp16_wfp4_bf16_t64x256x256_atomic,100.0%
256,512,3072,1536,128,4,ActivationType.Swiglu,torch.bfloat16,torch.bfloat16,torch.float4_e2m1fn_x2,QuantType.per_1x32,1,0,64,0,,,,,,,-1.0,,0.0,0.0,stage2,flydsl_moe2_afp16_wfp4_bf16_t64x256x256_reduce,100.0%
256,512,3072,1536,128,4,ActivationType.Swiglu,torch.bfloat16,torch.bfloat16,torch.float4_e2m1fn_x2,QuantType.per_1x32,1,0,128,0,,,,,,,-1.0,,0.0,0.0,stage2,flydsl_moe2_afp16_wfp4_bf16_t128x128x256_atomic,100.0%
256,512,3072,1536,128,4,ActivationType.Swiglu,torch.bfloat16,torch.bfloat16,torch.float4_e2m1fn_x2,QuantType.per_1x32,1,0,128,0,,,,,,,-1.0,,0.0,0.0,stage2,flydsl_moe2_afp16_wfp4_bf16_t128x128x256_reduce,100.0%
256,512,3072,1536,128,4,ActivationType.Swiglu,torch.bfloat16,torch.bfloat16,torch.float4_e2m1fn_x2,QuantType.per_1x32,1,0,128,0,,,,,,,-1.0,,0.0,0.0,stage2,flydsl_moe2_afp16_wfp4_bf16_t128x256x256_atomic,100.0%
256,512,3072,1536,128,4,ActivationType.Swiglu,torch.bfloat16,torch.bfloat16,torch.float4_e2m1fn_x2,QuantType.per_1x32,1,0,128,0,,,,,,,-1.0,,0.0,0.0,stage2,flydsl_moe2_afp16_wfp4_bf16_t128x256x256_reduce,100.0%
256,512,3072,1536,128,4,ActivationType.Swiglu,torch.bfloat16,torch.bfloat16,torch.float4_e2m1fn_x2,QuantType.per_1x32,1,0,32,0,,,,,,,123.0378,,471.25,14777.82,stage1,moe_cktile2stages_gemm1_256x32x256x256_1x4_16x16x32_2perCU_1x32_HasBias_swiglu,0.0%
256,512,3072,1536,128,4,ActivationType.Swiglu,torch.bfloat16,torch.bfloat16,torch.float4_e2m1fn_x2,QuantType.per_1x32,1,0,32,0,,,,,,,126.9952,,456.57,14317.32,stage1,moe_cktile2stages_gemm1_256x32x256x256_1x4_16x16x32_1perCU_1x32_HasBias_swiglu,0.0%
256,512,3072,1536,128,4,ActivationType.Swiglu,torch.bfloat16,torch.bfloat16,torch.float4_e2m1fn_x2,QuantType.per_1x32,1,0,32,0,,,,,,,193.2859,,299.98,9406.95,stage1,moe_cktile2stages_gemm1_256x32x256x256_1x4_16x16x32_3perCU_1x32_HasBias_swiglu,0.0%
256,512,3072,1536,128,4,ActivationType.Swiglu,torch.bfloat16,torch.bfloat16,torch.float4_e2m1fn_x2,QuantType.per_1x32,1,0,32,0,,,,,,,436.2661,,132.91,4167.71,stage1,moe_cktile2stages_gemm1_256x32x256x256_1x4_16x16x32_4perCU_1x32_HasBias_swiglu,0.0%
256,512,3072,1536,128,4,ActivationType.Swiglu,torch.bfloat16,torch.bfloat16,torch.float4_e2m1fn_x2,QuantType.per_1x32,1,0,32,0,,,,,,,76.1463,,761.46,23878.12,stage2,moe_cktile2stages_gemm2_256x32x256x256_1x4_16x16x32_2perCU_1x32_MulRoutedWeight_HasBias,3.7%
256,512,3072,1536,128,4,ActivationType.Swiglu,torch.bfloat16,torch.bfloat16,torch.float4_e2m1fn_x2,QuantType.per_1x32,1,0,32,0,,,,,,,78.099,,742.42,23281.1,stage2,moe_cktile2stages_gemm2_256x32x256x256_1x4_16x16x32_1perCU_1x32_MulRoutedWeight_HasBias,3.7%
256,512,3072,1536,128,4,ActivationType.Swiglu,torch.bfloat16,torch.bfloat16,torch.float4_e2m1fn_x2,QuantType.per_1x32,1,0,32,0,,,,,,,108.1085,,536.33,16818.57,stage2,moe_cktile2stages_gemm2_256x32x256x256_1x4_16x16x32_3perCU_1x32_MulRoutedWeight_HasBias,3.7%
256,512,3072,1536,128,4,ActivationType.Swiglu,torch.bfloat16,torch.bfloat16,torch.float4_e2m1fn_x2,QuantType.per_1x32,1,0,32,0,,,,,,,236.2558,,245.42,7696.03,stage2,moe_cktile2stages_gemm2_256x32x256x256_1x4_16x16x32_4perCU_1x32_MulRoutedWeight_HasBias,3.7%
256,512,3072,1536,128,4,ActivationType.Swiglu,torch.bfloat16,torch.bfloat16,torch.float4_e2m1fn_x2,QuantType.per_1x32,1,0,64,0,,,,,,,178.1332,,325.5,10207.14,stage1,moe_cktile2stages_gemm1_256x64x256x256_1x4_16x16x32_1perCU_1x32_HasBias_swiglu,0.0%
256,512,3072,1536,128,4,ActivationType.Swiglu,torch.bfloat16,torch.bfloat16,torch.float4_e2m1fn_x2,QuantType.per_1x32,1,0,64,0,,,,,,,231.4851,,250.48,7854.63,stage1,moe_cktile2stages_gemm1_256x64x256x256_1x4_16x16x32_2perCU_1x32_HasBias_swiglu,0.0%
256,512,3072,1536,128,4,ActivationType.Swiglu,torch.bfloat16,torch.bfloat16,torch.float4_e2m1fn_x2,QuantType.per_1x32,1,0,64,0,,,,,,,174.065,,333.11,10445.7,stage1,moe_cktile2stages_gemm1_256x64x256x256_1x4_16x16x32_3perCU_1x32_HasBias_swiglu,0.0%
256,512,3072,1536,128,4,ActivationType.Swiglu,torch.bfloat16,torch.bfloat16,torch.float4_e2m1fn_x2,QuantType.per_1x32,1,0,64,0,,,,,,,177.9813,,325.78,10215.85,stage1,moe_cktile2stages_gemm1_256x64x256x256_1x4_16x16x32_4perCU_1x32_HasBias_swiglu,0.0%
256,512,3072,1536,128,4,ActivationType.Swiglu,torch.bfloat16,torch.bfloat16,torch.float4_e2m1fn_x2,QuantType.per_1x32,1,0,64,0,,,,,,,109.6517,,528.78,16581.88,stage2,moe_cktile2stages_gemm2_256x64x256x256_1x4_16x16x32_1perCU_1x32_MulRoutedWeight_HasBias,3.7%
256,512,3072,1536,128,4,ActivationType.Swiglu,torch.bfloat16,torch.bfloat16,torch.float4_e2m1fn_x2,QuantType.per_1x32,1,0,64,0,,,,,,,120.5928,,480.81,15077.44,stage2,moe_cktile2stages_gemm2_256x64x256x256_1x4_16x16x32_2perCU_1x32_MulRoutedWeight_HasBias,3.7%
256,512,3072,1536,128,4,ActivationType.Swiglu,torch.bfloat16,torch.bfloat16,torch.float4_e2m1fn_x2,QuantType.per_1x32,1,0,64,0,,,,,,,111.5,,520.02,16307.0,stage2,moe_cktile2stages_gemm2_256x64x256x256_1x4_16x16x32_3perCU_1x32_MulRoutedWeight_HasBias,3.7%
256,512,3072,1536,128,4,ActivationType.Swiglu,torch.bfloat16,torch.bfloat16,torch.float4_e2m1fn_x2,QuantType.per_1x32,1,0,64,0,,,,,,,111.2179,,521.34,16348.36,stage2,moe_cktile2stages_gemm2_256x64x256x256_1x4_16x16x32_4perCU_1x32_MulRoutedWeight_HasBias,3.7%
256,512,3072,1536,128,4,ActivationType.Swiglu,torch.bfloat16,torch.float8_e4m3fn,torch.float4_e2m1fn_x2,QuantType.per_1x32,1,0,32,0,,,,,,,-1.0,,0.0,0.0,stage1,flydsl_moe1_afp8_wfp4_bf16_t32x256x256,100.0%
256,512,3072,1536,128,4,ActivationType.Swiglu,torch.bfloat16,torch.float8_e4m3fn,torch.float4_e2m1fn_x2,QuantType.per_1x32,1,0,32,0,,,,,,,-1.0,,0.0,0.0,stage2,flydsl_moe2_afp8_wfp4_bf16_t32x128x256_atomic,100.0%
256,512,3072,1536,128,4,ActivationType.Swiglu,torch.bfloat16,torch.float8_e4m3fn,torch.float4_e2m1fn_x2,QuantType.per_1x32,1,0,32,0,,,,,,,-1.0,,0.0,0.0,stage2,flydsl_moe2_afp8_wfp4_bf16_t32x128x256_reduce,100.0%
256,512,3072,1536,128,4,ActivationType.Swiglu,torch.bfloat16,torch.float8_e4m3fn,torch.float4_e2m1fn_x2,QuantType.per_1x32,1,0,32,0,,,,,,,-1.0,,0.0,0.0,stage2,flydsl_moe2_afp8_wfp4_bf16_t32x256x256_atomic,100.0%
256,512,3072,1536,128,4,ActivationType.Swiglu,torch.bfloat16,torch.float8_e4m3fn,torch.float4_e2m1fn_x2,QuantType.per_1x32,1,0,32,0,,,,,,,-1.0,,0.0,0.0,stage2,flydsl_moe2_afp8_wfp4_bf16_t32x256x256_reduce,100.0%
256,512,3072,1536,128,4,ActivationType.Swiglu,torch.bfloat16,torch.float8_e4m3fn,torch.float4_e2m1fn_x2,QuantType.per_1x32,1,0,64,0,,,,,,,-1.0,,0.0,0.0,stage1,flydsl_moe1_afp8_wfp4_bf16_t64x256x256,100.0%
256,512,3072,1536,128,4,ActivationType.Swiglu,torch.bfloat16,torch.float8_e4m3fn,torch.float4_e2m1fn_x2,QuantType.per_1x32,1,0,64,0,,,,,,,-1.0,,0.0,0.0,stage2,flydsl_moe2_afp8_wfp4_bf16_t64x128x256_atomic,100.0%
256,512,3072,1536,128,4,ActivationType.Swiglu,torch.bfloat16,torch.float8_e4m3fn,torch.float4_e2m1fn_x2,QuantType.per_1x32,1,0,64,0,,,,,,,-1.0,,0.0,0.0,stage2,flydsl_moe2_afp8_wfp4_bf16_t64x128x256_reduce,100.0%
256,512,3072,1536,128,4,ActivationType.Swiglu,torch.bfloat16,torch.float8_e4m3fn,torch.float4_e2m1fn_x2,QuantType.per_1x32,1,0,64,0,,,,,,,-1.0,,0.0,0.0,stage2,flydsl_moe2_afp8_wfp4_bf16_t64x256x256_atomic,100.0%
256,512,3072,1536,128,4,ActivationType.Swiglu,torch.bfloat16,torch.float8_e4m3fn,torch.float4_e2m1fn_x2,QuantType.per_1x32,1,0,64,0,,,,,,,-1.0,,0.0,0.0,stage2,flydsl_moe2_afp8_wfp4_bf16_t64x256x256_reduce,100.0%
256,512,3072,1536,128,4,ActivationType.Swiglu,torch.bfloat16,torch.float8_e4m3fn,torch.float4_e2m1fn_x2,QuantType.per_1x32,1,0,128,0,,,,,,,-1.0,,0.0,0.0,stage2,flydsl_moe2_afp8_wfp4_bf16_t128x128x256_atomic,100.0%
256,512,3072,1536,128,4,ActivationType.Swiglu,torch.bfloat16,torch.float8_e4m3fn,torch.float4_e2m1fn_x2,QuantType.per_1x32,1,0,128,0,,,,,,,-1.0,,0.0,0.0,stage2,flydsl_moe2_afp8_wfp4_bf16_t128x128x256_reduce,100.0%
256,512,3072,1536,128,4,ActivationType.Swiglu,torch.bfloat16,torch.float8_e4m3fn,torch.float4_e2m1fn_x2,QuantType.per_1x32,1,0,128,0,,,,,,,-1.0,,0.0,0.0,stage2,flydsl_moe2_afp8_wfp4_bf16_t128x256x256_atomic,100.0%
256,512,3072,1536,128,4,ActivationType.Swiglu,torch.bfloat16,torch.float8_e4m3fn,torch.float4_e2m1fn_x2,QuantType.per_1x32,1,0,128,0,,,,,,,-1.0,,0.0,0.0,stage2,flydsl_moe2_afp8_wfp4_bf16_t128x256x256_reduce,100.0%
256,512,3072,1536,128,4,ActivationType.Swiglu,torch.bfloat16,torch.float8_e4m3fn,torch.float4_e2m1fn_x2,QuantType.per_1x32,1,0,32,0,,,,,,,118.4108,,489.67,15342.0,stage1,moe_cktile2stages_gemm1_256x32x256x256_1x4_16x16x128_2perCU_1x32_HasBias_swiglu,0.0%
256,512,3072,1536,128,4,ActivationType.Swiglu,torch.bfloat16,torch.float8_e4m3fn,torch.float4_e2m1fn_x2,QuantType.per_1x32,1,0,32,0,,,,,,,120.8684,,479.71,15030.05,stage1,moe_cktile2stages_gemm1_256x32x256x256_1x4_16x16x128_1perCU_1x32_HasBias_swiglu,0.0%
256,512,3072,1536,128,4,ActivationType.Swiglu,torch.bfloat16,torch.float8_e4m3fn,torch.float4_e2m1fn_x2,QuantType.per_1x32,1,0,32,0,,,,,,,123.7882,,468.4,14675.53,stage1,moe_cktile2stages_gemm1_256x32x256x256_1x4_16x16x128_3perCU_1x32_HasBias_swiglu,0.0%
256,512,3072,1536,128,4,ActivationType.Swiglu,torch.bfloat16,torch.float8_e4m3fn,torch.float4_e2m1fn_x2,QuantType.per_1x32,1,0,32,0,,,,,,,243.0962,,238.51,7473.0,stage1,moe_cktile2stages_gemm1_256x32x256x256_1x4_16x16x128_4perCU_1x32_HasBias_swiglu,0.0%
256,512,3072,1536,128,4,ActivationType.Swiglu,torch.bfloat16,torch.float8_e4m3fn,torch.float4_e2m1fn_x2,QuantType.per_1x32,1,0,32,0,,,,,,,73.218,,791.91,24811.63,stage2,moe_cktile2stages_gemm2_256x32x256x256_1x4_16x16x128_2perCU_1x32_MulRoutedWeight_HasBias,3.7%
256,512,3072,1536,128,4,ActivationType.Swiglu,torch.bfloat16,torch.float8_e4m3fn,torch.float4_e2m1fn_x2,QuantType.per_1x32,1,0,32,0,,,,,,,72.7812,,796.66,24960.54,stage2,moe_cktile2stages_gemm2_256x32x256x256_1x4_16x16x128_1perCU_1x32_MulRoutedWeight_HasBias,3.7%
256,512,3072,1536,128,4,ActivationType.Swiglu,torch.bfloat16,torch.float8_e4m3fn,torch.float4_e2m1fn_x2,QuantType.per_1x32,1,0,32,0,,,,,,,76.7566,,755.4,23667.77,stage2,moe_cktile2stages_gemm2_256x32x256x256_1x4_16x16x128_3perCU_1x32_MulRoutedWeight_HasBias,3.7%
256,512,3072,1536,128,4,ActivationType.Swiglu,torch.bfloat16,torch.float8_e4m3fn,torch.float4_e2m1fn_x2,QuantType.per_1x32,1,0,32,0,,,,,,,147.3465,,393.51,12329.16,stage2,moe_cktile2stages_gemm2_256x32x256x256_1x4_16x16x128_4perCU_1x32_MulRoutedWeight_HasBias,3.7%
256,512,3072,1536,128,4,ActivationType.Swiglu,torch.bfloat16,torch.float8_e4m3fn,torch.float4_e2m1fn_x2,QuantType.per_1x32,1,0,64,0,,,,,,,140.7871,,411.84,12903.58,stage1,moe_cktile2stages_gemm1_256x64x256x256_1x4_16x16x128_1perCU_1x32_HasBias_swiglu,94.1%
256,512,3072,1536,128,4,ActivationType.Swiglu,torch.bfloat16,torch.float8_e4m3fn,torch.float4_e2m1fn_x2,QuantType.per_1x32,1,0,64,0,,,,,,,125.0922,,463.51,14522.55,stage1,moe_cktile2stages_gemm1_256x64x256x256_1x4_16x16x128_2perCU_1x32_HasBias_swiglu,94.1%
256,512,3072,1536,128,4,ActivationType.Swiglu,torch.bfloat16,torch.float8_e4m3fn,torch.float4_e2m1fn_x2,QuantType.per_1x32,1,0,64,0,,,,,,,325.898,,177.91,5574.31,stage1,moe_cktile2stages_gemm1_256x64x256x256_1x4_16x16x128_3perCU_1x32_HasBias_swiglu,94.1%
256,512,3072,1536,128,4,ActivationType.Swiglu,torch.bfloat16,torch.float8_e4m3fn,torch.float4_e2m1fn_x2,QuantType.per_1x32,1,0,64,0,,,,,,,642.9699,,90.18,2825.42,stage1,moe_cktile2stages_gemm1_256x64x256x256_1x4_16x16x128_4perCU_1x32_HasBias_swiglu,94.1%
256,512,3072,1536,128,4,ActivationType.Swiglu,torch.bfloat16,torch.float8_e4m3fn,torch.float4_e2m1fn_x2,QuantType.per_1x32,1,0,64,0,,,,,,,92.0734,,629.74,19730.54,stage2,moe_cktile2stages_gemm2_256x64x256x256_1x4_16x16x128_1perCU_1x32_MulRoutedWeight_HasBias,99.9%
256,512,3072,1536,128,4,ActivationType.Swiglu,torch.bfloat16,torch.float8_e4m3fn,torch.float4_e2m1fn_x2,QuantType.per_1x32,1,0,64,0,,,,,,,91.8931,,630.97,19769.25,stage2,moe_cktile2stages_gemm2_256x64x256x256_1x4_16x16x128_2perCU_1x32_MulRoutedWeight_HasBias,99.9%
256,512,3072,1536,128,4,ActivationType.Swiglu,torch.bfloat16,torch.float8_e4m3fn,torch.float4_e2m1fn_x2,QuantType.per_1x32,1,0,64,0,,,,,,,184.0471,,315.04,9870.61,stage2,moe_cktile2stages_gemm2_256x64x256x256_1x4_16x16x128_3perCU_1x32_MulRoutedWeight_HasBias,99.9%
256,512,3072,1536,128,4,ActivationType.Swiglu,torch.bfloat16,torch.float8_e4m3fn,torch.float4_e2m1fn_x2,QuantType.per_1x32,1,0,64,0,,,,,,,300.7023,,192.82,6041.38,stage2,moe_cktile2stages_gemm2_256x64x256x256_1x4_16x16x128_4perCU_1x32_MulRoutedWeight_HasBias,99.9%
256,512,3072,3072,128,4,ActivationType.Swiglu,torch.bfloat16,torch.bfloat16,torch.float4_e2m1fn_x2,QuantType.per_1x32,1,0,32,0,,,,,,,-1.0,,0.0,0.0,stage1,flydsl_moe1_afp16_wfp4_bf16_t32x256x256,100.0%
256,512,3072,3072,128,4,ActivationType.Swiglu,torch.bfloat16,torch.bfloat16,torch.float4_e2m1fn_x2,QuantType.per_1x32,1,0,32,0,,,,,,,-1.0,,0.0,0.0,stage2,flydsl_moe2_afp16_wfp4_bf16_t32x128x256_atomic,100.0%
256,512,3072,3072,128,4,ActivationType.Swiglu,torch.bfloat16,torch.bfloat16,torch.float4_e2m1fn_x2,QuantType.per_1x32,1,0,32,0,,,,,,,-1.0,,0.0,0.0,stage2,flydsl_moe2_afp16_wfp4_bf16_t32x128x256_reduce,100.0%
256,512,3072,3072,128,4,ActivationType.Swiglu,torch.bfloat16,torch.bfloat16,torch.float4_e2m1fn_x2,QuantType.per_1x32,1,0,32,0,,,,,,,-1.0,,0.0,0.0,stage2,flydsl_moe2_afp16_wfp4_bf16_t32x256x256_atomic,100.0%
256,512,3072,3072,128,4,ActivationType.Swiglu,torch.bfloat16,torch.bfloat16,torch.float4_e2m1fn_x2,QuantType.per_1x32,1,0,32,0,,,,,,,-1.0,,0.0,0.0,stage2,flydsl_moe2_afp16_wfp4_bf16_t32x256x256_reduce,100.0%
256,512,3072,3072,128,4,ActivationType.Swiglu,torch.bfloat16,torch.bfloat16,torch.float4_e2m1fn_x2,QuantType.per_1x32,1,0,64,0,,,,,,,-1.0,,0.0,0.0,stage1,flydsl_moe1_afp16_wfp4_bf16_t64x256x256,100.0%
256,512,3072,3072,128,4,ActivationType.Swiglu,torch.bfloat16,torch.bfloat16,torch.float4_e2m1fn_x2,QuantType.per_1x32,1,0,64,0,,,,,,,-1.0,,0.0,0.0,stage2,flydsl_moe2_afp16_wfp4_bf16_t64x128x256_atomic,100.0%
256,512,3072,3072,128,4,ActivationType.Swiglu,torch.bfloat16,torch.bfloat16,torch.float4_e2m1fn_x2,QuantType.per_1x32,1,0,64,0,,,,,,,-1.0,,0.0,0.0,stage2,flydsl_moe2_afp16_wfp4_bf16_t64x128x256_reduce,100.0%
256,512,3072,3072,128,4,ActivationType.Swiglu,torch.bfloat16,torch.bfloat16,torch.float4_e2m1fn_x2,QuantType.per_1x32,1,0,64,0,,,,,,,-1.0,,0.0,0.0,stage2,flydsl_moe2_afp16_wfp4_bf16_t64x256x256_atomic,100.0%
256,512,3072,3072,128,4,ActivationType.Swiglu,torch.bfloat16,torch.bfloat16,torch.float4_e2m1fn_x2,QuantType.per_1x32,1,0,64,0,,,,,,,-1.0,,0.0,0.0,stage2,flydsl_moe2_afp16_wfp4_bf16_t64x256x256_reduce,100.0%
256,512,3072,3072,128,4,ActivationType.Swiglu,torch.bfloat16,torch.bfloat16,torch.float4_e2m1fn_x2,QuantType.per_1x32,1,0,128,0,,,,,,,-1.0,,0.0,0.0,stage2,flydsl_moe2_afp16_wfp4_bf16_t128x128x256_atomic,100.0%
256,512,3072,3072,128,4,ActivationType.Swiglu,torch.bfloat16,torch.bfloat16,torch.float4_e2m1fn_x2,QuantType.per_1x32,1,0,128,0,,,,,,,-1.0,,0.0,0.0,stage2,flydsl_moe2_afp16_wfp4_bf16_t128x128x256_reduce,100.0%
256,512,3072,3072,128,4,ActivationType.Swiglu,torch.bfloat16,torch.bfloat16,torch.float4_e2m1fn_x2,QuantType.per_1x32,1,0,128,0,,,,,,,-1.0,,0.0,0.0,stage2,flydsl_moe2_afp16_wfp4_bf16_t128x256x256_atomic,100.0%
256,512,3072,3072,128,4,ActivationType.Swiglu,torch.bfloat16,torch.bfloat16,torch.float4_e2m1fn_x2,QuantType.per_1x32,1,0,128,0,,,,,,,-1.0,,0.0,0.0,stage2,flydsl_moe2_afp16_wfp4_bf16_t128x256x256_reduce,100.0%
256,512,3072,3072,128,4,ActivationType.Swiglu,torch.bfloat16,torch.bfloat16,torch.float4_e2m1fn_x2,QuantType.per_1x32,1,0,32,0,,,,,,,236.9656,,489.37,15319.4,stage1,moe_cktile2stages_gemm1_256x32x256x256_1x4_16x16x32_2perCU_1x32_HasBias_swiglu,0.0%
256,512,3072,3072,128,4,ActivationType.Swiglu,torch.bfloat16,torch.bfloat16,torch.float4_e2m1fn_x2,QuantType.per_1x32,1,0,32,0,,,,,,,236.3575,,490.63,15358.81,stage1,moe_cktile2stages_gemm1_256x32x256x256_1x4_16x16x32_1perCU_1x32_HasBias_swiglu,0.0%
256,512,3072,3072,128,4,ActivationType.Swiglu,torch.bfloat16,torch.bfloat16,torch.float4_e2m1fn_x2,QuantType.per_1x32,1,0,32,0,,,,,,,358.1664,,323.77,10135.43,stage1,moe_cktile2stages_gemm1_256x32x256x256_1x4_16x16x32_3perCU_1x32_HasBias_swiglu,0.0%
256,512,3072,3072,128,4,ActivationType.Swiglu,torch.bfloat16,torch.bfloat16,torch.float4_e2m1fn_x2,QuantType.per_1x32,1,0,32,0,,,,,,,702.1858,,165.15,5169.81,stage1,moe_cktile2stages_gemm1_256x32x256x256_1x4_16x16x32_4perCU_1x32_HasBias_swiglu,0.0%
256,512,3072,3072,128,4,ActivationType.Swiglu,torch.bfloat16,torch.bfloat16,torch.float4_e2m1fn_x2,QuantType.per_1x32,1,0,32,0,,,,,,,129.79,,893.47,27969.57,stage2,moe_cktile2stages_gemm2_256x32x256x256_1x4_16x16x32_2perCU_1x32_MulRoutedWeight_HasBias,5.1%
256,512,3072,3072,128,4,ActivationType.Swiglu,torch.bfloat16,torch.bfloat16,torch.float4_e2m1fn_x2,QuantType.per_1x32,1,0,32,0,,,,,,,129.5908,,894.85,28012.56,stage2,moe_cktile2stages_gemm2_256x32x256x256_1x4_16x16x32_1perCU_1x32_MulRoutedWeight_HasBias,5.1%
256,512,3072,3072,128,4,ActivationType.Swiglu,torch.bfloat16,torch.bfloat16,torch.float4_e2m1fn_x2,QuantType.per_1x32,1,0,32,0,,,,,,,191.9523,,604.13,18911.83,stage2,moe_cktile2stages_gemm2_256x32x256x256_1x4_16x16x32_3perCU_1x32_MulRoutedWeight_HasBias,5.1%
256,512,3072,3072,128,4,ActivationType.Swiglu,torch.bfloat16,torch.bfloat16,torch.float4_e2m1fn_x2,QuantType.per_1x32,1,0,32,0,,,,,,,429.4563,,270.03,8452.94,stage2,moe_cktile2stages_gemm2_256x32x256x256_1x4_16x16x32_4perCU_1x32_MulRoutedWeight_HasBias,5.1%
256,512,3072,3072,128,4,ActivationType.Swiglu,torch.bfloat16,torch.bfloat16,torch.float4_e2m1fn_x2,QuantType.per_1x32,1,0,64,0,,,,,,,342.4005,,338.68,10602.12,stage1,moe_cktile2stages_gemm1_256x64x256x256_1x4_16x16x32_1perCU_1x32_HasBias_swiglu,0.0%
256,512,3072,3072,128,4,ActivationType.Swiglu,torch.bfloat16,torch.bfloat16,torch.float4_e2m1fn_x2,QuantType.per_1x32,1,0,64,0,,,,,,,446.0542,,259.98,8138.41,stage1,moe_cktile2stages_gemm1_256x64x256x256_1x4_16x16x32_2perCU_1x32_HasBias_swiglu,0.0%
256,512,3072,3072,128,4,ActivationType.Swiglu,torch.bfloat16,torch.bfloat16,torch.float4_e2m1fn_x2,QuantType.per_1x32,1,0,64,0,,,,,,,342.3495,,338.73,10603.7,stage1,moe_cktile2stages_gemm1_256x64x256x256_1x4_16x16x32_3perCU_1x32_HasBias_swiglu,0.0%
256,512,3072,3072,128,4,ActivationType.Swiglu,torch.bfloat16,torch.bfloat16,torch.float4_e2m1fn_x2,QuantType.per_1x32,1,0,64,0,,,,,,,339.031,,342.05,10707.49,stage1,moe_cktile2stages_gemm1_256x64x256x256_1x4_16x16x32_4perCU_1x32_HasBias_swiglu,0.0%
256,512,3072,3072,128,4,ActivationType.Swiglu,torch.bfloat16,torch.bfloat16,torch.float4_e2m1fn_x2,QuantType.per_1x32,1,0,64,0,,,,,,,178.7774,,648.65,20305.53,stage2,moe_cktile2stages_gemm2_256x64x256x256_1x4_16x16x32_1perCU_1x32_MulRoutedWeight_HasBias,5.1%
256,512,3072,3072,128,4,ActivationType.Swiglu,torch.bfloat16,torch.bfloat16,torch.float4_e2m1fn_x2,QuantType.per_1x32,1,0,64,0,,,,,,,202.4112,,572.91,17934.63,stage2,moe_cktile2stages_gemm2_256x64x256x256_1x4_16x16x32_2perCU_1x32_MulRoutedWeight_HasBias,5.1%
256,512,3072,3072,128,4,ActivationType.Swiglu,torch.bfloat16,torch.bfloat16,torch.float4_e2m1fn_x2,QuantType.per_1x32,1,0,64,0,,,,,,,178.8917,,648.24,20292.56,stage2,moe_cktile2stages_gemm2_256x64x256x256_1x4_16x16x32_3perCU_1x32_MulRoutedWeight_HasBias,5.1%
256,512,3072,3072,128,4,ActivationType.Swiglu,torch.bfloat16,torch.bfloat16,torch.float4_e2m1fn_x2,QuantType.per_1x32,1,0,64,0,,,,,,,177.0539,,654.97,20503.19,stage2,moe_cktile2stages_gemm2_256x64x256x256_1x4_16x16x32_4perCU_1x32_MulRoutedWeight_HasBias,5.1%
256,512,3072,3072,128,4,ActivationType.Swiglu,torch.bfloat16,torch.float8_e4m3fn,torch.float4_e2m1fn_x2,QuantType.per_1x32,1,0,32,0,,,,,,,-1.0,,0.0,0.0,stage1,flydsl_moe1_afp8_wfp4_bf16_t32x256x256,100.0%
256,512,3072,3072,128,4,ActivationType.Swiglu,torch.bfloat16,torch.float8_e4m3fn,torch.float4_e2m1fn_x2,QuantType.per_1x32,1,0,32,0,,,,,,,-1.0,,0.0,0.0,stage2,flydsl_moe2_afp8_wfp4_bf16_t32x128x256_atomic,100.0%
256,512,3072,3072,128,4,ActivationType.Swiglu,torch.bfloat16,torch.float8_e4m3fn,torch.float4_e2m1fn_x2,QuantType.per_1x32,1,0,32,0,,,,,,,-1.0,,0.0,0.0,stage2,flydsl_moe2_afp8_wfp4_bf16_t32x128x256_reduce,100.0%
256,512,3072,3072,128,4,ActivationType.Swiglu,torch.bfloat16,torch.float8_e4m3fn,torch.float4_e2m1fn_x2,QuantType.per_1x32,1,0,32,0,,,,,,,-1.0,,0.0,0.0,stage2,flydsl_moe2_afp8_wfp4_bf16_t32x256x256_atomic,100.0%
256,512,3072,3072,128,4,ActivationType.Swiglu,torch.bfloat16,torch.float8_e4m3fn,torch.float4_e2m1fn_x2,QuantType.per_1x32,1,0,32,0,,,,,,,-1.0,,0.0,0.0,stage2,flydsl_moe2_afp8_wfp4_bf16_t32x256x256_reduce,100.0%
256,512,3072,3072,128,4,ActivationType.Swiglu,torch.bfloat16,torch.float8_e4m3fn,torch.float4_e2m1fn_x2,QuantType.per_1x32,1,0,64,0,,,,,,,-1.0,,0.0,0.0,stage1,flydsl_moe1_afp8_wfp4_bf16_t64x256x256,100.0%
256,512,3072,3072,128,4,ActivationType.Swiglu,torch.bfloat16,torch.float8_e4m3fn,torch.float4_e2m1fn_x2,QuantType.per_1x32,1,0,64,0,,,,,,,-1.0,,0.0,0.0,stage2,flydsl_moe2_afp8_wfp4_bf16_t64x128x256_atomic,100.0%
256,512,3072,3072,128,4,ActivationType.Swiglu,torch.bfloat16,torch.float8_e4m3fn,torch.float4_e2m1fn_x2,QuantType.per_1x32,1,0,64,0,,,,,,,-1.0,,0.0,0.0,stage2,flydsl_moe2_afp8_wfp4_bf16_t64x128x256_reduce,100.0%
256,512,3072,3072,128,4,ActivationType.Swiglu,torch.bfloat16,torch.float8_e4m3fn,torch.float4_e2m1fn_x2,QuantType.per_1x32,1,0,64,0,,,,,,,-1.0,,0.0,0.0,stage2,flydsl_moe2_afp8_wfp4_bf16_t64x256x256_atomic,100.0%
256,512,3072,3072,128,4,ActivationType.Swiglu,torch.bfloat16,torch.float8_e4m3fn,torch.float4_e2m1fn_x2,QuantType.per_1x32,1,0,64,0,,,,,,,-1.0,,0.0,0.0,stage2,flydsl_moe2_afp8_wfp4_bf16_t64x256x256_reduce,100.0%
256,512,3072,3072,128,4,ActivationType.Swiglu,torch.bfloat16,torch.float8_e4m3fn,torch.float4_e2m1fn_x2,QuantType.per_1x32,1,0,128,0,,,,,,,-1.0,,0.0,0.0,stage2,flydsl_moe2_afp8_wfp4_bf16_t128x128x256_atomic,100.0%
256,512,3072,3072,128,4,ActivationType.Swiglu,torch.bfloat16,torch.float8_e4m3fn,torch.float4_e2m1fn_x2,QuantType.per_1x32,1,0,128,0,,,,,,,-1.0,,0.0,0.0,stage2,flydsl_moe2_afp8_wfp4_bf16_t128x128x256_reduce,100.0%
256,512,3072,3072,128,4,ActivationType.Swiglu,torch.bfloat16,torch.float8_e4m3fn,torch.float4_e2m1fn_x2,QuantType.per_1x32,1,0,128,0,,,,,,,-1.0,,0.0,0.0,stage2,flydsl_moe2_afp8_wfp4_bf16_t128x256x256_atomic,100.0%
256,512,3072,3072,128,4,ActivationType.Swiglu,torch.bfloat16,torch.float8_e4m3fn,torch.float4_e2m1fn_x2,QuantType.per_1x32,1,0,128,0,,,,,,,-1.0,,0.0,0.0,stage2,flydsl_moe2_afp8_wfp4_bf16_t128x256x256_reduce,100.0%
256,512,3072,3072,128,4,ActivationType.Swiglu,torch.bfloat16,torch.float8_e4m3fn,torch.float4_e2m1fn_x2,QuantType.per_1x32,1,0,32,0,,,,,,,235.235,,492.97,15425.41,stage1,moe_cktile2stages_gemm1_256x32x256x256_1x4_16x16x128_2perCU_1x32_HasBias_swiglu,0.0%
256,512,3072,3072,128,4,ActivationType.Swiglu,torch.bfloat16,torch.float8_e4m3fn,torch.float4_e2m1fn_x2,QuantType.per_1x32,1,0,32,0,,,,,,,233.4283,,496.79,15544.8,stage1,moe_cktile2stages_gemm1_256x32x256x256_1x4_16x16x128_1perCU_1x32_HasBias_swiglu,0.0%
256,512,3072,3072,128,4,ActivationType.Swiglu,torch.bfloat16,torch.float8_e4m3fn,torch.float4_e2m1fn_x2,QuantType.per_1x32,1,0,32,0,,,,,,,250.6078,,462.73,14479.19,stage1,moe_cktile2stages_gemm1_256x32x256x256_1x4_16x16x128_3perCU_1x32_HasBias_swiglu,0.0%
256,512,3072,3072,128,4,ActivationType.Swiglu,torch.bfloat16,torch.float8_e4m3fn,torch.float4_e2m1fn_x2,QuantType.per_1x32,1,0,32,0,,,,,,,428.2229,,270.8,8473.62,stage1,moe_cktile2stages_gemm1_256x32x256x256_1x4_16x16x128_4perCU_1x32_HasBias_swiglu,0.0%
256,512,3072,3072,128,4,ActivationType.Swiglu,torch.bfloat16,torch.float8_e4m3fn,torch.float4_e2m1fn_x2,QuantType.per_1x32,1,0,32,0,,,,,,,124.396,,932.22,29169.73,stage2,moe_cktile2stages_gemm2_256x32x256x256_1x4_16x16x128_2perCU_1x32_MulRoutedWeight_HasBias,5.1%
256,512,3072,3072,128,4,ActivationType.Swiglu,torch.bfloat16,torch.float8_e4m3fn,torch.float4_e2m1fn_x2,QuantType.per_1x32,1,0,32,0,,,,,,,127.368,,910.47,28489.08,stage2,moe_cktile2stages_gemm2_256x32x256x256_1x4_16x16x128_1perCU_1x32_MulRoutedWeight_HasBias,5.1%
256,512,3072,3072,128,4,ActivationType.Swiglu,torch.bfloat16,torch.float8_e4m3fn,torch.float4_e2m1fn_x2,QuantType.per_1x32,1,0,32,0,,,,,,,130.7956,,886.61,27742.5,stage2,moe_cktile2stages_gemm2_256x32x256x256_1x4_16x16x128_3perCU_1x32_MulRoutedWeight_HasBias,5.1%
256,512,3072,3072,128,4,ActivationType.Swiglu,torch.bfloat16,torch.float8_e4m3fn,torch.float4_e2m1fn_x2,QuantType.per_1x32,1,0,32,0,,,,,,,263.3319,,440.37,13779.56,stage2,moe_cktile2stages_gemm2_256x32x256x256_1x4_16x16x128_4perCU_1x32_MulRoutedWeight_HasBias,5.0%
256,512,3072,3072,128,4,ActivationType.Swiglu,torch.bfloat16,torch.float8_e4m3fn,torch.float4_e2m1fn_x2,QuantType.per_1x32,1,0,64,0,,,,,,,268.9577,,431.16,13491.33,stage1,moe_cktile2stages_gemm1_256x64x256x256_1x4_16x16x128_1perCU_1x32_HasBias_swiglu,94.1%
256,512,3072,3072,128,4,ActivationType.Swiglu,torch.bfloat16,torch.float8_e4m3fn,torch.float4_e2m1fn_x2,QuantType.per_1x32,1,0,64,0,,,,,,,243.481,,476.28,14903.0,stage1,moe_cktile2stages_gemm1_256x64x256x256_1x4_16x16x128_2perCU_1x32_HasBias_swiglu,94.1%
256,512,3072,3072,128,4,ActivationType.Swiglu,torch.bfloat16,torch.float8_e4m3fn,torch.float4_e2m1fn_x2,QuantType.per_1x32,1,0,64,0,,,,,,,639.7871,,181.25,5671.57,stage1,moe_cktile2stages_gemm1_256x64x256x256_1x4_16x16x128_3perCU_1x32_HasBias_swiglu,94.1%
256,512,3072,3072,128,4,ActivationType.Swiglu,torch.bfloat16,torch.float8_e4m3fn,torch.float4_e2m1fn_x2,QuantType.per_1x32,1,0,64,0,,,,,,,1126.2787,,102.96,3221.76,stage1,moe_cktile2stages_gemm1_256x64x256x256_1x4_16x16x128_4perCU_1x32_HasBias_swiglu,94.1%
256,512,3072,3072,128,4,ActivationType.Swiglu,torch.bfloat16,torch.float8_e4m3fn,torch.float4_e2m1fn_x2,QuantType.per_1x32,1,0,64,0,,,,,,,144.5001,,802.52,25111.38,stage2,moe_cktile2stages_gemm2_256x64x256x256_1x4_16x16x128_1perCU_1x32_MulRoutedWeight_HasBias,99.9%
256,512,3072,3072,128,4,ActivationType.Swiglu,torch.bfloat16,torch.float8_e4m3fn,torch.float4_e2m1fn_x2,QuantType.per_1x32,1,0,64,0,,,,,,,138.3097,,838.44,26235.31,stage2,moe_cktile2stages_gemm2_256x64x256x256_1x4_16x16x128_2perCU_1x32_MulRoutedWeight_HasBias,99.9%
256,512,3072,3072,128,4,ActivationType.Swiglu,torch.bfloat16,torch.float8_e4m3fn,torch.float4_e2m1fn_x2,QuantType.per_1x32,1,0,64,0,,,,,,,329.3338,,352.12,11017.99,stage2,moe_cktile2stages_gemm2_256x64x256x256_1x4_16x16x128_3perCU_1x32_MulRoutedWeight_HasBias,99.9%
256,512,3072,3072,128,4,ActivationType.Swiglu,torch.bfloat16,torch.float8_e4m3fn,torch.float4_e2m1fn_x2,QuantType.per_1x32,1,0,64,0,,,,,,,587.0238,,197.55,6181.35,stage2,moe_cktile2stages_gemm2_256x64x256x256_1x4_16x16x128_4perCU_1x32_MulRoutedWeight_HasBias,99.9%
256,1024,3072,512,128,4,ActivationType.Swiglu,torch.bfloat16,torch.float8_e4m3fn,torch.float4_e2m1fn_x2,QuantType.per_1x32,1,0,32,0,,,,,,,-1.0,,0.0,0.0,stage1,flydsl_moe1_afp8_wfp4_bf16_t32x256x256,100.0%
256,1024,3072,512,128,4,ActivationType.Swiglu,torch.bfloat16,torch.float8_e4m3fn,torch.float4_e2m1fn_x2,QuantType.per_1x32,1,0,32,0,,,,,,,-1.0,,0.0,0.0,stage2,flydsl_moe2_afp8_wfp4_bf16_t32x128x256_atomic,100.0%
256,1024,3072,512,128,4,ActivationType.Swiglu,torch.bfloat16,torch.float8_e4m3fn,torch.float4_e2m1fn_x2,QuantType.per_1x32,1,0,32,0,,,,,,,-1.0,,0.0,0.0,stage2,flydsl_moe2_afp8_wfp4_bf16_t32x128x256_reduce,100.0%
256,1024,3072,512,128,4,ActivationType.Swiglu,torch.bfloat16,torch.float8_e4m3fn,torch.float4_e2m1fn_x2,QuantType.per_1x32,1,0,32,0,,,,,,,-1.0,,0.0,0.0,stage2,flydsl_moe2_afp8_wfp4_bf16_t32x256x256_atomic,100.0%
256,1024,3072,512,128,4,ActivationType.Swiglu,torch.bfloat16,torch.float8_e4m3fn,torch.float4_e2m1fn_x2,QuantType.per_1x32,1,0,32,0,,,,,,,-1.0,,0.0,0.0,stage2,flydsl_moe2_afp8_wfp4_bf16_t32x256x256_reduce,100.0%
256,1024,3072,512,128,4,ActivationType.Swiglu,torch.bfloat16,torch.float8_e4m3fn,torch.float4_e2m1fn_x2,QuantType.per_1x32,1,0,64,0,,,,,,,-1.0,,0.0,0.0,stage1,flydsl_moe1_afp8_wfp4_bf16_t64x256x256,100.0%
256,1024,3072,512,128,4,ActivationType.Swiglu,torch.bfloat16,torch.float8_e4m3fn,torch.float4_e2m1fn_x2,QuantType.per_1x32,1,0,64,0,,,,,,,-1.0,,0.0,0.0,stage2,flydsl_moe2_afp8_wfp4_bf16_t64x128x256_atomic,100.0%
256,1024,3072,512,128,4,ActivationType.Swiglu,torch.bfloat16,torch.float8_e4m3fn,torch.float4_e2m1fn_x2,QuantType.per_1x32,1,0,64,0,,,,,,,-1.0,,0.0,0.0,stage2,flydsl_moe2_afp8_wfp4_bf16_t64x128x256_reduce,100.0%
256,1024,3072,512,128,4,ActivationType.Swiglu,torch.bfloat16,torch.float8_e4m3fn,torch.float4_e2m1fn_x2,QuantType.per_1x32,1,0,64,0,,,,,,,-1.0,,0.0,0.0,stage2,flydsl_moe2_afp8_wfp4_bf16_t64x256x256_atomic,100.0%
256,1024,3072,512,128,4,ActivationType.Swiglu,torch.bfloat16,torch.float8_e4m3fn,torch.float4_e2m1fn_x2,QuantType.per_1x32,1,0,64,0,,,,,,,-1.0,,0.0,0.0,stage2,flydsl_moe2_afp8_wfp4_bf16_t64x256x256_reduce,100.0%
256,1024,3072,512,128,4,ActivationType.Swiglu,torch.bfloat16,torch.float8_e4m3fn,torch.float4_e2m1fn_x2,QuantType.per_1x32,1,0,128,0,,,,,,,-1.0,,0.0,0.0,stage2,flydsl_moe2_afp8_wfp4_bf16_t128x128x256_atomic,100.0%
256,1024,3072,512,128,4,ActivationType.Swiglu,torch.bfloat16,torch.float8_e4m3fn,torch.float4_e2m1fn_x2,QuantType.per_1x32,1,0,128,0,,,,,,,-1.0,,0.0,0.0,stage2,flydsl_moe2_afp8_wfp4_bf16_t128x128x256_reduce,100.0%
256,1024,3072,512,128,4,ActivationType.Swiglu,torch.bfloat16,torch.float8_e4m3fn,torch.float4_e2m1fn_x2,QuantType.per_1x32,1,0,128,0,,,,,,,-1.0,,0.0,0.0,stage2,flydsl_moe2_afp8_wfp4_bf16_t128x256x256_atomic,100.0%
256,1024,3072,512,128,4,ActivationType.Swiglu,torch.bfloat16,torch.float8_e4m3fn,torch.float4_e2m1fn_x2,QuantType.per_1x32,1,0,128,0,,,,,,,-1.0,,0.0,0.0,stage2,flydsl_moe2_afp8_wfp4_bf16_t128x256x256_reduce,100.0%
256,1024,3072,512,128,4,ActivationType.Swiglu,torch.bfloat16,torch.float8_e4m3fn,torch.float4_e2m1fn_x2,QuantType.per_1x32,1,0,32,0,,,,,,,55.7411,,693.47,11004.75,stage1,moe_cktile2stages_gemm1_256x32x256x256_1x4_16x16x128_2perCU_1x32_HasBias_swiglu,0.0%
