aiter/configs/profile_fmoe_flydsl_fp8.csv
cu_num,token,model_dim,inter_dim,expert,topk,act_type,dtype,q_dtype_a,q_dtype_w,q_type,use_g1u1,doweight_stage1,block_m,ksplit,us1,kernelName1,err1,us2,kernelName2,err2,us,run_1stage,tflops,bw
80,1024,7168,2048,33,10,ActivationType.Silu,torch.bfloat16,torch.float8_e4m3fnuz,torch.float8_e4m3fnuz,QuantType.per_Token,1,0,64,0,1656.9722,_ZN5aiter48fmoe_stage1_bf16_pertokenFp8_g1u1_64x128_2tg_pf3E,0.0%,1435.1064,moe_ck2stages_gemm2_256x64x128x128_1x4_MulABScaleExpertWeight_v3_Nswizzle0_Quant2_MulRoutedWeight1_F8_F8_B16,7.6%,3092.0786,0,291.69,477.14
80,1024,7168,2048,33,10,ActivationType.Silu,torch.bfloat16,torch.float8_e4m3fnuz,torch.float8_e4m3fnuz,QuantType.per_Token,1,0,32,0,1846.6738,_ZN5aiter48fmoe_stage1_bf16_pertokenFp8_g1u1_32x256_2tg_pf3E,0.0%,1798.0241,moe_ck2stages_gemm2_256x32x64x256_1x4_MulABScaleExpertWeight_v1_Nswizzle0_Quant2_MulRoutedWeight1_F8_F8_B16,7.6%,3644.6979,0,247.47,404.79
80,1024,7168,2048,33,10,ActivationType.Silu,torch.bfloat16,torch.float8_e4m3fnuz,torch.float8_e4m3fnuz,QuantType.per_Token,1,0,128,0,1920.356,_ZN5aiter45fmoe_stage1_bf16_pertokenFp8_g1u1_128x128_pf2E,0.0%,1430.5475,moe_ck2stages_gemm2_256x128x128x128_1x4_MulABScaleExpertWeight_v3_Nswizzle0_Quant2_MulRoutedWeight1_F8_F8_B16,7.6%,3350.9035,0,269.16,440.28
80,1024,7168,2048,33,10,ActivationType.Silu,torch.bfloat16,torch.float8_e4m3fnuz,torch.float8_e4m3fnuz,QuantType.per_Token,1,0,16,0,3019.9755,_ZN5aiter48fmoe_stage1_bf16_pertokenFp8_g1u1_16x512_2tg_pf2E,0.0%,1899.1696,moe_ck2stages_gemm2_256x16x128x256_1x4_MulABScaleExpertWeight_v1_Nswizzle0_Quant2_MulRoutedWeight1_F8_F8_B16,7.6%,4919.1451,0,183.35,299.92
80,1024,7168,2048,33,10,ActivationType.Silu,torch.bfloat16,torch.float8_e4m3fnuz,torch.float8_e4m3fnuz,QuantType.per_Token,1,0,32,0,3281.6287,_ZN5aiter45fmoe_bf16_pertokenFp8_g1u1_vs_silu_1tg_32x512E,0.0%,0.0,,0.0%,3281.6287,1,274.85,449.58
