aiter/configs/profile_fmoe.csv
stage,cu_num,token,model_dim,inter_dim,expert,topk,act_type,dtype,q_dtype_a,q_dtype_w,q_type,use_g1u1,doweight_stage1,block_m,ksplit,us,kernelName,err,tflops,bw
stage1,80,1024,7168,2048,33,10,ActivationType.Silu,torch.bfloat16,torch.float8_e4m3fnuz,torch.float8_e4m3fnuz,QuantType.per_Token,1,0,16,0,3409.4029,_ZN5aiter48fmoe_stage1_bf16_pertokenFp8_g1u1_16x128_4tg_pf2E,0.0%,264.55,432.73
stage1,80,1024,7168,2048,33,10,ActivationType.Silu,torch.bfloat16,torch.float8_e4m3fnuz,torch.float8_e4m3fnuz,QuantType.per_Token,1,0,16,0,3306.8689,_ZN5aiter48fmoe_stage1_bf16_pertokenFp8_g1u1_16x128_4tg_pf3E,0.0%,272.75,446.15
stage1,80,1024,7168,2048,33,10,ActivationType.Silu,torch.bfloat16,torch.float8_e4m3fnuz,torch.float8_e4m3fnuz,QuantType.per_Token,1,0,16,0,3079.4601,_ZN5aiter48fmoe_stage1_bf16_pertokenFp8_g1u1_16x256_3tg_pf2E,0.0%,292.89,479.09
stage1,80,1024,7168,2048,33,10,ActivationType.Silu,torch.bfloat16,torch.float8_e4m3fnuz,torch.float8_e4m3fnuz,QuantType.per_Token,1,0,16,0,3103.3206,_ZN5aiter48fmoe_stage1_bf16_pertokenFp8_g1u1_16x256_2tg_pf3E,0.0%,290.64,475.41
stage1,80,1024,7168,2048,33,10,ActivationType.Silu,torch.bfloat16,torch.float8_e4m3fnuz,torch.float8_e4m3fnuz,QuantType.per_Token,1,0,16,0,3017.7724,_ZN5aiter48fmoe_stage1_bf16_pertokenFp8_g1u1_16x512_2tg_pf2E,0.0%,298.88,488.89
stage1,80,1024,7168,2048,33,10,ActivationType.Silu,torch.bfloat16,torch.float8_e4m3fnuz,torch.float8_e4m3fnuz,QuantType.per_Token,1,0,16,0,3216.874,_ZN5aiter44fmoe_stage1_bf16_pertokenFp8_g1u1_16x512_pf3E,0.0%,280.38,458.63
stage1,80,1024,7168,2048,33,10,ActivationType.Silu,torch.bfloat16,torch.float8_e4m3fnuz,torch.float8_e4m3fnuz,QuantType.per_Token,1,0,16,0,3682.1809,_ZN5aiter47fmoe_stage1_bf16_pertokenFp8_g1u1_16x64_6tg_pf2E,0.0%,244.95,400.67
stage1,80,1024,7168,2048,33,10,ActivationType.Silu,torch.bfloat16,torch.float8_e4m3fnuz,torch.float8_e4m3fnuz,QuantType.per_Token,1,0,16,0,3593.0805,_ZN5aiter47fmoe_stage1_bf16_pertokenFp8_g1u1_16x64_5tg_pf3E,0.0%,251.02,410.61
stage1,80,1024,7168,2048,33,10,ActivationType.Silu,torch.bfloat16,torch.float8_e4m3fnuz,torch.float8_e4m3fnuz,QuantType.per_Token,1,0,32,0,2096.7942,_ZN5aiter48fmoe_stage1_bf16_pertokenFp8_g1u1_32x128_3tg_pf2E,0.0%,430.15,703.62
stage1,80,1024,7168,2048,33,10,ActivationType.Silu,torch.bfloat16,torch.float8_e4m3fnuz,torch.float8_e4m3fnuz,QuantType.per_Token,1,0,32,0,2023.0965,_ZN5aiter48fmoe_stage1_bf16_pertokenFp8_g1u1_32x128_3tg_pf3E,0.0%,445.82,729.25
stage1,80,1024,7168,2048,33,10,ActivationType.Silu,torch.bfloat16,torch.float8_e4m3fnuz,torch.float8_e4m3fnuz,QuantType.per_Token,1,0,32,0,1929.1502,_ZN5aiter48fmoe_stage1_bf16_pertokenFp8_g1u1_32x256_2tg_pf2E,0.0%,467.53,764.76
stage1,80,1024,7168,2048,33,10,ActivationType.Silu,torch.bfloat16,torch.float8_e4m3fnuz,torch.float8_e4m3fnuz,QuantType.per_Token,1,0,32,0,1843.7052,_ZN5aiter48fmoe_stage1_bf16_pertokenFp8_g1u1_32x256_2tg_pf3E,0.0%,489.2,800.21
stage1,80,1024,7168,2048,33,10,ActivationType.Silu,torch.bfloat16,torch.float8_e4m3fnuz,torch.float8_e4m3fnuz,QuantType.per_Token,1,0,32,0,2183.8952,_ZN5aiter44fmoe_stage1_bf16_pertokenFp8_g1u1_32x512_pf2E,0.0%,413.0,675.56
stage1,80,1024,7168,2048,33,10,ActivationType.Silu,torch.bfloat16,torch.float8_e4m3fnuz,torch.float8_e4m3fnuz,QuantType.per_Token,1,0,32,0,1942.1261,_ZN5aiter44fmoe_stage1_bf16_pertokenFp8_g1u1_32x512_pf3E,0.0%,464.41,759.66
stage1,80,1024,7168,2048,33,10,ActivationType.Silu,torch.bfloat16,torch.float8_e4m3fnuz,torch.float8_e4m3fnuz,QuantType.per_Token,1,0,32,0,2601.475,_ZN5aiter47fmoe_stage1_bf16_pertokenFp8_g1u1_32x64_4tg_pf2E,0.0%,346.7,567.12
stage1,80,1024,7168,2048,33,10,ActivationType.Silu,torch.bfloat16,torch.float8_e4m3fnuz,torch.float8_e4m3fnuz,QuantType.per_Token,1,0,32,0,2338.5374,_ZN5aiter47fmoe_stage1_bf16_pertokenFp8_g1u1_32x64_4tg_pf3E,0.0%,385.69,630.88
stage1,80,1024,7168,2048,33,10,ActivationType.Silu,torch.bfloat16,torch.float8_e4m3fnuz,torch.float8_e4m3fnuz,QuantType.per_Token,1,0,64,0,1706.5543,_ZN5aiter48fmoe_stage1_bf16_pertokenFp8_g1u1_64x128_2tg_pf2E,0.0%,528.52,864.52
stage1,80,1024,7168,2048,33,10,ActivationType.Silu,torch.bfloat16,torch.float8_e4m3fnuz,torch.float8_e4m3fnuz,QuantType.per_Token,1,0,64,0,1658.6161,_ZN5aiter48fmoe_stage1_bf16_pertokenFp8_g1u1_64x128_2tg_pf3E,0.0%,543.79,889.5
stage1,80,1024,7168,2048,33,10,ActivationType.Silu,torch.bfloat16,torch.float8_e4m3fnuz,torch.float8_e4m3fnuz,QuantType.per_Token,1,0,64,0,1743.4113,_ZN5aiter44fmoe_stage1_bf16_pertokenFp8_g1u1_64x256_pf2E,0.0%,517.34,846.24
stage1,80,1024,7168,2048,33,10,ActivationType.Silu,torch.bfloat16,torch.float8_e4m3fnuz,torch.float8_e4m3fnuz,QuantType.per_Token,1,0,64,0,1686.8966,_ZN5aiter44fmoe_stage1_bf16_pertokenFp8_g1u1_64x256_pf3E,0.0%,534.68,874.59
stage1,80,1024,7168,2048,33,10,ActivationType.Silu,torch.bfloat16,torch.float8_e4m3fnuz,torch.float8_e4m3fnuz,QuantType.per_Token,1,0,64,0,1958.5106,_ZN5aiter47fmoe_stage1_bf16_pertokenFp8_g1u1_64x64_3tg_pf2E,0.0%,460.53,753.3
stage1,80,1024,7168,2048,33,10,ActivationType.Silu,torch.bfloat16,torch.float8_e4m3fnuz,torch.float8_e4m3fnuz,QuantType.per_Token,1,0,64,0,1911.6152,_ZN5aiter47fmoe_stage1_bf16_pertokenFp8_g1u1_64x64_2tg_pf3E,0.0%,471.82,771.78
stage1,80,1024,7168,2048,33,10,ActivationType.Silu,torch.bfloat16,torch.float8_e4m3fnuz,torch.float8_e4m3fnuz,QuantType.per_Token,1,0,128,0,1922.1155,_ZN5aiter45fmoe_stage1_bf16_pertokenFp8_g1u1_128x128_pf2E,0.0%,469.25,767.56
stage1,80,1024,7168,2048,33,10,ActivationType.Silu,torch.bfloat16,torch.float8_e4m3fnuz,torch.float8_e4m3fnuz,QuantType.per_Token,1,0,128,0,2400.8744,_ZN5aiter45fmoe_stage1_bf16_pertokenFp8_g1u1_128x128_pf3E,0.0%,375.67,614.5
stage1,80,1024,7168,2048,33,10,ActivationType.Silu,torch.bfloat16,torch.float8_e4m3fnuz,torch.float8_e4m3fnuz,QuantType.per_Token,1,0,128,0,2643.3962,_ZN5aiter44fmoe_stage1_bf16_pertokenFp8_g1u1_128x64_pf2E,0.0%,341.21,558.13
stage1,80,1024,7168,2048,33,10,ActivationType.Silu,torch.bfloat16,torch.float8_e4m3fnuz,torch.float8_e4m3fnuz,QuantType.per_Token,1,0,128,0,2332.8641,_ZN5aiter44fmoe_stage1_bf16_pertokenFp8_g1u1_128x64_pf3E,0.0%,386.62,632.42
stage1,80,1024,7168,2048,33,10,ActivationType.Silu,torch.bfloat16,torch.float8_e4m3fnuz,torch.float8_e4m3fnuz,QuantType.per_Token,1,0,16,0,3541.1109,moe_ck2stages_gemm1_128x16x64x128_1x2_MulABScale_v1_Nswizzle0_Quant2_MulRoutedWeight0_silu_F8_F8_B16,0.0%,254.71,416.63
stage1,80,1024,7168,2048,33,10,ActivationType.Silu,torch.bfloat16,torch.float8_e4m3fnuz,torch.float8_e4m3fnuz,QuantType.per_Token,1,0,16,0,3171.2817,moe_ck2stages_gemm1_256x16x128x256_1x4_MulABScale_v1_Nswizzle0_Quant2_MulRoutedWeight0_silu_F8_F8_B16,0.0%,284.41,465.22
stage1,80,1024,7168,2048,33,10,ActivationType.Silu,torch.bfloat16,torch.float8_e4m3fnuz,torch.float8_e4m3fnuz,QuantType.per_Token,1,0,16,0,3418.4903,moe_ck2stages_gemm1_256x16x64x256_1x4_MulABScale_v1_Nswizzle0_Quant2_MulRoutedWeight0_silu_F8_F8_B16,0.0%,263.84,431.58
stage2,80,1024,7168,2048,33,10,ActivationType.Silu,torch.bfloat16,torch.float8_e4m3fnuz,torch.float8_e4m3fnuz,QuantType.per_Token,1,0,16,0,1900.7891,moe_ck2stages_gemm2_256x16x128x256_1x4_MulABScaleExpertWeight_v1_Nswizzle0_Quant2_MulRoutedWeight1_F8_F8_B16,7.6%,474.51,776.18
stage2,80,1024,7168,2048,33,10,ActivationType.Silu,torch.bfloat16,torch.float8_e4m3fnuz,torch.float8_e4m3fnuz,QuantType.per_Token,1,0,16,0,1997.5136,moe_ck2stages_gemm2_128x16x128x128_1x2_MulABScaleExpertWeight_v1_Nswizzle0_Quant2_MulRoutedWeight1_F8_F8_B16,7.6%,451.53,738.59
stage2,80,1024,7168,2048,33,10,ActivationType.Silu,torch.bfloat16,torch.float8_e4m3fnuz,torch.float8_e4m3fnuz,QuantType.per_Token,1,0,16,0,2873.2277,moe_ck2stages_gemm2_64x16x64x64_1x1_MulABScaleExpertWeight_v1_Nswizzle0_Quant2_MulRoutedWeight1_F8_F8_B16,7.6%,313.91,513.48
stage1,80,1024,7168,2048,33,10,ActivationType.Silu,torch.bfloat16,torch.float8_e4m3fnuz,torch.float8_e4m3fnuz,QuantType.per_Token,1,0,32,0,2284.1736,moe_ck2stages_gemm1_256x32x64x256_1x4_MulABScale_v1_Nswizzle0_Quant2_MulRoutedWeight0_silu_F8_F8_B16,0.0%,394.87,645.9
stage1,80,1024,7168,2048,33,10,ActivationType.Silu,torch.bfloat16,torch.float8_e4m3fnuz,torch.float8_e4m3fnuz,QuantType.per_Token,1,0,32,0,2554.3239,moe_ck2stages_gemm1_256x32x64x128_1x4_MulABScale_v1_Nswizzle0_Quant2_MulRoutedWeight0_silu_F8_F8_B16,0.0%,353.1,577.59
stage2,80,1024,7168,2048,33,10,ActivationType.Silu,torch.bfloat16,torch.float8_e4m3fnuz,torch.float8_e4m3fnuz,QuantType.per_Token,1,0,32,0,1792.7166,moe_ck2stages_gemm2_256x32x64x256_1x4_MulABScaleExpertWeight_v1_Nswizzle0_Quant2_MulRoutedWeight1_F8_F8_B16,7.6%,503.12,822.97
stage2,80,1024,7168,2048,33,10,ActivationType.Silu,torch.bfloat16,torch.float8_e4m3fnuz,torch.float8_e4m3fnuz,QuantType.per_Token,1,0,32,0,2469.5042,moe_ck2stages_gemm2_256x32x64x128_1x4_MulABScaleExpertWeight_v1_Nswizzle0_Quant2_MulRoutedWeight1_F8_F8_B16,7.6%,365.23,597.43
stage2,80,1024,7168,2048,33,10,ActivationType.Silu,torch.bfloat16,torch.float8_e4m3fnuz,torch.float8_e4m3fnuz,QuantType.per_Token,1,0,32,0,2938.6472,moe_ck2stages_gemm2_256x32x64x64_1x4_MulABScaleExpertWeight_v1_Nswizzle0_Quant2_MulRoutedWeight1_F8_F8_B16,99.6%,306.92,502.05
stage1,80,1024,7168,2048,33,10,ActivationType.Silu,torch.bfloat16,torch.float8_e4m3fnuz,torch.float8_e4m3fnuz,QuantType.per_Token,1,0,64,0,2430.201,moe_ck2stages_gemm1_256x64x64x256_1x4_MulABScale_v1_Nswizzle0_Quant2_MulRoutedWeight0_silu_F8_F8_B16,0.0%,371.14,607.09
stage1,80,1024,7168,2048,33,10,ActivationType.Silu,torch.bfloat16,torch.float8_e4m3fnuz,torch.float8_e4m3fnuz,QuantType.per_Token,1,0,64,0,1917.7007,moe_ck2stages_gemm1_256x64x64x128_1x4_MulABScale_v1_Nswizzle0_Quant2_MulRoutedWeight0_silu_F8_F8_B16,0.0%,470.33,769.33
stage1,80,1024,7168,2048,33,10,ActivationType.Silu,torch.bfloat16,torch.float8_e4m3fnuz,torch.float8_e4m3fnuz,QuantType.per_Token,1,0,64,0,2767.7379,moe_ck2stages_gemm1_256x64x128x256_1x4_MulABScale_v3_Nswizzle0_Quant2_MulRoutedWeight0_silu_F8_F8_B16,0.0%,325.88,533.05
stage1,80,1024,7168,2048,33,10,ActivationType.Silu,torch.bfloat16,torch.float8_e4m3fnuz,torch.float8_e4m3fnuz,QuantType.per_Token,1,0,64,0,1865.2847,moe_ck2stages_gemm1_256x64x128x128_1x4_MulABScale_v3_Nswizzle0_Quant2_MulRoutedWeight0_silu_F8_F8_B16,0.0%,483.54,790.95
stage2,80,1024,7168,2048,33,10,ActivationType.Silu,torch.bfloat16,torch.float8_e4m3fnuz,torch.float8_e4m3fnuz,QuantType.per_Token,1,0,64,0,2291.879,moe_ck2stages_gemm2_256x64x64x256_1x4_MulABScaleExpertWeight_v1_Nswizzle0_Quant2_MulRoutedWeight1_F8_F8_B16,7.6%,393.54,643.73
stage2,80,1024,7168,2048,33,10,ActivationType.Silu,torch.bfloat16,torch.float8_e4m3fnuz,torch.float8_e4m3fnuz,QuantType.per_Token,1,0,64,0,1711.5066,moe_ck2stages_gemm2_256x64x128x256_1x4_MulABScaleExpertWeight_v3_Nswizzle0_Quant2_MulRoutedWeight1_F8_F8_B16,7.6%,526.99,862.02
stage2,80,1024,7168,2048,33,10,ActivationType.Silu,torch.bfloat16,torch.float8_e4m3fnuz,torch.float8_e4m3fnuz,QuantType.per_Token,1,0,64,0,1437.8968,moe_ck2stages_gemm2_256x64x128x128_1x4_MulABScaleExpertWeight_v3_Nswizzle0_Quant2_MulRoutedWeight1_F8_F8_B16,7.6%,627.27,1026.04
stage2,80,1024,7168,2048,33,10,ActivationType.Silu,torch.bfloat16,torch.float8_e4m3fnuz,torch.float8_e4m3fnuz,QuantType.per_Token,1,0,64,0,2577.9171,moe_ck2stages_gemm2_256x64x128x64_1x4_MulABScaleExpertWeight_v3_Nswizzle0_Quant2_MulRoutedWeight1_F8_F8_B16,99.6%,349.87,572.3
stage2,80,1024,7168,2048,33,10,ActivationType.Silu,torch.bfloat16,torch.float8_e4m3fnuz,torch.float8_e4m3fnuz,QuantType.per_Token,1,0,64,0,2591.4136,moe_ck2stages_gemm2_256x64x64x64_1x4_MulABScaleExpertWeight_v1_Nswizzle0_Quant2_MulRoutedWeight1_F8_F8_B16,99.6%,348.05,569.32
stage1,80,1024,7168,2048,33,10,ActivationType.Silu,torch.bfloat16,torch.float8_e4m3fnuz,torch.float8_e4m3fnuz,QuantType.per_Token,1,0,128,0,2308.3937,moe_ck2stages_gemm1_256x128x64x128_1x4_MulABScale_v1_Nswizzle0_Quant2_MulRoutedWeight0_silu_F8_F8_B16,0.0%,390.72,639.12
stage1,80,1024,7168,2048,33,10,ActivationType.Silu,torch.bfloat16,torch.float8_e4m3fnuz,torch.float8_e4m3fnuz,QuantType.per_Token,1,0,128,0,3188.5162,moe_ck2stages_gemm1_256x128x128x256_1x4_MulABScale_v3_Nswizzle0_Quant2_MulRoutedWeight0_silu_F8_F8_B16,0.0%,282.87,462.71
stage1,80,1024,7168,2048,33,10,ActivationType.Silu,torch.bfloat16,torch.float8_e4m3fnuz,torch.float8_e4m3fnuz,QuantType.per_Token,1,0,128,0,2261.1447,moe_ck2stages_gemm1_256x128x128x128_1x4_MulABScale_v3_Nswizzle0_Quant2_MulRoutedWeight0_silu_F8_F8_B16,0.0%,398.89,652.48
stage2,80,1024,7168,2048,33,10,ActivationType.Silu,torch.bfloat16,torch.float8_e4m3fnuz,torch.float8_e4m3fnuz,QuantType.per_Token,1,0,128,0,2056.8177,moe_ck2stages_gemm2_256x128x64x128_1x4_MulABScaleExpertWeight_v1_Nswizzle0_Quant2_MulRoutedWeight1_F8_F8_B16,7.6%,438.51,717.3
stage2,80,1024,7168,2048,33,10,ActivationType.Silu,torch.bfloat16,torch.float8_e4m3fnuz,torch.float8_e4m3fnuz,QuantType.per_Token,1,0,128,0,1427.8507,moe_ck2stages_gemm2_256x128x128x128_1x4_MulABScaleExpertWeight_v3_Nswizzle0_Quant2_MulRoutedWeight1_F8_F8_B16,7.6%,631.68,1033.26
stage2,80,1024,7168,2048,33,10,ActivationType.Silu,torch.bfloat16,torch.float8_e4m3fnuz,torch.float8_e4m3fnuz,QuantType.per_Token,1,0,128,0,2440.1664,moe_ck2stages_gemm2_256x128x128x64_1x4_MulABScaleExpertWeight_v3_Nswizzle0_Quant2_MulRoutedWeight1_F8_F8_B16,99.6%,369.62,604.61
stage2,80,1024,7168,2048,33,10,ActivationType.Silu,torch.bfloat16,torch.float8_e4m3fnuz,torch.float8_e4m3fnuz,QuantType.per_Token,1,0,128,0,2909.1399,moe_ck2stages_gemm2_256x128x64x64_1x4_MulABScaleExpertWeight_v3_Nswizzle0_Quant2_MulRoutedWeight1_F8_F8_B16,99.6%,310.04,507.14
stage1,80,1024,7168,2048,33,10,ActivationType.Silu,torch.bfloat16,torch.float8_e4m3fnuz,torch.float8_e4m3fnuz,QuantType.per_Token,1,0,32,0,-1.0,flydsl_moe1_afp8_wfp8_bf16_t32x128x128,100.0%,0.0,0.0
stage2,80,1024,7168,2048,33,10,ActivationType.Silu,torch.bfloat16,torch.float8_e4m3fnuz,torch.float8_e4m3fnuz,QuantType.per_Token,1,0,32,0,-1.0,flydsl_moe2_afp8_wfp8_bf16_t32x128x128_atomic,100.0%,0.0,0.0
stage2,80,1024,7168,2048,33,10,ActivationType.Silu,torch.bfloat16,torch.float8_e4m3fnuz,torch.float8_e4m3fnuz,QuantType.per_Token,1,0,32,0,-1.0,flydsl_moe2_afp8_wfp8_bf16_t32x128x128_reduce,100.0%,0.0,0.0
stage1,80,1024,7168,2048,33,10,ActivationType.Silu,torch.bfloat16,torch.float8_e4m3fnuz,torch.float8_e4m3fnuz,QuantType.per_Token,1,0,64,0,-1.0,flydsl_moe1_afp8_wfp8_bf16_t64x128x128,100.0%,0.0,0.0
stage2,80,1024,7168,2048,33,10,ActivationType.Silu,torch.bfloat16,torch.float8_e4m3fnuz,torch.float8_e4m3fnuz,QuantType.per_Token,1,0,64,0,-1.0,flydsl_moe2_afp8_wfp8_bf16_t64x128x128_atomic,100.0%,0.0,0.0
stage2,80,1024,7168,2048,33,10,ActivationType.Silu,torch.bfloat16,torch.float8_e4m3fnuz,torch.float8_e4m3fnuz,QuantType.per_Token,1,0,64,0,-1.0,flydsl_moe2_afp8_wfp8_bf16_t64x128x128_reduce,100.0%,0.0,0.0
asm_1stage,80,1024,7168,2048,33,10,ActivationType.Silu,torch.bfloat16,torch.float8_e4m3fnuz,torch.float8_e4m3fnuz,QuantType.per_Token,1,0,32,0,7582.5694,_ZN5aiter45fmoe_bf16_pertokenFp8_g1u1_vs_silu_1tg_32x128E,0.0%,118.95,194.57
asm_1stage,80,1024,7168,2048,33,10,ActivationType.Silu,torch.bfloat16,torch.float8_e4m3fnuz,torch.float8_e4m3fnuz,QuantType.per_Token,1,0,32,0,7212.3999,_ZN5aiter48fmoe_bf16_pertokenFp8_g1u1_vs_silu_1tg_ps_32x128E,0.0%,125.05,204.56
asm_1stage,80,1024,7168,2048,33,10,ActivationType.Silu,torch.bfloat16,torch.float8_e4m3fnuz,torch.float8_e4m3fnuz,QuantType.per_Token,1,0,32,0,4390.1858,_ZN5aiter48fmoe_bf16_pertokenFp8_g1u1_vs_silu_1tg_ps_32x256E,0.0%,205.45,336.06
asm_1stage,80,1024,7168,2048,33,10,ActivationType.Silu,torch.bfloat16,torch.float8_e4m3fnuz,torch.float8_e4m3fnuz,QuantType.per_Token,1,0,32,0,4086.2461,_ZN5aiter45fmoe_bf16_pertokenFp8_g1u1_vs_silu_1tg_32x256E,0.0%,220.73,361.05
asm_1stage,80,1024,7168,2048,33,10,ActivationType.Silu,torch.bfloat16,torch.float8_e4m3fnuz,torch.float8_e4m3fnuz,QuantType.per_Token,1,0,32,0,3300.2561,_ZN5aiter45fmoe_bf16_pertokenFp8_g1u1_vs_silu_1tg_32x512E,0.0%,273.29,447.04
asm_1stage,80,1024,7168,2048,33,10,ActivationType.Silu,torch.bfloat16,torch.float8_e4m3fnuz,torch.float8_e4m3fnuz,QuantType.per_Token,1,0,32,0,16291.1706,_ZN5aiter48fmoe_bf16_pertokenFp8_g1u1_vs_silu_1tg_ps_32x512E,0.0%,55.36,90.56
stage1,80,1024,7168,2048,33,10,ActivationType.Silu,torch.bfloat16,torch.float8_e4m3fnuz,torch.float8_e4m3fnuz,QuantType.per_Token,1,0,16,0,3409.2821,_ZN5aiter48fmoe_stage1_bf16_pertokenFp8_g1u1_16x128_4tg_pf2E,0.0%,264.56,432.74
stage1,80,1024,7168,2048,33,10,ActivationType.Silu,torch.bfloat16,torch.float8_e4m3fnuz,torch.float8_e4m3fnuz,QuantType.per_Token,1,0,16,0,3305.9736,_ZN5aiter48fmoe_stage1_bf16_pertokenFp8_g1u1_16x128_4tg_pf3E,0.0%,272.82,446.27
stage1,80,1024,7168,2048,33,10,ActivationType.Silu,torch.bfloat16,torch.float8_e4m3fnuz,torch.float8_e4m3fnuz,QuantType.per_Token,1,0,16,0,3076.7287,_ZN5aiter48fmoe_stage1_bf16_pertokenFp8_g1u1_16x256_3tg_pf2E,0.0%,293.15,479.52
stage1,80,1024,7168,2048,33,10,ActivationType.Silu,torch.bfloat16,torch.float8_e4m3fnuz,torch.float8_e4m3fnuz,QuantType.per_Token,1,0,16,0,3101.2968,_ZN5aiter48fmoe_stage1_bf16_pertokenFp8_g1u1_16x256_2tg_pf3E,0.0%,290.83,475.72
stage1,80,1024,7168,2048,33,10,ActivationType.Silu,torch.bfloat16,torch.float8_e4m3fnuz,torch.float8_e4m3fnuz,QuantType.per_Token,1,0,16,0,3018.4364,_ZN5aiter48fmoe_stage1_bf16_pertokenFp8_g1u1_16x512_2tg_pf2E,0.0%,298.81,488.78
stage1,80,1024,7168,2048,33,10,ActivationType.Silu,torch.bfloat16,torch.float8_e4m3fnuz,torch.float8_e4m3fnuz,QuantType.per_Token,1,0,16,0,3218.5995,_ZN5aiter44fmoe_stage1_bf16_pertokenFp8_g1u1_16x512_pf3E,0.0%,280.23,458.38
stage1,80,1024,7168,2048,33,10,ActivationType.Silu,torch.bfloat16,torch.float8_e4m3fnuz,torch.float8_e4m3fnuz,QuantType.per_Token,1,0,16,0,3683.4228,_ZN5aiter47fmoe_stage1_bf16_pertokenFp8_g1u1_16x64_6tg_pf2E,0.0%,244.87,400.54
stage1,80,1024,7168,2048,33,10,ActivationType.Silu,torch.bfloat16,torch.float8_e4m3fnuz,torch.float8_e4m3fnuz,QuantType.per_Token,1,0,16,0,3594.4981,_ZN5aiter47fmoe_stage1_bf16_pertokenFp8_g1u1_16x64_5tg_pf3E,0.0%,250.92,410.45
stage1,80,1024,7168,2048,33,10,ActivationType.Silu,torch.bfloat16,torch.float8_e4m3fnuz,torch.float8_e4m3fnuz,QuantType.per_Token,1,0,32,0,2092.9643,_ZN5aiter48fmoe_stage1_bf16_pertokenFp8_g1u1_32x128_3tg_pf2E,0.0%,430.94,704.91
stage1,80,1024,7168,2048,33,10,ActivationType.Silu,torch.bfloat16,torch.float8_e4m3fnuz,torch.float8_e4m3fnuz,QuantType.per_Token,1,0,32,0,2018.0643,_ZN5aiter48fmoe_stage1_bf16_pertokenFp8_g1u1_32x128_3tg_pf3E,0.0%,446.93,731.07
stage1,80,1024,7168,2048,33,10,ActivationType.Silu,torch.bfloat16,torch.float8_e4m3fnuz,torch.float8_e4m3fnuz,QuantType.per_Token,1,0,32,0,1942.588,_ZN5aiter48fmoe_stage1_bf16_pertokenFp8_g1u1_32x256_2tg_pf2E,0.0%,464.3,759.47
stage1,80,1024,7168,2048,33,10,ActivationType.Silu,torch.bfloat16,torch.float8_e4m3fnuz,torch.float8_e4m3fnuz,QuantType.per_Token,1,0,32,0,1846.2834,_ZN5aiter48fmoe_stage1_bf16_pertokenFp8_g1u1_32x256_2tg_pf3E,0.0%,488.52,799.09
stage1,80,1024,7168,2048,33,10,ActivationType.Silu,torch.bfloat16,torch.float8_e4m3fnuz,torch.float8_e4m3fnuz,QuantType.per_Token,1,0,32,0,2184.9431,_ZN5aiter44fmoe_stage1_bf16_pertokenFp8_g1u1_32x512_pf2E,0.0%,412.8,675.23
stage1,80,1024,7168,2048,33,10,ActivationType.Silu,torch.bfloat16,torch.float8_e4m3fnuz,torch.float8_e4m3fnuz,QuantType.per_Token,1,0,32,0,1941.5583,_ZN5aiter44fmoe_stage1_bf16_pertokenFp8_g1u1_32x512_pf3E,0.0%,464.55,759.88
stage1,80,1024,7168,2048,33,10,ActivationType.Silu,torch.bfloat16,torch.float8_e4m3fnuz,torch.float8_e4m3fnuz,QuantType.per_Token,1,0,32,0,2601.5167,_ZN5aiter47fmoe_stage1_bf16_pertokenFp8_g1u1_32x64_4tg_pf2E,0.0%,346.7,567.11
stage1,80,1024,7168,2048,33,10,ActivationType.Silu,torch.bfloat16,torch.float8_e4m3fnuz,torch.float8_e4m3fnuz,QuantType.per_Token,1,0,32,0,2335.8763,_ZN5aiter47fmoe_stage1_bf16_pertokenFp8_g1u1_32x64_4tg_pf3E,0.0%,386.13,631.6
stage1,80,1024,7168,2048,33,10,ActivationType.Silu,torch.bfloat16,torch.float8_e4m3fnuz,torch.float8_e4m3fnuz,QuantType.per_Token,1,0,64,0,1716.9746,_ZN5aiter48fmoe_stage1_bf16_pertokenFp8_g1u1_64x128_2tg_pf2E,0.0%,525.31,859.27
stage1,80,1024,7168,2048,33,10,ActivationType.Silu,torch.bfloat16,torch.float8_e4m3fnuz,torch.float8_e4m3fnuz,QuantType.per_Token,1,0,64,0,1650.0557,_ZN5aiter48fmoe_stage1_bf16_pertokenFp8_g1u1_64x128_2tg_pf3E,0.0%,546.61,894.12
stage1,80,1024,7168,2048,33,10,ActivationType.Silu,torch.bfloat16,torch.float8_e4m3fnuz,torch.float8_e4m3fnuz,QuantType.per_Token,1,0,64,0,1733.1903,_ZN5aiter44fmoe_stage1_bf16_pertokenFp8_g1u1_64x256_pf2E,0.0%,520.39,851.23
stage1,80,1024,7168,2048,33,10,ActivationType.Silu,torch.bfloat16,torch.float8_e4m3fnuz,torch.float8_e4m3fnuz,QuantType.per_Token,1,0,64,0,1695.06,_ZN5aiter44fmoe_stage1_bf16_pertokenFp8_g1u1_64x256_pf3E,0.0%,532.1,870.38
stage1,80,1024,7168,2048,33,10,ActivationType.Silu,torch.bfloat16,torch.float8_e4m3fnuz,torch.float8_e4m3fnuz,QuantType.per_Token,1,0,64,0,1958.3449,_ZN5aiter47fmoe_stage1_bf16_pertokenFp8_g1u1_64x64_3tg_pf2E,0.0%,460.56,753.36
stage1,80,1024,7168,2048,33,10,ActivationType.Silu,torch.bfloat16,torch.float8_e4m3fnuz,torch.float8_e4m3fnuz,QuantType.per_Token,1,0,64,0,1912.0343,_ZN5aiter47fmoe_stage1_bf16_pertokenFp8_g1u1_64x64_2tg_pf3E,0.0%,471.72,771.61
stage1,80,1024,7168,2048,33,10,ActivationType.Silu,torch.bfloat16,torch.float8_e4m3fnuz,torch.float8_e4m3fnuz,QuantType.per_Token,1,0,128,0,1921.641,_ZN5aiter45fmoe_stage1_bf16_pertokenFp8_g1u1_128x128_pf2E,0.0%,469.36,767.75
stage1,80,1024,7168,2048,33,10,ActivationType.Silu,torch.bfloat16,torch.float8_e4m3fnuz,torch.float8_e4m3fnuz,QuantType.per_Token,1,0,128,0,4685.1315,_ZN5aiter45fmoe_stage1_bf16_pertokenFp8_g1u1_128x128_pf3E,0.0%,192.51,314.9
stage1,80,1024,7168,2048,33,10,ActivationType.Silu,torch.bfloat16,torch.float8_e4m3fnuz,torch.float8_e4m3fnuz,QuantType.per_Token,1,0,128,0,2642.5275,_ZN5aiter44fmoe_stage1_bf16_pertokenFp8_g1u1_128x64_pf2E,0.0%,341.32,558.31
stage1,80,1024,7168,2048,33,10,ActivationType.Silu,torch.bfloat16,torch.float8_e4m3fnuz,torch.float8_e4m3fnuz,QuantType.per_Token,1,0,128,0,2331.0962,_ZN5aiter44fmoe_stage1_bf16_pertokenFp8_g1u1_128x64_pf3E,0.0%,386.92,632.9
stage1,80,1024,7168,2048,33,10,ActivationType.Silu,torch.bfloat16,torch.float8_e4m3fnuz,torch.float8_e4m3fnuz,QuantType.per_Token,1,0,16,0,3534.4815,moe_ck2stages_gemm1_128x16x64x128_1x2_MulABScale_v1_Nswizzle0_Quant2_MulRoutedWeight0_silu_F8_F8_B16,0.0%,255.18,417.42
stage1,80,1024,7168,2048,33,10,ActivationType.Silu,torch.bfloat16,torch.float8_e4m3fnuz,torch.float8_e4m3fnuz,QuantType.per_Token,1,0,16,0,3179.5536,moe_ck2stages_gemm1_256x16x128x256_1x4_MulABScale_v1_Nswizzle0_Quant2_MulRoutedWeight0_silu_F8_F8_B16,0.0%,283.67,464.01
stage1,80,1024,7168,2048,33,10,ActivationType.Silu,torch.bfloat16,torch.float8_e4m3fnuz,torch.float8_e4m3fnuz,QuantType.per_Token,1,0,16,0,3422.4837,moe_ck2stages_gemm1_256x16x64x256_1x4_MulABScale_v1_Nswizzle0_Quant2_MulRoutedWeight0_silu_F8_F8_B16,0.0%,263.53,431.07
stage2,80,1024,7168,2048,33,10,ActivationType.Silu,torch.bfloat16,torch.float8_e4m3fnuz,torch.float8_e4m3fnuz,QuantType.per_Token,1,0,16,0,1899.6097,moe_ck2stages_gemm2_256x16x128x256_1x4_MulABScaleExpertWeight_v1_Nswizzle0_Quant2_MulRoutedWeight1_F8_F8_B16,7.6%,474.8,776.66
stage2,80,1024,7168,2048,33,10,ActivationType.Silu,torch.bfloat16,torch.float8_e4m3fnuz,torch.float8_e4m3fnuz,QuantType.per_Token,1,0,16,0,1996.6205,moe_ck2stages_gemm2_128x16x128x128_1x2_MulABScaleExpertWeight_v1_Nswizzle0_Quant2_MulRoutedWeight1_F8_F8_B16,7.6%,451.73,738.92
stage2,80,1024,7168,2048,33,10,ActivationType.Silu,torch.bfloat16,torch.float8_e4m3fnuz,torch.float8_e4m3fnuz,QuantType.per_Token,1,0,16,0,2746.2621,moe_ck2stages_gemm2_64x16x64x64_1x1_MulABScaleExpertWeight_v1_Nswizzle0_Quant2_MulRoutedWeight1_F8_F8_B16,7.6%,328.43,537.22
stage1,80,1024,7168,2048,33,10,ActivationType.Silu,torch.bfloat16,torch.float8_e4m3fnuz,torch.float8_e4m3fnuz,QuantType.per_Token,1,0,32,0,2265.2875,moe_ck2stages_gemm1_256x32x64x256_1x4_MulABScale_v1_Nswizzle0_Quant2_MulRoutedWeight0_silu_F8_F8_B16,0.0%,398.16,651.28
stage1,80,1024,7168,2048,33,10,ActivationType.Silu,torch.bfloat16,torch.float8_e4m3fnuz,torch.float8_e4m3fnuz,QuantType.per_Token,1,0,32,0,2552.3771,moe_ck2stages_gemm1_256x32x64x128_1x4_MulABScale_v1_Nswizzle0_Quant2_MulRoutedWeight0_silu_F8_F8_B16,0.0%,353.37,578.03
stage2,80,1024,7168,2048,33,10,ActivationType.Silu,torch.bfloat16,torch.float8_e4m3fnuz,torch.float8_e4m3fnuz,QuantType.per_Token,1,0,32,0,1997.2669,moe_ck2stages_gemm2_256x32x64x256_1x4_MulABScaleExpertWeight_v1_Nswizzle0_Quant2_MulRoutedWeight1_F8_F8_B16,7.6%,451.59,738.68
stage2,80,1024,7168,2048,33,10,ActivationType.Silu,torch.bfloat16,torch.float8_e4m3fnuz,torch.float8_e4m3fnuz,QuantType.per_Token,1,0,32,0,2444.7069,moe_ck2stages_gemm2_256x32x64x128_1x4_MulABScaleExpertWeight_v1_Nswizzle0_Quant2_MulRoutedWeight1_F8_F8_B16,7.6%,368.94,603.49
stage2,80,1024,7168,2048,33,10,ActivationType.Silu,torch.bfloat16,torch.float8_e4m3fnuz,torch.float8_e4m3fnuz,QuantType.per_Token,1,0,32,0,2940.3315,moe_ck2stages_gemm2_256x32x64x64_1x4_MulABScaleExpertWeight_v1_Nswizzle0_Quant2_MulRoutedWeight1_F8_F8_B16,99.6%,306.75,501.76
stage1,80,1024,7168,2048,33,10,ActivationType.Silu,torch.bfloat16,torch.float8_e4m3fnuz,torch.float8_e4m3fnuz,QuantType.per_Token,1,0,64,0,2423.3447,moe_ck2stages_gemm1_256x64x64x256_1x4_MulABScale_v1_Nswizzle0_Quant2_MulRoutedWeight0_silu_F8_F8_B16,0.0%,372.19,608.81
stage1,80,1024,7168,2048,33,10,ActivationType.Silu,torch.bfloat16,torch.float8_e4m3fnuz,torch.float8_e4m3fnuz,QuantType.per_Token,1,0,64,0,1916.3997,moe_ck2stages_gemm1_256x64x64x128_1x4_MulABScale_v1_Nswizzle0_Quant2_MulRoutedWeight0_silu_F8_F8_B16,0.0%,470.64,769.85
stage1,80,1024,7168,2048,33,10,ActivationType.Silu,torch.bfloat16,torch.float8_e4m3fnuz,torch.float8_e4m3fnuz,QuantType.per_Token,1,0,64,0,2769.515,moe_ck2stages_gemm1_256x64x128x256_1x4_MulABScale_v3_Nswizzle0_Quant2_MulRoutedWeight0_silu_F8_F8_B16,0.0%,325.67,532.71
stage1,80,1024,7168,2048,33,10,ActivationType.Silu,torch.bfloat16,torch.float8_e4m3fnuz,torch.float8_e4m3fnuz,QuantType.per_Token,1,0,64,0,1868.6278,moe_ck2stages_gemm1_256x64x128x128_1x4_MulABScale_v3_Nswizzle0_Quant2_MulRoutedWeight0_silu_F8_F8_B16,0.0%,482.68,789.53
stage2,80,1024,7168,2048,33,10,ActivationType.Silu,torch.bfloat16,torch.float8_e4m3fnuz,torch.float8_e4m3fnuz,QuantType.per_Token,1,0,64,0,1977.0696,moe_ck2stages_gemm2_256x64x64x256_1x4_MulABScaleExpertWeight_v1_Nswizzle0_Quant2_MulRoutedWeight1_F8_F8_B16,7.6%,456.2,746.23
stage2,80,1024,7168,2048,33,10,ActivationType.Silu,torch.bfloat16,torch.float8_e4m3fnuz,torch.float8_e4m3fnuz,QuantType.per_Token,1,0,64,0,1711.7054,moe_ck2stages_gemm2_256x64x128x256_1x4_MulABScaleExpertWeight_v3_Nswizzle0_Quant2_MulRoutedWeight1_F8_F8_B16,7.6%,526.93,861.92
stage2,80,1024,7168,2048,33,10,ActivationType.Silu,torch.bfloat16,torch.float8_e4m3fnuz,torch.float8_e4m3fnuz,QuantType.per_Token,1,0,64,0,1434.1827,moe_ck2stages_gemm2_256x64x128x128_1x4_MulABScaleExpertWeight_v3_Nswizzle0_Quant2_MulRoutedWeight1_F8_F8_B16,7.6%,628.89,1028.7
stage2,80,1024,7168,2048,33,10,ActivationType.Silu,torch.bfloat16,torch.float8_e4m3fnuz,torch.float8_e4m3fnuz,QuantType.per_Token,1,0,64,0,2577.4291,moe_ck2stages_gemm2_256x64x128x64_1x4_MulABScaleExpertWeight_v3_Nswizzle0_Quant2_MulRoutedWeight1_F8_F8_B16,99.6%,349.94,572.41
stage2,80,1024,7168,2048,33,10,ActivationType.Silu,torch.bfloat16,torch.float8_e4m3fnuz,torch.float8_e4m3fnuz,QuantType.per_Token,1,0,64,0,2761.222,moe_ck2stages_gemm2_256x64x64x64_1x4_MulABScaleExpertWeight_v1_Nswizzle0_Quant2_MulRoutedWeight1_F8_F8_B16,99.6%,326.65,534.31
stage1,80,1024,7168,2048,33,10,ActivationType.Silu,torch.bfloat16,torch.float8_e4m3fnuz,torch.float8_e4m3fnuz,QuantType.per_Token,1,0,128,0,2283.0956,moe_ck2stages_gemm1_256x128x64x128_1x4_MulABScale_v1_Nswizzle0_Quant2_MulRoutedWeight0_silu_F8_F8_B16,0.0%,395.05,646.2
stage1,80,1024,7168,2048,33,10,ActivationType.Silu,torch.bfloat16,torch.float8_e4m3fnuz,torch.float8_e4m3fnuz,QuantType.per_Token,1,0,128,0,3195.4958,moe_ck2stages_gemm1_256x128x128x256_1x4_MulABScale_v3_Nswizzle0_Quant2_MulRoutedWeight0_silu_F8_F8_B16,0.0%,282.25,461.7
stage1,80,1024,7168,2048,33,10,ActivationType.Silu,torch.bfloat16,torch.float8_e4m3fnuz,torch.float8_e4m3fnuz,QuantType.per_Token,1,0,128,0,2268.8336,moe_ck2stages_gemm1_256x128x128x128_1x4_MulABScale_v3_Nswizzle0_Quant2_MulRoutedWeight0_silu_F8_F8_B16,0.0%,397.54,650.27
stage2,80,1024,7168,2048,33,10,ActivationType.Silu,torch.bfloat16,torch.float8_e4m3fnuz,torch.float8_e4m3fnuz,QuantType.per_Token,1,0,128,0,1878.5292,moe_ck2stages_gemm2_256x128x64x128_1x4_MulABScaleExpertWeight_v1_Nswizzle0_Quant2_MulRoutedWeight1_F8_F8_B16,7.6%,480.13,785.37
stage2,80,1024,7168,2048,33,10,ActivationType.Silu,torch.bfloat16,torch.float8_e4m3fnuz,torch.float8_e4m3fnuz,QuantType.per_Token,1,0,128,0,1428.7382,moe_ck2stages_gemm2_256x128x128x128_1x4_MulABScaleExpertWeight_v3_Nswizzle0_Quant2_MulRoutedWeight1_F8_F8_B16,7.6%,631.29,1032.62
stage2,80,1024,7168,2048,33,10,ActivationType.Silu,torch.bfloat16,torch.float8_e4m3fnuz,torch.float8_e4m3fnuz,QuantType.per_Token,1,0,128,0,2433.9703,moe_ck2stages_gemm2_256x128x128x64_1x4_MulABScaleExpertWeight_v3_Nswizzle0_Quant2_MulRoutedWeight1_F8_F8_B16,99.6%,370.56,606.15
stage2,80,1024,7168,2048,33,10,ActivationType.Silu,torch.bfloat16,torch.float8_e4m3fnuz,torch.float8_e4m3fnuz,QuantType.per_Token,1,0,128,0,2907.3354,moe_ck2stages_gemm2_256x128x64x64_1x4_MulABScaleExpertWeight_v3_Nswizzle0_Quant2_MulRoutedWeight1_F8_F8_B16,99.6%,310.23,507.46
stage1,80,1024,7168,2048,33,10,ActivationType.Silu,torch.bfloat16,torch.float8_e4m3fnuz,torch.float8_e4m3fnuz,QuantType.per_Token,1,0,32,0,-1.0,flydsl_moe1_afp8_wfp8_bf16_t32x128x128,100.0%,0.0,0.0
stage2,80,1024,7168,2048,33,10,ActivationType.Silu,torch.bfloat16,torch.float8_e4m3fnuz,torch.float8_e4m3fnuz,QuantType.per_Token,1,0,32,0,-1.0,flydsl_moe2_afp8_wfp8_bf16_t32x128x128_atomic,100.0%,0.0,0.0
stage2,80,1024,7168,2048,33,10,ActivationType.Silu,torch.bfloat16,torch.float8_e4m3fnuz,torch.float8_e4m3fnuz,QuantType.per_Token,1,0,32,0,-1.0,flydsl_moe2_afp8_wfp8_bf16_t32x128x128_reduce,100.0%,0.0,0.0
stage1,80,1024,7168,2048,33,10,ActivationType.Silu,torch.bfloat16,torch.float8_e4m3fnuz,torch.float8_e4m3fnuz,QuantType.per_Token,1,0,64,0,-1.0,flydsl_moe1_afp8_wfp8_bf16_t64x128x128,100.0%,0.0,0.0
stage2,80,1024,7168,2048,33,10,ActivationType.Silu,torch.bfloat16,torch.float8_e4m3fnuz,torch.float8_e4m3fnuz,QuantType.per_Token,1,0,64,0,-1.0,flydsl_moe2_afp8_wfp8_bf16_t64x128x128_atomic,100.0%,0.0,0.0
stage2,80,1024,7168,2048,33,10,ActivationType.Silu,torch.bfloat16,torch.float8_e4m3fnuz,torch.float8_e4m3fnuz,QuantType.per_Token,1,0,64,0,-1.0,flydsl_moe2_afp8_wfp8_bf16_t64x128x128_reduce,100.0%,0.0,0.0
asm_1stage,80,1024,7168,2048,33,10,ActivationType.Silu,torch.bfloat16,torch.float8_e4m3fnuz,torch.float8_e4m3fnuz,QuantType.per_Token,1,0,32,0,7587.6952,_ZN5aiter45fmoe_bf16_pertokenFp8_g1u1_vs_silu_1tg_32x128E,0.0%,118.87,194.44
asm_1stage,80,1024,7168,2048,33,10,ActivationType.Silu,torch.bfloat16,torch.float8_e4m3fnuz,torch.float8_e4m3fnuz,QuantType.per_Token,1,0,32,0,7227.3255,_ZN5aiter48fmoe_bf16_pertokenFp8_g1u1_vs_silu_1tg_ps_32x128E,0.0%,124.8,204.13
asm_1stage,80,1024,7168,2048,33,10,ActivationType.Silu,torch.bfloat16,torch.float8_e4m3fnuz,torch.float8_e4m3fnuz,QuantType.per_Token,1,0,32,0,4351.4425,_ZN5aiter48fmoe_bf16_pertokenFp8_g1u1_vs_silu_1tg_ps_32x256E,0.0%,207.27,339.05
asm_1stage,80,1024,7168,2048,33,10,ActivationType.Silu,torch.bfloat16,torch.float8_e4m3fnuz,torch.float8_e4m3fnuz,QuantType.per_Token,1,0,32,0,4090.2241,_ZN5aiter45fmoe_bf16_pertokenFp8_g1u1_vs_silu_1tg_32x256E,0.0%,220.51,360.7
asm_1stage,80,1024,7168,2048,33,10,ActivationType.Silu,torch.bfloat16,torch.float8_e4m3fnuz,torch.float8_e4m3fnuz,QuantType.per_Token,1,0,32,0,3291.7652,_ZN5aiter45fmoe_bf16_pertokenFp8_g1u1_vs_silu_1tg_32x512E,0.0%,274.0,448.19
asm_1stage,80,1024,7168,2048,33,10,ActivationType.Silu,torch.bfloat16,torch.float8_e4m3fnuz,torch.float8_e4m3fnuz,QuantType.per_Token,1,0,32,0,3468.4894,_ZN5aiter48fmoe_bf16_pertokenFp8_g1u1_vs_silu_1tg_ps_32x512E,0.0%,260.04,425.36
stage1,80,1024,7168,2048,33,10,ActivationType.Silu,torch.bfloat16,torch.float8_e4m3fnuz,torch.float8_e4m3fnuz,QuantType.per_Token,1,0,16,0,3409.2102,_ZN5aiter48fmoe_stage1_bf16_pertokenFp8_g1u1_16x128_4tg_pf2E,0.0%,264.56,432.75
stage1,80,1024,7168,2048,33,10,ActivationType.Silu,torch.bfloat16,torch.float8_e4m3fnuz,torch.float8_e4m3fnuz,QuantType.per_Token,1,0,16,0,3305.8541,_ZN5aiter48fmoe_stage1_bf16_pertokenFp8_g1u1_16x128_4tg_pf3E,0.0%,272.83,446.28
stage1,80,1024,7168,2048,33,10,ActivationType.Silu,torch.bfloat16,torch.float8_e4m3fnuz,torch.float8_e4m3fnuz,QuantType.per_Token,1,0,16,0,3075.4325,_ZN5aiter48fmoe_stage1_bf16_pertokenFp8_g1u1_16x256_3tg_pf2E,0.0%,293.27,479.72
stage1,80,1024,7168,2048,33,10,ActivationType.Silu,torch.bfloat16,torch.float8_e4m3fnuz,torch.float8_e4m3fnuz,QuantType.per_Token,1,0,16,0,3100.1387,_ZN5aiter48fmoe_stage1_bf16_pertokenFp8_g1u1_16x256_2tg_pf3E,0.0%,290.94,475.9
stage1,80,1024,7168,2048,33,10,ActivationType.Silu,torch.bfloat16,torch.float8_e4m3fnuz,torch.float8_e4m3fnuz,QuantType.per_Token,1,0,16,0,3019.1559,_ZN5aiter48fmoe_stage1_bf16_pertokenFp8_g1u1_16x512_2tg_pf2E,0.0%,298.74,488.66
stage1,80,1024,7168,2048,33,10,ActivationType.Silu,torch.bfloat16,torch.float8_e4m3fnuz,torch.float8_e4m3fnuz,QuantType.per_Token,1,0,16,0,3215.6813,_ZN5aiter44fmoe_stage1_bf16_pertokenFp8_g1u1_16x512_pf3E,0.0%,280.48,458.8
stage1,80,1024,7168,2048,33,10,ActivationType.Silu,torch.bfloat16,torch.float8_e4m3fnuz,torch.float8_e4m3fnuz,QuantType.per_Token,1,0,16,0,3682.3003,_ZN5aiter47fmoe_stage1_bf16_pertokenFp8_g1u1_16x64_6tg_pf2E,0.0%,244.94,400.66
stage1,80,1024,7168,2048,33,10,ActivationType.Silu,torch.bfloat16,torch.float8_e4m3fnuz,torch.float8_e4m3fnuz,QuantType.per_Token,1,0,16,0,3591.6692,_ZN5aiter47fmoe_stage1_bf16_pertokenFp8_g1u1_16x64_5tg_pf3E,0.0%,251.12,410.77
stage1,80,1024,7168,2048,33,10,ActivationType.Silu,torch.bfloat16,torch.float8_e4m3fnuz,torch.float8_e4m3fnuz,QuantType.per_Token,1,0,32,0,2101.2561,_ZN5aiter48fmoe_stage1_bf16_pertokenFp8_g1u1_32x128_3tg_pf2E,0.0%,429.24,702.13
stage1,80,1024,7168,2048,33,10,ActivationType.Silu,torch.bfloat16,torch.float8_e4m3fnuz,torch.float8_e4m3fnuz,QuantType.per_Token,1,0,32,0,2016.446,_ZN5aiter48fmoe_stage1_bf16_pertokenFp8_g1u1_32x128_3tg_pf3E,0.0%,447.29,731.66
stage1,80,1024,7168,2048,33,10,ActivationType.Silu,torch.bfloat16,torch.float8_e4m3fnuz,torch.float8_e4m3fnuz,QuantType.per_Token,1,0,32,0,1928.8933,_ZN5aiter48fmoe_stage1_bf16_pertokenFp8_g1u1_32x256_2tg_pf2E,0.0%,467.6,764.87
stage1,80,1024,7168,2048,33,10,ActivationType.Silu,torch.bfloat16,torch.float8_e4m3fnuz,torch.float8_e4m3fnuz,QuantType.per_Token,1,0,32,0,1840.8554,_ZN5aiter48fmoe_stage1_bf16_pertokenFp8_g1u1_32x256_2tg_pf3E,0.0%,489.96,801.45
stage1,80,1024,7168,2048,33,10,ActivationType.Silu,torch.bfloat16,torch.float8_e4m3fnuz,torch.float8_e4m3fnuz,QuantType.per_Token,1,0,32,0,2185.7308,_ZN5aiter44fmoe_stage1_bf16_pertokenFp8_g1u1_32x512_pf2E,0.0%,412.65,674.99
stage1,80,1024,7168,2048,33,10,ActivationType.Silu,torch.bfloat16,torch.float8_e4m3fnuz,torch.float8_e4m3fnuz,QuantType.per_Token,1,0,32,0,2870.4196,_ZN5aiter44fmoe_stage1_bf16_pertokenFp8_g1u1_32x512_pf3E,0.0%,314.22,513.98
stage1,80,1024,7168,2048,33,10,ActivationType.Silu,torch.bfloat16,torch.float8_e4m3fnuz,torch.float8_e4m3fnuz,QuantType.per_Token,1,0,32,0,2524.5984,_ZN5aiter47fmoe_stage1_bf16_pertokenFp8_g1u1_32x64_4tg_pf2E,0.0%,357.26,584.39
stage1,80,1024,7168,2048,33,10,ActivationType.Silu,torch.bfloat16,torch.float8_e4m3fnuz,torch.float8_e4m3fnuz,QuantType.per_Token,1,0,32,0,2337.2378,_ZN5aiter47fmoe_stage1_bf16_pertokenFp8_g1u1_32x64_4tg_pf3E,0.0%,385.9,631.24
stage1,80,1024,7168,2048,33,10,ActivationType.Silu,torch.bfloat16,torch.float8_e4m3fnuz,torch.float8_e4m3fnuz,QuantType.per_Token,1,0,64,0,1718.134,_ZN5aiter48fmoe_stage1_bf16_pertokenFp8_g1u1_64x128_2tg_pf2E,0.0%,524.96,858.69
stage1,80,1024,7168,2048,33,10,ActivationType.Silu,torch.bfloat16,torch.float8_e4m3fnuz,torch.float8_e4m3fnuz,QuantType.per_Token,1,0,64,0,1647.5269,_ZN5aiter48fmoe_stage1_bf16_pertokenFp8_g1u1_64x128_2tg_pf3E,0.0%,547.45,895.49
stage1,80,1024,7168,2048,33,10,ActivationType.Silu,torch.bfloat16,torch.float8_e4m3fnuz,torch.float8_e4m3fnuz,QuantType.per_Token,1,0,64,0,1742.4984,_ZN5aiter44fmoe_stage1_bf16_pertokenFp8_g1u1_64x256_pf2E,0.0%,517.61,846.68
stage1,80,1024,7168,2048,33,10,ActivationType.Silu,torch.bfloat16,torch.float8_e4m3fnuz,torch.float8_e4m3fnuz,QuantType.per_Token,1,0,64,0,1689.2818,_ZN5aiter44fmoe_stage1_bf16_pertokenFp8_g1u1_64x256_pf3E,0.0%,533.92,873.36
stage1,80,1024,7168,2048,33,10,ActivationType.Silu,torch.bfloat16,torch.float8_e4m3fnuz,torch.float8_e4m3fnuz,QuantType.per_Token,1,0,64,0,1958.3434,_ZN5aiter47fmoe_stage1_bf16_pertokenFp8_g1u1_64x64_3tg_pf2E,0.0%,460.56,753.36
stage1,80,1024,7168,2048,33,10,ActivationType.Silu,torch.bfloat16,torch.float8_e4m3fnuz,torch.float8_e4m3fnuz,QuantType.per_Token,1,0,64,0,1912.8072,_ZN5aiter47fmoe_stage1_bf16_pertokenFp8_g1u1_64x64_2tg_pf3E,0.0%,471.53,771.3
stage1,80,1024,7168,2048,33,10,ActivationType.Silu,torch.bfloat16,torch.float8_e4m3fnuz,torch.float8_e4m3fnuz,QuantType.per_Token,1,0,128,0,1942.7852,_ZN5aiter45fmoe_stage1_bf16_pertokenFp8_g1u1_128x128_pf2E,0.0%,464.25,759.4
stage1,80,1024,7168,2048,33,10,ActivationType.Silu,torch.bfloat16,torch.float8_e4m3fnuz,torch.float8_e4m3fnuz,QuantType.per_Token,1,0,128,0,1905.7506,_ZN5aiter45fmoe_stage1_bf16_pertokenFp8_g1u1_128x128_pf3E,0.0%,473.27,774.16
stage1,80,1024,7168,2048,33,10,ActivationType.Silu,torch.bfloat16,torch.float8_e4m3fnuz,torch.float8_e4m3fnuz,QuantType.per_Token,1,0,128,0,4322.8354,_ZN5aiter44fmoe_stage1_bf16_pertokenFp8_g1u1_128x64_pf2E,0.0%,208.65,341.29
stage1,80,1024,7168,2048,33,10,ActivationType.Silu,torch.bfloat16,torch.float8_e4m3fnuz,torch.float8_e4m3fnuz,QuantType.per_Token,1,0,128,0,2312.8859,_ZN5aiter44fmoe_stage1_bf16_pertokenFp8_g1u1_128x64_pf3E,0.0%,389.96,637.88
stage1,80,1024,7168,2048,33,10,ActivationType.Silu,torch.bfloat16,torch.float8_e4m3fnuz,torch.float8_e4m3fnuz,QuantType.per_Token,1,0,16,0,3543.856,moe_ck2stages_gemm1_128x16x64x128_1x2_MulABScale_v1_Nswizzle0_Quant2_MulRoutedWeight0_silu_F8_F8_B16,0.0%,254.51,416.31
stage1,80,1024,7168,2048,33,10,ActivationType.Silu,torch.bfloat16,torch.float8_e4m3fnuz,torch.float8_e4m3fnuz,QuantType.per_Token,1,0,16,0,3173.3477,moe_ck2stages_gemm1_256x16x128x256_1x4_MulABScale_v1_Nswizzle0_Quant2_MulRoutedWeight0_silu_F8_F8_B16,0.0%,284.22,464.92
stage1,80,1024,7168,2048,33,10,ActivationType.Silu,torch.bfloat16,torch.float8_e4m3fnuz,torch.float8_e4m3fnuz,QuantType.per_Token,1,0,16,0,3421.958,moe_ck2stages_gemm1_256x16x64x256_1x4_MulABScale_v1_Nswizzle0_Quant2_MulRoutedWeight0_silu_F8_F8_B16,0.0%,263.58,431.14
stage2,80,1024,7168,2048,33,10,ActivationType.Silu,torch.bfloat16,torch.float8_e4m3fnuz,torch.float8_e4m3fnuz,QuantType.per_Token,1,0,16,0,1899.8397,moe_ck2stages_gemm2_256x16x128x256_1x4_MulABScaleExpertWeight_v1_Nswizzle0_Quant2_MulRoutedWeight1_F8_F8_B16,7.6%,474.75,776.56
stage2,80,1024,7168,2048,33,10,ActivationType.Silu,torch.bfloat16,torch.float8_e4m3fnuz,torch.float8_e4m3fnuz,QuantType.per_Token,1,0,16,0,2001.0857,moe_ck2stages_gemm2_128x16x128x128_1x2_MulABScaleExpertWeight_v1_Nswizzle0_Quant2_MulRoutedWeight1_F8_F8_B16,7.6%,450.73,737.27
stage2,80,1024,7168,2048,33,10,ActivationType.Silu,torch.bfloat16,torch.float8_e4m3fnuz,torch.float8_e4m3fnuz,QuantType.per_Token,1,0,16,0,2741.5126,moe_ck2stages_gemm2_64x16x64x64_1x1_MulABScaleExpertWeight_v1_Nswizzle0_Quant2_MulRoutedWeight1_F8_F8_B16,7.6%,328.99,538.15
stage1,80,1024,7168,2048,33,10,ActivationType.Silu,torch.bfloat16,torch.float8_e4m3fnuz,torch.float8_e4m3fnuz,QuantType.per_Token,1,0,32,0,2263.8794,moe_ck2stages_gemm1_256x32x64x256_1x4_MulABScale_v1_Nswizzle0_Quant2_MulRoutedWeight0_silu_F8_F8_B16,0.0%,398.41,651.69
stage1,80,1024,7168,2048,33,10,ActivationType.Silu,torch.bfloat16,torch.float8_e4m3fnuz,torch.float8_e4m3fnuz,QuantType.per_Token,1,0,32,0,2652.7987,moe_ck2stages_gemm1_256x32x64x128_1x4_MulABScale_v1_Nswizzle0_Quant2_MulRoutedWeight0_silu_F8_F8_B16,0.0%,340.0,556.15
stage2,80,1024,7168,2048,33,10,ActivationType.Silu,torch.bfloat16,torch.float8_e4m3fnuz,torch.float8_e4m3fnuz,QuantType.per_Token,1,0,32,0,1794.5294,moe_ck2stages_gemm2_256x32x64x256_1x4_MulABScaleExpertWeight_v1_Nswizzle0_Quant2_MulRoutedWeight1_F8_F8_B16,7.6%,502.61,822.14
stage2,80,1024,7168,2048,33,10,ActivationType.Silu,torch.bfloat16,torch.float8_e4m3fnuz,torch.float8_e4m3fnuz,QuantType.per_Token,1,0,32,0,2450.2178,moe_ck2stages_gemm2_256x32x64x128_1x4_MulABScaleExpertWeight_v1_Nswizzle0_Quant2_MulRoutedWeight1_F8_F8_B16,7.6%,368.11,602.13
stage2,80,1024,7168,2048,33,10,ActivationType.Silu,torch.bfloat16,torch.float8_e4m3fnuz,torch.float8_e4m3fnuz,QuantType.per_Token,1,0,32,0,2938.2213,moe_ck2stages_gemm2_256x32x64x64_1x4_MulABScaleExpertWeight_v1_Nswizzle0_Quant2_MulRoutedWeight1_F8_F8_B16,99.6%,306.97,502.12
stage1,80,1024,7168,2048,33,10,ActivationType.Silu,torch.bfloat16,torch.float8_e4m3fnuz,torch.float8_e4m3fnuz,QuantType.per_Token,1,0,64,0,2423.2879,moe_ck2stages_gemm1_256x64x64x256_1x4_MulABScale_v1_Nswizzle0_Quant2_MulRoutedWeight0_silu_F8_F8_B16,0.0%,372.2,608.82
stage1,80,1024,7168,2048,33,10,ActivationType.Silu,torch.bfloat16,torch.float8_e4m3fnuz,torch.float8_e4m3fnuz,QuantType.per_Token,1,0,64,0,1935.7141,moe_ck2stages_gemm1_256x64x64x128_1x4_MulABScale_v1_Nswizzle0_Quant2_MulRoutedWeight0_silu_F8_F8_B16,0.0%,465.95,762.17
stage1,80,1024,7168,2048,33,10,ActivationType.Silu,torch.bfloat16,torch.float8_e4m3fnuz,torch.float8_e4m3fnuz,QuantType.per_Token,1,0,64,0,2766.6791,moe_ck2stages_gemm1_256x64x128x256_1x4_MulABScale_v3_Nswizzle0_Quant2_MulRoutedWeight0_silu_F8_F8_B16,0.0%,326.0,533.26
stage1,80,1024,7168,2048,33,10,ActivationType.Silu,torch.bfloat16,torch.float8_e4m3fnuz,torch.float8_e4m3fnuz,QuantType.per_Token,1,0,64,0,1866.0722,moe_ck2stages_gemm1_256x64x128x128_1x4_MulABScale_v3_Nswizzle0_Quant2_MulRoutedWeight0_silu_F8_F8_B16,0.0%,483.34,790.62
stage2,80,1024,7168,2048,33,10,ActivationType.Silu,torch.bfloat16,torch.float8_e4m3fnuz,torch.float8_e4m3fnuz,QuantType.per_Token,1,0,64,0,2205.1571,moe_ck2stages_gemm2_256x64x64x256_1x4_MulABScaleExpertWeight_v1_Nswizzle0_Quant2_MulRoutedWeight1_F8_F8_B16,7.6%,409.02,669.04
stage2,80,1024,7168,2048,33,10,ActivationType.Silu,torch.bfloat16,torch.float8_e4m3fnuz,torch.float8_e4m3fnuz,QuantType.per_Token,1,0,64,0,1713.5942,moe_ck2stages_gemm2_256x64x128x256_1x4_MulABScaleExpertWeight_v3_Nswizzle0_Quant2_MulRoutedWeight1_F8_F8_B16,7.6%,526.35,860.97
stage2,80,1024,7168,2048,33,10,ActivationType.Silu,torch.bfloat16,torch.float8_e4m3fnuz,torch.float8_e4m3fnuz,QuantType.per_Token,1,0,64,0,1435.708,moe_ck2stages_gemm2_256x64x128x128_1x4_MulABScaleExpertWeight_v3_Nswizzle0_Quant2_MulRoutedWeight1_F8_F8_B16,7.6%,628.22,1027.61
stage2,80,1024,7168,2048,33,10,ActivationType.Silu,torch.bfloat16,torch.float8_e4m3fnuz,torch.float8_e4m3fnuz,QuantType.per_Token,1,0,64,0,2578.5875,moe_ck2stages_gemm2_256x64x128x64_1x4_MulABScaleExpertWeight_v3_Nswizzle0_Quant2_MulRoutedWeight1_F8_F8_B16,99.6%,349.78,572.15
stage2,80,1024,7168,2048,33,10,ActivationType.Silu,torch.bfloat16,torch.float8_e4m3fnuz,torch.float8_e4m3fnuz,QuantType.per_Token,1,0,64,0,2612.7092,moe_ck2stages_gemm2_256x64x64x64_1x4_MulABScaleExpertWeight_v1_Nswizzle0_Quant2_MulRoutedWeight1_F8_F8_B16,99.6%,345.21,564.68
stage1,80,1024,7168,2048,33,10,ActivationType.Silu,torch.bfloat16,torch.float8_e4m3fnuz,torch.float8_e4m3fnuz,QuantType.per_Token,1,0,128,0,2288.285,moe_ck2stages_gemm1_256x128x64x128_1x4_MulABScale_v1_Nswizzle0_Quant2_MulRoutedWeight0_silu_F8_F8_B16,0.0%,394.16,644.74
stage1,80,1024,7168,2048,33,10,ActivationType.Silu,torch.bfloat16,torch.float8_e4m3fnuz,torch.float8_e4m3fnuz,QuantType.per_Token,1,0,128,0,3193.4508,moe_ck2stages_gemm1_256x128x128x256_1x4_MulABScale_v3_Nswizzle0_Quant2_MulRoutedWeight0_silu_F8_F8_B16,0.0%,282.44,461.99
stage1,80,1024,7168,2048,33,10,ActivationType.Silu,torch.bfloat16,torch.float8_e4m3fnuz,torch.float8_e4m3fnuz,QuantType.per_Token,1,0,128,0,2260.4561,moe_ck2stages_gemm1_256x128x128x128_1x4_MulABScale_v3_Nswizzle0_Quant2_MulRoutedWeight0_silu_F8_F8_B16,0.0%,399.01,652.68
stage2,80,1024,7168,2048,33,10,ActivationType.Silu,torch.bfloat16,torch.float8_e4m3fnuz,torch.float8_e4m3fnuz,QuantType.per_Token,1,0,128,0,1873.8453,moe_ck2stages_gemm2_256x128x64x128_1x4_MulABScaleExpertWeight_v1_Nswizzle0_Quant2_MulRoutedWeight1_F8_F8_B16,7.6%,481.33,787.34
stage2,80,1024,7168,2048,33,10,ActivationType.Silu,torch.bfloat16,torch.float8_e4m3fnuz,torch.float8_e4m3fnuz,QuantType.per_Token,1,0,128,0,1428.4294,moe_ck2stages_gemm2_256x128x128x128_1x4_MulABScaleExpertWeight_v3_Nswizzle0_Quant2_MulRoutedWeight1_F8_F8_B16,7.6%,631.42,1032.85
stage2,80,1024,7168,2048,33,10,ActivationType.Silu,torch.bfloat16,torch.float8_e4m3fnuz,torch.float8_e4m3fnuz,QuantType.per_Token,1,0,128,0,2439.7529,moe_ck2stages_gemm2_256x128x128x64_1x4_MulABScaleExpertWeight_v3_Nswizzle0_Quant2_MulRoutedWeight1_F8_F8_B16,99.6%,369.69,604.71
stage2,80,1024,7168,2048,33,10,ActivationType.Silu,torch.bfloat16,torch.float8_e4m3fnuz,torch.float8_e4m3fnuz,QuantType.per_Token,1,0,128,0,2909.5935,moe_ck2stages_gemm2_256x128x64x64_1x4_MulABScaleExpertWeight_v3_Nswizzle0_Quant2_MulRoutedWeight1_F8_F8_B16,99.6%,309.99,507.06
stage1,80,1024,7168,2048,33,10,ActivationType.Silu,torch.bfloat16,torch.float8_e4m3fnuz,torch.float8_e4m3fnuz,QuantType.per_Token,1,0,32,0,-1.0,flydsl_moe1_afp8_wfp8_bf16_t32x128x128,100.0%,0.0,0.0
stage2,80,1024,7168,2048,33,10,ActivationType.Silu,torch.bfloat16,torch.float8_e4m3fnuz,torch.float8_e4m3fnuz,QuantType.per_Token,1,0,32,0,-1.0,flydsl_moe2_afp8_wfp8_bf16_t32x128x128_atomic,100.0%,0.0,0.0
stage2,80,1024,7168,2048,33,10,ActivationType.Silu,torch.bfloat16,torch.float8_e4m3fnuz,torch.float8_e4m3fnuz,QuantType.per_Token,1,0,32,0,-1.0,flydsl_moe2_afp8_wfp8_bf16_t32x128x128_reduce,100.0%,0.0,0.0
stage1,80,1024,7168,2048,33,10,ActivationType.Silu,torch.bfloat16,torch.float8_e4m3fnuz,torch.float8_e4m3fnuz,QuantType.per_Token,1,0,64,0,-1.0,flydsl_moe1_afp8_wfp8_bf16_t64x128x128,100.0%,0.0,0.0
stage2,80,1024,7168,2048,33,10,ActivationType.Silu,torch.bfloat16,torch.float8_e4m3fnuz,torch.float8_e4m3fnuz,QuantType.per_Token,1,0,64,0,-1.0,flydsl_moe2_afp8_wfp8_bf16_t64x128x128_atomic,100.0%,0.0,0.0
stage2,80,1024,7168,2048,33,10,ActivationType.Silu,torch.bfloat16,torch.float8_e4m3fnuz,torch.float8_e4m3fnuz,QuantType.per_Token,1,0,64,0,-1.0,flydsl_moe2_afp8_wfp8_bf16_t64x128x128_reduce,100.0%,0.0,0.0
asm_1stage,80,1024,7168,2048,33,10,ActivationType.Silu,torch.bfloat16,torch.float8_e4m3fnuz,torch.float8_e4m3fnuz,QuantType.per_Token,1,0,32,0,7615.8942,_ZN5aiter45fmoe_bf16_pertokenFp8_g1u1_vs_silu_1tg_32x128E,0.0%,118.43,193.72
asm_1stage,80,1024,7168,2048,33,10,ActivationType.Silu,torch.bfloat16,torch.float8_e4m3fnuz,torch.float8_e4m3fnuz,QuantType.per_Token,1,0,32,0,7217.5834,_ZN5aiter48fmoe_bf16_pertokenFp8_g1u1_vs_silu_1tg_ps_32x128E,0.0%,124.96,204.41
asm_1stage,80,1024,7168,2048,33,10,ActivationType.Silu,torch.bfloat16,torch.float8_e4m3fnuz,torch.float8_e4m3fnuz,QuantType.per_Token,1,0,32,0,4385.844,_ZN5aiter48fmoe_bf16_pertokenFp8_g1u1_vs_silu_1tg_ps_32x256E,0.0%,205.65,336.39
asm_1stage,80,1024,7168,2048,33,10,ActivationType.Silu,torch.bfloat16,torch.float8_e4m3fnuz,torch.float8_e4m3fnuz,QuantType.per_Token,1,0,32,0,4071.1823,_ZN5aiter45fmoe_bf16_pertokenFp8_g1u1_vs_silu_1tg_32x256E,0.0%,221.54,362.39
asm_1stage,80,1024,7168,2048,33,10,ActivationType.Silu,torch.bfloat16,torch.float8_e4m3fnuz,torch.float8_e4m3fnuz,QuantType.per_Token,1,0,32,0,5219.4357,_ZN5aiter45fmoe_bf16_pertokenFp8_g1u1_vs_silu_1tg_32x512E,0.0%,172.8,282.66
asm_1stage,80,1024,7168,2048,33,10,ActivationType.Silu,torch.bfloat16,torch.float8_e4m3fnuz,torch.float8_e4m3fnuz,QuantType.per_Token,1,0,32,0,3459.489,_ZN5aiter48fmoe_bf16_pertokenFp8_g1u1_vs_silu_1tg_ps_32x512E,0.0%,260.72,426.46
stage1,80,1024,7168,2048,33,10,ActivationType.Silu,torch.bfloat16,torch.float8_e4m3fnuz,torch.float8_e4m3fnuz,QuantType.per_Token,1,0,16,0,3408.4301,_ZN5aiter48fmoe_stage1_bf16_pertokenFp8_g1u1_16x128_4tg_pf2E,0.0%,264.62,432.85
stage1,80,1024,7168,2048,33,10,ActivationType.Silu,torch.bfloat16,torch.float8_e4m3fnuz,torch.float8_e4m3fnuz,QuantType.per_Token,1,0,16,0,3304.2848,_ZN5aiter48fmoe_stage1_bf16_pertokenFp8_g1u1_16x128_4tg_pf3E,0.0%,272.96,446.49
stage1,80,1024,7168,2048,33,10,ActivationType.Silu,torch.bfloat16,torch.float8_e4m3fnuz,torch.float8_e4m3fnuz,QuantType.per_Token,1,0,16,0,3077.7132,_ZN5aiter48fmoe_stage1_bf16_pertokenFp8_g1u1_16x256_3tg_pf2E,0.0%,293.06,479.36
stage1,80,1024,7168,2048,33,10,ActivationType.Silu,torch.bfloat16,torch.float8_e4m3fnuz,torch.float8_e4m3fnuz,QuantType.per_Token,1,0,16,0,3100.7323,_ZN5aiter48fmoe_stage1_bf16_pertokenFp8_g1u1_16x256_2tg_pf3E,0.0%,290.88,475.81
stage1,80,1024,7168,2048,33,10,ActivationType.Silu,torch.bfloat16,torch.float8_e4m3fnuz,torch.float8_e4m3fnuz,QuantType.per_Token,1,0,16,0,3019.9755,_ZN5aiter48fmoe_stage1_bf16_pertokenFp8_g1u1_16x512_2tg_pf2E,0.0%,298.66,488.53
stage1,80,1024,7168,2048,33,10,ActivationType.Silu,torch.bfloat16,torch.float8_e4m3fnuz,torch.float8_e4m3fnuz,QuantType.per_Token,1,0,16,0,3215.9884,_ZN5aiter44fmoe_stage1_bf16_pertokenFp8_g1u1_16x512_pf3E,0.0%,280.46,458.75
stage1,80,1024,7168,2048,33,10,ActivationType.Silu,torch.bfloat16,torch.float8_e4m3fnuz,torch.float8_e4m3fnuz,QuantType.per_Token,1,0,16,0,3681.3408,_ZN5aiter47fmoe_stage1_bf16_pertokenFp8_g1u1_16x64_6tg_pf2E,0.0%,245.0,400.76
stage1,80,1024,7168,2048,33,10,ActivationType.Silu,torch.bfloat16,torch.float8_e4m3fnuz,torch.float8_e4m3fnuz,QuantType.per_Token,1,0,16,0,3591.5205,_ZN5aiter47fmoe_stage1_bf16_pertokenFp8_g1u1_16x64_5tg_pf3E,0.0%,251.13,410.79
stage1,80,1024,7168,2048,33,10,ActivationType.Silu,torch.bfloat16,torch.float8_e4m3fnuz,torch.float8_e4m3fnuz,QuantType.per_Token,1,0,32,0,2094.3559,_ZN5aiter48fmoe_stage1_bf16_pertokenFp8_g1u1_32x128_3tg_pf2E,0.0%,430.65,704.44
stage1,80,1024,7168,2048,33,10,ActivationType.Silu,torch.bfloat16,torch.float8_e4m3fnuz,torch.float8_e4m3fnuz,QuantType.per_Token,1,0,32,0,2023.7299,_ZN5aiter48fmoe_stage1_bf16_pertokenFp8_g1u1_32x128_3tg_pf3E,0.0%,445.68,729.02
stage1,80,1024,7168,2048,33,10,ActivationType.Silu,torch.bfloat16,torch.float8_e4m3fnuz,torch.float8_e4m3fnuz,QuantType.per_Token,1,0,32,0,1923.7471,_ZN5aiter48fmoe_stage1_bf16_pertokenFp8_g1u1_32x256_2tg_pf2E,0.0%,468.85,766.91
stage1,80,1024,7168,2048,33,10,ActivationType.Silu,torch.bfloat16,torch.float8_e4m3fnuz,torch.float8_e4m3fnuz,QuantType.per_Token,1,0,32,0,1846.6738,_ZN5aiter48fmoe_stage1_bf16_pertokenFp8_g1u1_32x256_2tg_pf3E,0.0%,488.41,798.92
stage1,80,1024,7168,2048,33,10,ActivationType.Silu,torch.bfloat16,torch.float8_e4m3fnuz,torch.float8_e4m3fnuz,QuantType.per_Token,1,0,32,0,2182.8869,_ZN5aiter44fmoe_stage1_bf16_pertokenFp8_g1u1_32x512_pf2E,0.0%,413.19,675.87
stage1,80,1024,7168,2048,33,10,ActivationType.Silu,torch.bfloat16,torch.float8_e4m3fnuz,torch.float8_e4m3fnuz,QuantType.per_Token,1,0,32,0,1939.9523,_ZN5aiter44fmoe_stage1_bf16_pertokenFp8_g1u1_32x512_pf3E,0.0%,464.93,760.51
stage1,80,1024,7168,2048,33,10,ActivationType.Silu,torch.bfloat16,torch.float8_e4m3fnuz,torch.float8_e4m3fnuz,QuantType.per_Token,1,0,32,0,2603.1313,_ZN5aiter47fmoe_stage1_bf16_pertokenFp8_g1u1_32x64_4tg_pf2E,0.0%,346.48,566.76
stage1,80,1024,7168,2048,33,10,ActivationType.Silu,torch.bfloat16,torch.float8_e4m3fnuz,torch.float8_e4m3fnuz,QuantType.per_Token,1,0,32,0,2336.1226,_ZN5aiter47fmoe_stage1_bf16_pertokenFp8_g1u1_32x64_4tg_pf3E,0.0%,386.09,631.54
stage1,80,1024,7168,2048,33,10,ActivationType.Silu,torch.bfloat16,torch.float8_e4m3fnuz,torch.float8_e4m3fnuz,QuantType.per_Token,1,0,64,0,1707.3885,_ZN5aiter48fmoe_stage1_bf16_pertokenFp8_g1u1_64x128_2tg_pf2E,0.0%,528.26,864.1
stage1,80,1024,7168,2048,33,10,ActivationType.Silu,torch.bfloat16,torch.float8_e4m3fnuz,torch.float8_e4m3fnuz,QuantType.per_Token,1,0,64,0,1656.9722,_ZN5aiter48fmoe_stage1_bf16_pertokenFp8_g1u1_64x128_2tg_pf3E,0.0%,544.33,890.39
stage1,80,1024,7168,2048,33,10,ActivationType.Silu,torch.bfloat16,torch.float8_e4m3fnuz,torch.float8_e4m3fnuz,QuantType.per_Token,1,0,64,0,1733.5222,_ZN5aiter44fmoe_stage1_bf16_pertokenFp8_g1u1_64x256_pf2E,0.0%,520.3,851.07
stage1,80,1024,7168,2048,33,10,ActivationType.Silu,torch.bfloat16,torch.float8_e4m3fnuz,torch.float8_e4m3fnuz,QuantType.per_Token,1,0,64,0,1695.8855,_ZN5aiter44fmoe_stage1_bf16_pertokenFp8_g1u1_64x256_pf3E,0.0%,531.84,869.96
stage1,80,1024,7168,2048,33,10,ActivationType.Silu,torch.bfloat16,torch.float8_e4m3fnuz,torch.float8_e4m3fnuz,QuantType.per_Token,1,0,64,0,1957.6775,_ZN5aiter47fmoe_stage1_bf16_pertokenFp8_g1u1_64x64_3tg_pf2E,0.0%,460.72,753.62
stage1,80,1024,7168,2048,33,10,ActivationType.Silu,torch.bfloat16,torch.float8_e4m3fnuz,torch.float8_e4m3fnuz,QuantType.per_Token,1,0,64,0,1911.8513,_ZN5aiter47fmoe_stage1_bf16_pertokenFp8_g1u1_64x64_2tg_pf3E,0.0%,471.76,771.68
stage1,80,1024,7168,2048,33,10,ActivationType.Silu,torch.bfloat16,torch.float8_e4m3fnuz,torch.float8_e4m3fnuz,QuantType.per_Token,1,0,128,0,1920.356,_ZN5aiter45fmoe_stage1_bf16_pertokenFp8_g1u1_128x128_pf2E,0.0%,469.67,768.27
stage1,80,1024,7168,2048,33,10,ActivationType.Silu,torch.bfloat16,torch.float8_e4m3fnuz,torch.float8_e4m3fnuz,QuantType.per_Token,1,0,128,0,3128.9241,_ZN5aiter45fmoe_stage1_bf16_pertokenFp8_g1u1_128x128_pf3E,0.0%,288.26,471.52
stage1,80,1024,7168,2048,33,10,ActivationType.Silu,torch.bfloat16,torch.float8_e4m3fnuz,torch.float8_e4m3fnuz,QuantType.per_Token,1,0,128,0,2642.1772,_ZN5aiter44fmoe_stage1_bf16_pertokenFp8_g1u1_128x64_pf2E,0.0%,341.36,558.38
stage1,80,1024,7168,2048,33,10,ActivationType.Silu,torch.bfloat16,torch.float8_e4m3fnuz,torch.float8_e4m3fnuz,QuantType.per_Token,1,0,128,0,2332.6072,_ZN5aiter44fmoe_stage1_bf16_pertokenFp8_g1u1_128x64_pf3E,0.0%,386.67,632.49
stage1,80,1024,7168,2048,33,10,ActivationType.Silu,torch.bfloat16,torch.float8_e4m3fnuz,torch.float8_e4m3fnuz,QuantType.per_Token,1,0,16,0,3538.0734,moe_ck2stages_gemm1_128x16x64x128_1x2_MulABScale_v1_Nswizzle0_Quant2_MulRoutedWeight0_silu_F8_F8_B16,0.0%,254.92,416.99
stage1,80,1024,7168,2048,33,10,ActivationType.Silu,torch.bfloat16,torch.float8_e4m3fnuz,torch.float8_e4m3fnuz,QuantType.per_Token,1,0,16,0,3178.9317,moe_ck2stages_gemm1_256x16x128x256_1x4_MulABScale_v1_Nswizzle0_Quant2_MulRoutedWeight0_silu_F8_F8_B16,0.0%,283.73,464.1
stage1,80,1024,7168,2048,33,10,ActivationType.Silu,torch.bfloat16,torch.float8_e4m3fnuz,torch.float8_e4m3fnuz,QuantType.per_Token,1,0,16,0,3421.9849,moe_ck2stages_gemm1_256x16x64x256_1x4_MulABScale_v1_Nswizzle0_Quant2_MulRoutedWeight0_silu_F8_F8_B16,0.0%,263.57,431.14
stage2,80,1024,7168,2048,33,10,ActivationType.Silu,torch.bfloat16,torch.float8_e4m3fnuz,torch.float8_e4m3fnuz,QuantType.per_Token,1,0,16,0,1899.1696,moe_ck2stages_gemm2_256x16x128x256_1x4_MulABScaleExpertWeight_v1_Nswizzle0_Quant2_MulRoutedWeight1_F8_F8_B16,7.6%,474.91,776.84
stage2,80,1024,7168,2048,33,10,ActivationType.Silu,torch.bfloat16,torch.float8_e4m3fnuz,torch.float8_e4m3fnuz,QuantType.per_Token,1,0,16,0,1994.5003,moe_ck2stages_gemm2_128x16x128x128_1x2_MulABScaleExpertWeight_v1_Nswizzle0_Quant2_MulRoutedWeight1_F8_F8_B16,7.6%,452.22,739.71
stage2,80,1024,7168,2048,33,10,ActivationType.Silu,torch.bfloat16,torch.float8_e4m3fnuz,torch.float8_e4m3fnuz,QuantType.per_Token,1,0,16,0,2748.2707,moe_ck2stages_gemm2_64x16x64x64_1x1_MulABScaleExpertWeight_v1_Nswizzle0_Quant2_MulRoutedWeight1_F8_F8_B16,7.6%,328.19,536.83
stage1,80,1024,7168,2048,33,10,ActivationType.Silu,torch.bfloat16,torch.float8_e4m3fnuz,torch.float8_e4m3fnuz,QuantType.per_Token,1,0,32,0,2262.8829,moe_ck2stages_gemm1_256x32x64x256_1x4_MulABScale_v1_Nswizzle0_Quant2_MulRoutedWeight0_silu_F8_F8_B16,0.0%,398.58,651.98
stage1,80,1024,7168,2048,33,10,ActivationType.Silu,torch.bfloat16,torch.float8_e4m3fnuz,torch.float8_e4m3fnuz,QuantType.per_Token,1,0,32,0,2646.4268,moe_ck2stages_gemm1_256x32x64x128_1x4_MulABScale_v1_Nswizzle0_Quant2_MulRoutedWeight0_silu_F8_F8_B16,0.0%,340.82,557.49
stage2,80,1024,7168,2048,33,10,ActivationType.Silu,torch.bfloat16,torch.float8_e4m3fnuz,torch.float8_e4m3fnuz,QuantType.per_Token,1,0,32,0,1798.0241,moe_ck2stages_gemm2_256x32x64x256_1x4_MulABScaleExpertWeight_v1_Nswizzle0_Quant2_MulRoutedWeight1_F8_F8_B16,7.6%,501.63,820.54
stage2,80,1024,7168,2048,33,10,ActivationType.Silu,torch.bfloat16,torch.float8_e4m3fnuz,torch.float8_e4m3fnuz,QuantType.per_Token,1,0,32,0,2448.5818,moe_ck2stages_gemm2_256x32x64x128_1x4_MulABScaleExpertWeight_v1_Nswizzle0_Quant2_MulRoutedWeight1_F8_F8_B16,7.6%,368.35,602.53
stage2,80,1024,7168,2048,33,10,ActivationType.Silu,torch.bfloat16,torch.float8_e4m3fnuz,torch.float8_e4m3fnuz,QuantType.per_Token,1,0,32,0,2939.3541,moe_ck2stages_gemm2_256x32x64x64_1x4_MulABScaleExpertWeight_v1_Nswizzle0_Quant2_MulRoutedWeight1_F8_F8_B16,99.6%,306.85,501.93
stage1,80,1024,7168,2048,33,10,ActivationType.Silu,torch.bfloat16,torch.float8_e4m3fnuz,torch.float8_e4m3fnuz,QuantType.per_Token,1,0,64,0,2425.5709,moe_ck2stages_gemm1_256x64x64x256_1x4_MulABScale_v1_Nswizzle0_Quant2_MulRoutedWeight0_silu_F8_F8_B16,0.0%,371.85,608.25
stage1,80,1024,7168,2048,33,10,ActivationType.Silu,torch.bfloat16,torch.float8_e4m3fnuz,torch.float8_e4m3fnuz,QuantType.per_Token,1,0,64,0,1914.5914,moe_ck2stages_gemm1_256x64x64x128_1x4_MulABScale_v1_Nswizzle0_Quant2_MulRoutedWeight0_silu_F8_F8_B16,0.0%,471.09,770.58
stage1,80,1024,7168,2048,33,10,ActivationType.Silu,torch.bfloat16,torch.float8_e4m3fnuz,torch.float8_e4m3fnuz,QuantType.per_Token,1,0,64,0,2768.6723,moe_ck2stages_gemm1_256x64x128x256_1x4_MulABScale_v3_Nswizzle0_Quant2_MulRoutedWeight0_silu_F8_F8_B16,0.0%,325.77,532.87
stage1,80,1024,7168,2048,33,10,ActivationType.Silu,torch.bfloat16,torch.float8_e4m3fnuz,torch.float8_e4m3fnuz,QuantType.per_Token,1,0,64,0,2082.0571,moe_ck2stages_gemm1_256x64x128x128_1x4_MulABScale_v3_Nswizzle0_Quant2_MulRoutedWeight0_silu_F8_F8_B16,0.0%,433.2,708.6
stage2,80,1024,7168,2048,33,10,ActivationType.Silu,torch.bfloat16,torch.float8_e4m3fnuz,torch.float8_e4m3fnuz,QuantType.per_Token,1,0,64,0,1978.1283,moe_ck2stages_gemm2_256x64x64x256_1x4_MulABScaleExpertWeight_v1_Nswizzle0_Quant2_MulRoutedWeight1_F8_F8_B16,7.6%,455.96,745.83
stage2,80,1024,7168,2048,33,10,ActivationType.Silu,torch.bfloat16,torch.float8_e4m3fnuz,torch.float8_e4m3fnuz,QuantType.per_Token,1,0,64,0,1716.8831,moe_ck2stages_gemm2_256x64x128x256_1x4_MulABScaleExpertWeight_v3_Nswizzle0_Quant2_MulRoutedWeight1_F8_F8_B16,7.6%,525.34,859.32
stage2,80,1024,7168,2048,33,10,ActivationType.Silu,torch.bfloat16,torch.float8_e4m3fnuz,torch.float8_e4m3fnuz,QuantType.per_Token,1,0,64,0,1435.1064,moe_ck2stages_gemm2_256x64x128x128_1x4_MulABScaleExpertWeight_v3_Nswizzle0_Quant2_MulRoutedWeight1_F8_F8_B16,7.6%,628.49,1028.04
stage2,80,1024,7168,2048,33,10,ActivationType.Silu,torch.bfloat16,torch.float8_e4m3fnuz,torch.float8_e4m3fnuz,QuantType.per_Token,1,0,64,0,2577.6102,moe_ck2stages_gemm2_256x64x128x64_1x4_MulABScaleExpertWeight_v3_Nswizzle0_Quant2_MulRoutedWeight1_F8_F8_B16,99.6%,349.91,572.37
stage2,80,1024,7168,2048,33,10,ActivationType.Silu,torch.bfloat16,torch.float8_e4m3fnuz,torch.float8_e4m3fnuz,QuantType.per_Token,1,0,64,0,2589.3903,moe_ck2stages_gemm2_256x64x64x64_1x4_MulABScaleExpertWeight_v1_Nswizzle0_Quant2_MulRoutedWeight1_F8_F8_B16,99.6%,348.32,569.77
stage1,80,1024,7168,2048,33,10,ActivationType.Silu,torch.bfloat16,torch.float8_e4m3fnuz,torch.float8_e4m3fnuz,QuantType.per_Token,1,0,128,0,2281.4071,moe_ck2stages_gemm1_256x128x64x128_1x4_MulABScale_v1_Nswizzle0_Quant2_MulRoutedWeight0_silu_F8_F8_B16,0.0%,395.35,646.68
stage1,80,1024,7168,2048,33,10,ActivationType.Silu,torch.bfloat16,torch.float8_e4m3fnuz,torch.float8_e4m3fnuz,QuantType.per_Token,1,0,128,0,3194.7731,moe_ck2stages_gemm1_256x128x128x256_1x4_MulABScale_v3_Nswizzle0_Quant2_MulRoutedWeight0_silu_F8_F8_B16,0.0%,282.32,461.8
stage1,80,1024,7168,2048,33,10,ActivationType.Silu,torch.bfloat16,torch.float8_e4m3fnuz,torch.float8_e4m3fnuz,QuantType.per_Token,1,0,128,0,2287.9284,moe_ck2stages_gemm1_256x128x128x128_1x4_MulABScale_v3_Nswizzle0_Quant2_MulRoutedWeight0_silu_F8_F8_B16,0.0%,394.22,644.84
stage2,80,1024,7168,2048,33,10,ActivationType.Silu,torch.bfloat16,torch.float8_e4m3fnuz,torch.float8_e4m3fnuz,QuantType.per_Token,1,0,128,0,2055.8225,moe_ck2stages_gemm2_256x128x64x128_1x4_MulABScaleExpertWeight_v1_Nswizzle0_Quant2_MulRoutedWeight1_F8_F8_B16,7.6%,438.73,717.64
stage2,80,1024,7168,2048,33,10,ActivationType.Silu,torch.bfloat16,torch.float8_e4m3fnuz,torch.float8_e4m3fnuz,QuantType.per_Token,1,0,128,0,1430.5475,moe_ck2stages_gemm2_256x128x128x128_1x4_MulABScaleExpertWeight_v3_Nswizzle0_Quant2_MulRoutedWeight1_F8_F8_B16,7.6%,630.49,1031.32
stage2,80,1024,7168,2048,33,10,ActivationType.Silu,torch.bfloat16,torch.float8_e4m3fnuz,torch.float8_e4m3fnuz,QuantType.per_Token,1,0,128,0,2431.2728,moe_ck2stages_gemm2_256x128x128x64_1x4_MulABScaleExpertWeight_v3_Nswizzle0_Quant2_MulRoutedWeight1_F8_F8_B16,99.6%,370.98,606.82
stage2,80,1024,7168,2048,33,10,ActivationType.Silu,torch.bfloat16,torch.float8_e4m3fnuz,torch.float8_e4m3fnuz,QuantType.per_Token,1,0,128,0,2908.8486,moe_ck2stages_gemm2_256x128x64x64_1x4_MulABScaleExpertWeight_v3_Nswizzle0_Quant2_MulRoutedWeight1_F8_F8_B16,99.6%,310.07,507.19
stage2,80,1024,7168,2048,33,10,ActivationType.Silu,torch.bfloat16,torch.float8_e4m3fnuz,torch.float8_e4m3fnuz,QuantType.per_Token,1,0,32,0,-1.0,flydsl_moe2_afp8_wfp8_bf16_t32x128x128_atomic,100.0%,0.0,0.0
stage2,80,1024,7168,2048,33,10,ActivationType.Silu,torch.bfloat16,torch.float8_e4m3fnuz,torch.float8_e4m3fnuz,QuantType.per_Token,1,0,32,0,inf,flydsl_moe2_afp8_wfp8_bf16_t32x128x128_reduce,100.0%,0.0,0.0
stage2,80,1024,7168,2048,33,10,ActivationType.Silu,torch.bfloat16,torch.float8_e4m3fnuz,torch.float8_e4m3fnuz,QuantType.per_Token,1,0,64,0,-1.0,flydsl_moe2_afp8_wfp8_bf16_t64x128x128_atomic,100.0%,0.0,0.0
stage2,80,1024,7168,2048,33,10,ActivationType.Silu,torch.bfloat16,torch.float8_e4m3fnuz,torch.float8_e4m3fnuz,QuantType.per_Token,1,0,64,0,inf,flydsl_moe2_afp8_wfp8_bf16_t64x128x128_reduce,100.0%,0.0,0.0
asm_1stage,80,1024,7168,2048,33,10,ActivationType.Silu,torch.bfloat16,torch.float8_e4m3fnuz,torch.float8_e4m3fnuz,QuantType.per_Token,1,0,32,0,7604.7587,_ZN5aiter45fmoe_bf16_pertokenFp8_g1u1_vs_silu_1tg_32x128E,0.0%,118.6,194.0
asm_1stage,80,1024,7168,2048,33,10,ActivationType.Silu,torch.bfloat16,torch.float8_e4m3fnuz,torch.float8_e4m3fnuz,QuantType.per_Token,1,0,32,0,7209.5027,_ZN5aiter48fmoe_bf16_pertokenFp8_g1u1_vs_silu_1tg_ps_32x128E,0.0%,125.1,204.64
asm_1stage,80,1024,7168,2048,33,10,ActivationType.Silu,torch.bfloat16,torch.float8_e4m3fnuz,torch.float8_e4m3fnuz,QuantType.per_Token,1,0,32,0,8399.1529,_ZN5aiter48fmoe_bf16_pertokenFp8_g1u1_vs_silu_1tg_ps_32x256E,0.0%,107.39,175.65
asm_1stage,80,1024,7168,2048,33,10,ActivationType.Silu,torch.bfloat16,torch.float8_e4m3fnuz,torch.float8_e4m3fnuz,QuantType.per_Token,1,0,32,0,4082.587,_ZN5aiter45fmoe_bf16_pertokenFp8_g1u1_vs_silu_1tg_32x256E,0.0%,220.92,361.38
asm_1stage,80,1024,7168,2048,33,10,ActivationType.Silu,torch.bfloat16,torch.float8_e4m3fnuz,torch.float8_e4m3fnuz,QuantType.per_Token,1,0,32,0,3281.6287,_ZN5aiter45fmoe_bf16_pertokenFp8_g1u1_vs_silu_1tg_32x512E,0.0%,274.85,449.58
asm_1stage,80,1024,7168,2048,33,10,ActivationType.Silu,torch.bfloat16,torch.float8_e4m3fnuz,torch.float8_e4m3fnuz,QuantType.per_Token,1,0,32,0,3457.598,_ZN5aiter48fmoe_bf16_pertokenFp8_g1u1_vs_silu_1tg_ps_32x512E,0.0%,260.86,426.7
