aiter/configs/profile_fmoe.csv
stage,cu_num,token,model_dim,inter_dim,expert,topk,act_type,dtype,q_dtype_a,q_dtype_w,q_type,use_g1u1,doweight_stage1,block_m,ksplit,us,kernelName,err,tflops,bw
stage1,256,64,4096,4096,32,8,ActivationType.Silu,torch.bfloat16,torch.bfloat16,torch.bfloat16,QuantType.No,1,0,32,0,383.1692,moe_ck2stages_gemm1_256x32x64x128_1x4_TypeCast_v1_Nswizzle0_Quant0_MulRoutedWeight0_silu_B16_B16_B16,0.0%,134.51,8409.53
stage1,256,64,4096,4096,32,8,ActivationType.Silu,torch.bfloat16,torch.bfloat16,torch.bfloat16,QuantType.No,1,0,32,0,397.7944,moe_ck2stages_gemm1_256x32x64x64_1x4_TypeCast_v1_Nswizzle0_Quant0_MulRoutedWeight0_silu_B16_B16_B16,0.0%,129.56,8100.35
stage2,256,64,4096,4096,32,8,ActivationType.Silu,torch.bfloat16,torch.bfloat16,torch.bfloat16,QuantType.No,1,0,32,0,201.2212,moe_ck2stages_gemm2_256x32x128x128_1x4_TypeCast_v1_Nswizzle0_Quant0_MulRoutedWeight1_B16_B16_B16,5.3%,256.13,16013.59
stage2,256,64,4096,4096,32,8,ActivationType.Silu,torch.bfloat16,torch.bfloat16,torch.bfloat16,QuantType.No,1,0,32,0,199.8765,moe_ck2stages_gemm2_256x32x64x64_1x4_TypeCast_v1_Nswizzle0_Quant0_MulRoutedWeight1_B16_B16_B16,5.2%,257.86,16121.33
stage1,256,64,4096,4096,32,8,ActivationType.Silu,torch.bfloat16,torch.bfloat16,torch.bfloat16,QuantType.No,1,0,64,0,400.8845,moe_ck2stages_gemm1_256x64x64x128_1x4_TypeCast_v1_Nswizzle0_Quant0_MulRoutedWeight0_silu_B16_B16_B16,0.0%,128.56,8037.91
stage1,256,64,4096,4096,32,8,ActivationType.Silu,torch.bfloat16,torch.bfloat16,torch.bfloat16,QuantType.No,1,0,64,0,392.2598,moe_ck2stages_gemm1_256x64x64x64_1x4_TypeCast_v1_Nswizzle0_Quant0_MulRoutedWeight0_silu_B16_B16_B16,0.0%,131.39,8214.64
stage2,256,64,4096,4096,32,8,ActivationType.Silu,torch.bfloat16,torch.bfloat16,torch.bfloat16,QuantType.No,1,0,64,0,204.2312,moe_ck2stages_gemm2_256x64x128x128_1x4_TypeCast_v1_Nswizzle0_Quant0_MulRoutedWeight1_B16_B16_B16,5.3%,252.36,15777.58
stage2,256,64,4096,4096,32,8,ActivationType.Silu,torch.bfloat16,torch.bfloat16,torch.bfloat16,QuantType.No,1,0,64,0,200.1267,moe_ck2stages_gemm2_256x64x64x64_1x4_TypeCast_v1_Nswizzle0_Quant0_MulRoutedWeight1_B16_B16_B16,5.2%,257.53,16101.17
stage2,256,64,4096,4096,32,8,ActivationType.Silu,torch.bfloat16,torch.bfloat16,torch.bfloat16,QuantType.No,1,0,64,0,220.1063,moe_ck2stages_gemm2_256x64x128x64_1x4_TypeCast_v1_Nswizzle0_Quant0_MulRoutedWeight1_B16_B16_B16,5.3%,234.16,14639.63
stage1,256,64,4096,4096,32,8,ActivationType.Silu,torch.bfloat16,torch.bfloat16,torch.bfloat16,QuantType.No,1,0,128,0,402.3649,moe_ck2stages_gemm1_256x128x64x64_1x4_TypeCast_v1_Nswizzle0_Quant0_MulRoutedWeight0_silu_B16_B16_B16,0.0%,128.09,8008.34
stage1,256,64,4096,4096,32,8,ActivationType.Silu,torch.bfloat16,torch.bfloat16,torch.bfloat16,QuantType.No,1,0,128,0,412.816,moe_ck2stages_gemm1_256x128x128x64_1x4_TypeCast_v3_Nswizzle0_Quant0_MulRoutedWeight0_silu_B16_B16_B16,0.0%,124.85,7805.59
stage2,256,64,4096,4096,32,8,ActivationType.Silu,torch.bfloat16,torch.bfloat16,torch.bfloat16,QuantType.No,1,0,128,0,202.3795,moe_ck2stages_gemm2_256x128x128x64_1x4_TypeCast_v1_Nswizzle0_Quant0_MulRoutedWeight1_B16_B16_B16,5.3%,254.67,15921.94
stage2,256,64,4096,4096,32,8,ActivationType.Silu,torch.bfloat16,torch.bfloat16,torch.bfloat16,QuantType.No,1,0,128,0,198.9917,moe_ck2stages_gemm2_256x128x128x64_1x4_TypeCast_v3_Nswizzle0_Quant0_MulRoutedWeight1_B16_B16_B16,5.3%,259.0,16193.01
stage2,256,64,4096,4096,32,8,ActivationType.Silu,torch.bfloat16,torch.bfloat16,torch.bfloat16,QuantType.No,1,0,128,0,202.9835,moe_ck2stages_gemm2_256x128x64x64_1x4_TypeCast_v3_Nswizzle0_Quant0_MulRoutedWeight1_B16_B16_B16,5.3%,253.91,15874.56
stage2,256,64,4096,4096,32,8,ActivationType.Silu,torch.bfloat16,torch.bfloat16,torch.bfloat16,QuantType.No,1,0,128,0,208.6169,moe_ck2stages_gemm2_256x128x64x64_1x4_TypeCast_v1_Nswizzle0_Quant0_MulRoutedWeight1_B16_B16_B16,5.3%,247.05,15445.89
stage1,256,64,4096,4096,32,8,ActivationType.Swiglu,torch.bfloat16,torch.float4_e2m1fn_x2,torch.float4_e2m1fn_x2,QuantType.per_1x32,1,0,32,0,207.2309,flydsl_moe1_afp4_wfp4_bf16_t32x32x256_bnt0,0.0%,248.71,7775.86
stage1,256,64,4096,4096,32,8,ActivationType.Swiglu,torch.bfloat16,torch.float4_e2m1fn_x2,torch.float4_e2m1fn_x2,QuantType.per_1x32,1,0,32,0,217.0639,flydsl_moe1_afp4_wfp4_bf16_t32x32x256_bnt0_fp4,0.8%,237.44,7423.62
stage1,256,64,4096,4096,32,8,ActivationType.Swiglu,torch.bfloat16,torch.float4_e2m1fn_x2,torch.float4_e2m1fn_x2,QuantType.per_1x32,1,0,32,0,322.4053,flydsl_moe1_afp4_wfp4_bf16_t32x32x256_bnt0_xcd4,0.0%,159.86,4998.05
stage1,256,64,4096,4096,32,8,ActivationType.Swiglu,torch.bfloat16,torch.float4_e2m1fn_x2,torch.float4_e2m1fn_x2,QuantType.per_1x32,1,0,32,0,345.9142,flydsl_moe1_afp4_wfp4_bf16_t32x32x256_bnt0_xcd4_fp4,0.8%,149.0,4658.38
stage1,256,64,4096,4096,32,8,ActivationType.Swiglu,torch.bfloat16,torch.float4_e2m1fn_x2,torch.float4_e2m1fn_x2,QuantType.per_1x32,1,0,32,0,206.4248,flydsl_moe1_afp4_wfp4_bf16_t32x32x256,0.0%,249.68,7806.23
stage1,256,64,4096,4096,32,8,ActivationType.Swiglu,torch.bfloat16,torch.float4_e2m1fn_x2,torch.float4_e2m1fn_x2,QuantType.per_1x32,1,0,32,0,215.4048,flydsl_moe1_afp4_wfp4_bf16_t32x32x256_fp4,0.8%,239.27,7480.8
stage1,256,64,4096,4096,32,8,ActivationType.Swiglu,torch.bfloat16,torch.float4_e2m1fn_x2,torch.float4_e2m1fn_x2,QuantType.per_1x32,1,0,32,0,311.8204,flydsl_moe1_afp4_wfp4_bf16_t32x32x256_xcd4,0.0%,165.29,5167.72
stage1,256,64,4096,4096,32,8,ActivationType.Swiglu,torch.bfloat16,torch.float4_e2m1fn_x2,torch.float4_e2m1fn_x2,QuantType.per_1x32,1,0,32,0,338.5165,flydsl_moe1_afp4_wfp4_bf16_t32x32x256_xcd4_fp4,0.8%,152.25,4760.18
stage1,256,64,4096,4096,32,8,ActivationType.Swiglu,torch.bfloat16,torch.float4_e2m1fn_x2,torch.float4_e2m1fn_x2,QuantType.per_1x32,1,0,32,0,124.5811,flydsl_moe1_afp4_wfp4_bf16_t32x32x256_w2_bnt0,0.0%,413.7,12934.54
stage1,256,64,4096,4096,32,8,ActivationType.Swiglu,torch.bfloat16,torch.float4_e2m1fn_x2,torch.float4_e2m1fn_x2,QuantType.per_1x32,1,0,32,0,131.6444,flydsl_moe1_afp4_wfp4_bf16_t32x32x256_w2_bnt0_fp4,0.8%,391.51,12240.54
stage1,256,64,4096,4096,32,8,ActivationType.Swiglu,torch.bfloat16,torch.float4_e2m1fn_x2,torch.float4_e2m1fn_x2,QuantType.per_1x32,1,0,32,0,188.1306,flydsl_moe1_afp4_wfp4_bf16_t32x32x256_w2_bnt0_xcd4,0.0%,273.96,8565.32
stage1,256,64,4096,4096,32,8,ActivationType.Swiglu,torch.bfloat16,torch.float4_e2m1fn_x2,torch.float4_e2m1fn_x2,QuantType.per_1x32,1,0,32,0,201.8705,flydsl_moe1_afp4_wfp4_bf16_t32x32x256_w2_bnt0_xcd4_fp4,0.8%,255.31,7982.34
stage1,256,64,4096,4096,32,8,ActivationType.Swiglu,torch.bfloat16,torch.float4_e2m1fn_x2,torch.float4_e2m1fn_x2,QuantType.per_1x32,1,0,32,0,122.5006,flydsl_moe1_afp4_wfp4_bf16_t32x32x256_w2,0.0%,420.73,13154.21
stage1,256,64,4096,4096,32,8,ActivationType.Swiglu,torch.bfloat16,torch.float4_e2m1fn_x2,torch.float4_e2m1fn_x2,QuantType.per_1x32,1,0,32,0,127.9642,flydsl_moe1_afp4_wfp4_bf16_t32x32x256_w2_fp4,0.8%,402.77,12592.58
stage1,256,64,4096,4096,32,8,ActivationType.Swiglu,torch.bfloat16,torch.float4_e2m1fn_x2,torch.float4_e2m1fn_x2,QuantType.per_1x32,1,0,32,0,181.0628,flydsl_moe1_afp4_wfp4_bf16_t32x32x256_w2_xcd4,0.0%,284.65,8899.67
stage1,256,64,4096,4096,32,8,ActivationType.Swiglu,torch.bfloat16,torch.float4_e2m1fn_x2,torch.float4_e2m1fn_x2,QuantType.per_1x32,1,0,32,0,192.3337,flydsl_moe1_afp4_wfp4_bf16_t32x32x256_w2_xcd4_fp4,0.8%,267.97,8378.14
stage1,256,64,4096,4096,32,8,ActivationType.Swiglu,torch.bfloat16,torch.float4_e2m1fn_x2,torch.float4_e2m1fn_x2,QuantType.per_1x32,1,0,32,0,107.383,flydsl_moe1_afp4_wfp4_bf16_t32x32x256_w3_bnt0,0.0%,479.96,15006.09
stage1,256,64,4096,4096,32,8,ActivationType.Swiglu,torch.bfloat16,torch.float4_e2m1fn_x2,torch.float4_e2m1fn_x2,QuantType.per_1x32,1,0,32,0,111.0873,flydsl_moe1_afp4_wfp4_bf16_t32x32x256_w3_bnt0_fp4,0.8%,463.96,14505.7
stage1,256,64,4096,4096,32,8,ActivationType.Swiglu,torch.bfloat16,torch.float4_e2m1fn_x2,torch.float4_e2m1fn_x2,QuantType.per_1x32,1,0,32,0,153.6223,flydsl_moe1_afp4_wfp4_bf16_t32x32x256_w3_bnt0_xcd4,0.0%,335.5,10489.36
stage1,256,64,4096,4096,32,8,ActivationType.Swiglu,torch.bfloat16,torch.float4_e2m1fn_x2,torch.float4_e2m1fn_x2,QuantType.per_1x32,1,0,32,0,161.2885,flydsl_moe1_afp4_wfp4_bf16_t32x32x256_w3_bnt0_xcd4_fp4,0.8%,319.55,9990.79
stage1,256,64,4096,4096,32,8,ActivationType.Swiglu,torch.bfloat16,torch.float4_e2m1fn_x2,torch.float4_e2m1fn_x2,QuantType.per_1x32,1,0,32,0,104.1701,flydsl_moe1_afp4_wfp4_bf16_t32x32x256_w3,0.0%,494.76,15468.92
stage1,256,64,4096,4096,32,8,ActivationType.Swiglu,torch.bfloat16,torch.float4_e2m1fn_x2,torch.float4_e2m1fn_x2,QuantType.per_1x32,1,0,32,0,108.5876,flydsl_moe1_afp4_wfp4_bf16_t32x32x256_w3_fp4,0.8%,474.64,14839.62
stage1,256,64,4096,4096,32,8,ActivationType.Swiglu,torch.bfloat16,torch.float4_e2m1fn_x2,torch.float4_e2m1fn_x2,QuantType.per_1x32,1,0,32,0,148.4489,flydsl_moe1_afp4_wfp4_bf16_t32x32x256_w3_xcd4,0.0%,347.19,10854.91
stage1,256,64,4096,4096,32,8,ActivationType.Swiglu,torch.bfloat16,torch.float4_e2m1fn_x2,torch.float4_e2m1fn_x2,QuantType.per_1x32,1,0,32,0,155.4678,flydsl_moe1_afp4_wfp4_bf16_t32x32x256_w3_xcd4_fp4,0.8%,331.51,10364.84
stage1,256,64,4096,4096,32,8,ActivationType.Swiglu,torch.bfloat16,torch.float4_e2m1fn_x2,torch.float4_e2m1fn_x2,QuantType.per_1x32,1,0,32,0,133.9273,flydsl_moe1_afp4_wfp4_bf16_t32x32x256_w3_kb2_bnt0_fp4,100.0%,384.83,12031.89
stage1,256,64,4096,4096,32,8,ActivationType.Swiglu,torch.bfloat16,torch.float4_e2m1fn_x2,torch.float4_e2m1fn_x2,QuantType.per_1x32,1,0,32,0,195.5645,flydsl_moe1_afp4_wfp4_bf16_t32x32x256_w3_kb2_bnt0_xcd4_fp4,100.0%,263.54,8239.73
stage1,256,64,4096,4096,32,8,ActivationType.Swiglu,torch.bfloat16,torch.float4_e2m1fn_x2,torch.float4_e2m1fn_x2,QuantType.per_1x32,1,0,32,0,174.7053,flydsl_moe1_afp4_wfp4_bf16_t32x32x256_w3_kb2_bnt0_go_fp4,100.0%,295.01,9223.53
stage1,256,64,4096,4096,32,8,ActivationType.Swiglu,torch.bfloat16,torch.float4_e2m1fn_x2,torch.float4_e2m1fn_x2,QuantType.per_1x32,1,0,32,0,264.6822,flydsl_moe1_afp4_wfp4_bf16_t32x32x256_w3_kb2_bnt0_go_xcd4_fp4,100.0%,194.72,6088.05
stage1,256,64,4096,4096,32,8,ActivationType.Swiglu,torch.bfloat16,torch.float4_e2m1fn_x2,torch.float4_e2m1fn_x2,QuantType.per_1x32,1,0,32,0,130.8781,flydsl_moe1_afp4_wfp4_bf16_t32x32x256_w3_kb2_fp4,100.0%,393.8,12312.21
stage1,256,64,4096,4096,32,8,ActivationType.Swiglu,torch.bfloat16,torch.float4_e2m1fn_x2,torch.float4_e2m1fn_x2,QuantType.per_1x32,1,0,32,0,184.5168,flydsl_moe1_afp4_wfp4_bf16_t32x32x256_w3_kb2_xcd4_fp4,100.0%,279.32,8733.08
stage1,256,64,4096,4096,32,8,ActivationType.Swiglu,torch.bfloat16,torch.float4_e2m1fn_x2,torch.float4_e2m1fn_x2,QuantType.per_1x32,1,0,32,0,173.3081,flydsl_moe1_afp4_wfp4_bf16_t32x32x256_w3_kb2_go_fp4,100.0%,297.39,9297.89
stage1,256,64,4096,4096,32,8,ActivationType.Swiglu,torch.bfloat16,torch.float4_e2m1fn_x2,torch.float4_e2m1fn_x2,QuantType.per_1x32,1,0,32,0,259.2711,flydsl_moe1_afp4_wfp4_bf16_t32x32x256_w3_kb2_go_xcd4_fp4,100.0%,198.79,6215.11
stage1,256,64,4096,4096,32,8,ActivationType.Swiglu,torch.bfloat16,torch.float4_e2m1fn_x2,torch.float4_e2m1fn_x2,QuantType.per_1x32,1,0,32,0,162.6619,flydsl_moe1_afp4_wfp4_bf16_t32x32x256_w3_kb4_bnt0_fp4,100.0%,316.85,9906.43
stage1,256,64,4096,4096,32,8,ActivationType.Swiglu,torch.bfloat16,torch.float4_e2m1fn_x2,torch.float4_e2m1fn_x2,QuantType.per_1x32,1,0,32,0,243.5759,flydsl_moe1_afp4_wfp4_bf16_t32x32x256_w3_kb4_bnt0_xcd4_fp4,100.0%,211.6,6615.59
stage1,256,64,4096,4096,32,8,ActivationType.Swiglu,torch.bfloat16,torch.float4_e2m1fn_x2,torch.float4_e2m1fn_x2,QuantType.per_1x32,1,0,32,0,224.6267,flydsl_moe1_afp4_wfp4_bf16_t32x32x256_w3_kb4_bnt0_go_fp4,100.0%,229.45,7173.68
stage1,256,64,4096,4096,32,8,ActivationType.Swiglu,torch.bfloat16,torch.float4_e2m1fn_x2,torch.float4_e2m1fn_x2,QuantType.per_1x32,1,0,32,0,354.7595,flydsl_moe1_afp4_wfp4_bf16_t32x32x256_w3_kb4_bnt0_go_xcd4_fp4,100.0%,145.28,4542.23
stage1,256,64,4096,4096,32,8,ActivationType.Swiglu,torch.bfloat16,torch.float4_e2m1fn_x2,torch.float4_e2m1fn_x2,QuantType.per_1x32,1,0,32,0,157.8895,flydsl_moe1_afp4_wfp4_bf16_t32x32x256_w3_kb4_fp4,100.0%,326.43,10205.87
stage1,256,64,4096,4096,32,8,ActivationType.Swiglu,torch.bfloat16,torch.float4_e2m1fn_x2,torch.float4_e2m1fn_x2,QuantType.per_1x32,1,0,32,0,229.2811,flydsl_moe1_afp4_wfp4_bf16_t32x32x256_w3_kb4_xcd4_fp4,100.0%,224.79,7028.05
stage1,256,64,4096,4096,32,8,ActivationType.Swiglu,torch.bfloat16,torch.float4_e2m1fn_x2,torch.float4_e2m1fn_x2,QuantType.per_1x32,1,0,32,0,222.7617,flydsl_moe1_afp4_wfp4_bf16_t32x32x256_w3_kb4_go_fp4,100.0%,231.37,7233.74
stage1,256,64,4096,4096,32,8,ActivationType.Swiglu,torch.bfloat16,torch.float4_e2m1fn_x2,torch.float4_e2m1fn_x2,QuantType.per_1x32,1,0,32,0,348.9641,flydsl_moe1_afp4_wfp4_bf16_t32x32x256_w3_kb4_go_xcd4_fp4,100.0%,147.69,4617.66
stage1,256,64,4096,4096,32,8,ActivationType.Swiglu,torch.bfloat16,torch.float4_e2m1fn_x2,torch.float4_e2m1fn_x2,QuantType.per_1x32,1,0,32,0,-1.0,flydsl_moe1_afp4_wfp4_bf16_t32x32x256_w3_kb7_bnt0_fp4,100.0%,0.0,0.0
stage1,256,64,4096,4096,32,8,ActivationType.Swiglu,torch.bfloat16,torch.float4_e2m1fn_x2,torch.float4_e2m1fn_x2,QuantType.per_1x32,1,0,32,0,-1.0,flydsl_moe1_afp4_wfp4_bf16_t32x32x256_w3_kb7_bnt0_xcd4_fp4,100.0%,0.0,0.0
stage1,256,64,4096,4096,32,8,ActivationType.Swiglu,torch.bfloat16,torch.float4_e2m1fn_x2,torch.float4_e2m1fn_x2,QuantType.per_1x32,1,0,32,0,-1.0,flydsl_moe1_afp4_wfp4_bf16_t32x32x256_w3_kb7_bnt0_go_fp4,100.0%,0.0,0.0
stage1,256,64,4096,4096,32,8,ActivationType.Swiglu,torch.bfloat16,torch.float4_e2m1fn_x2,torch.float4_e2m1fn_x2,QuantType.per_1x32,1,0,32,0,-1.0,flydsl_moe1_afp4_wfp4_bf16_t32x32x256_w3_kb7_bnt0_go_xcd4_fp4,100.0%,0.0,0.0
stage1,256,64,4096,4096,32,8,ActivationType.Swiglu,torch.bfloat16,torch.float4_e2m1fn_x2,torch.float4_e2m1fn_x2,QuantType.per_1x32,1,0,32,0,-1.0,flydsl_moe1_afp4_wfp4_bf16_t32x32x256_w3_kb7_fp4,100.0%,0.0,0.0
stage1,256,64,4096,4096,32,8,ActivationType.Swiglu,torch.bfloat16,torch.float4_e2m1fn_x2,torch.float4_e2m1fn_x2,QuantType.per_1x32,1,0,32,0,-1.0,flydsl_moe1_afp4_wfp4_bf16_t32x32x256_w3_kb7_xcd4_fp4,100.0%,0.0,0.0
stage1,256,64,4096,4096,32,8,ActivationType.Swiglu,torch.bfloat16,torch.float4_e2m1fn_x2,torch.float4_e2m1fn_x2,QuantType.per_1x32,1,0,32,0,-1.0,flydsl_moe1_afp4_wfp4_bf16_t32x32x256_w3_kb7_go_fp4,100.0%,0.0,0.0
stage1,256,64,4096,4096,32,8,ActivationType.Swiglu,torch.bfloat16,torch.float4_e2m1fn_x2,torch.float4_e2m1fn_x2,QuantType.per_1x32,1,0,32,0,-1.0,flydsl_moe1_afp4_wfp4_bf16_t32x32x256_w3_kb7_go_xcd4_fp4,100.0%,0.0,0.0
stage1,256,64,4096,4096,32,8,ActivationType.Swiglu,torch.bfloat16,torch.float4_e2m1fn_x2,torch.float4_e2m1fn_x2,QuantType.per_1x32,1,0,32,0,-1.0,flydsl_moe1_afp4_wfp4_bf16_t32x32x256_w3_kb14_bnt0_fp4,100.0%,0.0,0.0
stage1,256,64,4096,4096,32,8,ActivationType.Swiglu,torch.bfloat16,torch.float4_e2m1fn_x2,torch.float4_e2m1fn_x2,QuantType.per_1x32,1,0,32,0,-1.0,flydsl_moe1_afp4_wfp4_bf16_t32x32x256_w3_kb14_bnt0_xcd4_fp4,100.0%,0.0,0.0
stage1,256,64,4096,4096,32,8,ActivationType.Swiglu,torch.bfloat16,torch.float4_e2m1fn_x2,torch.float4_e2m1fn_x2,QuantType.per_1x32,1,0,32,0,-1.0,flydsl_moe1_afp4_wfp4_bf16_t32x32x256_w3_kb14_bnt0_go_fp4,100.0%,0.0,0.0
stage1,256,64,4096,4096,32,8,ActivationType.Swiglu,torch.bfloat16,torch.float4_e2m1fn_x2,torch.float4_e2m1fn_x2,QuantType.per_1x32,1,0,32,0,-1.0,flydsl_moe1_afp4_wfp4_bf16_t32x32x256_w3_kb14_bnt0_go_xcd4_fp4,100.0%,0.0,0.0
stage1,256,64,4096,4096,32,8,ActivationType.Swiglu,torch.bfloat16,torch.float4_e2m1fn_x2,torch.float4_e2m1fn_x2,QuantType.per_1x32,1,0,32,0,-1.0,flydsl_moe1_afp4_wfp4_bf16_t32x32x256_w3_kb14_fp4,100.0%,0.0,0.0
stage1,256,64,4096,4096,32,8,ActivationType.Swiglu,torch.bfloat16,torch.float4_e2m1fn_x2,torch.float4_e2m1fn_x2,QuantType.per_1x32,1,0,32,0,-1.0,flydsl_moe1_afp4_wfp4_bf16_t32x32x256_w3_kb14_xcd4_fp4,100.0%,0.0,0.0
stage1,256,64,4096,4096,32,8,ActivationType.Swiglu,torch.bfloat16,torch.float4_e2m1fn_x2,torch.float4_e2m1fn_x2,QuantType.per_1x32,1,0,32,0,-1.0,flydsl_moe1_afp4_wfp4_bf16_t32x32x256_w3_kb14_go_fp4,100.0%,0.0,0.0
stage1,256,64,4096,4096,32,8,ActivationType.Swiglu,torch.bfloat16,torch.float4_e2m1fn_x2,torch.float4_e2m1fn_x2,QuantType.per_1x32,1,0,32,0,-1.0,flydsl_moe1_afp4_wfp4_bf16_t32x32x256_w3_kb14_go_xcd4_fp4,100.0%,0.0,0.0
stage1,256,64,4096,4096,32,8,ActivationType.Swiglu,torch.bfloat16,torch.float4_e2m1fn_x2,torch.float4_e2m1fn_x2,QuantType.per_1x32,1,0,32,0,100.0839,flydsl_moe1_afp4_wfp4_bf16_t32x32x256_w4_bnt0,0.0%,514.96,16100.48
stage1,256,64,4096,4096,32,8,ActivationType.Swiglu,torch.bfloat16,torch.float4_e2m1fn_x2,torch.float4_e2m1fn_x2,QuantType.per_1x32,1,0,32,0,102.8501,flydsl_moe1_afp4_wfp4_bf16_t32x32x256_w4_bnt0_fp4,0.8%,501.11,15667.45
stage1,256,64,4096,4096,32,8,ActivationType.Swiglu,torch.bfloat16,torch.float4_e2m1fn_x2,torch.float4_e2m1fn_x2,QuantType.per_1x32,1,0,32,0,146.8373,flydsl_moe1_afp4_wfp4_bf16_t32x32x256_w4_bnt0_xcd4,0.0%,351.0,10974.05
stage1,256,64,4096,4096,32,8,ActivationType.Swiglu,torch.bfloat16,torch.float4_e2m1fn_x2,torch.float4_e2m1fn_x2,QuantType.per_1x32,1,0,32,0,150.3877,flydsl_moe1_afp4_wfp4_bf16_t32x32x256_w4_bnt0_xcd4_fp4,0.8%,342.71,10714.97
stage1,256,64,4096,4096,32,8,ActivationType.Swiglu,torch.bfloat16,torch.float4_e2m1fn_x2,torch.float4_e2m1fn_x2,QuantType.per_1x32,1,0,32,0,95.4674,flydsl_moe1_afp4_wfp4_bf16_t32x32x256_w4,0.0%,539.87,16879.05
stage1,256,64,4096,4096,32,8,ActivationType.Swiglu,torch.bfloat16,torch.float4_e2m1fn_x2,torch.float4_e2m1fn_x2,QuantType.per_1x32,1,0,32,0,98.3069,flydsl_moe1_afp4_wfp4_bf16_t32x32x256_w4_fp4,0.8%,524.27,16391.52
stage1,256,64,4096,4096,32,8,ActivationType.Swiglu,torch.bfloat16,torch.float4_e2m1fn_x2,torch.float4_e2m1fn_x2,QuantType.per_1x32,1,0,32,0,141.6132,flydsl_moe1_afp4_wfp4_bf16_t32x32x256_w4_xcd4,0.0%,363.95,11378.88
stage1,256,64,4096,4096,32,8,ActivationType.Swiglu,torch.bfloat16,torch.float4_e2m1fn_x2,torch.float4_e2m1fn_x2,QuantType.per_1x32,1,0,32,0,147.0748,flydsl_moe1_afp4_wfp4_bf16_t32x32x256_w4_xcd4_fp4,0.8%,350.43,10956.32
stage1,256,64,4096,4096,32,8,ActivationType.Swiglu,torch.bfloat16,torch.float4_e2m1fn_x2,torch.float4_e2m1fn_x2,QuantType.per_1x32,1,0,32,0,120.5323,flydsl_moe1_afp4_wfp4_bf16_t32x64x256_bnt0,0.0%,427.6,13369.02
stage1,256,64,4096,4096,32,8,ActivationType.Swiglu,torch.bfloat16,torch.float4_e2m1fn_x2,torch.float4_e2m1fn_x2,QuantType.per_1x32,1,0,32,0,127.8693,flydsl_moe1_afp4_wfp4_bf16_t32x64x256_bnt0_fp4,0.8%,403.06,12601.92
stage1,256,64,4096,4096,32,8,ActivationType.Swiglu,torch.bfloat16,torch.float4_e2m1fn_x2,torch.float4_e2m1fn_x2,QuantType.per_1x32,1,0,32,0,181.0922,flydsl_moe1_afp4_wfp4_bf16_t32x64x256_bnt0_xcd4,0.0%,284.6,8898.23
stage1,256,64,4096,4096,32,8,ActivationType.Swiglu,torch.bfloat16,torch.float4_e2m1fn_x2,torch.float4_e2m1fn_x2,QuantType.per_1x32,1,0,32,0,199.0525,flydsl_moe1_afp4_wfp4_bf16_t32x64x256_bnt0_xcd4_fp4,0.8%,258.92,8095.35
stage1,256,64,4096,4096,32,8,ActivationType.Swiglu,torch.bfloat16,torch.float4_e2m1fn_x2,torch.float4_e2m1fn_x2,QuantType.per_1x32,1,0,32,0,118.0145,flydsl_moe1_afp4_wfp4_bf16_t32x64x256,0.0%,436.72,13654.25
stage1,256,64,4096,4096,32,8,ActivationType.Swiglu,torch.bfloat16,torch.float4_e2m1fn_x2,torch.float4_e2m1fn_x2,QuantType.per_1x32,1,0,32,0,124.7479,flydsl_moe1_afp4_wfp4_bf16_t32x64x256_fp4,0.8%,413.15,12917.24
stage1,256,64,4096,4096,32,8,ActivationType.Swiglu,torch.bfloat16,torch.float4_e2m1fn_x2,torch.float4_e2m1fn_x2,QuantType.per_1x32,1,0,32,0,173.8295,flydsl_moe1_afp4_wfp4_bf16_t32x64x256_xcd4,0.0%,296.5,9270.0
stage1,256,64,4096,4096,32,8,ActivationType.Swiglu,torch.bfloat16,torch.float4_e2m1fn_x2,torch.float4_e2m1fn_x2,QuantType.per_1x32,1,0,32,0,191.7054,flydsl_moe1_afp4_wfp4_bf16_t32x64x256_xcd4_fp4,0.8%,268.85,8405.6
stage1,256,64,4096,4096,32,8,ActivationType.Swiglu,torch.bfloat16,torch.float4_e2m1fn_x2,torch.float4_e2m1fn_x2,QuantType.per_1x32,1,0,32,0,100.6853,flydsl_moe1_afp4_wfp4_bf16_t32x64x256_w2_bnt0,0.0%,511.89,16004.31
stage1,256,64,4096,4096,32,8,ActivationType.Swiglu,torch.bfloat16,torch.float4_e2m1fn_x2,torch.float4_e2m1fn_x2,QuantType.per_1x32,1,0,32,0,104.2469,flydsl_moe1_afp4_wfp4_bf16_t32x64x256_w2_bnt0_fp4,0.8%,494.4,15457.53
stage1,256,64,4096,4096,32,8,ActivationType.Swiglu,torch.bfloat16,torch.float4_e2m1fn_x2,torch.float4_e2m1fn_x2,QuantType.per_1x32,1,0,32,0,143.3041,flydsl_moe1_afp4_wfp4_bf16_t32x64x256_w2_bnt0_xcd4,0.0%,359.65,11244.61
stage1,256,64,4096,4096,32,8,ActivationType.Swiglu,torch.bfloat16,torch.float4_e2m1fn_x2,torch.float4_e2m1fn_x2,QuantType.per_1x32,1,0,32,0,147.0394,flydsl_moe1_afp4_wfp4_bf16_t32x64x256_w2_bnt0_xcd4_fp4,0.8%,350.52,10958.96
stage1,256,64,4096,4096,32,8,ActivationType.Swiglu,torch.bfloat16,torch.float4_e2m1fn_x2,torch.float4_e2m1fn_x2,QuantType.per_1x32,1,0,32,0,95.9785,flydsl_moe1_afp4_wfp4_bf16_t32x64x256_w2,0.0%,536.99,16789.17
stage1,256,64,4096,4096,32,8,ActivationType.Swiglu,torch.bfloat16,torch.float4_e2m1fn_x2,torch.float4_e2m1fn_x2,QuantType.per_1x32,1,0,32,0,100.0394,flydsl_moe1_afp4_wfp4_bf16_t32x64x256_w2_fp4,0.8%,515.19,16107.65
stage1,256,64,4096,4096,32,8,ActivationType.Swiglu,torch.bfloat16,torch.float4_e2m1fn_x2,torch.float4_e2m1fn_x2,QuantType.per_1x32,1,0,32,0,138.9839,flydsl_moe1_afp4_wfp4_bf16_t32x64x256_w2_xcd4,0.0%,370.83,11594.14
stage1,256,64,4096,4096,32,8,ActivationType.Swiglu,torch.bfloat16,torch.float4_e2m1fn_x2,torch.float4_e2m1fn_x2,QuantType.per_1x32,1,0,32,0,143.1787,flydsl_moe1_afp4_wfp4_bf16_t32x64x256_w2_xcd4_fp4,0.8%,359.97,11254.46
stage1,256,64,4096,4096,32,8,ActivationType.Swiglu,torch.bfloat16,torch.float4_e2m1fn_x2,torch.float4_e2m1fn_x2,QuantType.per_1x32,1,0,32,0,101.8607,flydsl_moe1_afp4_wfp4_bf16_t32x64x256_w3_bnt0,0.0%,505.98,15819.64
stage1,256,64,4096,4096,32,8,ActivationType.Swiglu,torch.bfloat16,torch.float4_e2m1fn_x2,torch.float4_e2m1fn_x2,QuantType.per_1x32,1,0,32,0,105.5211,flydsl_moe1_afp4_wfp4_bf16_t32x64x256_w3_bnt0_fp4,0.8%,488.43,15270.87
stage1,256,64,4096,4096,32,8,ActivationType.Swiglu,torch.bfloat16,torch.float4_e2m1fn_x2,torch.float4_e2m1fn_x2,QuantType.per_1x32,1,0,32,0,138.0526,flydsl_moe1_afp4_wfp4_bf16_t32x64x256_w3_bnt0_xcd4,0.0%,373.33,11672.36
stage1,256,64,4096,4096,32,8,ActivationType.Swiglu,torch.bfloat16,torch.float4_e2m1fn_x2,torch.float4_e2m1fn_x2,QuantType.per_1x32,1,0,32,0,141.1874,flydsl_moe1_afp4_wfp4_bf16_t32x64x256_w3_bnt0_xcd4_fp4,0.8%,365.04,11413.19
stage1,256,64,4096,4096,32,8,ActivationType.Swiglu,torch.bfloat16,torch.float4_e2m1fn_x2,torch.float4_e2m1fn_x2,QuantType.per_1x32,1,0,32,0,96.8138,flydsl_moe1_afp4_wfp4_bf16_t32x64x256_w3,0.0%,532.36,16644.31
stage1,256,64,4096,4096,32,8,ActivationType.Swiglu,torch.bfloat16,torch.float4_e2m1fn_x2,torch.float4_e2m1fn_x2,QuantType.per_1x32,1,0,32,0,99.9127,flydsl_moe1_afp4_wfp4_bf16_t32x64x256_w3_fp4,0.8%,515.85,16128.07
stage1,256,64,4096,4096,32,8,ActivationType.Swiglu,torch.bfloat16,torch.float4_e2m1fn_x2,torch.float4_e2m1fn_x2,QuantType.per_1x32,1,0,32,0,134.7534,flydsl_moe1_afp4_wfp4_bf16_t32x64x256_w3_xcd4,0.0%,382.47,11958.13
stage1,256,64,4096,4096,32,8,ActivationType.Swiglu,torch.bfloat16,torch.float4_e2m1fn_x2,torch.float4_e2m1fn_x2,QuantType.per_1x32,1,0,32,0,135.9481,flydsl_moe1_afp4_wfp4_bf16_t32x64x256_w3_xcd4_fp4,0.8%,379.11,11853.05
stage1,256,64,4096,4096,32,8,ActivationType.Swiglu,torch.bfloat16,torch.float4_e2m1fn_x2,torch.float4_e2m1fn_x2,QuantType.per_1x32,1,0,32,0,117.7424,flydsl_moe1_afp4_wfp4_bf16_t32x64x256_w3_kb2_bnt0_fp4,100.0%,437.73,13685.8
stage1,256,64,4096,4096,32,8,ActivationType.Swiglu,torch.bfloat16,torch.float4_e2m1fn_x2,torch.float4_e2m1fn_x2,QuantType.per_1x32,1,0,32,0,162.4449,flydsl_moe1_afp4_wfp4_bf16_t32x64x256_w3_kb2_bnt0_xcd4_fp4,100.0%,317.27,9919.67
stage1,256,64,4096,4096,32,8,ActivationType.Swiglu,torch.bfloat16,torch.float4_e2m1fn_x2,torch.float4_e2m1fn_x2,QuantType.per_1x32,1,0,32,0,120.9793,flydsl_moe1_afp4_wfp4_bf16_t32x64x256_w3_kb2_bnt0_go_fp4,100.0%,426.02,13319.63
stage1,256,64,4096,4096,32,8,ActivationType.Swiglu,torch.bfloat16,torch.float4_e2m1fn_x2,torch.float4_e2m1fn_x2,QuantType.per_1x32,1,0,32,0,167.4342,flydsl_moe1_afp4_wfp4_bf16_t32x64x256_w3_kb2_bnt0_go_xcd4_fp4,100.0%,307.82,9624.07
stage1,256,64,4096,4096,32,8,ActivationType.Swiglu,torch.bfloat16,torch.float4_e2m1fn_x2,torch.float4_e2m1fn_x2,QuantType.per_1x32,1,0,32,0,110.9193,flydsl_moe1_afp4_wfp4_bf16_t32x64x256_w3_kb2_fp4,100.0%,464.66,14527.67
stage1,256,64,4096,4096,32,8,ActivationType.Swiglu,torch.bfloat16,torch.float4_e2m1fn_x2,torch.float4_e2m1fn_x2,QuantType.per_1x32,1,0,32,0,153.6505,flydsl_moe1_afp4_wfp4_bf16_t32x64x256_w3_kb2_xcd4_fp4,100.0%,335.43,10487.43
stage1,256,64,4096,4096,32,8,ActivationType.Swiglu,torch.bfloat16,torch.float4_e2m1fn_x2,torch.float4_e2m1fn_x2,QuantType.per_1x32,1,0,32,0,117.2299,flydsl_moe1_afp4_wfp4_bf16_t32x64x256_w3_kb2_go_fp4,100.0%,439.65,13745.63
stage1,256,64,4096,4096,32,8,ActivationType.Swiglu,torch.bfloat16,torch.float4_e2m1fn_x2,torch.float4_e2m1fn_x2,QuantType.per_1x32,1,0,32,0,160.8213,flydsl_moe1_afp4_wfp4_bf16_t32x64x256_w3_kb2_go_xcd4_fp4,100.0%,320.48,10019.81
stage1,256,64,4096,4096,32,8,ActivationType.Swiglu,torch.bfloat16,torch.float4_e2m1fn_x2,torch.float4_e2m1fn_x2,QuantType.per_1x32,1,0,32,0,125.5048,flydsl_moe1_afp4_wfp4_bf16_t32x64x256_w3_kb4_bnt0_fp4,100.0%,410.66,12839.34
stage1,256,64,4096,4096,32,8,ActivationType.Swiglu,torch.bfloat16,torch.float4_e2m1fn_x2,torch.float4_e2m1fn_x2,QuantType.per_1x32,1,0,32,0,180.2147,flydsl_moe1_afp4_wfp4_bf16_t32x64x256_w3_kb4_bnt0_xcd4_fp4,100.0%,285.99,8941.55
stage1,256,64,4096,4096,32,8,ActivationType.Swiglu,torch.bfloat16,torch.float4_e2m1fn_x2,torch.float4_e2m1fn_x2,QuantType.per_1x32,1,0,32,0,146.0099,flydsl_moe1_afp4_wfp4_bf16_t32x64x256_w3_kb4_bnt0_go_fp4,100.0%,352.99,11036.23
stage1,256,64,4096,4096,32,8,ActivationType.Swiglu,torch.bfloat16,torch.float4_e2m1fn_x2,torch.float4_e2m1fn_x2,QuantType.per_1x32,1,0,32,0,206.7794,flydsl_moe1_afp4_wfp4_bf16_t32x64x256_w3_kb4_bnt0_go_xcd4_fp4,100.0%,249.25,7792.84
stage1,256,64,4096,4096,32,8,ActivationType.Swiglu,torch.bfloat16,torch.float4_e2m1fn_x2,torch.float4_e2m1fn_x2,QuantType.per_1x32,1,0,32,0,119.4736,flydsl_moe1_afp4_wfp4_bf16_t32x64x256_w3_kb4_fp4,100.0%,431.39,13487.49
stage1,256,64,4096,4096,32,8,ActivationType.Swiglu,torch.bfloat16,torch.float4_e2m1fn_x2,torch.float4_e2m1fn_x2,QuantType.per_1x32,1,0,32,0,171.057,flydsl_moe1_afp4_wfp4_bf16_t32x64x256_w3_kb4_xcd4_fp4,100.0%,301.3,9420.25
stage1,256,64,4096,4096,32,8,ActivationType.Swiglu,torch.bfloat16,torch.float4_e2m1fn_x2,torch.float4_e2m1fn_x2,QuantType.per_1x32,1,0,32,0,141.018,flydsl_moe1_afp4_wfp4_bf16_t32x64x256_w3_kb4_go_fp4,100.0%,365.48,11426.9
stage1,256,64,4096,4096,32,8,ActivationType.Swiglu,torch.bfloat16,torch.float4_e2m1fn_x2,torch.float4_e2m1fn_x2,QuantType.per_1x32,1,0,32,0,199.3995,flydsl_moe1_afp4_wfp4_bf16_t32x64x256_w3_kb4_go_xcd4_fp4,100.0%,258.47,8081.26
stage1,256,64,4096,4096,32,8,ActivationType.Swiglu,torch.bfloat16,torch.float4_e2m1fn_x2,torch.float4_e2m1fn_x2,QuantType.per_1x32,1,0,32,0,-1.0,flydsl_moe1_afp4_wfp4_bf16_t32x64x256_w3_kb7_bnt0_fp4,100.0%,0.0,0.0
stage1,256,64,4096,4096,32,8,ActivationType.Swiglu,torch.bfloat16,torch.float4_e2m1fn_x2,torch.float4_e2m1fn_x2,QuantType.per_1x32,1,0,32,0,-1.0,flydsl_moe1_afp4_wfp4_bf16_t32x64x256_w3_kb7_bnt0_xcd4_fp4,100.0%,0.0,0.0
stage1,256,64,4096,4096,32,8,ActivationType.Swiglu,torch.bfloat16,torch.float4_e2m1fn_x2,torch.float4_e2m1fn_x2,QuantType.per_1x32,1,0,32,0,-1.0,flydsl_moe1_afp4_wfp4_bf16_t32x64x256_w3_kb7_bnt0_go_fp4,100.0%,0.0,0.0
stage1,256,64,4096,4096,32,8,ActivationType.Swiglu,torch.bfloat16,torch.float4_e2m1fn_x2,torch.float4_e2m1fn_x2,QuantType.per_1x32,1,0,32,0,-1.0,flydsl_moe1_afp4_wfp4_bf16_t32x64x256_w3_kb7_bnt0_go_xcd4_fp4,100.0%,0.0,0.0
stage1,256,64,4096,4096,32,8,ActivationType.Swiglu,torch.bfloat16,torch.float4_e2m1fn_x2,torch.float4_e2m1fn_x2,QuantType.per_1x32,1,0,32,0,-1.0,flydsl_moe1_afp4_wfp4_bf16_t32x64x256_w3_kb7_fp4,100.0%,0.0,0.0
stage1,256,64,4096,4096,32,8,ActivationType.Swiglu,torch.bfloat16,torch.float4_e2m1fn_x2,torch.float4_e2m1fn_x2,QuantType.per_1x32,1,0,32,0,-1.0,flydsl_moe1_afp4_wfp4_bf16_t32x64x256_w3_kb7_xcd4_fp4,100.0%,0.0,0.0
stage1,256,64,4096,4096,32,8,ActivationType.Swiglu,torch.bfloat16,torch.float4_e2m1fn_x2,torch.float4_e2m1fn_x2,QuantType.per_1x32,1,0,32,0,-1.0,flydsl_moe1_afp4_wfp4_bf16_t32x64x256_w3_kb7_go_fp4,100.0%,0.0,0.0
stage1,256,64,4096,4096,32,8,ActivationType.Swiglu,torch.bfloat16,torch.float4_e2m1fn_x2,torch.float4_e2m1fn_x2,QuantType.per_1x32,1,0,32,0,-1.0,flydsl_moe1_afp4_wfp4_bf16_t32x64x256_w3_kb7_go_xcd4_fp4,100.0%,0.0,0.0
stage1,256,64,4096,4096,32,8,ActivationType.Swiglu,torch.bfloat16,torch.float4_e2m1fn_x2,torch.float4_e2m1fn_x2,QuantType.per_1x32,1,0,32,0,-1.0,flydsl_moe1_afp4_wfp4_bf16_t32x64x256_w3_kb14_bnt0_fp4,100.0%,0.0,0.0
stage1,256,64,4096,4096,32,8,ActivationType.Swiglu,torch.bfloat16,torch.float4_e2m1fn_x2,torch.float4_e2m1fn_x2,QuantType.per_1x32,1,0,32,0,-1.0,flydsl_moe1_afp4_wfp4_bf16_t32x64x256_w3_kb14_bnt0_xcd4_fp4,100.0%,0.0,0.0
stage1,256,64,4096,4096,32,8,ActivationType.Swiglu,torch.bfloat16,torch.float4_e2m1fn_x2,torch.float4_e2m1fn_x2,QuantType.per_1x32,1,0,32,0,-1.0,flydsl_moe1_afp4_wfp4_bf16_t32x64x256_w3_kb14_bnt0_go_fp4,100.0%,0.0,0.0
stage1,256,64,4096,4096,32,8,ActivationType.Swiglu,torch.bfloat16,torch.float4_e2m1fn_x2,torch.float4_e2m1fn_x2,QuantType.per_1x32,1,0,32,0,-1.0,flydsl_moe1_afp4_wfp4_bf16_t32x64x256_w3_kb14_bnt0_go_xcd4_fp4,100.0%,0.0,0.0
stage1,256,64,4096,4096,32,8,ActivationType.Swiglu,torch.bfloat16,torch.float4_e2m1fn_x2,torch.float4_e2m1fn_x2,QuantType.per_1x32,1,0,32,0,-1.0,flydsl_moe1_afp4_wfp4_bf16_t32x64x256_w3_kb14_fp4,100.0%,0.0,0.0
stage1,256,64,4096,4096,32,8,ActivationType.Swiglu,torch.bfloat16,torch.float4_e2m1fn_x2,torch.float4_e2m1fn_x2,QuantType.per_1x32,1,0,32,0,-1.0,flydsl_moe1_afp4_wfp4_bf16_t32x64x256_w3_kb14_xcd4_fp4,100.0%,0.0,0.0
stage1,256,64,4096,4096,32,8,ActivationType.Swiglu,torch.bfloat16,torch.float4_e2m1fn_x2,torch.float4_e2m1fn_x2,QuantType.per_1x32,1,0,32,0,-1.0,flydsl_moe1_afp4_wfp4_bf16_t32x64x256_w3_kb14_go_fp4,100.0%,0.0,0.0
stage1,256,64,4096,4096,32,8,ActivationType.Swiglu,torch.bfloat16,torch.float4_e2m1fn_x2,torch.float4_e2m1fn_x2,QuantType.per_1x32,1,0,32,0,-1.0,flydsl_moe1_afp4_wfp4_bf16_t32x64x256_w3_kb14_go_xcd4_fp4,100.0%,0.0,0.0
stage1,256,64,4096,4096,32,8,ActivationType.Swiglu,torch.bfloat16,torch.float4_e2m1fn_x2,torch.float4_e2m1fn_x2,QuantType.per_1x32,1,0,32,0,101.9054,flydsl_moe1_afp4_wfp4_bf16_t32x64x256_w4_bnt0,0.0%,505.76,15812.7
stage1,256,64,4096,4096,32,8,ActivationType.Swiglu,torch.bfloat16,torch.float4_e2m1fn_x2,torch.float4_e2m1fn_x2,QuantType.per_1x32,1,0,32,0,103.7745,flydsl_moe1_afp4_wfp4_bf16_t32x64x256_w4_bnt0_fp4,0.8%,496.65,15527.89
stage1,256,64,4096,4096,32,8,ActivationType.Swiglu,torch.bfloat16,torch.float4_e2m1fn_x2,torch.float4_e2m1fn_x2,QuantType.per_1x32,1,0,32,0,135.3512,flydsl_moe1_afp4_wfp4_bf16_t32x64x256_w4_bnt0_xcd4,0.0%,380.78,11905.32
stage1,256,64,4096,4096,32,8,ActivationType.Swiglu,torch.bfloat16,torch.float4_e2m1fn_x2,torch.float4_e2m1fn_x2,QuantType.per_1x32,1,0,32,0,134.6259,flydsl_moe1_afp4_wfp4_bf16_t32x64x256_w4_bnt0_xcd4_fp4,0.8%,382.84,11969.46
stage1,256,64,4096,4096,32,8,ActivationType.Swiglu,torch.bfloat16,torch.float4_e2m1fn_x2,torch.float4_e2m1fn_x2,QuantType.per_1x32,1,0,32,0,95.4419,flydsl_moe1_afp4_wfp4_bf16_t32x64x256_w4,0.0%,540.01,16883.56
stage1,256,64,4096,4096,32,8,ActivationType.Swiglu,torch.bfloat16,torch.float4_e2m1fn_x2,torch.float4_e2m1fn_x2,QuantType.per_1x32,1,0,32,0,98.613,flydsl_moe1_afp4_wfp4_bf16_t32x64x256_w4_fp4,0.8%,522.65,16340.64
stage1,256,64,4096,4096,32,8,ActivationType.Swiglu,torch.bfloat16,torch.float4_e2m1fn_x2,torch.float4_e2m1fn_x2,QuantType.per_1x32,1,0,32,0,130.8863,flydsl_moe1_afp4_wfp4_bf16_t32x64x256_w4_xcd4,0.0%,393.77,12311.44
stage1,256,64,4096,4096,32,8,ActivationType.Swiglu,torch.bfloat16,torch.float4_e2m1fn_x2,torch.float4_e2m1fn_x2,QuantType.per_1x32,1,0,32,0,131.83,flydsl_moe1_afp4_wfp4_bf16_t32x64x256_w4_xcd4_fp4,0.8%,390.96,12223.31
stage1,256,64,4096,4096,32,8,ActivationType.Swiglu,torch.bfloat16,torch.float4_e2m1fn_x2,torch.float4_e2m1fn_x2,QuantType.per_1x32,1,0,32,0,113.7674,flydsl_moe1_afp4_wfp4_bf16_t32x128x256_bnt0,0.0%,453.03,14163.98
stage1,256,64,4096,4096,32,8,ActivationType.Swiglu,torch.bfloat16,torch.float4_e2m1fn_x2,torch.float4_e2m1fn_x2,QuantType.per_1x32,1,0,32,0,114.5676,flydsl_moe1_afp4_wfp4_bf16_t32x128x256_bnt0_fp4,0.8%,449.86,14065.05
stage1,256,64,4096,4096,32,8,ActivationType.Swiglu,torch.bfloat16,torch.float4_e2m1fn_x2,torch.float4_e2m1fn_x2,QuantType.per_1x32,1,0,32,0,145.3667,flydsl_moe1_afp4_wfp4_bf16_t32x128x256_bnt0_xcd4,0.0%,354.55,11085.06
stage1,256,64,4096,4096,32,8,ActivationType.Swiglu,torch.bfloat16,torch.float4_e2m1fn_x2,torch.float4_e2m1fn_x2,QuantType.per_1x32,1,0,32,0,150.0753,flydsl_moe1_afp4_wfp4_bf16_t32x128x256_bnt0_xcd4_fp4,0.8%,343.42,10737.27
stage1,256,64,4096,4096,32,8,ActivationType.Swiglu,torch.bfloat16,torch.float4_e2m1fn_x2,torch.float4_e2m1fn_x2,QuantType.per_1x32,1,0,32,0,107.6246,flydsl_moe1_afp4_wfp4_bf16_t32x128x256,0.0%,478.88,14972.41
stage1,256,64,4096,4096,32,8,ActivationType.Swiglu,torch.bfloat16,torch.float4_e2m1fn_x2,torch.float4_e2m1fn_x2,QuantType.per_1x32,1,0,32,0,108.9607,flydsl_moe1_afp4_wfp4_bf16_t32x128x256_fp4,0.8%,473.01,14788.81
stage1,256,64,4096,4096,32,8,ActivationType.Swiglu,torch.bfloat16,torch.float4_e2m1fn_x2,torch.float4_e2m1fn_x2,QuantType.per_1x32,1,0,32,0,139.7679,flydsl_moe1_afp4_wfp4_bf16_t32x128x256_xcd4,0.0%,368.75,11529.11
stage1,256,64,4096,4096,32,8,ActivationType.Swiglu,torch.bfloat16,torch.float4_e2m1fn_x2,torch.float4_e2m1fn_x2,QuantType.per_1x32,1,0,32,0,144.1633,flydsl_moe1_afp4_wfp4_bf16_t32x128x256_xcd4_fp4,0.8%,357.51,11177.6
stage1,256,64,4096,4096,32,8,ActivationType.Swiglu,torch.bfloat16,torch.float4_e2m1fn_x2,torch.float4_e2m1fn_x2,QuantType.per_1x32,1,0,32,0,109.4278,flydsl_moe1_afp4_wfp4_bf16_t32x128x256_w2_bnt0,0.0%,470.99,14725.68
stage1,256,64,4096,4096,32,8,ActivationType.Swiglu,torch.bfloat16,torch.float4_e2m1fn_x2,torch.float4_e2m1fn_x2,QuantType.per_1x32,1,0,32,0,111.3266,flydsl_moe1_afp4_wfp4_bf16_t32x128x256_w2_bnt0_fp4,0.8%,462.96,14474.52
stage1,256,64,4096,4096,32,8,ActivationType.Swiglu,torch.bfloat16,torch.float4_e2m1fn_x2,torch.float4_e2m1fn_x2,QuantType.per_1x32,1,0,32,0,131.9584,flydsl_moe1_afp4_wfp4_bf16_t32x128x256_w2_bnt0_xcd4,0.0%,390.57,12211.42
stage1,256,64,4096,4096,32,8,ActivationType.Swiglu,torch.bfloat16,torch.float4_e2m1fn_x2,torch.float4_e2m1fn_x2,QuantType.per_1x32,1,0,32,0,132.2891,flydsl_moe1_afp4_wfp4_bf16_t32x128x256_w2_bnt0_xcd4_fp4,0.8%,389.6,12180.89
stage1,256,64,4096,4096,32,8,ActivationType.Swiglu,torch.bfloat16,torch.float4_e2m1fn_x2,torch.float4_e2m1fn_x2,QuantType.per_1x32,1,0,32,0,105.0896,flydsl_moe1_afp4_wfp4_bf16_t32x128x256_w2,0.0%,490.43,15333.57
stage1,256,64,4096,4096,32,8,ActivationType.Swiglu,torch.bfloat16,torch.float4_e2m1fn_x2,torch.float4_e2m1fn_x2,QuantType.per_1x32,1,0,32,0,104.1036,flydsl_moe1_afp4_wfp4_bf16_t32x128x256_w2_fp4,0.8%,495.08,15478.8
stage1,256,64,4096,4096,32,8,ActivationType.Swiglu,torch.bfloat16,torch.float4_e2m1fn_x2,torch.float4_e2m1fn_x2,QuantType.per_1x32,1,0,32,0,128.3905,flydsl_moe1_afp4_wfp4_bf16_t32x128x256_w2_xcd4,0.0%,401.43,12550.77
stage1,256,64,4096,4096,32,8,ActivationType.Swiglu,torch.bfloat16,torch.float4_e2m1fn_x2,torch.float4_e2m1fn_x2,QuantType.per_1x32,1,0,32,0,127.3952,flydsl_moe1_afp4_wfp4_bf16_t32x128x256_w2_xcd4_fp4,0.8%,404.56,12648.82
stage1,256,64,4096,4096,32,8,ActivationType.Swiglu,torch.bfloat16,torch.float4_e2m1fn_x2,torch.float4_e2m1fn_x2,QuantType.per_1x32,1,0,32,0,109.2634,flydsl_moe1_afp4_wfp4_bf16_t32x128x256_w3_bnt0,0.0%,471.7,14747.84
stage1,256,64,4096,4096,32,8,ActivationType.Swiglu,torch.bfloat16,torch.float4_e2m1fn_x2,torch.float4_e2m1fn_x2,QuantType.per_1x32,1,0,32,0,109.5847,flydsl_moe1_afp4_wfp4_bf16_t32x128x256_w3_bnt0_fp4,0.8%,470.32,14704.6
stage1,256,64,4096,4096,32,8,ActivationType.Swiglu,torch.bfloat16,torch.float4_e2m1fn_x2,torch.float4_e2m1fn_x2,QuantType.per_1x32,1,0,32,0,128.9755,flydsl_moe1_afp4_wfp4_bf16_t32x128x256_w3_bnt0_xcd4,0.0%,399.61,12493.84
stage1,256,64,4096,4096,32,8,ActivationType.Swiglu,torch.bfloat16,torch.float4_e2m1fn_x2,torch.float4_e2m1fn_x2,QuantType.per_1x32,1,0,32,0,128.2109,flydsl_moe1_afp4_wfp4_bf16_t32x128x256_w3_bnt0_xcd4_fp4,0.8%,401.99,12568.35
stage1,256,64,4096,4096,32,8,ActivationType.Swiglu,torch.bfloat16,torch.float4_e2m1fn_x2,torch.float4_e2m1fn_x2,QuantType.per_1x32,1,0,32,0,104.0952,flydsl_moe1_afp4_wfp4_bf16_t32x128x256_w3,0.0%,495.12,15480.05
stage1,256,64,4096,4096,32,8,ActivationType.Swiglu,torch.bfloat16,torch.float4_e2m1fn_x2,torch.float4_e2m1fn_x2,QuantType.per_1x32,1,0,32,0,104.9221,flydsl_moe1_afp4_wfp4_bf16_t32x128x256_w3_fp4,0.8%,491.22,15358.05
stage1,256,64,4096,4096,32,8,ActivationType.Swiglu,torch.bfloat16,torch.float4_e2m1fn_x2,torch.float4_e2m1fn_x2,QuantType.per_1x32,1,0,32,0,124.3643,flydsl_moe1_afp4_wfp4_bf16_t32x128x256_w3_xcd4,0.0%,414.42,12957.09
stage1,256,64,4096,4096,32,8,ActivationType.Swiglu,torch.bfloat16,torch.float4_e2m1fn_x2,torch.float4_e2m1fn_x2,QuantType.per_1x32,1,0,32,0,125.4706,flydsl_moe1_afp4_wfp4_bf16_t32x128x256_w3_xcd4_fp4,0.8%,410.77,12842.84
stage1,256,64,4096,4096,32,8,ActivationType.Swiglu,torch.bfloat16,torch.float4_e2m1fn_x2,torch.float4_e2m1fn_x2,QuantType.per_1x32,1,0,32,0,126.2401,flydsl_moe1_afp4_wfp4_bf16_t32x128x256_w3_kb2_bnt0_fp4,100.0%,408.27,12764.56
stage1,256,64,4096,4096,32,8,ActivationType.Swiglu,torch.bfloat16,torch.float4_e2m1fn_x2,torch.float4_e2m1fn_x2,QuantType.per_1x32,1,0,32,0,150.9817,flydsl_moe1_afp4_wfp4_bf16_t32x128x256_w3_kb2_bnt0_xcd4_fp4,100.0%,341.36,10672.81
stage1,256,64,4096,4096,32,8,ActivationType.Swiglu,torch.bfloat16,torch.float4_e2m1fn_x2,torch.float4_e2m1fn_x2,QuantType.per_1x32,1,0,32,0,124.1568,flydsl_moe1_afp4_wfp4_bf16_t32x128x256_w3_kb2_bnt0_go_fp4,67.7%,415.12,12978.74
stage1,256,64,4096,4096,32,8,ActivationType.Swiglu,torch.bfloat16,torch.float4_e2m1fn_x2,torch.float4_e2m1fn_x2,QuantType.per_1x32,1,0,32,0,145.3672,flydsl_moe1_afp4_wfp4_bf16_t32x128x256_w3_kb2_bnt0_go_xcd4_fp4,71.5%,354.55,11085.03
stage1,256,64,4096,4096,32,8,ActivationType.Swiglu,torch.bfloat16,torch.float4_e2m1fn_x2,torch.float4_e2m1fn_x2,QuantType.per_1x32,1,0,32,0,119.2477,flydsl_moe1_afp4_wfp4_bf16_t32x128x256_w3_kb2_fp4,100.0%,432.21,13513.04
stage1,256,64,4096,4096,32,8,ActivationType.Swiglu,torch.bfloat16,torch.float4_e2m1fn_x2,torch.float4_e2m1fn_x2,QuantType.per_1x32,1,0,32,0,144.8309,flydsl_moe1_afp4_wfp4_bf16_t32x128x256_w3_kb2_xcd4_fp4,100.0%,355.86,11126.07
stage1,256,64,4096,4096,32,8,ActivationType.Swiglu,torch.bfloat16,torch.float4_e2m1fn_x2,torch.float4_e2m1fn_x2,QuantType.per_1x32,1,0,32,0,119.3361,flydsl_moe1_afp4_wfp4_bf16_t32x128x256_w3_kb2_go_fp4,62.7%,431.89,13503.03
stage1,256,64,4096,4096,32,8,ActivationType.Swiglu,torch.bfloat16,torch.float4_e2m1fn_x2,torch.float4_e2m1fn_x2,QuantType.per_1x32,1,0,32,0,140.6122,flydsl_moe1_afp4_wfp4_bf16_t32x128x256_w3_kb2_go_xcd4_fp4,71.6%,366.54,11459.88
stage1,256,64,4096,4096,32,8,ActivationType.Swiglu,torch.bfloat16,torch.float4_e2m1fn_x2,torch.float4_e2m1fn_x2,QuantType.per_1x32,1,0,32,0,132.3471,flydsl_moe1_afp4_wfp4_bf16_t32x128x256_w3_kb4_bnt0_fp4,100.0%,389.43,12175.55
stage1,256,64,4096,4096,32,8,ActivationType.Swiglu,torch.bfloat16,torch.float4_e2m1fn_x2,torch.float4_e2m1fn_x2,QuantType.per_1x32,1,0,32,0,149.9698,flydsl_moe1_afp4_wfp4_bf16_t32x128x256_w3_kb4_bnt0_xcd4_fp4,100.0%,343.67,10744.82
stage1,256,64,4096,4096,32,8,ActivationType.Swiglu,torch.bfloat16,torch.float4_e2m1fn_x2,torch.float4_e2m1fn_x2,QuantType.per_1x32,1,0,32,0,135.0153,flydsl_moe1_afp4_wfp4_bf16_t32x128x256_w3_kb4_bnt0_go_fp4,75.8%,381.73,11934.94
stage1,256,64,4096,4096,32,8,ActivationType.Swiglu,torch.bfloat16,torch.float4_e2m1fn_x2,torch.float4_e2m1fn_x2,QuantType.per_1x32,1,0,32,0,150.665,flydsl_moe1_afp4_wfp4_bf16_t32x128x256_w3_kb4_bnt0_go_xcd4_fp4,74.6%,342.08,10695.25
stage1,256,64,4096,4096,32,8,ActivationType.Swiglu,torch.bfloat16,torch.float4_e2m1fn_x2,torch.float4_e2m1fn_x2,QuantType.per_1x32,1,0,32,0,124.9963,flydsl_moe1_afp4_wfp4_bf16_t32x128x256_w3_kb4_fp4,100.0%,412.33,12891.57
stage1,256,64,4096,4096,32,8,ActivationType.Swiglu,torch.bfloat16,torch.float4_e2m1fn_x2,torch.float4_e2m1fn_x2,QuantType.per_1x32,1,0,32,0,144.7439,flydsl_moe1_afp4_wfp4_bf16_t32x128x256_w3_kb4_xcd4_fp4,100.0%,356.07,11132.76
stage1,256,64,4096,4096,32,8,ActivationType.Swiglu,torch.bfloat16,torch.float4_e2m1fn_x2,torch.float4_e2m1fn_x2,QuantType.per_1x32,1,0,32,0,128.4023,flydsl_moe1_afp4_wfp4_bf16_t32x128x256_w3_kb4_go_fp4,74.9%,401.39,12549.61
stage1,256,64,4096,4096,32,8,ActivationType.Swiglu,torch.bfloat16,torch.float4_e2m1fn_x2,torch.float4_e2m1fn_x2,QuantType.per_1x32,1,0,32,0,146.9856,flydsl_moe1_afp4_wfp4_bf16_t32x128x256_w3_kb4_go_xcd4_fp4,74.1%,350.64,10962.97
stage1,256,64,4096,4096,32,8,ActivationType.Swiglu,torch.bfloat16,torch.float4_e2m1fn_x2,torch.float4_e2m1fn_x2,QuantType.per_1x32,1,0,32,0,-1.0,flydsl_moe1_afp4_wfp4_bf16_t32x128x256_w3_kb7_bnt0_fp4,100.0%,0.0,0.0
stage1,256,64,4096,4096,32,8,ActivationType.Swiglu,torch.bfloat16,torch.float4_e2m1fn_x2,torch.float4_e2m1fn_x2,QuantType.per_1x32,1,0,32,0,-1.0,flydsl_moe1_afp4_wfp4_bf16_t32x128x256_w3_kb7_bnt0_xcd4_fp4,100.0%,0.0,0.0
stage1,256,64,4096,4096,32,8,ActivationType.Swiglu,torch.bfloat16,torch.float4_e2m1fn_x2,torch.float4_e2m1fn_x2,QuantType.per_1x32,1,0,32,0,-1.0,flydsl_moe1_afp4_wfp4_bf16_t32x128x256_w3_kb7_bnt0_go_fp4,100.0%,0.0,0.0
stage1,256,64,4096,4096,32,8,ActivationType.Swiglu,torch.bfloat16,torch.float4_e2m1fn_x2,torch.float4_e2m1fn_x2,QuantType.per_1x32,1,0,32,0,-1.0,flydsl_moe1_afp4_wfp4_bf16_t32x128x256_w3_kb7_bnt0_go_xcd4_fp4,100.0%,0.0,0.0
stage1,256,64,4096,4096,32,8,ActivationType.Swiglu,torch.bfloat16,torch.float4_e2m1fn_x2,torch.float4_e2m1fn_x2,QuantType.per_1x32,1,0,32,0,-1.0,flydsl_moe1_afp4_wfp4_bf16_t32x128x256_w3_kb7_fp4,100.0%,0.0,0.0
stage1,256,64,4096,4096,32,8,ActivationType.Swiglu,torch.bfloat16,torch.float4_e2m1fn_x2,torch.float4_e2m1fn_x2,QuantType.per_1x32,1,0,32,0,-1.0,flydsl_moe1_afp4_wfp4_bf16_t32x128x256_w3_kb7_xcd4_fp4,100.0%,0.0,0.0
stage1,256,64,4096,4096,32,8,ActivationType.Swiglu,torch.bfloat16,torch.float4_e2m1fn_x2,torch.float4_e2m1fn_x2,QuantType.per_1x32,1,0,32,0,-1.0,flydsl_moe1_afp4_wfp4_bf16_t32x128x256_w3_kb7_go_fp4,100.0%,0.0,0.0
stage1,256,64,4096,4096,32,8,ActivationType.Swiglu,torch.bfloat16,torch.float4_e2m1fn_x2,torch.float4_e2m1fn_x2,QuantType.per_1x32,1,0,32,0,-1.0,flydsl_moe1_afp4_wfp4_bf16_t32x128x256_w3_kb7_go_xcd4_fp4,100.0%,0.0,0.0
stage1,256,64,4096,4096,32,8,ActivationType.Swiglu,torch.bfloat16,torch.float4_e2m1fn_x2,torch.float4_e2m1fn_x2,QuantType.per_1x32,1,0,32,0,-1.0,flydsl_moe1_afp4_wfp4_bf16_t32x128x256_w3_kb14_bnt0_fp4,100.0%,0.0,0.0
stage1,256,64,4096,4096,32,8,ActivationType.Swiglu,torch.bfloat16,torch.float4_e2m1fn_x2,torch.float4_e2m1fn_x2,QuantType.per_1x32,1,0,32,0,-1.0,flydsl_moe1_afp4_wfp4_bf16_t32x128x256_w3_kb14_bnt0_xcd4_fp4,100.0%,0.0,0.0
stage1,256,64,4096,4096,32,8,ActivationType.Swiglu,torch.bfloat16,torch.float4_e2m1fn_x2,torch.float4_e2m1fn_x2,QuantType.per_1x32,1,0,32,0,-1.0,flydsl_moe1_afp4_wfp4_bf16_t32x128x256_w3_kb14_bnt0_go_fp4,100.0%,0.0,0.0
stage1,256,64,4096,4096,32,8,ActivationType.Swiglu,torch.bfloat16,torch.float4_e2m1fn_x2,torch.float4_e2m1fn_x2,QuantType.per_1x32,1,0,32,0,-1.0,flydsl_moe1_afp4_wfp4_bf16_t32x128x256_w3_kb14_bnt0_go_xcd4_fp4,100.0%,0.0,0.0
stage1,256,64,4096,4096,32,8,ActivationType.Swiglu,torch.bfloat16,torch.float4_e2m1fn_x2,torch.float4_e2m1fn_x2,QuantType.per_1x32,1,0,32,0,-1.0,flydsl_moe1_afp4_wfp4_bf16_t32x128x256_w3_kb14_fp4,100.0%,0.0,0.0
stage1,256,64,4096,4096,32,8,ActivationType.Swiglu,torch.bfloat16,torch.float4_e2m1fn_x2,torch.float4_e2m1fn_x2,QuantType.per_1x32,1,0,32,0,-1.0,flydsl_moe1_afp4_wfp4_bf16_t32x128x256_w3_kb14_xcd4_fp4,100.0%,0.0,0.0
stage1,256,64,4096,4096,32,8,ActivationType.Swiglu,torch.bfloat16,torch.float4_e2m1fn_x2,torch.float4_e2m1fn_x2,QuantType.per_1x32,1,0,32,0,-1.0,flydsl_moe1_afp4_wfp4_bf16_t32x128x256_w3_kb14_go_fp4,100.0%,0.0,0.0
stage1,256,64,4096,4096,32,8,ActivationType.Swiglu,torch.bfloat16,torch.float4_e2m1fn_x2,torch.float4_e2m1fn_x2,QuantType.per_1x32,1,0,32,0,-1.0,flydsl_moe1_afp4_wfp4_bf16_t32x128x256_w3_kb14_go_xcd4_fp4,100.0%,0.0,0.0
stage1,256,64,4096,4096,32,8,ActivationType.Swiglu,torch.bfloat16,torch.float4_e2m1fn_x2,torch.float4_e2m1fn_x2,QuantType.per_1x32,1,0,32,0,109.9039,flydsl_moe1_afp4_wfp4_bf16_t32x128x256_w4_bnt0,0.0%,468.95,14661.89
stage1,256,64,4096,4096,32,8,ActivationType.Swiglu,torch.bfloat16,torch.float4_e2m1fn_x2,torch.float4_e2m1fn_x2,QuantType.per_1x32,1,0,32,0,109.7645,flydsl_moe1_afp4_wfp4_bf16_t32x128x256_w4_bnt0_fp4,0.8%,469.55,14680.51
stage1,256,64,4096,4096,32,8,ActivationType.Swiglu,torch.bfloat16,torch.float4_e2m1fn_x2,torch.float4_e2m1fn_x2,QuantType.per_1x32,1,0,32,0,128.0925,flydsl_moe1_afp4_wfp4_bf16_t32x128x256_w4_bnt0_xcd4,0.0%,402.36,12579.97
stage1,256,64,4096,4096,32,8,ActivationType.Swiglu,torch.bfloat16,torch.float4_e2m1fn_x2,torch.float4_e2m1fn_x2,QuantType.per_1x32,1,0,32,0,130.1263,flydsl_moe1_afp4_wfp4_bf16_t32x128x256_w4_bnt0_xcd4_fp4,0.8%,396.07,12383.35
stage1,256,64,4096,4096,32,8,ActivationType.Swiglu,torch.bfloat16,torch.float4_e2m1fn_x2,torch.float4_e2m1fn_x2,QuantType.per_1x32,1,0,32,0,103.9656,flydsl_moe1_afp4_wfp4_bf16_t32x128x256_w4,0.0%,495.74,15499.35
stage1,256,64,4096,4096,32,8,ActivationType.Swiglu,torch.bfloat16,torch.float4_e2m1fn_x2,torch.float4_e2m1fn_x2,QuantType.per_1x32,1,0,32,0,104.2702,flydsl_moe1_afp4_wfp4_bf16_t32x128x256_w4_fp4,0.8%,494.29,15454.07
stage1,256,64,4096,4096,32,8,ActivationType.Swiglu,torch.bfloat16,torch.float4_e2m1fn_x2,torch.float4_e2m1fn_x2,QuantType.per_1x32,1,0,32,0,123.0409,flydsl_moe1_afp4_wfp4_bf16_t32x128x256_w4_xcd4,0.0%,418.88,13096.45
stage1,256,64,4096,4096,32,8,ActivationType.Swiglu,torch.bfloat16,torch.float4_e2m1fn_x2,torch.float4_e2m1fn_x2,QuantType.per_1x32,1,0,32,0,124.3016,flydsl_moe1_afp4_wfp4_bf16_t32x128x256_w4_xcd4_fp4,0.8%,414.63,12963.62
stage2,256,64,4096,4096,32,8,ActivationType.Swiglu,torch.bfloat16,torch.float4_e2m1fn_x2,torch.float4_e2m1fn_x2,QuantType.per_1x32,1,0,32,0,71.8274,flydsl_moe2_afp4_wfp4_bf16_t16x128x256_atomic_sbm32,9.2%,717.55,22434.32
stage2,256,64,4096,4096,32,8,ActivationType.Swiglu,torch.bfloat16,torch.float4_e2m1fn_x2,torch.float4_e2m1fn_x2,QuantType.per_1x32,1,0,32,0,67.8917,flydsl_moe2_afp4_wfp4_bf16_t16x128x256_atomic_persist_sbm32,9.3%,759.14,23734.85
stage2,256,64,4096,4096,32,8,ActivationType.Swiglu,torch.bfloat16,torch.float4_e2m1fn_x2,torch.float4_e2m1fn_x2,QuantType.per_1x32,1,0,32,0,88.7035,flydsl_moe2_afp4_wfp4_bf16_t16x128x256_atomic_xcd4_sbm32,9.1%,581.03,18166.13
stage2,256,64,4096,4096,32,8,ActivationType.Swiglu,torch.bfloat16,torch.float4_e2m1fn_x2,torch.float4_e2m1fn_x2,QuantType.per_1x32,1,0,32,0,181.3199,flydsl_moe2_afp4_wfp4_bf16_t16x128x256_atomic_xcd4_persist_sbm32,9.3%,284.25,8887.05
stage2,256,64,4096,4096,32,8,ActivationType.Swiglu,torch.bfloat16,torch.float4_e2m1fn_x2,torch.float4_e2m1fn_x2,QuantType.per_1x32,1,0,32,0,76.2619,flydsl_moe2_afp4_wfp4_bf16_t16x128x256_atomic_bnt2_sbm32,9.3%,675.82,21129.81
stage2,256,64,4096,4096,32,8,ActivationType.Swiglu,torch.bfloat16,torch.float4_e2m1fn_x2,torch.float4_e2m1fn_x2,QuantType.per_1x32,1,0,32,0,71.7949,flydsl_moe2_afp4_wfp4_bf16_t16x128x256_atomic_bnt2_persist_sbm32,9.2%,717.87,22444.48
stage2,256,64,4096,4096,32,8,ActivationType.Swiglu,torch.bfloat16,torch.float4_e2m1fn_x2,torch.float4_e2m1fn_x2,QuantType.per_1x32,1,0,32,0,94.2203,flydsl_moe2_afp4_wfp4_bf16_t16x128x256_atomic_bnt2_xcd4_sbm32,9.2%,547.01,17102.46
stage2,256,64,4096,4096,32,8,ActivationType.Swiglu,torch.bfloat16,torch.float4_e2m1fn_x2,torch.float4_e2m1fn_x2,QuantType.per_1x32,1,0,32,0,194.6087,flydsl_moe2_afp4_wfp4_bf16_t16x128x256_atomic_bnt2_xcd4_persist_sbm32,9.3%,264.84,8280.2
stage2,256,64,4096,4096,32,8,ActivationType.Swiglu,torch.bfloat16,torch.float4_e2m1fn_x2,torch.float4_e2m1fn_x2,QuantType.per_1x32,1,0,32,0,72.3534,flydsl_moe2_afp4_wfp4_bf16_t16x128x256_reduce_sbm32,3.8%,712.33,22271.23
stage2,256,64,4096,4096,32,8,ActivationType.Swiglu,torch.bfloat16,torch.float4_e2m1fn_x2,torch.float4_e2m1fn_x2,QuantType.per_1x32,1,0,32,0,68.9396,flydsl_moe2_afp4_wfp4_bf16_t16x128x256_reduce_persist_sbm32,3.8%,747.61,23374.07
stage2,256,64,4096,4096,32,8,ActivationType.Swiglu,torch.bfloat16,torch.float4_e2m1fn_x2,torch.float4_e2m1fn_x2,QuantType.per_1x32,1,0,32,0,88.8138,flydsl_moe2_afp4_wfp4_bf16_t16x128x256_reduce_xcd4_sbm32,3.8%,580.31,18143.57
stage2,256,64,4096,4096,32,8,ActivationType.Swiglu,torch.bfloat16,torch.float4_e2m1fn_x2,torch.float4_e2m1fn_x2,QuantType.per_1x32,1,0,32,0,182.061,flydsl_moe2_afp4_wfp4_bf16_t16x128x256_reduce_xcd4_persist_sbm32,3.8%,283.09,8850.88
stage2,256,64,4096,4096,32,8,ActivationType.Swiglu,torch.bfloat16,torch.float4_e2m1fn_x2,torch.float4_e2m1fn_x2,QuantType.per_1x32,1,0,32,0,76.322,flydsl_moe2_afp4_wfp4_bf16_t16x128x256_reduce_bnt2_sbm32,3.8%,675.29,21113.17
stage2,256,64,4096,4096,32,8,ActivationType.Swiglu,torch.bfloat16,torch.float4_e2m1fn_x2,torch.float4_e2m1fn_x2,QuantType.per_1x32,1,0,32,0,72.6394,flydsl_moe2_afp4_wfp4_bf16_t16x128x256_reduce_bnt2_persist_sbm32,3.8%,709.53,22183.54
stage2,256,64,4096,4096,32,8,ActivationType.Swiglu,torch.bfloat16,torch.float4_e2m1fn_x2,torch.float4_e2m1fn_x2,QuantType.per_1x32,1,0,32,0,94.7171,flydsl_moe2_afp4_wfp4_bf16_t16x128x256_reduce_bnt2_xcd4_sbm32,3.8%,544.14,17012.76
stage2,256,64,4096,4096,32,8,ActivationType.Swiglu,torch.bfloat16,torch.float4_e2m1fn_x2,torch.float4_e2m1fn_x2,QuantType.per_1x32,1,0,32,0,193.8763,flydsl_moe2_afp4_wfp4_bf16_t16x128x256_reduce_bnt2_xcd4_persist_sbm32,3.8%,265.84,8311.48
stage2,256,64,4096,4096,32,8,ActivationType.Swiglu,torch.bfloat16,torch.float4_e2m1fn_x2,torch.float4_e2m1fn_x2,QuantType.per_1x32,1,0,32,0,72.8859,flydsl_moe2_afp4_wfp4_bf16_t16x256x256_atomic_sbm32,9.3%,707.13,22108.52
stage2,256,64,4096,4096,32,8,ActivationType.Swiglu,torch.bfloat16,torch.float4_e2m1fn_x2,torch.float4_e2m1fn_x2,QuantType.per_1x32,1,0,32,0,72.9558,flydsl_moe2_afp4_wfp4_bf16_t16x256x256_atomic_persist_sbm32,9.2%,706.45,22087.33
stage2,256,64,4096,4096,32,8,ActivationType.Swiglu,torch.bfloat16,torch.float4_e2m1fn_x2,torch.float4_e2m1fn_x2,QuantType.per_1x32,1,0,32,0,81.816,flydsl_moe2_afp4_wfp4_bf16_t16x256x256_atomic_xcd4_sbm32,9.1%,629.95,19695.4
stage2,256,64,4096,4096,32,8,ActivationType.Swiglu,torch.bfloat16,torch.float4_e2m1fn_x2,torch.float4_e2m1fn_x2,QuantType.per_1x32,1,0,32,0,176.7833,flydsl_moe2_afp4_wfp4_bf16_t16x256x256_atomic_xcd4_persist_sbm32,9.3%,291.54,9115.11
stage2,256,64,4096,4096,32,8,ActivationType.Swiglu,torch.bfloat16,torch.float4_e2m1fn_x2,torch.float4_e2m1fn_x2,QuantType.per_1x32,1,0,32,0,75.694,flydsl_moe2_afp4_wfp4_bf16_t16x256x256_atomic_bnt2_sbm32,9.2%,680.89,21288.33
stage2,256,64,4096,4096,32,8,ActivationType.Swiglu,torch.bfloat16,torch.float4_e2m1fn_x2,torch.float4_e2m1fn_x2,QuantType.per_1x32,1,0,32,0,76.82,flydsl_moe2_afp4_wfp4_bf16_t16x256x256_atomic_bnt2_persist_sbm32,9.3%,670.91,20976.3
stage2,256,64,4096,4096,32,8,ActivationType.Swiglu,torch.bfloat16,torch.float4_e2m1fn_x2,torch.float4_e2m1fn_x2,QuantType.per_1x32,1,0,32,0,84.7109,flydsl_moe2_afp4_wfp4_bf16_t16x256x256_atomic_bnt2_xcd4_sbm32,9.1%,608.42,19022.34
stage2,256,64,4096,4096,32,8,ActivationType.Swiglu,torch.bfloat16,torch.float4_e2m1fn_x2,torch.float4_e2m1fn_x2,QuantType.per_1x32,1,0,32,0,183.6922,flydsl_moe2_afp4_wfp4_bf16_t16x256x256_atomic_bnt2_xcd4_persist_sbm32,9.2%,280.58,8772.28
stage2,256,64,4096,4096,32,8,ActivationType.Swiglu,torch.bfloat16,torch.float4_e2m1fn_x2,torch.float4_e2m1fn_x2,QuantType.per_1x32,1,0,32,0,73.5917,flydsl_moe2_afp4_wfp4_bf16_t16x256x256_reduce_sbm32,3.8%,700.35,21896.48
stage2,256,64,4096,4096,32,8,ActivationType.Swiglu,torch.bfloat16,torch.float4_e2m1fn_x2,torch.float4_e2m1fn_x2,QuantType.per_1x32,1,0,32,0,73.8169,flydsl_moe2_afp4_wfp4_bf16_t16x256x256_reduce_persist_sbm32,3.8%,698.21,21829.68
stage2,256,64,4096,4096,32,8,ActivationType.Swiglu,torch.bfloat16,torch.float4_e2m1fn_x2,torch.float4_e2m1fn_x2,QuantType.per_1x32,1,0,32,0,82.7348,flydsl_moe2_afp4_wfp4_bf16_t16x256x256_reduce_xcd4_sbm32,3.8%,622.95,19476.68
stage2,256,64,4096,4096,32,8,ActivationType.Swiglu,torch.bfloat16,torch.float4_e2m1fn_x2,torch.float4_e2m1fn_x2,QuantType.per_1x32,1,0,32,0,177.2408,flydsl_moe2_afp4_wfp4_bf16_t16x256x256_reduce_xcd4_persist_sbm32,3.8%,290.79,9091.58
stage2,256,64,4096,4096,32,8,ActivationType.Swiglu,torch.bfloat16,torch.float4_e2m1fn_x2,torch.float4_e2m1fn_x2,QuantType.per_1x32,1,0,32,0,77.1174,flydsl_moe2_afp4_wfp4_bf16_t16x256x256_reduce_bnt2_sbm32,3.8%,668.33,20895.4
stage2,256,64,4096,4096,32,8,ActivationType.Swiglu,torch.bfloat16,torch.float4_e2m1fn_x2,torch.float4_e2m1fn_x2,QuantType.per_1x32,1,0,32,0,78.0387,flydsl_moe2_afp4_wfp4_bf16_t16x256x256_reduce_bnt2_persist_sbm32,3.8%,660.44,20648.72
stage2,256,64,4096,4096,32,8,ActivationType.Swiglu,torch.bfloat16,torch.float4_e2m1fn_x2,torch.float4_e2m1fn_x2,QuantType.per_1x32,1,0,32,0,85.5657,flydsl_moe2_afp4_wfp4_bf16_t16x256x256_reduce_bnt2_xcd4_sbm32,3.8%,602.34,18832.3
stage2,256,64,4096,4096,32,8,ActivationType.Swiglu,torch.bfloat16,torch.float4_e2m1fn_x2,torch.float4_e2m1fn_x2,QuantType.per_1x32,1,0,32,0,183.9105,flydsl_moe2_afp4_wfp4_bf16_t16x256x256_reduce_bnt2_xcd4_persist_sbm32,3.8%,280.24,8761.87
stage2,256,64,4096,4096,32,8,ActivationType.Swiglu,torch.bfloat16,torch.float4_e2m1fn_x2,torch.float4_e2m1fn_x2,QuantType.per_1x32,1,0,32,0,58.7475,flydsl_moe2_afp4_wfp4_bf16_t32x128x256_atomic,9.2%,877.31,27429.24
stage2,256,64,4096,4096,32,8,ActivationType.Swiglu,torch.bfloat16,torch.float4_e2m1fn_x2,torch.float4_e2m1fn_x2,QuantType.per_1x32,1,0,32,0,61.1006,flydsl_moe2_afp4_wfp4_bf16_t32x128x256_atomic_persist,9.3%,843.52,26372.89
stage2,256,64,4096,4096,32,8,ActivationType.Swiglu,torch.bfloat16,torch.float4_e2m1fn_x2,torch.float4_e2m1fn_x2,QuantType.per_1x32,1,0,32,0,69.7129,flydsl_moe2_afp4_wfp4_bf16_t32x128x256_atomic_xcd4,9.2%,739.31,23114.79
stage2,256,64,4096,4096,32,8,ActivationType.Swiglu,torch.bfloat16,torch.float4_e2m1fn_x2,torch.float4_e2m1fn_x2,QuantType.per_1x32,1,0,32,0,238.9588,flydsl_moe2_afp4_wfp4_bf16_t32x128x256_atomic_xcd4_persist,9.3%,215.68,6743.42
stage2,256,64,4096,4096,32,8,ActivationType.Swiglu,torch.bfloat16,torch.float4_e2m1fn_x2,torch.float4_e2m1fn_x2,QuantType.per_1x32,1,0,32,0,57.708,flydsl_moe2_afp4_wfp4_bf16_t32x128x256_atomic_bnt2,9.3%,893.11,27923.32
stage2,256,64,4096,4096,32,8,ActivationType.Swiglu,torch.bfloat16,torch.float4_e2m1fn_x2,torch.float4_e2m1fn_x2,QuantType.per_1x32,1,0,32,0,59.3541,flydsl_moe2_afp4_wfp4_bf16_t32x128x256_atomic_bnt2_persist,9.3%,868.34,27148.91
stage2,256,64,4096,4096,32,8,ActivationType.Swiglu,torch.bfloat16,torch.float4_e2m1fn_x2,torch.float4_e2m1fn_x2,QuantType.per_1x32,1,0,32,0,68.8827,flydsl_moe2_afp4_wfp4_bf16_t32x128x256_atomic_bnt2_xcd4,9.2%,748.22,23393.38
stage2,256,64,4096,4096,32,8,ActivationType.Swiglu,torch.bfloat16,torch.float4_e2m1fn_x2,torch.float4_e2m1fn_x2,QuantType.per_1x32,1,0,32,0,237.9705,flydsl_moe2_afp4_wfp4_bf16_t32x128x256_atomic_bnt2_xcd4_persist,9.3%,216.58,6771.42
stage2,256,64,4096,4096,32,8,ActivationType.Swiglu,torch.bfloat16,torch.float4_e2m1fn_x2,torch.float4_e2m1fn_x2,QuantType.per_1x32,1,0,32,0,59.0667,flydsl_moe2_afp4_wfp4_bf16_t32x128x256_reduce,3.8%,872.57,27281.01
stage2,256,64,4096,4096,32,8,ActivationType.Swiglu,torch.bfloat16,torch.float4_e2m1fn_x2,torch.float4_e2m1fn_x2,QuantType.per_1x32,1,0,32,0,61.217,flydsl_moe2_afp4_wfp4_bf16_t32x128x256_reduce_persist,3.8%,841.92,26322.74
stage2,256,64,4096,4096,32,8,ActivationType.Swiglu,torch.bfloat16,torch.float4_e2m1fn_x2,torch.float4_e2m1fn_x2,QuantType.per_1x32,1,0,32,0,70.3948,flydsl_moe2_afp4_wfp4_bf16_t32x128x256_reduce_xcd4,3.8%,732.15,22890.88
stage2,256,64,4096,4096,32,8,ActivationType.Swiglu,torch.bfloat16,torch.float4_e2m1fn_x2,torch.float4_e2m1fn_x2,QuantType.per_1x32,1,0,32,0,239.5975,flydsl_moe2_afp4_wfp4_bf16_t32x128x256_reduce_xcd4_persist,3.8%,215.11,6725.44
stage2,256,64,4096,4096,32,8,ActivationType.Swiglu,torch.bfloat16,torch.float4_e2m1fn_x2,torch.float4_e2m1fn_x2,QuantType.per_1x32,1,0,32,0,58.3124,flydsl_moe2_afp4_wfp4_bf16_t32x128x256_reduce_bnt2,3.8%,883.85,27633.9
stage2,256,64,4096,4096,32,8,ActivationType.Swiglu,torch.bfloat16,torch.float4_e2m1fn_x2,torch.float4_e2m1fn_x2,QuantType.per_1x32,1,0,32,0,60.5132,flydsl_moe2_afp4_wfp4_bf16_t32x128x256_reduce_bnt2_persist,3.8%,851.71,26628.89
stage2,256,64,4096,4096,32,8,ActivationType.Swiglu,torch.bfloat16,torch.float4_e2m1fn_x2,torch.float4_e2m1fn_x2,QuantType.per_1x32,1,0,32,0,69.8753,flydsl_moe2_afp4_wfp4_bf16_t32x128x256_reduce_bnt2_xcd4,3.8%,737.59,23061.07
stage2,256,64,4096,4096,32,8,ActivationType.Swiglu,torch.bfloat16,torch.float4_e2m1fn_x2,torch.float4_e2m1fn_x2,QuantType.per_1x32,1,0,32,0,238.5729,flydsl_moe2_afp4_wfp4_bf16_t32x128x256_reduce_bnt2_xcd4_persist,3.8%,216.03,6754.33
stage2,256,64,4096,4096,32,8,ActivationType.Swiglu,torch.bfloat16,torch.float4_e2m1fn_x2,torch.float4_e2m1fn_x2,QuantType.per_1x32,1,0,32,0,68.6176,flydsl_moe2_afp4_wfp4_bf16_t32x256x256_atomic,9.3%,751.11,23483.76
stage2,256,64,4096,4096,32,8,ActivationType.Swiglu,torch.bfloat16,torch.float4_e2m1fn_x2,torch.float4_e2m1fn_x2,QuantType.per_1x32,1,0,32,0,67.2373,flydsl_moe2_afp4_wfp4_bf16_t32x256x256_atomic_persist,9.3%,766.53,23965.85
stage2,256,64,4096,4096,32,8,ActivationType.Swiglu,torch.bfloat16,torch.float4_e2m1fn_x2,torch.float4_e2m1fn_x2,QuantType.per_1x32,1,0,32,0,67.5451,flydsl_moe2_afp4_wfp4_bf16_t32x256x256_atomic_xcd4,9.2%,763.04,23856.64
stage2,256,64,4096,4096,32,8,ActivationType.Swiglu,torch.bfloat16,torch.float4_e2m1fn_x2,torch.float4_e2m1fn_x2,QuantType.per_1x32,1,0,32,0,238.2232,flydsl_moe2_afp4_wfp4_bf16_t32x256x256_atomic_xcd4_persist,9.3%,216.35,6764.24
stage2,256,64,4096,4096,32,8,ActivationType.Swiglu,torch.bfloat16,torch.float4_e2m1fn_x2,torch.float4_e2m1fn_x2,QuantType.per_1x32,1,0,32,0,65.6233,flydsl_moe2_afp4_wfp4_bf16_t32x256x256_atomic_bnt2,9.2%,785.39,24555.29
stage2,256,64,4096,4096,32,8,ActivationType.Swiglu,torch.bfloat16,torch.float4_e2m1fn_x2,torch.float4_e2m1fn_x2,QuantType.per_1x32,1,0,32,0,65.2316,flydsl_moe2_afp4_wfp4_bf16_t32x256x256_atomic_bnt2_persist,9.2%,790.1,24702.74
stage2,256,64,4096,4096,32,8,ActivationType.Swiglu,torch.bfloat16,torch.float4_e2m1fn_x2,torch.float4_e2m1fn_x2,QuantType.per_1x32,1,0,32,0,66.6027,flydsl_moe2_afp4_wfp4_bf16_t32x256x256_atomic_bnt2_xcd4,9.2%,773.84,24194.2
stage2,256,64,4096,4096,32,8,ActivationType.Swiglu,torch.bfloat16,torch.float4_e2m1fn_x2,torch.float4_e2m1fn_x2,QuantType.per_1x32,1,0,32,0,237.293,flydsl_moe2_afp4_wfp4_bf16_t32x256x256_atomic_bnt2_xcd4_persist,9.3%,217.2,6790.76
stage2,256,64,4096,4096,32,8,ActivationType.Swiglu,torch.bfloat16,torch.float4_e2m1fn_x2,torch.float4_e2m1fn_x2,QuantType.per_1x32,1,0,32,0,68.9745,flydsl_moe2_afp4_wfp4_bf16_t32x256x256_reduce,3.8%,747.23,23362.25
stage2,256,64,4096,4096,32,8,ActivationType.Swiglu,torch.bfloat16,torch.float4_e2m1fn_x2,torch.float4_e2m1fn_x2,QuantType.per_1x32,1,0,32,0,67.8491,flydsl_moe2_afp4_wfp4_bf16_t32x256x256_reduce_persist,3.8%,759.62,23749.75
stage2,256,64,4096,4096,32,8,ActivationType.Swiglu,torch.bfloat16,torch.float4_e2m1fn_x2,torch.float4_e2m1fn_x2,QuantType.per_1x32,1,0,32,0,68.6478,flydsl_moe2_afp4_wfp4_bf16_t32x256x256_reduce_xcd4,3.8%,750.78,23473.43
stage2,256,64,4096,4096,32,8,ActivationType.Swiglu,torch.bfloat16,torch.float4_e2m1fn_x2,torch.float4_e2m1fn_x2,QuantType.per_1x32,1,0,32,0,240.8,flydsl_moe2_afp4_wfp4_bf16_t32x256x256_reduce_xcd4_persist,3.8%,214.03,6691.86
stage2,256,64,4096,4096,32,8,ActivationType.Swiglu,torch.bfloat16,torch.float4_e2m1fn_x2,torch.float4_e2m1fn_x2,QuantType.per_1x32,1,0,32,0,66.2385,flydsl_moe2_afp4_wfp4_bf16_t32x256x256_reduce_bnt2,3.8%,778.09,24327.23
stage2,256,64,4096,4096,32,8,ActivationType.Swiglu,torch.bfloat16,torch.float4_e2m1fn_x2,torch.float4_e2m1fn_x2,QuantType.per_1x32,1,0,32,0,65.9,flydsl_moe2_afp4_wfp4_bf16_t32x256x256_reduce_bnt2_persist,3.8%,782.09,24452.19
stage2,256,64,4096,4096,32,8,ActivationType.Swiglu,torch.bfloat16,torch.float4_e2m1fn_x2,torch.float4_e2m1fn_x2,QuantType.per_1x32,1,0,32,0,67.0891,flydsl_moe2_afp4_wfp4_bf16_t32x256x256_reduce_bnt2_xcd4,3.8%,768.23,24018.79
stage2,256,64,4096,4096,32,8,ActivationType.Swiglu,torch.bfloat16,torch.float4_e2m1fn_x2,torch.float4_e2m1fn_x2,QuantType.per_1x32,1,0,32,0,240.1728,flydsl_moe2_afp4_wfp4_bf16_t32x256x256_reduce_bnt2_xcd4_persist,3.8%,214.59,6709.33
stage1,256,64,4096,4096,32,8,ActivationType.Swiglu,torch.bfloat16,torch.float4_e2m1fn_x2,torch.float4_e2m1fn_x2,QuantType.per_1x32,1,0,64,0,130.0418,flydsl_moe1_afp4_wfp4_bf16_t64x64x256_bnt0,0.0%,396.33,12391.39
stage1,256,64,4096,4096,32,8,ActivationType.Swiglu,torch.bfloat16,torch.float4_e2m1fn_x2,torch.float4_e2m1fn_x2,QuantType.per_1x32,1,0,64,0,136.9993,flydsl_moe1_afp4_wfp4_bf16_t64x64x256_bnt0_fp4,0.8%,376.2,11762.1
stage1,256,64,4096,4096,32,8,ActivationType.Swiglu,torch.bfloat16,torch.float4_e2m1fn_x2,torch.float4_e2m1fn_x2,QuantType.per_1x32,1,0,64,0,167.7264,flydsl_moe1_afp4_wfp4_bf16_t64x64x256_bnt0_xcd4,0.0%,307.28,9607.31
stage1,256,64,4096,4096,32,8,ActivationType.Swiglu,torch.bfloat16,torch.float4_e2m1fn_x2,torch.float4_e2m1fn_x2,QuantType.per_1x32,1,0,64,0,179.4363,flydsl_moe1_afp4_wfp4_bf16_t64x64x256_bnt0_xcd4_fp4,0.8%,287.23,8980.34
stage1,256,64,4096,4096,32,8,ActivationType.Swiglu,torch.bfloat16,torch.float4_e2m1fn_x2,torch.float4_e2m1fn_x2,QuantType.per_1x32,1,0,64,0,127.2568,flydsl_moe1_afp4_wfp4_bf16_t64x64x256,0.0%,405.0,12662.58
stage1,256,64,4096,4096,32,8,ActivationType.Swiglu,torch.bfloat16,torch.float4_e2m1fn_x2,torch.float4_e2m1fn_x2,QuantType.per_1x32,1,0,64,0,135.3164,flydsl_moe1_afp4_wfp4_bf16_t64x64x256_fp4,0.8%,380.88,11908.38
stage1,256,64,4096,4096,32,8,ActivationType.Swiglu,torch.bfloat16,torch.float4_e2m1fn_x2,torch.float4_e2m1fn_x2,QuantType.per_1x32,1,0,64,0,160.7415,flydsl_moe1_afp4_wfp4_bf16_t64x64x256_xcd4,0.0%,320.64,10024.79
stage1,256,64,4096,4096,32,8,ActivationType.Swiglu,torch.bfloat16,torch.float4_e2m1fn_x2,torch.float4_e2m1fn_x2,QuantType.per_1x32,1,0,64,0,174.2151,flydsl_moe1_afp4_wfp4_bf16_t64x64x256_xcd4_fp4,0.8%,295.84,9249.48
stage1,256,64,4096,4096,32,8,ActivationType.Swiglu,torch.bfloat16,torch.float4_e2m1fn_x2,torch.float4_e2m1fn_x2,QuantType.per_1x32,1,0,64,0,104.7416,flydsl_moe1_afp4_wfp4_bf16_t64x64x256_w2_bnt0,0.0%,492.06,15384.52
stage1,256,64,4096,4096,32,8,ActivationType.Swiglu,torch.bfloat16,torch.float4_e2m1fn_x2,torch.float4_e2m1fn_x2,QuantType.per_1x32,1,0,64,0,107.7484,flydsl_moe1_afp4_wfp4_bf16_t64x64x256_w2_bnt0_fp4,0.8%,478.33,14955.2
stage1,256,64,4096,4096,32,8,ActivationType.Swiglu,torch.bfloat16,torch.float4_e2m1fn_x2,torch.float4_e2m1fn_x2,QuantType.per_1x32,1,0,64,0,133.3001,flydsl_moe1_afp4_wfp4_bf16_t64x64x256_w2_bnt0_xcd4,0.0%,386.64,12088.51
stage1,256,64,4096,4096,32,8,ActivationType.Swiglu,torch.bfloat16,torch.float4_e2m1fn_x2,torch.float4_e2m1fn_x2,QuantType.per_1x32,1,0,64,0,137.434,flydsl_moe1_afp4_wfp4_bf16_t64x64x256_w2_bnt0_xcd4_fp4,0.8%,375.01,11724.89
stage1,256,64,4096,4096,32,8,ActivationType.Swiglu,torch.bfloat16,torch.float4_e2m1fn_x2,torch.float4_e2m1fn_x2,QuantType.per_1x32,1,0,64,0,99.3064,flydsl_moe1_afp4_wfp4_bf16_t64x64x256_w2,0.0%,519.0,16226.54
stage1,256,64,4096,4096,32,8,ActivationType.Swiglu,torch.bfloat16,torch.float4_e2m1fn_x2,torch.float4_e2m1fn_x2,QuantType.per_1x32,1,0,64,0,103.8487,flydsl_moe1_afp4_wfp4_bf16_t64x64x256_w2_fp4,0.8%,496.3,15516.8
stage1,256,64,4096,4096,32,8,ActivationType.Swiglu,torch.bfloat16,torch.float4_e2m1fn_x2,torch.float4_e2m1fn_x2,QuantType.per_1x32,1,0,64,0,127.8651,flydsl_moe1_afp4_wfp4_bf16_t64x64x256_w2_xcd4,0.0%,403.08,12602.34
stage1,256,64,4096,4096,32,8,ActivationType.Swiglu,torch.bfloat16,torch.float4_e2m1fn_x2,torch.float4_e2m1fn_x2,QuantType.per_1x32,1,0,64,0,130.1976,flydsl_moe1_afp4_wfp4_bf16_t64x64x256_w2_xcd4_fp4,0.8%,395.86,12376.57
stage1,256,64,4096,4096,32,8,ActivationType.Swiglu,torch.bfloat16,torch.float4_e2m1fn_x2,torch.float4_e2m1fn_x2,QuantType.per_1x32,1,0,64,0,105.6603,flydsl_moe1_afp4_wfp4_bf16_t64x64x256_w3_bnt0,0.0%,487.79,15250.75
stage1,256,64,4096,4096,32,8,ActivationType.Swiglu,torch.bfloat16,torch.float4_e2m1fn_x2,torch.float4_e2m1fn_x2,QuantType.per_1x32,1,0,64,0,107.0312,flydsl_moe1_afp4_wfp4_bf16_t64x64x256_w3_bnt0_fp4,0.8%,481.54,15055.42
stage1,256,64,4096,4096,32,8,ActivationType.Swiglu,torch.bfloat16,torch.float4_e2m1fn_x2,torch.float4_e2m1fn_x2,QuantType.per_1x32,1,0,64,0,135.1953,flydsl_moe1_afp4_wfp4_bf16_t64x64x256_w3_bnt0_xcd4,0.0%,381.22,11919.05
stage1,256,64,4096,4096,32,8,ActivationType.Swiglu,torch.bfloat16,torch.float4_e2m1fn_x2,torch.float4_e2m1fn_x2,QuantType.per_1x32,1,0,64,0,137.128,flydsl_moe1_afp4_wfp4_bf16_t64x64x256_w3_bnt0_xcd4_fp4,0.8%,375.85,11751.06
stage1,256,64,4096,4096,32,8,ActivationType.Swiglu,torch.bfloat16,torch.float4_e2m1fn_x2,torch.float4_e2m1fn_x2,QuantType.per_1x32,1,0,64,0,99.6983,flydsl_moe1_afp4_wfp4_bf16_t64x64x256_w3,0.0%,516.96,16162.75
stage1,256,64,4096,4096,32,8,ActivationType.Swiglu,torch.bfloat16,torch.float4_e2m1fn_x2,torch.float4_e2m1fn_x2,QuantType.per_1x32,1,0,64,0,102.0977,flydsl_moe1_afp4_wfp4_bf16_t64x64x256_w3_fp4,0.8%,504.81,15782.91
stage1,256,64,4096,4096,32,8,ActivationType.Swiglu,torch.bfloat16,torch.float4_e2m1fn_x2,torch.float4_e2m1fn_x2,QuantType.per_1x32,1,0,64,0,126.1892,flydsl_moe1_afp4_wfp4_bf16_t64x64x256_w3_xcd4,0.0%,408.43,12769.71
stage1,256,64,4096,4096,32,8,ActivationType.Swiglu,torch.bfloat16,torch.float4_e2m1fn_x2,torch.float4_e2m1fn_x2,QuantType.per_1x32,1,0,64,0,129.0903,flydsl_moe1_afp4_wfp4_bf16_t64x64x256_w3_xcd4_fp4,0.8%,399.25,12482.73
stage1,256,64,4096,4096,32,8,ActivationType.Swiglu,torch.bfloat16,torch.float4_e2m1fn_x2,torch.float4_e2m1fn_x2,QuantType.per_1x32,1,0,64,0,107.1757,flydsl_moe1_afp4_wfp4_bf16_t64x64x256_w4_bnt0,0.0%,480.89,15035.12
stage1,256,64,4096,4096,32,8,ActivationType.Swiglu,torch.bfloat16,torch.float4_e2m1fn_x2,torch.float4_e2m1fn_x2,QuantType.per_1x32,1,0,64,0,107.3837,flydsl_moe1_afp4_wfp4_bf16_t64x64x256_w4_bnt0_fp4,0.8%,479.96,15005.99
stage1,256,64,4096,4096,32,8,ActivationType.Swiglu,torch.bfloat16,torch.float4_e2m1fn_x2,torch.float4_e2m1fn_x2,QuantType.per_1x32,1,0,64,0,132.6274,flydsl_moe1_afp4_wfp4_bf16_t64x64x256_w4_bnt0_xcd4,0.0%,388.6,12149.82
stage1,256,64,4096,4096,32,8,ActivationType.Swiglu,torch.bfloat16,torch.float4_e2m1fn_x2,torch.float4_e2m1fn_x2,QuantType.per_1x32,1,0,64,0,134.2917,flydsl_moe1_afp4_wfp4_bf16_t64x64x256_w4_bnt0_xcd4_fp4,0.8%,383.79,11999.25
stage1,256,64,4096,4096,32,8,ActivationType.Swiglu,torch.bfloat16,torch.float4_e2m1fn_x2,torch.float4_e2m1fn_x2,QuantType.per_1x32,1,0,64,0,98.9514,flydsl_moe1_afp4_wfp4_bf16_t64x64x256_w4,0.0%,520.86,16284.75
stage1,256,64,4096,4096,32,8,ActivationType.Swiglu,torch.bfloat16,torch.float4_e2m1fn_x2,torch.float4_e2m1fn_x2,QuantType.per_1x32,1,0,64,0,100.9061,flydsl_moe1_afp4_wfp4_bf16_t64x64x256_w4_fp4,0.8%,510.77,15969.29
stage1,256,64,4096,4096,32,8,ActivationType.Swiglu,torch.bfloat16,torch.float4_e2m1fn_x2,torch.float4_e2m1fn_x2,QuantType.per_1x32,1,0,64,0,125.9109,flydsl_moe1_afp4_wfp4_bf16_t64x64x256_w4_xcd4,0.0%,409.33,12797.93
stage1,256,64,4096,4096,32,8,ActivationType.Swiglu,torch.bfloat16,torch.float4_e2m1fn_x2,torch.float4_e2m1fn_x2,QuantType.per_1x32,1,0,64,0,126.5971,flydsl_moe1_afp4_wfp4_bf16_t64x64x256_w4_xcd4_fp4,0.8%,407.12,12728.56
stage1,256,64,4096,4096,32,8,ActivationType.Swiglu,torch.bfloat16,torch.float4_e2m1fn_x2,torch.float4_e2m1fn_x2,QuantType.per_1x32,1,0,64,0,118.3188,flydsl_moe1_afp4_wfp4_bf16_t64x128x256_bnt0,0.0%,435.6,13619.13
stage1,256,64,4096,4096,32,8,ActivationType.Swiglu,torch.bfloat16,torch.float4_e2m1fn_x2,torch.float4_e2m1fn_x2,QuantType.per_1x32,1,0,64,0,117.0196,flydsl_moe1_afp4_wfp4_bf16_t64x128x256_bnt0_fp4,0.8%,440.44,13770.34
stage1,256,64,4096,4096,32,8,ActivationType.Swiglu,torch.bfloat16,torch.float4_e2m1fn_x2,torch.float4_e2m1fn_x2,QuantType.per_1x32,1,0,64,0,140.1109,flydsl_moe1_afp4_wfp4_bf16_t64x128x256_bnt0_xcd4,0.0%,367.85,11500.88
stage1,256,64,4096,4096,32,8,ActivationType.Swiglu,torch.bfloat16,torch.float4_e2m1fn_x2,torch.float4_e2m1fn_x2,QuantType.per_1x32,1,0,64,0,139.9769,flydsl_moe1_afp4_wfp4_bf16_t64x128x256_bnt0_xcd4_fp4,0.8%,368.2,11511.89
stage1,256,64,4096,4096,32,8,ActivationType.Swiglu,torch.bfloat16,torch.float4_e2m1fn_x2,torch.float4_e2m1fn_x2,QuantType.per_1x32,1,0,64,0,110.5094,flydsl_moe1_afp4_wfp4_bf16_t64x128x256,0.0%,466.38,14581.56
stage1,256,64,4096,4096,32,8,ActivationType.Swiglu,torch.bfloat16,torch.float4_e2m1fn_x2,torch.float4_e2m1fn_x2,QuantType.per_1x32,1,0,64,0,111.3637,flydsl_moe1_afp4_wfp4_bf16_t64x128x256_fp4,0.8%,462.8,14469.7
stage1,256,64,4096,4096,32,8,ActivationType.Swiglu,torch.bfloat16,torch.float4_e2m1fn_x2,torch.float4_e2m1fn_x2,QuantType.per_1x32,1,0,64,0,129.8952,flydsl_moe1_afp4_wfp4_bf16_t64x128x256_xcd4,0.0%,396.78,12405.38
stage1,256,64,4096,4096,32,8,ActivationType.Swiglu,torch.bfloat16,torch.float4_e2m1fn_x2,torch.float4_e2m1fn_x2,QuantType.per_1x32,1,0,64,0,131.3651,flydsl_moe1_afp4_wfp4_bf16_t64x128x256_xcd4_fp4,0.8%,392.34,12266.57
stage1,256,64,4096,4096,32,8,ActivationType.Swiglu,torch.bfloat16,torch.float4_e2m1fn_x2,torch.float4_e2m1fn_x2,QuantType.per_1x32,1,0,64,0,113.0841,flydsl_moe1_afp4_wfp4_bf16_t64x128x256_w2_bnt0,0.0%,455.76,14249.56
stage1,256,64,4096,4096,32,8,ActivationType.Swiglu,torch.bfloat16,torch.float4_e2m1fn_x2,torch.float4_e2m1fn_x2,QuantType.per_1x32,1,0,64,0,111.6558,flydsl_moe1_afp4_wfp4_bf16_t64x128x256_w2_bnt0_fp4,0.8%,461.59,14431.84
stage1,256,64,4096,4096,32,8,ActivationType.Swiglu,torch.bfloat16,torch.float4_e2m1fn_x2,torch.float4_e2m1fn_x2,QuantType.per_1x32,1,0,64,0,128.2661,flydsl_moe1_afp4_wfp4_bf16_t64x128x256_w2_bnt0_xcd4,0.0%,401.82,12562.94
stage1,256,64,4096,4096,32,8,ActivationType.Swiglu,torch.bfloat16,torch.float4_e2m1fn_x2,torch.float4_e2m1fn_x2,QuantType.per_1x32,1,0,64,0,128.8611,flydsl_moe1_afp4_wfp4_bf16_t64x128x256_w2_bnt0_xcd4_fp4,0.8%,399.96,12504.93
stage1,256,64,4096,4096,32,8,ActivationType.Swiglu,torch.bfloat16,torch.float4_e2m1fn_x2,torch.float4_e2m1fn_x2,QuantType.per_1x32,1,0,64,0,105.3469,flydsl_moe1_afp4_wfp4_bf16_t64x128x256_w2,0.0%,489.24,15296.12
stage1,256,64,4096,4096,32,8,ActivationType.Swiglu,torch.bfloat16,torch.float4_e2m1fn_x2,torch.float4_e2m1fn_x2,QuantType.per_1x32,1,0,64,0,105.1995,flydsl_moe1_afp4_wfp4_bf16_t64x128x256_w2_fp4,0.8%,489.92,15317.56
stage1,256,64,4096,4096,32,8,ActivationType.Swiglu,torch.bfloat16,torch.float4_e2m1fn_x2,torch.float4_e2m1fn_x2,QuantType.per_1x32,1,0,64,0,121.3823,flydsl_moe1_afp4_wfp4_bf16_t64x128x256_w2_xcd4,0.0%,424.61,13275.4
stage1,256,64,4096,4096,32,8,ActivationType.Swiglu,torch.bfloat16,torch.float4_e2m1fn_x2,torch.float4_e2m1fn_x2,QuantType.per_1x32,1,0,64,0,120.509,flydsl_moe1_afp4_wfp4_bf16_t64x128x256_w2_xcd4_fp4,0.8%,427.68,13371.61
stage1,256,64,4096,4096,32,8,ActivationType.Swiglu,torch.bfloat16,torch.float4_e2m1fn_x2,torch.float4_e2m1fn_x2,QuantType.per_1x32,1,0,64,0,110.818,flydsl_moe1_afp4_wfp4_bf16_t64x128x256_w3_bnt0,0.0%,465.08,14540.95
stage1,256,64,4096,4096,32,8,ActivationType.Swiglu,torch.bfloat16,torch.float4_e2m1fn_x2,torch.float4_e2m1fn_x2,QuantType.per_1x32,1,0,64,0,112.0983,flydsl_moe1_afp4_wfp4_bf16_t64x128x256_w3_bnt0_fp4,0.8%,459.77,14374.88
stage1,256,64,4096,4096,32,8,ActivationType.Swiglu,torch.bfloat16,torch.float4_e2m1fn_x2,torch.float4_e2m1fn_x2,QuantType.per_1x32,1,0,64,0,126.2764,flydsl_moe1_afp4_wfp4_bf16_t64x128x256_w3_bnt0_xcd4,0.0%,408.15,12760.89
stage1,256,64,4096,4096,32,8,ActivationType.Swiglu,torch.bfloat16,torch.float4_e2m1fn_x2,torch.float4_e2m1fn_x2,QuantType.per_1x32,1,0,64,0,129.283,flydsl_moe1_afp4_wfp4_bf16_t64x128x256_w3_bnt0_xcd4_fp4,0.8%,398.66,12464.12
stage1,256,64,4096,4096,32,8,ActivationType.Swiglu,torch.bfloat16,torch.float4_e2m1fn_x2,torch.float4_e2m1fn_x2,QuantType.per_1x32,1,0,64,0,104.9669,flydsl_moe1_afp4_wfp4_bf16_t64x128x256_w3,0.0%,491.01,15351.5
stage1,256,64,4096,4096,32,8,ActivationType.Swiglu,torch.bfloat16,torch.float4_e2m1fn_x2,torch.float4_e2m1fn_x2,QuantType.per_1x32,1,0,64,0,106.1117,flydsl_moe1_afp4_wfp4_bf16_t64x128x256_w3_fp4,0.8%,485.71,15185.88
stage1,256,64,4096,4096,32,8,ActivationType.Swiglu,torch.bfloat16,torch.float4_e2m1fn_x2,torch.float4_e2m1fn_x2,QuantType.per_1x32,1,0,64,0,120.2016,flydsl_moe1_afp4_wfp4_bf16_t64x128x256_w3_xcd4,0.0%,428.78,13405.8
stage1,256,64,4096,4096,32,8,ActivationType.Swiglu,torch.bfloat16,torch.float4_e2m1fn_x2,torch.float4_e2m1fn_x2,QuantType.per_1x32,1,0,64,0,120.9988,flydsl_moe1_afp4_wfp4_bf16_t64x128x256_w3_xcd4_fp4,0.8%,425.95,13317.48
stage1,256,64,4096,4096,32,8,ActivationType.Swiglu,torch.bfloat16,torch.float4_e2m1fn_x2,torch.float4_e2m1fn_x2,QuantType.per_1x32,1,0,64,0,113.3419,flydsl_moe1_afp4_wfp4_bf16_t64x128x256_w4_bnt0,0.0%,454.73,14217.15
stage1,256,64,4096,4096,32,8,ActivationType.Swiglu,torch.bfloat16,torch.float4_e2m1fn_x2,torch.float4_e2m1fn_x2,QuantType.per_1x32,1,0,64,0,111.5721,flydsl_moe1_afp4_wfp4_bf16_t64x128x256_w4_bnt0_fp4,0.8%,461.94,14442.67
stage1,256,64,4096,4096,32,8,ActivationType.Swiglu,torch.bfloat16,torch.float4_e2m1fn_x2,torch.float4_e2m1fn_x2,QuantType.per_1x32,1,0,64,0,128.4977,flydsl_moe1_afp4_wfp4_bf16_t64x128x256_w4_bnt0_xcd4,0.0%,401.09,12540.3
stage1,256,64,4096,4096,32,8,ActivationType.Swiglu,torch.bfloat16,torch.float4_e2m1fn_x2,torch.float4_e2m1fn_x2,QuantType.per_1x32,1,0,64,0,127.7258,flydsl_moe1_afp4_wfp4_bf16_t64x128x256_w4_bnt0_xcd4_fp4,0.8%,403.52,12616.08
stage1,256,64,4096,4096,32,8,ActivationType.Swiglu,torch.bfloat16,torch.float4_e2m1fn_x2,torch.float4_e2m1fn_x2,QuantType.per_1x32,1,0,64,0,105.2605,flydsl_moe1_afp4_wfp4_bf16_t64x128x256_w4,0.0%,489.64,15308.68
stage1,256,64,4096,4096,32,8,ActivationType.Swiglu,torch.bfloat16,torch.float4_e2m1fn_x2,torch.float4_e2m1fn_x2,QuantType.per_1x32,1,0,64,0,106.5936,flydsl_moe1_afp4_wfp4_bf16_t64x128x256_w4_fp4,0.8%,483.52,15117.22
stage1,256,64,4096,4096,32,8,ActivationType.Swiglu,torch.bfloat16,torch.float4_e2m1fn_x2,torch.float4_e2m1fn_x2,QuantType.per_1x32,1,0,64,0,121.3828,flydsl_moe1_afp4_wfp4_bf16_t64x128x256_w4_xcd4,0.0%,424.6,13275.35
stage1,256,64,4096,4096,32,8,ActivationType.Swiglu,torch.bfloat16,torch.float4_e2m1fn_x2,torch.float4_e2m1fn_x2,QuantType.per_1x32,1,0,64,0,121.5192,flydsl_moe1_afp4_wfp4_bf16_t64x128x256_w4_xcd4_fp4,0.8%,424.13,13260.45
stage2,256,64,4096,4096,32,8,ActivationType.Swiglu,torch.bfloat16,torch.float4_e2m1fn_x2,torch.float4_e2m1fn_x2,QuantType.per_1x32,1,0,64,0,65.537,flydsl_moe2_afp4_wfp4_bf16_t32x128x256_atomic_sbm64,9.2%,786.42,24587.62
stage2,256,64,4096,4096,32,8,ActivationType.Swiglu,torch.bfloat16,torch.float4_e2m1fn_x2,torch.float4_e2m1fn_x2,QuantType.per_1x32,1,0,64,0,62.3464,flydsl_moe2_afp4_wfp4_bf16_t32x128x256_atomic_persist_sbm64,9.1%,826.67,25845.91
stage2,256,64,4096,4096,32,8,ActivationType.Swiglu,torch.bfloat16,torch.float4_e2m1fn_x2,torch.float4_e2m1fn_x2,QuantType.per_1x32,1,0,64,0,76.2333,flydsl_moe2_afp4_wfp4_bf16_t32x128x256_atomic_xcd4_sbm64,9.3%,676.08,21137.73
stage2,256,64,4096,4096,32,8,ActivationType.Swiglu,torch.bfloat16,torch.float4_e2m1fn_x2,torch.float4_e2m1fn_x2,QuantType.per_1x32,1,0,64,0,206.4319,flydsl_moe2_afp4_wfp4_bf16_t32x128x256_atomic_xcd4_persist_sbm64,9.2%,249.67,7805.96
stage2,256,64,4096,4096,32,8,ActivationType.Swiglu,torch.bfloat16,torch.float4_e2m1fn_x2,torch.float4_e2m1fn_x2,QuantType.per_1x32,1,0,64,0,63.6929,flydsl_moe2_afp4_wfp4_bf16_t32x128x256_atomic_bnt2_sbm64,9.2%,809.19,25299.51
stage2,256,64,4096,4096,32,8,ActivationType.Swiglu,torch.bfloat16,torch.float4_e2m1fn_x2,torch.float4_e2m1fn_x2,QuantType.per_1x32,1,0,64,0,59.8822,flydsl_moe2_afp4_wfp4_bf16_t32x128x256_atomic_bnt2_persist_sbm64,9.2%,860.68,26909.49
stage2,256,64,4096,4096,32,8,ActivationType.Swiglu,torch.bfloat16,torch.float4_e2m1fn_x2,torch.float4_e2m1fn_x2,QuantType.per_1x32,1,0,64,0,76.8332,flydsl_moe2_afp4_wfp4_bf16_t32x128x256_atomic_bnt2_xcd4_sbm64,9.3%,670.8,20972.69
stage2,256,64,4096,4096,32,8,ActivationType.Swiglu,torch.bfloat16,torch.float4_e2m1fn_x2,torch.float4_e2m1fn_x2,QuantType.per_1x32,1,0,64,0,205.6705,flydsl_moe2_afp4_wfp4_bf16_t32x128x256_atomic_bnt2_xcd4_persist_sbm64,9.2%,250.59,7834.86
stage2,256,64,4096,4096,32,8,ActivationType.Swiglu,torch.bfloat16,torch.float4_e2m1fn_x2,torch.float4_e2m1fn_x2,QuantType.per_1x32,1,0,64,0,65.4555,flydsl_moe2_afp4_wfp4_bf16_t32x128x256_reduce_sbm64,3.8%,787.4,24618.24
stage2,256,64,4096,4096,32,8,ActivationType.Swiglu,torch.bfloat16,torch.float4_e2m1fn_x2,torch.float4_e2m1fn_x2,QuantType.per_1x32,1,0,64,0,62.9344,flydsl_moe2_afp4_wfp4_bf16_t32x128x256_reduce_persist_sbm64,3.8%,818.94,25604.43
stage2,256,64,4096,4096,32,8,ActivationType.Swiglu,torch.bfloat16,torch.float4_e2m1fn_x2,torch.float4_e2m1fn_x2,QuantType.per_1x32,1,0,64,0,77.2351,flydsl_moe2_afp4_wfp4_bf16_t32x128x256_reduce_xcd4_sbm64,3.8%,667.31,20863.56
stage2,256,64,4096,4096,32,8,ActivationType.Swiglu,torch.bfloat16,torch.float4_e2m1fn_x2,torch.float4_e2m1fn_x2,QuantType.per_1x32,1,0,64,0,206.6651,flydsl_moe2_afp4_wfp4_bf16_t32x128x256_reduce_xcd4_persist_sbm64,3.8%,249.39,7797.15
stage2,256,64,4096,4096,32,8,ActivationType.Swiglu,torch.bfloat16,torch.float4_e2m1fn_x2,torch.float4_e2m1fn_x2,QuantType.per_1x32,1,0,64,0,65.2818,flydsl_moe2_afp4_wfp4_bf16_t32x128x256_reduce_bnt2_sbm64,3.8%,789.49,24683.74
stage2,256,64,4096,4096,32,8,ActivationType.Swiglu,torch.bfloat16,torch.float4_e2m1fn_x2,torch.float4_e2m1fn_x2,QuantType.per_1x32,1,0,64,0,60.9442,flydsl_moe2_afp4_wfp4_bf16_t32x128x256_reduce_bnt2_persist_sbm64,3.8%,845.69,26440.57
stage2,256,64,4096,4096,32,8,ActivationType.Swiglu,torch.bfloat16,torch.float4_e2m1fn_x2,torch.float4_e2m1fn_x2,QuantType.per_1x32,1,0,64,0,75.8456,flydsl_moe2_afp4_wfp4_bf16_t32x128x256_reduce_bnt2_xcd4_sbm64,3.8%,679.53,21245.78
stage2,256,64,4096,4096,32,8,ActivationType.Swiglu,torch.bfloat16,torch.float4_e2m1fn_x2,torch.float4_e2m1fn_x2,QuantType.per_1x32,1,0,64,0,206.2634,flydsl_moe2_afp4_wfp4_bf16_t32x128x256_reduce_bnt2_xcd4_persist_sbm64,3.8%,249.87,7812.34
stage2,256,64,4096,4096,32,8,ActivationType.Swiglu,torch.bfloat16,torch.float4_e2m1fn_x2,torch.float4_e2m1fn_x2,QuantType.per_1x32,1,0,64,0,69.7477,flydsl_moe2_afp4_wfp4_bf16_t32x256x256_atomic_sbm64,9.2%,738.94,23103.26
stage2,256,64,4096,4096,32,8,ActivationType.Swiglu,torch.bfloat16,torch.float4_e2m1fn_x2,torch.float4_e2m1fn_x2,QuantType.per_1x32,1,0,64,0,68.0333,flydsl_moe2_afp4_wfp4_bf16_t32x256x256_atomic_persist_sbm64,9.2%,757.56,23685.45
stage2,256,64,4096,4096,32,8,ActivationType.Swiglu,torch.bfloat16,torch.float4_e2m1fn_x2,torch.float4_e2m1fn_x2,QuantType.per_1x32,1,0,64,0,81.536,flydsl_moe2_afp4_wfp4_bf16_t32x256x256_atomic_xcd4_sbm64,9.2%,632.11,19763.04
stage2,256,64,4096,4096,32,8,ActivationType.Swiglu,torch.bfloat16,torch.float4_e2m1fn_x2,torch.float4_e2m1fn_x2,QuantType.per_1x32,1,0,64,0,195.3334,flydsl_moe2_afp4_wfp4_bf16_t32x256x256_atomic_xcd4_persist_sbm64,9.2%,263.85,8249.48
stage2,256,64,4096,4096,32,8,ActivationType.Swiglu,torch.bfloat16,torch.float4_e2m1fn_x2,torch.float4_e2m1fn_x2,QuantType.per_1x32,1,0,64,0,67.5102,flydsl_moe2_afp4_wfp4_bf16_t32x256x256_atomic_bnt2_sbm64,9.2%,763.43,23868.97
stage2,256,64,4096,4096,32,8,ActivationType.Swiglu,torch.bfloat16,torch.float4_e2m1fn_x2,torch.float4_e2m1fn_x2,QuantType.per_1x32,1,0,64,0,66.8736,flydsl_moe2_afp4_wfp4_bf16_t32x256x256_atomic_bnt2_persist_sbm64,9.2%,770.7,24096.19
stage2,256,64,4096,4096,32,8,ActivationType.Swiglu,torch.bfloat16,torch.float4_e2m1fn_x2,torch.float4_e2m1fn_x2,QuantType.per_1x32,1,0,64,0,80.3308,flydsl_moe2_afp4_wfp4_bf16_t32x256x256_atomic_bnt2_xcd4_sbm64,9.2%,641.59,20059.54
stage2,256,64,4096,4096,32,8,ActivationType.Swiglu,torch.bfloat16,torch.float4_e2m1fn_x2,torch.float4_e2m1fn_x2,QuantType.per_1x32,1,0,64,0,195.4982,flydsl_moe2_afp4_wfp4_bf16_t32x256x256_atomic_bnt2_xcd4_persist_sbm64,9.2%,263.63,8242.53
stage2,256,64,4096,4096,32,8,ActivationType.Swiglu,torch.bfloat16,torch.float4_e2m1fn_x2,torch.float4_e2m1fn_x2,QuantType.per_1x32,1,0,64,0,70.5041,flydsl_moe2_afp4_wfp4_bf16_t32x256x256_reduce_sbm64,3.8%,731.02,22855.4
stage2,256,64,4096,4096,32,8,ActivationType.Swiglu,torch.bfloat16,torch.float4_e2m1fn_x2,torch.float4_e2m1fn_x2,QuantType.per_1x32,1,0,64,0,76.5182,flydsl_moe2_afp4_wfp4_bf16_t32x256x256_reduce_persist_sbm64,3.8%,673.56,21059.03
stage2,256,64,4096,4096,32,8,ActivationType.Swiglu,torch.bfloat16,torch.float4_e2m1fn_x2,torch.float4_e2m1fn_x2,QuantType.per_1x32,1,0,64,0,82.2343,flydsl_moe2_afp4_wfp4_bf16_t32x256x256_reduce_xcd4_sbm64,3.8%,626.74,19595.22
stage2,256,64,4096,4096,32,8,ActivationType.Swiglu,torch.bfloat16,torch.float4_e2m1fn_x2,torch.float4_e2m1fn_x2,QuantType.per_1x32,1,0,64,0,198.6981,flydsl_moe2_afp4_wfp4_bf16_t32x256x256_reduce_xcd4_persist_sbm64,3.8%,259.39,8109.79
stage2,256,64,4096,4096,32,8,ActivationType.Swiglu,torch.bfloat16,torch.float4_e2m1fn_x2,torch.float4_e2m1fn_x2,QuantType.per_1x32,1,0,64,0,68.38,flydsl_moe2_afp4_wfp4_bf16_t32x256x256_reduce_bnt2_sbm64,3.8%,753.72,23565.36
stage2,256,64,4096,4096,32,8,ActivationType.Swiglu,torch.bfloat16,torch.float4_e2m1fn_x2,torch.float4_e2m1fn_x2,QuantType.per_1x32,1,0,64,0,75.0605,flydsl_moe2_afp4_wfp4_bf16_t32x256x256_reduce_bnt2_persist_sbm64,3.8%,686.64,21468.0
stage2,256,64,4096,4096,32,8,ActivationType.Swiglu,torch.bfloat16,torch.float4_e2m1fn_x2,torch.float4_e2m1fn_x2,QuantType.per_1x32,1,0,64,0,81.3771,flydsl_moe2_afp4_wfp4_bf16_t32x256x256_reduce_bnt2_xcd4_sbm64,3.8%,633.34,19801.63
stage2,256,64,4096,4096,32,8,ActivationType.Swiglu,torch.bfloat16,torch.float4_e2m1fn_x2,torch.float4_e2m1fn_x2,QuantType.per_1x32,1,0,64,0,198.3113,flydsl_moe2_afp4_wfp4_bf16_t32x256x256_reduce_bnt2_xcd4_persist_sbm64,3.8%,259.89,8125.6
stage2,256,64,4096,4096,32,8,ActivationType.Swiglu,torch.bfloat16,torch.float4_e2m1fn_x2,torch.float4_e2m1fn_x2,QuantType.per_1x32,1,0,64,0,60.2601,flydsl_moe2_afp4_wfp4_bf16_t64x128x256_atomic,9.2%,855.29,26740.73
stage2,256,64,4096,4096,32,8,ActivationType.Swiglu,torch.bfloat16,torch.float4_e2m1fn_x2,torch.float4_e2m1fn_x2,QuantType.per_1x32,1,0,64,0,63.8114,flydsl_moe2_afp4_wfp4_bf16_t64x128x256_atomic_persist,9.3%,807.69,25252.53
stage2,256,64,4096,4096,32,8,ActivationType.Swiglu,torch.bfloat16,torch.float4_e2m1fn_x2,torch.float4_e2m1fn_x2,QuantType.per_1x32,1,0,64,0,59.6063,flydsl_moe2_afp4_wfp4_bf16_t64x128x256_atomic_xcd4,9.3%,864.67,27034.04
stage2,256,64,4096,4096,32,8,ActivationType.Swiglu,torch.bfloat16,torch.float4_e2m1fn_x2,torch.float4_e2m1fn_x2,QuantType.per_1x32,1,0,64,0,273.5862,flydsl_moe2_afp4_wfp4_bf16_t64x128x256_atomic_xcd4_persist,9.3%,188.39,5889.91
stage2,256,64,4096,4096,32,8,ActivationType.Swiglu,torch.bfloat16,torch.float4_e2m1fn_x2,torch.float4_e2m1fn_x2,QuantType.per_1x32,1,0,64,0,57.794,flydsl_moe2_afp4_wfp4_bf16_t64x128x256_atomic_bnt2,9.3%,891.78,27881.77
stage2,256,64,4096,4096,32,8,ActivationType.Swiglu,torch.bfloat16,torch.float4_e2m1fn_x2,torch.float4_e2m1fn_x2,QuantType.per_1x32,1,0,64,0,62.5667,flydsl_moe2_afp4_wfp4_bf16_t64x128x256_atomic_bnt2_persist,9.3%,823.75,25754.9
stage2,256,64,4096,4096,32,8,ActivationType.Swiglu,torch.bfloat16,torch.float4_e2m1fn_x2,torch.float4_e2m1fn_x2,QuantType.per_1x32,1,0,64,0,59.3653,flydsl_moe2_afp4_wfp4_bf16_t64x128x256_atomic_bnt2_xcd4,9.3%,868.18,27143.79
stage2,256,64,4096,4096,32,8,ActivationType.Swiglu,torch.bfloat16,torch.float4_e2m1fn_x2,torch.float4_e2m1fn_x2,QuantType.per_1x32,1,0,64,0,272.4315,flydsl_moe2_afp4_wfp4_bf16_t64x128x256_atomic_bnt2_xcd4_persist,9.3%,189.18,5914.88
stage2,256,64,4096,4096,32,8,ActivationType.Swiglu,torch.bfloat16,torch.float4_e2m1fn_x2,torch.float4_e2m1fn_x2,QuantType.per_1x32,1,0,64,0,60.6772,flydsl_moe2_afp4_wfp4_bf16_t64x128x256_reduce,3.8%,849.41,26556.91
stage2,256,64,4096,4096,32,8,ActivationType.Swiglu,torch.bfloat16,torch.float4_e2m1fn_x2,torch.float4_e2m1fn_x2,QuantType.per_1x32,1,0,64,0,70.159,flydsl_moe2_afp4_wfp4_bf16_t64x128x256_reduce_persist,3.8%,734.61,22967.82
stage2,256,64,4096,4096,32,8,ActivationType.Swiglu,torch.bfloat16,torch.float4_e2m1fn_x2,torch.float4_e2m1fn_x2,QuantType.per_1x32,1,0,64,0,60.5553,flydsl_moe2_afp4_wfp4_bf16_t64x128x256_reduce_xcd4,3.8%,851.12,26610.37
stage2,256,64,4096,4096,32,8,ActivationType.Swiglu,torch.bfloat16,torch.float4_e2m1fn_x2,torch.float4_e2m1fn_x2,QuantType.per_1x32,1,0,64,0,272.8835,flydsl_moe2_afp4_wfp4_bf16_t64x128x256_reduce_xcd4_persist,3.8%,188.87,5905.08
stage2,256,64,4096,4096,32,8,ActivationType.Swiglu,torch.bfloat16,torch.float4_e2m1fn_x2,torch.float4_e2m1fn_x2,QuantType.per_1x32,1,0,64,0,59.0197,flydsl_moe2_afp4_wfp4_bf16_t64x128x256_reduce_bnt2,3.8%,873.26,27302.73
stage2,256,64,4096,4096,32,8,ActivationType.Swiglu,torch.bfloat16,torch.float4_e2m1fn_x2,torch.float4_e2m1fn_x2,QuantType.per_1x32,1,0,64,0,69.0786,flydsl_moe2_afp4_wfp4_bf16_t64x128x256_reduce_bnt2_persist,3.8%,746.1,23327.04
stage2,256,64,4096,4096,32,8,ActivationType.Swiglu,torch.bfloat16,torch.float4_e2m1fn_x2,torch.float4_e2m1fn_x2,QuantType.per_1x32,1,0,64,0,60.1911,flydsl_moe2_afp4_wfp4_bf16_t64x128x256_reduce_bnt2_xcd4,3.8%,856.27,26771.39
stage2,256,64,4096,4096,32,8,ActivationType.Swiglu,torch.bfloat16,torch.float4_e2m1fn_x2,torch.float4_e2m1fn_x2,QuantType.per_1x32,1,0,64,0,271.1495,flydsl_moe2_afp4_wfp4_bf16_t64x128x256_reduce_bnt2_xcd4_persist,3.8%,190.08,5942.84
stage2,256,64,4096,4096,32,8,ActivationType.Swiglu,torch.bfloat16,torch.float4_e2m1fn_x2,torch.float4_e2m1fn_x2,QuantType.per_1x32,1,0,64,0,67.7293,flydsl_moe2_afp4_wfp4_bf16_t64x256x256_atomic,9.2%,760.96,23791.76
stage2,256,64,4096,4096,32,8,ActivationType.Swiglu,torch.bfloat16,torch.float4_e2m1fn_x2,torch.float4_e2m1fn_x2,QuantType.per_1x32,1,0,64,0,72.5652,flydsl_moe2_afp4_wfp4_bf16_t64x256x256_atomic_persist,9.2%,710.25,22206.23
stage2,256,64,4096,4096,32,8,ActivationType.Swiglu,torch.bfloat16,torch.float4_e2m1fn_x2,torch.float4_e2m1fn_x2,QuantType.per_1x32,1,0,64,0,64.8653,flydsl_moe2_afp4_wfp4_bf16_t64x256x256_atomic_xcd4,9.2%,794.56,24842.24
stage2,256,64,4096,4096,32,8,ActivationType.Swiglu,torch.bfloat16,torch.float4_e2m1fn_x2,torch.float4_e2m1fn_x2,QuantType.per_1x32,1,0,64,0,253.735,flydsl_moe2_afp4_wfp4_bf16_t64x256x256_atomic_xcd4_persist,9.3%,203.12,6350.72
stage2,256,64,4096,4096,32,8,ActivationType.Swiglu,torch.bfloat16,torch.float4_e2m1fn_x2,torch.float4_e2m1fn_x2,QuantType.per_1x32,1,0,64,0,66.1344,flydsl_moe2_afp4_wfp4_bf16_t64x256x256_atomic_bnt2,9.2%,779.32,24365.52
stage2,256,64,4096,4096,32,8,ActivationType.Swiglu,torch.bfloat16,torch.float4_e2m1fn_x2,torch.float4_e2m1fn_x2,QuantType.per_1x32,1,0,64,0,71.4794,flydsl_moe2_afp4_wfp4_bf16_t64x256x256_atomic_bnt2_persist,9.2%,721.04,22543.55
stage2,256,64,4096,4096,32,8,ActivationType.Swiglu,torch.bfloat16,torch.float4_e2m1fn_x2,torch.float4_e2m1fn_x2,QuantType.per_1x32,1,0,64,0,63.7245,flydsl_moe2_afp4_wfp4_bf16_t64x256x256_atomic_bnt2_xcd4,9.2%,808.79,25286.96
stage2,256,64,4096,4096,32,8,ActivationType.Swiglu,torch.bfloat16,torch.float4_e2m1fn_x2,torch.float4_e2m1fn_x2,QuantType.per_1x32,1,0,64,0,253.1365,flydsl_moe2_afp4_wfp4_bf16_t64x256x256_atomic_bnt2_xcd4_persist,9.3%,203.6,6365.73
stage2,256,64,4096,4096,32,8,ActivationType.Swiglu,torch.bfloat16,torch.float4_e2m1fn_x2,torch.float4_e2m1fn_x2,QuantType.per_1x32,1,0,64,0,68.909,flydsl_moe2_afp4_wfp4_bf16_t64x256x256_reduce,3.8%,747.94,23384.45
stage2,256,64,4096,4096,32,8,ActivationType.Swiglu,torch.bfloat16,torch.float4_e2m1fn_x2,torch.float4_e2m1fn_x2,QuantType.per_1x32,1,0,64,0,72.9683,flydsl_moe2_afp4_wfp4_bf16_t64x256x256_reduce_persist,3.8%,706.33,22083.55
stage2,256,64,4096,4096,32,8,ActivationType.Swiglu,torch.bfloat16,torch.float4_e2m1fn_x2,torch.float4_e2m1fn_x2,QuantType.per_1x32,1,0,64,0,65.7887,flydsl_moe2_afp4_wfp4_bf16_t64x256x256_reduce_xcd4,3.8%,783.41,24493.56
stage2,256,64,4096,4096,32,8,ActivationType.Swiglu,torch.bfloat16,torch.float4_e2m1fn_x2,torch.float4_e2m1fn_x2,QuantType.per_1x32,1,0,64,0,256.6985,flydsl_moe2_afp4_wfp4_bf16_t64x256x256_reduce_xcd4_persist,3.8%,200.78,6277.4
stage2,256,64,4096,4096,32,8,ActivationType.Swiglu,torch.bfloat16,torch.float4_e2m1fn_x2,torch.float4_e2m1fn_x2,QuantType.per_1x32,1,0,64,0,65.6988,flydsl_moe2_afp4_wfp4_bf16_t64x256x256_reduce_bnt2,3.8%,784.48,24527.07
stage2,256,64,4096,4096,32,8,ActivationType.Swiglu,torch.bfloat16,torch.float4_e2m1fn_x2,torch.float4_e2m1fn_x2,QuantType.per_1x32,1,0,64,0,70.9405,flydsl_moe2_afp4_wfp4_bf16_t64x256x256_reduce_bnt2_persist,3.8%,726.52,22714.8
stage2,256,64,4096,4096,32,8,ActivationType.Swiglu,torch.bfloat16,torch.float4_e2m1fn_x2,torch.float4_e2m1fn_x2,QuantType.per_1x32,1,0,64,0,64.342,flydsl_moe2_afp4_wfp4_bf16_t64x256x256_reduce_bnt2_xcd4,3.8%,801.03,25044.28
stage2,256,64,4096,4096,32,8,ActivationType.Swiglu,torch.bfloat16,torch.float4_e2m1fn_x2,torch.float4_e2m1fn_x2,QuantType.per_1x32,1,0,64,0,255.2121,flydsl_moe2_afp4_wfp4_bf16_t64x256x256_reduce_bnt2_xcd4_persist,3.8%,201.95,6313.96
stage1,256,64,4096,4096,32,8,ActivationType.Swiglu,torch.bfloat16,torch.float4_e2m1fn_x2,torch.float4_e2m1fn_x2,QuantType.per_1x32,1,0,128,0,158.2964,flydsl_moe1_afp4_wfp4_bf16_t128x64x256_bnt0,0.0%,325.59,10179.63
stage1,256,64,4096,4096,32,8,ActivationType.Swiglu,torch.bfloat16,torch.float4_e2m1fn_x2,torch.float4_e2m1fn_x2,QuantType.per_1x32,1,0,128,0,163.7216,flydsl_moe1_afp4_wfp4_bf16_t128x64x256_bnt0_fp4,0.8%,314.8,9842.31
stage1,256,64,4096,4096,32,8,ActivationType.Swiglu,torch.bfloat16,torch.float4_e2m1fn_x2,torch.float4_e2m1fn_x2,QuantType.per_1x32,1,0,128,0,188.7197,flydsl_moe1_afp4_wfp4_bf16_t128x64x256_bnt0_xcd4,0.0%,273.1,8538.58
stage1,256,64,4096,4096,32,8,ActivationType.Swiglu,torch.bfloat16,torch.float4_e2m1fn_x2,torch.float4_e2m1fn_x2,QuantType.per_1x32,1,0,128,0,199.7273,flydsl_moe1_afp4_wfp4_bf16_t128x64x256_bnt0_xcd4_fp4,0.8%,258.05,8068.0
stage1,256,64,4096,4096,32,8,ActivationType.Swiglu,torch.bfloat16,torch.float4_e2m1fn_x2,torch.float4_e2m1fn_x2,QuantType.per_1x32,1,0,128,0,155.0758,flydsl_moe1_afp4_wfp4_bf16_t128x64x256,0.0%,332.35,10391.04
stage1,256,64,4096,4096,32,8,ActivationType.Swiglu,torch.bfloat16,torch.float4_e2m1fn_x2,torch.float4_e2m1fn_x2,QuantType.per_1x32,1,0,128,0,164.7495,flydsl_moe1_afp4_wfp4_bf16_t128x64x256_fp4,0.8%,312.84,9780.9
stage1,256,64,4096,4096,32,8,ActivationType.Swiglu,torch.bfloat16,torch.float4_e2m1fn_x2,torch.float4_e2m1fn_x2,QuantType.per_1x32,1,0,128,0,178.7724,flydsl_moe1_afp4_wfp4_bf16_t128x64x256_xcd4,0.0%,288.3,9013.69
stage1,256,64,4096,4096,32,8,ActivationType.Swiglu,torch.bfloat16,torch.float4_e2m1fn_x2,torch.float4_e2m1fn_x2,QuantType.per_1x32,1,0,128,0,191.2859,flydsl_moe1_afp4_wfp4_bf16_t128x64x256_xcd4_fp4,0.8%,269.44,8424.04
stage1,256,64,4096,4096,32,8,ActivationType.Swiglu,torch.bfloat16,torch.float4_e2m1fn_x2,torch.float4_e2m1fn_x2,QuantType.per_1x32,1,0,128,0,116.6584,flydsl_moe1_afp4_wfp4_bf16_t128x64x256_w2_bnt0,0.0%,441.8,13812.97
stage1,256,64,4096,4096,32,8,ActivationType.Swiglu,torch.bfloat16,torch.float4_e2m1fn_x2,torch.float4_e2m1fn_x2,QuantType.per_1x32,1,0,128,0,119.9732,flydsl_moe1_afp4_wfp4_bf16_t128x64x256_w2_bnt0_fp4,0.8%,429.59,13431.33
stage1,256,64,4096,4096,32,8,ActivationType.Swiglu,torch.bfloat16,torch.float4_e2m1fn_x2,torch.float4_e2m1fn_x2,QuantType.per_1x32,1,0,128,0,150.4427,flydsl_moe1_afp4_wfp4_bf16_t128x64x256_w2_bnt0_xcd4,0.0%,342.59,10711.05
stage1,256,64,4096,4096,32,8,ActivationType.Swiglu,torch.bfloat16,torch.float4_e2m1fn_x2,torch.float4_e2m1fn_x2,QuantType.per_1x32,1,0,128,0,154.7224,flydsl_moe1_afp4_wfp4_bf16_t128x64x256_w2_bnt0_xcd4_fp4,0.8%,333.11,10414.78
stage1,256,64,4096,4096,32,8,ActivationType.Swiglu,torch.bfloat16,torch.float4_e2m1fn_x2,torch.float4_e2m1fn_x2,QuantType.per_1x32,1,0,128,0,113.3414,flydsl_moe1_afp4_wfp4_bf16_t128x64x256_w2,0.0%,454.73,14217.22
stage1,256,64,4096,4096,32,8,ActivationType.Swiglu,torch.bfloat16,torch.float4_e2m1fn_x2,torch.float4_e2m1fn_x2,QuantType.per_1x32,1,0,128,0,117.1562,flydsl_moe1_afp4_wfp4_bf16_t128x64x256_w2_fp4,0.8%,439.92,13754.28
stage1,256,64,4096,4096,32,8,ActivationType.Swiglu,torch.bfloat16,torch.float4_e2m1fn_x2,torch.float4_e2m1fn_x2,QuantType.per_1x32,1,0,128,0,143.9248,flydsl_moe1_afp4_wfp4_bf16_t128x64x256_w2_xcd4,0.0%,358.1,11196.12
stage1,256,64,4096,4096,32,8,ActivationType.Swiglu,torch.bfloat16,torch.float4_e2m1fn_x2,torch.float4_e2m1fn_x2,QuantType.per_1x32,1,0,128,0,147.7998,flydsl_moe1_afp4_wfp4_bf16_t128x64x256_w2_xcd4_fp4,0.8%,348.71,10902.58
stage1,256,64,4096,4096,32,8,ActivationType.Swiglu,torch.bfloat16,torch.float4_e2m1fn_x2,torch.float4_e2m1fn_x2,QuantType.per_1x32,1,0,128,0,117.4704,flydsl_moe1_afp4_wfp4_bf16_t128x64x256_w3_bnt0,0.0%,438.75,13717.49
stage1,256,64,4096,4096,32,8,ActivationType.Swiglu,torch.bfloat16,torch.float4_e2m1fn_x2,torch.float4_e2m1fn_x2,QuantType.per_1x32,1,0,128,0,121.7146,flydsl_moe1_afp4_wfp4_bf16_t128x64x256_w3_bnt0_fp4,0.8%,423.45,13239.16
stage1,256,64,4096,4096,32,8,ActivationType.Swiglu,torch.bfloat16,torch.float4_e2m1fn_x2,torch.float4_e2m1fn_x2,QuantType.per_1x32,1,0,128,0,150.4987,flydsl_moe1_afp4_wfp4_bf16_t128x64x256_w3_bnt0_xcd4,0.0%,342.46,10707.06
stage1,256,64,4096,4096,32,8,ActivationType.Swiglu,torch.bfloat16,torch.float4_e2m1fn_x2,torch.float4_e2m1fn_x2,QuantType.per_1x32,1,0,128,0,154.9383,flydsl_moe1_afp4_wfp4_bf16_t128x64x256_w3_bnt0_xcd4_fp4,0.8%,332.65,10400.26
stage1,256,64,4096,4096,32,8,ActivationType.Swiglu,torch.bfloat16,torch.float4_e2m1fn_x2,torch.float4_e2m1fn_x2,QuantType.per_1x32,1,0,128,0,112.2612,flydsl_moe1_afp4_wfp4_bf16_t128x64x256_w3,0.0%,459.1,14354.02
stage1,256,64,4096,4096,32,8,ActivationType.Swiglu,torch.bfloat16,torch.float4_e2m1fn_x2,torch.float4_e2m1fn_x2,QuantType.per_1x32,1,0,128,0,119.846,flydsl_moe1_afp4_wfp4_bf16_t128x64x256_w3_fp4,0.8%,430.05,13445.58
stage1,256,64,4096,4096,32,8,ActivationType.Swiglu,torch.bfloat16,torch.float4_e2m1fn_x2,torch.float4_e2m1fn_x2,QuantType.per_1x32,1,0,128,0,142.9742,flydsl_moe1_afp4_wfp4_bf16_t128x64x256_w3_xcd4,0.0%,360.48,11270.56
stage1,256,64,4096,4096,32,8,ActivationType.Swiglu,torch.bfloat16,torch.float4_e2m1fn_x2,torch.float4_e2m1fn_x2,QuantType.per_1x32,1,0,128,0,147.9026,flydsl_moe1_afp4_wfp4_bf16_t128x64x256_w3_xcd4_fp4,0.8%,348.47,10895.0
stage1,256,64,4096,4096,32,8,ActivationType.Swiglu,torch.bfloat16,torch.float4_e2m1fn_x2,torch.float4_e2m1fn_x2,QuantType.per_1x32,1,0,128,0,125.0651,flydsl_moe1_afp4_wfp4_bf16_t128x64x256_w4_bnt0,0.0%,412.1,12884.48
stage1,256,64,4096,4096,32,8,ActivationType.Swiglu,torch.bfloat16,torch.float4_e2m1fn_x2,torch.float4_e2m1fn_x2,QuantType.per_1x32,1,0,128,0,120.7904,flydsl_moe1_afp4_wfp4_bf16_t128x64x256_w4_bnt0_fp4,0.8%,426.69,13340.46
stage1,256,64,4096,4096,32,8,ActivationType.Swiglu,torch.bfloat16,torch.float4_e2m1fn_x2,torch.float4_e2m1fn_x2,QuantType.per_1x32,1,0,128,0,151.0901,flydsl_moe1_afp4_wfp4_bf16_t128x64x256_w4_bnt0_xcd4,0.0%,341.12,10665.15
stage1,256,64,4096,4096,32,8,ActivationType.Swiglu,torch.bfloat16,torch.float4_e2m1fn_x2,torch.float4_e2m1fn_x2,QuantType.per_1x32,1,0,128,0,154.8743,flydsl_moe1_afp4_wfp4_bf16_t128x64x256_w4_bnt0_xcd4_fp4,0.8%,332.78,10404.56
stage1,256,64,4096,4096,32,8,ActivationType.Swiglu,torch.bfloat16,torch.float4_e2m1fn_x2,torch.float4_e2m1fn_x2,QuantType.per_1x32,1,0,128,0,112.3982,flydsl_moe1_afp4_wfp4_bf16_t128x64x256_w4,0.0%,458.54,14336.52
stage1,256,64,4096,4096,32,8,ActivationType.Swiglu,torch.bfloat16,torch.float4_e2m1fn_x2,torch.float4_e2m1fn_x2,QuantType.per_1x32,1,0,128,0,119.6754,flydsl_moe1_afp4_wfp4_bf16_t128x64x256_w4_fp4,0.8%,430.66,13464.75
stage1,256,64,4096,4096,32,8,ActivationType.Swiglu,torch.bfloat16,torch.float4_e2m1fn_x2,torch.float4_e2m1fn_x2,QuantType.per_1x32,1,0,128,0,143.2505,flydsl_moe1_afp4_wfp4_bf16_t128x64x256_w4_xcd4,0.0%,359.79,11248.82
stage1,256,64,4096,4096,32,8,ActivationType.Swiglu,torch.bfloat16,torch.float4_e2m1fn_x2,torch.float4_e2m1fn_x2,QuantType.per_1x32,1,0,128,0,147.5553,flydsl_moe1_afp4_wfp4_bf16_t128x64x256_w4_xcd4_fp4,0.8%,349.29,10920.65
stage1,256,64,4096,4096,32,8,ActivationType.Swiglu,torch.bfloat16,torch.float4_e2m1fn_x2,torch.float4_e2m1fn_x2,QuantType.per_1x32,1,0,128,0,125.6731,flydsl_moe1_afp4_wfp4_bf16_t128x128x256_bnt0,0.0%,410.11,12822.15
stage1,256,64,4096,4096,32,8,ActivationType.Swiglu,torch.bfloat16,torch.float4_e2m1fn_x2,torch.float4_e2m1fn_x2,QuantType.per_1x32,1,0,128,0,126.9086,flydsl_moe1_afp4_wfp4_bf16_t128x128x256_bnt0_fp4,0.8%,406.12,12697.32
stage1,256,64,4096,4096,32,8,ActivationType.Swiglu,torch.bfloat16,torch.float4_e2m1fn_x2,torch.float4_e2m1fn_x2,QuantType.per_1x32,1,0,128,0,155.8648,flydsl_moe1_afp4_wfp4_bf16_t128x128x256_bnt0_xcd4,0.0%,330.67,10338.44
stage1,256,64,4096,4096,32,8,ActivationType.Swiglu,torch.bfloat16,torch.float4_e2m1fn_x2,torch.float4_e2m1fn_x2,QuantType.per_1x32,1,0,128,0,157.3033,flydsl_moe1_afp4_wfp4_bf16_t128x128x256_bnt0_xcd4_fp4,0.8%,327.64,10243.9
stage1,256,64,4096,4096,32,8,ActivationType.Swiglu,torch.bfloat16,torch.float4_e2m1fn_x2,torch.float4_e2m1fn_x2,QuantType.per_1x32,1,0,128,0,121.08,flydsl_moe1_afp4_wfp4_bf16_t128x128x256,0.0%,425.67,13308.55
stage1,256,64,4096,4096,32,8,ActivationType.Swiglu,torch.bfloat16,torch.float4_e2m1fn_x2,torch.float4_e2m1fn_x2,QuantType.per_1x32,1,0,128,0,121.0687,flydsl_moe1_afp4_wfp4_bf16_t128x128x256_fp4,0.8%,425.71,13309.79
stage1,256,64,4096,4096,32,8,ActivationType.Swiglu,torch.bfloat16,torch.float4_e2m1fn_x2,torch.float4_e2m1fn_x2,QuantType.per_1x32,1,0,128,0,145.4531,flydsl_moe1_afp4_wfp4_bf16_t128x128x256_xcd4,0.0%,354.34,11078.48
stage1,256,64,4096,4096,32,8,ActivationType.Swiglu,torch.bfloat16,torch.float4_e2m1fn_x2,torch.float4_e2m1fn_x2,QuantType.per_1x32,1,0,128,0,145.9683,flydsl_moe1_afp4_wfp4_bf16_t128x128x256_xcd4_fp4,0.8%,353.09,11039.38
stage1,256,64,4096,4096,32,8,ActivationType.Swiglu,torch.bfloat16,torch.float4_e2m1fn_x2,torch.float4_e2m1fn_x2,QuantType.per_1x32,1,0,128,0,124.7269,flydsl_moe1_afp4_wfp4_bf16_t128x128x256_w2_bnt0,0.0%,413.22,12919.42
stage1,256,64,4096,4096,32,8,ActivationType.Swiglu,torch.bfloat16,torch.float4_e2m1fn_x2,torch.float4_e2m1fn_x2,QuantType.per_1x32,1,0,128,0,126.1386,flydsl_moe1_afp4_wfp4_bf16_t128x128x256_w2_bnt0_fp4,0.8%,408.6,12774.83
stage1,256,64,4096,4096,32,8,ActivationType.Swiglu,torch.bfloat16,torch.float4_e2m1fn_x2,torch.float4_e2m1fn_x2,QuantType.per_1x32,1,0,128,0,155.0899,flydsl_moe1_afp4_wfp4_bf16_t128x128x256_w2_bnt0_xcd4,0.0%,332.32,10390.1
stage1,256,64,4096,4096,32,8,ActivationType.Swiglu,torch.bfloat16,torch.float4_e2m1fn_x2,torch.float4_e2m1fn_x2,QuantType.per_1x32,1,0,128,0,157.6118,flydsl_moe1_afp4_wfp4_bf16_t128x128x256_w2_bnt0_xcd4_fp4,0.8%,327.0,10223.85
stage1,256,64,4096,4096,32,8,ActivationType.Swiglu,torch.bfloat16,torch.float4_e2m1fn_x2,torch.float4_e2m1fn_x2,QuantType.per_1x32,1,0,128,0,119.9975,flydsl_moe1_afp4_wfp4_bf16_t128x128x256_w2,0.0%,429.51,13428.61
stage1,256,64,4096,4096,32,8,ActivationType.Swiglu,torch.bfloat16,torch.float4_e2m1fn_x2,torch.float4_e2m1fn_x2,QuantType.per_1x32,1,0,128,0,120.7697,flydsl_moe1_afp4_wfp4_bf16_t128x128x256_w2_fp4,0.8%,426.76,13342.74
stage1,256,64,4096,4096,32,8,ActivationType.Swiglu,torch.bfloat16,torch.float4_e2m1fn_x2,torch.float4_e2m1fn_x2,QuantType.per_1x32,1,0,128,0,144.4234,flydsl_moe1_afp4_wfp4_bf16_t128x128x256_w2_xcd4,0.0%,356.86,11157.47
stage1,256,64,4096,4096,32,8,ActivationType.Swiglu,torch.bfloat16,torch.float4_e2m1fn_x2,torch.float4_e2m1fn_x2,QuantType.per_1x32,1,0,128,0,145.7002,flydsl_moe1_afp4_wfp4_bf16_t128x128x256_w2_xcd4_fp4,0.8%,353.74,11059.69
stage1,256,64,4096,4096,32,8,ActivationType.Swiglu,torch.bfloat16,torch.float4_e2m1fn_x2,torch.float4_e2m1fn_x2,QuantType.per_1x32,1,0,128,0,124.7524,flydsl_moe1_afp4_wfp4_bf16_t128x128x256_w3_bnt0,0.0%,413.14,12916.78
stage1,256,64,4096,4096,32,8,ActivationType.Swiglu,torch.bfloat16,torch.float4_e2m1fn_x2,torch.float4_e2m1fn_x2,QuantType.per_1x32,1,0,128,0,127.034,flydsl_moe1_afp4_wfp4_bf16_t128x128x256_w3_bnt0_fp4,0.8%,405.72,12684.79
stage1,256,64,4096,4096,32,8,ActivationType.Swiglu,torch.bfloat16,torch.float4_e2m1fn_x2,torch.float4_e2m1fn_x2,QuantType.per_1x32,1,0,128,0,153.9371,flydsl_moe1_afp4_wfp4_bf16_t128x128x256_w3_bnt0_xcd4,0.0%,334.81,10467.91
stage1,256,64,4096,4096,32,8,ActivationType.Swiglu,torch.bfloat16,torch.float4_e2m1fn_x2,torch.float4_e2m1fn_x2,QuantType.per_1x32,1,0,128,0,158.1676,flydsl_moe1_afp4_wfp4_bf16_t128x128x256_w3_bnt0_xcd4_fp4,0.8%,325.85,10187.92
stage1,256,64,4096,4096,32,8,ActivationType.Swiglu,torch.bfloat16,torch.float4_e2m1fn_x2,torch.float4_e2m1fn_x2,QuantType.per_1x32,1,0,128,0,119.3891,flydsl_moe1_afp4_wfp4_bf16_t128x128x256_w3,0.0%,431.69,13497.04
stage1,256,64,4096,4096,32,8,ActivationType.Swiglu,torch.bfloat16,torch.float4_e2m1fn_x2,torch.float4_e2m1fn_x2,QuantType.per_1x32,1,0,128,0,121.17,flydsl_moe1_afp4_wfp4_bf16_t128x128x256_w3_fp4,0.8%,425.35,13298.66
stage1,256,64,4096,4096,32,8,ActivationType.Swiglu,torch.bfloat16,torch.float4_e2m1fn_x2,torch.float4_e2m1fn_x2,QuantType.per_1x32,1,0,128,0,144.7986,flydsl_moe1_afp4_wfp4_bf16_t128x128x256_w3_xcd4,0.0%,355.94,11128.55
stage1,256,64,4096,4096,32,8,ActivationType.Swiglu,torch.bfloat16,torch.float4_e2m1fn_x2,torch.float4_e2m1fn_x2,QuantType.per_1x32,1,0,128,0,145.765,flydsl_moe1_afp4_wfp4_bf16_t128x128x256_w3_xcd4_fp4,0.8%,353.58,11054.77
stage1,256,64,4096,4096,32,8,ActivationType.Swiglu,torch.bfloat16,torch.float4_e2m1fn_x2,torch.float4_e2m1fn_x2,QuantType.per_1x32,1,0,128,0,124.5949,flydsl_moe1_afp4_wfp4_bf16_t128x128x256_w4_bnt0,0.0%,413.66,12933.11
stage1,256,64,4096,4096,32,8,ActivationType.Swiglu,torch.bfloat16,torch.float4_e2m1fn_x2,torch.float4_e2m1fn_x2,QuantType.per_1x32,1,0,128,0,126.2203,flydsl_moe1_afp4_wfp4_bf16_t128x128x256_w4_bnt0_fp4,0.8%,408.33,12766.56
stage1,256,64,4096,4096,32,8,ActivationType.Swiglu,torch.bfloat16,torch.float4_e2m1fn_x2,torch.float4_e2m1fn_x2,QuantType.per_1x32,1,0,128,0,153.2128,flydsl_moe1_afp4_wfp4_bf16_t128x128x256_w4_bnt0_xcd4,0.0%,336.39,10517.39
stage1,256,64,4096,4096,32,8,ActivationType.Swiglu,torch.bfloat16,torch.float4_e2m1fn_x2,torch.float4_e2m1fn_x2,QuantType.per_1x32,1,0,128,0,157.8577,flydsl_moe1_afp4_wfp4_bf16_t128x128x256_w4_bnt0_xcd4_fp4,0.8%,326.49,10207.92
stage1,256,64,4096,4096,32,8,ActivationType.Swiglu,torch.bfloat16,torch.float4_e2m1fn_x2,torch.float4_e2m1fn_x2,QuantType.per_1x32,1,0,128,0,119.4804,flydsl_moe1_afp4_wfp4_bf16_t128x128x256_w4,0.0%,431.36,13486.72
stage1,256,64,4096,4096,32,8,ActivationType.Swiglu,torch.bfloat16,torch.float4_e2m1fn_x2,torch.float4_e2m1fn_x2,QuantType.per_1x32,1,0,128,0,121.3988,flydsl_moe1_afp4_wfp4_bf16_t128x128x256_w4_fp4,0.8%,424.55,13273.6
stage1,256,64,4096,4096,32,8,ActivationType.Swiglu,torch.bfloat16,torch.float4_e2m1fn_x2,torch.float4_e2m1fn_x2,QuantType.per_1x32,1,0,128,0,144.5506,flydsl_moe1_afp4_wfp4_bf16_t128x128x256_w4_xcd4,0.0%,356.55,11147.65
stage1,256,64,4096,4096,32,8,ActivationType.Swiglu,torch.bfloat16,torch.float4_e2m1fn_x2,torch.float4_e2m1fn_x2,QuantType.per_1x32,1,0,128,0,147.1632,flydsl_moe1_afp4_wfp4_bf16_t128x128x256_w4_xcd4_fp4,0.8%,350.22,10949.74
stage2,256,64,4096,4096,32,8,ActivationType.Swiglu,torch.bfloat16,torch.float4_e2m1fn_x2,torch.float4_e2m1fn_x2,QuantType.per_1x32,1,0,128,0,61.6461,flydsl_moe2_afp4_wfp4_bf16_t64x128x256_atomic_sbm128,9.1%,836.06,26139.52
stage2,256,64,4096,4096,32,8,ActivationType.Swiglu,torch.bfloat16,torch.float4_e2m1fn_x2,torch.float4_e2m1fn_x2,QuantType.per_1x32,1,0,128,0,62.2632,flydsl_moe2_afp4_wfp4_bf16_t64x128x256_atomic_persist_sbm128,9.3%,827.77,25880.44
stage2,256,64,4096,4096,32,8,ActivationType.Swiglu,torch.bfloat16,torch.float4_e2m1fn_x2,torch.float4_e2m1fn_x2,QuantType.per_1x32,1,0,128,0,78.8766,flydsl_moe2_afp4_wfp4_bf16_t64x128x256_atomic_xcd4_sbm128,9.1%,653.42,20429.37
stage2,256,64,4096,4096,32,8,ActivationType.Swiglu,torch.bfloat16,torch.float4_e2m1fn_x2,torch.float4_e2m1fn_x2,QuantType.per_1x32,1,0,128,0,256.9657,flydsl_moe2_afp4_wfp4_bf16_t64x128x256_atomic_xcd4_persist_sbm128,9.1%,200.57,6270.87
stage2,256,64,4096,4096,32,8,ActivationType.Swiglu,torch.bfloat16,torch.float4_e2m1fn_x2,torch.float4_e2m1fn_x2,QuantType.per_1x32,1,0,128,0,60.2175,flydsl_moe2_afp4_wfp4_bf16_t64x128x256_atomic_bnt2_sbm128,9.2%,855.89,26759.65
stage2,256,64,4096,4096,32,8,ActivationType.Swiglu,torch.bfloat16,torch.float4_e2m1fn_x2,torch.float4_e2m1fn_x2,QuantType.per_1x32,1,0,128,0,61.3011,flydsl_moe2_afp4_wfp4_bf16_t64x128x256_atomic_bnt2_persist_sbm128,9.2%,840.76,26286.63
stage2,256,64,4096,4096,32,8,ActivationType.Swiglu,torch.bfloat16,torch.float4_e2m1fn_x2,torch.float4_e2m1fn_x2,QuantType.per_1x32,1,0,128,0,77.7281,flydsl_moe2_afp4_wfp4_bf16_t64x128x256_atomic_bnt2_xcd4_sbm128,9.1%,663.08,20731.23
stage2,256,64,4096,4096,32,8,ActivationType.Swiglu,torch.bfloat16,torch.float4_e2m1fn_x2,torch.float4_e2m1fn_x2,QuantType.per_1x32,1,0,128,0,255.7597,flydsl_moe2_afp4_wfp4_bf16_t64x128x256_atomic_bnt2_xcd4_persist_sbm128,9.2%,201.52,6300.44
stage2,256,64,4096,4096,32,8,ActivationType.Swiglu,torch.bfloat16,torch.float4_e2m1fn_x2,torch.float4_e2m1fn_x2,QuantType.per_1x32,1,0,128,0,62.0889,flydsl_moe2_afp4_wfp4_bf16_t64x128x256_reduce_sbm128,3.8%,830.09,25953.1
stage2,256,64,4096,4096,32,8,ActivationType.Swiglu,torch.bfloat16,torch.float4_e2m1fn_x2,torch.float4_e2m1fn_x2,QuantType.per_1x32,1,0,128,0,72.2146,flydsl_moe2_afp4_wfp4_bf16_t64x128x256_reduce_persist_sbm128,3.8%,713.7,22314.04
stage2,256,64,4096,4096,32,8,ActivationType.Swiglu,torch.bfloat16,torch.float4_e2m1fn_x2,torch.float4_e2m1fn_x2,QuantType.per_1x32,1,0,128,0,79.8054,flydsl_moe2_afp4_wfp4_bf16_t64x128x256_reduce_xcd4_sbm128,3.8%,645.82,20191.61
stage2,256,64,4096,4096,32,8,ActivationType.Swiglu,torch.bfloat16,torch.float4_e2m1fn_x2,torch.float4_e2m1fn_x2,QuantType.per_1x32,1,0,128,0,255.1354,flydsl_moe2_afp4_wfp4_bf16_t64x128x256_reduce_xcd4_persist_sbm128,3.8%,202.01,6315.86
stage2,256,64,4096,4096,32,8,ActivationType.Swiglu,torch.bfloat16,torch.float4_e2m1fn_x2,torch.float4_e2m1fn_x2,QuantType.per_1x32,1,0,128,0,60.1065,flydsl_moe2_afp4_wfp4_bf16_t64x128x256_reduce_bnt2_sbm128,3.8%,857.47,26809.07
stage2,256,64,4096,4096,32,8,ActivationType.Swiglu,torch.bfloat16,torch.float4_e2m1fn_x2,torch.float4_e2m1fn_x2,QuantType.per_1x32,1,0,128,0,70.5573,flydsl_moe2_afp4_wfp4_bf16_t64x128x256_reduce_bnt2_persist_sbm128,3.8%,730.46,22838.16
stage2,256,64,4096,4096,32,8,ActivationType.Swiglu,torch.bfloat16,torch.float4_e2m1fn_x2,torch.float4_e2m1fn_x2,QuantType.per_1x32,1,0,128,0,78.3563,flydsl_moe2_afp4_wfp4_bf16_t64x128x256_reduce_bnt2_xcd4_sbm128,3.8%,657.76,20565.02
stage2,256,64,4096,4096,32,8,ActivationType.Swiglu,torch.bfloat16,torch.float4_e2m1fn_x2,torch.float4_e2m1fn_x2,QuantType.per_1x32,1,0,128,0,255.5355,flydsl_moe2_afp4_wfp4_bf16_t64x128x256_reduce_bnt2_xcd4_persist_sbm128,3.8%,201.69,6305.97
stage2,256,64,4096,4096,32,8,ActivationType.Swiglu,torch.bfloat16,torch.float4_e2m1fn_x2,torch.float4_e2m1fn_x2,QuantType.per_1x32,1,0,128,0,79.2493,flydsl_moe2_afp4_wfp4_bf16_t64x256x256_atomic_sbm128,9.2%,650.35,20333.29
stage2,256,64,4096,4096,32,8,ActivationType.Swiglu,torch.bfloat16,torch.float4_e2m1fn_x2,torch.float4_e2m1fn_x2,QuantType.per_1x32,1,0,128,0,78.4261,flydsl_moe2_afp4_wfp4_bf16_t64x256x256_atomic_persist_sbm128,9.2%,657.17,20546.72
stage2,256,64,4096,4096,32,8,ActivationType.Swiglu,torch.bfloat16,torch.float4_e2m1fn_x2,torch.float4_e2m1fn_x2,QuantType.per_1x32,1,0,128,0,77.138,flydsl_moe2_afp4_wfp4_bf16_t64x256x256_atomic_xcd4_sbm128,9.1%,668.15,20889.82
stage2,256,64,4096,4096,32,8,ActivationType.Swiglu,torch.bfloat16,torch.float4_e2m1fn_x2,torch.float4_e2m1fn_x2,QuantType.per_1x32,1,0,128,0,231.7712,flydsl_moe2_afp4_wfp4_bf16_t64x256x256_atomic_xcd4_persist_sbm128,9.2%,222.37,6952.54
stage2,256,64,4096,4096,32,8,ActivationType.Swiglu,torch.bfloat16,torch.float4_e2m1fn_x2,torch.float4_e2m1fn_x2,QuantType.per_1x32,1,0,128,0,78.3672,flydsl_moe2_afp4_wfp4_bf16_t64x256x256_atomic_bnt2_sbm128,9.3%,657.67,20562.16
stage2,256,64,4096,4096,32,8,ActivationType.Swiglu,torch.bfloat16,torch.float4_e2m1fn_x2,torch.float4_e2m1fn_x2,QuantType.per_1x32,1,0,128,0,76.756,flydsl_moe2_afp4_wfp4_bf16_t64x256x256_atomic_bnt2_persist_sbm128,9.2%,671.47,20993.79
stage2,256,64,4096,4096,32,8,ActivationType.Swiglu,torch.bfloat16,torch.float4_e2m1fn_x2,torch.float4_e2m1fn_x2,QuantType.per_1x32,1,0,128,0,75.5253,flydsl_moe2_afp4_wfp4_bf16_t64x256x256_atomic_bnt2_xcd4_sbm128,9.2%,682.42,21335.89
stage2,256,64,4096,4096,32,8,ActivationType.Swiglu,torch.bfloat16,torch.float4_e2m1fn_x2,torch.float4_e2m1fn_x2,QuantType.per_1x32,1,0,128,0,230.0473,flydsl_moe2_afp4_wfp4_bf16_t64x256x256_atomic_bnt2_xcd4_persist_sbm128,9.2%,224.04,7004.64
stage2,256,64,4096,4096,32,8,ActivationType.Swiglu,torch.bfloat16,torch.float4_e2m1fn_x2,torch.float4_e2m1fn_x2,QuantType.per_1x32,1,0,128,0,79.695,flydsl_moe2_afp4_wfp4_bf16_t64x256x256_reduce_sbm128,3.8%,646.71,20219.58
stage2,256,64,4096,4096,32,8,ActivationType.Swiglu,torch.bfloat16,torch.float4_e2m1fn_x2,torch.float4_e2m1fn_x2,QuantType.per_1x32,1,0,128,0,80.292,flydsl_moe2_afp4_wfp4_bf16_t64x256x256_reduce_persist_sbm128,3.8%,641.9,20069.24
stage2,256,64,4096,4096,32,8,ActivationType.Swiglu,torch.bfloat16,torch.float4_e2m1fn_x2,torch.float4_e2m1fn_x2,QuantType.per_1x32,1,0,128,0,78.0671,flydsl_moe2_afp4_wfp4_bf16_t64x256x256_reduce_xcd4_sbm128,3.8%,660.2,20641.21
stage2,256,64,4096,4096,32,8,ActivationType.Swiglu,torch.bfloat16,torch.float4_e2m1fn_x2,torch.float4_e2m1fn_x2,QuantType.per_1x32,1,0,128,0,235.2231,flydsl_moe2_afp4_wfp4_bf16_t64x256x256_reduce_xcd4_persist_sbm128,3.8%,219.11,6850.51
stage2,256,64,4096,4096,32,8,ActivationType.Swiglu,torch.bfloat16,torch.float4_e2m1fn_x2,torch.float4_e2m1fn_x2,QuantType.per_1x32,1,0,128,0,78.109,flydsl_moe2_afp4_wfp4_bf16_t64x256x256_reduce_bnt2_sbm128,3.8%,659.84,20630.13
stage2,256,64,4096,4096,32,8,ActivationType.Swiglu,torch.bfloat16,torch.float4_e2m1fn_x2,torch.float4_e2m1fn_x2,QuantType.per_1x32,1,0,128,0,78.2107,flydsl_moe2_afp4_wfp4_bf16_t64x256x256_reduce_bnt2_persist_sbm128,3.8%,658.98,20603.31
stage2,256,64,4096,4096,32,8,ActivationType.Swiglu,torch.bfloat16,torch.float4_e2m1fn_x2,torch.float4_e2m1fn_x2,QuantType.per_1x32,1,0,128,0,76.12,flydsl_moe2_afp4_wfp4_bf16_t64x256x256_reduce_bnt2_xcd4_sbm128,3.8%,677.08,21169.2
stage2,256,64,4096,4096,32,8,ActivationType.Swiglu,torch.bfloat16,torch.float4_e2m1fn_x2,torch.float4_e2m1fn_x2,QuantType.per_1x32,1,0,128,0,233.789,flydsl_moe2_afp4_wfp4_bf16_t64x256x256_reduce_bnt2_xcd4_persist_sbm128,3.8%,220.45,6892.54
stage2,256,64,4096,4096,32,8,ActivationType.Swiglu,torch.bfloat16,torch.float4_e2m1fn_x2,torch.float4_e2m1fn_x2,QuantType.per_1x32,1,0,128,0,74.2993,flydsl_moe2_afp4_wfp4_bf16_t128x128x256_atomic,9.2%,693.68,21687.95
stage2,256,64,4096,4096,32,8,ActivationType.Swiglu,torch.bfloat16,torch.float4_e2m1fn_x2,torch.float4_e2m1fn_x2,QuantType.per_1x32,1,0,128,0,80.235,flydsl_moe2_afp4_wfp4_bf16_t128x128x256_atomic_persist,9.2%,642.36,20083.49
stage2,256,64,4096,4096,32,8,ActivationType.Swiglu,torch.bfloat16,torch.float4_e2m1fn_x2,torch.float4_e2m1fn_x2,QuantType.per_1x32,1,0,128,0,72.0341,flydsl_moe2_afp4_wfp4_bf16_t128x128x256_atomic_xcd4,9.2%,715.49,22369.95
stage2,256,64,4096,4096,32,8,ActivationType.Swiglu,torch.bfloat16,torch.float4_e2m1fn_x2,torch.float4_e2m1fn_x2,QuantType.per_1x32,1,0,128,0,770.6436,flydsl_moe2_afp4_wfp4_bf16_t128x128x256_atomic_xcd4_persist,9.2%,66.88,2090.98
stage2,256,64,4096,4096,32,8,ActivationType.Swiglu,torch.bfloat16,torch.float4_e2m1fn_x2,torch.float4_e2m1fn_x2,QuantType.per_1x32,1,0,128,0,73.6227,flydsl_moe2_afp4_wfp4_bf16_t128x128x256_atomic_bnt2,9.2%,700.05,21887.26
stage2,256,64,4096,4096,32,8,ActivationType.Swiglu,torch.bfloat16,torch.float4_e2m1fn_x2,torch.float4_e2m1fn_x2,QuantType.per_1x32,1,0,128,0,79.8449,flydsl_moe2_afp4_wfp4_bf16_t128x128x256_atomic_bnt2_persist,9.2%,645.5,20181.62
stage2,256,64,4096,4096,32,8,ActivationType.Swiglu,torch.bfloat16,torch.float4_e2m1fn_x2,torch.float4_e2m1fn_x2,QuantType.per_1x32,1,0,128,0,71.311,flydsl_moe2_afp4_wfp4_bf16_t128x128x256_atomic_bnt2_xcd4,9.2%,722.74,22596.78
stage2,256,64,4096,4096,32,8,ActivationType.Swiglu,torch.bfloat16,torch.float4_e2m1fn_x2,torch.float4_e2m1fn_x2,QuantType.per_1x32,1,0,128,0,757.3118,flydsl_moe2_afp4_wfp4_bf16_t128x128x256_atomic_bnt2_xcd4_persist,9.3%,68.06,2127.79
stage2,256,64,4096,4096,32,8,ActivationType.Swiglu,torch.bfloat16,torch.float4_e2m1fn_x2,torch.float4_e2m1fn_x2,QuantType.per_1x32,1,0,128,0,74.9582,flydsl_moe2_afp4_wfp4_bf16_t128x128x256_reduce,3.8%,687.58,21497.3
stage2,256,64,4096,4096,32,8,ActivationType.Swiglu,torch.bfloat16,torch.float4_e2m1fn_x2,torch.float4_e2m1fn_x2,QuantType.per_1x32,1,0,128,0,82.6744,flydsl_moe2_afp4_wfp4_bf16_t128x128x256_reduce_persist,3.8%,623.4,19490.91
stage2,256,64,4096,4096,32,8,ActivationType.Swiglu,torch.bfloat16,torch.float4_e2m1fn_x2,torch.float4_e2m1fn_x2,QuantType.per_1x32,1,0,128,0,73.5923,flydsl_moe2_afp4_wfp4_bf16_t128x128x256_reduce_xcd4,3.8%,700.34,21896.3
stage2,256,64,4096,4096,32,8,ActivationType.Swiglu,torch.bfloat16,torch.float4_e2m1fn_x2,torch.float4_e2m1fn_x2,QuantType.per_1x32,1,0,128,0,746.7083,flydsl_moe2_afp4_wfp4_bf16_t128x128x256_reduce_xcd4_persist,3.8%,69.02,2158.0
stage2,256,64,4096,4096,32,8,ActivationType.Swiglu,torch.bfloat16,torch.float4_e2m1fn_x2,torch.float4_e2m1fn_x2,QuantType.per_1x32,1,0,128,0,74.1616,flydsl_moe2_afp4_wfp4_bf16_t128x128x256_reduce_bnt2,3.8%,694.96,21728.21
stage2,256,64,4096,4096,32,8,ActivationType.Swiglu,torch.bfloat16,torch.float4_e2m1fn_x2,torch.float4_e2m1fn_x2,QuantType.per_1x32,1,0,128,0,80.5059,flydsl_moe2_afp4_wfp4_bf16_t128x128x256_reduce_bnt2_persist,3.8%,640.2,20015.91
stage2,256,64,4096,4096,32,8,ActivationType.Swiglu,torch.bfloat16,torch.float4_e2m1fn_x2,torch.float4_e2m1fn_x2,QuantType.per_1x32,1,0,128,0,72.7389,flydsl_moe2_afp4_wfp4_bf16_t128x128x256_reduce_bnt2_xcd4,3.8%,708.56,22153.2
stage2,256,64,4096,4096,32,8,ActivationType.Swiglu,torch.bfloat16,torch.float4_e2m1fn_x2,torch.float4_e2m1fn_x2,QuantType.per_1x32,1,0,128,0,739.2871,flydsl_moe2_afp4_wfp4_bf16_t128x128x256_reduce_bnt2_xcd4_persist,3.8%,69.72,2179.67
stage2,256,64,4096,4096,32,8,ActivationType.Swiglu,torch.bfloat16,torch.float4_e2m1fn_x2,torch.float4_e2m1fn_x2,QuantType.per_1x32,1,0,128,0,78.7749,flydsl_moe2_afp4_wfp4_bf16_t128x256x256_atomic,9.2%,654.26,20455.74
stage2,256,64,4096,4096,32,8,ActivationType.Swiglu,torch.bfloat16,torch.float4_e2m1fn_x2,torch.float4_e2m1fn_x2,QuantType.per_1x32,1,0,128,0,88.4241,flydsl_moe2_afp4_wfp4_bf16_t128x256x256_atomic_persist,9.2%,582.87,18223.53
stage2,256,64,4096,4096,32,8,ActivationType.Swiglu,torch.bfloat16,torch.float4_e2m1fn_x2,torch.float4_e2m1fn_x2,QuantType.per_1x32,1,0,128,0,99.9517,flydsl_moe2_afp4_wfp4_bf16_t128x256x256_atomic_xcd4,9.2%,515.65,16121.78
stage2,256,64,4096,4096,32,8,ActivationType.Swiglu,torch.bfloat16,torch.float4_e2m1fn_x2,torch.float4_e2m1fn_x2,QuantType.per_1x32,1,0,128,0,495.203,flydsl_moe2_afp4_wfp4_bf16_t128x256x256_atomic_xcd4_persist,9.3%,104.08,3254.02
stage2,256,64,4096,4096,32,8,ActivationType.Swiglu,torch.bfloat16,torch.float4_e2m1fn_x2,torch.float4_e2m1fn_x2,QuantType.per_1x32,1,0,128,0,77.1009,flydsl_moe2_afp4_wfp4_bf16_t128x256x256_atomic_bnt2,9.3%,668.47,20899.87
stage2,256,64,4096,4096,32,8,ActivationType.Swiglu,torch.bfloat16,torch.float4_e2m1fn_x2,torch.float4_e2m1fn_x2,QuantType.per_1x32,1,0,128,0,86.494,flydsl_moe2_afp4_wfp4_bf16_t128x256x256_atomic_bnt2_persist,9.2%,595.87,18630.18
stage2,256,64,4096,4096,32,8,ActivationType.Swiglu,torch.bfloat16,torch.float4_e2m1fn_x2,torch.float4_e2m1fn_x2,QuantType.per_1x32,1,0,128,0,99.3445,flydsl_moe2_afp4_wfp4_bf16_t128x256x256_atomic_bnt2_xcd4,9.2%,518.8,16220.32
stage2,256,64,4096,4096,32,8,ActivationType.Swiglu,torch.bfloat16,torch.float4_e2m1fn_x2,torch.float4_e2m1fn_x2,QuantType.per_1x32,1,0,128,0,489.2253,flydsl_moe2_afp4_wfp4_bf16_t128x256x256_atomic_bnt2_xcd4_persist,9.3%,105.35,3293.78
stage2,256,64,4096,4096,32,8,ActivationType.Swiglu,torch.bfloat16,torch.float4_e2m1fn_x2,torch.float4_e2m1fn_x2,QuantType.per_1x32,1,0,128,0,79.7048,flydsl_moe2_afp4_wfp4_bf16_t128x256x256_reduce,3.8%,646.63,20217.09
stage2,256,64,4096,4096,32,8,ActivationType.Swiglu,torch.bfloat16,torch.float4_e2m1fn_x2,torch.float4_e2m1fn_x2,QuantType.per_1x32,1,0,128,0,90.2872,flydsl_moe2_afp4_wfp4_bf16_t128x256x256_reduce_persist,3.8%,570.84,17847.48
stage2,256,64,4096,4096,32,8,ActivationType.Swiglu,torch.bfloat16,torch.float4_e2m1fn_x2,torch.float4_e2m1fn_x2,QuantType.per_1x32,1,0,128,0,101.0367,flydsl_moe2_afp4_wfp4_bf16_t128x256x256_reduce_xcd4,3.8%,510.11,15948.65
stage2,256,64,4096,4096,32,8,ActivationType.Swiglu,torch.bfloat16,torch.float4_e2m1fn_x2,torch.float4_e2m1fn_x2,QuantType.per_1x32,1,0,128,0,497.0075,flydsl_moe2_afp4_wfp4_bf16_t128x256x256_reduce_xcd4_persist,3.8%,103.7,3242.2
stage2,256,64,4096,4096,32,8,ActivationType.Swiglu,torch.bfloat16,torch.float4_e2m1fn_x2,torch.float4_e2m1fn_x2,QuantType.per_1x32,1,0,128,0,78.1663,flydsl_moe2_afp4_wfp4_bf16_t128x256x256_reduce_bnt2,3.8%,659.36,20615.01
stage2,256,64,4096,4096,32,8,ActivationType.Swiglu,torch.bfloat16,torch.float4_e2m1fn_x2,torch.float4_e2m1fn_x2,QuantType.per_1x32,1,0,128,0,88.2733,flydsl_moe2_afp4_wfp4_bf16_t128x256x256_reduce_bnt2_persist,3.8%,583.86,18254.66
stage2,256,64,4096,4096,32,8,ActivationType.Swiglu,torch.bfloat16,torch.float4_e2m1fn_x2,torch.float4_e2m1fn_x2,QuantType.per_1x32,1,0,128,0,99.6867,flydsl_moe2_afp4_wfp4_bf16_t128x256x256_reduce_bnt2_xcd4,3.8%,517.02,16164.64
stage2,256,64,4096,4096,32,8,ActivationType.Swiglu,torch.bfloat16,torch.float4_e2m1fn_x2,torch.float4_e2m1fn_x2,QuantType.per_1x32,1,0,128,0,493.4915,flydsl_moe2_afp4_wfp4_bf16_t128x256x256_reduce_bnt2_xcd4_persist,3.8%,104.44,3265.3
stage1,256,32,4096,4096,32,8,ActivationType.Silu,torch.bfloat16,torch.bfloat16,torch.bfloat16,QuantType.No,1,0,32,0,377.7579,moe_ck2stages_gemm1_256x32x64x128_1x4_TypeCast_v1_Nswizzle0_Quant0_MulRoutedWeight0_silu_B16_B16_B16,0.0%,68.22,8528.61
stage1,256,32,4096,4096,32,8,ActivationType.Silu,torch.bfloat16,torch.bfloat16,torch.bfloat16,QuantType.No,1,0,32,0,393.0077,moe_ck2stages_gemm1_256x32x64x64_1x4_TypeCast_v1_Nswizzle0_Quant0_MulRoutedWeight0_silu_B16_B16_B16,0.0%,65.57,8197.68
stage2,256,32,4096,4096,32,8,ActivationType.Silu,torch.bfloat16,torch.bfloat16,torch.bfloat16,QuantType.No,1,0,32,0,196.5379,moe_ck2stages_gemm2_256x32x128x128_1x4_TypeCast_v1_Nswizzle0_Quant0_MulRoutedWeight1_B16_B16_B16,5.4%,131.12,16392.51
stage2,256,32,4096,4096,32,8,ActivationType.Silu,torch.bfloat16,torch.bfloat16,torch.bfloat16,QuantType.No,1,0,32,0,197.1161,moe_ck2stages_gemm2_256x32x64x64_1x4_TypeCast_v1_Nswizzle0_Quant0_MulRoutedWeight1_B16_B16_B16,5.2%,130.73,16344.43
stage1,256,32,4096,4096,32,8,ActivationType.Silu,torch.bfloat16,torch.bfloat16,torch.bfloat16,QuantType.No,1,0,64,0,396.0378,moe_ck2stages_gemm1_256x64x64x128_1x4_TypeCast_v1_Nswizzle0_Quant0_MulRoutedWeight0_silu_B16_B16_B16,0.0%,65.07,8134.96
stage1,256,32,4096,4096,32,8,ActivationType.Silu,torch.bfloat16,torch.bfloat16,torch.bfloat16,QuantType.No,1,0,64,0,390.3994,moe_ck2stages_gemm1_256x64x64x64_1x4_TypeCast_v1_Nswizzle0_Quant0_MulRoutedWeight0_silu_B16_B16_B16,0.0%,66.01,8252.45
stage2,256,32,4096,4096,32,8,ActivationType.Silu,torch.bfloat16,torch.bfloat16,torch.bfloat16,QuantType.No,1,0,64,0,201.3989,moe_ck2stages_gemm2_256x64x128x128_1x4_TypeCast_v1_Nswizzle0_Quant0_MulRoutedWeight1_B16_B16_B16,5.4%,127.95,15996.86
stage2,256,32,4096,4096,32,8,ActivationType.Silu,torch.bfloat16,torch.bfloat16,torch.bfloat16,QuantType.No,1,0,64,0,200.8911,moe_ck2stages_gemm2_256x64x64x64_1x4_TypeCast_v1_Nswizzle0_Quant0_MulRoutedWeight1_B16_B16_B16,5.3%,128.28,16037.29
stage2,256,32,4096,4096,32,8,ActivationType.Silu,torch.bfloat16,torch.bfloat16,torch.bfloat16,QuantType.No,1,0,64,0,218.2692,moe_ck2stages_gemm2_256x64x128x64_1x4_TypeCast_v1_Nswizzle0_Quant0_MulRoutedWeight1_B16_B16_B16,5.3%,118.06,14760.44
stage1,256,32,4096,4096,32,8,ActivationType.Silu,torch.bfloat16,torch.bfloat16,torch.bfloat16,QuantType.No,1,0,128,0,397.2671,moe_ck2stages_gemm1_256x128x64x64_1x4_TypeCast_v1_Nswizzle0_Quant0_MulRoutedWeight0_silu_B16_B16_B16,0.0%,64.87,8109.78
stage1,256,32,4096,4096,32,8,ActivationType.Silu,torch.bfloat16,torch.bfloat16,torch.bfloat16,QuantType.No,1,0,128,0,413.7643,moe_ck2stages_gemm1_256x128x128x64_1x4_TypeCast_v3_Nswizzle0_Quant0_MulRoutedWeight0_silu_B16_B16_B16,0.0%,62.28,7786.44
stage2,256,32,4096,4096,32,8,ActivationType.Silu,torch.bfloat16,torch.bfloat16,torch.bfloat16,QuantType.No,1,0,128,0,200.5164,moe_ck2stages_gemm2_256x128x128x64_1x4_TypeCast_v1_Nswizzle0_Quant0_MulRoutedWeight1_B16_B16_B16,5.4%,128.52,16067.26
stage2,256,32,4096,4096,32,8,ActivationType.Silu,torch.bfloat16,torch.bfloat16,torch.bfloat16,QuantType.No,1,0,128,0,197.8105,moe_ck2stages_gemm2_256x128x128x64_1x4_TypeCast_v3_Nswizzle0_Quant0_MulRoutedWeight1_B16_B16_B16,5.3%,130.28,16287.05
stage2,256,32,4096,4096,32,8,ActivationType.Silu,torch.bfloat16,torch.bfloat16,torch.bfloat16,QuantType.No,1,0,128,0,202.1397,moe_ck2stages_gemm2_256x128x64x64_1x4_TypeCast_v3_Nswizzle0_Quant0_MulRoutedWeight1_B16_B16_B16,5.4%,127.49,15938.23
stage2,256,32,4096,4096,32,8,ActivationType.Silu,torch.bfloat16,torch.bfloat16,torch.bfloat16,QuantType.No,1,0,128,0,203.8156,moe_ck2stages_gemm2_256x128x64x64_1x4_TypeCast_v1_Nswizzle0_Quant0_MulRoutedWeight1_B16_B16_B16,5.3%,126.44,15807.18
stage1,256,32,4096,4096,32,8,ActivationType.Swiglu,torch.bfloat16,torch.float4_e2m1fn_x2,torch.float4_e2m1fn_x2,QuantType.per_1x32,1,0,32,0,203.6761,flydsl_moe1_afp4_wfp4_bf16_t32x32x256_bnt0,0.0%,126.52,7909.65
stage1,256,32,4096,4096,32,8,ActivationType.Swiglu,torch.bfloat16,torch.float4_e2m1fn_x2,torch.float4_e2m1fn_x2,QuantType.per_1x32,1,0,32,0,207.6907,flydsl_moe1_afp4_wfp4_bf16_t32x32x256_bnt0_fp4,0.8%,124.08,7756.76
stage1,256,32,4096,4096,32,8,ActivationType.Swiglu,torch.bfloat16,torch.float4_e2m1fn_x2,torch.float4_e2m1fn_x2,QuantType.per_1x32,1,0,32,0,269.0558,flydsl_moe1_afp4_wfp4_bf16_t32x32x256_bnt0_xcd4,0.0%,95.78,5987.63
stage1,256,32,4096,4096,32,8,ActivationType.Swiglu,torch.bfloat16,torch.float4_e2m1fn_x2,torch.float4_e2m1fn_x2,QuantType.per_1x32,1,0,32,0,276.6576,flydsl_moe1_afp4_wfp4_bf16_t32x32x256_bnt0_xcd4_fp4,0.8%,93.15,5823.1
stage1,256,32,4096,4096,32,8,ActivationType.Swiglu,torch.bfloat16,torch.float4_e2m1fn_x2,torch.float4_e2m1fn_x2,QuantType.per_1x32,1,0,32,0,202.9663,flydsl_moe1_afp4_wfp4_bf16_t32x32x256,0.0%,126.97,7937.31
stage1,256,32,4096,4096,32,8,ActivationType.Swiglu,torch.bfloat16,torch.float4_e2m1fn_x2,torch.float4_e2m1fn_x2,QuantType.per_1x32,1,0,32,0,205.8862,flydsl_moe1_afp4_wfp4_bf16_t32x32x256_fp4,0.8%,125.17,7824.74
stage1,256,32,4096,4096,32,8,ActivationType.Swiglu,torch.bfloat16,torch.float4_e2m1fn_x2,torch.float4_e2m1fn_x2,QuantType.per_1x32,1,0,32,0,262.5188,flydsl_moe1_afp4_wfp4_bf16_t32x32x256_xcd4,0.0%,98.16,6136.73
stage1,256,32,4096,4096,32,8,ActivationType.Swiglu,torch.bfloat16,torch.float4_e2m1fn_x2,torch.float4_e2m1fn_x2,QuantType.per_1x32,1,0,32,0,267.4434,flydsl_moe1_afp4_wfp4_bf16_t32x32x256_xcd4_fp4,0.8%,96.36,6023.73
stage1,256,32,4096,4096,32,8,ActivationType.Swiglu,torch.bfloat16,torch.float4_e2m1fn_x2,torch.float4_e2m1fn_x2,QuantType.per_1x32,1,0,32,0,122.0611,flydsl_moe1_afp4_wfp4_bf16_t32x32x256_w2_bnt0,0.0%,211.12,13198.36
stage1,256,32,4096,4096,32,8,ActivationType.Swiglu,torch.bfloat16,torch.float4_e2m1fn_x2,torch.float4_e2m1fn_x2,QuantType.per_1x32,1,0,32,0,124.3168,flydsl_moe1_afp4_wfp4_bf16_t32x32x256_w2_bnt0_fp4,0.8%,207.29,12958.88
stage1,256,32,4096,4096,32,8,ActivationType.Swiglu,torch.bfloat16,torch.float4_e2m1fn_x2,torch.float4_e2m1fn_x2,QuantType.per_1x32,1,0,32,0,161.4029,flydsl_moe1_afp4_wfp4_bf16_t32x32x256_w2_bnt0_xcd4,0.0%,159.66,9981.27
stage1,256,32,4096,4096,32,8,ActivationType.Swiglu,torch.bfloat16,torch.float4_e2m1fn_x2,torch.float4_e2m1fn_x2,QuantType.per_1x32,1,0,32,0,163.7974,flydsl_moe1_afp4_wfp4_bf16_t32x32x256_w2_bnt0_xcd4_fp4,0.8%,157.33,9835.36
stage1,256,32,4096,4096,32,8,ActivationType.Swiglu,torch.bfloat16,torch.float4_e2m1fn_x2,torch.float4_e2m1fn_x2,QuantType.per_1x32,1,0,32,0,120.854,flydsl_moe1_afp4_wfp4_bf16_t32x32x256_w2,0.0%,213.23,13330.18
stage1,256,32,4096,4096,32,8,ActivationType.Swiglu,torch.bfloat16,torch.float4_e2m1fn_x2,torch.float4_e2m1fn_x2,QuantType.per_1x32,1,0,32,0,123.383,flydsl_moe1_afp4_wfp4_bf16_t32x32x256_w2_fp4,0.8%,208.86,13056.95
stage1,256,32,4096,4096,32,8,ActivationType.Swiglu,torch.bfloat16,torch.float4_e2m1fn_x2,torch.float4_e2m1fn_x2,QuantType.per_1x32,1,0,32,0,152.0786,flydsl_moe1_afp4_wfp4_bf16_t32x32x256_w2_xcd4,0.0%,169.45,10593.25
stage1,256,32,4096,4096,32,8,ActivationType.Swiglu,torch.bfloat16,torch.float4_e2m1fn_x2,torch.float4_e2m1fn_x2,QuantType.per_1x32,1,0,32,0,155.3935,flydsl_moe1_afp4_wfp4_bf16_t32x32x256_w2_xcd4_fp4,0.8%,165.84,10367.27
stage1,256,32,4096,4096,32,8,ActivationType.Swiglu,torch.bfloat16,torch.float4_e2m1fn_x2,torch.float4_e2m1fn_x2,QuantType.per_1x32,1,0,32,0,106.687,flydsl_moe1_afp4_wfp4_bf16_t32x32x256_w3_bnt0,0.0%,241.55,15100.3
stage1,256,32,4096,4096,32,8,ActivationType.Swiglu,torch.bfloat16,torch.float4_e2m1fn_x2,torch.float4_e2m1fn_x2,QuantType.per_1x32,1,0,32,0,107.5849,flydsl_moe1_afp4_wfp4_bf16_t32x32x256_w3_bnt0_fp4,0.8%,239.53,14974.28
stage1,256,32,4096,4096,32,8,ActivationType.Swiglu,torch.bfloat16,torch.float4_e2m1fn_x2,torch.float4_e2m1fn_x2,QuantType.per_1x32,1,0,32,0,139.2577,flydsl_moe1_afp4_wfp4_bf16_t32x32x256_w3_bnt0_xcd4,0.0%,185.05,11568.52
stage1,256,32,4096,4096,32,8,ActivationType.Swiglu,torch.bfloat16,torch.float4_e2m1fn_x2,torch.float4_e2m1fn_x2,QuantType.per_1x32,1,0,32,0,139.1227,flydsl_moe1_afp4_wfp4_bf16_t32x32x256_w3_bnt0_xcd4_fp4,0.8%,185.23,11579.75
stage1,256,32,4096,4096,32,8,ActivationType.Swiglu,torch.bfloat16,torch.float4_e2m1fn_x2,torch.float4_e2m1fn_x2,QuantType.per_1x32,1,0,32,0,103.0794,flydsl_moe1_afp4_wfp4_bf16_t32x32x256_w3,0.0%,250.0,15628.79
stage1,256,32,4096,4096,32,8,ActivationType.Swiglu,torch.bfloat16,torch.float4_e2m1fn_x2,torch.float4_e2m1fn_x2,QuantType.per_1x32,1,0,32,0,104.7755,flydsl_moe1_afp4_wfp4_bf16_t32x32x256_w3_fp4,0.8%,245.95,15375.79
stage1,256,32,4096,4096,32,8,ActivationType.Swiglu,torch.bfloat16,torch.float4_e2m1fn_x2,torch.float4_e2m1fn_x2,QuantType.per_1x32,1,0,32,0,131.8737,flydsl_moe1_afp4_wfp4_bf16_t32x32x256_w3_xcd4,0.0%,195.41,12216.28
stage1,256,32,4096,4096,32,8,ActivationType.Swiglu,torch.bfloat16,torch.float4_e2m1fn_x2,torch.float4_e2m1fn_x2,QuantType.per_1x32,1,0,32,0,134.1842,flydsl_moe1_afp4_wfp4_bf16_t32x32x256_w3_xcd4_fp4,0.8%,192.05,12005.93
stage1,256,32,4096,4096,32,8,ActivationType.Swiglu,torch.bfloat16,torch.float4_e2m1fn_x2,torch.float4_e2m1fn_x2,QuantType.per_1x32,1,0,32,0,126.5273,flydsl_moe1_afp4_wfp4_bf16_t32x32x256_w3_kb2_bnt0_fp4,100.0%,203.67,12732.48
stage1,256,32,4096,4096,32,8,ActivationType.Swiglu,torch.bfloat16,torch.float4_e2m1fn_x2,torch.float4_e2m1fn_x2,QuantType.per_1x32,1,0,32,0,167.6103,flydsl_moe1_afp4_wfp4_bf16_t32x32x256_w3_kb2_bnt0_xcd4_fp4,100.0%,153.75,9611.62
stage1,256,32,4096,4096,32,8,ActivationType.Swiglu,torch.bfloat16,torch.float4_e2m1fn_x2,torch.float4_e2m1fn_x2,QuantType.per_1x32,1,0,32,0,169.4354,flydsl_moe1_afp4_wfp4_bf16_t32x32x256_w3_kb2_bnt0_go_fp4,100.0%,152.09,9508.08
stage1,256,32,4096,4096,32,8,ActivationType.Swiglu,torch.bfloat16,torch.float4_e2m1fn_x2,torch.float4_e2m1fn_x2,QuantType.per_1x32,1,0,32,0,217.148,flydsl_moe1_afp4_wfp4_bf16_t32x32x256_w3_kb2_bnt0_go_xcd4_fp4,100.0%,118.67,7418.93
stage1,256,32,4096,4096,32,8,ActivationType.Swiglu,torch.bfloat16,torch.float4_e2m1fn_x2,torch.float4_e2m1fn_x2,QuantType.per_1x32,1,0,32,0,125.479,flydsl_moe1_afp4_wfp4_bf16_t32x32x256_w3_kb2_fp4,100.0%,205.37,12838.85
stage1,256,32,4096,4096,32,8,ActivationType.Swiglu,torch.bfloat16,torch.float4_e2m1fn_x2,torch.float4_e2m1fn_x2,QuantType.per_1x32,1,0,32,0,157.1815,flydsl_moe1_afp4_wfp4_bf16_t32x32x256_w3_kb2_xcd4_fp4,100.0%,163.95,10249.34
stage1,256,32,4096,4096,32,8,ActivationType.Swiglu,torch.bfloat16,torch.float4_e2m1fn_x2,torch.float4_e2m1fn_x2,QuantType.per_1x32,1,0,32,0,166.3237,flydsl_moe1_afp4_wfp4_bf16_t32x32x256_w3_kb2_go_fp4,100.0%,154.94,9685.97
stage1,256,32,4096,4096,32,8,ActivationType.Swiglu,torch.bfloat16,torch.float4_e2m1fn_x2,torch.float4_e2m1fn_x2,QuantType.per_1x32,1,0,32,0,212.6856,flydsl_moe1_afp4_wfp4_bf16_t32x32x256_w3_kb2_go_xcd4_fp4,100.0%,121.16,7574.59
stage1,256,32,4096,4096,32,8,ActivationType.Swiglu,torch.bfloat16,torch.float4_e2m1fn_x2,torch.float4_e2m1fn_x2,QuantType.per_1x32,1,0,32,0,151.6363,flydsl_moe1_afp4_wfp4_bf16_t32x32x256_w3_kb4_bnt0_fp4,100.0%,169.94,10624.14
stage1,256,32,4096,4096,32,8,ActivationType.Swiglu,torch.bfloat16,torch.float4_e2m1fn_x2,torch.float4_e2m1fn_x2,QuantType.per_1x32,1,0,32,0,203.5604,flydsl_moe1_afp4_wfp4_bf16_t32x32x256_w3_kb4_bnt0_xcd4_fp4,100.0%,126.6,7914.14
stage1,256,32,4096,4096,32,8,ActivationType.Swiglu,torch.bfloat16,torch.float4_e2m1fn_x2,torch.float4_e2m1fn_x2,QuantType.per_1x32,1,0,32,0,215.7219,flydsl_moe1_afp4_wfp4_bf16_t32x32x256_w3_kb4_bnt0_go_fp4,100.0%,119.46,7467.98
stage1,256,32,4096,4096,32,8,ActivationType.Swiglu,torch.bfloat16,torch.float4_e2m1fn_x2,torch.float4_e2m1fn_x2,QuantType.per_1x32,1,0,32,0,285.9683,flydsl_moe1_afp4_wfp4_bf16_t32x32x256_w3_kb4_bnt0_go_xcd4_fp4,100.0%,90.11,5633.51
stage1,256,32,4096,4096,32,8,ActivationType.Swiglu,torch.bfloat16,torch.float4_e2m1fn_x2,torch.float4_e2m1fn_x2,QuantType.per_1x32,1,0,32,0,148.1846,flydsl_moe1_afp4_wfp4_bf16_t32x32x256_w3_kb4_fp4,100.0%,173.9,10871.62
stage1,256,32,4096,4096,32,8,ActivationType.Swiglu,torch.bfloat16,torch.float4_e2m1fn_x2,torch.float4_e2m1fn_x2,QuantType.per_1x32,1,0,32,0,192.8193,flydsl_moe1_afp4_wfp4_bf16_t32x32x256_w3_kb4_xcd4_fp4,100.0%,133.65,8355.0
stage1,256,32,4096,4096,32,8,ActivationType.Swiglu,torch.bfloat16,torch.float4_e2m1fn_x2,torch.float4_e2m1fn_x2,QuantType.per_1x32,1,0,32,0,211.8,flydsl_moe1_afp4_wfp4_bf16_t32x32x256_w3_kb4_go_fp4,100.0%,121.67,7606.26
stage1,256,32,4096,4096,32,8,ActivationType.Swiglu,torch.bfloat16,torch.float4_e2m1fn_x2,torch.float4_e2m1fn_x2,QuantType.per_1x32,1,0,32,0,278.6963,flydsl_moe1_afp4_wfp4_bf16_t32x32x256_w3_kb4_go_xcd4_fp4,100.0%,92.47,5780.51
stage1,256,32,4096,4096,32,8,ActivationType.Swiglu,torch.bfloat16,torch.float4_e2m1fn_x2,torch.float4_e2m1fn_x2,QuantType.per_1x32,1,0,32,0,-1.0,flydsl_moe1_afp4_wfp4_bf16_t32x32x256_w3_kb7_bnt0_fp4,100.0%,0.0,0.0
stage1,256,32,4096,4096,32,8,ActivationType.Swiglu,torch.bfloat16,torch.float4_e2m1fn_x2,torch.float4_e2m1fn_x2,QuantType.per_1x32,1,0,32,0,-1.0,flydsl_moe1_afp4_wfp4_bf16_t32x32x256_w3_kb7_bnt0_xcd4_fp4,100.0%,0.0,0.0
stage1,256,32,4096,4096,32,8,ActivationType.Swiglu,torch.bfloat16,torch.float4_e2m1fn_x2,torch.float4_e2m1fn_x2,QuantType.per_1x32,1,0,32,0,-1.0,flydsl_moe1_afp4_wfp4_bf16_t32x32x256_w3_kb7_bnt0_go_fp4,100.0%,0.0,0.0
stage1,256,32,4096,4096,32,8,ActivationType.Swiglu,torch.bfloat16,torch.float4_e2m1fn_x2,torch.float4_e2m1fn_x2,QuantType.per_1x32,1,0,32,0,-1.0,flydsl_moe1_afp4_wfp4_bf16_t32x32x256_w3_kb7_bnt0_go_xcd4_fp4,100.0%,0.0,0.0
stage1,256,32,4096,4096,32,8,ActivationType.Swiglu,torch.bfloat16,torch.float4_e2m1fn_x2,torch.float4_e2m1fn_x2,QuantType.per_1x32,1,0,32,0,-1.0,flydsl_moe1_afp4_wfp4_bf16_t32x32x256_w3_kb7_fp4,100.0%,0.0,0.0
stage1,256,32,4096,4096,32,8,ActivationType.Swiglu,torch.bfloat16,torch.float4_e2m1fn_x2,torch.float4_e2m1fn_x2,QuantType.per_1x32,1,0,32,0,-1.0,flydsl_moe1_afp4_wfp4_bf16_t32x32x256_w3_kb7_xcd4_fp4,100.0%,0.0,0.0
stage1,256,32,4096,4096,32,8,ActivationType.Swiglu,torch.bfloat16,torch.float4_e2m1fn_x2,torch.float4_e2m1fn_x2,QuantType.per_1x32,1,0,32,0,-1.0,flydsl_moe1_afp4_wfp4_bf16_t32x32x256_w3_kb7_go_fp4,100.0%,0.0,0.0
stage1,256,32,4096,4096,32,8,ActivationType.Swiglu,torch.bfloat16,torch.float4_e2m1fn_x2,torch.float4_e2m1fn_x2,QuantType.per_1x32,1,0,32,0,-1.0,flydsl_moe1_afp4_wfp4_bf16_t32x32x256_w3_kb7_go_xcd4_fp4,100.0%,0.0,0.0
stage1,256,32,4096,4096,32,8,ActivationType.Swiglu,torch.bfloat16,torch.float4_e2m1fn_x2,torch.float4_e2m1fn_x2,QuantType.per_1x32,1,0,32,0,-1.0,flydsl_moe1_afp4_wfp4_bf16_t32x32x256_w3_kb14_bnt0_fp4,100.0%,0.0,0.0
stage1,256,32,4096,4096,32,8,ActivationType.Swiglu,torch.bfloat16,torch.float4_e2m1fn_x2,torch.float4_e2m1fn_x2,QuantType.per_1x32,1,0,32,0,-1.0,flydsl_moe1_afp4_wfp4_bf16_t32x32x256_w3_kb14_bnt0_xcd4_fp4,100.0%,0.0,0.0
stage1,256,32,4096,4096,32,8,ActivationType.Swiglu,torch.bfloat16,torch.float4_e2m1fn_x2,torch.float4_e2m1fn_x2,QuantType.per_1x32,1,0,32,0,-1.0,flydsl_moe1_afp4_wfp4_bf16_t32x32x256_w3_kb14_bnt0_go_fp4,100.0%,0.0,0.0
stage1,256,32,4096,4096,32,8,ActivationType.Swiglu,torch.bfloat16,torch.float4_e2m1fn_x2,torch.float4_e2m1fn_x2,QuantType.per_1x32,1,0,32,0,-1.0,flydsl_moe1_afp4_wfp4_bf16_t32x32x256_w3_kb14_bnt0_go_xcd4_fp4,100.0%,0.0,0.0
stage1,256,32,4096,4096,32,8,ActivationType.Swiglu,torch.bfloat16,torch.float4_e2m1fn_x2,torch.float4_e2m1fn_x2,QuantType.per_1x32,1,0,32,0,-1.0,flydsl_moe1_afp4_wfp4_bf16_t32x32x256_w3_kb14_fp4,100.0%,0.0,0.0
stage1,256,32,4096,4096,32,8,ActivationType.Swiglu,torch.bfloat16,torch.float4_e2m1fn_x2,torch.float4_e2m1fn_x2,QuantType.per_1x32,1,0,32,0,-1.0,flydsl_moe1_afp4_wfp4_bf16_t32x32x256_w3_kb14_xcd4_fp4,100.0%,0.0,0.0
stage1,256,32,4096,4096,32,8,ActivationType.Swiglu,torch.bfloat16,torch.float4_e2m1fn_x2,torch.float4_e2m1fn_x2,QuantType.per_1x32,1,0,32,0,-1.0,flydsl_moe1_afp4_wfp4_bf16_t32x32x256_w3_kb14_go_fp4,100.0%,0.0,0.0
stage1,256,32,4096,4096,32,8,ActivationType.Swiglu,torch.bfloat16,torch.float4_e2m1fn_x2,torch.float4_e2m1fn_x2,QuantType.per_1x32,1,0,32,0,-1.0,flydsl_moe1_afp4_wfp4_bf16_t32x32x256_w3_kb14_go_xcd4_fp4,100.0%,0.0,0.0
stage1,256,32,4096,4096,32,8,ActivationType.Swiglu,torch.bfloat16,torch.float4_e2m1fn_x2,torch.float4_e2m1fn_x2,QuantType.per_1x32,1,0,32,0,99.1634,flydsl_moe1_afp4_wfp4_bf16_t32x32x256_w4_bnt0,0.0%,259.87,16245.97
stage1,256,32,4096,4096,32,8,ActivationType.Swiglu,torch.bfloat16,torch.float4_e2m1fn_x2,torch.float4_e2m1fn_x2,QuantType.per_1x32,1,0,32,0,100.2863,flydsl_moe1_afp4_wfp4_bf16_t32x32x256_w4_bnt0_fp4,0.8%,256.96,16064.07
stage1,256,32,4096,4096,32,8,ActivationType.Swiglu,torch.bfloat16,torch.float4_e2m1fn_x2,torch.float4_e2m1fn_x2,QuantType.per_1x32,1,0,32,0,130.9009,flydsl_moe1_afp4_wfp4_bf16_t32x32x256_w4_bnt0_xcd4,0.0%,196.86,12307.07
stage1,256,32,4096,4096,32,8,ActivationType.Swiglu,torch.bfloat16,torch.float4_e2m1fn_x2,torch.float4_e2m1fn_x2,QuantType.per_1x32,1,0,32,0,140.8785,flydsl_moe1_afp4_wfp4_bf16_t32x32x256_w4_bnt0_xcd4_fp4,0.8%,182.92,11435.43
stage1,256,32,4096,4096,32,8,ActivationType.Swiglu,torch.bfloat16,torch.float4_e2m1fn_x2,torch.float4_e2m1fn_x2,QuantType.per_1x32,1,0,32,0,94.0916,flydsl_moe1_afp4_wfp4_bf16_t32x32x256_w4,0.0%,273.88,17121.68
stage1,256,32,4096,4096,32,8,ActivationType.Swiglu,torch.bfloat16,torch.float4_e2m1fn_x2,torch.float4_e2m1fn_x2,QuantType.per_1x32,1,0,32,0,95.6624,flydsl_moe1_afp4_wfp4_bf16_t32x32x256_w4_fp4,0.8%,269.38,16840.53
stage1,256,32,4096,4096,32,8,ActivationType.Swiglu,torch.bfloat16,torch.float4_e2m1fn_x2,torch.float4_e2m1fn_x2,QuantType.per_1x32,1,0,32,0,125.0421,flydsl_moe1_afp4_wfp4_bf16_t32x32x256_w4_xcd4,0.0%,206.09,12883.71
stage1,256,32,4096,4096,32,8,ActivationType.Swiglu,torch.bfloat16,torch.float4_e2m1fn_x2,torch.float4_e2m1fn_x2,QuantType.per_1x32,1,0,32,0,126.1516,flydsl_moe1_afp4_wfp4_bf16_t32x32x256_w4_xcd4_fp4,0.8%,204.28,12770.4
stage1,256,32,4096,4096,32,8,ActivationType.Swiglu,torch.bfloat16,torch.float4_e2m1fn_x2,torch.float4_e2m1fn_x2,QuantType.per_1x32,1,0,32,0,118.9992,flydsl_moe1_afp4_wfp4_bf16_t32x64x256_bnt0,0.0%,216.55,13537.96
stage1,256,32,4096,4096,32,8,ActivationType.Swiglu,torch.bfloat16,torch.float4_e2m1fn_x2,torch.float4_e2m1fn_x2,QuantType.per_1x32,1,0,32,0,123.3553,flydsl_moe1_afp4_wfp4_bf16_t32x64x256_bnt0_fp4,0.8%,208.91,13059.88
stage1,256,32,4096,4096,32,8,ActivationType.Swiglu,torch.bfloat16,torch.float4_e2m1fn_x2,torch.float4_e2m1fn_x2,QuantType.per_1x32,1,0,32,0,156.7556,flydsl_moe1_afp4_wfp4_bf16_t32x64x256_bnt0_xcd4,0.0%,164.39,10277.18
stage1,256,32,4096,4096,32,8,ActivationType.Swiglu,torch.bfloat16,torch.float4_e2m1fn_x2,torch.float4_e2m1fn_x2,QuantType.per_1x32,1,0,32,0,161.6063,flydsl_moe1_afp4_wfp4_bf16_t32x64x256_bnt0_xcd4_fp4,0.8%,159.46,9968.71
stage1,256,32,4096,4096,32,8,ActivationType.Swiglu,torch.bfloat16,torch.float4_e2m1fn_x2,torch.float4_e2m1fn_x2,QuantType.per_1x32,1,0,32,0,117.059,flydsl_moe1_afp4_wfp4_bf16_t32x64x256,0.0%,220.14,13762.34
stage1,256,32,4096,4096,32,8,ActivationType.Swiglu,torch.bfloat16,torch.float4_e2m1fn_x2,torch.float4_e2m1fn_x2,QuantType.per_1x32,1,0,32,0,120.3834,flydsl_moe1_afp4_wfp4_bf16_t32x64x256_fp4,0.8%,214.06,13382.29
stage1,256,32,4096,4096,32,8,ActivationType.Swiglu,torch.bfloat16,torch.float4_e2m1fn_x2,torch.float4_e2m1fn_x2,QuantType.per_1x32,1,0,32,0,148.9538,flydsl_moe1_afp4_wfp4_bf16_t32x64x256_xcd4,0.0%,173.01,10815.47
stage1,256,32,4096,4096,32,8,ActivationType.Swiglu,torch.bfloat16,torch.float4_e2m1fn_x2,torch.float4_e2m1fn_x2,QuantType.per_1x32,1,0,32,0,156.2511,flydsl_moe1_afp4_wfp4_bf16_t32x64x256_xcd4_fp4,0.8%,164.93,10310.37
stage1,256,32,4096,4096,32,8,ActivationType.Swiglu,torch.bfloat16,torch.float4_e2m1fn_x2,torch.float4_e2m1fn_x2,QuantType.per_1x32,1,0,32,0,99.5661,flydsl_moe1_afp4_wfp4_bf16_t32x64x256_w2_bnt0,0.0%,258.82,16180.27
stage1,256,32,4096,4096,32,8,ActivationType.Swiglu,torch.bfloat16,torch.float4_e2m1fn_x2,torch.float4_e2m1fn_x2,QuantType.per_1x32,1,0,32,0,100.9323,flydsl_moe1_afp4_wfp4_bf16_t32x64x256_w2_bnt0_fp4,0.8%,255.32,15961.25
stage1,256,32,4096,4096,32,8,ActivationType.Swiglu,torch.bfloat16,torch.float4_e2m1fn_x2,torch.float4_e2m1fn_x2,QuantType.per_1x32,1,0,32,0,128.9989,flydsl_moe1_afp4_wfp4_bf16_t32x64x256_w2_bnt0_xcd4,0.0%,199.77,12488.52
stage1,256,32,4096,4096,32,8,ActivationType.Swiglu,torch.bfloat16,torch.float4_e2m1fn_x2,torch.float4_e2m1fn_x2,QuantType.per_1x32,1,0,32,0,129.8744,flydsl_moe1_afp4_wfp4_bf16_t32x64x256_w2_bnt0_xcd4_fp4,0.8%,198.42,12404.34
stage1,256,32,4096,4096,32,8,ActivationType.Swiglu,torch.bfloat16,torch.float4_e2m1fn_x2,torch.float4_e2m1fn_x2,QuantType.per_1x32,1,0,32,0,95.4217,flydsl_moe1_afp4_wfp4_bf16_t32x64x256_w2,0.0%,270.06,16883.01
stage1,256,32,4096,4096,32,8,ActivationType.Swiglu,torch.bfloat16,torch.float4_e2m1fn_x2,torch.float4_e2m1fn_x2,QuantType.per_1x32,1,0,32,0,97.0237,flydsl_moe1_afp4_wfp4_bf16_t32x64x256_w2_fp4,0.8%,265.6,16604.25
stage1,256,32,4096,4096,32,8,ActivationType.Swiglu,torch.bfloat16,torch.float4_e2m1fn_x2,torch.float4_e2m1fn_x2,QuantType.per_1x32,1,0,32,0,122.9489,flydsl_moe1_afp4_wfp4_bf16_t32x64x256_w2_xcd4,0.0%,209.6,13103.05
stage1,256,32,4096,4096,32,8,ActivationType.Swiglu,torch.bfloat16,torch.float4_e2m1fn_x2,torch.float4_e2m1fn_x2,QuantType.per_1x32,1,0,32,0,123.9522,flydsl_moe1_afp4_wfp4_bf16_t32x64x256_w2_xcd4_fp4,0.8%,207.9,12996.99
stage1,256,32,4096,4096,32,8,ActivationType.Swiglu,torch.bfloat16,torch.float4_e2m1fn_x2,torch.float4_e2m1fn_x2,QuantType.per_1x32,1,0,32,0,101.3168,flydsl_moe1_afp4_wfp4_bf16_t32x64x256_w3_bnt0,0.0%,254.35,15900.68
stage1,256,32,4096,4096,32,8,ActivationType.Swiglu,torch.bfloat16,torch.float4_e2m1fn_x2,torch.float4_e2m1fn_x2,QuantType.per_1x32,1,0,32,0,102.5082,flydsl_moe1_afp4_wfp4_bf16_t32x64x256_w3_bnt0_fp4,0.8%,251.39,15715.87
stage1,256,32,4096,4096,32,8,ActivationType.Swiglu,torch.bfloat16,torch.float4_e2m1fn_x2,torch.float4_e2m1fn_x2,QuantType.per_1x32,1,0,32,0,134.7721,flydsl_moe1_afp4_wfp4_bf16_t32x64x256_w3_bnt0_xcd4,0.0%,191.21,11953.56
stage1,256,32,4096,4096,32,8,ActivationType.Swiglu,torch.bfloat16,torch.float4_e2m1fn_x2,torch.float4_e2m1fn_x2,QuantType.per_1x32,1,0,32,0,135.3291,flydsl_moe1_afp4_wfp4_bf16_t32x64x256_w3_bnt0_xcd4_fp4,0.8%,190.42,11904.36
stage1,256,32,4096,4096,32,8,ActivationType.Swiglu,torch.bfloat16,torch.float4_e2m1fn_x2,torch.float4_e2m1fn_x2,QuantType.per_1x32,1,0,32,0,96.0261,flydsl_moe1_afp4_wfp4_bf16_t32x64x256_w3,0.0%,268.36,16776.75
stage1,256,32,4096,4096,32,8,ActivationType.Swiglu,torch.bfloat16,torch.float4_e2m1fn_x2,torch.float4_e2m1fn_x2,QuantType.per_1x32,1,0,32,0,98.2269,flydsl_moe1_afp4_wfp4_bf16_t32x64x256_w3_fp4,0.8%,262.35,16400.86
stage1,256,32,4096,4096,32,8,ActivationType.Swiglu,torch.bfloat16,torch.float4_e2m1fn_x2,torch.float4_e2m1fn_x2,QuantType.per_1x32,1,0,32,0,126.1441,flydsl_moe1_afp4_wfp4_bf16_t32x64x256_w3_xcd4,0.0%,204.29,12771.16
stage1,256,32,4096,4096,32,8,ActivationType.Swiglu,torch.bfloat16,torch.float4_e2m1fn_x2,torch.float4_e2m1fn_x2,QuantType.per_1x32,1,0,32,0,126.4073,flydsl_moe1_afp4_wfp4_bf16_t32x64x256_w3_xcd4_fp4,0.8%,203.86,12744.56
stage1,256,32,4096,4096,32,8,ActivationType.Swiglu,torch.bfloat16,torch.float4_e2m1fn_x2,torch.float4_e2m1fn_x2,QuantType.per_1x32,1,0,32,0,112.8288,flydsl_moe1_afp4_wfp4_bf16_t32x64x256_w3_kb2_bnt0_fp4,100.0%,228.4,14278.32
stage1,256,32,4096,4096,32,8,ActivationType.Swiglu,torch.bfloat16,torch.float4_e2m1fn_x2,torch.float4_e2m1fn_x2,QuantType.per_1x32,1,0,32,0,147.3399,flydsl_moe1_afp4_wfp4_bf16_t32x64x256_w3_kb2_bnt0_xcd4_fp4,100.0%,174.9,10933.94
stage1,256,32,4096,4096,32,8,ActivationType.Swiglu,torch.bfloat16,torch.float4_e2m1fn_x2,torch.float4_e2m1fn_x2,QuantType.per_1x32,1,0,32,0,114.5929,flydsl_moe1_afp4_wfp4_bf16_t32x64x256_w3_kb2_bnt0_go_fp4,100.0%,224.88,14058.51
stage1,256,32,4096,4096,32,8,ActivationType.Swiglu,torch.bfloat16,torch.float4_e2m1fn_x2,torch.float4_e2m1fn_x2,QuantType.per_1x32,1,0,32,0,143.3191,flydsl_moe1_afp4_wfp4_bf16_t32x64x256_w3_kb2_bnt0_go_xcd4_fp4,100.0%,179.81,11240.69
stage1,256,32,4096,4096,32,8,ActivationType.Swiglu,torch.bfloat16,torch.float4_e2m1fn_x2,torch.float4_e2m1fn_x2,QuantType.per_1x32,1,0,32,0,107.1427,flydsl_moe1_afp4_wfp4_bf16_t32x64x256_w3_kb2_fp4,100.0%,240.52,15036.08
stage1,256,32,4096,4096,32,8,ActivationType.Swiglu,torch.bfloat16,torch.float4_e2m1fn_x2,torch.float4_e2m1fn_x2,QuantType.per_1x32,1,0,32,0,137.005,flydsl_moe1_afp4_wfp4_bf16_t32x64x256_w3_kb2_xcd4_fp4,100.0%,188.09,11758.74
stage1,256,32,4096,4096,32,8,ActivationType.Swiglu,torch.bfloat16,torch.float4_e2m1fn_x2,torch.float4_e2m1fn_x2,QuantType.per_1x32,1,0,32,0,111.6687,flydsl_moe1_afp4_wfp4_bf16_t32x64x256_w3_kb2_go_fp4,100.0%,230.77,14426.66
stage1,256,32,4096,4096,32,8,ActivationType.Swiglu,torch.bfloat16,torch.float4_e2m1fn_x2,torch.float4_e2m1fn_x2,QuantType.per_1x32,1,0,32,0,138.4356,flydsl_moe1_afp4_wfp4_bf16_t32x64x256_w3_kb2_go_xcd4_fp4,100.0%,186.15,11637.22
stage1,256,32,4096,4096,32,8,ActivationType.Swiglu,torch.bfloat16,torch.float4_e2m1fn_x2,torch.float4_e2m1fn_x2,QuantType.per_1x32,1,0,32,0,117.7281,flydsl_moe1_afp4_wfp4_bf16_t32x64x256_w3_kb4_bnt0_fp4,100.0%,218.89,13684.12
stage1,256,32,4096,4096,32,8,ActivationType.Swiglu,torch.bfloat16,torch.float4_e2m1fn_x2,torch.float4_e2m1fn_x2,QuantType.per_1x32,1,0,32,0,158.2953,flydsl_moe1_afp4_wfp4_bf16_t32x64x256_w3_kb4_bnt0_xcd4_fp4,100.0%,162.8,10177.22
stage1,256,32,4096,4096,32,8,ActivationType.Swiglu,torch.bfloat16,torch.float4_e2m1fn_x2,torch.float4_e2m1fn_x2,QuantType.per_1x32,1,0,32,0,142.731,flydsl_moe1_afp4_wfp4_bf16_t32x64x256_w3_kb4_bnt0_go_fp4,100.0%,180.55,11287.01
stage1,256,32,4096,4096,32,8,ActivationType.Swiglu,torch.bfloat16,torch.float4_e2m1fn_x2,torch.float4_e2m1fn_x2,QuantType.per_1x32,1,0,32,0,168.6582,flydsl_moe1_afp4_wfp4_bf16_t32x64x256_w3_kb4_bnt0_go_xcd4_fp4,100.0%,152.79,9551.9
stage1,256,32,4096,4096,32,8,ActivationType.Swiglu,torch.bfloat16,torch.float4_e2m1fn_x2,torch.float4_e2m1fn_x2,QuantType.per_1x32,1,0,32,0,112.6484,flydsl_moe1_afp4_wfp4_bf16_t32x64x256_w3_kb4_fp4,100.0%,228.76,14301.19
stage1,256,32,4096,4096,32,8,ActivationType.Swiglu,torch.bfloat16,torch.float4_e2m1fn_x2,torch.float4_e2m1fn_x2,QuantType.per_1x32,1,0,32,0,147.3742,flydsl_moe1_afp4_wfp4_bf16_t32x64x256_w3_kb4_xcd4_fp4,100.0%,174.86,10931.4
stage1,256,32,4096,4096,32,8,ActivationType.Swiglu,torch.bfloat16,torch.float4_e2m1fn_x2,torch.float4_e2m1fn_x2,QuantType.per_1x32,1,0,32,0,135.375,flydsl_moe1_afp4_wfp4_bf16_t32x64x256_w3_kb4_go_fp4,100.0%,190.36,11900.32
stage1,256,32,4096,4096,32,8,ActivationType.Swiglu,torch.bfloat16,torch.float4_e2m1fn_x2,torch.float4_e2m1fn_x2,QuantType.per_1x32,1,0,32,0,163.7393,flydsl_moe1_afp4_wfp4_bf16_t32x64x256_w3_kb4_go_xcd4_fp4,100.0%,157.38,9838.85
stage1,256,32,4096,4096,32,8,ActivationType.Swiglu,torch.bfloat16,torch.float4_e2m1fn_x2,torch.float4_e2m1fn_x2,QuantType.per_1x32,1,0,32,0,-1.0,flydsl_moe1_afp4_wfp4_bf16_t32x64x256_w3_kb7_bnt0_fp4,100.0%,0.0,0.0
stage1,256,32,4096,4096,32,8,ActivationType.Swiglu,torch.bfloat16,torch.float4_e2m1fn_x2,torch.float4_e2m1fn_x2,QuantType.per_1x32,1,0,32,0,-1.0,flydsl_moe1_afp4_wfp4_bf16_t32x64x256_w3_kb7_bnt0_xcd4_fp4,100.0%,0.0,0.0
stage1,256,32,4096,4096,32,8,ActivationType.Swiglu,torch.bfloat16,torch.float4_e2m1fn_x2,torch.float4_e2m1fn_x2,QuantType.per_1x32,1,0,32,0,-1.0,flydsl_moe1_afp4_wfp4_bf16_t32x64x256_w3_kb7_bnt0_go_fp4,100.0%,0.0,0.0
stage1,256,32,4096,4096,32,8,ActivationType.Swiglu,torch.bfloat16,torch.float4_e2m1fn_x2,torch.float4_e2m1fn_x2,QuantType.per_1x32,1,0,32,0,-1.0,flydsl_moe1_afp4_wfp4_bf16_t32x64x256_w3_kb7_bnt0_go_xcd4_fp4,100.0%,0.0,0.0
stage1,256,32,4096,4096,32,8,ActivationType.Swiglu,torch.bfloat16,torch.float4_e2m1fn_x2,torch.float4_e2m1fn_x2,QuantType.per_1x32,1,0,32,0,-1.0,flydsl_moe1_afp4_wfp4_bf16_t32x64x256_w3_kb7_fp4,100.0%,0.0,0.0
stage1,256,32,4096,4096,32,8,ActivationType.Swiglu,torch.bfloat16,torch.float4_e2m1fn_x2,torch.float4_e2m1fn_x2,QuantType.per_1x32,1,0,32,0,-1.0,flydsl_moe1_afp4_wfp4_bf16_t32x64x256_w3_kb7_xcd4_fp4,100.0%,0.0,0.0
stage1,256,32,4096,4096,32,8,ActivationType.Swiglu,torch.bfloat16,torch.float4_e2m1fn_x2,torch.float4_e2m1fn_x2,QuantType.per_1x32,1,0,32,0,-1.0,flydsl_moe1_afp4_wfp4_bf16_t32x64x256_w3_kb7_go_fp4,100.0%,0.0,0.0
stage1,256,32,4096,4096,32,8,ActivationType.Swiglu,torch.bfloat16,torch.float4_e2m1fn_x2,torch.float4_e2m1fn_x2,QuantType.per_1x32,1,0,32,0,-1.0,flydsl_moe1_afp4_wfp4_bf16_t32x64x256_w3_kb7_go_xcd4_fp4,100.0%,0.0,0.0
stage1,256,32,4096,4096,32,8,ActivationType.Swiglu,torch.bfloat16,torch.float4_e2m1fn_x2,torch.float4_e2m1fn_x2,QuantType.per_1x32,1,0,32,0,-1.0,flydsl_moe1_afp4_wfp4_bf16_t32x64x256_w3_kb14_bnt0_fp4,100.0%,0.0,0.0
stage1,256,32,4096,4096,32,8,ActivationType.Swiglu,torch.bfloat16,torch.float4_e2m1fn_x2,torch.float4_e2m1fn_x2,QuantType.per_1x32,1,0,32,0,-1.0,flydsl_moe1_afp4_wfp4_bf16_t32x64x256_w3_kb14_bnt0_xcd4_fp4,100.0%,0.0,0.0
stage1,256,32,4096,4096,32,8,ActivationType.Swiglu,torch.bfloat16,torch.float4_e2m1fn_x2,torch.float4_e2m1fn_x2,QuantType.per_1x32,1,0,32,0,-1.0,flydsl_moe1_afp4_wfp4_bf16_t32x64x256_w3_kb14_bnt0_go_fp4,100.0%,0.0,0.0
stage1,256,32,4096,4096,32,8,ActivationType.Swiglu,torch.bfloat16,torch.float4_e2m1fn_x2,torch.float4_e2m1fn_x2,QuantType.per_1x32,1,0,32,0,-1.0,flydsl_moe1_afp4_wfp4_bf16_t32x64x256_w3_kb14_bnt0_go_xcd4_fp4,100.0%,0.0,0.0
stage1,256,32,4096,4096,32,8,ActivationType.Swiglu,torch.bfloat16,torch.float4_e2m1fn_x2,torch.float4_e2m1fn_x2,QuantType.per_1x32,1,0,32,0,-1.0,flydsl_moe1_afp4_wfp4_bf16_t32x64x256_w3_kb14_fp4,100.0%,0.0,0.0
stage1,256,32,4096,4096,32,8,ActivationType.Swiglu,torch.bfloat16,torch.float4_e2m1fn_x2,torch.float4_e2m1fn_x2,QuantType.per_1x32,1,0,32,0,-1.0,flydsl_moe1_afp4_wfp4_bf16_t32x64x256_w3_kb14_xcd4_fp4,100.0%,0.0,0.0
stage1,256,32,4096,4096,32,8,ActivationType.Swiglu,torch.bfloat16,torch.float4_e2m1fn_x2,torch.float4_e2m1fn_x2,QuantType.per_1x32,1,0,32,0,-1.0,flydsl_moe1_afp4_wfp4_bf16_t32x64x256_w3_kb14_go_fp4,100.0%,0.0,0.0
stage1,256,32,4096,4096,32,8,ActivationType.Swiglu,torch.bfloat16,torch.float4_e2m1fn_x2,torch.float4_e2m1fn_x2,QuantType.per_1x32,1,0,32,0,-1.0,flydsl_moe1_afp4_wfp4_bf16_t32x64x256_w3_kb14_go_xcd4_fp4,100.0%,0.0,0.0
stage1,256,32,4096,4096,32,8,ActivationType.Swiglu,torch.bfloat16,torch.float4_e2m1fn_x2,torch.float4_e2m1fn_x2,QuantType.per_1x32,1,0,32,0,101.2782,flydsl_moe1_afp4_wfp4_bf16_t32x64x256_w4_bnt0,0.0%,254.45,15906.74
stage1,256,32,4096,4096,32,8,ActivationType.Swiglu,torch.bfloat16,torch.float4_e2m1fn_x2,torch.float4_e2m1fn_x2,QuantType.per_1x32,1,0,32,0,101.8633,flydsl_moe1_afp4_wfp4_bf16_t32x64x256_w4_bnt0_fp4,0.8%,252.98,15815.37
stage1,256,32,4096,4096,32,8,ActivationType.Swiglu,torch.bfloat16,torch.float4_e2m1fn_x2,torch.float4_e2m1fn_x2,QuantType.per_1x32,1,0,32,0,131.0082,flydsl_moe1_afp4_wfp4_bf16_t32x64x256_w4_bnt0_xcd4,0.0%,196.7,12296.99
stage1,256,32,4096,4096,32,8,ActivationType.Swiglu,torch.bfloat16,torch.float4_e2m1fn_x2,torch.float4_e2m1fn_x2,QuantType.per_1x32,1,0,32,0,131.7583,flydsl_moe1_afp4_wfp4_bf16_t32x64x256_w4_bnt0_xcd4_fp4,0.8%,195.58,12226.98
stage1,256,32,4096,4096,32,8,ActivationType.Swiglu,torch.bfloat16,torch.float4_e2m1fn_x2,torch.float4_e2m1fn_x2,QuantType.per_1x32,1,0,32,0,94.8653,flydsl_moe1_afp4_wfp4_bf16_t32x64x256_w4,0.0%,271.65,16982.04
stage1,256,32,4096,4096,32,8,ActivationType.Swiglu,torch.bfloat16,torch.float4_e2m1fn_x2,torch.float4_e2m1fn_x2,QuantType.per_1x32,1,0,32,0,96.7765,flydsl_moe1_afp4_wfp4_bf16_t32x64x256_w4_fp4,0.8%,266.28,16646.66
stage1,256,32,4096,4096,32,8,ActivationType.Swiglu,torch.bfloat16,torch.float4_e2m1fn_x2,torch.float4_e2m1fn_x2,QuantType.per_1x32,1,0,32,0,122.5867,flydsl_moe1_afp4_wfp4_bf16_t32x64x256_w4_xcd4,0.0%,210.22,13141.77
stage1,256,32,4096,4096,32,8,ActivationType.Swiglu,torch.bfloat16,torch.float4_e2m1fn_x2,torch.float4_e2m1fn_x2,QuantType.per_1x32,1,0,32,0,124.8368,flydsl_moe1_afp4_wfp4_bf16_t32x64x256_w4_xcd4_fp4,0.8%,206.43,12904.9
stage1,256,32,4096,4096,32,8,ActivationType.Swiglu,torch.bfloat16,torch.float4_e2m1fn_x2,torch.float4_e2m1fn_x2,QuantType.per_1x32,1,0,32,0,112.2888,flydsl_moe1_afp4_wfp4_bf16_t32x128x256_bnt0,0.0%,229.5,14346.99
stage1,256,32,4096,4096,32,8,ActivationType.Swiglu,torch.bfloat16,torch.float4_e2m1fn_x2,torch.float4_e2m1fn_x2,QuantType.per_1x32,1,0,32,0,112.9445,flydsl_moe1_afp4_wfp4_bf16_t32x128x256_bnt0_fp4,0.8%,228.16,14263.7
stage1,256,32,4096,4096,32,8,ActivationType.Swiglu,torch.bfloat16,torch.float4_e2m1fn_x2,torch.float4_e2m1fn_x2,QuantType.per_1x32,1,0,32,0,135.4536,flydsl_moe1_afp4_wfp4_bf16_t32x128x256_bnt0_xcd4,0.0%,190.25,11893.42
stage1,256,32,4096,4096,32,8,ActivationType.Swiglu,torch.bfloat16,torch.float4_e2m1fn_x2,torch.float4_e2m1fn_x2,QuantType.per_1x32,1,0,32,0,134.7148,flydsl_moe1_afp4_wfp4_bf16_t32x128x256_bnt0_xcd4_fp4,0.8%,191.29,11958.64
stage1,256,32,4096,4096,32,8,ActivationType.Swiglu,torch.bfloat16,torch.float4_e2m1fn_x2,torch.float4_e2m1fn_x2,QuantType.per_1x32,1,0,32,0,106.6896,flydsl_moe1_afp4_wfp4_bf16_t32x128x256,0.0%,241.54,15099.93
stage1,256,32,4096,4096,32,8,ActivationType.Swiglu,torch.bfloat16,torch.float4_e2m1fn_x2,torch.float4_e2m1fn_x2,QuantType.per_1x32,1,0,32,0,108.2235,flydsl_moe1_afp4_wfp4_bf16_t32x128x256_fp4,0.8%,238.12,14885.92
stage1,256,32,4096,4096,32,8,ActivationType.Swiglu,torch.bfloat16,torch.float4_e2m1fn_x2,torch.float4_e2m1fn_x2,QuantType.per_1x32,1,0,32,0,126.8103,flydsl_moe1_afp4_wfp4_bf16_t32x128x256_xcd4,0.0%,203.22,12704.06
stage1,256,32,4096,4096,32,8,ActivationType.Swiglu,torch.bfloat16,torch.float4_e2m1fn_x2,torch.float4_e2m1fn_x2,QuantType.per_1x32,1,0,32,0,127.3894,flydsl_moe1_afp4_wfp4_bf16_t32x128x256_xcd4_fp4,0.8%,202.29,12646.31
stage1,256,32,4096,4096,32,8,ActivationType.Swiglu,torch.bfloat16,torch.float4_e2m1fn_x2,torch.float4_e2m1fn_x2,QuantType.per_1x32,1,0,32,0,108.9763,flydsl_moe1_afp4_wfp4_bf16_t32x128x256_w2_bnt0,0.0%,236.47,14783.09
stage1,256,32,4096,4096,32,8,ActivationType.Swiglu,torch.bfloat16,torch.float4_e2m1fn_x2,torch.float4_e2m1fn_x2,QuantType.per_1x32,1,0,32,0,109.2922,flydsl_moe1_afp4_wfp4_bf16_t32x128x256_w2_bnt0_fp4,0.8%,235.79,14740.36
stage1,256,32,4096,4096,32,8,ActivationType.Swiglu,torch.bfloat16,torch.float4_e2m1fn_x2,torch.float4_e2m1fn_x2,QuantType.per_1x32,1,0,32,0,125.7621,flydsl_moe1_afp4_wfp4_bf16_t32x128x256_w2_bnt0_xcd4,0.0%,204.91,12809.95
stage1,256,32,4096,4096,32,8,ActivationType.Swiglu,torch.bfloat16,torch.float4_e2m1fn_x2,torch.float4_e2m1fn_x2,QuantType.per_1x32,1,0,32,0,126.707,flydsl_moe1_afp4_wfp4_bf16_t32x128x256_w2_bnt0_xcd4_fp4,0.8%,203.38,12714.42
stage1,256,32,4096,4096,32,8,ActivationType.Swiglu,torch.bfloat16,torch.float4_e2m1fn_x2,torch.float4_e2m1fn_x2,QuantType.per_1x32,1,0,32,0,103.1498,flydsl_moe1_afp4_wfp4_bf16_t32x128x256_w2,0.0%,249.83,15618.12
stage1,256,32,4096,4096,32,8,ActivationType.Swiglu,torch.bfloat16,torch.float4_e2m1fn_x2,torch.float4_e2m1fn_x2,QuantType.per_1x32,1,0,32,0,104.3401,flydsl_moe1_afp4_wfp4_bf16_t32x128x256_w2_fp4,0.8%,246.98,15439.95
stage1,256,32,4096,4096,32,8,ActivationType.Swiglu,torch.bfloat16,torch.float4_e2m1fn_x2,torch.float4_e2m1fn_x2,QuantType.per_1x32,1,0,32,0,116.694,flydsl_moe1_afp4_wfp4_bf16_t32x128x256_w2_xcd4,0.0%,220.83,13805.39
stage1,256,32,4096,4096,32,8,ActivationType.Swiglu,torch.bfloat16,torch.float4_e2m1fn_x2,torch.float4_e2m1fn_x2,QuantType.per_1x32,1,0,32,0,119.1658,flydsl_moe1_afp4_wfp4_bf16_t32x128x256_w2_xcd4_fp4,0.8%,216.25,13519.03
stage1,256,32,4096,4096,32,8,ActivationType.Swiglu,torch.bfloat16,torch.float4_e2m1fn_x2,torch.float4_e2m1fn_x2,QuantType.per_1x32,1,0,32,0,108.0949,flydsl_moe1_afp4_wfp4_bf16_t32x128x256_w3_bnt0,0.0%,238.4,14903.63
stage1,256,32,4096,4096,32,8,ActivationType.Swiglu,torch.bfloat16,torch.float4_e2m1fn_x2,torch.float4_e2m1fn_x2,QuantType.per_1x32,1,0,32,0,108.2404,flydsl_moe1_afp4_wfp4_bf16_t32x128x256_w3_bnt0_fp4,0.8%,238.08,14883.59
stage1,256,32,4096,4096,32,8,ActivationType.Swiglu,torch.bfloat16,torch.float4_e2m1fn_x2,torch.float4_e2m1fn_x2,QuantType.per_1x32,1,0,32,0,119.975,flydsl_moe1_afp4_wfp4_bf16_t32x128x256_w3_bnt0_xcd4,0.0%,214.79,13427.85
stage1,256,32,4096,4096,32,8,ActivationType.Swiglu,torch.bfloat16,torch.float4_e2m1fn_x2,torch.float4_e2m1fn_x2,QuantType.per_1x32,1,0,32,0,120.9852,flydsl_moe1_afp4_wfp4_bf16_t32x128x256_w3_bnt0_xcd4_fp4,0.8%,213.0,13315.73
stage1,256,32,4096,4096,32,8,ActivationType.Swiglu,torch.bfloat16,torch.float4_e2m1fn_x2,torch.float4_e2m1fn_x2,QuantType.per_1x32,1,0,32,0,102.9169,flydsl_moe1_afp4_wfp4_bf16_t32x128x256_w3,0.0%,250.39,15653.46
stage1,256,32,4096,4096,32,8,ActivationType.Swiglu,torch.bfloat16,torch.float4_e2m1fn_x2,torch.float4_e2m1fn_x2,QuantType.per_1x32,1,0,32,0,102.8504,flydsl_moe1_afp4_wfp4_bf16_t32x128x256_w3_fp4,0.8%,250.56,15663.58
stage1,256,32,4096,4096,32,8,ActivationType.Swiglu,torch.bfloat16,torch.float4_e2m1fn_x2,torch.float4_e2m1fn_x2,QuantType.per_1x32,1,0,32,0,114.1421,flydsl_moe1_afp4_wfp4_bf16_t32x128x256_w3_xcd4,0.0%,225.77,14114.04
stage1,256,32,4096,4096,32,8,ActivationType.Swiglu,torch.bfloat16,torch.float4_e2m1fn_x2,torch.float4_e2m1fn_x2,QuantType.per_1x32,1,0,32,0,113.5254,flydsl_moe1_afp4_wfp4_bf16_t32x128x256_w3_xcd4_fp4,0.8%,227.0,14190.71
stage1,256,32,4096,4096,32,8,ActivationType.Swiglu,torch.bfloat16,torch.float4_e2m1fn_x2,torch.float4_e2m1fn_x2,QuantType.per_1x32,1,0,32,0,122.0346,flydsl_moe1_afp4_wfp4_bf16_t32x128x256_w3_kb2_bnt0_fp4,100.0%,211.17,13201.22
stage1,256,32,4096,4096,32,8,ActivationType.Swiglu,torch.bfloat16,torch.float4_e2m1fn_x2,torch.float4_e2m1fn_x2,QuantType.per_1x32,1,0,32,0,138.4215,flydsl_moe1_afp4_wfp4_bf16_t32x128x256_w3_kb2_bnt0_xcd4_fp4,100.0%,186.17,11638.41
stage1,256,32,4096,4096,32,8,ActivationType.Swiglu,torch.bfloat16,torch.float4_e2m1fn_x2,torch.float4_e2m1fn_x2,QuantType.per_1x32,1,0,32,0,120.1001,flydsl_moe1_afp4_wfp4_bf16_t32x128x256_w3_kb2_bnt0_go_fp4,76.5%,214.57,13413.86
stage1,256,32,4096,4096,32,8,ActivationType.Swiglu,torch.bfloat16,torch.float4_e2m1fn_x2,torch.float4_e2m1fn_x2,QuantType.per_1x32,1,0,32,0,130.2133,flydsl_moe1_afp4_wfp4_bf16_t32x128x256_w3_kb2_bnt0_go_xcd4_fp4,79.8%,197.9,12372.05
stage1,256,32,4096,4096,32,8,ActivationType.Swiglu,torch.bfloat16,torch.float4_e2m1fn_x2,torch.float4_e2m1fn_x2,QuantType.per_1x32,1,0,32,0,114.5064,flydsl_moe1_afp4_wfp4_bf16_t32x128x256_w3_kb2_fp4,100.0%,225.05,14069.13
stage1,256,32,4096,4096,32,8,ActivationType.Swiglu,torch.bfloat16,torch.float4_e2m1fn_x2,torch.float4_e2m1fn_x2,QuantType.per_1x32,1,0,32,0,132.0777,flydsl_moe1_afp4_wfp4_bf16_t32x128x256_w3_kb2_xcd4_fp4,100.0%,195.11,12197.41
stage1,256,32,4096,4096,32,8,ActivationType.Swiglu,torch.bfloat16,torch.float4_e2m1fn_x2,torch.float4_e2m1fn_x2,QuantType.per_1x32,1,0,32,0,115.2676,flydsl_moe1_afp4_wfp4_bf16_t32x128x256_w3_kb2_go_fp4,76.9%,223.57,13976.23
stage1,256,32,4096,4096,32,8,ActivationType.Swiglu,torch.bfloat16,torch.float4_e2m1fn_x2,torch.float4_e2m1fn_x2,QuantType.per_1x32,1,0,32,0,126.1701,flydsl_moe1_afp4_wfp4_bf16_t32x128x256_w3_kb2_go_xcd4_fp4,79.5%,204.25,12768.52
stage1,256,32,4096,4096,32,8,ActivationType.Swiglu,torch.bfloat16,torch.float4_e2m1fn_x2,torch.float4_e2m1fn_x2,QuantType.per_1x32,1,0,32,0,126.7251,flydsl_moe1_afp4_wfp4_bf16_t32x128x256_w3_kb4_bnt0_fp4,100.0%,203.35,12712.6
stage1,256,32,4096,4096,32,8,ActivationType.Swiglu,torch.bfloat16,torch.float4_e2m1fn_x2,torch.float4_e2m1fn_x2,QuantType.per_1x32,1,0,32,0,141.9983,flydsl_moe1_afp4_wfp4_bf16_t32x128x256_w3_kb4_bnt0_xcd4_fp4,100.0%,181.48,11345.25
stage1,256,32,4096,4096,32,8,ActivationType.Swiglu,torch.bfloat16,torch.float4_e2m1fn_x2,torch.float4_e2m1fn_x2,QuantType.per_1x32,1,0,32,0,127.7552,flydsl_moe1_afp4_wfp4_bf16_t32x128x256_w3_kb4_bnt0_go_fp4,83.2%,201.71,12610.1
stage1,256,32,4096,4096,32,8,ActivationType.Swiglu,torch.bfloat16,torch.float4_e2m1fn_x2,torch.float4_e2m1fn_x2,QuantType.per_1x32,1,0,32,0,129.7937,flydsl_moe1_afp4_wfp4_bf16_t32x128x256_w3_kb4_bnt0_go_xcd4_fp4,82.5%,198.54,12412.05
stage1,256,32,4096,4096,32,8,ActivationType.Swiglu,torch.bfloat16,torch.float4_e2m1fn_x2,torch.float4_e2m1fn_x2,QuantType.per_1x32,1,0,32,0,119.5384,flydsl_moe1_afp4_wfp4_bf16_t32x128x256_w3_kb4_fp4,100.0%,215.58,13476.89
stage1,256,32,4096,4096,32,8,ActivationType.Swiglu,torch.bfloat16,torch.float4_e2m1fn_x2,torch.float4_e2m1fn_x2,QuantType.per_1x32,1,0,32,0,134.2741,flydsl_moe1_afp4_wfp4_bf16_t32x128x256_w3_kb4_xcd4_fp4,100.0%,191.92,11997.89
stage1,256,32,4096,4096,32,8,ActivationType.Swiglu,torch.bfloat16,torch.float4_e2m1fn_x2,torch.float4_e2m1fn_x2,QuantType.per_1x32,1,0,32,0,123.2152,flydsl_moe1_afp4_wfp4_bf16_t32x128x256_w3_kb4_go_fp4,82.9%,209.14,13074.73
stage1,256,32,4096,4096,32,8,ActivationType.Swiglu,torch.bfloat16,torch.float4_e2m1fn_x2,torch.float4_e2m1fn_x2,QuantType.per_1x32,1,0,32,0,126.0579,flydsl_moe1_afp4_wfp4_bf16_t32x128x256_w3_kb4_go_xcd4_fp4,82.2%,204.43,12779.89
stage1,256,32,4096,4096,32,8,ActivationType.Swiglu,torch.bfloat16,torch.float4_e2m1fn_x2,torch.float4_e2m1fn_x2,QuantType.per_1x32,1,0,32,0,-1.0,flydsl_moe1_afp4_wfp4_bf16_t32x128x256_w3_kb7_bnt0_fp4,100.0%,0.0,0.0
stage1,256,32,4096,4096,32,8,ActivationType.Swiglu,torch.bfloat16,torch.float4_e2m1fn_x2,torch.float4_e2m1fn_x2,QuantType.per_1x32,1,0,32,0,-1.0,flydsl_moe1_afp4_wfp4_bf16_t32x128x256_w3_kb7_bnt0_xcd4_fp4,100.0%,0.0,0.0
stage1,256,32,4096,4096,32,8,ActivationType.Swiglu,torch.bfloat16,torch.float4_e2m1fn_x2,torch.float4_e2m1fn_x2,QuantType.per_1x32,1,0,32,0,-1.0,flydsl_moe1_afp4_wfp4_bf16_t32x128x256_w3_kb7_bnt0_go_fp4,100.0%,0.0,0.0
stage1,256,32,4096,4096,32,8,ActivationType.Swiglu,torch.bfloat16,torch.float4_e2m1fn_x2,torch.float4_e2m1fn_x2,QuantType.per_1x32,1,0,32,0,-1.0,flydsl_moe1_afp4_wfp4_bf16_t32x128x256_w3_kb7_bnt0_go_xcd4_fp4,100.0%,0.0,0.0
stage1,256,32,4096,4096,32,8,ActivationType.Swiglu,torch.bfloat16,torch.float4_e2m1fn_x2,torch.float4_e2m1fn_x2,QuantType.per_1x32,1,0,32,0,-1.0,flydsl_moe1_afp4_wfp4_bf16_t32x128x256_w3_kb7_fp4,100.0%,0.0,0.0
stage1,256,32,4096,4096,32,8,ActivationType.Swiglu,torch.bfloat16,torch.float4_e2m1fn_x2,torch.float4_e2m1fn_x2,QuantType.per_1x32,1,0,32,0,-1.0,flydsl_moe1_afp4_wfp4_bf16_t32x128x256_w3_kb7_xcd4_fp4,100.0%,0.0,0.0
stage1,256,32,4096,4096,32,8,ActivationType.Swiglu,torch.bfloat16,torch.float4_e2m1fn_x2,torch.float4_e2m1fn_x2,QuantType.per_1x32,1,0,32,0,-1.0,flydsl_moe1_afp4_wfp4_bf16_t32x128x256_w3_kb7_go_fp4,100.0%,0.0,0.0
stage1,256,32,4096,4096,32,8,ActivationType.Swiglu,torch.bfloat16,torch.float4_e2m1fn_x2,torch.float4_e2m1fn_x2,QuantType.per_1x32,1,0,32,0,-1.0,flydsl_moe1_afp4_wfp4_bf16_t32x128x256_w3_kb7_go_xcd4_fp4,100.0%,0.0,0.0
stage1,256,32,4096,4096,32,8,ActivationType.Swiglu,torch.bfloat16,torch.float4_e2m1fn_x2,torch.float4_e2m1fn_x2,QuantType.per_1x32,1,0,32,0,-1.0,flydsl_moe1_afp4_wfp4_bf16_t32x128x256_w3_kb14_bnt0_fp4,100.0%,0.0,0.0
stage1,256,32,4096,4096,32,8,ActivationType.Swiglu,torch.bfloat16,torch.float4_e2m1fn_x2,torch.float4_e2m1fn_x2,QuantType.per_1x32,1,0,32,0,-1.0,flydsl_moe1_afp4_wfp4_bf16_t32x128x256_w3_kb14_bnt0_xcd4_fp4,100.0%,0.0,0.0
stage1,256,32,4096,4096,32,8,ActivationType.Swiglu,torch.bfloat16,torch.float4_e2m1fn_x2,torch.float4_e2m1fn_x2,QuantType.per_1x32,1,0,32,0,-1.0,flydsl_moe1_afp4_wfp4_bf16_t32x128x256_w3_kb14_bnt0_go_fp4,100.0%,0.0,0.0
stage1,256,32,4096,4096,32,8,ActivationType.Swiglu,torch.bfloat16,torch.float4_e2m1fn_x2,torch.float4_e2m1fn_x2,QuantType.per_1x32,1,0,32,0,-1.0,flydsl_moe1_afp4_wfp4_bf16_t32x128x256_w3_kb14_bnt0_go_xcd4_fp4,100.0%,0.0,0.0
stage1,256,32,4096,4096,32,8,ActivationType.Swiglu,torch.bfloat16,torch.float4_e2m1fn_x2,torch.float4_e2m1fn_x2,QuantType.per_1x32,1,0,32,0,-1.0,flydsl_moe1_afp4_wfp4_bf16_t32x128x256_w3_kb14_fp4,100.0%,0.0,0.0
stage1,256,32,4096,4096,32,8,ActivationType.Swiglu,torch.bfloat16,torch.float4_e2m1fn_x2,torch.float4_e2m1fn_x2,QuantType.per_1x32,1,0,32,0,-1.0,flydsl_moe1_afp4_wfp4_bf16_t32x128x256_w3_kb14_xcd4_fp4,100.0%,0.0,0.0
stage1,256,32,4096,4096,32,8,ActivationType.Swiglu,torch.bfloat16,torch.float4_e2m1fn_x2,torch.float4_e2m1fn_x2,QuantType.per_1x32,1,0,32,0,-1.0,flydsl_moe1_afp4_wfp4_bf16_t32x128x256_w3_kb14_go_fp4,100.0%,0.0,0.0
stage1,256,32,4096,4096,32,8,ActivationType.Swiglu,torch.bfloat16,torch.float4_e2m1fn_x2,torch.float4_e2m1fn_x2,QuantType.per_1x32,1,0,32,0,-1.0,flydsl_moe1_afp4_wfp4_bf16_t32x128x256_w3_kb14_go_xcd4_fp4,100.0%,0.0,0.0
stage1,256,32,4096,4096,32,8,ActivationType.Swiglu,torch.bfloat16,torch.float4_e2m1fn_x2,torch.float4_e2m1fn_x2,QuantType.per_1x32,1,0,32,0,109.4241,flydsl_moe1_afp4_wfp4_bf16_t32x128x256_w4_bnt0,0.0%,235.5,14722.59
stage1,256,32,4096,4096,32,8,ActivationType.Swiglu,torch.bfloat16,torch.float4_e2m1fn_x2,torch.float4_e2m1fn_x2,QuantType.per_1x32,1,0,32,0,108.6416,flydsl_moe1_afp4_wfp4_bf16_t32x128x256_w4_bnt0_fp4,0.8%,237.2,14828.63
stage1,256,32,4096,4096,32,8,ActivationType.Swiglu,torch.bfloat16,torch.float4_e2m1fn_x2,torch.float4_e2m1fn_x2,QuantType.per_1x32,1,0,32,0,120.3716,flydsl_moe1_afp4_wfp4_bf16_t32x128x256_w4_bnt0_xcd4,0.0%,214.09,13383.61
stage1,256,32,4096,4096,32,8,ActivationType.Swiglu,torch.bfloat16,torch.float4_e2m1fn_x2,torch.float4_e2m1fn_x2,QuantType.per_1x32,1,0,32,0,120.4336,flydsl_moe1_afp4_wfp4_bf16_t32x128x256_w4_bnt0_xcd4_fp4,0.8%,213.98,13376.72
stage1,256,32,4096,4096,32,8,ActivationType.Swiglu,torch.bfloat16,torch.float4_e2m1fn_x2,torch.float4_e2m1fn_x2,QuantType.per_1x32,1,0,32,0,102.6956,flydsl_moe1_afp4_wfp4_bf16_t32x128x256_w4,0.0%,250.93,15687.2
stage1,256,32,4096,4096,32,8,ActivationType.Swiglu,torch.bfloat16,torch.float4_e2m1fn_x2,torch.float4_e2m1fn_x2,QuantType.per_1x32,1,0,32,0,103.3569,flydsl_moe1_afp4_wfp4_bf16_t32x128x256_w4_fp4,0.8%,249.33,15586.83
stage1,256,32,4096,4096,32,8,ActivationType.Swiglu,torch.bfloat16,torch.float4_e2m1fn_x2,torch.float4_e2m1fn_x2,QuantType.per_1x32,1,0,32,0,113.2503,flydsl_moe1_afp4_wfp4_bf16_t32x128x256_w4_xcd4,0.0%,227.55,14225.18
stage1,256,32,4096,4096,32,8,ActivationType.Swiglu,torch.bfloat16,torch.float4_e2m1fn_x2,torch.float4_e2m1fn_x2,QuantType.per_1x32,1,0,32,0,114.3312,flydsl_moe1_afp4_wfp4_bf16_t32x128x256_w4_xcd4_fp4,0.8%,225.4,14090.69
stage2,256,32,4096,4096,32,8,ActivationType.Swiglu,torch.bfloat16,torch.float4_e2m1fn_x2,torch.float4_e2m1fn_x2,QuantType.per_1x32,1,0,32,0,66.4335,flydsl_moe2_afp4_wfp4_bf16_t16x128x256_atomic_sbm32,9.2%,387.9,24249.9
stage2,256,32,4096,4096,32,8,ActivationType.Swiglu,torch.bfloat16,torch.float4_e2m1fn_x2,torch.float4_e2m1fn_x2,QuantType.per_1x32,1,0,32,0,62.6227,flydsl_moe2_afp4_wfp4_bf16_t16x128x256_atomic_persist_sbm32,9.1%,411.51,25725.59
stage2,256,32,4096,4096,32,8,ActivationType.Swiglu,torch.bfloat16,torch.float4_e2m1fn_x2,torch.float4_e2m1fn_x2,QuantType.per_1x32,1,0,32,0,77.1346,flydsl_moe2_afp4_wfp4_bf16_t16x128x256_atomic_xcd4_sbm32,9.3%,334.09,20885.65
stage2,256,32,4096,4096,32,8,ActivationType.Swiglu,torch.bfloat16,torch.float4_e2m1fn_x2,torch.float4_e2m1fn_x2,QuantType.per_1x32,1,0,32,0,184.4215,flydsl_moe2_afp4_wfp4_bf16_t16x128x256_atomic_xcd4_persist_sbm32,9.3%,139.73,8735.46
stage2,256,32,4096,4096,32,8,ActivationType.Swiglu,torch.bfloat16,torch.float4_e2m1fn_x2,torch.float4_e2m1fn_x2,QuantType.per_1x32,1,0,32,0,65.5698,flydsl_moe2_afp4_wfp4_bf16_t16x128x256_atomic_bnt2_sbm32,9.4%,393.01,24569.33
stage2,256,32,4096,4096,32,8,ActivationType.Swiglu,torch.bfloat16,torch.float4_e2m1fn_x2,torch.float4_e2m1fn_x2,QuantType.per_1x32,1,0,32,0,60.9467,flydsl_moe2_afp4_wfp4_bf16_t16x128x256_atomic_bnt2_persist_sbm32,9.2%,422.83,26433.03
stage2,256,32,4096,4096,32,8,ActivationType.Swiglu,torch.bfloat16,torch.float4_e2m1fn_x2,torch.float4_e2m1fn_x2,QuantType.per_1x32,1,0,32,0,77.6205,flydsl_moe2_afp4_wfp4_bf16_t16x128x256_atomic_bnt2_xcd4_sbm32,9.2%,332.0,20754.9
stage2,256,32,4096,4096,32,8,ActivationType.Swiglu,torch.bfloat16,torch.float4_e2m1fn_x2,torch.float4_e2m1fn_x2,QuantType.per_1x32,1,0,32,0,184.9319,flydsl_moe2_afp4_wfp4_bf16_t16x128x256_atomic_bnt2_xcd4_persist_sbm32,9.3%,139.35,8711.35
stage2,256,32,4096,4096,32,8,ActivationType.Swiglu,torch.bfloat16,torch.float4_e2m1fn_x2,torch.float4_e2m1fn_x2,QuantType.per_1x32,1,0,32,0,66.1708,flydsl_moe2_afp4_wfp4_bf16_t16x128x256_reduce_sbm32,3.8%,389.44,24346.18
stage2,256,32,4096,4096,32,8,ActivationType.Swiglu,torch.bfloat16,torch.float4_e2m1fn_x2,torch.float4_e2m1fn_x2,QuantType.per_1x32,1,0,32,0,62.1564,flydsl_moe2_afp4_wfp4_bf16_t16x128x256_reduce_persist_sbm32,3.8%,414.6,25918.59
stage2,256,32,4096,4096,32,8,ActivationType.Swiglu,torch.bfloat16,torch.float4_e2m1fn_x2,torch.float4_e2m1fn_x2,QuantType.per_1x32,1,0,32,0,77.7682,flydsl_moe2_afp4_wfp4_bf16_t16x128x256_reduce_xcd4_sbm32,3.8%,331.37,20715.48
stage2,256,32,4096,4096,32,8,ActivationType.Swiglu,torch.bfloat16,torch.float4_e2m1fn_x2,torch.float4_e2m1fn_x2,QuantType.per_1x32,1,0,32,0,183.2729,flydsl_moe2_afp4_wfp4_bf16_t16x128x256_reduce_xcd4_persist_sbm32,3.8%,140.61,8790.2
stage2,256,32,4096,4096,32,8,ActivationType.Swiglu,torch.bfloat16,torch.float4_e2m1fn_x2,torch.float4_e2m1fn_x2,QuantType.per_1x32,1,0,32,0,65.4049,flydsl_moe2_afp4_wfp4_bf16_t16x128x256_reduce_bnt2_sbm32,3.8%,394.0,24631.27
stage2,256,32,4096,4096,32,8,ActivationType.Swiglu,torch.bfloat16,torch.float4_e2m1fn_x2,torch.float4_e2m1fn_x2,QuantType.per_1x32,1,0,32,0,60.8702,flydsl_moe2_afp4_wfp4_bf16_t16x128x256_reduce_bnt2_persist_sbm32,3.8%,423.36,26466.25
stage2,256,32,4096,4096,32,8,ActivationType.Swiglu,torch.bfloat16,torch.float4_e2m1fn_x2,torch.float4_e2m1fn_x2,QuantType.per_1x32,1,0,32,0,77.8146,flydsl_moe2_afp4_wfp4_bf16_t16x128x256_reduce_bnt2_xcd4_sbm32,3.8%,331.17,20703.13
stage2,256,32,4096,4096,32,8,ActivationType.Swiglu,torch.bfloat16,torch.float4_e2m1fn_x2,torch.float4_e2m1fn_x2,QuantType.per_1x32,1,0,32,0,183.1604,flydsl_moe2_afp4_wfp4_bf16_t16x128x256_reduce_bnt2_xcd4_persist_sbm32,3.8%,140.7,8795.6
stage2,256,32,4096,4096,32,8,ActivationType.Swiglu,torch.bfloat16,torch.float4_e2m1fn_x2,torch.float4_e2m1fn_x2,QuantType.per_1x32,1,0,32,0,66.5274,flydsl_moe2_afp4_wfp4_bf16_t16x256x256_atomic_sbm32,9.2%,387.36,24215.68
stage2,256,32,4096,4096,32,8,ActivationType.Swiglu,torch.bfloat16,torch.float4_e2m1fn_x2,torch.float4_e2m1fn_x2,QuantType.per_1x32,1,0,32,0,67.1528,flydsl_moe2_afp4_wfp4_bf16_t16x256x256_atomic_persist_sbm32,9.2%,383.75,23990.15
stage2,256,32,4096,4096,32,8,ActivationType.Swiglu,torch.bfloat16,torch.float4_e2m1fn_x2,torch.float4_e2m1fn_x2,QuantType.per_1x32,1,0,32,0,70.7213,flydsl_moe2_afp4_wfp4_bf16_t16x256x256_atomic_xcd4_sbm32,9.2%,364.39,22779.64
stage2,256,32,4096,4096,32,8,ActivationType.Swiglu,torch.bfloat16,torch.float4_e2m1fn_x2,torch.float4_e2m1fn_x2,QuantType.per_1x32,1,0,32,0,175.6486,flydsl_moe2_afp4_wfp4_bf16_t16x256x256_atomic_xcd4_persist_sbm32,9.3%,146.71,9171.76
stage2,256,32,4096,4096,32,8,ActivationType.Swiglu,torch.bfloat16,torch.float4_e2m1fn_x2,torch.float4_e2m1fn_x2,QuantType.per_1x32,1,0,32,0,64.8427,flydsl_moe2_afp4_wfp4_bf16_t16x256x256_atomic_bnt2_sbm32,9.2%,397.42,24844.83
stage2,256,32,4096,4096,32,8,ActivationType.Swiglu,torch.bfloat16,torch.float4_e2m1fn_x2,torch.float4_e2m1fn_x2,QuantType.per_1x32,1,0,32,0,65.6346,flydsl_moe2_afp4_wfp4_bf16_t16x256x256_atomic_bnt2_persist_sbm32,9.2%,392.63,24545.07
stage2,256,32,4096,4096,32,8,ActivationType.Swiglu,torch.bfloat16,torch.float4_e2m1fn_x2,torch.float4_e2m1fn_x2,QuantType.per_1x32,1,0,32,0,69.6409,flydsl_moe2_afp4_wfp4_bf16_t16x256x256_atomic_bnt2_xcd4_sbm32,9.3%,370.04,23133.04
stage2,256,32,4096,4096,32,8,ActivationType.Swiglu,torch.bfloat16,torch.float4_e2m1fn_x2,torch.float4_e2m1fn_x2,QuantType.per_1x32,1,0,32,0,175.7146,flydsl_moe2_afp4_wfp4_bf16_t16x256x256_atomic_bnt2_xcd4_persist_sbm32,9.3%,146.66,9168.31
stage2,256,32,4096,4096,32,8,ActivationType.Swiglu,torch.bfloat16,torch.float4_e2m1fn_x2,torch.float4_e2m1fn_x2,QuantType.per_1x32,1,0,32,0,69.4017,flydsl_moe2_afp4_wfp4_bf16_t16x256x256_reduce_sbm32,3.8%,371.31,23212.77
stage2,256,32,4096,4096,32,8,ActivationType.Swiglu,torch.bfloat16,torch.float4_e2m1fn_x2,torch.float4_e2m1fn_x2,QuantType.per_1x32,1,0,32,0,67.728,flydsl_moe2_afp4_wfp4_bf16_t16x256x256_reduce_persist_sbm32,3.8%,380.49,23786.41
stage2,256,32,4096,4096,32,8,ActivationType.Swiglu,torch.bfloat16,torch.float4_e2m1fn_x2,torch.float4_e2m1fn_x2,QuantType.per_1x32,1,0,32,0,70.0825,flydsl_moe2_afp4_wfp4_bf16_t16x256x256_reduce_xcd4_sbm32,3.8%,367.71,22987.28
stage2,256,32,4096,4096,32,8,ActivationType.Swiglu,torch.bfloat16,torch.float4_e2m1fn_x2,torch.float4_e2m1fn_x2,QuantType.per_1x32,1,0,32,0,174.3125,flydsl_moe2_afp4_wfp4_bf16_t16x256x256_reduce_xcd4_persist_sbm32,3.8%,147.84,9242.06
stage2,256,32,4096,4096,32,8,ActivationType.Swiglu,torch.bfloat16,torch.float4_e2m1fn_x2,torch.float4_e2m1fn_x2,QuantType.per_1x32,1,0,32,0,66.9892,flydsl_moe2_afp4_wfp4_bf16_t16x256x256_reduce_bnt2_sbm32,3.8%,384.69,24048.74
stage2,256,32,4096,4096,32,8,ActivationType.Swiglu,torch.bfloat16,torch.float4_e2m1fn_x2,torch.float4_e2m1fn_x2,QuantType.per_1x32,1,0,32,0,66.941,flydsl_moe2_afp4_wfp4_bf16_t16x256x256_reduce_bnt2_persist_sbm32,3.8%,384.96,24066.06
stage2,256,32,4096,4096,32,8,ActivationType.Swiglu,torch.bfloat16,torch.float4_e2m1fn_x2,torch.float4_e2m1fn_x2,QuantType.per_1x32,1,0,32,0,72.6184,flydsl_moe2_afp4_wfp4_bf16_t16x256x256_reduce_bnt2_xcd4_sbm32,3.8%,354.87,22184.54
stage2,256,32,4096,4096,32,8,ActivationType.Swiglu,torch.bfloat16,torch.float4_e2m1fn_x2,torch.float4_e2m1fn_x2,QuantType.per_1x32,1,0,32,0,174.7777,flydsl_moe2_afp4_wfp4_bf16_t16x256x256_reduce_bnt2_xcd4_persist_sbm32,3.8%,147.44,9217.46
stage2,256,32,4096,4096,32,8,ActivationType.Swiglu,torch.bfloat16,torch.float4_e2m1fn_x2,torch.float4_e2m1fn_x2,QuantType.per_1x32,1,0,32,0,57.9713,flydsl_moe2_afp4_wfp4_bf16_t32x128x256_atomic,9.3%,444.53,27789.72
stage2,256,32,4096,4096,32,8,ActivationType.Swiglu,torch.bfloat16,torch.float4_e2m1fn_x2,torch.float4_e2m1fn_x2,QuantType.per_1x32,1,0,32,0,60.0768,flydsl_moe2_afp4_wfp4_bf16_t32x128x256_atomic_persist,9.3%,428.95,26815.78
stage2,256,32,4096,4096,32,8,ActivationType.Swiglu,torch.bfloat16,torch.float4_e2m1fn_x2,torch.float4_e2m1fn_x2,QuantType.per_1x32,1,0,32,0,59.8938,flydsl_moe2_afp4_wfp4_bf16_t32x128x256_atomic_xcd4,9.3%,430.26,26897.71
stage2,256,32,4096,4096,32,8,ActivationType.Swiglu,torch.bfloat16,torch.float4_e2m1fn_x2,torch.float4_e2m1fn_x2,QuantType.per_1x32,1,0,32,0,236.4417,flydsl_moe2_afp4_wfp4_bf16_t32x128x256_atomic_xcd4_persist,9.3%,108.99,6813.54
stage2,256,32,4096,4096,32,8,ActivationType.Swiglu,torch.bfloat16,torch.float4_e2m1fn_x2,torch.float4_e2m1fn_x2,QuantType.per_1x32,1,0,32,0,56.8457,flydsl_moe2_afp4_wfp4_bf16_t32x128x256_atomic_bnt2,9.2%,453.33,28339.98
stage2,256,32,4096,4096,32,8,ActivationType.Swiglu,torch.bfloat16,torch.float4_e2m1fn_x2,torch.float4_e2m1fn_x2,QuantType.per_1x32,1,0,32,0,58.7424,flydsl_moe2_afp4_wfp4_bf16_t32x128x256_atomic_bnt2_persist,9.3%,438.69,27424.93
stage2,256,32,4096,4096,32,8,ActivationType.Swiglu,torch.bfloat16,torch.float4_e2m1fn_x2,torch.float4_e2m1fn_x2,QuantType.per_1x32,1,0,32,0,58.3185,flydsl_moe2_afp4_wfp4_bf16_t32x128x256_atomic_bnt2_xcd4,9.2%,441.88,27624.27
stage2,256,32,4096,4096,32,8,ActivationType.Swiglu,torch.bfloat16,torch.float4_e2m1fn_x2,torch.float4_e2m1fn_x2,QuantType.per_1x32,1,0,32,0,235.1234,flydsl_moe2_afp4_wfp4_bf16_t32x128x256_atomic_bnt2_xcd4_persist,9.3%,109.6,6851.75
stage2,256,32,4096,4096,32,8,ActivationType.Swiglu,torch.bfloat16,torch.float4_e2m1fn_x2,torch.float4_e2m1fn_x2,QuantType.per_1x32,1,0,32,0,59.1589,flydsl_moe2_afp4_wfp4_bf16_t32x128x256_reduce,3.8%,435.6,27231.84
stage2,256,32,4096,4096,32,8,ActivationType.Swiglu,torch.bfloat16,torch.float4_e2m1fn_x2,torch.float4_e2m1fn_x2,QuantType.per_1x32,1,0,32,0,62.2542,flydsl_moe2_afp4_wfp4_bf16_t32x128x256_reduce_persist,3.8%,413.94,25877.87
stage2,256,32,4096,4096,32,8,ActivationType.Swiglu,torch.bfloat16,torch.float4_e2m1fn_x2,torch.float4_e2m1fn_x2,QuantType.per_1x32,1,0,32,0,60.4934,flydsl_moe2_afp4_wfp4_bf16_t32x128x256_reduce_xcd4,3.8%,425.99,26631.1
stage2,256,32,4096,4096,32,8,ActivationType.Swiglu,torch.bfloat16,torch.float4_e2m1fn_x2,torch.float4_e2m1fn_x2,QuantType.per_1x32,1,0,32,0,236.4051,flydsl_moe2_afp4_wfp4_bf16_t32x128x256_reduce_xcd4_persist,3.8%,109.01,6814.6
stage2,256,32,4096,4096,32,8,ActivationType.Swiglu,torch.bfloat16,torch.float4_e2m1fn_x2,torch.float4_e2m1fn_x2,QuantType.per_1x32,1,0,32,0,57.352,flydsl_moe2_afp4_wfp4_bf16_t32x128x256_reduce_bnt2,3.8%,449.33,28089.8
stage2,256,32,4096,4096,32,8,ActivationType.Swiglu,torch.bfloat16,torch.float4_e2m1fn_x2,torch.float4_e2m1fn_x2,QuantType.per_1x32,1,0,32,0,59.9325,flydsl_moe2_afp4_wfp4_bf16_t32x128x256_reduce_bnt2_persist,3.8%,429.98,26880.34
stage2,256,32,4096,4096,32,8,ActivationType.Swiglu,torch.bfloat16,torch.float4_e2m1fn_x2,torch.float4_e2m1fn_x2,QuantType.per_1x32,1,0,32,0,60.4825,flydsl_moe2_afp4_wfp4_bf16_t32x128x256_reduce_bnt2_xcd4,3.8%,426.07,26635.9
stage2,256,32,4096,4096,32,8,ActivationType.Swiglu,torch.bfloat16,torch.float4_e2m1fn_x2,torch.float4_e2m1fn_x2,QuantType.per_1x32,1,0,32,0,235.5733,flydsl_moe2_afp4_wfp4_bf16_t32x128x256_reduce_bnt2_xcd4_persist,3.8%,109.39,6838.66
stage2,256,32,4096,4096,32,8,ActivationType.Swiglu,torch.bfloat16,torch.float4_e2m1fn_x2,torch.float4_e2m1fn_x2,QuantType.per_1x32,1,0,32,0,68.3446,flydsl_moe2_afp4_wfp4_bf16_t32x256x256_atomic,9.3%,377.06,23571.81
stage2,256,32,4096,4096,32,8,ActivationType.Swiglu,torch.bfloat16,torch.float4_e2m1fn_x2,torch.float4_e2m1fn_x2,QuantType.per_1x32,1,0,32,0,67.578,flydsl_moe2_afp4_wfp4_bf16_t32x256x256_atomic_persist,9.3%,381.33,23839.21
stage2,256,32,4096,4096,32,8,ActivationType.Swiglu,torch.bfloat16,torch.float4_e2m1fn_x2,torch.float4_e2m1fn_x2,QuantType.per_1x32,1,0,32,0,63.4528,flydsl_moe2_afp4_wfp4_bf16_t32x256x256_atomic_xcd4,9.3%,406.13,25389.04
stage2,256,32,4096,4096,32,8,ActivationType.Swiglu,torch.bfloat16,torch.float4_e2m1fn_x2,torch.float4_e2m1fn_x2,QuantType.per_1x32,1,0,32,0,236.3111,flydsl_moe2_afp4_wfp4_bf16_t32x256x256_atomic_xcd4_persist,9.3%,109.05,6817.31
stage2,256,32,4096,4096,32,8,ActivationType.Swiglu,torch.bfloat16,torch.float4_e2m1fn_x2,torch.float4_e2m1fn_x2,QuantType.per_1x32,1,0,32,0,65.5961,flydsl_moe2_afp4_wfp4_bf16_t32x256x256_atomic_bnt2,9.3%,392.86,24559.48
stage2,256,32,4096,4096,32,8,ActivationType.Swiglu,torch.bfloat16,torch.float4_e2m1fn_x2,torch.float4_e2m1fn_x2,QuantType.per_1x32,1,0,32,0,64.1532,flydsl_moe2_afp4_wfp4_bf16_t32x256x256_atomic_bnt2_persist,9.3%,401.69,25111.86
stage2,256,32,4096,4096,32,8,ActivationType.Swiglu,torch.bfloat16,torch.float4_e2m1fn_x2,torch.float4_e2m1fn_x2,QuantType.per_1x32,1,0,32,0,62.3063,flydsl_moe2_afp4_wfp4_bf16_t32x256x256_atomic_bnt2_xcd4,9.4%,413.6,25856.23
stage2,256,32,4096,4096,32,8,ActivationType.Swiglu,torch.bfloat16,torch.float4_e2m1fn_x2,torch.float4_e2m1fn_x2,QuantType.per_1x32,1,0,32,0,235.758,flydsl_moe2_afp4_wfp4_bf16_t32x256x256_atomic_bnt2_xcd4_persist,9.3%,109.31,6833.3
stage2,256,32,4096,4096,32,8,ActivationType.Swiglu,torch.bfloat16,torch.float4_e2m1fn_x2,torch.float4_e2m1fn_x2,QuantType.per_1x32,1,0,32,0,68.5063,flydsl_moe2_afp4_wfp4_bf16_t32x256x256_reduce,3.8%,376.17,23516.17
stage2,256,32,4096,4096,32,8,ActivationType.Swiglu,torch.bfloat16,torch.float4_e2m1fn_x2,torch.float4_e2m1fn_x2,QuantType.per_1x32,1,0,32,0,67.926,flydsl_moe2_afp4_wfp4_bf16_t32x256x256_reduce_persist,3.8%,379.38,23717.07
stage2,256,32,4096,4096,32,8,ActivationType.Swiglu,torch.bfloat16,torch.float4_e2m1fn_x2,torch.float4_e2m1fn_x2,QuantType.per_1x32,1,0,32,0,64.3935,flydsl_moe2_afp4_wfp4_bf16_t32x256x256_reduce_xcd4,3.8%,400.19,25018.15
stage2,256,32,4096,4096,32,8,ActivationType.Swiglu,torch.bfloat16,torch.float4_e2m1fn_x2,torch.float4_e2m1fn_x2,QuantType.per_1x32,1,0,32,0,238.9169,flydsl_moe2_afp4_wfp4_bf16_t32x256x256_reduce_xcd4_persist,3.8%,107.86,6742.96
stage2,256,32,4096,4096,32,8,ActivationType.Swiglu,torch.bfloat16,torch.float4_e2m1fn_x2,torch.float4_e2m1fn_x2,QuantType.per_1x32,1,0,32,0,66.6436,flydsl_moe2_afp4_wfp4_bf16_t32x256x256_reduce_bnt2,3.8%,386.68,24173.45
stage2,256,32,4096,4096,32,8,ActivationType.Swiglu,torch.bfloat16,torch.float4_e2m1fn_x2,torch.float4_e2m1fn_x2,QuantType.per_1x32,1,0,32,0,65.785,flydsl_moe2_afp4_wfp4_bf16_t32x256x256_reduce_bnt2_persist,3.8%,391.73,24488.96
stage2,256,32,4096,4096,32,8,ActivationType.Swiglu,torch.bfloat16,torch.float4_e2m1fn_x2,torch.float4_e2m1fn_x2,QuantType.per_1x32,1,0,32,0,62.3241,flydsl_moe2_afp4_wfp4_bf16_t32x256x256_reduce_bnt2_xcd4,3.8%,413.48,25848.84
stage2,256,32,4096,4096,32,8,ActivationType.Swiglu,torch.bfloat16,torch.float4_e2m1fn_x2,torch.float4_e2m1fn_x2,QuantType.per_1x32,1,0,32,0,238.5718,flydsl_moe2_afp4_wfp4_bf16_t32x256x256_reduce_bnt2_xcd4_persist,3.8%,108.02,6752.71
stage1,256,32,4096,4096,32,8,ActivationType.Swiglu,torch.bfloat16,torch.float4_e2m1fn_x2,torch.float4_e2m1fn_x2,QuantType.per_1x32,1,0,64,0,130.7135,flydsl_moe1_afp4_wfp4_bf16_t64x64x256_bnt0,0.0%,197.15,12324.71
stage1,256,32,4096,4096,32,8,ActivationType.Swiglu,torch.bfloat16,torch.float4_e2m1fn_x2,torch.float4_e2m1fn_x2,QuantType.per_1x32,1,0,64,0,134.137,flydsl_moe1_afp4_wfp4_bf16_t64x64x256_bnt0_fp4,0.8%,192.12,12010.15
stage1,256,32,4096,4096,32,8,ActivationType.Swiglu,torch.bfloat16,torch.float4_e2m1fn_x2,torch.float4_e2m1fn_x2,QuantType.per_1x32,1,0,64,0,158.6175,flydsl_moe1_afp4_wfp4_bf16_t64x64x256_bnt0_xcd4,0.0%,162.47,10156.55
stage1,256,32,4096,4096,32,8,ActivationType.Swiglu,torch.bfloat16,torch.float4_e2m1fn_x2,torch.float4_e2m1fn_x2,QuantType.per_1x32,1,0,64,0,164.3239,flydsl_moe1_afp4_wfp4_bf16_t64x64x256_bnt0_xcd4_fp4,0.8%,156.82,9803.84
stage1,256,32,4096,4096,32,8,ActivationType.Swiglu,torch.bfloat16,torch.float4_e2m1fn_x2,torch.float4_e2m1fn_x2,QuantType.per_1x32,1,0,64,0,127.4274,flydsl_moe1_afp4_wfp4_bf16_t64x64x256,0.0%,202.23,12642.54
stage1,256,32,4096,4096,32,8,ActivationType.Swiglu,torch.bfloat16,torch.float4_e2m1fn_x2,torch.float4_e2m1fn_x2,QuantType.per_1x32,1,0,64,0,131.4793,flydsl_moe1_afp4_wfp4_bf16_t64x64x256_fp4,0.8%,196.0,12252.92
stage1,256,32,4096,4096,32,8,ActivationType.Swiglu,torch.bfloat16,torch.float4_e2m1fn_x2,torch.float4_e2m1fn_x2,QuantType.per_1x32,1,0,64,0,148.3491,flydsl_moe1_afp4_wfp4_bf16_t64x64x256_xcd4,0.0%,173.71,10859.56
stage1,256,32,4096,4096,32,8,ActivationType.Swiglu,torch.bfloat16,torch.float4_e2m1fn_x2,torch.float4_e2m1fn_x2,QuantType.per_1x32,1,0,64,0,154.8883,flydsl_moe1_afp4_wfp4_bf16_t64x64x256_xcd4_fp4,0.8%,166.38,10401.08
stage1,256,32,4096,4096,32,8,ActivationType.Swiglu,torch.bfloat16,torch.float4_e2m1fn_x2,torch.float4_e2m1fn_x2,QuantType.per_1x32,1,0,64,0,105.5629,flydsl_moe1_afp4_wfp4_bf16_t64x64x256_w2_bnt0,0.0%,244.12,15261.1
stage1,256,32,4096,4096,32,8,ActivationType.Swiglu,torch.bfloat16,torch.float4_e2m1fn_x2,torch.float4_e2m1fn_x2,QuantType.per_1x32,1,0,64,0,107.4731,flydsl_moe1_afp4_wfp4_bf16_t64x64x256_w2_bnt0_fp4,0.8%,239.78,14989.85
stage1,256,32,4096,4096,32,8,ActivationType.Swiglu,torch.bfloat16,torch.float4_e2m1fn_x2,torch.float4_e2m1fn_x2,QuantType.per_1x32,1,0,64,0,136.215,flydsl_moe1_afp4_wfp4_bf16_t64x64x256_w2_bnt0_xcd4,0.0%,189.18,11826.94
stage1,256,32,4096,4096,32,8,ActivationType.Swiglu,torch.bfloat16,torch.float4_e2m1fn_x2,torch.float4_e2m1fn_x2,QuantType.per_1x32,1,0,64,0,137.0696,flydsl_moe1_afp4_wfp4_bf16_t64x64x256_w2_bnt0_xcd4_fp4,0.8%,188.01,11753.2
stage1,256,32,4096,4096,32,8,ActivationType.Swiglu,torch.bfloat16,torch.float4_e2m1fn_x2,torch.float4_e2m1fn_x2,QuantType.per_1x32,1,0,64,0,100.5472,flydsl_moe1_afp4_wfp4_bf16_t64x64x256_w2,0.0%,256.3,16022.39
stage1,256,32,4096,4096,32,8,ActivationType.Swiglu,torch.bfloat16,torch.float4_e2m1fn_x2,torch.float4_e2m1fn_x2,QuantType.per_1x32,1,0,64,0,100.2771,flydsl_moe1_afp4_wfp4_bf16_t64x64x256_w2_fp4,0.8%,256.99,16065.54
stage1,256,32,4096,4096,32,8,ActivationType.Swiglu,torch.bfloat16,torch.float4_e2m1fn_x2,torch.float4_e2m1fn_x2,QuantType.per_1x32,1,0,64,0,127.1157,flydsl_moe1_afp4_wfp4_bf16_t64x64x256_w2_xcd4,0.0%,202.73,12673.54
stage1,256,32,4096,4096,32,8,ActivationType.Swiglu,torch.bfloat16,torch.float4_e2m1fn_x2,torch.float4_e2m1fn_x2,QuantType.per_1x32,1,0,64,0,129.7849,flydsl_moe1_afp4_wfp4_bf16_t64x64x256_w2_xcd4_fp4,0.8%,198.56,12412.89
stage1,256,32,4096,4096,32,8,ActivationType.Swiglu,torch.bfloat16,torch.float4_e2m1fn_x2,torch.float4_e2m1fn_x2,QuantType.per_1x32,1,0,64,0,104.1093,flydsl_moe1_afp4_wfp4_bf16_t64x64x256_w3_bnt0,0.0%,247.53,15474.18
stage1,256,32,4096,4096,32,8,ActivationType.Swiglu,torch.bfloat16,torch.float4_e2m1fn_x2,torch.float4_e2m1fn_x2,QuantType.per_1x32,1,0,64,0,106.1758,flydsl_moe1_afp4_wfp4_bf16_t64x64x256_w3_bnt0_fp4,0.8%,242.71,15173.01
stage1,256,32,4096,4096,32,8,ActivationType.Swiglu,torch.bfloat16,torch.float4_e2m1fn_x2,torch.float4_e2m1fn_x2,QuantType.per_1x32,1,0,64,0,128.1865,flydsl_moe1_afp4_wfp4_bf16_t64x64x256_w3_bnt0_xcd4,0.0%,201.03,12567.67
stage1,256,32,4096,4096,32,8,ActivationType.Swiglu,torch.bfloat16,torch.float4_e2m1fn_x2,torch.float4_e2m1fn_x2,QuantType.per_1x32,1,0,64,0,129.6059,flydsl_moe1_afp4_wfp4_bf16_t64x64x256_w3_bnt0_xcd4_fp4,0.8%,198.83,12430.04
stage1,256,32,4096,4096,32,8,ActivationType.Swiglu,torch.bfloat16,torch.float4_e2m1fn_x2,torch.float4_e2m1fn_x2,QuantType.per_1x32,1,0,64,0,98.375,flydsl_moe1_afp4_wfp4_bf16_t64x64x256_w3,0.0%,261.95,16376.17
stage1,256,32,4096,4096,32,8,ActivationType.Swiglu,torch.bfloat16,torch.float4_e2m1fn_x2,torch.float4_e2m1fn_x2,QuantType.per_1x32,1,0,64,0,100.5008,flydsl_moe1_afp4_wfp4_bf16_t64x64x256_w3_fp4,0.8%,256.41,16029.78
stage1,256,32,4096,4096,32,8,ActivationType.Swiglu,torch.bfloat16,torch.float4_e2m1fn_x2,torch.float4_e2m1fn_x2,QuantType.per_1x32,1,0,64,0,120.8743,flydsl_moe1_afp4_wfp4_bf16_t64x64x256_w3_xcd4,0.0%,213.2,13327.94
stage1,256,32,4096,4096,32,8,ActivationType.Swiglu,torch.bfloat16,torch.float4_e2m1fn_x2,torch.float4_e2m1fn_x2,QuantType.per_1x32,1,0,64,0,120.5649,flydsl_moe1_afp4_wfp4_bf16_t64x64x256_w3_xcd4_fp4,0.8%,213.74,13362.15
stage1,256,32,4096,4096,32,8,ActivationType.Swiglu,torch.bfloat16,torch.float4_e2m1fn_x2,torch.float4_e2m1fn_x2,QuantType.per_1x32,1,0,64,0,104.2928,flydsl_moe1_afp4_wfp4_bf16_t64x64x256_w4_bnt0,0.0%,247.09,15446.95
stage1,256,32,4096,4096,32,8,ActivationType.Swiglu,torch.bfloat16,torch.float4_e2m1fn_x2,torch.float4_e2m1fn_x2,QuantType.per_1x32,1,0,64,0,105.3026,flydsl_moe1_afp4_wfp4_bf16_t64x64x256_w4_bnt0_fp4,0.8%,244.72,15298.82
stage1,256,32,4096,4096,32,8,ActivationType.Swiglu,torch.bfloat16,torch.float4_e2m1fn_x2,torch.float4_e2m1fn_x2,QuantType.per_1x32,1,0,64,0,123.5742,flydsl_moe1_afp4_wfp4_bf16_t64x64x256_w4_bnt0_xcd4,0.0%,208.54,13036.75
stage1,256,32,4096,4096,32,8,ActivationType.Swiglu,torch.bfloat16,torch.float4_e2m1fn_x2,torch.float4_e2m1fn_x2,QuantType.per_1x32,1,0,64,0,123.9683,flydsl_moe1_afp4_wfp4_bf16_t64x64x256_w4_bnt0_xcd4_fp4,0.8%,207.87,12995.31
stage1,256,32,4096,4096,32,8,ActivationType.Swiglu,torch.bfloat16,torch.float4_e2m1fn_x2,torch.float4_e2m1fn_x2,QuantType.per_1x32,1,0,64,0,98.4908,flydsl_moe1_afp4_wfp4_bf16_t64x64x256_w4,0.0%,261.65,16356.92
stage1,256,32,4096,4096,32,8,ActivationType.Swiglu,torch.bfloat16,torch.float4_e2m1fn_x2,torch.float4_e2m1fn_x2,QuantType.per_1x32,1,0,64,0,99.4117,flydsl_moe1_afp4_wfp4_bf16_t64x64x256_w4_fp4,0.8%,259.22,16205.4
stage1,256,32,4096,4096,32,8,ActivationType.Swiglu,torch.bfloat16,torch.float4_e2m1fn_x2,torch.float4_e2m1fn_x2,QuantType.per_1x32,1,0,64,0,114.2911,flydsl_moe1_afp4_wfp4_bf16_t64x64x256_w4_xcd4,0.0%,225.48,14095.64
stage1,256,32,4096,4096,32,8,ActivationType.Swiglu,torch.bfloat16,torch.float4_e2m1fn_x2,torch.float4_e2m1fn_x2,QuantType.per_1x32,1,0,64,0,116.847,flydsl_moe1_afp4_wfp4_bf16_t64x64x256_w4_xcd4_fp4,0.8%,220.54,13787.31
stage1,256,32,4096,4096,32,8,ActivationType.Swiglu,torch.bfloat16,torch.float4_e2m1fn_x2,torch.float4_e2m1fn_x2,QuantType.per_1x32,1,0,64,0,116.6854,flydsl_moe1_afp4_wfp4_bf16_t64x128x256_bnt0,0.0%,220.85,13806.41
stage1,256,32,4096,4096,32,8,ActivationType.Swiglu,torch.bfloat16,torch.float4_e2m1fn_x2,torch.float4_e2m1fn_x2,QuantType.per_1x32,1,0,64,0,116.8804,flydsl_moe1_afp4_wfp4_bf16_t64x128x256_bnt0_fp4,0.8%,220.48,13783.37
stage1,256,32,4096,4096,32,8,ActivationType.Swiglu,torch.bfloat16,torch.float4_e2m1fn_x2,torch.float4_e2m1fn_x2,QuantType.per_1x32,1,0,64,0,144.4479,flydsl_moe1_afp4_wfp4_bf16_t64x128x256_bnt0_xcd4,0.0%,178.4,11152.85
stage1,256,32,4096,4096,32,8,ActivationType.Swiglu,torch.bfloat16,torch.float4_e2m1fn_x2,torch.float4_e2m1fn_x2,QuantType.per_1x32,1,0,64,0,145.6553,flydsl_moe1_afp4_wfp4_bf16_t64x128x256_bnt0_xcd4_fp4,0.8%,176.92,11060.4
stage1,256,32,4096,4096,32,8,ActivationType.Swiglu,torch.bfloat16,torch.float4_e2m1fn_x2,torch.float4_e2m1fn_x2,QuantType.per_1x32,1,0,64,0,109.9454,flydsl_moe1_afp4_wfp4_bf16_t64x128x256,0.0%,234.39,14652.78
stage1,256,32,4096,4096,32,8,ActivationType.Swiglu,torch.bfloat16,torch.float4_e2m1fn_x2,torch.float4_e2m1fn_x2,QuantType.per_1x32,1,0,64,0,110.5182,flydsl_moe1_afp4_wfp4_bf16_t64x128x256_fp4,0.8%,233.17,14576.84
stage1,256,32,4096,4096,32,8,ActivationType.Swiglu,torch.bfloat16,torch.float4_e2m1fn_x2,torch.float4_e2m1fn_x2,QuantType.per_1x32,1,0,64,0,133.3326,flydsl_moe1_afp4_wfp4_bf16_t64x128x256_xcd4,0.0%,193.27,12082.61
stage1,256,32,4096,4096,32,8,ActivationType.Swiglu,torch.bfloat16,torch.float4_e2m1fn_x2,torch.float4_e2m1fn_x2,QuantType.per_1x32,1,0,64,0,134.248,flydsl_moe1_afp4_wfp4_bf16_t64x128x256_xcd4_fp4,0.8%,191.96,12000.22
stage1,256,32,4096,4096,32,8,ActivationType.Swiglu,torch.bfloat16,torch.float4_e2m1fn_x2,torch.float4_e2m1fn_x2,QuantType.per_1x32,1,0,64,0,110.6503,flydsl_moe1_afp4_wfp4_bf16_t64x128x256_w2_bnt0,0.0%,232.89,14559.44
stage1,256,32,4096,4096,32,8,ActivationType.Swiglu,torch.bfloat16,torch.float4_e2m1fn_x2,torch.float4_e2m1fn_x2,QuantType.per_1x32,1,0,64,0,110.5187,flydsl_moe1_afp4_wfp4_bf16_t64x128x256_w2_bnt0_fp4,0.8%,233.17,14576.77
stage1,256,32,4096,4096,32,8,ActivationType.Swiglu,torch.bfloat16,torch.float4_e2m1fn_x2,torch.float4_e2m1fn_x2,QuantType.per_1x32,1,0,64,0,127.5886,flydsl_moe1_afp4_wfp4_bf16_t64x128x256_w2_bnt0_xcd4,0.0%,201.98,12626.57
stage1,256,32,4096,4096,32,8,ActivationType.Swiglu,torch.bfloat16,torch.float4_e2m1fn_x2,torch.float4_e2m1fn_x2,QuantType.per_1x32,1,0,64,0,127.4122,flydsl_moe1_afp4_wfp4_bf16_t64x128x256_w2_bnt0_xcd4_fp4,0.8%,202.26,12644.05
stage1,256,32,4096,4096,32,8,ActivationType.Swiglu,torch.bfloat16,torch.float4_e2m1fn_x2,torch.float4_e2m1fn_x2,QuantType.per_1x32,1,0,64,0,104.559,flydsl_moe1_afp4_wfp4_bf16_t64x128x256_w2,0.0%,246.46,15407.63
stage1,256,32,4096,4096,32,8,ActivationType.Swiglu,torch.bfloat16,torch.float4_e2m1fn_x2,torch.float4_e2m1fn_x2,QuantType.per_1x32,1,0,64,0,104.7212,flydsl_moe1_afp4_wfp4_bf16_t64x128x256_w2_fp4,0.8%,246.08,15383.76
stage1,256,32,4096,4096,32,8,ActivationType.Swiglu,torch.bfloat16,torch.float4_e2m1fn_x2,torch.float4_e2m1fn_x2,QuantType.per_1x32,1,0,64,0,117.8565,flydsl_moe1_afp4_wfp4_bf16_t64x128x256_w2_xcd4,0.0%,218.65,13669.22
stage1,256,32,4096,4096,32,8,ActivationType.Swiglu,torch.bfloat16,torch.float4_e2m1fn_x2,torch.float4_e2m1fn_x2,QuantType.per_1x32,1,0,64,0,117.2958,flydsl_moe1_afp4_wfp4_bf16_t64x128x256_w2_xcd4_fp4,0.8%,219.7,13734.56
stage1,256,32,4096,4096,32,8,ActivationType.Swiglu,torch.bfloat16,torch.float4_e2m1fn_x2,torch.float4_e2m1fn_x2,QuantType.per_1x32,1,0,64,0,109.9212,flydsl_moe1_afp4_wfp4_bf16_t64x128x256_w3_bnt0,0.0%,234.44,14656.01
stage1,256,32,4096,4096,32,8,ActivationType.Swiglu,torch.bfloat16,torch.float4_e2m1fn_x2,torch.float4_e2m1fn_x2,QuantType.per_1x32,1,0,64,0,110.415,flydsl_moe1_afp4_wfp4_bf16_t64x128x256_w3_bnt0_fp4,0.8%,233.39,14590.46
stage1,256,32,4096,4096,32,8,ActivationType.Swiglu,torch.bfloat16,torch.float4_e2m1fn_x2,torch.float4_e2m1fn_x2,QuantType.per_1x32,1,0,64,0,127.7565,flydsl_moe1_afp4_wfp4_bf16_t64x128x256_w3_bnt0_xcd4,0.0%,201.71,12609.97
stage1,256,32,4096,4096,32,8,ActivationType.Swiglu,torch.bfloat16,torch.float4_e2m1fn_x2,torch.float4_e2m1fn_x2,QuantType.per_1x32,1,0,64,0,127.4608,flydsl_moe1_afp4_wfp4_bf16_t64x128x256_w3_bnt0_xcd4_fp4,0.8%,202.18,12639.23
stage1,256,32,4096,4096,32,8,ActivationType.Swiglu,torch.bfloat16,torch.float4_e2m1fn_x2,torch.float4_e2m1fn_x2,QuantType.per_1x32,1,0,64,0,104.1161,flydsl_moe1_afp4_wfp4_bf16_t64x128x256_w3,0.0%,247.51,15473.17
stage1,256,32,4096,4096,32,8,ActivationType.Swiglu,torch.bfloat16,torch.float4_e2m1fn_x2,torch.float4_e2m1fn_x2,QuantType.per_1x32,1,0,64,0,104.9475,flydsl_moe1_afp4_wfp4_bf16_t64x128x256_w3_fp4,0.8%,245.55,15350.59
stage1,256,32,4096,4096,32,8,ActivationType.Swiglu,torch.bfloat16,torch.float4_e2m1fn_x2,torch.float4_e2m1fn_x2,QuantType.per_1x32,1,0,64,0,117.0644,flydsl_moe1_afp4_wfp4_bf16_t64x128x256_w3_xcd4,0.0%,220.13,13761.71
stage1,256,32,4096,4096,32,8,ActivationType.Swiglu,torch.bfloat16,torch.float4_e2m1fn_x2,torch.float4_e2m1fn_x2,QuantType.per_1x32,1,0,64,0,117.3318,flydsl_moe1_afp4_wfp4_bf16_t64x128x256_w3_xcd4_fp4,0.8%,219.63,13730.34
stage1,256,32,4096,4096,32,8,ActivationType.Swiglu,torch.bfloat16,torch.float4_e2m1fn_x2,torch.float4_e2m1fn_x2,QuantType.per_1x32,1,0,64,0,110.3988,flydsl_moe1_afp4_wfp4_bf16_t64x128x256_w4_bnt0,0.0%,233.42,14592.6
stage1,256,32,4096,4096,32,8,ActivationType.Swiglu,torch.bfloat16,torch.float4_e2m1fn_x2,torch.float4_e2m1fn_x2,QuantType.per_1x32,1,0,64,0,110.2259,flydsl_moe1_afp4_wfp4_bf16_t64x128x256_w4_bnt0_fp4,0.8%,233.79,14615.49
stage1,256,32,4096,4096,32,8,ActivationType.Swiglu,torch.bfloat16,torch.float4_e2m1fn_x2,torch.float4_e2m1fn_x2,QuantType.per_1x32,1,0,64,0,127.4793,flydsl_moe1_afp4_wfp4_bf16_t64x128x256_w4_bnt0_xcd4,0.0%,202.15,12637.39
stage1,256,32,4096,4096,32,8,ActivationType.Swiglu,torch.bfloat16,torch.float4_e2m1fn_x2,torch.float4_e2m1fn_x2,QuantType.per_1x32,1,0,64,0,126.9831,flydsl_moe1_afp4_wfp4_bf16_t64x128x256_w4_bnt0_xcd4_fp4,0.8%,202.94,12686.77
stage1,256,32,4096,4096,32,8,ActivationType.Swiglu,torch.bfloat16,torch.float4_e2m1fn_x2,torch.float4_e2m1fn_x2,QuantType.per_1x32,1,0,64,0,104.5046,flydsl_moe1_afp4_wfp4_bf16_t64x128x256_w4,0.0%,246.59,15415.65
stage1,256,32,4096,4096,32,8,ActivationType.Swiglu,torch.bfloat16,torch.float4_e2m1fn_x2,torch.float4_e2m1fn_x2,QuantType.per_1x32,1,0,64,0,104.71,flydsl_moe1_afp4_wfp4_bf16_t64x128x256_w4_fp4,0.8%,246.11,15385.41
stage1,256,32,4096,4096,32,8,ActivationType.Swiglu,torch.bfloat16,torch.float4_e2m1fn_x2,torch.float4_e2m1fn_x2,QuantType.per_1x32,1,0,64,0,116.1278,flydsl_moe1_afp4_wfp4_bf16_t64x128x256_w4_xcd4,0.0%,221.91,13872.7
stage1,256,32,4096,4096,32,8,ActivationType.Swiglu,torch.bfloat16,torch.float4_e2m1fn_x2,torch.float4_e2m1fn_x2,QuantType.per_1x32,1,0,64,0,117.49,flydsl_moe1_afp4_wfp4_bf16_t64x128x256_w4_xcd4_fp4,0.8%,219.34,13711.86
stage2,256,32,4096,4096,32,8,ActivationType.Swiglu,torch.bfloat16,torch.float4_e2m1fn_x2,torch.float4_e2m1fn_x2,QuantType.per_1x32,1,0,64,0,64.2316,flydsl_moe2_afp4_wfp4_bf16_t32x128x256_atomic_sbm64,9.2%,401.2,25081.21
stage2,256,32,4096,4096,32,8,ActivationType.Swiglu,torch.bfloat16,torch.float4_e2m1fn_x2,torch.float4_e2m1fn_x2,QuantType.per_1x32,1,0,64,0,61.0057,flydsl_moe2_afp4_wfp4_bf16_t32x128x256_atomic_persist_sbm64,9.1%,422.42,26407.47
stage2,256,32,4096,4096,32,8,ActivationType.Swiglu,torch.bfloat16,torch.float4_e2m1fn_x2,torch.float4_e2m1fn_x2,QuantType.per_1x32,1,0,64,0,70.595,flydsl_moe2_afp4_wfp4_bf16_t32x128x256_atomic_xcd4_sbm64,9.1%,365.04,22820.4
stage2,256,32,4096,4096,32,8,ActivationType.Swiglu,torch.bfloat16,torch.float4_e2m1fn_x2,torch.float4_e2m1fn_x2,QuantType.per_1x32,1,0,64,0,200.9399,flydsl_moe2_afp4_wfp4_bf16_t32x128x256_atomic_xcd4_persist_sbm64,9.3%,128.25,8017.35
stage2,256,32,4096,4096,32,8,ActivationType.Swiglu,torch.bfloat16,torch.float4_e2m1fn_x2,torch.float4_e2m1fn_x2,QuantType.per_1x32,1,0,64,0,62.0225,flydsl_moe2_afp4_wfp4_bf16_t32x128x256_atomic_bnt2_sbm64,9.1%,415.49,25974.54
stage2,256,32,4096,4096,32,8,ActivationType.Swiglu,torch.bfloat16,torch.float4_e2m1fn_x2,torch.float4_e2m1fn_x2,QuantType.per_1x32,1,0,64,0,58.1142,flydsl_moe2_afp4_wfp4_bf16_t32x128x256_atomic_bnt2_persist_sbm64,9.1%,443.43,27721.38
stage2,256,32,4096,4096,32,8,ActivationType.Swiglu,torch.bfloat16,torch.float4_e2m1fn_x2,torch.float4_e2m1fn_x2,QuantType.per_1x32,1,0,64,0,70.1087,flydsl_moe2_afp4_wfp4_bf16_t32x128x256_atomic_bnt2_xcd4_sbm64,9.1%,367.57,22978.69
stage2,256,32,4096,4096,32,8,ActivationType.Swiglu,torch.bfloat16,torch.float4_e2m1fn_x2,torch.float4_e2m1fn_x2,QuantType.per_1x32,1,0,64,0,201.1581,flydsl_moe2_afp4_wfp4_bf16_t32x128x256_atomic_bnt2_xcd4_persist_sbm64,9.3%,128.11,8008.66
stage2,256,32,4096,4096,32,8,ActivationType.Swiglu,torch.bfloat16,torch.float4_e2m1fn_x2,torch.float4_e2m1fn_x2,QuantType.per_1x32,1,0,64,0,66.0764,flydsl_moe2_afp4_wfp4_bf16_t32x128x256_reduce_sbm64,3.8%,390.0,24380.96
stage2,256,32,4096,4096,32,8,ActivationType.Swiglu,torch.bfloat16,torch.float4_e2m1fn_x2,torch.float4_e2m1fn_x2,QuantType.per_1x32,1,0,64,0,60.8596,flydsl_moe2_afp4_wfp4_bf16_t32x128x256_reduce_persist_sbm64,3.8%,423.43,26470.86
stage2,256,32,4096,4096,32,8,ActivationType.Swiglu,torch.bfloat16,torch.float4_e2m1fn_x2,torch.float4_e2m1fn_x2,QuantType.per_1x32,1,0,64,0,72.8769,flydsl_moe2_afp4_wfp4_bf16_t32x128x256_reduce_xcd4_sbm64,3.8%,353.61,22105.85
stage2,256,32,4096,4096,32,8,ActivationType.Swiglu,torch.bfloat16,torch.float4_e2m1fn_x2,torch.float4_e2m1fn_x2,QuantType.per_1x32,1,0,64,0,201.7908,flydsl_moe2_afp4_wfp4_bf16_t32x128x256_reduce_xcd4_persist_sbm64,3.8%,127.71,7983.55
stage2,256,32,4096,4096,32,8,ActivationType.Swiglu,torch.bfloat16,torch.float4_e2m1fn_x2,torch.float4_e2m1fn_x2,QuantType.per_1x32,1,0,64,0,63.8507,flydsl_moe2_afp4_wfp4_bf16_t32x128x256_reduce_bnt2_sbm64,3.8%,403.59,25230.83
stage2,256,32,4096,4096,32,8,ActivationType.Swiglu,torch.bfloat16,torch.float4_e2m1fn_x2,torch.float4_e2m1fn_x2,QuantType.per_1x32,1,0,64,0,60.163,flydsl_moe2_afp4_wfp4_bf16_t32x128x256_reduce_bnt2_persist_sbm64,3.8%,428.33,26777.35
stage2,256,32,4096,4096,32,8,ActivationType.Swiglu,torch.bfloat16,torch.float4_e2m1fn_x2,torch.float4_e2m1fn_x2,QuantType.per_1x32,1,0,64,0,71.1864,flydsl_moe2_afp4_wfp4_bf16_t32x128x256_reduce_bnt2_xcd4_sbm64,3.8%,362.0,22630.81
stage2,256,32,4096,4096,32,8,ActivationType.Swiglu,torch.bfloat16,torch.float4_e2m1fn_x2,torch.float4_e2m1fn_x2,QuantType.per_1x32,1,0,64,0,200.4451,flydsl_moe2_afp4_wfp4_bf16_t32x128x256_reduce_bnt2_xcd4_persist_sbm64,3.8%,128.56,8037.14
stage2,256,32,4096,4096,32,8,ActivationType.Swiglu,torch.bfloat16,torch.float4_e2m1fn_x2,torch.float4_e2m1fn_x2,QuantType.per_1x32,1,0,64,0,70.1481,flydsl_moe2_afp4_wfp4_bf16_t32x256x256_atomic_sbm64,9.2%,367.36,22965.78
stage2,256,32,4096,4096,32,8,ActivationType.Swiglu,torch.bfloat16,torch.float4_e2m1fn_x2,torch.float4_e2m1fn_x2,QuantType.per_1x32,1,0,64,0,68.4143,flydsl_moe2_afp4_wfp4_bf16_t32x256x256_atomic_persist_sbm64,9.3%,376.67,23547.8
stage2,256,32,4096,4096,32,8,ActivationType.Swiglu,torch.bfloat16,torch.float4_e2m1fn_x2,torch.float4_e2m1fn_x2,QuantType.per_1x32,1,0,64,0,77.5705,flydsl_moe2_afp4_wfp4_bf16_t32x256x256_atomic_xcd4_sbm64,9.1%,332.21,20768.28
stage2,256,32,4096,4096,32,8,ActivationType.Swiglu,torch.bfloat16,torch.float4_e2m1fn_x2,torch.float4_e2m1fn_x2,QuantType.per_1x32,1,0,64,0,192.4453,flydsl_moe2_afp4_wfp4_bf16_t32x256x256_atomic_xcd4_persist_sbm64,9.2%,133.91,8371.24
stage2,256,32,4096,4096,32,8,ActivationType.Swiglu,torch.bfloat16,torch.float4_e2m1fn_x2,torch.float4_e2m1fn_x2,QuantType.per_1x32,1,0,64,0,67.2008,flydsl_moe2_afp4_wfp4_bf16_t32x256x256_atomic_bnt2_sbm64,9.2%,383.47,23973.02
stage2,256,32,4096,4096,32,8,ActivationType.Swiglu,torch.bfloat16,torch.float4_e2m1fn_x2,torch.float4_e2m1fn_x2,QuantType.per_1x32,1,0,64,0,66.6448,flydsl_moe2_afp4_wfp4_bf16_t32x256x256_atomic_bnt2_persist_sbm64,9.3%,386.67,24173.02
stage2,256,32,4096,4096,32,8,ActivationType.Swiglu,torch.bfloat16,torch.float4_e2m1fn_x2,torch.float4_e2m1fn_x2,QuantType.per_1x32,1,0,64,0,79.1191,flydsl_moe2_afp4_wfp4_bf16_t32x256x256_atomic_bnt2_xcd4_sbm64,9.2%,325.71,20361.78
stage2,256,32,4096,4096,32,8,ActivationType.Swiglu,torch.bfloat16,torch.float4_e2m1fn_x2,torch.float4_e2m1fn_x2,QuantType.per_1x32,1,0,64,0,191.8564,flydsl_moe2_afp4_wfp4_bf16_t32x256x256_atomic_bnt2_xcd4_persist_sbm64,9.3%,134.32,8396.94
stage2,256,32,4096,4096,32,8,ActivationType.Swiglu,torch.bfloat16,torch.float4_e2m1fn_x2,torch.float4_e2m1fn_x2,QuantType.per_1x32,1,0,64,0,69.6882,flydsl_moe2_afp4_wfp4_bf16_t32x256x256_reduce_sbm64,3.8%,369.79,23117.34
stage2,256,32,4096,4096,32,8,ActivationType.Swiglu,torch.bfloat16,torch.float4_e2m1fn_x2,torch.float4_e2m1fn_x2,QuantType.per_1x32,1,0,64,0,77.3638,flydsl_moe2_afp4_wfp4_bf16_t32x256x256_reduce_persist_sbm64,3.8%,333.1,20823.77
stage2,256,32,4096,4096,32,8,ActivationType.Swiglu,torch.bfloat16,torch.float4_e2m1fn_x2,torch.float4_e2m1fn_x2,QuantType.per_1x32,1,0,64,0,79.5762,flydsl_moe2_afp4_wfp4_bf16_t32x256x256_reduce_xcd4_sbm64,3.8%,323.84,20244.82
stage2,256,32,4096,4096,32,8,ActivationType.Swiglu,torch.bfloat16,torch.float4_e2m1fn_x2,torch.float4_e2m1fn_x2,QuantType.per_1x32,1,0,64,0,195.9164,flydsl_moe2_afp4_wfp4_bf16_t32x256x256_reduce_xcd4_persist_sbm64,3.8%,131.53,8222.93
stage2,256,32,4096,4096,32,8,ActivationType.Swiglu,torch.bfloat16,torch.float4_e2m1fn_x2,torch.float4_e2m1fn_x2,QuantType.per_1x32,1,0,64,0,68.3495,flydsl_moe2_afp4_wfp4_bf16_t32x256x256_reduce_bnt2_sbm64,3.8%,377.03,23570.12
stage2,256,32,4096,4096,32,8,ActivationType.Swiglu,torch.bfloat16,torch.float4_e2m1fn_x2,torch.float4_e2m1fn_x2,QuantType.per_1x32,1,0,64,0,74.7714,flydsl_moe2_afp4_wfp4_bf16_t32x256x256_reduce_bnt2_persist_sbm64,3.8%,344.65,21545.75
stage2,256,32,4096,4096,32,8,ActivationType.Swiglu,torch.bfloat16,torch.float4_e2m1fn_x2,torch.float4_e2m1fn_x2,QuantType.per_1x32,1,0,64,0,78.8792,flydsl_moe2_afp4_wfp4_bf16_t32x256x256_reduce_bnt2_xcd4_sbm64,3.8%,326.7,20423.71
stage2,256,32,4096,4096,32,8,ActivationType.Swiglu,torch.bfloat16,torch.float4_e2m1fn_x2,torch.float4_e2m1fn_x2,QuantType.per_1x32,1,0,64,0,194.9972,flydsl_moe2_afp4_wfp4_bf16_t32x256x256_reduce_bnt2_xcd4_persist_sbm64,3.8%,132.15,8261.69
stage2,256,32,4096,4096,32,8,ActivationType.Swiglu,torch.bfloat16,torch.float4_e2m1fn_x2,torch.float4_e2m1fn_x2,QuantType.per_1x32,1,0,64,0,59.2966,flydsl_moe2_afp4_wfp4_bf16_t64x128x256_atomic,9.3%,434.59,27168.61
stage2,256,32,4096,4096,32,8,ActivationType.Swiglu,torch.bfloat16,torch.float4_e2m1fn_x2,torch.float4_e2m1fn_x2,QuantType.per_1x32,1,0,64,0,64.2316,flydsl_moe2_afp4_wfp4_bf16_t64x128x256_atomic_persist,9.2%,401.2,25081.21
stage2,256,32,4096,4096,32,8,ActivationType.Swiglu,torch.bfloat16,torch.float4_e2m1fn_x2,torch.float4_e2m1fn_x2,QuantType.per_1x32,1,0,64,0,61.5523,flydsl_moe2_afp4_wfp4_bf16_t64x128x256_atomic_xcd4,9.2%,418.67,26172.96
stage2,256,32,4096,4096,32,8,ActivationType.Swiglu,torch.bfloat16,torch.float4_e2m1fn_x2,torch.float4_e2m1fn_x2,QuantType.per_1x32,1,0,64,0,272.3397,flydsl_moe2_afp4_wfp4_bf16_t64x128x256_atomic_xcd4_persist,9.3%,94.62,5915.43
stage2,256,32,4096,4096,32,8,ActivationType.Swiglu,torch.bfloat16,torch.float4_e2m1fn_x2,torch.float4_e2m1fn_x2,QuantType.per_1x32,1,0,64,0,57.3279,flydsl_moe2_afp4_wfp4_bf16_t64x128x256_atomic_bnt2,9.3%,449.52,28101.6
stage2,256,32,4096,4096,32,8,ActivationType.Swiglu,torch.bfloat16,torch.float4_e2m1fn_x2,torch.float4_e2m1fn_x2,QuantType.per_1x32,1,0,64,0,60.9783,flydsl_moe2_afp4_wfp4_bf16_t64x128x256_atomic_bnt2_persist,9.3%,422.61,26419.33
stage2,256,32,4096,4096,32,8,ActivationType.Swiglu,torch.bfloat16,torch.float4_e2m1fn_x2,torch.float4_e2m1fn_x2,QuantType.per_1x32,1,0,64,0,59.3729,flydsl_moe2_afp4_wfp4_bf16_t64x128x256_atomic_bnt2_xcd4,9.2%,434.03,27133.69
stage2,256,32,4096,4096,32,8,ActivationType.Swiglu,torch.bfloat16,torch.float4_e2m1fn_x2,torch.float4_e2m1fn_x2,QuantType.per_1x32,1,0,64,0,270.5441,flydsl_moe2_afp4_wfp4_bf16_t64x128x256_atomic_bnt2_xcd4_persist,9.3%,95.25,5954.69
stage2,256,32,4096,4096,32,8,ActivationType.Swiglu,torch.bfloat16,torch.float4_e2m1fn_x2,torch.float4_e2m1fn_x2,QuantType.per_1x32,1,0,64,0,59.3542,flydsl_moe2_afp4_wfp4_bf16_t64x128x256_reduce,3.8%,434.17,27142.24
stage2,256,32,4096,4096,32,8,ActivationType.Swiglu,torch.bfloat16,torch.float4_e2m1fn_x2,torch.float4_e2m1fn_x2,QuantType.per_1x32,1,0,64,0,70.2847,flydsl_moe2_afp4_wfp4_bf16_t64x128x256_reduce_persist,3.8%,366.65,22921.15
stage2,256,32,4096,4096,32,8,ActivationType.Swiglu,torch.bfloat16,torch.float4_e2m1fn_x2,torch.float4_e2m1fn_x2,QuantType.per_1x32,1,0,64,0,62.6019,flydsl_moe2_afp4_wfp4_bf16_t64x128x256_reduce_xcd4,3.8%,411.65,25734.14
stage2,256,32,4096,4096,32,8,ActivationType.Swiglu,torch.bfloat16,torch.float4_e2m1fn_x2,torch.float4_e2m1fn_x2,QuantType.per_1x32,1,0,64,0,270.656,flydsl_moe2_afp4_wfp4_bf16_t64x128x256_reduce_xcd4_persist,3.8%,95.21,5952.23
stage2,256,32,4096,4096,32,8,ActivationType.Swiglu,torch.bfloat16,torch.float4_e2m1fn_x2,torch.float4_e2m1fn_x2,QuantType.per_1x32,1,0,64,0,58.4525,flydsl_moe2_afp4_wfp4_bf16_t64x128x256_reduce_bnt2,3.8%,440.87,27560.94
stage2,256,32,4096,4096,32,8,ActivationType.Swiglu,torch.bfloat16,torch.float4_e2m1fn_x2,torch.float4_e2m1fn_x2,QuantType.per_1x32,1,0,64,0,67.9145,flydsl_moe2_afp4_wfp4_bf16_t64x128x256_reduce_bnt2_persist,3.8%,379.44,23721.09
stage2,256,32,4096,4096,32,8,ActivationType.Swiglu,torch.bfloat16,torch.float4_e2m1fn_x2,torch.float4_e2m1fn_x2,QuantType.per_1x32,1,0,64,0,59.7377,flydsl_moe2_afp4_wfp4_bf16_t64x128x256_reduce_bnt2_xcd4,3.8%,431.38,26967.99
stage2,256,32,4096,4096,32,8,ActivationType.Swiglu,torch.bfloat16,torch.float4_e2m1fn_x2,torch.float4_e2m1fn_x2,QuantType.per_1x32,1,0,64,0,270.1405,flydsl_moe2_afp4_wfp4_bf16_t64x128x256_reduce_bnt2_xcd4_persist,3.8%,95.39,5963.59
stage2,256,32,4096,4096,32,8,ActivationType.Swiglu,torch.bfloat16,torch.float4_e2m1fn_x2,torch.float4_e2m1fn_x2,QuantType.per_1x32,1,0,64,0,68.6773,flydsl_moe2_afp4_wfp4_bf16_t64x256x256_atomic,9.4%,375.23,23457.62
stage2,256,32,4096,4096,32,8,ActivationType.Swiglu,torch.bfloat16,torch.float4_e2m1fn_x2,torch.float4_e2m1fn_x2,QuantType.per_1x32,1,0,64,0,73.5701,flydsl_moe2_afp4_wfp4_bf16_t64x256x256_atomic_persist,9.2%,350.28,21897.56
stage2,256,32,4096,4096,32,8,ActivationType.Swiglu,torch.bfloat16,torch.float4_e2m1fn_x2,torch.float4_e2m1fn_x2,QuantType.per_1x32,1,0,64,0,65.0868,flydsl_moe2_afp4_wfp4_bf16_t64x256x256_atomic_xcd4,9.2%,395.93,24751.65
stage2,256,32,4096,4096,32,8,ActivationType.Swiglu,torch.bfloat16,torch.float4_e2m1fn_x2,torch.float4_e2m1fn_x2,QuantType.per_1x32,1,0,64,0,252.6056,flydsl_moe2_afp4_wfp4_bf16_t64x256x256_atomic_xcd4_persist,9.3%,102.02,6377.55
stage2,256,32,4096,4096,32,8,ActivationType.Swiglu,torch.bfloat16,torch.float4_e2m1fn_x2,torch.float4_e2m1fn_x2,QuantType.per_1x32,1,0,64,0,65.8785,flydsl_moe2_afp4_wfp4_bf16_t64x256x256_atomic_bnt2,9.3%,391.17,24454.2
stage2,256,32,4096,4096,32,8,ActivationType.Swiglu,torch.bfloat16,torch.float4_e2m1fn_x2,torch.float4_e2m1fn_x2,QuantType.per_1x32,1,0,64,0,70.1674,flydsl_moe2_afp4_wfp4_bf16_t64x256x256_atomic_bnt2_persist,9.5%,367.26,22959.46
stage2,256,32,4096,4096,32,8,ActivationType.Swiglu,torch.bfloat16,torch.float4_e2m1fn_x2,torch.float4_e2m1fn_x2,QuantType.per_1x32,1,0,64,0,63.8246,flydsl_moe2_afp4_wfp4_bf16_t64x256x256_atomic_bnt2_xcd4,9.3%,403.76,25241.14
stage2,256,32,4096,4096,32,8,ActivationType.Swiglu,torch.bfloat16,torch.float4_e2m1fn_x2,torch.float4_e2m1fn_x2,QuantType.per_1x32,1,0,64,0,251.0115,flydsl_moe2_afp4_wfp4_bf16_t64x256x256_atomic_bnt2_xcd4_persist,9.3%,102.66,6418.06
stage2,256,32,4096,4096,32,8,ActivationType.Swiglu,torch.bfloat16,torch.float4_e2m1fn_x2,torch.float4_e2m1fn_x2,QuantType.per_1x32,1,0,64,0,68.9148,flydsl_moe2_afp4_wfp4_bf16_t64x256x256_reduce,3.8%,373.94,23376.78
stage2,256,32,4096,4096,32,8,ActivationType.Swiglu,torch.bfloat16,torch.float4_e2m1fn_x2,torch.float4_e2m1fn_x2,QuantType.per_1x32,1,0,64,0,73.4711,flydsl_moe2_afp4_wfp4_bf16_t64x256x256_reduce_persist,3.8%,350.75,21927.07
stage2,256,32,4096,4096,32,8,ActivationType.Swiglu,torch.bfloat16,torch.float4_e2m1fn_x2,torch.float4_e2m1fn_x2,QuantType.per_1x32,1,0,64,0,66.5989,flydsl_moe2_afp4_wfp4_bf16_t64x256x256_reduce_xcd4,3.8%,386.94,24189.68
stage2,256,32,4096,4096,32,8,ActivationType.Swiglu,torch.bfloat16,torch.float4_e2m1fn_x2,torch.float4_e2m1fn_x2,QuantType.per_1x32,1,0,64,0,256.0704,flydsl_moe2_afp4_wfp4_bf16_t64x256x256_reduce_xcd4_persist,3.8%,100.64,6291.26
stage2,256,32,4096,4096,32,8,ActivationType.Swiglu,torch.bfloat16,torch.float4_e2m1fn_x2,torch.float4_e2m1fn_x2,QuantType.per_1x32,1,0,64,0,66.3844,flydsl_moe2_afp4_wfp4_bf16_t64x256x256_reduce_bnt2,3.8%,388.19,24267.84
stage2,256,32,4096,4096,32,8,ActivationType.Swiglu,torch.bfloat16,torch.float4_e2m1fn_x2,torch.float4_e2m1fn_x2,QuantType.per_1x32,1,0,64,0,69.6996,flydsl_moe2_afp4_wfp4_bf16_t64x256x256_reduce_bnt2_persist,3.8%,369.73,23113.56
stage2,256,32,4096,4096,32,8,ActivationType.Swiglu,torch.bfloat16,torch.float4_e2m1fn_x2,torch.float4_e2m1fn_x2,QuantType.per_1x32,1,0,64,0,64.0289,flydsl_moe2_afp4_wfp4_bf16_t64x256x256_reduce_bnt2_xcd4,3.8%,402.47,25160.61
stage2,256,32,4096,4096,32,8,ActivationType.Swiglu,torch.bfloat16,torch.float4_e2m1fn_x2,torch.float4_e2m1fn_x2,QuantType.per_1x32,1,0,64,0,254.9254,flydsl_moe2_afp4_wfp4_bf16_t64x256x256_reduce_bnt2_xcd4_persist,3.8%,101.09,6319.52
stage1,256,32,4096,4096,32,8,ActivationType.Swiglu,torch.bfloat16,torch.float4_e2m1fn_x2,torch.float4_e2m1fn_x2,QuantType.per_1x32,1,0,128,0,158.9732,flydsl_moe1_afp4_wfp4_bf16_t128x64x256_bnt0,0.0%,162.1,10133.82
stage1,256,32,4096,4096,32,8,ActivationType.Swiglu,torch.bfloat16,torch.float4_e2m1fn_x2,torch.float4_e2m1fn_x2,QuantType.per_1x32,1,0,128,0,161.5687,flydsl_moe1_afp4_wfp4_bf16_t128x64x256_bnt0_fp4,0.8%,159.5,9971.03
stage1,256,32,4096,4096,32,8,ActivationType.Swiglu,torch.bfloat16,torch.float4_e2m1fn_x2,torch.float4_e2m1fn_x2,QuantType.per_1x32,1,0,128,0,196.2975,flydsl_moe1_afp4_wfp4_bf16_t128x64x256_bnt0_xcd4,0.0%,131.28,8206.96
stage1,256,32,4096,4096,32,8,ActivationType.Swiglu,torch.bfloat16,torch.float4_e2m1fn_x2,torch.float4_e2m1fn_x2,QuantType.per_1x32,1,0,128,0,199.7435,flydsl_moe1_afp4_wfp4_bf16_t128x64x256_bnt0_xcd4_fp4,0.8%,129.01,8065.37
stage1,256,32,4096,4096,32,8,ActivationType.Swiglu,torch.bfloat16,torch.float4_e2m1fn_x2,torch.float4_e2m1fn_x2,QuantType.per_1x32,1,0,128,0,154.9577,flydsl_moe1_afp4_wfp4_bf16_t128x64x256,0.0%,166.3,10396.42
stage1,256,32,4096,4096,32,8,ActivationType.Swiglu,torch.bfloat16,torch.float4_e2m1fn_x2,torch.float4_e2m1fn_x2,QuantType.per_1x32,1,0,128,0,160.3169,flydsl_moe1_afp4_wfp4_bf16_t128x64x256_fp4,0.8%,160.74,10048.88
stage1,256,32,4096,4096,32,8,ActivationType.Swiglu,torch.bfloat16,torch.float4_e2m1fn_x2,torch.float4_e2m1fn_x2,QuantType.per_1x32,1,0,128,0,183.0265,flydsl_moe1_afp4_wfp4_bf16_t128x64x256_xcd4,0.0%,140.8,8802.04
stage1,256,32,4096,4096,32,8,ActivationType.Swiglu,torch.bfloat16,torch.float4_e2m1fn_x2,torch.float4_e2m1fn_x2,QuantType.per_1x32,1,0,128,0,191.3754,flydsl_moe1_afp4_wfp4_bf16_t128x64x256_xcd4_fp4,0.8%,134.66,8418.04
stage1,256,32,4096,4096,32,8,ActivationType.Swiglu,torch.bfloat16,torch.float4_e2m1fn_x2,torch.float4_e2m1fn_x2,QuantType.per_1x32,1,0,128,0,123.8723,flydsl_moe1_afp4_wfp4_bf16_t128x64x256_w2_bnt0,0.0%,208.04,13005.38
stage1,256,32,4096,4096,32,8,ActivationType.Swiglu,torch.bfloat16,torch.float4_e2m1fn_x2,torch.float4_e2m1fn_x2,QuantType.per_1x32,1,0,128,0,117.6436,flydsl_moe1_afp4_wfp4_bf16_t128x64x256_w2_bnt0_fp4,0.8%,219.05,13693.95
stage1,256,32,4096,4096,32,8,ActivationType.Swiglu,torch.bfloat16,torch.float4_e2m1fn_x2,torch.float4_e2m1fn_x2,QuantType.per_1x32,1,0,128,0,155.4391,flydsl_moe1_afp4_wfp4_bf16_t128x64x256_w2_bnt0_xcd4,0.0%,165.79,10364.23
stage1,256,32,4096,4096,32,8,ActivationType.Swiglu,torch.bfloat16,torch.float4_e2m1fn_x2,torch.float4_e2m1fn_x2,QuantType.per_1x32,1,0,128,0,157.1616,flydsl_moe1_afp4_wfp4_bf16_t128x64x256_w2_bnt0_xcd4_fp4,0.8%,163.97,10250.63
stage1,256,32,4096,4096,32,8,ActivationType.Swiglu,torch.bfloat16,torch.float4_e2m1fn_x2,torch.float4_e2m1fn_x2,QuantType.per_1x32,1,0,128,0,115.686,flydsl_moe1_afp4_wfp4_bf16_t128x64x256_w2,0.0%,222.76,13925.68
stage1,256,32,4096,4096,32,8,ActivationType.Swiglu,torch.bfloat16,torch.float4_e2m1fn_x2,torch.float4_e2m1fn_x2,QuantType.per_1x32,1,0,128,0,114.9772,flydsl_moe1_afp4_wfp4_bf16_t128x64x256_w2_fp4,0.8%,224.13,14011.53
stage1,256,32,4096,4096,32,8,ActivationType.Swiglu,torch.bfloat16,torch.float4_e2m1fn_x2,torch.float4_e2m1fn_x2,QuantType.per_1x32,1,0,128,0,144.8213,flydsl_moe1_afp4_wfp4_bf16_t128x64x256_w2_xcd4,0.0%,177.94,11124.1
stage1,256,32,4096,4096,32,8,ActivationType.Swiglu,torch.bfloat16,torch.float4_e2m1fn_x2,torch.float4_e2m1fn_x2,QuantType.per_1x32,1,0,128,0,144.5953,flydsl_moe1_afp4_wfp4_bf16_t128x64x256_w2_xcd4_fp4,0.8%,178.22,11141.48
stage1,256,32,4096,4096,32,8,ActivationType.Swiglu,torch.bfloat16,torch.float4_e2m1fn_x2,torch.float4_e2m1fn_x2,QuantType.per_1x32,1,0,128,0,115.9712,flydsl_moe1_afp4_wfp4_bf16_t128x64x256_w3_bnt0,0.0%,222.21,13891.43
stage1,256,32,4096,4096,32,8,ActivationType.Swiglu,torch.bfloat16,torch.float4_e2m1fn_x2,torch.float4_e2m1fn_x2,QuantType.per_1x32,1,0,128,0,117.6547,flydsl_moe1_afp4_wfp4_bf16_t128x64x256_w3_bnt0_fp4,0.8%,219.03,13692.66
stage1,256,32,4096,4096,32,8,ActivationType.Swiglu,torch.bfloat16,torch.float4_e2m1fn_x2,torch.float4_e2m1fn_x2,QuantType.per_1x32,1,0,128,0,155.5511,flydsl_moe1_afp4_wfp4_bf16_t128x64x256_w3_bnt0_xcd4,0.0%,165.67,10356.76
stage1,256,32,4096,4096,32,8,ActivationType.Swiglu,torch.bfloat16,torch.float4_e2m1fn_x2,torch.float4_e2m1fn_x2,QuantType.per_1x32,1,0,128,0,156.842,flydsl_moe1_afp4_wfp4_bf16_t128x64x256_w3_bnt0_xcd4_fp4,0.8%,164.3,10271.52
stage1,256,32,4096,4096,32,8,ActivationType.Swiglu,torch.bfloat16,torch.float4_e2m1fn_x2,torch.float4_e2m1fn_x2,QuantType.per_1x32,1,0,128,0,113.3508,flydsl_moe1_afp4_wfp4_bf16_t128x64x256_w3,0.0%,227.35,14212.57
stage1,256,32,4096,4096,32,8,ActivationType.Swiglu,torch.bfloat16,torch.float4_e2m1fn_x2,torch.float4_e2m1fn_x2,QuantType.per_1x32,1,0,128,0,114.3771,flydsl_moe1_afp4_wfp4_bf16_t128x64x256_w3_fp4,0.8%,225.31,14085.04
stage1,256,32,4096,4096,32,8,ActivationType.Swiglu,torch.bfloat16,torch.float4_e2m1fn_x2,torch.float4_e2m1fn_x2,QuantType.per_1x32,1,0,128,0,144.0595,flydsl_moe1_afp4_wfp4_bf16_t128x64x256_w3_xcd4,0.0%,178.88,11182.92
stage1,256,32,4096,4096,32,8,ActivationType.Swiglu,torch.bfloat16,torch.float4_e2m1fn_x2,torch.float4_e2m1fn_x2,QuantType.per_1x32,1,0,128,0,146.9131,flydsl_moe1_afp4_wfp4_bf16_t128x64x256_w3_xcd4_fp4,0.8%,175.41,10965.71
stage1,256,32,4096,4096,32,8,ActivationType.Swiglu,torch.bfloat16,torch.float4_e2m1fn_x2,torch.float4_e2m1fn_x2,QuantType.per_1x32,1,0,128,0,116.9063,flydsl_moe1_afp4_wfp4_bf16_t128x64x256_w4_bnt0,0.0%,220.43,13780.32
stage1,256,32,4096,4096,32,8,ActivationType.Swiglu,torch.bfloat16,torch.float4_e2m1fn_x2,torch.float4_e2m1fn_x2,QuantType.per_1x32,1,0,128,0,119.1879,flydsl_moe1_afp4_wfp4_bf16_t128x64x256_w4_bnt0_fp4,0.8%,216.21,13516.52
stage1,256,32,4096,4096,32,8,ActivationType.Swiglu,torch.bfloat16,torch.float4_e2m1fn_x2,torch.float4_e2m1fn_x2,QuantType.per_1x32,1,0,128,0,157.3337,flydsl_moe1_afp4_wfp4_bf16_t128x64x256_w4_bnt0_xcd4,0.0%,163.79,10239.42
stage1,256,32,4096,4096,32,8,ActivationType.Swiglu,torch.bfloat16,torch.float4_e2m1fn_x2,torch.float4_e2m1fn_x2,QuantType.per_1x32,1,0,128,0,157.8116,flydsl_moe1_afp4_wfp4_bf16_t128x64x256_w4_bnt0_xcd4_fp4,0.8%,163.29,10208.41
stage1,256,32,4096,4096,32,8,ActivationType.Swiglu,torch.bfloat16,torch.float4_e2m1fn_x2,torch.float4_e2m1fn_x2,QuantType.per_1x32,1,0,128,0,113.3149,flydsl_moe1_afp4_wfp4_bf16_t128x64x256_w4,0.0%,227.42,14217.07
stage1,256,32,4096,4096,32,8,ActivationType.Swiglu,torch.bfloat16,torch.float4_e2m1fn_x2,torch.float4_e2m1fn_x2,QuantType.per_1x32,1,0,128,0,124.5382,flydsl_moe1_afp4_wfp4_bf16_t128x64x256_w4_fp4,0.8%,206.92,12935.84
stage1,256,32,4096,4096,32,8,ActivationType.Swiglu,torch.bfloat16,torch.float4_e2m1fn_x2,torch.float4_e2m1fn_x2,QuantType.per_1x32,1,0,128,0,145.0242,flydsl_moe1_afp4_wfp4_bf16_t128x64x256_w4_xcd4,0.0%,177.69,11108.53
stage1,256,32,4096,4096,32,8,ActivationType.Swiglu,torch.bfloat16,torch.float4_e2m1fn_x2,torch.float4_e2m1fn_x2,QuantType.per_1x32,1,0,128,0,148.0386,flydsl_moe1_afp4_wfp4_bf16_t128x64x256_w4_xcd4_fp4,0.8%,174.07,10882.34
stage1,256,32,4096,4096,32,8,ActivationType.Swiglu,torch.bfloat16,torch.float4_e2m1fn_x2,torch.float4_e2m1fn_x2,QuantType.per_1x32,1,0,128,0,125.2727,flydsl_moe1_afp4_wfp4_bf16_t128x128x256_bnt0,0.0%,205.71,12859.99
stage1,256,32,4096,4096,32,8,ActivationType.Swiglu,torch.bfloat16,torch.float4_e2m1fn_x2,torch.float4_e2m1fn_x2,QuantType.per_1x32,1,0,128,0,126.0311,flydsl_moe1_afp4_wfp4_bf16_t128x128x256_bnt0_fp4,0.8%,204.47,12782.61
stage1,256,32,4096,4096,32,8,ActivationType.Swiglu,torch.bfloat16,torch.float4_e2m1fn_x2,torch.float4_e2m1fn_x2,QuantType.per_1x32,1,0,128,0,161.9696,flydsl_moe1_afp4_wfp4_bf16_t128x128x256_bnt0_xcd4,0.0%,159.1,9946.35
stage1,256,32,4096,4096,32,8,ActivationType.Swiglu,torch.bfloat16,torch.float4_e2m1fn_x2,torch.float4_e2m1fn_x2,QuantType.per_1x32,1,0,128,0,162.9074,flydsl_moe1_afp4_wfp4_bf16_t128x128x256_bnt0_xcd4_fp4,0.8%,158.19,9889.09
stage1,256,32,4096,4096,32,8,ActivationType.Swiglu,torch.bfloat16,torch.float4_e2m1fn_x2,torch.float4_e2m1fn_x2,QuantType.per_1x32,1,0,128,0,119.4608,flydsl_moe1_afp4_wfp4_bf16_t128x128x256,0.0%,215.72,13485.65
stage1,256,32,4096,4096,32,8,ActivationType.Swiglu,torch.bfloat16,torch.float4_e2m1fn_x2,torch.float4_e2m1fn_x2,QuantType.per_1x32,1,0,128,0,120.8508,flydsl_moe1_afp4_wfp4_bf16_t128x128x256_fp4,0.8%,213.24,13330.54
stage1,256,32,4096,4096,32,8,ActivationType.Swiglu,torch.bfloat16,torch.float4_e2m1fn_x2,torch.float4_e2m1fn_x2,QuantType.per_1x32,1,0,128,0,148.1888,flydsl_moe1_afp4_wfp4_bf16_t128x128x256_xcd4,0.0%,173.9,10871.31
stage1,256,32,4096,4096,32,8,ActivationType.Swiglu,torch.bfloat16,torch.float4_e2m1fn_x2,torch.float4_e2m1fn_x2,QuantType.per_1x32,1,0,128,0,149.4462,flydsl_moe1_afp4_wfp4_bf16_t128x128x256_xcd4_fp4,0.8%,172.44,10779.84
stage1,256,32,4096,4096,32,8,ActivationType.Swiglu,torch.bfloat16,torch.float4_e2m1fn_x2,torch.float4_e2m1fn_x2,QuantType.per_1x32,1,0,128,0,124.5671,flydsl_moe1_afp4_wfp4_bf16_t128x128x256_w2_bnt0,0.0%,206.87,12932.84
stage1,256,32,4096,4096,32,8,ActivationType.Swiglu,torch.bfloat16,torch.float4_e2m1fn_x2,torch.float4_e2m1fn_x2,QuantType.per_1x32,1,0,128,0,125.6266,flydsl_moe1_afp4_wfp4_bf16_t128x128x256_w2_bnt0_fp4,0.8%,205.13,12823.76
stage1,256,32,4096,4096,32,8,ActivationType.Swiglu,torch.bfloat16,torch.float4_e2m1fn_x2,torch.float4_e2m1fn_x2,QuantType.per_1x32,1,0,128,0,160.6015,flydsl_moe1_afp4_wfp4_bf16_t128x128x256_w2_bnt0_xcd4,0.0%,160.46,10031.08
stage1,256,32,4096,4096,32,8,ActivationType.Swiglu,torch.bfloat16,torch.float4_e2m1fn_x2,torch.float4_e2m1fn_x2,QuantType.per_1x32,1,0,128,0,162.4342,flydsl_moe1_afp4_wfp4_bf16_t128x128x256_w2_bnt0_xcd4_fp4,0.8%,158.65,9917.9
stage1,256,32,4096,4096,32,8,ActivationType.Swiglu,torch.bfloat16,torch.float4_e2m1fn_x2,torch.float4_e2m1fn_x2,QuantType.per_1x32,1,0,128,0,119.5251,flydsl_moe1_afp4_wfp4_bf16_t128x128x256_w2,0.0%,215.6,13478.39
stage1,256,32,4096,4096,32,8,ActivationType.Swiglu,torch.bfloat16,torch.float4_e2m1fn_x2,torch.float4_e2m1fn_x2,QuantType.per_1x32,1,0,128,0,121.0301,flydsl_moe1_afp4_wfp4_bf16_t128x128x256_w2_fp4,0.8%,212.92,13310.79
stage1,256,32,4096,4096,32,8,ActivationType.Swiglu,torch.bfloat16,torch.float4_e2m1fn_x2,torch.float4_e2m1fn_x2,QuantType.per_1x32,1,0,128,0,147.8443,flydsl_moe1_afp4_wfp4_bf16_t128x128x256_w2_xcd4,0.0%,174.3,10896.64
stage1,256,32,4096,4096,32,8,ActivationType.Swiglu,torch.bfloat16,torch.float4_e2m1fn_x2,torch.float4_e2m1fn_x2,QuantType.per_1x32,1,0,128,0,149.7,flydsl_moe1_afp4_wfp4_bf16_t128x128x256_w2_xcd4_fp4,0.8%,172.14,10761.56
stage1,256,32,4096,4096,32,8,ActivationType.Swiglu,torch.bfloat16,torch.float4_e2m1fn_x2,torch.float4_e2m1fn_x2,QuantType.per_1x32,1,0,128,0,124.4217,flydsl_moe1_afp4_wfp4_bf16_t128x128x256_w3_bnt0,0.0%,207.12,12947.95
stage1,256,32,4096,4096,32,8,ActivationType.Swiglu,torch.bfloat16,torch.float4_e2m1fn_x2,torch.float4_e2m1fn_x2,QuantType.per_1x32,1,0,128,0,124.9196,flydsl_moe1_afp4_wfp4_bf16_t128x128x256_w3_bnt0_fp4,0.8%,206.29,12896.34
stage1,256,32,4096,4096,32,8,ActivationType.Swiglu,torch.bfloat16,torch.float4_e2m1fn_x2,torch.float4_e2m1fn_x2,QuantType.per_1x32,1,0,128,0,163.7545,flydsl_moe1_afp4_wfp4_bf16_t128x128x256_w3_bnt0_xcd4,0.0%,157.37,9837.93
stage1,256,32,4096,4096,32,8,ActivationType.Swiglu,torch.bfloat16,torch.float4_e2m1fn_x2,torch.float4_e2m1fn_x2,QuantType.per_1x32,1,0,128,0,163.7513,flydsl_moe1_afp4_wfp4_bf16_t128x128x256_w3_bnt0_xcd4_fp4,0.8%,157.37,9838.13
stage1,256,32,4096,4096,32,8,ActivationType.Swiglu,torch.bfloat16,torch.float4_e2m1fn_x2,torch.float4_e2m1fn_x2,QuantType.per_1x32,1,0,128,0,119.0636,flydsl_moe1_afp4_wfp4_bf16_t128x128x256_w3,0.0%,216.44,13530.63
stage1,256,32,4096,4096,32,8,ActivationType.Swiglu,torch.bfloat16,torch.float4_e2m1fn_x2,torch.float4_e2m1fn_x2,QuantType.per_1x32,1,0,128,0,120.8439,flydsl_moe1_afp4_wfp4_bf16_t128x128x256_w3_fp4,0.8%,213.25,13331.3
stage1,256,32,4096,4096,32,8,ActivationType.Swiglu,torch.bfloat16,torch.float4_e2m1fn_x2,torch.float4_e2m1fn_x2,QuantType.per_1x32,1,0,128,0,148.7116,flydsl_moe1_afp4_wfp4_bf16_t128x128x256_w3_xcd4,0.0%,173.29,10833.09
stage1,256,32,4096,4096,32,8,ActivationType.Swiglu,torch.bfloat16,torch.float4_e2m1fn_x2,torch.float4_e2m1fn_x2,QuantType.per_1x32,1,0,128,0,147.9828,flydsl_moe1_afp4_wfp4_bf16_t128x128x256_w3_xcd4_fp4,0.8%,174.14,10886.44
stage1,256,32,4096,4096,32,8,ActivationType.Swiglu,torch.bfloat16,torch.float4_e2m1fn_x2,torch.float4_e2m1fn_x2,QuantType.per_1x32,1,0,128,0,123.3144,flydsl_moe1_afp4_wfp4_bf16_t128x128x256_w4_bnt0,0.0%,208.98,13064.22
stage1,256,32,4096,4096,32,8,ActivationType.Swiglu,torch.bfloat16,torch.float4_e2m1fn_x2,torch.float4_e2m1fn_x2,QuantType.per_1x32,1,0,128,0,125.0607,flydsl_moe1_afp4_wfp4_bf16_t128x128x256_w4_bnt0_fp4,0.8%,206.06,12881.79
stage1,256,32,4096,4096,32,8,ActivationType.Swiglu,torch.bfloat16,torch.float4_e2m1fn_x2,torch.float4_e2m1fn_x2,QuantType.per_1x32,1,0,128,0,161.7472,flydsl_moe1_afp4_wfp4_bf16_t128x128x256_w4_bnt0_xcd4,0.0%,159.32,9960.02
stage1,256,32,4096,4096,32,8,ActivationType.Swiglu,torch.bfloat16,torch.float4_e2m1fn_x2,torch.float4_e2m1fn_x2,QuantType.per_1x32,1,0,128,0,164.486,flydsl_moe1_afp4_wfp4_bf16_t128x128x256_w4_bnt0_xcd4_fp4,0.8%,156.67,9794.18
stage1,256,32,4096,4096,32,8,ActivationType.Swiglu,torch.bfloat16,torch.float4_e2m1fn_x2,torch.float4_e2m1fn_x2,QuantType.per_1x32,1,0,128,0,118.1583,flydsl_moe1_afp4_wfp4_bf16_t128x128x256_w4,0.0%,218.1,13634.3
stage1,256,32,4096,4096,32,8,ActivationType.Swiglu,torch.bfloat16,torch.float4_e2m1fn_x2,torch.float4_e2m1fn_x2,QuantType.per_1x32,1,0,128,0,119.3894,flydsl_moe1_afp4_wfp4_bf16_t128x128x256_w4_fp4,0.8%,215.85,13493.71
stage1,256,32,4096,4096,32,8,ActivationType.Swiglu,torch.bfloat16,torch.float4_e2m1fn_x2,torch.float4_e2m1fn_x2,QuantType.per_1x32,1,0,128,0,146.9644,flydsl_moe1_afp4_wfp4_bf16_t128x128x256_w4_xcd4,0.0%,175.35,10961.88
stage1,256,32,4096,4096,32,8,ActivationType.Swiglu,torch.bfloat16,torch.float4_e2m1fn_x2,torch.float4_e2m1fn_x2,QuantType.per_1x32,1,0,128,0,147.7623,flydsl_moe1_afp4_wfp4_bf16_t128x128x256_w4_xcd4_fp4,0.8%,174.4,10902.69
stage2,256,32,4096,4096,32,8,ActivationType.Swiglu,torch.bfloat16,torch.float4_e2m1fn_x2,torch.float4_e2m1fn_x2,QuantType.per_1x32,1,0,128,0,61.3757,flydsl_moe2_afp4_wfp4_bf16_t64x128x256_atomic_sbm128,9.1%,419.87,26248.27
stage2,256,32,4096,4096,32,8,ActivationType.Swiglu,torch.bfloat16,torch.float4_e2m1fn_x2,torch.float4_e2m1fn_x2,QuantType.per_1x32,1,0,128,0,64.6555,flydsl_moe2_afp4_wfp4_bf16_t64x128x256_atomic_persist_sbm128,9.2%,398.57,24916.77
stage2,256,32,4096,4096,32,8,ActivationType.Swiglu,torch.bfloat16,torch.float4_e2m1fn_x2,torch.float4_e2m1fn_x2,QuantType.per_1x32,1,0,128,0,75.2204,flydsl_moe2_afp4_wfp4_bf16_t64x128x256_atomic_xcd4_sbm128,9.2%,342.59,21417.14
stage2,256,32,4096,4096,32,8,ActivationType.Swiglu,torch.bfloat16,torch.float4_e2m1fn_x2,torch.float4_e2m1fn_x2,QuantType.per_1x32,1,0,128,0,255.7292,flydsl_moe2_afp4_wfp4_bf16_t64x128x256_atomic_xcd4_persist_sbm128,9.3%,100.77,6299.66
stage2,256,32,4096,4096,32,8,ActivationType.Swiglu,torch.bfloat16,torch.float4_e2m1fn_x2,torch.float4_e2m1fn_x2,QuantType.per_1x32,1,0,128,0,59.7424,flydsl_moe2_afp4_wfp4_bf16_t64x128x256_atomic_bnt2_sbm128,9.2%,431.35,26965.87
stage2,256,32,4096,4096,32,8,ActivationType.Swiglu,torch.bfloat16,torch.float4_e2m1fn_x2,torch.float4_e2m1fn_x2,QuantType.per_1x32,1,0,128,0,61.2199,flydsl_moe2_afp4_wfp4_bf16_t64x128x256_atomic_bnt2_persist_sbm128,9.3%,420.94,26315.07
stage2,256,32,4096,4096,32,8,ActivationType.Swiglu,torch.bfloat16,torch.float4_e2m1fn_x2,torch.float4_e2m1fn_x2,QuantType.per_1x32,1,0,128,0,74.656,flydsl_moe2_afp4_wfp4_bf16_t64x128x256_atomic_bnt2_xcd4_sbm128,9.2%,345.18,21579.06
stage2,256,32,4096,4096,32,8,ActivationType.Swiglu,torch.bfloat16,torch.float4_e2m1fn_x2,torch.float4_e2m1fn_x2,QuantType.per_1x32,1,0,128,0,257.1821,flydsl_moe2_afp4_wfp4_bf16_t64x128x256_atomic_bnt2_xcd4_persist_sbm128,9.3%,100.2,6264.07
stage2,256,32,4096,4096,32,8,ActivationType.Swiglu,torch.bfloat16,torch.float4_e2m1fn_x2,torch.float4_e2m1fn_x2,QuantType.per_1x32,1,0,128,0,60.5301,flydsl_moe2_afp4_wfp4_bf16_t64x128x256_reduce_sbm128,3.8%,425.74,26614.96
stage2,256,32,4096,4096,32,8,ActivationType.Swiglu,torch.bfloat16,torch.float4_e2m1fn_x2,torch.float4_e2m1fn_x2,QuantType.per_1x32,1,0,128,0,71.0225,flydsl_moe2_afp4_wfp4_bf16_t64x128x256_reduce_persist_sbm128,3.8%,362.84,22683.04
stage2,256,32,4096,4096,32,8,ActivationType.Swiglu,torch.bfloat16,torch.float4_e2m1fn_x2,torch.float4_e2m1fn_x2,QuantType.per_1x32,1,0,128,0,78.7808,flydsl_moe2_afp4_wfp4_bf16_t64x128x256_reduce_xcd4_sbm128,3.8%,327.11,20449.22
stage2,256,32,4096,4096,32,8,ActivationType.Swiglu,torch.bfloat16,torch.float4_e2m1fn_x2,torch.float4_e2m1fn_x2,QuantType.per_1x32,1,0,128,0,254.1614,flydsl_moe2_afp4_wfp4_bf16_t64x128x256_reduce_xcd4_persist_sbm128,3.8%,101.39,6338.52
stage2,256,32,4096,4096,32,8,ActivationType.Swiglu,torch.bfloat16,torch.float4_e2m1fn_x2,torch.float4_e2m1fn_x2,QuantType.per_1x32,1,0,128,0,59.6204,flydsl_moe2_afp4_wfp4_bf16_t64x128x256_reduce_bnt2_sbm128,3.8%,432.23,27021.05
stage2,256,32,4096,4096,32,8,ActivationType.Swiglu,torch.bfloat16,torch.float4_e2m1fn_x2,torch.float4_e2m1fn_x2,QuantType.per_1x32,1,0,128,0,70.0364,flydsl_moe2_afp4_wfp4_bf16_t64x128x256_reduce_bnt2_persist_sbm128,3.8%,367.95,23002.41
stage2,256,32,4096,4096,32,8,ActivationType.Swiglu,torch.bfloat16,torch.float4_e2m1fn_x2,torch.float4_e2m1fn_x2,QuantType.per_1x32,1,0,128,0,77.5539,flydsl_moe2_afp4_wfp4_bf16_t64x128x256_reduce_bnt2_xcd4_sbm128,3.8%,332.28,20772.73
stage2,256,32,4096,4096,32,8,ActivationType.Swiglu,torch.bfloat16,torch.float4_e2m1fn_x2,torch.float4_e2m1fn_x2,QuantType.per_1x32,1,0,128,0,255.3193,flydsl_moe2_afp4_wfp4_bf16_t64x128x256_reduce_bnt2_xcd4_persist_sbm128,3.8%,100.93,6309.77
stage2,256,32,4096,4096,32,8,ActivationType.Swiglu,torch.bfloat16,torch.float4_e2m1fn_x2,torch.float4_e2m1fn_x2,QuantType.per_1x32,1,0,128,0,80.5314,flydsl_moe2_afp4_wfp4_bf16_t64x256x256_atomic_sbm128,9.2%,320.0,20004.69
stage2,256,32,4096,4096,32,8,ActivationType.Swiglu,torch.bfloat16,torch.float4_e2m1fn_x2,torch.float4_e2m1fn_x2,QuantType.per_1x32,1,0,128,0,79.4565,flydsl_moe2_afp4_wfp4_bf16_t64x256x256_atomic_persist_sbm128,9.2%,324.33,20275.32
stage2,256,32,4096,4096,32,8,ActivationType.Swiglu,torch.bfloat16,torch.float4_e2m1fn_x2,torch.float4_e2m1fn_x2,QuantType.per_1x32,1,0,128,0,79.0605,flydsl_moe2_afp4_wfp4_bf16_t64x256x256_atomic_xcd4_sbm128,9.3%,325.95,20376.88
stage2,256,32,4096,4096,32,8,ActivationType.Swiglu,torch.bfloat16,torch.float4_e2m1fn_x2,torch.float4_e2m1fn_x2,QuantType.per_1x32,1,0,128,0,231.0361,flydsl_moe2_afp4_wfp4_bf16_t64x256x256_atomic_xcd4_persist_sbm128,9.3%,111.54,6972.96
stage2,256,32,4096,4096,32,8,ActivationType.Swiglu,torch.bfloat16,torch.float4_e2m1fn_x2,torch.float4_e2m1fn_x2,QuantType.per_1x32,1,0,128,0,77.7824,flydsl_moe2_afp4_wfp4_bf16_t64x256x256_atomic_bnt2_sbm128,9.2%,331.31,20711.7
stage2,256,32,4096,4096,32,8,ActivationType.Swiglu,torch.bfloat16,torch.float4_e2m1fn_x2,torch.float4_e2m1fn_x2,QuantType.per_1x32,1,0,128,0,78.1155,flydsl_moe2_afp4_wfp4_bf16_t64x256x256_atomic_bnt2_persist_sbm128,9.2%,329.89,20623.38
stage2,256,32,4096,4096,32,8,ActivationType.Swiglu,torch.bfloat16,torch.float4_e2m1fn_x2,torch.float4_e2m1fn_x2,QuantType.per_1x32,1,0,128,0,76.0026,flydsl_moe2_afp4_wfp4_bf16_t64x256x256_atomic_bnt2_xcd4_sbm128,9.2%,339.06,21196.72
stage2,256,32,4096,4096,32,8,ActivationType.Swiglu,torch.bfloat16,torch.float4_e2m1fn_x2,torch.float4_e2m1fn_x2,QuantType.per_1x32,1,0,128,0,230.9342,flydsl_moe2_afp4_wfp4_bf16_t64x256x256_atomic_bnt2_xcd4_persist_sbm128,9.3%,111.59,6976.04
stage2,256,32,4096,4096,32,8,ActivationType.Swiglu,torch.bfloat16,torch.float4_e2m1fn_x2,torch.float4_e2m1fn_x2,QuantType.per_1x32,1,0,128,0,80.2228,flydsl_moe2_afp4_wfp4_bf16_t64x256x256_reduce_sbm128,3.8%,321.23,20081.65
stage2,256,32,4096,4096,32,8,ActivationType.Swiglu,torch.bfloat16,torch.float4_e2m1fn_x2,torch.float4_e2m1fn_x2,QuantType.per_1x32,1,0,128,0,79.522,flydsl_moe2_afp4_wfp4_bf16_t64x256x256_reduce_persist_sbm128,3.8%,324.06,20258.62
stage2,256,32,4096,4096,32,8,ActivationType.Swiglu,torch.bfloat16,torch.float4_e2m1fn_x2,torch.float4_e2m1fn_x2,QuantType.per_1x32,1,0,128,0,76.489,flydsl_moe2_afp4_wfp4_bf16_t64x256x256_reduce_xcd4_sbm128,3.8%,336.91,21061.93
stage2,256,32,4096,4096,32,8,ActivationType.Swiglu,torch.bfloat16,torch.float4_e2m1fn_x2,torch.float4_e2m1fn_x2,QuantType.per_1x32,1,0,128,0,233.6625,flydsl_moe2_afp4_wfp4_bf16_t64x256x256_reduce_xcd4_persist_sbm128,3.8%,110.29,6894.58
stage2,256,32,4096,4096,32,8,ActivationType.Swiglu,torch.bfloat16,torch.float4_e2m1fn_x2,torch.float4_e2m1fn_x2,QuantType.per_1x32,1,0,128,0,77.6508,flydsl_moe2_afp4_wfp4_bf16_t64x256x256_reduce_bnt2_sbm128,3.8%,331.87,20746.8
stage2,256,32,4096,4096,32,8,ActivationType.Swiglu,torch.bfloat16,torch.float4_e2m1fn_x2,torch.float4_e2m1fn_x2,QuantType.per_1x32,1,0,128,0,79.0201,flydsl_moe2_afp4_wfp4_bf16_t64x256x256_reduce_bnt2_persist_sbm128,3.8%,326.12,20387.29
stage2,256,32,4096,4096,32,8,ActivationType.Swiglu,torch.bfloat16,torch.float4_e2m1fn_x2,torch.float4_e2m1fn_x2,QuantType.per_1x32,1,0,128,0,75.8737,flydsl_moe2_afp4_wfp4_bf16_t64x256x256_reduce_bnt2_xcd4_sbm128,3.8%,339.64,21232.73
stage2,256,32,4096,4096,32,8,ActivationType.Swiglu,torch.bfloat16,torch.float4_e2m1fn_x2,torch.float4_e2m1fn_x2,QuantType.per_1x32,1,0,128,0,232.1917,flydsl_moe2_afp4_wfp4_bf16_t64x256x256_reduce_bnt2_xcd4_persist_sbm128,3.8%,110.99,6938.26
stage2,256,32,4096,4096,32,8,ActivationType.Swiglu,torch.bfloat16,torch.float4_e2m1fn_x2,torch.float4_e2m1fn_x2,QuantType.per_1x32,1,0,128,0,73.6465,flydsl_moe2_afp4_wfp4_bf16_t128x128x256_atomic,9.3%,349.91,21874.85
stage2,256,32,4096,4096,32,8,ActivationType.Swiglu,torch.bfloat16,torch.float4_e2m1fn_x2,torch.float4_e2m1fn_x2,QuantType.per_1x32,1,0,128,0,80.1817,flydsl_moe2_afp4_wfp4_bf16_t128x128x256_atomic_persist,9.2%,321.39,20091.94
stage2,256,32,4096,4096,32,8,ActivationType.Swiglu,torch.bfloat16,torch.float4_e2m1fn_x2,torch.float4_e2m1fn_x2,QuantType.per_1x32,1,0,128,0,76.5313,flydsl_moe2_afp4_wfp4_bf16_t128x128x256_atomic_xcd4,9.3%,336.72,21050.29
stage2,256,32,4096,4096,32,8,ActivationType.Swiglu,torch.bfloat16,torch.float4_e2m1fn_x2,torch.float4_e2m1fn_x2,QuantType.per_1x32,1,0,128,0,769.8985,flydsl_moe2_afp4_wfp4_bf16_t128x128x256_atomic_xcd4_persist,9.3%,33.47,2092.49
stage2,256,32,4096,4096,32,8,ActivationType.Swiglu,torch.bfloat16,torch.float4_e2m1fn_x2,torch.float4_e2m1fn_x2,QuantType.per_1x32,1,0,128,0,73.3902,flydsl_moe2_afp4_wfp4_bf16_t128x128x256_atomic_bnt2,9.1%,351.13,21951.24
stage2,256,32,4096,4096,32,8,ActivationType.Swiglu,torch.bfloat16,torch.float4_e2m1fn_x2,torch.float4_e2m1fn_x2,QuantType.per_1x32,1,0,128,0,78.8107,flydsl_moe2_afp4_wfp4_bf16_t128x128x256_atomic_bnt2_persist,9.3%,326.98,20441.46
stage2,256,32,4096,4096,32,8,ActivationType.Swiglu,torch.bfloat16,torch.float4_e2m1fn_x2,torch.float4_e2m1fn_x2,QuantType.per_1x32,1,0,128,0,74.8527,flydsl_moe2_afp4_wfp4_bf16_t128x128x256_atomic_bnt2_xcd4,9.2%,344.27,21522.35
stage2,256,32,4096,4096,32,8,ActivationType.Swiglu,torch.bfloat16,torch.float4_e2m1fn_x2,torch.float4_e2m1fn_x2,QuantType.per_1x32,1,0,128,0,758.2961,flydsl_moe2_afp4_wfp4_bf16_t128x128x256_atomic_bnt2_xcd4_persist,9.2%,33.98,2124.51
stage2,256,32,4096,4096,32,8,ActivationType.Swiglu,torch.bfloat16,torch.float4_e2m1fn_x2,torch.float4_e2m1fn_x2,QuantType.per_1x32,1,0,128,0,74.3334,flydsl_moe2_afp4_wfp4_bf16_t128x128x256_reduce,3.8%,346.68,21672.71
stage2,256,32,4096,4096,32,8,ActivationType.Swiglu,torch.bfloat16,torch.float4_e2m1fn_x2,torch.float4_e2m1fn_x2,QuantType.per_1x32,1,0,128,0,81.1221,flydsl_moe2_afp4_wfp4_bf16_t128x128x256_reduce_persist,3.8%,317.67,19859.03
stage2,256,32,4096,4096,32,8,ActivationType.Swiglu,torch.bfloat16,torch.float4_e2m1fn_x2,torch.float4_e2m1fn_x2,QuantType.per_1x32,1,0,128,0,76.8761,flydsl_moe2_afp4_wfp4_bf16_t128x128x256_reduce_xcd4,3.8%,335.21,20955.88
stage2,256,32,4096,4096,32,8,ActivationType.Swiglu,torch.bfloat16,torch.float4_e2m1fn_x2,torch.float4_e2m1fn_x2,QuantType.per_1x32,1,0,128,0,747.1823,flydsl_moe2_afp4_wfp4_bf16_t128x128x256_reduce_xcd4_persist,3.8%,34.49,2156.11
stage2,256,32,4096,4096,32,8,ActivationType.Swiglu,torch.bfloat16,torch.float4_e2m1fn_x2,torch.float4_e2m1fn_x2,QuantType.per_1x32,1,0,128,0,73.8909,flydsl_moe2_afp4_wfp4_bf16_t128x128x256_reduce_bnt2,3.8%,348.75,21802.49
stage2,256,32,4096,4096,32,8,ActivationType.Swiglu,torch.bfloat16,torch.float4_e2m1fn_x2,torch.float4_e2m1fn_x2,QuantType.per_1x32,1,0,128,0,79.6481,flydsl_moe2_afp4_wfp4_bf16_t128x128x256_reduce_bnt2_persist,3.8%,323.55,20226.55
stage2,256,32,4096,4096,32,8,ActivationType.Swiglu,torch.bfloat16,torch.float4_e2m1fn_x2,torch.float4_e2m1fn_x2,QuantType.per_1x32,1,0,128,0,74.2403,flydsl_moe2_afp4_wfp4_bf16_t128x128x256_reduce_bnt2_xcd4,3.8%,347.11,21699.88
stage2,256,32,4096,4096,32,8,ActivationType.Swiglu,torch.bfloat16,torch.float4_e2m1fn_x2,torch.float4_e2m1fn_x2,QuantType.per_1x32,1,0,128,0,738.8265,flydsl_moe2_afp4_wfp4_bf16_t128x128x256_reduce_bnt2_xcd4_persist,3.8%,34.88,2180.49
stage2,256,32,4096,4096,32,8,ActivationType.Swiglu,torch.bfloat16,torch.float4_e2m1fn_x2,torch.float4_e2m1fn_x2,QuantType.per_1x32,1,0,128,0,77.4632,flydsl_moe2_afp4_wfp4_bf16_t128x256x256_atomic,9.3%,332.67,20797.05
stage2,256,32,4096,4096,32,8,ActivationType.Swiglu,torch.bfloat16,torch.float4_e2m1fn_x2,torch.float4_e2m1fn_x2,QuantType.per_1x32,1,0,128,0,87.4631,flydsl_moe2_afp4_wfp4_bf16_t128x256x256_atomic_persist,9.3%,294.64,18419.26
stage2,256,32,4096,4096,32,8,ActivationType.Swiglu,torch.bfloat16,torch.float4_e2m1fn_x2,torch.float4_e2m1fn_x2,QuantType.per_1x32,1,0,128,0,104.0419,flydsl_moe2_afp4_wfp4_bf16_t128x256x256_atomic_xcd4,9.3%,247.69,15484.2
stage2,256,32,4096,4096,32,8,ActivationType.Swiglu,torch.bfloat16,torch.float4_e2m1fn_x2,torch.float4_e2m1fn_x2,QuantType.per_1x32,1,0,128,0,492.7831,flydsl_moe2_afp4_wfp4_bf16_t128x256x256_atomic_xcd4_persist,9.3%,52.29,3269.2
stage2,256,32,4096,4096,32,8,ActivationType.Swiglu,torch.bfloat16,torch.float4_e2m1fn_x2,torch.float4_e2m1fn_x2,QuantType.per_1x32,1,0,128,0,77.5552,flydsl_moe2_afp4_wfp4_bf16_t128x256x256_atomic_bnt2,9.3%,332.28,20772.38
stage2,256,32,4096,4096,32,8,ActivationType.Swiglu,torch.bfloat16,torch.float4_e2m1fn_x2,torch.float4_e2m1fn_x2,QuantType.per_1x32,1,0,128,0,87.2199,flydsl_moe2_afp4_wfp4_bf16_t128x256x256_atomic_bnt2_persist,9.3%,295.46,18470.62
stage2,256,32,4096,4096,32,8,ActivationType.Swiglu,torch.bfloat16,torch.float4_e2m1fn_x2,torch.float4_e2m1fn_x2,QuantType.per_1x32,1,0,128,0,100.3089,flydsl_moe2_afp4_wfp4_bf16_t128x256x256_atomic_bnt2_xcd4,9.2%,256.9,16060.45
stage2,256,32,4096,4096,32,8,ActivationType.Swiglu,torch.bfloat16,torch.float4_e2m1fn_x2,torch.float4_e2m1fn_x2,QuantType.per_1x32,1,0,128,0,489.4776,flydsl_moe2_afp4_wfp4_bf16_t128x256x256_atomic_bnt2_xcd4_persist,9.3%,52.65,3291.28
stage2,256,32,4096,4096,32,8,ActivationType.Swiglu,torch.bfloat16,torch.float4_e2m1fn_x2,torch.float4_e2m1fn_x2,QuantType.per_1x32,1,0,128,0,80.1657,flydsl_moe2_afp4_wfp4_bf16_t128x256x256_reduce,3.8%,321.46,20095.95
stage2,256,32,4096,4096,32,8,ActivationType.Swiglu,torch.bfloat16,torch.float4_e2m1fn_x2,torch.float4_e2m1fn_x2,QuantType.per_1x32,1,0,128,0,88.975,flydsl_moe2_afp4_wfp4_bf16_t128x256x256_reduce_persist,3.8%,289.63,18106.28
stage2,256,32,4096,4096,32,8,ActivationType.Swiglu,torch.bfloat16,torch.float4_e2m1fn_x2,torch.float4_e2m1fn_x2,QuantType.per_1x32,1,0,128,0,103.4712,flydsl_moe2_afp4_wfp4_bf16_t128x256x256_reduce_xcd4,3.8%,249.05,15569.61
stage2,256,32,4096,4096,32,8,ActivationType.Swiglu,torch.bfloat16,torch.float4_e2m1fn_x2,torch.float4_e2m1fn_x2,QuantType.per_1x32,1,0,128,0,496.5622,flydsl_moe2_afp4_wfp4_bf16_t128x256x256_reduce_xcd4_persist,3.8%,51.9,3244.32
stage2,256,32,4096,4096,32,8,ActivationType.Swiglu,torch.bfloat16,torch.float4_e2m1fn_x2,torch.float4_e2m1fn_x2,QuantType.per_1x32,1,0,128,0,79.0101,flydsl_moe2_afp4_wfp4_bf16_t128x256x256_reduce_bnt2,3.8%,326.16,20389.87
stage2,256,32,4096,4096,32,8,ActivationType.Swiglu,torch.bfloat16,torch.float4_e2m1fn_x2,torch.float4_e2m1fn_x2,QuantType.per_1x32,1,0,128,0,86.7608,flydsl_moe2_afp4_wfp4_bf16_t128x256x256_reduce_bnt2_persist,3.8%,297.02,18568.36
stage2,256,32,4096,4096,32,8,ActivationType.Swiglu,torch.bfloat16,torch.float4_e2m1fn_x2,torch.float4_e2m1fn_x2,QuantType.per_1x32,1,0,128,0,100.5127,flydsl_moe2_afp4_wfp4_bf16_t128x256x256_reduce_bnt2_xcd4,3.8%,256.38,16027.88
stage2,256,32,4096,4096,32,8,ActivationType.Swiglu,torch.bfloat16,torch.float4_e2m1fn_x2,torch.float4_e2m1fn_x2,QuantType.per_1x32,1,0,128,0,494.0814,flydsl_moe2_afp4_wfp4_bf16_t128x256x256_reduce_bnt2_xcd4_persist,3.8%,52.16,3260.61
stage1,256,16,4096,4096,32,8,ActivationType.Silu,torch.bfloat16,torch.bfloat16,torch.bfloat16,QuantType.No,1,0,32,0,369.372,moe_ck2stages_gemm1_256x32x64x128_1x4_TypeCast_v1_Nswizzle0_Quant0_MulRoutedWeight0_silu_B16_B16_B16,0.0%,34.88,8721.53
stage1,256,16,4096,4096,32,8,ActivationType.Silu,torch.bfloat16,torch.bfloat16,torch.bfloat16,QuantType.No,1,0,32,0,382.7469,moe_ck2stages_gemm1_256x32x64x64_1x4_TypeCast_v1_Nswizzle0_Quant0_MulRoutedWeight0_silu_B16_B16_B16,0.0%,33.66,8416.76
stage2,256,16,4096,4096,32,8,ActivationType.Silu,torch.bfloat16,torch.bfloat16,torch.bfloat16,QuantType.No,1,0,32,0,189.0108,moe_ck2stages_gemm2_256x32x128x128_1x4_TypeCast_v1_Nswizzle0_Quant0_MulRoutedWeight1_B16_B16_B16,5.3%,68.17,17043.93
stage2,256,16,4096,4096,32,8,ActivationType.Silu,torch.bfloat16,torch.bfloat16,torch.bfloat16,QuantType.No,1,0,32,0,194.0801,moe_ck2stages_gemm2_256x32x64x64_1x4_TypeCast_v1_Nswizzle0_Quant0_MulRoutedWeight1_B16_B16_B16,5.3%,66.39,16598.75
stage1,256,16,4096,4096,32,8,ActivationType.Silu,torch.bfloat16,torch.bfloat16,torch.bfloat16,QuantType.No,1,0,64,0,384.9201,moe_ck2stages_gemm1_256x64x64x128_1x4_TypeCast_v1_Nswizzle0_Quant0_MulRoutedWeight0_silu_B16_B16_B16,0.0%,33.47,8369.24
stage1,256,16,4096,4096,32,8,ActivationType.Silu,torch.bfloat16,torch.bfloat16,torch.bfloat16,QuantType.No,1,0,64,0,381.5146,moe_ck2stages_gemm1_256x64x64x64_1x4_TypeCast_v1_Nswizzle0_Quant0_MulRoutedWeight0_silu_B16_B16_B16,0.0%,33.77,8443.94
stage2,256,16,4096,4096,32,8,ActivationType.Silu,torch.bfloat16,torch.bfloat16,torch.bfloat16,QuantType.No,1,0,64,0,194.0711,moe_ck2stages_gemm2_256x64x128x128_1x4_TypeCast_v1_Nswizzle0_Quant0_MulRoutedWeight1_B16_B16_B16,5.3%,66.39,16599.52
stage2,256,16,4096,4096,32,8,ActivationType.Silu,torch.bfloat16,torch.bfloat16,torch.bfloat16,QuantType.No,1,0,64,0,191.1638,moe_ck2stages_gemm2_256x64x64x64_1x4_TypeCast_v1_Nswizzle0_Quant0_MulRoutedWeight1_B16_B16_B16,5.3%,67.4,16851.98
stage2,256,16,4096,4096,32,8,ActivationType.Silu,torch.bfloat16,torch.bfloat16,torch.bfloat16,QuantType.No,1,0,64,0,214.0458,moe_ck2stages_gemm2_256x64x128x64_1x4_TypeCast_v1_Nswizzle0_Quant0_MulRoutedWeight1_B16_B16_B16,5.1%,60.2,15050.46
stage1,256,16,4096,4096,32,8,ActivationType.Silu,torch.bfloat16,torch.bfloat16,torch.bfloat16,QuantType.No,1,0,128,0,386.1144,moe_ck2stages_gemm1_256x128x64x64_1x4_TypeCast_v1_Nswizzle0_Quant0_MulRoutedWeight0_silu_B16_B16_B16,0.0%,33.37,8343.35
stage1,256,16,4096,4096,32,8,ActivationType.Silu,torch.bfloat16,torch.bfloat16,torch.bfloat16,QuantType.No,1,0,128,0,398.3996,moe_ck2stages_gemm1_256x128x128x64_1x4_TypeCast_v3_Nswizzle0_Quant0_MulRoutedWeight0_silu_B16_B16_B16,0.0%,32.34,8086.07
stage2,256,16,4096,4096,32,8,ActivationType.Silu,torch.bfloat16,torch.bfloat16,torch.bfloat16,QuantType.No,1,0,128,0,191.888,moe_ck2stages_gemm2_256x128x128x64_1x4_TypeCast_v1_Nswizzle0_Quant0_MulRoutedWeight1_B16_B16_B16,5.2%,67.15,16788.37
stage2,256,16,4096,4096,32,8,ActivationType.Silu,torch.bfloat16,torch.bfloat16,torch.bfloat16,QuantType.No,1,0,128,0,190.2131,moe_ck2stages_gemm2_256x128x128x64_1x4_TypeCast_v3_Nswizzle0_Quant0_MulRoutedWeight1_B16_B16_B16,5.2%,67.74,16936.2
stage2,256,16,4096,4096,32,8,ActivationType.Silu,torch.bfloat16,torch.bfloat16,torch.bfloat16,QuantType.No,1,0,128,0,195.7916,moe_ck2stages_gemm2_256x128x64x64_1x4_TypeCast_v3_Nswizzle0_Quant0_MulRoutedWeight1_B16_B16_B16,5.2%,65.81,16453.66
stage2,256,16,4096,4096,32,8,ActivationType.Silu,torch.bfloat16,torch.bfloat16,torch.bfloat16,QuantType.No,1,0,128,0,198.7724,moe_ck2stages_gemm2_256x128x64x64_1x4_TypeCast_v1_Nswizzle0_Quant0_MulRoutedWeight1_B16_B16_B16,5.3%,64.82,16206.92
stage1,256,16,4096,4096,32,8,ActivationType.Swiglu,torch.bfloat16,torch.float4_e2m1fn_x2,torch.float4_e2m1fn_x2,QuantType.per_1x32,1,0,32,0,201.8313,flydsl_moe1_afp4_wfp4_bf16_t32x32x256_bnt0,0.0%,63.84,7980.97
stage1,256,16,4096,4096,32,8,ActivationType.Swiglu,torch.bfloat16,torch.float4_e2m1fn_x2,torch.float4_e2m1fn_x2,QuantType.per_1x32,1,0,32,0,201.3576,flydsl_moe1_afp4_wfp4_bf16_t32x32x256_bnt0_fp4,0.8%,63.99,7999.74
stage1,256,16,4096,4096,32,8,ActivationType.Swiglu,torch.bfloat16,torch.float4_e2m1fn_x2,torch.float4_e2m1fn_x2,QuantType.per_1x32,1,0,32,0,241.2979,flydsl_moe1_afp4_wfp4_bf16_t32x32x256_bnt0_xcd4,0.0%,53.4,6675.6
stage1,256,16,4096,4096,32,8,ActivationType.Swiglu,torch.bfloat16,torch.float4_e2m1fn_x2,torch.float4_e2m1fn_x2,QuantType.per_1x32,1,0,32,0,241.3345,flydsl_moe1_afp4_wfp4_bf16_t32x32x256_bnt0_xcd4_fp4,0.8%,53.39,6674.59
stage1,256,16,4096,4096,32,8,ActivationType.Swiglu,torch.bfloat16,torch.float4_e2m1fn_x2,torch.float4_e2m1fn_x2,QuantType.per_1x32,1,0,32,0,199.028,flydsl_moe1_afp4_wfp4_bf16_t32x32x256,0.0%,64.74,8093.38
stage1,256,16,4096,4096,32,8,ActivationType.Swiglu,torch.bfloat16,torch.float4_e2m1fn_x2,torch.float4_e2m1fn_x2,QuantType.per_1x32,1,0,32,0,198.3057,flydsl_moe1_afp4_wfp4_bf16_t32x32x256_fp4,0.8%,64.97,8122.86
stage1,256,16,4096,4096,32,8,ActivationType.Swiglu,torch.bfloat16,torch.float4_e2m1fn_x2,torch.float4_e2m1fn_x2,QuantType.per_1x32,1,0,32,0,232.3127,flydsl_moe1_afp4_wfp4_bf16_t32x32x256_xcd4,0.0%,55.46,6933.8
stage1,256,16,4096,4096,32,8,ActivationType.Swiglu,torch.bfloat16,torch.float4_e2m1fn_x2,torch.float4_e2m1fn_x2,QuantType.per_1x32,1,0,32,0,233.711,flydsl_moe1_afp4_wfp4_bf16_t32x32x256_xcd4_fp4,0.8%,55.13,6892.31
stage1,256,16,4096,4096,32,8,ActivationType.Swiglu,torch.bfloat16,torch.float4_e2m1fn_x2,torch.float4_e2m1fn_x2,QuantType.per_1x32,1,0,32,0,118.5852,flydsl_moe1_afp4_wfp4_bf16_t32x32x256_w2_bnt0,0.0%,108.66,13583.56
stage1,256,16,4096,4096,32,8,ActivationType.Swiglu,torch.bfloat16,torch.float4_e2m1fn_x2,torch.float4_e2m1fn_x2,QuantType.per_1x32,1,0,32,0,118.6315,flydsl_moe1_afp4_wfp4_bf16_t32x32x256_w2_bnt0_fp4,0.8%,108.61,13578.26
stage1,256,16,4096,4096,32,8,ActivationType.Swiglu,torch.bfloat16,torch.float4_e2m1fn_x2,torch.float4_e2m1fn_x2,QuantType.per_1x32,1,0,32,0,145.1755,flydsl_moe1_afp4_wfp4_bf16_t32x32x256_w2_bnt0_xcd4,0.0%,88.75,11095.6
stage1,256,16,4096,4096,32,8,ActivationType.Swiglu,torch.bfloat16,torch.float4_e2m1fn_x2,torch.float4_e2m1fn_x2,QuantType.per_1x32,1,0,32,0,145.1822,flydsl_moe1_afp4_wfp4_bf16_t32x32x256_w2_bnt0_xcd4_fp4,0.8%,88.75,11095.09
stage1,256,16,4096,4096,32,8,ActivationType.Swiglu,torch.bfloat16,torch.float4_e2m1fn_x2,torch.float4_e2m1fn_x2,QuantType.per_1x32,1,0,32,0,116.5926,flydsl_moe1_afp4_wfp4_bf16_t32x32x256_w2,0.0%,110.51,13815.71
stage1,256,16,4096,4096,32,8,ActivationType.Swiglu,torch.bfloat16,torch.float4_e2m1fn_x2,torch.float4_e2m1fn_x2,QuantType.per_1x32,1,0,32,0,117.1954,flydsl_moe1_afp4_wfp4_bf16_t32x32x256_w2_fp4,0.8%,109.94,13744.65
stage1,256,16,4096,4096,32,8,ActivationType.Swiglu,torch.bfloat16,torch.float4_e2m1fn_x2,torch.float4_e2m1fn_x2,QuantType.per_1x32,1,0,32,0,138.3271,flydsl_moe1_afp4_wfp4_bf16_t32x32x256_w2_xcd4,0.0%,93.15,11644.93
stage1,256,16,4096,4096,32,8,ActivationType.Swiglu,torch.bfloat16,torch.float4_e2m1fn_x2,torch.float4_e2m1fn_x2,QuantType.per_1x32,1,0,32,0,138.6843,flydsl_moe1_afp4_wfp4_bf16_t32x32x256_w2_xcd4_fp4,0.8%,92.91,11614.94
stage1,256,16,4096,4096,32,8,ActivationType.Swiglu,torch.bfloat16,torch.float4_e2m1fn_x2,torch.float4_e2m1fn_x2,QuantType.per_1x32,1,0,32,0,103.5764,flydsl_moe1_afp4_wfp4_bf16_t32x32x256_w3_bnt0,0.0%,124.4,15551.9
stage1,256,16,4096,4096,32,8,ActivationType.Swiglu,torch.bfloat16,torch.float4_e2m1fn_x2,torch.float4_e2m1fn_x2,QuantType.per_1x32,1,0,32,0,104.039,flydsl_moe1_afp4_wfp4_bf16_t32x32x256_w3_bnt0_fp4,0.8%,123.85,15482.75
stage1,256,16,4096,4096,32,8,ActivationType.Swiglu,torch.bfloat16,torch.float4_e2m1fn_x2,torch.float4_e2m1fn_x2,QuantType.per_1x32,1,0,32,0,128.4017,flydsl_moe1_afp4_wfp4_bf16_t32x32x256_w3_bnt0_xcd4,0.0%,100.35,12545.08
stage1,256,16,4096,4096,32,8,ActivationType.Swiglu,torch.bfloat16,torch.float4_e2m1fn_x2,torch.float4_e2m1fn_x2,QuantType.per_1x32,1,0,32,0,128.0503,flydsl_moe1_afp4_wfp4_bf16_t32x32x256_w3_bnt0_xcd4_fp4,0.8%,100.62,12579.5
stage1,256,16,4096,4096,32,8,ActivationType.Swiglu,torch.bfloat16,torch.float4_e2m1fn_x2,torch.float4_e2m1fn_x2,QuantType.per_1x32,1,0,32,0,101.3585,flydsl_moe1_afp4_wfp4_bf16_t32x32x256_w3,0.0%,127.12,15892.2
stage1,256,16,4096,4096,32,8,ActivationType.Swiglu,torch.bfloat16,torch.float4_e2m1fn_x2,torch.float4_e2m1fn_x2,QuantType.per_1x32,1,0,32,0,101.038,flydsl_moe1_afp4_wfp4_bf16_t32x32x256_w3_fp4,0.8%,127.53,15942.61
stage1,256,16,4096,4096,32,8,ActivationType.Swiglu,torch.bfloat16,torch.float4_e2m1fn_x2,torch.float4_e2m1fn_x2,QuantType.per_1x32,1,0,32,0,119.896,flydsl_moe1_afp4_wfp4_bf16_t32x32x256_w3_xcd4,0.0%,107.47,13435.05
stage1,256,16,4096,4096,32,8,ActivationType.Swiglu,torch.bfloat16,torch.float4_e2m1fn_x2,torch.float4_e2m1fn_x2,QuantType.per_1x32,1,0,32,0,121.0366,flydsl_moe1_afp4_wfp4_bf16_t32x32x256_w3_xcd4_fp4,0.8%,106.45,13308.45
stage1,256,16,4096,4096,32,8,ActivationType.Swiglu,torch.bfloat16,torch.float4_e2m1fn_x2,torch.float4_e2m1fn_x2,QuantType.per_1x32,1,0,32,0,120.9324,flydsl_moe1_afp4_wfp4_bf16_t32x32x256_w3_kb2_bnt0_fp4,100.0%,106.55,13319.92
stage1,256,16,4096,4096,32,8,ActivationType.Swiglu,torch.bfloat16,torch.float4_e2m1fn_x2,torch.float4_e2m1fn_x2,QuantType.per_1x32,1,0,32,0,151.7623,flydsl_moe1_afp4_wfp4_bf16_t32x32x256_w3_kb2_bnt0_xcd4_fp4,100.0%,84.9,10614.03
stage1,256,16,4096,4096,32,8,ActivationType.Swiglu,torch.bfloat16,torch.float4_e2m1fn_x2,torch.float4_e2m1fn_x2,QuantType.per_1x32,1,0,32,0,161.5983,flydsl_moe1_afp4_wfp4_bf16_t32x32x256_w3_kb2_bnt0_go_fp4,100.0%,79.73,9967.98
stage1,256,16,4096,4096,32,8,ActivationType.Swiglu,torch.bfloat16,torch.float4_e2m1fn_x2,torch.float4_e2m1fn_x2,QuantType.per_1x32,1,0,32,0,193.2803,flydsl_moe1_afp4_wfp4_bf16_t32x32x256_w3_kb2_bnt0_go_xcd4_fp4,100.0%,66.66,8334.06
stage1,256,16,4096,4096,32,8,ActivationType.Swiglu,torch.bfloat16,torch.float4_e2m1fn_x2,torch.float4_e2m1fn_x2,QuantType.per_1x32,1,0,32,0,118.0736,flydsl_moe1_afp4_wfp4_bf16_t32x32x256_w3_kb2_fp4,100.0%,109.13,13642.42
stage1,256,16,4096,4096,32,8,ActivationType.Swiglu,torch.bfloat16,torch.float4_e2m1fn_x2,torch.float4_e2m1fn_x2,QuantType.per_1x32,1,0,32,0,143.6687,flydsl_moe1_afp4_wfp4_bf16_t32x32x256_w3_kb2_xcd4_fp4,100.0%,89.68,11211.97
stage1,256,16,4096,4096,32,8,ActivationType.Swiglu,torch.bfloat16,torch.float4_e2m1fn_x2,torch.float4_e2m1fn_x2,QuantType.per_1x32,1,0,32,0,160.3136,flydsl_moe1_afp4_wfp4_bf16_t32x32x256_w3_kb2_go_fp4,100.0%,80.37,10047.86
stage1,256,16,4096,4096,32,8,ActivationType.Swiglu,torch.bfloat16,torch.float4_e2m1fn_x2,torch.float4_e2m1fn_x2,QuantType.per_1x32,1,0,32,0,188.6977,flydsl_moe1_afp4_wfp4_bf16_t32x32x256_w3_kb2_go_xcd4_fp4,100.0%,68.28,8536.45
stage1,256,16,4096,4096,32,8,ActivationType.Swiglu,torch.bfloat16,torch.float4_e2m1fn_x2,torch.float4_e2m1fn_x2,QuantType.per_1x32,1,0,32,0,142.9893,flydsl_moe1_afp4_wfp4_bf16_t32x32x256_w3_kb4_bnt0_fp4,100.0%,90.11,11265.24
stage1,256,16,4096,4096,32,8,ActivationType.Swiglu,torch.bfloat16,torch.float4_e2m1fn_x2,torch.float4_e2m1fn_x2,QuantType.per_1x32,1,0,32,0,178.9647,flydsl_moe1_afp4_wfp4_bf16_t32x32x256_w3_kb4_bnt0_xcd4_fp4,100.0%,72.0,9000.71
stage1,256,16,4096,4096,32,8,ActivationType.Swiglu,torch.bfloat16,torch.float4_e2m1fn_x2,torch.float4_e2m1fn_x2,QuantType.per_1x32,1,0,32,0,204.5825,flydsl_moe1_afp4_wfp4_bf16_t32x32x256_w3_kb4_bnt0_go_fp4,100.0%,62.98,7873.64
stage1,256,16,4096,4096,32,8,ActivationType.Swiglu,torch.bfloat16,torch.float4_e2m1fn_x2,torch.float4_e2m1fn_x2,QuantType.per_1x32,1,0,32,0,250.951,flydsl_moe1_afp4_wfp4_bf16_t32x32x256_w3_kb4_bnt0_go_xcd4_fp4,100.0%,51.34,6418.82
stage1,256,16,4096,4096,32,8,ActivationType.Swiglu,torch.bfloat16,torch.float4_e2m1fn_x2,torch.float4_e2m1fn_x2,QuantType.per_1x32,1,0,32,0,141.253,flydsl_moe1_afp4_wfp4_bf16_t32x32x256_w3_kb4_fp4,100.0%,91.22,11403.72
stage1,256,16,4096,4096,32,8,ActivationType.Swiglu,torch.bfloat16,torch.float4_e2m1fn_x2,torch.float4_e2m1fn_x2,QuantType.per_1x32,1,0,32,0,170.7685,flydsl_moe1_afp4_wfp4_bf16_t32x32x256_w3_kb4_xcd4_fp4,100.0%,75.45,9432.71
stage1,256,16,4096,4096,32,8,ActivationType.Swiglu,torch.bfloat16,torch.float4_e2m1fn_x2,torch.float4_e2m1fn_x2,QuantType.per_1x32,1,0,32,0,202.9391,flydsl_moe1_afp4_wfp4_bf16_t32x32x256_w3_kb4_go_fp4,100.0%,63.49,7937.4
stage1,256,16,4096,4096,32,8,ActivationType.Swiglu,torch.bfloat16,torch.float4_e2m1fn_x2,torch.float4_e2m1fn_x2,QuantType.per_1x32,1,0,32,0,243.7402,flydsl_moe1_afp4_wfp4_bf16_t32x32x256_w3_kb4_go_xcd4_fp4,100.0%,52.86,6608.71
stage1,256,16,4096,4096,32,8,ActivationType.Swiglu,torch.bfloat16,torch.float4_e2m1fn_x2,torch.float4_e2m1fn_x2,QuantType.per_1x32,1,0,32,0,-1.0,flydsl_moe1_afp4_wfp4_bf16_t32x32x256_w3_kb7_bnt0_fp4,100.0%,0.0,0.0
stage1,256,16,4096,4096,32,8,ActivationType.Swiglu,torch.bfloat16,torch.float4_e2m1fn_x2,torch.float4_e2m1fn_x2,QuantType.per_1x32,1,0,32,0,-1.0,flydsl_moe1_afp4_wfp4_bf16_t32x32x256_w3_kb7_bnt0_xcd4_fp4,100.0%,0.0,0.0
stage1,256,16,4096,4096,32,8,ActivationType.Swiglu,torch.bfloat16,torch.float4_e2m1fn_x2,torch.float4_e2m1fn_x2,QuantType.per_1x32,1,0,32,0,-1.0,flydsl_moe1_afp4_wfp4_bf16_t32x32x256_w3_kb7_bnt0_go_fp4,100.0%,0.0,0.0
stage1,256,16,4096,4096,32,8,ActivationType.Swiglu,torch.bfloat16,torch.float4_e2m1fn_x2,torch.float4_e2m1fn_x2,QuantType.per_1x32,1,0,32,0,-1.0,flydsl_moe1_afp4_wfp4_bf16_t32x32x256_w3_kb7_bnt0_go_xcd4_fp4,100.0%,0.0,0.0
stage1,256,16,4096,4096,32,8,ActivationType.Swiglu,torch.bfloat16,torch.float4_e2m1fn_x2,torch.float4_e2m1fn_x2,QuantType.per_1x32,1,0,32,0,-1.0,flydsl_moe1_afp4_wfp4_bf16_t32x32x256_w3_kb7_fp4,100.0%,0.0,0.0
stage1,256,16,4096,4096,32,8,ActivationType.Swiglu,torch.bfloat16,torch.float4_e2m1fn_x2,torch.float4_e2m1fn_x2,QuantType.per_1x32,1,0,32,0,-1.0,flydsl_moe1_afp4_wfp4_bf16_t32x32x256_w3_kb7_xcd4_fp4,100.0%,0.0,0.0
stage1,256,16,4096,4096,32,8,ActivationType.Swiglu,torch.bfloat16,torch.float4_e2m1fn_x2,torch.float4_e2m1fn_x2,QuantType.per_1x32,1,0,32,0,-1.0,flydsl_moe1_afp4_wfp4_bf16_t32x32x256_w3_kb7_go_fp4,100.0%,0.0,0.0
stage1,256,16,4096,4096,32,8,ActivationType.Swiglu,torch.bfloat16,torch.float4_e2m1fn_x2,torch.float4_e2m1fn_x2,QuantType.per_1x32,1,0,32,0,-1.0,flydsl_moe1_afp4_wfp4_bf16_t32x32x256_w3_kb7_go_xcd4_fp4,100.0%,0.0,0.0
stage1,256,16,4096,4096,32,8,ActivationType.Swiglu,torch.bfloat16,torch.float4_e2m1fn_x2,torch.float4_e2m1fn_x2,QuantType.per_1x32,1,0,32,0,-1.0,flydsl_moe1_afp4_wfp4_bf16_t32x32x256_w3_kb14_bnt0_fp4,100.0%,0.0,0.0
stage1,256,16,4096,4096,32,8,ActivationType.Swiglu,torch.bfloat16,torch.float4_e2m1fn_x2,torch.float4_e2m1fn_x2,QuantType.per_1x32,1,0,32,0,-1.0,flydsl_moe1_afp4_wfp4_bf16_t32x32x256_w3_kb14_bnt0_xcd4_fp4,100.0%,0.0,0.0
stage1,256,16,4096,4096,32,8,ActivationType.Swiglu,torch.bfloat16,torch.float4_e2m1fn_x2,torch.float4_e2m1fn_x2,QuantType.per_1x32,1,0,32,0,-1.0,flydsl_moe1_afp4_wfp4_bf16_t32x32x256_w3_kb14_bnt0_go_fp4,100.0%,0.0,0.0
stage1,256,16,4096,4096,32,8,ActivationType.Swiglu,torch.bfloat16,torch.float4_e2m1fn_x2,torch.float4_e2m1fn_x2,QuantType.per_1x32,1,0,32,0,-1.0,flydsl_moe1_afp4_wfp4_bf16_t32x32x256_w3_kb14_bnt0_go_xcd4_fp4,100.0%,0.0,0.0
stage1,256,16,4096,4096,32,8,ActivationType.Swiglu,torch.bfloat16,torch.float4_e2m1fn_x2,torch.float4_e2m1fn_x2,QuantType.per_1x32,1,0,32,0,-1.0,flydsl_moe1_afp4_wfp4_bf16_t32x32x256_w3_kb14_fp4,100.0%,0.0,0.0
stage1,256,16,4096,4096,32,8,ActivationType.Swiglu,torch.bfloat16,torch.float4_e2m1fn_x2,torch.float4_e2m1fn_x2,QuantType.per_1x32,1,0,32,0,-1.0,flydsl_moe1_afp4_wfp4_bf16_t32x32x256_w3_kb14_xcd4_fp4,100.0%,0.0,0.0
stage1,256,16,4096,4096,32,8,ActivationType.Swiglu,torch.bfloat16,torch.float4_e2m1fn_x2,torch.float4_e2m1fn_x2,QuantType.per_1x32,1,0,32,0,-1.0,flydsl_moe1_afp4_wfp4_bf16_t32x32x256_w3_kb14_go_fp4,100.0%,0.0,0.0
stage1,256,16,4096,4096,32,8,ActivationType.Swiglu,torch.bfloat16,torch.float4_e2m1fn_x2,torch.float4_e2m1fn_x2,QuantType.per_1x32,1,0,32,0,-1.0,flydsl_moe1_afp4_wfp4_bf16_t32x32x256_w3_kb14_go_xcd4_fp4,100.0%,0.0,0.0
stage1,256,16,4096,4096,32,8,ActivationType.Swiglu,torch.bfloat16,torch.float4_e2m1fn_x2,torch.float4_e2m1fn_x2,QuantType.per_1x32,1,0,32,0,94.7788,flydsl_moe1_afp4_wfp4_bf16_t32x32x256_w4_bnt0,0.0%,135.95,16995.46
stage1,256,16,4096,4096,32,8,ActivationType.Swiglu,torch.bfloat16,torch.float4_e2m1fn_x2,torch.float4_e2m1fn_x2,QuantType.per_1x32,1,0,32,0,95.4649,flydsl_moe1_afp4_wfp4_bf16_t32x32x256_w4_bnt0_fp4,0.8%,134.97,16873.32
stage1,256,16,4096,4096,32,8,ActivationType.Swiglu,torch.bfloat16,torch.float4_e2m1fn_x2,torch.float4_e2m1fn_x2,QuantType.per_1x32,1,0,32,0,128.844,flydsl_moe1_afp4_wfp4_bf16_t32x32x256_w4_bnt0_xcd4,0.0%,100.0,12502.01
stage1,256,16,4096,4096,32,8,ActivationType.Swiglu,torch.bfloat16,torch.float4_e2m1fn_x2,torch.float4_e2m1fn_x2,QuantType.per_1x32,1,0,32,0,129.069,flydsl_moe1_afp4_wfp4_bf16_t32x32x256_w4_bnt0_xcd4_fp4,0.8%,99.83,12480.22
stage1,256,16,4096,4096,32,8,ActivationType.Swiglu,torch.bfloat16,torch.float4_e2m1fn_x2,torch.float4_e2m1fn_x2,QuantType.per_1x32,1,0,32,0,90.5481,flydsl_moe1_afp4_wfp4_bf16_t32x32x256_w4,0.0%,142.3,17789.54
stage1,256,16,4096,4096,32,8,ActivationType.Swiglu,torch.bfloat16,torch.float4_e2m1fn_x2,torch.float4_e2m1fn_x2,QuantType.per_1x32,1,0,32,0,92.3744,flydsl_moe1_afp4_wfp4_bf16_t32x32x256_w4_fp4,0.8%,139.49,17437.83
stage1,256,16,4096,4096,32,8,ActivationType.Swiglu,torch.bfloat16,torch.float4_e2m1fn_x2,torch.float4_e2m1fn_x2,QuantType.per_1x32,1,0,32,0,120.0441,flydsl_moe1_afp4_wfp4_bf16_t32x32x256_w4_xcd4,0.0%,107.33,13418.48
stage1,256,16,4096,4096,32,8,ActivationType.Swiglu,torch.bfloat16,torch.float4_e2m1fn_x2,torch.float4_e2m1fn_x2,QuantType.per_1x32,1,0,32,0,120.4837,flydsl_moe1_afp4_wfp4_bf16_t32x32x256_w4_xcd4_fp4,0.8%,106.94,13369.52
stage1,256,16,4096,4096,32,8,ActivationType.Swiglu,torch.bfloat16,torch.float4_e2m1fn_x2,torch.float4_e2m1fn_x2,QuantType.per_1x32,1,0,32,0,116.4804,flydsl_moe1_afp4_wfp4_bf16_t32x64x256_bnt0,0.0%,110.62,13829.02
stage1,256,16,4096,4096,32,8,ActivationType.Swiglu,torch.bfloat16,torch.float4_e2m1fn_x2,torch.float4_e2m1fn_x2,QuantType.per_1x32,1,0,32,0,118.5793,flydsl_moe1_afp4_wfp4_bf16_t32x64x256_bnt0_fp4,0.8%,108.66,13584.24
stage1,256,16,4096,4096,32,8,ActivationType.Swiglu,torch.bfloat16,torch.float4_e2m1fn_x2,torch.float4_e2m1fn_x2,QuantType.per_1x32,1,0,32,0,142.6509,flydsl_moe1_afp4_wfp4_bf16_t32x64x256_bnt0_xcd4,0.0%,90.32,11291.97
stage1,256,16,4096,4096,32,8,ActivationType.Swiglu,torch.bfloat16,torch.float4_e2m1fn_x2,torch.float4_e2m1fn_x2,QuantType.per_1x32,1,0,32,0,145.8432,flydsl_moe1_afp4_wfp4_bf16_t32x64x256_bnt0_xcd4_fp4,0.8%,88.35,11044.8
stage1,256,16,4096,4096,32,8,ActivationType.Swiglu,torch.bfloat16,torch.float4_e2m1fn_x2,torch.float4_e2m1fn_x2,QuantType.per_1x32,1,0,32,0,113.2417,flydsl_moe1_afp4_wfp4_bf16_t32x64x256,0.0%,113.78,14224.52
stage1,256,16,4096,4096,32,8,ActivationType.Swiglu,torch.bfloat16,torch.float4_e2m1fn_x2,torch.float4_e2m1fn_x2,QuantType.per_1x32,1,0,32,0,115.4445,flydsl_moe1_afp4_wfp4_bf16_t32x64x256_fp4,0.8%,111.61,13953.11
stage1,256,16,4096,4096,32,8,ActivationType.Swiglu,torch.bfloat16,torch.float4_e2m1fn_x2,torch.float4_e2m1fn_x2,QuantType.per_1x32,1,0,32,0,135.4557,flydsl_moe1_afp4_wfp4_bf16_t32x64x256_xcd4,0.0%,95.12,11891.78
stage1,256,16,4096,4096,32,8,ActivationType.Swiglu,torch.bfloat16,torch.float4_e2m1fn_x2,torch.float4_e2m1fn_x2,QuantType.per_1x32,1,0,32,0,138.9548,flydsl_moe1_afp4_wfp4_bf16_t32x64x256_xcd4_fp4,0.8%,92.73,11592.33
stage1,256,16,4096,4096,32,8,ActivationType.Swiglu,torch.bfloat16,torch.float4_e2m1fn_x2,torch.float4_e2m1fn_x2,QuantType.per_1x32,1,0,32,0,95.841,flydsl_moe1_afp4_wfp4_bf16_t32x64x256_w2_bnt0,0.0%,134.44,16807.1
stage1,256,16,4096,4096,32,8,ActivationType.Swiglu,torch.bfloat16,torch.float4_e2m1fn_x2,torch.float4_e2m1fn_x2,QuantType.per_1x32,1,0,32,0,97.4144,flydsl_moe1_afp4_wfp4_bf16_t32x64x256_w2_bnt0_fp4,0.8%,132.27,16535.64
stage1,256,16,4096,4096,32,8,ActivationType.Swiglu,torch.bfloat16,torch.float4_e2m1fn_x2,torch.float4_e2m1fn_x2,QuantType.per_1x32,1,0,32,0,125.912,flydsl_moe1_afp4_wfp4_bf16_t32x64x256_w2_bnt0_xcd4,0.0%,102.33,12793.14
stage1,256,16,4096,4096,32,8,ActivationType.Swiglu,torch.bfloat16,torch.float4_e2m1fn_x2,torch.float4_e2m1fn_x2,QuantType.per_1x32,1,0,32,0,127.0065,flydsl_moe1_afp4_wfp4_bf16_t32x64x256_w2_bnt0_xcd4_fp4,0.8%,101.45,12682.89
stage1,256,16,4096,4096,32,8,ActivationType.Swiglu,torch.bfloat16,torch.float4_e2m1fn_x2,torch.float4_e2m1fn_x2,QuantType.per_1x32,1,0,32,0,92.1164,flydsl_moe1_afp4_wfp4_bf16_t32x64x256_w2,0.0%,139.88,17486.67
stage1,256,16,4096,4096,32,8,ActivationType.Swiglu,torch.bfloat16,torch.float4_e2m1fn_x2,torch.float4_e2m1fn_x2,QuantType.per_1x32,1,0,32,0,93.6878,flydsl_moe1_afp4_wfp4_bf16_t32x64x256_w2_fp4,0.8%,137.53,17193.37
stage1,256,16,4096,4096,32,8,ActivationType.Swiglu,torch.bfloat16,torch.float4_e2m1fn_x2,torch.float4_e2m1fn_x2,QuantType.per_1x32,1,0,32,0,117.7599,flydsl_moe1_afp4_wfp4_bf16_t32x64x256_w2_xcd4,0.0%,109.42,13678.76
stage1,256,16,4096,4096,32,8,ActivationType.Swiglu,torch.bfloat16,torch.float4_e2m1fn_x2,torch.float4_e2m1fn_x2,QuantType.per_1x32,1,0,32,0,119.2699,flydsl_moe1_afp4_wfp4_bf16_t32x64x256_w2_xcd4_fp4,0.8%,108.03,13505.58
