aiter/configs/profile_fmoe.csv
stage,cu_num,token,model_dim,inter_dim,expert,topk,act_type,dtype,q_dtype_a,q_dtype_w,q_type,use_g1u1,doweight_stage1,block_m,ksplit,us,kernelName,err,tflops,bw
stage1,256,1,7168,256,384,8,ActivationType.Silu,torch.bfloat16,torch.float4_e2m1fn_x2,torch.float4_e2m1fn_x2,QuantType.per_1x32,1,0,32,0,25.5851,moe_ck2stages_gemm1_256x32x128x128_1x4_MulABScaleShuffled_v3_Nswizzle0_Quant3_MulRoutedWeight0_silu_FP4X2_FP4X2_B16,0.0%,3.44,82624.29
stage1,256,1,7168,256,384,8,ActivationType.Silu,torch.bfloat16,torch.float4_e2m1fn_x2,torch.float4_e2m1fn_x2,QuantType.per_1x32,1,0,32,0,22.0535,moe_ck2stages_gemm1_64x32x32x128_1x1_MulABScaleShuffled_v3_Nswizzle0_Quant3_MulRoutedWeight0_silu_FP4X2_FP4X2_B16,0.0%,3.99,95855.57
stage2,256,1,7168,256,384,8,ActivationType.Silu,torch.bfloat16,torch.float4_e2m1fn_x2,torch.float4_e2m1fn_x2,QuantType.per_1x32,1,0,32,0,6.6869,moe_ck2stages_gemm2_256x32x128x128_1x4_MulABScaleExpertWeightShuffled_v3_Nswizzle0_Quant3_MulRoutedWeight1_FP4X2_FP4X2_B16,1.5%,13.17,316133.14
stage2,256,1,7168,256,384,8,ActivationType.Silu,torch.bfloat16,torch.float4_e2m1fn_x2,torch.float4_e2m1fn_x2,QuantType.per_1x32,1,0,32,0,7.7161,moe_ck2stages_gemm2_64x32x32x128_1x1_MulABScaleExpertWeightShuffled_v1_Nswizzle0_Quant3_MulRoutedWeight1_FP4X2_FP4X2_B16,1.5%,11.42,273966.22
stage1,256,1,7168,256,384,8,ActivationType.Silu,torch.bfloat16,torch.float4_e2m1fn_x2,torch.float4_e2m1fn_x2,QuantType.per_1x32,1,0,64,0,29.0841,moe_ck2stages_gemm1_256x64x128x128_1x4_MulABScaleShuffled_v3_Nswizzle0_Quant3_MulRoutedWeight0_silu_FP4X2_FP4X2_B16,0.0%,3.03,72684.07
stage2,256,1,7168,256,384,8,ActivationType.Silu,torch.bfloat16,torch.float4_e2m1fn_x2,torch.float4_e2m1fn_x2,QuantType.per_1x32,1,0,64,0,8.3992,moe_ck2stages_gemm2_256x64x128x128_1x4_MulABScaleExpertWeightShuffled_v3_Nswizzle0_Quant3_MulRoutedWeight1_FP4X2_FP4X2_B16,1.3%,10.49,251684.77
stage2,256,1,7168,256,384,8,ActivationType.Silu,torch.bfloat16,torch.float4_e2m1fn_x2,torch.float4_e2m1fn_x2,QuantType.per_1x32,1,0,64,0,10.5519,moe_ck2stages_gemm2_64x64x128x128_1x1_MulABScaleExpertWeightShuffled_v3_Nswizzle0_Quant3_MulRoutedWeight1_FP4X2_FP4X2_B16,1.4%,8.35,200338.4
stage1,256,1,7168,256,384,8,ActivationType.Silu,torch.bfloat16,torch.float4_e2m1fn_x2,torch.float4_e2m1fn_x2,QuantType.per_1x32,1,0,128,0,39.0568,moe_ck2stages_gemm1_256x128x128x128_1x4_MulABScaleShuffled_v3_Nswizzle0_Quant3_MulRoutedWeight0_silu_FP4X2_FP4X2_B16,0.0%,2.26,54125.04
stage2,256,1,7168,256,384,8,ActivationType.Silu,torch.bfloat16,torch.float4_e2m1fn_x2,torch.float4_e2m1fn_x2,QuantType.per_1x32,1,0,128,0,8.9879,moe_ck2stages_gemm2_256x128x128x128_1x4_MulABScaleExpertWeightShuffled_v3_Nswizzle0_Quant3_MulRoutedWeight1_FP4X2_FP4X2_B16,1.3%,9.8,235199.63
stage2,256,1,7168,256,384,8,ActivationType.Silu,torch.bfloat16,torch.float4_e2m1fn_x2,torch.float4_e2m1fn_x2,QuantType.per_1x32,1,0,128,0,16.1909,moe_ck2stages_gemm2_64x128x128x128_1x1_MulABScaleExpertWeightShuffled_v3_Nswizzle0_Quant3_MulRoutedWeight1_FP4X2_FP4X2_B16,1.3%,5.44,130564.13
stage1,256,1,7168,256,384,8,ActivationType.Silu,torch.bfloat16,torch.float4_e2m1fn_x2,torch.float4_e2m1fn_x2,QuantType.per_1x32,1,0,32,0,27.2498,flydsl_moe1_afp4_wfp4_bf16_t16x32x256_bnt0,0.0%,3.23,77576.74
stage1,256,1,7168,256,384,8,ActivationType.Silu,torch.bfloat16,torch.float4_e2m1fn_x2,torch.float4_e2m1fn_x2,QuantType.per_1x32,1,0,32,0,27.6986,flydsl_moe1_afp4_wfp4_bf16_t16x32x256,0.0%,3.18,76319.77
stage1,256,1,7168,256,384,8,ActivationType.Silu,torch.bfloat16,torch.float4_e2m1fn_x2,torch.float4_e2m1fn_x2,QuantType.per_1x32,1,0,32,0,23.374,flydsl_moe1_afp4_wfp4_bf16_t16x32x256_kb2_bnt0,0.0%,3.77,90440.26
stage1,256,1,7168,256,384,8,ActivationType.Silu,torch.bfloat16,torch.float4_e2m1fn_x2,torch.float4_e2m1fn_x2,QuantType.per_1x32,1,0,32,0,18.1163,flydsl_moe1_afp4_wfp4_bf16_t16x32x256_kb2_bnt0_go,0.0%,4.86,116687.77
stage1,256,1,7168,256,384,8,ActivationType.Silu,torch.bfloat16,torch.float4_e2m1fn_x2,torch.float4_e2m1fn_x2,QuantType.per_1x32,1,0,32,0,23.3208,flydsl_moe1_afp4_wfp4_bf16_t16x32x256_kb2,0.0%,3.78,90646.58
stage1,256,1,7168,256,384,8,ActivationType.Silu,torch.bfloat16,torch.float4_e2m1fn_x2,torch.float4_e2m1fn_x2,QuantType.per_1x32,1,0,32,0,19.5389,flydsl_moe1_afp4_wfp4_bf16_t16x32x256_kb2_go,0.0%,4.51,108191.9
stage1,256,1,7168,256,384,8,ActivationType.Silu,torch.bfloat16,torch.float4_e2m1fn_x2,torch.float4_e2m1fn_x2,QuantType.per_1x32,1,0,32,0,14.3175,flydsl_moe1_afp4_wfp4_bf16_t16x32x256_kb4_bnt0,0.1%,6.15,147648.03
stage1,256,1,7168,256,384,8,ActivationType.Silu,torch.bfloat16,torch.float4_e2m1fn_x2,torch.float4_e2m1fn_x2,QuantType.per_1x32,1,0,32,0,19.1479,flydsl_moe1_afp4_wfp4_bf16_t16x32x256_kb4_bnt0_go,0.0%,4.6,110401.18
stage1,256,1,7168,256,384,8,ActivationType.Silu,torch.bfloat16,torch.float4_e2m1fn_x2,torch.float4_e2m1fn_x2,QuantType.per_1x32,1,0,32,0,15.73,flydsl_moe1_afp4_wfp4_bf16_t16x32x256_kb4,0.0%,5.6,134389.75
stage1,256,1,7168,256,384,8,ActivationType.Silu,torch.bfloat16,torch.float4_e2m1fn_x2,torch.float4_e2m1fn_x2,QuantType.per_1x32,1,0,32,0,19.5576,flydsl_moe1_afp4_wfp4_bf16_t16x32x256_kb4_go,0.0%,4.5,108088.45
stage1,256,1,7168,256,384,8,ActivationType.Silu,torch.bfloat16,torch.float4_e2m1fn_x2,torch.float4_e2m1fn_x2,QuantType.per_1x32,1,0,32,0,15.785,flydsl_moe1_afp4_wfp4_bf16_t16x32x256_kb7_bnt0,0.0%,5.58,133921.49
stage1,256,1,7168,256,384,8,ActivationType.Silu,torch.bfloat16,torch.float4_e2m1fn_x2,torch.float4_e2m1fn_x2,QuantType.per_1x32,1,0,32,0,21.2238,flydsl_moe1_afp4_wfp4_bf16_t16x32x256_kb7_bnt0_go,0.0%,4.15,99602.84
stage1,256,1,7168,256,384,8,ActivationType.Silu,torch.bfloat16,torch.float4_e2m1fn_x2,torch.float4_e2m1fn_x2,QuantType.per_1x32,1,0,32,0,17.2888,flydsl_moe1_afp4_wfp4_bf16_t16x32x256_kb7,0.0%,5.09,122272.84
stage1,256,1,7168,256,384,8,ActivationType.Silu,torch.bfloat16,torch.float4_e2m1fn_x2,torch.float4_e2m1fn_x2,QuantType.per_1x32,1,0,32,0,19.6724,flydsl_moe1_afp4_wfp4_bf16_t16x32x256_kb7_go,0.0%,4.48,107457.69
stage1,256,1,7168,256,384,8,ActivationType.Silu,torch.bfloat16,torch.float4_e2m1fn_x2,torch.float4_e2m1fn_x2,QuantType.per_1x32,1,0,32,0,27.0882,flydsl_moe1_afp4_wfp4_bf16_t16x32x256_w2_bnt0,0.0%,3.25,78039.54
stage1,256,1,7168,256,384,8,ActivationType.Silu,torch.bfloat16,torch.float4_e2m1fn_x2,torch.float4_e2m1fn_x2,QuantType.per_1x32,1,0,32,0,26.929,flydsl_moe1_afp4_wfp4_bf16_t16x32x256_w2,0.0%,3.27,78500.9
stage1,256,1,7168,256,384,8,ActivationType.Silu,torch.bfloat16,torch.float4_e2m1fn_x2,torch.float4_e2m1fn_x2,QuantType.per_1x32,1,0,32,0,24.2006,flydsl_moe1_afp4_wfp4_bf16_t16x32x256_w2_kb2_bnt0,0.0%,3.64,87351.17
stage1,256,1,7168,256,384,8,ActivationType.Silu,torch.bfloat16,torch.float4_e2m1fn_x2,torch.float4_e2m1fn_x2,QuantType.per_1x32,1,0,32,0,19.2646,flydsl_moe1_afp4_wfp4_bf16_t16x32x256_w2_kb2_bnt0_go,0.0%,4.57,109732.4
stage1,256,1,7168,256,384,8,ActivationType.Silu,torch.bfloat16,torch.float4_e2m1fn_x2,torch.float4_e2m1fn_x2,QuantType.per_1x32,1,0,32,0,21.6655,flydsl_moe1_afp4_wfp4_bf16_t16x32x256_w2_kb2,0.0%,4.07,97572.21
stage1,256,1,7168,256,384,8,ActivationType.Silu,torch.bfloat16,torch.float4_e2m1fn_x2,torch.float4_e2m1fn_x2,QuantType.per_1x32,1,0,32,0,18.1578,flydsl_moe1_afp4_wfp4_bf16_t16x32x256_w2_kb2_go,0.0%,4.85,116421.08
stage1,256,1,7168,256,384,8,ActivationType.Silu,torch.bfloat16,torch.float4_e2m1fn_x2,torch.float4_e2m1fn_x2,QuantType.per_1x32,1,0,32,0,15.6925,flydsl_moe1_afp4_wfp4_bf16_t16x32x256_w2_kb4_bnt0,0.0%,5.61,134710.9
stage1,256,1,7168,256,384,8,ActivationType.Silu,torch.bfloat16,torch.float4_e2m1fn_x2,torch.float4_e2m1fn_x2,QuantType.per_1x32,1,0,32,0,14.6884,flydsl_moe1_afp4_wfp4_bf16_t16x32x256_w2_kb4_bnt0_go,0.1%,6.0,143919.74
stage1,256,1,7168,256,384,8,ActivationType.Silu,torch.bfloat16,torch.float4_e2m1fn_x2,torch.float4_e2m1fn_x2,QuantType.per_1x32,1,0,32,0,14.2707,flydsl_moe1_afp4_wfp4_bf16_t16x32x256_w2_kb4,0.0%,6.17,148132.24
stage1,256,1,7168,256,384,8,ActivationType.Silu,torch.bfloat16,torch.float4_e2m1fn_x2,torch.float4_e2m1fn_x2,QuantType.per_1x32,1,0,32,0,13.3489,flydsl_moe1_afp4_wfp4_bf16_t16x32x256_w2_kb4_go,0.0%,6.6,158361.42
stage1,256,1,7168,256,384,8,ActivationType.Silu,torch.bfloat16,torch.float4_e2m1fn_x2,torch.float4_e2m1fn_x2,QuantType.per_1x32,1,0,32,0,13.5716,flydsl_moe1_afp4_wfp4_bf16_t16x32x256_w2_kb7_bnt0,0.0%,6.49,155762.82
stage1,256,1,7168,256,384,8,ActivationType.Silu,torch.bfloat16,torch.float4_e2m1fn_x2,torch.float4_e2m1fn_x2,QuantType.per_1x32,1,0,32,0,15.5418,flydsl_moe1_afp4_wfp4_bf16_t16x32x256_w2_kb7_bnt0_go,0.0%,5.67,136017.11
stage1,256,1,7168,256,384,8,ActivationType.Silu,torch.bfloat16,torch.float4_e2m1fn_x2,torch.float4_e2m1fn_x2,QuantType.per_1x32,1,0,32,0,12.073,flydsl_moe1_afp4_wfp4_bf16_t16x32x256_w2_kb7,0.0%,7.3,175097.38
stage1,256,1,7168,256,384,8,ActivationType.Silu,torch.bfloat16,torch.float4_e2m1fn_x2,torch.float4_e2m1fn_x2,QuantType.per_1x32,1,0,32,0,14.4879,flydsl_moe1_afp4_wfp4_bf16_t16x32x256_w2_kb7_go,0.0%,6.08,145911.47
stage1,256,1,7168,256,384,8,ActivationType.Silu,torch.bfloat16,torch.float4_e2m1fn_x2,torch.float4_e2m1fn_x2,QuantType.per_1x32,1,0,32,0,27.5678,flydsl_moe1_afp4_wfp4_bf16_t16x32x256_w3_bnt0,0.0%,3.2,76681.88
stage1,256,1,7168,256,384,8,ActivationType.Silu,torch.bfloat16,torch.float4_e2m1fn_x2,torch.float4_e2m1fn_x2,QuantType.per_1x32,1,0,32,0,27.4209,flydsl_moe1_afp4_wfp4_bf16_t16x32x256_w3,0.0%,3.21,77092.68
stage1,256,1,7168,256,384,8,ActivationType.Silu,torch.bfloat16,torch.float4_e2m1fn_x2,torch.float4_e2m1fn_x2,QuantType.per_1x32,1,0,32,0,21.0259,flydsl_moe1_afp4_wfp4_bf16_t16x32x256_w3_kb2_bnt0,0.0%,4.19,100540.32
stage1,256,1,7168,256,384,8,ActivationType.Silu,torch.bfloat16,torch.float4_e2m1fn_x2,torch.float4_e2m1fn_x2,QuantType.per_1x32,1,0,32,0,18.2531,flydsl_moe1_afp4_wfp4_bf16_t16x32x256_w3_kb2_bnt0_go,0.0%,4.83,115813.24
stage1,256,1,7168,256,384,8,ActivationType.Silu,torch.bfloat16,torch.float4_e2m1fn_x2,torch.float4_e2m1fn_x2,QuantType.per_1x32,1,0,32,0,23.1977,flydsl_moe1_afp4_wfp4_bf16_t16x32x256_w3_kb2,0.0%,3.8,91127.6
stage1,256,1,7168,256,384,8,ActivationType.Silu,torch.bfloat16,torch.float4_e2m1fn_x2,torch.float4_e2m1fn_x2,QuantType.per_1x32,1,0,32,0,19.3841,flydsl_moe1_afp4_wfp4_bf16_t16x32x256_w3_kb2_go,0.0%,4.54,109055.91
stage1,256,1,7168,256,384,8,ActivationType.Silu,torch.bfloat16,torch.float4_e2m1fn_x2,torch.float4_e2m1fn_x2,QuantType.per_1x32,1,0,32,0,14.2727,flydsl_moe1_afp4_wfp4_bf16_t16x32x256_w3_kb4_bnt0,0.0%,6.17,148111.48
stage1,256,1,7168,256,384,8,ActivationType.Silu,torch.bfloat16,torch.float4_e2m1fn_x2,torch.float4_e2m1fn_x2,QuantType.per_1x32,1,0,32,0,13.3643,flydsl_moe1_afp4_wfp4_bf16_t16x32x256_w3_kb4_bnt0_go,0.0%,6.59,158178.93
stage1,256,1,7168,256,384,8,ActivationType.Silu,torch.bfloat16,torch.float4_e2m1fn_x2,torch.float4_e2m1fn_x2,QuantType.per_1x32,1,0,32,0,15.6002,flydsl_moe1_afp4_wfp4_bf16_t16x32x256_w3_kb4,0.0%,5.65,135507.92
stage1,256,1,7168,256,384,8,ActivationType.Silu,torch.bfloat16,torch.float4_e2m1fn_x2,torch.float4_e2m1fn_x2,QuantType.per_1x32,1,0,32,0,14.7159,flydsl_moe1_afp4_wfp4_bf16_t16x32x256_w3_kb4_go,0.0%,5.99,143650.79
stage1,256,1,7168,256,384,8,ActivationType.Silu,torch.bfloat16,torch.float4_e2m1fn_x2,torch.float4_e2m1fn_x2,QuantType.per_1x32,1,0,32,0,11.9221,flydsl_moe1_afp4_wfp4_bf16_t16x32x256_w3_kb7_bnt0,0.0%,7.39,177313.62
stage1,256,1,7168,256,384,8,ActivationType.Silu,torch.bfloat16,torch.float4_e2m1fn_x2,torch.float4_e2m1fn_x2,QuantType.per_1x32,1,0,32,0,14.0659,flydsl_moe1_afp4_wfp4_bf16_t16x32x256_w3_kb7_bnt0_go,0.0%,6.26,150289.05
stage1,256,1,7168,256,384,8,ActivationType.Silu,torch.bfloat16,torch.float4_e2m1fn_x2,torch.float4_e2m1fn_x2,QuantType.per_1x32,1,0,32,0,13.4421,flydsl_moe1_afp4_wfp4_bf16_t16x32x256_w3_kb7,0.1%,6.55,157263.43
stage1,256,1,7168,256,384,8,ActivationType.Silu,torch.bfloat16,torch.float4_e2m1fn_x2,torch.float4_e2m1fn_x2,QuantType.per_1x32,1,0,32,0,15.3916,flydsl_moe1_afp4_wfp4_bf16_t16x32x256_w3_kb7_go,0.0%,5.72,137344.44
stage1,256,1,7168,256,384,8,ActivationType.Silu,torch.bfloat16,torch.float4_e2m1fn_x2,torch.float4_e2m1fn_x2,QuantType.per_1x32,1,0,32,0,27.4509,flydsl_moe1_afp4_wfp4_bf16_t16x32x256_w4_bnt0,0.0%,3.21,77008.43
stage1,256,1,7168,256,384,8,ActivationType.Silu,torch.bfloat16,torch.float4_e2m1fn_x2,torch.float4_e2m1fn_x2,QuantType.per_1x32,1,0,32,0,26.96,flydsl_moe1_afp4_wfp4_bf16_t16x32x256_w4,0.0%,3.27,78410.64
stage1,256,1,7168,256,384,8,ActivationType.Silu,torch.bfloat16,torch.float4_e2m1fn_x2,torch.float4_e2m1fn_x2,QuantType.per_1x32,1,0,32,0,21.6421,flydsl_moe1_afp4_wfp4_bf16_t16x32x256_w4_kb2_bnt0,0.0%,4.07,97677.71
stage1,256,1,7168,256,384,8,ActivationType.Silu,torch.bfloat16,torch.float4_e2m1fn_x2,torch.float4_e2m1fn_x2,QuantType.per_1x32,1,0,32,0,19.9149,flydsl_moe1_afp4_wfp4_bf16_t16x32x256_w4_kb2_bnt0_go,0.0%,4.42,106149.2
stage1,256,1,7168,256,384,8,ActivationType.Silu,torch.bfloat16,torch.float4_e2m1fn_x2,torch.float4_e2m1fn_x2,QuantType.per_1x32,1,0,32,0,22.1555,flydsl_moe1_afp4_wfp4_bf16_t16x32x256_w4_kb2,0.0%,3.98,95414.26
stage1,256,1,7168,256,384,8,ActivationType.Silu,torch.bfloat16,torch.float4_e2m1fn_x2,torch.float4_e2m1fn_x2,QuantType.per_1x32,1,0,32,0,18.1456,flydsl_moe1_afp4_wfp4_bf16_t16x32x256_w4_kb2_go,0.0%,4.85,116499.36
stage1,256,1,7168,256,384,8,ActivationType.Silu,torch.bfloat16,torch.float4_e2m1fn_x2,torch.float4_e2m1fn_x2,QuantType.per_1x32,1,0,32,0,15.6581,flydsl_moe1_afp4_wfp4_bf16_t16x32x256_w4_kb4_bnt0,0.0%,5.63,135006.85
stage1,256,1,7168,256,384,8,ActivationType.Silu,torch.bfloat16,torch.float4_e2m1fn_x2,torch.float4_e2m1fn_x2,QuantType.per_1x32,1,0,32,0,14.6555,flydsl_moe1_afp4_wfp4_bf16_t16x32x256_w4_kb4_bnt0_go,0.0%,6.01,144242.82
stage1,256,1,7168,256,384,8,ActivationType.Silu,torch.bfloat16,torch.float4_e2m1fn_x2,torch.float4_e2m1fn_x2,QuantType.per_1x32,1,0,32,0,14.2806,flydsl_moe1_afp4_wfp4_bf16_t16x32x256_w4_kb4,0.1%,6.17,148029.54
stage1,256,1,7168,256,384,8,ActivationType.Silu,torch.bfloat16,torch.float4_e2m1fn_x2,torch.float4_e2m1fn_x2,QuantType.per_1x32,1,0,32,0,13.3576,flydsl_moe1_afp4_wfp4_bf16_t16x32x256_w4_kb4_go,0.0%,6.59,158258.27
stage1,256,1,7168,256,384,8,ActivationType.Silu,torch.bfloat16,torch.float4_e2m1fn_x2,torch.float4_e2m1fn_x2,QuantType.per_1x32,1,0,32,0,13.4101,flydsl_moe1_afp4_wfp4_bf16_t16x32x256_w4_kb7_bnt0,0.0%,6.57,157638.7
stage1,256,1,7168,256,384,8,ActivationType.Silu,torch.bfloat16,torch.float4_e2m1fn_x2,torch.float4_e2m1fn_x2,QuantType.per_1x32,1,0,32,0,11.3713,flydsl_moe1_afp4_wfp4_bf16_t16x32x256_w4_kb7_bnt0_go,0.0%,7.75,185902.29
stage1,256,1,7168,256,384,8,ActivationType.Silu,torch.bfloat16,torch.float4_e2m1fn_x2,torch.float4_e2m1fn_x2,QuantType.per_1x32,1,0,32,0,13.5602,flydsl_moe1_afp4_wfp4_bf16_t16x32x256_w4_kb7,0.0%,6.5,155893.77
stage1,256,1,7168,256,384,8,ActivationType.Silu,torch.bfloat16,torch.float4_e2m1fn_x2,torch.float4_e2m1fn_x2,QuantType.per_1x32,1,0,32,0,11.5799,flydsl_moe1_afp4_wfp4_bf16_t16x32x256_w4_kb7_go,0.0%,7.61,182553.45
stage1,256,1,7168,256,384,8,ActivationType.Silu,torch.bfloat16,torch.float4_e2m1fn_x2,torch.float4_e2m1fn_x2,QuantType.per_1x32,1,0,32,0,30.0533,flydsl_moe1_afp4_wfp4_bf16_t16x64x256_bnt0,0.0%,2.93,70340.05
stage1,256,1,7168,256,384,8,ActivationType.Silu,torch.bfloat16,torch.float4_e2m1fn_x2,torch.float4_e2m1fn_x2,QuantType.per_1x32,1,0,32,0,29.7289,flydsl_moe1_afp4_wfp4_bf16_t16x64x256,0.0%,2.96,71107.6
stage1,256,1,7168,256,384,8,ActivationType.Silu,torch.bfloat16,torch.float4_e2m1fn_x2,torch.float4_e2m1fn_x2,QuantType.per_1x32,1,0,32,0,25.2772,flydsl_moe1_afp4_wfp4_bf16_t16x64x256_kb2_bnt0,0.0%,3.48,83630.73
stage1,256,1,7168,256,384,8,ActivationType.Silu,torch.bfloat16,torch.float4_e2m1fn_x2,torch.float4_e2m1fn_x2,QuantType.per_1x32,1,0,32,0,19.1582,flydsl_moe1_afp4_wfp4_bf16_t16x64x256_kb2_bnt0_go,0.0%,4.6,110341.82
stage1,256,1,7168,256,384,8,ActivationType.Silu,torch.bfloat16,torch.float4_e2m1fn_x2,torch.float4_e2m1fn_x2,QuantType.per_1x32,1,0,32,0,23.99,flydsl_moe1_afp4_wfp4_bf16_t16x64x256_kb2,0.0%,3.67,88118.0
stage1,256,1,7168,256,384,8,ActivationType.Silu,torch.bfloat16,torch.float4_e2m1fn_x2,torch.float4_e2m1fn_x2,QuantType.per_1x32,1,0,32,0,17.9253,flydsl_moe1_afp4_wfp4_bf16_t16x64x256_kb2_go,0.0%,4.91,117931.12
stage1,256,1,7168,256,384,8,ActivationType.Silu,torch.bfloat16,torch.float4_e2m1fn_x2,torch.float4_e2m1fn_x2,QuantType.per_1x32,1,0,32,0,16.0784,flydsl_moe1_afp4_wfp4_bf16_t16x64x256_kb4_bnt0,0.0%,5.48,131477.68
stage1,256,1,7168,256,384,8,ActivationType.Silu,torch.bfloat16,torch.float4_e2m1fn_x2,torch.float4_e2m1fn_x2,QuantType.per_1x32,1,0,32,0,15.0917,flydsl_moe1_afp4_wfp4_bf16_t16x64x256_kb4_bnt0_go,0.0%,5.84,140073.73
stage1,256,1,7168,256,384,8,ActivationType.Silu,torch.bfloat16,torch.float4_e2m1fn_x2,torch.float4_e2m1fn_x2,QuantType.per_1x32,1,0,32,0,14.6306,flydsl_moe1_afp4_wfp4_bf16_t16x64x256_kb4,0.0%,6.02,144488.31
stage1,256,1,7168,256,384,8,ActivationType.Silu,torch.bfloat16,torch.float4_e2m1fn_x2,torch.float4_e2m1fn_x2,QuantType.per_1x32,1,0,32,0,15.1605,flydsl_moe1_afp4_wfp4_bf16_t16x64x256_kb4_go,0.0%,5.81,139438.06
stage1,256,1,7168,256,384,8,ActivationType.Silu,torch.bfloat16,torch.float4_e2m1fn_x2,torch.float4_e2m1fn_x2,QuantType.per_1x32,1,0,32,0,11.9258,flydsl_moe1_afp4_wfp4_bf16_t16x64x256_kb7_bnt0,0.0%,7.39,177258.61
stage1,256,1,7168,256,384,8,ActivationType.Silu,torch.bfloat16,torch.float4_e2m1fn_x2,torch.float4_e2m1fn_x2,QuantType.per_1x32,1,0,32,0,15.3856,flydsl_moe1_afp4_wfp4_bf16_t16x64x256_kb7_bnt0_go,0.0%,5.72,137398.0
stage1,256,1,7168,256,384,8,ActivationType.Silu,torch.bfloat16,torch.float4_e2m1fn_x2,torch.float4_e2m1fn_x2,QuantType.per_1x32,1,0,32,0,11.94,flydsl_moe1_afp4_wfp4_bf16_t16x64x256_kb7,0.0%,7.38,177047.8
stage1,256,1,7168,256,384,8,ActivationType.Silu,torch.bfloat16,torch.float4_e2m1fn_x2,torch.float4_e2m1fn_x2,QuantType.per_1x32,1,0,32,0,13.9875,flydsl_moe1_afp4_wfp4_bf16_t16x64x256_kb7_go,0.0%,6.3,151131.42
stage1,256,1,7168,256,384,8,ActivationType.Silu,torch.bfloat16,torch.float4_e2m1fn_x2,torch.float4_e2m1fn_x2,QuantType.per_1x32,1,0,32,0,30.0733,flydsl_moe1_afp4_wfp4_bf16_t16x64x256_w2_bnt0,0.0%,2.93,70293.27
stage1,256,1,7168,256,384,8,ActivationType.Silu,torch.bfloat16,torch.float4_e2m1fn_x2,torch.float4_e2m1fn_x2,QuantType.per_1x32,1,0,32,0,30.0885,flydsl_moe1_afp4_wfp4_bf16_t16x64x256_w2,0.0%,2.93,70257.76
stage1,256,1,7168,256,384,8,ActivationType.Silu,torch.bfloat16,torch.float4_e2m1fn_x2,torch.float4_e2m1fn_x2,QuantType.per_1x32,1,0,32,0,24.3151,flydsl_moe1_afp4_wfp4_bf16_t16x64x256_w2_kb2_bnt0,0.0%,3.62,86939.83
stage1,256,1,7168,256,384,8,ActivationType.Silu,torch.bfloat16,torch.float4_e2m1fn_x2,torch.float4_e2m1fn_x2,QuantType.per_1x32,1,0,32,0,17.8049,flydsl_moe1_afp4_wfp4_bf16_t16x64x256_w2_kb2_bnt0_go,0.0%,4.95,118728.59
stage1,256,1,7168,256,384,8,ActivationType.Silu,torch.bfloat16,torch.float4_e2m1fn_x2,torch.float4_e2m1fn_x2,QuantType.per_1x32,1,0,32,0,25.3433,flydsl_moe1_afp4_wfp4_bf16_t16x64x256_w2_kb2,0.0%,3.48,83412.61
stage1,256,1,7168,256,384,8,ActivationType.Silu,torch.bfloat16,torch.float4_e2m1fn_x2,torch.float4_e2m1fn_x2,QuantType.per_1x32,1,0,32,0,19.413,flydsl_moe1_afp4_wfp4_bf16_t16x64x256_w2_kb2_go,0.0%,4.54,108893.56
stage1,256,1,7168,256,384,8,ActivationType.Silu,torch.bfloat16,torch.float4_e2m1fn_x2,torch.float4_e2m1fn_x2,QuantType.per_1x32,1,0,32,0,14.5592,flydsl_moe1_afp4_wfp4_bf16_t16x64x256_w2_kb4_bnt0,0.0%,6.05,145196.9
stage1,256,1,7168,256,384,8,ActivationType.Silu,torch.bfloat16,torch.float4_e2m1fn_x2,torch.float4_e2m1fn_x2,QuantType.per_1x32,1,0,32,0,13.7078,flydsl_moe1_afp4_wfp4_bf16_t16x64x256_w2_kb4_bnt0_go,0.0%,6.43,154215.17
stage1,256,1,7168,256,384,8,ActivationType.Silu,torch.bfloat16,torch.float4_e2m1fn_x2,torch.float4_e2m1fn_x2,QuantType.per_1x32,1,0,32,0,16.0438,flydsl_moe1_afp4_wfp4_bf16_t16x64x256_w2_kb4,0.0%,5.49,131761.22
stage1,256,1,7168,256,384,8,ActivationType.Silu,torch.bfloat16,torch.float4_e2m1fn_x2,torch.float4_e2m1fn_x2,QuantType.per_1x32,1,0,32,0,15.112,flydsl_moe1_afp4_wfp4_bf16_t16x64x256_w2_kb4_go,0.0%,5.83,139885.57
stage1,256,1,7168,256,384,8,ActivationType.Silu,torch.bfloat16,torch.float4_e2m1fn_x2,torch.float4_e2m1fn_x2,QuantType.per_1x32,1,0,32,0,11.9146,flydsl_moe1_afp4_wfp4_bf16_t16x64x256_w2_kb7_bnt0,0.1%,7.39,177425.24
stage1,256,1,7168,256,384,8,ActivationType.Silu,torch.bfloat16,torch.float4_e2m1fn_x2,torch.float4_e2m1fn_x2,QuantType.per_1x32,1,0,32,0,12.9914,flydsl_moe1_afp4_wfp4_bf16_t16x64x256_w2_kb7_bnt0_go,0.0%,6.78,162719.24
stage1,256,1,7168,256,384,8,ActivationType.Silu,torch.bfloat16,torch.float4_e2m1fn_x2,torch.float4_e2m1fn_x2,QuantType.per_1x32,1,0,32,0,11.8528,flydsl_moe1_afp4_wfp4_bf16_t16x64x256_w2_kb7,0.1%,7.43,178350.32
stage1,256,1,7168,256,384,8,ActivationType.Silu,torch.bfloat16,torch.float4_e2m1fn_x2,torch.float4_e2m1fn_x2,QuantType.per_1x32,1,0,32,0,12.7888,flydsl_moe1_afp4_wfp4_bf16_t16x64x256_w2_kb7_go,0.1%,6.89,165297.03
stage1,256,1,7168,256,384,8,ActivationType.Silu,torch.bfloat16,torch.float4_e2m1fn_x2,torch.float4_e2m1fn_x2,QuantType.per_1x32,1,0,32,0,30.6967,flydsl_moe1_afp4_wfp4_bf16_t16x64x256_w3_bnt0,0.0%,2.87,68865.73
stage1,256,1,7168,256,384,8,ActivationType.Silu,torch.bfloat16,torch.float4_e2m1fn_x2,torch.float4_e2m1fn_x2,QuantType.per_1x32,1,0,32,0,31.1661,flydsl_moe1_afp4_wfp4_bf16_t16x64x256_w3,0.0%,2.83,67828.53
stage1,256,1,7168,256,384,8,ActivationType.Silu,torch.bfloat16,torch.float4_e2m1fn_x2,torch.float4_e2m1fn_x2,QuantType.per_1x32,1,0,32,0,23.7816,flydsl_moe1_afp4_wfp4_bf16_t16x64x256_w3_kb2_bnt0,0.0%,3.7,88890.18
stage1,256,1,7168,256,384,8,ActivationType.Silu,torch.bfloat16,torch.float4_e2m1fn_x2,torch.float4_e2m1fn_x2,QuantType.per_1x32,1,0,32,0,19.5463,flydsl_moe1_afp4_wfp4_bf16_t16x64x256_w3_kb2_bnt0_go,0.0%,4.51,108150.94
stage1,256,1,7168,256,384,8,ActivationType.Silu,torch.bfloat16,torch.float4_e2m1fn_x2,torch.float4_e2m1fn_x2,QuantType.per_1x32,1,0,32,0,24.2268,flydsl_moe1_afp4_wfp4_bf16_t16x64x256_w3_kb2,0.0%,3.64,87256.7
stage1,256,1,7168,256,384,8,ActivationType.Silu,torch.bfloat16,torch.float4_e2m1fn_x2,torch.float4_e2m1fn_x2,QuantType.per_1x32,1,0,32,0,19.6908,flydsl_moe1_afp4_wfp4_bf16_t16x64x256_w3_kb2_go,0.0%,4.47,107357.28
stage1,256,1,7168,256,384,8,ActivationType.Silu,torch.bfloat16,torch.float4_e2m1fn_x2,torch.float4_e2m1fn_x2,QuantType.per_1x32,1,0,32,0,14.7184,flydsl_moe1_afp4_wfp4_bf16_t16x64x256_w3_kb4_bnt0,0.0%,5.98,143626.39
stage1,256,1,7168,256,384,8,ActivationType.Silu,torch.bfloat16,torch.float4_e2m1fn_x2,torch.float4_e2m1fn_x2,QuantType.per_1x32,1,0,32,0,14.9093,flydsl_moe1_afp4_wfp4_bf16_t16x64x256_w3_kb4_bnt0_go,0.0%,5.91,141787.39
stage1,256,1,7168,256,384,8,ActivationType.Silu,torch.bfloat16,torch.float4_e2m1fn_x2,torch.float4_e2m1fn_x2,QuantType.per_1x32,1,0,32,0,14.6576,flydsl_moe1_afp4_wfp4_bf16_t16x64x256_w3_kb4,0.0%,6.01,144222.16
stage1,256,1,7168,256,384,8,ActivationType.Silu,torch.bfloat16,torch.float4_e2m1fn_x2,torch.float4_e2m1fn_x2,QuantType.per_1x32,1,0,32,0,13.5061,flydsl_moe1_afp4_wfp4_bf16_t16x64x256_w3_kb4_go,0.1%,6.52,156518.22
stage1,256,1,7168,256,384,8,ActivationType.Silu,torch.bfloat16,torch.float4_e2m1fn_x2,torch.float4_e2m1fn_x2,QuantType.per_1x32,1,0,32,0,13.2754,flydsl_moe1_afp4_wfp4_bf16_t16x64x256_w3_kb7_bnt0,0.1%,6.63,159238.19
stage1,256,1,7168,256,384,8,ActivationType.Silu,torch.bfloat16,torch.float4_e2m1fn_x2,torch.float4_e2m1fn_x2,QuantType.per_1x32,1,0,32,0,12.7692,flydsl_moe1_afp4_wfp4_bf16_t16x64x256_w3_kb7_bnt0_go,0.0%,6.9,165550.76
stage1,256,1,7168,256,384,8,ActivationType.Silu,torch.bfloat16,torch.float4_e2m1fn_x2,torch.float4_e2m1fn_x2,QuantType.per_1x32,1,0,32,0,11.8388,flydsl_moe1_afp4_wfp4_bf16_t16x64x256_w3_kb7,0.1%,7.44,178561.23
stage1,256,1,7168,256,384,8,ActivationType.Silu,torch.bfloat16,torch.float4_e2m1fn_x2,torch.float4_e2m1fn_x2,QuantType.per_1x32,1,0,32,0,12.7233,flydsl_moe1_afp4_wfp4_bf16_t16x64x256_w3_kb7_go,0.0%,6.92,166147.99
stage1,256,1,7168,256,384,8,ActivationType.Silu,torch.bfloat16,torch.float4_e2m1fn_x2,torch.float4_e2m1fn_x2,QuantType.per_1x32,1,0,32,0,29.6381,flydsl_moe1_afp4_wfp4_bf16_t16x64x256_w4_bnt0,0.0%,2.97,71325.45
stage1,256,1,7168,256,384,8,ActivationType.Silu,torch.bfloat16,torch.float4_e2m1fn_x2,torch.float4_e2m1fn_x2,QuantType.per_1x32,1,0,32,0,29.9729,flydsl_moe1_afp4_wfp4_bf16_t16x64x256_w4,0.0%,2.94,70528.73
stage1,256,1,7168,256,384,8,ActivationType.Silu,torch.bfloat16,torch.float4_e2m1fn_x2,torch.float4_e2m1fn_x2,QuantType.per_1x32,1,0,32,0,24.1477,flydsl_moe1_afp4_wfp4_bf16_t16x64x256_w4_kb2_bnt0,0.0%,3.65,87542.53
stage1,256,1,7168,256,384,8,ActivationType.Silu,torch.bfloat16,torch.float4_e2m1fn_x2,torch.float4_e2m1fn_x2,QuantType.per_1x32,1,0,32,0,19.4936,flydsl_moe1_afp4_wfp4_bf16_t16x64x256_w4_kb2_bnt0_go,0.0%,4.52,108443.32
stage1,256,1,7168,256,384,8,ActivationType.Silu,torch.bfloat16,torch.float4_e2m1fn_x2,torch.float4_e2m1fn_x2,QuantType.per_1x32,1,0,32,0,23.8019,flydsl_moe1_afp4_wfp4_bf16_t16x64x256_w4_kb2,0.0%,3.7,88814.37
stage1,256,1,7168,256,384,8,ActivationType.Silu,torch.bfloat16,torch.float4_e2m1fn_x2,torch.float4_e2m1fn_x2,QuantType.per_1x32,1,0,32,0,19.3084,flydsl_moe1_afp4_wfp4_bf16_t16x64x256_w4_kb2_go,0.0%,4.56,109483.47
stage1,256,1,7168,256,384,8,ActivationType.Silu,torch.bfloat16,torch.float4_e2m1fn_x2,torch.float4_e2m1fn_x2,QuantType.per_1x32,1,0,32,0,14.6135,flydsl_moe1_afp4_wfp4_bf16_t16x64x256_w4_kb4_bnt0,0.0%,6.03,144657.39
stage1,256,1,7168,256,384,8,ActivationType.Silu,torch.bfloat16,torch.float4_e2m1fn_x2,torch.float4_e2m1fn_x2,QuantType.per_1x32,1,0,32,0,14.9251,flydsl_moe1_afp4_wfp4_bf16_t16x64x256_w4_kb4_bnt0_go,0.0%,5.9,141637.29
stage1,256,1,7168,256,384,8,ActivationType.Silu,torch.bfloat16,torch.float4_e2m1fn_x2,torch.float4_e2m1fn_x2,QuantType.per_1x32,1,0,32,0,14.536,flydsl_moe1_afp4_wfp4_bf16_t16x64x256_w4_kb4,0.0%,6.06,145428.64
stage1,256,1,7168,256,384,8,ActivationType.Silu,torch.bfloat16,torch.float4_e2m1fn_x2,torch.float4_e2m1fn_x2,QuantType.per_1x32,1,0,32,0,14.9309,flydsl_moe1_afp4_wfp4_bf16_t16x64x256_w4_kb4_go,0.0%,5.9,141582.27
stage1,256,1,7168,256,384,8,ActivationType.Silu,torch.bfloat16,torch.float4_e2m1fn_x2,torch.float4_e2m1fn_x2,QuantType.per_1x32,1,0,32,0,11.8702,flydsl_moe1_afp4_wfp4_bf16_t16x64x256_w4_kb7_bnt0,0.0%,7.42,178088.89
stage1,256,1,7168,256,384,8,ActivationType.Silu,torch.bfloat16,torch.float4_e2m1fn_x2,torch.float4_e2m1fn_x2,QuantType.per_1x32,1,0,32,0,11.3257,flydsl_moe1_afp4_wfp4_bf16_t16x64x256_w4_kb7_bnt0_go,0.1%,7.78,186650.78
stage1,256,1,7168,256,384,8,ActivationType.Silu,torch.bfloat16,torch.float4_e2m1fn_x2,torch.float4_e2m1fn_x2,QuantType.per_1x32,1,0,32,0,13.3348,flydsl_moe1_afp4_wfp4_bf16_t16x64x256_w4_kb7,0.0%,6.61,158528.87
stage1,256,1,7168,256,384,8,ActivationType.Silu,torch.bfloat16,torch.float4_e2m1fn_x2,torch.float4_e2m1fn_x2,QuantType.per_1x32,1,0,32,0,12.7899,flydsl_moe1_afp4_wfp4_bf16_t16x64x256_w4_kb7_go,0.1%,6.89,165282.82
stage1,256,1,7168,256,384,8,ActivationType.Silu,torch.bfloat16,torch.float4_e2m1fn_x2,torch.float4_e2m1fn_x2,QuantType.per_1x32,1,0,32,0,34.6817,flydsl_moe1_afp4_wfp4_bf16_t16x128x256_bnt0,0.0%,2.54,60952.92
stage1,256,1,7168,256,384,8,ActivationType.Silu,torch.bfloat16,torch.float4_e2m1fn_x2,torch.float4_e2m1fn_x2,QuantType.per_1x32,1,0,32,0,34.6509,flydsl_moe1_afp4_wfp4_bf16_t16x128x256,0.0%,2.54,61007.09
stage1,256,1,7168,256,384,8,ActivationType.Silu,torch.bfloat16,torch.float4_e2m1fn_x2,torch.float4_e2m1fn_x2,QuantType.per_1x32,1,0,32,0,26.5874,flydsl_moe1_afp4_wfp4_bf16_t16x128x256_kb2_bnt0,0.0%,3.31,79509.49
stage1,256,1,7168,256,384,8,ActivationType.Silu,torch.bfloat16,torch.float4_e2m1fn_x2,torch.float4_e2m1fn_x2,QuantType.per_1x32,1,0,32,0,25.1103,flydsl_moe1_afp4_wfp4_bf16_t16x128x256_kb2_bnt0_go,0.0%,3.51,84186.6
stage1,256,1,7168,256,384,8,ActivationType.Silu,torch.bfloat16,torch.float4_e2m1fn_x2,torch.float4_e2m1fn_x2,QuantType.per_1x32,1,0,32,0,25.8082,flydsl_moe1_afp4_wfp4_bf16_t16x128x256_kb2,0.0%,3.41,81910.04
stage1,256,1,7168,256,384,8,ActivationType.Silu,torch.bfloat16,torch.float4_e2m1fn_x2,torch.float4_e2m1fn_x2,QuantType.per_1x32,1,0,32,0,23.9353,flydsl_moe1_afp4_wfp4_bf16_t16x128x256_kb2_go,0.0%,3.68,88319.37
stage1,256,1,7168,256,384,8,ActivationType.Silu,torch.bfloat16,torch.float4_e2m1fn_x2,torch.float4_e2m1fn_x2,QuantType.per_1x32,1,0,32,0,17.3769,flydsl_moe1_afp4_wfp4_bf16_t16x128x256_kb4_bnt0,0.1%,5.07,121652.93
stage1,256,1,7168,256,384,8,ActivationType.Silu,torch.bfloat16,torch.float4_e2m1fn_x2,torch.float4_e2m1fn_x2,QuantType.per_1x32,1,0,32,0,15.6944,flydsl_moe1_afp4_wfp4_bf16_t16x128x256_kb4_bnt0_go,0.1%,5.61,134694.59
stage1,256,1,7168,256,384,8,ActivationType.Silu,torch.bfloat16,torch.float4_e2m1fn_x2,torch.float4_e2m1fn_x2,QuantType.per_1x32,1,0,32,0,16.0132,flydsl_moe1_afp4_wfp4_bf16_t16x128x256_kb4,0.0%,5.5,132013.01
stage1,256,1,7168,256,384,8,ActivationType.Silu,torch.bfloat16,torch.float4_e2m1fn_x2,torch.float4_e2m1fn_x2,QuantType.per_1x32,1,0,32,0,15.6589,flydsl_moe1_afp4_wfp4_bf16_t16x128x256_kb4_go,0.0%,5.62,134999.95
stage1,256,1,7168,256,384,8,ActivationType.Silu,torch.bfloat16,torch.float4_e2m1fn_x2,torch.float4_e2m1fn_x2,QuantType.per_1x32,1,0,32,0,12.5816,flydsl_moe1_afp4_wfp4_bf16_t16x128x256_kb7_bnt0,0.1%,7.0,168019.23
stage1,256,1,7168,256,384,8,ActivationType.Silu,torch.bfloat16,torch.float4_e2m1fn_x2,torch.float4_e2m1fn_x2,QuantType.per_1x32,1,0,32,0,12.9467,flydsl_moe1_afp4_wfp4_bf16_t16x128x256_kb7_bnt0_go,0.0%,6.8,163281.05
stage1,256,1,7168,256,384,8,ActivationType.Silu,torch.bfloat16,torch.float4_e2m1fn_x2,torch.float4_e2m1fn_x2,QuantType.per_1x32,1,0,32,0,12.667,flydsl_moe1_afp4_wfp4_bf16_t16x128x256_kb7,0.1%,6.95,166886.45
stage1,256,1,7168,256,384,8,ActivationType.Silu,torch.bfloat16,torch.float4_e2m1fn_x2,torch.float4_e2m1fn_x2,QuantType.per_1x32,1,0,32,0,11.4209,flydsl_moe1_afp4_wfp4_bf16_t16x128x256_kb7_go,0.1%,7.71,185094.93
stage1,256,1,7168,256,384,8,ActivationType.Silu,torch.bfloat16,torch.float4_e2m1fn_x2,torch.float4_e2m1fn_x2,QuantType.per_1x32,1,0,32,0,35.1573,flydsl_moe1_afp4_wfp4_bf16_t16x128x256_w2_bnt0,0.0%,2.51,60128.36
stage1,256,1,7168,256,384,8,ActivationType.Silu,torch.bfloat16,torch.float4_e2m1fn_x2,torch.float4_e2m1fn_x2,QuantType.per_1x32,1,0,32,0,35.2685,flydsl_moe1_afp4_wfp4_bf16_t16x128x256_w2,0.0%,2.5,59938.78
stage1,256,1,7168,256,384,8,ActivationType.Silu,torch.bfloat16,torch.float4_e2m1fn_x2,torch.float4_e2m1fn_x2,QuantType.per_1x32,1,0,32,0,25.9792,flydsl_moe1_afp4_wfp4_bf16_t16x128x256_w2_kb2_bnt0,0.0%,3.39,81370.89
stage1,256,1,7168,256,384,8,ActivationType.Silu,torch.bfloat16,torch.float4_e2m1fn_x2,torch.float4_e2m1fn_x2,QuantType.per_1x32,1,0,32,0,23.986,flydsl_moe1_afp4_wfp4_bf16_t16x128x256_w2_kb2_bnt0_go,0.0%,3.67,88132.69
stage1,256,1,7168,256,384,8,ActivationType.Silu,torch.bfloat16,torch.float4_e2m1fn_x2,torch.float4_e2m1fn_x2,QuantType.per_1x32,1,0,32,0,26.6377,flydsl_moe1_afp4_wfp4_bf16_t16x128x256_w2_kb2,0.0%,3.31,79359.36
stage1,256,1,7168,256,384,8,ActivationType.Silu,torch.bfloat16,torch.float4_e2m1fn_x2,torch.float4_e2m1fn_x2,QuantType.per_1x32,1,0,32,0,23.9286,flydsl_moe1_afp4_wfp4_bf16_t16x128x256_w2_kb2_go,0.0%,3.68,88344.1
stage1,256,1,7168,256,384,8,ActivationType.Silu,torch.bfloat16,torch.float4_e2m1fn_x2,torch.float4_e2m1fn_x2,QuantType.per_1x32,1,0,32,0,17.418,flydsl_moe1_afp4_wfp4_bf16_t16x128x256_w2_kb4_bnt0,0.0%,5.06,121365.87
stage1,256,1,7168,256,384,8,ActivationType.Silu,torch.bfloat16,torch.float4_e2m1fn_x2,torch.float4_e2m1fn_x2,QuantType.per_1x32,1,0,32,0,14.2534,flydsl_moe1_afp4_wfp4_bf16_t16x128x256_w2_kb4_bnt0_go,0.0%,6.18,148312.03
stage1,256,1,7168,256,384,8,ActivationType.Silu,torch.bfloat16,torch.float4_e2m1fn_x2,torch.float4_e2m1fn_x2,QuantType.per_1x32,1,0,32,0,17.358,flydsl_moe1_afp4_wfp4_bf16_t16x128x256_w2_kb4,0.0%,5.07,121785.39
stage1,256,1,7168,256,384,8,ActivationType.Silu,torch.bfloat16,torch.float4_e2m1fn_x2,torch.float4_e2m1fn_x2,QuantType.per_1x32,1,0,32,0,15.6759,flydsl_moe1_afp4_wfp4_bf16_t16x128x256_w2_kb4_go,0.0%,5.62,134853.55
stage1,256,1,7168,256,384,8,ActivationType.Silu,torch.bfloat16,torch.float4_e2m1fn_x2,torch.float4_e2m1fn_x2,QuantType.per_1x32,1,0,32,0,13.164,flydsl_moe1_afp4_wfp4_bf16_t16x128x256_w2_kb7_bnt0,0.1%,6.69,160585.74
stage1,256,1,7168,256,384,8,ActivationType.Silu,torch.bfloat16,torch.float4_e2m1fn_x2,torch.float4_e2m1fn_x2,QuantType.per_1x32,1,0,32,0,13.0642,flydsl_moe1_afp4_wfp4_bf16_t16x128x256_w2_kb7_bnt0_go,0.1%,6.74,161812.49
stage1,256,1,7168,256,384,8,ActivationType.Silu,torch.bfloat16,torch.float4_e2m1fn_x2,torch.float4_e2m1fn_x2,QuantType.per_1x32,1,0,32,0,13.0284,flydsl_moe1_afp4_wfp4_bf16_t16x128x256_w2_kb7,0.0%,6.76,162257.12
stage1,256,1,7168,256,384,8,ActivationType.Silu,torch.bfloat16,torch.float4_e2m1fn_x2,torch.float4_e2m1fn_x2,QuantType.per_1x32,1,0,32,0,13.0748,flydsl_moe1_afp4_wfp4_bf16_t16x128x256_w2_kb7_go,0.0%,6.74,161681.3
stage1,256,1,7168,256,384,8,ActivationType.Silu,torch.bfloat16,torch.float4_e2m1fn_x2,torch.float4_e2m1fn_x2,QuantType.per_1x32,1,0,32,0,34.5497,flydsl_moe1_afp4_wfp4_bf16_t16x128x256_w3_bnt0,0.0%,2.55,61185.79
stage1,256,1,7168,256,384,8,ActivationType.Silu,torch.bfloat16,torch.float4_e2m1fn_x2,torch.float4_e2m1fn_x2,QuantType.per_1x32,1,0,32,0,35.2025,flydsl_moe1_afp4_wfp4_bf16_t16x128x256_w3,0.0%,2.5,60051.15
stage1,256,1,7168,256,384,8,ActivationType.Silu,torch.bfloat16,torch.float4_e2m1fn_x2,torch.float4_e2m1fn_x2,QuantType.per_1x32,1,0,32,0,25.9422,flydsl_moe1_afp4_wfp4_bf16_t16x128x256_w3_kb2_bnt0,0.0%,3.4,81486.95
stage1,256,1,7168,256,384,8,ActivationType.Silu,torch.bfloat16,torch.float4_e2m1fn_x2,torch.float4_e2m1fn_x2,QuantType.per_1x32,1,0,32,0,25.2011,flydsl_moe1_afp4_wfp4_bf16_t16x128x256_w3_kb2_bnt0_go,0.0%,3.5,83883.27
stage1,256,1,7168,256,384,8,ActivationType.Silu,torch.bfloat16,torch.float4_e2m1fn_x2,torch.float4_e2m1fn_x2,QuantType.per_1x32,1,0,32,0,25.8831,flydsl_moe1_afp4_wfp4_bf16_t16x128x256_w3_kb2,0.0%,3.4,81673.01
stage1,256,1,7168,256,384,8,ActivationType.Silu,torch.bfloat16,torch.float4_e2m1fn_x2,torch.float4_e2m1fn_x2,QuantType.per_1x32,1,0,32,0,23.7172,flydsl_moe1_afp4_wfp4_bf16_t16x128x256_w3_kb2_go,0.0%,3.71,89131.55
stage1,256,1,7168,256,384,8,ActivationType.Silu,torch.bfloat16,torch.float4_e2m1fn_x2,torch.float4_e2m1fn_x2,QuantType.per_1x32,1,0,32,0,17.248,flydsl_moe1_afp4_wfp4_bf16_t16x128x256_w3_kb4_bnt0,0.0%,5.11,122562.08
stage1,256,1,7168,256,384,8,ActivationType.Silu,torch.bfloat16,torch.float4_e2m1fn_x2,torch.float4_e2m1fn_x2,QuantType.per_1x32,1,0,32,0,14.3371,flydsl_moe1_afp4_wfp4_bf16_t16x128x256_w3_kb4_bnt0_go,0.0%,6.14,147446.19
stage1,256,1,7168,256,384,8,ActivationType.Silu,torch.bfloat16,torch.float4_e2m1fn_x2,torch.float4_e2m1fn_x2,QuantType.per_1x32,1,0,32,0,17.3072,flydsl_moe1_afp4_wfp4_bf16_t16x128x256_w3_kb4,0.0%,5.09,122142.85
stage1,256,1,7168,256,384,8,ActivationType.Silu,torch.bfloat16,torch.float4_e2m1fn_x2,torch.float4_e2m1fn_x2,QuantType.per_1x32,1,0,32,0,14.2378,flydsl_moe1_afp4_wfp4_bf16_t16x128x256_w3_kb4_go,0.0%,6.19,148474.53
stage1,256,1,7168,256,384,8,ActivationType.Silu,torch.bfloat16,torch.float4_e2m1fn_x2,torch.float4_e2m1fn_x2,QuantType.per_1x32,1,0,32,0,14.1008,flydsl_moe1_afp4_wfp4_bf16_t16x128x256_w3_kb7_bnt0,0.0%,6.25,149917.08
stage1,256,1,7168,256,384,8,ActivationType.Silu,torch.bfloat16,torch.float4_e2m1fn_x2,torch.float4_e2m1fn_x2,QuantType.per_1x32,1,0,32,0,12.9797,flydsl_moe1_afp4_wfp4_bf16_t16x128x256_w3_kb7_bnt0_go,0.1%,6.79,162865.92
stage1,256,1,7168,256,384,8,ActivationType.Silu,torch.bfloat16,torch.float4_e2m1fn_x2,torch.float4_e2m1fn_x2,QuantType.per_1x32,1,0,32,0,12.9409,flydsl_moe1_afp4_wfp4_bf16_t16x128x256_w3_kb7,0.1%,6.81,163354.23
stage1,256,1,7168,256,384,8,ActivationType.Silu,torch.bfloat16,torch.float4_e2m1fn_x2,torch.float4_e2m1fn_x2,QuantType.per_1x32,1,0,32,0,12.8362,flydsl_moe1_afp4_wfp4_bf16_t16x128x256_w3_kb7_go,0.0%,6.86,164686.65
stage1,256,1,7168,256,384,8,ActivationType.Silu,torch.bfloat16,torch.float4_e2m1fn_x2,torch.float4_e2m1fn_x2,QuantType.per_1x32,1,0,32,0,35.9922,flydsl_moe1_afp4_wfp4_bf16_t16x128x256_w4_bnt0,0.0%,2.45,58733.58
stage1,256,1,7168,256,384,8,ActivationType.Silu,torch.bfloat16,torch.float4_e2m1fn_x2,torch.float4_e2m1fn_x2,QuantType.per_1x32,1,0,32,0,36.2227,flydsl_moe1_afp4_wfp4_bf16_t16x128x256_w4,0.0%,2.43,58359.83
stage1,256,1,7168,256,384,8,ActivationType.Silu,torch.bfloat16,torch.float4_e2m1fn_x2,torch.float4_e2m1fn_x2,QuantType.per_1x32,1,0,32,0,25.9332,flydsl_moe1_afp4_wfp4_bf16_t16x128x256_w4_kb2_bnt0,0.0%,3.4,81515.23
stage1,256,1,7168,256,384,8,ActivationType.Silu,torch.bfloat16,torch.float4_e2m1fn_x2,torch.float4_e2m1fn_x2,QuantType.per_1x32,1,0,32,0,23.9993,flydsl_moe1_afp4_wfp4_bf16_t16x128x256_w4_kb2_bnt0_go,0.0%,3.67,88083.85
stage1,256,1,7168,256,384,8,ActivationType.Silu,torch.bfloat16,torch.float4_e2m1fn_x2,torch.float4_e2m1fn_x2,QuantType.per_1x32,1,0,32,0,26.7636,flydsl_moe1_afp4_wfp4_bf16_t16x128x256_w4_kb2,0.0%,3.29,78986.04
stage1,256,1,7168,256,384,8,ActivationType.Silu,torch.bfloat16,torch.float4_e2m1fn_x2,torch.float4_e2m1fn_x2,QuantType.per_1x32,1,0,32,0,24.7072,flydsl_moe1_afp4_wfp4_bf16_t16x128x256_w4_kb2_go,0.0%,3.56,85560.11
stage1,256,1,7168,256,384,8,ActivationType.Silu,torch.bfloat16,torch.float4_e2m1fn_x2,torch.float4_e2m1fn_x2,QuantType.per_1x32,1,0,32,0,16.0541,flydsl_moe1_afp4_wfp4_bf16_t16x128x256_w4_kb4_bnt0,0.0%,5.49,131676.69
stage1,256,1,7168,256,384,8,ActivationType.Silu,torch.bfloat16,torch.float4_e2m1fn_x2,torch.float4_e2m1fn_x2,QuantType.per_1x32,1,0,32,0,14.3082,flydsl_moe1_afp4_wfp4_bf16_t16x128x256_w4_kb4_bnt0_go,0.0%,6.16,147744.0
stage1,256,1,7168,256,384,8,ActivationType.Silu,torch.bfloat16,torch.float4_e2m1fn_x2,torch.float4_e2m1fn_x2,QuantType.per_1x32,1,0,32,0,15.9187,flydsl_moe1_afp4_wfp4_bf16_t16x128x256_w4_kb4,0.0%,5.53,132796.69
stage1,256,1,7168,256,384,8,ActivationType.Silu,torch.bfloat16,torch.float4_e2m1fn_x2,torch.float4_e2m1fn_x2,QuantType.per_1x32,1,0,32,0,15.6694,flydsl_moe1_afp4_wfp4_bf16_t16x128x256_w4_kb4_go,0.0%,5.62,134909.49
stage1,256,1,7168,256,384,8,ActivationType.Silu,torch.bfloat16,torch.float4_e2m1fn_x2,torch.float4_e2m1fn_x2,QuantType.per_1x32,1,0,32,0,12.8151,flydsl_moe1_afp4_wfp4_bf16_t16x128x256_w4_kb7_bnt0,0.0%,6.87,164957.8
stage1,256,1,7168,256,384,8,ActivationType.Silu,torch.bfloat16,torch.float4_e2m1fn_x2,torch.float4_e2m1fn_x2,QuantType.per_1x32,1,0,32,0,12.9887,flydsl_moe1_afp4_wfp4_bf16_t16x128x256_w4_kb7_bnt0_go,0.0%,6.78,162753.06
stage1,256,1,7168,256,384,8,ActivationType.Silu,torch.bfloat16,torch.float4_e2m1fn_x2,torch.float4_e2m1fn_x2,QuantType.per_1x32,1,0,32,0,14.1761,flydsl_moe1_afp4_wfp4_bf16_t16x128x256_w4_kb7,0.0%,6.21,149120.75
stage1,256,1,7168,256,384,8,ActivationType.Silu,torch.bfloat16,torch.float4_e2m1fn_x2,torch.float4_e2m1fn_x2,QuantType.per_1x32,1,0,32,0,11.5097,flydsl_moe1_afp4_wfp4_bf16_t16x128x256_w4_kb7_go,0.0%,7.65,183666.88
stage1,256,1,7168,256,384,8,ActivationType.Silu,torch.bfloat16,torch.float4_e2m1fn_x2,torch.float4_e2m1fn_x2,QuantType.per_1x32,1,0,32,0,22.1066,flydsl_moe1_afp4_wfp4_bf16_t32x32x256_bnt0,0.0%,3.98,95625.32
stage1,256,1,7168,256,384,8,ActivationType.Silu,torch.bfloat16,torch.float4_e2m1fn_x2,torch.float4_e2m1fn_x2,QuantType.per_1x32,1,0,32,0,21.892,flydsl_moe1_afp4_wfp4_bf16_t32x32x256,0.0%,4.02,96562.7
stage1,256,1,7168,256,384,8,ActivationType.Silu,torch.bfloat16,torch.float4_e2m1fn_x2,torch.float4_e2m1fn_x2,QuantType.per_1x32,1,0,32,0,19.2962,flydsl_moe1_afp4_wfp4_bf16_t32x32x256_kb2_bnt0,0.0%,4.56,109552.7
stage1,256,1,7168,256,384,8,ActivationType.Silu,torch.bfloat16,torch.float4_e2m1fn_x2,torch.float4_e2m1fn_x2,QuantType.per_1x32,1,0,32,0,16.9407,flydsl_moe1_afp4_wfp4_bf16_t32x32x256_kb2_bnt0_go,0.0%,5.2,124785.32
stage1,256,1,7168,256,384,8,ActivationType.Silu,torch.bfloat16,torch.float4_e2m1fn_x2,torch.float4_e2m1fn_x2,QuantType.per_1x32,1,0,32,0,17.3791,flydsl_moe1_afp4_wfp4_bf16_t32x32x256_kb2,0.0%,5.07,121637.53
stage1,256,1,7168,256,384,8,ActivationType.Silu,torch.bfloat16,torch.float4_e2m1fn_x2,torch.float4_e2m1fn_x2,QuantType.per_1x32,1,0,32,0,15.4859,flydsl_moe1_afp4_wfp4_bf16_t32x32x256_kb2_go,0.0%,5.69,136508.1
stage1,256,1,7168,256,384,8,ActivationType.Silu,torch.bfloat16,torch.float4_e2m1fn_x2,torch.float4_e2m1fn_x2,QuantType.per_1x32,1,0,32,0,14.986,flydsl_moe1_afp4_wfp4_bf16_t32x32x256_kb4_bnt0,0.0%,5.88,141061.71
stage1,256,1,7168,256,384,8,ActivationType.Silu,torch.bfloat16,torch.float4_e2m1fn_x2,torch.float4_e2m1fn_x2,QuantType.per_1x32,1,0,32,0,18.121,flydsl_moe1_afp4_wfp4_bf16_t32x32x256_kb4_bnt0_go,0.0%,4.86,116657.51
stage1,256,1,7168,256,384,8,ActivationType.Silu,torch.bfloat16,torch.float4_e2m1fn_x2,torch.float4_e2m1fn_x2,QuantType.per_1x32,1,0,32,0,13.7145,flydsl_moe1_afp4_wfp4_bf16_t32x32x256_kb4,0.0%,6.42,154139.83
stage1,256,1,7168,256,384,8,ActivationType.Silu,torch.bfloat16,torch.float4_e2m1fn_x2,torch.float4_e2m1fn_x2,QuantType.per_1x32,1,0,32,0,16.816,flydsl_moe1_afp4_wfp4_bf16_t32x32x256_kb4_go,0.0%,5.24,125710.68
stage1,256,1,7168,256,384,8,ActivationType.Silu,torch.bfloat16,torch.float4_e2m1fn_x2,torch.float4_e2m1fn_x2,QuantType.per_1x32,1,0,32,0,17.7498,flydsl_moe1_afp4_wfp4_bf16_t32x32x256_kb7_bnt0,0.0%,4.96,119097.16
stage1,256,1,7168,256,384,8,ActivationType.Silu,torch.bfloat16,torch.float4_e2m1fn_x2,torch.float4_e2m1fn_x2,QuantType.per_1x32,1,0,32,0,22.1988,flydsl_moe1_afp4_wfp4_bf16_t32x32x256_kb7_bnt0_go,0.0%,3.97,95228.15
stage1,256,1,7168,256,384,8,ActivationType.Silu,torch.bfloat16,torch.float4_e2m1fn_x2,torch.float4_e2m1fn_x2,QuantType.per_1x32,1,0,32,0,17.6934,flydsl_moe1_afp4_wfp4_bf16_t32x32x256_kb7,0.0%,4.98,119476.79
stage1,256,1,7168,256,384,8,ActivationType.Silu,torch.bfloat16,torch.float4_e2m1fn_x2,torch.float4_e2m1fn_x2,QuantType.per_1x32,1,0,32,0,22.5014,flydsl_moe1_afp4_wfp4_bf16_t32x32x256_kb7_go,0.0%,3.91,93947.52
stage1,256,1,7168,256,384,8,ActivationType.Silu,torch.bfloat16,torch.float4_e2m1fn_x2,torch.float4_e2m1fn_x2,QuantType.per_1x32,1,0,32,0,21.8379,flydsl_moe1_afp4_wfp4_bf16_t32x32x256_w2_bnt0,0.0%,4.03,96801.92
stage1,256,1,7168,256,384,8,ActivationType.Silu,torch.bfloat16,torch.float4_e2m1fn_x2,torch.float4_e2m1fn_x2,QuantType.per_1x32,1,0,32,0,22.3522,flydsl_moe1_afp4_wfp4_bf16_t32x32x256_w2,0.0%,3.94,94574.62
stage1,256,1,7168,256,384,8,ActivationType.Silu,torch.bfloat16,torch.float4_e2m1fn_x2,torch.float4_e2m1fn_x2,QuantType.per_1x32,1,0,32,0,19.0162,flydsl_moe1_afp4_wfp4_bf16_t32x32x256_w2_kb2_bnt0,0.0%,4.63,111165.78
stage1,256,1,7168,256,384,8,ActivationType.Silu,torch.bfloat16,torch.float4_e2m1fn_x2,torch.float4_e2m1fn_x2,QuantType.per_1x32,1,0,32,0,15.4863,flydsl_moe1_afp4_wfp4_bf16_t32x32x256_w2_kb2_bnt0_go,0.0%,5.69,136504.57
stage1,256,1,7168,256,384,8,ActivationType.Silu,torch.bfloat16,torch.float4_e2m1fn_x2,torch.float4_e2m1fn_x2,QuantType.per_1x32,1,0,32,0,19.239,flydsl_moe1_afp4_wfp4_bf16_t32x32x256_w2_kb2,0.0%,4.58,109878.41
stage1,256,1,7168,256,384,8,ActivationType.Silu,torch.bfloat16,torch.float4_e2m1fn_x2,torch.float4_e2m1fn_x2,QuantType.per_1x32,1,0,32,0,16.874,flydsl_moe1_afp4_wfp4_bf16_t32x32x256_w2_kb2_go,0.0%,5.22,125278.58
stage1,256,1,7168,256,384,8,ActivationType.Silu,torch.bfloat16,torch.float4_e2m1fn_x2,torch.float4_e2m1fn_x2,QuantType.per_1x32,1,0,32,0,13.5311,flydsl_moe1_afp4_wfp4_bf16_t32x32x256_w2_kb4_bnt0,0.0%,6.51,156229.04
stage1,256,1,7168,256,384,8,ActivationType.Silu,torch.bfloat16,torch.float4_e2m1fn_x2,torch.float4_e2m1fn_x2,QuantType.per_1x32,1,0,32,0,12.5992,flydsl_moe1_afp4_wfp4_bf16_t32x32x256_w2_kb4_bnt0_go,0.1%,6.99,167784.52
stage1,256,1,7168,256,384,8,ActivationType.Silu,torch.bfloat16,torch.float4_e2m1fn_x2,torch.float4_e2m1fn_x2,QuantType.per_1x32,1,0,32,0,15.0159,flydsl_moe1_afp4_wfp4_bf16_t32x32x256_w2_kb4,0.0%,5.87,140780.82
stage1,256,1,7168,256,384,8,ActivationType.Silu,torch.bfloat16,torch.float4_e2m1fn_x2,torch.float4_e2m1fn_x2,QuantType.per_1x32,1,0,32,0,13.8329,flydsl_moe1_afp4_wfp4_bf16_t32x32x256_w2_kb4_go,0.1%,6.37,152820.5
stage1,256,1,7168,256,384,8,ActivationType.Silu,torch.bfloat16,torch.float4_e2m1fn_x2,torch.float4_e2m1fn_x2,QuantType.per_1x32,1,0,32,0,12.2734,flydsl_moe1_afp4_wfp4_bf16_t32x32x256_w2_kb7_bnt0,0.0%,7.18,172238.4
stage1,256,1,7168,256,384,8,ActivationType.Silu,torch.bfloat16,torch.float4_e2m1fn_x2,torch.float4_e2m1fn_x2,QuantType.per_1x32,1,0,32,0,15.6975,flydsl_moe1_afp4_wfp4_bf16_t32x32x256_w2_kb7_bnt0_go,0.0%,5.61,134667.99
stage1,256,1,7168,256,384,8,ActivationType.Silu,torch.bfloat16,torch.float4_e2m1fn_x2,torch.float4_e2m1fn_x2,QuantType.per_1x32,1,0,32,0,13.5979,flydsl_moe1_afp4_wfp4_bf16_t32x32x256_w2_kb7,0.1%,6.48,155461.56
stage1,256,1,7168,256,384,8,ActivationType.Silu,torch.bfloat16,torch.float4_e2m1fn_x2,torch.float4_e2m1fn_x2,QuantType.per_1x32,1,0,32,0,14.347,flydsl_moe1_afp4_wfp4_bf16_t32x32x256_w2_kb7_go,0.0%,6.14,147344.44
stage1,256,1,7168,256,384,8,ActivationType.Silu,torch.bfloat16,torch.float4_e2m1fn_x2,torch.float4_e2m1fn_x2,QuantType.per_1x32,1,0,32,0,21.9187,flydsl_moe1_afp4_wfp4_bf16_t32x32x256_w3_bnt0,0.0%,4.02,96445.08
stage1,256,1,7168,256,384,8,ActivationType.Silu,torch.bfloat16,torch.float4_e2m1fn_x2,torch.float4_e2m1fn_x2,QuantType.per_1x32,1,0,32,0,22.0684,flydsl_moe1_afp4_wfp4_bf16_t32x32x256_w3,0.0%,3.99,95790.85
stage1,256,1,7168,256,384,8,ActivationType.Silu,torch.bfloat16,torch.float4_e2m1fn_x2,torch.float4_e2m1fn_x2,QuantType.per_1x32,1,0,32,0,19.2829,flydsl_moe1_afp4_wfp4_bf16_t32x32x256_w3_kb2_bnt0,0.0%,4.57,109628.26
stage1,256,1,7168,256,384,8,ActivationType.Silu,torch.bfloat16,torch.float4_e2m1fn_x2,torch.float4_e2m1fn_x2,QuantType.per_1x32,1,0,32,0,15.5464,flydsl_moe1_afp4_wfp4_bf16_t32x32x256_w3_kb2_bnt0_go,0.0%,5.67,135976.86
stage1,256,1,7168,256,384,8,ActivationType.Silu,torch.bfloat16,torch.float4_e2m1fn_x2,torch.float4_e2m1fn_x2,QuantType.per_1x32,1,0,32,0,18.8969,flydsl_moe1_afp4_wfp4_bf16_t32x32x256_w3_kb2,0.0%,4.66,111867.59
stage1,256,1,7168,256,384,8,ActivationType.Silu,torch.bfloat16,torch.float4_e2m1fn_x2,torch.float4_e2m1fn_x2,QuantType.per_1x32,1,0,32,0,16.8525,flydsl_moe1_afp4_wfp4_bf16_t32x32x256_w3_kb2_go,0.0%,5.23,125438.4
stage1,256,1,7168,256,384,8,ActivationType.Silu,torch.bfloat16,torch.float4_e2m1fn_x2,torch.float4_e2m1fn_x2,QuantType.per_1x32,1,0,32,0,13.6241,flydsl_moe1_afp4_wfp4_bf16_t32x32x256_w3_kb4_bnt0,0.0%,6.47,155162.6
stage1,256,1,7168,256,384,8,ActivationType.Silu,torch.bfloat16,torch.float4_e2m1fn_x2,torch.float4_e2m1fn_x2,QuantType.per_1x32,1,0,32,0,12.4004,flydsl_moe1_afp4_wfp4_bf16_t32x32x256_w3_kb4_bnt0_go,0.0%,7.1,170474.4
stage1,256,1,7168,256,384,8,ActivationType.Silu,torch.bfloat16,torch.float4_e2m1fn_x2,torch.float4_e2m1fn_x2,QuantType.per_1x32,1,0,32,0,14.9739,flydsl_moe1_afp4_wfp4_bf16_t32x32x256_w3_kb4,0.0%,5.88,141175.69
stage1,256,1,7168,256,384,8,ActivationType.Silu,torch.bfloat16,torch.float4_e2m1fn_x2,torch.float4_e2m1fn_x2,QuantType.per_1x32,1,0,32,0,13.9449,flydsl_moe1_afp4_wfp4_bf16_t32x32x256_w3_kb4_go,0.0%,6.32,151593.11
stage1,256,1,7168,256,384,8,ActivationType.Silu,torch.bfloat16,torch.float4_e2m1fn_x2,torch.float4_e2m1fn_x2,QuantType.per_1x32,1,0,32,0,12.1842,flydsl_moe1_afp4_wfp4_bf16_t32x32x256_w3_kb7_bnt0,0.0%,7.23,173499.35
stage1,256,1,7168,256,384,8,ActivationType.Silu,torch.bfloat16,torch.float4_e2m1fn_x2,torch.float4_e2m1fn_x2,QuantType.per_1x32,1,0,32,0,14.0266,flydsl_moe1_afp4_wfp4_bf16_t32x32x256_w3_kb7_bnt0_go,0.0%,6.28,150710.13
stage1,256,1,7168,256,384,8,ActivationType.Silu,torch.bfloat16,torch.float4_e2m1fn_x2,torch.float4_e2m1fn_x2,QuantType.per_1x32,1,0,32,0,13.5849,flydsl_moe1_afp4_wfp4_bf16_t32x32x256_w3_kb7,0.0%,6.48,155610.33
stage1,256,1,7168,256,384,8,ActivationType.Silu,torch.bfloat16,torch.float4_e2m1fn_x2,torch.float4_e2m1fn_x2,QuantType.per_1x32,1,0,32,0,15.3151,flydsl_moe1_afp4_wfp4_bf16_t32x32x256_w3_kb7_go,0.0%,5.75,138030.49
stage1,256,1,7168,256,384,8,ActivationType.Silu,torch.bfloat16,torch.float4_e2m1fn_x2,torch.float4_e2m1fn_x2,QuantType.per_1x32,1,0,32,0,21.9661,flydsl_moe1_afp4_wfp4_bf16_t32x32x256_w4_bnt0,0.0%,4.01,96236.96
stage1,256,1,7168,256,384,8,ActivationType.Silu,torch.bfloat16,torch.float4_e2m1fn_x2,torch.float4_e2m1fn_x2,QuantType.per_1x32,1,0,32,0,21.858,flydsl_moe1_afp4_wfp4_bf16_t32x32x256_w4,0.0%,4.03,96712.91
stage1,256,1,7168,256,384,8,ActivationType.Silu,torch.bfloat16,torch.float4_e2m1fn_x2,torch.float4_e2m1fn_x2,QuantType.per_1x32,1,0,32,0,19.2755,flydsl_moe1_afp4_wfp4_bf16_t32x32x256_w4_kb2_bnt0,0.0%,4.57,109670.34
stage1,256,1,7168,256,384,8,ActivationType.Silu,torch.bfloat16,torch.float4_e2m1fn_x2,torch.float4_e2m1fn_x2,QuantType.per_1x32,1,0,32,0,15.4604,flydsl_moe1_afp4_wfp4_bf16_t32x32x256_w4_kb2_bnt0_go,0.0%,5.7,136733.25
stage1,256,1,7168,256,384,8,ActivationType.Silu,torch.bfloat16,torch.float4_e2m1fn_x2,torch.float4_e2m1fn_x2,QuantType.per_1x32,1,0,32,0,17.6716,flydsl_moe1_afp4_wfp4_bf16_t32x32x256_w4_kb2,0.0%,4.98,119624.18
stage1,256,1,7168,256,384,8,ActivationType.Silu,torch.bfloat16,torch.float4_e2m1fn_x2,torch.float4_e2m1fn_x2,QuantType.per_1x32,1,0,32,0,16.866,flydsl_moe1_afp4_wfp4_bf16_t32x32x256_w4_kb2_go,0.0%,5.22,125338.0
stage1,256,1,7168,256,384,8,ActivationType.Silu,torch.bfloat16,torch.float4_e2m1fn_x2,torch.float4_e2m1fn_x2,QuantType.per_1x32,1,0,32,0,14.9676,flydsl_moe1_afp4_wfp4_bf16_t32x32x256_w4_kb4_bnt0,0.0%,5.88,141235.12
stage1,256,1,7168,256,384,8,ActivationType.Silu,torch.bfloat16,torch.float4_e2m1fn_x2,torch.float4_e2m1fn_x2,QuantType.per_1x32,1,0,32,0,13.8201,flydsl_moe1_afp4_wfp4_bf16_t32x32x256_w4_kb4_bnt0_go,0.1%,6.37,152962.04
stage1,256,1,7168,256,384,8,ActivationType.Silu,torch.bfloat16,torch.float4_e2m1fn_x2,torch.float4_e2m1fn_x2,QuantType.per_1x32,1,0,32,0,13.5839,flydsl_moe1_afp4_wfp4_bf16_t32x32x256_w4_kb4,0.0%,6.48,155621.78
stage1,256,1,7168,256,384,8,ActivationType.Silu,torch.bfloat16,torch.float4_e2m1fn_x2,torch.float4_e2m1fn_x2,QuantType.per_1x32,1,0,32,0,13.7264,flydsl_moe1_afp4_wfp4_bf16_t32x32x256_w4_kb4_go,0.1%,6.42,154006.2
stage1,256,1,7168,256,384,8,ActivationType.Silu,torch.bfloat16,torch.float4_e2m1fn_x2,torch.float4_e2m1fn_x2,QuantType.per_1x32,1,0,32,0,12.1863,flydsl_moe1_afp4_wfp4_bf16_t32x32x256_w4_kb7_bnt0,0.0%,7.23,173469.45
stage1,256,1,7168,256,384,8,ActivationType.Silu,torch.bfloat16,torch.float4_e2m1fn_x2,torch.float4_e2m1fn_x2,QuantType.per_1x32,1,0,32,0,12.8241,flydsl_moe1_afp4_wfp4_bf16_t32x32x256_w4_kb7_bnt0_go,0.0%,6.87,164842.03
stage1,256,1,7168,256,384,8,ActivationType.Silu,torch.bfloat16,torch.float4_e2m1fn_x2,torch.float4_e2m1fn_x2,QuantType.per_1x32,1,0,32,0,12.1669,flydsl_moe1_afp4_wfp4_bf16_t32x32x256_w4_kb7,0.1%,7.24,173746.04
stage1,256,1,7168,256,384,8,ActivationType.Silu,torch.bfloat16,torch.float4_e2m1fn_x2,torch.float4_e2m1fn_x2,QuantType.per_1x32,1,0,32,0,11.4849,flydsl_moe1_afp4_wfp4_bf16_t32x32x256_w4_kb7_go,0.0%,7.67,184063.49
stage1,256,1,7168,256,384,8,ActivationType.Silu,torch.bfloat16,torch.float4_e2m1fn_x2,torch.float4_e2m1fn_x2,QuantType.per_1x32,1,0,32,0,23.5538,flydsl_moe1_afp4_wfp4_bf16_t32x64x256_bnt0,0.0%,3.74,89749.88
stage1,256,1,7168,256,384,8,ActivationType.Silu,torch.bfloat16,torch.float4_e2m1fn_x2,torch.float4_e2m1fn_x2,QuantType.per_1x32,1,0,32,0,23.5728,flydsl_moe1_afp4_wfp4_bf16_t32x64x256,0.0%,3.74,89677.54
stage1,256,1,7168,256,384,8,ActivationType.Silu,torch.bfloat16,torch.float4_e2m1fn_x2,torch.float4_e2m1fn_x2,QuantType.per_1x32,1,0,32,0,17.7772,flydsl_moe1_afp4_wfp4_bf16_t32x64x256_kb2_bnt0,0.0%,4.95,118913.59
stage1,256,1,7168,256,384,8,ActivationType.Silu,torch.bfloat16,torch.float4_e2m1fn_x2,torch.float4_e2m1fn_x2,QuantType.per_1x32,1,0,32,0,17.5845,flydsl_moe1_afp4_wfp4_bf16_t32x64x256_kb2_bnt0_go,0.0%,5.01,120216.71
stage1,256,1,7168,256,384,8,ActivationType.Silu,torch.bfloat16,torch.float4_e2m1fn_x2,torch.float4_e2m1fn_x2,QuantType.per_1x32,1,0,32,0,18.1375,flydsl_moe1_afp4_wfp4_bf16_t32x64x256_kb2,0.0%,4.86,116551.38
stage1,256,1,7168,256,384,8,ActivationType.Silu,torch.bfloat16,torch.float4_e2m1fn_x2,torch.float4_e2m1fn_x2,QuantType.per_1x32,1,0,32,0,17.4447,flydsl_moe1_afp4_wfp4_bf16_t32x64x256_kb2_go,0.0%,5.05,121180.11
stage1,256,1,7168,256,384,8,ActivationType.Silu,torch.bfloat16,torch.float4_e2m1fn_x2,torch.float4_e2m1fn_x2,QuantType.per_1x32,1,0,32,0,13.6982,flydsl_moe1_afp4_wfp4_bf16_t32x64x256_kb4_bnt0,0.0%,6.43,154323.25
stage1,256,1,7168,256,384,8,ActivationType.Silu,torch.bfloat16,torch.float4_e2m1fn_x2,torch.float4_e2m1fn_x2,QuantType.per_1x32,1,0,32,0,12.3984,flydsl_moe1_afp4_wfp4_bf16_t32x64x256_kb4_bnt0_go,0.0%,7.1,170501.9
stage1,256,1,7168,256,384,8,ActivationType.Silu,torch.bfloat16,torch.float4_e2m1fn_x2,torch.float4_e2m1fn_x2,QuantType.per_1x32,1,0,32,0,14.9913,flydsl_moe1_afp4_wfp4_bf16_t32x64x256_kb4,0.0%,5.88,141011.83
stage1,256,1,7168,256,384,8,ActivationType.Silu,torch.bfloat16,torch.float4_e2m1fn_x2,torch.float4_e2m1fn_x2,QuantType.per_1x32,1,0,32,0,12.5178,flydsl_moe1_afp4_wfp4_bf16_t32x64x256_kb4_go,0.0%,7.04,168875.58
stage1,256,1,7168,256,384,8,ActivationType.Silu,torch.bfloat16,torch.float4_e2m1fn_x2,torch.float4_e2m1fn_x2,QuantType.per_1x32,1,0,32,0,13.4143,flydsl_moe1_afp4_wfp4_bf16_t32x64x256_kb7_bnt0,0.0%,6.57,157589.34
stage1,256,1,7168,256,384,8,ActivationType.Silu,torch.bfloat16,torch.float4_e2m1fn_x2,torch.float4_e2m1fn_x2,QuantType.per_1x32,1,0,32,0,14.2775,flydsl_moe1_afp4_wfp4_bf16_t32x64x256_kb7_bnt0_go,0.0%,6.17,148061.69
stage1,256,1,7168,256,384,8,ActivationType.Silu,torch.bfloat16,torch.float4_e2m1fn_x2,torch.float4_e2m1fn_x2,QuantType.per_1x32,1,0,32,0,13.4733,flydsl_moe1_afp4_wfp4_bf16_t32x64x256_kb7,0.0%,6.54,156899.25
stage1,256,1,7168,256,384,8,ActivationType.Silu,torch.bfloat16,torch.float4_e2m1fn_x2,torch.float4_e2m1fn_x2,QuantType.per_1x32,1,0,32,0,15.707,flydsl_moe1_afp4_wfp4_bf16_t32x64x256_kb7_go,0.0%,5.61,134586.54
stage1,256,1,7168,256,384,8,ActivationType.Silu,torch.bfloat16,torch.float4_e2m1fn_x2,torch.float4_e2m1fn_x2,QuantType.per_1x32,1,0,32,0,23.1996,flydsl_moe1_afp4_wfp4_bf16_t32x64x256_w2_bnt0,0.0%,3.8,91120.14
stage1,256,1,7168,256,384,8,ActivationType.Silu,torch.bfloat16,torch.float4_e2m1fn_x2,torch.float4_e2m1fn_x2,QuantType.per_1x32,1,0,32,0,23.1155,flydsl_moe1_afp4_wfp4_bf16_t32x64x256_w2,0.0%,3.81,91451.65
stage1,256,1,7168,256,384,8,ActivationType.Silu,torch.bfloat16,torch.float4_e2m1fn_x2,torch.float4_e2m1fn_x2,QuantType.per_1x32,1,0,32,0,18.966,flydsl_moe1_afp4_wfp4_bf16_t32x64x256_w2_kb2_bnt0,0.0%,4.64,111460.02
stage1,256,1,7168,256,384,8,ActivationType.Silu,torch.bfloat16,torch.float4_e2m1fn_x2,torch.float4_e2m1fn_x2,QuantType.per_1x32,1,0,32,0,17.5432,flydsl_moe1_afp4_wfp4_bf16_t32x64x256_w2_kb2_bnt0_go,0.0%,5.02,120499.72
stage1,256,1,7168,256,384,8,ActivationType.Silu,torch.bfloat16,torch.float4_e2m1fn_x2,torch.float4_e2m1fn_x2,QuantType.per_1x32,1,0,32,0,18.0575,flydsl_moe1_afp4_wfp4_bf16_t32x64x256_w2_kb2,0.0%,4.88,117067.74
stage1,256,1,7168,256,384,8,ActivationType.Silu,torch.bfloat16,torch.float4_e2m1fn_x2,torch.float4_e2m1fn_x2,QuantType.per_1x32,1,0,32,0,16.0758,flydsl_moe1_afp4_wfp4_bf16_t32x64x256_w2_kb2_go,0.0%,5.48,131498.94
stage1,256,1,7168,256,384,8,ActivationType.Silu,torch.bfloat16,torch.float4_e2m1fn_x2,torch.float4_e2m1fn_x2,QuantType.per_1x32,1,0,32,0,14.9869,flydsl_moe1_afp4_wfp4_bf16_t32x64x256_w2_kb4_bnt0,0.0%,5.88,141053.23
stage1,256,1,7168,256,384,8,ActivationType.Silu,torch.bfloat16,torch.float4_e2m1fn_x2,torch.float4_e2m1fn_x2,QuantType.per_1x32,1,0,32,0,13.8569,flydsl_moe1_afp4_wfp4_bf16_t32x64x256_w2_kb4_bnt0_go,0.0%,6.36,152555.82
stage1,256,1,7168,256,384,8,ActivationType.Silu,torch.bfloat16,torch.float4_e2m1fn_x2,torch.float4_e2m1fn_x2,QuantType.per_1x32,1,0,32,0,13.629,flydsl_moe1_afp4_wfp4_bf16_t32x64x256_w2_kb4,0.0%,6.46,155106.81
stage1,256,1,7168,256,384,8,ActivationType.Silu,torch.bfloat16,torch.float4_e2m1fn_x2,torch.float4_e2m1fn_x2,QuantType.per_1x32,1,0,32,0,13.8749,flydsl_moe1_afp4_wfp4_bf16_t32x64x256_w2_kb4_go,0.1%,6.35,152357.91
stage1,256,1,7168,256,384,8,ActivationType.Silu,torch.bfloat16,torch.float4_e2m1fn_x2,torch.float4_e2m1fn_x2,QuantType.per_1x32,1,0,32,0,11.8854,flydsl_moe1_afp4_wfp4_bf16_t32x64x256_w2_kb7_bnt0,0.0%,7.41,177861.13
stage1,256,1,7168,256,384,8,ActivationType.Silu,torch.bfloat16,torch.float4_e2m1fn_x2,torch.float4_e2m1fn_x2,QuantType.per_1x32,1,0,32,0,12.6216,flydsl_moe1_afp4_wfp4_bf16_t32x64x256_w2_kb7_bnt0_go,0.0%,6.98,167486.75
stage1,256,1,7168,256,384,8,ActivationType.Silu,torch.bfloat16,torch.float4_e2m1fn_x2,torch.float4_e2m1fn_x2,QuantType.per_1x32,1,0,32,0,11.9006,flydsl_moe1_afp4_wfp4_bf16_t32x64x256_w2_kb7,0.0%,7.4,177633.96
stage1,256,1,7168,256,384,8,ActivationType.Silu,torch.bfloat16,torch.float4_e2m1fn_x2,torch.float4_e2m1fn_x2,QuantType.per_1x32,1,0,32,0,12.7071,flydsl_moe1_afp4_wfp4_bf16_t32x64x256_w2_kb7_go,0.0%,6.93,166359.81
stage1,256,1,7168,256,384,8,ActivationType.Silu,torch.bfloat16,torch.float4_e2m1fn_x2,torch.float4_e2m1fn_x2,QuantType.per_1x32,1,0,32,0,23.0444,flydsl_moe1_afp4_wfp4_bf16_t32x64x256_w3_bnt0,0.0%,3.82,91733.81
stage1,256,1,7168,256,384,8,ActivationType.Silu,torch.bfloat16,torch.float4_e2m1fn_x2,torch.float4_e2m1fn_x2,QuantType.per_1x32,1,0,32,0,23.6246,flydsl_moe1_afp4_wfp4_bf16_t32x64x256_w3,0.0%,3.73,89480.91
stage1,256,1,7168,256,384,8,ActivationType.Silu,torch.bfloat16,torch.float4_e2m1fn_x2,torch.float4_e2m1fn_x2,QuantType.per_1x32,1,0,32,0,17.9354,flydsl_moe1_afp4_wfp4_bf16_t32x64x256_w3_kb2_bnt0,0.0%,4.91,117864.71
stage1,256,1,7168,256,384,8,ActivationType.Silu,torch.bfloat16,torch.float4_e2m1fn_x2,torch.float4_e2m1fn_x2,QuantType.per_1x32,1,0,32,0,15.9392,flydsl_moe1_afp4_wfp4_bf16_t32x64x256_w3_kb2_bnt0_go,0.0%,5.53,132625.9
stage1,256,1,7168,256,384,8,ActivationType.Silu,torch.bfloat16,torch.float4_e2m1fn_x2,torch.float4_e2m1fn_x2,QuantType.per_1x32,1,0,32,0,19.1971,flydsl_moe1_afp4_wfp4_bf16_t32x64x256_w3_kb2,0.0%,4.59,110118.23
stage1,256,1,7168,256,384,8,ActivationType.Silu,torch.bfloat16,torch.float4_e2m1fn_x2,torch.float4_e2m1fn_x2,QuantType.per_1x32,1,0,32,0,17.4284,flydsl_moe1_afp4_wfp4_bf16_t32x64x256_w3_kb2_go,0.0%,5.05,121293.45
stage1,256,1,7168,256,384,8,ActivationType.Silu,torch.bfloat16,torch.float4_e2m1fn_x2,torch.float4_e2m1fn_x2,QuantType.per_1x32,1,0,32,0,13.6464,flydsl_moe1_afp4_wfp4_bf16_t32x64x256_w3_kb4_bnt0,0.0%,6.45,154909.04
stage1,256,1,7168,256,384,8,ActivationType.Silu,torch.bfloat16,torch.float4_e2m1fn_x2,torch.float4_e2m1fn_x2,QuantType.per_1x32,1,0,32,0,12.3512,flydsl_moe1_afp4_wfp4_bf16_t32x64x256_w3_kb4_bnt0_go,0.0%,7.13,171153.47
stage1,256,1,7168,256,384,8,ActivationType.Silu,torch.bfloat16,torch.float4_e2m1fn_x2,torch.float4_e2m1fn_x2,QuantType.per_1x32,1,0,32,0,15.0134,flydsl_moe1_afp4_wfp4_bf16_t32x64x256_w3_kb4,0.1%,5.87,140804.26
stage1,256,1,7168,256,384,8,ActivationType.Silu,torch.bfloat16,torch.float4_e2m1fn_x2,torch.float4_e2m1fn_x2,QuantType.per_1x32,1,0,32,0,13.8095,flydsl_moe1_afp4_wfp4_bf16_t32x64x256_w3_kb4_go,0.0%,6.38,153079.45
stage1,256,1,7168,256,384,8,ActivationType.Silu,torch.bfloat16,torch.float4_e2m1fn_x2,torch.float4_e2m1fn_x2,QuantType.per_1x32,1,0,32,0,11.9834,flydsl_moe1_afp4_wfp4_bf16_t32x64x256_w3_kb7_bnt0,0.1%,7.35,176406.59
stage1,256,1,7168,256,384,8,ActivationType.Silu,torch.bfloat16,torch.float4_e2m1fn_x2,torch.float4_e2m1fn_x2,QuantType.per_1x32,1,0,32,0,11.2486,flydsl_moe1_afp4_wfp4_bf16_t32x64x256_w3_kb7_bnt0_go,0.0%,7.83,187930.12
stage1,256,1,7168,256,384,8,ActivationType.Silu,torch.bfloat16,torch.float4_e2m1fn_x2,torch.float4_e2m1fn_x2,QuantType.per_1x32,1,0,32,0,13.3035,flydsl_moe1_afp4_wfp4_bf16_t32x64x256_w3_kb7,0.1%,6.62,158901.85
stage1,256,1,7168,256,384,8,ActivationType.Silu,torch.bfloat16,torch.float4_e2m1fn_x2,torch.float4_e2m1fn_x2,QuantType.per_1x32,1,0,32,0,12.7643,flydsl_moe1_afp4_wfp4_bf16_t32x64x256_w3_kb7_go,0.0%,6.9,165614.31
stage1,256,1,7168,256,384,8,ActivationType.Silu,torch.bfloat16,torch.float4_e2m1fn_x2,torch.float4_e2m1fn_x2,QuantType.per_1x32,1,0,32,0,23.2636,flydsl_moe1_afp4_wfp4_bf16_t32x64x256_w4_bnt0,0.0%,3.79,90869.46
stage1,256,1,7168,256,384,8,ActivationType.Silu,torch.bfloat16,torch.float4_e2m1fn_x2,torch.float4_e2m1fn_x2,QuantType.per_1x32,1,0,32,0,23.1249,flydsl_moe1_afp4_wfp4_bf16_t32x64x256_w4,0.0%,3.81,91414.48
stage1,256,1,7168,256,384,8,ActivationType.Silu,torch.bfloat16,torch.float4_e2m1fn_x2,torch.float4_e2m1fn_x2,QuantType.per_1x32,1,0,32,0,19.2665,flydsl_moe1_afp4_wfp4_bf16_t32x64x256_w4_kb2_bnt0,0.0%,4.57,109721.57
stage1,256,1,7168,256,384,8,ActivationType.Silu,torch.bfloat16,torch.float4_e2m1fn_x2,torch.float4_e2m1fn_x2,QuantType.per_1x32,1,0,32,0,16.106,flydsl_moe1_afp4_wfp4_bf16_t32x64x256_w4_kb2_bnt0_go,0.0%,5.47,131252.37
stage1,256,1,7168,256,384,8,ActivationType.Silu,torch.bfloat16,torch.float4_e2m1fn_x2,torch.float4_e2m1fn_x2,QuantType.per_1x32,1,0,32,0,17.8768,flydsl_moe1_afp4_wfp4_bf16_t32x64x256_w4_kb2,0.0%,4.93,118251.07
stage1,256,1,7168,256,384,8,ActivationType.Silu,torch.bfloat16,torch.float4_e2m1fn_x2,torch.float4_e2m1fn_x2,QuantType.per_1x32,1,0,32,0,17.5129,flydsl_moe1_afp4_wfp4_bf16_t32x64x256_w4_kb2_go,0.0%,5.03,120708.2
stage1,256,1,7168,256,384,8,ActivationType.Silu,torch.bfloat16,torch.float4_e2m1fn_x2,torch.float4_e2m1fn_x2,QuantType.per_1x32,1,0,32,0,15.0482,flydsl_moe1_afp4_wfp4_bf16_t32x64x256_w4_kb4_bnt0,0.1%,5.85,140478.64
stage1,256,1,7168,256,384,8,ActivationType.Silu,torch.bfloat16,torch.float4_e2m1fn_x2,torch.float4_e2m1fn_x2,QuantType.per_1x32,1,0,32,0,13.8676,flydsl_moe1_afp4_wfp4_bf16_t32x64x256_w4_kb4_bnt0_go,0.0%,6.35,152438.11
stage1,256,1,7168,256,384,8,ActivationType.Silu,torch.bfloat16,torch.float4_e2m1fn_x2,torch.float4_e2m1fn_x2,QuantType.per_1x32,1,0,32,0,13.6337,flydsl_moe1_afp4_wfp4_bf16_t32x64x256_w4_kb4,0.0%,6.46,155053.34
stage1,256,1,7168,256,384,8,ActivationType.Silu,torch.bfloat16,torch.float4_e2m1fn_x2,torch.float4_e2m1fn_x2,QuantType.per_1x32,1,0,32,0,12.4896,flydsl_moe1_afp4_wfp4_bf16_t32x64x256_w4_kb4_go,0.0%,7.05,169256.88
stage1,256,1,7168,256,384,8,ActivationType.Silu,torch.bfloat16,torch.float4_e2m1fn_x2,torch.float4_e2m1fn_x2,QuantType.per_1x32,1,0,32,0,13.4188,flydsl_moe1_afp4_wfp4_bf16_t32x64x256_w4_kb7_bnt0,0.0%,6.56,157536.5
stage1,256,1,7168,256,384,8,ActivationType.Silu,torch.bfloat16,torch.float4_e2m1fn_x2,torch.float4_e2m1fn_x2,QuantType.per_1x32,1,0,32,0,12.6493,flydsl_moe1_afp4_wfp4_bf16_t32x64x256_w4_kb7_bnt0_go,0.0%,6.96,167119.98
stage1,256,1,7168,256,384,8,ActivationType.Silu,torch.bfloat16,torch.float4_e2m1fn_x2,torch.float4_e2m1fn_x2,QuantType.per_1x32,1,0,32,0,11.9744,flydsl_moe1_afp4_wfp4_bf16_t32x64x256_w4_kb7,0.1%,7.36,176539.18
stage1,256,1,7168,256,384,8,ActivationType.Silu,torch.bfloat16,torch.float4_e2m1fn_x2,torch.float4_e2m1fn_x2,QuantType.per_1x32,1,0,32,0,12.6983,flydsl_moe1_afp4_wfp4_bf16_t32x64x256_w4_kb7_go,0.0%,6.94,166475.1
stage1,256,1,7168,256,384,8,ActivationType.Silu,torch.bfloat16,torch.float4_e2m1fn_x2,torch.float4_e2m1fn_x2,QuantType.per_1x32,1,0,32,0,26.744,flydsl_moe1_afp4_wfp4_bf16_t32x128x256_bnt0,0.0%,3.29,79043.92
stage1,256,1,7168,256,384,8,ActivationType.Silu,torch.bfloat16,torch.float4_e2m1fn_x2,torch.float4_e2m1fn_x2,QuantType.per_1x32,1,0,32,0,27.1947,flydsl_moe1_afp4_wfp4_bf16_t32x128x256,0.0%,3.24,77733.92
stage1,256,1,7168,256,384,8,ActivationType.Silu,torch.bfloat16,torch.float4_e2m1fn_x2,torch.float4_e2m1fn_x2,QuantType.per_1x32,1,0,32,0,21.8536,flydsl_moe1_afp4_wfp4_bf16_t32x128x256_kb2_bnt0,0.0%,4.03,96732.38
stage1,256,1,7168,256,384,8,ActivationType.Silu,torch.bfloat16,torch.float4_e2m1fn_x2,torch.float4_e2m1fn_x2,QuantType.per_1x32,1,0,32,0,18.4878,flydsl_moe1_afp4_wfp4_bf16_t32x128x256_kb2_bnt0_go,0.0%,4.76,114343.01
stage1,256,1,7168,256,384,8,ActivationType.Silu,torch.bfloat16,torch.float4_e2m1fn_x2,torch.float4_e2m1fn_x2,QuantType.per_1x32,1,0,32,0,22.0832,flydsl_moe1_afp4_wfp4_bf16_t32x128x256_kb2,0.0%,3.99,95726.65
stage1,256,1,7168,256,384,8,ActivationType.Silu,torch.bfloat16,torch.float4_e2m1fn_x2,torch.float4_e2m1fn_x2,QuantType.per_1x32,1,0,32,0,18.5206,flydsl_moe1_afp4_wfp4_bf16_t32x128x256_kb2_go,0.0%,4.76,114140.51
stage1,256,1,7168,256,384,8,ActivationType.Silu,torch.bfloat16,torch.float4_e2m1fn_x2,torch.float4_e2m1fn_x2,QuantType.per_1x32,1,0,32,0,14.2973,flydsl_moe1_afp4_wfp4_bf16_t32x128x256_kb4_bnt0,0.0%,6.16,147856.64
stage1,256,1,7168,256,384,8,ActivationType.Silu,torch.bfloat16,torch.float4_e2m1fn_x2,torch.float4_e2m1fn_x2,QuantType.per_1x32,1,0,32,0,12.7445,flydsl_moe1_afp4_wfp4_bf16_t32x128x256_kb4_bnt0_go,0.0%,6.91,165871.61
stage1,256,1,7168,256,384,8,ActivationType.Silu,torch.bfloat16,torch.float4_e2m1fn_x2,torch.float4_e2m1fn_x2,QuantType.per_1x32,1,0,32,0,15.7104,flydsl_moe1_afp4_wfp4_bf16_t32x128x256_kb4,0.0%,5.61,134557.41
stage1,256,1,7168,256,384,8,ActivationType.Silu,torch.bfloat16,torch.float4_e2m1fn_x2,torch.float4_e2m1fn_x2,QuantType.per_1x32,1,0,32,0,12.6443,flydsl_moe1_afp4_wfp4_bf16_t32x128x256_kb4_go,0.0%,6.97,167186.06
stage1,256,1,7168,256,384,8,ActivationType.Silu,torch.bfloat16,torch.float4_e2m1fn_x2,torch.float4_e2m1fn_x2,QuantType.per_1x32,1,0,32,0,13.8096,flydsl_moe1_afp4_wfp4_bf16_t32x128x256_kb7_bnt0,0.1%,6.38,153078.35
stage1,256,1,7168,256,384,8,ActivationType.Silu,torch.bfloat16,torch.float4_e2m1fn_x2,torch.float4_e2m1fn_x2,QuantType.per_1x32,1,0,32,0,11.2433,flydsl_moe1_afp4_wfp4_bf16_t32x128x256_kb7_bnt0_go,0.0%,7.83,188018.71
stage1,256,1,7168,256,384,8,ActivationType.Silu,torch.bfloat16,torch.float4_e2m1fn_x2,torch.float4_e2m1fn_x2,QuantType.per_1x32,1,0,32,0,13.7288,flydsl_moe1_afp4_wfp4_bf16_t32x128x256_kb7,0.1%,6.42,153979.28
stage1,256,1,7168,256,384,8,ActivationType.Silu,torch.bfloat16,torch.float4_e2m1fn_x2,torch.float4_e2m1fn_x2,QuantType.per_1x32,1,0,32,0,12.6717,flydsl_moe1_afp4_wfp4_bf16_t32x128x256_kb7_go,0.0%,6.95,166824.56
stage1,256,1,7168,256,384,8,ActivationType.Silu,torch.bfloat16,torch.float4_e2m1fn_x2,torch.float4_e2m1fn_x2,QuantType.per_1x32,1,0,32,0,26.761,flydsl_moe1_afp4_wfp4_bf16_t32x128x256_w2_bnt0,0.0%,3.29,78993.71
stage1,256,1,7168,256,384,8,ActivationType.Silu,torch.bfloat16,torch.float4_e2m1fn_x2,torch.float4_e2m1fn_x2,QuantType.per_1x32,1,0,32,0,26.5348,flydsl_moe1_afp4_wfp4_bf16_t32x128x256_w2,0.0%,3.32,79667.11
stage1,256,1,7168,256,384,8,ActivationType.Silu,torch.bfloat16,torch.float4_e2m1fn_x2,torch.float4_e2m1fn_x2,QuantType.per_1x32,1,0,32,0,24.4874,flydsl_moe1_afp4_wfp4_bf16_t32x128x256_w2_kb2_bnt0,0.0%,3.6,86328.1
stage1,256,1,7168,256,384,8,ActivationType.Silu,torch.bfloat16,torch.float4_e2m1fn_x2,torch.float4_e2m1fn_x2,QuantType.per_1x32,1,0,32,0,18.3844,flydsl_moe1_afp4_wfp4_bf16_t32x128x256_w2_kb2_bnt0_go,0.0%,4.79,114986.11
stage1,256,1,7168,256,384,8,ActivationType.Silu,torch.bfloat16,torch.float4_e2m1fn_x2,torch.float4_e2m1fn_x2,QuantType.per_1x32,1,0,32,0,21.0231,flydsl_moe1_afp4_wfp4_bf16_t32x128x256_w2_kb2,0.0%,4.19,100553.71
stage1,256,1,7168,256,384,8,ActivationType.Silu,torch.bfloat16,torch.float4_e2m1fn_x2,torch.float4_e2m1fn_x2,QuantType.per_1x32,1,0,32,0,16.9352,flydsl_moe1_afp4_wfp4_bf16_t32x128x256_w2_kb2_go,0.0%,5.2,124825.85
stage1,256,1,7168,256,384,8,ActivationType.Silu,torch.bfloat16,torch.float4_e2m1fn_x2,torch.float4_e2m1fn_x2,QuantType.per_1x32,1,0,32,0,15.8452,flydsl_moe1_afp4_wfp4_bf16_t32x128x256_w2_kb4_bnt0,0.0%,5.56,133412.69
stage1,256,1,7168,256,384,8,ActivationType.Silu,torch.bfloat16,torch.float4_e2m1fn_x2,torch.float4_e2m1fn_x2,QuantType.per_1x32,1,0,32,0,14.0517,flydsl_moe1_afp4_wfp4_bf16_t32x128x256_w2_kb4_bnt0_go,0.0%,6.27,150440.92
stage1,256,1,7168,256,384,8,ActivationType.Silu,torch.bfloat16,torch.float4_e2m1fn_x2,torch.float4_e2m1fn_x2,QuantType.per_1x32,1,0,32,0,14.3156,flydsl_moe1_afp4_wfp4_bf16_t32x128x256_w2_kb4,0.1%,6.15,147667.63
stage1,256,1,7168,256,384,8,ActivationType.Silu,torch.bfloat16,torch.float4_e2m1fn_x2,torch.float4_e2m1fn_x2,QuantType.per_1x32,1,0,32,0,14.0265,flydsl_moe1_afp4_wfp4_bf16_t32x128x256_w2_kb4_go,0.0%,6.28,150711.21
stage1,256,1,7168,256,384,8,ActivationType.Silu,torch.bfloat16,torch.float4_e2m1fn_x2,torch.float4_e2m1fn_x2,QuantType.per_1x32,1,0,32,0,12.2876,flydsl_moe1_afp4_wfp4_bf16_t32x128x256_w2_kb7_bnt0,0.0%,7.17,172039.35
stage1,256,1,7168,256,384,8,ActivationType.Silu,torch.bfloat16,torch.float4_e2m1fn_x2,torch.float4_e2m1fn_x2,QuantType.per_1x32,1,0,32,0,12.5971,flydsl_moe1_afp4_wfp4_bf16_t32x128x256_w2_kb7_bnt0_go,0.0%,6.99,167812.49
stage1,256,1,7168,256,384,8,ActivationType.Silu,torch.bfloat16,torch.float4_e2m1fn_x2,torch.float4_e2m1fn_x2,QuantType.per_1x32,1,0,32,0,12.3183,flydsl_moe1_afp4_wfp4_bf16_t32x128x256_w2_kb7,0.0%,7.15,171610.59
stage1,256,1,7168,256,384,8,ActivationType.Silu,torch.bfloat16,torch.float4_e2m1fn_x2,torch.float4_e2m1fn_x2,QuantType.per_1x32,1,0,32,0,11.1203,flydsl_moe1_afp4_wfp4_bf16_t32x128x256_w2_kb7_go,0.0%,7.92,190098.35
stage1,256,1,7168,256,384,8,ActivationType.Silu,torch.bfloat16,torch.float4_e2m1fn_x2,torch.float4_e2m1fn_x2,QuantType.per_1x32,1,0,32,0,27.0604,flydsl_moe1_afp4_wfp4_bf16_t32x128x256_w3_bnt0,0.0%,3.25,78119.71
stage1,256,1,7168,256,384,8,ActivationType.Silu,torch.bfloat16,torch.float4_e2m1fn_x2,torch.float4_e2m1fn_x2,QuantType.per_1x32,1,0,32,0,27.2501,flydsl_moe1_afp4_wfp4_bf16_t32x128x256_w3,0.0%,3.23,77575.89
stage1,256,1,7168,256,384,8,ActivationType.Silu,torch.bfloat16,torch.float4_e2m1fn_x2,torch.float4_e2m1fn_x2,QuantType.per_1x32,1,0,32,0,21.2206,flydsl_moe1_afp4_wfp4_bf16_t32x128x256_w3_kb2_bnt0,0.0%,4.15,99617.86
stage1,256,1,7168,256,384,8,ActivationType.Silu,torch.bfloat16,torch.float4_e2m1fn_x2,torch.float4_e2m1fn_x2,QuantType.per_1x32,1,0,32,0,18.3659,flydsl_moe1_afp4_wfp4_bf16_t32x128x256_w3_kb2_bnt0_go,0.0%,4.8,115101.94
stage1,256,1,7168,256,384,8,ActivationType.Silu,torch.bfloat16,torch.float4_e2m1fn_x2,torch.float4_e2m1fn_x2,QuantType.per_1x32,1,0,32,0,21.8979,flydsl_moe1_afp4_wfp4_bf16_t32x128x256_w3_kb2,0.0%,4.02,96536.69
stage1,256,1,7168,256,384,8,ActivationType.Silu,torch.bfloat16,torch.float4_e2m1fn_x2,torch.float4_e2m1fn_x2,QuantType.per_1x32,1,0,32,0,18.4382,flydsl_moe1_afp4_wfp4_bf16_t32x128x256_w3_kb2_go,0.0%,4.78,114650.6
stage1,256,1,7168,256,384,8,ActivationType.Silu,torch.bfloat16,torch.float4_e2m1fn_x2,torch.float4_e2m1fn_x2,QuantType.per_1x32,1,0,32,0,14.3498,flydsl_moe1_afp4_wfp4_bf16_t32x128x256_w3_kb4_bnt0,0.0%,6.14,147315.69
stage1,256,1,7168,256,384,8,ActivationType.Silu,torch.bfloat16,torch.float4_e2m1fn_x2,torch.float4_e2m1fn_x2,QuantType.per_1x32,1,0,32,0,12.6588,flydsl_moe1_afp4_wfp4_bf16_t32x128x256_w3_kb4_bnt0_go,0.1%,6.96,166994.56
stage1,256,1,7168,256,384,8,ActivationType.Silu,torch.bfloat16,torch.float4_e2m1fn_x2,torch.float4_e2m1fn_x2,QuantType.per_1x32,1,0,32,0,15.8301,flydsl_moe1_afp4_wfp4_bf16_t32x128x256_w3_kb4,0.0%,5.56,133539.95
stage1,256,1,7168,256,384,8,ActivationType.Silu,torch.bfloat16,torch.float4_e2m1fn_x2,torch.float4_e2m1fn_x2,QuantType.per_1x32,1,0,32,0,14.0884,flydsl_moe1_afp4_wfp4_bf16_t32x128x256_w3_kb4_go,0.0%,6.25,150049.03
stage1,256,1,7168,256,384,8,ActivationType.Silu,torch.bfloat16,torch.float4_e2m1fn_x2,torch.float4_e2m1fn_x2,QuantType.per_1x32,1,0,32,0,12.2448,flydsl_moe1_afp4_wfp4_bf16_t32x128x256_w3_kb7_bnt0,0.0%,7.19,172640.69
stage1,256,1,7168,256,384,8,ActivationType.Silu,torch.bfloat16,torch.float4_e2m1fn_x2,torch.float4_e2m1fn_x2,QuantType.per_1x32,1,0,32,0,12.5972,flydsl_moe1_afp4_wfp4_bf16_t32x128x256_w3_kb7_bnt0_go,0.1%,6.99,167811.16
stage1,256,1,7168,256,384,8,ActivationType.Silu,torch.bfloat16,torch.float4_e2m1fn_x2,torch.float4_e2m1fn_x2,QuantType.per_1x32,1,0,32,0,12.2313,flydsl_moe1_afp4_wfp4_bf16_t32x128x256_w3_kb7,0.0%,7.2,172831.24
stage1,256,1,7168,256,384,8,ActivationType.Silu,torch.bfloat16,torch.float4_e2m1fn_x2,torch.float4_e2m1fn_x2,QuantType.per_1x32,1,0,32,0,12.5996,flydsl_moe1_afp4_wfp4_bf16_t32x128x256_w3_kb7_go,0.0%,6.99,167779.19
stage1,256,1,7168,256,384,8,ActivationType.Silu,torch.bfloat16,torch.float4_e2m1fn_x2,torch.float4_e2m1fn_x2,QuantType.per_1x32,1,0,32,0,26.7129,flydsl_moe1_afp4_wfp4_bf16_t32x128x256_w4_bnt0,0.0%,3.3,79135.95
stage1,256,1,7168,256,384,8,ActivationType.Silu,torch.bfloat16,torch.float4_e2m1fn_x2,torch.float4_e2m1fn_x2,QuantType.per_1x32,1,0,32,0,26.5209,flydsl_moe1_afp4_wfp4_bf16_t32x128x256_w4,0.0%,3.32,79708.86
stage1,256,1,7168,256,384,8,ActivationType.Silu,torch.bfloat16,torch.float4_e2m1fn_x2,torch.float4_e2m1fn_x2,QuantType.per_1x32,1,0,32,0,24.448,flydsl_moe1_afp4_wfp4_bf16_t32x128x256_w4_kb2_bnt0,0.0%,3.6,86467.23
stage1,256,1,7168,256,384,8,ActivationType.Silu,torch.bfloat16,torch.float4_e2m1fn_x2,torch.float4_e2m1fn_x2,QuantType.per_1x32,1,0,32,0,18.4212,flydsl_moe1_afp4_wfp4_bf16_t32x128x256_w4_kb2_bnt0_go,0.0%,4.78,114756.41
stage1,256,1,7168,256,384,8,ActivationType.Silu,torch.bfloat16,torch.float4_e2m1fn_x2,torch.float4_e2m1fn_x2,QuantType.per_1x32,1,0,32,0,20.6645,flydsl_moe1_afp4_wfp4_bf16_t32x128x256_w4_kb2,0.0%,4.26,102298.66
stage1,256,1,7168,256,384,8,ActivationType.Silu,torch.bfloat16,torch.float4_e2m1fn_x2,torch.float4_e2m1fn_x2,QuantType.per_1x32,1,0,32,0,17.0014,flydsl_moe1_afp4_wfp4_bf16_t32x128x256_w4_kb2_go,0.0%,5.18,124339.8
stage1,256,1,7168,256,384,8,ActivationType.Silu,torch.bfloat16,torch.float4_e2m1fn_x2,torch.float4_e2m1fn_x2,QuantType.per_1x32,1,0,32,0,15.7266,flydsl_moe1_afp4_wfp4_bf16_t32x128x256_w4_kb4_bnt0,0.1%,5.6,134418.8
stage1,256,1,7168,256,384,8,ActivationType.Silu,torch.bfloat16,torch.float4_e2m1fn_x2,torch.float4_e2m1fn_x2,QuantType.per_1x32,1,0,32,0,14.1447,flydsl_moe1_afp4_wfp4_bf16_t32x128x256_w4_kb4_bnt0_go,0.0%,6.23,149451.79
stage1,256,1,7168,256,384,8,ActivationType.Silu,torch.bfloat16,torch.float4_e2m1fn_x2,torch.float4_e2m1fn_x2,QuantType.per_1x32,1,0,32,0,14.2967,flydsl_moe1_afp4_wfp4_bf16_t32x128x256_w4_kb4,0.0%,6.16,147862.84
stage1,256,1,7168,256,384,8,ActivationType.Silu,torch.bfloat16,torch.float4_e2m1fn_x2,torch.float4_e2m1fn_x2,QuantType.per_1x32,1,0,32,0,14.2085,flydsl_moe1_afp4_wfp4_bf16_t32x128x256_w4_kb4_go,0.0%,6.2,148780.71
stage1,256,1,7168,256,384,8,ActivationType.Silu,torch.bfloat16,torch.float4_e2m1fn_x2,torch.float4_e2m1fn_x2,QuantType.per_1x32,1,0,32,0,12.2772,flydsl_moe1_afp4_wfp4_bf16_t32x128x256_w4_kb7_bnt0,0.0%,7.17,172185.08
stage1,256,1,7168,256,384,8,ActivationType.Silu,torch.bfloat16,torch.float4_e2m1fn_x2,torch.float4_e2m1fn_x2,QuantType.per_1x32,1,0,32,0,12.5971,flydsl_moe1_afp4_wfp4_bf16_t32x128x256_w4_kb7_bnt0_go,0.0%,6.99,167812.49
stage1,256,1,7168,256,384,8,ActivationType.Silu,torch.bfloat16,torch.float4_e2m1fn_x2,torch.float4_e2m1fn_x2,QuantType.per_1x32,1,0,32,0,12.2559,flydsl_moe1_afp4_wfp4_bf16_t32x128x256_w4_kb7,0.1%,7.19,172484.33
stage1,256,1,7168,256,384,8,ActivationType.Silu,torch.bfloat16,torch.float4_e2m1fn_x2,torch.float4_e2m1fn_x2,QuantType.per_1x32,1,0,32,0,11.0879,flydsl_moe1_afp4_wfp4_bf16_t32x128x256_w4_kb7_go,0.0%,7.94,190653.84
stage2,256,1,7168,256,384,8,ActivationType.Silu,torch.bfloat16,torch.float4_e2m1fn_x2,torch.float4_e2m1fn_x2,QuantType.per_1x32,1,0,32,0,11.1785,flydsl_moe2_afp4_wfp4_bf16_t32x128x256_atomic,99.9%,7.88,189108.62
stage2,256,1,7168,256,384,8,ActivationType.Silu,torch.bfloat16,torch.float4_e2m1fn_x2,torch.float4_e2m1fn_x2,QuantType.per_1x32,1,0,32,0,16.1533,flydsl_moe2_afp4_wfp4_bf16_t32x128x256_reduce,0.0%,5.45,130868.04
stage2,256,1,7168,256,384,8,ActivationType.Silu,torch.bfloat16,torch.float4_e2m1fn_x2,torch.float4_e2m1fn_x2,QuantType.per_1x32,1,0,32,0,13.1789,flydsl_moe2_afp4_wfp4_bf16_t32x256x256_atomic,99.8%,6.68,160404.19
stage2,256,1,7168,256,384,8,ActivationType.Silu,torch.bfloat16,torch.float4_e2m1fn_x2,torch.float4_e2m1fn_x2,QuantType.per_1x32,1,0,32,0,19.2998,flydsl_moe2_afp4_wfp4_bf16_t32x256x256_reduce,0.0%,4.56,109532.26
stage1,256,1,7168,256,384,8,ActivationType.Silu,torch.bfloat16,torch.float4_e2m1fn_x2,torch.float4_e2m1fn_x2,QuantType.per_1x32,1,0,64,0,25.8295,flydsl_moe1_afp4_wfp4_bf16_t64x64x256_bnt0,0.0%,3.41,81842.49
stage1,256,1,7168,256,384,8,ActivationType.Silu,torch.bfloat16,torch.float4_e2m1fn_x2,torch.float4_e2m1fn_x2,QuantType.per_1x32,1,0,64,0,26.1842,flydsl_moe1_afp4_wfp4_bf16_t64x64x256,0.0%,3.36,80733.83
stage1,256,1,7168,256,384,8,ActivationType.Silu,torch.bfloat16,torch.float4_e2m1fn_x2,torch.float4_e2m1fn_x2,QuantType.per_1x32,1,0,64,0,25.9412,flydsl_moe1_afp4_wfp4_bf16_t64x64x256_w2_bnt0,0.0%,3.4,81490.09
stage1,256,1,7168,256,384,8,ActivationType.Silu,torch.bfloat16,torch.float4_e2m1fn_x2,torch.float4_e2m1fn_x2,QuantType.per_1x32,1,0,64,0,26.0954,flydsl_moe1_afp4_wfp4_bf16_t64x64x256_w2,0.0%,3.38,81008.56
stage1,256,1,7168,256,384,8,ActivationType.Silu,torch.bfloat16,torch.float4_e2m1fn_x2,torch.float4_e2m1fn_x2,QuantType.per_1x32,1,0,64,0,25.9666,flydsl_moe1_afp4_wfp4_bf16_t64x64x256_w3_bnt0,0.0%,3.39,81410.38
stage1,256,1,7168,256,384,8,ActivationType.Silu,torch.bfloat16,torch.float4_e2m1fn_x2,torch.float4_e2m1fn_x2,QuantType.per_1x32,1,0,64,0,25.8914,flydsl_moe1_afp4_wfp4_bf16_t64x64x256_w3,0.0%,3.4,81646.83
stage1,256,1,7168,256,384,8,ActivationType.Silu,torch.bfloat16,torch.float4_e2m1fn_x2,torch.float4_e2m1fn_x2,QuantType.per_1x32,1,0,64,0,26.4968,flydsl_moe1_afp4_wfp4_bf16_t64x64x256_w4_bnt0,0.0%,3.32,79781.36
stage1,256,1,7168,256,384,8,ActivationType.Silu,torch.bfloat16,torch.float4_e2m1fn_x2,torch.float4_e2m1fn_x2,QuantType.per_1x32,1,0,64,0,26.1153,flydsl_moe1_afp4_wfp4_bf16_t64x64x256_w4,0.0%,3.37,80946.83
stage1,256,1,7168,256,384,8,ActivationType.Silu,torch.bfloat16,torch.float4_e2m1fn_x2,torch.float4_e2m1fn_x2,QuantType.per_1x32,1,0,64,0,28.6459,flydsl_moe1_afp4_wfp4_bf16_t64x128x256_bnt0,0.0%,3.07,73795.93
stage1,256,1,7168,256,384,8,ActivationType.Silu,torch.bfloat16,torch.float4_e2m1fn_x2,torch.float4_e2m1fn_x2,QuantType.per_1x32,1,0,64,0,28.4129,flydsl_moe1_afp4_wfp4_bf16_t64x128x256,0.0%,3.1,74401.09
stage1,256,1,7168,256,384,8,ActivationType.Silu,torch.bfloat16,torch.float4_e2m1fn_x2,torch.float4_e2m1fn_x2,QuantType.per_1x32,1,0,64,0,29.4653,flydsl_moe1_afp4_wfp4_bf16_t64x128x256_w2_bnt0,0.0%,2.99,71743.74
stage1,256,1,7168,256,384,8,ActivationType.Silu,torch.bfloat16,torch.float4_e2m1fn_x2,torch.float4_e2m1fn_x2,QuantType.per_1x32,1,0,64,0,28.6948,flydsl_moe1_afp4_wfp4_bf16_t64x128x256_w2,0.0%,3.07,73670.17
stage1,256,1,7168,256,384,8,ActivationType.Silu,torch.bfloat16,torch.float4_e2m1fn_x2,torch.float4_e2m1fn_x2,QuantType.per_1x32,1,0,64,0,28.8261,flydsl_moe1_afp4_wfp4_bf16_t64x128x256_w3_bnt0,0.0%,3.06,73334.61
stage1,256,1,7168,256,384,8,ActivationType.Silu,torch.bfloat16,torch.float4_e2m1fn_x2,torch.float4_e2m1fn_x2,QuantType.per_1x32,1,0,64,0,28.7954,flydsl_moe1_afp4_wfp4_bf16_t64x128x256_w3,0.0%,3.06,73412.79
stage1,256,1,7168,256,384,8,ActivationType.Silu,torch.bfloat16,torch.float4_e2m1fn_x2,torch.float4_e2m1fn_x2,QuantType.per_1x32,1,0,64,0,29.1659,flydsl_moe1_afp4_wfp4_bf16_t64x128x256_w4_bnt0,0.0%,3.02,72480.22
stage1,256,1,7168,256,384,8,ActivationType.Silu,torch.bfloat16,torch.float4_e2m1fn_x2,torch.float4_e2m1fn_x2,QuantType.per_1x32,1,0,64,0,28.3281,flydsl_moe1_afp4_wfp4_bf16_t64x128x256_w4,0.0%,3.11,74623.81
stage2,256,1,7168,256,384,8,ActivationType.Silu,torch.bfloat16,torch.float4_e2m1fn_x2,torch.float4_e2m1fn_x2,QuantType.per_1x32,1,0,64,0,12.287,flydsl_moe2_afp4_wfp4_bf16_t64x128x256_atomic,99.9%,7.17,172047.75
stage2,256,1,7168,256,384,8,ActivationType.Silu,torch.bfloat16,torch.float4_e2m1fn_x2,torch.float4_e2m1fn_x2,QuantType.per_1x32,1,0,64,0,18.6769,flydsl_moe2_afp4_wfp4_bf16_t64x128x256_reduce,0.0%,4.72,113185.31
stage2,256,1,7168,256,384,8,ActivationType.Silu,torch.bfloat16,torch.float4_e2m1fn_x2,torch.float4_e2m1fn_x2,QuantType.per_1x32,1,0,64,0,16.2453,flydsl_moe2_afp4_wfp4_bf16_t64x256x256_atomic,99.8%,5.42,130126.91
stage2,256,1,7168,256,384,8,ActivationType.Silu,torch.bfloat16,torch.float4_e2m1fn_x2,torch.float4_e2m1fn_x2,QuantType.per_1x32,1,0,64,0,20.188,flydsl_moe2_afp4_wfp4_bf16_t64x256x256_reduce,0.0%,4.36,104713.23
stage1,256,1,7168,256,384,8,ActivationType.Silu,torch.bfloat16,torch.float4_e2m1fn_x2,torch.float4_e2m1fn_x2,QuantType.per_1x32,1,0,128,0,32.0892,flydsl_moe1_afp4_wfp4_bf16_t128x64x256_bnt0,0.0%,2.74,65877.33
stage1,256,1,7168,256,384,8,ActivationType.Silu,torch.bfloat16,torch.float4_e2m1fn_x2,torch.float4_e2m1fn_x2,QuantType.per_1x32,1,0,128,0,32.2869,flydsl_moe1_afp4_wfp4_bf16_t128x64x256,0.0%,2.73,65473.95
stage1,256,1,7168,256,384,8,ActivationType.Silu,torch.bfloat16,torch.float4_e2m1fn_x2,torch.float4_e2m1fn_x2,QuantType.per_1x32,1,0,128,0,32.0934,flydsl_moe1_afp4_wfp4_bf16_t128x64x256_w2_bnt0,0.0%,2.74,65868.71
stage1,256,1,7168,256,384,8,ActivationType.Silu,torch.bfloat16,torch.float4_e2m1fn_x2,torch.float4_e2m1fn_x2,QuantType.per_1x32,1,0,128,0,32.2493,flydsl_moe1_afp4_wfp4_bf16_t128x64x256_w2,0.0%,2.73,65550.28
stage1,256,1,7168,256,384,8,ActivationType.Silu,torch.bfloat16,torch.float4_e2m1fn_x2,torch.float4_e2m1fn_x2,QuantType.per_1x32,1,0,128,0,32.1666,flydsl_moe1_afp4_wfp4_bf16_t128x64x256_w3_bnt0,0.0%,2.74,65718.81
stage1,256,1,7168,256,384,8,ActivationType.Silu,torch.bfloat16,torch.float4_e2m1fn_x2,torch.float4_e2m1fn_x2,QuantType.per_1x32,1,0,128,0,32.3004,flydsl_moe1_afp4_wfp4_bf16_t128x64x256_w3,0.0%,2.73,65446.58
stage1,256,1,7168,256,384,8,ActivationType.Silu,torch.bfloat16,torch.float4_e2m1fn_x2,torch.float4_e2m1fn_x2,QuantType.per_1x32,1,0,128,0,32.1956,flydsl_moe1_afp4_wfp4_bf16_t128x64x256_w4_bnt0,0.0%,2.74,65659.62
stage1,256,1,7168,256,384,8,ActivationType.Silu,torch.bfloat16,torch.float4_e2m1fn_x2,torch.float4_e2m1fn_x2,QuantType.per_1x32,1,0,128,0,32.2151,flydsl_moe1_afp4_wfp4_bf16_t128x64x256_w4,0.0%,2.73,65619.87
stage1,256,1,7168,256,384,8,ActivationType.Silu,torch.bfloat16,torch.float4_e2m1fn_x2,torch.float4_e2m1fn_x2,QuantType.per_1x32,1,0,128,0,34.6471,flydsl_moe1_afp4_wfp4_bf16_t128x128x256_bnt0,0.0%,2.54,61013.79
stage1,256,1,7168,256,384,8,ActivationType.Silu,torch.bfloat16,torch.float4_e2m1fn_x2,torch.float4_e2m1fn_x2,QuantType.per_1x32,1,0,128,0,34.6985,flydsl_moe1_afp4_wfp4_bf16_t128x128x256,0.0%,2.54,60923.4
stage1,256,1,7168,256,384,8,ActivationType.Silu,torch.bfloat16,torch.float4_e2m1fn_x2,torch.float4_e2m1fn_x2,QuantType.per_1x32,1,0,128,0,34.7321,flydsl_moe1_afp4_wfp4_bf16_t128x128x256_w2_bnt0,0.0%,2.54,60864.47
stage1,256,1,7168,256,384,8,ActivationType.Silu,torch.bfloat16,torch.float4_e2m1fn_x2,torch.float4_e2m1fn_x2,QuantType.per_1x32,1,0,128,0,34.6822,flydsl_moe1_afp4_wfp4_bf16_t128x128x256_w2,0.0%,2.54,60952.04
stage1,256,1,7168,256,384,8,ActivationType.Silu,torch.bfloat16,torch.float4_e2m1fn_x2,torch.float4_e2m1fn_x2,QuantType.per_1x32,1,0,128,0,34.721,flydsl_moe1_afp4_wfp4_bf16_t128x128x256_w3_bnt0,0.0%,2.54,60883.92
stage1,256,1,7168,256,384,8,ActivationType.Silu,torch.bfloat16,torch.float4_e2m1fn_x2,torch.float4_e2m1fn_x2,QuantType.per_1x32,1,0,128,0,34.423,flydsl_moe1_afp4_wfp4_bf16_t128x128x256_w3,0.0%,2.56,61411.0
stage1,256,1,7168,256,384,8,ActivationType.Silu,torch.bfloat16,torch.float4_e2m1fn_x2,torch.float4_e2m1fn_x2,QuantType.per_1x32,1,0,128,0,35.1193,flydsl_moe1_afp4_wfp4_bf16_t128x128x256_w4_bnt0,0.0%,2.51,60193.42
stage1,256,1,7168,256,384,8,ActivationType.Silu,torch.bfloat16,torch.float4_e2m1fn_x2,torch.float4_e2m1fn_x2,QuantType.per_1x32,1,0,128,0,34.7473,flydsl_moe1_afp4_wfp4_bf16_t128x128x256_w4,0.0%,2.53,60837.84
stage2,256,1,7168,256,384,8,ActivationType.Silu,torch.bfloat16,torch.float4_e2m1fn_x2,torch.float4_e2m1fn_x2,QuantType.per_1x32,1,0,128,0,16.7112,flydsl_moe2_afp4_wfp4_bf16_t128x128x256_atomic,99.9%,5.27,126499.04
stage2,256,1,7168,256,384,8,ActivationType.Silu,torch.bfloat16,torch.float4_e2m1fn_x2,torch.float4_e2m1fn_x2,QuantType.per_1x32,1,0,128,0,20.9935,flydsl_moe2_afp4_wfp4_bf16_t128x128x256_reduce,0.0%,4.2,100695.49
stage2,256,1,7168,256,384,8,ActivationType.Silu,torch.bfloat16,torch.float4_e2m1fn_x2,torch.float4_e2m1fn_x2,QuantType.per_1x32,1,0,128,0,23.2396,flydsl_moe2_afp4_wfp4_bf16_t128x256x256_atomic,99.8%,3.79,90963.3
stage2,256,1,7168,256,384,8,ActivationType.Silu,torch.bfloat16,torch.float4_e2m1fn_x2,torch.float4_e2m1fn_x2,QuantType.per_1x32,1,0,128,0,27.3683,flydsl_moe2_afp4_wfp4_bf16_t128x256x256_reduce,0.0%,3.22,77240.85
stage1,256,2,7168,256,384,8,ActivationType.Silu,torch.bfloat16,torch.float4_e2m1fn_x2,torch.float4_e2m1fn_x2,QuantType.per_1x32,1,0,32,0,25.6651,moe_ck2stages_gemm1_256x32x128x128_1x4_MulABScaleShuffled_v3_Nswizzle0_Quant3_MulRoutedWeight0_silu_FP4X2_FP4X2_B16,0.0%,6.86,82367.58
stage1,256,2,7168,256,384,8,ActivationType.Silu,torch.bfloat16,torch.float4_e2m1fn_x2,torch.float4_e2m1fn_x2,QuantType.per_1x32,1,0,32,0,22.4229,moe_ck2stages_gemm1_64x32x32x128_1x1_MulABScaleShuffled_v3_Nswizzle0_Quant3_MulRoutedWeight0_silu_FP4X2_FP4X2_B16,0.0%,7.86,94277.38
stage2,256,2,7168,256,384,8,ActivationType.Silu,torch.bfloat16,torch.float4_e2m1fn_x2,torch.float4_e2m1fn_x2,QuantType.per_1x32,1,0,32,0,8.8586,moe_ck2stages_gemm2_256x32x128x128_1x4_MulABScaleExpertWeightShuffled_v3_Nswizzle0_Quant3_MulRoutedWeight1_FP4X2_FP4X2_B16,1.4%,19.89,238635.02
stage2,256,2,7168,256,384,8,ActivationType.Silu,torch.bfloat16,torch.float4_e2m1fn_x2,torch.float4_e2m1fn_x2,QuantType.per_1x32,1,0,32,0,9.9303,moe_ck2stages_gemm2_64x32x32x128_1x1_MulABScaleExpertWeightShuffled_v1_Nswizzle0_Quant3_MulRoutedWeight1_FP4X2_FP4X2_B16,1.3%,17.74,212881.0
stage1,256,2,7168,256,384,8,ActivationType.Silu,torch.bfloat16,torch.float4_e2m1fn_x2,torch.float4_e2m1fn_x2,QuantType.per_1x32,1,0,64,0,30.2693,moe_ck2stages_gemm1_256x64x128x128_1x4_MulABScaleShuffled_v3_Nswizzle0_Quant3_MulRoutedWeight0_silu_FP4X2_FP4X2_B16,0.0%,5.82,69838.82
stage2,256,2,7168,256,384,8,ActivationType.Silu,torch.bfloat16,torch.float4_e2m1fn_x2,torch.float4_e2m1fn_x2,QuantType.per_1x32,1,0,64,0,9.7464,moe_ck2stages_gemm2_256x64x128x128_1x4_MulABScaleExpertWeightShuffled_v3_Nswizzle0_Quant3_MulRoutedWeight1_FP4X2_FP4X2_B16,1.3%,18.07,216897.75
stage2,256,2,7168,256,384,8,ActivationType.Silu,torch.bfloat16,torch.float4_e2m1fn_x2,torch.float4_e2m1fn_x2,QuantType.per_1x32,1,0,64,0,14.6233,moe_ck2stages_gemm2_64x64x128x128_1x1_MulABScaleExpertWeightShuffled_v3_Nswizzle0_Quant3_MulRoutedWeight1_FP4X2_FP4X2_B16,1.5%,12.05,144561.91
stage1,256,2,7168,256,384,8,ActivationType.Silu,torch.bfloat16,torch.float4_e2m1fn_x2,torch.float4_e2m1fn_x2,QuantType.per_1x32,1,0,128,0,40.6289,moe_ck2stages_gemm1_256x128x128x128_1x4_MulABScaleShuffled_v3_Nswizzle0_Quant3_MulRoutedWeight0_silu_FP4X2_FP4X2_B16,0.0%,4.34,52031.24
stage2,256,2,7168,256,384,8,ActivationType.Silu,torch.bfloat16,torch.float4_e2m1fn_x2,torch.float4_e2m1fn_x2,QuantType.per_1x32,1,0,128,0,16.976,moe_ck2stages_gemm2_256x128x128x128_1x4_MulABScaleExpertWeightShuffled_v3_Nswizzle0_Quant3_MulRoutedWeight1_FP4X2_FP4X2_B16,1.4%,10.38,124527.11
stage2,256,2,7168,256,384,8,ActivationType.Silu,torch.bfloat16,torch.float4_e2m1fn_x2,torch.float4_e2m1fn_x2,QuantType.per_1x32,1,0,128,0,18.9465,moe_ck2stages_gemm2_64x128x128x128_1x1_MulABScaleExpertWeightShuffled_v3_Nswizzle0_Quant3_MulRoutedWeight1_FP4X2_FP4X2_B16,1.5%,9.3,111575.87
stage1,256,2,7168,256,384,8,ActivationType.Silu,torch.bfloat16,torch.float4_e2m1fn_x2,torch.float4_e2m1fn_x2,QuantType.per_1x32,1,0,32,0,27.5782,flydsl_moe1_afp4_wfp4_bf16_t16x32x256_bnt0,0.0%,6.39,76653.74
stage1,256,2,7168,256,384,8,ActivationType.Silu,torch.bfloat16,torch.float4_e2m1fn_x2,torch.float4_e2m1fn_x2,QuantType.per_1x32,1,0,32,0,27.8371,flydsl_moe1_afp4_wfp4_bf16_t16x32x256,0.0%,6.33,75940.82
stage1,256,2,7168,256,384,8,ActivationType.Silu,torch.bfloat16,torch.float4_e2m1fn_x2,torch.float4_e2m1fn_x2,QuantType.per_1x32,1,0,32,0,23.3936,flydsl_moe1_afp4_wfp4_bf16_t16x32x256_kb2_bnt0,0.0%,7.53,90365.41
stage1,256,2,7168,256,384,8,ActivationType.Silu,torch.bfloat16,torch.float4_e2m1fn_x2,torch.float4_e2m1fn_x2,QuantType.per_1x32,1,0,32,0,32.1275,flydsl_moe1_afp4_wfp4_bf16_t16x32x256_kb2_bnt0_go,0.0%,5.48,65799.46
stage1,256,2,7168,256,384,8,ActivationType.Silu,torch.bfloat16,torch.float4_e2m1fn_x2,torch.float4_e2m1fn_x2,QuantType.per_1x32,1,0,32,0,23.2237,flydsl_moe1_afp4_wfp4_bf16_t16x32x256_kb2,0.0%,7.59,91026.5
stage1,256,2,7168,256,384,8,ActivationType.Silu,torch.bfloat16,torch.float4_e2m1fn_x2,torch.float4_e2m1fn_x2,QuantType.per_1x32,1,0,32,0,32.4254,flydsl_moe1_afp4_wfp4_bf16_t16x32x256_kb2_go,0.0%,5.43,65194.95
stage1,256,2,7168,256,384,8,ActivationType.Silu,torch.bfloat16,torch.float4_e2m1fn_x2,torch.float4_e2m1fn_x2,QuantType.per_1x32,1,0,32,0,25.1228,flydsl_moe1_afp4_wfp4_bf16_t16x32x256_kb4_bnt0,0.0%,7.01,84145.57
stage1,256,2,7168,256,384,8,ActivationType.Silu,torch.bfloat16,torch.float4_e2m1fn_x2,torch.float4_e2m1fn_x2,QuantType.per_1x32,1,0,32,0,33.899,flydsl_moe1_afp4_wfp4_bf16_t16x32x256_kb4_bnt0_go,0.0%,5.2,62360.9
stage1,256,2,7168,256,384,8,ActivationType.Silu,torch.bfloat16,torch.float4_e2m1fn_x2,torch.float4_e2m1fn_x2,QuantType.per_1x32,1,0,32,0,24.5949,flydsl_moe1_afp4_wfp4_bf16_t16x32x256_kb4,0.0%,7.16,85951.65
stage1,256,2,7168,256,384,8,ActivationType.Silu,torch.bfloat16,torch.float4_e2m1fn_x2,torch.float4_e2m1fn_x2,QuantType.per_1x32,1,0,32,0,34.4668,flydsl_moe1_afp4_wfp4_bf16_t16x32x256_kb4_go,0.0%,5.11,61333.58
stage1,256,2,7168,256,384,8,ActivationType.Silu,torch.bfloat16,torch.float4_e2m1fn_x2,torch.float4_e2m1fn_x2,QuantType.per_1x32,1,0,32,0,27.279,flydsl_moe1_afp4_wfp4_bf16_t16x32x256_kb7_bnt0,0.1%,6.46,77494.49
stage1,256,2,7168,256,384,8,ActivationType.Silu,torch.bfloat16,torch.float4_e2m1fn_x2,torch.float4_e2m1fn_x2,QuantType.per_1x32,1,0,32,0,32.0245,flydsl_moe1_afp4_wfp4_bf16_t16x32x256_kb7_bnt0_go,0.1%,5.5,66011.09
stage1,256,2,7168,256,384,8,ActivationType.Silu,torch.bfloat16,torch.float4_e2m1fn_x2,torch.float4_e2m1fn_x2,QuantType.per_1x32,1,0,32,0,26.7955,flydsl_moe1_afp4_wfp4_bf16_t16x32x256_kb7,0.1%,6.57,78892.81
stage1,256,2,7168,256,384,8,ActivationType.Silu,torch.bfloat16,torch.float4_e2m1fn_x2,torch.float4_e2m1fn_x2,QuantType.per_1x32,1,0,32,0,32.471,flydsl_moe1_afp4_wfp4_bf16_t16x32x256_kb7_go,0.1%,5.43,65103.39
stage1,256,2,7168,256,384,8,ActivationType.Silu,torch.bfloat16,torch.float4_e2m1fn_x2,torch.float4_e2m1fn_x2,QuantType.per_1x32,1,0,32,0,27.7114,flydsl_moe1_afp4_wfp4_bf16_t16x32x256_w2_bnt0,0.0%,6.36,76285.29
stage1,256,2,7168,256,384,8,ActivationType.Silu,torch.bfloat16,torch.float4_e2m1fn_x2,torch.float4_e2m1fn_x2,QuantType.per_1x32,1,0,32,0,27.8958,flydsl_moe1_afp4_wfp4_bf16_t16x32x256_w2,0.0%,6.31,75781.02
stage1,256,2,7168,256,384,8,ActivationType.Silu,torch.bfloat16,torch.float4_e2m1fn_x2,torch.float4_e2m1fn_x2,QuantType.per_1x32,1,0,32,0,23.8625,flydsl_moe1_afp4_wfp4_bf16_t16x32x256_w2_kb2_bnt0,0.0%,7.38,88589.72
stage1,256,2,7168,256,384,8,ActivationType.Silu,torch.bfloat16,torch.float4_e2m1fn_x2,torch.float4_e2m1fn_x2,QuantType.per_1x32,1,0,32,0,22.2236,flydsl_moe1_afp4_wfp4_bf16_t16x32x256_w2_kb2_bnt0_go,0.0%,7.93,95122.85
stage1,256,2,7168,256,384,8,ActivationType.Silu,torch.bfloat16,torch.float4_e2m1fn_x2,torch.float4_e2m1fn_x2,QuantType.per_1x32,1,0,32,0,24.857,flydsl_moe1_afp4_wfp4_bf16_t16x32x256_w2_kb2,0.0%,7.09,85045.35
stage1,256,2,7168,256,384,8,ActivationType.Silu,torch.bfloat16,torch.float4_e2m1fn_x2,torch.float4_e2m1fn_x2,QuantType.per_1x32,1,0,32,0,22.4384,flydsl_moe1_afp4_wfp4_bf16_t16x32x256_w2_kb2_go,0.0%,7.85,94212.25
stage1,256,2,7168,256,384,8,ActivationType.Silu,torch.bfloat16,torch.float4_e2m1fn_x2,torch.float4_e2m1fn_x2,QuantType.per_1x32,1,0,32,0,15.9752,flydsl_moe1_afp4_wfp4_bf16_t16x32x256_w2_kb4_bnt0,0.0%,11.03,132328.37
stage1,256,2,7168,256,384,8,ActivationType.Silu,torch.bfloat16,torch.float4_e2m1fn_x2,torch.float4_e2m1fn_x2,QuantType.per_1x32,1,0,32,0,24.369,flydsl_moe1_afp4_wfp4_bf16_t16x32x256_w2_kb4_bnt0_go,0.0%,7.23,86748.42
stage1,256,2,7168,256,384,8,ActivationType.Silu,torch.bfloat16,torch.float4_e2m1fn_x2,torch.float4_e2m1fn_x2,QuantType.per_1x32,1,0,32,0,17.5043,flydsl_moe1_afp4_wfp4_bf16_t16x32x256_w2_kb4,0.0%,10.06,120768.74
stage1,256,2,7168,256,384,8,ActivationType.Silu,torch.bfloat16,torch.float4_e2m1fn_x2,torch.float4_e2m1fn_x2,QuantType.per_1x32,1,0,32,0,23.2888,flydsl_moe1_afp4_wfp4_bf16_t16x32x256_w2_kb4_go,0.0%,7.56,90772.05
stage1,256,2,7168,256,384,8,ActivationType.Silu,torch.bfloat16,torch.float4_e2m1fn_x2,torch.float4_e2m1fn_x2,QuantType.per_1x32,1,0,32,0,18.6434,flydsl_moe1_afp4_wfp4_bf16_t16x32x256_w2_kb7_bnt0,0.1%,9.45,113389.84
stage1,256,2,7168,256,384,8,ActivationType.Silu,torch.bfloat16,torch.float4_e2m1fn_x2,torch.float4_e2m1fn_x2,QuantType.per_1x32,1,0,32,0,24.3373,flydsl_moe1_afp4_wfp4_bf16_t16x32x256_w2_kb7_bnt0_go,0.1%,7.24,86861.41
stage1,256,2,7168,256,384,8,ActivationType.Silu,torch.bfloat16,torch.float4_e2m1fn_x2,torch.float4_e2m1fn_x2,QuantType.per_1x32,1,0,32,0,18.657,flydsl_moe1_afp4_wfp4_bf16_t16x32x256_w2_kb7,0.0%,9.44,113307.19
stage1,256,2,7168,256,384,8,ActivationType.Silu,torch.bfloat16,torch.float4_e2m1fn_x2,torch.float4_e2m1fn_x2,QuantType.per_1x32,1,0,32,0,25.6195,flydsl_moe1_afp4_wfp4_bf16_t16x32x256_w2_kb7_go,0.1%,6.88,82514.19
stage1,256,2,7168,256,384,8,ActivationType.Silu,torch.bfloat16,torch.float4_e2m1fn_x2,torch.float4_e2m1fn_x2,QuantType.per_1x32,1,0,32,0,27.4342,flydsl_moe1_afp4_wfp4_bf16_t16x32x256_w3_bnt0,0.0%,6.42,77056.09
stage1,256,2,7168,256,384,8,ActivationType.Silu,torch.bfloat16,torch.float4_e2m1fn_x2,torch.float4_e2m1fn_x2,QuantType.per_1x32,1,0,32,0,27.5697,flydsl_moe1_afp4_wfp4_bf16_t16x32x256_w3,0.0%,6.39,76677.37
stage1,256,2,7168,256,384,8,ActivationType.Silu,torch.bfloat16,torch.float4_e2m1fn_x2,torch.float4_e2m1fn_x2,QuantType.per_1x32,1,0,32,0,24.8961,flydsl_moe1_afp4_wfp4_bf16_t16x32x256_w3_kb2_bnt0,0.0%,7.08,84911.78
stage1,256,2,7168,256,384,8,ActivationType.Silu,torch.bfloat16,torch.float4_e2m1fn_x2,torch.float4_e2m1fn_x2,QuantType.per_1x32,1,0,32,0,21.5017,flydsl_moe1_afp4_wfp4_bf16_t16x32x256_w3_kb2_bnt0_go,0.0%,8.19,98316.52
stage1,256,2,7168,256,384,8,ActivationType.Silu,torch.bfloat16,torch.float4_e2m1fn_x2,torch.float4_e2m1fn_x2,QuantType.per_1x32,1,0,32,0,25.1488,flydsl_moe1_afp4_wfp4_bf16_t16x32x256_w3_kb2,0.0%,7.0,84058.57
stage1,256,2,7168,256,384,8,ActivationType.Silu,torch.bfloat16,torch.float4_e2m1fn_x2,torch.float4_e2m1fn_x2,QuantType.per_1x32,1,0,32,0,22.3986,flydsl_moe1_afp4_wfp4_bf16_t16x32x256_w3_kb2_go,0.0%,7.86,94379.66
stage1,256,2,7168,256,384,8,ActivationType.Silu,torch.bfloat16,torch.float4_e2m1fn_x2,torch.float4_e2m1fn_x2,QuantType.per_1x32,1,0,32,0,17.2676,flydsl_moe1_afp4_wfp4_bf16_t16x32x256_w3_kb4_bnt0,0.0%,10.2,122424.21
stage1,256,2,7168,256,384,8,ActivationType.Silu,torch.bfloat16,torch.float4_e2m1fn_x2,torch.float4_e2m1fn_x2,QuantType.per_1x32,1,0,32,0,23.0453,flydsl_moe1_afp4_wfp4_bf16_t16x32x256_w3_kb4_bnt0_go,0.0%,7.64,91731.17
stage1,256,2,7168,256,384,8,ActivationType.Silu,torch.bfloat16,torch.float4_e2m1fn_x2,torch.float4_e2m1fn_x2,QuantType.per_1x32,1,0,32,0,15.9736,flydsl_moe1_afp4_wfp4_bf16_t16x32x256_w3_kb4,0.0%,11.03,132341.63
stage1,256,2,7168,256,384,8,ActivationType.Silu,torch.bfloat16,torch.float4_e2m1fn_x2,torch.float4_e2m1fn_x2,QuantType.per_1x32,1,0,32,0,23.7403,flydsl_moe1_afp4_wfp4_bf16_t16x32x256_w3_kb4_go,0.0%,7.42,89045.72
stage1,256,2,7168,256,384,8,ActivationType.Silu,torch.bfloat16,torch.float4_e2m1fn_x2,torch.float4_e2m1fn_x2,QuantType.per_1x32,1,0,32,0,18.8106,flydsl_moe1_afp4_wfp4_bf16_t16x32x256_w3_kb7_bnt0,0.0%,9.36,112381.97
stage1,256,2,7168,256,384,8,ActivationType.Silu,torch.bfloat16,torch.float4_e2m1fn_x2,torch.float4_e2m1fn_x2,QuantType.per_1x32,1,0,32,0,18.0077,flydsl_moe1_afp4_wfp4_bf16_t16x32x256_w3_kb7_bnt0_go,0.1%,9.78,117392.68
stage1,256,2,7168,256,384,8,ActivationType.Silu,torch.bfloat16,torch.float4_e2m1fn_x2,torch.float4_e2m1fn_x2,QuantType.per_1x32,1,0,32,0,18.4346,flydsl_moe1_afp4_wfp4_bf16_t16x32x256_w3_kb7,0.0%,9.56,114674.16
stage1,256,2,7168,256,384,8,ActivationType.Silu,torch.bfloat16,torch.float4_e2m1fn_x2,torch.float4_e2m1fn_x2,QuantType.per_1x32,1,0,32,0,18.099,flydsl_moe1_afp4_wfp4_bf16_t16x32x256_w3_kb7_go,0.1%,9.73,116800.5
stage1,256,2,7168,256,384,8,ActivationType.Silu,torch.bfloat16,torch.float4_e2m1fn_x2,torch.float4_e2m1fn_x2,QuantType.per_1x32,1,0,32,0,27.9154,flydsl_moe1_afp4_wfp4_bf16_t16x32x256_w4_bnt0,0.0%,6.31,75727.81
stage1,256,2,7168,256,384,8,ActivationType.Silu,torch.bfloat16,torch.float4_e2m1fn_x2,torch.float4_e2m1fn_x2,QuantType.per_1x32,1,0,32,0,27.4441,flydsl_moe1_afp4_wfp4_bf16_t16x32x256_w4,0.0%,6.42,77028.29
stage1,256,2,7168,256,384,8,ActivationType.Silu,torch.bfloat16,torch.float4_e2m1fn_x2,torch.float4_e2m1fn_x2,QuantType.per_1x32,1,0,32,0,23.953,flydsl_moe1_afp4_wfp4_bf16_t16x32x256_w4_kb2_bnt0,0.0%,7.35,88255.01
stage1,256,2,7168,256,384,8,ActivationType.Silu,torch.bfloat16,torch.float4_e2m1fn_x2,torch.float4_e2m1fn_x2,QuantType.per_1x32,1,0,32,0,22.5581,flydsl_moe1_afp4_wfp4_bf16_t16x32x256_w4_kb2_bnt0_go,0.0%,7.81,93712.33
stage1,256,2,7168,256,384,8,ActivationType.Silu,torch.bfloat16,torch.float4_e2m1fn_x2,torch.float4_e2m1fn_x2,QuantType.per_1x32,1,0,32,0,24.8759,flydsl_moe1_afp4_wfp4_bf16_t16x32x256_w4_kb2,0.0%,7.08,84980.73
stage1,256,2,7168,256,384,8,ActivationType.Silu,torch.bfloat16,torch.float4_e2m1fn_x2,torch.float4_e2m1fn_x2,QuantType.per_1x32,1,0,32,0,21.5267,flydsl_moe1_afp4_wfp4_bf16_t16x32x256_w4_kb2_go,0.0%,8.18,98202.34
stage1,256,2,7168,256,384,8,ActivationType.Silu,torch.bfloat16,torch.float4_e2m1fn_x2,torch.float4_e2m1fn_x2,QuantType.per_1x32,1,0,32,0,17.0979,flydsl_moe1_afp4_wfp4_bf16_t16x32x256_w4_kb4_bnt0,0.0%,10.3,123639.29
stage1,256,2,7168,256,384,8,ActivationType.Silu,torch.bfloat16,torch.float4_e2m1fn_x2,torch.float4_e2m1fn_x2,QuantType.per_1x32,1,0,32,0,15.0223,flydsl_moe1_afp4_wfp4_bf16_t16x32x256_w4_kb4_bnt0_go,0.0%,11.73,140722.27
stage1,256,2,7168,256,384,8,ActivationType.Silu,torch.bfloat16,torch.float4_e2m1fn_x2,torch.float4_e2m1fn_x2,QuantType.per_1x32,1,0,32,0,17.288,flydsl_moe1_afp4_wfp4_bf16_t16x32x256_w4_kb4,0.0%,10.19,122279.74
stage1,256,2,7168,256,384,8,ActivationType.Silu,torch.bfloat16,torch.float4_e2m1fn_x2,torch.float4_e2m1fn_x2,QuantType.per_1x32,1,0,32,0,15.4506,flydsl_moe1_afp4_wfp4_bf16_t16x32x256_w4_kb4_go,0.0%,11.4,136821.37
stage1,256,2,7168,256,384,8,ActivationType.Silu,torch.bfloat16,torch.float4_e2m1fn_x2,torch.float4_e2m1fn_x2,QuantType.per_1x32,1,0,32,0,15.5369,flydsl_moe1_afp4_wfp4_bf16_t16x32x256_w4_kb7_bnt0,0.0%,11.34,136061.39
stage1,256,2,7168,256,384,8,ActivationType.Silu,torch.bfloat16,torch.float4_e2m1fn_x2,torch.float4_e2m1fn_x2,QuantType.per_1x32,1,0,32,0,16.2158,flydsl_moe1_afp4_wfp4_bf16_t16x32x256_w4_kb7_bnt0_go,0.1%,10.86,130364.97
stage1,256,2,7168,256,384,8,ActivationType.Silu,torch.bfloat16,torch.float4_e2m1fn_x2,torch.float4_e2m1fn_x2,QuantType.per_1x32,1,0,32,0,14.1316,flydsl_moe1_afp4_wfp4_bf16_t16x32x256_w4_kb7,0.0%,12.47,149591.85
stage1,256,2,7168,256,384,8,ActivationType.Silu,torch.bfloat16,torch.float4_e2m1fn_x2,torch.float4_e2m1fn_x2,QuantType.per_1x32,1,0,32,0,17.3401,flydsl_moe1_afp4_wfp4_bf16_t16x32x256_w4_kb7_go,0.1%,10.16,121912.34
stage1,256,2,7168,256,384,8,ActivationType.Silu,torch.bfloat16,torch.float4_e2m1fn_x2,torch.float4_e2m1fn_x2,QuantType.per_1x32,1,0,32,0,30.4629,flydsl_moe1_afp4_wfp4_bf16_t16x64x256_bnt0,0.0%,5.78,69394.98
stage1,256,2,7168,256,384,8,ActivationType.Silu,torch.bfloat16,torch.float4_e2m1fn_x2,torch.float4_e2m1fn_x2,QuantType.per_1x32,1,0,32,0,30.2148,flydsl_moe1_afp4_wfp4_bf16_t16x64x256,0.0%,5.83,69964.79
stage1,256,2,7168,256,384,8,ActivationType.Silu,torch.bfloat16,torch.float4_e2m1fn_x2,torch.float4_e2m1fn_x2,QuantType.per_1x32,1,0,32,0,24.4554,flydsl_moe1_afp4_wfp4_bf16_t16x64x256_kb2_bnt0,0.0%,7.2,86441.94
stage1,256,2,7168,256,384,8,ActivationType.Silu,torch.bfloat16,torch.float4_e2m1fn_x2,torch.float4_e2m1fn_x2,QuantType.per_1x32,1,0,32,0,19.5456,flydsl_moe1_afp4_wfp4_bf16_t16x64x256_kb2_bnt0_go,0.0%,9.01,108155.91
stage1,256,2,7168,256,384,8,ActivationType.Silu,torch.bfloat16,torch.float4_e2m1fn_x2,torch.float4_e2m1fn_x2,QuantType.per_1x32,1,0,32,0,25.3335,flydsl_moe1_afp4_wfp4_bf16_t16x64x256_kb2,0.0%,6.95,83445.72
stage1,256,2,7168,256,384,8,ActivationType.Silu,torch.bfloat16,torch.float4_e2m1fn_x2,torch.float4_e2m1fn_x2,QuantType.per_1x32,1,0,32,0,18.4472,flydsl_moe1_afp4_wfp4_bf16_t16x64x256_kb2_go,0.0%,9.55,114595.83
stage1,256,2,7168,256,384,8,ActivationType.Silu,torch.bfloat16,torch.float4_e2m1fn_x2,torch.float4_e2m1fn_x2,QuantType.per_1x32,1,0,32,0,15.5269,flydsl_moe1_afp4_wfp4_bf16_t16x64x256_kb4_bnt0,0.0%,11.35,136149.02
stage1,256,2,7168,256,384,8,ActivationType.Silu,torch.bfloat16,torch.float4_e2m1fn_x2,torch.float4_e2m1fn_x2,QuantType.per_1x32,1,0,32,0,24.4461,flydsl_moe1_afp4_wfp4_bf16_t16x64x256_kb4_bnt0_go,0.0%,7.21,86474.83
stage1,256,2,7168,256,384,8,ActivationType.Silu,torch.bfloat16,torch.float4_e2m1fn_x2,torch.float4_e2m1fn_x2,QuantType.per_1x32,1,0,32,0,16.7983,flydsl_moe1_afp4_wfp4_bf16_t16x64x256_kb4,0.0%,10.49,125844.41
stage1,256,2,7168,256,384,8,ActivationType.Silu,torch.bfloat16,torch.float4_e2m1fn_x2,torch.float4_e2m1fn_x2,QuantType.per_1x32,1,0,32,0,24.0839,flydsl_moe1_afp4_wfp4_bf16_t16x64x256_kb4_go,0.0%,7.31,87775.33
stage1,256,2,7168,256,384,8,ActivationType.Silu,torch.bfloat16,torch.float4_e2m1fn_x2,torch.float4_e2m1fn_x2,QuantType.per_1x32,1,0,32,0,18.6033,flydsl_moe1_afp4_wfp4_bf16_t16x64x256_kb7_bnt0,0.1%,9.47,113634.26
stage1,256,2,7168,256,384,8,ActivationType.Silu,torch.bfloat16,torch.float4_e2m1fn_x2,torch.float4_e2m1fn_x2,QuantType.per_1x32,1,0,32,0,24.2128,flydsl_moe1_afp4_wfp4_bf16_t16x64x256_kb7_bnt0_go,0.1%,7.28,87308.04
stage1,256,2,7168,256,384,8,ActivationType.Silu,torch.bfloat16,torch.float4_e2m1fn_x2,torch.float4_e2m1fn_x2,QuantType.per_1x32,1,0,32,0,18.7408,flydsl_moe1_afp4_wfp4_bf16_t16x64x256_kb7,0.0%,9.4,112800.53
stage1,256,2,7168,256,384,8,ActivationType.Silu,torch.bfloat16,torch.float4_e2m1fn_x2,torch.float4_e2m1fn_x2,QuantType.per_1x32,1,0,32,0,24.3785,flydsl_moe1_afp4_wfp4_bf16_t16x64x256_kb7_go,0.1%,7.23,86714.61
stage1,256,2,7168,256,384,8,ActivationType.Silu,torch.bfloat16,torch.float4_e2m1fn_x2,torch.float4_e2m1fn_x2,QuantType.per_1x32,1,0,32,0,30.4717,flydsl_moe1_afp4_wfp4_bf16_t16x64x256_w2_bnt0,0.0%,5.78,69374.94
stage1,256,2,7168,256,384,8,ActivationType.Silu,torch.bfloat16,torch.float4_e2m1fn_x2,torch.float4_e2m1fn_x2,QuantType.per_1x32,1,0,32,0,30.1449,flydsl_moe1_afp4_wfp4_bf16_t16x64x256_w2,0.0%,5.84,70127.03
stage1,256,2,7168,256,384,8,ActivationType.Silu,torch.bfloat16,torch.float4_e2m1fn_x2,torch.float4_e2m1fn_x2,QuantType.per_1x32,1,0,32,0,25.3932,flydsl_moe1_afp4_wfp4_bf16_t16x64x256_w2_kb2_bnt0,0.0%,6.94,83249.54
stage1,256,2,7168,256,384,8,ActivationType.Silu,torch.bfloat16,torch.float4_e2m1fn_x2,torch.float4_e2m1fn_x2,QuantType.per_1x32,1,0,32,0,20.2669,flydsl_moe1_afp4_wfp4_bf16_t16x64x256_w2_kb2_bnt0_go,0.0%,8.69,104306.64
stage1,256,2,7168,256,384,8,ActivationType.Silu,torch.bfloat16,torch.float4_e2m1fn_x2,torch.float4_e2m1fn_x2,QuantType.per_1x32,1,0,32,0,24.3525,flydsl_moe1_afp4_wfp4_bf16_t16x64x256_w2_kb2,0.0%,7.23,86807.2
stage1,256,2,7168,256,384,8,ActivationType.Silu,torch.bfloat16,torch.float4_e2m1fn_x2,torch.float4_e2m1fn_x2,QuantType.per_1x32,1,0,32,0,21.2856,flydsl_moe1_afp4_wfp4_bf16_t16x64x256_w2_kb2_go,0.0%,8.28,99314.66
stage1,256,2,7168,256,384,8,ActivationType.Silu,torch.bfloat16,torch.float4_e2m1fn_x2,torch.float4_e2m1fn_x2,QuantType.per_1x32,1,0,32,0,17.185,flydsl_moe1_afp4_wfp4_bf16_t16x64x256_w2_kb4_bnt0,0.0%,10.25,123012.64
stage1,256,2,7168,256,384,8,ActivationType.Silu,torch.bfloat16,torch.float4_e2m1fn_x2,torch.float4_e2m1fn_x2,QuantType.per_1x32,1,0,32,0,15.7776,flydsl_moe1_afp4_wfp4_bf16_t16x64x256_w2_kb4_bnt0_go,0.0%,11.17,133985.66
stage1,256,2,7168,256,384,8,ActivationType.Silu,torch.bfloat16,torch.float4_e2m1fn_x2,torch.float4_e2m1fn_x2,QuantType.per_1x32,1,0,32,0,15.4732,flydsl_moe1_afp4_wfp4_bf16_t16x64x256_w2_kb4,0.0%,11.38,136621.53
stage1,256,2,7168,256,384,8,ActivationType.Silu,torch.bfloat16,torch.float4_e2m1fn_x2,torch.float4_e2m1fn_x2,QuantType.per_1x32,1,0,32,0,16.1279,flydsl_moe1_afp4_wfp4_bf16_t16x64x256_w2_kb4_go,0.0%,10.92,131075.48
stage1,256,2,7168,256,384,8,ActivationType.Silu,torch.bfloat16,torch.float4_e2m1fn_x2,torch.float4_e2m1fn_x2,QuantType.per_1x32,1,0,32,0,13.9612,flydsl_moe1_afp4_wfp4_bf16_t16x64x256_w2_kb7_bnt0,0.0%,12.62,151417.66
stage1,256,2,7168,256,384,8,ActivationType.Silu,torch.bfloat16,torch.float4_e2m1fn_x2,torch.float4_e2m1fn_x2,QuantType.per_1x32,1,0,32,0,16.3423,flydsl_moe1_afp4_wfp4_bf16_t16x64x256_w2_kb7_bnt0_go,0.0%,10.78,129355.86
stage1,256,2,7168,256,384,8,ActivationType.Silu,torch.bfloat16,torch.float4_e2m1fn_x2,torch.float4_e2m1fn_x2,QuantType.per_1x32,1,0,32,0,15.3047,flydsl_moe1_afp4_wfp4_bf16_t16x64x256_w2_kb7,0.1%,11.51,138125.69
stage1,256,2,7168,256,384,8,ActivationType.Silu,torch.bfloat16,torch.float4_e2m1fn_x2,torch.float4_e2m1fn_x2,QuantType.per_1x32,1,0,32,0,17.4683,flydsl_moe1_afp4_wfp4_bf16_t16x64x256_w2_kb7_go,0.1%,10.08,121017.63
stage1,256,2,7168,256,384,8,ActivationType.Silu,torch.bfloat16,torch.float4_e2m1fn_x2,torch.float4_e2m1fn_x2,QuantType.per_1x32,1,0,32,0,30.1702,flydsl_moe1_afp4_wfp4_bf16_t16x64x256_w3_bnt0,0.0%,5.84,70068.22
stage1,256,2,7168,256,384,8,ActivationType.Silu,torch.bfloat16,torch.float4_e2m1fn_x2,torch.float4_e2m1fn_x2,QuantType.per_1x32,1,0,32,0,30.3889,flydsl_moe1_afp4_wfp4_bf16_t16x64x256_w3,0.0%,5.8,69563.96
stage1,256,2,7168,256,384,8,ActivationType.Silu,torch.bfloat16,torch.float4_e2m1fn_x2,torch.float4_e2m1fn_x2,QuantType.per_1x32,1,0,32,0,25.4698,flydsl_moe1_afp4_wfp4_bf16_t16x64x256_w3_kb2_bnt0,0.0%,6.92,82999.17
stage1,256,2,7168,256,384,8,ActivationType.Silu,torch.bfloat16,torch.float4_e2m1fn_x2,torch.float4_e2m1fn_x2,QuantType.per_1x32,1,0,32,0,18.6076,flydsl_moe1_afp4_wfp4_bf16_t16x64x256_w3_kb2_bnt0_go,0.0%,9.47,113608.0
stage1,256,2,7168,256,384,8,ActivationType.Silu,torch.bfloat16,torch.float4_e2m1fn_x2,torch.float4_e2m1fn_x2,QuantType.per_1x32,1,0,32,0,24.4295,flydsl_moe1_afp4_wfp4_bf16_t16x64x256_w3_kb2,0.0%,7.21,86533.59
stage1,256,2,7168,256,384,8,ActivationType.Silu,torch.bfloat16,torch.float4_e2m1fn_x2,torch.float4_e2m1fn_x2,QuantType.per_1x32,1,0,32,0,20.8564,flydsl_moe1_afp4_wfp4_bf16_t16x64x256_w3_kb2_go,0.0%,8.45,101358.44
stage1,256,2,7168,256,384,8,ActivationType.Silu,torch.bfloat16,torch.float4_e2m1fn_x2,torch.float4_e2m1fn_x2,QuantType.per_1x32,1,0,32,0,15.3921,flydsl_moe1_afp4_wfp4_bf16_t16x64x256_w3_kb4_bnt0,0.0%,11.44,137341.38
stage1,256,2,7168,256,384,8,ActivationType.Silu,torch.bfloat16,torch.float4_e2m1fn_x2,torch.float4_e2m1fn_x2,QuantType.per_1x32,1,0,32,0,16.6054,flydsl_moe1_afp4_wfp4_bf16_t16x64x256_w3_kb4_bnt0_go,0.0%,10.61,127306.31
stage1,256,2,7168,256,384,8,ActivationType.Silu,torch.bfloat16,torch.float4_e2m1fn_x2,torch.float4_e2m1fn_x2,QuantType.per_1x32,1,0,32,0,17.2677,flydsl_moe1_afp4_wfp4_bf16_t16x64x256_w3_kb4,0.0%,10.2,122423.5
stage1,256,2,7168,256,384,8,ActivationType.Silu,torch.bfloat16,torch.float4_e2m1fn_x2,torch.float4_e2m1fn_x2,QuantType.per_1x32,1,0,32,0,15.0346,flydsl_moe1_afp4_wfp4_bf16_t16x64x256_w3_kb4_go,0.0%,11.72,140607.15
stage1,256,2,7168,256,384,8,ActivationType.Silu,torch.bfloat16,torch.float4_e2m1fn_x2,torch.float4_e2m1fn_x2,QuantType.per_1x32,1,0,32,0,15.261,flydsl_moe1_afp4_wfp4_bf16_t16x64x256_w3_kb7_bnt0,0.0%,11.54,138521.21
stage1,256,2,7168,256,384,8,ActivationType.Silu,torch.bfloat16,torch.float4_e2m1fn_x2,torch.float4_e2m1fn_x2,QuantType.per_1x32,1,0,32,0,16.6583,flydsl_moe1_afp4_wfp4_bf16_t16x64x256_w3_kb7_bnt0_go,0.0%,10.57,126902.04
stage1,256,2,7168,256,384,8,ActivationType.Silu,torch.bfloat16,torch.float4_e2m1fn_x2,torch.float4_e2m1fn_x2,QuantType.per_1x32,1,0,32,0,13.979,flydsl_moe1_afp4_wfp4_bf16_t16x64x256_w3_kb7,0.0%,12.6,151224.85
stage1,256,2,7168,256,384,8,ActivationType.Silu,torch.bfloat16,torch.float4_e2m1fn_x2,torch.float4_e2m1fn_x2,QuantType.per_1x32,1,0,32,0,17.9037,flydsl_moe1_afp4_wfp4_bf16_t16x64x256_w3_kb7_go,0.0%,9.84,118074.6
stage1,256,2,7168,256,384,8,ActivationType.Silu,torch.bfloat16,torch.float4_e2m1fn_x2,torch.float4_e2m1fn_x2,QuantType.per_1x32,1,0,32,0,30.3968,flydsl_moe1_afp4_wfp4_bf16_t16x64x256_w4_bnt0,0.0%,5.8,69545.88
stage1,256,2,7168,256,384,8,ActivationType.Silu,torch.bfloat16,torch.float4_e2m1fn_x2,torch.float4_e2m1fn_x2,QuantType.per_1x32,1,0,32,0,30.0061,flydsl_moe1_afp4_wfp4_bf16_t16x64x256_w4,0.0%,5.87,70451.42
stage1,256,2,7168,256,384,8,ActivationType.Silu,torch.bfloat16,torch.float4_e2m1fn_x2,torch.float4_e2m1fn_x2,QuantType.per_1x32,1,0,32,0,24.4068,flydsl_moe1_afp4_wfp4_bf16_t16x64x256_w4_kb2_bnt0,0.0%,7.22,86614.07
stage1,256,2,7168,256,384,8,ActivationType.Silu,torch.bfloat16,torch.float4_e2m1fn_x2,torch.float4_e2m1fn_x2,QuantType.per_1x32,1,0,32,0,21.6007,flydsl_moe1_afp4_wfp4_bf16_t16x64x256_w4_kb2_bnt0_go,0.0%,8.16,97865.91
stage1,256,2,7168,256,384,8,ActivationType.Silu,torch.bfloat16,torch.float4_e2m1fn_x2,torch.float4_e2m1fn_x2,QuantType.per_1x32,1,0,32,0,25.8519,flydsl_moe1_afp4_wfp4_bf16_t16x64x256_w4_kb2,0.0%,6.81,81772.41
stage1,256,2,7168,256,384,8,ActivationType.Silu,torch.bfloat16,torch.float4_e2m1fn_x2,torch.float4_e2m1fn_x2,QuantType.per_1x32,1,0,32,0,19.6827,flydsl_moe1_afp4_wfp4_bf16_t16x64x256_w4_kb2_go,0.0%,8.95,107402.55
stage1,256,2,7168,256,384,8,ActivationType.Silu,torch.bfloat16,torch.float4_e2m1fn_x2,torch.float4_e2m1fn_x2,QuantType.per_1x32,1,0,32,0,15.9983,flydsl_moe1_afp4_wfp4_bf16_t16x64x256_w4_kb4_bnt0,0.0%,11.01,132137.3
stage1,256,2,7168,256,384,8,ActivationType.Silu,torch.bfloat16,torch.float4_e2m1fn_x2,torch.float4_e2m1fn_x2,QuantType.per_1x32,1,0,32,0,16.3612,flydsl_moe1_afp4_wfp4_bf16_t16x64x256_w4_kb4_bnt0_go,0.0%,10.77,129206.43
stage1,256,2,7168,256,384,8,ActivationType.Silu,torch.bfloat16,torch.float4_e2m1fn_x2,torch.float4_e2m1fn_x2,QuantType.per_1x32,1,0,32,0,17.0284,flydsl_moe1_afp4_wfp4_bf16_t16x64x256_w4_kb4,0.0%,10.35,124143.91
stage1,256,2,7168,256,384,8,ActivationType.Silu,torch.bfloat16,torch.float4_e2m1fn_x2,torch.float4_e2m1fn_x2,QuantType.per_1x32,1,0,32,0,14.9264,flydsl_moe1_afp4_wfp4_bf16_t16x64x256_w4_kb4_go,0.0%,11.8,141626.4
stage1,256,2,7168,256,384,8,ActivationType.Silu,torch.bfloat16,torch.float4_e2m1fn_x2,torch.float4_e2m1fn_x2,QuantType.per_1x32,1,0,32,0,14.1431,flydsl_moe1_afp4_wfp4_bf16_t16x64x256_w4_kb7_bnt0,0.0%,12.46,149470.22
stage1,256,2,7168,256,384,8,ActivationType.Silu,torch.bfloat16,torch.float4_e2m1fn_x2,torch.float4_e2m1fn_x2,QuantType.per_1x32,1,0,32,0,14.5127,flydsl_moe1_afp4_wfp4_bf16_t16x64x256_w4_kb7_bnt0_go,0.0%,12.14,145663.61
stage1,256,2,7168,256,384,8,ActivationType.Silu,torch.bfloat16,torch.float4_e2m1fn_x2,torch.float4_e2m1fn_x2,QuantType.per_1x32,1,0,32,0,15.1274,flydsl_moe1_afp4_wfp4_bf16_t16x64x256_w4_kb7,0.0%,11.65,139744.58
stage1,256,2,7168,256,384,8,ActivationType.Silu,torch.bfloat16,torch.float4_e2m1fn_x2,torch.float4_e2m1fn_x2,QuantType.per_1x32,1,0,32,0,13.1815,flydsl_moe1_afp4_wfp4_bf16_t16x64x256_w4_kb7_go,0.0%,13.36,160374.18
stage1,256,2,7168,256,384,8,ActivationType.Silu,torch.bfloat16,torch.float4_e2m1fn_x2,torch.float4_e2m1fn_x2,QuantType.per_1x32,1,0,32,0,35.4449,flydsl_moe1_afp4_wfp4_bf16_t16x128x256_bnt0,0.0%,4.97,59641.08
stage1,256,2,7168,256,384,8,ActivationType.Silu,torch.bfloat16,torch.float4_e2m1fn_x2,torch.float4_e2m1fn_x2,QuantType.per_1x32,1,0,32,0,34.8349,flydsl_moe1_afp4_wfp4_bf16_t16x128x256,0.0%,5.06,60685.47
stage1,256,2,7168,256,384,8,ActivationType.Silu,torch.bfloat16,torch.float4_e2m1fn_x2,torch.float4_e2m1fn_x2,QuantType.per_1x32,1,0,32,0,26.7807,flydsl_moe1_afp4_wfp4_bf16_t16x128x256_kb2_bnt0,0.0%,6.58,78936.41
stage1,256,2,7168,256,384,8,ActivationType.Silu,torch.bfloat16,torch.float4_e2m1fn_x2,torch.float4_e2m1fn_x2,QuantType.per_1x32,1,0,32,0,22.9336,flydsl_moe1_afp4_wfp4_bf16_t16x128x256_kb2_bnt0_go,0.0%,7.68,92177.95
stage1,256,2,7168,256,384,8,ActivationType.Silu,torch.bfloat16,torch.float4_e2m1fn_x2,torch.float4_e2m1fn_x2,QuantType.per_1x32,1,0,32,0,26.3027,flydsl_moe1_afp4_wfp4_bf16_t16x128x256_kb2,0.0%,6.7,80370.92
stage1,256,2,7168,256,384,8,ActivationType.Silu,torch.bfloat16,torch.float4_e2m1fn_x2,torch.float4_e2m1fn_x2,QuantType.per_1x32,1,0,32,0,24.9296,flydsl_moe1_afp4_wfp4_bf16_t16x128x256_kb2_go,0.0%,7.07,84797.68
stage1,256,2,7168,256,384,8,ActivationType.Silu,torch.bfloat16,torch.float4_e2m1fn_x2,torch.float4_e2m1fn_x2,QuantType.per_1x32,1,0,32,0,18.0216,flydsl_moe1_afp4_wfp4_bf16_t16x128x256_kb4_bnt0,0.0%,9.77,117302.14
stage1,256,2,7168,256,384,8,ActivationType.Silu,torch.bfloat16,torch.float4_e2m1fn_x2,torch.float4_e2m1fn_x2,QuantType.per_1x32,1,0,32,0,15.2145,flydsl_moe1_afp4_wfp4_bf16_t16x128x256_kb4_bnt0_go,0.0%,11.58,138944.57
stage1,256,2,7168,256,384,8,ActivationType.Silu,torch.bfloat16,torch.float4_e2m1fn_x2,torch.float4_e2m1fn_x2,QuantType.per_1x32,1,0,32,0,16.9034,flydsl_moe1_afp4_wfp4_bf16_t16x128x256_kb4,0.0%,10.42,125061.95
stage1,256,2,7168,256,384,8,ActivationType.Silu,torch.bfloat16,torch.float4_e2m1fn_x2,torch.float4_e2m1fn_x2,QuantType.per_1x32,1,0,32,0,16.8859,flydsl_moe1_afp4_wfp4_bf16_t16x128x256_kb4_go,0.0%,10.43,125191.56
stage1,256,2,7168,256,384,8,ActivationType.Silu,torch.bfloat16,torch.float4_e2m1fn_x2,torch.float4_e2m1fn_x2,QuantType.per_1x32,1,0,32,0,15.1123,flydsl_moe1_afp4_wfp4_bf16_t16x128x256_kb7_bnt0,0.1%,11.66,139884.22
stage1,256,2,7168,256,384,8,ActivationType.Silu,torch.bfloat16,torch.float4_e2m1fn_x2,torch.float4_e2m1fn_x2,QuantType.per_1x32,1,0,32,0,16.7572,flydsl_moe1_afp4_wfp4_bf16_t16x128x256_kb7_bnt0_go,0.1%,10.51,126153.07
stage1,256,2,7168,256,384,8,ActivationType.Silu,torch.bfloat16,torch.float4_e2m1fn_x2,torch.float4_e2m1fn_x2,QuantType.per_1x32,1,0,32,0,14.0451,flydsl_moe1_afp4_wfp4_bf16_t16x128x256_kb7,0.1%,12.54,150513.15
stage1,256,2,7168,256,384,8,ActivationType.Silu,torch.bfloat16,torch.float4_e2m1fn_x2,torch.float4_e2m1fn_x2,QuantType.per_1x32,1,0,32,0,17.9845,flydsl_moe1_afp4_wfp4_bf16_t16x128x256_kb7_go,0.0%,9.8,117544.12
stage1,256,2,7168,256,384,8,ActivationType.Silu,torch.bfloat16,torch.float4_e2m1fn_x2,torch.float4_e2m1fn_x2,QuantType.per_1x32,1,0,32,0,35.1106,flydsl_moe1_afp4_wfp4_bf16_t16x128x256_w2_bnt0,0.0%,5.02,60208.95
stage1,256,2,7168,256,384,8,ActivationType.Silu,torch.bfloat16,torch.float4_e2m1fn_x2,torch.float4_e2m1fn_x2,QuantType.per_1x32,1,0,32,0,35.0281,flydsl_moe1_afp4_wfp4_bf16_t16x128x256_w2,0.0%,5.03,60350.75
stage1,256,2,7168,256,384,8,ActivationType.Silu,torch.bfloat16,torch.float4_e2m1fn_x2,torch.float4_e2m1fn_x2,QuantType.per_1x32,1,0,32,0,26.8003,flydsl_moe1_afp4_wfp4_bf16_t16x128x256_w2_kb2_bnt0,0.0%,6.57,78878.68
stage1,256,2,7168,256,384,8,ActivationType.Silu,torch.bfloat16,torch.float4_e2m1fn_x2,torch.float4_e2m1fn_x2,QuantType.per_1x32,1,0,32,0,25.5293,flydsl_moe1_afp4_wfp4_bf16_t16x128x256_w2_kb2_bnt0_go,0.0%,6.9,82805.73
stage1,256,2,7168,256,384,8,ActivationType.Silu,torch.bfloat16,torch.float4_e2m1fn_x2,torch.float4_e2m1fn_x2,QuantType.per_1x32,1,0,32,0,26.3202,flydsl_moe1_afp4_wfp4_bf16_t16x128x256_w2_kb2,0.0%,6.69,80317.48
stage1,256,2,7168,256,384,8,ActivationType.Silu,torch.bfloat16,torch.float4_e2m1fn_x2,torch.float4_e2m1fn_x2,QuantType.per_1x32,1,0,32,0,24.0039,flydsl_moe1_afp4_wfp4_bf16_t16x128x256_w2_kb2_go,0.0%,7.34,88067.86
stage1,256,2,7168,256,384,8,ActivationType.Silu,torch.bfloat16,torch.float4_e2m1fn_x2,torch.float4_e2m1fn_x2,QuantType.per_1x32,1,0,32,0,17.9188,flydsl_moe1_afp4_wfp4_bf16_t16x128x256_w2_kb4_bnt0,0.0%,9.83,117975.1
stage1,256,2,7168,256,384,8,ActivationType.Silu,torch.bfloat16,torch.float4_e2m1fn_x2,torch.float4_e2m1fn_x2,QuantType.per_1x32,1,0,32,0,16.3495,flydsl_moe1_afp4_wfp4_bf16_t16x128x256_w2_kb4_bnt0_go,0.0%,10.77,129298.89
stage1,256,2,7168,256,384,8,ActivationType.Silu,torch.bfloat16,torch.float4_e2m1fn_x2,torch.float4_e2m1fn_x2,QuantType.per_1x32,1,0,32,0,16.6222,flydsl_moe1_afp4_wfp4_bf16_t16x128x256_w2_kb4,0.0%,10.6,127177.64
stage1,256,2,7168,256,384,8,ActivationType.Silu,torch.bfloat16,torch.float4_e2m1fn_x2,torch.float4_e2m1fn_x2,QuantType.per_1x32,1,0,32,0,16.4817,flydsl_moe1_afp4_wfp4_bf16_t16x128x256_w2_kb4_go,0.0%,10.69,128261.78
stage1,256,2,7168,256,384,8,ActivationType.Silu,torch.bfloat16,torch.float4_e2m1fn_x2,torch.float4_e2m1fn_x2,QuantType.per_1x32,1,0,32,0,14.0495,flydsl_moe1_afp4_wfp4_bf16_t16x128x256_w2_kb7_bnt0,0.0%,12.54,150466.01
stage1,256,2,7168,256,384,8,ActivationType.Silu,torch.bfloat16,torch.float4_e2m1fn_x2,torch.float4_e2m1fn_x2,QuantType.per_1x32,1,0,32,0,14.7187,flydsl_moe1_afp4_wfp4_bf16_t16x128x256_w2_kb7_bnt0_go,0.1%,11.97,143624.93
stage1,256,2,7168,256,384,8,ActivationType.Silu,torch.bfloat16,torch.float4_e2m1fn_x2,torch.float4_e2m1fn_x2,QuantType.per_1x32,1,0,32,0,15.3897,flydsl_moe1_afp4_wfp4_bf16_t16x128x256_w2_kb7,0.0%,11.45,137362.8
stage1,256,2,7168,256,384,8,ActivationType.Silu,torch.bfloat16,torch.float4_e2m1fn_x2,torch.float4_e2m1fn_x2,QuantType.per_1x32,1,0,32,0,13.4403,flydsl_moe1_afp4_wfp4_bf16_t16x128x256_w2_kb7_go,0.1%,13.11,157286.09
stage1,256,2,7168,256,384,8,ActivationType.Silu,torch.bfloat16,torch.float4_e2m1fn_x2,torch.float4_e2m1fn_x2,QuantType.per_1x32,1,0,32,0,35.1029,flydsl_moe1_afp4_wfp4_bf16_t16x128x256_w3_bnt0,0.0%,5.02,60222.15
stage1,256,2,7168,256,384,8,ActivationType.Silu,torch.bfloat16,torch.float4_e2m1fn_x2,torch.float4_e2m1fn_x2,QuantType.per_1x32,1,0,32,0,35.5049,flydsl_moe1_afp4_wfp4_bf16_t16x128x256_w3,0.0%,4.96,59540.3
stage1,256,2,7168,256,384,8,ActivationType.Silu,torch.bfloat16,torch.float4_e2m1fn_x2,torch.float4_e2m1fn_x2,QuantType.per_1x32,1,0,32,0,26.7781,flydsl_moe1_afp4_wfp4_bf16_t16x128x256_w3_kb2_bnt0,0.0%,6.58,78944.07
stage1,256,2,7168,256,384,8,ActivationType.Silu,torch.bfloat16,torch.float4_e2m1fn_x2,torch.float4_e2m1fn_x2,QuantType.per_1x32,1,0,32,0,24.0706,flydsl_moe1_afp4_wfp4_bf16_t16x128x256_w3_kb2_bnt0_go,0.0%,7.32,87823.83
stage1,256,2,7168,256,384,8,ActivationType.Silu,torch.bfloat16,torch.float4_e2m1fn_x2,torch.float4_e2m1fn_x2,QuantType.per_1x32,1,0,32,0,26.3611,flydsl_moe1_afp4_wfp4_bf16_t16x128x256_w3_kb2,0.0%,6.68,80192.87
stage1,256,2,7168,256,384,8,ActivationType.Silu,torch.bfloat16,torch.float4_e2m1fn_x2,torch.float4_e2m1fn_x2,QuantType.per_1x32,1,0,32,0,25.5601,flydsl_moe1_afp4_wfp4_bf16_t16x128x256_w3_kb2_go,0.0%,6.89,82705.94
stage1,256,2,7168,256,384,8,ActivationType.Silu,torch.bfloat16,torch.float4_e2m1fn_x2,torch.float4_e2m1fn_x2,QuantType.per_1x32,1,0,32,0,17.8804,flydsl_moe1_afp4_wfp4_bf16_t16x128x256_w3_kb4_bnt0,0.0%,9.85,118228.46
stage1,256,2,7168,256,384,8,ActivationType.Silu,torch.bfloat16,torch.float4_e2m1fn_x2,torch.float4_e2m1fn_x2,QuantType.per_1x32,1,0,32,0,15.6586,flydsl_moe1_afp4_wfp4_bf16_t16x128x256_w3_kb4_bnt0_go,0.0%,11.25,135003.91
stage1,256,2,7168,256,384,8,ActivationType.Silu,torch.bfloat16,torch.float4_e2m1fn_x2,torch.float4_e2m1fn_x2,QuantType.per_1x32,1,0,32,0,16.694,flydsl_moe1_afp4_wfp4_bf16_t16x128x256_w3_kb4,0.0%,10.55,126630.66
stage1,256,2,7168,256,384,8,ActivationType.Silu,torch.bfloat16,torch.float4_e2m1fn_x2,torch.float4_e2m1fn_x2,QuantType.per_1x32,1,0,32,0,17.1963,flydsl_moe1_afp4_wfp4_bf16_t16x128x256_w3_kb4_go,0.0%,10.24,122931.81
stage1,256,2,7168,256,384,8,ActivationType.Silu,torch.bfloat16,torch.float4_e2m1fn_x2,torch.float4_e2m1fn_x2,QuantType.per_1x32,1,0,32,0,15.3131,flydsl_moe1_afp4_wfp4_bf16_t16x128x256_w3_kb7_bnt0,0.0%,11.5,138049.92
stage1,256,2,7168,256,384,8,ActivationType.Silu,torch.bfloat16,torch.float4_e2m1fn_x2,torch.float4_e2m1fn_x2,QuantType.per_1x32,1,0,32,0,14.9616,flydsl_moe1_afp4_wfp4_bf16_t16x128x256_w3_kb7_bnt0_go,0.0%,11.77,141293.19
stage1,256,2,7168,256,384,8,ActivationType.Silu,torch.bfloat16,torch.float4_e2m1fn_x2,torch.float4_e2m1fn_x2,QuantType.per_1x32,1,0,32,0,14.0261,flydsl_moe1_afp4_wfp4_bf16_t16x128x256_w3_kb7,0.0%,12.56,150717.04
stage1,256,2,7168,256,384,8,ActivationType.Silu,torch.bfloat16,torch.float4_e2m1fn_x2,torch.float4_e2m1fn_x2,QuantType.per_1x32,1,0,32,0,13.6103,flydsl_moe1_afp4_wfp4_bf16_t16x128x256_w3_kb7_go,0.0%,12.94,155321.5
stage1,256,2,7168,256,384,8,ActivationType.Silu,torch.bfloat16,torch.float4_e2m1fn_x2,torch.float4_e2m1fn_x2,QuantType.per_1x32,1,0,32,0,35.3737,flydsl_moe1_afp4_wfp4_bf16_t16x128x256_w4_bnt0,0.0%,4.98,59761.13
stage1,256,2,7168,256,384,8,ActivationType.Silu,torch.bfloat16,torch.float4_e2m1fn_x2,torch.float4_e2m1fn_x2,QuantType.per_1x32,1,0,32,0,35.0725,flydsl_moe1_afp4_wfp4_bf16_t16x128x256_w4,0.0%,5.02,60274.35
stage1,256,2,7168,256,384,8,ActivationType.Silu,torch.bfloat16,torch.float4_e2m1fn_x2,torch.float4_e2m1fn_x2,QuantType.per_1x32,1,0,32,0,26.845,flydsl_moe1_afp4_wfp4_bf16_t16x128x256_w4_kb2_bnt0,0.0%,6.56,78747.34
stage1,256,2,7168,256,384,8,ActivationType.Silu,torch.bfloat16,torch.float4_e2m1fn_x2,torch.float4_e2m1fn_x2,QuantType.per_1x32,1,0,32,0,26.0021,flydsl_moe1_afp4_wfp4_bf16_t16x128x256_w4_kb2_bnt0_go,0.0%,6.77,81300.06
stage1,256,2,7168,256,384,8,ActivationType.Silu,torch.bfloat16,torch.float4_e2m1fn_x2,torch.float4_e2m1fn_x2,QuantType.per_1x32,1,0,32,0,26.3276,flydsl_moe1_afp4_wfp4_bf16_t16x128x256_w4_kb2,0.0%,6.69,80294.91
stage1,256,2,7168,256,384,8,ActivationType.Silu,torch.bfloat16,torch.float4_e2m1fn_x2,torch.float4_e2m1fn_x2,QuantType.per_1x32,1,0,32,0,24.2454,flydsl_moe1_afp4_wfp4_bf16_t16x128x256_w4_kb2_go,0.0%,7.27,87190.65
stage1,256,2,7168,256,384,8,ActivationType.Silu,torch.bfloat16,torch.float4_e2m1fn_x2,torch.float4_e2m1fn_x2,QuantType.per_1x32,1,0,32,0,18.07,flydsl_moe1_afp4_wfp4_bf16_t16x128x256_w4_kb4_bnt0,0.0%,9.75,116987.95
stage1,256,2,7168,256,384,8,ActivationType.Silu,torch.bfloat16,torch.float4_e2m1fn_x2,torch.float4_e2m1fn_x2,QuantType.per_1x32,1,0,32,0,16.5276,flydsl_moe1_afp4_wfp4_bf16_t16x128x256_w4_kb4_bnt0_go,0.0%,10.66,127905.58
stage1,256,2,7168,256,384,8,ActivationType.Silu,torch.bfloat16,torch.float4_e2m1fn_x2,torch.float4_e2m1fn_x2,QuantType.per_1x32,1,0,32,0,16.6668,flydsl_moe1_afp4_wfp4_bf16_t16x128x256_w4_kb4,0.0%,10.57,126837.32
stage1,256,2,7168,256,384,8,ActivationType.Silu,torch.bfloat16,torch.float4_e2m1fn_x2,torch.float4_e2m1fn_x2,QuantType.per_1x32,1,0,32,0,15.1859,flydsl_moe1_afp4_wfp4_bf16_t16x128x256_w4_kb4_go,0.0%,11.6,139206.25
stage1,256,2,7168,256,384,8,ActivationType.Silu,torch.bfloat16,torch.float4_e2m1fn_x2,torch.float4_e2m1fn_x2,QuantType.per_1x32,1,0,32,0,15.4673,flydsl_moe1_afp4_wfp4_bf16_t16x128x256_w4_kb7_bnt0,0.0%,11.39,136673.64
stage1,256,2,7168,256,384,8,ActivationType.Silu,torch.bfloat16,torch.float4_e2m1fn_x2,torch.float4_e2m1fn_x2,QuantType.per_1x32,1,0,32,0,14.6516,flydsl_moe1_afp4_wfp4_bf16_t16x128x256_w4_kb7_bnt0_go,0.0%,12.02,144282.69
stage1,256,2,7168,256,384,8,ActivationType.Silu,torch.bfloat16,torch.float4_e2m1fn_x2,torch.float4_e2m1fn_x2,QuantType.per_1x32,1,0,32,0,14.1088,flydsl_moe1_afp4_wfp4_bf16_t16x128x256_w4_kb7,0.0%,12.49,149833.59
stage1,256,2,7168,256,384,8,ActivationType.Silu,torch.bfloat16,torch.float4_e2m1fn_x2,torch.float4_e2m1fn_x2,QuantType.per_1x32,1,0,32,0,13.9422,flydsl_moe1_afp4_wfp4_bf16_t16x128x256_w4_kb7_go,0.0%,12.64,151624.01
stage1,256,2,7168,256,384,8,ActivationType.Silu,torch.bfloat16,torch.float4_e2m1fn_x2,torch.float4_e2m1fn_x2,QuantType.per_1x32,1,0,32,0,23.0379,flydsl_moe1_afp4_wfp4_bf16_t32x32x256_bnt0,0.0%,7.65,91760.63
stage1,256,2,7168,256,384,8,ActivationType.Silu,torch.bfloat16,torch.float4_e2m1fn_x2,torch.float4_e2m1fn_x2,QuantType.per_1x32,1,0,32,0,22.6552,flydsl_moe1_afp4_wfp4_bf16_t32x32x256,0.0%,7.78,93310.68
stage1,256,2,7168,256,384,8,ActivationType.Silu,torch.bfloat16,torch.float4_e2m1fn_x2,torch.float4_e2m1fn_x2,QuantType.per_1x32,1,0,32,0,18.3924,flydsl_moe1_afp4_wfp4_bf16_t32x32x256_kb2_bnt0,0.0%,9.58,114937.27
stage1,256,2,7168,256,384,8,ActivationType.Silu,torch.bfloat16,torch.float4_e2m1fn_x2,torch.float4_e2m1fn_x2,QuantType.per_1x32,1,0,32,0,26.3604,flydsl_moe1_afp4_wfp4_bf16_t32x32x256_kb2_bnt0_go,0.0%,6.68,80195.0
stage1,256,2,7168,256,384,8,ActivationType.Silu,torch.bfloat16,torch.float4_e2m1fn_x2,torch.float4_e2m1fn_x2,QuantType.per_1x32,1,0,32,0,20.1458,flydsl_moe1_afp4_wfp4_bf16_t32x32x256_kb2,0.0%,8.74,104933.64
stage1,256,2,7168,256,384,8,ActivationType.Silu,torch.bfloat16,torch.float4_e2m1fn_x2,torch.float4_e2m1fn_x2,QuantType.per_1x32,1,0,32,0,26.5556,flydsl_moe1_afp4_wfp4_bf16_t32x32x256_kb2_go,0.0%,6.63,79605.52
stage1,256,2,7168,256,384,8,ActivationType.Silu,torch.bfloat16,torch.float4_e2m1fn_x2,torch.float4_e2m1fn_x2,QuantType.per_1x32,1,0,32,0,22.216,flydsl_moe1_afp4_wfp4_bf16_t32x32x256_kb4_bnt0,0.0%,7.93,95155.39
stage1,256,2,7168,256,384,8,ActivationType.Silu,torch.bfloat16,torch.float4_e2m1fn_x2,torch.float4_e2m1fn_x2,QuantType.per_1x32,1,0,32,0,28.9021,flydsl_moe1_afp4_wfp4_bf16_t32x32x256_kb4_bnt0_go,0.0%,6.1,73142.51
stage1,256,2,7168,256,384,8,ActivationType.Silu,torch.bfloat16,torch.float4_e2m1fn_x2,torch.float4_e2m1fn_x2,QuantType.per_1x32,1,0,32,0,25.212,flydsl_moe1_afp4_wfp4_bf16_t32x32x256_kb4,0.0%,6.99,83847.86
stage1,256,2,7168,256,384,8,ActivationType.Silu,torch.bfloat16,torch.float4_e2m1fn_x2,torch.float4_e2m1fn_x2,QuantType.per_1x32,1,0,32,0,29.3053,flydsl_moe1_afp4_wfp4_bf16_t32x32x256_kb4_go,0.0%,6.01,72136.17
stage1,256,2,7168,256,384,8,ActivationType.Silu,torch.bfloat16,torch.float4_e2m1fn_x2,torch.float4_e2m1fn_x2,QuantType.per_1x32,1,0,32,0,27.9446,flydsl_moe1_afp4_wfp4_bf16_t32x32x256_kb7_bnt0,0.1%,6.3,75648.68
stage1,256,2,7168,256,384,8,ActivationType.Silu,torch.bfloat16,torch.float4_e2m1fn_x2,torch.float4_e2m1fn_x2,QuantType.per_1x32,1,0,32,0,33.3056,flydsl_moe1_afp4_wfp4_bf16_t32x32x256_kb7_bnt0_go,0.1%,5.29,63471.98
stage1,256,2,7168,256,384,8,ActivationType.Silu,torch.bfloat16,torch.float4_e2m1fn_x2,torch.float4_e2m1fn_x2,QuantType.per_1x32,1,0,32,0,28.5569,flydsl_moe1_afp4_wfp4_bf16_t32x32x256_kb7,0.1%,6.17,74026.67
stage1,256,2,7168,256,384,8,ActivationType.Silu,torch.bfloat16,torch.float4_e2m1fn_x2,torch.float4_e2m1fn_x2,QuantType.per_1x32,1,0,32,0,33.6789,flydsl_moe1_afp4_wfp4_bf16_t32x32x256_kb7_go,0.1%,5.23,62768.45
stage1,256,2,7168,256,384,8,ActivationType.Silu,torch.bfloat16,torch.float4_e2m1fn_x2,torch.float4_e2m1fn_x2,QuantType.per_1x32,1,0,32,0,22.5671,flydsl_moe1_afp4_wfp4_bf16_t32x32x256_w2_bnt0,0.0%,7.81,93674.96
stage1,256,2,7168,256,384,8,ActivationType.Silu,torch.bfloat16,torch.float4_e2m1fn_x2,torch.float4_e2m1fn_x2,QuantType.per_1x32,1,0,32,0,22.7354,flydsl_moe1_afp4_wfp4_bf16_t32x32x256_w2,0.0%,7.75,92981.53
stage1,256,2,7168,256,384,8,ActivationType.Silu,torch.bfloat16,torch.float4_e2m1fn_x2,torch.float4_e2m1fn_x2,QuantType.per_1x32,1,0,32,0,19.6823,flydsl_moe1_afp4_wfp4_bf16_t32x32x256_w2_kb2_bnt0,0.0%,8.95,107404.74
stage1,256,2,7168,256,384,8,ActivationType.Silu,torch.bfloat16,torch.float4_e2m1fn_x2,torch.float4_e2m1fn_x2,QuantType.per_1x32,1,0,32,0,18.5317,flydsl_moe1_afp4_wfp4_bf16_t32x32x256_w2_kb2_bnt0_go,0.0%,9.51,114073.3
stage1,256,2,7168,256,384,8,ActivationType.Silu,torch.bfloat16,torch.float4_e2m1fn_x2,torch.float4_e2m1fn_x2,QuantType.per_1x32,1,0,32,0,18.1626,flydsl_moe1_afp4_wfp4_bf16_t32x32x256_w2_kb2,0.0%,9.7,116391.5
stage1,256,2,7168,256,384,8,ActivationType.Silu,torch.bfloat16,torch.float4_e2m1fn_x2,torch.float4_e2m1fn_x2,QuantType.per_1x32,1,0,32,0,16.9909,flydsl_moe1_afp4_wfp4_bf16_t32x32x256_w2_kb2_go,0.0%,10.37,124417.91
stage1,256,2,7168,256,384,8,ActivationType.Silu,torch.bfloat16,torch.float4_e2m1fn_x2,torch.float4_e2m1fn_x2,QuantType.per_1x32,1,0,32,0,16.1066,flydsl_moe1_afp4_wfp4_bf16_t32x32x256_w2_kb4_bnt0,0.0%,10.94,131248.82
stage1,256,2,7168,256,384,8,ActivationType.Silu,torch.bfloat16,torch.float4_e2m1fn_x2,torch.float4_e2m1fn_x2,QuantType.per_1x32,1,0,32,0,19.1313,flydsl_moe1_afp4_wfp4_bf16_t32x32x256_w2_kb4_bnt0_go,0.0%,9.21,110498.1
stage1,256,2,7168,256,384,8,ActivationType.Silu,torch.bfloat16,torch.float4_e2m1fn_x2,torch.float4_e2m1fn_x2,QuantType.per_1x32,1,0,32,0,15.2231,flydsl_moe1_afp4_wfp4_bf16_t32x32x256_w2_kb4,0.0%,11.57,138866.08
stage1,256,2,7168,256,384,8,ActivationType.Silu,torch.bfloat16,torch.float4_e2m1fn_x2,torch.float4_e2m1fn_x2,QuantType.per_1x32,1,0,32,0,17.8618,flydsl_moe1_afp4_wfp4_bf16_t32x32x256_w2_kb4_go,0.0%,9.86,118351.58
stage1,256,2,7168,256,384,8,ActivationType.Silu,torch.bfloat16,torch.float4_e2m1fn_x2,torch.float4_e2m1fn_x2,QuantType.per_1x32,1,0,32,0,18.7965,flydsl_moe1_afp4_wfp4_bf16_t32x32x256_w2_kb7_bnt0,0.0%,9.37,112466.27
stage1,256,2,7168,256,384,8,ActivationType.Silu,torch.bfloat16,torch.float4_e2m1fn_x2,torch.float4_e2m1fn_x2,QuantType.per_1x32,1,0,32,0,25.8292,flydsl_moe1_afp4_wfp4_bf16_t32x32x256_w2_kb7_bnt0_go,0.1%,6.82,81844.28
stage1,256,2,7168,256,384,8,ActivationType.Silu,torch.bfloat16,torch.float4_e2m1fn_x2,torch.float4_e2m1fn_x2,QuantType.per_1x32,1,0,32,0,17.5768,flydsl_moe1_afp4_wfp4_bf16_t32x32x256_w2_kb7,0.1%,10.02,120270.6
stage1,256,2,7168,256,384,8,ActivationType.Silu,torch.bfloat16,torch.float4_e2m1fn_x2,torch.float4_e2m1fn_x2,QuantType.per_1x32,1,0,32,0,24.4412,flydsl_moe1_afp4_wfp4_bf16_t32x32x256_w2_kb7_go,0.1%,7.21,86492.16
stage1,256,2,7168,256,384,8,ActivationType.Silu,torch.bfloat16,torch.float4_e2m1fn_x2,torch.float4_e2m1fn_x2,QuantType.per_1x32,1,0,32,0,22.8009,flydsl_moe1_afp4_wfp4_bf16_t32x32x256_w3_bnt0,0.0%,7.73,92714.42
stage1,256,2,7168,256,384,8,ActivationType.Silu,torch.bfloat16,torch.float4_e2m1fn_x2,torch.float4_e2m1fn_x2,QuantType.per_1x32,1,0,32,0,22.7477,flydsl_moe1_afp4_wfp4_bf16_t32x32x256_w3,0.0%,7.74,92931.25
stage1,256,2,7168,256,384,8,ActivationType.Silu,torch.bfloat16,torch.float4_e2m1fn_x2,torch.float4_e2m1fn_x2,QuantType.per_1x32,1,0,32,0,18.3331,flydsl_moe1_afp4_wfp4_bf16_t32x32x256_w3_kb2_bnt0,0.0%,9.61,115309.04
stage1,256,2,7168,256,384,8,ActivationType.Silu,torch.bfloat16,torch.float4_e2m1fn_x2,torch.float4_e2m1fn_x2,QuantType.per_1x32,1,0,32,0,18.2399,flydsl_moe1_afp4_wfp4_bf16_t32x32x256_w3_kb2_bnt0_go,0.0%,9.66,115898.24
stage1,256,2,7168,256,384,8,ActivationType.Silu,torch.bfloat16,torch.float4_e2m1fn_x2,torch.float4_e2m1fn_x2,QuantType.per_1x32,1,0,32,0,18.1376,flydsl_moe1_afp4_wfp4_bf16_t32x32x256_w3_kb2,0.0%,9.71,116551.93
stage1,256,2,7168,256,384,8,ActivationType.Silu,torch.bfloat16,torch.float4_e2m1fn_x2,torch.float4_e2m1fn_x2,QuantType.per_1x32,1,0,32,0,18.1026,flydsl_moe1_afp4_wfp4_bf16_t32x32x256_w3_kb2_go,0.0%,9.73,116777.27
stage1,256,2,7168,256,384,8,ActivationType.Silu,torch.bfloat16,torch.float4_e2m1fn_x2,torch.float4_e2m1fn_x2,QuantType.per_1x32,1,0,32,0,15.0643,flydsl_moe1_afp4_wfp4_bf16_t32x32x256_w3_kb4_bnt0,0.0%,11.69,140329.93
stage1,256,2,7168,256,384,8,ActivationType.Silu,torch.bfloat16,torch.float4_e2m1fn_x2,torch.float4_e2m1fn_x2,QuantType.per_1x32,1,0,32,0,17.5283,flydsl_moe1_afp4_wfp4_bf16_t32x32x256_w3_kb4_bnt0_go,0.0%,10.05,120603.38
stage1,256,2,7168,256,384,8,ActivationType.Silu,torch.bfloat16,torch.float4_e2m1fn_x2,torch.float4_e2m1fn_x2,QuantType.per_1x32,1,0,32,0,16.7705,flydsl_moe1_afp4_wfp4_bf16_t32x32x256_w3_kb4,0.0%,10.5,126053.02
stage1,256,2,7168,256,384,8,ActivationType.Silu,torch.bfloat16,torch.float4_e2m1fn_x2,torch.float4_e2m1fn_x2,QuantType.per_1x32,1,0,32,0,18.6355,flydsl_moe1_afp4_wfp4_bf16_t32x32x256_w3_kb4_go,0.0%,9.45,113437.91
stage1,256,2,7168,256,384,8,ActivationType.Silu,torch.bfloat16,torch.float4_e2m1fn_x2,torch.float4_e2m1fn_x2,QuantType.per_1x32,1,0,32,0,17.4787,flydsl_moe1_afp4_wfp4_bf16_t32x32x256_w3_kb7_bnt0,0.0%,10.08,120945.62
stage1,256,2,7168,256,384,8,ActivationType.Silu,torch.bfloat16,torch.float4_e2m1fn_x2,torch.float4_e2m1fn_x2,QuantType.per_1x32,1,0,32,0,19.6956,flydsl_moe1_afp4_wfp4_bf16_t32x32x256_w3_kb7_bnt0_go,0.1%,8.94,107332.21
stage1,256,2,7168,256,384,8,ActivationType.Silu,torch.bfloat16,torch.float4_e2m1fn_x2,torch.float4_e2m1fn_x2,QuantType.per_1x32,1,0,32,0,18.835,flydsl_moe1_afp4_wfp4_bf16_t32x32x256_w3_kb7,0.1%,9.35,112236.38
stage1,256,2,7168,256,384,8,ActivationType.Silu,torch.bfloat16,torch.float4_e2m1fn_x2,torch.float4_e2m1fn_x2,QuantType.per_1x32,1,0,32,0,19.5109,flydsl_moe1_afp4_wfp4_bf16_t32x32x256_w3_kb7_go,0.1%,9.03,108348.27
stage1,256,2,7168,256,384,8,ActivationType.Silu,torch.bfloat16,torch.float4_e2m1fn_x2,torch.float4_e2m1fn_x2,QuantType.per_1x32,1,0,32,0,22.4026,flydsl_moe1_afp4_wfp4_bf16_t32x32x256_w4_bnt0,0.0%,7.86,94362.81
stage1,256,2,7168,256,384,8,ActivationType.Silu,torch.bfloat16,torch.float4_e2m1fn_x2,torch.float4_e2m1fn_x2,QuantType.per_1x32,1,0,32,0,22.4499,flydsl_moe1_afp4_wfp4_bf16_t32x32x256_w4,0.0%,7.85,94163.99
stage1,256,2,7168,256,384,8,ActivationType.Silu,torch.bfloat16,torch.float4_e2m1fn_x2,torch.float4_e2m1fn_x2,QuantType.per_1x32,1,0,32,0,19.5698,flydsl_moe1_afp4_wfp4_bf16_t32x32x256_w4_kb2_bnt0,0.0%,9.0,108022.17
stage1,256,2,7168,256,384,8,ActivationType.Silu,torch.bfloat16,torch.float4_e2m1fn_x2,torch.float4_e2m1fn_x2,QuantType.per_1x32,1,0,32,0,16.7364,flydsl_moe1_afp4_wfp4_bf16_t32x32x256_w4_kb2_bnt0_go,0.0%,10.53,126309.85
stage1,256,2,7168,256,384,8,ActivationType.Silu,torch.bfloat16,torch.float4_e2m1fn_x2,torch.float4_e2m1fn_x2,QuantType.per_1x32,1,0,32,0,18.7285,flydsl_moe1_afp4_wfp4_bf16_t32x32x256_w4_kb2,0.0%,9.41,112874.61
stage1,256,2,7168,256,384,8,ActivationType.Silu,torch.bfloat16,torch.float4_e2m1fn_x2,torch.float4_e2m1fn_x2,QuantType.per_1x32,1,0,32,0,18.2298,flydsl_moe1_afp4_wfp4_bf16_t32x32x256_w4_kb2_go,0.0%,9.66,115962.45
stage1,256,2,7168,256,384,8,ActivationType.Silu,torch.bfloat16,torch.float4_e2m1fn_x2,torch.float4_e2m1fn_x2,QuantType.per_1x32,1,0,32,0,16.5209,flydsl_moe1_afp4_wfp4_bf16_t32x32x256_w4_kb4_bnt0,0.0%,10.66,127957.45
stage1,256,2,7168,256,384,8,ActivationType.Silu,torch.bfloat16,torch.float4_e2m1fn_x2,torch.float4_e2m1fn_x2,QuantType.per_1x32,1,0,32,0,15.3388,flydsl_moe1_afp4_wfp4_bf16_t32x32x256_w4_kb4_bnt0_go,0.0%,11.48,137818.62
stage1,256,2,7168,256,384,8,ActivationType.Silu,torch.bfloat16,torch.float4_e2m1fn_x2,torch.float4_e2m1fn_x2,QuantType.per_1x32,1,0,32,0,15.1627,flydsl_moe1_afp4_wfp4_bf16_t32x32x256_w4_kb4,0.0%,11.62,139419.25
stage1,256,2,7168,256,384,8,ActivationType.Silu,torch.bfloat16,torch.float4_e2m1fn_x2,torch.float4_e2m1fn_x2,QuantType.per_1x32,1,0,32,0,13.9519,flydsl_moe1_afp4_wfp4_bf16_t32x32x256_w4_kb4_go,0.0%,12.63,151518.59
stage1,256,2,7168,256,384,8,ActivationType.Silu,torch.bfloat16,torch.float4_e2m1fn_x2,torch.float4_e2m1fn_x2,QuantType.per_1x32,1,0,32,0,15.6604,flydsl_moe1_afp4_wfp4_bf16_t32x32x256_w4_kb7_bnt0,0.0%,11.25,134988.39
stage1,256,2,7168,256,384,8,ActivationType.Silu,torch.bfloat16,torch.float4_e2m1fn_x2,torch.float4_e2m1fn_x2,QuantType.per_1x32,1,0,32,0,17.4107,flydsl_moe1_afp4_wfp4_bf16_t32x32x256_w4_kb7_bnt0_go,0.1%,10.12,121417.99
stage1,256,2,7168,256,384,8,ActivationType.Silu,torch.bfloat16,torch.float4_e2m1fn_x2,torch.float4_e2m1fn_x2,QuantType.per_1x32,1,0,32,0,14.2882,flydsl_moe1_afp4_wfp4_bf16_t32x32x256_w4_kb7,0.0%,12.33,147952.31
stage1,256,2,7168,256,384,8,ActivationType.Silu,torch.bfloat16,torch.float4_e2m1fn_x2,torch.float4_e2m1fn_x2,QuantType.per_1x32,1,0,32,0,16.0841,flydsl_moe1_afp4_wfp4_bf16_t32x32x256_w4_kb7_go,0.0%,10.95,131432.42
stage1,256,2,7168,256,384,8,ActivationType.Silu,torch.bfloat16,torch.float4_e2m1fn_x2,torch.float4_e2m1fn_x2,QuantType.per_1x32,1,0,32,0,23.9807,flydsl_moe1_afp4_wfp4_bf16_t32x64x256_bnt0,0.0%,7.35,88153.07
stage1,256,2,7168,256,384,8,ActivationType.Silu,torch.bfloat16,torch.float4_e2m1fn_x2,torch.float4_e2m1fn_x2,QuantType.per_1x32,1,0,32,0,24.0813,flydsl_moe1_afp4_wfp4_bf16_t32x64x256,0.0%,7.32,87784.8
stage1,256,2,7168,256,384,8,ActivationType.Silu,torch.bfloat16,torch.float4_e2m1fn_x2,torch.float4_e2m1fn_x2,QuantType.per_1x32,1,0,32,0,21.2775,flydsl_moe1_afp4_wfp4_bf16_t32x64x256_kb2_bnt0,0.0%,8.28,99352.47
stage1,256,2,7168,256,384,8,ActivationType.Silu,torch.bfloat16,torch.float4_e2m1fn_x2,torch.float4_e2m1fn_x2,QuantType.per_1x32,1,0,32,0,17.0103,flydsl_moe1_afp4_wfp4_bf16_t32x64x256_kb2_bnt0_go,0.0%,10.36,124276.01
stage1,256,2,7168,256,384,8,ActivationType.Silu,torch.bfloat16,torch.float4_e2m1fn_x2,torch.float4_e2m1fn_x2,QuantType.per_1x32,1,0,32,0,21.0473,flydsl_moe1_afp4_wfp4_bf16_t32x64x256_kb2,0.0%,8.37,100439.12
stage1,256,2,7168,256,384,8,ActivationType.Silu,torch.bfloat16,torch.float4_e2m1fn_x2,torch.float4_e2m1fn_x2,QuantType.per_1x32,1,0,32,0,18.4429,flydsl_moe1_afp4_wfp4_bf16_t32x64x256_kb2_go,0.0%,9.55,114622.55
stage1,256,2,7168,256,384,8,ActivationType.Silu,torch.bfloat16,torch.float4_e2m1fn_x2,torch.float4_e2m1fn_x2,QuantType.per_1x32,1,0,32,0,15.0449,flydsl_moe1_afp4_wfp4_bf16_t32x64x256_kb4_bnt0,0.0%,11.71,140510.89
stage1,256,2,7168,256,384,8,ActivationType.Silu,torch.bfloat16,torch.float4_e2m1fn_x2,torch.float4_e2m1fn_x2,QuantType.per_1x32,1,0,32,0,18.0771,flydsl_moe1_afp4_wfp4_bf16_t32x64x256_kb4_bnt0_go,0.0%,9.74,116942.0
stage1,256,2,7168,256,384,8,ActivationType.Silu,torch.bfloat16,torch.float4_e2m1fn_x2,torch.float4_e2m1fn_x2,QuantType.per_1x32,1,0,32,0,16.083,flydsl_moe1_afp4_wfp4_bf16_t32x64x256_kb4,0.0%,10.95,131441.41
stage1,256,2,7168,256,384,8,ActivationType.Silu,torch.bfloat16,torch.float4_e2m1fn_x2,torch.float4_e2m1fn_x2,QuantType.per_1x32,1,0,32,0,17.9858,flydsl_moe1_afp4_wfp4_bf16_t32x64x256_kb4_go,0.0%,9.79,117535.62
stage1,256,2,7168,256,384,8,ActivationType.Silu,torch.bfloat16,torch.float4_e2m1fn_x2,torch.float4_e2m1fn_x2,QuantType.per_1x32,1,0,32,0,17.6297,flydsl_moe1_afp4_wfp4_bf16_t32x64x256_kb7_bnt0,0.1%,9.99,119909.71
stage1,256,2,7168,256,384,8,ActivationType.Silu,torch.bfloat16,torch.float4_e2m1fn_x2,torch.float4_e2m1fn_x2,QuantType.per_1x32,1,0,32,0,25.5303,flydsl_moe1_afp4_wfp4_bf16_t32x64x256_kb7_bnt0_go,0.1%,6.9,82802.48
stage1,256,2,7168,256,384,8,ActivationType.Silu,torch.bfloat16,torch.float4_e2m1fn_x2,torch.float4_e2m1fn_x2,QuantType.per_1x32,1,0,32,0,18.6346,flydsl_moe1_afp4_wfp4_bf16_t32x64x256_kb7,0.0%,9.45,113443.39
stage1,256,2,7168,256,384,8,ActivationType.Silu,torch.bfloat16,torch.float4_e2m1fn_x2,torch.float4_e2m1fn_x2,QuantType.per_1x32,1,0,32,0,25.6199,flydsl_moe1_afp4_wfp4_bf16_t32x64x256_kb7_go,0.1%,6.88,82512.9
stage1,256,2,7168,256,384,8,ActivationType.Silu,torch.bfloat16,torch.float4_e2m1fn_x2,torch.float4_e2m1fn_x2,QuantType.per_1x32,1,0,32,0,23.613,flydsl_moe1_afp4_wfp4_bf16_t32x64x256_w2_bnt0,0.0%,7.46,89525.78
stage1,256,2,7168,256,384,8,ActivationType.Silu,torch.bfloat16,torch.float4_e2m1fn_x2,torch.float4_e2m1fn_x2,QuantType.per_1x32,1,0,32,0,23.6027,flydsl_moe1_afp4_wfp4_bf16_t32x64x256_w2,0.0%,7.46,89564.85
stage1,256,2,7168,256,384,8,ActivationType.Silu,torch.bfloat16,torch.float4_e2m1fn_x2,torch.float4_e2m1fn_x2,QuantType.per_1x32,1,0,32,0,20.0353,flydsl_moe1_afp4_wfp4_bf16_t32x64x256_w2_kb2_bnt0,0.0%,8.79,105512.38
stage1,256,2,7168,256,384,8,ActivationType.Silu,torch.bfloat16,torch.float4_e2m1fn_x2,torch.float4_e2m1fn_x2,QuantType.per_1x32,1,0,32,0,18.1927,flydsl_moe1_afp4_wfp4_bf16_t32x64x256_w2_kb2_bnt0_go,0.0%,9.68,116198.93
stage1,256,2,7168,256,384,8,ActivationType.Silu,torch.bfloat16,torch.float4_e2m1fn_x2,torch.float4_e2m1fn_x2,QuantType.per_1x32,1,0,32,0,20.3375,flydsl_moe1_afp4_wfp4_bf16_t32x64x256_w2_kb2,0.0%,8.66,103944.55
stage1,256,2,7168,256,384,8,ActivationType.Silu,torch.bfloat16,torch.float4_e2m1fn_x2,torch.float4_e2m1fn_x2,QuantType.per_1x32,1,0,32,0,16.9942,flydsl_moe1_afp4_wfp4_bf16_t32x64x256_w2_kb2_go,0.0%,10.37,124393.75
stage1,256,2,7168,256,384,8,ActivationType.Silu,torch.bfloat16,torch.float4_e2m1fn_x2,torch.float4_e2m1fn_x2,QuantType.per_1x32,1,0,32,0,16.0122,flydsl_moe1_afp4_wfp4_bf16_t32x64x256_w2_kb4_bnt0,0.0%,11.0,132022.6
stage1,256,2,7168,256,384,8,ActivationType.Silu,torch.bfloat16,torch.float4_e2m1fn_x2,torch.float4_e2m1fn_x2,QuantType.per_1x32,1,0,32,0,15.4976,flydsl_moe1_afp4_wfp4_bf16_t32x64x256_w2_kb4_bnt0_go,0.0%,11.37,136406.43
stage1,256,2,7168,256,384,8,ActivationType.Silu,torch.bfloat16,torch.float4_e2m1fn_x2,torch.float4_e2m1fn_x2,QuantType.per_1x32,1,0,32,0,14.5059,flydsl_moe1_afp4_wfp4_bf16_t32x64x256_w2_kb4,0.0%,12.14,145731.89
stage1,256,2,7168,256,384,8,ActivationType.Silu,torch.bfloat16,torch.float4_e2m1fn_x2,torch.float4_e2m1fn_x2,QuantType.per_1x32,1,0,32,0,14.0063,flydsl_moe1_afp4_wfp4_bf16_t32x64x256_w2_kb4_go,0.0%,12.58,150930.1
stage1,256,2,7168,256,384,8,ActivationType.Silu,torch.bfloat16,torch.float4_e2m1fn_x2,torch.float4_e2m1fn_x2,QuantType.per_1x32,1,0,32,0,15.2742,flydsl_moe1_afp4_wfp4_bf16_t32x64x256_w2_kb7_bnt0,0.0%,11.53,138401.5
stage1,256,2,7168,256,384,8,ActivationType.Silu,torch.bfloat16,torch.float4_e2m1fn_x2,torch.float4_e2m1fn_x2,QuantType.per_1x32,1,0,32,0,17.258,flydsl_moe1_afp4_wfp4_bf16_t32x64x256_w2_kb7_bnt0_go,0.0%,10.21,122492.31
stage1,256,2,7168,256,384,8,ActivationType.Silu,torch.bfloat16,torch.float4_e2m1fn_x2,torch.float4_e2m1fn_x2,QuantType.per_1x32,1,0,32,0,13.9048,flydsl_moe1_afp4_wfp4_bf16_t32x64x256_w2_kb7,0.0%,12.67,152031.83
stage1,256,2,7168,256,384,8,ActivationType.Silu,torch.bfloat16,torch.float4_e2m1fn_x2,torch.float4_e2m1fn_x2,QuantType.per_1x32,1,0,32,0,15.8974,flydsl_moe1_afp4_wfp4_bf16_t32x64x256_w2_kb7_go,0.1%,11.08,132975.97
stage1,256,2,7168,256,384,8,ActivationType.Silu,torch.bfloat16,torch.float4_e2m1fn_x2,torch.float4_e2m1fn_x2,QuantType.per_1x32,1,0,32,0,24.2455,flydsl_moe1_afp4_wfp4_bf16_t32x64x256_w3_bnt0,0.0%,7.27,87190.29
stage1,256,2,7168,256,384,8,ActivationType.Silu,torch.bfloat16,torch.float4_e2m1fn_x2,torch.float4_e2m1fn_x2,QuantType.per_1x32,1,0,32,0,23.5897,flydsl_moe1_afp4_wfp4_bf16_t32x64x256_w3,0.0%,7.47,89614.21
stage1,256,2,7168,256,384,8,ActivationType.Silu,torch.bfloat16,torch.float4_e2m1fn_x2,torch.float4_e2m1fn_x2,QuantType.per_1x32,1,0,32,0,21.0936,flydsl_moe1_afp4_wfp4_bf16_t32x64x256_w3_kb2_bnt0,0.0%,8.35,100218.66
stage1,256,2,7168,256,384,8,ActivationType.Silu,torch.bfloat16,torch.float4_e2m1fn_x2,torch.float4_e2m1fn_x2,QuantType.per_1x32,1,0,32,0,17.2265,flydsl_moe1_afp4_wfp4_bf16_t32x64x256_w3_kb2_bnt0_go,0.0%,10.23,122716.29
stage1,256,2,7168,256,384,8,ActivationType.Silu,torch.bfloat16,torch.float4_e2m1fn_x2,torch.float4_e2m1fn_x2,QuantType.per_1x32,1,0,32,0,19.6883,flydsl_moe1_afp4_wfp4_bf16_t32x64x256_w3_kb2,0.0%,8.95,107372.0
stage1,256,2,7168,256,384,8,ActivationType.Silu,torch.bfloat16,torch.float4_e2m1fn_x2,torch.float4_e2m1fn_x2,QuantType.per_1x32,1,0,32,0,18.4867,flydsl_moe1_afp4_wfp4_bf16_t32x64x256_w3_kb2_go,0.0%,9.53,114350.98
stage1,256,2,7168,256,384,8,ActivationType.Silu,torch.bfloat16,torch.float4_e2m1fn_x2,torch.float4_e2m1fn_x2,QuantType.per_1x32,1,0,32,0,14.836,flydsl_moe1_afp4_wfp4_bf16_t32x64x256_w3_kb4_bnt0,0.0%,11.87,142489.37
stage1,256,2,7168,256,384,8,ActivationType.Silu,torch.bfloat16,torch.float4_e2m1fn_x2,torch.float4_e2m1fn_x2,QuantType.per_1x32,1,0,32,0,13.9171,flydsl_moe1_afp4_wfp4_bf16_t32x64x256_w3_kb4_bnt0_go,0.0%,12.66,151897.47
stage1,256,2,7168,256,384,8,ActivationType.Silu,torch.bfloat16,torch.float4_e2m1fn_x2,torch.float4_e2m1fn_x2,QuantType.per_1x32,1,0,32,0,16.1846,flydsl_moe1_afp4_wfp4_bf16_t32x64x256_w3_kb4,0.0%,10.88,130616.28
stage1,256,2,7168,256,384,8,ActivationType.Silu,torch.bfloat16,torch.float4_e2m1fn_x2,torch.float4_e2m1fn_x2,QuantType.per_1x32,1,0,32,0,15.5375,flydsl_moe1_afp4_wfp4_bf16_t32x64x256_w3_kb4_go,0.0%,11.34,136056.14
stage1,256,2,7168,256,384,8,ActivationType.Silu,torch.bfloat16,torch.float4_e2m1fn_x2,torch.float4_e2m1fn_x2,QuantType.per_1x32,1,0,32,0,13.9971,flydsl_moe1_afp4_wfp4_bf16_t32x64x256_w3_kb7_bnt0,0.1%,12.59,151029.3
stage1,256,2,7168,256,384,8,ActivationType.Silu,torch.bfloat16,torch.float4_e2m1fn_x2,torch.float4_e2m1fn_x2,QuantType.per_1x32,1,0,32,0,16.1639,flydsl_moe1_afp4_wfp4_bf16_t32x64x256_w3_kb7_bnt0_go,0.0%,10.9,130783.55
stage1,256,2,7168,256,384,8,ActivationType.Silu,torch.bfloat16,torch.float4_e2m1fn_x2,torch.float4_e2m1fn_x2,QuantType.per_1x32,1,0,32,0,15.0232,flydsl_moe1_afp4_wfp4_bf16_t32x64x256_w3_kb7,0.1%,11.73,140713.84
stage1,256,2,7168,256,384,8,ActivationType.Silu,torch.bfloat16,torch.float4_e2m1fn_x2,torch.float4_e2m1fn_x2,QuantType.per_1x32,1,0,32,0,16.1984,flydsl_moe1_afp4_wfp4_bf16_t32x64x256_w3_kb7_go,0.0%,10.88,130505.0
stage1,256,2,7168,256,384,8,ActivationType.Silu,torch.bfloat16,torch.float4_e2m1fn_x2,torch.float4_e2m1fn_x2,QuantType.per_1x32,1,0,32,0,23.6396,flydsl_moe1_afp4_wfp4_bf16_t32x64x256_w4_bnt0,0.0%,7.45,89425.04
stage1,256,2,7168,256,384,8,ActivationType.Silu,torch.bfloat16,torch.float4_e2m1fn_x2,torch.float4_e2m1fn_x2,QuantType.per_1x32,1,0,32,0,24.057,flydsl_moe1_afp4_wfp4_bf16_t32x64x256_w4,0.0%,7.32,87873.48
stage1,256,2,7168,256,384,8,ActivationType.Silu,torch.bfloat16,torch.float4_e2m1fn_x2,torch.float4_e2m1fn_x2,QuantType.per_1x32,1,0,32,0,19.8619,flydsl_moe1_afp4_wfp4_bf16_t32x64x256_w4_kb2_bnt0,0.0%,8.87,106433.53
stage1,256,2,7168,256,384,8,ActivationType.Silu,torch.bfloat16,torch.float4_e2m1fn_x2,torch.float4_e2m1fn_x2,QuantType.per_1x32,1,0,32,0,16.8077,flydsl_moe1_afp4_wfp4_bf16_t32x64x256_w4_kb2_bnt0_go,0.0%,10.48,125774.03
stage1,256,2,7168,256,384,8,ActivationType.Silu,torch.bfloat16,torch.float4_e2m1fn_x2,torch.float4_e2m1fn_x2,QuantType.per_1x32,1,0,32,0,20.1276,flydsl_moe1_afp4_wfp4_bf16_t32x64x256_w4_kb2,0.0%,8.75,105028.53
stage1,256,2,7168,256,384,8,ActivationType.Silu,torch.bfloat16,torch.float4_e2m1fn_x2,torch.float4_e2m1fn_x2,QuantType.per_1x32,1,0,32,0,18.3276,flydsl_moe1_afp4_wfp4_bf16_t32x64x256_w4_kb2_go,0.0%,9.61,115343.65
stage1,256,2,7168,256,384,8,ActivationType.Silu,torch.bfloat16,torch.float4_e2m1fn_x2,torch.float4_e2m1fn_x2,QuantType.per_1x32,1,0,32,0,16.0698,flydsl_moe1_afp4_wfp4_bf16_t32x64x256_w4_kb4_bnt0,0.0%,10.96,131549.38
stage1,256,2,7168,256,384,8,ActivationType.Silu,torch.bfloat16,torch.float4_e2m1fn_x2,torch.float4_e2m1fn_x2,QuantType.per_1x32,1,0,32,0,15.0488,flydsl_moe1_afp4_wfp4_bf16_t32x64x256_w4_kb4_bnt0_go,0.0%,11.71,140474.47
stage1,256,2,7168,256,384,8,ActivationType.Silu,torch.bfloat16,torch.float4_e2m1fn_x2,torch.float4_e2m1fn_x2,QuantType.per_1x32,1,0,32,0,14.8715,flydsl_moe1_afp4_wfp4_bf16_t32x64x256_w4_kb4,0.0%,11.85,142149.23
stage1,256,2,7168,256,384,8,ActivationType.Silu,torch.bfloat16,torch.float4_e2m1fn_x2,torch.float4_e2m1fn_x2,QuantType.per_1x32,1,0,32,0,14.0555,flydsl_moe1_afp4_wfp4_bf16_t32x64x256_w4_kb4_go,0.0%,12.53,150401.78
stage1,256,2,7168,256,384,8,ActivationType.Silu,torch.bfloat16,torch.float4_e2m1fn_x2,torch.float4_e2m1fn_x2,QuantType.per_1x32,1,0,32,0,15.1193,flydsl_moe1_afp4_wfp4_bf16_t32x64x256_w4_kb7_bnt0,0.0%,11.65,139819.45
stage1,256,2,7168,256,384,8,ActivationType.Silu,torch.bfloat16,torch.float4_e2m1fn_x2,torch.float4_e2m1fn_x2,QuantType.per_1x32,1,0,32,0,14.5254,flydsl_moe1_afp4_wfp4_bf16_t32x64x256_w4_kb7_bnt0_go,0.0%,12.13,145536.25
stage1,256,2,7168,256,384,8,ActivationType.Silu,torch.bfloat16,torch.float4_e2m1fn_x2,torch.float4_e2m1fn_x2,QuantType.per_1x32,1,0,32,0,14.0175,flydsl_moe1_afp4_wfp4_bf16_t32x64x256_w4_kb7,0.1%,12.57,150809.5
stage1,256,2,7168,256,384,8,ActivationType.Silu,torch.bfloat16,torch.float4_e2m1fn_x2,torch.float4_e2m1fn_x2,QuantType.per_1x32,1,0,32,0,13.2417,flydsl_moe1_afp4_wfp4_bf16_t32x64x256_w4_kb7_go,0.0%,13.3,159645.08
stage1,256,2,7168,256,384,8,ActivationType.Silu,torch.bfloat16,torch.float4_e2m1fn_x2,torch.float4_e2m1fn_x2,QuantType.per_1x32,1,0,32,0,27.5564,flydsl_moe1_afp4_wfp4_bf16_t32x128x256_bnt0,0.0%,6.39,76714.38
stage1,256,2,7168,256,384,8,ActivationType.Silu,torch.bfloat16,torch.float4_e2m1fn_x2,torch.float4_e2m1fn_x2,QuantType.per_1x32,1,0,32,0,27.5429,flydsl_moe1_afp4_wfp4_bf16_t32x128x256,0.0%,6.4,76751.98
stage1,256,2,7168,256,384,8,ActivationType.Silu,torch.bfloat16,torch.float4_e2m1fn_x2,torch.float4_e2m1fn_x2,QuantType.per_1x32,1,0,32,0,23.9907,flydsl_moe1_afp4_wfp4_bf16_t32x128x256_kb2_bnt0,0.0%,7.34,88116.32
stage1,256,2,7168,256,384,8,ActivationType.Silu,torch.bfloat16,torch.float4_e2m1fn_x2,torch.float4_e2m1fn_x2,QuantType.per_1x32,1,0,32,0,17.8686,flydsl_moe1_afp4_wfp4_bf16_t32x128x256_kb2_bnt0_go,0.0%,9.86,118306.54
stage1,256,2,7168,256,384,8,ActivationType.Silu,torch.bfloat16,torch.float4_e2m1fn_x2,torch.float4_e2m1fn_x2,QuantType.per_1x32,1,0,32,0,24.7338,flydsl_moe1_afp4_wfp4_bf16_t32x128x256_kb2,0.0%,7.12,85468.96
stage1,256,2,7168,256,384,8,ActivationType.Silu,torch.bfloat16,torch.float4_e2m1fn_x2,torch.float4_e2m1fn_x2,QuantType.per_1x32,1,0,32,0,17.5517,flydsl_moe1_afp4_wfp4_bf16_t32x128x256_kb2_go,0.0%,10.04,120442.59
stage1,256,2,7168,256,384,8,ActivationType.Silu,torch.bfloat16,torch.float4_e2m1fn_x2,torch.float4_e2m1fn_x2,QuantType.per_1x32,1,0,32,0,17.4184,flydsl_moe1_afp4_wfp4_bf16_t32x128x256_kb4_bnt0,0.0%,10.11,121364.32
stage1,256,2,7168,256,384,8,ActivationType.Silu,torch.bfloat16,torch.float4_e2m1fn_x2,torch.float4_e2m1fn_x2,QuantType.per_1x32,1,0,32,0,13.9939,flydsl_moe1_afp4_wfp4_bf16_t32x128x256_kb4_bnt0_go,0.0%,12.59,151063.84
stage1,256,2,7168,256,384,8,ActivationType.Silu,torch.bfloat16,torch.float4_e2m1fn_x2,torch.float4_e2m1fn_x2,QuantType.per_1x32,1,0,32,0,16.8779,flydsl_moe1_afp4_wfp4_bf16_t32x128x256_kb4,0.0%,10.44,125250.9
stage1,256,2,7168,256,384,8,ActivationType.Silu,torch.bfloat16,torch.float4_e2m1fn_x2,torch.float4_e2m1fn_x2,QuantType.per_1x32,1,0,32,0,14.0924,flydsl_moe1_afp4_wfp4_bf16_t32x128x256_kb4_go,0.0%,12.5,150007.96
stage1,256,2,7168,256,384,8,ActivationType.Silu,torch.bfloat16,torch.float4_e2m1fn_x2,torch.float4_e2m1fn_x2,QuantType.per_1x32,1,0,32,0,14.88,flydsl_moe1_afp4_wfp4_bf16_t32x128x256_kb7_bnt0,0.0%,11.84,142068.03
stage1,256,2,7168,256,384,8,ActivationType.Silu,torch.bfloat16,torch.float4_e2m1fn_x2,torch.float4_e2m1fn_x2,QuantType.per_1x32,1,0,32,0,16.0797,flydsl_moe1_afp4_wfp4_bf16_t32x128x256_kb7_bnt0_go,0.1%,10.96,131468.39
stage1,256,2,7168,256,384,8,ActivationType.Silu,torch.bfloat16,torch.float4_e2m1fn_x2,torch.float4_e2m1fn_x2,QuantType.per_1x32,1,0,32,0,14.9898,flydsl_moe1_afp4_wfp4_bf16_t32x128x256_kb7,0.0%,11.75,141027.38
stage1,256,2,7168,256,384,8,ActivationType.Silu,torch.bfloat16,torch.float4_e2m1fn_x2,torch.float4_e2m1fn_x2,QuantType.per_1x32,1,0,32,0,16.8415,flydsl_moe1_afp4_wfp4_bf16_t32x128x256_kb7_go,0.1%,10.46,125521.61
stage1,256,2,7168,256,384,8,ActivationType.Silu,torch.bfloat16,torch.float4_e2m1fn_x2,torch.float4_e2m1fn_x2,QuantType.per_1x32,1,0,32,0,27.1009,flydsl_moe1_afp4_wfp4_bf16_t32x128x256_w2_bnt0,0.0%,6.5,78003.76
stage1,256,2,7168,256,384,8,ActivationType.Silu,torch.bfloat16,torch.float4_e2m1fn_x2,torch.float4_e2m1fn_x2,QuantType.per_1x32,1,0,32,0,27.1235,flydsl_moe1_afp4_wfp4_bf16_t32x128x256_w2,0.0%,6.49,77938.77
stage1,256,2,7168,256,384,8,ActivationType.Silu,torch.bfloat16,torch.float4_e2m1fn_x2,torch.float4_e2m1fn_x2,QuantType.per_1x32,1,0,32,0,23.4948,flydsl_moe1_afp4_wfp4_bf16_t32x128x256_w2_kb2_bnt0,0.0%,7.5,89976.17
stage1,256,2,7168,256,384,8,ActivationType.Silu,torch.bfloat16,torch.float4_e2m1fn_x2,torch.float4_e2m1fn_x2,QuantType.per_1x32,1,0,32,0,18.5047,flydsl_moe1_afp4_wfp4_bf16_t32x128x256_w2_kb2_bnt0_go,0.0%,9.52,114239.75
stage1,256,2,7168,256,384,8,ActivationType.Silu,torch.bfloat16,torch.float4_e2m1fn_x2,torch.float4_e2m1fn_x2,QuantType.per_1x32,1,0,32,0,23.9831,flydsl_moe1_afp4_wfp4_bf16_t32x128x256_w2_kb2,0.0%,7.35,88144.24
stage1,256,2,7168,256,384,8,ActivationType.Silu,torch.bfloat16,torch.float4_e2m1fn_x2,torch.float4_e2m1fn_x2,QuantType.per_1x32,1,0,32,0,17.8389,flydsl_moe1_afp4_wfp4_bf16_t32x128x256_w2_kb2_go,0.0%,9.88,118503.51
stage1,256,2,7168,256,384,8,ActivationType.Silu,torch.bfloat16,torch.float4_e2m1fn_x2,torch.float4_e2m1fn_x2,QuantType.per_1x32,1,0,32,0,16.89,flydsl_moe1_afp4_wfp4_bf16_t32x128x256_w2_kb4_bnt0,0.0%,10.43,125161.17
stage1,256,2,7168,256,384,8,ActivationType.Silu,torch.bfloat16,torch.float4_e2m1fn_x2,torch.float4_e2m1fn_x2,QuantType.per_1x32,1,0,32,0,15.529,flydsl_moe1_afp4_wfp4_bf16_t32x128x256_w2_kb4_bnt0_go,0.0%,11.34,136130.61
stage1,256,2,7168,256,384,8,ActivationType.Silu,torch.bfloat16,torch.float4_e2m1fn_x2,torch.float4_e2m1fn_x2,QuantType.per_1x32,1,0,32,0,15.7275,flydsl_moe1_afp4_wfp4_bf16_t32x128x256_w2_kb4,0.0%,11.2,134412.48
stage1,256,2,7168,256,384,8,ActivationType.Silu,torch.bfloat16,torch.float4_e2m1fn_x2,torch.float4_e2m1fn_x2,QuantType.per_1x32,1,0,32,0,13.7184,flydsl_moe1_afp4_wfp4_bf16_t32x128x256_w2_kb4_go,0.0%,12.84,154097.58
stage1,256,2,7168,256,384,8,ActivationType.Silu,torch.bfloat16,torch.float4_e2m1fn_x2,torch.float4_e2m1fn_x2,QuantType.per_1x32,1,0,32,0,14.8116,flydsl_moe1_afp4_wfp4_bf16_t32x128x256_w2_kb7_bnt0,0.0%,11.89,142724.1
stage1,256,2,7168,256,384,8,ActivationType.Silu,torch.bfloat16,torch.float4_e2m1fn_x2,torch.float4_e2m1fn_x2,QuantType.per_1x32,1,0,32,0,13.1677,flydsl_moe1_afp4_wfp4_bf16_t32x128x256_w2_kb7_bnt0_go,0.0%,13.38,160542.25
stage1,256,2,7168,256,384,8,ActivationType.Silu,torch.bfloat16,torch.float4_e2m1fn_x2,torch.float4_e2m1fn_x2,QuantType.per_1x32,1,0,32,0,14.9506,flydsl_moe1_afp4_wfp4_bf16_t32x128x256_w2_kb7,0.0%,11.78,141397.15
stage1,256,2,7168,256,384,8,ActivationType.Silu,torch.bfloat16,torch.float4_e2m1fn_x2,torch.float4_e2m1fn_x2,QuantType.per_1x32,1,0,32,0,13.1075,flydsl_moe1_afp4_wfp4_bf16_t32x128x256_w2_kb7_go,0.1%,13.44,161279.59
stage1,256,2,7168,256,384,8,ActivationType.Silu,torch.bfloat16,torch.float4_e2m1fn_x2,torch.float4_e2m1fn_x2,QuantType.per_1x32,1,0,32,0,27.458,flydsl_moe1_afp4_wfp4_bf16_t32x128x256_w3_bnt0,0.0%,6.42,76989.3
stage1,256,2,7168,256,384,8,ActivationType.Silu,torch.bfloat16,torch.float4_e2m1fn_x2,torch.float4_e2m1fn_x2,QuantType.per_1x32,1,0,32,0,27.1803,flydsl_moe1_afp4_wfp4_bf16_t32x128x256_w3,0.0%,6.48,77775.9
stage1,256,2,7168,256,384,8,ActivationType.Silu,torch.bfloat16,torch.float4_e2m1fn_x2,torch.float4_e2m1fn_x2,QuantType.per_1x32,1,0,32,0,24.9563,flydsl_moe1_afp4_wfp4_bf16_t32x128x256_w3_kb2_bnt0,0.0%,7.06,84706.96
stage1,256,2,7168,256,384,8,ActivationType.Silu,torch.bfloat16,torch.float4_e2m1fn_x2,torch.float4_e2m1fn_x2,QuantType.per_1x32,1,0,32,0,17.4319,flydsl_moe1_afp4_wfp4_bf16_t32x128x256_w3_kb2_bnt0_go,0.0%,10.11,121270.33
stage1,256,2,7168,256,384,8,ActivationType.Silu,torch.bfloat16,torch.float4_e2m1fn_x2,torch.float4_e2m1fn_x2,QuantType.per_1x32,1,0,32,0,25.2494,flydsl_moe1_afp4_wfp4_bf16_t32x128x256_w3_kb2,0.0%,6.98,83723.66
stage1,256,2,7168,256,384,8,ActivationType.Silu,torch.bfloat16,torch.float4_e2m1fn_x2,torch.float4_e2m1fn_x2,QuantType.per_1x32,1,0,32,0,18.6491,flydsl_moe1_afp4_wfp4_bf16_t32x128x256_w3_kb2_go,0.0%,9.45,113355.19
stage1,256,2,7168,256,384,8,ActivationType.Silu,torch.bfloat16,torch.float4_e2m1fn_x2,torch.float4_e2m1fn_x2,QuantType.per_1x32,1,0,32,0,15.4607,flydsl_moe1_afp4_wfp4_bf16_t32x128x256_w3_kb4_bnt0,0.0%,11.39,136731.99
stage1,256,2,7168,256,384,8,ActivationType.Silu,torch.bfloat16,torch.float4_e2m1fn_x2,torch.float4_e2m1fn_x2,QuantType.per_1x32,1,0,32,0,14.0273,flydsl_moe1_afp4_wfp4_bf16_t32x128x256_w3_kb4_bnt0_go,0.0%,12.56,150704.14
stage1,256,2,7168,256,384,8,ActivationType.Silu,torch.bfloat16,torch.float4_e2m1fn_x2,torch.float4_e2m1fn_x2,QuantType.per_1x32,1,0,32,0,17.5057,flydsl_moe1_afp4_wfp4_bf16_t32x128x256_w3_kb4,0.0%,10.06,120759.08
stage1,256,2,7168,256,384,8,ActivationType.Silu,torch.bfloat16,torch.float4_e2m1fn_x2,torch.float4_e2m1fn_x2,QuantType.per_1x32,1,0,32,0,14.8851,flydsl_moe1_afp4_wfp4_bf16_t32x128x256_w3_kb4_go,0.0%,11.83,142019.35
stage1,256,2,7168,256,384,8,ActivationType.Silu,torch.bfloat16,torch.float4_e2m1fn_x2,torch.float4_e2m1fn_x2,QuantType.per_1x32,1,0,32,0,13.6254,flydsl_moe1_afp4_wfp4_bf16_t32x128x256_w3_kb7_bnt0,0.0%,12.93,155149.37
stage1,256,2,7168,256,384,8,ActivationType.Silu,torch.bfloat16,torch.float4_e2m1fn_x2,torch.float4_e2m1fn_x2,QuantType.per_1x32,1,0,32,0,13.0992,flydsl_moe1_afp4_wfp4_bf16_t32x128x256_w3_kb7_bnt0_go,0.0%,13.45,161381.78
stage1,256,2,7168,256,384,8,ActivationType.Silu,torch.bfloat16,torch.float4_e2m1fn_x2,torch.float4_e2m1fn_x2,QuantType.per_1x32,1,0,32,0,14.8588,flydsl_moe1_afp4_wfp4_bf16_t32x128x256_w3_kb7,0.0%,11.86,142270.72
stage1,256,2,7168,256,384,8,ActivationType.Silu,torch.bfloat16,torch.float4_e2m1fn_x2,torch.float4_e2m1fn_x2,QuantType.per_1x32,1,0,32,0,14.3061,flydsl_moe1_afp4_wfp4_bf16_t32x128x256_w3_kb7_go,0.0%,12.31,147767.19
stage1,256,2,7168,256,384,8,ActivationType.Silu,torch.bfloat16,torch.float4_e2m1fn_x2,torch.float4_e2m1fn_x2,QuantType.per_1x32,1,0,32,0,27.1201,flydsl_moe1_afp4_wfp4_bf16_t32x128x256_w4_bnt0,0.0%,6.5,77948.54
stage1,256,2,7168,256,384,8,ActivationType.Silu,torch.bfloat16,torch.float4_e2m1fn_x2,torch.float4_e2m1fn_x2,QuantType.per_1x32,1,0,32,0,27.069,flydsl_moe1_afp4_wfp4_bf16_t32x128x256_w4,0.0%,6.51,78095.69
stage1,256,2,7168,256,384,8,ActivationType.Silu,torch.bfloat16,torch.float4_e2m1fn_x2,torch.float4_e2m1fn_x2,QuantType.per_1x32,1,0,32,0,24.1026,flydsl_moe1_afp4_wfp4_bf16_t32x128x256_w4_kb2_bnt0,0.0%,7.31,87707.23
stage1,256,2,7168,256,384,8,ActivationType.Silu,torch.bfloat16,torch.float4_e2m1fn_x2,torch.float4_e2m1fn_x2,QuantType.per_1x32,1,0,32,0,17.5448,flydsl_moe1_afp4_wfp4_bf16_t32x128x256_w4_kb2_bnt0_go,0.0%,10.04,120489.96
stage1,256,2,7168,256,384,8,ActivationType.Silu,torch.bfloat16,torch.float4_e2m1fn_x2,torch.float4_e2m1fn_x2,QuantType.per_1x32,1,0,32,0,24.1002,flydsl_moe1_afp4_wfp4_bf16_t32x128x256_w4_kb2,0.0%,7.31,87715.96
stage1,256,2,7168,256,384,8,ActivationType.Silu,torch.bfloat16,torch.float4_e2m1fn_x2,torch.float4_e2m1fn_x2,QuantType.per_1x32,1,0,32,0,18.7432,flydsl_moe1_afp4_wfp4_bf16_t32x128x256_w4_kb2_go,0.0%,9.4,112786.09
stage1,256,2,7168,256,384,8,ActivationType.Silu,torch.bfloat16,torch.float4_e2m1fn_x2,torch.float4_e2m1fn_x2,QuantType.per_1x32,1,0,32,0,16.8736,flydsl_moe1_afp4_wfp4_bf16_t32x128x256_w4_kb4_bnt0,0.0%,10.44,125282.82
stage1,256,2,7168,256,384,8,ActivationType.Silu,torch.bfloat16,torch.float4_e2m1fn_x2,torch.float4_e2m1fn_x2,QuantType.per_1x32,1,0,32,0,14.96,flydsl_moe1_afp4_wfp4_bf16_t32x128x256_w4_kb4_bnt0_go,0.0%,11.78,141308.3
stage1,256,2,7168,256,384,8,ActivationType.Silu,torch.bfloat16,torch.float4_e2m1fn_x2,torch.float4_e2m1fn_x2,QuantType.per_1x32,1,0,32,0,15.3458,flydsl_moe1_afp4_wfp4_bf16_t32x128x256_w4_kb4,0.0%,11.48,137755.75
stage1,256,2,7168,256,384,8,ActivationType.Silu,torch.bfloat16,torch.float4_e2m1fn_x2,torch.float4_e2m1fn_x2,QuantType.per_1x32,1,0,32,0,13.8612,flydsl_moe1_afp4_wfp4_bf16_t32x128x256_w4_kb4_go,0.0%,12.71,152510.04
stage1,256,2,7168,256,384,8,ActivationType.Silu,torch.bfloat16,torch.float4_e2m1fn_x2,torch.float4_e2m1fn_x2,QuantType.per_1x32,1,0,32,0,14.8272,flydsl_moe1_afp4_wfp4_bf16_t32x128x256_w4_kb7_bnt0,0.0%,11.88,142573.93
stage1,256,2,7168,256,384,8,ActivationType.Silu,torch.bfloat16,torch.float4_e2m1fn_x2,torch.float4_e2m1fn_x2,QuantType.per_1x32,1,0,32,0,14.4758,flydsl_moe1_afp4_wfp4_bf16_t32x128x256_w4_kb7_bnt0_go,0.0%,12.17,146034.92
stage1,256,2,7168,256,384,8,ActivationType.Silu,torch.bfloat16,torch.float4_e2m1fn_x2,torch.float4_e2m1fn_x2,QuantType.per_1x32,1,0,32,0,13.6276,flydsl_moe1_afp4_wfp4_bf16_t32x128x256_w4_kb7,0.0%,12.93,155124.32
stage1,256,2,7168,256,384,8,ActivationType.Silu,torch.bfloat16,torch.float4_e2m1fn_x2,torch.float4_e2m1fn_x2,QuantType.per_1x32,1,0,32,0,13.0931,flydsl_moe1_afp4_wfp4_bf16_t32x128x256_w4_kb7_go,0.1%,13.45,161456.97
stage2,256,2,7168,256,384,8,ActivationType.Silu,torch.bfloat16,torch.float4_e2m1fn_x2,torch.float4_e2m1fn_x2,QuantType.per_1x32,1,0,32,0,11.657,flydsl_moe2_afp4_wfp4_bf16_t32x128x256_atomic,99.9%,15.11,181347.88
stage2,256,2,7168,256,384,8,ActivationType.Silu,torch.bfloat16,torch.float4_e2m1fn_x2,torch.float4_e2m1fn_x2,QuantType.per_1x32,1,0,32,0,16.7017,flydsl_moe2_afp4_wfp4_bf16_t32x128x256_reduce,0.0%,10.55,126572.28
stage2,256,2,7168,256,384,8,ActivationType.Silu,torch.bfloat16,torch.float4_e2m1fn_x2,torch.float4_e2m1fn_x2,QuantType.per_1x32,1,0,32,0,13.4651,flydsl_moe2_afp4_wfp4_bf16_t32x256x256_atomic,99.9%,13.08,156996.4
stage2,256,2,7168,256,384,8,ActivationType.Silu,torch.bfloat16,torch.float4_e2m1fn_x2,torch.float4_e2m1fn_x2,QuantType.per_1x32,1,0,32,0,18.6556,flydsl_moe2_afp4_wfp4_bf16_t32x256x256_reduce,0.0%,9.44,113315.69
stage1,256,2,7168,256,384,8,ActivationType.Silu,torch.bfloat16,torch.float4_e2m1fn_x2,torch.float4_e2m1fn_x2,QuantType.per_1x32,1,0,64,0,26.5652,flydsl_moe1_afp4_wfp4_bf16_t64x64x256_bnt0,0.0%,6.63,79576.75
stage1,256,2,7168,256,384,8,ActivationType.Silu,torch.bfloat16,torch.float4_e2m1fn_x2,torch.float4_e2m1fn_x2,QuantType.per_1x32,1,0,64,0,26.1482,flydsl_moe1_afp4_wfp4_bf16_t64x64x256,0.0%,6.74,80845.8
stage1,256,2,7168,256,384,8,ActivationType.Silu,torch.bfloat16,torch.float4_e2m1fn_x2,torch.float4_e2m1fn_x2,QuantType.per_1x32,1,0,64,0,26.242,flydsl_moe1_afp4_wfp4_bf16_t64x64x256_w2_bnt0,0.0%,6.71,80556.83
stage1,256,2,7168,256,384,8,ActivationType.Silu,torch.bfloat16,torch.float4_e2m1fn_x2,torch.float4_e2m1fn_x2,QuantType.per_1x32,1,0,64,0,26.5748,flydsl_moe1_afp4_wfp4_bf16_t64x64x256_w2,0.0%,6.63,79548.0
stage1,256,2,7168,256,384,8,ActivationType.Silu,torch.bfloat16,torch.float4_e2m1fn_x2,torch.float4_e2m1fn_x2,QuantType.per_1x32,1,0,64,0,26.5137,flydsl_moe1_afp4_wfp4_bf16_t64x64x256_w3_bnt0,0.0%,6.64,79731.32
stage1,256,2,7168,256,384,8,ActivationType.Silu,torch.bfloat16,torch.float4_e2m1fn_x2,torch.float4_e2m1fn_x2,QuantType.per_1x32,1,0,64,0,26.2973,flydsl_moe1_afp4_wfp4_bf16_t64x64x256_w3,0.0%,6.7,80387.42
stage1,256,2,7168,256,384,8,ActivationType.Silu,torch.bfloat16,torch.float4_e2m1fn_x2,torch.float4_e2m1fn_x2,QuantType.per_1x32,1,0,64,0,26.3942,flydsl_moe1_afp4_wfp4_bf16_t64x64x256_w4_bnt0,0.0%,6.67,80092.3
stage1,256,2,7168,256,384,8,ActivationType.Silu,torch.bfloat16,torch.float4_e2m1fn_x2,torch.float4_e2m1fn_x2,QuantType.per_1x32,1,0,64,0,26.6841,flydsl_moe1_afp4_wfp4_bf16_t64x64x256_w4,0.0%,6.6,79222.17
stage1,256,2,7168,256,384,8,ActivationType.Silu,torch.bfloat16,torch.float4_e2m1fn_x2,torch.float4_e2m1fn_x2,QuantType.per_1x32,1,0,64,0,29.1731,flydsl_moe1_afp4_wfp4_bf16_t64x128x256_bnt0,0.0%,6.04,72463.06
stage1,256,2,7168,256,384,8,ActivationType.Silu,torch.bfloat16,torch.float4_e2m1fn_x2,torch.float4_e2m1fn_x2,QuantType.per_1x32,1,0,64,0,29.1312,flydsl_moe1_afp4_wfp4_bf16_t64x128x256,0.0%,6.05,72567.29
stage1,256,2,7168,256,384,8,ActivationType.Silu,torch.bfloat16,torch.float4_e2m1fn_x2,torch.float4_e2m1fn_x2,QuantType.per_1x32,1,0,64,0,29.3955,flydsl_moe1_afp4_wfp4_bf16_t64x128x256_w2_bnt0,0.0%,5.99,71914.82
stage1,256,2,7168,256,384,8,ActivationType.Silu,torch.bfloat16,torch.float4_e2m1fn_x2,torch.float4_e2m1fn_x2,QuantType.per_1x32,1,0,64,0,29.4933,flydsl_moe1_afp4_wfp4_bf16_t64x128x256_w2,0.0%,5.97,71676.35
stage1,256,2,7168,256,384,8,ActivationType.Silu,torch.bfloat16,torch.float4_e2m1fn_x2,torch.float4_e2m1fn_x2,QuantType.per_1x32,1,0,64,0,29.0235,flydsl_moe1_afp4_wfp4_bf16_t64x128x256_w3_bnt0,0.0%,6.07,72836.57
stage1,256,2,7168,256,384,8,ActivationType.Silu,torch.bfloat16,torch.float4_e2m1fn_x2,torch.float4_e2m1fn_x2,QuantType.per_1x32,1,0,64,0,28.6809,flydsl_moe1_afp4_wfp4_bf16_t64x128x256_w3,0.0%,6.14,73706.62
stage1,256,2,7168,256,384,8,ActivationType.Silu,torch.bfloat16,torch.float4_e2m1fn_x2,torch.float4_e2m1fn_x2,QuantType.per_1x32,1,0,64,0,29.3437,flydsl_moe1_afp4_wfp4_bf16_t64x128x256_w4_bnt0,0.0%,6.0,72041.77
stage1,256,2,7168,256,384,8,ActivationType.Silu,torch.bfloat16,torch.float4_e2m1fn_x2,torch.float4_e2m1fn_x2,QuantType.per_1x32,1,0,64,0,29.3305,flydsl_moe1_afp4_wfp4_bf16_t64x128x256_w4,0.0%,6.01,72074.2
stage2,256,2,7168,256,384,8,ActivationType.Silu,torch.bfloat16,torch.float4_e2m1fn_x2,torch.float4_e2m1fn_x2,QuantType.per_1x32,1,0,64,0,12.82,flydsl_moe2_afp4_wfp4_bf16_t64x128x256_atomic,99.9%,13.74,164896.43
stage2,256,2,7168,256,384,8,ActivationType.Silu,torch.bfloat16,torch.float4_e2m1fn_x2,torch.float4_e2m1fn_x2,QuantType.per_1x32,1,0,64,0,18.8897,flydsl_moe2_afp4_wfp4_bf16_t64x128x256_reduce,0.0%,9.33,111911.37
stage2,256,2,7168,256,384,8,ActivationType.Silu,torch.bfloat16,torch.float4_e2m1fn_x2,torch.float4_e2m1fn_x2,QuantType.per_1x32,1,0,64,0,16.6396,flydsl_moe2_afp4_wfp4_bf16_t64x256x256_atomic,99.8%,10.59,127044.65
stage2,256,2,7168,256,384,8,ActivationType.Silu,torch.bfloat16,torch.float4_e2m1fn_x2,torch.float4_e2m1fn_x2,QuantType.per_1x32,1,0,64,0,20.5618,flydsl_moe2_afp4_wfp4_bf16_t64x256x256_reduce,0.0%,8.57,102810.66
stage1,256,2,7168,256,384,8,ActivationType.Silu,torch.bfloat16,torch.float4_e2m1fn_x2,torch.float4_e2m1fn_x2,QuantType.per_1x32,1,0,128,0,32.3823,flydsl_moe1_afp4_wfp4_bf16_t128x64x256_bnt0,0.0%,5.44,65281.72
stage1,256,2,7168,256,384,8,ActivationType.Silu,torch.bfloat16,torch.float4_e2m1fn_x2,torch.float4_e2m1fn_x2,QuantType.per_1x32,1,0,128,0,32.6441,flydsl_moe1_afp4_wfp4_bf16_t128x64x256,0.0%,5.4,64758.17
stage1,256,2,7168,256,384,8,ActivationType.Silu,torch.bfloat16,torch.float4_e2m1fn_x2,torch.float4_e2m1fn_x2,QuantType.per_1x32,1,0,128,0,33.01,flydsl_moe1_afp4_wfp4_bf16_t128x64x256_w2_bnt0,0.0%,5.34,64040.36
stage1,256,2,7168,256,384,8,ActivationType.Silu,torch.bfloat16,torch.float4_e2m1fn_x2,torch.float4_e2m1fn_x2,QuantType.per_1x32,1,0,128,0,32.4922,flydsl_moe1_afp4_wfp4_bf16_t128x64x256_w2,0.0%,5.42,65060.91
stage1,256,2,7168,256,384,8,ActivationType.Silu,torch.bfloat16,torch.float4_e2m1fn_x2,torch.float4_e2m1fn_x2,QuantType.per_1x32,1,0,128,0,32.4031,flydsl_moe1_afp4_wfp4_bf16_t128x64x256_w3_bnt0,0.0%,5.44,65239.81
stage1,256,2,7168,256,384,8,ActivationType.Silu,torch.bfloat16,torch.float4_e2m1fn_x2,torch.float4_e2m1fn_x2,QuantType.per_1x32,1,0,128,0,32.4894,flydsl_moe1_afp4_wfp4_bf16_t128x64x256_w3,0.0%,5.42,65066.52
stage1,256,2,7168,256,384,8,ActivationType.Silu,torch.bfloat16,torch.float4_e2m1fn_x2,torch.float4_e2m1fn_x2,QuantType.per_1x32,1,0,128,0,32.9899,flydsl_moe1_afp4_wfp4_bf16_t128x64x256_w4_bnt0,0.0%,5.34,64079.38
stage1,256,2,7168,256,384,8,ActivationType.Silu,torch.bfloat16,torch.float4_e2m1fn_x2,torch.float4_e2m1fn_x2,QuantType.per_1x32,1,0,128,0,32.2184,flydsl_moe1_afp4_wfp4_bf16_t128x64x256_w4,0.0%,5.47,65613.82
stage1,256,2,7168,256,384,8,ActivationType.Silu,torch.bfloat16,torch.float4_e2m1fn_x2,torch.float4_e2m1fn_x2,QuantType.per_1x32,1,0,128,0,35.1342,flydsl_moe1_afp4_wfp4_bf16_t128x128x256_bnt0,0.0%,5.01,60168.5
stage1,256,2,7168,256,384,8,ActivationType.Silu,torch.bfloat16,torch.float4_e2m1fn_x2,torch.float4_e2m1fn_x2,QuantType.per_1x32,1,0,128,0,34.7593,flydsl_moe1_afp4_wfp4_bf16_t128x128x256,0.0%,5.07,60817.46
stage1,256,2,7168,256,384,8,ActivationType.Silu,torch.bfloat16,torch.float4_e2m1fn_x2,torch.float4_e2m1fn_x2,QuantType.per_1x32,1,0,128,0,35.5003,flydsl_moe1_afp4_wfp4_bf16_t128x128x256_w2_bnt0,0.0%,4.96,59548.01
stage1,256,2,7168,256,384,8,ActivationType.Silu,torch.bfloat16,torch.float4_e2m1fn_x2,torch.float4_e2m1fn_x2,QuantType.per_1x32,1,0,128,0,34.8397,flydsl_moe1_afp4_wfp4_bf16_t128x128x256_w2,0.0%,5.06,60677.11
stage1,256,2,7168,256,384,8,ActivationType.Silu,torch.bfloat16,torch.float4_e2m1fn_x2,torch.float4_e2m1fn_x2,QuantType.per_1x32,1,0,128,0,35.2228,flydsl_moe1_afp4_wfp4_bf16_t128x128x256_w3_bnt0,0.0%,5.0,60017.15
stage1,256,2,7168,256,384,8,ActivationType.Silu,torch.bfloat16,torch.float4_e2m1fn_x2,torch.float4_e2m1fn_x2,QuantType.per_1x32,1,0,128,0,34.7811,flydsl_moe1_afp4_wfp4_bf16_t128x128x256_w3,0.0%,5.06,60779.34
stage1,256,2,7168,256,384,8,ActivationType.Silu,torch.bfloat16,torch.float4_e2m1fn_x2,torch.float4_e2m1fn_x2,QuantType.per_1x32,1,0,128,0,35.5237,flydsl_moe1_afp4_wfp4_bf16_t128x128x256_w4_bnt0,0.0%,4.96,59508.78
stage1,256,2,7168,256,384,8,ActivationType.Silu,torch.bfloat16,torch.float4_e2m1fn_x2,torch.float4_e2m1fn_x2,QuantType.per_1x32,1,0,128,0,34.7901,flydsl_moe1_afp4_wfp4_bf16_t128x128x256_w4,0.0%,5.06,60763.61
stage2,256,2,7168,256,384,8,ActivationType.Silu,torch.bfloat16,torch.float4_e2m1fn_x2,torch.float4_e2m1fn_x2,QuantType.per_1x32,1,0,128,0,17.4641,flydsl_moe2_afp4_wfp4_bf16_t128x128x256_atomic,99.9%,10.09,121046.73
stage2,256,2,7168,256,384,8,ActivationType.Silu,torch.bfloat16,torch.float4_e2m1fn_x2,torch.float4_e2m1fn_x2,QuantType.per_1x32,1,0,128,0,21.6122,flydsl_moe2_afp4_wfp4_bf16_t128x128x256_reduce,0.0%,8.15,97813.84
stage2,256,2,7168,256,384,8,ActivationType.Silu,torch.bfloat16,torch.float4_e2m1fn_x2,torch.float4_e2m1fn_x2,QuantType.per_1x32,1,0,128,0,23.1396,flydsl_moe2_afp4_wfp4_bf16_t128x256x256_atomic,99.9%,7.61,91357.34
stage2,256,2,7168,256,384,8,ActivationType.Silu,torch.bfloat16,torch.float4_e2m1fn_x2,torch.float4_e2m1fn_x2,QuantType.per_1x32,1,0,128,0,27.9798,flydsl_moe2_afp4_wfp4_bf16_t128x256x256_reduce,0.0%,6.3,75553.51
stage1,256,4,7168,256,384,8,ActivationType.Silu,torch.bfloat16,torch.float4_e2m1fn_x2,torch.float4_e2m1fn_x2,QuantType.per_1x32,1,0,32,0,26.8472,moe_ck2stages_gemm1_256x32x128x128_1x4_MulABScaleShuffled_v3_Nswizzle0_Quant3_MulRoutedWeight0_silu_FP4X2_FP4X2_B16,0.0%,13.12,78742.48
stage1,256,4,7168,256,384,8,ActivationType.Silu,torch.bfloat16,torch.float4_e2m1fn_x2,torch.float4_e2m1fn_x2,QuantType.per_1x32,1,0,32,0,24.296,moe_ck2stages_gemm1_64x32x32x128_1x1_MulABScaleShuffled_v3_Nswizzle0_Quant3_MulRoutedWeight0_silu_FP4X2_FP4X2_B16,0.0%,14.5,87010.83
stage2,256,4,7168,256,384,8,ActivationType.Silu,torch.bfloat16,torch.float4_e2m1fn_x2,torch.float4_e2m1fn_x2,QuantType.per_1x32,1,0,32,0,15.6623,moe_ck2stages_gemm2_256x32x128x128_1x4_MulABScaleExpertWeightShuffled_v3_Nswizzle0_Quant3_MulRoutedWeight1_FP4X2_FP4X2_B16,1.3%,22.49,134974.76
stage2,256,4,7168,256,384,8,ActivationType.Silu,torch.bfloat16,torch.float4_e2m1fn_x2,torch.float4_e2m1fn_x2,QuantType.per_1x32,1,0,32,0,14.6473,moe_ck2stages_gemm2_64x32x32x128_1x1_MulABScaleExpertWeightShuffled_v1_Nswizzle0_Quant3_MulRoutedWeight1_FP4X2_FP4X2_B16,1.4%,24.05,144327.98
stage1,256,4,7168,256,384,8,ActivationType.Silu,torch.bfloat16,torch.float4_e2m1fn_x2,torch.float4_e2m1fn_x2,QuantType.per_1x32,1,0,64,0,31.4433,moe_ck2stages_gemm1_256x64x128x128_1x4_MulABScaleShuffled_v3_Nswizzle0_Quant3_MulRoutedWeight0_silu_FP4X2_FP4X2_B16,0.0%,11.2,67232.61
stage2,256,4,7168,256,384,8,ActivationType.Silu,torch.bfloat16,torch.float4_e2m1fn_x2,torch.float4_e2m1fn_x2,QuantType.per_1x32,1,0,64,0,16.4227,moe_ck2stages_gemm2_256x64x128x128_1x4_MulABScaleExpertWeightShuffled_v3_Nswizzle0_Quant3_MulRoutedWeight1_FP4X2_FP4X2_B16,1.3%,21.45,128725.19
stage2,256,4,7168,256,384,8,ActivationType.Silu,torch.bfloat16,torch.float4_e2m1fn_x2,torch.float4_e2m1fn_x2,QuantType.per_1x32,1,0,64,0,21.7406,moe_ck2stages_gemm2_64x64x128x128_1x1_MulABScaleExpertWeightShuffled_v3_Nswizzle0_Quant3_MulRoutedWeight1_FP4X2_FP4X2_B16,1.3%,16.21,97238.13
stage1,256,4,7168,256,384,8,ActivationType.Silu,torch.bfloat16,torch.float4_e2m1fn_x2,torch.float4_e2m1fn_x2,QuantType.per_1x32,1,0,128,0,41.7134,moe_ck2stages_gemm1_256x128x128x128_1x4_MulABScaleShuffled_v3_Nswizzle0_Quant3_MulRoutedWeight0_silu_FP4X2_FP4X2_B16,0.0%,8.45,50679.52
stage2,256,4,7168,256,384,8,ActivationType.Silu,torch.bfloat16,torch.float4_e2m1fn_x2,torch.float4_e2m1fn_x2,QuantType.per_1x32,1,0,128,0,23.1014,moe_ck2stages_gemm2_256x128x128x128_1x4_MulABScaleExpertWeightShuffled_v3_Nswizzle0_Quant3_MulRoutedWeight1_FP4X2_FP4X2_B16,1.3%,15.25,91510.26
stage2,256,4,7168,256,384,8,ActivationType.Silu,torch.bfloat16,torch.float4_e2m1fn_x2,torch.float4_e2m1fn_x2,QuantType.per_1x32,1,0,128,0,30.7587,moe_ck2stages_gemm2_64x128x128x128_1x1_MulABScaleExpertWeightShuffled_v3_Nswizzle0_Quant3_MulRoutedWeight1_FP4X2_FP4X2_B16,1.2%,11.45,68729.02
stage1,256,4,7168,256,384,8,ActivationType.Silu,torch.bfloat16,torch.float4_e2m1fn_x2,torch.float4_e2m1fn_x2,QuantType.per_1x32,1,0,32,0,28.912,flydsl_moe1_afp4_wfp4_bf16_t16x32x256_bnt0,0.0%,12.19,73118.96
stage1,256,4,7168,256,384,8,ActivationType.Silu,torch.bfloat16,torch.float4_e2m1fn_x2,torch.float4_e2m1fn_x2,QuantType.per_1x32,1,0,32,0,28.8392,flydsl_moe1_afp4_wfp4_bf16_t16x32x256,0.0%,12.22,73303.53
stage1,256,4,7168,256,384,8,ActivationType.Silu,torch.bfloat16,torch.float4_e2m1fn_x2,torch.float4_e2m1fn_x2,QuantType.per_1x32,1,0,32,0,37.4214,flydsl_moe1_afp4_wfp4_bf16_t16x32x256_kb2_bnt0,0.0%,9.41,56492.15
stage1,256,4,7168,256,384,8,ActivationType.Silu,torch.bfloat16,torch.float4_e2m1fn_x2,torch.float4_e2m1fn_x2,QuantType.per_1x32,1,0,32,0,58.5592,flydsl_moe1_afp4_wfp4_bf16_t16x32x256_kb2_bnt0_go,0.0%,6.02,36100.48
stage1,256,4,7168,256,384,8,ActivationType.Silu,torch.bfloat16,torch.float4_e2m1fn_x2,torch.float4_e2m1fn_x2,QuantType.per_1x32,1,0,32,0,36.5117,flydsl_moe1_afp4_wfp4_bf16_t16x32x256_kb2,0.0%,9.65,57899.67
stage1,256,4,7168,256,384,8,ActivationType.Silu,torch.bfloat16,torch.float4_e2m1fn_x2,torch.float4_e2m1fn_x2,QuantType.per_1x32,1,0,32,0,59.489,flydsl_moe1_afp4_wfp4_bf16_t16x32x256_kb2_go,0.0%,5.92,35536.24
stage1,256,4,7168,256,384,8,ActivationType.Silu,torch.bfloat16,torch.float4_e2m1fn_x2,torch.float4_e2m1fn_x2,QuantType.per_1x32,1,0,32,0,39.5382,flydsl_moe1_afp4_wfp4_bf16_t16x32x256_kb4_bnt0,0.0%,8.91,53467.66
stage1,256,4,7168,256,384,8,ActivationType.Silu,torch.bfloat16,torch.float4_e2m1fn_x2,torch.float4_e2m1fn_x2,QuantType.per_1x32,1,0,32,0,60.0818,flydsl_moe1_afp4_wfp4_bf16_t16x32x256_kb4_bnt0_go,0.0%,5.86,35185.62
stage1,256,4,7168,256,384,8,ActivationType.Silu,torch.bfloat16,torch.float4_e2m1fn_x2,torch.float4_e2m1fn_x2,QuantType.per_1x32,1,0,32,0,40.6161,flydsl_moe1_afp4_wfp4_bf16_t16x32x256_kb4,0.0%,8.67,52048.7
stage1,256,4,7168,256,384,8,ActivationType.Silu,torch.bfloat16,torch.float4_e2m1fn_x2,torch.float4_e2m1fn_x2,QuantType.per_1x32,1,0,32,0,61.232,flydsl_moe1_afp4_wfp4_bf16_t16x32x256_kb4_go,0.0%,5.75,34524.68
stage1,256,4,7168,256,384,8,ActivationType.Silu,torch.bfloat16,torch.float4_e2m1fn_x2,torch.float4_e2m1fn_x2,QuantType.per_1x32,1,0,32,0,43.5147,flydsl_moe1_afp4_wfp4_bf16_t16x32x256_kb7_bnt0,0.1%,8.1,48581.63
stage1,256,4,7168,256,384,8,ActivationType.Silu,torch.bfloat16,torch.float4_e2m1fn_x2,torch.float4_e2m1fn_x2,QuantType.per_1x32,1,0,32,0,57.1409,flydsl_moe1_afp4_wfp4_bf16_t16x32x256_kb7_bnt0_go,0.1%,6.17,36996.53
stage1,256,4,7168,256,384,8,ActivationType.Silu,torch.bfloat16,torch.float4_e2m1fn_x2,torch.float4_e2m1fn_x2,QuantType.per_1x32,1,0,32,0,43.4305,flydsl_moe1_afp4_wfp4_bf16_t16x32x256_kb7,0.1%,8.11,48675.82
stage1,256,4,7168,256,384,8,ActivationType.Silu,torch.bfloat16,torch.float4_e2m1fn_x2,torch.float4_e2m1fn_x2,QuantType.per_1x32,1,0,32,0,58.1418,flydsl_moe1_afp4_wfp4_bf16_t16x32x256_kb7_go,0.1%,6.06,36359.65
stage1,256,4,7168,256,384,8,ActivationType.Silu,torch.bfloat16,torch.float4_e2m1fn_x2,torch.float4_e2m1fn_x2,QuantType.per_1x32,1,0,32,0,29.3201,flydsl_moe1_afp4_wfp4_bf16_t16x32x256_w2_bnt0,0.0%,12.02,72101.23
stage1,256,4,7168,256,384,8,ActivationType.Silu,torch.bfloat16,torch.float4_e2m1fn_x2,torch.float4_e2m1fn_x2,QuantType.per_1x32,1,0,32,0,28.686,flydsl_moe1_afp4_wfp4_bf16_t16x32x256_w2,0.0%,12.28,73695.02
stage1,256,4,7168,256,384,8,ActivationType.Silu,torch.bfloat16,torch.float4_e2m1fn_x2,torch.float4_e2m1fn_x2,QuantType.per_1x32,1,0,32,0,26.2978,flydsl_moe1_afp4_wfp4_bf16_t16x32x256_w2_kb2_bnt0,0.0%,13.4,80387.53
stage1,256,4,7168,256,384,8,ActivationType.Silu,torch.bfloat16,torch.float4_e2m1fn_x2,torch.float4_e2m1fn_x2,QuantType.per_1x32,1,0,32,0,36.1988,flydsl_moe1_afp4_wfp4_bf16_t16x32x256_w2_kb2_bnt0_go,0.0%,9.73,58400.15
stage1,256,4,7168,256,384,8,ActivationType.Silu,torch.bfloat16,torch.float4_e2m1fn_x2,torch.float4_e2m1fn_x2,QuantType.per_1x32,1,0,32,0,27.6101,flydsl_moe1_afp4_wfp4_bf16_t16x32x256_w2_kb2,0.0%,12.76,76566.74
stage1,256,4,7168,256,384,8,ActivationType.Silu,torch.bfloat16,torch.float4_e2m1fn_x2,torch.float4_e2m1fn_x2,QuantType.per_1x32,1,0,32,0,35.3199,flydsl_moe1_afp4_wfp4_bf16_t16x32x256_w2_kb2_go,0.0%,9.98,59853.38
stage1,256,4,7168,256,384,8,ActivationType.Silu,torch.bfloat16,torch.float4_e2m1fn_x2,torch.float4_e2m1fn_x2,QuantType.per_1x32,1,0,32,0,27.7569,flydsl_moe1_afp4_wfp4_bf16_t16x32x256_w2_kb4_bnt0,0.0%,12.69,76161.79
stage1,256,4,7168,256,384,8,ActivationType.Silu,torch.bfloat16,torch.float4_e2m1fn_x2,torch.float4_e2m1fn_x2,QuantType.per_1x32,1,0,32,0,37.2749,flydsl_moe1_afp4_wfp4_bf16_t16x32x256_w2_kb4_bnt0_go,0.0%,9.45,56714.18
stage1,256,4,7168,256,384,8,ActivationType.Silu,torch.bfloat16,torch.float4_e2m1fn_x2,torch.float4_e2m1fn_x2,QuantType.per_1x32,1,0,32,0,27.9068,flydsl_moe1_afp4_wfp4_bf16_t16x32x256_w2_kb4,0.0%,12.62,75752.69
stage1,256,4,7168,256,384,8,ActivationType.Silu,torch.bfloat16,torch.float4_e2m1fn_x2,torch.float4_e2m1fn_x2,QuantType.per_1x32,1,0,32,0,37.2414,flydsl_moe1_afp4_wfp4_bf16_t16x32x256_w2_kb4_go,0.0%,9.46,56765.19
stage1,256,4,7168,256,384,8,ActivationType.Silu,torch.bfloat16,torch.float4_e2m1fn_x2,torch.float4_e2m1fn_x2,QuantType.per_1x32,1,0,32,0,30.8396,flydsl_moe1_afp4_wfp4_bf16_t16x32x256_w2_kb7_bnt0,0.1%,11.42,68548.72
stage1,256,4,7168,256,384,8,ActivationType.Silu,torch.bfloat16,torch.float4_e2m1fn_x2,torch.float4_e2m1fn_x2,QuantType.per_1x32,1,0,32,0,36.7518,flydsl_moe1_afp4_wfp4_bf16_t16x32x256_w2_kb7_bnt0_go,0.1%,9.59,57521.41
stage1,256,4,7168,256,384,8,ActivationType.Silu,torch.bfloat16,torch.float4_e2m1fn_x2,torch.float4_e2m1fn_x2,QuantType.per_1x32,1,0,32,0,30.3432,flydsl_moe1_afp4_wfp4_bf16_t16x32x256_w2_kb7,0.1%,11.61,69670.15
stage1,256,4,7168,256,384,8,ActivationType.Silu,torch.bfloat16,torch.float4_e2m1fn_x2,torch.float4_e2m1fn_x2,QuantType.per_1x32,1,0,32,0,36.9644,flydsl_moe1_afp4_wfp4_bf16_t16x32x256_w2_kb7_go,0.1%,9.53,57190.57
stage1,256,4,7168,256,384,8,ActivationType.Silu,torch.bfloat16,torch.float4_e2m1fn_x2,torch.float4_e2m1fn_x2,QuantType.per_1x32,1,0,32,0,28.4651,flydsl_moe1_afp4_wfp4_bf16_t16x32x256_w3_bnt0,0.0%,12.38,74266.92
stage1,256,4,7168,256,384,8,ActivationType.Silu,torch.bfloat16,torch.float4_e2m1fn_x2,torch.float4_e2m1fn_x2,QuantType.per_1x32,1,0,32,0,28.5474,flydsl_moe1_afp4_wfp4_bf16_t16x32x256_w3,0.0%,12.34,74052.81
stage1,256,4,7168,256,384,8,ActivationType.Silu,torch.bfloat16,torch.float4_e2m1fn_x2,torch.float4_e2m1fn_x2,QuantType.per_1x32,1,0,32,0,26.7996,flydsl_moe1_afp4_wfp4_bf16_t16x32x256_w3_kb2_bnt0,0.0%,13.15,78882.34
stage1,256,4,7168,256,384,8,ActivationType.Silu,torch.bfloat16,torch.float4_e2m1fn_x2,torch.float4_e2m1fn_x2,QuantType.per_1x32,1,0,32,0,35.3347,flydsl_moe1_afp4_wfp4_bf16_t16x32x256_w3_kb2_bnt0_go,0.0%,9.97,59828.31
stage1,256,4,7168,256,384,8,ActivationType.Silu,torch.bfloat16,torch.float4_e2m1fn_x2,torch.float4_e2m1fn_x2,QuantType.per_1x32,1,0,32,0,25.9913,flydsl_moe1_afp4_wfp4_bf16_t16x32x256_w3_kb2,0.0%,13.56,81335.49
stage1,256,4,7168,256,384,8,ActivationType.Silu,torch.bfloat16,torch.float4_e2m1fn_x2,torch.float4_e2m1fn_x2,QuantType.per_1x32,1,0,32,0,35.3982,flydsl_moe1_afp4_wfp4_bf16_t16x32x256_w3_kb2_go,0.0%,9.95,59720.98
stage1,256,4,7168,256,384,8,ActivationType.Silu,torch.bfloat16,torch.float4_e2m1fn_x2,torch.float4_e2m1fn_x2,QuantType.per_1x32,1,0,32,0,27.838,flydsl_moe1_afp4_wfp4_bf16_t16x32x256_w3_kb4_bnt0,0.0%,12.66,75939.91
stage1,256,4,7168,256,384,8,ActivationType.Silu,torch.bfloat16,torch.float4_e2m1fn_x2,torch.float4_e2m1fn_x2,QuantType.per_1x32,1,0,32,0,31.9463,flydsl_moe1_afp4_wfp4_bf16_t16x32x256_w3_kb4_bnt0_go,0.0%,11.03,66174.02
stage1,256,4,7168,256,384,8,ActivationType.Silu,torch.bfloat16,torch.float4_e2m1fn_x2,torch.float4_e2m1fn_x2,QuantType.per_1x32,1,0,32,0,26.9419,flydsl_moe1_afp4_wfp4_bf16_t16x32x256_w3_kb4,0.0%,13.08,78465.71
stage1,256,4,7168,256,384,8,ActivationType.Silu,torch.bfloat16,torch.float4_e2m1fn_x2,torch.float4_e2m1fn_x2,QuantType.per_1x32,1,0,32,0,31.6654,flydsl_moe1_afp4_wfp4_bf16_t16x32x256_w3_kb4_go,0.0%,11.13,66761.05
stage1,256,4,7168,256,384,8,ActivationType.Silu,torch.bfloat16,torch.float4_e2m1fn_x2,torch.float4_e2m1fn_x2,QuantType.per_1x32,1,0,32,0,27.7102,flydsl_moe1_afp4_wfp4_bf16_t16x32x256_w3_kb7_bnt0,0.1%,12.71,76290.15
stage1,256,4,7168,256,384,8,ActivationType.Silu,torch.bfloat16,torch.float4_e2m1fn_x2,torch.float4_e2m1fn_x2,QuantType.per_1x32,1,0,32,0,30.8695,flydsl_moe1_afp4_wfp4_bf16_t16x32x256_w3_kb7_bnt0_go,0.1%,11.41,68482.33
stage1,256,4,7168,256,384,8,ActivationType.Silu,torch.bfloat16,torch.float4_e2m1fn_x2,torch.float4_e2m1fn_x2,QuantType.per_1x32,1,0,32,0,27.6245,flydsl_moe1_afp4_wfp4_bf16_t16x32x256_w3_kb7,0.0%,12.75,76526.82
stage1,256,4,7168,256,384,8,ActivationType.Silu,torch.bfloat16,torch.float4_e2m1fn_x2,torch.float4_e2m1fn_x2,QuantType.per_1x32,1,0,32,0,30.5164,flydsl_moe1_afp4_wfp4_bf16_t16x32x256_w3_kb7_go,0.1%,11.55,69274.73
stage1,256,4,7168,256,384,8,ActivationType.Silu,torch.bfloat16,torch.float4_e2m1fn_x2,torch.float4_e2m1fn_x2,QuantType.per_1x32,1,0,32,0,28.8932,flydsl_moe1_afp4_wfp4_bf16_t16x32x256_w4_bnt0,0.0%,12.19,73166.53
stage1,256,4,7168,256,384,8,ActivationType.Silu,torch.bfloat16,torch.float4_e2m1fn_x2,torch.float4_e2m1fn_x2,QuantType.per_1x32,1,0,32,0,28.7805,flydsl_moe1_afp4_wfp4_bf16_t16x32x256_w4,0.0%,12.24,73453.04
stage1,256,4,7168,256,384,8,ActivationType.Silu,torch.bfloat16,torch.float4_e2m1fn_x2,torch.float4_e2m1fn_x2,QuantType.per_1x32,1,0,32,0,25.4194,flydsl_moe1_afp4_wfp4_bf16_t16x32x256_w4_kb2_bnt0,0.0%,13.86,83165.43
stage1,256,4,7168,256,384,8,ActivationType.Silu,torch.bfloat16,torch.float4_e2m1fn_x2,torch.float4_e2m1fn_x2,QuantType.per_1x32,1,0,32,0,26.0033,flydsl_moe1_afp4_wfp4_bf16_t16x32x256_w4_kb2_bnt0_go,0.0%,13.55,81297.96
stage1,256,4,7168,256,384,8,ActivationType.Silu,torch.bfloat16,torch.float4_e2m1fn_x2,torch.float4_e2m1fn_x2,QuantType.per_1x32,1,0,32,0,27.6489,flydsl_moe1_afp4_wfp4_bf16_t16x32x256_w4_kb2,0.0%,12.74,76459.29
stage1,256,4,7168,256,384,8,ActivationType.Silu,torch.bfloat16,torch.float4_e2m1fn_x2,torch.float4_e2m1fn_x2,QuantType.per_1x32,1,0,32,0,25.1495,flydsl_moe1_afp4_wfp4_bf16_t16x32x256_w4_kb2_go,0.0%,14.01,84057.94
stage1,256,4,7168,256,384,8,ActivationType.Silu,torch.bfloat16,torch.float4_e2m1fn_x2,torch.float4_e2m1fn_x2,QuantType.per_1x32,1,0,32,0,20.461,flydsl_moe1_afp4_wfp4_bf16_t16x32x256_w4_kb4_bnt0,0.0%,17.22,103319.25
stage1,256,4,7168,256,384,8,ActivationType.Silu,torch.bfloat16,torch.float4_e2m1fn_x2,torch.float4_e2m1fn_x2,QuantType.per_1x32,1,0,32,0,28.6116,flydsl_moe1_afp4_wfp4_bf16_t16x32x256_w4_kb4_bnt0_go,0.0%,12.31,73886.65
stage1,256,4,7168,256,384,8,ActivationType.Silu,torch.bfloat16,torch.float4_e2m1fn_x2,torch.float4_e2m1fn_x2,QuantType.per_1x32,1,0,32,0,22.38,flydsl_moe1_afp4_wfp4_bf16_t16x32x256_w4_kb4,0.0%,15.74,94460.02
stage1,256,4,7168,256,384,8,ActivationType.Silu,torch.bfloat16,torch.float4_e2m1fn_x2,torch.float4_e2m1fn_x2,QuantType.per_1x32,1,0,32,0,26.1747,flydsl_moe1_afp4_wfp4_bf16_t16x32x256_w4_kb4_go,0.0%,13.46,80765.6
stage1,256,4,7168,256,384,8,ActivationType.Silu,torch.bfloat16,torch.float4_e2m1fn_x2,torch.float4_e2m1fn_x2,QuantType.per_1x32,1,0,32,0,24.8427,flydsl_moe1_afp4_wfp4_bf16_t16x32x256_w4_kb7_bnt0,0.1%,14.18,85096.03
stage1,256,4,7168,256,384,8,ActivationType.Silu,torch.bfloat16,torch.float4_e2m1fn_x2,torch.float4_e2m1fn_x2,QuantType.per_1x32,1,0,32,0,28.6983,flydsl_moe1_afp4_wfp4_bf16_t16x32x256_w4_kb7_bnt0_go,0.1%,12.28,73663.43
stage1,256,4,7168,256,384,8,ActivationType.Silu,torch.bfloat16,torch.float4_e2m1fn_x2,torch.float4_e2m1fn_x2,QuantType.per_1x32,1,0,32,0,26.2777,flydsl_moe1_afp4_wfp4_bf16_t16x32x256_w4_kb7,0.0%,13.41,80449.02
stage1,256,4,7168,256,384,8,ActivationType.Silu,torch.bfloat16,torch.float4_e2m1fn_x2,torch.float4_e2m1fn_x2,QuantType.per_1x32,1,0,32,0,27.4251,flydsl_moe1_afp4_wfp4_bf16_t16x32x256_w4_kb7_go,0.1%,12.85,77083.23
stage1,256,4,7168,256,384,8,ActivationType.Silu,torch.bfloat16,torch.float4_e2m1fn_x2,torch.float4_e2m1fn_x2,QuantType.per_1x32,1,0,32,0,31.1817,flydsl_moe1_afp4_wfp4_bf16_t16x64x256_bnt0,0.0%,11.3,67796.66
stage1,256,4,7168,256,384,8,ActivationType.Silu,torch.bfloat16,torch.float4_e2m1fn_x2,torch.float4_e2m1fn_x2,QuantType.per_1x32,1,0,32,0,31.3189,flydsl_moe1_afp4_wfp4_bf16_t16x64x256,0.0%,11.25,67499.66
stage1,256,4,7168,256,384,8,ActivationType.Silu,torch.bfloat16,torch.float4_e2m1fn_x2,torch.float4_e2m1fn_x2,QuantType.per_1x32,1,0,32,0,27.1807,flydsl_moe1_afp4_wfp4_bf16_t16x64x256_kb2_bnt0,0.0%,12.96,77776.34
stage1,256,4,7168,256,384,8,ActivationType.Silu,torch.bfloat16,torch.float4_e2m1fn_x2,torch.float4_e2m1fn_x2,QuantType.per_1x32,1,0,32,0,33.8705,flydsl_moe1_afp4_wfp4_bf16_t16x64x256_kb2_bnt0_go,0.0%,10.4,62414.64
stage1,256,4,7168,256,384,8,ActivationType.Silu,torch.bfloat16,torch.float4_e2m1fn_x2,torch.float4_e2m1fn_x2,QuantType.per_1x32,1,0,32,0,26.77,flydsl_moe1_afp4_wfp4_bf16_t16x64x256_kb2,0.0%,13.16,78969.56
stage1,256,4,7168,256,384,8,ActivationType.Silu,torch.bfloat16,torch.float4_e2m1fn_x2,torch.float4_e2m1fn_x2,QuantType.per_1x32,1,0,32,0,34.666,flydsl_moe1_afp4_wfp4_bf16_t16x64x256_kb2_go,0.0%,10.16,60982.38
stage1,256,4,7168,256,384,8,ActivationType.Silu,torch.bfloat16,torch.float4_e2m1fn_x2,torch.float4_e2m1fn_x2,QuantType.per_1x32,1,0,32,0,26.9553,flydsl_moe1_afp4_wfp4_bf16_t16x64x256_kb4_bnt0,0.0%,13.07,78426.7
stage1,256,4,7168,256,384,8,ActivationType.Silu,torch.bfloat16,torch.float4_e2m1fn_x2,torch.float4_e2m1fn_x2,QuantType.per_1x32,1,0,32,0,37.3256,flydsl_moe1_afp4_wfp4_bf16_t16x64x256_kb4_bnt0_go,0.0%,9.44,56637.14
stage1,256,4,7168,256,384,8,ActivationType.Silu,torch.bfloat16,torch.float4_e2m1fn_x2,torch.float4_e2m1fn_x2,QuantType.per_1x32,1,0,32,0,27.1943,flydsl_moe1_afp4_wfp4_bf16_t16x64x256_kb4,0.0%,12.96,77737.44
stage1,256,4,7168,256,384,8,ActivationType.Silu,torch.bfloat16,torch.float4_e2m1fn_x2,torch.float4_e2m1fn_x2,QuantType.per_1x32,1,0,32,0,38.2989,flydsl_moe1_afp4_wfp4_bf16_t16x64x256_kb4_go,0.0%,9.2,55197.81
stage1,256,4,7168,256,384,8,ActivationType.Silu,torch.bfloat16,torch.float4_e2m1fn_x2,torch.float4_e2m1fn_x2,QuantType.per_1x32,1,0,32,0,30.7286,flydsl_moe1_afp4_wfp4_bf16_t16x64x256_kb7_bnt0,0.1%,11.47,68796.34
stage1,256,4,7168,256,384,8,ActivationType.Silu,torch.bfloat16,torch.float4_e2m1fn_x2,torch.float4_e2m1fn_x2,QuantType.per_1x32,1,0,32,0,35.8245,flydsl_moe1_afp4_wfp4_bf16_t16x64x256_kb7_bnt0_go,0.1%,9.83,59010.32
stage1,256,4,7168,256,384,8,ActivationType.Silu,torch.bfloat16,torch.float4_e2m1fn_x2,torch.float4_e2m1fn_x2,QuantType.per_1x32,1,0,32,0,30.2136,flydsl_moe1_afp4_wfp4_bf16_t16x64x256_kb7,0.1%,11.66,69969.0
stage1,256,4,7168,256,384,8,ActivationType.Silu,torch.bfloat16,torch.float4_e2m1fn_x2,torch.float4_e2m1fn_x2,QuantType.per_1x32,1,0,32,0,36.7407,flydsl_moe1_afp4_wfp4_bf16_t16x64x256_kb7_go,0.1%,9.59,57538.78
stage1,256,4,7168,256,384,8,ActivationType.Silu,torch.bfloat16,torch.float4_e2m1fn_x2,torch.float4_e2m1fn_x2,QuantType.per_1x32,1,0,32,0,31.2761,flydsl_moe1_afp4_wfp4_bf16_t16x64x256_w2_bnt0,0.0%,11.26,67592.03
stage1,256,4,7168,256,384,8,ActivationType.Silu,torch.bfloat16,torch.float4_e2m1fn_x2,torch.float4_e2m1fn_x2,QuantType.per_1x32,1,0,32,0,31.1445,flydsl_moe1_afp4_wfp4_bf16_t16x64x256_w2,0.0%,11.31,67877.64
stage1,256,4,7168,256,384,8,ActivationType.Silu,torch.bfloat16,torch.float4_e2m1fn_x2,torch.float4_e2m1fn_x2,QuantType.per_1x32,1,0,32,0,27.1997,flydsl_moe1_afp4_wfp4_bf16_t16x64x256_w2_kb2_bnt0,0.0%,12.95,77722.01
stage1,256,4,7168,256,384,8,ActivationType.Silu,torch.bfloat16,torch.float4_e2m1fn_x2,torch.float4_e2m1fn_x2,QuantType.per_1x32,1,0,32,0,25.4402,flydsl_moe1_afp4_wfp4_bf16_t16x64x256_w2_kb2_bnt0_go,0.0%,13.85,83097.43
stage1,256,4,7168,256,384,8,ActivationType.Silu,torch.bfloat16,torch.float4_e2m1fn_x2,torch.float4_e2m1fn_x2,QuantType.per_1x32,1,0,32,0,27.4435,flydsl_moe1_afp4_wfp4_bf16_t16x64x256_w2_kb2,0.0%,12.84,77031.55
stage1,256,4,7168,256,384,8,ActivationType.Silu,torch.bfloat16,torch.float4_e2m1fn_x2,torch.float4_e2m1fn_x2,QuantType.per_1x32,1,0,32,0,25.4403,flydsl_moe1_afp4_wfp4_bf16_t16x64x256_w2_kb2_go,0.0%,13.85,83097.1
stage1,256,4,7168,256,384,8,ActivationType.Silu,torch.bfloat16,torch.float4_e2m1fn_x2,torch.float4_e2m1fn_x2,QuantType.per_1x32,1,0,32,0,20.4871,flydsl_moe1_afp4_wfp4_bf16_t16x64x256_w2_kb4_bnt0,0.0%,17.2,103187.63
stage1,256,4,7168,256,384,8,ActivationType.Silu,torch.bfloat16,torch.float4_e2m1fn_x2,torch.float4_e2m1fn_x2,QuantType.per_1x32,1,0,32,0,28.0779,flydsl_moe1_afp4_wfp4_bf16_t16x64x256_w2_kb4_bnt0_go,0.0%,12.55,75291.07
stage1,256,4,7168,256,384,8,ActivationType.Silu,torch.bfloat16,torch.float4_e2m1fn_x2,torch.float4_e2m1fn_x2,QuantType.per_1x32,1,0,32,0,20.2056,flydsl_moe1_afp4_wfp4_bf16_t16x64x256_w2_kb4,0.0%,17.44,104625.21
stage1,256,4,7168,256,384,8,ActivationType.Silu,torch.bfloat16,torch.float4_e2m1fn_x2,torch.float4_e2m1fn_x2,QuantType.per_1x32,1,0,32,0,28.2348,flydsl_moe1_afp4_wfp4_bf16_t16x64x256_w2_kb4_go,0.0%,12.48,74872.68
stage1,256,4,7168,256,384,8,ActivationType.Silu,torch.bfloat16,torch.float4_e2m1fn_x2,torch.float4_e2m1fn_x2,QuantType.per_1x32,1,0,32,0,24.5914,flydsl_moe1_afp4_wfp4_bf16_t16x64x256_w2_kb7_bnt0,0.0%,14.33,85965.63
stage1,256,4,7168,256,384,8,ActivationType.Silu,torch.bfloat16,torch.float4_e2m1fn_x2,torch.float4_e2m1fn_x2,QuantType.per_1x32,1,0,32,0,28.4073,flydsl_moe1_afp4_wfp4_bf16_t16x64x256_w2_kb7_bnt0_go,0.1%,12.4,74418.03
stage1,256,4,7168,256,384,8,ActivationType.Silu,torch.bfloat16,torch.float4_e2m1fn_x2,torch.float4_e2m1fn_x2,QuantType.per_1x32,1,0,32,0,26.067,flydsl_moe1_afp4_wfp4_bf16_t16x64x256_w2_kb7,0.1%,13.52,81099.29
stage1,256,4,7168,256,384,8,ActivationType.Silu,torch.bfloat16,torch.float4_e2m1fn_x2,torch.float4_e2m1fn_x2,QuantType.per_1x32,1,0,32,0,29.0796,flydsl_moe1_afp4_wfp4_bf16_t16x64x256_w2_kb7_go,0.1%,12.12,72697.53
stage1,256,4,7168,256,384,8,ActivationType.Silu,torch.bfloat16,torch.float4_e2m1fn_x2,torch.float4_e2m1fn_x2,QuantType.per_1x32,1,0,32,0,31.2485,flydsl_moe1_afp4_wfp4_bf16_t16x64x256_w3_bnt0,0.0%,11.27,67651.73
stage1,256,4,7168,256,384,8,ActivationType.Silu,torch.bfloat16,torch.float4_e2m1fn_x2,torch.float4_e2m1fn_x2,QuantType.per_1x32,1,0,32,0,31.2585,flydsl_moe1_afp4_wfp4_bf16_t16x64x256_w3,0.0%,11.27,67630.09
stage1,256,4,7168,256,384,8,ActivationType.Silu,torch.bfloat16,torch.float4_e2m1fn_x2,torch.float4_e2m1fn_x2,QuantType.per_1x32,1,0,32,0,25.6172,flydsl_moe1_afp4_wfp4_bf16_t16x64x256_w3_kb2_bnt0,0.0%,13.75,82523.27
stage1,256,4,7168,256,384,8,ActivationType.Silu,torch.bfloat16,torch.float4_e2m1fn_x2,torch.float4_e2m1fn_x2,QuantType.per_1x32,1,0,32,0,26.2613,flydsl_moe1_afp4_wfp4_bf16_t16x64x256_w3_kb2_bnt0_go,0.0%,13.42,80499.26
stage1,256,4,7168,256,384,8,ActivationType.Silu,torch.bfloat16,torch.float4_e2m1fn_x2,torch.float4_e2m1fn_x2,QuantType.per_1x32,1,0,32,0,27.0572,flydsl_moe1_afp4_wfp4_bf16_t16x64x256_w3_kb2,0.0%,13.02,78131.34
stage1,256,4,7168,256,384,8,ActivationType.Silu,torch.bfloat16,torch.float4_e2m1fn_x2,torch.float4_e2m1fn_x2,QuantType.per_1x32,1,0,32,0,25.1218,flydsl_moe1_afp4_wfp4_bf16_t16x64x256_w3_kb2_go,0.0%,14.02,84150.63
stage1,256,4,7168,256,384,8,ActivationType.Silu,torch.bfloat16,torch.float4_e2m1fn_x2,torch.float4_e2m1fn_x2,QuantType.per_1x32,1,0,32,0,19.9705,flydsl_moe1_afp4_wfp4_bf16_t16x64x256_w3_kb4_bnt0,0.0%,17.64,105856.9
stage1,256,4,7168,256,384,8,ActivationType.Silu,torch.bfloat16,torch.float4_e2m1fn_x2,torch.float4_e2m1fn_x2,QuantType.per_1x32,1,0,32,0,27.084,flydsl_moe1_afp4_wfp4_bf16_t16x64x256_w3_kb4_bnt0_go,0.1%,13.01,78054.03
stage1,256,4,7168,256,384,8,ActivationType.Silu,torch.bfloat16,torch.float4_e2m1fn_x2,torch.float4_e2m1fn_x2,QuantType.per_1x32,1,0,32,0,21.4116,flydsl_moe1_afp4_wfp4_bf16_t16x64x256_w3_kb4,0.0%,16.45,98732.24
stage1,256,4,7168,256,384,8,ActivationType.Silu,torch.bfloat16,torch.float4_e2m1fn_x2,torch.float4_e2m1fn_x2,QuantType.per_1x32,1,0,32,0,26.2694,flydsl_moe1_afp4_wfp4_bf16_t16x64x256_w3_kb4_go,0.1%,13.41,80474.44
stage1,256,4,7168,256,384,8,ActivationType.Silu,torch.bfloat16,torch.float4_e2m1fn_x2,torch.float4_e2m1fn_x2,QuantType.per_1x32,1,0,32,0,25.5203,flydsl_moe1_afp4_wfp4_bf16_t16x64x256_w3_kb7_bnt0,0.0%,13.81,82836.61
stage1,256,4,7168,256,384,8,ActivationType.Silu,torch.bfloat16,torch.float4_e2m1fn_x2,torch.float4_e2m1fn_x2,QuantType.per_1x32,1,0,32,0,26.7687,flydsl_moe1_afp4_wfp4_bf16_t16x64x256_w3_kb7_bnt0_go,0.1%,13.16,78973.4
stage1,256,4,7168,256,384,8,ActivationType.Silu,torch.bfloat16,torch.float4_e2m1fn_x2,torch.float4_e2m1fn_x2,QuantType.per_1x32,1,0,32,0,26.6129,flydsl_moe1_afp4_wfp4_bf16_t16x64x256_w3_kb7,0.0%,13.24,79435.73
stage1,256,4,7168,256,384,8,ActivationType.Silu,torch.bfloat16,torch.float4_e2m1fn_x2,torch.float4_e2m1fn_x2,QuantType.per_1x32,1,0,32,0,25.5304,flydsl_moe1_afp4_wfp4_bf16_t16x64x256_w3_kb7_go,0.0%,13.8,82803.84
stage1,256,4,7168,256,384,8,ActivationType.Silu,torch.bfloat16,torch.float4_e2m1fn_x2,torch.float4_e2m1fn_x2,QuantType.per_1x32,1,0,32,0,31.2692,flydsl_moe1_afp4_wfp4_bf16_t16x64x256_w4_bnt0,0.0%,11.27,67606.95
stage1,256,4,7168,256,384,8,ActivationType.Silu,torch.bfloat16,torch.float4_e2m1fn_x2,torch.float4_e2m1fn_x2,QuantType.per_1x32,1,0,32,0,31.4305,flydsl_moe1_afp4_wfp4_bf16_t16x64x256_w4,0.0%,11.21,67259.99
stage1,256,4,7168,256,384,8,ActivationType.Silu,torch.bfloat16,torch.float4_e2m1fn_x2,torch.float4_e2m1fn_x2,QuantType.per_1x32,1,0,32,0,26.809,flydsl_moe1_afp4_wfp4_bf16_t16x64x256_w4_kb2_bnt0,0.0%,13.14,78854.68
stage1,256,4,7168,256,384,8,ActivationType.Silu,torch.bfloat16,torch.float4_e2m1fn_x2,torch.float4_e2m1fn_x2,QuantType.per_1x32,1,0,32,0,24.9837,flydsl_moe1_afp4_wfp4_bf16_t16x64x256_w4_kb2_bnt0_go,0.0%,14.1,84615.78
stage1,256,4,7168,256,384,8,ActivationType.Silu,torch.bfloat16,torch.float4_e2m1fn_x2,torch.float4_e2m1fn_x2,QuantType.per_1x32,1,0,32,0,27.1729,flydsl_moe1_afp4_wfp4_bf16_t16x64x256_w4_kb2,0.0%,12.97,77798.66
stage1,256,4,7168,256,384,8,ActivationType.Silu,torch.bfloat16,torch.float4_e2m1fn_x2,torch.float4_e2m1fn_x2,QuantType.per_1x32,1,0,32,0,25.039,flydsl_moe1_afp4_wfp4_bf16_t16x64x256_w4_kb2_go,0.0%,14.07,84428.9
stage1,256,4,7168,256,384,8,ActivationType.Silu,torch.bfloat16,torch.float4_e2m1fn_x2,torch.float4_e2m1fn_x2,QuantType.per_1x32,1,0,32,0,20.0117,flydsl_moe1_afp4_wfp4_bf16_t16x64x256_w4_kb4_bnt0,0.1%,17.61,105638.96
stage1,256,4,7168,256,384,8,ActivationType.Silu,torch.bfloat16,torch.float4_e2m1fn_x2,torch.float4_e2m1fn_x2,QuantType.per_1x32,1,0,32,0,18.0754,flydsl_moe1_afp4_wfp4_bf16_t16x64x256_w4_kb4_bnt0_go,0.0%,19.49,116955.38
stage1,256,4,7168,256,384,8,ActivationType.Silu,torch.bfloat16,torch.float4_e2m1fn_x2,torch.float4_e2m1fn_x2,QuantType.per_1x32,1,0,32,0,20.5888,flydsl_moe1_afp4_wfp4_bf16_t16x64x256_w4_kb4,0.0%,17.11,102677.92
stage1,256,4,7168,256,384,8,ActivationType.Silu,torch.bfloat16,torch.float4_e2m1fn_x2,torch.float4_e2m1fn_x2,QuantType.per_1x32,1,0,32,0,19.8997,flydsl_moe1_afp4_wfp4_bf16_t16x64x256_w4_kb4_go,0.0%,17.7,106233.52
stage1,256,4,7168,256,384,8,ActivationType.Silu,torch.bfloat16,torch.float4_e2m1fn_x2,torch.float4_e2m1fn_x2,QuantType.per_1x32,1,0,32,0,20.9649,flydsl_moe1_afp4_wfp4_bf16_t16x64x256_w4_kb7_bnt0,0.0%,16.81,100835.93
stage1,256,4,7168,256,384,8,ActivationType.Silu,torch.bfloat16,torch.float4_e2m1fn_x2,torch.float4_e2m1fn_x2,QuantType.per_1x32,1,0,32,0,24.6545,flydsl_moe1_afp4_wfp4_bf16_t16x64x256_w4_kb7_bnt0_go,0.1%,14.29,85745.61
stage1,256,4,7168,256,384,8,ActivationType.Silu,torch.bfloat16,torch.float4_e2m1fn_x2,torch.float4_e2m1fn_x2,QuantType.per_1x32,1,0,32,0,20.0812,flydsl_moe1_afp4_wfp4_bf16_t16x64x256_w4_kb7,0.0%,17.54,105273.35
stage1,256,4,7168,256,384,8,ActivationType.Silu,torch.bfloat16,torch.float4_e2m1fn_x2,torch.float4_e2m1fn_x2,QuantType.per_1x32,1,0,32,0,24.0576,flydsl_moe1_afp4_wfp4_bf16_t16x64x256_w4_kb7_go,0.0%,14.64,87873.07
stage1,256,4,7168,256,384,8,ActivationType.Silu,torch.bfloat16,torch.float4_e2m1fn_x2,torch.float4_e2m1fn_x2,QuantType.per_1x32,1,0,32,0,36.0021,flydsl_moe1_afp4_wfp4_bf16_t16x128x256_bnt0,0.0%,9.79,58719.22
stage1,256,4,7168,256,384,8,ActivationType.Silu,torch.bfloat16,torch.float4_e2m1fn_x2,torch.float4_e2m1fn_x2,QuantType.per_1x32,1,0,32,0,36.1412,flydsl_moe1_afp4_wfp4_bf16_t16x128x256,0.0%,9.75,58493.22
stage1,256,4,7168,256,384,8,ActivationType.Silu,torch.bfloat16,torch.float4_e2m1fn_x2,torch.float4_e2m1fn_x2,QuantType.per_1x32,1,0,32,0,27.9657,flydsl_moe1_afp4_wfp4_bf16_t16x128x256_kb2_bnt0,0.0%,12.6,75593.15
stage1,256,4,7168,256,384,8,ActivationType.Silu,torch.bfloat16,torch.float4_e2m1fn_x2,torch.float4_e2m1fn_x2,QuantType.per_1x32,1,0,32,0,25.4464,flydsl_moe1_afp4_wfp4_bf16_t16x128x256_kb2_bnt0_go,0.0%,13.85,83077.18
stage1,256,4,7168,256,384,8,ActivationType.Silu,torch.bfloat16,torch.float4_e2m1fn_x2,torch.float4_e2m1fn_x2,QuantType.per_1x32,1,0,32,0,29.6523,flydsl_moe1_afp4_wfp4_bf16_t16x128x256_kb2,0.0%,11.88,71293.47
stage1,256,4,7168,256,384,8,ActivationType.Silu,torch.bfloat16,torch.float4_e2m1fn_x2,torch.float4_e2m1fn_x2,QuantType.per_1x32,1,0,32,0,27.2713,flydsl_moe1_afp4_wfp4_bf16_t16x128x256_kb2_go,0.0%,12.92,77517.95
stage1,256,4,7168,256,384,8,ActivationType.Silu,torch.bfloat16,torch.float4_e2m1fn_x2,torch.float4_e2m1fn_x2,QuantType.per_1x32,1,0,32,0,20.6504,flydsl_moe1_afp4_wfp4_bf16_t16x128x256_kb4_bnt0,0.0%,17.06,102371.64
stage1,256,4,7168,256,384,8,ActivationType.Silu,torch.bfloat16,torch.float4_e2m1fn_x2,torch.float4_e2m1fn_x2,QuantType.per_1x32,1,0,32,0,26.3331,flydsl_moe1_afp4_wfp4_bf16_t16x128x256_kb4_bnt0_go,0.0%,13.38,80279.77
stage1,256,4,7168,256,384,8,ActivationType.Silu,torch.bfloat16,torch.float4_e2m1fn_x2,torch.float4_e2m1fn_x2,QuantType.per_1x32,1,0,32,0,21.9293,flydsl_moe1_afp4_wfp4_bf16_t16x128x256_kb4,0.0%,16.07,96401.4
stage1,256,4,7168,256,384,8,ActivationType.Silu,torch.bfloat16,torch.float4_e2m1fn_x2,torch.float4_e2m1fn_x2,QuantType.per_1x32,1,0,32,0,27.2998,flydsl_moe1_afp4_wfp4_bf16_t16x128x256_kb4_go,0.0%,12.91,77437.02
stage1,256,4,7168,256,384,8,ActivationType.Silu,torch.bfloat16,torch.float4_e2m1fn_x2,torch.float4_e2m1fn_x2,QuantType.per_1x32,1,0,32,0,24.7042,flydsl_moe1_afp4_wfp4_bf16_t16x128x256_kb7_bnt0,0.1%,14.26,85573.11
stage1,256,4,7168,256,384,8,ActivationType.Silu,torch.bfloat16,torch.float4_e2m1fn_x2,torch.float4_e2m1fn_x2,QuantType.per_1x32,1,0,32,0,28.7731,flydsl_moe1_afp4_wfp4_bf16_t16x128x256_kb7_bnt0_go,0.1%,12.24,73471.93
stage1,256,4,7168,256,384,8,ActivationType.Silu,torch.bfloat16,torch.float4_e2m1fn_x2,torch.float4_e2m1fn_x2,QuantType.per_1x32,1,0,32,0,24.9382,flydsl_moe1_afp4_wfp4_bf16_t16x128x256_kb7,0.0%,14.13,84770.16
stage1,256,4,7168,256,384,8,ActivationType.Silu,torch.bfloat16,torch.float4_e2m1fn_x2,torch.float4_e2m1fn_x2,QuantType.per_1x32,1,0,32,0,28.8483,flydsl_moe1_afp4_wfp4_bf16_t16x128x256_kb7_go,0.0%,12.21,73280.41
stage1,256,4,7168,256,384,8,ActivationType.Silu,torch.bfloat16,torch.float4_e2m1fn_x2,torch.float4_e2m1fn_x2,QuantType.per_1x32,1,0,32,0,36.4641,flydsl_moe1_afp4_wfp4_bf16_t16x128x256_w2_bnt0,0.0%,9.66,57975.25
stage1,256,4,7168,256,384,8,ActivationType.Silu,torch.bfloat16,torch.float4_e2m1fn_x2,torch.float4_e2m1fn_x2,QuantType.per_1x32,1,0,32,0,36.1233,flydsl_moe1_afp4_wfp4_bf16_t16x128x256_w2,0.0%,9.75,58522.21
stage1,256,4,7168,256,384,8,ActivationType.Silu,torch.bfloat16,torch.float4_e2m1fn_x2,torch.float4_e2m1fn_x2,QuantType.per_1x32,1,0,32,0,27.9043,flydsl_moe1_afp4_wfp4_bf16_t16x128x256_w2_kb2_bnt0,0.0%,12.63,75759.48
stage1,256,4,7168,256,384,8,ActivationType.Silu,torch.bfloat16,torch.float4_e2m1fn_x2,torch.float4_e2m1fn_x2,QuantType.per_1x32,1,0,32,0,26.6365,flydsl_moe1_afp4_wfp4_bf16_t16x128x256_w2_kb2_bnt0_go,0.0%,13.23,79365.35
stage1,256,4,7168,256,384,8,ActivationType.Silu,torch.bfloat16,torch.float4_e2m1fn_x2,torch.float4_e2m1fn_x2,QuantType.per_1x32,1,0,32,0,28.4335,flydsl_moe1_afp4_wfp4_bf16_t16x128x256_w2_kb2,0.0%,12.39,74349.46
stage1,256,4,7168,256,384,8,ActivationType.Silu,torch.bfloat16,torch.float4_e2m1fn_x2,torch.float4_e2m1fn_x2,QuantType.per_1x32,1,0,32,0,27.04,flydsl_moe1_afp4_wfp4_bf16_t16x128x256_w2_kb2_go,0.0%,13.03,78181.04
stage1,256,4,7168,256,384,8,ActivationType.Silu,torch.bfloat16,torch.float4_e2m1fn_x2,torch.float4_e2m1fn_x2,QuantType.per_1x32,1,0,32,0,20.8883,flydsl_moe1_afp4_wfp4_bf16_t16x128x256_w2_kb4_bnt0,0.0%,16.87,101205.71
stage1,256,4,7168,256,384,8,ActivationType.Silu,torch.bfloat16,torch.float4_e2m1fn_x2,torch.float4_e2m1fn_x2,QuantType.per_1x32,1,0,32,0,21.3752,flydsl_moe1_afp4_wfp4_bf16_t16x128x256_w2_kb4_bnt0_go,0.0%,16.48,98900.37
stage1,256,4,7168,256,384,8,ActivationType.Silu,torch.bfloat16,torch.float4_e2m1fn_x2,torch.float4_e2m1fn_x2,QuantType.per_1x32,1,0,32,0,20.6875,flydsl_moe1_afp4_wfp4_bf16_t16x128x256_w2_kb4,0.0%,17.03,102188.05
stage1,256,4,7168,256,384,8,ActivationType.Silu,torch.bfloat16,torch.float4_e2m1fn_x2,torch.float4_e2m1fn_x2,QuantType.per_1x32,1,0,32,0,20.2431,flydsl_moe1_afp4_wfp4_bf16_t16x128x256_w2_kb4_go,0.0%,17.4,104431.4
stage1,256,4,7168,256,384,8,ActivationType.Silu,torch.bfloat16,torch.float4_e2m1fn_x2,torch.float4_e2m1fn_x2,QuantType.per_1x32,1,0,32,0,19.7215,flydsl_moe1_afp4_wfp4_bf16_t16x128x256_w2_kb7_bnt0,0.1%,17.86,107193.43
stage1,256,4,7168,256,384,8,ActivationType.Silu,torch.bfloat16,torch.float4_e2m1fn_x2,torch.float4_e2m1fn_x2,QuantType.per_1x32,1,0,32,0,25.9982,flydsl_moe1_afp4_wfp4_bf16_t16x128x256_w2_kb7_bnt0_go,0.0%,13.55,81313.91
stage1,256,4,7168,256,384,8,ActivationType.Silu,torch.bfloat16,torch.float4_e2m1fn_x2,torch.float4_e2m1fn_x2,QuantType.per_1x32,1,0,32,0,19.7721,flydsl_moe1_afp4_wfp4_bf16_t16x128x256_w2_kb7,0.0%,17.82,106919.1
stage1,256,4,7168,256,384,8,ActivationType.Silu,torch.bfloat16,torch.float4_e2m1fn_x2,torch.float4_e2m1fn_x2,QuantType.per_1x32,1,0,32,0,25.9457,flydsl_moe1_afp4_wfp4_bf16_t16x128x256_w2_kb7_go,0.0%,13.58,81478.44
stage1,256,4,7168,256,384,8,ActivationType.Silu,torch.bfloat16,torch.float4_e2m1fn_x2,torch.float4_e2m1fn_x2,QuantType.per_1x32,1,0,32,0,36.0625,flydsl_moe1_afp4_wfp4_bf16_t16x128x256_w3_bnt0,0.0%,9.77,58620.87
stage1,256,4,7168,256,384,8,ActivationType.Silu,torch.bfloat16,torch.float4_e2m1fn_x2,torch.float4_e2m1fn_x2,QuantType.per_1x32,1,0,32,0,36.1391,flydsl_moe1_afp4_wfp4_bf16_t16x128x256_w3,0.0%,9.75,58496.62
stage1,256,4,7168,256,384,8,ActivationType.Silu,torch.bfloat16,torch.float4_e2m1fn_x2,torch.float4_e2m1fn_x2,QuantType.per_1x32,1,0,32,0,28.6294,flydsl_moe1_afp4_wfp4_bf16_t16x128x256_w3_kb2_bnt0,0.0%,12.31,73840.71
stage1,256,4,7168,256,384,8,ActivationType.Silu,torch.bfloat16,torch.float4_e2m1fn_x2,torch.float4_e2m1fn_x2,QuantType.per_1x32,1,0,32,0,25.2504,flydsl_moe1_afp4_wfp4_bf16_t16x128x256_w3_kb2_bnt0_go,0.0%,13.95,83722.05
stage1,256,4,7168,256,384,8,ActivationType.Silu,torch.bfloat16,torch.float4_e2m1fn_x2,torch.float4_e2m1fn_x2,QuantType.per_1x32,1,0,32,0,28.791,flydsl_moe1_afp4_wfp4_bf16_t16x128x256_w3_kb2,0.0%,12.24,73426.25
stage1,256,4,7168,256,384,8,ActivationType.Silu,torch.bfloat16,torch.float4_e2m1fn_x2,torch.float4_e2m1fn_x2,QuantType.per_1x32,1,0,32,0,26.4749,flydsl_moe1_afp4_wfp4_bf16_t16x128x256_w3_kb2_go,0.0%,13.31,79849.79
stage1,256,4,7168,256,384,8,ActivationType.Silu,torch.bfloat16,torch.float4_e2m1fn_x2,torch.float4_e2m1fn_x2,QuantType.per_1x32,1,0,32,0,20.9036,flydsl_moe1_afp4_wfp4_bf16_t16x128x256_w3_kb4_bnt0,0.0%,16.85,101131.63
stage1,256,4,7168,256,384,8,ActivationType.Silu,torch.bfloat16,torch.float4_e2m1fn_x2,torch.float4_e2m1fn_x2,QuantType.per_1x32,1,0,32,0,19.9208,flydsl_moe1_afp4_wfp4_bf16_t16x128x256_w3_kb4_bnt0_go,0.0%,17.69,106121.0
stage1,256,4,7168,256,384,8,ActivationType.Silu,torch.bfloat16,torch.float4_e2m1fn_x2,torch.float4_e2m1fn_x2,QuantType.per_1x32,1,0,32,0,22.0372,flydsl_moe1_afp4_wfp4_bf16_t16x128x256_w3_kb4,0.0%,15.99,95929.39
stage1,256,4,7168,256,384,8,ActivationType.Silu,torch.bfloat16,torch.float4_e2m1fn_x2,torch.float4_e2m1fn_x2,QuantType.per_1x32,1,0,32,0,18.326,flydsl_moe1_afp4_wfp4_bf16_t16x128x256_w3_kb4_go,0.0%,19.23,115356.06
stage1,256,4,7168,256,384,8,ActivationType.Silu,torch.bfloat16,torch.float4_e2m1fn_x2,torch.float4_e2m1fn_x2,QuantType.per_1x32,1,0,32,0,19.731,flydsl_moe1_afp4_wfp4_bf16_t16x128x256_w3_kb7_bnt0,0.0%,17.86,107141.82
stage1,256,4,7168,256,384,8,ActivationType.Silu,torch.bfloat16,torch.float4_e2m1fn_x2,torch.float4_e2m1fn_x2,QuantType.per_1x32,1,0,32,0,24.5061,flydsl_moe1_afp4_wfp4_bf16_t16x128x256_w3_kb7_bnt0_go,0.0%,14.38,86264.86
stage1,256,4,7168,256,384,8,ActivationType.Silu,torch.bfloat16,torch.float4_e2m1fn_x2,torch.float4_e2m1fn_x2,QuantType.per_1x32,1,0,32,0,20.1549,flydsl_moe1_afp4_wfp4_bf16_t16x128x256_w3_kb7,0.0%,17.48,104888.4
stage1,256,4,7168,256,384,8,ActivationType.Silu,torch.bfloat16,torch.float4_e2m1fn_x2,torch.float4_e2m1fn_x2,QuantType.per_1x32,1,0,32,0,24.3661,flydsl_moe1_afp4_wfp4_bf16_t16x128x256_w3_kb7_go,0.0%,14.46,86760.51
stage1,256,4,7168,256,384,8,ActivationType.Silu,torch.bfloat16,torch.float4_e2m1fn_x2,torch.float4_e2m1fn_x2,QuantType.per_1x32,1,0,32,0,36.3613,flydsl_moe1_afp4_wfp4_bf16_t16x128x256_w4_bnt0,0.0%,9.69,58139.15
stage1,256,4,7168,256,384,8,ActivationType.Silu,torch.bfloat16,torch.float4_e2m1fn_x2,torch.float4_e2m1fn_x2,QuantType.per_1x32,1,0,32,0,36.0137,flydsl_moe1_afp4_wfp4_bf16_t16x128x256_w4,0.0%,9.78,58700.31
stage1,256,4,7168,256,384,8,ActivationType.Silu,torch.bfloat16,torch.float4_e2m1fn_x2,torch.float4_e2m1fn_x2,QuantType.per_1x32,1,0,32,0,28.2994,flydsl_moe1_afp4_wfp4_bf16_t16x128x256_w4_kb2_bnt0,0.0%,12.45,74701.77
stage1,256,4,7168,256,384,8,ActivationType.Silu,torch.bfloat16,torch.float4_e2m1fn_x2,torch.float4_e2m1fn_x2,QuantType.per_1x32,1,0,32,0,26.9147,flydsl_moe1_afp4_wfp4_bf16_t16x128x256_w4_kb2_bnt0_go,0.0%,13.09,78545.0
stage1,256,4,7168,256,384,8,ActivationType.Silu,torch.bfloat16,torch.float4_e2m1fn_x2,torch.float4_e2m1fn_x2,QuantType.per_1x32,1,0,32,0,29.1873,flydsl_moe1_afp4_wfp4_bf16_t16x128x256_w4_kb2,0.0%,12.07,72429.28
stage1,256,4,7168,256,384,8,ActivationType.Silu,torch.bfloat16,torch.float4_e2m1fn_x2,torch.float4_e2m1fn_x2,QuantType.per_1x32,1,0,32,0,25.4237,flydsl_moe1_afp4_wfp4_bf16_t16x128x256_w4_kb2_go,0.0%,13.86,83151.36
stage1,256,4,7168,256,384,8,ActivationType.Silu,torch.bfloat16,torch.float4_e2m1fn_x2,torch.float4_e2m1fn_x2,QuantType.per_1x32,1,0,32,0,22.1156,flydsl_moe1_afp4_wfp4_bf16_t16x128x256_w4_kb4_bnt0,0.0%,15.93,95589.32
stage1,256,4,7168,256,384,8,ActivationType.Silu,torch.bfloat16,torch.float4_e2m1fn_x2,torch.float4_e2m1fn_x2,QuantType.per_1x32,1,0,32,0,18.3,flydsl_moe1_afp4_wfp4_bf16_t16x128x256_w4_kb4_bnt0_go,0.0%,19.25,115519.96
stage1,256,4,7168,256,384,8,ActivationType.Silu,torch.bfloat16,torch.float4_e2m1fn_x2,torch.float4_e2m1fn_x2,QuantType.per_1x32,1,0,32,0,20.8484,flydsl_moe1_afp4_wfp4_bf16_t16x128x256_w4_kb4,0.0%,16.9,101399.4
stage1,256,4,7168,256,384,8,ActivationType.Silu,torch.bfloat16,torch.float4_e2m1fn_x2,torch.float4_e2m1fn_x2,QuantType.per_1x32,1,0,32,0,20.0632,flydsl_moe1_afp4_wfp4_bf16_t16x128x256_w4_kb4_go,0.0%,17.56,105367.8
stage1,256,4,7168,256,384,8,ActivationType.Silu,torch.bfloat16,torch.float4_e2m1fn_x2,torch.float4_e2m1fn_x2,QuantType.per_1x32,1,0,32,0,21.1956,flydsl_moe1_afp4_wfp4_bf16_t16x128x256_w4_kb7_bnt0,0.1%,16.62,99738.4
stage1,256,4,7168,256,384,8,ActivationType.Silu,torch.bfloat16,torch.float4_e2m1fn_x2,torch.float4_e2m1fn_x2,QuantType.per_1x32,1,0,32,0,18.7772,flydsl_moe1_afp4_wfp4_bf16_t16x128x256_w4_kb7_bnt0_go,0.0%,18.76,112584.16
stage1,256,4,7168,256,384,8,ActivationType.Silu,torch.bfloat16,torch.float4_e2m1fn_x2,torch.float4_e2m1fn_x2,QuantType.per_1x32,1,0,32,0,19.9493,flydsl_moe1_afp4_wfp4_bf16_t16x128x256_w4_kb7,0.1%,17.66,105969.39
stage1,256,4,7168,256,384,8,ActivationType.Silu,torch.bfloat16,torch.float4_e2m1fn_x2,torch.float4_e2m1fn_x2,QuantType.per_1x32,1,0,32,0,18.2109,flydsl_moe1_afp4_wfp4_bf16_t16x128x256_w4_kb7_go,0.0%,19.35,116085.16
stage1,256,4,7168,256,384,8,ActivationType.Silu,torch.bfloat16,torch.float4_e2m1fn_x2,torch.float4_e2m1fn_x2,QuantType.per_1x32,1,0,32,0,24.2241,flydsl_moe1_afp4_wfp4_bf16_t32x32x256_bnt0,0.0%,14.54,87269.09
stage1,256,4,7168,256,384,8,ActivationType.Silu,torch.bfloat16,torch.float4_e2m1fn_x2,torch.float4_e2m1fn_x2,QuantType.per_1x32,1,0,32,0,24.0068,flydsl_moe1_afp4_wfp4_bf16_t32x32x256,0.0%,14.68,88059.02
stage1,256,4,7168,256,384,8,ActivationType.Silu,torch.bfloat16,torch.float4_e2m1fn_x2,torch.float4_e2m1fn_x2,QuantType.per_1x32,1,0,32,0,33.0097,flydsl_moe1_afp4_wfp4_bf16_t32x32x256_kb2_bnt0,0.0%,10.67,64042.24
stage1,256,4,7168,256,384,8,ActivationType.Silu,torch.bfloat16,torch.float4_e2m1fn_x2,torch.float4_e2m1fn_x2,QuantType.per_1x32,1,0,32,0,46.3438,flydsl_moe1_afp4_wfp4_bf16_t32x32x256_kb2_bnt0_go,0.0%,7.6,45615.92
stage1,256,4,7168,256,384,8,ActivationType.Silu,torch.bfloat16,torch.float4_e2m1fn_x2,torch.float4_e2m1fn_x2,QuantType.per_1x32,1,0,32,0,34.0898,flydsl_moe1_afp4_wfp4_bf16_t32x32x256_kb2,0.0%,10.34,62013.13
stage1,256,4,7168,256,384,8,ActivationType.Silu,torch.bfloat16,torch.float4_e2m1fn_x2,torch.float4_e2m1fn_x2,QuantType.per_1x32,1,0,32,0,45.7555,flydsl_moe1_afp4_wfp4_bf16_t32x32x256_kb2_go,0.0%,7.7,46202.43
stage1,256,4,7168,256,384,8,ActivationType.Silu,torch.bfloat16,torch.float4_e2m1fn_x2,torch.float4_e2m1fn_x2,QuantType.per_1x32,1,0,32,0,37.0113,flydsl_moe1_afp4_wfp4_bf16_t32x32x256_kb4_bnt0,0.0%,9.52,57118.1
stage1,256,4,7168,256,384,8,ActivationType.Silu,torch.bfloat16,torch.float4_e2m1fn_x2,torch.float4_e2m1fn_x2,QuantType.per_1x32,1,0,32,0,52.2239,flydsl_moe1_afp4_wfp4_bf16_t32x32x256_kb4_bnt0_go,0.0%,6.75,40479.84
stage1,256,4,7168,256,384,8,ActivationType.Silu,torch.bfloat16,torch.float4_e2m1fn_x2,torch.float4_e2m1fn_x2,QuantType.per_1x32,1,0,32,0,37.0784,flydsl_moe1_afp4_wfp4_bf16_t32x32x256_kb4,0.0%,9.5,57014.74
stage1,256,4,7168,256,384,8,ActivationType.Silu,torch.bfloat16,torch.float4_e2m1fn_x2,torch.float4_e2m1fn_x2,QuantType.per_1x32,1,0,32,0,52.3796,flydsl_moe1_afp4_wfp4_bf16_t32x32x256_kb4_go,0.0%,6.73,40359.51
stage1,256,4,7168,256,384,8,ActivationType.Silu,torch.bfloat16,torch.float4_e2m1fn_x2,torch.float4_e2m1fn_x2,QuantType.per_1x32,1,0,32,0,45.5758,flydsl_moe1_afp4_wfp4_bf16_t32x32x256_kb7_bnt0,0.1%,7.73,46384.6
stage1,256,4,7168,256,384,8,ActivationType.Silu,torch.bfloat16,torch.float4_e2m1fn_x2,torch.float4_e2m1fn_x2,QuantType.per_1x32,1,0,32,0,61.3033,flydsl_moe1_afp4_wfp4_bf16_t32x32x256_kb7_bnt0_go,0.1%,5.75,34484.53
stage1,256,4,7168,256,384,8,ActivationType.Silu,torch.bfloat16,torch.float4_e2m1fn_x2,torch.float4_e2m1fn_x2,QuantType.per_1x32,1,0,32,0,45.4681,flydsl_moe1_afp4_wfp4_bf16_t32x32x256_kb7,0.1%,7.75,46494.47
stage1,256,4,7168,256,384,8,ActivationType.Silu,torch.bfloat16,torch.float4_e2m1fn_x2,torch.float4_e2m1fn_x2,QuantType.per_1x32,1,0,32,0,60.6173,flydsl_moe1_afp4_wfp4_bf16_t32x32x256_kb7_go,0.1%,5.81,34874.78
stage1,256,4,7168,256,384,8,ActivationType.Silu,torch.bfloat16,torch.float4_e2m1fn_x2,torch.float4_e2m1fn_x2,QuantType.per_1x32,1,0,32,0,24.4336,flydsl_moe1_afp4_wfp4_bf16_t32x32x256_w2_bnt0,0.0%,14.42,86520.83
stage1,256,4,7168,256,384,8,ActivationType.Silu,torch.bfloat16,torch.float4_e2m1fn_x2,torch.float4_e2m1fn_x2,QuantType.per_1x32,1,0,32,0,24.1862,flydsl_moe1_afp4_wfp4_bf16_t32x32x256_w2,0.0%,14.57,87405.84
stage1,256,4,7168,256,384,8,ActivationType.Silu,torch.bfloat16,torch.float4_e2m1fn_x2,torch.float4_e2m1fn_x2,QuantType.per_1x32,1,0,32,0,26.0109,flydsl_moe1_afp4_wfp4_bf16_t32x32x256_w2_kb2_bnt0,0.0%,13.55,81274.21
stage1,256,4,7168,256,384,8,ActivationType.Silu,torch.bfloat16,torch.float4_e2m1fn_x2,torch.float4_e2m1fn_x2,QuantType.per_1x32,1,0,32,0,29.3832,flydsl_moe1_afp4_wfp4_bf16_t32x32x256_w2_kb2_bnt0_go,0.0%,11.99,71946.39
stage1,256,4,7168,256,384,8,ActivationType.Silu,torch.bfloat16,torch.float4_e2m1fn_x2,torch.float4_e2m1fn_x2,QuantType.per_1x32,1,0,32,0,24.7712,flydsl_moe1_afp4_wfp4_bf16_t32x32x256_w2_kb2,0.0%,14.22,85341.66
stage1,256,4,7168,256,384,8,ActivationType.Silu,torch.bfloat16,torch.float4_e2m1fn_x2,torch.float4_e2m1fn_x2,QuantType.per_1x32,1,0,32,0,30.6282,flydsl_moe1_afp4_wfp4_bf16_t32x32x256_w2_kb2_go,0.0%,11.5,69021.86
stage1,256,4,7168,256,384,8,ActivationType.Silu,torch.bfloat16,torch.float4_e2m1fn_x2,torch.float4_e2m1fn_x2,QuantType.per_1x32,1,0,32,0,26.5103,flydsl_moe1_afp4_wfp4_bf16_t32x32x256_w2_kb4_bnt0,0.0%,13.29,79743.17
stage1,256,4,7168,256,384,8,ActivationType.Silu,torch.bfloat16,torch.float4_e2m1fn_x2,torch.float4_e2m1fn_x2,QuantType.per_1x32,1,0,32,0,32.9398,flydsl_moe1_afp4_wfp4_bf16_t32x32x256_w2_kb4_bnt0_go,0.0%,10.7,64178.14
stage1,256,4,7168,256,384,8,ActivationType.Silu,torch.bfloat16,torch.float4_e2m1fn_x2,torch.float4_e2m1fn_x2,QuantType.per_1x32,1,0,32,0,24.8659,flydsl_moe1_afp4_wfp4_bf16_t32x32x256_w2_kb4,0.0%,14.17,85016.64
stage1,256,4,7168,256,384,8,ActivationType.Silu,torch.bfloat16,torch.float4_e2m1fn_x2,torch.float4_e2m1fn_x2,QuantType.per_1x32,1,0,32,0,33.7178,flydsl_moe1_afp4_wfp4_bf16_t32x32x256_w2_kb4_go,0.0%,10.45,62697.31
stage1,256,4,7168,256,384,8,ActivationType.Silu,torch.bfloat16,torch.float4_e2m1fn_x2,torch.float4_e2m1fn_x2,QuantType.per_1x32,1,0,32,0,31.2152,flydsl_moe1_afp4_wfp4_bf16_t32x32x256_w2_kb7_bnt0,0.1%,11.29,67723.9
stage1,256,4,7168,256,384,8,ActivationType.Silu,torch.bfloat16,torch.float4_e2m1fn_x2,torch.float4_e2m1fn_x2,QuantType.per_1x32,1,0,32,0,38.4868,flydsl_moe1_afp4_wfp4_bf16_t32x32x256_w2_kb7_bnt0_go,0.1%,9.15,54928.32
stage1,256,4,7168,256,384,8,ActivationType.Silu,torch.bfloat16,torch.float4_e2m1fn_x2,torch.float4_e2m1fn_x2,QuantType.per_1x32,1,0,32,0,30.6078,flydsl_moe1_afp4_wfp4_bf16_t32x32x256_w2_kb7,0.1%,11.51,69067.86
stage1,256,4,7168,256,384,8,ActivationType.Silu,torch.bfloat16,torch.float4_e2m1fn_x2,torch.float4_e2m1fn_x2,QuantType.per_1x32,1,0,32,0,39.2783,flydsl_moe1_afp4_wfp4_bf16_t32x32x256_w2_kb7_go,0.1%,8.97,53821.45
stage1,256,4,7168,256,384,8,ActivationType.Silu,torch.bfloat16,torch.float4_e2m1fn_x2,torch.float4_e2m1fn_x2,QuantType.per_1x32,1,0,32,0,24.0748,flydsl_moe1_afp4_wfp4_bf16_t32x32x256_w3_bnt0,0.0%,14.63,87810.29
stage1,256,4,7168,256,384,8,ActivationType.Silu,torch.bfloat16,torch.float4_e2m1fn_x2,torch.float4_e2m1fn_x2,QuantType.per_1x32,1,0,32,0,24.2707,flydsl_moe1_afp4_wfp4_bf16_t32x32x256_w3,0.0%,14.52,87101.54
stage1,256,4,7168,256,384,8,ActivationType.Silu,torch.bfloat16,torch.float4_e2m1fn_x2,torch.float4_e2m1fn_x2,QuantType.per_1x32,1,0,32,0,25.9464,flydsl_moe1_afp4_wfp4_bf16_t32x32x256_w3_kb2_bnt0,0.0%,13.58,81476.24
stage1,256,4,7168,256,384,8,ActivationType.Silu,torch.bfloat16,torch.float4_e2m1fn_x2,torch.float4_e2m1fn_x2,QuantType.per_1x32,1,0,32,0,29.5279,flydsl_moe1_afp4_wfp4_bf16_t32x32x256_w3_kb2_bnt0_go,0.0%,11.93,71593.82
stage1,256,4,7168,256,384,8,ActivationType.Silu,torch.bfloat16,torch.float4_e2m1fn_x2,torch.float4_e2m1fn_x2,QuantType.per_1x32,1,0,32,0,23.5878,flydsl_moe1_afp4_wfp4_bf16_t32x32x256_w3_kb2,0.0%,14.94,89623.25
stage1,256,4,7168,256,384,8,ActivationType.Silu,torch.bfloat16,torch.float4_e2m1fn_x2,torch.float4_e2m1fn_x2,QuantType.per_1x32,1,0,32,0,29.7127,flydsl_moe1_afp4_wfp4_bf16_t32x32x256_w3_kb2_go,0.0%,11.86,71148.54
stage1,256,4,7168,256,384,8,ActivationType.Silu,torch.bfloat16,torch.float4_e2m1fn_x2,torch.float4_e2m1fn_x2,QuantType.per_1x32,1,0,32,0,25.6691,flydsl_moe1_afp4_wfp4_bf16_t32x32x256_w3_kb4_bnt0,0.0%,13.73,82356.42
stage1,256,4,7168,256,384,8,ActivationType.Silu,torch.bfloat16,torch.float4_e2m1fn_x2,torch.float4_e2m1fn_x2,QuantType.per_1x32,1,0,32,0,28.4139,flydsl_moe1_afp4_wfp4_bf16_t32x32x256_w3_kb4_bnt0_go,0.0%,12.4,74400.74
stage1,256,4,7168,256,384,8,ActivationType.Silu,torch.bfloat16,torch.float4_e2m1fn_x2,torch.float4_e2m1fn_x2,QuantType.per_1x32,1,0,32,0,26.3989,flydsl_moe1_afp4_wfp4_bf16_t32x32x256_w3_kb4,0.0%,13.35,80079.67
stage1,256,4,7168,256,384,8,ActivationType.Silu,torch.bfloat16,torch.float4_e2m1fn_x2,torch.float4_e2m1fn_x2,QuantType.per_1x32,1,0,32,0,27.683,flydsl_moe1_afp4_wfp4_bf16_t32x32x256_w3_kb4_go,0.0%,12.73,76365.11
stage1,256,4,7168,256,384,8,ActivationType.Silu,torch.bfloat16,torch.float4_e2m1fn_x2,torch.float4_e2m1fn_x2,QuantType.per_1x32,1,0,32,0,27.8765,flydsl_moe1_afp4_wfp4_bf16_t32x32x256_w3_kb7_bnt0,0.1%,12.64,75835.03
stage1,256,4,7168,256,384,8,ActivationType.Silu,torch.bfloat16,torch.float4_e2m1fn_x2,torch.float4_e2m1fn_x2,QuantType.per_1x32,1,0,32,0,30.8119,flydsl_moe1_afp4_wfp4_bf16_t32x32x256_w3_kb7_bnt0_go,0.1%,11.43,68610.35
stage1,256,4,7168,256,384,8,ActivationType.Silu,torch.bfloat16,torch.float4_e2m1fn_x2,torch.float4_e2m1fn_x2,QuantType.per_1x32,1,0,32,0,27.4909,flydsl_moe1_afp4_wfp4_bf16_t32x32x256_w3_kb7,0.1%,12.82,76898.73
stage1,256,4,7168,256,384,8,ActivationType.Silu,torch.bfloat16,torch.float4_e2m1fn_x2,torch.float4_e2m1fn_x2,QuantType.per_1x32,1,0,32,0,30.6203,flydsl_moe1_afp4_wfp4_bf16_t32x32x256_w3_kb7_go,0.1%,11.51,69039.66
stage1,256,4,7168,256,384,8,ActivationType.Silu,torch.bfloat16,torch.float4_e2m1fn_x2,torch.float4_e2m1fn_x2,QuantType.per_1x32,1,0,32,0,24.0239,flydsl_moe1_afp4_wfp4_bf16_t32x32x256_w4_bnt0,0.0%,14.67,87996.34
stage1,256,4,7168,256,384,8,ActivationType.Silu,torch.bfloat16,torch.float4_e2m1fn_x2,torch.float4_e2m1fn_x2,QuantType.per_1x32,1,0,32,0,24.4548,flydsl_moe1_afp4_wfp4_bf16_t32x32x256_w4,0.0%,14.41,86445.82
stage1,256,4,7168,256,384,8,ActivationType.Silu,torch.bfloat16,torch.float4_e2m1fn_x2,torch.float4_e2m1fn_x2,QuantType.per_1x32,1,0,32,0,25.9495,flydsl_moe1_afp4_wfp4_bf16_t32x32x256_w4_kb2_bnt0,0.0%,13.58,81466.51
stage1,256,4,7168,256,384,8,ActivationType.Silu,torch.bfloat16,torch.float4_e2m1fn_x2,torch.float4_e2m1fn_x2,QuantType.per_1x32,1,0,32,0,20.0271,flydsl_moe1_afp4_wfp4_bf16_t32x32x256_w4_kb2_bnt0_go,0.0%,17.59,105557.73
stage1,256,4,7168,256,384,8,ActivationType.Silu,torch.bfloat16,torch.float4_e2m1fn_x2,torch.float4_e2m1fn_x2,QuantType.per_1x32,1,0,32,0,23.8713,flydsl_moe1_afp4_wfp4_bf16_t32x32x256_w4_kb2,0.0%,14.76,88558.86
stage1,256,4,7168,256,384,8,ActivationType.Silu,torch.bfloat16,torch.float4_e2m1fn_x2,torch.float4_e2m1fn_x2,QuantType.per_1x32,1,0,32,0,20.151,flydsl_moe1_afp4_wfp4_bf16_t32x32x256_w4_kb2_go,0.0%,17.48,104908.7
stage1,256,4,7168,256,384,8,ActivationType.Silu,torch.bfloat16,torch.float4_e2m1fn_x2,torch.float4_e2m1fn_x2,QuantType.per_1x32,1,0,32,0,19.0268,flydsl_moe1_afp4_wfp4_bf16_t32x32x256_w4_kb4_bnt0,0.0%,18.52,111107.24
stage1,256,4,7168,256,384,8,ActivationType.Silu,torch.bfloat16,torch.float4_e2m1fn_x2,torch.float4_e2m1fn_x2,QuantType.per_1x32,1,0,32,0,24.689,flydsl_moe1_afp4_wfp4_bf16_t32x32x256_w4_kb4_bnt0_go,0.0%,14.27,85625.79
stage1,256,4,7168,256,384,8,ActivationType.Silu,torch.bfloat16,torch.float4_e2m1fn_x2,torch.float4_e2m1fn_x2,QuantType.per_1x32,1,0,32,0,19.9414,flydsl_moe1_afp4_wfp4_bf16_t32x32x256_w4_kb4,0.0%,17.67,106011.37
stage1,256,4,7168,256,384,8,ActivationType.Silu,torch.bfloat16,torch.float4_e2m1fn_x2,torch.float4_e2m1fn_x2,QuantType.per_1x32,1,0,32,0,25.8853,flydsl_moe1_afp4_wfp4_bf16_t32x32x256_w4_kb4_go,0.0%,13.61,81668.56
stage1,256,4,7168,256,384,8,ActivationType.Silu,torch.bfloat16,torch.float4_e2m1fn_x2,torch.float4_e2m1fn_x2,QuantType.per_1x32,1,0,32,0,26.167,flydsl_moe1_afp4_wfp4_bf16_t32x32x256_w4_kb7_bnt0,0.1%,13.46,80789.36
stage1,256,4,7168,256,384,8,ActivationType.Silu,torch.bfloat16,torch.float4_e2m1fn_x2,torch.float4_e2m1fn_x2,QuantType.per_1x32,1,0,32,0,27.4106,flydsl_moe1_afp4_wfp4_bf16_t32x32x256_w4_kb7_bnt0_go,0.1%,12.85,77124.0
stage1,256,4,7168,256,384,8,ActivationType.Silu,torch.bfloat16,torch.float4_e2m1fn_x2,torch.float4_e2m1fn_x2,QuantType.per_1x32,1,0,32,0,24.7185,flydsl_moe1_afp4_wfp4_bf16_t32x32x256_w4_kb7,0.1%,14.25,85523.61
stage1,256,4,7168,256,384,8,ActivationType.Silu,torch.bfloat16,torch.float4_e2m1fn_x2,torch.float4_e2m1fn_x2,QuantType.per_1x32,1,0,32,0,28.1358,flydsl_moe1_afp4_wfp4_bf16_t32x32x256_w4_kb7_go,0.1%,12.52,75136.13
stage1,256,4,7168,256,384,8,ActivationType.Silu,torch.bfloat16,torch.float4_e2m1fn_x2,torch.float4_e2m1fn_x2,QuantType.per_1x32,1,0,32,0,25.3276,flydsl_moe1_afp4_wfp4_bf16_t32x64x256_bnt0,0.0%,13.91,83466.86
stage1,256,4,7168,256,384,8,ActivationType.Silu,torch.bfloat16,torch.float4_e2m1fn_x2,torch.float4_e2m1fn_x2,QuantType.per_1x32,1,0,32,0,25.5091,flydsl_moe1_afp4_wfp4_bf16_t32x64x256,0.0%,13.81,82872.98
stage1,256,4,7168,256,384,8,ActivationType.Silu,torch.bfloat16,torch.float4_e2m1fn_x2,torch.float4_e2m1fn_x2,QuantType.per_1x32,1,0,32,0,24.5208,flydsl_moe1_afp4_wfp4_bf16_t32x64x256_kb2_bnt0,0.0%,14.37,86213.14
stage1,256,4,7168,256,384,8,ActivationType.Silu,torch.bfloat16,torch.float4_e2m1fn_x2,torch.float4_e2m1fn_x2,QuantType.per_1x32,1,0,32,0,29.6965,flydsl_moe1_afp4_wfp4_bf16_t32x64x256_kb2_bnt0_go,0.0%,11.86,71187.35
stage1,256,4,7168,256,384,8,ActivationType.Silu,torch.bfloat16,torch.float4_e2m1fn_x2,torch.float4_e2m1fn_x2,QuantType.per_1x32,1,0,32,0,25.8082,flydsl_moe1_afp4_wfp4_bf16_t32x64x256_kb2,0.0%,13.65,81912.54
stage1,256,4,7168,256,384,8,ActivationType.Silu,torch.bfloat16,torch.float4_e2m1fn_x2,torch.float4_e2m1fn_x2,QuantType.per_1x32,1,0,32,0,29.1699,flydsl_moe1_afp4_wfp4_bf16_t32x64x256_kb2_go,0.0%,12.08,72472.49
stage1,256,4,7168,256,384,8,ActivationType.Silu,torch.bfloat16,torch.float4_e2m1fn_x2,torch.float4_e2m1fn_x2,QuantType.per_1x32,1,0,32,0,25.321,flydsl_moe1_afp4_wfp4_bf16_t32x64x256_kb4_bnt0,0.0%,13.91,83488.62
stage1,256,4,7168,256,384,8,ActivationType.Silu,torch.bfloat16,torch.float4_e2m1fn_x2,torch.float4_e2m1fn_x2,QuantType.per_1x32,1,0,32,0,33.6852,flydsl_moe1_afp4_wfp4_bf16_t32x64x256_kb4_bnt0_go,0.0%,10.46,62757.98
stage1,256,4,7168,256,384,8,ActivationType.Silu,torch.bfloat16,torch.float4_e2m1fn_x2,torch.float4_e2m1fn_x2,QuantType.per_1x32,1,0,32,0,27.1976,flydsl_moe1_afp4_wfp4_bf16_t32x64x256_kb4,0.0%,12.95,77728.01
stage1,256,4,7168,256,384,8,ActivationType.Silu,torch.bfloat16,torch.float4_e2m1fn_x2,torch.float4_e2m1fn_x2,QuantType.per_1x32,1,0,32,0,32.8519,flydsl_moe1_afp4_wfp4_bf16_t32x64x256_kb4_go,0.0%,10.72,64349.86
stage1,256,4,7168,256,384,8,ActivationType.Silu,torch.bfloat16,torch.float4_e2m1fn_x2,torch.float4_e2m1fn_x2,QuantType.per_1x32,1,0,32,0,30.0647,flydsl_moe1_afp4_wfp4_bf16_t32x64x256_kb7_bnt0,0.0%,11.72,70315.53
stage1,256,4,7168,256,384,8,ActivationType.Silu,torch.bfloat16,torch.float4_e2m1fn_x2,torch.float4_e2m1fn_x2,QuantType.per_1x32,1,0,32,0,38.1795,flydsl_moe1_afp4_wfp4_bf16_t32x64x256_kb7_bnt0_go,0.1%,9.23,55370.43
stage1,256,4,7168,256,384,8,ActivationType.Silu,torch.bfloat16,torch.float4_e2m1fn_x2,torch.float4_e2m1fn_x2,QuantType.per_1x32,1,0,32,0,30.7738,flydsl_moe1_afp4_wfp4_bf16_t32x64x256_kb7,0.0%,11.45,68695.29
stage1,256,4,7168,256,384,8,ActivationType.Silu,torch.bfloat16,torch.float4_e2m1fn_x2,torch.float4_e2m1fn_x2,QuantType.per_1x32,1,0,32,0,36.9654,flydsl_moe1_afp4_wfp4_bf16_t32x64x256_kb7_go,0.1%,9.53,57189.03
stage1,256,4,7168,256,384,8,ActivationType.Silu,torch.bfloat16,torch.float4_e2m1fn_x2,torch.float4_e2m1fn_x2,QuantType.per_1x32,1,0,32,0,24.7639,flydsl_moe1_afp4_wfp4_bf16_t32x64x256_w2_bnt0,0.0%,14.23,85366.81
stage1,256,4,7168,256,384,8,ActivationType.Silu,torch.bfloat16,torch.float4_e2m1fn_x2,torch.float4_e2m1fn_x2,QuantType.per_1x32,1,0,32,0,25.5168,flydsl_moe1_afp4_wfp4_bf16_t32x64x256_w2,0.0%,13.81,82847.98
stage1,256,4,7168,256,384,8,ActivationType.Silu,torch.bfloat16,torch.float4_e2m1fn_x2,torch.float4_e2m1fn_x2,QuantType.per_1x32,1,0,32,0,24.4099,flydsl_moe1_afp4_wfp4_bf16_t32x64x256_w2_kb2_bnt0,0.0%,14.43,86604.83
stage1,256,4,7168,256,384,8,ActivationType.Silu,torch.bfloat16,torch.float4_e2m1fn_x2,torch.float4_e2m1fn_x2,QuantType.per_1x32,1,0,32,0,19.9918,flydsl_moe1_afp4_wfp4_bf16_t32x64x256_w2_kb2_bnt0_go,0.0%,17.62,105744.12
stage1,256,4,7168,256,384,8,ActivationType.Silu,torch.bfloat16,torch.float4_e2m1fn_x2,torch.float4_e2m1fn_x2,QuantType.per_1x32,1,0,32,0,24.5065,flydsl_moe1_afp4_wfp4_bf16_t32x64x256_w2_kb2,0.0%,14.38,86263.45
stage1,256,4,7168,256,384,8,ActivationType.Silu,torch.bfloat16,torch.float4_e2m1fn_x2,torch.float4_e2m1fn_x2,QuantType.per_1x32,1,0,32,0,19.7636,flydsl_moe1_afp4_wfp4_bf16_t32x64x256_w2_kb2_go,0.0%,17.83,106965.09
stage1,256,4,7168,256,384,8,ActivationType.Silu,torch.bfloat16,torch.float4_e2m1fn_x2,torch.float4_e2m1fn_x2,QuantType.per_1x32,1,0,32,0,18.5829,flydsl_moe1_afp4_wfp4_bf16_t32x64x256_w2_kb4_bnt0,0.0%,18.96,113761.32
stage1,256,4,7168,256,384,8,ActivationType.Silu,torch.bfloat16,torch.float4_e2m1fn_x2,torch.float4_e2m1fn_x2,QuantType.per_1x32,1,0,32,0,24.9028,flydsl_moe1_afp4_wfp4_bf16_t32x64x256_w2_kb4_bnt0_go,0.0%,14.15,84890.66
stage1,256,4,7168,256,384,8,ActivationType.Silu,torch.bfloat16,torch.float4_e2m1fn_x2,torch.float4_e2m1fn_x2,QuantType.per_1x32,1,0,32,0,19.9622,flydsl_moe1_afp4_wfp4_bf16_t32x64x256_w2_kb4,0.0%,17.65,105900.91
stage1,256,4,7168,256,384,8,ActivationType.Silu,torch.bfloat16,torch.float4_e2m1fn_x2,torch.float4_e2m1fn_x2,QuantType.per_1x32,1,0,32,0,24.5065,flydsl_moe1_afp4_wfp4_bf16_t32x64x256_w2_kb4_go,0.0%,14.38,86263.45
stage1,256,4,7168,256,384,8,ActivationType.Silu,torch.bfloat16,torch.float4_e2m1fn_x2,torch.float4_e2m1fn_x2,QuantType.per_1x32,1,0,32,0,25.0995,flydsl_moe1_afp4_wfp4_bf16_t32x64x256_w2_kb7_bnt0,0.1%,14.04,84225.39
stage1,256,4,7168,256,384,8,ActivationType.Silu,torch.bfloat16,torch.float4_e2m1fn_x2,torch.float4_e2m1fn_x2,QuantType.per_1x32,1,0,32,0,26.8719,flydsl_moe1_afp4_wfp4_bf16_t32x64x256_w2_kb7_bnt0_go,0.1%,13.11,78670.11
stage1,256,4,7168,256,384,8,ActivationType.Silu,torch.bfloat16,torch.float4_e2m1fn_x2,torch.float4_e2m1fn_x2,QuantType.per_1x32,1,0,32,0,24.492,flydsl_moe1_afp4_wfp4_bf16_t32x64x256_w2_kb7,0.1%,14.39,86314.52
stage1,256,4,7168,256,384,8,ActivationType.Silu,torch.bfloat16,torch.float4_e2m1fn_x2,torch.float4_e2m1fn_x2,QuantType.per_1x32,1,0,32,0,28.0027,flydsl_moe1_afp4_wfp4_bf16_t32x64x256_w2_kb7_go,0.1%,12.58,75493.26
stage1,256,4,7168,256,384,8,ActivationType.Silu,torch.bfloat16,torch.float4_e2m1fn_x2,torch.float4_e2m1fn_x2,QuantType.per_1x32,1,0,32,0,25.3103,flydsl_moe1_afp4_wfp4_bf16_t32x64x256_w3_bnt0,0.0%,13.92,83523.91
stage1,256,4,7168,256,384,8,ActivationType.Silu,torch.bfloat16,torch.float4_e2m1fn_x2,torch.float4_e2m1fn_x2,QuantType.per_1x32,1,0,32,0,25.0663,flydsl_moe1_afp4_wfp4_bf16_t32x64x256_w3,0.0%,14.06,84336.95
stage1,256,4,7168,256,384,8,ActivationType.Silu,torch.bfloat16,torch.float4_e2m1fn_x2,torch.float4_e2m1fn_x2,QuantType.per_1x32,1,0,32,0,24.1782,flydsl_moe1_afp4_wfp4_bf16_t32x64x256_w3_kb2_bnt0,0.0%,14.57,87434.76
stage1,256,4,7168,256,384,8,ActivationType.Silu,torch.bfloat16,torch.float4_e2m1fn_x2,torch.float4_e2m1fn_x2,QuantType.per_1x32,1,0,32,0,20.3684,flydsl_moe1_afp4_wfp4_bf16_t32x64x256_w3_kb2_bnt0_go,0.0%,17.3,103788.97
stage1,256,4,7168,256,384,8,ActivationType.Silu,torch.bfloat16,torch.float4_e2m1fn_x2,torch.float4_e2m1fn_x2,QuantType.per_1x32,1,0,32,0,23.2651,flydsl_moe1_afp4_wfp4_bf16_t32x64x256_w3_kb2,0.0%,15.14,90866.37
stage1,256,4,7168,256,384,8,ActivationType.Silu,torch.bfloat16,torch.float4_e2m1fn_x2,torch.float4_e2m1fn_x2,QuantType.per_1x32,1,0,32,0,18.3838,flydsl_moe1_afp4_wfp4_bf16_t32x64x256_w3_kb2_go,0.0%,19.16,114993.38
stage1,256,4,7168,256,384,8,ActivationType.Silu,torch.bfloat16,torch.float4_e2m1fn_x2,torch.float4_e2m1fn_x2,QuantType.per_1x32,1,0,32,0,19.7958,flydsl_moe1_afp4_wfp4_bf16_t32x64x256_w3_kb4_bnt0,0.0%,17.8,106791.1
stage1,256,4,7168,256,384,8,ActivationType.Silu,torch.bfloat16,torch.float4_e2m1fn_x2,torch.float4_e2m1fn_x2,QuantType.per_1x32,1,0,32,0,24.746,flydsl_moe1_afp4_wfp4_bf16_t32x64x256_w3_kb4_bnt0_go,0.0%,14.24,85428.56
stage1,256,4,7168,256,384,8,ActivationType.Silu,torch.bfloat16,torch.float4_e2m1fn_x2,torch.float4_e2m1fn_x2,QuantType.per_1x32,1,0,32,0,19.8154,flydsl_moe1_afp4_wfp4_bf16_t32x64x256_w3_kb4,0.0%,17.78,106685.47
stage1,256,4,7168,256,384,8,ActivationType.Silu,torch.bfloat16,torch.float4_e2m1fn_x2,torch.float4_e2m1fn_x2,QuantType.per_1x32,1,0,32,0,25.1171,flydsl_moe1_afp4_wfp4_bf16_t32x64x256_w3_kb4_go,0.0%,14.03,84166.37
stage1,256,4,7168,256,384,8,ActivationType.Silu,torch.bfloat16,torch.float4_e2m1fn_x2,torch.float4_e2m1fn_x2,QuantType.per_1x32,1,0,32,0,24.9219,flydsl_moe1_afp4_wfp4_bf16_t32x64x256_w3_kb7_bnt0,0.0%,14.14,84825.6
stage1,256,4,7168,256,384,8,ActivationType.Silu,torch.bfloat16,torch.float4_e2m1fn_x2,torch.float4_e2m1fn_x2,QuantType.per_1x32,1,0,32,0,24.7662,flydsl_moe1_afp4_wfp4_bf16_t32x64x256_w3_kb7_bnt0_go,0.0%,14.23,85358.89
stage1,256,4,7168,256,384,8,ActivationType.Silu,torch.bfloat16,torch.float4_e2m1fn_x2,torch.float4_e2m1fn_x2,QuantType.per_1x32,1,0,32,0,25.9633,flydsl_moe1_afp4_wfp4_bf16_t32x64x256_w3_kb7,0.0%,13.57,81423.21
stage1,256,4,7168,256,384,8,ActivationType.Silu,torch.bfloat16,torch.float4_e2m1fn_x2,torch.float4_e2m1fn_x2,QuantType.per_1x32,1,0,32,0,25.1182,flydsl_moe1_afp4_wfp4_bf16_t32x64x256_w3_kb7_go,0.1%,14.03,84162.69
stage1,256,4,7168,256,384,8,ActivationType.Silu,torch.bfloat16,torch.float4_e2m1fn_x2,torch.float4_e2m1fn_x2,QuantType.per_1x32,1,0,32,0,25.2154,flydsl_moe1_afp4_wfp4_bf16_t32x64x256_w4_bnt0,0.0%,13.97,83838.26
stage1,256,4,7168,256,384,8,ActivationType.Silu,torch.bfloat16,torch.float4_e2m1fn_x2,torch.float4_e2m1fn_x2,QuantType.per_1x32,1,0,32,0,25.4633,flydsl_moe1_afp4_wfp4_bf16_t32x64x256_w4,0.0%,13.84,83022.04
stage1,256,4,7168,256,384,8,ActivationType.Silu,torch.bfloat16,torch.float4_e2m1fn_x2,torch.float4_e2m1fn_x2,QuantType.per_1x32,1,0,32,0,25.9777,flydsl_moe1_afp4_wfp4_bf16_t32x64x256_w4_kb2_bnt0,0.0%,13.56,81378.08
stage1,256,4,7168,256,384,8,ActivationType.Silu,torch.bfloat16,torch.float4_e2m1fn_x2,torch.float4_e2m1fn_x2,QuantType.per_1x32,1,0,32,0,18.5288,flydsl_moe1_afp4_wfp4_bf16_t32x64x256_w4_kb2_bnt0_go,0.0%,19.01,114093.48
stage1,256,4,7168,256,384,8,ActivationType.Silu,torch.bfloat16,torch.float4_e2m1fn_x2,torch.float4_e2m1fn_x2,QuantType.per_1x32,1,0,32,0,23.9583,flydsl_moe1_afp4_wfp4_bf16_t32x64x256_w4_kb2,0.0%,14.71,88237.28
stage1,256,4,7168,256,384,8,ActivationType.Silu,torch.bfloat16,torch.float4_e2m1fn_x2,torch.float4_e2m1fn_x2,QuantType.per_1x32,1,0,32,0,20.0127,flydsl_moe1_afp4_wfp4_bf16_t32x64x256_w4_kb2_go,0.0%,17.6,105633.68
stage1,256,4,7168,256,384,8,ActivationType.Silu,torch.bfloat16,torch.float4_e2m1fn_x2,torch.float4_e2m1fn_x2,QuantType.per_1x32,1,0,32,0,19.9146,flydsl_moe1_afp4_wfp4_bf16_t32x64x256_w4_kb4_bnt0,0.0%,17.69,106154.04
stage1,256,4,7168,256,384,8,ActivationType.Silu,torch.bfloat16,torch.float4_e2m1fn_x2,torch.float4_e2m1fn_x2,QuantType.per_1x32,1,0,32,0,18.1365,flydsl_moe1_afp4_wfp4_bf16_t32x64x256_w4_kb4_bnt0_go,0.0%,19.43,116561.37
stage1,256,4,7168,256,384,8,ActivationType.Silu,torch.bfloat16,torch.float4_e2m1fn_x2,torch.float4_e2m1fn_x2,QuantType.per_1x32,1,0,32,0,18.0621,flydsl_moe1_afp4_wfp4_bf16_t32x64x256_w4_kb4,0.0%,19.51,117041.5
stage1,256,4,7168,256,384,8,ActivationType.Silu,torch.bfloat16,torch.float4_e2m1fn_x2,torch.float4_e2m1fn_x2,QuantType.per_1x32,1,0,32,0,19.4995,flydsl_moe1_afp4_wfp4_bf16_t32x64x256_w4_kb4_go,0.0%,18.07,108413.82
stage1,256,4,7168,256,384,8,ActivationType.Silu,torch.bfloat16,torch.float4_e2m1fn_x2,torch.float4_e2m1fn_x2,QuantType.per_1x32,1,0,32,0,18.6828,flydsl_moe1_afp4_wfp4_bf16_t32x64x256_w4_kb7_bnt0,0.0%,18.86,113153.02
stage1,256,4,7168,256,384,8,ActivationType.Silu,torch.bfloat16,torch.float4_e2m1fn_x2,torch.float4_e2m1fn_x2,QuantType.per_1x32,1,0,32,0,21.4999,flydsl_moe1_afp4_wfp4_bf16_t32x64x256_w4_kb7_bnt0_go,0.1%,16.39,98326.75
stage1,256,4,7168,256,384,8,ActivationType.Silu,torch.bfloat16,torch.float4_e2m1fn_x2,torch.float4_e2m1fn_x2,QuantType.per_1x32,1,0,32,0,19.964,flydsl_moe1_afp4_wfp4_bf16_t32x64x256_w4_kb7,0.0%,17.65,105891.37
stage1,256,4,7168,256,384,8,ActivationType.Silu,torch.bfloat16,torch.float4_e2m1fn_x2,torch.float4_e2m1fn_x2,QuantType.per_1x32,1,0,32,0,21.3529,flydsl_moe1_afp4_wfp4_bf16_t32x64x256_w4_kb7_go,0.0%,16.5,99003.66
stage1,256,4,7168,256,384,8,ActivationType.Silu,torch.bfloat16,torch.float4_e2m1fn_x2,torch.float4_e2m1fn_x2,QuantType.per_1x32,1,0,32,0,28.2273,flydsl_moe1_afp4_wfp4_bf16_t32x128x256_bnt0,0.0%,12.48,74892.58
stage1,256,4,7168,256,384,8,ActivationType.Silu,torch.bfloat16,torch.float4_e2m1fn_x2,torch.float4_e2m1fn_x2,QuantType.per_1x32,1,0,32,0,28.4676,flydsl_moe1_afp4_wfp4_bf16_t32x128x256,0.0%,12.38,74260.4
stage1,256,4,7168,256,384,8,ActivationType.Silu,torch.bfloat16,torch.float4_e2m1fn_x2,torch.float4_e2m1fn_x2,QuantType.per_1x32,1,0,32,0,27.6098,flydsl_moe1_afp4_wfp4_bf16_t32x128x256_kb2_bnt0,0.0%,12.76,76567.57
stage1,256,4,7168,256,384,8,ActivationType.Silu,torch.bfloat16,torch.float4_e2m1fn_x2,torch.float4_e2m1fn_x2,QuantType.per_1x32,1,0,32,0,22.458,flydsl_moe1_afp4_wfp4_bf16_t32x128x256_kb2_bnt0_go,0.0%,15.69,94131.95
stage1,256,4,7168,256,384,8,ActivationType.Silu,torch.bfloat16,torch.float4_e2m1fn_x2,torch.float4_e2m1fn_x2,QuantType.per_1x32,1,0,32,0,26.3266,flydsl_moe1_afp4_wfp4_bf16_t32x128x256_kb2,0.0%,13.38,80299.59
stage1,256,4,7168,256,384,8,ActivationType.Silu,torch.bfloat16,torch.float4_e2m1fn_x2,torch.float4_e2m1fn_x2,QuantType.per_1x32,1,0,32,0,21.2888,flydsl_moe1_afp4_wfp4_bf16_t32x128x256_kb2_go,0.0%,16.55,99301.76
stage1,256,4,7168,256,384,8,ActivationType.Silu,torch.bfloat16,torch.float4_e2m1fn_x2,torch.float4_e2m1fn_x2,QuantType.per_1x32,1,0,32,0,18.2189,flydsl_moe1_afp4_wfp4_bf16_t32x128x256_kb4_bnt0,0.0%,19.34,116034.19
stage1,256,4,7168,256,384,8,ActivationType.Silu,torch.bfloat16,torch.float4_e2m1fn_x2,torch.float4_e2m1fn_x2,QuantType.per_1x32,1,0,32,0,25.9045,flydsl_moe1_afp4_wfp4_bf16_t32x128x256_kb4_bnt0_go,0.0%,13.6,81608.03
stage1,256,4,7168,256,384,8,ActivationType.Silu,torch.bfloat16,torch.float4_e2m1fn_x2,torch.float4_e2m1fn_x2,QuantType.per_1x32,1,0,32,0,19.7837,flydsl_moe1_afp4_wfp4_bf16_t32x128x256_kb4,0.1%,17.81,106856.41
stage1,256,4,7168,256,384,8,ActivationType.Silu,torch.bfloat16,torch.float4_e2m1fn_x2,torch.float4_e2m1fn_x2,QuantType.per_1x32,1,0,32,0,21.9348,flydsl_moe1_afp4_wfp4_bf16_t32x128x256_kb4_go,0.0%,16.06,96377.23
stage1,256,4,7168,256,384,8,ActivationType.Silu,torch.bfloat16,torch.float4_e2m1fn_x2,torch.float4_e2m1fn_x2,QuantType.per_1x32,1,0,32,0,24.2631,flydsl_moe1_afp4_wfp4_bf16_t32x128x256_kb7_bnt0,0.0%,14.52,87128.82
stage1,256,4,7168,256,384,8,ActivationType.Silu,torch.bfloat16,torch.float4_e2m1fn_x2,torch.float4_e2m1fn_x2,QuantType.per_1x32,1,0,32,0,27.58,flydsl_moe1_afp4_wfp4_bf16_t32x128x256_kb7_bnt0_go,0.0%,12.77,76650.3
stage1,256,4,7168,256,384,8,ActivationType.Silu,torch.bfloat16,torch.float4_e2m1fn_x2,torch.float4_e2m1fn_x2,QuantType.per_1x32,1,0,32,0,25.2825,flydsl_moe1_afp4_wfp4_bf16_t32x128x256_kb7,0.0%,13.94,83615.75
stage1,256,4,7168,256,384,8,ActivationType.Silu,torch.bfloat16,torch.float4_e2m1fn_x2,torch.float4_e2m1fn_x2,QuantType.per_1x32,1,0,32,0,26.8604,flydsl_moe1_afp4_wfp4_bf16_t32x128x256_kb7_go,0.0%,13.12,78703.79
stage1,256,4,7168,256,384,8,ActivationType.Silu,torch.bfloat16,torch.float4_e2m1fn_x2,torch.float4_e2m1fn_x2,QuantType.per_1x32,1,0,32,0,28.2118,flydsl_moe1_afp4_wfp4_bf16_t32x128x256_w2_bnt0,0.0%,12.49,74933.72
stage1,256,4,7168,256,384,8,ActivationType.Silu,torch.bfloat16,torch.float4_e2m1fn_x2,torch.float4_e2m1fn_x2,QuantType.per_1x32,1,0,32,0,28.6471,flydsl_moe1_afp4_wfp4_bf16_t32x128x256_w2,0.0%,12.3,73795.09
stage1,256,4,7168,256,384,8,ActivationType.Silu,torch.bfloat16,torch.float4_e2m1fn_x2,torch.float4_e2m1fn_x2,QuantType.per_1x32,1,0,32,0,24.7672,flydsl_moe1_afp4_wfp4_bf16_t32x128x256_w2_kb2_bnt0,0.0%,14.23,85355.44
stage1,256,4,7168,256,384,8,ActivationType.Silu,torch.bfloat16,torch.float4_e2m1fn_x2,torch.float4_e2m1fn_x2,QuantType.per_1x32,1,0,32,0,20.4024,flydsl_moe1_afp4_wfp4_bf16_t32x128x256_w2_kb2_bnt0_go,0.0%,17.27,103616.01
stage1,256,4,7168,256,384,8,ActivationType.Silu,torch.bfloat16,torch.float4_e2m1fn_x2,torch.float4_e2m1fn_x2,QuantType.per_1x32,1,0,32,0,27.5139,flydsl_moe1_afp4_wfp4_bf16_t32x128x256_w2_kb2,0.0%,12.81,76834.44
stage1,256,4,7168,256,384,8,ActivationType.Silu,torch.bfloat16,torch.float4_e2m1fn_x2,torch.float4_e2m1fn_x2,QuantType.per_1x32,1,0,32,0,20.0223,flydsl_moe1_afp4_wfp4_bf16_t32x128x256_w2_kb2_go,0.0%,17.6,105583.04
stage1,256,4,7168,256,384,8,ActivationType.Silu,torch.bfloat16,torch.float4_e2m1fn_x2,torch.float4_e2m1fn_x2,QuantType.per_1x32,1,0,32,0,18.6145,flydsl_moe1_afp4_wfp4_bf16_t32x128x256_w2_kb4_bnt0,0.0%,18.93,113568.2
stage1,256,4,7168,256,384,8,ActivationType.Silu,torch.bfloat16,torch.float4_e2m1fn_x2,torch.float4_e2m1fn_x2,QuantType.per_1x32,1,0,32,0,19.3989,flydsl_moe1_afp4_wfp4_bf16_t32x128x256_w2_kb4_bnt0_go,0.0%,18.16,108976.04
stage1,256,4,7168,256,384,8,ActivationType.Silu,torch.bfloat16,torch.float4_e2m1fn_x2,torch.float4_e2m1fn_x2,QuantType.per_1x32,1,0,32,0,19.6335,flydsl_moe1_afp4_wfp4_bf16_t32x128x256_w2_kb4,0.0%,17.94,107673.89
stage1,256,4,7168,256,384,8,ActivationType.Silu,torch.bfloat16,torch.float4_e2m1fn_x2,torch.float4_e2m1fn_x2,QuantType.per_1x32,1,0,32,0,17.7357,flydsl_moe1_afp4_wfp4_bf16_t32x128x256_w2_kb4_go,0.0%,19.87,119195.48
stage1,256,4,7168,256,384,8,ActivationType.Silu,torch.bfloat16,torch.float4_e2m1fn_x2,torch.float4_e2m1fn_x2,QuantType.per_1x32,1,0,32,0,19.7739,flydsl_moe1_afp4_wfp4_bf16_t32x128x256_w2_kb7_bnt0,0.0%,17.82,106909.37
stage1,256,4,7168,256,384,8,ActivationType.Silu,torch.bfloat16,torch.float4_e2m1fn_x2,torch.float4_e2m1fn_x2,QuantType.per_1x32,1,0,32,0,20.9192,flydsl_moe1_afp4_wfp4_bf16_t32x128x256_w2_kb7_bnt0_go,0.0%,16.84,101056.22
stage1,256,4,7168,256,384,8,ActivationType.Silu,torch.bfloat16,torch.float4_e2m1fn_x2,torch.float4_e2m1fn_x2,QuantType.per_1x32,1,0,32,0,18.2685,flydsl_moe1_afp4_wfp4_bf16_t32x128x256_w2_kb7,0.0%,19.29,115719.15
stage1,256,4,7168,256,384,8,ActivationType.Silu,torch.bfloat16,torch.float4_e2m1fn_x2,torch.float4_e2m1fn_x2,QuantType.per_1x32,1,0,32,0,22.03,flydsl_moe1_afp4_wfp4_bf16_t32x128x256_w2_kb7_go,0.0%,15.99,95960.75
stage1,256,4,7168,256,384,8,ActivationType.Silu,torch.bfloat16,torch.float4_e2m1fn_x2,torch.float4_e2m1fn_x2,QuantType.per_1x32,1,0,32,0,28.5269,flydsl_moe1_afp4_wfp4_bf16_t32x128x256_w3_bnt0,0.0%,12.35,74106.03
stage1,256,4,7168,256,384,8,ActivationType.Silu,torch.bfloat16,torch.float4_e2m1fn_x2,torch.float4_e2m1fn_x2,QuantType.per_1x32,1,0,32,0,28.1952,flydsl_moe1_afp4_wfp4_bf16_t32x128x256_w3,0.0%,12.5,74977.84
stage1,256,4,7168,256,384,8,ActivationType.Silu,torch.bfloat16,torch.float4_e2m1fn_x2,torch.float4_e2m1fn_x2,QuantType.per_1x32,1,0,32,0,25.7536,flydsl_moe1_afp4_wfp4_bf16_t32x128x256_w3_kb2_bnt0,0.0%,13.68,82086.2
stage1,256,4,7168,256,384,8,ActivationType.Silu,torch.bfloat16,torch.float4_e2m1fn_x2,torch.float4_e2m1fn_x2,QuantType.per_1x32,1,0,32,0,22.4816,flydsl_moe1_afp4_wfp4_bf16_t32x128x256_w3_kb2_bnt0_go,0.0%,15.67,94033.13
stage1,256,4,7168,256,384,8,ActivationType.Silu,torch.bfloat16,torch.float4_e2m1fn_x2,torch.float4_e2m1fn_x2,QuantType.per_1x32,1,0,32,0,27.2155,flydsl_moe1_afp4_wfp4_bf16_t32x128x256_w3_kb2,0.0%,12.95,77676.88
stage1,256,4,7168,256,384,8,ActivationType.Silu,torch.bfloat16,torch.float4_e2m1fn_x2,torch.float4_e2m1fn_x2,QuantType.per_1x32,1,0,32,0,19.1212,flydsl_moe1_afp4_wfp4_bf16_t32x128x256_w3_kb2_go,0.0%,18.43,110558.71
stage1,256,4,7168,256,384,8,ActivationType.Silu,torch.bfloat16,torch.float4_e2m1fn_x2,torch.float4_e2m1fn_x2,QuantType.per_1x32,1,0,32,0,18.5159,flydsl_moe1_afp4_wfp4_bf16_t32x128x256_w3_kb4_bnt0,0.0%,19.03,114172.97
stage1,256,4,7168,256,384,8,ActivationType.Silu,torch.bfloat16,torch.float4_e2m1fn_x2,torch.float4_e2m1fn_x2,QuantType.per_1x32,1,0,32,0,19.3349,flydsl_moe1_afp4_wfp4_bf16_t32x128x256_w3_kb4_bnt0_go,0.0%,18.22,109336.76
stage1,256,4,7168,256,384,8,ActivationType.Silu,torch.bfloat16,torch.float4_e2m1fn_x2,torch.float4_e2m1fn_x2,QuantType.per_1x32,1,0,32,0,18.1571,flydsl_moe1_afp4_wfp4_bf16_t32x128x256_w3_kb4,0.0%,19.4,116429.12
stage1,256,4,7168,256,384,8,ActivationType.Silu,torch.bfloat16,torch.float4_e2m1fn_x2,torch.float4_e2m1fn_x2,QuantType.per_1x32,1,0,32,0,19.432,flydsl_moe1_afp4_wfp4_bf16_t32x128x256_w3_kb4_go,0.0%,18.13,108790.41
stage1,256,4,7168,256,384,8,ActivationType.Silu,torch.bfloat16,torch.float4_e2m1fn_x2,torch.float4_e2m1fn_x2,QuantType.per_1x32,1,0,32,0,19.7512,flydsl_moe1_afp4_wfp4_bf16_t32x128x256_w3_kb7_bnt0,0.1%,17.84,107032.24
stage1,256,4,7168,256,384,8,ActivationType.Silu,torch.bfloat16,torch.float4_e2m1fn_x2,torch.float4_e2m1fn_x2,QuantType.per_1x32,1,0,32,0,24.3757,flydsl_moe1_afp4_wfp4_bf16_t32x128x256_w3_kb7_bnt0_go,0.0%,14.45,86726.34
stage1,256,4,7168,256,384,8,ActivationType.Silu,torch.bfloat16,torch.float4_e2m1fn_x2,torch.float4_e2m1fn_x2,QuantType.per_1x32,1,0,32,0,18.4418,flydsl_moe1_afp4_wfp4_bf16_t32x128x256_w3_kb7,0.0%,19.1,114631.72
stage1,256,4,7168,256,384,8,ActivationType.Silu,torch.bfloat16,torch.float4_e2m1fn_x2,torch.float4_e2m1fn_x2,QuantType.per_1x32,1,0,32,0,25.0138,flydsl_moe1_afp4_wfp4_bf16_t32x128x256_w3_kb7_go,0.0%,14.09,84513.96
stage1,256,4,7168,256,384,8,ActivationType.Silu,torch.bfloat16,torch.float4_e2m1fn_x2,torch.float4_e2m1fn_x2,QuantType.per_1x32,1,0,32,0,28.5513,flydsl_moe1_afp4_wfp4_bf16_t32x128x256_w4_bnt0,0.0%,12.34,74042.7
stage1,256,4,7168,256,384,8,ActivationType.Silu,torch.bfloat16,torch.float4_e2m1fn_x2,torch.float4_e2m1fn_x2,QuantType.per_1x32,1,0,32,0,28.2801,flydsl_moe1_afp4_wfp4_bf16_t32x128x256_w4,0.0%,12.46,74752.75
stage1,256,4,7168,256,384,8,ActivationType.Silu,torch.bfloat16,torch.float4_e2m1fn_x2,torch.float4_e2m1fn_x2,QuantType.per_1x32,1,0,32,0,26.6344,flydsl_moe1_afp4_wfp4_bf16_t32x128x256_w4_kb2_bnt0,0.0%,13.23,79371.61
stage1,256,4,7168,256,384,8,ActivationType.Silu,torch.bfloat16,torch.float4_e2m1fn_x2,torch.float4_e2m1fn_x2,QuantType.per_1x32,1,0,32,0,21.306,flydsl_moe1_afp4_wfp4_bf16_t32x128x256_w4_kb2_bnt0_go,0.0%,16.54,99221.59
stage1,256,4,7168,256,384,8,ActivationType.Silu,torch.bfloat16,torch.float4_e2m1fn_x2,torch.float4_e2m1fn_x2,QuantType.per_1x32,1,0,32,0,25.9138,flydsl_moe1_afp4_wfp4_bf16_t32x128x256_w4_kb2,0.0%,13.6,81578.74
stage1,256,4,7168,256,384,8,ActivationType.Silu,torch.bfloat16,torch.float4_e2m1fn_x2,torch.float4_e2m1fn_x2,QuantType.per_1x32,1,0,32,0,21.8539,flydsl_moe1_afp4_wfp4_bf16_t32x128x256_w4_kb2_go,0.0%,16.12,96734.0
stage1,256,4,7168,256,384,8,ActivationType.Silu,torch.bfloat16,torch.float4_e2m1fn_x2,torch.float4_e2m1fn_x2,QuantType.per_1x32,1,0,32,0,19.5781,flydsl_moe1_afp4_wfp4_bf16_t32x128x256_w4_kb4_bnt0,0.0%,18.0,107978.57
stage1,256,4,7168,256,384,8,ActivationType.Silu,torch.bfloat16,torch.float4_e2m1fn_x2,torch.float4_e2m1fn_x2,QuantType.per_1x32,1,0,32,0,18.2974,flydsl_moe1_afp4_wfp4_bf16_t32x128x256_w4_kb4_bnt0_go,0.0%,19.26,115536.37
stage1,256,4,7168,256,384,8,ActivationType.Silu,torch.bfloat16,torch.float4_e2m1fn_x2,torch.float4_e2m1fn_x2,QuantType.per_1x32,1,0,32,0,18.5304,flydsl_moe1_afp4_wfp4_bf16_t32x128x256_w4_kb4,0.0%,19.01,114083.63
stage1,256,4,7168,256,384,8,ActivationType.Silu,torch.bfloat16,torch.float4_e2m1fn_x2,torch.float4_e2m1fn_x2,QuantType.per_1x32,1,0,32,0,19.4485,flydsl_moe1_afp4_wfp4_bf16_t32x128x256_w4_kb4_go,0.0%,18.12,108698.11
stage1,256,4,7168,256,384,8,ActivationType.Silu,torch.bfloat16,torch.float4_e2m1fn_x2,torch.float4_e2m1fn_x2,QuantType.per_1x32,1,0,32,0,19.8151,flydsl_moe1_afp4_wfp4_bf16_t32x128x256_w4_kb7_bnt0,0.0%,17.78,106687.08
stage1,256,4,7168,256,384,8,ActivationType.Silu,torch.bfloat16,torch.float4_e2m1fn_x2,torch.float4_e2m1fn_x2,QuantType.per_1x32,1,0,32,0,18.9075,flydsl_moe1_afp4_wfp4_bf16_t32x128x256_w4_kb7_bnt0_go,0.0%,18.63,111808.29
stage1,256,4,7168,256,384,8,ActivationType.Silu,torch.bfloat16,torch.float4_e2m1fn_x2,torch.float4_e2m1fn_x2,QuantType.per_1x32,1,0,32,0,18.6189,flydsl_moe1_afp4_wfp4_bf16_t32x128x256_w4_kb7,0.0%,18.92,113541.36
stage1,256,4,7168,256,384,8,ActivationType.Silu,torch.bfloat16,torch.float4_e2m1fn_x2,torch.float4_e2m1fn_x2,QuantType.per_1x32,1,0,32,0,19.923,flydsl_moe1_afp4_wfp4_bf16_t32x128x256_w4_kb7_go,0.0%,17.68,106109.28
stage2,256,4,7168,256,384,8,ActivationType.Silu,torch.bfloat16,torch.float4_e2m1fn_x2,torch.float4_e2m1fn_x2,QuantType.per_1x32,1,0,32,0,13.5285,flydsl_moe2_afp4_wfp4_bf16_t32x128x256_atomic,99.8%,26.04,156263.83
stage2,256,4,7168,256,384,8,ActivationType.Silu,torch.bfloat16,torch.float4_e2m1fn_x2,torch.float4_e2m1fn_x2,QuantType.per_1x32,1,0,32,0,19.2698,flydsl_moe2_afp4_wfp4_bf16_t32x128x256_reduce,0.0%,18.28,109706.13
stage2,256,4,7168,256,384,8,ActivationType.Silu,torch.bfloat16,torch.float4_e2m1fn_x2,torch.float4_e2m1fn_x2,QuantType.per_1x32,1,0,32,0,14.6978,flydsl_moe2_afp4_wfp4_bf16_t32x256x256_atomic,99.8%,23.97,143832.09
stage2,256,4,7168,256,384,8,ActivationType.Silu,torch.bfloat16,torch.float4_e2m1fn_x2,torch.float4_e2m1fn_x2,QuantType.per_1x32,1,0,32,0,19.2279,flydsl_moe2_afp4_wfp4_bf16_t32x256x256_reduce,0.0%,18.32,109945.2
stage1,256,4,7168,256,384,8,ActivationType.Silu,torch.bfloat16,torch.float4_e2m1fn_x2,torch.float4_e2m1fn_x2,QuantType.per_1x32,1,0,64,0,27.7426,flydsl_moe1_afp4_wfp4_bf16_t64x64x256_bnt0,0.0%,12.7,76201.05
stage1,256,4,7168,256,384,8,ActivationType.Silu,torch.bfloat16,torch.float4_e2m1fn_x2,torch.float4_e2m1fn_x2,QuantType.per_1x32,1,0,64,0,27.2747,flydsl_moe1_afp4_wfp4_bf16_t64x64x256,0.0%,12.92,77508.29
stage1,256,4,7168,256,384,8,ActivationType.Silu,torch.bfloat16,torch.float4_e2m1fn_x2,torch.float4_e2m1fn_x2,QuantType.per_1x32,1,0,64,0,27.9633,flydsl_moe1_afp4_wfp4_bf16_t64x64x256_w2_bnt0,0.0%,12.6,75599.63
stage1,256,4,7168,256,384,8,ActivationType.Silu,torch.bfloat16,torch.float4_e2m1fn_x2,torch.float4_e2m1fn_x2,QuantType.per_1x32,1,0,64,0,27.3081,flydsl_moe1_afp4_wfp4_bf16_t64x64x256_w2,0.0%,12.9,77413.49
stage1,256,4,7168,256,384,8,ActivationType.Silu,torch.bfloat16,torch.float4_e2m1fn_x2,torch.float4_e2m1fn_x2,QuantType.per_1x32,1,0,64,0,27.6097,flydsl_moe1_afp4_wfp4_bf16_t64x64x256_w3_bnt0,0.0%,12.76,76567.85
stage1,256,4,7168,256,384,8,ActivationType.Silu,torch.bfloat16,torch.float4_e2m1fn_x2,torch.float4_e2m1fn_x2,QuantType.per_1x32,1,0,64,0,27.3241,flydsl_moe1_afp4_wfp4_bf16_t64x64x256_w3,0.0%,12.89,77368.16
stage1,256,4,7168,256,384,8,ActivationType.Silu,torch.bfloat16,torch.float4_e2m1fn_x2,torch.float4_e2m1fn_x2,QuantType.per_1x32,1,0,64,0,27.4383,flydsl_moe1_afp4_wfp4_bf16_t64x64x256_w4_bnt0,0.0%,12.84,77046.14
stage1,256,4,7168,256,384,8,ActivationType.Silu,torch.bfloat16,torch.float4_e2m1fn_x2,torch.float4_e2m1fn_x2,QuantType.per_1x32,1,0,64,0,27.603,flydsl_moe1_afp4_wfp4_bf16_t64x64x256_w4,0.0%,12.76,76586.43
stage1,256,4,7168,256,384,8,ActivationType.Silu,torch.bfloat16,torch.float4_e2m1fn_x2,torch.float4_e2m1fn_x2,QuantType.per_1x32,1,0,64,0,30.3217,flydsl_moe1_afp4_wfp4_bf16_t64x128x256_bnt0,0.0%,11.62,69719.55
stage1,256,4,7168,256,384,8,ActivationType.Silu,torch.bfloat16,torch.float4_e2m1fn_x2,torch.float4_e2m1fn_x2,QuantType.per_1x32,1,0,64,0,30.003,flydsl_moe1_afp4_wfp4_bf16_t64x128x256,0.0%,11.74,70460.13
stage1,256,4,7168,256,384,8,ActivationType.Silu,torch.bfloat16,torch.float4_e2m1fn_x2,torch.float4_e2m1fn_x2,QuantType.per_1x32,1,0,64,0,29.9051,flydsl_moe1_afp4_wfp4_bf16_t64x128x256_w2_bnt0,0.0%,11.78,70690.79
stage1,256,4,7168,256,384,8,ActivationType.Silu,torch.bfloat16,torch.float4_e2m1fn_x2,torch.float4_e2m1fn_x2,QuantType.per_1x32,1,0,64,0,30.4836,flydsl_moe1_afp4_wfp4_bf16_t64x128x256_w2,0.0%,11.56,69349.26
stage1,256,4,7168,256,384,8,ActivationType.Silu,torch.bfloat16,torch.float4_e2m1fn_x2,torch.float4_e2m1fn_x2,QuantType.per_1x32,1,0,64,0,30.362,flydsl_moe1_afp4_wfp4_bf16_t64x128x256_w3_bnt0,0.0%,11.6,69627.01
stage1,256,4,7168,256,384,8,ActivationType.Silu,torch.bfloat16,torch.float4_e2m1fn_x2,torch.float4_e2m1fn_x2,QuantType.per_1x32,1,0,64,0,29.9684,flydsl_moe1_afp4_wfp4_bf16_t64x128x256_w3,0.0%,11.76,70541.48
stage1,256,4,7168,256,384,8,ActivationType.Silu,torch.bfloat16,torch.float4_e2m1fn_x2,torch.float4_e2m1fn_x2,QuantType.per_1x32,1,0,64,0,29.9455,flydsl_moe1_afp4_wfp4_bf16_t64x128x256_w4_bnt0,0.0%,11.77,70595.42
stage1,256,4,7168,256,384,8,ActivationType.Silu,torch.bfloat16,torch.float4_e2m1fn_x2,torch.float4_e2m1fn_x2,QuantType.per_1x32,1,0,64,0,30.394,flydsl_moe1_afp4_wfp4_bf16_t64x128x256_w4,0.0%,11.59,69553.7
stage2,256,4,7168,256,384,8,ActivationType.Silu,torch.bfloat16,torch.float4_e2m1fn_x2,torch.float4_e2m1fn_x2,QuantType.per_1x32,1,0,64,0,15.7979,flydsl_moe2_afp4_wfp4_bf16_t64x128x256_atomic,99.8%,22.3,133816.22
stage2,256,4,7168,256,384,8,ActivationType.Silu,torch.bfloat16,torch.float4_e2m1fn_x2,torch.float4_e2m1fn_x2,QuantType.per_1x32,1,0,64,0,20.0509,flydsl_moe2_afp4_wfp4_bf16_t64x128x256_reduce,0.0%,17.57,105432.44
stage2,256,4,7168,256,384,8,ActivationType.Silu,torch.bfloat16,torch.float4_e2m1fn_x2,torch.float4_e2m1fn_x2,QuantType.per_1x32,1,0,64,0,17.284,flydsl_moe2_afp4_wfp4_bf16_t64x256x256_atomic,99.8%,20.38,122310.53
stage2,256,4,7168,256,384,8,ActivationType.Silu,torch.bfloat16,torch.float4_e2m1fn_x2,torch.float4_e2m1fn_x2,QuantType.per_1x32,1,0,64,0,22.0032,flydsl_moe2_afp4_wfp4_bf16_t64x256x256_reduce,0.0%,16.01,96077.63
stage1,256,4,7168,256,384,8,ActivationType.Silu,torch.bfloat16,torch.float4_e2m1fn_x2,torch.float4_e2m1fn_x2,QuantType.per_1x32,1,0,128,0,33.6219,flydsl_moe1_afp4_wfp4_bf16_t128x64x256_bnt0,0.0%,10.48,62876.14
stage1,256,4,7168,256,384,8,ActivationType.Silu,torch.bfloat16,torch.float4_e2m1fn_x2,torch.float4_e2m1fn_x2,QuantType.per_1x32,1,0,128,0,33.5046,flydsl_moe1_afp4_wfp4_bf16_t128x64x256,0.0%,10.52,63096.27
stage1,256,4,7168,256,384,8,ActivationType.Silu,torch.bfloat16,torch.float4_e2m1fn_x2,torch.float4_e2m1fn_x2,QuantType.per_1x32,1,0,128,0,33.2522,flydsl_moe1_afp4_wfp4_bf16_t128x64x256_w2_bnt0,0.0%,10.6,63575.2
stage1,256,4,7168,256,384,8,ActivationType.Silu,torch.bfloat16,torch.float4_e2m1fn_x2,torch.float4_e2m1fn_x2,QuantType.per_1x32,1,0,128,0,33.8266,flydsl_moe1_afp4_wfp4_bf16_t128x64x256_w2,0.0%,10.42,62495.65
stage1,256,4,7168,256,384,8,ActivationType.Silu,torch.bfloat16,torch.float4_e2m1fn_x2,torch.float4_e2m1fn_x2,QuantType.per_1x32,1,0,128,0,33.6123,flydsl_moe1_afp4_wfp4_bf16_t128x64x256_w3_bnt0,0.0%,10.48,62894.1
stage1,256,4,7168,256,384,8,ActivationType.Silu,torch.bfloat16,torch.float4_e2m1fn_x2,torch.float4_e2m1fn_x2,QuantType.per_1x32,1,0,128,0,33.3365,flydsl_moe1_afp4_wfp4_bf16_t128x64x256_w3,0.0%,10.57,63414.43
stage1,256,4,7168,256,384,8,ActivationType.Silu,torch.bfloat16,torch.float4_e2m1fn_x2,torch.float4_e2m1fn_x2,QuantType.per_1x32,1,0,128,0,33.3247,flydsl_moe1_afp4_wfp4_bf16_t128x64x256_w4_bnt0,0.0%,10.57,63436.89
stage1,256,4,7168,256,384,8,ActivationType.Silu,torch.bfloat16,torch.float4_e2m1fn_x2,torch.float4_e2m1fn_x2,QuantType.per_1x32,1,0,128,0,33.7471,flydsl_moe1_afp4_wfp4_bf16_t128x64x256_w4,0.0%,10.44,62642.87
stage1,256,4,7168,256,384,8,ActivationType.Silu,torch.bfloat16,torch.float4_e2m1fn_x2,torch.float4_e2m1fn_x2,QuantType.per_1x32,1,0,128,0,36.0525,flydsl_moe1_afp4_wfp4_bf16_t128x128x256_bnt0,0.0%,9.77,58637.13
stage1,256,4,7168,256,384,8,ActivationType.Silu,torch.bfloat16,torch.float4_e2m1fn_x2,torch.float4_e2m1fn_x2,QuantType.per_1x32,1,0,128,0,35.6127,flydsl_moe1_afp4_wfp4_bf16_t128x128x256,0.0%,9.89,59361.27
stage1,256,4,7168,256,384,8,ActivationType.Silu,torch.bfloat16,torch.float4_e2m1fn_x2,torch.float4_e2m1fn_x2,QuantType.per_1x32,1,0,128,0,35.7966,flydsl_moe1_afp4_wfp4_bf16_t128x128x256_w2_bnt0,0.0%,9.84,59056.31
stage1,256,4,7168,256,384,8,ActivationType.Silu,torch.bfloat16,torch.float4_e2m1fn_x2,torch.float4_e2m1fn_x2,QuantType.per_1x32,1,0,128,0,36.184,flydsl_moe1_afp4_wfp4_bf16_t128x128x256_w2,0.0%,9.74,58424.03
stage1,256,4,7168,256,384,8,ActivationType.Silu,torch.bfloat16,torch.float4_e2m1fn_x2,torch.float4_e2m1fn_x2,QuantType.per_1x32,1,0,128,0,36.3236,flydsl_moe1_afp4_wfp4_bf16_t128x128x256_w3_bnt0,0.0%,9.7,58199.5
stage1,256,4,7168,256,384,8,ActivationType.Silu,torch.bfloat16,torch.float4_e2m1fn_x2,torch.float4_e2m1fn_x2,QuantType.per_1x32,1,0,128,0,35.6246,flydsl_moe1_afp4_wfp4_bf16_t128x128x256_w3,0.0%,9.89,59341.44
stage1,256,4,7168,256,384,8,ActivationType.Silu,torch.bfloat16,torch.float4_e2m1fn_x2,torch.float4_e2m1fn_x2,QuantType.per_1x32,1,0,128,0,35.7502,flydsl_moe1_afp4_wfp4_bf16_t128x128x256_w4_bnt0,0.0%,9.86,59132.96
stage1,256,4,7168,256,384,8,ActivationType.Silu,torch.bfloat16,torch.float4_e2m1fn_x2,torch.float4_e2m1fn_x2,QuantType.per_1x32,1,0,128,0,36.1882,flydsl_moe1_afp4_wfp4_bf16_t128x128x256_w4,0.0%,9.74,58417.25
stage2,256,4,7168,256,384,8,ActivationType.Silu,torch.bfloat16,torch.float4_e2m1fn_x2,torch.float4_e2m1fn_x2,QuantType.per_1x32,1,0,128,0,21.0015,flydsl_moe2_afp4_wfp4_bf16_t128x128x256_atomic,99.8%,16.78,100660.2
stage2,256,4,7168,256,384,8,ActivationType.Silu,torch.bfloat16,torch.float4_e2m1fn_x2,torch.float4_e2m1fn_x2,QuantType.per_1x32,1,0,128,0,24.6069,flydsl_moe2_afp4_wfp4_bf16_t128x128x256_reduce,0.0%,14.32,85911.48
stage2,256,4,7168,256,384,8,ActivationType.Silu,torch.bfloat16,torch.float4_e2m1fn_x2,torch.float4_e2m1fn_x2,QuantType.per_1x32,1,0,128,0,24.2487,flydsl_moe2_afp4_wfp4_bf16_t128x256x256_atomic,99.8%,14.53,87180.56
stage2,256,4,7168,256,384,8,ActivationType.Silu,torch.bfloat16,torch.float4_e2m1fn_x2,torch.float4_e2m1fn_x2,QuantType.per_1x32,1,0,128,0,28.8325,flydsl_moe2_afp4_wfp4_bf16_t128x256x256_reduce,0.0%,12.22,73320.57
stage1,256,8,7168,256,384,8,ActivationType.Silu,torch.bfloat16,torch.float4_e2m1fn_x2,torch.float4_e2m1fn_x2,QuantType.per_1x32,1,0,32,0,33.565,moe_ck2stages_gemm1_256x32x128x128_1x4_MulABScaleShuffled_v3_Nswizzle0_Quant3_MulRoutedWeight0_silu_FP4X2_FP4X2_B16,0.0%,20.99,62985.29
stage1,256,8,7168,256,384,8,ActivationType.Silu,torch.bfloat16,torch.float4_e2m1fn_x2,torch.float4_e2m1fn_x2,QuantType.per_1x32,1,0,32,0,27.1676,moe_ck2stages_gemm1_64x32x32x128_1x1_MulABScaleShuffled_v3_Nswizzle0_Quant3_MulRoutedWeight0_silu_FP4X2_FP4X2_B16,0.0%,25.94,77817.0
stage2,256,8,7168,256,384,8,ActivationType.Silu,torch.bfloat16,torch.float4_e2m1fn_x2,torch.float4_e2m1fn_x2,QuantType.per_1x32,1,0,32,0,21.3068,moe_ck2stages_gemm2_256x32x128x128_1x4_MulABScaleExpertWeightShuffled_v3_Nswizzle0_Quant3_MulRoutedWeight1_FP4X2_FP4X2_B16,1.2%,33.07,99221.9
stage2,256,8,7168,256,384,8,ActivationType.Silu,torch.bfloat16,torch.float4_e2m1fn_x2,torch.float4_e2m1fn_x2,QuantType.per_1x32,1,0,32,0,18.7485,moe_ck2stages_gemm2_64x32x32x128_1x1_MulABScaleExpertWeightShuffled_v1_Nswizzle0_Quant3_MulRoutedWeight1_FP4X2_FP4X2_B16,1.2%,37.58,112761.09
stage1,256,8,7168,256,384,8,ActivationType.Silu,torch.bfloat16,torch.float4_e2m1fn_x2,torch.float4_e2m1fn_x2,QuantType.per_1x32,1,0,64,0,37.3752,moe_ck2stages_gemm1_256x64x128x128_1x4_MulABScaleShuffled_v3_Nswizzle0_Quant3_MulRoutedWeight0_silu_FP4X2_FP4X2_B16,0.0%,18.85,56564.28
stage2,256,8,7168,256,384,8,ActivationType.Silu,torch.bfloat16,torch.float4_e2m1fn_x2,torch.float4_e2m1fn_x2,QuantType.per_1x32,1,0,64,0,24.1371,moe_ck2stages_gemm2_256x64x128x128_1x4_MulABScaleExpertWeightShuffled_v3_Nswizzle0_Quant3_MulRoutedWeight1_FP4X2_FP4X2_B16,1.2%,29.19,87587.21
stage2,256,8,7168,256,384,8,ActivationType.Silu,torch.bfloat16,torch.float4_e2m1fn_x2,torch.float4_e2m1fn_x2,QuantType.per_1x32,1,0,64,0,34.4879,moe_ck2stages_gemm2_64x64x128x128_1x1_MulABScaleExpertWeightShuffled_v3_Nswizzle0_Quant3_MulRoutedWeight1_FP4X2_FP4X2_B16,1.3%,20.43,61299.8
stage1,256,8,7168,256,384,8,ActivationType.Silu,torch.bfloat16,torch.float4_e2m1fn_x2,torch.float4_e2m1fn_x2,QuantType.per_1x32,1,0,128,0,47.6844,moe_ck2stages_gemm1_256x128x128x128_1x4_MulABScaleShuffled_v3_Nswizzle0_Quant3_MulRoutedWeight0_silu_FP4X2_FP4X2_B16,0.0%,14.78,44335.28
stage2,256,8,7168,256,384,8,ActivationType.Silu,torch.bfloat16,torch.float4_e2m1fn_x2,torch.float4_e2m1fn_x2,QuantType.per_1x32,1,0,128,0,35.1787,moe_ck2stages_gemm2_256x128x128x128_1x4_MulABScaleExpertWeightShuffled_v3_Nswizzle0_Quant3_MulRoutedWeight1_FP4X2_FP4X2_B16,1.2%,20.03,60096.06
stage2,256,8,7168,256,384,8,ActivationType.Silu,torch.bfloat16,torch.float4_e2m1fn_x2,torch.float4_e2m1fn_x2,QuantType.per_1x32,1,0,128,0,51.4005,moe_ck2stages_gemm2_64x128x128x128_1x1_MulABScaleExpertWeightShuffled_v3_Nswizzle0_Quant3_MulRoutedWeight1_FP4X2_FP4X2_B16,1.2%,13.71,41129.97
stage1,256,8,7168,256,384,8,ActivationType.Silu,torch.bfloat16,torch.float4_e2m1fn_x2,torch.float4_e2m1fn_x2,QuantType.per_1x32,1,0,32,0,54.1453,flydsl_moe1_afp4_wfp4_bf16_t16x32x256_bnt0,0.0%,13.01,39044.96
stage1,256,8,7168,256,384,8,ActivationType.Silu,torch.bfloat16,torch.float4_e2m1fn_x2,torch.float4_e2m1fn_x2,QuantType.per_1x32,1,0,32,0,54.2334,flydsl_moe1_afp4_wfp4_bf16_t16x32x256,0.0%,12.99,38981.54
stage1,256,8,7168,256,384,8,ActivationType.Silu,torch.bfloat16,torch.float4_e2m1fn_x2,torch.float4_e2m1fn_x2,QuantType.per_1x32,1,0,32,0,67.2666,flydsl_moe1_afp4_wfp4_bf16_t16x32x256_kb2_bnt0,0.0%,10.48,31428.69
stage1,256,8,7168,256,384,8,ActivationType.Silu,torch.bfloat16,torch.float4_e2m1fn_x2,torch.float4_e2m1fn_x2,QuantType.per_1x32,1,0,32,0,106.182,flydsl_moe1_afp4_wfp4_bf16_t16x32x256_kb2_bnt0_go,0.0%,6.64,19910.17
stage1,256,8,7168,256,384,8,ActivationType.Silu,torch.bfloat16,torch.float4_e2m1fn_x2,torch.float4_e2m1fn_x2,QuantType.per_1x32,1,0,32,0,67.1047,flydsl_moe1_afp4_wfp4_bf16_t16x32x256_kb2,0.0%,10.5,31504.52
stage1,256,8,7168,256,384,8,ActivationType.Silu,torch.bfloat16,torch.float4_e2m1fn_x2,torch.float4_e2m1fn_x2,QuantType.per_1x32,1,0,32,0,105.9176,flydsl_moe1_afp4_wfp4_bf16_t16x32x256_kb2_go,0.0%,6.65,19959.87
stage1,256,8,7168,256,384,8,ActivationType.Silu,torch.bfloat16,torch.float4_e2m1fn_x2,torch.float4_e2m1fn_x2,QuantType.per_1x32,1,0,32,0,74.7032,flydsl_moe1_afp4_wfp4_bf16_t16x32x256_kb4_bnt0,0.0%,9.43,28300.01
stage1,256,8,7168,256,384,8,ActivationType.Silu,torch.bfloat16,torch.float4_e2m1fn_x2,torch.float4_e2m1fn_x2,QuantType.per_1x32,1,0,32,0,111.9341,flydsl_moe1_afp4_wfp4_bf16_t16x32x256_kb4_bnt0_go,0.0%,6.3,18887.02
stage1,256,8,7168,256,384,8,ActivationType.Silu,torch.bfloat16,torch.float4_e2m1fn_x2,torch.float4_e2m1fn_x2,QuantType.per_1x32,1,0,32,0,74.1212,flydsl_moe1_afp4_wfp4_bf16_t16x32x256_kb4,0.0%,9.51,28522.22
stage1,256,8,7168,256,384,8,ActivationType.Silu,torch.bfloat16,torch.float4_e2m1fn_x2,torch.float4_e2m1fn_x2,QuantType.per_1x32,1,0,32,0,111.6594,flydsl_moe1_afp4_wfp4_bf16_t16x32x256_kb4_go,0.0%,6.31,18933.48
stage1,256,8,7168,256,384,8,ActivationType.Silu,torch.bfloat16,torch.float4_e2m1fn_x2,torch.float4_e2m1fn_x2,QuantType.per_1x32,1,0,32,0,78.3742,flydsl_moe1_afp4_wfp4_bf16_t16x32x256_kb7_bnt0,0.0%,8.99,26974.45
stage1,256,8,7168,256,384,8,ActivationType.Silu,torch.bfloat16,torch.float4_e2m1fn_x2,torch.float4_e2m1fn_x2,QuantType.per_1x32,1,0,32,0,106.3882,flydsl_moe1_afp4_wfp4_bf16_t16x32x256_kb7_bnt0_go,0.0%,6.62,19871.58
