aiter/configs/qwen35_gemm_w16a16_profile.csv
cu_num,M,N,K,bias,dtype,outdtype,scaleAB,bpreshuffle,libtype,solidx,splitK,us,kernelName,err_ratio,tflops,bw
256,64,1024,4096,False,torch.bfloat16,torch.bfloat16,False,False,hipblaslt,439065,0,8.8848,,0.0,60.43,1017.91
256,64,1024,4096,False,torch.bfloat16,torch.bfloat16,False,False,hipblaslt,439066,0,9.1166,,0.0,58.89,992.03
256,64,1024,4096,False,torch.bfloat16,torch.bfloat16,False,False,hipblaslt,440202,0,9.2915,,0.0,57.78,973.36
256,64,1024,4096,False,torch.bfloat16,torch.bfloat16,False,False,hipblaslt,440197,0,9.3338,,0.0,57.52,968.95
256,64,1024,4096,False,torch.bfloat16,torch.bfloat16,False,False,hipblaslt,439308,0,9.3648,,0.0,57.33,965.74
256,64,1024,4096,False,torch.bfloat16,torch.bfloat16,False,False,hipblaslt,438688,0,9.3925,,0.0,57.16,962.89
256,64,1024,4096,False,torch.bfloat16,torch.bfloat16,False,False,hipblaslt,439688,0,9.4301,,0.0,56.93,959.05
256,64,1024,4096,False,torch.bfloat16,torch.bfloat16,False,False,hipblaslt,438755,0,9.4464,,0.0,56.83,957.4
256,64,1024,4096,False,torch.bfloat16,torch.bfloat16,False,False,hipblaslt,439380,0,10.2039,,0.0,52.61,886.32
256,64,1024,4096,False,torch.bfloat16,torch.bfloat16,False,False,hipblaslt,439945,0,10.3198,,0.0,52.02,876.37
256,64,1024,4096,False,torch.bfloat16,torch.bfloat16,False,False,hipblaslt,438957,0,10.5857,,0.0,50.72,854.36
256,64,1024,4096,False,torch.bfloat16,torch.bfloat16,False,False,asm,1,5,10.5954,_ZN5aiter39bf16gemm_fp32bf16_tn_32x64_splitk_cleanE,0.0143,50.67,853.57
256,64,1024,4096,False,torch.bfloat16,torch.bfloat16,False,False,asm,1,6,10.8334,_ZN5aiter39bf16gemm_fp32bf16_tn_32x64_splitk_cleanE,0.0159,49.56,834.82
256,64,1024,4096,False,torch.bfloat16,torch.bfloat16,False,False,asm,3,5,10.8647,_ZN5aiter39bf16gemm_fp32bf16_tn_48x64_splitk_cleanE,0.0143,49.41,832.42
256,64,1024,4096,False,torch.bfloat16,torch.bfloat16,False,False,hipblaslt,439684,0,10.8774,,0.0,49.36,831.45
256,64,1024,4096,False,torch.bfloat16,torch.bfloat16,False,False,asm,3,6,11.0019,_ZN5aiter39bf16gemm_fp32bf16_tn_48x64_splitk_cleanE,0.016,48.8,822.04
256,64,1024,4096,False,torch.bfloat16,torch.bfloat16,False,False,hipblaslt,438958,0,11.0624,,0.0,48.53,817.54
256,64,1024,4096,False,torch.bfloat16,torch.bfloat16,False,False,hipblaslt,439374,0,11.1027,,0.0,48.35,814.57
256,64,1024,4096,False,torch.bfloat16,torch.bfloat16,False,False,asm,5,6,11.1191,_ZN5aiter39bf16gemm_fp32bf16_tn_64x64_splitk_cleanE,0.0161,48.28,813.37
256,64,1024,4096,False,torch.bfloat16,torch.bfloat16,False,False,asm,1,4,11.1713,_ZN5aiter39bf16gemm_fp32bf16_tn_32x64_splitk_cleanE,0.0123,48.06,809.57
256,64,1024,4096,False,torch.bfloat16,torch.bfloat16,False,False,asm,5,7,11.2244,_ZN5aiter39bf16gemm_fp32bf16_tn_64x64_splitk_cleanE,0.017,47.83,805.74
256,64,1024,4096,False,torch.bfloat16,torch.bfloat16,False,False,asm,5,5,11.2293,_ZN5aiter39bf16gemm_fp32bf16_tn_64x64_splitk_cleanE,0.0141,47.81,805.39
256,64,1024,4096,False,torch.bfloat16,torch.bfloat16,False,False,asm,7,7,11.2568,_ZN5aiter39bf16gemm_fp32bf16_tn_80x64_splitk_cleanE,0.0172,47.69,803.42
256,64,1024,4096,False,torch.bfloat16,torch.bfloat16,False,False,asm,1,7,11.2647,_ZN5aiter39bf16gemm_fp32bf16_tn_32x64_splitk_cleanE,0.0177,47.66,802.86
256,64,1024,4096,False,torch.bfloat16,torch.bfloat16,False,False,asm,7,6,11.3767,_ZN5aiter39bf16gemm_fp32bf16_tn_80x64_splitk_cleanE,0.0163,47.19,794.96
256,64,1024,4096,False,torch.bfloat16,torch.bfloat16,False,False,asm,3,7,11.3831,_ZN5aiter39bf16gemm_fp32bf16_tn_48x64_splitk_cleanE,0.0175,47.16,794.51
256,64,1024,4096,False,torch.bfloat16,torch.bfloat16,False,False,asm,5,8,11.4283,_ZN5aiter39bf16gemm_fp32bf16_tn_64x64_splitk_cleanE,0.0192,46.98,791.37
256,64,1024,4096,False,torch.bfloat16,torch.bfloat16,False,False,asm,7,8,11.4303,_ZN5aiter39bf16gemm_fp32bf16_tn_80x64_splitk_cleanE,0.0196,46.97,791.23
256,64,1024,4096,False,torch.bfloat16,torch.bfloat16,False,False,asm,3,4,11.4695,_ZN5aiter39bf16gemm_fp32bf16_tn_48x64_splitk_cleanE,0.0121,46.81,788.52
256,64,1024,4096,False,torch.bfloat16,torch.bfloat16,False,False,asm,8,7,11.5063,_ZN5aiter39bf16gemm_fp32bf16_tn_96x64_splitk_cleanE,0.0178,46.66,786.0
256,64,1024,4096,False,torch.bfloat16,torch.bfloat16,False,False,hipblaslt,438931,0,11.5582,,0.0,46.45,782.47
256,64,1024,4096,False,torch.bfloat16,torch.bfloat16,False,False,asm,7,5,11.5668,_ZN5aiter39bf16gemm_fp32bf16_tn_80x64_splitk_cleanE,0.0143,46.41,781.89
256,64,1024,4096,False,torch.bfloat16,torch.bfloat16,False,False,asm,8,8,11.5895,_ZN5aiter39bf16gemm_fp32bf16_tn_96x64_splitk_cleanE,0.0199,46.32,780.36
256,64,1024,4096,False,torch.bfloat16,torch.bfloat16,False,False,asm,1,8,11.6168,_ZN5aiter39bf16gemm_fp32bf16_tn_32x64_splitk_cleanE,0.0186,46.22,778.52
256,64,1024,4096,False,torch.bfloat16,torch.bfloat16,False,False,asm,8,6,11.6791,_ZN5aiter39bf16gemm_fp32bf16_tn_96x64_splitk_cleanE,0.016,45.97,774.37
256,64,1024,4096,False,torch.bfloat16,torch.bfloat16,False,False,asm,7,9,11.7531,_ZN5aiter39bf16gemm_fp32bf16_tn_80x64_splitk_cleanE,0.0214,45.68,769.5
256,64,1024,4096,False,torch.bfloat16,torch.bfloat16,False,False,asm,8,5,11.8343,_ZN5aiter39bf16gemm_fp32bf16_tn_96x64_splitk_cleanE,0.0142,45.37,764.22
256,64,1024,4096,False,torch.bfloat16,torch.bfloat16,False,False,hipblaslt,438805,0,11.8489,,0.0,45.31,763.27
256,64,1024,4096,False,torch.bfloat16,torch.bfloat16,False,False,asm,5,9,11.8635,_ZN5aiter39bf16gemm_fp32bf16_tn_64x64_splitk_cleanE,0.021,45.25,762.34
256,64,1024,4096,False,torch.bfloat16,torch.bfloat16,False,False,asm,3,8,11.8955,_ZN5aiter39bf16gemm_fp32bf16_tn_48x64_splitk_cleanE,0.0196,45.13,760.28
256,64,1024,4096,False,torch.bfloat16,torch.bfloat16,False,False,asm,5,4,11.9591,_ZN5aiter39bf16gemm_fp32bf16_tn_64x64_splitk_cleanE,0.0119,44.89,756.24
256,64,1024,4096,False,torch.bfloat16,torch.bfloat16,False,False,asm,8,9,12.008,_ZN5aiter39bf16gemm_fp32bf16_tn_96x64_splitk_cleanE,0.0206,44.71,753.16
256,64,1024,4096,False,torch.bfloat16,torch.bfloat16,False,False,hipblaslt,438939,0,12.0742,,0.0,44.46,749.03
256,64,1024,4096,False,torch.bfloat16,torch.bfloat16,False,False,asm,1,3,12.3195,_ZN5aiter39bf16gemm_fp32bf16_tn_32x64_splitk_cleanE,0.009,43.58,734.12
256,64,1024,4096,False,torch.bfloat16,torch.bfloat16,False,False,hipblaslt,438938,0,12.3266,,0.0,43.55,733.7
256,64,1024,4096,False,torch.bfloat16,torch.bfloat16,False,False,asm,7,4,12.3547,_ZN5aiter39bf16gemm_fp32bf16_tn_80x64_splitk_cleanE,0.0124,43.45,732.03
256,64,1024,4096,False,torch.bfloat16,torch.bfloat16,False,False,asm,7,10,12.3675,_ZN5aiter39bf16gemm_fp32bf16_tn_80x64_splitk_cleanE,0.0224,43.41,731.27
256,64,1024,4096,False,torch.bfloat16,torch.bfloat16,False,False,asm,5,10,12.4924,_ZN5aiter39bf16gemm_fp32bf16_tn_64x64_splitk_cleanE,0.0228,42.98,723.96
256,64,1024,4096,False,torch.bfloat16,torch.bfloat16,False,False,asm,8,10,12.5369,_ZN5aiter39bf16gemm_fp32bf16_tn_96x64_splitk_cleanE,0.0223,42.82,721.39
256,64,1024,4096,False,torch.bfloat16,torch.bfloat16,False,False,asm,8,4,12.6079,_ZN5aiter39bf16gemm_fp32bf16_tn_96x64_splitk_cleanE,0.0121,42.58,717.33
256,64,1024,4096,False,torch.bfloat16,torch.bfloat16,False,False,asm,3,3,12.6759,_ZN5aiter39bf16gemm_fp32bf16_tn_48x64_splitk_cleanE,0.009,42.35,713.48
256,64,1024,4096,False,torch.bfloat16,torch.bfloat16,False,False,asm,7,11,13.2607,_ZN5aiter39bf16gemm_fp32bf16_tn_80x64_splitk_cleanE,0.0237,40.49,682.01
256,64,1024,4096,False,torch.bfloat16,torch.bfloat16,False,False,asm,5,3,13.3483,_ZN5aiter39bf16gemm_fp32bf16_tn_64x64_splitk_cleanE,0.0091,40.22,677.54
256,64,1024,4096,False,torch.bfloat16,torch.bfloat16,False,False,asm,8,11,13.4155,_ZN5aiter39bf16gemm_fp32bf16_tn_96x64_splitk_cleanE,0.0236,40.02,674.14
256,64,1024,4096,False,torch.bfloat16,torch.bfloat16,False,False,asm,5,11,13.4444,_ZN5aiter39bf16gemm_fp32bf16_tn_64x64_splitk_cleanE,0.0242,39.93,672.69
256,64,1024,4096,False,torch.bfloat16,torch.bfloat16,False,False,asm,7,3,13.8239,_ZN5aiter39bf16gemm_fp32bf16_tn_80x64_splitk_cleanE,0.0088,38.84,654.23
256,64,1024,4096,False,torch.bfloat16,torch.bfloat16,False,False,asm,8,12,13.9872,_ZN5aiter39bf16gemm_fp32bf16_tn_96x64_splitk_cleanE,0.0252,38.38,646.59
256,64,1024,4096,False,torch.bfloat16,torch.bfloat16,False,False,asm,7,12,13.9916,_ZN5aiter39bf16gemm_fp32bf16_tn_80x64_splitk_cleanE,0.0247,38.37,646.39
256,64,1024,4096,False,torch.bfloat16,torch.bfloat16,False,False,asm,8,3,14.1591,_ZN5aiter39bf16gemm_fp32bf16_tn_96x64_splitk_cleanE,0.0087,37.92,638.74
256,64,1024,4096,False,torch.bfloat16,torch.bfloat16,False,False,asm,5,12,14.25,_ZN5aiter39bf16gemm_fp32bf16_tn_64x64_splitk_cleanE,0.0255,37.68,634.66
256,64,1024,4096,False,torch.bfloat16,torch.bfloat16,False,False,hipblaslt,439031,0,14.6399,,0.0,36.67,617.76
256,64,1024,4096,False,torch.bfloat16,torch.bfloat16,False,False,asm,7,13,15.4823,_ZN5aiter39bf16gemm_fp32bf16_tn_80x64_splitk_cleanE,0.0256,34.68,584.15
256,64,1024,4096,False,torch.bfloat16,torch.bfloat16,False,False,asm,8,13,15.4888,_ZN5aiter39bf16gemm_fp32bf16_tn_96x64_splitk_cleanE,0.0258,34.66,583.9
256,64,1024,4096,False,torch.bfloat16,torch.bfloat16,False,False,asm,1,2,15.6235,_ZN5aiter39bf16gemm_fp32bf16_tn_32x64_splitk_cleanE,0.0053,34.36,578.87
256,64,1024,4096,False,torch.bfloat16,torch.bfloat16,False,False,asm,3,2,16.1154,_ZN5aiter39bf16gemm_fp32bf16_tn_48x64_splitk_cleanE,0.0053,33.31,561.2
256,64,1024,4096,False,torch.bfloat16,torch.bfloat16,False,False,asm,8,14,16.1639,_ZN5aiter39bf16gemm_fp32bf16_tn_96x64_splitk_cleanE,0.0271,33.21,559.52
256,64,1024,4096,False,torch.bfloat16,torch.bfloat16,False,False,asm,5,13,16.1664,_ZN5aiter39bf16gemm_fp32bf16_tn_64x64_splitk_cleanE,0.0259,33.21,559.43
256,64,1024,4096,False,torch.bfloat16,torch.bfloat16,False,False,asm,7,14,16.2278,_ZN5aiter39bf16gemm_fp32bf16_tn_80x64_splitk_cleanE,0.0269,33.08,557.31
256,64,1024,4096,False,torch.bfloat16,torch.bfloat16,False,False,asm,5,14,16.6161,_ZN5aiter39bf16gemm_fp32bf16_tn_64x64_splitk_cleanE,0.0267,32.31,544.29
256,64,1024,4096,False,torch.bfloat16,torch.bfloat16,False,False,asm,8,15,16.6601,_ZN5aiter39bf16gemm_fp32bf16_tn_96x64_splitk_cleanE,0.027,32.22,542.85
256,64,1024,4096,False,torch.bfloat16,torch.bfloat16,False,False,asm,5,2,16.8552,_ZN5aiter39bf16gemm_fp32bf16_tn_64x64_splitk_cleanE,0.0053,31.85,536.57
256,64,1024,4096,False,torch.bfloat16,torch.bfloat16,False,False,asm,7,15,17.1319,_ZN5aiter39bf16gemm_fp32bf16_tn_80x64_splitk_cleanE,0.0276,31.34,527.9
256,64,1024,4096,False,torch.bfloat16,torch.bfloat16,False,False,asm,7,16,17.2309,_ZN5aiter39bf16gemm_fp32bf16_tn_80x64_splitk_cleanE,0.0282,31.16,524.87
256,64,1024,4096,False,torch.bfloat16,torch.bfloat16,False,False,asm,8,16,17.5147,_ZN5aiter39bf16gemm_fp32bf16_tn_96x64_splitk_cleanE,0.0279,30.65,516.36
256,64,1024,4096,False,torch.bfloat16,torch.bfloat16,False,False,asm,7,2,17.5551,_ZN5aiter39bf16gemm_fp32bf16_tn_80x64_splitk_cleanE,0.0053,30.58,515.18
256,64,1024,4096,False,torch.bfloat16,torch.bfloat16,False,False,asm,5,15,17.5615,_ZN5aiter39bf16gemm_fp32bf16_tn_64x64_splitk_cleanE,0.028,30.57,514.99
256,64,1024,4096,False,torch.bfloat16,torch.bfloat16,False,False,asm,5,16,17.7114,_ZN5aiter39bf16gemm_fp32bf16_tn_64x64_splitk_cleanE,0.0278,30.31,510.63
256,64,1024,4096,False,torch.bfloat16,torch.bfloat16,False,False,asm,8,2,18.0185,_ZN5aiter39bf16gemm_fp32bf16_tn_96x64_splitk_cleanE,0.0053,29.8,501.93
256,64,1024,4096,False,torch.bfloat16,torch.bfloat16,False,False,hipblaslt,440187,0,20.0348,,0.0,26.8,451.41
256,64,1024,4096,False,torch.bfloat16,torch.bfloat16,False,False,asm,2,1,24.402,_ZN5aiter37bf16gemm_fp32bf16_tn_32x64_pf3_splitkE,0.0,22.0,370.62
256,64,1024,4096,False,torch.bfloat16,torch.bfloat16,False,False,asm,4,1,25.1042,_ZN5aiter37bf16gemm_fp32bf16_tn_48x64_pf3_splitkE,0.0,21.39,360.26
256,64,1024,4096,False,torch.bfloat16,torch.bfloat16,False,False,asm,6,1,26.4493,_ZN5aiter37bf16gemm_fp32bf16_tn_64x64_pf3_splitkE,0.0,20.3,341.94
256,64,1024,4096,False,torch.bfloat16,torch.bfloat16,False,False,asm,9,1,27.7315,_ZN5aiter37bf16gemm_fp32bf16_tn_96x64_pf3_splitkE,0.0,19.36,326.13
256,64,1024,4096,False,torch.bfloat16,torch.bfloat16,False,False,asm,10,1,68.93,_ZN5aiter24bf16gemm_bf16_tn_256x256E,0.0,7.79,131.21
256,128,1024,4096,False,torch.bfloat16,torch.bfloat16,False,False,hipblaslt,439308,0,10.2766,,0.0,104.48,943.83
256,128,1024,4096,False,torch.bfloat16,torch.bfloat16,False,False,hipblaslt,439686,0,10.7126,,0.0,100.23,905.41
256,128,1024,4096,False,torch.bfloat16,torch.bfloat16,False,False,hipblaslt,439065,0,10.9754,,0.0,97.83,883.73
256,128,1024,4096,False,torch.bfloat16,torch.bfloat16,False,False,hipblaslt,440200,0,11.0307,,0.0,97.34,879.3
256,128,1024,4096,False,torch.bfloat16,torch.bfloat16,False,False,hipblaslt,440198,0,11.0725,,0.0,96.97,875.98
256,128,1024,4096,False,torch.bfloat16,torch.bfloat16,False,False,asm,3,5,11.2831,_ZN5aiter39bf16gemm_fp32bf16_tn_48x64_splitk_cleanE,0.0141,95.16,859.63
256,128,1024,4096,False,torch.bfloat16,torch.bfloat16,False,False,asm,5,5,11.4233,_ZN5aiter39bf16gemm_fp32bf16_tn_64x64_splitk_cleanE,0.0144,94.0,849.08
256,128,1024,4096,False,torch.bfloat16,torch.bfloat16,False,False,asm,1,4,11.4542,_ZN5aiter39bf16gemm_fp32bf16_tn_32x64_splitk_cleanE,0.0113,93.74,846.79
256,128,1024,4096,False,torch.bfloat16,torch.bfloat16,False,False,hipblaslt,439690,0,11.4891,,0.0,93.46,844.22
256,128,1024,4096,False,torch.bfloat16,torch.bfloat16,False,False,asm,5,6,11.5815,_ZN5aiter39bf16gemm_fp32bf16_tn_64x64_splitk_cleanE,0.0161,92.71,837.48
256,128,1024,4096,False,torch.bfloat16,torch.bfloat16,False,False,hipblaslt,438755,0,11.6432,,0.0,92.22,833.05
256,128,1024,4096,False,torch.bfloat16,torch.bfloat16,False,False,hipblaslt,439941,0,11.6987,,0.0,91.78,829.09
256,128,1024,4096,False,torch.bfloat16,torch.bfloat16,False,False,asm,7,5,11.7138,_ZN5aiter39bf16gemm_fp32bf16_tn_80x64_splitk_cleanE,0.014,91.66,828.03
256,128,1024,4096,False,torch.bfloat16,torch.bfloat16,False,False,asm,7,6,11.7456,_ZN5aiter39bf16gemm_fp32bf16_tn_80x64_splitk_cleanE,0.0157,91.42,825.78
256,128,1024,4096,False,torch.bfloat16,torch.bfloat16,False,False,asm,3,4,11.7562,_ZN5aiter39bf16gemm_fp32bf16_tn_48x64_splitk_cleanE,0.0115,91.33,825.04
256,128,1024,4096,False,torch.bfloat16,torch.bfloat16,False,False,hipblaslt,440204,0,11.7624,,0.0,91.29,824.6
256,128,1024,4096,False,torch.bfloat16,torch.bfloat16,False,False,hipblaslt,438619,0,11.875,,0.0,90.42,816.79
256,128,1024,4096,False,torch.bfloat16,torch.bfloat16,False,False,asm,8,5,11.8871,_ZN5aiter39bf16gemm_fp32bf16_tn_96x64_splitk_cleanE,0.0141,90.33,815.95
256,128,1024,4096,False,torch.bfloat16,torch.bfloat16,False,False,asm,8,6,11.9339,_ZN5aiter39bf16gemm_fp32bf16_tn_96x64_splitk_cleanE,0.0158,89.97,812.75
256,128,1024,4096,False,torch.bfloat16,torch.bfloat16,False,False,hipblaslt,439681,0,11.9681,,0.0,89.72,810.43
256,128,1024,4096,False,torch.bfloat16,torch.bfloat16,False,False,asm,5,7,11.9723,_ZN5aiter39bf16gemm_fp32bf16_tn_64x64_splitk_cleanE,0.0171,89.69,810.15
256,128,1024,4096,False,torch.bfloat16,torch.bfloat16,False,False,asm,7,7,12.0905,_ZN5aiter39bf16gemm_fp32bf16_tn_80x64_splitk_cleanE,0.0172,88.81,802.23
256,128,1024,4096,False,torch.bfloat16,torch.bfloat16,False,False,hipblaslt,440203,0,12.1232,,0.0,88.57,800.06
256,128,1024,4096,False,torch.bfloat16,torch.bfloat16,False,False,asm,5,4,12.1415,_ZN5aiter39bf16gemm_fp32bf16_tn_64x64_splitk_cleanE,0.0115,88.44,798.86
256,128,1024,4096,False,torch.bfloat16,torch.bfloat16,False,False,asm,8,7,12.2766,_ZN5aiter39bf16gemm_fp32bf16_tn_96x64_splitk_cleanE,0.0174,87.46,790.07
256,128,1024,4096,False,torch.bfloat16,torch.bfloat16,False,False,asm,7,4,12.3381,_ZN5aiter39bf16gemm_fp32bf16_tn_80x64_splitk_cleanE,0.0113,87.03,786.13
256,128,1024,4096,False,torch.bfloat16,torch.bfloat16,False,False,asm,5,8,12.3855,_ZN5aiter39bf16gemm_fp32bf16_tn_64x64_splitk_cleanE,0.0185,86.69,783.12
256,128,1024,4096,False,torch.bfloat16,torch.bfloat16,False,False,asm,1,3,12.4279,_ZN5aiter39bf16gemm_fp32bf16_tn_32x64_splitk_cleanE,0.0088,86.4,780.45
256,128,1024,4096,False,torch.bfloat16,torch.bfloat16,False,False,hipblaslt,438411,0,12.4341,,0.0,86.35,780.06
256,128,1024,4096,False,torch.bfloat16,torch.bfloat16,False,False,asm,7,8,12.4991,_ZN5aiter39bf16gemm_fp32bf16_tn_80x64_splitk_cleanE,0.0188,85.91,776.0
256,128,1024,4096,False,torch.bfloat16,torch.bfloat16,False,False,hipblaslt,438938,0,12.6195,,0.0,85.09,768.6
256,128,1024,4096,False,torch.bfloat16,torch.bfloat16,False,False,asm,8,4,12.6959,_ZN5aiter39bf16gemm_fp32bf16_tn_96x64_splitk_cleanE,0.0114,84.57,763.97
256,128,1024,4096,False,torch.bfloat16,torch.bfloat16,False,False,asm,8,8,12.7459,_ZN5aiter39bf16gemm_fp32bf16_tn_96x64_splitk_cleanE,0.0184,84.24,760.98
256,128,1024,4096,False,torch.bfloat16,torch.bfloat16,False,False,asm,3,3,12.871,_ZN5aiter39bf16gemm_fp32bf16_tn_48x64_splitk_cleanE,0.0088,83.42,753.58
256,128,1024,4096,False,torch.bfloat16,torch.bfloat16,False,False,hipblaslt,440195,0,13.3158,,0.0,80.64,728.41
256,128,1024,4096,False,torch.bfloat16,torch.bfloat16,False,False,asm,5,3,13.3535,_ZN5aiter39bf16gemm_fp32bf16_tn_64x64_splitk_cleanE,0.0088,80.41,726.35
256,128,1024,4096,False,torch.bfloat16,torch.bfloat16,False,False,hipblaslt,440208,0,13.6881,,0.0,78.44,708.6
256,128,1024,4096,False,torch.bfloat16,torch.bfloat16,False,False,asm,7,3,13.7867,_ZN5aiter39bf16gemm_fp32bf16_tn_80x64_splitk_cleanE,0.0088,77.88,703.53
256,128,1024,4096,False,torch.bfloat16,torch.bfloat16,False,False,asm,8,3,14.0623,_ZN5aiter39bf16gemm_fp32bf16_tn_96x64_splitk_cleanE,0.0087,76.36,689.74
256,128,1024,4096,False,torch.bfloat16,torch.bfloat16,False,False,hipblaslt,439331,0,14.0995,,0.0,76.15,687.92
256,128,1024,4096,False,torch.bfloat16,torch.bfloat16,False,False,hipblaslt,440221,0,14.4597,,0.0,74.26,670.78
256,128,1024,4096,False,torch.bfloat16,torch.bfloat16,False,False,hipblaslt,439031,0,14.493,,0.0,74.09,669.24
256,128,1024,4096,False,torch.bfloat16,torch.bfloat16,False,False,asm,1,2,15.5962,_ZN5aiter39bf16gemm_fp32bf16_tn_32x64_splitk_cleanE,0.005,68.85,621.9
256,128,1024,4096,False,torch.bfloat16,torch.bfloat16,False,False,asm,3,2,16.3563,_ZN5aiter39bf16gemm_fp32bf16_tn_48x64_splitk_cleanE,0.005,65.65,593.0
256,128,1024,4096,False,torch.bfloat16,torch.bfloat16,False,False,asm,5,2,16.6554,_ZN5aiter39bf16gemm_fp32bf16_tn_64x64_splitk_cleanE,0.005,64.47,582.35
256,128,1024,4096,False,torch.bfloat16,torch.bfloat16,False,False,asm,7,2,17.3421,_ZN5aiter39bf16gemm_fp32bf16_tn_80x64_splitk_cleanE,0.005,61.92,559.29
256,128,1024,4096,False,torch.bfloat16,torch.bfloat16,False,False,asm,8,2,17.7535,_ZN5aiter39bf16gemm_fp32bf16_tn_96x64_splitk_cleanE,0.005,60.48,546.33
256,128,1024,4096,False,torch.bfloat16,torch.bfloat16,False,False,asm,2,1,24.2073,_ZN5aiter37bf16gemm_fp32bf16_tn_32x64_pf3_splitkE,0.0,44.36,400.68
256,128,1024,4096,False,torch.bfloat16,torch.bfloat16,False,False,hipblaslt,440215,0,24.7559,,0.0,43.37,391.8
256,128,1024,4096,False,torch.bfloat16,torch.bfloat16,False,False,asm,4,1,25.0311,_ZN5aiter37bf16gemm_fp32bf16_tn_48x64_pf3_splitkE,0.0,42.9,387.49
256,128,1024,4096,False,torch.bfloat16,torch.bfloat16,False,False,asm,6,1,26.5163,_ZN5aiter37bf16gemm_fp32bf16_tn_64x64_pf3_splitkE,0.0,40.49,365.79
256,128,1024,4096,False,torch.bfloat16,torch.bfloat16,False,False,asm,9,1,27.562,_ZN5aiter37bf16gemm_fp32bf16_tn_96x64_pf3_splitkE,0.0,38.96,351.91
256,128,1024,4096,False,torch.bfloat16,torch.bfloat16,False,False,asm,10,1,70.606,_ZN5aiter24bf16gemm_bf16_tn_256x256E,0.0,15.21,137.37
256,1024,1024,4096,False,torch.bfloat16,torch.bfloat16,False,False,hipblaslt,438489,0,21.3175,,0.0,402.95,885.39
256,1024,1024,4096,False,torch.bfloat16,torch.bfloat16,False,False,hipblaslt,439116,0,21.3891,,0.0,401.6,882.43
256,1024,1024,4096,False,torch.bfloat16,torch.bfloat16,False,False,hipblaslt,439040,0,21.4081,,0.0,401.25,881.65
256,1024,1024,4096,False,torch.bfloat16,torch.bfloat16,False,False,hipblaslt,438557,0,21.5199,,0.0,399.16,877.07
256,1024,1024,4096,False,torch.bfloat16,torch.bfloat16,False,False,hipblaslt,440181,0,21.7769,,0.0,394.45,866.72
256,1024,1024,4096,False,torch.bfloat16,torch.bfloat16,False,False,hipblaslt,438696,0,22.0146,,0.0,390.19,857.36
256,1024,1024,4096,False,torch.bfloat16,torch.bfloat16,False,False,hipblaslt,439039,0,22.055,,0.0,389.48,855.79
256,1024,1024,4096,False,torch.bfloat16,torch.bfloat16,False,False,hipblaslt,438370,0,22.2681,,0.0,385.75,847.6
256,1024,1024,4096,False,torch.bfloat16,torch.bfloat16,False,False,hipblaslt,438562,0,22.3363,,0.0,384.57,845.01
256,1024,1024,4096,False,torch.bfloat16,torch.bfloat16,False,False,hipblaslt,438177,0,22.4289,,0.0,382.99,841.52
256,1024,1024,4096,False,torch.bfloat16,torch.bfloat16,False,False,hipblaslt,438369,0,22.6141,,0.0,379.85,834.63
256,1024,1024,4096,False,torch.bfloat16,torch.bfloat16,False,False,hipblaslt,438763,0,22.6563,,0.0,379.14,833.07
256,1024,1024,4096,False,torch.bfloat16,torch.bfloat16,False,False,hipblaslt,440164,0,23.2187,,0.0,369.96,812.9
256,1024,1024,4096,False,torch.bfloat16,torch.bfloat16,False,False,hipblaslt,438417,0,23.2816,,0.0,368.96,810.7
256,1024,1024,4096,False,torch.bfloat16,torch.bfloat16,False,False,hipblaslt,438368,0,23.7306,,0.0,361.98,795.36
256,1024,1024,4096,False,torch.bfloat16,torch.bfloat16,False,False,hipblaslt,438488,0,24.4563,,0.0,351.24,771.76
256,1024,1024,4096,False,torch.bfloat16,torch.bfloat16,False,False,hipblaslt,438825,0,24.51,,0.0,350.47,770.07
256,1024,1024,4096,False,torch.bfloat16,torch.bfloat16,False,False,hipblaslt,438893,0,24.5102,,0.0,350.46,770.06
256,1024,1024,4096,False,torch.bfloat16,torch.bfloat16,False,False,hipblaslt,438894,0,24.7828,,0.0,346.61,761.59
256,1024,1024,4096,False,torch.bfloat16,torch.bfloat16,False,False,hipblaslt,438824,0,24.8204,,0.0,346.08,760.44
256,1024,1024,4096,False,torch.bfloat16,torch.bfloat16,False,False,asm,6,1,28.0064,_ZN5aiter37bf16gemm_fp32bf16_tn_64x64_pf3_splitkE,0.0,306.71,673.93
256,1024,1024,4096,False,torch.bfloat16,torch.bfloat16,False,False,asm,9,1,28.9962,_ZN5aiter37bf16gemm_fp32bf16_tn_96x64_pf3_splitkE,0.0,296.24,650.93
256,1024,1024,4096,False,torch.bfloat16,torch.bfloat16,False,False,asm,5,2,32.6999,_ZN5aiter39bf16gemm_fp32bf16_tn_64x64_splitk_cleanE,0.0049,262.69,577.2
256,1024,1024,4096,False,torch.bfloat16,torch.bfloat16,False,False,asm,5,3,35.0452,_ZN5aiter39bf16gemm_fp32bf16_tn_64x64_splitk_cleanE,0.0089,245.11,538.57
256,1024,1024,4096,False,torch.bfloat16,torch.bfloat16,False,False,asm,5,4,38.0326,_ZN5aiter39bf16gemm_fp32bf16_tn_64x64_splitk_cleanE,0.0118,225.86,496.27
256,1024,1024,4096,False,torch.bfloat16,torch.bfloat16,False,False,asm,3,2,41.5451,_ZN5aiter39bf16gemm_fp32bf16_tn_48x64_splitk_cleanE,0.0049,206.76,454.31
256,1024,1024,4096,False,torch.bfloat16,torch.bfloat16,False,False,asm,2,1,43.9357,_ZN5aiter37bf16gemm_fp32bf16_tn_32x64_pf3_splitkE,0.0,195.51,429.59
256,1024,1024,4096,False,torch.bfloat16,torch.bfloat16,False,False,asm,4,1,46.7094,_ZN5aiter37bf16gemm_fp32bf16_tn_48x64_pf3_splitkE,0.0,183.9,404.08
256,1024,1024,4096,False,torch.bfloat16,torch.bfloat16,False,False,asm,3,4,47.3856,_ZN5aiter39bf16gemm_fp32bf16_tn_48x64_splitk_cleanE,0.0118,181.28,398.31
256,1024,1024,4096,False,torch.bfloat16,torch.bfloat16,False,False,asm,3,3,48.0145,_ZN5aiter39bf16gemm_fp32bf16_tn_48x64_splitk_cleanE,0.0089,178.9,393.1
256,1024,1024,4096,False,torch.bfloat16,torch.bfloat16,False,False,asm,1,2,50.5536,_ZN5aiter39bf16gemm_fp32bf16_tn_32x64_splitk_cleanE,0.0049,169.92,373.35
256,1024,1024,4096,False,torch.bfloat16,torch.bfloat16,False,False,asm,1,3,54.6225,_ZN5aiter39bf16gemm_fp32bf16_tn_32x64_splitk_cleanE,0.0089,157.26,345.54
256,1024,1024,4096,False,torch.bfloat16,torch.bfloat16,False,False,asm,1,4,58.4447,_ZN5aiter39bf16gemm_fp32bf16_tn_32x64_splitk_cleanE,0.0118,146.98,322.94
256,1024,1024,4096,False,torch.bfloat16,torch.bfloat16,False,False,asm,10,1,75.3926,_ZN5aiter24bf16gemm_bf16_tn_256x256E,0.0,113.94,250.35
256,4096,1024,4096,False,torch.bfloat16,torch.bfloat16,False,False,asm,3,2,-1.0,_ZN5aiter39bf16gemm_fp32bf16_tn_48x64_splitk_cleanE,1.0,-1.0,-1.0
256,4096,1024,4096,False,torch.bfloat16,torch.bfloat16,False,False,asm,1,2,-1.0,_ZN5aiter39bf16gemm_fp32bf16_tn_32x64_splitk_cleanE,1.0,-1.0,-1.0
256,4096,1024,4096,False,torch.bfloat16,torch.bfloat16,False,False,asm,3,4,-1.0,_ZN5aiter39bf16gemm_fp32bf16_tn_48x64_splitk_cleanE,1.0,-1.0,-1.0
256,4096,1024,4096,False,torch.bfloat16,torch.bfloat16,False,False,asm,3,3,-1.0,_ZN5aiter39bf16gemm_fp32bf16_tn_48x64_splitk_cleanE,1.0,-1.0,-1.0
256,4096,1024,4096,False,torch.bfloat16,torch.bfloat16,False,False,asm,1,4,-1.0,_ZN5aiter39bf16gemm_fp32bf16_tn_32x64_splitk_cleanE,1.0,-1.0,-1.0
256,4096,1024,4096,False,torch.bfloat16,torch.bfloat16,False,False,asm,1,3,-1.0,_ZN5aiter39bf16gemm_fp32bf16_tn_32x64_splitk_cleanE,1.0,-1.0,-1.0
256,4096,1024,4096,False,torch.bfloat16,torch.bfloat16,False,False,hipblaslt,439128,0,39.6444,,0.0,866.7,1269.58
256,4096,1024,4096,False,torch.bfloat16,torch.bfloat16,False,False,hipblaslt,439457,0,40.1739,,0.0,855.28,1252.84
256,4096,1024,4096,False,torch.bfloat16,torch.bfloat16,False,False,hipblaslt,438976,0,40.6548,,0.0,845.16,1238.02
256,4096,1024,4096,False,torch.bfloat16,torch.bfloat16,False,False,hipblaslt,438631,0,41.0939,,0.0,836.13,1224.8
256,4096,1024,4096,False,torch.bfloat16,torch.bfloat16,False,False,hipblaslt,439454,0,41.1626,,0.0,834.73,1222.75
256,4096,1024,4096,False,torch.bfloat16,torch.bfloat16,False,False,hipblaslt,439455,0,41.2523,,0.0,832.92,1220.09
256,4096,1024,4096,False,torch.bfloat16,torch.bfloat16,False,False,hipblaslt,439447,0,42.2417,,0.0,813.41,1191.52
256,4096,1024,4096,False,torch.bfloat16,torch.bfloat16,False,False,hipblaslt,440149,0,43.1815,,0.0,795.71,1165.58
256,4096,1024,4096,False,torch.bfloat16,torch.bfloat16,False,False,hipblaslt,439127,0,43.854,,0.0,783.5,1147.71
256,4096,1024,4096,False,torch.bfloat16,torch.bfloat16,False,False,hipblaslt,438784,0,44.4882,,0.0,772.33,1131.35
256,4096,1024,4096,False,torch.bfloat16,torch.bfloat16,False,False,hipblaslt,438885,0,44.7993,,0.0,766.97,1123.49
256,4096,1024,4096,False,torch.bfloat16,torch.bfloat16,False,False,hipblaslt,438686,0,45.1093,,0.0,761.7,1115.77
256,4096,1024,4096,False,torch.bfloat16,torch.bfloat16,False,False,hipblaslt,438785,0,45.2037,,0.0,760.11,1113.44
256,4096,1024,4096,False,torch.bfloat16,torch.bfloat16,False,False,hipblaslt,438648,0,45.5655,,0.0,754.07,1104.6
256,4096,1024,4096,False,torch.bfloat16,torch.bfloat16,False,False,hipblaslt,438616,0,45.9984,,0.0,746.98,1094.2
256,4096,1024,4096,False,torch.bfloat16,torch.bfloat16,False,False,hipblaslt,439107,0,46.0615,,0.0,745.95,1092.71
256,4096,1024,4096,False,torch.bfloat16,torch.bfloat16,False,False,hipblaslt,439116,0,46.3813,,0.0,740.81,1085.17
256,4096,1024,4096,False,torch.bfloat16,torch.bfloat16,False,False,hipblaslt,438341,0,46.4962,,0.0,738.98,1082.49
256,4096,1024,4096,False,torch.bfloat16,torch.bfloat16,False,False,hipblaslt,438440,0,47.1269,,0.0,729.09,1068.0
256,4096,1024,4096,False,torch.bfloat16,torch.bfloat16,False,False,hipblaslt,438307,0,47.5702,,0.0,722.3,1058.05
256,4096,1024,4096,False,torch.bfloat16,torch.bfloat16,False,False,asm,10,1,77.2841,_ZN5aiter24bf16gemm_bf16_tn_256x256E,0.0,444.59,651.25
256,4096,1024,4096,False,torch.bfloat16,torch.bfloat16,False,False,asm,9,1,83.0546,_ZN5aiter37bf16gemm_fp32bf16_tn_96x64_pf3_splitkE,0.0,413.7,606.01
256,4096,1024,4096,False,torch.bfloat16,torch.bfloat16,False,False,asm,6,1,98.6811,_ZN5aiter37bf16gemm_fp32bf16_tn_64x64_pf3_splitkE,0.0,348.19,510.04
256,4096,1024,4096,False,torch.bfloat16,torch.bfloat16,False,False,asm,8,2,98.7563,_ZN5aiter39bf16gemm_fp32bf16_tn_96x64_splitk_cleanE,0.0049,347.92,509.66
256,4096,1024,4096,False,torch.bfloat16,torch.bfloat16,False,False,asm,8,3,107.1822,_ZN5aiter39bf16gemm_fp32bf16_tn_96x64_splitk_cleanE,0.0088,320.57,469.59
256,4096,1024,4096,False,torch.bfloat16,torch.bfloat16,False,False,asm,7,2,107.7588,_ZN5aiter39bf16gemm_fp32bf16_tn_80x64_splitk_cleanE,0.0049,318.86,467.08
256,4096,1024,4096,False,torch.bfloat16,torch.bfloat16,False,False,asm,8,4,108.8183,_ZN5aiter39bf16gemm_fp32bf16_tn_96x64_splitk_cleanE,0.0118,315.75,462.53
256,4096,1024,4096,False,torch.bfloat16,torch.bfloat16,False,False,asm,7,3,111.9311,_ZN5aiter39bf16gemm_fp32bf16_tn_80x64_splitk_cleanE,0.0088,306.97,449.67
256,4096,1024,4096,False,torch.bfloat16,torch.bfloat16,False,False,asm,5,2,114.7415,_ZN5aiter39bf16gemm_fp32bf16_tn_64x64_splitk_cleanE,0.0049,299.45,438.65
256,4096,1024,4096,False,torch.bfloat16,torch.bfloat16,False,False,asm,7,4,118.3656,_ZN5aiter39bf16gemm_fp32bf16_tn_80x64_splitk_cleanE,0.0118,290.28,425.22
256,4096,1024,4096,False,torch.bfloat16,torch.bfloat16,False,False,asm,5,3,122.9299,_ZN5aiter39bf16gemm_fp32bf16_tn_64x64_splitk_cleanE,0.0088,279.51,409.43
256,4096,1024,4096,False,torch.bfloat16,torch.bfloat16,False,False,asm,5,4,132.7704,_ZN5aiter39bf16gemm_fp32bf16_tn_64x64_splitk_cleanE,0.0118,258.79,379.09
256,4096,1024,4096,False,torch.bfloat16,torch.bfloat16,False,False,asm,4,1,133.6235,_ZN5aiter37bf16gemm_fp32bf16_tn_48x64_pf3_splitkE,0.0,257.14,376.67
256,4096,1024,4096,False,torch.bfloat16,torch.bfloat16,False,False,asm,2,1,161.0394,_ZN5aiter37bf16gemm_fp32bf16_tn_32x64_pf3_splitkE,0.0,213.36,312.54
256,8192,1024,4096,False,torch.bfloat16,torch.bfloat16,False,False,asm,3,2,-1.0,_ZN5aiter39bf16gemm_fp32bf16_tn_48x64_splitk_cleanE,1.0,-1.0,-1.0
256,8192,1024,4096,False,torch.bfloat16,torch.bfloat16,False,False,asm,3,3,-1.0,_ZN5aiter39bf16gemm_fp32bf16_tn_48x64_splitk_cleanE,1.0,-1.0,-1.0
256,8192,1024,4096,False,torch.bfloat16,torch.bfloat16,False,False,asm,3,4,-1.0,_ZN5aiter39bf16gemm_fp32bf16_tn_48x64_splitk_cleanE,1.0,-1.0,-1.0
256,8192,1024,4096,False,torch.bfloat16,torch.bfloat16,False,False,asm,5,2,-1.0,_ZN5aiter39bf16gemm_fp32bf16_tn_64x64_splitk_cleanE,1.0,-1.0,-1.0
256,8192,1024,4096,False,torch.bfloat16,torch.bfloat16,False,False,asm,5,4,-1.0,_ZN5aiter39bf16gemm_fp32bf16_tn_64x64_splitk_cleanE,1.0,-1.0,-1.0
256,8192,1024,4096,False,torch.bfloat16,torch.bfloat16,False,False,asm,1,2,-1.0,_ZN5aiter39bf16gemm_fp32bf16_tn_32x64_splitk_cleanE,1.0,-1.0,-1.0
256,8192,1024,4096,False,torch.bfloat16,torch.bfloat16,False,False,asm,1,4,-1.0,_ZN5aiter39bf16gemm_fp32bf16_tn_32x64_splitk_cleanE,1.0,-1.0,-1.0
256,8192,1024,4096,False,torch.bfloat16,torch.bfloat16,False,False,asm,5,3,-1.0,_ZN5aiter39bf16gemm_fp32bf16_tn_64x64_splitk_cleanE,1.0,-1.0,-1.0
256,8192,1024,4096,False,torch.bfloat16,torch.bfloat16,False,False,asm,1,3,-1.0,_ZN5aiter39bf16gemm_fp32bf16_tn_32x64_splitk_cleanE,1.0,-1.0,-1.0
256,8192,1024,4096,False,torch.bfloat16,torch.bfloat16,False,False,asm,7,4,-1.0,_ZN5aiter39bf16gemm_fp32bf16_tn_80x64_splitk_cleanE,1.0,-1.0,-1.0
256,8192,1024,4096,False,torch.bfloat16,torch.bfloat16,False,False,asm,8,4,-1.0,_ZN5aiter39bf16gemm_fp32bf16_tn_96x64_splitk_cleanE,1.0,-1.0,-1.0
256,8192,1024,4096,False,torch.bfloat16,torch.bfloat16,False,False,asm,8,3,-1.0,_ZN5aiter39bf16gemm_fp32bf16_tn_96x64_splitk_cleanE,1.0,-1.0,-1.0
256,8192,1024,4096,False,torch.bfloat16,torch.bfloat16,False,False,asm,8,2,-1.0,_ZN5aiter39bf16gemm_fp32bf16_tn_96x64_splitk_cleanE,1.0,-1.0,-1.0
256,8192,1024,4096,False,torch.bfloat16,torch.bfloat16,False,False,asm,7,2,-1.0,_ZN5aiter39bf16gemm_fp32bf16_tn_80x64_splitk_cleanE,1.0,-1.0,-1.0
256,8192,1024,4096,False,torch.bfloat16,torch.bfloat16,False,False,asm,7,3,-1.0,_ZN5aiter39bf16gemm_fp32bf16_tn_80x64_splitk_cleanE,1.0,-1.0,-1.0
256,8192,1024,4096,False,torch.bfloat16,torch.bfloat16,False,False,hipblaslt,439191,0,62.1847,,0.0,1105.09,1483.88
256,8192,1024,4096,False,torch.bfloat16,torch.bfloat16,False,False,hipblaslt,438981,0,63.4239,,0.0,1083.49,1454.89
256,8192,1024,4096,False,torch.bfloat16,torch.bfloat16,False,False,hipblaslt,439188,0,63.9716,,0.0,1074.22,1442.43
256,8192,1024,4096,False,torch.bfloat16,torch.bfloat16,False,False,hipblaslt,440090,0,64.3255,,0.0,1068.31,1434.5
256,8192,1024,4096,False,torch.bfloat16,torch.bfloat16,False,False,hipblaslt,439151,0,64.899,,0.0,1058.87,1421.82
256,8192,1024,4096,False,torch.bfloat16,torch.bfloat16,False,False,hipblaslt,439145,0,65.5161,,0.0,1048.89,1408.43
256,8192,1024,4096,False,torch.bfloat16,torch.bfloat16,False,False,hipblaslt,438980,0,65.859,,0.0,1043.43,1401.09
256,8192,1024,4096,False,torch.bfloat16,torch.bfloat16,False,False,hipblaslt,438362,0,66.001,,0.0,1041.19,1398.08
256,8192,1024,4096,False,torch.bfloat16,torch.bfloat16,False,False,hipblaslt,439143,0,66.1684,,0.0,1038.55,1394.54
256,8192,1024,4096,False,torch.bfloat16,torch.bfloat16,False,False,hipblaslt,439153,0,66.65,,0.0,1031.05,1384.47
256,8192,1024,4096,False,torch.bfloat16,torch.bfloat16,False,False,hipblaslt,439152,0,66.6557,,0.0,1030.96,1384.35
256,8192,1024,4096,False,torch.bfloat16,torch.bfloat16,False,False,hipblaslt,439144,0,66.8827,,0.0,1027.46,1379.65
256,8192,1024,4096,False,torch.bfloat16,torch.bfloat16,False,False,hipblaslt,440062,0,67.0524,,0.0,1024.86,1376.16
256,8192,1024,4096,False,torch.bfloat16,torch.bfloat16,False,False,hipblaslt,439150,0,67.1063,,0.0,1024.04,1375.05
256,8192,1024,4096,False,torch.bfloat16,torch.bfloat16,False,False,hipblaslt,439130,0,67.112,,0.0,1023.95,1374.94
256,8192,1024,4096,False,torch.bfloat16,torch.bfloat16,False,False,hipblaslt,438281,0,67.1561,,0.0,1023.28,1374.03
256,8192,1024,4096,False,torch.bfloat16,torch.bfloat16,False,False,hipblaslt,439190,0,67.1912,,0.0,1022.75,1373.32
256,8192,1024,4096,False,torch.bfloat16,torch.bfloat16,False,False,hipblaslt,438982,0,68.3994,,0.0,1004.68,1349.06
256,8192,1024,4096,False,torch.bfloat16,torch.bfloat16,False,False,hipblaslt,438230,0,68.5202,,0.0,1002.91,1346.68
256,8192,1024,4096,False,torch.bfloat16,torch.bfloat16,False,False,hipblaslt,439189,0,71.1953,,0.0,965.22,1296.08
256,8192,1024,4096,False,torch.bfloat16,torch.bfloat16,False,False,asm,10,1,86.1241,_ZN5aiter24bf16gemm_bf16_tn_256x256E,0.0,797.91,1071.42
256,8192,1024,4096,False,torch.bfloat16,torch.bfloat16,False,False,asm,9,1,162.1882,_ZN5aiter37bf16gemm_fp32bf16_tn_96x64_pf3_splitkE,0.0,423.7,568.94
256,8192,1024,4096,False,torch.bfloat16,torch.bfloat16,False,False,asm,6,1,189.8496,_ZN5aiter37bf16gemm_fp32bf16_tn_64x64_pf3_splitkE,0.0,361.97,486.04
256,8192,1024,4096,False,torch.bfloat16,torch.bfloat16,False,False,asm,4,1,242.0327,_ZN5aiter37bf16gemm_fp32bf16_tn_48x64_pf3_splitkE,0.0,283.93,381.25
256,8192,1024,4096,False,torch.bfloat16,torch.bfloat16,False,False,asm,2,1,320.8663,_ZN5aiter37bf16gemm_fp32bf16_tn_32x64_pf3_splitkE,0.0,214.17,287.58
256,16384,1024,4096,False,torch.bfloat16,torch.bfloat16,False,False,asm,3,2,-1.0,_ZN5aiter39bf16gemm_fp32bf16_tn_48x64_splitk_cleanE,1.0,-1.0,-1.0
256,16384,1024,4096,False,torch.bfloat16,torch.bfloat16,False,False,asm,3,3,-1.0,_ZN5aiter39bf16gemm_fp32bf16_tn_48x64_splitk_cleanE,1.0,-1.0,-1.0
256,16384,1024,4096,False,torch.bfloat16,torch.bfloat16,False,False,asm,3,4,-1.0,_ZN5aiter39bf16gemm_fp32bf16_tn_48x64_splitk_cleanE,1.0,-1.0,-1.0
256,16384,1024,4096,False,torch.bfloat16,torch.bfloat16,False,False,asm,5,2,-1.0,_ZN5aiter39bf16gemm_fp32bf16_tn_64x64_splitk_cleanE,1.0,-1.0,-1.0
256,16384,1024,4096,False,torch.bfloat16,torch.bfloat16,False,False,asm,5,4,-1.0,_ZN5aiter39bf16gemm_fp32bf16_tn_64x64_splitk_cleanE,1.0,-1.0,-1.0
256,16384,1024,4096,False,torch.bfloat16,torch.bfloat16,False,False,asm,1,2,-1.0,_ZN5aiter39bf16gemm_fp32bf16_tn_32x64_splitk_cleanE,1.0,-1.0,-1.0
256,16384,1024,4096,False,torch.bfloat16,torch.bfloat16,False,False,asm,1,4,-1.0,_ZN5aiter39bf16gemm_fp32bf16_tn_32x64_splitk_cleanE,1.0,-1.0,-1.0
256,16384,1024,4096,False,torch.bfloat16,torch.bfloat16,False,False,asm,5,3,-1.0,_ZN5aiter39bf16gemm_fp32bf16_tn_64x64_splitk_cleanE,1.0,-1.0,-1.0
256,16384,1024,4096,False,torch.bfloat16,torch.bfloat16,False,False,asm,1,3,-1.0,_ZN5aiter39bf16gemm_fp32bf16_tn_32x64_splitk_cleanE,1.0,-1.0,-1.0
256,16384,1024,4096,False,torch.bfloat16,torch.bfloat16,False,False,asm,7,4,-1.0,_ZN5aiter39bf16gemm_fp32bf16_tn_80x64_splitk_cleanE,1.0,-1.0,-1.0
256,16384,1024,4096,False,torch.bfloat16,torch.bfloat16,False,False,asm,8,4,-1.0,_ZN5aiter39bf16gemm_fp32bf16_tn_96x64_splitk_cleanE,1.0,-1.0,-1.0
256,16384,1024,4096,False,torch.bfloat16,torch.bfloat16,False,False,asm,8,3,-1.0,_ZN5aiter39bf16gemm_fp32bf16_tn_96x64_splitk_cleanE,1.0,-1.0,-1.0
256,16384,1024,4096,False,torch.bfloat16,torch.bfloat16,False,False,asm,8,2,-1.0,_ZN5aiter39bf16gemm_fp32bf16_tn_96x64_splitk_cleanE,1.0,-1.0,-1.0
256,16384,1024,4096,False,torch.bfloat16,torch.bfloat16,False,False,asm,7,2,-1.0,_ZN5aiter39bf16gemm_fp32bf16_tn_80x64_splitk_cleanE,1.0,-1.0,-1.0
256,16384,1024,4096,False,torch.bfloat16,torch.bfloat16,False,False,asm,7,3,-1.0,_ZN5aiter39bf16gemm_fp32bf16_tn_80x64_splitk_cleanE,1.0,-1.0,-1.0
256,16384,1024,4096,False,torch.bfloat16,torch.bfloat16,False,False,hipblaslt,439801,0,105.144,,0.0,1307.15,1675.42
256,16384,1024,4096,False,torch.bfloat16,torch.bfloat16,False,False,hipblaslt,440238,0,105.9441,,0.0,1297.28,1662.77
256,16384,1024,4096,False,torch.bfloat16,torch.bfloat16,False,False,hipblaslt,439320,0,106.1008,,0.0,1295.36,1660.32
256,16384,1024,4096,False,torch.bfloat16,torch.bfloat16,False,False,hipblaslt,439304,0,106.2266,,0.0,1293.83,1658.35
256,16384,1024,4096,False,torch.bfloat16,torch.bfloat16,False,False,hipblaslt,440237,0,106.2494,,0.0,1293.55,1657.99
256,16384,1024,4096,False,torch.bfloat16,torch.bfloat16,False,False,hipblaslt,439284,0,107.5319,,0.0,1278.12,1638.22
256,16384,1024,4096,False,torch.bfloat16,torch.bfloat16,False,False,hipblaslt,438309,0,107.7768,,0.0,1275.22,1634.5
256,16384,1024,4096,False,torch.bfloat16,torch.bfloat16,False,False,hipblaslt,439209,0,108.3221,,0.0,1268.8,1626.27
256,16384,1024,4096,False,torch.bfloat16,torch.bfloat16,False,False,hipblaslt,439361,0,108.7621,,0.0,1263.67,1619.69
256,16384,1024,4096,False,torch.bfloat16,torch.bfloat16,False,False,hipblaslt,439398,0,109.1702,,0.0,1258.94,1613.63
256,16384,1024,4096,False,torch.bfloat16,torch.bfloat16,False,False,hipblaslt,439285,0,109.7507,,0.0,1252.28,1605.1
256,16384,1024,4096,False,torch.bfloat16,torch.bfloat16,False,False,hipblaslt,439297,0,110.8886,,0.0,1239.43,1588.63
256,16384,1024,4096,False,torch.bfloat16,torch.bfloat16,False,False,asm,10,1,111.6992,_ZN5aiter24bf16gemm_bf16_tn_256x256E,0.0,1230.44,1577.1
256,16384,1024,4096,False,torch.bfloat16,torch.bfloat16,False,False,hipblaslt,440239,0,111.9082,,0.0,1228.14,1574.15
256,16384,1024,4096,False,torch.bfloat16,torch.bfloat16,False,False,hipblaslt,439325,0,113.6625,,0.0,1209.18,1549.86
256,16384,1024,4096,False,torch.bfloat16,torch.bfloat16,False,False,hipblaslt,439352,0,114.0503,,0.0,1205.07,1544.59
256,16384,1024,4096,False,torch.bfloat16,torch.bfloat16,False,False,hipblaslt,439321,0,114.3319,,0.0,1202.11,1540.78
256,16384,1024,4096,False,torch.bfloat16,torch.bfloat16,False,False,hipblaslt,439269,0,117.9254,,0.0,1165.47,1493.83
256,16384,1024,4096,False,torch.bfloat16,torch.bfloat16,False,False,hipblaslt,438386,0,118.2895,,0.0,1161.89,1489.23
256,16384,1024,4096,False,torch.bfloat16,torch.bfloat16,False,False,hipblaslt,439287,0,119.3817,,0.0,1151.26,1475.61
256,16384,1024,4096,False,torch.bfloat16,torch.bfloat16,False,False,hipblaslt,439305,0,120.1768,,0.0,1143.64,1465.85
256,16384,1024,4096,False,torch.bfloat16,torch.bfloat16,False,False,asm,9,1,296.7708,_ZN5aiter37bf16gemm_fp32bf16_tn_96x64_pf3_splitkE,0.0,463.11,593.59
256,16384,1024,4096,False,torch.bfloat16,torch.bfloat16,False,False,asm,6,1,376.6897,_ZN5aiter37bf16gemm_fp32bf16_tn_64x64_pf3_splitkE,0.0,364.86,467.65
256,16384,1024,4096,False,torch.bfloat16,torch.bfloat16,False,False,asm,4,1,477.3106,_ZN5aiter37bf16gemm_fp32bf16_tn_48x64_pf3_splitkE,0.0,287.94,369.07
256,16384,1024,4096,False,torch.bfloat16,torch.bfloat16,False,False,asm,2,1,637.1742,_ZN5aiter37bf16gemm_fp32bf16_tn_32x64_pf3_splitkE,0.0,215.7,276.47
256,32768,1024,4096,False,torch.bfloat16,torch.bfloat16,False,False,asm,3,2,-1.0,_ZN5aiter39bf16gemm_fp32bf16_tn_48x64_splitk_cleanE,1.0,-1.0,-1.0
256,32768,1024,4096,False,torch.bfloat16,torch.bfloat16,False,False,asm,3,3,-1.0,_ZN5aiter39bf16gemm_fp32bf16_tn_48x64_splitk_cleanE,1.0,-1.0,-1.0
256,32768,1024,4096,False,torch.bfloat16,torch.bfloat16,False,False,asm,3,4,-1.0,_ZN5aiter39bf16gemm_fp32bf16_tn_48x64_splitk_cleanE,1.0,-1.0,-1.0
256,32768,1024,4096,False,torch.bfloat16,torch.bfloat16,False,False,asm,5,2,-1.0,_ZN5aiter39bf16gemm_fp32bf16_tn_64x64_splitk_cleanE,1.0,-1.0,-1.0
256,32768,1024,4096,False,torch.bfloat16,torch.bfloat16,False,False,asm,5,4,-1.0,_ZN5aiter39bf16gemm_fp32bf16_tn_64x64_splitk_cleanE,1.0,-1.0,-1.0
256,32768,1024,4096,False,torch.bfloat16,torch.bfloat16,False,False,asm,1,2,-1.0,_ZN5aiter39bf16gemm_fp32bf16_tn_32x64_splitk_cleanE,1.0,-1.0,-1.0
256,32768,1024,4096,False,torch.bfloat16,torch.bfloat16,False,False,asm,1,4,-1.0,_ZN5aiter39bf16gemm_fp32bf16_tn_32x64_splitk_cleanE,1.0,-1.0,-1.0
256,32768,1024,4096,False,torch.bfloat16,torch.bfloat16,False,False,asm,5,3,-1.0,_ZN5aiter39bf16gemm_fp32bf16_tn_64x64_splitk_cleanE,1.0,-1.0,-1.0
256,32768,1024,4096,False,torch.bfloat16,torch.bfloat16,False,False,asm,1,3,-1.0,_ZN5aiter39bf16gemm_fp32bf16_tn_32x64_splitk_cleanE,1.0,-1.0,-1.0
256,32768,1024,4096,False,torch.bfloat16,torch.bfloat16,False,False,asm,7,4,-1.0,_ZN5aiter39bf16gemm_fp32bf16_tn_80x64_splitk_cleanE,1.0,-1.0,-1.0
256,32768,1024,4096,False,torch.bfloat16,torch.bfloat16,False,False,asm,8,4,-1.0,_ZN5aiter39bf16gemm_fp32bf16_tn_96x64_splitk_cleanE,1.0,-1.0,-1.0
256,32768,1024,4096,False,torch.bfloat16,torch.bfloat16,False,False,asm,8,3,-1.0,_ZN5aiter39bf16gemm_fp32bf16_tn_96x64_splitk_cleanE,1.0,-1.0,-1.0
256,32768,1024,4096,False,torch.bfloat16,torch.bfloat16,False,False,asm,8,2,-1.0,_ZN5aiter39bf16gemm_fp32bf16_tn_96x64_splitk_cleanE,1.0,-1.0,-1.0
256,32768,1024,4096,False,torch.bfloat16,torch.bfloat16,False,False,asm,7,2,-1.0,_ZN5aiter39bf16gemm_fp32bf16_tn_80x64_splitk_cleanE,1.0,-1.0,-1.0
256,32768,1024,4096,False,torch.bfloat16,torch.bfloat16,False,False,asm,7,3,-1.0,_ZN5aiter39bf16gemm_fp32bf16_tn_80x64_splitk_cleanE,1.0,-1.0,-1.0
256,32768,1024,4096,False,torch.bfloat16,torch.bfloat16,False,False,hipblaslt,439224,0,199.3323,,0.0,1378.99,1725.42
256,32768,1024,4096,False,torch.bfloat16,torch.bfloat16,False,False,hipblaslt,439212,0,201.2647,,0.0,1365.75,1708.86
256,32768,1024,4096,False,torch.bfloat16,torch.bfloat16,False,False,hipblaslt,439306,0,201.3585,,0.0,1365.12,1708.06
256,32768,1024,4096,False,torch.bfloat16,torch.bfloat16,False,False,hipblaslt,439311,0,201.6777,,0.0,1362.96,1705.36
256,32768,1024,4096,False,torch.bfloat16,torch.bfloat16,False,False,hipblaslt,439310,0,202.3553,,0.0,1358.39,1699.65
256,32768,1024,4096,False,torch.bfloat16,torch.bfloat16,False,False,hipblaslt,438366,0,203.3169,,0.0,1351.97,1691.61
256,32768,1024,4096,False,torch.bfloat16,torch.bfloat16,False,False,hipblaslt,439304,0,203.779,,0.0,1348.9,1687.77
256,32768,1024,4096,False,torch.bfloat16,torch.bfloat16,False,False,hipblaslt,439266,0,204.4337,,0.0,1344.58,1682.37
256,32768,1024,4096,False,torch.bfloat16,torch.bfloat16,False,False,hipblaslt,439303,0,206.0856,,0.0,1333.8,1668.88
256,32768,1024,4096,False,torch.bfloat16,torch.bfloat16,False,False,hipblaslt,440058,0,207.1032,,0.0,1327.25,1660.68
256,32768,1024,4096,False,torch.bfloat16,torch.bfloat16,False,False,hipblaslt,439355,0,207.9912,,0.0,1321.58,1653.59
256,32768,1024,4096,False,torch.bfloat16,torch.bfloat16,False,False,hipblaslt,439352,0,209.1541,,0.0,1314.24,1644.4
256,32768,1024,4096,False,torch.bfloat16,torch.bfloat16,False,False,asm,10,1,211.463,_ZN5aiter24bf16gemm_bf16_tn_256x256E,0.0,1299.89,1626.44
256,32768,1024,4096,False,torch.bfloat16,torch.bfloat16,False,False,hipblaslt,438244,0,220.1768,,0.0,1248.44,1562.08
256,32768,1024,4096,False,torch.bfloat16,torch.bfloat16,False,False,hipblaslt,439269,0,220.9346,,0.0,1244.16,1556.72
256,32768,1024,4096,False,torch.bfloat16,torch.bfloat16,False,False,hipblaslt,440237,0,223.9225,,0.0,1227.56,1535.95
256,32768,1024,4096,False,torch.bfloat16,torch.bfloat16,False,False,hipblaslt,440238,0,226.4423,,0.0,1213.9,1518.85
256,32768,1024,4096,False,torch.bfloat16,torch.bfloat16,False,False,hipblaslt,440235,0,228.2556,,0.0,1204.25,1506.79
256,32768,1024,4096,False,torch.bfloat16,torch.bfloat16,False,False,hipblaslt,440239,0,228.8214,,0.0,1201.28,1503.06
256,32768,1024,4096,False,torch.bfloat16,torch.bfloat16,False,False,hipblaslt,438309,0,228.8427,,0.0,1201.17,1502.92
256,32768,1024,4096,False,torch.bfloat16,torch.bfloat16,False,False,hipblaslt,438241,0,229.0496,,0.0,1200.08,1501.57
256,32768,1024,4096,False,torch.bfloat16,torch.bfloat16,False,False,asm,9,1,582.4572,_ZN5aiter37bf16gemm_fp32bf16_tn_96x64_pf3_splitkE,0.0,471.93,590.49
256,32768,1024,4096,False,torch.bfloat16,torch.bfloat16,False,False,asm,6,1,749.1646,_ZN5aiter37bf16gemm_fp32bf16_tn_64x64_pf3_splitkE,0.0,366.91,459.09
256,32768,1024,4096,False,torch.bfloat16,torch.bfloat16,False,False,asm,4,1,936.8277,_ZN5aiter37bf16gemm_fp32bf16_tn_48x64_pf3_splitkE,0.0,293.41,367.13
256,32768,1024,4096,False,torch.bfloat16,torch.bfloat16,False,False,asm,2,1,1271.5371,_ZN5aiter37bf16gemm_fp32bf16_tn_32x64_pf3_splitkE,0.0,216.18,270.49
256,65536,1024,4096,False,torch.bfloat16,torch.bfloat16,False,False,asm,3,2,-1.0,_ZN5aiter39bf16gemm_fp32bf16_tn_48x64_splitk_cleanE,1.0,-1.0,-1.0
256,65536,1024,4096,False,torch.bfloat16,torch.bfloat16,False,False,asm,3,3,-1.0,_ZN5aiter39bf16gemm_fp32bf16_tn_48x64_splitk_cleanE,1.0,-1.0,-1.0
256,65536,1024,4096,False,torch.bfloat16,torch.bfloat16,False,False,asm,3,4,-1.0,_ZN5aiter39bf16gemm_fp32bf16_tn_48x64_splitk_cleanE,1.0,-1.0,-1.0
256,65536,1024,4096,False,torch.bfloat16,torch.bfloat16,False,False,asm,5,2,-1.0,_ZN5aiter39bf16gemm_fp32bf16_tn_64x64_splitk_cleanE,1.0,-1.0,-1.0
256,65536,1024,4096,False,torch.bfloat16,torch.bfloat16,False,False,asm,5,4,-1.0,_ZN5aiter39bf16gemm_fp32bf16_tn_64x64_splitk_cleanE,1.0,-1.0,-1.0
256,65536,1024,4096,False,torch.bfloat16,torch.bfloat16,False,False,asm,1,2,-1.0,_ZN5aiter39bf16gemm_fp32bf16_tn_32x64_splitk_cleanE,1.0,-1.0,-1.0
256,65536,1024,4096,False,torch.bfloat16,torch.bfloat16,False,False,asm,1,4,-1.0,_ZN5aiter39bf16gemm_fp32bf16_tn_32x64_splitk_cleanE,1.0,-1.0,-1.0
256,65536,1024,4096,False,torch.bfloat16,torch.bfloat16,False,False,asm,5,3,-1.0,_ZN5aiter39bf16gemm_fp32bf16_tn_64x64_splitk_cleanE,1.0,-1.0,-1.0
256,65536,1024,4096,False,torch.bfloat16,torch.bfloat16,False,False,asm,1,3,-1.0,_ZN5aiter39bf16gemm_fp32bf16_tn_32x64_splitk_cleanE,1.0,-1.0,-1.0
256,65536,1024,4096,False,torch.bfloat16,torch.bfloat16,False,False,asm,7,4,-1.0,_ZN5aiter39bf16gemm_fp32bf16_tn_80x64_splitk_cleanE,1.0,-1.0,-1.0
256,65536,1024,4096,False,torch.bfloat16,torch.bfloat16,False,False,asm,8,4,-1.0,_ZN5aiter39bf16gemm_fp32bf16_tn_96x64_splitk_cleanE,1.0,-1.0,-1.0
256,65536,1024,4096,False,torch.bfloat16,torch.bfloat16,False,False,asm,8,3,-1.0,_ZN5aiter39bf16gemm_fp32bf16_tn_96x64_splitk_cleanE,1.0,-1.0,-1.0
256,65536,1024,4096,False,torch.bfloat16,torch.bfloat16,False,False,asm,8,2,-1.0,_ZN5aiter39bf16gemm_fp32bf16_tn_96x64_splitk_cleanE,1.0,-1.0,-1.0
256,65536,1024,4096,False,torch.bfloat16,torch.bfloat16,False,False,asm,7,2,-1.0,_ZN5aiter39bf16gemm_fp32bf16_tn_80x64_splitk_cleanE,1.0,-1.0,-1.0
256,65536,1024,4096,False,torch.bfloat16,torch.bfloat16,False,False,asm,7,3,-1.0,_ZN5aiter39bf16gemm_fp32bf16_tn_80x64_splitk_cleanE,1.0,-1.0,-1.0
256,65536,1024,4096,False,torch.bfloat16,torch.bfloat16,False,False,hipblaslt,439162,0,376.0065,,0.0,1462.09,1807.09
256,65536,1024,4096,False,torch.bfloat16,torch.bfloat16,False,False,hipblaslt,438241,0,380.5729,,0.0,1444.55,1785.41
256,65536,1024,4096,False,torch.bfloat16,torch.bfloat16,False,False,hipblaslt,439361,0,384.07,,0.0,1431.39,1769.15
256,65536,1024,4096,False,torch.bfloat16,torch.bfloat16,False,False,hipblaslt,439218,0,385.0812,,0.0,1427.64,1764.5
256,65536,1024,4096,False,torch.bfloat16,torch.bfloat16,False,False,hipblaslt,439311,0,386.5712,,0.0,1422.13,1757.7
256,65536,1024,4096,False,torch.bfloat16,torch.bfloat16,False,False,hipblaslt,439261,0,386.6548,,0.0,1421.83,1757.32
256,65536,1024,4096,False,torch.bfloat16,torch.bfloat16,False,False,hipblaslt,439301,0,387.3012,,0.0,1419.45,1754.39
256,65536,1024,4096,False,torch.bfloat16,torch.bfloat16,False,False,hipblaslt,439273,0,388.423,,0.0,1415.35,1749.32
256,65536,1024,4096,False,torch.bfloat16,torch.bfloat16,False,False,hipblaslt,439207,0,390.871,,0.0,1406.49,1738.37
256,65536,1024,4096,False,torch.bfloat16,torch.bfloat16,False,False,hipblaslt,439303,0,393.7167,,0.0,1396.32,1725.8
256,65536,1024,4096,False,torch.bfloat16,torch.bfloat16,False,False,hipblaslt,439211,0,397.4546,,0.0,1383.19,1709.57
256,65536,1024,4096,False,torch.bfloat16,torch.bfloat16,False,False,asm,10,1,408.2435,_ZN5aiter24bf16gemm_bf16_tn_256x256E,0.0,1346.64,1664.39
256,65536,1024,4096,False,torch.bfloat16,torch.bfloat16,False,False,hipblaslt,440238,0,413.4126,,0.0,1329.8,1643.58
256,65536,1024,4096,False,torch.bfloat16,torch.bfloat16,False,False,hipblaslt,438242,0,415.8563,,0.0,1321.99,1633.92
256,65536,1024,4096,False,torch.bfloat16,torch.bfloat16,False,False,hipblaslt,440239,0,419.4529,,0.0,1310.65,1619.91
256,65536,1024,4096,False,torch.bfloat16,torch.bfloat16,False,False,hipblaslt,439320,0,422.0281,,0.0,1302.65,1610.03
256,65536,1024,4096,False,torch.bfloat16,torch.bfloat16,False,False,hipblaslt,438243,0,422.7942,,0.0,1300.29,1607.11
256,65536,1024,4096,False,torch.bfloat16,torch.bfloat16,False,False,hipblaslt,440237,0,427.1851,,0.0,1286.93,1590.59
256,65536,1024,4096,False,torch.bfloat16,torch.bfloat16,False,False,hipblaslt,439258,0,427.2922,,0.0,1286.6,1590.19
256,65536,1024,4096,False,torch.bfloat16,torch.bfloat16,False,False,hipblaslt,439279,0,427.5455,,0.0,1285.84,1589.25
256,65536,1024,4096,False,torch.bfloat16,torch.bfloat16,False,False,hipblaslt,438159,0,517.3904,,0.0,1062.56,1313.28
256,65536,1024,4096,False,torch.bfloat16,torch.bfloat16,False,False,asm,9,1,1138.1518,_ZN5aiter37bf16gemm_fp32bf16_tn_96x64_pf3_splitkE,0.0,483.03,597.0
256,65536,1024,4096,False,torch.bfloat16,torch.bfloat16,False,False,asm,6,1,1481.1416,_ZN5aiter37bf16gemm_fp32bf16_tn_64x64_pf3_splitkE,0.0,371.17,458.75
256,65536,1024,4096,False,torch.bfloat16,torch.bfloat16,False,False,asm,4,1,1860.2557,_ZN5aiter37bf16gemm_fp32bf16_tn_48x64_pf3_splitkE,0.0,295.53,365.26
256,65536,1024,4096,False,torch.bfloat16,torch.bfloat16,False,False,asm,2,1,2521.1826,_ZN5aiter37bf16gemm_fp32bf16_tn_32x64_pf3_splitkE,0.0,218.05,269.51
256,131072,1024,4096,False,torch.bfloat16,torch.bfloat16,False,False,asm,3,2,-1.0,_ZN5aiter39bf16gemm_fp32bf16_tn_48x64_splitk_cleanE,1.0,-1.0,-1.0
256,131072,1024,4096,False,torch.bfloat16,torch.bfloat16,False,False,asm,3,3,-1.0,_ZN5aiter39bf16gemm_fp32bf16_tn_48x64_splitk_cleanE,1.0,-1.0,-1.0
256,131072,1024,4096,False,torch.bfloat16,torch.bfloat16,False,False,asm,3,4,-1.0,_ZN5aiter39bf16gemm_fp32bf16_tn_48x64_splitk_cleanE,1.0,-1.0,-1.0
256,131072,1024,4096,False,torch.bfloat16,torch.bfloat16,False,False,asm,5,2,-1.0,_ZN5aiter39bf16gemm_fp32bf16_tn_64x64_splitk_cleanE,1.0,-1.0,-1.0
256,131072,1024,4096,False,torch.bfloat16,torch.bfloat16,False,False,asm,5,4,-1.0,_ZN5aiter39bf16gemm_fp32bf16_tn_64x64_splitk_cleanE,1.0,-1.0,-1.0
256,131072,1024,4096,False,torch.bfloat16,torch.bfloat16,False,False,asm,1,2,-1.0,_ZN5aiter39bf16gemm_fp32bf16_tn_32x64_splitk_cleanE,1.0,-1.0,-1.0
256,131072,1024,4096,False,torch.bfloat16,torch.bfloat16,False,False,asm,1,4,-1.0,_ZN5aiter39bf16gemm_fp32bf16_tn_32x64_splitk_cleanE,1.0,-1.0,-1.0
256,131072,1024,4096,False,torch.bfloat16,torch.bfloat16,False,False,asm,5,3,-1.0,_ZN5aiter39bf16gemm_fp32bf16_tn_64x64_splitk_cleanE,1.0,-1.0,-1.0
256,131072,1024,4096,False,torch.bfloat16,torch.bfloat16,False,False,asm,1,3,-1.0,_ZN5aiter39bf16gemm_fp32bf16_tn_32x64_splitk_cleanE,1.0,-1.0,-1.0
256,131072,1024,4096,False,torch.bfloat16,torch.bfloat16,False,False,asm,7,4,-1.0,_ZN5aiter39bf16gemm_fp32bf16_tn_80x64_splitk_cleanE,1.0,-1.0,-1.0
256,131072,1024,4096,False,torch.bfloat16,torch.bfloat16,False,False,asm,8,4,-1.0,_ZN5aiter39bf16gemm_fp32bf16_tn_96x64_splitk_cleanE,1.0,-1.0,-1.0
256,131072,1024,4096,False,torch.bfloat16,torch.bfloat16,False,False,asm,8,3,-1.0,_ZN5aiter39bf16gemm_fp32bf16_tn_96x64_splitk_cleanE,1.0,-1.0,-1.0
256,131072,1024,4096,False,torch.bfloat16,torch.bfloat16,False,False,asm,8,2,-1.0,_ZN5aiter39bf16gemm_fp32bf16_tn_96x64_splitk_cleanE,1.0,-1.0,-1.0
256,131072,1024,4096,False,torch.bfloat16,torch.bfloat16,False,False,asm,7,2,-1.0,_ZN5aiter39bf16gemm_fp32bf16_tn_80x64_splitk_cleanE,1.0,-1.0,-1.0
256,131072,1024,4096,False,torch.bfloat16,torch.bfloat16,False,False,asm,7,3,-1.0,_ZN5aiter39bf16gemm_fp32bf16_tn_80x64_splitk_cleanE,1.0,-1.0,-1.0
256,131072,1024,4096,False,torch.bfloat16,torch.bfloat16,False,False,hipblaslt,438241,0,736.2422,,0.0,1493.41,1834.4
256,131072,1024,4096,False,torch.bfloat16,torch.bfloat16,False,False,hipblaslt,438366,0,754.0796,,0.0,1458.08,1791.01
256,131072,1024,4096,False,torch.bfloat16,torch.bfloat16,False,False,hipblaslt,439202,0,754.3854,,0.0,1457.49,1790.29
256,131072,1024,4096,False,torch.bfloat16,torch.bfloat16,False,False,hipblaslt,439311,0,754.558,,0.0,1457.16,1789.88
256,131072,1024,4096,False,torch.bfloat16,torch.bfloat16,False,False,hipblaslt,439229,0,754.9285,,0.0,1456.44,1789.0
256,131072,1024,4096,False,torch.bfloat16,torch.bfloat16,False,False,hipblaslt,439365,0,759.3102,,0.0,1448.04,1778.67
256,131072,1024,4096,False,torch.bfloat16,torch.bfloat16,False,False,hipblaslt,439223,0,760.866,,0.0,1445.08,1775.04
256,131072,1024,4096,False,torch.bfloat16,torch.bfloat16,False,False,hipblaslt,438992,0,762.3333,,0.0,1442.3,1771.62
256,131072,1024,4096,False,torch.bfloat16,torch.bfloat16,False,False,hipblaslt,439221,0,762.8881,,0.0,1441.25,1770.33
256,131072,1024,4096,False,torch.bfloat16,torch.bfloat16,False,False,hipblaslt,439287,0,768.5878,,0.0,1430.56,1757.2
256,131072,1024,4096,False,torch.bfloat16,torch.bfloat16,False,False,hipblaslt,438309,0,772.2585,,0.0,1423.76,1748.85
256,131072,1024,4096,False,torch.bfloat16,torch.bfloat16,False,False,hipblaslt,439051,0,774.7981,,0.0,1419.09,1743.12
256,131072,1024,4096,False,torch.bfloat16,torch.bfloat16,False,False,hipblaslt,440237,0,787.7015,,0.0,1395.85,1714.57
256,131072,1024,4096,False,torch.bfloat16,torch.bfloat16,False,False,hipblaslt,440235,0,790.9653,,0.0,1390.09,1707.49
256,131072,1024,4096,False,torch.bfloat16,torch.bfloat16,False,False,hipblaslt,439306,0,796.8627,,0.0,1379.8,1694.85
256,131072,1024,4096,False,torch.bfloat16,torch.bfloat16,False,False,hipblaslt,440238,0,797.0363,,0.0,1379.5,1694.48
256,131072,1024,4096,False,torch.bfloat16,torch.bfloat16,False,False,hipblaslt,440239,0,799.974,,0.0,1374.43,1688.26
256,131072,1024,4096,False,torch.bfloat16,torch.bfloat16,False,False,asm,10,1,802.6954,_ZN5aiter24bf16gemm_bf16_tn_256x256E,0.0,1369.77,1682.54
256,131072,1024,4096,False,torch.bfloat16,torch.bfloat16,False,False,hipblaslt,438229,0,803.1862,,0.0,1368.94,1681.51
256,131072,1024,4096,False,torch.bfloat16,torch.bfloat16,False,False,hipblaslt,439224,0,817.0837,,0.0,1345.65,1652.91
256,131072,1024,4096,False,torch.bfloat16,torch.bfloat16,False,False,hipblaslt,438212,0,842.1812,,0.0,1305.55,1603.65
256,131072,1024,4096,False,torch.bfloat16,torch.bfloat16,False,False,asm,9,1,2271.4129,_ZN5aiter37bf16gemm_fp32bf16_tn_96x64_pf3_splitkE,0.0,484.07,594.59
256,131072,1024,4096,False,torch.bfloat16,torch.bfloat16,False,False,asm,6,1,2971.0939,_ZN5aiter37bf16gemm_fp32bf16_tn_64x64_pf3_splitkE,0.0,370.07,454.57
256,131072,1024,4096,False,torch.bfloat16,torch.bfloat16,False,False,asm,4,1,3684.8221,_ZN5aiter37bf16gemm_fp32bf16_tn_48x64_pf3_splitkE,0.0,298.39,366.52
256,131072,1024,4096,False,torch.bfloat16,torch.bfloat16,False,False,asm,2,1,5017.2977,_ZN5aiter37bf16gemm_fp32bf16_tn_32x64_pf3_splitkE,0.0,219.14,269.18
256,262144,1024,4096,False,torch.bfloat16,torch.bfloat16,False,False,asm,3,2,-1.0,_ZN5aiter39bf16gemm_fp32bf16_tn_48x64_splitk_cleanE,1.0,-1.0,-1.0
256,262144,1024,4096,False,torch.bfloat16,torch.bfloat16,False,False,asm,3,3,-1.0,_ZN5aiter39bf16gemm_fp32bf16_tn_48x64_splitk_cleanE,1.0,-1.0,-1.0
256,262144,1024,4096,False,torch.bfloat16,torch.bfloat16,False,False,asm,3,4,-1.0,_ZN5aiter39bf16gemm_fp32bf16_tn_48x64_splitk_cleanE,1.0,-1.0,-1.0
256,262144,1024,4096,False,torch.bfloat16,torch.bfloat16,False,False,asm,5,2,-1.0,_ZN5aiter39bf16gemm_fp32bf16_tn_64x64_splitk_cleanE,1.0,-1.0,-1.0
256,262144,1024,4096,False,torch.bfloat16,torch.bfloat16,False,False,asm,5,4,-1.0,_ZN5aiter39bf16gemm_fp32bf16_tn_64x64_splitk_cleanE,1.0,-1.0,-1.0
256,262144,1024,4096,False,torch.bfloat16,torch.bfloat16,False,False,asm,1,2,-1.0,_ZN5aiter39bf16gemm_fp32bf16_tn_32x64_splitk_cleanE,1.0,-1.0,-1.0
256,262144,1024,4096,False,torch.bfloat16,torch.bfloat16,False,False,asm,1,4,-1.0,_ZN5aiter39bf16gemm_fp32bf16_tn_32x64_splitk_cleanE,1.0,-1.0,-1.0
256,262144,1024,4096,False,torch.bfloat16,torch.bfloat16,False,False,asm,5,3,-1.0,_ZN5aiter39bf16gemm_fp32bf16_tn_64x64_splitk_cleanE,1.0,-1.0,-1.0
256,262144,1024,4096,False,torch.bfloat16,torch.bfloat16,False,False,asm,1,3,-1.0,_ZN5aiter39bf16gemm_fp32bf16_tn_32x64_splitk_cleanE,1.0,-1.0,-1.0
256,262144,1024,4096,False,torch.bfloat16,torch.bfloat16,False,False,asm,7,4,-1.0,_ZN5aiter39bf16gemm_fp32bf16_tn_80x64_splitk_cleanE,1.0,-1.0,-1.0
256,262144,1024,4096,False,torch.bfloat16,torch.bfloat16,False,False,asm,8,4,-1.0,_ZN5aiter39bf16gemm_fp32bf16_tn_96x64_splitk_cleanE,1.0,-1.0,-1.0
256,262144,1024,4096,False,torch.bfloat16,torch.bfloat16,False,False,asm,8,3,-1.0,_ZN5aiter39bf16gemm_fp32bf16_tn_96x64_splitk_cleanE,1.0,-1.0,-1.0
256,262144,1024,4096,False,torch.bfloat16,torch.bfloat16,False,False,asm,8,2,-1.0,_ZN5aiter39bf16gemm_fp32bf16_tn_96x64_splitk_cleanE,1.0,-1.0,-1.0
256,262144,1024,4096,False,torch.bfloat16,torch.bfloat16,False,False,asm,7,2,-1.0,_ZN5aiter39bf16gemm_fp32bf16_tn_80x64_splitk_cleanE,1.0,-1.0,-1.0
256,262144,1024,4096,False,torch.bfloat16,torch.bfloat16,False,False,asm,7,3,-1.0,_ZN5aiter39bf16gemm_fp32bf16_tn_80x64_splitk_cleanE,1.0,-1.0,-1.0
256,262144,1024,4096,False,torch.bfloat16,torch.bfloat16,False,False,hipblaslt,439228,0,1481.9692,,0.0,1483.85,1817.0
256,262144,1024,4096,False,torch.bfloat16,torch.bfloat16,False,False,hipblaslt,440058,0,1482.5693,,0.0,1483.25,1816.27
256,262144,1024,4096,False,torch.bfloat16,torch.bfloat16,False,False,hipblaslt,439171,0,1487.8049,,0.0,1478.03,1809.88
256,262144,1024,4096,False,torch.bfloat16,torch.bfloat16,False,False,hipblaslt,438992,0,1487.8118,,0.0,1478.03,1809.87
256,262144,1024,4096,False,torch.bfloat16,torch.bfloat16,False,False,hipblaslt,439310,0,1491.0129,,0.0,1474.85,1805.98
256,262144,1024,4096,False,torch.bfloat16,torch.bfloat16,False,False,hipblaslt,439223,0,1496.8249,,0.0,1469.13,1798.97
256,262144,1024,4096,False,torch.bfloat16,torch.bfloat16,False,False,hipblaslt,438244,0,1499.8724,,0.0,1466.14,1795.31
256,262144,1024,4096,False,torch.bfloat16,torch.bfloat16,False,False,hipblaslt,438241,0,1501.8886,,0.0,1464.17,1792.9
256,262144,1024,4096,False,torch.bfloat16,torch.bfloat16,False,False,hipblaslt,439801,0,1506.6493,,0.0,1459.55,1787.24
256,262144,1024,4096,False,torch.bfloat16,torch.bfloat16,False,False,hipblaslt,439227,0,1507.4768,,0.0,1458.74,1786.26
256,262144,1024,4096,False,torch.bfloat16,torch.bfloat16,False,False,hipblaslt,440236,0,1515.3978,,0.0,1451.12,1776.92
256,262144,1024,4096,False,torch.bfloat16,torch.bfloat16,False,False,hipblaslt,439461,0,1516.9211,,0.0,1449.66,1775.14
256,262144,1024,4096,False,torch.bfloat16,torch.bfloat16,False,False,hipblaslt,438242,0,1518.8901,,0.0,1447.78,1772.84
256,262144,1024,4096,False,torch.bfloat16,torch.bfloat16,False,False,hipblaslt,439212,0,1519.586,,0.0,1447.12,1772.02
256,262144,1024,4096,False,torch.bfloat16,torch.bfloat16,False,False,hipblaslt,439218,0,1519.7686,,0.0,1446.95,1771.81
256,262144,1024,4096,False,torch.bfloat16,torch.bfloat16,False,False,hipblaslt,439283,0,1519.9942,,0.0,1446.73,1771.55
256,262144,1024,4096,False,torch.bfloat16,torch.bfloat16,False,False,hipblaslt,439364,0,1522.2427,,0.0,1444.59,1768.93
256,262144,1024,4096,False,torch.bfloat16,torch.bfloat16,False,False,hipblaslt,439391,0,1544.6969,,0.0,1423.6,1743.22
256,262144,1024,4096,False,torch.bfloat16,torch.bfloat16,False,False,hipblaslt,439381,0,1550.2195,,0.0,1418.52,1737.01
256,262144,1024,4096,False,torch.bfloat16,torch.bfloat16,False,False,hipblaslt,439282,0,1565.9922,,0.0,1404.24,1719.51
256,262144,1024,4096,False,torch.bfloat16,torch.bfloat16,False,False,asm,10,1,1577.4825,_ZN5aiter24bf16gemm_bf16_tn_256x256E,0.0,1394.01,1706.99
256,262144,1024,4096,False,torch.bfloat16,torch.bfloat16,False,False,asm,9,1,4469.7472,_ZN5aiter37bf16gemm_fp32bf16_tn_96x64_pf3_splitkE,0.0,491.98,602.44
256,262144,1024,4096,False,torch.bfloat16,torch.bfloat16,False,False,asm,6,1,6032.2971,_ZN5aiter37bf16gemm_fp32bf16_tn_64x64_pf3_splitkE,0.0,364.54,446.39
256,262144,1024,4096,False,torch.bfloat16,torch.bfloat16,False,False,asm,4,1,7373.9808,_ZN5aiter37bf16gemm_fp32bf16_tn_48x64_pf3_splitkE,0.0,298.21,365.17
256,262144,1024,4096,False,torch.bfloat16,torch.bfloat16,False,False,asm,2,1,10043.8446,_ZN5aiter37bf16gemm_fp32bf16_tn_32x64_pf3_splitkE,0.0,218.94,268.1
256,524288,1024,4096,False,torch.bfloat16,torch.bfloat16,False,False,asm,3,2,-1.0,_ZN5aiter39bf16gemm_fp32bf16_tn_48x64_splitk_cleanE,1.0,-1.0,-1.0
256,524288,1024,4096,False,torch.bfloat16,torch.bfloat16,False,False,asm,3,3,-1.0,_ZN5aiter39bf16gemm_fp32bf16_tn_48x64_splitk_cleanE,1.0,-1.0,-1.0
256,524288,1024,4096,False,torch.bfloat16,torch.bfloat16,False,False,asm,3,4,-1.0,_ZN5aiter39bf16gemm_fp32bf16_tn_48x64_splitk_cleanE,1.0,-1.0,-1.0
256,524288,1024,4096,False,torch.bfloat16,torch.bfloat16,False,False,asm,5,2,-1.0,_ZN5aiter39bf16gemm_fp32bf16_tn_64x64_splitk_cleanE,1.0,-1.0,-1.0
256,524288,1024,4096,False,torch.bfloat16,torch.bfloat16,False,False,asm,5,4,-1.0,_ZN5aiter39bf16gemm_fp32bf16_tn_64x64_splitk_cleanE,1.0,-1.0,-1.0
256,524288,1024,4096,False,torch.bfloat16,torch.bfloat16,False,False,asm,1,2,-1.0,_ZN5aiter39bf16gemm_fp32bf16_tn_32x64_splitk_cleanE,1.0,-1.0,-1.0
256,524288,1024,4096,False,torch.bfloat16,torch.bfloat16,False,False,asm,1,4,-1.0,_ZN5aiter39bf16gemm_fp32bf16_tn_32x64_splitk_cleanE,1.0,-1.0,-1.0
256,524288,1024,4096,False,torch.bfloat16,torch.bfloat16,False,False,asm,5,3,-1.0,_ZN5aiter39bf16gemm_fp32bf16_tn_64x64_splitk_cleanE,1.0,-1.0,-1.0
256,524288,1024,4096,False,torch.bfloat16,torch.bfloat16,False,False,asm,1,3,-1.0,_ZN5aiter39bf16gemm_fp32bf16_tn_32x64_splitk_cleanE,1.0,-1.0,-1.0
256,524288,1024,4096,False,torch.bfloat16,torch.bfloat16,False,False,asm,7,4,-1.0,_ZN5aiter39bf16gemm_fp32bf16_tn_80x64_splitk_cleanE,1.0,-1.0,-1.0
256,524288,1024,4096,False,torch.bfloat16,torch.bfloat16,False,False,asm,8,4,-1.0,_ZN5aiter39bf16gemm_fp32bf16_tn_96x64_splitk_cleanE,1.0,-1.0,-1.0
256,524288,1024,4096,False,torch.bfloat16,torch.bfloat16,False,False,asm,8,3,-1.0,_ZN5aiter39bf16gemm_fp32bf16_tn_96x64_splitk_cleanE,1.0,-1.0,-1.0
256,524288,1024,4096,False,torch.bfloat16,torch.bfloat16,False,False,asm,8,2,-1.0,_ZN5aiter39bf16gemm_fp32bf16_tn_96x64_splitk_cleanE,1.0,-1.0,-1.0
256,524288,1024,4096,False,torch.bfloat16,torch.bfloat16,False,False,asm,7,2,-1.0,_ZN5aiter39bf16gemm_fp32bf16_tn_80x64_splitk_cleanE,1.0,-1.0,-1.0
256,524288,1024,4096,False,torch.bfloat16,torch.bfloat16,False,False,asm,7,3,-1.0,_ZN5aiter39bf16gemm_fp32bf16_tn_80x64_splitk_cleanE,1.0,-1.0,-1.0
256,524288,1024,4096,False,torch.bfloat16,torch.bfloat16,False,False,hipblaslt,439221,0,2936.2715,,0.0,1497.83,1831.27
256,524288,1024,4096,False,torch.bfloat16,torch.bfloat16,False,False,hipblaslt,438244,0,2936.9074,,0.0,1497.51,1830.87
256,524288,1024,4096,False,torch.bfloat16,torch.bfloat16,False,False,hipblaslt,438242,0,2954.87,,0.0,1488.41,1819.74
256,524288,1024,4096,False,torch.bfloat16,torch.bfloat16,False,False,hipblaslt,439305,0,2959.2908,,0.0,1486.18,1817.02
256,524288,1024,4096,False,torch.bfloat16,torch.bfloat16,False,False,hipblaslt,439301,0,2965.3833,,0.0,1483.13,1813.29
256,524288,1024,4096,False,torch.bfloat16,torch.bfloat16,False,False,hipblaslt,439261,0,2973.8278,,0.0,1478.92,1808.14
256,524288,1024,4096,False,torch.bfloat16,torch.bfloat16,False,False,hipblaslt,440058,0,2975.5275,,0.0,1478.07,1807.11
256,524288,1024,4096,False,torch.bfloat16,torch.bfloat16,False,False,hipblaslt,439391,0,2976.7608,,0.0,1477.46,1806.36
256,524288,1024,4096,False,torch.bfloat16,torch.bfloat16,False,False,hipblaslt,439229,0,2978.5311,,0.0,1476.58,1805.29
256,524288,1024,4096,False,torch.bfloat16,torch.bfloat16,False,False,hipblaslt,439284,0,2986.5153,,0.0,1472.63,1800.46
256,524288,1024,4096,False,torch.bfloat16,torch.bfloat16,False,False,hipblaslt,439202,0,2995.6795,,0.0,1468.13,1794.95
256,524288,1024,4096,False,torch.bfloat16,torch.bfloat16,False,False,hipblaslt,439051,0,3003.1148,,0.0,1464.49,1790.51
256,524288,1024,4096,False,torch.bfloat16,torch.bfloat16,False,False,hipblaslt,439225,0,3008.7157,,0.0,1461.77,1787.17
256,524288,1024,4096,False,torch.bfloat16,torch.bfloat16,False,False,hipblaslt,439302,0,3020.2296,,0.0,1456.2,1780.36
256,524288,1024,4096,False,torch.bfloat16,torch.bfloat16,False,False,hipblaslt,439306,0,3025.0213,,0.0,1453.89,1777.54
256,524288,1024,4096,False,torch.bfloat16,torch.bfloat16,False,False,hipblaslt,439364,0,3032.9774,,0.0,1450.08,1772.88
256,524288,1024,4096,False,torch.bfloat16,torch.bfloat16,False,False,hipblaslt,438241,0,3033.4208,,0.0,1449.86,1772.62
256,524288,1024,4096,False,torch.bfloat16,torch.bfloat16,False,False,hipblaslt,439223,0,3036.764,,0.0,1448.27,1770.67
256,524288,1024,4096,False,torch.bfloat16,torch.bfloat16,False,False,hipblaslt,439461,0,3045.5258,,0.0,1444.1,1765.57
256,524288,1024,4096,False,torch.bfloat16,torch.bfloat16,False,False,hipblaslt,439320,0,3076.8075,,0.0,1429.42,1747.62
256,524288,1024,4096,False,torch.bfloat16,torch.bfloat16,False,False,asm,10,1,3321.5641,_ZN5aiter24bf16gemm_bf16_tn_256x256E,0.7516,1324.09,1618.85
256,524288,1024,4096,False,torch.bfloat16,torch.bfloat16,False,False,asm,9,1,8977.7755,_ZN5aiter37bf16gemm_fp32bf16_tn_96x64_pf3_splitkE,0.7516,489.88,598.93
256,524288,1024,4096,False,torch.bfloat16,torch.bfloat16,False,False,asm,6,1,11740.9909,_ZN5aiter37bf16gemm_fp32bf16_tn_64x64_pf3_splitkE,0.7516,374.59,457.98
256,524288,1024,4096,False,torch.bfloat16,torch.bfloat16,False,False,asm,4,1,14713.6766,_ZN5aiter37bf16gemm_fp32bf16_tn_48x64_pf3_splitkE,0.7516,298.91,365.45
256,524288,1024,4096,False,torch.bfloat16,torch.bfloat16,False,False,asm,2,1,19878.7164,_ZN5aiter37bf16gemm_fp32bf16_tn_32x64_pf3_splitkE,0.7516,221.24,270.5
256,1,2048,4096,False,torch.bfloat16,torch.bfloat16,False,False,hipblaslt,438818,0,7.6489,,0.0,2.19,2195.02
256,1,2048,4096,False,torch.bfloat16,torch.bfloat16,False,False,hipblaslt,438410,0,7.7024,,0.0,2.18,2179.78
256,1,2048,4096,False,torch.bfloat16,torch.bfloat16,False,False,hipblaslt,439064,0,7.8732,,0.0,2.13,2132.49
256,1,2048,4096,False,torch.bfloat16,torch.bfloat16,False,False,hipblaslt,439082,0,8.1757,,0.0,2.05,2053.59
256,1,2048,4096,False,torch.bfloat16,torch.bfloat16,False,False,hipblaslt,438618,0,8.3762,,0.0,2.0,2004.43
256,1,2048,4096,False,torch.bfloat16,torch.bfloat16,False,False,hipblaslt,440197,0,8.5223,,0.0,1.97,1970.07
256,1,2048,4096,False,torch.bfloat16,torch.bfloat16,False,False,hipblaslt,439065,0,8.6249,,0.0,1.95,1946.63
256,1,2048,4096,False,torch.bfloat16,torch.bfloat16,False,False,hipblaslt,439066,0,8.6457,,0.0,1.94,1941.95
256,1,2048,4096,False,torch.bfloat16,torch.bfloat16,False,False,hipblaslt,439683,0,8.6878,,0.0,1.93,1932.54
256,1,2048,4096,False,torch.bfloat16,torch.bfloat16,False,False,hipblaslt,438688,0,8.746,,0.0,1.92,1919.68
256,1,2048,4096,False,torch.bfloat16,torch.bfloat16,False,False,hipblaslt,438958,0,8.7599,,0.0,1.92,1916.63
256,1,2048,4096,False,torch.bfloat16,torch.bfloat16,False,False,hipblaslt,439308,0,8.7689,,0.0,1.91,1914.66
256,1,2048,4096,False,torch.bfloat16,torch.bfloat16,False,False,hipblaslt,439080,0,8.7882,,0.0,1.91,1910.46
256,1,2048,4096,False,torch.bfloat16,torch.bfloat16,False,False,hipblaslt,439063,0,8.8307,,0.0,1.9,1901.27
256,1,2048,4096,False,torch.bfloat16,torch.bfloat16,False,False,hipblaslt,440202,0,8.8562,,0.0,1.89,1895.79
256,1,2048,4096,False,torch.bfloat16,torch.bfloat16,False,False,hipblaslt,438754,0,8.9641,,0.0,1.87,1872.97
256,1,2048,4096,False,torch.bfloat16,torch.bfloat16,False,False,hipblaslt,438936,0,9.0374,,0.0,1.86,1857.78
256,1,2048,4096,False,torch.bfloat16,torch.bfloat16,False,False,hipblaslt,439081,0,9.2816,,0.0,1.81,1808.9
256,1,2048,4096,False,torch.bfloat16,torch.bfloat16,False,False,hipblaslt,438328,0,10.1435,,0.0,1.65,1655.2
256,1,2048,4096,False,torch.bfloat16,torch.bfloat16,False,False,hipblaslt,438606,0,10.1648,,0.0,1.65,1651.73
256,1,2048,4096,False,torch.bfloat16,torch.bfloat16,False,False,asm,1,5,10.4899,_ZN5aiter39bf16gemm_fp32bf16_tn_32x64_splitk_cleanE,0.0161,1.6,1600.54
256,1,2048,4096,False,torch.bfloat16,torch.bfloat16,False,False,asm,1,6,10.6877,_ZN5aiter39bf16gemm_fp32bf16_tn_32x64_splitk_cleanE,0.02,1.57,1570.92
256,1,2048,4096,False,torch.bfloat16,torch.bfloat16,False,False,asm,3,5,10.8073,_ZN5aiter39bf16gemm_fp32bf16_tn_48x64_splitk_cleanE,0.0151,1.55,1553.53
256,1,2048,4096,False,torch.bfloat16,torch.bfloat16,False,False,asm,3,6,10.9842,_ZN5aiter39bf16gemm_fp32bf16_tn_48x64_splitk_cleanE,0.0195,1.53,1528.51
256,1,2048,4096,False,torch.bfloat16,torch.bfloat16,False,False,asm,5,5,10.9907,_ZN5aiter39bf16gemm_fp32bf16_tn_64x64_splitk_cleanE,0.0171,1.53,1527.61
256,1,2048,4096,False,torch.bfloat16,torch.bfloat16,False,False,asm,1,4,11.0076,_ZN5aiter39bf16gemm_fp32bf16_tn_32x64_splitk_cleanE,0.0171,1.52,1525.26
256,1,2048,4096,False,torch.bfloat16,torch.bfloat16,False,False,asm,1,7,11.119,_ZN5aiter39bf16gemm_fp32bf16_tn_32x64_splitk_cleanE,0.0234,1.51,1509.98
256,1,2048,4096,False,torch.bfloat16,torch.bfloat16,False,False,asm,5,6,11.1512,_ZN5aiter39bf16gemm_fp32bf16_tn_64x64_splitk_cleanE,0.021,1.5,1505.62
256,1,2048,4096,False,torch.bfloat16,torch.bfloat16,False,False,asm,7,5,11.2153,_ZN5aiter39bf16gemm_fp32bf16_tn_80x64_splitk_cleanE,0.0181,1.5,1497.02
256,1,2048,4096,False,torch.bfloat16,torch.bfloat16,False,False,asm,3,4,11.2905,_ZN5aiter39bf16gemm_fp32bf16_tn_48x64_splitk_cleanE,0.0171,1.49,1487.05
256,1,2048,4096,False,torch.bfloat16,torch.bfloat16,False,False,asm,7,6,11.3078,_ZN5aiter39bf16gemm_fp32bf16_tn_80x64_splitk_cleanE,0.021,1.48,1484.77
256,1,2048,4096,False,torch.bfloat16,torch.bfloat16,False,False,asm,3,7,11.3865,_ZN5aiter39bf16gemm_fp32bf16_tn_48x64_splitk_cleanE,0.0244,1.47,1474.51
256,1,2048,4096,False,torch.bfloat16,torch.bfloat16,False,False,asm,5,7,11.4944,_ZN5aiter39bf16gemm_fp32bf16_tn_64x64_splitk_cleanE,0.0225,1.46,1460.67
256,1,2048,4096,False,torch.bfloat16,torch.bfloat16,False,False,asm,8,6,11.504,_ZN5aiter39bf16gemm_fp32bf16_tn_96x64_splitk_cleanE,0.021,1.46,1459.45
256,1,2048,4096,False,torch.bfloat16,torch.bfloat16,False,False,asm,8,5,11.5177,_ZN5aiter39bf16gemm_fp32bf16_tn_96x64_splitk_cleanE,0.0156,1.46,1457.71
256,1,2048,4096,False,torch.bfloat16,torch.bfloat16,False,False,asm,5,4,11.5676,_ZN5aiter39bf16gemm_fp32bf16_tn_64x64_splitk_cleanE,0.0186,1.45,1451.43
256,1,2048,4096,False,torch.bfloat16,torch.bfloat16,False,False,asm,1,8,11.6567,_ZN5aiter39bf16gemm_fp32bf16_tn_32x64_splitk_cleanE,0.0288,1.44,1440.33
256,1,2048,4096,False,torch.bfloat16,torch.bfloat16,False,False,asm,7,7,11.712,_ZN5aiter39bf16gemm_fp32bf16_tn_80x64_splitk_cleanE,0.0254,1.43,1433.53
256,1,2048,4096,False,torch.bfloat16,torch.bfloat16,False,False,asm,7,4,11.7473,_ZN5aiter39bf16gemm_fp32bf16_tn_80x64_splitk_cleanE,0.0171,1.43,1429.22
256,1,2048,4096,False,torch.bfloat16,torch.bfloat16,False,False,asm,8,7,11.9074,_ZN5aiter39bf16gemm_fp32bf16_tn_96x64_splitk_cleanE,0.021,1.41,1410.01
256,1,2048,4096,False,torch.bfloat16,torch.bfloat16,False,False,asm,3,8,11.9148,_ZN5aiter39bf16gemm_fp32bf16_tn_48x64_splitk_cleanE,0.0283,1.41,1409.13
256,1,2048,4096,False,torch.bfloat16,torch.bfloat16,False,False,asm,1,3,12.0292,_ZN5aiter39bf16gemm_fp32bf16_tn_32x64_splitk_cleanE,0.0156,1.39,1395.73
256,1,2048,4096,False,torch.bfloat16,torch.bfloat16,False,False,asm,5,8,12.0367,_ZN5aiter39bf16gemm_fp32bf16_tn_64x64_splitk_cleanE,0.0269,1.39,1394.86
256,1,2048,4096,False,torch.bfloat16,torch.bfloat16,False,False,asm,8,4,12.1367,_ZN5aiter39bf16gemm_fp32bf16_tn_96x64_splitk_cleanE,0.0176,1.38,1383.37
256,1,2048,4096,False,torch.bfloat16,torch.bfloat16,False,False,asm,7,8,12.1786,_ZN5aiter39bf16gemm_fp32bf16_tn_80x64_splitk_cleanE,0.0283,1.38,1378.61
256,1,2048,4096,False,torch.bfloat16,torch.bfloat16,False,False,asm,3,3,12.3586,_ZN5aiter39bf16gemm_fp32bf16_tn_48x64_splitk_cleanE,0.0151,1.36,1358.53
256,1,2048,4096,False,torch.bfloat16,torch.bfloat16,False,False,asm,8,8,12.3986,_ZN5aiter39bf16gemm_fp32bf16_tn_96x64_splitk_cleanE,0.0283,1.35,1354.15
256,1,2048,4096,False,torch.bfloat16,torch.bfloat16,False,False,asm,5,3,12.6897,_ZN5aiter39bf16gemm_fp32bf16_tn_64x64_splitk_cleanE,0.0156,1.32,1323.08
256,1,2048,4096,False,torch.bfloat16,torch.bfloat16,False,False,asm,7,3,13.0066,_ZN5aiter39bf16gemm_fp32bf16_tn_80x64_splitk_cleanE,0.0156,1.29,1290.84
256,1,2048,4096,False,torch.bfloat16,torch.bfloat16,False,False,asm,8,3,13.3205,_ZN5aiter39bf16gemm_fp32bf16_tn_96x64_splitk_cleanE,0.0166,1.26,1260.43
256,1,2048,4096,False,torch.bfloat16,torch.bfloat16,False,False,asm,1,2,15.4902,_ZN5aiter39bf16gemm_fp32bf16_tn_32x64_splitk_cleanE,0.0103,1.08,1083.88
256,1,2048,4096,False,torch.bfloat16,torch.bfloat16,False,False,asm,3,2,15.9945,_ZN5aiter39bf16gemm_fp32bf16_tn_48x64_splitk_cleanE,0.0103,1.05,1049.7
256,1,2048,4096,False,torch.bfloat16,torch.bfloat16,False,False,asm,5,2,16.3206,_ZN5aiter39bf16gemm_fp32bf16_tn_64x64_splitk_cleanE,0.0103,1.03,1028.73
256,1,2048,4096,False,torch.bfloat16,torch.bfloat16,False,False,asm,7,2,16.6991,_ZN5aiter39bf16gemm_fp32bf16_tn_80x64_splitk_cleanE,0.0103,1.0,1005.41
256,1,2048,4096,False,torch.bfloat16,torch.bfloat16,False,False,asm,8,2,17.1508,_ZN5aiter39bf16gemm_fp32bf16_tn_96x64_splitk_cleanE,0.0103,0.98,978.93
256,1,2048,4096,False,torch.bfloat16,torch.bfloat16,False,False,asm,2,1,23.7474,_ZN5aiter37bf16gemm_fp32bf16_tn_32x64_pf3_splitkE,0.0,0.71,707.0
256,1,2048,4096,False,torch.bfloat16,torch.bfloat16,False,False,asm,4,1,24.3769,_ZN5aiter37bf16gemm_fp32bf16_tn_48x64_pf3_splitkE,0.0,0.69,688.75
256,1,2048,4096,False,torch.bfloat16,torch.bfloat16,False,False,asm,6,1,25.0901,_ZN5aiter37bf16gemm_fp32bf16_tn_64x64_pf3_splitkE,0.0,0.67,669.17
256,1,2048,4096,False,torch.bfloat16,torch.bfloat16,False,False,asm,9,1,26.5927,_ZN5aiter37bf16gemm_fp32bf16_tn_96x64_pf3_splitkE,0.0,0.63,631.36
256,1,2048,4096,False,torch.bfloat16,torch.bfloat16,False,False,asm,10,1,68.2231,_ZN5aiter24bf16gemm_bf16_tn_256x256E,0.0,0.25,246.1
256,4,2048,4096,False,torch.bfloat16,torch.bfloat16,False,False,hipblaslt,438818,0,7.7958,,0.0,8.61,2158.39
256,4,2048,4096,False,torch.bfloat16,torch.bfloat16,False,False,hipblaslt,438410,0,8.0195,,0.0,8.37,2098.18
256,4,2048,4096,False,torch.bfloat16,torch.bfloat16,False,False,hipblaslt,439082,0,8.5084,,0.0,7.89,1977.62
256,4,2048,4096,False,torch.bfloat16,torch.bfloat16,False,False,hipblaslt,439064,0,8.5299,,0.0,7.87,1972.63
256,4,2048,4096,False,torch.bfloat16,torch.bfloat16,False,False,hipblaslt,438618,0,8.5321,,0.0,7.87,1972.13
256,4,2048,4096,False,torch.bfloat16,torch.bfloat16,False,False,hipblaslt,440197,0,8.608,,0.0,7.8,1954.74
256,4,2048,4096,False,torch.bfloat16,torch.bfloat16,False,False,hipblaslt,439688,0,9.0241,,0.0,7.44,1864.6
256,4,2048,4096,False,torch.bfloat16,torch.bfloat16,False,False,hipblaslt,440202,0,9.1518,,0.0,7.33,1838.59
256,4,2048,4096,False,torch.bfloat16,torch.bfloat16,False,False,hipblaslt,439066,0,9.2864,,0.0,7.23,1811.94
256,4,2048,4096,False,torch.bfloat16,torch.bfloat16,False,False,hipblaslt,438755,0,9.3362,,0.0,7.19,1802.27
256,4,2048,4096,False,torch.bfloat16,torch.bfloat16,False,False,hipblaslt,439080,0,9.377,,0.0,7.16,1794.43
256,4,2048,4096,False,torch.bfloat16,torch.bfloat16,False,False,hipblaslt,439081,0,9.4546,,0.0,7.1,1779.7
256,4,2048,4096,False,torch.bfloat16,torch.bfloat16,False,False,hipblaslt,438549,0,9.4562,,0.0,7.1,1779.4
256,4,2048,4096,False,torch.bfloat16,torch.bfloat16,False,False,hipblaslt,438958,0,9.4709,,0.0,7.09,1776.64
256,4,2048,4096,False,torch.bfloat16,torch.bfloat16,False,False,hipblaslt,439084,0,9.8024,,0.0,6.85,1716.56
256,4,2048,4096,False,torch.bfloat16,torch.bfloat16,False,False,hipblaslt,438481,0,9.8554,,0.0,6.81,1707.32
256,4,2048,4096,False,torch.bfloat16,torch.bfloat16,False,False,hipblaslt,439940,0,10.4113,,0.0,6.45,1616.16
256,4,2048,4096,False,torch.bfloat16,torch.bfloat16,False,False,asm,1,5,10.562,_ZN5aiter39bf16gemm_fp32bf16_tn_32x64_splitk_cleanE,0.0139,6.35,1593.1
256,4,2048,4096,False,torch.bfloat16,torch.bfloat16,False,False,asm,1,6,10.7435,_ZN5aiter39bf16gemm_fp32bf16_tn_32x64_splitk_cleanE,0.0183,6.25,1566.19
256,4,2048,4096,False,torch.bfloat16,torch.bfloat16,False,False,hipblaslt,438606,0,10.7477,,0.0,6.24,1565.58
256,4,2048,4096,False,torch.bfloat16,torch.bfloat16,False,False,hipblaslt,438328,0,10.7574,,0.0,6.24,1564.17
256,4,2048,4096,False,torch.bfloat16,torch.bfloat16,False,False,asm,3,5,10.8177,_ZN5aiter39bf16gemm_fp32bf16_tn_48x64_splitk_cleanE,0.0138,6.2,1555.45
256,4,2048,4096,False,torch.bfloat16,torch.bfloat16,False,False,asm,3,6,10.9553,_ZN5aiter39bf16gemm_fp32bf16_tn_48x64_splitk_cleanE,0.0173,6.13,1535.91
256,4,2048,4096,False,torch.bfloat16,torch.bfloat16,False,False,asm,5,5,11.0205,_ZN5aiter39bf16gemm_fp32bf16_tn_64x64_splitk_cleanE,0.0155,6.09,1526.82
256,4,2048,4096,False,torch.bfloat16,torch.bfloat16,False,False,asm,1,4,11.0629,_ZN5aiter39bf16gemm_fp32bf16_tn_32x64_splitk_cleanE,0.0131,6.07,1520.97
256,4,2048,4096,False,torch.bfloat16,torch.bfloat16,False,False,asm,5,6,11.1553,_ZN5aiter39bf16gemm_fp32bf16_tn_64x64_splitk_cleanE,0.0176,6.02,1508.37
256,4,2048,4096,False,torch.bfloat16,torch.bfloat16,False,False,asm,7,5,11.2065,_ZN5aiter39bf16gemm_fp32bf16_tn_80x64_splitk_cleanE,0.0159,5.99,1501.48
256,4,2048,4096,False,torch.bfloat16,torch.bfloat16,False,False,asm,1,7,11.2236,_ZN5aiter39bf16gemm_fp32bf16_tn_32x64_splitk_cleanE,0.0193,5.98,1499.2
256,4,2048,4096,False,torch.bfloat16,torch.bfloat16,False,False,asm,7,6,11.3377,_ZN5aiter39bf16gemm_fp32bf16_tn_80x64_splitk_cleanE,0.0188,5.92,1484.11
256,4,2048,4096,False,torch.bfloat16,torch.bfloat16,False,False,asm,3,4,11.3437,_ZN5aiter39bf16gemm_fp32bf16_tn_48x64_splitk_cleanE,0.0137,5.92,1483.32
256,4,2048,4096,False,torch.bfloat16,torch.bfloat16,False,False,asm,8,5,11.4391,_ZN5aiter39bf16gemm_fp32bf16_tn_96x64_splitk_cleanE,0.0148,5.87,1470.95
256,4,2048,4096,False,torch.bfloat16,torch.bfloat16,False,False,asm,3,7,11.4719,_ZN5aiter39bf16gemm_fp32bf16_tn_48x64_splitk_cleanE,0.0206,5.85,1466.75
256,4,2048,4096,False,torch.bfloat16,torch.bfloat16,False,False,hipblaslt,440198,0,11.515,,0.0,5.83,1461.26
256,4,2048,4096,False,torch.bfloat16,torch.bfloat16,False,False,asm,5,4,11.5323,_ZN5aiter39bf16gemm_fp32bf16_tn_64x64_splitk_cleanE,0.0126,5.82,1459.06
256,4,2048,4096,False,torch.bfloat16,torch.bfloat16,False,False,asm,5,7,11.553,_ZN5aiter39bf16gemm_fp32bf16_tn_64x64_splitk_cleanE,0.0194,5.81,1456.45
256,4,2048,4096,False,torch.bfloat16,torch.bfloat16,False,False,asm,8,6,11.5967,_ZN5aiter39bf16gemm_fp32bf16_tn_96x64_splitk_cleanE,0.0187,5.79,1450.96
256,4,2048,4096,False,torch.bfloat16,torch.bfloat16,False,False,asm,7,7,11.7896,_ZN5aiter39bf16gemm_fp32bf16_tn_80x64_splitk_cleanE,0.0199,5.69,1427.22
256,4,2048,4096,False,torch.bfloat16,torch.bfloat16,False,False,asm,1,8,11.7981,_ZN5aiter39bf16gemm_fp32bf16_tn_32x64_splitk_cleanE,0.0214,5.69,1426.19
256,4,2048,4096,False,torch.bfloat16,torch.bfloat16,False,False,asm,7,4,11.911,_ZN5aiter39bf16gemm_fp32bf16_tn_80x64_splitk_cleanE,0.0127,5.63,1412.67
256,4,2048,4096,False,torch.bfloat16,torch.bfloat16,False,False,asm,3,8,11.9986,_ZN5aiter39bf16gemm_fp32bf16_tn_48x64_splitk_cleanE,0.0199,5.59,1402.36
256,4,2048,4096,False,torch.bfloat16,torch.bfloat16,False,False,asm,8,7,12.0584,_ZN5aiter39bf16gemm_fp32bf16_tn_96x64_splitk_cleanE,0.0178,5.57,1395.41
256,4,2048,4096,False,torch.bfloat16,torch.bfloat16,False,False,asm,1,3,12.0627,_ZN5aiter39bf16gemm_fp32bf16_tn_32x64_splitk_cleanE,0.0101,5.56,1394.91
256,4,2048,4096,False,torch.bfloat16,torch.bfloat16,False,False,asm,8,4,12.1856,_ZN5aiter39bf16gemm_fp32bf16_tn_96x64_splitk_cleanE,0.0133,5.51,1380.84
256,4,2048,4096,False,torch.bfloat16,torch.bfloat16,False,False,asm,5,8,12.1879,_ZN5aiter39bf16gemm_fp32bf16_tn_64x64_splitk_cleanE,0.0221,5.51,1380.58
256,4,2048,4096,False,torch.bfloat16,torch.bfloat16,False,False,asm,7,8,12.2735,_ZN5aiter39bf16gemm_fp32bf16_tn_80x64_splitk_cleanE,0.0219,5.47,1370.95
256,4,2048,4096,False,torch.bfloat16,torch.bfloat16,False,False,asm,3,3,12.4137,_ZN5aiter39bf16gemm_fp32bf16_tn_48x64_splitk_cleanE,0.0101,5.41,1355.47
256,4,2048,4096,False,torch.bfloat16,torch.bfloat16,False,False,asm,8,8,12.5102,_ZN5aiter39bf16gemm_fp32bf16_tn_96x64_splitk_cleanE,0.0217,5.36,1345.01
256,4,2048,4096,False,torch.bfloat16,torch.bfloat16,False,False,asm,5,3,12.7699,_ZN5aiter39bf16gemm_fp32bf16_tn_64x64_splitk_cleanE,0.0101,5.26,1317.66
256,4,2048,4096,False,torch.bfloat16,torch.bfloat16,False,False,asm,7,3,13.0604,_ZN5aiter39bf16gemm_fp32bf16_tn_80x64_splitk_cleanE,0.0101,5.14,1288.35
256,4,2048,4096,False,torch.bfloat16,torch.bfloat16,False,False,asm,8,3,13.4502,_ZN5aiter39bf16gemm_fp32bf16_tn_96x64_splitk_cleanE,0.0101,4.99,1251.01
256,4,2048,4096,False,torch.bfloat16,torch.bfloat16,False,False,asm,1,2,15.5258,_ZN5aiter39bf16gemm_fp32bf16_tn_32x64_splitk_cleanE,0.0061,4.32,1083.77
256,4,2048,4096,False,torch.bfloat16,torch.bfloat16,False,False,asm,3,2,15.9313,_ZN5aiter39bf16gemm_fp32bf16_tn_48x64_splitk_cleanE,0.0061,4.21,1056.18
256,4,2048,4096,False,torch.bfloat16,torch.bfloat16,False,False,asm,5,2,16.4664,_ZN5aiter39bf16gemm_fp32bf16_tn_64x64_splitk_cleanE,0.0061,4.08,1021.86
256,4,2048,4096,False,torch.bfloat16,torch.bfloat16,False,False,asm,7,2,16.7782,_ZN5aiter39bf16gemm_fp32bf16_tn_80x64_splitk_cleanE,0.0061,4.0,1002.87
256,4,2048,4096,False,torch.bfloat16,torch.bfloat16,False,False,asm,8,2,17.1572,_ZN5aiter39bf16gemm_fp32bf16_tn_96x64_splitk_cleanE,0.0061,3.91,980.72
256,4,2048,4096,False,torch.bfloat16,torch.bfloat16,False,False,asm,2,1,23.7723,_ZN5aiter37bf16gemm_fp32bf16_tn_32x64_pf3_splitkE,0.0,2.82,707.81
256,4,2048,4096,False,torch.bfloat16,torch.bfloat16,False,False,asm,4,1,24.4435,_ZN5aiter37bf16gemm_fp32bf16_tn_48x64_pf3_splitkE,0.0,2.75,688.38
256,4,2048,4096,False,torch.bfloat16,torch.bfloat16,False,False,asm,6,1,25.0987,_ZN5aiter37bf16gemm_fp32bf16_tn_64x64_pf3_splitkE,0.0,2.67,670.41
256,4,2048,4096,False,torch.bfloat16,torch.bfloat16,False,False,asm,9,1,26.5192,_ZN5aiter37bf16gemm_fp32bf16_tn_96x64_pf3_splitkE,0.0,2.53,634.5
256,4,2048,4096,False,torch.bfloat16,torch.bfloat16,False,False,asm,10,1,67.9252,_ZN5aiter24bf16gemm_bf16_tn_256x256E,0.0,0.99,247.72
256,8,2048,4096,False,torch.bfloat16,torch.bfloat16,False,False,hipblaslt,439082,0,7.984,,0.0,16.81,2113.67
256,8,2048,4096,False,torch.bfloat16,torch.bfloat16,False,False,hipblaslt,438410,0,7.995,,0.0,16.79,2110.76
256,8,2048,4096,False,torch.bfloat16,torch.bfloat16,False,False,hipblaslt,438818,0,8.0374,,0.0,16.7,2099.62
256,8,2048,4096,False,torch.bfloat16,torch.bfloat16,False,False,hipblaslt,438618,0,8.6129,,0.0,15.58,1959.33
256,8,2048,4096,False,torch.bfloat16,torch.bfloat16,False,False,hipblaslt,439064,0,8.6146,,0.0,15.58,1958.94
256,8,2048,4096,False,torch.bfloat16,torch.bfloat16,False,False,hipblaslt,440197,0,8.8088,,0.0,15.24,1915.76
256,8,2048,4096,False,torch.bfloat16,torch.bfloat16,False,False,hipblaslt,439080,0,9.034,,0.0,14.86,1868.0
256,8,2048,4096,False,torch.bfloat16,torch.bfloat16,False,False,hipblaslt,438688,0,9.0358,,0.0,14.85,1867.63
256,8,2048,4096,False,torch.bfloat16,torch.bfloat16,False,False,hipblaslt,439308,0,9.066,,0.0,14.8,1861.41
256,8,2048,4096,False,torch.bfloat16,torch.bfloat16,False,False,hipblaslt,439081,0,9.1557,,0.0,14.66,1843.17
256,8,2048,4096,False,torch.bfloat16,torch.bfloat16,False,False,hipblaslt,438755,0,9.3068,,0.0,14.42,1813.25
256,8,2048,4096,False,torch.bfloat16,torch.bfloat16,False,False,hipblaslt,438958,0,9.4007,,0.0,14.28,1795.13
256,8,2048,4096,False,torch.bfloat16,torch.bfloat16,False,False,hipblaslt,438549,0,9.4628,,0.0,14.18,1783.35
256,8,2048,4096,False,torch.bfloat16,torch.bfloat16,False,False,hipblaslt,438754,0,9.5084,,0.0,14.12,1774.8
256,8,2048,4096,False,torch.bfloat16,torch.bfloat16,False,False,hipblaslt,438936,0,9.6872,,0.0,13.86,1742.04
256,8,2048,4096,False,torch.bfloat16,torch.bfloat16,False,False,hipblaslt,438935,0,9.8938,,0.0,13.57,1705.67
256,8,2048,4096,False,torch.bfloat16,torch.bfloat16,False,False,hipblaslt,440202,0,9.9787,,0.0,13.45,1691.15
256,8,2048,4096,False,torch.bfloat16,torch.bfloat16,False,False,hipblaslt,439083,0,10.2554,,0.0,13.09,1645.53
256,8,2048,4096,False,torch.bfloat16,torch.bfloat16,False,False,asm,1,5,10.5499,_ZN5aiter39bf16gemm_fp32bf16_tn_32x64_splitk_cleanE,0.0139,12.72,1599.59
256,8,2048,4096,False,torch.bfloat16,torch.bfloat16,False,False,asm,1,6,10.7692,_ZN5aiter39bf16gemm_fp32bf16_tn_32x64_splitk_cleanE,0.0176,12.46,1567.02
256,8,2048,4096,False,torch.bfloat16,torch.bfloat16,False,False,asm,3,5,10.8579,_ZN5aiter39bf16gemm_fp32bf16_tn_48x64_splitk_cleanE,0.0137,12.36,1554.22
256,8,2048,4096,False,torch.bfloat16,torch.bfloat16,False,False,hipblaslt,438328,0,10.8791,,0.0,12.34,1551.19
256,8,2048,4096,False,torch.bfloat16,torch.bfloat16,False,False,asm,5,5,11.0576,_ZN5aiter39bf16gemm_fp32bf16_tn_64x64_splitk_cleanE,0.0143,12.14,1526.15
256,8,2048,4096,False,torch.bfloat16,torch.bfloat16,False,False,asm,1,4,11.0624,_ZN5aiter39bf16gemm_fp32bf16_tn_32x64_splitk_cleanE,0.0126,12.13,1525.48
256,8,2048,4096,False,torch.bfloat16,torch.bfloat16,False,False,asm,3,6,11.0781,_ZN5aiter39bf16gemm_fp32bf16_tn_48x64_splitk_cleanE,0.0165,12.12,1523.32
256,8,2048,4096,False,torch.bfloat16,torch.bfloat16,False,False,asm,5,6,11.1781,_ZN5aiter39bf16gemm_fp32bf16_tn_64x64_splitk_cleanE,0.0167,12.01,1509.69
256,8,2048,4096,False,torch.bfloat16,torch.bfloat16,False,False,asm,7,5,11.2879,_ZN5aiter39bf16gemm_fp32bf16_tn_80x64_splitk_cleanE,0.0136,11.89,1495.01
256,8,2048,4096,False,torch.bfloat16,torch.bfloat16,False,False,asm,7,6,11.3167,_ZN5aiter39bf16gemm_fp32bf16_tn_80x64_splitk_cleanE,0.0157,11.86,1491.21
256,8,2048,4096,False,torch.bfloat16,torch.bfloat16,False,False,asm,1,7,11.3274,_ZN5aiter39bf16gemm_fp32bf16_tn_32x64_splitk_cleanE,0.0172,11.85,1489.8
256,8,2048,4096,False,torch.bfloat16,torch.bfloat16,False,False,asm,3,4,11.4151,_ZN5aiter39bf16gemm_fp32bf16_tn_48x64_splitk_cleanE,0.0126,11.76,1478.35
256,8,2048,4096,False,torch.bfloat16,torch.bfloat16,False,False,asm,8,5,11.5638,_ZN5aiter39bf16gemm_fp32bf16_tn_96x64_splitk_cleanE,0.0135,11.61,1459.34
256,8,2048,4096,False,torch.bfloat16,torch.bfloat16,False,False,asm,3,7,11.5708,_ZN5aiter39bf16gemm_fp32bf16_tn_48x64_splitk_cleanE,0.0179,11.6,1458.46
256,8,2048,4096,False,torch.bfloat16,torch.bfloat16,False,False,asm,8,6,11.5976,_ZN5aiter39bf16gemm_fp32bf16_tn_96x64_splitk_cleanE,0.0167,11.57,1455.09
256,8,2048,4096,False,torch.bfloat16,torch.bfloat16,False,False,asm,5,4,11.6265,_ZN5aiter39bf16gemm_fp32bf16_tn_64x64_splitk_cleanE,0.0129,11.54,1451.47
256,8,2048,4096,False,torch.bfloat16,torch.bfloat16,False,False,hipblaslt,440198,0,11.6599,,0.0,11.51,1447.31
256,8,2048,4096,False,torch.bfloat16,torch.bfloat16,False,False,asm,5,7,11.6847,_ZN5aiter39bf16gemm_fp32bf16_tn_64x64_splitk_cleanE,0.0176,11.49,1444.24
256,8,2048,4096,False,torch.bfloat16,torch.bfloat16,False,False,asm,7,7,11.8116,_ZN5aiter39bf16gemm_fp32bf16_tn_80x64_splitk_cleanE,0.0179,11.36,1428.72
256,8,2048,4096,False,torch.bfloat16,torch.bfloat16,False,False,asm,1,8,11.8602,_ZN5aiter39bf16gemm_fp32bf16_tn_32x64_splitk_cleanE,0.0197,11.32,1422.87
256,8,2048,4096,False,torch.bfloat16,torch.bfloat16,False,False,asm,7,4,11.9005,_ZN5aiter39bf16gemm_fp32bf16_tn_80x64_splitk_cleanE,0.0129,11.28,1418.05
256,8,2048,4096,False,torch.bfloat16,torch.bfloat16,False,False,asm,8,7,12.0637,_ZN5aiter39bf16gemm_fp32bf16_tn_96x64_splitk_cleanE,0.0187,11.13,1398.87
256,8,2048,4096,False,torch.bfloat16,torch.bfloat16,False,False,asm,1,3,12.0762,_ZN5aiter39bf16gemm_fp32bf16_tn_32x64_splitk_cleanE,0.0091,11.11,1397.42
256,8,2048,4096,False,torch.bfloat16,torch.bfloat16,False,False,asm,3,8,12.154,_ZN5aiter39bf16gemm_fp32bf16_tn_48x64_splitk_cleanE,0.0195,11.04,1388.47
256,8,2048,4096,False,torch.bfloat16,torch.bfloat16,False,False,asm,8,4,12.2144,_ZN5aiter39bf16gemm_fp32bf16_tn_96x64_splitk_cleanE,0.0121,10.99,1381.61
256,8,2048,4096,False,torch.bfloat16,torch.bfloat16,False,False,asm,5,8,12.2353,_ZN5aiter39bf16gemm_fp32bf16_tn_64x64_splitk_cleanE,0.0198,10.97,1379.25
256,8,2048,4096,False,torch.bfloat16,torch.bfloat16,False,False,asm,7,8,12.3238,_ZN5aiter39bf16gemm_fp32bf16_tn_80x64_splitk_cleanE,0.0208,10.89,1369.34
256,8,2048,4096,False,torch.bfloat16,torch.bfloat16,False,False,asm,3,3,12.464,_ZN5aiter39bf16gemm_fp32bf16_tn_48x64_splitk_cleanE,0.0091,10.77,1353.94
256,8,2048,4096,False,torch.bfloat16,torch.bfloat16,False,False,asm,8,8,12.5623,_ZN5aiter39bf16gemm_fp32bf16_tn_96x64_splitk_cleanE,0.0203,10.68,1343.35
256,8,2048,4096,False,torch.bfloat16,torch.bfloat16,False,False,asm,5,3,12.7875,_ZN5aiter39bf16gemm_fp32bf16_tn_64x64_splitk_cleanE,0.0091,10.5,1319.69
256,8,2048,4096,False,torch.bfloat16,torch.bfloat16,False,False,asm,7,3,13.145,_ZN5aiter39bf16gemm_fp32bf16_tn_80x64_splitk_cleanE,0.0092,10.21,1283.8
256,8,2048,4096,False,torch.bfloat16,torch.bfloat16,False,False,asm,8,3,13.4349,_ZN5aiter39bf16gemm_fp32bf16_tn_96x64_splitk_cleanE,0.0092,9.99,1256.1
256,8,2048,4096,False,torch.bfloat16,torch.bfloat16,False,False,asm,1,2,15.623,_ZN5aiter39bf16gemm_fp32bf16_tn_32x64_splitk_cleanE,0.0056,8.59,1080.17
256,8,2048,4096,False,torch.bfloat16,torch.bfloat16,False,False,asm,3,2,16.054,_ZN5aiter39bf16gemm_fp32bf16_tn_48x64_splitk_cleanE,0.0056,8.36,1051.17
256,8,2048,4096,False,torch.bfloat16,torch.bfloat16,False,False,asm,5,2,16.4283,_ZN5aiter39bf16gemm_fp32bf16_tn_64x64_splitk_cleanE,0.0056,8.17,1027.22
256,8,2048,4096,False,torch.bfloat16,torch.bfloat16,False,False,asm,7,2,16.7929,_ZN5aiter39bf16gemm_fp32bf16_tn_80x64_splitk_cleanE,0.0056,7.99,1004.92
256,8,2048,4096,False,torch.bfloat16,torch.bfloat16,False,False,asm,8,2,17.2734,_ZN5aiter39bf16gemm_fp32bf16_tn_96x64_splitk_cleanE,0.0056,7.77,976.97
256,8,2048,4096,False,torch.bfloat16,torch.bfloat16,False,False,asm,2,1,23.9659,_ZN5aiter37bf16gemm_fp32bf16_tn_32x64_pf3_splitkE,0.0,5.6,704.15
256,8,2048,4096,False,torch.bfloat16,torch.bfloat16,False,False,asm,4,1,24.4582,_ZN5aiter37bf16gemm_fp32bf16_tn_48x64_pf3_splitkE,0.0,5.49,689.97
256,8,2048,4096,False,torch.bfloat16,torch.bfloat16,False,False,asm,6,1,25.1635,_ZN5aiter37bf16gemm_fp32bf16_tn_64x64_pf3_splitkE,0.0,5.33,670.63
256,8,2048,4096,False,torch.bfloat16,torch.bfloat16,False,False,asm,9,1,26.723,_ZN5aiter37bf16gemm_fp32bf16_tn_96x64_pf3_splitkE,0.0,5.02,631.5
256,8,2048,4096,False,torch.bfloat16,torch.bfloat16,False,False,asm,10,1,68.1832,_ZN5aiter24bf16gemm_bf16_tn_256x256E,0.0,1.97,247.5
256,16,2048,4096,False,torch.bfloat16,torch.bfloat16,False,False,hipblaslt,439082,0,8.3682,,0.0,32.08,2028.37
256,16,2048,4096,False,torch.bfloat16,torch.bfloat16,False,False,hipblaslt,438618,0,8.3754,,0.0,32.05,2026.63
256,16,2048,4096,False,torch.bfloat16,torch.bfloat16,False,False,hipblaslt,438818,0,8.7215,,0.0,30.78,1946.2
256,16,2048,4096,False,torch.bfloat16,torch.bfloat16,False,False,hipblaslt,439064,0,8.8374,,0.0,30.37,1920.68
256,16,2048,4096,False,torch.bfloat16,torch.bfloat16,False,False,hipblaslt,438410,0,8.8924,,0.0,30.19,1908.8
256,16,2048,4096,False,torch.bfloat16,torch.bfloat16,False,False,hipblaslt,438949,0,9.4132,,0.0,28.52,1803.19
256,16,2048,4096,False,torch.bfloat16,torch.bfloat16,False,False,hipblaslt,438958,0,9.4138,,0.0,28.52,1803.08
256,16,2048,4096,False,torch.bfloat16,torch.bfloat16,False,False,hipblaslt,439063,0,9.4229,,0.0,28.49,1801.34
256,16,2048,4096,False,torch.bfloat16,torch.bfloat16,False,False,hipblaslt,438549,0,9.4665,,0.0,28.36,1793.04
256,16,2048,4096,False,torch.bfloat16,torch.bfloat16,False,False,hipblaslt,438754,0,9.4835,,0.0,28.31,1789.83
256,16,2048,4096,False,torch.bfloat16,torch.bfloat16,False,False,hipblaslt,439081,0,9.5782,,0.0,28.03,1772.13
256,16,2048,4096,False,torch.bfloat16,torch.bfloat16,False,False,hipblaslt,439080,0,9.5871,,0.0,28.0,1770.49
256,16,2048,4096,False,torch.bfloat16,torch.bfloat16,False,False,hipblaslt,439688,0,9.8286,,0.0,27.31,1726.98
256,16,2048,4096,False,torch.bfloat16,torch.bfloat16,False,False,hipblaslt,440197,0,9.8676,,0.0,27.2,1720.16
256,16,2048,4096,False,torch.bfloat16,torch.bfloat16,False,False,hipblaslt,439065,0,10.0431,,0.0,26.73,1690.1
256,16,2048,4096,False,torch.bfloat16,torch.bfloat16,False,False,hipblaslt,439379,0,10.1682,,0.0,26.4,1669.3
256,16,2048,4096,False,torch.bfloat16,torch.bfloat16,False,False,hipblaslt,440202,0,10.235,,0.0,26.23,1658.41
256,16,2048,4096,False,torch.bfloat16,torch.bfloat16,False,False,hipblaslt,438936,0,10.4227,,0.0,25.75,1628.54
256,16,2048,4096,False,torch.bfloat16,torch.bfloat16,False,False,asm,1,5,10.6174,_ZN5aiter39bf16gemm_fp32bf16_tn_32x64_splitk_cleanE,0.0152,25.28,1598.68
256,16,2048,4096,False,torch.bfloat16,torch.bfloat16,False,False,asm,3,5,10.8717,_ZN5aiter39bf16gemm_fp32bf16_tn_48x64_splitk_cleanE,0.0146,24.69,1561.29
256,16,2048,4096,False,torch.bfloat16,torch.bfloat16,False,False,hipblaslt,438606,0,10.8799,,0.0,24.67,1560.11
256,16,2048,4096,False,torch.bfloat16,torch.bfloat16,False,False,asm,1,6,10.9113,_ZN5aiter39bf16gemm_fp32bf16_tn_32x64_splitk_cleanE,0.0168,24.6,1555.62
256,16,2048,4096,False,torch.bfloat16,torch.bfloat16,False,False,hipblaslt,438328,0,11.057,,0.0,24.28,1535.12
256,16,2048,4096,False,torch.bfloat16,torch.bfloat16,False,False,asm,3,6,11.1087,_ZN5aiter39bf16gemm_fp32bf16_tn_48x64_splitk_cleanE,0.0164,24.16,1527.98
256,16,2048,4096,False,torch.bfloat16,torch.bfloat16,False,False,asm,1,4,11.1725,_ZN5aiter39bf16gemm_fp32bf16_tn_32x64_splitk_cleanE,0.0121,24.03,1519.25
256,16,2048,4096,False,torch.bfloat16,torch.bfloat16,False,False,asm,5,5,11.1735,_ZN5aiter39bf16gemm_fp32bf16_tn_64x64_splitk_cleanE,0.0149,24.02,1519.11
256,16,2048,4096,False,torch.bfloat16,torch.bfloat16,False,False,asm,5,6,11.3135,_ZN5aiter39bf16gemm_fp32bf16_tn_64x64_splitk_cleanE,0.0166,23.73,1500.32
256,16,2048,4096,False,torch.bfloat16,torch.bfloat16,False,False,asm,7,5,11.3191,_ZN5aiter39bf16gemm_fp32bf16_tn_80x64_splitk_cleanE,0.0147,23.72,1499.57
256,16,2048,4096,False,torch.bfloat16,torch.bfloat16,False,False,asm,1,7,11.3886,_ZN5aiter39bf16gemm_fp32bf16_tn_32x64_splitk_cleanE,0.0177,23.57,1490.42
256,16,2048,4096,False,torch.bfloat16,torch.bfloat16,False,False,asm,3,4,11.4316,_ZN5aiter39bf16gemm_fp32bf16_tn_48x64_splitk_cleanE,0.0123,23.48,1484.82
256,16,2048,4096,False,torch.bfloat16,torch.bfloat16,False,False,asm,7,6,11.4504,_ZN5aiter39bf16gemm_fp32bf16_tn_80x64_splitk_cleanE,0.0162,23.44,1482.38
256,16,2048,4096,False,torch.bfloat16,torch.bfloat16,False,False,asm,3,7,11.6588,_ZN5aiter39bf16gemm_fp32bf16_tn_48x64_splitk_cleanE,0.0179,23.02,1455.88
256,16,2048,4096,False,torch.bfloat16,torch.bfloat16,False,False,asm,8,5,11.6648,_ZN5aiter39bf16gemm_fp32bf16_tn_96x64_splitk_cleanE,0.0154,23.01,1455.13
256,16,2048,4096,False,torch.bfloat16,torch.bfloat16,False,False,asm,8,6,11.6893,_ZN5aiter39bf16gemm_fp32bf16_tn_96x64_splitk_cleanE,0.0168,22.96,1452.08
256,16,2048,4096,False,torch.bfloat16,torch.bfloat16,False,False,asm,5,4,11.766,_ZN5aiter39bf16gemm_fp32bf16_tn_64x64_splitk_cleanE,0.0122,22.81,1442.62
256,16,2048,4096,False,torch.bfloat16,torch.bfloat16,False,False,asm,5,7,11.8653,_ZN5aiter39bf16gemm_fp32bf16_tn_64x64_splitk_cleanE,0.0184,22.62,1430.54
256,16,2048,4096,False,torch.bfloat16,torch.bfloat16,False,False,asm,1,8,11.9019,_ZN5aiter39bf16gemm_fp32bf16_tn_32x64_splitk_cleanE,0.0198,22.55,1426.14
256,16,2048,4096,False,torch.bfloat16,torch.bfloat16,False,False,asm,7,4,11.913,_ZN5aiter39bf16gemm_fp32bf16_tn_80x64_splitk_cleanE,0.0115,22.53,1424.82
256,16,2048,4096,False,torch.bfloat16,torch.bfloat16,False,False,asm,7,7,11.9279,_ZN5aiter39bf16gemm_fp32bf16_tn_80x64_splitk_cleanE,0.0173,22.5,1423.04
256,16,2048,4096,False,torch.bfloat16,torch.bfloat16,False,False,asm,1,3,12.1256,_ZN5aiter39bf16gemm_fp32bf16_tn_32x64_splitk_cleanE,0.009,22.14,1399.83
256,16,2048,4096,False,torch.bfloat16,torch.bfloat16,False,False,asm,3,8,12.174,_ZN5aiter39bf16gemm_fp32bf16_tn_48x64_splitk_cleanE,0.0197,22.05,1394.27
256,16,2048,4096,False,torch.bfloat16,torch.bfloat16,False,False,asm,5,8,12.2047,_ZN5aiter39bf16gemm_fp32bf16_tn_64x64_splitk_cleanE,0.0188,21.99,1390.76
256,16,2048,4096,False,torch.bfloat16,torch.bfloat16,False,False,asm,8,7,12.2107,_ZN5aiter39bf16gemm_fp32bf16_tn_96x64_splitk_cleanE,0.0175,21.98,1390.08
256,16,2048,4096,False,torch.bfloat16,torch.bfloat16,False,False,asm,8,4,12.2419,_ZN5aiter39bf16gemm_fp32bf16_tn_96x64_splitk_cleanE,0.0123,21.93,1386.54
256,16,2048,4096,False,torch.bfloat16,torch.bfloat16,False,False,asm,3,3,12.5084,_ZN5aiter39bf16gemm_fp32bf16_tn_48x64_splitk_cleanE,0.009,21.46,1356.99
256,16,2048,4096,False,torch.bfloat16,torch.bfloat16,False,False,asm,7,8,12.5163,_ZN5aiter39bf16gemm_fp32bf16_tn_80x64_splitk_cleanE,0.0194,21.45,1356.14
256,16,2048,4096,False,torch.bfloat16,torch.bfloat16,False,False,asm,8,8,12.7341,_ZN5aiter39bf16gemm_fp32bf16_tn_96x64_splitk_cleanE,0.02,21.08,1332.94
256,16,2048,4096,False,torch.bfloat16,torch.bfloat16,False,False,asm,5,3,12.9048,_ZN5aiter39bf16gemm_fp32bf16_tn_64x64_splitk_cleanE,0.0089,20.8,1315.31
256,16,2048,4096,False,torch.bfloat16,torch.bfloat16,False,False,asm,7,3,13.1446,_ZN5aiter39bf16gemm_fp32bf16_tn_80x64_splitk_cleanE,0.009,20.42,1291.32
256,16,2048,4096,False,torch.bfloat16,torch.bfloat16,False,False,asm,8,3,13.552,_ZN5aiter39bf16gemm_fp32bf16_tn_96x64_splitk_cleanE,0.0092,19.81,1252.5
256,16,2048,4096,False,torch.bfloat16,torch.bfloat16,False,False,asm,1,2,15.6391,_ZN5aiter39bf16gemm_fp32bf16_tn_32x64_splitk_cleanE,0.005,17.16,1085.35
256,16,2048,4096,False,torch.bfloat16,torch.bfloat16,False,False,asm,3,2,16.1334,_ZN5aiter39bf16gemm_fp32bf16_tn_48x64_splitk_cleanE,0.005,16.64,1052.09
256,16,2048,4096,False,torch.bfloat16,torch.bfloat16,False,False,asm,5,2,16.4918,_ZN5aiter39bf16gemm_fp32bf16_tn_64x64_splitk_cleanE,0.005,16.28,1029.23
256,16,2048,4096,False,torch.bfloat16,torch.bfloat16,False,False,asm,7,2,16.7623,_ZN5aiter39bf16gemm_fp32bf16_tn_80x64_splitk_cleanE,0.005,16.01,1012.62
256,16,2048,4096,False,torch.bfloat16,torch.bfloat16,False,False,asm,8,2,17.3543,_ZN5aiter39bf16gemm_fp32bf16_tn_96x64_splitk_cleanE,0.005,15.47,978.08
256,16,2048,4096,False,torch.bfloat16,torch.bfloat16,False,False,asm,2,1,23.912,_ZN5aiter37bf16gemm_fp32bf16_tn_32x64_pf3_splitkE,0.0,11.23,709.85
256,16,2048,4096,False,torch.bfloat16,torch.bfloat16,False,False,asm,4,1,24.6912,_ZN5aiter37bf16gemm_fp32bf16_tn_48x64_pf3_splitkE,0.0,10.87,687.44
256,16,2048,4096,False,torch.bfloat16,torch.bfloat16,False,False,asm,6,1,25.3606,_ZN5aiter37bf16gemm_fp32bf16_tn_64x64_pf3_splitkE,0.0,10.58,669.3
256,16,2048,4096,False,torch.bfloat16,torch.bfloat16,False,False,asm,9,1,26.744,_ZN5aiter37bf16gemm_fp32bf16_tn_96x64_pf3_splitkE,0.0,10.04,634.68
256,16,2048,4096,False,torch.bfloat16,torch.bfloat16,False,False,asm,10,1,68.7792,_ZN5aiter24bf16gemm_bf16_tn_256x256E,0.0,3.9,246.79
256,32,2048,4096,False,torch.bfloat16,torch.bfloat16,False,False,hipblaslt,440197,0,9.6521,,0.0,55.62,1778.93
256,32,2048,4096,False,torch.bfloat16,torch.bfloat16,False,False,hipblaslt,439065,0,9.7069,,0.0,55.31,1768.89
256,32,2048,4096,False,torch.bfloat16,torch.bfloat16,False,False,hipblaslt,438688,0,9.8113,,0.0,54.72,1750.07
256,32,2048,4096,False,torch.bfloat16,torch.bfloat16,False,False,hipblaslt,439066,0,10.097,,0.0,53.17,1700.55
256,32,2048,4096,False,torch.bfloat16,torch.bfloat16,False,False,hipblaslt,439331,0,10.1746,,0.0,52.77,1687.58
256,32,2048,4096,False,torch.bfloat16,torch.bfloat16,False,False,hipblaslt,438481,0,10.2129,,0.0,52.57,1681.25
256,32,2048,4096,False,torch.bfloat16,torch.bfloat16,False,False,hipblaslt,440202,0,10.3133,,0.0,52.06,1664.88
256,32,2048,4096,False,torch.bfloat16,torch.bfloat16,False,False,hipblaslt,439688,0,10.3452,,0.0,51.9,1659.75
256,32,2048,4096,False,torch.bfloat16,torch.bfloat16,False,False,hipblaslt,438818,0,10.4174,,0.0,51.54,1648.25
256,32,2048,4096,False,torch.bfloat16,torch.bfloat16,False,False,hipblaslt,438957,0,10.4391,,0.0,51.43,1644.82
256,32,2048,4096,False,torch.bfloat16,torch.bfloat16,False,False,hipblaslt,439082,0,10.5949,,0.0,50.67,1620.63
256,32,2048,4096,False,torch.bfloat16,torch.bfloat16,False,False,hipblaslt,439064,0,10.6791,,0.0,50.27,1607.85
256,32,2048,4096,False,torch.bfloat16,torch.bfloat16,False,False,asm,1,5,10.6988,_ZN5aiter39bf16gemm_fp32bf16_tn_32x64_splitk_cleanE,0.0141,50.18,1604.89
256,32,2048,4096,False,torch.bfloat16,torch.bfloat16,False,False,hipblaslt,439686,0,10.7779,,0.0,49.81,1593.11
256,32,2048,4096,False,torch.bfloat16,torch.bfloat16,False,False,hipblaslt,439945,0,10.8586,,0.0,49.44,1581.27
256,32,2048,4096,False,torch.bfloat16,torch.bfloat16,False,False,hipblaslt,438410,0,10.8682,,0.0,49.4,1579.88
256,32,2048,4096,False,torch.bfloat16,torch.bfloat16,False,False,hipblaslt,438606,0,10.9558,,0.0,49.0,1567.25
256,32,2048,4096,False,torch.bfloat16,torch.bfloat16,False,False,asm,3,5,11.0541,_ZN5aiter39bf16gemm_fp32bf16_tn_48x64_splitk_cleanE,0.0141,48.57,1553.31
256,32,2048,4096,False,torch.bfloat16,torch.bfloat16,False,False,asm,1,6,11.0883,_ZN5aiter39bf16gemm_fp32bf16_tn_32x64_splitk_cleanE,0.0168,48.42,1548.52
256,32,2048,4096,False,torch.bfloat16,torch.bfloat16,False,False,hipblaslt,438958,0,11.1004,,0.0,48.37,1546.83
256,32,2048,4096,False,torch.bfloat16,torch.bfloat16,False,False,asm,1,4,11.2641,_ZN5aiter39bf16gemm_fp32bf16_tn_32x64_splitk_cleanE,0.0121,47.66,1524.35
256,32,2048,4096,False,torch.bfloat16,torch.bfloat16,False,False,asm,5,5,11.2981,_ZN5aiter39bf16gemm_fp32bf16_tn_64x64_splitk_cleanE,0.014,47.52,1519.76
256,32,2048,4096,False,torch.bfloat16,torch.bfloat16,False,False,asm,3,6,11.4262,_ZN5aiter39bf16gemm_fp32bf16_tn_48x64_splitk_cleanE,0.0155,46.99,1502.72
256,32,2048,4096,False,torch.bfloat16,torch.bfloat16,False,False,asm,5,6,11.4414,_ZN5aiter39bf16gemm_fp32bf16_tn_64x64_splitk_cleanE,0.0166,46.92,1500.73
256,32,2048,4096,False,torch.bfloat16,torch.bfloat16,False,False,asm,7,5,11.5177,_ZN5aiter39bf16gemm_fp32bf16_tn_80x64_splitk_cleanE,0.0143,46.61,1490.79
256,32,2048,4096,False,torch.bfloat16,torch.bfloat16,False,False,asm,3,4,11.617,_ZN5aiter39bf16gemm_fp32bf16_tn_48x64_splitk_cleanE,0.012,46.21,1478.04
256,32,2048,4096,False,torch.bfloat16,torch.bfloat16,False,False,asm,1,7,11.6514,_ZN5aiter39bf16gemm_fp32bf16_tn_32x64_splitk_cleanE,0.0173,46.08,1473.68
256,32,2048,4096,False,torch.bfloat16,torch.bfloat16,False,False,asm,8,5,11.74,_ZN5aiter39bf16gemm_fp32bf16_tn_96x64_splitk_cleanE,0.014,45.73,1462.56
256,32,2048,4096,False,torch.bfloat16,torch.bfloat16,False,False,asm,7,6,11.7726,_ZN5aiter39bf16gemm_fp32bf16_tn_80x64_splitk_cleanE,0.0167,45.6,1458.51
256,32,2048,4096,False,torch.bfloat16,torch.bfloat16,False,False,asm,3,7,11.8907,_ZN5aiter39bf16gemm_fp32bf16_tn_48x64_splitk_cleanE,0.0179,45.15,1444.02
256,32,2048,4096,False,torch.bfloat16,torch.bfloat16,False,False,asm,8,6,11.9862,_ZN5aiter39bf16gemm_fp32bf16_tn_96x64_splitk_cleanE,0.0158,44.79,1432.52
256,32,2048,4096,False,torch.bfloat16,torch.bfloat16,False,False,asm,5,4,11.9878,_ZN5aiter39bf16gemm_fp32bf16_tn_64x64_splitk_cleanE,0.012,44.78,1432.33
256,32,2048,4096,False,torch.bfloat16,torch.bfloat16,False,False,asm,5,7,12.0665,_ZN5aiter39bf16gemm_fp32bf16_tn_64x64_splitk_cleanE,0.0175,44.49,1422.98
256,32,2048,4096,False,torch.bfloat16,torch.bfloat16,False,False,asm,7,4,12.1313,_ZN5aiter39bf16gemm_fp32bf16_tn_80x64_splitk_cleanE,0.0118,44.26,1415.38
256,32,2048,4096,False,torch.bfloat16,torch.bfloat16,False,False,hipblaslt,438939,0,12.2105,,0.0,43.97,1406.2
256,32,2048,4096,False,torch.bfloat16,torch.bfloat16,False,False,asm,1,3,12.2174,_ZN5aiter39bf16gemm_fp32bf16_tn_32x64_splitk_cleanE,0.0087,43.94,1405.41
256,32,2048,4096,False,torch.bfloat16,torch.bfloat16,False,False,asm,1,8,12.2316,_ZN5aiter39bf16gemm_fp32bf16_tn_32x64_splitk_cleanE,0.0189,43.89,1403.78
256,32,2048,4096,False,torch.bfloat16,torch.bfloat16,False,False,asm,7,7,12.2541,_ZN5aiter39bf16gemm_fp32bf16_tn_80x64_splitk_cleanE,0.0173,43.81,1401.2
256,32,2048,4096,False,torch.bfloat16,torch.bfloat16,False,False,asm,8,4,12.4173,_ZN5aiter39bf16gemm_fp32bf16_tn_96x64_splitk_cleanE,0.0119,43.24,1382.78
256,32,2048,4096,False,torch.bfloat16,torch.bfloat16,False,False,asm,3,8,12.5825,_ZN5aiter39bf16gemm_fp32bf16_tn_48x64_splitk_cleanE,0.0191,42.67,1364.63
256,32,2048,4096,False,torch.bfloat16,torch.bfloat16,False,False,asm,8,7,12.674,_ZN5aiter39bf16gemm_fp32bf16_tn_96x64_splitk_cleanE,0.0174,42.36,1354.78
256,32,2048,4096,False,torch.bfloat16,torch.bfloat16,False,False,asm,5,8,12.6809,_ZN5aiter39bf16gemm_fp32bf16_tn_64x64_splitk_cleanE,0.0194,42.34,1354.04
256,32,2048,4096,False,torch.bfloat16,torch.bfloat16,False,False,asm,7,8,12.7655,_ZN5aiter39bf16gemm_fp32bf16_tn_80x64_splitk_cleanE,0.0197,42.06,1345.07
256,32,2048,4096,False,torch.bfloat16,torch.bfloat16,False,False,asm,3,3,12.8129,_ZN5aiter39bf16gemm_fp32bf16_tn_48x64_splitk_cleanE,0.0086,41.9,1340.09
256,32,2048,4096,False,torch.bfloat16,torch.bfloat16,False,False,hipblaslt,440113,0,12.9898,,0.0,41.33,1321.84
256,32,2048,4096,False,torch.bfloat16,torch.bfloat16,False,False,hipblaslt,438540,0,13.024,,0.0,41.22,1318.37
256,32,2048,4096,False,torch.bfloat16,torch.bfloat16,False,False,asm,5,3,13.0715,_ZN5aiter39bf16gemm_fp32bf16_tn_64x64_splitk_cleanE,0.0088,41.07,1313.58
256,32,2048,4096,False,torch.bfloat16,torch.bfloat16,False,False,asm,8,8,13.1044,_ZN5aiter39bf16gemm_fp32bf16_tn_96x64_splitk_cleanE,0.0192,40.97,1310.28
256,32,2048,4096,False,torch.bfloat16,torch.bfloat16,False,False,asm,7,3,13.3743,_ZN5aiter39bf16gemm_fp32bf16_tn_80x64_splitk_cleanE,0.0087,40.14,1283.84
256,32,2048,4096,False,torch.bfloat16,torch.bfloat16,False,False,asm,8,3,13.7664,_ZN5aiter39bf16gemm_fp32bf16_tn_96x64_splitk_cleanE,0.0087,39.0,1247.27
256,32,2048,4096,False,torch.bfloat16,torch.bfloat16,False,False,asm,1,2,15.6631,_ZN5aiter39bf16gemm_fp32bf16_tn_32x64_splitk_cleanE,0.005,34.28,1096.23
256,32,2048,4096,False,torch.bfloat16,torch.bfloat16,False,False,asm,3,2,16.2208,_ZN5aiter39bf16gemm_fp32bf16_tn_48x64_splitk_cleanE,0.005,33.1,1058.54
256,32,2048,4096,False,torch.bfloat16,torch.bfloat16,False,False,asm,5,2,16.5758,_ZN5aiter39bf16gemm_fp32bf16_tn_64x64_splitk_cleanE,0.005,32.39,1035.87
256,32,2048,4096,False,torch.bfloat16,torch.bfloat16,False,False,asm,7,2,17.0753,_ZN5aiter39bf16gemm_fp32bf16_tn_80x64_splitk_cleanE,0.005,31.44,1005.57
256,32,2048,4096,False,torch.bfloat16,torch.bfloat16,False,False,asm,8,2,17.48,_ZN5aiter39bf16gemm_fp32bf16_tn_96x64_splitk_cleanE,0.005,30.71,982.29
256,32,2048,4096,False,torch.bfloat16,torch.bfloat16,False,False,asm,2,1,24.1461,_ZN5aiter37bf16gemm_fp32bf16_tn_32x64_pf3_splitkE,0.0,22.23,711.11
256,32,2048,4096,False,torch.bfloat16,torch.bfloat16,False,False,asm,4,1,24.8825,_ZN5aiter37bf16gemm_fp32bf16_tn_48x64_pf3_splitkE,0.0,21.58,690.06
256,32,2048,4096,False,torch.bfloat16,torch.bfloat16,False,False,asm,6,1,25.3684,_ZN5aiter37bf16gemm_fp32bf16_tn_64x64_pf3_splitkE,0.0,21.16,676.84
256,32,2048,4096,False,torch.bfloat16,torch.bfloat16,False,False,asm,9,1,26.8925,_ZN5aiter37bf16gemm_fp32bf16_tn_96x64_pf3_splitkE,0.0,19.96,638.48
256,32,2048,4096,False,torch.bfloat16,torch.bfloat16,False,False,asm,10,1,68.8695,_ZN5aiter24bf16gemm_bf16_tn_256x256E,0.0,7.8,249.32
256,64,2048,4096,False,torch.bfloat16,torch.bfloat16,False,False,hipblaslt,438688,0,10.3487,,0.0,103.76,1697.18
256,64,2048,4096,False,torch.bfloat16,torch.bfloat16,False,False,hipblaslt,438755,0,10.6935,,0.0,100.41,1642.46
256,64,2048,4096,False,torch.bfloat16,torch.bfloat16,False,False,hipblaslt,439066,0,10.8151,,0.0,99.28,1623.99
256,64,2048,4096,False,torch.bfloat16,torch.bfloat16,False,False,hipblaslt,439686,0,11.1321,,0.0,96.45,1577.75
256,64,2048,4096,False,torch.bfloat16,torch.bfloat16,False,False,asm,1,4,11.4922,_ZN5aiter39bf16gemm_fp32bf16_tn_32x64_splitk_cleanE,0.0123,93.43,1528.31
256,64,2048,4096,False,torch.bfloat16,torch.bfloat16,False,False,asm,5,5,11.5005,_ZN5aiter39bf16gemm_fp32bf16_tn_64x64_splitk_cleanE,0.0141,93.36,1527.21
256,64,2048,4096,False,torch.bfloat16,torch.bfloat16,False,False,hipblaslt,440200,0,11.6652,,0.0,92.05,1505.64
256,64,2048,4096,False,torch.bfloat16,torch.bfloat16,False,False,hipblaslt,438888,0,11.7736,,0.0,91.2,1491.78
256,64,2048,4096,False,torch.bfloat16,torch.bfloat16,False,False,asm,5,6,11.7977,_ZN5aiter39bf16gemm_fp32bf16_tn_64x64_splitk_cleanE,0.0165,91.01,1488.73
256,64,2048,4096,False,torch.bfloat16,torch.bfloat16,False,False,hipblaslt,439684,0,11.8365,,0.0,90.71,1483.85
256,64,2048,4096,False,torch.bfloat16,torch.bfloat16,False,False,asm,3,4,11.8561,_ZN5aiter39bf16gemm_fp32bf16_tn_48x64_splitk_cleanE,0.0118,90.56,1481.4
256,64,2048,4096,False,torch.bfloat16,torch.bfloat16,False,False,asm,7,5,12.0286,_ZN5aiter39bf16gemm_fp32bf16_tn_80x64_splitk_cleanE,0.0137,89.27,1460.16
256,64,2048,4096,False,torch.bfloat16,torch.bfloat16,False,False,asm,5,4,12.0891,_ZN5aiter39bf16gemm_fp32bf16_tn_64x64_splitk_cleanE,0.012,88.82,1452.85
256,64,2048,4096,False,torch.bfloat16,torch.bfloat16,False,False,asm,7,6,12.1062,_ZN5aiter39bf16gemm_fp32bf16_tn_80x64_splitk_cleanE,0.0161,88.69,1450.8
256,64,2048,4096,False,torch.bfloat16,torch.bfloat16,False,False,asm,8,5,12.2441,_ZN5aiter39bf16gemm_fp32bf16_tn_96x64_splitk_cleanE,0.014,87.69,1434.46
256,64,2048,4096,False,torch.bfloat16,torch.bfloat16,False,False,asm,8,6,12.3103,_ZN5aiter39bf16gemm_fp32bf16_tn_96x64_splitk_cleanE,0.0161,87.22,1426.74
256,64,2048,4096,False,torch.bfloat16,torch.bfloat16,False,False,asm,5,7,12.326,_ZN5aiter39bf16gemm_fp32bf16_tn_64x64_splitk_cleanE,0.0176,87.11,1424.93
256,64,2048,4096,False,torch.bfloat16,torch.bfloat16,False,False,hipblaslt,439331,0,12.3524,,0.0,86.93,1421.88
256,64,2048,4096,False,torch.bfloat16,torch.bfloat16,False,False,asm,1,3,12.3639,_ZN5aiter39bf16gemm_fp32bf16_tn_32x64_splitk_cleanE,0.0088,86.84,1420.56
256,64,2048,4096,False,torch.bfloat16,torch.bfloat16,False,False,hipblaslt,438819,0,12.4986,,0.0,85.91,1405.25
256,64,2048,4096,False,torch.bfloat16,torch.bfloat16,False,False,hipblaslt,439689,0,12.5779,,0.0,85.37,1396.39
256,64,2048,4096,False,torch.bfloat16,torch.bfloat16,False,False,asm,7,4,12.59,_ZN5aiter39bf16gemm_fp32bf16_tn_80x64_splitk_cleanE,0.0121,85.29,1395.05
256,64,2048,4096,False,torch.bfloat16,torch.bfloat16,False,False,asm,7,7,12.6008,_ZN5aiter39bf16gemm_fp32bf16_tn_80x64_splitk_cleanE,0.0175,85.21,1393.85
256,64,2048,4096,False,torch.bfloat16,torch.bfloat16,False,False,hipblaslt,439385,0,12.6211,,0.0,85.08,1391.61
256,64,2048,4096,False,torch.bfloat16,torch.bfloat16,False,False,hipblaslt,439681,0,12.6328,,0.0,85.0,1390.32
256,64,2048,4096,False,torch.bfloat16,torch.bfloat16,False,False,hipblaslt,438957,0,12.6591,,0.0,84.82,1387.43
256,64,2048,4096,False,torch.bfloat16,torch.bfloat16,False,False,asm,3,3,12.7005,_ZN5aiter39bf16gemm_fp32bf16_tn_48x64_splitk_cleanE,0.0089,84.54,1382.91
256,64,2048,4096,False,torch.bfloat16,torch.bfloat16,False,False,asm,8,4,12.806,_ZN5aiter39bf16gemm_fp32bf16_tn_96x64_splitk_cleanE,0.0123,83.85,1371.52
256,64,2048,4096,False,torch.bfloat16,torch.bfloat16,False,False,asm,8,7,12.89,_ZN5aiter39bf16gemm_fp32bf16_tn_96x64_splitk_cleanE,0.0174,83.3,1362.58
256,64,2048,4096,False,torch.bfloat16,torch.bfloat16,False,False,asm,5,8,12.9701,_ZN5aiter39bf16gemm_fp32bf16_tn_64x64_splitk_cleanE,0.0191,82.79,1354.16
256,64,2048,4096,False,torch.bfloat16,torch.bfloat16,False,False,hipblaslt,438411,0,13.1044,,0.0,81.94,1340.29
256,64,2048,4096,False,torch.bfloat16,torch.bfloat16,False,False,hipblaslt,438938,0,13.2097,,0.0,81.28,1329.6
256,64,2048,4096,False,torch.bfloat16,torch.bfloat16,False,False,asm,7,8,13.297,_ZN5aiter39bf16gemm_fp32bf16_tn_80x64_splitk_cleanE,0.019,80.75,1320.87
256,64,2048,4096,False,torch.bfloat16,torch.bfloat16,False,False,hipblaslt,440195,0,13.2995,,0.0,80.74,1320.62
256,64,2048,4096,False,torch.bfloat16,torch.bfloat16,False,False,asm,5,3,13.3445,_ZN5aiter39bf16gemm_fp32bf16_tn_64x64_splitk_cleanE,0.0088,80.46,1316.17
256,64,2048,4096,False,torch.bfloat16,torch.bfloat16,False,False,asm,8,8,13.3945,_ZN5aiter39bf16gemm_fp32bf16_tn_96x64_splitk_cleanE,0.0188,80.16,1311.26
256,64,2048,4096,False,torch.bfloat16,torch.bfloat16,False,False,hipblaslt,438550,0,13.4467,,0.0,79.85,1306.17
256,64,2048,4096,False,torch.bfloat16,torch.bfloat16,False,False,asm,7,3,13.8486,_ZN5aiter39bf16gemm_fp32bf16_tn_80x64_splitk_cleanE,0.0088,77.53,1268.26
256,64,2048,4096,False,torch.bfloat16,torch.bfloat16,False,False,hipblaslt,440112,0,14.0128,,0.0,76.63,1253.4
256,64,2048,4096,False,torch.bfloat16,torch.bfloat16,False,False,hipblaslt,438292,0,14.179,,0.0,75.73,1238.71
256,64,2048,4096,False,torch.bfloat16,torch.bfloat16,False,False,asm,8,3,14.1859,_ZN5aiter39bf16gemm_fp32bf16_tn_96x64_splitk_cleanE,0.0089,75.69,1238.11
256,64,2048,4096,False,torch.bfloat16,torch.bfloat16,False,False,hipblaslt,440208,0,14.2708,,0.0,75.24,1230.74
256,64,2048,4096,False,torch.bfloat16,torch.bfloat16,False,False,asm,1,2,15.7121,_ZN5aiter39bf16gemm_fp32bf16_tn_32x64_splitk_cleanE,0.005,68.34,1117.84
256,64,2048,4096,False,torch.bfloat16,torch.bfloat16,False,False,asm,3,2,16.2841,_ZN5aiter39bf16gemm_fp32bf16_tn_48x64_splitk_cleanE,0.005,65.94,1078.58
256,64,2048,4096,False,torch.bfloat16,torch.bfloat16,False,False,asm,5,2,16.9605,_ZN5aiter39bf16gemm_fp32bf16_tn_64x64_splitk_cleanE,0.005,63.31,1035.56
256,64,2048,4096,False,torch.bfloat16,torch.bfloat16,False,False,asm,7,2,17.5717,_ZN5aiter39bf16gemm_fp32bf16_tn_80x64_splitk_cleanE,0.005,61.11,999.54
256,64,2048,4096,False,torch.bfloat16,torch.bfloat16,False,False,asm,8,2,18.1643,_ZN5aiter39bf16gemm_fp32bf16_tn_96x64_splitk_cleanE,0.005,59.11,966.93
256,64,2048,4096,False,torch.bfloat16,torch.bfloat16,False,False,asm,2,1,24.1808,_ZN5aiter37bf16gemm_fp32bf16_tn_32x64_pf3_splitkE,0.0,44.4,726.35
256,64,2048,4096,False,torch.bfloat16,torch.bfloat16,False,False,asm,4,1,24.8129,_ZN5aiter37bf16gemm_fp32bf16_tn_48x64_pf3_splitkE,0.0,43.27,707.84
256,64,2048,4096,False,torch.bfloat16,torch.bfloat16,False,False,asm,6,1,26.1911,_ZN5aiter37bf16gemm_fp32bf16_tn_64x64_pf3_splitkE,0.0,41.0,670.6
256,64,2048,4096,False,torch.bfloat16,torch.bfloat16,False,False,asm,9,1,27.4926,_ZN5aiter37bf16gemm_fp32bf16_tn_96x64_pf3_splitkE,0.0,39.06,638.85
256,64,2048,4096,False,torch.bfloat16,torch.bfloat16,False,False,asm,10,1,69.1947,_ZN5aiter24bf16gemm_bf16_tn_256x256E,0.0,15.52,253.83
256,128,2048,4096,False,torch.bfloat16,torch.bfloat16,False,False,asm,5,4,12.5633,_ZN5aiter39bf16gemm_fp32bf16_tn_64x64_splitk_cleanE,0.0113,170.93,1460.61
256,128,2048,4096,False,torch.bfloat16,torch.bfloat16,False,False,asm,7,4,13.0147,_ZN5aiter39bf16gemm_fp32bf16_tn_80x64_splitk_cleanE,0.0115,165.0,1409.95
256,128,2048,4096,False,torch.bfloat16,torch.bfloat16,False,False,asm,8,4,13.212,_ZN5aiter39bf16gemm_fp32bf16_tn_96x64_splitk_cleanE,0.0116,162.54,1388.89
256,128,2048,4096,False,torch.bfloat16,torch.bfloat16,False,False,asm,5,3,13.481,_ZN5aiter39bf16gemm_fp32bf16_tn_64x64_splitk_cleanE,0.0087,159.3,1361.18
256,128,2048,4096,False,torch.bfloat16,torch.bfloat16,False,False,hipblaslt,439671,0,13.5718,,0.0,158.23,1352.07
256,128,2048,4096,False,torch.bfloat16,torch.bfloat16,False,False,hipblaslt,440186,0,13.8367,,0.0,155.2,1326.19
256,128,2048,4096,False,torch.bfloat16,torch.bfloat16,False,False,asm,7,3,14.1409,_ZN5aiter39bf16gemm_fp32bf16_tn_80x64_splitk_cleanE,0.0088,151.86,1297.66
256,128,2048,4096,False,torch.bfloat16,torch.bfloat16,False,False,asm,8,3,14.3116,_ZN5aiter39bf16gemm_fp32bf16_tn_96x64_splitk_cleanE,0.0087,150.05,1282.18
256,128,2048,4096,False,torch.bfloat16,torch.bfloat16,False,False,hipblaslt,440185,0,14.6317,,0.0,146.77,1254.13
256,128,2048,4096,False,torch.bfloat16,torch.bfloat16,False,False,hipblaslt,439288,0,14.7418,,0.0,145.67,1244.77
256,128,2048,4096,False,torch.bfloat16,torch.bfloat16,False,False,hipblaslt,438619,0,14.8097,,0.0,145.01,1239.06
256,128,2048,4096,False,torch.bfloat16,torch.bfloat16,False,False,hipblaslt,438488,0,14.8333,,0.0,144.77,1237.09
256,128,2048,4096,False,torch.bfloat16,torch.bfloat16,False,False,hipblaslt,439682,0,15.0591,,0.0,142.6,1218.54
256,128,2048,4096,False,torch.bfloat16,torch.bfloat16,False,False,hipblaslt,438820,0,15.3362,,0.0,140.03,1196.52
256,128,2048,4096,False,torch.bfloat16,torch.bfloat16,False,False,hipblaslt,438622,0,15.5004,,0.0,138.54,1183.85
256,128,2048,4096,False,torch.bfloat16,torch.bfloat16,False,False,hipblaslt,438323,0,15.519,,0.0,138.38,1182.43
256,128,2048,4096,False,torch.bfloat16,torch.bfloat16,False,False,hipblaslt,440196,0,15.5811,,0.0,137.83,1177.71
256,128,2048,4096,False,torch.bfloat16,torch.bfloat16,False,False,hipblaslt,438326,0,15.704,,0.0,136.75,1168.5
256,128,2048,4096,False,torch.bfloat16,torch.bfloat16,False,False,hipblaslt,439385,0,15.7438,,0.0,136.4,1165.54
256,128,2048,4096,False,torch.bfloat16,torch.bfloat16,False,False,hipblaslt,440201,0,15.7441,,0.0,136.4,1165.52
256,128,2048,4096,False,torch.bfloat16,torch.bfloat16,False,False,asm,1,2,15.9238,_ZN5aiter39bf16gemm_fp32bf16_tn_32x64_splitk_cleanE,0.0049,134.86,1152.37
256,128,2048,4096,False,torch.bfloat16,torch.bfloat16,False,False,hipblaslt,438330,0,16.1147,,0.0,133.26,1138.72
256,128,2048,4096,False,torch.bfloat16,torch.bfloat16,False,False,hipblaslt,440216,0,16.1534,,0.0,132.94,1135.99
256,128,2048,4096,False,torch.bfloat16,torch.bfloat16,False,False,hipblaslt,438888,0,16.1684,,0.0,132.82,1134.93
256,128,2048,4096,False,torch.bfloat16,torch.bfloat16,False,False,asm,3,2,16.4,_ZN5aiter39bf16gemm_fp32bf16_tn_48x64_splitk_cleanE,0.0049,130.94,1118.91
256,128,2048,4096,False,torch.bfloat16,torch.bfloat16,False,False,hipblaslt,438528,0,16.5141,,0.0,130.04,1111.18
256,128,2048,4096,False,torch.bfloat16,torch.bfloat16,False,False,hipblaslt,439418,0,16.622,,0.0,129.2,1103.96
256,128,2048,4096,False,torch.bfloat16,torch.bfloat16,False,False,asm,5,2,17.0707,_ZN5aiter39bf16gemm_fp32bf16_tn_64x64_splitk_cleanE,0.0049,125.8,1074.95
256,128,2048,4096,False,torch.bfloat16,torch.bfloat16,False,False,asm,7,2,17.6823,_ZN5aiter39bf16gemm_fp32bf16_tn_80x64_splitk_cleanE,0.0049,121.45,1037.77
256,128,2048,4096,False,torch.bfloat16,torch.bfloat16,False,False,hipblaslt,438391,0,17.7583,,0.0,120.93,1033.32
256,128,2048,4096,False,torch.bfloat16,torch.bfloat16,False,False,asm,8,2,17.8938,_ZN5aiter39bf16gemm_fp32bf16_tn_96x64_splitk_cleanE,0.0049,120.01,1025.5
256,128,2048,4096,False,torch.bfloat16,torch.bfloat16,False,False,asm,2,1,24.3072,_ZN5aiter37bf16gemm_fp32bf16_tn_32x64_pf3_splitkE,0.0,88.35,754.92
256,128,2048,4096,False,torch.bfloat16,torch.bfloat16,False,False,asm,4,1,24.8154,_ZN5aiter37bf16gemm_fp32bf16_tn_48x64_pf3_splitkE,0.0,86.54,739.46
256,128,2048,4096,False,torch.bfloat16,torch.bfloat16,False,False,asm,6,1,26.1249,_ZN5aiter37bf16gemm_fp32bf16_tn_64x64_pf3_splitkE,0.0,82.2,702.4
256,128,2048,4096,False,torch.bfloat16,torch.bfloat16,False,False,asm,9,1,27.2194,_ZN5aiter37bf16gemm_fp32bf16_tn_96x64_pf3_splitkE,0.0,78.9,674.15
256,128,2048,4096,False,torch.bfloat16,torch.bfloat16,False,False,asm,10,1,70.3599,_ZN5aiter24bf16gemm_bf16_tn_256x256E,0.0,30.52,260.8
256,1024,2048,4096,False,torch.bfloat16,torch.bfloat16,False,False,hipblaslt,438986,0,28.0442,,0.0,612.6,1046.92
256,1024,2048,4096,False,torch.bfloat16,torch.bfloat16,False,False,hipblaslt,439457,0,28.0696,,0.0,612.05,1045.98
256,1024,2048,4096,False,torch.bfloat16,torch.bfloat16,False,False,hipblaslt,439118,0,28.1397,,0.0,610.52,1043.37
256,1024,2048,4096,False,torch.bfloat16,torch.bfloat16,False,False,hipblaslt,439177,0,28.5123,,0.0,602.54,1029.74
256,1024,2048,4096,False,torch.bfloat16,torch.bfloat16,False,False,hipblaslt,438564,0,28.6271,,0.0,600.13,1025.61
256,1024,2048,4096,False,torch.bfloat16,torch.bfloat16,False,False,hipblaslt,438562,0,28.9632,,0.0,593.16,1013.7
256,1024,2048,4096,False,torch.bfloat16,torch.bfloat16,False,False,hipblaslt,438769,0,29.0761,,0.0,590.86,1009.77
256,1024,2048,4096,False,torch.bfloat16,torch.bfloat16,False,False,hipblaslt,438831,0,29.6373,,0.0,579.67,990.65
256,1024,2048,4096,False,torch.bfloat16,torch.bfloat16,False,False,hipblaslt,438490,0,29.6627,,0.0,579.17,989.8
256,1024,2048,4096,False,torch.bfloat16,torch.bfloat16,False,False,hipblaslt,438331,0,30.0065,,0.0,572.54,978.46
256,1024,2048,4096,False,torch.bfloat16,torch.bfloat16,False,False,hipblaslt,438424,0,30.0499,,0.0,571.71,977.05
256,1024,2048,4096,False,torch.bfloat16,torch.bfloat16,False,False,hipblaslt,438702,0,30.0587,,0.0,571.54,976.76
256,1024,2048,4096,False,torch.bfloat16,torch.bfloat16,False,False,hipblaslt,440151,0,30.1382,,0.0,570.04,974.18
256,1024,2048,4096,False,torch.bfloat16,torch.bfloat16,False,False,hipblaslt,438295,0,30.2802,,0.0,567.36,969.61
256,1024,2048,4096,False,torch.bfloat16,torch.bfloat16,False,False,hipblaslt,438177,0,30.3706,,0.0,565.67,966.73
256,1024,2048,4096,False,torch.bfloat16,torch.bfloat16,False,False,hipblaslt,438900,0,30.4316,,0.0,564.54,964.79
256,1024,2048,4096,False,torch.bfloat16,torch.bfloat16,False,False,hipblaslt,438830,0,30.4571,,0.0,564.07,963.98
256,1024,2048,4096,False,torch.bfloat16,torch.bfloat16,False,False,hipblaslt,440162,0,30.5069,,0.0,563.15,962.41
256,1024,2048,4096,False,torch.bfloat16,torch.bfloat16,False,False,hipblaslt,438885,0,30.6562,,0.0,560.4,957.72
256,1024,2048,4096,False,torch.bfloat16,torch.bfloat16,False,False,hipblaslt,438561,0,30.7963,,0.0,557.85,953.37
256,1024,2048,4096,False,torch.bfloat16,torch.bfloat16,False,False,asm,6,1,50.3031,_ZN5aiter37bf16gemm_fp32bf16_tn_64x64_pf3_splitkE,0.0,341.53,583.66
256,1024,2048,4096,False,torch.bfloat16,torch.bfloat16,False,False,asm,8,2,51.5138,_ZN5aiter39bf16gemm_fp32bf16_tn_96x64_splitk_cleanE,0.0049,333.5,569.95
256,1024,2048,4096,False,torch.bfloat16,torch.bfloat16,False,False,asm,9,1,55.0352,_ZN5aiter37bf16gemm_fp32bf16_tn_96x64_pf3_splitkE,0.0,312.16,533.48
256,1024,2048,4096,False,torch.bfloat16,torch.bfloat16,False,False,asm,7,3,57.7654,_ZN5aiter39bf16gemm_fp32bf16_tn_80x64_splitk_cleanE,0.0089,297.41,508.26
256,1024,2048,4096,False,torch.bfloat16,torch.bfloat16,False,False,asm,5,2,59.2865,_ZN5aiter39bf16gemm_fp32bf16_tn_64x64_splitk_cleanE,0.0049,289.78,495.22
256,1024,2048,4096,False,torch.bfloat16,torch.bfloat16,False,False,asm,8,3,59.2995,_ZN5aiter39bf16gemm_fp32bf16_tn_96x64_splitk_cleanE,0.0089,289.71,495.12
256,1024,2048,4096,False,torch.bfloat16,torch.bfloat16,False,False,asm,8,4,59.5464,_ZN5aiter39bf16gemm_fp32bf16_tn_96x64_splitk_cleanE,0.0117,288.51,493.06
256,1024,2048,4096,False,torch.bfloat16,torch.bfloat16,False,False,asm,7,2,60.742,_ZN5aiter39bf16gemm_fp32bf16_tn_80x64_splitk_cleanE,0.0049,282.83,483.36
256,1024,2048,4096,False,torch.bfloat16,torch.bfloat16,False,False,asm,5,3,63.8118,_ZN5aiter39bf16gemm_fp32bf16_tn_64x64_splitk_cleanE,0.0089,269.23,460.1
256,1024,2048,4096,False,torch.bfloat16,torch.bfloat16,False,False,asm,7,4,64.0654,_ZN5aiter39bf16gemm_fp32bf16_tn_80x64_splitk_cleanE,0.0117,268.16,458.28
256,1024,2048,4096,False,torch.bfloat16,torch.bfloat16,False,False,asm,4,1,68.6112,_ZN5aiter37bf16gemm_fp32bf16_tn_48x64_pf3_splitkE,0.0,250.39,427.92
256,1024,2048,4096,False,torch.bfloat16,torch.bfloat16,False,False,asm,5,4,68.971,_ZN5aiter39bf16gemm_fp32bf16_tn_64x64_splitk_cleanE,0.0117,249.09,425.69
256,1024,2048,4096,False,torch.bfloat16,torch.bfloat16,False,False,asm,10,1,76.2201,_ZN5aiter24bf16gemm_bf16_tn_256x256E,0.0,225.4,385.2
256,1024,2048,4096,False,torch.bfloat16,torch.bfloat16,False,False,asm,3,2,78.0959,_ZN5aiter39bf16gemm_fp32bf16_tn_48x64_splitk_cleanE,0.0049,219.98,375.95
256,1024,2048,4096,False,torch.bfloat16,torch.bfloat16,False,False,asm,2,1,82.2412,_ZN5aiter37bf16gemm_fp32bf16_tn_32x64_pf3_splitkE,0.0,208.9,357.0
256,1024,2048,4096,False,torch.bfloat16,torch.bfloat16,False,False,asm,3,3,83.6485,_ZN5aiter39bf16gemm_fp32bf16_tn_48x64_splitk_cleanE,0.0089,205.38,350.99
256,1024,2048,4096,False,torch.bfloat16,torch.bfloat16,False,False,asm,3,4,84.4857,_ZN5aiter39bf16gemm_fp32bf16_tn_48x64_splitk_cleanE,0.0117,203.35,347.52
256,1024,2048,4096,False,torch.bfloat16,torch.bfloat16,False,False,asm,1,2,97.2507,_ZN5aiter39bf16gemm_fp32bf16_tn_32x64_splitk_cleanE,0.0049,176.66,301.9
256,1024,2048,4096,False,torch.bfloat16,torch.bfloat16,False,False,asm,1,3,105.1707,_ZN5aiter39bf16gemm_fp32bf16_tn_32x64_splitk_cleanE,0.0089,163.35,279.17
256,1024,2048,4096,False,torch.bfloat16,torch.bfloat16,False,False,asm,1,4,112.2418,_ZN5aiter39bf16gemm_fp32bf16_tn_32x64_splitk_cleanE,0.0117,153.06,261.58
256,4096,2048,4096,False,torch.bfloat16,torch.bfloat16,False,False,asm,3,2,-1.0,_ZN5aiter39bf16gemm_fp32bf16_tn_48x64_splitk_cleanE,1.0,-1.0,-1.0
256,4096,2048,4096,False,torch.bfloat16,torch.bfloat16,False,False,asm,3,3,-1.0,_ZN5aiter39bf16gemm_fp32bf16_tn_48x64_splitk_cleanE,1.0,-1.0,-1.0
256,4096,2048,4096,False,torch.bfloat16,torch.bfloat16,False,False,asm,3,4,-1.0,_ZN5aiter39bf16gemm_fp32bf16_tn_48x64_splitk_cleanE,1.0,-1.0,-1.0
256,4096,2048,4096,False,torch.bfloat16,torch.bfloat16,False,False,asm,5,2,-1.0,_ZN5aiter39bf16gemm_fp32bf16_tn_64x64_splitk_cleanE,1.0,-1.0,-1.0
256,4096,2048,4096,False,torch.bfloat16,torch.bfloat16,False,False,asm,5,4,-1.0,_ZN5aiter39bf16gemm_fp32bf16_tn_64x64_splitk_cleanE,1.0,-1.0,-1.0
256,4096,2048,4096,False,torch.bfloat16,torch.bfloat16,False,False,asm,1,2,-1.0,_ZN5aiter39bf16gemm_fp32bf16_tn_32x64_splitk_cleanE,1.0,-1.0,-1.0
256,4096,2048,4096,False,torch.bfloat16,torch.bfloat16,False,False,asm,1,4,-1.0,_ZN5aiter39bf16gemm_fp32bf16_tn_32x64_splitk_cleanE,1.0,-1.0,-1.0
256,4096,2048,4096,False,torch.bfloat16,torch.bfloat16,False,False,asm,5,3,-1.0,_ZN5aiter39bf16gemm_fp32bf16_tn_64x64_splitk_cleanE,1.0,-1.0,-1.0
256,4096,2048,4096,False,torch.bfloat16,torch.bfloat16,False,False,asm,1,3,-1.0,_ZN5aiter39bf16gemm_fp32bf16_tn_32x64_splitk_cleanE,1.0,-1.0,-1.0
256,4096,2048,4096,False,torch.bfloat16,torch.bfloat16,False,False,asm,7,4,-1.0,_ZN5aiter39bf16gemm_fp32bf16_tn_80x64_splitk_cleanE,1.0,-1.0,-1.0
256,4096,2048,4096,False,torch.bfloat16,torch.bfloat16,False,False,asm,8,4,-1.0,_ZN5aiter39bf16gemm_fp32bf16_tn_96x64_splitk_cleanE,1.0,-1.0,-1.0
256,4096,2048,4096,False,torch.bfloat16,torch.bfloat16,False,False,asm,8,3,-1.0,_ZN5aiter39bf16gemm_fp32bf16_tn_96x64_splitk_cleanE,1.0,-1.0,-1.0
256,4096,2048,4096,False,torch.bfloat16,torch.bfloat16,False,False,asm,8,2,-1.0,_ZN5aiter39bf16gemm_fp32bf16_tn_96x64_splitk_cleanE,1.0,-1.0,-1.0
256,4096,2048,4096,False,torch.bfloat16,torch.bfloat16,False,False,asm,7,2,-1.0,_ZN5aiter39bf16gemm_fp32bf16_tn_80x64_splitk_cleanE,1.0,-1.0,-1.0
256,4096,2048,4096,False,torch.bfloat16,torch.bfloat16,False,False,asm,7,3,-1.0,_ZN5aiter39bf16gemm_fp32bf16_tn_80x64_splitk_cleanE,1.0,-1.0,-1.0
256,4096,2048,4096,False,torch.bfloat16,torch.bfloat16,False,False,hipblaslt,438981,0,62.1487,,0.0,1105.73,1079.81
256,4096,2048,4096,False,torch.bfloat16,torch.bfloat16,False,False,hipblaslt,439191,0,63.1708,,0.0,1087.84,1062.34
256,4096,2048,4096,False,torch.bfloat16,torch.bfloat16,False,False,hipblaslt,439151,0,63.606,,0.0,1080.39,1055.07
256,4096,2048,4096,False,torch.bfloat16,torch.bfloat16,False,False,hipblaslt,439144,0,64.3639,,0.0,1067.67,1042.65
256,4096,2048,4096,False,torch.bfloat16,torch.bfloat16,False,False,hipblaslt,439153,0,64.3952,,0.0,1067.15,1042.14
256,4096,2048,4096,False,torch.bfloat16,torch.bfloat16,False,False,hipblaslt,438980,0,64.9586,,0.0,1057.9,1033.1
256,4096,2048,4096,False,torch.bfloat16,torch.bfloat16,False,False,hipblaslt,439147,0,65.0606,,0.0,1056.24,1031.48
256,4096,2048,4096,False,torch.bfloat16,torch.bfloat16,False,False,hipblaslt,438362,0,65.0883,,0.0,1055.79,1031.04
256,4096,2048,4096,False,torch.bfloat16,torch.bfloat16,False,False,hipblaslt,439152,0,65.7047,,0.0,1045.88,1021.37
256,4096,2048,4096,False,torch.bfloat16,torch.bfloat16,False,False,hipblaslt,439188,0,65.7855,,0.0,1044.6,1020.12
256,4096,2048,4096,False,torch.bfloat16,torch.bfloat16,False,False,hipblaslt,439190,0,66.2875,,0.0,1036.69,1012.39
256,4096,2048,4096,False,torch.bfloat16,torch.bfloat16,False,False,hipblaslt,439150,0,66.5733,,0.0,1032.24,1008.04
256,4096,2048,4096,False,torch.bfloat16,torch.bfloat16,False,False,hipblaslt,439192,0,66.6059,,0.0,1031.73,1007.55
256,4096,2048,4096,False,torch.bfloat16,torch.bfloat16,False,False,hipblaslt,438281,0,67.1373,,0.0,1023.57,999.58
256,4096,2048,4096,False,torch.bfloat16,torch.bfloat16,False,False,hipblaslt,438230,0,67.3749,,0.0,1019.96,996.05
256,4096,2048,4096,False,torch.bfloat16,torch.bfloat16,False,False,hipblaslt,439189,0,67.4092,,0.0,1019.44,995.54
256,4096,2048,4096,False,torch.bfloat16,torch.bfloat16,False,False,hipblaslt,440090,0,67.8337,,0.0,1013.06,989.31
256,4096,2048,4096,False,torch.bfloat16,torch.bfloat16,False,False,hipblaslt,439045,0,68.33,,0.0,1005.7,982.13
256,4096,2048,4096,False,torch.bfloat16,torch.bfloat16,False,False,hipblaslt,438346,0,68.9161,,0.0,997.15,973.78
256,4096,2048,4096,False,torch.bfloat16,torch.bfloat16,False,False,hipblaslt,438310,0,68.9471,,0.0,996.7,973.34
256,4096,2048,4096,False,torch.bfloat16,torch.bfloat16,False,False,asm,10,1,85.9895,_ZN5aiter24bf16gemm_bf16_tn_256x256E,0.0,799.16,780.43
256,4096,2048,4096,False,torch.bfloat16,torch.bfloat16,False,False,asm,9,1,159.6626,_ZN5aiter37bf16gemm_fp32bf16_tn_96x64_pf3_splitkE,0.0,430.4,420.32
256,4096,2048,4096,False,torch.bfloat16,torch.bfloat16,False,False,asm,6,1,189.6588,_ZN5aiter37bf16gemm_fp32bf16_tn_64x64_pf3_splitkE,0.0,362.33,353.84
256,4096,2048,4096,False,torch.bfloat16,torch.bfloat16,False,False,asm,4,1,238.8062,_ZN5aiter37bf16gemm_fp32bf16_tn_48x64_pf3_splitkE,0.0,287.76,281.02
256,4096,2048,4096,False,torch.bfloat16,torch.bfloat16,False,False,asm,2,1,314.717,_ZN5aiter37bf16gemm_fp32bf16_tn_32x64_pf3_splitkE,0.0,218.35,213.24
256,8192,2048,4096,False,torch.bfloat16,torch.bfloat16,False,False,asm,3,2,-1.0,_ZN5aiter39bf16gemm_fp32bf16_tn_48x64_splitk_cleanE,1.0,-1.0,-1.0
256,8192,2048,4096,False,torch.bfloat16,torch.bfloat16,False,False,asm,3,3,-1.0,_ZN5aiter39bf16gemm_fp32bf16_tn_48x64_splitk_cleanE,1.0,-1.0,-1.0
256,8192,2048,4096,False,torch.bfloat16,torch.bfloat16,False,False,asm,3,4,-1.0,_ZN5aiter39bf16gemm_fp32bf16_tn_48x64_splitk_cleanE,1.0,-1.0,-1.0
256,8192,2048,4096,False,torch.bfloat16,torch.bfloat16,False,False,asm,5,2,-1.0,_ZN5aiter39bf16gemm_fp32bf16_tn_64x64_splitk_cleanE,1.0,-1.0,-1.0
256,8192,2048,4096,False,torch.bfloat16,torch.bfloat16,False,False,asm,5,4,-1.0,_ZN5aiter39bf16gemm_fp32bf16_tn_64x64_splitk_cleanE,1.0,-1.0,-1.0
256,8192,2048,4096,False,torch.bfloat16,torch.bfloat16,False,False,asm,1,2,-1.0,_ZN5aiter39bf16gemm_fp32bf16_tn_32x64_splitk_cleanE,1.0,-1.0,-1.0
256,8192,2048,4096,False,torch.bfloat16,torch.bfloat16,False,False,asm,1,4,-1.0,_ZN5aiter39bf16gemm_fp32bf16_tn_32x64_splitk_cleanE,1.0,-1.0,-1.0
256,8192,2048,4096,False,torch.bfloat16,torch.bfloat16,False,False,asm,5,3,-1.0,_ZN5aiter39bf16gemm_fp32bf16_tn_64x64_splitk_cleanE,1.0,-1.0,-1.0
256,8192,2048,4096,False,torch.bfloat16,torch.bfloat16,False,False,asm,1,3,-1.0,_ZN5aiter39bf16gemm_fp32bf16_tn_32x64_splitk_cleanE,1.0,-1.0,-1.0
256,8192,2048,4096,False,torch.bfloat16,torch.bfloat16,False,False,asm,7,4,-1.0,_ZN5aiter39bf16gemm_fp32bf16_tn_80x64_splitk_cleanE,1.0,-1.0,-1.0
256,8192,2048,4096,False,torch.bfloat16,torch.bfloat16,False,False,asm,8,4,-1.0,_ZN5aiter39bf16gemm_fp32bf16_tn_96x64_splitk_cleanE,1.0,-1.0,-1.0
256,8192,2048,4096,False,torch.bfloat16,torch.bfloat16,False,False,asm,8,3,-1.0,_ZN5aiter39bf16gemm_fp32bf16_tn_96x64_splitk_cleanE,1.0,-1.0,-1.0
256,8192,2048,4096,False,torch.bfloat16,torch.bfloat16,False,False,asm,8,2,-1.0,_ZN5aiter39bf16gemm_fp32bf16_tn_96x64_splitk_cleanE,1.0,-1.0,-1.0
256,8192,2048,4096,False,torch.bfloat16,torch.bfloat16,False,False,asm,7,2,-1.0,_ZN5aiter39bf16gemm_fp32bf16_tn_80x64_splitk_cleanE,1.0,-1.0,-1.0
256,8192,2048,4096,False,torch.bfloat16,torch.bfloat16,False,False,asm,7,3,-1.0,_ZN5aiter39bf16gemm_fp32bf16_tn_80x64_splitk_cleanE,1.0,-1.0,-1.0
256,8192,2048,4096,False,torch.bfloat16,torch.bfloat16,False,False,hipblaslt,440235,0,105.0837,,0.0,1307.9,1117.59
256,8192,2048,4096,False,torch.bfloat16,torch.bfloat16,False,False,hipblaslt,439320,0,105.3041,,0.0,1305.16,1115.25
256,8192,2048,4096,False,torch.bfloat16,torch.bfloat16,False,False,hipblaslt,438244,0,105.7906,,0.0,1299.16,1110.12
256,8192,2048,4096,False,torch.bfloat16,torch.bfloat16,False,False,hipblaslt,438386,0,106.0967,,0.0,1295.41,1106.92
256,8192,2048,4096,False,torch.bfloat16,torch.bfloat16,False,False,hipblaslt,440239,0,106.1294,,0.0,1295.01,1106.58
256,8192,2048,4096,False,torch.bfloat16,torch.bfloat16,False,False,hipblaslt,439311,0,106.2061,,0.0,1294.08,1105.78
256,8192,2048,4096,False,torch.bfloat16,torch.bfloat16,False,False,hipblaslt,438241,0,106.5327,,0.0,1290.11,1102.39
256,8192,2048,4096,False,torch.bfloat16,torch.bfloat16,False,False,hipblaslt,439261,0,106.8829,,0.0,1285.88,1098.78
256,8192,2048,4096,False,torch.bfloat16,torch.bfloat16,False,False,hipblaslt,439280,0,107.9269,,0.0,1273.44,1088.15
256,8192,2048,4096,False,torch.bfloat16,torch.bfloat16,False,False,hipblaslt,438309,0,108.22,,0.0,1270.0,1085.2
256,8192,2048,4096,False,torch.bfloat16,torch.bfloat16,False,False,hipblaslt,439217,0,108.3229,,0.0,1268.79,1084.17
256,8192,2048,4096,False,torch.bfloat16,torch.bfloat16,False,False,hipblaslt,439357,0,109.2943,,0.0,1257.51,1074.53
256,8192,2048,4096,False,torch.bfloat16,torch.bfloat16,False,False,hipblaslt,440058,0,110.936,,0.0,1238.9,1058.63
256,8192,2048,4096,False,torch.bfloat16,torch.bfloat16,False,False,asm,10,1,111.1492,_ZN5aiter24bf16gemm_bf16_tn_256x256E,0.0,1236.53,1056.6
256,8192,2048,4096,False,torch.bfloat16,torch.bfloat16,False,False,hipblaslt,439391,0,111.8927,,0.0,1228.31,1049.58
256,8192,2048,4096,False,torch.bfloat16,torch.bfloat16,False,False,hipblaslt,439397,0,112.4274,,0.0,1222.47,1044.59
256,8192,2048,4096,False,torch.bfloat16,torch.bfloat16,False,False,hipblaslt,439209,0,112.4625,,0.0,1222.09,1044.26
256,8192,2048,4096,False,torch.bfloat16,torch.bfloat16,False,False,hipblaslt,439304,0,112.4633,,0.0,1222.08,1044.26
256,8192,2048,4096,False,torch.bfloat16,torch.bfloat16,False,False,hipblaslt,439111,0,113.456,,0.0,1211.39,1035.12
256,8192,2048,4096,False,torch.bfloat16,torch.bfloat16,False,False,hipblaslt,439399,0,114.7654,,0.0,1197.56,1023.31
256,8192,2048,4096,False,torch.bfloat16,torch.bfloat16,False,False,hipblaslt,439352,0,116.4699,,0.0,1180.04,1008.33
256,8192,2048,4096,False,torch.bfloat16,torch.bfloat16,False,False,asm,9,1,291.1389,_ZN5aiter37bf16gemm_fp32bf16_tn_96x64_pf3_splitkE,0.0,472.07,403.38
256,8192,2048,4096,False,torch.bfloat16,torch.bfloat16,False,False,asm,6,1,372.3826,_ZN5aiter37bf16gemm_fp32bf16_tn_64x64_pf3_splitkE,0.0,369.08,315.38
256,8192,2048,4096,False,torch.bfloat16,torch.bfloat16,False,False,asm,4,1,468.8309,_ZN5aiter37bf16gemm_fp32bf16_tn_48x64_pf3_splitkE,0.0,293.15,250.5
256,8192,2048,4096,False,torch.bfloat16,torch.bfloat16,False,False,asm,2,1,630.3221,_ZN5aiter37bf16gemm_fp32bf16_tn_32x64_pf3_splitkE,0.0,218.05,186.32
256,16384,2048,4096,False,torch.bfloat16,torch.bfloat16,False,False,asm,3,2,-1.0,_ZN5aiter39bf16gemm_fp32bf16_tn_48x64_splitk_cleanE,1.0,-1.0,-1.0
256,16384,2048,4096,False,torch.bfloat16,torch.bfloat16,False,False,asm,3,3,-1.0,_ZN5aiter39bf16gemm_fp32bf16_tn_48x64_splitk_cleanE,1.0,-1.0,-1.0
256,16384,2048,4096,False,torch.bfloat16,torch.bfloat16,False,False,asm,3,4,-1.0,_ZN5aiter39bf16gemm_fp32bf16_tn_48x64_splitk_cleanE,1.0,-1.0,-1.0
256,16384,2048,4096,False,torch.bfloat16,torch.bfloat16,False,False,asm,5,2,-1.0,_ZN5aiter39bf16gemm_fp32bf16_tn_64x64_splitk_cleanE,1.0,-1.0,-1.0
256,16384,2048,4096,False,torch.bfloat16,torch.bfloat16,False,False,asm,5,4,-1.0,_ZN5aiter39bf16gemm_fp32bf16_tn_64x64_splitk_cleanE,1.0,-1.0,-1.0
256,16384,2048,4096,False,torch.bfloat16,torch.bfloat16,False,False,asm,1,2,-1.0,_ZN5aiter39bf16gemm_fp32bf16_tn_32x64_splitk_cleanE,1.0,-1.0,-1.0
256,16384,2048,4096,False,torch.bfloat16,torch.bfloat16,False,False,asm,1,4,-1.0,_ZN5aiter39bf16gemm_fp32bf16_tn_32x64_splitk_cleanE,1.0,-1.0,-1.0
256,16384,2048,4096,False,torch.bfloat16,torch.bfloat16,False,False,asm,5,3,-1.0,_ZN5aiter39bf16gemm_fp32bf16_tn_64x64_splitk_cleanE,1.0,-1.0,-1.0
256,16384,2048,4096,False,torch.bfloat16,torch.bfloat16,False,False,asm,1,3,-1.0,_ZN5aiter39bf16gemm_fp32bf16_tn_32x64_splitk_cleanE,1.0,-1.0,-1.0
256,16384,2048,4096,False,torch.bfloat16,torch.bfloat16,False,False,asm,7,4,-1.0,_ZN5aiter39bf16gemm_fp32bf16_tn_80x64_splitk_cleanE,1.0,-1.0,-1.0
256,16384,2048,4096,False,torch.bfloat16,torch.bfloat16,False,False,asm,8,4,-1.0,_ZN5aiter39bf16gemm_fp32bf16_tn_96x64_splitk_cleanE,1.0,-1.0,-1.0
256,16384,2048,4096,False,torch.bfloat16,torch.bfloat16,False,False,asm,8,3,-1.0,_ZN5aiter39bf16gemm_fp32bf16_tn_96x64_splitk_cleanE,1.0,-1.0,-1.0
256,16384,2048,4096,False,torch.bfloat16,torch.bfloat16,False,False,asm,8,2,-1.0,_ZN5aiter39bf16gemm_fp32bf16_tn_96x64_splitk_cleanE,1.0,-1.0,-1.0
256,16384,2048,4096,False,torch.bfloat16,torch.bfloat16,False,False,asm,7,2,-1.0,_ZN5aiter39bf16gemm_fp32bf16_tn_80x64_splitk_cleanE,1.0,-1.0,-1.0
256,16384,2048,4096,False,torch.bfloat16,torch.bfloat16,False,False,asm,7,3,-1.0,_ZN5aiter39bf16gemm_fp32bf16_tn_80x64_splitk_cleanE,1.0,-1.0,-1.0
256,16384,2048,4096,False,torch.bfloat16,torch.bfloat16,False,False,hipblaslt,439397,0,199.6622,,0.0,1376.71,1092.36
256,16384,2048,4096,False,torch.bfloat16,torch.bfloat16,False,False,hipblaslt,438242,0,200.0761,,0.0,1373.87,1090.1
256,16384,2048,4096,False,torch.bfloat16,torch.bfloat16,False,False,hipblaslt,439365,0,200.1324,,0.0,1373.48,1089.8
256,16384,2048,4096,False,torch.bfloat16,torch.bfloat16,False,False,hipblaslt,439352,0,200.1764,,0.0,1373.18,1089.56
256,16384,2048,4096,False,torch.bfloat16,torch.bfloat16,False,False,hipblaslt,440238,0,200.4091,,0.0,1371.58,1088.29
256,16384,2048,4096,False,torch.bfloat16,torch.bfloat16,False,False,hipblaslt,439461,0,200.9262,,0.0,1368.05,1085.49
256,16384,2048,4096,False,torch.bfloat16,torch.bfloat16,False,False,hipblaslt,438309,0,201.512,,0.0,1364.08,1082.34
256,16384,2048,4096,False,torch.bfloat16,torch.bfloat16,False,False,hipblaslt,439305,0,202.8124,,0.0,1355.33,1075.4
256,16384,2048,4096,False,torch.bfloat16,torch.bfloat16,False,False,hipblaslt,438386,0,203.3757,,0.0,1351.58,1072.42
256,16384,2048,4096,False,torch.bfloat16,torch.bfloat16,False,False,hipblaslt,439223,0,204.8106,,0.0,1342.11,1064.9
256,16384,2048,4096,False,torch.bfloat16,torch.bfloat16,False,False,hipblaslt,439285,0,204.9801,,0.0,1341.0,1064.02
256,16384,2048,4096,False,torch.bfloat16,torch.bfloat16,False,False,asm,10,1,205.38,_ZN5aiter24bf16gemm_bf16_tn_256x256E,0.0,1338.39,1061.95
256,16384,2048,4096,False,torch.bfloat16,torch.bfloat16,False,False,hipblaslt,439044,0,206.2189,,0.0,1332.94,1057.63
256,16384,2048,4096,False,torch.bfloat16,torch.bfloat16,False,False,hipblaslt,440237,0,217.3797,,0.0,1264.51,1003.33
256,16384,2048,4096,False,torch.bfloat16,torch.bfloat16,False,False,hipblaslt,440239,0,218.6564,,0.0,1257.12,997.47
256,16384,2048,4096,False,torch.bfloat16,torch.bfloat16,False,False,hipblaslt,439225,0,219.3749,,0.0,1253.01,994.21
256,16384,2048,4096,False,torch.bfloat16,torch.bfloat16,False,False,hipblaslt,439398,0,220.0623,,0.0,1249.09,991.1
256,16384,2048,4096,False,torch.bfloat16,torch.bfloat16,False,False,hipblaslt,439399,0,223.0085,,0.0,1232.59,978.01
256,16384,2048,4096,False,torch.bfloat16,torch.bfloat16,False,False,hipblaslt,439401,0,224.2951,,0.0,1225.52,972.4
256,16384,2048,4096,False,torch.bfloat16,torch.bfloat16,False,False,hipblaslt,439306,0,224.8731,,0.0,1222.37,969.9
256,16384,2048,4096,False,torch.bfloat16,torch.bfloat16,False,False,hipblaslt,439059,0,225.0367,,0.0,1221.48,969.19
256,16384,2048,4096,False,torch.bfloat16,torch.bfloat16,False,False,asm,9,1,579.6735,_ZN5aiter37bf16gemm_fp32bf16_tn_96x64_pf3_splitkE,0.0,474.19,376.25
256,16384,2048,4096,False,torch.bfloat16,torch.bfloat16,False,False,asm,6,1,729.8035,_ZN5aiter37bf16gemm_fp32bf16_tn_64x64_pf3_splitkE,0.0,376.65,298.85
256,16384,2048,4096,False,torch.bfloat16,torch.bfloat16,False,False,asm,4,1,913.5092,_ZN5aiter37bf16gemm_fp32bf16_tn_48x64_pf3_splitkE,0.0,300.9,238.75
256,16384,2048,4096,False,torch.bfloat16,torch.bfloat16,False,False,asm,2,1,1254.0071,_ZN5aiter37bf16gemm_fp32bf16_tn_32x64_pf3_splitkE,0.0,219.2,173.93
256,32768,2048,4096,False,torch.bfloat16,torch.bfloat16,False,False,asm,3,2,-1.0,_ZN5aiter39bf16gemm_fp32bf16_tn_48x64_splitk_cleanE,1.0,-1.0,-1.0
256,32768,2048,4096,False,torch.bfloat16,torch.bfloat16,False,False,asm,3,3,-1.0,_ZN5aiter39bf16gemm_fp32bf16_tn_48x64_splitk_cleanE,1.0,-1.0,-1.0
256,32768,2048,4096,False,torch.bfloat16,torch.bfloat16,False,False,asm,3,4,-1.0,_ZN5aiter39bf16gemm_fp32bf16_tn_48x64_splitk_cleanE,1.0,-1.0,-1.0
256,32768,2048,4096,False,torch.bfloat16,torch.bfloat16,False,False,asm,5,2,-1.0,_ZN5aiter39bf16gemm_fp32bf16_tn_64x64_splitk_cleanE,1.0,-1.0,-1.0
256,32768,2048,4096,False,torch.bfloat16,torch.bfloat16,False,False,asm,5,4,-1.0,_ZN5aiter39bf16gemm_fp32bf16_tn_64x64_splitk_cleanE,1.0,-1.0,-1.0
256,32768,2048,4096,False,torch.bfloat16,torch.bfloat16,False,False,asm,1,2,-1.0,_ZN5aiter39bf16gemm_fp32bf16_tn_32x64_splitk_cleanE,1.0,-1.0,-1.0
256,32768,2048,4096,False,torch.bfloat16,torch.bfloat16,False,False,asm,1,4,-1.0,_ZN5aiter39bf16gemm_fp32bf16_tn_32x64_splitk_cleanE,1.0,-1.0,-1.0
256,32768,2048,4096,False,torch.bfloat16,torch.bfloat16,False,False,asm,5,3,-1.0,_ZN5aiter39bf16gemm_fp32bf16_tn_64x64_splitk_cleanE,1.0,-1.0,-1.0
256,32768,2048,4096,False,torch.bfloat16,torch.bfloat16,False,False,asm,1,3,-1.0,_ZN5aiter39bf16gemm_fp32bf16_tn_32x64_splitk_cleanE,1.0,-1.0,-1.0
256,32768,2048,4096,False,torch.bfloat16,torch.bfloat16,False,False,asm,7,4,-1.0,_ZN5aiter39bf16gemm_fp32bf16_tn_80x64_splitk_cleanE,1.0,-1.0,-1.0
256,32768,2048,4096,False,torch.bfloat16,torch.bfloat16,False,False,asm,8,4,-1.0,_ZN5aiter39bf16gemm_fp32bf16_tn_96x64_splitk_cleanE,1.0,-1.0,-1.0
256,32768,2048,4096,False,torch.bfloat16,torch.bfloat16,False,False,asm,8,3,-1.0,_ZN5aiter39bf16gemm_fp32bf16_tn_96x64_splitk_cleanE,1.0,-1.0,-1.0
256,32768,2048,4096,False,torch.bfloat16,torch.bfloat16,False,False,asm,8,2,-1.0,_ZN5aiter39bf16gemm_fp32bf16_tn_96x64_splitk_cleanE,1.0,-1.0,-1.0
256,32768,2048,4096,False,torch.bfloat16,torch.bfloat16,False,False,asm,7,2,-1.0,_ZN5aiter39bf16gemm_fp32bf16_tn_80x64_splitk_cleanE,1.0,-1.0,-1.0
256,32768,2048,4096,False,torch.bfloat16,torch.bfloat16,False,False,asm,7,3,-1.0,_ZN5aiter39bf16gemm_fp32bf16_tn_80x64_splitk_cleanE,1.0,-1.0,-1.0
256,32768,2048,4096,False,torch.bfloat16,torch.bfloat16,False,False,hipblaslt,438241,0,371.0894,,0.0,1481.46,1130.27
256,32768,2048,4096,False,torch.bfloat16,torch.bfloat16,False,False,hipblaslt,439222,0,374.6086,,0.0,1467.55,1119.65
256,32768,2048,4096,False,torch.bfloat16,torch.bfloat16,False,False,hipblaslt,439361,0,377.3592,,0.0,1456.85,1111.49
256,32768,2048,4096,False,torch.bfloat16,torch.bfloat16,False,False,hipblaslt,439167,0,378.6753,,0.0,1451.79,1107.63
256,32768,2048,4096,False,torch.bfloat16,torch.bfloat16,False,False,hipblaslt,439278,0,382.0945,,0.0,1438.8,1097.71
256,32768,2048,4096,False,torch.bfloat16,torch.bfloat16,False,False,hipblaslt,438386,0,382.3636,,0.0,1437.78,1096.94
256,32768,2048,4096,False,torch.bfloat16,torch.bfloat16,False,False,hipblaslt,439801,0,382.4821,,0.0,1437.34,1096.6
256,32768,2048,4096,False,torch.bfloat16,torch.bfloat16,False,False,hipblaslt,438243,0,382.6762,,0.0,1436.61,1096.05
256,32768,2048,4096,False,torch.bfloat16,torch.bfloat16,False,False,hipblaslt,439320,0,383.7489,,0.0,1432.59,1092.98
256,32768,2048,4096,False,torch.bfloat16,torch.bfloat16,False,False,hipblaslt,439304,0,384.3653,,0.0,1430.3,1091.23
256,32768,2048,4096,False,torch.bfloat16,torch.bfloat16,False,False,hipblaslt,439301,0,387.176,,0.0,1419.91,1083.31
256,32768,2048,4096,False,torch.bfloat16,torch.bfloat16,False,False,hipblaslt,439325,0,392.4177,,0.0,1400.95,1068.84
256,32768,2048,4096,False,torch.bfloat16,torch.bfloat16,False,False,asm,10,1,403.2649,_ZN5aiter24bf16gemm_bf16_tn_256x256E,0.0,1363.26,1040.09
256,32768,2048,4096,False,torch.bfloat16,torch.bfloat16,False,False,hipblaslt,439365,0,403.9488,,0.0,1360.95,1038.33
256,32768,2048,4096,False,torch.bfloat16,torch.bfloat16,False,False,hipblaslt,440238,0,408.5666,,0.0,1345.57,1026.59
256,32768,2048,4096,False,torch.bfloat16,torch.bfloat16,False,False,hipblaslt,440235,0,410.1044,,0.0,1340.53,1022.74
256,32768,2048,4096,False,torch.bfloat16,torch.bfloat16,False,False,hipblaslt,440239,0,411.9302,,0.0,1334.58,1018.21
256,32768,2048,4096,False,torch.bfloat16,torch.bfloat16,False,False,hipblaslt,440237,0,417.7367,,0.0,1316.03,1004.05
256,32768,2048,4096,False,torch.bfloat16,torch.bfloat16,False,False,hipblaslt,439224,0,418.1513,,0.0,1314.73,1003.06
256,32768,2048,4096,False,torch.bfloat16,torch.bfloat16,False,False,hipblaslt,439283,0,422.5818,,0.0,1300.95,992.54
256,32768,2048,4096,False,torch.bfloat16,torch.bfloat16,False,False,hipblaslt,438159,0,505.7497,,0.0,1087.01,829.32
256,32768,2048,4096,False,torch.bfloat16,torch.bfloat16,False,False,asm,9,1,1107.1509,_ZN5aiter37bf16gemm_fp32bf16_tn_96x64_pf3_splitkE,0.0,496.55,378.84
256,32768,2048,4096,False,torch.bfloat16,torch.bfloat16,False,False,asm,6,1,1463.9432,_ZN5aiter37bf16gemm_fp32bf16_tn_64x64_pf3_splitkE,0.0,375.53,286.51
256,32768,2048,4096,False,torch.bfloat16,torch.bfloat16,False,False,asm,4,1,1832.6769,_ZN5aiter37bf16gemm_fp32bf16_tn_48x64_pf3_splitkE,0.0,299.97,228.86
256,32768,2048,4096,False,torch.bfloat16,torch.bfloat16,False,False,asm,2,1,2498.685,_ZN5aiter37bf16gemm_fp32bf16_tn_32x64_pf3_splitkE,0.0,220.02,167.86
256,65536,2048,4096,False,torch.bfloat16,torch.bfloat16,False,False,asm,3,2,-1.0,_ZN5aiter39bf16gemm_fp32bf16_tn_48x64_splitk_cleanE,1.0,-1.0,-1.0
256,65536,2048,4096,False,torch.bfloat16,torch.bfloat16,False,False,asm,3,3,-1.0,_ZN5aiter39bf16gemm_fp32bf16_tn_48x64_splitk_cleanE,1.0,-1.0,-1.0
256,65536,2048,4096,False,torch.bfloat16,torch.bfloat16,False,False,asm,3,4,-1.0,_ZN5aiter39bf16gemm_fp32bf16_tn_48x64_splitk_cleanE,1.0,-1.0,-1.0
256,65536,2048,4096,False,torch.bfloat16,torch.bfloat16,False,False,asm,5,2,-1.0,_ZN5aiter39bf16gemm_fp32bf16_tn_64x64_splitk_cleanE,1.0,-1.0,-1.0
256,65536,2048,4096,False,torch.bfloat16,torch.bfloat16,False,False,asm,5,4,-1.0,_ZN5aiter39bf16gemm_fp32bf16_tn_64x64_splitk_cleanE,1.0,-1.0,-1.0
256,65536,2048,4096,False,torch.bfloat16,torch.bfloat16,False,False,asm,1,2,-1.0,_ZN5aiter39bf16gemm_fp32bf16_tn_32x64_splitk_cleanE,1.0,-1.0,-1.0
256,65536,2048,4096,False,torch.bfloat16,torch.bfloat16,False,False,asm,1,4,-1.0,_ZN5aiter39bf16gemm_fp32bf16_tn_32x64_splitk_cleanE,1.0,-1.0,-1.0
256,65536,2048,4096,False,torch.bfloat16,torch.bfloat16,False,False,asm,5,3,-1.0,_ZN5aiter39bf16gemm_fp32bf16_tn_64x64_splitk_cleanE,1.0,-1.0,-1.0
256,65536,2048,4096,False,torch.bfloat16,torch.bfloat16,False,False,asm,1,3,-1.0,_ZN5aiter39bf16gemm_fp32bf16_tn_32x64_splitk_cleanE,1.0,-1.0,-1.0
256,65536,2048,4096,False,torch.bfloat16,torch.bfloat16,False,False,asm,7,4,-1.0,_ZN5aiter39bf16gemm_fp32bf16_tn_80x64_splitk_cleanE,1.0,-1.0,-1.0
256,65536,2048,4096,False,torch.bfloat16,torch.bfloat16,False,False,asm,8,4,-1.0,_ZN5aiter39bf16gemm_fp32bf16_tn_96x64_splitk_cleanE,1.0,-1.0,-1.0
256,65536,2048,4096,False,torch.bfloat16,torch.bfloat16,False,False,asm,8,3,-1.0,_ZN5aiter39bf16gemm_fp32bf16_tn_96x64_splitk_cleanE,1.0,-1.0,-1.0
256,65536,2048,4096,False,torch.bfloat16,torch.bfloat16,False,False,asm,8,2,-1.0,_ZN5aiter39bf16gemm_fp32bf16_tn_96x64_splitk_cleanE,1.0,-1.0,-1.0
256,65536,2048,4096,False,torch.bfloat16,torch.bfloat16,False,False,asm,7,2,-1.0,_ZN5aiter39bf16gemm_fp32bf16_tn_80x64_splitk_cleanE,1.0,-1.0,-1.0
256,65536,2048,4096,False,torch.bfloat16,torch.bfloat16,False,False,asm,7,3,-1.0,_ZN5aiter39bf16gemm_fp32bf16_tn_80x64_splitk_cleanE,1.0,-1.0,-1.0
256,65536,2048,4096,False,torch.bfloat16,torch.bfloat16,False,False,hipblaslt,439801,0,721.3381,,0.0,1524.27,1139.66
256,65536,2048,4096,False,torch.bfloat16,torch.bfloat16,False,False,hipblaslt,438244,0,724.0709,,0.0,1518.51,1135.36
256,65536,2048,4096,False,torch.bfloat16,torch.bfloat16,False,False,hipblaslt,438386,0,727.9163,,0.0,1510.49,1129.37
256,65536,2048,4096,False,torch.bfloat16,torch.bfloat16,False,False,hipblaslt,439365,0,729.3101,,0.0,1507.61,1127.21
256,65536,2048,4096,False,torch.bfloat16,torch.bfloat16,False,False,hipblaslt,439297,0,738.4859,,0.0,1488.87,1113.2
256,65536,2048,4096,False,torch.bfloat16,torch.bfloat16,False,False,hipblaslt,439361,0,739.1121,,0.0,1487.61,1112.26
256,65536,2048,4096,False,torch.bfloat16,torch.bfloat16,False,False,hipblaslt,439227,0,741.6219,,0.0,1482.58,1108.49
256,65536,2048,4096,False,torch.bfloat16,torch.bfloat16,False,False,hipblaslt,439220,0,742.204,,0.0,1481.41,1107.62
256,65536,2048,4096,False,torch.bfloat16,torch.bfloat16,False,False,hipblaslt,439231,0,745.4611,,0.0,1474.94,1102.79
256,65536,2048,4096,False,torch.bfloat16,torch.bfloat16,False,False,hipblaslt,439286,0,747.0693,,0.0,1471.77,1100.41
256,65536,2048,4096,False,torch.bfloat16,torch.bfloat16,False,False,hipblaslt,439277,0,754.5015,,0.0,1457.27,1089.57
256,65536,2048,4096,False,torch.bfloat16,torch.bfloat16,False,False,hipblaslt,439399,0,754.7692,,0.0,1456.75,1089.19
256,65536,2048,4096,False,torch.bfloat16,torch.bfloat16,False,False,hipblaslt,440058,0,764.8789,,0.0,1437.5,1074.79
256,65536,2048,4096,False,torch.bfloat16,torch.bfloat16,False,False,hipblaslt,440239,0,766.6953,,0.0,1434.09,1072.24
256,65536,2048,4096,False,torch.bfloat16,torch.bfloat16,False,False,hipblaslt,439223,0,774.977,,0.0,1418.77,1060.78
256,65536,2048,4096,False,torch.bfloat16,torch.bfloat16,False,False,hipblaslt,439401,0,777.7921,,0.0,1413.63,1056.95
256,65536,2048,4096,False,torch.bfloat16,torch.bfloat16,False,False,hipblaslt,440237,0,780.9609,,0.0,1407.9,1052.66
256,65536,2048,4096,False,torch.bfloat16,torch.bfloat16,False,False,hipblaslt,438309,0,782.0834,,0.0,1405.88,1051.15
256,65536,2048,4096,False,torch.bfloat16,torch.bfloat16,False,False,hipblaslt,438242,0,788.9156,,0.0,1393.7,1042.04
256,65536,2048,4096,False,torch.bfloat16,torch.bfloat16,False,False,hipblaslt,440238,0,789.4599,,0.0,1392.74,1041.32
256,65536,2048,4096,False,torch.bfloat16,torch.bfloat16,False,False,asm,10,1,798.572,_ZN5aiter24bf16gemm_bf16_tn_256x256E,0.0,1376.85,1029.44
256,65536,2048,4096,False,torch.bfloat16,torch.bfloat16,False,False,asm,9,1,2260.5233,_ZN5aiter37bf16gemm_fp32bf16_tn_96x64_pf3_splitkE,0.0,486.4,363.67
256,65536,2048,4096,False,torch.bfloat16,torch.bfloat16,False,False,asm,6,1,2909.7436,_ZN5aiter37bf16gemm_fp32bf16_tn_64x64_pf3_splitkE,0.0,377.87,282.53
256,65536,2048,4096,False,torch.bfloat16,torch.bfloat16,False,False,asm,4,1,3619.3194,_ZN5aiter37bf16gemm_fp32bf16_tn_48x64_pf3_splitkE,0.0,303.79,227.14
256,65536,2048,4096,False,torch.bfloat16,torch.bfloat16,False,False,asm,2,1,4962.3996,_ZN5aiter37bf16gemm_fp32bf16_tn_32x64_pf3_splitkE,0.0,221.57,165.66
256,131072,2048,4096,False,torch.bfloat16,torch.bfloat16,False,False,asm,3,2,-1.0,_ZN5aiter39bf16gemm_fp32bf16_tn_48x64_splitk_cleanE,1.0,-1.0,-1.0
256,131072,2048,4096,False,torch.bfloat16,torch.bfloat16,False,False,asm,3,3,-1.0,_ZN5aiter39bf16gemm_fp32bf16_tn_48x64_splitk_cleanE,1.0,-1.0,-1.0
256,131072,2048,4096,False,torch.bfloat16,torch.bfloat16,False,False,asm,3,4,-1.0,_ZN5aiter39bf16gemm_fp32bf16_tn_48x64_splitk_cleanE,1.0,-1.0,-1.0
256,131072,2048,4096,False,torch.bfloat16,torch.bfloat16,False,False,asm,5,2,-1.0,_ZN5aiter39bf16gemm_fp32bf16_tn_64x64_splitk_cleanE,1.0,-1.0,-1.0
256,131072,2048,4096,False,torch.bfloat16,torch.bfloat16,False,False,asm,5,4,-1.0,_ZN5aiter39bf16gemm_fp32bf16_tn_64x64_splitk_cleanE,1.0,-1.0,-1.0
256,131072,2048,4096,False,torch.bfloat16,torch.bfloat16,False,False,asm,1,2,-1.0,_ZN5aiter39bf16gemm_fp32bf16_tn_32x64_splitk_cleanE,1.0,-1.0,-1.0
256,131072,2048,4096,False,torch.bfloat16,torch.bfloat16,False,False,asm,1,4,-1.0,_ZN5aiter39bf16gemm_fp32bf16_tn_32x64_splitk_cleanE,1.0,-1.0,-1.0
256,131072,2048,4096,False,torch.bfloat16,torch.bfloat16,False,False,asm,5,3,-1.0,_ZN5aiter39bf16gemm_fp32bf16_tn_64x64_splitk_cleanE,1.0,-1.0,-1.0
256,131072,2048,4096,False,torch.bfloat16,torch.bfloat16,False,False,asm,1,3,-1.0,_ZN5aiter39bf16gemm_fp32bf16_tn_32x64_splitk_cleanE,1.0,-1.0,-1.0
256,131072,2048,4096,False,torch.bfloat16,torch.bfloat16,False,False,asm,7,4,-1.0,_ZN5aiter39bf16gemm_fp32bf16_tn_80x64_splitk_cleanE,1.0,-1.0,-1.0
256,131072,2048,4096,False,torch.bfloat16,torch.bfloat16,False,False,asm,8,4,-1.0,_ZN5aiter39bf16gemm_fp32bf16_tn_96x64_splitk_cleanE,1.0,-1.0,-1.0
256,131072,2048,4096,False,torch.bfloat16,torch.bfloat16,False,False,asm,8,3,-1.0,_ZN5aiter39bf16gemm_fp32bf16_tn_96x64_splitk_cleanE,1.0,-1.0,-1.0
256,131072,2048,4096,False,torch.bfloat16,torch.bfloat16,False,False,asm,8,2,-1.0,_ZN5aiter39bf16gemm_fp32bf16_tn_96x64_splitk_cleanE,1.0,-1.0,-1.0
256,131072,2048,4096,False,torch.bfloat16,torch.bfloat16,False,False,asm,7,2,-1.0,_ZN5aiter39bf16gemm_fp32bf16_tn_80x64_splitk_cleanE,1.0,-1.0,-1.0
256,131072,2048,4096,False,torch.bfloat16,torch.bfloat16,False,False,asm,7,3,-1.0,_ZN5aiter39bf16gemm_fp32bf16_tn_80x64_splitk_cleanE,1.0,-1.0,-1.0
256,131072,2048,4096,False,torch.bfloat16,torch.bfloat16,False,False,hipblaslt,439801,0,1433.2409,,0.0,1534.3,1135.46
256,131072,2048,4096,False,torch.bfloat16,torch.bfloat16,False,False,hipblaslt,439365,0,1441.8394,,0.0,1525.15,1128.69
256,131072,2048,4096,False,torch.bfloat16,torch.bfloat16,False,False,hipblaslt,439175,0,1444.4167,,0.0,1522.43,1126.68
256,131072,2048,4096,False,torch.bfloat16,torch.bfloat16,False,False,hipblaslt,439397,0,1447.3748,,0.0,1519.32,1124.37
256,131072,2048,4096,False,torch.bfloat16,torch.bfloat16,False,False,hipblaslt,439391,0,1455.9069,,0.0,1510.41,1117.78
256,131072,2048,4096,False,torch.bfloat16,torch.bfloat16,False,False,hipblaslt,439352,0,1459.3741,,0.0,1506.83,1115.13
256,131072,2048,4096,False,torch.bfloat16,torch.bfloat16,False,False,hipblaslt,440235,0,1471.4581,,0.0,1494.45,1105.97
256,131072,2048,4096,False,torch.bfloat16,torch.bfloat16,False,False,hipblaslt,439304,0,1475.7593,,0.0,1490.1,1102.75
256,131072,2048,4096,False,torch.bfloat16,torch.bfloat16,False,False,hipblaslt,439301,0,1480.0566,,0.0,1485.77,1099.55
256,131072,2048,4096,False,torch.bfloat16,torch.bfloat16,False,False,hipblaslt,439310,0,1482.4514,,0.0,1483.37,1097.77
256,131072,2048,4096,False,torch.bfloat16,torch.bfloat16,False,False,hipblaslt,439051,0,1488.0825,,0.0,1477.76,1093.62
256,131072,2048,4096,False,torch.bfloat16,torch.bfloat16,False,False,hipblaslt,439323,0,1492.9517,,0.0,1472.94,1090.05
256,131072,2048,4096,False,torch.bfloat16,torch.bfloat16,False,False,hipblaslt,439317,0,1494.5363,,0.0,1471.37,1088.89
256,131072,2048,4096,False,torch.bfloat16,torch.bfloat16,False,False,hipblaslt,439316,0,1502.9371,,0.0,1463.15,1082.81
256,131072,2048,4096,False,torch.bfloat16,torch.bfloat16,False,False,hipblaslt,439297,0,1502.9985,,0.0,1463.09,1082.76
256,131072,2048,4096,False,torch.bfloat16,torch.bfloat16,False,False,hipblaslt,439212,0,1504.8176,,0.0,1461.32,1081.45
256,131072,2048,4096,False,torch.bfloat16,torch.bfloat16,False,False,hipblaslt,439302,0,1507.1251,,0.0,1459.08,1079.8
256,131072,2048,4096,False,torch.bfloat16,torch.bfloat16,False,False,hipblaslt,439111,0,1510.9428,,0.0,1455.4,1077.07
256,131072,2048,4096,False,torch.bfloat16,torch.bfloat16,False,False,hipblaslt,439229,0,1518.9795,,0.0,1447.7,1071.37
256,131072,2048,4096,False,torch.bfloat16,torch.bfloat16,False,False,hipblaslt,438242,0,1519.4095,,0.0,1447.29,1071.07
256,131072,2048,4096,False,torch.bfloat16,torch.bfloat16,False,False,asm,10,1,1590.624,_ZN5aiter24bf16gemm_bf16_tn_256x256E,0.0,1382.49,1023.11
256,131072,2048,4096,False,torch.bfloat16,torch.bfloat16,False,False,asm,9,1,4433.6669,_ZN5aiter37bf16gemm_fp32bf16_tn_96x64_pf3_splitkE,0.0,495.98,367.05
256,131072,2048,4096,False,torch.bfloat16,torch.bfloat16,False,False,asm,6,1,5785.5738,_ZN5aiter37bf16gemm_fp32bf16_tn_64x64_pf3_splitkE,0.0,380.09,281.28
256,131072,2048,4096,False,torch.bfloat16,torch.bfloat16,False,False,asm,4,1,7207.1775,_ZN5aiter37bf16gemm_fp32bf16_tn_48x64_pf3_splitkE,0.0,305.12,225.8
256,131072,2048,4096,False,torch.bfloat16,torch.bfloat16,False,False,asm,2,1,9928.3733,_ZN5aiter37bf16gemm_fp32bf16_tn_32x64_pf3_splitkE,0.0,221.49,163.91
256,262144,2048,4096,False,torch.bfloat16,torch.bfloat16,False,False,asm,3,2,-1.0,_ZN5aiter39bf16gemm_fp32bf16_tn_48x64_splitk_cleanE,1.0,-1.0,-1.0
256,262144,2048,4096,False,torch.bfloat16,torch.bfloat16,False,False,asm,3,3,-1.0,_ZN5aiter39bf16gemm_fp32bf16_tn_48x64_splitk_cleanE,1.0,-1.0,-1.0
256,262144,2048,4096,False,torch.bfloat16,torch.bfloat16,False,False,asm,3,4,-1.0,_ZN5aiter39bf16gemm_fp32bf16_tn_48x64_splitk_cleanE,1.0,-1.0,-1.0
256,262144,2048,4096,False,torch.bfloat16,torch.bfloat16,False,False,asm,5,2,-1.0,_ZN5aiter39bf16gemm_fp32bf16_tn_64x64_splitk_cleanE,1.0,-1.0,-1.0
256,262144,2048,4096,False,torch.bfloat16,torch.bfloat16,False,False,asm,5,4,-1.0,_ZN5aiter39bf16gemm_fp32bf16_tn_64x64_splitk_cleanE,1.0,-1.0,-1.0
256,262144,2048,4096,False,torch.bfloat16,torch.bfloat16,False,False,asm,1,2,-1.0,_ZN5aiter39bf16gemm_fp32bf16_tn_32x64_splitk_cleanE,1.0,-1.0,-1.0
256,262144,2048,4096,False,torch.bfloat16,torch.bfloat16,False,False,asm,1,4,-1.0,_ZN5aiter39bf16gemm_fp32bf16_tn_32x64_splitk_cleanE,1.0,-1.0,-1.0
256,262144,2048,4096,False,torch.bfloat16,torch.bfloat16,False,False,asm,5,3,-1.0,_ZN5aiter39bf16gemm_fp32bf16_tn_64x64_splitk_cleanE,1.0,-1.0,-1.0
256,262144,2048,4096,False,torch.bfloat16,torch.bfloat16,False,False,asm,1,3,-1.0,_ZN5aiter39bf16gemm_fp32bf16_tn_32x64_splitk_cleanE,1.0,-1.0,-1.0
256,262144,2048,4096,False,torch.bfloat16,torch.bfloat16,False,False,asm,7,4,-1.0,_ZN5aiter39bf16gemm_fp32bf16_tn_80x64_splitk_cleanE,1.0,-1.0,-1.0
256,262144,2048,4096,False,torch.bfloat16,torch.bfloat16,False,False,asm,8,4,-1.0,_ZN5aiter39bf16gemm_fp32bf16_tn_96x64_splitk_cleanE,1.0,-1.0,-1.0
256,262144,2048,4096,False,torch.bfloat16,torch.bfloat16,False,False,asm,8,3,-1.0,_ZN5aiter39bf16gemm_fp32bf16_tn_96x64_splitk_cleanE,1.0,-1.0,-1.0
256,262144,2048,4096,False,torch.bfloat16,torch.bfloat16,False,False,asm,8,2,-1.0,_ZN5aiter39bf16gemm_fp32bf16_tn_96x64_splitk_cleanE,1.0,-1.0,-1.0
256,262144,2048,4096,False,torch.bfloat16,torch.bfloat16,False,False,asm,7,2,-1.0,_ZN5aiter39bf16gemm_fp32bf16_tn_80x64_splitk_cleanE,1.0,-1.0,-1.0
256,262144,2048,4096,False,torch.bfloat16,torch.bfloat16,False,False,asm,7,3,-1.0,_ZN5aiter39bf16gemm_fp32bf16_tn_80x64_splitk_cleanE,1.0,-1.0,-1.0
256,262144,2048,4096,False,torch.bfloat16,torch.bfloat16,False,False,hipblaslt,438229,0,2863.9169,,0.0,1535.68,1130.62
256,262144,2048,4096,False,torch.bfloat16,torch.bfloat16,False,False,hipblaslt,438386,0,2874.4336,,0.0,1530.06,1126.48
256,262144,2048,4096,False,torch.bfloat16,torch.bfloat16,False,False,hipblaslt,439401,0,2880.5063,,0.0,1526.83,1124.11
256,262144,2048,4096,False,torch.bfloat16,torch.bfloat16,False,False,hipblaslt,439317,0,2888.675,,0.0,1522.51,1120.93
256,262144,2048,4096,False,torch.bfloat16,torch.bfloat16,False,False,hipblaslt,439282,0,2905.9858,,0.0,1513.44,1114.25
256,262144,2048,4096,False,torch.bfloat16,torch.bfloat16,False,False,hipblaslt,439365,0,2911.7057,,0.0,1510.47,1112.06
256,262144,2048,4096,False,torch.bfloat16,torch.bfloat16,False,False,hipblaslt,439223,0,2913.9084,,0.0,1509.33,1111.22
256,262144,2048,4096,False,torch.bfloat16,torch.bfloat16,False,False,hipblaslt,439225,0,2914.3792,,0.0,1509.09,1111.04
256,262144,2048,4096,False,torch.bfloat16,torch.bfloat16,False,False,hipblaslt,439306,0,2916.7792,,0.0,1507.84,1110.13
256,262144,2048,4096,False,torch.bfloat16,torch.bfloat16,False,False,hipblaslt,439304,0,2918.0943,,0.0,1507.16,1109.63
256,262144,2048,4096,False,torch.bfloat16,torch.bfloat16,False,False,hipblaslt,438243,0,2922.0463,,0.0,1505.13,1108.13
256,262144,2048,4096,False,torch.bfloat16,torch.bfloat16,False,False,hipblaslt,438309,0,2925.5649,,0.0,1503.32,1106.8
256,262144,2048,4096,False,torch.bfloat16,torch.bfloat16,False,False,hipblaslt,439175,0,2939.1787,,0.0,1496.35,1101.67
256,262144,2048,4096,False,torch.bfloat16,torch.bfloat16,False,False,hipblaslt,439801,0,2959.5366,,0.0,1486.06,1094.09
256,262144,2048,4096,False,torch.bfloat16,torch.bfloat16,False,False,hipblaslt,439303,0,2961.8593,,0.0,1484.89,1093.23
256,262144,2048,4096,False,torch.bfloat16,torch.bfloat16,False,False,hipblaslt,439397,0,2975.8838,,0.0,1477.9,1088.08
256,262144,2048,4096,False,torch.bfloat16,torch.bfloat16,False,False,hipblaslt,439364,0,2981.3171,,0.0,1475.2,1086.1
256,262144,2048,4096,False,torch.bfloat16,torch.bfloat16,False,False,hipblaslt,439311,0,2990.428,,0.0,1470.71,1082.79
256,262144,2048,4096,False,torch.bfloat16,torch.bfloat16,False,False,hipblaslt,438242,0,2997.3254,,0.0,1467.32,1080.3
256,262144,2048,4096,False,torch.bfloat16,torch.bfloat16,False,False,hipblaslt,439167,0,3022.457,,0.0,1455.12,1071.31
256,262144,2048,4096,False,torch.bfloat16,torch.bfloat16,False,False,asm,10,1,3086.8962,_ZN5aiter24bf16gemm_bf16_tn_256x256E,0.0,1424.75,1048.95
256,262144,2048,4096,False,torch.bfloat16,torch.bfloat16,False,False,asm,9,1,8763.9565,_ZN5aiter37bf16gemm_fp32bf16_tn_96x64_pf3_splitkE,0.0,501.83,369.47
256,262144,2048,4096,False,torch.bfloat16,torch.bfloat16,False,False,asm,6,1,11814.8732,_ZN5aiter37bf16gemm_fp32bf16_tn_64x64_pf3_splitkE,0.0,372.25,274.06
256,262144,2048,4096,False,torch.bfloat16,torch.bfloat16,False,False,asm,4,1,14336.1349,_ZN5aiter37bf16gemm_fp32bf16_tn_48x64_pf3_splitkE,0.0,306.78,225.86
256,262144,2048,4096,False,torch.bfloat16,torch.bfloat16,False,False,asm,2,1,19928.8297,_ZN5aiter37bf16gemm_fp32bf16_tn_32x64_pf3_splitkE,0.0,220.69,162.48
256,524288,2048,4096,False,torch.bfloat16,torch.bfloat16,False,False,asm,3,2,-1.0,_ZN5aiter39bf16gemm_fp32bf16_tn_48x64_splitk_cleanE,1.0,-1.0,-1.0
256,524288,2048,4096,False,torch.bfloat16,torch.bfloat16,False,False,asm,3,3,-1.0,_ZN5aiter39bf16gemm_fp32bf16_tn_48x64_splitk_cleanE,1.0,-1.0,-1.0
256,524288,2048,4096,False,torch.bfloat16,torch.bfloat16,False,False,asm,3,4,-1.0,_ZN5aiter39bf16gemm_fp32bf16_tn_48x64_splitk_cleanE,1.0,-1.0,-1.0
256,524288,2048,4096,False,torch.bfloat16,torch.bfloat16,False,False,asm,5,2,-1.0,_ZN5aiter39bf16gemm_fp32bf16_tn_64x64_splitk_cleanE,1.0,-1.0,-1.0
256,524288,2048,4096,False,torch.bfloat16,torch.bfloat16,False,False,asm,5,4,-1.0,_ZN5aiter39bf16gemm_fp32bf16_tn_64x64_splitk_cleanE,1.0,-1.0,-1.0
256,524288,2048,4096,False,torch.bfloat16,torch.bfloat16,False,False,asm,1,2,-1.0,_ZN5aiter39bf16gemm_fp32bf16_tn_32x64_splitk_cleanE,1.0,-1.0,-1.0
256,524288,2048,4096,False,torch.bfloat16,torch.bfloat16,False,False,asm,1,4,-1.0,_ZN5aiter39bf16gemm_fp32bf16_tn_32x64_splitk_cleanE,1.0,-1.0,-1.0
256,524288,2048,4096,False,torch.bfloat16,torch.bfloat16,False,False,asm,5,3,-1.0,_ZN5aiter39bf16gemm_fp32bf16_tn_64x64_splitk_cleanE,1.0,-1.0,-1.0
256,524288,2048,4096,False,torch.bfloat16,torch.bfloat16,False,False,asm,1,3,-1.0,_ZN5aiter39bf16gemm_fp32bf16_tn_32x64_splitk_cleanE,1.0,-1.0,-1.0
256,524288,2048,4096,False,torch.bfloat16,torch.bfloat16,False,False,asm,7,4,-1.0,_ZN5aiter39bf16gemm_fp32bf16_tn_80x64_splitk_cleanE,1.0,-1.0,-1.0
256,524288,2048,4096,False,torch.bfloat16,torch.bfloat16,False,False,asm,8,4,-1.0,_ZN5aiter39bf16gemm_fp32bf16_tn_96x64_splitk_cleanE,1.0,-1.0,-1.0
256,524288,2048,4096,False,torch.bfloat16,torch.bfloat16,False,False,asm,8,3,-1.0,_ZN5aiter39bf16gemm_fp32bf16_tn_96x64_splitk_cleanE,1.0,-1.0,-1.0
256,524288,2048,4096,False,torch.bfloat16,torch.bfloat16,False,False,asm,8,2,-1.0,_ZN5aiter39bf16gemm_fp32bf16_tn_96x64_splitk_cleanE,1.0,-1.0,-1.0
256,524288,2048,4096,False,torch.bfloat16,torch.bfloat16,False,False,asm,7,2,-1.0,_ZN5aiter39bf16gemm_fp32bf16_tn_80x64_splitk_cleanE,1.0,-1.0,-1.0
256,524288,2048,4096,False,torch.bfloat16,torch.bfloat16,False,False,asm,7,3,-1.0,_ZN5aiter39bf16gemm_fp32bf16_tn_80x64_splitk_cleanE,1.0,-1.0,-1.0
256,524288,2048,4096,False,torch.bfloat16,torch.bfloat16,False,False,hipblaslt,439352,0,5749.1973,,0.0,1529.97,1123.5
256,524288,2048,4096,False,torch.bfloat16,torch.bfloat16,False,False,hipblaslt,440235,0,5767.5962,,0.0,1525.09,1119.92
256,524288,2048,4096,False,torch.bfloat16,torch.bfloat16,False,False,hipblaslt,439279,0,5785.5577,,0.0,1520.35,1116.44
256,524288,2048,4096,False,torch.bfloat16,torch.bfloat16,False,False,hipblaslt,439398,0,5785.6783,,0.0,1520.32,1116.42
256,524288,2048,4096,False,torch.bfloat16,torch.bfloat16,False,False,hipblaslt,439221,0,5795.7994,,0.0,1517.67,1114.47
256,524288,2048,4096,False,torch.bfloat16,torch.bfloat16,False,False,hipblaslt,439287,0,5796.2356,,0.0,1517.55,1114.38
256,524288,2048,4096,False,torch.bfloat16,torch.bfloat16,False,False,hipblaslt,439229,0,5832.3708,,0.0,1508.15,1107.48
256,524288,2048,4096,False,torch.bfloat16,torch.bfloat16,False,False,hipblaslt,439282,0,5839.6392,,0.0,1506.27,1106.1
256,524288,2048,4096,False,torch.bfloat16,torch.bfloat16,False,False,hipblaslt,439311,0,5855.7499,,0.0,1502.13,1103.06
256,524288,2048,4096,False,torch.bfloat16,torch.bfloat16,False,False,hipblaslt,439323,0,5889.5728,,0.0,1493.5,1096.72
256,524288,2048,4096,False,torch.bfloat16,torch.bfloat16,False,False,hipblaslt,438366,0,5897.7519,,0.0,1491.43,1095.2
256,524288,2048,4096,False,torch.bfloat16,torch.bfloat16,False,False,hipblaslt,439110,0,5916.2856,,0.0,1486.76,1091.77
256,524288,2048,4096,False,torch.bfloat16,torch.bfloat16,False,False,hipblaslt,439401,0,5921.5312,,0.0,1485.44,1090.8
256,524288,2048,4096,False,torch.bfloat16,torch.bfloat16,False,False,hipblaslt,439325,0,5932.6991,,0.0,1482.65,1088.75
256,524288,2048,4096,False,torch.bfloat16,torch.bfloat16,False,False,hipblaslt,438244,0,5956.589,,0.0,1476.7,1084.38
256,524288,2048,4096,False,torch.bfloat16,torch.bfloat16,False,False,hipblaslt,438241,0,5957.1445,,0.0,1476.56,1084.28
256,524288,2048,4096,False,torch.bfloat16,torch.bfloat16,False,False,hipblaslt,440236,0,5970.711,,0.0,1473.21,1081.82
256,524288,2048,4096,False,torch.bfloat16,torch.bfloat16,False,False,hipblaslt,439317,0,5986.5212,,0.0,1469.32,1078.96
256,524288,2048,4096,False,torch.bfloat16,torch.bfloat16,False,False,hipblaslt,439224,0,6013.7099,,0.0,1462.67,1074.08
256,524288,2048,4096,False,torch.bfloat16,torch.bfloat16,False,False,hipblaslt,439304,0,6053.3609,,0.0,1453.09,1067.05
256,524288,2048,4096,False,torch.bfloat16,torch.bfloat16,False,False,asm,10,1,6079.9138,_ZN5aiter24bf16gemm_bf16_tn_256x256E,0.7512,1446.75,1062.39
256,524288,2048,4096,False,torch.bfloat16,torch.bfloat16,False,False,asm,9,1,17390.2421,_ZN5aiter37bf16gemm_fp32bf16_tn_96x64_pf3_splitkE,0.7512,505.81,371.43
256,524288,2048,4096,False,torch.bfloat16,torch.bfloat16,False,False,asm,6,1,23036.4923,_ZN5aiter37bf16gemm_fp32bf16_tn_64x64_pf3_splitkE,0.7512,381.83,280.39
256,524288,2048,4096,False,torch.bfloat16,torch.bfloat16,False,False,asm,4,1,28950.1379,_ZN5aiter37bf16gemm_fp32bf16_tn_48x64_pf3_splitkE,0.7512,303.84,223.12
256,524288,2048,4096,False,torch.bfloat16,torch.bfloat16,False,False,asm,2,1,39828.5278,_ZN5aiter37bf16gemm_fp32bf16_tn_32x64_pf3_splitkE,0.7512,220.85,162.18
256,1,256,4096,False,torch.bfloat16,torch.bfloat16,False,False,asm,3,9,5.0383,_ZN5aiter39bf16gemm_fp32bf16_tn_48x64_splitk_cleanE,0.0312,0.42,417.97
256,1,256,4096,False,torch.bfloat16,torch.bfloat16,False,False,asm,3,7,5.1599,_ZN5aiter39bf16gemm_fp32bf16_tn_48x64_splitk_cleanE,0.0352,0.41,408.12
256,1,256,4096,False,torch.bfloat16,torch.bfloat16,False,False,asm,1,14,5.1869,_ZN5aiter39bf16gemm_fp32bf16_tn_32x64_splitk_cleanE,0.0312,0.4,406.0
256,1,256,4096,False,torch.bfloat16,torch.bfloat16,False,False,asm,3,10,5.1886,_ZN5aiter39bf16gemm_fp32bf16_tn_48x64_splitk_cleanE,0.0273,0.4,405.86
256,1,256,4096,False,torch.bfloat16,torch.bfloat16,False,False,asm,1,12,5.3344,_ZN5aiter39bf16gemm_fp32bf16_tn_32x64_splitk_cleanE,0.0352,0.39,394.77
256,1,256,4096,False,torch.bfloat16,torch.bfloat16,False,False,asm,3,12,5.3438,_ZN5aiter39bf16gemm_fp32bf16_tn_48x64_splitk_cleanE,0.0352,0.39,394.07
256,1,256,4096,False,torch.bfloat16,torch.bfloat16,False,False,asm,3,8,5.3485,_ZN5aiter39bf16gemm_fp32bf16_tn_48x64_splitk_cleanE,0.0312,0.39,393.73
256,1,256,4096,False,torch.bfloat16,torch.bfloat16,False,False,asm,7,12,5.3514,_ZN5aiter39bf16gemm_fp32bf16_tn_80x64_splitk_cleanE,0.043,0.39,393.51
256,1,256,4096,False,torch.bfloat16,torch.bfloat16,False,False,asm,3,15,5.3524,_ZN5aiter39bf16gemm_fp32bf16_tn_48x64_splitk_cleanE,0.0391,0.39,393.44
256,1,256,4096,False,torch.bfloat16,torch.bfloat16,False,False,asm,1,16,5.3529,_ZN5aiter39bf16gemm_fp32bf16_tn_32x64_splitk_cleanE,0.0234,0.39,393.4
256,1,256,4096,False,torch.bfloat16,torch.bfloat16,False,False,asm,5,9,5.353,_ZN5aiter39bf16gemm_fp32bf16_tn_64x64_splitk_cleanE,0.0117,0.39,393.4
256,1,256,4096,False,torch.bfloat16,torch.bfloat16,False,False,asm,3,14,5.3909,_ZN5aiter39bf16gemm_fp32bf16_tn_48x64_splitk_cleanE,0.0273,0.39,390.63
256,1,256,4096,False,torch.bfloat16,torch.bfloat16,False,False,asm,1,10,5.4007,_ZN5aiter39bf16gemm_fp32bf16_tn_32x64_splitk_cleanE,0.0234,0.39,389.92
256,1,256,4096,False,torch.bfloat16,torch.bfloat16,False,False,asm,5,15,5.4395,_ZN5aiter39bf16gemm_fp32bf16_tn_64x64_splitk_cleanE,0.0312,0.39,387.14
256,1,256,4096,False,torch.bfloat16,torch.bfloat16,False,False,asm,1,9,5.4597,_ZN5aiter39bf16gemm_fp32bf16_tn_32x64_splitk_cleanE,0.0352,0.38,385.71
256,1,256,4096,False,torch.bfloat16,torch.bfloat16,False,False,asm,7,9,5.4664,_ZN5aiter39bf16gemm_fp32bf16_tn_80x64_splitk_cleanE,0.0352,0.38,385.24
256,1,256,4096,False,torch.bfloat16,torch.bfloat16,False,False,asm,8,12,5.5883,_ZN5aiter39bf16gemm_fp32bf16_tn_96x64_splitk_cleanE,0.0312,0.38,376.83
256,1,256,4096,False,torch.bfloat16,torch.bfloat16,False,False,asm,1,7,5.5897,_ZN5aiter39bf16gemm_fp32bf16_tn_32x64_splitk_cleanE,0.043,0.38,376.74
256,1,256,4096,False,torch.bfloat16,torch.bfloat16,False,False,asm,1,15,5.5914,_ZN5aiter39bf16gemm_fp32bf16_tn_32x64_splitk_cleanE,0.043,0.38,376.62
256,1,256,4096,False,torch.bfloat16,torch.bfloat16,False,False,asm,1,11,5.5947,_ZN5aiter39bf16gemm_fp32bf16_tn_32x64_splitk_cleanE,0.0508,0.37,376.4
256,1,256,4096,False,torch.bfloat16,torch.bfloat16,False,False,asm,5,7,5.6423,_ZN5aiter39bf16gemm_fp32bf16_tn_64x64_splitk_cleanE,0.0273,0.37,373.23
256,1,256,4096,False,torch.bfloat16,torch.bfloat16,False,False,asm,5,14,5.6951,_ZN5aiter39bf16gemm_fp32bf16_tn_64x64_splitk_cleanE,0.0391,0.37,369.77
256,1,256,4096,False,torch.bfloat16,torch.bfloat16,False,False,asm,8,9,5.7174,_ZN5aiter39bf16gemm_fp32bf16_tn_96x64_splitk_cleanE,0.0195,0.37,368.32
256,1,256,4096,False,torch.bfloat16,torch.bfloat16,False,False,asm,3,16,5.7268,_ZN5aiter39bf16gemm_fp32bf16_tn_48x64_splitk_cleanE,0.0156,0.37,367.72
256,1,256,4096,False,torch.bfloat16,torch.bfloat16,False,False,asm,5,8,5.7379,_ZN5aiter39bf16gemm_fp32bf16_tn_64x64_splitk_cleanE,0.0312,0.37,367.01
256,1,256,4096,False,torch.bfloat16,torch.bfloat16,False,False,asm,5,6,5.7441,_ZN5aiter39bf16gemm_fp32bf16_tn_64x64_splitk_cleanE,0.0352,0.37,366.61
256,1,256,4096,False,torch.bfloat16,torch.bfloat16,False,False,asm,7,8,5.7471,_ZN5aiter39bf16gemm_fp32bf16_tn_80x64_splitk_cleanE,0.0391,0.36,366.42
256,1,256,4096,False,torch.bfloat16,torch.bfloat16,False,False,asm,5,12,5.7823,_ZN5aiter39bf16gemm_fp32bf16_tn_64x64_splitk_cleanE,0.0508,0.36,364.19
256,1,256,4096,False,torch.bfloat16,torch.bfloat16,False,False,asm,7,10,5.7967,_ZN5aiter39bf16gemm_fp32bf16_tn_80x64_splitk_cleanE,0.0273,0.36,363.29
256,1,256,4096,False,torch.bfloat16,torch.bfloat16,False,False,asm,7,7,5.8033,_ZN5aiter39bf16gemm_fp32bf16_tn_80x64_splitk_cleanE,0.0234,0.36,362.87
256,1,256,4096,False,torch.bfloat16,torch.bfloat16,False,False,asm,5,16,5.8181,_ZN5aiter39bf16gemm_fp32bf16_tn_64x64_splitk_cleanE,0.0156,0.36,361.95
256,1,256,4096,False,torch.bfloat16,torch.bfloat16,False,False,asm,1,13,5.8357,_ZN5aiter39bf16gemm_fp32bf16_tn_32x64_splitk_cleanE,0.0312,0.36,360.86
256,1,256,4096,False,torch.bfloat16,torch.bfloat16,False,False,asm,8,8,5.8656,_ZN5aiter39bf16gemm_fp32bf16_tn_96x64_splitk_cleanE,0.0391,0.36,359.02
256,1,256,4096,False,torch.bfloat16,torch.bfloat16,False,False,asm,1,8,5.885,_ZN5aiter39bf16gemm_fp32bf16_tn_32x64_splitk_cleanE,0.0273,0.36,357.83
256,1,256,4096,False,torch.bfloat16,torch.bfloat16,False,False,asm,5,10,5.8951,_ZN5aiter39bf16gemm_fp32bf16_tn_64x64_splitk_cleanE,0.0391,0.36,357.22
256,1,256,4096,False,torch.bfloat16,torch.bfloat16,False,False,asm,8,15,5.9297,_ZN5aiter39bf16gemm_fp32bf16_tn_96x64_splitk_cleanE,0.0352,0.35,355.14
256,1,256,4096,False,torch.bfloat16,torch.bfloat16,False,False,asm,7,14,5.9429,_ZN5aiter39bf16gemm_fp32bf16_tn_80x64_splitk_cleanE,0.0352,0.35,354.35
256,1,256,4096,False,torch.bfloat16,torch.bfloat16,False,False,asm,3,11,6.0619,_ZN5aiter39bf16gemm_fp32bf16_tn_48x64_splitk_cleanE,0.0312,0.35,347.39
256,1,256,4096,False,torch.bfloat16,torch.bfloat16,False,False,asm,3,13,6.0842,_ZN5aiter39bf16gemm_fp32bf16_tn_48x64_splitk_cleanE,0.0273,0.34,346.12
256,1,256,4096,False,torch.bfloat16,torch.bfloat16,False,False,asm,8,10,6.0925,_ZN5aiter39bf16gemm_fp32bf16_tn_96x64_splitk_cleanE,0.0352,0.34,345.65
256,1,256,4096,False,torch.bfloat16,torch.bfloat16,False,False,asm,7,16,6.1055,_ZN5aiter39bf16gemm_fp32bf16_tn_80x64_splitk_cleanE,0.0273,0.34,344.91
256,1,256,4096,False,torch.bfloat16,torch.bfloat16,False,False,asm,3,6,6.1303,_ZN5aiter39bf16gemm_fp32bf16_tn_48x64_splitk_cleanE,0.0352,0.34,343.52
256,1,256,4096,False,torch.bfloat16,torch.bfloat16,False,False,asm,1,6,6.1449,_ZN5aiter39bf16gemm_fp32bf16_tn_32x64_splitk_cleanE,0.0234,0.34,342.7
256,1,256,4096,False,torch.bfloat16,torch.bfloat16,False,False,asm,1,5,6.1541,_ZN5aiter39bf16gemm_fp32bf16_tn_32x64_splitk_cleanE,0.0156,0.34,342.19
256,1,256,4096,False,torch.bfloat16,torch.bfloat16,False,False,asm,8,7,6.1987,_ZN5aiter39bf16gemm_fp32bf16_tn_96x64_splitk_cleanE,0.0469,0.34,339.73
256,1,256,4096,False,torch.bfloat16,torch.bfloat16,False,False,asm,7,6,6.2234,_ZN5aiter39bf16gemm_fp32bf16_tn_80x64_splitk_cleanE,0.0273,0.34,338.38
256,1,256,4096,False,torch.bfloat16,torch.bfloat16,False,False,asm,7,15,6.2331,_ZN5aiter39bf16gemm_fp32bf16_tn_80x64_splitk_cleanE,0.043,0.34,337.85
256,1,256,4096,False,torch.bfloat16,torch.bfloat16,False,False,hipblaslt,438410,0,6.314,,0.0,0.33,333.52
256,1,256,4096,False,torch.bfloat16,torch.bfloat16,False,False,asm,5,11,6.3955,_ZN5aiter39bf16gemm_fp32bf16_tn_64x64_splitk_cleanE,0.043,0.33,329.27
256,1,256,4096,False,torch.bfloat16,torch.bfloat16,False,False,hipblaslt,439082,0,6.4146,,0.0,0.33,328.29
256,1,256,4096,False,torch.bfloat16,torch.bfloat16,False,False,hipblaslt,438818,0,6.4342,,0.0,0.33,327.29
256,1,256,4096,False,torch.bfloat16,torch.bfloat16,False,False,asm,1,4,6.4547,_ZN5aiter39bf16gemm_fp32bf16_tn_32x64_splitk_cleanE,0.0156,0.32,326.25
256,1,256,4096,False,torch.bfloat16,torch.bfloat16,False,False,asm,8,16,6.4579,_ZN5aiter39bf16gemm_fp32bf16_tn_96x64_splitk_cleanE,0.0195,0.32,326.09
256,1,256,4096,False,torch.bfloat16,torch.bfloat16,False,False,hipblaslt,438618,0,6.4655,,0.0,0.32,325.71
256,1,256,4096,False,torch.bfloat16,torch.bfloat16,False,False,hipblaslt,439683,0,6.524,,0.0,0.32,322.79
256,1,256,4096,False,torch.bfloat16,torch.bfloat16,False,False,hipblaslt,440197,0,6.5941,,0.0,0.32,319.35
256,1,256,4096,False,torch.bfloat16,torch.bfloat16,False,False,asm,3,5,6.6355,_ZN5aiter39bf16gemm_fp32bf16_tn_48x64_splitk_cleanE,0.0156,0.32,317.36
256,1,256,4096,False,torch.bfloat16,torch.bfloat16,False,False,hipblaslt,439064,0,6.6563,,0.0,0.32,316.37
256,1,256,4096,False,torch.bfloat16,torch.bfloat16,False,False,asm,7,11,6.7119,_ZN5aiter39bf16gemm_fp32bf16_tn_80x64_splitk_cleanE,0.0234,0.31,313.75
256,1,256,4096,False,torch.bfloat16,torch.bfloat16,False,False,asm,5,13,6.7647,_ZN5aiter39bf16gemm_fp32bf16_tn_64x64_splitk_cleanE,0.0273,0.31,311.3
256,1,256,4096,False,torch.bfloat16,torch.bfloat16,False,False,asm,8,6,6.7651,_ZN5aiter39bf16gemm_fp32bf16_tn_96x64_splitk_cleanE,0.0391,0.31,311.28
256,1,256,4096,False,torch.bfloat16,torch.bfloat16,False,False,hipblaslt,440202,0,6.9616,,0.0,0.3,302.5
256,1,256,4096,False,torch.bfloat16,torch.bfloat16,False,False,asm,7,13,7.0195,_ZN5aiter39bf16gemm_fp32bf16_tn_80x64_splitk_cleanE,0.0391,0.3,300.0
256,1,256,4096,False,torch.bfloat16,torch.bfloat16,False,False,asm,5,5,7.0311,_ZN5aiter39bf16gemm_fp32bf16_tn_64x64_splitk_cleanE,0.0078,0.3,299.51
256,1,256,4096,False,torch.bfloat16,torch.bfloat16,False,False,asm,8,11,7.1127,_ZN5aiter39bf16gemm_fp32bf16_tn_96x64_splitk_cleanE,0.0273,0.29,296.07
256,1,256,4096,False,torch.bfloat16,torch.bfloat16,False,False,hipblaslt,438958,0,7.1127,,0.0,0.29,296.07
256,1,256,4096,False,torch.bfloat16,torch.bfloat16,False,False,asm,7,5,7.2495,_ZN5aiter39bf16gemm_fp32bf16_tn_80x64_splitk_cleanE,0.0078,0.29,290.48
256,1,256,4096,False,torch.bfloat16,torch.bfloat16,False,False,asm,5,4,7.2536,_ZN5aiter39bf16gemm_fp32bf16_tn_64x64_splitk_cleanE,0.0234,0.29,290.32
256,1,256,4096,False,torch.bfloat16,torch.bfloat16,False,False,asm,8,14,7.3127,_ZN5aiter39bf16gemm_fp32bf16_tn_96x64_splitk_cleanE,0.0273,0.29,287.97
256,1,256,4096,False,torch.bfloat16,torch.bfloat16,False,False,hipblaslt,438549,0,7.3226,,0.0,0.29,287.58
256,1,256,4096,False,torch.bfloat16,torch.bfloat16,False,False,hipblaslt,439080,0,7.3676,,0.0,0.28,285.83
256,1,256,4096,False,torch.bfloat16,torch.bfloat16,False,False,hipblaslt,438949,0,7.4408,,0.0,0.28,283.01
256,1,256,4096,False,torch.bfloat16,torch.bfloat16,False,False,hipblaslt,439081,0,7.4489,,0.0,0.28,282.71
256,1,256,4096,False,torch.bfloat16,torch.bfloat16,False,False,hipblaslt,439063,0,7.5632,,0.0,0.28,278.43
256,1,256,4096,False,torch.bfloat16,torch.bfloat16,False,False,hipblaslt,438936,0,7.7264,,0.0,0.27,272.55
256,1,256,4096,False,torch.bfloat16,torch.bfloat16,False,False,hipblaslt,438935,0,7.7812,,0.0,0.27,270.63
256,1,256,4096,False,torch.bfloat16,torch.bfloat16,False,False,asm,8,5,7.7959,_ZN5aiter39bf16gemm_fp32bf16_tn_96x64_splitk_cleanE,0.0117,0.27,270.12
256,1,256,4096,False,torch.bfloat16,torch.bfloat16,False,False,asm,8,13,7.9495,_ZN5aiter39bf16gemm_fp32bf16_tn_96x64_splitk_cleanE,0.0195,0.26,264.9
256,1,256,4096,False,torch.bfloat16,torch.bfloat16,False,False,hipblaslt,439940,0,8.0325,,0.0,0.26,262.17
256,1,256,4096,False,torch.bfloat16,torch.bfloat16,False,False,hipblaslt,439379,0,8.1599,,0.0,0.26,258.07
256,1,256,4096,False,torch.bfloat16,torch.bfloat16,False,False,hipblaslt,438256,0,8.1675,,0.0,0.26,257.83
256,1,256,4096,False,torch.bfloat16,torch.bfloat16,False,False,asm,3,4,8.2339,_ZN5aiter39bf16gemm_fp32bf16_tn_48x64_splitk_cleanE,0.0195,0.25,255.75
256,1,256,4096,False,torch.bfloat16,torch.bfloat16,False,False,asm,1,3,8.2876,_ZN5aiter39bf16gemm_fp32bf16_tn_32x64_splitk_cleanE,0.0234,0.25,254.1
256,1,256,4096,False,torch.bfloat16,torch.bfloat16,False,False,hipblaslt,438328,0,8.32,,0.0,0.25,253.11
256,1,256,4096,False,torch.bfloat16,torch.bfloat16,False,False,asm,7,4,8.3222,_ZN5aiter39bf16gemm_fp32bf16_tn_80x64_splitk_cleanE,0.0156,0.25,253.04
256,1,256,4096,False,torch.bfloat16,torch.bfloat16,False,False,asm,8,4,8.4848,_ZN5aiter39bf16gemm_fp32bf16_tn_96x64_splitk_cleanE,0.0156,0.25,248.19
256,1,256,4096,False,torch.bfloat16,torch.bfloat16,False,False,asm,3,3,8.5223,_ZN5aiter39bf16gemm_fp32bf16_tn_48x64_splitk_cleanE,0.0234,0.25,247.1
256,1,256,4096,False,torch.bfloat16,torch.bfloat16,False,False,asm,7,3,8.5824,_ZN5aiter39bf16gemm_fp32bf16_tn_80x64_splitk_cleanE,0.0234,0.24,245.37
256,1,256,4096,False,torch.bfloat16,torch.bfloat16,False,False,asm,8,3,8.8465,_ZN5aiter39bf16gemm_fp32bf16_tn_96x64_splitk_cleanE,0.0234,0.24,238.04
256,1,256,4096,False,torch.bfloat16,torch.bfloat16,False,False,asm,5,3,9.5414,_ZN5aiter39bf16gemm_fp32bf16_tn_64x64_splitk_cleanE,0.0234,0.22,220.71
256,1,256,4096,False,torch.bfloat16,torch.bfloat16,False,False,asm,1,2,9.8194,_ZN5aiter39bf16gemm_fp32bf16_tn_32x64_splitk_cleanE,0.0078,0.21,214.46
256,1,256,4096,False,torch.bfloat16,torch.bfloat16,False,False,asm,3,2,10.2602,_ZN5aiter39bf16gemm_fp32bf16_tn_48x64_splitk_cleanE,0.0078,0.2,205.25
256,1,256,4096,False,torch.bfloat16,torch.bfloat16,False,False,asm,5,2,10.3248,_ZN5aiter39bf16gemm_fp32bf16_tn_64x64_splitk_cleanE,0.0078,0.2,203.96
256,1,256,4096,False,torch.bfloat16,torch.bfloat16,False,False,asm,7,2,10.7386,_ZN5aiter39bf16gemm_fp32bf16_tn_80x64_splitk_cleanE,0.0078,0.2,196.1
256,1,256,4096,False,torch.bfloat16,torch.bfloat16,False,False,asm,8,2,11.1293,_ZN5aiter39bf16gemm_fp32bf16_tn_96x64_splitk_cleanE,0.0078,0.19,189.22
256,1,256,4096,False,torch.bfloat16,torch.bfloat16,False,False,asm,2,1,15.0461,_ZN5aiter37bf16gemm_fp32bf16_tn_32x64_pf3_splitkE,0.0,0.14,139.96
256,1,256,4096,False,torch.bfloat16,torch.bfloat16,False,False,asm,4,1,15.4858,_ZN5aiter37bf16gemm_fp32bf16_tn_48x64_pf3_splitkE,0.0,0.14,135.99
256,1,256,4096,False,torch.bfloat16,torch.bfloat16,False,False,asm,6,1,16.123,_ZN5aiter37bf16gemm_fp32bf16_tn_64x64_pf3_splitkE,0.0,0.13,130.61
256,1,256,4096,False,torch.bfloat16,torch.bfloat16,False,False,asm,9,1,17.4665,_ZN5aiter37bf16gemm_fp32bf16_tn_96x64_pf3_splitkE,0.0,0.12,120.57
256,1,256,4096,False,torch.bfloat16,torch.bfloat16,False,False,asm,10,1,61.0497,_ZN5aiter24bf16gemm_bf16_tn_256x256E,0.0,0.03,34.49
256,4,256,4096,False,torch.bfloat16,torch.bfloat16,False,False,asm,3,9,5.1223,_ZN5aiter39bf16gemm_fp32bf16_tn_48x64_splitk_cleanE,0.0195,1.64,416.21
256,4,256,4096,False,torch.bfloat16,torch.bfloat16,False,False,asm,3,12,5.1808,_ZN5aiter39bf16gemm_fp32bf16_tn_48x64_splitk_cleanE,0.0205,1.62,411.51
256,4,256,4096,False,torch.bfloat16,torch.bfloat16,False,False,asm,1,15,5.2275,_ZN5aiter39bf16gemm_fp32bf16_tn_32x64_splitk_cleanE,0.0293,1.6,407.84
256,4,256,4096,False,torch.bfloat16,torch.bfloat16,False,False,asm,3,15,5.2613,_ZN5aiter39bf16gemm_fp32bf16_tn_48x64_splitk_cleanE,0.0264,1.59,405.22
256,4,256,4096,False,torch.bfloat16,torch.bfloat16,False,False,asm,1,10,5.3367,_ZN5aiter39bf16gemm_fp32bf16_tn_32x64_splitk_cleanE,0.0264,1.57,399.49
256,4,256,4096,False,torch.bfloat16,torch.bfloat16,False,False,asm,7,9,5.3635,_ZN5aiter39bf16gemm_fp32bf16_tn_80x64_splitk_cleanE,0.0215,1.56,397.5
256,4,256,4096,False,torch.bfloat16,torch.bfloat16,False,False,asm,3,8,5.4707,_ZN5aiter39bf16gemm_fp32bf16_tn_48x64_splitk_cleanE,0.0244,1.53,389.71
256,4,256,4096,False,torch.bfloat16,torch.bfloat16,False,False,asm,7,10,5.4775,_ZN5aiter39bf16gemm_fp32bf16_tn_80x64_splitk_cleanE,0.0254,1.53,389.22
256,4,256,4096,False,torch.bfloat16,torch.bfloat16,False,False,asm,5,9,5.4807,_ZN5aiter39bf16gemm_fp32bf16_tn_64x64_splitk_cleanE,0.0195,1.53,389.0
256,4,256,4096,False,torch.bfloat16,torch.bfloat16,False,False,asm,7,7,5.4872,_ZN5aiter39bf16gemm_fp32bf16_tn_80x64_splitk_cleanE,0.0293,1.53,388.53
256,4,256,4096,False,torch.bfloat16,torch.bfloat16,False,False,asm,1,11,5.4947,_ZN5aiter39bf16gemm_fp32bf16_tn_32x64_splitk_cleanE,0.0264,1.53,388.0
256,4,256,4096,False,torch.bfloat16,torch.bfloat16,False,False,asm,3,14,5.5048,_ZN5aiter39bf16gemm_fp32bf16_tn_48x64_splitk_cleanE,0.0254,1.52,387.29
256,4,256,4096,False,torch.bfloat16,torch.bfloat16,False,False,asm,1,9,5.5083,_ZN5aiter39bf16gemm_fp32bf16_tn_32x64_splitk_cleanE,0.0264,1.52,387.05
256,4,256,4096,False,torch.bfloat16,torch.bfloat16,False,False,asm,5,8,5.5179,_ZN5aiter39bf16gemm_fp32bf16_tn_64x64_splitk_cleanE,0.0146,1.52,386.37
256,4,256,4096,False,torch.bfloat16,torch.bfloat16,False,False,asm,5,14,5.5231,_ZN5aiter39bf16gemm_fp32bf16_tn_64x64_splitk_cleanE,0.0283,1.52,386.01
256,4,256,4096,False,torch.bfloat16,torch.bfloat16,False,False,asm,1,16,5.5351,_ZN5aiter39bf16gemm_fp32bf16_tn_32x64_splitk_cleanE,0.0283,1.52,385.17
256,4,256,4096,False,torch.bfloat16,torch.bfloat16,False,False,asm,8,8,5.5535,_ZN5aiter39bf16gemm_fp32bf16_tn_96x64_splitk_cleanE,0.0273,1.51,383.9
256,4,256,4096,False,torch.bfloat16,torch.bfloat16,False,False,asm,5,7,5.5595,_ZN5aiter39bf16gemm_fp32bf16_tn_64x64_splitk_cleanE,0.0264,1.51,383.48
256,4,256,4096,False,torch.bfloat16,torch.bfloat16,False,False,asm,5,12,5.572,_ZN5aiter39bf16gemm_fp32bf16_tn_64x64_splitk_cleanE,0.0352,1.51,382.62
256,4,256,4096,False,torch.bfloat16,torch.bfloat16,False,False,asm,3,16,5.5871,_ZN5aiter39bf16gemm_fp32bf16_tn_48x64_splitk_cleanE,0.0234,1.5,381.59
256,4,256,4096,False,torch.bfloat16,torch.bfloat16,False,False,asm,8,7,5.5956,_ZN5aiter39bf16gemm_fp32bf16_tn_96x64_splitk_cleanE,0.0234,1.5,381.01
256,4,256,4096,False,torch.bfloat16,torch.bfloat16,False,False,asm,3,7,5.6151,_ZN5aiter39bf16gemm_fp32bf16_tn_48x64_splitk_cleanE,0.0244,1.49,379.68
256,4,256,4096,False,torch.bfloat16,torch.bfloat16,False,False,asm,5,15,5.6211,_ZN5aiter39bf16gemm_fp32bf16_tn_64x64_splitk_cleanE,0.0332,1.49,379.28
256,4,256,4096,False,torch.bfloat16,torch.bfloat16,False,False,asm,3,11,5.6257,_ZN5aiter39bf16gemm_fp32bf16_tn_48x64_splitk_cleanE,0.0244,1.49,378.97
256,4,256,4096,False,torch.bfloat16,torch.bfloat16,False,False,asm,7,15,5.633,_ZN5aiter39bf16gemm_fp32bf16_tn_80x64_splitk_cleanE,0.0322,1.49,378.48
256,4,256,4096,False,torch.bfloat16,torch.bfloat16,False,False,asm,5,6,5.6552,_ZN5aiter39bf16gemm_fp32bf16_tn_64x64_splitk_cleanE,0.0166,1.48,376.99
256,4,256,4096,False,torch.bfloat16,torch.bfloat16,False,False,asm,1,14,5.6763,_ZN5aiter39bf16gemm_fp32bf16_tn_32x64_splitk_cleanE,0.0254,1.48,375.59
256,4,256,4096,False,torch.bfloat16,torch.bfloat16,False,False,asm,1,13,5.7024,_ZN5aiter39bf16gemm_fp32bf16_tn_32x64_splitk_cleanE,0.0244,1.47,373.87
256,4,256,4096,False,torch.bfloat16,torch.bfloat16,False,False,asm,1,7,5.7101,_ZN5aiter39bf16gemm_fp32bf16_tn_32x64_splitk_cleanE,0.0244,1.47,373.37
256,4,256,4096,False,torch.bfloat16,torch.bfloat16,False,False,asm,1,12,5.7256,_ZN5aiter39bf16gemm_fp32bf16_tn_32x64_splitk_cleanE,0.0293,1.47,372.36
256,4,256,4096,False,torch.bfloat16,torch.bfloat16,False,False,asm,7,8,5.7421,_ZN5aiter39bf16gemm_fp32bf16_tn_80x64_splitk_cleanE,0.0195,1.46,371.29
256,4,256,4096,False,torch.bfloat16,torch.bfloat16,False,False,asm,8,10,5.766,_ZN5aiter39bf16gemm_fp32bf16_tn_96x64_splitk_cleanE,0.0254,1.45,369.75
256,4,256,4096,False,torch.bfloat16,torch.bfloat16,False,False,asm,5,10,5.777,_ZN5aiter39bf16gemm_fp32bf16_tn_64x64_splitk_cleanE,0.0264,1.45,369.04
256,4,256,4096,False,torch.bfloat16,torch.bfloat16,False,False,asm,3,10,5.7848,_ZN5aiter39bf16gemm_fp32bf16_tn_48x64_splitk_cleanE,0.0234,1.45,368.55
256,4,256,4096,False,torch.bfloat16,torch.bfloat16,False,False,asm,7,12,5.7924,_ZN5aiter39bf16gemm_fp32bf16_tn_80x64_splitk_cleanE,0.0332,1.45,368.06
256,4,256,4096,False,torch.bfloat16,torch.bfloat16,False,False,asm,5,16,5.7975,_ZN5aiter39bf16gemm_fp32bf16_tn_64x64_splitk_cleanE,0.0303,1.45,367.74
256,4,256,4096,False,torch.bfloat16,torch.bfloat16,False,False,asm,8,9,5.8051,_ZN5aiter39bf16gemm_fp32bf16_tn_96x64_splitk_cleanE,0.0205,1.45,367.26
256,4,256,4096,False,torch.bfloat16,torch.bfloat16,False,False,asm,7,14,5.8567,_ZN5aiter39bf16gemm_fp32bf16_tn_80x64_splitk_cleanE,0.0332,1.43,364.02
256,4,256,4096,False,torch.bfloat16,torch.bfloat16,False,False,asm,1,8,5.9026,_ZN5aiter39bf16gemm_fp32bf16_tn_32x64_splitk_cleanE,0.0225,1.42,361.19
256,4,256,4096,False,torch.bfloat16,torch.bfloat16,False,False,asm,8,16,5.9379,_ZN5aiter39bf16gemm_fp32bf16_tn_96x64_splitk_cleanE,0.0264,1.41,359.04
256,4,256,4096,False,torch.bfloat16,torch.bfloat16,False,False,asm,1,5,6.0012,_ZN5aiter39bf16gemm_fp32bf16_tn_32x64_splitk_cleanE,0.0146,1.4,355.26
256,4,256,4096,False,torch.bfloat16,torch.bfloat16,False,False,asm,8,12,6.0355,_ZN5aiter39bf16gemm_fp32bf16_tn_96x64_splitk_cleanE,0.0254,1.39,353.24
256,4,256,4096,False,torch.bfloat16,torch.bfloat16,False,False,asm,1,6,6.1079,_ZN5aiter39bf16gemm_fp32bf16_tn_32x64_splitk_cleanE,0.0195,1.37,349.05
256,4,256,4096,False,torch.bfloat16,torch.bfloat16,False,False,asm,7,16,6.3527,_ZN5aiter39bf16gemm_fp32bf16_tn_80x64_splitk_cleanE,0.0225,1.32,335.6
256,4,256,4096,False,torch.bfloat16,torch.bfloat16,False,False,asm,1,4,6.3716,_ZN5aiter39bf16gemm_fp32bf16_tn_32x64_splitk_cleanE,0.0127,1.32,334.6
256,4,256,4096,False,torch.bfloat16,torch.bfloat16,False,False,asm,3,13,6.3875,_ZN5aiter39bf16gemm_fp32bf16_tn_48x64_splitk_cleanE,0.0264,1.31,333.77
256,4,256,4096,False,torch.bfloat16,torch.bfloat16,False,False,asm,8,15,6.3955,_ZN5aiter39bf16gemm_fp32bf16_tn_96x64_splitk_cleanE,0.0225,1.31,333.35
256,4,256,4096,False,torch.bfloat16,torch.bfloat16,False,False,asm,3,5,6.3955,_ZN5aiter39bf16gemm_fp32bf16_tn_48x64_splitk_cleanE,0.0098,1.31,333.35
256,4,256,4096,False,torch.bfloat16,torch.bfloat16,False,False,hipblaslt,438410,0,6.4301,,0.0,1.3,331.56
256,4,256,4096,False,torch.bfloat16,torch.bfloat16,False,False,hipblaslt,439082,0,6.431,,0.0,1.3,331.51
256,4,256,4096,False,torch.bfloat16,torch.bfloat16,False,False,hipblaslt,439683,0,6.5368,,0.0,1.28,326.15
256,4,256,4096,False,torch.bfloat16,torch.bfloat16,False,False,hipblaslt,438618,0,6.5458,,0.0,1.28,325.7
256,4,256,4096,False,torch.bfloat16,torch.bfloat16,False,False,asm,7,11,6.5587,_ZN5aiter39bf16gemm_fp32bf16_tn_80x64_splitk_cleanE,0.0244,1.28,325.06
256,4,256,4096,False,torch.bfloat16,torch.bfloat16,False,False,hipblaslt,440197,0,6.5665,,0.0,1.28,324.67
256,4,256,4096,False,torch.bfloat16,torch.bfloat16,False,False,asm,5,11,6.6067,_ZN5aiter39bf16gemm_fp32bf16_tn_64x64_splitk_cleanE,0.0264,1.27,322.7
256,4,256,4096,False,torch.bfloat16,torch.bfloat16,False,False,asm,5,13,6.7239,_ZN5aiter39bf16gemm_fp32bf16_tn_64x64_splitk_cleanE,0.0264,1.25,317.07
256,4,256,4096,False,torch.bfloat16,torch.bfloat16,False,False,hipblaslt,439064,0,6.7599,,0.0,1.24,315.38
256,4,256,4096,False,torch.bfloat16,torch.bfloat16,False,False,asm,5,5,6.8571,_ZN5aiter39bf16gemm_fp32bf16_tn_64x64_splitk_cleanE,0.0137,1.22,310.91
256,4,256,4096,False,torch.bfloat16,torch.bfloat16,False,False,hipblaslt,438818,0,6.9901,,0.0,1.2,305.0
256,4,256,4096,False,torch.bfloat16,torch.bfloat16,False,False,asm,7,6,7.0855,_ZN5aiter39bf16gemm_fp32bf16_tn_80x64_splitk_cleanE,0.0215,1.18,300.89
256,4,256,4096,False,torch.bfloat16,torch.bfloat16,False,False,hipblaslt,440202,0,7.1167,,0.0,1.18,299.57
256,4,256,4096,False,torch.bfloat16,torch.bfloat16,False,False,asm,7,13,7.1291,_ZN5aiter39bf16gemm_fp32bf16_tn_80x64_splitk_cleanE,0.0225,1.18,299.05
256,4,256,4096,False,torch.bfloat16,torch.bfloat16,False,False,asm,3,6,7.1431,_ZN5aiter39bf16gemm_fp32bf16_tn_48x64_splitk_cleanE,0.0195,1.17,298.47
256,4,256,4096,False,torch.bfloat16,torch.bfloat16,False,False,asm,8,14,7.1775,_ZN5aiter39bf16gemm_fp32bf16_tn_96x64_splitk_cleanE,0.0381,1.17,297.03
256,4,256,4096,False,torch.bfloat16,torch.bfloat16,False,False,hipblaslt,438958,0,7.2622,,0.0,1.16,293.57
256,4,256,4096,False,torch.bfloat16,torch.bfloat16,False,False,asm,3,4,7.2727,_ZN5aiter39bf16gemm_fp32bf16_tn_48x64_splitk_cleanE,0.0127,1.15,293.15
256,4,256,4096,False,torch.bfloat16,torch.bfloat16,False,False,asm,8,11,7.2775,_ZN5aiter39bf16gemm_fp32bf16_tn_96x64_splitk_cleanE,0.0186,1.15,292.95
256,4,256,4096,False,torch.bfloat16,torch.bfloat16,False,False,hipblaslt,438754,0,7.289,,0.0,1.15,292.49
256,4,256,4096,False,torch.bfloat16,torch.bfloat16,False,False,hipblaslt,438549,0,7.3746,,0.0,1.14,289.1
256,4,256,4096,False,torch.bfloat16,torch.bfloat16,False,False,hipblaslt,438949,0,7.3853,,0.0,1.14,288.68
256,4,256,4096,False,torch.bfloat16,torch.bfloat16,False,False,hipblaslt,439080,0,7.395,,0.0,1.13,288.3
256,4,256,4096,False,torch.bfloat16,torch.bfloat16,False,False,hipblaslt,439081,0,7.4596,,0.0,1.12,285.8
256,4,256,4096,False,torch.bfloat16,torch.bfloat16,False,False,asm,7,5,7.5235,_ZN5aiter39bf16gemm_fp32bf16_tn_80x64_splitk_cleanE,0.0107,1.11,283.37
256,4,256,4096,False,torch.bfloat16,torch.bfloat16,False,False,hipblaslt,439063,0,7.5583,,0.0,1.11,282.07
256,4,256,4096,False,torch.bfloat16,torch.bfloat16,False,False,asm,8,6,7.6755,_ZN5aiter39bf16gemm_fp32bf16_tn_96x64_splitk_cleanE,0.0205,1.09,277.76
256,4,256,4096,False,torch.bfloat16,torch.bfloat16,False,False,asm,8,5,7.7703,_ZN5aiter39bf16gemm_fp32bf16_tn_96x64_splitk_cleanE,0.0137,1.08,274.37
256,4,256,4096,False,torch.bfloat16,torch.bfloat16,False,False,asm,8,13,8.0155,_ZN5aiter39bf16gemm_fp32bf16_tn_96x64_splitk_cleanE,0.0283,1.05,265.98
256,4,256,4096,False,torch.bfloat16,torch.bfloat16,False,False,hipblaslt,438936,0,8.1841,,0.0,1.02,260.5
256,4,256,4096,False,torch.bfloat16,torch.bfloat16,False,False,hipblaslt,439940,0,8.1959,,0.0,1.02,260.13
256,4,256,4096,False,torch.bfloat16,torch.bfloat16,False,False,hipblaslt,438935,0,8.2898,,0.0,1.01,257.18
256,4,256,4096,False,torch.bfloat16,torch.bfloat16,False,False,asm,5,4,8.3003,_ZN5aiter39bf16gemm_fp32bf16_tn_64x64_splitk_cleanE,0.0127,1.01,256.85
256,4,256,4096,False,torch.bfloat16,torch.bfloat16,False,False,asm,3,3,8.3776,_ZN5aiter39bf16gemm_fp32bf16_tn_48x64_splitk_cleanE,0.0098,1.0,254.48
256,4,256,4096,False,torch.bfloat16,torch.bfloat16,False,False,hipblaslt,439945,0,8.4617,,0.0,0.99,251.96
256,4,256,4096,False,torch.bfloat16,torch.bfloat16,False,False,asm,7,4,8.6235,_ZN5aiter39bf16gemm_fp32bf16_tn_80x64_splitk_cleanE,0.0098,0.97,247.23
256,4,256,4096,False,torch.bfloat16,torch.bfloat16,False,False,asm,7,3,8.6326,_ZN5aiter39bf16gemm_fp32bf16_tn_80x64_splitk_cleanE,0.0098,0.97,246.97
256,4,256,4096,False,torch.bfloat16,torch.bfloat16,False,False,asm,8,4,8.7879,_ZN5aiter39bf16gemm_fp32bf16_tn_96x64_splitk_cleanE,0.0127,0.95,242.6
256,4,256,4096,False,torch.bfloat16,torch.bfloat16,False,False,hipblaslt,438256,0,8.8155,,0.0,0.95,241.84
256,4,256,4096,False,torch.bfloat16,torch.bfloat16,False,False,asm,8,3,8.826,_ZN5aiter39bf16gemm_fp32bf16_tn_96x64_splitk_cleanE,0.0068,0.95,241.56
256,4,256,4096,False,torch.bfloat16,torch.bfloat16,False,False,asm,1,3,8.9054,_ZN5aiter39bf16gemm_fp32bf16_tn_32x64_splitk_cleanE,0.0068,0.94,239.4
256,4,256,4096,False,torch.bfloat16,torch.bfloat16,False,False,asm,5,3,8.9264,_ZN5aiter39bf16gemm_fp32bf16_tn_64x64_splitk_cleanE,0.0098,0.94,238.84
256,4,256,4096,False,torch.bfloat16,torch.bfloat16,False,False,asm,3,2,10.0026,_ZN5aiter39bf16gemm_fp32bf16_tn_48x64_splitk_cleanE,0.0068,0.84,213.14
256,4,256,4096,False,torch.bfloat16,torch.bfloat16,False,False,asm,5,2,10.3821,_ZN5aiter39bf16gemm_fp32bf16_tn_64x64_splitk_cleanE,0.0068,0.81,205.35
256,4,256,4096,False,torch.bfloat16,torch.bfloat16,False,False,asm,8,2,11.1523,_ZN5aiter39bf16gemm_fp32bf16_tn_96x64_splitk_cleanE,0.0068,0.75,191.17
256,4,256,4096,False,torch.bfloat16,torch.bfloat16,False,False,asm,7,2,11.3523,_ZN5aiter39bf16gemm_fp32bf16_tn_80x64_splitk_cleanE,0.0068,0.74,187.8
256,4,256,4096,False,torch.bfloat16,torch.bfloat16,False,False,asm,1,2,11.8768,_ZN5aiter39bf16gemm_fp32bf16_tn_32x64_splitk_cleanE,0.0068,0.71,179.51
256,4,256,4096,False,torch.bfloat16,torch.bfloat16,False,False,asm,2,1,15.1652,_ZN5aiter37bf16gemm_fp32bf16_tn_32x64_pf3_splitkE,0.0,0.55,140.58
256,4,256,4096,False,torch.bfloat16,torch.bfloat16,False,False,asm,4,1,15.5374,_ZN5aiter37bf16gemm_fp32bf16_tn_48x64_pf3_splitkE,0.0,0.54,137.22
256,4,256,4096,False,torch.bfloat16,torch.bfloat16,False,False,asm,6,1,16.1262,_ZN5aiter37bf16gemm_fp32bf16_tn_64x64_pf3_splitkE,0.0,0.52,132.21
256,4,256,4096,False,torch.bfloat16,torch.bfloat16,False,False,asm,9,1,17.5395,_ZN5aiter37bf16gemm_fp32bf16_tn_96x64_pf3_splitkE,0.0,0.48,121.55
256,4,256,4096,False,torch.bfloat16,torch.bfloat16,False,False,asm,10,1,61.0331,_ZN5aiter24bf16gemm_bf16_tn_256x256E,0.0,0.14,34.93
256,8,256,4096,False,torch.bfloat16,torch.bfloat16,False,False,asm,3,9,5.1895,_ZN5aiter39bf16gemm_fp32bf16_tn_48x64_splitk_cleanE,0.019,3.23,417.53
256,8,256,4096,False,torch.bfloat16,torch.bfloat16,False,False,asm,1,14,5.2247,_ZN5aiter39bf16gemm_fp32bf16_tn_32x64_splitk_cleanE,0.0225,3.21,414.72
256,8,256,4096,False,torch.bfloat16,torch.bfloat16,False,False,asm,3,10,5.2475,_ZN5aiter39bf16gemm_fp32bf16_tn_48x64_splitk_cleanE,0.021,3.2,412.92
256,8,256,4096,False,torch.bfloat16,torch.bfloat16,False,False,asm,1,16,5.2759,_ZN5aiter39bf16gemm_fp32bf16_tn_32x64_splitk_cleanE,0.0293,3.18,410.69
256,8,256,4096,False,torch.bfloat16,torch.bfloat16,False,False,asm,1,12,5.3335,_ZN5aiter39bf16gemm_fp32bf16_tn_32x64_splitk_cleanE,0.0278,3.15,406.26
256,8,256,4096,False,torch.bfloat16,torch.bfloat16,False,False,asm,3,12,5.3549,_ZN5aiter39bf16gemm_fp32bf16_tn_48x64_splitk_cleanE,0.0288,3.13,404.64
256,8,256,4096,False,torch.bfloat16,torch.bfloat16,False,False,asm,1,10,5.3995,_ZN5aiter39bf16gemm_fp32bf16_tn_32x64_splitk_cleanE,0.0205,3.11,401.29
256,8,256,4096,False,torch.bfloat16,torch.bfloat16,False,False,asm,3,7,5.402,_ZN5aiter39bf16gemm_fp32bf16_tn_48x64_splitk_cleanE,0.022,3.11,401.11
256,8,256,4096,False,torch.bfloat16,torch.bfloat16,False,False,asm,3,16,5.4087,_ZN5aiter39bf16gemm_fp32bf16_tn_48x64_splitk_cleanE,0.0386,3.1,400.61
256,8,256,4096,False,torch.bfloat16,torch.bfloat16,False,False,asm,3,15,5.4561,_ZN5aiter39bf16gemm_fp32bf16_tn_48x64_splitk_cleanE,0.0317,3.07,397.13
256,8,256,4096,False,torch.bfloat16,torch.bfloat16,False,False,asm,7,10,5.484,_ZN5aiter39bf16gemm_fp32bf16_tn_80x64_splitk_cleanE,0.0239,3.06,395.11
256,8,256,4096,False,torch.bfloat16,torch.bfloat16,False,False,asm,5,7,5.5131,_ZN5aiter39bf16gemm_fp32bf16_tn_64x64_splitk_cleanE,0.0239,3.04,393.02
256,8,256,4096,False,torch.bfloat16,torch.bfloat16,False,False,asm,1,9,5.5132,_ZN5aiter39bf16gemm_fp32bf16_tn_32x64_splitk_cleanE,0.0229,3.04,393.02
256,8,256,4096,False,torch.bfloat16,torch.bfloat16,False,False,asm,1,15,5.5307,_ZN5aiter39bf16gemm_fp32bf16_tn_32x64_splitk_cleanE,0.0332,3.03,391.77
256,8,256,4096,False,torch.bfloat16,torch.bfloat16,False,False,asm,7,9,5.5312,_ZN5aiter39bf16gemm_fp32bf16_tn_80x64_splitk_cleanE,0.019,3.03,391.74
256,8,256,4096,False,torch.bfloat16,torch.bfloat16,False,False,asm,1,11,5.5727,_ZN5aiter39bf16gemm_fp32bf16_tn_32x64_splitk_cleanE,0.0259,3.01,388.82
256,8,256,4096,False,torch.bfloat16,torch.bfloat16,False,False,asm,3,11,5.5822,_ZN5aiter39bf16gemm_fp32bf16_tn_48x64_splitk_cleanE,0.0254,3.01,388.16
256,8,256,4096,False,torch.bfloat16,torch.bfloat16,False,False,asm,1,8,5.5848,_ZN5aiter39bf16gemm_fp32bf16_tn_32x64_splitk_cleanE,0.0225,3.0,387.98
256,8,256,4096,False,torch.bfloat16,torch.bfloat16,False,False,asm,7,12,5.593,_ZN5aiter39bf16gemm_fp32bf16_tn_80x64_splitk_cleanE,0.0303,3.0,387.41
256,8,256,4096,False,torch.bfloat16,torch.bfloat16,False,False,asm,5,8,5.6099,_ZN5aiter39bf16gemm_fp32bf16_tn_64x64_splitk_cleanE,0.022,2.99,386.24
256,8,256,4096,False,torch.bfloat16,torch.bfloat16,False,False,asm,3,14,5.6254,_ZN5aiter39bf16gemm_fp32bf16_tn_48x64_splitk_cleanE,0.0234,2.98,385.18
256,8,256,4096,False,torch.bfloat16,torch.bfloat16,False,False,asm,7,8,5.6282,_ZN5aiter39bf16gemm_fp32bf16_tn_80x64_splitk_cleanE,0.0225,2.98,384.99
256,8,256,4096,False,torch.bfloat16,torch.bfloat16,False,False,asm,1,7,5.6327,_ZN5aiter39bf16gemm_fp32bf16_tn_32x64_splitk_cleanE,0.0205,2.98,384.68
256,8,256,4096,False,torch.bfloat16,torch.bfloat16,False,False,asm,5,12,5.6719,_ZN5aiter39bf16gemm_fp32bf16_tn_64x64_splitk_cleanE,0.0229,2.96,382.02
256,8,256,4096,False,torch.bfloat16,torch.bfloat16,False,False,asm,5,15,5.6846,_ZN5aiter39bf16gemm_fp32bf16_tn_64x64_splitk_cleanE,0.0332,2.95,381.17
256,8,256,4096,False,torch.bfloat16,torch.bfloat16,False,False,asm,8,8,5.6954,_ZN5aiter39bf16gemm_fp32bf16_tn_96x64_splitk_cleanE,0.019,2.95,380.44
256,8,256,4096,False,torch.bfloat16,torch.bfloat16,False,False,asm,5,14,5.7187,_ZN5aiter39bf16gemm_fp32bf16_tn_64x64_splitk_cleanE,0.0308,2.93,378.89
256,8,256,4096,False,torch.bfloat16,torch.bfloat16,False,False,asm,5,9,5.7283,_ZN5aiter39bf16gemm_fp32bf16_tn_64x64_splitk_cleanE,0.0225,2.93,378.26
256,8,256,4096,False,torch.bfloat16,torch.bfloat16,False,False,asm,8,7,5.7287,_ZN5aiter39bf16gemm_fp32bf16_tn_96x64_splitk_cleanE,0.0215,2.93,378.23
256,8,256,4096,False,torch.bfloat16,torch.bfloat16,False,False,asm,5,10,5.7807,_ZN5aiter39bf16gemm_fp32bf16_tn_64x64_splitk_cleanE,0.0234,2.9,374.83
256,8,256,4096,False,torch.bfloat16,torch.bfloat16,False,False,asm,7,16,5.7831,_ZN5aiter39bf16gemm_fp32bf16_tn_80x64_splitk_cleanE,0.0308,2.9,374.68
256,8,256,4096,False,torch.bfloat16,torch.bfloat16,False,False,asm,3,8,5.7938,_ZN5aiter39bf16gemm_fp32bf16_tn_48x64_splitk_cleanE,0.0225,2.9,373.98
256,8,256,4096,False,torch.bfloat16,torch.bfloat16,False,False,asm,8,9,5.8675,_ZN5aiter39bf16gemm_fp32bf16_tn_96x64_splitk_cleanE,0.0234,2.86,369.29
256,8,256,4096,False,torch.bfloat16,torch.bfloat16,False,False,asm,5,16,5.8791,_ZN5aiter39bf16gemm_fp32bf16_tn_64x64_splitk_cleanE,0.0312,2.85,368.56
256,8,256,4096,False,torch.bfloat16,torch.bfloat16,False,False,asm,7,14,5.9389,_ZN5aiter39bf16gemm_fp32bf16_tn_80x64_splitk_cleanE,0.0278,2.82,364.85
256,8,256,4096,False,torch.bfloat16,torch.bfloat16,False,False,asm,8,10,5.9391,_ZN5aiter39bf16gemm_fp32bf16_tn_96x64_splitk_cleanE,0.0205,2.82,364.83
256,8,256,4096,False,torch.bfloat16,torch.bfloat16,False,False,asm,7,7,5.947,_ZN5aiter39bf16gemm_fp32bf16_tn_80x64_splitk_cleanE,0.0225,2.82,364.35
256,8,256,4096,False,torch.bfloat16,torch.bfloat16,False,False,asm,1,6,5.956,_ZN5aiter39bf16gemm_fp32bf16_tn_32x64_splitk_cleanE,0.0181,2.82,363.8
256,8,256,4096,False,torch.bfloat16,torch.bfloat16,False,False,asm,5,11,5.9591,_ZN5aiter39bf16gemm_fp32bf16_tn_64x64_splitk_cleanE,0.0234,2.82,363.61
256,8,256,4096,False,torch.bfloat16,torch.bfloat16,False,False,asm,8,12,5.9807,_ZN5aiter39bf16gemm_fp32bf16_tn_96x64_splitk_cleanE,0.0278,2.81,362.3
256,8,256,4096,False,torch.bfloat16,torch.bfloat16,False,False,asm,1,13,5.9837,_ZN5aiter39bf16gemm_fp32bf16_tn_32x64_splitk_cleanE,0.0229,2.8,362.11
256,8,256,4096,False,torch.bfloat16,torch.bfloat16,False,False,asm,3,6,6.0033,_ZN5aiter39bf16gemm_fp32bf16_tn_48x64_splitk_cleanE,0.019,2.79,360.93
256,8,256,4096,False,torch.bfloat16,torch.bfloat16,False,False,asm,3,13,6.0281,_ZN5aiter39bf16gemm_fp32bf16_tn_48x64_splitk_cleanE,0.0249,2.78,359.45
256,8,256,4096,False,torch.bfloat16,torch.bfloat16,False,False,asm,5,6,6.0685,_ZN5aiter39bf16gemm_fp32bf16_tn_64x64_splitk_cleanE,0.0171,2.76,357.05
256,8,256,4096,False,torch.bfloat16,torch.bfloat16,False,False,asm,7,15,6.0935,_ZN5aiter39bf16gemm_fp32bf16_tn_80x64_splitk_cleanE,0.0283,2.75,355.59
256,8,256,4096,False,torch.bfloat16,torch.bfloat16,False,False,asm,1,5,6.1277,_ZN5aiter39bf16gemm_fp32bf16_tn_32x64_splitk_cleanE,0.0137,2.74,353.6
256,8,256,4096,False,torch.bfloat16,torch.bfloat16,False,False,hipblaslt,438818,0,6.4158,,0.0,2.61,337.73
256,8,256,4096,False,torch.bfloat16,torch.bfloat16,False,False,asm,8,16,6.4655,_ZN5aiter39bf16gemm_fp32bf16_tn_96x64_splitk_cleanE,0.0308,2.59,335.13
256,8,256,4096,False,torch.bfloat16,torch.bfloat16,False,False,hipblaslt,439082,0,6.4885,,0.0,2.59,333.94
256,8,256,4096,False,torch.bfloat16,torch.bfloat16,False,False,hipblaslt,438410,0,6.5441,,0.0,2.56,331.1
256,8,256,4096,False,torch.bfloat16,torch.bfloat16,False,False,asm,8,15,6.5467,_ZN5aiter39bf16gemm_fp32bf16_tn_96x64_splitk_cleanE,0.0264,2.56,330.97
256,8,256,4096,False,torch.bfloat16,torch.bfloat16,False,False,asm,1,4,6.5554,_ZN5aiter39bf16gemm_fp32bf16_tn_32x64_splitk_cleanE,0.0137,2.56,330.53
256,8,256,4096,False,torch.bfloat16,torch.bfloat16,False,False,hipblaslt,438618,0,6.5582,,0.0,2.56,330.39
256,8,256,4096,False,torch.bfloat16,torch.bfloat16,False,False,asm,8,14,6.5815,_ZN5aiter39bf16gemm_fp32bf16_tn_96x64_splitk_cleanE,0.0293,2.55,329.22
256,8,256,4096,False,torch.bfloat16,torch.bfloat16,False,False,hipblaslt,439683,0,6.5976,,0.0,2.54,328.42
256,8,256,4096,False,torch.bfloat16,torch.bfloat16,False,False,asm,8,11,6.6528,_ZN5aiter39bf16gemm_fp32bf16_tn_96x64_splitk_cleanE,0.0269,2.52,325.7
256,8,256,4096,False,torch.bfloat16,torch.bfloat16,False,False,asm,7,11,6.6535,_ZN5aiter39bf16gemm_fp32bf16_tn_80x64_splitk_cleanE,0.0283,2.52,325.66
256,8,256,4096,False,torch.bfloat16,torch.bfloat16,False,False,asm,7,6,6.6939,_ZN5aiter39bf16gemm_fp32bf16_tn_80x64_splitk_cleanE,0.0156,2.51,323.7
256,8,256,4096,False,torch.bfloat16,torch.bfloat16,False,False,asm,3,5,6.7043,_ZN5aiter39bf16gemm_fp32bf16_tn_48x64_splitk_cleanE,0.0151,2.5,323.19
256,8,256,4096,False,torch.bfloat16,torch.bfloat16,False,False,asm,5,13,6.7055,_ZN5aiter39bf16gemm_fp32bf16_tn_64x64_splitk_cleanE,0.0264,2.5,323.14
256,8,256,4096,False,torch.bfloat16,torch.bfloat16,False,False,asm,5,5,6.7403,_ZN5aiter39bf16gemm_fp32bf16_tn_64x64_splitk_cleanE,0.0142,2.49,321.47
256,8,256,4096,False,torch.bfloat16,torch.bfloat16,False,False,asm,7,5,7.0147,_ZN5aiter39bf16gemm_fp32bf16_tn_80x64_splitk_cleanE,0.0142,2.39,308.89
256,8,256,4096,False,torch.bfloat16,torch.bfloat16,False,False,hipblaslt,438958,0,7.1675,,0.0,2.34,302.31
256,8,256,4096,False,torch.bfloat16,torch.bfloat16,False,False,hipblaslt,440197,0,7.1762,,0.0,2.34,301.94
256,8,256,4096,False,torch.bfloat16,torch.bfloat16,False,False,asm,8,13,7.2639,_ZN5aiter39bf16gemm_fp32bf16_tn_96x64_splitk_cleanE,0.0273,2.31,298.29
256,8,256,4096,False,torch.bfloat16,torch.bfloat16,False,False,hipblaslt,439064,0,7.3208,,0.0,2.29,295.98
256,8,256,4096,False,torch.bfloat16,torch.bfloat16,False,False,hipblaslt,438549,0,7.399,,0.0,2.27,292.85
256,8,256,4096,False,torch.bfloat16,torch.bfloat16,False,False,hipblaslt,439081,0,7.4172,,0.0,2.26,292.13
256,8,256,4096,False,torch.bfloat16,torch.bfloat16,False,False,hipblaslt,438949,0,7.4522,,0.0,2.25,290.76
256,8,256,4096,False,torch.bfloat16,torch.bfloat16,False,False,asm,8,6,7.4807,_ZN5aiter39bf16gemm_fp32bf16_tn_96x64_splitk_cleanE,0.0146,2.24,289.65
256,8,256,4096,False,torch.bfloat16,torch.bfloat16,False,False,hipblaslt,439066,0,7.4816,,0.0,2.24,289.62
256,8,256,4096,False,torch.bfloat16,torch.bfloat16,False,False,hipblaslt,439080,0,7.4914,,0.0,2.24,289.24
256,8,256,4096,False,torch.bfloat16,torch.bfloat16,False,False,hipblaslt,438688,0,7.5096,,0.0,2.23,288.54
256,8,256,4096,False,torch.bfloat16,torch.bfloat16,False,False,asm,8,5,7.5287,_ZN5aiter39bf16gemm_fp32bf16_tn_96x64_splitk_cleanE,0.0142,2.23,287.8
256,8,256,4096,False,torch.bfloat16,torch.bfloat16,False,False,hipblaslt,439063,0,7.5453,,0.0,2.22,287.17
256,8,256,4096,False,torch.bfloat16,torch.bfloat16,False,False,asm,7,13,7.8611,_ZN5aiter39bf16gemm_fp32bf16_tn_80x64_splitk_cleanE,0.0322,2.13,275.63
256,8,256,4096,False,torch.bfloat16,torch.bfloat16,False,False,asm,3,4,7.9951,_ZN5aiter39bf16gemm_fp32bf16_tn_48x64_splitk_cleanE,0.0103,2.1,271.01
256,8,256,4096,False,torch.bfloat16,torch.bfloat16,False,False,asm,5,4,8.0015,_ZN5aiter39bf16gemm_fp32bf16_tn_64x64_splitk_cleanE,0.0122,2.1,270.8
256,8,256,4096,False,torch.bfloat16,torch.bfloat16,False,False,asm,7,4,8.0532,_ZN5aiter39bf16gemm_fp32bf16_tn_80x64_splitk_cleanE,0.0107,2.08,269.06
256,8,256,4096,False,torch.bfloat16,torch.bfloat16,False,False,hipblaslt,439940,0,8.4025,,0.0,2.0,257.87
256,8,256,4096,False,torch.bfloat16,torch.bfloat16,False,False,hipblaslt,438935,0,8.4178,,0.0,1.99,257.41
256,8,256,4096,False,torch.bfloat16,torch.bfloat16,False,False,asm,1,3,8.4608,_ZN5aiter39bf16gemm_fp32bf16_tn_32x64_splitk_cleanE,0.0068,1.98,256.1
256,8,256,4096,False,torch.bfloat16,torch.bfloat16,False,False,hipblaslt,438936,0,8.4719,,0.0,1.98,255.76
256,8,256,4096,False,torch.bfloat16,torch.bfloat16,False,False,asm,8,4,8.518,_ZN5aiter39bf16gemm_fp32bf16_tn_96x64_splitk_cleanE,0.0137,1.97,254.38
256,8,256,4096,False,torch.bfloat16,torch.bfloat16,False,False,asm,5,3,8.668,_ZN5aiter39bf16gemm_fp32bf16_tn_64x64_splitk_cleanE,0.0083,1.94,249.98
256,8,256,4096,False,torch.bfloat16,torch.bfloat16,False,False,asm,3,3,8.7313,_ZN5aiter39bf16gemm_fp32bf16_tn_48x64_splitk_cleanE,0.0078,1.92,248.16
256,8,256,4096,False,torch.bfloat16,torch.bfloat16,False,False,hipblaslt,439945,0,8.7419,,0.0,1.92,247.86
256,8,256,4096,False,torch.bfloat16,torch.bfloat16,False,False,asm,7,3,8.746,_ZN5aiter39bf16gemm_fp32bf16_tn_80x64_splitk_cleanE,0.0068,1.92,247.75
256,8,256,4096,False,torch.bfloat16,torch.bfloat16,False,False,hipblaslt,438328,0,8.7626,,0.0,1.91,247.28
256,8,256,4096,False,torch.bfloat16,torch.bfloat16,False,False,asm,8,3,8.7919,_ZN5aiter39bf16gemm_fp32bf16_tn_96x64_splitk_cleanE,0.0073,1.91,246.45
256,8,256,4096,False,torch.bfloat16,torch.bfloat16,False,False,asm,1,2,9.7069,_ZN5aiter39bf16gemm_fp32bf16_tn_32x64_splitk_cleanE,0.0049,1.73,223.22
256,8,256,4096,False,torch.bfloat16,torch.bfloat16,False,False,asm,3,2,10.0226,_ZN5aiter39bf16gemm_fp32bf16_tn_48x64_splitk_cleanE,0.0049,1.67,216.19
256,8,256,4096,False,torch.bfloat16,torch.bfloat16,False,False,asm,5,2,10.6371,_ZN5aiter39bf16gemm_fp32bf16_tn_64x64_splitk_cleanE,0.0049,1.58,203.7
256,8,256,4096,False,torch.bfloat16,torch.bfloat16,False,False,asm,7,2,10.8108,_ZN5aiter39bf16gemm_fp32bf16_tn_80x64_splitk_cleanE,0.0049,1.55,200.43
256,8,256,4096,False,torch.bfloat16,torch.bfloat16,False,False,asm,8,2,11.402,_ZN5aiter39bf16gemm_fp32bf16_tn_96x64_splitk_cleanE,0.0049,1.47,190.04
256,8,256,4096,False,torch.bfloat16,torch.bfloat16,False,False,asm,2,1,15.1726,_ZN5aiter37bf16gemm_fp32bf16_tn_32x64_pf3_splitkE,0.0,1.11,142.81
256,8,256,4096,False,torch.bfloat16,torch.bfloat16,False,False,asm,4,1,15.5997,_ZN5aiter37bf16gemm_fp32bf16_tn_48x64_pf3_splitkE,0.0,1.08,138.9
256,8,256,4096,False,torch.bfloat16,torch.bfloat16,False,False,asm,6,1,16.1957,_ZN5aiter37bf16gemm_fp32bf16_tn_64x64_pf3_splitkE,0.0,1.04,133.79
256,8,256,4096,False,torch.bfloat16,torch.bfloat16,False,False,asm,9,1,17.5373,_ZN5aiter37bf16gemm_fp32bf16_tn_96x64_pf3_splitkE,0.0,0.96,123.55
256,8,256,4096,False,torch.bfloat16,torch.bfloat16,False,False,asm,10,1,60.9712,_ZN5aiter24bf16gemm_bf16_tn_256x256E,0.0,0.28,35.54
256,16,256,4096,False,torch.bfloat16,torch.bfloat16,False,False,asm,1,12,5.2643,_ZN5aiter39bf16gemm_fp32bf16_tn_32x64_splitk_cleanE,0.0208,6.37,424.83
256,16,256,4096,False,torch.bfloat16,torch.bfloat16,False,False,asm,7,8,5.3303,_ZN5aiter39bf16gemm_fp32bf16_tn_80x64_splitk_cleanE,0.022,6.3,419.57
256,16,256,4096,False,torch.bfloat16,torch.bfloat16,False,False,asm,5,9,5.4315,_ZN5aiter39bf16gemm_fp32bf16_tn_64x64_splitk_cleanE,0.0193,6.18,411.75
256,16,256,4096,False,torch.bfloat16,torch.bfloat16,False,False,asm,7,9,5.4435,_ZN5aiter39bf16gemm_fp32bf16_tn_80x64_splitk_cleanE,0.0217,6.16,410.84
256,16,256,4096,False,torch.bfloat16,torch.bfloat16,False,False,asm,1,16,5.4647,_ZN5aiter39bf16gemm_fp32bf16_tn_32x64_splitk_cleanE,0.0278,6.14,409.25
256,16,256,4096,False,torch.bfloat16,torch.bfloat16,False,False,asm,3,16,5.4653,_ZN5aiter39bf16gemm_fp32bf16_tn_48x64_splitk_cleanE,0.0303,6.14,409.2
256,16,256,4096,False,torch.bfloat16,torch.bfloat16,False,False,asm,8,9,5.4683,_ZN5aiter39bf16gemm_fp32bf16_tn_96x64_splitk_cleanE,0.0205,6.14,408.98
256,16,256,4096,False,torch.bfloat16,torch.bfloat16,False,False,asm,3,10,5.5268,_ZN5aiter39bf16gemm_fp32bf16_tn_48x64_splitk_cleanE,0.0215,6.07,404.65
256,16,256,4096,False,torch.bfloat16,torch.bfloat16,False,False,asm,5,8,5.5563,_ZN5aiter39bf16gemm_fp32bf16_tn_64x64_splitk_cleanE,0.022,6.04,402.5
256,16,256,4096,False,torch.bfloat16,torch.bfloat16,False,False,asm,3,15,5.5647,_ZN5aiter39bf16gemm_fp32bf16_tn_48x64_splitk_cleanE,0.03,6.03,401.89
256,16,256,4096,False,torch.bfloat16,torch.bfloat16,False,False,asm,1,14,5.5681,_ZN5aiter39bf16gemm_fp32bf16_tn_32x64_splitk_cleanE,0.0269,6.03,401.65
256,16,256,4096,False,torch.bfloat16,torch.bfloat16,False,False,asm,5,15,5.5966,_ZN5aiter39bf16gemm_fp32bf16_tn_64x64_splitk_cleanE,0.031,6.0,399.6
256,16,256,4096,False,torch.bfloat16,torch.bfloat16,False,False,asm,5,16,5.6011,_ZN5aiter39bf16gemm_fp32bf16_tn_64x64_splitk_cleanE,0.0269,5.99,399.28
256,16,256,4096,False,torch.bfloat16,torch.bfloat16,False,False,asm,1,9,5.6047,_ZN5aiter39bf16gemm_fp32bf16_tn_32x64_splitk_cleanE,0.0188,5.99,399.03
256,16,256,4096,False,torch.bfloat16,torch.bfloat16,False,False,asm,1,11,5.637,_ZN5aiter39bf16gemm_fp32bf16_tn_32x64_splitk_cleanE,0.0264,5.95,396.74
256,16,256,4096,False,torch.bfloat16,torch.bfloat16,False,False,asm,3,14,5.6395,_ZN5aiter39bf16gemm_fp32bf16_tn_48x64_splitk_cleanE,0.0291,5.95,396.56
256,16,256,4096,False,torch.bfloat16,torch.bfloat16,False,False,asm,5,10,5.6455,_ZN5aiter39bf16gemm_fp32bf16_tn_64x64_splitk_cleanE,0.0247,5.94,396.14
256,16,256,4096,False,torch.bfloat16,torch.bfloat16,False,False,asm,5,7,5.6887,_ZN5aiter39bf16gemm_fp32bf16_tn_64x64_splitk_cleanE,0.0173,5.9,393.13
256,16,256,4096,False,torch.bfloat16,torch.bfloat16,False,False,asm,5,14,5.6906,_ZN5aiter39bf16gemm_fp32bf16_tn_64x64_splitk_cleanE,0.0312,5.9,393.0
256,16,256,4096,False,torch.bfloat16,torch.bfloat16,False,False,asm,1,8,5.7071,_ZN5aiter39bf16gemm_fp32bf16_tn_32x64_splitk_cleanE,0.0203,5.88,391.87
256,16,256,4096,False,torch.bfloat16,torch.bfloat16,False,False,asm,3,7,5.7284,_ZN5aiter39bf16gemm_fp32bf16_tn_48x64_splitk_cleanE,0.021,5.86,390.41
256,16,256,4096,False,torch.bfloat16,torch.bfloat16,False,False,asm,1,7,5.7348,_ZN5aiter39bf16gemm_fp32bf16_tn_32x64_splitk_cleanE,0.0203,5.85,389.97
256,16,256,4096,False,torch.bfloat16,torch.bfloat16,False,False,asm,7,7,5.7536,_ZN5aiter39bf16gemm_fp32bf16_tn_80x64_splitk_cleanE,0.0203,5.83,388.7
256,16,256,4096,False,torch.bfloat16,torch.bfloat16,False,False,asm,7,15,5.7661,_ZN5aiter39bf16gemm_fp32bf16_tn_80x64_splitk_cleanE,0.0315,5.82,387.86
256,16,256,4096,False,torch.bfloat16,torch.bfloat16,False,False,asm,3,8,5.7879,_ZN5aiter39bf16gemm_fp32bf16_tn_48x64_splitk_cleanE,0.0222,5.8,386.4
256,16,256,4096,False,torch.bfloat16,torch.bfloat16,False,False,asm,1,13,5.8372,_ZN5aiter39bf16gemm_fp32bf16_tn_32x64_splitk_cleanE,0.0254,5.75,383.13
256,16,256,4096,False,torch.bfloat16,torch.bfloat16,False,False,asm,7,14,5.8683,_ZN5aiter39bf16gemm_fp32bf16_tn_80x64_splitk_cleanE,0.0278,5.72,381.1
256,16,256,4096,False,torch.bfloat16,torch.bfloat16,False,False,asm,8,8,5.9082,_ZN5aiter39bf16gemm_fp32bf16_tn_96x64_splitk_cleanE,0.02,5.68,378.53
256,16,256,4096,False,torch.bfloat16,torch.bfloat16,False,False,asm,1,10,5.924,_ZN5aiter39bf16gemm_fp32bf16_tn_32x64_splitk_cleanE,0.0242,5.66,377.52
256,16,256,4096,False,torch.bfloat16,torch.bfloat16,False,False,asm,8,12,5.9328,_ZN5aiter39bf16gemm_fp32bf16_tn_96x64_splitk_cleanE,0.0251,5.66,376.96
256,16,256,4096,False,torch.bfloat16,torch.bfloat16,False,False,asm,3,6,5.9522,_ZN5aiter39bf16gemm_fp32bf16_tn_48x64_splitk_cleanE,0.0149,5.64,375.73
256,16,256,4096,False,torch.bfloat16,torch.bfloat16,False,False,asm,7,12,5.963,_ZN5aiter39bf16gemm_fp32bf16_tn_80x64_splitk_cleanE,0.0261,5.63,375.05
256,16,256,4096,False,torch.bfloat16,torch.bfloat16,False,False,asm,5,6,5.9875,_ZN5aiter39bf16gemm_fp32bf16_tn_64x64_splitk_cleanE,0.0171,5.6,373.51
256,16,256,4096,False,torch.bfloat16,torch.bfloat16,False,False,asm,7,16,5.9935,_ZN5aiter39bf16gemm_fp32bf16_tn_80x64_splitk_cleanE,0.0276,5.6,373.14
256,16,256,4096,False,torch.bfloat16,torch.bfloat16,False,False,asm,3,11,6.0343,_ZN5aiter39bf16gemm_fp32bf16_tn_48x64_splitk_cleanE,0.0273,5.56,370.62
256,16,256,4096,False,torch.bfloat16,torch.bfloat16,False,False,asm,3,9,6.0599,_ZN5aiter39bf16gemm_fp32bf16_tn_48x64_splitk_cleanE,0.0203,5.54,369.05
256,16,256,4096,False,torch.bfloat16,torch.bfloat16,False,False,asm,8,7,6.0828,_ZN5aiter39bf16gemm_fp32bf16_tn_96x64_splitk_cleanE,0.0195,5.52,367.66
256,16,256,4096,False,torch.bfloat16,torch.bfloat16,False,False,asm,8,16,6.1039,_ZN5aiter39bf16gemm_fp32bf16_tn_96x64_splitk_cleanE,0.03,5.5,366.39
256,16,256,4096,False,torch.bfloat16,torch.bfloat16,False,False,asm,7,11,6.1313,_ZN5aiter39bf16gemm_fp32bf16_tn_80x64_splitk_cleanE,0.0222,5.47,364.75
256,16,256,4096,False,torch.bfloat16,torch.bfloat16,False,False,asm,1,6,6.1571,_ZN5aiter39bf16gemm_fp32bf16_tn_32x64_splitk_cleanE,0.0166,5.45,363.23
256,16,256,4096,False,torch.bfloat16,torch.bfloat16,False,False,asm,1,15,6.3419,_ZN5aiter39bf16gemm_fp32bf16_tn_32x64_splitk_cleanE,0.0293,5.29,352.64
256,16,256,4096,False,torch.bfloat16,torch.bfloat16,False,False,asm,5,11,6.3499,_ZN5aiter39bf16gemm_fp32bf16_tn_64x64_splitk_cleanE,0.0237,5.28,352.2
256,16,256,4096,False,torch.bfloat16,torch.bfloat16,False,False,asm,1,4,6.425,_ZN5aiter39bf16gemm_fp32bf16_tn_32x64_splitk_cleanE,0.011,5.22,348.08
256,16,256,4096,False,torch.bfloat16,torch.bfloat16,False,False,asm,8,15,6.4447,_ZN5aiter39bf16gemm_fp32bf16_tn_96x64_splitk_cleanE,0.0293,5.21,347.02
256,16,256,4096,False,torch.bfloat16,torch.bfloat16,False,False,asm,5,12,6.4611,_ZN5aiter39bf16gemm_fp32bf16_tn_64x64_splitk_cleanE,0.0266,5.19,346.14
256,16,256,4096,False,torch.bfloat16,torch.bfloat16,False,False,hipblaslt,438818,0,6.6443,,0.0,5.05,336.59
256,16,256,4096,False,torch.bfloat16,torch.bfloat16,False,False,asm,1,5,6.7058,_ZN5aiter39bf16gemm_fp32bf16_tn_32x64_splitk_cleanE,0.0132,5.0,333.5
256,16,256,4096,False,torch.bfloat16,torch.bfloat16,False,False,asm,7,10,6.7486,_ZN5aiter39bf16gemm_fp32bf16_tn_80x64_splitk_cleanE,0.0212,4.97,331.39
256,16,256,4096,False,torch.bfloat16,torch.bfloat16,False,False,hipblaslt,438410,0,6.8308,,0.0,4.91,327.4
256,16,256,4096,False,torch.bfloat16,torch.bfloat16,False,False,hipblaslt,438618,0,6.8317,,0.0,4.91,327.36
256,16,256,4096,False,torch.bfloat16,torch.bfloat16,False,False,hipblaslt,439683,0,6.8331,,0.0,4.91,327.29
256,16,256,4096,False,torch.bfloat16,torch.bfloat16,False,False,hipblaslt,439082,0,6.8407,,0.0,4.91,326.93
256,16,256,4096,False,torch.bfloat16,torch.bfloat16,False,False,asm,3,13,6.9039,_ZN5aiter39bf16gemm_fp32bf16_tn_48x64_splitk_cleanE,0.0276,4.86,323.94
256,16,256,4096,False,torch.bfloat16,torch.bfloat16,False,False,asm,3,12,6.9649,_ZN5aiter39bf16gemm_fp32bf16_tn_48x64_splitk_cleanE,0.0239,4.82,321.1
256,16,256,4096,False,torch.bfloat16,torch.bfloat16,False,False,asm,7,6,7.0282,_ZN5aiter39bf16gemm_fp32bf16_tn_80x64_splitk_cleanE,0.0156,4.77,318.21
256,16,256,4096,False,torch.bfloat16,torch.bfloat16,False,False,asm,8,11,7.1071,_ZN5aiter39bf16gemm_fp32bf16_tn_96x64_splitk_cleanE,0.0239,4.72,314.67
256,16,256,4096,False,torch.bfloat16,torch.bfloat16,False,False,asm,5,13,7.1727,_ZN5aiter39bf16gemm_fp32bf16_tn_64x64_splitk_cleanE,0.0271,4.68,311.8
256,16,256,4096,False,torch.bfloat16,torch.bfloat16,False,False,hipblaslt,440202,0,7.191,,0.0,4.67,311.0
256,16,256,4096,False,torch.bfloat16,torch.bfloat16,False,False,hipblaslt,438549,0,7.2691,,0.0,4.62,307.66
256,16,256,4096,False,torch.bfloat16,torch.bfloat16,False,False,hipblaslt,438754,0,7.2766,,0.0,4.61,307.34
256,16,256,4096,False,torch.bfloat16,torch.bfloat16,False,False,hipblaslt,439688,0,7.2924,,0.0,4.6,306.68
256,16,256,4096,False,torch.bfloat16,torch.bfloat16,False,False,hipblaslt,438949,0,7.3158,,0.0,4.59,305.7
256,16,256,4096,False,torch.bfloat16,torch.bfloat16,False,False,asm,5,5,7.3361,_ZN5aiter39bf16gemm_fp32bf16_tn_64x64_splitk_cleanE,0.0129,4.57,304.85
256,16,256,4096,False,torch.bfloat16,torch.bfloat16,False,False,hipblaslt,439081,0,7.3366,,0.0,4.57,304.83
256,16,256,4096,False,torch.bfloat16,torch.bfloat16,False,False,asm,3,5,7.3487,_ZN5aiter39bf16gemm_fp32bf16_tn_48x64_splitk_cleanE,0.0149,4.57,304.33
256,16,256,4096,False,torch.bfloat16,torch.bfloat16,False,False,hipblaslt,440197,0,7.3632,,0.0,4.56,303.73
256,16,256,4096,False,torch.bfloat16,torch.bfloat16,False,False,hipblaslt,439064,0,7.3684,,0.0,4.55,303.51
256,16,256,4096,False,torch.bfloat16,torch.bfloat16,False,False,hipblaslt,438958,0,7.4058,,0.0,4.53,301.98
256,16,256,4096,False,torch.bfloat16,torch.bfloat16,False,False,hipblaslt,439080,0,7.4357,,0.0,4.51,300.77
256,16,256,4096,False,torch.bfloat16,torch.bfloat16,False,False,asm,8,14,7.4887,_ZN5aiter39bf16gemm_fp32bf16_tn_96x64_splitk_cleanE,0.0278,4.48,298.64
256,16,256,4096,False,torch.bfloat16,torch.bfloat16,False,False,asm,8,10,7.6013,_ZN5aiter39bf16gemm_fp32bf16_tn_96x64_splitk_cleanE,0.0217,4.41,294.21
256,16,256,4096,False,torch.bfloat16,torch.bfloat16,False,False,asm,5,4,7.7242,_ZN5aiter39bf16gemm_fp32bf16_tn_64x64_splitk_cleanE,0.0107,4.34,289.53
256,16,256,4096,False,torch.bfloat16,torch.bfloat16,False,False,asm,7,13,7.7995,_ZN5aiter39bf16gemm_fp32bf16_tn_80x64_splitk_cleanE,0.0264,4.3,286.74
256,16,256,4096,False,torch.bfloat16,torch.bfloat16,False,False,asm,7,5,7.8496,_ZN5aiter39bf16gemm_fp32bf16_tn_80x64_splitk_cleanE,0.0156,4.27,284.91
256,16,256,4096,False,torch.bfloat16,torch.bfloat16,False,False,asm,8,13,8.1371,_ZN5aiter39bf16gemm_fp32bf16_tn_96x64_splitk_cleanE,0.0237,4.12,274.84
256,16,256,4096,False,torch.bfloat16,torch.bfloat16,False,False,asm,8,5,8.3271,_ZN5aiter39bf16gemm_fp32bf16_tn_96x64_splitk_cleanE,0.0146,4.03,268.57
256,16,256,4096,False,torch.bfloat16,torch.bfloat16,False,False,asm,3,3,8.4129,_ZN5aiter39bf16gemm_fp32bf16_tn_48x64_splitk_cleanE,0.0073,3.99,265.83
256,16,256,4096,False,torch.bfloat16,torch.bfloat16,False,False,asm,3,4,8.4329,_ZN5aiter39bf16gemm_fp32bf16_tn_48x64_splitk_cleanE,0.0107,3.98,265.2
256,16,256,4096,False,torch.bfloat16,torch.bfloat16,False,False,asm,8,6,8.5328,_ZN5aiter39bf16gemm_fp32bf16_tn_96x64_splitk_cleanE,0.0149,3.93,262.1
256,16,256,4096,False,torch.bfloat16,torch.bfloat16,False,False,asm,1,3,8.5459,_ZN5aiter39bf16gemm_fp32bf16_tn_32x64_splitk_cleanE,0.0081,3.93,261.69
256,16,256,4096,False,torch.bfloat16,torch.bfloat16,False,False,hipblaslt,438354,0,8.5828,,0.0,3.91,260.57
256,16,256,4096,False,torch.bfloat16,torch.bfloat16,False,False,asm,8,4,8.5975,_ZN5aiter39bf16gemm_fp32bf16_tn_96x64_splitk_cleanE,0.011,3.9,260.12
256,16,256,4096,False,torch.bfloat16,torch.bfloat16,False,False,asm,7,3,8.6024,_ZN5aiter39bf16gemm_fp32bf16_tn_80x64_splitk_cleanE,0.0081,3.9,259.98
256,16,256,4096,False,torch.bfloat16,torch.bfloat16,False,False,asm,8,3,8.7741,_ZN5aiter39bf16gemm_fp32bf16_tn_96x64_splitk_cleanE,0.0076,3.82,254.89
256,16,256,4096,False,torch.bfloat16,torch.bfloat16,False,False,hipblaslt,438256,0,8.8645,,0.0,3.79,252.29
256,16,256,4096,False,torch.bfloat16,torch.bfloat16,False,False,hipblaslt,439940,0,9.0272,,0.0,3.72,247.74
256,16,256,4096,False,torch.bfloat16,torch.bfloat16,False,False,asm,7,4,9.0414,_ZN5aiter39bf16gemm_fp32bf16_tn_80x64_splitk_cleanE,0.0107,3.71,247.35
256,16,256,4096,False,torch.bfloat16,torch.bfloat16,False,False,hipblaslt,438936,0,9.1919,,0.0,3.65,243.3
256,16,256,4096,False,torch.bfloat16,torch.bfloat16,False,False,hipblaslt,438935,0,9.2058,,0.0,3.64,242.94
256,16,256,4096,False,torch.bfloat16,torch.bfloat16,False,False,asm,5,3,9.6488,_ZN5aiter39bf16gemm_fp32bf16_tn_64x64_splitk_cleanE,0.0073,3.48,231.78
256,16,256,4096,False,torch.bfloat16,torch.bfloat16,False,False,asm,3,2,10.315,_ZN5aiter39bf16gemm_fp32bf16_tn_48x64_splitk_cleanE,0.0037,3.25,216.81
256,16,256,4096,False,torch.bfloat16,torch.bfloat16,False,False,asm,5,2,10.4754,_ZN5aiter39bf16gemm_fp32bf16_tn_64x64_splitk_cleanE,0.0037,3.2,213.49
256,16,256,4096,False,torch.bfloat16,torch.bfloat16,False,False,asm,1,2,10.6586,_ZN5aiter39bf16gemm_fp32bf16_tn_32x64_splitk_cleanE,0.0037,3.15,209.82
256,16,256,4096,False,torch.bfloat16,torch.bfloat16,False,False,asm,7,2,10.8759,_ZN5aiter39bf16gemm_fp32bf16_tn_80x64_splitk_cleanE,0.0037,3.09,205.63
256,16,256,4096,False,torch.bfloat16,torch.bfloat16,False,False,asm,8,2,11.4996,_ZN5aiter39bf16gemm_fp32bf16_tn_96x64_splitk_cleanE,0.0037,2.92,194.48
256,16,256,4096,False,torch.bfloat16,torch.bfloat16,False,False,asm,2,1,15.2788,_ZN5aiter37bf16gemm_fp32bf16_tn_32x64_pf3_splitkE,0.0,2.2,146.37
256,16,256,4096,False,torch.bfloat16,torch.bfloat16,False,False,asm,4,1,15.6509,_ZN5aiter37bf16gemm_fp32bf16_tn_48x64_pf3_splitkE,0.0,2.14,142.89
256,16,256,4096,False,torch.bfloat16,torch.bfloat16,False,False,asm,6,1,16.2641,_ZN5aiter37bf16gemm_fp32bf16_tn_64x64_pf3_splitkE,0.0,2.06,137.51
256,16,256,4096,False,torch.bfloat16,torch.bfloat16,False,False,asm,9,1,17.6281,_ZN5aiter37bf16gemm_fp32bf16_tn_96x64_pf3_splitkE,0.0,1.9,126.87
256,16,256,4096,False,torch.bfloat16,torch.bfloat16,False,False,asm,10,1,61.2359,_ZN5aiter24bf16gemm_bf16_tn_256x256E,0.0,0.55,36.52
256,32,256,4096,False,torch.bfloat16,torch.bfloat16,False,False,asm,3,8,5.143,_ZN5aiter39bf16gemm_fp32bf16_tn_48x64_splitk_cleanE,0.022,13.05,461.92
256,32,256,4096,False,torch.bfloat16,torch.bfloat16,False,False,asm,1,15,5.2568,_ZN5aiter39bf16gemm_fp32bf16_tn_32x64_splitk_cleanE,0.0305,12.77,451.93
256,32,256,4096,False,torch.bfloat16,torch.bfloat16,False,False,asm,3,12,5.2993,_ZN5aiter39bf16gemm_fp32bf16_tn_48x64_splitk_cleanE,0.0261,12.66,448.3
256,32,256,4096,False,torch.bfloat16,torch.bfloat16,False,False,asm,3,16,5.3112,_ZN5aiter39bf16gemm_fp32bf16_tn_48x64_splitk_cleanE,0.0273,12.64,447.3
256,32,256,4096,False,torch.bfloat16,torch.bfloat16,False,False,asm,5,12,5.3799,_ZN5aiter39bf16gemm_fp32bf16_tn_64x64_splitk_cleanE,0.025,12.47,441.58
256,32,256,4096,False,torch.bfloat16,torch.bfloat16,False,False,asm,3,9,5.4214,_ZN5aiter39bf16gemm_fp32bf16_tn_48x64_splitk_cleanE,0.0204,12.38,438.2
256,32,256,4096,False,torch.bfloat16,torch.bfloat16,False,False,asm,1,16,5.4223,_ZN5aiter39bf16gemm_fp32bf16_tn_32x64_splitk_cleanE,0.0305,12.38,438.13
256,32,256,4096,False,torch.bfloat16,torch.bfloat16,False,False,asm,3,15,5.424,_ZN5aiter39bf16gemm_fp32bf16_tn_48x64_splitk_cleanE,0.0294,12.37,437.99
256,32,256,4096,False,torch.bfloat16,torch.bfloat16,False,False,asm,3,7,5.5216,_ZN5aiter39bf16gemm_fp32bf16_tn_48x64_splitk_cleanE,0.0193,12.15,430.25
256,32,256,4096,False,torch.bfloat16,torch.bfloat16,False,False,asm,1,12,5.5466,_ZN5aiter39bf16gemm_fp32bf16_tn_32x64_splitk_cleanE,0.0232,12.1,428.31
256,32,256,4096,False,torch.bfloat16,torch.bfloat16,False,False,asm,7,9,5.5785,_ZN5aiter39bf16gemm_fp32bf16_tn_80x64_splitk_cleanE,0.0209,12.03,425.86
256,32,256,4096,False,torch.bfloat16,torch.bfloat16,False,False,asm,7,12,5.5942,_ZN5aiter39bf16gemm_fp32bf16_tn_80x64_splitk_cleanE,0.0248,12.0,424.67
256,32,256,4096,False,torch.bfloat16,torch.bfloat16,False,False,asm,5,8,5.6531,_ZN5aiter39bf16gemm_fp32bf16_tn_64x64_splitk_cleanE,0.0209,11.87,420.24
256,32,256,4096,False,torch.bfloat16,torch.bfloat16,False,False,asm,7,10,5.6836,_ZN5aiter39bf16gemm_fp32bf16_tn_80x64_splitk_cleanE,0.0244,11.81,417.99
256,32,256,4096,False,torch.bfloat16,torch.bfloat16,False,False,asm,7,8,5.7667,_ZN5aiter39bf16gemm_fp32bf16_tn_80x64_splitk_cleanE,0.0212,11.64,411.97
256,32,256,4096,False,torch.bfloat16,torch.bfloat16,False,False,asm,3,10,5.8133,_ZN5aiter39bf16gemm_fp32bf16_tn_48x64_splitk_cleanE,0.0223,11.54,408.66
256,32,256,4096,False,torch.bfloat16,torch.bfloat16,False,False,asm,5,10,5.8139,_ZN5aiter39bf16gemm_fp32bf16_tn_64x64_splitk_cleanE,0.0244,11.54,408.62
256,32,256,4096,False,torch.bfloat16,torch.bfloat16,False,False,asm,1,8,5.8437,_ZN5aiter39bf16gemm_fp32bf16_tn_32x64_splitk_cleanE,0.0193,11.48,406.54
256,32,256,4096,False,torch.bfloat16,torch.bfloat16,False,False,asm,1,11,5.855,_ZN5aiter39bf16gemm_fp32bf16_tn_32x64_splitk_cleanE,0.0244,11.46,405.75
256,32,256,4096,False,torch.bfloat16,torch.bfloat16,False,False,asm,8,10,5.8635,_ZN5aiter39bf16gemm_fp32bf16_tn_96x64_splitk_cleanE,0.0211,11.45,405.16
256,32,256,4096,False,torch.bfloat16,torch.bfloat16,False,False,asm,5,16,5.9273,_ZN5aiter39bf16gemm_fp32bf16_tn_64x64_splitk_cleanE,0.0305,11.32,400.8
256,32,256,4096,False,torch.bfloat16,torch.bfloat16,False,False,asm,1,10,5.9372,_ZN5aiter39bf16gemm_fp32bf16_tn_32x64_splitk_cleanE,0.0234,11.3,400.13
256,32,256,4096,False,torch.bfloat16,torch.bfloat16,False,False,asm,1,14,5.9778,_ZN5aiter39bf16gemm_fp32bf16_tn_32x64_splitk_cleanE,0.027,11.23,397.42
256,32,256,4096,False,torch.bfloat16,torch.bfloat16,False,False,asm,8,9,5.9939,_ZN5aiter39bf16gemm_fp32bf16_tn_96x64_splitk_cleanE,0.0211,11.2,396.35
256,32,256,4096,False,torch.bfloat16,torch.bfloat16,False,False,asm,5,9,6.0124,_ZN5aiter39bf16gemm_fp32bf16_tn_64x64_splitk_cleanE,0.0226,11.16,395.13
256,32,256,4096,False,torch.bfloat16,torch.bfloat16,False,False,asm,5,7,6.0981,_ZN5aiter39bf16gemm_fp32bf16_tn_64x64_splitk_cleanE,0.0195,11.0,389.58
256,32,256,4096,False,torch.bfloat16,torch.bfloat16,False,False,asm,5,15,6.1143,_ZN5aiter39bf16gemm_fp32bf16_tn_64x64_splitk_cleanE,0.0294,10.98,388.54
256,32,256,4096,False,torch.bfloat16,torch.bfloat16,False,False,asm,1,9,6.1146,_ZN5aiter39bf16gemm_fp32bf16_tn_32x64_splitk_cleanE,0.0212,10.98,388.53
256,32,256,4096,False,torch.bfloat16,torch.bfloat16,False,False,asm,1,7,6.2003,_ZN5aiter39bf16gemm_fp32bf16_tn_32x64_splitk_cleanE,0.0204,10.82,383.16
256,32,256,4096,False,torch.bfloat16,torch.bfloat16,False,False,asm,1,5,6.212,_ZN5aiter39bf16gemm_fp32bf16_tn_32x64_splitk_cleanE,0.0139,10.8,382.43
256,32,256,4096,False,torch.bfloat16,torch.bfloat16,False,False,asm,7,15,6.2284,_ZN5aiter39bf16gemm_fp32bf16_tn_80x64_splitk_cleanE,0.0288,10.77,381.43
256,32,256,4096,False,torch.bfloat16,torch.bfloat16,False,False,asm,5,6,6.3162,_ZN5aiter39bf16gemm_fp32bf16_tn_64x64_splitk_cleanE,0.0165,10.62,376.12
256,32,256,4096,False,torch.bfloat16,torch.bfloat16,False,False,asm,7,16,6.3901,_ZN5aiter39bf16gemm_fp32bf16_tn_80x64_splitk_cleanE,0.0289,10.5,371.78
256,32,256,4096,False,torch.bfloat16,torch.bfloat16,False,False,asm,1,6,6.3918,_ZN5aiter39bf16gemm_fp32bf16_tn_32x64_splitk_cleanE,0.0157,10.5,371.68
256,32,256,4096,False,torch.bfloat16,torch.bfloat16,False,False,asm,3,14,6.4055,_ZN5aiter39bf16gemm_fp32bf16_tn_48x64_splitk_cleanE,0.0284,10.48,370.88
256,32,256,4096,False,torch.bfloat16,torch.bfloat16,False,False,asm,1,13,6.4341,_ZN5aiter39bf16gemm_fp32bf16_tn_32x64_splitk_cleanE,0.0262,10.43,369.23
256,32,256,4096,False,torch.bfloat16,torch.bfloat16,False,False,asm,8,8,6.5704,_ZN5aiter39bf16gemm_fp32bf16_tn_96x64_splitk_cleanE,0.0209,10.21,361.57
256,32,256,4096,False,torch.bfloat16,torch.bfloat16,False,False,asm,8,15,6.6195,_ZN5aiter39bf16gemm_fp32bf16_tn_96x64_splitk_cleanE,0.0302,10.14,358.89
256,32,256,4096,False,torch.bfloat16,torch.bfloat16,False,False,asm,1,4,6.6513,_ZN5aiter39bf16gemm_fp32bf16_tn_32x64_splitk_cleanE,0.0114,10.09,357.18
256,32,256,4096,False,torch.bfloat16,torch.bfloat16,False,False,asm,3,11,6.6803,_ZN5aiter39bf16gemm_fp32bf16_tn_48x64_splitk_cleanE,0.0266,10.05,355.62
256,32,256,4096,False,torch.bfloat16,torch.bfloat16,False,False,asm,5,13,6.7115,_ZN5aiter39bf16gemm_fp32bf16_tn_64x64_splitk_cleanE,0.0262,10.0,353.97
256,32,256,4096,False,torch.bfloat16,torch.bfloat16,False,False,asm,5,11,6.7183,_ZN5aiter39bf16gemm_fp32bf16_tn_64x64_splitk_cleanE,0.0223,9.99,353.61
256,32,256,4096,False,torch.bfloat16,torch.bfloat16,False,False,asm,7,7,6.7466,_ZN5aiter39bf16gemm_fp32bf16_tn_80x64_splitk_cleanE,0.0195,9.95,352.13
256,32,256,4096,False,torch.bfloat16,torch.bfloat16,False,False,asm,8,16,6.8967,_ZN5aiter39bf16gemm_fp32bf16_tn_96x64_splitk_cleanE,0.0275,9.73,344.47
256,32,256,4096,False,torch.bfloat16,torch.bfloat16,False,False,asm,7,14,6.9751,_ZN5aiter39bf16gemm_fp32bf16_tn_80x64_splitk_cleanE,0.0281,9.62,340.59
256,32,256,4096,False,torch.bfloat16,torch.bfloat16,False,False,asm,3,6,6.9783,_ZN5aiter39bf16gemm_fp32bf16_tn_48x64_splitk_cleanE,0.015,9.62,340.44
256,32,256,4096,False,torch.bfloat16,torch.bfloat16,False,False,asm,3,13,7.0755,_ZN5aiter39bf16gemm_fp32bf16_tn_48x64_splitk_cleanE,0.0272,9.48,335.76
256,32,256,4096,False,torch.bfloat16,torch.bfloat16,False,False,asm,5,14,7.0791,_ZN5aiter39bf16gemm_fp32bf16_tn_64x64_splitk_cleanE,0.0261,9.48,335.59
256,32,256,4096,False,torch.bfloat16,torch.bfloat16,False,False,asm,8,7,7.0919,_ZN5aiter39bf16gemm_fp32bf16_tn_96x64_splitk_cleanE,0.0173,9.46,334.98
256,32,256,4096,False,torch.bfloat16,torch.bfloat16,False,False,asm,7,11,7.1003,_ZN5aiter39bf16gemm_fp32bf16_tn_80x64_splitk_cleanE,0.0242,9.45,334.59
256,32,256,4096,False,torch.bfloat16,torch.bfloat16,False,False,asm,8,11,7.3259,_ZN5aiter39bf16gemm_fp32bf16_tn_96x64_splitk_cleanE,0.0239,9.16,324.29
256,32,256,4096,False,torch.bfloat16,torch.bfloat16,False,False,asm,5,5,7.3363,_ZN5aiter39bf16gemm_fp32bf16_tn_64x64_splitk_cleanE,0.0146,9.15,323.83
256,32,256,4096,False,torch.bfloat16,torch.bfloat16,False,False,asm,3,5,7.4251,_ZN5aiter39bf16gemm_fp32bf16_tn_48x64_splitk_cleanE,0.0146,9.04,319.95
256,32,256,4096,False,torch.bfloat16,torch.bfloat16,False,False,asm,8,12,7.6127,_ZN5aiter39bf16gemm_fp32bf16_tn_96x64_splitk_cleanE,0.0249,8.82,312.07
256,32,256,4096,False,torch.bfloat16,torch.bfloat16,False,False,hipblaslt,440197,0,7.6244,,0.0,8.8,311.59
256,32,256,4096,False,torch.bfloat16,torch.bfloat16,False,False,asm,8,14,7.6559,_ZN5aiter39bf16gemm_fp32bf16_tn_96x64_splitk_cleanE,0.0288,8.77,310.31
256,32,256,4096,False,torch.bfloat16,torch.bfloat16,False,False,asm,5,4,7.7923,_ZN5aiter39bf16gemm_fp32bf16_tn_64x64_splitk_cleanE,0.0121,8.61,304.88
256,32,256,4096,False,torch.bfloat16,torch.bfloat16,False,False,asm,7,6,7.8783,_ZN5aiter39bf16gemm_fp32bf16_tn_80x64_splitk_cleanE,0.0162,8.52,301.55
256,32,256,4096,False,torch.bfloat16,torch.bfloat16,False,False,asm,8,13,7.9975,_ZN5aiter39bf16gemm_fp32bf16_tn_96x64_splitk_cleanE,0.0289,8.39,297.05
256,32,256,4096,False,torch.bfloat16,torch.bfloat16,False,False,asm,7,13,8.0119,_ZN5aiter39bf16gemm_fp32bf16_tn_80x64_splitk_cleanE,0.0265,8.38,296.52
256,32,256,4096,False,torch.bfloat16,torch.bfloat16,False,False,hipblaslt,438481,0,8.0383,,0.0,8.35,295.55
256,32,256,4096,False,torch.bfloat16,torch.bfloat16,False,False,asm,8,5,8.0731,_ZN5aiter39bf16gemm_fp32bf16_tn_96x64_splitk_cleanE,0.0135,8.31,294.27
256,32,256,4096,False,torch.bfloat16,torch.bfloat16,False,False,asm,7,5,8.1652,_ZN5aiter39bf16gemm_fp32bf16_tn_80x64_splitk_cleanE,0.0146,8.22,290.95
256,32,256,4096,False,torch.bfloat16,torch.bfloat16,False,False,hipblaslt,438618,0,8.1844,,0.0,8.2,290.27
256,32,256,4096,False,torch.bfloat16,torch.bfloat16,False,False,asm,3,4,8.1884,_ZN5aiter39bf16gemm_fp32bf16_tn_48x64_splitk_cleanE,0.0125,8.2,290.13
256,32,256,4096,False,torch.bfloat16,torch.bfloat16,False,False,hipblaslt,438755,0,8.4,,0.0,7.99,282.82
256,32,256,4096,False,torch.bfloat16,torch.bfloat16,False,False,asm,3,3,8.4177,_ZN5aiter39bf16gemm_fp32bf16_tn_48x64_splitk_cleanE,0.0077,7.97,282.22
256,32,256,4096,False,torch.bfloat16,torch.bfloat16,False,False,asm,7,4,8.4232,_ZN5aiter39bf16gemm_fp32bf16_tn_80x64_splitk_cleanE,0.0112,7.97,282.04
256,32,256,4096,False,torch.bfloat16,torch.bfloat16,False,False,hipblaslt,438818,0,8.5526,,0.0,7.85,277.77
256,32,256,4096,False,torch.bfloat16,torch.bfloat16,False,False,hipblaslt,439683,0,8.6441,,0.0,7.76,274.83
256,32,256,4096,False,torch.bfloat16,torch.bfloat16,False,False,hipblaslt,438936,0,8.6666,,0.0,7.74,274.12
256,32,256,4096,False,torch.bfloat16,torch.bfloat16,False,False,hipblaslt,439082,0,8.7177,,0.0,7.7,272.51
256,32,256,4096,False,torch.bfloat16,torch.bfloat16,False,False,asm,8,6,8.7385,_ZN5aiter39bf16gemm_fp32bf16_tn_96x64_splitk_cleanE,0.0161,7.68,271.86
256,32,256,4096,False,torch.bfloat16,torch.bfloat16,False,False,hipblaslt,438410,0,8.7408,,0.0,7.68,271.79
256,32,256,4096,False,torch.bfloat16,torch.bfloat16,False,False,hipblaslt,439081,0,8.7485,,0.0,7.67,271.55
256,32,256,4096,False,torch.bfloat16,torch.bfloat16,False,False,hipblaslt,438549,0,8.7904,,0.0,7.63,270.26
256,32,256,4096,False,torch.bfloat16,torch.bfloat16,False,False,hipblaslt,438949,0,8.7926,,0.0,7.63,270.19
256,32,256,4096,False,torch.bfloat16,torch.bfloat16,False,False,hipblaslt,439940,0,8.8122,,0.0,7.62,269.59
256,32,256,4096,False,torch.bfloat16,torch.bfloat16,False,False,asm,7,3,8.8227,_ZN5aiter39bf16gemm_fp32bf16_tn_80x64_splitk_cleanE,0.0082,7.61,269.27
256,32,256,4096,False,torch.bfloat16,torch.bfloat16,False,False,hipblaslt,439064,0,8.8571,,0.0,7.58,268.22
256,32,256,4096,False,torch.bfloat16,torch.bfloat16,False,False,asm,8,4,8.8692,_ZN5aiter39bf16gemm_fp32bf16_tn_96x64_splitk_cleanE,0.012,7.57,267.86
256,32,256,4096,False,torch.bfloat16,torch.bfloat16,False,False,hipblaslt,438256,0,8.9534,,0.0,7.5,265.34
256,32,256,4096,False,torch.bfloat16,torch.bfloat16,False,False,hipblaslt,438754,0,9.0225,,0.0,7.44,263.31
256,32,256,4096,False,torch.bfloat16,torch.bfloat16,False,False,asm,8,3,9.1134,_ZN5aiter39bf16gemm_fp32bf16_tn_96x64_splitk_cleanE,0.0087,7.36,260.68
256,32,256,4096,False,torch.bfloat16,torch.bfloat16,False,False,hipblaslt,438328,0,9.1476,,0.0,7.34,259.71
256,32,256,4096,False,torch.bfloat16,torch.bfloat16,False,False,asm,1,3,9.1896,_ZN5aiter39bf16gemm_fp32bf16_tn_32x64_splitk_cleanE,0.0077,7.3,258.52
256,32,256,4096,False,torch.bfloat16,torch.bfloat16,False,False,asm,5,3,9.2936,_ZN5aiter39bf16gemm_fp32bf16_tn_64x64_splitk_cleanE,0.0079,7.22,255.63
256,32,256,4096,False,torch.bfloat16,torch.bfloat16,False,False,hipblaslt,438935,0,9.3853,,0.0,7.15,253.13
256,32,256,4096,False,torch.bfloat16,torch.bfloat16,False,False,hipblaslt,439945,0,9.5632,,0.0,7.02,248.42
256,32,256,4096,False,torch.bfloat16,torch.bfloat16,False,False,hipblaslt,438329,0,10.2008,,0.0,6.58,232.89
256,32,256,4096,False,torch.bfloat16,torch.bfloat16,False,False,asm,3,2,10.436,_ZN5aiter39bf16gemm_fp32bf16_tn_48x64_splitk_cleanE,0.0045,6.43,227.64
256,32,256,4096,False,torch.bfloat16,torch.bfloat16,False,False,asm,5,2,10.9727,_ZN5aiter39bf16gemm_fp32bf16_tn_64x64_splitk_cleanE,0.0045,6.12,216.51
256,32,256,4096,False,torch.bfloat16,torch.bfloat16,False,False,asm,7,2,11.5253,_ZN5aiter39bf16gemm_fp32bf16_tn_80x64_splitk_cleanE,0.0045,5.82,206.13
256,32,256,4096,False,torch.bfloat16,torch.bfloat16,False,False,asm,8,2,11.5992,_ZN5aiter39bf16gemm_fp32bf16_tn_96x64_splitk_cleanE,0.0045,5.79,204.81
256,32,256,4096,False,torch.bfloat16,torch.bfloat16,False,False,asm,1,2,11.614,_ZN5aiter39bf16gemm_fp32bf16_tn_32x64_splitk_cleanE,0.0045,5.78,204.55
256,32,256,4096,False,torch.bfloat16,torch.bfloat16,False,False,asm,4,1,15.8293,_ZN5aiter37bf16gemm_fp32bf16_tn_48x64_pf3_splitkE,0.0,4.24,150.08
256,32,256,4096,False,torch.bfloat16,torch.bfloat16,False,False,asm,6,1,16.4206,_ZN5aiter37bf16gemm_fp32bf16_tn_64x64_pf3_splitkE,0.0,4.09,144.68
256,32,256,4096,False,torch.bfloat16,torch.bfloat16,False,False,asm,2,1,16.9021,_ZN5aiter37bf16gemm_fp32bf16_tn_32x64_pf3_splitkE,0.0,3.97,140.56
256,32,256,4096,False,torch.bfloat16,torch.bfloat16,False,False,asm,9,1,17.7766,_ZN5aiter37bf16gemm_fp32bf16_tn_96x64_pf3_splitkE,0.0,3.78,133.64
256,32,256,4096,False,torch.bfloat16,torch.bfloat16,False,False,asm,10,1,61.5705,_ZN5aiter24bf16gemm_bf16_tn_256x256E,0.0,1.09,38.58
256,64,256,4096,False,torch.bfloat16,torch.bfloat16,False,False,asm,5,9,5.5632,_ZN5aiter39bf16gemm_fp32bf16_tn_64x64_splitk_cleanE,0.0216,24.13,477.1
256,64,256,4096,False,torch.bfloat16,torch.bfloat16,False,False,asm,7,16,5.7869,_ZN5aiter39bf16gemm_fp32bf16_tn_80x64_splitk_cleanE,0.0262,23.19,458.66
256,64,256,4096,False,torch.bfloat16,torch.bfloat16,False,False,asm,5,8,5.8935,_ZN5aiter39bf16gemm_fp32bf16_tn_64x64_splitk_cleanE,0.0194,22.77,450.36
256,64,256,4096,False,torch.bfloat16,torch.bfloat16,False,False,asm,5,16,5.915,_ZN5aiter39bf16gemm_fp32bf16_tn_64x64_splitk_cleanE,0.0292,22.69,448.72
256,64,256,4096,False,torch.bfloat16,torch.bfloat16,False,False,asm,8,9,6.1142,_ZN5aiter39bf16gemm_fp32bf16_tn_96x64_splitk_cleanE,0.0203,21.95,434.11
256,64,256,4096,False,torch.bfloat16,torch.bfloat16,False,False,asm,7,8,6.2403,_ZN5aiter39bf16gemm_fp32bf16_tn_80x64_splitk_cleanE,0.0198,21.51,425.33
256,64,256,4096,False,torch.bfloat16,torch.bfloat16,False,False,asm,5,15,6.2484,_ZN5aiter39bf16gemm_fp32bf16_tn_64x64_splitk_cleanE,0.0276,21.48,424.78
256,64,256,4096,False,torch.bfloat16,torch.bfloat16,False,False,asm,7,10,6.3836,_ZN5aiter39bf16gemm_fp32bf16_tn_80x64_splitk_cleanE,0.0219,21.03,415.79
256,64,256,4096,False,torch.bfloat16,torch.bfloat16,False,False,asm,5,10,6.4251,_ZN5aiter39bf16gemm_fp32bf16_tn_64x64_splitk_cleanE,0.0203,20.89,413.1
256,64,256,4096,False,torch.bfloat16,torch.bfloat16,False,False,asm,7,9,6.4589,_ZN5aiter39bf16gemm_fp32bf16_tn_80x64_splitk_cleanE,0.0194,20.78,410.94
256,64,256,4096,False,torch.bfloat16,torch.bfloat16,False,False,asm,5,12,6.7914,_ZN5aiter39bf16gemm_fp32bf16_tn_64x64_splitk_cleanE,0.0227,19.76,390.82
256,64,256,4096,False,torch.bfloat16,torch.bfloat16,False,False,asm,3,8,6.8607,_ZN5aiter39bf16gemm_fp32bf16_tn_48x64_splitk_cleanE,0.0181,19.56,386.87
256,64,256,4096,False,torch.bfloat16,torch.bfloat16,False,False,asm,8,12,6.9551,_ZN5aiter39bf16gemm_fp32bf16_tn_96x64_splitk_cleanE,0.0225,19.3,381.62
256,64,256,4096,False,torch.bfloat16,torch.bfloat16,False,False,asm,1,8,7.0131,_ZN5aiter39bf16gemm_fp32bf16_tn_32x64_splitk_cleanE,0.0191,19.14,378.46
256,64,256,4096,False,torch.bfloat16,torch.bfloat16,False,False,asm,5,7,7.0651,_ZN5aiter39bf16gemm_fp32bf16_tn_64x64_splitk_cleanE,0.0187,19.0,375.68
256,64,256,4096,False,torch.bfloat16,torch.bfloat16,False,False,asm,7,15,7.1135,_ZN5aiter39bf16gemm_fp32bf16_tn_80x64_splitk_cleanE,0.0278,18.87,373.12
256,64,256,4096,False,torch.bfloat16,torch.bfloat16,False,False,asm,1,9,7.2025,_ZN5aiter39bf16gemm_fp32bf16_tn_32x64_splitk_cleanE,0.0196,18.63,368.51
256,64,256,4096,False,torch.bfloat16,torch.bfloat16,False,False,asm,1,7,7.2907,_ZN5aiter39bf16gemm_fp32bf16_tn_32x64_splitk_cleanE,0.0181,18.41,364.05
256,64,256,4096,False,torch.bfloat16,torch.bfloat16,False,False,asm,8,15,7.3435,_ZN5aiter39bf16gemm_fp32bf16_tn_96x64_splitk_cleanE,0.027,18.28,361.44
256,64,256,4096,False,torch.bfloat16,torch.bfloat16,False,False,asm,8,16,7.3467,_ZN5aiter39bf16gemm_fp32bf16_tn_96x64_splitk_cleanE,0.0294,18.27,361.28
256,64,256,4096,False,torch.bfloat16,torch.bfloat16,False,False,hipblaslt,440197,0,7.626,,0.0,17.6,348.05
256,64,256,4096,False,torch.bfloat16,torch.bfloat16,False,False,asm,8,8,7.7183,_ZN5aiter39bf16gemm_fp32bf16_tn_96x64_splitk_cleanE,0.0193,17.39,343.89
256,64,256,4096,False,torch.bfloat16,torch.bfloat16,False,False,asm,5,11,7.7835,_ZN5aiter39bf16gemm_fp32bf16_tn_64x64_splitk_cleanE,0.0244,17.24,341.0
256,64,256,4096,False,torch.bfloat16,torch.bfloat16,False,False,asm,7,12,7.8175,_ZN5aiter39bf16gemm_fp32bf16_tn_80x64_splitk_cleanE,0.0238,17.17,339.52
256,64,256,4096,False,torch.bfloat16,torch.bfloat16,False,False,hipblaslt,438688,0,7.8866,,0.0,17.02,336.55
256,64,256,4096,False,torch.bfloat16,torch.bfloat16,False,False,asm,1,5,7.8883,_ZN5aiter39bf16gemm_fp32bf16_tn_32x64_splitk_cleanE,0.0136,17.01,336.47
256,64,256,4096,False,torch.bfloat16,torch.bfloat16,False,False,hipblaslt,438936,0,7.8962,,0.0,17.0,336.14
256,64,256,4096,False,torch.bfloat16,torch.bfloat16,False,False,hipblaslt,439688,0,7.8963,,0.0,17.0,336.13
256,64,256,4096,False,torch.bfloat16,torch.bfloat16,False,False,asm,7,11,7.9351,_ZN5aiter39bf16gemm_fp32bf16_tn_80x64_splitk_cleanE,0.0223,16.91,334.49
256,64,256,4096,False,torch.bfloat16,torch.bfloat16,False,False,asm,5,14,7.9603,_ZN5aiter39bf16gemm_fp32bf16_tn_64x64_splitk_cleanE,0.0264,16.86,333.43
256,64,256,4096,False,torch.bfloat16,torch.bfloat16,False,False,asm,8,7,8.0231,_ZN5aiter39bf16gemm_fp32bf16_tn_96x64_splitk_cleanE,0.0171,16.73,330.82
256,64,256,4096,False,torch.bfloat16,torch.bfloat16,False,False,asm,7,7,8.1323,_ZN5aiter39bf16gemm_fp32bf16_tn_80x64_splitk_cleanE,0.0184,16.5,326.38
256,64,256,4096,False,torch.bfloat16,torch.bfloat16,False,False,hipblaslt,439683,0,8.1625,,0.0,16.44,325.17
256,64,256,4096,False,torch.bfloat16,torch.bfloat16,False,False,asm,3,9,8.2327,_ZN5aiter39bf16gemm_fp32bf16_tn_48x64_splitk_cleanE,0.0211,16.3,322.4
256,64,256,4096,False,torch.bfloat16,torch.bfloat16,False,False,asm,3,5,8.2535,_ZN5aiter39bf16gemm_fp32bf16_tn_48x64_splitk_cleanE,0.0137,16.26,321.59
256,64,256,4096,False,torch.bfloat16,torch.bfloat16,False,False,asm,8,10,8.2573,_ZN5aiter39bf16gemm_fp32bf16_tn_96x64_splitk_cleanE,0.0206,16.25,321.44
256,64,256,4096,False,torch.bfloat16,torch.bfloat16,False,False,hipblaslt,438818,0,8.2938,,0.0,16.18,320.02
256,64,256,4096,False,torch.bfloat16,torch.bfloat16,False,False,asm,5,13,8.3239,_ZN5aiter39bf16gemm_fp32bf16_tn_64x64_splitk_cleanE,0.0244,16.12,318.87
256,64,256,4096,False,torch.bfloat16,torch.bfloat16,False,False,asm,1,6,8.3435,_ZN5aiter39bf16gemm_fp32bf16_tn_32x64_splitk_cleanE,0.0168,16.09,318.12
256,64,256,4096,False,torch.bfloat16,torch.bfloat16,False,False,hipblaslt,439940,0,8.4541,,0.0,15.88,313.96
256,64,256,4096,False,torch.bfloat16,torch.bfloat16,False,False,hipblaslt,438410,0,8.4873,,0.0,15.81,312.73
256,64,256,4096,False,torch.bfloat16,torch.bfloat16,False,False,asm,5,6,8.4931,_ZN5aiter39bf16gemm_fp32bf16_tn_64x64_splitk_cleanE,0.0168,15.8,312.51
256,64,256,4096,False,torch.bfloat16,torch.bfloat16,False,False,hipblaslt,438958,0,8.5131,,0.0,15.77,311.78
256,64,256,4096,False,torch.bfloat16,torch.bfloat16,False,False,asm,8,11,8.5271,_ZN5aiter39bf16gemm_fp32bf16_tn_96x64_splitk_cleanE,0.0237,15.74,311.27
256,64,256,4096,False,torch.bfloat16,torch.bfloat16,False,False,hipblaslt,438618,0,8.5669,,0.0,15.67,309.82
256,64,256,4096,False,torch.bfloat16,torch.bfloat16,False,False,asm,7,13,8.7119,_ZN5aiter39bf16gemm_fp32bf16_tn_80x64_splitk_cleanE,0.0255,15.41,304.66
256,64,256,4096,False,torch.bfloat16,torch.bfloat16,False,False,asm,3,7,8.72,_ZN5aiter39bf16gemm_fp32bf16_tn_48x64_splitk_cleanE,0.0165,15.39,304.38
256,64,256,4096,False,torch.bfloat16,torch.bfloat16,False,False,hipblaslt,438935,0,8.73,,0.0,15.37,304.03
256,64,256,4096,False,torch.bfloat16,torch.bfloat16,False,False,hipblaslt,439082,0,8.7358,,0.0,15.36,303.83
256,64,256,4096,False,torch.bfloat16,torch.bfloat16,False,False,asm,3,10,8.7359,_ZN5aiter39bf16gemm_fp32bf16_tn_48x64_splitk_cleanE,0.0202,15.36,303.83
256,64,256,4096,False,torch.bfloat16,torch.bfloat16,False,False,hipblaslt,439063,0,8.7396,,0.0,15.36,303.7
256,64,256,4096,False,torch.bfloat16,torch.bfloat16,False,False,asm,3,6,8.773,_ZN5aiter39bf16gemm_fp32bf16_tn_48x64_splitk_cleanE,0.0169,15.3,302.54
256,64,256,4096,False,torch.bfloat16,torch.bfloat16,False,False,hipblaslt,439080,0,8.7775,,0.0,15.29,302.39
256,64,256,4096,False,torch.bfloat16,torch.bfloat16,False,False,asm,7,14,8.7776,_ZN5aiter39bf16gemm_fp32bf16_tn_80x64_splitk_cleanE,0.0269,15.29,302.38
256,64,256,4096,False,torch.bfloat16,torch.bfloat16,False,False,asm,3,12,8.7894,_ZN5aiter39bf16gemm_fp32bf16_tn_48x64_splitk_cleanE,0.0237,15.27,301.98
256,64,256,4096,False,torch.bfloat16,torch.bfloat16,False,False,asm,1,14,8.7991,_ZN5aiter39bf16gemm_fp32bf16_tn_32x64_splitk_cleanE,0.0258,15.25,301.65
256,64,256,4096,False,torch.bfloat16,torch.bfloat16,False,False,hipblaslt,438549,0,8.831,,0.0,15.2,300.56
256,64,256,4096,False,torch.bfloat16,torch.bfloat16,False,False,hipblaslt,439081,0,8.8603,,0.0,15.15,299.56
256,64,256,4096,False,torch.bfloat16,torch.bfloat16,False,False,asm,8,14,8.8662,_ZN5aiter39bf16gemm_fp32bf16_tn_96x64_splitk_cleanE,0.0259,15.14,299.36
256,64,256,4096,False,torch.bfloat16,torch.bfloat16,False,False,asm,1,10,8.8897,_ZN5aiter39bf16gemm_fp32bf16_tn_32x64_splitk_cleanE,0.0208,15.1,298.57
256,64,256,4096,False,torch.bfloat16,torch.bfloat16,False,False,asm,1,13,8.8999,_ZN5aiter39bf16gemm_fp32bf16_tn_32x64_splitk_cleanE,0.0261,15.08,298.23
256,64,256,4096,False,torch.bfloat16,torch.bfloat16,False,False,asm,7,6,8.9012,_ZN5aiter39bf16gemm_fp32bf16_tn_80x64_splitk_cleanE,0.0162,15.08,298.19
256,64,256,4096,False,torch.bfloat16,torch.bfloat16,False,False,asm,3,16,8.9208,_ZN5aiter39bf16gemm_fp32bf16_tn_48x64_splitk_cleanE,0.0289,15.05,297.53
256,64,256,4096,False,torch.bfloat16,torch.bfloat16,False,False,asm,1,16,8.9238,_ZN5aiter39bf16gemm_fp32bf16_tn_32x64_splitk_cleanE,0.028,15.04,297.43
256,64,256,4096,False,torch.bfloat16,torch.bfloat16,False,False,asm,3,4,8.9502,_ZN5aiter39bf16gemm_fp32bf16_tn_48x64_splitk_cleanE,0.0125,15.0,296.55
256,64,256,4096,False,torch.bfloat16,torch.bfloat16,False,False,hipblaslt,438328,0,8.9575,,0.0,14.98,296.31
256,64,256,4096,False,torch.bfloat16,torch.bfloat16,False,False,asm,3,11,8.9709,_ZN5aiter39bf16gemm_fp32bf16_tn_48x64_splitk_cleanE,0.0229,14.96,295.87
256,64,256,4096,False,torch.bfloat16,torch.bfloat16,False,False,asm,3,14,9.0036,_ZN5aiter39bf16gemm_fp32bf16_tn_48x64_splitk_cleanE,0.0262,14.91,294.79
256,64,256,4096,False,torch.bfloat16,torch.bfloat16,False,False,asm,8,13,9.0675,_ZN5aiter39bf16gemm_fp32bf16_tn_96x64_splitk_cleanE,0.0246,14.8,292.72
256,64,256,4096,False,torch.bfloat16,torch.bfloat16,False,False,asm,1,12,9.0708,_ZN5aiter39bf16gemm_fp32bf16_tn_32x64_splitk_cleanE,0.023,14.8,292.61
256,64,256,4096,False,torch.bfloat16,torch.bfloat16,False,False,asm,5,5,9.0749,_ZN5aiter39bf16gemm_fp32bf16_tn_64x64_splitk_cleanE,0.014,14.79,292.48
256,64,256,4096,False,torch.bfloat16,torch.bfloat16,False,False,asm,8,5,9.1624,_ZN5aiter39bf16gemm_fp32bf16_tn_96x64_splitk_cleanE,0.0145,14.65,289.68
256,64,256,4096,False,torch.bfloat16,torch.bfloat16,False,False,hipblaslt,438754,0,9.1933,,0.0,14.6,288.71
256,64,256,4096,False,torch.bfloat16,torch.bfloat16,False,False,asm,7,4,9.2715,_ZN5aiter39bf16gemm_fp32bf16_tn_80x64_splitk_cleanE,0.0117,14.48,286.28
256,64,256,4096,False,torch.bfloat16,torch.bfloat16,False,False,hipblaslt,438938,0,9.2824,,0.0,14.46,285.94
256,64,256,4096,False,torch.bfloat16,torch.bfloat16,False,False,asm,1,15,9.2859,_ZN5aiter39bf16gemm_fp32bf16_tn_32x64_splitk_cleanE,0.0266,14.45,285.83
256,64,256,4096,False,torch.bfloat16,torch.bfloat16,False,False,asm,7,5,9.294,_ZN5aiter39bf16gemm_fp32bf16_tn_80x64_splitk_cleanE,0.0131,14.44,285.58
256,64,256,4096,False,torch.bfloat16,torch.bfloat16,False,False,asm,5,4,9.3111,_ZN5aiter39bf16gemm_fp32bf16_tn_64x64_splitk_cleanE,0.0119,14.41,285.06
256,64,256,4096,False,torch.bfloat16,torch.bfloat16,False,False,asm,8,6,9.3376,_ZN5aiter39bf16gemm_fp32bf16_tn_96x64_splitk_cleanE,0.0167,14.37,284.25
256,64,256,4096,False,torch.bfloat16,torch.bfloat16,False,False,asm,1,11,9.381,_ZN5aiter39bf16gemm_fp32bf16_tn_32x64_splitk_cleanE,0.0236,14.31,282.93
256,64,256,4096,False,torch.bfloat16,torch.bfloat16,False,False,asm,8,4,9.4043,_ZN5aiter39bf16gemm_fp32bf16_tn_96x64_splitk_cleanE,0.0117,14.27,282.23
256,64,256,4096,False,torch.bfloat16,torch.bfloat16,False,False,asm,3,15,9.4387,_ZN5aiter39bf16gemm_fp32bf16_tn_48x64_splitk_cleanE,0.0259,14.22,281.2
256,64,256,4096,False,torch.bfloat16,torch.bfloat16,False,False,asm,3,3,9.4495,_ZN5aiter39bf16gemm_fp32bf16_tn_48x64_splitk_cleanE,0.0081,14.2,280.88
256,64,256,4096,False,torch.bfloat16,torch.bfloat16,False,False,asm,5,3,9.4583,_ZN5aiter39bf16gemm_fp32bf16_tn_64x64_splitk_cleanE,0.0084,14.19,280.62
256,64,256,4096,False,torch.bfloat16,torch.bfloat16,False,False,asm,3,13,9.6066,_ZN5aiter39bf16gemm_fp32bf16_tn_48x64_splitk_cleanE,0.0266,13.97,276.29
256,64,256,4096,False,torch.bfloat16,torch.bfloat16,False,False,hipblaslt,439945,0,9.7241,,0.0,13.8,272.95
256,64,256,4096,False,torch.bfloat16,torch.bfloat16,False,False,asm,1,4,9.7371,_ZN5aiter39bf16gemm_fp32bf16_tn_32x64_splitk_cleanE,0.0124,13.78,272.59
256,64,256,4096,False,torch.bfloat16,torch.bfloat16,False,False,asm,1,3,10.3535,_ZN5aiter39bf16gemm_fp32bf16_tn_32x64_splitk_cleanE,0.0077,12.96,256.36
256,64,256,4096,False,torch.bfloat16,torch.bfloat16,False,False,asm,7,3,10.3875,_ZN5aiter39bf16gemm_fp32bf16_tn_80x64_splitk_cleanE,0.008,12.92,255.52
256,64,256,4096,False,torch.bfloat16,torch.bfloat16,False,False,asm,8,3,11.0584,_ZN5aiter39bf16gemm_fp32bf16_tn_96x64_splitk_cleanE,0.008,12.14,240.02
256,64,256,4096,False,torch.bfloat16,torch.bfloat16,False,False,asm,8,2,13.152,_ZN5aiter39bf16gemm_fp32bf16_tn_96x64_splitk_cleanE,0.0048,10.21,201.81
256,64,256,4096,False,torch.bfloat16,torch.bfloat16,False,False,asm,1,2,13.3633,_ZN5aiter39bf16gemm_fp32bf16_tn_32x64_splitk_cleanE,0.0048,10.04,198.62
256,64,256,4096,False,torch.bfloat16,torch.bfloat16,False,False,asm,3,2,13.6105,_ZN5aiter39bf16gemm_fp32bf16_tn_48x64_splitk_cleanE,0.0048,9.86,195.01
256,64,256,4096,False,torch.bfloat16,torch.bfloat16,False,False,asm,5,2,13.8344,_ZN5aiter39bf16gemm_fp32bf16_tn_64x64_splitk_cleanE,0.0048,9.7,191.86
256,64,256,4096,False,torch.bfloat16,torch.bfloat16,False,False,asm,7,2,14.2224,_ZN5aiter39bf16gemm_fp32bf16_tn_80x64_splitk_cleanE,0.0048,9.44,186.62
256,64,256,4096,False,torch.bfloat16,torch.bfloat16,False,False,asm,2,1,19.3441,_ZN5aiter37bf16gemm_fp32bf16_tn_32x64_pf3_splitkE,0.0,6.94,137.21
256,64,256,4096,False,torch.bfloat16,torch.bfloat16,False,False,asm,6,1,19.8709,_ZN5aiter37bf16gemm_fp32bf16_tn_64x64_pf3_splitkE,0.0,6.75,133.57
256,64,256,4096,False,torch.bfloat16,torch.bfloat16,False,False,asm,9,1,20.2189,_ZN5aiter37bf16gemm_fp32bf16_tn_96x64_pf3_splitkE,0.0,6.64,131.27
256,64,256,4096,False,torch.bfloat16,torch.bfloat16,False,False,asm,4,1,20.3817,_ZN5aiter37bf16gemm_fp32bf16_tn_48x64_pf3_splitkE,0.0,6.59,130.23
256,64,256,4096,False,torch.bfloat16,torch.bfloat16,False,False,asm,10,1,64.7591,_ZN5aiter24bf16gemm_bf16_tn_256x256E,0.0,2.07,40.99
256,128,256,4096,False,torch.bfloat16,torch.bfloat16,False,False,hipblaslt,440197,0,7.6504,,0.0,35.09,419.75
256,128,256,4096,False,torch.bfloat16,torch.bfloat16,False,False,hipblaslt,439308,0,8.2054,,0.0,32.71,391.36
256,128,256,4096,False,torch.bfloat16,torch.bfloat16,False,False,hipblaslt,439683,0,8.3697,,0.0,32.07,383.68
256,128,256,4096,False,torch.bfloat16,torch.bfloat16,False,False,hipblaslt,438935,0,8.4833,,0.0,31.64,378.54
256,128,256,4096,False,torch.bfloat16,torch.bfloat16,False,False,asm,7,8,8.4869,_ZN5aiter39bf16gemm_fp32bf16_tn_80x64_splitk_cleanE,0.0186,31.63,378.38
256,128,256,4096,False,torch.bfloat16,torch.bfloat16,False,False,asm,7,7,8.4926,_ZN5aiter39bf16gemm_fp32bf16_tn_80x64_splitk_cleanE,0.017,31.61,378.12
256,128,256,4096,False,torch.bfloat16,torch.bfloat16,False,False,asm,5,8,8.6283,_ZN5aiter39bf16gemm_fp32bf16_tn_64x64_splitk_cleanE,0.0186,31.11,372.18
256,128,256,4096,False,torch.bfloat16,torch.bfloat16,False,False,asm,8,8,8.6596,_ZN5aiter39bf16gemm_fp32bf16_tn_96x64_splitk_cleanE,0.0195,31.0,370.83
256,128,256,4096,False,torch.bfloat16,torch.bfloat16,False,False,hipblaslt,438818,0,8.6608,,0.0,30.99,370.78
256,128,256,4096,False,torch.bfloat16,torch.bfloat16,False,False,asm,5,12,8.6866,_ZN5aiter39bf16gemm_fp32bf16_tn_64x64_splitk_cleanE,0.0234,30.9,369.68
256,128,256,4096,False,torch.bfloat16,torch.bfloat16,False,False,asm,5,7,8.6949,_ZN5aiter39bf16gemm_fp32bf16_tn_64x64_splitk_cleanE,0.0162,30.87,369.33
256,128,256,4096,False,torch.bfloat16,torch.bfloat16,False,False,hipblaslt,439940,0,8.7058,,0.0,30.83,368.86
256,128,256,4096,False,torch.bfloat16,torch.bfloat16,False,False,hipblaslt,438606,0,8.7518,,0.0,30.67,366.93
256,128,256,4096,False,torch.bfloat16,torch.bfloat16,False,False,asm,8,9,8.7762,_ZN5aiter39bf16gemm_fp32bf16_tn_96x64_splitk_cleanE,0.0211,30.59,365.91
256,128,256,4096,False,torch.bfloat16,torch.bfloat16,False,False,asm,7,9,8.7987,_ZN5aiter39bf16gemm_fp32bf16_tn_80x64_splitk_cleanE,0.0206,30.51,364.97
256,128,256,4096,False,torch.bfloat16,torch.bfloat16,False,False,hipblaslt,438410,0,8.8473,,0.0,30.34,362.97
256,128,256,4096,False,torch.bfloat16,torch.bfloat16,False,False,asm,8,7,8.9358,_ZN5aiter39bf16gemm_fp32bf16_tn_96x64_splitk_cleanE,0.0174,30.04,359.37
256,128,256,4096,False,torch.bfloat16,torch.bfloat16,False,False,asm,7,6,8.9473,_ZN5aiter39bf16gemm_fp32bf16_tn_80x64_splitk_cleanE,0.0155,30.0,358.91
256,128,256,4096,False,torch.bfloat16,torch.bfloat16,False,False,asm,5,11,9.01,_ZN5aiter39bf16gemm_fp32bf16_tn_64x64_splitk_cleanE,0.0222,29.79,356.41
256,128,256,4096,False,torch.bfloat16,torch.bfloat16,False,False,asm,7,10,9.0587,_ZN5aiter39bf16gemm_fp32bf16_tn_80x64_splitk_cleanE,0.0208,29.63,354.5
256,128,256,4096,False,torch.bfloat16,torch.bfloat16,False,False,asm,8,10,9.0741,_ZN5aiter39bf16gemm_fp32bf16_tn_96x64_splitk_cleanE,0.0194,29.58,353.89
256,128,256,4096,False,torch.bfloat16,torch.bfloat16,False,False,asm,5,6,9.0844,_ZN5aiter39bf16gemm_fp32bf16_tn_64x64_splitk_cleanE,0.0162,29.55,353.49
256,128,256,4096,False,torch.bfloat16,torch.bfloat16,False,False,asm,5,5,9.103,_ZN5aiter39bf16gemm_fp32bf16_tn_64x64_splitk_cleanE,0.0134,29.49,352.77
256,128,256,4096,False,torch.bfloat16,torch.bfloat16,False,False,asm,7,11,9.1035,_ZN5aiter39bf16gemm_fp32bf16_tn_80x64_splitk_cleanE,0.023,29.49,352.75
256,128,256,4096,False,torch.bfloat16,torch.bfloat16,False,False,asm,5,13,9.1473,_ZN5aiter39bf16gemm_fp32bf16_tn_64x64_splitk_cleanE,0.0252,29.35,351.06
256,128,256,4096,False,torch.bfloat16,torch.bfloat16,False,False,asm,5,10,9.1587,_ZN5aiter39bf16gemm_fp32bf16_tn_64x64_splitk_cleanE,0.0204,29.31,350.62
256,128,256,4096,False,torch.bfloat16,torch.bfloat16,False,False,asm,5,14,9.1616,_ZN5aiter39bf16gemm_fp32bf16_tn_64x64_splitk_cleanE,0.0259,29.3,350.51
256,128,256,4096,False,torch.bfloat16,torch.bfloat16,False,False,asm,3,7,9.1723,_ZN5aiter39bf16gemm_fp32bf16_tn_48x64_splitk_cleanE,0.0164,29.27,350.1
256,128,256,4096,False,torch.bfloat16,torch.bfloat16,False,False,asm,5,15,9.1738,_ZN5aiter39bf16gemm_fp32bf16_tn_64x64_splitk_cleanE,0.0265,29.26,350.05
256,128,256,4096,False,torch.bfloat16,torch.bfloat16,False,False,asm,7,12,9.1798,_ZN5aiter39bf16gemm_fp32bf16_tn_80x64_splitk_cleanE,0.024,29.24,349.82
256,128,256,4096,False,torch.bfloat16,torch.bfloat16,False,False,hipblaslt,438937,0,9.1913,,0.0,29.21,349.38
256,128,256,4096,False,torch.bfloat16,torch.bfloat16,False,False,asm,5,9,9.2286,_ZN5aiter39bf16gemm_fp32bf16_tn_64x64_splitk_cleanE,0.0196,29.09,347.97
256,128,256,4096,False,torch.bfloat16,torch.bfloat16,False,False,hipblaslt,438329,0,9.253,,0.0,29.01,347.05
