aiter/configs/tuned_fmoe.csv
cu_num,token,model_dim,inter_dim,expert,topk,act_type,dtype,q_dtype_a,q_dtype_w,q_type,use_g1u1,doweight_stage1,block_m,ksplit,us1,kernelName1,err1,us2,kernelName2,err2,total_us,run_1stage
80,512,6144,4096,8,2,ActivationType.Silu,torch.bfloat16,torch.bfloat16,torch.bfloat16,QuantType.No,1,0,64,0,760.6357,moe_ck2stages_gemm1_256x64x64x64_1x4_TypeCast_v1_Nswizzle0_no_MulRoutedWeight0_silu,0.0%,426.7219,moe_ck2stages_gemm2_256x64x128x128_1x4_TypeCastExpertWeight_v3_Nswizzle0_no_MulRoutedWeight1,2.4%,1187.3576,nan
80,512,6144,4096,8,2,ActivationType.Silu,torch.bfloat16,torch.float8_e4m3fnuz,torch.float8_e4m3fnuz,QuantType.per_Token,1,0,64,0,377.0059,_ZN5aiter48fmoe_stage1_bf16_pertokenFp8_g1u1_64x128_2tg_pf3E,0.0%,269.2044,moe_ck2stages_gemm2_256x64x128x256_1x4_MulABScaleExpertWeight_v3_Nswizzle0_per_token_MulRoutedWeight1,2.4%,646.2103,nan
80,512,6144,4096,8,2,ActivationType.Silu,torch.bfloat16,torch.int8,torch.int8,QuantType.per_Tensor,1,0,64,0,346.5174,_ZN5aiter45fmoe_stage1_bf16_pertokenInt8_g1u1_64x256_pf3E,0.0%,225.6346,moe_ck2stages_gemm2_256x64x128x128_1x4_MulABScaleExpertWeight_v3_Nswizzle0_per_tensor_MulRoutedWeight1,2.1%,572.152,nan
80,4,2304,1536,8,2,ActivationType.Gelu,torch.bfloat16,torch.float8_e4m3fnuz,torch.float8_e4m3fnuz,QuantType.per_Token,1,0,32,0,18.8987,_ZN5aiter47fmoe_stage1_bf16_pertokenFp8_g1u1_32x64_4tg_pf3E,0.0%,16.9605,moe_ck2stages_gemm2_256x32x64x256_1x4_MulABScaleExpertWeight_v1_Nswizzle0_per_token_MulRoutedWeight1,0.2%,35.8592,nan
80,4,2304,1536,8,2,ActivationType.Gelu,torch.bfloat16,torch.float8_e4m3fnuz,torch.float8_e4m3fnuz,QuantType.per_Token,1,1,32,0,20.0471,_ZN5aiter56fmoe_stage1_bf16_pertokenFp8_doweight_g1u1_32x64_4tg_pf3E,0.0%,16.1797,moe_ck2stages_gemm2_256x32x64x256_1x4_MulABScaleExpertWeight_v1_Nswizzle0_per_token_MulRoutedWeight0,0.0%,36.2268,nan
80,56,6144,4096,8,2,ActivationType.Silu,torch.bfloat16,torch.float8_e4m3fnuz,torch.float8_e4m3fnuz,QuantType.per_1x128,1,0,64,0,389.6922,moe_ck2stages_gemm1_256x64x128x128_1x4_MulABScaleExpertWeightA8W8blkscale_v3_Nswizzle0_per_1x128_MulRoutedWeight0_silu,0.0%,128.0998,moe_ck2stages_gemm2_256x64x128x128_1x4_MulABScaleExpertWeightA8W8blkscale_v3_Nswizzle0_per_1x128_MulRoutedWeight1,2.1%,517.792,nan
80,16,7168,512,256,8,ActivationType.Silu,torch.bfloat16,torch.bfloat16,torch.bfloat16,QuantType.No,1,0,32,0,457.1267,moe_ck2stages_gemm1_256x32x64x128_1x4_TypeCast_v1_Nswizzle0_no_MulRoutedWeight0_silu,0.0%,250.9869,moe_ck2stages_gemm2_256x32x64x64_1x4_TypeCastExpertWeight_v1_Nswizzle0_no_MulRoutedWeight1,2.8%,708.1136,nan
80,32,7168,512,256,8,ActivationType.Silu,torch.bfloat16,torch.bfloat16,torch.bfloat16,QuantType.No,1,0,32,0,842.6371,moe_ck2stages_gemm1_256x32x64x128_1x4_TypeCast_v1_Nswizzle0_no_MulRoutedWeight0_silu,0.0%,448.4958,moe_ck2stages_gemm2_256x32x64x64_1x4_TypeCastExpertWeight_v1_Nswizzle0_no_MulRoutedWeight1,2.9%,1291.1329,nan
80,64,7168,512,256,8,ActivationType.Silu,torch.bfloat16,torch.bfloat16,torch.bfloat16,QuantType.No,1,0,32,0,1055.0625,moe_ck2stages_gemm1_256x32x64x128_1x4_TypeCast_v1_Nswizzle0_no_MulRoutedWeight0_silu,0.0%,579.0959,moe_ck2stages_gemm2_256x32x64x64_1x4_TypeCastExpertWeight_v1_Nswizzle0_no_MulRoutedWeight1,2.7%,1634.1584,nan
80,128,7168,512,256,8,ActivationType.Silu,torch.bfloat16,torch.bfloat16,torch.bfloat16,QuantType.No,1,0,32,0,1162.6608,moe_ck2stages_gemm1_256x32x64x128_1x4_TypeCast_v1_Nswizzle0_no_MulRoutedWeight0_silu,0.0%,637.3112,moe_ck2stages_gemm2_256x32x64x64_1x4_TypeCastExpertWeight_v1_Nswizzle0_no_MulRoutedWeight1,2.9%,1799.9720000000002,nan
80,256,7168,512,256,8,ActivationType.Silu,torch.bfloat16,torch.bfloat16,torch.bfloat16,QuantType.No,1,0,32,0,1206.2989,moe_ck2stages_gemm1_256x32x64x128_1x4_TypeCast_v1_Nswizzle0_no_MulRoutedWeight0_silu,0.0%,677.1182,moe_ck2stages_gemm2_256x32x64x64_1x4_TypeCastExpertWeight_v1_Nswizzle0_no_MulRoutedWeight1,2.9%,1883.4171,nan
80,512,7168,512,256,8,ActivationType.Silu,torch.bfloat16,torch.bfloat16,torch.bfloat16,QuantType.No,1,0,32,0,1228.5943,moe_ck2stages_gemm1_256x32x64x128_1x4_TypeCast_v1_Nswizzle0_no_MulRoutedWeight0_silu,0.0%,742.1092,moe_ck2stages_gemm2_256x32x64x64_1x4_TypeCastExpertWeight_v1_Nswizzle0_no_MulRoutedWeight1,2.8%,1970.7035,nan
80,1024,7168,512,256,8,ActivationType.Silu,torch.bfloat16,torch.bfloat16,torch.bfloat16,QuantType.No,1,0,32,0,1549.4835,moe_ck2stages_gemm1_256x32x64x128_1x4_TypeCast_v1_Nswizzle0_no_MulRoutedWeight0_silu,0.0%,1048.5477,moe_ck2stages_gemm2_256x32x64x64_1x4_TypeCastExpertWeight_v1_Nswizzle0_no_MulRoutedWeight1,2.8%,2598.0312000000004,nan
80,16,7168,512,256,8,ActivationType.Silu,torch.bfloat16,torch.bfloat16,torch.bfloat16,QuantType.No,1,1,32,0,459.2154,moe_ck2stages_gemm1_256x32x64x128_1x4_TypeCastExpertWeight_v1_Nswizzle0_no_MulRoutedWeight1_silu,0.0%,250.0338,moe_ck2stages_gemm2_256x32x64x64_1x4_TypeCast_v1_Nswizzle0_no_MulRoutedWeight0,0.0%,709.2492,nan
80,32,7168,512,256,8,ActivationType.Silu,torch.bfloat16,torch.bfloat16,torch.bfloat16,QuantType.No,1,1,32,0,724.5065,moe_ck2stages_gemm1_256x32x64x128_1x4_TypeCastExpertWeight_v1_Nswizzle0_no_MulRoutedWeight1_silu,0.0%,381.0979,moe_ck2stages_gemm2_256x32x64x64_1x4_TypeCast_v1_Nswizzle0_no_MulRoutedWeight0,0.0%,1105.6044,nan
80,64,7168,512,256,8,ActivationType.Silu,torch.bfloat16,torch.bfloat16,torch.bfloat16,QuantType.No,1,1,32,0,1041.8478,moe_ck2stages_gemm1_256x32x64x128_1x4_TypeCastExpertWeight_v1_Nswizzle0_no_MulRoutedWeight1_silu,0.0%,553.4974,moe_ck2stages_gemm2_256x32x64x64_1x4_TypeCast_v1_Nswizzle0_no_MulRoutedWeight0,0.0%,1595.3452,nan
80,128,7168,512,256,8,ActivationType.Silu,torch.bfloat16,torch.bfloat16,torch.bfloat16,QuantType.No,1,1,32,0,1155.7542,moe_ck2stages_gemm1_256x32x64x128_1x4_TypeCastExpertWeight_v1_Nswizzle0_no_MulRoutedWeight1_silu,0.0%,621.3659,moe_ck2stages_gemm2_256x32x64x64_1x4_TypeCast_v1_Nswizzle0_no_MulRoutedWeight0,0.0%,1777.1201,nan
80,256,7168,512,256,8,ActivationType.Silu,torch.bfloat16,torch.bfloat16,torch.bfloat16,QuantType.No,1,1,32,0,1229.6976,moe_ck2stages_gemm1_256x32x64x128_1x4_TypeCastExpertWeight_v1_Nswizzle0_no_MulRoutedWeight1_silu,0.0%,673.3784,moe_ck2stages_gemm2_256x32x64x64_1x4_TypeCast_v1_Nswizzle0_no_MulRoutedWeight0,0.0%,1903.076,nan
80,512,7168,512,256,8,ActivationType.Silu,torch.bfloat16,torch.bfloat16,torch.bfloat16,QuantType.No,1,1,32,0,1286.5572,moe_ck2stages_gemm1_256x32x64x128_1x4_TypeCastExpertWeight_v1_Nswizzle0_no_MulRoutedWeight1_silu,0.0%,730.78,moe_ck2stages_gemm2_256x32x64x64_1x4_TypeCast_v1_Nswizzle0_no_MulRoutedWeight0,0.0%,2017.3372,nan
80,1024,7168,512,256,8,ActivationType.Silu,torch.bfloat16,torch.bfloat16,torch.bfloat16,QuantType.No,1,1,32,0,1564.6015,moe_ck2stages_gemm1_256x32x64x128_1x4_TypeCastExpertWeight_v1_Nswizzle0_no_MulRoutedWeight1_silu,0.0%,1019.8327,moe_ck2stages_gemm2_256x32x64x128_1x4_TypeCast_v1_Nswizzle0_no_MulRoutedWeight0,0.0%,2584.4342,nan
80,16,7168,256,256,8,ActivationType.Silu,torch.bfloat16,torch.bfloat16,torch.bfloat16,QuantType.No,1,0,32,0,223.111,moe_ck2stages_gemm1_256x32x64x64_1x4_TypeCast_v1_Nswizzle0_no_MulRoutedWeight0_silu,0.0%,153.9122,moe_ck2stages_gemm2_256x32x64x64_1x4_TypeCastExpertWeight_v1_Nswizzle0_no_MulRoutedWeight1,1.4%,377.0232,nan
80,32,7168,256,256,8,ActivationType.Silu,torch.bfloat16,torch.bfloat16,torch.bfloat16,QuantType.No,1,0,32,0,371.1757,moe_ck2stages_gemm1_256x32x64x128_1x4_TypeCast_v1_Nswizzle0_no_MulRoutedWeight0_silu,0.0%,240.2681,moe_ck2stages_gemm2_256x32x64x64_1x4_TypeCastExpertWeight_v1_Nswizzle0_no_MulRoutedWeight1,1.4%,611.4438,nan
80,64,7168,256,256,8,ActivationType.Silu,torch.bfloat16,torch.bfloat16,torch.bfloat16,QuantType.No,1,0,32,0,512.3994,moe_ck2stages_gemm1_256x32x64x128_1x4_TypeCast_v1_Nswizzle0_no_MulRoutedWeight0_silu,0.0%,334.0284,moe_ck2stages_gemm2_256x32x64x64_1x4_TypeCastExpertWeight_v1_Nswizzle0_no_MulRoutedWeight1,1.3%,846.4277999999999,nan
80,128,7168,256,256,8,ActivationType.Silu,torch.bfloat16,torch.bfloat16,torch.bfloat16,QuantType.No,1,0,32,0,592.3627,moe_ck2stages_gemm1_256x32x64x128_1x4_TypeCast_v1_Nswizzle0_no_MulRoutedWeight0_silu,0.0%,374.2339,moe_ck2stages_gemm2_256x32x64x64_1x4_TypeCastExpertWeight_v1_Nswizzle0_no_MulRoutedWeight1,1.3%,966.5966,nan
80,256,7168,256,256,8,ActivationType.Silu,torch.bfloat16,torch.bfloat16,torch.bfloat16,QuantType.No,1,0,32,0,614.7264,moe_ck2stages_gemm1_256x32x64x128_1x4_TypeCast_v1_Nswizzle0_no_MulRoutedWeight0_silu,0.0%,399.7879,moe_ck2stages_gemm2_256x32x64x64_1x4_TypeCastExpertWeight_v1_Nswizzle0_no_MulRoutedWeight1,1.3%,1014.5143,nan
80,512,7168,256,256,8,ActivationType.Silu,torch.bfloat16,torch.bfloat16,torch.bfloat16,QuantType.No,1,0,32,0,626.7139,moe_ck2stages_gemm1_256x32x64x128_1x4_TypeCast_v1_Nswizzle0_no_MulRoutedWeight0_silu,0.0%,431.0309,moe_ck2stages_gemm2_256x32x64x64_1x4_TypeCastExpertWeight_v1_Nswizzle0_no_MulRoutedWeight1,1.3%,1057.7448,nan
80,1024,7168,256,256,8,ActivationType.Silu,torch.bfloat16,torch.bfloat16,torch.bfloat16,QuantType.No,1,0,32,0,797.1001,moe_ck2stages_gemm1_256x32x64x128_1x4_TypeCast_v1_Nswizzle0_no_MulRoutedWeight0_silu,0.0%,606.5011,moe_ck2stages_gemm2_256x32x64x64_1x4_TypeCastExpertWeight_v1_Nswizzle0_no_MulRoutedWeight1,1.3%,1403.6012,nan
80,16,7168,256,256,8,ActivationType.Silu,torch.bfloat16,torch.bfloat16,torch.bfloat16,QuantType.No,1,1,32,0,210.9945,moe_ck2stages_gemm1_256x32x64x128_1x4_TypeCastExpertWeight_v1_Nswizzle0_no_MulRoutedWeight1_silu,0.0%,137.5169,moe_ck2stages_gemm2_256x32x64x64_1x4_TypeCast_v1_Nswizzle0_no_MulRoutedWeight0,0.0%,348.5114,nan
80,32,7168,256,256,8,ActivationType.Silu,torch.bfloat16,torch.bfloat16,torch.bfloat16,QuantType.No,1,1,32,0,343.5771,moe_ck2stages_gemm1_256x32x64x64_1x4_TypeCastExpertWeight_v1_Nswizzle0_no_MulRoutedWeight1_silu,0.0%,220.1879,moe_ck2stages_gemm2_256x32x64x64_1x4_TypeCast_v1_Nswizzle0_no_MulRoutedWeight0,0.0%,563.765,nan
80,64,7168,256,256,8,ActivationType.Silu,torch.bfloat16,torch.bfloat16,torch.bfloat16,QuantType.No,1,1,32,0,503.8883,moe_ck2stages_gemm1_256x32x64x128_1x4_TypeCastExpertWeight_v1_Nswizzle0_no_MulRoutedWeight1_silu,0.0%,303.7076,moe_ck2stages_gemm2_256x32x64x64_1x4_TypeCast_v1_Nswizzle0_no_MulRoutedWeight0,0.0%,807.5959,nan
80,128,7168,256,256,8,ActivationType.Silu,torch.bfloat16,torch.bfloat16,torch.bfloat16,QuantType.No,1,1,32,0,594.2539,moe_ck2stages_gemm1_256x32x64x128_1x4_TypeCastExpertWeight_v1_Nswizzle0_no_MulRoutedWeight1_silu,0.0%,358.5454,moe_ck2stages_gemm2_256x32x64x64_1x4_TypeCast_v1_Nswizzle0_no_MulRoutedWeight0,0.0%,952.7993,nan
80,256,7168,256,256,8,ActivationType.Silu,torch.bfloat16,torch.bfloat16,torch.bfloat16,QuantType.No,1,1,32,0,606.0154,moe_ck2stages_gemm1_256x32x64x128_1x4_TypeCastExpertWeight_v1_Nswizzle0_no_MulRoutedWeight1_silu,0.0%,378.8467,moe_ck2stages_gemm2_256x32x64x64_1x4_TypeCast_v1_Nswizzle0_no_MulRoutedWeight0,0.0%,984.8621,nan
80,512,7168,256,256,8,ActivationType.Silu,torch.bfloat16,torch.bfloat16,torch.bfloat16,QuantType.No,1,1,32,0,638.8216,moe_ck2stages_gemm1_256x32x64x128_1x4_TypeCastExpertWeight_v1_Nswizzle0_no_MulRoutedWeight1_silu,0.0%,412.018,moe_ck2stages_gemm2_256x32x64x64_1x4_TypeCast_v1_Nswizzle0_no_MulRoutedWeight0,0.0%,1050.8396,nan
80,1024,7168,256,256,8,ActivationType.Silu,torch.bfloat16,torch.bfloat16,torch.bfloat16,QuantType.No,1,1,32,0,790.6629,moe_ck2stages_gemm1_256x32x64x128_1x4_TypeCastExpertWeight_v1_Nswizzle0_no_MulRoutedWeight1_silu,0.0%,570.6619,moe_ck2stages_gemm2_256x32x64x64_1x4_TypeCast_v1_Nswizzle0_no_MulRoutedWeight0,0.0%,1361.3248,nan
80,16,7168,512,256,8,ActivationType.Silu,torch.bfloat16,torch.float8_e4m3fnuz,torch.float8_e4m3fnuz,QuantType.per_Tensor,1,0,32,0,236.0887,moe_ck2stages_gemm1_256x32x64x128_1x4_MulABScale_v1_Nswizzle0_per_tensor_MulRoutedWeight0_silu,0.0%,164.984,moe_ck2stages_gemm2_256x32x64x128_1x4_MulABScaleExpertWeight_v1_Nswizzle0_per_tensor_MulRoutedWeight1,2.9%,401.0727,nan
80,32,7168,512,256,8,ActivationType.Silu,torch.bfloat16,torch.float8_e4m3fnuz,torch.float8_e4m3fnuz,QuantType.per_Tensor,1,0,32,0,386.8106,_ZN5aiter48fmoe_stage1_bf16_pertokenFp8_g1u1_32x128_3tg_pf2E,0.0%,251.5004,moe_ck2stages_gemm2_256x32x64x128_1x4_MulABScaleExpertWeight_v1_Nswizzle0_per_tensor_MulRoutedWeight1,2.8%,638.311,nan
80,64,7168,512,256,8,ActivationType.Silu,torch.bfloat16,torch.float8_e4m3fnuz,torch.float8_e4m3fnuz,QuantType.per_Tensor,1,0,32,0,517.5269,_ZN5aiter48fmoe_stage1_bf16_pertokenFp8_g1u1_32x256_2tg_pf2E,0.0%,331.7605,moe_ck2stages_gemm2_256x32x64x128_1x4_MulABScaleExpertWeight_v1_Nswizzle0_per_tensor_MulRoutedWeight1,2.8%,849.2873999999999,nan
80,128,7168,512,256,8,ActivationType.Silu,torch.bfloat16,torch.float8_e4m3fnuz,torch.float8_e4m3fnuz,QuantType.per_Tensor,1,0,32,0,609.8662,moe_ck2stages_gemm1_256x32x64x256_1x4_MulABScale_v1_Nswizzle0_per_tensor_MulRoutedWeight0_silu,0.0%,383.4415,moe_ck2stages_gemm2_256x32x64x128_1x4_MulABScaleExpertWeight_v1_Nswizzle0_per_tensor_MulRoutedWeight1,2.8%,993.3077,nan
80,256,7168,512,256,8,ActivationType.Silu,torch.bfloat16,torch.float8_e4m3fnuz,torch.float8_e4m3fnuz,QuantType.per_Tensor,1,0,32,0,615.9277,_ZN5aiter48fmoe_stage1_bf16_pertokenFp8_g1u1_32x128_3tg_pf3E,0.1%,394.287,moe_ck2stages_gemm2_256x32x64x128_1x4_MulABScaleExpertWeight_v1_Nswizzle0_per_tensor_MulRoutedWeight1,2.8%,1010.2147,nan
80,512,7168,512,256,8,ActivationType.Silu,torch.bfloat16,torch.float8_e4m3fnuz,torch.float8_e4m3fnuz,QuantType.per_Tensor,1,0,32,0,623.2077,moe_ck2stages_gemm1_256x32x64x256_1x4_MulABScale_v1_Nswizzle0_per_tensor_MulRoutedWeight0_silu,0.0%,438.4601,moe_ck2stages_gemm2_256x32x64x128_1x4_MulABScaleExpertWeight_v1_Nswizzle0_per_tensor_MulRoutedWeight1,2.8%,1061.6678000000002,nan
80,1024,7168,512,256,8,ActivationType.Silu,torch.bfloat16,torch.float8_e4m3fnuz,torch.float8_e4m3fnuz,QuantType.per_Tensor,1,0,32,0,791.8041,_ZN5aiter44fmoe_stage1_bf16_pertokenFp8_g1u1_32x512_pf3E,0.0%,614.9508,moe_ck2stages_gemm2_256x32x64x128_1x4_MulABScaleExpertWeight_v1_Nswizzle0_per_tensor_MulRoutedWeight1,2.8%,1406.7549,nan
80,16,7168,512,256,8,ActivationType.Silu,torch.bfloat16,torch.float8_e4m3fnuz,torch.float8_e4m3fnuz,QuantType.per_Tensor,1,1,32,0,237.0499,moe_ck2stages_gemm1_256x32x64x256_1x4_MulABScale_v1_Nswizzle0_per_tensor_MulRoutedWeight1_silu,0.0%,154.8038,moe_ck2stages_gemm2_256x32x64x128_1x4_MulABScaleExpertWeight_v1_Nswizzle0_per_tensor_MulRoutedWeight0,0.0%,391.8537,nan
80,32,7168,512,256,8,ActivationType.Silu,torch.bfloat16,torch.float8_e4m3fnuz,torch.float8_e4m3fnuz,QuantType.per_Tensor,1,1,32,0,380.5869,_ZN5aiter57fmoe_stage1_bf16_pertokenFp8_doweight_g1u1_32x128_3tg_pf3E,0.0%,237.0931,moe_ck2stages_gemm2_256x32x64x128_1x4_MulABScaleExpertWeight_v1_Nswizzle0_per_tensor_MulRoutedWeight0,0.0%,617.6800000000001,nan
80,64,7168,512,256,8,ActivationType.Silu,torch.bfloat16,torch.float8_e4m3fnuz,torch.float8_e4m3fnuz,QuantType.per_Tensor,1,1,32,0,522.5679,moe_ck2stages_gemm1_256x32x64x256_1x4_MulABScale_v1_Nswizzle0_per_tensor_MulRoutedWeight1_silu,0.0%,326.5505,moe_ck2stages_gemm2_256x32x64x128_1x4_MulABScaleExpertWeight_v1_Nswizzle0_per_tensor_MulRoutedWeight0,0.0%,849.1184000000001,nan
80,128,7168,512,256,8,ActivationType.Silu,torch.bfloat16,torch.float8_e4m3fnuz,torch.float8_e4m3fnuz,QuantType.per_Tensor,1,1,32,0,600.4039,moe_ck2stages_gemm1_256x32x64x256_1x4_MulABScale_v1_Nswizzle0_per_tensor_MulRoutedWeight1_silu,0.0%,376.3787,moe_ck2stages_gemm2_256x32x64x128_1x4_MulABScaleExpertWeight_v1_Nswizzle0_per_tensor_MulRoutedWeight0,0.0%,976.7826,nan
80,256,7168,512,256,8,ActivationType.Silu,torch.bfloat16,torch.float8_e4m3fnuz,torch.float8_e4m3fnuz,QuantType.per_Tensor,1,1,32,0,614.8241,_ZN5aiter57fmoe_stage1_bf16_pertokenFp8_doweight_g1u1_32x128_3tg_pf3E,0.0%,388.1785,moe_ck2stages_gemm2_256x32x64x128_1x4_MulABScaleExpertWeight_v1_Nswizzle0_per_tensor_MulRoutedWeight0,0.0%,1003.0026,nan
80,512,7168,512,256,8,ActivationType.Silu,torch.bfloat16,torch.float8_e4m3fnuz,torch.float8_e4m3fnuz,QuantType.per_Tensor,1,1,32,0,636.7195,_ZN5aiter53fmoe_stage1_bf16_pertokenFp8_doweight_g1u1_32x512_pf3E,0.0%,424.2829,moe_ck2stages_gemm2_256x32x64x128_1x4_MulABScaleExpertWeight_v1_Nswizzle0_per_tensor_MulRoutedWeight0,0.0%,1061.0024,nan
80,1024,7168,512,256,8,ActivationType.Silu,torch.bfloat16,torch.float8_e4m3fnuz,torch.float8_e4m3fnuz,QuantType.per_Tensor,1,1,32,0,786.1241,_ZN5aiter53fmoe_stage1_bf16_pertokenFp8_doweight_g1u1_32x512_pf3E,0.0%,594.7951,moe_ck2stages_gemm2_256x32x64x128_1x4_MulABScaleExpertWeight_v1_Nswizzle0_per_tensor_MulRoutedWeight0,0.0%,1380.9192,nan
80,16,7168,256,256,8,ActivationType.Silu,torch.bfloat16,torch.float8_e4m3fnuz,torch.float8_e4m3fnuz,QuantType.per_Tensor,1,0,32,0,133.9983,moe_ck2stages_gemm1_256x32x64x256_1x4_MulABScale_v1_Nswizzle0_per_tensor_MulRoutedWeight0_silu,0.0%,122.4929,moe_ck2stages_gemm2_256x32x64x128_1x4_MulABScaleExpertWeight_v1_Nswizzle0_per_tensor_MulRoutedWeight1,1.4%,256.4912,nan
80,32,7168,256,256,8,ActivationType.Silu,torch.bfloat16,torch.float8_e4m3fnuz,torch.float8_e4m3fnuz,QuantType.per_Tensor,1,0,32,0,189.9893,moe_ck2stages_gemm1_256x32x64x256_1x4_MulABScale_v1_Nswizzle0_per_tensor_MulRoutedWeight0_silu,0.0%,172.0037,moe_ck2stages_gemm2_256x32x64x128_1x4_MulABScaleExpertWeight_v1_Nswizzle0_per_tensor_MulRoutedWeight1,1.3%,361.993,nan
80,64,7168,256,256,8,ActivationType.Silu,torch.bfloat16,torch.float8_e4m3fnuz,torch.float8_e4m3fnuz,QuantType.per_Tensor,1,0,32,0,262.7584,_ZN5aiter48fmoe_stage1_bf16_pertokenFp8_g1u1_32x256_2tg_pf3E,0.0%,235.5389,moe_ck2stages_gemm2_256x32x64x128_1x4_MulABScaleExpertWeight_v1_Nswizzle0_per_tensor_MulRoutedWeight1,1.3%,498.2973,nan
80,128,7168,256,256,8,ActivationType.Silu,torch.bfloat16,torch.float8_e4m3fnuz,torch.float8_e4m3fnuz,QuantType.per_Tensor,1,0,32,0,304.3711,_ZN5aiter48fmoe_stage1_bf16_pertokenFp8_g1u1_32x256_2tg_pf3E,0.0%,267.2018,moe_ck2stages_gemm2_256x32x64x128_1x4_MulABScaleExpertWeight_v1_Nswizzle0_per_tensor_MulRoutedWeight1,1.2%,571.5729,nan
80,256,7168,256,256,8,ActivationType.Silu,torch.bfloat16,torch.float8_e4m3fnuz,torch.float8_e4m3fnuz,QuantType.per_Tensor,1,0,32,0,311.7778,moe_ck2stages_gemm1_256x32x64x128_1x4_MulABScale_v1_Nswizzle0_per_tensor_MulRoutedWeight0_silu,0.0%,278.8173,moe_ck2stages_gemm2_256x32x64x128_1x4_MulABScaleExpertWeight_v1_Nswizzle0_per_tensor_MulRoutedWeight1,1.3%,590.5951,nan
80,512,7168,256,256,8,ActivationType.Silu,torch.bfloat16,torch.float8_e4m3fnuz,torch.float8_e4m3fnuz,QuantType.per_Tensor,1,0,32,0,321.6061,_ZN5aiter48fmoe_stage1_bf16_pertokenFp8_g1u1_32x256_2tg_pf3E,0.0%,297.6124,moe_ck2stages_gemm2_256x32x64x128_1x4_MulABScaleExpertWeight_v1_Nswizzle0_per_tensor_MulRoutedWeight1,1.3%,619.2185,nan
80,1024,7168,256,256,8,ActivationType.Silu,torch.bfloat16,torch.float8_e4m3fnuz,torch.float8_e4m3fnuz,QuantType.per_Tensor,1,0,32,0,401.8613,_ZN5aiter48fmoe_stage1_bf16_pertokenFp8_g1u1_32x256_2tg_pf3E,0.0%,427.4045,moe_ck2stages_gemm2_256x32x64x128_1x4_MulABScaleExpertWeight_v1_Nswizzle0_per_tensor_MulRoutedWeight1,1.3%,829.2658,nan
80,16,7168,256,256,8,ActivationType.Silu,torch.bfloat16,torch.float8_e4m3fnuz,torch.float8_e4m3fnuz,QuantType.per_Tensor,1,1,32,0,125.6912,moe_ck2stages_gemm1_256x32x64x128_1x4_MulABScale_v1_Nswizzle0_per_tensor_MulRoutedWeight1_silu,0.0%,117.306,moe_ck2stages_gemm2_256x32x64x128_1x4_MulABScaleExpertWeight_v1_Nswizzle0_per_tensor_MulRoutedWeight0,0.0%,242.9972,nan
80,32,7168,256,256,8,ActivationType.Silu,torch.bfloat16,torch.float8_e4m3fnuz,torch.float8_e4m3fnuz,QuantType.per_Tensor,1,1,32,0,179.3709,_ZN5aiter57fmoe_stage1_bf16_pertokenFp8_doweight_g1u1_32x256_2tg_pf3E,0.0%,158.7266,moe_ck2stages_gemm2_256x32x64x128_1x4_MulABScaleExpertWeight_v1_Nswizzle0_per_tensor_MulRoutedWeight0,0.0%,338.0975,nan
80,64,7168,256,256,8,ActivationType.Silu,torch.bfloat16,torch.float8_e4m3fnuz,torch.float8_e4m3fnuz,QuantType.per_Tensor,1,1,32,0,256.3156,_ZN5aiter57fmoe_stage1_bf16_pertokenFp8_doweight_g1u1_32x256_2tg_pf3E,0.0%,219.7025,moe_ck2stages_gemm2_256x32x64x128_1x4_MulABScaleExpertWeight_v1_Nswizzle0_per_tensor_MulRoutedWeight0,0.0%,476.0181,nan
80,128,7168,256,256,8,ActivationType.Silu,torch.bfloat16,torch.float8_e4m3fnuz,torch.float8_e4m3fnuz,QuantType.per_Tensor,1,1,32,0,294.2746,_ZN5aiter57fmoe_stage1_bf16_pertokenFp8_doweight_g1u1_32x128_3tg_pf3E,0.0%,255.9378,moe_ck2stages_gemm2_256x32x64x256_1x4_MulABScaleExpertWeight_v1_Nswizzle0_per_tensor_MulRoutedWeight0,0.0%,550.2124,nan
80,256,7168,256,256,8,ActivationType.Silu,torch.bfloat16,torch.float8_e4m3fnuz,torch.float8_e4m3fnuz,QuantType.per_Tensor,1,1,32,0,316.2013,_ZN5aiter57fmoe_stage1_bf16_pertokenFp8_doweight_g1u1_32x256_2tg_pf3E,0.0%,268.1578,moe_ck2stages_gemm2_256x32x64x256_1x4_MulABScaleExpertWeight_v1_Nswizzle0_per_tensor_MulRoutedWeight0,0.0%,584.3591,nan
80,512,7168,256,256,8,ActivationType.Silu,torch.bfloat16,torch.float8_e4m3fnuz,torch.float8_e4m3fnuz,QuantType.per_Tensor,1,1,32,0,319.691,_ZN5aiter57fmoe_stage1_bf16_pertokenFp8_doweight_g1u1_32x128_3tg_pf3E,0.0%,287.2659,moe_ck2stages_gemm2_256x32x64x256_1x4_MulABScaleExpertWeight_v1_Nswizzle0_per_tensor_MulRoutedWeight0,0.0%,606.9568999999999,nan
80,1024,7168,256,256,8,ActivationType.Silu,torch.bfloat16,torch.float8_e4m3fnuz,torch.float8_e4m3fnuz,QuantType.per_Tensor,1,1,32,0,399.8662,_ZN5aiter57fmoe_stage1_bf16_pertokenFp8_doweight_g1u1_32x256_2tg_pf3E,0.0%,415.5508,moe_ck2stages_gemm2_256x32x64x128_1x4_MulABScaleExpertWeight_v1_Nswizzle0_per_tensor_MulRoutedWeight0,0.0%,815.4169999999999,nan
80,16,7168,512,256,8,ActivationType.Silu,torch.bfloat16,torch.float8_e4m3fnuz,torch.float8_e4m3fnuz,QuantType.per_Token,1,0,32,0,236.4211,_ZN5aiter48fmoe_stage1_bf16_pertokenFp8_g1u1_32x256_2tg_pf3E,0.0%,173.2015,moe_ck2stages_gemm2_256x32x64x128_1x4_MulABScaleExpertWeight_v1_Nswizzle0_per_token_MulRoutedWeight1,2.8%,409.6226,nan
80,32,7168,512,256,8,ActivationType.Silu,torch.bfloat16,torch.float8_e4m3fnuz,torch.float8_e4m3fnuz,QuantType.per_Token,1,0,32,0,404.6734,_ZN5aiter48fmoe_stage1_bf16_pertokenFp8_g1u1_32x256_2tg_pf3E,0.0%,279.4616,moe_ck2stages_gemm2_256x32x64x128_1x4_MulABScaleExpertWeight_v1_Nswizzle0_per_token_MulRoutedWeight1,2.7%,684.135,nan
80,64,7168,512,256,8,ActivationType.Silu,torch.bfloat16,torch.float8_e4m3fnuz,torch.float8_e4m3fnuz,QuantType.per_Token,1,0,32,0,538.7098,_ZN5aiter48fmoe_stage1_bf16_pertokenFp8_g1u1_32x256_2tg_pf3E,0.0%,375.1912,moe_ck2stages_gemm2_256x32x64x128_1x4_MulABScaleExpertWeight_v1_Nswizzle0_per_token_MulRoutedWeight1,2.8%,913.901,nan
80,128,7168,512,256,8,ActivationType.Silu,torch.bfloat16,torch.float8_e4m3fnuz,torch.float8_e4m3fnuz,QuantType.per_Token,1,0,32,0,589.7511,moe_ck2stages_gemm1_256x32x64x256_1x4_MulABScale_v1_Nswizzle0_per_token_MulRoutedWeight0_silu,0.0%,427.3453,moe_ck2stages_gemm2_256x32x64x128_1x4_MulABScaleExpertWeight_v1_Nswizzle0_per_token_MulRoutedWeight1,2.8%,1017.0964,nan
80,256,7168,512,256,8,ActivationType.Silu,torch.bfloat16,torch.float8_e4m3fnuz,torch.float8_e4m3fnuz,QuantType.per_Token,1,0,32,0,613.9277,_ZN5aiter44fmoe_stage1_bf16_pertokenFp8_g1u1_32x512_pf3E,0.0%,442.6931,moe_ck2stages_gemm2_256x32x64x128_1x4_MulABScaleExpertWeight_v1_Nswizzle0_per_token_MulRoutedWeight1,2.8%,1056.6208,nan
80,512,7168,512,256,8,ActivationType.Silu,torch.bfloat16,torch.float8_e4m3fnuz,torch.float8_e4m3fnuz,QuantType.per_Token,1,0,32,0,622.3274,_ZN5aiter44fmoe_stage1_bf16_pertokenFp8_g1u1_32x512_pf3E,0.0%,481.164,moe_ck2stages_gemm2_256x32x64x128_1x4_MulABScaleExpertWeight_v1_Nswizzle0_per_token_MulRoutedWeight1,2.8%,1103.4914,nan
80,1024,7168,512,256,8,ActivationType.Silu,torch.bfloat16,torch.float8_e4m3fnuz,torch.float8_e4m3fnuz,QuantType.per_Token,1,0,32,0,790.8098,_ZN5aiter44fmoe_stage1_bf16_pertokenFp8_g1u1_32x512_pf3E,0.0%,721.0261,moe_ck2stages_gemm2_256x32x64x128_1x4_MulABScaleExpertWeight_v1_Nswizzle0_per_token_MulRoutedWeight1,2.8%,1511.8359,nan
80,16,7168,512,256,8,ActivationType.Silu,torch.bfloat16,torch.float8_e4m3fnuz,torch.float8_e4m3fnuz,QuantType.per_Token,1,1,32,0,221.3891,moe_ck2stages_gemm1_256x32x64x128_1x4_MulABScale_v1_Nswizzle0_per_token_MulRoutedWeight1_silu,0.0%,164.7756,moe_ck2stages_gemm2_256x32x64x128_1x4_MulABScaleExpertWeight_v1_Nswizzle0_per_token_MulRoutedWeight0,0.0%,386.1647,nan
80,32,7168,512,256,8,ActivationType.Silu,torch.bfloat16,torch.float8_e4m3fnuz,torch.float8_e4m3fnuz,QuantType.per_Token,1,1,32,0,350.5317,_ZN5aiter57fmoe_stage1_bf16_pertokenFp8_doweight_g1u1_32x128_3tg_pf3E,0.0%,254.5409,moe_ck2stages_gemm2_256x32x64x128_1x4_MulABScaleExpertWeight_v1_Nswizzle0_per_token_MulRoutedWeight0,0.0%,605.0726,nan
80,64,7168,512,256,8,ActivationType.Silu,torch.bfloat16,torch.float8_e4m3fnuz,torch.float8_e4m3fnuz,QuantType.per_Token,1,1,32,0,525.1363,_ZN5aiter57fmoe_stage1_bf16_pertokenFp8_doweight_g1u1_32x256_2tg_pf2E,0.0%,362.3449,moe_ck2stages_gemm2_256x32x64x128_1x4_MulABScaleExpertWeight_v1_Nswizzle0_per_token_MulRoutedWeight0,0.0%,887.4812,nan
80,128,7168,512,256,8,ActivationType.Silu,torch.bfloat16,torch.float8_e4m3fnuz,torch.float8_e4m3fnuz,QuantType.per_Token,1,1,32,0,598.1386,_ZN5aiter57fmoe_stage1_bf16_pertokenFp8_doweight_g1u1_32x128_3tg_pf2E,0.0%,419.7459,moe_ck2stages_gemm2_256x32x64x128_1x4_MulABScaleExpertWeight_v1_Nswizzle0_per_token_MulRoutedWeight0,0.0%,1017.8845,nan
80,256,7168,512,256,8,ActivationType.Silu,torch.bfloat16,torch.float8_e4m3fnuz,torch.float8_e4m3fnuz,QuantType.per_Token,1,1,32,0,617.4698,_ZN5aiter53fmoe_stage1_bf16_pertokenFp8_doweight_g1u1_32x512_pf3E,0.0%,438.4527,moe_ck2stages_gemm2_256x32x64x128_1x4_MulABScaleExpertWeight_v1_Nswizzle0_per_token_MulRoutedWeight0,0.0%,1055.9225,nan
80,512,7168,512,256,8,ActivationType.Silu,torch.bfloat16,torch.float8_e4m3fnuz,torch.float8_e4m3fnuz,QuantType.per_Token,1,1,32,0,644.1693,_ZN5aiter53fmoe_stage1_bf16_pertokenFp8_doweight_g1u1_32x512_pf3E,0.0%,478.6702,moe_ck2stages_gemm2_256x32x64x128_1x4_MulABScaleExpertWeight_v1_Nswizzle0_per_token_MulRoutedWeight0,0.0%,1122.8395,nan
80,1024,7168,512,256,8,ActivationType.Silu,torch.bfloat16,torch.float8_e4m3fnuz,torch.float8_e4m3fnuz,QuantType.per_Token,1,1,32,0,778.9093,_ZN5aiter57fmoe_stage1_bf16_pertokenFp8_doweight_g1u1_32x256_2tg_pf2E,0.0%,689.3972,moe_ck2stages_gemm2_256x32x64x128_1x4_MulABScaleExpertWeight_v1_Nswizzle0_per_token_MulRoutedWeight0,0.0%,1468.3065,nan
80,16,7168,256,256,8,ActivationType.Silu,torch.bfloat16,torch.float8_e4m3fnuz,torch.float8_e4m3fnuz,QuantType.per_Token,1,0,32,0,125.4068,_ZN5aiter48fmoe_stage1_bf16_pertokenFp8_g1u1_32x128_3tg_pf2E,0.0%,135.382,moe_ck2stages_gemm2_256x32x64x128_1x4_MulABScaleExpertWeight_v1_Nswizzle0_per_token_MulRoutedWeight1,1.3%,260.78880000000004,nan
80,32,7168,256,256,8,ActivationType.Silu,torch.bfloat16,torch.float8_e4m3fnuz,torch.float8_e4m3fnuz,QuantType.per_Token,1,0,32,0,177.6258,_ZN5aiter48fmoe_stage1_bf16_pertokenFp8_g1u1_32x256_2tg_pf2E,0.0%,191.2903,moe_ck2stages_gemm2_256x32x64x128_1x4_MulABScaleExpertWeight_v1_Nswizzle0_per_token_MulRoutedWeight1,1.4%,368.9161,nan
80,64,7168,256,256,8,ActivationType.Silu,torch.bfloat16,torch.float8_e4m3fnuz,torch.float8_e4m3fnuz,QuantType.per_Token,1,0,32,0,261.1704,_ZN5aiter48fmoe_stage1_bf16_pertokenFp8_g1u1_32x128_3tg_pf2E,0.0%,271.8617,moe_ck2stages_gemm2_256x32x64x128_1x4_MulABScaleExpertWeight_v1_Nswizzle0_per_token_MulRoutedWeight1,1.3%,533.0320999999999,nan
80,128,7168,256,256,8,ActivationType.Silu,torch.bfloat16,torch.float8_e4m3fnuz,torch.float8_e4m3fnuz,QuantType.per_Token,1,0,32,0,300.9794,moe_ck2stages_gemm1_256x32x64x256_1x4_MulABScale_v1_Nswizzle0_per_token_MulRoutedWeight0_silu,0.0%,311.9721,moe_ck2stages_gemm2_256x32x64x128_1x4_MulABScaleExpertWeight_v1_Nswizzle0_per_token_MulRoutedWeight1,1.3%,612.9515,nan
80,256,7168,256,256,8,ActivationType.Silu,torch.bfloat16,torch.float8_e4m3fnuz,torch.float8_e4m3fnuz,QuantType.per_Token,1,0,32,0,305.6713,_ZN5aiter48fmoe_stage1_bf16_pertokenFp8_g1u1_32x128_3tg_pf3E,0.0%,328.5768,moe_ck2stages_gemm2_256x32x64x128_1x4_MulABScaleExpertWeight_v1_Nswizzle0_per_token_MulRoutedWeight1,1.3%,634.2481,nan
80,512,7168,256,256,8,ActivationType.Silu,torch.bfloat16,torch.float8_e4m3fnuz,torch.float8_e4m3fnuz,QuantType.per_Token,1,0,32,0,313.6366,_ZN5aiter48fmoe_stage1_bf16_pertokenFp8_g1u1_32x256_2tg_pf3E,0.0%,358.7294,moe_ck2stages_gemm2_256x32x64x128_1x4_MulABScaleExpertWeight_v1_Nswizzle0_per_token_MulRoutedWeight1,1.3%,672.366,nan
80,1024,7168,256,256,8,ActivationType.Silu,torch.bfloat16,torch.float8_e4m3fnuz,torch.float8_e4m3fnuz,QuantType.per_Token,1,0,32,0,393.4372,_ZN5aiter48fmoe_stage1_bf16_pertokenFp8_g1u1_32x256_2tg_pf3E,0.0%,533.2726,moe_ck2stages_gemm2_256x32x64x128_1x4_MulABScaleExpertWeight_v1_Nswizzle0_per_token_MulRoutedWeight1,1.3%,926.7098,nan
80,16,7168,256,256,8,ActivationType.Silu,torch.bfloat16,torch.float8_e4m3fnuz,torch.float8_e4m3fnuz,QuantType.per_Token,1,1,32,0,126.6989,moe_ck2stages_gemm1_256x32x64x128_1x4_MulABScale_v1_Nswizzle0_per_token_MulRoutedWeight1_silu,0.0%,133.3308,moe_ck2stages_gemm2_256x32x64x256_1x4_MulABScaleExpertWeight_v1_Nswizzle0_per_token_MulRoutedWeight0,0.0%,260.0297,nan
80,32,7168,256,256,8,ActivationType.Silu,torch.bfloat16,torch.float8_e4m3fnuz,torch.float8_e4m3fnuz,QuantType.per_Token,1,1,32,0,195.2158,moe_ck2stages_gemm1_256x32x64x256_1x4_MulABScale_v1_Nswizzle0_per_token_MulRoutedWeight1_silu,0.0%,195.86,moe_ck2stages_gemm2_256x32x64x256_1x4_MulABScaleExpertWeight_v1_Nswizzle0_per_token_MulRoutedWeight0,0.0%,391.0758,nan
80,64,7168,256,256,8,ActivationType.Silu,torch.bfloat16,torch.float8_e4m3fnuz,torch.float8_e4m3fnuz,QuantType.per_Token,1,1,32,0,256.0292,_ZN5aiter57fmoe_stage1_bf16_pertokenFp8_doweight_g1u1_32x128_3tg_pf2E,0.0%,264.2336,moe_ck2stages_gemm2_256x32x64x256_1x4_MulABScaleExpertWeight_v1_Nswizzle0_per_token_MulRoutedWeight0,0.0%,520.2628,nan
80,128,7168,256,256,8,ActivationType.Silu,torch.bfloat16,torch.float8_e4m3fnuz,torch.float8_e4m3fnuz,QuantType.per_Token,1,1,32,0,299.1638,_ZN5aiter57fmoe_stage1_bf16_pertokenFp8_doweight_g1u1_32x256_2tg_pf3E,0.0%,301.8734,moe_ck2stages_gemm2_256x32x64x256_1x4_MulABScaleExpertWeight_v1_Nswizzle0_per_token_MulRoutedWeight0,0.0%,601.0372,nan
80,256,7168,256,256,8,ActivationType.Silu,torch.bfloat16,torch.float8_e4m3fnuz,torch.float8_e4m3fnuz,QuantType.per_Token,1,1,32,0,309.4074,_ZN5aiter57fmoe_stage1_bf16_pertokenFp8_doweight_g1u1_32x256_2tg_pf3E,0.0%,319.2041,moe_ck2stages_gemm2_256x32x64x256_1x4_MulABScaleExpertWeight_v1_Nswizzle0_per_token_MulRoutedWeight0,0.0%,628.6115,nan
80,512,7168,256,256,8,ActivationType.Silu,torch.bfloat16,torch.float8_e4m3fnuz,torch.float8_e4m3fnuz,QuantType.per_Token,1,1,32,0,321.2283,_ZN5aiter57fmoe_stage1_bf16_pertokenFp8_doweight_g1u1_32x256_2tg_pf3E,0.0%,350.0187,moe_ck2stages_gemm2_256x32x64x128_1x4_MulABScaleExpertWeight_v1_Nswizzle0_per_token_MulRoutedWeight0,0.0%,671.2470000000001,nan
80,1024,7168,256,256,8,ActivationType.Silu,torch.bfloat16,torch.float8_e4m3fnuz,torch.float8_e4m3fnuz,QuantType.per_Token,1,1,32,0,392.0635,_ZN5aiter57fmoe_stage1_bf16_pertokenFp8_doweight_g1u1_32x256_2tg_pf3E,0.0%,527.058,moe_ck2stages_gemm2_256x32x64x128_1x4_MulABScaleExpertWeight_v1_Nswizzle0_per_token_MulRoutedWeight0,0.0%,919.1215,nan
80,16,7168,512,256,8,ActivationType.Silu,torch.bfloat16,torch.float8_e4m3fnuz,torch.float8_e4m3fnuz,QuantType.per_1x128,1,0,64,0,339.2704,_ZN5aiter59fmoe_stage1_bf16_pertokenFp8_blockscale_g1u1_64x128_2tg_pf3E,3.5%,434.6542,moe_ck2stages_gemm2_256x64x128x128_1x4_MulABScaleExpertWeightA8W8blkscale_v3_Nswizzle0_per_1x128_MulRoutedWeight1,2.8%,773.9246,nan
80,32,7168,512,256,8,ActivationType.Silu,torch.bfloat16,torch.float8_e4m3fnuz,torch.float8_e4m3fnuz,QuantType.per_1x128,1,0,64,0,504.633,_ZN5aiter59fmoe_stage1_bf16_pertokenFp8_blockscale_g1u1_64x128_2tg_pf3E,3.7%,691.5374,moe_ck2stages_gemm2_256x64x128x128_1x4_MulABScaleExpertWeightA8W8blkscale_v3_Nswizzle0_per_1x128_MulRoutedWeight1,2.9%,1196.1704,nan
80,64,7168,512,256,8,ActivationType.Silu,torch.bfloat16,torch.float8_e4m3fnuz,torch.float8_e4m3fnuz,QuantType.per_1x128,1,0,64,0,674.4161,_ZN5aiter59fmoe_stage1_bf16_pertokenFp8_blockscale_g1u1_64x128_2tg_pf3E,3.6%,943.8697,moe_ck2stages_gemm2_256x64x128x128_1x4_MulABScaleExpertWeightA8W8blkscale_v3_Nswizzle0_per_1x128_MulRoutedWeight1,2.7%,1618.2858,nan
80,128,7168,512,256,8,ActivationType.Silu,torch.bfloat16,torch.float8_e4m3fnuz,torch.float8_e4m3fnuz,QuantType.per_1x128,1,0,64,0,754.8548,_ZN5aiter59fmoe_stage1_bf16_pertokenFp8_blockscale_g1u1_64x128_2tg_pf3E,3.7%,1059.303,moe_ck2stages_gemm2_256x64x128x128_1x4_MulABScaleExpertWeightA8W8blkscale_v3_Nswizzle0_per_1x128_MulRoutedWeight1,2.8%,1814.1578,nan
80,256,7168,512,256,8,ActivationType.Silu,torch.bfloat16,torch.float8_e4m3fnuz,torch.float8_e4m3fnuz,QuantType.per_1x128,1,0,64,0,770.6774,_ZN5aiter59fmoe_stage1_bf16_pertokenFp8_blockscale_g1u1_64x128_2tg_pf3E,3.7%,1079.1528,moe_ck2stages_gemm2_256x64x128x128_1x4_MulABScaleExpertWeightA8W8blkscale_v3_Nswizzle0_per_1x128_MulRoutedWeight1,2.8%,1849.8302,nan
80,512,7168,512,256,8,ActivationType.Silu,torch.bfloat16,torch.float8_e4m3fnuz,torch.float8_e4m3fnuz,QuantType.per_1x128,1,0,64,0,795.5641,_ZN5aiter59fmoe_stage1_bf16_pertokenFp8_blockscale_g1u1_64x128_2tg_pf3E,3.7%,1167.2181,moe_ck2stages_gemm2_256x64x128x128_1x4_MulABScaleExpertWeightA8W8blkscale_v3_Nswizzle0_per_1x128_MulRoutedWeight1,2.8%,1962.7822,nan
80,1024,7168,512,256,8,ActivationType.Silu,torch.bfloat16,torch.float8_e4m3fnuz,torch.float8_e4m3fnuz,QuantType.per_1x128,1,0,64,0,855.5604,_ZN5aiter59fmoe_stage1_bf16_pertokenFp8_blockscale_g1u1_64x128_2tg_pf3E,3.7%,1447.2264,moe_ck2stages_gemm2_256x64x128x128_1x4_MulABScaleExpertWeightA8W8blkscale_v3_Nswizzle0_per_1x128_MulRoutedWeight1,2.8%,2302.7868,nan
80,16,7168,512,256,8,ActivationType.Silu,torch.bfloat16,torch.float8_e4m3fnuz,torch.float8_e4m3fnuz,QuantType.per_1x128,1,1,64,0,627.9416,moe_ck2stages_gemm1_256x64x128x128_1x4_MulABScaleExpertWeightA8W8blkscale_v3_Nswizzle0_per_1x128_MulRoutedWeight1_silu,0.0%,438.5499,moe_ck2stages_gemm2_256x64x128x128_1x4_MulABScaleExpertWeightA8W8blkscale_v3_Nswizzle0_per_1x128_MulRoutedWeight0,0.0%,1066.4915,nan
80,32,7168,512,256,8,ActivationType.Silu,torch.bfloat16,torch.float8_e4m3fnuz,torch.float8_e4m3fnuz,QuantType.per_1x128,1,1,64,0,840.5793,moe_ck2stages_gemm1_256x64x128x128_1x4_MulABScaleExpertWeightA8W8blkscale_v3_Nswizzle0_per_1x128_MulRoutedWeight1_silu,0.0%,673.6297,moe_ck2stages_gemm2_256x64x128x128_1x4_MulABScaleExpertWeightA8W8blkscale_v3_Nswizzle0_per_1x128_MulRoutedWeight0,0.0%,1514.2089999999998,nan
80,64,7168,512,256,8,ActivationType.Silu,torch.bfloat16,torch.float8_e4m3fnuz,torch.float8_e4m3fnuz,QuantType.per_1x128,1,1,64,0,1253.7134,moe_ck2stages_gemm1_256x64x128x128_1x4_MulABScaleExpertWeightA8W8blkscale_v3_Nswizzle0_per_1x128_MulRoutedWeight1_silu,0.0%,947.1867,moe_ck2stages_gemm2_256x64x128x128_1x4_MulABScaleExpertWeightA8W8blkscale_v3_Nswizzle0_per_1x128_MulRoutedWeight0,0.0%,2200.9001,nan
80,128,7168,512,256,8,ActivationType.Silu,torch.bfloat16,torch.float8_e4m3fnuz,torch.float8_e4m3fnuz,QuantType.per_1x128,1,1,64,0,1369.8031,moe_ck2stages_gemm1_256x64x128x128_1x4_MulABScaleExpertWeightA8W8blkscale_v3_Nswizzle0_per_1x128_MulRoutedWeight1_silu,0.0%,1067.3066,moe_ck2stages_gemm2_256x64x128x128_1x4_MulABScaleExpertWeightA8W8blkscale_v3_Nswizzle0_per_1x128_MulRoutedWeight0,0.0%,2437.1097,nan
80,256,7168,512,256,8,ActivationType.Silu,torch.bfloat16,torch.float8_e4m3fnuz,torch.float8_e4m3fnuz,QuantType.per_1x128,1,1,64,0,1400.748,moe_ck2stages_gemm1_256x64x128x128_1x4_MulABScaleExpertWeightA8W8blkscale_v3_Nswizzle0_per_1x128_MulRoutedWeight1_silu,0.0%,1077.6522,moe_ck2stages_gemm2_256x64x128x128_1x4_MulABScaleExpertWeightA8W8blkscale_v3_Nswizzle0_per_1x128_MulRoutedWeight0,0.0%,2478.4002,nan
80,512,7168,512,256,8,ActivationType.Silu,torch.bfloat16,torch.float8_e4m3fnuz,torch.float8_e4m3fnuz,QuantType.per_1x128,1,1,64,0,1468.6698,moe_ck2stages_gemm1_256x64x128x128_1x4_MulABScaleExpertWeightA8W8blkscale_v3_Nswizzle0_per_1x128_MulRoutedWeight1_silu,0.0%,1157.7019,moe_ck2stages_gemm2_256x64x128x128_1x4_MulABScaleExpertWeightA8W8blkscale_v3_Nswizzle0_per_1x128_MulRoutedWeight0,0.0%,2626.3717,nan
80,1024,7168,512,256,8,ActivationType.Silu,torch.bfloat16,torch.float8_e4m3fnuz,torch.float8_e4m3fnuz,QuantType.per_1x128,1,1,64,0,1584.4348,moe_ck2stages_gemm1_256x64x128x128_1x4_MulABScaleExpertWeightA8W8blkscale_v3_Nswizzle0_per_1x128_MulRoutedWeight1_silu,0.0%,1438.5974,moe_ck2stages_gemm2_256x64x128x128_1x4_MulABScaleExpertWeightA8W8blkscale_v3_Nswizzle0_per_1x128_MulRoutedWeight0,0.0%,3023.0322,nan
80,16,7168,256,256,8,ActivationType.Silu,torch.bfloat16,torch.float8_e4m3fnuz,torch.float8_e4m3fnuz,QuantType.per_1x128,1,0,64,0,173.6985,_ZN5aiter59fmoe_stage1_bf16_pertokenFp8_blockscale_g1u1_64x128_2tg_pf3E,3.6%,352.3509,moe_ck2stages_gemm2_256x64x128x128_1x4_MulABScaleExpertWeightA8W8blkscale_v3_Nswizzle0_per_1x128_MulRoutedWeight1,1.3%,526.0494,nan
80,32,7168,256,256,8,ActivationType.Silu,torch.bfloat16,torch.float8_e4m3fnuz,torch.float8_e4m3fnuz,QuantType.per_1x128,1,0,64,0,285.8465,_ZN5aiter59fmoe_stage1_bf16_pertokenFp8_blockscale_g1u1_64x128_2tg_pf3E,3.6%,580.4678,moe_ck2stages_gemm2_256x64x128x128_1x4_MulABScaleExpertWeightA8W8blkscale_v3_Nswizzle0_per_1x128_MulRoutedWeight1,1.2%,866.3143,nan
80,64,7168,256,256,8,ActivationType.Silu,torch.bfloat16,torch.float8_e4m3fnuz,torch.float8_e4m3fnuz,QuantType.per_1x128,1,0,64,0,349.3365,_ZN5aiter59fmoe_stage1_bf16_pertokenFp8_blockscale_g1u1_64x128_2tg_pf3E,3.8%,789.5956,moe_ck2stages_gemm2_256x64x128x128_1x4_MulABScaleExpertWeightA8W8blkscale_v3_Nswizzle0_per_1x128_MulRoutedWeight1,1.2%,1138.9321,nan
80,128,7168,256,256,8,ActivationType.Silu,torch.bfloat16,torch.float8_e4m3fnuz,torch.float8_e4m3fnuz,QuantType.per_1x128,1,0,64,0,395.7534,_ZN5aiter59fmoe_stage1_bf16_pertokenFp8_blockscale_g1u1_64x128_2tg_pf3E,3.7%,879.8917,moe_ck2stages_gemm2_256x64x128x128_1x4_MulABScaleExpertWeightA8W8blkscale_v3_Nswizzle0_per_1x128_MulRoutedWeight1,1.3%,1275.6451,nan
80,256,7168,256,256,8,ActivationType.Silu,torch.bfloat16,torch.float8_e4m3fnuz,torch.float8_e4m3fnuz,QuantType.per_1x128,1,0,64,0,402.0565,_ZN5aiter59fmoe_stage1_bf16_pertokenFp8_blockscale_g1u1_64x128_2tg_pf3E,3.7%,898.1789,moe_ck2stages_gemm2_256x64x128x128_1x4_MulABScaleExpertWeightA8W8blkscale_v3_Nswizzle0_per_1x128_MulRoutedWeight1,1.3%,1300.2354,nan
80,512,7168,256,256,8,ActivationType.Silu,torch.bfloat16,torch.float8_e4m3fnuz,torch.float8_e4m3fnuz,QuantType.per_1x128,1,0,64,0,409.927,_ZN5aiter59fmoe_stage1_bf16_pertokenFp8_blockscale_g1u1_64x128_2tg_pf3E,3.7%,929.0695,moe_ck2stages_gemm2_256x64x128x128_1x4_MulABScaleExpertWeightA8W8blkscale_v3_Nswizzle0_per_1x128_MulRoutedWeight1,1.3%,1338.9965,nan
80,1024,7168,256,256,8,ActivationType.Silu,torch.bfloat16,torch.float8_e4m3fnuz,torch.float8_e4m3fnuz,QuantType.per_1x128,1,0,64,0,452.2813,_ZN5aiter59fmoe_stage1_bf16_pertokenFp8_blockscale_g1u1_64x128_2tg_pf3E,3.7%,1178.146,moe_ck2stages_gemm2_256x64x128x128_1x4_MulABScaleExpertWeightA8W8blkscale_v3_Nswizzle0_per_1x128_MulRoutedWeight1,1.3%,1630.4272999999998,nan
80,16,7168,256,256,8,ActivationType.Silu,torch.bfloat16,torch.float8_e4m3fnuz,torch.float8_e4m3fnuz,QuantType.per_1x128,1,1,64,0,318.7557,moe_ck2stages_gemm1_256x64x128x128_1x4_MulABScaleExpertWeightA8W8blkscale_v3_Nswizzle0_per_1x128_MulRoutedWeight1_silu,0.0%,362.4079,moe_ck2stages_gemm2_256x64x128x128_1x4_MulABScaleExpertWeightA8W8blkscale_v3_Nswizzle0_per_1x128_MulRoutedWeight0,0.0%,681.1636,nan
80,32,7168,256,256,8,ActivationType.Silu,torch.bfloat16,torch.float8_e4m3fnuz,torch.float8_e4m3fnuz,QuantType.per_1x128,1,1,64,0,424.2163,moe_ck2stages_gemm1_256x64x128x128_1x4_MulABScaleExpertWeightA8W8blkscale_v3_Nswizzle0_per_1x128_MulRoutedWeight1_silu,0.0%,532.6921,moe_ck2stages_gemm2_256x64x128x128_1x4_MulABScaleExpertWeightA8W8blkscale_v3_Nswizzle0_per_1x128_MulRoutedWeight0,0.0%,956.9084,nan
80,64,7168,256,256,8,ActivationType.Silu,torch.bfloat16,torch.float8_e4m3fnuz,torch.float8_e4m3fnuz,QuantType.per_1x128,1,1,64,0,631.6563,moe_ck2stages_gemm1_256x64x128x128_1x4_MulABScaleExpertWeightA8W8blkscale_v3_Nswizzle0_per_1x128_MulRoutedWeight1_silu,0.0%,742.3946,moe_ck2stages_gemm2_256x64x128x128_1x4_MulABScaleExpertWeightA8W8blkscale_v3_Nswizzle0_per_1x128_MulRoutedWeight0,0.0%,1374.0509,nan
80,128,7168,256,256,8,ActivationType.Silu,torch.bfloat16,torch.float8_e4m3fnuz,torch.float8_e4m3fnuz,QuantType.per_1x128,1,1,64,0,738.8212,moe_ck2stages_gemm1_256x64x128x128_1x4_MulABScaleExpertWeightA8W8blkscale_v3_Nswizzle0_per_1x128_MulRoutedWeight1_silu,0.0%,875.5076,moe_ck2stages_gemm2_256x64x128x128_1x4_MulABScaleExpertWeightA8W8blkscale_v3_Nswizzle0_per_1x128_MulRoutedWeight0,0.0%,1614.3288,nan
80,256,7168,256,256,8,ActivationType.Silu,torch.bfloat16,torch.float8_e4m3fnuz,torch.float8_e4m3fnuz,QuantType.per_1x128,1,1,64,0,754.4055,moe_ck2stages_gemm1_256x64x128x128_1x4_MulABScaleExpertWeightA8W8blkscale_v3_Nswizzle0_per_1x128_MulRoutedWeight1_silu,0.0%,889.0316,moe_ck2stages_gemm2_256x64x128x128_1x4_MulABScaleExpertWeightA8W8blkscale_v3_Nswizzle0_per_1x128_MulRoutedWeight0,0.0%,1643.4371,nan
80,512,7168,256,256,8,ActivationType.Silu,torch.bfloat16,torch.float8_e4m3fnuz,torch.float8_e4m3fnuz,QuantType.per_1x128,1,1,64,0,795.3668,moe_ck2stages_gemm1_256x64x128x128_1x4_MulABScaleExpertWeightA8W8blkscale_v3_Nswizzle0_per_1x128_MulRoutedWeight1_silu,0.0%,925.0732,moe_ck2stages_gemm2_256x64x128x128_1x4_MulABScaleExpertWeightA8W8blkscale_v3_Nswizzle0_per_1x128_MulRoutedWeight0,0.0%,1720.44,nan
80,1024,7168,256,256,8,ActivationType.Silu,torch.bfloat16,torch.float8_e4m3fnuz,torch.float8_e4m3fnuz,QuantType.per_1x128,1,1,64,0,855.7399,moe_ck2stages_gemm1_256x64x128x128_1x4_MulABScaleExpertWeightA8W8blkscale_v3_Nswizzle0_per_1x128_MulRoutedWeight1_silu,0.0%,1165.0834,moe_ck2stages_gemm2_256x64x128x128_1x4_MulABScaleExpertWeightA8W8blkscale_v3_Nswizzle0_per_1x128_MulRoutedWeight0,0.0%,2020.8233,nan
80,16,4096,384,128,8,ActivationType.Silu,torch.bfloat16,torch.bfloat16,torch.bfloat16,QuantType.No,1,0,32,0,157.1651,moe_ck2stages_gemm1_256x32x64x128_1x4_TypeCast_v1_Nswizzle0_no_MulRoutedWeight0_silu,0.0%,93.2444,moe_ck2stages_gemm2_256x32x64x64_1x4_TypeCastExpertWeight_v1_Nswizzle0_no_MulRoutedWeight1,0.4%,250.4095,nan
80,32,4096,384,128,8,ActivationType.Silu,torch.bfloat16,torch.bfloat16,torch.bfloat16,QuantType.No,1,0,32,0,217.8225,moe_ck2stages_gemm1_256x32x64x64_1x4_TypeCast_v1_Nswizzle0_no_MulRoutedWeight0_silu,0.0%,132.5009,moe_ck2stages_gemm2_256x32x64x64_1x4_TypeCastExpertWeight_v1_Nswizzle0_no_MulRoutedWeight1,0.4%,350.3234,nan
80,64,4096,384,128,8,ActivationType.Silu,torch.bfloat16,torch.bfloat16,torch.bfloat16,QuantType.No,1,0,32,0,249.1107,moe_ck2stages_gemm1_256x32x64x64_1x4_TypeCast_v1_Nswizzle0_no_MulRoutedWeight0_silu,0.0%,149.7123,moe_ck2stages_gemm2_256x32x64x64_1x4_TypeCastExpertWeight_v1_Nswizzle0_no_MulRoutedWeight1,0.4%,398.823,nan
80,128,4096,384,128,8,ActivationType.Silu,torch.bfloat16,torch.bfloat16,torch.bfloat16,QuantType.No,1,0,32,0,255.9379,moe_ck2stages_gemm1_256x32x64x128_1x4_TypeCast_v1_Nswizzle0_no_MulRoutedWeight0_silu,0.0%,157.5912,moe_ck2stages_gemm2_256x32x64x64_1x4_TypeCastExpertWeight_v1_Nswizzle0_no_MulRoutedWeight1,0.4%,413.5291,nan
80,256,4096,384,128,8,ActivationType.Silu,torch.bfloat16,torch.bfloat16,torch.bfloat16,QuantType.No,1,0,32,0,265.4576,moe_ck2stages_gemm1_256x32x64x128_1x4_TypeCast_v1_Nswizzle0_no_MulRoutedWeight0_silu,0.0%,169.2155,moe_ck2stages_gemm2_256x32x64x64_1x4_TypeCastExpertWeight_v1_Nswizzle0_no_MulRoutedWeight1,0.3%,434.6731,nan
80,512,4096,384,128,8,ActivationType.Silu,torch.bfloat16,torch.bfloat16,torch.bfloat16,QuantType.No,1,0,32,0,359.0511,moe_ck2stages_gemm1_256x32x64x128_1x4_TypeCast_v1_Nswizzle0_no_MulRoutedWeight0_silu,0.0%,226.0352,moe_ck2stages_gemm2_256x32x64x64_1x4_TypeCastExpertWeight_v1_Nswizzle0_no_MulRoutedWeight1,0.4%,585.0863,nan
80,1024,4096,384,128,8,ActivationType.Silu,torch.bfloat16,torch.bfloat16,torch.bfloat16,QuantType.No,1,0,32,0,523.3946,moe_ck2stages_gemm1_256x32x64x128_1x4_TypeCast_v1_Nswizzle0_no_MulRoutedWeight0_silu,0.0%,370.9183,moe_ck2stages_gemm2_256x32x64x64_1x4_TypeCastExpertWeight_v1_Nswizzle0_no_MulRoutedWeight1,0.4%,894.3128999999999,nan
80,16,4096,384,128,8,ActivationType.Silu,torch.bfloat16,torch.bfloat16,torch.bfloat16,QuantType.No,1,1,32,0,155.779,moe_ck2stages_gemm1_256x32x64x128_1x4_TypeCastExpertWeight_v1_Nswizzle0_no_MulRoutedWeight1_silu,0.0%,89.3163,moe_ck2stages_gemm2_256x32x64x64_1x4_TypeCast_v1_Nswizzle0_no_MulRoutedWeight0,0.0%,245.0953,nan
80,32,4096,384,128,8,ActivationType.Silu,torch.bfloat16,torch.bfloat16,torch.bfloat16,QuantType.No,1,1,32,0,225.4566,moe_ck2stages_gemm1_256x32x64x128_1x4_TypeCastExpertWeight_v1_Nswizzle0_no_MulRoutedWeight1_silu,0.0%,128.9418,moe_ck2stages_gemm2_256x32x64x64_1x4_TypeCast_v1_Nswizzle0_no_MulRoutedWeight0,0.0%,354.39840000000004,nan
80,64,4096,384,128,8,ActivationType.Silu,torch.bfloat16,torch.bfloat16,torch.bfloat16,QuantType.No,1,1,32,0,247.9983,moe_ck2stages_gemm1_256x32x64x64_1x4_TypeCastExpertWeight_v1_Nswizzle0_no_MulRoutedWeight1_silu,0.0%,145.2865,moe_ck2stages_gemm2_256x32x64x64_1x4_TypeCast_v1_Nswizzle0_no_MulRoutedWeight0,0.0%,393.2848,nan
80,128,4096,384,128,8,ActivationType.Silu,torch.bfloat16,torch.bfloat16,torch.bfloat16,QuantType.No,1,1,32,0,257.8247,moe_ck2stages_gemm1_256x32x64x64_1x4_TypeCastExpertWeight_v1_Nswizzle0_no_MulRoutedWeight1_silu,0.0%,151.4652,moe_ck2stages_gemm2_256x32x64x64_1x4_TypeCast_v1_Nswizzle0_no_MulRoutedWeight0,0.0%,409.2899,nan
80,256,4096,384,128,8,ActivationType.Silu,torch.bfloat16,torch.bfloat16,torch.bfloat16,QuantType.No,1,1,32,0,268.1008,moe_ck2stages_gemm1_256x32x64x128_1x4_TypeCastExpertWeight_v1_Nswizzle0_no_MulRoutedWeight1_silu,0.0%,164.5129,moe_ck2stages_gemm2_256x32x64x64_1x4_TypeCast_v1_Nswizzle0_no_MulRoutedWeight0,0.0%,432.6137,nan
80,512,4096,384,128,8,ActivationType.Silu,torch.bfloat16,torch.bfloat16,torch.bfloat16,QuantType.No,1,1,32,0,357.4769,moe_ck2stages_gemm1_256x32x64x128_1x4_TypeCastExpertWeight_v1_Nswizzle0_no_MulRoutedWeight1_silu,0.0%,215.4405,moe_ck2stages_gemm2_256x32x64x64_1x4_TypeCast_v1_Nswizzle0_no_MulRoutedWeight0,0.0%,572.9174,nan
80,1024,4096,384,128,8,ActivationType.Silu,torch.bfloat16,torch.bfloat16,torch.bfloat16,QuantType.No,1,1,64,0,438.1081,moe_ck2stages_gemm1_256x64x128x64_1x4_TypeCastExpertWeight_v3_Nswizzle0_no_MulRoutedWeight1_silu,0.0%,413.9833,moe_ck2stages_gemm2_256x64x128x64_1x4_TypeCast_v3_Nswizzle0_no_MulRoutedWeight0,0.0%,852.0914,nan
80,16,4096,192,128,8,ActivationType.Silu,torch.bfloat16,torch.bfloat16,torch.bfloat16,QuantType.No,1,0,32,0,89.5458,moe_ck2stages_gemm1_256x32x64x128_1x4_TypeCast_v1_Nswizzle0_no_MulRoutedWeight0_silu,0.0%,65.9949,moe_ck2stages_gemm2_256x32x64x64_1x4_TypeCastExpertWeight_v1_Nswizzle0_no_MulRoutedWeight1,0.1%,155.54070000000002,nan
80,32,4096,192,128,8,ActivationType.Silu,torch.bfloat16,torch.bfloat16,torch.bfloat16,QuantType.No,1,0,32,0,121.615,moe_ck2stages_gemm1_256x32x64x128_1x4_TypeCast_v1_Nswizzle0_no_MulRoutedWeight0_silu,0.0%,88.9958,moe_ck2stages_gemm2_256x32x64x64_1x4_TypeCastExpertWeight_v1_Nswizzle0_no_MulRoutedWeight1,0.1%,210.6108,nan
80,64,4096,192,128,8,ActivationType.Silu,torch.bfloat16,torch.bfloat16,torch.bfloat16,QuantType.No,1,0,32,0,129.1891,moe_ck2stages_gemm1_256x32x64x128_1x4_TypeCast_v1_Nswizzle0_no_MulRoutedWeight0_silu,0.0%,100.1176,moe_ck2stages_gemm2_256x32x64x64_1x4_TypeCastExpertWeight_v1_Nswizzle0_no_MulRoutedWeight1,0.1%,229.3067,nan
80,128,4096,192,128,8,ActivationType.Silu,torch.bfloat16,torch.bfloat16,torch.bfloat16,QuantType.No,1,0,32,0,133.6309,moe_ck2stages_gemm1_256x32x64x128_1x4_TypeCast_v1_Nswizzle0_no_MulRoutedWeight0_silu,0.0%,104.2252,moe_ck2stages_gemm2_256x32x64x64_1x4_TypeCastExpertWeight_v1_Nswizzle0_no_MulRoutedWeight1,0.1%,237.8561,nan
80,256,4096,192,128,8,ActivationType.Silu,torch.bfloat16,torch.bfloat16,torch.bfloat16,QuantType.No,1,0,32,0,139.6634,moe_ck2stages_gemm1_256x32x64x128_1x4_TypeCast_v1_Nswizzle0_no_MulRoutedWeight0_silu,0.0%,109.2368,moe_ck2stages_gemm2_256x32x64x64_1x4_TypeCastExpertWeight_v1_Nswizzle0_no_MulRoutedWeight1,0.1%,248.9002,nan
80,512,4096,192,128,8,ActivationType.Silu,torch.bfloat16,torch.bfloat16,torch.bfloat16,QuantType.No,1,0,32,0,187.2796,moe_ck2stages_gemm1_256x32x64x128_1x4_TypeCast_v1_Nswizzle0_no_MulRoutedWeight0_silu,0.0%,154.5518,moe_ck2stages_gemm2_256x32x64x64_1x4_TypeCastExpertWeight_v1_Nswizzle0_no_MulRoutedWeight1,0.1%,341.8314,nan
80,1024,4096,192,128,8,ActivationType.Silu,torch.bfloat16,torch.bfloat16,torch.bfloat16,QuantType.No,1,0,32,0,284.7091,moe_ck2stages_gemm1_256x32x64x128_1x4_TypeCast_v1_Nswizzle0_no_MulRoutedWeight0_silu,0.0%,255.4906,moe_ck2stages_gemm2_256x32x64x64_1x4_TypeCastExpertWeight_v1_Nswizzle0_no_MulRoutedWeight1,0.1%,540.1997,nan
80,16,4096,192,128,8,ActivationType.Silu,torch.bfloat16,torch.bfloat16,torch.bfloat16,QuantType.No,1,1,32,0,89.9287,moe_ck2stages_gemm1_256x32x64x64_1x4_TypeCastExpertWeight_v1_Nswizzle0_no_MulRoutedWeight1_silu,0.0%,61.054,moe_ck2stages_gemm2_256x32x64x64_1x4_TypeCast_v1_Nswizzle0_no_MulRoutedWeight0,0.0%,150.98270000000002,nan
80,32,4096,192,128,8,ActivationType.Silu,torch.bfloat16,torch.bfloat16,torch.bfloat16,QuantType.No,1,1,32,0,114.2954,moe_ck2stages_gemm1_256x32x64x128_1x4_TypeCastExpertWeight_v1_Nswizzle0_no_MulRoutedWeight1_silu,0.0%,80.9839,moe_ck2stages_gemm2_256x32x64x64_1x4_TypeCast_v1_Nswizzle0_no_MulRoutedWeight0,0.0%,195.2793,nan
80,64,4096,192,128,8,ActivationType.Silu,torch.bfloat16,torch.bfloat16,torch.bfloat16,QuantType.No,1,1,32,0,130.6407,moe_ck2stages_gemm1_256x32x64x64_1x4_TypeCastExpertWeight_v1_Nswizzle0_no_MulRoutedWeight1_silu,0.0%,92.6727,moe_ck2stages_gemm2_256x32x64x64_1x4_TypeCast_v1_Nswizzle0_no_MulRoutedWeight0,0.0%,223.3134,nan
80,128,4096,192,128,8,ActivationType.Silu,torch.bfloat16,torch.bfloat16,torch.bfloat16,QuantType.No,1,1,32,0,134.3195,moe_ck2stages_gemm1_256x32x64x64_1x4_TypeCastExpertWeight_v1_Nswizzle0_no_MulRoutedWeight1_silu,0.0%,96.1391,moe_ck2stages_gemm2_256x32x64x64_1x4_TypeCast_v1_Nswizzle0_no_MulRoutedWeight0,0.0%,230.4586,nan
80,256,4096,192,128,8,ActivationType.Silu,torch.bfloat16,torch.bfloat16,torch.bfloat16,QuantType.No,1,1,32,0,139.2209,moe_ck2stages_gemm1_256x32x64x64_1x4_TypeCastExpertWeight_v1_Nswizzle0_no_MulRoutedWeight1_silu,0.0%,100.9844,moe_ck2stages_gemm2_256x32x64x64_1x4_TypeCast_v1_Nswizzle0_no_MulRoutedWeight0,0.0%,240.2053,nan
80,512,4096,192,128,8,ActivationType.Silu,torch.bfloat16,torch.bfloat16,torch.bfloat16,QuantType.No,1,1,32,0,187.6828,moe_ck2stages_gemm1_256x32x64x128_1x4_TypeCastExpertWeight_v1_Nswizzle0_no_MulRoutedWeight1_silu,0.0%,141.8482,moe_ck2stages_gemm2_256x32x64x64_1x4_TypeCast_v1_Nswizzle0_no_MulRoutedWeight0,0.0%,329.53099999999995,nan
80,1024,4096,192,128,8,ActivationType.Silu,torch.bfloat16,torch.bfloat16,torch.bfloat16,QuantType.No,1,1,32,0,281.872,moe_ck2stages_gemm1_256x32x64x128_1x4_TypeCastExpertWeight_v1_Nswizzle0_no_MulRoutedWeight1_silu,0.0%,231.818,moe_ck2stages_gemm2_256x32x64x64_1x4_TypeCast_v1_Nswizzle0_no_MulRoutedWeight0,0.0%,513.69,nan
80,16,4096,384,128,8,ActivationType.Silu,torch.bfloat16,torch.float8_e4m3fnuz,torch.float8_e4m3fnuz,QuantType.per_Tensor,1,0,32,0,88.6805,moe_ck2stages_gemm1_256x32x64x128_1x4_MulABScale_v1_Nswizzle0_per_tensor_MulRoutedWeight0_silu,0.0%,69.2293,moe_ck2stages_gemm2_256x32x64x128_1x4_MulABScaleExpertWeight_v1_Nswizzle0_per_tensor_MulRoutedWeight1,0.4%,157.9098,nan
80,32,4096,384,128,8,ActivationType.Silu,torch.bfloat16,torch.float8_e4m3fnuz,torch.float8_e4m3fnuz,QuantType.per_Tensor,1,0,32,0,117.3378,moe_ck2stages_gemm1_256x32x64x128_1x4_MulABScale_v1_Nswizzle0_per_tensor_MulRoutedWeight0_silu,0.0%,90.0048,moe_ck2stages_gemm2_256x32x64x128_1x4_MulABScaleExpertWeight_v1_Nswizzle0_per_tensor_MulRoutedWeight1,0.4%,207.3426,nan
80,64,4096,384,128,8,ActivationType.Silu,torch.bfloat16,torch.float8_e4m3fnuz,torch.float8_e4m3fnuz,QuantType.per_Tensor,1,0,32,0,131.493,moe_ck2stages_gemm1_256x32x64x256_1x4_MulABScale_v1_Nswizzle0_per_tensor_MulRoutedWeight0_silu,0.0%,101.9902,moe_ck2stages_gemm2_256x32x64x128_1x4_MulABScaleExpertWeight_v1_Nswizzle0_per_tensor_MulRoutedWeight1,0.4%,233.4832,nan
80,128,4096,384,128,8,ActivationType.Silu,torch.bfloat16,torch.float8_e4m3fnuz,torch.float8_e4m3fnuz,QuantType.per_Tensor,1,0,32,0,134.8903,moe_ck2stages_gemm1_256x32x64x256_1x4_MulABScale_v1_Nswizzle0_per_tensor_MulRoutedWeight0_silu,0.0%,105.2228,moe_ck2stages_gemm2_256x32x64x128_1x4_MulABScaleExpertWeight_v1_Nswizzle0_per_tensor_MulRoutedWeight1,0.4%,240.1131,nan
80,256,4096,384,128,8,ActivationType.Silu,torch.bfloat16,torch.float8_e4m3fnuz,torch.float8_e4m3fnuz,QuantType.per_Tensor,1,0,32,0,139.6984,moe_ck2stages_gemm1_256x32x64x256_1x4_MulABScale_v1_Nswizzle0_per_tensor_MulRoutedWeight0_silu,0.0%,109.9724,moe_ck2stages_gemm2_256x32x64x128_1x4_MulABScaleExpertWeight_v1_Nswizzle0_per_tensor_MulRoutedWeight1,0.4%,249.6708,nan
80,512,4096,384,128,8,ActivationType.Silu,torch.bfloat16,torch.float8_e4m3fnuz,torch.float8_e4m3fnuz,QuantType.per_Tensor,1,0,32,0,183.0231,moe_ck2stages_gemm1_256x32x64x256_1x4_MulABScale_v1_Nswizzle0_per_tensor_MulRoutedWeight0_silu,0.0%,157.1813,moe_ck2stages_gemm2_256x32x64x128_1x4_MulABScaleExpertWeight_v1_Nswizzle0_per_tensor_MulRoutedWeight1,0.4%,340.2044,nan
80,1024,4096,384,128,8,ActivationType.Silu,torch.bfloat16,torch.float8_e4m3fnuz,torch.float8_e4m3fnuz,QuantType.per_Tensor,1,0,32,0,270.8914,moe_ck2stages_gemm1_256x32x64x256_1x4_MulABScale_v1_Nswizzle0_per_tensor_MulRoutedWeight0_silu,0.0%,260.2162,moe_ck2stages_gemm2_256x32x64x128_1x4_MulABScaleExpertWeight_v1_Nswizzle0_per_tensor_MulRoutedWeight1,0.4%,531.1076,nan
80,16,4096,384,128,8,ActivationType.Silu,torch.bfloat16,torch.float8_e4m3fnuz,torch.float8_e4m3fnuz,QuantType.per_Tensor,1,1,32,0,84.2563,moe_ck2stages_gemm1_256x32x64x128_1x4_MulABScale_v1_Nswizzle0_per_tensor_MulRoutedWeight1_silu,0.0%,65.2059,moe_ck2stages_gemm2_256x32x64x128_1x4_MulABScaleExpertWeight_v1_Nswizzle0_per_tensor_MulRoutedWeight0,0.0%,149.4622,nan
80,32,4096,384,128,8,ActivationType.Silu,torch.bfloat16,torch.float8_e4m3fnuz,torch.float8_e4m3fnuz,QuantType.per_Tensor,1,1,32,0,116.313,moe_ck2stages_gemm1_256x32x64x128_1x4_MulABScale_v1_Nswizzle0_per_tensor_MulRoutedWeight1_silu,0.0%,85.0286,moe_ck2stages_gemm2_256x32x64x128_1x4_MulABScaleExpertWeight_v1_Nswizzle0_per_tensor_MulRoutedWeight0,0.0%,201.3416,nan
80,64,4096,384,128,8,ActivationType.Silu,torch.bfloat16,torch.float8_e4m3fnuz,torch.float8_e4m3fnuz,QuantType.per_Tensor,1,1,32,0,129.6147,moe_ck2stages_gemm1_256x32x64x128_1x4_MulABScale_v1_Nswizzle0_per_tensor_MulRoutedWeight1_silu,0.0%,97.6896,moe_ck2stages_gemm2_256x32x64x128_1x4_MulABScaleExpertWeight_v1_Nswizzle0_per_tensor_MulRoutedWeight0,0.0%,227.3043,nan
80,128,4096,384,128,8,ActivationType.Silu,torch.bfloat16,torch.float8_e4m3fnuz,torch.float8_e4m3fnuz,QuantType.per_Tensor,1,1,32,0,134.6626,moe_ck2stages_gemm1_256x32x64x256_1x4_MulABScale_v1_Nswizzle0_per_tensor_MulRoutedWeight1_silu,0.0%,101.4684,moe_ck2stages_gemm2_256x32x64x128_1x4_MulABScaleExpertWeight_v1_Nswizzle0_per_tensor_MulRoutedWeight0,0.0%,236.131,nan
80,256,4096,384,128,8,ActivationType.Silu,torch.bfloat16,torch.float8_e4m3fnuz,torch.float8_e4m3fnuz,QuantType.per_Tensor,1,1,32,0,139.8815,moe_ck2stages_gemm1_256x32x64x256_1x4_MulABScale_v1_Nswizzle0_per_tensor_MulRoutedWeight1_silu,0.0%,106.9703,moe_ck2stages_gemm2_256x32x64x128_1x4_MulABScaleExpertWeight_v1_Nswizzle0_per_tensor_MulRoutedWeight0,0.0%,246.8518,nan
80,512,4096,384,128,8,ActivationType.Silu,torch.bfloat16,torch.float8_e4m3fnuz,torch.float8_e4m3fnuz,QuantType.per_Tensor,1,1,32,0,181.5497,moe_ck2stages_gemm1_256x32x64x256_1x4_MulABScale_v1_Nswizzle0_per_tensor_MulRoutedWeight1_silu,0.0%,145.8214,moe_ck2stages_gemm2_256x32x64x128_1x4_MulABScaleExpertWeight_v1_Nswizzle0_per_tensor_MulRoutedWeight0,0.0%,327.3711,nan
80,1024,4096,384,128,8,ActivationType.Silu,torch.bfloat16,torch.float8_e4m3fnuz,torch.float8_e4m3fnuz,QuantType.per_Tensor,1,1,32,0,270.1825,moe_ck2stages_gemm1_256x32x64x256_1x4_MulABScale_v1_Nswizzle0_per_tensor_MulRoutedWeight1_silu,0.0%,247.6162,moe_ck2stages_gemm2_256x32x64x128_1x4_MulABScaleExpertWeight_v1_Nswizzle0_per_tensor_MulRoutedWeight0,0.0%,517.7987,nan
80,16,2048,192,128,8,ActivationType.Silu,torch.bfloat16,torch.bfloat16,torch.bfloat16,QuantType.No,1,0,32,0,47.8047,moe_ck2stages_gemm1_256x32x64x64_1x4_TypeCast_v1_Nswizzle0_no_MulRoutedWeight0_silu,0.0%,38.2441,moe_ck2stages_gemm2_256x32x64x64_1x4_TypeCastExpertWeight_v1_Nswizzle0_no_MulRoutedWeight1,0.0%,86.0488,nan
80,32,2048,192,128,8,ActivationType.Silu,torch.bfloat16,torch.bfloat16,torch.bfloat16,QuantType.No,1,0,32,0,59.8292,moe_ck2stages_gemm1_256x32x64x64_1x4_TypeCast_v1_Nswizzle0_no_MulRoutedWeight0_silu,0.0%,51.2858,moe_ck2stages_gemm2_256x32x64x64_1x4_TypeCastExpertWeight_v1_Nswizzle0_no_MulRoutedWeight1,0.0%,111.115,nan
80,64,2048,192,128,8,ActivationType.Silu,torch.bfloat16,torch.bfloat16,torch.bfloat16,QuantType.No,1,0,32,0,61.636,moe_ck2stages_gemm1_256x32x64x64_1x4_TypeCast_v1_Nswizzle0_no_MulRoutedWeight0_silu,0.0%,55.509,moe_ck2stages_gemm2_256x32x64x64_1x4_TypeCastExpertWeight_v1_Nswizzle0_no_MulRoutedWeight1,0.0%,117.145,nan
80,128,2048,192,128,8,ActivationType.Silu,torch.bfloat16,torch.bfloat16,torch.bfloat16,QuantType.No,1,0,32,0,64.082,moe_ck2stages_gemm1_256x32x64x128_1x4_TypeCast_v1_Nswizzle0_no_MulRoutedWeight0_silu,0.0%,57.4694,moe_ck2stages_gemm2_256x32x64x64_1x4_TypeCastExpertWeight_v1_Nswizzle0_no_MulRoutedWeight1,0.0%,121.5514,nan
80,256,2048,192,128,8,ActivationType.Silu,torch.bfloat16,torch.bfloat16,torch.bfloat16,QuantType.No,1,0,32,0,66.2715,moe_ck2stages_gemm1_256x32x64x128_1x4_TypeCast_v1_Nswizzle0_no_MulRoutedWeight0_silu,0.0%,59.2337,moe_ck2stages_gemm2_256x32x64x64_1x4_TypeCastExpertWeight_v1_Nswizzle0_no_MulRoutedWeight1,0.0%,125.5052,nan
80,512,2048,192,128,8,ActivationType.Silu,torch.bfloat16,torch.bfloat16,torch.bfloat16,QuantType.No,1,0,32,0,96.9888,moe_ck2stages_gemm1_256x32x64x128_1x4_TypeCast_v1_Nswizzle0_no_MulRoutedWeight0_silu,0.0%,84.1154,moe_ck2stages_gemm2_256x32x64x64_1x4_TypeCastExpertWeight_v1_Nswizzle0_no_MulRoutedWeight1,0.0%,181.1042,nan
80,1024,2048,192,128,8,ActivationType.Silu,torch.bfloat16,torch.bfloat16,torch.bfloat16,QuantType.No,1,0,32,0,138.8968,moe_ck2stages_gemm1_256x32x64x128_1x4_TypeCast_v1_Nswizzle0_no_MulRoutedWeight0_silu,0.0%,132.8933,moe_ck2stages_gemm2_256x32x64x64_1x4_TypeCastExpertWeight_v1_Nswizzle0_no_MulRoutedWeight1,0.0%,271.79010000000005,nan
80,16,2048,192,128,8,ActivationType.Silu,torch.bfloat16,torch.bfloat16,torch.bfloat16,QuantType.No,1,1,32,0,48.0952,moe_ck2stages_gemm1_256x32x64x64_1x4_TypeCastExpertWeight_v1_Nswizzle0_no_MulRoutedWeight1_silu,0.0%,35.239,moe_ck2stages_gemm2_256x32x64x64_1x4_TypeCast_v1_Nswizzle0_no_MulRoutedWeight0,0.0%,83.3342,nan
80,32,2048,192,128,8,ActivationType.Silu,torch.bfloat16,torch.bfloat16,torch.bfloat16,QuantType.No,1,1,32,0,59.4344,moe_ck2stages_gemm1_256x32x64x64_1x4_TypeCastExpertWeight_v1_Nswizzle0_no_MulRoutedWeight1_silu,0.0%,46.247,moe_ck2stages_gemm2_256x32x64x64_1x4_TypeCast_v1_Nswizzle0_no_MulRoutedWeight0,0.0%,105.6814,nan
80,64,2048,192,128,8,ActivationType.Silu,torch.bfloat16,torch.bfloat16,torch.bfloat16,QuantType.No,1,1,32,0,62.6916,moe_ck2stages_gemm1_256x32x64x64_1x4_TypeCastExpertWeight_v1_Nswizzle0_no_MulRoutedWeight1_silu,0.0%,51.7606,moe_ck2stages_gemm2_256x32x64x64_1x4_TypeCast_v1_Nswizzle0_no_MulRoutedWeight0,0.0%,114.4522,nan
80,128,2048,192,128,8,ActivationType.Silu,torch.bfloat16,torch.bfloat16,torch.bfloat16,QuantType.No,1,1,32,0,64.9686,moe_ck2stages_gemm1_256x32x64x64_1x4_TypeCastExpertWeight_v1_Nswizzle0_no_MulRoutedWeight1_silu,0.0%,53.261,moe_ck2stages_gemm2_256x32x64x64_1x4_TypeCast_v1_Nswizzle0_no_MulRoutedWeight0,0.0%,118.2296,nan
80,256,2048,192,128,8,ActivationType.Silu,torch.bfloat16,torch.bfloat16,torch.bfloat16,QuantType.No,1,1,64,0,90.6873,moe_ck2stages_gemm1_256x64x64x64_1x4_TypeCastExpertWeight_v1_Nswizzle0_no_MulRoutedWeight1_silu,0.0%,109.2719,moe_ck2stages_gemm2_256x64x128x64_1x4_TypeCast_v3_Nswizzle0_no_MulRoutedWeight0,0.0%,199.9592,nan
80,512,2048,192,128,8,ActivationType.Silu,torch.bfloat16,torch.bfloat16,torch.bfloat16,QuantType.No,1,1,32,0,89.6155,moe_ck2stages_gemm1_256x32x64x128_1x4_TypeCastExpertWeight_v1_Nswizzle0_no_MulRoutedWeight1_silu,0.0%,74.9893,moe_ck2stages_gemm2_256x32x64x64_1x4_TypeCast_v1_Nswizzle0_no_MulRoutedWeight0,0.0%,164.6048,nan
80,1024,2048,192,128,8,ActivationType.Silu,torch.bfloat16,torch.bfloat16,torch.bfloat16,QuantType.No,1,1,32,0,144.0118,moe_ck2stages_gemm1_256x32x64x128_1x4_TypeCastExpertWeight_v1_Nswizzle0_no_MulRoutedWeight1_silu,0.0%,121.1407,moe_ck2stages_gemm2_256x32x64x64_1x4_TypeCast_v1_Nswizzle0_no_MulRoutedWeight0,0.0%,265.1525,nan
256,16,4096,384,128,8,ActivationType.Silu,torch.bfloat16,torch.bfloat16,torch.bfloat16,QuantType.No,1,0,32,0,87.9827,moe_ck2stages_gemm1_256x32x64x128_1x4_TypeCast_v1_Nswizzle0_no_MulRoutedWeight0_silu,0.0%,50.4725,moe_ck2stages_gemm2_256x32x128x128_1x4_TypeCast_v1_Nswizzle0_no_MulRoutedWeight1,0.3%,138.4552,nan
256,32,4096,384,128,8,ActivationType.Silu,torch.bfloat16,torch.bfloat16,torch.bfloat16,QuantType.No,1,0,32,0,120.8363,moe_ck2stages_gemm1_256x32x64x128_1x4_TypeCast_v1_Nswizzle0_no_MulRoutedWeight0_silu,0.0%,65.1117,moe_ck2stages_gemm2_256x32x128x128_1x4_TypeCast_v1_Nswizzle0_no_MulRoutedWeight1,0.4%,185.948,nan
256,64,4096,384,128,8,ActivationType.Silu,torch.bfloat16,torch.bfloat16,torch.bfloat16,QuantType.No,1,0,32,0,137.3623,moe_ck2stages_gemm1_256x32x64x128_1x4_TypeCast_v1_Nswizzle0_no_MulRoutedWeight0_silu,0.0%,75.6669,moe_ck2stages_gemm2_256x32x128x128_1x4_TypeCast_v1_Nswizzle0_no_MulRoutedWeight1,0.4%,213.0292,nan
256,128,4096,384,128,8,ActivationType.Silu,torch.bfloat16,torch.bfloat16,torch.bfloat16,QuantType.No,1,0,32,0,139.6659,moe_ck2stages_gemm1_256x32x64x128_1x4_TypeCast_v1_Nswizzle0_no_MulRoutedWeight0_silu,0.0%,77.5117,moe_ck2stages_gemm2_256x32x128x128_1x4_TypeCast_v1_Nswizzle0_no_MulRoutedWeight1,0.4%,217.1776,nan
256,256,4096,384,128,8,ActivationType.Silu,torch.bfloat16,torch.bfloat16,torch.bfloat16,QuantType.No,1,0,32,0,140.6049,moe_ck2stages_gemm1_256x32x64x128_1x4_TypeCast_v1_Nswizzle0_no_MulRoutedWeight0_silu,0.0%,80.4324,moe_ck2stages_gemm2_256x32x128x128_1x4_TypeCast_v1_Nswizzle0_no_MulRoutedWeight1,0.4%,221.0373,nan
256,512,4096,384,128,8,ActivationType.Silu,torch.bfloat16,torch.bfloat16,torch.bfloat16,QuantType.No,1,0,64,0,144.6934,moe_ck2stages_gemm1_256x64x64x64_1x4_TypeCast_v1_Nswizzle0_no_MulRoutedWeight0_silu,0.0%,102.6906,moe_ck2stages_gemm2_256x64x128x128_1x4_TypeCast_v1_Nswizzle0_no_MulRoutedWeight1,0.4%,247.384,nan
256,1024,4096,384,128,8,ActivationType.Silu,torch.bfloat16,torch.bfloat16,torch.bfloat16,QuantType.No,1,0,128,0,169.9523,moe_ck2stages_gemm1_256x128x64x64_1x4_TypeCast_v1_Nswizzle0_no_MulRoutedWeight0_silu,0.0%,151.6234,moe_ck2stages_gemm2_256x128x128x64_1x4_TypeCast_v3_Nswizzle0_no_MulRoutedWeight1,0.4%,321.5757,nan
256,16,4096,384,128,8,ActivationType.Silu,torch.bfloat16,torch.bfloat16,torch.bfloat16,QuantType.No,1,1,32,0,111.1454,moe_ck2stages_gemm1_256x32x64x128_1x4_TypeCast_v1_Nswizzle0_no_MulRoutedWeight1_silu,0.0%,54.5726,moe_ck2stages_gemm2_256x32x128x128_1x4_TypeCast_v1_Nswizzle0_no_MulRoutedWeight0,0.0%,165.718,nan
256,32,4096,384,128,8,ActivationType.Silu,torch.bfloat16,torch.bfloat16,torch.bfloat16,QuantType.No,1,1,32,0,118.7768,moe_ck2stages_gemm1_256x32x64x128_1x4_TypeCast_v1_Nswizzle0_no_MulRoutedWeight1_silu,0.0%,63.3007,moe_ck2stages_gemm2_256x32x128x128_1x4_TypeCast_v1_Nswizzle0_no_MulRoutedWeight0,0.0%,182.0775,nan
256,64,4096,384,128,8,ActivationType.Silu,torch.bfloat16,torch.bfloat16,torch.bfloat16,QuantType.No,1,1,32,0,133.0787,moe_ck2stages_gemm1_256x32x64x128_1x4_TypeCast_v1_Nswizzle0_no_MulRoutedWeight1_silu,0.0%,74.2727,moe_ck2stages_gemm2_256x32x128x128_1x4_TypeCast_v1_Nswizzle0_no_MulRoutedWeight0,0.0%,207.3514,nan
256,128,4096,384,128,8,ActivationType.Silu,torch.bfloat16,torch.bfloat16,torch.bfloat16,QuantType.No,1,1,32,0,139.6302,moe_ck2stages_gemm1_256x32x64x128_1x4_TypeCast_v1_Nswizzle0_no_MulRoutedWeight1_silu,0.0%,77.6408,moe_ck2stages_gemm2_256x32x128x128_1x4_TypeCast_v1_Nswizzle0_no_MulRoutedWeight0,0.0%,217.271,nan
256,256,4096,384,128,8,ActivationType.Silu,torch.bfloat16,torch.bfloat16,torch.bfloat16,QuantType.No,1,1,32,0,141.2038,moe_ck2stages_gemm1_256x32x64x128_1x4_TypeCast_v1_Nswizzle0_no_MulRoutedWeight1_silu,0.0%,80.7543,moe_ck2stages_gemm2_256x32x128x128_1x4_TypeCast_v1_Nswizzle0_no_MulRoutedWeight0,0.0%,221.9581,nan
256,512,4096,384,128,8,ActivationType.Silu,torch.bfloat16,torch.bfloat16,torch.bfloat16,QuantType.No,1,1,64,0,146.2916,moe_ck2stages_gemm1_256x64x64x128_1x4_TypeCast_v1_Nswizzle0_no_MulRoutedWeight1_silu,0.0%,96.7368,moe_ck2stages_gemm2_256x64x128x128_1x4_TypeCast_v1_Nswizzle0_no_MulRoutedWeight0,0.0%,243.0284,nan
256,1024,4096,384,128,8,ActivationType.Silu,torch.bfloat16,torch.bfloat16,torch.bfloat16,QuantType.No,1,1,128,0,171.9931,moe_ck2stages_gemm1_256x128x64x64_1x4_TypeCast_v1_Nswizzle0_no_MulRoutedWeight1_silu,0.0%,142.378,moe_ck2stages_gemm2_256x128x128x64_1x4_TypeCast_v3_Nswizzle0_no_MulRoutedWeight0,0.0%,314.3711,nan
256,16,4096,192,128,8,ActivationType.Silu,torch.bfloat16,torch.bfloat16,torch.bfloat16,QuantType.No,1,0,128,0,56.9509,moe_ck2stages_gemm1_256x128x64x64_1x4_TypeCast_v1_Nswizzle0_no_MulRoutedWeight0_silu,0.0%,50.7976,moe_ck2stages_gemm2_256x128x128x64_1x4_TypeCast_v1_Nswizzle0_no_MulRoutedWeight1,0.1%,107.7485,nan
256,32,4096,192,128,8,ActivationType.Silu,torch.bfloat16,torch.bfloat16,torch.bfloat16,QuantType.No,1,0,128,0,73.0589,moe_ck2stages_gemm1_256x128x64x64_1x4_TypeCast_v1_Nswizzle0_no_MulRoutedWeight0_silu,0.0%,60.9883,moe_ck2stages_gemm2_256x128x128x64_1x4_TypeCast_v3_Nswizzle0_no_MulRoutedWeight1,0.1%,134.0472,nan
256,64,4096,192,128,8,ActivationType.Silu,torch.bfloat16,torch.bfloat16,torch.bfloat16,QuantType.No,1,0,128,0,77.5834,moe_ck2stages_gemm1_256x128x64x64_1x4_TypeCast_v1_Nswizzle0_no_MulRoutedWeight0_silu,0.0%,68.8501,moe_ck2stages_gemm2_256x128x128x64_1x4_TypeCast_v3_Nswizzle0_no_MulRoutedWeight1,0.1%,146.43349999999998,nan
256,128,4096,192,128,8,ActivationType.Silu,torch.bfloat16,torch.bfloat16,torch.bfloat16,QuantType.No,1,0,128,0,79.3422,moe_ck2stages_gemm1_256x128x64x64_1x4_TypeCast_v1_Nswizzle0_no_MulRoutedWeight0_silu,0.0%,72.4396,moe_ck2stages_gemm2_256x128x128x64_1x4_TypeCast_v1_Nswizzle0_no_MulRoutedWeight1,0.1%,151.7818,nan
256,256,4096,192,128,8,ActivationType.Silu,torch.bfloat16,torch.bfloat16,torch.bfloat16,QuantType.No,1,0,128,0,80.5217,moe_ck2stages_gemm1_256x128x64x64_1x4_TypeCast_v1_Nswizzle0_no_MulRoutedWeight0_silu,0.0%,76.6425,moe_ck2stages_gemm2_256x128x128x64_1x4_TypeCast_v3_Nswizzle0_no_MulRoutedWeight1,0.1%,157.1642,nan
256,512,4096,192,128,8,ActivationType.Silu,torch.bfloat16,torch.bfloat16,torch.bfloat16,QuantType.No,1,0,128,0,81.8457,moe_ck2stages_gemm1_256x128x64x64_1x4_TypeCast_v1_Nswizzle0_no_MulRoutedWeight0_silu,0.0%,89.5649,moe_ck2stages_gemm2_256x128x128x64_1x4_TypeCast_v1_Nswizzle0_no_MulRoutedWeight1,0.1%,171.4106,nan
256,1024,4096,192,128,8,ActivationType.Silu,torch.bfloat16,torch.bfloat16,torch.bfloat16,QuantType.No,1,0,128,0,88.2257,moe_ck2stages_gemm1_256x128x64x64_1x4_TypeCast_v1_Nswizzle0_no_MulRoutedWeight0_silu,0.0%,126.3083,moe_ck2stages_gemm2_256x128x128x64_1x4_TypeCast_v1_Nswizzle0_no_MulRoutedWeight1,0.1%,214.534,nan
256,16,4096,192,128,8,ActivationType.Silu,torch.bfloat16,torch.bfloat16,torch.bfloat16,QuantType.No,1,1,128,0,57.1056,moe_ck2stages_gemm1_256x128x64x64_1x4_TypeCast_v1_Nswizzle0_no_MulRoutedWeight1_silu,0.0%,43.7497,moe_ck2stages_gemm2_256x128x128x64_1x4_TypeCast_v1_Nswizzle0_no_MulRoutedWeight0,0.0%,100.8553,nan
256,32,4096,192,128,8,ActivationType.Silu,torch.bfloat16,torch.bfloat16,torch.bfloat16,QuantType.No,1,1,128,0,74.1605,moe_ck2stages_gemm1_256x128x64x64_1x4_TypeCast_v1_Nswizzle0_no_MulRoutedWeight1_silu,0.0%,57.5293,moe_ck2stages_gemm2_256x128x128x64_1x4_TypeCast_v1_Nswizzle0_no_MulRoutedWeight0,0.0%,131.6898,nan
256,64,4096,192,128,8,ActivationType.Silu,torch.bfloat16,torch.bfloat16,torch.bfloat16,QuantType.No,1,1,128,0,78.3818,moe_ck2stages_gemm1_256x128x64x64_1x4_TypeCast_v1_Nswizzle0_no_MulRoutedWeight1_silu,0.0%,64.5094,moe_ck2stages_gemm2_256x128x128x64_1x4_TypeCast_v1_Nswizzle0_no_MulRoutedWeight0,0.0%,142.8912,nan
256,128,4096,192,128,8,ActivationType.Silu,torch.bfloat16,torch.bfloat16,torch.bfloat16,QuantType.No,1,1,128,0,79.9687,moe_ck2stages_gemm1_256x128x64x64_1x4_TypeCast_v1_Nswizzle0_no_MulRoutedWeight1_silu,0.0%,67.3521,moe_ck2stages_gemm2_256x128x128x64_1x4_TypeCast_v1_Nswizzle0_no_MulRoutedWeight0,0.0%,147.3208,nan
256,256,4096,192,128,8,ActivationType.Silu,torch.bfloat16,torch.bfloat16,torch.bfloat16,QuantType.No,1,1,128,0,81.1913,moe_ck2stages_gemm1_256x128x64x64_1x4_TypeCast_v1_Nswizzle0_no_MulRoutedWeight1_silu,0.0%,72.3304,moe_ck2stages_gemm2_256x128x128x64_1x4_TypeCast_v1_Nswizzle0_no_MulRoutedWeight0,0.0%,153.5217,nan
256,512,4096,192,128,8,ActivationType.Silu,torch.bfloat16,torch.bfloat16,torch.bfloat16,QuantType.No,1,1,128,0,84.8306,moe_ck2stages_gemm1_256x128x64x64_1x4_TypeCast_v1_Nswizzle0_no_MulRoutedWeight1_silu,0.0%,84.153,moe_ck2stages_gemm2_256x128x128x64_1x4_TypeCast_v3_Nswizzle0_no_MulRoutedWeight0,0.0%,168.98360000000002,nan
256,1024,4096,192,128,8,ActivationType.Silu,torch.bfloat16,torch.bfloat16,torch.bfloat16,QuantType.No,1,1,128,0,88.3746,moe_ck2stages_gemm1_256x128x64x64_1x4_TypeCast_v1_Nswizzle0_no_MulRoutedWeight1_silu,0.0%,125.0546,moe_ck2stages_gemm2_256x128x128x64_1x4_TypeCast_v1_Nswizzle0_no_MulRoutedWeight0,0.0%,213.4292,nan
256,16,2048,192,128,8,ActivationType.Silu,torch.bfloat16,torch.bfloat16,torch.bfloat16,QuantType.No,1,0,128,0,32.0198,moe_ck2stages_gemm1_256x128x64x64_1x4_TypeCast_v1_Nswizzle0_no_MulRoutedWeight0_silu,0.0%,29.7098,moe_ck2stages_gemm2_256x128x128x64_1x4_TypeCast_v3_Nswizzle0_no_MulRoutedWeight1,0.0%,61.7296,nan
256,32,2048,192,128,8,ActivationType.Silu,torch.bfloat16,torch.bfloat16,torch.bfloat16,QuantType.No,1,0,128,0,39.8128,moe_ck2stages_gemm1_256x128x64x64_1x4_TypeCast_v1_Nswizzle0_no_MulRoutedWeight0_silu,0.0%,37.1613,moe_ck2stages_gemm2_256x128x128x64_1x4_TypeCast_v3_Nswizzle0_no_MulRoutedWeight1,0.0%,76.97409999999999,nan
256,64,2048,192,128,8,ActivationType.Silu,torch.bfloat16,torch.bfloat16,torch.bfloat16,QuantType.No,1,0,128,0,44.832,moe_ck2stages_gemm1_256x128x64x64_1x4_TypeCast_v1_Nswizzle0_no_MulRoutedWeight0_silu,0.0%,39.0422,moe_ck2stages_gemm2_256x128x128x64_1x4_TypeCast_v3_Nswizzle0_no_MulRoutedWeight1,0.0%,83.8742,nan
256,128,2048,192,128,8,ActivationType.Silu,torch.bfloat16,torch.bfloat16,torch.bfloat16,QuantType.No,1,0,128,0,44.3232,moe_ck2stages_gemm1_256x128x64x64_1x4_TypeCast_v1_Nswizzle0_no_MulRoutedWeight0_silu,0.0%,40.6872,moe_ck2stages_gemm2_256x128x128x64_1x4_TypeCast_v1_Nswizzle0_no_MulRoutedWeight1,0.0%,85.0104,nan
256,256,2048,192,128,8,ActivationType.Silu,torch.bfloat16,torch.bfloat16,torch.bfloat16,QuantType.No,1,0,128,0,45.7407,moe_ck2stages_gemm1_256x128x64x64_1x4_TypeCast_v1_Nswizzle0_no_MulRoutedWeight0_silu,0.0%,43.6842,moe_ck2stages_gemm2_256x128x128x64_1x4_TypeCast_v3_Nswizzle0_no_MulRoutedWeight1,0.0%,89.4249,nan
256,512,2048,192,128,8,ActivationType.Silu,torch.bfloat16,torch.bfloat16,torch.bfloat16,QuantType.No,1,0,128,0,46.5686,moe_ck2stages_gemm1_256x128x64x64_1x4_TypeCast_v1_Nswizzle0_no_MulRoutedWeight0_silu,0.0%,53.2277,moe_ck2stages_gemm2_256x128x128x64_1x4_TypeCast_v1_Nswizzle0_no_MulRoutedWeight1,0.0%,99.7963,nan
256,1024,2048,192,128,8,ActivationType.Silu,torch.bfloat16,torch.bfloat16,torch.bfloat16,QuantType.No,1,0,128,0,50.9576,moe_ck2stages_gemm1_256x128x64x64_1x4_TypeCast_v1_Nswizzle0_no_MulRoutedWeight0_silu,0.0%,74.6309,moe_ck2stages_gemm2_256x128x128x64_1x4_TypeCast_v1_Nswizzle0_no_MulRoutedWeight1,0.0%,125.5885,nan
256,16,2048,192,128,8,ActivationType.Silu,torch.bfloat16,torch.bfloat16,torch.bfloat16,QuantType.No,1,1,128,0,32.8985,moe_ck2stages_gemm1_256x128x64x64_1x4_TypeCast_v1_Nswizzle0_no_MulRoutedWeight1_silu,0.0%,27.851,moe_ck2stages_gemm2_256x128x128x64_1x4_TypeCast_v1_Nswizzle0_no_MulRoutedWeight0,0.0%,60.7495,nan
256,32,2048,192,128,8,ActivationType.Silu,torch.bfloat16,torch.bfloat16,torch.bfloat16,QuantType.No,1,1,128,0,40.2212,moe_ck2stages_gemm1_256x128x64x64_1x4_TypeCast_v1_Nswizzle0_no_MulRoutedWeight1_silu,0.0%,34.3124,moe_ck2stages_gemm2_256x128x128x64_1x4_TypeCast_v1_Nswizzle0_no_MulRoutedWeight0,0.0%,74.5336,nan
256,64,2048,192,128,8,ActivationType.Silu,torch.bfloat16,torch.bfloat16,torch.bfloat16,QuantType.No,1,1,128,0,44.8619,moe_ck2stages_gemm1_256x128x64x64_1x4_TypeCast_v1_Nswizzle0_no_MulRoutedWeight1_silu,0.0%,36.6934,moe_ck2stages_gemm2_256x128x128x64_1x4_TypeCast_v1_Nswizzle0_no_MulRoutedWeight0,0.0%,81.55529999999999,nan
256,128,2048,192,128,8,ActivationType.Silu,torch.bfloat16,torch.bfloat16,torch.bfloat16,QuantType.No,1,1,128,0,45.8688,moe_ck2stages_gemm1_256x128x64x64_1x4_TypeCast_v1_Nswizzle0_no_MulRoutedWeight1_silu,0.0%,38.2871,moe_ck2stages_gemm2_256x128x128x64_1x4_TypeCast_v1_Nswizzle0_no_MulRoutedWeight0,0.0%,84.1559,nan
256,256,2048,192,128,8,ActivationType.Silu,torch.bfloat16,torch.bfloat16,torch.bfloat16,QuantType.No,1,1,128,0,45.9188,moe_ck2stages_gemm1_256x128x64x64_1x4_TypeCast_v1_Nswizzle0_no_MulRoutedWeight1_silu,0.0%,41.2582,moe_ck2stages_gemm2_256x128x128x64_1x4_TypeCast_v1_Nswizzle0_no_MulRoutedWeight0,0.0%,87.17699999999999,nan
256,512,2048,192,128,8,ActivationType.Silu,torch.bfloat16,torch.bfloat16,torch.bfloat16,QuantType.No,1,1,128,0,47.3376,moe_ck2stages_gemm1_256x128x64x64_1x4_TypeCast_v1_Nswizzle0_no_MulRoutedWeight1_silu,0.0%,50.4655,moe_ck2stages_gemm2_256x128x128x64_1x4_TypeCast_v1_Nswizzle0_no_MulRoutedWeight0,0.0%,97.8031,nan
256,1024,2048,192,128,8,ActivationType.Silu,torch.bfloat16,torch.bfloat16,torch.bfloat16,QuantType.No,1,1,128,0,51.2892,moe_ck2stages_gemm1_256x128x64x64_1x4_TypeCast_v1_Nswizzle0_no_MulRoutedWeight1_silu,0.0%,72.2206,moe_ck2stages_gemm2_256x128x128x64_1x4_TypeCast_v1_Nswizzle0_no_MulRoutedWeight0,0.0%,123.5098,nan
256,16,4096,384,128,8,ActivationType.Silu,torch.bfloat16,torch.float8_e4m3fn,torch.float8_e4m3fn,QuantType.per_Tensor,1,0,128,0,49.2797,moe_ck2stages_gemm1_256x128x64x128_1x4_TypeCast_v1_Nswizzle0_per_tensor_MulRoutedWeight0_silu,0.0%,41.8774,moe_ck2stages_gemm2_256x128x128x128_1x4_TypeCast_v3_Nswizzle0_per_tensor_MulRoutedWeight1,0.3%,91.1571,nan
256,32,4096,384,128,8,ActivationType.Silu,torch.bfloat16,torch.float8_e4m3fn,torch.float8_e4m3fn,QuantType.per_Tensor,1,0,128,0,77.9358,moe_ck2stages_gemm1_256x128x64x128_1x4_TypeCast_v1_Nswizzle0_per_tensor_MulRoutedWeight0_silu,0.0%,51.714,moe_ck2stages_gemm2_256x128x128x128_1x4_TypeCast_v3_Nswizzle0_per_tensor_MulRoutedWeight1,0.4%,129.6498,nan
256,64,4096,384,128,8,ActivationType.Silu,torch.bfloat16,torch.float8_e4m3fn,torch.float8_e4m3fn,QuantType.per_Tensor,1,0,128,0,84.4623,moe_ck2stages_gemm1_256x128x64x128_1x4_TypeCast_v1_Nswizzle0_per_tensor_MulRoutedWeight0_silu,0.0%,60.2049,moe_ck2stages_gemm2_256x128x128x128_1x4_TypeCast_v3_Nswizzle0_per_tensor_MulRoutedWeight1,0.3%,144.6672,nan
256,128,4096,384,128,8,ActivationType.Silu,torch.bfloat16,torch.float8_e4m3fn,torch.float8_e4m3fn,QuantType.per_Tensor,1,0,128,0,85.616,moe_ck2stages_gemm1_256x128x64x128_1x4_TypeCast_v1_Nswizzle0_per_tensor_MulRoutedWeight0_silu,0.0%,61.7579,moe_ck2stages_gemm2_256x128x128x128_1x4_TypeCast_v3_Nswizzle0_per_tensor_MulRoutedWeight1,0.4%,147.3739,nan
256,256,4096,384,128,8,ActivationType.Silu,torch.bfloat16,torch.float8_e4m3fn,torch.float8_e4m3fn,QuantType.per_Tensor,1,0,128,0,85.8787,moe_ck2stages_gemm1_256x128x64x128_1x4_TypeCast_v1_Nswizzle0_per_tensor_MulRoutedWeight0_silu,0.0%,65.7805,moe_ck2stages_gemm2_256x128x128x128_1x4_TypeCast_v3_Nswizzle0_per_tensor_MulRoutedWeight1,0.4%,151.6592,nan
256,512,4096,384,128,8,ActivationType.Silu,torch.bfloat16,torch.float8_e4m3fn,torch.float8_e4m3fn,QuantType.per_Tensor,1,0,128,0,88.0257,moe_ck2stages_gemm1_256x128x64x128_1x4_TypeCast_v1_Nswizzle0_per_tensor_MulRoutedWeight0_silu,0.0%,82.142,moe_ck2stages_gemm2_256x128x128x128_1x4_TypeCast_v3_Nswizzle0_per_tensor_MulRoutedWeight1,0.4%,170.1677,nan
256,1024,4096,384,128,8,ActivationType.Silu,torch.bfloat16,torch.float8_e4m3fn,torch.float8_e4m3fn,QuantType.per_Tensor,1,0,128,0,93.1959,moe_ck2stages_gemm1_256x128x64x128_1x4_TypeCast_v1_Nswizzle0_per_tensor_MulRoutedWeight0_silu,0.0%,126.5037,moe_ck2stages_gemm2_256x128x128x128_1x4_TypeCast_v3_Nswizzle0_per_tensor_MulRoutedWeight1,0.4%,219.6996,nan
256,16,4096,384,128,8,ActivationType.Silu,torch.bfloat16,torch.float8_e4m3fn,torch.float8_e4m3fn,QuantType.per_Tensor,1,1,128,0,50.6956,moe_ck2stages_gemm1_256x128x64x128_1x4_TypeCast_v1_Nswizzle0_per_tensor_MulRoutedWeight1_silu,0.0%,40.5053,moe_ck2stages_gemm2_256x128x128x128_1x4_TypeCast_v3_Nswizzle0_per_tensor_MulRoutedWeight0,0.0%,91.2009,nan
256,32,4096,384,128,8,ActivationType.Silu,torch.bfloat16,torch.float8_e4m3fn,torch.float8_e4m3fn,QuantType.per_Tensor,1,1,128,0,80.6123,moe_ck2stages_gemm1_256x128x64x128_1x4_TypeCast_v1_Nswizzle0_per_tensor_MulRoutedWeight1_silu,0.0%,51.345,moe_ck2stages_gemm2_256x128x128x128_1x4_TypeCast_v3_Nswizzle0_per_tensor_MulRoutedWeight0,0.0%,131.9573,nan
256,64,4096,384,128,8,ActivationType.Silu,torch.bfloat16,torch.float8_e4m3fn,torch.float8_e4m3fn,QuantType.per_Tensor,1,1,128,0,84.8503,moe_ck2stages_gemm1_256x128x64x128_1x4_TypeCast_v1_Nswizzle0_per_tensor_MulRoutedWeight1_silu,0.0%,56.6858,moe_ck2stages_gemm2_256x128x128x128_1x4_TypeCast_v3_Nswizzle0_per_tensor_MulRoutedWeight0,0.0%,141.5361,nan
256,128,4096,384,128,8,ActivationType.Silu,torch.bfloat16,torch.float8_e4m3fn,torch.float8_e4m3fn,QuantType.per_Tensor,1,1,128,0,86.7731,moe_ck2stages_gemm1_256x128x64x128_1x4_TypeCast_v1_Nswizzle0_per_tensor_MulRoutedWeight1_silu,0.0%,59.632,moe_ck2stages_gemm2_256x128x128x128_1x4_TypeCast_v3_Nswizzle0_per_tensor_MulRoutedWeight0,0.0%,146.4051,nan
256,256,4096,384,128,8,ActivationType.Silu,torch.bfloat16,torch.float8_e4m3fn,torch.float8_e4m3fn,QuantType.per_Tensor,1,1,128,0,87.7176,moe_ck2stages_gemm1_256x128x64x128_1x4_TypeCast_v1_Nswizzle0_per_tensor_MulRoutedWeight1_silu,0.0%,64.4493,moe_ck2stages_gemm2_256x128x128x128_1x4_TypeCast_v3_Nswizzle0_per_tensor_MulRoutedWeight0,0.0%,152.1669,nan
256,512,4096,384,128,8,ActivationType.Silu,torch.bfloat16,torch.float8_e4m3fn,torch.float8_e4m3fn,QuantType.per_Tensor,1,1,128,0,89.1743,moe_ck2stages_gemm1_256x128x64x128_1x4_TypeCast_v1_Nswizzle0_per_tensor_MulRoutedWeight1_silu,0.0%,79.5536,moe_ck2stages_gemm2_256x128x128x128_1x4_TypeCast_v3_Nswizzle0_per_tensor_MulRoutedWeight0,0.0%,168.7279,nan
256,1024,4096,384,128,8,ActivationType.Silu,torch.bfloat16,torch.float8_e4m3fn,torch.float8_e4m3fn,QuantType.per_Tensor,1,1,128,0,94.3824,moe_ck2stages_gemm1_256x128x64x128_1x4_TypeCast_v1_Nswizzle0_per_tensor_MulRoutedWeight1_silu,0.0%,125.2355,moe_ck2stages_gemm2_256x128x128x128_1x4_TypeCast_v3_Nswizzle0_per_tensor_MulRoutedWeight0,0.0%,219.6179,nan
256,16,7168,512,256,8,ActivationType.Silu,torch.bfloat16,torch.bfloat16,torch.bfloat16,QuantType.No,1,0,32,0,262.2322,moe_ck2stages_gemm1_256x32x64x128_1x4_TypeCast_v1_Nswizzle0_no_MulRoutedWeight0_silu,0.0%,124.9051,moe_ck2stages_gemm2_256x32x128x128_1x4_TypeCast_v1_Nswizzle0_no_MulRoutedWeight1,2.6%,387.1373,nan
256,32,7168,512,256,8,ActivationType.Silu,torch.bfloat16,torch.bfloat16,torch.bfloat16,QuantType.No,1,0,32,0,378.9136,moe_ck2stages_gemm1_256x32x64x128_1x4_TypeCast_v1_Nswizzle0_no_MulRoutedWeight0_silu,0.0%,193.6245,moe_ck2stages_gemm2_256x32x128x128_1x4_TypeCast_v1_Nswizzle0_no_MulRoutedWeight1,2.7%,572.5381,nan
256,64,7168,512,256,8,ActivationType.Silu,torch.bfloat16,torch.bfloat16,torch.bfloat16,QuantType.No,1,0,32,0,520.6413,moe_ck2stages_gemm1_256x32x64x128_1x4_TypeCast_v1_Nswizzle0_no_MulRoutedWeight0_silu,0.0%,262.6027,moe_ck2stages_gemm2_256x32x128x128_1x4_TypeCast_v1_Nswizzle0_no_MulRoutedWeight1,2.8%,783.244,nan
256,128,7168,512,256,8,ActivationType.Silu,torch.bfloat16,torch.bfloat16,torch.bfloat16,QuantType.No,1,0,64,0,604.4069,moe_ck2stages_gemm1_256x64x64x128_1x4_TypeCast_v1_Nswizzle0_no_MulRoutedWeight0_silu,0.0%,309.7197,moe_ck2stages_gemm2_256x64x128x128_1x4_TypeCast_v1_Nswizzle0_no_MulRoutedWeight1,2.8%,914.1266,nan
256,256,7168,512,256,8,ActivationType.Silu,torch.bfloat16,torch.bfloat16,torch.bfloat16,QuantType.No,1,0,64,0,615.2191,moe_ck2stages_gemm1_256x64x64x128_1x4_TypeCast_v1_Nswizzle0_no_MulRoutedWeight0_silu,0.0%,320.2366,moe_ck2stages_gemm2_256x64x128x128_1x4_TypeCast_v1_Nswizzle0_no_MulRoutedWeight1,2.8%,935.4557,nan
256,512,7168,512,256,8,ActivationType.Silu,torch.bfloat16,torch.bfloat16,torch.bfloat16,QuantType.No,1,0,64,0,625.807,moe_ck2stages_gemm1_256x64x64x128_1x4_TypeCast_v1_Nswizzle0_no_MulRoutedWeight0_silu,0.0%,337.6519,moe_ck2stages_gemm2_256x64x128x128_1x4_TypeCast_v1_Nswizzle0_no_MulRoutedWeight1,2.8%,963.4589,nan
256,1024,7168,512,256,8,ActivationType.Silu,torch.bfloat16,torch.bfloat16,torch.bfloat16,QuantType.No,1,0,64,0,650.7961,moe_ck2stages_gemm1_256x64x64x64_1x4_TypeCast_v1_Nswizzle0_no_MulRoutedWeight0_silu,0.0%,367.9128,moe_ck2stages_gemm2_256x64x128x128_1x4_TypeCast_v1_Nswizzle0_no_MulRoutedWeight1,2.8%,1018.7089,nan
256,16,7168,512,256,8,ActivationType.Silu,torch.bfloat16,torch.bfloat16,torch.bfloat16,QuantType.No,1,1,32,0,271.5349,moe_ck2stages_gemm1_256x32x64x128_1x4_TypeCast_v1_Nswizzle0_no_MulRoutedWeight1_silu,0.0%,137.0149,moe_ck2stages_gemm2_256x32x128x128_1x4_TypeCast_v1_Nswizzle0_no_MulRoutedWeight0,0.0%,408.5498,nan
256,32,7168,512,256,8,ActivationType.Silu,torch.bfloat16,torch.bfloat16,torch.bfloat16,QuantType.No,1,1,64,0,379.64,moe_ck2stages_gemm1_256x64x64x128_1x4_TypeCast_v1_Nswizzle0_no_MulRoutedWeight1_silu,0.0%,192.4608,moe_ck2stages_gemm2_256x64x128x128_1x4_TypeCast_v1_Nswizzle0_no_MulRoutedWeight0,0.0%,572.1007999999999,nan
256,64,7168,512,256,8,ActivationType.Silu,torch.bfloat16,torch.bfloat16,torch.bfloat16,QuantType.No,1,1,64,0,532.1603,moe_ck2stages_gemm1_256x64x64x128_1x4_TypeCast_v1_Nswizzle0_no_MulRoutedWeight1_silu,0.0%,264.815,moe_ck2stages_gemm2_256x64x128x128_1x4_TypeCast_v1_Nswizzle0_no_MulRoutedWeight0,0.0%,796.9753000000001,nan
256,128,7168,512,256,8,ActivationType.Silu,torch.bfloat16,torch.bfloat16,torch.bfloat16,QuantType.No,1,1,64,0,595.8963,moe_ck2stages_gemm1_256x64x64x128_1x4_TypeCast_v1_Nswizzle0_no_MulRoutedWeight1_silu,0.0%,298.9484,moe_ck2stages_gemm2_256x64x128x128_1x4_TypeCast_v1_Nswizzle0_no_MulRoutedWeight0,0.0%,894.8447,nan
256,256,7168,512,256,8,ActivationType.Silu,torch.bfloat16,torch.bfloat16,torch.bfloat16,QuantType.No,1,1,64,0,615.1908,moe_ck2stages_gemm1_256x64x64x128_1x4_TypeCast_v1_Nswizzle0_no_MulRoutedWeight1_silu,0.0%,314.3421,moe_ck2stages_gemm2_256x64x128x128_1x4_TypeCast_v1_Nswizzle0_no_MulRoutedWeight0,0.0%,929.5329,nan
256,512,7168,512,256,8,ActivationType.Silu,torch.bfloat16,torch.bfloat16,torch.bfloat16,QuantType.No,1,1,64,0,625.1718,moe_ck2stages_gemm1_256x64x64x128_1x4_TypeCast_v1_Nswizzle0_no_MulRoutedWeight1_silu,0.0%,330.7111,moe_ck2stages_gemm2_256x64x128x128_1x4_TypeCast_v1_Nswizzle0_no_MulRoutedWeight0,0.0%,955.8829,nan
256,1024,7168,512,256,8,ActivationType.Silu,torch.bfloat16,torch.bfloat16,torch.bfloat16,QuantType.No,1,1,64,0,648.8599,moe_ck2stages_gemm1_256x64x64x64_1x4_TypeCast_v1_Nswizzle0_no_MulRoutedWeight1_silu,0.0%,362.3305,moe_ck2stages_gemm2_256x64x128x128_1x4_TypeCast_v1_Nswizzle0_no_MulRoutedWeight0,0.0%,1011.1904,nan
256,16,7168,256,256,8,ActivationType.Silu,torch.bfloat16,torch.bfloat16,torch.bfloat16,QuantType.No,1,0,32,0,127.4991,moe_ck2stages_gemm1_256x32x64x128_1x4_TypeCast_v1_Nswizzle0_no_MulRoutedWeight0_silu,0.0%,68.6181,moe_ck2stages_gemm2_256x32x128x128_1x4_TypeCast_v1_Nswizzle0_no_MulRoutedWeight1,1.4%,196.1172,nan
256,32,7168,256,256,8,ActivationType.Silu,torch.bfloat16,torch.bfloat16,torch.bfloat16,QuantType.No,1,0,32,0,199.8024,moe_ck2stages_gemm1_256x32x64x128_1x4_TypeCast_v1_Nswizzle0_no_MulRoutedWeight0_silu,0.0%,102.7948,moe_ck2stages_gemm2_256x32x128x128_1x4_TypeCast_v1_Nswizzle0_no_MulRoutedWeight1,1.3%,302.5972,nan
256,64,7168,256,256,8,ActivationType.Silu,torch.bfloat16,torch.bfloat16,torch.bfloat16,QuantType.No,1,0,32,0,277.8706,moe_ck2stages_gemm1_256x32x64x128_1x4_TypeCast_v1_Nswizzle0_no_MulRoutedWeight0_silu,0.0%,143.4176,moe_ck2stages_gemm2_256x32x128x128_1x4_TypeCast_v1_Nswizzle0_no_MulRoutedWeight1,1.3%,421.2882,nan
256,128,7168,256,256,8,ActivationType.Silu,torch.bfloat16,torch.bfloat16,torch.bfloat16,QuantType.No,1,0,32,0,299.8742,moe_ck2stages_gemm1_256x32x64x128_1x4_TypeCast_v1_Nswizzle0_no_MulRoutedWeight0_silu,0.0%,160.3621,moe_ck2stages_gemm2_256x32x128x128_1x4_TypeCast_v1_Nswizzle0_no_MulRoutedWeight1,1.3%,460.2363,nan
256,256,7168,256,256,8,ActivationType.Silu,torch.bfloat16,torch.bfloat16,torch.bfloat16,QuantType.No,1,0,32,0,312.6948,moe_ck2stages_gemm1_256x32x64x128_1x4_TypeCast_v1_Nswizzle0_no_MulRoutedWeight0_silu,0.0%,170.2932,moe_ck2stages_gemm2_256x32x128x128_1x4_TypeCast_v1_Nswizzle0_no_MulRoutedWeight1,1.3%,482.988,nan
256,512,7168,256,256,8,ActivationType.Silu,torch.bfloat16,torch.bfloat16,torch.bfloat16,QuantType.No,1,0,32,0,317.9155,moe_ck2stages_gemm1_256x32x64x128_1x4_TypeCast_v1_Nswizzle0_no_MulRoutedWeight0_silu,0.0%,184.8675,moe_ck2stages_gemm2_256x32x128x128_1x4_TypeCast_v1_Nswizzle0_no_MulRoutedWeight1,1.3%,502.783,nan
256,1024,7168,256,256,8,ActivationType.Silu,torch.bfloat16,torch.bfloat16,torch.bfloat16,QuantType.No,1,0,64,0,332.9115,moe_ck2stages_gemm1_256x64x64x128_1x4_TypeCast_v1_Nswizzle0_no_MulRoutedWeight0_silu,0.0%,229.6731,moe_ck2stages_gemm2_256x64x128x128_1x4_TypeCast_v1_Nswizzle0_no_MulRoutedWeight1,1.3%,562.5846,nan
256,16,7168,256,256,8,ActivationType.Silu,torch.bfloat16,torch.bfloat16,torch.bfloat16,QuantType.No,1,1,32,0,127.4765,moe_ck2stages_gemm1_256x32x64x128_1x4_TypeCast_v1_Nswizzle0_no_MulRoutedWeight1_silu,0.0%,69.0058,moe_ck2stages_gemm2_256x32x128x128_1x4_TypeCast_v1_Nswizzle0_no_MulRoutedWeight0,0.0%,196.4823,nan
256,32,7168,256,256,8,ActivationType.Silu,torch.bfloat16,torch.bfloat16,torch.bfloat16,QuantType.No,1,1,64,0,207.3725,moe_ck2stages_gemm1_256x64x64x128_1x4_TypeCast_v1_Nswizzle0_no_MulRoutedWeight1_silu,0.0%,106.9836,moe_ck2stages_gemm2_256x64x128x128_1x4_TypeCast_v1_Nswizzle0_no_MulRoutedWeight0,0.0%,314.3561,nan
256,64,7168,256,256,8,ActivationType.Silu,torch.bfloat16,torch.bfloat16,torch.bfloat16,QuantType.No,1,1,32,0,271.9849,moe_ck2stages_gemm1_256x32x64x128_1x4_TypeCast_v1_Nswizzle0_no_MulRoutedWeight1_silu,0.0%,137.9562,moe_ck2stages_gemm2_256x32x128x128_1x4_TypeCast_v1_Nswizzle0_no_MulRoutedWeight0,0.0%,409.9411,nan
256,128,7168,256,256,8,ActivationType.Silu,torch.bfloat16,torch.bfloat16,torch.bfloat16,QuantType.No,1,1,64,0,301.5563,moe_ck2stages_gemm1_256x64x64x128_1x4_TypeCast_v1_Nswizzle0_no_MulRoutedWeight1_silu,0.0%,158.8191,moe_ck2stages_gemm2_256x64x128x128_1x4_TypeCast_v1_Nswizzle0_no_MulRoutedWeight0,0.0%,460.3754,nan
256,256,7168,256,256,8,ActivationType.Silu,torch.bfloat16,torch.bfloat16,torch.bfloat16,QuantType.No,1,1,64,0,312.246,moe_ck2stages_gemm1_256x64x64x128_1x4_TypeCast_v1_Nswizzle0_no_MulRoutedWeight1_silu,0.0%,167.3812,moe_ck2stages_gemm2_256x64x128x128_1x4_TypeCast_v1_Nswizzle0_no_MulRoutedWeight0,0.0%,479.6272,nan
256,512,7168,256,256,8,ActivationType.Silu,torch.bfloat16,torch.bfloat16,torch.bfloat16,QuantType.No,1,1,64,0,317.8334,moe_ck2stages_gemm1_256x64x64x128_1x4_TypeCast_v1_Nswizzle0_no_MulRoutedWeight1_silu,0.0%,182.3294,moe_ck2stages_gemm2_256x64x128x128_1x4_TypeCast_v1_Nswizzle0_no_MulRoutedWeight0,0.0%,500.1628,nan
256,1024,7168,256,256,8,ActivationType.Silu,torch.bfloat16,torch.bfloat16,torch.bfloat16,QuantType.No,1,1,64,0,332.3753,moe_ck2stages_gemm1_256x64x64x64_1x4_TypeCast_v1_Nswizzle0_no_MulRoutedWeight1_silu,0.0%,225.2754,moe_ck2stages_gemm2_256x64x128x128_1x4_TypeCast_v1_Nswizzle0_no_MulRoutedWeight0,0.0%,557.6506999999999,nan
256,16,7168,512,256,8,ActivationType.Silu,torch.bfloat16,torch.float8_e4m3fn,torch.float8_e4m3fn,QuantType.per_Tensor,1,0,32,0,137.606,moe_ck2stages_gemm1_256x32x64x256_1x4_TypeCast_v1_Nswizzle0_per_tensor_MulRoutedWeight0_silu,0.0%,68.0979,moe_ck2stages_gemm2_256x32x128x256_1x4_TypeCast_v1_Nswizzle0_per_tensor_MulRoutedWeight1,2.7%,205.7039,nan
256,32,7168,512,256,8,ActivationType.Silu,torch.bfloat16,torch.float8_e4m3fn,torch.float8_e4m3fn,QuantType.per_Tensor,1,0,32,0,212.5738,moe_ck2stages_gemm1_256x32x64x256_1x4_TypeCast_v1_Nswizzle0_per_tensor_MulRoutedWeight0_silu,0.0%,104.3245,moe_ck2stages_gemm2_256x32x128x256_1x4_TypeCast_v1_Nswizzle0_per_tensor_MulRoutedWeight1,2.8%,316.8983,nan
256,64,7168,512,256,8,ActivationType.Silu,torch.bfloat16,torch.float8_e4m3fn,torch.float8_e4m3fn,QuantType.per_Tensor,1,0,32,0,271.0619,moe_ck2stages_gemm1_256x32x64x256_1x4_TypeCast_v1_Nswizzle0_per_tensor_MulRoutedWeight0_silu,0.0%,139.0758,moe_ck2stages_gemm2_256x32x128x256_1x4_TypeCast_v1_Nswizzle0_per_tensor_MulRoutedWeight1,2.8%,410.1377,nan
256,128,7168,512,256,8,ActivationType.Silu,torch.bfloat16,torch.float8_e4m3fn,torch.float8_e4m3fn,QuantType.per_Tensor,1,0,32,0,305.9851,moe_ck2stages_gemm1_256x32x64x256_1x4_TypeCast_v1_Nswizzle0_per_tensor_MulRoutedWeight0_silu,0.0%,159.4656,moe_ck2stages_gemm2_256x32x128x256_1x4_TypeCast_v1_Nswizzle0_per_tensor_MulRoutedWeight1,2.8%,465.4507,nan
256,256,7168,512,256,8,ActivationType.Silu,torch.bfloat16,torch.float8_e4m3fn,torch.float8_e4m3fn,QuantType.per_Tensor,1,0,64,0,312.9204,moe_ck2stages_gemm1_256x64x64x256_1x4_TypeCast_v1_Nswizzle0_per_tensor_MulRoutedWeight0_silu,0.0%,167.9833,moe_ck2stages_gemm2_256x64x128x256_1x4_TypeCast_v1_Nswizzle0_per_tensor_MulRoutedWeight1,2.8%,480.9037,nan
256,512,7168,512,256,8,ActivationType.Silu,torch.bfloat16,torch.float8_e4m3fn,torch.float8_e4m3fn,QuantType.per_Tensor,1,0,32,0,318.2949,moe_ck2stages_gemm1_256x32x64x256_1x4_TypeCast_v1_Nswizzle0_per_tensor_MulRoutedWeight0_silu,0.0%,182.2957,moe_ck2stages_gemm2_256x32x128x256_1x4_TypeCast_v1_Nswizzle0_per_tensor_MulRoutedWeight1,2.8%,500.5906,nan
256,1024,7168,512,256,8,ActivationType.Silu,torch.bfloat16,torch.float8_e4m3fn,torch.float8_e4m3fn,QuantType.per_Tensor,1,0,64,0,326.4982,_ZN5aiter44fmoe_stage1_bf16_pertokenFp8_g1u1_64x256_pf2E,0.0%,227.6336,moe_ck2stages_gemm2_256x64x128x256_1x4_TypeCast_v1_Nswizzle0_per_tensor_MulRoutedWeight1,2.8%,554.1318,nan
256,16,7168,512,256,8,ActivationType.Silu,torch.bfloat16,torch.float8_e4m3fn,torch.float8_e4m3fn,QuantType.per_Tensor,1,1,32,0,116.8782,moe_ck2stages_gemm1_256x32x64x256_1x4_TypeCast_v1_Nswizzle0_per_tensor_MulRoutedWeight1_silu,0.0%,62.1114,moe_ck2stages_gemm2_256x32x128x256_1x4_TypeCast_v1_Nswizzle0_per_tensor_MulRoutedWeight0,0.0%,178.9896,nan
256,32,7168,512,256,8,ActivationType.Silu,torch.bfloat16,torch.float8_e4m3fn,torch.float8_e4m3fn,QuantType.per_Tensor,1,1,32,0,213.2745,moe_ck2stages_gemm1_256x32x64x256_1x4_TypeCast_v1_Nswizzle0_per_tensor_MulRoutedWeight1_silu,0.0%,105.1926,moe_ck2stages_gemm2_256x32x128x256_1x4_TypeCast_v1_Nswizzle0_per_tensor_MulRoutedWeight0,0.0%,318.4671,nan
256,64,7168,512,256,8,ActivationType.Silu,torch.bfloat16,torch.float8_e4m3fn,torch.float8_e4m3fn,QuantType.per_Tensor,1,1,32,0,263.7414,moe_ck2stages_gemm1_256x32x64x256_1x4_TypeCast_v1_Nswizzle0_per_tensor_MulRoutedWeight1_silu,0.0%,135.6834,moe_ck2stages_gemm2_256x32x128x256_1x4_TypeCast_v1_Nswizzle0_per_tensor_MulRoutedWeight0,0.0%,399.4248,nan
256,128,7168,512,256,8,ActivationType.Silu,torch.bfloat16,torch.float8_e4m3fn,torch.float8_e4m3fn,QuantType.per_Tensor,1,1,64,0,307.2551,moe_ck2stages_gemm1_256x64x64x256_1x4_TypeCast_v1_Nswizzle0_per_tensor_MulRoutedWeight1_silu,0.0%,158.9091,moe_ck2stages_gemm2_256x64x128x256_1x4_TypeCast_v1_Nswizzle0_per_tensor_MulRoutedWeight0,0.0%,466.1642000000001,nan
256,256,7168,512,256,8,ActivationType.Silu,torch.bfloat16,torch.float8_e4m3fn,torch.float8_e4m3fn,QuantType.per_Tensor,1,1,64,0,313.0156,moe_ck2stages_gemm1_256x64x64x256_1x4_TypeCast_v1_Nswizzle0_per_tensor_MulRoutedWeight1_silu,0.0%,165.6992,moe_ck2stages_gemm2_256x64x128x256_1x4_TypeCast_v1_Nswizzle0_per_tensor_MulRoutedWeight0,0.0%,478.7148,nan
256,512,7168,512,256,8,ActivationType.Silu,torch.bfloat16,torch.float8_e4m3fn,torch.float8_e4m3fn,QuantType.per_Tensor,1,1,32,0,319.24,moe_ck2stages_gemm1_256x32x64x256_1x4_TypeCast_v1_Nswizzle0_per_tensor_MulRoutedWeight1_silu,0.0%,181.8332,moe_ck2stages_gemm2_256x32x128x256_1x4_TypeCast_v1_Nswizzle0_per_tensor_MulRoutedWeight0,0.0%,501.0732,nan
256,1024,7168,512,256,8,ActivationType.Silu,torch.bfloat16,torch.float8_e4m3fn,torch.float8_e4m3fn,QuantType.per_Tensor,1,1,64,0,326.6711,_ZN5aiter53fmoe_stage1_bf16_pertokenFp8_doweight_g1u1_64x256_pf2E,0.0%,228.2788,moe_ck2stages_gemm2_256x64x128x256_1x4_TypeCast_v1_Nswizzle0_per_tensor_MulRoutedWeight0,0.0%,554.9499000000001,nan
256,16,7168,256,256,8,ActivationType.Silu,torch.bfloat16,torch.float8_e4m3fn,torch.float8_e4m3fn,QuantType.per_Tensor,1,0,32,0,65.7093,moe_ck2stages_gemm1_256x32x64x256_1x4_TypeCast_v1_Nswizzle0_per_tensor_MulRoutedWeight0_silu,0.0%,39.2158,moe_ck2stages_gemm2_256x32x128x256_1x4_TypeCast_v1_Nswizzle0_per_tensor_MulRoutedWeight1,1.3%,104.9251,nan
256,32,7168,256,256,8,ActivationType.Silu,torch.bfloat16,torch.float8_e4m3fn,torch.float8_e4m3fn,QuantType.per_Tensor,1,0,32,0,104.4603,moe_ck2stages_gemm1_256x32x64x256_1x4_TypeCast_v1_Nswizzle0_per_tensor_MulRoutedWeight0_silu,0.0%,58.4566,moe_ck2stages_gemm2_256x32x128x256_1x4_TypeCast_v1_Nswizzle0_per_tensor_MulRoutedWeight1,1.3%,162.9169,nan
256,64,7168,256,256,8,ActivationType.Silu,torch.bfloat16,torch.float8_e4m3fn,torch.float8_e4m3fn,QuantType.per_Tensor,1,0,32,0,142.3228,moe_ck2stages_gemm1_256x32x64x256_1x4_TypeCast_v1_Nswizzle0_per_tensor_MulRoutedWeight0_silu,0.0%,78.2952,moe_ck2stages_gemm2_256x32x128x256_1x4_TypeCast_v1_Nswizzle0_per_tensor_MulRoutedWeight1,1.3%,220.618,nan
256,128,7168,256,256,8,ActivationType.Silu,torch.bfloat16,torch.float8_e4m3fn,torch.float8_e4m3fn,QuantType.per_Tensor,1,0,32,0,154.4684,moe_ck2stages_gemm1_256x32x64x256_1x4_TypeCast_v1_Nswizzle0_per_tensor_MulRoutedWeight0_silu,0.0%,85.4546,moe_ck2stages_gemm2_256x32x128x256_1x4_TypeCast_v1_Nswizzle0_per_tensor_MulRoutedWeight1,1.3%,239.923,nan
256,256,7168,256,256,8,ActivationType.Silu,torch.bfloat16,torch.float8_e4m3fn,torch.float8_e4m3fn,QuantType.per_Tensor,1,0,32,0,159.2133,moe_ck2stages_gemm1_256x32x64x256_1x4_TypeCast_v1_Nswizzle0_per_tensor_MulRoutedWeight0_silu,0.0%,93.1649,moe_ck2stages_gemm2_256x32x128x256_1x4_TypeCast_v1_Nswizzle0_per_tensor_MulRoutedWeight1,1.3%,252.3782,nan
256,512,7168,256,256,8,ActivationType.Silu,torch.bfloat16,torch.float8_e4m3fn,torch.float8_e4m3fn,QuantType.per_Tensor,1,0,32,0,162.4645,moe_ck2stages_gemm1_256x32x64x256_1x4_TypeCast_v1_Nswizzle0_per_tensor_MulRoutedWeight0_silu,0.0%,114.5867,moe_ck2stages_gemm2_256x32x128x256_1x4_TypeCast_v1_Nswizzle0_per_tensor_MulRoutedWeight1,1.3%,277.0512,nan
256,1024,7168,256,256,8,ActivationType.Silu,torch.bfloat16,torch.float8_e4m3fn,torch.float8_e4m3fn,QuantType.per_Tensor,1,0,64,0,169.8598,moe_ck2stages_gemm1_256x64x64x256_1x4_TypeCast_v1_Nswizzle0_per_tensor_MulRoutedWeight0_silu,0.0%,207.0476,moe_ck2stages_gemm2_256x64x128x256_1x4_TypeCast_v1_Nswizzle0_per_tensor_MulRoutedWeight1,1.3%,376.9074,nan
256,16,7168,256,256,8,ActivationType.Silu,torch.bfloat16,torch.float8_e4m3fn,torch.float8_e4m3fn,QuantType.per_Tensor,1,1,32,0,64.5225,moe_ck2stages_gemm1_256x32x64x256_1x4_TypeCast_v1_Nswizzle0_per_tensor_MulRoutedWeight1_silu,0.0%,37.9683,moe_ck2stages_gemm2_256x32x128x256_1x4_TypeCast_v1_Nswizzle0_per_tensor_MulRoutedWeight0,0.0%,102.4908,nan
256,32,7168,256,256,8,ActivationType.Silu,torch.bfloat16,torch.float8_e4m3fn,torch.float8_e4m3fn,QuantType.per_Tensor,1,1,32,0,103.262,moe_ck2stages_gemm1_256x32x64x256_1x4_TypeCast_v1_Nswizzle0_per_tensor_MulRoutedWeight1_silu,0.0%,57.4872,moe_ck2stages_gemm2_256x32x128x256_1x4_TypeCast_v1_Nswizzle0_per_tensor_MulRoutedWeight0,0.0%,160.7492,nan
256,64,7168,256,256,8,ActivationType.Silu,torch.bfloat16,torch.float8_e4m3fn,torch.float8_e4m3fn,QuantType.per_Tensor,1,1,32,0,143.6284,moe_ck2stages_gemm1_256x32x64x256_1x4_TypeCast_v1_Nswizzle0_per_tensor_MulRoutedWeight1_silu,0.0%,78.8048,moe_ck2stages_gemm2_256x32x128x256_1x4_TypeCast_v1_Nswizzle0_per_tensor_MulRoutedWeight0,0.0%,222.4332,nan
256,128,7168,256,256,8,ActivationType.Silu,torch.bfloat16,torch.float8_e4m3fn,torch.float8_e4m3fn,QuantType.per_Tensor,1,1,32,0,153.3444,moe_ck2stages_gemm1_256x32x64x256_1x4_TypeCast_v1_Nswizzle0_per_tensor_MulRoutedWeight1_silu,0.0%,86.512,moe_ck2stages_gemm2_256x32x128x256_1x4_TypeCast_v1_Nswizzle0_per_tensor_MulRoutedWeight0,0.0%,239.8564,nan
256,256,7168,256,256,8,ActivationType.Silu,torch.bfloat16,torch.float8_e4m3fn,torch.float8_e4m3fn,QuantType.per_Tensor,1,1,32,0,159.9866,moe_ck2stages_gemm1_256x32x64x256_1x4_TypeCast_v1_Nswizzle0_per_tensor_MulRoutedWeight1_silu,0.0%,94.9291,moe_ck2stages_gemm2_256x32x128x256_1x4_TypeCast_v1_Nswizzle0_per_tensor_MulRoutedWeight0,0.0%,254.9157,nan
256,512,7168,256,256,8,ActivationType.Silu,torch.bfloat16,torch.float8_e4m3fn,torch.float8_e4m3fn,QuantType.per_Tensor,1,1,32,0,162.2757,moe_ck2stages_gemm1_256x32x64x256_1x4_TypeCast_v1_Nswizzle0_per_tensor_MulRoutedWeight1_silu,0.0%,113.4555,moe_ck2stages_gemm2_256x32x128x256_1x4_TypeCast_v1_Nswizzle0_per_tensor_MulRoutedWeight0,0.0%,275.7312,nan
256,1024,7168,256,256,8,ActivationType.Silu,torch.bfloat16,torch.float8_e4m3fn,torch.float8_e4m3fn,QuantType.per_Tensor,1,1,64,0,169.9357,moe_ck2stages_gemm1_256x64x64x256_1x4_TypeCast_v1_Nswizzle0_per_tensor_MulRoutedWeight1_silu,0.0%,206.6223,moe_ck2stages_gemm2_256x64x128x256_1x4_TypeCast_v1_Nswizzle0_per_tensor_MulRoutedWeight0,0.0%,376.558,nan
256,16,7168,512,256,8,ActivationType.Silu,torch.bfloat16,torch.float8_e4m3fn,torch.float8_e4m3fn,QuantType.per_Token,1,0,32,0,128.7185,_ZN5aiter48fmoe_stage1_bf16_pertokenFp8_g1u1_32x256_2tg_pf3E,0.0%,71.4745,moe_ck2stages_gemm2_256x32x128x256_1x4_TypeCast_v1_Nswizzle0_per_token_MulRoutedWeight1,2.8%,200.193,nan
256,32,7168,512,256,8,ActivationType.Silu,torch.bfloat16,torch.float8_e4m3fn,torch.float8_e4m3fn,QuantType.per_Token,1,0,32,0,207.5363,_ZN5aiter44fmoe_stage1_bf16_pertokenFp8_g1u1_32x512_pf3E,0.0%,108.3467,moe_ck2stages_gemm2_256x32x128x256_1x4_TypeCast_v1_Nswizzle0_per_token_MulRoutedWeight1,3.0%,315.88300000000004,nan
256,64,7168,512,256,8,ActivationType.Silu,torch.bfloat16,torch.float8_e4m3fn,torch.float8_e4m3fn,QuantType.per_Token,1,0,32,0,275.0654,_ZN5aiter48fmoe_stage1_bf16_pertokenFp8_g1u1_32x256_2tg_pf3E,0.0%,143.1273,moe_ck2stages_gemm2_256x32x128x256_1x4_TypeCast_v1_Nswizzle0_per_token_MulRoutedWeight1,2.9%,418.1927,nan
256,128,7168,512,256,8,ActivationType.Silu,torch.bfloat16,torch.float8_e4m3fn,torch.float8_e4m3fn,QuantType.per_Token,1,0,32,0,309.0034,moe_ck2stages_gemm1_256x32x64x256_1x4_TypeCast_v1_Nswizzle0_per_token_MulRoutedWeight0_silu,0.0%,167.3375,moe_ck2stages_gemm2_256x32x128x256_1x4_TypeCast_v1_Nswizzle0_per_token_MulRoutedWeight1,2.8%,476.3409,nan
256,256,7168,512,256,8,ActivationType.Silu,torch.bfloat16,torch.float8_e4m3fn,torch.float8_e4m3fn,QuantType.per_Token,1,0,32,0,313.2463,_ZN5aiter48fmoe_stage1_bf16_pertokenFp8_g1u1_32x256_2tg_pf3E,0.1%,171.5152,moe_ck2stages_gemm2_256x32x128x256_1x4_TypeCast_v1_Nswizzle0_per_token_MulRoutedWeight1,2.8%,484.7615,nan
256,512,7168,512,256,8,ActivationType.Silu,torch.bfloat16,torch.float8_e4m3fn,torch.float8_e4m3fn,QuantType.per_Token,1,0,32,0,314.8282,_ZN5aiter44fmoe_stage1_bf16_pertokenFp8_g1u1_32x512_pf2E,0.0%,193.4713,moe_ck2stages_gemm2_256x32x128x256_1x4_TypeCast_v1_Nswizzle0_per_token_MulRoutedWeight1,2.8%,508.2995,nan
256,1024,7168,512,256,8,ActivationType.Silu,torch.bfloat16,torch.float8_e4m3fn,torch.float8_e4m3fn,QuantType.per_Token,1,0,32,0,328.5025,_ZN5aiter47fmoe_stage1_bf16_pertokenFp8_g1u1_32x64_4tg_pf2E,0.0%,254.0907,moe_ck2stages_gemm2_256x32x128x256_1x4_TypeCast_v1_Nswizzle0_per_token_MulRoutedWeight1,2.8%,582.5932,nan
256,16,7168,512,256,8,ActivationType.Silu,torch.bfloat16,torch.float8_e4m3fn,torch.float8_e4m3fn,QuantType.per_Token,1,1,32,0,120.9845,_ZN5aiter57fmoe_stage1_bf16_pertokenFp8_doweight_g1u1_32x256_2tg_pf3E,0.0%,67.3355,moe_ck2stages_gemm2_256x32x128x256_1x4_TypeCast_v1_Nswizzle0_per_token_MulRoutedWeight0,0.0%,188.32,nan
256,32,7168,512,256,8,ActivationType.Silu,torch.bfloat16,torch.float8_e4m3fn,torch.float8_e4m3fn,QuantType.per_Token,1,1,32,0,208.9454,_ZN5aiter53fmoe_stage1_bf16_pertokenFp8_doweight_g1u1_32x512_pf3E,0.0%,107.3961,moe_ck2stages_gemm2_256x32x128x256_1x4_TypeCast_v1_Nswizzle0_per_token_MulRoutedWeight0,0.0%,316.3415,nan
256,64,7168,512,256,8,ActivationType.Silu,torch.bfloat16,torch.float8_e4m3fn,torch.float8_e4m3fn,QuantType.per_Token,1,1,32,0,271.9205,moe_ck2stages_gemm1_256x32x64x256_1x4_TypeCast_v1_Nswizzle0_per_token_MulRoutedWeight1_silu,0.0%,141.24,moe_ck2stages_gemm2_256x32x128x256_1x4_TypeCast_v1_Nswizzle0_per_token_MulRoutedWeight0,0.0%,413.1605,nan
256,128,7168,512,256,8,ActivationType.Silu,torch.bfloat16,torch.float8_e4m3fn,torch.float8_e4m3fn,QuantType.per_Token,1,1,32,0,310.551,_ZN5aiter57fmoe_stage1_bf16_pertokenFp8_doweight_g1u1_32x256_2tg_pf3E,0.0%,166.1306,moe_ck2stages_gemm2_256x32x128x256_1x4_TypeCast_v1_Nswizzle0_per_token_MulRoutedWeight0,0.0%,476.6816,nan
256,256,7168,512,256,8,ActivationType.Silu,torch.bfloat16,torch.float8_e4m3fn,torch.float8_e4m3fn,QuantType.per_Token,1,1,32,0,313.2787,_ZN5aiter53fmoe_stage1_bf16_pertokenFp8_doweight_g1u1_32x512_pf2E,0.0%,170.1213,moe_ck2stages_gemm2_256x32x128x256_1x4_TypeCast_v1_Nswizzle0_per_token_MulRoutedWeight0,0.0%,483.4,nan
256,512,7168,512,256,8,ActivationType.Silu,torch.bfloat16,torch.float8_e4m3fn,torch.float8_e4m3fn,QuantType.per_Token,1,1,32,0,312.9451,_ZN5aiter53fmoe_stage1_bf16_pertokenFp8_doweight_g1u1_32x512_pf2E,0.0%,192.7392,moe_ck2stages_gemm2_256x32x128x256_1x4_TypeCast_v1_Nswizzle0_per_token_MulRoutedWeight0,0.0%,505.6843,nan
256,1024,7168,512,256,8,ActivationType.Silu,torch.bfloat16,torch.float8_e4m3fn,torch.float8_e4m3fn,QuantType.per_Token,1,1,32,0,331.989,_ZN5aiter56fmoe_stage1_bf16_pertokenFp8_doweight_g1u1_32x64_4tg_pf2E,0.0%,242.9988,moe_ck2stages_gemm2_256x32x128x256_1x4_TypeCast_v1_Nswizzle0_per_token_MulRoutedWeight0,0.0%,574.9878,nan
256,16,7168,256,256,8,ActivationType.Silu,torch.bfloat16,torch.float8_e4m3fn,torch.float8_e4m3fn,QuantType.per_Token,1,0,32,0,61.5216,_ZN5aiter48fmoe_stage1_bf16_pertokenFp8_g1u1_32x128_3tg_pf3E,0.0%,42.0747,moe_ck2stages_gemm2_256x32x128x256_1x4_TypeCast_v1_Nswizzle0_per_token_MulRoutedWeight1,1.3%,103.5963,nan
256,32,7168,256,256,8,ActivationType.Silu,torch.bfloat16,torch.float8_e4m3fn,torch.float8_e4m3fn,QuantType.per_Token,1,0,32,0,103.7974,_ZN5aiter47fmoe_stage1_bf16_pertokenFp8_g1u1_32x64_4tg_pf2E,0.0%,65.1641,moe_ck2stages_gemm2_256x32x128x256_1x4_TypeCast_v1_Nswizzle0_per_token_MulRoutedWeight1,1.3%,168.9615,nan
256,64,7168,256,256,8,ActivationType.Silu,torch.bfloat16,torch.float8_e4m3fn,torch.float8_e4m3fn,QuantType.per_Token,1,0,32,0,134.7205,_ZN5aiter48fmoe_stage1_bf16_pertokenFp8_g1u1_32x256_2tg_pf3E,0.0%,83.2291,moe_ck2stages_gemm2_256x32x128x256_1x4_TypeCast_v1_Nswizzle0_per_token_MulRoutedWeight1,1.3%,217.9496,nan
256,128,7168,256,256,8,ActivationType.Silu,torch.bfloat16,torch.float8_e4m3fn,torch.float8_e4m3fn,QuantType.per_Token,1,0,32,0,157.2978,_ZN5aiter48fmoe_stage1_bf16_pertokenFp8_g1u1_32x256_2tg_pf2E,0.0%,98.6288,moe_ck2stages_gemm2_256x32x128x256_1x4_TypeCast_v1_Nswizzle0_per_token_MulRoutedWeight1,1.3%,255.9266,nan
256,256,7168,256,256,8,ActivationType.Silu,torch.bfloat16,torch.float8_e4m3fn,torch.float8_e4m3fn,QuantType.per_Token,1,0,32,0,158.0901,_ZN5aiter48fmoe_stage1_bf16_pertokenFp8_g1u1_32x256_2tg_pf2E,0.0%,107.5609,moe_ck2stages_gemm2_256x32x128x256_1x4_TypeCast_v1_Nswizzle0_per_token_MulRoutedWeight1,1.3%,265.651,nan
256,512,7168,256,256,8,ActivationType.Silu,torch.bfloat16,torch.float8_e4m3fn,torch.float8_e4m3fn,QuantType.per_Token,1,0,32,0,159.828,_ZN5aiter48fmoe_stage1_bf16_pertokenFp8_g1u1_32x256_2tg_pf2E,0.0%,138.8408,moe_ck2stages_gemm2_256x32x128x256_1x4_TypeCast_v1_Nswizzle0_per_token_MulRoutedWeight1,1.3%,298.66880000000003,nan
256,1024,7168,256,256,8,ActivationType.Silu,torch.bfloat16,torch.float8_e4m3fn,torch.float8_e4m3fn,QuantType.per_Token,1,0,64,0,163.426,_ZN5aiter48fmoe_stage1_bf16_pertokenFp8_g1u1_64x128_2tg_pf2E,0.0%,227.9884,moe_ck2stages_gemm2_256x64x128x256_1x4_TypeCast_v1_Nswizzle0_per_token_MulRoutedWeight1,1.3%,391.4144,nan
256,16,7168,256,256,8,ActivationType.Silu,torch.bfloat16,torch.float8_e4m3fn,torch.float8_e4m3fn,QuantType.per_Token,1,1,32,0,65.5912,_ZN5aiter57fmoe_stage1_bf16_pertokenFp8_doweight_g1u1_32x128_3tg_pf3E,0.0%,42.6546,moe_ck2stages_gemm2_256x32x128x256_1x4_TypeCast_v1_Nswizzle0_per_token_MulRoutedWeight0,0.0%,108.2458,nan
256,32,7168,256,256,8,ActivationType.Silu,torch.bfloat16,torch.float8_e4m3fn,torch.float8_e4m3fn,QuantType.per_Token,1,1,32,0,98.2698,_ZN5aiter56fmoe_stage1_bf16_pertokenFp8_doweight_g1u1_32x64_4tg_pf2E,0.0%,59.9297,moe_ck2stages_gemm2_256x32x128x256_1x4_TypeCast_v1_Nswizzle0_per_token_MulRoutedWeight0,0.0%,158.1995,nan
256,64,7168,256,256,8,ActivationType.Silu,torch.bfloat16,torch.float8_e4m3fn,torch.float8_e4m3fn,QuantType.per_Token,1,1,32,0,138.6775,_ZN5aiter57fmoe_stage1_bf16_pertokenFp8_doweight_g1u1_32x256_2tg_pf3E,0.0%,80.5739,moe_ck2stages_gemm2_256x32x128x256_1x4_TypeCast_v1_Nswizzle0_per_token_MulRoutedWeight0,0.0%,219.2514,nan
256,128,7168,256,256,8,ActivationType.Silu,torch.bfloat16,torch.float8_e4m3fn,torch.float8_e4m3fn,QuantType.per_Token,1,1,32,0,156.0668,moe_ck2stages_gemm1_256x32x64x256_1x4_TypeCast_v1_Nswizzle0_per_token_MulRoutedWeight1_silu,0.0%,92.12,moe_ck2stages_gemm2_256x32x128x256_1x4_TypeCast_v1_Nswizzle0_per_token_MulRoutedWeight0,0.0%,248.1868,nan
256,256,7168,256,256,8,ActivationType.Silu,torch.bfloat16,torch.float8_e4m3fn,torch.float8_e4m3fn,QuantType.per_Token,1,1,32,0,159.2601,_ZN5aiter57fmoe_stage1_bf16_pertokenFp8_doweight_g1u1_32x256_2tg_pf2E,0.0%,103.2168,moe_ck2stages_gemm2_256x32x128x256_1x4_TypeCast_v1_Nswizzle0_per_token_MulRoutedWeight0,0.0%,262.4769,nan
256,512,7168,256,256,8,ActivationType.Silu,torch.bfloat16,torch.float8_e4m3fn,torch.float8_e4m3fn,QuantType.per_Token,1,1,32,0,159.7849,_ZN5aiter57fmoe_stage1_bf16_pertokenFp8_doweight_g1u1_32x256_2tg_pf2E,0.0%,129.9343,moe_ck2stages_gemm2_256x32x128x256_1x4_TypeCast_v1_Nswizzle0_per_token_MulRoutedWeight0,0.0%,289.7192,nan
256,1024,7168,256,256,8,ActivationType.Silu,torch.bfloat16,torch.float8_e4m3fn,torch.float8_e4m3fn,QuantType.per_Token,1,1,64,0,164.3403,_ZN5aiter53fmoe_stage1_bf16_pertokenFp8_doweight_g1u1_64x256_pf2E,0.0%,220.6618,moe_ck2stages_gemm2_256x64x128x256_1x4_TypeCast_v1_Nswizzle0_per_token_MulRoutedWeight0,0.0%,385.0021,nan
256,16,7168,512,256,8,ActivationType.Silu,torch.bfloat16,torch.float8_e4m3fn,torch.float8_e4m3fn,QuantType.per_1x128,1,0,64,0,125.5129,_ZN5aiter55fmoe_stage1_bf16_pertokenFp8_blockscale_g1u1_64x256_pf3E,96.5%,93.3652,moe_ck2stages_gemm2_256x64x128x128_1x4_MulABScaleExpertWeightA8W8blkscale_v3_Nswizzle0_per_1x128_MulRoutedWeight1,2.6%,218.8781,nan
256,32,7168,512,256,8,ActivationType.Silu,torch.bfloat16,torch.float8_e4m3fn,torch.float8_e4m3fn,QuantType.per_1x128,1,0,64,0,209.7064,_ZN5aiter59fmoe_stage1_bf16_pertokenFp8_blockscale_g1u1_64x128_2tg_pf3E,99.5%,145.146,moe_ck2stages_gemm2_256x64x128x128_1x4_MulABScaleExpertWeightA8W8blkscale_v3_Nswizzle0_per_1x128_MulRoutedWeight1,2.8%,354.8524,nan
256,64,7168,512,256,8,ActivationType.Silu,torch.bfloat16,torch.float8_e4m3fn,torch.float8_e4m3fn,QuantType.per_1x128,1,0,64,0,266.9879,_ZN5aiter59fmoe_stage1_bf16_pertokenFp8_blockscale_g1u1_64x128_2tg_pf2E,99.5%,186.9789,moe_ck2stages_gemm2_256x64x128x128_1x4_MulABScaleExpertWeightA8W8blkscale_v3_Nswizzle0_per_1x128_MulRoutedWeight1,2.9%,453.9668,nan
256,128,7168,512,256,8,ActivationType.Silu,torch.bfloat16,torch.float8_e4m3fn,torch.float8_e4m3fn,QuantType.per_1x128,1,0,64,0,302.9716,_ZN5aiter59fmoe_stage1_bf16_pertokenFp8_blockscale_g1u1_64x128_2tg_pf3E,99.5%,220.9686,moe_ck2stages_gemm2_256x64x128x128_1x4_MulABScaleExpertWeightA8W8blkscale_v3_Nswizzle0_per_1x128_MulRoutedWeight1,2.8%,523.9402,nan
256,256,7168,512,256,8,ActivationType.Silu,torch.bfloat16,torch.float8_e4m3fn,torch.float8_e4m3fn,QuantType.per_1x128,1,0,64,0,313.5661,_ZN5aiter59fmoe_stage1_bf16_pertokenFp8_blockscale_g1u1_64x128_2tg_pf3E,99.5%,279.5519,moe_ck2stages_gemm2_256x64x128x128_1x4_MulABScaleExpertWeightA8W8blkscale_v3_Nswizzle0_per_1x128_MulRoutedWeight1,2.8%,593.1179999999999,nan
256,512,7168,512,256,8,ActivationType.Silu,torch.bfloat16,torch.float8_e4m3fn,torch.float8_e4m3fn,QuantType.per_1x128,1,0,64,0,316.5643,_ZN5aiter59fmoe_stage1_bf16_pertokenFp8_blockscale_g1u1_64x128_2tg_pf2E,99.5%,461.0233,moe_ck2stages_gemm2_256x64x128x128_1x4_MulABScaleExpertWeightA8W8blkscale_v3_Nswizzle0_per_1x128_MulRoutedWeight1,2.8%,777.5876000000001,nan
256,1024,7168,512,256,8,ActivationType.Silu,torch.bfloat16,torch.float8_e4m3fn,torch.float8_e4m3fn,QuantType.per_1x128,1,0,64,0,318.9892,_ZN5aiter55fmoe_stage1_bf16_pertokenFp8_blockscale_g1u1_64x256_pf2E,99.5%,847.1488,moe_ck2stages_gemm2_256x64x128x128_1x4_MulABScaleExpertWeightA8W8blkscale_v3_Nswizzle0_per_1x128_MulRoutedWeight1,2.8%,1166.138,nan
256,16,7168,512,256,8,ActivationType.Silu,torch.bfloat16,torch.float8_e4m3fn,torch.float8_e4m3fn,QuantType.per_1x128,1,1,64,0,146.5588,moe_ck2stages_gemm1_256x64x128x128_1x4_MulABScaleExpertWeightA8W8blkscale_v3_Nswizzle0_per_1x128_MulRoutedWeight1_silu,0.1%,95.8251,moe_ck2stages_gemm2_256x64x128x128_1x4_MulABScaleExpertWeightA8W8blkscale_v3_Nswizzle0_per_1x128_MulRoutedWeight0,0.0%,242.3839,nan
256,32,7168,512,256,8,ActivationType.Silu,torch.bfloat16,torch.float8_e4m3fn,torch.float8_e4m3fn,QuantType.per_1x128,1,1,64,0,222.7504,moe_ck2stages_gemm1_256x64x128x128_1x4_MulABScaleExpertWeightA8W8blkscale_v3_Nswizzle0_per_1x128_MulRoutedWeight1_silu,0.1%,146.7641,moe_ck2stages_gemm2_256x64x128x128_1x4_MulABScaleExpertWeightA8W8blkscale_v3_Nswizzle0_per_1x128_MulRoutedWeight0,0.0%,369.5145,nan
256,64,7168,512,256,8,ActivationType.Silu,torch.bfloat16,torch.float8_e4m3fn,torch.float8_e4m3fn,QuantType.per_1x128,1,1,64,0,305.0497,moe_ck2stages_gemm1_256x64x128x128_1x4_MulABScaleExpertWeightA8W8blkscale_v3_Nswizzle0_per_1x128_MulRoutedWeight1_silu,0.1%,200.6496,moe_ck2stages_gemm2_256x64x128x128_1x4_MulABScaleExpertWeightA8W8blkscale_v3_Nswizzle0_per_1x128_MulRoutedWeight0,0.0%,505.6993,nan
256,128,7168,512,256,8,ActivationType.Silu,torch.bfloat16,torch.float8_e4m3fn,torch.float8_e4m3fn,QuantType.per_1x128,1,1,64,0,316.019,moe_ck2stages_gemm1_256x64x128x128_1x4_MulABScaleExpertWeightA8W8blkscale_v3_Nswizzle0_per_1x128_MulRoutedWeight1_silu,0.1%,221.6866,moe_ck2stages_gemm2_256x64x128x128_1x4_MulABScaleExpertWeightA8W8blkscale_v3_Nswizzle0_per_1x128_MulRoutedWeight0,0.0%,537.7056,nan
256,256,7168,512,256,8,ActivationType.Silu,torch.bfloat16,torch.float8_e4m3fn,torch.float8_e4m3fn,QuantType.per_1x128,1,1,64,0,327.4229,moe_ck2stages_gemm1_256x64x128x128_1x4_MulABScaleExpertWeightA8W8blkscale_v3_Nswizzle0_per_1x128_MulRoutedWeight1_silu,0.1%,278.0706,moe_ck2stages_gemm2_256x64x128x128_1x4_MulABScaleExpertWeightA8W8blkscale_v3_Nswizzle0_per_1x128_MulRoutedWeight0,0.0%,605.4935,nan
256,512,7168,512,256,8,ActivationType.Silu,torch.bfloat16,torch.float8_e4m3fn,torch.float8_e4m3fn,QuantType.per_1x128,1,1,64,0,329.7892,moe_ck2stages_gemm1_256x64x128x128_1x4_MulABScaleExpertWeightA8W8blkscale_v3_Nswizzle0_per_1x128_MulRoutedWeight1_silu,0.1%,464.747,moe_ck2stages_gemm2_256x64x128x128_1x4_MulABScaleExpertWeightA8W8blkscale_v3_Nswizzle0_per_1x128_MulRoutedWeight0,0.0%,794.5362,nan
256,1024,7168,512,256,8,ActivationType.Silu,torch.bfloat16,torch.float8_e4m3fn,torch.float8_e4m3fn,QuantType.per_1x128,1,1,64,0,340.7874,moe_ck2stages_gemm1_256x64x128x128_1x4_MulABScaleExpertWeightA8W8blkscale_v3_Nswizzle0_per_1x128_MulRoutedWeight1_silu,0.1%,847.4703,moe_ck2stages_gemm2_256x64x128x128_1x4_MulABScaleExpertWeightA8W8blkscale_v3_Nswizzle0_per_1x128_MulRoutedWeight0,0.0%,1188.2577,nan
256,16,7168,256,256,8,ActivationType.Silu,torch.bfloat16,torch.float8_e4m3fn,torch.float8_e4m3fn,QuantType.per_1x128,1,0,64,0,64.8063,_ZN5aiter59fmoe_stage1_bf16_pertokenFp8_blockscale_g1u1_64x128_2tg_pf3E,96.5%,55.3156,moe_ck2stages_gemm2_256x64x128x128_1x4_MulABScaleExpertWeightA8W8blkscale_v3_Nswizzle0_per_1x128_MulRoutedWeight1,1.3%,120.1219,nan
256,32,7168,256,256,8,ActivationType.Silu,torch.bfloat16,torch.float8_e4m3fn,torch.float8_e4m3fn,QuantType.per_1x128,1,0,64,0,111.3401,_ZN5aiter55fmoe_stage1_bf16_pertokenFp8_blockscale_g1u1_64x256_pf3E,99.5%,85.7127,moe_ck2stages_gemm2_256x64x128x128_1x4_MulABScaleExpertWeightA8W8blkscale_v3_Nswizzle0_per_1x128_MulRoutedWeight1,1.3%,197.0528,nan
256,64,7168,256,256,8,ActivationType.Silu,torch.bfloat16,torch.float8_e4m3fn,torch.float8_e4m3fn,QuantType.per_1x128,1,0,64,0,145.1274,_ZN5aiter59fmoe_stage1_bf16_pertokenFp8_blockscale_g1u1_64x128_2tg_pf2E,99.5%,114.5353,moe_ck2stages_gemm2_256x64x128x128_1x4_MulABScaleExpertWeightA8W8blkscale_v3_Nswizzle0_per_1x128_MulRoutedWeight1,1.3%,259.6627,nan
256,128,7168,256,256,8,ActivationType.Silu,torch.bfloat16,torch.float8_e4m3fn,torch.float8_e4m3fn,QuantType.per_1x128,1,0,64,0,156.0831,_ZN5aiter59fmoe_stage1_bf16_pertokenFp8_blockscale_g1u1_64x128_2tg_pf3E,99.5%,137.9183,moe_ck2stages_gemm2_256x64x128x128_1x4_MulABScaleExpertWeightA8W8blkscale_v3_Nswizzle0_per_1x128_MulRoutedWeight1,1.3%,294.0014,nan
256,256,7168,256,256,8,ActivationType.Silu,torch.bfloat16,torch.float8_e4m3fn,torch.float8_e4m3fn,QuantType.per_1x128,1,0,64,0,161.8879,_ZN5aiter59fmoe_stage1_bf16_pertokenFp8_blockscale_g1u1_64x128_2tg_pf3E,99.5%,239.0528,moe_ck2stages_gemm2_256x64x128x128_1x4_MulABScaleExpertWeightA8W8blkscale_v3_Nswizzle0_per_1x128_MulRoutedWeight1,1.3%,400.9407,nan
256,512,7168,256,256,8,ActivationType.Silu,torch.bfloat16,torch.float8_e4m3fn,torch.float8_e4m3fn,QuantType.per_1x128,1,0,64,0,163.0088,_ZN5aiter59fmoe_stage1_bf16_pertokenFp8_blockscale_g1u1_64x128_2tg_pf2E,99.5%,427.814,moe_ck2stages_gemm2_256x64x128x128_1x4_MulABScaleExpertWeightA8W8blkscale_v3_Nswizzle0_per_1x128_MulRoutedWeight1,1.3%,590.8228,nan
256,1024,7168,256,256,8,ActivationType.Silu,torch.bfloat16,torch.float8_e4m3fn,torch.float8_e4m3fn,QuantType.per_1x128,1,0,64,0,166.058,_ZN5aiter55fmoe_stage1_bf16_pertokenFp8_blockscale_g1u1_64x256_pf3E,99.5%,815.3448,moe_ck2stages_gemm2_256x64x128x128_1x4_MulABScaleExpertWeightA8W8blkscale_v3_Nswizzle0_per_1x128_MulRoutedWeight1,1.3%,981.4028,nan
256,16,7168,256,256,8,ActivationType.Silu,torch.bfloat16,torch.float8_e4m3fn,torch.float8_e4m3fn,QuantType.per_1x128,1,1,64,0,78.3549,moe_ck2stages_gemm1_256x64x128x128_1x4_MulABScaleExpertWeightA8W8blkscale_v3_Nswizzle0_per_1x128_MulRoutedWeight1_silu,0.1%,59.6466,moe_ck2stages_gemm2_256x64x128x128_1x4_MulABScaleExpertWeightA8W8blkscale_v3_Nswizzle0_per_1x128_MulRoutedWeight0,0.0%,138.0015,nan
256,32,7168,256,256,8,ActivationType.Silu,torch.bfloat16,torch.float8_e4m3fn,torch.float8_e4m3fn,QuantType.per_1x128,1,1,64,0,138.2761,moe_ck2stages_gemm1_256x64x128x128_1x4_MulABScaleExpertWeightA8W8blkscale_v3_Nswizzle0_per_1x128_MulRoutedWeight1_silu,0.1%,88.0174,moe_ck2stages_gemm2_256x64x128x128_1x4_MulABScaleExpertWeightA8W8blkscale_v3_Nswizzle0_per_1x128_MulRoutedWeight0,0.0%,226.2935,nan
256,64,7168,256,256,8,ActivationType.Silu,torch.bfloat16,torch.float8_e4m3fn,torch.float8_e4m3fn,QuantType.per_1x128,1,1,64,0,153.4375,moe_ck2stages_gemm1_256x64x128x128_1x4_MulABScaleExpertWeightA8W8blkscale_v3_Nswizzle0_per_1x128_MulRoutedWeight1_silu,0.1%,115.2693,moe_ck2stages_gemm2_256x64x128x128_1x4_MulABScaleExpertWeightA8W8blkscale_v3_Nswizzle0_per_1x128_MulRoutedWeight0,0.0%,268.7068,nan
256,128,7168,256,256,8,ActivationType.Silu,torch.bfloat16,torch.float8_e4m3fn,torch.float8_e4m3fn,QuantType.per_1x128,1,1,64,0,167.2332,moe_ck2stages_gemm1_256x64x128x128_1x4_MulABScaleExpertWeightA8W8blkscale_v3_Nswizzle0_per_1x128_MulRoutedWeight1_silu,0.1%,141.1579,moe_ck2stages_gemm2_256x64x128x128_1x4_MulABScaleExpertWeightA8W8blkscale_v3_Nswizzle0_per_1x128_MulRoutedWeight0,0.0%,308.39110000000005,nan
256,256,7168,256,256,8,ActivationType.Silu,torch.bfloat16,torch.float8_e4m3fn,torch.float8_e4m3fn,QuantType.per_1x128,1,1,64,0,170.0834,moe_ck2stages_gemm1_256x64x128x128_1x4_MulABScaleExpertWeightA8W8blkscale_v3_Nswizzle0_per_1x128_MulRoutedWeight1_silu,0.1%,236.5246,moe_ck2stages_gemm2_256x64x128x128_1x4_MulABScaleExpertWeightA8W8blkscale_v3_Nswizzle0_per_1x128_MulRoutedWeight0,0.0%,406.608,nan
256,512,7168,256,256,8,ActivationType.Silu,torch.bfloat16,torch.float8_e4m3fn,torch.float8_e4m3fn,QuantType.per_1x128,1,1,64,0,173.9888,moe_ck2stages_gemm1_256x64x128x128_1x4_MulABScaleExpertWeightA8W8blkscale_v3_Nswizzle0_per_1x128_MulRoutedWeight1_silu,0.1%,430.4641,moe_ck2stages_gemm2_256x64x128x128_1x4_MulABScaleExpertWeightA8W8blkscale_v3_Nswizzle0_per_1x128_MulRoutedWeight0,0.0%,604.4529,nan
256,1024,7168,256,256,8,ActivationType.Silu,torch.bfloat16,torch.float8_e4m3fn,torch.float8_e4m3fn,QuantType.per_1x128,1,1,64,0,177.8429,moe_ck2stages_gemm1_256x64x128x128_1x4_MulABScaleExpertWeightA8W8blkscale_v3_Nswizzle0_per_1x128_MulRoutedWeight1_silu,0.1%,811.8627,moe_ck2stages_gemm2_256x64x128x128_1x4_MulABScaleExpertWeightA8W8blkscale_v3_Nswizzle0_per_1x128_MulRoutedWeight0,0.0%,989.7056,nan
80,16,4096,1536,2,2,ActivationType.Silu,torch.bfloat16,torch.float8_e4m3fnuz,torch.float8_e4m3fnuz,QuantType.per_Token,1,0,32,0,18.6087,moe_ck2stages_gemm1_256x32x64x256_1x4_MulABScale_v1_Nswizzle0_Quant2_MulRoutedWeight0_silu_F8_F8_B16,0.0%,13.4843,moe_ck2stages_gemm2_256x32x64x256_1x4_MulABScaleExpertWeight_v1_Nswizzle0_Quant2_MulRoutedWeight1_F8_F8_B16,0.4%,32.092999999999996,0
