aiter/configs/tuned_fmoe.csv
cu_num,token,model_dim,inter_dim,expert,topk,act_type,dtype,q_dtype_a,q_dtype_w,q_type,use_g1u1,doweight_stage1,block_m,ksplit,us1,kernelName1,err1,us2,kernelName2,err2,us,run_1stage,tflops,bw
256,512,6144,4096,8,2,ActivationType.Silu,torch.bfloat16,torch.float8_e4m3fn,torch.float8_e4m3fn,QuantType.per_Token,1,0,64,0,111.9791,_ZN5aiter48fmoe_stage1_bf16_pertokenFp8_g1u1_64x128_2tg_pf3E,0.0%,74.9857,moe_ck2stages_gemm2_256x64x128x256_1x4_TypeCast_v1_Nswizzle0_Quant2_MulRoutedWeight1_F8_F8_B16,2.3%,186.9648,0,826.99,3280.92
256,512,6144,4096,8,2,ActivationType.Silu,torch.bfloat16,torch.int8,torch.int8,QuantType.per_Tensor,1,0,64,0,109.3441,moe_ck2stages_gemm1_256x64x64x256_1x4_TypeCast_v1_Nswizzle0_Quant1_MulRoutedWeight0_silu_I8_I8_B16,0.0%,69.6659,moe_ck2stages_gemm2_256x64x128x256_1x4_TypeCast_v1_Nswizzle0_Quant1_MulRoutedWeight1_I8_I8_B16,2.1%,179.01,0,863.74,3426.72
256,4,2304,1536,8,2,ActivationType.Gelu,torch.bfloat16,torch.float8_e4m3fn,torch.float8_e4m3fn,QuantType.per_Token,1,0,32,0,12.9146,moe_ck2stages_gemm1_256x32x64x256_1x4_TypeCast_v1_Nswizzle0_Quant2_MulRoutedWeight0_gelu_F8_F8_B16,0.0%,13.5525,moe_ck2stages_gemm2_256x32x128x256_1x4_TypeCast_v1_Nswizzle0_Quant2_MulRoutedWeight1_F8_F8_B16,0.3%,26.4671,0,6.42,3210.11
256,4,2304,1536,8,2,ActivationType.Gelu,torch.bfloat16,torch.float8_e4m3fn,torch.float8_e4m3fn,QuantType.per_Token,1,1,32,0,13.1042,moe_ck2stages_gemm1_256x32x64x256_1x4_TypeCast_v1_Nswizzle0_Quant2_MulRoutedWeight1_gelu_F8_F8_B16,0.0%,13.0865,moe_ck2stages_gemm2_256x32x128x256_1x4_TypeCast_v1_Nswizzle0_Quant2_MulRoutedWeight0_F8_F8_B16,0.0%,26.1907,0,6.49,3243.99
256,56,6144,4096,8,2,ActivationType.Silu,torch.bfloat16,torch.float8_e4m3fn,torch.float8_e4m3fn,QuantType.per_1x128,1,0,32,0,75.967,moe_ck2stages_gemm1_256x32x128x128_1x4_MulABScaleExpertWeightA8W8blkscale_v1_Nswizzle0_Quant4_MulRoutedWeight0_silu_F8_F8_B16,0.1%,49.9711,moe_ck2stages_gemm2_256x32x128x128_1x4_MulABScaleExpertWeightA8W8blkscale_v1_Nswizzle0_Quant4_MulRoutedWeight1_F8_F8_B16,5.2%,125.9381,0,134.28,4804.04
256,16,7168,256,256,8,ActivationType.Silu,torch.bfloat16,torch.float8_e4m3fn,torch.float8_e4m3fn,QuantType.per_Token,1,0,32,0,67.8353,moe_ck2stages_gemm1_256x32x64x256_1x4_TypeCast_v1_Nswizzle0_Quant2_MulRoutedWeight0_silu_F8_F8_B16,0.0%,45.5089,moe_ck2stages_gemm2_256x32x128x256_1x4_TypeCast_v1_Nswizzle0_Quant2_MulRoutedWeight1_F8_F8_B16,1.4%,113.3442,0,12.43,12436.72
256,32,7168,256,256,8,ActivationType.Silu,torch.bfloat16,torch.float8_e4m3fn,torch.float8_e4m3fn,QuantType.per_Token,1,0,32,0,160.407,_ZN5aiter45fmoe_bf16_pertokenFp8_g1u1_vs_silu_1tg_32x256E,0.0%,0.0,Null,0.0%,160.407,1,17.57,8789.98
256,64,7168,256,256,8,ActivationType.Silu,torch.bfloat16,torch.float8_e4m3fn,torch.float8_e4m3fn,QuantType.per_Token,1,0,32,0,137.9078,_ZN5aiter48fmoe_stage1_bf16_pertokenFp8_g1u1_32x128_3tg_pf3E,5.1%,80.8188,moe_ck2stages_gemm2_256x32x128x256_1x4_TypeCast_v1_Nswizzle0_Quant2_MulRoutedWeight1_F8_F8_B16,1.3%,218.7266,0,25.77,6449.43
256,128,7168,256,256,8,ActivationType.Silu,torch.bfloat16,torch.float8_e4m3fn,torch.float8_e4m3fn,QuantType.per_Token,1,0,32,0,151.9774,moe_ck2stages_gemm1_256x32x64x256_1x4_TypeCast_v1_Nswizzle0_Quant2_MulRoutedWeight0_silu_F8_F8_B16,0.0%,94.272,moe_ck2stages_gemm2_256x32x128x256_1x4_TypeCast_v1_Nswizzle0_Quant2_MulRoutedWeight1_F8_F8_B16,1.3%,246.2494,0,45.78,5734.18
256,256,7168,256,256,8,ActivationType.Silu,torch.bfloat16,torch.float8_e4m3fn,torch.float8_e4m3fn,QuantType.per_Token,1,0,32,0,259.3801,_ZN5aiter45fmoe_bf16_pertokenFp8_g1u1_vs_silu_1tg_32x256E,0.0%,0.0,Null,0.0%,259.3801,1,86.93,5454.51
256,512,7168,256,256,8,ActivationType.Silu,torch.bfloat16,torch.float8_e4m3fn,torch.float8_e4m3fn,QuantType.per_Token,1,0,32,0,263.6525,_ZN5aiter45fmoe_bf16_pertokenFp8_g1u1_vs_silu_1tg_32x256E,0.0%,0.0,Null,0.0%,263.6525,1,171.05,5387.0
256,1024,7168,256,256,8,ActivationType.Silu,torch.bfloat16,torch.float8_e4m3fn,torch.float8_e4m3fn,QuantType.per_Token,1,0,32,0,366.7456,_ZN5aiter45fmoe_bf16_pertokenFp8_g1u1_vs_silu_1tg_32x256E,0.0%,0.0,Null,0.0%,366.7456,1,245.93,3902.72
256,1,2048,512,512,10,ActivationType.Silu,torch.bfloat16,torch.float8_e4m3fn,torch.float8_e4m3fn,QuantType.per_1x128,1,0,32,0,124.907,_ZN5aiter44fmoe_bf16_blockscaleBf16_g1u1_ps_silu_32x128E,0.1%,474.7793,"",15.5%,599.6863,1,128.92,1028.14
256,2,2048,512,512,10,ActivationType.Silu,torch.bfloat16,torch.float8_e4m3fn,torch.float8_e4m3fn,QuantType.per_1x128,1,0,32,0,124.907,_ZN5aiter44fmoe_bf16_blockscaleBf16_g1u1_ps_silu_32x128E,0.1%,474.7793,"",15.5%,599.6863,1,128.92,1028.14
256,3,2048,512,512,10,ActivationType.Silu,torch.bfloat16,torch.float8_e4m3fn,torch.float8_e4m3fn,QuantType.per_1x128,1,0,32,0,124.907,_ZN5aiter44fmoe_bf16_blockscaleBf16_g1u1_ps_silu_32x128E,0.1%,474.7793,"",15.5%,599.6863,1,128.92,1028.14
256,4,2048,512,512,10,ActivationType.Silu,torch.bfloat16,torch.float8_e4m3fn,torch.float8_e4m3fn,QuantType.per_1x128,1,0,32,0,124.907,_ZN5aiter44fmoe_bf16_blockscaleBf16_g1u1_ps_silu_32x128E,0.1%,474.7793,"",15.5%,599.6863,1,128.92,1028.14
256,5,2048,512,512,10,ActivationType.Silu,torch.bfloat16,torch.float8_e4m3fn,torch.float8_e4m3fn,QuantType.per_1x128,1,0,32,0,124.907,_ZN5aiter44fmoe_bf16_blockscaleBf16_g1u1_ps_silu_32x128E,0.1%,474.7793,"",15.5%,599.6863,1,128.92,1028.14
256,6,2048,512,512,10,ActivationType.Silu,torch.bfloat16,torch.float8_e4m3fn,torch.float8_e4m3fn,QuantType.per_1x128,1,0,32,0,124.907,_ZN5aiter44fmoe_bf16_blockscaleBf16_g1u1_ps_silu_32x128E,0.1%,474.7793,"",15.5%,599.6863,1,128.92,1028.14
256,7,2048,512,512,10,ActivationType.Silu,torch.bfloat16,torch.float8_e4m3fn,torch.float8_e4m3fn,QuantType.per_1x128,1,0,32,0,124.907,_ZN5aiter44fmoe_bf16_blockscaleBf16_g1u1_ps_silu_32x128E,0.1%,474.7793,"",15.5%,599.6863,1,128.92,1028.14
256,8,2048,512,512,10,ActivationType.Silu,torch.bfloat16,torch.float8_e4m3fn,torch.float8_e4m3fn,QuantType.per_1x128,1,0,32,0,124.907,_ZN5aiter44fmoe_bf16_blockscaleBf16_g1u1_ps_silu_32x128E,0.1%,474.7793,"",15.5%,599.6863,1,128.92,1028.14
256,10,2048,512,512,10,ActivationType.Silu,torch.bfloat16,torch.float8_e4m3fn,torch.float8_e4m3fn,QuantType.per_1x128,1,0,32,0,61.6757,_ZN5aiter47fmoe_bf16_blockscaleFp8_g1u1_vs_silu_1tg_32x256E,0.0%,0.0,Null,0.0%,61.6757,1,10.2,26115.22
256,11,2048,512,512,10,ActivationType.Silu,torch.bfloat16,torch.float8_e4m3fn,torch.float8_e4m3fn,QuantType.per_1x128,1,0,32,0,64.3725,_ZN5aiter47fmoe_bf16_blockscaleFp8_g1u1_vs_silu_1tg_32x256E,0.0%,0.0,Null,0.0%,64.3725,1,10.75,25021.25
256,12,2048,512,512,10,ActivationType.Silu,torch.bfloat16,torch.float8_e4m3fn,torch.float8_e4m3fn,QuantType.per_1x128,1,0,32,0,69.2653,_ZN5aiter47fmoe_bf16_blockscaleFp8_g1u1_vs_silu_1tg_32x256E,0.0%,0.0,Null,0.0%,69.2653,1,10.9,23253.87
256,13,2048,512,512,10,ActivationType.Silu,torch.bfloat16,torch.float8_e4m3fn,torch.float8_e4m3fn,QuantType.per_1x128,1,0,32,0,74.9387,_ZN5aiter47fmoe_bf16_blockscaleFp8_g1u1_vs_silu_1tg_32x256E,0.0%,0.0,Null,0.0%,74.9387,1,10.91,21493.47
256,14,2048,512,512,10,ActivationType.Silu,torch.bfloat16,torch.float8_e4m3fn,torch.float8_e4m3fn,QuantType.per_1x128,1,0,32,0,79.2867,_ZN5aiter47fmoe_bf16_blockscaleFp8_g1u1_vs_silu_1tg_32x256E,0.0%,0.0,Null,0.0%,79.2867,1,11.11,20314.87
256,15,2048,512,512,10,ActivationType.Silu,torch.bfloat16,torch.float8_e4m3fn,torch.float8_e4m3fn,QuantType.per_1x128,1,0,16,0,61.2128,moe_ck2stages_gemm1_256x16x128x256_1x4_MulABScaleExpertWeightA8W8blkscale_v1_Nswizzle0_Quant4_MulRoutedWeight0_silu_F8_F8_B16,0.1%,30.4451,moe_ck2stages_gemm2_256x16x128x256_1x4_MulABScaleExpertWeightA8W8blkscale_v1_Nswizzle0_Quant4_MulRoutedWeight1_F8_F8_B16,18.0%,91.6579,0,10.3,17573.01
256,16,2048,512,512,10,ActivationType.Silu,torch.bfloat16,torch.float8_e4m3fn,torch.float8_e4m3fn,QuantType.per_1x128,1,0,16,0,62.2865,moe_ck2stages_gemm1_256x16x128x256_1x4_MulABScaleExpertWeightA8W8blkscale_v1_Nswizzle0_Quant4_MulRoutedWeight0_silu_F8_F8_B16,0.1%,31.5821,moe_ck2stages_gemm2_256x16x128x256_1x4_MulABScaleExpertWeightA8W8blkscale_v1_Nswizzle0_Quant4_MulRoutedWeight1_F8_F8_B16,17.8%,93.8686,0,10.72,17159.21
256,32,2048,512,512,10,ActivationType.Silu,torch.bfloat16,torch.float8_e4m3fn,torch.float8_e4m3fn,QuantType.per_1x128,1,0,32,0,138.0591,_ZN5aiter50fmoe_bf16_blockscaleFp8_g1u1_vs_silu_1tg_ps_32x256E,0.0%,0.0,Null,0.0%,138.0591,1,14.58,11667.53
256,64,2048,512,512,10,ActivationType.Silu,torch.bfloat16,torch.float8_e4m3fn,torch.float8_e4m3fn,QuantType.per_1x128,1,0,16,0,135.9822,moe_ck2stages_gemm1_256x16x128x256_1x4_MulABScaleExpertWeightA8W8blkscale_v1_Nswizzle0_Quant4_MulRoutedWeight0_silu_F8_F8_B16,0.1%,68.6891,moe_ck2stages_gemm2_256x16x128x256_1x4_MulABScaleExpertWeightA8W8blkscale_v1_Nswizzle0_Quant4_MulRoutedWeight1_F8_F8_B16,17.4%,204.6713,0,19.67,7871.19
256,128,2048,512,512,10,ActivationType.Silu,torch.bfloat16,torch.float8_e4m3fn,torch.float8_e4m3fn,QuantType.per_1x128,1,0,16,0,173.8665,moe_ck2stages_gemm1_128x16x128x128_1x2_MulABScaleExpertWeightA8W8blkscale_v1_Nswizzle0_Quant4_MulRoutedWeight0_silu_F8_F8_B16,0.1%,87.2063,moe_ck2stages_gemm2_256x16x128x256_1x4_MulABScaleExpertWeightA8W8blkscale_v1_Nswizzle0_Quant4_MulRoutedWeight1_F8_F8_B16,17.6%,261.0728,0,30.85,6172.22
256,256,2048,512,512,10,ActivationType.Silu,torch.bfloat16,torch.float8_e4m3fn,torch.float8_e4m3fn,QuantType.per_1x128,1,0,16,0,196.5804,moe_ck2stages_gemm1_128x16x128x128_1x2_MulABScaleExpertWeightA8W8blkscale_v1_Nswizzle0_Quant4_MulRoutedWeight0_silu_F8_F8_B16,0.1%,94.0998,moe_ck2stages_gemm2_256x16x128x256_1x4_MulABScaleExpertWeightA8W8blkscale_v1_Nswizzle0_Quant4_MulRoutedWeight1_F8_F8_B16,17.6%,290.6802,0,55.41,5546.25
256,512,2048,512,512,10,ActivationType.Silu,torch.bfloat16,torch.float8_e4m3fn,torch.float8_e4m3fn,QuantType.per_1x128,1,0,16,0,204.7754,moe_ck2stages_gemm1_128x16x128x128_1x2_MulABScaleExpertWeightA8W8blkscale_v1_Nswizzle0_Quant4_MulRoutedWeight0_silu_F8_F8_B16,0.1%,99.0744,moe_ck2stages_gemm2_256x16x128x256_1x4_MulABScaleExpertWeightA8W8blkscale_v1_Nswizzle0_Quant4_MulRoutedWeight1_F8_F8_B16,17.7%,303.8498,0,106.01,5311.04
256,1024,2048,512,512,10,ActivationType.Silu,torch.bfloat16,torch.float8_e4m3fn,torch.float8_e4m3fn,QuantType.per_1x128,1,0,64,0,319.3694,_ZN5aiter40fmoe_bf16_blockscaleFp8_g1u1_silu_64x256E,0.0%,0.0,Null,0.0%,319.3694,1,201.72,5062.8
256,2048,2048,512,512,10,ActivationType.Silu,torch.bfloat16,torch.float8_e4m3fn,torch.float8_e4m3fn,QuantType.per_1x128,1,0,64,0,347.1508,_ZN5aiter40fmoe_bf16_blockscaleFp8_g1u1_silu_64x256E,0.0%,0.0,Null,0.0%,347.1508,1,371.16,4675.77
256,4096,2048,512,512,10,ActivationType.Silu,torch.bfloat16,torch.float8_e4m3fn,torch.float8_e4m3fn,QuantType.per_1x128,1,0,64,0,479.5371,_ZN5aiter40fmoe_bf16_blockscaleFp8_g1u1_silu_64x256E,0.0%,0.0,Null,0.0%,479.5371,1,537.39,3411.16
256,8192,2048,512,512,10,ActivationType.Silu,torch.bfloat16,torch.float8_e4m3fn,torch.float8_e4m3fn,QuantType.per_1x128,1,0,64,0,760.3597,_ZN5aiter40fmoe_bf16_blockscaleFp8_g1u1_silu_64x256E,0.0%,0.0,Null,0.0%,760.3597,1,677.83,2184.42
256,16384,2048,512,512,10,ActivationType.Silu,torch.bfloat16,torch.float8_e4m3fn,torch.float8_e4m3fn,QuantType.per_1x128,1,0,64,0,1366.1334,_ZN5aiter40fmoe_bf16_blockscaleFp8_g1u1_silu_64x256E,0.0%,0.0,Null,0.0%,1366.1334,1,754.53,1252.64
256,32768,2048,512,512,10,ActivationType.Silu,torch.bfloat16,torch.float8_e4m3fn,torch.float8_e4m3fn,QuantType.per_1x128,1,0,64,0,2664.1188,_ZN5aiter40fmoe_bf16_blockscaleFp8_g1u1_silu_64x256E,0.0%,0.0,Null,0.0%,2664.1188,1,773.83,680.13
256,1,2048,128,512,10,ActivationType.Silu,torch.bfloat16,torch.float8_e4m3fn,torch.float8_e4m3fn,QuantType.per_1x128,1,0,16,0,16.733,moe_ck2stages_gemm1_256x16x128x256_1x4_MulABScaleExpertWeightA8W8blkscale_v1_Nswizzle0_Quant4_MulRoutedWeight0_silu_F8_F8_B16,0.0%,5.8063,moe_ck2stages_gemm2_128x16x128x128_1x2_MulABScaleExpertWeightA8W8blkscale_v1_Nswizzle0_Quant4_MulRoutedWeight1_F8_F8_B16,14.6%,22.5393,0,0.7,17864.77
256,2,2048,128,512,10,ActivationType.Silu,torch.bfloat16,torch.float8_e4m3fn,torch.float8_e4m3fn,QuantType.per_1x128,1,0,16,0,17.2649,moe_ck2stages_gemm1_256x16x128x256_1x4_MulABScaleExpertWeightA8W8blkscale_v1_Nswizzle0_Quant4_MulRoutedWeight0_silu_F8_F8_B16,0.0%,6.3524,moe_ck2stages_gemm2_128x16x128x128_1x2_MulABScaleExpertWeightA8W8blkscale_v1_Nswizzle0_Quant4_MulRoutedWeight1_F8_F8_B16,15.9%,23.6173,0,1.33,17049.6
256,4,2048,128,512,10,ActivationType.Silu,torch.bfloat16,torch.float8_e4m3fn,torch.float8_e4m3fn,QuantType.per_1x128,1,0,32,0,0,_ZN5aiter44fmoe_bf16_blockscaleBf16_g1u1_ps_silu_32x128E,0,0,"",0.521027,41.707,1,0,0
256,8,2048,128,512,10,ActivationType.Silu,torch.bfloat16,torch.float8_e4m3fn,torch.float8_e4m3fn,QuantType.per_1x128,1,0,32,0,0,_ZN5aiter44fmoe_bf16_blockscaleBf16_g1u1_ps_silu_32x128E,0,0,"",0.521027,41.707,1,0,0
256,16,2048,128,512,10,ActivationType.Silu,torch.bfloat16,torch.float8_e4m3fn,torch.float8_e4m3fn,QuantType.per_1x128,1,0,32,0,0,_ZN5aiter44fmoe_bf16_blockscaleBf16_g1u1_ps_silu_32x128E,0,0,"",0.521027,41.707,1,0,0
256,32,2048,128,512,10,ActivationType.Silu,torch.bfloat16,torch.float8_e4m3fn,torch.float8_e4m3fn,QuantType.per_1x128,1,0,32,0,0,_ZN5aiter44fmoe_bf16_blockscaleBf16_g1u1_ps_silu_32x128E,0,0,"",0.596817,40.4,1,0,0
256,64,2048,128,512,10,ActivationType.Silu,torch.bfloat16,torch.float8_e4m3fn,torch.float8_e4m3fn,QuantType.per_1x128,1,0,32,0,0,_ZN5aiter44fmoe_bf16_blockscaleBf16_g1u1_ps_silu_32x128E,0,0,"",0.591309,63.4,1,0,0
256,128,2048,128,512,10,ActivationType.Silu,torch.bfloat16,torch.float8_e4m3fn,torch.float8_e4m3fn,QuantType.per_1x128,1,0,32,0,0,_ZN5aiter44fmoe_bf16_blockscaleBf16_g1u1_ps_silu_32x128E,0,0,"",0.585987,71.1,1,0,0
256,256,2048,128,512,10,ActivationType.Silu,torch.bfloat16,torch.float8_e4m3fn,torch.float8_e4m3fn,QuantType.per_1x128,1,0,16,0,63.3387,moe_ck2stages_gemm1_256x16x128x256_1x4_MulABScaleExpertWeightA8W8blkscale_v1_Nswizzle0_Quant4_MulRoutedWeight0_silu_F8_F8_B16,0.1%,31.5143,moe_ck2stages_gemm2_128x16x128x128_1x2_MulABScaleExpertWeightA8W8blkscale_v1_Nswizzle0_Quant4_MulRoutedWeight1_F8_F8_B16,17.5%,94.853,0,42.45,4261.61
256,512,2048,128,512,10,ActivationType.Silu,torch.bfloat16,torch.float8_e4m3fn,torch.float8_e4m3fn,QuantType.per_1x128,1,0,16,0,63.2674,moe_ck2stages_gemm1_128x16x128x128_1x2_MulABScaleExpertWeightA8W8blkscale_v1_Nswizzle0_Quant4_MulRoutedWeight0_silu_F8_F8_B16,0.1%,33.348,moe_ck2stages_gemm2_128x16x128x128_1x2_MulABScaleExpertWeightA8W8blkscale_v1_Nswizzle0_Quant4_MulRoutedWeight1_F8_F8_B16,17.5%,96.6154,0,83.35,4200.15
256,1024,2048,128,512,10,ActivationType.Silu,torch.bfloat16,torch.float8_e4m3fn,torch.float8_e4m3fn,QuantType.per_1x128,1,0,32,0,77.2361,moe_ck2stages_gemm1_256x32x128x128_1x4_MulABScaleExpertWeightA8W8blkscale_v1_Nswizzle0_Quant4_MulRoutedWeight0_silu_F8_F8_B16,0.1%,44.5108,moe_ck2stages_gemm2_256x32x128x128_1x4_MulABScaleExpertWeightA8W8blkscale_v1_Nswizzle0_Quant4_MulRoutedWeight1_F8_F8_B16,17.5%,121.7469,0,132.29,3358.97
256,2048,2048,128,512,10,ActivationType.Silu,torch.bfloat16,torch.float8_e4m3fn,torch.float8_e4m3fn,QuantType.per_1x128,1,0,64,0,81.2484,moe_ck2stages_gemm1_256x64x128x128_1x4_MulABScaleExpertWeightA8W8blkscale_v3_Nswizzle0_Quant4_MulRoutedWeight0_silu_F8_F8_B16,0.1%,79.1283,moe_ck2stages_gemm2_256x64x128x128_1x4_MulABScaleExpertWeightA8W8blkscale_v3_Nswizzle0_Quant4_MulRoutedWeight1_F8_F8_B16,17.5%,160.3767,0,200.85,2589.13
256,4096,2048,128,512,10,ActivationType.Silu,torch.bfloat16,torch.float8_e4m3fn,torch.float8_e4m3fn,QuantType.per_1x128,1,0,64,0,128.372,moe_ck2stages_gemm1_256x64x128x128_1x4_MulABScaleExpertWeightA8W8blkscale_v3_Nswizzle0_Quant4_MulRoutedWeight0_silu_F8_F8_B16,0.1%,146.9346,moe_ck2stages_gemm2_256x64x128x128_1x4_MulABScaleExpertWeightA8W8blkscale_v3_Nswizzle0_Quant4_MulRoutedWeight1_F8_F8_B16,17.5%,275.3066,0,234.01,1553.97
256,8192,2048,128,512,10,ActivationType.Silu,torch.bfloat16,torch.float8_e4m3fn,torch.float8_e4m3fn,QuantType.per_1x128,1,0,64,0,189.4635,moe_ck2stages_gemm1_256x64x128x128_1x4_MulABScaleExpertWeightA8W8blkscale_v3_Nswizzle0_Quant4_MulRoutedWeight0_silu_F8_F8_B16,0.1%,271.4026,moe_ck2stages_gemm2_256x64x128x128_1x4_MulABScaleExpertWeightA8W8blkscale_v3_Nswizzle0_Quant4_MulRoutedWeight1_F8_F8_B16,17.5%,460.8661,0,279.58,982.9
256,16384,2048,128,512,10,ActivationType.Silu,torch.bfloat16,torch.float8_e4m3fn,torch.float8_e4m3fn,QuantType.per_1x128,1,0,64,0,342.8973,moe_ck2stages_gemm1_256x64x128x128_1x4_MulABScaleExpertWeightA8W8blkscale_v3_Nswizzle0_Quant4_MulRoutedWeight0_silu_F8_F8_B16,0.1%,529.5598,moe_ck2stages_gemm2_256x64x128x128_1x4_MulABScaleExpertWeightA8W8blkscale_v3_Nswizzle0_Quant4_MulRoutedWeight1_F8_F8_B16,17.5%,872.4571,0,295.37,576.9
256,32768,2048,128,512,10,ActivationType.Silu,torch.bfloat16,torch.float8_e4m3fn,torch.float8_e4m3fn,QuantType.per_1x128,1,0,32,0,483.7855,moe_ck2stages_gemm1_256x32x128x128_1x4_MulABScaleExpertWeightA8W8blkscale_v1_Nswizzle0_Quant4_MulRoutedWeight0_silu_F8_F8_B16,0.1%,1058.6343,moe_ck2stages_gemm2_256x32x128x128_1x4_MulABScaleExpertWeightA8W8blkscale_v1_Nswizzle0_Quant4_MulRoutedWeight1_F8_F8_B16,17.6%,1542.4198,0,334.15,391.58
256,512,6144,4096,8,2,ActivationType.Silu,torch.bfloat16,torch.bfloat16,torch.bfloat16,QuantType.No,1,0,128,0,214.892,moe_ck2stages_gemm1_256x128x64x64_1x4_TypeCast_v1_Nswizzle0_Quant0_MulRoutedWeight0_silu_B16_B16_B16,0.0%,131.2803,moe_ck2stages_gemm2_256x128x64x64_1x4_TypeCast_v1_Nswizzle0_Quant0_MulRoutedWeight1_B16_B16_B16,2.4%,346.1723,0,446.65,3525.82
