aiter/configs/tuned_fmoe.csv
token,model_dim,inter_dim,expert,topk,act_type,dtype,q_dtype_a,q_dtype_w,q_type,use_g1u1,doweight_stage1,block_m,ksplit,us1,kernelName1,err1,us2,kernelName2,err2,total_us
512,6144,4096,8,2,ActivationType.Silu,torch.bfloat16,torch.bfloat16,torch.bfloat16,QuantType.No,1,0,64,0,760.6357,moe_ck2stages_gemm1_256x64x64x64_1x4_TypeCast_v1_Nswizzle0_no_MulRoutedWeight0_silu,0.0%,426.7219,moe_ck2stages_gemm2_256x64x128x128_1x4_TypeCastExpertWeight_v3_Nswizzle0_no_MulRoutedWeight1,2.4%,1187.3576
512,6144,4096,8,2,ActivationType.Silu,torch.bfloat16,torch.float8_e4m3fnuz,torch.float8_e4m3fnuz,QuantType.per_Token,1,0,64,0,377.0059,_ZN5aiter48fmoe_stage1_bf16_pertokenFp8_g1u1_64x128_2tg_pf3E,0.0%,269.2044,moe_ck2stages_gemm2_256x64x128x256_1x4_MulABScaleExpertWeight_v3_Nswizzle0_per_token_MulRoutedWeight1,2.4%,646.2103
512,6144,4096,8,2,ActivationType.Silu,torch.bfloat16,torch.int8,torch.int8,QuantType.per_Tensor,1,0,64,0,346.5174,_ZN5aiter45fmoe_stage1_bf16_pertokenInt8_g1u1_64x256_pf3E,0.0%,225.6346,moe_ck2stages_gemm2_256x64x128x128_1x4_MulABScaleExpertWeight_v3_Nswizzle0_per_tensor_MulRoutedWeight1,2.1%,572.152
4,2304,1536,8,2,ActivationType.Gelu,torch.bfloat16,torch.float8_e4m3fnuz,torch.float8_e4m3fnuz,QuantType.per_Token,1,0,32,0,18.8987,_ZN5aiter47fmoe_stage1_bf16_pertokenFp8_g1u1_32x64_4tg_pf3E,0.0%,16.9605,moe_ck2stages_gemm2_256x32x64x256_1x4_MulABScaleExpertWeight_v1_Nswizzle0_per_token_MulRoutedWeight1,0.2%,35.8592
4,2304,1536,8,2,ActivationType.Gelu,torch.bfloat16,torch.float8_e4m3fnuz,torch.float8_e4m3fnuz,QuantType.per_Token,1,1,32,0,20.0471,_ZN5aiter56fmoe_stage1_bf16_pertokenFp8_doweight_g1u1_32x64_4tg_pf3E,0.0%,16.1797,moe_ck2stages_gemm2_256x32x64x256_1x4_MulABScaleExpertWeight_v1_Nswizzle0_per_token_MulRoutedWeight0,0.0%,36.2268
56,6144,4096,8,2,ActivationType.Silu,torch.bfloat16,torch.float8_e4m3fnuz,torch.float8_e4m3fnuz,QuantType.per_128x128,1,0,64,0,394.1806,moe_ck2stages_gemm1_256x64x128x128_1x4_MulABScaleExpertWeightA8W8blkscale_v3_Nswizzle0_per_128x128_MulRoutedWeight0_silu,0.0%,128.7186,moe_ck2stages_gemm2_256x64x128x128_1x4_MulABScaleExpertWeightA8W8blkscale_v3_Nswizzle0_per_128x128_MulRoutedWeight1,2.3%,522.8992000000001
1024,4096,192,128,8,ActivationType.Silu,torch.bfloat16,torch.bfloat16,torch.bfloat16,QuantType.No,1,0,128,0,93.3776,moe_ck2stages_gemm1_256x128x64x64_1x4_TypeCast_v1_Nswizzle0_no_MulRoutedWeight0_silu,0.0%,127.3646,moe_ck2stages_gemm2_256x128x128x64_1x4_TypeCast_v3_Nswizzle0_no_MulRoutedWeight1,0.1%,220.7422
64,4096,192,128,8,ActivationType.Silu,torch.bfloat16,torch.bfloat16,torch.bfloat16,QuantType.No,1,0,128,0,83.0388,moe_ck2stages_gemm1_256x128x64x64_1x4_TypeCast_v1_Nswizzle0_no_MulRoutedWeight0_silu,0.0%,60.5276,moe_ck2stages_gemm2_256x128x128x64_1x4_TypeCast_v3_Nswizzle0_no_MulRoutedWeight1,0.1%,143.5664
128,4096,192,128,8,ActivationType.Silu,torch.bfloat16,torch.bfloat16,torch.bfloat16,QuantType.No,1,0,128,0,83.823,moe_ck2stages_gemm1_256x128x64x64_1x4_TypeCast_v1_Nswizzle0_no_MulRoutedWeight0_silu,0.0%,63.2704,moe_ck2stages_gemm2_256x128x128x64_1x4_TypeCast_v3_Nswizzle0_no_MulRoutedWeight1,0.1%,147.0934
256,4096,192,128,8,ActivationType.Silu,torch.bfloat16,torch.bfloat16,torch.bfloat16,QuantType.No,1,0,128,0,84.2129,moe_ck2stages_gemm1_256x128x64x64_1x4_TypeCast_v1_Nswizzle0_no_MulRoutedWeight0_silu,0.0%,67.6697,moe_ck2stages_gemm2_256x128x128x64_1x4_TypeCast_v3_Nswizzle0_no_MulRoutedWeight1,0.1%,151.88260000000002
32,4096,192,128,8,ActivationType.Silu,torch.bfloat16,torch.bfloat16,torch.bfloat16,QuantType.No,1,0,128,0,70.6945,moe_ck2stages_gemm1_256x128x64x64_1x4_TypeCast_v1_Nswizzle0_no_MulRoutedWeight0_silu,0.0%,50.2878,moe_ck2stages_gemm2_256x128x128x64_1x4_TypeCast_v3_Nswizzle0_no_MulRoutedWeight1,0.1%,120.9823
96,4096,192,128,8,ActivationType.Silu,torch.bfloat16,torch.bfloat16,torch.bfloat16,QuantType.No,1,0,128,0,79.0462,moe_ck2stages_gemm1_256x128x64x64_1x4_TypeCast_v1_Nswizzle0_no_MulRoutedWeight0_silu,0.0%,60.0445,moe_ck2stages_gemm2_256x128x128x64_1x4_TypeCast_v3_Nswizzle0_no_MulRoutedWeight1,0.1%,139.0907
384,4096,192,128,8,ActivationType.Silu,torch.bfloat16,torch.bfloat16,torch.bfloat16,QuantType.No,1,0,128,0,81.2194,moe_ck2stages_gemm1_256x128x64x64_1x4_TypeCast_v1_Nswizzle0_no_MulRoutedWeight0_silu,0.0%,73.1513,moe_ck2stages_gemm2_256x128x128x64_1x4_TypeCast_v3_Nswizzle0_no_MulRoutedWeight1,0.1%,154.3707
512,4096,192,128,8,ActivationType.Silu,torch.bfloat16,torch.bfloat16,torch.bfloat16,QuantType.No,1,0,128,0,81.5943,moe_ck2stages_gemm1_256x128x64x64_1x4_TypeCast_v1_Nswizzle0_no_MulRoutedWeight0_silu,0.0%,83.5425,moe_ck2stages_gemm2_256x128x128x64_1x4_TypeCast_v3_Nswizzle0_no_MulRoutedWeight1,0.1%,165.1368
768,4096,192,128,8,ActivationType.Silu,torch.bfloat16,torch.bfloat16,torch.bfloat16,QuantType.No,1,0,128,0,83.8413,moe_ck2stages_gemm1_256x128x64x64_1x4_TypeCast_v1_Nswizzle0_no_MulRoutedWeight0_silu,0.0%,104.6896,moe_ck2stages_gemm2_256x128x128x64_1x4_TypeCast_v3_Nswizzle0_no_MulRoutedWeight1,0.1%,188.5309
