aiter/configs/tuned_fmoe.csv
token,model_dim,inter_dim,expert,topk,act_type,dtype,q_dtype_a,q_dtype_w,q_type,use_g1u1,doweight_stage1,block_m,ksplit,us1,kernelName1,err1,us2,kernelName2,err2,total_us
512,6144,4096,8,2,ActivationType.Silu,torch.bfloat16,torch.bfloat16,torch.bfloat16,QuantType.No,1,0,64,0,760.6357,moe_ck2stages_gemm1_256x64x64x64_1x4_TypeCast_v1_Nswizzle0_no_MulRoutedWeight0_silu,0.0%,426.7219,moe_ck2stages_gemm2_256x64x128x128_1x4_TypeCastExpertWeight_v3_Nswizzle0_no_MulRoutedWeight1,2.4%,1187.3576
512,6144,4096,8,2,ActivationType.Silu,torch.bfloat16,torch.float8_e4m3fnuz,torch.float8_e4m3fnuz,QuantType.per_Token,1,0,64,0,377.0059,_ZN5aiter48fmoe_stage1_bf16_pertokenFp8_g1u1_64x128_2tg_pf3E,0.0%,269.2044,moe_ck2stages_gemm2_256x64x128x256_1x4_MulABScaleExpertWeight_v3_Nswizzle0_per_token_MulRoutedWeight1,2.4%,646.2103
512,6144,4096,8,2,ActivationType.Silu,torch.bfloat16,torch.int8,torch.int8,QuantType.per_Tensor,1,0,64,0,346.5174,_ZN5aiter45fmoe_stage1_bf16_pertokenInt8_g1u1_64x256_pf3E,0.0%,225.6346,moe_ck2stages_gemm2_256x64x128x128_1x4_MulABScaleExpertWeight_v3_Nswizzle0_per_tensor_MulRoutedWeight1,2.1%,572.152
4,2304,1536,8,2,ActivationType.Gelu,torch.bfloat16,torch.float8_e4m3fnuz,torch.float8_e4m3fnuz,QuantType.per_Token,1,0,32,0,18.8987,_ZN5aiter47fmoe_stage1_bf16_pertokenFp8_g1u1_32x64_4tg_pf3E,0.0%,16.9605,moe_ck2stages_gemm2_256x32x64x256_1x4_MulABScaleExpertWeight_v1_Nswizzle0_per_token_MulRoutedWeight1,0.2%,35.8592
4,2304,1536,8,2,ActivationType.Gelu,torch.bfloat16,torch.float8_e4m3fnuz,torch.float8_e4m3fnuz,QuantType.per_Token,1,1,32,0,20.0471,_ZN5aiter56fmoe_stage1_bf16_pertokenFp8_doweight_g1u1_32x64_4tg_pf3E,0.0%,16.1797,moe_ck2stages_gemm2_256x32x64x256_1x4_MulABScaleExpertWeight_v1_Nswizzle0_per_token_MulRoutedWeight0,0.0%,36.2268
56,6144,4096,8,2,ActivationType.Silu,torch.bfloat16,torch.float8_e4m3fnuz,torch.float8_e4m3fnuz,QuantType.per_128x128,1,0,64,0,394.1806,moe_ck2stages_gemm1_256x64x128x128_1x4_MulABScaleExpertWeightA8W8blkscale_v3_Nswizzle0_per_128x128_MulRoutedWeight0_silu,0.0%,128.7186,moe_ck2stages_gemm2_256x64x128x128_1x4_MulABScaleExpertWeightA8W8blkscale_v3_Nswizzle0_per_128x128_MulRoutedWeight1,2.3%,522.8992000000001
32,4096,192,128,8,ActivationType.Silu,torch.bfloat16,torch.bfloat16,torch.bfloat16,QuantType.No,1,0,32,0,62.2929,moe_ck2stages_gemm1_256x32x64x64_1x4_TypeCast_v1_Nswizzle0_no_MulRoutedWeight0_silu,0.0%,35.5134,moe_ck2stages_gemm2_256x32x64x64_1x4_TypeCast_v1_Nswizzle0_no_MulRoutedWeight1,0.1%,97.8063
64,4096,192,128,8,ActivationType.Silu,torch.bfloat16,torch.bfloat16,torch.bfloat16,QuantType.No,1,0,32,0,70.7223,moe_ck2stages_gemm1_256x32x64x64_1x4_TypeCast_v1_Nswizzle0_no_MulRoutedWeight0_silu,0.0%,40.8179,moe_ck2stages_gemm2_256x32x64x64_1x4_TypeCast_v1_Nswizzle0_no_MulRoutedWeight1,0.1%,111.5402
128,4096,192,128,8,ActivationType.Silu,torch.bfloat16,torch.bfloat16,torch.bfloat16,QuantType.No,1,0,32,0,71.9705,moe_ck2stages_gemm1_256x32x64x64_1x4_TypeCast_v1_Nswizzle0_no_MulRoutedWeight0_silu,0.0%,41.2473,moe_ck2stages_gemm2_256x32x64x64_1x4_TypeCast_v1_Nswizzle0_no_MulRoutedWeight1,0.1%,113.2178
256,4096,192,128,8,ActivationType.Silu,torch.bfloat16,torch.bfloat16,torch.bfloat16,QuantType.No,1,0,32,0,73.1474,moe_ck2stages_gemm1_256x32x64x64_1x4_TypeCast_v1_Nswizzle0_no_MulRoutedWeight0_silu,0.0%,42.8677,moe_ck2stages_gemm2_256x32x64x64_1x4_TypeCast_v1_Nswizzle0_no_MulRoutedWeight1,0.1%,116.0151
1024,4096,192,128,8,ActivationType.Silu,torch.bfloat16,torch.bfloat16,torch.bfloat16,QuantType.No,1,0,128,0,86.7218,moe_ck2stages_gemm1_256x128x64x64_1x4_TypeCast_v1_Nswizzle0_no_MulRoutedWeight0_silu,0.0%,93.9881,moe_ck2stages_gemm2_256x128x64x64_1x4_TypeCast_v1_Nswizzle0_no_MulRoutedWeight1,0.1%,180.7099
10,4096,192,128,8,ActivationType.Silu,torch.bfloat16,torch.bfloat16,torch.bfloat16,QuantType.No,1,0,64,0,36.3308,moe_ck2stages_gemm1_256x64x64x128_1x4_TypeCast_v1_Nswizzle0_no_MulRoutedWeight0_silu,0.0%,26.6699,moe_ck2stages_gemm2_256x64x64x64_1x4_TypeCast_v1_Nswizzle0_no_MulRoutedWeight1,0.1%,63.0007
19,4096,192,128,8,ActivationType.Silu,torch.bfloat16,torch.bfloat16,torch.bfloat16,QuantType.No,1,0,128,0,64.6331,moe_ck2stages_gemm1_256x128x64x64_1x4_TypeCast_v1_Nswizzle0_no_MulRoutedWeight0_silu,0.0%,42.2389,moe_ck2stages_gemm2_256x128x128x64_1x4_TypeCast_v3_Nswizzle0_no_MulRoutedWeight1,0.1%,106.872
22,4096,192,128,8,ActivationType.Silu,torch.bfloat16,torch.bfloat16,torch.bfloat16,QuantType.No,1,0,32,0,61.916,moe_ck2stages_gemm1_256x32x64x64_1x4_TypeCast_v1_Nswizzle0_no_MulRoutedWeight0_silu,0.0%,33.8101,moe_ck2stages_gemm2_256x32x64x64_1x4_TypeCast_v1_Nswizzle0_no_MulRoutedWeight1,0.1%,95.7261
37,4096,192,128,8,ActivationType.Silu,torch.bfloat16,torch.bfloat16,torch.bfloat16,QuantType.No,1,0,32,0,68.4266,moe_ck2stages_gemm1_256x32x64x64_1x4_TypeCast_v1_Nswizzle0_no_MulRoutedWeight0_silu,0.0%,38.509,moe_ck2stages_gemm2_256x32x64x64_1x4_TypeCast_v1_Nswizzle0_no_MulRoutedWeight1,0.1%,106.9356
50,4096,192,128,8,ActivationType.Silu,torch.bfloat16,torch.bfloat16,torch.bfloat16,QuantType.No,1,0,128,0,77.7193,moe_ck2stages_gemm1_256x128x64x64_1x4_TypeCast_v1_Nswizzle0_no_MulRoutedWeight0_silu,0.0%,56.8969,moe_ck2stages_gemm2_256x128x128x64_1x4_TypeCast_v3_Nswizzle0_no_MulRoutedWeight1,0.1%,134.6162
51,4096,192,128,8,ActivationType.Silu,torch.bfloat16,torch.bfloat16,torch.bfloat16,QuantType.No,1,0,32,0,70.6107,moe_ck2stages_gemm1_256x32x64x64_1x4_TypeCast_v1_Nswizzle0_no_MulRoutedWeight0_silu,0.0%,39.8649,moe_ck2stages_gemm2_256x32x64x64_1x4_TypeCast_v1_Nswizzle0_no_MulRoutedWeight1,0.1%,110.4756
62,4096,192,128,8,ActivationType.Silu,torch.bfloat16,torch.bfloat16,torch.bfloat16,QuantType.No,1,0,128,0,76.6479,moe_ck2stages_gemm1_256x128x64x64_1x4_TypeCast_v1_Nswizzle0_no_MulRoutedWeight0_silu,0.0%,68.9158,moe_ck2stages_gemm2_256x128x128x64_1x4_TypeCast_v1_Nswizzle0_no_MulRoutedWeight1,0.1%,145.5637
74,4096,192,128,8,ActivationType.Silu,torch.bfloat16,torch.bfloat16,torch.bfloat16,QuantType.No,1,0,32,0,72.1016,moe_ck2stages_gemm1_256x32x64x64_1x4_TypeCast_v1_Nswizzle0_no_MulRoutedWeight0_silu,0.0%,41.0441,moe_ck2stages_gemm2_256x32x64x64_1x4_TypeCast_v1_Nswizzle0_no_MulRoutedWeight1,0.1%,113.1457
89,4096,192,128,8,ActivationType.Silu,torch.bfloat16,torch.bfloat16,torch.bfloat16,QuantType.No,1,0,32,0,72.7144,moe_ck2stages_gemm1_256x32x64x64_1x4_TypeCast_v1_Nswizzle0_no_MulRoutedWeight0_silu,0.0%,41.981,moe_ck2stages_gemm2_256x32x64x64_1x4_TypeCast_v1_Nswizzle0_no_MulRoutedWeight1,0.1%,114.6954
93,4096,192,128,8,ActivationType.Silu,torch.bfloat16,torch.bfloat16,torch.bfloat16,QuantType.No,1,0,64,0,75.5675,moe_ck2stages_gemm1_256x64x64x64_1x4_TypeCast_v1_Nswizzle0_no_MulRoutedWeight0_silu,0.0%,50.7976,moe_ck2stages_gemm2_256x64x64x64_1x4_TypeCast_v1_Nswizzle0_no_MulRoutedWeight1,0.1%,126.3651
110,4096,192,128,8,ActivationType.Silu,torch.bfloat16,torch.bfloat16,torch.bfloat16,QuantType.No,1,0,32,0,74.2995,moe_ck2stages_gemm1_256x32x64x64_1x4_TypeCast_v1_Nswizzle0_no_MulRoutedWeight0_silu,0.0%,65.0771,moe_ck2stages_gemm2_256x32x64x64_1x4_TypeCast_v1_Nswizzle0_no_MulRoutedWeight1,0.1%,139.3766
118,4096,192,128,8,ActivationType.Silu,torch.bfloat16,torch.bfloat16,torch.bfloat16,QuantType.No,1,0,32,0,75.0599,moe_ck2stages_gemm1_256x32x64x64_1x4_TypeCast_v1_Nswizzle0_no_MulRoutedWeight0_silu,0.0%,41.8211,moe_ck2stages_gemm2_256x32x64x64_1x4_TypeCast_v1_Nswizzle0_no_MulRoutedWeight1,0.1%,116.881
129,4096,192,128,8,ActivationType.Silu,torch.bfloat16,torch.bfloat16,torch.bfloat16,QuantType.No,1,0,64,0,77.2029,moe_ck2stages_gemm1_256x64x64x64_1x4_TypeCast_v1_Nswizzle0_no_MulRoutedWeight0_silu,0.0%,52.5953,moe_ck2stages_gemm2_256x64x64x64_1x4_TypeCast_v1_Nswizzle0_no_MulRoutedWeight1,0.1%,129.7982
140,4096,192,128,8,ActivationType.Silu,torch.bfloat16,torch.bfloat16,torch.bfloat16,QuantType.No,1,0,32,0,73.0211,moe_ck2stages_gemm1_256x32x64x64_1x4_TypeCast_v1_Nswizzle0_no_MulRoutedWeight0_silu,0.0%,41.316,moe_ck2stages_gemm2_256x32x64x64_1x4_TypeCast_v1_Nswizzle0_no_MulRoutedWeight1,0.1%,114.3371
148,4096,192,128,8,ActivationType.Silu,torch.bfloat16,torch.bfloat16,torch.bfloat16,QuantType.No,1,0,64,0,77.857,moe_ck2stages_gemm1_256x64x64x64_1x4_TypeCast_v1_Nswizzle0_no_MulRoutedWeight0_silu,0.0%,52.4542,moe_ck2stages_gemm2_256x64x64x64_1x4_TypeCast_v1_Nswizzle0_no_MulRoutedWeight1,0.1%,130.3112
160,4096,192,128,8,ActivationType.Silu,torch.bfloat16,torch.bfloat16,torch.bfloat16,QuantType.No,1,0,64,0,77.7993,moe_ck2stages_gemm1_256x64x64x64_1x4_TypeCast_v1_Nswizzle0_no_MulRoutedWeight0_silu,0.0%,52.5131,moe_ck2stages_gemm2_256x64x64x64_1x4_TypeCast_v1_Nswizzle0_no_MulRoutedWeight1,0.1%,130.3124
167,4096,192,128,8,ActivationType.Silu,torch.bfloat16,torch.bfloat16,torch.bfloat16,QuantType.No,1,0,32,0,74.6039,moe_ck2stages_gemm1_256x32x64x64_1x4_TypeCast_v1_Nswizzle0_no_MulRoutedWeight0_silu,0.0%,47.3679,moe_ck2stages_gemm2_256x32x64x64_1x4_TypeCast_v1_Nswizzle0_no_MulRoutedWeight1,0.1%,121.9718
175,4096,192,128,8,ActivationType.Silu,torch.bfloat16,torch.bfloat16,torch.bfloat16,QuantType.No,1,0,32,0,77.0682,moe_ck2stages_gemm1_256x32x64x64_1x4_TypeCast_v1_Nswizzle0_no_MulRoutedWeight0_silu,0.0%,44.8618,moe_ck2stages_gemm2_256x32x64x64_1x4_TypeCast_v1_Nswizzle0_no_MulRoutedWeight1,0.1%,121.93
181,4096,192,128,8,ActivationType.Silu,torch.bfloat16,torch.bfloat16,torch.bfloat16,QuantType.No,1,0,32,0,76.1494,moe_ck2stages_gemm1_256x32x64x64_1x4_TypeCast_v1_Nswizzle0_no_MulRoutedWeight0_silu,0.0%,42.8406,moe_ck2stages_gemm2_256x32x64x64_1x4_TypeCast_v1_Nswizzle0_no_MulRoutedWeight1,0.1%,118.99
194,4096,192,128,8,ActivationType.Silu,torch.bfloat16,torch.bfloat16,torch.bfloat16,QuantType.No,1,0,32,0,74.5766,moe_ck2stages_gemm1_256x32x64x64_1x4_TypeCast_v1_Nswizzle0_no_MulRoutedWeight0_silu,0.0%,65.1489,moe_ck2stages_gemm2_256x32x64x64_1x4_TypeCast_v1_Nswizzle0_no_MulRoutedWeight1,0.1%,139.7255
202,4096,192,128,8,ActivationType.Silu,torch.bfloat16,torch.bfloat16,torch.bfloat16,QuantType.No,1,0,32,0,103.785,moe_ck2stages_gemm1_256x32x64x128_1x4_TypeCast_v1_Nswizzle0_no_MulRoutedWeight0_silu,0.0%,43.1363,moe_ck2stages_gemm2_256x32x64x64_1x4_TypeCast_v1_Nswizzle0_no_MulRoutedWeight1,0.1%,146.9213
217,4096,192,128,8,ActivationType.Silu,torch.bfloat16,torch.bfloat16,torch.bfloat16,QuantType.No,1,0,128,0,82.8683,moe_ck2stages_gemm1_256x128x64x64_1x4_TypeCast_v1_Nswizzle0_no_MulRoutedWeight0_silu,0.0%,75.9673,moe_ck2stages_gemm2_256x128x128x64_1x4_TypeCast_v1_Nswizzle0_no_MulRoutedWeight1,0.1%,158.8356
229,4096,192,128,8,ActivationType.Silu,torch.bfloat16,torch.bfloat16,torch.bfloat16,QuantType.No,1,0,32,0,75.9136,moe_ck2stages_gemm1_256x32x64x64_1x4_TypeCast_v1_Nswizzle0_no_MulRoutedWeight0_silu,0.0%,43.9432,moe_ck2stages_gemm2_256x32x64x64_1x4_TypeCast_v1_Nswizzle0_no_MulRoutedWeight1,0.1%,119.8568
231,4096,192,128,8,ActivationType.Silu,torch.bfloat16,torch.bfloat16,torch.bfloat16,QuantType.No,1,0,32,0,77.3544,moe_ck2stages_gemm1_256x32x64x128_1x4_TypeCast_v1_Nswizzle0_no_MulRoutedWeight0_silu,0.0%,43.9918,moe_ck2stages_gemm2_256x32x64x64_1x4_TypeCast_v1_Nswizzle0_no_MulRoutedWeight1,0.1%,121.3462
242,4096,192,128,8,ActivationType.Silu,torch.bfloat16,torch.bfloat16,torch.bfloat16,QuantType.No,1,0,128,0,84.3056,moe_ck2stages_gemm1_256x128x64x64_1x4_TypeCast_v1_Nswizzle0_no_MulRoutedWeight0_silu,0.0%,82.6947,moe_ck2stages_gemm2_256x128x64x64_1x4_TypeCast_v1_Nswizzle0_no_MulRoutedWeight1,0.1%,167.00029999999998
251,4096,192,128,8,ActivationType.Silu,torch.bfloat16,torch.bfloat16,torch.bfloat16,QuantType.No,1,0,64,0,106.1036,moe_ck2stages_gemm1_256x64x64x128_1x4_TypeCast_v1_Nswizzle0_no_MulRoutedWeight0_silu,0.0%,59.3788,moe_ck2stages_gemm2_256x64x64x64_1x4_TypeCast_v1_Nswizzle0_no_MulRoutedWeight1,0.1%,165.48239999999998
270,4096,192,128,8,ActivationType.Silu,torch.bfloat16,torch.bfloat16,torch.bfloat16,QuantType.No,1,0,32,0,75.8628,moe_ck2stages_gemm1_256x32x64x64_1x4_TypeCast_v1_Nswizzle0_no_MulRoutedWeight0_silu,0.0%,45.0842,moe_ck2stages_gemm2_256x32x64x64_1x4_TypeCast_v1_Nswizzle0_no_MulRoutedWeight1,0.1%,120.947
273,4096,192,128,8,ActivationType.Silu,torch.bfloat16,torch.bfloat16,torch.bfloat16,QuantType.No,1,0,128,0,80.9519,moe_ck2stages_gemm1_256x128x64x64_1x4_TypeCast_v1_Nswizzle0_no_MulRoutedWeight0_silu,0.0%,76.8259,moe_ck2stages_gemm2_256x128x128x64_1x4_TypeCast_v1_Nswizzle0_no_MulRoutedWeight1,0.1%,157.7778
283,4096,192,128,8,ActivationType.Silu,torch.bfloat16,torch.bfloat16,torch.bfloat16,QuantType.No,1,0,32,0,74.932,moe_ck2stages_gemm1_256x32x64x64_1x4_TypeCast_v1_Nswizzle0_no_MulRoutedWeight0_silu,0.0%,45.895,moe_ck2stages_gemm2_256x32x64x64_1x4_TypeCast_v1_Nswizzle0_no_MulRoutedWeight1,0.1%,120.827
297,4096,192,128,8,ActivationType.Silu,torch.bfloat16,torch.bfloat16,torch.bfloat16,QuantType.No,1,0,64,0,78.4817,moe_ck2stages_gemm1_256x64x64x64_1x4_TypeCast_v1_Nswizzle0_no_MulRoutedWeight0_silu,0.0%,56.0892,moe_ck2stages_gemm2_256x64x64x64_1x4_TypeCast_v1_Nswizzle0_no_MulRoutedWeight1,0.1%,134.5709
302,4096,192,128,8,ActivationType.Silu,torch.bfloat16,torch.bfloat16,torch.bfloat16,QuantType.No,1,0,32,0,76.0448,moe_ck2stages_gemm1_256x32x64x64_1x4_TypeCast_v1_Nswizzle0_no_MulRoutedWeight0_silu,0.0%,46.6564,moe_ck2stages_gemm2_256x32x64x64_1x4_TypeCast_v1_Nswizzle0_no_MulRoutedWeight1,0.1%,122.7012
315,4096,192,128,8,ActivationType.Silu,torch.bfloat16,torch.bfloat16,torch.bfloat16,QuantType.No,1,0,128,0,85.6753,moe_ck2stages_gemm1_256x128x64x64_1x4_TypeCast_v1_Nswizzle0_no_MulRoutedWeight0_silu,0.0%,69.1888,moe_ck2stages_gemm2_256x128x128x64_1x4_TypeCast_v3_Nswizzle0_no_MulRoutedWeight1,0.1%,154.8641
329,4096,192,128,8,ActivationType.Silu,torch.bfloat16,torch.bfloat16,torch.bfloat16,QuantType.No,1,0,64,0,75.264,moe_ck2stages_gemm1_256x64x64x64_1x4_TypeCast_v1_Nswizzle0_no_MulRoutedWeight0_silu,0.0%,56.9781,moe_ck2stages_gemm2_256x64x64x64_1x4_TypeCast_v1_Nswizzle0_no_MulRoutedWeight1,0.1%,132.2421
332,4096,192,128,8,ActivationType.Silu,torch.bfloat16,torch.bfloat16,torch.bfloat16,QuantType.No,1,0,128,0,94.1582,moe_ck2stages_gemm1_256x128x64x64_1x4_TypeCast_v1_Nswizzle0_no_MulRoutedWeight0_silu,0.0%,69.9825,moe_ck2stages_gemm2_256x128x128x64_1x4_TypeCast_v3_Nswizzle0_no_MulRoutedWeight1,0.1%,164.14069999999998
342,4096,192,128,8,ActivationType.Silu,torch.bfloat16,torch.bfloat16,torch.bfloat16,QuantType.No,1,0,64,0,77.1443,moe_ck2stages_gemm1_256x64x64x64_1x4_TypeCast_v1_Nswizzle0_no_MulRoutedWeight0_silu,0.0%,53.7008,moe_ck2stages_gemm2_256x64x64x64_1x4_TypeCast_v1_Nswizzle0_no_MulRoutedWeight1,0.1%,130.8451
358,4096,192,128,8,ActivationType.Silu,torch.bfloat16,torch.bfloat16,torch.bfloat16,QuantType.No,1,0,128,0,82.5308,moe_ck2stages_gemm1_256x128x64x64_1x4_TypeCast_v1_Nswizzle0_no_MulRoutedWeight0_silu,0.0%,72.2647,moe_ck2stages_gemm2_256x128x128x64_1x4_TypeCast_v3_Nswizzle0_no_MulRoutedWeight1,0.1%,154.7955
365,4096,192,128,8,ActivationType.Silu,torch.bfloat16,torch.bfloat16,torch.bfloat16,QuantType.No,1,0,64,0,82.8222,moe_ck2stages_gemm1_256x64x64x128_1x4_TypeCast_v1_Nswizzle0_no_MulRoutedWeight0_silu,0.0%,56.8461,moe_ck2stages_gemm2_256x64x64x64_1x4_TypeCast_v1_Nswizzle0_no_MulRoutedWeight1,0.1%,139.6683
378,4096,192,128,8,ActivationType.Silu,torch.bfloat16,torch.bfloat16,torch.bfloat16,QuantType.No,1,0,32,0,77.9893,moe_ck2stages_gemm1_256x32x64x64_1x4_TypeCast_v1_Nswizzle0_no_MulRoutedWeight0_silu,0.0%,48.7356,moe_ck2stages_gemm2_256x32x64x64_1x4_TypeCast_v1_Nswizzle0_no_MulRoutedWeight1,0.1%,126.7249
386,4096,192,128,8,ActivationType.Silu,torch.bfloat16,torch.bfloat16,torch.bfloat16,QuantType.No,1,0,128,0,81.8785,moe_ck2stages_gemm1_256x128x64x64_1x4_TypeCast_v1_Nswizzle0_no_MulRoutedWeight0_silu,0.0%,75.9595,moe_ck2stages_gemm2_256x128x128x64_1x4_TypeCast_v3_Nswizzle0_no_MulRoutedWeight1,0.1%,157.83800000000002
396,4096,192,128,8,ActivationType.Silu,torch.bfloat16,torch.bfloat16,torch.bfloat16,QuantType.No,1,0,64,0,80.643,moe_ck2stages_gemm1_256x64x64x128_1x4_TypeCast_v1_Nswizzle0_no_MulRoutedWeight0_silu,0.0%,57.4113,moe_ck2stages_gemm2_256x64x64x64_1x4_TypeCast_v1_Nswizzle0_no_MulRoutedWeight1,0.1%,138.0543
404,4096,192,128,8,ActivationType.Silu,torch.bfloat16,torch.bfloat16,torch.bfloat16,QuantType.No,1,0,32,0,74.7229,moe_ck2stages_gemm1_256x32x64x64_1x4_TypeCast_v1_Nswizzle0_no_MulRoutedWeight0_silu,0.0%,50.1322,moe_ck2stages_gemm2_256x32x64x64_1x4_TypeCast_v1_Nswizzle0_no_MulRoutedWeight1,0.1%,124.8551
416,4096,192,128,8,ActivationType.Silu,torch.bfloat16,torch.bfloat16,torch.bfloat16,QuantType.No,1,0,32,0,75.1799,moe_ck2stages_gemm1_256x32x64x64_1x4_TypeCast_v1_Nswizzle0_no_MulRoutedWeight0_silu,0.0%,49.9039,moe_ck2stages_gemm2_256x32x64x64_1x4_TypeCast_v1_Nswizzle0_no_MulRoutedWeight1,0.1%,125.0838
427,4096,192,128,8,ActivationType.Silu,torch.bfloat16,torch.bfloat16,torch.bfloat16,QuantType.No,1,0,32,0,80.7743,moe_ck2stages_gemm1_256x32x64x128_1x4_TypeCast_v1_Nswizzle0_no_MulRoutedWeight0_silu,0.0%,48.7182,moe_ck2stages_gemm2_256x32x64x64_1x4_TypeCast_v1_Nswizzle0_no_MulRoutedWeight1,0.1%,129.4925
440,4096,192,128,8,ActivationType.Silu,torch.bfloat16,torch.bfloat16,torch.bfloat16,QuantType.No,1,0,64,0,78.5328,moe_ck2stages_gemm1_256x64x64x64_1x4_TypeCast_v1_Nswizzle0_no_MulRoutedWeight0_silu,0.0%,57.1505,moe_ck2stages_gemm2_256x64x64x64_1x4_TypeCast_v1_Nswizzle0_no_MulRoutedWeight1,0.1%,135.6833
444,4096,192,128,8,ActivationType.Silu,torch.bfloat16,torch.bfloat16,torch.bfloat16,QuantType.No,1,0,32,0,77.3434,moe_ck2stages_gemm1_256x32x64x64_1x4_TypeCast_v1_Nswizzle0_no_MulRoutedWeight0_silu,0.0%,50.1474,moe_ck2stages_gemm2_256x32x64x64_1x4_TypeCast_v1_Nswizzle0_no_MulRoutedWeight1,0.1%,127.4908
455,4096,192,128,8,ActivationType.Silu,torch.bfloat16,torch.bfloat16,torch.bfloat16,QuantType.No,1,0,64,0,100.6237,moe_ck2stages_gemm1_256x64x64x64_1x4_TypeCast_v1_Nswizzle0_no_MulRoutedWeight0_silu,0.0%,58.4111,moe_ck2stages_gemm2_256x64x64x64_1x4_TypeCast_v1_Nswizzle0_no_MulRoutedWeight1,0.1%,159.0348
470,4096,192,128,8,ActivationType.Silu,torch.bfloat16,torch.bfloat16,torch.bfloat16,QuantType.No,1,0,32,0,83.4172,moe_ck2stages_gemm1_256x32x64x64_1x4_TypeCast_v1_Nswizzle0_no_MulRoutedWeight0_silu,0.0%,51.9533,moe_ck2stages_gemm2_256x32x64x64_1x4_TypeCast_v1_Nswizzle0_no_MulRoutedWeight1,0.1%,135.3705
475,4096,192,128,8,ActivationType.Silu,torch.bfloat16,torch.bfloat16,torch.bfloat16,QuantType.No,1,0,128,0,81.4838,moe_ck2stages_gemm1_256x128x64x64_1x4_TypeCast_v1_Nswizzle0_no_MulRoutedWeight0_silu,0.0%,87.6603,moe_ck2stages_gemm2_256x128x128x64_1x4_TypeCast_v1_Nswizzle0_no_MulRoutedWeight1,0.1%,169.1441
487,4096,192,128,8,ActivationType.Silu,torch.bfloat16,torch.bfloat16,torch.bfloat16,QuantType.No,1,0,64,0,80.5644,moe_ck2stages_gemm1_256x64x64x64_1x4_TypeCast_v1_Nswizzle0_no_MulRoutedWeight0_silu,0.0%,59.3147,moe_ck2stages_gemm2_256x64x64x64_1x4_TypeCast_v1_Nswizzle0_no_MulRoutedWeight1,0.1%,139.8791
496,4096,192,128,8,ActivationType.Silu,torch.bfloat16,torch.bfloat16,torch.bfloat16,QuantType.No,1,0,64,0,80.7017,moe_ck2stages_gemm1_256x64x64x64_1x4_TypeCast_v1_Nswizzle0_no_MulRoutedWeight0_silu,0.0%,60.5355,moe_ck2stages_gemm2_256x64x64x64_1x4_TypeCast_v1_Nswizzle0_no_MulRoutedWeight1,0.1%,141.2372
507,4096,192,128,8,ActivationType.Silu,torch.bfloat16,torch.bfloat16,torch.bfloat16,QuantType.No,1,0,64,0,80.9088,moe_ck2stages_gemm1_256x64x64x64_1x4_TypeCast_v1_Nswizzle0_no_MulRoutedWeight0_silu,0.0%,59.8263,moe_ck2stages_gemm2_256x64x64x64_1x4_TypeCast_v1_Nswizzle0_no_MulRoutedWeight1,0.1%,140.7351
512,4096,192,128,8,ActivationType.Silu,torch.bfloat16,torch.bfloat16,torch.bfloat16,QuantType.No,1,0,128,0,84.6459,moe_ck2stages_gemm1_256x128x64x64_1x4_TypeCast_v1_Nswizzle0_no_MulRoutedWeight0_silu,0.0%,85.2881,moe_ck2stages_gemm2_256x128x128x64_1x4_TypeCast_v3_Nswizzle0_no_MulRoutedWeight1,0.1%,169.934
521,4096,192,128,8,ActivationType.Silu,torch.bfloat16,torch.bfloat16,torch.bfloat16,QuantType.No,1,0,128,0,84.7088,moe_ck2stages_gemm1_256x128x64x64_1x4_TypeCast_v1_Nswizzle0_no_MulRoutedWeight0_silu,0.0%,84.817,moe_ck2stages_gemm2_256x128x128x64_1x4_TypeCast_v3_Nswizzle0_no_MulRoutedWeight1,0.1%,169.5258
536,4096,192,128,8,ActivationType.Silu,torch.bfloat16,torch.bfloat16,torch.bfloat16,QuantType.No,1,0,32,0,108.3267,moe_ck2stages_gemm1_256x32x64x128_1x4_TypeCast_v1_Nswizzle0_no_MulRoutedWeight0_silu,0.0%,57.7033,moe_ck2stages_gemm2_256x32x64x64_1x4_TypeCast_v1_Nswizzle0_no_MulRoutedWeight1,0.1%,166.03
545,4096,192,128,8,ActivationType.Silu,torch.bfloat16,torch.bfloat16,torch.bfloat16,QuantType.No,1,0,64,0,81.4655,moe_ck2stages_gemm1_256x64x64x64_1x4_TypeCast_v1_Nswizzle0_no_MulRoutedWeight0_silu,0.0%,62.0001,moe_ck2stages_gemm2_256x64x64x64_1x4_TypeCast_v1_Nswizzle0_no_MulRoutedWeight1,0.1%,143.4656
555,4096,192,128,8,ActivationType.Silu,torch.bfloat16,torch.bfloat16,torch.bfloat16,QuantType.No,1,0,64,0,82.3406,moe_ck2stages_gemm1_256x64x64x64_1x4_TypeCast_v1_Nswizzle0_no_MulRoutedWeight0_silu,0.0%,62.3545,moe_ck2stages_gemm2_256x64x64x64_1x4_TypeCast_v1_Nswizzle0_no_MulRoutedWeight1,0.1%,144.6951
564,4096,192,128,8,ActivationType.Silu,torch.bfloat16,torch.bfloat16,torch.bfloat16,QuantType.No,1,0,64,0,78.9265,moe_ck2stages_gemm1_256x64x64x64_1x4_TypeCast_v1_Nswizzle0_no_MulRoutedWeight0_silu,0.0%,62.0303,moe_ck2stages_gemm2_256x64x64x64_1x4_TypeCast_v1_Nswizzle0_no_MulRoutedWeight1,0.1%,140.9568
576,4096,192,128,8,ActivationType.Silu,torch.bfloat16,torch.bfloat16,torch.bfloat16,QuantType.No,1,0,64,0,81.9104,moe_ck2stages_gemm1_256x64x64x64_1x4_TypeCast_v1_Nswizzle0_no_MulRoutedWeight0_silu,0.0%,62.6858,moe_ck2stages_gemm2_256x64x64x64_1x4_TypeCast_v1_Nswizzle0_no_MulRoutedWeight1,0.1%,144.5962
586,4096,192,128,8,ActivationType.Silu,torch.bfloat16,torch.bfloat16,torch.bfloat16,QuantType.No,1,0,128,0,84.4829,moe_ck2stages_gemm1_256x128x64x64_1x4_TypeCast_v1_Nswizzle0_no_MulRoutedWeight0_silu,0.0%,88.1277,moe_ck2stages_gemm2_256x128x64x64_1x4_TypeCast_v1_Nswizzle0_no_MulRoutedWeight1,0.1%,172.6106
600,4096,192,128,8,ActivationType.Silu,torch.bfloat16,torch.bfloat16,torch.bfloat16,QuantType.No,1,0,64,0,82.7348,moe_ck2stages_gemm1_256x64x64x64_1x4_TypeCast_v1_Nswizzle0_no_MulRoutedWeight0_silu,0.0%,63.6596,moe_ck2stages_gemm2_256x64x64x64_1x4_TypeCast_v1_Nswizzle0_no_MulRoutedWeight1,0.1%,146.39440000000002
603,4096,192,128,8,ActivationType.Silu,torch.bfloat16,torch.bfloat16,torch.bfloat16,QuantType.No,1,0,64,0,83.1285,moe_ck2stages_gemm1_256x64x64x64_1x4_TypeCast_v1_Nswizzle0_no_MulRoutedWeight0_silu,0.0%,63.6925,moe_ck2stages_gemm2_256x64x64x64_1x4_TypeCast_v1_Nswizzle0_no_MulRoutedWeight1,0.1%,146.821
612,4096,192,128,8,ActivationType.Silu,torch.bfloat16,torch.bfloat16,torch.bfloat16,QuantType.No,1,0,64,0,81.271,moe_ck2stages_gemm1_256x64x64x64_1x4_TypeCast_v1_Nswizzle0_no_MulRoutedWeight0_silu,0.0%,79.4386,moe_ck2stages_gemm2_256x64x64x64_1x4_TypeCast_v1_Nswizzle0_no_MulRoutedWeight1,0.1%,160.7096
622,4096,192,128,8,ActivationType.Silu,torch.bfloat16,torch.bfloat16,torch.bfloat16,QuantType.No,1,0,128,0,85.1911,moe_ck2stages_gemm1_256x128x64x64_1x4_TypeCast_v1_Nswizzle0_no_MulRoutedWeight0_silu,0.0%,89.0524,moe_ck2stages_gemm2_256x128x64x64_1x4_TypeCast_v1_Nswizzle0_no_MulRoutedWeight1,0.1%,174.2435
639,4096,192,128,8,ActivationType.Silu,torch.bfloat16,torch.bfloat16,torch.bfloat16,QuantType.No,1,0,128,0,84.9643,moe_ck2stages_gemm1_256x128x64x64_1x4_TypeCast_v1_Nswizzle0_no_MulRoutedWeight0_silu,0.0%,90.6926,moe_ck2stages_gemm2_256x128x64x64_1x4_TypeCast_v1_Nswizzle0_no_MulRoutedWeight1,0.1%,175.6569
646,4096,192,128,8,ActivationType.Silu,torch.bfloat16,torch.bfloat16,torch.bfloat16,QuantType.No,1,0,128,0,83.8596,moe_ck2stages_gemm1_256x128x64x64_1x4_TypeCast_v1_Nswizzle0_no_MulRoutedWeight0_silu,0.0%,90.355,moe_ck2stages_gemm2_256x128x64x64_1x4_TypeCast_v1_Nswizzle0_no_MulRoutedWeight1,0.1%,174.21460000000002
651,4096,192,128,8,ActivationType.Silu,torch.bfloat16,torch.bfloat16,torch.bfloat16,QuantType.No,1,0,64,0,83.2926,moe_ck2stages_gemm1_256x64x64x64_1x4_TypeCast_v1_Nswizzle0_no_MulRoutedWeight0_silu,0.0%,64.0757,moe_ck2stages_gemm2_256x64x64x64_1x4_TypeCast_v1_Nswizzle0_no_MulRoutedWeight1,0.1%,147.36829999999998
667,4096,192,128,8,ActivationType.Silu,torch.bfloat16,torch.bfloat16,torch.bfloat16,QuantType.No,1,0,64,0,81.1455,moe_ck2stages_gemm1_256x64x64x64_1x4_TypeCast_v1_Nswizzle0_no_MulRoutedWeight0_silu,0.0%,65.0218,moe_ck2stages_gemm2_256x64x64x64_1x4_TypeCast_v1_Nswizzle0_no_MulRoutedWeight1,0.1%,146.1673
674,4096,192,128,8,ActivationType.Silu,torch.bfloat16,torch.bfloat16,torch.bfloat16,QuantType.No,1,0,64,0,108.3921,moe_ck2stages_gemm1_256x64x64x64_1x4_TypeCast_v1_Nswizzle0_no_MulRoutedWeight0_silu,0.0%,65.0554,moe_ck2stages_gemm2_256x64x64x64_1x4_TypeCast_v1_Nswizzle0_no_MulRoutedWeight1,0.1%,173.4475
685,4096,192,128,8,ActivationType.Silu,torch.bfloat16,torch.bfloat16,torch.bfloat16,QuantType.No,1,0,64,0,82.8223,moe_ck2stages_gemm1_256x64x64x64_1x4_TypeCast_v1_Nswizzle0_no_MulRoutedWeight0_silu,0.0%,65.4665,moe_ck2stages_gemm2_256x64x64x64_1x4_TypeCast_v1_Nswizzle0_no_MulRoutedWeight1,0.1%,148.28879999999998
696,4096,192,128,8,ActivationType.Silu,torch.bfloat16,torch.bfloat16,torch.bfloat16,QuantType.No,1,0,64,0,81.9805,moe_ck2stages_gemm1_256x64x64x64_1x4_TypeCast_v1_Nswizzle0_no_MulRoutedWeight0_silu,0.0%,66.3998,moe_ck2stages_gemm2_256x64x64x64_1x4_TypeCast_v1_Nswizzle0_no_MulRoutedWeight1,0.1%,148.3803
701,4096,192,128,8,ActivationType.Silu,torch.bfloat16,torch.bfloat16,torch.bfloat16,QuantType.No,1,0,64,0,83.0409,moe_ck2stages_gemm1_256x64x64x64_1x4_TypeCast_v1_Nswizzle0_no_MulRoutedWeight0_silu,0.0%,66.8459,moe_ck2stages_gemm2_256x64x64x64_1x4_TypeCast_v1_Nswizzle0_no_MulRoutedWeight1,0.1%,149.8868
713,4096,192,128,8,ActivationType.Silu,torch.bfloat16,torch.bfloat16,torch.bfloat16,QuantType.No,1,0,64,0,82.9192,moe_ck2stages_gemm1_256x64x64x64_1x4_TypeCast_v1_Nswizzle0_no_MulRoutedWeight0_silu,0.0%,76.6325,moe_ck2stages_gemm2_256x64x64x64_1x4_TypeCast_v1_Nswizzle0_no_MulRoutedWeight1,0.1%,159.55169999999998
721,4096,192,128,8,ActivationType.Silu,torch.bfloat16,torch.bfloat16,torch.bfloat16,QuantType.No,1,0,64,0,83.613,moe_ck2stages_gemm1_256x64x64x64_1x4_TypeCast_v1_Nswizzle0_no_MulRoutedWeight0_silu,0.0%,65.6601,moe_ck2stages_gemm2_256x64x64x64_1x4_TypeCast_v1_Nswizzle0_no_MulRoutedWeight1,0.1%,149.2731
737,4096,192,128,8,ActivationType.Silu,torch.bfloat16,torch.bfloat16,torch.bfloat16,QuantType.No,1,0,64,0,82.6104,moe_ck2stages_gemm1_256x64x64x64_1x4_TypeCast_v1_Nswizzle0_no_MulRoutedWeight0_silu,0.0%,68.5869,moe_ck2stages_gemm2_256x64x64x64_1x4_TypeCast_v1_Nswizzle0_no_MulRoutedWeight1,0.1%,151.19729999999998
747,4096,192,128,8,ActivationType.Silu,torch.bfloat16,torch.bfloat16,torch.bfloat16,QuantType.No,1,0,64,0,83.1347,moe_ck2stages_gemm1_256x64x64x64_1x4_TypeCast_v1_Nswizzle0_no_MulRoutedWeight0_silu,0.0%,67.1753,moe_ck2stages_gemm2_256x64x64x64_1x4_TypeCast_v1_Nswizzle0_no_MulRoutedWeight1,0.1%,150.31
759,4096,192,128,8,ActivationType.Silu,torch.bfloat16,torch.bfloat16,torch.bfloat16,QuantType.No,1,0,64,0,83.8318,moe_ck2stages_gemm1_256x64x64x64_1x4_TypeCast_v1_Nswizzle0_no_MulRoutedWeight0_silu,0.0%,67.8439,moe_ck2stages_gemm2_256x64x64x64_1x4_TypeCast_v1_Nswizzle0_no_MulRoutedWeight1,0.1%,151.6757
764,4096,192,128,8,ActivationType.Silu,torch.bfloat16,torch.bfloat16,torch.bfloat16,QuantType.No,1,0,32,0,125.6445,moe_ck2stages_gemm1_256x32x64x64_1x4_TypeCast_v1_Nswizzle0_no_MulRoutedWeight0_silu,0.0%,68.304,moe_ck2stages_gemm2_256x32x64x64_1x4_TypeCast_v1_Nswizzle0_no_MulRoutedWeight1,0.1%,193.9485
771,4096,192,128,8,ActivationType.Silu,torch.bfloat16,torch.bfloat16,torch.bfloat16,QuantType.No,1,0,64,0,83.5335,moe_ck2stages_gemm1_256x64x64x64_1x4_TypeCast_v1_Nswizzle0_no_MulRoutedWeight0_silu,0.0%,67.026,moe_ck2stages_gemm2_256x64x64x64_1x4_TypeCast_v1_Nswizzle0_no_MulRoutedWeight1,0.1%,150.5595
789,4096,192,128,8,ActivationType.Silu,torch.bfloat16,torch.bfloat16,torch.bfloat16,QuantType.No,1,0,128,0,83.3985,moe_ck2stages_gemm1_256x128x64x64_1x4_TypeCast_v1_Nswizzle0_no_MulRoutedWeight0_silu,0.0%,93.6865,moe_ck2stages_gemm2_256x128x64x64_1x4_TypeCast_v1_Nswizzle0_no_MulRoutedWeight1,0.1%,177.08499999999998
800,4096,192,128,8,ActivationType.Silu,torch.bfloat16,torch.bfloat16,torch.bfloat16,QuantType.No,1,0,64,0,85.2536,moe_ck2stages_gemm1_256x64x64x64_1x4_TypeCast_v1_Nswizzle0_no_MulRoutedWeight0_silu,0.0%,69.852,moe_ck2stages_gemm2_256x64x64x64_1x4_TypeCast_v1_Nswizzle0_no_MulRoutedWeight1,0.1%,155.1056
801,4096,192,128,8,ActivationType.Silu,torch.bfloat16,torch.bfloat16,torch.bfloat16,QuantType.No,1,0,128,0,86.515,moe_ck2stages_gemm1_256x128x64x64_1x4_TypeCast_v1_Nswizzle0_no_MulRoutedWeight0_silu,0.0%,95.8222,moe_ck2stages_gemm2_256x128x64x64_1x4_TypeCast_v1_Nswizzle0_no_MulRoutedWeight1,0.1%,182.3372
819,4096,192,128,8,ActivationType.Silu,torch.bfloat16,torch.bfloat16,torch.bfloat16,QuantType.No,1,0,128,0,86.6275,moe_ck2stages_gemm1_256x128x64x64_1x4_TypeCast_v1_Nswizzle0_no_MulRoutedWeight0_silu,0.0%,94.4118,moe_ck2stages_gemm2_256x128x64x64_1x4_TypeCast_v1_Nswizzle0_no_MulRoutedWeight1,0.1%,181.0393
824,4096,192,128,8,ActivationType.Silu,torch.bfloat16,torch.bfloat16,torch.bfloat16,QuantType.No,1,0,64,0,84.6935,moe_ck2stages_gemm1_256x64x64x64_1x4_TypeCast_v1_Nswizzle0_no_MulRoutedWeight0_silu,0.0%,68.7624,moe_ck2stages_gemm2_256x64x64x64_1x4_TypeCast_v1_Nswizzle0_no_MulRoutedWeight1,0.1%,153.4559
839,4096,192,128,8,ActivationType.Silu,torch.bfloat16,torch.bfloat16,torch.bfloat16,QuantType.No,1,0,128,0,86.4091,moe_ck2stages_gemm1_256x128x64x64_1x4_TypeCast_v1_Nswizzle0_no_MulRoutedWeight0_silu,0.0%,114.3047,moe_ck2stages_gemm2_256x128x128x64_1x4_TypeCast_v1_Nswizzle0_no_MulRoutedWeight1,0.1%,200.7138
845,4096,192,128,8,ActivationType.Silu,torch.bfloat16,torch.bfloat16,torch.bfloat16,QuantType.No,1,0,128,0,88.1597,moe_ck2stages_gemm1_256x128x64x64_1x4_TypeCast_v1_Nswizzle0_no_MulRoutedWeight0_silu,0.0%,96.6494,moe_ck2stages_gemm2_256x128x64x64_1x4_TypeCast_v1_Nswizzle0_no_MulRoutedWeight1,0.1%,184.8091
851,4096,192,128,8,ActivationType.Silu,torch.bfloat16,torch.bfloat16,torch.bfloat16,QuantType.No,1,0,64,0,91.2028,moe_ck2stages_gemm1_256x64x64x128_1x4_TypeCast_v1_Nswizzle0_no_MulRoutedWeight0_silu,0.0%,72.5497,moe_ck2stages_gemm2_256x64x64x64_1x4_TypeCast_v1_Nswizzle0_no_MulRoutedWeight1,0.1%,163.7525
869,4096,192,128,8,ActivationType.Silu,torch.bfloat16,torch.bfloat16,torch.bfloat16,QuantType.No,1,0,128,0,88.1865,moe_ck2stages_gemm1_256x128x64x64_1x4_TypeCast_v1_Nswizzle0_no_MulRoutedWeight0_silu,0.0%,120.4006,moe_ck2stages_gemm2_256x128x64x64_1x4_TypeCast_v1_Nswizzle0_no_MulRoutedWeight1,0.1%,208.5871
878,4096,192,128,8,ActivationType.Silu,torch.bfloat16,torch.bfloat16,torch.bfloat16,QuantType.No,1,0,128,0,86.8809,moe_ck2stages_gemm1_256x128x64x64_1x4_TypeCast_v1_Nswizzle0_no_MulRoutedWeight0_silu,0.0%,94.5368,moe_ck2stages_gemm2_256x128x64x64_1x4_TypeCast_v1_Nswizzle0_no_MulRoutedWeight1,0.1%,181.4177
886,4096,192,128,8,ActivationType.Silu,torch.bfloat16,torch.bfloat16,torch.bfloat16,QuantType.No,1,0,128,0,87.4127,moe_ck2stages_gemm1_256x128x64x64_1x4_TypeCast_v1_Nswizzle0_no_MulRoutedWeight0_silu,0.0%,95.3077,moe_ck2stages_gemm2_256x128x64x64_1x4_TypeCast_v1_Nswizzle0_no_MulRoutedWeight1,0.1%,182.7204
900,4096,192,128,8,ActivationType.Silu,torch.bfloat16,torch.bfloat16,torch.bfloat16,QuantType.No,1,0,64,0,87.3858,moe_ck2stages_gemm1_256x64x64x64_1x4_TypeCast_v1_Nswizzle0_no_MulRoutedWeight0_silu,0.0%,74.531,moe_ck2stages_gemm2_256x64x64x64_1x4_TypeCast_v1_Nswizzle0_no_MulRoutedWeight1,0.1%,161.91680000000002
904,4096,192,128,8,ActivationType.Silu,torch.bfloat16,torch.bfloat16,torch.bfloat16,QuantType.No,1,0,32,0,146.3602,moe_ck2stages_gemm1_256x32x64x128_1x4_TypeCast_v1_Nswizzle0_no_MulRoutedWeight0_silu,0.0%,156.2976,moe_ck2stages_gemm2_256x32x64x64_1x4_TypeCast_v1_Nswizzle0_no_MulRoutedWeight1,0.1%,302.65779999999995
918,4096,192,128,8,ActivationType.Silu,torch.bfloat16,torch.bfloat16,torch.bfloat16,QuantType.No,1,0,128,0,90.2046,moe_ck2stages_gemm1_256x128x64x64_1x4_TypeCast_v1_Nswizzle0_no_MulRoutedWeight0_silu,0.0%,99.0093,moe_ck2stages_gemm2_256x128x64x64_1x4_TypeCast_v1_Nswizzle0_no_MulRoutedWeight1,0.1%,189.2139
927,4096,192,128,8,ActivationType.Silu,torch.bfloat16,torch.bfloat16,torch.bfloat16,QuantType.No,1,0,128,0,87.6638,moe_ck2stages_gemm1_256x128x64x64_1x4_TypeCast_v1_Nswizzle0_no_MulRoutedWeight0_silu,0.0%,98.6546,moe_ck2stages_gemm2_256x128x64x64_1x4_TypeCast_v1_Nswizzle0_no_MulRoutedWeight1,0.1%,186.3184
932,4096,192,128,8,ActivationType.Silu,torch.bfloat16,torch.bfloat16,torch.bfloat16,QuantType.No,1,0,64,0,119.5653,moe_ck2stages_gemm1_256x64x64x64_1x4_TypeCast_v1_Nswizzle0_no_MulRoutedWeight0_silu,0.0%,94.0182,moe_ck2stages_gemm2_256x64x64x64_1x4_TypeCast_v1_Nswizzle0_no_MulRoutedWeight1,0.1%,213.5835
942,4096,192,128,8,ActivationType.Silu,torch.bfloat16,torch.bfloat16,torch.bfloat16,QuantType.No,1,0,128,0,88.2634,moe_ck2stages_gemm1_256x128x64x64_1x4_TypeCast_v1_Nswizzle0_no_MulRoutedWeight0_silu,0.0%,96.0208,moe_ck2stages_gemm2_256x128x64x64_1x4_TypeCast_v1_Nswizzle0_no_MulRoutedWeight1,0.1%,184.2842
957,4096,192,128,8,ActivationType.Silu,torch.bfloat16,torch.bfloat16,torch.bfloat16,QuantType.No,1,0,128,0,89.0006,moe_ck2stages_gemm1_256x128x64x64_1x4_TypeCast_v1_Nswizzle0_no_MulRoutedWeight0_silu,0.0%,98.321,moe_ck2stages_gemm2_256x128x64x64_1x4_TypeCast_v1_Nswizzle0_no_MulRoutedWeight1,0.1%,187.3216
965,4096,192,128,8,ActivationType.Silu,torch.bfloat16,torch.bfloat16,torch.bfloat16,QuantType.No,1,0,64,0,97.2268,moe_ck2stages_gemm1_256x64x64x128_1x4_TypeCast_v1_Nswizzle0_no_MulRoutedWeight0_silu,0.0%,81.1427,moe_ck2stages_gemm2_256x64x64x64_1x4_TypeCast_v1_Nswizzle0_no_MulRoutedWeight1,0.1%,178.36950000000002
972,4096,192,128,8,ActivationType.Silu,torch.bfloat16,torch.bfloat16,torch.bfloat16,QuantType.No,1,0,64,0,93.8906,moe_ck2stages_gemm1_256x64x64x64_1x4_TypeCast_v1_Nswizzle0_no_MulRoutedWeight0_silu,0.0%,78.7038,moe_ck2stages_gemm2_256x64x64x64_1x4_TypeCast_v1_Nswizzle0_no_MulRoutedWeight1,0.1%,172.5944
984,4096,192,128,8,ActivationType.Silu,torch.bfloat16,torch.bfloat16,torch.bfloat16,QuantType.No,1,0,128,0,88.935,moe_ck2stages_gemm1_256x128x64x64_1x4_TypeCast_v1_Nswizzle0_no_MulRoutedWeight0_silu,0.0%,100.5962,moe_ck2stages_gemm2_256x128x64x64_1x4_TypeCast_v1_Nswizzle0_no_MulRoutedWeight1,0.1%,189.5312
999,4096,192,128,8,ActivationType.Silu,torch.bfloat16,torch.bfloat16,torch.bfloat16,QuantType.No,1,0,64,0,115.1325,moe_ck2stages_gemm1_256x64x64x128_1x4_TypeCast_v1_Nswizzle0_no_MulRoutedWeight0_silu,0.0%,81.2932,moe_ck2stages_gemm2_256x64x64x64_1x4_TypeCast_v1_Nswizzle0_no_MulRoutedWeight1,0.1%,196.4257
1005,4096,192,128,8,ActivationType.Silu,torch.bfloat16,torch.bfloat16,torch.bfloat16,QuantType.No,1,0,128,0,89.6367,moe_ck2stages_gemm1_256x128x64x64_1x4_TypeCast_v1_Nswizzle0_no_MulRoutedWeight0_silu,0.0%,99.2763,moe_ck2stages_gemm2_256x128x64x64_1x4_TypeCast_v1_Nswizzle0_no_MulRoutedWeight1,0.1%,188.913
1019,4096,192,128,8,ActivationType.Silu,torch.bfloat16,torch.bfloat16,torch.bfloat16,QuantType.No,1,0,128,0,89.6629,moe_ck2stages_gemm1_256x128x64x64_1x4_TypeCast_v1_Nswizzle0_no_MulRoutedWeight0_silu,0.0%,100.3883,moe_ck2stages_gemm2_256x128x64x64_1x4_TypeCast_v1_Nswizzle0_no_MulRoutedWeight1,0.1%,190.0512
1021,4096,192,128,8,ActivationType.Silu,torch.bfloat16,torch.bfloat16,torch.bfloat16,QuantType.No,1,0,128,0,87.985,moe_ck2stages_gemm1_256x128x64x64_1x4_TypeCast_v1_Nswizzle0_no_MulRoutedWeight0_silu,0.0%,96.8212,moe_ck2stages_gemm2_256x128x64x64_1x4_TypeCast_v1_Nswizzle0_no_MulRoutedWeight1,0.1%,184.8062
