aiter/configs/tuned_hybrid_fmoe.csv
cu_num,token,model_dim,inter_dim,expert,topk,act_type,dtype,q_dtype_a,q_dtype_w,q_type,use_g1u1,doweight_stage1,q_dtype_a2,q_dtype_w2,q_type2,block_m,block_m2,ksplit,us1,kernelName1,err1,us2,kernelName2,err2,us,run_1stage,tflops,bw,_tag
256,20480,4096,1536,400,20,ActivationType.Gelu,torch.bfloat16,torch.int8,torch.int8,QuantType.per_Token,0,0,torch.int8,torch.int8,QuantType.per_Token,128,128,0,3184.5362,flydsl_moe1_aint8_wint8_bf16_t128x128x128_async_bnt0,0.6%,3622.8508,flydsl_moe2_aint8_wint8_bf16_t128x128x128_atomic_w2_bnt0,8.6%,6807.387,0,1514.23,776.34,
256,20480,4096,1536,400,20,ActivationType.Gelu,torch.bfloat16,torch.float4_e2m1fn_x2,torch.float4_e2m1fn_x2,QuantType.per_1x32,0,0,torch.float4_e2m1fn_x2,torch.float4_e2m1fn_x2,QuantType.per_1x32,128,64,0,2499.3974,flydsl_moe1_afp4_wfp4_bf16_t128x128x256_async_w3_bnt0,0.2%,2809.9599,flydsl_moe2_afp4_wfp4_bf16_t64x128x256_atomic_w0_bnt0,9.1%,5309.3573,0,1941.46,995.38,
256,20480,4096,1536,400,20,ActivationType.Gelu,torch.bfloat16,torch.float4_e2m1fn_x2,torch.float4_e2m1fn_x2,QuantType.per_1x32,0,0,torch.int8,torch.int8,QuantType.per_Token,128,128,0,2471.7789,flydsl_moe1_afp4_wfp4_bf16_t128x128x256_async_w3_bnt0,0.2%,3658.1978,flydsl_moe2_aint8_wint8_bf16_t128x128x128_atomic_w3_bnt0,8.9%,6129.9767,0,1681.56,862.13,
256,20480,4096,1536,400,20,ActivationType.Gelu,torch.bfloat16,torch.int8,torch.int8,QuantType.per_Token,0,0,torch.float4_e2m1fn_x2,torch.float4_e2m1fn_x2,QuantType.per_1x32,128,64,0,3403.9011,flydsl_moe1_aint8_wint8_bf16_t128x256x128_async_bnt0,1.3%,2821.0196,flydsl_moe2_afp4_wfp4_bf16_t64x128x256_atomic_w0_bnt0,8.8%,6224.9207,0,1655.91,848.98,
