aiter/configs/tuned_hybrid_fmoe.csv
cu_num,token,model_dim,inter_dim,expert,topk,act_type,dtype,q_dtype_a,q_dtype_w,q_type,use_g1u1,doweight_stage1,q_dtype_a2,q_dtype_w2,q_type2,block_m,ksplit,us1,kernelName1,err1,us2,kernelName2,err2,us,run_1stage,tflops,bw,_tag
256,20480,4096,1536,400,20,ActivationType.Gelu,torch.bfloat16,torch.int8,torch.int8,QuantType.per_Token,0,0,torch.int8,torch.int8,QuantType.per_Token,128,0,3174.1584,flydsl_moe1_aint8_wint8_bf16_t128x128x128_async_w2_bnt0,0.6%,3666.7654,flydsl_moe2_aint8_wint8_bf16_t128x128x128_atomic_w1_bnt0,8.6%,6840.9238,0,1506.8,772.53,
256,20480,4096,1536,400,20,ActivationType.Gelu,torch.bfloat16,torch.float4_e2m1fn_x2,torch.float4_e2m1fn_x2,QuantType.per_1x32,0,0,torch.float4_e2m1fn_x2,torch.float4_e2m1fn_x2,QuantType.per_1x32,64,0,2665.9841,flydsl_moe1_afp4_wfp4_bf16_t64x128x256_async_w4_bnt0,0.0%,2859.966,flydsl_moe2_afp4_wfp4_bf16_t64x128x256_atomic_w0_bnt0,9.1%,5525.9501,0,1865.37,956.36,
256,20480,4096,1536,400,20,ActivationType.Gelu,torch.bfloat16,torch.float4_e2m1fn_x2,torch.float4_e2m1fn_x2,QuantType.per_1x32,0,0,torch.int8,torch.int8,QuantType.per_Token,128,0,2607.886,flydsl_moe1_afp4_wfp4_bf16_t128x128x256_async_w3_bnt0,0.0%,3633.8591,flydsl_moe2_aint8_wint8_bf16_t128x128x128_atomic_bnt0,8.9%,6241.7451,0,1651.45,846.69,
256,20480,4096,1536,400,20,ActivationType.Gelu,torch.bfloat16,torch.int8,torch.int8,QuantType.per_Token,0,0,torch.float4_e2m1fn_x2,torch.float4_e2m1fn_x2,QuantType.per_1x32,64,0,3492.4235,flydsl_moe1_aint8_wint8_bf16_t64x128x128_w4_bnt0,0.0%,2857.3094,flydsl_moe2_afp4_wfp4_bf16_t64x128x256_atomic_w0_bnt0,8.8%,6349.7329,0,1623.36,832.29,
