aiter/configs/tuned_hybrid_fmoe.csv
cu_num,token,model_dim,inter_dim,expert,topk,act_type,dtype,q_dtype_a,q_dtype_w,q_type,use_g1u1,doweight_stage1,q_dtype_a2,q_dtype_w2,q_type2,block_m,block_m2,ksplit,us1,kernelName1,err1,us2,kernelName2,err2,us,run_1stage,tflops,bw,_tag
256,20480,4096,1536,400,20,ActivationType.Gelu,torch.bfloat16,torch.int8,torch.int8,QuantType.per_Token,0,0,torch.int8,torch.int8,QuantType.per_Token,128,128,0,3175.483,flydsl_moe1_aint8_wint8_bf16_t128x128x128_async_w3_bnt0,0.6%,3639.9956,flydsl_moe2_aint8_wint8_bf16_t128x128x128_atomic_w3_bnt0,8.6%,6815.4786,0,1512.43,775.41,
256,20480,4096,1536,400,20,ActivationType.Gelu,torch.bfloat16,torch.float4_e2m1fn_x2,torch.float4_e2m1fn_x2,QuantType.per_1x32,0,0,torch.float4_e2m1fn_x2,torch.float4_e2m1fn_x2,QuantType.per_1x32,128,64,0,2456.2561,flydsl_moe1_afp4_wfp4_bf16_t128x128x256_async_w3_bnt0,0.2%,2853.6037,flydsl_moe2_afp4_wfp4_bf16_t64x128x256_atomic_w0_bnt0,9.1%,5309.8598,0,1941.28,995.28,
256,20480,4096,1536,400,20,ActivationType.Gelu,torch.bfloat16,torch.float4_e2m1fn_x2,torch.float4_e2m1fn_x2,QuantType.per_1x32,0,0,torch.int8,torch.int8,QuantType.per_Token,128,128,0,2457.6927,flydsl_moe1_afp4_wfp4_bf16_t128x128x256_async_w3_bnt0,0.1%,3628.3277,flydsl_moe2_aint8_wint8_bf16_t128x128x128_atomic_w1_bnt0,8.9%,6086.0204,0,1693.7,868.35,
256,20480,4096,1536,400,20,ActivationType.Gelu,torch.bfloat16,torch.int8,torch.int8,QuantType.per_Token,0,0,torch.float4_e2m1fn_x2,torch.float4_e2m1fn_x2,QuantType.per_1x32,128,64,0,3186.3855,flydsl_moe1_aint8_wint8_bf16_t128x128x128_async_w2_bnt0,0.6%,2862.6078,flydsl_moe2_afp4_wfp4_bf16_t64x128x256_atomic_w0_bnt0,8.8%,6048.9933,0,1704.07,873.67,
