aiter/ops/triton/configs/gemm/gfx1250-GEMM-A16W16-N=5120-K=2880.json
{
    "M_LEQ_64": {
        "BLOCK_M": 32,
        "BLOCK_N": 32,
        "BLOCK_K": 64,
        "NUM_BUFFERS": 4,
        "num_warps": 4
    },
    "M_LEQ_256": {
        "BLOCK_M": 32,
        "BLOCK_N": 32,
        "BLOCK_K": 64,
        "NUM_BUFFERS": 5,
        "num_warps": 2
    },
    "any": {
        "BLOCK_M": 64,
        "BLOCK_N": 64,
        "BLOCK_K": 64,
        "NUM_BUFFERS": 5,
        "num_warps": 2
    }
}
