aiter/ops/triton/configs/gemm/gfx1201-GEMM-A8W8.json
{
    "small": {
        "BLOCK_SIZE_K": 64,
        "BLOCK_SIZE_M": 32,
        "BLOCK_SIZE_N": 32,
        "GROUP_SIZE_M": 16,
        "kpack": 2,
        "matrix_instr_nonkdim": 16,
        "num_stages": 2,
        "num_warps": 4,
        "waves_per_eu": 8
    },
    "medium_M32": {
        "BLOCK_SIZE_K": 256,
        "BLOCK_SIZE_M": 32,
        "BLOCK_SIZE_N": 32,
        "GROUP_SIZE_M": 8,
        "kpack": 2,
        "matrix_instr_nonkdim": 16,
        "num_stages": 1,
        "num_warps": 2,
        "waves_per_eu": 8
    },
    "medium_M64": {
        "BLOCK_SIZE_K": 128,
        "BLOCK_SIZE_M": 64,
        "BLOCK_SIZE_N": 64,
        "GROUP_SIZE_M": 16,
        "kpack": 2,
        "matrix_instr_nonkdim": 16,
        "num_stages": 1,
        "num_warps": 4,
        "waves_per_eu": 4
    },
    "medium_M128": {
        "BLOCK_SIZE_K": 64,
        "BLOCK_SIZE_M": 32,
        "BLOCK_SIZE_N": 128,
        "GROUP_SIZE_M": 16,
        "kpack": 2,
        "matrix_instr_nonkdim": 16,
        "num_stages": 1,
        "num_warps": 8,
        "waves_per_eu": 2
    },
    "large": {
        "BLOCK_SIZE_K": 128,
        "BLOCK_SIZE_M": 128,
        "BLOCK_SIZE_N": 64,
        "GROUP_SIZE_M": 16,
        "kpack": 2,
        "matrix_instr_nonkdim": 16,
        "num_stages": 2,
        "num_warps": 8,
        "waves_per_eu": 4
    },
    "xlarge": {
        "BLOCK_SIZE_K": 128,
        "BLOCK_SIZE_M": 128,
        "BLOCK_SIZE_N": 64,
        "GROUP_SIZE_M": 1,
        "kpack": 2,
        "matrix_instr_nonkdim": 16,
        "num_stages": 2,
        "num_warps": 8,
        "waves_per_eu": 4
    },
    "any": {
        "BLOCK_SIZE_K": 64,
        "BLOCK_SIZE_M": 32,
        "BLOCK_SIZE_N": 256,
        "GROUP_SIZE_M": 1,
        "kpack": 2,
        "matrix_instr_nonkdim": 16,
        "num_stages": 1,
        "num_warps": 4,
        "waves_per_eu": 2
    }
}
