aiter/ops/triton/configs/gemm/gfx1250-GEMM-A16W16-N=128-K=2880.json
{
    "M_LEQ_64": {
        "BLOCK_M": 16,
        "BLOCK_N": 16,
        "BLOCK_K": 512,
        "NUM_BUFFERS": 5,
        "num_warps": 1,
        "kernel_type": "compute_bound"
    },
    "M_LEQ_256": {
        "BLOCK_M": 16,
        "BLOCK_N": 32,
        "BLOCK_K": 256,
        "NUM_BUFFERS": 5,
        "num_warps": 2,
        "kernel_type": "bandwidth_bound"
    },
    "any": {
        "BLOCK_M": 64,
        "BLOCK_N": 64,
        "BLOCK_K": 64,
        "NUM_BUFFERS": 5,
        "num_warps": 2,
        "kernel_type": "bandwidth_bound"
    }
}
