aiter/ops/triton/configs/gemm/gfx1201-GEMM-A16W16-N=4096-K=1024.json
{
    "M_LEQ_64": {
        "BLOCK_SIZE_M": 32,
        "BLOCK_SIZE_N": 64,
        "BLOCK_SIZE_K": 128,
        "GROUP_SIZE_M": 64,
        "num_warps": 4,
        "num_stages": 2,
        "waves_per_eu": 2,
        "matrix_instr_nonkdim": 16,
        "NUM_KSPLIT": 1,
        "kpack": 1,
        "cache_modifier": null,
        "SPLITK_BLOCK_SIZE": 1024
    },
    "M_LEQ_128": {
        "BLOCK_SIZE_M": 128,
        "BLOCK_SIZE_N": 64,
        "BLOCK_SIZE_K": 64,
        "GROUP_SIZE_M": 32,
        "num_warps": 8,
        "num_stages": 3,
        "waves_per_eu": 3,
        "matrix_instr_nonkdim": 16,
        "NUM_KSPLIT": 1,
        "kpack": 1,
        "cache_modifier": null,
        "SPLITK_BLOCK_SIZE": 1024
    },
    "M_LEQ_256": {
        "BLOCK_SIZE_M": 256,
        "BLOCK_SIZE_N": 64,
        "BLOCK_SIZE_K": 64,
        "GROUP_SIZE_M": 32,
        "num_warps": 8,
        "num_stages": 2,
        "waves_per_eu": 4,
        "matrix_instr_nonkdim": 16,
        "NUM_KSPLIT": 1,
        "kpack": 1,
        "cache_modifier": null,
        "SPLITK_BLOCK_SIZE": 1024
    },
    "M_LEQ_512": {
        "BLOCK_SIZE_M": 128,
        "BLOCK_SIZE_N": 128,
        "BLOCK_SIZE_K": 64,
        "GROUP_SIZE_M": 16,
        "num_warps": 8,
        "num_stages": 3,
        "waves_per_eu": 4,
        "matrix_instr_nonkdim": 16,
        "NUM_KSPLIT": 1,
        "kpack": 1,
        "cache_modifier": null,
        "SPLITK_BLOCK_SIZE": 1024
    },
    "M_LEQ_2048": {
        "BLOCK_SIZE_M": 128,
        "BLOCK_SIZE_N": 128,
        "BLOCK_SIZE_K": 64,
        "GROUP_SIZE_M": 1,
        "num_warps": 8,
        "num_stages": 2,
        "waves_per_eu": 4,
        "matrix_instr_nonkdim": 16,
        "NUM_KSPLIT": 1,
        "kpack": 1,
        "cache_modifier": null,
        "SPLITK_BLOCK_SIZE": 1024
    },
    "any": {
        "BLOCK_SIZE_M": 128,
        "BLOCK_SIZE_N": 128,
        "BLOCK_SIZE_K": 64,
        "GROUP_SIZE_M": 1,
        "num_warps": 8,
        "num_stages": 2,
        "waves_per_eu": 4,
        "matrix_instr_nonkdim": 16,
        "NUM_KSPLIT": 1,
        "kpack": 1,
        "cache_modifier": null,
        "SPLITK_BLOCK_SIZE": 1024
    }
}
