aiter/ops/triton/configs/gemm/gfx950-GEMM-A8W8_BLOCKSCALE-N=32768-K=512.json
{
    "M_LEQ_64": {
        "BLOCK_SIZE_M": 128,
        "BLOCK_SIZE_N": 128,
        "BLOCK_SIZE_K": 128,
        "GROUP_SIZE_M": 8,
        "num_warps": 4,
        "num_stages": 1,
        "waves_per_eu": 2,
        "matrix_instr_nonkdim": 16,
        "cache_modifier": ".ca",
        "NUM_KSPLIT": 1
    },
    "M_LEQ_256": {
        "BLOCK_SIZE_M": 128,
        "BLOCK_SIZE_N": 128,
        "BLOCK_SIZE_K": 128,
        "GROUP_SIZE_M": 1,
        "num_warps": 4,
        "num_stages": 1,
        "waves_per_eu": 2,
        "matrix_instr_nonkdim": 16,
        "cache_modifier": ".ca",
        "NUM_KSPLIT": 1
    },
    "any": {
        "BLOCK_SIZE_M": 128,
        "BLOCK_SIZE_N": 128,
        "BLOCK_SIZE_K": 128,
        "GROUP_SIZE_M": 4,
        "num_warps": 4,
        "num_stages": 1,
        "waves_per_eu": 2,
        "matrix_instr_nonkdim": 16,
        "cache_modifier": ".ca",
        "NUM_KSPLIT": 1
    }
}
