aiter/ops/triton/configs/gemm/gfx950-FUSED-SWIGLU-GATE-D=512.json
{
    "M_LEQ_512": {
        "BLOCK_M": 8,
        "BLOCK_N": 128,
        "num_warps": 4,
        "waves_per_eu": 0
    },
    "M_LEQ_2048": {
        "BLOCK_M": 16,
        "BLOCK_N": 128,
        "num_warps": 4,
        "waves_per_eu": 0
    },
    "M_LEQ_8192": {
        "BLOCK_M": 32,
        "BLOCK_N": 128,
        "num_warps": 4,
        "waves_per_eu": 0
    },
    "M_GEQ_8192": {
        "BLOCK_M": 16,
        "BLOCK_N": 256,
        "num_warps": 4,
        "waves_per_eu": 0
    }
}
