aiter/ops/triton/configs/gemm/MI300X-GEMM-A8W8_BLOCKSCALE-N=2112-K=7168.json
{
    "small": {
      "BLOCK_SIZE_M": 16,
      "BLOCK_SIZE_N": 32,
      "BLOCK_SIZE_K": 512,
      "GROUP_SIZE_M": 3,
      "matrix_instr_nonkdim": 16,
      "num_warps": 2,
      "num_stages": 1,
      "waves_per_eu": 0,
      "cache_modifier": ".cg",
      "NUM_KSPLIT": 4
    },
    "medium_M32": {
      "BLOCK_SIZE_M": 32,
      "BLOCK_SIZE_N": 32,
      "BLOCK_SIZE_K": 512,
      "GROUP_SIZE_M": 7,
      "matrix_instr_nonkdim": 16,
      "num_warps": 2,
      "num_stages": 1,
      "waves_per_eu": 0,
      "cache_modifier": ".cg",
      "NUM_KSPLIT": 7
    },
    "medium_M64": {
      "BLOCK_SIZE_M": 64,
      "BLOCK_SIZE_N": 32,
      "BLOCK_SIZE_K": 512,
      "GROUP_SIZE_M": 7,
      "matrix_instr_nonkdim": 16,
      "num_warps": 2,
      "num_stages": 1,
      "waves_per_eu": 1,
      "cache_modifier": ".cg",
      "NUM_KSPLIT": 4
    },
    "medium_M128": {
      "BLOCK_SIZE_M": 32,
      "BLOCK_SIZE_N": 32,
      "BLOCK_SIZE_K": 512,
      "GROUP_SIZE_M": 1,
      "matrix_instr_nonkdim": 16,
      "num_warps": 4,
      "num_stages": 1,
      "waves_per_eu": 4,
      "cache_modifier": null,
      "NUM_KSPLIT": 1
    },
    "large": {
      "BLOCK_SIZE_M": 64,
      "BLOCK_SIZE_N": 32,
      "BLOCK_SIZE_K": 512,
      "GROUP_SIZE_M": 13,
      "matrix_instr_nonkdim": 16,
      "num_warps": 4,
      "num_stages": 1,
      "waves_per_eu": 0,
      "cache_modifier": ".ca",
      "NUM_KSPLIT": 1
    },
    "xlarge_M512": {
      "BLOCK_SIZE_M": 64,
      "BLOCK_SIZE_N": 64,
      "BLOCK_SIZE_K": 512,
      "GROUP_SIZE_M": 12,
      "matrix_instr_nonkdim": 16,
      "num_warps": 4,
      "num_stages": 1,
      "waves_per_eu": 2,
      "cache_modifier": null,
      "NUM_KSPLIT": 1
    },
    "any": {
      "BLOCK_SIZE_M": 128,
      "BLOCK_SIZE_N": 64,
      "BLOCK_SIZE_K": 256,
      "GROUP_SIZE_M": 8,
      "matrix_instr_nonkdim": 16,
      "num_warps": 4,
      "num_stages": 1,
      "waves_per_eu": 0,
      "cache_modifier": null,
      "NUM_KSPLIT": 1
    }
}
