aiter/ops/triton/configs/gemm/R9700-GEMM-A16W16-ATOMIC.json
{
    "small": {
        "BLOCK_SIZE_K": 64,
        "BLOCK_SIZE_M": 16,
        "BLOCK_SIZE_N": 32,
        "GROUP_SIZE_M": 1,
        "NUM_KSPLIT": 1,
        "SPLITK_BLOCK_SIZE": 3072,
        "cache_modifier": "",
        "kpack": 1,
        "matrix_instr_nonkdim": 16,
        "num_stages": 2,
        "num_warps": 4,
        "waves_per_eu": 3
    },
    "medium_M32": {
        "BLOCK_SIZE_K": 64,
        "BLOCK_SIZE_M": 16,
        "BLOCK_SIZE_N": 32,
        "GROUP_SIZE_M": 1,
        "NUM_KSPLIT": 1,
        "SPLITK_BLOCK_SIZE": 3072,
        "cache_modifier": "",
        "kpack": 1,
        "matrix_instr_nonkdim": 16,
        "num_stages": 2,
        "num_warps": 4,
        "waves_per_eu": 3
    },
    "medium_M64": {
        "BLOCK_SIZE_K": 64,
        "BLOCK_SIZE_M": 16,
        "BLOCK_SIZE_N": 32,
        "GROUP_SIZE_M": 1,
        "NUM_KSPLIT": 1,
        "SPLITK_BLOCK_SIZE": 3072,
        "cache_modifier": "",
        "kpack": 1,
        "matrix_instr_nonkdim": 16,
        "num_stages": 2,
        "num_warps": 4,
        "waves_per_eu": 3
    },
    "medium_M128": {
        "BLOCK_SIZE_K": 64,
        "BLOCK_SIZE_M": 16,
        "BLOCK_SIZE_N": 32,
        "GROUP_SIZE_M": 1,
        "NUM_KSPLIT": 1,
        "SPLITK_BLOCK_SIZE": 3072,
        "cache_modifier": "",
        "kpack": 1,
        "matrix_instr_nonkdim": 16,
        "num_stages": 2,
        "num_warps": 4,
        "waves_per_eu": 3
    },
    "large": {
        "BLOCK_SIZE_K": 64,
        "BLOCK_SIZE_M": 16,
        "BLOCK_SIZE_N": 32,
        "GROUP_SIZE_M": 1,
        "NUM_KSPLIT": 1,
        "SPLITK_BLOCK_SIZE": 3072,
        "cache_modifier": "",
        "kpack": 1,
        "matrix_instr_nonkdim": 16,
        "num_stages": 2,
        "num_warps": 4,
        "waves_per_eu": 3
    },
    "xlarge": {
        "BLOCK_SIZE_K": 64,
        "BLOCK_SIZE_M": 16,
        "BLOCK_SIZE_N": 32,
        "GROUP_SIZE_M": 1,
        "NUM_KSPLIT": 1,
        "SPLITK_BLOCK_SIZE": 3072,
        "cache_modifier": "",
        "kpack": 1,
        "matrix_instr_nonkdim": 16,
        "num_stages": 2,
        "num_warps": 4,
        "waves_per_eu": 3
    },
    "any": {
        "BLOCK_SIZE_K": 64,
        "BLOCK_SIZE_M": 16,
        "BLOCK_SIZE_N": 32,
        "GROUP_SIZE_M": 1,
        "NUM_KSPLIT": 1,
        "SPLITK_BLOCK_SIZE": 3072,
        "cache_modifier": "",
        "kpack": 1,
        "matrix_instr_nonkdim": 16,
        "num_stages": 2,
        "num_warps": 4,
        "waves_per_eu": 3
    }
}
