aiter/ops/triton/configs/gemm/R9700-GEMM-A16W16-ATOMIC-N=1024-K=2048.json
{
    "small": {
        "BLOCK_SIZE_M": 32,
        "BLOCK_SIZE_N": 32,
        "BLOCK_SIZE_K": 128,
        "GROUP_SIZE_M": 16,
        "num_warps": 4,
        "num_stages": 5,
        "waves_per_eu": 4,
        "matrix_instr_nonkdim": 16,
        "cache_modifier": "",
        "NUM_KSPLIT": 1,
        "SPLITK_BLOCK_SIZE": 2048
    },
    "medium_M32": {
        "BLOCK_SIZE_M": 32,
        "BLOCK_SIZE_N": 32,
        "BLOCK_SIZE_K": 128,
        "GROUP_SIZE_M": 32,
        "num_warps": 4,
        "num_stages": 3,
        "waves_per_eu": 8,
        "matrix_instr_nonkdim": 16,
        "cache_modifier": "",
        "NUM_KSPLIT": 1,
        "SPLITK_BLOCK_SIZE": 2048
    },
    "medium_M64": {
        "BLOCK_SIZE_M": 64,
        "BLOCK_SIZE_N": 32,
        "BLOCK_SIZE_K": 128,
        "GROUP_SIZE_M": 32,
        "num_warps": 8,
        "num_stages": 2,
        "waves_per_eu": 2,
        "matrix_instr_nonkdim": 16,
        "cache_modifier": "",
        "NUM_KSPLIT": 1,
        "SPLITK_BLOCK_SIZE": 2048
    },
    "medium_M128": {
        "BLOCK_SIZE_M": 32,
        "BLOCK_SIZE_N": 64,
        "BLOCK_SIZE_K": 128,
        "GROUP_SIZE_M": 8,
        "num_warps": 8,
        "num_stages": 2,
        "waves_per_eu": 2,
        "matrix_instr_nonkdim": 16,
        "cache_modifier": "",
        "NUM_KSPLIT": 1,
        "SPLITK_BLOCK_SIZE": 2048
    },
    "large": {
        "BLOCK_SIZE_M": 64,
        "BLOCK_SIZE_N": 64,
        "BLOCK_SIZE_K": 128,
        "GROUP_SIZE_M": 1,
        "num_warps": 8,
        "num_stages": 2,
        "waves_per_eu": 2,
        "matrix_instr_nonkdim": 16,
        "cache_modifier": "",
        "NUM_KSPLIT": 1,
        "SPLITK_BLOCK_SIZE": 2048
    },
    "xlarge": {
        "BLOCK_SIZE_M": 128,
        "BLOCK_SIZE_N": 256,
        "BLOCK_SIZE_K": 64,
        "GROUP_SIZE_M": 1,
        "num_warps": 8,
        "num_stages": 2,
        "waves_per_eu": 4,
        "matrix_instr_nonkdim": 16,
        "cache_modifier": "",
        "NUM_KSPLIT": 1,
        "SPLITK_BLOCK_SIZE": 2048
    },
    "any": {
        "BLOCK_SIZE_M": 128,
        "BLOCK_SIZE_N": 128,
        "BLOCK_SIZE_K": 64,
        "GROUP_SIZE_M": 1,
        "num_warps": 8,
        "num_stages": 2,
        "waves_per_eu": 4,
        "matrix_instr_nonkdim": 16,
        "cache_modifier": "",
        "NUM_KSPLIT": 1,
        "SPLITK_BLOCK_SIZE": 2048
    }
}
