aiter/ops/triton/configs/gemm/R9700-GEMM-A16W16-ATOMIC-N=4096-K=1024.json
{
    "small": {
        "BLOCK_SIZE_M": 16,
        "BLOCK_SIZE_N": 64,
        "BLOCK_SIZE_K": 128,
        "GROUP_SIZE_M": 1,
        "num_warps": 4,
        "num_stages": 1,
        "waves_per_eu": 4,
        "matrix_instr_nonkdim": 16,
        "cache_modifier": "",
        "NUM_KSPLIT": 1,
        "kpack": 1,
        "SPLITK_BLOCK_SIZE": 1024
    },
    "medium_M32": {
        "BLOCK_SIZE_M": 64,
        "BLOCK_SIZE_N": 64,
        "BLOCK_SIZE_K": 64,
        "GROUP_SIZE_M": 8,
        "num_warps": 4,
        "num_stages": 1,
        "waves_per_eu": 4,
        "matrix_instr_nonkdim": 16,
        "cache_modifier": "",
        "NUM_KSPLIT": 1,
        "kpack": 1,
        "SPLITK_BLOCK_SIZE": 1024
    },
    "medium_M64": {
        "BLOCK_SIZE_M": 64,
        "BLOCK_SIZE_N": 32,
        "BLOCK_SIZE_K": 128,
        "GROUP_SIZE_M": 16,
        "num_warps": 4,
        "num_stages": 1,
        "waves_per_eu": 4,
        "matrix_instr_nonkdim": 16,
        "cache_modifier": "",
        "NUM_KSPLIT": 1,
        "kpack": 1,
        "SPLITK_BLOCK_SIZE": 1024
    },
    "medium_M128": {
        "BLOCK_SIZE_M": 64,
        "BLOCK_SIZE_N": 32,
        "BLOCK_SIZE_K": 64,
        "GROUP_SIZE_M": 16,
        "num_warps": 4,
        "num_stages": 1,
        "waves_per_eu": 4,
        "matrix_instr_nonkdim": 16,
        "cache_modifier": "",
        "NUM_KSPLIT": 1,
        "kpack": 1,
        "SPLITK_BLOCK_SIZE": 1024
    },
    "large": {
        "BLOCK_SIZE_M": 128,
        "BLOCK_SIZE_N": 32,
        "BLOCK_SIZE_K": 64,
        "GROUP_SIZE_M": 16,
        "num_warps": 4,
        "num_stages": 1,
        "waves_per_eu": 4,
        "matrix_instr_nonkdim": 16,
        "cache_modifier": "",
        "NUM_KSPLIT": 1,
        "kpack": 1,
        "SPLITK_BLOCK_SIZE": 1024
    },
    "xlarge": {
        "BLOCK_SIZE_M": 64,
        "BLOCK_SIZE_N": 128,
        "BLOCK_SIZE_K": 64,
        "GROUP_SIZE_M": 8,
        "num_warps": 4,
        "num_stages": 1,
        "waves_per_eu": 4,
        "matrix_instr_nonkdim": 16,
        "cache_modifier": "",
        "NUM_KSPLIT": 1,
        "kpack": 1,
        "SPLITK_BLOCK_SIZE": 1024
    },
    "any": {
        "BLOCK_SIZE_M": 64,
        "BLOCK_SIZE_N": 128,
        "BLOCK_SIZE_K": 64,
        "GROUP_SIZE_M": 1,
        "num_warps": 4,
        "num_stages": 1,
        "waves_per_eu": 4,
        "matrix_instr_nonkdim": 16,
        "cache_modifier": "",
        "NUM_KSPLIT": 1,
        "kpack": 1,
        "SPLITK_BLOCK_SIZE": 1024
    }
}
