aiter/configs/xavier/xavier_backup/tuned.csv
cu_num,token,model_dim,inter_dim,expert,topk,act_type,dtype,q_dtype_a,q_dtype_w,q_type,use_g1u1,doweight_stage1,block_m,ksplit,us1,kernelName1,err1,us2,kernelName2,err2,us,run_1stage,tflops,bw,_tag
256,2,7168,1024,384,8,ActivationType.Silu,torch.bfloat16,torch.float4_e2m1fn_x2,torch.float4_e2m1fn_x2,QuantType.per_1x32,1,0,32,0,26.7206,moe_ck2stages_gemm1_64x32x32x128_1x1_MulABScaleShuffled_v3_Nswizzle0_Quant3_MulRoutedWeight0_silu_FP4X2_FP4X2_B16,0.0%,17.1718,moe_ck2stages_gemm2_256x32x128x128_1x4_MulABScaleExpertWeightShuffled_v3_Nswizzle0_Quant3_MulRoutedWeight1_FP4X2_FP4X2_B16,5.0%,43.8924,0,16.05,192647.47,
256,4,7168,1024,384,8,ActivationType.Silu,torch.bfloat16,torch.float4_e2m1fn_x2,torch.float4_e2m1fn_x2,QuantType.per_1x32,1,0,32,0,44.6327,moe_ck2stages_gemm1_256x32x128x128_1x4_MulABScaleShuffled_v3_Nswizzle0_Quant3_MulRoutedWeight0_silu_FP4X2_FP4X2_B16,0.0%,26.455,moe_ck2stages_gemm2_256x32x128x128_1x4_MulABScaleExpertWeightShuffled_v3_Nswizzle0_Quant3_MulRoutedWeight1_FP4X2_FP4X2_B16,4.6%,71.0877,0,19.82,118948.89,
256,8,7168,1024,384,8,ActivationType.Silu,torch.bfloat16,torch.float4_e2m1fn_x2,torch.float4_e2m1fn_x2,QuantType.per_1x32,1,0,32,0,75.0462,moe_ck2stages_gemm1_256x32x128x128_1x4_MulABScaleShuffled_v3_Nswizzle0_Quant3_MulRoutedWeight0_silu_FP4X2_FP4X2_B16,0.0%,44.0587,moe_ck2stages_gemm2_256x32x128x128_1x4_MulABScaleExpertWeightShuffled_v3_Nswizzle0_Quant3_MulRoutedWeight1_FP4X2_FP4X2_B16,4.8%,119.1049,0,23.66,70995.31,
256,16,7168,1024,384,8,ActivationType.Silu,torch.bfloat16,torch.float4_e2m1fn_x2,torch.float4_e2m1fn_x2,QuantType.per_1x32,1,0,32,0,143.9667,moe_ck2stages_gemm1_64x32x32x128_1x1_MulABScaleShuffled_v3_Nswizzle0_Quant3_MulRoutedWeight0_silu_FP4X2_FP4X2_B16,0.0%,74.0909,moe_ck2stages_gemm2_256x32x128x128_1x4_MulABScaleExpertWeightShuffled_v3_Nswizzle0_Quant3_MulRoutedWeight1_FP4X2_FP4X2_B16,4.8%,218.0576,0,25.85,38779.02,
256,32,7168,1024,384,8,ActivationType.Silu,torch.bfloat16,torch.float4_e2m1fn_x2,torch.float4_e2m1fn_x2,QuantType.per_1x32,1,0,32,0,239.7984,moe_ck2stages_gemm1_64x32x32x128_1x1_MulABScaleShuffled_v3_Nswizzle0_Quant3_MulRoutedWeight0_silu_FP4X2_FP4X2_B16,0.0%,119.5716,moe_ck2stages_gemm2_256x32x128x128_1x4_MulABScaleExpertWeightShuffled_v3_Nswizzle0_Quant3_MulRoutedWeight1_FP4X2_FP4X2_B16,4.6%,359.37,0,31.37,23531.19,
256,128,7168,1024,384,8,ActivationType.Silu,torch.bfloat16,torch.float4_e2m1fn_x2,torch.float4_e2m1fn_x2,QuantType.per_1x32,1,0,32,0,457.4501,moe_ck2stages_gemm1_64x32x32x128_1x1_MulABScaleShuffled_v3_Nswizzle0_Quant3_MulRoutedWeight0_silu_FP4X2_FP4X2_B16,0.0%,241.017,moe_ck2stages_gemm2_256x32x128x128_1x4_MulABScaleExpertWeightShuffled_v3_Nswizzle0_Quant3_MulRoutedWeight1_FP4X2_FP4X2_B16,4.8%,698.4671,0,64.57,12110.05,
256,256,7168,1024,384,8,ActivationType.Silu,torch.bfloat16,torch.float4_e2m1fn_x2,torch.float4_e2m1fn_x2,QuantType.per_1x32,1,0,32,0,499.2976,moe_ck2stages_gemm1_64x32x32x128_1x1_MulABScaleShuffled_v3_Nswizzle0_Quant3_MulRoutedWeight0_silu_FP4X2_FP4X2_B16,0.0%,266.3032,moe_ck2stages_gemm2_256x32x128x128_1x4_MulABScaleExpertWeightShuffled_v3_Nswizzle0_Quant3_MulRoutedWeight1_FP4X2_FP4X2_B16,4.8%,765.6008,0,117.81,11051.74,
256,512,7168,1024,384,8,ActivationType.Silu,torch.bfloat16,torch.float4_e2m1fn_x2,torch.float4_e2m1fn_x2,QuantType.per_1x32,1,0,32,0,502.958,moe_ck2stages_gemm1_256x32x128x128_1x4_MulABScaleShuffled_v3_Nswizzle0_Quant3_MulRoutedWeight0_silu_FP4X2_FP4X2_B16,0.0%,282.7941,moe_ck2stages_gemm2_256x32x128x128_1x4_MulABScaleExpertWeightShuffled_v3_Nswizzle0_Quant3_MulRoutedWeight1_FP4X2_FP4X2_B16,4.8%,785.7521,0,229.57,10775.32,
256,1024,7168,1024,384,8,ActivationType.Silu,torch.bfloat16,torch.float4_e2m1fn_x2,torch.float4_e2m1fn_x2,QuantType.per_1x32,1,0,32,0,515.3757,moe_ck2stages_gemm1_64x32x32x128_1x1_MulABScaleShuffled_v3_Nswizzle0_Quant3_MulRoutedWeight0_silu_FP4X2_FP4X2_B16,0.0%,311.0231,moe_ck2stages_gemm2_256x32x128x128_1x4_MulABScaleExpertWeightShuffled_v3_Nswizzle0_Quant3_MulRoutedWeight1_FP4X2_FP4X2_B16,4.7%,826.3988,0,436.57,10258.65,
256,2048,7168,1024,384,8,ActivationType.Silu,torch.bfloat16,torch.float4_e2m1fn_x2,torch.float4_e2m1fn_x2,QuantType.per_1x32,1,0,64,0,544.2179,moe_ck2stages_gemm1_256x64x128x128_1x4_MulABScaleShuffled_v3_Nswizzle0_Quant3_MulRoutedWeight0_silu_FP4X2_FP4X2_B16,0.0%,424.3733,moe_ck2stages_gemm2_256x64x128x128_1x4_MulABScaleExpertWeightShuffled_v3_Nswizzle0_Quant3_MulRoutedWeight1_FP4X2_FP4X2_B16,4.8%,968.5912,0,744.95,8775.38,
256,4096,7168,1024,384,8,ActivationType.Silu,torch.bfloat16,torch.float4_e2m1fn_x2,torch.float4_e2m1fn_x2,QuantType.per_1x32,1,0,128,0,611.0087,moe_ck2stages_gemm1_256x128x128x128_1x4_MulABScaleShuffled_v3_Nswizzle0_Quant3_MulRoutedWeight0_silu_FP4X2_FP4X2_B16,0.0%,793.1564,moe_ck2stages_gemm2_256x128x128x128_1x4_MulABScaleExpertWeightShuffled_v3_Nswizzle0_Quant3_MulRoutedWeight1_FP4X2_FP4X2_B16,4.8%,1404.1651,0,1027.73,6084.61,
256,8192,7168,1024,384,8,ActivationType.Silu,torch.bfloat16,torch.float4_e2m1fn_x2,torch.float4_e2m1fn_x2,QuantType.per_1x32,1,0,128,0,832.4072,moe_ck2stages_gemm1_256x128x128x128_1x4_MulABScaleShuffled_v3_Nswizzle0_Quant3_MulRoutedWeight0_silu_FP4X2_FP4X2_B16,0.0%,1552.4566,moe_ck2stages_gemm2_256x128x128x128_1x4_MulABScaleExpertWeightShuffled_v3_Nswizzle0_Quant3_MulRoutedWeight1_FP4X2_FP4X2_B16,4.8%,2384.8638,0,1210.22,3619.44,
