aiter/ops/triton/configs/moe/gfx1201-MOE-INT8_W8A16.json
{
    "small_M": {
        "BLOCK_SIZE_M": 32,
        "BLOCK_SIZE_N": 64,
        "BLOCK_SIZE_K": 64,
        "GROUP_SIZE_M": 16,
        "num_warps": 4,
        "num_stages": 3,
        "waves_per_eu": 3,
        "matrix_instr_nonkdim": 16
    },
    "medium_M": {
        "BLOCK_SIZE_M": 32,
        "BLOCK_SIZE_N": 128,
        "BLOCK_SIZE_K": 64,
        "GROUP_SIZE_M": 32,
        "num_warps": 8,
        "num_stages": 2,
        "waves_per_eu": 3,
        "matrix_instr_nonkdim": 16
    },
    "large_M": {
        "BLOCK_SIZE_M": 64,
        "BLOCK_SIZE_N": 128,
        "BLOCK_SIZE_K": 64,
        "GROUP_SIZE_M": 1,
        "num_warps": 4,
        "num_stages": 2,
        "waves_per_eu": 2,
        "matrix_instr_nonkdim": 16
    }
}
