aiter/ops/triton/configs/moe/MI350X-MOE-e2e-FP8_W8A8.json
{
  "small_M": {
    "BLOCK_SIZE_M": 32,
    "BLOCK_SIZE_N": 512,
    "BLOCK_SIZE_K1": 32,
    "BLOCK_SIZE_K2": 32,
    "GROUP_SIZE_M": 1,
    "num_warps": 4,
    "num_stages": 1,
    "waves_per_eu": 1,
    "matrix_instr_nonkdim": 16,
    "kpack": 1
  },
  "medium_M": {
    "BLOCK_SIZE_M": 32,
    "BLOCK_SIZE_N": 512,
    "BLOCK_SIZE_K1": 64,
    "BLOCK_SIZE_K2": 64,
    "GROUP_SIZE_M": 1,
    "num_warps": 4,
    "num_stages": 2,
    "waves_per_eu": 1,
    "matrix_instr_nonkdim": 16,
    "kpack": 1
  },
  "large_M": {
    "BLOCK_SIZE_M": 32,
    "BLOCK_SIZE_N": 512,
    "BLOCK_SIZE_K1": 64,
    "BLOCK_SIZE_K2": 64,
    "GROUP_SIZE_M": 1,
    "num_warps": 4,
    "num_stages": 2,
    "waves_per_eu": 1,
    "matrix_instr_nonkdim": 16,
    "kpack": 1
  }
}
