aiter/ops/triton/configs/moe/MI350X-MOE-e2e-N=192-DEFAULT.json
{
  "small_M": {
    "BLOCK_SIZE_M": 32,
    "BLOCK_SIZE_N": 256,
    "BLOCK_SIZE_K1": 128,
    "BLOCK_SIZE_K2": 512,
    "GROUP_SIZE_M": 1,
    "num_warps": 8,
    "num_stages": 3,
    "waves_per_eu": 0,
    "matrix_instr_nonkdim": 16,
    "kpack": 1
  },
  "medium_M": {
    "BLOCK_SIZE_M": 32,
    "BLOCK_SIZE_N": 256,
    "BLOCK_SIZE_K1": 128,
    "BLOCK_SIZE_K2": 512,
    "GROUP_SIZE_M": 1,
    "num_warps": 8,
    "num_stages": 3,
    "waves_per_eu": 0,
    "matrix_instr_nonkdim": 16,
    "kpack": 1
  },
  "large_M": {
    "BLOCK_SIZE_M": 32,
    "BLOCK_SIZE_N": 256,
    "BLOCK_SIZE_K1": 128,
    "BLOCK_SIZE_K2": 512,
    "GROUP_SIZE_M": 1,
    "num_warps": 8,
    "num_stages": 3,
    "waves_per_eu": 0,
    "matrix_instr_nonkdim": 16,
    "kpack": 1
  }
}
