aiter/configs/model_configs/a8w8_blockscale_tuned_gemm_qwen3_vl_32b_tp8.csv
gfx,cu_num,M,N,K,libtype,kernelId,splitK,us,kernelName,tflops,bw,errRatio
gfx942,304,16,1280,5120,ck,8,0,17.4656,a8w8_blockscale_1x128x128_256x16x64x256_16x16_16x16_1x1_16x16x1_16x16x1_1x16x1x16_4_1x1_intrawave_v1,12.01,382.26,0.0
gfx942,304,32,1280,5120,ck,8,0,17.5307,a8w8_blockscale_1x128x128_256x16x64x256_16x16_16x16_1x1_16x16x1_16x16x1_1x16x1x16_4_1x1_intrawave_v1,23.93,387.85,0.0
gfx942,304,48,1280,5120,ck,8,0,17.466,a8w8_blockscale_1x128x128_256x16x64x256_16x16_16x16_1x1_16x16x1_16x16x1_1x16x1x16_4_1x1_intrawave_v1,36.02,396.33,0.0
gfx942,304,64,1280,5120,ck,8,0,17.3013,a8w8_blockscale_1x128x128_256x16x64x256_16x16_16x16_1x1_16x16x1_16x16x1_1x16x1x16_4_1x1_intrawave_v1,48.49,407.2,0.0
gfx942,304,80,1280,5120,ck,8,0,17.3638,a8w8_blockscale_1x128x128_256x16x64x256_16x16_16x16_1x1_16x16x1_16x16x1_1x16x1x16_4_1x1_intrawave_v1,60.39,412.81,0.0
gfx942,304,96,1280,5120,ck,8,0,17.2977,a8w8_blockscale_1x128x128_256x16x64x256_16x16_16x16_1x1_16x16x1_16x16x1_1x16x1x16_4_1x1_intrawave_v1,72.74,421.49,0.0
gfx942,304,112,1280,5120,ck,8,0,17.2115,a8w8_blockscale_1x128x128_256x16x64x256_16x16_16x16_1x1_16x16x1_16x16x1_1x16x1x16_4_1x1_intrawave_v1,85.29,430.74,0.0
gfx942,304,128,1280,5120,ck,8,0,17.2317,a8w8_blockscale_1x128x128_256x16x64x256_16x16_16x16_1x1_16x16x1_16x16x1_1x16x1x16_4_1x1_intrawave_v1,97.36,437.37,0.0
gfx942,304,144,1280,5120,ck,8,0,17.3507,a8w8_blockscale_1x128x128_256x16x64x256_16x16_16x16_1x1_16x16x1_16x16x1_1x16x1x16_4_1x1_intrawave_v1,108.78,441.45,0.0
gfx942,304,160,1280,5120,ck,8,0,17.2863,a8w8_blockscale_1x128x128_256x16x64x256_16x16_16x16_1x1_16x16x1_16x16x1_1x16x1x16_4_1x1_intrawave_v1,121.32,450.21,0.0
gfx942,304,176,1280,5120,ck,8,0,17.3017,a8w8_blockscale_1x128x128_256x16x64x256_16x16_16x16_1x1_16x16x1_16x16x1_1x16x1x16_4_1x1_intrawave_v1,133.33,456.91,0.0
gfx942,304,192,1280,5120,ck,8,0,17.3054,a8w8_blockscale_1x128x128_256x16x64x256_16x16_16x16_1x1_16x16x1_16x16x1_1x16x1x16_4_1x1_intrawave_v1,145.42,463.91,0.0
gfx942,304,208,1280,5120,ck,8,0,17.2992,a8w8_blockscale_1x128x128_256x16x64x256_16x16_16x16_1x1_16x16x1_16x16x1_1x16x1x16_4_1x1_intrawave_v1,157.6,471.18,0.0
gfx942,304,224,1280,5120,ck,8,0,17.3556,a8w8_blockscale_1x128x128_256x16x64x256_16x16_16x16_1x1_16x16x1_16x16x1_1x16x1x16_4_1x1_intrawave_v1,169.17,476.73,0.0
gfx942,304,240,1280,5120,ck,8,0,17.403,a8w8_blockscale_1x128x128_256x16x64x256_16x16_16x16_1x1_16x16x1_16x16x1_1x16x1x16_4_1x1_intrawave_v1,180.76,482.49,0.0
gfx942,304,256,1280,5120,ck,18,0,21.8693,a8w8_blockscale_1x128x128_256x64x64x256_16x16_32x32_1x1_16x16x1_16x16x1_1x32x1x8_8_1x1_intrawave_v1,153.43,389.57,0.0
gfx942,304,288,1280,5120,ck,13,0,22.6396,a8w8_blockscale_1x128x128_256x32x64x256_16x16_16x16_2x1_16x16x1_16x16x1_1x32x1x8_8_2x1_intrawave_v1,166.74,387.17,0.0
gfx942,304,320,1280,5120,ck,18,0,22.0032,a8w8_blockscale_1x128x128_256x64x64x256_16x16_32x32_1x1_16x16x1_16x16x1_1x32x1x8_8_1x1_intrawave_v1,190.62,409.54,0.0
gfx942,304,352,1280,5120,ck,13,0,22.8732,a8w8_blockscale_1x128x128_256x32x64x256_16x16_16x16_2x1_16x16x1_16x16x1_1x32x1x8_8_2x1_intrawave_v1,201.71,404.71,0.0
gfx942,304,384,1280,5120,ck,18,0,22.0182,a8w8_blockscale_1x128x128_256x64x64x256_16x16_32x32_1x1_16x16x1_16x16x1_1x32x1x8_8_1x1_intrawave_v1,228.59,431.58,0.0
gfx942,304,416,1280,5120,ck,13,0,23.1883,a8w8_blockscale_1x128x128_256x32x64x256_16x16_16x16_2x1_16x16x1_16x16x1_1x32x1x8_8_2x1_intrawave_v1,235.14,420.41,0.0
gfx942,304,448,1280,5120,ck,18,0,22.6252,a8w8_blockscale_1x128x128_256x64x64x256_16x16_32x32_1x1_16x16x1_16x16x1_1x32x1x8_8_1x1_intrawave_v1,259.53,441.73,0.0
gfx942,304,480,1280,5120,ck,13,0,23.9434,a8w8_blockscale_1x128x128_256x32x64x256_16x16_16x16_2x1_16x16x1_16x16x1_1x32x1x8_8_2x1_intrawave_v1,262.76,427.68,0.0
gfx942,304,512,1280,5120,ck,18,0,22.8832,a8w8_blockscale_1x128x128_256x64x64x256_16x16_32x32_1x1_16x16x1_16x16x1_1x32x1x8_8_1x1_intrawave_v1,293.27,458.23,0.0
gfx942,304,544,1280,5120,ck,18,0,24.8347,a8w8_blockscale_1x128x128_256x64x64x256_16x16_32x32_1x1_16x16x1_16x16x1_1x32x1x8_8_1x1_intrawave_v1,287.11,432.12,0.0
gfx942,304,576,1280,5120,ck,18,0,23.0771,a8w8_blockscale_1x128x128_256x64x64x256_16x16_32x32_1x1_16x16x1_16x16x1_1x32x1x8_8_1x1_intrawave_v1,327.15,475.68,0.0
gfx942,304,608,1280,5120,ck,18,0,26.4232,a8w8_blockscale_1x128x128_256x64x64x256_16x16_32x32_1x1_16x16x1_16x16x1_1x32x1x8_8_1x1_intrawave_v1,301.6,424.74,0.0
gfx942,304,640,1280,5120,ck,18,0,24.8877,a8w8_blockscale_1x128x128_256x64x64x256_16x16_32x32_1x1_16x16x1_16x16x1_1x32x1x8_8_1x1_intrawave_v1,337.06,460.82,0.0
gfx942,304,672,1280,5120,ck,18,0,27.695,a8w8_blockscale_1x128x128_256x64x64x256_16x16_32x32_1x1_16x16x1_16x16x1_1x32x1x8_8_1x1_intrawave_v1,318.04,422.98,0.0
gfx942,304,704,1280,5120,ck,18,0,25.8223,a8w8_blockscale_1x128x128_256x64x64x256_16x16_32x32_1x1_16x16x1_16x16x1_1x32x1x8_8_1x1_intrawave_v1,357.34,463.18,0.0
gfx942,304,736,1280,5120,ck,18,0,28.6934,a8w8_blockscale_1x128x128_256x64x64x256_16x16_32x32_1x1_16x16x1_16x16x1_1x32x1x8_8_1x1_intrawave_v1,336.21,425.4,0.0
gfx942,304,768,1280,5120,ck,18,0,27.1158,a8w8_blockscale_1x128x128_256x64x64x256_16x16_32x32_1x1_16x16x1_16x16x1_1x32x1x8_8_1x1_intrawave_v1,371.23,459.21,0.0
gfx942,304,800,1280,5120,ck,18,0,30.8009,a8w8_blockscale_1x128x128_256x64x64x256_16x16_32x32_1x1_16x16x1_16x16x1_1x32x1x8_8_1x1_intrawave_v1,340.44,412.25,0.0
gfx942,304,832,1280,5120,ck,18,0,28.9169,a8w8_blockscale_1x128x128_256x64x64x256_16x16_32x32_1x1_16x16x1_16x16x1_1x32x1x8_8_1x1_intrawave_v1,377.12,447.61,0.0
gfx942,304,864,1280,5120,ck,18,0,31.8905,a8w8_blockscale_1x128x128_256x64x64x256_16x16_32x32_1x1_16x16x1_16x16x1_1x32x1x8_8_1x1_intrawave_v1,355.11,413.58,0.0
gfx942,304,896,1280,5120,ck,18,0,30.188,a8w8_blockscale_1x128x128_256x64x64x256_16x16_32x32_1x1_16x16x1_16x16x1_1x32x1x8_8_1x1_intrawave_v1,389.03,445.04,0.0
gfx942,304,928,1280,5120,ck,18,0,33.5493,a8w8_blockscale_1x128x128_256x64x64x256_16x16_32x32_1x1_16x16x1_16x16x1_1x32x1x8_8_1x1_intrawave_v1,362.56,407.78,0.0
gfx942,304,960,1280,5120,ck,18,0,30.2704,a8w8_blockscale_1x128x128_256x64x64x256_16x16_32x32_1x1_16x16x1_16x16x1_1x32x1x8_8_1x1_intrawave_v1,415.68,460.07,0.0
gfx942,304,992,1280,5120,ck,3,0,41.3642,a8w8_blockscale_1x128x128_256x64x64x128_16x16_32x32_1x1_8x32x1_8x32x1_1x32x1x8_8_1x1_intrawave_v3,314.34,342.62,0.0
gfx942,304,1024,1280,5120,ck,3,0,37.6866,a8w8_blockscale_1x128x128_256x64x64x128_16x16_32x32_1x1_8x32x1_8x32x1_1x32x1x8_8_1x1_intrawave_v3,356.14,382.57,0.0
gfx942,304,1088,1280,5120,ck,3,0,40.9707,a8w8_blockscale_1x128x128_256x64x64x128_16x16_32x32_1x1_8x32x1_8x32x1_1x32x1x8_8_1x1_intrawave_v3,348.07,363.9,0.0
gfx942,304,1152,1280,5120,ck,3,0,44.4991,a8w8_blockscale_1x128x128_256x64x64x128_16x16_32x32_1x1_8x32x1_8x32x1_1x32x1x8_8_1x1_intrawave_v3,339.32,346.1,0.0
gfx942,304,1216,1280,5120,ck,3,0,47.5015,a8w8_blockscale_1x128x128_256x64x64x128_16x16_32x32_1x1_8x32x1_8x32x1_1x32x1x8_8_1x1_intrawave_v3,335.53,334.57,0.0
gfx942,304,1280,1280,5120,ck,3,0,44.8757,a8w8_blockscale_1x128x128_256x64x64x128_16x16_32x32_1x1_8x32x1_8x32x1_1x32x1x8_8_1x1_intrawave_v3,373.86,365.1,0.0
gfx942,304,1344,1280,5120,ck,3,0,48.6292,a8w8_blockscale_1x128x128_256x64x64x128_16x16_32x32_1x1_8x32x1_8x32x1_1x32x1x8_8_1x1_intrawave_v3,362.25,347.02,0.0
gfx942,304,1408,1280,5120,ck,3,0,45.535,a8w8_blockscale_1x128x128_256x64x64x128_16x16_32x32_1x1_8x32x1_8x32x1_1x32x1x8_8_1x1_intrawave_v3,405.29,381.4,0.0
gfx942,304,1472,1280,5120,ck,3,0,45.8827,a8w8_blockscale_1x128x128_256x64x64x128_16x16_32x32_1x1_8x32x1_8x32x1_1x32x1x8_8_1x1_intrawave_v3,420.5,389.22,0.0
gfx942,304,1536,1280,5120,ck,3,0,46.4996,a8w8_blockscale_1x128x128_256x64x64x128_16x16_32x32_1x1_8x32x1_8x32x1_1x32x1x8_8_1x1_intrawave_v3,432.96,394.63,0.0
gfx942,304,1600,1280,5120,ck,3,0,49.299,a8w8_blockscale_1x128x128_256x64x64x128_16x16_32x32_1x1_8x32x1_8x32x1_1x32x1x8_8_1x1_intrawave_v3,425.39,382.19,0.0
gfx942,304,1664,1280,5120,ck,3,0,48.7842,a8w8_blockscale_1x128x128_256x64x64x128_16x16_32x32_1x1_8x32x1_8x32x1_1x32x1x8_8_1x1_intrawave_v3,447.08,396.3,0.0
gfx942,304,1728,1280,5120,ck,3,0,49.9637,a8w8_blockscale_1x128x128_256x64x64x128_16x16_32x32_1x1_8x32x1_8x32x1_1x32x1x8_8_1x1_intrawave_v3,453.31,396.78,0.0
gfx942,304,1792,1280,5120,ck,3,0,51.467,a8w8_blockscale_1x128x128_256x64x64x128_16x16_32x32_1x1_8x32x1_8x32x1_1x32x1x8_8_1x1_intrawave_v3,456.37,394.74,0.0
gfx942,304,1856,1280,5120,ck,3,0,53.4476,a8w8_blockscale_1x128x128_256x64x64x128_16x16_32x32_1x1_8x32x1_8x32x1_1x32x1x8_8_1x1_intrawave_v3,455.16,389.31,0.0
gfx942,304,1920,1280,5120,ck,1,0,55.2301,a8w8_blockscale_1x128x128_256x128x64x128_16x16_32x32_2x1_8x32x1_8x32x1_1x32x1x8_8_1x1_intrawave_v3,455.65,385.64,0.0
gfx942,304,1984,1280,5120,ck,0,0,64.1911,a8w8_blockscale_1x128x128_256x128x128x128_16x16_32x32_2x2_8x32x1_8x32x1_1x32x1x8_8_1x1_intrawave_v3,405.11,339.47,0.0
gfx942,304,2048,1280,5120,ck,1,0,65.7446,a8w8_blockscale_1x128x128_256x128x64x128_16x16_32x32_2x1_8x32x1_8x32x1_1x32x1x8_8_1x1_intrawave_v3,408.3,338.92,0.0
gfx942,304,2112,1280,5120,ck,0,0,62.4411,a8w8_blockscale_1x128x128_256x128x128x128_16x16_32x32_2x2_8x32x1_8x32x1_1x32x1x8_8_1x1_intrawave_v3,443.34,364.72,0.0
gfx942,304,2176,1280,5120,ck,3,0,66.399,a8w8_blockscale_1x128x128_256x64x64x128_16x16_32x32_1x1_8x32x1_8x32x1_1x32x1x8_8_1x1_intrawave_v3,429.54,350.39,0.0
gfx942,304,2240,1280,5120,ck,0,0,64.3575,a8w8_blockscale_1x128x128_256x128x128x128_16x16_32x32_2x2_8x32x1_8x32x1_1x32x1x8_8_1x1_intrawave_v3,456.2,369.14,0.0
gfx942,304,2304,1280,5120,ck,3,0,67.884,a8w8_blockscale_1x128x128_256x64x64x128_16x16_32x32_1x1_8x32x1_8x32x1_1x32x1x8_8_1x1_intrawave_v3,444.86,357.2,0.0
gfx942,304,2368,1280,5120,ck,0,0,65.8783,a8w8_blockscale_1x128x128_256x128x128x128_16x16_32x32_2x2_8x32x1_8x32x1_1x32x1x8_8_1x1_intrawave_v3,471.14,375.54,0.0
gfx942,304,2432,1280,5120,ck,2,0,69.5413,a8w8_blockscale_1x128x128_256x64x128x128_16x16_32x32_1x2_8x32x1_8x32x1_1x32x1x8_8_1x1_intrawave_v3,458.39,362.83,0.0
gfx942,304,2496,1280,5120,ck,0,0,65.7757,a8w8_blockscale_1x128x128_256x128x128x128_16x16_32x32_2x2_8x32x1_8x32x1_1x32x1x8_8_1x1_intrawave_v3,497.38,391.07,0.0
gfx942,304,2560,1280,5120,ck,2,0,69.1435,a8w8_blockscale_1x128x128_256x64x128x128_16x16_32x32_1x2_8x32x1_8x32x1_1x32x1x8_8_1x1_intrawave_v3,485.29,379.13,0.0
gfx942,304,2624,1280,5120,ck,0,0,67.7323,a8w8_blockscale_1x128x128_256x128x128x128_16x16_32x32_2x2_8x32x1_8x32x1_1x32x1x8_8_1x1_intrawave_v3,507.78,394.29,0.0
gfx942,304,2688,1280,5120,ck,2,0,70.5856,a8w8_blockscale_1x128x128_256x64x128x128_16x16_32x32_1x2_8x32x1_8x32x1_1x32x1x8_8_1x1_intrawave_v3,499.14,385.31,0.0
gfx942,304,2752,1280,5120,ck,0,0,69.1403,a8w8_blockscale_1x128x128_256x128x128x128_16x16_32x32_2x2_8x32x1_8x32x1_1x32x1x8_8_1x1_intrawave_v3,521.71,400.47,0.0
gfx942,304,2816,1280,5120,ck,2,0,71.4609,a8w8_blockscale_1x128x128_256x64x128x128_16x16_32x32_1x2_8x32x1_8x32x1_1x32x1x8_8_1x1_intrawave_v3,516.5,394.35,0.0
gfx942,304,2880,1280,5120,ck,0,0,69.0169,a8w8_blockscale_1x128x128_256x128x128x128_16x16_32x32_2x2_8x32x1_8x32x1_1x32x1x8_8_1x1_intrawave_v3,546.95,415.43,0.0
gfx942,304,2944,1280,5120,ck,2,0,73.3411,a8w8_blockscale_1x128x128_256x64x128x128_16x16_32x32_1x2_8x32x1_8x32x1_1x32x1x8_8_1x1_intrawave_v3,526.14,397.64,0.0
gfx942,304,3008,1280,5120,ck,0,0,70.7851,a8w8_blockscale_1x128x128_256x128x128x128_16x16_32x32_2x2_8x32x1_8x32x1_1x32x1x8_8_1x1_intrawave_v3,556.99,418.94,0.0
gfx942,304,3072,1280,5120,ck,0,0,76.5697,a8w8_blockscale_1x128x128_256x128x128x128_16x16_32x32_2x2_8x32x1_8x32x1_1x32x1x8_8_1x1_intrawave_v3,525.86,393.71,0.0
gfx942,304,3136,1280,5120,ck,0,0,72.6788,a8w8_blockscale_1x128x128_256x128x128x128_16x16_32x32_2x2_8x32x1_8x32x1_1x32x1x8_8_1x1_intrawave_v3,565.56,421.55,0.0
gfx942,304,3200,1280,5120,ck,2,0,75.2616,a8w8_blockscale_1x128x128_256x64x128x128_16x16_32x32_1x2_8x32x1_8x32x1_1x32x1x8_8_1x1_intrawave_v3,557.3,413.62,0.0
gfx942,304,3264,1280,5120,ck,0,0,72.7498,a8w8_blockscale_1x128x128_256x128x128x128_16x16_32x32_2x2_8x32x1_8x32x1_1x32x1x8_8_1x1_intrawave_v3,588.07,434.66,0.0
gfx942,304,3328,1280,5120,ck,2,0,76.581,a8w8_blockscale_1x128x128_256x64x128x128_16x16_32x32_1x2_8x32x1_8x32x1_1x32x1x8_8_1x1_intrawave_v3,569.6,419.33,0.0
gfx942,304,3392,1280,5120,ck,0,0,72.2099,a8w8_blockscale_1x128x128_256x128x128x128_16x16_32x32_2x2_8x32x1_8x32x1_1x32x1x8_8_1x1_intrawave_v3,615.7,451.52,0.0
gfx942,304,3456,1280,5120,ck,2,0,79.4797,a8w8_blockscale_1x128x128_256x64x128x128_16x16_32x32_1x2_8x32x1_8x32x1_1x32x1x8_8_1x1_intrawave_v3,569.94,416.4,0.0
gfx942,304,3520,1280,5120,ck,0,0,75.9464,a8w8_blockscale_1x128x128_256x128x128x128_16x16_32x32_2x2_8x32x1_8x32x1_1x32x1x8_8_1x1_intrawave_v3,607.5,442.25,0.0
gfx942,304,3584,1280,5120,ck,2,0,79.6751,a8w8_blockscale_1x128x128_256x64x128x128_16x16_32x32_1x2_8x32x1_8x32x1_1x32x1x8_8_1x1_intrawave_v3,589.6,427.72,0.0
gfx942,304,3648,1280,5120,ck,0,0,75.8081,a8w8_blockscale_1x128x128_256x128x128x128_16x16_32x32_2x2_8x32x1_8x32x1_1x32x1x8_8_1x1_intrawave_v3,630.74,456.02,0.0
gfx942,304,3712,1280,5120,ck,0,0,80.5214,a8w8_blockscale_1x128x128_256x128x128x128_16x16_32x32_2x2_8x32x1_8x32x1_1x32x1x8_8_1x1_intrawave_v3,604.24,435.43,0.0
gfx942,304,3776,1280,5120,ck,0,0,77.0272,a8w8_blockscale_1x128x128_256x128x128x128_16x16_32x32_2x2_8x32x1_8x32x1_1x32x1x8_8_1x1_intrawave_v3,642.54,461.57,0.0
gfx942,304,3840,1280,5120,ck,0,0,82.1174,a8w8_blockscale_1x128x128_256x128x128x128_16x16_32x32_2x2_8x32x1_8x32x1_1x32x1x8_8_1x1_intrawave_v3,612.92,438.94,0.0
gfx942,304,3904,1280,5120,ck,0,0,110.6554,a8w8_blockscale_1x128x128_256x128x128x128_16x16_32x32_2x2_8x32x1_8x32x1_1x32x1x8_8_1x1_intrawave_v3,462.43,330.18,0.0
gfx942,304,3968,1280,5120,ck,0,0,103.5655,a8w8_blockscale_1x128x128_256x128x128x128_16x16_32x32_2x2_8x32x1_8x32x1_1x32x1x8_8_1x1_intrawave_v3,502.19,357.53,0.0
gfx942,304,4032,1280,5120,ck,0,0,94.9129,a8w8_blockscale_1x128x128_256x128x128x128_16x16_32x32_2x2_8x32x1_8x32x1_1x32x1x8_8_1x1_intrawave_v3,556.81,395.3,0.0
gfx942,304,4096,1280,5120,ck,0,0,101.0903,a8w8_blockscale_1x128x128_256x128x128x128_16x16_32x32_2x2_8x32x1_8x32x1_1x32x1x8_8_1x1_intrawave_v3,531.08,376.01,0.0
gfx942,304,4224,1280,5120,ck,0,0,103.9361,a8w8_blockscale_1x128x128_256x128x128x128_16x16_32x32_2x2_8x32x1_8x32x1_1x32x1x8_8_1x1_intrawave_v3,532.68,375.17,0.0
gfx942,304,4352,1280,5120,ck,0,0,105.0915,a8w8_blockscale_1x128x128_256x128x128x128_16x16_32x32_2x2_8x32x1_8x32x1_1x32x1x8_8_1x1_intrawave_v3,542.79,380.4,0.0
gfx942,304,4480,1280,5120,ck,0,0,105.2925,a8w8_blockscale_1x128x128_256x128x128x128_16x16_32x32_2x2_8x32x1_8x32x1_1x32x1x8_8_1x1_intrawave_v3,557.69,389.01,0.0
gfx942,304,4608,1280,5120,ck,0,0,106.1827,a8w8_blockscale_1x128x128_256x128x128x128_16x16_32x32_2x2_8x32x1_8x32x1_1x32x1x8_8_1x1_intrawave_v3,568.81,395.01,0.0
gfx942,304,4736,1280,5120,ck,0,0,107.5164,a8w8_blockscale_1x128x128_256x128x128x128_16x16_32x32_2x2_8x32x1_8x32x1_1x32x1x8_8_1x1_intrawave_v3,577.36,399.25,0.0
gfx942,304,4864,1280,5120,ck,0,0,106.9535,a8w8_blockscale_1x128x128_256x128x128x128_16x16_32x32_2x2_8x32x1_8x32x1_1x32x1x8_8_1x1_intrawave_v3,596.09,410.54,0.0
gfx942,304,4992,1280,5120,ck,0,0,107.8753,a8w8_blockscale_1x128x128_256x128x128x128_16x16_32x32_2x2_8x32x1_8x32x1_1x32x1x8_8_1x1_intrawave_v3,606.54,416.15,0.0
gfx942,304,5120,1280,5120,ck,0,0,105.1147,a8w8_blockscale_1x128x128_256x128x128x128_16x16_32x32_2x2_8x32x1_8x32x1_1x32x1x8_8_1x1_intrawave_v3,638.43,436.43,0.0
gfx942,304,5248,1280,5120,ck,0,0,109.5322,a8w8_blockscale_1x128x128_256x128x128x128_16x16_32x32_2x2_8x32x1_8x32x1_1x32x1x8_8_1x1_intrawave_v3,628.0,427.8,0.0
gfx942,304,5376,1280,5120,ck,0,0,110.6074,a8w8_blockscale_1x128x128_256x128x128x128_16x16_32x32_2x2_8x32x1_8x32x1_1x32x1x8_8_1x1_intrawave_v3,637.07,432.53,0.0
gfx942,304,5504,1280,5120,ck,0,0,111.0295,a8w8_blockscale_1x128x128_256x128x128x128_16x16_32x32_2x2_8x32x1_8x32x1_1x32x1x8_8_1x1_intrawave_v3,649.76,439.74,0.0
gfx942,304,5632,1280,5120,ck,0,0,112.9216,a8w8_blockscale_1x128x128_256x128x128x128_16x16_32x32_2x2_8x32x1_8x32x1_1x32x1x8_8_1x1_intrawave_v3,653.73,441.08,0.0
gfx942,304,5760,1280,5120,ck,0,0,113.4958,a8w8_blockscale_1x128x128_256x128x128x128_16x16_32x32_2x2_8x32x1_8x32x1_1x32x1x8_8_1x1_intrawave_v3,665.2,447.51,0.0
gfx942,304,5888,1280,5120,ck,0,0,113.6131,a8w8_blockscale_1x128x128_256x128x128x128_16x16_32x32_2x2_8x32x1_8x32x1_1x32x1x8_8_1x1_intrawave_v3,679.28,455.7,0.0
gfx942,304,6016,1280,5120,ck,0,0,115.4186,a8w8_blockscale_1x128x128_256x128x128x128_16x16_32x32_2x2_8x32x1_8x32x1_1x32x1x8_8_1x1_intrawave_v3,683.19,457.09,0.0
gfx942,304,6144,1280,5120,ck,0,0,114.7177,a8w8_blockscale_1x128x128_256x128x128x128_16x16_32x32_2x2_8x32x1_8x32x1_1x32x1x8_8_1x1_intrawave_v3,701.99,468.45,0.0
gfx942,304,6272,1280,5120,ck,0,0,115.8537,a8w8_blockscale_1x128x128_256x128x128x128_16x16_32x32_2x2_8x32x1_8x32x1_1x32x1x8_8_1x1_intrawave_v3,709.59,472.34,0.0
gfx942,304,6400,1280,5120,ck,0,0,122.0394,a8w8_blockscale_1x128x128_256x128x128x128_16x16_32x32_2x2_8x32x1_8x32x1_1x32x1x8_8_1x1_intrawave_v3,687.37,456.46,0.0
gfx942,304,6528,1280,5120,ck,0,0,120.758,a8w8_blockscale_1x128x128_256x128x128x128_16x16_32x32_2x2_8x32x1_8x32x1_1x32x1x8_8_1x1_intrawave_v3,708.56,469.44,0.0
gfx942,304,6656,1280,5120,ck,0,0,121.7867,a8w8_blockscale_1x128x128_256x128x128x128_16x16_32x32_2x2_8x32x1_8x32x1_1x32x1x8_8_1x1_intrawave_v3,716.35,473.55,0.0
gfx942,304,6784,1280,5120,ck,0,0,123.5662,a8w8_blockscale_1x128x128_256x128x128x128_16x16_32x32_2x2_8x32x1_8x32x1_1x32x1x8_8_1x1_intrawave_v3,719.61,474.68,0.0
gfx942,304,6912,1280,5120,ck,0,0,124.3772,a8w8_blockscale_1x128x128_256x128x128x128_16x16_32x32_2x2_8x32x1_8x32x1_1x32x1x8_8_1x1_intrawave_v3,728.4,479.49,0.0
gfx942,304,7040,1280,5120,ck,0,0,126.099,a8w8_blockscale_1x128x128_256x128x128x128_16x16_32x32_2x2_8x32x1_8x32x1_1x32x1x8_8_1x1_intrawave_v3,731.76,480.74,0.0
gfx942,304,7168,1280,5120,ck,0,0,127.1796,a8w8_blockscale_1x128x128_256x128x128x128_16x16_32x32_2x2_8x32x1_8x32x1_1x32x1x8_8_1x1_intrawave_v3,738.74,484.38,0.0
gfx942,304,7296,1280,5120,ck,0,0,131.2966,a8w8_blockscale_1x128x128_256x128x128x128_16x16_32x32_2x2_8x32x1_8x32x1_1x32x1x8_8_1x1_intrawave_v3,728.35,476.68,0.0
gfx942,304,7424,1280,5120,ck,0,0,132.6405,a8w8_blockscale_1x128x128_256x128x128x128_16x16_32x32_2x2_8x32x1_8x32x1_1x32x1x8_8_1x1_intrawave_v3,733.62,479.26,0.0
gfx942,304,7552,1280,5120,ck,0,0,133.8881,a8w8_blockscale_1x128x128_256x128x128x128_16x16_32x32_2x2_8x32x1_8x32x1_1x32x1x8_8_1x1_intrawave_v3,739.32,482.14,0.0
gfx942,304,7680,1280,5120,ck,0,0,139.9397,a8w8_blockscale_1x128x128_256x128x128x128_16x16_32x32_2x2_8x32x1_8x32x1_1x32x1x8_8_1x1_intrawave_v3,719.33,468.32,0.0
gfx942,304,7808,1280,5120,ck,0,0,179.0618,a8w8_blockscale_1x128x128_256x128x128x128_16x16_32x32_2x2_8x32x1_8x32x1_1x32x1x8_8_1x1_intrawave_v3,571.54,371.49,0.0
gfx942,304,7936,1280,5120,ck,2,0,183.7877,a8w8_blockscale_1x128x128_256x64x128x128_16x16_32x32_1x2_8x32x1_8x32x1_1x32x1x8_8_1x1_intrawave_v3,565.97,367.28,0.0
gfx942,304,8064,1280,5120,ck,0,0,180.9352,a8w8_blockscale_1x128x128_256x128x128x128_16x16_32x32_2x2_8x32x1_8x32x1_1x32x1x8_8_1x1_intrawave_v3,584.17,378.51,0.0
gfx942,304,8192,1280,5120,ck,0,0,174.5141,a8w8_blockscale_1x128x128_256x128x128x128_16x16_32x32_2x2_8x32x1_8x32x1_1x32x1x8_8_1x1_intrawave_v3,615.28,398.07,0.0
gfx942,304,8320,1280,5120,ck,0,0,174.1236,a8w8_blockscale_1x128x128_256x128x128x128_16x16_32x32_2x2_8x32x1_8x32x1_1x32x1x8_8_1x1_intrawave_v3,626.29,404.6,0.0
gfx942,304,8448,1280,5120,ck,2,0,182.8194,a8w8_blockscale_1x128x128_256x64x128x128_16x16_32x32_1x2_8x32x1_8x32x1_1x32x1x8_8_1x1_intrawave_v3,605.68,390.74,0.0
gfx942,304,8576,1280,5120,ck,0,0,174.2304,a8w8_blockscale_1x128x128_256x128x128x128_16x16_32x32_2x2_8x32x1_8x32x1_1x32x1x8_8_1x1_intrawave_v3,645.16,415.64,0.0
gfx942,304,8704,1280,5120,ck,0,0,172.0632,a8w8_blockscale_1x128x128_256x128x128x128_16x16_32x32_2x2_8x32x1_8x32x1_1x32x1x8_8_1x1_intrawave_v3,663.04,426.59,0.0
gfx942,304,8832,1280,5120,ck,0,0,184.4121,a8w8_blockscale_1x128x128_256x128x128x128_16x16_32x32_2x2_8x32x1_8x32x1_1x32x1x8_8_1x1_intrawave_v3,627.74,403.35,0.0
gfx942,304,8960,1280,5120,ck,0,0,174.8702,a8w8_blockscale_1x128x128_256x128x128x128_16x16_32x32_2x2_8x32x1_8x32x1_1x32x1x8_8_1x1_intrawave_v3,671.59,430.98,0.0
gfx942,304,9088,1280,5120,ck,0,0,175.9126,a8w8_blockscale_1x128x128_256x128x128x128_16x16_32x32_2x2_8x32x1_8x32x1_1x32x1x8_8_1x1_intrawave_v3,677.14,434.02,0.0
gfx942,304,9216,1280,5120,ck,0,0,175.1254,a8w8_blockscale_1x128x128_256x128x128x128_16x16_32x32_2x2_8x32x1_8x32x1_1x32x1x8_8_1x1_intrawave_v3,689.77,441.58,0.0
gfx942,304,9344,1280,5120,ck,0,0,176.4116,a8w8_blockscale_1x128x128_256x128x128x128_16x16_32x32_2x2_8x32x1_8x32x1_1x32x1x8_8_1x1_intrawave_v3,694.25,443.94,0.0
gfx942,304,9472,1280,5120,ck,0,0,176.7925,a8w8_blockscale_1x128x128_256x128x128x128_16x16_32x32_2x2_8x32x1_8x32x1_1x32x1x8_8_1x1_intrawave_v3,702.24,448.54,0.0
gfx942,304,9600,1280,5120,ck,0,0,179.0626,a8w8_blockscale_1x128x128_256x128x128x128_16x16_32x32_2x2_8x32x1_8x32x1_1x32x1x8_8_1x1_intrawave_v3,702.71,448.34,0.0
gfx942,304,9728,1280,5120,ck,0,0,175.7296,a8w8_blockscale_1x128x128_256x128x128x128_16x16_32x32_2x2_8x32x1_8x32x1_1x32x1x8_8_1x1_intrawave_v3,725.59,462.44,0.0
gfx942,304,9856,1280,5120,ck,0,0,182.2994,a8w8_blockscale_1x128x128_256x128x128x128_16x16_32x32_2x2_8x32x1_8x32x1_1x32x1x8_8_1x1_intrawave_v3,708.64,451.17,0.0
gfx942,304,9984,1280,5120,ck,0,0,183.1612,a8w8_blockscale_1x128x128_256x128x128x128_16x16_32x32_2x2_8x32x1_8x32x1_1x32x1x8_8_1x1_intrawave_v3,714.47,454.41,0.0
gfx942,304,10112,1280,5120,ck,0,0,181.0421,a8w8_blockscale_1x128x128_256x128x128x128_16x16_32x32_2x2_8x32x1_8x32x1_1x32x1x8_8_1x1_intrawave_v3,732.09,465.16,0.0
gfx942,304,10240,1280,5120,ck,0,0,180.1257,a8w8_blockscale_1x128x128_256x128x128x128_16x16_32x32_2x2_8x32x1_8x32x1_1x32x1x8_8_1x1_intrawave_v3,745.13,472.99,0.0
gfx942,304,10368,1280,5120,ck,0,0,184.4981,a8w8_blockscale_1x128x128_256x128x128x128_16x16_32x32_2x2_8x32x1_8x32x1_1x32x1x8_8_1x1_intrawave_v3,736.57,467.1,0.0
gfx942,304,10496,1280,5120,ck,0,0,184.4277,a8w8_blockscale_1x128x128_256x128x128x128_16x16_32x32_2x2_8x32x1_8x32x1_1x32x1x8_8_1x1_intrawave_v3,745.95,472.61,0.0
gfx942,304,10624,1280,5120,ck,0,0,192.412,a8w8_blockscale_1x128x128_256x128x128x128_16x16_32x32_2x2_8x32x1_8x32x1_1x32x1x8_8_1x1_intrawave_v3,723.71,458.11,0.0
gfx942,304,10752,1280,5120,ck,0,0,190.8454,a8w8_blockscale_1x128x128_256x128x128x128_16x16_32x32_2x2_8x32x1_8x32x1_1x32x1x8_8_1x1_intrawave_v3,738.44,467.02,0.0
gfx942,304,10880,1280,5120,ck,0,0,190.2329,a8w8_blockscale_1x128x128_256x128x128x128_16x16_32x32_2x2_8x32x1_8x32x1_1x32x1x8_8_1x1_intrawave_v3,749.64,473.69,0.0
gfx942,304,11008,1280,5120,ck,0,0,191.7614,a8w8_blockscale_1x128x128_256x128x128x128_16x16_32x32_2x2_8x32x1_8x32x1_1x32x1x8_8_1x1_intrawave_v3,752.41,475.04,0.0
gfx942,304,11136,1280,5120,ck,0,0,194.8076,a8w8_blockscale_1x128x128_256x128x128x128_16x16_32x32_2x2_8x32x1_8x32x1_1x32x1x8_8_1x1_intrawave_v3,749.26,472.66,0.0
gfx942,304,11264,1280,5120,ck,0,0,193.9558,a8w8_blockscale_1x128x128_256x128x128x128_16x16_32x32_2x2_8x32x1_8x32x1_1x32x1x8_8_1x1_intrawave_v3,761.2,479.81,0.0
gfx942,304,11392,1280,5120,ck,0,0,196.0646,a8w8_blockscale_1x128x128_256x128x128x128_16x16_32x32_2x2_8x32x1_8x32x1_1x32x1x8_8_1x1_intrawave_v3,761.57,479.66,0.0
gfx942,304,11520,1280,5120,ck,0,0,199.9578,a8w8_blockscale_1x128x128_256x128x128x128_16x16_32x32_2x2_8x32x1_8x32x1_1x32x1x8_8_1x1_intrawave_v3,755.13,475.24,0.0
gfx942,304,11648,1280,5120,ck,0,0,203.7641,a8w8_blockscale_1x128x128_256x128x128x128_16x16_32x32_2x2_8x32x1_8x32x1_1x32x1x8_8_1x1_intrawave_v3,749.26,471.18,0.0
gfx942,304,11776,1280,5120,ck,0,0,231.2736,a8w8_blockscale_1x128x128_256x128x128x128_16x16_32x32_2x2_8x32x1_8x32x1_1x32x1x8_8_1x1_intrawave_v3,667.39,419.39,0.0
gfx942,304,11904,1280,5120,ck,0,0,226.2414,a8w8_blockscale_1x128x128_256x128x128x128_16x16_32x32_2x2_8x32x1_8x32x1_1x32x1x8_8_1x1_intrawave_v3,689.65,433.06,0.0
gfx942,304,12032,1280,5120,ck,0,0,234.0384,a8w8_blockscale_1x128x128_256x128x128x128_16x16_32x32_2x2_8x32x1_8x32x1_1x32x1x8_8_1x1_intrawave_v3,673.85,422.83,0.0
gfx942,304,12160,1280,5120,ck,0,0,226.889,a8w8_blockscale_1x128x128_256x128x128x128_16x16_32x32_2x2_8x32x1_8x32x1_1x32x1x8_8_1x1_intrawave_v3,702.47,440.49,0.0
gfx942,304,12288,1280,5120,ck,0,0,223.5923,a8w8_blockscale_1x128x128_256x128x128x128_16x16_32x32_2x2_8x32x1_8x32x1_1x32x1x8_8_1x1_intrawave_v3,720.33,451.38,0.0
gfx942,304,12416,1280,5120,ck,0,0,225.9986,a8w8_blockscale_1x128x128_256x128x128x128_16x16_32x32_2x2_8x32x1_8x32x1_1x32x1x8_8_1x1_intrawave_v3,720.09,450.93,0.0
gfx942,304,12544,1280,5120,ck,0,0,227.3459,a8w8_blockscale_1x128x128_256x128x128x128_16x16_32x32_2x2_8x32x1_8x32x1_1x32x1x8_8_1x1_intrawave_v3,723.2,452.58,0.0
gfx942,304,12672,1280,5120,ck,0,0,228.8072,a8w8_blockscale_1x128x128_256x128x128x128_16x16_32x32_2x2_8x32x1_8x32x1_1x32x1x8_8_1x1_intrawave_v3,725.91,453.98,0.0
gfx942,304,12800,1280,5120,ck,0,0,234.1928,a8w8_blockscale_1x128x128_256x128x128x128_16x16_32x32_2x2_8x32x1_8x32x1_1x32x1x8_8_1x1_intrawave_v3,716.38,447.74,0.0
gfx942,304,12928,1280,5120,ck,0,0,230.2076,a8w8_blockscale_1x128x128_256x128x128x128_16x16_32x32_2x2_8x32x1_8x32x1_1x32x1x8_8_1x1_intrawave_v3,736.07,459.76,0.0
gfx942,304,13056,1280,5120,ck,0,0,235.8685,a8w8_blockscale_1x128x128_256x128x128x128_16x16_32x32_2x2_8x32x1_8x32x1_1x32x1x8_8_1x1_intrawave_v3,725.52,452.9,0.0
gfx942,304,13184,1280,5120,ck,0,0,238.6639,a8w8_blockscale_1x128x128_256x128x128x128_16x16_32x32_2x2_8x32x1_8x32x1_1x32x1x8_8_1x1_intrawave_v3,724.05,451.71,0.0
gfx942,304,13312,1280,5120,ck,0,0,239.2794,a8w8_blockscale_1x128x128_256x128x128x128_16x16_32x32_2x2_8x32x1_8x32x1_1x32x1x8_8_1x1_intrawave_v3,729.2,454.66,0.0
gfx942,304,13440,1280,5120,ck,0,0,234.1326,a8w8_blockscale_1x128x128_256x128x128x128_16x16_32x32_2x2_8x32x1_8x32x1_1x32x1x8_8_1x1_intrawave_v3,752.4,468.85,0.0
gfx942,304,13568,1280,5120,ck,0,0,241.7031,a8w8_blockscale_1x128x128_256x128x128x128_16x16_32x32_2x2_8x32x1_8x32x1_1x32x1x8_8_1x1_intrawave_v3,735.77,458.23,0.0
gfx942,304,13696,1280,5120,ck,0,0,239.7577,a8w8_blockscale_1x128x128_256x128x128x128_16x16_32x32_2x2_8x32x1_8x32x1_1x32x1x8_8_1x1_intrawave_v3,748.74,466.05,0.0
gfx942,304,13824,1280,5120,ck,0,0,243.1155,a8w8_blockscale_1x128x128_256x128x128x128_16x16_32x32_2x2_8x32x1_8x32x1_1x32x1x8_8_1x1_intrawave_v3,745.3,463.66,0.0
gfx942,304,13952,1280,5120,ck,0,0,245.4056,a8w8_blockscale_1x128x128_256x128x128x128_16x16_32x32_2x2_8x32x1_8x32x1_1x32x1x8_8_1x1_intrawave_v3,745.18,463.33,0.0
gfx942,304,14080,1280,5120,ck,0,0,242.7979,a8w8_blockscale_1x128x128_256x128x128x128_16x16_32x32_2x2_8x32x1_8x32x1_1x32x1x8_8_1x1_intrawave_v3,760.09,472.36,0.0
gfx942,304,14208,1280,5120,ck,0,0,247.5257,a8w8_blockscale_1x128x128_256x128x128x128_16x16_32x32_2x2_8x32x1_8x32x1_1x32x1x8_8_1x1_intrawave_v3,752.35,467.31,0.0
gfx942,304,14336,1280,5120,ck,0,0,246.4641,a8w8_blockscale_1x128x128_256x128x128x128_16x16_32x32_2x2_8x32x1_8x32x1_1x32x1x8_8_1x1_intrawave_v3,762.4,473.31,0.0
gfx942,304,14464,1280,5120,ck,0,0,252.9229,a8w8_blockscale_1x128x128_256x128x128x128_16x16_32x32_2x2_8x32x1_8x32x1_1x32x1x8_8_1x1_intrawave_v3,749.57,465.11,0.0
gfx942,304,14592,1280,5120,ck,0,0,253.0332,a8w8_blockscale_1x128x128_256x128x128x128_16x16_32x32_2x2_8x32x1_8x32x1_1x32x1x8_8_1x1_intrawave_v3,755.87,468.79,0.0
gfx942,304,14720,1280,5120,ck,0,0,255.6698,a8w8_blockscale_1x128x128_256x128x128x128_16x16_32x32_2x2_8x32x1_8x32x1_1x32x1x8_8_1x1_intrawave_v3,754.64,467.8,0.0
gfx942,304,14848,1280,5120,ck,0,0,253.3514,a8w8_blockscale_1x128x128_256x128x128x128_16x16_32x32_2x2_8x32x1_8x32x1_1x32x1x8_8_1x1_intrawave_v3,768.17,475.96,0.0
gfx942,304,14976,1280,5120,ck,0,0,252.2627,a8w8_blockscale_1x128x128_256x128x128x128_16x16_32x32_2x2_8x32x1_8x32x1_1x32x1x8_8_1x1_intrawave_v3,778.13,481.92,0.0
gfx942,304,15104,1280,5120,ck,0,0,261.4152,a8w8_blockscale_1x128x128_256x128x128x128_16x16_32x32_2x2_8x32x1_8x32x1_1x32x1x8_8_1x1_intrawave_v3,757.31,468.8,0.0
gfx942,304,15232,1280,5120,ck,0,0,262.39,a8w8_blockscale_1x128x128_256x128x128x128_16x16_32x32_2x2_8x32x1_8x32x1_1x32x1x8_8_1x1_intrawave_v3,760.89,470.81,0.0
gfx942,304,15360,1280,5120,ck,0,0,263.1027,a8w8_blockscale_1x128x128_256x128x128x128_16x16_32x32_2x2_8x32x1_8x32x1_1x32x1x8_8_1x1_intrawave_v3,765.2,473.27,0.0
gfx942,304,15488,1280,5120,ck,0,0,269.2867,a8w8_blockscale_1x128x128_256x128x128x128_16x16_32x32_2x2_8x32x1_8x32x1_1x32x1x8_8_1x1_intrawave_v3,753.86,466.05,0.0
gfx942,304,15616,1280,5120,ck,0,0,295.7236,a8w8_blockscale_1x128x128_256x128x128x128_16x16_32x32_2x2_8x32x1_8x32x1_1x32x1x8_8_1x1_intrawave_v3,692.14,427.71,0.0
gfx942,304,15744,1280,5120,ck,0,0,291.1179,a8w8_blockscale_1x128x128_256x128x128x128_16x16_32x32_2x2_8x32x1_8x32x1_1x32x1x8_8_1x1_intrawave_v3,708.85,437.86,0.0
gfx942,304,15872,1280,5120,ck,0,0,290.5076,a8w8_blockscale_1x128x128_256x128x128x128_16x16_32x32_2x2_8x32x1_8x32x1_1x32x1x8_8_1x1_intrawave_v3,716.12,442.16,0.0
gfx942,304,16000,1280,5120,ck,0,0,288.2688,a8w8_blockscale_1x128x128_256x128x128x128_16x16_32x32_2x2_8x32x1_8x32x1_1x32x1x8_8_1x1_intrawave_v3,727.5,449.0,0.0
gfx942,304,16128,1280,5120,ck,0,0,287.1511,a8w8_blockscale_1x128x128_256x128x128x128_16x16_32x32_2x2_8x32x1_8x32x1_1x32x1x8_8_1x1_intrawave_v3,736.17,454.17,0.0
gfx942,304,16256,1280,5120,ck,0,0,291.9836,a8w8_blockscale_1x128x128_256x128x128x128_16x16_32x32_2x2_8x32x1_8x32x1_1x32x1x8_8_1x1_intrawave_v3,729.73,450.02,0.0
gfx942,304,16384,1280,5120,ck,0,0,287.2021,a8w8_blockscale_1x128x128_256x128x128x128_16x16_32x32_2x2_8x32x1_8x32x1_1x32x1x8_8_1x1_intrawave_v3,747.73,460.94,0.0
gfx942,304,16512,1280,5120,ck,0,0,294.2642,a8w8_blockscale_1x128x128_256x128x128x128_16x16_32x32_2x2_8x32x1_8x32x1_1x32x1x8_8_1x1_intrawave_v3,735.48,453.22,0.0
gfx942,304,16640,1280,5120,ck,0,0,290.4825,a8w8_blockscale_1x128x128_256x128x128x128_16x16_32x32_2x2_8x32x1_8x32x1_1x32x1x8_8_1x1_intrawave_v3,750.83,462.5,0.0
gfx942,304,16768,1280,5120,ck,0,0,295.2511,a8w8_blockscale_1x128x128_256x128x128x128_16x16_32x32_2x2_8x32x1_8x32x1_1x32x1x8_8_1x1_intrawave_v3,744.39,458.36,0.0
gfx942,304,16896,1280,5120,ck,0,0,298.438,a8w8_blockscale_1x128x128_256x128x128x128_16x16_32x32_2x2_8x32x1_8x32x1_1x32x1x8_8_1x1_intrawave_v3,742.06,456.76,0.0
gfx942,304,17024,1280,5120,ck,0,0,296.4197,a8w8_blockscale_1x128x128_256x128x128x128_16x16_32x32_2x2_8x32x1_8x32x1_1x32x1x8_8_1x1_intrawave_v3,752.77,463.19,0.0
gfx942,304,17152,1280,5120,ck,0,0,301.7023,a8w8_blockscale_1x128x128_256x128x128x128_16x16_32x32_2x2_8x32x1_8x32x1_1x32x1x8_8_1x1_intrawave_v3,745.15,458.34,0.0
gfx942,304,17280,1280,5120,ck,0,0,302.389,a8w8_blockscale_1x128x128_256x128x128x128_16x16_32x32_2x2_8x32x1_8x32x1_1x32x1x8_8_1x1_intrawave_v3,749.01,460.55,0.0
gfx942,304,17408,1280,5120,ck,0,0,301.9571,a8w8_blockscale_1x128x128_256x128x128x128_16x16_32x32_2x2_8x32x1_8x32x1_1x32x1x8_8_1x1_intrawave_v3,755.64,464.46,0.0
gfx942,304,17536,1280,5120,ck,0,0,305.2228,a8w8_blockscale_1x128x128_256x128x128x128_16x16_32x32_2x2_8x32x1_8x32x1_1x32x1x8_8_1x1_intrawave_v3,753.05,462.71,0.0
gfx942,304,17664,1280,5120,ck,0,0,303.274,a8w8_blockscale_1x128x128_256x128x128x128_16x16_32x32_2x2_8x32x1_8x32x1_1x32x1x8_8_1x1_intrawave_v3,763.42,468.93,0.0
gfx942,304,17792,1280,5120,ck,0,0,307.0586,a8w8_blockscale_1x128x128_256x128x128x128_16x16_32x32_2x2_8x32x1_8x32x1_1x32x1x8_8_1x1_intrawave_v3,759.47,466.35,0.0
gfx942,304,17920,1280,5120,ck,0,0,313.7057,a8w8_blockscale_1x128x128_256x128x128x128_16x16_32x32_2x2_8x32x1_8x32x1_1x32x1x8_8_1x1_intrawave_v3,748.73,459.6,0.0
gfx942,304,18048,1280,5120,ck,0,0,310.7656,a8w8_blockscale_1x128x128_256x128x128x128_16x16_32x32_2x2_8x32x1_8x32x1_1x32x1x8_8_1x1_intrawave_v3,761.21,467.11,0.0
gfx942,304,18176,1280,5120,ck,0,0,309.6204,a8w8_blockscale_1x128x128_256x128x128x128_16x16_32x32_2x2_8x32x1_8x32x1_1x32x1x8_8_1x1_intrawave_v3,769.45,472.01,0.0
gfx942,304,18304,1280,5120,ck,0,0,311.3882,a8w8_blockscale_1x128x128_256x128x128x128_16x16_32x32_2x2_8x32x1_8x32x1_1x32x1x8_8_1x1_intrawave_v3,770.47,472.49,0.0
gfx942,304,18432,1280,5120,ck,0,0,314.8212,a8w8_blockscale_1x128x128_256x128x128x128_16x16_32x32_2x2_8x32x1_8x32x1_1x32x1x8_8_1x1_intrawave_v3,767.39,470.46,0.0
gfx942,304,18560,1280,5120,ck,0,0,315.6694,a8w8_blockscale_1x128x128_256x128x128x128_16x16_32x32_2x2_8x32x1_8x32x1_1x32x1x8_8_1x1_intrawave_v3,770.65,472.31,0.0
gfx942,304,18688,1280,5120,ck,0,0,317.4694,a8w8_blockscale_1x128x128_256x128x128x128_16x16_32x32_2x2_8x32x1_8x32x1_1x32x1x8_8_1x1_intrawave_v3,771.56,472.73,0.0
gfx942,304,18816,1280,5120,ck,0,0,311.8998,a8w8_blockscale_1x128x128_256x128x128x128_16x16_32x32_2x2_8x32x1_8x32x1_1x32x1x8_8_1x1_intrawave_v3,790.72,484.32,0.0
gfx942,304,18944,1280,5120,ck,0,0,321.5829,a8w8_blockscale_1x128x128_256x128x128x128_16x16_32x32_2x2_8x32x1_8x32x1_1x32x1x8_8_1x1_intrawave_v3,772.13,472.8,0.0
gfx942,304,19072,1280,5120,ck,0,0,326.2088,a8w8_blockscale_1x128x128_256x128x128x128_16x16_32x32_2x2_8x32x1_8x32x1_1x32x1x8_8_1x1_intrawave_v3,766.32,469.11,0.0
gfx942,304,19200,1280,5120,ck,0,0,322.585,a8w8_blockscale_1x128x128_256x128x128x128_16x16_32x32_2x2_8x32x1_8x32x1_1x32x1x8_8_1x1_intrawave_v3,780.13,477.42,0.0
gfx942,304,19328,1280,5120,ck,0,0,333.0896,a8w8_blockscale_1x128x128_256x128x128x128_16x16_32x32_2x2_8x32x1_8x32x1_1x32x1x8_8_1x1_intrawave_v3,760.56,465.32,0.0
gfx942,304,19456,1280,5120,ck,0,0,337.5645,a8w8_blockscale_1x128x128_256x128x128x128_16x16_32x32_2x2_8x32x1_8x32x1_1x32x1x8_8_1x1_intrawave_v3,755.45,462.06,0.0
gfx942,304,19584,1280,5120,ck,0,0,348.2766,a8w8_blockscale_1x128x128_256x128x128x128_16x16_32x32_2x2_8x32x1_8x32x1_1x32x1x8_8_1x1_intrawave_v3,737.03,450.67,0.0
gfx942,304,19712,1280,5120,ck,0,0,359.2383,a8w8_blockscale_1x128x128_256x128x128x128_16x16_32x32_2x2_8x32x1_8x32x1_1x32x1x8_8_1x1_intrawave_v3,719.21,439.66,0.0
gfx942,304,19840,1280,5120,ck,0,0,350.8512,a8w8_blockscale_1x128x128_256x128x128x128_16x16_32x32_2x2_8x32x1_8x32x1_1x32x1x8_8_1x1_intrawave_v3,741.19,452.97,0.0
gfx942,304,19968,1280,5120,ck,0,0,351.3066,a8w8_blockscale_1x128x128_256x128x128x128_16x16_32x32_2x2_8x32x1_8x32x1_1x32x1x8_8_1x1_intrawave_v3,745.0,455.18,0.0
gfx942,304,20096,1280,5120,ck,0,0,352.3219,a8w8_blockscale_1x128x128_256x128x128x128_16x16_32x32_2x2_8x32x1_8x32x1_1x32x1x8_8_1x1_intrawave_v3,747.62,456.66,0.0
gfx942,304,20224,1280,5120,ck,0,0,351.1608,a8w8_blockscale_1x128x128_256x128x128x128_16x16_32x32_2x2_8x32x1_8x32x1_1x32x1x8_8_1x1_intrawave_v3,754.87,460.97,0.0
gfx942,304,20352,1280,5120,ck,0,0,356.7417,a8w8_blockscale_1x128x128_256x128x128x128_16x16_32x32_2x2_8x32x1_8x32x1_1x32x1x8_8_1x1_intrawave_v3,747.76,456.51,0.0
gfx942,304,20480,1280,5120,ck,0,0,356.4824,a8w8_blockscale_1x128x128_256x128x128x128_16x16_32x32_2x2_8x32x1_8x32x1_1x32x1x8_8_1x1_intrawave_v3,753.01,459.6,0.0
gfx942,304,20608,1280,5120,ck,0,0,365.9186,a8w8_blockscale_1x128x128_256x128x128x128_16x16_32x32_2x2_8x32x1_8x32x1_1x32x1x8_8_1x1_intrawave_v3,738.18,450.44,0.0
gfx942,304,20736,1280,5120,ck,0,0,357.0442,a8w8_blockscale_1x128x128_256x128x128x128_16x16_32x32_2x2_8x32x1_8x32x1_1x32x1x8_8_1x1_intrawave_v3,761.22,464.39,0.0
gfx942,304,20864,1280,5120,ck,0,0,364.5163,a8w8_blockscale_1x128x128_256x128x128x128_16x16_32x32_2x2_8x32x1_8x32x1_1x32x1x8_8_1x1_intrawave_v3,750.22,457.56,0.0
gfx942,304,20992,1280,5120,ck,0,0,372.5247,a8w8_blockscale_1x128x128_256x128x128x128_16x16_32x32_2x2_8x32x1_8x32x1_1x32x1x8_8_1x1_intrawave_v3,738.6,450.37,0.0
gfx942,304,21120,1280,5120,ck,0,0,367.4544,a8w8_blockscale_1x128x128_256x128x128x128_16x16_32x32_2x2_8x32x1_8x32x1_1x32x1x8_8_1x1_intrawave_v3,753.36,459.25,0.0
gfx942,304,21248,1280,5120,ck,0,0,373.7691,a8w8_blockscale_1x128x128_256x128x128x128_16x16_32x32_2x2_8x32x1_8x32x1_1x32x1x8_8_1x1_intrawave_v3,745.12,454.13,0.0
gfx942,304,21376,1280,5120,ck,0,0,369.0197,a8w8_blockscale_1x128x128_256x128x128x128_16x16_32x32_2x2_8x32x1_8x32x1_1x32x1x8_8_1x1_intrawave_v3,759.25,462.63,0.0
gfx942,304,21504,1280,5120,ck,0,0,371.1697,a8w8_blockscale_1x128x128_256x128x128x128_16x16_32x32_2x2_8x32x1_8x32x1_1x32x1x8_8_1x1_intrawave_v3,759.38,462.6,0.0
gfx942,304,21632,1280,5120,ck,0,0,375.28,a8w8_blockscale_1x128x128_256x128x128x128_16x16_32x32_2x2_8x32x1_8x32x1_1x32x1x8_8_1x1_intrawave_v3,755.53,460.16,0.0
gfx942,304,21760,1280,5120,ck,0,0,379.7368,a8w8_blockscale_1x128x128_256x128x128x128_16x16_32x32_2x2_8x32x1_8x32x1_1x32x1x8_8_1x1_intrawave_v3,751.08,457.34,0.0
gfx942,304,21888,1280,5120,ck,0,0,380.0711,a8w8_blockscale_1x128x128_256x128x128x128_16x16_32x32_2x2_8x32x1_8x32x1_1x32x1x8_8_1x1_intrawave_v3,754.83,459.53,0.0
gfx942,304,22016,1280,5120,ck,0,0,384.3566,a8w8_blockscale_1x128x128_256x128x128x128_16x16_32x32_2x2_8x32x1_8x32x1_1x32x1x8_8_1x1_intrawave_v3,750.78,456.96,0.0
gfx942,304,22144,1280,5120,ck,0,0,383.6678,a8w8_blockscale_1x128x128_256x128x128x128_16x16_32x32_2x2_8x32x1_8x32x1_1x32x1x8_8_1x1_intrawave_v3,756.5,460.34,0.0
gfx942,304,22272,1280,5120,ck,0,0,383.2429,a8w8_blockscale_1x128x128_256x128x128x128_16x16_32x32_2x2_8x32x1_8x32x1_1x32x1x8_8_1x1_intrawave_v3,761.72,463.42,0.0
gfx942,304,22400,1280,5120,ck,0,0,383.5034,a8w8_blockscale_1x128x128_256x128x128x128_16x16_32x32_2x2_8x32x1_8x32x1_1x32x1x8_8_1x1_intrawave_v3,765.58,465.67,0.0
gfx942,304,22528,1280,5120,ck,0,0,378.342,a8w8_blockscale_1x128x128_256x128x128x128_16x16_32x32_2x2_8x32x1_8x32x1_1x32x1x8_8_1x1_intrawave_v3,780.46,474.62,0.0
gfx942,304,22656,1280,5120,ck,0,0,387.1736,a8w8_blockscale_1x128x128_256x128x128x128_16x16_32x32_2x2_8x32x1_8x32x1_1x32x1x8_8_1x1_intrawave_v3,766.99,466.33,0.0
gfx942,304,22784,1280,5120,ck,0,0,388.988,a8w8_blockscale_1x128x128_256x128x128x128_16x16_32x32_2x2_8x32x1_8x32x1_1x32x1x8_8_1x1_intrawave_v3,767.72,466.68,0.0
gfx942,304,22912,1280,5120,ck,0,0,386.6122,a8w8_blockscale_1x128x128_256x128x128x128_16x16_32x32_2x2_8x32x1_8x32x1_1x32x1x8_8_1x1_intrawave_v3,776.78,472.1,0.0
gfx942,304,23040,1280,5120,ck,0,0,394.2469,a8w8_blockscale_1x128x128_256x128x128x128_16x16_32x32_2x2_8x32x1_8x32x1_1x32x1x8_8_1x1_intrawave_v3,765.99,465.45,0.0
gfx942,304,23168,1280,5120,ck,0,0,398.9211,a8w8_blockscale_1x128x128_256x128x128x128_16x16_32x32_2x2_8x32x1_8x32x1_1x32x1x8_8_1x1_intrawave_v3,761.22,462.46,0.0
gfx942,304,23296,1280,5120,ck,0,0,406.3004,a8w8_blockscale_1x128x128_256x128x128x128_16x16_32x32_2x2_8x32x1_8x32x1_1x32x1x8_8_1x1_intrawave_v3,751.53,456.48,0.0
gfx942,304,23424,1280,5120,ck,0,0,418.1858,a8w8_blockscale_1x128x128_256x128x128x128_16x16_32x32_2x2_8x32x1_8x32x1_1x32x1x8_8_1x1_intrawave_v3,734.18,445.85,0.0
gfx942,304,23552,1280,5120,ck,0,0,412.3299,a8w8_blockscale_1x128x128_256x128x128x128_16x16_32x32_2x2_8x32x1_8x32x1_1x32x1x8_8_1x1_intrawave_v3,748.67,454.57,0.0
gfx942,304,23680,1280,5120,ck,0,0,420.036,a8w8_blockscale_1x128x128_256x128x128x128_16x16_32x32_2x2_8x32x1_8x32x1_1x32x1x8_8_1x1_intrawave_v3,738.93,448.57,0.0
gfx942,304,23808,1280,5120,ck,0,0,414.8622,a8w8_blockscale_1x128x128_256x128x128x128_16x16_32x32_2x2_8x32x1_8x32x1_1x32x1x8_8_1x1_intrawave_v3,752.19,456.53,0.0
gfx942,304,23936,1280,5120,ck,0,0,422.0887,a8w8_blockscale_1x128x128_256x128x128x128_16x16_32x32_2x2_8x32x1_8x32x1_1x32x1x8_8_1x1_intrawave_v3,743.29,451.05,0.0
gfx942,304,24064,1280,5120,ck,0,0,422.4469,a8w8_blockscale_1x128x128_256x128x128x128_16x16_32x32_2x2_8x32x1_8x32x1_1x32x1x8_8_1x1_intrawave_v3,746.63,452.99,0.0
gfx942,304,24192,1280,5120,ck,0,0,421.7784,a8w8_blockscale_1x128x128_256x128x128x128_16x16_32x32_2x2_8x32x1_8x32x1_1x32x1x8_8_1x1_intrawave_v3,751.79,456.04,0.0
gfx942,304,24320,1280,5120,ck,0,0,424.0823,a8w8_blockscale_1x128x128_256x128x128x128_16x16_32x32_2x2_8x32x1_8x32x1_1x32x1x8_8_1x1_intrawave_v3,751.66,455.88,0.0
gfx942,304,24448,1280,5120,ck,0,0,432.703,a8w8_blockscale_1x128x128_256x128x128x128_16x16_32x32_2x2_8x32x1_8x32x1_1x32x1x8_8_1x1_intrawave_v3,740.57,449.07,0.0
gfx942,304,24576,1280,5120,ck,0,0,422.63,a8w8_blockscale_1x128x128_256x128x128x128_16x16_32x32_2x2_8x32x1_8x32x1_1x32x1x8_8_1x1_intrawave_v3,762.19,462.1,0.0
gfx942,304,24704,1280,5120,ck,0,0,425.992,a8w8_blockscale_1x128x128_256x128x128x128_16x16_32x32_2x2_8x32x1_8x32x1_1x32x1x8_8_1x1_intrawave_v3,760.11,460.76,0.0
gfx942,304,24832,1280,5120,ck,0,0,435.4014,a8w8_blockscale_1x128x128_256x128x128x128_16x16_32x32_2x2_8x32x1_8x32x1_1x32x1x8_8_1x1_intrawave_v3,747.54,453.06,0.0
gfx942,304,24960,1280,5120,ck,0,0,431.4752,a8w8_blockscale_1x128x128_256x128x128x128_16x16_32x32_2x2_8x32x1_8x32x1_1x32x1x8_8_1x1_intrawave_v3,758.23,459.46,0.0
gfx942,304,25088,1280,5120,ck,0,0,434.7626,a8w8_blockscale_1x128x128_256x128x128x128_16x16_32x32_2x2_8x32x1_8x32x1_1x32x1x8_8_1x1_intrawave_v3,756.35,458.25,0.0
gfx942,304,25216,1280,5120,ck,0,0,434.1473,a8w8_blockscale_1x128x128_256x128x128x128_16x16_32x32_2x2_8x32x1_8x32x1_1x32x1x8_8_1x1_intrawave_v3,761.29,461.16,0.0
gfx942,304,25344,1280,5120,ck,0,0,440.235,a8w8_blockscale_1x128x128_256x128x128x128_16x16_32x32_2x2_8x32x1_8x32x1_1x32x1x8_8_1x1_intrawave_v3,754.57,457.02,0.0
gfx942,304,25472,1280,5120,ck,0,0,437.4308,a8w8_blockscale_1x128x128_256x128x128x128_16x16_32x32_2x2_8x32x1_8x32x1_1x32x1x8_8_1x1_intrawave_v3,763.24,462.2,0.0
gfx942,304,25600,1280,5120,ck,0,0,437.8093,a8w8_blockscale_1x128x128_256x128x128x128_16x16_32x32_2x2_8x32x1_8x32x1_1x32x1x8_8_1x1_intrawave_v3,766.42,464.04,0.0
gfx942,304,25728,1280,5120,ck,0,0,444.1813,a8w8_blockscale_1x128x128_256x128x128x128_16x16_32x32_2x2_8x32x1_8x32x1_1x32x1x8_8_1x1_intrawave_v3,759.2,459.6,0.0
gfx942,304,25856,1280,5120,ck,0,0,445.9783,a8w8_blockscale_1x128x128_256x128x128x128_16x16_32x32_2x2_8x32x1_8x32x1_1x32x1x8_8_1x1_intrawave_v3,759.9,459.95,0.0
gfx942,304,25984,1280,5120,ck,0,0,448.7459,a8w8_blockscale_1x128x128_256x128x128x128_16x16_32x32_2x2_8x32x1_8x32x1_1x32x1x8_8_1x1_intrawave_v3,758.95,459.3,0.0
gfx942,304,26112,1280,5120,ck,0,0,444.8389,a8w8_blockscale_1x128x128_256x128x128x128_16x16_32x32_2x2_8x32x1_8x32x1_1x32x1x8_8_1x1_intrawave_v3,769.39,465.55,0.0
gfx942,304,26240,1280,5120,ck,0,0,451.7712,a8w8_blockscale_1x128x128_256x128x128x128_16x16_32x32_2x2_8x32x1_8x32x1_1x32x1x8_8_1x1_intrawave_v3,761.3,460.58,0.0
gfx942,304,26368,1280,5120,ck,0,0,456.1387,a8w8_blockscale_1x128x128_256x128x128x128_16x16_32x32_2x2_8x32x1_8x32x1_1x32x1x8_8_1x1_intrawave_v3,757.69,458.33,0.0
gfx942,304,26496,1280,5120,ck,0,0,452.6399,a8w8_blockscale_1x128x128_256x128x128x128_16x16_32x32_2x2_8x32x1_8x32x1_1x32x1x8_8_1x1_intrawave_v3,767.25,464.04,0.0
gfx942,304,26624,1280,5120,ck,0,0,448.9091,a8w8_blockscale_1x128x128_256x128x128x128_16x16_32x32_2x2_8x32x1_8x32x1_1x32x1x8_8_1x1_intrawave_v3,777.36,470.09,0.0
gfx942,304,26752,1280,5120,ck,0,0,458.5607,a8w8_blockscale_1x128x128_256x128x128x128_16x16_32x32_2x2_8x32x1_8x32x1_1x32x1x8_8_1x1_intrawave_v3,764.66,462.34,0.0
gfx942,304,26880,1280,5120,ck,0,0,462.1688,a8w8_blockscale_1x128x128_256x128x128x128_16x16_32x32_2x2_8x32x1_8x32x1_1x32x1x8_8_1x1_intrawave_v3,762.32,460.85,0.0
gfx942,304,27008,1280,5120,ck,0,0,465.3255,a8w8_blockscale_1x128x128_256x128x128x128_16x16_32x32_2x2_8x32x1_8x32x1_1x32x1x8_8_1x1_intrawave_v3,760.76,459.84,0.0
gfx942,304,27136,1280,5120,ck,0,0,476.3817,a8w8_blockscale_1x128x128_256x128x128x128_16x16_32x32_2x2_8x32x1_8x32x1_1x32x1x8_8_1x1_intrawave_v3,746.62,451.23,0.0
gfx942,304,27264,1280,5120,ck,0,0,482.7851,a8w8_blockscale_1x128x128_256x128x128x128_16x16_32x32_2x2_8x32x1_8x32x1_1x32x1x8_8_1x1_intrawave_v3,740.19,447.28,0.0
gfx942,304,27392,1280,5120,ck,0,0,481.4596,a8w8_blockscale_1x128x128_256x128x128x128_16x16_32x32_2x2_8x32x1_8x32x1_1x32x1x8_8_1x1_intrawave_v3,745.72,450.56,0.0
gfx942,304,27520,1280,5120,ck,0,0,488.9665,a8w8_blockscale_1x128x128_256x128x128x128_16x16_32x32_2x2_8x32x1_8x32x1_1x32x1x8_8_1x1_intrawave_v3,737.7,445.65,0.0
gfx942,304,27648,1280,5120,ck,0,0,489.3238,a8w8_blockscale_1x128x128_256x128x128x128_16x16_32x32_2x2_8x32x1_8x32x1_1x32x1x8_8_1x1_intrawave_v3,740.59,447.33,0.0
gfx942,304,27776,1280,5120,ck,0,0,499.6641,a8w8_blockscale_1x128x128_256x128x128x128_16x16_32x32_2x2_8x32x1_8x32x1_1x32x1x8_8_1x1_intrawave_v3,728.62,440.04,0.0
gfx942,304,27904,1280,5120,ck,0,0,494.1086,a8w8_blockscale_1x128x128_256x128x128x128_16x16_32x32_2x2_8x32x1_8x32x1_1x32x1x8_8_1x1_intrawave_v3,740.21,446.98,0.0
gfx942,304,28032,1280,5120,ck,0,0,491.4799,a8w8_blockscale_1x128x128_256x128x128x128_16x16_32x32_2x2_8x32x1_8x32x1_1x32x1x8_8_1x1_intrawave_v3,747.58,451.37,0.0
gfx942,304,28160,1280,5120,ck,0,0,493.2188,a8w8_blockscale_1x128x128_256x128x128x128_16x16_32x32_2x2_8x32x1_8x32x1_1x32x1x8_8_1x1_intrawave_v3,748.35,451.77,0.0
gfx942,304,28288,1280,5120,ck,0,0,492.6933,a8w8_blockscale_1x128x128_256x128x128x128_16x16_32x32_2x2_8x32x1_8x32x1_1x32x1x8_8_1x1_intrawave_v3,752.55,454.25,0.0
gfx942,304,28416,1280,5120,ck,0,0,496.1413,a8w8_blockscale_1x128x128_256x128x128x128_16x16_32x32_2x2_8x32x1_8x32x1_1x32x1x8_8_1x1_intrawave_v3,750.7,453.07,0.0
gfx942,304,28544,1280,5120,ck,0,0,496.9275,a8w8_blockscale_1x128x128_256x128x128x128_16x16_32x32_2x2_8x32x1_8x32x1_1x32x1x8_8_1x1_intrawave_v3,752.89,454.33,0.0
gfx942,304,28672,1280,5120,ck,0,0,485.3628,a8w8_blockscale_1x128x128_256x128x128x128_16x16_32x32_2x2_8x32x1_8x32x1_1x32x1x8_8_1x1_intrawave_v3,774.29,467.19,0.0
gfx942,304,28800,1280,5120,ck,0,0,500.9404,a8w8_blockscale_1x128x128_256x128x128x128_16x16_32x32_2x2_8x32x1_8x32x1_1x32x1x8_8_1x1_intrawave_v3,753.56,454.62,0.0
gfx942,304,28928,1280,5120,ck,0,0,502.0769,a8w8_blockscale_1x128x128_256x128x128x128_16x16_32x32_2x2_8x32x1_8x32x1_1x32x1x8_8_1x1_intrawave_v3,755.19,455.55,0.0
gfx942,304,29056,1280,5120,ck,0,0,506.4491,a8w8_blockscale_1x128x128_256x128x128x128_16x16_32x32_2x2_8x32x1_8x32x1_1x32x1x8_8_1x1_intrawave_v3,751.99,453.56,0.0
gfx942,304,29184,1280,5120,ck,0,0,504.2614,a8w8_blockscale_1x128x128_256x128x128x128_16x16_32x32_2x2_8x32x1_8x32x1_1x32x1x8_8_1x1_intrawave_v3,758.58,457.47,0.0
gfx942,304,29312,1280,5120,ck,0,0,506.558,a8w8_blockscale_1x128x128_256x128x128x128_16x16_32x32_2x2_8x32x1_8x32x1_1x32x1x8_8_1x1_intrawave_v3,758.45,457.34,0.0
gfx942,304,29440,1280,5120,ck,0,0,505.292,a8w8_blockscale_1x128x128_256x128x128x128_16x16_32x32_2x2_8x32x1_8x32x1_1x32x1x8_8_1x1_intrawave_v3,763.67,460.43,0.0
gfx942,304,29568,1280,5120,ck,0,0,506.6684,a8w8_blockscale_1x128x128_256x128x128x128_16x16_32x32_2x2_8x32x1_8x32x1_1x32x1x8_8_1x1_intrawave_v3,764.91,461.12,0.0
gfx942,304,29696,1280,5120,ck,0,0,513.1776,a8w8_blockscale_1x128x128_256x128x128x128_16x16_32x32_2x2_8x32x1_8x32x1_1x32x1x8_8_1x1_intrawave_v3,758.47,457.19,0.0
gfx942,304,29824,1280,5120,ck,0,0,516.8325,a8w8_blockscale_1x128x128_256x128x128x128_16x16_32x32_2x2_8x32x1_8x32x1_1x32x1x8_8_1x1_intrawave_v3,756.36,455.86,0.0
gfx942,304,29952,1280,5120,ck,0,0,514.0724,a8w8_blockscale_1x128x128_256x128x128x128_16x16_32x32_2x2_8x32x1_8x32x1_1x32x1x8_8_1x1_intrawave_v3,763.68,460.22,0.0
gfx942,304,30080,1280,5120,ck,0,0,513.6788,a8w8_blockscale_1x128x128_256x128x128x128_16x16_32x32_2x2_8x32x1_8x32x1_1x32x1x8_8_1x1_intrawave_v3,767.53,462.48,0.0
gfx942,304,30208,1280,5120,ck,0,0,517.4919,a8w8_blockscale_1x128x128_256x128x128x128_16x16_32x32_2x2_8x32x1_8x32x1_1x32x1x8_8_1x1_intrawave_v3,765.12,460.98,0.0
gfx942,304,30336,1280,5120,ck,0,0,524.9521,a8w8_blockscale_1x128x128_256x128x128x128_16x16_32x32_2x2_8x32x1_8x32x1_1x32x1x8_8_1x1_intrawave_v3,757.44,456.3,0.0
gfx942,304,30464,1280,5120,ck,0,0,519.4804,a8w8_blockscale_1x128x128_256x128x128x128_16x16_32x32_2x2_8x32x1_8x32x1_1x32x1x8_8_1x1_intrawave_v3,768.65,463.0,0.0
gfx942,304,30592,1280,5120,ck,0,0,535.774,a8w8_blockscale_1x128x128_256x128x128x128_16x16_32x32_2x2_8x32x1_8x32x1_1x32x1x8_8_1x1_intrawave_v3,748.4,450.75,0.0
gfx942,304,30720,1280,5120,ck,0,0,523.5012,a8w8_blockscale_1x128x128_256x128x128x128_16x16_32x32_2x2_8x32x1_8x32x1_1x32x1x8_8_1x1_intrawave_v3,769.15,463.2,0.0
gfx942,304,30848,1280,5120,ck,0,0,529.9938,a8w8_blockscale_1x128x128_256x128x128x128_16x16_32x32_2x2_8x32x1_8x32x1_1x32x1x8_8_1x1_intrawave_v3,762.9,459.38,0.0
gfx942,304,30976,1280,5120,ck,0,0,528.4701,a8w8_blockscale_1x128x128_256x128x128x128_16x16_32x32_2x2_8x32x1_8x32x1_1x32x1x8_8_1x1_intrawave_v3,768.27,462.56,0.0
gfx942,304,31104,1280,5120,ck,0,0,534.948,a8w8_blockscale_1x128x128_256x128x128x128_16x16_32x32_2x2_8x32x1_8x32x1_1x32x1x8_8_1x1_intrawave_v3,762.1,458.8,0.0
gfx942,304,31232,1280,5120,ck,0,0,545.8709,a8w8_blockscale_1x128x128_256x128x128x128_16x16_32x32_2x2_8x32x1_8x32x1_1x32x1x8_8_1x1_intrawave_v3,749.93,451.42,0.0
gfx942,304,31360,1280,5120,ck,0,0,553.7169,a8w8_blockscale_1x128x128_256x128x128x128_16x16_32x32_2x2_8x32x1_8x32x1_1x32x1x8_8_1x1_intrawave_v3,742.33,446.8,0.0
gfx942,304,31488,1280,5120,ck,0,0,545.9057,a8w8_blockscale_1x128x128_256x128x128x128_16x16_32x32_2x2_8x32x1_8x32x1_1x32x1x8_8_1x1_intrawave_v3,756.03,454.99,0.0
gfx942,304,31616,1280,5120,ck,0,0,549.7918,a8w8_blockscale_1x128x128_256x128x128x128_16x16_32x32_2x2_8x32x1_8x32x1_1x32x1x8_8_1x1_intrawave_v3,753.73,453.56,0.0
gfx942,304,31744,1280,5120,ck,0,0,550.4121,a8w8_blockscale_1x128x128_256x128x128x128_16x16_32x32_2x2_8x32x1_8x32x1_1x32x1x8_8_1x1_intrawave_v3,755.93,454.84,0.0
gfx942,304,31872,1280,5120,ck,0,0,554.4298,a8w8_blockscale_1x128x128_256x128x128x128_16x16_32x32_2x2_8x32x1_8x32x1_1x32x1x8_8_1x1_intrawave_v3,753.48,453.31,0.0
gfx942,304,32000,1280,5120,ck,0,0,551.4175,a8w8_blockscale_1x128x128_256x128x128x128_16x16_32x32_2x2_8x32x1_8x32x1_1x32x1x8_8_1x1_intrawave_v3,760.64,457.57,0.0
gfx942,304,32128,1280,5120,ck,0,0,558.6759,a8w8_blockscale_1x128x128_256x128x128x128_16x16_32x32_2x2_8x32x1_8x32x1_1x32x1x8_8_1x1_intrawave_v3,753.76,453.39,0.0
gfx942,304,32256,1280,5120,ck,0,0,549.5903,a8w8_blockscale_1x128x128_256x128x128x128_16x16_32x32_2x2_8x32x1_8x32x1_1x32x1x8_8_1x1_intrawave_v3,769.27,462.67,0.0
gfx942,304,32384,1280,5120,ck,0,0,549.9985,a8w8_blockscale_1x128x128_256x128x128x128_16x16_32x32_2x2_8x32x1_8x32x1_1x32x1x8_8_1x1_intrawave_v3,771.75,464.12,0.0
gfx942,304,32512,1280,5120,ck,0,0,566.0989,a8w8_blockscale_1x128x128_256x128x128x128_16x16_32x32_2x2_8x32x1_8x32x1_1x32x1x8_8_1x1_intrawave_v3,752.77,452.65,0.0
gfx942,304,32640,1280,5120,ck,0,0,559.6623,a8w8_blockscale_1x128x128_256x128x128x128_16x16_32x32_2x2_8x32x1_8x32x1_1x32x1x8_8_1x1_intrawave_v3,764.42,459.61,0.0
gfx942,304,32768,1280,5120,ck,0,0,551.6047,a8w8_blockscale_1x128x128_256x128x128x128_16x16_32x32_2x2_8x32x1_8x32x1_1x32x1x8_8_1x1_intrawave_v3,778.63,468.11,0.0
gfx942,304,32896,1280,5120,ck,0,0,567.5494,a8w8_blockscale_1x128x128_256x128x128x128_16x16_32x32_2x2_8x32x1_8x32x1_1x32x1x8_8_1x1_intrawave_v3,759.71,456.69,0.0
gfx942,304,33024,1280,5120,ck,0,0,565.1879,a8w8_blockscale_1x128x128_256x128x128x128_16x16_32x32_2x2_8x32x1_8x32x1_1x32x1x8_8_1x1_intrawave_v3,765.86,460.34,0.0
gfx942,304,33152,1280,5120,ck,0,0,563.6582,a8w8_blockscale_1x128x128_256x128x128x128_16x16_32x32_2x2_8x32x1_8x32x1_1x32x1x8_8_1x1_intrawave_v3,770.91,463.33,0.0
gfx942,304,33280,1280,5120,ck,0,0,568.1263,a8w8_blockscale_1x128x128_256x128x128x128_16x16_32x32_2x2_8x32x1_8x32x1_1x32x1x8_8_1x1_intrawave_v3,767.8,461.42,0.0
gfx942,304,33408,1280,5120,ck,0,0,565.7013,a8w8_blockscale_1x128x128_256x128x128x128_16x16_32x32_2x2_8x32x1_8x32x1_1x32x1x8_8_1x1_intrawave_v3,774.06,465.13,0.0
gfx942,304,33536,1280,5120,ck,0,0,571.2154,a8w8_blockscale_1x128x128_256x128x128x128_16x16_32x32_2x2_8x32x1_8x32x1_1x32x1x8_8_1x1_intrawave_v3,769.52,462.37,0.0
gfx942,304,33664,1280,5120,ck,0,0,567.5174,a8w8_blockscale_1x128x128_256x128x128x128_16x16_32x32_2x2_8x32x1_8x32x1_1x32x1x8_8_1x1_intrawave_v3,777.49,467.11,0.0
gfx942,304,33792,1280,5120,ck,0,0,575.1932,a8w8_blockscale_1x128x128_256x128x128x128_16x16_32x32_2x2_8x32x1_8x32x1_1x32x1x8_8_1x1_intrawave_v3,770.03,462.59,0.0
gfx942,304,33920,1280,5120,ck,0,0,584.7526,a8w8_blockscale_1x128x128_256x128x128x128_16x16_32x32_2x2_8x32x1_8x32x1_1x32x1x8_8_1x1_intrawave_v3,760.32,456.7,0.0
gfx942,304,34048,1280,5120,ck,0,0,590.0005,a8w8_blockscale_1x128x128_256x128x128x128_16x16_32x32_2x2_8x32x1_8x32x1_1x32x1x8_8_1x1_intrawave_v3,756.4,454.31,0.0
gfx942,304,34176,1280,5120,ck,0,0,586.7736,a8w8_blockscale_1x128x128_256x128x128x128_16x16_32x32_2x2_8x32x1_8x32x1_1x32x1x8_8_1x1_intrawave_v3,763.41,458.48,0.0
gfx942,304,34304,1280,5120,ck,0,0,584.6323,a8w8_blockscale_1x128x128_256x128x128x128_16x16_32x32_2x2_8x32x1_8x32x1_1x32x1x8_8_1x1_intrawave_v3,769.08,461.84,0.0
gfx942,304,34432,1280,5120,ck,0,0,596.5169,a8w8_blockscale_1x128x128_256x128x128x128_16x16_32x32_2x2_8x32x1_8x32x1_1x32x1x8_8_1x1_intrawave_v3,756.57,454.29,0.0
gfx942,304,34560,1280,5120,ck,0,0,590.1636,a8w8_blockscale_1x128x128_256x128x128x128_16x16_32x32_2x2_8x32x1_8x32x1_1x32x1x8_8_1x1_intrawave_v3,767.56,460.85,0.0
gfx942,304,34688,1280,5120,ck,0,0,595.6479,a8w8_blockscale_1x128x128_256x128x128x128_16x16_32x32_2x2_8x32x1_8x32x1_1x32x1x8_8_1x1_intrawave_v3,763.31,458.25,0.0
gfx942,304,34816,1280,5120,ck,0,0,598.3925,a8w8_blockscale_1x128x128_256x128x128x128_16x16_32x32_2x2_8x32x1_8x32x1_1x32x1x8_8_1x1_intrawave_v3,762.61,457.79,0.0
gfx942,304,34944,1280,5120,ck,0,0,605.0127,a8w8_blockscale_1x128x128_256x128x128x128_16x16_32x32_2x2_8x32x1_8x32x1_1x32x1x8_8_1x1_intrawave_v3,757.04,454.41,0.0
gfx942,304,35072,1280,5120,ck,0,0,609.1624,a8w8_blockscale_1x128x128_256x128x128x128_16x16_32x32_2x2_8x32x1_8x32x1_1x32x1x8_8_1x1_intrawave_v3,754.64,452.93,0.0
gfx942,304,35200,1280,5120,ck,0,0,611.7088,a8w8_blockscale_1x128x128_256x128x128x128_16x16_32x32_2x2_8x32x1_8x32x1_1x32x1x8_8_1x1_intrawave_v3,754.24,452.65,0.0
gfx942,304,35328,1280,5120,ck,0,0,612.3071,a8w8_blockscale_1x128x128_256x128x128x128_16x16_32x32_2x2_8x32x1_8x32x1_1x32x1x8_8_1x1_intrawave_v3,756.24,453.81,0.0
gfx942,304,35456,1280,5120,ck,0,0,616.457,a8w8_blockscale_1x128x128_256x128x128x128_16x16_32x32_2x2_8x32x1_8x32x1_1x32x1x8_8_1x1_intrawave_v3,753.87,452.35,0.0
gfx942,304,35584,1280,5120,ck,0,0,617.7462,a8w8_blockscale_1x128x128_256x128x128x128_16x16_32x32_2x2_8x32x1_8x32x1_1x32x1x8_8_1x1_intrawave_v3,755.01,453.0,0.0
gfx942,304,35712,1280,5120,ck,0,0,614.9887,a8w8_blockscale_1x128x128_256x128x128x128_16x16_32x32_2x2_8x32x1_8x32x1_1x32x1x8_8_1x1_intrawave_v3,761.13,456.63,0.0
gfx942,304,35840,1280,5120,ck,0,0,613.2466,a8w8_blockscale_1x128x128_256x128x128x128_16x16_32x32_2x2_8x32x1_8x32x1_1x32x1x8_8_1x1_intrawave_v3,766.02,459.53,0.0
gfx942,304,35968,1280,5120,ck,0,0,616.0596,a8w8_blockscale_1x128x128_256x128x128x128_16x16_32x32_2x2_8x32x1_8x32x1_1x32x1x8_8_1x1_intrawave_v3,765.25,459.03,0.0
gfx942,304,36096,1280,5120,ck,0,0,632.8842,a8w8_blockscale_1x128x128_256x128x128x128_16x16_32x32_2x2_8x32x1_8x32x1_1x32x1x8_8_1x1_intrawave_v3,747.56,448.38,0.0
gfx942,304,36224,1280,5120,ck,0,0,614.047,a8w8_blockscale_1x128x128_256x128x128x128_16x16_32x32_2x2_8x32x1_8x32x1_1x32x1x8_8_1x1_intrawave_v3,773.22,463.73,0.0
gfx942,304,36352,1280,5120,ck,0,0,618.6916,a8w8_blockscale_1x128x128_256x128x128x128_16x16_32x32_2x2_8x32x1_8x32x1_1x32x1x8_8_1x1_intrawave_v3,770.13,461.84,0.0
gfx942,304,36480,1280,5120,ck,0,0,619.0868,a8w8_blockscale_1x128x128_256x128x128x128_16x16_32x32_2x2_8x32x1_8x32x1_1x32x1x8_8_1x1_intrawave_v3,772.35,463.13,0.0
gfx942,304,36608,1280,5120,ck,0,0,623.0123,a8w8_blockscale_1x128x128_256x128x128x128_16x16_32x32_2x2_8x32x1_8x32x1_1x32x1x8_8_1x1_intrawave_v3,770.17,461.79,0.0
gfx942,304,36736,1280,5120,ck,0,0,624.6637,a8w8_blockscale_1x128x128_256x128x128x128_16x16_32x32_2x2_8x32x1_8x32x1_1x32x1x8_8_1x1_intrawave_v3,770.82,462.15,0.0
gfx942,304,36864,1280,5120,ck,0,0,629.1305,a8w8_blockscale_1x128x128_256x128x128x128_16x16_32x32_2x2_8x32x1_8x32x1_1x32x1x8_8_1x1_intrawave_v3,768.02,460.43,0.0
gfx942,304,36992,1280,5120,ck,0,0,627.5756,a8w8_blockscale_1x128x128_256x128x128x128_16x16_32x32_2x2_8x32x1_8x32x1_1x32x1x8_8_1x1_intrawave_v3,772.59,463.13,0.0
gfx942,304,37120,1280,5120,ck,0,0,634.2951,a8w8_blockscale_1x128x128_256x128x128x128_16x16_32x32_2x2_8x32x1_8x32x1_1x32x1x8_8_1x1_intrawave_v3,767.06,459.78,0.0
gfx942,304,37248,1280,5120,ck,0,0,630.5326,a8w8_blockscale_1x128x128_256x128x128x128_16x16_32x32_2x2_8x32x1_8x32x1_1x32x1x8_8_1x1_intrawave_v3,774.29,464.08,0.0
gfx942,304,37376,1280,5120,ck,0,0,635.2178,a8w8_blockscale_1x128x128_256x128x128x128_16x16_32x32_2x2_8x32x1_8x32x1_1x32x1x8_8_1x1_intrawave_v3,771.22,462.21,0.0
gfx942,304,37504,1280,5120,ck,0,0,638.2256,a8w8_blockscale_1x128x128_256x128x128x128_16x16_32x32_2x2_8x32x1_8x32x1_1x32x1x8_8_1x1_intrawave_v3,770.22,461.57,0.0
gfx942,304,37632,1280,5120,ck,0,0,650.5838,a8w8_blockscale_1x128x128_256x128x128x128_16x16_32x32_2x2_8x32x1_8x32x1_1x32x1x8_8_1x1_intrawave_v3,758.17,454.31,0.0
gfx942,304,37760,1280,5120,ck,0,0,638.5418,a8w8_blockscale_1x128x128_256x128x128x128_16x16_32x32_2x2_8x32x1_8x32x1_1x32x1x8_8_1x1_intrawave_v3,775.09,464.42,0.0
gfx942,304,37888,1280,5120,ck,0,0,639.4438,a8w8_blockscale_1x128x128_256x128x128x128_16x16_32x32_2x2_8x32x1_8x32x1_1x32x1x8_8_1x1_intrawave_v3,776.62,465.3,0.0
gfx942,304,38016,1280,5120,ck,0,0,646.9331,a8w8_blockscale_1x128x128_256x128x128x128_16x16_32x32_2x2_8x32x1_8x32x1_1x32x1x8_8_1x1_intrawave_v3,770.22,461.43,0.0
gfx942,304,38144,1280,5120,ck,0,0,656.7862,a8w8_blockscale_1x128x128_256x128x128x128_16x16_32x32_2x2_8x32x1_8x32x1_1x32x1x8_8_1x1_intrawave_v3,761.22,456.01,0.0
gfx942,304,38272,1280,5120,ck,0,0,653.3581,a8w8_blockscale_1x128x128_256x128x128x128_16x16_32x32_2x2_8x32x1_8x32x1_1x32x1x8_8_1x1_intrawave_v3,767.79,459.9,0.0
gfx942,304,38400,1280,5120,ck,0,0,659.6038,a8w8_blockscale_1x128x128_256x128x128x128_16x16_32x32_2x2_8x32x1_8x32x1_1x32x1x8_8_1x1_intrawave_v3,763.06,457.04,0.0
gfx942,304,38528,1280,5120,ck,0,0,655.2917,a8w8_blockscale_1x128x128_256x128x128x128_16x16_32x32_2x2_8x32x1_8x32x1_1x32x1x8_8_1x1_intrawave_v3,770.64,461.55,0.0
gfx942,304,38656,1280,5120,ck,0,0,662.2159,a8w8_blockscale_1x128x128_256x128x128x128_16x16_32x32_2x2_8x32x1_8x32x1_1x32x1x8_8_1x1_intrawave_v3,765.12,458.21,0.0
gfx942,304,38784,1280,5120,ck,0,0,660.2811,a8w8_blockscale_1x128x128_256x128x128x128_16x16_32x32_2x2_8x32x1_8x32x1_1x32x1x8_8_1x1_intrawave_v3,769.9,461.04,0.0
gfx942,304,38912,1280,5120,ck,0,0,663.2127,a8w8_blockscale_1x128x128_256x128x128x128_16x16_32x32_2x2_8x32x1_8x32x1_1x32x1x8_8_1x1_intrawave_v3,769.03,460.48,0.0
gfx942,304,39040,1280,5120,ck,0,0,673.7247,a8w8_blockscale_1x128x128_256x128x128x128_16x16_32x32_2x2_8x32x1_8x32x1_1x32x1x8_8_1x1_intrawave_v3,759.52,454.76,0.0
gfx942,304,39168,1280,5120,ck,0,0,674.4227,a8w8_blockscale_1x128x128_256x128x128x128_16x16_32x32_2x2_8x32x1_8x32x1_1x32x1x8_8_1x1_intrawave_v3,761.22,455.74,0.0
gfx942,304,39296,1280,5120,ck,0,0,669.9984,a8w8_blockscale_1x128x128_256x128x128x128_16x16_32x32_2x2_8x32x1_8x32x1_1x32x1x8_8_1x1_intrawave_v3,768.75,460.22,0.0
gfx942,304,39424,1280,5120,ck,0,0,671.087,a8w8_blockscale_1x128x128_256x128x128x128_16x16_32x32_2x2_8x32x1_8x32x1_1x32x1x8_8_1x1_intrawave_v3,770.0,460.94,0.0
gfx942,304,39552,1280,5120,ck,0,0,676.8388,a8w8_blockscale_1x128x128_256x128x128x128_16x16_32x32_2x2_8x32x1_8x32x1_1x32x1x8_8_1x1_intrawave_v3,765.94,458.47,0.0
gfx942,304,39680,1280,5120,ck,0,0,682.5527,a8w8_blockscale_1x128x128_256x128x128x128_16x16_32x32_2x2_8x32x1_8x32x1_1x32x1x8_8_1x1_intrawave_v3,761.98,456.08,0.0
gfx942,304,39808,1280,5120,ck,0,0,681.0938,a8w8_blockscale_1x128x128_256x128x128x128_16x16_32x32_2x2_8x32x1_8x32x1_1x32x1x8_8_1x1_intrawave_v3,766.08,458.5,0.0
gfx942,304,39936,1280,5120,ck,0,0,674.6924,a8w8_blockscale_1x128x128_256x128x128x128_16x16_32x32_2x2_8x32x1_8x32x1_1x32x1x8_8_1x1_intrawave_v3,775.83,464.3,0.0
gfx942,304,40064,1280,5120,ck,0,0,686.0092,a8w8_blockscale_1x128x128_256x128x128x128_16x16_32x32_2x2_8x32x1_8x32x1_1x32x1x8_8_1x1_intrawave_v3,765.48,458.08,0.0
gfx942,304,40192,1280,5120,ck,0,0,687.0159,a8w8_blockscale_1x128x128_256x128x128x128_16x16_32x32_2x2_8x32x1_8x32x1_1x32x1x8_8_1x1_intrawave_v3,766.8,458.84,0.0
gfx942,304,40320,1280,5120,ck,0,0,690.4994,a8w8_blockscale_1x128x128_256x128x128x128_16x16_32x32_2x2_8x32x1_8x32x1_1x32x1x8_8_1x1_intrawave_v3,765.36,457.95,0.0
gfx942,304,40448,1280,5120,ck,0,0,681.717,a8w8_blockscale_1x128x128_256x128x128x128_16x16_32x32_2x2_8x32x1_8x32x1_1x32x1x8_8_1x1_intrawave_v3,777.68,465.29,0.0
gfx942,304,40576,1280,5120,ck,0,0,704.5826,a8w8_blockscale_1x128x128_256x128x128x128_16x16_32x32_2x2_8x32x1_8x32x1_1x32x1x8_8_1x1_intrawave_v3,754.83,451.58,0.0
gfx942,304,40704,1280,5120,ck,0,0,689.2694,a8w8_blockscale_1x128x128_256x128x128x128_16x16_32x32_2x2_8x32x1_8x32x1_1x32x1x8_8_1x1_intrawave_v3,774.03,463.04,0.0
gfx942,304,40832,1280,5120,ck,0,0,695.2987,a8w8_blockscale_1x128x128_256x128x128x128_16x16_32x32_2x2_8x32x1_8x32x1_1x32x1x8_8_1x1_intrawave_v3,769.73,460.44,0.0
gfx942,304,40960,1280,5120,ck,0,0,701.4224,a8w8_blockscale_1x128x128_256x128x128x128_16x16_32x32_2x2_8x32x1_8x32x1_1x32x1x8_8_1x1_intrawave_v3,765.4,457.82,0.0
gfx942,304,41088,1280,5120,ck,0,0,701.2805,a8w8_blockscale_1x128x128_256x128x128x128_16x16_32x32_2x2_8x32x1_8x32x1_1x32x1x8_8_1x1_intrawave_v3,767.95,459.32,0.0
gfx942,304,41216,1280,5120,ck,0,0,705.2921,a8w8_blockscale_1x128x128_256x128x128x128_16x16_32x32_2x2_8x32x1_8x32x1_1x32x1x8_8_1x1_intrawave_v3,765.96,458.1,0.0
gfx942,304,41344,1280,5120,ck,0,0,711.1446,a8w8_blockscale_1x128x128_256x128x128x128_16x16_32x32_2x2_8x32x1_8x32x1_1x32x1x8_8_1x1_intrawave_v3,762.02,455.71,0.0
gfx942,304,41472,1280,5120,ck,0,0,708.9552,a8w8_blockscale_1x128x128_256x128x128x128_16x16_32x32_2x2_8x32x1_8x32x1_1x32x1x8_8_1x1_intrawave_v3,766.74,458.5,0.0
gfx942,304,41600,1280,5120,ck,0,0,710.2272,a8w8_blockscale_1x128x128_256x128x128x128_16x16_32x32_2x2_8x32x1_8x32x1_1x32x1x8_8_1x1_intrawave_v3,767.73,459.07,0.0
gfx942,304,41728,1280,5120,ck,0,0,712.3269,a8w8_blockscale_1x128x128_256x128x128x128_16x16_32x32_2x2_8x32x1_8x32x1_1x32x1x8_8_1x1_intrawave_v3,767.82,459.09,0.0
gfx942,304,41856,1280,5120,ck,0,0,707.7488,a8w8_blockscale_1x128x128_256x128x128x128_16x16_32x32_2x2_8x32x1_8x32x1_1x32x1x8_8_1x1_intrawave_v3,775.15,463.45,0.0
gfx942,304,41984,1280,5120,ck,0,0,710.2316,a8w8_blockscale_1x128x128_256x128x128x128_16x16_32x32_2x2_8x32x1_8x32x1_1x32x1x8_8_1x1_intrawave_v3,774.81,463.22,0.0
gfx942,304,42112,1280,5120,ck,0,0,714.9211,a8w8_blockscale_1x128x128_256x128x128x128_16x16_32x32_2x2_8x32x1_8x32x1_1x32x1x8_8_1x1_intrawave_v3,772.07,461.55,0.0
gfx942,304,42240,1280,5120,ck,0,0,719.3019,a8w8_blockscale_1x128x128_256x128x128x128_16x16_32x32_2x2_8x32x1_8x32x1_1x32x1x8_8_1x1_intrawave_v3,769.7,460.11,0.0
gfx942,304,42368,1280,5120,ck,0,0,720.1342,a8w8_blockscale_1x128x128_256x128x128x128_16x16_32x32_2x2_8x32x1_8x32x1_1x32x1x8_8_1x1_intrawave_v3,771.14,460.94,0.0
gfx942,304,42496,1280,5120,ck,0,0,728.9641,a8w8_blockscale_1x128x128_256x128x128x128_16x16_32x32_2x2_8x32x1_8x32x1_1x32x1x8_8_1x1_intrawave_v3,764.1,456.71,0.0
gfx942,304,42624,1280,5120,ck,0,0,747.6754,a8w8_blockscale_1x128x128_256x128x128x128_16x16_32x32_2x2_8x32x1_8x32x1_1x32x1x8_8_1x1_intrawave_v3,747.22,446.59,0.0
gfx942,304,42752,1280,5120,ck,0,0,732.7609,a8w8_blockscale_1x128x128_256x128x128x128_16x16_32x32_2x2_8x32x1_8x32x1_1x32x1x8_8_1x1_intrawave_v3,764.72,457.02,0.0
gfx942,304,42880,1280,5120,ck,0,0,736.7316,a8w8_blockscale_1x128x128_256x128x128x128_16x16_32x32_2x2_8x32x1_8x32x1_1x32x1x8_8_1x1_intrawave_v3,762.88,455.89,0.0
gfx942,304,43008,1280,5120,ck,0,0,745.4821,a8w8_blockscale_1x128x128_256x128x128x128_16x16_32x32_2x2_8x32x1_8x32x1_1x32x1x8_8_1x1_intrawave_v3,756.17,451.86,0.0
gfx942,304,43136,1280,5120,ck,0,0,740.6328,a8w8_blockscale_1x128x128_256x128x128x128_16x16_32x32_2x2_8x32x1_8x32x1_1x32x1x8_8_1x1_intrawave_v3,763.39,456.15,0.0
gfx942,304,43264,1280,5120,ck,0,0,737.3095,a8w8_blockscale_1x128x128_256x128x128x128_16x16_32x32_2x2_8x32x1_8x32x1_1x32x1x8_8_1x1_intrawave_v3,769.11,459.54,0.0
gfx942,304,43392,1280,5120,ck,0,0,740.5268,a8w8_blockscale_1x128x128_256x128x128x128_16x16_32x32_2x2_8x32x1_8x32x1_1x32x1x8_8_1x1_intrawave_v3,768.03,458.87,0.0
gfx942,304,43520,1280,5120,ck,0,0,742.0173,a8w8_blockscale_1x128x128_256x128x128x128_16x16_32x32_2x2_8x32x1_8x32x1_1x32x1x8_8_1x1_intrawave_v3,768.75,459.27,0.0
gfx942,304,43648,1280,5120,ck,0,0,746.8983,a8w8_blockscale_1x128x128_256x128x128x128_16x16_32x32_2x2_8x32x1_8x32x1_1x32x1x8_8_1x1_intrawave_v3,765.97,457.59,0.0
gfx942,304,43776,1280,5120,ck,0,0,743.8039,a8w8_blockscale_1x128x128_256x128x128x128_16x16_32x32_2x2_8x32x1_8x32x1_1x32x1x8_8_1x1_intrawave_v3,771.41,460.81,0.0
gfx942,304,43904,1280,5120,ck,0,0,748.3469,a8w8_blockscale_1x128x128_256x128x128x128_16x16_32x32_2x2_8x32x1_8x32x1_1x32x1x8_8_1x1_intrawave_v3,768.97,459.33,0.0
gfx942,304,44032,1280,5120,ck,0,0,759.9054,a8w8_blockscale_1x128x128_256x128x128x128_16x16_32x32_2x2_8x32x1_8x32x1_1x32x1x8_8_1x1_intrawave_v3,759.48,453.63,0.0
gfx942,304,44160,1280,5120,ck,0,0,748.8139,a8w8_blockscale_1x128x128_256x128x128x128_16x16_32x32_2x2_8x32x1_8x32x1_1x32x1x8_8_1x1_intrawave_v3,772.97,461.67,0.0
gfx942,304,44288,1280,5120,ck,0,0,770.4126,a8w8_blockscale_1x128x128_256x128x128x128_16x16_32x32_2x2_8x32x1_8x32x1_1x32x1x8_8_1x1_intrawave_v3,753.48,450.0,0.0
gfx942,304,44416,1280,5120,ck,0,0,752.8111,a8w8_blockscale_1x128x128_256x128x128x128_16x16_32x32_2x2_8x32x1_8x32x1_1x32x1x8_8_1x1_intrawave_v3,773.33,461.83,0.0
gfx942,304,44544,1280,5120,ck,0,0,762.1677,a8w8_blockscale_1x128x128_256x128x128x128_16x16_32x32_2x2_8x32x1_8x32x1_1x32x1x8_8_1x1_intrawave_v3,766.03,457.45,0.0
gfx942,304,44672,1280,5120,ck,0,0,763.7839,a8w8_blockscale_1x128x128_256x128x128x128_16x16_32x32_2x2_8x32x1_8x32x1_1x32x1x8_8_1x1_intrawave_v3,766.61,457.77,0.0
gfx942,304,44800,1280,5120,ck,0,0,754.7253,a8w8_blockscale_1x128x128_256x128x128x128_16x16_32x32_2x2_8x32x1_8x32x1_1x32x1x8_8_1x1_intrawave_v3,778.03,464.56,0.0
gfx942,304,44928,1280,5120,ck,0,0,764.4012,a8w8_blockscale_1x128x128_256x128x128x128_16x16_32x32_2x2_8x32x1_8x32x1_1x32x1x8_8_1x1_intrawave_v3,770.38,459.97,0.0
gfx942,304,45056,1280,5120,ck,0,0,744.6618,a8w8_blockscale_1x128x128_256x128x128x128_16x16_32x32_2x2_8x32x1_8x32x1_1x32x1x8_8_1x1_intrawave_v3,793.06,473.48,0.0
gfx942,304,45184,1280,5120,ck,0,0,766.0478,a8w8_blockscale_1x128x128_256x128x128x128_16x16_32x32_2x2_8x32x1_8x32x1_1x32x1x8_8_1x1_intrawave_v3,773.11,461.55,0.0
gfx942,304,45312,1280,5120,ck,0,0,792.5131,a8w8_blockscale_1x128x128_256x128x128x128_16x16_32x32_2x2_8x32x1_8x32x1_1x32x1x8_8_1x1_intrawave_v3,749.41,447.37,0.0
gfx942,304,45440,1280,5120,ck,0,0,778.2642,a8w8_blockscale_1x128x128_256x128x128x128_16x16_32x32_2x2_8x32x1_8x32x1_1x32x1x8_8_1x1_intrawave_v3,765.28,456.83,0.0
gfx942,304,45568,1280,5120,ck,0,0,783.2004,a8w8_blockscale_1x128x128_256x128x128x128_16x16_32x32_2x2_8x32x1_8x32x1_1x32x1x8_8_1x1_intrawave_v3,762.6,455.2,0.0
gfx942,304,45696,1280,5120,ck,0,0,781.0266,a8w8_blockscale_1x128x128_256x128x128x128_16x16_32x32_2x2_8x32x1_8x32x1_1x32x1x8_8_1x1_intrawave_v3,766.87,457.73,0.0
gfx942,304,45824,1280,5120,ck,0,0,782.4628,a8w8_blockscale_1x128x128_256x128x128x128_16x16_32x32_2x2_8x32x1_8x32x1_1x32x1x8_8_1x1_intrawave_v3,767.61,458.15,0.0
gfx942,304,45952,1280,5120,ck,0,0,786.296,a8w8_blockscale_1x128x128_256x128x128x128_16x16_32x32_2x2_8x32x1_8x32x1_1x32x1x8_8_1x1_intrawave_v3,766.0,457.16,0.0
gfx942,304,46080,1280,5120,ck,0,0,787.9957,a8w8_blockscale_1x128x128_256x128x128x128_16x16_32x32_2x2_8x32x1_8x32x1_1x32x1x8_8_1x1_intrawave_v3,766.48,457.42,0.0
gfx942,304,46208,1280,5120,ck,0,0,794.9052,a8w8_blockscale_1x128x128_256x128x128x128_16x16_32x32_2x2_8x32x1_8x32x1_1x32x1x8_8_1x1_intrawave_v3,761.92,454.68,0.0
gfx942,304,46336,1280,5120,ck,0,0,785.858,a8w8_blockscale_1x128x128_256x128x128x128_16x16_32x32_2x2_8x32x1_8x32x1_1x32x1x8_8_1x1_intrawave_v3,772.83,461.17,0.0
gfx942,304,46464,1280,5120,ck,0,0,792.8066,a8w8_blockscale_1x128x128_256x128x128x128_16x16_32x32_2x2_8x32x1_8x32x1_1x32x1x8_8_1x1_intrawave_v3,768.17,458.37,0.0
gfx942,304,46592,1280,5120,ck,0,0,796.659,a8w8_blockscale_1x128x128_256x128x128x128_16x16_32x32_2x2_8x32x1_8x32x1_1x32x1x8_8_1x1_intrawave_v3,766.56,457.39,0.0
gfx942,304,46720,1280,5120,ck,0,0,793.1082,a8w8_blockscale_1x128x128_256x128x128x128_16x16_32x32_2x2_8x32x1_8x32x1_1x32x1x8_8_1x1_intrawave_v3,772.11,460.67,0.0
gfx942,304,46848,1280,5120,ck,0,0,802.4988,a8w8_blockscale_1x128x128_256x128x128x128_16x16_32x32_2x2_8x32x1_8x32x1_1x32x1x8_8_1x1_intrawave_v3,765.17,456.51,0.0
gfx942,304,46976,1280,5120,ck,0,0,796.8429,a8w8_blockscale_1x128x128_256x128x128x128_16x16_32x32_2x2_8x32x1_8x32x1_1x32x1x8_8_1x1_intrawave_v3,772.7,460.98,0.0
gfx942,304,47104,1280,5120,ck,0,0,800.9115,a8w8_blockscale_1x128x128_256x128x128x128_16x16_32x32_2x2_8x32x1_8x32x1_1x32x1x8_8_1x1_intrawave_v3,770.87,459.87,0.0
gfx942,304,47232,1280,5120,ck,0,0,833.2887,a8w8_blockscale_1x128x128_256x128x128x128_16x16_32x32_2x2_8x32x1_8x32x1_1x32x1x8_8_1x1_intrawave_v3,742.93,443.18,0.0
gfx942,304,47360,1280,5120,ck,0,0,820.1165,a8w8_blockscale_1x128x128_256x128x128x128_16x16_32x32_2x2_8x32x1_8x32x1_1x32x1x8_8_1x1_intrawave_v3,756.91,451.49,0.0
gfx942,304,47488,1280,5120,ck,0,0,800.503,a8w8_blockscale_1x128x128_256x128x128x128_16x16_32x32_2x2_8x32x1_8x32x1_1x32x1x8_8_1x1_intrawave_v3,777.55,463.79,0.0
gfx942,304,47616,1280,5120,ck,0,0,818.0794,a8w8_blockscale_1x128x128_256x128x128x128_16x16_32x32_2x2_8x32x1_8x32x1_1x32x1x8_8_1x1_intrawave_v3,762.9,455.02,0.0
gfx942,304,47744,1280,5120,ck,0,0,803.8463,a8w8_blockscale_1x128x128_256x128x128x128_16x16_32x32_2x2_8x32x1_8x32x1_1x32x1x8_8_1x1_intrawave_v3,778.49,464.3,0.0
gfx942,304,47872,1280,5120,ck,0,0,821.4083,a8w8_blockscale_1x128x128_256x128x128x128_16x16_32x32_2x2_8x32x1_8x32x1_1x32x1x8_8_1x1_intrawave_v3,763.89,455.57,0.0
gfx942,304,48000,1280,5120,ck,0,0,824.455,a8w8_blockscale_1x128x128_256x128x128x128_16x16_32x32_2x2_8x32x1_8x32x1_1x32x1x8_8_1x1_intrawave_v3,763.1,455.08,0.0
gfx942,304,48128,1280,5120,ck,0,0,813.1153,a8w8_blockscale_1x128x128_256x128x128x128_16x16_32x32_2x2_8x32x1_8x32x1_1x32x1x8_8_1x1_intrawave_v3,775.81,462.64,0.0
gfx942,304,48256,1280,5120,ck,0,0,842.9686,a8w8_blockscale_1x128x128_256x128x128x128_16x16_32x32_2x2_8x32x1_8x32x1_1x32x1x8_8_1x1_intrawave_v3,750.33,447.42,0.0
gfx942,304,48384,1280,5120,ck,0,0,815.4727,a8w8_blockscale_1x128x128_256x128x128x128_16x16_32x32_2x2_8x32x1_8x32x1_1x32x1x8_8_1x1_intrawave_v3,777.68,463.71,0.0
gfx942,304,48512,1280,5120,ck,0,0,834.5031,a8w8_blockscale_1x128x128_256x128x128x128_16x16_32x32_2x2_8x32x1_8x32x1_1x32x1x8_8_1x1_intrawave_v3,761.96,454.31,0.0
gfx942,304,48640,1280,5120,ck,0,0,824.3056,a8w8_blockscale_1x128x128_256x128x128x128_16x16_32x32_2x2_8x32x1_8x32x1_1x32x1x8_8_1x1_intrawave_v3,773.42,461.13,0.0
gfx942,304,48768,1280,5120,ck,0,0,831.2478,a8w8_blockscale_1x128x128_256x128x128x128_16x16_32x32_2x2_8x32x1_8x32x1_1x32x1x8_8_1x1_intrawave_v3,768.98,458.46,0.0
gfx942,304,48896,1280,5120,ck,0,0,842.0377,a8w8_blockscale_1x128x128_256x128x128x128_16x16_32x32_2x2_8x32x1_8x32x1_1x32x1x8_8_1x1_intrawave_v3,761.12,453.75,0.0
gfx942,304,49024,1280,5120,ck,0,0,823.4316,a8w8_blockscale_1x128x128_256x128x128x128_16x16_32x32_2x2_8x32x1_8x32x1_1x32x1x8_8_1x1_intrawave_v3,780.35,465.2,0.0
gfx942,304,49152,1280,5120,ck,0,0,814.0193,a8w8_blockscale_1x128x128_256x128x128x128_16x16_32x32_2x2_8x32x1_8x32x1_1x32x1x8_8_1x1_intrawave_v3,791.44,471.78,0.0
gfx942,304,49280,1280,5120,ck,0,0,820.573,a8w8_blockscale_1x128x128_256x128x128x128_16x16_32x32_2x2_8x32x1_8x32x1_1x32x1x8_8_1x1_intrawave_v3,787.16,469.21,0.0
gfx942,304,49408,1280,5120,ck,0,0,834.8737,a8w8_blockscale_1x128x128_256x128x128x128_16x16_32x32_2x2_8x32x1_8x32x1_1x32x1x8_8_1x1_intrawave_v3,775.69,462.35,0.0
gfx942,304,49536,1280,5120,ck,0,0,839.7727,a8w8_blockscale_1x128x128_256x128x128x128_16x16_32x32_2x2_8x32x1_8x32x1_1x32x1x8_8_1x1_intrawave_v3,773.16,460.83,0.0
gfx942,304,49664,1280,5120,ck,0,0,847.5366,a8w8_blockscale_1x128x128_256x128x128x128_16x16_32x32_2x2_8x32x1_8x32x1_1x32x1x8_8_1x1_intrawave_v3,768.06,457.77,0.0
gfx942,304,49792,1280,5120,ck,0,0,836.9692,a8w8_blockscale_1x128x128_256x128x128x128_16x16_32x32_2x2_8x32x1_8x32x1_1x32x1x8_8_1x1_intrawave_v3,779.76,464.72,0.0
gfx942,304,49920,1280,5120,ck,0,0,855.3927,a8w8_blockscale_1x128x128_256x128x128x128_16x16_32x32_2x2_8x32x1_8x32x1_1x32x1x8_8_1x1_intrawave_v3,764.93,455.86,0.0
gfx942,304,50048,1280,5120,ck,0,0,844.4816,a8w8_blockscale_1x128x128_256x128x128x128_16x16_32x32_2x2_8x32x1_8x32x1_1x32x1x8_8_1x1_intrawave_v3,776.8,462.91,0.0
gfx942,304,50176,1280,5120,ck,0,0,856.4978,a8w8_blockscale_1x128x128_256x128x128x128_16x16_32x32_2x2_8x32x1_8x32x1_1x32x1x8_8_1x1_intrawave_v3,767.86,457.57,0.0
gfx942,304,50304,1280,5120,ck,0,0,857.5378,a8w8_blockscale_1x128x128_256x128x128x128_16x16_32x32_2x2_8x32x1_8x32x1_1x32x1x8_8_1x1_intrawave_v3,768.88,458.16,0.0
gfx942,304,50432,1280,5120,ck,0,0,858.9046,a8w8_blockscale_1x128x128_256x128x128x128_16x16_32x32_2x2_8x32x1_8x32x1_1x32x1x8_8_1x1_intrawave_v3,769.61,458.57,0.0
gfx942,304,50560,1280,5120,ck,0,0,868.5477,a8w8_blockscale_1x128x128_256x128x128x128_16x16_32x32_2x2_8x32x1_8x32x1_1x32x1x8_8_1x1_intrawave_v3,763.0,454.61,0.0
gfx942,304,50688,1280,5120,ck,0,0,870.575,a8w8_blockscale_1x128x128_256x128x128x128_16x16_32x32_2x2_8x32x1_8x32x1_1x32x1x8_8_1x1_intrawave_v3,763.15,454.69,0.0
gfx942,304,50816,1280,5120,ck,0,0,860.6827,a8w8_blockscale_1x128x128_256x128x128x128_16x16_32x32_2x2_8x32x1_8x32x1_1x32x1x8_8_1x1_intrawave_v3,773.87,461.05,0.0
gfx942,304,50944,1280,5120,ck,0,0,869.983,a8w8_blockscale_1x128x128_256x128x128x128_16x16_32x32_2x2_8x32x1_8x32x1_1x32x1x8_8_1x1_intrawave_v3,767.52,457.25,0.0
gfx942,304,51072,1280,5120,ck,0,0,863.4024,a8w8_blockscale_1x128x128_256x128x128x128_16x16_32x32_2x2_8x32x1_8x32x1_1x32x1x8_8_1x1_intrawave_v3,775.32,461.88,0.0
gfx942,304,51200,1280,5120,ck,0,0,861.7142,a8w8_blockscale_1x128x128_256x128x128x128_16x16_32x32_2x2_8x32x1_8x32x1_1x32x1x8_8_1x1_intrawave_v3,778.78,463.92,0.0
gfx942,304,51328,1280,5120,ck,0,0,881.7024,a8w8_blockscale_1x128x128_256x128x128x128_16x16_32x32_2x2_8x32x1_8x32x1_1x32x1x8_8_1x1_intrawave_v3,763.03,454.52,0.0
gfx942,304,51456,1280,5120,ck,0,0,870.2234,a8w8_blockscale_1x128x128_256x128x128x128_16x16_32x32_2x2_8x32x1_8x32x1_1x32x1x8_8_1x1_intrawave_v3,775.02,461.65,0.0
gfx942,304,51584,1280,5120,ck,0,0,867.2411,a8w8_blockscale_1x128x128_256x128x128x128_16x16_32x32_2x2_8x32x1_8x32x1_1x32x1x8_8_1x1_intrawave_v3,779.62,464.37,0.0
gfx942,304,51712,1280,5120,ck,0,0,891.6776,a8w8_blockscale_1x128x128_256x128x128x128_16x16_32x32_2x2_8x32x1_8x32x1_1x32x1x8_8_1x1_intrawave_v3,760.14,452.74,0.0
gfx942,304,51840,1280,5120,ck,0,0,881.4042,a8w8_blockscale_1x128x128_256x128x128x128_16x16_32x32_2x2_8x32x1_8x32x1_1x32x1x8_8_1x1_intrawave_v3,770.9,459.14,0.0
gfx942,304,51968,1280,5120,ck,0,0,888.0749,a8w8_blockscale_1x128x128_256x128x128x128_16x16_32x32_2x2_8x32x1_8x32x1_1x32x1x8_8_1x1_intrawave_v3,767.0,456.79,0.0
gfx942,304,52096,1280,5120,ck,0,0,889.9471,a8w8_blockscale_1x128x128_256x128x128x128_16x16_32x32_2x2_8x32x1_8x32x1_1x32x1x8_8_1x1_intrawave_v3,767.27,456.94,0.0
gfx942,304,52224,1280,5120,ck,0,0,892.6291,a8w8_blockscale_1x128x128_256x128x128x128_16x16_32x32_2x2_8x32x1_8x32x1_1x32x1x8_8_1x1_intrawave_v3,766.85,456.67,0.0
gfx942,304,52352,1280,5120,ck,0,0,897.285,a8w8_blockscale_1x128x128_256x128x128x128_16x16_32x32_2x2_8x32x1_8x32x1_1x32x1x8_8_1x1_intrawave_v3,764.74,455.39,0.0
gfx942,304,52480,1280,5120,ck,0,0,889.8051,a8w8_blockscale_1x128x128_256x128x128x128_16x16_32x32_2x2_8x32x1_8x32x1_1x32x1x8_8_1x1_intrawave_v3,773.05,460.33,0.0
gfx942,304,52608,1280,5120,ck,0,0,887.8154,a8w8_blockscale_1x128x128_256x128x128x128_16x16_32x32_2x2_8x32x1_8x32x1_1x32x1x8_8_1x1_intrawave_v3,776.67,462.46,0.0
gfx942,304,52736,1280,5120,ck,0,0,898.6148,a8w8_blockscale_1x128x128_256x128x128x128_16x16_32x32_2x2_8x32x1_8x32x1_1x32x1x8_8_1x1_intrawave_v3,769.21,458.0,0.0
gfx942,304,52864,1280,5120,ck,0,0,895.5014,a8w8_blockscale_1x128x128_256x128x128x128_16x16_32x32_2x2_8x32x1_8x32x1_1x32x1x8_8_1x1_intrawave_v3,773.76,460.69,0.0
gfx942,304,52992,1280,5120,ck,0,0,891.7686,a8w8_blockscale_1x128x128_256x128x128x128_16x16_32x32_2x2_8x32x1_8x32x1_1x32x1x8_8_1x1_intrawave_v3,778.88,463.72,0.0
gfx942,304,53120,1280,5120,ck,0,0,907.9971,a8w8_blockscale_1x128x128_256x128x128x128_16x16_32x32_2x2_8x32x1_8x32x1_1x32x1x8_8_1x1_intrawave_v3,766.8,456.52,0.0
gfx942,304,53248,1280,5120,ck,0,0,893.3666,a8w8_blockscale_1x128x128_256x128x128x128_16x16_32x32_2x2_8x32x1_8x32x1_1x32x1x8_8_1x1_intrawave_v3,781.24,465.09,0.0
gfx942,304,53376,1280,5120,ck,0,0,904.9918,a8w8_blockscale_1x128x128_256x128x128x128_16x16_32x32_2x2_8x32x1_8x32x1_1x32x1x8_8_1x1_intrawave_v3,773.06,460.2,0.0
gfx942,304,53504,1280,5120,ck,0,0,933.9593,a8w8_blockscale_1x128x128_256x128x128x128_16x16_32x32_2x2_8x32x1_8x32x1_1x32x1x8_8_1x1_intrawave_v3,750.88,446.98,0.0
gfx942,304,53632,1280,5120,ck,0,0,902.0888,a8w8_blockscale_1x128x128_256x128x128x128_16x16_32x32_2x2_8x32x1_8x32x1_1x32x1x8_8_1x1_intrawave_v3,779.26,463.86,0.0
gfx942,304,53760,1280,5120,ck,0,0,914.4616,a8w8_blockscale_1x128x128_256x128x128x128_16x16_32x32_2x2_8x32x1_8x32x1_1x32x1x8_8_1x1_intrawave_v3,770.56,458.66,0.0
gfx942,304,53888,1280,5120,ck,0,0,915.027,a8w8_blockscale_1x128x128_256x128x128x128_16x16_32x32_2x2_8x32x1_8x32x1_1x32x1x8_8_1x1_intrawave_v3,771.91,459.45,0.0
gfx942,304,54016,1280,5120,ck,0,0,924.0537,a8w8_blockscale_1x128x128_256x128x128x128_16x16_32x32_2x2_8x32x1_8x32x1_1x32x1x8_8_1x1_intrawave_v3,766.19,456.03,0.0
gfx942,304,54144,1280,5120,ck,0,0,918.2099,a8w8_blockscale_1x128x128_256x128x128x128_16x16_32x32_2x2_8x32x1_8x32x1_1x32x1x8_8_1x1_intrawave_v3,772.89,460.0,0.0
gfx942,304,54272,1280,5120,ck,0,0,920.0467,a8w8_blockscale_1x128x128_256x128x128x128_16x16_32x32_2x2_8x32x1_8x32x1_1x32x1x8_8_1x1_intrawave_v3,773.17,460.15,0.0
gfx942,304,54400,1280,5120,ck,0,0,932.1144,a8w8_blockscale_1x128x128_256x128x128x128_16x16_32x32_2x2_8x32x1_8x32x1_1x32x1x8_8_1x1_intrawave_v3,764.96,455.25,0.0
gfx942,304,54528,1280,5120,ck,0,0,927.2147,a8w8_blockscale_1x128x128_256x128x128x128_16x16_32x32_2x2_8x32x1_8x32x1_1x32x1x8_8_1x1_intrawave_v3,770.81,458.72,0.0
gfx942,304,54656,1280,5120,ck,0,0,929.7551,a8w8_blockscale_1x128x128_256x128x128x128_16x16_32x32_2x2_8x32x1_8x32x1_1x32x1x8_8_1x1_intrawave_v3,770.51,458.52,0.0
gfx942,304,54784,1280,5120,ck,0,0,927.9753,a8w8_blockscale_1x128x128_256x128x128x128_16x16_32x32_2x2_8x32x1_8x32x1_1x32x1x8_8_1x1_intrawave_v3,773.8,460.46,0.0
gfx942,304,54912,1280,5120,ck,0,0,937.0384,a8w8_blockscale_1x128x128_256x128x128x128_16x16_32x32_2x2_8x32x1_8x32x1_1x32x1x8_8_1x1_intrawave_v3,768.1,457.05,0.0
gfx942,304,55040,1280,5120,ck,0,0,953.2552,a8w8_blockscale_1x128x128_256x128x128x128_16x16_32x32_2x2_8x32x1_8x32x1_1x32x1x8_8_1x1_intrawave_v3,756.8,450.31,0.0
gfx942,304,55168,1280,5120,ck,0,0,944.5097,a8w8_blockscale_1x128x128_256x128x128x128_16x16_32x32_2x2_8x32x1_8x32x1_1x32x1x8_8_1x1_intrawave_v3,765.58,455.52,0.0
gfx942,304,55296,1280,5120,ck,0,0,926.1343,a8w8_blockscale_1x128x128_256x128x128x128_16x16_32x32_2x2_8x32x1_8x32x1_1x32x1x8_8_1x1_intrawave_v3,782.58,465.62,0.0
gfx942,304,55424,1280,5120,ck,0,0,949.3695,a8w8_blockscale_1x128x128_256x128x128x128_16x16_32x32_2x2_8x32x1_8x32x1_1x32x1x8_8_1x1_intrawave_v3,765.2,455.26,0.0
gfx942,304,55552,1280,5120,ck,0,0,953.8039,a8w8_blockscale_1x128x128_256x128x128x128_16x16_32x32_2x2_8x32x1_8x32x1_1x32x1x8_8_1x1_intrawave_v3,763.4,454.17,0.0
gfx942,304,55680,1280,5120,ck,0,0,934.4835,a8w8_blockscale_1x128x128_256x128x128x128_16x16_32x32_2x2_8x32x1_8x32x1_1x32x1x8_8_1x1_intrawave_v3,780.98,464.62,0.0
gfx942,304,55808,1280,5120,ck,0,0,943.8086,a8w8_blockscale_1x128x128_256x128x128x128_16x16_32x32_2x2_8x32x1_8x32x1_1x32x1x8_8_1x1_intrawave_v3,775.04,461.07,0.0
gfx942,304,55936,1280,5120,ck,0,0,951.61,a8w8_blockscale_1x128x128_256x128x128x128_16x16_32x32_2x2_8x32x1_8x32x1_1x32x1x8_8_1x1_intrawave_v3,770.45,458.32,0.0
gfx942,304,56064,1280,5120,ck,0,0,939.3512,a8w8_blockscale_1x128x128_256x128x128x128_16x16_32x32_2x2_8x32x1_8x32x1_1x32x1x8_8_1x1_intrawave_v3,782.29,465.35,0.0
gfx942,304,56192,1280,5120,ck,0,0,947.9653,a8w8_blockscale_1x128x128_256x128x128x128_16x16_32x32_2x2_8x32x1_8x32x1_1x32x1x8_8_1x1_intrawave_v3,776.95,462.16,0.0
gfx942,304,56320,1280,5120,ck,0,0,960.0607,a8w8_blockscale_1x128x128_256x128x128x128_16x16_32x32_2x2_8x32x1_8x32x1_1x32x1x8_8_1x1_intrawave_v3,768.91,457.36,0.0
gfx942,304,56448,1280,5120,ck,0,0,953.907,a8w8_blockscale_1x128x128_256x128x128x128_16x16_32x32_2x2_8x32x1_8x32x1_1x32x1x8_8_1x1_intrawave_v3,775.63,461.34,0.0
gfx942,304,56576,1280,5120,ck,0,0,955.5166,a8w8_blockscale_1x128x128_256x128x128x128_16x16_32x32_2x2_8x32x1_8x32x1_1x32x1x8_8_1x1_intrawave_v3,776.08,461.59,0.0
gfx942,304,56704,1280,5120,ck,0,0,962.8817,a8w8_blockscale_1x128x128_256x128x128x128_16x16_32x32_2x2_8x32x1_8x32x1_1x32x1x8_8_1x1_intrawave_v3,771.88,459.08,0.0
gfx942,304,56832,1280,5120,ck,0,0,962.4462,a8w8_blockscale_1x128x128_256x128x128x128_16x16_32x32_2x2_8x32x1_8x32x1_1x32x1x8_8_1x1_intrawave_v3,773.97,460.31,0.0
gfx942,304,56960,1280,5120,ck,0,0,979.0082,a8w8_blockscale_1x128x128_256x128x128x128_16x16_32x32_2x2_8x32x1_8x32x1_1x32x1x8_8_1x1_intrawave_v3,762.59,453.53,0.0
gfx942,304,57088,1280,5120,ck,0,0,974.5305,a8w8_blockscale_1x128x128_256x128x128x128_16x16_32x32_2x2_8x32x1_8x32x1_1x32x1x8_8_1x1_intrawave_v3,767.82,456.62,0.0
gfx942,304,57216,1280,5120,ck,0,0,999.5296,a8w8_blockscale_1x128x128_256x128x128x128_16x16_32x32_2x2_8x32x1_8x32x1_1x32x1x8_8_1x1_intrawave_v3,750.29,446.18,0.0
gfx942,304,57344,1280,5120,ck,0,0,945.2341,a8w8_blockscale_1x128x128_256x128x128x128_16x16_32x32_2x2_8x32x1_8x32x1_1x32x1x8_8_1x1_intrawave_v3,795.17,472.85,0.0
gfx942,304,57472,1280,5120,ck,0,0,973.6069,a8w8_blockscale_1x128x128_256x128x128x128_16x16_32x32_2x2_8x32x1_8x32x1_1x32x1x8_8_1x1_intrawave_v3,773.72,460.08,0.0
gfx942,304,57600,1280,5120,ck,0,0,983.674,a8w8_blockscale_1x128x128_256x128x128x128_16x16_32x32_2x2_8x32x1_8x32x1_1x32x1x8_8_1x1_intrawave_v3,767.51,456.37,0.0
gfx942,304,57728,1280,5120,ck,0,0,1005.5487,a8w8_blockscale_1x128x128_256x128x128x128_16x16_32x32_2x2_8x32x1_8x32x1_1x32x1x8_8_1x1_intrawave_v3,752.48,447.42,0.0
gfx942,304,57856,1280,5120,ck,0,0,992.0854,a8w8_blockscale_1x128x128_256x128x128x128_16x16_32x32_2x2_8x32x1_8x32x1_1x32x1x8_8_1x1_intrawave_v3,764.38,454.48,0.0
gfx942,304,57984,1280,5120,ck,0,0,1016.0889,a8w8_blockscale_1x128x128_256x128x128x128_16x16_32x32_2x2_8x32x1_8x32x1_1x32x1x8_8_1x1_intrawave_v3,747.97,444.72,0.0
gfx942,304,58112,1280,5120,ck,0,0,991.5753,a8w8_blockscale_1x128x128_256x128x128x128_16x16_32x32_2x2_8x32x1_8x32x1_1x32x1x8_8_1x1_intrawave_v3,768.16,456.7,0.0
gfx942,304,58240,1280,5120,ck,0,0,995.3494,a8w8_blockscale_1x128x128_256x128x128x128_16x16_32x32_2x2_8x32x1_8x32x1_1x32x1x8_8_1x1_intrawave_v3,766.93,455.96,0.0
gfx942,304,58368,1280,5120,ck,0,0,988.178,a8w8_blockscale_1x128x128_256x128x128x128_16x16_32x32_2x2_8x32x1_8x32x1_1x32x1x8_8_1x1_intrawave_v3,774.19,460.26,0.0
gfx942,304,58496,1280,5120,ck,0,0,993.8113,a8w8_blockscale_1x128x128_256x128x128x128_16x16_32x32_2x2_8x32x1_8x32x1_1x32x1x8_8_1x1_intrawave_v3,771.49,458.64,0.0
gfx942,304,58624,1280,5120,ck,0,0,989.4711,a8w8_blockscale_1x128x128_256x128x128x128_16x16_32x32_2x2_8x32x1_8x32x1_1x32x1x8_8_1x1_intrawave_v3,776.57,461.65,0.0
gfx942,304,58752,1280,5120,ck,0,0,1003.742,a8w8_blockscale_1x128x128_256x128x128x128_16x16_32x32_2x2_8x32x1_8x32x1_1x32x1x8_8_1x1_intrawave_v3,767.2,456.06,0.0
gfx942,304,58880,1280,5120,ck,0,0,1007.9166,a8w8_blockscale_1x128x128_256x128x128x128_16x16_32x32_2x2_8x32x1_8x32x1_1x32x1x8_8_1x1_intrawave_v3,765.69,455.15,0.0
gfx942,304,59008,1280,5120,ck,0,0,996.2595,a8w8_blockscale_1x128x128_256x128x128x128_16x16_32x32_2x2_8x32x1_8x32x1_1x32x1x8_8_1x1_intrawave_v3,776.33,461.46,0.0
gfx942,304,59136,1280,5120,ck,0,0,996.3154,a8w8_blockscale_1x128x128_256x128x128x128_16x16_32x32_2x2_8x32x1_8x32x1_1x32x1x8_8_1x1_intrawave_v3,777.97,462.42,0.0
gfx942,304,59264,1280,5120,ck,0,0,1016.6208,a8w8_blockscale_1x128x128_256x128x128x128_16x16_32x32_2x2_8x32x1_8x32x1_1x32x1x8_8_1x1_intrawave_v3,764.09,454.15,0.0
gfx942,304,59392,1280,5120,ck,0,0,997.058,a8w8_blockscale_1x128x128_256x128x128x128_16x16_32x32_2x2_8x32x1_8x32x1_1x32x1x8_8_1x1_intrawave_v3,780.76,464.05,0.0
gfx942,304,59520,1280,5120,ck,0,0,1009.8195,a8w8_blockscale_1x128x128_256x128x128x128_16x16_32x32_2x2_8x32x1_8x32x1_1x32x1x8_8_1x1_intrawave_v3,772.55,459.16,0.0
gfx942,304,59648,1280,5120,ck,0,0,1017.8594,a8w8_blockscale_1x128x128_256x128x128x128_16x16_32x32_2x2_8x32x1_8x32x1_1x32x1x8_8_1x1_intrawave_v3,768.1,456.5,0.0
gfx942,304,59776,1280,5120,ck,0,0,1012.943,a8w8_blockscale_1x128x128_256x128x128x128_16x16_32x32_2x2_8x32x1_8x32x1_1x32x1x8_8_1x1_intrawave_v3,773.48,459.68,0.0
gfx942,304,59904,1280,5120,ck,0,0,1027.6259,a8w8_blockscale_1x128x128_256x128x128x128_16x16_32x32_2x2_8x32x1_8x32x1_1x32x1x8_8_1x1_intrawave_v3,764.07,454.07,0.0
gfx942,304,60032,1280,5120,ck,0,0,1037.4233,a8w8_blockscale_1x128x128_256x128x128x128_16x16_32x32_2x2_8x32x1_8x32x1_1x32x1x8_8_1x1_intrawave_v3,758.47,450.73,0.0
gfx942,304,60160,1280,5120,ck,0,0,1016.0699,a8w8_blockscale_1x128x128_256x128x128x128_16x16_32x32_2x2_8x32x1_8x32x1_1x32x1x8_8_1x1_intrawave_v3,776.06,461.17,0.0
gfx942,304,60288,1280,5120,ck,0,0,1047.575,a8w8_blockscale_1x128x128_256x128x128x128_16x16_32x32_2x2_8x32x1_8x32x1_1x32x1x8_8_1x1_intrawave_v3,754.32,448.24,0.0
gfx942,304,60416,1280,5120,ck,0,0,1022.375,a8w8_blockscale_1x128x128_256x128x128x128_16x16_32x32_2x2_8x32x1_8x32x1_1x32x1x8_8_1x1_intrawave_v3,774.55,460.25,0.0
gfx942,304,60544,1280,5120,ck,0,0,1031.4681,a8w8_blockscale_1x128x128_256x128x128x128_16x16_32x32_2x2_8x32x1_8x32x1_1x32x1x8_8_1x1_intrawave_v3,769.35,457.15,0.0
gfx942,304,60672,1280,5120,ck,0,0,1023.7463,a8w8_blockscale_1x128x128_256x128x128x128_16x16_32x32_2x2_8x32x1_8x32x1_1x32x1x8_8_1x1_intrawave_v3,776.79,461.55,0.0
gfx942,304,60800,1280,5120,ck,0,0,1030.4788,a8w8_blockscale_1x128x128_256x128x128x128_16x16_32x32_2x2_8x32x1_8x32x1_1x32x1x8_8_1x1_intrawave_v3,773.35,459.49,0.0
gfx942,304,60928,1280,5120,ck,0,0,1040.6919,a8w8_blockscale_1x128x128_256x128x128x128_16x16_32x32_2x2_8x32x1_8x32x1_1x32x1x8_8_1x1_intrawave_v3,767.37,455.93,0.0
gfx942,304,61056,1280,5120,ck,0,0,1036.5021,a8w8_blockscale_1x128x128_256x128x128x128_16x16_32x32_2x2_8x32x1_8x32x1_1x32x1x8_8_1x1_intrawave_v3,772.09,458.72,0.0
gfx942,304,61184,1280,5120,ck,0,0,1048.6504,a8w8_blockscale_1x128x128_256x128x128x128_16x16_32x32_2x2_8x32x1_8x32x1_1x32x1x8_8_1x1_intrawave_v3,764.75,454.34,0.0
gfx942,304,61312,1280,5120,ck,0,0,1067.9814,a8w8_blockscale_1x128x128_256x128x128x128_16x16_32x32_2x2_8x32x1_8x32x1_1x32x1x8_8_1x1_intrawave_v3,752.47,447.04,0.0
gfx942,304,61440,1280,5120,ck,0,0,1060.9701,a8w8_blockscale_1x128x128_256x128x128x128_16x16_32x32_2x2_8x32x1_8x32x1_1x32x1x8_8_1x1_intrawave_v3,759.03,450.92,0.0
gfx942,304,61568,1280,5120,ck,0,0,1027.5777,a8w8_blockscale_1x128x128_256x128x128x128_16x16_32x32_2x2_8x32x1_8x32x1_1x32x1x8_8_1x1_intrawave_v3,785.33,466.53,0.0
gfx942,304,61696,1280,5120,ck,0,0,1051.0746,a8w8_blockscale_1x128x128_256x128x128x128_16x16_32x32_2x2_8x32x1_8x32x1_1x32x1x8_8_1x1_intrawave_v3,769.37,457.04,0.0
gfx942,304,61824,1280,5120,ck,0,0,1032.9379,a8w8_blockscale_1x128x128_256x128x128x128_16x16_32x32_2x2_8x32x1_8x32x1_1x32x1x8_8_1x1_intrawave_v3,784.5,466.01,0.0
gfx942,304,61952,1280,5120,ck,0,0,1053.0255,a8w8_blockscale_1x128x128_256x128x128x128_16x16_32x32_2x2_8x32x1_8x32x1_1x32x1x8_8_1x1_intrawave_v3,771.13,458.06,0.0
gfx942,304,62080,1280,5120,ck,0,0,1065.1679,a8w8_blockscale_1x128x128_256x128x128x128_16x16_32x32_2x2_8x32x1_8x32x1_1x32x1x8_8_1x1_intrawave_v3,763.91,453.76,0.0
gfx942,304,62208,1280,5120,ck,0,0,1060.9371,a8w8_blockscale_1x128x128_256x128x128x128_16x16_32x32_2x2_8x32x1_8x32x1_1x32x1x8_8_1x1_intrawave_v3,768.54,456.49,0.0
gfx942,304,62336,1280,5120,ck,0,0,1069.4743,a8w8_blockscale_1x128x128_256x128x128x128_16x16_32x32_2x2_8x32x1_8x32x1_1x32x1x8_8_1x1_intrawave_v3,763.97,453.77,0.0
gfx942,304,62464,1280,5120,ck,0,0,1069.1329,a8w8_blockscale_1x128x128_256x128x128x128_16x16_32x32_2x2_8x32x1_8x32x1_1x32x1x8_8_1x1_intrawave_v3,765.79,454.83,0.0
gfx942,304,62592,1280,5120,ck,0,0,1100.1676,a8w8_blockscale_1x128x128_256x128x128x128_16x16_32x32_2x2_8x32x1_8x32x1_1x32x1x8_8_1x1_intrawave_v3,745.71,442.9,0.0
gfx942,304,62720,1280,5120,ck,0,0,1056.728,a8w8_blockscale_1x128x128_256x128x128x128_16x16_32x32_2x2_8x32x1_8x32x1_1x32x1x8_8_1x1_intrawave_v3,777.95,462.03,0.0
gfx942,304,62848,1280,5120,ck,0,0,1081.2779,a8w8_blockscale_1x128x128_256x128x128x128_16x16_32x32_2x2_8x32x1_8x32x1_1x32x1x8_8_1x1_intrawave_v3,761.84,452.45,0.0
gfx942,304,62976,1280,5120,ck,0,0,1084.5516,a8w8_blockscale_1x128x128_256x128x128x128_16x16_32x32_2x2_8x32x1_8x32x1_1x32x1x8_8_1x1_intrawave_v3,761.09,451.99,0.0
gfx942,304,63104,1280,5120,ck,0,0,1092.0096,a8w8_blockscale_1x128x128_256x128x128x128_16x16_32x32_2x2_8x32x1_8x32x1_1x32x1x8_8_1x1_intrawave_v3,757.43,449.81,0.0
gfx942,304,63232,1280,5120,ck,0,0,1062.4621,a8w8_blockscale_1x128x128_256x128x128x128_16x16_32x32_2x2_8x32x1_8x32x1_1x32x1x8_8_1x1_intrawave_v3,780.07,463.24,0.0
gfx942,304,63360,1280,5120,ck,0,0,1094.5685,a8w8_blockscale_1x128x128_256x128x128x128_16x16_32x32_2x2_8x32x1_8x32x1_1x32x1x8_8_1x1_intrawave_v3,758.72,450.55,0.0
gfx942,304,63488,1280,5120,ck,0,0,1076.4444,a8w8_blockscale_1x128x128_256x128x128x128_16x16_32x32_2x2_8x32x1_8x32x1_1x32x1x8_8_1x1_intrawave_v3,773.05,459.05,0.0
gfx942,304,63616,1280,5120,ck,0,0,1093.4505,a8w8_blockscale_1x128x128_256x128x128x128_16x16_32x32_2x2_8x32x1_8x32x1_1x32x1x8_8_1x1_intrawave_v3,762.57,452.81,0.0
gfx942,304,63744,1280,5120,ck,0,0,1086.7788,a8w8_blockscale_1x128x128_256x128x128x128_16x16_32x32_2x2_8x32x1_8x32x1_1x32x1x8_8_1x1_intrawave_v3,768.79,456.49,0.0
gfx942,304,63872,1280,5120,ck,0,0,1081.7376,a8w8_blockscale_1x128x128_256x128x128x128_16x16_32x32_2x2_8x32x1_8x32x1_1x32x1x8_8_1x1_intrawave_v3,773.92,459.53,0.0
gfx942,304,64000,1280,5120,ck,0,0,1079.6158,a8w8_blockscale_1x128x128_256x128x128x128_16x16_32x32_2x2_8x32x1_8x32x1_1x32x1x8_8_1x1_intrawave_v3,777.0,461.34,0.0
gfx942,304,64128,1280,5120,ck,0,0,1078.7998,a8w8_blockscale_1x128x128_256x128x128x128_16x16_32x32_2x2_8x32x1_8x32x1_1x32x1x8_8_1x1_intrawave_v3,779.14,462.6,0.0
gfx942,304,64256,1280,5120,ck,0,0,1109.4706,a8w8_blockscale_1x128x128_256x128x128x128_16x16_32x32_2x2_8x32x1_8x32x1_1x32x1x8_8_1x1_intrawave_v3,759.12,450.7,0.0
gfx942,304,64384,1280,5120,ck,0,0,1097.7455,a8w8_blockscale_1x128x128_256x128x128x128_16x16_32x32_2x2_8x32x1_8x32x1_1x32x1x8_8_1x1_intrawave_v3,768.75,456.41,0.0
gfx942,304,64512,1280,5120,ck,0,0,1115.2505,a8w8_blockscale_1x128x128_256x128x128x128_16x16_32x32_2x2_8x32x1_8x32x1_1x32x1x8_8_1x1_intrawave_v3,758.19,450.13,0.0
gfx942,304,64640,1280,5120,ck,0,0,1106.1651,a8w8_blockscale_1x128x128_256x128x128x128_16x16_32x32_2x2_8x32x1_8x32x1_1x32x1x8_8_1x1_intrawave_v3,765.93,454.71,0.0
gfx942,304,64768,1280,5120,ck,0,0,1098.327,a8w8_blockscale_1x128x128_256x128x128x128_16x16_32x32_2x2_8x32x1_8x32x1_1x32x1x8_8_1x1_intrawave_v3,772.93,458.85,0.0
gfx942,304,64896,1280,5120,ck,0,0,1093.6562,a8w8_blockscale_1x128x128_256x128x128x128_16x16_32x32_2x2_8x32x1_8x32x1_1x32x1x8_8_1x1_intrawave_v3,777.76,461.71,0.0
gfx942,304,65024,1280,5120,ck,0,0,1125.7591,a8w8_blockscale_1x128x128_256x128x128x128_16x16_32x32_2x2_8x32x1_8x32x1_1x32x1x8_8_1x1_intrawave_v3,757.07,449.42,0.0
gfx942,304,65152,1280,5120,ck,0,0,1102.3433,a8w8_blockscale_1x128x128_256x128x128x128_16x16_32x32_2x2_8x32x1_8x32x1_1x32x1x8_8_1x1_intrawave_v3,774.68,459.86,0.0
gfx942,304,65280,1280,5120,ck,0,0,1126.1384,a8w8_blockscale_1x128x128_256x128x128x128_16x16_32x32_2x2_8x32x1_8x32x1_1x32x1x8_8_1x1_intrawave_v3,759.8,451.01,0.0
gfx942,304,65408,1280,5120,ck,0,0,1109.7444,a8w8_blockscale_1x128x128_256x128x128x128_16x16_32x32_2x2_8x32x1_8x32x1_1x32x1x8_8_1x1_intrawave_v3,772.53,458.56,0.0
gfx942,304,65536,1280,5120,ck,0,0,1106.9687,a8w8_blockscale_1x128x128_256x128x128x128_16x16_32x32_2x2_8x32x1_8x32x1_1x32x1x8_8_1x1_intrawave_v3,775.99,460.6,0.0
gfx942,304,65664,1280,5120,ck,0,0,1127.8748,a8w8_blockscale_1x128x128_256x128x128x128_16x16_32x32_2x2_8x32x1_8x32x1_1x32x1x8_8_1x1_intrawave_v3,763.09,452.93,0.0
gfx942,304,65792,1280,5120,ck,0,0,1115.2646,a8w8_blockscale_1x128x128_256x128x128x128_16x16_32x32_2x2_8x32x1_8x32x1_1x32x1x8_8_1x1_intrawave_v3,773.22,458.94,0.0
gfx942,304,65920,1280,5120,ck,0,0,1141.9705,a8w8_blockscale_1x128x128_256x128x128x128_16x16_32x32_2x2_8x32x1_8x32x1_1x32x1x8_8_1x1_intrawave_v3,756.61,449.07,0.0
gfx942,304,66048,1280,5120,ck,0,0,1145.5417,a8w8_blockscale_1x128x128_256x128x128x128_16x16_32x32_2x2_8x32x1_8x32x1_1x32x1x8_8_1x1_intrawave_v3,755.72,448.52,0.0
gfx942,304,66176,1280,5120,ck,0,0,1141.618,a8w8_blockscale_1x128x128_256x128x128x128_16x16_32x32_2x2_8x32x1_8x32x1_1x32x1x8_8_1x1_intrawave_v3,759.78,450.93,0.0
gfx942,304,66304,1280,5120,ck,0,0,1134.3031,a8w8_blockscale_1x128x128_256x128x128x128_16x16_32x32_2x2_8x32x1_8x32x1_1x32x1x8_8_1x1_intrawave_v3,766.16,454.7,0.0
gfx942,304,66432,1280,5120,ck,0,0,1170.8977,a8w8_blockscale_1x128x128_256x128x128x128_16x16_32x32_2x2_8x32x1_8x32x1_1x32x1x8_8_1x1_intrawave_v3,743.65,441.33,0.0
gfx942,304,66560,1280,5120,ck,0,0,1140.3236,a8w8_blockscale_1x128x128_256x128x128x128_16x16_32x32_2x2_8x32x1_8x32x1_1x32x1x8_8_1x1_intrawave_v3,765.06,454.02,0.0
gfx942,304,66688,1280,5120,ck,0,0,1145.1293,a8w8_blockscale_1x128x128_256x128x128x128_16x16_32x32_2x2_8x32x1_8x32x1_1x32x1x8_8_1x1_intrawave_v3,763.31,452.98,0.0
gfx942,304,66816,1280,5120,ck,0,0,1152.812,a8w8_blockscale_1x128x128_256x128x128x128_16x16_32x32_2x2_8x32x1_8x32x1_1x32x1x8_8_1x1_intrawave_v3,759.68,450.81,0.0
gfx942,304,66944,1280,5120,ck,0,0,1149.2042,a8w8_blockscale_1x128x128_256x128x128x128_16x16_32x32_2x2_8x32x1_8x32x1_1x32x1x8_8_1x1_intrawave_v3,763.53,453.08,0.0
gfx942,304,67072,1280,5120,ck,0,0,1137.2752,a8w8_blockscale_1x128x128_256x128x128x128_16x16_32x32_2x2_8x32x1_8x32x1_1x32x1x8_8_1x1_intrawave_v3,773.01,458.7,0.0
gfx942,304,67200,1280,5120,ck,0,0,1156.1043,a8w8_blockscale_1x128x128_256x128x128x128_16x16_32x32_2x2_8x32x1_8x32x1_1x32x1x8_8_1x1_intrawave_v3,761.87,452.08,0.0
gfx942,304,67328,1280,5120,ck,0,0,1137.9702,a8w8_blockscale_1x128x128_256x128x128x128_16x16_32x32_2x2_8x32x1_8x32x1_1x32x1x8_8_1x1_intrawave_v3,775.49,460.15,0.0
gfx942,304,67456,1280,5120,ck,0,0,1162.4197,a8w8_blockscale_1x128x128_256x128x128x128_16x16_32x32_2x2_8x32x1_8x32x1_1x32x1x8_8_1x1_intrawave_v3,760.62,451.31,0.0
gfx942,304,67584,1280,5120,ck,0,0,1154.2705,a8w8_blockscale_1x128x128_256x128x128x128_16x16_32x32_2x2_8x32x1_8x32x1_1x32x1x8_8_1x1_intrawave_v3,767.44,455.35,0.0
gfx942,304,67712,1280,5120,ck,0,0,1166.6169,a8w8_blockscale_1x128x128_256x128x128x128_16x16_32x32_2x2_8x32x1_8x32x1_1x32x1x8_8_1x1_intrawave_v3,760.76,451.38,0.0
gfx942,304,67840,1280,5120,ck,0,0,1145.3154,a8w8_blockscale_1x128x128_256x128x128x128_16x16_32x32_2x2_8x32x1_8x32x1_1x32x1x8_8_1x1_intrawave_v3,776.37,460.63,0.0
gfx942,304,67968,1280,5120,ck,0,0,1139.5763,a8w8_blockscale_1x128x128_256x128x128x128_16x16_32x32_2x2_8x32x1_8x32x1_1x32x1x8_8_1x1_intrawave_v3,781.76,463.81,0.0
gfx942,304,68096,1280,5120,ck,0,0,1169.0636,a8w8_blockscale_1x128x128_256x128x128x128_16x16_32x32_2x2_8x32x1_8x32x1_1x32x1x8_8_1x1_intrawave_v3,763.47,452.95,0.0
gfx942,304,68224,1280,5120,ck,0,0,1210.066,a8w8_blockscale_1x128x128_256x128x128x128_16x16_32x32_2x2_8x32x1_8x32x1_1x32x1x8_8_1x1_intrawave_v3,738.99,438.42,0.0
gfx942,304,68352,1280,5120,ck,0,0,1181.5075,a8w8_blockscale_1x128x128_256x128x128x128_16x16_32x32_2x2_8x32x1_8x32x1_1x32x1x8_8_1x1_intrawave_v3,758.27,449.85,0.0
gfx942,304,68480,1280,5120,ck,0,0,1184.4486,a8w8_blockscale_1x128x128_256x128x128x128_16x16_32x32_2x2_8x32x1_8x32x1_1x32x1x8_8_1x1_intrawave_v3,757.8,449.56,0.0
gfx942,304,68608,1280,5120,ck,0,0,1160.7681,a8w8_blockscale_1x128x128_256x128x128x128_16x16_32x32_2x2_8x32x1_8x32x1_1x32x1x8_8_1x1_intrawave_v3,774.71,459.58,0.0
gfx942,304,68736,1280,5120,ck,0,0,1198.6843,a8w8_blockscale_1x128x128_256x128x128x128_16x16_32x32_2x2_8x32x1_8x32x1_1x32x1x8_8_1x1_intrawave_v3,751.6,445.86,0.0
gfx942,304,68864,1280,5120,ck,0,0,1182.0777,a8w8_blockscale_1x128x128_256x128x128x128_16x16_32x32_2x2_8x32x1_8x32x1_1x32x1x8_8_1x1_intrawave_v3,763.58,452.96,0.0
gfx942,304,68992,1280,5120,ck,0,0,1193.6752,a8w8_blockscale_1x128x128_256x128x128x128_16x16_32x32_2x2_8x32x1_8x32x1_1x32x1x8_8_1x1_intrawave_v3,757.57,449.38,0.0
gfx942,304,69120,1280,5120,ck,0,0,1165.5148,a8w8_blockscale_1x128x128_256x128x128x128_16x16_32x32_2x2_8x32x1_8x32x1_1x32x1x8_8_1x1_intrawave_v3,777.31,461.08,0.0
gfx942,304,69248,1280,5120,ck,0,0,1234.8835,a8w8_blockscale_1x128x128_256x128x128x128_16x16_32x32_2x2_8x32x1_8x32x1_1x32x1x8_8_1x1_intrawave_v3,735.01,435.97,0.0
gfx942,304,69376,1280,5120,ck,0,0,1172.4644,a8w8_blockscale_1x128x128_256x128x128x128_16x16_32x32_2x2_8x32x1_8x32x1_1x32x1x8_8_1x1_intrawave_v3,775.57,460.02,0.0
gfx942,304,69504,1280,5120,ck,0,0,1204.8939,a8w8_blockscale_1x128x128_256x128x128x128_16x16_32x32_2x2_8x32x1_8x32x1_1x32x1x8_8_1x1_intrawave_v3,756.09,448.46,0.0
gfx942,304,69632,1280,5120,ck,0,0,1186.6706,a8w8_blockscale_1x128x128_256x128x128x128_16x16_32x32_2x2_8x32x1_8x32x1_1x32x1x8_8_1x1_intrawave_v3,769.11,456.17,0.0
gfx942,304,69760,1280,5120,ck,0,0,1174.0295,a8w8_blockscale_1x128x128_256x128x128x128_16x16_32x32_2x2_8x32x1_8x32x1_1x32x1x8_8_1x1_intrawave_v3,778.82,461.92,0.0
gfx942,304,69888,1280,5120,ck,0,0,1186.1106,a8w8_blockscale_1x128x128_256x128x128x128_16x16_32x32_2x2_8x32x1_8x32x1_1x32x1x8_8_1x1_intrawave_v3,772.3,458.05,0.0
gfx942,304,70016,1280,5120,ck,0,0,1214.9219,a8w8_blockscale_1x128x128_256x128x128x128_16x16_32x32_2x2_8x32x1_8x32x1_1x32x1x8_8_1x1_intrawave_v3,755.37,447.99,0.0
gfx942,304,70144,1280,5120,ck,0,0,1181.9453,a8w8_blockscale_1x128x128_256x128x128x128_16x16_32x32_2x2_8x32x1_8x32x1_1x32x1x8_8_1x1_intrawave_v3,777.86,461.32,0.0
gfx942,304,70272,1280,5120,ck,0,0,1193.6562,a8w8_blockscale_1x128x128_256x128x128x128_16x16_32x32_2x2_8x32x1_8x32x1_1x32x1x8_8_1x1_intrawave_v3,771.64,457.62,0.0
gfx942,304,70400,1280,5120,ck,0,0,1190.5489,a8w8_blockscale_1x128x128_256x128x128x128_16x16_32x32_2x2_8x32x1_8x32x1_1x32x1x8_8_1x1_intrawave_v3,775.06,459.64,0.0
gfx942,304,70528,1280,5120,ck,0,0,1241.1078,a8w8_blockscale_1x128x128_256x128x128x128_16x16_32x32_2x2_8x32x1_8x32x1_1x32x1x8_8_1x1_intrawave_v3,744.84,441.71,0.0
gfx942,304,70656,1280,5120,ck,0,0,1196.9025,a8w8_blockscale_1x128x128_256x128x128x128_16x16_32x32_2x2_8x32x1_8x32x1_1x32x1x8_8_1x1_intrawave_v3,773.75,458.84,0.0
gfx942,304,70784,1280,5120,ck,0,0,1223.2667,a8w8_blockscale_1x128x128_256x128x128x128_16x16_32x32_2x2_8x32x1_8x32x1_1x32x1x8_8_1x1_intrawave_v3,758.44,449.76,0.0
gfx942,304,70912,1280,5120,ck,0,0,1218.3832,a8w8_blockscale_1x128x128_256x128x128x128_16x16_32x32_2x2_8x32x1_8x32x1_1x32x1x8_8_1x1_intrawave_v3,762.86,452.37,0.0
gfx942,304,71040,1280,5120,ck,0,0,1196.9099,a8w8_blockscale_1x128x128_256x128x128x128_16x16_32x32_2x2_8x32x1_8x32x1_1x32x1x8_8_1x1_intrawave_v3,777.95,461.31,0.0
gfx942,304,71168,1280,5120,ck,0,0,1207.8694,a8w8_blockscale_1x128x128_256x128x128x128_16x16_32x32_2x2_8x32x1_8x32x1_1x32x1x8_8_1x1_intrawave_v3,772.28,457.93,0.0
gfx942,304,71296,1280,5120,ck,0,0,1203.3152,a8w8_blockscale_1x128x128_256x128x128x128_16x16_32x32_2x2_8x32x1_8x32x1_1x32x1x8_8_1x1_intrawave_v3,776.6,460.48,0.0
gfx942,304,71424,1280,5120,ck,0,0,1223.9859,a8w8_blockscale_1x128x128_256x128x128x128_16x16_32x32_2x2_8x32x1_8x32x1_1x32x1x8_8_1x1_intrawave_v3,764.85,453.51,0.0
gfx942,304,71552,1280,5120,ck,0,0,1211.8625,a8w8_blockscale_1x128x128_256x128x128x128_16x16_32x32_2x2_8x32x1_8x32x1_1x32x1x8_8_1x1_intrawave_v3,773.89,458.86,0.0
gfx942,304,71680,1280,5120,ck,0,0,1255.4555,a8w8_blockscale_1x128x128_256x128x128x128_16x16_32x32_2x2_8x32x1_8x32x1_1x32x1x8_8_1x1_intrawave_v3,748.35,443.71,0.0
gfx942,304,71808,1280,5120,ck,0,0,1211.5069,a8w8_blockscale_1x128x128_256x128x128x128_16x16_32x32_2x2_8x32x1_8x32x1_1x32x1x8_8_1x1_intrawave_v3,776.89,460.62,0.0
gfx942,304,71936,1280,5120,ck,0,0,1268.1951,a8w8_blockscale_1x128x128_256x128x128x128_16x16_32x32_2x2_8x32x1_8x32x1_1x32x1x8_8_1x1_intrawave_v3,743.48,440.8,0.0
gfx942,304,72064,1280,5120,ck,0,0,1239.8667,a8w8_blockscale_1x128x128_256x128x128x128_16x16_32x32_2x2_8x32x1_8x32x1_1x32x1x8_8_1x1_intrawave_v3,761.82,451.67,0.0
gfx942,304,72192,1280,5120,ck,0,0,1221.9749,a8w8_blockscale_1x128x128_256x128x128x128_16x16_32x32_2x2_8x32x1_8x32x1_1x32x1x8_8_1x1_intrawave_v3,774.35,459.08,0.0
gfx942,304,72320,1280,5120,ck,0,0,1223.3697,a8w8_blockscale_1x128x128_256x128x128x128_16x16_32x32_2x2_8x32x1_8x32x1_1x32x1x8_8_1x1_intrawave_v3,774.84,459.36,0.0
gfx942,304,72448,1280,5120,ck,0,0,1245.6786,a8w8_blockscale_1x128x128_256x128x128x128_16x16_32x32_2x2_8x32x1_8x32x1_1x32x1x8_8_1x1_intrawave_v3,762.31,451.93,0.0
gfx942,304,72576,1280,5120,ck,0,0,1253.2357,a8w8_blockscale_1x128x128_256x128x128x128_16x16_32x32_2x2_8x32x1_8x32x1_1x32x1x8_8_1x1_intrawave_v3,759.05,449.99,0.0
gfx942,304,72704,1280,5120,ck,0,0,1230.3036,a8w8_blockscale_1x128x128_256x128x128x128_16x16_32x32_2x2_8x32x1_8x32x1_1x32x1x8_8_1x1_intrawave_v3,774.56,459.17,0.0
gfx942,304,72832,1280,5120,ck,0,0,1235.7415,a8w8_blockscale_1x128x128_256x128x128x128_16x16_32x32_2x2_8x32x1_8x32x1_1x32x1x8_8_1x1_intrawave_v3,772.51,457.95,0.0
gfx942,304,72960,1280,5120,ck,0,0,1236.9684,a8w8_blockscale_1x128x128_256x128x128x128_16x16_32x32_2x2_8x32x1_8x32x1_1x32x1x8_8_1x1_intrawave_v3,773.1,458.29,0.0
gfx942,304,73088,1280,5120,ck,0,0,1293.6744,a8w8_blockscale_1x128x128_256x128x128x128_16x16_32x32_2x2_8x32x1_8x32x1_1x32x1x8_8_1x1_intrawave_v3,740.51,438.96,0.0
gfx942,304,73216,1280,5120,ck,0,0,1265.6967,a8w8_blockscale_1x128x128_256x128x128x128_16x16_32x32_2x2_8x32x1_8x32x1_1x32x1x8_8_1x1_intrawave_v3,758.2,449.44,0.0
gfx942,304,73344,1280,5120,ck,0,0,1239.5483,a8w8_blockscale_1x128x128_256x128x128x128_16x16_32x32_2x2_8x32x1_8x32x1_1x32x1x8_8_1x1_intrawave_v3,775.55,459.71,0.0
gfx942,304,73472,1280,5120,ck,0,0,1271.7551,a8w8_blockscale_1x128x128_256x128x128x128_16x16_32x32_2x2_8x32x1_8x32x1_1x32x1x8_8_1x1_intrawave_v3,757.23,448.84,0.0
gfx942,304,73600,1280,5120,ck,0,0,1266.9715,a8w8_blockscale_1x128x128_256x128x128x128_16x16_32x32_2x2_8x32x1_8x32x1_1x32x1x8_8_1x1_intrawave_v3,761.41,451.31,0.0
gfx942,304,73728,1280,5120,ck,0,0,1241.5942,a8w8_blockscale_1x128x128_256x128x128x128_16x16_32x32_2x2_8x32x1_8x32x1_1x32x1x8_8_1x1_intrawave_v3,778.33,461.33,0.0
gfx942,304,73856,1280,5120,ck,0,0,1267.5546,a8w8_blockscale_1x128x128_256x128x128x128_16x16_32x32_2x2_8x32x1_8x32x1_1x32x1x8_8_1x1_intrawave_v3,763.71,452.66,0.0
gfx942,304,73984,1280,5120,ck,0,0,1280.6332,a8w8_blockscale_1x128x128_256x128x128x128_16x16_32x32_2x2_8x32x1_8x32x1_1x32x1x8_8_1x1_intrawave_v3,757.22,448.8,0.0
gfx942,304,74112,1280,5120,ck,0,0,1290.8273,a8w8_blockscale_1x128x128_256x128x128x128_16x16_32x32_2x2_8x32x1_8x32x1_1x32x1x8_8_1x1_intrawave_v3,752.54,446.02,0.0
gfx942,304,74240,1280,5120,ck,0,0,1258.8665,a8w8_blockscale_1x128x128_256x128x128x128_16x16_32x32_2x2_8x32x1_8x32x1_1x32x1x8_8_1x1_intrawave_v3,772.98,458.12,0.0
gfx942,304,74368,1280,5120,ck,0,0,1250.4227,a8w8_blockscale_1x128x128_256x128x128x128_16x16_32x32_2x2_8x32x1_8x32x1_1x32x1x8_8_1x1_intrawave_v3,779.54,462.0,0.0
gfx942,304,74496,1280,5120,ck,0,0,1259.9848,a8w8_blockscale_1x128x128_256x128x128x128_16x16_32x32_2x2_8x32x1_8x32x1_1x32x1x8_8_1x1_intrawave_v3,774.96,459.28,0.0
gfx942,304,74624,1280,5120,ck,0,0,1263.7414,a8w8_blockscale_1x128x128_256x128x128x128_16x16_32x32_2x2_8x32x1_8x32x1_1x32x1x8_8_1x1_intrawave_v3,773.98,458.69,0.0
gfx942,304,74752,1280,5120,ck,0,0,1298.6797,a8w8_blockscale_1x128x128_256x128x128x128_16x16_32x32_2x2_8x32x1_8x32x1_1x32x1x8_8_1x1_intrawave_v3,754.45,447.11,0.0
gfx942,304,74880,1280,5120,ck,0,0,1278.0096,a8w8_blockscale_1x128x128_256x128x128x128_16x16_32x32_2x2_8x32x1_8x32x1_1x32x1x8_8_1x1_intrawave_v3,767.97,455.11,0.0
gfx942,304,75008,1280,5120,ck,0,0,1283.5079,a8w8_blockscale_1x128x128_256x128x128x128_16x16_32x32_2x2_8x32x1_8x32x1_1x32x1x8_8_1x1_intrawave_v3,765.98,453.92,0.0
gfx942,304,75136,1280,5120,ck,0,0,1277.4835,a8w8_blockscale_1x128x128_256x128x128x128_16x16_32x32_2x2_8x32x1_8x32x1_1x32x1x8_8_1x1_intrawave_v3,770.91,456.83,0.0
gfx942,304,75264,1280,5120,ck,0,0,1274.351,a8w8_blockscale_1x128x128_256x128x128x128_16x16_32x32_2x2_8x32x1_8x32x1_1x32x1x8_8_1x1_intrawave_v3,774.12,458.73,0.0
gfx942,304,75392,1280,5120,ck,0,0,1263.549,a8w8_blockscale_1x128x128_256x128x128x128_16x16_32x32_2x2_8x32x1_8x32x1_1x32x1x8_8_1x1_intrawave_v3,782.07,463.43,0.0
gfx942,304,75520,1280,5120,ck,0,0,1289.2094,a8w8_blockscale_1x128x128_256x128x128x128_16x16_32x32_2x2_8x32x1_8x32x1_1x32x1x8_8_1x1_intrawave_v3,767.8,454.97,0.0
gfx942,304,75648,1280,5120,ck,0,0,1276.7996,a8w8_blockscale_1x128x128_256x128x128x128_16x16_32x32_2x2_8x32x1_8x32x1_1x32x1x8_8_1x1_intrawave_v3,776.58,460.16,0.0
gfx942,304,75776,1280,5120,ck,0,0,1274.6678,a8w8_blockscale_1x128x128_256x128x128x128_16x16_32x32_2x2_8x32x1_8x32x1_1x32x1x8_8_1x1_intrawave_v3,779.19,461.7,0.0
gfx942,304,75904,1280,5120,ck,0,0,1310.5074,a8w8_blockscale_1x128x128_256x128x128x128_16x16_32x32_2x2_8x32x1_8x32x1_1x32x1x8_8_1x1_intrawave_v3,759.16,449.82,0.0
gfx942,304,76032,1280,5120,ck,0,0,1309.2042,a8w8_blockscale_1x128x128_256x128x128x128_16x16_32x32_2x2_8x32x1_8x32x1_1x32x1x8_8_1x1_intrawave_v3,761.2,451.02,0.0
gfx942,304,76160,1280,5120,ck,0,0,1282.0434,a8w8_blockscale_1x128x128_256x128x128x128_16x16_32x32_2x2_8x32x1_8x32x1_1x32x1x8_8_1x1_intrawave_v3,778.64,461.34,0.0
gfx942,304,76288,1280,5120,ck,0,0,1284.0289,a8w8_blockscale_1x128x128_256x128x128x128_16x16_32x32_2x2_8x32x1_8x32x1_1x32x1x8_8_1x1_intrawave_v3,778.74,461.4,0.0
gfx942,304,76416,1280,5120,ck,0,0,1311.5174,a8w8_blockscale_1x128x128_256x128x128x128_16x16_32x32_2x2_8x32x1_8x32x1_1x32x1x8_8_1x1_intrawave_v3,763.7,452.47,0.0
gfx942,304,76544,1280,5120,ck,0,0,1310.1255,a8w8_blockscale_1x128x128_256x128x128x128_16x16_32x32_2x2_8x32x1_8x32x1_1x32x1x8_8_1x1_intrawave_v3,765.79,453.71,0.0
gfx942,304,76672,1280,5120,ck,0,0,1295.748,a8w8_blockscale_1x128x128_256x128x128x128_16x16_32x32_2x2_8x32x1_8x32x1_1x32x1x8_8_1x1_intrawave_v3,775.58,459.5,0.0
gfx942,304,76800,1280,5120,ck,0,0,1311.4913,a8w8_blockscale_1x128x128_256x128x128x128_16x16_32x32_2x2_8x32x1_8x32x1_1x32x1x8_8_1x1_intrawave_v3,767.55,454.73,0.0
gfx942,304,76928,1280,5120,ck,0,0,1304.4715,a8w8_blockscale_1x128x128_256x128x128x128_16x16_32x32_2x2_8x32x1_8x32x1_1x32x1x8_8_1x1_intrawave_v3,772.96,457.93,0.0
gfx942,304,77056,1280,5120,ck,0,0,1353.6499,a8w8_blockscale_1x128x128_256x128x128x128_16x16_32x32_2x2_8x32x1_8x32x1_1x32x1x8_8_1x1_intrawave_v3,746.12,442.02,0.0
gfx942,304,77184,1280,5120,ck,0,0,1328.2478,a8w8_blockscale_1x128x128_256x128x128x128_16x16_32x32_2x2_8x32x1_8x32x1_1x32x1x8_8_1x1_intrawave_v3,761.65,451.22,0.0
gfx942,304,77312,1280,5120,ck,0,0,1325.7479,a8w8_blockscale_1x128x128_256x128x128x128_16x16_32x32_2x2_8x32x1_8x32x1_1x32x1x8_8_1x1_intrawave_v3,764.36,452.81,0.0
gfx942,304,77440,1280,5120,ck,0,0,1322.0478,a8w8_blockscale_1x128x128_256x128x128x128_16x16_32x32_2x2_8x32x1_8x32x1_1x32x1x8_8_1x1_intrawave_v3,767.76,454.82,0.0
gfx942,304,77568,1280,5120,ck,0,0,1322.981,a8w8_blockscale_1x128x128_256x128x128x128_16x16_32x32_2x2_8x32x1_8x32x1_1x32x1x8_8_1x1_intrawave_v3,768.49,455.24,0.0
gfx942,304,77696,1280,5120,ck,0,0,1323.8135,a8w8_blockscale_1x128x128_256x128x128x128_16x16_32x32_2x2_8x32x1_8x32x1_1x32x1x8_8_1x1_intrawave_v3,769.28,455.7,0.0
gfx942,304,77824,1280,5120,ck,0,0,1340.6637,a8w8_blockscale_1x128x128_256x128x128x128_16x16_32x32_2x2_8x32x1_8x32x1_1x32x1x8_8_1x1_intrawave_v3,760.86,450.7,0.0
gfx942,304,77952,1280,5120,ck,0,0,1305.038,a8w8_blockscale_1x128x128_256x128x128x128_16x16_32x32_2x2_8x32x1_8x32x1_1x32x1x8_8_1x1_intrawave_v3,782.91,463.76,0.0
gfx942,304,78080,1280,5120,ck,0,0,1350.2511,a8w8_blockscale_1x128x128_256x128x128x128_16x16_32x32_2x2_8x32x1_8x32x1_1x32x1x8_8_1x1_intrawave_v3,757.94,448.96,0.0
gfx942,304,78208,1280,5120,ck,0,0,1354.098,a8w8_blockscale_1x128x128_256x128x128x128_16x16_32x32_2x2_8x32x1_8x32x1_1x32x1x8_8_1x1_intrawave_v3,757.03,448.41,0.0
gfx942,304,78336,1280,5120,ck,0,0,1357.2558,a8w8_blockscale_1x128x128_256x128x128x128_16x16_32x32_2x2_8x32x1_8x32x1_1x32x1x8_8_1x1_intrawave_v3,756.5,448.09,0.0
gfx942,304,78464,1280,5120,ck,0,0,1331.5834,a8w8_blockscale_1x128x128_256x128x128x128_16x16_32x32_2x2_8x32x1_8x32x1_1x32x1x8_8_1x1_intrawave_v3,772.35,457.47,0.0
gfx942,304,78592,1280,5120,ck,0,0,1325.5656,a8w8_blockscale_1x128x128_256x128x128x128_16x16_32x32_2x2_8x32x1_8x32x1_1x32x1x8_8_1x1_intrawave_v3,777.12,460.29,0.0
gfx942,304,78720,1280,5120,ck,0,0,1357.3876,a8w8_blockscale_1x128x128_256x128x128x128_16x16_32x32_2x2_8x32x1_8x32x1_1x32x1x8_8_1x1_intrawave_v3,760.14,450.22,0.0
gfx942,304,78848,1280,5120,ck,0,0,1393.5661,a8w8_blockscale_1x128x128_256x128x128x128_16x16_32x32_2x2_8x32x1_8x32x1_1x32x1x8_8_1x1_intrawave_v3,741.61,439.24,0.0
gfx942,304,78976,1280,5120,ck,0,0,1358.3824,a8w8_blockscale_1x128x128_256x128x128x128_16x16_32x32_2x2_8x32x1_8x32x1_1x32x1x8_8_1x1_intrawave_v3,762.05,451.34,0.0
gfx942,304,79104,1280,5120,ck,0,0,1333.1376,a8w8_blockscale_1x128x128_256x128x128x128_16x16_32x32_2x2_8x32x1_8x32x1_1x32x1x8_8_1x1_intrawave_v3,777.74,460.62,0.0
gfx942,304,79232,1280,5120,ck,0,0,1374.2013,a8w8_blockscale_1x128x128_256x128x128x128_16x16_32x32_2x2_8x32x1_8x32x1_1x32x1x8_8_1x1_intrawave_v3,755.72,447.57,0.0
gfx942,304,79360,1280,5120,ck,0,0,1373.5982,a8w8_blockscale_1x128x128_256x128x128x128_16x16_32x32_2x2_8x32x1_8x32x1_1x32x1x8_8_1x1_intrawave_v3,757.27,448.49,0.0
gfx942,304,79488,1280,5120,ck,0,0,1408.5983,a8w8_blockscale_1x128x128_256x128x128x128_16x16_32x32_2x2_8x32x1_8x32x1_1x32x1x8_8_1x1_intrawave_v3,739.65,438.04,0.0
gfx942,304,79616,1280,5120,ck,0,0,1344.2151,a8w8_blockscale_1x128x128_256x128x128x128_16x16_32x32_2x2_8x32x1_8x32x1_1x32x1x8_8_1x1_intrawave_v3,776.32,459.75,0.0
gfx942,304,79744,1280,5120,ck,0,0,1354.6196,a8w8_blockscale_1x128x128_256x128x128x128_16x16_32x32_2x2_8x32x1_8x32x1_1x32x1x8_8_1x1_intrawave_v3,771.6,456.95,0.0
gfx942,304,79872,1280,5120,ck,0,0,1364.9115,a8w8_blockscale_1x128x128_256x128x128x128_16x16_32x32_2x2_8x32x1_8x32x1_1x32x1x8_8_1x1_intrawave_v3,767.01,454.22,0.0
gfx942,304,80000,1280,5120,ck,0,0,1377.9518,a8w8_blockscale_1x128x128_256x128x128x128_16x16_32x32_2x2_8x32x1_8x32x1_1x32x1x8_8_1x1_intrawave_v3,760.97,450.64,0.0
gfx942,304,16,5120,1024,ck,8,0,5.9105,a8w8_blockscale_1x128x128_256x16x64x256_16x16_16x16_1x1_16x16x1_16x16x1_1x16x1x16_4_1x1_intrawave_v1,28.39,917.54,0.0
gfx942,304,16,5120,3200,ck,8,0,13.6898,a8w8_blockscale_1x128x128_256x16x64x256_16x16_16x16_1x1_16x16x1_16x16x1_1x16x1x16_4_1x1_intrawave_v1,38.3,1212.51,0.0
gfx942,304,32,5120,1024,ck,8,0,6.4893,a8w8_blockscale_1x128x128_256x16x64x256_16x16_16x16_1x1_16x16x1_16x16x1_1x16x1x16_4_1x1_intrawave_v1,51.71,863.47,0.0
gfx942,304,32,5120,3200,ck,8,0,13.9226,a8w8_blockscale_1x128x128_256x16x64x256_16x16_16x16_1x1_16x16x1_16x16x1_1x16x1x16_4_1x1_intrawave_v1,75.31,1207.68,0.0
gfx942,304,48,5120,1024,ck,8,0,6.5986,a8w8_blockscale_1x128x128_256x16x64x256_16x16_16x16_1x1_16x16x1_16x16x1_1x16x1x16_4_1x1_intrawave_v1,76.28,876.48,0.0
gfx942,304,48,5120,3200,ck,8,0,14.1053,a8w8_blockscale_1x128x128_256x16x64x256_16x16_16x16_1x1_16x16x1_16x16x1_1x16x1x16_4_1x1_intrawave_v1,111.51,1207.29,0.0
gfx942,304,64,5120,1024,ck,13,0,6.9448,a8w8_blockscale_1x128x128_256x32x64x256_16x16_16x16_2x1_16x16x1_16x16x1_1x32x1x8_8_2x1_intrawave_v1,96.63,858.74,0.0
gfx942,304,64,5120,3200,ck,6,0,16.3767,a8w8_blockscale_1x128x128_256x16x64x128_8x16_16x16_1x1_16x16x1_8x32x1_1x16x1x16_4_1x1_intrawave_v1,128.06,1052.97,0.0
gfx942,304,80,5120,1024,ck,13,0,7.5099,a8w8_blockscale_1x128x128_256x32x64x256_16x16_16x16_2x1_16x16x1_16x16x1_1x32x1x8_8_2x1_intrawave_v1,111.7,818.12,0.0
gfx942,304,80,5120,3200,ck,13,0,17.313,a8w8_blockscale_1x128x128_256x32x64x256_16x16_16x16_2x1_16x16x1_16x16x1_1x32x1x8_8_2x1_intrawave_v1,151.41,1008.44,0.0
gfx942,304,96,5120,1024,ck,13,0,7.4889,a8w8_blockscale_1x128x128_256x32x64x256_16x16_16x16_2x1_16x16x1_16x16x1_1x32x1x8_8_2x1_intrawave_v1,134.42,844.48,0.0
gfx942,304,96,5120,3200,ck,13,0,17.0554,a8w8_blockscale_1x128x128_256x32x64x256_16x16_16x16_2x1_16x16x1_16x16x1_1x32x1x8_8_2x1_intrawave_v1,184.44,1036.28,0.0
gfx942,304,112,5120,1024,ck,7,0,7.8045,a8w8_blockscale_1x128x128_256x16x128x256_16x16_16x16_1x2_16x16x1_16x16x1_1x16x1x16_8_1x2_intrawave_v1,150.48,833.42,0.0
gfx942,304,112,5120,3200,ck,3,0,17.993,a8w8_blockscale_1x128x128_256x64x64x128_16x16_32x32_1x1_8x32x1_8x32x1_1x32x1x8_8_1x1_intrawave_v3,203.97,994.24,0.0
gfx942,304,128,5120,1024,ck,18,0,7.5145,a8w8_blockscale_1x128x128_256x64x64x256_16x16_32x32_1x1_16x16x1_16x16x1_1x32x1x8_8_1x1_intrawave_v1,178.61,889.57,0.0
gfx942,304,128,5120,3200,ck,3,0,17.491,a8w8_blockscale_1x128x128_256x64x64x128_16x16_32x32_1x1_8x32x1_8x32x1_1x32x1x8_8_1x1_intrawave_v3,239.8,1035.06,0.0
gfx942,304,144,5120,1024,ck,12,0,8.5704,a8w8_blockscale_1x128x128_256x32x128x256_16x16_32x32_1x1_16x16x1_16x16x1_1x32x1x8_8_1x1_intrawave_v1,176.18,801.0,0.0
gfx942,304,144,5120,3200,ck,3,0,19.3467,a8w8_blockscale_1x128x128_256x64x64x128_16x16_32x32_1x1_8x32x1_8x32x1_1x32x1x8_8_1x1_intrawave_v3,243.9,946.9,0.0
gfx942,304,160,5120,1024,ck,18,0,8.4709,a8w8_blockscale_1x128x128_256x64x64x256_16x16_32x32_1x1_16x16x1_16x16x1_1x32x1x8_8_1x1_intrawave_v1,198.06,831.68,0.0
gfx942,304,160,5120,3200,ck,3,0,19.2832,a8w8_blockscale_1x128x128_256x64x64x128_16x16_32x32_1x1_8x32x1_8x32x1_1x32x1x8_8_1x1_intrawave_v3,271.89,961.17,0.0
gfx942,304,176,5120,1024,ck,18,0,8.6543,a8w8_blockscale_1x128x128_256x64x64x256_16x16_32x32_1x1_16x16x1_16x16x1_1x32x1x8_8_1x1_intrawave_v1,213.25,834.88,0.0
gfx942,304,176,5120,3200,ck,2,0,20.3972,a8w8_blockscale_1x128x128_256x64x128x128_16x16_32x32_1x2_8x32x1_8x32x1_1x32x1x8_8_1x1_intrawave_v3,282.74,919.22,0.0
gfx942,304,192,5120,1024,ck,18,0,7.6697,a8w8_blockscale_1x128x128_256x64x64x256_16x16_32x32_1x1_16x16x1_16x16x1_1x32x1x8_8_1x1_intrawave_v1,262.5,965.56,0.0
gfx942,304,192,5120,3200,ck,3,0,19.5271,a8w8_blockscale_1x128x128_256x64x64x128_16x16_32x32_1x1_8x32x1_8x32x1_1x32x1x8_8_1x1_intrawave_v3,322.19,971.19,0.0
gfx942,304,208,5120,1024,ck,10,0,11.2648,a8w8_blockscale_1x128x128_256x32x128x128_16x16_32x32_1x1_8x32x1_8x32x1_1x32x1x8_8_1x1_intrawave_v1,193.62,673.41,0.0
gfx942,304,208,5120,3200,ck,2,0,22.605,a8w8_blockscale_1x128x128_256x64x128x128_16x16_32x32_1x2_8x32x1_8x32x1_1x32x1x8_8_1x1_intrawave_v3,301.51,848.46,0.0
gfx942,304,224,5120,1024,ck,3,0,11.5299,a8w8_blockscale_1x128x128_256x64x64x128_16x16_32x32_1x1_8x32x1_8x32x1_1x32x1x8_8_1x1_intrawave_v3,203.71,673.55,0.0
gfx942,304,224,5120,3200,ck,2,0,22.2548,a8w8_blockscale_1x128x128_256x64x128x128_16x16_32x32_1x2_8x32x1_8x32x1_1x32x1x8_8_1x1_intrawave_v3,329.82,871.48,0.0
gfx942,304,240,5120,1024,ck,3,0,12.0184,a8w8_blockscale_1x128x128_256x64x64x128_16x16_32x32_1x1_8x32x1_8x32x1_1x32x1x8_8_1x1_intrawave_v3,209.39,661.17,0.0
gfx942,304,240,5120,3200,ck,2,0,22.8512,a8w8_blockscale_1x128x128_256x64x128x128_16x16_32x32_1x2_8x32x1_8x32x1_1x32x1x8_8_1x1_intrawave_v3,344.15,858.14,0.0
gfx942,304,256,5120,1024,ck,3,0,11.943,a8w8_blockscale_1x128x128_256x64x64x128_16x16_32x32_1x1_8x32x1_8x32x1_1x32x1x8_8_1x1_intrawave_v3,224.76,680.44,0.0
gfx942,304,256,5120,3200,ck,2,0,22.5299,a8w8_blockscale_1x128x128_256x64x128x128_16x16_32x32_1x2_8x32x1_8x32x1_1x32x1x8_8_1x1_intrawave_v3,372.33,879.93,0.0
gfx942,304,288,5120,1024,ck,2,0,13.1623,a8w8_blockscale_1x128x128_256x64x128x128_16x16_32x32_1x2_8x32x1_8x32x1_1x32x1x8_8_1x1_intrawave_v3,229.44,644.79,0.0
gfx942,304,288,5120,3200,ck,2,0,26.2784,a8w8_blockscale_1x128x128_256x64x128x128_16x16_32x32_1x2_8x32x1_8x32x1_1x32x1x8_8_1x1_intrawave_v3,359.12,770.77,0.0
gfx942,304,320,5120,1024,ck,2,0,13.6311,a8w8_blockscale_1x128x128_256x64x128x128_16x16_32x32_1x2_8x32x1_8x32x1_1x32x1x8_8_1x1_intrawave_v3,246.16,649.06,0.0
gfx942,304,320,5120,3200,ck,2,0,26.2277,a8w8_blockscale_1x128x128_256x64x128x128_16x16_32x32_1x2_8x32x1_8x32x1_1x32x1x8_8_1x1_intrawave_v3,399.8,788.66,0.0
gfx942,304,352,5120,1024,ck,18,0,14.08,a8w8_blockscale_1x128x128_256x64x64x256_16x16_32x32_1x1_16x16x1_16x16x1_1x32x1x8_8_1x1_intrawave_v1,262.14,653.96,0.0
gfx942,304,352,5120,3200,ck,2,0,27.8409,a8w8_blockscale_1x128x128_256x64x128x128_16x16_32x32_1x2_8x32x1_8x32x1_1x32x1x8_8_1x1_intrawave_v3,414.29,758.41,0.0
gfx942,304,384,5120,1024,ck,18,0,13.6778,a8w8_blockscale_1x128x128_256x64x64x256_16x16_32x32_1x1_16x16x1_16x16x1_1x32x1x8_8_1x1_intrawave_v1,294.38,699.55,0.0
gfx942,304,384,5120,3200,ck,2,0,27.5993,a8w8_blockscale_1x128x128_256x64x128x128_16x16_32x32_1x2_8x32x1_8x32x1_1x32x1x8_8_1x1_intrawave_v3,455.91,780.63,0.0
gfx942,304,416,5120,1024,ck,2,0,15.2801,a8w8_blockscale_1x128x128_256x64x128x128_16x16_32x32_1x2_8x32x1_8x32x1_1x32x1x8_8_1x1_intrawave_v3,285.47,649.78,0.0
gfx942,304,416,5120,3200,ck,2,0,29.8503,a8w8_blockscale_1x128x128_256x64x128x128_16x16_32x32_1x2_8x32x1_8x32x1_1x32x1x8_8_1x1_intrawave_v3,456.66,736.17,0.0
gfx942,304,448,5120,1024,ck,18,0,15.5343,a8w8_blockscale_1x128x128_256x64x64x256_16x16_32x32_1x1_16x16x1_16x16x1_1x32x1x8_8_1x1_intrawave_v1,302.4,662.35,0.0
gfx942,304,448,5120,3200,ck,2,0,30.0718,a8w8_blockscale_1x128x128_256x64x128x128_16x16_32x32_1x2_8x32x1_8x32x1_1x32x1x8_8_1x1_intrawave_v3,488.17,745.05,0.0
gfx942,304,480,5120,1024,ck,0,0,18.3964,a8w8_blockscale_1x128x128_256x128x128x128_16x16_32x32_2x2_8x32x1_8x32x1_1x32x1x8_8_1x1_intrawave_v3,273.6,578.9,0.0
gfx942,304,480,5120,3200,ck,0,0,33.1868,a8w8_blockscale_1x128x128_256x128x128x128_16x16_32x32_2x2_8x32x1_8x32x1_1x32x1x8_8_1x1_intrawave_v3,473.94,688.08,0.0
gfx942,304,512,5120,1024,ck,0,0,19.2229,a8w8_blockscale_1x128x128_256x128x128x128_16x16_32x32_2x2_8x32x1_8x32x1_1x32x1x8_8_1x1_intrawave_v3,279.29,572.76,0.0
gfx942,304,512,5120,3200,ck,0,0,33.6867,a8w8_blockscale_1x128x128_256x128x128x128_16x16_32x32_2x2_8x32x1_8x32x1_1x32x1x8_8_1x1_intrawave_v3,498.04,690.64,0.0
gfx942,304,544,5120,1024,ck,0,0,19.4285,a8w8_blockscale_1x128x128_256x128x128x128_16x16_32x32_2x2_8x32x1_8x32x1_1x32x1x8_8_1x1_intrawave_v3,293.6,585.25,0.0
gfx942,304,544,5120,3200,ck,0,0,37.2932,a8w8_blockscale_1x128x128_256x128x128x128_16x16_32x32_2x2_8x32x1_8x32x1_1x32x1x8_8_1x1_intrawave_v3,477.99,635.38,0.0
gfx942,304,576,5120,1024,ck,0,0,19.5636,a8w8_blockscale_1x128x128_256x128x128x128_16x16_32x32_2x2_8x32x1_8x32x1_1x32x1x8_8_1x1_intrawave_v3,308.73,599.63,0.0
gfx942,304,576,5120,3200,ck,0,0,37.9771,a8w8_blockscale_1x128x128_256x128x128x128_16x16_32x32_2x2_8x32x1_8x32x1_1x32x1x8_8_1x1_intrawave_v3,496.99,635.26,0.0
gfx942,304,608,5120,1024,ck,3,0,20.5522,a8w8_blockscale_1x128x128_256x64x64x128_16x16_32x32_1x1_8x32x1_8x32x1_1x32x1x8_8_1x1_intrawave_v3,310.2,588.33,0.0
gfx942,304,608,5120,3200,ck,0,0,38.5323,a8w8_blockscale_1x128x128_256x128x128x128_16x16_32x32_2x2_8x32x1_8x32x1_1x32x1x8_8_1x1_intrawave_v3,517.05,637.27,0.0
gfx942,304,640,5120,1024,ck,18,0,19.9857,a8w8_blockscale_1x128x128_256x64x64x256_16x16_32x32_1x1_16x16x1_16x16x1_1x32x1x8_8_1x1_intrawave_v1,335.78,623.04,0.0
gfx942,304,640,5120,3200,ck,0,0,39.0558,a8w8_blockscale_1x128x128_256x128x128x128_16x16_32x32_2x2_8x32x1_8x32x1_1x32x1x8_8_1x1_intrawave_v3,536.96,639.74,0.0
gfx942,304,672,5120,1024,ck,0,0,21.3432,a8w8_blockscale_1x128x128_256x128x128x128_16x16_32x32_2x2_8x32x1_8x32x1_1x32x1x8_8_1x1_intrawave_v3,330.15,600.3,0.0
gfx942,304,672,5120,3200,ck,0,0,39.9537,a8w8_blockscale_1x128x128_256x128x128x128_16x16_32x32_2x2_8x32x1_8x32x1_1x32x1x8_8_1x1_intrawave_v3,551.14,636.13,0.0
gfx942,304,704,5120,1024,ck,0,0,21.0705,a8w8_blockscale_1x128x128_256x128x128x128_16x16_32x32_2x2_8x32x1_8x32x1_1x32x1x8_8_1x1_intrawave_v3,350.35,625.17,0.0
gfx942,304,704,5120,3200,ck,0,0,42.3824,a8w8_blockscale_1x128x128_256x128x128x128_16x16_32x32_2x2_8x32x1_8x32x1_1x32x1x8_8_1x1_intrawave_v3,544.3,609.82,0.0
gfx942,304,736,5120,1024,ck,0,0,21.639,a8w8_blockscale_1x128x128_256x128x128x128_16x16_32x32_2x2_8x32x1_8x32x1_1x32x1x8_8_1x1_intrawave_v3,356.65,625.41,0.0
gfx942,304,736,5120,3200,ck,0,0,41.8326,a8w8_blockscale_1x128x128_256x128x128x128_16x16_32x32_2x2_8x32x1_8x32x1_1x32x1x8_8_1x1_intrawave_v3,576.52,628.12,0.0
gfx942,304,768,5120,1024,ck,0,0,22.5563,a8w8_blockscale_1x128x128_256x128x128x128_16x16_32x32_2x2_8x32x1_8x32x1_1x32x1x8_8_1x1_intrawave_v3,357.02,615.95,0.0
gfx942,304,768,5120,3200,ck,0,0,40.1229,a8w8_blockscale_1x128x128_256x128x128x128_16x16_32x32_2x2_8x32x1_8x32x1_1x32x1x8_8_1x1_intrawave_v3,627.22,665.6,0.0
gfx942,304,800,5120,1024,ck,0,0,22.8867,a8w8_blockscale_1x128x128_256x128x128x128_16x16_32x32_2x2_8x32x1_8x32x1_1x32x1x8_8_1x1_intrawave_v3,366.53,622.81,0.0
gfx942,304,800,5120,3200,ck,0,0,44.7554,a8w8_blockscale_1x128x128_256x128x128x128_16x16_32x32_2x2_8x32x1_8x32x1_1x32x1x8_8_1x1_intrawave_v3,585.73,606.32,0.0
gfx942,304,832,5120,1024,ck,0,0,23.0836,a8w8_blockscale_1x128x128_256x128x128x128_16x16_32x32_2x2_8x32x1_8x32x1_1x32x1x8_8_1x1_intrawave_v3,377.94,633.11,0.0
gfx942,304,832,5120,3200,ck,0,0,43.7193,a8w8_blockscale_1x128x128_256x128x128x128_16x16_32x32_2x2_8x32x1_8x32x1_1x32x1x8_8_1x1_intrawave_v3,623.59,630.52,0.0
gfx942,304,864,5120,1024,ck,0,0,23.2936,a8w8_blockscale_1x128x128_256x128x128x128_16x16_32x32_2x2_8x32x1_8x32x1_1x32x1x8_8_1x1_intrawave_v3,388.94,642.88,0.0
gfx942,304,864,5120,3200,ck,0,0,46.256,a8w8_blockscale_1x128x128_256x128x128x128_16x16_32x32_2x2_8x32x1_8x32x1_1x32x1x8_8_1x1_intrawave_v3,612.06,605.24,0.0
gfx942,304,896,5120,1024,ck,0,0,23.809,a8w8_blockscale_1x128x128_256x128x128x128_16x16_32x32_2x2_8x32x1_8x32x1_1x32x1x8_8_1x1_intrawave_v3,394.61,644.1,0.0
gfx942,304,896,5120,3200,ck,0,0,43.5656,a8w8_blockscale_1x128x128_256x128x128x128_16x16_32x32_2x2_8x32x1_8x32x1_1x32x1x8_8_1x1_intrawave_v3,673.93,652.49,0.0
gfx942,304,928,5120,1024,ck,2,0,25.6188,a8w8_blockscale_1x128x128_256x64x128x128_16x16_32x32_1x2_8x32x1_8x32x1_1x32x1x8_8_1x1_intrawave_v3,379.83,612.67,0.0
gfx942,304,928,5120,3200,ck,2,0,53.7112,a8w8_blockscale_1x128x128_256x64x128x128_16x16_32x32_1x2_8x32x1_8x32x1_1x32x1x8_8_1x1_intrawave_v3,566.15,537.25,0.0
gfx942,304,960,5120,1024,ck,2,0,25.6941,a8w8_blockscale_1x128x128_256x64x128x128_16x16_32x32_1x2_8x32x1_8x32x1_1x32x1x8_8_1x1_intrawave_v3,391.78,624.9,0.0
gfx942,304,960,5120,3200,ck,2,0,53.1933,a8w8_blockscale_1x128x128_256x64x128x128_16x16_32x32_1x2_8x32x1_8x32x1_1x32x1x8_8_1x1_intrawave_v3,591.38,550.57,0.0
gfx942,304,992,5120,1024,ck,3,0,30.4708,a8w8_blockscale_1x128x128_256x64x64x128_16x16_32x32_1x1_8x32x1_8x32x1_1x32x1x8_8_1x1_intrawave_v3,341.37,538.77,0.0
gfx942,304,992,5120,3200,ck,0,0,65.9077,a8w8_blockscale_1x128x128_256x128x128x128_16x16_32x32_2x2_8x32x1_8x32x1_1x32x1x8_8_1x1_intrawave_v3,493.2,450.88,0.0
gfx942,304,1024,5120,1024,ck,3,0,30.1732,a8w8_blockscale_1x128x128_256x64x64x128_16x16_32x32_1x1_8x32x1_8x32x1_1x32x1x8_8_1x1_intrawave_v3,355.86,556.03,0.0
gfx942,304,1024,5120,3200,ck,3,0,64.6473,a8w8_blockscale_1x128x128_256x64x64x128_16x16_32x32_1x1_8x32x1_8x32x1_1x32x1x8_8_1x1_intrawave_v3,519.04,466.32,0.0
gfx942,304,1088,5120,1024,ck,18,0,30.8457,a8w8_blockscale_1x128x128_256x64x64x256_16x16_32x32_1x1_16x16x1_16x16x1_1x32x1x8_8_1x1_intrawave_v1,369.86,567.28,0.0
gfx942,304,1088,5120,3200,ck,0,0,67.906,a8w8_blockscale_1x128x128_256x128x128x128_16x16_32x32_2x2_8x32x1_8x32x1_1x32x1x8_8_1x1_intrawave_v3,525.01,456.61,0.0
gfx942,304,1152,5120,1024,ck,18,0,31.7206,a8w8_blockscale_1x128x128_256x64x64x256_16x16_32x32_1x1_16x16x1_16x16x1_1x32x1x8_8_1x1_intrawave_v1,380.81,574.36,0.0
gfx942,304,1152,5120,3200,ck,0,0,67.9865,a8w8_blockscale_1x128x128_256x128x128x128_16x16_32x32_2x2_8x32x1_8x32x1_1x32x1x8_8_1x1_intrawave_v3,555.24,468.72,0.0
gfx942,304,1216,5120,1024,ck,0,0,32.0088,a8w8_blockscale_1x128x128_256x128x128x128_16x16_32x32_2x2_8x32x1_8x32x1_1x32x1x8_8_1x1_intrawave_v3,398.35,591.71,0.0
gfx942,304,1216,5120,3200,ck,2,0,69.1254,a8w8_blockscale_1x128x128_256x64x128x128_16x16_32x32_1x2_8x32x1_8x32x1_1x32x1x8_8_1x1_intrawave_v3,576.43,473.44,0.0
gfx942,304,1280,5120,1024,ck,0,0,33.029,a8w8_blockscale_1x128x128_256x128x128x128_16x16_32x32_2x2_8x32x1_8x32x1_1x32x1x8_8_1x1_intrawave_v3,406.36,595.26,0.0
gfx942,304,1280,5120,3200,ck,0,0,68.5218,a8w8_blockscale_1x128x128_256x128x128x128_16x16_32x32_2x2_8x32x1_8x32x1_1x32x1x8_8_1x1_intrawave_v3,612.11,490.17,0.0
gfx942,304,1344,5120,1024,ck,0,0,33.8637,a8w8_blockscale_1x128x128_256x128x128x128_16x16_32x32_2x2_8x32x1_8x32x1_1x32x1x8_8_1x1_intrawave_v3,416.16,601.87,0.0
gfx942,304,1344,5120,3200,ck,0,0,69.3124,a8w8_blockscale_1x128x128_256x128x128x128_16x16_32x32_2x2_8x32x1_8x32x1_1x32x1x8_8_1x1_intrawave_v3,635.39,496.99,0.0
gfx942,304,1408,5120,1024,ck,0,0,34.155,a8w8_blockscale_1x128x128_256x128x128x128_16x16_32x32_2x2_8x32x1_8x32x1_1x32x1x8_8_1x1_intrawave_v3,432.26,617.85,0.0
gfx942,304,1408,5120,3200,ck,0,0,70.6918,a8w8_blockscale_1x128x128_256x128x128x128_16x16_32x32_2x2_8x32x1_8x32x1_1x32x1x8_8_1x1_intrawave_v3,652.65,499.46,0.0
gfx942,304,1472,5120,1024,ck,0,0,34.0453,a8w8_blockscale_1x128x128_256x128x128x128_16x16_32x32_2x2_8x32x1_8x32x1_1x32x1x8_8_1x1_intrawave_v3,453.37,641.01,0.0
gfx942,304,1472,5120,3200,ck,0,0,71.8256,a8w8_blockscale_1x128x128_256x128x128x128_16x16_32x32_2x2_8x32x1_8x32x1_1x32x1x8_8_1x1_intrawave_v3,671.55,503.55,0.0
gfx942,304,1536,5120,1024,ck,0,0,34.8938,a8w8_blockscale_1x128x128_256x128x128x128_16x16_32x32_2x2_8x32x1_8x32x1_1x32x1x8_8_1x1_intrawave_v3,461.58,646.09,0.0
gfx942,304,1536,5120,3200,ck,0,0,70.7249,a8w8_blockscale_1x128x128_256x128x128x128_16x16_32x32_2x2_8x32x1_8x32x1_1x32x1x8_8_1x1_intrawave_v3,711.65,523.55,0.0
gfx942,304,1600,5120,1024,ck,0,0,35.6484,a8w8_blockscale_1x128x128_256x128x128x128_16x16_32x32_2x2_8x32x1_8x32x1_1x32x1x8_8_1x1_intrawave_v3,470.63,652.63,0.0
gfx942,304,1600,5120,3200,ck,0,0,78.3517,a8w8_blockscale_1x128x128_256x128x128x128_16x16_32x32_2x2_8x32x1_8x32x1_1x32x1x8_8_1x1_intrawave_v3,669.15,483.56,0.0
gfx942,304,1664,5120,1024,ck,0,0,36.5775,a8w8_blockscale_1x128x128_256x128x128x128_16x16_32x32_2x2_8x32x1_8x32x1_1x32x1x8_8_1x1_intrawave_v3,477.02,655.76,0.0
gfx942,304,1664,5120,3200,ck,0,0,73.7158,a8w8_blockscale_1x128x128_256x128x128x128_16x16_32x32_2x2_8x32x1_8x32x1_1x32x1x8_8_1x1_intrawave_v3,739.68,525.64,0.0
gfx942,304,1728,5120,1024,ck,0,0,37.023,a8w8_blockscale_1x128x128_256x128x128x128_16x16_32x32_2x2_8x32x1_8x32x1_1x32x1x8_8_1x1_intrawave_v3,489.41,667.34,0.0
gfx942,304,1728,5120,3200,ck,0,0,81.7948,a8w8_blockscale_1x128x128_256x128x128x128_16x16_32x32_2x2_8x32x1_8x32x1_1x32x1x8_8_1x1_intrawave_v3,692.26,484.24,0.0
gfx942,304,1792,5120,1024,ck,0,0,38.5541,a8w8_blockscale_1x128x128_256x128x128x128_16x16_32x32_2x2_8x32x1_8x32x1_1x32x1x8_8_1x1_intrawave_v3,487.38,659.54,0.0
gfx942,304,1792,5120,3200,ck,0,0,77.5676,a8w8_blockscale_1x128x128_256x128x128x128_16x16_32x32_2x2_8x32x1_8x32x1_1x32x1x8_8_1x1_intrawave_v3,757.02,521.72,0.0
gfx942,304,1856,5120,1024,ck,0,0,38.5884,a8w8_blockscale_1x128x128_256x128x128x128_16x16_32x32_2x2_8x32x1_8x32x1_1x32x1x8_8_1x1_intrawave_v3,504.34,677.64,0.0
gfx942,304,1856,5120,3200,ck,0,0,83.9389,a8w8_blockscale_1x128x128_256x128x128x128_16x16_32x32_2x2_8x32x1_8x32x1_1x32x1x8_8_1x1_intrawave_v3,724.54,492.37,0.0
gfx942,304,1920,5120,1024,ck,0,0,40.4569,a8w8_blockscale_1x128x128_256x128x128x128_16x16_32x32_2x2_8x32x1_8x32x1_1x32x1x8_8_1x1_intrawave_v3,497.63,664.16,0.0
gfx942,304,1920,5120,3200,ck,0,0,81.4026,a8w8_blockscale_1x128x128_256x128x128x128_16x16_32x32_2x2_8x32x1_8x32x1_1x32x1x8_8_1x1_intrawave_v3,772.88,518.27,0.0
gfx942,304,1984,5120,1024,ck,0,0,49.0755,a8w8_blockscale_1x128x128_256x128x128x128_16x16_32x32_2x2_8x32x1_8x32x1_1x32x1x8_8_1x1_intrawave_v3,423.91,562.21,0.0
gfx942,304,1984,5120,3200,ck,0,0,106.8746,a8w8_blockscale_1x128x128_256x128x128x128_16x16_32x32_2x2_8x32x1_8x32x1_1x32x1x8_8_1x1_intrawave_v3,608.3,402.8,0.0
gfx942,304,2048,5120,1024,ck,0,0,49.591,a8w8_blockscale_1x128x128_256x128x128x128_16x16_32x32_2x2_8x32x1_8x32x1_1x32x1x8_8_1x1_intrawave_v3,433.04,570.9,0.0
gfx942,304,2048,5120,3200,ck,0,0,106.0477,a8w8_blockscale_1x128x128_256x128x128x128_16x16_32x32_2x2_8x32x1_8x32x1_1x32x1x8_8_1x1_intrawave_v3,632.82,414.05,0.0
gfx942,304,2112,5120,1024,ck,0,0,49.0755,a8w8_blockscale_1x128x128_256x128x128x128_16x16_32x32_2x2_8x32x1_8x32x1_1x32x1x8_8_1x1_intrawave_v3,451.26,591.59,0.0
gfx942,304,2112,5120,3200,ck,0,0,109.6798,a8w8_blockscale_1x128x128_256x128x128x128_16x16_32x32_2x2_8x32x1_8x32x1_1x32x1x8_8_1x1_intrawave_v3,630.98,408.18,0.0
gfx942,304,2176,5120,1024,ck,0,0,50.5667,a8w8_blockscale_1x128x128_256x128x128x128_16x16_32x32_2x2_8x32x1_8x32x1_1x32x1x8_8_1x1_intrawave_v3,451.23,588.4,0.0
gfx942,304,2176,5120,3200,ck,0,0,104.7805,a8w8_blockscale_1x128x128_256x128x128x128_16x16_32x32_2x2_8x32x1_8x32x1_1x32x1x8_8_1x1_intrawave_v3,680.5,435.48,0.0
gfx942,304,2240,5120,1024,ck,0,0,48.3764,a8w8_blockscale_1x128x128_256x128x128x128_16x16_32x32_2x2_8x32x1_8x32x1_1x32x1x8_8_1x1_intrawave_v3,485.53,629.94,0.0
gfx942,304,2240,5120,3200,ck,0,0,107.251,a8w8_blockscale_1x128x128_256x128x128x128_16x16_32x32_2x2_8x32x1_8x32x1_1x32x1x8_8_1x1_intrawave_v3,684.38,433.47,0.0
gfx942,304,2304,5120,1024,ck,0,0,47.9633,a8w8_blockscale_1x128x128_256x128x128x128_16x16_32x32_2x2_8x32x1_8x32x1_1x32x1x8_8_1x1_intrawave_v3,503.7,650.4,0.0
gfx942,304,2304,5120,3200,ck,0,0,111.3747,a8w8_blockscale_1x128x128_256x128x128x128_16x16_32x32_2x2_8x32x1_8x32x1_1x32x1x8_8_1x1_intrawave_v3,677.87,425.14,0.0
gfx942,304,2368,5120,1024,ck,0,0,50.2898,a8w8_blockscale_1x128x128_256x128x128x128_16x16_32x32_2x2_8x32x1_8x32x1_1x32x1x8_8_1x1_intrawave_v3,493.74,634.64,0.0
gfx942,304,2368,5120,3200,ck,0,0,108.2405,a8w8_blockscale_1x128x128_256x128x128x128_16x16_32x32_2x2_8x32x1_8x32x1_1x32x1x8_8_1x1_intrawave_v3,716.87,445.4,0.0
gfx942,304,2432,5120,1024,ck,0,0,48.7389,a8w8_blockscale_1x128x128_256x128x128x128_16x16_32x32_2x2_8x32x1_8x32x1_1x32x1x8_8_1x1_intrawave_v3,523.22,669.63,0.0
gfx942,304,2432,5120,3200,ck,0,0,107.4885,a8w8_blockscale_1x128x128_256x128x128x128_16x16_32x32_2x2_8x32x1_8x32x1_1x32x1x8_8_1x1_intrawave_v3,741.4,456.51,0.0
gfx942,304,2496,5120,1024,ck,0,0,50.6238,a8w8_blockscale_1x128x128_256x128x128x128_16x16_32x32_2x2_8x32x1_8x32x1_1x32x1x8_8_1x1_intrawave_v3,517.0,658.94,0.0
gfx942,304,2496,5120,3200,ck,0,0,107.6823,a8w8_blockscale_1x128x128_256x128x128x128_16x16_32x32_2x2_8x32x1_8x32x1_1x32x1x8_8_1x1_intrawave_v3,759.54,463.68,0.0
gfx942,304,2560,5120,1024,ck,0,0,49.5942,a8w8_blockscale_1x128x128_256x128x128x128_16x16_32x32_2x2_8x32x1_8x32x1_1x32x1x8_8_1x1_intrawave_v3,541.26,687.15,0.0
gfx942,304,2560,5120,3200,ck,0,0,109.0576,a8w8_blockscale_1x128x128_256x128x128x128_16x16_32x32_2x2_8x32x1_8x32x1_1x32x1x8_8_1x1_intrawave_v3,769.19,465.72,0.0
gfx942,304,2624,5120,1024,ck,0,0,51.6267,a8w8_blockscale_1x128x128_256x128x128x128_16x16_32x32_2x2_8x32x1_8x32x1_1x32x1x8_8_1x1_intrawave_v3,532.95,674.06,0.0
gfx942,304,2624,5120,3200,ck,0,0,113.4906,a8w8_blockscale_1x128x128_256x128x128x128_16x16_32x32_2x2_8x32x1_8x32x1_1x32x1x8_8_1x1_intrawave_v3,757.62,455.11,0.0
gfx942,304,2688,5120,1024,ck,0,0,51.4722,a8w8_blockscale_1x128x128_256x128x128x128_16x16_32x32_2x2_8x32x1_8x32x1_1x32x1x8_8_1x1_intrawave_v3,547.59,690.09,0.0
gfx942,304,2688,5120,3200,ck,0,0,111.0461,a8w8_blockscale_1x128x128_256x128x128x128_16x16_32x32_2x2_8x32x1_8x32x1_1x32x1x8_8_1x1_intrawave_v3,793.19,472.87,0.0
gfx942,304,2752,5120,1024,ck,0,0,52.1796,a8w8_blockscale_1x128x128_256x128x128x128_16x16_32x32_2x2_8x32x1_8x32x1_1x32x1x8_8_1x1_intrawave_v3,553.03,694.55,0.0
gfx942,304,2752,5120,3200,ck,0,0,117.0043,a8w8_blockscale_1x128x128_256x128x128x128_16x16_32x32_2x2_8x32x1_8x32x1_1x32x1x8_8_1x1_intrawave_v3,770.72,456.14,0.0
gfx942,304,2816,5120,1024,ck,0,0,53.0567,a8w8_blockscale_1x128x128_256x128x128x128_16x16_32x32_2x2_8x32x1_8x32x1_1x32x1x8_8_1x1_intrawave_v3,556.53,696.66,0.0
gfx942,304,2816,5120,3200,ck,0,0,115.3834,a8w8_blockscale_1x128x128_256x128x128x128_16x16_32x32_2x2_8x32x1_8x32x1_1x32x1x8_8_1x1_intrawave_v3,799.72,470.01,0.0
gfx942,304,2880,5120,1024,ck,0,0,61.8657,a8w8_blockscale_1x128x128_256x128x128x128_16x16_32x32_2x2_8x32x1_8x32x1_1x32x1x8_8_1x1_intrawave_v3,488.14,609.11,0.0
gfx942,304,2880,5120,3200,ck,0,0,137.0261,a8w8_blockscale_1x128x128_256x128x128x128_16x16_32x32_2x2_8x32x1_8x32x1_1x32x1x8_8_1x1_intrawave_v3,688.71,402.05,0.0
gfx942,304,2944,5120,1024,ck,0,0,62.9988,a8w8_blockscale_1x128x128_256x128x128x128_16x16_32x32_2x2_8x32x1_8x32x1_1x32x1x8_8_1x1_intrawave_v3,490.01,609.6,0.0
gfx942,304,2944,5120,3200,ck,0,0,132.5241,a8w8_blockscale_1x128x128_256x128x128x128_16x16_32x32_2x2_8x32x1_8x32x1_1x32x1x8_8_1x1_intrawave_v3,727.94,422.2,0.0
gfx942,304,3008,5120,1024,ck,0,0,62.5108,a8w8_blockscale_1x128x128_256x128x128x128_16x16_32x32_2x2_8x32x1_8x32x1_1x32x1x8_8_1x1_intrawave_v3,504.57,625.89,0.0
gfx942,304,3008,5120,3200,ck,0,0,136.3826,a8w8_blockscale_1x128x128_256x128x128x128_16x16_32x32_2x2_8x32x1_8x32x1_1x32x1x8_8_1x1_intrawave_v3,722.72,416.56,0.0
gfx942,304,3072,5120,1024,ck,0,0,63.519,a8w8_blockscale_1x128x128_256x128x128x128_16x16_32x32_2x2_8x32x1_8x32x1_1x32x1x8_8_1x1_intrawave_v3,507.13,627.31,0.0
gfx942,304,3072,5120,3200,ck,0,0,134.6617,a8w8_blockscale_1x128x128_256x128x128x128_16x16_32x32_2x2_8x32x1_8x32x1_1x32x1x8_8_1x1_intrawave_v3,747.53,428.27,0.0
gfx942,304,3136,5120,1024,ck,0,0,63.2885,a8w8_blockscale_1x128x128_256x128x128x128_16x16_32x32_2x2_8x32x1_8x32x1_1x32x1x8_8_1x1_intrawave_v3,519.58,640.98,0.0
gfx942,304,3136,5120,3200,ck,0,0,140.7579,a8w8_blockscale_1x128x128_256x128x128x128_16x16_32x32_2x2_8x32x1_8x32x1_1x32x1x8_8_1x1_intrawave_v3,730.05,415.83,0.0
gfx942,304,3200,5120,1024,ck,0,0,64.1456,a8w8_blockscale_1x128x128_256x128x128x128_16x16_32x32_2x2_8x32x1_8x32x1_1x32x1x8_8_1x1_intrawave_v3,523.1,643.66,0.0
gfx942,304,3200,5120,3200,ck,0,0,137.3935,a8w8_blockscale_1x128x128_256x128x128x128_16x16_32x32_2x2_8x32x1_8x32x1_1x32x1x8_8_1x1_intrawave_v3,763.19,432.28,0.0
gfx942,304,3264,5120,1024,ck,0,0,64.1324,a8w8_blockscale_1x128x128_256x128x128x128_16x16_32x32_2x2_8x32x1_8x32x1_1x32x1x8_8_1x1_intrawave_v3,533.67,655.03,0.0
gfx942,304,3264,5120,3200,ck,0,0,143.5303,a8w8_blockscale_1x128x128_256x128x128x128_16x16_32x32_2x2_8x32x1_8x32x1_1x32x1x8_8_1x1_intrawave_v3,745.17,419.79,0.0
gfx942,304,3328,5120,1024,ck,0,0,64.5607,a8w8_blockscale_1x128x128_256x128x128x128_16x16_32x32_2x2_8x32x1_8x32x1_1x32x1x8_8_1x1_intrawave_v3,540.52,661.85,0.0
gfx942,304,3328,5120,3200,ck,0,0,141.1592,a8w8_blockscale_1x128x128_256x128x128x128_16x16_32x32_2x2_8x32x1_8x32x1_1x32x1x8_8_1x1_intrawave_v3,772.55,432.93,0.0
gfx942,304,3392,5120,1024,ck,0,0,66.0813,a8w8_blockscale_1x128x128_256x128x128x128_16x16_32x32_2x2_8x32x1_8x32x1_1x32x1x8_8_1x1_intrawave_v3,538.24,657.53,0.0
gfx942,304,3392,5120,3200,ck,0,0,146.5241,a8w8_blockscale_1x128x128_256x128x128x128_16x16_32x32_2x2_8x32x1_8x32x1_1x32x1x8_8_1x1_intrawave_v3,758.57,422.95,0.0
gfx942,304,3456,5120,1024,ck,0,0,65.203,a8w8_blockscale_1x128x128_256x128x128x128_16x16_32x32_2x2_8x32x1_8x32x1_1x32x1x8_8_1x1_intrawave_v3,555.78,677.44,0.0
gfx942,304,3456,5120,3200,ck,0,0,140.9919,a8w8_blockscale_1x128x128_256x128x128x128_16x16_32x32_2x2_8x32x1_8x32x1_1x32x1x8_8_1x1_intrawave_v3,803.21,445.65,0.0
gfx942,304,3520,5120,1024,ck,0,0,65.0734,a8w8_blockscale_1x128x128_256x128x128x128_16x16_32x32_2x2_8x32x1_8x32x1_1x32x1x8_8_1x1_intrawave_v3,567.2,689.87,0.0
gfx942,304,3520,5120,3200,ck,0,0,150.8147,a8w8_blockscale_1x128x128_256x128x128x128_16x16_32x32_2x2_8x32x1_8x32x1_1x32x1x8_8_1x1_intrawave_v3,764.8,422.32,0.0
gfx942,304,3584,5120,1024,ck,0,0,66.9036,a8w8_blockscale_1x128x128_256x128x128x128_16x16_32x32_2x2_8x32x1_8x32x1_1x32x1x8_8_1x1_intrawave_v3,561.72,681.77,0.0
gfx942,304,3584,5120,3200,ck,0,0,142.5626,a8w8_blockscale_1x128x128_256x128x128x128_16x16_32x32_2x2_8x32x1_8x32x1_1x32x1x8_8_1x1_intrawave_v3,823.78,452.8,0.0
gfx942,304,3648,5120,1024,ck,0,0,67.3815,a8w8_blockscale_1x128x128_256x128x128x128_16x16_32x32_2x2_8x32x1_8x32x1_1x32x1x8_8_1x1_intrawave_v3,567.69,687.64,0.0
gfx942,304,3648,5120,3200,ck,0,0,149.7056,a8w8_blockscale_1x128x128_256x128x128x128_16x16_32x32_2x2_8x32x1_8x32x1_1x32x1x8_8_1x1_intrawave_v3,798.48,436.95,0.0
gfx942,304,3712,5120,1024,ck,0,0,67.7831,a8w8_blockscale_1x128x128_256x128x128x128_16x16_32x32_2x2_8x32x1_8x32x1_1x32x1x8_8_1x1_intrawave_v3,574.23,694.2,0.0
gfx942,304,3712,5120,3200,ck,0,0,151.4813,a8w8_blockscale_1x128x128_256x128x128x128_16x16_32x32_2x2_8x32x1_8x32x1_1x32x1x8_8_1x1_intrawave_v3,802.97,437.5,0.0
gfx942,304,3776,5120,1024,ck,0,0,68.1973,a8w8_blockscale_1x128x128_256x128x128x128_16x16_32x32_2x2_8x32x1_8x32x1_1x32x1x8_8_1x1_intrawave_v3,580.58,700.55,0.0
gfx942,304,3776,5120,3200,ck,0,0,149.1233,a8w8_blockscale_1x128x128_256x128x128x128_16x16_32x32_2x2_8x32x1_8x32x1_1x32x1x8_8_1x1_intrawave_v3,829.73,450.19,0.0
gfx942,304,3840,5120,1024,ck,0,0,67.9755,a8w8_blockscale_1x128x128_256x128x128x128_16x16_32x32_2x2_8x32x1_8x32x1_1x32x1x8_8_1x1_intrawave_v3,592.35,713.44,0.0
gfx942,304,3840,5120,3200,ck,0,0,151.3546,a8w8_blockscale_1x128x128_256x128x128x128_16x16_32x32_2x2_8x32x1_8x32x1_1x32x1x8_8_1x1_intrawave_v3,831.35,449.23,0.0
gfx942,304,3904,5120,1024,ck,0,0,77.0629,a8w8_blockscale_1x128x128_256x128x128x128_16x16_32x32_2x2_8x32x1_8x32x1_1x32x1x8_8_1x1_intrawave_v3,531.21,638.67,0.0
gfx942,304,3904,5120,3200,ck,0,0,170.2163,a8w8_blockscale_1x128x128_256x128x128x128_16x16_32x32_2x2_8x32x1_8x32x1_1x32x1x8_8_1x1_intrawave_v3,751.55,404.51,0.0
gfx942,304,3968,5120,1024,ck,0,0,78.0019,a8w8_blockscale_1x128x128_256x128x128x128_16x16_32x32_2x2_8x32x1_8x32x1_1x32x1x8_8_1x1_intrawave_v3,533.42,640.22,0.0
gfx942,304,3968,5120,3200,ck,0,0,167.7832,a8w8_blockscale_1x128x128_256x128x128x128_16x16_32x32_2x2_8x32x1_8x32x1_1x32x1x8_8_1x1_intrawave_v3,774.95,415.5,0.0
gfx942,304,4032,5120,1024,ck,0,0,79.1227,a8w8_blockscale_1x128x128_256x128x128x128_16x16_32x32_2x2_8x32x1_8x32x1_1x32x1x8_8_1x1_intrawave_v3,534.34,640.26,0.0
gfx942,304,4032,5120,3200,ck,0,0,181.9388,a8w8_blockscale_1x128x128_256x128x128x128_16x16_32x32_2x2_8x32x1_8x32x1_1x32x1x8_8_1x1_intrawave_v3,726.18,387.9,0.0
gfx942,304,4096,5120,1024,ck,0,0,78.5428,a8w8_blockscale_1x128x128_256x128x128x128_16x16_32x32_2x2_8x32x1_8x32x1_1x32x1x8_8_1x1_intrawave_v3,546.83,654.17,0.0
gfx942,304,4096,5120,3200,ck,0,0,175.6104,a8w8_blockscale_1x128x128_256x128x128x128_16x16_32x32_2x2_8x32x1_8x32x1_1x32x1x8_8_1x1_intrawave_v3,764.29,406.78,0.0
gfx942,304,4224,5120,1024,ck,0,0,78.5937,a8w8_blockscale_1x128x128_256x128x128x128_16x16_32x32_2x2_8x32x1_8x32x1_1x32x1x8_8_1x1_intrawave_v3,563.55,672.09,0.0
gfx942,304,4224,5120,3200,ck,0,0,175.685,a8w8_blockscale_1x128x128_256x128x128x128_16x16_32x32_2x2_8x32x1_8x32x1_1x32x1x8_8_1x1_intrawave_v3,787.84,416.4,0.0
gfx942,304,4352,5120,1024,ck,0,0,80.7762,a8w8_blockscale_1x128x128_256x128x128x128_16x16_32x32_2x2_8x32x1_8x32x1_1x32x1x8_8_1x1_intrawave_v3,564.94,671.78,0.0
gfx942,304,4352,5120,3200,ck,0,0,184.2549,a8w8_blockscale_1x128x128_256x128x128x128_16x16_32x32_2x2_8x32x1_8x32x1_1x32x1x8_8_1x1_intrawave_v3,773.96,406.37,0.0
gfx942,304,4480,5120,1024,ck,0,0,79.391,a8w8_blockscale_1x128x128_256x128x128x128_16x16_32x32_2x2_8x32x1_8x32x1_1x32x1x8_8_1x1_intrawave_v3,591.71,701.66,0.0
gfx942,304,4480,5120,3200,ck,0,0,181.0652,a8w8_blockscale_1x128x128_256x128x128x128_16x16_32x32_2x2_8x32x1_8x32x1_1x32x1x8_8_1x1_intrawave_v3,810.76,423.03,0.0
gfx942,304,4608,5120,1024,ck,0,0,80.5736,a8w8_blockscale_1x128x128_256x128x128x128_16x16_32x32_2x2_8x32x1_8x32x1_1x32x1x8_8_1x1_intrawave_v3,599.68,709.26,0.0
gfx942,304,4608,5120,3200,ck,0,0,180.3729,a8w8_blockscale_1x128x128_256x128x128x128_16x16_32x32_2x2_8x32x1_8x32x1_1x32x1x8_8_1x1_intrawave_v3,837.13,434.19,0.0
gfx942,304,4736,5120,1024,ck,0,0,83.553,a8w8_blockscale_1x128x128_256x128x128x128_16x16_32x32_2x2_8x32x1_8x32x1_1x32x1x8_8_1x1_intrawave_v3,594.36,701.22,0.0
gfx942,304,4736,5120,3200,ck,0,0,190.5987,a8w8_blockscale_1x128x128_256x128x128x128_16x16_32x32_2x2_8x32x1_8x32x1_1x32x1x8_8_1x1_intrawave_v3,814.22,419.92,0.0
gfx942,304,4864,5120,1024,ck,0,0,81.3369,a8w8_blockscale_1x128x128_256x128x128x128_16x16_32x32_2x2_8x32x1_8x32x1_1x32x1x8_8_1x1_intrawave_v3,627.06,738.05,0.0
gfx942,304,4864,5120,3200,ck,0,0,197.034,a8w8_blockscale_1x128x128_256x128x128x128_16x16_32x32_2x2_8x32x1_8x32x1_1x32x1x8_8_1x1_intrawave_v3,808.91,414.93,0.0
gfx942,304,4992,5120,1024,ck,0,0,93.2875,a8w8_blockscale_1x128x128_256x128x128x128_16x16_32x32_2x2_8x32x1_8x32x1_1x32x1x8_8_1x1_intrawave_v3,561.11,658.96,0.0
gfx942,304,4992,5120,3200,ck,0,0,207.2076,a8w8_blockscale_1x128x128_256x128x128x128_16x16_32x32_2x2_8x32x1_8x32x1_1x32x1x8_8_1x1_intrawave_v3,789.44,402.86,0.0
gfx942,304,5120,5120,1024,ck,0,0,92.8444,a8w8_blockscale_1x128x128_256x128x128x128_16x16_32x32_2x2_8x32x1_8x32x1_1x32x1x8_8_1x1_intrawave_v3,578.25,677.63,0.0
gfx942,304,5120,5120,3200,ck,0,0,202.226,a8w8_blockscale_1x128x128_256x128x128x128_16x16_32x32_2x2_8x32x1_8x32x1_1x32x1x8_8_1x1_intrawave_v3,829.63,421.29,0.0
gfx942,304,5248,5120,1024,ck,0,0,93.1574,a8w8_blockscale_1x128x128_256x128x128x128_16x16_32x32_2x2_8x32x1_8x32x1_1x32x1x8_8_1x1_intrawave_v3,590.71,690.83,0.0
gfx942,304,5248,5120,3200,ck,0,0,208.9489,a8w8_blockscale_1x128x128_256x128x128x128_16x16_32x32_2x2_8x32x1_8x32x1_1x32x1x8_8_1x1_intrawave_v3,823.01,415.97,0.0
gfx942,304,5376,5120,1024,ck,0,0,92.1959,a8w8_blockscale_1x128x128_256x128x128x128_16x16_32x32_2x2_8x32x1_8x32x1_1x32x1x8_8_1x1_intrawave_v3,611.43,713.68,0.0
gfx942,304,5376,5120,3200,ck,0,0,207.8129,a8w8_blockscale_1x128x128_256x128x128x128_16x16_32x32_2x2_8x32x1_8x32x1_1x32x1x8_8_1x1_intrawave_v3,847.69,426.53,0.0
gfx942,304,5504,5120,1024,ck,0,0,95.4468,a8w8_blockscale_1x128x128_256x128x128x128_16x16_32x32_2x2_8x32x1_8x32x1_1x32x1x8_8_1x1_intrawave_v3,604.67,704.48,0.0
gfx942,304,5504,5120,3200,ck,0,0,220.6903,a8w8_blockscale_1x128x128_256x128x128x128_16x16_32x32_2x2_8x32x1_8x32x1_1x32x1x8_8_1x1_intrawave_v3,817.23,409.43,0.0
gfx942,304,5632,5120,1024,ck,0,0,94.7521,a8w8_blockscale_1x128x128_256x128x128x128_16x16_32x32_2x2_8x32x1_8x32x1_1x32x1x8_8_1x1_intrawave_v3,623.27,724.86,0.0
gfx942,304,5632,5120,3200,ck,0,0,219.4473,a8w8_blockscale_1x128x128_256x128x128x128_16x16_32x32_2x2_8x32x1_8x32x1_1x32x1x8_8_1x1_intrawave_v3,840.97,419.59,0.0
gfx942,304,5760,5120,1024,ck,0,0,99.5992,a8w8_blockscale_1x128x128_256x128x128x128_16x16_32x32_2x2_8x32x1_8x32x1_1x32x1x8_8_1x1_intrawave_v3,606.41,704.06,0.0
gfx942,304,5760,5120,3200,ck,0,0,226.1552,a8w8_blockscale_1x128x128_256x128x128x128_16x16_32x32_2x2_8x32x1_8x32x1_1x32x1x8_8_1x1_intrawave_v3,834.58,414.75,0.0
gfx942,304,5888,5120,1024,ck,0,0,104.0773,a8w8_blockscale_1x128x128_256x128x128x128_16x16_32x32_2x2_8x32x1_8x32x1_1x32x1x8_8_1x1_intrawave_v3,593.21,687.62,0.0
gfx942,304,5888,5120,3200,ck,0,0,242.8447,a8w8_blockscale_1x128x128_256x128x128x128_16x16_32x32_2x2_8x32x1_8x32x1_1x32x1x8_8_1x1_intrawave_v3,794.49,393.33,0.0
gfx942,304,6016,5120,1024,ck,0,0,107.371,a8w8_blockscale_1x128x128_256x128x128x128_16x16_32x32_2x2_8x32x1_8x32x1_1x32x1x8_8_1x1_intrawave_v3,587.52,679.95,0.0
gfx942,304,6016,5120,3200,ck,0,0,247.9072,a8w8_blockscale_1x128x128_256x128x128x128_16x16_32x32_2x2_8x32x1_8x32x1_1x32x1x8_8_1x1_intrawave_v3,795.19,392.24,0.0
gfx942,304,6144,5120,1024,ck,0,0,109.9509,a8w8_blockscale_1x128x128_256x128x128x128_16x16_32x32_2x2_8x32x1_8x32x1_1x32x1x8_8_1x1_intrawave_v3,585.94,677.11,0.0
gfx942,304,6144,5120,3200,ck,0,0,253.037,a8w8_blockscale_1x128x128_256x128x128x128_16x16_32x32_2x2_8x32x1_8x32x1_1x32x1x8_8_1x1_intrawave_v3,795.64,391.09,0.0
gfx942,304,6272,5120,1024,ck,0,0,109.2532,a8w8_blockscale_1x128x128_256x128x128x128_16x16_32x32_2x2_8x32x1_8x32x1_1x32x1x8_8_1x1_intrawave_v3,601.97,694.63,0.0
gfx942,304,6272,5120,3200,ck,0,0,253.6073,a8w8_blockscale_1x128x128_256x128x128x128_16x16_32x32_2x2_8x32x1_8x32x1_1x32x1x8_8_1x1_intrawave_v3,810.39,396.99,0.0
gfx942,304,6400,5120,1024,ck,0,0,107.9728,a8w8_blockscale_1x128x128_256x128x128x128_16x16_32x32_2x2_8x32x1_8x32x1_1x32x1x8_8_1x1_intrawave_v3,621.53,716.22,0.0
gfx942,304,6400,5120,3200,ck,0,0,250.4659,a8w8_blockscale_1x128x128_256x128x128x128_16x16_32x32_2x2_8x32x1_8x32x1_1x32x1x8_8_1x1_intrawave_v3,837.3,408.84,0.0
gfx942,304,6528,5120,1024,ck,0,0,107.0714,a8w8_blockscale_1x128x128_256x128x128x128_16x16_32x32_2x2_8x32x1_8x32x1_1x32x1x8_8_1x1_intrawave_v3,639.3,735.72,0.0
gfx942,304,6528,5120,3200,ck,0,0,254.5243,a8w8_blockscale_1x128x128_256x128x128x128_16x16_32x32_2x2_8x32x1_8x32x1_1x32x1x8_8_1x1_intrawave_v3,840.43,409.08,0.0
gfx942,304,6656,5120,1024,ck,0,0,113.9388,a8w8_blockscale_1x128x128_256x128x128x128_16x16_32x32_2x2_8x32x1_8x32x1_1x32x1x8_8_1x1_intrawave_v3,612.55,704.03,0.0
gfx942,304,6656,5120,3200,ck,0,0,259.8068,a8w8_blockscale_1x128x128_256x128x128x128_16x16_32x32_2x2_8x32x1_8x32x1_1x32x1x8_8_1x1_intrawave_v3,839.48,407.38,0.0
gfx942,304,6784,5120,1024,ck,0,0,115.9714,a8w8_blockscale_1x128x128_256x128x128x128_16x16_32x32_2x2_8x32x1_8x32x1_1x32x1x8_8_1x1_intrawave_v3,613.39,704.12,0.0
gfx942,304,6784,5120,3200,ck,0,0,260.0234,a8w8_blockscale_1x128x128_256x128x128x128_16x16_32x32_2x2_8x32x1_8x32x1_1x32x1x8_8_1x1_intrawave_v3,854.92,413.66,0.0
gfx942,304,6912,5120,1024,ck,0,0,118.3403,a8w8_blockscale_1x128x128_256x128x128x128_16x16_32x32_2x2_8x32x1_8x32x1_1x32x1x8_8_1x1_intrawave_v3,612.45,702.21,0.0
gfx942,304,6912,5120,3200,ck,0,0,285.1657,a8w8_blockscale_1x128x128_256x128x128x128_16x16_32x32_2x2_8x32x1_8x32x1_1x32x1x8_8_1x1_intrawave_v3,794.25,383.22,0.0
gfx942,304,7040,5120,1024,ck,0,0,120.1832,a8w8_blockscale_1x128x128_256x128x128x128_16x16_32x32_2x2_8x32x1_8x32x1_1x32x1x8_8_1x1_intrawave_v3,614.23,703.44,0.0
gfx942,304,7040,5120,3200,ck,0,0,289.2874,a8w8_blockscale_1x128x128_256x128x128x128_16x16_32x32_2x2_8x32x1_8x32x1_1x32x1x8_8_1x1_intrawave_v3,797.43,383.71,0.0
gfx942,304,7168,5120,1024,ck,0,0,124.7344,a8w8_blockscale_1x128x128_256x128x128x128_16x16_32x32_2x2_8x32x1_8x32x1_1x32x1x8_8_1x1_intrawave_v3,602.58,689.33,0.0
gfx942,304,7168,5120,3200,ck,0,0,289.7662,a8w8_blockscale_1x128x128_256x128x128x128_16x16_32x32_2x2_8x32x1_8x32x1_1x32x1x8_8_1x1_intrawave_v3,810.59,389.01,0.0
gfx942,304,7296,5120,1024,ck,0,0,125.697,a8w8_blockscale_1x128x128_256x128x128x128_16x16_32x32_2x2_8x32x1_8x32x1_1x32x1x8_8_1x1_intrawave_v3,608.64,695.52,0.0
gfx942,304,7296,5120,3200,ck,0,0,285.6229,a8w8_blockscale_1x128x128_256x128x128x128_16x16_32x32_2x2_8x32x1_8x32x1_1x32x1x8_8_1x1_intrawave_v3,837.03,400.68,0.0
gfx942,304,7424,5120,1024,ck,0,0,123.8701,a8w8_blockscale_1x128x128_256x128x128x128_16x16_32x32_2x2_8x32x1_8x32x1_1x32x1x8_8_1x1_intrawave_v3,628.45,717.42,0.0
gfx942,304,7424,5120,3200,ck,0,0,290.1712,a8w8_blockscale_1x128x128_256x128x128x128_16x16_32x32_2x2_8x32x1_8x32x1_1x32x1x8_8_1x1_intrawave_v3,838.37,400.32,0.0
gfx942,304,7552,5120,1024,ck,0,0,124.5779,a8w8_blockscale_1x128x128_256x128x128x128_16x16_32x32_2x2_8x32x1_8x32x1_1x32x1x8_8_1x1_intrawave_v3,635.65,724.92,0.0
gfx942,304,7552,5120,3200,ck,0,0,288.1784,a8w8_blockscale_1x128x128_256x128x128x128_16x16_32x32_2x2_8x32x1_8x32x1_1x32x1x8_8_1x1_intrawave_v3,858.72,409.06,0.0
gfx942,304,7680,5120,1024,ck,0,0,127.0685,a8w8_blockscale_1x128x128_256x128x128x128_16x16_32x32_2x2_8x32x1_8x32x1_1x32x1x8_8_1x1_intrawave_v3,633.76,722.05,0.0
gfx942,304,7680,5120,3200,ck,0,0,295.9821,a8w8_blockscale_1x128x128_256x128x128x128_16x16_32x32_2x2_8x32x1_8x32x1_1x32x1x8_8_1x1_intrawave_v3,850.25,404.09,0.0
gfx942,304,7808,5120,1024,ck,0,0,133.403,a8w8_blockscale_1x128x128_256x128x128x128_16x16_32x32_2x2_8x32x1_8x32x1_1x32x1x8_8_1x1_intrawave_v3,613.73,698.58,0.0
gfx942,304,7808,5120,3200,ck,0,0,323.4664,a8w8_blockscale_1x128x128_256x128x128x128_16x16_32x32_2x2_8x32x1_8x32x1_1x32x1x8_8_1x1_intrawave_v3,790.97,375.07,0.0
gfx942,304,7936,5120,1024,ck,0,0,136.0436,a8w8_blockscale_1x128x128_256x128x128x128_16x16_32x32_2x2_8x32x1_8x32x1_1x32x1x8_8_1x1_intrawave_v3,611.68,695.62,0.0
gfx942,304,7936,5120,3200,ck,0,0,316.1399,a8w8_blockscale_1x128x128_256x128x128x128_16x16_32x32_2x2_8x32x1_8x32x1_1x32x1x8_8_1x1_intrawave_v3,822.57,389.21,0.0
gfx942,304,8064,5120,1024,ck,0,0,136.8157,a8w8_blockscale_1x128x128_256x128x128x128_16x16_32x32_2x2_8x32x1_8x32x1_1x32x1x8_8_1x1_intrawave_v3,618.04,702.23,0.0
gfx942,304,8064,5120,3200,ck,0,0,328.4314,a8w8_blockscale_1x128x128_256x128x128x128_16x16_32x32_2x2_8x32x1_8x32x1_1x32x1x8_8_1x1_intrawave_v3,804.56,379.88,0.0
gfx942,304,8192,5120,1024,ck,0,0,137.0325,a8w8_blockscale_1x128x128_256x128x128x128_16x16_32x32_2x2_8x32x1_8x32x1_1x32x1x8_8_1x1_intrawave_v3,626.85,711.64,0.0
gfx942,304,8192,5120,3200,ck,0,0,317.3134,a8w8_blockscale_1x128x128_256x128x128x128_16x16_32x32_2x2_8x32x1_8x32x1_1x32x1x8_8_1x1_intrawave_v3,845.96,398.61,0.0
gfx942,304,8320,5120,1024,ck,0,0,141.0021,a8w8_blockscale_1x128x128_256x128x128x128_16x16_32x32_2x2_8x32x1_8x32x1_1x32x1x8_8_1x1_intrawave_v3,618.72,701.83,0.0
gfx942,304,8320,5120,3200,ck,0,0,321.6424,a8w8_blockscale_1x128x128_256x128x128x128_16x16_32x32_2x2_8x32x1_8x32x1_1x32x1x8_8_1x1_intrawave_v3,847.62,398.59,0.0
gfx942,304,8448,5120,1024,ck,0,0,141.1134,a8w8_blockscale_1x128x128_256x128x128x128_16x16_32x32_2x2_8x32x1_8x32x1_1x32x1x8_8_1x1_intrawave_v3,627.75,711.49,0.0
gfx942,304,8448,5120,3200,ck,0,0,327.0526,a8w8_blockscale_1x128x128_256x128x128x128_16x16_32x32_2x2_8x32x1_8x32x1_1x32x1x8_8_1x1_intrawave_v3,846.42,397.26,0.0
gfx942,304,8576,5120,1024,ck,0,0,142.0669,a8w8_blockscale_1x128x128_256x128x128x128_16x16_32x32_2x2_8x32x1_8x32x1_1x32x1x8_8_1x1_intrawave_v3,632.98,716.87,0.0
gfx942,304,8576,5120,3200,ck,0,0,320.4188,a8w8_blockscale_1x128x128_256x128x128x128_16x16_32x32_2x2_8x32x1_8x32x1_1x32x1x8_8_1x1_intrawave_v3,877.03,410.85,0.0
gfx942,304,8704,5120,1024,ck,0,0,139.3896,a8w8_blockscale_1x128x128_256x128x128x128_16x16_32x32_2x2_8x32x1_8x32x1_1x32x1x8_8_1x1_intrawave_v3,654.77,740.98,0.0
gfx942,304,8704,5120,3200,ck,0,0,328.5387,a8w8_blockscale_1x128x128_256x128x128x128_16x16_32x32_2x2_8x32x1_8x32x1_1x32x1x8_8_1x1_intrawave_v3,868.13,405.94,0.0
gfx942,304,8832,5120,1024,ck,0,0,153.7797,a8w8_blockscale_1x128x128_256x128x128x128_16x16_32x32_2x2_8x32x1_8x32x1_1x32x1x8_8_1x1_intrawave_v3,602.23,681.02,0.0
gfx942,304,8832,5120,3200,ck,0,0,345.7166,a8w8_blockscale_1x128x128_256x128x128x128_16x16_32x32_2x2_8x32x1_8x32x1_1x32x1x8_8_1x1_intrawave_v3,837.12,390.74,0.0
gfx942,304,8960,5120,1024,ck,0,0,151.6136,a8w8_blockscale_1x128x128_256x128x128x128_16x16_32x32_2x2_8x32x1_8x32x1_1x32x1x8_8_1x1_intrawave_v3,619.68,700.26,0.0
gfx942,304,8960,5120,3200,ck,0,0,345.6678,a8w8_blockscale_1x128x128_256x128x128x128_16x16_32x32_2x2_8x32x1_8x32x1_1x32x1x8_8_1x1_intrawave_v3,849.37,395.77,0.0
gfx942,304,9088,5120,1024,ck,0,0,153.8244,a8w8_blockscale_1x128x128_256x128x128x128_16x16_32x32_2x2_8x32x1_8x32x1_1x32x1x8_8_1x1_intrawave_v3,619.5,699.56,0.0
gfx942,304,9088,5120,3200,ck,0,0,358.4401,a8w8_blockscale_1x128x128_256x128x128x128_16x16_32x32_2x2_8x32x1_8x32x1_1x32x1x8_8_1x1_intrawave_v3,830.81,386.47,0.0
gfx942,304,9216,5120,1024,ck,0,0,154.3275,a8w8_blockscale_1x128x128_256x128x128x128_16x16_32x32_2x2_8x32x1_8x32x1_1x32x1x8_8_1x1_intrawave_v3,626.18,706.63,0.0
gfx942,304,9216,5120,3200,ck,0,0,350.6842,a8w8_blockscale_1x128x128_256x128x128x128_16x16_32x32_2x2_8x32x1_8x32x1_1x32x1x8_8_1x1_intrawave_v3,861.14,399.92,0.0
gfx942,304,9344,5120,1024,ck,0,0,152.0947,a8w8_blockscale_1x128x128_256x128x128x128_16x16_32x32_2x2_8x32x1_8x32x1_1x32x1x8_8_1x1_intrawave_v3,644.2,726.48,0.0
gfx942,304,9344,5120,3200,ck,0,0,360.0626,a8w8_blockscale_1x128x128_256x128x128x128_16x16_32x32_2x2_8x32x1_8x32x1_1x32x1x8_8_1x1_intrawave_v3,850.36,394.29,0.0
gfx942,304,9472,5120,1024,ck,0,0,156.0121,a8w8_blockscale_1x128x128_256x128x128x128_16x16_32x32_2x2_8x32x1_8x32x1_1x32x1x8_8_1x1_intrawave_v3,636.62,717.48,0.0
gfx942,304,9472,5120,3200,ck,0,0,365.738,a8w8_blockscale_1x128x128_256x128x128x128_16x16_32x32_2x2_8x32x1_8x32x1_1x32x1x8_8_1x1_intrawave_v3,848.64,392.87,0.0
gfx942,304,9600,5120,1024,ck,0,0,155.1583,a8w8_blockscale_1x128x128_256x128x128x128_16x16_32x32_2x2_8x32x1_8x32x1_1x32x1x8_8_1x1_intrawave_v3,648.78,730.72,0.0
gfx942,304,9600,5120,3200,ck,0,0,375.6786,a8w8_blockscale_1x128x128_256x128x128x128_16x16_32x32_2x2_8x32x1_8x32x1_1x32x1x8_8_1x1_intrawave_v3,837.35,387.05,0.0
gfx942,304,9728,5120,1024,ck,0,0,159.0965,a8w8_blockscale_1x128x128_256x128x128x128_16x16_32x32_2x2_8x32x1_8x32x1_1x32x1x8_8_1x1_intrawave_v3,641.15,721.69,0.0
gfx942,304,9728,5120,3200,ck,0,0,364.2962,a8w8_blockscale_1x128x128_256x128x128x128_16x16_32x32_2x2_8x32x1_8x32x1_1x32x1x8_8_1x1_intrawave_v3,875.02,403.87,0.0
gfx942,304,9856,5120,1024,ck,0,0,161.5825,a8w8_blockscale_1x128x128_256x128x128x128_16x16_32x32_2x2_8x32x1_8x32x1_1x32x1x8_8_1x1_intrawave_v3,639.6,719.51,0.0
gfx942,304,9856,5120,3200,ck,0,0,383.1659,a8w8_blockscale_1x128x128_256x128x128x128_16x16_32x32_2x2_8x32x1_8x32x1_1x32x1x8_8_1x1_intrawave_v3,842.88,388.47,0.0
gfx942,304,9984,5120,1024,ck,0,0,162.7127,a8w8_blockscale_1x128x128_256x128x128x128_16x16_32x32_2x2_8x32x1_8x32x1_1x32x1x8_8_1x1_intrawave_v3,643.4,723.38,0.0
gfx942,304,9984,5120,3200,ck,0,0,386.0025,a8w8_blockscale_1x128x128_256x128x128x128_16x16_32x32_2x2_8x32x1_8x32x1_1x32x1x8_8_1x1_intrawave_v3,847.55,390.07,0.0
gfx942,304,10112,5120,1024,ck,0,0,163.3677,a8w8_blockscale_1x128x128_256x128x128x128_16x16_32x32_2x2_8x32x1_8x32x1_1x32x1x8_8_1x1_intrawave_v3,649.04,729.3,0.0
gfx942,304,10112,5120,3200,ck,0,0,393.6087,a8w8_blockscale_1x128x128_256x128x128x128_16x16_32x32_2x2_8x32x1_8x32x1_1x32x1x8_8_1x1_intrawave_v3,841.83,386.91,0.0
gfx942,304,10240,5120,1024,ck,0,0,169.2267,a8w8_blockscale_1x128x128_256x128x128x128_16x16_32x32_2x2_8x32x1_8x32x1_1x32x1x8_8_1x1_intrawave_v3,634.5,712.57,0.0
gfx942,304,10240,5120,3200,ck,0,0,393.1054,a8w8_blockscale_1x128x128_256x128x128x128_16x16_32x32_2x2_8x32x1_8x32x1_1x32x1x8_8_1x1_intrawave_v3,853.57,391.78,0.0
gfx942,304,10368,5120,1024,ck,0,0,165.1612,a8w8_blockscale_1x128x128_256x128x128x128_16x16_32x32_2x2_8x32x1_8x32x1_1x32x1x8_8_1x1_intrawave_v3,658.24,738.84,0.0
gfx942,304,10368,5120,3200,ck,0,0,392.7619,a8w8_blockscale_1x128x128_256x128x128x128_16x16_32x32_2x2_8x32x1_8x32x1_1x32x1x8_8_1x1_intrawave_v3,865.0,396.5,0.0
gfx942,304,10496,5120,1024,ck,0,0,164.8602,a8w8_blockscale_1x128x128_256x128x128x128_16x16_32x32_2x2_8x32x1_8x32x1_1x32x1x8_8_1x1_intrawave_v3,667.59,748.94,0.0
gfx942,304,10496,5120,3200,ck,0,0,396.2529,a8w8_blockscale_1x128x128_256x128x128x128_16x16_32x32_2x2_8x32x1_8x32x1_1x32x1x8_8_1x1_intrawave_v3,867.96,397.35,0.0
gfx942,304,10624,5120,1024,ck,0,0,173.8504,a8w8_blockscale_1x128x128_256x128x128x128_16x16_32x32_2x2_8x32x1_8x32x1_1x32x1x8_8_1x1_intrawave_v3,640.78,718.5,0.0
gfx942,304,10624,5120,3200,ck,0,0,403.718,a8w8_blockscale_1x128x128_256x128x128x128_16x16_32x32_2x2_8x32x1_8x32x1_1x32x1x8_8_1x1_intrawave_v3,862.3,394.26,0.0
gfx942,304,10752,5120,1024,ck,0,0,170.6923,a8w8_blockscale_1x128x128_256x128x128x128_16x16_32x32_2x2_8x32x1_8x32x1_1x32x1x8_8_1x1_intrawave_v3,660.5,740.24,0.0
gfx942,304,10752,5120,3200,ck,0,0,421.5431,a8w8_blockscale_1x128x128_256x128x128x128_16x16_32x32_2x2_8x32x1_8x32x1_1x32x1x8_8_1x1_intrawave_v3,835.79,381.67,0.0
gfx942,304,10880,5120,1024,ck,0,0,177.6565,a8w8_blockscale_1x128x128_256x128x128x128_16x16_32x32_2x2_8x32x1_8x32x1_1x32x1x8_8_1x1_intrawave_v3,642.17,719.34,0.0
gfx942,304,10880,5120,3200,ck,0,0,422.8843,a8w8_blockscale_1x128x128_256x128x128x128_16x16_32x32_2x2_8x32x1_8x32x1_1x32x1x8_8_1x1_intrawave_v3,843.06,384.53,0.0
gfx942,304,11008,5120,1024,ck,0,0,178.8636,a8w8_blockscale_1x128x128_256x128x128x128_16x16_32x32_2x2_8x32x1_8x32x1_1x32x1x8_8_1x1_intrawave_v3,645.34,722.54,0.0
gfx942,304,11008,5120,3200,ck,0,0,408.3797,a8w8_blockscale_1x128x128_256x128x128x128_16x16_32x32_2x2_8x32x1_8x32x1_1x32x1x8_8_1x1_intrawave_v3,883.27,402.4,0.0
gfx942,304,11136,5120,1024,ck,0,0,178.635,a8w8_blockscale_1x128x128_256x128x128x128_16x16_32x32_2x2_8x32x1_8x32x1_1x32x1x8_8_1x1_intrawave_v3,653.68,731.54,0.0
gfx942,304,11136,5120,3200,ck,0,0,423.38,a8w8_blockscale_1x128x128_256x128x128x128_16x16_32x32_2x2_8x32x1_8x32x1_1x32x1x8_8_1x1_intrawave_v3,861.88,392.21,0.0
gfx942,304,11264,5120,1024,ck,0,0,180.4321,a8w8_blockscale_1x128x128_256x128x128x128_16x16_32x32_2x2_8x32x1_8x32x1_1x32x1x8_8_1x1_intrawave_v3,654.6,732.25,0.0
gfx942,304,11264,5120,3200,ck,0,0,428.3362,a8w8_blockscale_1x128x128_256x128x128x128_16x16_32x32_2x2_8x32x1_8x32x1_1x32x1x8_8_1x1_intrawave_v3,861.7,391.68,0.0
gfx942,304,11392,5120,1024,ck,0,0,185.5162,a8w8_blockscale_1x128x128_256x128x128x128_16x16_32x32_2x2_8x32x1_8x32x1_1x32x1x8_8_1x1_intrawave_v3,643.9,719.95,0.0
gfx942,304,11392,5120,3200,ck,0,0,438.1607,a8w8_blockscale_1x128x128_256x128x128x128_16x16_32x32_2x2_8x32x1_8x32x1_1x32x1x8_8_1x1_intrawave_v3,851.95,386.83,0.0
gfx942,304,11520,5120,1024,ck,0,0,186.284,a8w8_blockscale_1x128x128_256x128x128x128_16x16_32x32_2x2_8x32x1_8x32x1_1x32x1x8_8_1x1_intrawave_v3,648.45,724.72,0.0
gfx942,304,11520,5120,3200,ck,0,0,443.3319,a8w8_blockscale_1x128x128_256x128x128x128_16x16_32x32_2x2_8x32x1_8x32x1_1x32x1x8_8_1x1_intrawave_v3,851.48,386.2,0.0
gfx942,304,11648,5120,1024,ck,0,0,184.3309,a8w8_blockscale_1x128x128_256x128x128x128_16x16_32x32_2x2_8x32x1_8x32x1_1x32x1x8_8_1x1_intrawave_v3,662.6,740.22,0.0
gfx942,304,11648,5120,3200,ck,0,0,446.5143,a8w8_blockscale_1x128x128_256x128x128x128_16x16_32x32_2x2_8x32x1_8x32x1_1x32x1x8_8_1x1_intrawave_v3,854.8,387.3,0.0
gfx942,304,11776,5120,1024,ck,0,0,194.173,a8w8_blockscale_1x128x128_256x128x128x128_16x16_32x32_2x2_8x32x1_8x32x1_1x32x1x8_8_1x1_intrawave_v3,635.93,710.13,0.0
gfx942,304,11776,5120,3200,ck,0,0,446.8184,a8w8_blockscale_1x128x128_256x128x128x128_16x16_32x32_2x2_8x32x1_8x32x1_1x32x1x8_8_1x1_intrawave_v3,863.61,390.88,0.0
gfx942,304,11904,5120,1024,ck,0,0,195.3238,a8w8_blockscale_1x128x128_256x128x128x128_16x16_32x32_2x2_8x32x1_8x32x1_1x32x1x8_8_1x1_intrawave_v3,639.05,713.33,0.0
gfx942,304,11904,5120,3200,ck,0,0,445.2839,a8w8_blockscale_1x128x128_256x128x128x128_16x16_32x32_2x2_8x32x1_8x32x1_1x32x1x8_8_1x1_intrawave_v3,876.0,396.09,0.0
gfx942,304,12032,5120,1024,ck,0,0,192.6592,a8w8_blockscale_1x128x128_256x128x128x128_16x16_32x32_2x2_8x32x1_8x32x1_1x32x1x8_8_1x1_intrawave_v3,654.86,730.68,0.0
gfx942,304,12032,5120,3200,ck,0,0,467.6778,a8w8_blockscale_1x128x128_256x128x128x128_16x16_32x32_2x2_8x32x1_8x32x1_1x32x1x8_8_1x1_intrawave_v3,843.03,380.81,0.0
gfx942,304,12160,5120,1024,ck,0,0,197.4624,a8w8_blockscale_1x128x128_256x128x128x128_16x16_32x32_2x2_8x32x1_8x32x1_1x32x1x8_8_1x1_intrawave_v3,645.73,720.2,0.0
gfx942,304,12160,5120,3200,ck,0,0,462.3397,a8w8_blockscale_1x128x128_256x128x128x128_16x16_32x32_2x2_8x32x1_8x32x1_1x32x1x8_8_1x1_intrawave_v3,861.83,388.92,0.0
gfx942,304,12288,5120,1024,ck,0,0,196.1894,a8w8_blockscale_1x128x128_256x128x128x128_16x16_32x32_2x2_8x32x1_8x32x1_1x32x1x8_8_1x1_intrawave_v3,656.76,732.23,0.0
gfx942,304,12288,5120,3200,ck,0,0,478.7286,a8w8_blockscale_1x128x128_256x128x128x128_16x16_32x32_2x2_8x32x1_8x32x1_1x32x1x8_8_1x1_intrawave_v3,841.09,379.2,0.0
gfx942,304,12416,5120,1024,ck,0,0,199.335,a8w8_blockscale_1x128x128_256x128x128x128_16x16_32x32_2x2_8x32x1_8x32x1_1x32x1x8_8_1x1_intrawave_v3,653.13,727.9,0.0
gfx942,304,12416,5120,3200,ck,0,0,471.1949,a8w8_blockscale_1x128x128_256x128x128x128_16x16_32x32_2x2_8x32x1_8x32x1_1x32x1x8_8_1x1_intrawave_v3,863.44,388.92,0.0
gfx942,304,12544,5120,1024,ck,0,0,200.3066,a8w8_blockscale_1x128x128_256x128x128x128_16x16_32x32_2x2_8x32x1_8x32x1_1x32x1x8_8_1x1_intrawave_v3,656.66,731.57,0.0
gfx942,304,12544,5120,3200,ck,0,0,485.6438,a8w8_blockscale_1x128x128_256x128x128x128_16x16_32x32_2x2_8x32x1_8x32x1_1x32x1x8_8_1x1_intrawave_v3,846.39,380.89,0.0
gfx942,304,12672,5120,1024,ck,0,0,203.073,a8w8_blockscale_1x128x128_256x128x128x128_16x16_32x32_2x2_8x32x1_8x32x1_1x32x1x8_8_1x1_intrawave_v3,654.32,728.7,0.0
gfx942,304,12672,5120,3200,ck,0,0,490.3923,a8w8_blockscale_1x128x128_256x128x128x128_16x16_32x32_2x2_8x32x1_8x32x1_1x32x1x8_8_1x1_intrawave_v3,846.74,380.71,0.0
gfx942,304,12800,5120,1024,ck,0,0,204.8697,a8w8_blockscale_1x128x128_256x128x128x128_16x16_32x32_2x2_8x32x1_8x32x1_1x32x1x8_8_1x1_intrawave_v3,655.14,729.35,0.0
gfx942,304,12800,5120,3200,ck,0,0,500.2817,a8w8_blockscale_1x128x128_256x128x128x128_16x16_32x32_2x2_8x32x1_8x32x1_1x32x1x8_8_1x1_intrawave_v3,838.39,376.62,0.0
gfx942,304,12928,5120,1024,ck,0,0,208.4285,a8w8_blockscale_1x128x128_256x128x128x128_16x16_32x32_2x2_8x32x1_8x32x1_1x32x1x8_8_1x1_intrawave_v3,650.39,723.82,0.0
gfx942,304,12928,5120,3200,ck,0,0,486.7159,a8w8_blockscale_1x128x128_256x128x128x128_16x16_32x32_2x2_8x32x1_8x32x1_1x32x1x8_8_1x1_intrawave_v3,870.37,390.65,0.0
gfx942,304,13056,5120,1024,ck,0,0,207.5759,a8w8_blockscale_1x128x128_256x128x128x128_16x16_32x32_2x2_8x32x1_8x32x1_1x32x1x8_8_1x1_intrawave_v3,659.53,733.73,0.0
gfx942,304,13056,5120,3200,ck,0,0,508.6546,a8w8_blockscale_1x128x128_256x128x128x128_16x16_32x32_2x2_8x32x1_8x32x1_1x32x1x8_8_1x1_intrawave_v3,841.08,377.18,0.0
gfx942,304,13184,5120,1024,ck,0,0,208.0799,a8w8_blockscale_1x128x128_256x128x128x128_16x16_32x32_2x2_8x32x1_8x32x1_1x32x1x8_8_1x1_intrawave_v3,664.38,738.89,0.0
gfx942,304,13184,5120,3200,ck,0,0,493.5786,a8w8_blockscale_1x128x128_256x128x128x128_16x16_32x32_2x2_8x32x1_8x32x1_1x32x1x8_8_1x1_intrawave_v3,875.27,392.19,0.0
gfx942,304,13312,5120,1024,ck,0,0,211.7037,a8w8_blockscale_1x128x128_256x128x128x128_16x16_32x32_2x2_8x32x1_8x32x1_1x32x1x8_8_1x1_intrawave_v3,659.35,733.05,0.0
gfx942,304,13312,5120,3200,ck,0,0,496.1124,a8w8_blockscale_1x128x128_256x128x128x128_16x16_32x32_2x2_8x32x1_8x32x1_1x32x1x8_8_1x1_intrawave_v3,879.25,393.66,0.0
gfx942,304,13440,5120,1024,ck,0,0,217.6657,a8w8_blockscale_1x128x128_256x128x128x128_16x16_32x32_2x2_8x32x1_8x32x1_1x32x1x8_8_1x1_intrawave_v3,647.45,719.59,0.0
gfx942,304,13440,5120,3200,ck,0,0,502.3447,a8w8_blockscale_1x128x128_256x128x128x128_16x16_32x32_2x2_8x32x1_8x32x1_1x32x1x8_8_1x1_intrawave_v3,876.69,392.2,0.0
gfx942,304,13568,5120,1024,ck,0,0,220.2284,a8w8_blockscale_1x128x128_256x128x128x128_16x16_32x32_2x2_8x32x1_8x32x1_1x32x1x8_8_1x1_intrawave_v3,646.01,717.77,0.0
gfx942,304,13568,5120,3200,ck,0,0,526.7611,a8w8_blockscale_1x128x128_256x128x128x128_16x16_32x32_2x2_8x32x1_8x32x1_1x32x1x8_8_1x1_intrawave_v3,844.02,377.28,0.0
gfx942,304,13696,5120,1024,ck,0,0,219.3925,a8w8_blockscale_1x128x128_256x128x128x128_16x16_32x32_2x2_8x32x1_8x32x1_1x32x1x8_8_1x1_intrawave_v3,654.59,727.07,0.0
gfx942,304,13696,5120,3200,ck,0,0,526.0238,a8w8_blockscale_1x128x128_256x128x128x128_16x16_32x32_2x2_8x32x1_8x32x1_1x32x1x8_8_1x1_intrawave_v3,853.18,381.08,0.0
gfx942,304,13824,5120,1024,ck,0,0,226.4201,a8w8_blockscale_1x128x128_256x128x128x128_16x16_32x32_2x2_8x32x1_8x32x1_1x32x1x8_8_1x1_intrawave_v3,640.2,710.88,0.0
gfx942,304,13824,5120,3200,ck,0,0,529.4202,a8w8_blockscale_1x128x128_256x128x128x128_16x16_32x32_2x2_8x32x1_8x32x1_1x32x1x8_8_1x1_intrawave_v3,855.62,381.89,0.0
gfx942,304,13952,5120,1024,ck,0,0,220.5864,a8w8_blockscale_1x128x128_256x128x128x128_16x16_32x32_2x2_8x32x1_8x32x1_1x32x1x8_8_1x1_intrawave_v3,663.22,736.21,0.0
gfx942,304,13952,5120,3200,ck,0,0,537.5951,a8w8_blockscale_1x128x128_256x128x128x128_16x16_32x32_2x2_8x32x1_8x32x1_1x32x1x8_8_1x1_intrawave_v3,850.42,379.28,0.0
gfx942,304,14080,5120,1024,ck,0,0,224.5281,a8w8_blockscale_1x128x128_256x128x128x128_16x16_32x32_2x2_8x32x1_8x32x1_1x32x1x8_8_1x1_intrawave_v3,657.55,729.71,0.0
gfx942,304,14080,5120,3200,ck,0,0,543.3641,a8w8_blockscale_1x128x128_256x128x128x128_16x16_32x32_2x2_8x32x1_8x32x1_1x32x1x8_8_1x1_intrawave_v3,849.11,378.42,0.0
gfx942,304,14208,5120,1024,ck,0,0,223.4895,a8w8_blockscale_1x128x128_256x128x128x128_16x16_32x32_2x2_8x32x1_8x32x1_1x32x1x8_8_1x1_intrawave_v3,666.62,739.55,0.0
gfx942,304,14208,5120,3200,ck,0,0,532.9749,a8w8_blockscale_1x128x128_256x128x128x128_16x16_32x32_2x2_8x32x1_8x32x1_1x32x1x8_8_1x1_intrawave_v3,873.53,389.02,0.0
gfx942,304,14336,5120,1024,ck,0,0,226.9536,a8w8_blockscale_1x128x128_256x128x128x128_16x16_32x32_2x2_8x32x1_8x32x1_1x32x1x8_8_1x1_intrawave_v3,662.36,734.62,0.0
gfx942,304,14336,5120,3200,ck,0,0,554.5437,a8w8_blockscale_1x128x128_256x128x128x128_16x16_32x32_2x2_8x32x1_8x32x1_1x32x1x8_8_1x1_intrawave_v3,847.11,376.99,0.0
gfx942,304,14464,5120,1024,ck,0,0,222.733,a8w8_blockscale_1x128x128_256x128x128x128_16x16_32x32_2x2_8x32x1_8x32x1_1x32x1x8_8_1x1_intrawave_v3,680.93,755.01,0.0
gfx942,304,14464,5120,3200,ck,0,0,538.9607,a8w8_blockscale_1x128x128_256x128x128x128_16x16_32x32_2x2_8x32x1_8x32x1_1x32x1x8_8_1x1_intrawave_v3,879.39,391.09,0.0
gfx942,304,14592,5120,1024,ck,0,0,229.9311,a8w8_blockscale_1x128x128_256x128x128x128_16x16_32x32_2x2_8x32x1_8x32x1_1x32x1x8_8_1x1_intrawave_v3,665.45,737.64,0.0
gfx942,304,14592,5120,3200,ck,0,0,543.139,a8w8_blockscale_1x128x128_256x128x128x128_16x16_32x32_2x2_8x32x1_8x32x1_1x32x1x8_8_1x1_intrawave_v3,880.35,391.25,0.0
gfx942,304,14720,5120,1024,ck,0,0,236.7487,a8w8_blockscale_1x128x128_256x128x128x128_16x16_32x32_2x2_8x32x1_8x32x1_1x32x1x8_8_1x1_intrawave_v3,651.96,722.49,0.0
gfx942,304,14720,5120,3200,ck,0,0,575.7219,a8w8_blockscale_1x128x128_256x128x128x128_16x16_32x32_2x2_8x32x1_8x32x1_1x32x1x8_8_1x1_intrawave_v3,837.81,372.09,0.0
gfx942,304,14848,5120,1024,ck,0,0,235.5001,a8w8_blockscale_1x128x128_256x128x128x128_16x16_32x32_2x2_8x32x1_8x32x1_1x32x1x8_8_1x1_intrawave_v3,661.11,732.44,0.0
gfx942,304,14848,5120,3200,ck,0,0,573.0115,a8w8_blockscale_1x128x128_256x128x128x128_16x16_32x32_2x2_8x32x1_8x32x1_1x32x1x8_8_1x1_intrawave_v3,849.09,376.85,0.0
gfx942,304,14976,5120,1024,ck,0,0,237.1756,a8w8_blockscale_1x128x128_256x128x128x128_16x16_32x32_2x2_8x32x1_8x32x1_1x32x1x8_8_1x1_intrawave_v3,662.1,733.35,0.0
gfx942,304,14976,5120,3200,ck,0,0,557.5298,a8w8_blockscale_1x128x128_256x128x128x128_16x16_32x32_2x2_8x32x1_8x32x1_1x32x1x8_8_1x1_intrawave_v3,880.19,390.4,0.0
gfx942,304,15104,5120,1024,ck,0,0,239.8057,a8w8_blockscale_1x128x128_256x128x128x128_16x16_32x32_2x2_8x32x1_8x32x1_1x32x1x8_8_1x1_intrawave_v3,660.44,731.32,0.0
gfx942,304,15104,5120,3200,ck,0,0,563.8155,a8w8_blockscale_1x128x128_256x128x128x128_16x16_32x32_2x2_8x32x1_8x32x1_1x32x1x8_8_1x1_intrawave_v3,877.82,389.1,0.0
gfx942,304,15232,5120,1024,ck,0,0,242.4203,a8w8_blockscale_1x128x128_256x128x128x128_16x16_32x32_2x2_8x32x1_8x32x1_1x32x1x8_8_1x1_intrawave_v3,658.85,729.38,0.0
gfx942,304,15232,5120,3200,ck,0,0,593.5892,a8w8_blockscale_1x128x128_256x128x128x128_16x16_32x32_2x2_8x32x1_8x32x1_1x32x1x8_8_1x1_intrawave_v3,840.85,372.48,0.0
gfx942,304,15360,5120,1024,ck,0,0,241.4903,a8w8_blockscale_1x128x128_256x128x128x128_16x16_32x32_2x2_8x32x1_8x32x1_1x32x1x8_8_1x1_intrawave_v3,666.95,738.16,0.0
gfx942,304,15360,5120,3200,ck,0,0,571.8881,a8w8_blockscale_1x128x128_256x128x128x128_16x16_32x32_2x2_8x32x1_8x32x1_1x32x1x8_8_1x1_intrawave_v3,880.1,389.63,0.0
gfx942,304,15488,5120,1024,ck,0,0,240.7545,a8w8_blockscale_1x128x128_256x128x128x128_16x16_32x32_2x2_8x32x1_8x32x1_1x32x1x8_8_1x1_intrawave_v3,674.56,746.4,0.0
gfx942,304,15488,5120,3200,ck,0,0,579.2901,a8w8_blockscale_1x128x128_256x128x128x128_16x16_32x32_2x2_8x32x1_8x32x1_1x32x1x8_8_1x1_intrawave_v3,876.09,387.62,0.0
gfx942,304,15616,5120,1024,ck,0,0,250.1778,a8w8_blockscale_1x128x128_256x128x128x128_16x16_32x32_2x2_8x32x1_8x32x1_1x32x1x8_8_1x1_intrawave_v3,654.52,724.05,0.0
gfx942,304,15616,5120,3200,ck,0,0,586.6069,a8w8_blockscale_1x128x128_256x128x128x128_16x16_32x32_2x2_8x32x1_8x32x1_1x32x1x8_8_1x1_intrawave_v3,872.31,385.71,0.0
gfx942,304,15744,5120,1024,ck,0,0,249.0826,a8w8_blockscale_1x128x128_256x128x128x128_16x16_32x32_2x2_8x32x1_8x32x1_1x32x1x8_8_1x1_intrawave_v3,662.78,733.02,0.0
gfx942,304,15744,5120,3200,ck,0,0,607.1785,a8w8_blockscale_1x128x128_256x128x128x128_16x16_32x32_2x2_8x32x1_8x32x1_1x32x1x8_8_1x1_intrawave_v3,849.67,375.48,0.0
gfx942,304,15872,5120,1024,ck,0,0,244.7832,a8w8_blockscale_1x128x128_256x128x128x128_16x16_32x32_2x2_8x32x1_8x32x1_1x32x1x8_8_1x1_intrawave_v3,679.91,751.79,0.0
gfx942,304,15872,5120,3200,ck,0,0,604.6012,a8w8_blockscale_1x128x128_256x128x128x128_16x16_32x32_2x2_8x32x1_8x32x1_1x32x1x8_8_1x1_intrawave_v3,860.23,379.93,0.0
gfx942,304,16000,5120,1024,ck,0,0,253.4622,a8w8_blockscale_1x128x128_256x128x128x128_16x16_32x32_2x2_8x32x1_8x32x1_1x32x1x8_8_1x1_intrawave_v3,661.92,731.73,0.0
gfx942,304,16000,5120,3200,ck,0,0,598.7706,a8w8_blockscale_1x128x128_256x128x128x128_16x16_32x32_2x2_8x32x1_8x32x1_1x32x1x8_8_1x1_intrawave_v3,875.61,386.5,0.0
gfx942,304,16128,5120,1024,ck,0,0,254.1438,a8w8_blockscale_1x128x128_256x128x128x128_16x16_32x32_2x2_8x32x1_8x32x1_1x32x1x8_8_1x1_intrawave_v3,665.43,735.44,0.0
gfx942,304,16128,5120,3200,ck,0,0,610.7102,a8w8_blockscale_1x128x128_256x128x128x128_16x16_32x32_2x2_8x32x1_8x32x1_1x32x1x8_8_1x1_intrawave_v3,865.36,381.76,0.0
gfx942,304,16256,5120,1024,ck,0,0,252.7556,a8w8_blockscale_1x128x128_256x128x128x128_16x16_32x32_2x2_8x32x1_8x32x1_1x32x1x8_8_1x1_intrawave_v3,674.39,745.19,0.0
gfx942,304,16256,5120,3200,ck,0,0,618.336,a8w8_blockscale_1x128x128_256x128x128x128_16x16_32x32_2x2_8x32x1_8x32x1_1x32x1x8_8_1x1_intrawave_v3,861.47,379.83,0.0
gfx942,304,16384,5120,1024,ck,0,0,259.2172,a8w8_blockscale_1x128x128_256x128x128x128_16x16_32x32_2x2_8x32x1_8x32x1_1x32x1x8_8_1x1_intrawave_v3,662.76,732.17,0.0
gfx942,304,16384,5120,3200,ck,0,0,605.1951,a8w8_blockscale_1x128x128_256x128x128x128_16x16_32x32_2x2_8x32x1_8x32x1_1x32x1x8_8_1x1_intrawave_v3,887.1,390.92,0.0
gfx942,304,16512,5120,1024,ck,0,0,265.173,a8w8_blockscale_1x128x128_256x128x128x128_16x16_32x32_2x2_8x32x1_8x32x1_1x32x1x8_8_1x1_intrawave_v3,652.94,721.17,0.0
gfx942,304,16512,5120,3200,ck,0,0,615.0643,a8w8_blockscale_1x128x128_256x128x128x128_16x16_32x32_2x2_8x32x1_8x32x1_1x32x1x8_8_1x1_intrawave_v3,879.69,387.45,0.0
gfx942,304,16640,5120,1024,ck,0,0,264.3897,a8w8_blockscale_1x128x128_256x128x128x128_16x16_32x32_2x2_8x32x1_8x32x1_1x32x1x8_8_1x1_intrawave_v3,659.95,728.76,0.0
gfx942,304,16640,5120,3200,ck,0,0,637.0504,a8w8_blockscale_1x128x128_256x128x128x128_16x16_32x32_2x2_8x32x1_8x32x1_1x32x1x8_8_1x1_intrawave_v3,855.91,376.78,0.0
gfx942,304,16768,5120,1024,ck,0,0,266.1429,a8w8_blockscale_1x128x128_256x128x128x128_16x16_32x32_2x2_8x32x1_8x32x1_1x32x1x8_8_1x1_intrawave_v3,660.64,729.37,0.0
gfx942,304,16768,5120,3200,ck,0,0,633.1739,a8w8_blockscale_1x128x128_256x128x128x128_16x16_32x32_2x2_8x32x1_8x32x1_1x32x1x8_8_1x1_intrawave_v3,867.78,381.8,0.0
gfx942,304,16896,5120,1024,ck,0,0,262.7109,a8w8_blockscale_1x128x128_256x128x128x128_16x16_32x32_2x2_8x32x1_8x32x1_1x32x1x8_8_1x1_intrawave_v3,674.38,744.39,0.0
gfx942,304,16896,5120,3200,ck,0,0,637.9323,a8w8_blockscale_1x128x128_256x128x128x128_16x16_32x32_2x2_8x32x1_8x32x1_1x32x1x8_8_1x1_intrawave_v3,867.88,381.65,0.0
gfx942,304,17024,5120,1024,ck,0,0,268.0825,a8w8_blockscale_1x128x128_256x128x128x128_16x16_32x32_2x2_8x32x1_8x32x1_1x32x1x8_8_1x1_intrawave_v3,665.88,734.85,0.0
gfx942,304,17024,5120,3200,ck,0,0,646.0553,a8w8_blockscale_1x128x128_256x128x128x128_16x16_32x32_2x2_8x32x1_8x32x1_1x32x1x8_8_1x1_intrawave_v3,863.46,379.51,0.0
gfx942,304,17152,5120,1024,ck,0,0,270.3427,a8w8_blockscale_1x128x128_256x128x128x128_16x16_32x32_2x2_8x32x1_8x32x1_1x32x1x8_8_1x1_intrawave_v3,665.27,734.04,0.0
gfx942,304,17152,5120,3200,ck,0,0,653.1936,a8w8_blockscale_1x128x128_256x128x128x128_16x16_32x32_2x2_8x32x1_8x32x1_1x32x1x8_8_1x1_intrawave_v3,860.44,378.0,0.0
gfx942,304,17280,5120,1024,ck,0,0,268.607,a8w8_blockscale_1x128x128_256x128x128x128_16x16_32x32_2x2_8x32x1_8x32x1_1x32x1x8_8_1x1_intrawave_v3,674.57,744.15,0.0
gfx942,304,17280,5120,3200,ck,0,0,661.0215,a8w8_blockscale_1x128x128_256x128x128x128_16x16_32x32_2x2_8x32x1_8x32x1_1x32x1x8_8_1x1_intrawave_v3,856.6,376.13,0.0
gfx942,304,17408,5120,1024,ck,0,0,271.6788,a8w8_blockscale_1x128x128_256x128x128x128_16x16_32x32_2x2_8x32x1_8x32x1_1x32x1x8_8_1x1_intrawave_v3,671.88,741.05,0.0
gfx942,304,17408,5120,3200,ck,0,0,678.0151,a8w8_blockscale_1x128x128_256x128x128x128_16x16_32x32_2x2_8x32x1_8x32x1_1x32x1x8_8_1x1_intrawave_v3,841.32,369.24,0.0
gfx942,304,17536,5120,1024,ck,0,0,270.6701,a8w8_blockscale_1x128x128_256x128x128x128_16x16_32x32_2x2_8x32x1_8x32x1_1x32x1x8_8_1x1_intrawave_v3,679.34,749.13,0.0
gfx942,304,17536,5120,3200,ck,0,0,663.9243,a8w8_blockscale_1x128x128_256x128x128x128_16x16_32x32_2x2_8x32x1_8x32x1_1x32x1x8_8_1x1_intrawave_v3,865.49,379.66,0.0
gfx942,304,17664,5120,1024,ck,0,0,276.8061,a8w8_blockscale_1x128x128_256x128x128x128_16x16_32x32_2x2_8x32x1_8x32x1_1x32x1x8_8_1x1_intrawave_v3,669.13,737.74,0.0
gfx942,304,17664,5120,3200,ck,0,0,690.657,a8w8_blockscale_1x128x128_256x128x128x128_16x16_32x32_2x2_8x32x1_8x32x1_1x32x1x8_8_1x1_intrawave_v3,838.06,367.46,0.0
gfx942,304,17792,5120,1024,ck,0,0,279.2529,a8w8_blockscale_1x128x128_256x128x128x128_16x16_32x32_2x2_8x32x1_8x32x1_1x32x1x8_8_1x1_intrawave_v3,668.08,736.44,0.0
gfx942,304,17792,5120,3200,ck,0,0,679.7742,a8w8_blockscale_1x128x128_256x128x128x128_16x16_32x32_2x2_8x32x1_8x32x1_1x32x1x8_8_1x1_intrawave_v3,857.65,375.87,0.0
gfx942,304,17920,5120,1024,ck,0,0,277.2905,a8w8_blockscale_1x128x128_256x128x128x128_16x16_32x32_2x2_8x32x1_8x32x1_1x32x1x8_8_1x1_intrawave_v3,677.65,746.85,0.0
gfx942,304,17920,5120,3200,ck,0,0,684.928,a8w8_blockscale_1x128x128_256x128x128x128_16x16_32x32_2x2_8x32x1_8x32x1_1x32x1x8_8_1x1_intrawave_v3,857.32,375.56,0.0
gfx942,304,18048,5120,1024,ck,0,0,283.9893,a8w8_blockscale_1x128x128_256x128x128x128_16x16_32x32_2x2_8x32x1_8x32x1_1x32x1x8_8_1x1_intrawave_v3,666.39,734.31,0.0
gfx942,304,18048,5120,3200,ck,0,0,681.8444,a8w8_blockscale_1x128x128_256x128x128x128_16x16_32x32_2x2_8x32x1_8x32x1_1x32x1x8_8_1x1_intrawave_v3,867.35,379.78,0.0
gfx942,304,18176,5120,1024,ck,0,0,285.9941,a8w8_blockscale_1x128x128_256x128x128x128_16x16_32x32_2x2_8x32x1_8x32x1_1x32x1x8_8_1x1_intrawave_v3,666.41,734.2,0.0
gfx942,304,18176,5120,3200,ck,0,0,676.6406,a8w8_blockscale_1x128x128_256x128x128x128_16x16_32x32_2x2_8x32x1_8x32x1_1x32x1x8_8_1x1_intrawave_v3,880.22,385.24,0.0
gfx942,304,18304,5120,1024,ck,0,0,281.2744,a8w8_blockscale_1x128x128_256x128x128x128_16x16_32x32_2x2_8x32x1_8x32x1_1x32x1x8_8_1x1_intrawave_v3,682.36,751.65,0.0
gfx942,304,18304,5120,3200,ck,0,0,699.0675,a8w8_blockscale_1x128x128_256x128x128x128_16x16_32x32_2x2_8x32x1_8x32x1_1x32x1x8_8_1x1_intrawave_v3,857.98,375.34,0.0
gfx942,304,18432,5120,1024,ck,0,0,287.2244,a8w8_blockscale_1x128x128_256x128x128x128_16x16_32x32_2x2_8x32x1_8x32x1_1x32x1x8_8_1x1_intrawave_v3,672.9,741.1,0.0
gfx942,304,18432,5120,3200,ck,0,0,682.6189,a8w8_blockscale_1x128x128_256x128x128x128_16x16_32x32_2x2_8x32x1_8x32x1_1x32x1x8_8_1x1_intrawave_v3,884.8,386.91,0.0
gfx942,304,18560,5120,1024,ck,0,0,291.3076,a8w8_blockscale_1x128x128_256x128x128x128_16x16_32x32_2x2_8x32x1_8x32x1_1x32x1x8_8_1x1_intrawave_v3,668.08,735.66,0.0
gfx942,304,18560,5120,3200,ck,0,0,731.9281,a8w8_blockscale_1x128x128_256x128x128x128_16x16_32x32_2x2_8x32x1_8x32x1_1x32x1x8_8_1x1_intrawave_v3,830.92,363.19,0.0
gfx942,304,18688,5120,1024,ck,0,0,295.3486,a8w8_blockscale_1x128x128_256x128x128x128_16x16_32x32_2x2_8x32x1_8x32x1_1x32x1x8_8_1x1_intrawave_v3,663.48,730.47,0.0
gfx942,304,18688,5120,3200,ck,0,0,710.2182,a8w8_blockscale_1x128x128_256x128x128x128_16x16_32x32_2x2_8x32x1_8x32x1_1x32x1x8_8_1x1_intrawave_v3,862.23,376.72,0.0
gfx942,304,18816,5120,1024,ck,0,0,294.6689,a8w8_blockscale_1x128x128_256x128x128x128_16x16_32x32_2x2_8x32x1_8x32x1_1x32x1x8_8_1x1_intrawave_v3,669.57,737.05,0.0
gfx942,304,18816,5120,3200,ck,0,0,736.2319,a8w8_blockscale_1x128x128_256x128x128x128_16x16_32x32_2x2_8x32x1_8x32x1_1x32x1x8_8_1x1_intrawave_v3,837.46,365.74,0.0
gfx942,304,18944,5120,1024,ck,0,0,296.7077,a8w8_blockscale_1x128x128_256x128x128x128_16x16_32x32_2x2_8x32x1_8x32x1_1x32x1x8_8_1x1_intrawave_v3,669.49,736.85,0.0
gfx942,304,18944,5120,3200,ck,0,0,741.8096,a8w8_blockscale_1x128x128_256x128x128x128_16x16_32x32_2x2_8x32x1_8x32x1_1x32x1x8_8_1x1_intrawave_v3,836.81,365.31,0.0
gfx942,304,19072,5120,1024,ck,0,0,299.0427,a8w8_blockscale_1x128x128_256x128x128x128_16x16_32x32_2x2_8x32x1_8x32x1_1x32x1x8_8_1x1_intrawave_v3,668.75,735.91,0.0
gfx942,304,19072,5120,3200,ck,0,0,715.9778,a8w8_blockscale_1x128x128_256x128x128x128_16x16_32x32_2x2_8x32x1_8x32x1_1x32x1x8_8_1x1_intrawave_v3,872.86,380.89,0.0
gfx942,304,19200,5120,1024,ck,0,0,302.0293,a8w8_blockscale_1x128x128_256x128x128x128_16x16_32x32_2x2_8x32x1_8x32x1_1x32x1x8_8_1x1_intrawave_v3,666.58,733.41,0.0
gfx942,304,19200,5120,3200,ck,0,0,713.7525,a8w8_blockscale_1x128x128_256x128x128x128_16x16_32x32_2x2_8x32x1_8x32x1_1x32x1x8_8_1x1_intrawave_v3,881.46,384.49,0.0
gfx942,304,19328,5120,1024,ck,0,0,298.6457,a8w8_blockscale_1x128x128_256x128x128x128_16x16_32x32_2x2_8x32x1_8x32x1_1x32x1x8_8_1x1_intrawave_v3,678.63,746.55,0.0
gfx942,304,19328,5120,3200,ck,0,0,735.6409,a8w8_blockscale_1x128x128_256x128x128x128_16x16_32x32_2x2_8x32x1_8x32x1_1x32x1x8_8_1x1_intrawave_v3,860.94,375.39,0.0
gfx942,304,19456,5120,1024,ck,0,0,304.4079,a8w8_blockscale_1x128x128_256x128x128x128_16x16_32x32_2x2_8x32x1_8x32x1_1x32x1x8_8_1x1_intrawave_v3,670.19,737.15,0.0
gfx942,304,19456,5120,3200,ck,0,0,721.1716,a8w8_blockscale_1x128x128_256x128x128x128_16x16_32x32_2x2_8x32x1_8x32x1_1x32x1x8_8_1x1_intrawave_v3,884.03,385.31,0.0
gfx942,304,19584,5120,1024,ck,0,0,306.699,a8w8_blockscale_1x128x128_256x128x128x128_16x16_32x32_2x2_8x32x1_8x32x1_1x32x1x8_8_1x1_intrawave_v3,669.56,736.35,0.0
gfx942,304,19584,5120,3200,ck,0,0,771.6477,a8w8_blockscale_1x128x128_256x128x128x128_16x16_32x32_2x2_8x32x1_8x32x1_1x32x1x8_8_1x1_intrawave_v3,831.63,362.33,0.0
gfx942,304,19712,5120,1024,ck,0,0,310.067,a8w8_blockscale_1x128x128_256x128x128x128_16x16_32x32_2x2_8x32x1_8x32x1_1x32x1x8_8_1x1_intrawave_v3,666.61,733.0,0.0
gfx942,304,19712,5120,3200,ck,0,0,753.5706,a8w8_blockscale_1x128x128_256x128x128x128_16x16_32x32_2x2_8x32x1_8x32x1_1x32x1x8_8_1x1_intrawave_v3,857.15,373.31,0.0
gfx942,304,19840,5120,1024,ck,0,0,309.8845,a8w8_blockscale_1x128x128_256x128x128x128_16x16_32x32_2x2_8x32x1_8x32x1_1x32x1x8_8_1x1_intrawave_v3,671.34,738.08,0.0
gfx942,304,19840,5120,3200,ck,0,0,752.9232,a8w8_blockscale_1x128x128_256x128x128x128_16x16_32x32_2x2_8x32x1_8x32x1_1x32x1x8_8_1x1_intrawave_v3,863.46,375.91,0.0
gfx942,304,19968,5120,1024,ck,0,0,308.3081,a8w8_blockscale_1x128x128_256x128x128x128_16x16_32x32_2x2_8x32x1_8x32x1_1x32x1x8_8_1x1_intrawave_v3,679.12,746.53,0.0
gfx942,304,19968,5120,3200,ck,0,0,748.3795,a8w8_blockscale_1x128x128_256x128x128x128_16x16_32x32_2x2_8x32x1_8x32x1_1x32x1x8_8_1x1_intrawave_v3,874.3,380.49,0.0
gfx942,304,20096,5120,1024,ck,0,0,315.8317,a8w8_blockscale_1x128x128_256x128x128x128_16x16_32x32_2x2_8x32x1_8x32x1_1x32x1x8_8_1x1_intrawave_v3,667.2,733.32,0.0
gfx942,304,20096,5120,3200,ck,0,0,771.5969,a8w8_blockscale_1x128x128_256x128x128x128_16x16_32x32_2x2_8x32x1_8x32x1_1x32x1x8_8_1x1_intrawave_v3,853.43,371.27,0.0
gfx942,304,20224,5120,1024,ck,0,0,320.6733,a8w8_blockscale_1x128x128_256x128x128x128_16x16_32x32_2x2_8x32x1_8x32x1_1x32x1x8_8_1x1_intrawave_v3,661.31,726.74,0.0
gfx942,304,20224,5120,3200,ck,0,0,765.6494,a8w8_blockscale_1x128x128_256x128x128x128_16x16_32x32_2x2_8x32x1_8x32x1_1x32x1x8_8_1x1_intrawave_v3,865.54,376.41,0.0
gfx942,304,20352,5120,1024,ck,0,0,325.5134,a8w8_blockscale_1x128x128_256x128x128x128_16x16_32x32_2x2_8x32x1_8x32x1_1x32x1x8_8_1x1_intrawave_v3,655.6,720.36,0.0
gfx942,304,20352,5120,3200,ck,0,0,779.9571,a8w8_blockscale_1x128x128_256x128x128x128_16x16_32x32_2x2_8x32x1_8x32x1_1x32x1x8_8_1x1_intrawave_v3,855.04,371.71,0.0
gfx942,304,20480,5120,1024,ck,0,0,321.8291,a8w8_blockscale_1x128x128_256x128x128x128_16x16_32x32_2x2_8x32x1_8x32x1_1x32x1x8_8_1x1_intrawave_v3,667.27,733.09,0.0
gfx942,304,20480,5120,3200,ck,0,0,792.2005,a8w8_blockscale_1x128x128_256x128x128x128_16x16_32x32_2x2_8x32x1_8x32x1_1x32x1x8_8_1x1_intrawave_v3,847.12,368.13,0.0
gfx942,304,20608,5120,1024,ck,0,0,324.7965,a8w8_blockscale_1x128x128_256x128x128x128_16x16_32x32_2x2_8x32x1_8x32x1_1x32x1x8_8_1x1_intrawave_v3,665.31,730.83,0.0
gfx942,304,20608,5120,3200,ck,0,0,791.3784,a8w8_blockscale_1x128x128_256x128x128x128_16x16_32x32_2x2_8x32x1_8x32x1_1x32x1x8_8_1x1_intrawave_v3,853.3,370.69,0.0
gfx942,304,20736,5120,1024,ck,0,0,322.0197,a8w8_blockscale_1x128x128_256x128x128x128_16x16_32x32_2x2_8x32x1_8x32x1_1x32x1x8_8_1x1_intrawave_v3,675.22,741.61,0.0
gfx942,304,20736,5120,3200,ck,0,0,790.9139,a8w8_blockscale_1x128x128_256x128x128x128_16x16_32x32_2x2_8x32x1_8x32x1_1x32x1x8_8_1x1_intrawave_v3,859.1,373.08,0.0
gfx942,304,20864,5120,1024,ck,0,0,325.9587,a8w8_blockscale_1x128x128_256x128x128x128_16x16_32x32_2x2_8x32x1_8x32x1_1x32x1x8_8_1x1_intrawave_v3,671.17,737.07,0.0
gfx942,304,20864,5120,3200,ck,0,0,819.0304,a8w8_blockscale_1x128x128_256x128x128x128_16x16_32x32_2x2_8x32x1_8x32x1_1x32x1x8_8_1x1_intrawave_v3,834.73,362.38,0.0
gfx942,304,20992,5120,1024,ck,0,0,328.6157,a8w8_blockscale_1x128x128_256x128x128x128_16x16_32x32_2x2_8x32x1_8x32x1_1x32x1x8_8_1x1_intrawave_v3,669.83,735.5,0.0
gfx942,304,20992,5120,3200,ck,0,0,792.5705,a8w8_blockscale_1x128x128_256x128x128x128_16x16_32x32_2x2_8x32x1_8x32x1_1x32x1x8_8_1x1_intrawave_v3,867.89,376.64,0.0
gfx942,304,21120,5120,1024,ck,0,0,335.258,a8w8_blockscale_1x128x128_256x128x128x128_16x16_32x32_2x2_8x32x1_8x32x1_1x32x1x8_8_1x1_intrawave_v3,660.56,725.23,0.0
gfx942,304,21120,5120,3200,ck,0,0,794.9445,a8w8_blockscale_1x128x128_256x128x128x128_16x16_32x32_2x2_8x32x1_8x32x1_1x32x1x8_8_1x1_intrawave_v3,870.58,377.68,0.0
gfx942,304,21248,5120,1024,ck,0,0,331.4467,a8w8_blockscale_1x128x128_256x128x128x128_16x16_32x32_2x2_8x32x1_8x32x1_1x32x1x8_8_1x1_intrawave_v3,672.21,737.92,0.0
gfx942,304,21248,5120,3200,ck,0,0,800.6345,a8w8_blockscale_1x128x128_256x128x128x128_16x16_32x32_2x2_8x32x1_8x32x1_1x32x1x8_8_1x1_intrawave_v3,869.63,377.15,0.0
gfx942,304,21376,5120,1024,ck,0,0,331.6319,a8w8_blockscale_1x128x128_256x128x128x128_16x16_32x32_2x2_8x32x1_8x32x1_1x32x1x8_8_1x1_intrawave_v3,675.88,741.85,0.0
gfx942,304,21376,5120,3200,ck,0,0,799.0657,a8w8_blockscale_1x128x128_256x128x128x128_16x16_32x32_2x2_8x32x1_8x32x1_1x32x1x8_8_1x1_intrawave_v3,876.58,380.04,0.0
gfx942,304,21504,5120,1024,ck,0,0,341.0821,a8w8_blockscale_1x128x128_256x128x128x128_16x16_32x32_2x2_8x32x1_8x32x1_1x32x1x8_8_1x1_intrawave_v3,661.09,725.53,0.0
gfx942,304,21504,5120,3200,ck,0,0,813.4831,a8w8_blockscale_1x128x128_256x128x128x128_16x16_32x32_2x2_8x32x1_8x32x1_1x32x1x8_8_1x1_intrawave_v3,866.2,375.42,0.0
gfx942,304,21632,5120,1024,ck,0,0,336.7067,a8w8_blockscale_1x128x128_256x128x128x128_16x16_32x32_2x2_8x32x1_8x32x1_1x32x1x8_8_1x1_intrawave_v3,673.67,739.24,0.0
gfx942,304,21632,5120,3200,ck,0,0,810.4528,a8w8_blockscale_1x128x128_256x128x128x128_16x16_32x32_2x2_8x32x1_8x32x1_1x32x1x8_8_1x1_intrawave_v3,874.62,378.95,0.0
gfx942,304,21760,5120,1024,ck,0,0,335.5557,a8w8_blockscale_1x128x128_256x128x128x128_16x16_32x32_2x2_8x32x1_8x32x1_1x32x1x8_8_1x1_intrawave_v3,679.98,746.07,0.0
gfx942,304,21760,5120,3200,ck,0,0,834.3162,a8w8_blockscale_1x128x128_256x128x128x128_16x16_32x32_2x2_8x32x1_8x32x1_1x32x1x8_8_1x1_intrawave_v3,854.63,370.17,0.0
gfx942,304,21888,5120,1024,ck,0,0,337.1625,a8w8_blockscale_1x128x128_256x128x128x128_16x16_32x32_2x2_8x32x1_8x32x1_1x32x1x8_8_1x1_intrawave_v3,680.72,746.79,0.0
gfx942,304,21888,5120,3200,ck,0,0,851.363,a8w8_blockscale_1x128x128_256x128x128x128_16x16_32x32_2x2_8x32x1_8x32x1_1x32x1x8_8_1x1_intrawave_v3,842.44,364.78,0.0
gfx942,304,22016,5120,1024,ck,0,0,345.457,a8w8_blockscale_1x128x128_256x128x128x128_16x16_32x32_2x2_8x32x1_8x32x1_1x32x1x8_8_1x1_intrawave_v3,668.26,733.03,0.0
gfx942,304,22016,5120,3200,ck,0,0,843.1894,a8w8_blockscale_1x128x128_256x128x128x128_16x16_32x32_2x2_8x32x1_8x32x1_1x32x1x8_8_1x1_intrawave_v3,855.59,370.35,0.0
gfx942,304,22144,5120,1024,ck,0,0,345.7948,a8w8_blockscale_1x128x128_256x128x128x128_16x16_32x32_2x2_8x32x1_8x32x1_1x32x1x8_8_1x1_intrawave_v3,671.49,736.49,0.0
gfx942,304,22144,5120,3200,ck,0,0,824.6566,a8w8_blockscale_1x128x128_256x128x128x128_16x16_32x32_2x2_8x32x1_8x32x1_1x32x1x8_8_1x1_intrawave_v3,879.9,380.76,0.0
gfx942,304,22272,5120,1024,ck,0,0,345.8064,a8w8_blockscale_1x128x128_256x128x128x128_16x16_32x32_2x2_8x32x1_8x32x1_1x32x1x8_8_1x1_intrawave_v3,675.35,740.63,0.0
gfx942,304,22272,5120,3200,ck,0,0,842.3599,a8w8_blockscale_1x128x128_256x128x128x128_16x16_32x32_2x2_8x32x1_8x32x1_1x32x1x8_8_1x1_intrawave_v3,866.39,374.8,0.0
gfx942,304,22400,5120,1024,ck,0,0,355.3129,a8w8_blockscale_1x128x128_256x128x128x128_16x16_32x32_2x2_8x32x1_8x32x1_1x32x1x8_8_1x1_intrawave_v3,661.05,724.87,0.0
gfx942,304,22400,5120,3200,ck,0,0,879.6803,a8w8_blockscale_1x128x128_256x128x128x128_16x16_32x32_2x2_8x32x1_8x32x1_1x32x1x8_8_1x1_intrawave_v3,834.4,360.86,0.0
gfx942,304,22528,5120,1024,ck,0,0,355.856,a8w8_blockscale_1x128x128_256x128x128x128_16x16_32x32_2x2_8x32x1_8x32x1_1x32x1x8_8_1x1_intrawave_v3,663.82,727.82,0.0
gfx942,304,22528,5120,3200,ck,0,0,842.8661,a8w8_blockscale_1x128x128_256x128x128x128_16x16_32x32_2x2_8x32x1_8x32x1_1x32x1x8_8_1x1_intrawave_v3,875.82,378.66,0.0
gfx942,304,22656,5120,1024,ck,0,0,362.8319,a8w8_blockscale_1x128x128_256x128x128x128_16x16_32x32_2x2_8x32x1_8x32x1_1x32x1x8_8_1x1_intrawave_v3,654.75,717.8,0.0
gfx942,304,22656,5120,3200,ck,0,0,844.8452,a8w8_blockscale_1x128x128_256x128x128x128_16x16_32x32_2x2_8x32x1_8x32x1_1x32x1x8_8_1x1_intrawave_v3,878.73,379.81,0.0
gfx942,304,22784,5120,1024,ck,0,0,352.0931,a8w8_blockscale_1x128x128_256x128x128x128_16x16_32x32_2x2_8x32x1_8x32x1_1x32x1x8_8_1x1_intrawave_v3,678.54,743.79,0.0
gfx942,304,22784,5120,3200,ck,0,0,852.9171,a8w8_blockscale_1x128x128_256x128x128x128_16x16_32x32_2x2_8x32x1_8x32x1_1x32x1x8_8_1x1_intrawave_v3,875.33,378.23,0.0
gfx942,304,22912,5120,1024,ck,0,0,360.8129,a8w8_blockscale_1x128x128_256x128x128x128_16x16_32x32_2x2_8x32x1_8x32x1_1x32x1x8_8_1x1_intrawave_v3,665.86,729.81,0.0
gfx942,304,22912,5120,3200,ck,0,0,872.3732,a8w8_blockscale_1x128x128_256x128x128x128_16x16_32x32_2x2_8x32x1_8x32x1_1x32x1x8_8_1x1_intrawave_v3,860.62,371.77,0.0
gfx942,304,23040,5120,1024,ck,0,0,358.4567,a8w8_blockscale_1x128x128_256x128x128x128_16x16_32x32_2x2_8x32x1_8x32x1_1x32x1x8_8_1x1_intrawave_v3,673.98,738.63,0.0
gfx942,304,23040,5120,3200,ck,0,0,877.1723,a8w8_blockscale_1x128x128_256x128x128x128_16x16_32x32_2x2_8x32x1_8x32x1_1x32x1x8_8_1x1_intrawave_v3,860.69,371.7,0.0
gfx942,304,23168,5120,1024,ck,0,0,357.7564,a8w8_blockscale_1x128x128_256x128x128x128_16x16_32x32_2x2_8x32x1_8x32x1_1x32x1x8_8_1x1_intrawave_v3,679.05,744.1,0.0
gfx942,304,23168,5120,3200,ck,0,0,879.5158,a8w8_blockscale_1x128x128_256x128x128x128_16x16_32x32_2x2_8x32x1_8x32x1_1x32x1x8_8_1x1_intrawave_v3,863.17,372.66,0.0
gfx942,304,23296,5120,1024,ck,0,0,364.6457,a8w8_blockscale_1x128x128_256x128x128x128_16x16_32x32_2x2_8x32x1_8x32x1_1x32x1x8_8_1x1_intrawave_v3,669.9,734.0,0.0
gfx942,304,23296,5120,3200,ck,0,0,910.4984,a8w8_blockscale_1x128x128_256x128x128x128_16x16_32x32_2x2_8x32x1_8x32x1_1x32x1x8_8_1x1_intrawave_v3,838.4,361.87,0.0
gfx942,304,23424,5120,1024,ck,0,0,367.0755,a8w8_blockscale_1x128x128_256x128x128x128_16x16_32x32_2x2_8x32x1_8x32x1_1x32x1x8_8_1x1_intrawave_v3,669.12,733.07,0.0
gfx942,304,23424,5120,3200,ck,0,0,880.883,a8w8_blockscale_1x128x128_256x128x128x128_16x16_32x32_2x2_8x32x1_8x32x1_1x32x1x8_8_1x1_intrawave_v3,871.35,375.99,0.0
gfx942,304,23552,5120,1024,ck,0,0,358.8043,a8w8_blockscale_1x128x128_256x128x128x128_16x16_32x32_2x2_8x32x1_8x32x1_1x32x1x8_8_1x1_intrawave_v3,688.29,753.98,0.0
gfx942,304,23552,5120,3200,ck,0,0,875.7994,a8w8_blockscale_1x128x128_256x128x128x128_16x16_32x32_2x2_8x32x1_8x32x1_1x32x1x8_8_1x1_intrawave_v3,881.2,380.14,0.0
gfx942,304,23680,5120,1024,ck,0,0,370.0218,a8w8_blockscale_1x128x128_256x128x128x128_16x16_32x32_2x2_8x32x1_8x32x1_1x32x1x8_8_1x1_intrawave_v3,671.05,735.02,0.0
gfx942,304,23680,5120,3200,ck,0,0,908.7739,a8w8_blockscale_1x128x128_256x128x128x128_16x16_32x32_2x2_8x32x1_8x32x1_1x32x1x8_8_1x1_intrawave_v3,853.84,368.24,0.0
gfx942,304,23808,5120,1024,ck,0,0,372.2062,a8w8_blockscale_1x128x128_256x128x128x128_16x16_32x32_2x2_8x32x1_8x32x1_1x32x1x8_8_1x1_intrawave_v3,670.72,734.58,0.0
gfx942,304,23808,5120,3200,ck,0,0,894.6455,a8w8_blockscale_1x128x128_256x128x128x128_16x16_32x32_2x2_8x32x1_8x32x1_1x32x1x8_8_1x1_intrawave_v3,872.01,375.97,0.0
gfx942,304,23936,5120,1024,ck,0,0,380.3738,a8w8_blockscale_1x128x128_256x128x128x128_16x16_32x32_2x2_8x32x1_8x32x1_1x32x1x8_8_1x1_intrawave_v3,659.84,722.6,0.0
gfx942,304,23936,5120,3200,ck,0,0,937.6452,a8w8_blockscale_1x128x128_256x128x128x128_16x16_32x32_2x2_8x32x1_8x32x1_1x32x1x8_8_1x1_intrawave_v3,836.49,360.57,0.0
gfx942,304,24064,5120,1024,ck,0,0,377.959,a8w8_blockscale_1x128x128_256x128x128x128_16x16_32x32_2x2_8x32x1_8x32x1_1x32x1x8_8_1x1_intrawave_v3,667.61,731.03,0.0
gfx942,304,24064,5120,3200,ck,0,0,908.9074,a8w8_blockscale_1x128x128_256x128x128x128_16x16_32x32_2x2_8x32x1_8x32x1_1x32x1x8_8_1x1_intrawave_v3,867.56,373.86,0.0
gfx942,304,24192,5120,1024,ck,0,0,377.7172,a8w8_blockscale_1x128x128_256x128x128x128_16x16_32x32_2x2_8x32x1_8x32x1_1x32x1x8_8_1x1_intrawave_v3,671.59,735.32,0.0
gfx942,304,24192,5120,3200,ck,0,0,917.2243,a8w8_blockscale_1x128x128_256x128x128x128_16x16_32x32_2x2_8x32x1_8x32x1_1x32x1x8_8_1x1_intrawave_v3,864.26,372.35,0.0
gfx942,304,24320,5120,1024,ck,0,0,381.723,a8w8_blockscale_1x128x128_256x128x128x128_16x16_32x32_2x2_8x32x1_8x32x1_1x32x1x8_8_1x1_intrawave_v3,668.06,731.38,0.0
gfx942,304,24320,5120,3200,ck,0,0,955.8204,a8w8_blockscale_1x128x128_256x128x128x128_16x16_32x32_2x2_8x32x1_8x32x1_1x32x1x8_8_1x1_intrawave_v3,833.75,359.11,0.0
gfx942,304,24448,5120,1024,ck,0,0,381.9622,a8w8_blockscale_1x128x128_256x128x128x128_16x16_32x32_2x2_8x32x1_8x32x1_1x32x1x8_8_1x1_intrawave_v3,671.16,734.69,0.0
gfx942,304,24448,5120,3200,ck,0,0,940.7328,a8w8_blockscale_1x128x128_256x128x128x128_16x16_32x32_2x2_8x32x1_8x32x1_1x32x1x8_8_1x1_intrawave_v3,851.58,366.7,0.0
gfx942,304,24576,5120,1024,ck,0,0,385.7725,a8w8_blockscale_1x128x128_256x128x128x128_16x16_32x32_2x2_8x32x1_8x32x1_1x32x1x8_8_1x1_intrawave_v3,668.01,731.17,0.0
gfx942,304,24576,5120,3200,ck,0,0,944.1672,a8w8_blockscale_1x128x128_256x128x128x128_16x16_32x32_2x2_8x32x1_8x32x1_1x32x1x8_8_1x1_intrawave_v3,852.93,367.19,0.0
gfx942,304,24704,5120,1024,ck,0,0,390.3353,a8w8_blockscale_1x128x128_256x128x128x128_16x16_32x32_2x2_8x32x1_8x32x1_1x32x1x8_8_1x1_intrawave_v3,663.64,726.32,0.0
gfx942,304,24704,5120,3200,ck,0,0,964.9519,a8w8_blockscale_1x128x128_256x128x128x128_16x16_32x32_2x2_8x32x1_8x32x1_1x32x1x8_8_1x1_intrawave_v3,838.9,361.06,0.0
gfx942,304,24832,5120,1024,ck,0,0,386.6745,a8w8_blockscale_1x128x128_256x128x128x128_16x16_32x32_2x2_8x32x1_8x32x1_1x32x1x8_8_1x1_intrawave_v3,673.39,736.93,0.0
gfx942,304,24832,5120,3200,ck,0,0,920.9198,a8w8_blockscale_1x128x128_256x128x128x128_16x16_32x32_2x2_8x32x1_8x32x1_1x32x1x8_8_1x1_intrawave_v3,883.57,380.19,0.0
gfx942,304,24960,5120,1024,ck,0,0,382.4542,a8w8_blockscale_1x128x128_256x128x128x128_16x16_32x32_2x2_8x32x1_8x32x1_1x32x1x8_8_1x1_intrawave_v3,684.33,748.83,0.0
gfx942,304,24960,5120,3200,ck,0,0,928.626,a8w8_blockscale_1x128x128_256x128x128x128_16x16_32x32_2x2_8x32x1_8x32x1_1x32x1x8_8_1x1_intrawave_v3,880.75,378.89,0.0
gfx942,304,25088,5120,1024,ck,0,0,387.7445,a8w8_blockscale_1x128x128_256x128x128x128_16x16_32x32_2x2_8x32x1_8x32x1_1x32x1x8_8_1x1_intrawave_v3,678.45,742.33,0.0
gfx942,304,25088,5120,3200,ck,0,0,952.4707,a8w8_blockscale_1x128x128_256x128x128x128_16x16_32x32_2x2_8x32x1_8x32x1_1x32x1x8_8_1x1_intrawave_v3,863.11,371.21,0.0
gfx942,304,25216,5120,1024,ck,0,0,386.7953,a8w8_blockscale_1x128x128_256x128x128x128_16x16_32x32_2x2_8x32x1_8x32x1_1x32x1x8_8_1x1_intrawave_v3,683.59,747.88,0.0
gfx942,304,25216,5120,3200,ck,0,0,948.3477,a8w8_blockscale_1x128x128_256x128x128x128_16x16_32x32_2x2_8x32x1_8x32x1_1x32x1x8_8_1x1_intrawave_v3,871.28,374.64,0.0
gfx942,304,25344,5120,1024,ck,0,0,396.1455,a8w8_blockscale_1x128x128_256x128x128x128_16x16_32x32_2x2_8x32x1_8x32x1_1x32x1x8_8_1x1_intrawave_v3,670.84,733.87,0.0
gfx942,304,25344,5120,3200,ck,0,0,958.7886,a8w8_blockscale_1x128x128_256x128x128x128_16x16_32x32_2x2_8x32x1_8x32x1_1x32x1x8_8_1x1_intrawave_v3,866.17,372.35,0.0
gfx942,304,25472,5120,1024,ck,0,0,397.7484,a8w8_blockscale_1x128x128_256x128x128x128_16x16_32x32_2x2_8x32x1_8x32x1_1x32x1x8_8_1x1_intrawave_v3,671.51,734.53,0.0
gfx942,304,25472,5120,3200,ck,0,0,972.061,a8w8_blockscale_1x128x128_256x128x128x128_16x16_32x32_2x2_8x32x1_8x32x1_1x32x1x8_8_1x1_intrawave_v3,858.66,369.04,0.0
gfx942,304,25600,5120,1024,ck,0,0,394.2102,a8w8_blockscale_1x128x128_256x128x128x128_16x16_32x32_2x2_8x32x1_8x32x1_1x32x1x8_8_1x1_intrawave_v3,680.94,744.78,0.0
gfx942,304,25600,5120,3200,ck,0,0,988.0797,a8w8_blockscale_1x128x128_256x128x128x128_16x16_32x32_2x2_8x32x1_8x32x1_1x32x1x8_8_1x1_intrawave_v3,848.98,364.8,0.0
gfx942,304,25728,5120,1024,ck,0,0,410.5513,a8w8_blockscale_1x128x128_256x128x128x128_16x16_32x32_2x2_8x32x1_8x32x1_1x32x1x8_8_1x1_intrawave_v3,657.11,718.65,0.0
gfx942,304,25728,5120,3200,ck,0,0,981.9402,a8w8_blockscale_1x128x128_256x128x128x128_16x16_32x32_2x2_8x32x1_8x32x1_1x32x1x8_8_1x1_intrawave_v3,858.56,368.83,0.0
gfx942,304,25856,5120,1024,ck,0,0,395.8046,a8w8_blockscale_1x128x128_256x128x128x128_16x16_32x32_2x2_8x32x1_8x32x1_1x32x1x8_8_1x1_intrawave_v3,684.98,749.07,0.0
gfx942,304,25856,5120,3200,ck,0,0,965.4868,a8w8_blockscale_1x128x128_256x128x128x128_16x16_32x32_2x2_8x32x1_8x32x1_1x32x1x8_8_1x1_intrawave_v3,877.54,376.9,0.0
gfx942,304,25984,5120,1024,ck,0,0,402.7207,a8w8_blockscale_1x128x128_256x128x128x128_16x16_32x32_2x2_8x32x1_8x32x1_1x32x1x8_8_1x1_intrawave_v3,676.55,739.78,0.0
gfx942,304,25984,5120,3200,ck,0,0,992.1412,a8w8_blockscale_1x128x128_256x128x128x128_16x16_32x32_2x2_8x32x1_8x32x1_1x32x1x8_8_1x1_intrawave_v3,858.19,368.5,0.0
gfx942,304,26112,5120,1024,ck,0,0,397.4154,a8w8_blockscale_1x128x128_256x128x128x128_16x16_32x32_2x2_8x32x1_8x32x1_1x32x1x8_8_1x1_intrawave_v3,688.96,753.29,0.0
gfx942,304,26112,5120,3200,ck,0,0,995.849,a8w8_blockscale_1x128x128_256x128x128x128_16x16_32x32_2x2_8x32x1_8x32x1_1x32x1x8_8_1x1_intrawave_v3,859.2,368.86,0.0
gfx942,304,26240,5120,1024,ck,0,0,416.6501,a8w8_blockscale_1x128x128_256x128x128x128_16x16_32x32_2x2_8x32x1_8x32x1_1x32x1x8_8_1x1_intrawave_v3,660.38,721.97,0.0
gfx942,304,26240,5120,3200,ck,0,0,975.8352,a8w8_blockscale_1x128x128_256x128x128x128_16x16_32x32_2x2_8x32x1_8x32x1_1x32x1x8_8_1x1_intrawave_v3,881.12,378.19,0.0
gfx942,304,26368,5120,1024,ck,0,0,408.3129,a8w8_blockscale_1x128x128_256x128x128x128_16x16_32x32_2x2_8x32x1_8x32x1_1x32x1x8_8_1x1_intrawave_v3,677.15,740.25,0.0
gfx942,304,26368,5120,3200,ck,0,0,986.6445,a8w8_blockscale_1x128x128_256x128x128x128_16x16_32x32_2x2_8x32x1_8x32x1_1x32x1x8_8_1x1_intrawave_v3,875.72,375.79,0.0
gfx942,304,26496,5120,1024,ck,0,0,412.0241,a8w8_blockscale_1x128x128_256x128x128x128_16x16_32x32_2x2_8x32x1_8x32x1_1x32x1x8_8_1x1_intrawave_v3,674.31,737.08,0.0
gfx942,304,26496,5120,3200,ck,0,0,1014.7771,a8w8_blockscale_1x128x128_256x128x128x128_16x16_32x32_2x2_8x32x1_8x32x1_1x32x1x8_8_1x1_intrawave_v3,855.58,367.07,0.0
gfx942,304,26624,5120,1024,ck,0,0,417.8342,a8w8_blockscale_1x128x128_256x128x128x128_16x16_32x32_2x2_8x32x1_8x32x1_1x32x1x8_8_1x1_intrawave_v3,668.14,730.28,0.0
gfx942,304,26624,5120,3200,ck,0,0,1005.7692,a8w8_blockscale_1x128x128_256x128x128x128_16x16_32x32_2x2_8x32x1_8x32x1_1x32x1x8_8_1x1_intrawave_v3,867.41,372.06,0.0
gfx942,304,26752,5120,1024,ck,0,0,418.0365,a8w8_blockscale_1x128x128_256x128x128x128_16x16_32x32_2x2_8x32x1_8x32x1_1x32x1x8_8_1x1_intrawave_v3,671.03,733.37,0.0
gfx942,304,26752,5120,3200,ck,0,0,1013.0832,a8w8_blockscale_1x128x128_256x128x128x128_16x16_32x32_2x2_8x32x1_8x32x1_1x32x1x8_8_1x1_intrawave_v3,865.29,371.08,0.0
gfx942,304,26880,5120,1024,ck,0,0,422.5298,a8w8_blockscale_1x128x128_256x128x128x128_16x16_32x32_2x2_8x32x1_8x32x1_1x32x1x8_8_1x1_intrawave_v3,667.07,728.99,0.0
gfx942,304,26880,5120,3200,ck,0,0,1054.3536,a8w8_blockscale_1x128x128_256x128x128x128_16x16_32x32_2x2_8x32x1_8x32x1_1x32x1x8_8_1x1_intrawave_v3,835.4,358.18,0.0
gfx942,304,27008,5120,1024,ck,0,0,418.5024,a8w8_blockscale_1x128x128_256x128x128x128_16x16_32x32_2x2_8x32x1_8x32x1_1x32x1x8_8_1x1_intrawave_v3,676.7,739.45,0.0
gfx942,304,27008,5120,3200,ck,0,0,998.9754,a8w8_blockscale_1x128x128_256x128x128x128_16x16_32x32_2x2_8x32x1_8x32x1_1x32x1x8_8_1x1_intrawave_v3,885.91,379.76,0.0
gfx942,304,27136,5120,1024,ck,0,0,418.3005,a8w8_blockscale_1x128x128_256x128x128x128_16x16_32x32_2x2_8x32x1_8x32x1_1x32x1x8_8_1x1_intrawave_v3,680.23,743.25,0.0
gfx942,304,27136,5120,3200,ck,0,0,1036.3858,a8w8_blockscale_1x128x128_256x128x128x128_16x16_32x32_2x2_8x32x1_8x32x1_1x32x1x8_8_1x1_intrawave_v3,857.97,367.71,0.0
gfx942,304,27264,5120,1024,ck,0,0,428.5372,a8w8_blockscale_1x128x128_256x128x128x128_16x16_32x32_2x2_8x32x1_8x32x1_1x32x1x8_8_1x1_intrawave_v3,667.12,728.86,0.0
gfx942,304,27264,5120,3200,ck,0,0,1041.9203,a8w8_blockscale_1x128x128_256x128x128x128_16x16_32x32_2x2_8x32x1_8x32x1_1x32x1x8_8_1x1_intrawave_v3,857.44,367.41,0.0
gfx942,304,27392,5120,1024,ck,0,0,429.3446,a8w8_blockscale_1x128x128_256x128x128x128_16x16_32x32_2x2_8x32x1_8x32x1_1x32x1x8_8_1x1_intrawave_v3,668.99,730.85,0.0
gfx942,304,27392,5120,3200,ck,0,0,1038.4212,a8w8_blockscale_1x128x128_256x128x128x128_16x16_32x32_2x2_8x32x1_8x32x1_1x32x1x8_8_1x1_intrawave_v3,864.37,370.3,0.0
gfx942,304,27520,5120,1024,ck,0,0,421.9562,a8w8_blockscale_1x128x128_256x128x128x128_16x16_32x32_2x2_8x32x1_8x32x1_1x32x1x8_8_1x1_intrawave_v3,683.88,747.06,0.0
gfx942,304,27520,5120,3200,ck,0,0,1043.2149,a8w8_blockscale_1x128x128_256x128x128x128_16x16_32x32_2x2_8x32x1_8x32x1_1x32x1x8_8_1x1_intrawave_v3,864.42,370.25,0.0
gfx942,304,27648,5120,1024,ck,0,0,429.6535,a8w8_blockscale_1x128x128_256x128x128x128_16x16_32x32_2x2_8x32x1_8x32x1_1x32x1x8_8_1x1_intrawave_v3,674.75,737.04,0.0
gfx942,304,27648,5120,3200,ck,0,0,1047.1401,a8w8_blockscale_1x128x128_256x128x128x128_16x16_32x32_2x2_8x32x1_8x32x1_1x32x1x8_8_1x1_intrawave_v3,865.18,370.51,0.0
gfx942,304,27776,5120,1024,ck,0,0,435.6453,a8w8_blockscale_1x128x128_256x128x128x128_16x16_32x32_2x2_8x32x1_8x32x1_1x32x1x8_8_1x1_intrawave_v3,668.55,730.21,0.0
gfx942,304,27776,5120,3200,ck,0,0,1041.4673,a8w8_blockscale_1x128x128_256x128x128x128_16x16_32x32_2x2_8x32x1_8x32x1_1x32x1x8_8_1x1_intrawave_v3,873.92,374.18,0.0
gfx942,304,27904,5120,1024,ck,0,0,434.8806,a8w8_blockscale_1x128x128_256x128x128x128_16x16_32x32_2x2_8x32x1_8x32x1_1x32x1x8_8_1x1_intrawave_v3,672.82,734.81,0.0
gfx942,304,27904,5120,3200,ck,0,0,1069.8353,a8w8_blockscale_1x128x128_256x128x128x128_16x16_32x32_2x2_8x32x1_8x32x1_1x32x1x8_8_1x1_intrawave_v3,854.67,365.86,0.0
gfx942,304,28032,5120,1024,ck,0,0,432.1495,a8w8_blockscale_1x128x128_256x128x128x128_16x16_32x32_2x2_8x32x1_8x32x1_1x32x1x8_8_1x1_intrawave_v3,680.17,742.79,0.0
gfx942,304,28032,5120,3200,ck,0,0,1071.1569,a8w8_blockscale_1x128x128_256x128x128x128_16x16_32x32_2x2_8x32x1_8x32x1_1x32x1x8_8_1x1_intrawave_v3,857.53,367.02,0.0
gfx942,304,28160,5120,1024,ck,0,0,444.7244,a8w8_blockscale_1x128x128_256x128x128x128_16x16_32x32_2x2_8x32x1_8x32x1_1x32x1x8_8_1x1_intrawave_v3,663.96,725.03,0.0
gfx942,304,28160,5120,3200,ck,0,0,1052.6928,a8w8_blockscale_1x128x128_256x128x128x128_16x16_32x32_2x2_8x32x1_8x32x1_1x32x1x8_8_1x1_intrawave_v3,876.56,375.09,0.0
gfx942,304,28288,5120,1024,ck,0,0,442.9483,a8w8_blockscale_1x128x128_256x128x128x128_16x16_32x32_2x2_8x32x1_8x32x1_1x32x1x8_8_1x1_intrawave_v3,669.65,731.19,0.0
gfx942,304,28288,5120,3200,ck,0,0,1058.024,a8w8_blockscale_1x128x128_256x128x128x128_16x16_32x32_2x2_8x32x1_8x32x1_1x32x1x8_8_1x1_intrawave_v3,876.11,374.83,0.0
gfx942,304,28416,5120,1024,ck,0,0,453.1364,a8w8_blockscale_1x128x128_256x128x128x128_16x16_32x32_2x2_8x32x1_8x32x1_1x32x1x8_8_1x1_intrawave_v3,657.56,717.93,0.0
gfx942,304,28416,5120,3200,ck,0,0,1095.5308,a8w8_blockscale_1x128x128_256x128x128x128_16x16_32x32_2x2_8x32x1_8x32x1_1x32x1x8_8_1x1_intrawave_v3,849.94,363.56,0.0
gfx942,304,28544,5120,1024,ck,0,0,442.5963,a8w8_blockscale_1x128x128_256x128x128x128_16x16_32x32_2x2_8x32x1_8x32x1_1x32x1x8_8_1x1_intrawave_v3,676.25,738.29,0.0
gfx942,304,28544,5120,3200,ck,0,0,1064.3515,a8w8_blockscale_1x128x128_256x128x128x128_16x16_32x32_2x2_8x32x1_8x32x1_1x32x1x8_8_1x1_intrawave_v3,878.78,375.83,0.0
gfx942,304,28672,5120,1024,ck,0,0,448.7052,a8w8_blockscale_1x128x128_256x128x128x128_16x16_32x32_2x2_8x32x1_8x32x1_1x32x1x8_8_1x1_intrawave_v3,670.03,731.45,0.0
gfx942,304,28672,5120,3200,ck,0,0,1095.6673,a8w8_blockscale_1x128x128_256x128x128x128_16x16_32x32_2x2_8x32x1_8x32x1_1x32x1x8_8_1x1_intrawave_v3,857.49,366.66,0.0
gfx942,304,28800,5120,1024,ck,0,0,442.3446,a8w8_blockscale_1x128x128_256x128x128x128_16x16_32x32_2x2_8x32x1_8x32x1_1x32x1x8_8_1x1_intrawave_v3,682.7,745.22,0.0
gfx942,304,28800,5120,3200,ck,0,0,1101.5838,a8w8_blockscale_1x128x128_256x128x128x128_16x16_32x32_2x2_8x32x1_8x32x1_1x32x1x8_8_1x1_intrawave_v3,856.69,366.25,0.0
gfx942,304,28928,5120,1024,ck,0,0,451.3339,a8w8_blockscale_1x128x128_256x128x128x128_16x16_32x32_2x2_8x32x1_8x32x1_1x32x1x8_8_1x1_intrawave_v3,672.08,733.58,0.0
gfx942,304,28928,5120,3200,ck,0,0,1080.0201,a8w8_blockscale_1x128x128_256x128x128x128_16x16_32x32_2x2_8x32x1_8x32x1_1x32x1x8_8_1x1_intrawave_v3,877.68,375.16,0.0
gfx942,304,29056,5120,1024,ck,0,0,446.2844,a8w8_blockscale_1x128x128_256x128x128x128_16x16_32x32_2x2_8x32x1_8x32x1_1x32x1x8_8_1x1_intrawave_v3,682.69,745.11,0.0
gfx942,304,29056,5120,3200,ck,0,0,1108.7748,a8w8_blockscale_1x128x128_256x128x128x128_16x16_32x32_2x2_8x32x1_8x32x1_1x32x1x8_8_1x1_intrawave_v3,858.7,366.98,0.0
gfx942,304,29184,5120,1024,ck,0,0,449.2927,a8w8_blockscale_1x128x128_256x128x128x128_16x16_32x32_2x2_8x32x1_8x32x1_1x32x1x8_8_1x1_intrawave_v3,681.11,743.33,0.0
gfx942,304,29184,5120,3200,ck,0,0,1122.005,a8w8_blockscale_1x128x128_256x128x128x128_16x16_32x32_2x2_8x32x1_8x32x1_1x32x1x8_8_1x1_intrawave_v3,852.31,364.18,0.0
gfx942,304,29312,5120,1024,ck,0,0,453.8506,a8w8_blockscale_1x128x128_256x128x128x128_16x16_32x32_2x2_8x32x1_8x32x1_1x32x1x8_8_1x1_intrawave_v3,677.22,739.04,0.0
gfx942,304,29312,5120,3200,ck,0,0,1124.4391,a8w8_blockscale_1x128x128_256x128x128x128_16x16_32x32_2x2_8x32x1_8x32x1_1x32x1x8_8_1x1_intrawave_v3,854.2,364.93,0.0
gfx942,304,29440,5120,1024,ck,0,0,456.7432,a8w8_blockscale_1x128x128_256x128x128x128_16x16_32x32_2x2_8x32x1_8x32x1_1x32x1x8_8_1x1_intrawave_v3,675.87,737.52,0.0
gfx942,304,29440,5120,3200,ck,0,0,1134.7761,a8w8_blockscale_1x128x128_256x128x128x128_16x16_32x32_2x2_8x32x1_8x32x1_1x32x1x8_8_1x1_intrawave_v3,850.11,363.12,0.0
gfx942,304,29568,5120,1024,ck,0,0,459.4439,a8w8_blockscale_1x128x128_256x128x128x128_16x16_32x32_2x2_8x32x1_8x32x1_1x32x1x8_8_1x1_intrawave_v3,674.82,736.32,0.0
gfx942,304,29568,5120,3200,ck,0,0,1133.7799,a8w8_blockscale_1x128x128_256x128x128x128_16x16_32x32_2x2_8x32x1_8x32x1_1x32x1x8_8_1x1_intrawave_v3,854.56,364.95,0.0
gfx942,304,29696,5120,1024,ck,0,0,468.0872,a8w8_blockscale_1x128x128_256x128x128x128_16x16_32x32_2x2_8x32x1_8x32x1_1x32x1x8_8_1x1_intrawave_v3,665.23,725.8,0.0
gfx942,304,29696,5120,3200,ck,0,0,1130.3713,a8w8_blockscale_1x128x128_256x128x128x128_16x16_32x32_2x2_8x32x1_8x32x1_1x32x1x8_8_1x1_intrawave_v3,860.85,367.58,0.0
gfx942,304,29824,5120,1024,ck,0,0,470.8109,a8w8_blockscale_1x128x128_256x128x128x128_16x16_32x32_2x2_8x32x1_8x32x1_1x32x1x8_8_1x1_intrawave_v3,664.23,724.67,0.0
gfx942,304,29824,5120,3200,ck,0,0,1140.964,a8w8_blockscale_1x128x128_256x128x128x128_16x16_32x32_2x2_8x32x1_8x32x1_1x32x1x8_8_1x1_intrawave_v3,856.53,365.67,0.0
gfx942,304,29952,5120,1024,ck,0,0,460.5946,a8w8_blockscale_1x128x128_256x128x128x128_16x16_32x32_2x2_8x32x1_8x32x1_1x32x1x8_8_1x1_intrawave_v3,681.88,743.87,0.0
gfx942,304,29952,5120,3200,ck,0,0,1147.3547,a8w8_blockscale_1x128x128_256x128x128x128_16x16_32x32_2x2_8x32x1_8x32x1_1x32x1x8_8_1x1_intrawave_v3,855.42,365.13,0.0
gfx942,304,30080,5120,1024,ck,0,0,468.1465,a8w8_blockscale_1x128x128_256x128x128x128_16x16_32x32_2x2_8x32x1_8x32x1_1x32x1x8_8_1x1_intrawave_v3,673.75,734.95,0.0
gfx942,304,30080,5120,3200,ck,0,0,1188.4618,a8w8_blockscale_1x128x128_256x128x128x128_16x16_32x32_2x2_8x32x1_8x32x1_1x32x1x8_8_1x1_intrawave_v3,829.36,353.95,0.0
gfx942,304,30208,5120,1024,ck,0,0,475.8346,a8w8_blockscale_1x128x128_256x128x128x128_16x16_32x32_2x2_8x32x1_8x32x1_1x32x1x8_8_1x1_intrawave_v3,665.68,726.1,0.0
gfx942,304,30208,5120,3200,ck,0,0,1170.8234,a8w8_blockscale_1x128x128_256x128x128x128_16x16_32x32_2x2_8x32x1_8x32x1_1x32x1x8_8_1x1_intrawave_v3,845.44,360.75,0.0
gfx942,304,30336,5120,1024,ck,0,0,465.5602,a8w8_blockscale_1x128x128_256x128x128x128_16x16_32x32_2x2_8x32x1_8x32x1_1x32x1x8_8_1x1_intrawave_v3,683.25,745.23,0.0
gfx942,304,30336,5120,3200,ck,0,0,1163.0914,a8w8_blockscale_1x128x128_256x128x128x128_16x16_32x32_2x2_8x32x1_8x32x1_1x32x1x8_8_1x1_intrawave_v3,854.66,364.63,0.0
gfx942,304,30464,5120,1024,ck,0,0,466.1369,a8w8_blockscale_1x128x128_256x128x128x128_16x16_32x32_2x2_8x32x1_8x32x1_1x32x1x8_8_1x1_intrawave_v3,685.29,747.4,0.0
gfx942,304,30464,5120,3200,ck,0,0,1167.9967,a8w8_blockscale_1x128x128_256x128x128x128_16x16_32x32_2x2_8x32x1_8x32x1_1x32x1x8_8_1x1_intrawave_v3,854.66,364.57,0.0
gfx942,304,30592,5120,1024,ck,0,0,471.8318,a8w8_blockscale_1x128x128_256x128x128x128_16x16_32x32_2x2_8x32x1_8x32x1_1x32x1x8_8_1x1_intrawave_v3,679.86,741.43,0.0
gfx942,304,30592,5120,3200,ck,0,0,1171.5471,a8w8_blockscale_1x128x128_256x128x128x128_16x16_32x32_2x2_8x32x1_8x32x1_1x32x1x8_8_1x1_intrawave_v3,855.65,364.94,0.0
gfx942,304,30720,5120,1024,ck,0,0,471.63,a8w8_blockscale_1x128x128_256x128x128x128_16x16_32x32_2x2_8x32x1_8x32x1_1x32x1x8_8_1x1_intrawave_v3,683.0,744.81,0.0
gfx942,304,30720,5120,3200,ck,0,0,1169.9171,a8w8_blockscale_1x128x128_256x128x128x128_16x16_32x32_2x2_8x32x1_8x32x1_1x32x1x8_8_1x1_intrawave_v3,860.43,366.92,0.0
gfx942,304,30848,5120,1024,ck,0,0,478.7087,a8w8_blockscale_1x128x128_256x128x128x128_16x16_32x32_2x2_8x32x1_8x32x1_1x32x1x8_8_1x1_intrawave_v3,675.7,736.8,0.0
gfx942,304,30848,5120,3200,ck,0,0,1190.7075,a8w8_blockscale_1x128x128_256x128x128x128_16x16_32x32_2x2_8x32x1_8x32x1_1x32x1x8_8_1x1_intrawave_v3,848.93,361.95,0.0
gfx942,304,30976,5120,1024,ck,0,0,475.0496,a8w8_blockscale_1x128x128_256x128x128x128_16x16_32x32_2x2_8x32x1_8x32x1_1x32x1x8_8_1x1_intrawave_v3,683.73,745.51,0.0
gfx942,304,30976,5120,3200,ck,0,0,1155.2297,a8w8_blockscale_1x128x128_256x128x128x128_16x16_32x32_2x2_8x32x1_8x32x1_1x32x1x8_8_1x1_intrawave_v3,878.63,374.56,0.0
gfx942,304,31104,5120,1024,ck,0,0,481.398,a8w8_blockscale_1x128x128_256x128x128x128_16x16_32x32_2x2_8x32x1_8x32x1_1x32x1x8_8_1x1_intrawave_v3,677.5,738.68,0.0
gfx942,304,31104,5120,3200,ck,0,0,1157.1839,a8w8_blockscale_1x128x128_256x128x128x128_16x16_32x32_2x2_8x32x1_8x32x1_1x32x1x8_8_1x1_intrawave_v3,880.77,375.41,0.0
gfx942,304,31232,5120,1024,ck,0,0,479.0276,a8w8_blockscale_1x128x128_256x128x128x128_16x16_32x32_2x2_8x32x1_8x32x1_1x32x1x8_8_1x1_intrawave_v3,683.66,745.34,0.0
gfx942,304,31232,5120,3200,ck,0,0,1164.3977,a8w8_blockscale_1x128x128_256x128x128x128_16x16_32x32_2x2_8x32x1_8x32x1_1x32x1x8_8_1x1_intrawave_v3,878.92,374.56,0.0
gfx942,304,31360,5120,1024,ck,0,0,482.554,a8w8_blockscale_1x128x128_256x128x128x128_16x16_32x32_2x2_8x32x1_8x32x1_1x32x1x8_8_1x1_intrawave_v3,681.44,742.88,0.0
gfx942,304,31360,5120,3200,ck,0,0,1208.0952,a8w8_blockscale_1x128x128_256x128x128x128_16x16_32x32_2x2_8x32x1_8x32x1_1x32x1x8_8_1x1_intrawave_v3,850.6,362.44,0.0
gfx942,304,31488,5120,1024,ck,0,0,494.0662,a8w8_blockscale_1x128x128_256x128x128x128_16x16_32x32_2x2_8x32x1_8x32x1_1x32x1x8_8_1x1_intrawave_v3,668.28,728.49,0.0
gfx942,304,31488,5120,3200,ck,0,0,1174.2462,a8w8_blockscale_1x128x128_256x128x128x128_16x16_32x32_2x2_8x32x1_8x32x1_1x32x1x8_8_1x1_intrawave_v3,878.69,374.35,0.0
gfx942,304,31616,5120,1024,ck,0,0,480.658,a8w8_blockscale_1x128x128_256x128x128x128_16x16_32x32_2x2_8x32x1_8x32x1_1x32x1x8_8_1x1_intrawave_v3,689.72,751.81,0.0
gfx942,304,31616,5120,3200,ck,0,0,1223.2603,a8w8_blockscale_1x128x128_256x128x128x128_16x16_32x32_2x2_8x32x1_8x32x1_1x32x1x8_8_1x1_intrawave_v3,846.91,360.76,0.0
gfx942,304,31744,5120,1024,ck,0,0,495.8517,a8w8_blockscale_1x128x128_256x128x128x128_16x16_32x32_2x2_8x32x1_8x32x1_1x32x1x8_8_1x1_intrawave_v3,671.29,731.69,0.0
gfx942,304,31744,5120,3200,ck,0,0,1186.3847,a8w8_blockscale_1x128x128_256x128x128x128_16x16_32x32_2x2_8x32x1_8x32x1_1x32x1x8_8_1x1_intrawave_v3,876.77,373.42,0.0
gfx942,304,31872,5120,1024,ck,0,0,485.4822,a8w8_blockscale_1x128x128_256x128x128x128_16x16_32x32_2x2_8x32x1_8x32x1_1x32x1x8_8_1x1_intrawave_v3,688.39,750.28,0.0
gfx942,304,31872,5120,3200,ck,0,0,1257.446,a8w8_blockscale_1x128x128_256x128x128x128_16x16_32x32_2x2_8x32x1_8x32x1_1x32x1x8_8_1x1_intrawave_v3,830.56,353.69,0.0
gfx942,304,32000,5120,1024,ck,0,0,499.9569,a8w8_blockscale_1x128x128_256x128x128x128_16x16_32x32_2x2_8x32x1_8x32x1_1x32x1x8_8_1x1_intrawave_v3,671.15,731.44,0.0
gfx942,304,32000,5120,3200,ck,0,0,1236.197,a8w8_blockscale_1x128x128_256x128x128x128_16x16_32x32_2x2_8x32x1_8x32x1_1x32x1x8_8_1x1_intrawave_v3,848.23,361.16,0.0
gfx942,304,32128,5120,1024,ck,0,0,503.0695,a8w8_blockscale_1x128x128_256x128x128x128_16x16_32x32_2x2_8x32x1_8x32x1_1x32x1x8_8_1x1_intrawave_v3,669.66,729.79,0.0
gfx942,304,32128,5120,3200,ck,0,0,1212.9522,a8w8_blockscale_1x128x128_256x128x128x128_16x16_32x32_2x2_8x32x1_8x32x1_1x32x1x8_8_1x1_intrawave_v3,867.94,369.5,0.0
gfx942,304,32256,5120,1024,ck,0,0,501.0073,a8w8_blockscale_1x128x128_256x128x128x128_16x16_32x32_2x2_8x32x1_8x32x1_1x32x1x8_8_1x1_intrawave_v3,675.1,735.67,0.0
gfx942,304,32256,5120,3200,ck,0,0,1274.8742,a8w8_blockscale_1x128x128_256x128x128x128_16x16_32x32_2x2_8x32x1_8x32x1_1x32x1x8_8_1x1_intrawave_v3,829.07,352.9,0.0
gfx942,304,32384,5120,1024,ck,0,0,503.7409,a8w8_blockscale_1x128x128_256x128x128x128_16x16_32x32_2x2_8x32x1_8x32x1_1x32x1x8_8_1x1_intrawave_v3,674.1,734.54,0.0
gfx942,304,32384,5120,3200,ck,0,0,1291.916,a8w8_blockscale_1x128x128_256x128x128x128_16x16_32x32_2x2_8x32x1_8x32x1_1x32x1x8_8_1x1_intrawave_v3,821.38,349.58,0.0
gfx942,304,32512,5120,1024,ck,0,0,499.5542,a8w8_blockscale_1x128x128_256x128x128x128_16x16_32x32_2x2_8x32x1_8x32x1_1x32x1x8_8_1x1_intrawave_v3,682.43,743.58,0.0
gfx942,304,32512,5120,3200,ck,0,0,1260.0678,a8w8_blockscale_1x128x128_256x128x128x128_16x16_32x32_2x2_8x32x1_8x32x1_1x32x1x8_8_1x1_intrawave_v3,845.47,359.78,0.0
gfx942,304,32640,5120,1024,ck,0,0,520.6251,a8w8_blockscale_1x128x128_256x128x128x128_16x16_32x32_2x2_8x32x1_8x32x1_1x32x1x8_8_1x1_intrawave_v3,657.39,716.25,0.0
gfx942,304,32640,5120,3200,ck,0,0,1238.5606,a8w8_blockscale_1x128x128_256x128x128x128_16x16_32x32_2x2_8x32x1_8x32x1_1x32x1x8_8_1x1_intrawave_v3,863.54,367.41,0.0
gfx942,304,32768,5120,1024,ck,0,0,502.5916,a8w8_blockscale_1x128x128_256x128x128x128_16x16_32x32_2x2_8x32x1_8x32x1_1x32x1x8_8_1x1_intrawave_v3,683.65,744.82,0.0
gfx942,304,32768,5120,3200,ck,0,0,1226.4264,a8w8_blockscale_1x128x128_256x128x128x128_16x16_32x32_2x2_8x32x1_8x32x1_1x32x1x8_8_1x1_intrawave_v3,875.5,372.45,0.0
gfx942,304,32896,5120,1024,ck,0,0,506.9763,a8w8_blockscale_1x128x128_256x128x128x128_16x16_32x32_2x2_8x32x1_8x32x1_1x32x1x8_8_1x1_intrawave_v3,680.39,741.22,0.0
gfx942,304,32896,5120,3200,ck,0,0,1222.2092,a8w8_blockscale_1x128x128_256x128x128x128_16x16_32x32_2x2_8x32x1_8x32x1_1x32x1x8_8_1x1_intrawave_v3,881.96,375.15,0.0
gfx942,304,33024,5120,1024,ck,0,0,507.0209,a8w8_blockscale_1x128x128_256x128x128x128_16x16_32x32_2x2_8x32x1_8x32x1_1x32x1x8_8_1x1_intrawave_v3,682.97,744.0,0.0
gfx942,304,33024,5120,3200,ck,0,0,1270.519,a8w8_blockscale_1x128x128_256x128x128x128_16x16_32x32_2x2_8x32x1_8x32x1_1x32x1x8_8_1x1_intrawave_v3,851.72,362.24,0.0
gfx942,304,33152,5120,1024,ck,0,0,513.3688,a8w8_blockscale_1x128x128_256x128x128x128_16x16_32x32_2x2_8x32x1_8x32x1_1x32x1x8_8_1x1_intrawave_v3,677.14,737.61,0.0
gfx942,304,33152,5120,3200,ck,0,0,1270.3605,a8w8_blockscale_1x128x128_256x128x128x128_16x16_32x32_2x2_8x32x1_8x32x1_1x32x1x8_8_1x1_intrawave_v3,855.13,363.63,0.0
gfx942,304,33280,5120,1024,ck,0,0,518.8892,a8w8_blockscale_1x128x128_256x128x128x128_16x16_32x32_2x2_8x32x1_8x32x1_1x32x1x8_8_1x1_intrawave_v3,672.53,732.54,0.0
gfx942,304,33280,5120,3200,ck,0,0,1280.4178,a8w8_blockscale_1x128x128_256x128x128x128_16x16_32x32_2x2_8x32x1_8x32x1_1x32x1x8_8_1x1_intrawave_v3,851.69,362.12,0.0
gfx942,304,33408,5120,1024,ck,0,0,528.9736,a8w8_blockscale_1x128x128_256x128x128x128_16x16_32x32_2x2_8x32x1_8x32x1_1x32x1x8_8_1x1_intrawave_v3,662.24,721.3,0.0
gfx942,304,33408,5120,3200,ck,0,0,1290.1261,a8w8_blockscale_1x128x128_256x128x128x128_16x16_32x32_2x2_8x32x1_8x32x1_1x32x1x8_8_1x1_intrawave_v3,848.53,360.73,0.0
gfx942,304,33536,5120,1024,ck,0,0,520.1727,a8w8_blockscale_1x128x128_256x128x128x128_16x16_32x32_2x2_8x32x1_8x32x1_1x32x1x8_8_1x1_intrawave_v3,676.03,736.28,0.0
gfx942,304,33536,5120,3200,ck,0,0,1252.7708,a8w8_blockscale_1x128x128_256x128x128x128_16x16_32x32_2x2_8x32x1_8x32x1_1x32x1x8_8_1x1_intrawave_v3,877.18,372.86,0.0
gfx942,304,33664,5120,1024,ck,0,0,522.9592,a8w8_blockscale_1x128x128_256x128x128x128_16x16_32x32_2x2_8x32x1_8x32x1_1x32x1x8_8_1x1_intrawave_v3,674.99,735.11,0.0
gfx942,304,33664,5120,3200,ck,0,0,1294.4024,a8w8_blockscale_1x128x128_256x128x128x128_16x16_32x32_2x2_8x32x1_8x32x1_1x32x1x8_8_1x1_intrawave_v3,852.21,362.2,0.0
gfx942,304,33792,5120,1024,ck,0,0,519.5595,a8w8_blockscale_1x128x128_256x128x128x128_16x16_32x32_2x2_8x32x1_8x32x1_1x32x1x8_8_1x1_intrawave_v3,681.99,742.7,0.0
gfx942,304,33792,5120,3200,ck,0,0,1275.2466,a8w8_blockscale_1x128x128_256x128x128x128_16x16_32x32_2x2_8x32x1_8x32x1_1x32x1x8_8_1x1_intrawave_v3,868.3,368.99,0.0
gfx942,304,33920,5120,1024,ck,0,0,524.1832,a8w8_blockscale_1x128x128_256x128x128x128_16x16_32x32_2x2_8x32x1_8x32x1_1x32x1x8_8_1x1_intrawave_v3,678.54,738.9,0.0
gfx942,304,33920,5120,3200,ck,0,0,1293.8446,a8w8_blockscale_1x128x128_256x128x128x128_16x16_32x32_2x2_8x32x1_8x32x1_1x32x1x8_8_1x1_intrawave_v3,859.06,365.01,0.0
gfx942,304,34048,5120,1024,ck,0,0,524.8567,a8w8_blockscale_1x128x128_256x128x128x128_16x16_32x32_2x2_8x32x1_8x32x1_1x32x1x8_8_1x1_intrawave_v3,680.22,740.7,0.0
gfx942,304,34048,5120,3200,ck,0,0,1337.6057,a8w8_blockscale_1x128x128_256x128x128x128_16x16_32x32_2x2_8x32x1_8x32x1_1x32x1x8_8_1x1_intrawave_v3,834.09,354.36,0.0
gfx942,304,34176,5120,1024,ck,0,0,530.3844,a8w8_blockscale_1x128x128_256x128x128x128_16x16_32x32_2x2_8x32x1_8x32x1_1x32x1x8_8_1x1_intrawave_v3,675.66,735.7,0.0
gfx942,304,34176,5120,3200,ck,0,0,1280.2803,a8w8_blockscale_1x128x128_256x128x128x128_16x16_32x32_2x2_8x32x1_8x32x1_1x32x1x8_8_1x1_intrawave_v3,874.71,371.57,0.0
gfx942,304,34304,5120,1024,ck,0,0,527.9658,a8w8_blockscale_1x128x128_256x128x128x128_16x16_32x32_2x2_8x32x1_8x32x1_1x32x1x8_8_1x1_intrawave_v3,681.3,741.8,0.0
gfx942,304,34304,5120,3200,ck,0,0,1306.9011,a8w8_blockscale_1x128x128_256x128x128x128_16x16_32x32_2x2_8x32x1_8x32x1_1x32x1x8_8_1x1_intrawave_v3,860.11,365.31,0.0
gfx942,304,34432,5120,1024,ck,0,0,528.6134,a8w8_blockscale_1x128x128_256x128x128x128_16x16_32x32_2x2_8x32x1_8x32x1_1x32x1x8_8_1x1_intrawave_v3,683.01,743.62,0.0
gfx942,304,34432,5120,3200,ck,0,0,1309.9136,a8w8_blockscale_1x128x128_256x128x128x128_16x16_32x32_2x2_8x32x1_8x32x1_1x32x1x8_8_1x1_intrawave_v3,861.33,365.79,0.0
gfx942,304,34560,5120,1024,ck,0,0,540.0481,a8w8_blockscale_1x128x128_256x128x128x128_16x16_32x32_2x2_8x32x1_8x32x1_1x32x1x8_8_1x1_intrawave_v3,671.03,730.54,0.0
gfx942,304,34560,5120,3200,ck,0,0,1308.3011,a8w8_blockscale_1x128x128_256x128x128x128_16x16_32x32_2x2_8x32x1_8x32x1_1x32x1x8_8_1x1_intrawave_v3,865.6,367.55,0.0
gfx942,304,34688,5120,1024,ck,0,0,535.0601,a8w8_blockscale_1x128x128_256x128x128x128_16x16_32x32_2x2_8x32x1_8x32x1_1x32x1x8_8_1x1_intrawave_v3,679.79,740.04,0.0
gfx942,304,34688,5120,3200,ck,0,0,1285.6912,a8w8_blockscale_1x128x128_256x128x128x128_16x16_32x32_2x2_8x32x1_8x32x1_1x32x1x8_8_1x1_intrawave_v3,884.08,375.36,0.0
gfx942,304,34816,5120,1024,ck,0,0,538.3468,a8w8_blockscale_1x128x128_256x128x128x128_16x16_32x32_2x2_8x32x1_8x32x1_1x32x1x8_8_1x1_intrawave_v3,678.14,738.21,0.0
gfx942,304,34816,5120,3200,ck,0,0,1331.4324,a8w8_blockscale_1x128x128_256x128x128x128_16x16_32x32_2x2_8x32x1_8x32x1_1x32x1x8_8_1x1_intrawave_v3,856.86,363.75,0.0
gfx942,304,34944,5120,1024,ck,0,0,530.5162,a8w8_blockscale_1x128x128_256x128x128x128_16x16_32x32_2x2_8x32x1_8x32x1_1x32x1x8_8_1x1_intrawave_v3,690.68,751.82,0.0
gfx942,304,34944,5120,3200,ck,0,0,1337.6528,a8w8_blockscale_1x128x128_256x128x128x128_16x16_32x32_2x2_8x32x1_8x32x1_1x32x1x8_8_1x1_intrawave_v3,856.01,363.35,0.0
gfx942,304,35072,5120,1024,ck,0,0,541.7286,a8w8_blockscale_1x128x128_256x128x128x128_16x16_32x32_2x2_8x32x1_8x32x1_1x32x1x8_8_1x1_intrawave_v3,678.86,738.92,0.0
gfx942,304,35072,5120,3200,ck,0,0,1341.1539,a8w8_blockscale_1x128x128_256x128x128x128_16x16_32x32_2x2_8x32x1_8x32x1_1x32x1x8_8_1x1_intrawave_v3,856.9,363.68,0.0
gfx942,304,35200,5120,1024,ck,0,0,535.4023,a8w8_blockscale_1x128x128_256x128x128x128_16x16_32x32_2x2_8x32x1_8x32x1_1x32x1x8_8_1x1_intrawave_v3,689.39,750.34,0.0
gfx942,304,35200,5120,3200,ck,0,0,1314.1249,a8w8_blockscale_1x128x128_256x128x128x128_16x16_32x32_2x2_8x32x1_8x32x1_1x32x1x8_8_1x1_intrawave_v3,877.72,372.47,0.0
gfx942,304,35328,5120,1024,ck,0,0,539.0945,a8w8_blockscale_1x128x128_256x128x128x128_16x16_32x32_2x2_8x32x1_8x32x1_1x32x1x8_8_1x1_intrawave_v3,687.15,747.88,0.0
gfx942,304,35328,5120,3200,ck,0,0,1356.6379,a8w8_blockscale_1x128x128_256x128x128x128_16x16_32x32_2x2_8x32x1_8x32x1_1x32x1x8_8_1x1_intrawave_v3,853.31,362.07,0.0
gfx942,304,35456,5120,1024,ck,0,0,551.2399,a8w8_blockscale_1x128x128_256x128x128x128_16x16_32x32_2x2_8x32x1_8x32x1_1x32x1x8_8_1x1_intrawave_v3,674.45,734.02,0.0
gfx942,304,35456,5120,3200,ck,0,0,1370.4918,a8w8_blockscale_1x128x128_256x128x128x128_16x16_32x32_2x2_8x32x1_8x32x1_1x32x1x8_8_1x1_intrawave_v3,847.74,359.66,0.0
gfx942,304,35584,5120,1024,ck,0,0,545.5818,a8w8_blockscale_1x128x128_256x128x128x128_16x16_32x32_2x2_8x32x1_8x32x1_1x32x1x8_8_1x1_intrawave_v3,683.9,744.27,0.0
gfx942,304,35584,5120,3200,ck,0,0,1367.1645,a8w8_blockscale_1x128x128_256x128x128x128_16x16_32x32_2x2_8x32x1_8x32x1_1x32x1x8_8_1x1_intrawave_v3,852.87,361.79,0.0
gfx942,304,35712,5120,1024,ck,0,0,543.094,a8w8_blockscale_1x128x128_256x128x128x128_16x16_32x32_2x2_8x32x1_8x32x1_1x32x1x8_8_1x1_intrawave_v3,689.51,750.34,0.0
gfx942,304,35712,5120,3200,ck,0,0,1322.7356,a8w8_blockscale_1x128x128_256x128x128x128_16x16_32x32_2x2_8x32x1_8x32x1_1x32x1x8_8_1x1_intrawave_v3,884.69,375.25,0.0
gfx942,304,35840,5120,1024,ck,0,0,545.738,a8w8_blockscale_1x128x128_256x128x128x128_16x16_32x32_2x2_8x32x1_8x32x1_1x32x1x8_8_1x1_intrawave_v3,688.63,749.34,0.0
gfx942,304,35840,5120,3200,ck,0,0,1353.3763,a8w8_blockscale_1x128x128_256x128x128x128_16x16_32x32_2x2_8x32x1_8x32x1_1x32x1x8_8_1x1_intrawave_v3,867.76,368.02,0.0
gfx942,304,35968,5120,1024,ck,0,0,564.3034,a8w8_blockscale_1x128x128_256x128x128x128_16x16_32x32_2x2_8x32x1_8x32x1_1x32x1x8_8_1x1_intrawave_v3,668.35,727.24,0.0
gfx942,304,35968,5120,3200,ck,0,0,1375.288,a8w8_blockscale_1x128x128_256x128x128x128_16x16_32x32_2x2_8x32x1_8x32x1_1x32x1x8_8_1x1_intrawave_v3,856.98,363.41,0.0
gfx942,304,36096,5120,1024,ck,0,0,563.7171,a8w8_blockscale_1x128x128_256x128x128x128_16x16_32x32_2x2_8x32x1_8x32x1_1x32x1x8_8_1x1_intrawave_v3,671.43,730.56,0.0
gfx942,304,36096,5120,3200,ck,0,0,1378.0861,a8w8_blockscale_1x128x128_256x128x128x128_16x16_32x32_2x2_8x32x1_8x32x1_1x32x1x8_8_1x1_intrawave_v3,858.29,363.92,0.0
gfx942,304,36224,5120,1024,ck,0,0,556.5791,a8w8_blockscale_1x128x128_256x128x128x128_16x16_32x32_2x2_8x32x1_8x32x1_1x32x1x8_8_1x1_intrawave_v3,682.45,742.52,0.0
gfx942,304,36224,5120,3200,ck,0,0,1385.559,a8w8_blockscale_1x128x128_256x128x128x128_16x16_32x32_2x2_8x32x1_8x32x1_1x32x1x8_8_1x1_intrawave_v3,856.69,363.2,0.0
gfx942,304,36352,5120,1024,ck,0,0,552.9048,a8w8_blockscale_1x128x128_256x128x128x128_16x16_32x32_2x2_8x32x1_8x32x1_1x32x1x8_8_1x1_intrawave_v3,689.41,750.06,0.0
gfx942,304,36352,5120,3200,ck,0,0,1356.4002,a8w8_blockscale_1x128x128_256x128x128x128_16x16_32x32_2x2_8x32x1_8x32x1_1x32x1x8_8_1x1_intrawave_v3,878.19,372.28,0.0
gfx942,304,36480,5120,1024,ck,0,0,569.3022,a8w8_blockscale_1x128x128_256x128x128x128_16x16_32x32_2x2_8x32x1_8x32x1_1x32x1x8_8_1x1_intrawave_v3,671.91,730.99,0.0
gfx942,304,36480,5120,3200,ck,0,0,1399.3579,a8w8_blockscale_1x128x128_256x128x128x128_16x16_32x32_2x2_8x32x1_8x32x1_1x32x1x8_8_1x1_intrawave_v3,854.23,362.08,0.0
gfx942,304,36608,5120,1024,ck,0,0,561.2845,a8w8_blockscale_1x128x128_256x128x128x128_16x16_32x32_2x2_8x32x1_8x32x1_1x32x1x8_8_1x1_intrawave_v3,683.9,744.0,0.0
gfx942,304,36608,5120,3200,ck,0,0,1389.0718,a8w8_blockscale_1x128x128_256x128x128x128_16x16_32x32_2x2_8x32x1_8x32x1_1x32x1x8_8_1x1_intrawave_v3,863.58,366.0,0.0
gfx942,304,36736,5120,1024,ck,0,0,567.7781,a8w8_blockscale_1x128x128_256x128x128x128_16x16_32x32_2x2_8x32x1_8x32x1_1x32x1x8_8_1x1_intrawave_v3,678.44,738.03,0.0
gfx942,304,36736,5120,3200,ck,0,0,1387.5319,a8w8_blockscale_1x128x128_256x128x128x128_16x16_32x32_2x2_8x32x1_8x32x1_1x32x1x8_8_1x1_intrawave_v3,867.56,367.64,0.0
gfx942,304,36864,5120,1024,ck,0,0,565.3706,a8w8_blockscale_1x128x128_256x128x128x128_16x16_32x32_2x2_8x32x1_8x32x1_1x32x1x8_8_1x1_intrawave_v3,683.71,743.72,0.0
gfx942,304,36864,5120,3200,ck,0,0,1406.1392,a8w8_blockscale_1x128x128_256x128x128x128_16x16_32x32_2x2_8x32x1_8x32x1_1x32x1x8_8_1x1_intrawave_v3,859.06,364.0,0.0
gfx942,304,36992,5120,1024,ck,0,0,571.2907,a8w8_blockscale_1x128x128_256x128x128x128_16x16_32x32_2x2_8x32x1_8x32x1_1x32x1x8_8_1x1_intrawave_v3,678.97,738.54,0.0
gfx942,304,36992,5120,3200,ck,0,0,1463.5898,a8w8_blockscale_1x128x128_256x128x128x128_16x16_32x32_2x2_8x32x1_8x32x1_1x32x1x8_8_1x1_intrawave_v3,828.21,350.89,0.0
gfx942,304,37120,5120,1024,ck,0,0,572.9053,a8w8_blockscale_1x128x128_256x128x128x128_16x16_32x32_2x2_8x32x1_8x32x1_1x32x1x8_8_1x1_intrawave_v3,679.4,738.97,0.0
gfx942,304,37120,5120,3200,ck,0,0,1384.9432,a8w8_blockscale_1x128x128_256x128x128x128_16x16_32x32_2x2_8x32x1_8x32x1_1x32x1x8_8_1x1_intrawave_v3,878.27,372.06,0.0
gfx942,304,37248,5120,1024,ck,0,0,577.7617,a8w8_blockscale_1x128x128_256x128x128x128_16x16_32x32_2x2_8x32x1_8x32x1_1x32x1x8_8_1x1_intrawave_v3,676.01,735.26,0.0
gfx942,304,37248,5120,3200,ck,0,0,1402.2392,a8w8_blockscale_1x128x128_256x128x128x128_16x16_32x32_2x2_8x32x1_8x32x1_1x32x1x8_8_1x1_intrawave_v3,870.42,368.69,0.0
gfx942,304,37376,5120,1024,ck,0,0,568.5093,a8w8_blockscale_1x128x128_256x128x128x128_16x16_32x32_2x2_8x32x1_8x32x1_1x32x1x8_8_1x1_intrawave_v3,689.37,749.76,0.0
gfx942,304,37376,5120,3200,ck,0,0,1427.8424,a8w8_blockscale_1x128x128_256x128x128x128_16x16_32x32_2x2_8x32x1_8x32x1_1x32x1x8_8_1x1_intrawave_v3,857.75,363.29,0.0
gfx942,304,37504,5120,1024,ck,0,0,573.5509,a8w8_blockscale_1x128x128_256x128x128x128_16x16_32x32_2x2_8x32x1_8x32x1_1x32x1x8_8_1x1_intrawave_v3,685.65,745.68,0.0
gfx942,304,37504,5120,3200,ck,0,0,1390.41,a8w8_blockscale_1x128x128_256x128x128x128_16x16_32x32_2x2_8x32x1_8x32x1_1x32x1x8_8_1x1_intrawave_v3,883.86,374.31,0.0
gfx942,304,37632,5120,1024,ck,0,0,581.2974,a8w8_blockscale_1x128x128_256x128x128x128_16x16_32x32_2x2_8x32x1_8x32x1_1x32x1x8_8_1x1_intrawave_v3,678.83,738.23,0.0
gfx942,304,37632,5120,3200,ck,0,0,1420.1421,a8w8_blockscale_1x128x128_256x128x128x128_16x16_32x32_2x2_8x32x1_8x32x1_1x32x1x8_8_1x1_intrawave_v3,868.31,367.68,0.0
gfx942,304,37760,5120,1024,ck,0,0,580.2659,a8w8_blockscale_1x128x128_256x128x128x128_16x16_32x32_2x2_8x32x1_8x32x1_1x32x1x8_8_1x1_intrawave_v3,682.35,742.02,0.0
gfx942,304,37760,5120,3200,ck,0,0,1407.7306,a8w8_blockscale_1x128x128_256x128x128x128_16x16_32x32_2x2_8x32x1_8x32x1_1x32x1x8_8_1x1_intrawave_v3,878.95,372.14,0.0
gfx942,304,37888,5120,1024,ck,0,0,577.3068,a8w8_blockscale_1x128x128_256x128x128x128_16x16_32x32_2x2_8x32x1_8x32x1_1x32x1x8_8_1x1_intrawave_v3,688.17,748.33,0.0
gfx942,304,37888,5120,3200,ck,0,0,1397.8393,a8w8_blockscale_1x128x128_256x128x128x128_16x16_32x32_2x2_8x32x1_8x32x1_1x32x1x8_8_1x1_intrawave_v3,888.17,376.01,0.0
gfx942,304,38016,5120,1024,ck,0,0,587.4304,a8w8_blockscale_1x128x128_256x128x128x128_16x16_32x32_2x2_8x32x1_8x32x1_1x32x1x8_8_1x1_intrawave_v3,678.59,737.88,0.0
gfx942,304,38016,5120,3200,ck,0,0,1424.7143,a8w8_blockscale_1x128x128_256x128x128x128_16x16_32x32_2x2_8x32x1_8x32x1_1x32x1x8_8_1x1_intrawave_v3,874.36,370.12,0.0
gfx942,304,38144,5120,1024,ck,0,0,586.8034,a8w8_blockscale_1x128x128_256x128x128x128_16x16_32x32_2x2_8x32x1_8x32x1_1x32x1x8_8_1x1_intrawave_v3,681.61,741.13,0.0
gfx942,304,38144,5120,3200,ck,0,0,1452.4682,a8w8_blockscale_1x128x128_256x128x128x128_16x16_32x32_2x2_8x32x1_8x32x1_1x32x1x8_8_1x1_intrawave_v3,860.54,364.23,0.0
gfx942,304,38272,5120,1024,ck,0,0,586.0066,a8w8_blockscale_1x128x128_256x128x128x128_16x16_32x32_2x2_8x32x1_8x32x1_1x32x1x8_8_1x1_intrawave_v3,684.82,744.6,0.0
gfx942,304,38272,5120,3200,ck,0,0,1455.8682,a8w8_blockscale_1x128x128_256x128x128x128_16x16_32x32_2x2_8x32x1_8x32x1_1x32x1x8_8_1x1_intrawave_v3,861.41,364.57,0.0
gfx942,304,38400,5120,1024,ck,0,0,587.557,a8w8_blockscale_1x128x128_256x128x128x128_16x16_32x32_2x2_8x32x1_8x32x1_1x32x1x8_8_1x1_intrawave_v3,685.3,745.09,0.0
gfx942,304,38400,5120,3200,ck,0,0,1463.3938,a8w8_blockscale_1x128x128_256x128x128x128_16x16_32x32_2x2_8x32x1_8x32x1_1x32x1x8_8_1x1_intrawave_v3,859.84,363.87,0.0
gfx942,304,38528,5120,1024,ck,0,0,596.7315,a8w8_blockscale_1x128x128_256x128x128x128_16x16_32x32_2x2_8x32x1_8x32x1_1x32x1x8_8_1x1_intrawave_v3,677.01,736.05,0.0
gfx942,304,38528,5120,3200,ck,0,0,1468.4243,a8w8_blockscale_1x128x128_256x128x128x128_16x16_32x32_2x2_8x32x1_8x32x1_1x32x1x8_8_1x1_intrawave_v3,859.76,363.79,0.0
gfx942,304,38656,5120,1024,ck,0,0,587.5055,a8w8_blockscale_1x128x128_256x128x128x128_16x16_32x32_2x2_8x32x1_8x32x1_1x32x1x8_8_1x1_intrawave_v3,689.93,750.06,0.0
gfx942,304,38656,5120,3200,ck,0,0,1476.1856,a8w8_blockscale_1x128x128_256x128x128x128_16x16_32x32_2x2_8x32x1_8x32x1_1x32x1x8_8_1x1_intrawave_v3,858.08,363.04,0.0
gfx942,304,38784,5120,1024,ck,0,0,587.3204,a8w8_blockscale_1x128x128_256x128x128x128_16x16_32x32_2x2_8x32x1_8x32x1_1x32x1x8_8_1x1_intrawave_v3,692.43,752.75,0.0
gfx942,304,38784,5120,3200,ck,0,0,1455.0042,a8w8_blockscale_1x128x128_256x128x128x128_16x16_32x32_2x2_8x32x1_8x32x1_1x32x1x8_8_1x1_intrawave_v3,873.45,369.51,0.0
gfx942,304,38912,5120,1024,ck,0,0,595.9421,a8w8_blockscale_1x128x128_256x128x128x128_16x16_32x32_2x2_8x32x1_8x32x1_1x32x1x8_8_1x1_intrawave_v3,684.67,744.28,0.0
gfx942,304,38912,5120,3200,ck,0,0,1468.5007,a8w8_blockscale_1x128x128_256x128x128x128_16x16_32x32_2x2_8x32x1_8x32x1_1x32x1x8_8_1x1_intrawave_v3,868.28,367.29,0.0
gfx942,304,39040,5120,1024,ck,0,0,599.4168,a8w8_blockscale_1x128x128_256x128x128x128_16x16_32x32_2x2_8x32x1_8x32x1_1x32x1x8_8_1x1_intrawave_v3,682.94,742.37,0.0
gfx942,304,39040,5120,3200,ck,0,0,1495.6338,a8w8_blockscale_1x128x128_256x128x128x128_16x16_32x32_2x2_8x32x1_8x32x1_1x32x1x8_8_1x1_intrawave_v3,855.33,361.77,0.0
gfx942,304,39168,5120,1024,ck,0,0,596.3933,a8w8_blockscale_1x128x128_256x128x128x128_16x16_32x32_2x2_8x32x1_8x32x1_1x32x1x8_8_1x1_intrawave_v3,688.65,748.55,0.0
gfx942,304,39168,5120,3200,ck,0,0,1503.5067,a8w8_blockscale_1x128x128_256x128x128x128_16x16_32x32_2x2_8x32x1_8x32x1_1x32x1x8_8_1x1_intrawave_v3,853.64,361.02,0.0
gfx942,304,39296,5120,1024,ck,0,0,606.0707,a8w8_blockscale_1x128x128_256x128x128x128_16x16_32x32_2x2_8x32x1_8x32x1_1x32x1x8_8_1x1_intrawave_v3,679.87,738.98,0.0
gfx942,304,39296,5120,3200,ck,0,0,1510.6451,a8w8_blockscale_1x128x128_256x128x128x128_16x16_32x32_2x2_8x32x1_8x32x1_1x32x1x8_8_1x1_intrawave_v3,852.39,360.46,0.0
gfx942,304,39424,5120,1024,ck,0,0,603.5017,a8w8_blockscale_1x128x128_256x128x128x128_16x16_32x32_2x2_8x32x1_8x32x1_1x32x1x8_8_1x1_intrawave_v3,684.99,744.51,0.0
gfx942,304,39424,5120,3200,ck,0,0,1472.3775,a8w8_blockscale_1x128x128_256x128x128x128_16x16_32x32_2x2_8x32x1_8x32x1_1x32x1x8_8_1x1_intrawave_v3,877.39,370.99,0.0
gfx942,304,39552,5120,1024,ck,0,0,615.0309,a8w8_blockscale_1x128x128_256x128x128x128_16x16_32x32_2x2_8x32x1_8x32x1_1x32x1x8_8_1x1_intrawave_v3,674.33,732.9,0.0
gfx942,304,39552,5120,3200,ck,0,0,1511.7078,a8w8_blockscale_1x128x128_256x128x128x128_16x16_32x32_2x2_8x32x1_8x32x1_1x32x1x8_8_1x1_intrawave_v3,857.33,362.48,0.0
gfx942,304,39680,5120,1024,ck,0,0,602.5923,a8w8_blockscale_1x128x128_256x128x128x128_16x16_32x32_2x2_8x32x1_8x32x1_1x32x1x8_8_1x1_intrawave_v3,690.48,750.42,0.0
gfx942,304,39680,5120,3200,ck,0,0,1510.0052,a8w8_blockscale_1x128x128_256x128x128x128_16x16_32x32_2x2_8x32x1_8x32x1_1x32x1x8_8_1x1_intrawave_v3,861.08,364.03,0.0
gfx942,304,39808,5120,1024,ck,0,0,602.1632,a8w8_blockscale_1x128x128_256x128x128x128_16x16_32x32_2x2_8x32x1_8x32x1_1x32x1x8_8_1x1_intrawave_v3,693.2,753.35,0.0
gfx942,304,39808,5120,3200,ck,0,0,1504.8319,a8w8_blockscale_1x128x128_256x128x128x128_16x16_32x32_2x2_8x32x1_8x32x1_1x32x1x8_8_1x1_intrawave_v3,866.83,366.42,0.0
gfx942,304,39936,5120,1024,ck,0,0,612.7171,a8w8_blockscale_1x128x128_256x128x128x128_16x16_32x32_2x2_8x32x1_8x32x1_1x32x1x8_8_1x1_intrawave_v3,683.45,742.73,0.0
gfx942,304,39936,5120,3200,ck,0,0,1482.9159,a8w8_blockscale_1x128x128_256x128x128x128_16x16_32x32_2x2_8x32x1_8x32x1_1x32x1x8_8_1x1_intrawave_v3,882.47,373.0,0.0
gfx942,304,40064,5120,1024,ck,0,0,620.4088,a8w8_blockscale_1x128x128_256x128x128x128_16x16_32x32_2x2_8x32x1_8x32x1_1x32x1x8_8_1x1_intrawave_v3,677.14,735.84,0.0
gfx942,304,40064,5120,3200,ck,0,0,1499.9279,a8w8_blockscale_1x128x128_256x128x128x128_16x16_32x32_2x2_8x32x1_8x32x1_1x32x1x8_8_1x1_intrawave_v3,875.25,369.91,0.0
gfx942,304,40192,5120,1024,ck,0,0,613.3513,a8w8_blockscale_1x128x128_256x128x128x128_16x16_32x32_2x2_8x32x1_8x32x1_1x32x1x8_8_1x1_intrawave_v3,687.12,746.66,0.0
gfx942,304,40192,5120,3200,ck,0,0,1544.766,a8w8_blockscale_1x128x128_256x128x128x128_16x16_32x32_2x2_8x32x1_8x32x1_1x32x1x8_8_1x1_intrawave_v3,852.56,360.29,0.0
gfx942,304,40320,5120,1024,ck,0,0,617.7004,a8w8_blockscale_1x128x128_256x128x128x128_16x16_32x32_2x2_8x32x1_8x32x1_1x32x1x8_8_1x1_intrawave_v3,684.45,743.74,0.0
gfx942,304,40320,5120,3200,ck,0,0,1505.1143,a8w8_blockscale_1x128x128_256x128x128x128_16x16_32x32_2x2_8x32x1_8x32x1_1x32x1x8_8_1x1_intrawave_v3,877.81,370.93,0.0
gfx942,304,40448,5120,1024,ck,0,0,618.7474,a8w8_blockscale_1x128x128_256x128x128x128_16x16_32x32_2x2_8x32x1_8x32x1_1x32x1x8_8_1x1_intrawave_v3,685.46,744.81,0.0
gfx942,304,40448,5120,3200,ck,0,0,1554.0911,a8w8_blockscale_1x128x128_256x128x128x128_16x16_32x32_2x2_8x32x1_8x32x1_1x32x1x8_8_1x1_intrawave_v3,852.85,360.34,0.0
gfx942,304,40576,5120,1024,ck,0,0,617.8891,a8w8_blockscale_1x128x128_256x128x128x128_16x16_32x32_2x2_8x32x1_8x32x1_1x32x1x8_8_1x1_intrawave_v3,688.59,748.18,0.0
gfx942,304,40576,5120,3200,ck,0,0,1598.0295,a8w8_blockscale_1x128x128_256x128x128x128_16x16_32x32_2x2_8x32x1_8x32x1_1x32x1x8_8_1x1_intrawave_v3,832.02,351.51,0.0
gfx942,304,40704,5120,1024,ck,0,0,621.6449,a8w8_blockscale_1x128x128_256x128x128x128_16x16_32x32_2x2_8x32x1_8x32x1_1x32x1x8_8_1x1_intrawave_v3,686.59,745.98,0.0
gfx942,304,40704,5120,3200,ck,0,0,1554.2196,a8w8_blockscale_1x128x128_256x128x128x128_16x16_32x32_2x2_8x32x1_8x32x1_1x32x1x8_8_1x1_intrawave_v3,858.17,362.53,0.0
gfx942,304,40832,5120,1024,ck,0,0,626.0906,a8w8_blockscale_1x128x128_256x128x128x128_16x16_32x32_2x2_8x32x1_8x32x1_1x32x1x8_8_1x1_intrawave_v3,683.85,742.98,0.0
gfx942,304,40832,5120,3200,ck,0,0,1537.8474,a8w8_blockscale_1x128x128_256x128x128x128_16x16_32x32_2x2_8x32x1_8x32x1_1x32x1x8_8_1x1_intrawave_v3,870.04,367.5,0.0
gfx942,304,40960,5120,1024,ck,0,0,626.5061,a8w8_blockscale_1x128x128_256x128x128x128_16x16_32x32_2x2_8x32x1_8x32x1_1x32x1x8_8_1x1_intrawave_v3,685.54,744.79,0.0
gfx942,304,40960,5120,3200,ck,0,0,1544.4575,a8w8_blockscale_1x128x128_256x128x128x128_16x16_32x32_2x2_8x32x1_8x32x1_1x32x1x8_8_1x1_intrawave_v3,869.03,367.05,0.0
gfx942,304,41088,5120,1024,ck,0,0,627.8176,a8w8_blockscale_1x128x128_256x128x128x128_16x16_32x32_2x2_8x32x1_8x32x1_1x32x1x8_8_1x1_intrawave_v3,686.25,745.53,0.0
gfx942,304,41088,5120,3200,ck,0,0,1543.8785,a8w8_blockscale_1x128x128_256x128x128x128_16x16_32x32_2x2_8x32x1_8x32x1_1x32x1x8_8_1x1_intrawave_v3,872.07,368.3,0.0
gfx942,304,41216,5120,1024,ck,0,0,628.6241,a8w8_blockscale_1x128x128_256x128x128x128_16x16_32x32_2x2_8x32x1_8x32x1_1x32x1x8_8_1x1_intrawave_v3,687.5,746.87,0.0
gfx942,304,41216,5120,3200,ck,0,0,1548.186,a8w8_blockscale_1x128x128_256x128x128x128_16x16_32x32_2x2_8x32x1_8x32x1_1x32x1x8_8_1x1_intrawave_v3,872.35,368.38,0.0
gfx942,304,41344,5120,1024,ck,0,0,630.2871,a8w8_blockscale_1x128x128_256x128x128x128_16x16_32x32_2x2_8x32x1_8x32x1_1x32x1x8_8_1x1_intrawave_v3,687.82,747.19,0.0
gfx942,304,41344,5120,3200,ck,0,0,1581.4352,a8w8_blockscale_1x128x128_256x128x128x128_16x16_32x32_2x2_8x32x1_8x32x1_1x32x1x8_8_1x1_intrawave_v3,856.67,361.73,0.0
gfx942,304,41472,5120,1024,ck,0,0,638.2502,a8w8_blockscale_1x128x128_256x128x128x128_16x16_32x32_2x2_8x32x1_8x32x1_1x32x1x8_8_1x1_intrawave_v3,681.34,740.12,0.0
gfx942,304,41472,5120,3200,ck,0,0,1587.2605,a8w8_blockscale_1x128x128_256x128x128x128_16x16_32x32_2x2_8x32x1_8x32x1_1x32x1x8_8_1x1_intrawave_v3,856.16,361.48,0.0
gfx942,304,41600,5120,1024,ck,0,0,647.2756,a8w8_blockscale_1x128x128_256x128x128x128_16x16_32x32_2x2_8x32x1_8x32x1_1x32x1x8_8_1x1_intrawave_v3,673.91,732.03,0.0
gfx942,304,41600,5120,3200,ck,0,0,1639.171,a8w8_blockscale_1x128x128_256x128x128x128_16x16_32x32_2x2_8x32x1_8x32x1_1x32x1x8_8_1x1_intrawave_v3,831.61,351.08,0.0
gfx942,304,41728,5120,1024,ck,0,0,644.4425,a8w8_blockscale_1x128x128_256x128x128x128_16x16_32x32_2x2_8x32x1_8x32x1_1x32x1x8_8_1x1_intrawave_v3,678.96,737.49,0.0
gfx942,304,41728,5120,3200,ck,0,0,1650.5327,a8w8_blockscale_1x128x128_256x128x128x128_16x16_32x32_2x2_8x32x1_8x32x1_1x32x1x8_8_1x1_intrawave_v3,828.43,349.71,0.0
gfx942,304,41856,5120,1024,ck,0,0,642.1447,a8w8_blockscale_1x128x128_256x128x128x128_16x16_32x32_2x2_8x32x1_8x32x1_1x32x1x8_8_1x1_intrawave_v3,683.48,742.37,0.0
gfx942,304,41856,5120,3200,ck,0,0,1657.2146,a8w8_blockscale_1x128x128_256x128x128x128_16x16_32x32_2x2_8x32x1_8x32x1_1x32x1x8_8_1x1_intrawave_v3,827.62,349.34,0.0
gfx942,304,41984,5120,1024,ck,0,0,645.9884,a8w8_blockscale_1x128x128_256x128x128x128_16x16_32x32_2x2_8x32x1_8x32x1_1x32x1x8_8_1x1_intrawave_v3,681.49,740.18,0.0
gfx942,304,41984,5120,3200,ck,0,0,1561.4513,a8w8_blockscale_1x128x128_256x128x128x128_16x16_32x32_2x2_8x32x1_8x32x1_1x32x1x8_8_1x1_intrawave_v3,881.06,371.86,0.0
gfx942,304,42112,5120,1024,ck,0,0,641.9846,a8w8_blockscale_1x128x128_256x128x128x128_16x16_32x32_2x2_8x32x1_8x32x1_1x32x1x8_8_1x1_intrawave_v3,687.83,747.05,0.0
gfx942,304,42112,5120,3200,ck,0,0,1572.2811,a8w8_blockscale_1x128x128_256x128x128x128_16x16_32x32_2x2_8x32x1_8x32x1_1x32x1x8_8_1x1_intrawave_v3,877.66,370.4,0.0
gfx942,304,42240,5120,1024,ck,0,0,651.2812,a8w8_blockscale_1x128x128_256x128x128x128_16x16_32x32_2x2_8x32x1_8x32x1_1x32x1x8_8_1x1_intrawave_v3,680.07,738.6,0.0
gfx942,304,42240,5120,3200,ck,0,0,1574.9848,a8w8_blockscale_1x128x128_256x128x128x128_16x16_32x32_2x2_8x32x1_8x32x1_1x32x1x8_8_1x1_intrawave_v3,878.82,370.85,0.0
gfx942,304,42368,5120,1024,ck,0,0,644.9723,a8w8_blockscale_1x128x128_256x128x128x128_16x16_32x32_2x2_8x32x1_8x32x1_1x32x1x8_8_1x1_intrawave_v3,688.81,748.06,0.0
gfx942,304,42368,5120,3200,ck,0,0,1676.0785,a8w8_blockscale_1x128x128_256x128x128x128_16x16_32x32_2x2_8x32x1_8x32x1_1x32x1x8_8_1x1_intrawave_v3,828.31,349.51,0.0
gfx942,304,42496,5120,1024,ck,0,0,654.4183,a8w8_blockscale_1x128x128_256x128x128x128_16x16_32x32_2x2_8x32x1_8x32x1_1x32x1x8_8_1x1_intrawave_v3,680.91,739.46,0.0
gfx942,304,42496,5120,3200,ck,0,0,1580.0236,a8w8_blockscale_1x128x128_256x128x128x128_16x16_32x32_2x2_8x32x1_8x32x1_1x32x1x8_8_1x1_intrawave_v3,881.32,371.85,0.0
gfx942,304,42624,5120,1024,ck,0,0,654.8425,a8w8_blockscale_1x128x128_256x128x128x128_16x16_32x32_2x2_8x32x1_8x32x1_1x32x1x8_8_1x1_intrawave_v3,682.52,741.19,0.0
gfx942,304,42624,5120,3200,ck,0,0,1681.8812,a8w8_blockscale_1x128x128_256x128x128x128_16x16_32x32_2x2_8x32x1_8x32x1_1x32x1x8_8_1x1_intrawave_v3,830.44,350.35,0.0
gfx942,304,42752,5120,1024,ck,0,0,651.2055,a8w8_blockscale_1x128x128_256x128x128x128_16x16_32x32_2x2_8x32x1_8x32x1_1x32x1x8_8_1x1_intrawave_v3,688.4,747.54,0.0
gfx942,304,42752,5120,3200,ck,0,0,1610.0364,a8w8_blockscale_1x128x128_256x128x128x128_16x16_32x32_2x2_8x32x1_8x32x1_1x32x1x8_8_1x1_intrawave_v3,870.1,367.05,0.0
gfx942,304,42880,5120,1024,ck,0,0,650.1979,a8w8_blockscale_1x128x128_256x128x128x128_16x16_32x32_2x2_8x32x1_8x32x1_1x32x1x8_8_1x1_intrawave_v3,691.53,750.91,0.0
gfx942,304,42880,5120,3200,ck,0,0,1624.1692,a8w8_blockscale_1x128x128_256x128x128x128_16x16_32x32_2x2_8x32x1_8x32x1_1x32x1x8_8_1x1_intrawave_v3,865.11,364.92,0.0
gfx942,304,43008,5120,1024,ck,0,0,663.0818,a8w8_blockscale_1x128x128_256x128x128x128_16x16_32x32_2x2_8x32x1_8x32x1_1x32x1x8_8_1x1_intrawave_v3,680.11,738.5,0.0
gfx942,304,43008,5120,3200,ck,0,0,1626.1791,a8w8_blockscale_1x128x128_256x128x128x128_16x16_32x32_2x2_8x32x1_8x32x1_1x32x1x8_8_1x1_intrawave_v3,866.62,365.53,0.0
gfx942,304,43136,5120,1024,ck,0,0,668.7901,a8w8_blockscale_1x128x128_256x128x128x128_16x16_32x32_2x2_8x32x1_8x32x1_1x32x1x8_8_1x1_intrawave_v3,676.32,734.35,0.0
gfx942,304,43136,5120,3200,ck,0,0,1604.9256,a8w8_blockscale_1x128x128_256x128x128x128_16x16_32x32_2x2_8x32x1_8x32x1_1x32x1x8_8_1x1_intrawave_v3,880.71,371.44,0.0
gfx942,304,43264,5120,1024,ck,0,0,662.9607,a8w8_blockscale_1x128x128_256x128x128x128_16x16_32x32_2x2_8x32x1_8x32x1_1x32x1x8_8_1x1_intrawave_v3,684.29,742.98,0.0
gfx942,304,43264,5120,3200,ck,0,0,1652.8613,a8w8_blockscale_1x128x128_256x128x128x128_16x16_32x32_2x2_8x32x1_8x32x1_1x32x1x8_8_1x1_intrawave_v3,857.71,361.71,0.0
gfx942,304,43392,5120,1024,ck,0,0,663.1378,a8w8_blockscale_1x128x128_256x128x128x128_16x16_32x32_2x2_8x32x1_8x32x1_1x32x1x8_8_1x1_intrawave_v3,686.13,744.96,0.0
gfx942,304,43392,5120,3200,ck,0,0,1613.2305,a8w8_blockscale_1x128x128_256x128x128x128_16x16_32x32_2x2_8x32x1_8x32x1_1x32x1x8_8_1x1_intrawave_v3,881.38,371.66,0.0
gfx942,304,43520,5120,1024,ck,0,0,664.3051,a8w8_blockscale_1x128x128_256x128x128x128_16x16_32x32_2x2_8x32x1_8x32x1_1x32x1x8_8_1x1_intrawave_v3,686.94,745.82,0.0
gfx942,304,43520,5120,3200,ck,0,0,1618.1805,a8w8_blockscale_1x128x128_256x128x128x128_16x16_32x32_2x2_8x32x1_8x32x1_1x32x1x8_8_1x1_intrawave_v3,881.28,371.59,0.0
gfx942,304,43648,5120,1024,ck,0,0,677.1619,a8w8_blockscale_1x128x128_256x128x128x128_16x16_32x32_2x2_8x32x1_8x32x1_1x32x1x8_8_1x1_intrawave_v3,675.88,733.79,0.0
gfx942,304,43648,5120,3200,ck,0,0,1658.9354,a8w8_blockscale_1x128x128_256x128x128x128_16x16_32x32_2x2_8x32x1_8x32x1_1x32x1x8_8_1x1_intrawave_v3,862.15,363.49,0.0
gfx942,304,43776,5120,1024,ck,0,0,674.7548,a8w8_blockscale_1x128x128_256x128x128x128_16x16_32x32_2x2_8x32x1_8x32x1_1x32x1x8_8_1x1_intrawave_v3,680.28,738.54,0.0
gfx942,304,43776,5120,3200,ck,0,0,1666.2183,a8w8_blockscale_1x128x128_256x128x128x128_16x16_32x32_2x2_8x32x1_8x32x1_1x32x1x8_8_1x1_intrawave_v3,860.9,362.94,0.0
gfx942,304,43904,5120,1024,ck,0,0,668.4972,a8w8_blockscale_1x128x128_256x128x128x128_16x16_32x32_2x2_8x32x1_8x32x1_1x32x1x8_8_1x1_intrawave_v3,688.66,747.61,0.0
gfx942,304,43904,5120,3200,ck,0,0,1632.0933,a8w8_blockscale_1x128x128_256x128x128x128_16x16_32x32_2x2_8x32x1_8x32x1_1x32x1x8_8_1x1_intrawave_v3,881.47,371.58,0.0
gfx942,304,44032,5120,1024,ck,0,0,682.444,a8w8_blockscale_1x128x128_256x128x128x128_16x16_32x32_2x2_8x32x1_8x32x1_1x32x1x8_8_1x1_intrawave_v3,676.55,734.45,0.0
gfx942,304,44032,5120,3200,ck,0,0,1683.0334,a8w8_blockscale_1x128x128_256x128x128x128_16x16_32x32_2x2_8x32x1_8x32x1_1x32x1x8_8_1x1_intrawave_v3,857.29,361.36,0.0
gfx942,304,44160,5120,1024,ck,0,0,669.6424,a8w8_blockscale_1x128x128_256x128x128x128_16x16_32x32_2x2_8x32x1_8x32x1_1x32x1x8_8_1x1_intrawave_v3,691.49,750.64,0.0
gfx942,304,44160,5120,3200,ck,0,0,1640.2967,a8w8_blockscale_1x128x128_256x128x128x128_16x16_32x32_2x2_8x32x1_8x32x1_1x32x1x8_8_1x1_intrawave_v3,882.18,371.82,0.0
gfx942,304,44288,5120,1024,ck,0,0,672.1284,a8w8_blockscale_1x128x128_256x128x128x128_16x16_32x32_2x2_8x32x1_8x32x1_1x32x1x8_8_1x1_intrawave_v3,690.93,750.01,0.0
gfx942,304,44288,5120,3200,ck,0,0,1648.4184,a8w8_blockscale_1x128x128_256x128x128x128_16x16_32x32_2x2_8x32x1_8x32x1_1x32x1x8_8_1x1_intrawave_v3,880.38,371.03,0.0
gfx942,304,44416,5120,1024,ck,0,0,682.6005,a8w8_blockscale_1x128x128_256x128x128x128_16x16_32x32_2x2_8x32x1_8x32x1_1x32x1x8_8_1x1_intrawave_v3,682.3,740.62,0.0
gfx942,304,44416,5120,3200,ck,0,0,1650.4256,a8w8_blockscale_1x128x128_256x128x128x128_16x16_32x32_2x2_8x32x1_8x32x1_1x32x1x8_8_1x1_intrawave_v3,881.85,371.62,0.0
gfx942,304,44544,5120,1024,ck,0,0,686.6358,a8w8_blockscale_1x128x128_256x128x128x128_16x16_32x32_2x2_8x32x1_8x32x1_1x32x1x8_8_1x1_intrawave_v3,680.24,738.36,0.0
gfx942,304,44544,5120,3200,ck,0,0,1715.0276,a8w8_blockscale_1x128x128_256x128x128x128_16x16_32x32_2x2_8x32x1_8x32x1_1x32x1x8_8_1x1_intrawave_v3,851.08,358.63,0.0
gfx942,304,44672,5120,1024,ck,0,0,679.815,a8w8_blockscale_1x128x128_256x128x128x128_16x16_32x32_2x2_8x32x1_8x32x1_1x32x1x8_8_1x1_intrawave_v3,689.04,747.89,0.0
gfx942,304,44672,5120,3200,ck,0,0,1712.7896,a8w8_blockscale_1x128x128_256x128x128x128_16x16_32x32_2x2_8x32x1_8x32x1_1x32x1x8_8_1x1_intrawave_v3,854.64,360.1,0.0
gfx942,304,44800,5120,1024,ck,0,0,705.3473,a8w8_blockscale_1x128x128_256x128x128x128_16x16_32x32_2x2_8x32x1_8x32x1_1x32x1x8_8_1x1_intrawave_v3,666.0,722.86,0.0
gfx942,304,44800,5120,3200,ck,0,0,1714.7079,a8w8_blockscale_1x128x128_256x128x128x128_16x16_32x32_2x2_8x32x1_8x32x1_1x32x1x8_8_1x1_intrawave_v3,856.13,360.7,0.0
gfx942,304,44928,5120,1024,ck,0,0,681.6132,a8w8_blockscale_1x128x128_256x128x128x128_16x16_32x32_2x2_8x32x1_8x32x1_1x32x1x8_8_1x1_intrawave_v3,691.16,750.15,0.0
gfx942,304,44928,5120,3200,ck,0,0,1726.431,a8w8_blockscale_1x128x128_256x128x128x128_16x16_32x32_2x2_8x32x1_8x32x1_1x32x1x8_8_1x1_intrawave_v3,852.74,359.25,0.0
gfx942,304,45056,5120,1024,ck,0,0,685.2728,a8w8_blockscale_1x128x128_256x128x128x128_16x16_32x32_2x2_8x32x1_8x32x1_1x32x1x8_8_1x1_intrawave_v3,689.43,748.25,0.0
gfx942,304,45056,5120,3200,ck,0,0,1717.3751,a8w8_blockscale_1x128x128_256x128x128x128_16x16_32x32_2x2_8x32x1_8x32x1_1x32x1x8_8_1x1_intrawave_v3,859.68,362.14,0.0
gfx942,304,45184,5120,1024,ck,0,0,688.7902,a8w8_blockscale_1x128x128_256x128x128x128_16x16_32x32_2x2_8x32x1_8x32x1_1x32x1x8_8_1x1_intrawave_v3,687.86,746.52,0.0
gfx942,304,45184,5120,3200,ck,0,0,1683.8739,a8w8_blockscale_1x128x128_256x128x128x128_16x16_32x32_2x2_8x32x1_8x32x1_1x32x1x8_8_1x1_intrawave_v3,879.28,370.37,0.0
gfx942,304,45312,5120,1024,ck,0,0,692.1633,a8w8_blockscale_1x128x128_256x128x128x128_16x16_32x32_2x2_8x32x1_8x32x1_1x32x1x8_8_1x1_intrawave_v3,686.44,744.96,0.0
gfx942,304,45312,5120,3200,ck,0,0,1694.4308,a8w8_blockscale_1x128x128_256x128x128x128_16x16_32x32_2x2_8x32x1_8x32x1_1x32x1x8_8_1x1_intrawave_v3,876.27,369.08,0.0
gfx942,304,45440,5120,1024,ck,0,0,689.6083,a8w8_blockscale_1x128x128_256x128x128x128_16x16_32x32_2x2_8x32x1_8x32x1_1x32x1x8_8_1x1_intrawave_v3,690.93,749.82,0.0
gfx942,304,45440,5120,3200,ck,0,0,1719.9941,a8w8_blockscale_1x128x128_256x128x128x128_16x16_32x32_2x2_8x32x1_8x32x1_1x32x1x8_8_1x1_intrawave_v3,865.69,364.59,0.0
gfx942,304,45568,5120,1024,ck,0,0,697.2962,a8w8_blockscale_1x128x128_256x128x128x128_16x16_32x32_2x2_8x32x1_8x32x1_1x32x1x8_8_1x1_intrawave_v3,685.24,743.62,0.0
gfx942,304,45568,5120,3200,ck,0,0,1746.3338,a8w8_blockscale_1x128x128_256x128x128x128_16x16_32x32_2x2_8x32x1_8x32x1_1x32x1x8_8_1x1_intrawave_v3,855.03,360.08,0.0
gfx942,304,45696,5120,1024,ck,0,0,698.1833,a8w8_blockscale_1x128x128_256x128x128x128_16x16_32x32_2x2_8x32x1_8x32x1_1x32x1x8_8_1x1_intrawave_v3,686.29,744.74,0.0
gfx942,304,45696,5120,3200,ck,0,0,1752.5385,a8w8_blockscale_1x128x128_256x128x128x128_16x16_32x32_2x2_8x32x1_8x32x1_1x32x1x8_8_1x1_intrawave_v3,854.4,359.79,0.0
gfx942,304,45824,5120,1024,ck,0,0,703.9821,a8w8_blockscale_1x128x128_256x128x128x128_16x16_32x32_2x2_8x32x1_8x32x1_1x32x1x8_8_1x1_intrawave_v3,682.55,740.65,0.0
gfx942,304,45824,5120,3200,ck,0,0,1751.8498,a8w8_blockscale_1x128x128_256x128x128x128_16x16_32x32_2x2_8x32x1_8x32x1_1x32x1x8_8_1x1_intrawave_v3,857.13,360.91,0.0
gfx942,304,45952,5120,1024,ck,0,0,712.0542,a8w8_blockscale_1x128x128_256x128x128x128_16x16_32x32_2x2_8x32x1_8x32x1_1x32x1x8_8_1x1_intrawave_v3,676.69,734.28,0.0
gfx942,304,45952,5120,3200,ck,0,0,1758.4787,a8w8_blockscale_1x128x128_256x128x128x128_16x16_32x32_2x2_8x32x1_8x32x1_1x32x1x8_8_1x1_intrawave_v3,856.28,360.53,0.0
gfx942,304,46080,5120,1024,ck,0,0,709.5793,a8w8_blockscale_1x128x128_256x128x128x128_16x16_32x32_2x2_8x32x1_8x32x1_1x32x1x8_8_1x1_intrawave_v3,680.94,738.87,0.0
gfx942,304,46080,5120,3200,ck,0,0,1768.5653,a8w8_blockscale_1x128x128_256x128x128x128_16x16_32x32_2x2_8x32x1_8x32x1_1x32x1x8_8_1x1_intrawave_v3,853.77,359.44,0.0
gfx942,304,46208,5120,1024,ck,0,0,701.0208,a8w8_blockscale_1x128x128_256x128x128x128_16x16_32x32_2x2_8x32x1_8x32x1_1x32x1x8_8_1x1_intrawave_v3,691.17,749.95,0.0
gfx942,304,46208,5120,3200,ck,0,0,1777.882,a8w8_blockscale_1x128x128_256x128x128x128_16x16_32x32_2x2_8x32x1_8x32x1_1x32x1x8_8_1x1_intrawave_v3,851.66,358.53,0.0
gfx942,304,46336,5120,1024,ck,0,0,716.9464,a8w8_blockscale_1x128x128_256x128x128x128_16x16_32x32_2x2_8x32x1_8x32x1_1x32x1x8_8_1x1_intrawave_v3,677.69,735.3,0.0
gfx942,304,46336,5120,3200,ck,0,0,1785.0536,a8w8_blockscale_1x128x128_256x128x128x128_16x16_32x32_2x2_8x32x1_8x32x1_1x32x1x8_8_1x1_intrawave_v3,850.58,358.05,0.0
gfx942,304,46464,5120,1024,ck,0,0,707.7297,a8w8_blockscale_1x128x128_256x128x128x128_16x16_32x32_2x2_8x32x1_8x32x1_1x32x1x8_8_1x1_intrawave_v3,688.41,746.91,0.0
gfx942,304,46464,5120,3200,ck,0,0,1779.3989,a8w8_blockscale_1x128x128_256x128x128x128_16x16_32x32_2x2_8x32x1_8x32x1_1x32x1x8_8_1x1_intrawave_v3,855.64,360.16,0.0
gfx942,304,46592,5120,1024,ck,0,0,709.1158,a8w8_blockscale_1x128x128_256x128x128x128_16x16_32x32_2x2_8x32x1_8x32x1_1x32x1x8_8_1x1_intrawave_v3,688.96,747.49,0.0
gfx942,304,46592,5120,3200,ck,0,0,1757.0969,a8w8_blockscale_1x128x128_256x128x128x128_16x16_32x32_2x2_8x32x1_8x32x1_1x32x1x8_8_1x1_intrawave_v3,868.89,365.71,0.0
gfx942,304,46720,5120,1024,ck,0,0,709.3838,a8w8_blockscale_1x128x128_256x128x128x128_16x16_32x32_2x2_8x32x1_8x32x1_1x32x1x8_8_1x1_intrawave_v3,690.59,749.24,0.0
gfx942,304,46720,5120,3200,ck,0,0,1770.0816,a8w8_blockscale_1x128x128_256x128x128x128_16x16_32x32_2x2_8x32x1_8x32x1_1x32x1x8_8_1x1_intrawave_v3,864.89,363.99,0.0
gfx942,304,46848,5120,1024,ck,0,0,734.7877,a8w8_blockscale_1x128x128_256x128x128x128_16x16_32x32_2x2_8x32x1_8x32x1_1x32x1x8_8_1x1_intrawave_v3,668.54,725.3,0.0
gfx942,304,46848,5120,3200,ck,0,0,1749.882,a8w8_blockscale_1x128x128_256x128x128x128_16x16_32x32_2x2_8x32x1_8x32x1_1x32x1x8_8_1x1_intrawave_v3,877.27,369.18,0.0
gfx942,304,46976,5120,1024,ck,0,0,742.2505,a8w8_blockscale_1x128x128_256x128x128x128_16x16_32x32_2x2_8x32x1_8x32x1_1x32x1x8_8_1x1_intrawave_v3,663.63,719.95,0.0
gfx942,304,46976,5120,3200,ck,0,0,1747.9445,a8w8_blockscale_1x128x128_256x128x128x128_16x16_32x32_2x2_8x32x1_8x32x1_1x32x1x8_8_1x1_intrawave_v3,880.64,370.57,0.0
gfx942,304,47104,5120,1024,ck,0,0,727.4537,a8w8_blockscale_1x128x128_256x128x128x128_16x16_32x32_2x2_8x32x1_8x32x1_1x32x1x8_8_1x1_intrawave_v3,678.97,736.57,0.0
gfx942,304,47104,5120,3200,ck,0,0,1782.4291,a8w8_blockscale_1x128x128_256x128x128x128_16x16_32x32_2x2_8x32x1_8x32x1_1x32x1x8_8_1x1_intrawave_v3,865.96,364.37,0.0
gfx942,304,47232,5120,1024,ck,0,0,727.9759,a8w8_blockscale_1x128x128_256x128x128x128_16x16_32x32_2x2_8x32x1_8x32x1_1x32x1x8_8_1x1_intrawave_v3,680.33,738.02,0.0
gfx942,304,47232,5120,3200,ck,0,0,1817.0933,a8w8_blockscale_1x128x128_256x128x128x128_16x16_32x32_2x2_8x32x1_8x32x1_1x32x1x8_8_1x1_intrawave_v3,851.74,358.36,0.0
gfx942,304,47360,5120,1024,ck,0,0,729.1101,a8w8_blockscale_1x128x128_256x128x128x128_16x16_32x32_2x2_8x32x1_8x32x1_1x32x1x8_8_1x1_intrawave_v3,681.11,738.85,0.0
gfx942,304,47360,5120,3200,ck,0,0,1807.09,a8w8_blockscale_1x128x128_256x128x128x128_16x16_32x32_2x2_8x32x1_8x32x1_1x32x1x8_8_1x1_intrawave_v3,858.78,361.3,0.0
gfx942,304,47488,5120,1024,ck,0,0,742.7139,a8w8_blockscale_1x128x128_256x128x128x128_16x16_32x32_2x2_8x32x1_8x32x1_1x32x1x8_8_1x1_intrawave_v3,670.44,727.26,0.0
gfx942,304,47488,5120,3200,ck,0,0,1757.3525,a8w8_blockscale_1x128x128_256x128x128x128_16x16_32x32_2x2_8x32x1_8x32x1_1x32x1x8_8_1x1_intrawave_v3,885.47,372.51,0.0
gfx942,304,47616,5120,1024,ck,0,0,731.9744,a8w8_blockscale_1x128x128_256x128x128x128_16x16_32x32_2x2_8x32x1_8x32x1_1x32x1x8_8_1x1_intrawave_v3,682.11,739.9,0.0
gfx942,304,47616,5120,3200,ck,0,0,1760.9639,a8w8_blockscale_1x128x128_256x128x128x128_16x16_32x32_2x2_8x32x1_8x32x1_1x32x1x8_8_1x1_intrawave_v3,886.04,372.72,0.0
gfx942,304,47744,5120,1024,ck,0,0,727.5358,a8w8_blockscale_1x128x128_256x128x128x128_16x16_32x32_2x2_8x32x1_8x32x1_1x32x1x8_8_1x1_intrawave_v3,688.12,746.4,0.0
gfx942,304,47744,5120,3200,ck,0,0,1832.2777,a8w8_blockscale_1x128x128_256x128x128x128_16x16_32x32_2x2_8x32x1_8x32x1_1x32x1x8_8_1x1_intrawave_v3,853.84,359.15,0.0
gfx942,304,47872,5120,1024,ck,0,0,739.6979,a8w8_blockscale_1x128x128_256x128x128x128_16x16_32x32_2x2_8x32x1_8x32x1_1x32x1x8_8_1x1_intrawave_v3,678.62,736.07,0.0
gfx942,304,47872,5120,3200,ck,0,0,1820.4471,a8w8_blockscale_1x128x128_256x128x128x128_16x16_32x32_2x2_8x32x1_8x32x1_1x32x1x8_8_1x1_intrawave_v3,861.69,362.43,0.0
gfx942,304,48000,5120,1024,ck,0,0,726.1549,a8w8_blockscale_1x128x128_256x128x128x128_16x16_32x32_2x2_8x32x1_8x32x1_1x32x1x8_8_1x1_intrawave_v3,693.13,751.79,0.0
gfx942,304,48000,5120,3200,ck,0,0,1833.6588,a8w8_blockscale_1x128x128_256x128x128x128_16x16_32x32_2x2_8x32x1_8x32x1_1x32x1x8_8_1x1_intrawave_v3,857.77,360.76,0.0
gfx942,304,48128,5120,1024,ck,0,0,737.9527,a8w8_blockscale_1x128x128_256x128x128x128_16x16_32x32_2x2_8x32x1_8x32x1_1x32x1x8_8_1x1_intrawave_v3,683.86,741.72,0.0
gfx942,304,48128,5120,3200,ck,0,0,1780.7957,a8w8_blockscale_1x128x128_256x128x128x128_16x16_32x32_2x2_8x32x1_8x32x1_1x32x1x8_8_1x1_intrawave_v3,885.59,372.43,0.0
gfx942,304,48256,5120,1024,ck,0,0,733.2173,a8w8_blockscale_1x128x128_256x128x128x128_16x16_32x32_2x2_8x32x1_8x32x1_1x32x1x8_8_1x1_intrawave_v3,690.11,748.48,0.0
gfx942,304,48256,5120,3200,ck,0,0,1789.0818,a8w8_blockscale_1x128x128_256x128x128x128_16x16_32x32_2x2_8x32x1_8x32x1_1x32x1x8_8_1x1_intrawave_v3,883.83,371.67,0.0
gfx942,304,48384,5120,1024,ck,0,0,741.1729,a8w8_blockscale_1x128x128_256x128x128x128_16x16_32x32_2x2_8x32x1_8x32x1_1x32x1x8_8_1x1_intrawave_v3,684.51,742.39,0.0
gfx942,304,48384,5120,3200,ck,0,0,1834.8865,a8w8_blockscale_1x128x128_256x128x128x128_16x16_32x32_2x2_8x32x1_8x32x1_1x32x1x8_8_1x1_intrawave_v3,864.06,363.33,0.0
gfx942,304,48512,5120,1024,ck,0,0,735.3523,a8w8_blockscale_1x128x128_256x128x128x128_16x16_32x32_2x2_8x32x1_8x32x1_1x32x1x8_8_1x1_intrawave_v3,691.76,750.23,0.0
gfx942,304,48512,5120,3200,ck,0,0,1849.6657,a8w8_blockscale_1x128x128_256x128x128x128_16x16_32x32_2x2_8x32x1_8x32x1_1x32x1x8_8_1x1_intrawave_v3,859.42,361.35,0.0
gfx942,304,48640,5120,1024,ck,0,0,752.7374,a8w8_blockscale_1x128x128_256x128x128x128_16x16_32x32_2x2_8x32x1_8x32x1_1x32x1x8_8_1x1_intrawave_v3,677.56,734.82,0.0
gfx942,304,48640,5120,3200,ck,0,0,1804.1391,a8w8_blockscale_1x128x128_256x128x128x128_16x16_32x32_2x2_8x32x1_8x32x1_1x32x1x8_8_1x1_intrawave_v3,883.43,371.43,0.0
gfx942,304,48768,5120,1024,ck,0,0,747.1181,a8w8_blockscale_1x128x128_256x128x128x128_16x16_32x32_2x2_8x32x1_8x32x1_1x32x1x8_8_1x1_intrawave_v3,684.46,742.27,0.0
gfx942,304,48768,5120,3200,ck,0,0,1874.4646,a8w8_blockscale_1x128x128_256x128x128x128_16x16_32x32_2x2_8x32x1_8x32x1_1x32x1x8_8_1x1_intrawave_v3,852.53,358.41,0.0
gfx942,304,48896,5120,1024,ck,0,0,752.5915,a8w8_blockscale_1x128x128_256x128x128x128_16x16_32x32_2x2_8x32x1_8x32x1_1x32x1x8_8_1x1_intrawave_v3,681.26,738.79,0.0
gfx942,304,48896,5120,3200,ck,0,0,1817.9277,a8w8_blockscale_1x128x128_256x128x128x128_16x16_32x32_2x2_8x32x1_8x32x1_1x32x1x8_8_1x1_intrawave_v3,881.35,370.5,0.0
gfx942,304,49024,5120,1024,ck,0,0,766.1261,a8w8_blockscale_1x128x128_256x128x128x128_16x16_32x32_2x2_8x32x1_8x32x1_1x32x1x8_8_1x1_intrawave_v3,670.98,727.62,0.0
gfx942,304,49024,5120,3200,ck,0,0,1828.3398,a8w8_blockscale_1x128x128_256x128x128x128_16x16_32x32_2x2_8x32x1_8x32x1_1x32x1x8_8_1x1_intrawave_v3,878.62,369.33,0.0
gfx942,304,49152,5120,1024,ck,0,0,757.6667,a8w8_blockscale_1x128x128_256x128x128x128_16x16_32x32_2x2_8x32x1_8x32x1_1x32x1x8_8_1x1_intrawave_v3,680.24,737.65,0.0
gfx942,304,49152,5120,3200,ck,0,0,1832.7496,a8w8_blockscale_1x128x128_256x128x128x128_16x16_32x32_2x2_8x32x1_8x32x1_1x32x1x8_8_1x1_intrawave_v3,878.8,369.38,0.0
gfx942,304,49280,5120,1024,ck,0,0,756.1973,a8w8_blockscale_1x128x128_256x128x128x128_16x16_32x32_2x2_8x32x1_8x32x1_1x32x1x8_8_1x1_intrawave_v3,683.34,740.99,0.0
gfx942,304,49280,5120,3200,ck,0,0,1881.4838,a8w8_blockscale_1x128x128_256x128x128x128_16x16_32x32_2x2_8x32x1_8x32x1_1x32x1x8_8_1x1_intrawave_v3,858.26,360.73,0.0
gfx942,304,49408,5120,1024,ck,0,0,760.4008,a8w8_blockscale_1x128x128_256x128x128x128_16x16_32x32_2x2_8x32x1_8x32x1_1x32x1x8_8_1x1_intrawave_v3,681.33,738.79,0.0
gfx942,304,49408,5120,3200,ck,0,0,1846.4638,a8w8_blockscale_1x128x128_256x128x128x128_16x16_32x32_2x2_8x32x1_8x32x1_1x32x1x8_8_1x1_intrawave_v3,876.81,368.5,0.0
gfx942,304,49536,5120,1024,ck,0,0,758.584,a8w8_blockscale_1x128x128_256x128x128x128_16x16_32x32_2x2_8x32x1_8x32x1_1x32x1x8_8_1x1_intrawave_v3,684.73,742.46,0.0
gfx942,304,49536,5120,3200,ck,0,0,1842.8809,a8w8_blockscale_1x128x128_256x128x128x128_16x16_32x32_2x2_8x32x1_8x32x1_1x32x1x8_8_1x1_intrawave_v3,880.79,370.15,0.0
gfx942,304,49664,5120,1024,ck,0,0,754.744,a8w8_blockscale_1x128x128_256x128x128x128_16x16_32x32_2x2_8x32x1_8x32x1_1x32x1x8_8_1x1_intrawave_v3,689.99,748.15,0.0
gfx942,304,49664,5120,3200,ck,0,0,1966.4204,a8w8_blockscale_1x128x128_256x128x128x128_16x16_32x32_2x2_8x32x1_8x32x1_1x32x1x8_8_1x1_intrawave_v3,827.59,347.77,0.0
gfx942,304,49792,5120,1024,ck,0,0,757.7683,a8w8_blockscale_1x128x128_256x128x128x128_16x16_32x32_2x2_8x32x1_8x32x1_1x32x1x8_8_1x1_intrawave_v3,689.01,747.06,0.0
gfx942,304,49792,5120,3200,ck,0,0,1965.431,a8w8_blockscale_1x128x128_256x128x128x128_16x16_32x32_2x2_8x32x1_8x32x1_1x32x1x8_8_1x1_intrawave_v3,830.14,348.82,0.0
gfx942,304,49920,5120,1024,ck,0,0,769.4339,a8w8_blockscale_1x128x128_256x128x128x128_16x16_32x32_2x2_8x32x1_8x32x1_1x32x1x8_8_1x1_intrawave_v3,680.3,737.61,0.0
gfx942,304,49920,5120,3200,ck,0,0,1901.6905,a8w8_blockscale_1x128x128_256x128x128x128_16x16_32x32_2x2_8x32x1_8x32x1_1x32x1x8_8_1x1_intrawave_v3,860.17,361.42,0.0
gfx942,304,50048,5120,1024,ck,0,0,758.7753,a8w8_blockscale_1x128x128_256x128x128x128_16x16_32x32_2x2_8x32x1_8x32x1_1x32x1x8_8_1x1_intrawave_v3,691.63,749.87,0.0
gfx942,304,50048,5120,3200,ck,0,0,1908.6817,a8w8_blockscale_1x128x128_256x128x128x128_16x16_32x32_2x2_8x32x1_8x32x1_1x32x1x8_8_1x1_intrawave_v3,859.22,361.0,0.0
gfx942,304,50176,5120,1024,ck,0,0,788.2974,a8w8_blockscale_1x128x128_256x128x128x128_16x16_32x32_2x2_8x32x1_8x32x1_1x32x1x8_8_1x1_intrawave_v3,667.43,723.62,0.0
gfx942,304,50176,5120,3200,ck,0,0,1864.4198,a8w8_blockscale_1x128x128_256x128x128x128_16x16_32x32_2x2_8x32x1_8x32x1_1x32x1x8_8_1x1_intrawave_v3,881.87,370.49,0.0
gfx942,304,50304,5120,1024,ck,0,0,767.5199,a8w8_blockscale_1x128x128_256x128x128x128_16x16_32x32_2x2_8x32x1_8x32x1_1x32x1x8_8_1x1_intrawave_v3,687.25,745.08,0.0
gfx942,304,50304,5120,3200,ck,0,0,1861.3611,a8w8_blockscale_1x128x128_256x128x128x128_16x16_32x32_2x2_8x32x1_8x32x1_1x32x1x8_8_1x1_intrawave_v3,885.57,372.02,0.0
gfx942,304,50432,5120,1024,ck,0,0,767.0507,a8w8_blockscale_1x128x128_256x128x128x128_16x16_32x32_2x2_8x32x1_8x32x1_1x32x1x8_8_1x1_intrawave_v3,689.42,747.42,0.0
gfx942,304,50432,5120,3200,ck,0,0,1932.9564,a8w8_blockscale_1x128x128_256x128x128x128_16x16_32x32_2x2_8x32x1_8x32x1_1x32x1x8_8_1x1_intrawave_v3,854.94,359.13,0.0
gfx942,304,50560,5120,1024,ck,0,0,768.752,a8w8_blockscale_1x128x128_256x128x128x128_16x16_32x32_2x2_8x32x1_8x32x1_1x32x1x8_8_1x1_intrawave_v3,689.64,747.64,0.0
gfx942,304,50560,5120,3200,ck,0,0,1877.0983,a8w8_blockscale_1x128x128_256x128x128x128_16x16_32x32_2x2_8x32x1_8x32x1_1x32x1x8_8_1x1_intrawave_v3,882.61,370.74,0.0
gfx942,304,50688,5120,1024,ck,0,0,780.6023,a8w8_blockscale_1x128x128_256x128x128x128_16x16_32x32_2x2_8x32x1_8x32x1_1x32x1x8_8_1x1_intrawave_v3,680.89,738.14,0.0
gfx942,304,50688,5120,3200,ck,0,0,1935.0184,a8w8_blockscale_1x128x128_256x128x128x128_16x16_32x32_2x2_8x32x1_8x32x1_1x32x1x8_8_1x1_intrawave_v3,858.36,360.53,0.0
gfx942,304,50816,5120,1024,ck,0,0,770.6017,a8w8_blockscale_1x128x128_256x128x128x128_16x16_32x32_2x2_8x32x1_8x32x1_1x32x1x8_8_1x1_intrawave_v3,691.47,749.59,0.0
gfx942,304,50816,5120,3200,ck,0,0,1955.7262,a8w8_blockscale_1x128x128_256x128x128x128_16x16_32x32_2x2_8x32x1_8x32x1_1x32x1x8_8_1x1_intrawave_v3,851.42,357.59,0.0
gfx942,304,50944,5120,1024,ck,0,0,787.2769,a8w8_blockscale_1x128x128_256x128x128x128_16x16_32x32_2x2_8x32x1_8x32x1_1x32x1x8_8_1x1_intrawave_v3,678.52,735.54,0.0
gfx942,304,50944,5120,3200,ck,0,0,1895.74,a8w8_blockscale_1x128x128_256x128x128x128_16x16_32x32_2x2_8x32x1_8x32x1_1x32x1x8_8_1x1_intrawave_v3,880.57,369.81,0.0
gfx942,304,51072,5120,1024,ck,0,0,801.6784,a8w8_blockscale_1x128x128_256x128x128x128_16x16_32x32_2x2_8x32x1_8x32x1_1x32x1x8_8_1x1_intrawave_v3,668.01,724.13,0.0
gfx942,304,51072,5120,3200,ck,0,0,1898.4433,a8w8_blockscale_1x128x128_256x128x128x128_16x16_32x32_2x2_8x32x1_8x32x1_1x32x1x8_8_1x1_intrawave_v3,881.53,370.19,0.0
gfx942,304,51200,5120,1024,ck,0,0,783.4457,a8w8_blockscale_1x128x128_256x128x128x128_16x16_32x32_2x2_8x32x1_8x32x1_1x32x1x8_8_1x1_intrawave_v3,685.27,742.82,0.0
gfx942,304,51200,5120,3200,ck,0,0,1897.5928,a8w8_blockscale_1x128x128_256x128x128x128_16x16_32x32_2x2_8x32x1_8x32x1_1x32x1x8_8_1x1_intrawave_v3,884.13,371.27,0.0
gfx942,304,51328,5120,1024,ck,0,0,780.2413,a8w8_blockscale_1x128x128_256x128x128x128_16x16_32x32_2x2_8x32x1_8x32x1_1x32x1x8_8_1x1_intrawave_v3,689.8,747.72,0.0
gfx942,304,51328,5120,3200,ck,0,0,1911.9097,a8w8_blockscale_1x128x128_256x128x128x128_16x16_32x32_2x2_8x32x1_8x32x1_1x32x1x8_8_1x1_intrawave_v3,879.7,369.39,0.0
