aiter/configs/model_configs/a8w8_bpreshuffle_tuned_gemm_qwen3_5_397b_a17b_mxfp4_attnfp8.csv
gfx,cu_num,M,N,K,q_dtype_w,libtype,kernelId,splitK,us,kernelName,tflops,bw,errRatio
gfx950,256,1,4096,1024,torch.float8_e4m3fn,flydsl,1,0,4.4217,flydsl_bpreshuflle_16x64x512_F8_F8_B16_0x0x0x2_default,1.9,950.66,0.0
gfx950,256,2,4096,1024,torch.float8_e4m3fn,flydsl,737,0,4.4712,flydsl_bpreshuflle_16x64x512_F8_F8_B16_0x3x0x2_default,3.75,942.19,0.0
gfx950,256,4,4096,1024,torch.float8_e4m3fn,flydsl,249,0,4.0052,flydsl_bpreshuflle_16x64x512_F8_F8_B16_0x1x0x2_default,8.38,1056.42,0.0
gfx950,256,8,4096,1024,torch.float8_e4m3fn,flydsl,737,0,4.557,flydsl_bpreshuflle_16x64x512_F8_F8_B16_0x3x0x2_default,14.73,936.59,0.0
gfx950,256,12,4096,1024,torch.float8_e4m3fn,flydsl,497,0,3.9654,flydsl_bpreshuflle_16x64x512_F8_F8_B16_0x2x0x2_default,25.39,1085.61,0.0
gfx950,256,16,4096,1024,torch.float8_e4m3fn,flydsl,249,0,4.5415,flydsl_bpreshuflle_16x64x512_F8_F8_B16_0x1x0x2_default,29.55,956.02,0.0
gfx950,256,32,4096,1024,torch.float8_e4m3fn,flydsl,961,0,4.0169,flydsl_bpreshuflle_16x64x512_F8_F8_B16_0x4x0x2_default,66.83,1117.58,0.0
gfx950,256,1,4096,4096,torch.float8_e4m3fn,flydsl,249,0,8.0167,flydsl_bpreshuflle_16x64x512_F8_F8_B16_0x1x0x2_default,4.19,2094.32,0.0
gfx950,256,2,4096,4096,torch.float8_e4m3fn,flydsl,961,0,8.0767,flydsl_bpreshuflle_16x64x512_F8_F8_B16_0x4x0x2_default,8.31,2080.28,0.0
gfx950,256,4,4096,4096,torch.float8_e4m3fn,flydsl,1,0,8.1491,flydsl_bpreshuflle_16x64x512_F8_F8_B16_0x0x0x2_default,16.47,2064.81,0.0
gfx950,256,8,4096,4096,torch.float8_e4m3fn,flydsl,1,0,8.2125,flydsl_bpreshuflle_16x64x512_F8_F8_B16_0x0x0x2_default,32.69,2054.86,0.0
gfx950,256,12,4096,4096,torch.float8_e4m3fn,flydsl,497,0,7.8169,flydsl_bpreshuflle_16x64x512_F8_F8_B16_0x2x0x2_default,51.51,2165.14,0.0
gfx950,256,16,4096,4096,torch.float8_e4m3fn,ck,24,0,7.8965,a8w8_bpreshuffle_128x16x32x512_16x16_16x16_32x4x1_32x4x1_1x16x1x8_4x4x1_1x1_intrawave_v2,67.99,2149.54,0.0
gfx950,256,32,4096,4096,torch.float8_e4m3fn,ck,8,0,8.0244,a8w8_bpreshuffle_128x32x16x512_16x16_16x16_32x4x1_32x4x1_1x32x1x4_4x4x1_1x1_intrawave_v1,133.81,2139.78,0.0
gfx950,256,1,8704,4096,torch.float8_e4m3fn,flydsl,557,0,9.1075,flydsl_bpreshuflle_16x64x512_F8_F8_B16_0x2x4x2_default,7.83,3916.89,0.0
gfx950,256,2,8704,4096,torch.float8_e4m3fn,flydsl,737,0,8.7986,flydsl_bpreshuflle_16x64x512_F8_F8_B16_0x3x0x2_default,16.21,4056.85,0.0
gfx950,256,4,8704,4096,torch.float8_e4m3fn,flydsl,677,0,8.8884,flydsl_bpreshuflle_16x64x512_F8_F8_B16_1x2x4x2_default,32.09,4020.7,0.0
gfx950,256,8,8704,4096,torch.float8_e4m3fn,flydsl,435,0,9.2862,flydsl_bpreshuflle_16x64x512_F8_F8_B16_1x1x4x2_default,61.43,3857.73,0.0
gfx950,256,12,8704,4096,torch.float8_e4m3fn,flydsl,905,0,9.1087,flydsl_bpreshuflle_16x64x512_F8_F8_B16_1x3x4x2_default,93.94,3942.34,0.0
gfx950,256,16,8704,4096,torch.float8_e4m3fn,flydsl,677,0,9.663,flydsl_bpreshuflle_16x64x512_F8_F8_B16_1x2x4x2_default,118.06,3725.1,0.0
gfx950,256,32,8704,4096,torch.float8_e4m3fn,flydsl,10,0,10.6752,flydsl_bpreshuflle_32x64x512_F8_F8_B16_0x0x0x2_default,213.74,3404.12,0.0
gfx950,256,1,10240,4096,torch.float8_e4m3fn,flydsl,1,0,9.6059,flydsl_bpreshuflle_16x64x512_F8_F8_B16_0x0x0x2_default,8.73,4368.94,0.0
gfx950,256,2,10240,4096,torch.float8_e4m3fn,flydsl,1108,0,9.6219,flydsl_bpreshuflle_16x64x512_F8_F8_B16_1x4x4x2_default,17.44,4364.23,0.0
gfx950,256,4,10240,4096,torch.float8_e4m3fn,flydsl,905,0,9.6094,flydsl_bpreshuflle_16x64x512_F8_F8_B16_1x3x4x2_default,34.92,4375.02,0.0
gfx950,256,8,10240,4096,torch.float8_e4m3fn,flydsl,63,0,9.6885,flydsl_bpreshuflle_16x64x512_F8_F8_B16_0x0x4x2_default,69.27,4349.45,0.0
gfx950,256,12,10240,4096,torch.float8_e4m3fn,flydsl,63,0,9.4205,flydsl_bpreshuflle_16x64x512_F8_F8_B16_0x0x4x2_default,106.86,4483.62,0.0
gfx950,256,16,10240,4096,torch.float8_e4m3fn,flydsl,677,0,10.1277,flydsl_bpreshuflle_16x64x512_F8_F8_B16_1x2x4x2_default,132.53,4180.24,0.0
gfx950,256,32,10240,4096,torch.float8_e4m3fn,flydsl,320,0,11.062,flydsl_bpreshuflle_32x64x512_F8_F8_B16_0x1x4x2_default,242.66,3862.73,0.0
gfx950,256,64,4096,1024,torch.float8_e4m3fn,flydsl,311,0,4.7808,flydsl_bpreshuflle_16x64x512_F8_F8_B16_0x1x4x2_default,112.3,1000.7,0.0
gfx950,256,128,4096,1024,torch.float8_e4m3fn,flydsl,72,0,5.2382,flydsl_bpreshuflle_32x64x512_F8_F8_B16_0x0x4x2_default,204.98,1025.92,0.0
gfx950,256,256,4096,1024,torch.float8_e4m3fn,flydsl,518,0,6.0712,flydsl_bpreshuflle_64x64x256_F8_F8_B16_0x2x0x2_default,353.72,1079.46,0.0
gfx950,256,512,4096,1024,torch.float8_e4m3fn,flydsl,458,0,7.2692,flydsl_bpreshuflle_64x128x256_F8_F8_B16_1x1x4x2_default,590.84,1226.12,0.0
gfx950,256,1024,4096,1024,torch.float8_e4m3fn,flydsl,234,0,10.0056,flydsl_bpreshuflle_128x128x256_F8_F8_B16_1x0x4x2_default,858.51,1362.39,0.0
gfx950,256,2048,4096,1024,torch.float8_e4m3fn,flydsl,485,0,14.6791,flydsl_bpreshuflle_128x256x128_F8_F8_B16_1x1x4x2_default,1170.36,1571.53,0.0
gfx950,256,4096,4096,1024,torch.float8_e4m3fn,flydsl,245,0,25.664,flydsl_bpreshuflle_256x128x128_F8_F8_B16_1x0x4x2_default,1338.83,1634.31,0.0
gfx950,256,8192,4096,1024,torch.float8_e4m3fn,flydsl,1763,0,48.6791,flydsl_bpreshuflle_128x256x128_F8_F8_B16_0x2x4x1_default,1411.68,1637.08,0.0
gfx950,256,64,4096,4096,torch.float8_e4m3fn,ck,11,0,8.374,a8w8_bpreshuffle_256x16x64x512_16x16_16x16_32x8x1_32x8x1_1x16x1x16_4x4x1_1x1_intrawave_v1,256.45,2097.4,0.0
gfx950,256,128,4096,4096,torch.float8_e4m3fn,flydsl,1722,0,9.7705,flydsl_bpreshuflle_32x64x512_F8_F8_B16_0x2x4x1_default,439.59,1878.11,0.0
gfx950,256,256,4096,4096,torch.float8_e4m3fn,ck,114,0,12.8635,a8w8_bpreshuffle_256x64x64x256_16x16_16x16_16x16x1_16x16x1_1x32x1x8_8x8x1_2x1_intrawave_v3,667.78,1548.8,0.0
gfx950,256,512,4096,4096,torch.float8_e4m3fn,flydsl,928,0,16.0292,flydsl_bpreshuflle_64x128x256_F8_F8_B16_1x3x4x2_default,1071.79,1439.17,0.0
gfx950,256,1024,4096,4096,torch.float8_e4m3fn,flydsl,952,0,23.5732,flydsl_bpreshuflle_128x128x256_F8_F8_B16_1x3x4x2_default,1457.58,1245.49,0.0
gfx950,256,2048,4096,4096,torch.float8_e4m3fn,flydsl,727,0,35.9447,flydsl_bpreshuflle_128x256x128_F8_F8_B16_1x2x4x2_default,1911.81,1166.88,0.0
gfx950,256,4096,4096,4096,torch.float8_e4m3fn,flydsl,1331,0,66.8132,flydsl_bpreshuflle_128x256x128_F8_F8_B16_1x0x0x1_default,2057.06,1004.43,0.0
gfx950,256,8192,4096,4096,torch.float8_e4m3fn,flydsl,727,0,124.7335,flydsl_bpreshuflle_128x256x128_F8_F8_B16_1x2x4x2_default,2203.72,941.53,0.0
gfx950,256,64,8704,4096,torch.float8_e4m3fn,flydsl,2070,0,13.1288,flydsl_bpreshuflle_32x64x512_F8_F8_B16_1x3x4x1_default,347.59,2820.35,0.0
gfx950,256,128,8704,4096,torch.float8_e4m3fn,flydsl,698,0,16.1327,flydsl_bpreshuflle_64x64x256_F8_F8_B16_1x2x4x2_default,565.73,2380.51,0.0
gfx950,256,256,8704,4096,torch.float8_e4m3fn,flydsl,234,0,21.3255,flydsl_bpreshuflle_128x128x256_F8_F8_B16_1x0x4x2_default,855.95,1929.92,0.0
gfx950,256,512,8704,4096,torch.float8_e4m3fn,cktile,125,0,31.7843,a8w8_bpreshuffle_cktile_0x0x8x4x1x0x0x0x0x2_80x128x256_1x4x1_16x16x128_default,1148.59,1468.07,0.0
gfx950,256,1024,8704,4096,torch.float8_e4m3fn,flydsl,234,0,50.0631,flydsl_bpreshuflle_128x128x256_F8_F8_B16_1x0x4x2_default,1458.45,1151.98,0.0
gfx950,256,2048,8704,4096,torch.float8_e4m3fn,cktile,82,0,83.549,a8w8_bpreshuffle_cktile_0x0x8x4x1x0x0x0x0x1_96x256x128_1x4x1_16x16x128_default,1747.82,953.83,0.0
gfx950,256,4096,8704,4096,torch.float8_e4m3fn,flydsl,727,0,144.1547,flydsl_bpreshuflle_128x256x128_F8_F8_B16_1x2x4x2_default,2026.0,858.33,0.0
gfx950,256,8192,8704,4096,torch.float8_e4m3fn,flydsl,727,0,247.5521,flydsl_bpreshuflle_128x256x128_F8_F8_B16_1x2x4x2_default,2359.57,855.63,0.0
gfx950,256,64,10240,4096,torch.float8_e4m3fn,flydsl,1129,0,13.985,flydsl_bpreshuflle_64x64x256_F8_F8_B16_1x4x4x2_default,383.89,3111.61,0.0
gfx950,256,128,10240,4096,torch.float8_e4m3fn,flydsl,700,0,16.6906,flydsl_bpreshuflle_64x128x256_F8_F8_B16_1x2x4x2_default,643.32,2701.45,0.0
gfx950,256,256,10240,4096,torch.float8_e4m3fn,flydsl,952,0,21.7093,flydsl_bpreshuflle_128x128x256_F8_F8_B16_1x3x4x2_default,989.2,2221.84,0.0
gfx950,256,512,10240,4096,torch.float8_e4m3fn,flydsl,234,0,33.2179,flydsl_bpreshuflle_128x128x256_F8_F8_B16_1x0x4x2_default,1292.97,1641.46,0.0
gfx950,256,1024,10240,4096,torch.float8_e4m3fn,flydsl,482,0,54.2639,flydsl_bpreshuflle_128x128x256_F8_F8_B16_1x1x4x2_default,1582.99,1236.71,0.0
gfx950,256,2048,10240,4096,torch.float8_e4m3fn,flydsl,727,0,86.703,flydsl_bpreshuflle_128x256x128_F8_F8_B16_1x2x4x2_default,1981.46,1064.26,0.0
gfx950,256,4096,10240,4096,torch.float8_e4m3fn,flydsl,727,0,150.4111,flydsl_bpreshuflle_128x256x128_F8_F8_B16_1x2x4x2_default,2284.39,948.11,0.0
gfx950,256,8192,10240,4096,torch.float8_e4m3fn,flydsl,727,0,276.3923,flydsl_bpreshuflle_128x256x128_F8_F8_B16_1x2x4x2_default,2486.3,880.16,0.0
