aiter/configs/model_configs/a8w8_blockscale_tuned_fmoe_glm5_1.csv
cu_num,token,model_dim,inter_dim,expert,topk,act_type,dtype,q_dtype_a,q_dtype_w,q_type,use_g1u1,doweight_stage1,block_m,ksplit,us1,kernelName1,err1,us2,kernelName2,err2,us,run_1stage,xbf16,tflops,bw,_tag
304,1,6144,2048,32,8,ActivationType.Silu,torch.bfloat16,torch.float8_e4m3fnuz,torch.float8_e4m3fnuz,QuantType.per_1x128,1,0,32,0,85.1113,_ZN5aiter50fmoe_bf16_blockscaleFp8_g1u1_vs_silu_1tg_ps_32x128E,0.0%,0.0,,0.0%,85.1113,1,0,7.1,14192.92,
304,2,6144,2048,32,8,ActivationType.Silu,torch.bfloat16,torch.float8_e4m3fnuz,torch.float8_e4m3fnuz,QuantType.per_1x128,1,0,32,0,139.3279,_ZN5aiter50fmoe_bf16_blockscaleFp8_g1u1_vs_silu_1tg_ps_32x256E,0.0%,0.0,,0.0%,139.3279,1,0,8.67,8670.17,
304,4,6144,2048,32,8,ActivationType.Silu,torch.bfloat16,torch.float8_e4m3fnuz,torch.float8_e4m3fnuz,QuantType.per_1x128,1,0,32,0,207.6314,_ZN5aiter47fmoe_bf16_blockscaleFp8_g1u1_vs_silu_1tg_32x256E,0.0%,0.0,,0.0%,207.6314,1,0,11.64,5818.16,
304,8,6144,2048,32,8,ActivationType.Silu,torch.bfloat16,torch.float8_e4m3fnuz,torch.float8_e4m3fnuz,QuantType.per_1x128,1,0,32,0,241.8714,_ZN5aiter47fmoe_bf16_blockscaleFp8_g1u1_vs_silu_1tg_32x256E,0.0%,0.0,,0.0%,241.8714,1,0,19.98,4994.83,
304,16,6144,2048,32,8,ActivationType.Silu,torch.bfloat16,torch.float8_e4m3fnuz,torch.float8_e4m3fnuz,QuantType.per_1x128,1,0,32,0,279.8341,_ZN5aiter50fmoe_bf16_blockscaleFp8_g1u1_vs_silu_1tg_ps_32x256E,0.0%,0.0,,0.0%,279.8341,1,0,34.53,4317.75,
304,32,6144,2048,32,8,ActivationType.Silu,torch.bfloat16,torch.float8_e4m3fnuz,torch.float8_e4m3fnuz,QuantType.per_1x128,1,0,32,0,293.5291,_ZN5aiter49fmoe_bf16_blockscaleFp8_g1u1_novs_silu_1tg_32x256E,0.0%,0.0,,0.0%,293.5291,1,0,65.84,4117.31,
304,64,6144,2048,32,8,ActivationType.Silu,torch.bfloat16,torch.float8_e4m3fnuz,torch.float8_e4m3fnuz,QuantType.per_1x128,1,0,32,0,302.1429,_ZN5aiter52fmoe_bf16_blockscaleFp8_g1u1_novs_silu_1tg_ps_32x256E,0.0%,0.0,,0.0%,302.1429,1,0,127.94,4001.88,
304,128,6144,2048,32,8,ActivationType.Silu,torch.bfloat16,torch.float8_e4m3fnuz,torch.float8_e4m3fnuz,QuantType.per_1x128,1,0,64,0,334.8752,_ZN5aiter43fmoe_bf16_blockscaleFp8_g1u1_vs_silu_64x256E,0.0%,0.0,,0.0%,334.8752,1,0,230.86,3614.24,
304,256,6144,2048,32,8,ActivationType.Silu,torch.bfloat16,torch.float8_e4m3fnuz,torch.float8_e4m3fnuz,QuantType.per_1x128,1,0,32,0,447.7594,_ZN5aiter47fmoe_bf16_blockscaleFp8_g1u1_vs_silu_1tg_32x256E,0.0%,0.0,,0.0%,447.7594,1,0,345.32,2708.33,
304,1024,6144,2048,32,8,ActivationType.Silu,torch.bfloat16,torch.float8_e4m3fnuz,torch.float8_e4m3fnuz,QuantType.per_1x128,1,0,64,0,986.9189,_ZN5aiter43fmoe_bf16_blockscaleFp8_g1u1_vs_silu_64x256E,0.0%,0.0,,0.0%,986.9189,1,0,626.67,1243.09,
304,2048,6144,2048,32,8,ActivationType.Silu,torch.bfloat16,torch.float8_e4m3fnuz,torch.float8_e4m3fnuz,QuantType.per_1x128,1,0,32,0,1875.2839,_ZN5aiter47fmoe_bf16_blockscaleFp8_g1u1_vs_silu_1tg_32x256E,0.0%,0.0,,0.0%,1875.2839,1,0,659.61,664.28,
304,4096,6144,2048,32,8,ActivationType.Silu,torch.bfloat16,torch.float8_e4m3fnuz,torch.float8_e4m3fnuz,QuantType.per_1x128,1,0,64,0,3401.6051,_ZN5aiter43fmoe_bf16_blockscaleFp8_g1u1_vs_silu_64x256E,0.0%,0.0,,0.0%,3401.6051,1,0,727.27,377.31,
304,8192,6144,2048,32,8,ActivationType.Silu,torch.bfloat16,torch.float8_e4m3fnuz,torch.float8_e4m3fnuz,QuantType.per_1x128,1,0,64,0,6655.1026,_ZN5aiter43fmoe_bf16_blockscaleFp8_g1u1_vs_silu_64x256E,0.0%,0.0,,0.0%,6655.1026,1,0,743.46,204.2,
304,16384,6144,2048,32,8,ActivationType.Silu,torch.bfloat16,torch.float8_e4m3fnuz,torch.float8_e4m3fnuz,QuantType.per_1x128,1,0,64,0,13155.6144,_ZN5aiter43fmoe_bf16_blockscaleFp8_g1u1_vs_silu_64x256E,0.0%,0.0,,0.0%,13155.6144,1,0,752.2,114.78,
304,1,6144,256,257,9,ActivationType.Silu,torch.bfloat16,torch.float8_e4m3fnuz,torch.float8_e4m3fnuz,QuantType.per_1x128,1,0,32,0,69.8232,_ZN5aiter47fmoe_bf16_blockscaleFp8_g1u1_vs_silu_1tg_32x128E,0.0%,0.0,,0.0%,69.8232,1,0,1.22,17368.1,
304,2,6144,256,257,9,ActivationType.Silu,torch.bfloat16,torch.float8_e4m3fnuz,torch.float8_e4m3fnuz,QuantType.per_1x128,1,0,32,0,71.3105,_ZN5aiter47fmoe_bf16_blockscaleFp8_g1u1_vs_silu_1tg_32x128E,0.0%,0.0,,0.0%,71.3105,1,0,2.38,17006.12,
304,4,6144,256,257,9,ActivationType.Silu,torch.bfloat16,torch.float8_e4m3fnuz,torch.float8_e4m3fnuz,QuantType.per_1x128,1,0,32,0,74.5101,_ZN5aiter47fmoe_bf16_blockscaleFp8_g1u1_vs_silu_1tg_32x128E,0.0%,0.0,,0.0%,74.5101,1,0,4.56,16276.34,
304,8,6144,256,257,9,ActivationType.Silu,torch.bfloat16,torch.float8_e4m3fnuz,torch.float8_e4m3fnuz,QuantType.per_1x128,1,0,32,0,92.1876,_ZN5aiter52fmoe_bf16_blockscaleFp8_g1u1_novs_silu_1tg_ps_32x128E,0.0%,0.0,,0.0%,92.1876,1,0,7.37,13156.06,
304,16,6144,256,257,9,ActivationType.Silu,torch.bfloat16,torch.float8_e4m3fnuz,torch.float8_e4m3fnuz,QuantType.per_1x128,1,0,32,0,132.7928,_ZN5aiter47fmoe_bf16_blockscaleFp8_g1u1_vs_silu_1tg_32x128E,0.0%,0.0,,0.0%,132.7928,1,0,10.23,9134.33,
304,32,6144,256,257,9,ActivationType.Silu,torch.bfloat16,torch.float8_e4m3fnuz,torch.float8_e4m3fnuz,QuantType.per_1x128,1,0,32,0,198.0035,_ZN5aiter47fmoe_bf16_blockscaleFp8_g1u1_vs_silu_1tg_32x256E,0.0%,0.0,,0.0%,198.0035,1,0,13.73,6127.51,
304,64,6144,256,257,9,ActivationType.Silu,torch.bfloat16,torch.float8_e4m3fnuz,torch.float8_e4m3fnuz,QuantType.per_1x128,1,0,32,0,262.1929,_ZN5aiter50fmoe_bf16_blockscaleFp8_g1u1_vs_silu_1tg_ps_32x256E,0.0%,0.0,,0.0%,262.1929,1,0,20.73,4629.64,
304,128,6144,256,257,9,ActivationType.Silu,torch.bfloat16,torch.float8_e4m3fnuz,torch.float8_e4m3fnuz,QuantType.per_1x128,1,0,32,0,290.8255,_ZN5aiter52fmoe_bf16_blockscaleFp8_g1u1_novs_silu_1tg_ps_32x256E,0.0%,0.0,,0.0%,290.8255,1,0,37.38,4177.89,
304,256,6144,256,257,9,ActivationType.Silu,torch.bfloat16,torch.float8_e4m3fnuz,torch.float8_e4m3fnuz,QuantType.per_1x128,1,0,32,0,301.4273,_ZN5aiter52fmoe_bf16_blockscaleFp8_g1u1_novs_silu_1tg_ps_32x256E,0.0%,0.0,,0.0%,301.4273,1,0,72.13,4038.77,
304,512,6144,256,257,9,ActivationType.Silu,torch.bfloat16,torch.float8_e4m3fnuz,torch.float8_e4m3fnuz,QuantType.per_1x128,1,0,32,0,310.917,_ZN5aiter52fmoe_bf16_blockscaleFp8_g1u1_novs_silu_1tg_ps_32x256E,0.0%,0.0,,0.0%,310.917,1,0,139.87,3930.68,
304,1024,6144,256,257,9,ActivationType.Silu,torch.bfloat16,torch.float8_e4m3fnuz,torch.float8_e4m3fnuz,QuantType.per_1x128,1,0,64,0,353.377,_ZN5aiter43fmoe_bf16_blockscaleFp8_g1u1_vs_silu_64x256E,0.0%,0.0,,0.0%,353.377,1,0,246.12,3485.1,
304,2048,6144,256,257,9,ActivationType.Silu,torch.bfloat16,torch.float8_e4m3fnuz,torch.float8_e4m3fnuz,QuantType.per_1x128,1,0,64,0,547.545,_ZN5aiter46fmoe_bf16_blockscaleFp8_g1u1_vs_ps_silu_64x256E,0.0%,0.0,,0.0%,547.545,1,0,317.68,2283.7,
304,4096,6144,256,257,9,ActivationType.Silu,torch.bfloat16,torch.float8_e4m3fnuz,torch.float8_e4m3fnuz,QuantType.per_1x128,1,0,64,0,827.9386,_ZN5aiter46fmoe_bf16_blockscaleFp8_g1u1_vs_ps_silu_64x256E,0.0%,0.0,,0.0%,827.9386,1,0,420.19,1555.88,
304,8192,6144,256,257,9,ActivationType.Silu,torch.bfloat16,torch.float8_e4m3fnuz,torch.float8_e4m3fnuz,QuantType.per_1x128,1,0,64,0,1344.6203,_ZN5aiter46fmoe_bf16_blockscaleFp8_g1u1_vs_ps_silu_64x256E,0.0%,0.0,,0.0%,1344.6203,1,0,517.46,1014.17,
304,16384,6144,256,257,9,ActivationType.Silu,torch.bfloat16,torch.float8_e4m3fnuz,torch.float8_e4m3fnuz,QuantType.per_1x128,1,0,64,0,2287.1742,_ZN5aiter46fmoe_bf16_blockscaleFp8_g1u1_vs_ps_silu_64x256E,0.0%,0.0,,0.0%,2287.1742,1,0,608.42,662.24,
