aiter/configs/model_configs/a8w8_blockscale_tuned_gemm_qwen36_27b_tp8.csv
gfx,cu_num,M,N,K,libtype,kernelId,splitK,us,kernelName,tflops,bw,errRatio
gfx942,304,16,2048,5120,ck,8,0,17.3072,a8w8_blockscale_1x128x128_256x16x64x256_16x16_16x16_1x1_16x16x1_16x16x1_1x16x1x16_4_1x1_intrawave_v1,19.39,614.38,0.0
gfx942,304,32,2048,5120,ck,8,0,17.4067,a8w8_blockscale_1x128x128_256x16x64x256_16x16_16x16_1x1_16x16x1_16x16x1_1x16x1x16_4_1x1_intrawave_v1,38.55,619.34,0.0
gfx942,304,48,2048,5120,ck,8,0,17.3609,a8w8_blockscale_1x128x128_256x16x64x256_16x16_16x16_1x1_16x16x1_16x16x1_1x16x1x16_4_1x1_intrawave_v1,57.98,629.47,0.0
gfx942,304,64,2048,5120,ck,8,0,17.3077,a8w8_blockscale_1x128x128_256x16x64x256_16x16_16x16_1x1_16x16x1_16x16x1_1x16x1x16_4_1x1_intrawave_v1,77.55,639.92,0.0
gfx942,304,80,2048,5120,ck,8,0,17.3325,a8w8_blockscale_1x128x128_256x16x64x256_16x16_16x16_1x1_16x16x1_16x16x1_1x16x1x16_4_1x1_intrawave_v1,96.8,647.51,0.0
gfx942,304,96,2048,5120,ck,8,0,17.3875,a8w8_blockscale_1x128x128_256x16x64x256_16x16_16x16_1x1_16x16x1_16x16x1_1x16x1x16_4_1x1_intrawave_v1,115.79,653.95,0.0
gfx942,304,112,2048,5120,ck,8,0,17.396,a8w8_blockscale_1x128x128_256x16x64x256_16x16_16x16_1x1_16x16x1_16x16x1_1x16x1x16_4_1x1_intrawave_v1,135.02,662.1,0.0
gfx942,304,128,2048,5120,ck,8,0,17.8508,a8w8_blockscale_1x128x128_256x16x64x256_16x16_16x16_1x1_16x16x1_16x16x1_1x16x1x16_4_1x1_intrawave_v1,150.38,653.49,0.0
gfx942,304,144,2048,5120,ck,8,0,18.1581,a8w8_blockscale_1x128x128_256x16x64x256_16x16_16x16_1x1_16x16x1_16x16x1_1x16x1x16_4_1x1_intrawave_v1,166.31,650.56,0.0
gfx942,304,160,2048,5120,ck,13,0,22.3508,a8w8_blockscale_1x128x128_256x32x64x256_16x16_16x16_2x1_16x16x1_16x16x1_1x32x1x8_8_2x1_intrawave_v1,150.13,535.12,0.0
gfx942,304,176,2048,5120,ck,13,0,22.9294,a8w8_blockscale_1x128x128_256x32x64x256_16x16_16x16_2x1_16x16x1_16x16x1_1x32x1x8_8_2x1_intrawave_v1,160.97,528.05,0.0
gfx942,304,192,2048,5120,ck,18,0,21.875,a8w8_blockscale_1x128x128_256x64x64x256_16x16_32x32_1x1_16x16x1_16x16x1_1x32x1x8_8_1x1_intrawave_v1,184.07,560.24,0.0
gfx942,304,208,2048,5120,ck,13,0,23.343,a8w8_blockscale_1x128x128_256x32x64x256_16x16_16x16_2x1_16x16x1_16x16x1_1x32x1x8_8_2x1_intrawave_v1,186.87,531.32,0.0
gfx942,304,224,2048,5120,ck,13,0,23.0037,a8w8_blockscale_1x128x128_256x32x64x256_16x16_16x16_2x1_16x16x1_16x16x1_1x32x1x8_8_2x1_intrawave_v1,204.21,545.57,0.0
gfx942,304,240,2048,5120,ck,13,0,23.5841,a8w8_blockscale_1x128x128_256x32x64x256_16x16_16x16_2x1_16x16x1_16x16x1_1x32x1x8_8_2x1_intrawave_v1,213.41,538.4,0.0
gfx942,304,256,2048,5120,ck,18,0,22.7541,a8w8_blockscale_1x128x128_256x64x64x256_16x16_32x32_1x1_16x16x1_16x16x1_1x32x1x8_8_1x1_intrawave_v1,235.94,564.52,0.0
gfx942,304,288,2048,5120,ck,13,0,23.4351,a8w8_blockscale_1x128x128_256x32x64x256_16x16_16x16_2x1_16x16x1_16x16x1_1x32x1x8_8_2x1_intrawave_v1,257.72,560.7,0.0
gfx942,304,320,2048,5120,ck,18,0,23.339,a8w8_blockscale_1x128x128_256x64x64x256_16x16_32x32_1x1_16x16x1_16x16x1_1x32x1x8_8_1x1_intrawave_v1,287.54,575.64,0.0
gfx942,304,352,2048,5120,ck,18,0,25.3968,a8w8_blockscale_1x128x128_256x64x64x256_16x16_32x32_1x1_16x16x1_16x16x1_1x32x1x8_8_1x1_intrawave_v1,290.67,540.61,0.0
gfx942,304,384,2048,5120,ck,18,0,23.9094,a8w8_blockscale_1x128x128_256x64x64x256_16x16_32x32_1x1_16x16x1_16x16x1_1x32x1x8_8_1x1_intrawave_v1,336.82,586.58,0.0
gfx942,304,416,2048,5120,ck,18,0,28.3705,a8w8_blockscale_1x128x128_256x64x64x256_16x16_32x32_1x1_16x16x1_16x16x1_1x32x1x8_8_1x1_intrawave_v1,307.51,504.74,0.0
gfx942,304,448,2048,5120,ck,18,0,25.7249,a8w8_blockscale_1x128x128_256x64x64x256_16x16_32x32_1x1_16x16x1_16x16x1_1x32x1x8_8_1x1_intrawave_v1,365.22,568.11,0.0
gfx942,304,480,2048,5120,ck,18,0,29.3463,a8w8_blockscale_1x128x128_256x64x64x256_16x16_32x32_1x1_16x16x1_16x16x1_1x32x1x8_8_1x1_intrawave_v1,343.02,508.05,0.0
gfx942,304,512,2048,5120,ck,18,0,26.6549,a8w8_blockscale_1x128x128_256x64x64x256_16x16_32x32_1x1_16x16x1_16x16x1_1x32x1x8_8_1x1_intrawave_v1,402.83,570.41,0.0
gfx942,304,544,2048,5120,ck,18,0,31.6542,a8w8_blockscale_1x128x128_256x64x64x256_16x16_32x32_1x1_16x16x1_16x16x1_1x32x1x8_8_1x1_intrawave_v1,360.41,489.64,0.0
gfx942,304,576,2048,5120,ck,18,0,29.4124,a8w8_blockscale_1x128x128_256x64x64x256_16x16_32x32_1x1_16x16x1_16x16x1_1x32x1x8_8_1x1_intrawave_v1,410.7,536.99,0.0
gfx942,304,608,2048,5120,ck,12,0,36.0002,a8w8_blockscale_1x128x128_256x32x128x256_16x16_32x32_1x1_16x16x1_16x16x1_1x32x1x8_8_1x1_intrawave_v1,354.18,446.92,0.0
gfx942,304,640,2048,5120,ck,3,0,40.5326,a8w8_blockscale_1x128x128_256x64x64x128_16x16_32x32_1x1_8x32x1_8x32x1_1x32x1x8_8_1x1_intrawave_v3,331.14,404.22,0.0
gfx942,304,672,2048,5120,ck,2,0,42.8428,a8w8_blockscale_1x128x128_256x64x128x128_16x16_32x32_1x2_8x32x1_8x32x1_1x32x1x8_8_1x1_intrawave_v3,328.94,389.3,0.0
gfx942,304,704,2048,5120,ck,3,0,41.9976,a8w8_blockscale_1x128x128_256x64x64x128_16x16_32x32_1x1_8x32x1_8x32x1_1x32x1x8_8_1x1_intrawave_v3,351.54,404.16,0.0
gfx942,304,736,2048,5120,ck,3,0,42.6461,a8w8_blockscale_1x128x128_256x64x64x128_16x16_32x32_1x1_8x32x1_8x32x1_1x32x1x8_8_1x1_intrawave_v3,361.93,404.93,0.0
gfx942,304,768,2048,5120,ck,3,0,41.2921,a8w8_blockscale_1x128x128_256x64x64x128_16x16_32x32_1x1_8x32x1_8x32x1_1x32x1x8_8_1x1_intrawave_v3,390.05,425.35,0.0
gfx942,304,800,2048,5120,ck,2,0,44.5053,a8w8_blockscale_1x128x128_256x64x128x128_16x16_32x32_1x2_8x32x1_8x32x1_1x32x1x8_8_1x1_intrawave_v3,376.97,401.27,0.0
gfx942,304,832,2048,5120,ck,3,0,45.0512,a8w8_blockscale_1x128x128_256x64x64x128_16x16_32x32_1x1_8x32x1_8x32x1_1x32x1x8_8_1x1_intrawave_v3,387.3,402.95,0.0
gfx942,304,864,2048,5120,ck,2,0,44.8298,a8w8_blockscale_1x128x128_256x64x128x128_16x16_32x32_1x2_8x32x1_8x32x1_1x32x1x8_8_1x1_intrawave_v3,404.18,411.52,0.0
gfx942,304,896,2048,5120,ck,1,0,48.3683,a8w8_blockscale_1x128x128_256x128x64x128_16x16_32x32_2x1_8x32x1_8x32x1_1x32x1x8_8_1x1_intrawave_v3,388.49,387.51,0.0
gfx942,304,928,2048,5120,ck,2,0,45.8397,a8w8_blockscale_1x128x128_256x64x128x128_16x16_32x32_1x2_8x32x1_8x32x1_1x32x1x8_8_1x1_intrawave_v3,424.56,415.32,0.0
gfx942,304,960,2048,5120,ck,3,0,47.7036,a8w8_blockscale_1x128x128_256x64x64x128_16x16_32x32_1x1_8x32x1_8x32x1_1x32x1x8_8_1x1_intrawave_v3,422.04,405.28,0.0
gfx942,304,992,2048,5120,ck,3,0,49.6506,a8w8_blockscale_1x128x128_256x64x64x128_16x16_32x32_1x1_8x32x1_8x32x1_1x32x1x8_8_1x1_intrawave_v3,419.0,395.32,0.0
gfx942,304,1024,2048,5120,ck,3,0,48.9287,a8w8_blockscale_1x128x128_256x64x64x128_16x16_32x32_1x1_8x32x1_8x32x1_1x32x1x8_8_1x1_intrawave_v3,438.9,407.18,0.0
gfx942,304,1088,2048,5120,ck,3,0,50.493,a8w8_blockscale_1x128x128_256x64x64x128_16x16_32x32_1x1_8x32x1_8x32x1_1x32x1x8_8_1x1_intrawave_v3,451.88,406.25,0.0
gfx942,304,1152,2048,5120,ck,2,0,52.0097,a8w8_blockscale_1x128x128_256x64x128x128_16x16_32x32_1x2_8x32x1_8x32x1_1x32x1x8_8_1x1_intrawave_v3,464.51,405.74,0.0
gfx942,304,1216,2048,5120,ck,2,0,53.0008,a8w8_blockscale_1x128x128_256x64x128x128_16x16_32x32_1x2_8x32x1_8x32x1_1x32x1x8_8_1x1_intrawave_v3,481.15,409.28,0.0
gfx942,304,1280,2048,5120,ck,2,0,63.4796,a8w8_blockscale_1x128x128_256x64x128x128_16x16_32x32_1x2_8x32x1_8x32x1_1x32x1x8_8_1x1_intrawave_v3,422.87,351.01,0.0
gfx942,304,1344,2048,5120,ck,0,0,60.9218,a8w8_blockscale_1x128x128_256x128x128x128_16x16_32x32_2x2_8x32x1_8x32x1_1x32x1x8_8_1x1_intrawave_v3,462.65,375.43,0.0
gfx942,304,1408,2048,5120,ck,2,0,67.0273,a8w8_blockscale_1x128x128_256x64x128x128_16x16_32x32_1x2_8x32x1_8x32x1_1x32x1x8_8_1x1_intrawave_v3,440.54,350.03,0.0
gfx942,304,1472,2048,5120,ck,0,0,62.2178,a8w8_blockscale_1x128x128_256x128x128x128_16x16_32x32_2x2_8x32x1_8x32x1_1x32x1x8_8_1x1_intrawave_v3,496.16,386.57,0.0
gfx942,304,1536,2048,5120,ck,2,0,67.086,a8w8_blockscale_1x128x128_256x64x128x128_16x16_32x32_1x2_8x32x1_8x32x1_1x32x1x8_8_1x1_intrawave_v3,480.16,367.31,0.0
gfx942,304,1600,2048,5120,ck,0,0,63.5109,a8w8_blockscale_1x128x128_256x128x128x128_16x16_32x32_2x2_8x32x1_8x32x1_1x32x1x8_8_1x1_intrawave_v3,528.33,397.28,0.0
gfx942,304,1664,2048,5120,ck,2,0,69.1403,a8w8_blockscale_1x128x128_256x64x128x128_16x16_32x32_1x2_8x32x1_8x32x1_1x32x1x8_8_1x1_intrawave_v3,504.72,373.46,0.0
gfx942,304,1728,2048,5120,ck,0,0,65.9413,a8w8_blockscale_1x128x128_256x128x128x128_16x16_32x32_2x2_8x32x1_8x32x1_1x32x1x8_8_1x1_intrawave_v3,549.56,400.52,0.0
gfx942,304,1792,2048,5120,ck,2,0,69.3201,a8w8_blockscale_1x128x128_256x64x128x128_16x16_32x32_1x2_8x32x1_8x32x1_1x32x1x8_8_1x1_intrawave_v3,542.14,389.51,0.0
gfx942,304,1856,2048,5120,ck,0,0,67.6306,a8w8_blockscale_1x128x128_256x128x128x128_16x16_32x32_2x2_8x32x1_8x32x1_1x32x1x8_8_1x1_intrawave_v3,575.53,407.96,0.0
gfx942,304,1920,2048,5120,ck,0,0,75.9097,a8w8_blockscale_1x128x128_256x128x128x128_16x16_32x32_2x2_8x32x1_8x32x1_1x32x1x8_8_1x1_intrawave_v3,530.44,371.24,0.0
gfx942,304,1984,2048,5120,ck,0,0,71.1725,a8w8_blockscale_1x128x128_256x128x128x128_16x16_32x32_2x2_8x32x1_8x32x1_1x32x1x8_8_1x1_intrawave_v3,584.6,404.23,0.0
gfx942,304,2048,2048,5120,ck,0,0,76.4977,a8w8_blockscale_1x128x128_256x128x128x128_16x16_32x32_2x2_8x32x1_8x32x1_1x32x1x8_8_1x1_intrawave_v3,561.45,383.8,0.0
gfx942,304,2112,2048,5120,ck,0,0,70.591,a8w8_blockscale_1x128x128_256x128x128x128_16x16_32x32_2x2_8x32x1_8x32x1_1x32x1x8_8_1x1_intrawave_v3,627.44,424.27,0.0
gfx942,304,2176,2048,5120,ck,0,0,79.0579,a8w8_blockscale_1x128x128_256x128x128x128_16x16_32x32_2x2_8x32x1_8x32x1_1x32x1x8_8_1x1_intrawave_v3,577.22,386.3,0.0
gfx942,304,2240,2048,5120,ck,0,0,71.0372,a8w8_blockscale_1x128x128_256x128x128x128_16x16_32x32_2x2_8x32x1_8x32x1_1x32x1x8_8_1x1_intrawave_v3,661.29,438.22,0.0
gfx942,304,2304,2048,5120,ck,0,0,79.903,a8w8_blockscale_1x128x128_256x128x128x128_16x16_32x32_2x2_8x32x1_8x32x1_1x32x1x8_8_1x1_intrawave_v3,604.71,396.97,0.0
gfx942,304,2368,2048,5120,ck,0,0,74.837,a8w8_blockscale_1x128x128_256x128x128x128_16x16_32x32_2x2_8x32x1_8x32x1_1x32x1x8_8_1x1_intrawave_v3,663.58,431.73,0.0
gfx942,304,2432,2048,5120,ck,0,0,80.4205,a8w8_blockscale_1x128x128_256x128x128x128_16x16_32x32_2x2_8x32x1_8x32x1_1x32x1x8_8_1x1_intrawave_v3,634.2,409.09,0.0
gfx942,304,2496,2048,5120,ck,0,0,103.6008,a8w8_blockscale_1x128x128_256x128x128x128_16x16_32x32_2x2_8x32x1_8x32x1_1x32x1x8_8_1x1_intrawave_v3,505.26,323.25,0.0
gfx942,304,2560,2048,5120,ck,0,0,102.4071,a8w8_blockscale_1x128x128_256x128x128x128_16x16_32x32_2x2_8x32x1_8x32x1_1x32x1x8_8_1x1_intrawave_v3,524.25,332.78,0.0
gfx942,304,2624,2048,5120,ck,0,0,110.3719,a8w8_blockscale_1x128x128_256x128x128x128_16x16_32x32_2x2_8x32x1_8x32x1_1x32x1x8_8_1x1_intrawave_v3,498.58,314.11,0.0
gfx942,304,2688,2048,5120,ck,0,0,103.0353,a8w8_blockscale_1x128x128_256x128x128x128_16x16_32x32_2x2_8x32x1_8x32x1_1x32x1x8_8_1x1_intrawave_v3,547.11,342.2,0.0
gfx942,304,2752,2048,5120,ck,0,0,103.1803,a8w8_blockscale_1x128x128_256x128x128x128_16x16_32x32_2x2_8x32x1_8x32x1_1x32x1x8_8_1x1_intrawave_v3,559.35,347.43,0.0
gfx942,304,2816,2048,5120,ck,0,0,101.6731,a8w8_blockscale_1x128x128_256x128x128x128_16x16_32x32_2x2_8x32x1_8x32x1_1x32x1x8_8_1x1_intrawave_v3,580.84,358.38,0.0
gfx942,304,2880,2048,5120,ck,0,0,106.9046,a8w8_blockscale_1x128x128_256x128x128x128_16x16_32x32_2x2_8x32x1_8x32x1_1x32x1x8_8_1x1_intrawave_v3,564.97,346.36,0.0
gfx942,304,2944,2048,5120,ck,0,0,104.4876,a8w8_blockscale_1x128x128_256x128x128x128_16x16_32x32_2x2_8x32x1_8x32x1_1x32x1x8_8_1x1_intrawave_v3,590.88,360.02,0.0
gfx942,304,3008,2048,5120,ck,0,0,103.6438,a8w8_blockscale_1x128x128_256x128x128x128_16x16_32x32_2x2_8x32x1_8x32x1_1x32x1x8_8_1x1_intrawave_v3,608.65,368.64,0.0
gfx942,304,3072,2048,5120,ck,0,0,102.8532,a8w8_blockscale_1x128x128_256x128x128x128_16x16_32x32_2x2_8x32x1_8x32x1_1x32x1x8_8_1x1_intrawave_v3,626.37,377.21,0.0
gfx942,304,3136,2048,5120,ck,0,0,107.9178,a8w8_blockscale_1x128x128_256x128x128x128_16x16_32x32_2x2_8x32x1_8x32x1_1x32x1x8_8_1x1_intrawave_v3,609.41,364.97,0.0
gfx942,304,3200,2048,5120,ck,0,0,107.1905,a8w8_blockscale_1x128x128_256x128x128x128_16x16_32x32_2x2_8x32x1_8x32x1_1x32x1x8_8_1x1_intrawave_v3,626.07,372.95,0.0
gfx942,304,3264,2048,5120,ck,0,0,108.739,a8w8_blockscale_1x128x128_256x128x128x128_16x16_32x32_2x2_8x32x1_8x32x1_1x32x1x8_8_1x1_intrawave_v3,629.5,373.07,0.0
gfx942,304,3328,2048,5120,ck,0,0,108.7647,a8w8_blockscale_1x128x128_256x128x128x128_16x16_32x32_2x2_8x32x1_8x32x1_1x32x1x8_8_1x1_intrawave_v3,641.69,378.4,0.0
gfx942,304,3392,2048,5120,ck,0,0,112.7051,a8w8_blockscale_1x128x128_256x128x128x128_16x16_32x32_2x2_8x32x1_8x32x1_1x32x1x8_8_1x1_intrawave_v3,631.16,370.4,0.0
gfx942,304,3456,2048,5120,ck,0,0,106.3484,a8w8_blockscale_1x128x128_256x128x128x128_16x16_32x32_2x2_8x32x1_8x32x1_1x32x1x8_8_1x1_intrawave_v3,681.51,398.09,0.0
gfx942,304,3520,2048,5120,ck,0,0,110.6022,a8w8_blockscale_1x128x128_256x128x128x128_16x16_32x32_2x2_8x32x1_8x32x1_1x32x1x8_8_1x1_intrawave_v3,667.43,388.11,0.0
gfx942,304,3584,2048,5120,ck,0,0,110.1183,a8w8_blockscale_1x128x128_256x128x128x128_16x16_32x32_2x2_8x32x1_8x32x1_1x32x1x8_8_1x1_intrawave_v3,682.56,395.17,0.0
gfx942,304,3648,2048,5120,ck,0,0,111.4636,a8w8_blockscale_1x128x128_256x128x128x128_16x16_32x32_2x2_8x32x1_8x32x1_1x32x1x8_8_1x1_intrawave_v3,686.36,395.7,0.0
gfx942,304,3712,2048,5120,ck,0,0,112.2167,a8w8_blockscale_1x128x128_256x128x128x128_16x16_32x32_2x2_8x32x1_8x32x1_1x32x1x8_8_1x1_intrawave_v3,693.71,398.3,0.0
gfx942,304,3776,2048,5120,ck,0,0,115.0064,a8w8_blockscale_1x128x128_256x128x128x128_16x16_32x32_2x2_8x32x1_8x32x1_1x32x1x8_8_1x1_intrawave_v3,688.56,393.76,0.0
gfx942,304,3840,2048,5120,ck,0,0,115.7675,a8w8_blockscale_1x128x128_256x128x128x128_16x16_32x32_2x2_8x32x1_8x32x1_1x32x1x8_8_1x1_intrawave_v3,695.62,396.27,0.0
gfx942,304,3904,2048,5120,ck,0,0,118.3622,a8w8_blockscale_1x128x128_256x128x128x128_16x16_32x32_2x2_8x32x1_8x32x1_1x32x1x8_8_1x1_intrawave_v3,691.71,392.57,0.0
gfx942,304,3968,2048,5120,ck,0,0,118.3668,a8w8_blockscale_1x128x128_256x128x128x128_16x16_32x32_2x2_8x32x1_8x32x1_1x32x1x8_8_1x1_intrawave_v3,703.03,397.53,0.0
gfx942,304,4032,2048,5120,ck,0,0,114.3029,a8w8_blockscale_1x128x128_256x128x128x128_16x16_32x32_2x2_8x32x1_8x32x1_1x32x1x8_8_1x1_intrawave_v3,739.76,416.83,0.0
gfx942,304,4096,2048,5120,ck,0,0,113.2455,a8w8_blockscale_1x128x128_256x128x128x128_16x16_32x32_2x2_8x32x1_8x32x1_1x32x1x8_8_1x1_intrawave_v3,758.52,425.93,0.0
gfx942,304,4224,2048,5120,ck,0,0,120.7471,a8w8_blockscale_1x128x128_256x128x128x128_16x16_32x32_2x2_8x32x1_8x32x1_1x32x1x8_8_1x1_intrawave_v3,733.63,409.24,0.0
gfx942,304,4352,2048,5120,ck,0,0,121.9094,a8w8_blockscale_1x128x128_256x128x128x128_16x16_32x32_2x2_8x32x1_8x32x1_1x32x1x8_8_1x1_intrawave_v3,748.65,415.01,0.0
gfx942,304,4480,2048,5120,ck,0,0,122.7757,a8w8_blockscale_1x128x128_256x128x128x128_16x16_32x32_2x2_8x32x1_8x32x1_1x32x1x8_8_1x1_intrawave_v3,765.24,421.69,0.0
gfx942,304,4608,2048,5120,ck,0,0,124.144,a8w8_blockscale_1x128x128_256x128x128x128_16x16_32x32_2x2_8x32x1_8x32x1_1x32x1x8_8_1x1_intrawave_v3,778.42,426.55,0.0
gfx942,304,4736,2048,5120,ck,0,0,129.3692,a8w8_blockscale_1x128x128_256x128x128x128_16x16_32x32_2x2_8x32x1_8x32x1_1x32x1x8_8_1x1_intrawave_v3,767.73,418.44,0.0
gfx942,304,4864,2048,5120,ck,0,0,132.3204,a8w8_blockscale_1x128x128_256x128x128x128_16x16_32x32_2x2_8x32x1_8x32x1_1x32x1x8_8_1x1_intrawave_v3,770.9,418.02,0.0
gfx942,304,4992,2048,5120,ck,0,0,177.6036,a8w8_blockscale_1x128x128_256x128x128x128_16x16_32x32_2x2_8x32x1_8x32x1_1x32x1x8_8_1x1_intrawave_v3,589.46,318.08,0.0
gfx942,304,5120,2048,5120,ck,0,0,172.3857,a8w8_blockscale_1x128x128_256x128x128x128_16x16_32x32_2x2_8x32x1_8x32x1_1x32x1x8_8_1x1_intrawave_v3,622.87,334.55,0.0
gfx942,304,5248,2048,5120,ck,0,0,171.4091,a8w8_blockscale_1x128x128_256x128x128x128_16x16_32x32_2x2_8x32x1_8x32x1_1x32x1x8_8_1x1_intrawave_v3,642.08,343.34,0.0
gfx942,304,5376,2048,5120,ck,0,0,167.0614,a8w8_blockscale_1x128x128_256x128x128x128_16x16_32x32_2x2_8x32x1_8x32x1_1x32x1x8_8_1x1_intrawave_v3,674.86,359.33,0.0
gfx942,304,5504,2048,5120,ck,0,0,172.0672,a8w8_blockscale_1x128x128_256x128x128x128_16x16_32x32_2x2_8x32x1_8x32x1_1x32x1x8_8_1x1_intrawave_v3,670.83,355.74,0.0
gfx942,304,5632,2048,5120,ck,0,0,174.083,a8w8_blockscale_1x128x128_256x128x128x128_16x16_32x32_2x2_8x32x1_8x32x1_1x32x1x8_8_1x1_intrawave_v3,678.48,358.39,0.0
gfx942,304,5760,2048,5120,ck,0,0,175.7265,a8w8_blockscale_1x128x128_256x128x128x128_16x16_32x32_2x2_8x32x1_8x32x1_1x32x1x8_8_1x1_intrawave_v3,687.41,361.75,0.0
gfx942,304,5888,2048,5120,ck,0,0,176.0762,a8w8_blockscale_1x128x128_256x128x128x128_16x16_32x32_2x2_8x32x1_8x32x1_1x32x1x8_8_1x1_intrawave_v3,701.29,367.74,0.0
gfx942,304,6016,2048,5120,ck,0,0,173.5131,a8w8_blockscale_1x128x128_256x128x128x128_16x16_32x32_2x2_8x32x1_8x32x1_1x32x1x8_8_1x1_intrawave_v3,727.12,379.97,0.0
gfx942,304,6144,2048,5120,ck,0,0,174.0863,a8w8_blockscale_1x128x128_256x128x128x128_16x16_32x32_2x2_8x32x1_8x32x1_1x32x1x8_8_1x1_intrawave_v3,740.14,385.49,0.0
gfx942,304,6272,2048,5120,ck,0,0,181.4175,a8w8_blockscale_1x128x128_256x128x128x128_16x16_32x32_2x2_8x32x1_8x32x1_1x32x1x8_8_1x1_intrawave_v3,725.03,376.42,0.0
gfx942,304,6400,2048,5120,ck,0,0,180.3498,a8w8_blockscale_1x128x128_256x128x128x128_16x16_32x32_2x2_8x32x1_8x32x1_1x32x1x8_8_1x1_intrawave_v3,744.21,385.19,0.0
gfx942,304,6528,2048,5120,ck,0,0,181.4453,a8w8_blockscale_1x128x128_256x128x128x128_16x16_32x32_2x2_8x32x1_8x32x1_1x32x1x8_8_1x1_intrawave_v3,754.51,389.36,0.0
gfx942,304,6656,2048,5120,ck,0,0,185.334,a8w8_blockscale_1x128x128_256x128x128x128_16x16_32x32_2x2_8x32x1_8x32x1_1x32x1x8_8_1x1_intrawave_v3,753.16,387.56,0.0
gfx942,304,6784,2048,5120,ck,0,0,187.1762,a8w8_blockscale_1x128x128_256x128x128x128_16x16_32x32_2x2_8x32x1_8x32x1_1x32x1x8_8_1x1_intrawave_v3,760.09,390.04,0.0
gfx942,304,6912,2048,5120,ck,0,0,188.8337,a8w8_blockscale_1x128x128_256x128x128x128_16x16_32x32_2x2_8x32x1_8x32x1_1x32x1x8_8_1x1_intrawave_v3,767.63,392.87,0.0
gfx942,304,7040,2048,5120,ck,0,0,198.3055,a8w8_blockscale_1x128x128_256x128x128x128_16x16_32x32_2x2_8x32x1_8x32x1_1x32x1x8_8_1x1_intrawave_v3,744.51,380.05,0.0
gfx942,304,7168,2048,5120,ck,0,0,203.3403,a8w8_blockscale_1x128x128_256x128x128x128_16x16_32x32_2x2_8x32x1_8x32x1_1x32x1x8_8_1x1_intrawave_v3,739.27,376.44,0.0
gfx942,304,7296,2048,5120,ck,0,0,208.9977,a8w8_blockscale_1x128x128_256x128x128x128_16x16_32x32_2x2_8x32x1_8x32x1_1x32x1x8_8_1x1_intrawave_v3,732.1,371.9,0.0
gfx942,304,7424,2048,5120,ck,0,0,226.0959,a8w8_blockscale_1x128x128_256x128x128x128_16x16_32x32_2x2_8x32x1_8x32x1_1x32x1x8_8_1x1_intrawave_v3,688.61,348.99,0.0
gfx942,304,7552,2048,5120,ck,0,0,227.5587,a8w8_blockscale_1x128x128_256x128x128x128_16x16_32x32_2x2_8x32x1_8x32x1_1x32x1x8_8_1x1_intrawave_v3,695.98,351.93,0.0
gfx942,304,7680,2048,5120,ck,0,0,222.9884,a8w8_blockscale_1x128x128_256x128x128x128_16x16_32x32_2x2_8x32x1_8x32x1_1x32x1x8_8_1x1_intrawave_v3,722.29,364.43,0.0
gfx942,304,7808,2048,5120,ck,0,0,229.6773,a8w8_blockscale_1x128x128_256x128x128x128_16x16_32x32_2x2_8x32x1_8x32x1_1x32x1x8_8_1x1_intrawave_v3,712.94,358.96,0.0
gfx942,304,7936,2048,5120,ck,0,0,229.7634,a8w8_blockscale_1x128x128_256x128x128x128_16x16_32x32_2x2_8x32x1_8x32x1_1x32x1x8_8_1x1_intrawave_v3,724.35,363.96,0.0
gfx942,304,8064,2048,5120,ck,0,0,227.7839,a8w8_blockscale_1x128x128_256x128x128x128_16x16_32x32_2x2_8x32x1_8x32x1_1x32x1x8_8_1x1_intrawave_v3,742.43,372.3,0.0
gfx942,304,8192,2048,5120,ck,0,0,229.1141,a8w8_blockscale_1x128x128_256x128x128x128_16x16_32x32_2x2_8x32x1_8x32x1_1x32x1x8_8_1x1_intrawave_v3,749.84,375.29,0.0
gfx942,304,8320,2048,5120,ck,0,0,239.9139,a8w8_blockscale_1x128x128_256x128x128x128_16x16_32x32_2x2_8x32x1_8x32x1_1x32x1x8_8_1x1_intrawave_v3,727.27,363.31,0.0
gfx942,304,8448,2048,5120,ck,0,0,240.0128,a8w8_blockscale_1x128x128_256x128x128x128_16x16_32x32_2x2_8x32x1_8x32x1_1x32x1x8_8_1x1_intrawave_v3,738.16,368.07,0.0
gfx942,304,8576,2048,5120,ck,0,0,244.6994,a8w8_blockscale_1x128x128_256x128x128x128_16x16_32x32_2x2_8x32x1_8x32x1_1x32x1x8_8_1x1_intrawave_v3,734.99,365.85,0.0
gfx942,304,8704,2048,5120,ck,0,0,242.5063,a8w8_blockscale_1x128x128_256x128x128x128_16x16_32x32_2x2_8x32x1_8x32x1_1x32x1x8_8_1x1_intrawave_v3,752.71,374.02,0.0
gfx942,304,8832,2048,5120,ck,0,0,248.4961,a8w8_blockscale_1x128x128_256x128x128x128_16x16_32x32_2x2_8x32x1_8x32x1_1x32x1x8_8_1x1_intrawave_v3,745.37,369.75,0.0
gfx942,304,8960,2048,5120,ck,0,0,247.4266,a8w8_blockscale_1x128x128_256x128x128x128_16x16_32x32_2x2_8x32x1_8x32x1_1x32x1x8_8_1x1_intrawave_v3,759.44,376.12,0.0
gfx942,304,9088,2048,5120,ck,0,0,251.2538,a8w8_blockscale_1x128x128_256x128x128x128_16x16_32x32_2x2_8x32x1_8x32x1_1x32x1x8_8_1x1_intrawave_v3,758.55,375.08,0.0
gfx942,304,9216,2048,5120,ck,0,0,257.1893,a8w8_blockscale_1x128x128_256x128x128x128_16x16_32x32_2x2_8x32x1_8x32x1_1x32x1x8_8_1x1_intrawave_v3,751.48,371.01,0.0
gfx942,304,9344,2048,5120,ck,0,0,256.4945,a8w8_blockscale_1x128x128_256x128x128x128_16x16_32x32_2x2_8x32x1_8x32x1_1x32x1x8_8_1x1_intrawave_v3,763.98,376.62,0.0
gfx942,304,9472,2048,5120,ck,0,0,258.6171,a8w8_blockscale_1x128x128_256x128x128x128_16x16_32x32_2x2_8x32x1_8x32x1_1x32x1x8_8_1x1_intrawave_v3,768.09,378.09,0.0
gfx942,304,9600,2048,5120,ck,0,0,263.9122,a8w8_blockscale_1x128x128_256x128x128x128_16x16_32x32_2x2_8x32x1_8x32x1_1x32x1x8_8_1x1_intrawave_v3,762.85,374.97,0.0
gfx942,304,9728,2048,5120,ck,0,0,259.95,a8w8_blockscale_1x128x128_256x128x128x128_16x16_32x32_2x2_8x32x1_8x32x1_1x32x1x8_8_1x1_intrawave_v3,784.81,385.22,0.0
gfx942,304,9856,2048,5120,ck,0,0,285.2876,a8w8_blockscale_1x128x128_256x128x128x128_16x16_32x32_2x2_8x32x1_8x32x1_1x32x1x8_8_1x1_intrawave_v3,724.52,355.15,0.0
gfx942,304,9984,2048,5120,ck,0,0,284.4915,a8w8_blockscale_1x128x128_256x128x128x128_16x16_32x32_2x2_8x32x1_8x32x1_1x32x1x8_8_1x1_intrawave_v3,735.98,360.29,0.0
gfx942,304,10112,2048,5120,ck,0,0,287.3939,a8w8_blockscale_1x128x128_256x128x128x128_16x16_32x32_2x2_8x32x1_8x32x1_1x32x1x8_8_1x1_intrawave_v3,737.89,360.75,0.0
gfx942,304,10240,2048,5120,ck,0,0,285.2631,a8w8_blockscale_1x128x128_256x128x128x128_16x16_32x32_2x2_8x32x1_8x32x1_1x32x1x8_8_1x1_intrawave_v3,752.81,367.58,0.0
gfx942,304,10368,2048,5120,ck,0,0,293.0798,a8w8_blockscale_1x128x128_256x128x128x128_16x16_32x32_2x2_8x32x1_8x32x1_1x32x1x8_8_1x1_intrawave_v3,741.89,361.8,0.0
gfx942,304,10496,2048,5120,ck,0,0,295.6841,a8w8_blockscale_1x128x128_256x128x128x128_16x16_32x32_2x2_8x32x1_8x32x1_1x32x1x8_8_1x1_intrawave_v3,744.43,362.61,0.0
gfx942,304,10624,2048,5120,ck,0,0,296.2587,a8w8_blockscale_1x128x128_256x128x128x128_16x16_32x32_2x2_8x32x1_8x32x1_1x32x1x8_8_1x1_intrawave_v3,752.05,365.88,0.0
gfx942,304,10752,2048,5120,ck,0,0,291.434,a8w8_blockscale_1x128x128_256x128x128x128_16x16_32x32_2x2_8x32x1_8x32x1_1x32x1x8_8_1x1_intrawave_v3,773.71,375.99,0.0
gfx942,304,10880,2048,5120,ck,0,0,295.166,a8w8_blockscale_1x128x128_256x128x128x128_16x16_32x32_2x2_8x32x1_8x32x1_1x32x1x8_8_1x1_intrawave_v3,773.02,375.23,0.0
gfx942,304,11008,2048,5120,ck,0,0,297.2874,a8w8_blockscale_1x128x128_256x128x128x128_16x16_32x32_2x2_8x32x1_8x32x1_1x32x1x8_8_1x1_intrawave_v3,776.54,376.52,0.0
gfx942,304,11136,2048,5120,ck,0,0,302.3483,a8w8_blockscale_1x128x128_256x128x128x128_16x16_32x32_2x2_8x32x1_8x32x1_1x32x1x8_8_1x1_intrawave_v3,772.42,374.12,0.0
gfx942,304,11264,2048,5120,ck,0,0,304.6097,a8w8_blockscale_1x128x128_256x128x128x128_16x16_32x32_2x2_8x32x1_8x32x1_1x32x1x8_8_1x1_intrawave_v3,775.49,375.22,0.0
gfx942,304,11392,2048,5120,ck,0,0,308.4857,a8w8_blockscale_1x128x128_256x128x128x128_16x16_32x32_2x2_8x32x1_8x32x1_1x32x1x8_8_1x1_intrawave_v3,774.45,374.33,0.0
gfx942,304,11520,2048,5120,ck,0,0,305.5168,a8w8_blockscale_1x128x128_256x128x128x128_16x16_32x32_2x2_8x32x1_8x32x1_1x32x1x8_8_1x1_intrawave_v3,790.76,381.83,0.0
gfx942,304,11648,2048,5120,ck,0,0,311.0887,a8w8_blockscale_1x128x128_256x128x128x128_16x16_32x32_2x2_8x32x1_8x32x1_1x32x1x8_8_1x1_intrawave_v3,785.23,378.78,0.0
gfx942,304,11776,2048,5120,ck,0,0,309.0262,a8w8_blockscale_1x128x128_256x128x128x128_16x16_32x32_2x2_8x32x1_8x32x1_1x32x1x8_8_1x1_intrawave_v3,799.16,385.12,0.0
gfx942,304,11904,2048,5120,ck,0,0,320.4541,a8w8_blockscale_1x128x128_256x128x128x128_16x16_32x32_2x2_8x32x1_8x32x1_1x32x1x8_8_1x1_intrawave_v3,779.04,375.07,0.0
gfx942,304,12032,2048,5120,ck,0,0,325.6175,a8w8_blockscale_1x128x128_256x128x128x128_16x16_32x32_2x2_8x32x1_8x32x1_1x32x1x8_8_1x1_intrawave_v3,774.93,372.75,0.0
gfx942,304,12160,2048,5120,ck,0,0,327.0121,a8w8_blockscale_1x128x128_256x128x128x128_16x16_32x32_2x2_8x32x1_8x32x1_1x32x1x8_8_1x1_intrawave_v3,779.83,374.76,0.0
gfx942,304,12288,2048,5120,ck,0,0,337.991,a8w8_blockscale_1x128x128_256x128x128x128_16x16_32x32_2x2_8x32x1_8x32x1_1x32x1x8_8_1x1_intrawave_v3,762.44,366.08,0.0
gfx942,304,12416,2048,5120,ck,0,0,345.7421,a8w8_blockscale_1x128x128_256x128x128x128_16x16_32x32_2x2_8x32x1_8x32x1_1x32x1x8_8_1x1_intrawave_v3,753.11,361.29,0.0
gfx942,304,12544,2048,5120,ck,0,0,345.8579,a8w8_blockscale_1x128x128_256x128x128x128_16x16_32x32_2x2_8x32x1_8x32x1_1x32x1x8_8_1x1_intrawave_v3,760.62,364.58,0.0
gfx942,304,12672,2048,5120,ck,0,0,348.6617,a8w8_blockscale_1x128x128_256x128x128x128_16x16_32x32_2x2_8x32x1_8x32x1_1x32x1x8_8_1x1_intrawave_v3,762.2,365.03,0.0
gfx942,304,12800,2048,5120,ck,0,0,352.2167,a8w8_blockscale_1x128x128_256x128x128x128_16x16_32x32_2x2_8x32x1_8x32x1_1x32x1x8_8_1x1_intrawave_v3,762.13,364.69,0.0
gfx942,304,12928,2048,5120,ck,0,0,356.9534,a8w8_blockscale_1x128x128_256x128x128x128_16x16_32x32_2x2_8x32x1_8x32x1_1x32x1x8_8_1x1_intrawave_v3,759.54,363.16,0.0
gfx942,304,13056,2048,5120,ck,0,0,356.2298,a8w8_blockscale_1x128x128_256x128x128x128_16x16_32x32_2x2_8x32x1_8x32x1_1x32x1x8_8_1x1_intrawave_v3,768.62,367.21,0.0
gfx942,304,13184,2048,5120,ck,0,0,359.2743,a8w8_blockscale_1x128x128_256x128x128x128_16x16_32x32_2x2_8x32x1_8x32x1_1x32x1x8_8_1x1_intrawave_v3,769.58,367.38,0.0
gfx942,304,13312,2048,5120,ck,0,0,359.396,a8w8_blockscale_1x128x128_256x128x128x128_16x16_32x32_2x2_8x32x1_8x32x1_1x32x1x8_8_1x1_intrawave_v3,776.78,370.54,0.0
gfx942,304,13440,2048,5120,ck,0,0,366.4476,a8w8_blockscale_1x128x128_256x128x128x128_16x16_32x32_2x2_8x32x1_8x32x1_1x32x1x8_8_1x1_intrawave_v3,769.16,366.62,0.0
gfx942,304,13568,2048,5120,ck,0,0,359.6536,a8w8_blockscale_1x128x128_256x128x128x128_16x16_32x32_2x2_8x32x1_8x32x1_1x32x1x8_8_1x1_intrawave_v3,791.15,376.83,0.0
gfx942,304,13696,2048,5120,ck,0,0,365.1527,a8w8_blockscale_1x128x128_256x128x128x128_16x16_32x32_2x2_8x32x1_8x32x1_1x32x1x8_8_1x1_intrawave_v3,786.59,374.39,0.0
gfx942,304,13824,2048,5120,ck,0,0,367.6592,a8w8_blockscale_1x128x128_256x128x128x128_16x16_32x32_2x2_8x32x1_8x32x1_1x32x1x8_8_1x1_intrawave_v3,788.53,375.04,0.0
gfx942,304,13952,2048,5120,ck,0,0,369.0618,a8w8_blockscale_1x128x128_256x128x128x128_16x16_32x32_2x2_8x32x1_8x32x1_1x32x1x8_8_1x1_intrawave_v3,792.81,376.81,0.0
gfx942,304,14080,2048,5120,ck,0,0,376.5024,a8w8_blockscale_1x128x128_256x128x128x128_16x16_32x32_2x2_8x32x1_8x32x1_1x32x1x8_8_1x1_intrawave_v3,784.27,372.5,0.0
gfx942,304,14208,2048,5120,ck,0,0,374.4749,a8w8_blockscale_1x128x128_256x128x128x128_16x16_32x32_2x2_8x32x1_8x32x1_1x32x1x8_8_1x1_intrawave_v3,795.68,377.67,0.0
gfx942,304,14336,2048,5120,ck,0,0,375.8544,a8w8_blockscale_1x128x128_256x128x128x128_16x16_32x32_2x2_8x32x1_8x32x1_1x32x1x8_8_1x1_intrawave_v3,799.9,379.42,0.0
gfx942,304,14464,2048,5120,ck,0,0,389.6025,a8w8_blockscale_1x128x128_256x128x128x128_16x16_32x32_2x2_8x32x1_8x32x1_1x32x1x8_8_1x1_intrawave_v3,778.57,369.06,0.0
gfx942,304,14592,2048,5120,ck,0,0,387.4231,a8w8_blockscale_1x128x128_256x128x128x128_16x16_32x32_2x2_8x32x1_8x32x1_1x32x1x8_8_1x1_intrawave_v3,789.88,374.18,0.0
gfx942,304,14720,2048,5120,ck,0,0,405.2277,a8w8_blockscale_1x128x128_256x128x128x128_16x16_32x32_2x2_8x32x1_8x32x1_1x32x1x8_8_1x1_intrawave_v3,761.8,360.65,0.0
gfx942,304,14848,2048,5120,ck,0,0,419.2273,a8w8_blockscale_1x128x128_256x128x128x128_16x16_32x32_2x2_8x32x1_8x32x1_1x32x1x8_8_1x1_intrawave_v3,742.76,351.42,0.0
gfx942,304,14976,2048,5120,ck,0,0,419.2978,a8w8_blockscale_1x128x128_256x128x128x128_16x16_32x32_2x2_8x32x1_8x32x1_1x32x1x8_8_1x1_intrawave_v3,749.04,354.17,0.0
gfx942,304,15104,2048,5120,ck,0,0,411.7285,a8w8_blockscale_1x128x128_256x128x128x128_16x16_32x32_2x2_8x32x1_8x32x1_1x32x1x8_8_1x1_intrawave_v3,769.33,363.55,0.0
gfx942,304,15232,2048,5120,ck,0,0,416.4091,a8w8_blockscale_1x128x128_256x128x128x128_16x16_32x32_2x2_8x32x1_8x32x1_1x32x1x8_8_1x1_intrawave_v3,767.13,362.3,0.0
gfx942,304,15360,2048,5120,ck,0,0,413.0558,a8w8_blockscale_1x128x128_256x128x128x128_16x16_32x32_2x2_8x32x1_8x32x1_1x32x1x8_8_1x1_intrawave_v3,779.85,368.09,0.0
gfx942,304,15488,2048,5120,ck,0,0,422.6001,a8w8_blockscale_1x128x128_256x128x128x128_16x16_32x32_2x2_8x32x1_8x32x1_1x32x1x8_8_1x1_intrawave_v3,768.59,362.57,0.0
gfx942,304,15616,2048,5120,ck,0,0,425.3065,a8w8_blockscale_1x128x128_256x128x128x128_16x16_32x32_2x2_8x32x1_8x32x1_1x32x1x8_8_1x1_intrawave_v3,770.01,363.04,0.0
gfx942,304,15744,2048,5120,ck,0,0,423.008,a8w8_blockscale_1x128x128_256x128x128x128_16x16_32x32_2x2_8x32x1_8x32x1_1x32x1x8_8_1x1_intrawave_v3,780.54,367.8,0.0
gfx942,304,15872,2048,5120,ck,0,0,430.0022,a8w8_blockscale_1x128x128_256x128x128x128_16x16_32x32_2x2_8x32x1_8x32x1_1x32x1x8_8_1x1_intrawave_v3,774.09,364.56,0.0
gfx942,304,16000,2048,5120,ck,0,0,427.5078,a8w8_blockscale_1x128x128_256x128x128x128_16x16_32x32_2x2_8x32x1_8x32x1_1x32x1x8_8_1x1_intrawave_v3,784.88,369.45,0.0
gfx942,304,16128,2048,5120,ck,0,0,428.0483,a8w8_blockscale_1x128x128_256x128x128x128_16x16_32x32_2x2_8x32x1_8x32x1_1x32x1x8_8_1x1_intrawave_v3,790.16,371.74,0.0
gfx942,304,16256,2048,5120,ck,0,0,430.723,a8w8_blockscale_1x128x128_256x128x128x128_16x16_32x32_2x2_8x32x1_8x32x1_1x32x1x8_8_1x1_intrawave_v3,791.49,372.17,0.0
gfx942,304,16384,2048,5120,ck,0,0,429.2839,a8w8_blockscale_1x128x128_256x128x128x128_16x16_32x32_2x2_8x32x1_8x32x1_1x32x1x8_8_1x1_intrawave_v3,800.4,376.16,0.0
gfx942,304,16512,2048,5120,ck,0,0,433.9951,a8w8_blockscale_1x128x128_256x128x128x128_16x16_32x32_2x2_8x32x1_8x32x1_1x32x1x8_8_1x1_intrawave_v3,797.89,374.8,0.0
gfx942,304,16640,2048,5120,ck,0,0,447.4039,a8w8_blockscale_1x128x128_256x128x128x128_16x16_32x32_2x2_8x32x1_8x32x1_1x32x1x8_8_1x1_intrawave_v3,779.98,366.2,0.0
gfx942,304,16768,2048,5120,ck,0,0,449.5762,a8w8_blockscale_1x128x128_256x128x128x128_16x16_32x32_2x2_8x32x1_8x32x1_1x32x1x8_8_1x1_intrawave_v3,782.18,367.06,0.0
gfx942,304,16896,2048,5120,ck,0,0,453.1185,a8w8_blockscale_1x128x128_256x128x128x128_16x16_32x32_2x2_8x32x1_8x32x1_1x32x1x8_8_1x1_intrawave_v3,781.99,366.79,0.0
gfx942,304,17024,2048,5120,ck,0,0,468.3618,a8w8_blockscale_1x128x128_256x128x128x128_16x16_32x32_2x2_8x32x1_8x32x1_1x32x1x8_8_1x1_intrawave_v3,762.27,357.37,0.0
gfx942,304,17152,2048,5120,ck,0,0,461.9871,a8w8_blockscale_1x128x128_256x128x128x128_16x16_32x32_2x2_8x32x1_8x32x1_1x32x1x8_8_1x1_intrawave_v3,778.6,364.86,0.0
gfx942,304,17280,2048,5120,ck,0,0,467.9415,a8w8_blockscale_1x128x128_256x128x128x128_16x16_32x32_2x2_8x32x1_8x32x1_1x32x1x8_8_1x1_intrawave_v3,774.43,362.73,0.0
gfx942,304,17408,2048,5120,ck,0,0,468.1316,a8w8_blockscale_1x128x128_256x128x128x128_16x16_32x32_2x2_8x32x1_8x32x1_1x32x1x8_8_1x1_intrawave_v3,779.85,365.11,0.0
gfx942,304,17536,2048,5120,ck,0,0,477.4921,a8w8_blockscale_1x128x128_256x128x128x128_16x16_32x32_2x2_8x32x1_8x32x1_1x32x1x8_8_1x1_intrawave_v3,770.18,360.42,0.0
gfx942,304,17664,2048,5120,ck,0,0,475.6812,a8w8_blockscale_1x128x128_256x128x128x128_16x16_32x32_2x2_8x32x1_8x32x1_1x32x1x8_8_1x1_intrawave_v3,778.76,364.27,0.0
gfx942,304,17792,2048,5120,ck,0,0,479.8388,a8w8_blockscale_1x128x128_256x128x128x128_16x16_32x32_2x2_8x32x1_8x32x1_1x32x1x8_8_1x1_intrawave_v3,777.61,363.57,0.0
gfx942,304,17920,2048,5120,ck,0,0,484.6512,a8w8_blockscale_1x128x128_256x128x128x128_16x16_32x32_2x2_8x32x1_8x32x1_1x32x1x8_8_1x1_intrawave_v3,775.42,362.4,0.0
gfx942,304,18048,2048,5120,ck,0,0,478.1577,a8w8_blockscale_1x128x128_256x128x128x128_16x16_32x32_2x2_8x32x1_8x32x1_1x32x1x8_8_1x1_intrawave_v3,791.57,369.79,0.0
gfx942,304,18176,2048,5120,ck,0,0,484.9075,a8w8_blockscale_1x128x128_256x128x128x128_16x16_32x32_2x2_8x32x1_8x32x1_1x32x1x8_8_1x1_intrawave_v3,786.08,367.07,0.0
gfx942,304,18304,2048,5120,ck,0,0,492.186,a8w8_blockscale_1x128x128_256x128x128x128_16x16_32x32_2x2_8x32x1_8x32x1_1x32x1x8_8_1x1_intrawave_v3,779.91,364.04,0.0
gfx942,304,18432,2048,5120,ck,0,0,497.131,a8w8_blockscale_1x128x128_256x128x128x128_16x16_32x32_2x2_8x32x1_8x32x1_1x32x1x8_8_1x1_intrawave_v3,777.56,362.79,0.0
gfx942,304,18560,2048,5120,ck,0,0,494.3007,a8w8_blockscale_1x128x128_256x128x128x128_16x16_32x32_2x2_8x32x1_8x32x1_1x32x1x8_8_1x1_intrawave_v3,787.44,367.26,0.0
gfx942,304,18688,2048,5120,ck,0,0,494.3977,a8w8_blockscale_1x128x128_256x128x128x128_16x16_32x32_2x2_8x32x1_8x32x1_1x32x1x8_8_1x1_intrawave_v3,792.71,369.57,0.0
gfx942,304,18816,2048,5120,ck,0,0,493.547,a8w8_blockscale_1x128x128_256x128x128x128_16x16_32x32_2x2_8x32x1_8x32x1_1x32x1x8_8_1x1_intrawave_v3,799.52,372.6,0.0
gfx942,304,18944,2048,5120,ck,0,0,496.9975,a8w8_blockscale_1x128x128_256x128x128x128_16x16_32x32_2x2_8x32x1_8x32x1_1x32x1x8_8_1x1_intrawave_v3,799.37,372.38,0.0
gfx942,304,19072,2048,5120,ck,0,0,513.3084,a8w8_blockscale_1x128x128_256x128x128x128_16x16_32x32_2x2_8x32x1_8x32x1_1x32x1x8_8_1x1_intrawave_v3,779.2,362.85,0.0
gfx942,304,19200,2048,5120,ck,0,0,507.9842,a8w8_blockscale_1x128x128_256x128x128x128_16x16_32x32_2x2_8x32x1_8x32x1_1x32x1x8_8_1x1_intrawave_v3,792.65,368.97,0.0
gfx942,304,19328,2048,5120,ck,0,0,519.1492,a8w8_blockscale_1x128x128_256x128x128x128_16x16_32x32_2x2_8x32x1_8x32x1_1x32x1x8_8_1x1_intrawave_v3,780.77,363.31,0.0
gfx942,304,19456,2048,5120,ck,0,0,518.6224,a8w8_blockscale_1x128x128_256x128x128x128_16x16_32x32_2x2_8x32x1_8x32x1_1x32x1x8_8_1x1_intrawave_v3,786.74,365.95,0.0
gfx942,304,19584,2048,5120,ck,0,0,529.4784,a8w8_blockscale_1x128x128_256x128x128x128_16x16_32x32_2x2_8x32x1_8x32x1_1x32x1x8_8_1x1_intrawave_v3,775.68,360.68,0.0
gfx942,304,19712,2048,5120,ck,0,0,541.8485,a8w8_blockscale_1x128x128_256x128x128x128_16x16_32x32_2x2_8x32x1_8x32x1_1x32x1x8_8_1x1_intrawave_v3,762.93,354.62,0.0
gfx942,304,19840,2048,5120,ck,0,0,536.8943,a8w8_blockscale_1x128x128_256x128x128x128_16x16_32x32_2x2_8x32x1_8x32x1_1x32x1x8_8_1x1_intrawave_v3,774.97,360.09,0.0
gfx942,304,19968,2048,5120,ck,0,0,537.1096,a8w8_blockscale_1x128x128_256x128x128x128_16x16_32x32_2x2_8x32x1_8x32x1_1x32x1x8_8_1x1_intrawave_v3,779.65,362.14,0.0
gfx942,304,20096,2048,5120,ck,0,0,549.2057,a8w8_blockscale_1x128x128_256x128x128x128_16x16_32x32_2x2_8x32x1_8x32x1_1x32x1x8_8_1x1_intrawave_v3,767.37,356.32,0.0
gfx942,304,20224,2048,5120,ck,0,0,541.0046,a8w8_blockscale_1x128x128_256x128x128x128_16x16_32x32_2x2_8x32x1_8x32x1_1x32x1x8_8_1x1_intrawave_v3,783.96,363.9,0.0
gfx942,304,20352,2048,5120,ck,0,0,545.6984,a8w8_blockscale_1x128x128_256x128x128x128_16x16_32x32_2x2_8x32x1_8x32x1_1x32x1x8_8_1x1_intrawave_v3,782.14,362.93,0.0
gfx942,304,20480,2048,5120,ck,0,0,537.2441,a8w8_blockscale_1x128x128_256x128x128x128_16x16_32x32_2x2_8x32x1_8x32x1_1x32x1x8_8_1x1_intrawave_v3,799.44,370.84,0.0
gfx942,304,20608,2048,5120,ck,0,0,546.6884,a8w8_blockscale_1x128x128_256x128x128x128_16x16_32x32_2x2_8x32x1_8x32x1_1x32x1x8_8_1x1_intrawave_v3,790.54,366.59,0.0
gfx942,304,20736,2048,5120,ck,0,0,551.3339,a8w8_blockscale_1x128x128_256x128x128x128_16x16_32x32_2x2_8x32x1_8x32x1_1x32x1x8_8_1x1_intrawave_v3,788.75,365.64,0.0
gfx942,304,20864,2048,5120,ck,0,0,559.1738,a8w8_blockscale_1x128x128_256x128x128x128_16x16_32x32_2x2_8x32x1_8x32x1_1x32x1x8_8_1x1_intrawave_v3,782.49,362.62,0.0
gfx942,304,20992,2048,5120,ck,0,0,559.4619,a8w8_blockscale_1x128x128_256x128x128x128_16x16_32x32_2x2_8x32x1_8x32x1_1x32x1x8_8_1x1_intrawave_v3,786.89,364.54,0.0
gfx942,304,21120,2048,5120,ck,0,0,560.7894,a8w8_blockscale_1x128x128_256x128x128x128_16x16_32x32_2x2_8x32x1_8x32x1_1x32x1x8_8_1x1_intrawave_v3,789.81,365.78,0.0
gfx942,304,21248,2048,5120,ck,0,0,568.731,a8w8_blockscale_1x128x128_256x128x128x128_16x16_32x32_2x2_8x32x1_8x32x1_1x32x1x8_8_1x1_intrawave_v3,783.5,362.75,0.0
gfx942,304,21376,2048,5120,ck,0,0,564.9853,a8w8_blockscale_1x128x128_256x128x128x128_16x16_32x32_2x2_8x32x1_8x32x1_1x32x1x8_8_1x1_intrawave_v3,793.45,367.24,0.0
gfx942,304,21504,2048,5120,ck,0,0,569.3774,a8w8_blockscale_1x128x128_256x128x128x128_16x16_32x32_2x2_8x32x1_8x32x1_1x32x1x8_8_1x1_intrawave_v3,792.04,366.48,0.0
gfx942,304,21632,2048,5120,ck,0,0,581.2964,a8w8_blockscale_1x128x128_256x128x128x128_16x16_32x32_2x2_8x32x1_8x32x1_1x32x1x8_8_1x1_intrawave_v3,780.42,361.0,0.0
gfx942,304,21760,2048,5120,ck,0,0,588.3451,a8w8_blockscale_1x128x128_256x128x128x128_16x16_32x32_2x2_8x32x1_8x32x1_1x32x1x8_8_1x1_intrawave_v3,775.63,358.68,0.0
gfx942,304,21888,2048,5120,ck,0,0,592.6069,a8w8_blockscale_1x128x128_256x128x128x128_16x16_32x32_2x2_8x32x1_8x32x1_1x32x1x8_8_1x1_intrawave_v3,774.59,358.09,0.0
gfx942,304,22016,2048,5120,ck,0,0,602.8564,a8w8_blockscale_1x128x128_256x128x128x128_16x16_32x32_2x2_8x32x1_8x32x1_1x32x1x8_8_1x1_intrawave_v3,765.87,353.96,0.0
gfx942,304,22144,2048,5120,ck,0,0,602.2119,a8w8_blockscale_1x128x128_256x128x128x128_16x16_32x32_2x2_8x32x1_8x32x1_1x32x1x8_8_1x1_intrawave_v3,771.15,356.29,0.0
gfx942,304,22272,2048,5120,ck,0,0,604.72,a8w8_blockscale_1x128x128_256x128x128x128_16x16_32x32_2x2_8x32x1_8x32x1_1x32x1x8_8_1x1_intrawave_v3,772.39,356.77,0.0
gfx942,304,22400,2048,5120,ck,0,0,596.5585,a8w8_blockscale_1x128x128_256x128x128x128_16x16_32x32_2x2_8x32x1_8x32x1_1x32x1x8_8_1x1_intrawave_v3,787.45,363.63,0.0
gfx942,304,22528,2048,5120,ck,0,0,604.6825,a8w8_blockscale_1x128x128_256x128x128x128_16x16_32x32_2x2_8x32x1_8x32x1_1x32x1x8_8_1x1_intrawave_v3,781.31,360.69,0.0
gfx942,304,22656,2048,5120,ck,0,0,615.0206,a8w8_blockscale_1x128x128_256x128x128x128_16x16_32x32_2x2_8x32x1_8x32x1_1x32x1x8_8_1x1_intrawave_v3,772.54,356.55,0.0
gfx942,304,22784,2048,5120,ck,0,0,601.3301,a8w8_blockscale_1x128x128_256x128x128x128_16x16_32x32_2x2_8x32x1_8x32x1_1x32x1x8_8_1x1_intrawave_v3,794.6,366.63,0.0
gfx942,304,22912,2048,5120,ck,0,0,616.879,a8w8_blockscale_1x128x128_256x128x128x128_16x16_32x32_2x2_8x32x1_8x32x1_1x32x1x8_8_1x1_intrawave_v3,778.92,359.3,0.0
gfx942,304,23040,2048,5120,ck,0,0,616.9432,a8w8_blockscale_1x128x128_256x128x128x128_16x16_32x32_2x2_8x32x1_8x32x1_1x32x1x8_8_1x1_intrawave_v3,783.19,361.17,0.0
gfx942,304,23168,2048,5120,ck,0,0,623.5393,a8w8_blockscale_1x128x128_256x128x128x128_16x16_32x32_2x2_8x32x1_8x32x1_1x32x1x8_8_1x1_intrawave_v3,779.21,359.24,0.0
gfx942,304,23296,2048,5120,ck,0,0,613.0511,a8w8_blockscale_1x128x128_256x128x128x128_16x16_32x32_2x2_8x32x1_8x32x1_1x32x1x8_8_1x1_intrawave_v3,796.92,367.31,0.0
gfx942,304,23424,2048,5120,ck,0,0,609.3561,a8w8_blockscale_1x128x128_256x128x128x128_16x16_32x32_2x2_8x32x1_8x32x1_1x32x1x8_8_1x1_intrawave_v3,806.16,371.48,0.0
gfx942,304,23552,2048,5120,ck,0,0,631.4654,a8w8_blockscale_1x128x128_256x128x128x128_16x16_32x32_2x2_8x32x1_8x32x1_1x32x1x8_8_1x1_intrawave_v3,782.18,360.34,0.0
gfx942,304,23680,2048,5120,ck,0,0,622.6436,a8w8_blockscale_1x128x128_256x128x128x128_16x16_32x32_2x2_8x32x1_8x32x1_1x32x1x8_8_1x1_intrawave_v3,797.58,367.34,0.0
gfx942,304,23808,2048,5120,ck,0,0,623.6925,a8w8_blockscale_1x128x128_256x128x128x128_16x16_32x32_2x2_8x32x1_8x32x1_1x32x1x8_8_1x1_intrawave_v3,800.54,368.61,0.0
gfx942,304,23936,2048,5120,ck,0,0,633.9065,a8w8_blockscale_1x128x128_256x128x128x128_16x16_32x32_2x2_8x32x1_8x32x1_1x32x1x8_8_1x1_intrawave_v3,791.87,364.53,0.0
gfx942,304,24064,2048,5120,ck,0,0,639.0863,a8w8_blockscale_1x128x128_256x128x128x128_16x16_32x32_2x2_8x32x1_8x32x1_1x32x1x8_8_1x1_intrawave_v3,789.66,363.42,0.0
gfx942,304,24192,2048,5120,ck,0,0,644.5272,a8w8_blockscale_1x128x128_256x128x128x128_16x16_32x32_2x2_8x32x1_8x32x1_1x32x1x8_8_1x1_intrawave_v3,787.16,362.19,0.0
gfx942,304,24320,2048,5120,ck,0,0,650.1143,a8w8_blockscale_1x128x128_256x128x128x128_16x16_32x32_2x2_8x32x1_8x32x1_1x32x1x8_8_1x1_intrawave_v3,784.52,360.89,0.0
gfx942,304,24448,2048,5120,ck,0,0,668.0314,a8w8_blockscale_1x128x128_256x128x128x128_16x16_32x32_2x2_8x32x1_8x32x1_1x32x1x8_8_1x1_intrawave_v3,767.5,352.98,0.0
gfx942,304,24576,2048,5120,ck,0,0,648.1601,a8w8_blockscale_1x128x128_256x128x128x128_16x16_32x32_2x2_8x32x1_8x32x1_1x32x1x8_8_1x1_intrawave_v3,795.17,365.62,0.0
gfx942,304,24704,2048,5120,ck,0,0,672.6496,a8w8_blockscale_1x128x128_256x128x128x128_16x16_32x32_2x2_8x32x1_8x32x1_1x32x1x8_8_1x1_intrawave_v3,770.21,354.06,0.0
gfx942,304,24832,2048,5120,ck,0,0,658.8772,a8w8_blockscale_1x128x128_256x128x128x128_16x16_32x32_2x2_8x32x1_8x32x1_1x32x1x8_8_1x1_intrawave_v3,790.38,363.25,0.0
gfx942,304,24960,2048,5120,ck,0,0,663.3006,a8w8_blockscale_1x128x128_256x128x128x128_16x16_32x32_2x2_8x32x1_8x32x1_1x32x1x8_8_1x1_intrawave_v3,789.16,362.61,0.0
gfx942,304,25088,2048,5120,ck,0,0,682.2483,a8w8_blockscale_1x128x128_256x128x128x128_16x16_32x32_2x2_8x32x1_8x32x1_1x32x1x8_8_1x1_intrawave_v3,771.18,354.27,0.0
gfx942,304,25216,2048,5120,ck,0,0,675.3277,a8w8_blockscale_1x128x128_256x128x128x128_16x16_32x32_2x2_8x32x1_8x32x1_1x32x1x8_8_1x1_intrawave_v3,783.05,359.64,0.0
gfx942,304,25344,2048,5120,ck,0,0,677.9613,a8w8_blockscale_1x128x128_256x128x128x128_16x16_32x32_2x2_8x32x1_8x32x1_1x32x1x8_8_1x1_intrawave_v3,783.97,359.99,0.0
gfx942,304,25472,2048,5120,ck,0,0,667.4377,a8w8_blockscale_1x128x128_256x128x128x128_16x16_32x32_2x2_8x32x1_8x32x1_1x32x1x8_8_1x1_intrawave_v3,800.35,367.43,0.0
gfx942,304,25600,2048,5120,ck,0,0,683.0268,a8w8_blockscale_1x128x128_256x128x128x128_16x16_32x32_2x2_8x32x1_8x32x1_1x32x1x8_8_1x1_intrawave_v3,786.02,360.77,0.0
gfx942,304,25728,2048,5120,ck,0,0,682.0944,a8w8_blockscale_1x128x128_256x128x128x128_16x16_32x32_2x2_8x32x1_8x32x1_1x32x1x8_8_1x1_intrawave_v3,791.03,362.99,0.0
gfx942,304,25856,2048,5120,ck,0,0,673.0369,a8w8_blockscale_1x128x128_256x128x128x128_16x16_32x32_2x2_8x32x1_8x32x1_1x32x1x8_8_1x1_intrawave_v3,805.66,369.63,0.0
gfx942,304,25984,2048,5120,ck,0,0,681.6446,a8w8_blockscale_1x128x128_256x128x128x128_16x16_32x32_2x2_8x32x1_8x32x1_1x32x1x8_8_1x1_intrawave_v3,799.43,366.69,0.0
gfx942,304,26112,2048,5120,ck,0,0,688.0739,a8w8_blockscale_1x128x128_256x128x128x128_16x16_32x32_2x2_8x32x1_8x32x1_1x32x1x8_8_1x1_intrawave_v3,795.86,364.98,0.0
gfx942,304,26240,2048,5120,ck,0,0,704.2982,a8w8_blockscale_1x128x128_256x128x128x128_16x16_32x32_2x2_8x32x1_8x32x1_1x32x1x8_8_1x1_intrawave_v3,781.33,358.25,0.0
gfx942,304,26368,2048,5120,ck,0,0,692.503,a8w8_blockscale_1x128x128_256x128x128x128_16x16_32x32_2x2_8x32x1_8x32x1_1x32x1x8_8_1x1_intrawave_v3,798.52,366.05,0.0
gfx942,304,26496,2048,5120,ck,0,0,701.7995,a8w8_blockscale_1x128x128_256x128x128x128_16x16_32x32_2x2_8x32x1_8x32x1_1x32x1x8_8_1x1_intrawave_v3,791.77,362.89,0.0
gfx942,304,26624,2048,5120,ck,0,0,698.8167,a8w8_blockscale_1x128x128_256x128x128x128_16x16_32x32_2x2_8x32x1_8x32x1_1x32x1x8_8_1x1_intrawave_v3,798.99,366.12,0.0
gfx942,304,26752,2048,5120,ck,0,0,727.5899,a8w8_blockscale_1x128x128_256x128x128x128_16x16_32x32_2x2_8x32x1_8x32x1_1x32x1x8_8_1x1_intrawave_v3,771.08,353.27,0.0
gfx942,304,26880,2048,5120,ck,0,0,716.6408,a8w8_blockscale_1x128x128_256x128x128x128_16x16_32x32_2x2_8x32x1_8x32x1_1x32x1x8_8_1x1_intrawave_v3,786.61,360.31,0.0
gfx942,304,27008,2048,5120,ck,0,0,732.172,a8w8_blockscale_1x128x128_256x128x128x128_16x16_32x32_2x2_8x32x1_8x32x1_1x32x1x8_8_1x1_intrawave_v3,773.59,354.28,0.0
gfx942,304,27136,2048,5120,ck,0,0,731.1406,a8w8_blockscale_1x128x128_256x128x128x128_16x16_32x32_2x2_8x32x1_8x32x1_1x32x1x8_8_1x1_intrawave_v3,778.35,356.39,0.0
gfx942,304,27264,2048,5120,ck,0,0,737.5919,a8w8_blockscale_1x128x128_256x128x128x128_16x16_32x32_2x2_8x32x1_8x32x1_1x32x1x8_8_1x1_intrawave_v3,775.18,354.87,0.0
gfx942,304,27392,2048,5120,ck,0,0,722.8988,a8w8_blockscale_1x128x128_256x128x128x128_16x16_32x32_2x2_8x32x1_8x32x1_1x32x1x8_8_1x1_intrawave_v3,794.65,363.72,0.0
gfx942,304,27520,2048,5120,ck,0,0,719.2171,a8w8_blockscale_1x128x128_256x128x128x128_16x16_32x32_2x2_8x32x1_8x32x1_1x32x1x8_8_1x1_intrawave_v3,802.45,367.22,0.0
gfx942,304,27648,2048,5120,ck,0,0,742.2939,a8w8_blockscale_1x128x128_256x128x128x128_16x16_32x32_2x2_8x32x1_8x32x1_1x32x1x8_8_1x1_intrawave_v3,781.12,357.39,0.0
gfx942,304,27776,2048,5120,ck,0,0,732.3934,a8w8_blockscale_1x128x128_256x128x128x128_16x16_32x32_2x2_8x32x1_8x32x1_1x32x1x8_8_1x1_intrawave_v3,795.34,363.83,0.0
gfx942,304,27904,2048,5120,ck,0,0,745.4254,a8w8_blockscale_1x128x128_256x128x128x128_16x16_32x32_2x2_8x32x1_8x32x1_1x32x1x8_8_1x1_intrawave_v3,785.04,359.06,0.0
gfx942,304,28032,2048,5120,ck,0,0,751.5153,a8w8_blockscale_1x128x128_256x128x128x128_16x16_32x32_2x2_8x32x1_8x32x1_1x32x1x8_8_1x1_intrawave_v3,782.25,357.72,0.0
gfx942,304,28160,2048,5120,ck,0,0,734.1996,a8w8_blockscale_1x128x128_256x128x128x128_16x16_32x32_2x2_8x32x1_8x32x1_1x32x1x8_8_1x1_intrawave_v3,804.36,367.76,0.0
gfx942,304,28288,2048,5120,ck,0,0,744.3834,a8w8_blockscale_1x128x128_256x128x128x128_16x16_32x32_2x2_8x32x1_8x32x1_1x32x1x8_8_1x1_intrawave_v3,796.96,364.31,0.0
gfx942,304,28416,2048,5120,ck,0,0,743.4438,a8w8_blockscale_1x128x128_256x128x128x128_16x16_32x32_2x2_8x32x1_8x32x1_1x32x1x8_8_1x1_intrawave_v3,801.58,366.36,0.0
gfx942,304,28544,2048,5120,ck,0,0,745.2964,a8w8_blockscale_1x128x128_256x128x128x128_16x16_32x32_2x2_8x32x1_8x32x1_1x32x1x8_8_1x1_intrawave_v3,803.19,367.03,0.0
gfx942,304,28672,2048,5120,ck,0,0,745.0806,a8w8_blockscale_1x128x128_256x128x128x128_16x16_32x32_2x2_8x32x1_8x32x1_1x32x1x8_8_1x1_intrawave_v3,807.02,368.72,0.0
gfx942,304,28800,2048,5120,ck,0,0,756.5144,a8w8_blockscale_1x128x128_256x128x128x128_16x16_32x32_2x2_8x32x1_8x32x1_1x32x1x8_8_1x1_intrawave_v3,798.37,364.71,0.0
gfx942,304,28928,2048,5120,ck,0,0,763.988,a8w8_blockscale_1x128x128_256x128x128x128_16x16_32x32_2x2_8x32x1_8x32x1_1x32x1x8_8_1x1_intrawave_v3,794.08,362.68,0.0
gfx942,304,29056,2048,5120,ck,0,0,771.5908,a8w8_blockscale_1x128x128_256x128x128x128_16x16_32x32_2x2_8x32x1_8x32x1_1x32x1x8_8_1x1_intrawave_v3,789.73,360.64,0.0
gfx942,304,29184,2048,5120,ck,0,0,769.2423,a8w8_blockscale_1x128x128_256x128x128x128_16x16_32x32_2x2_8x32x1_8x32x1_1x32x1x8_8_1x1_intrawave_v3,795.63,363.27,0.0
gfx942,304,29312,2048,5120,ck,0,0,781.4585,a8w8_blockscale_1x128x128_256x128x128x128_16x16_32x32_2x2_8x32x1_8x32x1_1x32x1x8_8_1x1_intrawave_v3,786.63,359.1,0.0
gfx942,304,29440,2048,5120,ck,0,0,784.5354,a8w8_blockscale_1x128x128_256x128x128x128_16x16_32x32_2x2_8x32x1_8x32x1_1x32x1x8_8_1x1_intrawave_v3,786.96,359.2,0.0
gfx942,304,29568,2048,5120,ck,0,0,801.8156,a8w8_blockscale_1x128x128_256x128x128x128_16x16_32x32_2x2_8x32x1_8x32x1_1x32x1x8_8_1x1_intrawave_v3,773.35,352.93,0.0
gfx942,304,29696,2048,5120,ck,0,0,795.5848,a8w8_blockscale_1x128x128_256x128x128x128_16x16_32x32_2x2_8x32x1_8x32x1_1x32x1x8_8_1x1_intrawave_v3,782.78,357.18,0.0
gfx942,304,29824,2048,5120,ck,0,0,784.6711,a8w8_blockscale_1x128x128_256x128x128x128_16x16_32x32_2x2_8x32x1_8x32x1_1x32x1x8_8_1x1_intrawave_v3,797.09,363.65,0.0
gfx942,304,29952,2048,5120,ck,0,0,788.6415,a8w8_blockscale_1x128x128_256x128x128x128_16x16_32x32_2x2_8x32x1_8x32x1_1x32x1x8_8_1x1_intrawave_v3,796.48,363.31,0.0
gfx942,304,30080,2048,5120,ck,0,0,789.1455,a8w8_blockscale_1x128x128_256x128x128x128_16x16_32x32_2x2_8x32x1_8x32x1_1x32x1x8_8_1x1_intrawave_v3,799.38,364.58,0.0
gfx942,304,30208,2048,5120,ck,0,0,792.7975,a8w8_blockscale_1x128x128_256x128x128x128_16x16_32x32_2x2_8x32x1_8x32x1_1x32x1x8_8_1x1_intrawave_v3,799.08,364.38,0.0
gfx942,304,30336,2048,5120,ck,0,0,793.9969,a8w8_blockscale_1x128x128_256x128x128x128_16x16_32x32_2x2_8x32x1_8x32x1_1x32x1x8_8_1x1_intrawave_v3,801.25,365.32,0.0
gfx942,304,30464,2048,5120,ck,0,0,800.847,a8w8_blockscale_1x128x128_256x128x128x128_16x16_32x32_2x2_8x32x1_8x32x1_1x32x1x8_8_1x1_intrawave_v3,797.75,363.67,0.0
gfx942,304,30592,2048,5120,ck,0,0,800.1988,a8w8_blockscale_1x128x128_256x128x128x128_16x16_32x32_2x2_8x32x1_8x32x1_1x32x1x8_8_1x1_intrawave_v3,801.75,365.44,0.0
gfx942,304,30720,2048,5120,ck,0,0,795.7556,a8w8_blockscale_1x128x128_256x128x128x128_16x16_32x32_2x2_8x32x1_8x32x1_1x32x1x8_8_1x1_intrawave_v3,809.6,368.96,0.0
gfx942,304,30848,2048,5120,ck,0,0,808.6055,a8w8_blockscale_1x128x128_256x128x128x128_16x16_32x32_2x2_8x32x1_8x32x1_1x32x1x8_8_1x1_intrawave_v3,800.06,364.55,0.0
gfx942,304,30976,2048,5120,ck,0,0,810.8424,a8w8_blockscale_1x128x128_256x128x128x128_16x16_32x32_2x2_8x32x1_8x32x1_1x32x1x8_8_1x1_intrawave_v3,801.16,365.0,0.0
gfx942,304,31104,2048,5120,ck,0,0,819.8324,a8w8_blockscale_1x128x128_256x128x128x128_16x16_32x32_2x2_8x32x1_8x32x1_1x32x1x8_8_1x1_intrawave_v3,795.65,362.44,0.0
gfx942,304,31232,2048,5120,ck,0,0,812.5722,a8w8_blockscale_1x128x128_256x128x128x128_16x16_32x32_2x2_8x32x1_8x32x1_1x32x1x8_8_1x1_intrawave_v3,806.06,367.13,0.0
gfx942,304,31360,2048,5120,ck,0,0,825.7664,a8w8_blockscale_1x128x128_256x128x128x128_16x16_32x32_2x2_8x32x1_8x32x1_1x32x1x8_8_1x1_intrawave_v3,796.43,362.69,0.0
gfx942,304,31488,2048,5120,ck,0,0,834.3319,a8w8_blockscale_1x128x128_256x128x128x128_16x16_32x32_2x2_8x32x1_8x32x1_1x32x1x8_8_1x1_intrawave_v3,791.47,360.38,0.0
gfx942,304,31616,2048,5120,ck,0,0,831.0299,a8w8_blockscale_1x128x128_256x128x128x128_16x16_32x32_2x2_8x32x1_8x32x1_1x32x1x8_8_1x1_intrawave_v3,797.85,363.23,0.0
gfx942,304,31744,2048,5120,ck,0,0,833.7844,a8w8_blockscale_1x128x128_256x128x128x128_16x16_32x32_2x2_8x32x1_8x32x1_1x32x1x8_8_1x1_intrawave_v3,798.43,363.45,0.0
gfx942,304,31872,2048,5120,ck,0,0,839.1919,a8w8_blockscale_1x128x128_256x128x128x128_16x16_32x32_2x2_8x32x1_8x32x1_1x32x1x8_8_1x1_intrawave_v3,796.49,362.51,0.0
gfx942,304,32000,2048,5120,ck,0,0,837.1165,a8w8_blockscale_1x128x128_256x128x128x128_16x16_32x32_2x2_8x32x1_8x32x1_1x32x1x8_8_1x1_intrawave_v3,801.67,364.82,0.0
gfx942,304,32128,2048,5120,ck,0,0,844.3656,a8w8_blockscale_1x128x128_256x128x128x128_16x16_32x32_2x2_8x32x1_8x32x1_1x32x1x8_8_1x1_intrawave_v3,797.96,363.09,0.0
gfx942,304,32256,2048,5120,ck,0,0,841.572,a8w8_blockscale_1x128x128_256x128x128x128_16x16_32x32_2x2_8x32x1_8x32x1_1x32x1x8_8_1x1_intrawave_v3,803.8,365.69,0.0
gfx942,304,32384,2048,5120,ck,0,0,851.1572,a8w8_blockscale_1x128x128_256x128x128x128_16x16_32x32_2x2_8x32x1_8x32x1_1x32x1x8_8_1x1_intrawave_v3,797.9,362.96,0.0
gfx942,304,32512,2048,5120,ck,0,0,852.5962,a8w8_blockscale_1x128x128_256x128x128x128_16x16_32x32_2x2_8x32x1_8x32x1_1x32x1x8_8_1x1_intrawave_v3,799.71,363.73,0.0
gfx942,304,32640,2048,5120,ck,0,0,852.6059,a8w8_blockscale_1x128x128_256x128x128x128_16x16_32x32_2x2_8x32x1_8x32x1_1x32x1x8_8_1x1_intrawave_v3,802.85,365.11,0.0
gfx942,304,32768,2048,5120,ck,0,0,855.8827,a8w8_blockscale_1x128x128_256x128x128x128_16x16_32x32_2x2_8x32x1_8x32x1_1x32x1x8_8_1x1_intrawave_v3,802.91,365.09,0.0
gfx942,304,32896,2048,5120,ck,0,0,884.7894,a8w8_blockscale_1x128x128_256x128x128x128_16x16_32x32_2x2_8x32x1_8x32x1_1x32x1x8_8_1x1_intrawave_v3,779.71,354.5,0.0
gfx942,304,33024,2048,5120,ck,0,0,889.8891,a8w8_blockscale_1x128x128_256x128x128x128_16x16_32x32_2x2_8x32x1_8x32x1_1x32x1x8_8_1x1_intrawave_v3,778.26,353.79,0.0
gfx942,304,33152,2048,5120,ck,0,0,868.2793,a8w8_blockscale_1x128x128_256x128x128x128_16x16_32x32_2x2_8x32x1_8x32x1_1x32x1x8_8_1x1_intrawave_v3,800.72,363.95,0.0
gfx942,304,33280,2048,5120,ck,0,0,870.8143,a8w8_blockscale_1x128x128_256x128x128x128_16x16_32x32_2x2_8x32x1_8x32x1_1x32x1x8_8_1x1_intrawave_v3,801.47,364.25,0.0
gfx942,304,33408,2048,5120,ck,0,0,883.0009,a8w8_blockscale_1x128x128_256x128x128x128_16x16_32x32_2x2_8x32x1_8x32x1_1x32x1x8_8_1x1_intrawave_v3,793.45,360.56,0.0
gfx942,304,33536,2048,5120,ck,0,0,879.1859,a8w8_blockscale_1x128x128_256x128x128x128_16x16_32x32_2x2_8x32x1_8x32x1_1x32x1x8_8_1x1_intrawave_v3,799.95,363.47,0.0
gfx942,304,33664,2048,5120,ck,0,0,884.1231,a8w8_blockscale_1x128x128_256x128x128x128_16x16_32x32_2x2_8x32x1_8x32x1_1x32x1x8_8_1x1_intrawave_v3,798.51,362.77,0.0
gfx942,304,33792,2048,5120,ck,0,0,888.0256,a8w8_blockscale_1x128x128_256x128x128x128_16x16_32x32_2x2_8x32x1_8x32x1_1x32x1x8_8_1x1_intrawave_v3,798.03,362.5,0.0
gfx942,304,33920,2048,5120,ck,0,0,913.3306,a8w8_blockscale_1x128x128_256x128x128x128_16x16_32x32_2x2_8x32x1_8x32x1_1x32x1x8_8_1x1_intrawave_v3,778.86,353.75,0.0
gfx942,304,34048,2048,5120,ck,0,0,901.3474,a8w8_blockscale_1x128x128_256x128x128x128_16x16_32x32_2x2_8x32x1_8x32x1_1x32x1x8_8_1x1_intrawave_v3,792.19,359.76,0.0
gfx942,304,34176,2048,5120,ck,0,0,904.8176,a8w8_blockscale_1x128x128_256x128x128x128_16x16_32x32_2x2_8x32x1_8x32x1_1x32x1x8_8_1x1_intrawave_v3,792.12,359.69,0.0
gfx942,304,34304,2048,5120,ck,0,0,906.6876,a8w8_blockscale_1x128x128_256x128x128x128_16x16_32x32_2x2_8x32x1_8x32x1_1x32x1x8_8_1x1_intrawave_v3,793.45,360.25,0.0
gfx942,304,34432,2048,5120,ck,0,0,904.8067,a8w8_blockscale_1x128x128_256x128x128x128_16x16_32x32_2x2_8x32x1_8x32x1_1x32x1x8_8_1x1_intrawave_v3,798.06,362.3,0.0
gfx942,304,34560,2048,5120,ck,0,0,901.2542,a8w8_blockscale_1x128x128_256x128x128x128_16x16_32x32_2x2_8x32x1_8x32x1_1x32x1x8_8_1x1_intrawave_v3,804.19,365.04,0.0
gfx942,304,34688,2048,5120,ck,0,0,902.7723,a8w8_blockscale_1x128x128_256x128x128x128_16x16_32x32_2x2_8x32x1_8x32x1_1x32x1x8_8_1x1_intrawave_v3,805.81,365.73,0.0
gfx942,304,34816,2048,5120,ck,0,0,913.7219,a8w8_blockscale_1x128x128_256x128x128x128_16x16_32x32_2x2_8x32x1_8x32x1_1x32x1x8_8_1x1_intrawave_v3,799.09,362.64,0.0
gfx942,304,34944,2048,5120,ck,0,0,915.5307,a8w8_blockscale_1x128x128_256x128x128x128_16x16_32x32_2x2_8x32x1_8x32x1_1x32x1x8_8_1x1_intrawave_v3,800.44,363.21,0.0
gfx942,304,35072,2048,5120,ck,0,0,919.2004,a8w8_blockscale_1x128x128_256x128x128x128_16x16_32x32_2x2_8x32x1_8x32x1_1x32x1x8_8_1x1_intrawave_v3,800.17,363.04,0.0
gfx942,304,35200,2048,5120,ck,0,0,927.6717,a8w8_blockscale_1x128x128_256x128x128x128_16x16_32x32_2x2_8x32x1_8x32x1_1x32x1x8_8_1x1_intrawave_v3,795.75,361.0,0.0
gfx942,304,35328,2048,5120,ck,0,0,925.1608,a8w8_blockscale_1x128x128_256x128x128x128_16x16_32x32_2x2_8x32x1_8x32x1_1x32x1x8_8_1x1_intrawave_v3,800.81,363.25,0.0
gfx942,304,35456,2048,5120,ck,0,0,953.8436,a8w8_blockscale_1x128x128_256x128x128x128_16x16_32x32_2x2_8x32x1_8x32x1_1x32x1x8_8_1x1_intrawave_v3,779.55,353.57,0.0
gfx942,304,35584,2048,5120,ck,0,0,957.5027,a8w8_blockscale_1x128x128_256x128x128x128_16x16_32x32_2x2_8x32x1_8x32x1_1x32x1x8_8_1x1_intrawave_v3,779.37,353.45,0.0
gfx942,304,35712,2048,5120,ck,0,0,932.6456,a8w8_blockscale_1x128x128_256x128x128x128_16x16_32x32_2x2_8x32x1_8x32x1_1x32x1x8_8_1x1_intrawave_v3,803.02,364.13,0.0
gfx942,304,35840,2048,5120,ck,0,0,947.9374,a8w8_blockscale_1x128x128_256x128x128x128_16x16_32x32_2x2_8x32x1_8x32x1_1x32x1x8_8_1x1_intrawave_v3,792.9,359.5,0.0
gfx942,304,35968,2048,5120,ck,0,0,946.3712,a8w8_blockscale_1x128x128_256x128x128x128_16x16_32x32_2x2_8x32x1_8x32x1_1x32x1x8_8_1x1_intrawave_v3,797.05,361.35,0.0
gfx942,304,36096,2048,5120,ck,0,0,976.525,a8w8_blockscale_1x128x128_256x128x128x128_16x16_32x32_2x2_8x32x1_8x32x1_1x32x1x8_8_1x1_intrawave_v3,775.19,351.4,0.0
gfx942,304,36224,2048,5120,ck,0,0,947.2231,a8w8_blockscale_1x128x128_256x128x128x128_16x16_32x32_2x2_8x32x1_8x32x1_1x32x1x8_8_1x1_intrawave_v3,802.0,363.51,0.0
gfx942,304,36352,2048,5120,ck,0,0,951.2718,a8w8_blockscale_1x128x128_256x128x128x128_16x16_32x32_2x2_8x32x1_8x32x1_1x32x1x8_8_1x1_intrawave_v3,801.41,363.2,0.0
gfx942,304,36480,2048,5120,ck,0,0,955.7797,a8w8_blockscale_1x128x128_256x128x128x128_16x16_32x32_2x2_8x32x1_8x32x1_1x32x1x8_8_1x1_intrawave_v3,800.44,362.73,0.0
gfx942,304,36608,2048,5120,ck,0,0,951.6897,a8w8_blockscale_1x128x128_256x128x128x128_16x16_32x32_2x2_8x32x1_8x32x1_1x32x1x8_8_1x1_intrawave_v3,806.7,365.52,0.0
gfx942,304,36736,2048,5120,ck,0,0,961.0193,a8w8_blockscale_1x128x128_256x128x128x128_16x16_32x32_2x2_8x32x1_8x32x1_1x32x1x8_8_1x1_intrawave_v3,801.66,363.2,0.0
gfx942,304,36864,2048,5120,ck,0,0,956.0588,a8w8_blockscale_1x128x128_256x128x128x128_16x16_32x32_2x2_8x32x1_8x32x1_1x32x1x8_8_1x1_intrawave_v3,808.63,366.32,0.0
gfx942,304,36992,2048,5120,ck,0,0,970.8626,a8w8_blockscale_1x128x128_256x128x128x128_16x16_32x32_2x2_8x32x1_8x32x1_1x32x1x8_8_1x1_intrawave_v3,799.06,361.95,0.0
gfx942,304,37120,2048,5120,ck,0,0,974.126,a8w8_blockscale_1x128x128_256x128x128x128_16x16_32x32_2x2_8x32x1_8x32x1_1x32x1x8_8_1x1_intrawave_v3,799.14,361.95,0.0
gfx942,304,37248,2048,5120,ck,0,0,974.8033,a8w8_blockscale_1x128x128_256x128x128x128_16x16_32x32_2x2_8x32x1_8x32x1_1x32x1x8_8_1x1_intrawave_v3,801.34,362.91,0.0
gfx942,304,37376,2048,5120,ck,0,0,973.6809,a8w8_blockscale_1x128x128_256x128x128x128_16x16_32x32_2x2_8x32x1_8x32x1_1x32x1x8_8_1x1_intrawave_v3,805.02,364.54,0.0
gfx942,304,37504,2048,5120,ck,0,0,985.3569,a8w8_blockscale_1x128x128_256x128x128x128_16x16_32x32_2x2_8x32x1_8x32x1_1x32x1x8_8_1x1_intrawave_v3,798.2,361.41,0.0
gfx942,304,37632,2048,5120,ck,0,0,1008.5387,a8w8_blockscale_1x128x128_256x128x128x128_16x16_32x32_2x2_8x32x1_8x32x1_1x32x1x8_8_1x1_intrawave_v3,782.52,354.28,0.0
gfx942,304,37760,2048,5120,ck,0,0,991.351,a8w8_blockscale_1x128x128_256x128x128x128_16x16_32x32_2x2_8x32x1_8x32x1_1x32x1x8_8_1x1_intrawave_v3,798.79,361.61,0.0
gfx942,304,37888,2048,5120,ck,0,0,987.7115,a8w8_blockscale_1x128x128_256x128x128x128_16x16_32x32_2x2_8x32x1_8x32x1_1x32x1x8_8_1x1_intrawave_v3,804.45,364.14,0.0
gfx942,304,38016,2048,5120,ck,0,0,997.9028,a8w8_blockscale_1x128x128_256x128x128x128_16x16_32x32_2x2_8x32x1_8x32x1_1x32x1x8_8_1x1_intrawave_v3,798.93,361.6,0.0
gfx942,304,38144,2048,5120,ck,0,0,1007.9593,a8w8_blockscale_1x128x128_256x128x128x128_16x16_32x32_2x2_8x32x1_8x32x1_1x32x1x8_8_1x1_intrawave_v3,793.62,359.16,0.0
gfx942,304,38272,2048,5120,ck,0,0,1004.4901,a8w8_blockscale_1x128x128_256x128x128x128_16x16_32x32_2x2_8x32x1_8x32x1_1x32x1x8_8_1x1_intrawave_v3,799.03,361.58,0.0
gfx942,304,38400,2048,5120,ck,0,0,1006.136,a8w8_blockscale_1x128x128_256x128x128x128_16x16_32x32_2x2_8x32x1_8x32x1_1x32x1x8_8_1x1_intrawave_v3,800.4,362.16,0.0
gfx942,304,38528,2048,5120,ck,0,0,1014.1579,a8w8_blockscale_1x128x128_256x128x128x128_16x16_32x32_2x2_8x32x1_8x32x1_1x32x1x8_8_1x1_intrawave_v3,796.71,360.46,0.0
gfx942,304,38656,2048,5120,ck,0,0,1019.3717,a8w8_blockscale_1x128x128_256x128x128x128_16x16_32x32_2x2_8x32x1_8x32x1_1x32x1x8_8_1x1_intrawave_v3,795.27,359.77,0.0
gfx942,304,38784,2048,5120,ck,0,0,1033.8823,a8w8_blockscale_1x128x128_256x128x128x128_16x16_32x32_2x2_8x32x1_8x32x1_1x32x1x8_8_1x1_intrawave_v3,786.7,355.86,0.0
gfx942,304,38912,2048,5120,ck,0,0,1015.9283,a8w8_blockscale_1x128x128_256x128x128x128_16x16_32x32_2x2_8x32x1_8x32x1_1x32x1x8_8_1x1_intrawave_v3,803.25,363.31,0.0
gfx942,304,39040,2048,5120,ck,0,0,1028.865,a8w8_blockscale_1x128x128_256x128x128x128_16x16_32x32_2x2_8x32x1_8x32x1_1x32x1x8_8_1x1_intrawave_v3,795.76,359.89,0.0
gfx942,304,39168,2048,5120,ck,0,0,1026.3345,a8w8_blockscale_1x128x128_256x128x128x128_16x16_32x32_2x2_8x32x1_8x32x1_1x32x1x8_8_1x1_intrawave_v3,800.34,361.93,0.0
gfx942,304,39296,2048,5120,ck,0,0,1027.9431,a8w8_blockscale_1x128x128_256x128x128x128_16x16_32x32_2x2_8x32x1_8x32x1_1x32x1x8_8_1x1_intrawave_v3,801.7,362.51,0.0
gfx942,304,39424,2048,5120,ck,0,0,1030.2646,a8w8_blockscale_1x128x128_256x128x128x128_16x16_32x32_2x2_8x32x1_8x32x1_1x32x1x8_8_1x1_intrawave_v3,802.49,362.84,0.0
gfx942,304,39552,2048,5120,ck,0,0,1032.1187,a8w8_blockscale_1x128x128_256x128x128x128_16x16_32x32_2x2_8x32x1_8x32x1_1x32x1x8_8_1x1_intrawave_v3,803.65,363.33,0.0
gfx942,304,39680,2048,5120,ck,0,0,1043.5964,a8w8_blockscale_1x128x128_256x128x128x128_16x16_32x32_2x2_8x32x1_8x32x1_1x32x1x8_8_1x1_intrawave_v3,797.39,360.46,0.0
gfx942,304,39808,2048,5120,ck,0,0,1040.4966,a8w8_blockscale_1x128x128_256x128x128x128_16x16_32x32_2x2_8x32x1_8x32x1_1x32x1x8_8_1x1_intrawave_v3,802.34,362.67,0.0
gfx942,304,39936,2048,5120,ck,0,0,1038.6859,a8w8_blockscale_1x128x128_256x128x128x128_16x16_32x32_2x2_8x32x1_8x32x1_1x32x1x8_8_1x1_intrawave_v3,806.33,364.44,0.0
gfx942,304,40064,2048,5120,ck,0,0,1045.7901,a8w8_blockscale_1x128x128_256x128x128x128_16x16_32x32_2x2_8x32x1_8x32x1_1x32x1x8_8_1x1_intrawave_v3,803.41,363.09,0.0
gfx942,304,40192,2048,5120,ck,0,0,1052.1625,a8w8_blockscale_1x128x128_256x128x128x128_16x16_32x32_2x2_8x32x1_8x32x1_1x32x1x8_8_1x1_intrawave_v3,801.1,362.01,0.0
gfx942,304,40320,2048,5120,ck,0,0,1058.0296,a8w8_blockscale_1x128x128_256x128x128x128_16x16_32x32_2x2_8x32x1_8x32x1_1x32x1x8_8_1x1_intrawave_v3,799.19,361.12,0.0
gfx942,304,40448,2048,5120,ck,0,0,1058.2186,a8w8_blockscale_1x128x128_256x128x128x128_16x16_32x32_2x2_8x32x1_8x32x1_1x32x1x8_8_1x1_intrawave_v3,801.59,362.17,0.0
gfx942,304,40576,2048,5120,ck,0,0,1062.7311,a8w8_blockscale_1x128x128_256x128x128x128_16x16_32x32_2x2_8x32x1_8x32x1_1x32x1x8_8_1x1_intrawave_v3,800.71,361.74,0.0
gfx942,304,40704,2048,5120,ck,0,0,1059.9762,a8w8_blockscale_1x128x128_256x128x128x128_16x16_32x32_2x2_8x32x1_8x32x1_1x32x1x8_8_1x1_intrawave_v3,805.32,363.79,0.0
gfx942,304,40832,2048,5120,ck,0,0,1080.9771,a8w8_blockscale_1x128x128_256x128x128x128_16x16_32x32_2x2_8x32x1_8x32x1_1x32x1x8_8_1x1_intrawave_v3,792.16,357.82,0.0
gfx942,304,40960,2048,5120,ck,0,0,1077.8504,a8w8_blockscale_1x128x128_256x128x128x128_16x16_32x32_2x2_8x32x1_8x32x1_1x32x1x8_8_1x1_intrawave_v3,796.95,359.95,0.0
gfx942,304,41088,2048,5120,ck,0,0,1077.3263,a8w8_blockscale_1x128x128_256x128x128x128_16x16_32x32_2x2_8x32x1_8x32x1_1x32x1x8_8_1x1_intrawave_v3,799.83,361.22,0.0
gfx942,304,41216,2048,5120,ck,0,0,1078.3308,a8w8_blockscale_1x128x128_256x128x128x128_16x16_32x32_2x2_8x32x1_8x32x1_1x32x1x8_8_1x1_intrawave_v3,801.57,361.98,0.0
gfx942,304,41344,2048,5120,ck,0,0,1088.6377,a8w8_blockscale_1x128x128_256x128x128x128_16x16_32x32_2x2_8x32x1_8x32x1_1x32x1x8_8_1x1_intrawave_v3,796.45,359.63,0.0
gfx942,304,41472,2048,5120,ck,0,0,1082.3874,a8w8_blockscale_1x128x128_256x128x128x128_16x16_32x32_2x2_8x32x1_8x32x1_1x32x1x8_8_1x1_intrawave_v3,803.53,362.8,0.0
gfx942,304,41600,2048,5120,ck,0,0,1088.6851,a8w8_blockscale_1x128x128_256x128x128x128_16x16_32x32_2x2_8x32x1_8x32x1_1x32x1x8_8_1x1_intrawave_v3,801.35,361.79,0.0
gfx942,304,41728,2048,5120,ck,0,0,1092.3924,a8w8_blockscale_1x128x128_256x128x128x128_16x16_32x32_2x2_8x32x1_8x32x1_1x32x1x8_8_1x1_intrawave_v3,801.09,361.64,0.0
gfx942,304,41856,2048,5120,ck,0,0,1099.1707,a8w8_blockscale_1x128x128_256x128x128x128_16x16_32x32_2x2_8x32x1_8x32x1_1x32x1x8_8_1x1_intrawave_v3,798.59,360.48,0.0
gfx942,304,41984,2048,5120,ck,0,0,1103.4868,a8w8_blockscale_1x128x128_256x128x128x128_16x16_32x32_2x2_8x32x1_8x32x1_1x32x1x8_8_1x1_intrawave_v3,797.9,360.14,0.0
gfx942,304,42112,2048,5120,ck,0,0,1103.5389,a8w8_blockscale_1x128x128_256x128x128x128_16x16_32x32_2x2_8x32x1_8x32x1_1x32x1x8_8_1x1_intrawave_v3,800.29,361.19,0.0
gfx942,304,42240,2048,5120,ck,0,0,1100.8514,a8w8_blockscale_1x128x128_256x128x128x128_16x16_32x32_2x2_8x32x1_8x32x1_1x32x1x8_8_1x1_intrawave_v3,804.68,363.15,0.0
gfx942,304,42368,2048,5120,ck,0,0,1119.2624,a8w8_blockscale_1x128x128_256x128x128x128_16x16_32x32_2x2_8x32x1_8x32x1_1x32x1x8_8_1x1_intrawave_v3,793.85,358.23,0.0
gfx942,304,42496,2048,5120,ck,0,0,1123.8209,a8w8_blockscale_1x128x128_256x128x128x128_16x16_32x32_2x2_8x32x1_8x32x1_1x32x1x8_8_1x1_intrawave_v3,793.01,357.82,0.0
gfx942,304,42624,2048,5120,ck,0,0,1124.9105,a8w8_blockscale_1x128x128_256x128x128x128_16x16_32x32_2x2_8x32x1_8x32x1_1x32x1x8_8_1x1_intrawave_v3,794.63,358.53,0.0
gfx942,304,42752,2048,5120,ck,0,0,1125.8195,a8w8_blockscale_1x128x128_256x128x128x128_16x16_32x32_2x2_8x32x1_8x32x1_1x32x1x8_8_1x1_intrawave_v3,796.37,359.28,0.0
gfx942,304,42880,2048,5120,ck,0,0,1121.9012,a8w8_blockscale_1x128x128_256x128x128x128_16x16_32x32_2x2_8x32x1_8x32x1_1x32x1x8_8_1x1_intrawave_v3,801.55,361.59,0.0
gfx942,304,43008,2048,5120,ck,0,0,1135.7768,a8w8_blockscale_1x128x128_256x128x128x128_16x16_32x32_2x2_8x32x1_8x32x1_1x32x1x8_8_1x1_intrawave_v3,794.12,358.21,0.0
gfx942,304,43136,2048,5120,ck,0,0,1132.7409,a8w8_blockscale_1x128x128_256x128x128x128_16x16_32x32_2x2_8x32x1_8x32x1_1x32x1x8_8_1x1_intrawave_v3,798.62,360.21,0.0
gfx942,304,43264,2048,5120,ck,0,0,1163.4017,a8w8_blockscale_1x128x128_256x128x128x128_16x16_32x32_2x2_8x32x1_8x32x1_1x32x1x8_8_1x1_intrawave_v3,779.88,351.73,0.0
gfx942,304,43392,2048,5120,ck,0,0,1151.8029,a8w8_blockscale_1x128x128_256x128x128x128_16x16_32x32_2x2_8x32x1_8x32x1_1x32x1x8_8_1x1_intrawave_v3,790.06,356.3,0.0
gfx942,304,43520,2048,5120,ck,0,0,1149.0009,a8w8_blockscale_1x128x128_256x128x128x128_16x16_32x32_2x2_8x32x1_8x32x1_1x32x1x8_8_1x1_intrawave_v3,794.33,358.19,0.0
gfx942,304,43648,2048,5120,ck,0,0,1157.3883,a8w8_blockscale_1x128x128_256x128x128x128_16x16_32x32_2x2_8x32x1_8x32x1_1x32x1x8_8_1x1_intrawave_v3,790.89,356.62,0.0
gfx942,304,43776,2048,5120,ck,0,0,1147.8688,a8w8_blockscale_1x128x128_256x128x128x128_16x16_32x32_2x2_8x32x1_8x32x1_1x32x1x8_8_1x1_intrawave_v3,799.79,360.6,0.0
gfx942,304,43904,2048,5120,ck,0,0,1147.6489,a8w8_blockscale_1x128x128_256x128x128x128_16x16_32x32_2x2_8x32x1_8x32x1_1x32x1x8_8_1x1_intrawave_v3,802.28,361.7,0.0
gfx942,304,44032,2048,5120,ck,0,0,1149.7187,a8w8_blockscale_1x128x128_256x128x128x128_16x16_32x32_2x2_8x32x1_8x32x1_1x32x1x8_8_1x1_intrawave_v3,803.17,362.08,0.0
gfx942,304,44160,2048,5120,ck,0,0,1168.1728,a8w8_blockscale_1x128x128_256x128x128x128_16x16_32x32_2x2_8x32x1_8x32x1_1x32x1x8_8_1x1_intrawave_v3,792.78,357.37,0.0
gfx942,304,44288,2048,5120,ck,0,0,1166.7237,a8w8_blockscale_1x128x128_256x128x128x128_16x16_32x32_2x2_8x32x1_8x32x1_1x32x1x8_8_1x1_intrawave_v3,796.06,358.82,0.0
gfx942,304,44416,2048,5120,ck,0,0,1165.6912,a8w8_blockscale_1x128x128_256x128x128x128_16x16_32x32_2x2_8x32x1_8x32x1_1x32x1x8_8_1x1_intrawave_v3,799.07,360.15,0.0
gfx942,304,44544,2048,5120,ck,0,0,1173.6178,a8w8_blockscale_1x128x128_256x128x128x128_16x16_32x32_2x2_8x32x1_8x32x1_1x32x1x8_8_1x1_intrawave_v3,795.96,358.72,0.0
gfx942,304,44672,2048,5120,ck,0,0,1173.4926,a8w8_blockscale_1x128x128_256x128x128x128_16x16_32x32_2x2_8x32x1_8x32x1_1x32x1x8_8_1x1_intrawave_v3,798.33,359.77,0.0
gfx942,304,44800,2048,5120,ck,0,0,1171.6994,a8w8_blockscale_1x128x128_256x128x128x128_16x16_32x32_2x2_8x32x1_8x32x1_1x32x1x8_8_1x1_intrawave_v3,801.85,361.32,0.0
gfx942,304,44928,2048,5120,ck,0,0,1170.8749,a8w8_blockscale_1x128x128_256x128x128x128_16x16_32x32_2x2_8x32x1_8x32x1_1x32x1x8_8_1x1_intrawave_v3,804.7,362.59,0.0
gfx942,304,45056,2048,5120,ck,0,0,1171.3013,a8w8_blockscale_1x128x128_256x128x128x128_16x16_32x32_2x2_8x32x1_8x32x1_1x32x1x8_8_1x1_intrawave_v3,806.7,363.46,0.0
gfx942,304,45184,2048,5120,ck,0,0,1196.8441,a8w8_blockscale_1x128x128_256x128x128x128_16x16_32x32_2x2_8x32x1_8x32x1_1x32x1x8_8_1x1_intrawave_v3,791.73,356.69,0.0
gfx942,304,45312,2048,5120,ck,0,0,1225.2654,a8w8_blockscale_1x128x128_256x128x128x128_16x16_32x32_2x2_8x32x1_8x32x1_1x32x1x8_8_1x1_intrawave_v3,775.56,349.38,0.0
gfx942,304,45440,2048,5120,ck,0,0,1185.8392,a8w8_blockscale_1x128x128_256x128x128x128_16x16_32x32_2x2_8x32x1_8x32x1_1x32x1x8_8_1x1_intrawave_v3,803.6,361.99,0.0
gfx942,304,45568,2048,5120,ck,0,0,1195.2763,a8w8_blockscale_1x128x128_256x128x128x128_16x16_32x32_2x2_8x32x1_8x32x1_1x32x1x8_8_1x1_intrawave_v3,799.51,360.12,0.0
gfx942,304,45696,2048,5120,ck,0,0,1199.7672,a8w8_blockscale_1x128x128_256x128x128x128_16x16_32x32_2x2_8x32x1_8x32x1_1x32x1x8_8_1x1_intrawave_v3,798.75,359.75,0.0
gfx942,304,45824,2048,5120,ck,0,0,1215.7182,a8w8_blockscale_1x128x128_256x128x128x128_16x16_32x32_2x2_8x32x1_8x32x1_1x32x1x8_8_1x1_intrawave_v3,790.48,356.0,0.0
gfx942,304,45952,2048,5120,ck,0,0,1215.1514,a8w8_blockscale_1x128x128_256x128x128x128_16x16_32x32_2x2_8x32x1_8x32x1_1x32x1x8_8_1x1_intrawave_v3,793.06,357.14,0.0
gfx942,304,46080,2048,5120,ck,0,0,1215.3372,a8w8_blockscale_1x128x128_256x128x128x128_16x16_32x32_2x2_8x32x1_8x32x1_1x32x1x8_8_1x1_intrawave_v3,795.14,358.06,0.0
gfx942,304,46208,2048,5120,ck,0,0,1236.7588,a8w8_blockscale_1x128x128_256x128x128x128_16x16_32x32_2x2_8x32x1_8x32x1_1x32x1x8_8_1x1_intrawave_v3,783.54,352.81,0.0
gfx942,304,46336,2048,5120,ck,0,0,1251.5458,a8w8_blockscale_1x128x128_256x128x128x128_16x16_32x32_2x2_8x32x1_8x32x1_1x32x1x8_8_1x1_intrawave_v3,776.43,349.58,0.0
gfx942,304,46464,2048,5120,ck,0,0,1226.7198,a8w8_blockscale_1x128x128_256x128x128x128_16x16_32x32_2x2_8x32x1_8x32x1_1x32x1x8_8_1x1_intrawave_v3,794.33,357.62,0.0
gfx942,304,46592,2048,5120,ck,0,0,1220.4666,a8w8_blockscale_1x128x128_256x128x128x128_16x16_32x32_2x2_8x32x1_8x32x1_1x32x1x8_8_1x1_intrawave_v3,800.6,360.42,0.0
gfx942,304,46720,2048,5120,ck,0,0,1264.9476,a8w8_blockscale_1x128x128_256x128x128x128_16x16_32x32_2x2_8x32x1_8x32x1_1x32x1x8_8_1x1_intrawave_v3,774.57,348.68,0.0
gfx942,304,46848,2048,5120,ck,0,0,1267.9448,a8w8_blockscale_1x128x128_256x128x128x128_16x16_32x32_2x2_8x32x1_8x32x1_1x32x1x8_8_1x1_intrawave_v3,774.86,348.78,0.0
gfx942,304,46976,2048,5120,ck,0,0,1236.1879,a8w8_blockscale_1x128x128_256x128x128x128_16x16_32x32_2x2_8x32x1_8x32x1_1x32x1x8_8_1x1_intrawave_v3,796.93,358.7,0.0
gfx942,304,47104,2048,5120,ck,0,0,1230.3972,a8w8_blockscale_1x128x128_256x128x128x128_16x16_32x32_2x2_8x32x1_8x32x1_1x32x1x8_8_1x1_intrawave_v3,802.86,361.34,0.0
gfx942,304,47232,2048,5120,ck,0,0,1249.7753,a8w8_blockscale_1x128x128_256x128x128x128_16x16_32x32_2x2_8x32x1_8x32x1_1x32x1x8_8_1x1_intrawave_v3,792.56,356.68,0.0
gfx942,304,47360,2048,5120,ck,0,0,1249.7931,a8w8_blockscale_1x128x128_256x128x128x128_16x16_32x32_2x2_8x32x1_8x32x1_1x32x1x8_8_1x1_intrawave_v3,794.7,357.62,0.0
gfx942,304,47488,2048,5120,ck,0,0,1248.3782,a8w8_blockscale_1x128x128_256x128x128x128_16x16_32x32_2x2_8x32x1_8x32x1_1x32x1x8_8_1x1_intrawave_v3,797.75,358.97,0.0
gfx942,304,47616,2048,5120,ck,0,0,1250.0345,a8w8_blockscale_1x128x128_256x128x128x128_16x16_32x32_2x2_8x32x1_8x32x1_1x32x1x8_8_1x1_intrawave_v3,798.84,359.44,0.0
gfx942,304,47744,2048,5120,ck,0,0,1264.4698,a8w8_blockscale_1x128x128_256x128x128x128_16x16_32x32_2x2_8x32x1_8x32x1_1x32x1x8_8_1x1_intrawave_v3,791.85,356.27,0.0
gfx942,304,47872,2048,5120,ck,0,0,1256.6802,a8w8_blockscale_1x128x128_256x128x128x128_16x16_32x32_2x2_8x32x1_8x32x1_1x32x1x8_8_1x1_intrawave_v3,798.89,359.42,0.0
gfx942,304,48000,2048,5120,ck,0,0,1273.1448,a8w8_blockscale_1x128x128_256x128x128x128_16x16_32x32_2x2_8x32x1_8x32x1_1x32x1x8_8_1x1_intrawave_v3,790.67,355.7,0.0
gfx942,304,48128,2048,5120,ck,0,0,1257.5356,a8w8_blockscale_1x128x128_256x128x128x128_16x16_32x32_2x2_8x32x1_8x32x1_1x32x1x8_8_1x1_intrawave_v3,802.62,361.05,0.0
gfx942,304,48256,2048,5120,ck,0,0,1260.7714,a8w8_blockscale_1x128x128_256x128x128x128_16x16_32x32_2x2_8x32x1_8x32x1_1x32x1x8_8_1x1_intrawave_v3,802.68,361.06,0.0
gfx942,304,48384,2048,5120,ck,0,0,1273.6358,a8w8_blockscale_1x128x128_256x128x128x128_16x16_32x32_2x2_8x32x1_8x32x1_1x32x1x8_8_1x1_intrawave_v3,796.68,358.34,0.0
gfx942,304,48512,2048,5120,ck,0,0,1319.8373,a8w8_blockscale_1x128x128_256x128x128x128_16x16_32x32_2x2_8x32x1_8x32x1_1x32x1x8_8_1x1_intrawave_v3,770.83,346.69,0.0
gfx942,304,48640,2048,5120,ck,0,0,1289.1144,a8w8_blockscale_1x128x128_256x128x128x128_16x16_32x32_2x2_8x32x1_8x32x1_1x32x1x8_8_1x1_intrawave_v3,791.28,355.87,0.0
gfx942,304,48768,2048,5120,ck,0,0,1288.4771,a8w8_blockscale_1x128x128_256x128x128x128_16x16_32x32_2x2_8x32x1_8x32x1_1x32x1x8_8_1x1_intrawave_v3,793.76,356.96,0.0
gfx942,304,48896,2048,5120,ck,0,0,1283.5766,a8w8_blockscale_1x128x128_256x128x128x128_16x16_32x32_2x2_8x32x1_8x32x1_1x32x1x8_8_1x1_intrawave_v3,798.88,359.24,0.0
gfx942,304,49024,2048,5120,ck,0,0,1269.36,a8w8_blockscale_1x128x128_256x128x128x128_16x16_32x32_2x2_8x32x1_8x32x1_1x32x1x8_8_1x1_intrawave_v3,809.94,364.19,0.0
gfx942,304,49152,2048,5120,ck,0,0,1271.5848,a8w8_blockscale_1x128x128_256x128x128x128_16x16_32x32_2x2_8x32x1_8x32x1_1x32x1x8_8_1x1_intrawave_v3,810.64,364.48,0.0
gfx942,304,49280,2048,5120,ck,0,0,1289.9515,a8w8_blockscale_1x128x128_256x128x128x128_16x16_32x32_2x2_8x32x1_8x32x1_1x32x1x8_8_1x1_intrawave_v3,801.17,360.21,0.0
gfx942,304,49408,2048,5120,ck,0,0,1326.2834,a8w8_blockscale_1x128x128_256x128x128x128_16x16_32x32_2x2_8x32x1_8x32x1_1x32x1x8_8_1x1_intrawave_v3,781.25,351.23,0.0
gfx942,304,49536,2048,5120,ck,0,0,1308.2241,a8w8_blockscale_1x128x128_256x128x128x128_16x16_32x32_2x2_8x32x1_8x32x1_1x32x1x8_8_1x1_intrawave_v3,794.09,356.98,0.0
gfx942,304,49664,2048,5120,ck,0,0,1308.8315,a8w8_blockscale_1x128x128_256x128x128x128_16x16_32x32_2x2_8x32x1_8x32x1_1x32x1x8_8_1x1_intrawave_v3,795.77,357.72,0.0
gfx942,304,49792,2048,5120,ck,0,0,1302.9076,a8w8_blockscale_1x128x128_256x128x128x128_16x16_32x32_2x2_8x32x1_8x32x1_1x32x1x8_8_1x1_intrawave_v3,801.45,360.25,0.0
gfx942,304,49920,2048,5120,ck,0,0,1340.7782,a8w8_blockscale_1x128x128_256x128x128x128_16x16_32x32_2x2_8x32x1_8x32x1_1x32x1x8_8_1x1_intrawave_v3,780.81,350.95,0.0
gfx942,304,50048,2048,5120,ck,0,0,1320.796,a8w8_blockscale_1x128x128_256x128x128x128_16x16_32x32_2x2_8x32x1_8x32x1_1x32x1x8_8_1x1_intrawave_v3,794.66,357.15,0.0
gfx942,304,50176,2048,5120,ck,0,0,1322.0626,a8w8_blockscale_1x128x128_256x128x128x128_16x16_32x32_2x2_8x32x1_8x32x1_1x32x1x8_8_1x1_intrawave_v3,795.93,357.7,0.0
gfx942,304,50304,2048,5120,ck,0,0,1352.0698,a8w8_blockscale_1x128x128_256x128x128x128_16x16_32x32_2x2_8x32x1_8x32x1_1x32x1x8_8_1x1_intrawave_v3,780.25,350.64,0.0
gfx942,304,50432,2048,5120,ck,0,0,1333.1715,a8w8_blockscale_1x128x128_256x128x128x128_16x16_32x32_2x2_8x32x1_8x32x1_1x32x1x8_8_1x1_intrawave_v3,793.32,356.49,0.0
gfx942,304,50560,2048,5120,ck,0,0,1326.6102,a8w8_blockscale_1x128x128_256x128x128x128_16x16_32x32_2x2_8x32x1_8x32x1_1x32x1x8_8_1x1_intrawave_v3,799.27,359.15,0.0
gfx942,304,50688,2048,5120,ck,0,0,1324.2027,a8w8_blockscale_1x128x128_256x128x128x128_16x16_32x32_2x2_8x32x1_8x32x1_1x32x1x8_8_1x1_intrawave_v3,802.75,360.69,0.0
gfx942,304,50816,2048,5120,ck,0,0,1334.4083,a8w8_blockscale_1x128x128_256x128x128x128_16x16_32x32_2x2_8x32x1_8x32x1_1x32x1x8_8_1x1_intrawave_v3,798.62,358.82,0.0
gfx942,304,50944,2048,5120,ck,0,0,1330.817,a8w8_blockscale_1x128x128_256x128x128x128_16x16_32x32_2x2_8x32x1_8x32x1_1x32x1x8_8_1x1_intrawave_v3,802.79,360.67,0.0
gfx942,304,51072,2048,5120,ck,0,0,1363.3455,a8w8_blockscale_1x128x128_256x128x128x128_16x16_32x32_2x2_8x32x1_8x32x1_1x32x1x8_8_1x1_intrawave_v3,785.61,352.93,0.0
gfx942,304,51200,2048,5120,ck,0,0,1371.5196,a8w8_blockscale_1x128x128_256x128x128x128_16x16_32x32_2x2_8x32x1_8x32x1_1x32x1x8_8_1x1_intrawave_v3,782.88,351.69,0.0
gfx942,304,51328,2048,5120,ck,0,0,1376.0076,a8w8_blockscale_1x128x128_256x128x128x128_16x16_32x32_2x2_8x32x1_8x32x1_1x32x1x8_8_1x1_intrawave_v3,782.28,351.4,0.0
gfx942,304,51456,2048,5120,ck,0,0,1352.9105,a8w8_blockscale_1x128x128_256x128x128x128_16x16_32x32_2x2_8x32x1_8x32x1_1x32x1x8_8_1x1_intrawave_v3,797.62,358.27,0.0
gfx942,304,51584,2048,5120,ck,0,0,1369.8556,a8w8_blockscale_1x128x128_256x128x128x128_16x16_32x32_2x2_8x32x1_8x32x1_1x32x1x8_8_1x1_intrawave_v3,789.71,354.7,0.0
gfx942,304,51712,2048,5120,ck,0,0,1366.0115,a8w8_blockscale_1x128x128_256x128x128x128_16x16_32x32_2x2_8x32x1_8x32x1_1x32x1x8_8_1x1_intrawave_v3,793.9,356.56,0.0
gfx942,304,51840,2048,5120,ck,0,0,1363.1785,a8w8_blockscale_1x128x128_256x128x128x128_16x16_32x32_2x2_8x32x1_8x32x1_1x32x1x8_8_1x1_intrawave_v3,797.52,358.17,0.0
gfx942,304,51968,2048,5120,ck,0,0,1394.1588,a8w8_blockscale_1x128x128_256x128x128x128_16x16_32x32_2x2_8x32x1_8x32x1_1x32x1x8_8_1x1_intrawave_v3,781.72,351.05,0.0
gfx942,304,52096,2048,5120,ck,0,0,1378.0923,a8w8_blockscale_1x128x128_256x128x128x128_16x16_32x32_2x2_8x32x1_8x32x1_1x32x1x8_8_1x1_intrawave_v3,792.79,356.0,0.0
gfx942,304,52224,2048,5120,ck,0,0,1387.0109,a8w8_blockscale_1x128x128_256x128x128x128_16x16_32x32_2x2_8x32x1_8x32x1_1x32x1x8_8_1x1_intrawave_v3,789.62,354.56,0.0
gfx942,304,52352,2048,5120,ck,0,0,1383.5546,a8w8_blockscale_1x128x128_256x128x128x128_16x16_32x32_2x2_8x32x1_8x32x1_1x32x1x8_8_1x1_intrawave_v3,793.54,356.3,0.0
gfx942,304,52480,2048,5120,ck,0,0,1384.638,a8w8_blockscale_1x128x128_256x128x128x128_16x16_32x32_2x2_8x32x1_8x32x1_1x32x1x8_8_1x1_intrawave_v3,794.85,356.87,0.0
gfx942,304,52608,2048,5120,ck,0,0,1394.3574,a8w8_blockscale_1x128x128_256x128x128x128_16x16_32x32_2x2_8x32x1_8x32x1_1x32x1x8_8_1x1_intrawave_v3,791.24,355.23,0.0
gfx942,304,52736,2048,5120,ck,0,0,1388.2425,a8w8_blockscale_1x128x128_256x128x128x128_16x16_32x32_2x2_8x32x1_8x32x1_1x32x1x8_8_1x1_intrawave_v3,796.66,357.65,0.0
gfx942,304,52864,2048,5120,ck,0,0,1402.0831,a8w8_blockscale_1x128x128_256x128x128x128_16x16_32x32_2x2_8x32x1_8x32x1_1x32x1x8_8_1x1_intrawave_v3,790.71,354.96,0.0
gfx942,304,52992,2048,5120,ck,0,0,1384.4118,a8w8_blockscale_1x128x128_256x128x128x128_16x16_32x32_2x2_8x32x1_8x32x1_1x32x1x8_8_1x1_intrawave_v3,802.74,360.34,0.0
gfx942,304,53120,2048,5120,ck,0,0,1412.1937,a8w8_blockscale_1x128x128_256x128x128x128_16x16_32x32_2x2_8x32x1_8x32x1_1x32x1x8_8_1x1_intrawave_v3,788.85,354.09,0.0
gfx942,304,53248,2048,5120,ck,0,0,1431.8739,a8w8_blockscale_1x128x128_256x128x128x128_16x16_32x32_2x2_8x32x1_8x32x1_1x32x1x8_8_1x1_intrawave_v3,779.88,350.04,0.0
gfx942,304,53376,2048,5120,ck,0,0,1416.474,a8w8_blockscale_1x128x128_256x128x128x128_16x16_32x32_2x2_8x32x1_8x32x1_1x32x1x8_8_1x1_intrawave_v3,790.26,354.68,0.0
gfx942,304,53504,2048,5120,ck,0,0,1434.3161,a8w8_blockscale_1x128x128_256x128x128x128_16x16_32x32_2x2_8x32x1_8x32x1_1x32x1x8_8_1x1_intrawave_v3,782.3,351.09,0.0
gfx942,304,53632,2048,5120,ck,0,0,1430.6391,a8w8_blockscale_1x128x128_256x128x128x128_16x16_32x32_2x2_8x32x1_8x32x1_1x32x1x8_8_1x1_intrawave_v3,786.18,352.82,0.0
gfx942,304,53760,2048,5120,ck,0,0,1426.2936,a8w8_blockscale_1x128x128_256x128x128x128_16x16_32x32_2x2_8x32x1_8x32x1_1x32x1x8_8_1x1_intrawave_v3,790.46,354.72,0.0
gfx942,304,53888,2048,5120,ck,0,0,1446.798,a8w8_blockscale_1x128x128_256x128x128x128_16x16_32x32_2x2_8x32x1_8x32x1_1x32x1x8_8_1x1_intrawave_v3,781.11,350.51,0.0
gfx942,304,54016,2048,5120,ck,0,0,1432.6806,a8w8_blockscale_1x128x128_256x128x128x128_16x16_32x32_2x2_8x32x1_8x32x1_1x32x1x8_8_1x1_intrawave_v3,790.68,354.79,0.0
gfx942,304,54144,2048,5120,ck,0,0,1429.5272,a8w8_blockscale_1x128x128_256x128x128x128_16x16_32x32_2x2_8x32x1_8x32x1_1x32x1x8_8_1x1_intrawave_v3,794.31,356.4,0.0
gfx942,304,54272,2048,5120,ck,0,0,1423.3412,a8w8_blockscale_1x128x128_256x128x128x128_16x16_32x32_2x2_8x32x1_8x32x1_1x32x1x8_8_1x1_intrawave_v3,799.64,358.77,0.0
gfx942,304,54400,2048,5120,ck,0,0,1451.7069,a8w8_blockscale_1x128x128_256x128x128x128_16x16_32x32_2x2_8x32x1_8x32x1_1x32x1x8_8_1x1_intrawave_v3,785.87,352.58,0.0
gfx942,304,54528,2048,5120,ck,0,0,1443.4929,a8w8_blockscale_1x128x128_256x128x128x128_16x16_32x32_2x2_8x32x1_8x32x1_1x32x1x8_8_1x1_intrawave_v3,792.2,355.4,0.0
gfx942,304,54656,2048,5120,ck,0,0,1453.9831,a8w8_blockscale_1x128x128_256x128x128x128_16x16_32x32_2x2_8x32x1_8x32x1_1x32x1x8_8_1x1_intrawave_v3,788.33,353.65,0.0
gfx942,304,54784,2048,5120,ck,0,0,1456.3056,a8w8_blockscale_1x128x128_256x128x128x128_16x16_32x32_2x2_8x32x1_8x32x1_1x32x1x8_8_1x1_intrawave_v3,788.92,353.89,0.0
gfx942,304,54912,2048,5120,ck,0,0,1451.2438,a8w8_blockscale_1x128x128_256x128x128x128_16x16_32x32_2x2_8x32x1_8x32x1_1x32x1x8_8_1x1_intrawave_v3,793.52,355.94,0.0
gfx942,304,55040,2048,5120,ck,0,0,1452.804,a8w8_blockscale_1x128x128_256x128x128x128_16x16_32x32_2x2_8x32x1_8x32x1_1x32x1x8_8_1x1_intrawave_v3,794.51,356.37,0.0
gfx942,304,55168,2048,5120,ck,0,0,1493.401,a8w8_blockscale_1x128x128_256x128x128x128_16x16_32x32_2x2_8x32x1_8x32x1_1x32x1x8_8_1x1_intrawave_v3,774.71,347.47,0.0
gfx942,304,55296,2048,5120,ck,0,0,1458.3787,a8w8_blockscale_1x128x128_256x128x128x128_16x16_32x32_2x2_8x32x1_8x32x1_1x32x1x8_8_1x1_intrawave_v3,795.16,356.62,0.0
gfx942,304,55424,2048,5120,ck,0,0,1462.2773,a8w8_blockscale_1x128x128_256x128x128x128_16x16_32x32_2x2_8x32x1_8x32x1_1x32x1x8_8_1x1_intrawave_v3,794.87,356.48,0.0
gfx942,304,55552,2048,5120,ck,0,0,1462.3441,a8w8_blockscale_1x128x128_256x128x128x128_16x16_32x32_2x2_8x32x1_8x32x1_1x32x1x8_8_1x1_intrawave_v3,796.67,357.27,0.0
gfx942,304,55680,2048,5120,ck,0,0,1487.7696,a8w8_blockscale_1x128x128_256x128x128x128_16x16_32x32_2x2_8x32x1_8x32x1_1x32x1x8_8_1x1_intrawave_v3,784.86,351.96,0.0
gfx942,304,55808,2048,5120,ck,0,0,1480.2749,a8w8_blockscale_1x128x128_256x128x128x128_16x16_32x32_2x2_8x32x1_8x32x1_1x32x1x8_8_1x1_intrawave_v3,790.65,354.54,0.0
gfx942,304,55936,2048,5120,ck,0,0,1459.6919,a8w8_blockscale_1x128x128_256x128x128x128_16x16_32x32_2x2_8x32x1_8x32x1_1x32x1x8_8_1x1_intrawave_v3,803.64,360.34,0.0
gfx942,304,56064,2048,5120,ck,0,0,1500.5425,a8w8_blockscale_1x128x128_256x128x128x128_16x16_32x32_2x2_8x32x1_8x32x1_1x32x1x8_8_1x1_intrawave_v3,783.55,351.32,0.0
gfx942,304,56192,2048,5120,ck,0,0,1488.6158,a8w8_blockscale_1x128x128_256x128x128x128_16x16_32x32_2x2_8x32x1_8x32x1_1x32x1x8_8_1x1_intrawave_v3,791.63,354.93,0.0
gfx942,304,56320,2048,5120,ck,0,0,1496.5734,a8w8_blockscale_1x128x128_256x128x128x128_16x16_32x32_2x2_8x32x1_8x32x1_1x32x1x8_8_1x1_intrawave_v3,789.21,353.83,0.0
gfx942,304,56448,2048,5120,ck,0,0,1493.9245,a8w8_blockscale_1x128x128_256x128x128x128_16x16_32x32_2x2_8x32x1_8x32x1_1x32x1x8_8_1x1_intrawave_v3,792.41,355.25,0.0
gfx942,304,56576,2048,5120,ck,0,0,1534.3217,a8w8_blockscale_1x128x128_256x128x128x128_16x16_32x32_2x2_8x32x1_8x32x1_1x32x1x8_8_1x1_intrawave_v3,773.3,346.66,0.0
gfx942,304,56704,2048,5120,ck,0,0,1504.4688,a8w8_blockscale_1x128x128_256x128x128x128_16x16_32x32_2x2_8x32x1_8x32x1_1x32x1x8_8_1x1_intrawave_v3,790.42,354.32,0.0
gfx942,304,56832,2048,5120,ck,0,0,1499.5692,a8w8_blockscale_1x128x128_256x128x128x128_16x16_32x32_2x2_8x32x1_8x32x1_1x32x1x8_8_1x1_intrawave_v3,794.8,356.27,0.0
gfx942,304,56960,2048,5120,ck,0,0,1542.3065,a8w8_blockscale_1x128x128_256x128x128x128_16x16_32x32_2x2_8x32x1_8x32x1_1x32x1x8_8_1x1_intrawave_v3,774.51,347.16,0.0
gfx942,304,57088,2048,5120,ck,0,0,1499.9869,a8w8_blockscale_1x128x128_256x128x128x128_16x16_32x32_2x2_8x32x1_8x32x1_1x32x1x8_8_1x1_intrawave_v3,798.16,357.74,0.0
gfx942,304,57216,2048,5120,ck,0,0,1505.2172,a8w8_blockscale_1x128x128_256x128x128x128_16x16_32x32_2x2_8x32x1_8x32x1_1x32x1x8_8_1x1_intrawave_v3,797.17,357.28,0.0
gfx942,304,57344,2048,5120,ck,0,0,1514.8421,a8w8_blockscale_1x128x128_256x128x128x128_16x16_32x32_2x2_8x32x1_8x32x1_1x32x1x8_8_1x1_intrawave_v3,793.87,355.79,0.0
gfx942,304,57472,2048,5120,ck,0,0,1516.6054,a8w8_blockscale_1x128x128_256x128x128x128_16x16_32x32_2x2_8x32x1_8x32x1_1x32x1x8_8_1x1_intrawave_v3,794.72,356.16,0.0
gfx942,304,57600,2048,5120,ck,0,0,1568.8495,a8w8_blockscale_1x128x128_256x128x128x128_16x16_32x32_2x2_8x32x1_8x32x1_1x32x1x8_8_1x1_intrawave_v3,769.97,345.05,0.0
gfx942,304,57728,2048,5120,ck,0,0,1550.3191,a8w8_blockscale_1x128x128_256x128x128x128_16x16_32x32_2x2_8x32x1_8x32x1_1x32x1x8_8_1x1_intrawave_v3,780.9,349.93,0.0
gfx942,304,57856,2048,5120,ck,0,0,1533.761,a8w8_blockscale_1x128x128_256x128x128x128_16x16_32x32_2x2_8x32x1_8x32x1_1x32x1x8_8_1x1_intrawave_v3,791.08,354.48,0.0
gfx942,304,57984,2048,5120,ck,0,0,1560.9395,a8w8_blockscale_1x128x128_256x128x128x128_16x16_32x32_2x2_8x32x1_8x32x1_1x32x1x8_8_1x1_intrawave_v3,779.03,349.06,0.0
gfx942,304,58112,2048,5120,ck,0,0,1557.2352,a8w8_blockscale_1x128x128_256x128x128x128_16x16_32x32_2x2_8x32x1_8x32x1_1x32x1x8_8_1x1_intrawave_v3,782.6,350.65,0.0
gfx942,304,58240,2048,5120,ck,0,0,1540.1869,a8w8_blockscale_1x128x128_256x128x128x128_16x16_32x32_2x2_8x32x1_8x32x1_1x32x1x8_8_1x1_intrawave_v3,793.01,355.3,0.0
gfx942,304,58368,2048,5120,ck,0,0,1555.4839,a8w8_blockscale_1x128x128_256x128x128x128_16x16_32x32_2x2_8x32x1_8x32x1_1x32x1x8_8_1x1_intrawave_v3,786.94,352.56,0.0
gfx942,304,58496,2048,5120,ck,0,0,1565.776,a8w8_blockscale_1x128x128_256x128x128x128_16x16_32x32_2x2_8x32x1_8x32x1_1x32x1x8_8_1x1_intrawave_v3,783.48,351.0,0.0
gfx942,304,58624,2048,5120,ck,0,0,1560.0861,a8w8_blockscale_1x128x128_256x128x128x128_16x16_32x32_2x2_8x32x1_8x32x1_1x32x1x8_8_1x1_intrawave_v3,788.06,353.03,0.0
gfx942,304,58752,2048,5120,ck,0,0,1573.6552,a8w8_blockscale_1x128x128_256x128x128x128_16x16_32x32_2x2_8x32x1_8x32x1_1x32x1x8_8_1x1_intrawave_v3,782.97,350.74,0.0
gfx942,304,58880,2048,5120,ck,0,0,1542.6454,a8w8_blockscale_1x128x128_256x128x128x128_16x16_32x32_2x2_8x32x1_8x32x1_1x32x1x8_8_1x1_intrawave_v3,800.45,358.56,0.0
gfx942,304,59008,2048,5120,ck,0,0,1579.4901,a8w8_blockscale_1x128x128_256x128x128x128_16x16_32x32_2x2_8x32x1_8x32x1_1x32x1x8_8_1x1_intrawave_v3,783.47,350.94,0.0
gfx942,304,59136,2048,5120,ck,0,0,1584.6058,a8w8_blockscale_1x128x128_256x128x128x128_16x16_32x32_2x2_8x32x1_8x32x1_1x32x1x8_8_1x1_intrawave_v3,782.64,350.55,0.0
gfx942,304,59264,2048,5120,ck,0,0,1570.3437,a8w8_blockscale_1x128x128_256x128x128x128_16x16_32x32_2x2_8x32x1_8x32x1_1x32x1x8_8_1x1_intrawave_v3,791.45,354.48,0.0
gfx942,304,59392,2048,5120,ck,0,0,1572.4945,a8w8_blockscale_1x128x128_256x128x128x128_16x16_32x32_2x2_8x32x1_8x32x1_1x32x1x8_8_1x1_intrawave_v3,792.08,354.75,0.0
gfx942,304,59520,2048,5120,ck,0,0,1618.6107,a8w8_blockscale_1x128x128_256x128x128x128_16x16_32x32_2x2_8x32x1_8x32x1_1x32x1x8_8_1x1_intrawave_v3,771.17,345.37,0.0
gfx942,304,59648,2048,5120,ck,0,0,1578.1233,a8w8_blockscale_1x128x128_256x128x128x128_16x16_32x32_2x2_8x32x1_8x32x1_1x32x1x8_8_1x1_intrawave_v3,792.66,354.98,0.0
gfx942,304,59776,2048,5120,ck,0,0,1623.2069,a8w8_blockscale_1x128x128_256x128x128x128_16x16_32x32_2x2_8x32x1_8x32x1_1x32x1x8_8_1x1_intrawave_v3,772.29,345.85,0.0
gfx942,304,59904,2048,5120,ck,0,0,1571.4854,a8w8_blockscale_1x128x128_256x128x128x128_16x16_32x32_2x2_8x32x1_8x32x1_1x32x1x8_8_1x1_intrawave_v3,799.42,357.98,0.0
gfx942,304,60032,2048,5120,ck,0,0,1606.4577,a8w8_blockscale_1x128x128_256x128x128x128_16x16_32x32_2x2_8x32x1_8x32x1_1x32x1x8_8_1x1_intrawave_v3,783.69,350.92,0.0
gfx942,304,60160,2048,5120,ck,0,0,1602.7544,a8w8_blockscale_1x128x128_256x128x128x128_16x16_32x32_2x2_8x32x1_8x32x1_1x32x1x8_8_1x1_intrawave_v3,787.17,352.47,0.0
gfx942,304,60288,2048,5120,ck,0,0,1601.7811,a8w8_blockscale_1x128x128_256x128x128x128_16x16_32x32_2x2_8x32x1_8x32x1_1x32x1x8_8_1x1_intrawave_v3,789.33,353.42,0.0
gfx942,304,60416,2048,5120,ck,0,0,1587.9108,a8w8_blockscale_1x128x128_256x128x128x128_16x16_32x32_2x2_8x32x1_8x32x1_1x32x1x8_8_1x1_intrawave_v3,797.91,357.25,0.0
gfx942,304,60544,2048,5120,ck,0,0,1630.5428,a8w8_blockscale_1x128x128_256x128x128x128_16x16_32x32_2x2_8x32x1_8x32x1_1x32x1x8_8_1x1_intrawave_v3,778.7,348.63,0.0
gfx942,304,60672,2048,5120,ck,0,0,1593.7622,a8w8_blockscale_1x128x128_256x128x128x128_16x16_32x32_2x2_8x32x1_8x32x1_1x32x1x8_8_1x1_intrawave_v3,798.35,357.42,0.0
gfx942,304,60800,2048,5120,ck,0,0,1612.0908,a8w8_blockscale_1x128x128_256x128x128x128_16x16_32x32_2x2_8x32x1_8x32x1_1x32x1x8_8_1x1_intrawave_v3,790.94,354.09,0.0
gfx942,304,60928,2048,5120,ck,0,0,1615.0139,a8w8_blockscale_1x128x128_256x128x128x128_16x16_32x32_2x2_8x32x1_8x32x1_1x32x1x8_8_1x1_intrawave_v3,791.17,354.18,0.0
gfx942,304,61056,2048,5120,ck,0,0,1603.3569,a8w8_blockscale_1x128x128_256x128x128x128_16x16_32x32_2x2_8x32x1_8x32x1_1x32x1x8_8_1x1_intrawave_v3,798.6,357.49,0.0
gfx942,304,61184,2048,5120,ck,0,0,1639.6679,a8w8_blockscale_1x128x128_256x128x128x128_16x16_32x32_2x2_8x32x1_8x32x1_1x32x1x8_8_1x1_intrawave_v3,782.55,350.29,0.0
gfx942,304,61312,2048,5120,ck,0,0,1639.5055,a8w8_blockscale_1x128x128_256x128x128x128_16x16_32x32_2x2_8x32x1_8x32x1_1x32x1x8_8_1x1_intrawave_v3,784.26,351.04,0.0
gfx942,304,61440,2048,5120,ck,0,0,1605.9992,a8w8_blockscale_1x128x128_256x128x128x128_16x16_32x32_2x2_8x32x1_8x32x1_1x32x1x8_8_1x1_intrawave_v3,802.3,359.1,0.0
gfx942,304,61568,2048,5120,ck,0,0,1661.3025,a8w8_blockscale_1x128x128_256x128x128x128_16x16_32x32_2x2_8x32x1_8x32x1_1x32x1x8_8_1x1_intrawave_v3,777.21,347.86,0.0
gfx942,304,61696,2048,5120,ck,0,0,1635.1827,a8w8_blockscale_1x128x128_256x128x128x128_16x16_32x32_2x2_8x32x1_8x32x1_1x32x1x8_8_1x1_intrawave_v3,791.26,354.14,0.0
gfx942,304,61824,2048,5120,ck,0,0,1642.9367,a8w8_blockscale_1x128x128_256x128x128x128_16x16_32x32_2x2_8x32x1_8x32x1_1x32x1x8_8_1x1_intrawave_v3,789.16,353.18,0.0
gfx942,304,61952,2048,5120,ck,0,0,1655.7603,a8w8_blockscale_1x128x128_256x128x128x128_16x16_32x32_2x2_8x32x1_8x32x1_1x32x1x8_8_1x1_intrawave_v3,784.67,351.16,0.0
gfx942,304,62080,2048,5120,ck,0,0,1640.7009,a8w8_blockscale_1x128x128_256x128x128x128_16x16_32x32_2x2_8x32x1_8x32x1_1x32x1x8_8_1x1_intrawave_v3,793.51,355.1,0.0
gfx942,304,62208,2048,5120,ck,0,0,1653.772,a8w8_blockscale_1x128x128_256x128x128x128_16x16_32x32_2x2_8x32x1_8x32x1_1x32x1x8_8_1x1_intrawave_v3,788.86,353.01,0.0
gfx942,304,62336,2048,5120,ck,0,0,1656.7795,a8w8_blockscale_1x128x128_256x128x128x128_16x16_32x32_2x2_8x32x1_8x32x1_1x32x1x8_8_1x1_intrawave_v3,789.05,353.08,0.0
gfx942,304,62464,2048,5120,ck,0,0,1652.0423,a8w8_blockscale_1x128x128_256x128x128x128_16x16_32x32_2x2_8x32x1_8x32x1_1x32x1x8_8_1x1_intrawave_v3,792.94,354.81,0.0
gfx942,304,62592,2048,5120,ck,0,0,1639.6943,a8w8_blockscale_1x128x128_256x128x128x128_16x16_32x32_2x2_8x32x1_8x32x1_1x32x1x8_8_1x1_intrawave_v3,800.55,358.2,0.0
gfx942,304,62720,2048,5120,ck,0,0,1662.8799,a8w8_blockscale_1x128x128_256x128x128x128_16x16_32x32_2x2_8x32x1_8x32x1_1x32x1x8_8_1x1_intrawave_v3,791.0,353.91,0.0
gfx942,304,62848,2048,5120,ck,0,0,1657.9873,a8w8_blockscale_1x128x128_256x128x128x128_16x16_32x32_2x2_8x32x1_8x32x1_1x32x1x8_8_1x1_intrawave_v3,794.95,355.67,0.0
gfx942,304,62976,2048,5120,ck,0,0,1655.8658,a8w8_blockscale_1x128x128_256x128x128x128_16x16_32x32_2x2_8x32x1_8x32x1_1x32x1x8_8_1x1_intrawave_v3,797.59,356.84,0.0
gfx942,304,63104,2048,5120,ck,0,0,1661.7314,a8w8_blockscale_1x128x128_256x128x128x128_16x16_32x32_2x2_8x32x1_8x32x1_1x32x1x8_8_1x1_intrawave_v3,796.39,356.29,0.0
gfx942,304,63232,2048,5120,ck,0,0,1668.541,a8w8_blockscale_1x128x128_256x128x128x128_16x16_32x32_2x2_8x32x1_8x32x1_1x32x1x8_8_1x1_intrawave_v3,794.75,355.54,0.0
gfx942,304,63360,2048,5120,ck,0,0,1678.5496,a8w8_blockscale_1x128x128_256x128x128x128_16x16_32x32_2x2_8x32x1_8x32x1_1x32x1x8_8_1x1_intrawave_v3,791.61,354.12,0.0
gfx942,304,63488,2048,5120,ck,0,0,1684.33,a8w8_blockscale_1x128x128_256x128x128x128_16x16_32x32_2x2_8x32x1_8x32x1_1x32x1x8_8_1x1_intrawave_v3,790.49,353.61,0.0
gfx942,304,63616,2048,5120,ck,0,0,1676.2906,a8w8_blockscale_1x128x128_256x128x128x128_16x16_32x32_2x2_8x32x1_8x32x1_1x32x1x8_8_1x1_intrawave_v3,795.88,356.01,0.0
gfx942,304,63744,2048,5120,ck,0,0,1699.815,a8w8_blockscale_1x128x128_256x128x128x128_16x16_32x32_2x2_8x32x1_8x32x1_1x32x1x8_8_1x1_intrawave_v3,786.44,351.77,0.0
gfx942,304,63872,2048,5120,ck,0,0,1696.8104,a8w8_blockscale_1x128x128_256x128x128x128_16x16_32x32_2x2_8x32x1_8x32x1_1x32x1x8_8_1x1_intrawave_v3,789.42,353.09,0.0
gfx942,304,64000,2048,5120,ck,0,0,1722.6376,a8w8_blockscale_1x128x128_256x128x128x128_16x16_32x32_2x2_8x32x1_8x32x1_1x32x1x8_8_1x1_intrawave_v3,779.14,348.48,0.0
gfx942,304,64128,2048,5120,ck,0,0,1700.332,a8w8_blockscale_1x128x128_256x128x128x128_16x16_32x32_2x2_8x32x1_8x32x1_1x32x1x8_8_1x1_intrawave_v3,790.94,353.75,0.0
gfx942,304,64256,2048,5120,ck,0,0,1675.7637,a8w8_blockscale_1x128x128_256x128x128x128_16x16_32x32_2x2_8x32x1_8x32x1_1x32x1x8_8_1x1_intrawave_v3,804.14,359.64,0.0
gfx942,304,64384,2048,5120,ck,0,0,1740.9513,a8w8_blockscale_1x128x128_256x128x128x128_16x16_32x32_2x2_8x32x1_8x32x1_1x32x1x8_8_1x1_intrawave_v3,775.57,346.85,0.0
gfx942,304,64512,2048,5120,ck,0,0,1718.2804,a8w8_blockscale_1x128x128_256x128x128x128_16x16_32x32_2x2_8x32x1_8x32x1_1x32x1x8_8_1x1_intrawave_v3,787.37,352.11,0.0
gfx942,304,64640,2048,5120,ck,0,0,1726.7472,a8w8_blockscale_1x128x128_256x128x128x128_16x16_32x32_2x2_8x32x1_8x32x1_1x32x1x8_8_1x1_intrawave_v3,785.06,351.07,0.0
gfx942,304,64768,2048,5120,ck,0,0,1733.9753,a8w8_blockscale_1x128x128_256x128x128x128_16x16_32x32_2x2_8x32x1_8x32x1_1x32x1x8_8_1x1_intrawave_v3,783.33,350.29,0.0
gfx942,304,64896,2048,5120,ck,0,0,1726.1499,a8w8_blockscale_1x128x128_256x128x128x128_16x16_32x32_2x2_8x32x1_8x32x1_1x32x1x8_8_1x1_intrawave_v3,788.44,352.56,0.0
gfx942,304,65024,2048,5120,ck,0,0,1729.1089,a8w8_blockscale_1x128x128_256x128x128x128_16x16_32x32_2x2_8x32x1_8x32x1_1x32x1x8_8_1x1_intrawave_v3,788.64,352.64,0.0
gfx942,304,65152,2048,5120,ck,0,0,1708.4759,a8w8_blockscale_1x128x128_256x128x128x128_16x16_32x32_2x2_8x32x1_8x32x1_1x32x1x8_8_1x1_intrawave_v3,799.74,357.59,0.0
gfx942,304,65280,2048,5120,ck,0,0,1734.2062,a8w8_blockscale_1x128x128_256x128x128x128_16x16_32x32_2x2_8x32x1_8x32x1_1x32x1x8_8_1x1_intrawave_v3,789.42,352.96,0.0
gfx942,304,65408,2048,5120,ck,0,0,1743.1611,a8w8_blockscale_1x128x128_256x128x128x128_16x16_32x32_2x2_8x32x1_8x32x1_1x32x1x8_8_1x1_intrawave_v3,786.91,351.82,0.0
gfx942,304,65536,2048,5120,ck,0,0,1722.8672,a8w8_blockscale_1x128x128_256x128x128x128_16x16_32x32_2x2_8x32x1_8x32x1_1x32x1x8_8_1x1_intrawave_v3,797.73,356.65,0.0
gfx942,304,65664,2048,5120,ck,0,0,1747.9728,a8w8_blockscale_1x128x128_256x128x128x128_16x16_32x32_2x2_8x32x1_8x32x1_1x32x1x8_8_1x1_intrawave_v3,787.81,352.21,0.0
gfx942,304,65792,2048,5120,ck,0,0,1742.8953,a8w8_blockscale_1x128x128_256x128x128x128_16x16_32x32_2x2_8x32x1_8x32x1_1x32x1x8_8_1x1_intrawave_v3,791.65,353.91,0.0
gfx942,304,65920,2048,5120,ck,0,0,1725.2913,a8w8_blockscale_1x128x128_256x128x128x128_16x16_32x32_2x2_8x32x1_8x32x1_1x32x1x8_8_1x1_intrawave_v3,801.28,358.2,0.0
gfx942,304,66048,2048,5120,ck,0,0,1743.6362,a8w8_blockscale_1x128x128_256x128x128x128_16x16_32x32_2x2_8x32x1_8x32x1_1x32x1x8_8_1x1_intrawave_v3,794.39,355.11,0.0
gfx942,304,66176,2048,5120,ck,0,0,1767.2451,a8w8_blockscale_1x128x128_256x128x128x128_16x16_32x32_2x2_8x32x1_8x32x1_1x32x1x8_8_1x1_intrawave_v3,785.3,351.03,0.0
gfx942,304,66304,2048,5120,ck,0,0,1782.1335,a8w8_blockscale_1x128x128_256x128x128x128_16x16_32x32_2x2_8x32x1_8x32x1_1x32x1x8_8_1x1_intrawave_v3,780.24,348.76,0.0
gfx942,304,66432,2048,5120,ck,0,0,1738.7005,a8w8_blockscale_1x128x128_256x128x128x128_16x16_32x32_2x2_8x32x1_8x32x1_1x32x1x8_8_1x1_intrawave_v3,801.28,358.15,0.0
gfx942,304,66560,2048,5120,ck,0,0,1757.8893,a8w8_blockscale_1x128x128_256x128x128x128_16x16_32x32_2x2_8x32x1_8x32x1_1x32x1x8_8_1x1_intrawave_v3,794.06,354.92,0.0
gfx942,304,66688,2048,5120,ck,0,0,1789.3566,a8w8_blockscale_1x128x128_256x128x128x128_16x16_32x32_2x2_8x32x1_8x32x1_1x32x1x8_8_1x1_intrawave_v3,781.59,349.33,0.0
gfx942,304,66816,2048,5120,ck,0,0,1789.5677,a8w8_blockscale_1x128x128_256x128x128x128_16x16_32x32_2x2_8x32x1_8x32x1_1x32x1x8_8_1x1_intrawave_v3,783.0,349.95,0.0
gfx942,304,66944,2048,5120,ck,0,0,1771.7364,a8w8_blockscale_1x128x128_256x128x128x128_16x16_32x32_2x2_8x32x1_8x32x1_1x32x1x8_8_1x1_intrawave_v3,792.4,354.14,0.0
gfx942,304,67072,2048,5120,ck,0,0,1787.9877,a8w8_blockscale_1x128x128_256x128x128x128_16x16_32x32_2x2_8x32x1_8x32x1_1x32x1x8_8_1x1_intrawave_v3,786.7,351.58,0.0
gfx942,304,67200,2048,5120,ck,0,0,1781.4039,a8w8_blockscale_1x128x128_256x128x128x128_16x16_32x32_2x2_8x32x1_8x32x1_1x32x1x8_8_1x1_intrawave_v3,791.11,353.54,0.0
gfx942,304,67328,2048,5120,ck,0,0,1820.203,a8w8_blockscale_1x128x128_256x128x128x128_16x16_32x32_2x2_8x32x1_8x32x1_1x32x1x8_8_1x1_intrawave_v3,775.72,346.65,0.0
gfx942,304,67456,2048,5120,ck,0,0,1821.4523,a8w8_blockscale_1x128x128_256x128x128x128_16x16_32x32_2x2_8x32x1_8x32x1_1x32x1x8_8_1x1_intrawave_v3,776.66,347.06,0.0
gfx942,304,67584,2048,5120,ck,0,0,1800.2,a8w8_blockscale_1x128x128_256x128x128x128_16x16_32x32_2x2_8x32x1_8x32x1_1x32x1x8_8_1x1_intrawave_v3,787.32,351.82,0.0
gfx942,304,67712,2048,5120,ck,0,0,1798.1785,a8w8_blockscale_1x128x128_256x128x128x128_16x16_32x32_2x2_8x32x1_8x32x1_1x32x1x8_8_1x1_intrawave_v3,789.7,352.87,0.0
gfx942,304,67840,2048,5120,ck,0,0,1779.1703,a8w8_blockscale_1x128x128_256x128x128x128_16x16_32x32_2x2_8x32x1_8x32x1_1x32x1x8_8_1x1_intrawave_v3,799.65,357.3,0.0
gfx942,304,67968,2048,5120,ck,0,0,1813.0102,a8w8_blockscale_1x128x128_256x128x128x128_16x16_32x32_2x2_8x32x1_8x32x1_1x32x1x8_8_1x1_intrawave_v3,786.2,351.28,0.0
gfx942,304,68096,2048,5120,ck,0,0,1823.6525,a8w8_blockscale_1x128x128_256x128x128x128_16x16_32x32_2x2_8x32x1_8x32x1_1x32x1x8_8_1x1_intrawave_v3,783.09,349.88,0.0
gfx942,304,68224,2048,5120,ck,0,0,1822.1899,a8w8_blockscale_1x128x128_256x128x128x128_16x16_32x32_2x2_8x32x1_8x32x1_1x32x1x8_8_1x1_intrawave_v3,785.19,350.81,0.0
gfx942,304,68352,2048,5120,ck,0,0,1827.5898,a8w8_blockscale_1x128x128_256x128x128x128_16x16_32x32_2x2_8x32x1_8x32x1_1x32x1x8_8_1x1_intrawave_v3,784.34,350.42,0.0
gfx942,304,68480,2048,5120,ck,0,0,1830.1576,a8w8_blockscale_1x128x128_256x128x128x128_16x16_32x32_2x2_8x32x1_8x32x1_1x32x1x8_8_1x1_intrawave_v3,784.7,350.57,0.0
gfx942,304,68608,2048,5120,ck,0,0,1833.2166,a8w8_blockscale_1x128x128_256x128x128x128_16x16_32x32_2x2_8x32x1_8x32x1_1x32x1x8_8_1x1_intrawave_v3,784.86,350.63,0.0
gfx942,304,68736,2048,5120,ck,0,0,1801.4777,a8w8_blockscale_1x128x128_256x128x128x128_16x16_32x32_2x2_8x32x1_8x32x1_1x32x1x8_8_1x1_intrawave_v3,800.18,357.46,0.0
gfx942,304,68864,2048,5120,ck,0,0,1828.2867,a8w8_blockscale_1x128x128_256x128x128x128_16x16_32x32_2x2_8x32x1_8x32x1_1x32x1x8_8_1x1_intrawave_v3,789.91,352.86,0.0
gfx942,304,68992,2048,5120,ck,0,0,1812.7958,a8w8_blockscale_1x128x128_256x128x128x128_16x16_32x32_2x2_8x32x1_8x32x1_1x32x1x8_8_1x1_intrawave_v3,798.14,356.53,0.0
gfx942,304,69120,2048,5120,ck,0,0,1834.8719,a8w8_blockscale_1x128x128_256x128x128x128_16x16_32x32_2x2_8x32x1_8x32x1_1x32x1x8_8_1x1_intrawave_v3,790.0,352.88,0.0
gfx942,304,69248,2048,5120,ck,0,0,1876.7068,a8w8_blockscale_1x128x128_256x128x128x128_16x16_32x32_2x2_8x32x1_8x32x1_1x32x1x8_8_1x1_intrawave_v3,773.82,345.65,0.0
gfx942,304,69376,2048,5120,ck,0,0,1859.2925,a8w8_blockscale_1x128x128_256x128x128x128_16x16_32x32_2x2_8x32x1_8x32x1_1x32x1x8_8_1x1_intrawave_v3,782.51,349.52,0.0
gfx942,304,69504,2048,5120,ck,0,0,1843.9227,a8w8_blockscale_1x128x128_256x128x128x128_16x16_32x32_2x2_8x32x1_8x32x1_1x32x1x8_8_1x1_intrawave_v3,790.49,353.07,0.0
gfx942,304,69632,2048,5120,ck,0,0,1841.7145,a8w8_blockscale_1x128x128_256x128x128x128_16x16_32x32_2x2_8x32x1_8x32x1_1x32x1x8_8_1x1_intrawave_v3,792.9,354.13,0.0
gfx942,304,69760,2048,5120,ck,0,0,1833.9615,a8w8_blockscale_1x128x128_256x128x128x128_16x16_32x32_2x2_8x32x1_8x32x1_1x32x1x8_8_1x1_intrawave_v3,797.71,356.27,0.0
gfx942,304,69888,2048,5120,ck,0,0,1866.9329,a8w8_blockscale_1x128x128_256x128x128x128_16x16_32x32_2x2_8x32x1_8x32x1_1x32x1x8_8_1x1_intrawave_v3,785.06,350.61,0.0
gfx942,304,70016,2048,5120,ck,0,0,1877.5448,a8w8_blockscale_1x128x128_256x128x128x128_16x16_32x32_2x2_8x32x1_8x32x1_1x32x1x8_8_1x1_intrawave_v3,782.05,349.26,0.0
gfx942,304,70144,2048,5120,ck,0,0,1861.0764,a8w8_blockscale_1x128x128_256x128x128x128_16x16_32x32_2x2_8x32x1_8x32x1_1x32x1x8_8_1x1_intrawave_v3,790.42,352.99,0.0
gfx942,304,70272,2048,5120,ck,0,0,1864.544,a8w8_blockscale_1x128x128_256x128x128x128_16x16_32x32_2x2_8x32x1_8x32x1_1x32x1x8_8_1x1_intrawave_v3,790.39,352.96,0.0
gfx942,304,70400,2048,5120,ck,0,0,1900.9303,a8w8_blockscale_1x128x128_256x128x128x128_16x16_32x32_2x2_8x32x1_8x32x1_1x32x1x8_8_1x1_intrawave_v3,776.67,346.83,0.0
gfx942,304,70528,2048,5120,ck,0,0,1901.1962,a8w8_blockscale_1x128x128_256x128x128x128_16x16_32x32_2x2_8x32x1_8x32x1_1x32x1x8_8_1x1_intrawave_v3,777.97,347.4,0.0
gfx942,304,70656,2048,5120,ck,0,0,1870.6421,a8w8_blockscale_1x128x128_256x128x128x128_16x16_32x32_2x2_8x32x1_8x32x1_1x32x1x8_8_1x1_intrawave_v3,792.12,353.7,0.0
gfx942,304,70784,2048,5120,ck,0,0,1862.7493,a8w8_blockscale_1x128x128_256x128x128x128_16x16_32x32_2x2_8x32x1_8x32x1_1x32x1x8_8_1x1_intrawave_v3,796.91,355.83,0.0
gfx942,304,70912,2048,5120,ck,0,0,1891.9578,a8w8_blockscale_1x128x128_256x128x128x128_16x16_32x32_2x2_8x32x1_8x32x1_1x32x1x8_8_1x1_intrawave_v3,786.03,350.96,0.0
gfx942,304,71040,2048,5120,ck,0,0,1887.7483,a8w8_blockscale_1x128x128_256x128x128x128_16x16_32x32_2x2_8x32x1_8x32x1_1x32x1x8_8_1x1_intrawave_v3,789.2,352.37,0.0
gfx942,304,71168,2048,5120,ck,0,0,1887.5142,a8w8_blockscale_1x128x128_256x128x128x128_16x16_32x32_2x2_8x32x1_8x32x1_1x32x1x8_8_1x1_intrawave_v3,790.72,353.04,0.0
gfx942,304,71296,2048,5120,ck,0,0,1897.6846,a8w8_blockscale_1x128x128_256x128x128x128_16x16_32x32_2x2_8x32x1_8x32x1_1x32x1x8_8_1x1_intrawave_v3,787.9,351.77,0.0
gfx942,304,71424,2048,5120,ck,0,0,1917.0028,a8w8_blockscale_1x128x128_256x128x128x128_16x16_32x32_2x2_8x32x1_8x32x1_1x32x1x8_8_1x1_intrawave_v3,781.36,348.84,0.0
gfx942,304,71552,2048,5120,ck,0,0,1915.2294,a8w8_blockscale_1x128x128_256x128x128x128_16x16_32x32_2x2_8x32x1_8x32x1_1x32x1x8_8_1x1_intrawave_v3,783.49,349.78,0.0
gfx942,304,71680,2048,5120,ck,0,0,1932.5099,a8w8_blockscale_1x128x128_256x128x128x128_16x16_32x32_2x2_8x32x1_8x32x1_1x32x1x8_8_1x1_intrawave_v3,777.87,347.26,0.0
gfx942,304,71808,2048,5120,ck,0,0,1908.6457,a8w8_blockscale_1x128x128_256x128x128x128_16x16_32x32_2x2_8x32x1_8x32x1_1x32x1x8_8_1x1_intrawave_v3,789.0,352.22,0.0
gfx942,304,71936,2048,5120,ck,0,0,1891.4903,a8w8_blockscale_1x128x128_256x128x128x128_16x16_32x32_2x2_8x32x1_8x32x1_1x32x1x8_8_1x1_intrawave_v3,797.58,356.04,0.0
gfx942,304,72064,2048,5120,ck,0,0,1911.3762,a8w8_blockscale_1x128x128_256x128x128x128_16x16_32x32_2x2_8x32x1_8x32x1_1x32x1x8_8_1x1_intrawave_v3,790.68,352.95,0.0
gfx942,304,72192,2048,5120,ck,0,0,1958.7203,a8w8_blockscale_1x128x128_256x128x128x128_16x16_32x32_2x2_8x32x1_8x32x1_1x32x1x8_8_1x1_intrawave_v3,772.94,345.02,0.0
gfx942,304,72320,2048,5120,ck,0,0,1959.8863,a8w8_blockscale_1x128x128_256x128x128x128_16x16_32x32_2x2_8x32x1_8x32x1_1x32x1x8_8_1x1_intrawave_v3,773.85,345.42,0.0
gfx942,304,72448,2048,5120,ck,0,0,1939.7882,a8w8_blockscale_1x128x128_256x128x128x128_16x16_32x32_2x2_8x32x1_8x32x1_1x32x1x8_8_1x1_intrawave_v3,783.25,349.61,0.0
gfx942,304,72576,2048,5120,ck,0,0,1940.1833,a8w8_blockscale_1x128x128_256x128x128x128_16x16_32x32_2x2_8x32x1_8x32x1_1x32x1x8_8_1x1_intrawave_v3,784.48,350.15,0.0
gfx942,304,72704,2048,5120,ck,0,0,1926.456,a8w8_blockscale_1x128x128_256x128x128x128_16x16_32x32_2x2_8x32x1_8x32x1_1x32x1x8_8_1x1_intrawave_v3,791.46,353.25,0.0
gfx942,304,72832,2048,5120,ck,0,0,1926.9849,a8w8_blockscale_1x128x128_256x128x128x128_16x16_32x32_2x2_8x32x1_8x32x1_1x32x1x8_8_1x1_intrawave_v3,792.64,353.77,0.0
gfx942,304,72960,2048,5120,ck,0,0,1949.419,a8w8_blockscale_1x128x128_256x128x128x128_16x16_32x32_2x2_8x32x1_8x32x1_1x32x1x8_8_1x1_intrawave_v3,784.89,350.3,0.0
gfx942,304,73088,2048,5120,ck,0,0,1939.6627,a8w8_blockscale_1x128x128_256x128x128x128_16x16_32x32_2x2_8x32x1_8x32x1_1x32x1x8_8_1x1_intrawave_v3,790.22,352.67,0.0
gfx942,304,73216,2048,5120,ck,0,0,1916.7374,a8w8_blockscale_1x128x128_256x128x128x128_16x16_32x32_2x2_8x32x1_8x32x1_1x32x1x8_8_1x1_intrawave_v3,801.08,357.51,0.0
gfx942,304,73344,2048,5120,ck,0,0,1945.398,a8w8_blockscale_1x128x128_256x128x128x128_16x16_32x32_2x2_8x32x1_8x32x1_1x32x1x8_8_1x1_intrawave_v3,790.65,352.85,0.0
gfx942,304,73472,2048,5120,ck,0,0,1950.0173,a8w8_blockscale_1x128x128_256x128x128x128_16x16_32x32_2x2_8x32x1_8x32x1_1x32x1x8_8_1x1_intrawave_v3,790.16,352.61,0.0
gfx942,304,73600,2048,5120,ck,0,0,1962.2329,a8w8_blockscale_1x128x128_256x128x128x128_16x16_32x32_2x2_8x32x1_8x32x1_1x32x1x8_8_1x1_intrawave_v3,786.61,351.02,0.0
gfx942,304,73728,2048,5120,ck,0,0,1982.98,a8w8_blockscale_1x128x128_256x128x128x128_16x16_32x32_2x2_8x32x1_8x32x1_1x32x1x8_8_1x1_intrawave_v3,779.73,347.94,0.0
gfx942,304,73856,2048,5120,ck,0,0,1975.1116,a8w8_blockscale_1x128x128_256x128x128x128_16x16_32x32_2x2_8x32x1_8x32x1_1x32x1x8_8_1x1_intrawave_v3,784.19,349.93,0.0
gfx942,304,73984,2048,5120,ck,0,0,1963.9636,a8w8_blockscale_1x128x128_256x128x128x128_16x16_32x32_2x2_8x32x1_8x32x1_1x32x1x8_8_1x1_intrawave_v3,790.01,352.51,0.0
gfx942,304,74112,2048,5120,ck,0,0,1998.164,a8w8_blockscale_1x128x128_256x128x128x128_16x16_32x32_2x2_8x32x1_8x32x1_1x32x1x8_8_1x1_intrawave_v3,777.83,347.07,0.0
gfx942,304,74240,2048,5120,ck,0,0,1968.0853,a8w8_blockscale_1x128x128_256x128x128x128_16x16_32x32_2x2_8x32x1_8x32x1_1x32x1x8_8_1x1_intrawave_v3,791.09,352.97,0.0
gfx942,304,74368,2048,5120,ck,0,0,2003.6154,a8w8_blockscale_1x128x128_256x128x128x128_16x16_32x32_2x2_8x32x1_8x32x1_1x32x1x8_8_1x1_intrawave_v3,778.4,347.3,0.0
gfx942,304,74496,2048,5120,ck,0,0,2001.8095,a8w8_blockscale_1x128x128_256x128x128x128_16x16_32x32_2x2_8x32x1_8x32x1_1x32x1x8_8_1x1_intrawave_v3,780.44,348.21,0.0
gfx942,304,74624,2048,5120,ck,0,0,1979.2635,a8w8_blockscale_1x128x128_256x128x128x128_16x16_32x32_2x2_8x32x1_8x32x1_1x32x1x8_8_1x1_intrawave_v3,790.69,352.77,0.0
gfx942,304,74752,2048,5120,ck,0,0,1975.5602,a8w8_blockscale_1x128x128_256x128x128x128_16x16_32x32_2x2_8x32x1_8x32x1_1x32x1x8_8_1x1_intrawave_v3,793.53,354.03,0.0
gfx942,304,74880,2048,5120,ck,0,0,1998.5339,a8w8_blockscale_1x128x128_256x128x128x128_16x16_32x32_2x2_8x32x1_8x32x1_1x32x1x8_8_1x1_intrawave_v3,785.75,350.55,0.0
gfx942,304,75008,2048,5120,ck,0,0,1979.0956,a8w8_blockscale_1x128x128_256x128x128x128_16x16_32x32_2x2_8x32x1_8x32x1_1x32x1x8_8_1x1_intrawave_v3,794.82,354.59,0.0
gfx942,304,75136,2048,5120,ck,0,0,2016.3134,a8w8_blockscale_1x128x128_256x128x128x128_16x16_32x32_2x2_8x32x1_8x32x1_1x32x1x8_8_1x1_intrawave_v3,781.48,348.63,0.0
gfx942,304,75264,2048,5120,ck,0,0,2000.3299,a8w8_blockscale_1x128x128_256x128x128x128_16x16_32x32_2x2_8x32x1_8x32x1_1x32x1x8_8_1x1_intrawave_v3,789.07,352.0,0.0
gfx942,304,75392,2048,5120,ck,0,0,2007.5702,a8w8_blockscale_1x128x128_256x128x128x128_16x16_32x32_2x2_8x32x1_8x32x1_1x32x1x8_8_1x1_intrawave_v3,787.56,351.32,0.0
gfx942,304,75520,2048,5120,ck,0,0,2034.8157,a8w8_blockscale_1x128x128_256x128x128x128_16x16_32x32_2x2_8x32x1_8x32x1_1x32x1x8_8_1x1_intrawave_v3,778.34,347.2,0.0
gfx942,304,75648,2048,5120,ck,0,0,1996.1094,a8w8_blockscale_1x128x128_256x128x128x128_16x16_32x32_2x2_8x32x1_8x32x1_1x32x1x8_8_1x1_intrawave_v3,794.77,354.52,0.0
gfx942,304,75776,2048,5120,ck,0,0,1995.0131,a8w8_blockscale_1x128x128_256x128x128x128_16x16_32x32_2x2_8x32x1_8x32x1_1x32x1x8_8_1x1_intrawave_v3,796.56,355.3,0.0
gfx942,304,75904,2048,5120,ck,0,0,2064.6736,a8w8_blockscale_1x128x128_256x128x128x128_16x16_32x32_2x2_8x32x1_8x32x1_1x32x1x8_8_1x1_intrawave_v3,770.98,343.89,0.0
gfx942,304,76032,2048,5120,ck,0,0,1992.1877,a8w8_blockscale_1x128x128_256x128x128x128_16x16_32x32_2x2_8x32x1_8x32x1_1x32x1x8_8_1x1_intrawave_v3,800.38,356.99,0.0
gfx942,304,76160,2048,5120,ck,0,0,2056.4328,a8w8_blockscale_1x128x128_256x128x128x128_16x16_32x32_2x2_8x32x1_8x32x1_1x32x1x8_8_1x1_intrawave_v3,776.68,346.41,0.0
gfx942,304,76288,2048,5120,ck,0,0,2012.6141,a8w8_blockscale_1x128x128_256x128x128x128_16x16_32x32_2x2_8x32x1_8x32x1_1x32x1x8_8_1x1_intrawave_v3,794.92,354.54,0.0
gfx942,304,76416,2048,5120,ck,0,0,2028.8915,a8w8_blockscale_1x128x128_256x128x128x128_16x16_32x32_2x2_8x32x1_8x32x1_1x32x1x8_8_1x1_intrawave_v3,789.87,352.28,0.0
gfx942,304,76544,2048,5120,ck,0,0,2039.7259,a8w8_blockscale_1x128x128_256x128x128x128_16x16_32x32_2x2_8x32x1_8x32x1_1x32x1x8_8_1x1_intrawave_v3,786.99,350.99,0.0
gfx942,304,76672,2048,5120,ck,0,0,2068.7902,a8w8_blockscale_1x128x128_256x128x128x128_16x16_32x32_2x2_8x32x1_8x32x1_1x32x1x8_8_1x1_intrawave_v3,777.23,346.63,0.0
gfx942,304,76800,2048,5120,ck,0,0,2034.3857,a8w8_blockscale_1x128x128_256x128x128x128_16x16_32x32_2x2_8x32x1_8x32x1_1x32x1x8_8_1x1_intrawave_v3,791.69,353.07,0.0
gfx942,304,76928,2048,5120,ck,0,0,2105.4109,a8w8_blockscale_1x128x128_256x128x128x128_16x16_32x32_2x2_8x32x1_8x32x1_1x32x1x8_8_1x1_intrawave_v3,766.26,341.72,0.0
gfx942,304,77056,2048,5120,ck,0,0,2036.902,a8w8_blockscale_1x128x128_256x128x128x128_16x16_32x32_2x2_8x32x1_8x32x1_1x32x1x8_8_1x1_intrawave_v3,793.35,353.79,0.0
gfx942,304,77184,2048,5120,ck,0,0,2087.7287,a8w8_blockscale_1x128x128_256x128x128x128_16x16_32x32_2x2_8x32x1_8x32x1_1x32x1x8_8_1x1_intrawave_v3,775.32,345.74,0.0
gfx942,304,77312,2048,5120,ck,0,0,2061.8929,a8w8_blockscale_1x128x128_256x128x128x128_16x16_32x32_2x2_8x32x1_8x32x1_1x32x1x8_8_1x1_intrawave_v3,786.34,350.65,0.0
gfx942,304,77440,2048,5120,ck,0,0,2049.8472,a8w8_blockscale_1x128x128_256x128x128x128_16x16_32x32_2x2_8x32x1_8x32x1_1x32x1x8_8_1x1_intrawave_v3,792.27,353.28,0.0
gfx942,304,77568,2048,5120,ck,0,0,2096.5141,a8w8_blockscale_1x128x128_256x128x128x128_16x16_32x32_2x2_8x32x1_8x32x1_1x32x1x8_8_1x1_intrawave_v3,775.92,345.98,0.0
gfx942,304,77696,2048,5120,ck,0,0,2076.1498,a8w8_blockscale_1x128x128_256x128x128x128_16x16_32x32_2x2_8x32x1_8x32x1_1x32x1x8_8_1x1_intrawave_v3,784.82,349.94,0.0
gfx942,304,77824,2048,5120,ck,0,0,2074.2949,a8w8_blockscale_1x128x128_256x128x128x128_16x16_32x32_2x2_8x32x1_8x32x1_1x32x1x8_8_1x1_intrawave_v3,786.82,350.82,0.0
gfx942,304,77952,2048,5120,ck,0,0,2081.5404,a8w8_blockscale_1x128x128_256x128x128x128_16x16_32x32_2x2_8x32x1_8x32x1_1x32x1x8_8_1x1_intrawave_v3,785.37,350.17,0.0
gfx942,304,78080,2048,5120,ck,0,0,2072.4968,a8w8_blockscale_1x128x128_256x128x128x128_16x16_32x32_2x2_8x32x1_8x32x1_1x32x1x8_8_1x1_intrawave_v3,790.09,352.27,0.0
gfx942,304,78208,2048,5120,ck,0,0,2050.9854,a8w8_blockscale_1x128x128_256x128x128x128_16x16_32x32_2x2_8x32x1_8x32x1_1x32x1x8_8_1x1_intrawave_v3,799.68,356.54,0.0
gfx942,304,78336,2048,5120,ck,0,0,2135.8317,a8w8_blockscale_1x128x128_256x128x128x128_16x16_32x32_2x2_8x32x1_8x32x1_1x32x1x8_8_1x1_intrawave_v3,769.17,342.93,0.0
gfx942,304,78464,2048,5120,ck,0,0,2152.1657,a8w8_blockscale_1x128x128_256x128x128x128_16x16_32x32_2x2_8x32x1_8x32x1_1x32x1x8_8_1x1_intrawave_v3,764.58,340.87,0.0
gfx942,304,78592,2048,5120,ck,0,0,2097.0002,a8w8_blockscale_1x128x128_256x128x128x128_16x16_32x32_2x2_8x32x1_8x32x1_1x32x1x8_8_1x1_intrawave_v3,785.98,350.4,0.0
gfx942,304,78720,2048,5120,ck,0,0,2088.2055,a8w8_blockscale_1x128x128_256x128x128x128_16x16_32x32_2x2_8x32x1_8x32x1_1x32x1x8_8_1x1_intrawave_v3,790.57,352.44,0.0
gfx942,304,78848,2048,5120,ck,0,0,2092.7299,a8w8_blockscale_1x128x128_256x128x128x128_16x16_32x32_2x2_8x32x1_8x32x1_1x32x1x8_8_1x1_intrawave_v3,790.15,352.24,0.0
gfx942,304,78976,2048,5120,ck,0,0,2080.2974,a8w8_blockscale_1x128x128_256x128x128x128_16x16_32x32_2x2_8x32x1_8x32x1_1x32x1x8_8_1x1_intrawave_v3,796.16,354.91,0.0
gfx942,304,79104,2048,5120,ck,0,0,2077.3379,a8w8_blockscale_1x128x128_256x128x128x128_16x16_32x32_2x2_8x32x1_8x32x1_1x32x1x8_8_1x1_intrawave_v3,798.59,355.99,0.0
gfx942,304,79232,2048,5120,ck,0,0,2078.2167,a8w8_blockscale_1x128x128_256x128x128x128_16x16_32x32_2x2_8x32x1_8x32x1_1x32x1x8_8_1x1_intrawave_v3,799.54,356.41,0.0
gfx942,304,79360,2048,5120,ck,0,0,2143.8811,a8w8_blockscale_1x128x128_256x128x128x128_16x16_32x32_2x2_8x32x1_8x32x1_1x32x1x8_8_1x1_intrawave_v3,776.3,346.04,0.0
gfx942,304,79488,2048,5120,ck,0,0,2120.5327,a8w8_blockscale_1x128x128_256x128x128x128_16x16_32x32_2x2_8x32x1_8x32x1_1x32x1x8_8_1x1_intrawave_v3,786.12,350.41,0.0
gfx942,304,79616,2048,5120,ck,0,0,2134.5333,a8w8_blockscale_1x128x128_256x128x128x128_16x16_32x32_2x2_8x32x1_8x32x1_1x32x1x8_8_1x1_intrawave_v3,782.22,348.66,0.0
gfx942,304,79744,2048,5120,ck,0,0,2116.3005,a8w8_blockscale_1x128x128_256x128x128x128_16x16_32x32_2x2_8x32x1_8x32x1_1x32x1x8_8_1x1_intrawave_v3,790.22,352.22,0.0
gfx942,304,79872,2048,5120,ck,0,0,2118.8405,a8w8_blockscale_1x128x128_256x128x128x128_16x16_32x32_2x2_8x32x1_8x32x1_1x32x1x8_8_1x1_intrawave_v3,790.54,352.36,0.0
gfx942,304,80000,2048,5120,ck,0,0,2145.555,a8w8_blockscale_1x128x128_256x128x128x128_16x16_32x32_2x2_8x32x1_8x32x1_1x32x1x8_8_1x1_intrawave_v3,781.95,348.52,0.0
gfx942,304,16,4352,5120,ck,8,0,17.5961,a8w8_blockscale_1x128x128_256x16x64x256_16x16_16x16_1x1_16x16x1_16x16x1_1x16x1x16_4_1x1_intrawave_v1,40.52,1278.89,0.0
gfx942,304,32,4352,5120,ck,8,0,17.7301,a8w8_blockscale_1x128x128_256x16x64x256_16x16_16x16_1x1_16x16x1_16x16x1_1x16x1x16_4_1x1_intrawave_v1,80.43,1281.7,0.0
gfx942,304,48,4352,5120,ck,8,0,17.8226,a8w8_blockscale_1x128x128_256x16x64x256_16x16_16x16_1x1_16x16x1_16x16x1_1x16x1x16_4_1x1_intrawave_v1,120.02,1287.45,0.0
gfx942,304,64,4352,5120,ck,8,0,17.5997,a8w8_blockscale_1x128x128_256x16x64x256_16x16_16x16_1x1_16x16x1_16x16x1_1x16x1x16_4_1x1_intrawave_v1,162.06,1316.33,0.0
gfx942,304,80,4352,5120,ck,13,0,23.4089,a8w8_blockscale_1x128x128_256x32x64x256_16x16_16x16_2x1_16x16x1_16x16x1_1x32x1x8_8_2x1_intrawave_v1,152.3,999.11,0.0
gfx942,304,96,4352,5120,ck,13,0,22.6583,a8w8_blockscale_1x128x128_256x32x64x256_16x16_16x16_2x1_16x16x1_16x16x1_1x32x1x8_8_2x1_intrawave_v1,188.81,1041.97,0.0
gfx942,304,112,4352,5120,ck,13,0,23.5399,a8w8_blockscale_1x128x128_256x32x64x256_16x16_16x16_2x1_16x16x1_16x16x1_1x32x1x8_8_2x1_intrawave_v1,212.03,1012.35,0.0
gfx942,304,128,4352,5120,ck,13,0,23.0428,a8w8_blockscale_1x128x128_256x32x64x256_16x16_16x16_2x1_16x16x1_16x16x1_1x32x1x8_8_2x1_intrawave_v1,247.55,1043.78,0.0
gfx942,304,144,4352,5120,ck,18,0,25.765,a8w8_blockscale_1x128x128_256x64x64x256_16x16_32x32_1x1_16x16x1_16x16x1_1x32x1x8_8_1x1_intrawave_v1,249.07,942.09,0.0
gfx942,304,160,4352,5120,ck,18,0,26.3226,a8w8_blockscale_1x128x128_256x64x64x256_16x16_32x32_1x1_16x16x1_16x16x1_1x32x1x8_8_1x1_intrawave_v1,270.88,930.53,0.0
gfx942,304,176,4352,5120,ck,18,0,26.7733,a8w8_blockscale_1x128x128_256x64x64x256_16x16_32x32_1x1_16x16x1_16x16x1_1x32x1x8_8_1x1_intrawave_v1,292.95,923.13,0.0
gfx942,304,192,4352,5120,ck,18,0,24.7843,a8w8_blockscale_1x128x128_256x64x64x256_16x16_32x32_1x1_16x16x1_16x16x1_1x32x1x8_8_1x1_intrawave_v1,345.23,1006.14,0.0
gfx942,304,208,4352,5120,ck,18,0,30.5409,a8w8_blockscale_1x128x128_256x64x64x256_16x16_32x32_1x1_16x16x1_16x16x1_1x32x1x8_8_1x1_intrawave_v1,303.51,823.74,0.0
gfx942,304,224,4352,5120,ck,18,0,30.0706,a8w8_blockscale_1x128x128_256x64x64x256_16x16_32x32_1x1_16x16x1_16x16x1_1x32x1x8_8_1x1_intrawave_v1,331.97,843.97,0.0
gfx942,304,240,4352,5120,ck,18,0,30.7861,a8w8_blockscale_1x128x128_256x64x64x256_16x16_32x32_1x1_16x16x1_16x16x1_1x32x1x8_8_1x1_intrawave_v1,347.41,831.54,0.0
gfx942,304,256,4352,5120,ck,18,0,28.1664,a8w8_blockscale_1x128x128_256x64x64x256_16x16_32x32_1x1_16x16x1_16x16x1_1x32x1x8_8_1x1_intrawave_v1,405.04,916.74,0.0
gfx942,304,288,4352,5120,ck,3,0,42.8729,a8w8_blockscale_1x128x128_256x64x64x128_16x16_32x32_1x1_8x32x1_8x32x1_1x32x1x8_8_1x1_intrawave_v3,299.36,612.59,0.0
gfx942,304,320,4352,5120,ck,1,0,47.622,a8w8_blockscale_1x128x128_256x128x64x128_16x16_32x32_2x1_8x32x1_8x32x1_1x32x1x8_8_1x1_intrawave_v3,299.45,560.79,0.0
gfx942,304,352,4352,5120,ck,2,0,44.2393,a8w8_blockscale_1x128x128_256x64x128x128_16x16_32x32_1x2_8x32x1_8x32x1_1x32x1x8_8_1x1_intrawave_v3,354.59,613.67,0.0
gfx942,304,384,4352,5120,ck,2,0,48.0097,a8w8_blockscale_1x128x128_256x64x128x128_16x16_32x32_1x2_8x32x1_8x32x1_1x32x1x8_8_1x1_intrawave_v3,356.44,574.69,0.0
gfx942,304,416,4352,5120,ck,2,0,45.3506,a8w8_blockscale_1x128x128_256x64x128x128_16x16_32x32_1x2_8x32x1_8x32x1_1x32x1x8_8_1x1_intrawave_v3,408.79,618.14,0.0
gfx942,304,448,4352,5120,ck,2,0,48.7312,a8w8_blockscale_1x128x128_256x64x128x128_16x16_32x32_1x2_8x32x1_8x32x1_1x32x1x8_8_1x1_intrawave_v3,409.69,584.34,0.0
gfx942,304,480,4352,5120,ck,2,0,48.8472,a8w8_blockscale_1x128x128_256x64x128x128_16x16_32x32_1x2_8x32x1_8x32x1_1x32x1x8_8_1x1_intrawave_v3,437.92,592.0,0.0
gfx942,304,512,4352,5120,ck,2,0,50.0928,a8w8_blockscale_1x128x128_256x64x128x128_16x16_32x32_1x2_8x32x1_8x32x1_1x32x1x8_8_1x1_intrawave_v3,455.49,586.11,0.0
gfx942,304,544,4352,5120,ck,0,0,60.8387,a8w8_blockscale_1x128x128_256x128x128x128_16x16_32x32_2x2_8x32x1_8x32x1_1x32x1x8_8_1x1_intrawave_v3,398.48,489.86,0.0
gfx942,304,576,4352,5120,ck,0,0,60.111,a8w8_blockscale_1x128x128_256x128x128x128_16x16_32x32_2x2_8x32x1_8x32x1_1x32x1x8_8_1x1_intrawave_v3,427.03,503.15,0.0
gfx942,304,608,4352,5120,ck,0,0,63.4131,a8w8_blockscale_1x128x128_256x128x128x128_16x16_32x32_2x2_8x32x1_8x32x1_1x32x1x8_8_1x1_intrawave_v3,427.28,483.93,0.0
gfx942,304,640,4352,5120,ck,2,0,66.6804,a8w8_blockscale_1x128x128_256x64x128x128_16x16_32x32_1x2_8x32x1_8x32x1_1x32x1x8_8_1x1_intrawave_v3,427.73,466.85,0.0
gfx942,304,672,4352,5120,ck,0,0,63.4031,a8w8_blockscale_1x128x128_256x128x128x128_16x16_32x32_2x2_8x32x1_8x32x1_1x32x1x8_8_1x1_intrawave_v3,472.33,497.96,0.0
gfx942,304,704,4352,5120,ck,0,0,63.225,a8w8_blockscale_1x128x128_256x128x128x128_16x16_32x32_2x2_8x32x1_8x32x1_1x32x1x8_8_1x1_intrawave_v3,496.22,506.36,0.0
gfx942,304,736,4352,5120,ck,0,0,64.5969,a8w8_blockscale_1x128x128_256x128x128x128_16x16_32x32_2x2_8x32x1_8x32x1_1x32x1x8_8_1x1_intrawave_v3,507.76,502.45,0.0
gfx942,304,768,4352,5120,ck,2,0,71.5087,a8w8_blockscale_1x128x128_256x64x128x128_16x16_32x32_1x2_8x32x1_8x32x1_1x32x1x8_8_1x1_intrawave_v3,478.62,460.07,0.0
gfx942,304,800,4352,5120,ck,0,0,64.8657,a8w8_blockscale_1x128x128_256x128x128x128_16x16_32x32_2x2_8x32x1_8x32x1_1x32x1x8_8_1x1_intrawave_v3,549.62,514.01,0.0
gfx942,304,832,4352,5120,ck,0,0,65.636,a8w8_blockscale_1x128x128_256x128x128x128_16x16_32x32_2x2_8x32x1_8x32x1_1x32x1x8_8_1x1_intrawave_v3,564.9,514.71,0.0
gfx942,304,864,4352,5120,ck,0,0,68.8474,a8w8_blockscale_1x128x128_256x128x128x128_16x16_32x32_2x2_8x32x1_8x32x1_1x32x1x8_8_1x1_intrawave_v3,559.26,497.13,0.0
gfx942,304,896,4352,5120,ck,0,0,74.6666,a8w8_blockscale_1x128x128_256x128x128x128_16x16_32x32_2x2_8x32x1_8x32x1_1x32x1x8_8_1x1_intrawave_v3,534.77,464.31,0.0
gfx942,304,928,4352,5120,ck,0,0,69.7485,a8w8_blockscale_1x128x128_256x128x128x128_16x16_32x32_2x2_8x32x1_8x32x1_1x32x1x8_8_1x1_intrawave_v3,592.93,503.39,0.0
gfx942,304,960,4352,5120,ck,0,0,69.3055,a8w8_blockscale_1x128x128_256x128x128x128_16x16_32x32_2x2_8x32x1_8x32x1_1x32x1x8_8_1x1_intrawave_v3,617.29,512.99,0.0
gfx942,304,992,4352,5120,ck,0,0,71.4683,a8w8_blockscale_1x128x128_256x128x128x128_16x16_32x32_2x2_8x32x1_8x32x1_1x32x1x8_8_1x1_intrawave_v3,618.57,503.66,0.0
gfx942,304,1024,4352,5120,ck,0,0,78.4107,a8w8_blockscale_1x128x128_256x128x128x128_16x16_32x32_2x2_8x32x1_8x32x1_1x32x1x8_8_1x1_intrawave_v3,581.99,464.71,0.0
gfx942,304,1088,4352,5120,ck,2,0,82.5526,a8w8_blockscale_1x128x128_256x64x128x128_16x16_32x32_1x2_8x32x1_8x32x1_1x32x1x8_8_1x1_intrawave_v3,587.34,452.11,0.0
gfx942,304,1152,4352,5120,ck,0,0,103.298,a8w8_blockscale_1x128x128_256x128x128x128_16x16_32x32_2x2_8x32x1_8x32x1_1x32x1x8_8_1x1_intrawave_v3,496.99,369.88,0.0
gfx942,304,1216,4352,5120,ck,0,0,107.1935,a8w8_blockscale_1x128x128_256x128x128x128_16x16_32x32_2x2_8x32x1_8x32x1_1x32x1x8_8_1x1_intrawave_v3,505.54,364.69,0.0
gfx942,304,1280,4352,5120,ck,0,0,102.6146,a8w8_blockscale_1x128x128_256x128x128x128_16x16_32x32_2x2_8x32x1_8x32x1_1x32x1x8_8_1x1_intrawave_v3,555.89,389.58,0.0
gfx942,304,1344,4352,5120,ck,0,0,107.1022,a8w8_blockscale_1x128x128_256x128x128x128_16x16_32x32_2x2_8x32x1_8x32x1_1x32x1x8_8_1x1_intrawave_v3,559.23,381.52,0.0
gfx942,304,1408,4352,5120,ck,0,0,100.841,a8w8_blockscale_1x128x128_256x128x128x128_16x16_32x32_2x2_8x32x1_8x32x1_1x32x1x8_8_1x1_intrawave_v3,622.23,413.98,0.0
gfx942,304,1472,4352,5120,ck,0,0,104.1797,a8w8_blockscale_1x128x128_256x128x128x128_16x16_32x32_2x2_8x32x1_8x32x1_1x32x1x8_8_1x1_intrawave_v3,629.67,409.21,0.0
gfx942,304,1536,4352,5120,ck,0,0,105.8964,a8w8_blockscale_1x128x128_256x128x128x128_16x16_32x32_2x2_8x32x1_8x32x1_1x32x1x8_8_1x1_intrawave_v3,646.4,410.93,0.0
gfx942,304,1600,4352,5120,ck,0,0,109.4404,a8w8_blockscale_1x128x128_256x128x128x128_16x16_32x32_2x2_8x32x1_8x32x1_1x32x1x8_8_1x1_intrawave_v3,651.53,405.71,0.0
gfx942,304,1664,4352,5120,ck,0,0,112.298,a8w8_blockscale_1x128x128_256x128x128x128_16x16_32x32_2x2_8x32x1_8x32x1_1x32x1x8_8_1x1_intrawave_v3,660.34,403.26,0.0
gfx942,304,1728,4352,5120,ck,0,0,113.6313,a8w8_blockscale_1x128x128_256x128x128x128_16x16_32x32_2x2_8x32x1_8x32x1_1x32x1x8_8_1x1_intrawave_v3,677.7,406.32,0.0
gfx942,304,1792,4352,5120,ck,0,0,119.7149,a8w8_blockscale_1x128x128_256x128x128x128_16x16_32x32_2x2_8x32x1_8x32x1_1x32x1x8_8_1x1_intrawave_v3,667.08,393.06,0.0
gfx942,304,1856,4352,5120,ck,0,0,116.7668,a8w8_blockscale_1x128x128_256x128x128x128_16x16_32x32_2x2_8x32x1_8x32x1_1x32x1x8_8_1x1_intrawave_v3,708.35,410.56,0.0
gfx942,304,1920,4352,5120,ck,0,0,118.1519,a8w8_blockscale_1x128x128_256x128x128x128_16x16_32x32_2x2_8x32x1_8x32x1_1x32x1x8_8_1x1_intrawave_v3,724.18,413.23,0.0
gfx942,304,1984,4352,5120,ck,0,0,116.2873,a8w8_blockscale_1x128x128_256x128x128x128_16x16_32x32_2x2_8x32x1_8x32x1_1x32x1x8_8_1x1_intrawave_v3,760.32,427.47,0.0
gfx942,304,2048,4352,5120,ck,0,0,121.9459,a8w8_blockscale_1x128x128_256x128x128x128_16x16_32x32_2x2_8x32x1_8x32x1_1x32x1x8_8_1x1_intrawave_v3,748.43,414.89,0.0
gfx942,304,2112,4352,5120,ck,0,0,129.4798,a8w8_blockscale_1x128x128_256x128x128x128_16x16_32x32_2x2_8x32x1_8x32x1_1x32x1x8_8_1x1_intrawave_v3,726.91,397.58,0.0
gfx942,304,2176,4352,5120,ck,0,0,126.7961,a8w8_blockscale_1x128x128_256x128x128x128_16x16_32x32_2x2_8x32x1_8x32x1_1x32x1x8_8_1x1_intrawave_v3,764.79,412.97,0.0
gfx942,304,2240,4352,5120,ck,2,0,161.2069,a8w8_blockscale_1x128x128_256x64x128x128_16x16_32x32_1x2_8x32x1_8x32x1_1x32x1x8_8_1x1_intrawave_v3,619.23,330.31,0.0
gfx942,304,2304,4352,5120,ck,0,0,176.6544,a8w8_blockscale_1x128x128_256x128x128x128_16x16_32x32_2x2_8x32x1_8x32x1_1x32x1x8_8_1x1_intrawave_v3,581.23,306.43,0.0
gfx942,304,2368,4352,5120,ck,0,0,168.2046,a8w8_blockscale_1x128x128_256x128x128x128_16x16_32x32_2x2_8x32x1_8x32x1_1x32x1x8_8_1x1_intrawave_v3,627.38,327.09,0.0
gfx942,304,2432,4352,5120,ck,0,0,169.0482,a8w8_blockscale_1x128x128_256x128x128x128_16x16_32x32_2x2_8x32x1_8x32x1_1x32x1x8_8_1x1_intrawave_v3,641.12,330.69,0.0
gfx942,304,2496,4352,5120,ck,0,0,168.5728,a8w8_blockscale_1x128x128_256x128x128x128_16x16_32x32_2x2_8x32x1_8x32x1_1x32x1x8_8_1x1_intrawave_v3,659.85,336.87,0.0
gfx942,304,2560,4352,5120,ck,0,0,170.6699,a8w8_blockscale_1x128x128_256x128x128x128_16x16_32x32_2x2_8x32x1_8x32x1_1x32x1x8_8_1x1_intrawave_v3,668.45,337.91,0.0
gfx942,304,2624,4352,5120,ck,0,0,174.4626,a8w8_blockscale_1x128x128_256x128x128x128_16x16_32x32_2x2_8x32x1_8x32x1_1x32x1x8_8_1x1_intrawave_v3,670.27,335.64,0.0
gfx942,304,2688,4352,5120,ck,0,0,174.0571,a8w8_blockscale_1x128x128_256x128x128x128_16x16_32x32_2x2_8x32x1_8x32x1_1x32x1x8_8_1x1_intrawave_v3,688.22,341.5,0.0
gfx942,304,2752,4352,5120,ck,0,0,172.2841,a8w8_blockscale_1x128x128_256x128x128x128_16x16_32x32_2x2_8x32x1_8x32x1_1x32x1x8_8_1x1_intrawave_v3,711.86,350.15,0.0
gfx942,304,2816,4352,5120,ck,0,0,176.3267,a8w8_blockscale_1x128x128_256x128x128x128_16x16_32x32_2x2_8x32x1_8x32x1_1x32x1x8_8_1x1_intrawave_v3,711.71,347.14,0.0
gfx942,304,2880,4352,5120,ck,0,0,177.1874,a8w8_blockscale_1x128x128_256x128x128x128_16x16_32x32_2x2_8x32x1_8x32x1_1x32x1x8_8_1x1_intrawave_v3,724.35,350.45,0.0
gfx942,304,2944,4352,5120,ck,0,0,177.4162,a8w8_blockscale_1x128x128_256x128x128x128_16x16_32x32_2x2_8x32x1_8x32x1_1x32x1x8_8_1x1_intrawave_v3,739.49,354.99,0.0
gfx942,304,3008,4352,5120,ck,0,0,175.8786,a8w8_blockscale_1x128x128_256x128x128x128_16x16_32x32_2x2_8x32x1_8x32x1_1x32x1x8_8_1x1_intrawave_v3,762.17,363.12,0.0
gfx942,304,3072,4352,5120,ck,0,0,178.3378,a8w8_blockscale_1x128x128_256x128x128x128_16x16_32x32_2x2_8x32x1_8x32x1_1x32x1x8_8_1x1_intrawave_v3,767.66,363.07,0.0
gfx942,304,3136,4352,5120,ck,0,0,188.0845,a8w8_blockscale_1x128x128_256x128x128x128_16x16_32x32_2x2_8x32x1_8x32x1_1x32x1x8_8_1x1_intrawave_v3,743.04,348.96,0.0
gfx942,304,3200,4352,5120,ck,0,0,187.0796,a8w8_blockscale_1x128x128_256x128x128x128_16x16_32x32_2x2_8x32x1_8x32x1_1x32x1x8_8_1x1_intrawave_v3,762.28,355.57,0.0
gfx942,304,3264,4352,5120,ck,0,0,199.2438,a8w8_blockscale_1x128x128_256x128x128x128_16x16_32x32_2x2_8x32x1_8x32x1_1x32x1x8_8_1x1_intrawave_v3,730.05,338.3,0.0
gfx942,304,3328,4352,5120,ck,0,0,195.785,a8w8_blockscale_1x128x128_256x128x128x128_16x16_32x32_2x2_8x32x1_8x32x1_1x32x1x8_8_1x1_intrawave_v3,757.52,348.79,0.0
gfx942,304,3392,4352,5120,ck,0,0,213.7014,a8w8_blockscale_1x128x128_256x128x128x128_16x16_32x32_2x2_8x32x1_8x32x1_1x32x1x8_8_1x1_intrawave_v3,707.35,323.69,0.0
gfx942,304,3456,4352,5120,ck,0,0,229.2422,a8w8_blockscale_1x128x128_256x128x128x128_16x16_32x32_2x2_8x32x1_8x32x1_1x32x1x8_8_1x1_intrawave_v3,671.84,305.61,0.0
gfx942,304,3520,4352,5120,ck,0,0,220.6495,a8w8_blockscale_1x128x128_256x128x128x128_16x16_32x32_2x2_8x32x1_8x32x1_1x32x1x8_8_1x1_intrawave_v3,710.93,321.52,0.0
gfx942,304,3584,4352,5120,ck,0,0,223.2164,a8w8_blockscale_1x128x128_256x128x128x128_16x16_32x32_2x2_8x32x1_8x32x1_1x32x1x8_8_1x1_intrawave_v3,715.53,321.78,0.0
gfx942,304,3648,4352,5120,ck,0,0,222.2058,a8w8_blockscale_1x128x128_256x128x128x128_16x16_32x32_2x2_8x32x1_8x32x1_1x32x1x8_8_1x1_intrawave_v3,731.62,327.23,0.0
gfx942,304,3712,4352,5120,ck,0,0,228.3087,a8w8_blockscale_1x128x128_256x128x128x128_16x16_32x32_2x2_8x32x1_8x32x1_1x32x1x8_8_1x1_intrawave_v3,724.56,322.36,0.0
gfx942,304,3776,4352,5120,ck,0,0,226.5515,a8w8_blockscale_1x128x128_256x128x128x128_16x16_32x32_2x2_8x32x1_8x32x1_1x32x1x8_8_1x1_intrawave_v3,742.77,328.76,0.0
gfx942,304,3840,4352,5120,ck,0,0,230.5146,a8w8_blockscale_1x128x128_256x128x128x128_16x16_32x32_2x2_8x32x1_8x32x1_1x32x1x8_8_1x1_intrawave_v3,742.37,326.95,0.0
gfx942,304,3904,4352,5120,ck,0,0,230.4521,a8w8_blockscale_1x128x128_256x128x128x128_16x16_32x32_2x2_8x32x1_8x32x1_1x32x1x8_8_1x1_intrawave_v3,754.95,330.88,0.0
gfx942,304,3968,4352,5120,ck,0,0,236.0852,a8w8_blockscale_1x128x128_256x128x128x128_16x16_32x32_2x2_8x32x1_8x32x1_1x32x1x8_8_1x1_intrawave_v3,749.02,326.73,0.0
gfx942,304,4032,4352,5120,ck,0,0,230.6739,a8w8_blockscale_1x128x128_256x128x128x128_16x16_32x32_2x2_8x32x1_8x32x1_1x32x1x8_8_1x1_intrawave_v3,778.95,338.23,0.0
gfx942,304,4096,4352,5120,ck,0,0,234.1352,a8w8_blockscale_1x128x128_256x128x128x128_16x16_32x32_2x2_8x32x1_8x32x1_1x32x1x8_8_1x1_intrawave_v3,779.62,337.01,0.0
gfx942,304,4224,4352,5120,ck,0,0,245.5747,a8w8_blockscale_1x128x128_256x128x128x128_16x16_32x32_2x2_8x32x1_8x32x1_1x32x1x8_8_1x1_intrawave_v3,766.53,328.51,0.0
gfx942,304,4352,4352,5120,ck,0,0,251.2166,a8w8_blockscale_1x128x128_256x128x128x128_16x16_32x32_2x2_8x32x1_8x32x1_1x32x1x8_8_1x1_intrawave_v3,772.02,328.18,0.0
gfx942,304,4480,4352,5120,ck,0,0,255.1666,a8w8_blockscale_1x128x128_256x128x128x128_16x16_32x32_2x2_8x32x1_8x32x1_1x32x1x8_8_1x1_intrawave_v3,782.43,330.03,0.0
gfx942,304,4608,4352,5120,ck,0,0,287.8938,a8w8_blockscale_1x128x128_256x128x128x128_16x16_32x32_2x2_8x32x1_8x32x1_1x32x1x8_8_1x1_intrawave_v3,713.29,298.66,0.0
gfx942,304,4736,4352,5120,ck,0,0,282.7577,a8w8_blockscale_1x128x128_256x128x128x128_16x16_32x32_2x2_8x32x1_8x32x1_1x32x1x8_8_1x1_intrawave_v3,746.42,310.35,0.0
gfx942,304,4864,4352,5120,ck,0,0,292.2391,a8w8_blockscale_1x128x128_256x128x128x128_16x16_32x32_2x2_8x32x1_8x32x1_1x32x1x8_8_1x1_intrawave_v3,741.73,306.33,0.0
gfx942,304,4992,4352,5120,ck,0,0,295.2096,a8w8_blockscale_1x128x128_256x128x128x128_16x16_32x32_2x2_8x32x1_8x32x1_1x32x1x8_8_1x1_intrawave_v3,753.59,309.24,0.0
gfx942,304,5120,4352,5120,ck,0,0,292.2416,a8w8_blockscale_1x128x128_256x128x128x128_16x16_32x32_2x2_8x32x1_8x32x1_1x32x1x8_8_1x1_intrawave_v3,780.76,318.44,0.0
gfx942,304,5248,4352,5120,ck,0,0,299.6777,a8w8_blockscale_1x128x128_256x128x128x128_16x16_32x32_2x2_8x32x1_8x32x1_1x32x1x8_8_1x1_intrawave_v3,780.42,316.44,0.0
gfx942,304,5376,4352,5120,ck,0,0,303.38,a8w8_blockscale_1x128x128_256x128x128x128_16x16_32x32_2x2_8x32x1_8x32x1_1x32x1x8_8_1x1_intrawave_v3,789.7,318.41,0.0
gfx942,304,5504,4352,5120,ck,0,0,311.4157,a8w8_blockscale_1x128x128_256x128x128x128_16x16_32x32_2x2_8x32x1_8x32x1_1x32x1x8_8_1x1_intrawave_v3,787.64,315.88,0.0
gfx942,304,5632,4352,5120,ck,0,0,319.8941,a8w8_blockscale_1x128x128_256x128x128x128_16x16_32x32_2x2_8x32x1_8x32x1_1x32x1x8_8_1x1_intrawave_v3,784.59,313.04,0.0
gfx942,304,5760,4352,5120,ck,0,0,341.9449,a8w8_blockscale_1x128x128_256x128x128x128_16x16_32x32_2x2_8x32x1_8x32x1_1x32x1x8_8_1x1_intrawave_v3,750.68,298.03,0.0
gfx942,304,5888,4352,5120,ck,0,0,341.1876,a8w8_blockscale_1x128x128_256x128x128x128_16x16_32x32_2x2_8x32x1_8x32x1_1x32x1x8_8_1x1_intrawave_v3,769.07,303.87,0.0
gfx942,304,6016,4352,5120,ck,0,0,343.4391,a8w8_blockscale_1x128x128_256x128x128x128_16x16_32x32_2x2_8x32x1_8x32x1_1x32x1x8_8_1x1_intrawave_v3,780.63,307.03,0.0
gfx942,304,6144,4352,5120,ck,0,0,345.292,a8w8_blockscale_1x128x128_256x128x128x128_16x16_32x32_2x2_8x32x1_8x32x1_1x32x1x8_8_1x1_intrawave_v3,792.96,310.51,0.0
gfx942,304,6272,4352,5120,ck,0,0,356.1598,a8w8_blockscale_1x128x128_256x128x128x128_16x16_32x32_2x2_8x32x1_8x32x1_1x32x1x8_8_1x1_intrawave_v3,784.78,306.0,0.0
gfx942,304,6400,4352,5120,ck,0,0,363.0177,a8w8_blockscale_1x128x128_256x128x128x128_16x16_32x32_2x2_8x32x1_8x32x1_1x32x1x8_8_1x1_intrawave_v3,785.67,305.1,0.0
gfx942,304,6528,4352,5120,ck,0,0,367.2287,a8w8_blockscale_1x128x128_256x128x128x128_16x16_32x32_2x2_8x32x1_8x32x1_1x32x1x8_8_1x1_intrawave_v3,792.2,306.42,0.0
gfx942,304,6656,4352,5120,ck,0,0,377.4334,a8w8_blockscale_1x128x128_256x128x128x128_16x16_32x32_2x2_8x32x1_8x32x1_1x32x1x8_8_1x1_intrawave_v3,785.89,302.82,0.0
gfx942,304,6784,4352,5120,ck,0,0,381.0549,a8w8_blockscale_1x128x128_256x128x128x128_16x16_32x32_2x2_8x32x1_8x32x1_1x32x1x8_8_1x1_intrawave_v3,793.39,304.59,0.0
gfx942,304,6912,4352,5120,ck,0,0,404.3102,a8w8_blockscale_1x128x128_256x128x128x128_16x16_32x32_2x2_8x32x1_8x32x1_1x32x1x8_8_1x1_intrawave_v3,761.86,291.44,0.0
gfx942,304,7040,4352,5120,ck,0,0,406.0555,a8w8_blockscale_1x128x128_256x128x128x128_16x16_32x32_2x2_8x32x1_8x32x1_1x32x1x8_8_1x1_intrawave_v3,772.64,294.55,0.0
gfx942,304,7168,4352,5120,ck,0,0,406.3035,a8w8_blockscale_1x128x128_256x128x128x128_16x16_32x32_2x2_8x32x1_8x32x1_1x32x1x8_8_1x1_intrawave_v3,786.21,298.72,0.0
gfx942,304,7296,4352,5120,ck,0,0,409.1707,a8w8_blockscale_1x128x128_256x128x128x128_16x16_32x32_2x2_8x32x1_8x32x1_1x32x1x8_8_1x1_intrawave_v3,794.64,300.96,0.0
gfx942,304,7424,4352,5120,ck,0,0,414.5256,a8w8_blockscale_1x128x128_256x128x128x128_16x16_32x32_2x2_8x32x1_8x32x1_1x32x1x8_8_1x1_intrawave_v3,798.13,301.34,0.0
gfx942,304,7552,4352,5120,ck,0,0,419.8783,a8w8_blockscale_1x128x128_256x128x128x128_16x16_32x32_2x2_8x32x1_8x32x1_1x32x1x8_8_1x1_intrawave_v3,801.54,301.71,0.0
gfx942,304,7680,4352,5120,ck,0,0,428.7098,a8w8_blockscale_1x128x128_256x128x128x128_16x16_32x32_2x2_8x32x1_8x32x1_1x32x1x8_8_1x1_intrawave_v3,798.34,299.62,0.0
gfx942,304,7808,4352,5120,ck,0,0,433.4638,a8w8_blockscale_1x128x128_256x128x128x128_16x16_32x32_2x2_8x32x1_8x32x1_1x32x1x8_8_1x1_intrawave_v3,802.74,300.42,0.0
gfx942,304,7936,4352,5120,ck,0,0,449.4337,a8w8_blockscale_1x128x128_256x128x128x128_16x16_32x32_2x2_8x32x1_8x32x1_1x32x1x8_8_1x1_intrawave_v3,786.91,293.68,0.0
gfx942,304,8064,4352,5120,ck,0,0,454.8536,a8w8_blockscale_1x128x128_256x128x128x128_16x16_32x32_2x2_8x32x1_8x32x1_1x32x1x8_8_1x1_intrawave_v3,790.07,294.07,0.0
gfx942,304,8192,4352,5120,ck,0,0,463.5961,a8w8_blockscale_1x128x128_256x128x128x128_16x16_32x32_2x2_8x32x1_8x32x1_1x32x1x8_8_1x1_intrawave_v3,787.48,292.34,0.0
gfx942,304,8320,4352,5120,ck,0,0,467.9988,a8w8_blockscale_1x128x128_256x128x128x128_16x16_32x32_2x2_8x32x1_8x32x1_1x32x1x8_8_1x1_intrawave_v3,792.26,293.37,0.0
gfx942,304,8448,4352,5120,ck,0,0,473.1006,a8w8_blockscale_1x128x128_256x128x128x128_16x16_32x32_2x2_8x32x1_8x32x1_1x32x1x8_8_1x1_intrawave_v3,795.77,293.95,0.0
gfx942,304,8576,4352,5120,ck,0,0,475.865,a8w8_blockscale_1x128x128_256x128x128x128_16x16_32x32_2x2_8x32x1_8x32x1_1x32x1x8_8_1x1_intrawave_v3,803.14,295.96,0.0
gfx942,304,8704,4352,5120,ck,0,0,480.8308,a8w8_blockscale_1x128x128_256x128x128x128_16x16_32x32_2x2_8x32x1_8x32x1_1x32x1x8_8_1x1_intrawave_v3,806.71,296.58,0.0
gfx942,304,8832,4352,5120,ck,0,0,482.4925,a8w8_blockscale_1x128x128_256x128x128x128_16x16_32x32_2x2_8x32x1_8x32x1_1x32x1x8_8_1x1_intrawave_v3,815.75,299.23,0.0
gfx942,304,8960,4352,5120,ck,0,0,498.7352,a8w8_blockscale_1x128x128_256x128x128x128_16x16_32x32_2x2_8x32x1_8x32x1_1x32x1x8_8_1x1_intrawave_v3,800.62,293.03,0.0
gfx942,304,9088,4352,5120,ck,0,0,506.4557,a8w8_blockscale_1x128x128_256x128x128x128_16x16_32x32_2x2_8x32x1_8x32x1_1x32x1x8_8_1x1_intrawave_v3,799.68,292.06,0.0
gfx942,304,9216,4352,5120,ck,0,0,525.1254,a8w8_blockscale_1x128x128_256x128x128x128_16x16_32x32_2x2_8x32x1_8x32x1_1x32x1x8_8_1x1_intrawave_v3,782.11,285.04,0.0
gfx942,304,9344,4352,5120,ck,0,0,520.8125,a8w8_blockscale_1x128x128_256x128x128x128_16x16_32x32_2x2_8x32x1_8x32x1_1x32x1x8_8_1x1_intrawave_v3,799.54,290.8,0.0
gfx942,304,9472,4352,5120,ck,0,0,538.8566,a8w8_blockscale_1x128x128_256x128x128x128_16x16_32x32_2x2_8x32x1_8x32x1_1x32x1x8_8_1x1_intrawave_v3,783.35,284.35,0.0
gfx942,304,9600,4352,5120,ck,0,0,528.3739,a8w8_blockscale_1x128x128_256x128x128x128_16x16_32x32_2x2_8x32x1_8x32x1_1x32x1x8_8_1x1_intrawave_v3,809.69,293.34,0.0
gfx942,304,9728,4352,5120,ck,0,0,539.3703,a8w8_blockscale_1x128x128_256x128x128x128_16x16_32x32_2x2_8x32x1_8x32x1_1x32x1x8_8_1x1_intrawave_v3,803.76,290.64,0.0
gfx942,304,9856,4352,5120,ck,0,0,543.689,a8w8_blockscale_1x128x128_256x128x128x128_16x16_32x32_2x2_8x32x1_8x32x1_1x32x1x8_8_1x1_intrawave_v3,807.87,291.59,0.0
gfx942,304,9984,4352,5120,ck,0,0,546.9365,a8w8_blockscale_1x128x128_256x128x128x128_16x16_32x32_2x2_8x32x1_8x32x1_1x32x1x8_8_1x1_intrawave_v3,813.5,293.09,0.0
gfx942,304,10112,4352,5120,ck,0,0,557.7778,a8w8_blockscale_1x128x128_256x128x128x128_16x16_32x32_2x2_8x32x1_8x32x1_1x32x1x8_8_1x1_intrawave_v3,807.91,290.56,0.0
gfx942,304,10240,4352,5120,ck,0,0,570.1148,a8w8_blockscale_1x128x128_256x128x128x128_16x16_32x32_2x2_8x32x1_8x32x1_1x32x1x8_8_1x1_intrawave_v3,800.44,287.38,0.0
gfx942,304,10368,4352,5120,ck,0,0,585.9814,a8w8_blockscale_1x128x128_256x128x128x128_16x16_32x32_2x2_8x32x1_8x32x1_1x32x1x8_8_1x1_intrawave_v3,788.5,282.62,0.0
gfx942,304,10496,4352,5120,ck,0,0,579.9329,a8w8_blockscale_1x128x128_256x128x128x128_16x16_32x32_2x2_8x32x1_8x32x1_1x32x1x8_8_1x1_intrawave_v3,806.56,288.62,0.0
gfx942,304,10624,4352,5120,ck,0,0,588.1688,a8w8_blockscale_1x128x128_256x128x128x128_16x16_32x32_2x2_8x32x1_8x32x1_1x32x1x8_8_1x1_intrawave_v3,804.96,287.58,0.0
gfx942,304,10752,4352,5120,ck,0,0,591.6889,a8w8_blockscale_1x128x128_256x128x128x128_16x16_32x32_2x2_8x32x1_8x32x1_1x32x1x8_8_1x1_intrawave_v3,809.81,288.86,0.0
gfx942,304,10880,4352,5120,ck,0,0,603.0912,a8w8_blockscale_1x128x128_256x128x128x128_16x16_32x32_2x2_8x32x1_8x32x1_1x32x1x8_8_1x1_intrawave_v3,803.96,286.34,0.0
gfx942,304,11008,4352,5120,ck,0,0,601.9041,a8w8_blockscale_1x128x128_256x128x128x128_16x16_32x32_2x2_8x32x1_8x32x1_1x32x1x8_8_1x1_intrawave_v3,815.02,289.84,0.0
gfx942,304,11136,4352,5120,ck,0,0,609.804,a8w8_blockscale_1x128x128_256x128x128x128_16x16_32x32_2x2_8x32x1_8x32x1_1x32x1x8_8_1x1_intrawave_v3,813.82,288.99,0.0
gfx942,304,11264,4352,5120,ck,0,0,617.1708,a8w8_blockscale_1x128x128_256x128x128x128_16x16_32x32_2x2_8x32x1_8x32x1_1x32x1x8_8_1x1_intrawave_v3,813.35,288.41,0.0
gfx942,304,11392,4352,5120,ck,0,0,639.6966,a8w8_blockscale_1x128x128_256x128x128x128_16x16_32x32_2x2_8x32x1_8x32x1_1x32x1x8_8_1x1_intrawave_v3,793.62,281.02,0.0
gfx942,304,11520,4352,5120,ck,0,0,640.0904,a8w8_blockscale_1x128x128_256x128x128x128_16x16_32x32_2x2_8x32x1_8x32x1_1x32x1x8_8_1x1_intrawave_v3,802.05,283.61,0.0
gfx942,304,11648,4352,5120,ck,0,0,662.6378,a8w8_blockscale_1x128x128_256x128x128x128_16x16_32x32_2x2_8x32x1_8x32x1_1x32x1x8_8_1x1_intrawave_v3,783.36,276.63,0.0
gfx942,304,11776,4352,5120,ck,0,0,650.8478,a8w8_blockscale_1x128x128_256x128x128x128_16x16_32x32_2x2_8x32x1_8x32x1_1x32x1x8_8_1x1_intrawave_v3,806.32,284.36,0.0
gfx942,304,11904,4352,5120,ck,0,0,672.0321,a8w8_blockscale_1x128x128_256x128x128x128_16x16_32x32_2x2_8x32x1_8x32x1_1x32x1x8_8_1x1_intrawave_v3,789.39,278.03,0.0
gfx942,304,12032,4352,5120,ck,0,0,662.6907,a8w8_blockscale_1x128x128_256x128x128x128_16x16_32x32_2x2_8x32x1_8x32x1_1x32x1x8_8_1x1_intrawave_v3,809.13,284.62,0.0
gfx942,304,12160,4352,5120,ck,0,0,664.9493,a8w8_blockscale_1x128x128_256x128x128x128_16x16_32x32_2x2_8x32x1_8x32x1_1x32x1x8_8_1x1_intrawave_v3,814.96,286.31,0.0
gfx942,304,12288,4352,5120,ck,0,0,670.0565,a8w8_blockscale_1x128x128_256x128x128x128_16x16_32x32_2x2_8x32x1_8x32x1_1x32x1x8_8_1x1_intrawave_v3,817.26,286.77,0.0
gfx942,304,12416,4352,5120,ck,0,0,687.6813,a8w8_blockscale_1x128x128_256x128x128x128_16x16_32x32_2x2_8x32x1_8x32x1_1x32x1x8_8_1x1_intrawave_v3,804.61,281.99,0.0
gfx942,304,12544,4352,5120,ck,0,0,689.6037,a8w8_blockscale_1x128x128_256x128x128x128_16x16_32x32_2x2_8x32x1_8x32x1_1x32x1x8_8_1x1_intrawave_v3,810.63,283.77,0.0
gfx942,304,12672,4352,5120,ck,0,0,706.4157,a8w8_blockscale_1x128x128_256x128x128x128_16x16_32x32_2x2_8x32x1_8x32x1_1x32x1x8_8_1x1_intrawave_v3,799.42,279.52,0.0
gfx942,304,12800,4352,5120,ck,0,0,703.9489,a8w8_blockscale_1x128x128_256x128x128x128_16x16_32x32_2x2_8x32x1_8x32x1_1x32x1x8_8_1x1_intrawave_v3,810.32,283.02,0.0
gfx942,304,12928,4352,5120,ck,0,0,713.3344,a8w8_blockscale_1x128x128_256x128x128x128_16x16_32x32_2x2_8x32x1_8x32x1_1x32x1x8_8_1x1_intrawave_v3,807.66,281.77,0.0
gfx942,304,13056,4352,5120,ck,0,0,722.6467,a8w8_blockscale_1x128x128_256x128x128x128_16x16_32x32_2x2_8x32x1_8x32x1_1x32x1x8_8_1x1_intrawave_v3,805.14,280.59,0.0
gfx942,304,13184,4352,5120,ck,0,0,724.3974,a8w8_blockscale_1x128x128_256x128x128x128_16x16_32x32_2x2_8x32x1_8x32x1_1x32x1x8_8_1x1_intrawave_v3,811.07,282.36,0.0
gfx942,304,13312,4352,5120,ck,0,0,724.3065,a8w8_blockscale_1x128x128_256x128x128x128_16x16_32x32_2x2_8x32x1_8x32x1_1x32x1x8_8_1x1_intrawave_v3,819.05,284.83,0.0
gfx942,304,13440,4352,5120,ck,0,0,740.2455,a8w8_blockscale_1x128x128_256x128x128x128_16x16_32x32_2x2_8x32x1_8x32x1_1x32x1x8_8_1x1_intrawave_v3,809.12,281.09,0.0
gfx942,304,13568,4352,5120,ck,0,0,751.1367,a8w8_blockscale_1x128x128_256x128x128x128_16x16_32x32_2x2_8x32x1_8x32x1_1x32x1x8_8_1x1_intrawave_v3,804.98,279.37,0.0
gfx942,304,13696,4352,5120,ck,0,0,760.2068,a8w8_blockscale_1x128x128_256x128x128x128_16x16_32x32_2x2_8x32x1_8x32x1_1x32x1x8_8_1x1_intrawave_v3,802.88,278.37,0.0
gfx942,304,13824,4352,5120,ck,0,0,768.6726,a8w8_blockscale_1x128x128_256x128x128x128_16x16_32x32_2x2_8x32x1_8x32x1_1x32x1x8_8_1x1_intrawave_v3,801.46,277.6,0.0
gfx942,304,13952,4352,5120,ck,0,0,768.9625,a8w8_blockscale_1x128x128_256x128x128x128_16x16_32x32_2x2_8x32x1_8x32x1_1x32x1x8_8_1x1_intrawave_v3,808.57,279.8,0.0
gfx942,304,14080,4352,5120,ck,0,0,766.344,a8w8_blockscale_1x128x128_256x128x128x128_16x16_32x32_2x2_8x32x1_8x32x1_1x32x1x8_8_1x1_intrawave_v3,818.78,283.06,0.0
gfx942,304,14208,4352,5120,ck,0,0,775.3804,a8w8_blockscale_1x128x128_256x128x128x128_16x16_32x32_2x2_8x32x1_8x32x1_1x32x1x8_8_1x1_intrawave_v3,816.6,282.05,0.0
gfx942,304,14336,4352,5120,ck,0,0,781.4268,a8w8_blockscale_1x128x128_256x128x128x128_16x16_32x32_2x2_8x32x1_8x32x1_1x32x1x8_8_1x1_intrawave_v3,817.58,282.13,0.0
gfx942,304,14464,4352,5120,ck,0,0,795.0356,a8w8_blockscale_1x128x128_256x128x128x128_16x16_32x32_2x2_8x32x1_8x32x1_1x32x1x8_8_1x1_intrawave_v3,810.76,279.53,0.0
gfx942,304,14592,4352,5120,ck,0,0,807.5107,a8w8_blockscale_1x128x128_256x128x128x128_16x16_32x32_2x2_8x32x1_8x32x1_1x32x1x8_8_1x1_intrawave_v3,805.3,277.4,0.0
gfx942,304,14720,4352,5120,ck,0,0,821.4642,a8w8_blockscale_1x128x128_256x128x128x128_16x16_32x32_2x2_8x32x1_8x32x1_1x32x1x8_8_1x1_intrawave_v3,798.56,274.84,0.0
gfx942,304,14848,4352,5120,ck,0,0,821.7163,a8w8_blockscale_1x128x128_256x128x128x128_16x16_32x32_2x2_8x32x1_8x32x1_1x32x1x8_8_1x1_intrawave_v3,805.26,276.91,0.0
gfx942,304,14976,4352,5120,ck,0,0,831.9265,a8w8_blockscale_1x128x128_256x128x128x128_16x16_32x32_2x2_8x32x1_8x32x1_1x32x1x8_8_1x1_intrawave_v3,802.23,275.64,0.0
gfx942,304,15104,4352,5120,ck,0,0,831.3086,a8w8_blockscale_1x128x128_256x128x128x128_16x16_32x32_2x2_8x32x1_8x32x1_1x32x1x8_8_1x1_intrawave_v3,809.69,277.97,0.0
gfx942,304,15232,4352,5120,ck,0,0,835.4217,a8w8_blockscale_1x128x128_256x128x128x128_16x16_32x32_2x2_8x32x1_8x32x1_1x32x1x8_8_1x1_intrawave_v3,812.53,278.72,0.0
gfx942,304,15360,4352,5120,ck,0,0,863.9792,a8w8_blockscale_1x128x128_256x128x128x128_16x16_32x32_2x2_8x32x1_8x32x1_1x32x1x8_8_1x1_intrawave_v3,792.28,271.56,0.0
gfx942,304,15488,4352,5120,ck,0,0,852.616,a8w8_blockscale_1x128x128_256x128x128x128_16x16_32x32_2x2_8x32x1_8x32x1_1x32x1x8_8_1x1_intrawave_v3,809.53,277.25,0.0
gfx942,304,15616,4352,5120,ck,0,0,860.5329,a8w8_blockscale_1x128x128_256x128x128x128_16x16_32x32_2x2_8x32x1_8x32x1_1x32x1x8_8_1x1_intrawave_v3,808.71,276.76,0.0
gfx942,304,15744,4352,5120,ck,0,0,868.2755,a8w8_blockscale_1x128x128_256x128x128x128_16x16_32x32_2x2_8x32x1_8x32x1_1x32x1x8_8_1x1_intrawave_v3,808.07,276.33,0.0
gfx942,304,15872,4352,5120,ck,0,0,903.3991,a8w8_blockscale_1x128x128_256x128x128x128_16x16_32x32_2x2_8x32x1_8x32x1_1x32x1x8_8_1x1_intrawave_v3,782.96,267.54,0.0
gfx942,304,16000,4352,5120,ck,0,0,910.25,a8w8_blockscale_1x128x128_256x128x128x128_16x16_32x32_2x2_8x32x1_8x32x1_1x32x1x8_8_1x1_intrawave_v3,783.34,267.47,0.0
gfx942,304,16128,4352,5120,ck,0,0,911.0777,a8w8_blockscale_1x128x128_256x128x128x128_16x16_32x32_2x2_8x32x1_8x32x1_1x32x1x8_8_1x1_intrawave_v3,788.89,269.17,0.0
gfx942,304,16256,4352,5120,ck,0,0,895.7594,a8w8_blockscale_1x128x128_256x128x128x128_16x16_32x32_2x2_8x32x1_8x32x1_1x32x1x8_8_1x1_intrawave_v3,808.74,275.75,0.0
gfx942,304,16384,4352,5120,ck,0,0,890.8484,a8w8_blockscale_1x128x128_256x128x128x128_16x16_32x32_2x2_8x32x1_8x32x1_1x32x1x8_8_1x1_intrawave_v3,819.61,279.26,0.0
gfx942,304,16512,4352,5120,ck,0,0,912.8324,a8w8_blockscale_1x128x128_256x128x128x128_16x16_32x32_2x2_8x32x1_8x32x1_1x32x1x8_8_1x1_intrawave_v3,806.12,274.47,0.0
gfx942,304,16640,4352,5120,ck,0,0,942.0647,a8w8_blockscale_1x128x128_256x128x128x128_16x16_32x32_2x2_8x32x1_8x32x1_1x32x1x8_8_1x1_intrawave_v3,787.16,267.83,0.0
gfx942,304,16768,4352,5120,ck,0,0,920.4458,a8w8_blockscale_1x128x128_256x128x128x128_16x16_32x32_2x2_8x32x1_8x32x1_1x32x1x8_8_1x1_intrawave_v3,811.84,276.04,0.0
gfx942,304,16896,4352,5120,ck,0,0,926.1933,a8w8_blockscale_1x128x128_256x128x128x128_16x16_32x32_2x2_8x32x1_8x32x1_1x32x1x8_8_1x1_intrawave_v3,812.96,276.24,0.0
gfx942,304,17024,4352,5120,ck,0,0,943.635,a8w8_blockscale_1x128x128_256x128x128x128_16x16_32x32_2x2_8x32x1_8x32x1_1x32x1x8_8_1x1_intrawave_v3,803.98,273.01,0.0
gfx942,304,17152,4352,5120,ck,0,0,941.4619,a8w8_blockscale_1x128x128_256x128x128x128_16x16_32x32_2x2_8x32x1_8x32x1_1x32x1x8_8_1x1_intrawave_v3,811.9,275.52,0.0
gfx942,304,17280,4352,5120,ck,0,0,944.8053,a8w8_blockscale_1x128x128_256x128x128x128_16x16_32x32_2x2_8x32x1_8x32x1_1x32x1x8_8_1x1_intrawave_v3,815.06,276.42,0.0
gfx942,304,17408,4352,5120,ck,0,0,959.3677,a8w8_blockscale_1x128x128_256x128x128x128_16x16_32x32_2x2_8x32x1_8x32x1_1x32x1x8_8_1x1_intrawave_v3,808.64,274.07,0.0
gfx942,304,17536,4352,5120,ck,0,0,994.8533,a8w8_blockscale_1x128x128_256x128x128x128_16x16_32x32_2x2_8x32x1_8x32x1_1x32x1x8_8_1x1_intrawave_v3,785.53,266.07,0.0
gfx942,304,17664,4352,5120,ck,0,0,974.2778,a8w8_blockscale_1x128x128_256x128x128x128_16x16_32x32_2x2_8x32x1_8x32x1_1x32x1x8_8_1x1_intrawave_v3,807.97,273.5,0.0
gfx942,304,17792,4352,5120,ck,0,0,983.814,a8w8_blockscale_1x128x128_256x128x128x128_16x16_32x32_2x2_8x32x1_8x32x1_1x32x1x8_8_1x1_intrawave_v3,805.94,272.65,0.0
gfx942,304,17920,4352,5120,ck,0,0,983.9561,a8w8_blockscale_1x128x128_256x128x128x128_16x16_32x32_2x2_8x32x1_8x32x1_1x32x1x8_8_1x1_intrawave_v3,811.62,274.41,0.0
gfx942,304,18048,4352,5120,ck,0,0,998.5103,a8w8_blockscale_1x128x128_256x128x128x128_16x16_32x32_2x2_8x32x1_8x32x1_1x32x1x8_8_1x1_intrawave_v3,805.5,272.18,0.0
gfx942,304,18176,4352,5120,ck,0,0,1002.9951,a8w8_blockscale_1x128x128_256x128x128x128_16x16_32x32_2x2_8x32x1_8x32x1_1x32x1x8_8_1x1_intrawave_v3,807.59,272.73,0.0
gfx942,304,18304,4352,5120,ck,0,0,1039.5745,a8w8_blockscale_1x128x128_256x128x128x128_16x16_32x32_2x2_8x32x1_8x32x1_1x32x1x8_8_1x1_intrawave_v3,784.66,264.84,0.0
gfx942,304,18432,4352,5120,ck,0,0,1007.3234,a8w8_blockscale_1x128x128_256x128x128x128_16x16_32x32_2x2_8x32x1_8x32x1_1x32x1x8_8_1x1_intrawave_v3,815.44,275.07,0.0
gfx942,304,18560,4352,5120,ck,0,0,1003.7557,a8w8_blockscale_1x128x128_256x128x128x128_16x16_32x32_2x2_8x32x1_8x32x1_1x32x1x8_8_1x1_intrawave_v3,824.02,277.81,0.0
gfx942,304,18688,4352,5120,ck,0,0,1044.5732,a8w8_blockscale_1x128x128_256x128x128x128_16x16_32x32_2x2_8x32x1_8x32x1_1x32x1x8_8_1x1_intrawave_v3,797.28,268.65,0.0
gfx942,304,18816,4352,5120,ck,0,0,1034.112,a8w8_blockscale_1x128x128_256x128x128x128_16x16_32x32_2x2_8x32x1_8x32x1_1x32x1x8_8_1x1_intrawave_v3,810.87,273.08,0.0
gfx942,304,18944,4352,5120,ck,0,0,1031.8217,a8w8_blockscale_1x128x128_256x128x128x128_16x16_32x32_2x2_8x32x1_8x32x1_1x32x1x8_8_1x1_intrawave_v3,818.19,275.4,0.0
gfx942,304,19072,4352,5120,ck,0,0,1051.1081,a8w8_blockscale_1x128x128_256x128x128x128_16x16_32x32_2x2_8x32x1_8x32x1_1x32x1x8_8_1x1_intrawave_v3,808.61,272.03,0.0
gfx942,304,19200,4352,5120,ck,0,0,1052.5501,a8w8_blockscale_1x128x128_256x128x128x128_16x16_32x32_2x2_8x32x1_8x32x1_1x32x1x8_8_1x1_intrawave_v3,812.92,273.34,0.0
gfx942,304,19328,4352,5120,ck,0,0,1051.1824,a8w8_blockscale_1x128x128_256x128x128x128_16x16_32x32_2x2_8x32x1_8x32x1_1x32x1x8_8_1x1_intrawave_v3,819.4,275.38,0.0
gfx942,304,19456,4352,5120,ck,0,0,1068.2984,a8w8_blockscale_1x128x128_256x128x128x128_16x16_32x32_2x2_8x32x1_8x32x1_1x32x1x8_8_1x1_intrawave_v3,811.61,272.62,0.0
gfx942,304,19584,4352,5120,ck,0,0,1070.1084,a8w8_blockscale_1x128x128_256x128x128x128_16x16_32x32_2x2_8x32x1_8x32x1_1x32x1x8_8_1x1_intrawave_v3,815.57,273.81,0.0
gfx942,304,19712,4352,5120,ck,0,0,1104.6944,a8w8_blockscale_1x128x128_256x128x128x128_16x16_32x32_2x2_8x32x1_8x32x1_1x32x1x8_8_1x1_intrawave_v3,795.2,266.84,0.0
gfx942,304,19840,4352,5120,ck,0,0,1077.0095,a8w8_blockscale_1x128x128_256x128x128x128_16x16_32x32_2x2_8x32x1_8x32x1_1x32x1x8_8_1x1_intrawave_v3,820.94,275.35,0.0
gfx942,304,19968,4352,5120,ck,0,0,1092.9014,a8w8_blockscale_1x128x128_256x128x128x128_16x16_32x32_2x2_8x32x1_8x32x1_1x32x1x8_8_1x1_intrawave_v3,814.22,272.96,0.0
gfx942,304,20096,4352,5120,ck,0,0,1103.458,a8w8_blockscale_1x128x128_256x128x128x128_16x16_32x32_2x2_8x32x1_8x32x1_1x32x1x8_8_1x1_intrawave_v3,811.6,271.95,0.0
gfx942,304,20224,4352,5120,ck,0,0,1101.8185,a8w8_blockscale_1x128x128_256x128x128x128_16x16_32x32_2x2_8x32x1_8x32x1_1x32x1x8_8_1x1_intrawave_v3,817.99,273.96,0.0
gfx942,304,20352,4352,5120,ck,0,0,1111.0094,a8w8_blockscale_1x128x128_256x128x128x128_16x16_32x32_2x2_8x32x1_8x32x1_1x32x1x8_8_1x1_intrawave_v3,816.35,273.29,0.0
gfx942,304,20480,4352,5120,ck,0,0,1106.9704,a8w8_blockscale_1x128x128_256x128x128x128_16x16_32x32_2x2_8x32x1_8x32x1_1x32x1x8_8_1x1_intrawave_v3,824.49,275.89,0.0
gfx942,304,20608,4352,5120,ck,0,0,1125.8547,a8w8_blockscale_1x128x128_256x128x128x128_16x16_32x32_2x2_8x32x1_8x32x1_1x32x1x8_8_1x1_intrawave_v3,815.72,272.83,0.0
gfx942,304,20736,4352,5120,ck,0,0,1136.8693,a8w8_blockscale_1x128x128_256x128x128x128_16x16_32x32_2x2_8x32x1_8x32x1_1x32x1x8_8_1x1_intrawave_v3,812.84,271.74,0.0
gfx942,304,20864,4352,5120,ck,0,0,1149.2383,a8w8_blockscale_1x128x128_256x128x128x128_16x16_32x32_2x2_8x32x1_8x32x1_1x32x1x8_8_1x1_intrawave_v3,809.05,270.36,0.0
gfx942,304,20992,4352,5120,ck,0,0,1144.3326,a8w8_blockscale_1x128x128_256x128x128x128_16x16_32x32_2x2_8x32x1_8x32x1_1x32x1x8_8_1x1_intrawave_v3,817.5,273.06,0.0
gfx942,304,21120,4352,5120,ck,0,0,1153.1274,a8w8_blockscale_1x128x128_256x128x128x128_16x16_32x32_2x2_8x32x1_8x32x1_1x32x1x8_8_1x1_intrawave_v3,816.22,272.52,0.0
gfx942,304,21248,4352,5120,ck,0,0,1161.4908,a8w8_blockscale_1x128x128_256x128x128x128_16x16_32x32_2x2_8x32x1_8x32x1_1x32x1x8_8_1x1_intrawave_v3,815.25,272.08,0.0
gfx942,304,21376,4352,5120,ck,0,0,1208.9772,a8w8_blockscale_1x128x128_256x128x128x128_16x16_32x32_2x2_8x32x1_8x32x1_1x32x1x8_8_1x1_intrawave_v3,787.95,262.85,0.0
gfx942,304,21504,4352,5120,ck,0,0,1167.3883,a8w8_blockscale_1x128x128_256x128x128x128_16x16_32x32_2x2_8x32x1_8x32x1_1x32x1x8_8_1x1_intrawave_v3,820.9,273.73,0.0
gfx942,304,21632,4352,5120,ck,0,0,1191.6148,a8w8_blockscale_1x128x128_256x128x128x128_16x16_32x32_2x2_8x32x1_8x32x1_1x32x1x8_8_1x1_intrawave_v3,809.0,269.65,0.0
gfx942,304,21760,4352,5120,ck,0,0,1191.2021,a8w8_blockscale_1x128x128_256x128x128x128_16x16_32x32_2x2_8x32x1_8x32x1_1x32x1x8_8_1x1_intrawave_v3,814.07,271.23,0.0
gfx942,304,21888,4352,5120,ck,0,0,1194.5289,a8w8_blockscale_1x128x128_256x128x128x128_16x16_32x32_2x2_8x32x1_8x32x1_1x32x1x8_8_1x1_intrawave_v3,816.58,271.96,0.0
gfx942,304,22016,4352,5120,ck,0,0,1195.24,a8w8_blockscale_1x128x128_256x128x128x128_16x16_32x32_2x2_8x32x1_8x32x1_1x32x1x8_8_1x1_intrawave_v3,820.87,273.28,0.0
gfx942,304,22144,4352,5120,ck,0,0,1210.5521,a8w8_blockscale_1x128x128_256x128x128x128_16x16_32x32_2x2_8x32x1_8x32x1_1x32x1x8_8_1x1_intrawave_v3,815.19,271.28,0.0
gfx942,304,22272,4352,5120,ck,0,0,1218.4362,a8w8_blockscale_1x128x128_256x128x128x128_16x16_32x32_2x2_8x32x1_8x32x1_1x32x1x8_8_1x1_intrawave_v3,814.6,270.98,0.0
gfx942,304,22400,4352,5120,ck,0,0,1215.8518,a8w8_blockscale_1x128x128_256x128x128x128_16x16_32x32_2x2_8x32x1_8x32x1_1x32x1x8_8_1x1_intrawave_v3,821.02,273.01,0.0
gfx942,304,22528,4352,5120,ck,0,0,1220.2917,a8w8_blockscale_1x128x128_256x128x128x128_16x16_32x32_2x2_8x32x1_8x32x1_1x32x1x8_8_1x1_intrawave_v3,822.71,273.47,0.0
gfx942,304,22656,4352,5120,ck,0,0,1248.2746,a8w8_blockscale_1x128x128_256x128x128x128_16x16_32x32_2x2_8x32x1_8x32x1_1x32x1x8_8_1x1_intrawave_v3,808.84,268.75,0.0
gfx942,304,22784,4352,5120,ck,0,0,1249.9194,a8w8_blockscale_1x128x128_256x128x128x128_16x16_32x32_2x2_8x32x1_8x32x1_1x32x1x8_8_1x1_intrawave_v3,812.34,269.82,0.0
gfx942,304,22912,4352,5120,ck,0,0,1247.5526,a8w8_blockscale_1x128x128_256x128x128x128_16x16_32x32_2x2_8x32x1_8x32x1_1x32x1x8_8_1x1_intrawave_v3,818.45,271.75,0.0
gfx942,304,23040,4352,5120,ck,0,0,1259.3478,a8w8_blockscale_1x128x128_256x128x128x128_16x16_32x32_2x2_8x32x1_8x32x1_1x32x1x8_8_1x1_intrawave_v3,815.32,270.61,0.0
gfx942,304,23168,4352,5120,ck,0,0,1271.5326,a8w8_blockscale_1x128x128_256x128x128x128_16x16_32x32_2x2_8x32x1_8x32x1_1x32x1x8_8_1x1_intrawave_v3,811.99,269.4,0.0
gfx942,304,23296,4352,5120,ck,0,0,1262.7455,a8w8_blockscale_1x128x128_256x128x128x128_16x16_32x32_2x2_8x32x1_8x32x1_1x32x1x8_8_1x1_intrawave_v3,822.16,272.68,0.0
gfx942,304,23424,4352,5120,ck,0,0,1265.6605,a8w8_blockscale_1x128x128_256x128x128x128_16x16_32x32_2x2_8x32x1_8x32x1_1x32x1x8_8_1x1_intrawave_v3,824.77,273.45,0.0
gfx942,304,23552,4352,5120,ck,0,0,1281.1305,a8w8_blockscale_1x128x128_256x128x128x128_16x16_32x32_2x2_8x32x1_8x32x1_1x32x1x8_8_1x1_intrawave_v3,819.26,271.53,0.0
gfx942,304,23680,4352,5120,ck,0,0,1296.8178,a8w8_blockscale_1x128x128_256x128x128x128_16x16_32x32_2x2_8x32x1_8x32x1_1x32x1x8_8_1x1_intrawave_v3,813.75,269.61,0.0
gfx942,304,23808,4352,5120,ck,0,0,1296.5936,a8w8_blockscale_1x128x128_256x128x128x128_16x16_32x32_2x2_8x32x1_8x32x1_1x32x1x8_8_1x1_intrawave_v3,818.29,271.02,0.0
gfx942,304,23936,4352,5120,ck,0,0,1300.4561,a8w8_blockscale_1x128x128_256x128x128x128_16x16_32x32_2x2_8x32x1_8x32x1_1x32x1x8_8_1x1_intrawave_v3,820.25,271.58,0.0
gfx942,304,24064,4352,5120,ck,0,0,1313.0626,a8w8_blockscale_1x128x128_256x128x128x128_16x16_32x32_2x2_8x32x1_8x32x1_1x32x1x8_8_1x1_intrawave_v3,816.72,270.32,0.0
gfx942,304,24192,4352,5120,ck,0,0,1303.2641,a8w8_blockscale_1x128x128_256x128x128x128_16x16_32x32_2x2_8x32x1_8x32x1_1x32x1x8_8_1x1_intrawave_v3,827.23,273.71,0.0
gfx942,304,24320,4352,5120,ck,0,0,1323.4269,a8w8_blockscale_1x128x128_256x128x128x128_16x16_32x32_2x2_8x32x1_8x32x1_1x32x1x8_8_1x1_intrawave_v3,818.94,270.87,0.0
gfx942,304,24448,4352,5120,ck,0,0,1336.6961,a8w8_blockscale_1x128x128_256x128x128x128_16x16_32x32_2x2_8x32x1_8x32x1_1x32x1x8_8_1x1_intrawave_v3,815.08,269.51,0.0
gfx942,304,24576,4352,5120,ck,0,0,1341.4856,a8w8_blockscale_1x128x128_256x128x128x128_16x16_32x32_2x2_8x32x1_8x32x1_1x32x1x8_8_1x1_intrawave_v3,816.42,269.87,0.0
gfx942,304,24704,4352,5120,ck,0,0,1349.7013,a8w8_blockscale_1x128x128_256x128x128x128_16x16_32x32_2x2_8x32x1_8x32x1_1x32x1x8_8_1x1_intrawave_v3,815.68,269.53,0.0
gfx942,304,24832,4352,5120,ck,0,0,1354.1686,a8w8_blockscale_1x128x128_256x128x128x128_16x16_32x32_2x2_8x32x1_8x32x1_1x32x1x8_8_1x1_intrawave_v3,817.2,269.95,0.0
gfx942,304,24960,4352,5120,ck,0,0,1399.921,a8w8_blockscale_1x128x128_256x128x128x128_16x16_32x32_2x2_8x32x1_8x32x1_1x32x1x8_8_1x1_intrawave_v3,794.57,262.39,0.0
gfx942,304,25088,4352,5120,ck,0,0,1380.7122,a8w8_blockscale_1x128x128_256x128x128x128_16x16_32x32_2x2_8x32x1_8x32x1_1x32x1x8_8_1x1_intrawave_v3,809.75,267.32,0.0
gfx942,304,25216,4352,5120,ck,0,0,1369.4761,a8w8_blockscale_1x128x128_256x128x128x128_16x16_32x32_2x2_8x32x1_8x32x1_1x32x1x8_8_1x1_intrawave_v3,820.56,270.81,0.0
gfx942,304,25344,4352,5120,ck,0,0,1409.002,a8w8_blockscale_1x128x128_256x128x128x128_16x16_32x32_2x2_8x32x1_8x32x1_1x32x1x8_8_1x1_intrawave_v3,801.59,264.47,0.0
gfx942,304,25472,4352,5120,ck,0,0,1389.7327,a8w8_blockscale_1x128x128_256x128x128x128_16x16_32x32_2x2_8x32x1_8x32x1_1x32x1x8_8_1x1_intrawave_v3,816.81,269.41,0.0
gfx942,304,25600,4352,5120,ck,0,0,1384.2746,a8w8_blockscale_1x128x128_256x128x128x128_16x16_32x32_2x2_8x32x1_8x32x1_1x32x1x8_8_1x1_intrawave_v3,824.15,271.75,0.0
gfx942,304,25728,4352,5120,ck,0,0,1445.1253,a8w8_blockscale_1x128x128_256x128x128x128_16x16_32x32_2x2_8x32x1_8x32x1_1x32x1x8_8_1x1_intrawave_v3,793.39,261.53,0.0
gfx942,304,25856,4352,5120,ck,0,0,1416.3496,a8w8_blockscale_1x128x128_256x128x128x128_16x16_32x32_2x2_8x32x1_8x32x1_1x32x1x8_8_1x1_intrawave_v3,813.54,268.09,0.0
gfx942,304,25984,4352,5120,ck,0,0,1406.7315,a8w8_blockscale_1x128x128_256x128x128x128_16x16_32x32_2x2_8x32x1_8x32x1_1x32x1x8_8_1x1_intrawave_v3,823.16,271.19,0.0
gfx942,304,26112,4352,5120,ck,0,0,1420.2136,a8w8_blockscale_1x128x128_256x128x128x128_16x16_32x32_2x2_8x32x1_8x32x1_1x32x1x8_8_1x1_intrawave_v3,819.36,269.86,0.0
gfx942,304,26240,4352,5120,ck,0,0,1428.8681,a8w8_blockscale_1x128x128_256x128x128x128_16x16_32x32_2x2_8x32x1_8x32x1_1x32x1x8_8_1x1_intrawave_v3,818.39,269.46,0.0
gfx942,304,26368,4352,5120,ck,0,0,1425.3771,a8w8_blockscale_1x128x128_256x128x128x128_16x16_32x32_2x2_8x32x1_8x32x1_1x32x1x8_8_1x1_intrawave_v3,824.4,271.36,0.0
gfx942,304,26496,4352,5120,ck,0,0,1432.4416,a8w8_blockscale_1x128x128_256x128x128x128_16x16_32x32_2x2_8x32x1_8x32x1_1x32x1x8_8_1x1_intrawave_v3,824.31,271.26,0.0
gfx942,304,26624,4352,5120,ck,0,0,1457.0583,a8w8_blockscale_1x128x128_256x128x128x128_16x16_32x32_2x2_8x32x1_8x32x1_1x32x1x8_8_1x1_intrawave_v3,814.3,267.89,0.0
gfx942,304,26752,4352,5120,ck,0,0,1465.5417,a8w8_blockscale_1x128x128_256x128x128x128_16x16_32x32_2x2_8x32x1_8x32x1_1x32x1x8_8_1x1_intrawave_v3,813.48,267.55,0.0
gfx942,304,26880,4352,5120,ck,0,0,1473.3879,a8w8_blockscale_1x128x128_256x128x128x128_16x16_32x32_2x2_8x32x1_8x32x1_1x32x1x8_8_1x1_intrawave_v3,813.02,267.32,0.0
gfx942,304,27008,4352,5120,ck,0,0,1478.0865,a8w8_blockscale_1x128x128_256x128x128x128_16x16_32x32_2x2_8x32x1_8x32x1_1x32x1x8_8_1x1_intrawave_v3,814.29,267.67,0.0
gfx942,304,27136,4352,5120,ck,0,0,1478.2448,a8w8_blockscale_1x128x128_256x128x128x128_16x16_32x32_2x2_8x32x1_8x32x1_1x32x1x8_8_1x1_intrawave_v3,818.07,268.84,0.0
gfx942,304,27264,4352,5120,ck,0,0,1491.399,a8w8_blockscale_1x128x128_256x128x128x128_16x16_32x32_2x2_8x32x1_8x32x1_1x32x1x8_8_1x1_intrawave_v3,814.68,267.65,0.0
gfx942,304,27392,4352,5120,ck,0,0,1488.3014,a8w8_blockscale_1x128x128_256x128x128x128_16x16_32x32_2x2_8x32x1_8x32x1_1x32x1x8_8_1x1_intrawave_v3,820.2,269.4,0.0
gfx942,304,27520,4352,5120,ck,0,0,1486.4762,a8w8_blockscale_1x128x128_256x128x128x128_16x16_32x32_2x2_8x32x1_8x32x1_1x32x1x8_8_1x1_intrawave_v3,825.05,270.92,0.0
gfx942,304,27648,4352,5120,ck,0,0,1501.4046,a8w8_blockscale_1x128x128_256x128x128x128_16x16_32x32_2x2_8x32x1_8x32x1_1x32x1x8_8_1x1_intrawave_v3,820.64,269.41,0.0
gfx942,304,27776,4352,5120,ck,0,0,1503.5157,a8w8_blockscale_1x128x128_256x128x128x128_16x16_32x32_2x2_8x32x1_8x32x1_1x32x1x8_8_1x1_intrawave_v3,823.29,270.21,0.0
gfx942,304,27904,4352,5120,ck,0,0,1508.845,a8w8_blockscale_1x128x128_256x128x128x128_16x16_32x32_2x2_8x32x1_8x32x1_1x32x1x8_8_1x1_intrawave_v3,824.16,270.42,0.0
gfx942,304,28032,4352,5120,ck,0,0,1572.9321,a8w8_blockscale_1x128x128_256x128x128x128_16x16_32x32_2x2_8x32x1_8x32x1_1x32x1x8_8_1x1_intrawave_v3,794.21,260.53,0.0
gfx942,304,28160,4352,5120,ck,0,0,1520.6622,a8w8_blockscale_1x128x128_256x128x128x128_16x16_32x32_2x2_8x32x1_8x32x1_1x32x1x8_8_1x1_intrawave_v3,825.26,270.65,0.0
gfx942,304,28288,4352,5120,ck,0,0,1550.4482,a8w8_blockscale_1x128x128_256x128x128x128_16x16_32x32_2x2_8x32x1_8x32x1_1x32x1x8_8_1x1_intrawave_v3,813.08,266.59,0.0
gfx942,304,28416,4352,5120,ck,0,0,1540.6076,a8w8_blockscale_1x128x128_256x128x128x128_16x16_32x32_2x2_8x32x1_8x32x1_1x32x1x8_8_1x1_intrawave_v3,821.98,269.44,0.0
gfx942,304,28544,4352,5120,ck,0,0,1595.9883,a8w8_blockscale_1x128x128_256x128x128x128_16x16_32x32_2x2_8x32x1_8x32x1_1x32x1x8_8_1x1_intrawave_v3,797.03,261.2,0.0
gfx942,304,28672,4352,5120,ck,0,0,1558.54,a8w8_blockscale_1x128x128_256x128x128x128_16x16_32x32_2x2_8x32x1_8x32x1_1x32x1x8_8_1x1_intrawave_v3,819.84,268.61,0.0
gfx942,304,28800,4352,5120,ck,0,0,1580.1925,a8w8_blockscale_1x128x128_256x128x128x128_16x16_32x32_2x2_8x32x1_8x32x1_1x32x1x8_8_1x1_intrawave_v3,812.22,266.05,0.0
gfx942,304,28928,4352,5120,ck,0,0,1586.6492,a8w8_blockscale_1x128x128_256x128x128x128_16x16_32x32_2x2_8x32x1_8x32x1_1x32x1x8_8_1x1_intrawave_v3,812.51,266.08,0.0
gfx942,304,29056,4352,5120,ck,0,0,1590.2574,a8w8_blockscale_1x128x128_256x128x128x128_16x16_32x32_2x2_8x32x1_8x32x1_1x32x1x8_8_1x1_intrawave_v3,814.25,266.59,0.0
gfx942,304,29184,4352,5120,ck,0,0,1586.4921,a8w8_blockscale_1x128x128_256x128x128x128_16x16_32x32_2x2_8x32x1_8x32x1_1x32x1x8_8_1x1_intrawave_v3,819.78,268.34,0.0
gfx942,304,29312,4352,5120,ck,0,0,1596.9297,a8w8_blockscale_1x128x128_256x128x128x128_16x16_32x32_2x2_8x32x1_8x32x1_1x32x1x8_8_1x1_intrawave_v3,817.99,267.7,0.0
gfx942,304,29440,4352,5120,ck,0,0,1618.6743,a8w8_blockscale_1x128x128_256x128x128x128_16x16_32x32_2x2_8x32x1_8x32x1_1x32x1x8_8_1x1_intrawave_v3,810.53,265.19,0.0
gfx942,304,29568,4352,5120,ck,0,0,1598.4046,a8w8_blockscale_1x128x128_256x128x128x128_16x16_32x32_2x2_8x32x1_8x32x1_1x32x1x8_8_1x1_intrawave_v3,824.37,269.66,0.0
gfx942,304,29696,4352,5120,ck,0,0,1603.0648,a8w8_blockscale_1x128x128_256x128x128x128_16x16_32x32_2x2_8x32x1_8x32x1_1x32x1x8_8_1x1_intrawave_v3,825.54,269.98,0.0
gfx942,304,29824,4352,5120,ck,0,0,1633.3325,a8w8_blockscale_1x128x128_256x128x128x128_16x16_32x32_2x2_8x32x1_8x32x1_1x32x1x8_8_1x1_intrawave_v3,813.73,266.06,0.0
gfx942,304,29952,4352,5120,ck,0,0,1623.0452,a8w8_blockscale_1x128x128_256x128x128x128_16x16_32x32_2x2_8x32x1_8x32x1_1x32x1x8_8_1x1_intrawave_v3,822.4,268.84,0.0
gfx942,304,30080,4352,5120,ck,0,0,1630.9181,a8w8_blockscale_1x128x128_256x128x128x128_16x16_32x32_2x2_8x32x1_8x32x1_1x32x1x8_8_1x1_intrawave_v3,821.93,268.63,0.0
gfx942,304,30208,4352,5120,ck,0,0,1641.8423,a8w8_blockscale_1x128x128_256x128x128x128_16x16_32x32_2x2_8x32x1_8x32x1_1x32x1x8_8_1x1_intrawave_v3,819.93,267.92,0.0
gfx942,304,30336,4352,5120,ck,0,0,1653.505,a8w8_blockscale_1x128x128_256x128x128x128_16x16_32x32_2x2_8x32x1_8x32x1_1x32x1x8_8_1x1_intrawave_v3,817.6,267.1,0.0
gfx942,304,30464,4352,5120,ck,0,0,1644.4349,a8w8_blockscale_1x128x128_256x128x128x128_16x16_32x32_2x2_8x32x1_8x32x1_1x32x1x8_8_1x1_intrawave_v3,825.58,269.65,0.0
gfx942,304,30592,4352,5120,ck,0,0,1666.0408,a8w8_blockscale_1x128x128_256x128x128x128_16x16_32x32_2x2_8x32x1_8x32x1_1x32x1x8_8_1x1_intrawave_v3,818.3,267.21,0.0
gfx942,304,30720,4352,5120,ck,0,0,1674.0594,a8w8_blockscale_1x128x128_256x128x128x128_16x16_32x32_2x2_8x32x1_8x32x1_1x32x1x8_8_1x1_intrawave_v3,817.79,266.99,0.0
gfx942,304,30848,4352,5120,ck,0,0,1686.8398,a8w8_blockscale_1x128x128_256x128x128x128_16x16_32x32_2x2_8x32x1_8x32x1_1x32x1x8_8_1x1_intrawave_v3,814.97,266.02,0.0
gfx942,304,30976,4352,5120,ck,0,0,1690.4433,a8w8_blockscale_1x128x128_256x128x128x128_16x16_32x32_2x2_8x32x1_8x32x1_1x32x1x8_8_1x1_intrawave_v3,816.61,266.49,0.0
gfx942,304,31104,4352,5120,ck,0,0,1713.5231,a8w8_blockscale_1x128x128_256x128x128x128_16x16_32x32_2x2_8x32x1_8x32x1_1x32x1x8_8_1x1_intrawave_v3,808.94,263.94,0.0
gfx942,304,31232,4352,5120,ck,0,0,1705.5741,a8w8_blockscale_1x128x128_256x128x128x128_16x16_32x32_2x2_8x32x1_8x32x1_1x32x1x8_8_1x1_intrawave_v3,816.05,266.21,0.0
gfx942,304,31360,4352,5120,ck,0,0,1714.3406,a8w8_blockscale_1x128x128_256x128x128x128_16x16_32x32_2x2_8x32x1_8x32x1_1x32x1x8_8_1x1_intrawave_v3,815.21,265.88,0.0
gfx942,304,31488,4352,5120,ck,0,0,1708.8776,a8w8_blockscale_1x128x128_256x128x128x128_16x16_32x32_2x2_8x32x1_8x32x1_1x32x1x8_8_1x1_intrawave_v3,821.15,267.76,0.0
gfx942,304,31616,4352,5120,ck,0,0,1704.0595,a8w8_blockscale_1x128x128_256x128x128x128_16x16_32x32_2x2_8x32x1_8x32x1_1x32x1x8_8_1x1_intrawave_v3,826.82,269.56,0.0
gfx942,304,31744,4352,5120,ck,0,0,1725.3235,a8w8_blockscale_1x128x128_256x128x128x128_16x16_32x32_2x2_8x32x1_8x32x1_1x32x1x8_8_1x1_intrawave_v3,819.94,267.26,0.0
gfx942,304,31872,4352,5120,ck,0,0,1721.3387,a8w8_blockscale_1x128x128_256x128x128x128_16x16_32x32_2x2_8x32x1_8x32x1_1x32x1x8_8_1x1_intrawave_v3,825.15,268.91,0.0
gfx942,304,32000,4352,5120,ck,0,0,1742.2438,a8w8_blockscale_1x128x128_256x128x128x128_16x16_32x32_2x2_8x32x1_8x32x1_1x32x1x8_8_1x1_intrawave_v3,818.52,266.7,0.0
gfx942,304,32128,4352,5120,ck,0,0,1741.5676,a8w8_blockscale_1x128x128_256x128x128x128_16x16_32x32_2x2_8x32x1_8x32x1_1x32x1x8_8_1x1_intrawave_v3,822.11,267.82,0.0
gfx942,304,32256,4352,5120,ck,0,0,1799.5745,a8w8_blockscale_1x128x128_256x128x128x128_16x16_32x32_2x2_8x32x1_8x32x1_1x32x1x8_8_1x1_intrawave_v3,798.78,260.17,0.0
gfx942,304,32384,4352,5120,ck,0,0,1770.2365,a8w8_blockscale_1x128x128_256x128x128x128_16x16_32x32_2x2_8x32x1_8x32x1_1x32x1x8_8_1x1_intrawave_v3,815.24,265.48,0.0
gfx942,304,32512,4352,5120,ck,0,0,1763.8719,a8w8_blockscale_1x128x128_256x128x128x128_16x16_32x32_2x2_8x32x1_8x32x1_1x32x1x8_8_1x1_intrawave_v3,821.42,267.44,0.0
gfx942,304,32640,4352,5120,ck,0,0,1768.3322,a8w8_blockscale_1x128x128_256x128x128x128_16x16_32x32_2x2_8x32x1_8x32x1_1x32x1x8_8_1x1_intrawave_v3,822.57,267.77,0.0
gfx942,304,32768,4352,5120,ck,0,0,1771.2694,a8w8_blockscale_1x128x128_256x128x128x128_16x16_32x32_2x2_8x32x1_8x32x1_1x32x1x8_8_1x1_intrawave_v3,824.43,268.32,0.0
gfx942,304,32896,4352,5120,ck,0,0,1787.5195,a8w8_blockscale_1x128x128_256x128x128x128_16x16_32x32_2x2_8x32x1_8x32x1_1x32x1x8_8_1x1_intrawave_v3,820.13,266.87,0.0
gfx942,304,33024,4352,5120,ck,0,0,1802.767,a8w8_blockscale_1x128x128_256x128x128x128_16x16_32x32_2x2_8x32x1_8x32x1_1x32x1x8_8_1x1_intrawave_v3,816.35,265.6,0.0
gfx942,304,33152,4352,5120,ck,0,0,1816.0239,a8w8_blockscale_1x128x128_256x128x128x128_16x16_32x32_2x2_8x32x1_8x32x1_1x32x1x8_8_1x1_intrawave_v3,813.54,264.63,0.0
gfx942,304,33280,4352,5120,ck,0,0,1821.9308,a8w8_blockscale_1x128x128_256x128x128x128_16x16_32x32_2x2_8x32x1_8x32x1_1x32x1x8_8_1x1_intrawave_v3,814.03,264.74,0.0
gfx942,304,33408,4352,5120,ck,0,0,1828.2588,a8w8_blockscale_1x128x128_256x128x128x128_16x16_32x32_2x2_8x32x1_8x32x1_1x32x1x8_8_1x1_intrawave_v3,814.33,264.8,0.0
gfx942,304,33536,4352,5120,ck,0,0,1822.5437,a8w8_blockscale_1x128x128_256x128x128x128_16x16_32x32_2x2_8x32x1_8x32x1_1x32x1x8_8_1x1_intrawave_v3,820.02,266.6,0.0
gfx942,304,33664,4352,5120,ck,0,0,1824.2251,a8w8_blockscale_1x128x128_256x128x128x128_16x16_32x32_2x2_8x32x1_8x32x1_1x32x1x8_8_1x1_intrawave_v3,822.39,267.32,0.0
gfx942,304,33792,4352,5120,ck,0,0,1832.5878,a8w8_blockscale_1x128x128_256x128x128x128_16x16_32x32_2x2_8x32x1_8x32x1_1x32x1x8_8_1x1_intrawave_v3,821.75,267.07,0.0
gfx942,304,33920,4352,5120,ck,0,0,1894.5165,a8w8_blockscale_1x128x128_256x128x128x128_16x16_32x32_2x2_8x32x1_8x32x1_1x32x1x8_8_1x1_intrawave_v3,797.9,259.27,0.0
gfx942,304,34048,4352,5120,ck,0,0,1865.1928,a8w8_blockscale_1x128x128_256x128x128x128_16x16_32x32_2x2_8x32x1_8x32x1_1x32x1x8_8_1x1_intrawave_v3,813.5,264.3,0.0
gfx942,304,34176,4352,5120,ck,0,0,1851.4626,a8w8_blockscale_1x128x128_256x128x128x128_16x16_32x32_2x2_8x32x1_8x32x1_1x32x1x8_8_1x1_intrawave_v3,822.61,267.21,0.0
gfx942,304,34304,4352,5120,ck,0,0,1863.87,a8w8_blockscale_1x128x128_256x128x128x128_16x16_32x32_2x2_8x32x1_8x32x1_1x32x1x8_8_1x1_intrawave_v3,820.2,266.38,0.0
gfx942,304,34432,4352,5120,ck,0,0,1888.2626,a8w8_blockscale_1x128x128_256x128x128x128_16x16_32x32_2x2_8x32x1_8x32x1_1x32x1x8_8_1x1_intrawave_v3,812.62,263.88,0.0
gfx942,304,34560,4352,5120,ck,0,0,1925.3222,a8w8_blockscale_1x128x128_256x128x128x128_16x16_32x32_2x2_8x32x1_8x32x1_1x32x1x8_8_1x1_intrawave_v3,799.94,259.72,0.0
gfx942,304,34688,4352,5120,ck,0,0,1885.0042,a8w8_blockscale_1x128x128_256x128x128x128_16x16_32x32_2x2_8x32x1_8x32x1_1x32x1x8_8_1x1_intrawave_v3,820.08,266.21,0.0
gfx942,304,34816,4352,5120,ck,0,0,1884.9806,a8w8_blockscale_1x128x128_256x128x128x128_16x16_32x32_2x2_8x32x1_8x32x1_1x32x1x8_8_1x1_intrawave_v3,823.12,267.15,0.0
gfx942,304,34944,4352,5120,ck,0,0,1915.8427,a8w8_blockscale_1x128x128_256x128x128x128_16x16_32x32_2x2_8x32x1_8x32x1_1x32x1x8_8_1x1_intrawave_v3,812.83,263.77,0.0
gfx942,304,35072,4352,5120,ck,0,0,1963.4072,a8w8_blockscale_1x128x128_256x128x128x128_16x16_32x32_2x2_8x32x1_8x32x1_1x32x1x8_8_1x1_intrawave_v3,796.05,258.28,0.0
gfx942,304,35200,4352,5120,ck,0,0,1967.0408,a8w8_blockscale_1x128x128_256x128x128x128_16x16_32x32_2x2_8x32x1_8x32x1_1x32x1x8_8_1x1_intrawave_v3,797.48,258.71,0.0
gfx942,304,35328,4352,5120,ck,0,0,1919.7669,a8w8_blockscale_1x128x128_256x128x128x128_16x16_32x32_2x2_8x32x1_8x32x1_1x32x1x8_8_1x1_intrawave_v3,820.09,266.0,0.0
gfx942,304,35456,4352,5120,ck,0,0,1946.7864,a8w8_blockscale_1x128x128_256x128x128x128_16x16_32x32_2x2_8x32x1_8x32x1_1x32x1x8_8_1x1_intrawave_v3,811.63,263.22,0.0
gfx942,304,35584,4352,5120,ck,0,0,1930.346,a8w8_blockscale_1x128x128_256x128x128x128_16x16_32x32_2x2_8x32x1_8x32x1_1x32x1x8_8_1x1_intrawave_v3,821.5,266.37,0.0
gfx942,304,35712,4352,5120,ck,0,0,1940.7892,a8w8_blockscale_1x128x128_256x128x128x128_16x16_32x32_2x2_8x32x1_8x32x1_1x32x1x8_8_1x1_intrawave_v3,820.02,265.85,0.0
gfx942,304,35840,4352,5120,ck,0,0,1938.73,a8w8_blockscale_1x128x128_256x128x128x128_16x16_32x32_2x2_8x32x1_8x32x1_1x32x1x8_8_1x1_intrawave_v3,823.83,267.05,0.0
gfx942,304,35968,4352,5120,ck,0,0,1953.4397,a8w8_blockscale_1x128x128_256x128x128x128_16x16_32x32_2x2_8x32x1_8x32x1_1x32x1x8_8_1x1_intrawave_v3,820.55,265.94,0.0
gfx942,304,36096,4352,5120,ck,0,0,1957.6492,a8w8_blockscale_1x128x128_256x128x128x128_16x16_32x32_2x2_8x32x1_8x32x1_1x32x1x8_8_1x1_intrawave_v3,821.7,266.28,0.0
gfx942,304,36224,4352,5120,ck,0,0,1991.7784,a8w8_blockscale_1x128x128_256x128x128x128_16x16_32x32_2x2_8x32x1_8x32x1_1x32x1x8_8_1x1_intrawave_v3,810.48,262.6,0.0
gfx942,304,36352,4352,5120,ck,0,0,1973.0036,a8w8_blockscale_1x128x128_256x128x128x128_16x16_32x32_2x2_8x32x1_8x32x1_1x32x1x8_8_1x1_intrawave_v3,821.09,266.0,0.0
gfx942,304,36480,4352,5120,ck,0,0,1999.636,a8w8_blockscale_1x128x128_256x128x128x128_16x16_32x32_2x2_8x32x1_8x32x1_1x32x1x8_8_1x1_intrawave_v3,813.0,263.34,0.0
gfx942,304,36608,4352,5120,ck,0,0,2000.8948,a8w8_blockscale_1x128x128_256x128x128x128_16x16_32x32_2x2_8x32x1_8x32x1_1x32x1x8_8_1x1_intrawave_v3,815.34,264.06,0.0
gfx942,304,36736,4352,5120,ck,0,0,2002.6721,a8w8_blockscale_1x128x128_256x128x128x128_16x16_32x32_2x2_8x32x1_8x32x1_1x32x1x8_8_1x1_intrawave_v3,817.47,264.71,0.0
gfx942,304,36864,4352,5120,ck,0,0,2007.5104,a8w8_blockscale_1x128x128_256x128x128x128_16x16_32x32_2x2_8x32x1_8x32x1_1x32x1x8_8_1x1_intrawave_v3,818.34,264.95,0.0
gfx942,304,36992,4352,5120,ck,0,0,2023.8602,a8w8_blockscale_1x128x128_256x128x128x128_16x16_32x32_2x2_8x32x1_8x32x1_1x32x1x8_8_1x1_intrawave_v3,814.55,263.68,0.0
gfx942,304,37120,4352,5120,ck,0,0,2017.4052,a8w8_blockscale_1x128x128_256x128x128x128_16x16_32x32_2x2_8x32x1_8x32x1_1x32x1x8_8_1x1_intrawave_v3,819.98,265.4,0.0
gfx942,304,37248,4352,5120,ck,0,0,2043.4651,a8w8_blockscale_1x128x128_256x128x128x128_16x16_32x32_2x2_8x32x1_8x32x1_1x32x1x8_8_1x1_intrawave_v3,812.32,262.89,0.0
gfx942,304,37376,4352,5120,ck,0,0,2053.6288,a8w8_blockscale_1x128x128_256x128x128x128_16x16_32x32_2x2_8x32x1_8x32x1_1x32x1x8_8_1x1_intrawave_v3,811.07,262.45,0.0
gfx942,304,37504,4352,5120,ck,0,0,2066.4955,a8w8_blockscale_1x128x128_256x128x128x128_16x16_32x32_2x2_8x32x1_8x32x1_1x32x1x8_8_1x1_intrawave_v3,808.78,261.67,0.0
gfx942,304,37632,4352,5120,ck,0,0,2052.5081,a8w8_blockscale_1x128x128_256x128x128x128_16x16_32x32_2x2_8x32x1_8x32x1_1x32x1x8_8_1x1_intrawave_v3,817.07,264.31,0.0
gfx942,304,37760,4352,5120,ck,0,0,2061.5259,a8w8_blockscale_1x128x128_256x128x128x128_16x16_32x32_2x2_8x32x1_8x32x1_1x32x1x8_8_1x1_intrawave_v3,816.27,264.02,0.0
gfx942,304,37888,4352,5120,ck,0,0,2059.6812,a8w8_blockscale_1x128x128_256x128x128x128_16x16_32x32_2x2_8x32x1_8x32x1_1x32x1x8_8_1x1_intrawave_v3,819.77,265.11,0.0
gfx942,304,38016,4352,5120,ck,0,0,2084.2631,a8w8_blockscale_1x128x128_256x128x128x128_16x16_32x32_2x2_8x32x1_8x32x1_1x32x1x8_8_1x1_intrawave_v3,812.84,262.83,0.0
gfx942,304,38144,4352,5120,ck,0,0,2085.7044,a8w8_blockscale_1x128x128_256x128x128x128_16x16_32x32_2x2_8x32x1_8x32x1_1x32x1x8_8_1x1_intrawave_v3,815.01,263.5,0.0
gfx942,304,38272,4352,5120,ck,0,0,2103.9983,a8w8_blockscale_1x128x128_256x128x128x128_16x16_32x32_2x2_8x32x1_8x32x1_1x32x1x8_8_1x1_intrawave_v3,810.63,262.05,0.0
gfx942,304,38400,4352,5120,ck,0,0,2103.9827,a8w8_blockscale_1x128x128_256x128x128x128_16x16_32x32_2x2_8x32x1_8x32x1_1x32x1x8_8_1x1_intrawave_v3,813.35,262.89,0.0
gfx942,304,38528,4352,5120,ck,0,0,2171.5795,a8w8_blockscale_1x128x128_256x128x128x128_16x16_32x32_2x2_8x32x1_8x32x1_1x32x1x8_8_1x1_intrawave_v3,790.66,255.53,0.0
gfx942,304,38656,4352,5120,ck,0,0,2129.4538,a8w8_blockscale_1x128x128_256x128x128x128_16x16_32x32_2x2_8x32x1_8x32x1_1x32x1x8_8_1x1_intrawave_v3,808.98,261.41,0.0
gfx942,304,38784,4352,5120,ck,0,0,2136.3366,a8w8_blockscale_1x128x128_256x128x128x128_16x16_32x32_2x2_8x32x1_8x32x1_1x32x1x8_8_1x1_intrawave_v3,809.04,261.4,0.0
gfx942,304,38912,4352,5120,ck,0,0,2120.6895,a8w8_blockscale_1x128x128_256x128x128x128_16x16_32x32_2x2_8x32x1_8x32x1_1x32x1x8_8_1x1_intrawave_v3,817.7,264.16,0.0
gfx942,304,39040,4352,5120,ck,0,0,2142.6677,a8w8_blockscale_1x128x128_256x128x128x128_16x16_32x32_2x2_8x32x1_8x32x1_1x32x1x8_8_1x1_intrawave_v3,811.98,262.28,0.0
gfx942,304,39168,4352,5120,ck,0,0,2138.7872,a8w8_blockscale_1x128x128_256x128x128x128_16x16_32x32_2x2_8x32x1_8x32x1_1x32x1x8_8_1x1_intrawave_v3,816.12,263.58,0.0
gfx942,304,39296,4352,5120,ck,0,0,2210.8013,a8w8_blockscale_1x128x128_256x128x128x128_16x16_32x32_2x2_8x32x1_8x32x1_1x32x1x8_8_1x1_intrawave_v3,792.11,255.79,0.0
gfx942,304,39424,4352,5120,ck,0,0,2185.7744,a8w8_blockscale_1x128x128_256x128x128x128_16x16_32x32_2x2_8x32x1_8x32x1_1x32x1x8_8_1x1_intrawave_v3,803.79,259.53,0.0
gfx942,304,39552,4352,5120,ck,0,0,2165.0987,a8w8_blockscale_1x128x128_256x128x128x128_16x16_32x32_2x2_8x32x1_8x32x1_1x32x1x8_8_1x1_intrawave_v3,814.1,262.83,0.0
gfx942,304,39680,4352,5120,ck,0,0,2228.1596,a8w8_blockscale_1x128x128_256x128x128x128_16x16_32x32_2x2_8x32x1_8x32x1_1x32x1x8_8_1x1_intrawave_v3,793.62,256.18,0.0
gfx942,304,39808,4352,5120,ck,0,0,2230.3468,a8w8_blockscale_1x128x128_256x128x128x128_16x16_32x32_2x2_8x32x1_8x32x1_1x32x1x8_8_1x1_intrawave_v3,795.4,256.73,0.0
gfx942,304,39936,4352,5120,ck,0,0,2234.8569,a8w8_blockscale_1x128x128_256x128x128x128_16x16_32x32_2x2_8x32x1_8x32x1_1x32x1x8_8_1x1_intrawave_v3,796.35,257.0,0.0
gfx942,304,40064,4352,5120,ck,0,0,2210.0088,a8w8_blockscale_1x128x128_256x128x128x128_16x16_32x32_2x2_8x32x1_8x32x1_1x32x1x8_8_1x1_intrawave_v3,807.88,260.69,0.0
gfx942,304,40192,4352,5120,ck,0,0,2188.6797,a8w8_blockscale_1x128x128_256x128x128x128_16x16_32x32_2x2_8x32x1_8x32x1_1x32x1x8_8_1x1_intrawave_v3,818.36,264.04,0.0
gfx942,304,40320,4352,5120,ck,0,0,2236.6274,a8w8_blockscale_1x128x128_256x128x128x128_16x16_32x32_2x2_8x32x1_8x32x1_1x32x1x8_8_1x1_intrawave_v3,803.37,259.17,0.0
gfx942,304,40448,4352,5120,ck,0,0,2229.3699,a8w8_blockscale_1x128x128_256x128x128x128_16x16_32x32_2x2_8x32x1_8x32x1_1x32x1x8_8_1x1_intrawave_v3,808.54,260.81,0.0
gfx942,304,40576,4352,5120,ck,0,0,2215.8709,a8w8_blockscale_1x128x128_256x128x128x128_16x16_32x32_2x2_8x32x1_8x32x1_1x32x1x8_8_1x1_intrawave_v3,816.04,263.19,0.0
gfx942,304,40704,4352,5120,ck,0,0,2246.1067,a8w8_blockscale_1x128x128_256x128x128x128_16x16_32x32_2x2_8x32x1_8x32x1_1x32x1x8_8_1x1_intrawave_v3,807.6,260.44,0.0
gfx942,304,40832,4352,5120,ck,0,0,2248.7033,a8w8_blockscale_1x128x128_256x128x128x128_16x16_32x32_2x2_8x32x1_8x32x1_1x32x1x8_8_1x1_intrawave_v3,809.2,260.93,0.0
gfx942,304,40960,4352,5120,ck,0,0,2266.3276,a8w8_blockscale_1x128x128_256x128x128x128_16x16_32x32_2x2_8x32x1_8x32x1_1x32x1x8_8_1x1_intrawave_v3,805.43,259.68,0.0
gfx942,304,41088,4352,5120,ck,0,0,2313.9769,a8w8_blockscale_1x128x128_256x128x128x128_16x16_32x32_2x2_8x32x1_8x32x1_1x32x1x8_8_1x1_intrawave_v3,791.31,255.09,0.0
gfx942,304,41216,4352,5120,ck,0,0,2249.4189,a8w8_blockscale_1x128x128_256x128x128x128_16x16_32x32_2x2_8x32x1_8x32x1_1x32x1x8_8_1x1_intrawave_v3,816.55,263.2,0.0
gfx942,304,41344,4352,5120,ck,0,0,2284.1053,a8w8_blockscale_1x128x128_256x128x128x128_16x16_32x32_2x2_8x32x1_8x32x1_1x32x1x8_8_1x1_intrawave_v3,806.65,259.98,0.0
gfx942,304,41472,4352,5120,ck,0,0,2291.0181,a8w8_blockscale_1x128x128_256x128x128x128_16x16_32x32_2x2_8x32x1_8x32x1_1x32x1x8_8_1x1_intrawave_v3,806.71,259.97,0.0
gfx942,304,41600,4352,5120,ck,0,0,2309.2529,a8w8_blockscale_1x128x128_256x128x128x128_16x16_32x32_2x2_8x32x1_8x32x1_1x32x1x8_8_1x1_intrawave_v3,802.81,258.68,0.0
gfx942,304,41728,4352,5120,ck,0,0,2281.8668,a8w8_blockscale_1x128x128_256x128x128x128_16x16_32x32_2x2_8x32x1_8x32x1_1x32x1x8_8_1x1_intrawave_v3,814.94,262.56,0.0
gfx942,304,41856,4352,5120,ck,0,0,2333.3939,a8w8_blockscale_1x128x128_256x128x128x128_16x16_32x32_2x2_8x32x1_8x32x1_1x32x1x8_8_1x1_intrawave_v3,799.39,257.52,0.0
gfx942,304,41984,4352,5120,ck,0,0,2360.9664,a8w8_blockscale_1x128x128_256x128x128x128_16x16_32x32_2x2_8x32x1_8x32x1_1x32x1x8_8_1x1_intrawave_v3,792.47,255.26,0.0
gfx942,304,42112,4352,5120,ck,0,0,2320.3055,a8w8_blockscale_1x128x128_256x128x128x128_16x16_32x32_2x2_8x32x1_8x32x1_1x32x1x8_8_1x1_intrawave_v3,808.82,260.5,0.0
gfx942,304,42240,4352,5120,ck,0,0,2303.6785,a8w8_blockscale_1x128x128_256x128x128x128_16x16_32x32_2x2_8x32x1_8x32x1_1x32x1x8_8_1x1_intrawave_v3,817.13,263.15,0.0
gfx942,304,42368,4352,5120,ck,0,0,2337.0009,a8w8_blockscale_1x128x128_256x128x128x128_16x16_32x32_2x2_8x32x1_8x32x1_1x32x1x8_8_1x1_intrawave_v3,807.92,260.15,0.0
gfx942,304,42496,4352,5120,ck,0,0,2346.6011,a8w8_blockscale_1x128x128_256x128x128x128_16x16_32x32_2x2_8x32x1_8x32x1_1x32x1x8_8_1x1_intrawave_v3,807.04,259.84,0.0
gfx942,304,42624,4352,5120,ck,0,0,2409.307,a8w8_blockscale_1x128x128_256x128x128x128_16x16_32x32_2x2_8x32x1_8x32x1_1x32x1x8_8_1x1_intrawave_v3,788.41,253.81,0.0
gfx942,304,42752,4352,5120,ck,0,0,2344.07,a8w8_blockscale_1x128x128_256x128x128x128_16x16_32x32_2x2_8x32x1_8x32x1_1x32x1x8_8_1x1_intrawave_v3,812.78,261.63,0.0
gfx942,304,42880,4352,5120,ck,0,0,2381.6622,a8w8_blockscale_1x128x128_256x128x128x128_16x16_32x32_2x2_8x32x1_8x32x1_1x32x1x8_8_1x1_intrawave_v3,802.35,258.25,0.0
gfx942,304,43008,4352,5120,ck,0,0,2364.2504,a8w8_blockscale_1x128x128_256x128x128x128_16x16_32x32_2x2_8x32x1_8x32x1_1x32x1x8_8_1x1_intrawave_v3,810.67,260.9,0.0
gfx942,304,43136,4352,5120,ck,0,0,2387.2228,a8w8_blockscale_1x128x128_256x128x128x128_16x16_32x32_2x2_8x32x1_8x32x1_1x32x1x8_8_1x1_intrawave_v3,805.26,259.13,0.0
gfx942,304,43264,4352,5120,ck,0,0,2414.9599,a8w8_blockscale_1x128x128_256x128x128x128_16x16_32x32_2x2_8x32x1_8x32x1_1x32x1x8_8_1x1_intrawave_v3,798.37,256.88,0.0
gfx942,304,43392,4352,5120,ck,0,0,2406.9696,a8w8_blockscale_1x128x128_256x128x128x128_16x16_32x32_2x2_8x32x1_8x32x1_1x32x1x8_8_1x1_intrawave_v3,803.39,258.47,0.0
gfx942,304,43520,4352,5120,ck,0,0,2402.6535,a8w8_blockscale_1x128x128_256x128x128x128_16x16_32x32_2x2_8x32x1_8x32x1_1x32x1x8_8_1x1_intrawave_v3,807.21,259.67,0.0
gfx942,304,43648,4352,5120,ck,0,0,2416.9225,a8w8_blockscale_1x128x128_256x128x128x128_16x16_32x32_2x2_8x32x1_8x32x1_1x32x1x8_8_1x1_intrawave_v3,804.8,258.87,0.0
gfx942,304,43776,4352,5120,ck,0,0,2391.0682,a8w8_blockscale_1x128x128_256x128x128x128_16x16_32x32_2x2_8x32x1_8x32x1_1x32x1x8_8_1x1_intrawave_v3,815.89,262.41,0.0
gfx942,304,43904,4352,5120,ck,0,0,2434.6927,a8w8_blockscale_1x128x128_256x128x128x128_16x16_32x32_2x2_8x32x1_8x32x1_1x32x1x8_8_1x1_intrawave_v3,803.62,258.44,0.0
gfx942,304,44032,4352,5120,ck,0,0,2433.1363,a8w8_blockscale_1x128x128_256x128x128x128_16x16_32x32_2x2_8x32x1_8x32x1_1x32x1x8_8_1x1_intrawave_v3,806.47,259.33,0.0
gfx942,304,44160,4352,5120,ck,0,0,2437.5434,a8w8_blockscale_1x128x128_256x128x128x128_16x16_32x32_2x2_8x32x1_8x32x1_1x32x1x8_8_1x1_intrawave_v3,807.36,259.59,0.0
gfx942,304,44288,4352,5120,ck,0,0,2440.3706,a8w8_blockscale_1x128x128_256x128x128x128_16x16_32x32_2x2_8x32x1_8x32x1_1x32x1x8_8_1x1_intrawave_v3,808.76,260.01,0.0
gfx942,304,44416,4352,5120,ck,0,0,2431.3772,a8w8_blockscale_1x128x128_256x128x128x128_16x16_32x32_2x2_8x32x1_8x32x1_1x32x1x8_8_1x1_intrawave_v3,814.1,261.7,0.0
gfx942,304,44544,4352,5120,ck,0,0,2504.1525,a8w8_blockscale_1x128x128_256x128x128x128_16x16_32x32_2x2_8x32x1_8x32x1_1x32x1x8_8_1x1_intrawave_v3,792.72,254.8,0.0
gfx942,304,44672,4352,5120,ck,0,0,2447.4672,a8w8_blockscale_1x128x128_256x128x128x128_16x16_32x32_2x2_8x32x1_8x32x1_1x32x1x8_8_1x1_intrawave_v3,813.41,261.42,0.0
gfx942,304,44800,4352,5120,ck,0,0,2507.8204,a8w8_blockscale_1x128x128_256x128x128x128_16x16_32x32_2x2_8x32x1_8x32x1_1x32x1x8_8_1x1_intrawave_v3,796.11,255.84,0.0
gfx942,304,44928,4352,5120,ck,0,0,2490.642,a8w8_blockscale_1x128x128_256x128x128x128_16x16_32x32_2x2_8x32x1_8x32x1_1x32x1x8_8_1x1_intrawave_v3,803.89,258.31,0.0
gfx942,304,45056,4352,5120,ck,0,0,2482.8098,a8w8_blockscale_1x128x128_256x128x128x128_16x16_32x32_2x2_8x32x1_8x32x1_1x32x1x8_8_1x1_intrawave_v3,808.72,259.84,0.0
gfx942,304,45184,4352,5120,ck,0,0,2529.3697,a8w8_blockscale_1x128x128_256x128x128x128_16x16_32x32_2x2_8x32x1_8x32x1_1x32x1x8_8_1x1_intrawave_v3,796.09,255.76,0.0
gfx942,304,45312,4352,5120,ck,0,0,2459.2411,a8w8_blockscale_1x128x128_256x128x128x128_16x16_32x32_2x2_8x32x1_8x32x1_1x32x1x8_8_1x1_intrawave_v3,821.11,263.77,0.0
gfx942,304,45440,4352,5120,ck,0,0,2497.6079,a8w8_blockscale_1x128x128_256x128x128x128_16x16_32x32_2x2_8x32x1_8x32x1_1x32x1x8_8_1x1_intrawave_v3,810.78,260.43,0.0
gfx942,304,45568,4352,5120,ck,0,0,2555.841,a8w8_blockscale_1x128x128_256x128x128x128_16x16_32x32_2x2_8x32x1_8x32x1_1x32x1x8_8_1x1_intrawave_v3,794.54,255.19,0.0
gfx942,304,45696,4352,5120,ck,0,0,2538.1836,a8w8_blockscale_1x128x128_256x128x128x128_16x16_32x32_2x2_8x32x1_8x32x1_1x32x1x8_8_1x1_intrawave_v3,802.31,257.66,0.0
gfx942,304,45824,4352,5120,ck,0,0,2548.0863,a8w8_blockscale_1x128x128_256x128x128x128_16x16_32x32_2x2_8x32x1_8x32x1_1x32x1x8_8_1x1_intrawave_v3,801.43,257.35,0.0
gfx942,304,45952,4352,5120,ck,0,0,2501.9295,a8w8_blockscale_1x128x128_256x128x128x128_16x16_32x32_2x2_8x32x1_8x32x1_1x32x1x8_8_1x1_intrawave_v3,818.5,262.81,0.0
gfx942,304,46080,4352,5120,ck,0,0,2498.7808,a8w8_blockscale_1x128x128_256x128x128x128_16x16_32x32_2x2_8x32x1_8x32x1_1x32x1x8_8_1x1_intrawave_v3,821.81,263.85,0.0
gfx942,304,46208,4352,5120,ck,0,0,2514.1599,a8w8_blockscale_1x128x128_256x128x128x128_16x16_32x32_2x2_8x32x1_8x32x1_1x32x1x8_8_1x1_intrawave_v3,819.06,262.94,0.0
gfx942,304,46336,4352,5120,ck,0,0,2524.9412,a8w8_blockscale_1x128x128_256x128x128x128_16x16_32x32_2x2_8x32x1_8x32x1_1x32x1x8_8_1x1_intrawave_v3,817.82,262.51,0.0
gfx942,304,46464,4352,5120,ck,0,0,2575.6717,a8w8_blockscale_1x128x128_256x128x128x128_16x16_32x32_2x2_8x32x1_8x32x1_1x32x1x8_8_1x1_intrawave_v3,803.92,258.03,0.0
gfx942,304,46592,4352,5120,ck,0,0,2535.2952,a8w8_blockscale_1x128x128_256x128x128x128_16x16_32x32_2x2_8x32x1_8x32x1_1x32x1x8_8_1x1_intrawave_v3,818.98,262.84,0.0
gfx942,304,46720,4352,5120,ck,0,0,2546.531,a8w8_blockscale_1x128x128_256x128x128x128_16x16_32x32_2x2_8x32x1_8x32x1_1x32x1x8_8_1x1_intrawave_v3,817.6,262.37,0.0
gfx942,304,46848,4352,5120,ck,0,0,2617.4,a8w8_blockscale_1x128x128_256x128x128x128_16x16_32x32_2x2_8x32x1_8x32x1_1x32x1x8_8_1x1_intrawave_v3,797.65,255.94,0.0
gfx942,304,46976,4352,5120,ck,0,0,2602.5863,a8w8_blockscale_1x128x128_256x128x128x128_16x16_32x32_2x2_8x32x1_8x32x1_1x32x1x8_8_1x1_intrawave_v3,804.38,258.08,0.0
gfx942,304,47104,4352,5120,ck,0,0,2564.7227,a8w8_blockscale_1x128x128_256x128x128x128_16x16_32x32_2x2_8x32x1_8x32x1_1x32x1x8_8_1x1_intrawave_v3,818.48,262.58,0.0
gfx942,304,47232,4352,5120,ck,0,0,2606.3952,a8w8_blockscale_1x128x128_256x128x128x128_16x16_32x32_2x2_8x32x1_8x32x1_1x32x1x8_8_1x1_intrawave_v3,807.58,259.06,0.0
gfx942,304,47360,4352,5120,ck,0,0,2666.7992,a8w8_blockscale_1x128x128_256x128x128x128_16x16_32x32_2x2_8x32x1_8x32x1_1x32x1x8_8_1x1_intrawave_v3,791.43,253.86,0.0
gfx942,304,47488,4352,5120,ck,0,0,2651.8115,a8w8_blockscale_1x128x128_256x128x128x128_16x16_32x32_2x2_8x32x1_8x32x1_1x32x1x8_8_1x1_intrawave_v3,798.05,255.96,0.0
gfx942,304,47616,4352,5120,ck,0,0,2632.6099,a8w8_blockscale_1x128x128_256x128x128x128_16x16_32x32_2x2_8x32x1_8x32x1_1x32x1x8_8_1x1_intrawave_v3,806.04,258.5,0.0
gfx942,304,47744,4352,5120,ck,0,0,2662.1939,a8w8_blockscale_1x128x128_256x128x128x128_16x16_32x32_2x2_8x32x1_8x32x1_1x32x1x8_8_1x1_intrawave_v3,799.22,256.29,0.0
gfx942,304,47872,4352,5120,ck,0,0,2698.9333,a8w8_blockscale_1x128x128_256x128x128x128_16x16_32x32_2x2_8x32x1_8x32x1_1x32x1x8_8_1x1_intrawave_v3,790.46,253.46,0.0
gfx942,304,48000,4352,5120,ck,0,0,2640.2743,a8w8_blockscale_1x128x128_256x128x128x128_16x16_32x32_2x2_8x32x1_8x32x1_1x32x1x8_8_1x1_intrawave_v3,810.18,259.76,0.0
gfx942,304,48128,4352,5120,ck,0,0,2655.5821,a8w8_blockscale_1x128x128_256x128x128x128_16x16_32x32_2x2_8x32x1_8x32x1_1x32x1x8_8_1x1_intrawave_v3,807.66,258.93,0.0
gfx942,304,48256,4352,5120,ck,0,0,2739.5959,a8w8_blockscale_1x128x128_256x128x128x128_16x16_32x32_2x2_8x32x1_8x32x1_1x32x1x8_8_1x1_intrawave_v3,784.97,251.63,0.0
gfx942,304,48384,4352,5120,ck,0,0,2665.1732,a8w8_blockscale_1x128x128_256x128x128x128_16x16_32x32_2x2_8x32x1_8x32x1_1x32x1x8_8_1x1_intrawave_v3,809.03,259.32,0.0
gfx942,304,48512,4352,5120,ck,0,0,2652.0575,a8w8_blockscale_1x128x128_256x128x128x128_16x16_32x32_2x2_8x32x1_8x32x1_1x32x1x8_8_1x1_intrawave_v3,815.18,261.27,0.0
gfx942,304,48640,4352,5120,ck,0,0,2649.0008,a8w8_blockscale_1x128x128_256x128x128x128_16x16_32x32_2x2_8x32x1_8x32x1_1x32x1x8_8_1x1_intrawave_v3,818.28,262.24,0.0
gfx942,304,48768,4352,5120,ck,0,0,2692.1152,a8w8_blockscale_1x128x128_256x128x128x128_16x16_32x32_2x2_8x32x1_8x32x1_1x32x1x8_8_1x1_intrawave_v3,807.29,258.7,0.0
gfx942,304,48896,4352,5120,ck,0,0,2728.7495,a8w8_blockscale_1x128x128_256x128x128x128_16x16_32x32_2x2_8x32x1_8x32x1_1x32x1x8_8_1x1_intrawave_v3,798.54,255.88,0.0
gfx942,304,49024,4352,5120,ck,0,0,2736.848,a8w8_blockscale_1x128x128_256x128x128x128_16x16_32x32_2x2_8x32x1_8x32x1_1x32x1x8_8_1x1_intrawave_v3,798.26,255.77,0.0
gfx942,304,49152,4352,5120,ck,0,0,2720.5381,a8w8_blockscale_1x128x128_256x128x128x128_16x16_32x32_2x2_8x32x1_8x32x1_1x32x1x8_8_1x1_intrawave_v3,805.15,257.95,0.0
gfx942,304,49280,4352,5120,ck,0,0,2699.8609,a8w8_blockscale_1x128x128_256x128x128x128_16x16_32x32_2x2_8x32x1_8x32x1_1x32x1x8_8_1x1_intrawave_v3,813.43,260.58,0.0
gfx942,304,49408,4352,5120,ck,0,0,2704.3119,a8w8_blockscale_1x128x128_256x128x128x128_16x16_32x32_2x2_8x32x1_8x32x1_1x32x1x8_8_1x1_intrawave_v3,814.2,260.81,0.0
gfx942,304,49536,4352,5120,ck,0,0,2741.0831,a8w8_blockscale_1x128x128_256x128x128x128_16x16_32x32_2x2_8x32x1_8x32x1_1x32x1x8_8_1x1_intrawave_v3,805.36,257.95,0.0
gfx942,304,49664,4352,5120,ck,0,0,2740.6712,a8w8_blockscale_1x128x128_256x128x128x128_16x16_32x32_2x2_8x32x1_8x32x1_1x32x1x8_8_1x1_intrawave_v3,807.56,258.64,0.0
gfx942,304,49792,4352,5120,ck,0,0,2755.8527,a8w8_blockscale_1x128x128_256x128x128x128_16x16_32x32_2x2_8x32x1_8x32x1_1x32x1x8_8_1x1_intrawave_v3,805.18,257.85,0.0
gfx942,304,49920,4352,5120,ck,0,0,2778.3037,a8w8_blockscale_1x128x128_256x128x128x128_16x16_32x32_2x2_8x32x1_8x32x1_1x32x1x8_8_1x1_intrawave_v3,800.73,256.41,0.0
gfx942,304,50048,4352,5120,ck,0,0,2728.6391,a8w8_blockscale_1x128x128_256x128x128x128_16x16_32x32_2x2_8x32x1_8x32x1_1x32x1x8_8_1x1_intrawave_v3,817.39,261.72,0.0
gfx942,304,50176,4352,5120,ck,0,0,2774.1567,a8w8_blockscale_1x128x128_256x128x128x128_16x16_32x32_2x2_8x32x1_8x32x1_1x32x1x8_8_1x1_intrawave_v3,806.03,258.07,0.0
gfx942,304,50304,4352,5120,ck,0,0,2785.8637,a8w8_blockscale_1x128x128_256x128x128x128_16x16_32x32_2x2_8x32x1_8x32x1_1x32x1x8_8_1x1_intrawave_v3,804.7,257.62,0.0
gfx942,304,50432,4352,5120,ck,0,0,2844.2848,a8w8_blockscale_1x128x128_256x128x128x128_16x16_32x32_2x2_8x32x1_8x32x1_1x32x1x8_8_1x1_intrawave_v3,790.17,252.95,0.0
gfx942,304,50560,4352,5120,ck,0,0,2794.2546,a8w8_blockscale_1x128x128_256x128x128x128_16x16_32x32_2x2_8x32x1_8x32x1_1x32x1x8_8_1x1_intrawave_v3,806.36,258.11,0.0
gfx942,304,50688,4352,5120,ck,0,0,2814.4457,a8w8_blockscale_1x128x128_256x128x128x128_16x16_32x32_2x2_8x32x1_8x32x1_1x32x1x8_8_1x1_intrawave_v3,802.6,256.89,0.0
gfx942,304,50816,4352,5120,ck,0,0,2799.9095,a8w8_blockscale_1x128x128_256x128x128x128_16x16_32x32_2x2_8x32x1_8x32x1_1x32x1x8_8_1x1_intrawave_v3,808.81,258.85,0.0
gfx942,304,50944,4352,5120,ck,0,0,2804.8224,a8w8_blockscale_1x128x128_256x128x128x128_16x16_32x32_2x2_8x32x1_8x32x1_1x32x1x8_8_1x1_intrawave_v3,809.42,259.03,0.0
gfx942,304,51072,4352,5120,ck,0,0,2818.1219,a8w8_blockscale_1x128x128_256x128x128x128_16x16_32x32_2x2_8x32x1_8x32x1_1x32x1x8_8_1x1_intrawave_v3,807.63,258.44,0.0
gfx942,304,51200,4352,5120,ck,0,0,2819.1157,a8w8_blockscale_1x128x128_256x128x128x128_16x16_32x32_2x2_8x32x1_8x32x1_1x32x1x8_8_1x1_intrawave_v3,809.37,258.97,0.0
gfx942,304,51328,4352,5120,ck,0,0,2838.2202,a8w8_blockscale_1x128x128_256x128x128x128_16x16_32x32_2x2_8x32x1_8x32x1_1x32x1x8_8_1x1_intrawave_v3,805.93,257.85,0.0
gfx942,304,51456,4352,5120,ck,0,0,2937.2295,a8w8_blockscale_1x128x128_256x128x128x128_16x16_32x32_2x2_8x32x1_8x32x1_1x32x1x8_8_1x1_intrawave_v3,780.71,249.76,0.0
gfx942,304,51584,4352,5120,ck,0,0,2853.1899,a8w8_blockscale_1x128x128_256x128x128x128_16x16_32x32_2x2_8x32x1_8x32x1_1x32x1x8_8_1x1_intrawave_v3,805.7,257.74,0.0
gfx942,304,51712,4352,5120,ck,0,0,2876.5095,a8w8_blockscale_1x128x128_256x128x128x128_16x16_32x32_2x2_8x32x1_8x32x1_1x32x1x8_8_1x1_intrawave_v3,801.15,256.27,0.0
gfx942,304,51840,4352,5120,ck,0,0,2929.7962,a8w8_blockscale_1x128x128_256x128x128x128_16x16_32x32_2x2_8x32x1_8x32x1_1x32x1x8_8_1x1_intrawave_v3,788.53,252.21,0.0
gfx942,304,51968,4352,5120,ck,0,0,2930.071,a8w8_blockscale_1x128x128_256x128x128x128_16x16_32x32_2x2_8x32x1_8x32x1_1x32x1x8_8_1x1_intrawave_v3,790.4,252.79,0.0
gfx942,304,52096,4352,5120,ck,0,0,2907.0808,a8w8_blockscale_1x128x128_256x128x128x128_16x16_32x32_2x2_8x32x1_8x32x1_1x32x1x8_8_1x1_intrawave_v3,798.61,255.4,0.0
gfx942,304,52224,4352,5120,ck,0,0,2886.3366,a8w8_blockscale_1x128x128_256x128x128x128_16x16_32x32_2x2_8x32x1_8x32x1_1x32x1x8_8_1x1_intrawave_v3,806.33,257.84,0.0
gfx942,304,52352,4352,5120,ck,0,0,2922.1682,a8w8_blockscale_1x128x128_256x128x128x128_16x16_32x32_2x2_8x32x1_8x32x1_1x32x1x8_8_1x1_intrawave_v3,798.39,255.29,0.0
gfx942,304,52480,4352,5120,ck,0,0,2959.6219,a8w8_blockscale_1x128x128_256x128x128x128_16x16_32x32_2x2_8x32x1_8x32x1_1x32x1x8_8_1x1_intrawave_v3,790.22,252.66,0.0
gfx942,304,52608,4352,5120,ck,0,0,2931.1278,a8w8_blockscale_1x128x128_256x128x128x128_16x16_32x32_2x2_8x32x1_8x32x1_1x32x1x8_8_1x1_intrawave_v3,799.85,255.72,0.0
gfx942,304,52736,4352,5120,ck,0,0,2936.9685,a8w8_blockscale_1x128x128_256x128x128x128_16x16_32x32_2x2_8x32x1_8x32x1_1x32x1x8_8_1x1_intrawave_v3,800.2,255.81,0.0
gfx942,304,52864,4352,5120,ck,0,0,2945.232,a8w8_blockscale_1x128x128_256x128x128x128_16x16_32x32_2x2_8x32x1_8x32x1_1x32x1x8_8_1x1_intrawave_v3,799.89,255.69,0.0
gfx942,304,52992,4352,5120,ck,0,0,2927.8078,a8w8_blockscale_1x128x128_256x128x128x128_16x16_32x32_2x2_8x32x1_8x32x1_1x32x1x8_8_1x1_intrawave_v3,806.6,257.82,0.0
gfx942,304,53120,4352,5120,ck,0,0,2998.2863,a8w8_blockscale_1x128x128_256x128x128x128_16x16_32x32_2x2_8x32x1_8x32x1_1x32x1x8_8_1x1_intrawave_v3,789.54,252.35,0.0
gfx942,304,53248,4352,5120,ck,0,0,2967.73,a8w8_blockscale_1x128x128_256x128x128x128_16x16_32x32_2x2_8x32x1_8x32x1_1x32x1x8_8_1x1_intrawave_v3,799.59,255.54,0.0
gfx942,304,53376,4352,5120,ck,0,0,2922.2246,a8w8_blockscale_1x128x128_256x128x128x128_16x16_32x32_2x2_8x32x1_8x32x1_1x32x1x8_8_1x1_intrawave_v3,813.99,260.13,0.0
gfx942,304,53504,4352,5120,ck,0,0,2927.1587,a8w8_blockscale_1x128x128_256x128x128x128_16x16_32x32_2x2_8x32x1_8x32x1_1x32x1x8_8_1x1_intrawave_v3,814.57,260.29,0.0
gfx942,304,53632,4352,5120,ck,0,0,3034.7995,a8w8_blockscale_1x128x128_256x128x128x128_16x16_32x32_2x2_8x32x1_8x32x1_1x32x1x8_8_1x1_intrawave_v3,787.56,251.64,0.0
gfx942,304,53760,4352,5120,ck,0,0,3005.7847,a8w8_blockscale_1x128x128_256x128x128x128_16x16_32x32_2x2_8x32x1_8x32x1_1x32x1x8_8_1x1_intrawave_v3,797.06,254.66,0.0
gfx942,304,53888,4352,5120,ck,0,0,3001.1594,a8w8_blockscale_1x128x128_256x128x128x128_16x16_32x32_2x2_8x32x1_8x32x1_1x32x1x8_8_1x1_intrawave_v3,800.19,255.64,0.0
gfx942,304,54016,4352,5120,ck,0,0,3006.5376,a8w8_blockscale_1x128x128_256x128x128x128_16x16_32x32_2x2_8x32x1_8x32x1_1x32x1x8_8_1x1_intrawave_v3,800.65,255.78,0.0
gfx942,304,54144,4352,5120,ck,0,0,3074.4355,a8w8_blockscale_1x128x128_256x128x128x128_16x16_32x32_2x2_8x32x1_8x32x1_1x32x1x8_8_1x1_intrawave_v3,784.83,250.7,0.0
gfx942,304,54272,4352,5120,ck,0,0,3062.5881,a8w8_blockscale_1x128x128_256x128x128x128_16x16_32x32_2x2_8x32x1_8x32x1_1x32x1x8_8_1x1_intrawave_v3,789.73,252.25,0.0
gfx942,304,54400,4352,5120,ck,0,0,3029.3994,a8w8_blockscale_1x128x128_256x128x128x128_16x16_32x32_2x2_8x32x1_8x32x1_1x32x1x8_8_1x1_intrawave_v3,800.26,255.6,0.0
gfx942,304,54528,4352,5120,ck,0,0,3042.7426,a8w8_blockscale_1x128x128_256x128x128x128_16x16_32x32_2x2_8x32x1_8x32x1_1x32x1x8_8_1x1_intrawave_v3,798.63,255.06,0.0
gfx942,304,54656,4352,5120,ck,0,0,3019.4862,a8w8_blockscale_1x128x128_256x128x128x128_16x16_32x32_2x2_8x32x1_8x32x1_1x32x1x8_8_1x1_intrawave_v3,806.67,257.61,0.0
gfx942,304,54784,4352,5120,ck,0,0,3050.1372,a8w8_blockscale_1x128x128_256x128x128x128_16x16_32x32_2x2_8x32x1_8x32x1_1x32x1x8_8_1x1_intrawave_v3,800.43,255.6,0.0
gfx942,304,54912,4352,5120,ck,0,0,3040.5457,a8w8_blockscale_1x128x128_256x128x128x128_16x16_32x32_2x2_8x32x1_8x32x1_1x32x1x8_8_1x1_intrawave_v3,804.83,256.99,0.0
gfx942,304,55040,4352,5120,ck,0,0,3123.7074,a8w8_blockscale_1x128x128_256x128x128x128_16x16_32x32_2x2_8x32x1_8x32x1_1x32x1x8_8_1x1_intrawave_v3,785.23,250.71,0.0
gfx942,304,55168,4352,5120,ck,0,0,3071.4729,a8w8_blockscale_1x128x128_256x128x128x128_16x16_32x32_2x2_8x32x1_8x32x1_1x32x1x8_8_1x1_intrawave_v3,800.44,255.55,0.0
gfx942,304,55296,4352,5120,ck,0,0,3039.9716,a8w8_blockscale_1x128x128_256x128x128x128_16x16_32x32_2x2_8x32x1_8x32x1_1x32x1x8_8_1x1_intrawave_v3,810.61,258.78,0.0
gfx942,304,55424,4352,5120,ck,0,0,3104.6563,a8w8_blockscale_1x128x128_256x128x128x128_16x16_32x32_2x2_8x32x1_8x32x1_1x32x1x8_8_1x1_intrawave_v3,795.56,253.96,0.0
gfx942,304,55552,4352,5120,ck,0,0,3039.6463,a8w8_blockscale_1x128x128_256x128x128x128_16x16_32x32_2x2_8x32x1_8x32x1_1x32x1x8_8_1x1_intrawave_v3,814.45,259.98,0.0
gfx942,304,55680,4352,5120,ck,0,0,3075.9246,a8w8_blockscale_1x128x128_256x128x128x128_16x16_32x32_2x2_8x32x1_8x32x1_1x32x1x8_8_1x1_intrawave_v3,806.7,257.48,0.0
gfx942,304,55808,4352,5120,ck,0,0,3130.5749,a8w8_blockscale_1x128x128_256x128x128x128_16x16_32x32_2x2_8x32x1_8x32x1_1x32x1x8_8_1x1_intrawave_v3,794.44,253.55,0.0
gfx942,304,55936,4352,5120,ck,0,0,3138.9243,a8w8_blockscale_1x128x128_256x128x128x128_16x16_32x32_2x2_8x32x1_8x32x1_1x32x1x8_8_1x1_intrawave_v3,794.14,253.44,0.0
gfx942,304,56064,4352,5120,ck,0,0,3070.2345,a8w8_blockscale_1x128x128_256x128x128x128_16x16_32x32_2x2_8x32x1_8x32x1_1x32x1x8_8_1x1_intrawave_v3,813.77,259.69,0.0
gfx942,304,56192,4352,5120,ck,0,0,3117.6317,a8w8_blockscale_1x128x128_256x128x128x128_16x16_32x32_2x2_8x32x1_8x32x1_1x32x1x8_8_1x1_intrawave_v3,803.23,256.31,0.0
gfx942,304,56320,4352,5120,ck,0,0,3128.9101,a8w8_blockscale_1x128x128_256x128x128x128_16x16_32x32_2x2_8x32x1_8x32x1_1x32x1x8_8_1x1_intrawave_v3,802.16,255.95,0.0
gfx942,304,56448,4352,5120,ck,0,0,3158.9714,a8w8_blockscale_1x128x128_256x128x128x128_16x16_32x32_2x2_8x32x1_8x32x1_1x32x1x8_8_1x1_intrawave_v3,796.33,254.08,0.0
gfx942,304,56576,4352,5120,ck,0,0,3159.7977,a8w8_blockscale_1x128x128_256x128x128x128_16x16_32x32_2x2_8x32x1_8x32x1_1x32x1x8_8_1x1_intrawave_v3,797.92,254.57,0.0
gfx942,304,56704,4352,5120,ck,0,0,3171.2432,a8w8_blockscale_1x128x128_256x128x128x128_16x16_32x32_2x2_8x32x1_8x32x1_1x32x1x8_8_1x1_intrawave_v3,796.84,254.21,0.0
gfx942,304,56832,4352,5120,ck,0,0,3170.7541,a8w8_blockscale_1x128x128_256x128x128x128_16x16_32x32_2x2_8x32x1_8x32x1_1x32x1x8_8_1x1_intrawave_v3,798.77,254.81,0.0
gfx942,304,56960,4352,5120,ck,0,0,3153.5176,a8w8_blockscale_1x128x128_256x128x128x128_16x16_32x32_2x2_8x32x1_8x32x1_1x32x1x8_8_1x1_intrawave_v3,804.94,256.76,0.0
gfx942,304,57088,4352,5120,ck,0,0,3163.27,a8w8_blockscale_1x128x128_256x128x128x128_16x16_32x32_2x2_8x32x1_8x32x1_1x32x1x8_8_1x1_intrawave_v3,804.26,256.53,0.0
gfx942,304,57216,4352,5120,ck,0,0,3111.9058,a8w8_blockscale_1x128x128_256x128x128x128_16x16_32x32_2x2_8x32x1_8x32x1_1x32x1x8_8_1x1_intrawave_v3,819.37,261.33,0.0
gfx942,304,57344,4352,5120,ck,0,0,3134.6244,a8w8_blockscale_1x128x128_256x128x128x128_16x16_32x32_2x2_8x32x1_8x32x1_1x32x1x8_8_1x1_intrawave_v3,815.25,260.0,0.0
gfx942,304,57472,4352,5120,ck,0,0,3212.9953,a8w8_blockscale_1x128x128_256x128x128x128_16x16_32x32_2x2_8x32x1_8x32x1_1x32x1x8_8_1x1_intrawave_v3,797.14,254.21,0.0
gfx942,304,57600,4352,5120,ck,0,0,3186.0388,a8w8_blockscale_1x128x128_256x128x128x128_16x16_32x32_2x2_8x32x1_8x32x1_1x32x1x8_8_1x1_intrawave_v3,805.68,256.92,0.0
gfx942,304,57728,4352,5120,ck,0,0,3244.3864,a8w8_blockscale_1x128x128_256x128x128x128_16x16_32x32_2x2_8x32x1_8x32x1_1x32x1x8_8_1x1_intrawave_v3,792.94,252.84,0.0
gfx942,304,57856,4352,5120,ck,0,0,3216.2067,a8w8_blockscale_1x128x128_256x128x128x128_16x16_32x32_2x2_8x32x1_8x32x1_1x32x1x8_8_1x1_intrawave_v3,801.67,255.61,0.0
gfx942,304,57984,4352,5120,ck,0,0,3197.1458,a8w8_blockscale_1x128x128_256x128x128x128_16x16_32x32_2x2_8x32x1_8x32x1_1x32x1x8_8_1x1_intrawave_v3,808.23,257.68,0.0
gfx942,304,58112,4352,5120,ck,0,0,3223.3624,a8w8_blockscale_1x128x128_256x128x128x128_16x16_32x32_2x2_8x32x1_8x32x1_1x32x1x8_8_1x1_intrawave_v3,803.43,256.14,0.0
gfx942,304,58240,4352,5120,ck,0,0,3270.1844,a8w8_blockscale_1x128x128_256x128x128x128_16x16_32x32_2x2_8x32x1_8x32x1_1x32x1x8_8_1x1_intrawave_v3,793.67,253.01,0.0
gfx942,304,58368,4352,5120,ck,0,0,3177.3863,a8w8_blockscale_1x128x128_256x128x128x128_16x16_32x32_2x2_8x32x1_8x32x1_1x32x1x8_8_1x1_intrawave_v3,818.64,260.96,0.0
gfx942,304,58496,4352,5120,ck,0,0,3249.4389,a8w8_blockscale_1x128x128_256x128x128x128_16x16_32x32_2x2_8x32x1_8x32x1_1x32x1x8_8_1x1_intrawave_v3,802.24,255.72,0.0
gfx942,304,58624,4352,5120,ck,0,0,3260.6844,a8w8_blockscale_1x128x128_256x128x128x128_16x16_32x32_2x2_8x32x1_8x32x1_1x32x1x8_8_1x1_intrawave_v3,801.23,255.38,0.0
gfx942,304,58752,4352,5120,ck,0,0,3262.7974,a8w8_blockscale_1x128x128_256x128x128x128_16x16_32x32_2x2_8x32x1_8x32x1_1x32x1x8_8_1x1_intrawave_v3,802.46,255.75,0.0
gfx942,304,58880,4352,5120,ck,0,0,3221.1759,a8w8_blockscale_1x128x128_256x128x128x128_16x16_32x32_2x2_8x32x1_8x32x1_1x32x1x8_8_1x1_intrawave_v3,814.6,259.61,0.0
gfx942,304,59008,4352,5120,ck,0,0,3263.2487,a8w8_blockscale_1x128x128_256x128x128x128_16x16_32x32_2x2_8x32x1_8x32x1_1x32x1x8_8_1x1_intrawave_v3,805.84,256.8,0.0
gfx942,304,59136,4352,5120,ck,0,0,3229.9645,a8w8_blockscale_1x128x128_256x128x128x128_16x16_32x32_2x2_8x32x1_8x32x1_1x32x1x8_8_1x1_intrawave_v3,815.91,260.0,0.0
gfx942,304,59264,4352,5120,ck,0,0,3235.8294,a8w8_blockscale_1x128x128_256x128x128x128_16x16_32x32_2x2_8x32x1_8x32x1_1x32x1x8_8_1x1_intrawave_v3,816.2,260.07,0.0
gfx942,304,59392,4352,5120,ck,0,0,3242.3954,a8w8_blockscale_1x128x128_256x128x128x128_16x16_32x32_2x2_8x32x1_8x32x1_1x32x1x8_8_1x1_intrawave_v3,816.3,260.09,0.0
gfx942,304,59520,4352,5120,ck,0,0,3290.7781,a8w8_blockscale_1x128x128_256x128x128x128_16x16_32x32_2x2_8x32x1_8x32x1_1x32x1x8_8_1x1_intrawave_v3,806.03,256.8,0.0
gfx942,304,59648,4352,5120,ck,0,0,3308.0754,a8w8_blockscale_1x128x128_256x128x128x128_16x16_32x32_2x2_8x32x1_8x32x1_1x32x1x8_8_1x1_intrawave_v3,803.54,256.0,0.0
gfx942,304,59776,4352,5120,ck,0,0,3338.5236,a8w8_blockscale_1x128x128_256x128x128x128_16x16_32x32_2x2_8x32x1_8x32x1_1x32x1x8_8_1x1_intrawave_v3,797.92,254.19,0.0
gfx942,304,59904,4352,5120,ck,0,0,3305.5705,a8w8_blockscale_1x128x128_256x128x128x128_16x16_32x32_2x2_8x32x1_8x32x1_1x32x1x8_8_1x1_intrawave_v3,807.6,257.26,0.0
gfx942,304,60032,4352,5120,ck,0,0,3362.3876,a8w8_blockscale_1x128x128_256x128x128x128_16x16_32x32_2x2_8x32x1_8x32x1_1x32x1x8_8_1x1_intrawave_v3,795.65,253.44,0.0
gfx942,304,60160,4352,5120,ck,0,0,3314.5335,a8w8_blockscale_1x128x128_256x128x128x128_16x16_32x32_2x2_8x32x1_8x32x1_1x32x1x8_8_1x1_intrawave_v3,808.86,257.63,0.0
gfx942,304,60288,4352,5120,ck,0,0,3331.3838,a8w8_blockscale_1x128x128_256x128x128x128_16x16_32x32_2x2_8x32x1_8x32x1_1x32x1x8_8_1x1_intrawave_v3,806.48,256.86,0.0
gfx942,304,60416,4352,5120,ck,0,0,3402.7008,a8w8_blockscale_1x128x128_256x128x128x128_16x16_32x32_2x2_8x32x1_8x32x1_1x32x1x8_8_1x1_intrawave_v3,791.26,252.0,0.0
gfx942,304,60544,4352,5120,ck,0,0,3424.7223,a8w8_blockscale_1x128x128_256x128x128x128_16x16_32x32_2x2_8x32x1_8x32x1_1x32x1x8_8_1x1_intrawave_v3,787.83,250.89,0.0
gfx942,304,60672,4352,5120,ck,0,0,3428.5814,a8w8_blockscale_1x128x128_256x128x128x128_16x16_32x32_2x2_8x32x1_8x32x1_1x32x1x8_8_1x1_intrawave_v3,788.61,251.13,0.0
gfx942,304,60800,4352,5120,ck,0,0,3364.1224,a8w8_blockscale_1x128x128_256x128x128x128_16x16_32x32_2x2_8x32x1_8x32x1_1x32x1x8_8_1x1_intrawave_v3,805.42,256.47,0.0
gfx942,304,60928,4352,5120,ck,0,0,3405.7342,a8w8_blockscale_1x128x128_256x128x128x128_16x16_32x32_2x2_8x32x1_8x32x1_1x32x1x8_8_1x1_intrawave_v3,797.25,253.85,0.0
gfx942,304,61056,4352,5120,ck,0,0,3380.6208,a8w8_blockscale_1x128x128_256x128x128x128_16x16_32x32_2x2_8x32x1_8x32x1_1x32x1x8_8_1x1_intrawave_v3,804.86,256.26,0.0
gfx942,304,61184,4352,5120,ck,0,0,3387.1228,a8w8_blockscale_1x128x128_256x128x128x128_16x16_32x32_2x2_8x32x1_8x32x1_1x32x1x8_8_1x1_intrawave_v3,805.0,256.29,0.0
gfx942,304,61312,4352,5120,ck,0,0,3389.109,a8w8_blockscale_1x128x128_256x128x128x128_16x16_32x32_2x2_8x32x1_8x32x1_1x32x1x8_8_1x1_intrawave_v3,806.21,256.66,0.0
gfx942,304,61440,4352,5120,ck,0,0,3408.6982,a8w8_blockscale_1x128x128_256x128x128x128_16x16_32x32_2x2_8x32x1_8x32x1_1x32x1x8_8_1x1_intrawave_v3,803.25,255.71,0.0
gfx942,304,61568,4352,5120,ck,0,0,3423.3388,a8w8_blockscale_1x128x128_256x128x128x128_16x16_32x32_2x2_8x32x1_8x32x1_1x32x1x8_8_1x1_intrawave_v3,801.48,255.13,0.0
gfx942,304,61696,4352,5120,ck,0,0,3434.9266,a8w8_blockscale_1x128x128_256x128x128x128_16x16_32x32_2x2_8x32x1_8x32x1_1x32x1x8_8_1x1_intrawave_v3,800.44,254.78,0.0
gfx942,304,61824,4352,5120,ck,0,0,3423.8894,a8w8_blockscale_1x128x128_256x128x128x128_16x16_32x32_2x2_8x32x1_8x32x1_1x32x1x8_8_1x1_intrawave_v3,804.69,256.12,0.0
gfx942,304,61952,4352,5120,ck,0,0,3500.4637,a8w8_blockscale_1x128x128_256x128x128x128_16x16_32x32_2x2_8x32x1_8x32x1_1x32x1x8_8_1x1_intrawave_v3,788.71,251.03,0.0
gfx942,304,62080,4352,5120,ck,0,0,3442.537,a8w8_blockscale_1x128x128_256x128x128x128_16x16_32x32_2x2_8x32x1_8x32x1_1x32x1x8_8_1x1_intrawave_v3,803.64,255.76,0.0
gfx942,304,62208,4352,5120,ck,0,0,3452.3921,a8w8_blockscale_1x128x128_256x128x128x128_16x16_32x32_2x2_8x32x1_8x32x1_1x32x1x8_8_1x1_intrawave_v3,803.0,255.55,0.0
gfx942,304,62336,4352,5120,ck,0,0,3490.864,a8w8_blockscale_1x128x128_256x128x128x128_16x16_32x32_2x2_8x32x1_8x32x1_1x32x1x8_8_1x1_intrawave_v3,795.78,253.24,0.0
gfx942,304,62464,4352,5120,ck,0,0,3488.8615,a8w8_blockscale_1x128x128_256x128x128x128_16x16_32x32_2x2_8x32x1_8x32x1_1x32x1x8_8_1x1_intrawave_v3,797.88,253.89,0.0
gfx942,304,62592,4352,5120,ck,0,0,3507.2594,a8w8_blockscale_1x128x128_256x128x128x128_16x16_32x32_2x2_8x32x1_8x32x1_1x32x1x8_8_1x1_intrawave_v3,795.32,253.06,0.0
gfx942,304,62720,4352,5120,ck,0,0,3513.5099,a8w8_blockscale_1x128x128_256x128x128x128_16x16_32x32_2x2_8x32x1_8x32x1_1x32x1x8_8_1x1_intrawave_v3,795.52,253.12,0.0
gfx942,304,62848,4352,5120,ck,0,0,3544.5541,a8w8_blockscale_1x128x128_256x128x128x128_16x16_32x32_2x2_8x32x1_8x32x1_1x32x1x8_8_1x1_intrawave_v3,790.17,251.4,0.0
gfx942,304,62976,4352,5120,ck,0,0,3557.6524,a8w8_blockscale_1x128x128_256x128x128x128_16x16_32x32_2x2_8x32x1_8x32x1_1x32x1x8_8_1x1_intrawave_v3,788.86,250.97,0.0
gfx942,304,63104,4352,5120,ck,0,0,3493.2344,a8w8_blockscale_1x128x128_256x128x128x128_16x16_32x32_2x2_8x32x1_8x32x1_1x32x1x8_8_1x1_intrawave_v3,805.04,256.1,0.0
gfx942,304,63232,4352,5120,ck,0,0,3462.7074,a8w8_blockscale_1x128x128_256x128x128x128_16x16_32x32_2x2_8x32x1_8x32x1_1x32x1x8_8_1x1_intrawave_v3,813.79,258.87,0.0
gfx942,304,63360,4352,5120,ck,0,0,3471.5026,a8w8_blockscale_1x128x128_256x128x128x128_16x16_32x32_2x2_8x32x1_8x32x1_1x32x1x8_8_1x1_intrawave_v3,813.37,258.73,0.0
gfx942,304,63488,4352,5120,ck,0,0,3560.6261,a8w8_blockscale_1x128x128_256x128x128x128_16x16_32x32_2x2_8x32x1_8x32x1_1x32x1x8_8_1x1_intrawave_v3,794.61,252.75,0.0
gfx942,304,63616,4352,5120,ck,0,0,3560.2595,a8w8_blockscale_1x128x128_256x128x128x128_16x16_32x32_2x2_8x32x1_8x32x1_1x32x1x8_8_1x1_intrawave_v3,796.29,253.27,0.0
gfx942,304,63744,4352,5120,ck,0,0,3612.0604,a8w8_blockscale_1x128x128_256x128x128x128_16x16_32x32_2x2_8x32x1_8x32x1_1x32x1x8_8_1x1_intrawave_v3,786.45,250.13,0.0
gfx942,304,63872,4352,5120,ck,0,0,3503.917,a8w8_blockscale_1x128x128_256x128x128x128_16x16_32x32_2x2_8x32x1_8x32x1_1x32x1x8_8_1x1_intrawave_v3,812.35,258.35,0.0
gfx942,304,64000,4352,5120,ck,0,0,3552.9938,a8w8_blockscale_1x128x128_256x128x128x128_16x16_32x32_2x2_8x32x1_8x32x1_1x32x1x8_8_1x1_intrawave_v3,802.74,255.28,0.0
gfx942,304,64128,4352,5120,ck,0,0,3592.3803,a8w8_blockscale_1x128x128_256x128x128x128_16x16_32x32_2x2_8x32x1_8x32x1_1x32x1x8_8_1x1_intrawave_v3,795.53,252.98,0.0
gfx942,304,64256,4352,5120,ck,0,0,3694.6134,a8w8_blockscale_1x128x128_256x128x128x128_16x16_32x32_2x2_8x32x1_8x32x1_1x32x1x8_8_1x1_intrawave_v3,775.06,246.46,0.0
gfx942,304,64384,4352,5120,ck,0,0,3558.6183,a8w8_blockscale_1x128x128_256x128x128x128_16x16_32x32_2x2_8x32x1_8x32x1_1x32x1x8_8_1x1_intrawave_v3,806.28,256.37,0.0
gfx942,304,64512,4352,5120,ck,0,0,3649.945,a8w8_blockscale_1x128x128_256x128x128x128_16x16_32x32_2x2_8x32x1_8x32x1_1x32x1x8_8_1x1_intrawave_v3,787.67,250.44,0.0
gfx942,304,64640,4352,5120,ck,0,0,3586.454,a8w8_blockscale_1x128x128_256x128x128x128_16x16_32x32_2x2_8x32x1_8x32x1_1x32x1x8_8_1x1_intrawave_v3,803.2,255.37,0.0
gfx942,304,64768,4352,5120,ck,0,0,3581.2642,a8w8_blockscale_1x128x128_256x128x128x128_16x16_32x32_2x2_8x32x1_8x32x1_1x32x1x8_8_1x1_intrawave_v3,805.96,256.23,0.0
gfx942,304,64896,4352,5120,ck,0,0,3623.1658,a8w8_blockscale_1x128x128_256x128x128x128_16x16_32x32_2x2_8x32x1_8x32x1_1x32x1x8_8_1x1_intrawave_v3,798.21,253.76,0.0
gfx942,304,65024,4352,5120,ck,0,0,3633.4804,a8w8_blockscale_1x128x128_256x128x128x128_16x16_32x32_2x2_8x32x1_8x32x1_1x32x1x8_8_1x1_intrawave_v3,797.52,253.52,0.0
gfx942,304,65152,4352,5120,ck,0,0,3581.3518,a8w8_blockscale_1x128x128_256x128x128x128_16x16_32x32_2x2_8x32x1_8x32x1_1x32x1x8_8_1x1_intrawave_v3,810.72,257.71,0.0
gfx942,304,65280,4352,5120,ck,0,0,3644.7208,a8w8_blockscale_1x128x128_256x128x128x128_16x16_32x32_2x2_8x32x1_8x32x1_1x32x1x8_8_1x1_intrawave_v3,798.19,253.71,0.0
gfx942,304,65408,4352,5120,ck,0,0,3648.7611,a8w8_blockscale_1x128x128_256x128x128x128_16x16_32x32_2x2_8x32x1_8x32x1_1x32x1x8_8_1x1_intrawave_v3,798.87,253.92,0.0
gfx942,304,65536,4352,5120,ck,0,0,3643.8998,a8w8_blockscale_1x128x128_256x128x128x128_16x16_32x32_2x2_8x32x1_8x32x1_1x32x1x8_8_1x1_intrawave_v3,801.5,254.74,0.0
gfx942,304,65664,4352,5120,ck,0,0,3664.2405,a8w8_blockscale_1x128x128_256x128x128x128_16x16_32x32_2x2_8x32x1_8x32x1_1x32x1x8_8_1x1_intrawave_v3,798.61,253.81,0.0
gfx942,304,65792,4352,5120,ck,0,0,3645.6504,a8w8_blockscale_1x128x128_256x128x128x128_16x16_32x32_2x2_8x32x1_8x32x1_1x32x1x8_8_1x1_intrawave_v3,804.24,255.59,0.0
gfx942,304,65920,4352,5120,ck,0,0,3643.0998,a8w8_blockscale_1x128x128_256x128x128x128_16x16_32x32_2x2_8x32x1_8x32x1_1x32x1x8_8_1x1_intrawave_v3,806.37,256.25,0.0
gfx942,304,66048,4352,5120,ck,0,0,3654.0478,a8w8_blockscale_1x128x128_256x128x128x128_16x16_32x32_2x2_8x32x1_8x32x1_1x32x1x8_8_1x1_intrawave_v3,805.52,255.97,0.0
gfx942,304,66176,4352,5120,ck,0,0,3717.3717,a8w8_blockscale_1x128x128_256x128x128x128_16x16_32x32_2x2_8x32x1_8x32x1_1x32x1x8_8_1x1_intrawave_v3,793.33,252.09,0.0
gfx942,304,66304,4352,5120,ck,0,0,3750.3002,a8w8_blockscale_1x128x128_256x128x128x128_16x16_32x32_2x2_8x32x1_8x32x1_1x32x1x8_8_1x1_intrawave_v3,787.88,250.34,0.0
gfx942,304,66432,4352,5120,ck,0,0,3764.6844,a8w8_blockscale_1x128x128_256x128x128x128_16x16_32x32_2x2_8x32x1_8x32x1_1x32x1x8_8_1x1_intrawave_v3,786.39,249.86,0.0
gfx942,304,66560,4352,5120,ck,0,0,3825.6122,a8w8_blockscale_1x128x128_256x128x128x128_16x16_32x32_2x2_8x32x1_8x32x1_1x32x1x8_8_1x1_intrawave_v3,775.36,246.34,0.0
gfx942,304,66688,4352,5120,ck,0,0,3748.1933,a8w8_blockscale_1x128x128_256x128x128x128_16x16_32x32_2x2_8x32x1_8x32x1_1x32x1x8_8_1x1_intrawave_v3,792.89,251.9,0.0
gfx942,304,66816,4352,5120,ck,0,0,3761.5866,a8w8_blockscale_1x128x128_256x128x128x128_16x16_32x32_2x2_8x32x1_8x32x1_1x32x1x8_8_1x1_intrawave_v3,791.59,251.48,0.0
gfx942,304,66944,4352,5120,ck,0,0,3680.9262,a8w8_blockscale_1x128x128_256x128x128x128_16x16_32x32_2x2_8x32x1_8x32x1_1x32x1x8_8_1x1_intrawave_v3,810.48,257.47,0.0
gfx942,304,67072,4352,5120,ck,0,0,3767.4751,a8w8_blockscale_1x128x128_256x128x128x128_16x16_32x32_2x2_8x32x1_8x32x1_1x32x1x8_8_1x1_intrawave_v3,793.38,252.02,0.0
gfx942,304,67200,4352,5120,ck,0,0,3774.3013,a8w8_blockscale_1x128x128_256x128x128x128_16x16_32x32_2x2_8x32x1_8x32x1_1x32x1x8_8_1x1_intrawave_v3,793.45,252.03,0.0
gfx942,304,67328,4352,5120,ck,0,0,3720.8979,a8w8_blockscale_1x128x128_256x128x128x128_16x16_32x32_2x2_8x32x1_8x32x1_1x32x1x8_8_1x1_intrawave_v3,806.37,256.13,0.0
gfx942,304,67456,4352,5120,ck,0,0,3768.3955,a8w8_blockscale_1x128x128_256x128x128x128_16x16_32x32_2x2_8x32x1_8x32x1_1x32x1x8_8_1x1_intrawave_v3,797.72,253.37,0.0
gfx942,304,67584,4352,5120,ck,0,0,3711.3034,a8w8_blockscale_1x128x128_256x128x128x128_16x16_32x32_2x2_8x32x1_8x32x1_1x32x1x8_8_1x1_intrawave_v3,811.53,257.74,0.0
gfx942,304,67712,4352,5120,ck,0,0,3720.1306,a8w8_blockscale_1x128x128_256x128x128x128_16x16_32x32_2x2_8x32x1_8x32x1_1x32x1x8_8_1x1_intrawave_v3,811.14,257.61,0.0
gfx942,304,67840,4352,5120,ck,0,0,3806.8346,a8w8_blockscale_1x128x128_256x128x128x128_16x16_32x32_2x2_8x32x1_8x32x1_1x32x1x8_8_1x1_intrawave_v3,794.16,252.2,0.0
gfx942,304,67968,4352,5120,ck,0,0,3811.1032,a8w8_blockscale_1x128x128_256x128x128x128_16x16_32x32_2x2_8x32x1_8x32x1_1x32x1x8_8_1x1_intrawave_v3,794.77,252.39,0.0
gfx942,304,68096,4352,5120,ck,0,0,3736.7474,a8w8_blockscale_1x128x128_256x128x128x128_16x16_32x32_2x2_8x32x1_8x32x1_1x32x1x8_8_1x1_intrawave_v3,812.11,257.88,0.0
gfx942,304,68224,4352,5120,ck,0,0,3833.6831,a8w8_blockscale_1x128x128_256x128x128x128_16x16_32x32_2x2_8x32x1_8x32x1_1x32x1x8_8_1x1_intrawave_v3,793.07,251.82,0.0
gfx942,304,68352,4352,5120,ck,0,0,3819.0656,a8w8_blockscale_1x128x128_256x128x128x128_16x16_32x32_2x2_8x32x1_8x32x1_1x32x1x8_8_1x1_intrawave_v3,797.6,253.25,0.0
gfx942,304,68480,4352,5120,ck,0,0,3790.5028,a8w8_blockscale_1x128x128_256x128x128x128_16x16_32x32_2x2_8x32x1_8x32x1_1x32x1x8_8_1x1_intrawave_v3,805.11,255.63,0.0
gfx942,304,68608,4352,5120,ck,0,0,3792.1119,a8w8_blockscale_1x128x128_256x128x128x128_16x16_32x32_2x2_8x32x1_8x32x1_1x32x1x8_8_1x1_intrawave_v3,806.27,255.98,0.0
gfx942,304,68736,4352,5120,ck,0,0,3817.1319,a8w8_blockscale_1x128x128_256x128x128x128_16x16_32x32_2x2_8x32x1_8x32x1_1x32x1x8_8_1x1_intrawave_v3,802.48,254.77,0.0
gfx942,304,68864,4352,5120,ck,0,0,3817.2902,a8w8_blockscale_1x128x128_256x128x128x128_16x16_32x32_2x2_8x32x1_8x32x1_1x32x1x8_8_1x1_intrawave_v3,803.94,255.22,0.0
gfx942,304,68992,4352,5120,ck,0,0,3881.0763,a8w8_blockscale_1x128x128_256x128x128x128_16x16_32x32_2x2_8x32x1_8x32x1_1x32x1x8_8_1x1_intrawave_v3,792.2,251.48,0.0
gfx942,304,69120,4352,5120,ck,0,0,3877.5011,a8w8_blockscale_1x128x128_256x128x128x128_16x16_32x32_2x2_8x32x1_8x32x1_1x32x1x8_8_1x1_intrawave_v3,794.4,252.17,0.0
gfx942,304,69248,4352,5120,ck,0,0,3892.5691,a8w8_blockscale_1x128x128_256x128x128x128_16x16_32x32_2x2_8x32x1_8x32x1_1x32x1x8_8_1x1_intrawave_v3,792.79,251.65,0.0
gfx942,304,69376,4352,5120,ck,0,0,3896.5262,a8w8_blockscale_1x128x128_256x128x128x128_16x16_32x32_2x2_8x32x1_8x32x1_1x32x1x8_8_1x1_intrawave_v3,793.45,251.85,0.0
gfx942,304,69504,4352,5120,ck,0,0,3902.861,a8w8_blockscale_1x128x128_256x128x128x128_16x16_32x32_2x2_8x32x1_8x32x1_1x32x1x8_8_1x1_intrawave_v3,793.63,251.89,0.0
gfx942,304,69632,4352,5120,ck,0,0,3898.0012,a8w8_blockscale_1x128x128_256x128x128x128_16x16_32x32_2x2_8x32x1_8x32x1_1x32x1x8_8_1x1_intrawave_v3,796.08,252.66,0.0
gfx942,304,69760,4352,5120,ck,0,0,3866.5573,a8w8_blockscale_1x128x128_256x128x128x128_16x16_32x32_2x2_8x32x1_8x32x1_1x32x1x8_8_1x1_intrawave_v3,804.03,255.17,0.0
gfx942,304,69888,4352,5120,ck,0,0,3906.2023,a8w8_blockscale_1x128x128_256x128x128x128_16x16_32x32_2x2_8x32x1_8x32x1_1x32x1x8_8_1x1_intrawave_v3,797.33,253.04,0.0
gfx942,304,70016,4352,5120,ck,0,0,3896.0522,a8w8_blockscale_1x128x128_256x128x128x128_16x16_32x32_2x2_8x32x1_8x32x1_1x32x1x8_8_1x1_intrawave_v3,800.87,254.15,0.0
gfx942,304,70144,4352,5120,ck,0,0,3862.7314,a8w8_blockscale_1x128x128_256x128x128x128_16x16_32x32_2x2_8x32x1_8x32x1_1x32x1x8_8_1x1_intrawave_v3,809.25,256.8,0.0
gfx942,304,70272,4352,5120,ck,0,0,3995.4499,a8w8_blockscale_1x128x128_256x128x128x128_16x16_32x32_2x2_8x32x1_8x32x1_1x32x1x8_8_1x1_intrawave_v3,783.8,248.71,0.0
gfx942,304,70400,4352,5120,ck,0,0,3961.7324,a8w8_blockscale_1x128x128_256x128x128x128_16x16_32x32_2x2_8x32x1_8x32x1_1x32x1x8_8_1x1_intrawave_v3,791.91,251.28,0.0
gfx942,304,70528,4352,5120,ck,0,0,3961.9001,a8w8_blockscale_1x128x128_256x128x128x128_16x16_32x32_2x2_8x32x1_8x32x1_1x32x1x8_8_1x1_intrawave_v3,793.32,251.71,0.0
gfx942,304,70656,4352,5120,ck,0,0,3878.7555,a8w8_blockscale_1x128x128_256x128x128x128_16x16_32x32_2x2_8x32x1_8x32x1_1x32x1x8_8_1x1_intrawave_v3,811.79,257.56,0.0
gfx942,304,70784,4352,5120,ck,0,0,3998.4307,a8w8_blockscale_1x128x128_256x128x128x128_16x16_32x32_2x2_8x32x1_8x32x1_1x32x1x8_8_1x1_intrawave_v3,788.92,250.3,0.0
gfx942,304,70912,4352,5120,ck,0,0,3870.2786,a8w8_blockscale_1x128x128_256x128x128x128_16x16_32x32_2x2_8x32x1_8x32x1_1x32x1x8_8_1x1_intrawave_v3,816.52,259.04,0.0
gfx942,304,71040,4352,5120,ck,0,0,3919.1316,a8w8_blockscale_1x128x128_256x128x128x128_16x16_32x32_2x2_8x32x1_8x32x1_1x32x1x8_8_1x1_intrawave_v3,807.8,256.27,0.0
gfx942,304,71168,4352,5120,ck,0,0,3926.8622,a8w8_blockscale_1x128x128_256x128x128x128_16x16_32x32_2x2_8x32x1_8x32x1_1x32x1x8_8_1x1_intrawave_v3,807.66,256.21,0.0
gfx942,304,71296,4352,5120,ck,0,0,3979.4029,a8w8_blockscale_1x128x128_256x128x128x128_16x16_32x32_2x2_8x32x1_8x32x1_1x32x1x8_8_1x1_intrawave_v3,798.43,253.27,0.0
gfx942,304,71424,4352,5120,ck,0,0,3929.8776,a8w8_blockscale_1x128x128_256x128x128x128_16x16_32x32_2x2_8x32x1_8x32x1_1x32x1x8_8_1x1_intrawave_v3,809.94,256.92,0.0
gfx942,304,71552,4352,5120,ck,0,0,3956.8866,a8w8_blockscale_1x128x128_256x128x128x128_16x16_32x32_2x2_8x32x1_8x32x1_1x32x1x8_8_1x1_intrawave_v3,805.86,255.61,0.0
gfx942,304,71680,4352,5120,ck,0,0,3914.5543,a8w8_blockscale_1x128x128_256x128x128x128_16x16_32x32_2x2_8x32x1_8x32x1_1x32x1x8_8_1x1_intrawave_v3,816.03,258.83,0.0
gfx942,304,71808,4352,5120,ck,0,0,3973.1738,a8w8_blockscale_1x128x128_256x128x128x128_16x16_32x32_2x2_8x32x1_8x32x1_1x32x1x8_8_1x1_intrawave_v3,805.42,255.45,0.0
gfx942,304,71936,4352,5120,ck,0,0,4053.0762,a8w8_blockscale_1x128x128_256x128x128x128_16x16_32x32_2x2_8x32x1_8x32x1_1x32x1x8_8_1x1_intrawave_v3,790.95,250.85,0.0
gfx942,304,72064,4352,5120,ck,0,0,3975.5879,a8w8_blockscale_1x128x128_256x128x128x128_16x16_32x32_2x2_8x32x1_8x32x1_1x32x1x8_8_1x1_intrawave_v3,807.8,256.19,0.0
gfx942,304,72192,4352,5120,ck,0,0,4075.8288,a8w8_blockscale_1x128x128_256x128x128x128_16x16_32x32_2x2_8x32x1_8x32x1_1x32x1x8_8_1x1_intrawave_v3,789.34,250.32,0.0
gfx942,304,72320,4352,5120,ck,0,0,4085.4805,a8w8_blockscale_1x128x128_256x128x128x128_16x16_32x32_2x2_8x32x1_8x32x1_1x32x1x8_8_1x1_intrawave_v3,788.87,250.16,0.0
gfx942,304,72448,4352,5120,ck,0,0,4090.6227,a8w8_blockscale_1x128x128_256x128x128x128_16x16_32x32_2x2_8x32x1_8x32x1_1x32x1x8_8_1x1_intrawave_v3,789.27,250.28,0.0
gfx942,304,72576,4352,5120,ck,0,0,4089.3487,a8w8_blockscale_1x128x128_256x128x128x128_16x16_32x32_2x2_8x32x1_8x32x1_1x32x1x8_8_1x1_intrawave_v3,790.91,250.79,0.0
gfx942,304,72704,4352,5120,ck,0,0,4021.9399,a8w8_blockscale_1x128x128_256x128x128x128_16x16_32x32_2x2_8x32x1_8x32x1_1x32x1x8_8_1x1_intrawave_v3,805.59,255.43,0.0
gfx942,304,72832,4352,5120,ck,0,0,4030.1034,a8w8_blockscale_1x128x128_256x128x128x128_16x16_32x32_2x2_8x32x1_8x32x1_1x32x1x8_8_1x1_intrawave_v3,805.37,255.36,0.0
gfx942,304,72960,4352,5120,ck,0,0,4102.3597,a8w8_blockscale_1x128x128_256x128x128x128_16x16_32x32_2x2_8x32x1_8x32x1_1x32x1x8_8_1x1_intrawave_v3,792.57,251.29,0.0
gfx942,304,73088,4352,5120,ck,0,0,4024.3455,a8w8_blockscale_1x128x128_256x128x128x128_16x16_32x32_2x2_8x32x1_8x32x1_1x32x1x8_8_1x1_intrawave_v3,809.36,256.6,0.0
gfx942,304,73216,4352,5120,ck,0,0,4044.2012,a8w8_blockscale_1x128x128_256x128x128x128_16x16_32x32_2x2_8x32x1_8x32x1_1x32x1x8_8_1x1_intrawave_v3,806.79,255.78,0.0
gfx942,304,73344,4352,5120,ck,0,0,4095.4478,a8w8_blockscale_1x128x128_256x128x128x128_16x16_32x32_2x2_8x32x1_8x32x1_1x32x1x8_8_1x1_intrawave_v3,798.09,253.01,0.0
gfx942,304,73472,4352,5120,ck,0,0,4086.3539,a8w8_blockscale_1x128x128_256x128x128x128_16x16_32x32_2x2_8x32x1_8x32x1_1x32x1x8_8_1x1_intrawave_v3,801.26,254.01,0.0
gfx942,304,73600,4352,5120,ck,0,0,4149.7212,a8w8_blockscale_1x128x128_256x128x128x128_16x16_32x32_2x2_8x32x1_8x32x1_1x32x1x8_8_1x1_intrawave_v3,790.4,250.55,0.0
gfx942,304,73728,4352,5120,ck,0,0,4097.3923,a8w8_blockscale_1x128x128_256x128x128x128_16x16_32x32_2x2_8x32x1_8x32x1_1x32x1x8_8_1x1_intrawave_v3,801.89,254.19,0.0
gfx942,304,73856,4352,5120,ck,0,0,4088.4811,a8w8_blockscale_1x128x128_256x128x128x128_16x16_32x32_2x2_8x32x1_8x32x1_1x32x1x8_8_1x1_intrawave_v3,805.03,255.17,0.0
gfx942,304,73984,4352,5120,ck,0,0,4050.4023,a8w8_blockscale_1x128x128_256x128x128x128_16x16_32x32_2x2_8x32x1_8x32x1_1x32x1x8_8_1x1_intrawave_v3,814.01,258.01,0.0
gfx942,304,74112,4352,5120,ck,0,0,4108.2276,a8w8_blockscale_1x128x128_256x128x128x128_16x16_32x32_2x2_8x32x1_8x32x1_1x32x1x8_8_1x1_intrawave_v3,803.94,254.81,0.0
gfx942,304,74240,4352,5120,ck,0,0,4136.1997,a8w8_blockscale_1x128x128_256x128x128x128_16x16_32x32_2x2_8x32x1_8x32x1_1x32x1x8_8_1x1_intrawave_v3,799.88,253.51,0.0
gfx942,304,74368,4352,5120,ck,0,0,4169.1116,a8w8_blockscale_1x128x128_256x128x128x128_16x16_32x32_2x2_8x32x1_8x32x1_1x32x1x8_8_1x1_intrawave_v3,794.93,251.94,0.0
gfx942,304,74496,4352,5120,ck,0,0,4174.1106,a8w8_blockscale_1x128x128_256x128x128x128_16x16_32x32_2x2_8x32x1_8x32x1_1x32x1x8_8_1x1_intrawave_v3,795.35,252.06,0.0
gfx942,304,74624,4352,5120,ck,0,0,4177.9394,a8w8_blockscale_1x128x128_256x128x128x128_16x16_32x32_2x2_8x32x1_8x32x1_1x32x1x8_8_1x1_intrawave_v3,795.99,252.25,0.0
gfx942,304,74752,4352,5120,ck,0,0,4135.705,a8w8_blockscale_1x128x128_256x128x128x128_16x16_32x32_2x2_8x32x1_8x32x1_1x32x1x8_8_1x1_intrawave_v3,805.49,255.25,0.0
gfx942,304,74880,4352,5120,ck,0,0,4103.11,a8w8_blockscale_1x128x128_256x128x128x128_16x16_32x32_2x2_8x32x1_8x32x1_1x32x1x8_8_1x1_intrawave_v3,813.28,257.71,0.0
gfx942,304,75008,4352,5120,ck,0,0,4143.7945,a8w8_blockscale_1x128x128_256x128x128x128_16x16_32x32_2x2_8x32x1_8x32x1_1x32x1x8_8_1x1_intrawave_v3,806.67,255.61,0.0
gfx942,304,75136,4352,5120,ck,0,0,4219.155,a8w8_blockscale_1x128x128_256x128x128x128_16x16_32x32_2x2_8x32x1_8x32x1_1x32x1x8_8_1x1_intrawave_v3,793.62,251.46,0.0
gfx942,304,75264,4352,5120,ck,0,0,4306.3441,a8w8_blockscale_1x128x128_256x128x128x128_16x16_32x32_2x2_8x32x1_8x32x1_1x32x1x8_8_1x1_intrawave_v3,778.87,246.78,0.0
gfx942,304,75392,4352,5120,ck,0,0,4206.8549,a8w8_blockscale_1x128x128_256x128x128x128_16x16_32x32_2x2_8x32x1_8x32x1_1x32x1x8_8_1x1_intrawave_v3,798.65,253.04,0.0
gfx942,304,75520,4352,5120,ck,0,0,4252.7384,a8w8_blockscale_1x128x128_256x128x128x128_16x16_32x32_2x2_8x32x1_8x32x1_1x32x1x8_8_1x1_intrawave_v3,791.37,250.73,0.0
gfx942,304,75648,4352,5120,ck,0,0,4151.4288,a8w8_blockscale_1x128x128_256x128x128x128_16x16_32x32_2x2_8x32x1_8x32x1_1x32x1x8_8_1x1_intrawave_v3,812.06,257.27,0.0
gfx942,304,75776,4352,5120,ck,0,0,4211.3929,a8w8_blockscale_1x128x128_256x128x128x128_16x16_32x32_2x2_8x32x1_8x32x1_1x32x1x8_8_1x1_intrawave_v3,801.85,254.03,0.0
gfx942,304,75904,4352,5120,ck,0,0,4211.7188,a8w8_blockscale_1x128x128_256x128x128x128_16x16_32x32_2x2_8x32x1_8x32x1_1x32x1x8_8_1x1_intrawave_v3,803.15,254.43,0.0
gfx942,304,76032,4352,5120,ck,0,0,4163.8721,a8w8_blockscale_1x128x128_256x128x128x128_16x16_32x32_2x2_8x32x1_8x32x1_1x32x1x8_8_1x1_intrawave_v3,813.74,257.78,0.0
gfx942,304,76160,4352,5120,ck,0,0,4212.2995,a8w8_blockscale_1x128x128_256x128x128x128_16x16_32x32_2x2_8x32x1_8x32x1_1x32x1x8_8_1x1_intrawave_v3,805.74,255.23,0.0
gfx942,304,76288,4352,5120,ck,0,0,4220.4211,a8w8_blockscale_1x128x128_256x128x128x128_16x16_32x32_2x2_8x32x1_8x32x1_1x32x1x8_8_1x1_intrawave_v3,805.54,255.16,0.0
gfx942,304,76416,4352,5120,ck,0,0,4195.3191,a8w8_blockscale_1x128x128_256x128x128x128_16x16_32x32_2x2_8x32x1_8x32x1_1x32x1x8_8_1x1_intrawave_v3,811.72,257.11,0.0
gfx942,304,76544,4352,5120,ck,0,0,4235.3592,a8w8_blockscale_1x128x128_256x128x128x128_16x16_32x32_2x2_8x32x1_8x32x1_1x32x1x8_8_1x1_intrawave_v3,805.4,255.1,0.0
gfx942,304,76672,4352,5120,ck,0,0,4323.741,a8w8_blockscale_1x128x128_256x128x128x128_16x16_32x32_2x2_8x32x1_8x32x1_1x32x1x8_8_1x1_intrawave_v3,790.25,250.29,0.0
gfx942,304,76800,4352,5120,ck,0,0,4273.5864,a8w8_blockscale_1x128x128_256x128x128x128_16x16_32x32_2x2_8x32x1_8x32x1_1x32x1x8_8_1x1_intrawave_v3,800.86,253.64,0.0
gfx942,304,76928,4352,5120,ck,0,0,4315.4239,a8w8_blockscale_1x128x128_256x128x128x128_16x16_32x32_2x2_8x32x1_8x32x1_1x32x1x8_8_1x1_intrawave_v3,794.42,251.59,0.0
gfx942,304,77056,4352,5120,ck,0,0,4276.2868,a8w8_blockscale_1x128x128_256x128x128x128_16x16_32x32_2x2_8x32x1_8x32x1_1x32x1x8_8_1x1_intrawave_v3,803.02,254.31,0.0
gfx942,304,77184,4352,5120,ck,0,0,4279.1487,a8w8_blockscale_1x128x128_256x128x128x128_16x16_32x32_2x2_8x32x1_8x32x1_1x32x1x8_8_1x1_intrawave_v3,803.82,254.55,0.0
gfx942,304,77312,4352,5120,ck,0,0,4369.5472,a8w8_blockscale_1x128x128_256x128x128x128_16x16_32x32_2x2_8x32x1_8x32x1_1x32x1x8_8_1x1_intrawave_v3,788.5,249.69,0.0
gfx942,304,77440,4352,5120,ck,0,0,4374.0447,a8w8_blockscale_1x128x128_256x128x128x128_16x16_32x32_2x2_8x32x1_8x32x1_1x32x1x8_8_1x1_intrawave_v3,788.99,249.84,0.0
gfx942,304,77568,4352,5120,ck,0,0,4336.9801,a8w8_blockscale_1x128x128_256x128x128x128_16x16_32x32_2x2_8x32x1_8x32x1_1x32x1x8_8_1x1_intrawave_v3,797.05,252.38,0.0
gfx942,304,77696,4352,5120,ck,0,0,4300.7601,a8w8_blockscale_1x128x128_256x128x128x128_16x16_32x32_2x2_8x32x1_8x32x1_1x32x1x8_8_1x1_intrawave_v3,805.09,254.92,0.0
gfx942,304,77824,4352,5120,ck,0,0,4354.5839,a8w8_blockscale_1x128x128_256x128x128x128_16x16_32x32_2x2_8x32x1_8x32x1_1x32x1x8_8_1x1_intrawave_v3,796.44,252.18,0.0
gfx942,304,77952,4352,5120,ck,0,0,4369.1885,a8w8_blockscale_1x128x128_256x128x128x128_16x16_32x32_2x2_8x32x1_8x32x1_1x32x1x8_8_1x1_intrawave_v3,795.09,251.74,0.0
gfx942,304,78080,4352,5120,ck,0,0,4379.5433,a8w8_blockscale_1x128x128_256x128x128x128_16x16_32x32_2x2_8x32x1_8x32x1_1x32x1x8_8_1x1_intrawave_v3,794.51,251.55,0.0
gfx942,304,78208,4352,5120,ck,0,0,4354.1526,a8w8_blockscale_1x128x128_256x128x128x128_16x16_32x32_2x2_8x32x1_8x32x1_1x32x1x8_8_1x1_intrawave_v3,800.45,253.42,0.0
gfx942,304,78336,4352,5120,ck,0,0,4366.9172,a8w8_blockscale_1x128x128_256x128x128x128_16x16_32x32_2x2_8x32x1_8x32x1_1x32x1x8_8_1x1_intrawave_v3,799.42,253.08,0.0
gfx942,304,78464,4352,5120,ck,0,0,4352.2105,a8w8_blockscale_1x128x128_256x128x128x128_16x16_32x32_2x2_8x32x1_8x32x1_1x32x1x8_8_1x1_intrawave_v3,803.43,254.35,0.0
gfx942,304,78592,4352,5120,ck,0,0,4411.9368,a8w8_blockscale_1x128x128_256x128x128x128_16x16_32x32_2x2_8x32x1_8x32x1_1x32x1x8_8_1x1_intrawave_v3,793.85,251.3,0.0
gfx942,304,78720,4352,5120,ck,0,0,4310.7494,a8w8_blockscale_1x128x128_256x128x128x128_16x16_32x32_2x2_8x32x1_8x32x1_1x32x1x8_8_1x1_intrawave_v3,813.81,257.61,0.0
gfx942,304,78848,4352,5120,ck,0,0,4401.4909,a8w8_blockscale_1x128x128_256x128x128x128_16x16_32x32_2x2_8x32x1_8x32x1_1x32x1x8_8_1x1_intrawave_v3,798.32,252.7,0.0
gfx942,304,78976,4352,5120,ck,0,0,4414.3899,a8w8_blockscale_1x128x128_256x128x128x128_16x16_32x32_2x2_8x32x1_8x32x1_1x32x1x8_8_1x1_intrawave_v3,797.28,252.37,0.0
gfx942,304,79104,4352,5120,ck,0,0,4345.1628,a8w8_blockscale_1x128x128_256x128x128x128_16x16_32x32_2x2_8x32x1_8x32x1_1x32x1x8_8_1x1_intrawave_v3,811.3,256.79,0.0
gfx942,304,79232,4352,5120,ck,0,0,4343.5436,a8w8_blockscale_1x128x128_256x128x128x128_16x16_32x32_2x2_8x32x1_8x32x1_1x32x1x8_8_1x1_intrawave_v3,812.92,257.3,0.0
gfx942,304,79360,4352,5120,ck,0,0,4352.1903,a8w8_blockscale_1x128x128_256x128x128x128_16x16_32x32_2x2_8x32x1_8x32x1_1x32x1x8_8_1x1_intrawave_v3,812.61,257.19,0.0
gfx942,304,79488,4352,5120,ck,0,0,4541.9448,a8w8_blockscale_1x128x128_256x128x128x128_16x16_32x32_2x2_8x32x1_8x32x1_1x32x1x8_8_1x1_intrawave_v3,779.92,246.84,0.0
gfx942,304,79616,4352,5120,ck,0,0,4441.2457,a8w8_blockscale_1x128x128_256x128x128x128_16x16_32x32_2x2_8x32x1_8x32x1_1x32x1x8_8_1x1_intrawave_v3,798.89,252.83,0.0
gfx942,304,79744,4352,5120,ck,0,0,4515.5807,a8w8_blockscale_1x128x128_256x128x128x128_16x16_32x32_2x2_8x32x1_8x32x1_1x32x1x8_8_1x1_intrawave_v3,787.0,249.06,0.0
gfx942,304,79872,4352,5120,ck,0,0,4485.4032,a8w8_blockscale_1x128x128_256x128x128x128_16x16_32x32_2x2_8x32x1_8x32x1_1x32x1x8_8_1x1_intrawave_v3,793.56,251.13,0.0
gfx942,304,80000,4352,5120,ck,0,0,4513.2229,a8w8_blockscale_1x128x128_256x128x128x128_16x16_32x32_2x2_8x32x1_8x32x1_1x32x1x8_8_1x1_intrawave_v3,789.94,249.98,0.0
gfx942,304,16,5120,768,ck,8,0,5.1347,a8w8_blockscale_1x128x128_256x16x64x256_16x16_16x16_1x1_16x16x1_16x16x1_1x16x1x16_4_1x1_intrawave_v1,24.51,800.1,0.0
gfx942,304,16,5120,2176,ck,8,0,11.2253,a8w8_blockscale_1x128x128_256x16x64x256_16x16_16x16_1x1_16x16x1_16x16x1_1x16x1x16_4_1x1_intrawave_v1,31.76,1010.2,0.0
gfx942,304,32,5120,768,ck,8,0,5.363,a8w8_blockscale_1x128x128_256x16x64x256_16x16_16x16_1x1_16x16x1_16x16x1_1x16x1x16_4_1x1_intrawave_v1,46.92,798.88,0.0
gfx942,304,32,5120,2176,ck,8,0,11.2962,a8w8_blockscale_1x128x128_256x16x64x256_16x16_16x16_1x1_16x16x1_16x16x1_1x16x1x16_4_1x1_intrawave_v1,63.12,1021.44,0.0
gfx942,304,48,5120,768,ck,8,0,5.4115,a8w8_blockscale_1x128x128_256x16x64x256_16x16_16x16_1x1_16x16x1_16x16x1_1x16x1x16_4_1x1_intrawave_v1,69.76,824.27,0.0
gfx942,304,48,5120,2176,ck,8,0,11.6015,a8w8_blockscale_1x128x128_256x16x64x256_16x16_16x16_1x1_16x16x1_16x16x1_1x16x1x16_4_1x1_intrawave_v1,92.19,1011.69,0.0
gfx942,304,64,5120,768,ck,13,0,5.6541,a8w8_blockscale_1x128x128_256x32x64x256_16x16_16x16_2x1_16x16x1_16x16x1_1x32x1x8_8_2x1_intrawave_v1,89.02,820.05,0.0
gfx942,304,64,5120,2176,ck,6,0,11.8221,a8w8_blockscale_1x128x128_256x16x64x128_8x16_16x16_1x1_16x16x1_8x32x1_1x16x1x16_4_1x1_intrawave_v1,120.63,1009.61,0.0
gfx942,304,80,5120,768,ck,13,0,5.9101,a8w8_blockscale_1x128x128_256x32x64x256_16x16_16x16_2x1_16x16x1_16x16x1_1x32x1x8_8_2x1_intrawave_v1,106.45,814.33,0.0
gfx942,304,80,5120,2176,ck,13,0,12.4239,a8w8_blockscale_1x128x128_256x32x64x256_16x16_16x16_2x1_16x16x1_16x16x1_1x32x1x8_8_2x1_intrawave_v1,143.48,976.7,0.0
gfx942,304,96,5120,768,ck,7,0,6.0885,a8w8_blockscale_1x128x128_256x16x128x256_16x16_16x16_1x2_16x16x1_16x16x1_1x16x1x16_8_1x2_intrawave_v1,124.0,819.4,0.0
gfx942,304,96,5120,2176,ck,5,0,12.2644,a8w8_blockscale_1x128x128_256x16x128x128_8x16_16x16_1x2_16x16x1_8x32x1_1x16x1x16_8_1x2_intrawave_v1,174.41,1005.6,0.0
gfx942,304,112,5120,768,ck,7,0,6.1661,a8w8_blockscale_1x128x128_256x16x128x256_16x16_16x16_1x2_16x16x1_16x16x1_1x16x1x16_8_1x2_intrawave_v1,142.85,837.65,0.0
gfx942,304,112,5120,2176,ck,5,0,12.5552,a8w8_blockscale_1x128x128_256x16x128x128_8x16_16x16_1x2_16x16x1_8x32x1_1x16x1x16_8_1x2_intrawave_v1,198.77,998.13,0.0
gfx942,304,128,5120,768,ck,18,0,7.0884,a8w8_blockscale_1x128x128_256x64x64x256_16x16_32x32_1x1_16x16x1_16x16x1_1x32x1x8_8_1x1_intrawave_v1,142.01,753.51,0.0
gfx942,304,128,5120,2176,ck,3,0,12.8181,a8w8_blockscale_1x128x128_256x64x64x128_16x16_32x32_1x1_8x32x1_8x32x1_1x32x1x8_8_1x1_intrawave_v3,222.51,993.16,0.0
gfx942,304,144,5120,768,ck,18,0,7.4505,a8w8_blockscale_1x128x128_256x64x64x256_16x16_32x32_1x1_16x16x1_16x16x1_1x32x1x8_8_1x1_intrawave_v1,152.0,740.53,0.0
gfx942,304,144,5120,2176,ck,3,0,14.2035,a8w8_blockscale_1x128x128_256x64x64x128_16x16_32x32_1x1_8x32x1_8x32x1_1x32x1x8_8_1x1_intrawave_v3,225.91,910.27,0.0
gfx942,304,160,5120,768,ck,18,0,7.1074,a8w8_blockscale_1x128x128_256x64x64x256_16x16_32x32_1x1_16x16x1_16x16x1_1x32x1x8_8_1x1_intrawave_v1,177.04,801.06,0.0
gfx942,304,160,5120,2176,ck,3,0,14.1504,a8w8_blockscale_1x128x128_256x64x64x128_16x16_32x32_1x1_8x32x1_8x32x1_1x32x1x8_8_1x1_intrawave_v3,251.95,927.73,0.0
gfx942,304,176,5120,768,ck,18,0,7.5047,a8w8_blockscale_1x128x128_256x64x64x256_16x16_32x32_1x1_16x16x1_16x16x1_1x32x1x8_8_1x1_intrawave_v1,184.43,782.12,0.0
gfx942,304,176,5120,2176,ck,3,0,14.5416,a8w8_blockscale_1x128x128_256x64x64x128_16x16_32x32_1x1_8x32x1_8x32x1_1x32x1x8_8_1x1_intrawave_v3,269.69,916.43,0.0
gfx942,304,192,5120,768,ck,18,0,7.2555,a8w8_blockscale_1x128x128_256x64x64x256_16x16_32x32_1x1_16x16x1_16x16x1_1x32x1x8_8_1x1_intrawave_v1,208.11,833.26,0.0
gfx942,304,192,5120,2176,ck,3,0,14.0878,a8w8_blockscale_1x128x128_256x64x64x128_16x16_32x32_1x1_8x32x1_8x32x1_1x32x1x8_8_1x1_intrawave_v3,303.68,960.05,0.0
gfx942,304,208,5120,768,ck,12,0,7.7455,a8w8_blockscale_1x128x128_256x32x128x256_16x16_32x32_1x1_16x16x1_16x16x1_1x32x1x8_8_1x1_intrawave_v1,211.19,803.28,0.0
gfx942,304,208,5120,2176,ck,2,0,16.3121,a8w8_blockscale_1x128x128_256x64x128x128_16x16_32x32_1x2_8x32x1_8x32x1_1x32x1x8_8_1x1_intrawave_v3,284.13,841.32,0.0
gfx942,304,224,5120,768,ck,12,0,8.0289,a8w8_blockscale_1x128x128_256x32x128x256_16x16_32x32_1x1_16x16x1_16x16x1_1x32x1x8_8_1x1_intrawave_v1,219.41,796.87,0.0
gfx942,304,224,5120,2176,ck,2,0,16.488,a8w8_blockscale_1x128x128_256x64x128x128_16x16_32x32_1x2_8x32x1_8x32x1_1x32x1x8_8_1x1_intrawave_v3,302.72,844.39,0.0
gfx942,304,240,5120,768,ck,4,0,8.9626,a8w8_blockscale_1x128x128_256x16x256x128_8x16_16x16_1x4_16x16x1_8x32x1_1x16x1x16_8_1x2_intrawave_v1,210.59,733.5,0.0
gfx942,304,240,5120,2176,ck,2,0,16.5314,a8w8_blockscale_1x128x128_256x64x128x128_16x16_32x32_1x2_8x32x1_8x32x1_1x32x1x8_8_1x1_intrawave_v3,323.49,854.19,0.0
gfx942,304,256,5120,768,ck,3,0,8.4178,a8w8_blockscale_1x128x128_256x64x64x128_16x16_32x32_1x1_8x32x1_8x32x1_1x32x1x8_8_1x1_intrawave_v3,239.17,801.9,0.0
gfx942,304,256,5120,2176,ck,2,0,16.8501,a8w8_blockscale_1x128x128_256x64x128x128_16x16_32x32_1x2_8x32x1_8x32x1_1x32x1x8_8_1x1_intrawave_v3,338.53,849.82,0.0
gfx942,304,288,5120,768,ck,2,0,10.076,a8w8_blockscale_1x128x128_256x64x128x128_16x16_32x32_1x2_8x32x1_8x32x1_1x32x1x8_8_1x1_intrawave_v3,224.78,704.89,0.0
gfx942,304,288,5120,2176,ck,2,0,18.8467,a8w8_blockscale_1x128x128_256x64x128x128_16x16_32x32_1x2_8x32x1_8x32x1_1x32x1x8_8_1x1_intrawave_v3,340.5,780.88,0.0
gfx942,304,320,5120,768,ck,2,0,10.0316,a8w8_blockscale_1x128x128_256x64x128x128_16x16_32x32_1x2_8x32x1_8x32x1_1x32x1x8_8_1x1_intrawave_v3,250.87,743.12,0.0
gfx942,304,320,5120,2176,ck,2,0,19.0712,a8w8_blockscale_1x128x128_256x64x128x128_16x16_32x32_1x2_8x32x1_8x32x1_1x32x1x8_8_1x1_intrawave_v3,373.88,792.52,0.0
gfx942,304,352,5120,768,ck,2,0,11.0492,a8w8_blockscale_1x128x128_256x64x128x128_16x16_32x32_1x2_8x32x1_8x32x1_1x32x1x8_8_1x1_intrawave_v3,250.54,706.56,0.0
gfx942,304,352,5120,2176,ck,1,0,20.9061,a8w8_blockscale_1x128x128_256x128x64x128_16x16_32x32_2x1_8x32x1_8x32x1_1x32x1x8_8_1x1_intrawave_v3,375.17,741.96,0.0
gfx942,304,384,5120,768,ck,15,0,10.7771,a8w8_blockscale_1x128x128_256x64x128x128_16x16_32x32_2x1_8x32x1_8x32x1_1x32x1x8_8_1x1_intrawave_v1,280.21,757.09,0.0
gfx942,304,384,5120,2176,ck,2,0,20.111,a8w8_blockscale_1x128x128_256x64x128x128_16x16_32x32_1x2_8x32x1_8x32x1_1x32x1x8_8_1x1_intrawave_v3,425.46,791.05,0.0
gfx942,304,416,5120,768,ck,2,0,11.5427,a8w8_blockscale_1x128x128_256x64x128x128_16x16_32x32_1x2_8x32x1_8x32x1_1x32x1x8_8_1x1_intrawave_v3,283.43,737.39,0.0
gfx942,304,416,5120,2176,ck,2,0,21.9513,a8w8_blockscale_1x128x128_256x64x128x128_16x16_32x32_1x2_8x32x1_8x32x1_1x32x1x8_8_1x1_intrawave_v3,422.27,742.83,0.0
gfx942,304,448,5120,768,ck,18,0,11.6228,a8w8_blockscale_1x128x128_256x64x64x256_16x16_32x32_1x1_16x16x1_16x16x1_1x32x1x8_8_1x1_intrawave_v1,303.13,762.62,0.0
gfx942,304,448,5120,2176,ck,2,0,22.0696,a8w8_blockscale_1x128x128_256x64x128x128_16x16_32x32_1x2_8x32x1_8x32x1_1x32x1x8_8_1x1_intrawave_v3,452.32,756.86,0.0
gfx942,304,480,5120,768,ck,0,0,13.2459,a8w8_blockscale_1x128x128_256x128x128x128_16x16_32x32_2x2_8x32x1_8x32x1_1x32x1x8_8_1x1_intrawave_v3,284.98,695.76,0.0
gfx942,304,480,5120,2176,ck,0,0,24.6085,a8w8_blockscale_1x128x128_256x128x128x128_16x16_32x32_2x2_8x32x1_8x32x1_1x32x1x8_8_1x1_intrawave_v3,434.63,694.91,0.0
gfx942,304,512,5120,768,ck,0,0,13.474,a8w8_blockscale_1x128x128_256x128x128x128_16x16_32x32_2x2_8x32x1_8x32x1_1x32x1x8_8_1x1_intrawave_v3,298.84,710.13,0.0
gfx942,304,512,5120,2176,ck,0,0,24.2916,a8w8_blockscale_1x128x128_256x128x128x128_16x16_32x32_2x2_8x32x1_8x32x1_1x32x1x8_8_1x1_intrawave_v3,469.65,720.34,0.0
gfx942,304,544,5120,768,ck,3,0,14.688,a8w8_blockscale_1x128x128_256x64x64x128_16x16_32x32_1x1_8x32x1_8x32x1_1x32x1x8_8_1x1_intrawave_v3,291.27,675.42,0.0
gfx942,304,544,5120,2176,ck,0,0,27.3866,a8w8_blockscale_1x128x128_256x128x128x128_16x16_32x32_2x2_8x32x1_8x32x1_1x32x1x8_8_1x1_intrawave_v3,442.61,653.44,0.0
gfx942,304,576,5120,768,ck,3,0,14.8653,a8w8_blockscale_1x128x128_256x64x64x128_16x16_32x32_1x1_8x32x1_8x32x1_1x32x1x8_8_1x1_intrawave_v3,304.73,691.06,0.0
gfx942,304,576,5120,2176,ck,0,0,28.4794,a8w8_blockscale_1x128x128_256x128x128x128_16x16_32x32_2x2_8x32x1_8x32x1_1x32x1x8_8_1x1_intrawave_v3,450.66,642.31,0.0
gfx942,304,608,5120,768,ck,0,0,15.2945,a8w8_blockscale_1x128x128_256x128x128x128_16x16_32x32_2x2_8x32x1_8x32x1_1x32x1x8_8_1x1_intrawave_v3,312.63,694.7,0.0
gfx942,304,608,5120,2176,ck,0,0,28.2611,a8w8_blockscale_1x128x128_256x128x128x128_16x16_32x32_2x2_8x32x1_8x32x1_1x32x1x8_8_1x1_intrawave_v3,479.37,661.33,0.0
gfx942,304,640,5120,768,ck,0,0,15.2935,a8w8_blockscale_1x128x128_256x128x128x128_16x16_32x32_2x2_8x32x1_8x32x1_1x32x1x8_8_1x1_intrawave_v3,329.1,717.77,0.0
gfx942,304,640,5120,2176,ck,0,0,28.193,a8w8_blockscale_1x128x128_256x128x128x128_16x16_32x32_2x2_8x32x1_8x32x1_1x32x1x8_8_1x1_intrawave_v3,505.82,677.02,0.0
gfx942,304,672,5120,768,ck,0,0,15.8898,a8w8_blockscale_1x128x128_256x128x128x128_16x16_32x32_2x2_8x32x1_8x32x1_1x32x1x8_8_1x1_intrawave_v3,332.59,713.01,0.0
gfx942,304,672,5120,2176,ck,0,0,29.7265,a8w8_blockscale_1x128x128_256x128x128x128_16x16_32x32_2x2_8x32x1_8x32x1_1x32x1x8_8_1x1_intrawave_v3,503.71,655.46,0.0
gfx942,304,704,5120,768,ck,0,0,16.2814,a8w8_blockscale_1x128x128_256x128x128x128_16x16_32x32_2x2_8x32x1_8x32x1_1x32x1x8_8_1x1_intrawave_v3,340.05,717.49,0.0
gfx942,304,704,5120,2176,ck,0,0,30.1415,a8w8_blockscale_1x128x128_256x128x128x128_16x16_32x32_2x2_8x32x1_8x32x1_1x32x1x8_8_1x1_intrawave_v3,520.44,659.62,0.0
gfx942,304,736,5120,768,ck,0,0,16.7298,a8w8_blockscale_1x128x128_256x128x128x128_16x16_32x32_2x2_8x32x1_8x32x1_1x32x1x8_8_1x1_intrawave_v3,345.98,719.32,0.0
gfx942,304,736,5120,2176,ck,0,0,30.7404,a8w8_blockscale_1x128x128_256x128x128x128_16x16_32x32_2x2_8x32x1_8x32x1_1x32x1x8_8_1x1_intrawave_v3,533.49,659.7,0.0
gfx942,304,768,5120,768,ck,0,0,16.6735,a8w8_blockscale_1x128x128_256x128x128x128_16x16_32x32_2x2_8x32x1_8x32x1_1x32x1x8_8_1x1_intrawave_v3,362.24,742.87,0.0
gfx942,304,768,5120,2176,ck,0,0,30.1427,a8w8_blockscale_1x128x128_256x128x128x128_16x16_32x32_2x2_8x32x1_8x32x1_1x32x1x8_8_1x1_intrawave_v3,567.72,685.96,0.0
gfx942,304,800,5120,768,ck,0,0,17.6309,a8w8_blockscale_1x128x128_256x128x128x128_16x16_32x32_2x2_8x32x1_8x32x1_1x32x1x8_8_1x1_intrawave_v3,356.84,722.51,0.0
gfx942,304,800,5120,2176,ck,0,0,32.7991,a8w8_blockscale_1x128x128_256x128x128x128_16x16_32x32_2x2_8x32x1_8x32x1_1x32x1x8_8_1x1_intrawave_v3,543.48,642.52,0.0
gfx942,304,832,5120,768,ck,0,0,17.66,a8w8_blockscale_1x128x128_256x128x128x128_16x16_32x32_2x2_8x32x1_8x32x1_1x32x1x8_8_1x1_intrawave_v3,370.5,741.27,0.0
gfx942,304,832,5120,2176,ck,0,0,33.15,a8w8_blockscale_1x128x128_256x128x128x128_16x16_32x32_2x2_8x32x1_8x32x1_1x32x1x8_8_1x1_intrawave_v3,559.24,647.7,0.0
gfx942,304,864,5120,768,ck,0,0,17.5528,a8w8_blockscale_1x128x128_256x128x128x128_16x16_32x32_2x2_8x32x1_8x32x1_1x32x1x8_8_1x1_intrawave_v3,387.1,765.86,0.0
gfx942,304,864,5120,2176,ck,0,0,33.3896,a8w8_blockscale_1x128x128_256x128x128x128_16x16_32x32_2x2_8x32x1_8x32x1_1x32x1x8_8_1x1_intrawave_v3,576.58,654.95,0.0
gfx942,304,896,5120,768,ck,0,0,17.7636,a8w8_blockscale_1x128x128_256x128x128x128_16x16_32x32_2x2_8x32x1_8x32x1_1x32x1x8_8_1x1_intrawave_v3,396.68,776.61,0.0
gfx942,304,896,5120,2176,ck,0,0,33.4405,a8w8_blockscale_1x128x128_256x128x128x128_16x16_32x32_2x2_8x32x1_8x32x1_1x32x1x8_8_1x1_intrawave_v3,597.03,665.84,0.0
gfx942,304,928,5120,768,ck,2,0,20.1307,a8w8_blockscale_1x128x128_256x64x128x128_16x16_32x32_1x2_8x32x1_8x32x1_1x32x1x8_8_1x1_intrawave_v3,362.54,702.79,0.0
gfx942,304,928,5120,2176,ck,2,0,37.783,a8w8_blockscale_1x128x128_256x64x128x128_16x16_32x32_1x2_8x32x1_8x32x1_1x32x1x8_8_1x1_intrawave_v3,547.28,599.82,0.0
gfx942,304,960,5120,768,ck,18,0,20.3301,a8w8_blockscale_1x128x128_256x64x64x256_16x16_32x32_1x1_16x16x1_16x16x1_1x32x1x8_8_1x1_intrawave_v1,371.36,713.22,0.0
gfx942,304,960,5120,2176,ck,2,0,38.2778,a8w8_blockscale_1x128x128_256x64x128x128_16x16_32x32_1x2_8x32x1_8x32x1_1x32x1x8_8_1x1_intrawave_v3,558.83,602.45,0.0
gfx942,304,992,5120,768,ck,3,0,23.9903,a8w8_blockscale_1x128x128_256x64x64x128_16x16_32x32_1x1_8x32x1_8x32x1_1x32x1x8_8_1x1_intrawave_v3,325.19,619.09,0.0
gfx942,304,992,5120,2176,ck,3,0,48.2991,a8w8_blockscale_1x128x128_256x64x64x128_16x16_32x32_1x1_8x32x1_8x32x1_1x32x1x8_8_1x1_intrawave_v3,457.65,485.68,0.0
gfx942,304,1024,5120,768,ck,3,0,22.9079,a8w8_blockscale_1x128x128_256x64x64x128_16x16_32x32_1x1_8x32x1_8x32x1_1x32x1x8_8_1x1_intrawave_v3,351.54,663.72,0.0
gfx942,304,1024,5120,2176,ck,3,0,48.0774,a8w8_blockscale_1x128x128_256x64x64x128_16x16_32x32_1x1_8x32x1_8x32x1_1x32x1x8_8_1x1_intrawave_v3,474.59,496.18,0.0
gfx942,304,1088,5120,768,ck,3,0,23.611,a8w8_blockscale_1x128x128_256x64x64x128_16x16_32x32_1x1_8x32x1_8x32x1_1x32x1x8_8_1x1_intrawave_v3,362.39,673.79,0.0
gfx942,304,1088,5120,2176,ck,3,0,49.0599,a8w8_blockscale_1x128x128_256x64x64x128_16x16_32x32_1x1_8x32x1_8x32x1_1x32x1x8_8_1x1_intrawave_v3,494.15,502.44,0.0
gfx942,304,1152,5120,768,ck,3,0,24.5191,a8w8_blockscale_1x128x128_256x64x64x128_16x16_32x32_1x1_8x32x1_8x32x1_1x32x1x8_8_1x1_intrawave_v3,369.5,677.57,0.0
gfx942,304,1152,5120,2176,ck,3,0,49.115,a8w8_blockscale_1x128x128_256x64x64x128_16x16_32x32_1x1_8x32x1_8x32x1_1x32x1x8_8_1x1_intrawave_v3,522.63,518.06,0.0
gfx942,304,1216,5120,768,ck,2,0,24.8994,a8w8_blockscale_1x128x128_256x64x128x128_16x16_32x32_1x2_8x32x1_8x32x1_1x32x1x8_8_1x1_intrawave_v3,384.07,695.51,0.0
gfx942,304,1216,5120,2176,ck,0,0,50.8494,a8w8_blockscale_1x128x128_256x128x128x128_16x16_32x32_2x2_8x32x1_8x32x1_1x32x1x8_8_1x1_intrawave_v3,532.85,516.01,0.0
gfx942,304,1280,5120,768,ck,1,0,25.7157,a8w8_blockscale_1x128x128_256x128x64x128_16x16_32x32_2x1_8x32x1_8x32x1_1x32x1x8_8_1x1_intrawave_v3,391.45,700.83,0.0
gfx942,304,1280,5120,2176,ck,0,0,51.7485,a8w8_blockscale_1x128x128_256x128x128x128_16x16_32x32_2x2_8x32x1_8x32x1_1x32x1x8_8_1x1_intrawave_v3,551.15,522.4,0.0
gfx942,304,1344,5120,768,ck,2,0,25.912,a8w8_blockscale_1x128x128_256x64x128x128_16x16_32x32_1x2_8x32x1_8x32x1_1x32x1x8_8_1x1_intrawave_v3,407.91,722.71,0.0
gfx942,304,1344,5120,2176,ck,0,0,51.5275,a8w8_blockscale_1x128x128_256x128x128x128_16x16_32x32_2x2_8x32x1_8x32x1_1x32x1x8_8_1x1_intrawave_v3,581.19,540.07,0.0
gfx942,304,1408,5120,768,ck,0,0,26.7312,a8w8_blockscale_1x128x128_256x128x128x128_16x16_32x32_2x2_8x32x1_8x32x1_1x32x1x8_8_1x1_intrawave_v3,414.23,726.92,0.0
gfx942,304,1408,5120,2176,ck,0,0,52.4107,a8w8_blockscale_1x128x128_256x128x128x128_16x16_32x32_2x2_8x32x1_8x32x1_1x32x1x8_8_1x1_intrawave_v3,598.61,546.13,0.0
gfx942,304,1472,5120,768,ck,0,0,27.5242,a8w8_blockscale_1x128x128_256x128x128x128_16x16_32x32_2x2_8x32x1_8x32x1_1x32x1x8_8_1x1_intrawave_v3,420.59,731.57,0.0
gfx942,304,1472,5120,2176,ck,0,0,53.2404,a8w8_blockscale_1x128x128_256x128x128x128_16x16_32x32_2x2_8x32x1_8x32x1_1x32x1x8_8_1x1_intrawave_v3,616.06,552.54,0.0
gfx942,304,1536,5120,768,ck,0,0,27.5425,a8w8_blockscale_1x128x128_256x128x128x128_16x16_32x32_2x2_8x32x1_8x32x1_1x32x1x8_8_1x1_intrawave_v3,438.58,756.67,0.0
gfx942,304,1536,5120,2176,ck,0,0,53.9025,a8w8_blockscale_1x128x128_256x128x128x128_16x16_32x32_2x2_8x32x1_8x32x1_1x32x1x8_8_1x1_intrawave_v3,634.95,560.5,0.0
gfx942,304,1600,5120,768,ck,0,0,28.295,a8w8_blockscale_1x128x128_256x128x128x128_16x16_32x32_2x2_8x32x1_8x32x1_1x32x1x8_8_1x1_intrawave_v3,444.7,761.44,0.0
gfx942,304,1600,5120,2176,ck,0,0,56.0455,a8w8_blockscale_1x128x128_256x128x128x128_16x16_32x32_2x2_8x32x1_8x32x1_1x32x1x8_8_1x1_intrawave_v3,636.12,553.24,0.0
gfx942,304,1664,5120,768,ck,0,0,28.3276,a8w8_blockscale_1x128x128_256x128x128x128_16x16_32x32_2x2_8x32x1_8x32x1_1x32x1x8_8_1x1_intrawave_v3,461.96,785.43,0.0
gfx942,304,1664,5120,2176,ck,0,0,55.8592,a8w8_blockscale_1x128x128_256x128x128x128_16x16_32x32_2x2_8x32x1_8x32x1_1x32x1x8_8_1x1_intrawave_v3,663.77,569.31,0.0
gfx942,304,1728,5120,768,ck,0,0,29.1665,a8w8_blockscale_1x128x128_256x128x128x128_16x16_32x32_2x2_8x32x1_8x32x1_1x32x1x8_8_1x1_intrawave_v3,465.93,787.0,0.0
gfx942,304,1728,5120,2176,ck,0,0,58.2785,a8w8_blockscale_1x128x128_256x128x128x128_16x16_32x32_2x2_8x32x1_8x32x1_1x32x1x8_8_1x1_intrawave_v3,660.68,559.31,0.0
gfx942,304,1792,5120,768,ck,0,0,29.2628,a8w8_blockscale_1x128x128_256x128x128x128_16x16_32x32_2x2_8x32x1_8x32x1_1x32x1x8_8_1x1_intrawave_v3,481.6,808.48,0.0
gfx942,304,1792,5120,2176,ck,0,0,57.0602,a8w8_blockscale_1x128x128_256x128x128x128_16x16_32x32_2x2_8x32x1_8x32x1_1x32x1x8_8_1x1_intrawave_v3,699.78,585.18,0.0
gfx942,304,1856,5120,768,ck,0,0,30.3262,a8w8_blockscale_1x128x128_256x128x128x128_16x16_32x32_2x2_8x32x1_8x32x1_1x32x1x8_8_1x1_intrawave_v3,481.31,803.37,0.0
gfx942,304,1856,5120,2176,ck,0,0,59.2201,a8w8_blockscale_1x128x128_256x128x128x128_16x16_32x32_2x2_8x32x1_8x32x1_1x32x1x8_8_1x1_intrawave_v3,698.34,577.26,0.0
gfx942,304,1920,5120,768,ck,0,0,30.4862,a8w8_blockscale_1x128x128_256x128x128x128_16x16_32x32_2x2_8x32x1_8x32x1_1x32x1x8_8_1x1_intrawave_v3,495.29,822.26,0.0
gfx942,304,1920,5120,2176,ck,0,0,60.8247,a8w8_blockscale_1x128x128_256x128x128x128_16x16_32x32_2x2_8x32x1_8x32x1_1x32x1x8_8_1x1_intrawave_v3,703.36,575.09,0.0
gfx942,304,1984,5120,768,ck,0,0,37.943,a8w8_blockscale_1x128x128_256x128x128x128_16x16_32x32_2x2_8x32x1_8x32x1_1x32x1x8_8_1x1_intrawave_v3,411.22,679.23,0.0
gfx942,304,1984,5120,2176,ck,0,0,76.0232,a8w8_blockscale_1x128x128_256x128x128x128_16x16_32x32_2x2_8x32x1_8x32x1_1x32x1x8_8_1x1_intrawave_v3,581.51,470.57,0.0
gfx942,304,2048,5120,768,ck,0,0,38.2047,a8w8_blockscale_1x128x128_256x128x128x128_16x16_32x32_2x2_8x32x1_8x32x1_1x32x1x8_8_1x1_intrawave_v3,421.57,693.02,0.0
gfx942,304,2048,5120,2176,ck,0,0,74.7792,a8w8_blockscale_1x128x128_256x128x128x128_16x16_32x32_2x2_8x32x1_8x32x1_1x32x1x8_8_1x1_intrawave_v3,610.25,489.03,0.0
gfx942,304,2112,5120,768,ck,0,0,37.8651,a8w8_blockscale_1x128x128_256x128x128x128_16x16_32x32_2x2_8x32x1_8x32x1_1x32x1x8_8_1x1_intrawave_v3,438.65,717.84,0.0
gfx942,304,2112,5120,2176,ck,0,0,79.1077,a8w8_blockscale_1x128x128_256x128x128x128_16x16_32x32_2x2_8x32x1_8x32x1_1x32x1x8_8_1x1_intrawave_v3,594.89,472.31,0.0
gfx942,304,2176,5120,768,ck,0,0,38.0578,a8w8_blockscale_1x128x128_256x128x128x128_16x16_32x32_2x2_8x32x1_8x32x1_1x32x1x8_8_1x1_intrawave_v3,449.65,732.72,0.0
gfx942,304,2176,5120,2176,ck,0,0,76.0364,a8w8_blockscale_1x128x128_256x128x128x128_16x16_32x32_2x2_8x32x1_8x32x1_1x32x1x8_8_1x1_intrawave_v3,637.67,501.84,0.0
gfx942,304,2240,5120,768,ck,0,0,38.0844,a8w8_blockscale_1x128x128_256x128x128x128_16x16_32x32_2x2_8x32x1_8x32x1_1x32x1x8_8_1x1_intrawave_v3,462.55,750.7,0.0
gfx942,304,2240,5120,2176,ck,0,0,78.1211,a8w8_blockscale_1x128x128_256x128x128x128_16x16_32x32_2x2_8x32x1_8x32x1_1x32x1x8_8_1x1_intrawave_v3,638.91,498.62,0.0
gfx942,304,2304,5120,768,ck,0,0,38.4336,a8w8_blockscale_1x128x128_256x128x128x128_16x16_32x32_2x2_8x32x1_8x32x1_1x32x1x8_8_1x1_intrawave_v3,471.45,762.21,0.0
gfx942,304,2304,5120,2176,ck,0,0,76.4407,a8w8_blockscale_1x128x128_256x128x128x128_16x16_32x32_2x2_8x32x1_8x32x1_1x32x1x8_8_1x1_intrawave_v3,671.61,519.98,0.0
gfx942,304,2368,5120,768,ck,0,0,39.0989,a8w8_blockscale_1x128x128_256x128x128x128_16x16_32x32_2x2_8x32x1_8x32x1_1x32x1x8_8_1x1_intrawave_v3,476.3,767.26,0.0
gfx942,304,2368,5120,2176,ck,0,0,78.8597,a8w8_blockscale_1x128x128_256x128x128x128_16x16_32x32_2x2_8x32x1_8x32x1_1x32x1x8_8_1x1_intrawave_v3,669.09,514.11,0.0
gfx942,304,2432,5120,768,ck,0,0,38.7571,a8w8_blockscale_1x128x128_256x128x128x128_16x16_32x32_2x2_8x32x1_8x32x1_1x32x1x8_8_1x1_intrawave_v3,493.48,792.21,0.0
gfx942,304,2432,5120,2176,ck,0,0,80.7787,a8w8_blockscale_1x128x128_256x128x128x128_16x16_32x32_2x2_8x32x1_8x32x1_1x32x1x8_8_1x1_intrawave_v3,670.85,511.73,0.0
gfx942,304,2496,5120,768,ck,0,0,40.0874,a8w8_blockscale_1x128x128_256x128x128x128_16x16_32x32_2x2_8x32x1_8x32x1_1x32x1x8_8_1x1_intrawave_v3,489.66,783.49,0.0
gfx942,304,2496,5120,2176,ck,0,0,79.9302,a8w8_blockscale_1x128x128_256x128x128x128_16x16_32x32_2x2_8x32x1_8x32x1_1x32x1x8_8_1x1_intrawave_v3,695.81,527.1,0.0
gfx942,304,2560,5120,768,ck,0,0,40.5181,a8w8_blockscale_1x128x128_256x128x128x128_16x16_32x32_2x2_8x32x1_8x32x1_1x32x1x8_8_1x1_intrawave_v3,496.88,792.55,0.0
gfx942,304,2560,5120,2176,ck,0,0,83.2842,a8w8_blockscale_1x128x128_256x128x128x128_16x16_32x32_2x2_8x32x1_8x32x1_1x32x1x8_8_1x1_intrawave_v3,684.91,515.42,0.0
gfx942,304,2624,5120,768,ck,0,0,40.7122,a8w8_blockscale_1x128x128_256x128x128x128_16x16_32x32_2x2_8x32x1_8x32x1_1x32x1x8_8_1x1_intrawave_v3,506.87,806.08,0.0
gfx942,304,2624,5120,2176,ck,0,0,84.7385,a8w8_blockscale_1x128x128_256x128x128x128_16x16_32x32_2x2_8x32x1_8x32x1_1x32x1x8_8_1x1_intrawave_v3,689.99,515.95,0.0
gfx942,304,2688,5120,768,ck,0,0,40.726,a8w8_blockscale_1x128x128_256x128x128x128_16x16_32x32_2x2_8x32x1_8x32x1_1x32x1x8_8_1x1_intrawave_v3,519.06,823.1,0.0
gfx942,304,2688,5120,2176,ck,0,0,84.2767,a8w8_blockscale_1x128x128_256x128x128x128_16x16_32x32_2x2_8x32x1_8x32x1_1x32x1x8_8_1x1_intrawave_v3,710.69,528.2,0.0
gfx942,304,2752,5120,768,ck,0,0,41.8005,a8w8_blockscale_1x128x128_256x128x128x128_16x16_32x32_2x2_8x32x1_8x32x1_1x32x1x8_8_1x1_intrawave_v3,517.76,818.8,0.0
gfx942,304,2752,5120,2176,ck,0,0,84.5386,a8w8_blockscale_1x128x128_256x128x128x128_16x16_32x32_2x2_8x32x1_8x32x1_1x32x1x8_8_1x1_intrawave_v3,725.36,535.97,0.0
gfx942,304,2816,5120,768,ck,0,0,41.3748,a8w8_blockscale_1x128x128_256x128x128x128_16x16_32x32_2x2_8x32x1_8x32x1_1x32x1x8_8_1x1_intrawave_v3,535.25,844.25,0.0
gfx942,304,2816,5120,2176,ck,0,0,84.644,a8w8_blockscale_1x128x128_256x128x128x128_16x16_32x32_2x2_8x32x1_8x32x1_1x32x1x8_8_1x1_intrawave_v3,741.3,544.69,0.0
gfx942,304,2880,5120,768,ck,2,0,48.4119,a8w8_blockscale_1x128x128_256x64x128x128_16x16_32x32_1x2_8x32x1_8x32x1_1x32x1x8_8_1x1_intrawave_v3,467.84,736.08,0.0
gfx942,304,2880,5120,2176,ck,0,0,103.11,a8w8_blockscale_1x128x128_256x128x128x128_16x16_32x32_2x2_8x32x1_8x32x1_1x32x1x8_8_1x1_intrawave_v3,622.37,454.85,0.0
gfx942,304,2944,5120,768,ck,0,0,49.5303,a8w8_blockscale_1x128x128_256x128x128x128_16x16_32x32_2x2_8x32x1_8x32x1_1x32x1x8_8_1x1_intrawave_v3,467.44,733.69,0.0
gfx942,304,2944,5120,2176,ck,0,0,100.446,a8w8_blockscale_1x128x128_256x128x128x128_16x16_32x32_2x2_8x32x1_8x32x1_1x32x1x8_8_1x1_intrawave_v3,653.08,474.82,0.0
gfx942,304,3008,5120,768,ck,0,0,49.7274,a8w8_blockscale_1x128x128_256x128x128x128_16x16_32x32_2x2_8x32x1_8x32x1_1x32x1x8_8_1x1_intrawave_v3,475.71,744.95,0.0
gfx942,304,3008,5120,2176,ck,0,0,102.8654,a8w8_blockscale_1x128x128_256x128x128x128_16x16_32x32_2x2_8x32x1_8x32x1_1x32x1x8_8_1x1_intrawave_v3,651.58,471.38,0.0
gfx942,304,3072,5120,768,ck,0,0,49.8565,a8w8_blockscale_1x128x128_256x128x128x128_16x16_32x32_2x2_8x32x1_8x32x1_1x32x1x8_8_1x1_intrawave_v3,484.57,757.15,0.0
gfx942,304,3072,5120,2176,ck,0,0,105.2239,a8w8_blockscale_1x128x128_256x128x128x128_16x16_32x32_2x2_8x32x1_8x32x1_1x32x1x8_8_1x1_intrawave_v3,650.53,468.36,0.0
gfx942,304,3136,5120,768,ck,0,0,50.953,a8w8_blockscale_1x128x128_256x128x128x128_16x16_32x32_2x2_8x32x1_8x32x1_1x32x1x8_8_1x1_intrawave_v3,484.02,754.68,0.0
gfx942,304,3136,5120,2176,ck,0,0,104.9312,a8w8_blockscale_1x128x128_256x128x128x128_16x16_32x32_2x2_8x32x1_8x32x1_1x32x1x8_8_1x1_intrawave_v3,665.93,477.24,0.0
gfx942,304,3200,5120,768,ck,0,0,50.9668,a8w8_blockscale_1x128x128_256x128x128x128_16x16_32x32_2x2_8x32x1_8x32x1_1x32x1x8_8_1x1_intrawave_v3,493.77,768.3,0.0
gfx942,304,3200,5120,2176,ck,0,0,101.212,a8w8_blockscale_1x128x128_256x128x128x128_16x16_32x32_2x2_8x32x1_8x32x1_1x32x1x8_8_1x1_intrawave_v3,704.49,502.63,0.0
gfx942,304,3264,5120,768,ck,0,0,50.2704,a8w8_blockscale_1x128x128_256x128x128x128_16x16_32x32_2x2_8x32x1_8x32x1_1x32x1x8_8_1x1_intrawave_v3,510.62,792.96,0.0
gfx942,304,3264,5120,2176,ck,0,0,108.682,a8w8_blockscale_1x128x128_256x128x128x128_16x16_32x32_2x2_8x32x1_8x32x1_1x32x1x8_8_1x1_intrawave_v3,669.19,475.4,0.0
gfx942,304,3328,5120,768,ck,0,0,51.7778,a8w8_blockscale_1x128x128_256x128x128x128_16x16_32x32_2x2_8x32x1_8x32x1_1x32x1x8_8_1x1_intrawave_v3,505.48,783.48,0.0
gfx942,304,3328,5120,2176,ck,0,0,103.6726,a8w8_blockscale_1x128x128_256x128x128x128_16x16_32x32_2x2_8x32x1_8x32x1_1x32x1x8_8_1x1_intrawave_v3,715.28,506.03,0.0
gfx942,304,3392,5120,768,ck,0,0,52.6359,a8w8_blockscale_1x128x128_256x128x128x128_16x16_32x32_2x2_8x32x1_8x32x1_1x32x1x8_8_1x1_intrawave_v3,506.8,784.09,0.0
gfx942,304,3392,5120,2176,ck,0,0,101.3846,a8w8_blockscale_1x128x128_256x128x128x128_16x16_32x32_2x2_8x32x1_8x32x1_1x32x1x8_8_1x1_intrawave_v3,745.49,525.29,0.0
gfx942,304,3456,5120,768,ck,0,0,51.6355,a8w8_blockscale_1x128x128_256x128x128x128_16x16_32x32_2x2_8x32x1_8x32x1_1x32x1x8_8_1x1_intrawave_v3,526.36,812.93,0.0
gfx942,304,3456,5120,2176,ck,0,0,107.5914,a8w8_blockscale_1x128x128_256x128x128x128_16x16_32x32_2x2_8x32x1_8x32x1_1x32x1x8_8_1x1_intrawave_v3,715.74,502.37,0.0
gfx942,304,3520,5120,768,ck,0,0,51.3907,a8w8_blockscale_1x128x128_256x128x128x128_16x16_32x32_2x2_8x32x1_8x32x1_1x32x1x8_8_1x1_intrawave_v3,538.67,830.51,0.0
gfx942,304,3520,5120,2176,ck,0,0,107.9308,a8w8_blockscale_1x128x128_256x128x128x128_16x16_32x32_2x2_8x32x1_8x32x1_1x32x1x8_8_1x1_intrawave_v3,726.7,508.15,0.0
gfx942,304,3584,5120,768,ck,0,0,53.4149,a8w8_blockscale_1x128x128_256x128x128x128_16x16_32x32_2x2_8x32x1_8x32x1_1x32x1x8_8_1x1_intrawave_v3,527.68,812.22,0.0
gfx942,304,3584,5120,2176,ck,0,0,104.7868,a8w8_blockscale_1x128x128_256x128x128x128_16x16_32x32_2x2_8x32x1_8x32x1_1x32x1x8_8_1x1_intrawave_v3,762.11,530.98,0.0
gfx942,304,3648,5120,768,ck,0,0,53.3081,a8w8_blockscale_1x128x128_256x128x128x128_16x16_32x32_2x2_8x32x1_8x32x1_1x32x1x8_8_1x1_intrawave_v3,538.17,827.07,0.0
gfx942,304,3648,5120,2176,ck,0,0,108.7775,a8w8_blockscale_1x128x128_256x128x128x128_16x16_32x32_2x2_8x32x1_8x32x1_1x32x1x8_8_1x1_intrawave_v3,747.26,518.81,0.0
gfx942,304,3712,5120,768,ck,0,0,53.8232,a8w8_blockscale_1x128x128_256x128x128x128_16x16_32x32_2x2_8x32x1_8x32x1_1x32x1x8_8_1x1_intrawave_v3,542.37,832.24,0.0
gfx942,304,3712,5120,2176,ck,0,0,108.8729,a8w8_blockscale_1x128x128_256x128x128x128_16x16_32x32_2x2_8x32x1_8x32x1_1x32x1x8_8_1x1_intrawave_v3,759.71,525.65,0.0
gfx942,304,3776,5120,768,ck,0,0,55.6836,a8w8_blockscale_1x128x128_256x128x128x128_16x16_32x32_2x2_8x32x1_8x32x1_1x32x1x8_8_1x1_intrawave_v3,533.29,817.09,0.0
gfx942,304,3776,5120,2176,ck,0,0,107.0942,a8w8_blockscale_1x128x128_256x128x128x128_16x16_32x32_2x2_8x32x1_8x32x1_1x32x1x8_8_1x1_intrawave_v3,785.64,541.8,0.0
gfx942,304,3840,5120,768,ck,0,0,54.9263,a8w8_blockscale_1x128x128_256x128x128x128_16x16_32x32_2x2_8x32x1_8x32x1_1x32x1x8_8_1x1_intrawave_v3,549.81,841.18,0.0
gfx942,304,3840,5120,2176,ck,0,0,111.5907,a8w8_blockscale_1x128x128_256x128x128x128_16x16_32x32_2x2_8x32x1_8x32x1_1x32x1x8_8_1x1_intrawave_v3,766.76,527.09,0.0
gfx942,304,3904,5120,768,ck,0,0,62.308,a8w8_blockscale_1x128x128_256x128x128x128_16x16_32x32_2x2_8x32x1_8x32x1_1x32x1x8_8_1x1_intrawave_v3,492.75,752.83,0.0
gfx942,304,3904,5120,2176,ck,0,0,126.1642,a8w8_blockscale_1x128x128_256x128x128x128_16x16_32x32_2x2_8x32x1_8x32x1_1x32x1x8_8_1x1_intrawave_v3,689.5,472.5,0.0
gfx942,304,3968,5120,768,ck,0,0,61.6859,a8w8_blockscale_1x128x128_256x128x128x128_16x16_32x32_2x2_8x32x1_8x32x1_1x32x1x8_8_1x1_intrawave_v3,505.88,771.84,0.0
gfx942,304,3968,5120,2176,ck,0,0,126.4008,a8w8_blockscale_1x128x128_256x128x128x128_16x16_32x32_2x2_8x32x1_8x32x1_1x32x1x8_8_1x1_intrawave_v3,699.49,477.91,0.0
gfx942,304,4032,5120,768,ck,0,0,61.6868,a8w8_blockscale_1x128x128_256x128x128x128_16x16_32x32_2x2_8x32x1_8x32x1_1x32x1x8_8_1x1_intrawave_v3,514.03,783.25,0.0
gfx942,304,4032,5120,2176,ck,0,0,126.9546,a8w8_blockscale_1x128x128_256x128x128x128_16x16_32x32_2x2_8x32x1_8x32x1_1x32x1x8_8_1x1_intrawave_v3,707.67,482.08,0.0
gfx942,304,4096,5120,768,ck,0,0,62.4769,a8w8_blockscale_1x128x128_256x128x128x128_16x16_32x32_2x2_8x32x1_8x32x1_1x32x1x8_8_1x1_intrawave_v3,515.59,784.62,0.0
gfx942,304,4096,5120,2176,ck,0,0,124.1568,a8w8_blockscale_1x128x128_256x128x128x128_16x16_32x32_2x2_8x32x1_8x32x1_1x32x1x8_8_1x1_intrawave_v3,735.1,499.34,0.0
gfx942,304,4224,5120,768,ck,0,0,62.7582,a8w8_blockscale_1x128x128_256x128x128x128_16x16_32x32_2x2_8x32x1_8x32x1_1x32x1x8_8_1x1_intrawave_v3,529.32,803.56,0.0
gfx942,304,4224,5120,2176,ck,0,0,124.5219,a8w8_blockscale_1x128x128_256x128x128x128_16x16_32x32_2x2_8x32x1_8x32x1_1x32x1x8_8_1x1_intrawave_v3,755.85,510.64,0.0
gfx942,304,4352,5120,768,ck,0,0,64.1756,a8w8_blockscale_1x128x128_256x128x128x128_16x16_32x32_2x2_8x32x1_8x32x1_1x32x1x8_8_1x1_intrawave_v3,533.31,807.77,0.0
gfx942,304,4352,5120,2176,ck,0,0,127.3958,a8w8_blockscale_1x128x128_256x128x128x128_16x16_32x32_2x2_8x32x1_8x32x1_1x32x1x8_8_1x1_intrawave_v3,761.19,511.6,0.0
gfx942,304,4480,5120,768,ck,0,0,64.4435,a8w8_blockscale_1x128x128_256x128x128x128_16x16_32x32_2x2_8x32x1_8x32x1_1x32x1x8_8_1x1_intrawave_v3,546.71,826.27,0.0
gfx942,304,4480,5120,2176,ck,0,0,132.5845,a8w8_blockscale_1x128x128_256x128x128x128_16x16_32x32_2x2_8x32x1_8x32x1_1x32x1x8_8_1x1_intrawave_v3,752.91,503.56,0.0
gfx942,304,4608,5120,768,ck,0,0,64.324,a8w8_blockscale_1x128x128_256x128x128x128_16x16_32x32_2x2_8x32x1_8x32x1_1x32x1x8_8_1x1_intrawave_v3,563.38,849.71,0.0
gfx942,304,4608,5120,2176,ck,0,0,138.6807,a8w8_blockscale_1x128x128_256x128x128x128_16x16_32x32_2x2_8x32x1_8x32x1_1x32x1x8_8_1x1_intrawave_v3,740.38,492.89,0.0
gfx942,304,4736,5120,768,ck,0,0,67.3752,a8w8_blockscale_1x128x128_256x128x128x128_16x16_32x32_2x2_8x32x1_8x32x1_1x32x1x8_8_1x1_intrawave_v3,552.81,832.15,0.0
gfx942,304,4736,5120,2176,ck,0,0,142.365,a8w8_blockscale_1x128x128_256x128x128x128_16x16_32x32_2x2_8x32x1_8x32x1_1x32x1x8_8_1x1_intrawave_v3,741.25,491.3,0.0
gfx942,304,4864,5120,768,ck,0,0,66.5715,a8w8_blockscale_1x128x128_256x128x128x128_16x16_32x32_2x2_8x32x1_8x32x1_1x32x1x8_8_1x1_intrawave_v3,574.6,863.36,0.0
gfx942,304,4864,5120,2176,ck,0,0,138.0594,a8w8_blockscale_1x128x128_256x128x128x128_16x16_32x32_2x2_8x32x1_8x32x1_1x32x1x8_8_1x1_intrawave_v3,785.03,518.13,0.0
gfx942,304,4992,5120,768,ck,0,0,74.7044,a8w8_blockscale_1x128x128_256x128x128x128_16x16_32x32_2x2_8x32x1_8x32x1_1x32x1x8_8_1x1_intrawave_v3,525.52,788.23,0.0
gfx942,304,4992,5120,2176,ck,0,0,155.212,a8w8_blockscale_1x128x128_256x128x128x128_16x16_32x32_2x2_8x32x1_8x32x1_1x32x1x8_8_1x1_intrawave_v3,716.65,471.11,0.0
gfx942,304,5120,5120,768,ck,0,0,75.047,a8w8_blockscale_1x128x128_256x128x128x128_16x16_32x32_2x2_8x32x1_8x32x1_1x32x1x8_8_1x1_intrawave_v3,536.53,803.4,0.0
gfx942,304,5120,5120,2176,ck,0,0,152.9361,a8w8_blockscale_1x128x128_256x128x128x128_16x16_32x32_2x2_8x32x1_8x32x1_1x32x1x8_8_1x1_intrawave_v3,745.97,488.51,0.0
gfx942,304,5248,5120,768,ck,0,0,74.9059,a8w8_blockscale_1x128x128_256x128x128x128_16x16_32x32_2x2_8x32x1_8x32x1_1x32x1x8_8_1x1_intrawave_v3,550.98,823.73,0.0
gfx942,304,5248,5120,2176,ck,0,0,156.7603,a8w8_blockscale_1x128x128_256x128x128x128_16x16_32x32_2x2_8x32x1_8x32x1_1x32x1x8_8_1x1_intrawave_v3,745.96,486.73,0.0
gfx942,304,5376,5120,768,ck,0,0,78.1206,a8w8_blockscale_1x128x128_256x128x128x128_16x16_32x32_2x2_8x32x1_8x32x1_1x32x1x8_8_1x1_intrawave_v3,541.2,807.87,0.0
gfx942,304,5376,5120,2176,ck,0,0,159.6921,a8w8_blockscale_1x128x128_256x128x128x128_16x16_32x32_2x2_8x32x1_8x32x1_1x32x1x8_8_1x1_intrawave_v3,750.13,487.75,0.0
gfx942,304,5504,5120,768,ck,0,0,76.9313,a8w8_blockscale_1x128x128_256x128x128x128_16x16_32x32_2x2_8x32x1_8x32x1_1x32x1x8_8_1x1_intrawave_v3,562.65,838.67,0.0
gfx942,304,5504,5120,2176,ck,0,0,155.5209,a8w8_blockscale_1x128x128_256x128x128x128_16x16_32x32_2x2_8x32x1_8x32x1_1x32x1x8_8_1x1_intrawave_v3,788.59,511.05,0.0
gfx942,304,5632,5120,768,ck,0,0,78.615,a8w8_blockscale_1x128x128_256x128x128x128_16x16_32x32_2x2_8x32x1_8x32x1_1x32x1x8_8_1x1_intrawave_v3,563.4,838.63,0.0
gfx942,304,5632,5120,2176,ck,0,0,157.1454,a8w8_blockscale_1x128x128_256x128x128x128_16x16_32x32_2x2_8x32x1_8x32x1_1x32x1x8_8_1x1_intrawave_v3,798.58,515.88,0.0
gfx942,304,5760,5120,768,ck,0,0,78.9855,a8w8_blockscale_1x128x128_256x128x128x128_16x16_32x32_2x2_8x32x1_8x32x1_1x32x1x8_8_1x1_intrawave_v3,573.5,852.54,0.0
gfx942,304,5760,5120,2176,ck,0,0,163.7046,a8w8_blockscale_1x128x128_256x128x128x128_16x16_32x32_2x2_8x32x1_8x32x1_1x32x1x8_8_1x1_intrawave_v3,784.01,504.92,0.0
gfx942,304,5888,5120,768,ck,0,0,82.2217,a8w8_blockscale_1x128x128_256x128x128x128_16x16_32x32_2x2_8x32x1_8x32x1_1x32x1x8_8_1x1_intrawave_v3,563.17,836.12,0.0
gfx942,304,5888,5120,2176,ck,0,0,173.3035,a8w8_blockscale_1x128x128_256x128x128x128_16x16_32x32_2x2_8x32x1_8x32x1_1x32x1x8_8_1x1_intrawave_v3,757.04,486.12,0.0
gfx942,304,6016,5120,768,ck,0,0,83.3416,a8w8_blockscale_1x128x128_256x128x128x128_16x16_32x32_2x2_8x32x1_8x32x1_1x32x1x8_8_1x1_intrawave_v3,567.68,841.79,0.0
gfx942,304,6016,5120,2176,ck,0,0,181.8488,a8w8_blockscale_1x128x128_256x128x128x128_16x16_32x32_2x2_8x32x1_8x32x1_1x32x1x8_8_1x1_intrawave_v3,737.15,472.02,0.0
gfx942,304,6144,5120,768,ck,0,0,86.4221,a8w8_blockscale_1x128x128_256x128x128x128_16x16_32x32_2x2_8x32x1_8x32x1_1x32x1x8_8_1x1_intrawave_v3,559.1,828.09,0.0
gfx942,304,6144,5120,2176,ck,0,0,180.8722,a8w8_blockscale_1x128x128_256x128x128x128_16x16_32x32_2x2_8x32x1_8x32x1_1x32x1x8_8_1x1_intrawave_v3,756.9,483.35,0.0
gfx942,304,6272,5120,768,ck,0,0,86.2262,a8w8_blockscale_1x128x128_256x128x128x128_16x16_32x32_2x2_8x32x1_8x32x1_1x32x1x8_8_1x1_intrawave_v3,572.04,846.31,0.0
gfx942,304,6272,5120,2176,ck,0,0,182.4065,a8w8_blockscale_1x128x128_256x128x128x128_16x16_32x32_2x2_8x32x1_8x32x1_1x32x1x8_8_1x1_intrawave_v3,766.17,488.0,0.0
gfx942,304,6400,5120,768,ck,0,0,87.1658,a8w8_blockscale_1x128x128_256x128x128x128_16x16_32x32_2x2_8x32x1_8x32x1_1x32x1x8_8_1x1_intrawave_v3,577.42,853.35,0.0
gfx942,304,6400,5120,2176,ck,0,0,183.8556,a8w8_blockscale_1x128x128_256x128x128x128_16x16_32x32_2x2_8x32x1_8x32x1_1x32x1x8_8_1x1_intrawave_v3,775.64,492.8,0.0
gfx942,304,6528,5120,768,ck,0,0,88.9117,a8w8_blockscale_1x128x128_256x128x128x128_16x16_32x32_2x2_8x32x1_8x32x1_1x32x1x8_8_1x1_intrawave_v3,577.41,852.45,0.0
gfx942,304,6528,5120,2176,ck,0,0,182.8373,a8w8_blockscale_1x128x128_256x128x128x128_16x16_32x32_2x2_8x32x1_8x32x1_1x32x1x8_8_1x1_intrawave_v3,795.56,504.23,0.0
gfx942,304,6656,5120,768,ck,0,0,87.4762,a8w8_blockscale_1x128x128_256x128x128x128_16x16_32x32_2x2_8x32x1_8x32x1_1x32x1x8_8_1x1_intrawave_v3,598.39,882.54,0.0
gfx942,304,6656,5120,2176,ck,0,0,190.4492,a8w8_blockscale_1x128x128_256x128x128x128_16x16_32x32_2x2_8x32x1_8x32x1_1x32x1x8_8_1x1_intrawave_v3,778.74,492.43,0.0
gfx942,304,6784,5120,768,ck,0,0,90.22,a8w8_blockscale_1x128x128_256x128x128x128_16x16_32x32_2x2_8x32x1_8x32x1_1x32x1x8_8_1x1_intrawave_v3,591.35,871.32,0.0
gfx942,304,6784,5120,2176,ck,0,0,191.0767,a8w8_blockscale_1x128x128_256x128x128x128_16x16_32x32_2x2_8x32x1_8x32x1_1x32x1x8_8_1x1_intrawave_v3,791.11,499.13,0.0
gfx942,304,6912,5120,768,ck,0,0,96.6729,a8w8_blockscale_1x128x128_256x128x128x128_16x16_32x32_2x2_8x32x1_8x32x1_1x32x1x8_8_1x1_intrawave_v3,562.29,827.73,0.0
gfx942,304,6912,5120,2176,ck,0,0,206.8765,a8w8_blockscale_1x128x128_256x128x128x128_16x16_32x32_2x2_8x32x1_8x32x1_1x32x1x8_8_1x1_intrawave_v3,744.48,468.69,0.0
gfx942,304,7040,5120,768,ck,0,0,97.3304,a8w8_blockscale_1x128x128_256x128x128x128_16x16_32x32_2x2_8x32x1_8x32x1_1x32x1x8_8_1x1_intrawave_v3,568.83,836.62,0.0
gfx942,304,7040,5120,2176,ck,0,0,208.7987,a8w8_blockscale_1x128x128_256x128x128x128_16x16_32x32_2x2_8x32x1_8x32x1_1x32x1x8_8_1x1_intrawave_v3,751.28,471.98,0.0
gfx942,304,7168,5120,768,ck,0,0,97.3995,a8w8_blockscale_1x128x128_256x128x128x128_16x16_32x32_2x2_8x32x1_8x32x1_1x32x1x8_8_1x1_intrawave_v3,578.77,850.49,0.0
gfx942,304,7168,5120,2176,ck,0,0,210.5886,a8w8_blockscale_1x128x128_256x128x128x128_16x16_32x32_2x2_8x32x1_8x32x1_1x32x1x8_8_1x1_intrawave_v3,758.44,475.52,0.0
gfx942,304,7296,5120,768,ck,0,0,98.2654,a8w8_blockscale_1x128x128_256x128x128x128_16x16_32x32_2x2_8x32x1_8x32x1_1x32x1x8_8_1x1_intrawave_v3,583.91,857.34,0.0
gfx942,304,7296,5120,2176,ck,0,0,209.7244,a8w8_blockscale_1x128x128_256x128x128x128_16x16_32x32_2x2_8x32x1_8x32x1_1x32x1x8_8_1x1_intrawave_v3,775.17,485.06,0.0
gfx942,304,7424,5120,768,ck,0,0,101.4994,a8w8_blockscale_1x128x128_256x128x128x128_16x16_32x32_2x2_8x32x1_8x32x1_1x32x1x8_8_1x1_intrawave_v3,575.22,843.9,0.0
gfx942,304,7424,5120,2176,ck,0,0,215.02,a8w8_blockscale_1x128x128_256x128x128x128_16x16_32x32_2x2_8x32x1_8x32x1_1x32x1x8_8_1x1_intrawave_v3,769.34,480.5,0.0
gfx942,304,7552,5120,768,ck,0,0,102.8988,a8w8_blockscale_1x128x128_256x128x128x128_16x16_32x32_2x2_8x32x1_8x32x1_1x32x1x8_8_1x1_intrawave_v3,577.18,846.12,0.0
gfx942,304,7552,5120,2176,ck,0,0,215.3339,a8w8_blockscale_1x128x128_256x128x128x128_16x16_32x32_2x2_8x32x1_8x32x1_1x32x1x8_8_1x1_intrawave_v3,781.46,487.18,0.0
gfx942,304,7680,5120,768,ck,0,0,103.7223,a8w8_blockscale_1x128x128_256x128x128x128_16x16_32x32_2x2_8x32x1_8x32x1_1x32x1x8_8_1x1_intrawave_v3,582.3,852.99,0.0
gfx942,304,7680,5120,2176,ck,0,0,209.5099,a8w8_blockscale_1x128x128_256x128x128x128_16x16_32x32_2x2_8x32x1_8x32x1_1x32x1x8_8_1x1_intrawave_v3,816.8,508.31,0.0
