aiter/configs/model_configs/a8w8_blockscale_tuned_gemm_qwen3_5-27B.csv
cu_num,M,N,K,libtype,kernelId,splitK,us,kernelName,tflops,bw,errRatio
64,1,5120,3072,ck,4,0,35.8449,a8w8_blockscale_1x128x128_256x16x256x128_8x16_16x16_1x4_16x16x1_8x32x1_1x16x1x16_8_1x2_intrawave_v1,0.88,439.17,0.0
64,1,5120,8704,ck,7,0,74.0455,a8w8_blockscale_1x128x128_256x16x128x256_16x16_16x16_1x2_16x16x1_16x16x1_1x16x1x16_8_1x2_intrawave_v1,1.2,602.11,0.0
64,2,5120,3072,ck,7,0,32.5003,a8w8_blockscale_1x128x128_256x16x128x256_16x16_16x16_1x2_16x16x1_16x16x1_1x16x1x16_8_1x2_intrawave_v1,1.94,484.77,0.0
64,2,5120,8704,ck,7,0,74.1262,a8w8_blockscale_1x128x128_256x16x128x256_16x16_16x16_1x2_16x16x1_16x16x1_1x16x1x16_8_1x2_intrawave_v1,2.4,601.71,0.0
64,4,5120,3072,ck,4,0,35.969,a8w8_blockscale_1x128x128_256x16x256x128_8x16_16x16_1x4_16x16x1_8x32x1_1x16x1x16_8_1x2_intrawave_v1,3.5,438.76,0.0
64,4,5120,8704,ck,7,0,74.4339,a8w8_blockscale_1x128x128_256x16x128x256_16x16_16x16_1x2_16x16x1_16x16x1_1x16x1x16_8_1x2_intrawave_v1,4.79,599.73,0.0
64,8,5120,3072,ck,7,0,32.8681,a8w8_blockscale_1x128x128_256x16x128x256_16x16_16x16_1x2_16x16x1_16x16x1_1x16x1x16_8_1x2_intrawave_v1,7.66,481.78,0.0
64,8,5120,8704,ck,7,0,75.0469,a8w8_blockscale_1x128x128_256x16x128x256_16x16_16x16_1x2_16x16x1_16x16x1_1x16x1x16_8_1x2_intrawave_v1,9.5,595.84,0.0
64,16,5120,3072,ck,7,0,33.1785,a8w8_blockscale_1x128x128_256x16x128x256_16x16_16x16_1x2_16x16x1_16x16x1_1x16x1x16_8_1x2_intrawave_v1,15.17,480.48,0.0
64,16,5120,8704,ck,7,0,75.7674,a8w8_blockscale_1x128x128_256x16x128x256_16x16_16x16_1x2_16x16x1_16x16x1_1x16x1x16_8_1x2_intrawave_v1,18.82,592.18,0.0
64,24,5120,3072,ck,7,0,36.1101,a8w8_blockscale_1x128x128_256x16x128x256_16x16_16x16_1x2_16x16x1_16x16x1_1x16x1x16_8_1x2_intrawave_v1,20.91,444.42,0.0
64,24,5120,8704,ck,5,0,77.0484,a8w8_blockscale_1x128x128_256x16x128x128_8x16_16x16_1x2_16x16x1_8x32x1_1x16x1x16_8_1x2_intrawave_v1,27.76,584.3,0.0
64,32,5120,3072,ck,7,0,35.9258,a8w8_blockscale_1x128x128_256x16x128x256_16x16_16x16_1x2_16x16x1_16x16x1_1x16x1x16_8_1x2_intrawave_v1,28.02,449.67,0.0
64,32,5120,8704,ck,5,0,78.3997,a8w8_blockscale_1x128x128_256x16x128x128_8x16_16x16_1x2_16x16x1_8x32x1_1x16x1x16_8_1x2_intrawave_v1,36.38,576.16,0.0
64,40,5120,3072,ck,5,0,38.5909,a8w8_blockscale_1x128x128_256x16x128x128_8x16_16x16_1x2_16x16x1_8x32x1_1x16x1x16_8_1x2_intrawave_v1,32.61,421.37,0.0
64,40,5120,8704,ck,5,0,78.5167,a8w8_blockscale_1x128x128_256x16x128x128_8x16_16x16_1x2_16x16x1_8x32x1_1x16x1x16_8_1x2_intrawave_v1,45.41,577.23,0.0
64,48,5120,3072,ck,5,0,38.9412,a8w8_blockscale_1x128x128_256x16x128x128_8x16_16x16_1x2_16x16x1_8x32x1_1x16x1x16_8_1x2_intrawave_v1,38.78,420.32,0.0
64,48,5120,8704,ck,5,0,80.9134,a8w8_blockscale_1x128x128_256x16x128x128_8x16_16x16_1x2_16x16x1_8x32x1_1x16x1x16_8_1x2_intrawave_v1,52.87,562.01,0.0
64,56,5120,3072,ck,7,0,39.7148,a8w8_blockscale_1x128x128_256x16x128x256_16x16_16x16_1x2_16x16x1_16x16x1_1x16x1x16_8_1x2_intrawave_v1,44.36,414.81,0.0
64,56,5120,8704,ck,5,0,80.3693,a8w8_blockscale_1x128x128_256x16x128x128_8x16_16x16_1x2_16x16x1_8x32x1_1x16x1x16_8_1x2_intrawave_v1,62.1,567.7,0.0
64,64,5120,3072,ck,7,0,40.4736,a8w8_blockscale_1x128x128_256x16x128x256_16x16_16x16_1x2_16x16x1_16x16x1_1x16x1x16_8_1x2_intrawave_v1,49.74,409.66,0.0
64,64,5120,8704,ck,5,0,81.9423,a8w8_blockscale_1x128x128_256x16x128x128_8x16_16x16_1x2_16x16x1_8x32x1_1x16x1x16_8_1x2_intrawave_v1,69.61,558.65,0.0
64,72,5120,3072,ck,5,0,48.5162,a8w8_blockscale_1x128x128_256x16x128x128_8x16_16x16_1x2_16x16x1_8x32x1_1x16x1x16_8_1x2_intrawave_v1,46.68,343.95,0.0
64,72,5120,8704,ck,5,0,92.863,a8w8_blockscale_1x128x128_256x16x128x128_8x16_16x16_1x2_16x16x1_8x32x1_1x16x1x16_8_1x2_intrawave_v1,69.1,494.58,0.0
64,80,5120,3072,ck,5,0,49.5481,a8w8_blockscale_1x128x128_256x16x128x128_8x16_16x16_1x2_16x16x1_8x32x1_1x16x1x16_8_1x2_intrawave_v1,50.79,338.94,0.0
64,80,5120,8704,ck,5,0,92.5285,a8w8_blockscale_1x128x128_256x16x128x128_8x16_16x16_1x2_16x16x1_8x32x1_1x16x1x16_8_1x2_intrawave_v1,77.06,498.01,0.0
64,88,5120,3072,ck,4,0,53.2705,a8w8_blockscale_1x128x128_256x16x256x128_8x16_16x16_1x4_16x16x1_8x32x1_1x16x1x16_8_1x2_intrawave_v1,51.97,317.25,0.0
64,88,5120,8704,ck,4,0,110.4217,a8w8_blockscale_1x128x128_256x16x256x128_8x16_16x16_1x4_16x16x1_8x32x1_1x16x1x16_8_1x2_intrawave_v1,71.03,418.68,0.0
64,96,5120,3072,ck,4,0,52.5399,a8w8_blockscale_1x128x128_256x16x256x128_8x16_16x16_1x4_16x16x1_8x32x1_1x16x1x16_8_1x2_intrawave_v1,57.48,323.69,0.0
64,96,5120,8704,ck,5,0,108.663,a8w8_blockscale_1x128x128_256x16x128x128_8x16_16x16_1x2_16x16x1_8x32x1_1x16x1x16_8_1x2_intrawave_v1,78.74,426.85,0.0
64,104,5120,3072,ck,4,0,54.4798,a8w8_blockscale_1x128x128_256x16x256x128_8x16_16x16_1x4_16x16x1_8x32x1_1x16x1x16_8_1x2_intrawave_v1,60.05,314.12,0.0
64,104,5120,8704,ck,4,0,114.0897,a8w8_blockscale_1x128x128_256x16x256x128_8x16_16x16_1x4_16x16x1_8x32x1_1x16x1x16_8_1x2_intrawave_v1,81.25,407.88,0.0
64,112,5120,3072,ck,4,0,52.7406,a8w8_blockscale_1x128x128_256x16x256x128_8x16_16x16_1x4_16x16x1_8x32x1_1x16x1x16_8_1x2_intrawave_v1,66.8,326.5,0.0
64,112,5120,8704,ck,5,0,115.5738,a8w8_blockscale_1x128x128_256x16x128x128_8x16_16x16_1x2_16x16x1_8x32x1_1x16x1x16_8_1x2_intrawave_v1,86.37,403.95,0.0
64,120,5120,3072,ck,4,0,50.5377,a8w8_blockscale_1x128x128_256x16x256x128_8x16_16x16_1x4_16x16x1_8x32x1_1x16x1x16_8_1x2_intrawave_v1,74.69,342.83,0.0
64,120,5120,8704,ck,4,0,100.01,a8w8_blockscale_1x128x128_256x16x256x128_8x16_16x16_1x4_16x16x1_8x32x1_1x16x1x16_8_1x2_intrawave_v1,106.94,468.33,0.0
64,128,5120,3072,ck,4,0,53.0801,a8w8_blockscale_1x128x128_256x16x256x128_8x16_16x16_1x4_16x16x1_8x32x1_1x16x1x16_8_1x2_intrawave_v1,75.86,328.42,0.0
64,128,5120,8704,ck,5,0,99.397,a8w8_blockscale_1x128x128_256x16x128x128_8x16_16x16_1x2_16x16x1_8x32x1_1x16x1x16_8_1x2_intrawave_v1,114.78,472.74,0.0
64,136,5120,3072,ck,4,0,59.8006,a8w8_blockscale_1x128x128_256x16x256x128_8x16_16x16_1x4_16x16x1_8x32x1_1x16x1x16_8_1x2_intrawave_v1,71.54,293.29,0.0
64,136,5120,8704,ck,4,0,135.5545,a8w8_blockscale_1x128x128_256x16x256x128_8x16_16x16_1x4_16x16x1_8x32x1_1x16x1x16_8_1x2_intrawave_v1,89.42,347.76,0.0
64,144,5120,3072,ck,4,0,60.2411,a8w8_blockscale_1x128x128_256x16x256x128_8x16_16x16_1x4_16x16x1_8x32x1_1x16x1x16_8_1x2_intrawave_v1,75.2,292.92,0.0
64,144,5120,8704,ck,4,0,137.3691,a8w8_blockscale_1x128x128_256x16x256x128_8x16_16x16_1x4_16x16x1_8x32x1_1x16x1x16_8_1x2_intrawave_v1,93.43,344.27,0.0
64,152,5120,3072,ck,4,0,64.0916,a8w8_blockscale_1x128x128_256x16x256x128_8x16_16x16_1x4_16x16x1_8x32x1_1x16x1x16_8_1x2_intrawave_v1,74.6,276.98,0.0
64,152,5120,8704,ck,5,0,136.1241,a8w8_blockscale_1x128x128_256x16x128x128_8x16_16x16_1x2_16x16x1_8x32x1_1x16x1x16_8_1x2_intrawave_v1,99.52,348.53,0.0
64,160,5120,3072,ck,4,0,60.0399,a8w8_blockscale_1x128x128_256x16x256x128_8x16_16x16_1x4_16x16x1_8x32x1_1x16x1x16_8_1x2_intrawave_v1,83.83,297.44,0.0
64,160,5120,8704,ck,5,0,135.6244,a8w8_blockscale_1x128x128_256x16x128x128_8x16_16x16_1x2_16x16x1_8x32x1_1x16x1x16_8_1x2_intrawave_v1,105.15,350.94,0.0
64,168,5120,3072,ck,4,0,69.7486,a8w8_blockscale_1x128x128_256x16x256x128_8x16_16x16_1x4_16x16x1_8x32x1_1x16x1x16_8_1x2_intrawave_v1,75.77,257.57,0.0
64,168,5120,8704,ck,5,0,146.9721,a8w8_blockscale_1x128x128_256x16x128x128_8x16_16x16_1x2_16x16x1_8x32x1_1x16x1x16_8_1x2_intrawave_v1,101.88,324.87,0.0
64,176,5120,3072,ck,4,0,65.8057,a8w8_blockscale_1x128x128_256x16x256x128_8x16_16x16_1x4_16x16x1_8x32x1_1x16x1x16_8_1x2_intrawave_v1,84.13,274.62,0.0
64,176,5120,8704,ck,5,0,148.4097,a8w8_blockscale_1x128x128_256x16x128x128_8x16_16x16_1x2_16x16x1_8x32x1_1x16x1x16_8_1x2_intrawave_v1,105.7,322.75,0.0
64,184,5120,3072,ck,4,0,77.0512,a8w8_blockscale_1x128x128_256x16x256x128_8x16_16x16_1x4_16x16x1_8x32x1_1x16x1x16_8_1x2_intrawave_v1,75.12,235.92,0.0
64,184,5120,8704,ck,5,0,173.4977,a8w8_blockscale_1x128x128_256x16x128x128_8x16_16x16_1x2_16x16x1_8x32x1_1x16x1x16_8_1x2_intrawave_v1,94.52,276.95,0.0
64,192,5120,3072,ck,4,0,77.8566,a8w8_blockscale_1x128x128_256x16x256x128_8x16_16x16_1x4_16x16x1_8x32x1_1x16x1x16_8_1x2_intrawave_v1,77.58,234.85,0.0
64,192,5120,8704,ck,5,0,174.1203,a8w8_blockscale_1x128x128_256x16x128x128_8x16_16x16_1x2_16x16x1_8x32x1_1x16x1x16_8_1x2_intrawave_v1,98.28,276.83,0.0
64,200,5120,3072,ck,4,0,77.9719,a8w8_blockscale_1x128x128_256x16x256x128_8x16_16x16_1x4_16x16x1_8x32x1_1x16x1x16_8_1x2_intrawave_v1,80.69,235.87,0.0
64,200,5120,8704,ck,4,0,181.1139,a8w8_blockscale_1x128x128_256x16x256x128_8x16_16x16_1x4_16x16x1_8x32x1_1x16x1x16_8_1x2_intrawave_v1,98.42,266.98,0.0
64,208,5120,3072,ck,4,0,72.2924,a8w8_blockscale_1x128x128_256x16x256x128_8x16_16x16_1x4_16x16x1_8x32x1_1x16x1x16_8_1x2_intrawave_v1,90.51,255.87,0.0
64,208,5120,8704,ck,4,0,181.636,a8w8_blockscale_1x128x128_256x16x256x128_8x16_16x16_1x4_16x16x1_8x32x1_1x16x1x16_8_1x2_intrawave_v1,102.07,267.04,0.0
64,216,5120,3072,ck,4,0,78.12,a8w8_blockscale_1x128x128_256x16x256x128_8x16_16x16_1x4_16x16x1_8x32x1_1x16x1x16_8_1x2_intrawave_v1,86.98,238.15,0.0
64,216,5120,8704,ck,4,0,189.0926,a8w8_blockscale_1x128x128_256x16x256x128_8x16_16x16_1x4_16x16x1_8x32x1_1x16x1x16_8_1x2_intrawave_v1,101.81,257.32,0.0
64,224,5120,3072,ck,4,0,79.321,a8w8_blockscale_1x128x128_256x16x256x128_8x16_16x16_1x4_16x16x1_8x32x1_1x16x1x16_8_1x2_intrawave_v1,88.83,235.88,0.0
64,224,5120,8704,ck,4,0,187.9046,a8w8_blockscale_1x128x128_256x16x256x128_8x16_16x16_1x4_16x16x1_8x32x1_1x16x1x16_8_1x2_intrawave_v1,106.25,259.75,0.0
64,232,5120,3072,ck,4,0,74.5569,a8w8_blockscale_1x128x128_256x16x256x128_8x16_16x16_1x4_16x16x1_8x32x1_1x16x1x16_8_1x2_intrawave_v1,97.89,252.38,0.0
64,232,5120,8704,ck,4,0,175.3156,a8w8_blockscale_1x128x128_256x16x256x128_8x16_16x16_1x4_16x16x1_8x32x1_1x16x1x16_8_1x2_intrawave_v1,117.95,279.26,0.0
64,240,5120,3072,ck,4,0,76.0598,a8w8_blockscale_1x128x128_256x16x256x128_8x16_16x16_1x4_16x16x1_8x32x1_1x16x1x16_8_1x2_intrawave_v1,99.26,248.8,0.0
64,240,5120,8704,ck,4,0,178.0808,a8w8_blockscale_1x128x128_256x16x256x128_8x16_16x16_1x4_16x16x1_8x32x1_1x16x1x16_8_1x2_intrawave_v1,120.12,275.78,0.0
64,248,5120,3072,ck,4,0,68.5878,a8w8_blockscale_1x128x128_256x16x256x128_8x16_16x16_1x4_16x16x1_8x32x1_1x16x1x16_8_1x2_intrawave_v1,113.74,277.45,0.0
64,248,5120,8704,ck,4,0,165.3605,a8w8_blockscale_1x128x128_256x16x256x128_8x16_16x16_1x4_16x16x1_8x32x1_1x16x1x16_8_1x2_intrawave_v1,133.67,297.91,0.0
64,256,5120,3072,ck,4,0,69.8923,a8w8_blockscale_1x128x128_256x16x256x128_8x16_16x16_1x4_16x16x1_8x32x1_1x16x1x16_8_1x2_intrawave_v1,115.22,273.8,0.0
64,256,5120,8704,ck,4,0,167.3519,a8w8_blockscale_1x128x128_256x16x256x128_8x16_16x16_1x4_16x16x1_8x32x1_1x16x1x16_8_1x2_intrawave_v1,136.34,295.27,0.0
64,264,5120,3072,ck,4,0,81.0515,a8w8_blockscale_1x128x128_256x16x256x128_8x16_16x16_1x4_16x16x1_8x32x1_1x16x1x16_8_1x2_intrawave_v1,102.46,237.42,0.0
64,264,5120,8704,ck,4,0,201.0811,a8w8_blockscale_1x128x128_256x16x256x128_8x16_16x16_1x4_16x16x1_8x32x1_1x16x1x16_8_1x2_intrawave_v1,117.02,246.5,0.0
64,272,5120,3072,ck,4,0,82.2626,a8w8_blockscale_1x128x128_256x16x256x128_8x16_16x16_1x4_16x16x1_8x32x1_1x16x1x16_8_1x2_intrawave_v1,104.01,235.22,0.0
64,272,5120,8704,ck,4,0,199.7823,a8w8_blockscale_1x128x128_256x16x256x128_8x16_16x16_1x4_16x16x1_8x32x1_1x16x1x16_8_1x2_intrawave_v1,121.35,248.86,0.0
64,280,5120,3072,ck,4,0,92.8186,a8w8_blockscale_1x128x128_256x16x256x128_8x16_16x16_1x4_16x16x1_8x32x1_1x16x1x16_8_1x2_intrawave_v1,94.9,209.61,0.0
64,280,5120,8704,ck,4,0,230.8247,a8w8_blockscale_1x128x128_256x16x256x128_8x16_16x16_1x4_16x16x1_8x32x1_1x16x1x16_8_1x2_intrawave_v1,108.12,216.05,0.0
64,288,5120,3072,ck,4,0,92.6305,a8w8_blockscale_1x128x128_256x16x256x128_8x16_16x16_1x4_16x16x1_8x32x1_1x16x1x16_8_1x2_intrawave_v1,97.8,211.19,0.0
64,288,5120,8704,ck,4,0,231.1063,a8w8_blockscale_1x128x128_256x16x256x128_8x16_16x16_1x4_16x16x1_8x32x1_1x16x1x16_8_1x2_intrawave_v1,111.07,216.44,0.0
64,296,5120,3072,ck,4,0,100.3553,a8w8_blockscale_1x128x128_256x16x256x128_8x16_16x16_1x4_16x16x1_8x32x1_1x16x1x16_8_1x2_intrawave_v1,92.78,195.99,0.0
64,296,5120,8704,ck,4,0,224.7026,a8w8_blockscale_1x128x128_256x16x256x128_8x16_16x16_1x4_16x16x1_8x32x1_1x16x1x16_8_1x2_intrawave_v1,117.41,223.28,0.0
64,304,5120,3072,ck,4,0,94.1803,a8w8_blockscale_1x128x128_256x16x256x128_8x16_16x16_1x4_16x16x1_8x32x1_1x16x1x16_8_1x2_intrawave_v1,101.54,209.97,0.0
64,304,5120,8704,ck,4,0,226.0766,a8w8_blockscale_1x128x128_256x16x256x128_8x16_16x16_1x4_16x16x1_8x32x1_1x16x1x16_8_1x2_intrawave_v1,119.85,222.59,0.0
64,312,5120,3072,ck,4,0,106.1679,a8w8_blockscale_1x128x128_256x16x256x128_8x16_16x16_1x4_16x16x1_8x32x1_1x16x1x16_8_1x2_intrawave_v1,92.44,187.27,0.0
64,312,5120,8704,ck,4,0,248.7446,a8w8_blockscale_1x128x128_256x16x256x128_8x16_16x16_1x4_16x16x1_8x32x1_1x16x1x16_8_1x2_intrawave_v1,111.79,202.92,0.0
64,320,5120,3072,ck,5,0,114.9468,a8w8_blockscale_1x128x128_256x16x128x128_8x16_16x16_1x2_16x16x1_8x32x1_1x16x1x16_8_1x2_intrawave_v1,87.57,173.89,0.0
64,320,5120,8704,ck,4,0,253.2089,a8w8_blockscale_1x128x128_256x16x256x128_8x16_16x16_1x4_16x16x1_8x32x1_1x16x1x16_8_1x2_intrawave_v1,112.64,199.94,0.0
64,328,5120,3072,ck,4,0,94.1648,a8w8_blockscale_1x128x128_256x16x256x128_8x16_16x16_1x4_16x16x1_8x32x1_1x16x1x16_8_1x2_intrawave_v1,109.57,213.4,0.0
64,328,5120,8704,ck,4,0,238.1408,a8w8_blockscale_1x128x128_256x16x256x128_8x16_16x16_1x4_16x16x1_8x32x1_1x16x1x16_8_1x2_intrawave_v1,122.76,213.23,0.0
64,336,5120,3072,ck,4,0,94.1173,a8w8_blockscale_1x128x128_256x16x256x128_8x16_16x16_1x4_16x16x1_8x32x1_1x16x1x16_8_1x2_intrawave_v1,112.3,214.64,0.0
64,336,5120,8704,ck,4,0,237.6507,a8w8_blockscale_1x128x128_256x16x256x128_8x16_16x16_1x4_16x16x1_8x32x1_1x16x1x16_8_1x2_intrawave_v1,126.01,214.3,0.0
64,344,5120,3072,ck,4,0,109.9089,a8w8_blockscale_1x128x128_256x16x256x128_8x16_16x16_1x4_16x16x1_8x32x1_1x16x1x16_8_1x2_intrawave_v1,98.46,184.77,0.0
64,344,5120,8704,ck,4,0,255.0689,a8w8_blockscale_1x128x128_256x16x256x128_8x16_16x16_1x4_16x16x1_8x32x1_1x16x1x16_8_1x2_intrawave_v1,120.2,200.26,0.0
64,352,5120,3072,ck,4,0,102.297,a8w8_blockscale_1x128x128_256x16x256x128_8x16_16x16_1x4_16x16x1_8x32x1_1x16x1x16_8_1x2_intrawave_v1,108.24,199.56,0.0
64,352,5120,8704,ck,4,0,256.2715,a8w8_blockscale_1x128x128_256x16x256x128_8x16_16x16_1x4_16x16x1_8x32x1_1x16x1x16_8_1x2_intrawave_v1,122.42,199.92,0.0
64,360,5120,3072,ck,4,0,107.4799,a8w8_blockscale_1x128x128_256x16x256x128_8x16_16x16_1x4_16x16x1_8x32x1_1x16x1x16_8_1x2_intrawave_v1,105.37,190.93,0.0
64,360,5120,8704,ck,4,0,278.8013,a8w8_blockscale_1x128x128_256x16x256x128_8x16_16x16_1x4_16x16x1_8x32x1_1x16x1x16_8_1x2_intrawave_v1,115.09,184.3,0.0
64,368,5120,3072,ck,4,0,108.8708,a8w8_blockscale_1x128x128_256x16x256x128_8x16_16x16_1x4_16x16x1_8x32x1_1x16x1x16_8_1x2_intrawave_v1,106.33,189.47,0.0
64,368,5120,8704,ck,4,0,278.4959,a8w8_blockscale_1x128x128_256x16x256x128_8x16_16x16_1x4_16x16x1_8x32x1_1x16x1x16_8_1x2_intrawave_v1,117.77,185.05,0.0
64,376,5120,3072,ck,4,0,115.2247,a8w8_blockscale_1x128x128_256x16x256x128_8x16_16x16_1x4_16x16x1_8x32x1_1x16x1x16_8_1x2_intrawave_v1,102.65,179.94,0.0
64,376,5120,8704,ck,4,0,257.0561,a8w8_blockscale_1x128x128_256x16x256x128_8x16_16x16_1x4_16x16x1_8x32x1_1x16x1x16_8_1x2_intrawave_v1,130.37,201.07,0.0
64,384,5120,3072,ck,4,0,108.543,a8w8_blockscale_1x128x128_256x16x256x128_8x16_16x16_1x4_16x16x1_8x32x1_1x16x1x16_8_1x2_intrawave_v1,111.29,192.0,0.0
64,384,5120,8704,ck,4,0,254.5963,a8w8_blockscale_1x128x128_256x16x256x128_8x16_16x16_1x4_16x16x1_8x32x1_1x16x1x16_8_1x2_intrawave_v1,134.43,203.61,0.0
64,392,5120,3072,ck,4,0,117.56,a8w8_blockscale_1x128x128_256x16x256x128_8x16_16x16_1x4_16x16x1_8x32x1_1x16x1x16_8_1x2_intrawave_v1,104.89,178.18,0.0
64,392,5120,8704,ck,4,0,293.4792,a8w8_blockscale_1x128x128_256x16x256x128_8x16_16x16_1x4_16x16x1_8x32x1_1x16x1x16_8_1x2_intrawave_v1,119.05,177.15,0.0
64,400,5120,3072,ck,4,0,116.2589,a8w8_blockscale_1x128x128_256x16x256x128_8x16_16x16_1x4_16x16x1_8x32x1_1x16x1x16_8_1x2_intrawave_v1,108.23,181.09,0.0
64,400,5120,8704,ck,4,0,293.589,a8w8_blockscale_1x128x128_256x16x256x128_8x16_16x16_1x4_16x16x1_8x32x1_1x16x1x16_8_1x2_intrawave_v1,121.43,177.6,0.0
64,408,5120,3072,ck,4,0,116.6696,a8w8_blockscale_1x128x128_256x16x256x128_8x16_16x16_1x4_16x16x1_8x32x1_1x16x1x16_8_1x2_intrawave_v1,110.01,181.37,0.0
64,408,5120,8704,ck,4,0,308.7743,a8w8_blockscale_1x128x128_256x16x256x128_8x16_16x16_1x4_16x16x1_8x32x1_1x16x1x16_8_1x2_intrawave_v1,117.77,169.36,0.0
64,416,5120,3072,ck,4,0,124.735,a8w8_blockscale_1x128x128_256x16x256x128_8x16_16x16_1x4_16x16x1_8x32x1_1x16x1x16_8_1x2_intrawave_v1,104.91,170.49,0.0
64,416,5120,8704,ck,4,0,307.2475,a8w8_blockscale_1x128x128_256x16x256x128_8x16_16x16_1x4_16x16x1_8x32x1_1x16x1x16_8_1x2_intrawave_v1,120.68,170.69,0.0
64,424,5120,3072,ck,4,0,122.4101,a8w8_blockscale_1x128x128_256x16x256x128_8x16_16x16_1x4_16x16x1_8x32x1_1x16x1x16_8_1x2_intrawave_v1,108.96,174.6,0.0
64,424,5120,8704,ck,4,0,312.3243,a8w8_blockscale_1x128x128_256x16x256x128_8x16_16x16_1x4_16x16x1_8x32x1_1x16x1x16_8_1x2_intrawave_v1,121.0,168.4,0.0
64,432,5120,3072,ck,4,0,121.4453,a8w8_blockscale_1x128x128_256x16x256x128_8x16_16x16_1x4_16x16x1_8x32x1_1x16x1x16_8_1x2_intrawave_v1,111.9,176.87,0.0
64,432,5120,8704,ck,4,0,315.9592,a8w8_blockscale_1x128x128_256x16x256x128_8x16_16x16_1x4_16x16x1_8x32x1_1x16x1x16_8_1x2_intrawave_v1,121.86,166.95,0.0
64,440,5120,3072,ck,4,0,144.8272,a8w8_blockscale_1x128x128_256x16x256x128_8x16_16x16_1x4_16x16x1_8x32x1_1x16x1x16_8_1x2_intrawave_v1,95.57,149.05,0.0
64,440,5120,8704,ck,4,0,328.4189,a8w8_blockscale_1x128x128_256x16x256x128_8x16_16x16_1x4_16x16x1_8x32x1_1x16x1x16_8_1x2_intrawave_v1,119.41,161.07,0.0
64,448,5120,3072,ck,4,0,142.1904,a8w8_blockscale_1x128x128_256x16x256x128_8x16_16x16_1x4_16x16x1_8x32x1_1x16x1x16_8_1x2_intrawave_v1,99.11,152.56,0.0
64,448,5120,8704,ck,4,0,326.8641,a8w8_blockscale_1x128x128_256x16x256x128_8x16_16x16_1x4_16x16x1_8x32x1_1x16x1x16_8_1x2_intrawave_v1,122.16,162.3,0.0
64,456,5120,3072,ck,4,0,124.6693,a8w8_blockscale_1x128x128_256x16x256x128_8x16_16x16_1x4_16x16x1_8x32x1_1x16x1x16_8_1x2_intrawave_v1,115.06,174.85,0.0
64,456,5120,8704,ck,4,0,331.842,a8w8_blockscale_1x128x128_256x16x256x128_8x16_16x16_1x4_16x16x1_8x32x1_1x16x1x16_8_1x2_intrawave_v1,122.48,160.33,0.0
64,464,5120,3072,ck,4,0,126.366,a8w8_blockscale_1x128x128_256x16x256x128_8x16_16x16_1x4_16x16x1_8x32x1_1x16x1x16_8_1x2_intrawave_v1,115.51,173.35,0.0
64,464,5120,8704,ck,4,0,332.8535,a8w8_blockscale_1x128x128_256x16x256x128_8x16_16x16_1x4_16x16x1_8x32x1_1x16x1x16_8_1x2_intrawave_v1,124.25,160.29,0.0
64,472,5120,3072,ck,4,0,125.6154,a8w8_blockscale_1x128x128_256x16x256x128_8x16_16x16_1x4_16x16x1_8x32x1_1x16x1x16_8_1x2_intrawave_v1,118.2,175.23,0.0
64,472,5120,8704,ck,4,0,315.8533,a8w8_blockscale_1x128x128_256x16x256x128_8x16_16x16_1x4_16x16x1_8x32x1_1x16x1x16_8_1x2_intrawave_v1,133.19,169.4,0.0
64,480,5120,3072,ck,4,0,138.1526,a8w8_blockscale_1x128x128_256x16x256x128_8x16_16x16_1x4_16x16x1_8x32x1_1x16x1x16_8_1x2_intrawave_v1,109.3,160.1,0.0
64,480,5120,8704,ck,4,0,318.8913,a8w8_blockscale_1x128x128_256x16x256x128_8x16_16x16_1x4_16x16x1_8x32x1_1x16x1x16_8_1x2_intrawave_v1,134.16,168.26,0.0
64,488,5120,3072,ck,4,0,125.6216,a8w8_blockscale_1x128x128_256x16x256x128_8x16_16x16_1x4_16x16x1_8x32x1_1x16x1x16_8_1x2_intrawave_v1,122.2,176.92,0.0
64,488,5120,8704,ck,4,0,320.4373,a8w8_blockscale_1x128x128_256x16x256x128_8x16_16x16_1x4_16x16x1_8x32x1_1x16x1x16_8_1x2_intrawave_v1,135.74,167.92,0.0
64,496,5120,3072,ck,4,0,125.1677,a8w8_blockscale_1x128x128_256x16x256x128_8x16_16x16_1x4_16x16x1_8x32x1_1x16x1x16_8_1x2_intrawave_v1,124.66,178.41,0.0
64,496,5120,8704,ck,4,0,315.5768,a8w8_blockscale_1x128x128_256x16x256x128_8x16_16x16_1x4_16x16x1_8x32x1_1x16x1x16_8_1x2_intrawave_v1,140.09,170.99,0.0
64,504,5120,3072,ck,4,0,120.172,a8w8_blockscale_1x128x128_256x16x256x128_8x16_16x16_1x4_16x16x1_8x32x1_1x16x1x16_8_1x2_intrawave_v1,131.93,186.71,0.0
64,504,5120,8704,ck,4,0,311.3322,a8w8_blockscale_1x128x128_256x16x256x128_8x16_16x16_1x4_16x16x1_8x32x1_1x16x1x16_8_1x2_intrawave_v1,144.29,173.81,0.0
64,512,5120,3072,ck,4,0,119.8345,a8w8_blockscale_1x128x128_256x16x256x128_8x16_16x16_1x4_16x16x1_8x32x1_1x16x1x16_8_1x2_intrawave_v1,134.4,188.13,0.0
64,512,5120,8704,ck,4,0,313.226,a8w8_blockscale_1x128x128_256x16x256x128_8x16_16x16_1x4_16x16x1_8x32x1_1x16x1x16_8_1x2_intrawave_v1,145.69,173.24,0.0
64,1024,5120,3072,ck,4,0,240.8796,a8w8_blockscale_1x128x128_256x16x256x128_8x16_16x16_1x4_16x16x1_8x32x1_1x16x1x16_8_1x2_intrawave_v1,133.73,121.89,0.0
64,1024,5120,8704,ck,4,0,625.6462,a8w8_blockscale_1x128x128_256x16x256x128_8x16_16x16_1x4_16x16x1_8x32x1_1x16x1x16_8_1x2_intrawave_v1,145.88,102.24,0.0
64,2048,5120,3072,ck,4,0,474.6263,a8w8_blockscale_1x128x128_256x16x256x128_8x16_16x16_1x4_16x16x1_8x32x1_1x16x1x16_8_1x2_intrawave_v1,135.74,90.58,0.0
64,2048,5120,8704,ck,4,0,1240.9607,a8w8_blockscale_1x128x128_256x16x256x128_8x16_16x16_1x4_16x16x1_8x32x1_1x16x1x16_8_1x2_intrawave_v1,147.09,67.18,0.0
64,4096,5120,3072,ck,4,0,940.0359,a8w8_blockscale_1x128x128_256x16x256x128_8x16_16x16_1x4_16x16x1_8x32x1_1x16x1x16_8_1x2_intrawave_v1,137.07,74.74,0.0
64,4096,5120,8704,ck,4,0,2539.3671,a8w8_blockscale_1x128x128_256x16x256x128_8x16_16x16_1x4_16x16x1_8x32x1_1x16x1x16_8_1x2_intrawave_v1,143.77,48.11,0.0
64,8192,5120,3072,ck,4,0,1850.1587,a8w8_blockscale_1x128x128_256x16x256x128_8x16_16x16_1x4_16x16x1_8x32x1_1x16x1x16_8_1x2_intrawave_v1,139.28,67.44,0.0
64,8192,5120,8704,ck,4,0,5060.5879,a8w8_blockscale_1x128x128_256x16x256x128_8x16_16x16_1x4_16x16x1_8x32x1_1x16x1x16_8_1x2_intrawave_v1,144.28,39.47,0.0
64,16384,5120,3072,ck,4,0,3757.8692,a8w8_blockscale_1x128x128_256x16x256x128_8x16_16x16_1x4_16x16x1_8x32x1_1x16x1x16_8_1x2_intrawave_v1,137.15,62.22,0.0
64,16384,5120,8704,ck,4,0,10235.6174,a8w8_blockscale_1x128x128_256x16x256x128_8x16_16x16_1x4_16x16x1_8x32x1_1x16x1x16_8_1x2_intrawave_v1,142.67,34.68,0.0
64,20480,5120,3072,ck,4,0,4723.0002,a8w8_blockscale_1x128x128_256x16x256x128_8x16_16x16_1x4_16x16x1_8x32x1_1x16x1x16_8_1x2_intrawave_v1,136.41,61.05,0.0
64,20480,5120,8704,ck,4,0,12639.3843,a8w8_blockscale_1x128x128_256x16x256x128_8x16_16x16_1x4_16x16x1_8x32x1_1x16x1x16_8_1x2_intrawave_v1,144.42,34.22,0.0
64,1,7168,5120,ck,7,0,67.055,a8w8_blockscale_1x128x128_256x16x128x256_16x16_16x16_1x2_16x16x1_16x16x1_1x16x1x16_8_1x2_intrawave_v1,1.09,547.6,0.0
64,2,7168,5120,ck,7,0,67.8543,a8w8_blockscale_1x128x128_256x16x128x256_16x16_16x16_1x2_16x16x1_16x16x1_1x16x1x16_8_1x2_intrawave_v1,2.16,541.44,0.0
64,4,7168,5120,ck,7,0,67.9946,a8w8_blockscale_1x128x128_256x16x128x256_16x16_16x16_1x2_16x16x1_16x16x1_1x16x1x16_8_1x2_intrawave_v1,4.32,540.9,0.0
64,8,7168,5120,ck,7,0,68.1301,a8w8_blockscale_1x128x128_256x16x128x256_16x16_16x16_1x2_16x16x1_16x16x1_1x16x1x16_8_1x2_intrawave_v1,8.62,540.96,0.0
64,16,7168,5120,ck,7,0,68.9515,a8w8_blockscale_1x128x128_256x16x128x256_16x16_16x16_1x2_16x16x1_16x16x1_1x16x1x16_8_1x2_intrawave_v1,17.03,536.78,0.0
64,24,7168,5120,ck,4,0,73.3388,a8w8_blockscale_1x128x128_256x16x256x128_8x16_16x16_1x4_16x16x1_8x32x1_1x16x1x16_8_1x2_intrawave_v1,24.02,506.79,0.0
64,32,7168,5120,ck,5,0,74.3126,a8w8_blockscale_1x128x128_256x16x128x128_8x16_16x16_1x2_16x16x1_8x32x1_1x16x1x16_8_1x2_intrawave_v1,31.61,502.24,0.0
64,40,7168,5120,ck,7,0,76.2882,a8w8_blockscale_1x128x128_256x16x128x256_16x16_16x16_1x2_16x16x1_16x16x1_1x16x1x16_8_1x2_intrawave_v1,38.49,491.27,0.0
64,48,7168,5120,ck,7,0,76.1381,a8w8_blockscale_1x128x128_256x16x128x256_16x16_16x16_1x2_16x16x1_16x16x1_1x16x1x16_8_1x2_intrawave_v1,46.27,494.29,0.0
64,56,7168,5120,ck,7,0,86.9846,a8w8_blockscale_1x128x128_256x16x128x256_16x16_16x16_1x2_16x16x1_16x16x1_1x16x1x16_8_1x2_intrawave_v1,47.25,434.44,0.0
64,64,7168,5120,ck,7,0,85.6914,a8w8_blockscale_1x128x128_256x16x128x256_16x16_16x16_1x2_16x16x1_16x16x1_1x16x1x16_8_1x2_intrawave_v1,54.82,442.81,0.0
64,72,7168,5120,ck,4,0,101.1864,a8w8_blockscale_1x128x128_256x16x256x128_8x16_16x16_1x4_16x16x1_8x32x1_1x16x1x16_8_1x2_intrawave_v1,52.23,376.54,0.0
64,80,7168,5120,ck,4,0,102.3098,a8w8_blockscale_1x128x128_256x16x256x128_8x16_16x16_1x4_16x16x1_8x32x1_1x16x1x16_8_1x2_intrawave_v1,57.39,373.93,0.0
64,88,7168,5120,ck,5,0,98.0691,a8w8_blockscale_1x128x128_256x16x128x128_8x16_16x16_1x2_16x16x1_8x32x1_1x16x1x16_8_1x2_intrawave_v1,65.86,391.69,0.0
64,96,7168,5120,ck,4,0,96.5738,a8w8_blockscale_1x128x128_256x16x256x128_8x16_16x16_1x4_16x16x1_8x32x1_1x16x1x16_8_1x2_intrawave_v1,72.96,399.36,0.0
64,104,7168,5120,ck,4,0,104.8764,a8w8_blockscale_1x128x128_256x16x256x128_8x16_16x16_1x4_16x16x1_8x32x1_1x16x1x16_8_1x2_intrawave_v1,72.79,369.23,0.0
64,112,7168,5120,ck,4,0,107.0064,a8w8_blockscale_1x128x128_256x16x256x128_8x16_16x16_1x4_16x16x1_8x32x1_1x16x1x16_8_1x2_intrawave_v1,76.83,363.34,0.0
64,120,7168,5120,ck,4,0,101.1914,a8w8_blockscale_1x128x128_256x16x256x128_8x16_16x16_1x4_16x16x1_8x32x1_1x16x1x16_8_1x2_intrawave_v1,87.04,385.75,0.0
64,128,7168,5120,ck,4,0,102.1472,a8w8_blockscale_1x128x128_256x16x256x128_8x16_16x16_1x4_16x16x1_8x32x1_1x16x1x16_8_1x2_intrawave_v1,91.98,383.67,0.0
64,136,7168,5120,ck,4,0,129.9391,a8w8_blockscale_1x128x128_256x16x256x128_8x16_16x16_1x4_16x16x1_8x32x1_1x16x1x16_8_1x2_intrawave_v1,76.82,302.8,0.0
64,144,7168,5120,ck,4,0,136.7413,a8w8_blockscale_1x128x128_256x16x256x128_8x16_16x16_1x4_16x16x1_8x32x1_1x16x1x16_8_1x2_intrawave_v1,77.3,288.88,0.0
64,152,7168,5120,ck,4,0,122.4671,a8w8_blockscale_1x128x128_256x16x256x128_8x16_16x16_1x4_16x16x1_8x32x1_1x16x1x16_8_1x2_intrawave_v1,91.1,323.82,0.0
64,160,7168,5120,ck,4,0,120.632,a8w8_blockscale_1x128x128_256x16x256x128_8x16_16x16_1x4_16x16x1_8x32x1_1x16x1x16_8_1x2_intrawave_v1,97.35,330.04,0.0
64,168,7168,5120,ck,4,0,130.7588,a8w8_blockscale_1x128x128_256x16x256x128_8x16_16x16_1x4_16x16x1_8x32x1_1x16x1x16_8_1x2_intrawave_v1,94.31,305.67,0.0
64,176,7168,5120,ck,5,0,129.5027,a8w8_blockscale_1x128x128_256x16x128x128_8x16_16x16_1x2_16x16x1_8x32x1_1x16x1x16_8_1x2_intrawave_v1,99.75,309.83,0.0
64,184,7168,5120,ck,5,0,175.1763,a8w8_blockscale_1x128x128_256x16x128x128_8x16_16x16_1x2_16x16x1_8x32x1_1x16x1x16_8_1x2_intrawave_v1,77.1,229.94,0.0
64,192,7168,5120,ck,5,0,178.8028,a8w8_blockscale_1x128x128_256x16x128x128_8x16_16x16_1x2_16x16x1_8x32x1_1x16x1x16_8_1x2_intrawave_v1,78.82,226.15,0.0
64,200,7168,5120,ck,4,0,150.387,a8w8_blockscale_1x128x128_256x16x256x128_8x16_16x16_1x4_16x16x1_8x32x1_1x16x1x16_8_1x2_intrawave_v1,97.62,269.91,0.0
64,208,7168,5120,ck,4,0,153.2228,a8w8_blockscale_1x128x128_256x16x256x128_8x16_16x16_1x4_16x16x1_8x32x1_1x16x1x16_8_1x2_intrawave_v1,99.64,265.93,0.0
64,216,7168,5120,ck,4,0,181.0379,a8w8_blockscale_1x128x128_256x16x256x128_8x16_16x16_1x4_16x16x1_8x32x1_1x16x1x16_8_1x2_intrawave_v1,87.58,225.93,0.0
64,224,7168,5120,ck,4,0,184.7581,a8w8_blockscale_1x128x128_256x16x256x128_8x16_16x16_1x4_16x16x1_8x32x1_1x16x1x16_8_1x2_intrawave_v1,88.99,222.23,0.0
64,232,7168,5120,ck,4,0,148.6517,a8w8_blockscale_1x128x128_256x16x256x128_8x16_16x16_1x4_16x16x1_8x32x1_1x16x1x16_8_1x2_intrawave_v1,114.56,277.25,0.0
64,240,7168,5120,ck,4,0,152.1646,a8w8_blockscale_1x128x128_256x16x256x128_8x16_16x16_1x4_16x16x1_8x32x1_1x16x1x16_8_1x2_intrawave_v1,115.77,271.87,0.0
64,248,7168,5120,ck,4,0,142.5502,a8w8_blockscale_1x128x128_256x16x256x128_8x16_16x16_1x4_16x16x1_8x32x1_1x16x1x16_8_1x2_intrawave_v1,127.7,291.3,0.0
64,256,7168,5120,ck,4,0,141.3901,a8w8_blockscale_1x128x128_256x16x256x128_8x16_16x16_1x4_16x16x1_8x32x1_1x16x1x16_8_1x2_intrawave_v1,132.9,294.79,0.0
64,264,7168,5120,ck,4,0,168.7103,a8w8_blockscale_1x128x128_256x16x256x128_8x16_16x16_1x4_16x16x1_8x32x1_1x16x1x16_8_1x2_intrawave_v1,114.86,247.98,0.0
64,272,7168,5120,ck,4,0,169.796,a8w8_blockscale_1x128x128_256x16x256x128_8x16_16x16_1x4_16x16x1_8x32x1_1x16x1x16_8_1x2_intrawave_v1,117.58,247.31,0.0
64,280,7168,5120,ck,4,0,221.1661,a8w8_blockscale_1x128x128_256x16x256x128_8x16_16x16_1x4_16x16x1_8x32x1_1x16x1x16_8_1x2_intrawave_v1,92.93,190.57,0.0
64,288,7168,5120,ck,4,0,222.421,a8w8_blockscale_1x128x128_256x16x256x128_8x16_16x16_1x4_16x16x1_8x32x1_1x16x1x16_8_1x2_intrawave_v1,95.04,190.2,0.0
64,296,7168,5120,ck,4,0,202.3839,a8w8_blockscale_1x128x128_256x16x256x128_8x16_16x16_1x4_16x16x1_8x32x1_1x16x1x16_8_1x2_intrawave_v1,107.35,209.8,0.0
64,304,7168,5120,ck,4,0,200.3786,a8w8_blockscale_1x128x128_256x16x256x128_8x16_16x16_1x4_16x16x1_8x32x1_1x16x1x16_8_1x2_intrawave_v1,111.36,212.67,0.0
64,312,7168,5120,ck,4,0,245.0979,a8w8_blockscale_1x128x128_256x16x256x128_8x16_16x16_1x4_16x16x1_8x32x1_1x16x1x16_8_1x2_intrawave_v1,93.44,174.5,0.0
64,320,7168,5120,ck,4,0,247.9154,a8w8_blockscale_1x128x128_256x16x256x128_8x16_16x16_1x4_16x16x1_8x32x1_1x16x1x16_8_1x2_intrawave_v1,94.74,173.15,0.0
64,328,7168,5120,ck,4,0,202.1131,a8w8_blockscale_1x128x128_256x16x256x128_8x16_16x16_1x4_16x16x1_8x32x1_1x16x1x16_8_1x2_intrawave_v1,119.12,213.16,0.0
64,336,7168,5120,ck,4,0,203.4273,a8w8_blockscale_1x128x128_256x16x256x128_8x16_16x16_1x4_16x16x1_8x32x1_1x16x1x16_8_1x2_intrawave_v1,121.23,212.54,0.0
64,344,7168,5120,ck,4,0,220.0581,a8w8_blockscale_1x128x128_256x16x256x128_8x16_16x16_1x4_16x16x1_8x32x1_1x16x1x16_8_1x2_intrawave_v1,114.74,197.19,0.0
64,352,7168,5120,ck,4,0,220.407,a8w8_blockscale_1x128x128_256x16x256x128_8x16_16x16_1x4_16x16x1_8x32x1_1x16x1x16_8_1x2_intrawave_v1,117.22,197.58,0.0
64,360,7168,5120,ck,4,0,261.3669,a8w8_blockscale_1x128x128_256x16x256x128_8x16_16x16_1x4_16x16x1_8x32x1_1x16x1x16_8_1x2_intrawave_v1,101.1,167.21,0.0
64,368,7168,5120,ck,4,0,262.4339,a8w8_blockscale_1x128x128_256x16x256x128_8x16_16x16_1x4_16x16x1_8x32x1_1x16x1x16_8_1x2_intrawave_v1,102.93,167.13,0.0
64,376,7168,5120,ck,4,0,232.2583,a8w8_blockscale_1x128x128_256x16x256x128_8x16_16x16_1x4_16x16x1_8x32x1_1x16x1x16_8_1x2_intrawave_v1,118.83,189.51,0.0
64,384,7168,5120,ck,4,0,229.2603,a8w8_blockscale_1x128x128_256x16x256x128_8x16_16x16_1x4_16x16x1_8x32x1_1x16x1x16_8_1x2_intrawave_v1,122.94,192.67,0.0
64,392,7168,5120,ck,4,0,269.0352,a8w8_blockscale_1x128x128_256x16x256x128_8x16_16x16_1x4_16x16x1_8x32x1_1x16x1x16_8_1x2_intrawave_v1,106.95,164.76,0.0
64,400,7168,5120,ck,4,0,268.942,a8w8_blockscale_1x128x128_256x16x256x128_8x16_16x16_1x4_16x16x1_8x32x1_1x16x1x16_8_1x2_intrawave_v1,109.17,165.4,0.0
64,408,7168,5120,ck,4,0,274.7943,a8w8_blockscale_1x128x128_256x16x256x128_8x16_16x16_1x4_16x16x1_8x32x1_1x16x1x16_8_1x2_intrawave_v1,108.98,162.44,0.0
64,416,7168,5120,ck,4,0,274.4765,a8w8_blockscale_1x128x128_256x16x256x128_8x16_16x16_1x4_16x16x1_8x32x1_1x16x1x16_8_1x2_intrawave_v1,111.25,163.2,0.0
64,424,7168,5120,ck,4,0,299.0424,a8w8_blockscale_1x128x128_256x16x256x128_8x16_16x16_1x4_16x16x1_8x32x1_1x16x1x16_8_1x2_intrawave_v1,104.07,150.31,0.0
64,432,7168,5120,ck,4,0,292.9403,a8w8_blockscale_1x128x128_256x16x256x128_8x16_16x16_1x4_16x16x1_8x32x1_1x16x1x16_8_1x2_intrawave_v1,108.24,153.97,0.0
64,440,7168,5120,ck,4,0,324.6209,a8w8_blockscale_1x128x128_256x16x256x128_8x16_16x16_1x4_16x16x1_8x32x1_1x16x1x16_8_1x2_intrawave_v1,99.49,139.43,0.0
64,448,7168,5120,ck,4,0,326.2797,a8w8_blockscale_1x128x128_256x16x256x128_8x16_16x16_1x4_16x16x1_8x32x1_1x16x1x16_8_1x2_intrawave_v1,100.78,139.19,0.0
64,456,7168,5120,ck,4,0,294.9812,a8w8_blockscale_1x128x128_256x16x256x128_8x16_16x16_1x4_16x16x1_8x32x1_1x16x1x16_8_1x2_intrawave_v1,113.47,154.49,0.0
64,464,7168,5120,ck,4,0,292.9574,a8w8_blockscale_1x128x128_256x16x256x128_8x16_16x16_1x4_16x16x1_8x32x1_1x16x1x16_8_1x2_intrawave_v1,116.25,156.09,0.0
64,472,7168,5120,ck,4,0,280.3803,a8w8_blockscale_1x128x128_256x16x256x128_8x16_16x16_1x4_16x16x1_8x32x1_1x16x1x16_8_1x2_intrawave_v1,123.56,163.65,0.0
64,480,7168,5120,ck,4,0,276.2382,a8w8_blockscale_1x128x128_256x16x256x128_8x16_16x16_1x4_16x16x1_8x32x1_1x16x1x16_8_1x2_intrawave_v1,127.54,166.66,0.0
64,488,7168,5120,ck,4,0,275.4432,a8w8_blockscale_1x128x128_256x16x256x128_8x16_16x16_1x4_16x16x1_8x32x1_1x16x1x16_8_1x2_intrawave_v1,130.04,167.71,0.0
64,496,7168,5120,ck,4,0,277.1214,a8w8_blockscale_1x128x128_256x16x256x128_8x16_16x16_1x4_16x16x1_8x32x1_1x16x1x16_8_1x2_intrawave_v1,131.37,167.26,0.0
64,504,7168,5120,ck,4,0,271.4847,a8w8_blockscale_1x128x128_256x16x256x128_8x16_16x16_1x4_16x16x1_8x32x1_1x16x1x16_8_1x2_intrawave_v1,136.26,171.3,0.0
64,512,7168,5120,ck,4,0,277.2898,a8w8_blockscale_1x128x128_256x16x256x128_8x16_16x16_1x4_16x16x1_8x32x1_1x16x1x16_8_1x2_intrawave_v1,135.53,168.28,0.0
64,1024,7168,5120,ck,4,0,537.9461,a8w8_blockscale_1x128x128_256x16x256x128_8x16_16x16_1x4_16x16x1_8x32x1_1x16x1x16_8_1x2_intrawave_v1,139.72,105.26,0.0
64,2048,7168,5120,ck,4,0,1066.3435,a8w8_blockscale_1x128x128_256x16x256x128_8x16_16x16_1x4_16x16x1_8x32x1_1x16x1x16_8_1x2_intrawave_v1,140.97,71.78,0.0
64,4096,7168,5120,ck,4,0,2102.2687,a8w8_blockscale_1x128x128_256x16x256x128_8x16_16x16_1x4_16x16x1_8x32x1_1x16x1x16_8_1x2_intrawave_v1,143.01,55.36,0.0
64,8192,7168,5120,ck,4,0,4269.2965,a8w8_blockscale_1x128x128_256x16x256x128_8x16_16x16_1x4_16x16x1_8x32x1_1x16x1x16_8_1x2_intrawave_v1,140.84,45.93,0.0
64,16384,7168,5120,ck,4,0,8458.2401,a8w8_blockscale_1x128x128_256x16x256x128_8x16_16x16_1x4_16x16x1_8x32x1_1x16x1x16_8_1x2_intrawave_v1,142.18,42.03,0.0
64,20480,7168,5120,ck,4,0,10720.9979,a8w8_blockscale_1x128x128_256x16x256x128_8x16_16x16_1x4_16x16x1_8x32x1_1x16x1x16_8_1x2_intrawave_v1,140.21,40.59,0.0
64,1,8192,5120,ck,7,0,76.6738,a8w8_blockscale_1x128x128_256x16x128x256_16x16_16x16_1x2_16x16x1_16x16x1_1x16x1x16_8_1x2_intrawave_v1,1.09,547.31,0.0
64,2,8192,5120,ck,7,0,77.3314,a8w8_blockscale_1x128x128_256x16x128x256_16x16_16x16_1x2_16x16x1_16x16x1_1x16x1x16_8_1x2_intrawave_v1,2.17,542.94,0.0
64,4,8192,5120,ck,7,0,78.0258,a8w8_blockscale_1x128x128_256x16x128x256_16x16_16x16_1x2_16x16x1_16x16x1_1x16x1x16_8_1x2_intrawave_v1,4.3,538.66,0.0
64,8,8192,5120,ck,7,0,78.7914,a8w8_blockscale_1x128x128_256x16x128x256_16x16_16x16_1x2_16x16x1_16x16x1_1x16x1x16_8_1x2_intrawave_v1,8.52,534.51,0.0
64,16,8192,5120,ck,7,0,79.6993,a8w8_blockscale_1x128x128_256x16x128x256_16x16_16x16_1x2_16x16x1_16x16x1_1x16x1x16_8_1x2_intrawave_v1,16.84,530.58,0.0
64,24,8192,5120,ck,7,0,85.7176,a8w8_blockscale_1x128x128_256x16x128x256_16x16_16x16_1x2_16x16x1_16x16x1_1x16x1x16_8_1x2_intrawave_v1,23.49,495.34,0.0
64,32,8192,5120,ck,7,0,86.2539,a8w8_blockscale_1x128x128_256x16x128x256_16x16_16x16_1x2_16x16x1_16x16x1_1x16x1x16_8_1x2_intrawave_v1,31.12,494.25,0.0
64,40,8192,5120,ck,7,0,78.8229,a8w8_blockscale_1x128x128_256x16x128x256_16x16_16x16_1x2_16x16x1_16x16x1_1x16x1x16_8_1x2_intrawave_v1,42.57,543.03,0.0
64,48,8192,5120,ck,7,0,79.0824,a8w8_blockscale_1x128x128_256x16x128x256_16x16_16x16_1x2_16x16x1_16x16x1_1x16x1x16_8_1x2_intrawave_v1,50.92,543.42,0.0
64,56,8192,5120,ck,7,0,95.1865,a8w8_blockscale_1x128x128_256x16x128x256_16x16_16x16_1x2_16x16x1_16x16x1_1x16x1x16_8_1x2_intrawave_v1,49.35,453.29,0.0
64,64,8192,5120,ck,7,0,96.0011,a8w8_blockscale_1x128x128_256x16x128x256_16x16_16x16_1x2_16x16x1_16x16x1_1x16x1x16_8_1x2_intrawave_v1,55.92,451.24,0.0
64,72,8192,5120,ck,4,0,103.9705,a8w8_blockscale_1x128x128_256x16x256x128_8x16_16x16_1x4_16x16x1_8x32x1_1x16x1x16_8_1x2_intrawave_v1,58.09,418.3,0.0
64,80,8192,5120,ck,4,0,104.4642,a8w8_blockscale_1x128x128_256x16x256x128_8x16_16x16_1x4_16x16x1_8x32x1_1x16x1x16_8_1x2_intrawave_v1,64.24,417.97,0.0
64,88,8192,5120,ck,4,0,101.3989,a8w8_blockscale_1x128x128_256x16x256x128_8x16_16x16_1x4_16x16x1_8x32x1_1x16x1x16_8_1x2_intrawave_v1,72.8,432.31,0.0
64,96,8192,5120,ck,4,0,102.0517,a8w8_blockscale_1x128x128_256x16x256x128_8x16_16x16_1x4_16x16x1_8x32x1_1x16x1x16_8_1x2_intrawave_v1,78.91,431.23,0.0
64,104,8192,5120,ck,4,0,114.5421,a8w8_blockscale_1x128x128_256x16x256x128_8x16_16x16_1x4_16x16x1_8x32x1_1x16x1x16_8_1x2_intrawave_v1,76.17,385.7,0.0
64,112,8192,5120,ck,4,0,116.4693,a8w8_blockscale_1x128x128_256x16x256x128_8x16_16x16_1x4_16x16x1_8x32x1_1x16x1x16_8_1x2_intrawave_v1,80.67,380.8,0.0
64,120,8192,5120,ck,4,0,107.3381,a8w8_blockscale_1x128x128_256x16x256x128_8x16_16x16_1x4_16x16x1_8x32x1_1x16x1x16_8_1x2_intrawave_v1,93.78,414.8,0.0
64,128,8192,5120,ck,4,0,109.1852,a8w8_blockscale_1x128x128_256x16x256x128_8x16_16x16_1x4_16x16x1_8x32x1_1x16x1x16_8_1x2_intrawave_v1,98.34,409.36,0.0
64,136,8192,5120,ck,4,0,146.5093,a8w8_blockscale_1x128x128_256x16x256x128_8x16_16x16_1x4_16x16x1_8x32x1_1x16x1x16_8_1x2_intrawave_v1,77.87,306.24,0.0
64,144,8192,5120,ck,4,0,148.0828,a8w8_blockscale_1x128x128_256x16x256x128_8x16_16x16_1x4_16x16x1_8x32x1_1x16x1x16_8_1x2_intrawave_v1,81.57,304.15,0.0
64,152,8192,5120,ck,4,0,134.235,a8w8_blockscale_1x128x128_256x16x256x128_8x16_16x16_1x4_16x16x1_8x32x1_1x16x1x16_8_1x2_intrawave_v1,94.99,336.81,0.0
64,160,8192,5120,ck,4,0,134.6065,a8w8_blockscale_1x128x128_256x16x256x128_8x16_16x16_1x4_16x16x1_8x32x1_1x16x1x16_8_1x2_intrawave_v1,99.71,337.16,0.0
64,168,8192,5120,ck,4,0,139.8929,a8w8_blockscale_1x128x128_256x16x256x128_8x16_16x16_1x4_16x16x1_8x32x1_1x16x1x16_8_1x2_intrawave_v1,100.74,325.65,0.0
64,176,8192,5120,ck,4,0,140.0007,a8w8_blockscale_1x128x128_256x16x256x128_8x16_16x16_1x4_16x16x1_8x32x1_1x16x1x16_8_1x2_intrawave_v1,105.46,326.63,0.0
64,184,8192,5120,ck,4,0,183.021,a8w8_blockscale_1x128x128_256x16x256x128_8x16_16x16_1x4_16x16x1_8x32x1_1x16x1x16_8_1x2_intrawave_v1,84.33,250.79,0.0
64,192,8192,5120,ck,4,0,184.5597,a8w8_blockscale_1x128x128_256x16x256x128_8x16_16x16_1x4_16x16x1_8x32x1_1x16x1x16_8_1x2_intrawave_v1,87.27,249.63,0.0
64,200,8192,5120,ck,4,0,170.5095,a8w8_blockscale_1x128x128_256x16x256x128_8x16_16x16_1x4_16x16x1_8x32x1_1x16x1x16_8_1x2_intrawave_v1,98.39,271.21,0.0
64,208,8192,5120,ck,4,0,171.1904,a8w8_blockscale_1x128x128_256x16x256x128_8x16_16x16_1x4_16x16x1_8x32x1_1x16x1x16_8_1x2_intrawave_v1,101.92,271.14,0.0
64,216,8192,5120,ck,4,0,193.7095,a8w8_blockscale_1x128x128_256x16x256x128_8x16_16x16_1x4_16x16x1_8x32x1_1x16x1x16_8_1x2_intrawave_v1,93.54,240.5,0.0
64,224,8192,5120,ck,4,0,200.9746,a8w8_blockscale_1x128x128_256x16x256x128_8x16_16x16_1x4_16x16x1_8x32x1_1x16x1x16_8_1x2_intrawave_v1,93.5,232.67,0.0
64,232,8192,5120,ck,4,0,164.5046,a8w8_blockscale_1x128x128_256x16x256x128_8x16_16x16_1x4_16x16x1_8x32x1_1x16x1x16_8_1x2_intrawave_v1,118.3,285.29,0.0
64,240,8192,5120,ck,4,0,164.1554,a8w8_blockscale_1x128x128_256x16x256x128_8x16_16x16_1x4_16x16x1_8x32x1_1x16x1x16_8_1x2_intrawave_v1,122.64,286.95,0.0
64,248,8192,5120,ck,4,0,167.7187,a8w8_blockscale_1x128x128_256x16x256x128_8x16_16x16_1x4_16x16x1_8x32x1_1x16x1x16_8_1x2_intrawave_v1,124.04,281.88,0.0
64,256,8192,5120,ck,4,0,168.7507,a8w8_blockscale_1x128x128_256x16x256x128_8x16_16x16_1x4_16x16x1_8x32x1_1x16x1x16_8_1x2_intrawave_v1,127.26,281.17,0.0
64,264,8192,5120,ck,4,0,192.8451,a8w8_blockscale_1x128x128_256x16x256x128_8x16_16x16_1x4_16x16x1_8x32x1_1x16x1x16_8_1x2_intrawave_v1,114.84,246.93,0.0
64,272,8192,5120,ck,4,0,190.4972,a8w8_blockscale_1x128x128_256x16x256x128_8x16_16x16_1x4_16x16x1_8x32x1_1x16x1x16_8_1x2_intrawave_v1,119.78,250.88,0.0
64,280,8192,5120,ck,4,0,237.1027,a8w8_blockscale_1x128x128_256x16x256x128_8x16_16x16_1x4_16x16x1_8x32x1_1x16x1x16_8_1x2_intrawave_v1,99.06,202.29,0.0
64,288,8192,5120,ck,4,0,235.8966,a8w8_blockscale_1x128x128_256x16x256x128_8x16_16x16_1x4_16x16x1_8x32x1_1x16x1x16_8_1x2_intrawave_v1,102.41,204.06,0.0
64,296,8192,5120,ck,4,0,224.2165,a8w8_blockscale_1x128x128_256x16x256x128_8x16_16x16_1x4_16x16x1_8x32x1_1x16x1x16_8_1x2_intrawave_v1,110.74,215.45,0.0
64,304,8192,5120,ck,4,0,228.9283,a8w8_blockscale_1x128x128_256x16x256x128_8x16_16x16_1x4_16x16x1_8x32x1_1x16x1x16_8_1x2_intrawave_v1,111.39,211.77,0.0
64,312,8192,5120,ck,4,0,255.9937,a8w8_blockscale_1x128x128_256x16x256x128_8x16_16x16_1x4_16x16x1_8x32x1_1x16x1x16_8_1x2_intrawave_v1,102.24,190.05,0.0
64,320,8192,5120,ck,4,0,259.27,a8w8_blockscale_1x128x128_256x16x256x128_8x16_16x16_1x4_16x16x1_8x32x1_1x16x1x16_8_1x2_intrawave_v1,103.54,188.31,0.0
64,328,8192,5120,ck,4,0,219.3642,a8w8_blockscale_1x128x128_256x16x256x128_8x16_16x16_1x4_16x16x1_8x32x1_1x16x1x16_8_1x2_intrawave_v1,125.43,223.36,0.0
64,336,8192,5120,ck,4,0,219.2196,a8w8_blockscale_1x128x128_256x16x256x128_8x16_16x16_1x4_16x16x1_8x32x1_1x16x1x16_8_1x2_intrawave_v1,128.57,224.29,0.0
64,344,8192,5120,ck,4,0,244.0908,a8w8_blockscale_1x128x128_256x16x256x128_8x16_16x16_1x4_16x16x1_8x32x1_1x16x1x16_8_1x2_intrawave_v1,118.22,202.14,0.0
64,352,8192,5120,ck,4,0,245.4089,a8w8_blockscale_1x128x128_256x16x256x128_8x16_16x16_1x4_16x16x1_8x32x1_1x16x1x16_8_1x2_intrawave_v1,120.32,201.75,0.0
64,360,8192,5120,ck,4,0,280.6081,a8w8_blockscale_1x128x128_256x16x256x128_8x16_16x16_1x4_16x16x1_8x32x1_1x16x1x16_8_1x2_intrawave_v1,107.62,177.06,0.0
64,368,8192,5120,ck,4,0,283.8888,a8w8_blockscale_1x128x128_256x16x256x128_8x16_16x16_1x4_16x16x1_8x32x1_1x16x1x16_8_1x2_intrawave_v1,108.74,175.62,0.0
64,376,8192,5120,ck,4,0,257.9842,a8w8_blockscale_1x128x128_256x16x256x128_8x16_16x16_1x4_16x16x1_8x32x1_1x16x1x16_8_1x2_intrawave_v1,122.26,193.92,0.0
64,384,8192,5120,ck,4,0,255.9412,a8w8_blockscale_1x128x128_256x16x256x128_8x16_16x16_1x4_16x16x1_8x32x1_1x16x1x16_8_1x2_intrawave_v1,125.86,196.14,0.0
64,392,8192,5120,ck,4,0,307.1995,a8w8_blockscale_1x128x128_256x16x256x128_8x16_16x16_1x4_16x16x1_8x32x1_1x16x1x16_8_1x2_intrawave_v1,107.04,163.97,0.0
64,400,8192,5120,ck,4,0,310.0359,a8w8_blockscale_1x128x128_256x16x256x128_8x16_16x16_1x4_16x16x1_8x32x1_1x16x1x16_8_1x2_intrawave_v1,108.23,163.03,0.0
64,408,8192,5120,ck,4,0,294.0402,a8w8_blockscale_1x128x128_256x16x256x128_8x16_16x16_1x4_16x16x1_8x32x1_1x16x1x16_8_1x2_intrawave_v1,116.4,172.48,0.0
64,416,8192,5120,ck,4,0,301.2059,a8w8_blockscale_1x128x128_256x16x256x128_8x16_16x16_1x4_16x16x1_8x32x1_1x16x1x16_8_1x2_intrawave_v1,115.86,168.95,0.0
64,424,8192,5120,ck,4,0,311.0252,a8w8_blockscale_1x128x128_256x16x256x128_8x16_16x16_1x4_16x16x1_8x32x1_1x16x1x16_8_1x2_intrawave_v1,114.36,164.17,0.0
64,432,8192,5120,ck,4,0,313.1823,a8w8_blockscale_1x128x128_256x16x256x128_8x16_16x16_1x4_16x16x1_8x32x1_1x16x1x16_8_1x2_intrawave_v1,115.71,163.59,0.0
64,440,8192,5120,ck,4,0,330.955,a8w8_blockscale_1x128x128_256x16x256x128_8x16_16x16_1x4_16x16x1_8x32x1_1x16x1x16_8_1x2_intrawave_v1,111.53,155.32,0.0
64,448,8192,5120,ck,4,0,330.5297,a8w8_blockscale_1x128x128_256x16x256x128_8x16_16x16_1x4_16x16x1_8x32x1_1x16x1x16_8_1x2_intrawave_v1,113.7,156.04,0.0
64,456,8192,5120,ck,4,0,342.4588,a8w8_blockscale_1x128x128_256x16x256x128_8x16_16x16_1x4_16x16x1_8x32x1_1x16x1x16_8_1x2_intrawave_v1,111.7,151.11,0.0
64,464,8192,5120,ck,4,0,347.2986,a8w8_blockscale_1x128x128_256x16x256x128_8x16_16x16_1x4_16x16x1_8x32x1_1x16x1x16_8_1x2_intrawave_v1,112.07,149.5,0.0
64,472,8192,5120,ck,4,0,315.0676,a8w8_blockscale_1x128x128_256x16x256x128_8x16_16x16_1x4_16x16x1_8x32x1_1x16x1x16_8_1x2_intrawave_v1,125.67,165.34,0.0
64,480,8192,5120,ck,4,0,311.5867,a8w8_blockscale_1x128x128_256x16x256x128_8x16_16x16_1x4_16x16x1_8x32x1_1x16x1x16_8_1x2_intrawave_v1,129.23,167.74,0.0
64,488,8192,5120,ck,4,0,309.1985,a8w8_blockscale_1x128x128_256x16x256x128_8x16_16x16_1x4_16x16x1_8x32x1_1x16x1x16_8_1x2_intrawave_v1,132.4,169.59,0.0
64,496,8192,5120,ck,4,0,305.9953,a8w8_blockscale_1x128x128_256x16x256x128_8x16_16x16_1x4_16x16x1_8x32x1_1x16x1x16_8_1x2_intrawave_v1,135.97,171.93,0.0
64,504,8192,5120,ck,4,0,306.7255,a8w8_blockscale_1x128x128_256x16x256x128_8x16_16x16_1x4_16x16x1_8x32x1_1x16x1x16_8_1x2_intrawave_v1,137.84,172.08,0.0
64,512,8192,5120,ck,4,0,313.9396,a8w8_blockscale_1x128x128_256x16x256x128_8x16_16x16_1x4_16x16x1_8x32x1_1x16x1x16_8_1x2_intrawave_v1,136.81,168.67,0.0
64,1024,8192,5120,ck,4,0,617.2382,a8w8_blockscale_1x128x128_256x16x256x128_8x16_16x16_1x4_16x16x1_8x32x1_1x16x1x16_8_1x2_intrawave_v1,139.17,103.63,0.0
64,2048,8192,5120,ck,4,0,1185.2902,a8w8_blockscale_1x128x128_256x16x256x128_8x16_16x16_1x4_16x16x1_8x32x1_1x16x1x16_8_1x2_intrawave_v1,144.94,72.54,0.0
64,4096,8192,5120,ck,4,0,2384.1821,a8w8_blockscale_1x128x128_256x16x256x128_8x16_16x16_1x4_16x16x1_8x32x1_1x16x1x16_8_1x2_intrawave_v1,144.12,54.54,0.0
64,8192,8192,5120,ck,4,0,4832.5317,a8w8_blockscale_1x128x128_256x16x256x128_8x16_16x16_1x4_16x16x1_8x32x1_1x16x1x16_8_1x2_intrawave_v1,142.2,45.13,0.0
64,16384,8192,5120,ck,4,0,9644.5615,a8w8_blockscale_1x128x128_256x16x256x128_8x16_16x16_1x4_16x16x1_8x32x1_1x16x1x16_8_1x2_intrawave_v1,142.5,40.88,0.0
64,20480,8192,5120,ck,4,0,12131.3009,a8w8_blockscale_1x128x128_256x16x256x128_8x16_16x16_1x4_16x16x1_8x32x1_1x16x1x16_8_1x2_intrawave_v1,141.62,39.76,0.0
64,1,17408,5120,ck,7,0,160.3868,a8w8_blockscale_1x128x128_256x16x128x256_16x16_16x16_1x2_16x16x1_16x16x1_1x16x1x16_8_1x2_intrawave_v1,1.11,555.96,0.0
64,2,17408,5120,ck,7,0,160.3319,a8w8_blockscale_1x128x128_256x16x128x256_16x16_16x16_1x2_16x16x1_16x16x1_1x16x1x16_8_1x2_intrawave_v1,2.22,556.4,0.0
64,4,17408,5120,ck,7,0,161.3785,a8w8_blockscale_1x128x128_256x16x128x256_16x16_16x16_1x2_16x16x1_16x16x1_1x16x1x16_8_1x2_intrawave_v1,4.42,553.29,0.0
64,8,17408,5120,ck,7,0,162.6844,a8w8_blockscale_1x128x128_256x16x128x256_16x16_16x16_1x2_16x16x1_16x16x1_1x16x1x16_8_1x2_intrawave_v1,8.77,549.83,0.0
64,16,17408,5120,ck,7,0,164.8444,a8w8_blockscale_1x128x128_256x16x128x256_16x16_16x16_1x2_16x16x1_16x16x1_1x16x1x16_8_1x2_intrawave_v1,17.3,544.56,0.0
64,24,17408,5120,ck,7,0,156.6888,a8w8_blockscale_1x128x128_256x16x128x256_16x16_16x16_1x2_16x16x1_16x16x1_1x16x1x16_8_1x2_intrawave_v1,27.3,574.94,0.0
64,32,17408,5120,ck,7,0,158.1821,a8w8_blockscale_1x128x128_256x16x128x256_16x16_16x16_1x2_16x16x1_16x16x1_1x16x1x16_8_1x2_intrawave_v1,36.06,571.54,0.0
64,40,17408,5120,ck,7,0,164.1216,a8w8_blockscale_1x128x128_256x16x128x256_16x16_16x16_1x2_16x16x1_16x16x1_1x16x1x16_8_1x2_intrawave_v1,43.45,552.8,0.0
64,48,17408,5120,ck,7,0,165.0289,a8w8_blockscale_1x128x128_256x16x128x256_16x16_16x16_1x2_16x16x1_16x16x1_1x16x1x16_8_1x2_intrawave_v1,51.85,551.7,0.0
64,56,17408,5120,ck,7,0,176.2058,a8w8_blockscale_1x128x128_256x16x128x256_16x16_16x16_1x2_16x16x1_16x16x1_1x16x1x16_8_1x2_intrawave_v1,56.65,518.52,0.0
64,64,17408,5120,ck,7,0,177.4502,a8w8_blockscale_1x128x128_256x16x128x256_16x16_16x16_1x2_16x16x1_16x16x1_1x16x1x16_8_1x2_intrawave_v1,64.29,516.68,0.0
64,72,17408,5120,ck,5,0,233.7382,a8w8_blockscale_1x128x128_256x16x128x128_8x16_16x16_1x2_16x16x1_8x32x1_1x16x1x16_8_1x2_intrawave_v1,54.91,393.62,0.0
64,80,17408,5120,ck,7,0,234.9918,a8w8_blockscale_1x128x128_256x16x128x256_16x16_16x16_1x2_16x16x1_16x16x1_1x16x1x16_8_1x2_intrawave_v1,60.69,392.88,0.0
64,88,17408,5120,ck,4,0,247.4265,a8w8_blockscale_1x128x128_256x16x256x128_8x16_16x16_1x4_16x16x1_8x32x1_1x16x1x16_8_1x2_intrawave_v1,63.4,374.43,0.0
64,96,17408,5120,ck,4,0,248.3971,a8w8_blockscale_1x128x128_256x16x256x128_8x16_16x16_1x4_16x16x1_8x32x1_1x16x1x16_8_1x2_intrawave_v1,68.89,374.25,0.0
64,104,17408,5120,ck,4,0,246.0865,a8w8_blockscale_1x128x128_256x16x256x128_8x16_16x16_1x4_16x16x1_8x32x1_1x16x1x16_8_1x2_intrawave_v1,75.33,379.06,0.0
64,112,17408,5120,ck,4,0,247.5756,a8w8_blockscale_1x128x128_256x16x256x128_8x16_16x16_1x4_16x16x1_8x32x1_1x16x1x16_8_1x2_intrawave_v1,80.64,378.07,0.0
64,120,17408,5120,ck,4,0,199.2878,a8w8_blockscale_1x128x128_256x16x256x128_8x16_16x16_1x4_16x16x1_8x32x1_1x16x1x16_8_1x2_intrawave_v1,107.34,471.28,0.0
64,128,17408,5120,ck,4,0,200.7226,a8w8_blockscale_1x128x128_256x16x256x128_8x16_16x16_1x4_16x16x1_8x32x1_1x16x1x16_8_1x2_intrawave_v1,113.67,469.51,0.0
64,136,17408,5120,ck,4,0,333.7152,a8w8_blockscale_1x128x128_256x16x256x128_8x16_16x16_1x4_16x16x1_8x32x1_1x16x1x16_8_1x2_intrawave_v1,72.65,283.36,0.0
64,144,17408,5120,ck,4,0,337.1046,a8w8_blockscale_1x128x128_256x16x256x128_8x16_16x16_1x4_16x16x1_8x32x1_1x16x1x16_8_1x2_intrawave_v1,76.15,281.45,0.0
64,152,17408,5120,ck,4,0,298.8233,a8w8_blockscale_1x128x128_256x16x256x128_8x16_16x16_1x4_16x16x1_8x32x1_1x16x1x16_8_1x2_intrawave_v1,90.67,318.58,0.0
64,160,17408,5120,ck,4,0,299.8362,a8w8_blockscale_1x128x128_256x16x256x128_8x16_16x16_1x4_16x16x1_8x32x1_1x16x1x16_8_1x2_intrawave_v1,95.12,318.57,0.0
64,168,17408,5120,ck,4,0,303.5292,a8w8_blockscale_1x128x128_256x16x256x128_8x16_16x16_1x4_16x16x1_8x32x1_1x16x1x16_8_1x2_intrawave_v1,98.66,315.75,0.0
64,176,17408,5120,ck,5,0,304.8058,a8w8_blockscale_1x128x128_256x16x128x128_8x16_16x16_1x2_16x16x1_8x32x1_1x16x1x16_8_1x2_intrawave_v1,102.93,315.47,0.0
64,184,17408,5120,ck,4,0,461.0282,a8w8_blockscale_1x128x128_256x16x256x128_8x16_16x16_1x4_16x16x1_8x32x1_1x16x1x16_8_1x2_intrawave_v1,71.14,209.27,0.0
64,192,17408,5120,ck,4,0,463.7121,a8w8_blockscale_1x128x128_256x16x256x128_8x16_16x16_1x4_16x16x1_8x32x1_1x16x1x16_8_1x2_intrawave_v1,73.81,208.74,0.0
64,200,17408,5120,ck,5,0,384.1631,a8w8_blockscale_1x128x128_256x16x128x128_8x16_16x16_1x2_16x16x1_8x32x1_1x16x1x16_8_1x2_intrawave_v1,92.8,252.8,0.0
64,208,17408,5120,ck,5,0,388.856,a8w8_blockscale_1x128x128_256x16x128x128_8x16_16x16_1x2_16x16x1_8x32x1_1x16x1x16_8_1x2_intrawave_v1,95.35,250.57,0.0
64,216,17408,5120,ck,5,0,483.3415,a8w8_blockscale_1x128x128_256x16x128x128_8x16_16x16_1x2_16x16x1_8x32x1_1x16x1x16_8_1x2_intrawave_v1,79.66,202.25,0.0
64,224,17408,5120,ck,5,0,491.4845,a8w8_blockscale_1x128x128_256x16x128x128_8x16_16x16_1x2_16x16x1_8x32x1_1x16x1x16_8_1x2_intrawave_v1,81.24,199.55,0.0
64,232,17408,5120,ck,4,0,357.6991,a8w8_blockscale_1x128x128_256x16x256x128_8x16_16x16_1x4_16x16x1_8x32x1_1x16x1x16_8_1x2_intrawave_v1,115.62,275.08,0.0
64,240,17408,5120,ck,4,0,353.7584,a8w8_blockscale_1x128x128_256x16x256x128_8x16_16x16_1x4_16x16x1_8x32x1_1x16x1x16_8_1x2_intrawave_v1,120.94,279.04,0.0
64,248,17408,5120,ck,4,0,339.9477,a8w8_blockscale_1x128x128_256x16x256x128_8x16_16x16_1x4_16x16x1_8x32x1_1x16x1x16_8_1x2_intrawave_v1,130.04,291.32,0.0
64,256,17408,5120,ck,4,0,341.6366,a8w8_blockscale_1x128x128_256x16x256x128_8x16_16x16_1x4_16x16x1_8x32x1_1x16x1x16_8_1x2_intrawave_v1,133.57,290.81,0.0
64,264,17408,5120,ck,4,0,454.4213,a8w8_blockscale_1x128x128_256x16x256x128_8x16_16x16_1x4_16x16x1_8x32x1_1x16x1x16_8_1x2_intrawave_v1,103.56,219.34,0.0
64,272,17408,5120,ck,4,0,455.4351,a8w8_blockscale_1x128x128_256x16x256x128_8x16_16x16_1x4_16x16x1_8x32x1_1x16x1x16_8_1x2_intrawave_v1,106.46,219.55,0.0
64,280,17408,5120,ck,5,0,581.5285,a8w8_blockscale_1x128x128_256x16x128x128_8x16_16x16_1x2_16x16x1_8x32x1_1x16x1x16_8_1x2_intrawave_v1,85.83,172.5,0.0
64,288,17408,5120,ck,5,0,594.3946,a8w8_blockscale_1x128x128_256x16x128x128_8x16_16x16_1x2_16x16x1_8x32x1_1x16x1x16_8_1x2_intrawave_v1,86.37,169.3,0.0
64,296,17408,5120,ck,5,0,527.8183,a8w8_blockscale_1x128x128_256x16x128x128_8x16_16x16_1x2_16x16x1_8x32x1_1x16x1x16_8_1x2_intrawave_v1,99.97,191.26,0.0
64,304,17408,5120,ck,5,0,531.2639,a8w8_blockscale_1x128x128_256x16x128x128_8x16_16x16_1x2_16x16x1_8x32x1_1x16x1x16_8_1x2_intrawave_v1,102.0,190.62,0.0
64,312,17408,5120,ck,4,0,729.4028,a8w8_blockscale_1x128x128_256x16x256x128_8x16_16x16_1x4_16x16x1_8x32x1_1x16x1x16_8_1x2_intrawave_v1,76.25,139.28,0.0
64,320,17408,5120,ck,4,0,744.9058,a8w8_blockscale_1x128x128_256x16x256x128_8x16_16x16_1x4_16x16x1_8x32x1_1x16x1x16_8_1x2_intrawave_v1,76.58,136.81,0.0
64,328,17408,5120,ck,4,0,535.0255,a8w8_blockscale_1x128x128_256x16x256x128_8x16_16x16_1x4_16x16x1_8x32x1_1x16x1x16_8_1x2_intrawave_v1,109.28,191.07,0.0
64,336,17408,5120,ck,4,0,527.0793,a8w8_blockscale_1x128x128_256x16x256x128_8x16_16x16_1x4_16x16x1_8x32x1_1x16x1x16_8_1x2_intrawave_v1,113.64,194.56,0.0
64,344,17408,5120,ck,5,0,592.0397,a8w8_blockscale_1x128x128_256x16x128x128_8x16_16x16_1x2_16x16x1_8x32x1_1x16x1x16_8_1x2_intrawave_v1,103.58,173.75,0.0
64,352,17408,5120,ck,5,0,596.326,a8w8_blockscale_1x128x128_256x16x128x128_8x16_16x16_1x2_16x16x1_8x32x1_1x16x1x16_8_1x2_intrawave_v1,105.22,173.04,0.0
64,360,17408,5120,ck,4,0,739.9626,a8w8_blockscale_1x128x128_256x16x256x128_8x16_16x16_1x4_16x16x1_8x32x1_1x16x1x16_8_1x2_intrawave_v1,86.72,139.88,0.0
64,368,17408,5120,ck,4,0,748.4909,a8w8_blockscale_1x128x128_256x16x256x128_8x16_16x16_1x4_16x16x1_8x32x1_1x16x1x16_8_1x2_intrawave_v1,87.64,138.71,0.0
64,376,17408,5120,ck,4,0,560.3176,a8w8_blockscale_1x128x128_256x16x256x128_8x16_16x16_1x4_16x16x1_8x32x1_1x16x1x16_8_1x2_intrawave_v1,119.62,185.87,0.0
64,384,17408,5120,ck,4,0,568.5766,a8w8_blockscale_1x128x128_256x16x256x128_8x16_16x16_1x4_16x16x1_8x32x1_1x16x1x16_8_1x2_intrawave_v1,120.39,183.73,0.0
64,392,17408,5120,ck,5,0,837.0589,a8w8_blockscale_1x128x128_256x16x128x128_8x16_16x16_1x2_16x16x1_8x32x1_1x16x1x16_8_1x2_intrawave_v1,83.48,125.18,0.0
64,400,17408,5120,ck,4,0,848.4456,a8w8_blockscale_1x128x128_256x16x256x128_8x16_16x16_1x4_16x16x1_8x32x1_1x16x1x16_8_1x2_intrawave_v1,84.04,123.88,0.0
64,408,17408,5120,ck,5,0,717.5189,a8w8_blockscale_1x128x128_256x16x128x128_8x16_16x16_1x2_16x16x1_8x32x1_1x16x1x16_8_1x2_intrawave_v1,101.36,146.93,0.0
64,416,17408,5120,ck,5,0,731.0468,a8w8_blockscale_1x128x128_256x16x128x128_8x16_16x16_1x2_16x16x1_8x32x1_1x16x1x16_8_1x2_intrawave_v1,101.44,144.65,0.0
64,424,17408,5120,ck,5,0,822.4876,a8w8_blockscale_1x128x128_256x16x128x128_8x16_16x16_1x2_16x16x1_8x32x1_1x16x1x16_8_1x2_intrawave_v1,91.89,128.95,0.0
64,432,17408,5120,ck,5,0,843.1205,a8w8_blockscale_1x128x128_256x16x128x128_8x16_16x16_1x2_16x16x1_8x32x1_1x16x1x16_8_1x2_intrawave_v1,91.34,126.18,0.0
64,440,17408,5120,ck,4,0,1019.8987,a8w8_blockscale_1x128x128_256x16x256x128_8x16_16x16_1x4_16x16x1_8x32x1_1x16x1x16_8_1x2_intrawave_v1,76.9,104.62,0.0
64,448,17408,5120,ck,4,0,1039.569,a8w8_blockscale_1x128x128_256x16x256x128_8x16_16x16_1x4_16x16x1_8x32x1_1x16x1x16_8_1x2_intrawave_v1,76.82,102.95,0.0
64,456,17408,5120,ck,5,0,814.7424,a8w8_blockscale_1x128x128_256x16x128x128_8x16_16x16_1x2_16x16x1_8x32x1_1x16x1x16_8_1x2_intrawave_v1,99.77,131.75,0.0
64,464,17408,5120,ck,5,0,824.5378,a8w8_blockscale_1x128x128_256x16x128x128_8x16_16x16_1x2_16x16x1_8x32x1_1x16x1x16_8_1x2_intrawave_v1,100.31,130.57,0.0
64,472,17408,5120,ck,5,0,773.5131,a8w8_blockscale_1x128x128_256x16x128x128_8x16_16x16_1x2_16x16x1_8x32x1_1x16x1x16_8_1x2_intrawave_v1,108.77,139.6,0.0
64,480,17408,5120,ck,5,0,774.4636,a8w8_blockscale_1x128x128_256x16x128x128_8x16_16x16_1x2_16x16x1_8x32x1_1x16x1x16_8_1x2_intrawave_v1,110.48,139.84,0.0
64,488,17408,5120,ck,4,0,694.9497,a8w8_blockscale_1x128x128_256x16x256x128_8x16_16x16_1x4_16x16x1_8x32x1_1x16x1x16_8_1x2_intrawave_v1,125.17,156.3,0.0
64,496,17408,5120,ck,4,0,684.3552,a8w8_blockscale_1x128x128_256x16x256x128_8x16_16x16_1x4_16x16x1_8x32x1_1x16x1x16_8_1x2_intrawave_v1,129.2,159.18,0.0
64,504,17408,5120,ck,4,0,655.6456,a8w8_blockscale_1x128x128_256x16x256x128_8x16_16x16_1x4_16x16x1_8x32x1_1x16x1x16_8_1x2_intrawave_v1,137.03,166.64,0.0
64,512,17408,5120,ck,4,0,664.5802,a8w8_blockscale_1x128x128_256x16x256x128_8x16_16x16_1x4_16x16x1_8x32x1_1x16x1x16_8_1x2_intrawave_v1,137.33,164.88,0.0
64,1024,17408,5120,ck,4,0,1292.6321,a8w8_blockscale_1x128x128_256x16x256x128_8x16_16x16_1x4_16x16x1_8x32x1_1x16x1x16_8_1x2_intrawave_v1,141.21,100.59,0.0
64,2048,17408,5120,ck,4,0,2620.8741,a8w8_blockscale_1x128x128_256x16x256x128_8x16_16x16_1x4_16x16x1_8x32x1_1x16x1x16_8_1x2_intrawave_v1,139.29,65.21,0.0
64,4096,17408,5120,ck,4,0,5243.782,a8w8_blockscale_1x128x128_256x16x256x128_8x16_16x16_1x4_16x16x1_8x32x1_1x16x1x16_8_1x2_intrawave_v1,139.24,48.19,0.0
64,8192,17408,5120,ck,4,0,10636.9877,a8w8_blockscale_1x128x128_256x16x256x128_8x16_16x16_1x4_16x16x1_8x32x1_1x16x1x16_8_1x2_intrawave_v1,137.28,39.14,0.0
64,16384,17408,5120,ck,4,0,21145.2935,a8w8_blockscale_1x128x128_256x16x256x128_8x16_16x16_1x4_16x16x1_8x32x1_1x16x1x16_8_1x2_intrawave_v1,138.12,35.16,0.0
64,20480,17408,5120,ck,4,0,26902.2857,a8w8_blockscale_1x128x128_256x16x256x128_8x16_16x16_1x4_16x16x1_8x32x1_1x16x1x16_8_1x2_intrawave_v1,135.7,33.72,0.0
