aiter/configs/model_configs/a8w8_blockscale_bpreshuffle_tuned_gemm_qwen3.5_397b.csv
gfx,cu_num,M,N,K,libtype,kernelId,splitK,us,kernelName,tflops,bw,errRatio
gfx950,256,1,16,4096,cktile,0,3,9.9476,a8w8_blockscale_cktile_16x128x256_1x4x1_16x16x128_intrawave_0x1x0_1,0.01,7.0,0.0
gfx950,256,2,16,4096,cktile,13,0,11.4023,a8w8_blockscale_cktile_16x128x256_1x4x1_16x16x128_intrawave_0x1x0_3,0.02,6.47,0.0
gfx950,256,4,16,4096,cktile,2,0,11.9477,a8w8_blockscale_cktile_16x128x256_1x4x1_16x16x64_intrawave_0x1x0_1,0.04,6.87,0.0
gfx950,256,8,16,4096,cktile,13,2,12.3432,a8w8_blockscale_cktile_16x128x256_1x4x1_16x16x128_intrawave_0x1x0_3,0.08,7.98,0.0
gfx950,256,16,16,4096,cktile,2,3,13.1725,a8w8_blockscale_cktile_16x128x256_1x4x1_16x16x64_intrawave_0x1x0_1,0.16,9.99,0.0
gfx950,256,32,16,4096,cktile,2,3,13.2694,a8w8_blockscale_cktile_16x128x256_1x4x1_16x16x64_intrawave_0x1x0_1,0.32,14.89,0.0
gfx950,256,64,16,4096,cktile,2,3,14.3694,a8w8_blockscale_cktile_16x128x256_1x4x1_16x16x64_intrawave_0x1x0_1,0.58,22.95,0.0
gfx950,256,128,16,4096,cktile,2,3,14.9731,a8w8_blockscale_cktile_16x128x256_1x4x1_16x16x64_intrawave_0x1x0_1,1.12,39.67,0.0
gfx950,256,256,16,4096,cktile,13,0,15.4707,a8w8_blockscale_cktile_16x128x256_1x4x1_16x16x128_intrawave_0x1x0_3,2.17,72.54,0.0
gfx950,256,512,16,4096,cktile,14,0,16.0332,a8w8_blockscale_cktile_16x128x256_1x4x1_16x16x64_intrawave_0x1x0_3,4.19,135.91,0.0
gfx950,256,1024,16,4096,cktile,2,0,17.2261,a8w8_blockscale_cktile_16x128x256_1x4x1_16x16x64_intrawave_0x1x0_1,7.79,249.19,0.0
gfx950,256,2048,16,4096,cktile,2,0,17.6907,a8w8_blockscale_cktile_16x128x256_1x4x1_16x16x64_intrawave_0x1x0_1,15.17,481.59,0.0
gfx950,256,4096,16,4096,cktile,2,0,17.9514,a8w8_blockscale_cktile_16x128x256_1x4x1_16x16x64_intrawave_0x1x0_1,29.91,945.54,0.0
gfx950,256,8192,16,4096,cktile,0,0,24.6005,a8w8_blockscale_cktile_16x128x256_1x4x1_16x16x128_intrawave_0x1x0_1,43.65,1377.29,0.0
gfx950,256,16384,16,4096,cktile,7,0,37.8328,a8w8_blockscale_cktile_32x128x128_1x4x1_16x16x64_intrawave_0x1x0_2,56.76,1789.42,0.0
gfx950,256,32768,16,4096,cktile,19,3,55.9043,a8w8_blockscale_cktile_32x128x128_1x4x1_16x16x64_intrawave_0x1x0_3,76.83,2420.78,0.0
gfx950,256,1,32,4096,cktile,13,3,9.8436,a8w8_blockscale_cktile_16x128x256_1x4x1_16x16x128_intrawave_0x1x0_3,0.03,13.74,0.0
gfx950,256,2,32,4096,cktile,2,2,11.35,a8w8_blockscale_cktile_16x128x256_1x4x1_16x16x64_intrawave_0x1x0_1,0.05,12.28,0.0
gfx950,256,4,32,4096,cktile,13,2,11.9049,a8w8_blockscale_cktile_16x128x256_1x4x1_16x16x128_intrawave_0x1x0_3,0.09,12.41,0.0
gfx950,256,8,32,4096,cktile,2,3,11.9675,a8w8_blockscale_cktile_16x128x256_1x4x1_16x16x64_intrawave_0x1x0_1,0.18,13.73,0.0
gfx950,256,16,32,4096,cktile,2,1,13.072,a8w8_blockscale_cktile_16x128x256_1x4x1_16x16x64_intrawave_0x1x0_1,0.32,15.12,0.0
gfx950,256,32,32,4096,cktile,2,0,13.3613,a8w8_blockscale_cktile_16x128x256_1x4x1_16x16x64_intrawave_0x1x0_1,0.63,19.77,0.0
gfx950,256,64,32,4096,cktile,2,0,13.8795,a8w8_blockscale_cktile_16x128x256_1x4x1_16x16x64_intrawave_0x1x0_1,1.21,28.63,0.0
gfx950,256,128,32,4096,cktile,12,0,15.6217,a8w8_blockscale_cktile_16x128x256_1x4x1_16x16x128_intrawave_0x1x0_3,2.15,42.48,0.0
gfx950,256,256,32,4096,cktile,2,2,15.0875,a8w8_blockscale_cktile_16x128x256_1x4x1_16x16x64_intrawave_0x1x0_1,4.45,79.27,0.0
gfx950,256,512,32,4096,cktile,12,0,16.3069,a8w8_blockscale_cktile_16x128x256_1x4x1_16x16x128_intrawave_0x1x0_3,8.23,138.65,0.0
gfx950,256,1024,32,4096,cktile,2,2,16.4717,a8w8_blockscale_cktile_16x128x256_1x4x1_16x16x64_intrawave_0x1x0_1,16.3,266.57,0.0
gfx950,256,2048,32,4096,cktile,2,0,17.3604,a8w8_blockscale_cktile_16x128x256_1x4x1_16x16x64_intrawave_0x1x0_1,30.93,498.3,0.0
gfx950,256,4096,32,4096,cktile,2,0,17.4132,a8w8_blockscale_cktile_16x128x256_1x4x1_16x16x64_intrawave_0x1x0_1,61.66,986.06,0.0
gfx950,256,8192,32,4096,cktile,2,0,25.1674,a8w8_blockscale_cktile_16x128x256_1x4x1_16x16x64_intrawave_0x1x0_1,85.33,1359.29,0.0
gfx950,256,16384,32,4096,cktile,7,0,38.4387,a8w8_blockscale_cktile_32x128x128_1x4x1_16x16x64_intrawave_0x1x0_2,111.74,1776.56,0.0
gfx950,256,32768,32,4096,cktile,19,3,55.9346,a8w8_blockscale_cktile_32x128x128_1x4x1_16x16x64_intrawave_0x1x0_3,153.57,2439.38,0.0
gfx950,256,1,256,512,ck,7,2,2.5833,a8w8_blockscale_bpreshuffle_1x128x128_256x16x64x256_16x16_16x16_16x16x1_16x16x1_1x16x1x16_4_1x1_intrawave_v1,0.1,51.13,0.0
gfx950,256,2,256,512,ck,7,2,2.601,a8w8_blockscale_bpreshuffle_1x128x128_256x16x64x256_16x16_16x16_16x16x1_16x16x1_1x16x1x16_4_1x1_intrawave_v1,0.2,51.18,0.0
gfx950,256,4,256,512,ck,7,0,2.4076,a8w8_blockscale_bpreshuffle_1x128x128_256x16x64x256_16x16_16x16_16x16x1_16x16x1_1x16x1x16_4_1x1_intrawave_v1,0.44,56.14,0.0
gfx950,256,8,256,512,ck,7,0,2.6846,a8w8_blockscale_bpreshuffle_1x128x128_256x16x64x256_16x16_16x16_16x16x1_16x16x1_1x16x1x16_4_1x1_intrawave_v1,0.78,51.88,0.0
gfx950,256,16,256,512,ck,7,3,2.6929,a8w8_blockscale_bpreshuffle_1x128x128_256x16x64x256_16x16_16x16_16x16x1_16x16x1_1x16x1x16_4_1x1_intrawave_v1,1.56,54.76,0.0
gfx950,256,32,256,512,ck,12,0,2.9842,a8w8_blockscale_bpreshuffle_1x128x128_256x32x64x256_16x16_16x16_16x16x1_16x16x1_1x32x1x8_8_2x1_intrawave_v1,2.81,54.9,0.0
gfx950,256,64,256,512,ck,6,0,3.6491,a8w8_blockscale_bpreshuffle_1x128x128_256x16x128x256_16x16_16x16_16x16x1_16x16x1_1x16x1x16_8_1x2_intrawave_v1,4.6,53.88,0.0
gfx950,256,128,256,512,ck,7,0,3.2278,a8w8_blockscale_bpreshuffle_1x128x128_256x16x64x256_16x16_16x16_16x16x1_16x16x1_1x16x1x16_4_1x1_intrawave_v1,10.4,81.21,0.0
gfx950,256,256,256,512,ck,7,0,3.2341,a8w8_blockscale_bpreshuffle_1x128x128_256x16x64x256_16x16_16x16_16x16x1_16x16x1_1x16x1x16_4_1x1_intrawave_v1,20.75,121.58,0.0
gfx950,256,512,256,512,ck,7,0,3.2978,a8w8_blockscale_bpreshuffle_1x128x128_256x16x64x256_16x16_16x16_16x16x1_16x16x1_1x16x1x16_4_1x1_intrawave_v1,40.7,198.73,0.0
gfx950,256,1024,256,512,ck,7,0,3.5588,a8w8_blockscale_bpreshuffle_1x128x128_256x16x64x256_16x16_16x16_16x16x1_16x16x1_1x16x1x16_4_1x1_intrawave_v1,75.43,331.47,0.0
gfx950,256,2048,256,512,ck,6,0,3.9969,a8w8_blockscale_bpreshuffle_1x128x128_256x16x128x256_16x16_16x16_16x16x1_16x16x1_1x16x1x16_8_1x2_intrawave_v1,134.32,557.49,0.0
gfx950,256,4096,256,512,ck,12,0,5.1797,a8w8_blockscale_bpreshuffle_1x128x128_256x32x64x256_16x16_16x16_16x16x1_16x16x1_1x32x1x8_8_2x1_intrawave_v1,207.3,835.06,0.0
gfx950,256,8192,256,512,ck,9,0,6.6634,a8w8_blockscale_bpreshuffle_1x128x128_256x32x128x128_16x16_16x16_8x32x1_8x32x1_1x32x1x8_8_2x1_intrawave_v1,322.28,1278.58,0.0
gfx950,256,16384,256,512,ck,14,2,10.4642,a8w8_blockscale_bpreshuffle_1x128x128_256x64x128x128_16x16_16x16_8x32x1_8x32x1_1x32x1x8_8_2x1_intrawave_v1,410.44,1615.82,0.0
gfx950,256,32768,256,512,ck,16,1,16.0455,a8w8_blockscale_bpreshuffle_1x128x128_256x64x128x256_16x16_16x16_16x16x1_16x16x1_1x32x1x8_8_2x1_intrawave_v1,535.35,2099.37,0.0
gfx950,256,1,512,256,ck,6,0,2.6774,a8w8_blockscale_bpreshuffle_1x128x128_256x16x128x256_16x16_16x16_16x16x1_16x16x1_1x16x1x16_8_1x2_intrawave_v1,0.1,49.43,0.0
gfx950,256,1,512,512,ck,7,0,2.9061,a8w8_blockscale_bpreshuffle_1x128x128_256x16x64x256_16x16_16x16_16x16x1_16x16x1_1x16x1x16_4_1x1_intrawave_v1,0.18,90.73,0.0
gfx950,256,1,512,1024,ck,7,1,4.0236,a8w8_blockscale_bpreshuffle_1x128x128_256x16x64x256_16x16_16x16_16x16x1_16x16x1_1x16x1x16_4_1x1_intrawave_v1,0.26,130.81,0.0
gfx950,256,1,512,2048,asm,5,8,5.0388,_ZN5aiter42fp8gemm_bf16_blockscale_BpreShuffle_32x128E,0.42,208.71,0.0
gfx950,256,2,512,256,ck,6,0,2.5406,a8w8_blockscale_bpreshuffle_1x128x128_256x16x128x256_16x16_16x16_16x16x1_16x16x1_1x16x1x16_8_1x2_intrawave_v1,0.21,52.6,0.0
gfx950,256,2,512,512,ck,6,0,2.7919,a8w8_blockscale_bpreshuffle_1x128x128_256x16x128x256_16x16_16x16_16x16x1_16x16x1_1x16x1x16_8_1x2_intrawave_v1,0.38,94.99,0.0
gfx950,256,2,512,1024,ck,6,0,3.8596,a8w8_blockscale_bpreshuffle_1x128x128_256x16x128x256_16x16_16x16_16x16x1_16x16x1_1x16x1x16_8_1x2_intrawave_v1,0.54,136.9,0.0
gfx950,256,2,512,2048,asm,5,8,5.0134,_ZN5aiter42fp8gemm_bf16_blockscale_BpreShuffle_32x128E,0.84,210.38,0.0
gfx950,256,4,512,256,ck,4,0,2.6362,a8w8_blockscale_bpreshuffle_1x128x128_256x16x128x128_8x16_16x16_16x16x1_8x32x1_1x16x1x16_8_1x2_intrawave_v1,0.4,51.66,0.0
gfx950,256,4,512,512,ck,6,0,3.0436,a8w8_blockscale_bpreshuffle_1x128x128_256x16x128x256_16x16_16x16_16x16x1_16x16x1_1x16x1x16_8_1x2_intrawave_v1,0.69,88.15,0.0
gfx950,256,4,512,1024,ck,7,0,3.8855,a8w8_blockscale_bpreshuffle_1x128x128_256x16x64x256_16x16_16x16_16x16x1_16x16x1_1x16x1x16_4_1x1_intrawave_v1,1.08,137.04,0.0
gfx950,256,4,512,2048,asm,5,8,5.0717,_ZN5aiter42fp8gemm_bf16_blockscale_BpreShuffle_32x128E,1.65,209.17,0.0
gfx950,256,8,512,256,ck,6,0,2.5849,a8w8_blockscale_bpreshuffle_1x128x128_256x16x128x256_16x16_16x16_16x16x1_16x16x1_1x16x1x16_8_1x2_intrawave_v1,0.81,54.67,0.0
gfx950,256,8,512,512,ck,6,0,2.8378,a8w8_blockscale_bpreshuffle_1x128x128_256x16x128x256_16x16_16x16_16x16x1_16x16x1_1x16x1x16_8_1x2_intrawave_v1,1.48,96.71,0.0
gfx950,256,8,512,1024,ck,6,0,4.1566,a8w8_blockscale_bpreshuffle_1x128x128_256x16x128x256_16x16_16x16_16x16x1_16x16x1_1x16x1x16_8_1x2_intrawave_v1,2.02,130.08,0.0
gfx950,256,8,512,2048,asm,5,8,5.3534,_ZN5aiter42fp8gemm_bf16_blockscale_BpreShuffle_32x128E,3.13,200.46,0.0
gfx950,256,16,512,256,ck,6,0,2.6211,a8w8_blockscale_bpreshuffle_1x128x128_256x16x128x256_16x16_16x16_16x16x1_16x16x1_1x16x1x16_8_1x2_intrawave_v1,1.6,57.82,0.0
gfx950,256,16,512,512,ck,6,0,2.8905,a8w8_blockscale_bpreshuffle_1x128x128_256x16x128x256_16x16_16x16_16x16x1_16x16x1_1x16x1x16_8_1x2_intrawave_v1,2.9,99.19,0.0
gfx950,256,16,512,1024,ck,7,0,3.9659,a8w8_blockscale_bpreshuffle_1x128x128_256x16x64x256_16x16_16x16_16x16x1_16x16x1_1x16x1x16_4_1x1_intrawave_v1,4.23,140.46,0.0
gfx950,256,16,512,2048,ck,7,0,5.2571,a8w8_blockscale_bpreshuffle_1x128x128_256x16x64x256_16x16_16x16_16x16x1_16x16x1_1x16x1x16_4_1x1_intrawave_v1,6.38,208.81,0.0
gfx950,256,32,512,256,ck,7,0,2.9498,a8w8_blockscale_bpreshuffle_1x128x128_256x16x64x256_16x16_16x16_16x16x1_16x16x1_1x16x1x16_4_1x1_intrawave_v1,2.84,58.32,0.0
gfx950,256,32,512,512,ck,7,0,3.2402,a8w8_blockscale_bpreshuffle_1x128x128_256x16x64x256_16x16_16x16_16x16x1_16x16x1_1x16x1x16_4_1x1_intrawave_v1,5.18,96.07,0.0
gfx950,256,32,512,1024,ck,7,0,4.1647,a8w8_blockscale_bpreshuffle_1x128x128_256x16x64x256_16x16_16x16_16x16x1_16x16x1_1x16x1x16_4_1x1_intrawave_v1,8.06,141.62,0.0
gfx950,256,32,512,2048,ck,7,0,5.4239,a8w8_blockscale_bpreshuffle_1x128x128_256x16x64x256_16x16_16x16_16x16x1_16x16x1_1x16x1x16_4_1x1_intrawave_v1,12.37,211.45,0.0
gfx950,256,64,512,256,ck,7,0,2.9421,a8w8_blockscale_bpreshuffle_1x128x128_256x16x64x256_16x16_16x16_16x16x1_16x16x1_1x16x1x16_4_1x1_intrawave_v1,5.7,72.39,0.0
gfx950,256,64,512,512,ck,7,0,3.2447,a8w8_blockscale_bpreshuffle_1x128x128_256x16x64x256_16x16_16x16_16x16x1_16x16x1_1x16x1x16_4_1x1_intrawave_v1,10.34,111.09,0.0
gfx950,256,64,512,1024,ck,12,0,4.617,a8w8_blockscale_bpreshuffle_1x128x128_256x32x64x256_16x16_16x16_16x16x1_16x16x1_1x32x1x8_8_2x1_intrawave_v1,14.54,141.94,0.0
gfx950,256,64,512,2048,asm,5,8,6.0049,_ZN5aiter42fp8gemm_bf16_blockscale_BpreShuffle_32x128E,22.35,207.36,0.0
gfx950,256,128,512,256,ck,10,0,3.388,a8w8_blockscale_bpreshuffle_1x128x128_256x32x64x128_16x16_16x16_8x32x1_8x32x1_1x32x1x8_8_2x1_intrawave_v1,9.9,87.05,0.0
gfx950,256,128,512,512,ck,7,0,3.2281,a8w8_blockscale_bpreshuffle_1x128x128_256x16x64x256_16x16_16x16_16x16x1_16x16x1_1x16x1x16_4_1x1_intrawave_v1,20.79,142.11,0.0
gfx950,256,128,512,1024,ck,7,2,4.4119,a8w8_blockscale_bpreshuffle_1x128x128_256x16x64x256_16x16_16x16_16x16x1_16x16x1_1x16x1x16_4_1x1_intrawave_v1,30.42,178.25,0.0
gfx950,256,128,512,2048,ck,7,0,5.4576,a8w8_blockscale_bpreshuffle_1x128x128_256x16x64x256_16x16_16x16_16x16x1_16x16x1_1x16x1x16_4_1x1_intrawave_v1,49.19,264.18,0.0
gfx950,256,256,512,256,ck,7,0,2.9734,a8w8_blockscale_bpreshuffle_1x128x128_256x16x64x256_16x16_16x16_16x16x1_16x16x1_1x16x1x16_4_1x1_intrawave_v1,22.57,154.29,0.0
gfx950,256,256,512,512,ck,7,0,3.2856,a8w8_blockscale_bpreshuffle_1x128x128_256x16x64x256_16x16_16x16_16x16x1_16x16x1_1x16x1x16_4_1x1_intrawave_v1,40.85,199.46,0.0
gfx950,256,256,512,1024,ck,7,0,4.2998,a8w8_blockscale_bpreshuffle_1x128x128_256x16x64x256_16x16_16x16_16x16x1_16x16x1_1x16x1x16_4_1x1_intrawave_v1,62.43,243.87,0.0
gfx950,256,256,512,2048,ck,12,0,6.0343,a8w8_blockscale_bpreshuffle_1x128x128_256x32x64x256_16x16_16x16_16x16x1_16x16x1_1x32x1x8_8_2x1_intrawave_v1,88.97,304.1,0.0
gfx950,256,512,512,256,ck,12,0,3.3898,a8w8_blockscale_bpreshuffle_1x128x128_256x32x64x256_16x16_16x16_16x16x1_16x16x1_1x32x1x8_8_2x1_intrawave_v1,39.59,232.0,0.0
gfx950,256,512,512,512,ck,7,0,3.5867,a8w8_blockscale_bpreshuffle_1x128x128_256x16x64x256_16x16_16x16_16x16x1_16x16x1_1x16x1x16_4_1x1_intrawave_v1,74.84,292.35,0.0
gfx950,256,512,512,1024,ck,12,0,4.7538,a8w8_blockscale_bpreshuffle_1x128x128_256x32x64x256_16x16_16x16_16x16x1_16x16x1_1x32x1x8_8_2x1_intrawave_v1,112.94,330.86,0.0
gfx950,256,512,512,2048,ck,7,0,6.4199,a8w8_blockscale_bpreshuffle_1x128x128_256x16x64x256_16x16_16x16_16x16x1_16x16x1_1x16x1x16_4_1x1_intrawave_v1,167.25,408.33,0.0
gfx950,256,1024,512,256,ck,12,0,3.4621,a8w8_blockscale_bpreshuffle_1x128x128_256x32x64x256_16x16_16x16_16x16x1_16x16x1_1x32x1x8_8_2x1_intrawave_v1,77.54,416.45,0.0
gfx950,256,1024,512,512,ck,6,0,3.9298,a8w8_blockscale_bpreshuffle_1x128x128_256x16x128x256_16x16_16x16_16x16x1_16x16x1_1x16x1x16_8_1x2_intrawave_v1,136.62,466.95,0.0
gfx950,256,1024,512,1024,ck,12,0,5.4144,a8w8_blockscale_bpreshuffle_1x128x128_256x32x64x256_16x16_16x16_16x16x1_16x16x1_1x32x1x8_8_2x1_intrawave_v1,198.31,484.16,0.0
gfx950,256,1024,512,2048,ck,12,0,6.9139,a8w8_blockscale_bpreshuffle_1x128x128_256x32x64x256_16x16_16x16_16x16x1_16x16x1_1x32x1x8_8_2x1_intrawave_v1,310.6,606.65,0.0
gfx950,256,2048,512,256,ck,4,0,4.3267,a8w8_blockscale_bpreshuffle_1x128x128_256x16x128x128_8x16_16x16_16x16x1_8x32x1_1x16x1x16_8_1x2_intrawave_v1,124.08,636.17,0.0
gfx950,256,2048,512,512,ck,11,0,4.9635,a8w8_blockscale_bpreshuffle_1x128x128_256x32x128x256_16x16_16x16_16x16x1_16x16x1_1x32x1x8_8_2x1_intrawave_v1,216.33,686.59,0.0
gfx950,256,2048,512,1024,ck,17,2,7.0378,a8w8_blockscale_bpreshuffle_1x128x128_256x64x64x256_16x16_16x16_16x16x1_16x16x1_1x32x1x8_8_2x1_intrawave_v1,305.14,670.46,0.0
gfx950,256,2048,512,2048,ck,17,2,9.8818,a8w8_blockscale_bpreshuffle_1x128x128_256x64x64x256_16x16_16x16_16x16x1_16x16x1_1x32x1x8_8_2x1_intrawave_v1,434.63,742.78,0.0
gfx950,256,4096,512,256,ck,12,0,5.7231,a8w8_blockscale_bpreshuffle_1x128x128_256x32x64x256_16x16_16x16_16x16x1_16x16x1_1x32x1x8_8_2x1_intrawave_v1,187.62,938.99,0.0
gfx950,256,4096,512,512,ck,16,0,6.0313,a8w8_blockscale_bpreshuffle_1x128x128_256x64x128x256_16x16_16x16_16x16x1_16x16x1_1x32x1x8_8_2x1_intrawave_v1,356.06,1086.6,0.0
gfx950,256,4096,512,1024,asm,10,1,9.1624,_ZN5aiter42fp8gemm_bf16_blockscale_BpreShuffle_64x128E,468.76,972.77,0.0
gfx950,256,4096,512,2048,asm,12,1,12.7517,_ZN5aiter42fp8gemm_bf16_blockscale_BpreShuffle_64x128E,673.63,1068.99,0.0
gfx950,256,8192,512,256,ck,14,0,7.7636,a8w8_blockscale_bpreshuffle_1x128x128_256x64x128x128_16x16_16x16_8x32x1_8x32x1_1x32x1x8_8_2x1_intrawave_v1,276.61,1367.51,0.0
gfx950,256,8192,512,512,ck,1,0,10.1629,a8w8_blockscale_bpreshuffle_1x128x128_256x64x128x128_16x16_16x16_8x32x1_8x32x1_1x32x1x8_8_2x1_intrawave_v3,422.61,1263.92,0.0
gfx950,256,8192,512,1024,ck,14,0,13.1835,a8w8_blockscale_bpreshuffle_1x128x128_256x64x128x128_16x16_16x16_8x32x1_8x32x1_1x32x1x8_8_2x1_intrawave_v1,651.57,1312.36,0.0
gfx950,256,8192,512,2048,ck,14,0,18.8774,a8w8_blockscale_bpreshuffle_1x128x128_256x64x128x128_16x16_16x16_8x32x1_8x32x1_1x32x1x8_8_2x1_intrawave_v1,910.08,1388.67,0.0
gfx950,256,16384,512,256,ck,9,0,12.9271,a8w8_blockscale_bpreshuffle_1x128x128_256x32x128x128_16x16_16x16_8x32x1_8x32x1_1x32x1x8_8_2x1_intrawave_v1,332.25,1632.43,0.0
gfx950,256,16384,512,512,ck,16,3,15.3485,a8w8_blockscale_bpreshuffle_1x128x128_256x64x128x256_16x16_16x16_16x16x1_16x16x1_1x32x1x8_8_2x1_intrawave_v1,559.66,1656.71,0.0
gfx950,256,16384,512,1024,ck,13,1,20.7624,a8w8_blockscale_bpreshuffle_1x128x128_256x64x256x128_16x16_16x16_8x32x1_8x32x1_1x32x1x8_8_2x1_intrawave_v1,827.45,1641.37,0.0
gfx950,256,16384,512,2048,ck,13,0,29.9784,a8w8_blockscale_bpreshuffle_1x128x128_256x64x256x128_16x16_16x16_8x32x1_8x32x1_1x32x1x8_8_2x1_intrawave_v1,1146.15,1713.91,0.0
gfx950,256,32768,512,256,ck,16,2,20.6256,a8w8_blockscale_bpreshuffle_1x128x128_256x64x128x256_16x16_16x16_16x16x1_16x16x1_1x32x1x8_8_2x1_intrawave_v1,416.47,2039.9,0.0
gfx950,256,32768,512,512,ck,16,2,26.9851,a8w8_blockscale_bpreshuffle_1x128x128_256x64x128x256_16x16_16x16_16x16x1_16x16x1_1x32x1x8_8_2x1_intrawave_v1,636.64,1874.88,0.0
gfx950,256,32768,512,1024,ck,13,2,38.1165,a8w8_blockscale_bpreshuffle_1x128x128_256x64x256x128_16x16_16x16_8x32x1_8x32x1_1x32x1x8_8_2x1_intrawave_v1,901.44,1774.38,0.0
gfx950,256,32768,512,2048,ck,13,1,56.1624,a8w8_blockscale_bpreshuffle_1x128x128_256x64x256x128_16x16_16x16_8x32x1_8x32x1_1x32x1x8_8_2x1_intrawave_v1,1223.59,1811.03,0.0
gfx950,256,1,1024,256,ck,5,0,2.7529,a8w8_blockscale_bpreshuffle_1x128x128_256x16x64x128_8x16_16x16_16x16x1_8x32x1_1x16x1x16_4_1x1_intrawave_v1,0.19,96.06,0.0
gfx950,256,1,1024,512,ck,7,0,2.9323,a8w8_blockscale_bpreshuffle_1x128x128_256x16x64x256_16x16_16x16_16x16x1_16x16x1_1x16x1x16_4_1x1_intrawave_v1,0.36,179.67,0.0
gfx950,256,1,1024,1024,cktile,1,0,4.3045,a8w8_blockscale_cktile_16x128x256_1x4x1_16x16x128_intrawave_0x1x0_2,0.49,244.31,0.0
gfx950,256,1,1024,2048,ck,7,0,5.17,a8w8_blockscale_bpreshuffle_1x128x128_256x16x64x256_16x16_16x16_16x16x1_16x16x1_1x16x1x16_4_1x1_intrawave_v1,0.81,406.43,0.0
gfx950,256,1,1024,4096,asm,7,8,7.66,_ZN5aiter42fp8gemm_bf16_blockscale_BpreShuffle_32x128E,1.1,548.36,0.0
gfx950,256,2,1024,256,ck,5,0,2.7842,a8w8_blockscale_bpreshuffle_1x128x128_256x16x64x128_8x16_16x16_16x16x1_8x32x1_1x16x1x16_4_1x1_intrawave_v1,0.38,95.81,0.0
gfx950,256,2,1024,512,ck,7,0,2.9541,a8w8_blockscale_bpreshuffle_1x128x128_256x16x64x256_16x16_16x16_16x16x1_16x16x1_1x16x1x16_4_1x1_intrawave_v1,0.71,179.21,0.0
gfx950,256,2,1024,1024,ck,7,0,3.8918,a8w8_blockscale_bpreshuffle_1x128x128_256x16x64x256_16x16_16x16_16x16x1_16x16x1_1x16x1x16_4_1x1_intrawave_v1,1.08,271.01,0.0
gfx950,256,2,1024,2048,ck,7,0,5.2282,a8w8_blockscale_bpreshuffle_1x128x128_256x16x64x256_16x16_16x16_16x16x1_16x16x1_1x16x1x16_4_1x1_intrawave_v1,1.6,402.69,0.0
gfx950,256,2,1024,4096,asm,7,8,7.6735,_ZN5aiter42fp8gemm_bf16_blockscale_BpreShuffle_32x128E,2.19,548.2,0.0
gfx950,256,4,1024,256,ck,5,0,2.7982,a8w8_blockscale_bpreshuffle_1x128x128_256x16x64x128_8x16_16x16_16x16x1_8x32x1_1x16x1x16_4_1x1_intrawave_v1,0.75,96.98,0.0
gfx950,256,4,1024,512,ck,7,0,3.5522,a8w8_blockscale_bpreshuffle_1x128x128_256x16x64x256_16x16_16x16_16x16x1_16x16x1_1x16x1x16_4_1x1_intrawave_v1,1.18,150.48,0.0
gfx950,256,4,1024,1024,ck,7,0,3.9714,a8w8_blockscale_bpreshuffle_1x128x128_256x16x64x256_16x16_16x16_16x16x1_16x16x1_1x16x1x16_4_1x1_intrawave_v1,2.11,267.13,0.0
gfx950,256,4,1024,2048,ck,7,0,5.2853,a8w8_blockscale_bpreshuffle_1x128x128_256x16x64x256_16x16_16x16_16x16x1_16x16x1_1x16x1x16_4_1x1_intrawave_v1,3.17,399.89,0.0
gfx950,256,4,1024,4096,asm,7,8,7.7332,_ZN5aiter42fp8gemm_bf16_blockscale_BpreShuffle_32x128E,4.34,545.55,0.0
gfx950,256,8,1024,256,ck,7,0,2.6714,a8w8_blockscale_bpreshuffle_1x128x128_256x16x64x256_16x16_16x16_16x16x1_16x16x1_1x16x1x16_4_1x1_intrawave_v1,1.57,105.03,0.0
gfx950,256,8,1024,512,ck,7,0,3.2117,a8w8_blockscale_bpreshuffle_1x128x128_256x16x64x256_16x16_16x16_16x16x1_16x16x1_1x16x1x16_4_1x1_intrawave_v1,2.61,169.62,0.0
gfx950,256,8,1024,1024,ck,6,0,4.5254,a8w8_blockscale_bpreshuffle_1x128x128_256x16x128x256_16x16_16x16_16x16x1_16x16x1_1x16x1x16_8_1x2_intrawave_v1,3.71,237.14,0.0
gfx950,256,8,1024,2048,ck,7,0,5.3151,a8w8_blockscale_bpreshuffle_1x128x128_256x16x64x256_16x16_16x16_16x16x1_16x16x1_1x16x1x16_4_1x1_intrawave_v1,6.31,400.73,0.0
gfx950,256,8,1024,4096,asm,7,8,7.7822,_ZN5aiter42fp8gemm_bf16_blockscale_BpreShuffle_32x128E,8.62,545.28,0.0006
gfx950,256,16,1024,256,ck,7,0,2.7287,a8w8_blockscale_bpreshuffle_1x128x128_256x16x64x256_16x16_16x16_16x16x1_16x16x1_1x16x1x16_4_1x1_intrawave_v1,3.07,109.58,0.0
gfx950,256,16,1024,512,ck,7,0,3.0314,a8w8_blockscale_bpreshuffle_1x128x128_256x16x64x256_16x16_16x16_16x16x1_16x16x1_1x16x1x16_4_1x1_intrawave_v1,5.53,186.46,0.0
gfx950,256,16,1024,1024,ck,7,1,4.1569,a8w8_blockscale_bpreshuffle_1x128x128_256x16x64x256_16x16_16x16_16x16x1_16x16x1_1x16x1x16_4_1x1_intrawave_v1,8.07,264.07,0.0
gfx950,256,16,1024,2048,ck,7,0,5.1776,a8w8_blockscale_bpreshuffle_1x128x128_256x16x64x256_16x16_16x16_16x16x1_16x16x1_1x16x1x16_4_1x1_intrawave_v1,12.96,417.7,0.0
gfx950,256,16,1024,4096,asm,7,8,8.5373,_ZN5aiter42fp8gemm_bf16_blockscale_BpreShuffle_32x128E,15.72,502.81,0.0002
gfx950,256,32,1024,256,ck,7,0,3.0511,a8w8_blockscale_bpreshuffle_1x128x128_256x16x64x256_16x16_16x16_16x16x1_16x16x1_1x16x1x16_4_1x1_intrawave_v1,5.5,110.08,0.0
gfx950,256,32,1024,512,ck,7,0,3.2677,a8w8_blockscale_bpreshuffle_1x128x128_256x16x64x256_16x16_16x16_16x16x1_16x16x1_1x16x1x16_4_1x1_intrawave_v1,10.27,185.52,0.0
gfx950,256,32,1024,1024,ck,7,0,4.8239,a8w8_blockscale_bpreshuffle_1x128x128_256x16x64x256_16x16_16x16_16x16x1_16x16x1_1x16x1x16_4_1x1_intrawave_v1,13.91,237.75,0.0
gfx950,256,32,1024,2048,ck,7,0,5.3868,a8w8_blockscale_bpreshuffle_1x128x128_256x16x64x256_16x16_16x16_16x16x1_16x16x1_1x16x1x16_4_1x1_intrawave_v1,24.92,413.65,0.0
gfx950,256,32,1024,4096,asm,7,8,8.9248,_ZN5aiter42fp8gemm_bf16_blockscale_BpreShuffle_32x128E,30.08,491.99,0.0003
gfx950,256,64,1024,256,ck,5,0,3.0742,a8w8_blockscale_bpreshuffle_1x128x128_256x16x64x128_8x16_16x16_16x16x1_8x32x1_1x16x1x16_4_1x1_intrawave_v1,10.91,133.24,0.0
gfx950,256,64,1024,512,ck,7,0,3.4728,a8w8_blockscale_bpreshuffle_1x128x128_256x16x64x256_16x16_16x16_16x16x1_16x16x1_1x16x1x16_4_1x1_intrawave_v1,19.32,198.15,0.0
gfx950,256,64,1024,1024,ck,7,0,4.2391,a8w8_blockscale_bpreshuffle_1x128x128_256x16x64x256_16x16_16x16_16x16x1_16x16x1_1x16x1x16_4_1x1_intrawave_v1,31.66,293.74,0.0
gfx950,256,64,1024,2048,ck,7,0,5.3999,a8w8_blockscale_bpreshuffle_1x128x128_256x16x64x256_16x16_16x16_16x16x1_16x16x1_1x16x1x16_4_1x1_intrawave_v1,49.71,436.91,0.0
gfx950,256,64,1024,4096,asm,7,8,7.1551,_ZN5aiter42fp8gemm_bf16_blockscale_BpreShuffle_32x128E,75.03,641.15,0.0004
gfx950,256,128,1024,256,ck,7,0,2.9858,a8w8_blockscale_bpreshuffle_1x128x128_256x16x64x256_16x16_16x16_16x16x1_16x16x1_1x16x1x16_4_1x1_intrawave_v1,22.48,186.57,0.0
gfx950,256,128,1024,512,ck,7,0,3.3077,a8w8_blockscale_bpreshuffle_1x128x128_256x16x64x256_16x16_16x16_16x16x1_16x16x1_1x16x1x16_4_1x1_intrawave_v1,40.58,257.57,0.0
gfx950,256,128,1024,1024,ck,7,0,4.2871,a8w8_blockscale_bpreshuffle_1x128x128_256x16x64x256_16x16_16x16_16x16x1_16x16x1_1x16x1x16_4_1x1_intrawave_v1,62.61,336.31,0.0
gfx950,256,128,1024,2048,ck,7,0,5.8742,a8w8_blockscale_bpreshuffle_1x128x128_256x16x64x256_16x16_16x16_16x16x1_16x16x1_1x16x1x16_4_1x1_intrawave_v1,91.39,446.26,0.0
gfx950,256,128,1024,4096,asm,5,6,7.7633,_ZN5aiter42fp8gemm_bf16_blockscale_BpreShuffle_32x128E,138.31,641.57,0.0001
gfx950,256,256,1024,256,ck,7,0,3.0616,a8w8_blockscale_bpreshuffle_1x128x128_256x16x64x256_16x16_16x16_16x16x1_16x16x1_1x16x1x16_4_1x1_intrawave_v1,43.84,278.28,0.0
gfx950,256,256,1024,512,ck,7,0,3.4184,a8w8_blockscale_bpreshuffle_1x128x128_256x16x64x256_16x16_16x16_16x16x1_16x16x1_1x16x1x16_4_1x1_intrawave_v1,78.53,345.09,0.0
gfx950,256,256,1024,1024,ck,7,0,4.5507,a8w8_blockscale_bpreshuffle_1x128x128_256x16x64x256_16x16_16x16_16x16x1_16x16x1_1x16x1x16_4_1x1_intrawave_v1,117.98,403.24,0.0
gfx950,256,256,1024,2048,ck,7,0,6.8139,a8w8_blockscale_bpreshuffle_1x128x128_256x16x64x256_16x16_16x16_16x16x1_16x16x1_1x16x1x16_4_1x1_intrawave_v1,157.58,461.66,0.0
gfx950,256,256,1024,4096,asm,11,4,10.7746,_ZN5aiter42fp8gemm_bf16_blockscale_BpreShuffle_48x128E,199.31,535.26,0.0
gfx950,256,512,1024,256,ck,12,0,3.4576,a8w8_blockscale_bpreshuffle_1x128x128_256x32x64x256_16x16_16x16_16x16x1_16x16x1_1x32x1x8_8_2x1_intrawave_v1,77.64,416.99,0.0
gfx950,256,512,1024,512,ck,7,0,3.9003,a8w8_blockscale_bpreshuffle_1x128x128_256x16x64x256_16x16_16x16_16x16x1_16x16x1_1x16x1x16_4_1x1_intrawave_v1,137.65,470.48,0.0
gfx950,256,512,1024,1024,ck,12,0,5.1465,a8w8_blockscale_bpreshuffle_1x128x128_256x32x64x256_16x16_16x16_16x16x1_16x16x1_1x32x1x8_8_2x1_intrawave_v1,208.64,509.36,0.0
gfx950,256,512,1024,2048,ck,12,0,7.3305,a8w8_blockscale_bpreshuffle_1x128x128_256x32x64x256_16x16_16x16_16x16x1_16x16x1_1x32x1x8_8_2x1_intrawave_v1,292.95,572.17,0.0
gfx950,256,512,1024,4096,ck,12,0,11.8278,a8w8_blockscale_bpreshuffle_1x128x128_256x32x64x256_16x16_16x16_16x16x1_16x16x1_1x32x1x8_8_2x1_intrawave_v1,363.12,620.57,0.0
gfx950,256,1024,1024,256,ck,12,0,4.2083,a8w8_blockscale_bpreshuffle_1x128x128_256x32x64x256_16x16_16x16_16x16x1_16x16x1_1x32x1x8_8_2x1_intrawave_v1,127.57,622.92,0.0
gfx950,256,1024,1024,512,ck,11,0,4.9934,a8w8_blockscale_bpreshuffle_1x128x128_256x32x128x256_16x16_16x16_16x16x1_16x16x1_1x32x1x8_8_2x1_intrawave_v1,215.03,629.98,0.0
gfx950,256,1024,1024,1024,ck,17,0,6.6739,a8w8_blockscale_bpreshuffle_1x128x128_256x64x64x256_16x16_16x16_16x16x1_16x16x1_1x32x1x8_8_2x1_intrawave_v1,321.77,628.46,0.0
gfx950,256,1024,1024,2048,ck,17,0,9.3621,a8w8_blockscale_bpreshuffle_1x128x128_256x64x64x256_16x16_16x16_16x16x1_16x16x1_1x32x1x8_8_2x1_intrawave_v1,458.76,672.01,0.0
gfx950,256,1024,1024,4096,ck,17,3,13.9641,a8w8_blockscale_bpreshuffle_1x128x128_256x64x64x256_16x16_16x16_16x16x1_16x16x1_1x32x1x8_8_2x1_intrawave_v1,615.14,750.91,0.0
gfx950,256,2048,1024,256,ck,17,0,5.7494,a8w8_blockscale_bpreshuffle_1x128x128_256x64x64x256_16x16_16x16_16x16x1_16x16x1_1x32x1x8_8_2x1_intrawave_v1,186.76,866.31,0.0
gfx950,256,2048,1024,512,ck,14,0,6.599,a8w8_blockscale_bpreshuffle_1x128x128_256x64x128x128_16x16_16x16_8x32x1_8x32x1_1x32x1x8_8_2x1_intrawave_v1,325.43,873.95,0.0
gfx950,256,2048,1024,1024,asm,10,1,9.3241,_ZN5aiter42fp8gemm_bf16_blockscale_BpreShuffle_64x128E,460.63,787.21,0.0
gfx950,256,2048,1024,2048,asm,12,1,12.5367,_ZN5aiter42fp8gemm_bf16_blockscale_BpreShuffle_64x128E,685.18,836.41,0.0
gfx950,256,2048,1024,4096,asm,16,1,19.7257,_ZN5aiter42fp8gemm_bf16_blockscale_BpreShuffle_64x128E,870.94,850.53,0.0
gfx950,256,4096,1024,256,ck,8,0,7.9335,a8w8_blockscale_bpreshuffle_1x128x128_256x32x256x128_16x16_16x16_8x32x1_8x32x1_1x32x1x8_8_2x1_intrawave_v1,270.69,1222.58,0.0
gfx950,256,4096,1024,512,ck,16,0,10.3882,a8w8_blockscale_bpreshuffle_1x128x128_256x64x128x256_16x16_16x16_16x16x1_16x16x1_1x32x1x8_8_2x1_intrawave_v1,413.45,1059.86,0.0
gfx950,256,4096,1024,1024,ck,14,0,13.1991,a8w8_blockscale_bpreshuffle_1x128x128_256x64x128x128_16x16_16x16_8x32x1_8x32x1_1x32x1x8_8_2x1_intrawave_v1,650.8,1032.76,0.0
gfx950,256,4096,1024,2048,ck,14,1,18.6869,a8w8_blockscale_bpreshuffle_1x128x128_256x64x128x128_16x16_16x16_8x32x1_8x32x1_1x32x1x8_8_2x1_intrawave_v1,919.35,1010.03,0.0001
gfx950,256,4096,1024,4096,ck,14,0,30.4942,a8w8_blockscale_bpreshuffle_1x128x128_256x64x128x128_16x16_16x16_8x32x1_8x32x1_1x32x1x8_8_2x1_intrawave_v1,1126.76,962.81,0.0002
gfx950,256,8192,1024,256,ck,9,0,12.8029,a8w8_blockscale_bpreshuffle_1x128x128_256x32x128x128_16x16_16x16_8x32x1_8x32x1_1x32x1x8_8_2x1_intrawave_v1,335.47,1494.7,0.0
gfx950,256,8192,1024,512,ck,11,0,15.7794,a8w8_blockscale_bpreshuffle_1x128x128_256x32x128x256_16x16_16x16_16x16x1_16x16x1_1x32x1x8_8_2x1_intrawave_v1,544.38,1362.27,0.0
gfx950,256,8192,1024,1024,ck,13,3,20.6832,a8w8_blockscale_bpreshuffle_1x128x128_256x64x256x128_16x16_16x16_8x32x1_8x32x1_1x32x1x8_8_2x1_intrawave_v1,830.62,1267.42,0.0
gfx950,256,8192,1024,2048,ck,13,0,29.8301,a8w8_blockscale_bpreshuffle_1x128x128_256x64x256x128_16x16_16x16_8x32x1_8x32x1_1x32x1x8_8_2x1_intrawave_v1,1151.85,1195.15,0.0
gfx950,256,8192,1024,4096,ck,13,3,48.3627,a8w8_blockscale_bpreshuffle_1x128x128_256x64x256x128_16x16_16x16_8x32x1_8x32x1_1x32x1x8_8_2x1_intrawave_v1,1420.92,1127.44,0.0
gfx950,256,16384,1024,256,ck,16,1,21.043,a8w8_blockscale_bpreshuffle_1x128x128_256x64x128x256_16x16_16x16_16x16x1_16x16x1_1x32x1x8_8_2x1_intrawave_v1,408.21,1806.34,0.0
gfx950,256,16384,1024,512,ck,16,3,25.5778,a8w8_blockscale_bpreshuffle_1x128x128_256x64x128x256_16x16_16x16_16x16x1_16x16x1_1x32x1x8_8_2x1_intrawave_v1,671.67,1660.32,0.0
gfx950,256,16384,1024,1024,ck,14,2,37.6644,a8w8_blockscale_bpreshuffle_1x128x128_256x64x128x128_16x16_16x16_8x32x1_8x32x1_1x32x1x8_8_2x1_intrawave_v1,912.26,1364.16,0.0004
gfx950,256,16384,1024,2048,ck,13,0,54.2525,a8w8_blockscale_bpreshuffle_1x128x128_256x64x256x128_16x16_16x16_8x32x1_8x32x1_1x32x1x8_8_2x1_intrawave_v1,1266.66,1275.63,0.0
gfx950,256,16384,1024,4096,ck,13,2,90.8959,a8w8_blockscale_bpreshuffle_1x128x128_256x64x256x128_16x16_16x16_8x32x1_8x32x1_1x32x1x8_8_2x1_intrawave_v1,1512.05,1153.6,0.0
gfx950,256,32768,1024,256,ck,16,3,36.0514,a8w8_blockscale_bpreshuffle_1x128x128_256x64x128x256_16x16_16x16_16x16x1_16x16x1_1x32x1x8_8_2x1_intrawave_v1,476.54,2101.43,0.0
gfx950,256,32768,1024,512,ck,16,2,45.9989,a8w8_blockscale_bpreshuffle_1x128x128_256x64x128x256_16x16_16x16_16x16x1_16x16x1_1x32x1x8_8_2x1_intrawave_v1,746.97,1835.05,0.0
gfx950,256,32768,1024,1024,ck,13,3,69.9154,a8w8_blockscale_bpreshuffle_1x128x128_256x64x256x128_16x16_16x16_8x32x1_8x32x1_1x32x1x8_8_2x1_intrawave_v1,982.89,1454.78,0.0
gfx950,256,32768,1024,2048,ck,13,2,100.09,a8w8_blockscale_bpreshuffle_1x128x128_256x64x256x128_16x16_16x16_8x32x1_8x32x1_1x32x1x8_8_2x1_intrawave_v1,1373.15,1361.92,0.0
gfx950,256,32768,1024,4096,ck,13,2,169.353,a8w8_blockscale_bpreshuffle_1x128x128_256x64x256x128_16x16_16x16_8x32x1_8x32x1_1x32x1x8_8_2x1_intrawave_v1,1623.11,1213.57,0.0
gfx950,256,1,1152,2048,ck,6,0,5.7928,a8w8_blockscale_bpreshuffle_1x128x128_256x16x128x256_16x16_16x16_16x16x1_16x16x1_1x16x1x16_8_1x2_intrawave_v1,0.81,408.03,0.0
gfx950,256,2,1152,2048,asm,5,8,5.6588,_ZN5aiter42fp8gemm_bf16_blockscale_BpreShuffle_32x128E,1.67,418.46,0.0
gfx950,256,4,1152,2048,ck,7,0,5.8616,a8w8_blockscale_bpreshuffle_1x128x128_256x16x64x256_16x16_16x16_16x16x1_16x16x1_1x16x1x16_4_1x1_intrawave_v1,3.22,405.47,0.0
gfx950,256,8,1152,2048,ck,7,0,5.9408,a8w8_blockscale_bpreshuffle_1x128x128_256x16x64x256_16x16_16x16_16x16x1_16x16x1_1x16x1x16_4_1x1_intrawave_v1,6.35,402.99,0.0
gfx950,256,16,1152,2048,ck,7,0,5.5125,a8w8_blockscale_bpreshuffle_1x128x128_256x16x64x256_16x16_16x16_16x16x1_16x16x1_1x16x1x16_4_1x1_intrawave_v1,13.7,440.62,0.0
gfx950,256,32,1152,2048,ck,7,0,5.4689,a8w8_blockscale_bpreshuffle_1x128x128_256x16x64x256_16x16_16x16_16x16x1_16x16x1_1x16x1x16_4_1x1_intrawave_v1,27.61,456.87,0.0
gfx950,256,64,1152,2048,ck,7,0,6.1787,a8w8_blockscale_bpreshuffle_1x128x128_256x16x64x256_16x16_16x16_16x16x1_16x16x1_1x16x1x16_4_1x1_intrawave_v1,48.88,426.92,0.0
gfx950,256,128,1152,2048,ck,7,0,6.7713,a8w8_blockscale_bpreshuffle_1x128x128_256x16x64x256_16x16_16x16_16x16x1_16x16x1_1x16x1x16_4_1x1_intrawave_v1,89.2,430.69,0.0
gfx950,256,256,1152,2048,ck,7,0,6.8666,a8w8_blockscale_bpreshuffle_1x128x128_256x16x64x256_16x16_16x16_16x16x1_16x16x1_1x16x1x16_4_1x1_intrawave_v1,175.92,505.84,0.0
gfx950,256,512,1152,2048,ck,12,0,8.3546,a8w8_blockscale_bpreshuffle_1x128x128_256x32x64x256_16x16_16x16_16x16x1_16x16x1_1x32x1x8_8_2x1_intrawave_v1,289.17,549.1,0.0
gfx950,256,1024,1152,2048,asm,6,1,11.5914,_ZN5aiter42fp8gemm_bf16_blockscale_BpreShuffle_48x128E,416.85,588.0,0.0
gfx950,256,2048,1152,2048,asm,18,1,14.0724,_ZN5aiter42fp8gemm_bf16_blockscale_BpreShuffle_80x128E,686.71,801.01,0.0
gfx950,256,4096,1152,2048,ck,14,3,23.1102,a8w8_blockscale_bpreshuffle_1x128x128_256x64x128x128_16x16_16x16_8x32x1_8x32x1_1x32x1x8_8_2x1_intrawave_v1,836.31,873.43,0.0001
gfx950,256,8192,1152,2048,ck,14,0,37.396,a8w8_blockscale_bpreshuffle_1x128x128_256x64x128x128_16x16_16x16_8x32x1_8x32x1_1x32x1x8_8_2x1_intrawave_v1,1033.66,1016.44,0.0003
gfx950,256,16384,1152,2048,ck,14,0,66.0603,a8w8_blockscale_bpreshuffle_1x128x128_256x64x128x128_16x16_16x16_8x32x1_8x32x1_1x32x1x8_8_2x1_intrawave_v1,1170.29,1115.08,0.0003
gfx950,256,32768,1152,2048,ck,14,3,118.4688,a8w8_blockscale_bpreshuffle_1x128x128_256x64x128x128_16x16_16x16_8x32x1_8x32x1_1x32x1x8_8_2x1_intrawave_v1,1305.14,1223.66,0.0004
gfx950,256,1,1536,2048,asm,5,8,5.6429,_ZN5aiter42fp8gemm_bf16_blockscale_BpreShuffle_32x128E,1.11,558.37,0.0
gfx950,256,2,1536,2048,asm,5,8,6.5913,_ZN5aiter42fp8gemm_bf16_blockscale_BpreShuffle_32x128E,1.91,478.81,0.0
gfx950,256,4,1536,2048,asm,5,8,6.6795,_ZN5aiter42fp8gemm_bf16_blockscale_BpreShuffle_32x128E,3.77,474.02,0.0002
gfx950,256,8,1536,2048,asm,5,8,6.0274,_ZN5aiter42fp8gemm_bf16_blockscale_BpreShuffle_32x128E,8.35,528.7,0.0
gfx950,256,16,1536,2048,asm,23,8,7.2266,_ZN5aiter42fp8gemm_bf16_blockscale_BpreShuffle_80x128E,13.93,446.63,0.0
gfx950,256,32,1536,2048,ck,12,0,7.6017,a8w8_blockscale_bpreshuffle_1x128x128_256x32x64x256_16x16_16x16_16x16x1_16x16x1_1x32x1x8_8_2x1_intrawave_v1,26.48,435.37,0.0
gfx950,256,64,1536,2048,asm,5,8,6.6011,_ZN5aiter42fp8gemm_bf16_blockscale_BpreShuffle_32x128E,61.0,526.19,0.0
gfx950,256,128,1536,2048,ck,7,0,7.0358,a8w8_blockscale_bpreshuffle_1x128x128_256x16x64x256_16x16_16x16_16x16x1_16x16x1_1x16x1x16_4_1x1_intrawave_v1,114.46,540.25,0.0
gfx950,256,256,1536,2048,ck,12,0,6.8003,a8w8_blockscale_bpreshuffle_1x128x128_256x32x64x256_16x16_16x16_16x16x1_16x16x1_1x32x1x8_8_2x1_intrawave_v1,236.84,655.33,0.0
gfx950,256,512,1536,2048,ck,12,0,8.9195,a8w8_blockscale_bpreshuffle_1x128x128_256x32x64x256_16x16_16x16_16x16x1_16x16x1_1x32x1x8_8_2x1_intrawave_v1,361.14,646.58,0.0
gfx950,256,1024,1536,2048,ck,17,0,11.1809,a8w8_blockscale_bpreshuffle_1x128x128_256x64x64x256_16x16_16x16_16x16x1_16x16x1_1x32x1x8_8_2x1_intrawave_v1,576.2,750.26,0.0
gfx950,256,2048,1536,2048,ck,14,0,17.0679,a8w8_blockscale_bpreshuffle_1x128x128_256x64x128x128_16x16_16x16_8x32x1_8x32x1_1x32x1x8_8_2x1_intrawave_v1,754.92,798.66,0.0001
gfx950,256,4096,1536,2048,ck,14,2,24.8983,a8w8_blockscale_bpreshuffle_1x128x128_256x64x128x128_16x16_16x16_8x32x1_8x32x1_1x32x1x8_8_2x1_intrawave_v1,1035.0,968.63,0.0002
gfx950,256,8192,1536,2048,ck,13,1,43.9527,a8w8_blockscale_bpreshuffle_1x128x128_256x64x256x128_16x16_16x16_8x32x1_8x32x1_1x32x1x8_8_2x1_intrawave_v1,1172.62,1025.85,0.0
gfx950,256,16384,1536,2048,ck,13,2,75.5336,a8w8_blockscale_bpreshuffle_1x128x128_256x64x256x128_16x16_16x16_8x32x1_8x32x1_1x32x1x8_8_2x1_intrawave_v1,1364.68,1152.23,0.0
gfx950,256,32768,1536,2048,ck,13,2,139.558,a8w8_blockscale_bpreshuffle_1x128x128_256x64x256x128_16x16_16x16_8x32x1_8x32x1_1x32x1x8_8_2x1_intrawave_v1,1477.22,1224.71,0.0
gfx950,256,1,2048,512,ck,7,2,3.1476,a8w8_blockscale_bpreshuffle_1x128x128_256x16x64x256_16x16_16x16_16x16x1_16x16x1_1x16x1x16_4_1x1_intrawave_v1,0.67,334.6,0.0
gfx950,256,1,2048,1024,ck,7,0,3.8919,a8w8_blockscale_bpreshuffle_1x128x128_256x16x64x256_16x16_16x16_16x16x1_16x16x1_1x16x1x16_4_1x1_intrawave_v1,1.08,540.17,0.0
gfx950,256,1,2048,2048,asm,5,8,6.5568,_ZN5aiter42fp8gemm_bf16_blockscale_BpreShuffle_32x128E,1.28,640.62,0.0
gfx950,256,1,2048,4096,asm,7,8,7.5994,_ZN5aiter42fp8gemm_bf16_blockscale_BpreShuffle_32x128E,2.21,1104.93,0.0
gfx950,256,2,2048,512,ck,7,0,2.9658,a8w8_blockscale_bpreshuffle_1x128x128_256x16x64x256_16x16_16x16_16x16x1_16x16x1_1x16x1x16_4_1x1_intrawave_v1,1.41,356.66,0.0
gfx950,256,2,2048,1024,ck,7,0,3.9292,a8w8_blockscale_bpreshuffle_1x128x128_256x16x64x256_16x16_16x16_16x16x1_16x16x1_1x16x1x16_4_1x1_intrawave_v1,2.13,536.34,0.0
gfx950,256,2,2048,2048,asm,5,8,5.0038,_ZN5aiter42fp8gemm_bf16_blockscale_BpreShuffle_32x128E,3.35,840.68,0.0
gfx950,256,2,2048,4096,asm,7,8,6.8508,_ZN5aiter42fp8gemm_bf16_blockscale_BpreShuffle_32x128E,4.9,1226.86,0.0005
gfx950,256,4,2048,512,ck,7,0,2.9866,a8w8_blockscale_bpreshuffle_1x128x128_256x16x64x256_16x16_16x16_16x16x1_16x16x1_1x16x1x16_4_1x1_intrawave_v1,2.81,357.27,0.0
gfx950,256,4,2048,1024,ck,6,0,4.4419,a8w8_blockscale_bpreshuffle_1x128x128_256x16x128x256_16x16_16x16_16x16x1_16x16x1_1x16x1x16_8_1x2_intrawave_v1,3.78,476.74,0.0
gfx950,256,4,2048,2048,asm,5,8,6.9765,_ZN5aiter42fp8gemm_bf16_blockscale_BpreShuffle_32x128E,4.81,604.73,0.0
gfx950,256,4,2048,4096,asm,7,8,6.6424,_ZN5aiter42fp8gemm_bf16_blockscale_BpreShuffle_32x128E,10.1,1267.82,0.0005
gfx950,256,8,2048,512,ck,7,0,3.0406,a8w8_blockscale_bpreshuffle_1x128x128_256x16x64x256_16x16_16x16_16x16x1_16x16x1_1x16x1x16_4_1x1_intrawave_v1,5.52,356.98,0.0
gfx950,256,8,2048,1024,ck,7,0,3.964,a8w8_blockscale_bpreshuffle_1x128x128_256x16x64x256_16x16_16x16_16x16x1_16x16x1_1x16x1x16_4_1x1_intrawave_v1,8.46,539.38,0.0
gfx950,256,8,2048,2048,asm,5,8,6.5942,_ZN5aiter42fp8gemm_bf16_blockscale_BpreShuffle_32x128E,10.18,643.51,0.0
gfx950,256,8,2048,4096,asm,7,8,8.6397,_ZN5aiter42fp8gemm_bf16_blockscale_BpreShuffle_32x128E,15.53,978.52,0.0007
gfx950,256,16,2048,512,ck,7,0,3.0452,a8w8_blockscale_bpreshuffle_1x128x128_256x16x64x256_16x16_16x16_16x16x1_16x16x1_1x16x1x16_4_1x1_intrawave_v1,11.02,368.55,0.0
gfx950,256,16,2048,1024,ck,7,0,3.9842,a8w8_blockscale_bpreshuffle_1x128x128_256x16x64x256_16x16_16x16_16x16x1_16x16x1_1x16x1x16_4_1x1_intrawave_v1,16.84,546.93,0.0
gfx950,256,16,2048,2048,ck,7,0,6.856,a8w8_blockscale_bpreshuffle_1x128x128_256x16x64x256_16x16_16x16_16x16x1_16x16x1_1x16x1x16_4_1x1_intrawave_v1,19.58,626.11,0.0
gfx950,256,16,2048,4096,asm,7,8,7.815,_ZN5aiter42fp8gemm_bf16_blockscale_BpreShuffle_32x128E,34.35,1090.17,0.0002
gfx950,256,32,2048,512,ck,7,0,3.2685,a8w8_blockscale_bpreshuffle_1x128x128_256x16x64x256_16x16_16x16_16x16x1_16x16x1_1x16x1x16_4_1x1_intrawave_v1,20.53,365.93,0.0
gfx950,256,32,2048,1024,ck,7,0,4.2361,a8w8_blockscale_bpreshuffle_1x128x128_256x16x64x256_16x16_16x16_16x16x1_16x16x1_1x16x1x16_4_1x1_intrawave_v1,31.68,533.74,0.0
gfx950,256,32,2048,2048,ck,7,0,7.1317,a8w8_blockscale_bpreshuffle_1x128x128_256x16x64x256_16x16_16x16_16x16x1_16x16x1_1x16x1x16_4_1x1_intrawave_v1,37.64,615.69,0.0
gfx950,256,32,2048,4096,asm,7,8,7.842,_ZN5aiter42fp8gemm_bf16_blockscale_BpreShuffle_32x128E,68.46,1103.13,0.0003
gfx950,256,64,2048,512,ck,7,0,3.3002,a8w8_blockscale_bpreshuffle_1x128x128_256x16x64x256_16x16_16x16_16x16x1_16x16x1_1x16x1x16_4_1x1_intrawave_v1,40.67,407.09,0.0
gfx950,256,64,2048,1024,ck,7,0,4.3176,a8w8_blockscale_bpreshuffle_1x128x128_256x16x64x256_16x16_16x16_16x16x1_16x16x1_1x16x1x16_4_1x1_intrawave_v1,62.17,561.62,0.0
gfx950,256,64,2048,2048,ck,7,0,7.1316,a8w8_blockscale_bpreshuffle_1x128x128_256x16x64x256_16x16_16x16_16x16x1_16x16x1_1x16x1x16_4_1x1_intrawave_v1,75.28,643.27,0.0
gfx950,256,64,2048,4096,asm,15,8,8.4126,_ZN5aiter42fp8gemm_bf16_blockscale_BpreShuffle_48x128E,127.63,1059.47,0.0004
gfx950,256,128,2048,512,ck,7,0,3.3974,a8w8_blockscale_bpreshuffle_1x128x128_256x16x64x256_16x16_16x16_16x16x1_16x16x1_1x16x1x16_4_1x1_intrawave_v1,79.01,482.25,0.0
gfx950,256,128,2048,1024,ck,7,0,5.065,a8w8_blockscale_bpreshuffle_1x128x128_256x16x64x256_16x16_16x16_16x16x1_16x16x1_1x16x1x16_4_1x1_intrawave_v1,106.0,543.44,0.0
gfx950,256,128,2048,2048,ck,7,0,7.0523,a8w8_blockscale_bpreshuffle_1x128x128_256x16x64x256_16x16_16x16_16x16x1_16x16x1_1x16x1x16_4_1x1_intrawave_v1,152.25,706.26,0.0
gfx950,256,128,2048,4096,asm,12,5,10.4238,_ZN5aiter42fp8gemm_bf16_blockscale_BpreShuffle_48x128E,206.02,905.35,0.0001
gfx950,256,256,2048,512,ck,12,0,3.9772,a8w8_blockscale_bpreshuffle_1x128x128_256x32x64x256_16x16_16x16_16x16x1_16x16x1_1x32x1x8_8_2x1_intrawave_v1,134.99,560.25,0.0
gfx950,256,256,2048,1024,ck,12,0,5.3818,a8w8_blockscale_bpreshuffle_1x128x128_256x32x64x256_16x16_16x16_16x16x1_16x16x1_1x32x1x8_8_2x1_intrawave_v1,199.51,633.22,0.0
gfx950,256,256,2048,2048,ck,12,0,7.5893,a8w8_blockscale_bpreshuffle_1x128x128_256x32x64x256_16x16_16x16_16x16x1_16x16x1_1x32x1x8_8_2x1_intrawave_v1,282.96,759.91,0.0
gfx950,256,256,2048,4096,asm,19,4,11.5742,_ZN5aiter42fp8gemm_bf16_blockscale_BpreShuffle_64x128E,371.08,905.96,0.0
gfx950,256,512,2048,512,ck,11,0,5.0404,a8w8_blockscale_bpreshuffle_1x128x128_256x32x128x256_16x16_16x16_16x16x1_16x16x1_1x32x1x8_8_2x1_intrawave_v1,213.03,676.11,0.0
gfx950,256,512,2048,1024,ck,11,0,6.3963,a8w8_blockscale_bpreshuffle_1x128x128_256x32x128x256_16x16_16x16_16x16x1_16x16x1_1x32x1x8_8_2x1_intrawave_v1,335.74,737.71,0.0
gfx950,256,512,2048,2048,ck,17,2,9.5414,a8w8_blockscale_bpreshuffle_1x128x128_256x64x64x256_16x16_16x16_16x16x1_16x16x1_1x32x1x8_8_2x1_intrawave_v1,450.14,769.28,0.0
gfx950,256,512,2048,4096,ck,17,0,13.9323,a8w8_blockscale_bpreshuffle_1x128x128_256x64x64x256_16x16_16x16_16x16x1_16x16x1_1x32x1x8_8_2x1_intrawave_v1,616.55,903.15,0.0
gfx950,256,1024,2048,512,ck,17,0,6.2043,a8w8_blockscale_bpreshuffle_1x128x128_256x64x64x256_16x16_16x16_16x16x1_16x16x1_1x32x1x8_8_2x1_intrawave_v1,346.13,929.54,0.0
gfx950,256,1024,2048,1024,asm,10,1,9.1666,_ZN5aiter42fp8gemm_bf16_blockscale_BpreShuffle_64x128E,468.55,800.74,0.0
gfx950,256,1024,2048,2048,asm,12,1,12.4632,_ZN5aiter42fp8gemm_bf16_blockscale_BpreShuffle_64x128E,689.22,841.34,0.0
gfx950,256,1024,2048,4096,asm,16,1,19.4509,_ZN5aiter42fp8gemm_bf16_blockscale_BpreShuffle_64x128E,883.24,862.54,0.0
gfx950,256,2048,2048,512,ck,14,1,9.9972,a8w8_blockscale_bpreshuffle_1x128x128_256x64x128x128_16x16_16x16_8x32x1_8x32x1_1x32x1x8_8_2x1_intrawave_v1,429.62,1048.87,0.0
gfx950,256,2048,2048,1024,asm,25,1,13.412,_ZN5aiter43fp8gemm_bf16_blockscale_BpreShuffle_128x128E,640.47,938.18,0.0
gfx950,256,2048,2048,2048,asm,30,1,18.5151,_ZN5aiter43fp8gemm_bf16_blockscale_BpreShuffle_128x128E,927.88,906.14,0.0
gfx950,256,2048,2048,4096,asm,40,1,29.3684,_ZN5aiter43fp8gemm_bf16_blockscale_BpreShuffle_128x128E,1169.96,856.9,0.0
gfx950,256,4096,2048,512,ck,16,0,15.7595,a8w8_blockscale_bpreshuffle_1x128x128_256x64x128x256_16x16_16x16_16x16x1_16x16x1_1x32x1x8_8_2x1_intrawave_v1,545.06,1264.19,0.0
gfx950,256,4096,2048,1024,ck,13,0,20.6804,a8w8_blockscale_bpreshuffle_1x128x128_256x64x256x128_16x16_16x16_8x32x1_8x32x1_1x32x1x8_8_2x1_intrawave_v1,830.73,1115.48,0.0
gfx950,256,4096,2048,2048,ck,13,0,29.2569,a8w8_blockscale_bpreshuffle_1x128x128_256x64x256x128_16x16_16x16_8x32x1_8x32x1_1x32x1x8_8_2x1_intrawave_v1,1174.41,1003.53,0.0
gfx950,256,4096,2048,4096,ck,13,2,48.7429,a8w8_blockscale_bpreshuffle_1x128x128_256x64x256x128_16x16_16x16_8x32x1_8x32x1_1x32x1x8_8_2x1_intrawave_v1,1409.84,860.5,0.0
gfx950,256,8192,2048,512,ck,16,1,25.5923,a8w8_blockscale_bpreshuffle_1x128x128_256x64x128x256_16x16_16x16_16x16x1_16x16x1_1x32x1x8_8_2x1_intrawave_v1,671.29,1515.98,0.0
gfx950,256,8192,2048,1024,ck,13,0,37.5433,a8w8_blockscale_bpreshuffle_1x128x128_256x64x256x128_16x16_16x16_8x32x1_8x32x1_1x32x1x8_8_2x1_intrawave_v1,915.2,1173.05,0.0
gfx950,256,8192,2048,2048,ck,13,1,53.2959,a8w8_blockscale_bpreshuffle_1x128x128_256x64x256x128_16x16_16x16_8x32x1_8x32x1_1x32x1x8_8_2x1_intrawave_v1,1289.4,1023.08,0.0
gfx950,256,8192,2048,4096,ck,13,3,89.0569,a8w8_blockscale_bpreshuffle_1x128x128_256x64x256x128_16x16_16x16_8x32x1_8x32x1_1x32x1x8_8_2x1_intrawave_v1,1543.27,847.74,0.0
gfx950,256,16384,2048,512,ck,16,3,44.6156,a8w8_blockscale_bpreshuffle_1x128x128_256x64x128x256_16x16_16x16_16x16x1_16x16x1_1x32x1x8_8_2x1_intrawave_v1,770.13,1715.68,0.0
gfx950,256,16384,2048,1024,ck,13,2,67.0275,a8w8_blockscale_bpreshuffle_1x128x128_256x64x256x128_16x16_16x16_8x32x1_8x32x1_1x32x1x8_8_2x1_intrawave_v1,1025.24,1282.81,0.0
gfx950,256,16384,2048,2048,ck,13,3,100.4129,a8w8_blockscale_bpreshuffle_1x128x128_256x64x256x128_16x16_16x16_8x32x1_8x32x1_1x32x1x8_8_2x1_intrawave_v1,1368.74,1044.26,0.0
gfx950,256,16384,2048,4096,ck,13,1,168.3107,a8w8_blockscale_bpreshuffle_1x128x128_256x64x256x128_16x16_16x16_8x32x1_8x32x1_1x32x1x8_8_2x1_intrawave_v1,1633.16,847.28,0.0
gfx950,256,32768,2048,512,ck,16,1,84.0988,a8w8_blockscale_bpreshuffle_1x128x128_256x64x128x256_16x16_16x16_16x16x1_16x16x1_1x32x1x8_8_2x1_intrawave_v1,817.13,1807.92,0.0
gfx950,256,32768,2048,1024,ck,13,1,128.1282,a8w8_blockscale_bpreshuffle_1x128x128_256x64x256x128_16x16_16x16_8x32x1_8x32x1_1x32x1x8_8_2x1_intrawave_v1,1072.67,1325.78,0.0
gfx950,256,32768,2048,2048,ck,13,0,191.3218,a8w8_blockscale_bpreshuffle_1x128x128_256x64x256x128_16x16_16x16_8x32x1_8x32x1_1x32x1x8_8_2x1_intrawave_v1,1436.73,1074.22,0.0
gfx950,256,32768,2048,4096,ck,13,3,327.16,a8w8_blockscale_bpreshuffle_1x128x128_256x64x256x128_16x16_16x16_8x32x1_8x32x1_1x32x1x8_8_2x1_intrawave_v1,1680.39,846.14,0.0
gfx950,256,1,2176,4096,asm,7,8,7.8744,_ZN5aiter42fp8gemm_bf16_blockscale_BpreShuffle_32x128E,2.26,1132.96,0.0
gfx950,256,2,2176,4096,asm,7,8,7.9053,_ZN5aiter42fp8gemm_bf16_blockscale_BpreShuffle_32x128E,4.51,1129.6,0.0011
gfx950,256,4,2176,4096,asm,7,8,7.5517,_ZN5aiter42fp8gemm_bf16_blockscale_BpreShuffle_32x128E,9.44,1184.73,0.0
gfx950,256,8,2176,4096,asm,7,8,8.7635,_ZN5aiter42fp8gemm_bf16_blockscale_BpreShuffle_32x128E,16.27,1024.76,0.0007
gfx950,256,16,2176,4096,asm,7,8,7.9181,_ZN5aiter42fp8gemm_bf16_blockscale_BpreShuffle_32x128E,36.02,1142.71,0.0003
gfx950,256,32,2176,4096,asm,7,8,9.0372,_ZN5aiter42fp8gemm_bf16_blockscale_BpreShuffle_32x128E,63.12,1016.16,0.0004
gfx950,256,64,2176,4096,asm,4,5,9.5371,_ZN5aiter42fp8gemm_bf16_blockscale_BpreShuffle_32x128E,119.62,991.24,0.0
gfx950,256,128,2176,4096,asm,11,4,10.9227,_ZN5aiter42fp8gemm_bf16_blockscale_BpreShuffle_48x128E,208.9,915.0,0.0
gfx950,256,256,2176,4096,asm,18,3,13.8058,_ZN5aiter42fp8gemm_bf16_blockscale_BpreShuffle_64x128E,330.54,802.24,0.0
gfx950,256,512,2176,4096,asm,25,2,16.8678,_ZN5aiter42fp8gemm_bf16_blockscale_BpreShuffle_80x128E,541.08,784.83,0.0
gfx950,256,1024,2176,4096,asm,24,1,21.6111,_ZN5aiter42fp8gemm_bf16_blockscale_BpreShuffle_80x128E,844.64,812.71,0.0
gfx950,256,2048,2176,4096,ck,14,3,39.4015,a8w8_blockscale_bpreshuffle_1x128x128_256x64x128x128_16x16_16x16_8x32x1_8x32x1_1x32x1x8_8_2x1_intrawave_v1,926.54,665.31,0.0002
gfx950,256,4096,2176,4096,ck,14,1,61.2772,a8w8_blockscale_bpreshuffle_1x128x128_256x64x128x128_16x16_16x16_8x32x1_8x32x1_1x32x1x8_8_2x1_intrawave_v1,1191.54,710.15,0.0003
gfx950,256,8192,2176,4096,ck,14,0,106.5168,a8w8_blockscale_bpreshuffle_1x128x128_256x64x128x128_16x16_16x16_8x32x1_8x32x1_1x32x1x8_8_2x1_intrawave_v1,1370.95,733.4,0.0003
gfx950,256,16384,2176,4096,ck,0,3,186.2105,a8w8_blockscale_bpreshuffle_1x128x128_256x128x128x128_16x16_16x16_8x32x1_8x32x1_1x32x1x8_8_2x1_intrawave_v3,1568.43,791.17,0.0
gfx950,256,32768,2176,4096,ck,0,2,351.6479,a8w8_blockscale_bpreshuffle_1x128x128_256x128x128x128_16x16_16x16_8x32x1_8x32x1_1x32x1x8_8_2x1_intrawave_v3,1661.08,812.57,0.0
gfx950,256,1,2304,2048,asm,5,8,5.8881,_ZN5aiter42fp8gemm_bf16_blockscale_BpreShuffle_32x128E,1.6,802.51,0.0
gfx950,256,2,2304,2048,asm,5,8,5.9445,_ZN5aiter42fp8gemm_bf16_blockscale_BpreShuffle_32x128E,3.18,796.01,0.0
gfx950,256,4,2304,2048,asm,5,8,6.9751,_ZN5aiter42fp8gemm_bf16_blockscale_BpreShuffle_32x128E,5.41,680.31,0.0002
gfx950,256,8,2304,2048,ck,7,0,7.2733,a8w8_blockscale_bpreshuffle_1x128x128_256x16x64x256_16x16_16x16_16x16x1_16x16x1_1x16x1x16_4_1x1_intrawave_v1,10.38,656.08,0.0
gfx950,256,16,2304,2048,asm,5,8,6.5934,_ZN5aiter42fp8gemm_bf16_blockscale_BpreShuffle_32x128E,22.9,731.81,0.0
gfx950,256,32,2304,2048,ck,7,0,6.6844,a8w8_blockscale_bpreshuffle_1x128x128_256x16x64x256_16x16_16x16_16x16x1_16x16x1_1x16x1x16_4_1x1_intrawave_v1,45.18,737.78,0.0
gfx950,256,64,2304,2048,ck,7,0,6.8275,a8w8_blockscale_bpreshuffle_1x128x128_256x16x64x256_16x16_16x16_16x16x1_16x16x1_1x16x1x16_4_1x1_intrawave_v1,88.46,753.51,0.0
gfx950,256,128,2304,2048,ck,7,0,7.3232,a8w8_blockscale_bpreshuffle_1x128x128_256x16x64x256_16x16_16x16_16x16x1_16x16x1_1x16x1x16_4_1x1_intrawave_v1,164.95,760.67,0.0
gfx950,256,256,2304,2048,ck,12,3,9.0772,a8w8_blockscale_bpreshuffle_1x128x128_256x32x64x256_16x16_16x16_16x16x1_16x16x1_1x32x1x8_8_2x1_intrawave_v1,266.15,707.55,0.0
gfx950,256,512,2304,2048,asm,6,1,11.2464,_ZN5aiter42fp8gemm_bf16_blockscale_BpreShuffle_48x128E,429.63,722.58,0.0
gfx950,256,1024,2304,2048,asm,18,1,13.4055,_ZN5aiter42fp8gemm_bf16_blockscale_BpreShuffle_80x128E,720.87,860.42,0.0
gfx950,256,2048,2304,2048,ck,14,3,23.1781,a8w8_blockscale_bpreshuffle_1x128x128_256x64x128x128_16x16_16x16_8x32x1_8x32x1_1x32x1x8_8_2x1_intrawave_v1,833.86,791.7,0.0002
gfx950,256,4096,2304,2048,ck,14,2,36.6592,a8w8_blockscale_bpreshuffle_1x128x128_256x64x128x128_16x16_16x16_8x32x1_8x32x1_1x32x1x8_8_2x1_intrawave_v1,1054.43,872.4,0.0002
gfx950,256,8192,2304,2048,ck,13,2,63.1591,a8w8_blockscale_bpreshuffle_1x128x128_256x64x256x128_16x16_16x16_8x32x1_8x32x1_1x32x1x8_8_2x1_intrawave_v1,1224.04,938.02,0.0
gfx950,256,16384,2304,2048,ck,13,3,111.7906,a8w8_blockscale_bpreshuffle_1x128x128_256x64x256x128_16x16_16x16_8x32x1_8x32x1_1x32x1x8_8_2x1_intrawave_v1,1383.11,1017.71,0.0
gfx950,256,32768,2304,2048,ck,13,3,205.3694,a8w8_blockscale_bpreshuffle_1x128x128_256x64x256x128_16x16_16x16_8x32x1_8x32x1_1x32x1x8_8_2x1_intrawave_v1,1505.76,1084.98,0.0
gfx950,256,1,2560,4096,asm,7,8,7.9625,_ZN5aiter42fp8gemm_bf16_blockscale_BpreShuffle_32x128E,2.63,1318.05,0.0
gfx950,256,2,2560,4096,asm,7,8,7.0372,_ZN5aiter42fp8gemm_bf16_blockscale_BpreShuffle_32x128E,5.96,1492.67,0.0002
gfx950,256,4,2560,4096,asm,7,8,7.4717,_ZN5aiter42fp8gemm_bf16_blockscale_BpreShuffle_32x128E,11.23,1408.33,0.0
gfx950,256,8,2560,4096,asm,7,8,7.8474,_ZN5aiter42fp8gemm_bf16_blockscale_BpreShuffle_32x128E,21.38,1345.6,0.0002
gfx950,256,16,2560,4096,asm,7,8,8.0428,_ZN5aiter42fp8gemm_bf16_blockscale_BpreShuffle_32x128E,41.72,1322.08,0.0003
gfx950,256,32,2560,4096,asm,7,8,9.3162,_ZN5aiter42fp8gemm_bf16_blockscale_BpreShuffle_32x128E,72.03,1157.2,0.0004
gfx950,256,64,2560,4096,asm,5,6,9.6355,_ZN5aiter42fp8gemm_bf16_blockscale_BpreShuffle_32x128E,139.3,1149.46,0.0001
gfx950,256,128,2560,4096,asm,11,4,10.8476,_ZN5aiter42fp8gemm_bf16_blockscale_BpreShuffle_48x128E,247.46,1075.39,0.0
gfx950,256,256,2560,4096,asm,18,3,13.3461,_ZN5aiter42fp8gemm_bf16_blockscale_BpreShuffle_64x128E,402.27,962.46,0.0
gfx950,256,512,2560,4096,asm,8,1,18.1662,_ZN5aiter42fp8gemm_bf16_blockscale_BpreShuffle_48x128E,591.07,836.96,0.0
gfx950,256,1024,2560,4096,asm,32,1,22.7592,_ZN5aiter42fp8gemm_bf16_blockscale_BpreShuffle_96x128E,943.57,875.38,0.0
gfx950,256,2048,2560,4096,ck,14,1,41.1542,a8w8_blockscale_bpreshuffle_1x128x128_256x64x128x128_16x16_16x16_8x32x1_8x32x1_1x32x1x8_8_2x1_intrawave_v1,1043.63,713.42,0.0001
gfx950,256,4096,2560,4096,cktile,27,3,59.7186,a8w8_blockscale_cktile_192x256x128_4x2x1_16x16x128_intrawave_0x1x0_2,1438.4,807.7,0.0
gfx950,256,8192,2560,4096,ck,13,1,110.5445,a8w8_blockscale_bpreshuffle_1x128x128_256x64x256x128_16x16_16x16_8x32x1_8x32x1_1x32x1x8_8_2x1_intrawave_v1,1554.11,777.82,0.0
gfx950,256,16384,2560,4096,ck,13,3,203.1261,a8w8_blockscale_bpreshuffle_1x128x128_256x64x256x128_16x16_16x16_8x32x1_8x32x1_1x32x1x8_8_2x1_intrawave_v1,1691.55,794.98,0.0
gfx950,256,32768,2560,4096,ck,13,1,383.4777,a8w8_blockscale_bpreshuffle_1x128x128_256x64x256x128_16x16_16x16_8x32x1_8x32x1_1x32x1x8_8_2x1_intrawave_v1,1792.01,814.85,0.0
gfx950,256,1,3072,2048,asm,5,8,5.1263,_ZN5aiter42fp8gemm_bf16_blockscale_BpreShuffle_32x128E,2.45,1228.89,0.0
gfx950,256,2,3072,2048,asm,5,8,6.0121,_ZN5aiter42fp8gemm_bf16_blockscale_BpreShuffle_32x128E,4.19,1049.19,0.0
gfx950,256,4,3072,2048,asm,5,8,6.6828,_ZN5aiter42fp8gemm_bf16_blockscale_BpreShuffle_32x128E,7.53,946.34,0.0
gfx950,256,8,3072,2048,asm,5,8,6.558,_ZN5aiter42fp8gemm_bf16_blockscale_BpreShuffle_32x128E,15.35,969.35,0.0
gfx950,256,16,3072,2048,ck,7,0,6.8232,a8w8_blockscale_bpreshuffle_1x128x128_256x16x64x256_16x16_16x16_16x16x1_16x16x1_1x16x1x16_4_1x1_intrawave_v1,29.51,941.28,0.0
gfx950,256,32,3072,2048,asm,29,8,7.0543,_ZN5aiter42fp8gemm_bf16_blockscale_BpreShuffle_96x128E,57.08,929.02,0.0
gfx950,256,64,3072,2048,ck,7,0,7.3176,a8w8_blockscale_bpreshuffle_1x128x128_256x16x64x256_16x16_16x16_16x16x1_16x16x1_1x16x1x16_4_1x1_intrawave_v1,110.05,931.42,0.0
gfx950,256,128,3072,2048,ck,7,3,7.9336,a8w8_blockscale_bpreshuffle_1x128x128_256x16x64x256_16x16_16x16_16x16x1_16x16x1_1x16x1x16_4_1x1_intrawave_v1,203.01,925.18,0.0
gfx950,256,256,3072,2048,ck,12,1,9.2808,a8w8_blockscale_bpreshuffle_1x128x128_256x32x64x256_16x16_16x16_16x16x1_16x16x1_1x32x1x8_8_2x1_intrawave_v1,347.08,903.87,0.0
gfx950,256,512,3072,2048,asm,12,1,12.0624,_ZN5aiter42fp8gemm_bf16_blockscale_BpreShuffle_64x128E,534.09,869.29,0.0
gfx950,256,1024,3072,2048,ck,2,3,17.4087,a8w8_blockscale_bpreshuffle_1x128x128_256x64x64x128_16x16_16x16_8x32x1_8x32x1_1x32x1x8_8_2x1_intrawave_v3,740.14,843.26,0.0
gfx950,256,2048,3072,2048,ck,14,2,25.3294,a8w8_blockscale_bpreshuffle_1x128x128_256x64x128x128_16x16_16x16_8x32x1_8x32x1_1x32x1x8_8_2x1_intrawave_v1,1017.39,910.75,0.0002
gfx950,256,4096,3072,2048,ck,13,0,41.3547,a8w8_blockscale_bpreshuffle_1x128x128_256x64x256x128_16x16_16x16_8x32x1_8x32x1_1x32x1x8_8_2x1_intrawave_v1,1246.28,963.52,0.0
gfx950,256,8192,3072,2048,ck,13,1,75.3755,a8w8_blockscale_bpreshuffle_1x128x128_256x64x256x128_16x16_16x16_8x32x1_8x32x1_1x32x1x8_8_2x1_intrawave_v1,1367.54,973.8,0.0
gfx950,256,16384,3072,2048,ck,13,3,137.6796,a8w8_blockscale_bpreshuffle_1x128x128_256x64x256x128_16x16_16x16_8x32x1_8x32x1_1x32x1x8_8_2x1_intrawave_v1,1497.38,1020.55,0.0
gfx950,256,32768,3072,2048,ck,13,2,263.055,a8w8_blockscale_bpreshuffle_1x128x128_256x64x256x128_16x16_16x16_8x32x1_8x32x1_1x32x1x8_8_2x1_intrawave_v1,1567.42,1044.37,0.0
gfx950,256,1,4096,2048,asm,5,8,7.1908,_ZN5aiter42fp8gemm_bf16_blockscale_BpreShuffle_32x128E,2.33,1168.0,0.0
gfx950,256,2,4096,2048,asm,5,8,6.3493,_ZN5aiter42fp8gemm_bf16_blockscale_BpreShuffle_32x128E,5.28,1324.41,0.0
gfx950,256,4,4096,1024,ck,7,0,5.181,a8w8_blockscale_bpreshuffle_1x128x128_256x16x64x256_16x16_16x16_16x16x1_16x16x1_1x16x1x16_4_1x1_intrawave_v1,6.48,816.67,0.0
gfx950,256,4,4096,2048,asm,5,8,6.7125,_ZN5aiter42fp8gemm_bf16_blockscale_BpreShuffle_32x128E,10.0,1255.8,0.0
gfx950,256,8,4096,2048,ck,7,0,7.1699,a8w8_blockscale_bpreshuffle_1x128x128_256x16x64x256_16x16_16x16_16x16x1_16x16x1_1x16x1x16_4_1x1_intrawave_v1,18.72,1181.4,0.0
gfx950,256,16,4096,1024,ck,7,0,5.1635,a8w8_blockscale_bpreshuffle_1x128x128_256x16x64x256_16x16_16x16_16x16x1_16x16x1_1x16x1x16_4_1x1_intrawave_v1,25.99,840.86,0.0
gfx950,256,16,4096,2048,asm,5,8,6.9374,_ZN5aiter42fp8gemm_bf16_blockscale_BpreShuffle_32x128E,38.69,1232.8,0.0
gfx950,256,32,4096,1024,ck,7,3,5.5505,a8w8_blockscale_bpreshuffle_1x128x128_256x16x64x256_16x16_16x16_16x16x1_16x16x1_1x16x1x16_4_1x1_intrawave_v1,48.36,808.79,0.0
gfx950,256,32,4096,2048,ck,7,0,7.4602,a8w8_blockscale_bpreshuffle_1x128x128_256x16x64x256_16x16_16x16_16x16x1_16x16x1_1x16x1x16_4_1x1_intrawave_v1,71.96,1168.37,0.0
gfx950,256,64,4096,1024,ck,7,1,5.5796,a8w8_blockscale_bpreshuffle_1x128x128_256x16x64x256_16x16_16x16_16x16x1_16x16x1_1x16x1x16_4_1x1_intrawave_v1,96.22,857.43,0.0
gfx950,256,64,4096,2048,ck,7,0,7.1537,a8w8_blockscale_bpreshuffle_1x128x128_256x16x64x256_16x16_16x16_16x16x1_16x16x1_1x16x1x16_4_1x1_intrawave_v1,150.1,1264.24,0.0
gfx950,256,128,4096,1024,ck,7,0,5.6283,a8w8_blockscale_bpreshuffle_1x128x128_256x16x64x256_16x16_16x16_16x16x1_16x16x1_1x16x1x16_4_1x1_intrawave_v1,190.78,954.81,0.0
gfx950,256,128,4096,2048,ck,7,0,7.6378,a8w8_blockscale_bpreshuffle_1x128x128_256x16x64x256_16x16_16x16_16x16x1_16x16x1_1x16x1x16_4_1x1_intrawave_v1,281.17,1269.91,0.0
gfx950,256,256,4096,1024,ck,12,0,6.7543,a8w8_blockscale_bpreshuffle_1x128x128_256x32x64x256_16x16_16x16_16x16x1_16x16x1_1x32x1x8_8_2x1_intrawave_v1,317.94,970.29,0.0
gfx950,256,256,4096,2048,ck,11,1,9.5084,a8w8_blockscale_bpreshuffle_1x128x128_256x32x128x256_16x16_16x16_16x16x1_16x16x1_1x32x1x8_8_2x1_intrawave_v1,451.7,1157.93,0.0
gfx950,256,512,4096,1024,asm,10,1,8.5367,_ZN5aiter42fp8gemm_bf16_blockscale_BpreShuffle_64x128E,503.12,1044.07,0.0
gfx950,256,512,4096,2048,asm,12,1,12.3486,_ZN5aiter42fp8gemm_bf16_blockscale_BpreShuffle_64x128E,695.62,1103.89,0.0
gfx950,256,1024,4096,1024,ck,14,0,12.7825,a8w8_blockscale_bpreshuffle_1x128x128_256x64x128x128_16x16_16x16_8x32x1_8x32x1_1x32x1x8_8_2x1_intrawave_v1,672.01,1066.42,0.0
gfx950,256,1024,4096,2048,asm,30,1,17.9537,_ZN5aiter43fp8gemm_bf16_blockscale_BpreShuffle_128x128E,956.9,1051.28,0.0
gfx950,256,2048,4096,1024,ck,13,3,20.7057,a8w8_blockscale_bpreshuffle_1x128x128_256x64x256x128_16x16_16x16_8x32x1_8x32x1_1x32x1x8_8_2x1_intrawave_v1,829.72,1114.12,0.0
gfx950,256,2048,4096,2048,ck,13,1,29.2873,a8w8_blockscale_bpreshuffle_1x128x128_256x64x256x128_16x16_16x16_8x32x1_8x32x1_1x32x1x8_8_2x1_intrawave_v1,1173.2,1002.49,0.0
gfx950,256,4096,4096,1024,ck,13,1,38.4552,a8w8_blockscale_bpreshuffle_1x128x128_256x64x256x128_16x16_16x16_8x32x1_8x32x1_1x32x1x8_8_2x1_intrawave_v1,893.5,1090.7,0.0
gfx950,256,4096,4096,2048,ck,13,3,52.8654,a8w8_blockscale_bpreshuffle_1x128x128_256x64x256x128_16x16_16x16_8x32x1_8x32x1_1x32x1x8_8_2x1_intrawave_v1,1299.9,952.07,0.0
gfx950,256,8192,4096,1024,ck,14,1,68.5991,a8w8_blockscale_bpreshuffle_1x128x128_256x64x128x128_16x16_16x16_8x32x1_8x32x1_1x32x1x8_8_2x1_intrawave_v1,1001.75,1161.7,0.0003
gfx950,256,8192,4096,2048,ck,13,0,98.0147,a8w8_blockscale_bpreshuffle_1x128x128_256x64x256x128_16x16_16x16_8x32x1_8x32x1_1x32x1x8_8_2x1_intrawave_v1,1402.23,941.44,0.0
gfx950,256,16384,4096,1024,ck,14,0,127.6182,a8w8_blockscale_bpreshuffle_1x128x128_256x64x128x128_16x16_16x16_8x32x1_8x32x1_1x32x1x8_8_2x1_intrawave_v1,1076.95,1216.04,0.0004
gfx950,256,16384,4096,2048,ck,13,3,183.5648,a8w8_blockscale_bpreshuffle_1x128x128_256x64x256x128_16x16_16x16_8x32x1_8x32x1_1x32x1x8_8_2x1_intrawave_v1,1497.44,959.67,0.0
gfx950,256,32768,4096,1024,ck,14,1,237.1793,a8w8_blockscale_bpreshuffle_1x128x128_256x64x128x128_16x16_16x16_8x32x1_8x32x1_1x32x1x8_8_2x1_intrawave_v1,1158.95,1290.94,0.0003
gfx950,256,32768,4096,2048,ck,13,1,345.9207,a8w8_blockscale_bpreshuffle_1x128x128_256x64x256x128_16x16_16x16_8x32x1_8x32x1_1x32x1x8_8_2x1_intrawave_v1,1589.25,994.25,0.0
gfx950,256,1,4352,4096,asm,6,7,8.075,_ZN5aiter42fp8gemm_bf16_blockscale_BpreShuffle_32x128E,4.42,2209.11,0.0
gfx950,256,2,4352,4096,asm,6,7,7.523,_ZN5aiter42fp8gemm_bf16_blockscale_BpreShuffle_32x128E,9.48,2372.91,0.0
gfx950,256,4,4352,4096,asm,6,7,9.7464,_ZN5aiter42fp8gemm_bf16_blockscale_BpreShuffle_32x128E,14.63,1834.21,0.0003
gfx950,256,8,4352,4096,asm,6,7,9.6398,_ZN5aiter42fp8gemm_bf16_blockscale_BpreShuffle_32x128E,29.59,1859.81,0.0001
gfx950,256,16,4352,4096,asm,6,7,8.5647,_ZN5aiter42fp8gemm_bf16_blockscale_BpreShuffle_32x128E,66.6,2105.22,0.0002
gfx950,256,32,4352,4096,asm,6,7,8.9224,_ZN5aiter42fp8gemm_bf16_blockscale_BpreShuffle_32x128E,127.86,2043.78,0.0002
gfx950,256,64,4352,4096,ck,7,1,11.2411,a8w8_blockscale_bpreshuffle_1x128x128_256x16x64x256_16x16_16x16_16x16x1_16x16x1_1x16x1x16_4_1x1_intrawave_v1,202.98,1658.64,0.0
gfx950,256,128,4352,4096,asm,18,3,13.6242,_ZN5aiter42fp8gemm_bf16_blockscale_BpreShuffle_64x128E,334.95,1428.65,0.0
gfx950,256,256,4352,4096,asm,33,2,18.5734,_ZN5aiter42fp8gemm_bf16_blockscale_BpreShuffle_96x128E,491.39,1136.17,0.0
gfx950,256,512,4352,4096,asm,24,1,21.6752,_ZN5aiter42fp8gemm_bf16_blockscale_BpreShuffle_80x128E,842.14,1124.76,0.0
gfx950,256,1024,4352,4096,ck,14,0,39.1913,a8w8_blockscale_bpreshuffle_1x128x128_256x64x128x128_16x16_16x16_8x32x1_8x32x1_1x32x1x8_8_2x1_intrawave_v1,931.51,789.28,0.0002
gfx950,256,2048,4352,4096,cktile,11,0,58.2844,a8w8_blockscale_cktile_192x256x128_4x2x1_16x16x128_intrawave_0x1x0_1,1252.73,755.61,0.0
gfx950,256,4096,4352,4096,ck,13,0,102.3257,a8w8_blockscale_bpreshuffle_1x128x128_256x64x256x128_16x16_16x16_8x32x1_8x32x1_1x32x1x8_8_2x1_intrawave_v1,1427.1,686.58,0.0
gfx950,256,8192,4352,4096,cktile,27,2,172.4752,a8w8_blockscale_cktile_192x256x128_4x2x1_16x16x128_intrawave_0x1x0_2,1693.33,711.31,0.0
gfx950,256,16384,4352,4096,ck,13,2,330.5067,a8w8_blockscale_bpreshuffle_1x128x128_256x64x256x128_16x16_16x16_8x32x1_8x32x1_1x32x1x8_8_2x1_intrawave_v1,1767.33,688.46,0.0
gfx950,256,32768,4352,4096,cktile,28,0,623.3898,a8w8_blockscale_cktile_192x256x128_4x2x1_16x16x128_intrawave_0x1x0_4,1874.0,701.42,0.0
gfx950,256,1,4608,2048,asm,4,6,6.6269,_ZN5aiter42fp8gemm_bf16_blockscale_BpreShuffle_32x128E,2.85,1425.77,0.0
gfx950,256,1,4608,4096,asm,6,7,8.9662,_ZN5aiter42fp8gemm_bf16_blockscale_BpreShuffle_32x128E,4.21,2106.54,0.0004
gfx950,256,2,4608,2048,asm,4,6,7.0506,_ZN5aiter42fp8gemm_bf16_blockscale_BpreShuffle_32x128E,5.35,1341.69,0.0
gfx950,256,2,4608,4096,asm,6,7,8.6091,_ZN5aiter42fp8gemm_bf16_blockscale_BpreShuffle_32x128E,8.77,2195.47,0.0
gfx950,256,4,4608,2048,ck,7,0,7.3386,a8w8_blockscale_bpreshuffle_1x128x128_256x16x64x256_16x16_16x16_16x16x1_16x16x1_1x16x1x16_4_1x1_intrawave_v1,10.29,1292.1,0.0
gfx950,256,4,4608,4096,asm,6,7,9.6183,_ZN5aiter42fp8gemm_bf16_blockscale_BpreShuffle_32x128E,15.7,1967.88,0.0
gfx950,256,8,4608,2048,ck,7,0,7.5215,a8w8_blockscale_bpreshuffle_1x128x128_256x16x64x256_16x16_16x16_16x16x1_16x16x1_1x16x1x16_4_1x1_intrawave_v1,20.08,1266.67,0.0
gfx950,256,8,4608,4096,asm,6,7,8.8436,_ZN5aiter42fp8gemm_bf16_blockscale_BpreShuffle_32x128E,34.15,2146.28,0.0002
gfx950,256,16,4608,2048,ck,7,0,7.28,a8w8_blockscale_bpreshuffle_1x128x128_256x16x64x256_16x16_16x16_16x16x1_16x16x1_1x16x1x16_4_1x1_intrawave_v1,41.48,1321.07,0.0
gfx950,256,16,4608,4096,asm,6,7,9.8806,_ZN5aiter42fp8gemm_bf16_blockscale_BpreShuffle_32x128E,61.13,1931.8,0.0002
gfx950,256,32,4608,2048,ck,7,0,7.7986,a8w8_blockscale_bpreshuffle_1x128x128_256x16x64x256_16x16_16x16_16x16x1_16x16x1_1x16x1x16_4_1x1_intrawave_v1,77.45,1256.33,0.0
gfx950,256,32,4608,4096,asm,6,7,9.301,_ZN5aiter42fp8gemm_bf16_blockscale_BpreShuffle_32x128E,129.87,2075.08,0.0002
gfx950,256,64,4608,2048,ck,12,2,7.9944,a8w8_blockscale_bpreshuffle_1x128x128_256x32x64x256_16x16_16x16_16x16x1_16x16x1_1x32x1x8_8_2x1_intrawave_v1,151.1,1270.65,0.0
gfx950,256,64,4608,4096,asm,20,5,10.7618,_ZN5aiter42fp8gemm_bf16_blockscale_BpreShuffle_64x128E,224.49,1833.0,0.0001
gfx950,256,128,4608,2048,ck,12,0,9.9319,a8w8_blockscale_bpreshuffle_1x128x128_256x32x64x256_16x16_16x16_16x16x1_16x16x1_1x32x1x8_8_2x1_intrawave_v1,243.25,1095.36,0.0
gfx950,256,128,4608,4096,asm,18,3,13.9308,_ZN5aiter42fp8gemm_bf16_blockscale_BpreShuffle_64x128E,346.85,1477.18,0.0
gfx950,256,256,4608,2048,asm,6,1,11.2009,_ZN5aiter42fp8gemm_bf16_blockscale_BpreShuffle_48x128E,431.38,1099.98,0.0
gfx950,256,256,4608,4096,asm,8,1,18.1441,_ZN5aiter42fp8gemm_bf16_blockscale_BpreShuffle_48x128E,532.61,1228.07,0.0
gfx950,256,512,4608,2048,asm,18,1,13.4175,_ZN5aiter42fp8gemm_bf16_blockscale_BpreShuffle_80x128E,720.23,1133.17,0.0
gfx950,256,512,4608,4096,asm,24,1,21.0081,_ZN5aiter42fp8gemm_bf16_blockscale_BpreShuffle_80x128E,920.0,1222.87,0.0
gfx950,256,1024,4608,2048,ck,14,0,23.4479,a8w8_blockscale_bpreshuffle_1x128x128_256x64x128x128_16x16_16x16_8x32x1_8x32x1_1x32x1x8_8_2x1_intrawave_v1,824.27,894.39,0.0002
gfx950,256,1024,4608,4096,ck,14,3,39.8348,a8w8_blockscale_bpreshuffle_1x128x128_256x64x128x128_16x16_16x16_8x32x1_8x32x1_1x32x1x8_8_2x1_intrawave_v1,970.38,816.02,0.0002
gfx950,256,2048,4608,2048,cktile,27,3,37.0792,a8w8_blockscale_cktile_192x256x128_4x2x1_16x16x128_intrawave_0x1x0_2,1042.49,876.66,0.0
gfx950,256,2048,4608,4096,cktile,11,1,57.4707,a8w8_blockscale_cktile_192x256x128_4x2x1_16x16x128_intrawave_0x1x0_1,1345.2,802.8,0.0
gfx950,256,4096,4608,2048,ck,13,3,62.7279,a8w8_blockscale_bpreshuffle_1x128x128_256x64x256x128_16x16_16x16_8x32x1_8x32x1_1x32x1x8_8_2x1_intrawave_v1,1232.46,885.96,0.0
gfx950,256,4096,4608,4096,ck,13,1,104.4286,a8w8_blockscale_bpreshuffle_1x128x128_256x64x256x128_16x16_16x16_8x32x1_8x32x1_1x32x1x8_8_2x1_intrawave_v1,1480.62,702.88,0.0
gfx950,256,8192,4608,2048,ck,13,2,110.6928,a8w8_blockscale_bpreshuffle_1x128x128_256x64x256x128_16x16_16x16_8x32x1_8x32x1_1x32x1x8_8_2x1_intrawave_v1,1396.83,918.87,0.0
gfx950,256,8192,4608,4096,cktile,27,2,182.7463,a8w8_blockscale_cktile_192x256x128_4x2x1_16x16x128_intrawave_0x1x0_2,1692.17,700.02,0.0
gfx950,256,16384,4608,2048,ck,13,3,195.9755,a8w8_blockscale_bpreshuffle_1x128x128_256x64x256x128_16x16_16x16_8x32x1_8x32x1_1x32x1x8_8_2x1_intrawave_v1,1577.94,989.85,0.0
gfx950,256,16384,4608,4096,cktile,28,0,334.3939,a8w8_blockscale_cktile_192x256x128_4x2x1_16x16x128_intrawave_0x1x0_4,1849.54,708.68,0.0
gfx950,256,32768,4608,2048,ck,13,2,374.3291,a8w8_blockscale_bpreshuffle_1x128x128_256x64x256x128_16x16_16x16_8x32x1_8x32x1_1x32x1x8_8_2x1_intrawave_v1,1652.22,1011.24,0.0
gfx950,256,32768,4608,4096,ck,13,2,663.3602,a8w8_blockscale_bpreshuffle_1x128x128_256x64x256x128_16x16_16x16_8x32x1_8x32x1_1x32x1x8_8_2x1_intrawave_v1,1864.67,686.03,0.0
gfx950,256,1,5120,4096,asm,5,6,8.2905,_ZN5aiter42fp8gemm_bf16_blockscale_BpreShuffle_32x128E,5.06,2531.31,0.001
gfx950,256,2,5120,4096,asm,4,5,9.9747,_ZN5aiter42fp8gemm_bf16_blockscale_BpreShuffle_32x128E,8.41,2105.35,0.0002
gfx950,256,4,5120,4096,asm,4,5,10.2768,_ZN5aiter42fp8gemm_bf16_blockscale_BpreShuffle_32x128E,16.33,2046.25,0.0001
gfx950,256,8,5120,4096,asm,4,5,9.4352,_ZN5aiter42fp8gemm_bf16_blockscale_BpreShuffle_32x128E,35.56,2234.84,0.0
gfx950,256,16,5120,4096,asm,5,6,10.5649,_ZN5aiter42fp8gemm_bf16_blockscale_BpreShuffle_32x128E,63.52,2006.73,0.0001
gfx950,256,32,5120,4096,asm,4,5,9.9458,_ZN5aiter42fp8gemm_bf16_blockscale_BpreShuffle_32x128E,134.95,2154.71,0.0001
gfx950,256,64,5120,4096,asm,19,4,11.8787,_ZN5aiter42fp8gemm_bf16_blockscale_BpreShuffle_64x128E,225.98,1842.71,0.0
gfx950,256,128,5120,4096,asm,18,3,14.0306,_ZN5aiter42fp8gemm_bf16_blockscale_BpreShuffle_64x128E,382.64,1625.48,0.0
gfx950,256,256,5120,4096,asm,8,1,18.0466,_ZN5aiter42fp8gemm_bf16_blockscale_BpreShuffle_48x128E,594.98,1365.44,0.0
gfx950,256,512,5120,4096,asm,32,1,22.8818,_ZN5aiter42fp8gemm_bf16_blockscale_BpreShuffle_96x128E,938.51,1237.3,0.0
gfx950,256,1024,5120,4096,ck,14,3,41.2478,a8w8_blockscale_bpreshuffle_1x128x128_256x64x128x128_16x16_16x16_8x32x1_8x32x1_1x32x1x8_8_2x1_intrawave_v1,1041.26,864.33,0.0002
gfx950,256,2048,5120,4096,cktile,28,2,57.5062,a8w8_blockscale_cktile_192x256x128_4x2x1_16x16x128_intrawave_0x1x0_3,1493.74,875.24,0.0
gfx950,256,4096,5120,4096,ck,13,3,108.1203,a8w8_blockscale_bpreshuffle_1x128x128_256x64x256x128_16x16_16x16_8x32x1_8x32x1_1x32x1x8_8_2x1_intrawave_v1,1588.96,737.07,0.0
gfx950,256,8192,5120,4096,ck,13,3,196.9417,a8w8_blockscale_bpreshuffle_1x128x128_256x64x256x128_16x16_16x16_8x32x1_8x32x1_1x32x1x8_8_2x1_intrawave_v1,1744.67,702.81,0.0
gfx950,256,16384,5120,4096,ck,13,3,378.4297,a8w8_blockscale_bpreshuffle_1x128x128_256x64x256x128_16x16_16x16_8x32x1_8x32x1_1x32x1x8_8_2x1_intrawave_v1,1815.91,676.09,0.0
gfx950,256,32768,5120,4096,ck,13,0,739.9087,a8w8_blockscale_bpreshuffle_1x128x128_256x64x256x128_16x16_16x16_8x32x1_8x32x1_1x32x1x8_8_2x1_intrawave_v1,1857.51,663.24,0.0
gfx950,256,1,6144,2048,asm,3,4,6.3955,_ZN5aiter42fp8gemm_bf16_blockscale_BpreShuffle_32x128E,3.93,1969.7,0.0
gfx950,256,2,6144,2048,ck,7,0,7.8348,a8w8_blockscale_bpreshuffle_1x128x128_256x16x64x256_16x16_16x16_16x16x1_16x16x1_1x16x1x16_4_1x1_intrawave_v1,6.42,1609.69,0.0
gfx950,256,4,6144,2048,asm,3,4,7.4763,_ZN5aiter42fp8gemm_bf16_blockscale_BpreShuffle_32x128E,13.46,1690.71,0.0
gfx950,256,8,6144,2048,ck,7,0,7.9833,a8w8_blockscale_bpreshuffle_1x128x128_256x16x64x256_16x16_16x16_16x16x1_16x16x1_1x16x1x16_4_1x1_intrawave_v1,25.22,1590.52,0.0
gfx950,256,16,6144,2048,ck,7,0,7.3427,a8w8_blockscale_bpreshuffle_1x128x128_256x16x64x256_16x16_16x16_16x16x1_16x16x1_1x16x1x16_4_1x1_intrawave_v1,54.84,1744.9,0.0
gfx950,256,32,6144,2048,ck,7,3,7.5307,a8w8_blockscale_bpreshuffle_1x128x128_256x16x64x256_16x16_16x16_16x16x1_16x16x1_1x16x1x16_4_1x1_intrawave_v1,106.94,1731.8,0.0
gfx950,256,64,6144,2048,ck,12,0,8.1218,a8w8_blockscale_bpreshuffle_1x128x128_256x32x64x256_16x16_16x16_16x16x1_16x16x1_1x32x1x8_8_2x1_intrawave_v1,198.31,1662.24,0.0
gfx950,256,128,6144,2048,ck,17,2,9.5481,a8w8_blockscale_bpreshuffle_1x128x128_256x64x64x256_16x16_16x16_16x16x1_16x16x1_1x32x1x8_8_2x1_intrawave_v1,337.37,1510.03,0.0
gfx950,256,256,6144,2048,asm,12,1,12.2603,_ZN5aiter42fp8gemm_bf16_blockscale_BpreShuffle_64x128E,525.47,1325.66,0.0
gfx950,256,512,6144,2048,ck,15,1,16.8983,a8w8_blockscale_bpreshuffle_1x128x128_256x64x64x128_16x16_16x16_8x32x1_8x32x1_1x32x1x8_8_2x1_intrawave_v1,762.5,1178.99,0.0024
gfx950,256,1024,6144,2048,ck,14,0,24.9928,a8w8_blockscale_bpreshuffle_1x128x128_256x64x128x128_16x16_16x16_8x32x1_8x32x1_1x32x1x8_8_2x1_intrawave_v1,1031.09,1090.83,0.0002
gfx950,256,2048,6144,2048,ck,13,0,44.574,a8w8_blockscale_bpreshuffle_1x128x128_256x64x256x128_16x16_16x16_8x32x1_8x32x1_1x32x1x8_8_2x1_intrawave_v1,1156.27,940.98,0.0
gfx950,256,4096,6144,2048,ck,13,1,76.2737,a8w8_blockscale_bpreshuffle_1x128x128_256x64x256x128_16x16_16x16_8x32x1_8x32x1_1x32x1x8_8_2x1_intrawave_v1,1351.44,934.83,0.0
gfx950,256,8192,6144,2048,ck,13,2,139.0457,a8w8_blockscale_bpreshuffle_1x128x128_256x64x256x128_16x16_16x16_8x32x1_8x32x1_1x32x1x8_8_2x1_intrawave_v1,1482.67,935.11,0.0
gfx950,256,16384,6144,2048,ck,13,3,255.1762,a8w8_blockscale_bpreshuffle_1x128x128_256x64x256x128_16x16_16x16_8x32x1_8x32x1_1x32x1x8_8_2x1_intrawave_v1,1615.81,969.78,0.0
gfx950,256,32768,6144,2048,ck,13,0,500.76,a8w8_blockscale_bpreshuffle_1x128x128_256x64x256x128_16x16_16x16_8x32x1_8x32x1_1x32x1x8_8_2x1_intrawave_v1,1646.76,963.23,0.0
gfx950,256,1,8704,4096,asm,2,3,13.5796,_ZN5aiter42fp8gemm_bf16_blockscale_BpreShuffle_32x128E,5.25,2626.96,0.0
gfx950,256,2,8704,4096,asm,18,3,13.3302,_ZN5aiter42fp8gemm_bf16_blockscale_BpreShuffle_64x128E,10.7,2677.72,0.0
gfx950,256,4,8704,4096,asm,18,3,13.4589,_ZN5aiter42fp8gemm_bf16_blockscale_BpreShuffle_64x128E,21.19,2655.31,0.0
gfx950,256,8,8704,4096,ck,7,0,13.631,a8w8_blockscale_bpreshuffle_1x128x128_256x16x64x256_16x16_16x16_16x16x1_16x16x1_1x16x1x16_4_1x1_intrawave_v1,41.85,2628.1,0.0
gfx950,256,16,8704,4096,ck,7,0,12.8177,a8w8_blockscale_bpreshuffle_1x128x128_256x16x64x256_16x16_16x16_16x16x1_16x16x1_1x16x1x16_4_1x1_intrawave_v1,89.01,2808.28,0.0
gfx950,256,32,8704,4096,asm,2,3,12.3668,_ZN5aiter42fp8gemm_bf16_blockscale_BpreShuffle_32x128E,184.5,2938.49,0.0
gfx950,256,64,8704,4096,asm,18,3,14.5234,_ZN5aiter42fp8gemm_bf16_blockscale_BpreShuffle_64x128E,314.21,2549.53,0.0
gfx950,256,128,8704,4096,asm,42,3,18.9532,_ZN5aiter43fp8gemm_bf16_blockscale_BpreShuffle_128x128E,481.54,2026.26,0.0
gfx950,256,256,8704,4096,asm,32,1,23.0846,_ZN5aiter42fp8gemm_bf16_blockscale_BpreShuffle_96x128E,790.73,1782.86,0.0
gfx950,256,512,8704,4096,ck,14,1,40.4899,a8w8_blockscale_bpreshuffle_1x128x128_256x64x128x128_16x16_16x16_8x32x1_8x32x1_1x32x1x8_8_2x1_intrawave_v1,901.64,1152.43,0.0003
gfx950,256,1024,8704,4096,cktile,27,3,58.0496,a8w8_blockscale_cktile_192x256x128_4x2x1_16x16x128_intrawave_0x1x0_2,1257.79,993.49,0.0
gfx950,256,2048,8704,4096,ck,13,2,107.5541,a8w8_blockscale_bpreshuffle_1x128x128_256x64x256x128_16x16_16x16_8x32x1_8x32x1_1x32x1x8_8_2x1_intrawave_v1,1357.72,740.95,0.0
gfx950,256,4096,8704,4096,cktile,27,3,172.2355,a8w8_blockscale_cktile_192x256x128_4x2x1_16x16x128_intrawave_0x1x0_2,1695.69,718.39,0.0
gfx950,256,8192,8704,4096,ck,13,3,324.4164,a8w8_blockscale_bpreshuffle_1x128x128_256x64x256x128_16x16_16x16_8x32x1_8x32x1_1x32x1x8_8_2x1_intrawave_v1,1800.51,652.9,0.0
gfx950,256,16384,8704,4096,cktile,26,0,625.4187,a8w8_blockscale_cktile_192x256x128_4x2x1_16x16x128_intrawave_0x1x0_2,1867.92,620.34,0.0
gfx950,256,32768,8704,4096,cktile,26,0,1226.8874,a8w8_blockscale_cktile_192x256x128_4x2x1_16x16x128_intrawave_0x1x0_2,1904.38,603.39,0.0
gfx950,256,1,9216,2048,ck,7,0,7.7504,a8w8_blockscale_bpreshuffle_1x128x128_256x16x64x256_16x16_16x16_16x16x1_16x16x1_1x16x1x16_4_1x1_intrawave_v1,4.87,2437.92,0.0
gfx950,256,2,9216,2048,ck,7,0,7.4979,a8w8_blockscale_bpreshuffle_1x128x128_256x16x64x256_16x16_16x16_16x16x1_16x16x1_1x16x1x16_4_1x1_intrawave_v1,10.07,2522.75,0.0
gfx950,256,4,9216,2048,ck,7,0,7.9418,a8w8_blockscale_bpreshuffle_1x128x128_256x16x64x256_16x16_16x16_16x16x1_16x16x1_1x16x1x16_4_1x1_intrawave_v1,19.01,2386.9,0.0
gfx950,256,8,9216,2048,ck,7,0,7.4624,a8w8_blockscale_bpreshuffle_1x128x128_256x16x64x256_16x16_16x16_16x16x1_16x16x1_1x16x1x16_4_1x1_intrawave_v1,40.47,2551.22,0.0
gfx950,256,16,9216,2048,ck,7,0,7.5502,a8w8_blockscale_bpreshuffle_1x128x128_256x16x64x256_16x16_16x16_16x16x1_16x16x1_1x16x1x16_4_1x1_intrawave_v1,80.0,2543.25,0.0
gfx950,256,32,9216,2048,ck,7,0,8.2702,a8w8_blockscale_bpreshuffle_1x128x128_256x16x64x256_16x16_16x16_16x16x1_16x16x1_1x16x1x16_4_1x1_intrawave_v1,146.06,2361.46,0.0
gfx950,256,64,9216,2048,ck,17,0,9.7695,a8w8_blockscale_bpreshuffle_1x128x128_256x64x64x256_16x16_16x16_16x16x1_16x16x1_1x32x1x8_8_2x1_intrawave_v1,247.29,2066.13,0.0
gfx950,256,128,9216,2048,asm,6,1,11.855,_ZN5aiter42fp8gemm_bf16_blockscale_BpreShuffle_48x128E,407.58,1813.23,0.0
gfx950,256,256,9216,2048,asm,24,1,14.4836,_ZN5aiter42fp8gemm_bf16_blockscale_BpreShuffle_96x128E,667.22,1665.14,0.0
gfx950,256,512,9216,2048,ck,14,0,23.691,a8w8_blockscale_bpreshuffle_1x128x128_256x64x128x128_16x16_16x16_8x32x1_8x32x1_1x32x1x8_8_2x1_intrawave_v1,815.81,1239.29,0.0002
gfx950,256,1024,9216,2048,cktile,26,0,37.0071,a8w8_blockscale_cktile_192x256x128_4x2x1_16x16x128_intrawave_0x1x0_2,1044.52,1076.71,0.0
gfx950,256,2048,9216,2048,ck,13,3,65.8827,a8w8_blockscale_bpreshuffle_1x128x128_256x64x256x128_16x16_16x16_8x32x1_8x32x1_1x32x1x8_8_2x1_intrawave_v1,1173.44,923.12,0.0
gfx950,256,4096,9216,2048,ck,13,0,108.3322,a8w8_blockscale_bpreshuffle_1x128x128_256x64x256x128_16x16_16x16_8x32x1_8x32x1_1x32x1x8_8_2x1_intrawave_v1,1427.27,948.57,0.0
gfx950,256,8192,9216,2048,ck,13,3,200.1597,a8w8_blockscale_bpreshuffle_1x128x128_256x64x256x128_16x16_16x16_8x32x1_8x32x1_1x32x1x8_8_2x1_intrawave_v1,1544.95,932.49,0.0
gfx950,256,16384,9216,2048,ck,13,0,371.3158,a8w8_blockscale_bpreshuffle_1x128x128_256x64x256x128_16x16_16x16_8x32x1_8x32x1_1x32x1x8_8_2x1_intrawave_v1,1665.63,954.49,0.0
gfx950,256,32768,9216,2048,ck,13,0,726.1403,a8w8_blockscale_bpreshuffle_1x128x128_256x64x256x128_16x16_16x16_8x32x1_8x32x1_1x32x1x8_8_2x1_intrawave_v1,1703.46,950.18,0.0
gfx950,256,1,10240,4096,ck,7,0,14.125,a8w8_blockscale_bpreshuffle_1x128x128_256x16x64x256_16x16_16x16_16x16x1_16x16x1_1x16x1x16_4_1x1_intrawave_v1,5.94,2971.16,0.0
gfx950,256,2,10240,4096,ck,7,0,14.5233,a8w8_blockscale_bpreshuffle_1x128x128_256x16x64x256_16x16_16x16_16x16x1_16x16x1_1x16x1x16_4_1x1_intrawave_v1,11.55,2891.37,0.0
gfx950,256,4,10240,4096,asm,2,3,13.31,_ZN5aiter42fp8gemm_bf16_blockscale_BpreShuffle_32x128E,25.21,3158.63,0.0
gfx950,256,8,10240,4096,asm,2,3,13.3759,_ZN5aiter42fp8gemm_bf16_blockscale_BpreShuffle_32x128E,50.17,3150.42,0.0
gfx950,256,16,10240,4096,ck,7,1,12.9358,a8w8_blockscale_bpreshuffle_1x128x128_256x16x64x256_16x16_16x16_16x16x1_16x16x1_1x16x1x16_4_1x1_intrawave_v1,103.76,3272.8,0.0
gfx950,256,32,10240,4096,ck,12,0,14.0676,a8w8_blockscale_bpreshuffle_1x128x128_256x32x64x256_16x16_16x16_16x16x1_16x16x1_1x32x1x8_8_2x1_intrawave_v1,190.82,3037.44,0.0
gfx950,256,64,10240,4096,ck,17,3,15.9835,a8w8_blockscale_bpreshuffle_1x128x128_256x64x64x256_16x16_16x16_16x16x1_16x16x1_1x32x1x8_8_2x1_intrawave_v1,335.89,2722.55,0.0
gfx950,256,128,10240,4096,asm,8,1,19.5641,_ZN5aiter42fp8gemm_bf16_blockscale_BpreShuffle_48x128E,548.83,2304.67,0.0
gfx950,256,256,10240,4096,asm,32,1,23.7433,_ZN5aiter42fp8gemm_bf16_blockscale_BpreShuffle_96x128E,904.46,2031.5,0.0
gfx950,256,512,10240,4096,ck,14,2,42.3866,a8w8_blockscale_bpreshuffle_1x128x128_256x64x128x128_16x16_16x16_8x32x1_8x32x1_1x32x1x8_8_2x1_intrawave_v1,1013.28,1286.4,0.0002
gfx950,256,1024,10240,4096,cktile,27,0,57.7598,a8w8_blockscale_cktile_192x256x128_4x2x1_16x16x128_intrawave_0x1x0_2,1487.18,1161.86,0.0
gfx950,256,2048,10240,4096,cktile,11,2,111.5732,a8w8_blockscale_cktile_192x256x128_4x2x1_16x16x128_intrawave_0x1x0_1,1539.78,827.03,0.0
gfx950,256,4096,10240,4096,ck,13,2,199.4126,a8w8_blockscale_bpreshuffle_1x128x128_256x64x256x128_16x16_16x16_8x32x1_8x32x1_1x32x1x8_8_2x1_intrawave_v1,1723.05,715.13,0.0
gfx950,256,8192,10240,4096,ck,13,1,375.5395,a8w8_blockscale_bpreshuffle_1x128x128_256x64x256x128_16x16_16x16_8x32x1_8x32x1_1x32x1x8_8_2x1_intrawave_v1,1829.89,647.79,0.0
gfx950,256,16384,10240,4096,cktile,27,0,704.2104,a8w8_blockscale_cktile_192x256x128_4x2x1_16x16x128_intrawave_0x1x0_3,1951.67,631.34,0.0
gfx950,256,32768,10240,4096,cktile,27,3,1400.2882,a8w8_blockscale_cktile_192x256x128_4x2x1_16x16x128_intrawave_0x1x0_2,1963.01,605.05,0.0
gfx950,256,1,12288,2048,ck,7,0,8.545,a8w8_blockscale_bpreshuffle_1x128x128_256x16x64x256_16x16_16x16_16x16x1_16x16x1_1x16x1x16_4_1x1_intrawave_v1,5.89,2948.21,0.0
gfx950,256,2,12288,2048,ck,7,0,8.9331,a8w8_blockscale_bpreshuffle_1x128x128_256x16x64x256_16x16_16x16_16x16x1_16x16x1_1x16x1x16_4_1x1_intrawave_v1,11.27,2823.1,0.0
gfx950,256,4,12288,2048,ck,7,0,8.6807,a8w8_blockscale_bpreshuffle_1x128x128_256x16x64x256_16x16_16x16_16x16x1_16x16x1_1x16x1x16_4_1x1_intrawave_v1,23.19,2911.32,0.0
gfx950,256,8,12288,2048,ck,7,0,8.4403,a8w8_blockscale_bpreshuffle_1x128x128_256x16x64x256_16x16_16x16_16x16x1_16x16x1_1x16x1x16_4_1x1_intrawave_v1,47.71,3006.86,0.0
gfx950,256,16,12288,2048,ck,7,0,7.8145,a8w8_blockscale_bpreshuffle_1x128x128_256x16x64x256_16x16_16x16_16x16x1_16x16x1_1x16x1x16_4_1x1_intrawave_v1,103.05,3274.91,0.0
gfx950,256,32,12288,2048,ck,12,3,9.0097,a8w8_blockscale_bpreshuffle_1x128x128_256x32x64x256_16x16_16x16_16x16x1_16x16x1_1x32x1x8_8_2x1_intrawave_v1,178.76,2887.75,0.0
gfx950,256,64,12288,2048,ck,11,0,10.7084,a8w8_blockscale_bpreshuffle_1x128x128_256x32x128x256_16x16_16x16_16x16x1_16x16x1_1x32x1x8_8_2x1_intrawave_v1,300.81,2509.22,0.0
gfx950,256,128,12288,2048,asm,12,1,12.9665,_ZN5aiter42fp8gemm_bf16_blockscale_BpreShuffle_64x128E,496.85,2203.66,0.0
gfx950,256,256,12288,2048,asm,30,1,17.8942,_ZN5aiter43fp8gemm_bf16_blockscale_BpreShuffle_128x128E,720.06,1787.26,0.0
gfx950,256,512,12288,2048,ck,14,3,24.4608,a8w8_blockscale_bpreshuffle_1x128x128_256x64x128x128_16x16_16x16_8x32x1_8x32x1_1x32x1x8_8_2x1_intrawave_v1,1053.51,1586.1,0.0003
gfx950,256,1024,12288,2048,ck,13,2,44.3599,a8w8_blockscale_bpreshuffle_1x128x128_256x64x256x128_16x16_16x16_8x32x1_8x32x1_1x32x1x8_8_2x1_intrawave_v1,1161.85,1181.9,0.0
gfx950,256,2048,12288,2048,ck,13,3,78.6704,a8w8_blockscale_bpreshuffle_1x128x128_256x64x256x128_16x16_16x16_8x32x1_8x32x1_1x32x1x8_8_2x1_intrawave_v1,1310.27,1012.98,0.0
gfx950,256,4096,12288,2048,ck,13,2,141.1312,a8w8_blockscale_bpreshuffle_1x128x128_256x64x256x128_16x16_16x16_8x32x1_8x32x1_1x32x1x8_8_2x1_intrawave_v1,1460.76,951.01,0.0
gfx950,256,8192,12288,2048,ck,13,0,256.7749,a8w8_blockscale_bpreshuffle_1x128x128_256x64x256x128_16x16_16x16_8x32x1_8x32x1_1x32x1x8_8_2x1_intrawave_v1,1605.75,947.4,0.0
gfx950,256,16384,12288,2048,ck,13,0,500.4659,a8w8_blockscale_bpreshuffle_1x128x128_256x64x256x128_16x16_16x16_8x32x1_8x32x1_1x32x1x8_8_2x1_intrawave_v1,1647.73,921.89,0.0
gfx950,256,32768,12288,2048,ck,13,3,968.8395,a8w8_blockscale_bpreshuffle_1x128x128_256x64x256x128_16x16_16x16_8x32x1_8x32x1_1x32x1x8_8_2x1_intrawave_v1,1702.31,926.45,0.0
gfx950,256,1,17408,4096,ck,7,3,17.0902,a8w8_blockscale_bpreshuffle_1x128x128_256x16x64x256_16x16_16x16_16x16x1_16x16x1_1x16x1x16_4_1x1_intrawave_v1,8.34,4174.44,0.0
gfx950,256,2,17408,4096,ck,7,0,16.4033,a8w8_blockscale_bpreshuffle_1x128x128_256x16x64x256_16x16_16x16_16x16x1_16x16x1_1x16x1x16_4_1x1_intrawave_v1,17.39,4351.62,0.0
gfx950,256,4,17408,4096,ck,7,0,16.5658,a8w8_blockscale_bpreshuffle_1x128x128_256x16x64x256_16x16_16x16_16x16x1_16x16x1_1x16x1x16_4_1x1_intrawave_v1,34.43,4313.64,0.0
gfx950,256,8,17408,4096,ck,7,0,16.643,a8w8_blockscale_bpreshuffle_1x128x128_256x16x64x256_16x16_16x16_16x16x1_16x16x1_1x16x1x16_4_1x1_intrawave_v1,68.55,4302.98,0.0
gfx950,256,16,17408,4096,ck,7,0,16.8605,a8w8_blockscale_bpreshuffle_1x128x128_256x16x64x256_16x16_16x16_16x16x1_16x16x1_1x16x1x16_4_1x1_intrawave_v1,135.33,4265.93,0.0
gfx950,256,32,17408,4096,ck,12,0,19.4233,a8w8_blockscale_bpreshuffle_1x128x128_256x32x64x256_16x16_16x16_16x16x1_16x16x1_1x32x1x8_8_2x1_intrawave_v1,234.94,3735.12,0.0
gfx950,256,64,17408,4096,ck,10,0,23.5642,a8w8_blockscale_bpreshuffle_1x128x128_256x32x64x128_16x16_16x16_8x32x1_8x32x1_1x32x1x8_8_2x1_intrawave_v1,387.32,3131.6,0.0206
gfx950,256,128,17408,4096,asm,40,1,29.419,_ZN5aiter43fp8gemm_bf16_blockscale_BpreShuffle_128x128E,620.47,2593.01,0.0
gfx950,256,256,17408,4096,ck,14,0,41.891,a8w8_blockscale_bpreshuffle_1x128x128_256x64x128x128_16x16_16x16_8x32x1_8x32x1_1x32x1x8_8_2x1_intrawave_v1,871.48,1939.91,0.0002
gfx950,256,512,17408,4096,cktile,26,0,57.9873,a8w8_blockscale_cktile_192x256x128_4x2x1_16x16x128_intrawave_0x1x0_2,1259.15,1573.21,0.0
gfx950,256,1024,17408,4096,ck,13,1,106.6303,a8w8_blockscale_bpreshuffle_1x128x128_256x64x256x128_16x16_16x16_8x32x1_8x32x1_1x32x1x8_8_2x1_intrawave_v1,1369.49,1042.38,0.0
gfx950,256,2048,17408,4096,cktile,11,0,171.7418,a8w8_blockscale_cktile_192x256x128_4x2x1_16x16x128_intrawave_0x1x0_1,1700.56,879.2,0.0
gfx950,256,4096,17408,4096,ck,13,0,321.4585,a8w8_blockscale_bpreshuffle_1x128x128_256x64x256x128_16x16_16x16_8x32x1_8x32x1_1x32x1x8_8_2x1_intrawave_v1,1817.08,717.63,0.0
gfx950,256,8192,17408,4096,cktile,11,0,617.9339,a8w8_blockscale_cktile_192x256x128_4x2x1_16x16x128_intrawave_0x1x0_1,1890.54,631.25,0.0
gfx950,256,16384,17408,4096,ck,13,0,1208.8428,a8w8_blockscale_bpreshuffle_1x128x128_256x64x256x128_16x16_16x16_8x32x1_8x32x1_1x32x1x8_8_2x1_intrawave_v1,1932.81,586.38,0.0
gfx950,256,32768,17408,4096,cktile,27,0,2389.7849,a8w8_blockscale_cktile_192x256x128_4x2x1_16x16x128_intrawave_0x1x0_3,1955.37,563.39,0.0
gfx950,256,1,20480,4096,ck,7,2,17.5701,a8w8_blockscale_bpreshuffle_1x128x128_256x16x64x256_16x16_16x16_16x16x1_16x16x1_1x16x1x16_4_1x1_intrawave_v1,9.55,4776.93,0.0
gfx950,256,2,20480,4096,ck,7,3,17.1976,a8w8_blockscale_bpreshuffle_1x128x128_256x16x64x256_16x16_16x16_16x16x1_16x16x1_1x16x1x16_4_1x1_intrawave_v1,19.51,4883.02,0.0
gfx950,256,4,20480,4096,ck,7,0,17.4998,a8w8_blockscale_bpreshuffle_1x128x128_256x16x64x256_16x16_16x16_16x16x1_16x16x1_1x16x1x16_4_1x1_intrawave_v1,38.35,4803.84,0.0
gfx950,256,8,20480,4096,ck,7,0,17.5819,a8w8_blockscale_bpreshuffle_1x128x128_256x16x64x256_16x16_16x16_16x16x1_16x16x1_1x16x1x16_4_1x1_intrawave_v1,76.34,4791.66,0.0
gfx950,256,16,20480,4096,ck,7,3,17.685,a8w8_blockscale_bpreshuffle_1x128x128_256x16x64x256_16x16_16x16_16x16x1_16x16x1_1x16x1x16_4_1x1_intrawave_v1,151.79,4784.11,0.0
gfx950,256,32,20480,4096,ck,12,0,20.1716,a8w8_blockscale_bpreshuffle_1x128x128_256x32x64x256_16x16_16x16_16x16x1_16x16x1_1x32x1x8_8_2x1_intrawave_v1,266.15,4230.1,0.0
gfx950,256,64,20480,4096,ck,15,3,24.7803,a8w8_blockscale_bpreshuffle_1x128x128_256x64x64x128_16x16_16x16_8x32x1_8x32x1_1x32x1x8_8_2x1_intrawave_v1,433.3,3501.56,0.0009
gfx950,256,128,20480,4096,asm,40,1,30.4702,_ZN5aiter43fp8gemm_bf16_blockscale_BpreShuffle_128x128E,704.78,2942.33,0.0
gfx950,256,256,20480,4096,ck,14,0,43.8044,a8w8_blockscale_bpreshuffle_1x128x128_256x64x128x128_16x16_16x16_8x32x1_8x32x1_1x32x1x8_8_2x1_intrawave_v1,980.49,2178.33,0.0003
gfx950,256,512,20480,4096,cktile,26,0,58.6077,a8w8_blockscale_cktile_192x256x128_4x2x1_16x16x128_intrawave_0x1x0_2,1465.67,1824.93,0.0
gfx950,256,1024,20480,4096,ck,13,2,112.0828,a8w8_blockscale_bpreshuffle_1x128x128_256x64x256x128_16x16_16x16_8x32x1_8x32x1_1x32x1x8_8_2x1_intrawave_v1,1532.78,1160.07,0.0
gfx950,256,2048,20480,4096,cktile,11,3,197.2942,a8w8_blockscale_cktile_192x256x128_4x2x1_16x16x128_intrawave_0x1x0_1,1741.55,892.88,0.0
gfx950,256,4096,20480,4096,cktile,28,0,371.7097,a8w8_blockscale_cktile_192x256x128_4x2x1_16x16x128_intrawave_0x1x0_4,1848.74,722.16,0.0
gfx950,256,8192,20480,4096,cktile,29,1,707.2878,a8w8_blockscale_cktile_192x256x128_4x2x1_16x16x128_intrawave_0x1x0_4,1943.18,640.45,0.0
gfx950,256,16384,20480,4096,cktile,27,0,1387.4271,a8w8_blockscale_cktile_192x256x128_4x2x1_16x16x128_intrawave_0x1x0_3,1981.21,592.52,0.0
gfx950,256,32768,20480,4096,cktile,28,0,2721.3003,a8w8_blockscale_cktile_192x256x128_4x2x1_16x16x128_intrawave_0x1x0_4,2020.2,573.36,0.0
