aiter/configs/model_configs/a8w8_blockscale_tuned_gemm_qwen3_vl_235b_tp4.csv
gfx,cu_num,M,N,K,libtype,kernelId,splitK,us,kernelName,tflops,bw,errRatio
gfx942,304,16,2304,4096,ck,8,0,15.0407,a8w8_blockscale_1x128x128_256x16x64x256_16x16_16x16_1x1_16x16x1_16x16x1_1x16x1x16_4_1x1_intrawave_v1,20.08,636.7,0.0
gfx942,304,32,2304,4096,ck,8,0,15.0376,a8w8_blockscale_1x128x128_256x16x64x256_16x16_16x16_1x1_16x16x1_16x16x1_1x16x1x16_4_1x1_intrawave_v1,40.16,646.09,0.0
gfx942,304,48,2304,4096,ck,8,0,14.8863,a8w8_blockscale_1x128x128_256x16x64x256_16x16_16x16_1x1_16x16x1_16x16x1_1x16x1x16_4_1x1_intrawave_v1,60.86,662.02,0.0
gfx942,304,64,2304,4096,ck,8,0,14.6362,a8w8_blockscale_1x128x128_256x16x64x256_16x16_16x16_1x1_16x16x1_16x16x1_1x16x1x16_4_1x1_intrawave_v1,82.53,682.84,0.0
gfx942,304,80,2304,4096,ck,8,0,14.8649,a8w8_blockscale_1x128x128_256x16x64x256_16x16_16x16_1x1_16x16x1_16x16x1_1x16x1x16_4_1x1_intrawave_v1,101.58,681.71,0.0
gfx942,304,96,2304,4096,ck,8,0,14.7977,a8w8_blockscale_1x128x128_256x16x64x256_16x16_16x16_1x1_16x16x1_16x16x1_1x16x1x16_4_1x1_intrawave_v1,122.45,694.21,0.0
gfx942,304,112,2304,4096,ck,8,0,14.8091,a8w8_blockscale_1x128x128_256x16x64x256_16x16_16x16_1x1_16x16x1_16x16x1_1x16x1x16_4_1x1_intrawave_v1,142.75,703.08,0.0
gfx942,304,128,2304,4096,ck,8,0,15.0141,a8w8_blockscale_1x128x128_256x16x64x256_16x16_16x16_1x1_16x16x1_16x16x1_1x16x1x16_4_1x1_intrawave_v1,160.91,702.76,0.0
gfx942,304,144,2304,4096,ck,18,0,19.7526,a8w8_blockscale_1x128x128_256x64x64x256_16x16_32x32_1x1_16x16x1_16x16x1_1x32x1x8_8_1x1_intrawave_v1,137.6,541.22,0.0
gfx942,304,160,2304,4096,ck,18,0,19.8015,a8w8_blockscale_1x128x128_256x64x64x256_16x16_32x32_1x1_16x16x1_16x16x1_1x32x1x8_8_1x1_intrawave_v1,152.51,546.92,0.0
gfx942,304,176,2304,4096,ck,18,0,19.9156,a8w8_blockscale_1x128x128_256x64x64x256_16x16_32x32_1x1_16x16x1_16x16x1_1x32x1x8_8_1x1_intrawave_v1,166.8,550.78,0.0
gfx942,304,192,2304,4096,ck,18,0,18.7668,a8w8_blockscale_1x128x128_256x64x64x256_16x16_32x32_1x1_16x16x1_16x16x1_1x32x1x8_8_1x1_intrawave_v1,193.1,591.92,0.0
gfx942,304,208,2304,4096,ck,13,0,20.1257,a8w8_blockscale_1x128x128_256x32x64x256_16x16_16x16_2x1_16x16x1_16x16x1_1x32x1x8_8_2x1_intrawave_v1,195.07,558.87,0.0
gfx942,304,224,2304,4096,ck,18,0,19.801,a8w8_blockscale_1x128x128_256x64x64x256_16x16_32x32_1x1_16x16x1_16x16x1_1x32x1x8_8_1x1_intrawave_v1,213.52,575.07,0.0
gfx942,304,240,2304,4096,ck,18,0,20.0049,a8w8_blockscale_1x128x128_256x64x64x256_16x16_32x32_1x1_16x16x1_16x16x1_1x32x1x8_8_1x1_intrawave_v1,226.44,576.17,0.0
gfx942,304,256,2304,4096,ck,18,0,19.0042,a8w8_blockscale_1x128x128_256x64x64x256_16x16_32x32_1x1_16x16x1_16x16x1_1x32x1x8_8_1x1_intrawave_v1,254.25,613.83,0.0
gfx942,304,288,2304,4096,ck,18,0,20.1896,a8w8_blockscale_1x128x128_256x64x64x256_16x16_32x32_1x1_16x16x1_16x16x1_1x32x1x8_8_1x1_intrawave_v1,269.24,591.59,0.0
gfx942,304,320,2304,4096,ck,18,0,19.68,a8w8_blockscale_1x128x128_256x64x64x256_16x16_32x32_1x1_16x16x1_16x16x1_1x32x1x8_8_1x1_intrawave_v1,306.9,621.06,0.0
gfx942,304,352,2304,4096,ck,18,0,23.3923,a8w8_blockscale_1x128x128_256x64x64x256_16x16_32x32_1x1_16x16x1_16x16x1_1x32x1x8_8_1x1_intrawave_v1,284.02,534.41,0.0
gfx942,304,384,2304,4096,ck,18,0,21.7571,a8w8_blockscale_1x128x128_256x64x64x256_16x16_32x32_1x1_16x16x1_16x16x1_1x32x1x8_8_1x1_intrawave_v1,333.12,587.37,0.0
gfx942,304,416,2304,4096,ck,18,0,26.0458,a8w8_blockscale_1x128x128_256x64x64x256_16x16_32x32_1x1_16x16x1_16x16x1_1x32x1x8_8_1x1_intrawave_v1,301.46,501.35,0.0
gfx942,304,448,2304,4096,ck,18,0,23.3659,a8w8_blockscale_1x128x128_256x64x64x256_16x16_32x32_1x1_16x16x1_16x16x1_1x32x1x8_8_1x1_intrawave_v1,361.88,570.77,0.0
gfx942,304,480,2304,4096,ck,18,0,26.515,a8w8_blockscale_1x128x128_256x64x64x256_16x16_32x32_1x1_16x16x1_16x16x1_1x32x1x8_8_1x1_intrawave_v1,341.68,513.49,0.0
gfx942,304,512,2304,4096,ck,18,0,24.7191,a8w8_blockscale_1x128x128_256x64x64x256_16x16_32x32_1x1_16x16x1_16x16x1_1x32x1x8_8_1x1_intrawave_v1,390.94,562.06,0.0
gfx942,304,544,2304,4096,ck,3,0,34.8379,a8w8_blockscale_1x128x128_256x64x64x128_16x16_32x32_1x1_8x32x1_8x32x1_1x32x1x8_8_1x1_intrawave_v3,294.73,406.8,0.0
gfx942,304,576,2304,4096,ck,1,0,38.3277,a8w8_blockscale_1x128x128_256x128x64x128_16x16_32x32_2x1_8x32x1_8x32x1_1x32x1x8_8_1x1_intrawave_v3,283.65,377.03,0.0
gfx942,304,608,2304,4096,ck,2,0,35.274,a8w8_blockscale_1x128x128_256x64x128x128_16x16_32x32_1x2_8x32x1_8x32x1_1x32x1x8_8_1x1_intrawave_v3,325.33,417.57,0.0
gfx942,304,640,2304,4096,ck,3,0,35.5829,a8w8_blockscale_1x128x128_256x64x64x128_16x16_32x32_1x1_8x32x1_8x32x1_1x32x1x8_8_1x1_intrawave_v3,339.48,421.77,0.0
gfx942,304,672,2304,4096,ck,2,0,34.6458,a8w8_blockscale_1x128x128_256x64x128x128_16x16_32x32_1x2_8x32x1_8x32x1_1x32x1x8_8_1x1_intrawave_v3,366.09,441.22,0.0
gfx942,304,704,2304,4096,ck,3,0,38.1391,a8w8_blockscale_1x128x128_256x64x64x128_16x16_32x32_1x1_8x32x1_8x32x1_1x32x1x8_8_1x1_intrawave_v3,348.4,408.11,0.0
gfx942,304,736,2304,4096,ck,2,0,35.4607,a8w8_blockscale_1x128x128_256x64x128x128_16x16_32x32_1x2_8x32x1_8x32x1_1x32x1x8_8_1x1_intrawave_v3,391.74,446.79,0.0
gfx942,304,768,2304,4096,ck,3,0,37.4757,a8w8_blockscale_1x128x128_256x64x64x128_16x16_32x32_1x1_8x32x1_8x32x1_1x32x1x8_8_1x1_intrawave_v3,386.8,430.19,0.0
gfx942,304,800,2304,4096,ck,2,0,38.0501,a8w8_blockscale_1x128x128_256x64x128x128_16x16_32x32_1x2_8x32x1_8x32x1_1x32x1x8_8_1x1_intrawave_v3,396.83,431.02,0.0
gfx942,304,832,2304,4096,ck,2,0,40.0576,a8w8_blockscale_1x128x128_256x64x128x128_16x16_32x32_1x2_8x32x1_8x32x1_1x32x1x8_8_1x1_intrawave_v3,392.02,416.37,0.0
gfx942,304,864,2304,4096,ck,2,0,38.2375,a8w8_blockscale_1x128x128_256x64x128x128_16x16_32x32_1x2_8x32x1_8x32x1_1x32x1x8_8_1x1_intrawave_v3,426.48,443.48,0.0
gfx942,304,896,2304,4096,ck,3,0,40.8908,a8w8_blockscale_1x128x128_256x64x64x128_16x16_32x32_1x1_8x32x1_8x32x1_1x32x1x8_8_1x1_intrawave_v3,413.58,421.51,0.0
gfx942,304,928,2304,4096,ck,2,0,38.8037,a8w8_blockscale_1x128x128_256x64x128x128_16x16_32x32_1x2_8x32x1_8x32x1_1x32x1x8_8_1x1_intrawave_v3,451.39,451.36,0.0
gfx942,304,960,2304,4096,ck,2,0,42.006,a8w8_blockscale_1x128x128_256x64x128x128_16x16_32x32_1x2_8x32x1_8x32x1_1x32x1x8_8_1x1_intrawave_v3,431.35,423.58,0.0
gfx942,304,992,2304,4096,ck,2,0,40.0564,a8w8_blockscale_1x128x128_256x64x128x128_16x16_32x32_1x2_8x32x1_8x32x1_1x32x1x8_8_1x1_intrawave_v3,467.43,451.15,0.0
gfx942,304,1024,2304,4096,ck,2,0,42.8266,a8w8_blockscale_1x128x128_256x64x128x128_16x16_32x32_1x2_8x32x1_8x32x1_1x32x1x8_8_1x1_intrawave_v3,451.29,428.47,0.0
gfx942,304,1088,2304,4096,ck,0,0,50.3802,a8w8_blockscale_1x128x128_256x128x128x128_16x16_32x32_2x2_8x32x1_8x32x1_1x32x1x8_8_1x1_intrawave_v3,407.61,375.29,0.0
gfx942,304,1152,2304,4096,ck,2,0,55.6901,a8w8_blockscale_1x128x128_256x64x128x128_16x16_32x32_1x2_8x32x1_8x32x1_1x32x1x8_8_1x1_intrawave_v3,390.43,349.51,0.0
gfx942,304,1216,2304,4096,ck,0,0,50.8605,a8w8_blockscale_1x128x128_256x128x128x128_16x16_32x32_2x2_8x32x1_8x32x1_1x32x1x8_8_1x1_intrawave_v3,451.26,393.65,0.0
gfx942,304,1280,2304,4096,ck,2,0,57.1291,a8w8_blockscale_1x128x128_256x64x128x128_16x16_32x32_1x2_8x32x1_8x32x1_1x32x1x8_8_1x1_intrawave_v3,422.89,360.21,0.0
gfx942,304,1344,2304,4096,ck,0,0,52.9512,a8w8_blockscale_1x128x128_256x128x128x128_16x16_32x32_2x2_8x32x1_8x32x1_1x32x1x8_8_1x1_intrawave_v3,479.07,399.15,0.0
gfx942,304,1408,2304,4096,ck,2,0,58.6489,a8w8_blockscale_1x128x128_256x64x128x128_16x16_32x32_1x2_8x32x1_8x32x1_1x32x1x8_8_1x1_intrawave_v3,453.12,369.87,0.0
gfx942,304,1472,2304,4096,ck,0,0,54.7194,a8w8_blockscale_1x128x128_256x128x128x128_16x16_32x32_2x2_8x32x1_8x32x1_1x32x1x8_8_1x1_intrawave_v3,507.74,406.61,0.0
gfx942,304,1536,2304,4096,ck,0,0,59.0507,a8w8_blockscale_1x128x128_256x128x128x128_16x16_32x32_2x2_8x32x1_8x32x1_1x32x1x8_8_1x1_intrawave_v3,490.95,386.22,0.0
gfx942,304,1600,2304,4096,ck,0,0,56.0607,a8w8_blockscale_1x128x128_256x128x128x128_16x16_32x32_2x2_8x32x1_8x32x1_1x32x1x8_8_1x1_intrawave_v3,538.68,416.76,0.0
gfx942,304,1664,2304,4096,ck,2,0,62.3685,a8w8_blockscale_1x128x128_256x64x128x128_16x16_32x32_1x2_8x32x1_8x32x1_1x32x1x8_8_1x1_intrawave_v3,503.57,383.54,0.0
gfx942,304,1728,2304,4096,ck,0,0,58.806,a8w8_blockscale_1x128x128_256x128x128x128_16x16_32x32_2x2_8x32x1_8x32x1_1x32x1x8_8_1x1_intrawave_v3,554.62,416.24,0.0
gfx942,304,1792,2304,4096,ck,2,0,62.7747,a8w8_blockscale_1x128x128_256x64x128x128_16x16_32x32_1x2_8x32x1_8x32x1_1x32x1x8_8_1x1_intrawave_v3,538.8,398.8,0.0
gfx942,304,1856,2304,4096,ck,0,0,60.5386,a8w8_blockscale_1x128x128_256x128x128x128_16x16_32x32_2x2_8x32x1_8x32x1_1x32x1x8_8_1x1_intrawave_v3,578.65,422.74,0.0
gfx942,304,1920,2304,4096,ck,0,0,63.2118,a8w8_blockscale_1x128x128_256x128x128x128_16x16_32x32_2x2_8x32x1_8x32x1_1x32x1x8_8_1x1_intrawave_v3,573.29,413.67,0.0
gfx942,304,1984,2304,4096,ck,0,0,60.2617,a8w8_blockscale_1x128x128_256x128x128x128_16x16_32x32_2x2_8x32x1_8x32x1_1x32x1x8_8_1x1_intrawave_v3,621.4,443.17,0.0
gfx942,304,2048,2304,4096,ck,0,0,64.5698,a8w8_blockscale_1x128x128_256x128x128x128_16x16_32x32_2x2_8x32x1_8x32x1_1x32x1x8_8_1x1_intrawave_v3,598.65,422.22,0.0
gfx942,304,2112,2304,4096,ck,2,0,71.3588,a8w8_blockscale_1x128x128_256x64x128x128_16x16_32x32_1x2_8x32x1_8x32x1_1x32x1x8_8_1x1_intrawave_v3,558.62,389.86,0.0
gfx942,304,2176,2304,4096,ck,0,0,81.8193,a8w8_blockscale_1x128x128_256x128x128x128_16x16_32x32_2x2_8x32x1_8x32x1_1x32x1x8_8_1x1_intrawave_v3,501.97,346.83,0.0
gfx942,304,2240,2304,4096,ck,0,0,89.3764,a8w8_blockscale_1x128x128_256x128x128x128_16x16_32x32_2x2_8x32x1_8x32x1_1x32x1x8_8_1x1_intrawave_v3,473.04,323.73,0.0
gfx942,304,2304,2304,4096,ck,0,0,86.8166,a8w8_blockscale_1x128x128_256x128x128x128_16x16_32x32_2x2_8x32x1_8x32x1_1x32x1x8_8_1x1_intrawave_v3,500.9,339.7,0.0
gfx942,304,2368,2304,4096,ck,0,0,87.199,a8w8_blockscale_1x128x128_256x128x128x128_16x16_32x32_2x2_8x32x1_8x32x1_1x32x1x8_8_1x1_intrawave_v3,512.56,344.59,0.0
gfx942,304,2432,2304,4096,ck,0,0,88.6015,a8w8_blockscale_1x128x128_256x128x128x128_16x16_32x32_2x2_8x32x1_8x32x1_1x32x1x8_8_1x1_intrawave_v3,518.08,345.43,0.0
gfx942,304,2496,2304,4096,ck,0,0,86.1532,a8w8_blockscale_1x128x128_256x128x128x128_16x16_32x32_2x2_8x32x1_8x32x1_1x32x1x8_8_1x1_intrawave_v3,546.82,361.71,0.0
gfx942,304,2560,2304,4096,ck,0,0,84.9757,a8w8_blockscale_1x128x128_256x128x128x128_16x16_32x32_2x2_8x32x1_8x32x1_1x32x1x8_8_1x1_intrawave_v3,568.61,373.28,0.0
gfx942,304,2624,2304,4096,ck,0,0,86.9387,a8w8_blockscale_1x128x128_256x128x128x128_16x16_32x32_2x2_8x32x1_8x32x1_1x32x1x8_8_1x1_intrawave_v3,569.67,371.26,0.0
gfx942,304,2688,2304,4096,ck,0,0,87.6756,a8w8_blockscale_1x128x128_256x128x128x128_16x16_32x32_2x2_8x32x1_8x32x1_1x32x1x8_8_1x1_intrawave_v3,578.66,374.49,0.0
gfx942,304,2752,2304,4096,ck,0,0,84.9528,a8w8_blockscale_1x128x128_256x128x128x128_16x16_32x32_2x2_8x32x1_8x32x1_1x32x1x8_8_1x1_intrawave_v3,611.42,393.05,0.0
gfx942,304,2816,2304,4096,ck,0,0,88.2241,a8w8_blockscale_1x128x128_256x128x128x128_16x16_32x32_2x2_8x32x1_8x32x1_1x32x1x8_8_1x1_intrawave_v3,602.45,384.79,0.0
gfx942,304,2880,2304,4096,ck,0,0,86.675,a8w8_blockscale_1x128x128_256x128x128x128_16x16_32x32_2x2_8x32x1_8x32x1_1x32x1x8_8_1x1_intrawave_v3,627.15,398.09,0.0
gfx942,304,2944,2304,4096,ck,0,0,88.7351,a8w8_blockscale_1x128x128_256x128x128x128_16x16_32x32_2x2_8x32x1_8x32x1_1x32x1x8_8_1x1_intrawave_v3,626.2,395.13,0.0
gfx942,304,3008,2304,4096,ck,0,0,89.6448,a8w8_blockscale_1x128x128_256x128x128x128_16x16_32x32_2x2_8x32x1_8x32x1_1x32x1x8_8_1x1_intrawave_v3,633.32,397.33,0.0
gfx942,304,3072,2304,4096,ck,0,0,88.0547,a8w8_blockscale_1x128x128_256x128x128x128_16x16_32x32_2x2_8x32x1_8x32x1_1x32x1x8_8_1x1_intrawave_v3,658.48,410.83,0.0
gfx942,304,3136,2304,4096,ck,0,0,91.1289,a8w8_blockscale_1x128x128_256x128x128x128_16x16_32x32_2x2_8x32x1_8x32x1_1x32x1x8_8_1x1_intrawave_v3,649.52,403.09,0.0
gfx942,304,3200,2304,4096,ck,0,0,91.1252,a8w8_blockscale_1x128x128_256x128x128x128_16x16_32x32_2x2_8x32x1_8x32x1_1x32x1x8_8_1x1_intrawave_v3,662.8,409.22,0.0
gfx942,304,3264,2304,4096,ck,0,0,91.8885,a8w8_blockscale_1x128x128_256x128x128x128_16x16_32x32_2x2_8x32x1_8x32x1_1x32x1x8_8_1x1_intrawave_v3,670.44,411.88,0.0
gfx942,304,3328,2304,4096,ck,0,0,92.4418,a8w8_blockscale_1x128x128_256x128x128x128_16x16_32x32_2x2_8x32x1_8x32x1_1x32x1x8_8_1x1_intrawave_v3,679.5,415.44,0.0
gfx942,304,3392,2304,4096,ck,0,0,94.7075,a8w8_blockscale_1x128x128_256x128x128x128_16x16_32x32_2x2_8x32x1_8x32x1_1x32x1x8_8_1x1_intrawave_v3,676.0,411.38,0.0
gfx942,304,3456,2304,4096,ck,0,0,95.3643,a8w8_blockscale_1x128x128_256x128x128x128_16x16_32x32_2x2_8x32x1_8x32x1_1x32x1x8_8_1x1_intrawave_v3,684.01,414.39,0.0
gfx942,304,3520,2304,4096,ck,0,0,95.3215,a8w8_blockscale_1x128x128_256x128x128x128_16x16_32x32_2x2_8x32x1_8x32x1_1x32x1x8_8_1x1_intrawave_v3,696.99,420.42,0.0
gfx942,304,3584,2304,4096,ck,0,0,94.5513,a8w8_blockscale_1x128x128_256x128x128x128_16x16_32x32_2x2_8x32x1_8x32x1_1x32x1x8_8_1x1_intrawave_v3,715.44,429.74,0.0
gfx942,304,3648,2304,4096,ck,0,0,98.6724,a8w8_blockscale_1x128x128_256x128x128x128_16x16_32x32_2x2_8x32x1_8x32x1_1x32x1x8_8_1x1_intrawave_v3,697.8,417.44,0.0
gfx942,304,3712,2304,4096,ck,0,0,95.4247,a8w8_blockscale_1x128x128_256x128x128x128_16x16_32x32_2x2_8x32x1_8x32x1_1x32x1x8_8_1x1_intrawave_v3,734.21,437.48,0.0
gfx942,304,3776,2304,4096,ck,0,0,100.5379,a8w8_blockscale_1x128x128_256x128x128x128_16x16_32x32_2x2_8x32x1_8x32x1_1x32x1x8_8_1x1_intrawave_v3,708.88,420.77,0.0
gfx942,304,3840,2304,4096,ck,0,0,101.4071,a8w8_blockscale_1x128x128_256x128x128x128_16x16_32x32_2x2_8x32x1_8x32x1_1x32x1x8_8_1x1_intrawave_v3,714.72,422.66,0.0
gfx942,304,3904,2304,4096,ck,0,0,98.6626,a8w8_blockscale_1x128x128_256x128x128x128_16x16_32x32_2x2_8x32x1_8x32x1_1x32x1x8_8_1x1_intrawave_v3,746.84,440.06,0.0
gfx942,304,3968,2304,4096,ck,0,0,102.8856,a8w8_blockscale_1x128x128_256x128x128x128_16x16_32x32_2x2_8x32x1_8x32x1_1x32x1x8_8_1x1_intrawave_v3,727.93,427.41,0.0
gfx942,304,4032,2304,4096,ck,0,0,99.2027,a8w8_blockscale_1x128x128_256x128x128x128_16x16_32x32_2x2_8x32x1_8x32x1_1x32x1x8_8_1x1_intrawave_v3,767.13,448.9,0.0
gfx942,304,4096,2304,4096,ck,0,0,102.2151,a8w8_blockscale_1x128x128_256x128x128x128_16x16_32x32_2x2_8x32x1_8x32x1_1x32x1x8_8_1x1_intrawave_v3,756.34,441.12,0.0
gfx942,304,4224,2304,4096,ck,0,0,105.6526,a8w8_blockscale_1x128x128_256x128x128x128_16x16_32x32_2x2_8x32x1_8x32x1_1x32x1x8_8_1x1_intrawave_v3,754.6,437.31,0.0
gfx942,304,4352,2304,4096,ck,0,0,149.0936,a8w8_blockscale_1x128x128_256x128x128x128_16x16_32x32_2x2_8x32x1_8x32x1_1x32x1x8_8_1x1_intrawave_v3,550.94,317.36,0.0
gfx942,304,4480,2304,4096,ck,0,0,144.6109,a8w8_blockscale_1x128x128_256x128x128x128_16x16_32x32_2x2_8x32x1_8x32x1_1x32x1x8_8_1x1_intrawave_v3,584.72,334.91,0.0
gfx942,304,4608,2304,4096,ck,0,0,143.8005,a8w8_blockscale_1x128x128_256x128x128x128_16x16_32x32_2x2_8x32x1_8x32x1_1x32x1x8_8_1x1_intrawave_v3,604.82,344.54,0.0
gfx942,304,4736,2304,4096,ck,0,0,137.8742,a8w8_blockscale_1x128x128_256x128x128x128_16x16_32x32_2x2_8x32x1_8x32x1_1x32x1x8_8_1x1_intrawave_v3,648.34,367.43,0.0
gfx942,304,4864,2304,4096,ck,0,0,137.2899,a8w8_blockscale_1x128x128_256x128x128x128_16x16_32x32_2x2_8x32x1_8x32x1_1x32x1x8_8_1x1_intrawave_v3,668.69,377.11,0.0
gfx942,304,4992,2304,4096,ck,0,0,137.6016,a8w8_blockscale_1x128x128_256x128x128x128_16x16_32x32_2x2_8x32x1_8x32x1_1x32x1x8_8_1x1_intrawave_v3,684.74,384.35,0.0
gfx942,304,5120,2304,4096,ck,0,0,138.152,a8w8_blockscale_1x128x128_256x128x128x128_16x16_32x32_2x2_8x32x1_8x32x1_1x32x1x8_8_1x1_intrawave_v3,699.5,390.89,0.0
gfx942,304,5248,2304,4096,ck,0,0,142.1154,a8w8_blockscale_1x128x128_256x128x128x128_16x16_32x32_2x2_8x32x1_8x32x1_1x32x1x8_8_1x1_intrawave_v3,696.99,387.82,0.0
gfx942,304,5376,2304,4096,ck,0,0,142.2784,a8w8_blockscale_1x128x128_256x128x128x128_16x16_32x32_2x2_8x32x1_8x32x1_1x32x1x8_8_1x1_intrawave_v3,713.17,395.21,0.0
gfx942,304,5504,2304,4096,ck,0,0,149.4089,a8w8_blockscale_1x128x128_256x128x128x128_16x16_32x32_2x2_8x32x1_8x32x1_1x32x1x8_8_1x1_intrawave_v3,695.3,383.81,0.0
gfx942,304,5632,2304,4096,ck,0,0,143.3653,a8w8_blockscale_1x128x128_256x128x128x128_16x16_32x32_2x2_8x32x1_8x32x1_1x32x1x8_8_1x1_intrawave_v3,741.47,407.76,0.0
gfx942,304,5760,2304,4096,ck,0,0,153.3083,a8w8_blockscale_1x128x128_256x128x128x128_16x16_32x32_2x2_8x32x1_8x32x1_1x32x1x8_8_1x1_intrawave_v3,709.14,388.58,0.0
gfx942,304,5888,2304,4096,ck,0,0,151.4407,a8w8_blockscale_1x128x128_256x128x128x128_16x16_32x32_2x2_8x32x1_8x32x1_1x32x1x8_8_1x1_intrawave_v3,733.83,400.73,0.0
gfx942,304,6016,2304,4096,ck,0,0,151.6985,a8w8_blockscale_1x128x128_256x128x128x128_16x16_32x32_2x2_8x32x1_8x32x1_1x32x1x8_8_1x1_intrawave_v3,748.51,407.39,0.0
gfx942,304,6144,2304,4096,ck,0,0,154.7142,a8w8_blockscale_1x128x128_256x128x128x128_16x16_32x32_2x2_8x32x1_8x32x1_1x32x1x8_8_1x1_intrawave_v3,749.54,406.65,0.0
gfx942,304,6272,2304,4096,ck,0,0,154.5324,a8w8_blockscale_1x128x128_256x128x128x128_16x16_32x32_2x2_8x32x1_8x32x1_1x32x1x8_8_1x1_intrawave_v3,766.05,414.34,0.0
gfx942,304,6400,2304,4096,ck,0,0,162.8262,a8w8_blockscale_1x128x128_256x128x128x128_16x16_32x32_2x2_8x32x1_8x32x1_1x32x1x8_8_1x1_intrawave_v3,741.87,400.08,0.0
gfx942,304,6528,2304,4096,ck,0,0,172.9538,a8w8_blockscale_1x128x128_256x128x128x128_16x16_32x32_2x2_8x32x1_8x32x1_1x32x1x8_8_1x1_intrawave_v3,712.4,383.09,0.0
gfx942,304,6656,2304,4096,ck,0,0,188.3012,a8w8_blockscale_1x128x128_256x128x128x128_16x16_32x32_2x2_8x32x1_8x32x1_1x32x1x8_8_1x1_intrawave_v3,667.16,357.78,0.0
gfx942,304,6784,2304,4096,ck,0,0,178.3983,a8w8_blockscale_1x128x128_256x128x128x128_16x16_32x32_2x2_8x32x1_8x32x1_1x32x1x8_8_1x1_intrawave_v3,717.74,383.89,0.0
gfx942,304,6912,2304,4096,ck,0,0,180.0281,a8w8_blockscale_1x128x128_256x128x128x128_16x16_32x32_2x2_8x32x1_8x32x1_1x32x1x8_8_1x1_intrawave_v3,724.66,386.6,0.0
gfx942,304,7040,2304,4096,ck,0,0,181.5913,a8w8_blockscale_1x128x128_256x128x128x128_16x16_32x32_2x2_8x32x1_8x32x1_1x32x1x8_8_1x1_intrawave_v3,731.73,389.41,0.0
gfx942,304,7168,2304,4096,ck,0,0,183.401,a8w8_blockscale_1x128x128_256x128x128x128_16x16_32x32_2x2_8x32x1_8x32x1_1x32x1x8_8_1x1_intrawave_v3,737.68,391.64,0.0
gfx942,304,7296,2304,4096,ck,0,0,188.3875,a8w8_blockscale_1x128x128_256x128x128x128_16x16_32x32_2x2_8x32x1_8x32x1_1x32x1x8_8_1x1_intrawave_v3,730.98,387.19,0.0
gfx942,304,7424,2304,4096,ck,0,0,192.2406,a8w8_blockscale_1x128x128_256x128x128x128_16x16_32x32_2x2_8x32x1_8x32x1_1x32x1x8_8_1x1_intrawave_v3,728.9,385.22,0.0
gfx942,304,7552,2304,4096,ck,0,0,191.0431,a8w8_blockscale_1x128x128_256x128x128x128_16x16_32x32_2x2_8x32x1_8x32x1_1x32x1x8_8_1x1_intrawave_v3,746.11,393.47,0.0
gfx942,304,7680,2304,4096,ck,0,0,193.1117,a8w8_blockscale_1x128x128_256x128x128x128_16x16_32x32_2x2_8x32x1_8x32x1_1x32x1x8_8_1x1_intrawave_v3,750.63,395.02,0.0
gfx942,304,7808,2304,4096,ck,0,0,192.9304,a8w8_blockscale_1x128x128_256x128x128x128_16x16_32x32_2x2_8x32x1_8x32x1_1x32x1x8_8_1x1_intrawave_v3,763.86,401.17,0.0
gfx942,304,7936,2304,4096,ck,0,0,193.7021,a8w8_blockscale_1x128x128_256x128x128x128_16x16_32x32_2x2_8x32x1_8x32x1_1x32x1x8_8_1x1_intrawave_v3,773.29,405.32,0.0
gfx942,304,8064,2304,4096,ck,0,0,199.021,a8w8_blockscale_1x128x128_256x128x128x128_16x16_32x32_2x2_8x32x1_8x32x1_1x32x1x8_8_1x1_intrawave_v3,764.76,400.09,0.0
gfx942,304,8192,2304,4096,ck,0,0,193.4873,a8w8_blockscale_1x128x128_256x128x128x128_16x16_32x32_2x2_8x32x1_8x32x1_1x32x1x8_8_1x1_intrawave_v3,799.12,417.29,0.0
gfx942,304,8320,2304,4096,ck,0,0,205.3772,a8w8_blockscale_1x128x128_256x128x128x128_16x16_32x32_2x2_8x32x1_8x32x1_1x32x1x8_8_1x1_intrawave_v3,764.62,398.56,0.0
gfx942,304,8448,2304,4096,ck,0,0,207.5995,a8w8_blockscale_1x128x128_256x128x128x128_16x16_32x32_2x2_8x32x1_8x32x1_1x32x1x8_8_1x1_intrawave_v3,768.07,399.66,0.0
gfx942,304,8576,2304,4096,ck,0,0,204.0636,a8w8_blockscale_1x128x128_256x128x128x128_16x16_32x32_2x2_8x32x1_8x32x1_1x32x1x8_8_1x1_intrawave_v3,793.22,412.04,0.0
gfx942,304,8704,2304,4096,ck,0,0,228.2569,a8w8_blockscale_1x128x128_256x128x128x128_16x16_32x32_2x2_8x32x1_8x32x1_1x32x1x8_8_1x1_intrawave_v3,719.73,373.25,0.0
gfx942,304,8832,2304,4096,ck,0,0,231.3036,a8w8_blockscale_1x128x128_256x128x128x128_16x16_32x32_2x2_8x32x1_8x32x1_1x32x1x8_8_1x1_intrawave_v3,720.69,373.15,0.0
gfx942,304,8960,2304,4096,ck,0,0,228.3464,a8w8_blockscale_1x128x128_256x128x128x128_16x16_32x32_2x2_8x32x1_8x32x1_1x32x1x8_8_1x1_intrawave_v3,740.6,382.86,0.0
gfx942,304,9088,2304,4096,ck,0,0,231.8299,a8w8_blockscale_1x128x128_256x128x128x128_16x16_32x32_2x2_8x32x1_8x32x1_1x32x1x8_8_1x1_intrawave_v3,739.9,381.91,0.0
gfx942,304,9216,2304,4096,ck,0,0,232.9391,a8w8_blockscale_1x128x128_256x128x128x128_16x16_32x32_2x2_8x32x1_8x32x1_1x32x1x8_8_1x1_intrawave_v3,746.75,384.88,0.0
gfx942,304,9344,2304,4096,ck,0,0,234.9295,a8w8_blockscale_1x128x128_256x128x128x128_16x16_32x32_2x2_8x32x1_8x32x1_1x32x1x8_8_1x1_intrawave_v3,750.7,386.36,0.0
gfx942,304,9472,2304,4096,ck,0,0,236.9282,a8w8_blockscale_1x128x128_256x128x128x128_16x16_32x32_2x2_8x32x1_8x32x1_1x32x1x8_8_1x1_intrawave_v3,754.57,387.8,0.0
gfx942,304,9600,2304,4096,ck,0,0,235.9872,a8w8_blockscale_1x128x128_256x128x128x128_16x16_32x32_2x2_8x32x1_8x32x1_1x32x1x8_8_1x1_intrawave_v3,767.81,394.07,0.0
gfx942,304,9728,2304,4096,ck,0,0,238.8251,a8w8_blockscale_1x128x128_256x128x128x128_16x16_32x32_2x2_8x32x1_8x32x1_1x32x1x8_8_1x1_intrawave_v3,768.8,394.05,0.0
gfx942,304,9856,2304,4096,ck,0,0,246.6667,a8w8_blockscale_1x128x128_256x128x128x128_16x16_32x32_2x2_8x32x1_8x32x1_1x32x1x8_8_1x1_intrawave_v3,754.16,386.04,0.0
gfx942,304,9984,2304,4096,ck,0,0,241.7431,a8w8_blockscale_1x128x128_256x128x128x128_16x16_32x32_2x2_8x32x1_8x32x1_1x32x1x8_8_1x1_intrawave_v3,779.51,398.51,0.0
gfx942,304,10112,2304,4096,ck,0,0,244.4246,a8w8_blockscale_1x128x128_256x128x128x128_16x16_32x32_2x2_8x32x1_8x32x1_1x32x1x8_8_1x1_intrawave_v3,780.84,398.7,0.0
gfx942,304,10240,2304,4096,ck,0,0,244.1518,a8w8_blockscale_1x128x128_256x128x128x128_16x16_32x32_2x2_8x32x1_8x32x1_1x32x1x8_8_1x1_intrawave_v3,791.61,403.71,0.0
gfx942,304,10368,2304,4096,ck,0,0,252.7934,a8w8_blockscale_1x128x128_256x128x128x128_16x16_32x32_2x2_8x32x1_8x32x1_1x32x1x8_8_1x1_intrawave_v3,774.11,394.32,0.0
gfx942,304,10496,2304,4096,ck,0,0,254.2558,a8w8_blockscale_1x128x128_256x128x128x128_16x16_32x32_2x2_8x32x1_8x32x1_1x32x1x8_8_1x1_intrawave_v3,779.16,396.43,0.0
gfx942,304,10624,2304,4096,ck,0,0,254.4477,a8w8_blockscale_1x128x128_256x128x128x128_16x16_32x32_2x2_8x32x1_8x32x1_1x32x1x8_8_1x1_intrawave_v3,788.06,400.51,0.0
gfx942,304,10752,2304,4096,ck,0,0,257.7604,a8w8_blockscale_1x128x128_256x128x128x128_16x16_32x32_2x2_8x32x1_8x32x1_1x32x1x8_8_1x1_intrawave_v3,787.31,399.68,0.0
gfx942,304,10880,2304,4096,ck,0,0,270.0059,a8w8_blockscale_1x128x128_256x128x128x128_16x16_32x32_2x2_8x32x1_8x32x1_1x32x1x8_8_1x1_intrawave_v3,760.55,385.68,0.0
gfx942,304,11008,2304,4096,ck,0,0,273.0179,a8w8_blockscale_1x128x128_256x128x128x128_16x16_32x32_2x2_8x32x1_8x32x1_1x32x1x8_8_1x1_intrawave_v3,761.01,385.51,0.0
gfx942,304,11136,2304,4096,ck,0,0,274.7319,a8w8_blockscale_1x128x128_256x128x128x128_16x16_32x32_2x2_8x32x1_8x32x1_1x32x1x8_8_1x1_intrawave_v3,765.05,387.16,0.0
gfx942,304,11264,2304,4096,ck,0,0,275.0383,a8w8_blockscale_1x128x128_256x128x128x128_16x16_32x32_2x2_8x32x1_8x32x1_1x32x1x8_8_1x1_intrawave_v3,772.99,390.78,0.0
gfx942,304,11392,2304,4096,ck,0,0,276.999,a8w8_blockscale_1x128x128_256x128x128x128_16x16_32x32_2x2_8x32x1_8x32x1_1x32x1x8_8_1x1_intrawave_v3,776.24,392.03,0.0
gfx942,304,11520,2304,4096,ck,0,0,278.9371,a8w8_blockscale_1x128x128_256x128x128x128_16x16_32x32_2x2_8x32x1_8x32x1_1x32x1x8_8_1x1_intrawave_v3,779.5,393.3,0.0
gfx942,304,11648,2304,4096,ck,0,0,287.9582,a8w8_blockscale_1x128x128_256x128x128x128_16x16_32x32_2x2_8x32x1_8x32x1_1x32x1x8_8_1x1_intrawave_v3,763.47,384.85,0.0
gfx942,304,11776,2304,4096,ck,0,0,283.0787,a8w8_blockscale_1x128x128_256x128x128x128_16x16_32x32_2x2_8x32x1_8x32x1_1x32x1x8_8_1x1_intrawave_v3,785.17,395.42,0.0
gfx942,304,11904,2304,4096,ck,0,0,298.1036,a8w8_blockscale_1x128x128_256x128x128x128_16x16_32x32_2x2_8x32x1_8x32x1_1x32x1x8_8_1x1_intrawave_v3,753.7,379.23,0.0
gfx942,304,12032,2304,4096,ck,0,0,289.2534,a8w8_blockscale_1x128x128_256x128x128x128_16x16_32x32_2x2_8x32x1_8x32x1_1x32x1x8_8_1x1_intrawave_v3,785.11,394.68,0.0
gfx942,304,12160,2304,4096,ck,0,0,294.4267,a8w8_blockscale_1x128x128_256x128x128x128_16x16_32x32_2x2_8x32x1_8x32x1_1x32x1x8_8_1x1_intrawave_v3,779.52,391.53,0.0
gfx942,304,12288,2304,4096,ck,0,0,292.5364,a8w8_blockscale_1x128x128_256x128x128x128_16x16_32x32_2x2_8x32x1_8x32x1_1x32x1x8_8_1x1_intrawave_v3,792.82,397.87,0.0
gfx942,304,12416,2304,4096,ck,0,0,304.8644,a8w8_blockscale_1x128x128_256x128x128x128_16x16_32x32_2x2_8x32x1_8x32x1_1x32x1x8_8_1x1_intrawave_v3,768.68,385.44,0.0
gfx942,304,12544,2304,4096,ck,0,0,298.4845,a8w8_blockscale_1x128x128_256x128x128x128_16x16_32x32_2x2_8x32x1_8x32x1_1x32x1x8_8_1x1_intrawave_v3,793.21,397.41,0.0
gfx942,304,12672,2304,4096,ck,0,0,302.1415,a8w8_blockscale_1x128x128_256x128x128x128_16x16_32x32_2x2_8x32x1_8x32x1_1x32x1x8_8_1x1_intrawave_v3,791.6,396.29,0.0
gfx942,304,12800,2304,4096,ck,0,0,311.8363,a8w8_blockscale_1x128x128_256x128x128x128_16x16_32x32_2x2_8x32x1_8x32x1_1x32x1x8_8_1x1_intrawave_v3,774.74,387.54,0.0
gfx942,304,12928,2304,4096,ck,0,0,311.4475,a8w8_blockscale_1x128x128_256x128x128x128_16x16_32x32_2x2_8x32x1_8x32x1_1x32x1x8_8_1x1_intrawave_v3,783.46,391.6,0.0
gfx942,304,13056,2304,4096,ck,0,0,319.8276,a8w8_blockscale_1x128x128_256x128x128x128_16x16_32x32_2x2_8x32x1_8x32x1_1x32x1x8_8_1x1_intrawave_v3,770.49,384.82,0.0
gfx942,304,13184,2304,4096,ck,0,0,324.7338,a8w8_blockscale_1x128x128_256x128x128x128_16x16_32x32_2x2_8x32x1_8x32x1_1x32x1x8_8_1x1_intrawave_v3,766.29,382.44,0.0
gfx942,304,13312,2304,4096,ck,0,0,323.8683,a8w8_blockscale_1x128x128_256x128x128x128_16x16_32x32_2x2_8x32x1_8x32x1_1x32x1x8_8_1x1_intrawave_v3,775.8,386.9,0.0
gfx942,304,13440,2304,4096,ck,0,0,331.261,a8w8_blockscale_1x128x128_256x128x128x128_16x16_32x32_2x2_8x32x1_8x32x1_1x32x1x8_8_1x1_intrawave_v3,765.78,381.63,0.0
gfx942,304,13568,2304,4096,ck,0,0,332.4163,a8w8_blockscale_1x128x128_256x128x128x128_16x16_32x32_2x2_8x32x1_8x32x1_1x32x1x8_8_1x1_intrawave_v3,770.38,383.65,0.0
gfx942,304,13696,2304,4096,ck,0,0,332.0123,a8w8_blockscale_1x128x128_256x128x128x128_16x16_32x32_2x2_8x32x1_8x32x1_1x32x1x8_8_1x1_intrawave_v3,778.6,387.48,0.0
gfx942,304,13824,2304,4096,ck,0,0,331.6342,a8w8_blockscale_1x128x128_256x128x128x128_16x16_32x32_2x2_8x32x1_8x32x1_1x32x1x8_8_1x1_intrawave_v3,786.77,391.28,0.0
gfx942,304,13952,2304,4096,ck,0,0,340.5171,a8w8_blockscale_1x128x128_256x128x128x128_16x16_32x32_2x2_8x32x1_8x32x1_1x32x1x8_8_1x1_intrawave_v3,773.34,384.34,0.0
gfx942,304,14080,2304,4096,ck,0,0,334.0098,a8w8_blockscale_1x128x128_256x128x128x128_16x16_32x32_2x2_8x32x1_8x32x1_1x32x1x8_8_1x1_intrawave_v3,795.64,395.17,0.0
gfx942,304,14208,2304,4096,ck,0,0,339.8206,a8w8_blockscale_1x128x128_256x128x128x128_16x16_32x32_2x2_8x32x1_8x32x1_1x32x1x8_8_1x1_intrawave_v3,789.14,391.69,0.0
gfx942,304,14336,2304,4096,ck,0,0,333.8242,a8w8_blockscale_1x128x128_256x128x128x128_16x16_32x32_2x2_8x32x1_8x32x1_1x32x1x8_8_1x1_intrawave_v3,810.56,402.06,0.0
gfx942,304,14464,2304,4096,ck,0,0,352.0066,a8w8_blockscale_1x128x128_256x128x128x128_16x16_32x32_2x2_8x32x1_8x32x1_1x32x1x8_8_1x1_intrawave_v3,775.55,384.46,0.0
gfx942,304,14592,2304,4096,ck,0,0,350.8652,a8w8_blockscale_1x128x128_256x128x128x128_16x16_32x32_2x2_8x32x1_8x32x1_1x32x1x8_8_1x1_intrawave_v3,784.96,388.88,0.0
gfx942,304,14720,2304,4096,ck,0,0,353.4486,a8w8_blockscale_1x128x128_256x128x128x128_16x16_32x32_2x2_8x32x1_8x32x1_1x32x1x8_8_1x1_intrawave_v3,786.06,389.19,0.0
gfx942,304,14848,2304,4096,ck,0,0,352.2595,a8w8_blockscale_1x128x128_256x128x128x128_16x16_32x32_2x2_8x32x1_8x32x1_1x32x1x8_8_1x1_intrawave_v3,795.57,393.67,0.0
gfx942,304,14976,2304,4096,ck,0,0,361.1473,a8w8_blockscale_1x128x128_256x128x128x128_16x16_32x32_2x2_8x32x1_8x32x1_1x32x1x8_8_1x1_intrawave_v3,782.68,387.07,0.0
gfx942,304,15104,2304,4096,ck,0,0,361.6199,a8w8_blockscale_1x128x128_256x128x128x128_16x16_32x32_2x2_8x32x1_8x32x1_1x32x1x8_8_1x1_intrawave_v3,788.34,389.64,0.0
gfx942,304,15232,2304,4096,ck,0,0,365.4823,a8w8_blockscale_1x128x128_256x128x128x128_16x16_32x32_2x2_8x32x1_8x32x1_1x32x1x8_8_1x1_intrawave_v3,786.62,388.57,0.0
gfx942,304,15360,2304,4096,ck,0,0,371.5226,a8w8_blockscale_1x128x128_256x128x128x128_16x16_32x32_2x2_8x32x1_8x32x1_1x32x1x8_8_1x1_intrawave_v3,780.33,385.25,0.0
gfx942,304,15488,2304,4096,ck,0,0,382.5337,a8w8_blockscale_1x128x128_256x128x128x128_16x16_32x32_2x2_8x32x1_8x32x1_1x32x1x8_8_1x1_intrawave_v3,764.18,377.08,0.0
gfx942,304,15616,2304,4096,ck,0,0,385.9431,a8w8_blockscale_1x128x128_256x128x128x128_16x16_32x32_2x2_8x32x1_8x32x1_1x32x1x8_8_1x1_intrawave_v3,763.69,376.63,0.0
gfx942,304,15744,2304,4096,ck,0,0,386.9818,a8w8_blockscale_1x128x128_256x128x128x128_16x16_32x32_2x2_8x32x1_8x32x1_1x32x1x8_8_1x1_intrawave_v3,767.89,378.5,0.0
gfx942,304,15872,2304,4096,ck,0,0,381.4747,a8w8_blockscale_1x128x128_256x128x128x128_16x16_32x32_2x2_8x32x1_8x32x1_1x32x1x8_8_1x1_intrawave_v3,785.3,386.89,0.0
gfx942,304,16000,2304,4096,ck,0,0,392.8725,a8w8_blockscale_1x128x128_256x128x128x128_16x16_32x32_2x2_8x32x1_8x32x1_1x32x1x8_8_1x1_intrawave_v3,768.67,378.5,0.0
gfx942,304,16128,2304,4096,ck,0,0,387.9244,a8w8_blockscale_1x128x128_256x128x128x128_16x16_32x32_2x2_8x32x1_8x32x1_1x32x1x8_8_1x1_intrawave_v3,784.7,386.2,0.0
gfx942,304,16256,2304,4096,ck,0,0,389.7921,a8w8_blockscale_1x128x128_256x128x128x128_16x16_32x32_2x2_8x32x1_8x32x1_1x32x1x8_8_1x1_intrawave_v3,787.14,387.2,0.0
gfx942,304,16384,2304,4096,ck,0,0,382.173,a8w8_blockscale_1x128x128_256x128x128x128_16x16_32x32_2x2_8x32x1_8x32x1_1x32x1x8_8_1x1_intrawave_v3,809.16,397.84,0.0
gfx942,304,16512,2304,4096,ck,0,0,390.6167,a8w8_blockscale_1x128x128_256x128x128x128_16x16_32x32_2x2_8x32x1_8x32x1_1x32x1x8_8_1x1_intrawave_v3,797.85,392.09,0.0
gfx942,304,16640,2304,4096,ck,0,0,400.6009,a8w8_blockscale_1x128x128_256x128x128x128_16x16_32x32_2x2_8x32x1_8x32x1_1x32x1x8_8_1x1_intrawave_v3,784.0,385.1,0.0
gfx942,304,16768,2304,4096,ck,0,0,398.8027,a8w8_blockscale_1x128x128_256x128x128x128_16x16_32x32_2x2_8x32x1_8x32x1_1x32x1x8_8_1x1_intrawave_v3,793.59,389.63,0.0
gfx942,304,16896,2304,4096,ck,0,0,396.2072,a8w8_blockscale_1x128x128_256x128x128x128_16x16_32x32_2x2_8x32x1_8x32x1_1x32x1x8_8_1x1_intrawave_v3,804.89,395.0,0.0
gfx942,304,17024,2304,4096,ck,0,0,407.8006,a8w8_blockscale_1x128x128_256x128x128x128_16x16_32x32_2x2_8x32x1_8x32x1_1x32x1x8_8_1x1_intrawave_v3,787.93,386.5,0.0
gfx942,304,17152,2304,4096,ck,0,0,415.092,a8w8_blockscale_1x128x128_256x128x128x128_16x16_32x32_2x2_8x32x1_8x32x1_1x32x1x8_8_1x1_intrawave_v3,779.91,382.39,0.0
gfx942,304,17280,2304,4096,ck,0,0,405.8178,a8w8_blockscale_1x128x128_256x128x128x128_16x16_32x32_2x2_8x32x1_8x32x1_1x32x1x8_8_1x1_intrawave_v3,803.68,393.88,0.0
gfx942,304,17408,2304,4096,ck,0,0,422.8462,a8w8_blockscale_1x128x128_256x128x128x128_16x16_32x32_2x2_8x32x1_8x32x1_1x32x1x8_8_1x1_intrawave_v3,777.03,380.65,0.0
gfx942,304,17536,2304,4096,ck,0,0,432.7406,a8w8_blockscale_1x128x128_256x128x128x128_16x16_32x32_2x2_8x32x1_8x32x1_1x32x1x8_8_1x1_intrawave_v3,764.85,374.52,0.0
gfx942,304,17664,2304,4096,ck,0,0,429.8935,a8w8_blockscale_1x128x128_256x128x128x128_16x16_32x32_2x2_8x32x1_8x32x1_1x32x1x8_8_1x1_intrawave_v3,775.53,379.59,0.0
gfx942,304,17792,2304,4096,ck,0,0,432.0661,a8w8_blockscale_1x128x128_256x128x128x128_16x16_32x32_2x2_8x32x1_8x32x1_1x32x1x8_8_1x1_intrawave_v3,777.23,380.26,0.0
gfx942,304,17920,2304,4096,ck,0,0,427.797,a8w8_blockscale_1x128x128_256x128x128x128_16x16_32x32_2x2_8x32x1_8x32x1_1x32x1x8_8_1x1_intrawave_v3,790.63,386.66,0.0
gfx942,304,18048,2304,4096,ck,0,0,433.9062,a8w8_blockscale_1x128x128_256x128x128x128_16x16_32x32_2x2_8x32x1_8x32x1_1x32x1x8_8_1x1_intrawave_v3,785.07,383.79,0.0
gfx942,304,18176,2304,4096,ck,0,0,429.6046,a8w8_blockscale_1x128x128_256x128x128x128_16x16_32x32_2x2_8x32x1_8x32x1_1x32x1x8_8_1x1_intrawave_v3,798.55,390.22,0.0
gfx942,304,18304,2304,4096,ck,0,0,445.6154,a8w8_blockscale_1x128x128_256x128x128x128_16x16_32x32_2x2_8x32x1_8x32x1_1x32x1x8_8_1x1_intrawave_v3,775.28,378.7,0.0
gfx942,304,18432,2304,4096,ck,0,0,433.7165,a8w8_blockscale_1x128x128_256x128x128x128_16x16_32x32_2x2_8x32x1_8x32x1_1x32x1x8_8_1x1_intrawave_v3,802.12,391.66,0.0
gfx942,304,18560,2304,4096,ck,0,0,439.0794,a8w8_blockscale_1x128x128_256x128x128x128_16x16_32x32_2x2_8x32x1_8x32x1_1x32x1x8_8_1x1_intrawave_v3,797.82,389.41,0.0
gfx942,304,18688,2304,4096,ck,0,0,441.1012,a8w8_blockscale_1x128x128_256x128x128x128_16x16_32x32_2x2_8x32x1_8x32x1_1x32x1x8_8_1x1_intrawave_v3,799.64,390.15,0.0
gfx942,304,18816,2304,4096,ck,0,0,440.9913,a8w8_blockscale_1x128x128_256x128x128x128_16x16_32x32_2x2_8x32x1_8x32x1_1x32x1x8_8_1x1_intrawave_v3,805.32,392.78,0.0
gfx942,304,18944,2304,4096,ck,0,0,450.0312,a8w8_blockscale_1x128x128_256x128x128x128_16x16_32x32_2x2_8x32x1_8x32x1_1x32x1x8_8_1x1_intrawave_v3,794.51,387.36,0.0
gfx942,304,19072,2304,4096,ck,0,0,445.5015,a8w8_blockscale_1x128x128_256x128x128x128_16x16_32x32_2x2_8x32x1_8x32x1_1x32x1x8_8_1x1_intrawave_v3,808.02,393.8,0.0
gfx942,304,19200,2304,4096,ck,0,0,454.3087,a8w8_blockscale_1x128x128_256x128x128x128_16x16_32x32_2x2_8x32x1_8x32x1_1x32x1x8_8_1x1_intrawave_v3,797.67,388.62,0.0
gfx942,304,19328,2304,4096,ck,0,0,457.265,a8w8_blockscale_1x128x128_256x128x128x128_16x16_32x32_2x2_8x32x1_8x32x1_1x32x1x8_8_1x1_intrawave_v3,797.8,388.55,0.0
gfx942,304,19456,2304,4096,ck,0,0,456.9429,a8w8_blockscale_1x128x128_256x128x128x128_16x16_32x32_2x2_8x32x1_8x32x1_1x32x1x8_8_1x1_intrawave_v3,803.64,391.26,0.0
gfx942,304,19584,2304,4096,ck,0,0,479.4698,a8w8_blockscale_1x128x128_256x128x128x128_16x16_32x32_2x2_8x32x1_8x32x1_1x32x1x8_8_1x1_intrawave_v3,770.93,375.2,0.0
gfx942,304,19712,2304,4096,ck,0,0,468.3038,a8w8_blockscale_1x128x128_256x128x128x128_16x16_32x32_2x2_8x32x1_8x32x1_1x32x1x8_8_1x1_intrawave_v3,794.47,386.52,0.0
gfx942,304,19840,2304,4096,ck,0,0,480.7727,a8w8_blockscale_1x128x128_256x128x128x128_16x16_32x32_2x2_8x32x1_8x32x1_1x32x1x8_8_1x1_intrawave_v3,778.89,378.82,0.0
gfx942,304,19968,2304,4096,ck,0,0,471.9746,a8w8_blockscale_1x128x128_256x128x128x128_16x16_32x32_2x2_8x32x1_8x32x1_1x32x1x8_8_1x1_intrawave_v3,798.52,388.24,0.0
gfx942,304,20096,2304,4096,ck,0,0,489.7712,a8w8_blockscale_1x128x128_256x128x128x128_16x16_32x32_2x2_8x32x1_8x32x1_1x32x1x8_8_1x1_intrawave_v3,774.44,376.41,0.0
gfx942,304,20224,2304,4096,ck,0,0,487.709,a8w8_blockscale_1x128x128_256x128x128x128_16x16_32x32_2x2_8x32x1_8x32x1_1x32x1x8_8_1x1_intrawave_v3,782.67,380.28,0.0
gfx942,304,20352,2304,4096,ck,0,0,481.7216,a8w8_blockscale_1x128x128_256x128x128x128_16x16_32x32_2x2_8x32x1_8x32x1_1x32x1x8_8_1x1_intrawave_v3,797.41,387.32,0.0
gfx942,304,20480,2304,4096,ck,0,0,470.8058,a8w8_blockscale_1x128x128_256x128x128x128_16x16_32x32_2x2_8x32x1_8x32x1_1x32x1x8_8_1x1_intrawave_v3,821.03,398.67,0.0
gfx942,304,20608,2304,4096,ck,0,0,492.3048,a8w8_blockscale_1x128x128_256x128x128x128_16x16_32x32_2x2_8x32x1_8x32x1_1x32x1x8_8_1x1_intrawave_v3,790.09,383.52,0.0
gfx942,304,20736,2304,4096,ck,0,0,489.4264,a8w8_blockscale_1x128x128_256x128x128x128_16x16_32x32_2x2_8x32x1_8x32x1_1x32x1x8_8_1x1_intrawave_v3,799.67,388.05,0.0
gfx942,304,20864,2304,4096,ck,0,0,492.7374,a8w8_blockscale_1x128x128_256x128x128x128_16x16_32x32_2x2_8x32x1_8x32x1_1x32x1x8_8_1x1_intrawave_v3,799.2,387.71,0.0
gfx942,304,20992,2304,4096,ck,0,0,494.6839,a8w8_blockscale_1x128x128_256x128x128x128_16x16_32x32_2x2_8x32x1_8x32x1_1x32x1x8_8_1x1_intrawave_v3,800.94,388.43,0.0
gfx942,304,21120,2304,4096,ck,0,0,501.9041,a8w8_blockscale_1x128x128_256x128x128x128_16x16_32x32_2x2_8x32x1_8x32x1_1x32x1x8_8_1x1_intrawave_v3,794.23,385.06,0.0
gfx942,304,21248,2304,4096,ck,0,0,501.6527,a8w8_blockscale_1x128x128_256x128x128x128_16x16_32x32_2x2_8x32x1_8x32x1_1x32x1x8_8_1x1_intrawave_v3,799.44,387.48,0.0
gfx942,304,21376,2304,4096,ck,0,0,502.0754,a8w8_blockscale_1x128x128_256x128x128x128_16x16_32x32_2x2_8x32x1_8x32x1_1x32x1x8_8_1x1_intrawave_v3,803.58,389.37,0.0
gfx942,304,21504,2304,4096,ck,0,0,490.6641,a8w8_blockscale_1x128x128_256x128x128x128_16x16_32x32_2x2_8x32x1_8x32x1_1x32x1x8_8_1x1_intrawave_v3,827.19,400.7,0.0
gfx942,304,21632,2304,4096,ck,0,0,526.3803,a8w8_blockscale_1x128x128_256x128x128x128_16x16_32x32_2x2_8x32x1_8x32x1_1x32x1x8_8_1x1_intrawave_v3,775.66,375.63,0.0
gfx942,304,21760,2304,4096,ck,0,0,524.3548,a8w8_blockscale_1x128x128_256x128x128x128_16x16_32x32_2x2_8x32x1_8x32x1_1x32x1x8_8_1x1_intrawave_v3,783.26,379.2,0.0
gfx942,304,21888,2304,4096,ck,0,0,526.6294,a8w8_blockscale_1x128x128_256x128x128x128_16x16_32x32_2x2_8x32x1_8x32x1_1x32x1x8_8_1x1_intrawave_v3,784.46,379.68,0.0
gfx942,304,22016,2304,4096,ck,0,0,524.8627,a8w8_blockscale_1x128x128_256x128x128x128_16x16_32x32_2x2_8x32x1_8x32x1_1x32x1x8_8_1x1_intrawave_v3,791.71,383.08,0.0
gfx942,304,22144,2304,4096,ck,0,0,535.5026,a8w8_blockscale_1x128x128_256x128x128x128_16x16_32x32_2x2_8x32x1_8x32x1_1x32x1x8_8_1x1_intrawave_v3,780.49,377.55,0.0
gfx942,304,22272,2304,4096,ck,0,0,532.5418,a8w8_blockscale_1x128x128_256x128x128x128_16x16_32x32_2x2_8x32x1_8x32x1_1x32x1x8_8_1x1_intrawave_v3,789.37,381.74,0.0
gfx942,304,22400,2304,4096,ck,0,0,532.4484,a8w8_blockscale_1x128x128_256x128x128x128_16x16_32x32_2x2_8x32x1_8x32x1_1x32x1x8_8_1x1_intrawave_v3,794.04,383.9,0.0
gfx942,304,22528,2304,4096,ck,0,0,519.8544,a8w8_blockscale_1x128x128_256x128x128x128_16x16_32x32_2x2_8x32x1_8x32x1_1x32x1x8_8_1x1_intrawave_v3,817.92,395.34,0.0
gfx942,304,22656,2304,4096,ck,0,0,536.7486,a8w8_blockscale_1x128x128_256x128x128x128_16x16_32x32_2x2_8x32x1_8x32x1_1x32x1x8_8_1x1_intrawave_v3,796.68,384.98,0.0
gfx942,304,22784,2304,4096,ck,0,0,542.9124,a8w8_blockscale_1x128x128_256x128x128x128_16x16_32x32_2x2_8x32x1_8x32x1_1x32x1x8_8_1x1_intrawave_v3,792.09,382.66,0.0
gfx942,304,22912,2304,4096,ck,0,0,535.3553,a8w8_blockscale_1x128x128_256x128x128x128_16x16_32x32_2x2_8x32x1_8x32x1_1x32x1x8_8_1x1_intrawave_v3,807.78,390.14,0.0
gfx942,304,23040,2304,4096,ck,0,0,540.2236,a8w8_blockscale_1x128x128_256x128x128x128_16x16_32x32_2x2_8x32x1_8x32x1_1x32x1x8_8_1x1_intrawave_v3,804.97,388.69,0.0
gfx942,304,23168,2304,4096,ck,0,0,545.1468,a8w8_blockscale_1x128x128_256x128x128x128_16x16_32x32_2x2_8x32x1_8x32x1_1x32x1x8_8_1x1_intrawave_v3,802.14,387.22,0.0
gfx942,304,23296,2304,4096,ck,0,0,549.2282,a8w8_blockscale_1x128x128_256x128x128x128_16x16_32x32_2x2_8x32x1_8x32x1_1x32x1x8_8_1x1_intrawave_v3,800.57,386.37,0.0
gfx942,304,23424,2304,4096,ck,0,0,551.5589,a8w8_blockscale_1x128x128_256x128x128x128_16x16_32x32_2x2_8x32x1_8x32x1_1x32x1x8_8_1x1_intrawave_v3,801.57,386.76,0.0
gfx942,304,23552,2304,4096,ck,0,0,546.5867,a8w8_blockscale_1x128x128_256x128x128x128_16x16_32x32_2x2_8x32x1_8x32x1_1x32x1x8_8_1x1_intrawave_v3,813.28,392.31,0.0
gfx942,304,23680,2304,4096,ck,0,0,559.715,a8w8_blockscale_1x128x128_256x128x128x128_16x16_32x32_2x2_8x32x1_8x32x1_1x32x1x8_8_1x1_intrawave_v3,798.52,385.1,0.0
gfx942,304,23808,2304,4096,ck,0,0,569.9029,a8w8_blockscale_1x128x128_256x128x128x128_16x16_32x32_2x2_8x32x1_8x32x1_1x32x1x8_8_1x1_intrawave_v3,788.49,380.17,0.0
gfx942,304,23936,2304,4096,ck,0,0,577.7025,a8w8_blockscale_1x128x128_256x128x128x128_16x16_32x32_2x2_8x32x1_8x32x1_1x32x1x8_8_1x1_intrawave_v3,782.02,376.97,0.0
gfx942,304,24064,2304,4096,ck,0,0,581.9023,a8w8_blockscale_1x128x128_256x128x128x128_16x16_32x32_2x2_8x32x1_8x32x1_1x32x1x8_8_1x1_intrawave_v3,780.53,376.16,0.0
gfx942,304,24192,2304,4096,ck,0,0,580.9377,a8w8_blockscale_1x128x128_256x128x128x128_16x16_32x32_2x2_8x32x1_8x32x1_1x32x1x8_8_1x1_intrawave_v3,785.99,378.71,0.0
gfx942,304,24320,2304,4096,ck,0,0,586.8061,a8w8_blockscale_1x128x128_256x128x128x128_16x16_32x32_2x2_8x32x1_8x32x1_1x32x1x8_8_1x1_intrawave_v3,782.24,376.82,0.0
gfx942,304,24448,2304,4096,ck,0,0,576.5209,a8w8_blockscale_1x128x128_256x128x128x128_16x16_32x32_2x2_8x32x1_8x32x1_1x32x1x8_8_1x1_intrawave_v3,800.39,385.47,0.0
gfx942,304,24576,2304,4096,ck,0,0,579.5567,a8w8_blockscale_1x128x128_256x128x128x128_16x16_32x32_2x2_8x32x1_8x32x1_1x32x1x8_8_1x1_intrawave_v3,800.36,385.38,0.0
gfx942,304,24704,2304,4096,ck,0,0,590.3564,a8w8_blockscale_1x128x128_256x128x128x128_16x16_32x32_2x2_8x32x1_8x32x1_1x32x1x8_8_1x1_intrawave_v3,789.82,380.21,0.0
gfx942,304,24832,2304,4096,ck,0,0,583.4508,a8w8_blockscale_1x128x128_256x128x128x128_16x16_32x32_2x2_8x32x1_8x32x1_1x32x1x8_8_1x1_intrawave_v3,803.3,386.62,0.0
gfx942,304,24960,2304,4096,ck,0,0,593.9619,a8w8_blockscale_1x128x128_256x128x128x128_16x16_32x32_2x2_8x32x1_8x32x1_1x32x1x8_8_1x1_intrawave_v3,793.16,381.66,0.0
gfx942,304,25088,2304,4096,ck,0,0,581.1713,a8w8_blockscale_1x128x128_256x128x128x128_16x16_32x32_2x2_8x32x1_8x32x1_1x32x1x8_8_1x1_intrawave_v3,814.77,391.97,0.0
gfx942,304,25216,2304,4096,ck,0,0,591.7216,a8w8_blockscale_1x128x128_256x128x128x128_16x16_32x32_2x2_8x32x1_8x32x1_1x32x1x8_8_1x1_intrawave_v3,804.32,386.87,0.0
gfx942,304,25344,2304,4096,ck,0,0,604.4636,a8w8_blockscale_1x128x128_256x128x128x128_16x16_32x32_2x2_8x32x1_8x32x1_1x32x1x8_8_1x1_intrawave_v3,791.37,380.55,0.0
gfx942,304,25472,2304,4096,ck,0,0,589.2265,a8w8_blockscale_1x128x128_256x128x128x128_16x16_32x32_2x2_8x32x1_8x32x1_1x32x1x8_8_1x1_intrawave_v3,815.93,392.29,0.0
gfx942,304,25600,2304,4096,ck,0,0,598.9424,a8w8_blockscale_1x128x128_256x128x128x128_16x16_32x32_2x2_8x32x1_8x32x1_1x32x1x8_8_1x1_intrawave_v3,806.73,387.78,0.0
gfx942,304,25728,2304,4096,ck,0,0,613.066,a8w8_blockscale_1x128x128_256x128x128x128_16x16_32x32_2x2_8x32x1_8x32x1_1x32x1x8_8_1x1_intrawave_v3,792.08,380.67,0.0
gfx942,304,25856,2304,4096,ck,0,0,618.2608,a8w8_blockscale_1x128x128_256x128x128x128_16x16_32x32_2x2_8x32x1_8x32x1_1x32x1x8_8_1x1_intrawave_v3,789.34,379.27,0.0
gfx942,304,25984,2304,4096,ck,0,0,620.5682,a8w8_blockscale_1x128x128_256x128x128x128_16x16_32x32_2x2_8x32x1_8x32x1_1x32x1x8_8_1x1_intrawave_v3,790.29,379.66,0.0
gfx942,304,26112,2304,4096,ck,0,0,621.4593,a8w8_blockscale_1x128x128_256x128x128x128_16x16_32x32_2x2_8x32x1_8x32x1_1x32x1x8_8_1x1_intrawave_v3,793.05,380.9,0.0
gfx942,304,26240,2304,4096,ck,0,0,624.0525,a8w8_blockscale_1x128x128_256x128x128x128_16x16_32x32_2x2_8x32x1_8x32x1_1x32x1x8_8_1x1_intrawave_v3,793.62,381.11,0.0
gfx942,304,26368,2304,4096,ck,0,0,632.8764,a8w8_blockscale_1x128x128_256x128x128x128_16x16_32x32_2x2_8x32x1_8x32x1_1x32x1x8_8_1x1_intrawave_v3,786.38,377.55,0.0
gfx942,304,26496,2304,4096,ck,0,0,633.8172,a8w8_blockscale_1x128x128_256x128x128x128_16x16_32x32_2x2_8x32x1_8x32x1_1x32x1x8_8_1x1_intrawave_v3,789.02,378.75,0.0
gfx942,304,26624,2304,4096,ck,0,0,614.444,a8w8_blockscale_1x128x128_256x128x128x128_16x16_32x32_2x2_8x32x1_8x32x1_1x32x1x8_8_1x1_intrawave_v3,817.83,392.51,0.0
gfx942,304,26752,2304,4096,ck,0,0,634.8238,a8w8_blockscale_1x128x128_256x128x128x128_16x16_32x32_2x2_8x32x1_8x32x1_1x32x1x8_8_1x1_intrawave_v3,795.38,381.66,0.0
gfx942,304,26880,2304,4096,ck,0,0,638.6291,a8w8_blockscale_1x128x128_256x128x128x128_16x16_32x32_2x2_8x32x1_8x32x1_1x32x1x8_8_1x1_intrawave_v3,794.43,381.13,0.0
gfx942,304,27008,2304,4096,ck,0,0,641.5651,a8w8_blockscale_1x128x128_256x128x128x128_16x16_32x32_2x2_8x32x1_8x32x1_1x32x1x8_8_1x1_intrawave_v3,794.56,381.12,0.0
gfx942,304,27136,2304,4096,ck,0,0,632.6352,a8w8_blockscale_1x128x128_256x128x128x128_16x16_32x32_2x2_8x32x1_8x32x1_1x32x1x8_8_1x1_intrawave_v3,809.59,388.26,0.0
gfx942,304,27264,2304,4096,ck,0,0,640.1556,a8w8_blockscale_1x128x128_256x128x128x128_16x16_32x32_2x2_8x32x1_8x32x1_1x32x1x8_8_1x1_intrawave_v3,803.85,385.44,0.0
gfx942,304,27392,2304,4096,ck,0,0,653.3236,a8w8_blockscale_1x128x128_256x128x128x128_16x16_32x32_2x2_8x32x1_8x32x1_1x32x1x8_8_1x1_intrawave_v3,791.35,379.38,0.0
gfx942,304,27520,2304,4096,ck,0,0,651.1645,a8w8_blockscale_1x128x128_256x128x128x128_16x16_32x32_2x2_8x32x1_8x32x1_1x32x1x8_8_1x1_intrawave_v3,797.68,382.35,0.0
gfx942,304,27648,2304,4096,ck,0,0,649.7403,a8w8_blockscale_1x128x128_256x128x128x128_16x16_32x32_2x2_8x32x1_8x32x1_1x32x1x8_8_1x1_intrawave_v3,803.15,384.9,0.0
gfx942,304,27776,2304,4096,ck,0,0,666.2225,a8w8_blockscale_1x128x128_256x128x128x128_16x16_32x32_2x2_8x32x1_8x32x1_1x32x1x8_8_1x1_intrawave_v3,786.91,377.05,0.0
gfx942,304,27904,2304,4096,ck,0,0,652.3532,a8w8_blockscale_1x128x128_256x128x128x128_16x16_32x32_2x2_8x32x1_8x32x1_1x32x1x8_8_1x1_intrawave_v3,807.34,386.77,0.0
gfx942,304,28032,2304,4096,ck,0,0,658.3638,a8w8_blockscale_1x128x128_256x128x128x128_16x16_32x32_2x2_8x32x1_8x32x1_1x32x1x8_8_1x1_intrawave_v3,803.64,384.94,0.0
gfx942,304,28160,2304,4096,ck,0,0,659.0932,a8w8_blockscale_1x128x128_256x128x128x128_16x16_32x32_2x2_8x32x1_8x32x1_1x32x1x8_8_1x1_intrawave_v3,806.41,386.2,0.0
gfx942,304,28288,2304,4096,ck,0,0,673.4998,a8w8_blockscale_1x128x128_256x128x128x128_16x16_32x32_2x2_8x32x1_8x32x1_1x32x1x8_8_1x1_intrawave_v3,792.75,379.59,0.0
gfx942,304,28416,2304,4096,ck,0,0,670.5691,a8w8_blockscale_1x128x128_256x128x128x128_16x16_32x32_2x2_8x32x1_8x32x1_1x32x1x8_8_1x1_intrawave_v3,799.82,382.91,0.0
gfx942,304,28544,2304,4096,ck,0,0,662.1747,a8w8_blockscale_1x128x128_256x128x128x128_16x16_32x32_2x2_8x32x1_8x32x1_1x32x1x8_8_1x1_intrawave_v3,813.61,389.45,0.0
gfx942,304,28672,2304,4096,ck,0,0,657.782,a8w8_blockscale_1x128x128_256x128x128x128_16x16_32x32_2x2_8x32x1_8x32x1_1x32x1x8_8_1x1_intrawave_v3,822.71,393.74,0.0
gfx942,304,28800,2304,4096,ck,0,0,676.031,a8w8_blockscale_1x128x128_256x128x128x128_16x16_32x32_2x2_8x32x1_8x32x1_1x32x1x8_8_1x1_intrawave_v3,804.08,384.76,0.0
gfx942,304,28928,2304,4096,ck,0,0,669.7155,a8w8_blockscale_1x128x128_256x128x128x128_16x16_32x32_2x2_8x32x1_8x32x1_1x32x1x8_8_1x1_intrawave_v3,815.27,390.06,0.0
gfx942,304,29056,2304,4096,ck,0,0,679.4869,a8w8_blockscale_1x128x128_256x128x128x128_16x16_32x32_2x2_8x32x1_8x32x1_1x32x1x8_8_1x1_intrawave_v3,807.1,386.09,0.0
gfx942,304,29184,2304,4096,ck,0,0,681.4688,a8w8_blockscale_1x128x128_256x128x128x128_16x16_32x32_2x2_8x32x1_8x32x1_1x32x1x8_8_1x1_intrawave_v3,808.3,386.6,0.0
gfx942,304,29312,2304,4096,ck,0,0,696.8577,a8w8_blockscale_1x128x128_256x128x128x128_16x16_32x32_2x2_8x32x1_8x32x1_1x32x1x8_8_1x1_intrawave_v3,793.91,379.66,0.0
gfx942,304,29440,2304,4096,ck,0,0,702.9743,a8w8_blockscale_1x128x128_256x128x128x128_16x16_32x32_2x2_8x32x1_8x32x1_1x32x1x8_8_1x1_intrawave_v3,790.44,377.94,0.0
gfx942,304,29568,2304,4096,ck,0,0,695.5274,a8w8_blockscale_1x128x128_256x128x128x128_16x16_32x32_2x2_8x32x1_8x32x1_1x32x1x8_8_1x1_intrawave_v3,802.38,383.59,0.0
gfx942,304,29696,2304,4096,ck,0,0,681.7502,a8w8_blockscale_1x128x128_256x128x128x128_16x16_32x32_2x2_8x32x1_8x32x1_1x32x1x8_8_1x1_intrawave_v3,822.14,392.98,0.0
gfx942,304,29824,2304,4096,ck,0,0,717.8682,a8w8_blockscale_1x128x128_256x128x128x128_16x16_32x32_2x2_8x32x1_8x32x1_1x32x1x8_8_1x1_intrawave_v3,784.14,374.76,0.0
gfx942,304,29952,2304,4096,ck,0,0,710.0743,a8w8_blockscale_1x128x128_256x128x128x128_16x16_32x32_2x2_8x32x1_8x32x1_1x32x1x8_8_1x1_intrawave_v3,796.15,380.44,0.0
gfx942,304,30080,2304,4096,ck,0,0,709.0159,a8w8_blockscale_1x128x128_256x128x128x128_16x16_32x32_2x2_8x32x1_8x32x1_1x32x1x8_8_1x1_intrawave_v3,800.75,382.58,0.0
gfx942,304,30208,2304,4096,ck,0,0,700.8498,a8w8_blockscale_1x128x128_256x128x128x128_16x16_32x32_2x2_8x32x1_8x32x1_1x32x1x8_8_1x1_intrawave_v3,813.52,388.62,0.0
gfx942,304,30336,2304,4096,ck,0,0,731.8612,a8w8_blockscale_1x128x128_256x128x128x128_16x16_32x32_2x2_8x32x1_8x32x1_1x32x1x8_8_1x1_intrawave_v3,782.35,373.68,0.0
gfx942,304,30464,2304,4096,ck,0,0,729.7736,a8w8_blockscale_1x128x128_256x128x128x128_16x16_32x32_2x2_8x32x1_8x32x1_1x32x1x8_8_1x1_intrawave_v3,787.9,376.28,0.0
gfx942,304,30592,2304,4096,ck,0,0,720.0703,a8w8_blockscale_1x128x128_256x128x128x128_16x16_32x32_2x2_8x32x1_8x32x1_1x32x1x8_8_1x1_intrawave_v3,801.87,382.89,0.0
gfx942,304,30720,2304,4096,ck,0,0,704.9966,a8w8_blockscale_1x128x128_256x128x128x128_16x16_32x32_2x2_8x32x1_8x32x1_1x32x1x8_8_1x1_intrawave_v3,822.44,392.66,0.0
gfx942,304,30848,2304,4096,ck,0,0,729.8228,a8w8_blockscale_1x128x128_256x128x128x128_16x16_32x32_2x2_8x32x1_8x32x1_1x32x1x8_8_1x1_intrawave_v3,797.78,380.83,0.0
gfx942,304,30976,2304,4096,ck,0,0,729.2696,a8w8_blockscale_1x128x128_256x128x128x128_16x16_32x32_2x2_8x32x1_8x32x1_1x32x1x8_8_1x1_intrawave_v3,801.7,382.65,0.0
gfx942,304,31104,2304,4096,ck,0,0,742.9605,a8w8_blockscale_1x128x128_256x128x128x128_16x16_32x32_2x2_8x32x1_8x32x1_1x32x1x8_8_1x1_intrawave_v3,790.17,377.09,0.0
gfx942,304,31232,2304,4096,ck,0,0,738.2326,a8w8_blockscale_1x128x128_256x128x128x128_16x16_32x32_2x2_8x32x1_8x32x1_1x32x1x8_8_1x1_intrawave_v3,798.51,381.02,0.0
gfx942,304,31360,2304,4096,ck,0,0,720.7119,a8w8_blockscale_1x128x128_256x128x128x128_16x16_32x32_2x2_8x32x1_8x32x1_1x32x1x8_8_1x1_intrawave_v3,821.27,391.83,0.0
gfx942,304,31488,2304,4096,ck,0,0,735.8741,a8w8_blockscale_1x128x128_256x128x128x128_16x16_32x32_2x2_8x32x1_8x32x1_1x32x1x8_8_1x1_intrawave_v3,807.63,385.27,0.0
gfx942,304,31616,2304,4096,ck,0,0,738.5093,a8w8_blockscale_1x128x128_256x128x128x128_16x16_32x32_2x2_8x32x1_8x32x1_1x32x1x8_8_1x1_intrawave_v3,808.02,385.4,0.0
gfx942,304,31744,2304,4096,ck,0,0,729.0071,a8w8_blockscale_1x128x128_256x128x128x128_16x16_32x32_2x2_8x32x1_8x32x1_1x32x1x8_8_1x1_intrawave_v3,821.87,391.95,0.0
gfx942,304,31872,2304,4096,ck,0,0,735.3451,a8w8_blockscale_1x128x128_256x128x128x128_16x16_32x32_2x2_8x32x1_8x32x1_1x32x1x8_8_1x1_intrawave_v3,818.07,390.09,0.0
gfx942,304,32000,2304,4096,ck,0,0,760.7414,a8w8_blockscale_1x128x128_256x128x128x128_16x16_32x32_2x2_8x32x1_8x32x1_1x32x1x8_8_1x1_intrawave_v3,793.94,378.53,0.0
gfx942,304,32128,2304,4096,ck,0,0,747.3525,a8w8_blockscale_1x128x128_256x128x128x128_16x16_32x32_2x2_8x32x1_8x32x1_1x32x1x8_8_1x1_intrawave_v3,811.39,386.8,0.0
gfx942,304,32256,2304,4096,ck,0,0,761.6632,a8w8_blockscale_1x128x128_256x128x128x128_16x16_32x32_2x2_8x32x1_8x32x1_1x32x1x8_8_1x1_intrawave_v3,799.32,381.0,0.0
gfx942,304,32384,2304,4096,ck,0,0,759.9953,a8w8_blockscale_1x128x128_256x128x128x128_16x16_32x32_2x2_8x32x1_8x32x1_1x32x1x8_8_1x1_intrawave_v3,804.25,383.3,0.0
gfx942,304,32512,2304,4096,ck,0,0,767.2377,a8w8_blockscale_1x128x128_256x128x128x128_16x16_32x32_2x2_8x32x1_8x32x1_1x32x1x8_8_1x1_intrawave_v3,799.81,381.14,0.0
gfx942,304,32640,2304,4096,ck,0,0,760.7739,a8w8_blockscale_1x128x128_256x128x128x128_16x16_32x32_2x2_8x32x1_8x32x1_1x32x1x8_8_1x1_intrawave_v3,809.78,385.84,0.0
gfx942,304,32768,2304,4096,ck,0,0,758.1589,a8w8_blockscale_1x128x128_256x128x128x128_16x16_32x32_2x2_8x32x1_8x32x1_1x32x1x8_8_1x1_intrawave_v3,815.76,388.64,0.0
gfx942,304,32896,2304,4096,ck,0,0,758.6362,a8w8_blockscale_1x128x128_256x128x128x128_16x16_32x32_2x2_8x32x1_8x32x1_1x32x1x8_8_1x1_intrawave_v3,818.43,389.86,0.0
gfx942,304,33024,2304,4096,ck,0,0,766.1716,a8w8_blockscale_1x128x128_256x128x128x128_16x16_32x32_2x2_8x32x1_8x32x1_1x32x1x8_8_1x1_intrawave_v3,813.53,387.48,0.0
gfx942,304,33152,2304,4096,ck,0,0,781.8479,a8w8_blockscale_1x128x128_256x128x128x128_16x16_32x32_2x2_8x32x1_8x32x1_1x32x1x8_8_1x1_intrawave_v3,800.31,381.14,0.0
gfx942,304,33280,2304,4096,ck,0,0,768.8964,a8w8_blockscale_1x128x128_256x128x128x128_16x16_32x32_2x2_8x32x1_8x32x1_1x32x1x8_8_1x1_intrawave_v3,816.94,389.01,0.0
gfx942,304,33408,2304,4096,ck,0,0,772.5227,a8w8_blockscale_1x128x128_256x128x128x128_16x16_32x32_2x2_8x32x1_8x32x1_1x32x1x8_8_1x1_intrawave_v3,816.23,388.62,0.0
gfx942,304,33536,2304,4096,ck,0,0,764.1947,a8w8_blockscale_1x128x128_256x128x128x128_16x16_32x32_2x2_8x32x1_8x32x1_1x32x1x8_8_1x1_intrawave_v3,828.28,394.32,0.0
gfx942,304,33664,2304,4096,ck,0,0,777.7641,a8w8_blockscale_1x128x128_256x128x128x128_16x16_32x32_2x2_8x32x1_8x32x1_1x32x1x8_8_1x1_intrawave_v3,816.94,388.87,0.0
gfx942,304,33792,2304,4096,ck,0,0,771.5985,a8w8_blockscale_1x128x128_256x128x128x128_16x16_32x32_2x2_8x32x1_8x32x1_1x32x1x8_8_1x1_intrawave_v3,826.6,393.42,0.0
gfx942,304,33920,2304,4096,ck,0,0,794.3086,a8w8_blockscale_1x128x128_256x128x128x128_16x16_32x32_2x2_8x32x1_8x32x1_1x32x1x8_8_1x1_intrawave_v3,806.01,383.57,0.0
gfx942,304,34048,2304,4096,ck,0,0,784.3687,a8w8_blockscale_1x128x128_256x128x128x128_16x16_32x32_2x2_8x32x1_8x32x1_1x32x1x8_8_1x1_intrawave_v3,819.3,389.86,0.0
gfx942,304,34176,2304,4096,ck,0,0,790.7808,a8w8_blockscale_1x128x128_256x128x128x128_16x16_32x32_2x2_8x32x1_8x32x1_1x32x1x8_8_1x1_intrawave_v3,815.71,388.1,0.0
gfx942,304,34304,2304,4096,ck,0,0,794.8904,a8w8_blockscale_1x128x128_256x128x128x128_16x16_32x32_2x2_8x32x1_8x32x1_1x32x1x8_8_1x1_intrawave_v3,814.54,387.5,0.0
gfx942,304,34432,2304,4096,ck,0,0,803.4697,a8w8_blockscale_1x128x128_256x128x128x128_16x16_32x32_2x2_8x32x1_8x32x1_1x32x1x8_8_1x1_intrawave_v3,808.84,384.75,0.0
gfx942,304,34560,2304,4096,ck,0,0,796.5755,a8w8_blockscale_1x128x128_256x128x128x128_16x16_32x32_2x2_8x32x1_8x32x1_1x32x1x8_8_1x1_intrawave_v3,818.88,389.48,0.0
gfx942,304,34688,2304,4096,ck,0,0,799.1023,a8w8_blockscale_1x128x128_256x128x128x128_16x16_32x32_2x2_8x32x1_8x32x1_1x32x1x8_8_1x1_intrawave_v3,819.31,389.64,0.0
gfx942,304,34816,2304,4096,ck,0,0,814.22,a8w8_blockscale_1x128x128_256x128x128x128_16x16_32x32_2x2_8x32x1_8x32x1_1x32x1x8_8_1x1_intrawave_v3,807.07,383.77,0.0
gfx942,304,34944,2304,4096,ck,0,0,820.3883,a8w8_blockscale_1x128x128_256x128x128x128_16x16_32x32_2x2_8x32x1_8x32x1_1x32x1x8_8_1x1_intrawave_v3,803.94,382.25,0.0
gfx942,304,35072,2304,4096,ck,0,0,815.1208,a8w8_blockscale_1x128x128_256x128x128x128_16x16_32x32_2x2_8x32x1_8x32x1_1x32x1x8_8_1x1_intrawave_v3,812.1,386.08,0.0
gfx942,304,35200,2304,4096,ck,0,0,827.3048,a8w8_blockscale_1x128x128_256x128x128x128_16x16_32x32_2x2_8x32x1_8x32x1_1x32x1x8_8_1x1_intrawave_v3,803.06,381.74,0.0
gfx942,304,35328,2304,4096,ck,0,0,814.9256,a8w8_blockscale_1x128x128_256x128x128x128_16x16_32x32_2x2_8x32x1_8x32x1_1x32x1x8_8_1x1_intrawave_v3,818.23,388.91,0.0
gfx942,304,35456,2304,4096,ck,0,0,841.2388,a8w8_blockscale_1x128x128_256x128x128x128_16x16_32x32_2x2_8x32x1_8x32x1_1x32x1x8_8_1x1_intrawave_v3,795.5,378.07,0.0
gfx942,304,35584,2304,4096,ck,0,0,822.1671,a8w8_blockscale_1x128x128_256x128x128x128_16x16_32x32_2x2_8x32x1_8x32x1_1x32x1x8_8_1x1_intrawave_v3,816.9,388.19,0.0
gfx942,304,35712,2304,4096,ck,0,0,818.4355,a8w8_blockscale_1x128x128_256x128x128x128_16x16_32x32_2x2_8x32x1_8x32x1_1x32x1x8_8_1x1_intrawave_v3,823.57,391.33,0.0
gfx942,304,35840,2304,4096,ck,0,0,828.8672,a8w8_blockscale_1x128x128_256x128x128x128_16x16_32x32_2x2_8x32x1_8x32x1_1x32x1x8_8_1x1_intrawave_v3,816.12,387.74,0.0
gfx942,304,35968,2304,4096,ck,0,0,848.3982,a8w8_blockscale_1x128x128_256x128x128x128_16x16_32x32_2x2_8x32x1_8x32x1_1x32x1x8_8_1x1_intrawave_v3,800.18,380.13,0.0
gfx942,304,36096,2304,4096,ck,0,0,843.37,a8w8_blockscale_1x128x128_256x128x128x128_16x16_32x32_2x2_8x32x1_8x32x1_1x32x1x8_8_1x1_intrawave_v3,807.82,383.72,0.0
gfx942,304,36224,2304,4096,ck,0,0,853.9338,a8w8_blockscale_1x128x128_256x128x128x128_16x16_32x32_2x2_8x32x1_8x32x1_1x32x1x8_8_1x1_intrawave_v3,800.65,380.28,0.0
gfx942,304,36352,2304,4096,ck,0,0,838.0241,a8w8_blockscale_1x128x128_256x128x128x128_16x16_32x32_2x2_8x32x1_8x32x1_1x32x1x8_8_1x1_intrawave_v3,818.74,388.83,0.0
gfx942,304,36480,2304,4096,ck,0,0,866.2914,a8w8_blockscale_1x128x128_256x128x128x128_16x16_32x32_2x2_8x32x1_8x32x1_1x32x1x8_8_1x1_intrawave_v3,794.81,377.42,0.0
gfx942,304,36608,2304,4096,ck,0,0,852.2095,a8w8_blockscale_1x128x128_256x128x128x128_16x16_32x32_2x2_8x32x1_8x32x1_1x32x1x8_8_1x1_intrawave_v3,810.78,384.97,0.0
gfx942,304,36736,2304,4096,ck,0,0,865.5429,a8w8_blockscale_1x128x128_256x128x128x128_16x16_32x32_2x2_8x32x1_8x32x1_1x32x1x8_8_1x1_intrawave_v3,801.08,380.32,0.0
gfx942,304,36864,2304,4096,ck,0,0,832.1778,a8w8_blockscale_1x128x128_256x128x128x128_16x16_32x32_2x2_8x32x1_8x32x1_1x32x1x8_8_1x1_intrawave_v3,836.1,396.91,0.0
gfx942,304,36992,2304,4096,ck,0,0,859.8451,a8w8_blockscale_1x128x128_256x128x128x128_16x16_32x32_2x2_8x32x1_8x32x1_1x32x1x8_8_1x1_intrawave_v3,812.01,385.44,0.0
gfx942,304,37120,2304,4096,ck,0,0,852.7613,a8w8_blockscale_1x128x128_256x128x128x128_16x16_32x32_2x2_8x32x1_8x32x1_1x32x1x8_8_1x1_intrawave_v3,821.59,389.94,0.0
gfx942,304,37248,2304,4096,ck,0,0,860.2299,a8w8_blockscale_1x128x128_256x128x128x128_16x16_32x32_2x2_8x32x1_8x32x1_1x32x1x8_8_1x1_intrawave_v3,817.26,387.85,0.0
gfx942,304,37376,2304,4096,ck,0,0,858.9803,a8w8_blockscale_1x128x128_256x128x128x128_16x16_32x32_2x2_8x32x1_8x32x1_1x32x1x8_8_1x1_intrawave_v3,821.26,389.72,0.0
gfx942,304,37504,2304,4096,ck,0,0,881.0054,a8w8_blockscale_1x128x128_256x128x128x128_16x16_32x32_2x2_8x32x1_8x32x1_1x32x1x8_8_1x1_intrawave_v3,803.47,381.24,0.0
gfx942,304,37632,2304,4096,ck,0,0,882.1133,a8w8_blockscale_1x128x128_256x128x128x128_16x16_32x32_2x2_8x32x1_8x32x1_1x32x1x8_8_1x1_intrawave_v3,805.2,382.02,0.0
gfx942,304,37760,2304,4096,ck,0,0,869.6661,a8w8_blockscale_1x128x128_256x128x128x128_16x16_32x32_2x2_8x32x1_8x32x1_1x32x1x8_8_1x1_intrawave_v3,819.51,388.77,0.0
gfx942,304,37888,2304,4096,ck,0,0,887.2597,a8w8_blockscale_1x128x128_256x128x128x128_16x16_32x32_2x2_8x32x1_8x32x1_1x32x1x8_8_1x1_intrawave_v3,805.98,382.32,0.0
gfx942,304,38016,2304,4096,ck,0,0,889.0221,a8w8_blockscale_1x128x128_256x128x128x128_16x16_32x32_2x2_8x32x1_8x32x1_1x32x1x8_8_1x1_intrawave_v3,807.1,382.81,0.0
gfx942,304,38144,2304,4096,ck,0,0,893.7252,a8w8_blockscale_1x128x128_256x128x128x128_16x16_32x32_2x2_8x32x1_8x32x1_1x32x1x8_8_1x1_intrawave_v3,805.55,382.04,0.0
gfx942,304,38272,2304,4096,ck,0,0,892.3031,a8w8_blockscale_1x128x128_256x128x128x128_16x16_32x32_2x2_8x32x1_8x32x1_1x32x1x8_8_1x1_intrawave_v3,809.55,383.9,0.0
gfx942,304,38400,2304,4096,ck,0,0,880.2635,a8w8_blockscale_1x128x128_256x128x128x128_16x16_32x32_2x2_8x32x1_8x32x1_1x32x1x8_8_1x1_intrawave_v3,823.36,390.42,0.0
gfx942,304,38528,2304,4096,ck,0,0,897.3199,a8w8_blockscale_1x128x128_256x128x128x128_16x16_32x32_2x2_8x32x1_8x32x1_1x32x1x8_8_1x1_intrawave_v3,810.4,384.24,0.0
gfx942,304,38656,2304,4096,ck,0,0,904.0342,a8w8_blockscale_1x128x128_256x128x128x128_16x16_32x32_2x2_8x32x1_8x32x1_1x32x1x8_8_1x1_intrawave_v3,807.06,382.62,0.0
gfx942,304,38784,2304,4096,ck,0,0,886.414,a8w8_blockscale_1x128x128_256x128x128x128_16x16_32x32_2x2_8x32x1_8x32x1_1x32x1x8_8_1x1_intrawave_v3,825.83,391.48,0.0
gfx942,304,38912,2304,4096,ck,0,0,885.6645,a8w8_blockscale_1x128x128_256x128x128x128_16x16_32x32_2x2_8x32x1_8x32x1_1x32x1x8_8_1x1_intrawave_v3,829.25,393.07,0.0
gfx942,304,39040,2304,4096,ck,0,0,906.5448,a8w8_blockscale_1x128x128_256x128x128x128_16x16_32x32_2x2_8x32x1_8x32x1_1x32x1x8_8_1x1_intrawave_v3,812.82,385.24,0.0
gfx942,304,39168,2304,4096,ck,0,0,916.6295,a8w8_blockscale_1x128x128_256x128x128x128_16x16_32x32_2x2_8x32x1_8x32x1_1x32x1x8_8_1x1_intrawave_v3,806.51,382.22,0.0
gfx942,304,39296,2304,4096,ck,0,0,906.0465,a8w8_blockscale_1x128x128_256x128x128x128_16x16_32x32_2x2_8x32x1_8x32x1_1x32x1x8_8_1x1_intrawave_v3,818.6,387.92,0.0
gfx942,304,39424,2304,4096,ck,0,0,907.0128,a8w8_blockscale_1x128x128_256x128x128x128_16x16_32x32_2x2_8x32x1_8x32x1_1x32x1x8_8_1x1_intrawave_v3,820.39,388.73,0.0
gfx942,304,39552,2304,4096,ck,0,0,912.9092,a8w8_blockscale_1x128x128_256x128x128x128_16x16_32x32_2x2_8x32x1_8x32x1_1x32x1x8_8_1x1_intrawave_v3,817.74,387.44,0.0
gfx942,304,39680,2304,4096,ck,0,0,933.7595,a8w8_blockscale_1x128x128_256x128x128x128_16x16_32x32_2x2_8x32x1_8x32x1_1x32x1x8_8_1x1_intrawave_v3,802.06,379.98,0.0
gfx942,304,39808,2304,4096,ck,0,0,917.0148,a8w8_blockscale_1x128x128_256x128x128x128_16x16_32x32_2x2_8x32x1_8x32x1_1x32x1x8_8_1x1_intrawave_v3,819.34,388.14,0.0
gfx942,304,39936,2304,4096,ck,0,0,940.6088,a8w8_blockscale_1x128x128_256x128x128x128_16x16_32x32_2x2_8x32x1_8x32x1_1x32x1x8_8_1x1_intrawave_v3,801.36,379.58,0.0
gfx942,304,40064,2304,4096,ck,0,0,919.6642,a8w8_blockscale_1x128x128_256x128x128x128_16x16_32x32_2x2_8x32x1_8x32x1_1x32x1x8_8_1x1_intrawave_v3,822.24,389.44,0.0
gfx942,304,40192,2304,4096,ck,0,0,919.8839,a8w8_blockscale_1x128x128_256x128x128x128_16x16_32x32_2x2_8x32x1_8x32x1_1x32x1x8_8_1x1_intrawave_v3,824.67,390.56,0.0
gfx942,304,40320,2304,4096,ck,0,0,954.5614,a8w8_blockscale_1x128x128_256x128x128x128_16x16_32x32_2x2_8x32x1_8x32x1_1x32x1x8_8_1x1_intrawave_v3,797.24,377.54,0.0
gfx942,304,40448,2304,4096,ck,0,0,952.6291,a8w8_blockscale_1x128x128_256x128x128x128_16x16_32x32_2x2_8x32x1_8x32x1_1x32x1x8_8_1x1_intrawave_v3,801.39,379.47,0.0
gfx942,304,40576,2304,4096,ck,0,0,934.0358,a8w8_blockscale_1x128x128_256x128x128x128_16x16_32x32_2x2_8x32x1_8x32x1_1x32x1x8_8_1x1_intrawave_v3,819.93,388.22,0.0
gfx942,304,40704,2304,4096,ck,0,0,929.9255,a8w8_blockscale_1x128x128_256x128x128x128_16x16_32x32_2x2_8x32x1_8x32x1_1x32x1x8_8_1x1_intrawave_v3,826.15,391.13,0.0
gfx942,304,40832,2304,4096,ck,0,0,951.7803,a8w8_blockscale_1x128x128_256x128x128x128_16x16_32x32_2x2_8x32x1_8x32x1_1x32x1x8_8_1x1_intrawave_v3,809.72,383.32,0.0
gfx942,304,40960,2304,4096,ck,0,0,943.5465,a8w8_blockscale_1x128x128_256x128x128x128_16x16_32x32_2x2_8x32x1_8x32x1_1x32x1x8_8_1x1_intrawave_v3,819.35,387.85,0.0
gfx942,304,41088,2304,4096,ck,0,0,961.6143,a8w8_blockscale_1x128x128_256x128x128x128_16x16_32x32_2x2_8x32x1_8x32x1_1x32x1x8_8_1x1_intrawave_v3,806.47,381.72,0.0
gfx942,304,41216,2304,4096,ck,0,0,974.6185,a8w8_blockscale_1x128x128_256x128x128x128_16x16_32x32_2x2_8x32x1_8x32x1_1x32x1x8_8_1x1_intrawave_v3,798.19,377.77,0.0
gfx942,304,41344,2304,4096,ck,0,0,971.4501,a8w8_blockscale_1x128x128_256x128x128x128_16x16_32x32_2x2_8x32x1_8x32x1_1x32x1x8_8_1x1_intrawave_v3,803.28,380.15,0.0
gfx942,304,41472,2304,4096,ck,0,0,955.5868,a8w8_blockscale_1x128x128_256x128x128x128_16x16_32x32_2x2_8x32x1_8x32x1_1x32x1x8_8_1x1_intrawave_v3,819.14,387.63,0.0
gfx942,304,41600,2304,4096,ck,0,0,984.3527,a8w8_blockscale_1x128x128_256x128x128x128_16x16_32x32_2x2_8x32x1_8x32x1_1x32x1x8_8_1x1_intrawave_v3,797.65,377.43,0.0
gfx942,304,41728,2304,4096,ck,0,0,972.3288,a8w8_blockscale_1x128x128_256x128x128x128_16x16_32x32_2x2_8x32x1_8x32x1_1x32x1x8_8_1x1_intrawave_v3,810.0,383.24,0.0
gfx942,304,41856,2304,4096,ck,0,0,978.3897,a8w8_blockscale_1x128x128_256x128x128x128_16x16_32x32_2x2_8x32x1_8x32x1_1x32x1x8_8_1x1_intrawave_v3,807.45,382.01,0.0
gfx942,304,41984,2304,4096,ck,0,0,959.5435,a8w8_blockscale_1x128x128_256x128x128x128_16x16_32x32_2x2_8x32x1_8x32x1_1x32x1x8_8_1x1_intrawave_v3,825.83,390.67,0.0
gfx942,304,42112,2304,4096,ck,0,0,966.6584,a8w8_blockscale_1x128x128_256x128x128x128_16x16_32x32_2x2_8x32x1_8x32x1_1x32x1x8_8_1x1_intrawave_v3,822.25,388.95,0.0
gfx942,304,42240,2304,4096,ck,0,0,986.694,a8w8_blockscale_1x128x128_256x128x128x128_16x16_32x32_2x2_8x32x1_8x32x1_1x32x1x8_8_1x1_intrawave_v3,808.0,382.18,0.0
gfx942,304,42368,2304,4096,ck,0,0,972.6887,a8w8_blockscale_1x128x128_256x128x128x128_16x16_32x32_2x2_8x32x1_8x32x1_1x32x1x8_8_1x1_intrawave_v3,822.12,388.83,0.0
gfx942,304,42496,2304,4096,ck,0,0,1001.1761,a8w8_blockscale_1x128x128_256x128x128x128_16x16_32x32_2x2_8x32x1_8x32x1_1x32x1x8_8_1x1_intrawave_v3,801.14,378.88,0.0
gfx942,304,42624,2304,4096,ck,0,0,977.9112,a8w8_blockscale_1x128x128_256x128x128x128_16x16_32x32_2x2_8x32x1_8x32x1_1x32x1x8_8_1x1_intrawave_v3,822.67,389.03,0.0
gfx942,304,42752,2304,4096,ck,0,0,982.5363,a8w8_blockscale_1x128x128_256x128x128x128_16x16_32x32_2x2_8x32x1_8x32x1_1x32x1x8_8_1x1_intrawave_v3,821.26,388.33,0.0
gfx942,304,42880,2304,4096,ck,0,0,979.1043,a8w8_blockscale_1x128x128_256x128x128x128_16x16_32x32_2x2_8x32x1_8x32x1_1x32x1x8_8_1x1_intrawave_v3,826.61,390.83,0.0
gfx942,304,43008,2304,4096,ck,0,0,1001.6072,a8w8_blockscale_1x128x128_256x128x128x128_16x16_32x32_2x2_8x32x1_8x32x1_1x32x1x8_8_1x1_intrawave_v3,810.45,383.16,0.0
gfx942,304,43136,2304,4096,ck,0,0,991.2805,a8w8_blockscale_1x128x128_256x128x128x128_16x16_32x32_2x2_8x32x1_8x32x1_1x32x1x8_8_1x1_intrawave_v3,821.33,388.28,0.0
gfx942,304,43264,2304,4096,ck,0,0,992.1812,a8w8_blockscale_1x128x128_256x128x128x128_16x16_32x32_2x2_8x32x1_8x32x1_1x32x1x8_8_1x1_intrawave_v3,823.02,389.05,0.0
gfx942,304,43392,2304,4096,ck,0,0,1021.645,a8w8_blockscale_1x128x128_256x128x128x128_16x16_32x32_2x2_8x32x1_8x32x1_1x32x1x8_8_1x1_intrawave_v3,801.64,378.92,0.0
gfx942,304,43520,2304,4096,ck,0,0,1014.7691,a8w8_blockscale_1x128x128_256x128x128x128_16x16_32x32_2x2_8x32x1_8x32x1_1x32x1x8_8_1x1_intrawave_v3,809.46,382.58,0.0
gfx942,304,43648,2304,4096,ck,0,0,1031.2334,a8w8_blockscale_1x128x128_256x128x128x128_16x16_32x32_2x2_8x32x1_8x32x1_1x32x1x8_8_1x1_intrawave_v3,798.88,377.56,0.0
gfx942,304,43776,2304,4096,ck,0,0,1001.8984,a8w8_blockscale_1x128x128_256x128x128x128_16x16_32x32_2x2_8x32x1_8x32x1_1x32x1x8_8_1x1_intrawave_v3,824.68,389.72,0.0
gfx942,304,43904,2304,4096,ck,0,0,1001.0876,a8w8_blockscale_1x128x128_256x128x128x128_16x16_32x32_2x2_8x32x1_8x32x1_1x32x1x8_8_1x1_intrawave_v3,827.76,391.15,0.0
gfx942,304,44032,2304,4096,ck,0,0,1003.8655,a8w8_blockscale_1x128x128_256x128x128x128_16x16_32x32_2x2_8x32x1_8x32x1_1x32x1x8_8_1x1_intrawave_v3,827.88,391.18,0.0
gfx942,304,44160,2304,4096,ck,0,0,1000.2151,a8w8_blockscale_1x128x128_256x128x128x128_16x16_32x32_2x2_8x32x1_8x32x1_1x32x1x8_8_1x1_intrawave_v3,833.31,393.72,0.0
gfx942,304,44288,2304,4096,ck,0,0,1023.2435,a8w8_blockscale_1x128x128_256x128x128x128_16x16_32x32_2x2_8x32x1_8x32x1_1x32x1x8_8_1x1_intrawave_v3,816.92,385.95,0.0
gfx942,304,44416,2304,4096,ck,0,0,1036.9894,a8w8_blockscale_1x128x128_256x128x128x128_16x16_32x32_2x2_8x32x1_8x32x1_1x32x1x8_8_1x1_intrawave_v3,808.42,381.91,0.0
gfx942,304,44544,2304,4096,ck,0,0,1027.4059,a8w8_blockscale_1x128x128_256x128x128x128_16x16_32x32_2x2_8x32x1_8x32x1_1x32x1x8_8_1x1_intrawave_v3,818.31,386.55,0.0
gfx942,304,44672,2304,4096,ck,0,0,1042.4355,a8w8_blockscale_1x128x128_256x128x128x128_16x16_32x32_2x2_8x32x1_8x32x1_1x32x1x8_8_1x1_intrawave_v3,808.83,382.05,0.0
gfx942,304,44800,2304,4096,ck,0,0,1043.69,a8w8_blockscale_1x128x128_256x128x128x128_16x16_32x32_2x2_8x32x1_8x32x1_1x32x1x8_8_1x1_intrawave_v3,810.18,382.66,0.0
gfx942,304,44928,2304,4096,ck,0,0,1016.3381,a8w8_blockscale_1x128x128_256x128x128x128_16x16_32x32_2x2_8x32x1_8x32x1_1x32x1x8_8_1x1_intrawave_v3,834.36,394.05,0.0
gfx942,304,45056,2304,4096,ck,0,0,1008.9482,a8w8_blockscale_1x128x128_256x128x128x128_16x16_32x32_2x2_8x32x1_8x32x1_1x32x1x8_8_1x1_intrawave_v3,842.86,398.04,0.0
gfx942,304,45184,2304,4096,ck,0,0,1027.4983,a8w8_blockscale_1x128x128_256x128x128x128_16x16_32x32_2x2_8x32x1_8x32x1_1x32x1x8_8_1x1_intrawave_v3,830.0,391.94,0.0
gfx942,304,45312,2304,4096,ck,0,0,1030.1812,a8w8_blockscale_1x128x128_256x128x128x128_16x16_32x32_2x2_8x32x1_8x32x1_1x32x1x8_8_1x1_intrawave_v3,830.18,392.0,0.0
gfx942,304,45440,2304,4096,ck,0,0,1049.9617,a8w8_blockscale_1x128x128_256x128x128x128_16x16_32x32_2x2_8x32x1_8x32x1_1x32x1x8_8_1x1_intrawave_v3,816.84,385.68,0.0
gfx942,304,45568,2304,4096,ck,0,0,1062.9866,a8w8_blockscale_1x128x128_256x128x128x128_16x16_32x32_2x2_8x32x1_8x32x1_1x32x1x8_8_1x1_intrawave_v3,809.1,382.0,0.0
gfx942,304,45696,2304,4096,ck,0,0,1058.9567,a8w8_blockscale_1x128x128_256x128x128x128_16x16_32x32_2x2_8x32x1_8x32x1_1x32x1x8_8_1x1_intrawave_v3,814.46,384.51,0.0
gfx942,304,45824,2304,4096,ck,0,0,1039.9114,a8w8_blockscale_1x128x128_256x128x128x128_16x16_32x32_2x2_8x32x1_8x32x1_1x32x1x8_8_1x1_intrawave_v3,831.7,392.62,0.0
gfx942,304,45952,2304,4096,ck,0,0,1070.3563,a8w8_blockscale_1x128x128_256x128x128x128_16x16_32x32_2x2_8x32x1_8x32x1_1x32x1x8_8_1x1_intrawave_v3,810.3,382.49,0.0
gfx942,304,46080,2304,4096,ck,0,0,1047.6284,a8w8_blockscale_1x128x128_256x128x128x128_16x16_32x32_2x2_8x32x1_8x32x1_1x32x1x8_8_1x1_intrawave_v3,830.19,391.85,0.0
gfx942,304,46208,2304,4096,ck,0,0,1060.8245,a8w8_blockscale_1x128x128_256x128x128x128_16x16_32x32_2x2_8x32x1_8x32x1_1x32x1x8_8_1x1_intrawave_v3,822.14,388.03,0.0
gfx942,304,46336,2304,4096,ck,0,0,1051.0724,a8w8_blockscale_1x128x128_256x128x128x128_16x16_32x32_2x2_8x32x1_8x32x1_1x32x1x8_8_1x1_intrawave_v3,832.07,392.69,0.0
gfx942,304,46464,2304,4096,ck,0,0,1075.7965,a8w8_blockscale_1x128x128_256x128x128x128_16x16_32x32_2x2_8x32x1_8x32x1_1x32x1x8_8_1x1_intrawave_v3,815.19,384.7,0.0
gfx942,304,46592,2304,4096,ck,0,0,1080.9756,a8w8_blockscale_1x128x128_256x128x128x128_16x16_32x32_2x2_8x32x1_8x32x1_1x32x1x8_8_1x1_intrawave_v3,813.52,383.89,0.0
gfx942,304,46720,2304,4096,ck,0,0,1073.2552,a8w8_blockscale_1x128x128_256x128x128x128_16x16_32x32_2x2_8x32x1_8x32x1_1x32x1x8_8_1x1_intrawave_v3,821.62,387.69,0.0
gfx942,304,46848,2304,4096,ck,0,0,1053.4403,a8w8_blockscale_1x128x128_256x128x128x128_16x16_32x32_2x2_8x32x1_8x32x1_1x32x1x8_8_1x1_intrawave_v3,839.37,396.04,0.0
gfx942,304,46976,2304,4096,ck,0,0,1091.7189,a8w8_blockscale_1x128x128_256x128x128x128_16x16_32x32_2x2_8x32x1_8x32x1_1x32x1x8_8_1x1_intrawave_v3,812.15,383.17,0.0
gfx942,304,47104,2304,4096,ck,0,0,1094.0287,a8w8_blockscale_1x128x128_256x128x128x128_16x16_32x32_2x2_8x32x1_8x32x1_1x32x1x8_8_1x1_intrawave_v3,812.65,383.38,0.0
gfx942,304,47232,2304,4096,ck,0,0,1090.1095,a8w8_blockscale_1x128x128_256x128x128x128_16x16_32x32_2x2_8x32x1_8x32x1_1x32x1x8_8_1x1_intrawave_v3,817.78,385.78,0.0
gfx942,304,47360,2304,4096,ck,0,0,1095.6671,a8w8_blockscale_1x128x128_256x128x128x128_16x16_32x32_2x2_8x32x1_8x32x1_1x32x1x8_8_1x1_intrawave_v3,815.84,384.84,0.0
gfx942,304,47488,2304,4096,ck,0,0,1095.1458,a8w8_blockscale_1x128x128_256x128x128x128_16x16_32x32_2x2_8x32x1_8x32x1_1x32x1x8_8_1x1_intrawave_v3,818.44,386.04,0.0
gfx942,304,47616,2304,4096,ck,0,0,1079.8138,a8w8_blockscale_1x128x128_256x128x128x128_16x16_32x32_2x2_8x32x1_8x32x1_1x32x1x8_8_1x1_intrawave_v3,832.29,392.56,0.0
gfx942,304,47744,2304,4096,ck,0,0,1096.0705,a8w8_blockscale_1x128x128_256x128x128x128_16x16_32x32_2x2_8x32x1_8x32x1_1x32x1x8_8_1x1_intrawave_v3,822.15,387.75,0.0
gfx942,304,47872,2304,4096,ck,0,0,1121.8486,a8w8_blockscale_1x128x128_256x128x128x128_16x16_32x32_2x2_8x32x1_8x32x1_1x32x1x8_8_1x1_intrawave_v3,805.42,379.83,0.0
gfx942,304,48000,2304,4096,ck,0,0,1092.7343,a8w8_blockscale_1x128x128_256x128x128x128_16x16_32x32_2x2_8x32x1_8x32x1_1x32x1x8_8_1x1_intrawave_v3,829.09,390.97,0.0
gfx942,304,48128,2304,4096,ck,0,0,1094.1598,a8w8_blockscale_1x128x128_256x128x128x128_16x16_32x32_2x2_8x32x1_8x32x1_1x32x1x8_8_1x1_intrawave_v3,830.21,391.48,0.0
gfx942,304,48256,2304,4096,ck,0,0,1093.0873,a8w8_blockscale_1x128x128_256x128x128x128_16x16_32x32_2x2_8x32x1_8x32x1_1x32x1x8_8_1x1_intrawave_v3,833.24,392.88,0.0
gfx942,304,48384,2304,4096,ck,0,0,1119.6111,a8w8_blockscale_1x128x128_256x128x128x128_16x16_32x32_2x2_8x32x1_8x32x1_1x32x1x8_8_1x1_intrawave_v3,815.66,384.57,0.0
gfx942,304,48512,2304,4096,ck,0,0,1130.9223,a8w8_blockscale_1x128x128_256x128x128x128_16x16_32x32_2x2_8x32x1_8x32x1_1x32x1x8_8_1x1_intrawave_v3,809.63,381.71,0.0
gfx942,304,48640,2304,4096,ck,0,0,1140.5081,a8w8_blockscale_1x128x128_256x128x128x128_16x16_32x32_2x2_8x32x1_8x32x1_1x32x1x8_8_1x1_intrawave_v3,804.95,379.48,0.0
gfx942,304,48768,2304,4096,ck,0,0,1132.6539,a8w8_blockscale_1x128x128_256x128x128x128_16x16_32x32_2x2_8x32x1_8x32x1_1x32x1x8_8_1x1_intrawave_v3,812.66,383.09,0.0
gfx942,304,48896,2304,4096,ck,0,0,1130.7426,a8w8_blockscale_1x128x128_256x128x128x128_16x16_32x32_2x2_8x32x1_8x32x1_1x32x1x8_8_1x1_intrawave_v3,816.17,384.73,0.0
gfx942,304,49024,2304,4096,ck,0,0,1116.7701,a8w8_blockscale_1x128x128_256x128x128x128_16x16_32x32_2x2_8x32x1_8x32x1_1x32x1x8_8_1x1_intrawave_v3,828.55,390.54,0.0
gfx942,304,49152,2304,4096,ck,0,0,1105.386,a8w8_blockscale_1x128x128_256x128x128x128_16x16_32x32_2x2_8x32x1_8x32x1_1x32x1x8_8_1x1_intrawave_v3,839.27,395.57,0.0
gfx942,304,49280,2304,4096,ck,0,0,1146.9412,a8w8_blockscale_1x128x128_256x128x128x128_16x16_32x32_2x2_8x32x1_8x32x1_1x32x1x8_8_1x1_intrawave_v3,810.96,382.21,0.0
gfx942,304,49408,2304,4096,ck,0,0,1137.7073,a8w8_blockscale_1x128x128_256x128x128x128_16x16_32x32_2x2_8x32x1_8x32x1_1x32x1x8_8_1x1_intrawave_v3,819.67,386.29,0.0
gfx942,304,49536,2304,4096,ck,0,0,1158.0204,a8w8_blockscale_1x128x128_256x128x128x128_16x16_32x32_2x2_8x32x1_8x32x1_1x32x1x8_8_1x1_intrawave_v3,807.38,380.48,0.0
gfx942,304,49664,2304,4096,ck,0,0,1158.245,a8w8_blockscale_1x128x128_256x128x128x128_16x16_32x32_2x2_8x32x1_8x32x1_1x32x1x8_8_1x1_intrawave_v3,809.31,381.36,0.0
gfx942,304,49792,2304,4096,ck,0,0,1157.6351,a8w8_blockscale_1x128x128_256x128x128x128_16x16_32x32_2x2_8x32x1_8x32x1_1x32x1x8_8_1x1_intrawave_v3,811.82,382.53,0.0
gfx942,304,49920,2304,4096,ck,0,0,1136.7934,a8w8_blockscale_1x128x128_256x128x128x128_16x16_32x32_2x2_8x32x1_8x32x1_1x32x1x8_8_1x1_intrawave_v3,828.83,390.52,0.0
gfx942,304,50048,2304,4096,ck,0,0,1162.2739,a8w8_blockscale_1x128x128_256x128x128x128_16x16_32x32_2x2_8x32x1_8x32x1_1x32x1x8_8_1x1_intrawave_v3,812.74,382.92,0.0
gfx942,304,50176,2304,4096,ck,0,0,1140.9078,a8w8_blockscale_1x128x128_256x128x128x128_16x16_32x32_2x2_8x32x1_8x32x1_1x32x1x8_8_1x1_intrawave_v3,830.08,391.06,0.0
gfx942,304,50304,2304,4096,ck,0,0,1156.1158,a8w8_blockscale_1x128x128_256x128x128x128_16x16_32x32_2x2_8x32x1_8x32x1_1x32x1x8_8_1x1_intrawave_v3,821.25,386.88,0.0
gfx942,304,50432,2304,4096,ck,0,0,1156.3837,a8w8_blockscale_1x128x128_256x128x128x128_16x16_32x32_2x2_8x32x1_8x32x1_1x32x1x8_8_1x1_intrawave_v3,823.15,387.76,0.0
gfx942,304,50560,2304,4096,ck,0,0,1158.4288,a8w8_blockscale_1x128x128_256x128x128x128_16x16_32x32_2x2_8x32x1_8x32x1_1x32x1x8_8_1x1_intrawave_v3,823.78,388.04,0.0
gfx942,304,50688,2304,4096,ck,0,0,1152.7759,a8w8_blockscale_1x128x128_256x128x128x128_16x16_32x32_2x2_8x32x1_8x32x1_1x32x1x8_8_1x1_intrawave_v3,829.91,390.9,0.0
gfx942,304,50816,2304,4096,ck,0,0,1162.1742,a8w8_blockscale_1x128x128_256x128x128x128_16x16_32x32_2x2_8x32x1_8x32x1_1x32x1x8_8_1x1_intrawave_v3,825.28,388.7,0.0
gfx942,304,50944,2304,4096,ck,0,0,1162.2848,a8w8_blockscale_1x128x128_256x128x128x128_16x16_32x32_2x2_8x32x1_8x32x1_1x32x1x8_8_1x1_intrawave_v3,827.28,389.62,0.0
gfx942,304,51072,2304,4096,ck,0,0,1175.6227,a8w8_blockscale_1x128x128_256x128x128x128_16x16_32x32_2x2_8x32x1_8x32x1_1x32x1x8_8_1x1_intrawave_v3,819.95,386.15,0.0
gfx942,304,51200,2304,4096,ck,0,0,1175.9389,a8w8_blockscale_1x128x128_256x128x128x128_16x16_32x32_2x2_8x32x1_8x32x1_1x32x1x8_8_1x1_intrawave_v3,821.78,386.99,0.0
gfx942,304,51328,2304,4096,ck,0,0,1178.3179,a8w8_blockscale_1x128x128_256x128x128x128_16x16_32x32_2x2_8x32x1_8x32x1_1x32x1x8_8_1x1_intrawave_v3,822.18,387.16,0.0
gfx942,304,51456,2304,4096,ck,0,0,1180.3886,a8w8_blockscale_1x128x128_256x128x128x128_16x16_32x32_2x2_8x32x1_8x32x1_1x32x1x8_8_1x1_intrawave_v3,822.78,387.42,0.0
gfx942,304,51584,2304,4096,ck,0,0,1171.7591,a8w8_blockscale_1x128x128_256x128x128x128_16x16_32x32_2x2_8x32x1_8x32x1_1x32x1x8_8_1x1_intrawave_v3,830.9,391.23,0.0
gfx942,304,51712,2304,4096,ck,0,0,1198.1157,a8w8_blockscale_1x128x128_256x128x128x128_16x16_32x32_2x2_8x32x1_8x32x1_1x32x1x8_8_1x1_intrawave_v3,814.64,383.55,0.0
gfx942,304,51840,2304,4096,ck,0,0,1214.2372,a8w8_blockscale_1x128x128_256x128x128x128_16x16_32x32_2x2_8x32x1_8x32x1_1x32x1x8_8_1x1_intrawave_v3,805.81,379.38,0.0
gfx942,304,51968,2304,4096,ck,0,0,1220.6509,a8w8_blockscale_1x128x128_256x128x128x128_16x16_32x32_2x2_8x32x1_8x32x1_1x32x1x8_8_1x1_intrawave_v3,803.56,378.3,0.0
gfx942,304,52096,2304,4096,ck,0,0,1208.3264,a8w8_blockscale_1x128x128_256x128x128x128_16x16_32x32_2x2_8x32x1_8x32x1_1x32x1x8_8_1x1_intrawave_v3,813.75,383.08,0.0
gfx942,304,52224,2304,4096,ck,0,0,1185.1164,a8w8_blockscale_1x128x128_256x128x128x128_16x16_32x32_2x2_8x32x1_8x32x1_1x32x1x8_8_1x1_intrawave_v3,831.73,391.52,0.0
gfx942,304,52352,2304,4096,ck,0,0,1193.867,a8w8_blockscale_1x128x128_256x128x128x128_16x16_32x32_2x2_8x32x1_8x32x1_1x32x1x8_8_1x1_intrawave_v3,827.66,389.58,0.0
gfx942,304,52480,2304,4096,ck,0,0,1201.6798,a8w8_blockscale_1x128x128_256x128x128x128_16x16_32x32_2x2_8x32x1_8x32x1_1x32x1x8_8_1x1_intrawave_v3,824.29,387.98,0.0
gfx942,304,52608,2304,4096,ck,0,0,1199.6159,a8w8_blockscale_1x128x128_256x128x128x128_16x16_32x32_2x2_8x32x1_8x32x1_1x32x1x8_8_1x1_intrawave_v3,827.72,389.57,0.0
gfx942,304,52736,2304,4096,ck,0,0,1205.9022,a8w8_blockscale_1x128x128_256x128x128x128_16x16_32x32_2x2_8x32x1_8x32x1_1x32x1x8_8_1x1_intrawave_v3,825.41,388.47,0.0
gfx942,304,52864,2304,4096,ck,0,0,1223.079,a8w8_blockscale_1x128x128_256x128x128x128_16x16_32x32_2x2_8x32x1_8x32x1_1x32x1x8_8_1x1_intrawave_v3,815.79,383.92,0.0
gfx942,304,52992,2304,4096,ck,0,0,1244.4652,a8w8_blockscale_1x128x128_256x128x128x128_16x16_32x32_2x2_8x32x1_8x32x1_1x32x1x8_8_1x1_intrawave_v3,803.71,378.22,0.0
gfx942,304,53120,2304,4096,ck,0,0,1209.9024,a8w8_blockscale_1x128x128_256x128x128x128_16x16_32x32_2x2_8x32x1_8x32x1_1x32x1x8_8_1x1_intrawave_v3,828.67,389.94,0.0
gfx942,304,53248,2304,4096,ck,0,0,1228.7045,a8w8_blockscale_1x128x128_256x128x128x128_16x16_32x32_2x2_8x32x1_8x32x1_1x32x1x8_8_1x1_intrawave_v3,817.95,384.88,0.0
gfx942,304,53376,2304,4096,ck,0,0,1250.6655,a8w8_blockscale_1x128x128_256x128x128x128_16x16_32x32_2x2_8x32x1_8x32x1_1x32x1x8_8_1x1_intrawave_v3,805.52,379.02,0.0
gfx942,304,53504,2304,4096,ck,0,0,1249.6573,a8w8_blockscale_1x128x128_256x128x128x128_16x16_32x32_2x2_8x32x1_8x32x1_1x32x1x8_8_1x1_intrawave_v3,808.1,380.21,0.0
gfx942,304,53632,2304,4096,ck,0,0,1218.4901,a8w8_blockscale_1x128x128_256x128x128x128_16x16_32x32_2x2_8x32x1_8x32x1_1x32x1x8_8_1x1_intrawave_v3,830.76,390.85,0.0
gfx942,304,53760,2304,4096,ck,0,0,1245.2144,a8w8_blockscale_1x128x128_256x128x128x128_16x16_32x32_2x2_8x32x1_8x32x1_1x32x1x8_8_1x1_intrawave_v3,814.87,383.36,0.0
gfx942,304,53888,2304,4096,ck,0,0,1247.0652,a8w8_blockscale_1x128x128_256x128x128x128_16x16_32x32_2x2_8x32x1_8x32x1_1x32x1x8_8_1x1_intrawave_v3,815.6,383.68,0.0
gfx942,304,54016,2304,4096,ck,0,0,1223.2462,a8w8_blockscale_1x128x128_256x128x128x128_16x16_32x32_2x2_8x32x1_8x32x1_1x32x1x8_8_1x1_intrawave_v3,833.45,392.07,0.0
gfx942,304,54144,2304,4096,ck,0,0,1228.9514,a8w8_blockscale_1x128x128_256x128x128x128_16x16_32x32_2x2_8x32x1_8x32x1_1x32x1x8_8_1x1_intrawave_v3,831.55,391.15,0.0
gfx942,304,54272,2304,4096,ck,0,0,1254.415,a8w8_blockscale_1x128x128_256x128x128x128_16x16_32x32_2x2_8x32x1_8x32x1_1x32x1x8_8_1x1_intrawave_v3,816.6,384.1,0.0
gfx942,304,54400,2304,4096,ck,0,0,1230.511,a8w8_blockscale_1x128x128_256x128x128x128_16x16_32x32_2x2_8x32x1_8x32x1_1x32x1x8_8_1x1_intrawave_v3,834.42,392.47,0.0
gfx942,304,54528,2304,4096,ck,0,0,1258.1149,a8w8_blockscale_1x128x128_256x128x128x128_16x16_32x32_2x2_8x32x1_8x32x1_1x32x1x8_8_1x1_intrawave_v3,818.03,384.74,0.0
gfx942,304,54656,2304,4096,ck,0,0,1249.6773,a8w8_blockscale_1x128x128_256x128x128x128_16x16_32x32_2x2_8x32x1_8x32x1_1x32x1x8_8_1x1_intrawave_v3,825.49,388.23,0.0
gfx942,304,54784,2304,4096,ck,0,0,1238.6446,a8w8_blockscale_1x128x128_256x128x128x128_16x16_32x32_2x2_8x32x1_8x32x1_1x32x1x8_8_1x1_intrawave_v3,834.79,392.59,0.0
gfx942,304,54912,2304,4096,ck,0,0,1276.1806,a8w8_blockscale_1x128x128_256x128x128x128_16x16_32x32_2x2_8x32x1_8x32x1_1x32x1x8_8_1x1_intrawave_v3,812.13,381.91,0.0
gfx942,304,55040,2304,4096,ck,0,0,1277.3424,a8w8_blockscale_1x128x128_256x128x128x128_16x16_32x32_2x2_8x32x1_8x32x1_1x32x1x8_8_1x1_intrawave_v3,813.29,382.44,0.0
gfx942,304,55168,2304,4096,ck,0,0,1291.5314,a8w8_blockscale_1x128x128_256x128x128x128_16x16_32x32_2x2_8x32x1_8x32x1_1x32x1x8_8_1x1_intrawave_v3,806.22,379.1,0.0
gfx942,304,55296,2304,4096,ck,0,0,1233.2056,a8w8_blockscale_1x128x128_256x128x128x128_16x16_32x32_2x2_8x32x1_8x32x1_1x32x1x8_8_1x1_intrawave_v3,846.31,397.93,0.0
gfx942,304,55424,2304,4096,ck,0,0,1259.0213,a8w8_blockscale_1x128x128_256x128x128x128_16x16_32x32_2x2_8x32x1_8x32x1_1x32x1x8_8_1x1_intrawave_v3,830.88,390.66,0.0
gfx942,304,55552,2304,4096,ck,0,0,1300.9826,a8w8_blockscale_1x128x128_256x128x128x128_16x16_32x32_2x2_8x32x1_8x32x1_1x32x1x8_8_1x1_intrawave_v3,805.94,378.91,0.0
gfx942,304,55680,2304,4096,ck,0,0,1307.2712,a8w8_blockscale_1x128x128_256x128x128x128_16x16_32x32_2x2_8x32x1_8x32x1_1x32x1x8_8_1x1_intrawave_v3,803.91,377.94,0.0
gfx942,304,55808,2304,4096,ck,0,0,1273.7027,a8w8_blockscale_1x128x128_256x128x128x128_16x16_32x32_2x2_8x32x1_8x32x1_1x32x1x8_8_1x1_intrawave_v3,826.99,388.78,0.0
gfx942,304,55936,2304,4096,ck,0,0,1301.3874,a8w8_blockscale_1x128x128_256x128x128x128_16x16_32x32_2x2_8x32x1_8x32x1_1x32x1x8_8_1x1_intrawave_v3,811.25,381.37,0.0
gfx942,304,56064,2304,4096,ck,0,0,1276.7068,a8w8_blockscale_1x128x128_256x128x128x128_16x16_32x32_2x2_8x32x1_8x32x1_1x32x1x8_8_1x1_intrawave_v3,828.83,389.61,0.0
gfx942,304,56192,2304,4096,ck,0,0,1287.1256,a8w8_blockscale_1x128x128_256x128x128x128_16x16_32x32_2x2_8x32x1_8x32x1_1x32x1x8_8_1x1_intrawave_v3,824.0,387.32,0.0
gfx942,304,56320,2304,4096,ck,0,0,1283.7256,a8w8_blockscale_1x128x128_256x128x128x128_16x16_32x32_2x2_8x32x1_8x32x1_1x32x1x8_8_1x1_intrawave_v3,828.06,389.22,0.0
gfx942,304,56448,2304,4096,ck,0,0,1287.45,a8w8_blockscale_1x128x128_256x128x128x128_16x16_32x32_2x2_8x32x1_8x32x1_1x32x1x8_8_1x1_intrawave_v3,827.54,388.96,0.0
gfx942,304,56576,2304,4096,ck,0,0,1300.9484,a8w8_blockscale_1x128x128_256x128x128x128_16x16_32x32_2x2_8x32x1_8x32x1_1x32x1x8_8_1x1_intrawave_v3,820.81,385.78,0.0
gfx942,304,56704,2304,4096,ck,0,0,1278.5062,a8w8_blockscale_1x128x128_256x128x128x128_16x16_32x32_2x2_8x32x1_8x32x1_1x32x1x8_8_1x1_intrawave_v3,837.11,393.42,0.0
gfx942,304,56832,2304,4096,ck,0,0,1294.5863,a8w8_blockscale_1x128x128_256x128x128x128_16x16_32x32_2x2_8x32x1_8x32x1_1x32x1x8_8_1x1_intrawave_v3,828.58,389.39,0.0
gfx942,304,56960,2304,4096,ck,0,0,1287.7767,a8w8_blockscale_1x128x128_256x128x128x128_16x16_32x32_2x2_8x32x1_8x32x1_1x32x1x8_8_1x1_intrawave_v3,834.84,392.32,0.0
gfx942,304,57088,2304,4096,ck,0,0,1317.526,a8w8_blockscale_1x128x128_256x128x128x128_16x16_32x32_2x2_8x32x1_8x32x1_1x32x1x8_8_1x1_intrawave_v3,817.82,384.3,0.0
gfx942,304,57216,2304,4096,ck,0,0,1285.4134,a8w8_blockscale_1x128x128_256x128x128x128_16x16_32x32_2x2_8x32x1_8x32x1_1x32x1x8_8_1x1_intrawave_v3,840.13,394.77,0.0
gfx942,304,57344,2304,4096,ck,0,0,1297.417,a8w8_blockscale_1x128x128_256x128x128x128_16x16_32x32_2x2_8x32x1_8x32x1_1x32x1x8_8_1x1_intrawave_v3,834.22,391.98,0.0
gfx942,304,57472,2304,4096,ck,0,0,1302.2879,a8w8_blockscale_1x128x128_256x128x128x128_16x16_32x32_2x2_8x32x1_8x32x1_1x32x1x8_8_1x1_intrawave_v3,832.96,391.37,0.0
gfx942,304,57600,2304,4096,ck,0,0,1294.6595,a8w8_blockscale_1x128x128_256x128x128x128_16x16_32x32_2x2_8x32x1_8x32x1_1x32x1x8_8_1x1_intrawave_v3,839.73,394.53,0.0
gfx942,304,57728,2304,4096,ck,0,0,1310.8295,a8w8_blockscale_1x128x128_256x128x128x128_16x16_32x32_2x2_8x32x1_8x32x1_1x32x1x8_8_1x1_intrawave_v3,831.21,390.52,0.0
gfx942,304,57856,2304,4096,ck,0,0,1322.0967,a8w8_blockscale_1x128x128_256x128x128x128_16x16_32x32_2x2_8x32x1_8x32x1_1x32x1x8_8_1x1_intrawave_v3,825.96,388.03,0.0
gfx942,304,57984,2304,4096,ck,0,0,1348.6232,a8w8_blockscale_1x128x128_256x128x128x128_16x16_32x32_2x2_8x32x1_8x32x1_1x32x1x8_8_1x1_intrawave_v3,811.5,381.23,0.0
gfx942,304,58112,2304,4096,ck,0,0,1327.3003,a8w8_blockscale_1x128x128_256x128x128x128_16x16_32x32_2x2_8x32x1_8x32x1_1x32x1x8_8_1x1_intrawave_v3,826.36,388.19,0.0
gfx942,304,58240,2304,4096,ck,0,0,1315.2216,a8w8_blockscale_1x128x128_256x128x128x128_16x16_32x32_2x2_8x32x1_8x32x1_1x32x1x8_8_1x1_intrawave_v3,835.79,392.6,0.0
gfx942,304,58368,2304,4096,ck,0,0,1316.5026,a8w8_blockscale_1x128x128_256x128x128x128_16x16_32x32_2x2_8x32x1_8x32x1_1x32x1x8_8_1x1_intrawave_v3,836.81,393.07,0.0
gfx942,304,58496,2304,4096,ck,0,0,1359.3476,a8w8_blockscale_1x128x128_256x128x128x128_16x16_32x32_2x2_8x32x1_8x32x1_1x32x1x8_8_1x1_intrawave_v3,812.21,381.5,0.0
gfx942,304,58624,2304,4096,ck,0,0,1330.9064,a8w8_blockscale_1x128x128_256x128x128x128_16x16_32x32_2x2_8x32x1_8x32x1_1x32x1x8_8_1x1_intrawave_v3,831.38,390.49,0.0
gfx942,304,58752,2304,4096,ck,0,0,1364.0538,a8w8_blockscale_1x128x128_256x128x128x128_16x16_32x32_2x2_8x32x1_8x32x1_1x32x1x8_8_1x1_intrawave_v3,812.95,381.81,0.0
gfx942,304,58880,2304,4096,ck,0,0,1363.9582,a8w8_blockscale_1x128x128_256x128x128x128_16x16_32x32_2x2_8x32x1_8x32x1_1x32x1x8_8_1x1_intrawave_v3,814.78,382.66,0.0
gfx942,304,59008,2304,4096,ck,0,0,1328.6313,a8w8_blockscale_1x128x128_256x128x128x128_16x16_32x32_2x2_8x32x1_8x32x1_1x32x1x8_8_1x1_intrawave_v3,838.26,393.67,0.0
gfx942,304,59136,2304,4096,ck,0,0,1335.5671,a8w8_blockscale_1x128x128_256x128x128x128_16x16_32x32_2x2_8x32x1_8x32x1_1x32x1x8_8_1x1_intrawave_v3,835.72,392.46,0.0
gfx942,304,59264,2304,4096,ck,0,0,1373.6023,a8w8_blockscale_1x128x128_256x128x128x128_16x16_32x32_2x2_8x32x1_8x32x1_1x32x1x8_8_1x1_intrawave_v3,814.33,382.4,0.0
gfx942,304,59392,2304,4096,ck,0,0,1356.6043,a8w8_blockscale_1x128x128_256x128x128x128_16x16_32x32_2x2_8x32x1_8x32x1_1x32x1x8_8_1x1_intrawave_v3,826.32,388.02,0.0
gfx942,304,59520,2304,4096,ck,0,0,1334.9301,a8w8_blockscale_1x128x128_256x128x128x128_16x16_32x32_2x2_8x32x1_8x32x1_1x32x1x8_8_1x1_intrawave_v3,841.54,395.15,0.0
gfx942,304,59648,2304,4096,ck,0,0,1358.6687,a8w8_blockscale_1x128x128_256x128x128x128_16x16_32x32_2x2_8x32x1_8x32x1_1x32x1x8_8_1x1_intrawave_v3,828.62,389.07,0.0
gfx942,304,59776,2304,4096,ck,0,0,1356.7512,a8w8_blockscale_1x128x128_256x128x128x128_16x16_32x32_2x2_8x32x1_8x32x1_1x32x1x8_8_1x1_intrawave_v3,831.57,390.44,0.0
gfx942,304,59904,2304,4096,ck,0,0,1357.2925,a8w8_blockscale_1x128x128_256x128x128x128_16x16_32x32_2x2_8x32x1_8x32x1_1x32x1x8_8_1x1_intrawave_v3,833.02,391.1,0.0
gfx942,304,60032,2304,4096,ck,0,0,1381.1013,a8w8_blockscale_1x128x128_256x128x128x128_16x16_32x32_2x2_8x32x1_8x32x1_1x32x1x8_8_1x1_intrawave_v3,820.41,385.17,0.0
gfx942,304,60160,2304,4096,ck,0,0,1356.1896,a8w8_blockscale_1x128x128_256x128x128x128_16x16_32x32_2x2_8x32x1_8x32x1_1x32x1x8_8_1x1_intrawave_v3,837.26,393.06,0.0
gfx942,304,60288,2304,4096,ck,0,0,1362.9702,a8w8_blockscale_1x128x128_256x128x128x128_16x16_32x32_2x2_8x32x1_8x32x1_1x32x1x8_8_1x1_intrawave_v3,834.87,391.93,0.0
gfx942,304,60416,2304,4096,ck,0,0,1372.8282,a8w8_blockscale_1x128x128_256x128x128x128_16x16_32x32_2x2_8x32x1_8x32x1_1x32x1x8_8_1x1_intrawave_v3,830.63,389.92,0.0
gfx942,304,60544,2304,4096,ck,0,0,1368.7387,a8w8_blockscale_1x128x128_256x128x128x128_16x16_32x32_2x2_8x32x1_8x32x1_1x32x1x8_8_1x1_intrawave_v3,834.88,391.9,0.0
gfx942,304,60672,2304,4096,ck,0,0,1404.1816,a8w8_blockscale_1x128x128_256x128x128x128_16x16_32x32_2x2_8x32x1_8x32x1_1x32x1x8_8_1x1_intrawave_v3,815.53,382.8,0.0
gfx942,304,60800,2304,4096,ck,0,0,1376.311,a8w8_blockscale_1x128x128_256x128x128x128_16x16_32x32_2x2_8x32x1_8x32x1_1x32x1x8_8_1x1_intrawave_v3,833.8,391.37,0.0
gfx942,304,60928,2304,4096,ck,0,0,1401.8661,a8w8_blockscale_1x128x128_256x128x128x128_16x16_32x32_2x2_8x32x1_8x32x1_1x32x1x8_8_1x1_intrawave_v3,820.32,385.03,0.0
gfx942,304,61056,2304,4096,ck,0,0,1370.658,a8w8_blockscale_1x128x128_256x128x128x128_16x16_32x32_2x2_8x32x1_8x32x1_1x32x1x8_8_1x1_intrawave_v3,840.76,394.61,0.0
gfx942,304,61184,2304,4096,ck,0,0,1421.7237,a8w8_blockscale_1x128x128_256x128x128x128_16x16_32x32_2x2_8x32x1_8x32x1_1x32x1x8_8_1x1_intrawave_v3,812.26,381.22,0.0
gfx942,304,61312,2304,4096,ck,0,0,1408.8378,a8w8_blockscale_1x128x128_256x128x128x128_16x16_32x32_2x2_8x32x1_8x32x1_1x32x1x8_8_1x1_intrawave_v3,821.4,385.49,0.0
gfx942,304,61440,2304,4096,ck,0,0,1380.9944,a8w8_blockscale_1x128x128_256x128x128x128_16x16_32x32_2x2_8x32x1_8x32x1_1x32x1x8_8_1x1_intrawave_v3,839.71,394.07,0.0
gfx942,304,61568,2304,4096,ck,0,0,1400.254,a8w8_blockscale_1x128x128_256x128x128x128_16x16_32x32_2x2_8x32x1_8x32x1_1x32x1x8_8_1x1_intrawave_v3,829.89,389.45,0.0
gfx942,304,61696,2304,4096,ck,0,0,1406.4064,a8w8_blockscale_1x128x128_256x128x128x128_16x16_32x32_2x2_8x32x1_8x32x1_1x32x1x8_8_1x1_intrawave_v3,827.98,388.54,0.0
gfx942,304,61824,2304,4096,ck,0,0,1401.4169,a8w8_blockscale_1x128x128_256x128x128x128_16x16_32x32_2x2_8x32x1_8x32x1_1x32x1x8_8_1x1_intrawave_v3,832.65,390.71,0.0
gfx942,304,61952,2304,4096,ck,0,0,1415.1551,a8w8_blockscale_1x128x128_256x128x128x128_16x16_32x32_2x2_8x32x1_8x32x1_1x32x1x8_8_1x1_intrawave_v3,826.27,387.71,0.0
gfx942,304,62080,2304,4096,ck,0,0,1454.7696,a8w8_blockscale_1x128x128_256x128x128x128_16x16_32x32_2x2_8x32x1_8x32x1_1x32x1x8_8_1x1_intrawave_v3,805.43,377.92,0.0
gfx942,304,62208,2304,4096,ck,0,0,1443.2594,a8w8_blockscale_1x128x128_256x128x128x128_16x16_32x32_2x2_8x32x1_8x32x1_1x32x1x8_8_1x1_intrawave_v3,813.53,381.7,0.0
gfx942,304,62336,2304,4096,ck,0,0,1402.0324,a8w8_blockscale_1x128x128_256x128x128x128_16x16_32x32_2x2_8x32x1_8x32x1_1x32x1x8_8_1x1_intrawave_v3,839.18,393.72,0.0
gfx942,304,62464,2304,4096,ck,0,0,1410.5973,a8w8_blockscale_1x128x128_256x128x128x128_16x16_32x32_2x2_8x32x1_8x32x1_1x32x1x8_8_1x1_intrawave_v3,835.79,392.12,0.0
gfx942,304,62592,2304,4096,ck,0,0,1430.6695,a8w8_blockscale_1x128x128_256x128x128x128_16x16_32x32_2x2_8x32x1_8x32x1_1x32x1x8_8_1x1_intrawave_v3,825.76,387.4,0.0
gfx942,304,62720,2304,4096,ck,0,0,1415.5623,a8w8_blockscale_1x128x128_256x128x128x128_16x16_32x32_2x2_8x32x1_8x32x1_1x32x1x8_8_1x1_intrawave_v3,836.28,392.32,0.0
gfx942,304,62848,2304,4096,ck,0,0,1457.2008,a8w8_blockscale_1x128x128_256x128x128x128_16x16_32x32_2x2_8x32x1_8x32x1_1x32x1x8_8_1x1_intrawave_v3,814.04,381.87,0.0
gfx942,304,62976,2304,4096,ck,0,0,1417.6284,a8w8_blockscale_1x128x128_256x128x128x128_16x16_32x32_2x2_8x32x1_8x32x1_1x32x1x8_8_1x1_intrawave_v3,838.47,393.32,0.0
gfx942,304,63104,2304,4096,ck,0,0,1428.7203,a8w8_blockscale_1x128x128_256x128x128x128_16x16_32x32_2x2_8x32x1_8x32x1_1x32x1x8_8_1x1_intrawave_v3,833.65,391.05,0.0
gfx942,304,63232,2304,4096,ck,0,0,1432.7668,a8w8_blockscale_1x128x128_256x128x128x128_16x16_32x32_2x2_8x32x1_8x32x1_1x32x1x8_8_1x1_intrawave_v3,832.98,390.72,0.0
gfx942,304,63360,2304,4096,ck,0,0,1479.4534,a8w8_blockscale_1x128x128_256x128x128x128_16x16_32x32_2x2_8x32x1_8x32x1_1x32x1x8_8_1x1_intrawave_v3,808.33,379.14,0.0
gfx942,304,63488,2304,4096,ck,0,0,1441.0455,a8w8_blockscale_1x128x128_256x128x128x128_16x16_32x32_2x2_8x32x1_8x32x1_1x32x1x8_8_1x1_intrawave_v3,831.55,390.02,0.0
gfx942,304,63616,2304,4096,ck,0,0,1444.0426,a8w8_blockscale_1x128x128_256x128x128x128_16x16_32x32_2x2_8x32x1_8x32x1_1x32x1x8_8_1x1_intrawave_v3,831.49,389.98,0.0
gfx942,304,63744,2304,4096,ck,0,0,1438.334,a8w8_blockscale_1x128x128_256x128x128x128_16x16_32x32_2x2_8x32x1_8x32x1_1x32x1x8_8_1x1_intrawave_v3,836.47,392.3,0.0
gfx942,304,63872,2304,4096,ck,0,0,1445.1751,a8w8_blockscale_1x128x128_256x128x128x128_16x16_32x32_2x2_8x32x1_8x32x1_1x32x1x8_8_1x1_intrawave_v3,834.19,391.22,0.0
gfx942,304,64000,2304,4096,ck,0,0,1481.0038,a8w8_blockscale_1x128x128_256x128x128x128_16x16_32x32_2x2_8x32x1_8x32x1_1x32x1x8_8_1x1_intrawave_v3,815.64,382.51,0.0
gfx942,304,64128,2304,4096,ck,0,0,1502.2179,a8w8_blockscale_1x128x128_256x128x128x128_16x16_32x32_2x2_8x32x1_8x32x1_1x32x1x8_8_1x1_intrawave_v3,805.73,377.85,0.0
gfx942,304,64256,2304,4096,ck,0,0,1487.5447,a8w8_blockscale_1x128x128_256x128x128x128_16x16_32x32_2x2_8x32x1_8x32x1_1x32x1x8_8_1x1_intrawave_v3,815.3,382.32,0.0
gfx942,304,64384,2304,4096,ck,0,0,1460.121,a8w8_blockscale_1x128x128_256x128x128x128_16x16_32x32_2x2_8x32x1_8x32x1_1x32x1x8_8_1x1_intrawave_v3,832.26,390.27,0.0
gfx942,304,64512,2304,4096,ck,0,0,1487.1123,a8w8_blockscale_1x128x128_256x128x128x128_16x16_32x32_2x2_8x32x1_8x32x1_1x32x1x8_8_1x1_intrawave_v3,818.78,383.93,0.0
gfx942,304,64640,2304,4096,ck,0,0,1469.7222,a8w8_blockscale_1x128x128_256x128x128x128_16x16_32x32_2x2_8x32x1_8x32x1_1x32x1x8_8_1x1_intrawave_v3,830.12,389.23,0.0
gfx942,304,64768,2304,4096,ck,0,0,1520.3611,a8w8_blockscale_1x128x128_256x128x128x128_16x16_32x32_2x2_8x32x1_8x32x1_1x32x1x8_8_1x1_intrawave_v3,804.06,377.0,0.0
gfx942,304,64896,2304,4096,ck,0,0,1484.5557,a8w8_blockscale_1x128x128_256x128x128x128_16x16_32x32_2x2_8x32x1_8x32x1_1x32x1x8_8_1x1_intrawave_v3,825.08,386.84,0.0
gfx942,304,65024,2304,4096,ck,0,0,1458.7806,a8w8_blockscale_1x128x128_256x128x128x128_16x16_32x32_2x2_8x32x1_8x32x1_1x32x1x8_8_1x1_intrawave_v3,841.31,394.44,0.0
gfx942,304,65152,2304,4096,ck,0,0,1514.1146,a8w8_blockscale_1x128x128_256x128x128x128_16x16_32x32_2x2_8x32x1_8x32x1_1x32x1x8_8_1x1_intrawave_v3,812.16,380.76,0.0
gfx942,304,65280,2304,4096,ck,0,0,1519.8096,a8w8_blockscale_1x128x128_256x128x128x128_16x16_32x32_2x2_8x32x1_8x32x1_1x32x1x8_8_1x1_intrawave_v3,810.71,380.07,0.0
gfx942,304,65408,2304,4096,ck,0,0,1504.0967,a8w8_blockscale_1x128x128_256x128x128x128_16x16_32x32_2x2_8x32x1_8x32x1_1x32x1x8_8_1x1_intrawave_v3,820.78,384.78,0.0
gfx942,304,65536,2304,4096,ck,0,0,1497.793,a8w8_blockscale_1x128x128_256x128x128x128_16x16_32x32_2x2_8x32x1_8x32x1_1x32x1x8_8_1x1_intrawave_v3,825.85,387.14,0.0
gfx942,304,65664,2304,4096,ck,0,0,1494.2477,a8w8_blockscale_1x128x128_256x128x128x128_16x16_32x32_2x2_8x32x1_8x32x1_1x32x1x8_8_1x1_intrawave_v3,829.43,388.81,0.0
gfx942,304,65792,2304,4096,ck,0,0,1509.3041,a8w8_blockscale_1x128x128_256x128x128x128_16x16_32x32_2x2_8x32x1_8x32x1_1x32x1x8_8_1x1_intrawave_v3,822.75,385.67,0.0
gfx942,304,65920,2304,4096,ck,0,0,1502.9485,a8w8_blockscale_1x128x128_256x128x128x128_16x16_32x32_2x2_8x32x1_8x32x1_1x32x1x8_8_1x1_intrawave_v3,827.84,388.04,0.0
gfx942,304,66048,2304,4096,ck,0,0,1502.4554,a8w8_blockscale_1x128x128_256x128x128x128_16x16_32x32_2x2_8x32x1_8x32x1_1x32x1x8_8_1x1_intrawave_v3,829.72,388.91,0.0
gfx942,304,66176,2304,4096,ck,0,0,1493.9377,a8w8_blockscale_1x128x128_256x128x128x128_16x16_32x32_2x2_8x32x1_8x32x1_1x32x1x8_8_1x1_intrawave_v3,836.07,391.87,0.0
gfx942,304,66304,2304,4096,ck,0,0,1493.9114,a8w8_blockscale_1x128x128_256x128x128x128_16x16_32x32_2x2_8x32x1_8x32x1_1x32x1x8_8_1x1_intrawave_v3,837.7,392.63,0.0
gfx942,304,66432,2304,4096,ck,0,0,1535.4368,a8w8_blockscale_1x128x128_256x128x128x128_16x16_32x32_2x2_8x32x1_8x32x1_1x32x1x8_8_1x1_intrawave_v3,816.62,382.73,0.0
gfx942,304,66560,2304,4096,ck,0,0,1536.8673,a8w8_blockscale_1x128x128_256x128x128x128_16x16_32x32_2x2_8x32x1_8x32x1_1x32x1x8_8_1x1_intrawave_v3,817.43,383.1,0.0
gfx942,304,66688,2304,4096,ck,0,0,1539.481,a8w8_blockscale_1x128x128_256x128x128x128_16x16_32x32_2x2_8x32x1_8x32x1_1x32x1x8_8_1x1_intrawave_v3,817.61,383.17,0.0
gfx942,304,66816,2304,4096,ck,0,0,1543.591,a8w8_blockscale_1x128x128_256x128x128x128_16x16_32x32_2x2_8x32x1_8x32x1_1x32x1x8_8_1x1_intrawave_v3,817.0,382.88,0.0
gfx942,304,66944,2304,4096,ck,0,0,1573.2238,a8w8_blockscale_1x128x128_256x128x128x128_16x16_32x32_2x2_8x32x1_8x32x1_1x32x1x8_8_1x1_intrawave_v3,803.14,376.37,0.0
gfx942,304,67072,2304,4096,ck,0,0,1555.4196,a8w8_blockscale_1x128x128_256x128x128x128_16x16_32x32_2x2_8x32x1_8x32x1_1x32x1x8_8_1x1_intrawave_v3,813.89,381.4,0.0
gfx942,304,67200,2304,4096,ck,0,0,1519.6328,a8w8_blockscale_1x128x128_256x128x128x128_16x16_32x32_2x2_8x32x1_8x32x1_1x32x1x8_8_1x1_intrawave_v3,834.65,391.11,0.0
gfx942,304,67328,2304,4096,ck,0,0,1552.6819,a8w8_blockscale_1x128x128_256x128x128x128_16x16_32x32_2x2_8x32x1_8x32x1_1x32x1x8_8_1x1_intrawave_v3,818.44,383.5,0.0
gfx942,304,67456,2304,4096,ck,0,0,1559.6824,a8w8_blockscale_1x128x128_256x128x128x128_16x16_32x32_2x2_8x32x1_8x32x1_1x32x1x8_8_1x1_intrawave_v3,816.31,382.5,0.0
gfx942,304,67584,2304,4096,ck,0,0,1552.6688,a8w8_blockscale_1x128x128_256x128x128x128_16x16_32x32_2x2_8x32x1_8x32x1_1x32x1x8_8_1x1_intrawave_v3,821.56,384.94,0.0
gfx942,304,67712,2304,4096,ck,0,0,1588.1979,a8w8_blockscale_1x128x128_256x128x128x128_16x16_32x32_2x2_8x32x1_8x32x1_1x32x1x8_8_1x1_intrawave_v3,804.7,377.03,0.0
gfx942,304,67840,2304,4096,ck,0,0,1573.4701,a8w8_blockscale_1x128x128_256x128x128x128_16x16_32x32_2x2_8x32x1_8x32x1_1x32x1x8_8_1x1_intrawave_v3,813.77,381.27,0.0
gfx942,304,67968,2304,4096,ck,0,0,1540.1636,a8w8_blockscale_1x128x128_256x128x128x128_16x16_32x32_2x2_8x32x1_8x32x1_1x32x1x8_8_1x1_intrawave_v3,832.93,390.24,0.0
gfx942,304,68096,2304,4096,ck,0,0,1598.3299,a8w8_blockscale_1x128x128_256x128x128x128_16x16_32x32_2x2_8x32x1_8x32x1_1x32x1x8_8_1x1_intrawave_v3,804.13,376.73,0.0
gfx942,304,68224,2304,4096,ck,0,0,1543.3856,a8w8_blockscale_1x128x128_256x128x128x128_16x16_32x32_2x2_8x32x1_8x32x1_1x32x1x8_8_1x1_intrawave_v3,834.32,390.87,0.0
gfx942,304,68352,2304,4096,ck,0,0,1581.2948,a8w8_blockscale_1x128x128_256x128x128x128_16x16_32x32_2x2_8x32x1_8x32x1_1x32x1x8_8_1x1_intrawave_v3,815.85,382.2,0.0
gfx942,304,68480,2304,4096,ck,0,0,1599.1993,a8w8_blockscale_1x128x128_256x128x128x128_16x16_32x32_2x2_8x32x1_8x32x1_1x32x1x8_8_1x1_intrawave_v3,808.23,378.62,0.0
gfx942,304,68608,2304,4096,ck,0,0,1547.1884,a8w8_blockscale_1x128x128_256x128x128x128_16x16_32x32_2x2_8x32x1_8x32x1_1x32x1x8_8_1x1_intrawave_v3,836.96,392.07,0.0
gfx942,304,68736,2304,4096,ck,0,0,1592.0666,a8w8_blockscale_1x128x128_256x128x128x128_16x16_32x32_2x2_8x32x1_8x32x1_1x32x1x8_8_1x1_intrawave_v3,814.88,381.71,0.0
gfx942,304,68864,2304,4096,ck,0,0,1552.3937,a8w8_blockscale_1x128x128_256x128x128x128_16x16_32x32_2x2_8x32x1_8x32x1_1x32x1x8_8_1x1_intrawave_v3,837.26,392.19,0.0
gfx942,304,68992,2304,4096,ck,0,0,1605.0975,a8w8_blockscale_1x128x128_256x128x128x128_16x16_32x32_2x2_8x32x1_8x32x1_1x32x1x8_8_1x1_intrawave_v3,811.28,380.0,0.0
gfx942,304,69120,2304,4096,ck,0,0,1570.1249,a8w8_blockscale_1x128x128_256x128x128x128_16x16_32x32_2x2_8x32x1_8x32x1_1x32x1x8_8_1x1_intrawave_v3,830.89,389.18,0.0
gfx942,304,69248,2304,4096,ck,0,0,1617.8819,a8w8_blockscale_1x128x128_256x128x128x128_16x16_32x32_2x2_8x32x1_8x32x1_1x32x1x8_8_1x1_intrawave_v3,807.85,378.38,0.0
gfx942,304,69376,2304,4096,ck,0,0,1555.7215,a8w8_blockscale_1x128x128_256x128x128x128_16x16_32x32_2x2_8x32x1_8x32x1_1x32x1x8_8_1x1_intrawave_v3,841.69,394.21,0.0
gfx942,304,69504,2304,4096,ck,0,0,1606.2559,a8w8_blockscale_1x128x128_256x128x128x128_16x16_32x32_2x2_8x32x1_8x32x1_1x32x1x8_8_1x1_intrawave_v3,816.71,382.5,0.0
gfx942,304,69632,2304,4096,ck,0,0,1595.0987,a8w8_blockscale_1x128x128_256x128x128x128_16x16_32x32_2x2_8x32x1_8x32x1_1x32x1x8_8_1x1_intrawave_v3,823.94,385.88,0.0
gfx942,304,69760,2304,4096,ck,0,0,1576.2632,a8w8_blockscale_1x128x128_256x128x128x128_16x16_32x32_2x2_8x32x1_8x32x1_1x32x1x8_8_1x1_intrawave_v3,835.31,391.2,0.0
gfx942,304,69888,2304,4096,ck,0,0,1604.9086,a8w8_blockscale_1x128x128_256x128x128x128_16x16_32x32_2x2_8x32x1_8x32x1_1x32x1x8_8_1x1_intrawave_v3,821.91,384.91,0.0
gfx942,304,70016,2304,4096,ck,0,0,1623.3284,a8w8_blockscale_1x128x128_256x128x128x128_16x16_32x32_2x2_8x32x1_8x32x1_1x32x1x8_8_1x1_intrawave_v3,814.07,381.23,0.0
gfx942,304,70144,2304,4096,ck,0,0,1556.0464,a8w8_blockscale_1x128x128_256x128x128x128_16x16_32x32_2x2_8x32x1_8x32x1_1x32x1x8_8_1x1_intrawave_v3,850.83,398.43,0.0
gfx942,304,70272,2304,4096,ck,0,0,1576.1119,a8w8_blockscale_1x128x128_256x128x128x128_16x16_32x32_2x2_8x32x1_8x32x1_1x32x1x8_8_1x1_intrawave_v3,841.53,394.06,0.0
gfx942,304,70400,2304,4096,ck,0,0,1636.2241,a8w8_blockscale_1x128x128_256x128x128x128_16x16_32x32_2x2_8x32x1_8x32x1_1x32x1x8_8_1x1_intrawave_v3,812.09,380.27,0.0
gfx942,304,70528,2304,4096,ck,0,0,1582.4573,a8w8_blockscale_1x128x128_256x128x128x128_16x16_32x32_2x2_8x32x1_8x32x1_1x32x1x8_8_1x1_intrawave_v3,841.21,393.89,0.0
gfx942,304,70656,2304,4096,ck,0,0,1598.545,a8w8_blockscale_1x128x128_256x128x128x128_16x16_32x32_2x2_8x32x1_8x32x1_1x32x1x8_8_1x1_intrawave_v3,834.25,390.62,0.0
gfx942,304,70784,2304,4096,ck,0,0,1624.8834,a8w8_blockscale_1x128x128_256x128x128x128_16x16_32x32_2x2_8x32x1_8x32x1_1x32x1x8_8_1x1_intrawave_v3,822.21,384.98,0.0
gfx942,304,70912,2304,4096,ck,0,0,1605.6513,a8w8_blockscale_1x128x128_256x128x128x128_16x16_32x32_2x2_8x32x1_8x32x1_1x32x1x8_8_1x1_intrawave_v3,833.57,390.28,0.0
gfx942,304,71040,2304,4096,ck,0,0,1641.6011,a8w8_blockscale_1x128x128_256x128x128x128_16x16_32x32_2x2_8x32x1_8x32x1_1x32x1x8_8_1x1_intrawave_v3,816.78,382.41,0.0
gfx942,304,71168,2304,4096,ck,0,0,1660.1409,a8w8_blockscale_1x128x128_256x128x128x128_16x16_32x32_2x2_8x32x1_8x32x1_1x32x1x8_8_1x1_intrawave_v3,809.12,378.81,0.0
gfx942,304,71296,2304,4096,ck,0,0,1650.5099,a8w8_blockscale_1x128x128_256x128x128x128_16x16_32x32_2x2_8x32x1_8x32x1_1x32x1x8_8_1x1_intrawave_v3,815.3,381.7,0.0
gfx942,304,71424,2304,4096,ck,0,0,1611.4223,a8w8_blockscale_1x128x128_256x128x128x128_16x16_32x32_2x2_8x32x1_8x32x1_1x32x1x8_8_1x1_intrawave_v3,836.58,391.65,0.0
gfx942,304,71552,2304,4096,ck,0,0,1620.0955,a8w8_blockscale_1x128x128_256x128x128x128_16x16_32x32_2x2_8x32x1_8x32x1_1x32x1x8_8_1x1_intrawave_v3,833.59,390.24,0.0
gfx942,304,71680,2304,4096,ck,0,0,1602.5211,a8w8_blockscale_1x128x128_256x128x128x128_16x16_32x32_2x2_8x32x1_8x32x1_1x32x1x8_8_1x1_intrawave_v3,844.24,395.21,0.0
gfx942,304,71808,2304,4096,ck,0,0,1614.3044,a8w8_blockscale_1x128x128_256x128x128x128_16x16_32x32_2x2_8x32x1_8x32x1_1x32x1x8_8_1x1_intrawave_v3,839.58,393.02,0.0
gfx942,304,71936,2304,4096,ck,0,0,1628.2958,a8w8_blockscale_1x128x128_256x128x128x128_16x16_32x32_2x2_8x32x1_8x32x1_1x32x1x8_8_1x1_intrawave_v3,833.85,390.33,0.0
gfx942,304,72064,2304,4096,ck,0,0,1659.3212,a8w8_blockscale_1x128x128_256x128x128x128_16x16_32x32_2x2_8x32x1_8x32x1_1x32x1x8_8_1x1_intrawave_v3,819.71,383.7,0.0
gfx942,304,72192,2304,4096,ck,0,0,1665.861,a8w8_blockscale_1x128x128_256x128x128x128_16x16_32x32_2x2_8x32x1_8x32x1_1x32x1x8_8_1x1_intrawave_v3,817.94,382.86,0.0
gfx942,304,72320,2304,4096,ck,0,0,1623.5487,a8w8_blockscale_1x128x128_256x128x128x128_16x16_32x32_2x2_8x32x1_8x32x1_1x32x1x8_8_1x1_intrawave_v3,840.75,393.53,0.0
gfx942,304,72448,2304,4096,ck,0,0,1667.995,a8w8_blockscale_1x128x128_256x128x128x128_16x16_32x32_2x2_8x32x1_8x32x1_1x32x1x8_8_1x1_intrawave_v3,819.79,383.71,0.0
gfx942,304,72576,2304,4096,ck,0,0,1647.8778,a8w8_blockscale_1x128x128_256x128x128x128_16x16_32x32_2x2_8x32x1_8x32x1_1x32x1x8_8_1x1_intrawave_v3,831.27,389.07,0.0
gfx942,304,72704,2304,4096,ck,0,0,1636.3218,a8w8_blockscale_1x128x128_256x128x128x128_16x16_32x32_2x2_8x32x1_8x32x1_1x32x1x8_8_1x1_intrawave_v3,838.61,392.5,0.0
gfx942,304,72832,2304,4096,ck,0,0,1637.3826,a8w8_blockscale_1x128x128_256x128x128x128_16x16_32x32_2x2_8x32x1_8x32x1_1x32x1x8_8_1x1_intrawave_v3,839.55,392.92,0.0
gfx942,304,72960,2304,4096,ck,0,0,1703.7737,a8w8_blockscale_1x128x128_256x128x128x128_16x16_32x32_2x2_8x32x1_8x32x1_1x32x1x8_8_1x1_intrawave_v3,808.25,378.27,0.0
gfx942,304,73088,2304,4096,ck,0,0,1699.3822,a8w8_blockscale_1x128x128_256x128x128x128_16x16_32x32_2x2_8x32x1_8x32x1_1x32x1x8_8_1x1_intrawave_v3,811.76,379.9,0.0
gfx942,304,73216,2304,4096,ck,0,0,1700.0845,a8w8_blockscale_1x128x128_256x128x128x128_16x16_32x32_2x2_8x32x1_8x32x1_1x32x1x8_8_1x1_intrawave_v3,812.85,380.4,0.0
gfx942,304,73344,2304,4096,ck,0,0,1684.298,a8w8_blockscale_1x128x128_256x128x128x128_16x16_32x32_2x2_8x32x1_8x32x1_1x32x1x8_8_1x1_intrawave_v3,821.9,384.63,0.0
gfx942,304,73472,2304,4096,ck,0,0,1690.804,a8w8_blockscale_1x128x128_256x128x128x128_16x16_32x32_2x2_8x32x1_8x32x1_1x32x1x8_8_1x1_intrawave_v3,820.16,383.8,0.0
gfx942,304,73600,2304,4096,ck,0,0,1691.2549,a8w8_blockscale_1x128x128_256x128x128x128_16x16_32x32_2x2_8x32x1_8x32x1_1x32x1x8_8_1x1_intrawave_v3,821.37,384.36,0.0
gfx942,304,73728,2304,4096,ck,0,0,1665.5425,a8w8_blockscale_1x128x128_256x128x128x128_16x16_32x32_2x2_8x32x1_8x32x1_1x32x1x8_8_1x1_intrawave_v3,835.51,390.96,0.0
gfx942,304,73856,2304,4096,ck,0,0,1662.6807,a8w8_blockscale_1x128x128_256x128x128x128_16x16_32x32_2x2_8x32x1_8x32x1_1x32x1x8_8_1x1_intrawave_v3,838.4,392.31,0.0
gfx942,304,73984,2304,4096,ck,0,0,1708.3509,a8w8_blockscale_1x128x128_256x128x128x128_16x16_32x32_2x2_8x32x1_8x32x1_1x32x1x8_8_1x1_intrawave_v3,817.4,382.47,0.0
gfx942,304,74112,2304,4096,ck,0,0,1703.8362,a8w8_blockscale_1x128x128_256x128x128x128_16x16_32x32_2x2_8x32x1_8x32x1_1x32x1x8_8_1x1_intrawave_v3,820.98,384.14,0.0
gfx942,304,74240,2304,4096,ck,0,0,1685.9299,a8w8_blockscale_1x128x128_256x128x128x128_16x16_32x32_2x2_8x32x1_8x32x1_1x32x1x8_8_1x1_intrawave_v3,831.13,388.88,0.0
gfx942,304,74368,2304,4096,ck,0,0,1681.8873,a8w8_blockscale_1x128x128_256x128x128x128_16x16_32x32_2x2_8x32x1_8x32x1_1x32x1x8_8_1x1_intrawave_v3,834.57,390.48,0.0
gfx942,304,74496,2304,4096,ck,0,0,1669.0928,a8w8_blockscale_1x128x128_256x128x128x128_16x16_32x32_2x2_8x32x1_8x32x1_1x32x1x8_8_1x1_intrawave_v3,842.41,394.14,0.0
gfx942,304,74624,2304,4096,ck,0,0,1730.073,a8w8_blockscale_1x128x128_256x128x128x128_16x16_32x32_2x2_8x32x1_8x32x1_1x32x1x8_8_1x1_intrawave_v3,814.12,380.89,0.0
gfx942,304,74752,2304,4096,ck,0,0,1692.1095,a8w8_blockscale_1x128x128_256x128x128x128_16x16_32x32_2x2_8x32x1_8x32x1_1x32x1x8_8_1x1_intrawave_v3,833.81,390.09,0.0
gfx942,304,74880,2304,4096,ck,0,0,1679.013,a8w8_blockscale_1x128x128_256x128x128x128_16x16_32x32_2x2_8x32x1_8x32x1_1x32x1x8_8_1x1_intrawave_v3,841.75,393.8,0.0
gfx942,304,75008,2304,4096,ck,0,0,1757.8427,a8w8_blockscale_1x128x128_256x128x128x128_16x16_32x32_2x2_8x32x1_8x32x1_1x32x1x8_8_1x1_intrawave_v3,805.38,376.77,0.0
gfx942,304,75136,2304,4096,ck,0,0,1741.1821,a8w8_blockscale_1x128x128_256x128x128x128_16x16_32x32_2x2_8x32x1_8x32x1_1x32x1x8_8_1x1_intrawave_v3,814.47,381.02,0.0
gfx942,304,75264,2304,4096,ck,0,0,1692.1449,a8w8_blockscale_1x128x128_256x128x128x128_16x16_32x32_2x2_8x32x1_8x32x1_1x32x1x8_8_1x1_intrawave_v3,839.5,392.72,0.0
gfx942,304,75392,2304,4096,ck,0,0,1698.7028,a8w8_blockscale_1x128x128_256x128x128x128_16x16_32x32_2x2_8x32x1_8x32x1_1x32x1x8_8_1x1_intrawave_v3,837.68,391.86,0.0
gfx942,304,75520,2304,4096,ck,0,0,1746.8798,a8w8_blockscale_1x128x128_256x128x128x128_16x16_32x32_2x2_8x32x1_8x32x1_1x32x1x8_8_1x1_intrawave_v3,815.96,381.69,0.0
gfx942,304,75648,2304,4096,ck,0,0,1748.5057,a8w8_blockscale_1x128x128_256x128x128x128_16x16_32x32_2x2_8x32x1_8x32x1_1x32x1x8_8_1x1_intrawave_v3,816.59,381.97,0.0
gfx942,304,75776,2304,4096,ck,0,0,1688.09,a8w8_blockscale_1x128x128_256x128x128x128_16x16_32x32_2x2_8x32x1_8x32x1_1x32x1x8_8_1x1_intrawave_v3,847.24,396.3,0.0
gfx942,304,75904,2304,4096,ck,0,0,1720.6734,a8w8_blockscale_1x128x128_256x128x128x128_16x16_32x32_2x2_8x32x1_8x32x1_1x32x1x8_8_1x1_intrawave_v3,832.6,389.44,0.0
gfx942,304,76032,2304,4096,ck,0,0,1758.2191,a8w8_blockscale_1x128x128_256x128x128x128_16x16_32x32_2x2_8x32x1_8x32x1_1x32x1x8_8_1x1_intrawave_v3,816.2,381.76,0.0
gfx942,304,76160,2304,4096,ck,0,0,1718.2016,a8w8_blockscale_1x128x128_256x128x128x128_16x16_32x32_2x2_8x32x1_8x32x1_1x32x1x8_8_1x1_intrawave_v3,836.61,391.3,0.0
gfx942,304,76288,2304,4096,ck,0,0,1769.5714,a8w8_blockscale_1x128x128_256x128x128x128_16x16_32x32_2x2_8x32x1_8x32x1_1x32x1x8_8_1x1_intrawave_v3,813.69,380.57,0.0
gfx942,304,76416,2304,4096,ck,0,0,1790.2356,a8w8_blockscale_1x128x128_256x128x128x128_16x16_32x32_2x2_8x32x1_8x32x1_1x32x1x8_8_1x1_intrawave_v3,805.65,376.8,0.0
gfx942,304,76544,2304,4096,ck,0,0,1727.2919,a8w8_blockscale_1x128x128_256x128x128x128_16x16_32x32_2x2_8x32x1_8x32x1_1x32x1x8_8_1x1_intrawave_v3,836.41,391.18,0.0
gfx942,304,76672,2304,4096,ck,0,0,1794.5347,a8w8_blockscale_1x128x128_256x128x128x128_16x16_32x32_2x2_8x32x1_8x32x1_1x32x1x8_8_1x1_intrawave_v3,806.41,377.14,0.0
gfx942,304,76800,2304,4096,ck,0,0,1789.8124,a8w8_blockscale_1x128x128_256x128x128x128_16x16_32x32_2x2_8x32x1_8x32x1_1x32x1x8_8_1x1_intrawave_v3,809.89,378.76,0.0
gfx942,304,76928,2304,4096,ck,0,0,1746.3357,a8w8_blockscale_1x128x128_256x128x128x128_16x16_32x32_2x2_8x32x1_8x32x1_1x32x1x8_8_1x1_intrawave_v3,831.44,388.82,0.0
gfx942,304,77056,2304,4096,ck,0,0,1774.6642,a8w8_blockscale_1x128x128_256x128x128x128_16x16_32x32_2x2_8x32x1_8x32x1_1x32x1x8_8_1x1_intrawave_v3,819.53,383.25,0.0
gfx942,304,77184,2304,4096,ck,0,0,1785.1762,a8w8_blockscale_1x128x128_256x128x128x128_16x16_32x32_2x2_8x32x1_8x32x1_1x32x1x8_8_1x1_intrawave_v3,816.05,381.61,0.0
gfx942,304,77312,2304,4096,ck,0,0,1810.021,a8w8_blockscale_1x128x128_256x128x128x128_16x16_32x32_2x2_8x32x1_8x32x1_1x32x1x8_8_1x1_intrawave_v3,806.19,376.99,0.0
gfx942,304,77440,2304,4096,ck,0,0,1812.2619,a8w8_blockscale_1x128x128_256x128x128x128_16x16_32x32_2x2_8x32x1_8x32x1_1x32x1x8_8_1x1_intrawave_v3,806.52,377.14,0.0
gfx942,304,77568,2304,4096,ck,0,0,1797.3691,a8w8_blockscale_1x128x128_256x128x128x128_16x16_32x32_2x2_8x32x1_8x32x1_1x32x1x8_8_1x1_intrawave_v3,814.55,380.88,0.0
gfx942,304,77696,2304,4096,ck,0,0,1752.8571,a8w8_blockscale_1x128x128_256x128x128x128_16x16_32x32_2x2_8x32x1_8x32x1_1x32x1x8_8_1x1_intrawave_v3,836.61,391.19,0.0
gfx942,304,77824,2304,4096,ck,0,0,1742.051,a8w8_blockscale_1x128x128_256x128x128x128_16x16_32x32_2x2_8x32x1_8x32x1_1x32x1x8_8_1x1_intrawave_v3,843.19,394.26,0.0
gfx942,304,77952,2304,4096,ck,0,0,1832.7847,a8w8_blockscale_1x128x128_256x128x128x128_16x16_32x32_2x2_8x32x1_8x32x1_1x32x1x8_8_1x1_intrawave_v3,802.76,375.35,0.0
gfx942,304,78080,2304,4096,ck,0,0,1755.8408,a8w8_blockscale_1x128x128_256x128x128x128_16x16_32x32_2x2_8x32x1_8x32x1_1x32x1x8_8_1x1_intrawave_v3,839.32,392.43,0.0
gfx942,304,78208,2304,4096,ck,0,0,1817.0378,a8w8_blockscale_1x128x128_256x128x128x128_16x16_32x32_2x2_8x32x1_8x32x1_1x32x1x8_8_1x1_intrawave_v3,812.38,379.83,0.0
gfx942,304,78336,2304,4096,ck,0,0,1771.6472,a8w8_blockscale_1x128x128_256x128x128x128_16x16_32x32_2x2_8x32x1_8x32x1_1x32x1x8_8_1x1_intrawave_v3,834.56,390.19,0.0
gfx942,304,78464,2304,4096,ck,0,0,1764.01,a8w8_blockscale_1x128x128_256x128x128x128_16x16_32x32_2x2_8x32x1_8x32x1_1x32x1x8_8_1x1_intrawave_v3,839.54,392.51,0.0
gfx942,304,78592,2304,4096,ck,0,0,1769.9557,a8w8_blockscale_1x128x128_256x128x128x128_16x16_32x32_2x2_8x32x1_8x32x1_1x32x1x8_8_1x1_intrawave_v3,838.09,391.82,0.0
gfx942,304,78720,2304,4096,ck,0,0,1840.8033,a8w8_blockscale_1x128x128_256x128x128x128_16x16_32x32_2x2_8x32x1_8x32x1_1x32x1x8_8_1x1_intrawave_v3,807.14,377.34,0.0
gfx942,304,78848,2304,4096,ck,0,0,1815.091,a8w8_blockscale_1x128x128_256x128x128x128_16x16_32x32_2x2_8x32x1_8x32x1_1x32x1x8_8_1x1_intrawave_v3,819.91,383.3,0.0
gfx942,304,78976,2304,4096,ck,0,0,1803.0081,a8w8_blockscale_1x128x128_256x128x128x128_16x16_32x32_2x2_8x32x1_8x32x1_1x32x1x8_8_1x1_intrawave_v3,826.74,386.49,0.0
gfx942,304,79104,2304,4096,ck,0,0,1824.9359,a8w8_blockscale_1x128x128_256x128x128x128_16x16_32x32_2x2_8x32x1_8x32x1_1x32x1x8_8_1x1_intrawave_v3,818.13,382.46,0.0
gfx942,304,79232,2304,4096,ck,0,0,1793.6239,a8w8_blockscale_1x128x128_256x128x128x128_16x16_32x32_2x2_8x32x1_8x32x1_1x32x1x8_8_1x1_intrawave_v3,833.76,389.75,0.0
gfx942,304,79360,2304,4096,ck,0,0,1851.7573,a8w8_blockscale_1x128x128_256x128x128x128_16x16_32x32_2x2_8x32x1_8x32x1_1x32x1x8_8_1x1_intrawave_v3,808.89,378.12,0.0
gfx942,304,79488,2304,4096,ck,0,0,1817.5356,a8w8_blockscale_1x128x128_256x128x128x128_16x16_32x32_2x2_8x32x1_8x32x1_1x32x1x8_8_1x1_intrawave_v3,825.45,385.85,0.0
gfx942,304,79616,2304,4096,ck,0,0,1842.3833,a8w8_blockscale_1x128x128_256x128x128x128_16x16_32x32_2x2_8x32x1_8x32x1_1x32x1x8_8_1x1_intrawave_v3,815.63,381.25,0.0
gfx942,304,79744,2304,4096,ck,0,0,1792.5259,a8w8_blockscale_1x128x128_256x128x128x128_16x16_32x32_2x2_8x32x1_8x32x1_1x32x1x8_8_1x1_intrawave_v3,839.66,392.48,0.0
gfx942,304,79872,2304,4096,ck,0,0,1804.9181,a8w8_blockscale_1x128x128_256x128x128x128_16x16_32x32_2x2_8x32x1_8x32x1_1x32x1x8_8_1x1_intrawave_v3,835.24,390.4,0.0
gfx942,304,80000,2304,4096,ck,0,0,1827.5891,a8w8_blockscale_1x128x128_256x128x128x128_16x16_32x32_2x2_8x32x1_8x32x1_1x32x1x8_8_1x1_intrawave_v3,826.2,386.17,0.0
gfx942,304,16,4096,2048,ck,8,0,8.9909,a8w8_blockscale_1x128x128_256x16x64x256_16x16_16x16_1x1_16x16x1_16x16x1_1x16x1x16_4_1x1_intrawave_v1,29.86,951.23,0.0
gfx942,304,32,4096,2048,ck,8,0,8.8126,a8w8_blockscale_1x128x128_256x16x64x256_16x16_16x16_1x1_16x16x1_16x16x1_1x16x1x16_4_1x1_intrawave_v1,60.92,989.07,0.0
gfx942,304,48,4096,2048,ck,8,0,9.7872,a8w8_blockscale_1x128x128_256x16x64x256_16x16_16x16_1x1_16x16x1_16x16x1_1x16x1x16_4_1x1_intrawave_v1,82.28,907.32,0.0
gfx942,304,64,4096,2048,ck,8,0,8.9776,a8w8_blockscale_1x128x128_256x16x64x256_16x16_16x16_1x1_16x16x1_16x16x1_1x16x1x16_4_1x1_intrawave_v1,119.6,1007.39,0.0
gfx942,304,80,4096,2048,ck,13,0,11.4557,a8w8_blockscale_1x128x128_256x32x64x256_16x16_16x16_2x1_16x16x1_16x16x1_1x32x1x8_8_2x1_intrawave_v1,117.16,803.78,0.0
gfx942,304,96,4096,2048,ck,13,0,11.3588,a8w8_blockscale_1x128x128_256x32x64x256_16x16_16x16_2x1_16x16x1_16x16x1_1x32x1x8_8_2x1_intrawave_v1,141.79,825.06,0.0
gfx942,304,112,4096,2048,ck,13,0,11.4172,a8w8_blockscale_1x128x128_256x32x64x256_16x16_16x16_2x1_16x16x1_16x16x1_1x32x1x8_8_2x1_intrawave_v1,164.58,835.19,0.0
gfx942,304,128,4096,2048,ck,18,0,11.2886,a8w8_blockscale_1x128x128_256x64x64x256_16x16_32x32_1x1_16x16x1_16x16x1_1x32x1x8_8_1x1_intrawave_v1,190.23,859.21,0.0
gfx942,304,144,4096,2048,ck,18,0,12.1277,a8w8_blockscale_1x128x128_256x64x64x256_16x16_32x32_1x1_16x16x1_16x16x1_1x32x1x8_8_1x1_intrawave_v1,199.21,813.28,0.0
gfx942,304,160,4096,2048,ck,18,0,11.9007,a8w8_blockscale_1x128x128_256x64x64x256_16x16_32x32_1x1_16x16x1_16x16x1_1x32x1x8_8_1x1_intrawave_v1,225.56,842.56,0.0
gfx942,304,176,4096,2048,ck,18,0,13.0524,a8w8_blockscale_1x128x128_256x64x64x256_16x16_32x32_1x1_16x16x1_16x16x1_1x32x1x8_8_1x1_intrawave_v1,226.23,780.76,0.0
gfx942,304,192,4096,2048,ck,18,0,11.8509,a8w8_blockscale_1x128x128_256x64x64x256_16x16_32x32_1x1_16x16x1_16x16x1_1x32x1x8_8_1x1_intrawave_v1,271.81,873.75,0.0
gfx942,304,208,4096,2048,ck,18,0,14.1353,a8w8_blockscale_1x128x128_256x64x64x256_16x16_32x32_1x1_16x16x1_16x16x1_1x32x1x8_8_1x1_intrawave_v1,246.88,744.13,0.0
gfx942,304,224,4096,2048,ck,18,0,15.0973,a8w8_blockscale_1x128x128_256x64x64x256_16x16_32x32_1x1_16x16x1_16x16x1_1x32x1x8_8_1x1_intrawave_v1,248.93,707.57,0.0
gfx942,304,240,4096,2048,ck,18,0,14.9239,a8w8_blockscale_1x128x128_256x64x64x256_16x16_32x32_1x1_16x16x1_16x16x1_1x32x1x8_8_1x1_intrawave_v1,269.8,726.77,0.0
gfx942,304,256,4096,2048,ck,18,0,14.0466,a8w8_blockscale_1x128x128_256x64x64x256_16x16_32x32_1x1_16x16x1_16x16x1_1x32x1x8_8_1x1_intrawave_v1,305.77,783.82,0.0
gfx942,304,288,4096,2048,ck,12,0,17.898,a8w8_blockscale_1x128x128_256x32x128x256_16x16_32x32_1x1_16x16x1_16x16x1_1x32x1x8_8_1x1_intrawave_v1,269.97,633.46,0.0
gfx942,304,320,4096,2048,ck,3,0,21.5528,a8w8_blockscale_1x128x128_256x64x64x128_16x16_32x32_1x1_8x32x1_8x32x1_1x32x1x8_8_1x1_intrawave_v3,249.1,541.25,0.0
gfx942,304,352,4096,2048,ck,2,0,20.4591,a8w8_blockscale_1x128x128_256x64x128x128_16x16_32x32_1x2_8x32x1_8x32x1_1x32x1x8_8_1x1_intrawave_v3,288.65,586.2,0.0
gfx942,304,384,4096,2048,ck,18,0,22.5155,a8w8_blockscale_1x128x128_256x64x64x256_16x16_32x32_1x1_16x16x1_16x16x1_1x32x1x8_8_1x1_intrawave_v1,286.13,547.21,0.0
gfx942,304,416,4096,2048,ck,2,0,20.8946,a8w8_blockscale_1x128x128_256x64x128x128_16x16_32x32_1x2_8x32x1_8x32x1_1x32x1x8_8_1x1_intrawave_v3,334.03,605.35,0.0
gfx942,304,448,4096,2048,ck,2,0,22.5535,a8w8_blockscale_1x128x128_256x64x128x128_16x16_32x32_1x2_8x32x1_8x32x1_1x32x1x8_8_1x1_intrawave_v3,333.26,575.35,0.0
gfx942,304,480,4096,2048,ck,2,0,22.3467,a8w8_blockscale_1x128x128_256x64x128x128_16x16_32x32_1x2_8x32x1_8x32x1_1x32x1x8_8_1x1_intrawave_v3,360.37,595.34,0.0
gfx942,304,512,4096,2048,ck,2,0,23.5157,a8w8_blockscale_1x128x128_256x64x128x128_16x16_32x32_1x2_8x32x1_8x32x1_1x32x1x8_8_1x1_intrawave_v3,365.29,579.68,0.0
gfx942,304,544,4096,2048,ck,2,0,24.7568,a8w8_blockscale_1x128x128_256x64x128x128_16x16_32x32_1x2_8x32x1_8x32x1_1x32x1x8_8_1x1_intrawave_v3,368.66,563.85,0.0
gfx942,304,576,4096,2048,ck,2,0,24.9562,a8w8_blockscale_1x128x128_256x64x128x128_16x16_32x32_1x2_8x32x1_8x32x1_1x32x1x8_8_1x1_intrawave_v3,387.23,572.48,0.0
gfx942,304,608,4096,2048,ck,0,0,28.955,a8w8_blockscale_1x128x128_256x128x128x128_16x16_32x32_2x2_8x32x1_8x32x1_1x32x1x8_8_1x1_intrawave_v3,352.29,504.73,0.0
gfx942,304,640,4096,2048,ck,0,0,30.8815,a8w8_blockscale_1x128x128_256x128x128x128_16x16_32x32_2x2_8x32x1_8x32x1_1x32x1x8_8_1x1_intrawave_v3,347.7,483.86,0.0
gfx942,304,672,4096,2048,ck,0,0,28.7527,a8w8_blockscale_1x128x128_256x128x128x128_16x16_32x32_2x2_8x32x1_8x32x1_1x32x1x8_8_1x1_intrawave_v3,392.11,531.08,0.0
gfx942,304,704,4096,2048,ck,0,0,29.7826,a8w8_blockscale_1x128x128_256x128x128x128_16x16_32x32_2x2_8x32x1_8x32x1_1x32x1x8_8_1x1_intrawave_v3,396.58,523.71,0.0
gfx942,304,736,4096,2048,ck,0,0,30.2252,a8w8_blockscale_1x128x128_256x128x128x128_16x16_32x32_2x2_8x32x1_8x32x1_1x32x1x8_8_1x1_intrawave_v3,408.53,526.89,0.0
gfx942,304,768,4096,2048,ck,0,0,32.0496,a8w8_blockscale_1x128x128_256x128x128x128_16x16_32x32_2x2_8x32x1_8x32x1_1x32x1x8_8_1x1_intrawave_v3,402.03,507.12,0.0
gfx942,304,800,4096,2048,ck,0,0,31.6046,a8w8_blockscale_1x128x128_256x128x128x128_16x16_32x32_2x2_8x32x1_8x32x1_1x32x1x8_8_1x1_intrawave_v3,424.68,524.63,0.0
gfx942,304,832,4096,2048,ck,0,0,31.4383,a8w8_blockscale_1x128x128_256x128x128x128_16x16_32x32_2x2_8x32x1_8x32x1_1x32x1x8_8_1x1_intrawave_v3,444.0,537.82,0.0
gfx942,304,864,4096,2048,ck,0,0,32.1991,a8w8_blockscale_1x128x128_256x128x128x128_16x16_32x32_2x2_8x32x1_8x32x1_1x32x1x8_8_1x1_intrawave_v3,450.18,535.29,0.0
gfx942,304,896,4096,2048,ck,0,0,34.0598,a8w8_blockscale_1x128x128_256x128x128x128_16x16_32x32_2x2_8x32x1_8x32x1_1x32x1x8_8_1x1_intrawave_v3,441.35,515.67,0.0
gfx942,304,928,4096,2048,ck,0,0,32.709,a8w8_blockscale_1x128x128_256x128x128x128_16x16_32x32_2x2_8x32x1_8x32x1_1x32x1x8_8_1x1_intrawave_v3,475.99,546.98,0.0
gfx942,304,960,4096,2048,ck,0,0,32.826,a8w8_blockscale_1x128x128_256x128x128x128_16x16_32x32_2x2_8x32x1_8x32x1_1x32x1x8_8_1x1_intrawave_v3,490.65,555.02,0.0
gfx942,304,992,4096,2048,ck,0,0,33.5142,a8w8_blockscale_1x128x128_256x128x128x128_16x16_32x32_2x2_8x32x1_8x32x1_1x32x1x8_8_1x1_intrawave_v3,496.6,553.4,0.0
gfx942,304,1024,4096,2048,ck,0,0,35.7457,a8w8_blockscale_1x128x128_256x128x128x128_16x16_32x32_2x2_8x32x1_8x32x1_1x32x1x8_8_1x1_intrawave_v3,480.61,528.02,0.0
gfx942,304,1088,4096,2048,ck,0,0,35.6822,a8w8_blockscale_1x128x128_256x128x128x128_16x16_32x32_2x2_8x32x1_8x32x1_1x32x1x8_8_1x1_intrawave_v3,511.56,547.32,0.0
gfx942,304,1152,4096,2048,ck,0,0,37.4525,a8w8_blockscale_1x128x128_256x128x128x128_16x16_32x32_2x2_8x32x1_8x32x1_1x32x1x8_8_1x1_intrawave_v3,516.05,538.95,0.0
gfx942,304,1216,4096,2048,ck,2,0,40.3157,a8w8_blockscale_1x128x128_256x64x128x128_16x16_32x32_1x2_8x32x1_8x32x1_1x32x1x8_8_1x1_intrawave_v3,506.03,516.93,0.0
gfx942,304,1280,4096,2048,ck,0,0,49.0214,a8w8_blockscale_1x128x128_256x128x128x128_16x16_32x32_2x2_8x32x1_8x32x1_1x32x1x8_8_1x1_intrawave_v3,438.07,438.5,0.0
gfx942,304,1344,4096,2048,ck,0,0,48.3295,a8w8_blockscale_1x128x128_256x128x128x128_16x16_32x32_2x2_8x32x1_8x32x1_1x32x1x8_8_1x1_intrawave_v3,466.56,458.34,0.0
gfx942,304,1408,4096,2048,ck,0,0,48.9268,a8w8_blockscale_1x128x128_256x128x128x128_16x16_32x32_2x2_8x32x1_8x32x1_1x32x1x8_8_1x1_intrawave_v3,482.81,466.14,0.0
gfx942,304,1472,4096,2048,ck,0,0,49.6145,a8w8_blockscale_1x128x128_256x128x128x128_16x16_32x32_2x2_8x32x1_8x32x1_1x32x1x8_8_1x1_intrawave_v3,497.76,472.88,0.0
gfx942,304,1536,4096,2048,ck,0,0,49.7794,a8w8_blockscale_1x128x128_256x128x128x128_16x16_32x32_2x2_8x32x1_8x32x1_1x32x1x8_8_1x1_intrawave_v3,517.68,484.48,0.0
gfx942,304,1600,4096,2048,ck,0,0,50.8171,a8w8_blockscale_1x128x128_256x128x128x128_16x16_32x32_2x2_8x32x1_8x32x1_1x32x1x8_8_1x1_intrawave_v3,528.24,487.49,0.0
gfx942,304,1664,4096,2048,ck,0,0,51.1958,a8w8_blockscale_1x128x128_256x128x128x128_16x16_32x32_2x2_8x32x1_8x32x1_1x32x1x8_8_1x1_intrawave_v3,545.3,496.68,0.0
gfx942,304,1728,4096,2048,ck,0,0,51.6012,a8w8_blockscale_1x128x128_256x128x128x128_16x16_32x32_2x2_8x32x1_8x32x1_1x32x1x8_8_1x1_intrawave_v3,561.83,505.48,0.0
gfx942,304,1792,4096,2048,ck,0,0,51.7426,a8w8_blockscale_1x128x128_256x128x128x128_16x16_32x32_2x2_8x32x1_8x32x1_1x32x1x8_8_1x1_intrawave_v3,581.04,516.76,0.0
gfx942,304,1856,4096,2048,ck,0,0,54.5552,a8w8_blockscale_1x128x128_256x128x128x128_16x16_32x32_2x2_8x32x1_8x32x1_1x32x1x8_8_1x1_intrawave_v3,570.77,502.13,0.0
gfx942,304,1920,4096,2048,ck,0,0,53.5222,a8w8_blockscale_1x128x128_256x128x128x128_16x16_32x32_2x2_8x32x1_8x32x1_1x32x1x8_8_1x1_intrawave_v3,601.85,524.07,0.0
gfx942,304,1984,4096,2048,ck,0,0,55.288,a8w8_blockscale_1x128x128_256x128x128x128_16x16_32x32_2x2_8x32x1_8x32x1_1x32x1x8_8_1x1_intrawave_v3,602.05,519.19,0.0
gfx942,304,2048,4096,2048,ck,0,0,56.5523,a8w8_blockscale_1x128x128_256x128x128x128_16x16_32x32_2x2_8x32x1_8x32x1_1x32x1x8_8_1x1_intrawave_v3,607.57,519.17,0.0
gfx942,304,2112,4096,2048,ck,0,0,57.7795,a8w8_blockscale_1x128x128_256x128x128x128_16x16_32x32_2x2_8x32x1_8x32x1_1x32x1x8_8_1x1_intrawave_v3,613.25,519.48,0.0
gfx942,304,2176,4096,2048,ck,0,0,57.9372,a8w8_blockscale_1x128x128_256x128x128x128_16x16_32x32_2x2_8x32x1_8x32x1_1x32x1x8_8_1x1_intrawave_v3,630.12,529.38,0.0
gfx942,304,2240,4096,2048,ck,0,0,57.5504,a8w8_blockscale_1x128x128_256x128x128x128_16x16_32x32_2x2_8x32x1_8x32x1_1x32x1x8_8_1x1_intrawave_v3,653.01,544.33,0.0
gfx942,304,2304,4096,2048,ck,0,0,58.9524,a8w8_blockscale_1x128x128_256x128x128x128_16x16_32x32_2x2_8x32x1_8x32x1_1x32x1x8_8_1x1_intrawave_v3,655.69,542.5,0.0
gfx942,304,2368,4096,2048,ck,0,0,60.4407,a8w8_blockscale_1x128x128_256x128x128x128_16x16_32x32_2x2_8x32x1_8x32x1_1x32x1x8_8_1x1_intrawave_v3,657.31,539.98,0.0
gfx942,304,2432,4096,2048,ck,0,0,61.231,a8w8_blockscale_1x128x128_256x128x128x128_16x16_32x32_2x2_8x32x1_8x32x1_1x32x1x8_8_1x1_intrawave_v3,666.36,543.72,0.0
gfx942,304,2496,4096,2048,ck,0,0,78.5298,a8w8_blockscale_1x128x128_256x128x128x128_16x16_32x32_2x2_8x32x1_8x32x1_1x32x1x8_8_1x1_intrawave_v3,533.25,432.29,0.0
gfx942,304,2560,4096,2048,ck,0,0,77.7014,a8w8_blockscale_1x128x128_256x128x128x128_16x16_32x32_2x2_8x32x1_8x32x1_1x32x1x8_8_1x1_intrawave_v3,552.75,445.33,0.0
gfx942,304,2624,4096,2048,ck,0,0,79.1371,a8w8_blockscale_1x128x128_256x128x128x128_16x16_32x32_2x2_8x32x1_8x32x1_1x32x1x8_8_1x1_intrawave_v3,556.29,445.54,0.0
gfx942,304,2688,4096,2048,ck,0,0,78.7152,a8w8_blockscale_1x128x128_256x128x128x128_16x16_32x32_2x2_8x32x1_8x32x1_1x32x1x8_8_1x1_intrawave_v3,572.92,456.25,0.0
gfx942,304,2752,4096,2048,ck,0,0,77.676,a8w8_blockscale_1x128x128_256x128x128x128_16x16_32x32_2x2_8x32x1_8x32x1_1x32x1x8_8_1x1_intrawave_v3,594.4,470.79,0.0
gfx942,304,2816,4096,2048,ck,0,0,77.3972,a8w8_blockscale_1x128x128_256x128x128x128_16x16_32x32_2x2_8x32x1_8x32x1_1x32x1x8_8_1x1_intrawave_v3,610.42,480.95,0.0
gfx942,304,2880,4096,2048,ck,0,0,79.7685,a8w8_blockscale_1x128x128_256x128x128x128_16x16_32x32_2x2_8x32x1_8x32x1_1x32x1x8_8_1x1_intrawave_v3,605.73,474.87,0.0
gfx942,304,2944,4096,2048,ck,0,0,79.1211,a8w8_blockscale_1x128x128_256x128x128x128_16x16_32x32_2x2_8x32x1_8x32x1_1x32x1x8_8_1x1_intrawave_v3,624.26,487.04,0.0
gfx942,304,3008,4096,2048,ck,0,0,80.9756,a8w8_blockscale_1x128x128_256x128x128x128_16x16_32x32_2x2_8x32x1_8x32x1_1x32x1x8_8_1x1_intrawave_v3,623.22,483.98,0.0
gfx942,304,3072,4096,2048,ck,0,0,78.9982,a8w8_blockscale_1x128x128_256x128x128x128_16x16_32x32_2x2_8x32x1_8x32x1_1x32x1x8_8_1x1_intrawave_v3,652.41,504.39,0.0
gfx942,304,3136,4096,2048,ck,0,0,82.3761,a8w8_blockscale_1x128x128_256x128x128x128_16x16_32x32_2x2_8x32x1_8x32x1_1x32x1x8_8_1x1_intrawave_v3,638.7,491.66,0.0
gfx942,304,3200,4096,2048,ck,0,0,81.9268,a8w8_blockscale_1x128x128_256x128x128x128_16x16_32x32_2x2_8x32x1_8x32x1_1x32x1x8_8_1x1_intrawave_v3,655.31,502.36,0.0
gfx942,304,3264,4096,2048,ck,0,0,81.0333,a8w8_blockscale_1x128x128_256x128x128x128_16x16_32x32_2x2_8x32x1_8x32x1_1x32x1x8_8_1x1_intrawave_v3,675.78,515.99,0.0
gfx942,304,3328,4096,2048,ck,0,0,82.6886,a8w8_blockscale_1x128x128_256x128x128x128_16x16_32x32_2x2_8x32x1_8x32x1_1x32x1x8_8_1x1_intrawave_v3,675.24,513.58,0.0
gfx942,304,3392,4096,2048,ck,0,0,86.3474,a8w8_blockscale_1x128x128_256x128x128x128_16x16_32x32_2x2_8x32x1_8x32x1_1x32x1x8_8_1x1_intrawave_v3,659.06,499.41,0.0
gfx942,304,3456,4096,2048,ck,0,0,84.0422,a8w8_blockscale_1x128x128_256x128x128x128_16x16_32x32_2x2_8x32x1_8x32x1_1x32x1x8_8_1x1_intrawave_v3,689.92,520.91,0.0
gfx942,304,3520,4096,2048,ck,0,0,86.8316,a8w8_blockscale_1x128x128_256x128x128x128_16x16_32x32_2x2_8x32x1_8x32x1_1x32x1x8_8_1x1_intrawave_v3,680.12,511.72,0.0
gfx942,304,3584,4096,2048,ck,0,0,83.7807,a8w8_blockscale_1x128x128_256x128x128x128_16x16_32x32_2x2_8x32x1_8x32x1_1x32x1x8_8_1x1_intrawave_v3,717.7,538.18,0.0
gfx942,304,3648,4096,2048,ck,0,0,98.7799,a8w8_blockscale_1x128x128_256x128x128x128_16x16_32x32_2x2_8x32x1_8x32x1_1x32x1x8_8_1x1_intrawave_v3,619.59,463.09,0.0
gfx942,304,3712,4096,2048,ck,0,0,102.2542,a8w8_blockscale_1x128x128_256x128x128x128_16x16_32x32_2x2_8x32x1_8x32x1_1x32x1x8_8_1x1_intrawave_v3,609.04,453.77,0.0
gfx942,304,3776,4096,2048,ck,0,0,97.8066,a8w8_blockscale_1x128x128_256x128x128x128_16x16_32x32_2x2_8x32x1_8x32x1_1x32x1x8_8_1x1_intrawave_v3,647.71,481.1,0.0
gfx942,304,3840,4096,2048,ck,0,0,97.9407,a8w8_blockscale_1x128x128_256x128x128x128_16x16_32x32_2x2_8x32x1_8x32x1_1x32x1x8_8_1x1_intrawave_v3,657.79,487.13,0.0
gfx942,304,3904,4096,2048,ck,0,0,98.6262,a8w8_blockscale_1x128x128_256x128x128x128_16x16_32x32_2x2_8x32x1_8x32x1_1x32x1x8_8_1x1_intrawave_v3,664.11,490.39,0.0
gfx942,304,3968,4096,2048,ck,0,0,98.507,a8w8_blockscale_1x128x128_256x128x128x128_16x16_32x32_2x2_8x32x1_8x32x1_1x32x1x8_8_1x1_intrawave_v3,675.81,497.64,0.0
gfx942,304,4032,4096,2048,ck,0,0,102.6327,a8w8_blockscale_1x128x128_256x128x128x128_16x16_32x32_2x2_8x32x1_8x32x1_1x32x1x8_8_1x1_intrawave_v3,659.11,484.02,0.0
gfx942,304,4096,4096,2048,ck,0,0,103.141,a8w8_blockscale_1x128x128_256x128x128x128_16x16_32x32_2x2_8x32x1_8x32x1_1x32x1x8_8_1x1_intrawave_v3,666.27,487.99,0.0
gfx942,304,4224,4096,2048,ck,0,0,104.6176,a8w8_blockscale_1x128x128_256x128x128x128_16x16_32x32_2x2_8x32x1_8x32x1_1x32x1x8_8_1x1_intrawave_v3,677.39,493.63,0.0
gfx942,304,4352,4096,2048,ck,0,0,104.4453,a8w8_blockscale_1x128x128_256x128x128x128_16x16_32x32_2x2_8x32x1_8x32x1_1x32x1x8_8_1x1_intrawave_v3,699.07,506.99,0.0
gfx942,304,4480,4096,2048,ck,0,0,107.012,a8w8_blockscale_1x128x128_256x128x128x128_16x16_32x32_2x2_8x32x1_8x32x1_1x32x1x8_8_1x1_intrawave_v3,702.37,507.08,0.0
gfx942,304,4608,4096,2048,ck,0,0,108.0048,a8w8_blockscale_1x128x128_256x128x128x128_16x16_32x32_2x2_8x32x1_8x32x1_1x32x1x8_8_1x1_intrawave_v3,715.8,514.56,0.0
gfx942,304,4736,4096,2048,ck,0,0,111.4712,a8w8_blockscale_1x128x128_256x128x128x128_16x16_32x32_2x2_8x32x1_8x32x1_1x32x1x8_8_1x1_intrawave_v3,712.8,510.31,0.0
gfx942,304,4864,4096,2048,ck,0,0,109.6246,a8w8_blockscale_1x128x128_256x128x128x128_16x16_32x32_2x2_8x32x1_8x32x1_1x32x1x8_8_1x1_intrawave_v3,744.4,530.87,0.0
gfx942,304,4992,4096,2048,ck,0,0,125.8947,a8w8_blockscale_1x128x128_256x128x128x128_16x16_32x32_2x2_8x32x1_8x32x1_1x32x1x8_8_1x1_intrawave_v3,665.25,472.67,0.0
gfx942,304,5120,4096,2048,ck,0,0,122.4846,a8w8_blockscale_1x128x128_256x128x128x128_16x16_32x32_2x2_8x32x1_8x32x1_1x32x1x8_8_1x1_intrawave_v3,701.31,496.53,0.0
gfx942,304,5248,4096,2048,ck,0,0,125.5245,a8w8_blockscale_1x128x128_256x128x128x128_16x16_32x32_2x2_8x32x1_8x32x1_1x32x1x8_8_1x1_intrawave_v3,701.43,494.95,0.0
gfx942,304,5376,4096,2048,ck,0,0,129.8744,a8w8_blockscale_1x128x128_256x128x128x128_16x16_32x32_2x2_8x32x1_8x32x1_1x32x1x8_8_1x1_intrawave_v3,694.47,488.46,0.0
gfx942,304,5504,4096,2048,ck,0,0,131.9131,a8w8_blockscale_1x128x128_256x128x128x128_16x16_32x32_2x2_8x32x1_8x32x1_1x32x1x8_8_1x1_intrawave_v3,700.02,490.85,0.0
gfx942,304,5632,4096,2048,ck,0,0,128.7181,a8w8_blockscale_1x128x128_256x128x128x128_16x16_32x32_2x2_8x32x1_8x32x1_1x32x1x8_8_1x1_intrawave_v3,734.08,513.22,0.0
gfx942,304,5760,4096,2048,ck,0,0,133.1043,a8w8_blockscale_1x128x128_256x128x128x128_16x16_32x32_2x2_8x32x1_8x32x1_1x32x1x8_8_1x1_intrawave_v3,726.02,506.15,0.0
gfx942,304,5888,4096,2048,ck,0,0,134.101,a8w8_blockscale_1x128x128_256x128x128x128_16x16_32x32_2x2_8x32x1_8x32x1_1x32x1x8_8_1x1_intrawave_v3,736.64,512.16,0.0
gfx942,304,6016,4096,2048,ck,0,0,135.7409,a8w8_blockscale_1x128x128_256x128x128x128_16x16_32x32_2x2_8x32x1_8x32x1_1x32x1x8_8_1x1_intrawave_v3,743.56,515.63,0.0
gfx942,304,6144,4096,2048,ck,0,0,149.1673,a8w8_blockscale_1x128x128_256x128x128x128_16x16_32x32_2x2_8x32x1_8x32x1_1x32x1x8_8_1x1_intrawave_v3,691.03,478.01,0.0
gfx942,304,6272,4096,2048,ck,0,0,152.0056,a8w8_blockscale_1x128x128_256x128x128x128_16x16_32x32_2x2_8x32x1_8x32x1_1x32x1x8_8_1x1_intrawave_v3,692.26,477.71,0.0
gfx942,304,6400,4096,2048,ck,0,0,152.6619,a8w8_blockscale_1x128x128_256x128x128x128_16x16_32x32_2x2_8x32x1_8x32x1_1x32x1x8_8_1x1_intrawave_v3,703.35,484.24,0.0
gfx942,304,6528,4096,2048,ck,0,0,146.1385,a8w8_blockscale_1x128x128_256x128x128x128_16x16_32x32_2x2_8x32x1_8x32x1_1x32x1x8_8_1x1_intrawave_v3,749.44,514.82,0.0
gfx942,304,6656,4096,2048,ck,0,0,152.9728,a8w8_blockscale_1x128x128_256x128x128x128_16x16_32x32_2x2_8x32x1_8x32x1_1x32x1x8_8_1x1_intrawave_v3,729.99,500.39,0.0
gfx942,304,6784,4096,2048,ck,0,0,154.5357,a8w8_blockscale_1x128x128_256x128x128x128_16x16_32x32_2x2_8x32x1_8x32x1_1x32x1x8_8_1x1_intrawave_v3,736.51,503.81,0.0
gfx942,304,6912,4096,2048,ck,0,0,159.3132,a8w8_blockscale_1x128x128_256x128x128x128_16x16_32x32_2x2_8x32x1_8x32x1_1x32x1x8_8_1x1_intrawave_v3,727.9,496.93,0.0
gfx942,304,7040,4096,2048,ck,0,0,163.0008,a8w8_blockscale_1x128x128_256x128x128x128_16x16_32x32_2x2_8x32x1_8x32x1_1x32x1x8_8_1x1_intrawave_v3,724.61,493.73,0.0
gfx942,304,7168,4096,2048,ck,0,0,159.6899,a8w8_blockscale_1x128x128_256x128x128x128_16x16_32x32_2x2_8x32x1_8x32x1_1x32x1x8_8_1x1_intrawave_v3,753.08,512.17,0.0
gfx942,304,7296,4096,2048,ck,0,0,160.2221,a8w8_blockscale_1x128x128_256x128x128x128_16x16_32x32_2x2_8x32x1_8x32x1_1x32x1x8_8_1x1_intrawave_v3,763.98,518.65,0.0
gfx942,304,7424,4096,2048,ck,0,0,167.8978,a8w8_blockscale_1x128x128_256x128x128x128_16x16_32x32_2x2_8x32x1_8x32x1_1x32x1x8_8_1x1_intrawave_v3,741.84,502.75,0.0
gfx942,304,7552,4096,2048,ck,0,0,173.8441,a8w8_blockscale_1x128x128_256x128x128x128_16x16_32x32_2x2_8x32x1_8x32x1_1x32x1x8_8_1x1_intrawave_v3,728.82,493.09,0.0
gfx942,304,7680,4096,2048,ck,0,0,174.1597,a8w8_blockscale_1x128x128_256x128x128x128_16x16_32x32_2x2_8x32x1_8x32x1_1x32x1x8_8_1x1_intrawave_v3,739.83,499.72,0.0
gfx942,304,7808,4096,2048,ck,0,0,179.5504,a8w8_blockscale_1x128x128_256x128x128x128_16x16_32x32_2x2_8x32x1_8x32x1_1x32x1x8_8_1x1_intrawave_v3,729.58,492.02,0.0
gfx942,304,7936,4096,2048,ck,0,0,178.5816,a8w8_blockscale_1x128x128_256x128x128x128_16x16_32x32_2x2_8x32x1_8x32x1_1x32x1x8_8_1x1_intrawave_v3,745.56,502.03,0.0
gfx942,304,8064,4096,2048,ck,0,0,179.0654,a8w8_blockscale_1x128x128_256x128x128x128_16x16_32x32_2x2_8x32x1_8x32x1_1x32x1x8_8_1x1_intrawave_v3,755.54,507.99,0.0
gfx942,304,8192,4096,2048,ck,0,0,182.4868,a8w8_blockscale_1x128x128_256x128x128x128_16x16_32x32_2x2_8x32x1_8x32x1_1x32x1x8_8_1x1_intrawave_v3,753.14,505.65,0.0
gfx942,304,8320,4096,2048,ck,0,0,182.0734,a8w8_blockscale_1x128x128_256x128x128x128_16x16_32x32_2x2_8x32x1_8x32x1_1x32x1x8_8_1x1_intrawave_v3,766.65,514.0,0.0
gfx942,304,8448,4096,2048,ck,0,0,185.7884,a8w8_blockscale_1x128x128_256x128x128x128_16x16_32x32_2x2_8x32x1_8x32x1_1x32x1x8_8_1x1_intrawave_v3,762.88,510.78,0.0
gfx942,304,8576,4096,2048,ck,0,0,190.556,a8w8_blockscale_1x128x128_256x128x128x128_16x16_32x32_2x2_8x32x1_8x32x1_1x32x1x8_8_1x1_intrawave_v3,755.06,504.87,0.0
gfx942,304,8704,4096,2048,ck,0,0,193.7181,a8w8_blockscale_1x128x128_256x128x128x128_16x16_32x32_2x2_8x32x1_8x32x1_1x32x1x8_8_1x1_intrawave_v3,753.82,503.4,0.0
gfx942,304,8832,4096,2048,ck,0,0,205.3661,a8w8_blockscale_1x128x128_256x128x128x128_16x16_32x32_2x2_8x32x1_8x32x1_1x32x1x8_8_1x1_intrawave_v3,721.52,481.23,0.0
gfx942,304,8960,4096,2048,ck,0,0,197.7737,a8w8_blockscale_1x128x128_256x128x128x128_16x16_32x32_2x2_8x32x1_8x32x1_1x32x1x8_8_1x1_intrawave_v3,760.08,506.33,0.0
gfx942,304,9088,4096,2048,ck,0,0,198.3843,a8w8_blockscale_1x128x128_256x128x128x128_16x16_32x32_2x2_8x32x1_8x32x1_1x32x1x8_8_1x1_intrawave_v3,768.57,511.38,0.0
gfx942,304,9216,4096,2048,ck,0,0,202.5322,a8w8_blockscale_1x128x128_256x128x128x128_16x16_32x32_2x2_8x32x1_8x32x1_1x32x1x8_8_1x1_intrawave_v3,763.43,507.38,0.0
gfx942,304,9344,4096,2048,ck,0,0,209.6505,a8w8_blockscale_1x128x128_256x128x128x128_16x16_32x32_2x2_8x32x1_8x32x1_1x32x1x8_8_1x1_intrawave_v3,747.75,496.4,0.0
gfx942,304,9472,4096,2048,ck,0,0,202.3036,a8w8_blockscale_1x128x128_256x128x128x128_16x16_32x32_2x2_8x32x1_8x32x1_1x32x1x8_8_1x1_intrawave_v3,785.52,520.91,0.0
gfx942,304,9600,4096,2048,ck,0,0,206.212,a8w8_blockscale_1x128x128_256x128x128x128_16x16_32x32_2x2_8x32x1_8x32x1_1x32x1x8_8_1x1_intrawave_v3,781.05,517.39,0.0
gfx942,304,9728,4096,2048,ck,0,0,207.5875,a8w8_blockscale_1x128x128_256x128x128x128_16x16_32x32_2x2_8x32x1_8x32x1_1x32x1x8_8_1x1_intrawave_v3,786.22,520.28,0.0
gfx942,304,9856,4096,2048,ck,0,0,219.5731,a8w8_blockscale_1x128x128_256x128x128x128_16x16_32x32_2x2_8x32x1_8x32x1_1x32x1x8_8_1x1_intrawave_v3,753.08,497.85,0.0
gfx942,304,9984,4096,2048,ck,0,0,224.3479,a8w8_blockscale_1x128x128_256x128x128x128_16x16_32x32_2x2_8x32x1_8x32x1_1x32x1x8_8_1x1_intrawave_v3,746.62,493.09,0.0
gfx942,304,10112,4096,2048,ck,0,0,224.9972,a8w8_blockscale_1x128x128_256x128x128x128_16x16_32x32_2x2_8x32x1_8x32x1_1x32x1x8_8_1x1_intrawave_v3,754.01,497.5,0.0
gfx942,304,10240,4096,2048,ck,0,0,224.9301,a8w8_blockscale_1x128x128_256x128x128x128_16x16_32x32_2x2_8x32x1_8x32x1_1x32x1x8_8_1x1_intrawave_v3,763.79,503.47,0.0
gfx942,304,10368,4096,2048,ck,0,0,231.5497,a8w8_blockscale_1x128x128_256x128x128x128_16x16_32x32_2x2_8x32x1_8x32x1_1x32x1x8_8_1x1_intrawave_v3,751.23,494.74,0.0
gfx942,304,10496,4096,2048,ck,0,0,229.0806,a8w8_blockscale_1x128x128_256x128x128x128_16x16_32x32_2x2_8x32x1_8x32x1_1x32x1x8_8_1x1_intrawave_v3,768.7,505.79,0.0
gfx942,304,10624,4096,2048,ck,0,0,232.095,a8w8_blockscale_1x128x128_256x128x128x128_16x16_32x32_2x2_8x32x1_8x32x1_1x32x1x8_8_1x1_intrawave_v3,767.97,504.87,0.0
gfx942,304,10752,4096,2048,ck,0,0,230.1291,a8w8_blockscale_1x128x128_256x128x128x128_16x16_32x32_2x2_8x32x1_8x32x1_1x32x1x8_8_1x1_intrawave_v3,783.86,514.88,0.0
gfx942,304,10880,4096,2048,ck,0,0,234.0056,a8w8_blockscale_1x128x128_256x128x128x128_16x16_32x32_2x2_8x32x1_8x32x1_1x32x1x8_8_1x1_intrawave_v3,780.05,511.95,0.0
gfx942,304,11008,4096,2048,ck,0,0,245.6673,a8w8_blockscale_1x128x128_256x128x128x128_16x16_32x32_2x2_8x32x1_8x32x1_1x32x1x8_8_1x1_intrawave_v3,751.76,492.99,0.0
gfx942,304,11136,4096,2048,ck,0,0,247.136,a8w8_blockscale_1x128x128_256x128x128x128_16x16_32x32_2x2_8x32x1_8x32x1_1x32x1x8_8_1x1_intrawave_v3,755.98,495.36,0.0
gfx942,304,11264,4096,2048,ck,0,0,244.9722,a8w8_blockscale_1x128x128_256x128x128x128_16x16_32x32_2x2_8x32x1_8x32x1_1x32x1x8_8_1x1_intrawave_v3,771.43,505.09,0.0
gfx942,304,11392,4096,2048,ck,0,0,250.0919,a8w8_blockscale_1x128x128_256x128x128x128_16x16_32x32_2x2_8x32x1_8x32x1_1x32x1x8_8_1x1_intrawave_v3,764.22,499.99,0.0
gfx942,304,11520,4096,2048,ck,0,0,249.7722,a8w8_blockscale_1x128x128_256x128x128x128_16x16_32x32_2x2_8x32x1_8x32x1_1x32x1x8_8_1x1_intrawave_v3,773.8,505.87,0.0
gfx942,304,11648,4096,2048,ck,0,0,248.8921,a8w8_blockscale_1x128x128_256x128x128x128_16x16_32x32_2x2_8x32x1_8x32x1_1x32x1x8_8_1x1_intrawave_v3,785.16,512.93,0.0
gfx942,304,11776,4096,2048,ck,0,0,255.1534,a8w8_blockscale_1x128x128_256x128x128x128_16x16_32x32_2x2_8x32x1_8x32x1_1x32x1x8_8_1x1_intrawave_v3,774.31,505.48,0.0
gfx942,304,11904,4096,2048,ck,0,0,256.9435,a8w8_blockscale_1x128x128_256x128x128x128_16x16_32x32_2x2_8x32x1_8x32x1_1x32x1x8_8_1x1_intrawave_v3,777.28,507.06,0.0
gfx942,304,12032,4096,2048,ck,0,0,256.8755,a8w8_blockscale_1x128x128_256x128x128x128_16x16_32x32_2x2_8x32x1_8x32x1_1x32x1x8_8_1x1_intrawave_v3,785.84,512.3,0.0
gfx942,304,12160,4096,2048,ck,0,0,262.1107,a8w8_blockscale_1x128x128_256x128x128x128_16x16_32x32_2x2_8x32x1_8x32x1_1x32x1x8_8_1x1_intrawave_v3,778.34,507.06,0.0
gfx942,304,12288,4096,2048,ck,0,0,265.6936,a8w8_blockscale_1x128x128_256x128x128x128_16x16_32x32_2x2_8x32x1_8x32x1_1x32x1x8_8_1x1_intrawave_v3,775.93,505.16,0.0
gfx942,304,12416,4096,2048,ck,0,0,270.4214,a8w8_blockscale_1x128x128_256x128x128x128_16x16_32x32_2x2_8x32x1_8x32x1_1x32x1x8_8_1x1_intrawave_v3,770.3,501.18,0.0
gfx942,304,12544,4096,2048,ck,0,0,272.585,a8w8_blockscale_1x128x128_256x128x128x128_16x16_32x32_2x2_8x32x1_8x32x1_1x32x1x8_8_1x1_intrawave_v3,772.07,502.01,0.0
gfx942,304,12672,4096,2048,ck,0,0,273.9494,a8w8_blockscale_1x128x128_256x128x128x128_16x16_32x32_2x2_8x32x1_8x32x1_1x32x1x8_8_1x1_intrawave_v3,776.06,504.29,0.0
gfx942,304,12800,4096,2048,ck,0,0,272.7772,a8w8_blockscale_1x128x128_256x128x128x128_16x16_32x32_2x2_8x32x1_8x32x1_1x32x1x8_8_1x1_intrawave_v3,787.27,511.26,0.0
gfx942,304,12928,4096,2048,ck,0,0,280.705,a8w8_blockscale_1x128x128_256x128x128x128_16x16_32x32_2x2_8x32x1_8x32x1_1x32x1x8_8_1x1_intrawave_v3,772.68,501.49,0.0
gfx942,304,13056,4096,2048,ck,0,0,274.583,a8w8_blockscale_1x128x128_256x128x128x128_16x16_32x32_2x2_8x32x1_8x32x1_1x32x1x8_8_1x1_intrawave_v3,797.73,517.45,0.0
gfx942,304,13184,4096,2048,ck,0,0,279.9176,a8w8_blockscale_1x128x128_256x128x128x128_16x16_32x32_2x2_8x32x1_8x32x1_1x32x1x8_8_1x1_intrawave_v3,790.2,512.27,0.0
gfx942,304,13312,4096,2048,ck,0,0,291.4196,a8w8_blockscale_1x128x128_256x128x128x128_16x16_32x32_2x2_8x32x1_8x32x1_1x32x1x8_8_1x1_intrawave_v3,766.38,496.55,0.0
gfx942,304,13440,4096,2048,ck,0,0,294.4429,a8w8_blockscale_1x128x128_256x128x128x128_16x16_32x32_2x2_8x32x1_8x32x1_1x32x1x8_8_1x1_intrawave_v3,765.8,495.9,0.0
gfx942,304,13568,4096,2048,ck,0,0,290.4559,a8w8_blockscale_1x128x128_256x128x128x128_16x16_32x32_2x2_8x32x1_8x32x1_1x32x1x8_8_1x1_intrawave_v3,783.71,507.22,0.0
gfx942,304,13696,4096,2048,ck,0,0,292.6905,a8w8_blockscale_1x128x128_256x128x128x128_16x16_32x32_2x2_8x32x1_8x32x1_1x32x1x8_8_1x1_intrawave_v3,785.06,507.83,0.0
gfx942,304,13824,4096,2048,ck,0,0,295.3662,a8w8_blockscale_1x128x128_256x128x128x128_16x16_32x32_2x2_8x32x1_8x32x1_1x32x1x8_8_1x1_intrawave_v3,785.22,507.66,0.0
gfx942,304,13952,4096,2048,ck,0,0,304.3509,a8w8_blockscale_1x128x128_256x128x128x128_16x16_32x32_2x2_8x32x1_8x32x1_1x32x1x8_8_1x1_intrawave_v3,769.1,496.98,0.0
gfx942,304,14080,4096,2048,ck,0,0,301.5548,a8w8_blockscale_1x128x128_256x128x128x128_16x16_32x32_2x2_8x32x1_8x32x1_1x32x1x8_8_1x1_intrawave_v3,783.35,505.94,0.0
gfx942,304,14208,4096,2048,ck,0,0,302.0744,a8w8_blockscale_1x128x128_256x128x128x128_16x16_32x32_2x2_8x32x1_8x32x1_1x32x1x8_8_1x1_intrawave_v3,789.11,509.41,0.0
gfx942,304,14336,4096,2048,ck,0,0,302.2951,a8w8_blockscale_1x128x128_256x128x128x128_16x16_32x32_2x2_8x32x1_8x32x1_1x32x1x8_8_1x1_intrawave_v3,795.64,513.37,0.0
gfx942,304,14464,4096,2048,ck,0,0,307.1517,a8w8_blockscale_1x128x128_256x128x128x128_16x16_32x32_2x2_8x32x1_8x32x1_1x32x1x8_8_1x1_intrawave_v3,790.05,509.52,0.0
gfx942,304,14592,4096,2048,ck,0,0,311.8826,a8w8_blockscale_1x128x128_256x128x128x128_16x16_32x32_2x2_8x32x1_8x32x1_1x32x1x8_8_1x1_intrawave_v3,784.95,505.99,0.0
gfx942,304,14720,4096,2048,ck,0,0,315.1352,a8w8_blockscale_1x128x128_256x128x128x128_16x16_32x32_2x2_8x32x1_8x32x1_1x32x1x8_8_1x1_intrawave_v3,783.67,504.93,0.0
gfx942,304,14848,4096,2048,ck,0,0,317.3864,a8w8_blockscale_1x128x128_256x128x128x128_16x16_32x32_2x2_8x32x1_8x32x1_1x32x1x8_8_1x1_intrawave_v3,784.87,505.48,0.0
gfx942,304,14976,4096,2048,ck,0,0,324.2952,a8w8_blockscale_1x128x128_256x128x128x128_16x16_32x32_2x2_8x32x1_8x32x1_1x32x1x8_8_1x1_intrawave_v3,774.77,498.75,0.0
gfx942,304,15104,4096,2048,ck,0,0,324.2851,a8w8_blockscale_1x128x128_256x128x128x128_16x16_32x32_2x2_8x32x1_8x32x1_1x32x1x8_8_1x1_intrawave_v3,781.42,502.81,0.0
gfx942,304,15232,4096,2048,ck,0,0,321.7215,a8w8_blockscale_1x128x128_256x128x128x128_16x16_32x32_2x2_8x32x1_8x32x1_1x32x1x8_8_1x1_intrawave_v3,794.32,510.89,0.0
gfx942,304,15360,4096,2048,ck,0,0,322.5862,a8w8_blockscale_1x128x128_256x128x128x128_16x16_32x32_2x2_8x32x1_8x32x1_1x32x1x8_8_1x1_intrawave_v3,798.85,513.58,0.0
gfx942,304,15488,4096,2048,ck,0,0,330.1587,a8w8_blockscale_1x128x128_256x128x128x128_16x16_32x32_2x2_8x32x1_8x32x1_1x32x1x8_8_1x1_intrawave_v3,787.03,505.77,0.0
gfx942,304,15616,4096,2048,ck,0,0,337.4221,a8w8_blockscale_1x128x128_256x128x128x128_16x16_32x32_2x2_8x32x1_8x32x1_1x32x1x8_8_1x1_intrawave_v3,776.45,498.77,0.0
gfx942,304,15744,4096,2048,ck,0,0,338.4098,a8w8_blockscale_1x128x128_256x128x128x128_16x16_32x32_2x2_8x32x1_8x32x1_1x32x1x8_8_1x1_intrawave_v3,780.53,501.19,0.0
gfx942,304,15872,4096,2048,ck,0,0,337.0277,a8w8_blockscale_1x128x128_256x128x128x128_16x16_32x32_2x2_8x32x1_8x32x1_1x32x1x8_8_1x1_intrawave_v3,790.11,507.13,0.0
gfx942,304,16000,4096,2048,ck,0,0,343.2994,a8w8_blockscale_1x128x128_256x128x128x128_16x16_32x32_2x2_8x32x1_8x32x1_1x32x1x8_8_1x1_intrawave_v3,781.93,501.69,0.0
gfx942,304,16128,4096,2048,ck,0,0,342.2006,a8w8_blockscale_1x128x128_256x128x128x128_16x16_32x32_2x2_8x32x1_8x32x1_1x32x1x8_8_1x1_intrawave_v3,790.71,507.13,0.0
gfx942,304,16256,4096,2048,ck,0,0,351.6939,a8w8_blockscale_1x128x128_256x128x128x128_16x16_32x32_2x2_8x32x1_8x32x1_1x32x1x8_8_1x1_intrawave_v3,775.48,497.17,0.0
gfx942,304,16384,4096,2048,ck,0,0,346.7164,a8w8_blockscale_1x128x128_256x128x128x128_16x16_32x32_2x2_8x32x1_8x32x1_1x32x1x8_8_1x1_intrawave_v3,792.8,508.08,0.0
gfx942,304,16512,4096,2048,ck,0,0,360.4923,a8w8_blockscale_1x128x128_256x128x128x128_16x16_32x32_2x2_8x32x1_8x32x1_1x32x1x8_8_1x1_intrawave_v3,768.46,492.3,0.0
gfx942,304,16640,4096,2048,ck,0,0,355.8063,a8w8_blockscale_1x128x128_256x128x128x128_16x16_32x32_2x2_8x32x1_8x32x1_1x32x1x8_8_1x1_intrawave_v3,784.62,502.47,0.0
gfx942,304,16768,4096,2048,ck,0,0,351.1213,a8w8_blockscale_1x128x128_256x128x128x128_16x16_32x32_2x2_8x32x1_8x32x1_1x32x1x8_8_1x1_intrawave_v3,801.21,512.91,0.0
gfx942,304,16896,4096,2048,ck,0,0,359.3564,a8w8_blockscale_1x128x128_256x128x128x128_16x16_32x32_2x2_8x32x1_8x32x1_1x32x1x8_8_1x1_intrawave_v3,788.82,504.8,0.0
gfx942,304,17024,4096,2048,ck,0,0,357.0139,a8w8_blockscale_1x128x128_256x128x128x128_16x16_32x32_2x2_8x32x1_8x32x1_1x32x1x8_8_1x1_intrawave_v3,800.01,511.79,0.0
gfx942,304,17152,4096,2048,ck,0,0,373.421,a8w8_blockscale_1x128x128_256x128x128x128_16x16_32x32_2x2_8x32x1_8x32x1_1x32x1x8_8_1x1_intrawave_v3,770.61,492.81,0.0
gfx942,304,17280,4096,2048,ck,0,0,359.9721,a8w8_blockscale_1x128x128_256x128x128x128_16x16_32x32_2x2_8x32x1_8x32x1_1x32x1x8_8_1x1_intrawave_v3,805.37,514.86,0.0
gfx942,304,17408,4096,2048,ck,0,0,369.224,a8w8_blockscale_1x128x128_256x128x128x128_16x16_32x32_2x2_8x32x1_8x32x1_1x32x1x8_8_1x1_intrawave_v3,791.0,505.51,0.0
gfx942,304,17536,4096,2048,ck,0,0,372.133,a8w8_blockscale_1x128x128_256x128x128x128_16x16_32x32_2x2_8x32x1_8x32x1_1x32x1x8_8_1x1_intrawave_v3,790.59,505.08,0.0
gfx942,304,17664,4096,2048,ck,0,0,373.4047,a8w8_blockscale_1x128x128_256x128x128x128_16x16_32x32_2x2_8x32x1_8x32x1_1x32x1x8_8_1x1_intrawave_v3,793.65,506.87,0.0
gfx942,304,17792,4096,2048,ck,0,0,373.4285,a8w8_blockscale_1x128x128_256x128x128x128_16x16_32x32_2x2_8x32x1_8x32x1_1x32x1x8_8_1x1_intrawave_v3,799.35,510.35,0.0
gfx942,304,17920,4096,2048,ck,0,0,388.2335,a8w8_blockscale_1x128x128_256x128x128x128_16x16_32x32_2x2_8x32x1_8x32x1_1x32x1x8_8_1x1_intrawave_v3,774.4,494.26,0.0
gfx942,304,18048,4096,2048,ck,0,0,379.7064,a8w8_blockscale_1x128x128_256x128x128x128_16x16_32x32_2x2_8x32x1_8x32x1_1x32x1x8_8_1x1_intrawave_v3,797.45,508.81,0.0
gfx942,304,18176,4096,2048,ck,0,0,383.1244,a8w8_blockscale_1x128x128_256x128x128x128_16x16_32x32_2x2_8x32x1_8x32x1_1x32x1x8_8_1x1_intrawave_v3,795.94,507.7,0.0
gfx942,304,18304,4096,2048,ck,0,0,393.707,a8w8_blockscale_1x128x128_256x128x128x128_16x16_32x32_2x2_8x32x1_8x32x1_1x32x1x8_8_1x1_intrawave_v3,780.0,497.38,0.0
gfx942,304,18432,4096,2048,ck,0,0,392.5323,a8w8_blockscale_1x128x128_256x128x128x128_16x16_32x32_2x2_8x32x1_8x32x1_1x32x1x8_8_1x1_intrawave_v3,787.8,502.21,0.0
gfx942,304,18560,4096,2048,ck,0,0,398.6333,a8w8_blockscale_1x128x128_256x128x128x128_16x16_32x32_2x2_8x32x1_8x32x1_1x32x1x8_8_1x1_intrawave_v3,781.13,497.81,0.0
gfx942,304,18688,4096,2048,ck,0,0,401.477,a8w8_blockscale_1x128x128_256x128x128x128_16x16_32x32_2x2_8x32x1_8x32x1_1x32x1x8_8_1x1_intrawave_v3,780.95,497.55,0.0
gfx942,304,18816,4096,2048,ck,0,0,399.5645,a8w8_blockscale_1x128x128_256x128x128x128_16x16_32x32_2x2_8x32x1_8x32x1_1x32x1x8_8_1x1_intrawave_v3,790.06,503.21,0.0
gfx942,304,18944,4096,2048,ck,0,0,402.9663,a8w8_blockscale_1x128x128_256x128x128x128_16x16_32x32_2x2_8x32x1_8x32x1_1x32x1x8_8_1x1_intrawave_v3,788.72,502.21,0.0
gfx942,304,19072,4096,2048,ck,0,0,407.5264,a8w8_blockscale_1x128x128_256x128x128x128_16x16_32x32_2x2_8x32x1_8x32x1_1x32x1x8_8_1x1_intrawave_v3,785.16,499.81,0.0
gfx942,304,19200,4096,2048,ck,0,0,404.989,a8w8_blockscale_1x128x128_256x128x128x128_16x16_32x32_2x2_8x32x1_8x32x1_1x32x1x8_8_1x1_intrawave_v3,795.39,506.18,0.0
gfx942,304,19328,4096,2048,ck,0,0,404.8253,a8w8_blockscale_1x128x128_256x128x128x128_16x16_32x32_2x2_8x32x1_8x32x1_1x32x1x8_8_1x1_intrawave_v3,801.01,509.62,0.0
gfx942,304,19456,4096,2048,ck,0,0,410.5598,a8w8_blockscale_1x128x128_256x128x128x128_16x16_32x32_2x2_8x32x1_8x32x1_1x32x1x8_8_1x1_intrawave_v3,795.05,505.7,0.0
gfx942,304,19584,4096,2048,ck,0,0,420.6471,a8w8_blockscale_1x128x128_256x128x128x128_16x16_32x32_2x2_8x32x1_8x32x1_1x32x1x8_8_1x1_intrawave_v3,781.09,496.68,0.0
gfx942,304,19712,4096,2048,ck,0,0,421.3253,a8w8_blockscale_1x128x128_256x128x128x128_16x16_32x32_2x2_8x32x1_8x32x1_1x32x1x8_8_1x1_intrawave_v3,784.93,499.0,0.0
gfx942,304,19840,4096,2048,ck,0,0,421.924,a8w8_blockscale_1x128x128_256x128x128x128_16x16_32x32_2x2_8x32x1_8x32x1_1x32x1x8_8_1x1_intrawave_v3,788.91,501.39,0.0
gfx942,304,19968,4096,2048,ck,0,0,425.5621,a8w8_blockscale_1x128x128_256x128x128x128_16x16_32x32_2x2_8x32x1_8x32x1_1x32x1x8_8_1x1_intrawave_v3,787.21,500.19,0.0
gfx942,304,20096,4096,2048,ck,0,0,425.3887,a8w8_blockscale_1x128x128_256x128x128x128_16x16_32x32_2x2_8x32x1_8x32x1_1x32x1x8_8_1x1_intrawave_v3,792.58,503.47,0.0
gfx942,304,20224,4096,2048,ck,0,0,426.7354,a8w8_blockscale_1x128x128_256x128x128x128_16x16_32x32_2x2_8x32x1_8x32x1_1x32x1x8_8_1x1_intrawave_v3,795.11,504.96,0.0
gfx942,304,20352,4096,2048,ck,0,0,424.5315,a8w8_blockscale_1x128x128_256x128x128x128_16x16_32x32_2x2_8x32x1_8x32x1_1x32x1x8_8_1x1_intrawave_v3,804.3,510.66,0.0
gfx942,304,20480,4096,2048,ck,0,0,433.8628,a8w8_blockscale_1x128x128_256x128x128x128_16x16_32x32_2x2_8x32x1_8x32x1_1x32x1x8_8_1x1_intrawave_v3,791.95,502.7,0.0
gfx942,304,20608,4096,2048,ck,0,0,431.2892,a8w8_blockscale_1x128x128_256x128x128x128_16x16_32x32_2x2_8x32x1_8x32x1_1x32x1x8_8_1x1_intrawave_v3,801.65,508.74,0.0
gfx942,304,20736,4096,2048,ck,0,0,441.6512,a8w8_blockscale_1x128x128_256x128x128x128_16x16_32x32_2x2_8x32x1_8x32x1_1x32x1x8_8_1x1_intrawave_v3,787.71,499.77,0.0
gfx942,304,20864,4096,2048,ck,0,0,443.1221,a8w8_blockscale_1x128x128_256x128x128x128_16x16_32x32_2x2_8x32x1_8x32x1_1x32x1x8_8_1x1_intrawave_v3,789.94,501.07,0.0
gfx942,304,20992,4096,2048,ck,0,0,438.0242,a8w8_blockscale_1x128x128_256x128x128x128_16x16_32x32_2x2_8x32x1_8x32x1_1x32x1x8_8_1x1_intrawave_v3,804.04,509.9,0.0
gfx942,304,21120,4096,2048,ck,0,0,448.8053,a8w8_blockscale_1x128x128_256x128x128x128_16x16_32x32_2x2_8x32x1_8x32x1_1x32x1x8_8_1x1_intrawave_v3,789.51,500.57,0.0
gfx942,304,21248,4096,2048,ck,0,0,447.4318,a8w8_blockscale_1x128x128_256x128x128x128_16x16_32x32_2x2_8x32x1_8x32x1_1x32x1x8_8_1x1_intrawave_v3,796.73,505.03,0.0
gfx942,304,21376,4096,2048,ck,0,0,452.0465,a8w8_blockscale_1x128x128_256x128x128x128_16x16_32x32_2x2_8x32x1_8x32x1_1x32x1x8_8_1x1_intrawave_v3,793.35,502.78,0.0
gfx942,304,21504,4096,2048,ck,0,0,448.2952,a8w8_blockscale_1x128x128_256x128x128x128_16x16_32x32_2x2_8x32x1_8x32x1_1x32x1x8_8_1x1_intrawave_v3,804.78,509.91,0.0
gfx942,304,21632,4096,2048,ck,0,0,459.3624,a8w8_blockscale_1x128x128_256x128x128x128_16x16_32x32_2x2_8x32x1_8x32x1_1x32x1x8_8_1x1_intrawave_v3,790.06,500.48,0.0
gfx942,304,21760,4096,2048,ck,0,0,454.5153,a8w8_blockscale_1x128x128_256x128x128x128_16x16_32x32_2x2_8x32x1_8x32x1_1x32x1x8_8_1x1_intrawave_v3,803.21,508.7,0.0
gfx942,304,21888,4096,2048,ck,0,0,456.7754,a8w8_blockscale_1x128x128_256x128x128x128_16x16_32x32_2x2_8x32x1_8x32x1_1x32x1x8_8_1x1_intrawave_v3,803.94,509.05,0.0
gfx942,304,22016,4096,2048,ck,0,0,461.4094,a8w8_blockscale_1x128x128_256x128x128x128_16x16_32x32_2x2_8x32x1_8x32x1_1x32x1x8_8_1x1_intrawave_v3,800.52,506.78,0.0
gfx942,304,22144,4096,2048,ck,0,0,461.9381,a8w8_blockscale_1x128x128_256x128x128x128_16x16_32x32_2x2_8x32x1_8x32x1_1x32x1x8_8_1x1_intrawave_v3,804.25,509.04,0.0
gfx942,304,22272,4096,2048,ck,0,0,473.5747,a8w8_blockscale_1x128x128_256x128x128x128_16x16_32x32_2x2_8x32x1_8x32x1_1x32x1x8_8_1x1_intrawave_v3,789.02,499.3,0.0
gfx942,304,22400,4096,2048,ck,0,0,473.3419,a8w8_blockscale_1x128x128_256x128x128x128_16x16_32x32_2x2_8x32x1_8x32x1_1x32x1x8_8_1x1_intrawave_v3,793.95,502.31,0.0
gfx942,304,22528,4096,2048,ck,0,0,479.3562,a8w8_blockscale_1x128x128_256x128x128x128_16x16_32x32_2x2_8x32x1_8x32x1_1x32x1x8_8_1x1_intrawave_v3,788.47,498.74,0.0
gfx942,304,22656,4096,2048,ck,0,0,475.2042,a8w8_blockscale_1x128x128_256x128x128x128_16x16_32x32_2x2_8x32x1_8x32x1_1x32x1x8_8_1x1_intrawave_v3,799.88,505.86,0.0
gfx942,304,22784,4096,2048,ck,0,0,482.9174,a8w8_blockscale_1x128x128_256x128x128x128_16x16_32x32_2x2_8x32x1_8x32x1_1x32x1x8_8_1x1_intrawave_v3,791.55,500.49,0.0
gfx942,304,22912,4096,2048,ck,0,0,479.6218,a8w8_blockscale_1x128x128_256x128x128x128_16x16_32x32_2x2_8x32x1_8x32x1_1x32x1x8_8_1x1_intrawave_v3,801.46,506.66,0.0
gfx942,304,23040,4096,2048,ck,0,0,479.6415,a8w8_blockscale_1x128x128_256x128x128x128_16x16_32x32_2x2_8x32x1_8x32x1_1x32x1x8_8_1x1_intrawave_v3,805.91,509.38,0.0
gfx942,304,23168,4096,2048,ck,0,0,493.1195,a8w8_blockscale_1x128x128_256x128x128x128_16x16_32x32_2x2_8x32x1_8x32x1_1x32x1x8_8_1x1_intrawave_v3,788.24,498.11,0.0
gfx942,304,23296,4096,2048,ck,0,0,497.0704,a8w8_blockscale_1x128x128_256x128x128x128_16x16_32x32_2x2_8x32x1_8x32x1_1x32x1x8_8_1x1_intrawave_v3,786.29,496.79,0.0
gfx942,304,23424,4096,2048,ck,0,0,490.3703,a8w8_blockscale_1x128x128_256x128x128x128_16x16_32x32_2x2_8x32x1_8x32x1_1x32x1x8_8_1x1_intrawave_v3,801.41,506.25,0.0
gfx942,304,23552,4096,2048,ck,0,0,491.281,a8w8_blockscale_1x128x128_256x128x128x128_16x16_32x32_2x2_8x32x1_8x32x1_1x32x1x8_8_1x1_intrawave_v3,804.3,507.98,0.0
gfx942,304,23680,4096,2048,ck,0,0,495.4431,a8w8_blockscale_1x128x128_256x128x128x128_16x16_32x32_2x2_8x32x1_8x32x1_1x32x1x8_8_1x1_intrawave_v3,801.88,506.36,0.0
gfx942,304,23808,4096,2048,ck,0,0,509.0277,a8w8_blockscale_1x128x128_256x128x128x128_16x16_32x32_2x2_8x32x1_8x32x1_1x32x1x8_8_1x1_intrawave_v3,784.7,495.42,0.0
gfx942,304,23936,4096,2048,ck,0,0,498.0661,a8w8_blockscale_1x128x128_256x128x128x128_16x16_32x32_2x2_8x32x1_8x32x1_1x32x1x8_8_1x1_intrawave_v3,806.28,508.96,0.0
gfx942,304,24064,4096,2048,ck,0,0,503.5876,a8w8_blockscale_1x128x128_256x128x128x128_16x16_32x32_2x2_8x32x1_8x32x1_1x32x1x8_8_1x1_intrawave_v3,801.7,505.98,0.0
gfx942,304,24192,4096,2048,ck,0,0,502.3606,a8w8_blockscale_1x128x128_256x128x128x128_16x16_32x32_2x2_8x32x1_8x32x1_1x32x1x8_8_1x1_intrawave_v3,807.93,509.82,0.0
gfx942,304,24320,4096,2048,ck,0,0,519.1056,a8w8_blockscale_1x128x128_256x128x128x128_16x16_32x32_2x2_8x32x1_8x32x1_1x32x1x8_8_1x1_intrawave_v3,786.01,495.9,0.0
gfx942,304,24448,4096,2048,ck,0,0,508.4147,a8w8_blockscale_1x128x128_256x128x128x128_16x16_32x32_2x2_8x32x1_8x32x1_1x32x1x8_8_1x1_intrawave_v3,806.76,508.91,0.0
gfx942,304,24576,4096,2048,ck,0,0,527.5849,a8w8_blockscale_1x128x128_256x128x128x128_16x16_32x32_2x2_8x32x1_8x32x1_1x32x1x8_8_1x1_intrawave_v3,781.52,492.9,0.0
gfx942,304,24704,4096,2048,ck,0,0,528.1506,a8w8_blockscale_1x128x128_256x128x128x128_16x16_32x32_2x2_8x32x1_8x32x1_1x32x1x8_8_1x1_intrawave_v3,784.75,494.85,0.0
gfx942,304,24832,4096,2048,ck,0,0,530.0177,a8w8_blockscale_1x128x128_256x128x128x128_16x16_32x32_2x2_8x32x1_8x32x1_1x32x1x8_8_1x1_intrawave_v3,786.03,495.58,0.0
gfx942,304,24960,4096,2048,ck,0,0,518.7989,a8w8_blockscale_1x128x128_256x128x128x128_16x16_32x32_2x2_8x32x1_8x32x1_1x32x1x8_8_1x1_intrawave_v3,807.17,508.83,0.0
gfx942,304,25088,4096,2048,ck,0,0,521.7572,a8w8_blockscale_1x128x128_256x128x128x128_16x16_32x32_2x2_8x32x1_8x32x1_1x32x1x8_8_1x1_intrawave_v3,806.71,508.45,0.0
gfx942,304,25216,4096,2048,ck,0,0,534.0656,a8w8_blockscale_1x128x128_256x128x128x128_16x16_32x32_2x2_8x32x1_8x32x1_1x32x1x8_8_1x1_intrawave_v3,792.14,499.19,0.0
gfx942,304,25344,4096,2048,ck,0,0,540.9279,a8w8_blockscale_1x128x128_256x128x128x128_16x16_32x32_2x2_8x32x1_8x32x1_1x32x1x8_8_1x1_intrawave_v3,786.06,495.28,0.0
gfx942,304,25472,4096,2048,ck,0,0,534.3518,a8w8_blockscale_1x128x128_256x128x128x128_16x16_32x32_2x2_8x32x1_8x32x1_1x32x1x8_8_1x1_intrawave_v3,799.75,503.83,0.0
gfx942,304,25600,4096,2048,ck,0,0,534.1916,a8w8_blockscale_1x128x128_256x128x128x128_16x16_32x32_2x2_8x32x1_8x32x1_1x32x1x8_8_1x1_intrawave_v3,804.01,506.43,0.0
gfx942,304,25728,4096,2048,ck,0,0,535.896,a8w8_blockscale_1x128x128_256x128x128x128_16x16_32x32_2x2_8x32x1_8x32x1_1x32x1x8_8_1x1_intrawave_v3,805.46,507.27,0.0
gfx942,304,25856,4096,2048,ck,0,0,551.7322,a8w8_blockscale_1x128x128_256x128x128x128_16x16_32x32_2x2_8x32x1_8x32x1_1x32x1x8_8_1x1_intrawave_v3,786.24,495.08,0.0
gfx942,304,25984,4096,2048,ck,0,0,538.6991,a8w8_blockscale_1x128x128_256x128x128x128_16x16_32x32_2x2_8x32x1_8x32x1_1x32x1x8_8_1x1_intrawave_v3,809.24,509.5,0.0
gfx942,304,26112,4096,2048,ck,0,0,547.2992,a8w8_blockscale_1x128x128_256x128x128x128_16x16_32x32_2x2_8x32x1_8x32x1_1x32x1x8_8_1x1_intrawave_v3,800.45,503.88,0.0
gfx942,304,26240,4096,2048,ck,0,0,554.465,a8w8_blockscale_1x128x128_256x128x128x128_16x16_32x32_2x2_8x32x1_8x32x1_1x32x1x8_8_1x1_intrawave_v3,793.98,499.74,0.0
gfx942,304,26368,4096,2048,ck,0,0,544.3203,a8w8_blockscale_1x128x128_256x128x128x128_16x16_32x32_2x2_8x32x1_8x32x1_1x32x1x8_8_1x1_intrawave_v3,812.72,511.46,0.0
gfx942,304,26496,4096,2048,ck,0,0,563.7716,a8w8_blockscale_1x128x128_256x128x128x128_16x16_32x32_2x2_8x32x1_8x32x1_1x32x1x8_8_1x1_intrawave_v3,788.49,496.14,0.0
gfx942,304,26624,4096,2048,ck,0,0,551.5046,a8w8_blockscale_1x128x128_256x128x128x128_16x16_32x32_2x2_8x32x1_8x32x1_1x32x1x8_8_1x1_intrawave_v3,809.92,509.55,0.0
gfx942,304,26752,4096,2048,ck,0,0,563.4927,a8w8_blockscale_1x128x128_256x128x128x128_16x16_32x32_2x2_8x32x1_8x32x1_1x32x1x8_8_1x1_intrawave_v3,796.5,501.03,0.0
gfx942,304,26880,4096,2048,ck,0,0,559.3838,a8w8_blockscale_1x128x128_256x128x128x128_16x16_32x32_2x2_8x32x1_8x32x1_1x32x1x8_8_1x1_intrawave_v3,806.19,507.06,0.0
gfx942,304,27008,4096,2048,ck,0,0,558.8698,a8w8_blockscale_1x128x128_256x128x128x128_16x16_32x32_2x2_8x32x1_8x32x1_1x32x1x8_8_1x1_intrawave_v3,810.78,509.87,0.0
gfx942,304,27136,4096,2048,ck,0,0,565.9243,a8w8_blockscale_1x128x128_256x128x128x128_16x16_32x32_2x2_8x32x1_8x32x1_1x32x1x8_8_1x1_intrawave_v3,804.47,505.83,0.0
gfx942,304,27264,4096,2048,ck,0,0,567.8939,a8w8_blockscale_1x128x128_256x128x128x128_16x16_32x32_2x2_8x32x1_8x32x1_1x32x1x8_8_1x1_intrawave_v3,805.46,506.38,0.0
gfx942,304,27392,4096,2048,ck,0,0,567.863,a8w8_blockscale_1x128x128_256x128x128x128_16x16_32x32_2x2_8x32x1_8x32x1_1x32x1x8_8_1x1_intrawave_v3,809.28,508.72,0.0
gfx942,304,27520,4096,2048,ck,0,0,569.871,a8w8_blockscale_1x128x128_256x128x128x128_16x16_32x32_2x2_8x32x1_8x32x1_1x32x1x8_8_1x1_intrawave_v3,810.2,509.23,0.0
gfx942,304,27648,4096,2048,ck,0,0,569.5234,a8w8_blockscale_1x128x128_256x128x128x128_16x16_32x32_2x2_8x32x1_8x32x1_1x32x1x8_8_1x1_intrawave_v3,814.46,511.84,0.0
gfx942,304,27776,4096,2048,ck,0,0,591.414,a8w8_blockscale_1x128x128_256x128x128x128_16x16_32x32_2x2_8x32x1_8x32x1_1x32x1x8_8_1x1_intrawave_v3,787.95,495.11,0.0
gfx942,304,27904,4096,2048,ck,0,0,593.7076,a8w8_blockscale_1x128x128_256x128x128x128_16x16_32x32_2x2_8x32x1_8x32x1_1x32x1x8_8_1x1_intrawave_v3,788.52,495.4,0.0
gfx942,304,28032,4096,2048,ck,0,0,584.484,a8w8_blockscale_1x128x128_256x128x128x128_16x16_32x32_2x2_8x32x1_8x32x1_1x32x1x8_8_1x1_intrawave_v3,804.64,505.47,0.0
gfx942,304,28160,4096,2048,ck,0,0,597.9238,a8w8_blockscale_1x128x128_256x128x128x128_16x16_32x32_2x2_8x32x1_8x32x1_1x32x1x8_8_1x1_intrawave_v3,790.14,496.3,0.0
gfx942,304,28288,4096,2048,ck,0,0,592.6737,a8w8_blockscale_1x128x128_256x128x128x128_16x16_32x32_2x2_8x32x1_8x32x1_1x32x1x8_8_1x1_intrawave_v3,800.77,502.9,0.0
gfx942,304,28416,4096,2048,ck,0,0,606.012,a8w8_blockscale_1x128x128_256x128x128x128_16x16_32x32_2x2_8x32x1_8x32x1_1x32x1x8_8_1x1_intrawave_v3,786.69,494.0,0.0
gfx942,304,28544,4096,2048,ck,0,0,592.9504,a8w8_blockscale_1x128x128_256x128x128x128_16x16_32x32_2x2_8x32x1_8x32x1_1x32x1x8_8_1x1_intrawave_v3,807.64,507.09,0.0
gfx942,304,28672,4096,2048,ck,0,0,604.9772,a8w8_blockscale_1x128x128_256x128x128x128_16x16_32x32_2x2_8x32x1_8x32x1_1x32x1x8_8_1x1_intrawave_v3,795.13,499.18,0.0
gfx942,304,28800,4096,2048,ck,0,0,610.8352,a8w8_blockscale_1x128x128_256x128x128x128_16x16_32x32_2x2_8x32x1_8x32x1_1x32x1x8_8_1x1_intrawave_v3,791.02,496.53,0.0
gfx942,304,28928,4096,2048,ck,0,0,607.5319,a8w8_blockscale_1x128x128_256x128x128x128_16x16_32x32_2x2_8x32x1_8x32x1_1x32x1x8_8_1x1_intrawave_v3,798.86,501.39,0.0
gfx942,304,29056,4096,2048,ck,0,0,606.5712,a8w8_blockscale_1x128x128_256x128x128x128_16x16_32x32_2x2_8x32x1_8x32x1_1x32x1x8_8_1x1_intrawave_v3,803.66,504.35,0.0
gfx942,304,29184,4096,2048,ck,0,0,610.6679,a8w8_blockscale_1x128x128_256x128x128x128_16x16_32x32_2x2_8x32x1_8x32x1_1x32x1x8_8_1x1_intrawave_v3,801.79,503.11,0.0
gfx942,304,29312,4096,2048,ck,0,0,608.2467,a8w8_blockscale_1x128x128_256x128x128x128_16x16_32x32_2x2_8x32x1_8x32x1_1x32x1x8_8_1x1_intrawave_v3,808.51,507.27,0.0
gfx942,304,29440,4096,2048,ck,0,0,628.3618,a8w8_blockscale_1x128x128_256x128x128x128_16x16_32x32_2x2_8x32x1_8x32x1_1x32x1x8_8_1x1_intrawave_v3,786.05,493.11,0.0
gfx942,304,29568,4096,2048,ck,0,0,618.0841,a8w8_blockscale_1x128x128_256x128x128x128_16x16_32x32_2x2_8x32x1_8x32x1_1x32x1x8_8_1x1_intrawave_v3,802.59,503.43,0.0
gfx942,304,29696,4096,2048,ck,0,0,619.1352,a8w8_blockscale_1x128x128_256x128x128x128_16x16_32x32_2x2_8x32x1_8x32x1_1x32x1x8_8_1x1_intrawave_v3,804.7,504.7,0.0
gfx942,304,29824,4096,2048,ck,0,0,620.3776,a8w8_blockscale_1x128x128_256x128x128x128_16x16_32x32_2x2_8x32x1_8x32x1_1x32x1x8_8_1x1_intrawave_v3,806.55,505.8,0.0
gfx942,304,29952,4096,2048,ck,0,0,623.185,a8w8_blockscale_1x128x128_256x128x128x128_16x16_32x32_2x2_8x32x1_8x32x1_1x32x1x8_8_1x1_intrawave_v3,806.36,505.62,0.0
gfx942,304,30080,4096,2048,ck,0,0,639.7986,a8w8_blockscale_1x128x128_256x128x128x128_16x16_32x32_2x2_8x32x1_8x32x1_1x32x1x8_8_1x1_intrawave_v3,788.78,494.54,0.0
gfx942,304,30208,4096,2048,ck,0,0,627.86,a8w8_blockscale_1x128x128_256x128x128x128_16x16_32x32_2x2_8x32x1_8x32x1_1x32x1x8_8_1x1_intrawave_v3,807.2,506.03,0.0
gfx942,304,30336,4096,2048,ck,0,0,628.1126,a8w8_blockscale_1x128x128_256x128x128x128_16x16_32x32_2x2_8x32x1_8x32x1_1x32x1x8_8_1x1_intrawave_v3,810.29,507.92,0.0
gfx942,304,30464,4096,2048,ck,0,0,634.7225,a8w8_blockscale_1x128x128_256x128x128x128_16x16_32x32_2x2_8x32x1_8x32x1_1x32x1x8_8_1x1_intrawave_v3,805.24,504.69,0.0
gfx942,304,30592,4096,2048,ck,0,0,636.2678,a8w8_blockscale_1x128x128_256x128x128x128_16x16_32x32_2x2_8x32x1_8x32x1_1x32x1x8_8_1x1_intrawave_v3,806.65,505.53,0.0
gfx942,304,30720,4096,2048,ck,0,0,634.8587,a8w8_blockscale_1x128x128_256x128x128x128_16x16_32x32_2x2_8x32x1_8x32x1_1x32x1x8_8_1x1_intrawave_v3,811.83,508.71,0.0
gfx942,304,30848,4096,2048,ck,0,0,642.3086,a8w8_blockscale_1x128x128_256x128x128x128_16x16_32x32_2x2_8x32x1_8x32x1_1x32x1x8_8_1x1_intrawave_v3,805.76,504.85,0.0
gfx942,304,30976,4096,2048,ck,0,0,655.1109,a8w8_blockscale_1x128x128_256x128x128x128_16x16_32x32_2x2_8x32x1_8x32x1_1x32x1x8_8_1x1_intrawave_v3,793.29,496.99,0.0
gfx942,304,31104,4096,2048,ck,0,0,658.4116,a8w8_blockscale_1x128x128_256x128x128x128_16x16_32x32_2x2_8x32x1_8x32x1_1x32x1x8_8_1x1_intrawave_v3,792.57,496.49,0.0
gfx942,304,31232,4096,2048,ck,0,0,660.9548,a8w8_blockscale_1x128x128_256x128x128x128_16x16_32x32_2x2_8x32x1_8x32x1_1x32x1x8_8_1x1_intrawave_v3,792.77,496.56,0.0
gfx942,304,31360,4096,2048,ck,0,0,650.4967,a8w8_blockscale_1x128x128_256x128x128x128_16x16_32x32_2x2_8x32x1_8x32x1_1x32x1x8_8_1x1_intrawave_v3,808.82,506.56,0.0
gfx942,304,31488,4096,2048,ck,0,0,657.8266,a8w8_blockscale_1x128x128_256x128x128x128_16x16_32x32_2x2_8x32x1_8x32x1_1x32x1x8_8_1x1_intrawave_v3,803.07,502.91,0.0
gfx942,304,31616,4096,2048,ck,0,0,654.4883,a8w8_blockscale_1x128x128_256x128x128x128_16x16_32x32_2x2_8x32x1_8x32x1_1x32x1x8_8_1x1_intrawave_v3,810.45,507.47,0.0
gfx942,304,31744,4096,2048,ck,0,0,672.2585,a8w8_blockscale_1x128x128_256x128x128x128_16x16_32x32_2x2_8x32x1_8x32x1_1x32x1x8_8_1x1_intrawave_v3,792.22,496.01,0.0
gfx942,304,31872,4096,2048,ck,0,0,673.421,a8w8_blockscale_1x128x128_256x128x128x128_16x16_32x32_2x2_8x32x1_8x32x1_1x32x1x8_8_1x1_intrawave_v3,794.04,497.1,0.0
gfx942,304,32000,4096,2048,ck,0,0,670.9514,a8w8_blockscale_1x128x128_256x128x128x128_16x16_32x32_2x2_8x32x1_8x32x1_1x32x1x8_8_1x1_intrawave_v3,800.16,500.88,0.0
gfx942,304,32128,4096,2048,ck,0,0,668.9311,a8w8_blockscale_1x128x128_256x128x128x128_16x16_32x32_2x2_8x32x1_8x32x1_1x32x1x8_8_1x1_intrawave_v3,805.79,504.36,0.0
gfx942,304,32256,4096,2048,ck,0,0,685.4678,a8w8_blockscale_1x128x128_256x128x128x128_16x16_32x32_2x2_8x32x1_8x32x1_1x32x1x8_8_1x1_intrawave_v3,789.48,494.1,0.0
gfx942,304,32384,4096,2048,ck,0,0,682.7346,a8w8_blockscale_1x128x128_256x128x128x128_16x16_32x32_2x2_8x32x1_8x32x1_1x32x1x8_8_1x1_intrawave_v3,795.79,498.0,0.0
gfx942,304,32512,4096,2048,ck,0,0,675.4079,a8w8_blockscale_1x128x128_256x128x128x128_16x16_32x32_2x2_8x32x1_8x32x1_1x32x1x8_8_1x1_intrawave_v3,807.6,505.34,0.0
gfx942,304,32640,4096,2048,ck,0,0,675.4565,a8w8_blockscale_1x128x128_256x128x128x128_16x16_32x32_2x2_8x32x1_8x32x1_1x32x1x8_8_1x1_intrawave_v3,810.72,507.25,0.0
gfx942,304,32768,4096,2048,ck,0,0,675.1326,a8w8_blockscale_1x128x128_256x128x128x128_16x16_32x32_2x2_8x32x1_8x32x1_1x32x1x8_8_1x1_intrawave_v3,814.29,509.43,0.0
gfx942,304,32896,4096,2048,ck,0,0,685.5076,a8w8_blockscale_1x128x128_256x128x128x128_16x16_32x32_2x2_8x32x1_8x32x1_1x32x1x8_8_1x1_intrawave_v3,805.1,503.63,0.0
gfx942,304,33024,4096,2048,ck,0,0,702.7992,a8w8_blockscale_1x128x128_256x128x128x128_16x16_32x32_2x2_8x32x1_8x32x1_1x32x1x8_8_1x1_intrawave_v3,788.35,493.11,0.0
gfx942,304,33152,4096,2048,ck,0,0,683.1995,a8w8_blockscale_1x128x128_256x128x128x128_16x16_32x32_2x2_8x32x1_8x32x1_1x32x1x8_8_1x1_intrawave_v3,814.11,509.17,0.0
gfx942,304,33280,4096,2048,ck,0,0,701.9622,a8w8_blockscale_1x128x128_256x128x128x128_16x16_32x32_2x2_8x32x1_8x32x1_1x32x1x8_8_1x1_intrawave_v3,795.41,497.43,0.0
gfx942,304,33408,4096,2048,ck,0,0,709.9644,a8w8_blockscale_1x128x128_256x128x128x128_16x16_32x32_2x2_8x32x1_8x32x1_1x32x1x8_8_1x1_intrawave_v3,789.47,493.67,0.0
gfx942,304,33536,4096,2048,ck,0,0,714.0801,a8w8_blockscale_1x128x128_256x128x128x128_16x16_32x32_2x2_8x32x1_8x32x1_1x32x1x8_8_1x1_intrawave_v3,787.92,492.66,0.0
gfx942,304,33664,4096,2048,ck,0,0,708.7174,a8w8_blockscale_1x128x128_256x128x128x128_16x16_32x32_2x2_8x32x1_8x32x1_1x32x1x8_8_1x1_intrawave_v3,796.92,498.24,0.0
gfx942,304,33792,4096,2048,ck,0,0,697.2177,a8w8_blockscale_1x128x128_256x128x128x128_16x16_32x32_2x2_8x32x1_8x32x1_1x32x1x8_8_1x1_intrawave_v3,813.14,508.33,0.0
gfx942,304,33920,4096,2048,ck,0,0,715.8622,a8w8_blockscale_1x128x128_256x128x128x128_16x16_32x32_2x2_8x32x1_8x32x1_1x32x1x8_8_1x1_intrawave_v3,794.96,496.92,0.0
gfx942,304,34048,4096,2048,ck,0,0,700.9046,a8w8_blockscale_1x128x128_256x128x128x128_16x16_32x32_2x2_8x32x1_8x32x1_1x32x1x8_8_1x1_intrawave_v3,814.99,509.4,0.0
gfx942,304,34176,4096,2048,ck,0,0,719.7857,a8w8_blockscale_1x128x128_256x128x128x128_16x16_32x32_2x2_8x32x1_8x32x1_1x32x1x8_8_1x1_intrawave_v3,796.6,497.86,0.0
gfx942,304,34304,4096,2048,ck,0,0,721.0616,a8w8_blockscale_1x128x128_256x128x128x128_16x16_32x32_2x2_8x32x1_8x32x1_1x32x1x8_8_1x1_intrawave_v3,798.16,498.79,0.0
gfx942,304,34432,4096,2048,ck,0,0,728.3519,a8w8_blockscale_1x128x128_256x128x128x128_16x16_32x32_2x2_8x32x1_8x32x1_1x32x1x8_8_1x1_intrawave_v3,793.12,495.6,0.0
gfx942,304,34560,4096,2048,ck,0,0,709.3705,a8w8_blockscale_1x128x128_256x128x128x128_16x16_32x32_2x2_8x32x1_8x32x1_1x32x1x8_8_1x1_intrawave_v3,817.37,510.71,0.0
gfx942,304,34688,4096,2048,ck,0,0,716.8192,a8w8_blockscale_1x128x128_256x128x128x128_16x16_32x32_2x2_8x32x1_8x32x1_1x32x1x8_8_1x1_intrawave_v3,811.88,507.23,0.0
gfx942,304,34816,4096,2048,ck,0,0,719.9218,a8w8_blockscale_1x128x128_256x128x128x128_16x16_32x32_2x2_8x32x1_8x32x1_1x32x1x8_8_1x1_intrawave_v3,811.36,506.87,0.0
gfx942,304,34944,4096,2048,ck,0,0,724.1715,a8w8_blockscale_1x128x128_256x128x128x128_16x16_32x32_2x2_8x32x1_8x32x1_1x32x1x8_8_1x1_intrawave_v3,809.56,505.7,0.0
gfx942,304,35072,4096,2048,ck,0,0,725.8308,a8w8_blockscale_1x128x128_256x128x128x128_16x16_32x32_2x2_8x32x1_8x32x1_1x32x1x8_8_1x1_intrawave_v3,810.67,506.35,0.0
gfx942,304,35200,4096,2048,ck,0,0,724.7664,a8w8_blockscale_1x128x128_256x128x128x128_16x16_32x32_2x2_8x32x1_8x32x1_1x32x1x8_8_1x1_intrawave_v3,814.83,508.9,0.0
gfx942,304,35328,4096,2048,ck,0,0,732.8014,a8w8_blockscale_1x128x128_256x128x128x128_16x16_32x32_2x2_8x32x1_8x32x1_1x32x1x8_8_1x1_intrawave_v3,808.82,505.11,0.0
gfx942,304,35456,4096,2048,ck,0,0,752.7542,a8w8_blockscale_1x128x128_256x128x128x128_16x16_32x32_2x2_8x32x1_8x32x1_1x32x1x8_8_1x1_intrawave_v3,790.24,493.47,0.0
gfx942,304,35584,4096,2048,ck,0,0,736.4636,a8w8_blockscale_1x128x128_256x128x128x128_16x16_32x32_2x2_8x32x1_8x32x1_1x32x1x8_8_1x1_intrawave_v3,810.63,506.16,0.0
gfx942,304,35712,4096,2048,ck,0,0,755.0718,a8w8_blockscale_1x128x128_256x128x128x128_16x16_32x32_2x2_8x32x1_8x32x1_1x32x1x8_8_1x1_intrawave_v3,793.5,495.42,0.0
gfx942,304,35840,4096,2048,ck,0,0,740.2207,a8w8_blockscale_1x128x128_256x128x128x128_16x16_32x32_2x2_8x32x1_8x32x1_1x32x1x8_8_1x1_intrawave_v3,812.32,507.13,0.0
gfx942,304,35968,4096,2048,ck,0,0,758.9781,a8w8_blockscale_1x128x128_256x128x128x128_16x16_32x32_2x2_8x32x1_8x32x1_1x32x1x8_8_1x1_intrawave_v3,795.07,496.33,0.0
gfx942,304,36096,4096,2048,ck,0,0,743.1329,a8w8_blockscale_1x128x128_256x128x128x128_16x16_32x32_2x2_8x32x1_8x32x1_1x32x1x8_8_1x1_intrawave_v3,814.92,508.67,0.0
gfx942,304,36224,4096,2048,ck,0,0,758.6624,a8w8_blockscale_1x128x128_256x128x128x128_16x16_32x32_2x2_8x32x1_8x32x1_1x32x1x8_8_1x1_intrawave_v3,801.06,499.99,0.0
gfx942,304,36352,4096,2048,ck,0,0,760.0711,a8w8_blockscale_1x128x128_256x128x128x128_16x16_32x32_2x2_8x32x1_8x32x1_1x32x1x8_8_1x1_intrawave_v3,802.41,500.79,0.0
gfx942,304,36480,4096,2048,ck,0,0,768.0009,a8w8_blockscale_1x128x128_256x128x128x128_16x16_32x32_2x2_8x32x1_8x32x1_1x32x1x8_8_1x1_intrawave_v3,796.92,497.32,0.0
gfx942,304,36608,4096,2048,ck,0,0,767.5402,a8w8_blockscale_1x128x128_256x128x128x128_16x16_32x32_2x2_8x32x1_8x32x1_1x32x1x8_8_1x1_intrawave_v3,800.19,499.33,0.0
gfx942,304,36736,4096,2048,ck,0,0,773.3946,a8w8_blockscale_1x128x128_256x128x128x128_16x16_32x32_2x2_8x32x1_8x32x1_1x32x1x8_8_1x1_intrawave_v3,796.91,497.24,0.0
gfx942,304,36864,4096,2048,ck,0,0,764.1196,a8w8_blockscale_1x128x128_256x128x128x128_16x16_32x32_2x2_8x32x1_8x32x1_1x32x1x8_8_1x1_intrawave_v3,809.4,504.99,0.0
gfx942,304,36992,4096,2048,ck,0,0,783.566,a8w8_blockscale_1x128x128_256x128x128x128_16x16_32x32_2x2_8x32x1_8x32x1_1x32x1x8_8_1x1_intrawave_v3,792.05,494.13,0.0
gfx942,304,37120,4096,2048,ck,0,0,764.7408,a8w8_blockscale_1x128x128_256x128x128x128_16x16_32x32_2x2_8x32x1_8x32x1_1x32x1x8_8_1x1_intrawave_v3,814.35,508.01,0.0
gfx942,304,37248,4096,2048,ck,0,0,764.7011,a8w8_blockscale_1x128x128_256x128x128x128_16x16_32x32_2x2_8x32x1_8x32x1_1x32x1x8_8_1x1_intrawave_v3,817.21,509.75,0.0
gfx942,304,37376,4096,2048,ck,0,0,774.4156,a8w8_blockscale_1x128x128_256x128x128x128_16x16_32x32_2x2_8x32x1_8x32x1_1x32x1x8_8_1x1_intrawave_v3,809.73,505.05,0.0
gfx942,304,37504,4096,2048,ck,0,0,768.2138,a8w8_blockscale_1x128x128_256x128x128x128_16x16_32x32_2x2_8x32x1_8x32x1_1x32x1x8_8_1x1_intrawave_v3,819.06,510.83,0.0
gfx942,304,37632,4096,2048,ck,0,0,805.2705,a8w8_blockscale_1x128x128_256x128x128x128_16x16_32x32_2x2_8x32x1_8x32x1_1x32x1x8_8_1x1_intrawave_v3,784.03,488.95,0.0
gfx942,304,37760,4096,2048,ck,0,0,778.2497,a8w8_blockscale_1x128x128_256x128x128x128_16x16_32x32_2x2_8x32x1_8x32x1_1x32x1x8_8_1x1_intrawave_v3,814.02,507.61,0.0
gfx942,304,37888,4096,2048,ck,0,0,785.8572,a8w8_blockscale_1x128x128_256x128x128x128_16x16_32x32_2x2_8x32x1_8x32x1_1x32x1x8_8_1x1_intrawave_v3,808.87,504.37,0.0
gfx942,304,38016,4096,2048,ck,0,0,786.281,a8w8_blockscale_1x128x128_256x128x128x128_16x16_32x32_2x2_8x32x1_8x32x1_1x32x1x8_8_1x1_intrawave_v3,811.16,505.76,0.0
gfx942,304,38144,4096,2048,ck,0,0,808.7178,a8w8_blockscale_1x128x128_256x128x128x128_16x16_32x32_2x2_8x32x1_8x32x1_1x32x1x8_8_1x1_intrawave_v3,791.31,493.35,0.0
gfx942,304,38272,4096,2048,ck,0,0,791.8878,a8w8_blockscale_1x128x128_256x128x128x128_16x16_32x32_2x2_8x32x1_8x32x1_1x32x1x8_8_1x1_intrawave_v3,810.84,505.49,0.0
gfx942,304,38400,4096,2048,ck,0,0,806.5265,a8w8_blockscale_1x128x128_256x128x128x128_16x16_32x32_2x2_8x32x1_8x32x1_1x32x1x8_8_1x1_intrawave_v3,798.79,497.94,0.0
gfx942,304,38528,4096,2048,ck,0,0,807.6573,a8w8_blockscale_1x128x128_256x128x128x128_16x16_32x32_2x2_8x32x1_8x32x1_1x32x1x8_8_1x1_intrawave_v3,800.33,498.87,0.0
gfx942,304,38656,4096,2048,ck,0,0,820.1298,a8w8_blockscale_1x128x128_256x128x128x128_16x16_32x32_2x2_8x32x1_8x32x1_1x32x1x8_8_1x1_intrawave_v3,790.78,492.88,0.0
gfx942,304,38784,4096,2048,ck,0,0,811.4392,a8w8_blockscale_1x128x128_256x128x128x128_16x16_32x32_2x2_8x32x1_8x32x1_1x32x1x8_8_1x1_intrawave_v3,801.89,499.77,0.0
gfx942,304,38912,4096,2048,ck,0,0,800.9258,a8w8_blockscale_1x128x128_256x128x128x128_16x16_32x32_2x2_8x32x1_8x32x1_1x32x1x8_8_1x1_intrawave_v3,815.1,507.97,0.0
gfx942,304,39040,4096,2048,ck,0,0,808.5942,a8w8_blockscale_1x128x128_256x128x128x128_16x16_32x32_2x2_8x32x1_8x32x1_1x32x1x8_8_1x1_intrawave_v3,810.03,504.78,0.0
gfx942,304,39168,4096,2048,ck,0,0,811.8462,a8w8_blockscale_1x128x128_256x128x128x128_16x16_32x32_2x2_8x32x1_8x32x1_1x32x1x8_8_1x1_intrawave_v3,809.43,504.37,0.0
gfx942,304,39296,4096,2048,ck,0,0,832.4989,a8w8_blockscale_1x128x128_256x128x128x128_16x16_32x32_2x2_8x32x1_8x32x1_1x32x1x8_8_1x1_intrawave_v3,791.93,493.43,0.0
gfx942,304,39424,4096,2048,ck,0,0,819.2301,a8w8_blockscale_1x128x128_256x128x128x128_16x16_32x32_2x2_8x32x1_8x32x1_1x32x1x8_8_1x1_intrawave_v3,807.37,503.02,0.0
gfx942,304,39552,4096,2048,ck,0,0,818.2206,a8w8_blockscale_1x128x128_256x128x128x128_16x16_32x32_2x2_8x32x1_8x32x1_1x32x1x8_8_1x1_intrawave_v3,810.99,505.24,0.0
gfx942,304,39680,4096,2048,ck,0,0,826.182,a8w8_blockscale_1x128x128_256x128x128x128_16x16_32x32_2x2_8x32x1_8x32x1_1x32x1x8_8_1x1_intrawave_v3,805.78,501.96,0.0
gfx942,304,39808,4096,2048,ck,0,0,820.2767,a8w8_blockscale_1x128x128_256x128x128x128_16x16_32x32_2x2_8x32x1_8x32x1_1x32x1x8_8_1x1_intrawave_v3,814.2,507.17,0.0
gfx942,304,39936,4096,2048,ck,0,0,818.4684,a8w8_blockscale_1x128x128_256x128x128x128_16x16_32x32_2x2_8x32x1_8x32x1_1x32x1x8_8_1x1_intrawave_v3,818.62,509.9,0.0
gfx942,304,40064,4096,2048,ck,0,0,824.6034,a8w8_blockscale_1x128x128_256x128x128x128_16x16_32x32_2x2_8x32x1_8x32x1_1x32x1x8_8_1x1_intrawave_v3,815.13,507.69,0.0
gfx942,304,40192,4096,2048,ck,0,0,844.0842,a8w8_blockscale_1x128x128_256x128x128x128_16x16_32x32_2x2_8x32x1_8x32x1_1x32x1x8_8_1x1_intrawave_v3,798.87,497.53,0.0
gfx942,304,40320,4096,2048,ck,0,0,828.3017,a8w8_blockscale_1x128x128_256x128x128x128_16x16_32x32_2x2_8x32x1_8x32x1_1x32x1x8_8_1x1_intrawave_v3,816.68,508.59,0.0
gfx942,304,40448,4096,2048,ck,0,0,840.6621,a8w8_blockscale_1x128x128_256x128x128x128_16x16_32x32_2x2_8x32x1_8x32x1_1x32x1x8_8_1x1_intrawave_v3,807.23,502.67,0.0
gfx942,304,40576,4096,2048,ck,0,0,838.6363,a8w8_blockscale_1x128x128_256x128x128x128_16x16_32x32_2x2_8x32x1_8x32x1_1x32x1x8_8_1x1_intrawave_v3,811.74,505.45,0.0
gfx942,304,40704,4096,2048,ck,0,0,862.0145,a8w8_blockscale_1x128x128_256x128x128x128_16x16_32x32_2x2_8x32x1_8x32x1_1x32x1x8_8_1x1_intrawave_v3,792.21,493.26,0.0
gfx942,304,40832,4096,2048,ck,0,0,864.1109,a8w8_blockscale_1x128x128_256x128x128x128_16x16_32x32_2x2_8x32x1_8x32x1_1x32x1x8_8_1x1_intrawave_v3,792.78,493.58,0.0
gfx942,304,40960,4096,2048,ck,0,0,848.9845,a8w8_blockscale_1x128x128_256x128x128x128_16x16_32x32_2x2_8x32x1_8x32x1_1x32x1x8_8_1x1_intrawave_v3,809.43,503.92,0.0
gfx942,304,41088,4096,2048,ck,0,0,868.7072,a8w8_blockscale_1x128x128_256x128x128x128_16x16_32x32_2x2_8x32x1_8x32x1_1x32x1x8_8_1x1_intrawave_v3,793.53,493.99,0.0
gfx942,304,41216,4096,2048,ck,0,0,861.5012,a8w8_blockscale_1x128x128_256x128x128x128_16x16_32x32_2x2_8x32x1_8x32x1_1x32x1x8_8_1x1_intrawave_v3,802.66,499.64,0.0
gfx942,304,41344,4096,2048,ck,0,0,868.3745,a8w8_blockscale_1x128x128_256x128x128x128_16x16_32x32_2x2_8x32x1_8x32x1_1x32x1x8_8_1x1_intrawave_v3,798.78,497.19,0.0
gfx942,304,41472,4096,2048,ck,0,0,870.9654,a8w8_blockscale_1x128x128_256x128x128x128_16x16_32x32_2x2_8x32x1_8x32x1_1x32x1x8_8_1x1_intrawave_v3,798.87,497.22,0.0
gfx942,304,41600,4096,2048,ck,0,0,878.4214,a8w8_blockscale_1x128x128_256x128x128x128_16x16_32x32_2x2_8x32x1_8x32x1_1x32x1x8_8_1x1_intrawave_v3,794.53,494.49,0.0
gfx942,304,41728,4096,2048,ck,0,0,872.5548,a8w8_blockscale_1x128x128_256x128x128x128_16x16_32x32_2x2_8x32x1_8x32x1_1x32x1x8_8_1x1_intrawave_v3,802.33,499.32,0.0
gfx942,304,41856,4096,2048,ck,0,0,859.0915,a8w8_blockscale_1x128x128_256x128x128x128_16x16_32x32_2x2_8x32x1_8x32x1_1x32x1x8_8_1x1_intrawave_v3,817.41,508.67,0.0
gfx942,304,41984,4096,2048,ck,0,0,869.9029,a8w8_blockscale_1x128x128_256x128x128x128_16x16_32x32_2x2_8x32x1_8x32x1_1x32x1x8_8_1x1_intrawave_v3,809.72,503.85,0.0
gfx942,304,42112,4096,2048,ck,0,0,886.9143,a8w8_blockscale_1x128x128_256x128x128x128_16x16_32x32_2x2_8x32x1_8x32x1_1x32x1x8_8_1x1_intrawave_v3,796.61,495.67,0.0
gfx942,304,42240,4096,2048,ck,0,0,884.8404,a8w8_blockscale_1x128x128_256x128x128x128_16x16_32x32_2x2_8x32x1_8x32x1_1x32x1x8_8_1x1_intrawave_v3,800.9,498.31,0.0
gfx942,304,42368,4096,2048,ck,0,0,875.094,a8w8_blockscale_1x128x128_256x128x128x128_16x16_32x32_2x2_8x32x1_8x32x1_1x32x1x8_8_1x1_intrawave_v3,812.28,505.36,0.0
gfx942,304,42496,4096,2048,ck,0,0,869.9027,a8w8_blockscale_1x128x128_256x128x128x128_16x16_32x32_2x2_8x32x1_8x32x1_1x32x1x8_8_1x1_intrawave_v3,819.59,509.88,0.0
gfx942,304,42624,4096,2048,ck,0,0,878.6681,a8w8_blockscale_1x128x128_256x128x128x128_16x16_32x32_2x2_8x32x1_8x32x1_1x32x1x8_8_1x1_intrawave_v3,813.86,506.29,0.0
gfx942,304,42752,4096,2048,ck,0,0,882.1851,a8w8_blockscale_1x128x128_256x128x128x128_16x16_32x32_2x2_8x32x1_8x32x1_1x32x1x8_8_1x1_intrawave_v3,813.05,505.75,0.0
gfx942,304,42880,4096,2048,ck,0,0,915.5078,a8w8_blockscale_1x128x128_256x128x128x128_16x16_32x32_2x2_8x32x1_8x32x1_1x32x1x8_8_1x1_intrawave_v3,785.8,488.78,0.0
gfx942,304,43008,4096,2048,ck,0,0,908.0984,a8w8_blockscale_1x128x128_256x128x128x128_16x16_32x32_2x2_8x32x1_8x32x1_1x32x1x8_8_1x1_intrawave_v3,794.58,494.21,0.0
gfx942,304,43136,4096,2048,ck,0,0,909.817,a8w8_blockscale_1x128x128_256x128x128x128_16x16_32x32_2x2_8x32x1_8x32x1_1x32x1x8_8_1x1_intrawave_v3,795.44,494.72,0.0
gfx942,304,43264,4096,2048,ck,0,0,906.0252,a8w8_blockscale_1x128x128_256x128x128x128_16x16_32x32_2x2_8x32x1_8x32x1_1x32x1x8_8_1x1_intrawave_v3,801.14,498.23,0.0
gfx942,304,43392,4096,2048,ck,0,0,923.5567,a8w8_blockscale_1x128x128_256x128x128x128_16x16_32x32_2x2_8x32x1_8x32x1_1x32x1x8_8_1x1_intrawave_v3,788.25,490.19,0.0
gfx942,304,43520,4096,2048,ck,0,0,913.2359,a8w8_blockscale_1x128x128_256x128x128x128_16x16_32x32_2x2_8x32x1_8x32x1_1x32x1x8_8_1x1_intrawave_v3,799.51,497.17,0.0
gfx942,304,43648,4096,2048,ck,0,0,906.2191,a8w8_blockscale_1x128x128_256x128x128x128_16x16_32x32_2x2_8x32x1_8x32x1_1x32x1x8_8_1x1_intrawave_v3,808.07,502.47,0.0
gfx942,304,43776,4096,2048,ck,0,0,898.8299,a8w8_blockscale_1x128x128_256x128x128x128_16x16_32x32_2x2_8x32x1_8x32x1_1x32x1x8_8_1x1_intrawave_v3,817.11,508.05,0.0
gfx942,304,43904,4096,2048,ck,0,0,903.3455,a8w8_blockscale_1x128x128_256x128x128x128_16x16_32x32_2x2_8x32x1_8x32x1_1x32x1x8_8_1x1_intrawave_v3,815.4,506.97,0.0
gfx942,304,44032,4096,2048,ck,0,0,909.1705,a8w8_blockscale_1x128x128_256x128x128x128_16x16_32x32_2x2_8x32x1_8x32x1_1x32x1x8_8_1x1_intrawave_v3,812.54,505.16,0.0
gfx942,304,44160,4096,2048,ck,0,0,930.5258,a8w8_blockscale_1x128x128_256x128x128x128_16x16_32x32_2x2_8x32x1_8x32x1_1x32x1x8_8_1x1_intrawave_v3,796.2,494.98,0.0
gfx942,304,44288,4096,2048,ck,0,0,905.4671,a8w8_blockscale_1x128x128_256x128x128x128_16x16_32x32_2x2_8x32x1_8x32x1_1x32x1x8_8_1x1_intrawave_v3,820.6,510.12,0.0
gfx942,304,44416,4096,2048,ck,0,0,903.8451,a8w8_blockscale_1x128x128_256x128x128x128_16x16_32x32_2x2_8x32x1_8x32x1_1x32x1x8_8_1x1_intrawave_v3,824.45,512.49,0.0
gfx942,304,44544,4096,2048,ck,0,0,941.5111,a8w8_blockscale_1x128x128_256x128x128x128_16x16_32x32_2x2_8x32x1_8x32x1_1x32x1x8_8_1x1_intrawave_v3,793.75,493.38,0.0
gfx942,304,44672,4096,2048,ck,0,0,930.6275,a8w8_blockscale_1x128x128_256x128x128x128_16x16_32x32_2x2_8x32x1_8x32x1_1x32x1x8_8_1x1_intrawave_v3,805.34,500.55,0.0
gfx942,304,44800,4096,2048,ck,0,0,918.2679,a8w8_blockscale_1x128x128_256x128x128x128_16x16_32x32_2x2_8x32x1_8x32x1_1x32x1x8_8_1x1_intrawave_v3,818.52,508.72,0.0
gfx942,304,44928,4096,2048,ck,0,0,940.8517,a8w8_blockscale_1x128x128_256x128x128x128_16x16_32x32_2x2_8x32x1_8x32x1_1x32x1x8_8_1x1_intrawave_v3,801.15,497.9,0.0
gfx942,304,45056,4096,2048,ck,0,0,927.7906,a8w8_blockscale_1x128x128_256x128x128x128_16x16_32x32_2x2_8x32x1_8x32x1_1x32x1x8_8_1x1_intrawave_v3,814.75,506.32,0.0
gfx942,304,45184,4096,2048,ck,0,0,927.412,a8w8_blockscale_1x128x128_256x128x128x128_16x16_32x32_2x2_8x32x1_8x32x1_1x32x1x8_8_1x1_intrawave_v3,817.39,507.94,0.0
gfx942,304,45312,4096,2048,ck,0,0,943.1321,a8w8_blockscale_1x128x128_256x128x128x128_16x16_32x32_2x2_8x32x1_8x32x1_1x32x1x8_8_1x1_intrawave_v3,806.05,500.87,0.0
gfx942,304,45440,4096,2048,ck,0,0,939.2189,a8w8_blockscale_1x128x128_256x128x128x128_16x16_32x32_2x2_8x32x1_8x32x1_1x32x1x8_8_1x1_intrawave_v3,811.69,504.35,0.0
gfx942,304,45568,4096,2048,ck,0,0,936.642,a8w8_blockscale_1x128x128_256x128x128x128_16x16_32x32_2x2_8x32x1_8x32x1_1x32x1x8_8_1x1_intrawave_v3,816.22,507.14,0.0
gfx942,304,45696,4096,2048,ck,0,0,941.8988,a8w8_blockscale_1x128x128_256x128x128x128_16x16_32x32_2x2_8x32x1_8x32x1_1x32x1x8_8_1x1_intrawave_v3,813.94,505.7,0.0
gfx942,304,45824,4096,2048,ck,0,0,938.8072,a8w8_blockscale_1x128x128_256x128x128x128_16x16_32x32_2x2_8x32x1_8x32x1_1x32x1x8_8_1x1_intrawave_v3,818.91,508.76,0.0
gfx942,304,45952,4096,2048,ck,0,0,942.3867,a8w8_blockscale_1x128x128_256x128x128x128_16x16_32x32_2x2_8x32x1_8x32x1_1x32x1x8_8_1x1_intrawave_v3,818.08,508.22,0.0
gfx942,304,46080,4096,2048,ck,0,0,966.2509,a8w8_blockscale_1x128x128_256x128x128x128_16x16_32x32_2x2_8x32x1_8x32x1_1x32x1x8_8_1x1_intrawave_v3,800.1,497.02,0.0
gfx942,304,46208,4096,2048,ck,0,0,950.3289,a8w8_blockscale_1x128x128_256x128x128x128_16x16_32x32_2x2_8x32x1_8x32x1_1x32x1x8_8_1x1_intrawave_v3,815.76,506.73,0.0
gfx942,304,46336,4096,2048,ck,0,0,962.531,a8w8_blockscale_1x128x128_256x128x128x128_16x16_32x32_2x2_8x32x1_8x32x1_1x32x1x8_8_1x1_intrawave_v3,807.65,501.67,0.0
gfx942,304,46464,4096,2048,ck,0,0,981.76,a8w8_blockscale_1x128x128_256x128x128x128_16x16_32x32_2x2_8x32x1_8x32x1_1x32x1x8_8_1x1_intrawave_v3,794.02,493.18,0.0
gfx942,304,46592,4096,2048,ck,0,0,954.6176,a8w8_blockscale_1x128x128_256x128x128x128_16x16_32x32_2x2_8x32x1_8x32x1_1x32x1x8_8_1x1_intrawave_v3,818.85,508.57,0.0
gfx942,304,46720,4096,2048,ck,0,0,974.4166,a8w8_blockscale_1x128x128_256x128x128x128_16x16_32x32_2x2_8x32x1_8x32x1_1x32x1x8_8_1x1_intrawave_v3,804.41,499.58,0.0
gfx942,304,46848,4096,2048,ck,0,0,974.5429,a8w8_blockscale_1x128x128_256x128x128x128_16x16_32x32_2x2_8x32x1_8x32x1_1x32x1x8_8_1x1_intrawave_v3,806.51,500.86,0.0
gfx942,304,46976,4096,2048,ck,0,0,968.7313,a8w8_blockscale_1x128x128_256x128x128x128_16x16_32x32_2x2_8x32x1_8x32x1_1x32x1x8_8_1x1_intrawave_v3,813.57,505.22,0.0
gfx942,304,47104,4096,2048,ck,0,0,960.8094,a8w8_blockscale_1x128x128_256x128x128x128_16x16_32x32_2x2_8x32x1_8x32x1_1x32x1x8_8_1x1_intrawave_v3,822.51,510.75,0.0
gfx942,304,47232,4096,2048,ck,0,0,962.2304,a8w8_blockscale_1x128x128_256x128x128x128_16x16_32x32_2x2_8x32x1_8x32x1_1x32x1x8_8_1x1_intrawave_v3,823.53,511.36,0.0
gfx942,304,47360,4096,2048,ck,0,0,997.2874,a8w8_blockscale_1x128x128_256x128x128x128_16x16_32x32_2x2_8x32x1_8x32x1_1x32x1x8_8_1x1_intrawave_v3,796.73,494.7,0.0
gfx942,304,47488,4096,2048,ck,0,0,987.617,a8w8_blockscale_1x128x128_256x128x128x128_16x16_32x32_2x2_8x32x1_8x32x1_1x32x1x8_8_1x1_intrawave_v3,806.71,500.87,0.0
gfx942,304,47616,4096,2048,ck,0,0,1001.6622,a8w8_blockscale_1x128x128_256x128x128x128_16x16_32x32_2x2_8x32x1_8x32x1_1x32x1x8_8_1x1_intrawave_v3,797.54,495.15,0.0
gfx942,304,47744,4096,2048,ck,0,0,976.6846,a8w8_blockscale_1x128x128_256x128x128x128_16x16_32x32_2x2_8x32x1_8x32x1_1x32x1x8_8_1x1_intrawave_v3,820.13,509.16,0.0
gfx942,304,47872,4096,2048,ck,0,0,1008.0975,a8w8_blockscale_1x128x128_256x128x128x128_16x16_32x32_2x2_8x32x1_8x32x1_1x32x1x8_8_1x1_intrawave_v3,796.71,494.59,0.0
gfx942,304,48000,4096,2048,ck,0,0,977.812,a8w8_blockscale_1x128x128_256x128x128x128_16x16_32x32_2x2_8x32x1_8x32x1_1x32x1x8_8_1x1_intrawave_v3,823.58,511.25,0.0
gfx942,304,48128,4096,2048,ck,0,0,1002.227,a8w8_blockscale_1x128x128_256x128x128x128_16x16_32x32_2x2_8x32x1_8x32x1_1x32x1x8_8_1x1_intrawave_v3,805.66,500.11,0.0
gfx942,304,48256,4096,2048,ck,0,0,985.4546,a8w8_blockscale_1x128x128_256x128x128x128_16x16_32x32_2x2_8x32x1_8x32x1_1x32x1x8_8_1x1_intrawave_v3,821.55,509.95,0.0
gfx942,304,48384,4096,2048,ck,0,0,988.5579,a8w8_blockscale_1x128x128_256x128x128x128_16x16_32x32_2x2_8x32x1_8x32x1_1x32x1x8_8_1x1_intrawave_v3,821.14,509.67,0.0
gfx942,304,48512,4096,2048,ck,0,0,1008.4836,a8w8_blockscale_1x128x128_256x128x128x128_16x16_32x32_2x2_8x32x1_8x32x1_1x32x1x8_8_1x1_intrawave_v3,807.05,500.9,0.0
gfx942,304,48640,4096,2048,ck,0,0,1023.4536,a8w8_blockscale_1x128x128_256x128x128x128_16x16_32x32_2x2_8x32x1_8x32x1_1x32x1x8_8_1x1_intrawave_v3,797.34,494.86,0.0
gfx942,304,48768,4096,2048,ck,0,0,1020.8777,a8w8_blockscale_1x128x128_256x128x128x128_16x16_32x32_2x2_8x32x1_8x32x1_1x32x1x8_8_1x1_intrawave_v3,801.46,497.39,0.0
gfx942,304,48896,4096,2048,ck,0,0,999.8655,a8w8_blockscale_1x128x128_256x128x128x128_16x16_32x32_2x2_8x32x1_8x32x1_1x32x1x8_8_1x1_intrawave_v3,820.45,509.15,0.0
gfx942,304,49024,4096,2048,ck,0,0,1020.4308,a8w8_blockscale_1x128x128_256x128x128x128_16x16_32x32_2x2_8x32x1_8x32x1_1x32x1x8_8_1x1_intrawave_v3,806.02,500.18,0.0
gfx942,304,49152,4096,2048,ck,0,0,999.8188,a8w8_blockscale_1x128x128_256x128x128x128_16x16_32x32_2x2_8x32x1_8x32x1_1x32x1x8_8_1x1_intrawave_v3,824.78,511.8,0.0
gfx942,304,49280,4096,2048,ck,0,0,1028.6969,a8w8_blockscale_1x128x128_256x128x128x128_16x16_32x32_2x2_8x32x1_8x32x1_1x32x1x8_8_1x1_intrawave_v3,803.72,498.7,0.0
gfx942,304,49408,4096,2048,ck,0,0,1009.5923,a8w8_blockscale_1x128x128_256x128x128x128_16x16_32x32_2x2_8x32x1_8x32x1_1x32x1x8_8_1x1_intrawave_v3,821.05,509.44,0.0
gfx942,304,49536,4096,2048,ck,0,0,1035.6097,a8w8_blockscale_1x128x128_256x128x128x128_16x16_32x32_2x2_8x32x1_8x32x1_1x32x1x8_8_1x1_intrawave_v3,802.5,497.91,0.0
gfx942,304,49664,4096,2048,ck,0,0,1030.4664,a8w8_blockscale_1x128x128_256x128x128x128_16x16_32x32_2x2_8x32x1_8x32x1_1x32x1x8_8_1x1_intrawave_v3,808.59,501.66,0.0
gfx942,304,49792,4096,2048,ck,0,0,1033.7686,a8w8_blockscale_1x128x128_256x128x128x128_16x16_32x32_2x2_8x32x1_8x32x1_1x32x1x8_8_1x1_intrawave_v3,808.08,501.33,0.0
gfx942,304,49920,4096,2048,ck,0,0,1028.1831,a8w8_blockscale_1x128x128_256x128x128x128_16x16_32x32_2x2_8x32x1_8x32x1_1x32x1x8_8_1x1_intrawave_v3,814.56,505.33,0.0
gfx942,304,50048,4096,2048,ck,0,0,1050.9982,a8w8_blockscale_1x128x128_256x128x128x128_16x16_32x32_2x2_8x32x1_8x32x1_1x32x1x8_8_1x1_intrawave_v3,798.92,495.61,0.0
gfx942,304,50176,4096,2048,ck,0,0,1044.0953,a8w8_blockscale_1x128x128_256x128x128x128_16x16_32x32_2x2_8x32x1_8x32x1_1x32x1x8_8_1x1_intrawave_v3,806.26,500.14,0.0
gfx942,304,50304,4096,2048,ck,0,0,1052.155,a8w8_blockscale_1x128x128_256x128x128x128_16x16_32x32_2x2_8x32x1_8x32x1_1x32x1x8_8_1x1_intrawave_v3,802.13,497.55,0.0
gfx942,304,50432,4096,2048,ck,0,0,1032.2046,a8w8_blockscale_1x128x128_256x128x128x128_16x16_32x32_2x2_8x32x1_8x32x1_1x32x1x8_8_1x1_intrawave_v3,819.71,508.44,0.0
gfx942,304,50560,4096,2048,ck,0,0,1035.0159,a8w8_blockscale_1x128x128_256x128x128x128_16x16_32x32_2x2_8x32x1_8x32x1_1x32x1x8_8_1x1_intrawave_v3,819.56,508.32,0.0
gfx942,304,50688,4096,2048,ck,0,0,1056.295,a8w8_blockscale_1x128x128_256x128x128x128_16x16_32x32_2x2_8x32x1_8x32x1_1x32x1x8_8_1x1_intrawave_v3,805.08,499.32,0.0
gfx942,304,50816,4096,2048,ck,0,0,1052.4944,a8w8_blockscale_1x128x128_256x128x128x128_16x16_32x32_2x2_8x32x1_8x32x1_1x32x1x8_8_1x1_intrawave_v3,810.03,502.37,0.0
gfx942,304,50944,4096,2048,ck,0,0,1040.9433,a8w8_blockscale_1x128x128_256x128x128x128_16x16_32x32_2x2_8x32x1_8x32x1_1x32x1x8_8_1x1_intrawave_v3,821.08,509.21,0.0
gfx942,304,51072,4096,2048,ck,0,0,1070.1463,a8w8_blockscale_1x128x128_256x128x128x128_16x16_32x32_2x2_8x32x1_8x32x1_1x32x1x8_8_1x1_intrawave_v3,800.68,496.54,0.0
gfx942,304,51200,4096,2048,ck,0,0,1063.8246,a8w8_blockscale_1x128x128_256x128x128x128_16x16_32x32_2x2_8x32x1_8x32x1_1x32x1x8_8_1x1_intrawave_v3,807.46,500.72,0.0
gfx942,304,51328,4096,2048,ck,0,0,1070.3394,a8w8_blockscale_1x128x128_256x128x128x128_16x16_32x32_2x2_8x32x1_8x32x1_1x32x1x8_8_1x1_intrawave_v3,804.55,498.9,0.0
gfx942,304,51456,4096,2048,ck,0,0,1055.5321,a8w8_blockscale_1x128x128_256x128x128x128_16x16_32x32_2x2_8x32x1_8x32x1_1x32x1x8_8_1x1_intrawave_v3,817.87,507.14,0.0
gfx942,304,51584,4096,2048,ck,0,0,1065.9854,a8w8_blockscale_1x128x128_256x128x128x128_16x16_32x32_2x2_8x32x1_8x32x1_1x32x1x8_8_1x1_intrawave_v3,811.86,503.39,0.0
gfx942,304,51712,4096,2048,ck,0,0,1069.2849,a8w8_blockscale_1x128x128_256x128x128x128_16x16_32x32_2x2_8x32x1_8x32x1_1x32x1x8_8_1x1_intrawave_v3,811.37,503.06,0.0
gfx942,304,51840,4096,2048,ck,0,0,1055.5351,a8w8_blockscale_1x128x128_256x128x128x128_16x16_32x32_2x2_8x32x1_8x32x1_1x32x1x8_8_1x1_intrawave_v3,823.97,510.86,0.0
gfx942,304,51968,4096,2048,ck,0,0,1077.093,a8w8_blockscale_1x128x128_256x128x128x128_16x16_32x32_2x2_8x32x1_8x32x1_1x32x1x8_8_1x1_intrawave_v3,809.47,501.85,0.0
gfx942,304,52096,4096,2048,ck,0,0,1066.6627,a8w8_blockscale_1x128x128_256x128x128x128_16x16_32x32_2x2_8x32x1_8x32x1_1x32x1x8_8_1x1_intrawave_v3,819.4,507.99,0.0
gfx942,304,52224,4096,2048,ck,0,0,1076.0817,a8w8_blockscale_1x128x128_256x128x128x128_16x16_32x32_2x2_8x32x1_8x32x1_1x32x1x8_8_1x1_intrawave_v3,814.23,504.76,0.0
gfx942,304,52352,4096,2048,ck,0,0,1070.8122,a8w8_blockscale_1x128x128_256x128x128x128_16x16_32x32_2x2_8x32x1_8x32x1_1x32x1x8_8_1x1_intrawave_v3,820.24,508.47,0.0
gfx942,304,52480,4096,2048,ck,0,0,1073.3805,a8w8_blockscale_1x128x128_256x128x128x128_16x16_32x32_2x2_8x32x1_8x32x1_1x32x1x8_8_1x1_intrawave_v3,820.28,508.47,0.0
gfx942,304,52608,4096,2048,ck,0,0,1070.6591,a8w8_blockscale_1x128x128_256x128x128x128_16x16_32x32_2x2_8x32x1_8x32x1_1x32x1x8_8_1x1_intrawave_v3,824.37,510.99,0.0
gfx942,304,52736,4096,2048,ck,0,0,1078.1563,a8w8_blockscale_1x128x128_256x128x128x128_16x16_32x32_2x2_8x32x1_8x32x1_1x32x1x8_8_1x1_intrawave_v3,820.63,508.65,0.0
gfx942,304,52864,4096,2048,ck,0,0,1085.5686,a8w8_blockscale_1x128x128_256x128x128x128_16x16_32x32_2x2_8x32x1_8x32x1_1x32x1x8_8_1x1_intrawave_v3,817.0,506.39,0.0
gfx942,304,52992,4096,2048,ck,0,0,1081.3249,a8w8_blockscale_1x128x128_256x128x128x128_16x16_32x32_2x2_8x32x1_8x32x1_1x32x1x8_8_1x1_intrawave_v3,822.19,509.58,0.0
gfx942,304,53120,4096,2048,ck,0,0,1103.6918,a8w8_blockscale_1x128x128_256x128x128x128_16x16_32x32_2x2_8x32x1_8x32x1_1x32x1x8_8_1x1_intrawave_v3,807.48,500.45,0.0
gfx942,304,53248,4096,2048,ck,0,0,1088.9939,a8w8_blockscale_1x128x128_256x128x128x128_16x16_32x32_2x2_8x32x1_8x32x1_1x32x1x8_8_1x1_intrawave_v3,820.35,508.4,0.0
gfx942,304,53376,4096,2048,ck,0,0,1117.8094,a8w8_blockscale_1x128x128_256x128x128x128_16x16_32x32_2x2_8x32x1_8x32x1_1x32x1x8_8_1x1_intrawave_v3,801.12,496.47,0.0
gfx942,304,53504,4096,2048,ck,0,0,1094.8094,a8w8_blockscale_1x128x128_256x128x128x128_16x16_32x32_2x2_8x32x1_8x32x1_1x32x1x8_8_1x1_intrawave_v3,819.91,508.1,0.0
gfx942,304,53632,4096,2048,ck,0,0,1129.2931,a8w8_blockscale_1x128x128_256x128x128x128_16x16_32x32_2x2_8x32x1_8x32x1_1x32x1x8_8_1x1_intrawave_v3,796.78,493.74,0.0
gfx942,304,53760,4096,2048,ck,0,0,1124.131,a8w8_blockscale_1x128x128_256x128x128x128_16x16_32x32_2x2_8x32x1_8x32x1_1x32x1x8_8_1x1_intrawave_v3,802.35,497.18,0.0
gfx942,304,53888,4096,2048,ck,0,0,1111.3942,a8w8_blockscale_1x128x128_256x128x128x128_16x16_32x32_2x2_8x32x1_8x32x1_1x32x1x8_8_1x1_intrawave_v3,813.47,504.05,0.0
gfx942,304,54016,4096,2048,ck,0,0,1103.5838,a8w8_blockscale_1x128x128_256x128x128x128_16x16_32x32_2x2_8x32x1_8x32x1_1x32x1x8_8_1x1_intrawave_v3,821.18,508.81,0.0
gfx942,304,54144,4096,2048,ck,0,0,1107.1806,a8w8_blockscale_1x128x128_256x128x128x128_16x16_32x32_2x2_8x32x1_8x32x1_1x32x1x8_8_1x1_intrawave_v3,820.45,508.34,0.0
gfx942,304,54272,4096,2048,ck,0,0,1142.5455,a8w8_blockscale_1x128x128_256x128x128x128_16x16_32x32_2x2_8x32x1_8x32x1_1x32x1x8_8_1x1_intrawave_v3,796.93,493.75,0.0
gfx942,304,54400,4096,2048,ck,0,0,1142.0618,a8w8_blockscale_1x128x128_256x128x128x128_16x16_32x32_2x2_8x32x1_8x32x1_1x32x1x8_8_1x1_intrawave_v3,799.15,495.11,0.0
gfx942,304,54528,4096,2048,ck,0,0,1131.9743,a8w8_blockscale_1x128x128_256x128x128x128_16x16_32x32_2x2_8x32x1_8x32x1_1x32x1x8_8_1x1_intrawave_v3,808.17,500.68,0.0
gfx942,304,54656,4096,2048,ck,0,0,1142.5638,a8w8_blockscale_1x128x128_256x128x128x128_16x16_32x32_2x2_8x32x1_8x32x1_1x32x1x8_8_1x1_intrawave_v3,802.56,497.19,0.0
gfx942,304,54784,4096,2048,ck,0,0,1142.9221,a8w8_blockscale_1x128x128_256x128x128x128_16x16_32x32_2x2_8x32x1_8x32x1_1x32x1x8_8_1x1_intrawave_v3,804.19,498.18,0.0
gfx942,304,54912,4096,2048,ck,0,0,1136.6162,a8w8_blockscale_1x128x128_256x128x128x128_16x16_32x32_2x2_8x32x1_8x32x1_1x32x1x8_8_1x1_intrawave_v3,810.54,502.09,0.0
gfx942,304,55040,4096,2048,ck,0,0,1123.8789,a8w8_blockscale_1x128x128_256x128x128x128_16x16_32x32_2x2_8x32x1_8x32x1_1x32x1x8_8_1x1_intrawave_v3,821.63,508.95,0.0
gfx942,304,55168,4096,2048,ck,0,0,1125.6623,a8w8_blockscale_1x128x128_256x128x128x128_16x16_32x32_2x2_8x32x1_8x32x1_1x32x1x8_8_1x1_intrawave_v3,822.24,509.31,0.0
gfx942,304,55296,4096,2048,ck,0,0,1132.7304,a8w8_blockscale_1x128x128_256x128x128x128_16x16_32x32_2x2_8x32x1_8x32x1_1x32x1x8_8_1x1_intrawave_v3,819.01,507.29,0.0
gfx942,304,55424,4096,2048,ck,0,0,1160.6887,a8w8_blockscale_1x128x128_256x128x128x128_16x16_32x32_2x2_8x32x1_8x32x1_1x32x1x8_8_1x1_intrawave_v3,801.13,496.2,0.0
gfx942,304,55552,4096,2048,ck,0,0,1143.9074,a8w8_blockscale_1x128x128_256x128x128x128_16x16_32x32_2x2_8x32x1_8x32x1_1x32x1x8_8_1x1_intrawave_v3,814.76,504.62,0.0
gfx942,304,55680,4096,2048,ck,0,0,1154.4773,a8w8_blockscale_1x128x128_256x128x128x128_16x16_32x32_2x2_8x32x1_8x32x1_1x32x1x8_8_1x1_intrawave_v3,809.16,501.14,0.0
gfx942,304,55808,4096,2048,ck,0,0,1137.8297,a8w8_blockscale_1x128x128_256x128x128x128_16x16_32x32_2x2_8x32x1_8x32x1_1x32x1x8_8_1x1_intrawave_v3,822.88,509.62,0.0
gfx942,304,55936,4096,2048,ck,0,0,1170.8315,a8w8_blockscale_1x128x128_256x128x128x128_16x16_32x32_2x2_8x32x1_8x32x1_1x32x1x8_8_1x1_intrawave_v3,801.52,496.38,0.0
gfx942,304,56064,4096,2048,ck,0,0,1180.0409,a8w8_blockscale_1x128x128_256x128x128x128_16x16_32x32_2x2_8x32x1_8x32x1_1x32x1x8_8_1x1_intrawave_v3,797.09,493.61,0.0
gfx942,304,56192,4096,2048,ck,0,0,1155.8208,a8w8_blockscale_1x128x128_256x128x128x128_16x16_32x32_2x2_8x32x1_8x32x1_1x32x1x8_8_1x1_intrawave_v3,815.65,505.09,0.0
gfx942,304,56320,4096,2048,ck,0,0,1148.3895,a8w8_blockscale_1x128x128_256x128x128x128_16x16_32x32_2x2_8x32x1_8x32x1_1x32x1x8_8_1x1_intrawave_v3,822.8,509.5,0.0
gfx942,304,56448,4096,2048,ck,0,0,1160.0205,a8w8_blockscale_1x128x128_256x128x128x128_16x16_32x32_2x2_8x32x1_8x32x1_1x32x1x8_8_1x1_intrawave_v3,816.4,505.52,0.0
gfx942,304,56576,4096,2048,ck,0,0,1149.3654,a8w8_blockscale_1x128x128_256x128x128x128_16x16_32x32_2x2_8x32x1_8x32x1_1x32x1x8_8_1x1_intrawave_v3,825.84,511.35,0.0
gfx942,304,56704,4096,2048,ck,0,0,1155.6916,a8w8_blockscale_1x128x128_256x128x128x128_16x16_32x32_2x2_8x32x1_8x32x1_1x32x1x8_8_1x1_intrawave_v3,823.17,509.68,0.0
gfx942,304,56832,4096,2048,ck,0,0,1182.1693,a8w8_blockscale_1x128x128_256x128x128x128_16x16_32x32_2x2_8x32x1_8x32x1_1x32x1x8_8_1x1_intrawave_v3,806.55,499.38,0.0
gfx942,304,56960,4096,2048,ck,0,0,1196.0256,a8w8_blockscale_1x128x128_256x128x128x128_16x16_32x32_2x2_8x32x1_8x32x1_1x32x1x8_8_1x1_intrawave_v3,799.0,494.69,0.0
gfx942,304,57088,4096,2048,ck,0,0,1179.4784,a8w8_blockscale_1x128x128_256x128x128x128_16x16_32x32_2x2_8x32x1_8x32x1_1x32x1x8_8_1x1_intrawave_v3,812.03,502.74,0.0
gfx942,304,57216,4096,2048,ck,0,0,1199.139,a8w8_blockscale_1x128x128_256x128x128x128_16x16_32x32_2x2_8x32x1_8x32x1_1x32x1x8_8_1x1_intrawave_v3,800.51,495.59,0.0
gfx942,304,57344,4096,2048,ck,0,0,1176.912,a8w8_blockscale_1x128x128_256x128x128x128_16x16_32x32_2x2_8x32x1_8x32x1_1x32x1x8_8_1x1_intrawave_v3,817.46,506.06,0.0
gfx942,304,57472,4096,2048,ck,0,0,1173.7863,a8w8_blockscale_1x128x128_256x128x128x128_16x16_32x32_2x2_8x32x1_8x32x1_1x32x1x8_8_1x1_intrawave_v3,821.46,508.53,0.0
gfx942,304,57600,4096,2048,ck,0,0,1177.8957,a8w8_blockscale_1x128x128_256x128x128x128_16x16_32x32_2x2_8x32x1_8x32x1_1x32x1x8_8_1x1_intrawave_v3,820.42,507.87,0.0
gfx942,304,57728,4096,2048,ck,0,0,1177.3085,a8w8_blockscale_1x128x128_256x128x128x128_16x16_32x32_2x2_8x32x1_8x32x1_1x32x1x8_8_1x1_intrawave_v3,822.65,509.23,0.0
gfx942,304,57856,4096,2048,ck,0,0,1182.182,a8w8_blockscale_1x128x128_256x128x128x128_16x16_32x32_2x2_8x32x1_8x32x1_1x32x1x8_8_1x1_intrawave_v3,821.08,508.24,0.0
gfx942,304,57984,4096,2048,ck,0,0,1190.6192,a8w8_blockscale_1x128x128_256x128x128x128_16x16_32x32_2x2_8x32x1_8x32x1_1x32x1x8_8_1x1_intrawave_v3,817.06,505.74,0.0
gfx942,304,58112,4096,2048,ck,0,0,1212.0479,a8w8_blockscale_1x128x128_256x128x128x128_16x16_32x32_2x2_8x32x1_8x32x1_1x32x1x8_8_1x1_intrawave_v3,804.39,497.88,0.0
gfx942,304,58240,4096,2048,ck,0,0,1194.1667,a8w8_blockscale_1x128x128_256x128x128x128_16x16_32x32_2x2_8x32x1_8x32x1_1x32x1x8_8_1x1_intrawave_v3,818.23,506.43,0.0
gfx942,304,58368,4096,2048,ck,0,0,1230.0923,a8w8_blockscale_1x128x128_256x128x128x128_16x16_32x32_2x2_8x32x1_8x32x1_1x32x1x8_8_1x1_intrawave_v3,796.08,492.71,0.0
gfx942,304,58496,4096,2048,ck,0,0,1199.1974,a8w8_blockscale_1x128x128_256x128x128x128_16x16_32x32_2x2_8x32x1_8x32x1_1x32x1x8_8_1x1_intrawave_v3,818.38,506.5,0.0
gfx942,304,58624,4096,2048,ck,0,0,1231.2219,a8w8_blockscale_1x128x128_256x128x128x128_16x16_32x32_2x2_8x32x1_8x32x1_1x32x1x8_8_1x1_intrawave_v3,798.84,494.39,0.0
gfx942,304,58752,4096,2048,ck,0,0,1223.155,a8w8_blockscale_1x128x128_256x128x128x128_16x16_32x32_2x2_8x32x1_8x32x1_1x32x1x8_8_1x1_intrawave_v3,805.86,498.72,0.0
gfx942,304,58880,4096,2048,ck,0,0,1201.1955,a8w8_blockscale_1x128x128_256x128x128x128_16x16_32x32_2x2_8x32x1_8x32x1_1x32x1x8_8_1x1_intrawave_v3,822.38,508.93,0.0
gfx942,304,59008,4096,2048,ck,0,0,1208.4327,a8w8_blockscale_1x128x128_256x128x128x128_16x16_32x32_2x2_8x32x1_8x32x1_1x32x1x8_8_1x1_intrawave_v3,819.23,506.96,0.0
gfx942,304,59136,4096,2048,ck,0,0,1202.1814,a8w8_blockscale_1x128x128_256x128x128x128_16x16_32x32_2x2_8x32x1_8x32x1_1x32x1x8_8_1x1_intrawave_v3,825.28,510.69,0.0
gfx942,304,59264,4096,2048,ck,0,0,1240.0726,a8w8_blockscale_1x128x128_256x128x128x128_16x16_32x32_2x2_8x32x1_8x32x1_1x32x1x8_8_1x1_intrawave_v3,801.8,496.14,0.0
gfx942,304,59392,4096,2048,ck,0,0,1201.3961,a8w8_blockscale_1x128x128_256x128x128x128_16x16_32x32_2x2_8x32x1_8x32x1_1x32x1x8_8_1x1_intrawave_v3,829.4,513.21,0.0
gfx942,304,59520,4096,2048,ck,0,0,1207.3309,a8w8_blockscale_1x128x128_256x128x128x128_16x16_32x32_2x2_8x32x1_8x32x1_1x32x1x8_8_1x1_intrawave_v3,827.1,511.77,0.0
gfx942,304,59648,4096,2048,ck,0,0,1238.8895,a8w8_blockscale_1x128x128_256x128x128x128_16x16_32x32_2x2_8x32x1_8x32x1_1x32x1x8_8_1x1_intrawave_v3,807.76,499.79,0.0
gfx942,304,59776,4096,2048,ck,0,0,1226.7625,a8w8_blockscale_1x128x128_256x128x128x128_16x16_32x32_2x2_8x32x1_8x32x1_1x32x1x8_8_1x1_intrawave_v3,817.5,505.8,0.0
gfx942,304,59904,4096,2048,ck,0,0,1239.1864,a8w8_blockscale_1x128x128_256x128x128x128_16x16_32x32_2x2_8x32x1_8x32x1_1x32x1x8_8_1x1_intrawave_v3,811.03,501.79,0.0
gfx942,304,60032,4096,2048,ck,0,0,1243.2892,a8w8_blockscale_1x128x128_256x128x128x128_16x16_32x32_2x2_8x32x1_8x32x1_1x32x1x8_8_1x1_intrawave_v3,810.08,501.18,0.0
gfx942,304,60160,4096,2048,ck,0,0,1222.0139,a8w8_blockscale_1x128x128_256x128x128x128_16x16_32x32_2x2_8x32x1_8x32x1_1x32x1x8_8_1x1_intrawave_v3,825.95,510.98,0.0
gfx942,304,60288,4096,2048,ck,0,0,1243.0858,a8w8_blockscale_1x128x128_256x128x128x128_16x16_32x32_2x2_8x32x1_8x32x1_1x32x1x8_8_1x1_intrawave_v3,813.67,503.37,0.0
gfx942,304,60416,4096,2048,ck,0,0,1225.9929,a8w8_blockscale_1x128x128_256x128x128x128_16x16_32x32_2x2_8x32x1_8x32x1_1x32x1x8_8_1x1_intrawave_v3,826.77,511.46,0.0
gfx942,304,60544,4096,2048,ck,0,0,1228.0028,a8w8_blockscale_1x128x128_256x128x128x128_16x16_32x32_2x2_8x32x1_8x32x1_1x32x1x8_8_1x1_intrawave_v3,827.16,511.69,0.0
gfx942,304,60672,4096,2048,ck,0,0,1250.9681,a8w8_blockscale_1x128x128_256x128x128x128_16x16_32x32_2x2_8x32x1_8x32x1_1x32x1x8_8_1x1_intrawave_v3,813.7,503.35,0.0
gfx942,304,60800,4096,2048,ck,0,0,1237.2619,a8w8_blockscale_1x128x128_256x128x128x128_16x16_32x32_2x2_8x32x1_8x32x1_1x32x1x8_8_1x1_intrawave_v3,824.45,509.98,0.0
gfx942,304,60928,4096,2048,ck,0,0,1245.3819,a8w8_blockscale_1x128x128_256x128x128x128_16x16_32x32_2x2_8x32x1_8x32x1_1x32x1x8_8_1x1_intrawave_v3,820.79,507.71,0.0
gfx942,304,61056,4096,2048,ck,0,0,1268.1329,a8w8_blockscale_1x128x128_256x128x128x128_16x16_32x32_2x2_8x32x1_8x32x1_1x32x1x8_8_1x1_intrawave_v3,807.76,499.63,0.0
gfx942,304,61184,4096,2048,ck,0,0,1253.0735,a8w8_blockscale_1x128x128_256x128x128x128_16x16_32x32_2x2_8x32x1_8x32x1_1x32x1x8_8_1x1_intrawave_v3,819.18,506.68,0.0
gfx942,304,61312,4096,2048,ck,0,0,1269.7414,a8w8_blockscale_1x128x128_256x128x128x128_16x16_32x32_2x2_8x32x1_8x32x1_1x32x1x8_8_1x1_intrawave_v3,810.12,501.07,0.0
gfx942,304,61440,4096,2048,ck,0,0,1282.0857,a8w8_blockscale_1x128x128_256x128x128x128_16x16_32x32_2x2_8x32x1_8x32x1_1x32x1x8_8_1x1_intrawave_v3,804.0,497.26,0.0
gfx942,304,61568,4096,2048,ck,0,0,1277.1256,a8w8_blockscale_1x128x128_256x128x128x128_16x16_32x32_2x2_8x32x1_8x32x1_1x32x1x8_8_1x1_intrawave_v3,808.8,500.22,0.0
gfx942,304,61696,4096,2048,ck,0,0,1268.9257,a8w8_blockscale_1x128x128_256x128x128x128_16x16_32x32_2x2_8x32x1_8x32x1_1x32x1x8_8_1x1_intrawave_v3,815.72,504.49,0.0
gfx942,304,61824,4096,2048,ck,0,0,1289.0626,a8w8_blockscale_1x128x128_256x128x128x128_16x16_32x32_2x2_8x32x1_8x32x1_1x32x1x8_8_1x1_intrawave_v3,804.64,497.62,0.0
gfx942,304,61952,4096,2048,ck,0,0,1288.0421,a8w8_blockscale_1x128x128_256x128x128x128_16x16_32x32_2x2_8x32x1_8x32x1_1x32x1x8_8_1x1_intrawave_v3,806.95,499.03,0.0
gfx942,304,62080,4096,2048,ck,0,0,1263.6474,a8w8_blockscale_1x128x128_256x128x128x128_16x16_32x32_2x2_8x32x1_8x32x1_1x32x1x8_8_1x1_intrawave_v3,824.22,509.71,0.0
gfx942,304,62208,4096,2048,ck,0,0,1263.3101,a8w8_blockscale_1x128x128_256x128x128x128_16x16_32x32_2x2_8x32x1_8x32x1_1x32x1x8_8_1x1_intrawave_v3,826.14,510.88,0.0
gfx942,304,62336,4096,2048,ck,0,0,1305.8799,a8w8_blockscale_1x128x128_256x128x128x128_16x16_32x32_2x2_8x32x1_8x32x1_1x32x1x8_8_1x1_intrawave_v3,800.86,495.23,0.0
gfx942,304,62464,4096,2048,ck,0,0,1287.9586,a8w8_blockscale_1x128x128_256x128x128x128_16x16_32x32_2x2_8x32x1_8x32x1_1x32x1x8_8_1x1_intrawave_v3,813.67,503.14,0.0
gfx942,304,62592,4096,2048,ck,0,0,1282.4769,a8w8_blockscale_1x128x128_256x128x128x128_16x16_32x32_2x2_8x32x1_8x32x1_1x32x1x8_8_1x1_intrawave_v3,818.82,506.31,0.0
gfx942,304,62720,4096,2048,ck,0,0,1272.8399,a8w8_blockscale_1x128x128_256x128x128x128_16x16_32x32_2x2_8x32x1_8x32x1_1x32x1x8_8_1x1_intrawave_v3,826.71,511.17,0.0
gfx942,304,62848,4096,2048,ck,0,0,1282.6601,a8w8_blockscale_1x128x128_256x128x128x128_16x16_32x32_2x2_8x32x1_8x32x1_1x32x1x8_8_1x1_intrawave_v3,822.05,508.28,0.0
gfx942,304,62976,4096,2048,ck,0,0,1316.2269,a8w8_blockscale_1x128x128_256x128x128x128_16x16_32x32_2x2_8x32x1_8x32x1_1x32x1x8_8_1x1_intrawave_v3,802.72,496.31,0.0
gfx942,304,63104,4096,2048,ck,0,0,1308.2917,a8w8_blockscale_1x128x128_256x128x128x128_16x16_32x32_2x2_8x32x1_8x32x1_1x32x1x8_8_1x1_intrawave_v3,809.23,500.33,0.0
gfx942,304,63232,4096,2048,ck,0,0,1288.7986,a8w8_blockscale_1x128x128_256x128x128x128_16x16_32x32_2x2_8x32x1_8x32x1_1x32x1x8_8_1x1_intrawave_v3,823.14,508.91,0.0
gfx942,304,63360,4096,2048,ck,0,0,1310.6856,a8w8_blockscale_1x128x128_256x128x128x128_16x16_32x32_2x2_8x32x1_8x32x1_1x32x1x8_8_1x1_intrawave_v3,811.03,501.41,0.0
gfx942,304,63488,4096,2048,ck,0,0,1288.3521,a8w8_blockscale_1x128x128_256x128x128x128_16x16_32x32_2x2_8x32x1_8x32x1_1x32x1x8_8_1x1_intrawave_v3,826.76,511.12,0.0
gfx942,304,63616,4096,2048,ck,0,0,1315.5698,a8w8_blockscale_1x128x128_256x128x128x128_16x16_32x32_2x2_8x32x1_8x32x1_1x32x1x8_8_1x1_intrawave_v3,811.28,501.54,0.0
gfx942,304,63744,4096,2048,ck,0,0,1338.8907,a8w8_blockscale_1x128x128_256x128x128x128_16x16_32x32_2x2_8x32x1_8x32x1_1x32x1x8_8_1x1_intrawave_v3,798.76,493.79,0.0
gfx942,304,63872,4096,2048,ck,0,0,1334.2247,a8w8_blockscale_1x128x128_256x128x128x128_16x16_32x32_2x2_8x32x1_8x32x1_1x32x1x8_8_1x1_intrawave_v3,803.16,496.5,0.0
gfx942,304,64000,4096,2048,ck,0,0,1306.2537,a8w8_blockscale_1x128x128_256x128x128x128_16x16_32x32_2x2_8x32x1_8x32x1_1x32x1x8_8_1x1_intrawave_v3,822.0,508.13,0.0
gfx942,304,64128,4096,2048,ck,0,0,1349.2159,a8w8_blockscale_1x128x128_256x128x128x128_16x16_32x32_2x2_8x32x1_8x32x1_1x32x1x8_8_1x1_intrawave_v3,797.42,492.92,0.0
gfx942,304,64256,4096,2048,ck,0,0,1306.3615,a8w8_blockscale_1x128x128_256x128x128x128_16x16_32x32_2x2_8x32x1_8x32x1_1x32x1x8_8_1x1_intrawave_v3,825.22,510.1,0.0
gfx942,304,64384,4096,2048,ck,0,0,1337.2495,a8w8_blockscale_1x128x128_256x128x128x128_16x16_32x32_2x2_8x32x1_8x32x1_1x32x1x8_8_1x1_intrawave_v3,807.77,499.29,0.0
gfx942,304,64512,4096,2048,ck,0,0,1352.3129,a8w8_blockscale_1x128x128_256x128x128x128_16x16_32x32_2x2_8x32x1_8x32x1_1x32x1x8_8_1x1_intrawave_v3,800.36,494.7,0.0
gfx942,304,64640,4096,2048,ck,0,0,1314.5221,a8w8_blockscale_1x128x128_256x128x128x128_16x16_32x32_2x2_8x32x1_8x32x1_1x32x1x8_8_1x1_intrawave_v3,825.0,509.92,0.0
gfx942,304,64768,4096,2048,ck,0,0,1335.6247,a8w8_blockscale_1x128x128_256x128x128x128_16x16_32x32_2x2_8x32x1_8x32x1_1x32x1x8_8_1x1_intrawave_v3,813.57,502.85,0.0
gfx942,304,64896,4096,2048,ck,0,0,1364.1233,a8w8_blockscale_1x128x128_256x128x128x128_16x16_32x32_2x2_8x32x1_8x32x1_1x32x1x8_8_1x1_intrawave_v3,798.15,493.3,0.0
gfx942,304,65024,4096,2048,ck,0,0,1326.5087,a8w8_blockscale_1x128x128_256x128x128x128_16x16_32x32_2x2_8x32x1_8x32x1_1x32x1x8_8_1x1_intrawave_v3,822.4,508.28,0.0
gfx942,304,65152,4096,2048,ck,0,0,1321.1821,a8w8_blockscale_1x128x128_256x128x128x128_16x16_32x32_2x2_8x32x1_8x32x1_1x32x1x8_8_1x1_intrawave_v3,827.34,511.32,0.0
gfx942,304,65280,4096,2048,ck,0,0,1350.9623,a8w8_blockscale_1x128x128_256x128x128x128_16x16_32x32_2x2_8x32x1_8x32x1_1x32x1x8_8_1x1_intrawave_v3,810.69,501.02,0.0
gfx942,304,65408,4096,2048,ck,0,0,1334.8764,a8w8_blockscale_1x128x128_256x128x128x128_16x16_32x32_2x2_8x32x1_8x32x1_1x32x1x8_8_1x1_intrawave_v3,822.07,508.04,0.0
gfx942,304,65536,4096,2048,ck,0,0,1357.8056,a8w8_blockscale_1x128x128_256x128x128x128_16x16_32x32_2x2_8x32x1_8x32x1_1x32x1x8_8_1x1_intrawave_v3,809.77,500.42,0.0
gfx942,304,65664,4096,2048,ck,0,0,1339.6158,a8w8_blockscale_1x128x128_256x128x128x128_16x16_32x32_2x2_8x32x1_8x32x1_1x32x1x8_8_1x1_intrawave_v3,822.37,508.2,0.0
gfx942,304,65792,4096,2048,ck,0,0,1336.0393,a8w8_blockscale_1x128x128_256x128x128x128_16x16_32x32_2x2_8x32x1_8x32x1_1x32x1x8_8_1x1_intrawave_v3,826.18,510.54,0.0
gfx942,304,65920,4096,2048,ck,0,0,1367.5458,a8w8_blockscale_1x128x128_256x128x128x128_16x16_32x32_2x2_8x32x1_8x32x1_1x32x1x8_8_1x1_intrawave_v3,808.71,499.73,0.0
gfx942,304,66048,4096,2048,ck,0,0,1342.0673,a8w8_blockscale_1x128x128_256x128x128x128_16x16_32x32_2x2_8x32x1_8x32x1_1x32x1x8_8_1x1_intrawave_v3,825.67,510.2,0.0
gfx942,304,66176,4096,2048,ck,0,0,1375.3135,a8w8_blockscale_1x128x128_256x128x128x128_16x16_32x32_2x2_8x32x1_8x32x1_1x32x1x8_8_1x1_intrawave_v3,807.27,498.82,0.0
gfx942,304,66304,4096,2048,ck,0,0,1372.2016,a8w8_blockscale_1x128x128_256x128x128x128_16x16_32x32_2x2_8x32x1_8x32x1_1x32x1x8_8_1x1_intrawave_v3,810.67,500.9,0.0
gfx942,304,66432,4096,2048,ck,0,0,1354.7451,a8w8_blockscale_1x128x128_256x128x128x128_16x16_32x32_2x2_8x32x1_8x32x1_1x32x1x8_8_1x1_intrawave_v3,822.7,508.33,0.0
gfx942,304,66560,4096,2048,ck,0,0,1400.2504,a8w8_blockscale_1x128x128_256x128x128x128_16x16_32x32_2x2_8x32x1_8x32x1_1x32x1x8_8_1x1_intrawave_v3,797.49,492.74,0.0
gfx942,304,66688,4096,2048,ck,0,0,1367.3136,a8w8_blockscale_1x128x128_256x128x128x128_16x16_32x32_2x2_8x32x1_8x32x1_1x32x1x8_8_1x1_intrawave_v3,818.28,505.57,0.0
gfx942,304,66816,4096,2048,ck,0,0,1359.1008,a8w8_blockscale_1x128x128_256x128x128x128_16x16_32x32_2x2_8x32x1_8x32x1_1x32x1x8_8_1x1_intrawave_v3,824.8,509.59,0.0
gfx942,304,66944,4096,2048,ck,0,0,1394.29,a8w8_blockscale_1x128x128_256x128x128x128_16x16_32x32_2x2_8x32x1_8x32x1_1x32x1x8_8_1x1_intrawave_v3,805.52,497.67,0.0
gfx942,304,67072,4096,2048,ck,0,0,1404.4669,a8w8_blockscale_1x128x128_256x128x128x128_16x16_32x32_2x2_8x32x1_8x32x1_1x32x1x8_8_1x1_intrawave_v3,801.22,495.0,0.0
gfx942,304,67200,4096,2048,ck,0,0,1417.7991,a8w8_blockscale_1x128x128_256x128x128x128_16x16_32x32_2x2_8x32x1_8x32x1_1x32x1x8_8_1x1_intrawave_v3,795.2,491.27,0.0
gfx942,304,67328,4096,2048,ck,0,0,1395.2261,a8w8_blockscale_1x128x128_256x128x128x128_16x16_32x32_2x2_8x32x1_8x32x1_1x32x1x8_8_1x1_intrawave_v3,809.6,500.15,0.0
gfx942,304,67456,4096,2048,ck,0,0,1364.2634,a8w8_blockscale_1x128x128_256x128x128x128_16x16_32x32_2x2_8x32x1_8x32x1_1x32x1x8_8_1x1_intrawave_v3,829.55,512.47,0.0
gfx942,304,67584,4096,2048,ck,0,0,1422.4056,a8w8_blockscale_1x128x128_256x128x128x128_16x16_32x32_2x2_8x32x1_8x32x1_1x32x1x8_8_1x1_intrawave_v3,797.15,492.44,0.0
gfx942,304,67712,4096,2048,ck,0,0,1425.7489,a8w8_blockscale_1x128x128_256x128x128x128_16x16_32x32_2x2_8x32x1_8x32x1_1x32x1x8_8_1x1_intrawave_v3,796.79,492.2,0.0
gfx942,304,67840,4096,2048,ck,0,0,1415.4805,a8w8_blockscale_1x128x128_256x128x128x128_16x16_32x32_2x2_8x32x1_8x32x1_1x32x1x8_8_1x1_intrawave_v3,804.08,496.7,0.0
gfx942,304,67968,4096,2048,ck,0,0,1390.8182,a8w8_blockscale_1x128x128_256x128x128x128_16x16_32x32_2x2_8x32x1_8x32x1_1x32x1x8_8_1x1_intrawave_v3,819.89,506.45,0.0
gfx942,304,68096,4096,2048,ck,0,0,1428.9931,a8w8_blockscale_1x128x128_256x128x128x128_16x16_32x32_2x2_8x32x1_8x32x1_1x32x1x8_8_1x1_intrawave_v3,799.49,493.84,0.0
gfx942,304,68224,4096,2048,ck,0,0,1391.2901,a8w8_blockscale_1x128x128_256x128x128x128_16x16_32x32_2x2_8x32x1_8x32x1_1x32x1x8_8_1x1_intrawave_v3,822.7,508.16,0.0
gfx942,304,68352,4096,2048,ck,0,0,1400.6258,a8w8_blockscale_1x128x128_256x128x128x128_16x16_32x32_2x2_8x32x1_8x32x1_1x32x1x8_8_1x1_intrawave_v3,818.75,505.71,0.0
gfx942,304,68480,4096,2048,ck,0,0,1398.4515,a8w8_blockscale_1x128x128_256x128x128x128_16x16_32x32_2x2_8x32x1_8x32x1_1x32x1x8_8_1x1_intrawave_v3,821.55,507.44,0.0
gfx942,304,68608,4096,2048,ck,0,0,1389.8872,a8w8_blockscale_1x128x128_256x128x128x128_16x16_32x32_2x2_8x32x1_8x32x1_1x32x1x8_8_1x1_intrawave_v3,828.16,511.51,0.0
gfx942,304,68736,4096,2048,ck,0,0,1403.1394,a8w8_blockscale_1x128x128_256x128x128x128_16x16_32x32_2x2_8x32x1_8x32x1_1x32x1x8_8_1x1_intrawave_v3,821.87,507.61,0.0
gfx942,304,68864,4096,2048,ck,0,0,1428.0649,a8w8_blockscale_1x128x128_256x128x128x128_16x16_32x32_2x2_8x32x1_8x32x1_1x32x1x8_8_1x1_intrawave_v3,809.03,499.67,0.0
gfx942,304,68992,4096,2048,ck,0,0,1443.9494,a8w8_blockscale_1x128x128_256x128x128x128_16x16_32x32_2x2_8x32x1_8x32x1_1x32x1x8_8_1x1_intrawave_v3,801.62,495.08,0.0
gfx942,304,69120,4096,2048,ck,0,0,1442.8088,a8w8_blockscale_1x128x128_256x128x128x128_16x16_32x32_2x2_8x32x1_8x32x1_1x32x1x8_8_1x1_intrawave_v3,803.74,496.38,0.0
gfx942,304,69248,4096,2048,ck,0,0,1443.2784,a8w8_blockscale_1x128x128_256x128x128x128_16x16_32x32_2x2_8x32x1_8x32x1_1x32x1x8_8_1x1_intrawave_v3,804.97,497.12,0.0
gfx942,304,69376,4096,2048,ck,0,0,1452.5728,a8w8_blockscale_1x128x128_256x128x128x128_16x16_32x32_2x2_8x32x1_8x32x1_1x32x1x8_8_1x1_intrawave_v3,801.29,494.85,0.0
gfx942,304,69504,4096,2048,ck,0,0,1435.5035,a8w8_blockscale_1x128x128_256x128x128x128_16x16_32x32_2x2_8x32x1_8x32x1_1x32x1x8_8_1x1_intrawave_v3,812.32,501.64,0.0
gfx942,304,69632,4096,2048,ck,0,0,1415.7717,a8w8_blockscale_1x128x128_256x128x128x128_16x16_32x32_2x2_8x32x1_8x32x1_1x32x1x8_8_1x1_intrawave_v3,825.16,509.56,0.0
gfx942,304,69760,4096,2048,ck,0,0,1474.3024,a8w8_blockscale_1x128x128_256x128x128x128_16x16_32x32_2x2_8x32x1_8x32x1_1x32x1x8_8_1x1_intrawave_v3,793.85,490.22,0.0
gfx942,304,69888,4096,2048,ck,0,0,1420.8821,a8w8_blockscale_1x128x128_256x128x128x128_16x16_32x32_2x2_8x32x1_8x32x1_1x32x1x8_8_1x1_intrawave_v3,825.21,509.57,0.0
gfx942,304,70016,4096,2048,ck,0,0,1450.9809,a8w8_blockscale_1x128x128_256x128x128x128_16x16_32x32_2x2_8x32x1_8x32x1_1x32x1x8_8_1x1_intrawave_v3,809.57,499.9,0.0
gfx942,304,70144,4096,2048,ck,0,0,1450.3039,a8w8_blockscale_1x128x128_256x128x128x128_16x16_32x32_2x2_8x32x1_8x32x1_1x32x1x8_8_1x1_intrawave_v3,811.43,501.04,0.0
gfx942,304,70272,4096,2048,ck,0,0,1455.8833,a8w8_blockscale_1x128x128_256x128x128x128_16x16_32x32_2x2_8x32x1_8x32x1_1x32x1x8_8_1x1_intrawave_v3,809.8,500.02,0.0
gfx942,304,70400,4096,2048,ck,0,0,1426.0709,a8w8_blockscale_1x128x128_256x128x128x128_16x16_32x32_2x2_8x32x1_8x32x1_1x32x1x8_8_1x1_intrawave_v3,828.23,511.39,0.0
gfx942,304,70528,4096,2048,ck,0,0,1434.9788,a8w8_blockscale_1x128x128_256x128x128x128_16x16_32x32_2x2_8x32x1_8x32x1_1x32x1x8_8_1x1_intrawave_v3,824.59,509.13,0.0
gfx942,304,70656,4096,2048,ck,0,0,1440.473,a8w8_blockscale_1x128x128_256x128x128x128_16x16_32x32_2x2_8x32x1_8x32x1_1x32x1x8_8_1x1_intrawave_v3,822.93,508.1,0.0
gfx942,304,70784,4096,2048,ck,0,0,1446.2858,a8w8_blockscale_1x128x128_256x128x128x128_16x16_32x32_2x2_8x32x1_8x32x1_1x32x1x8_8_1x1_intrawave_v3,821.11,506.97,0.0
gfx942,304,70912,4096,2048,ck,0,0,1474.7621,a8w8_blockscale_1x128x128_256x128x128x128_16x16_32x32_2x2_8x32x1_8x32x1_1x32x1x8_8_1x1_intrawave_v3,806.71,498.07,0.0
gfx942,304,71040,4096,2048,ck,0,0,1436.473,a8w8_blockscale_1x128x128_256x128x128x128_16x16_32x32_2x2_8x32x1_8x32x1_1x32x1x8_8_1x1_intrawave_v3,829.71,512.25,0.0
gfx942,304,71168,4096,2048,ck,0,0,1485.1708,a8w8_blockscale_1x128x128_256x128x128x128_16x16_32x32_2x2_8x32x1_8x32x1_1x32x1x8_8_1x1_intrawave_v3,803.95,496.34,0.0
gfx942,304,71296,4096,2048,ck,0,0,1480.8111,a8w8_blockscale_1x128x128_256x128x128x128_16x16_32x32_2x2_8x32x1_8x32x1_1x32x1x8_8_1x1_intrawave_v3,807.77,498.69,0.0
gfx942,304,71424,4096,2048,ck,0,0,1446.4875,a8w8_blockscale_1x128x128_256x128x128x128_16x16_32x32_2x2_8x32x1_8x32x1_1x32x1x8_8_1x1_intrawave_v3,828.42,511.43,0.0
gfx942,304,71552,4096,2048,ck,0,0,1440.9077,a8w8_blockscale_1x128x128_256x128x128x128_16x16_32x32_2x2_8x32x1_8x32x1_1x32x1x8_8_1x1_intrawave_v3,833.12,514.32,0.0
gfx942,304,71680,4096,2048,ck,0,0,1458.6107,a8w8_blockscale_1x128x128_256x128x128x128_16x16_32x32_2x2_8x32x1_8x32x1_1x32x1x8_8_1x1_intrawave_v3,824.48,508.97,0.0
gfx942,304,71808,4096,2048,ck,0,0,1500.6563,a8w8_blockscale_1x128x128_256x128x128x128_16x16_32x32_2x2_8x32x1_8x32x1_1x32x1x8_8_1x1_intrawave_v3,802.81,495.58,0.0
gfx942,304,71936,4096,2048,ck,0,0,1464.3944,a8w8_blockscale_1x128x128_256x128x128x128_16x16_32x32_2x2_8x32x1_8x32x1_1x32x1x8_8_1x1_intrawave_v3,824.15,508.75,0.0
gfx942,304,72064,4096,2048,ck,0,0,1472.7173,a8w8_blockscale_1x128x128_256x128x128x128_16x16_32x32_2x2_8x32x1_8x32x1_1x32x1x8_8_1x1_intrawave_v3,820.95,506.77,0.0
gfx942,304,72192,4096,2048,ck,0,0,1455.1549,a8w8_blockscale_1x128x128_256x128x128x128_16x16_32x32_2x2_8x32x1_8x32x1_1x32x1x8_8_1x1_intrawave_v3,832.34,513.78,0.0
gfx942,304,72320,4096,2048,ck,0,0,1482.8066,a8w8_blockscale_1x128x128_256x128x128x128_16x16_32x32_2x2_8x32x1_8x32x1_1x32x1x8_8_1x1_intrawave_v3,818.26,505.09,0.0
gfx942,304,72448,4096,2048,ck,0,0,1464.6818,a8w8_blockscale_1x128x128_256x128x128x128_16x16_32x32_2x2_8x32x1_8x32x1_1x32x1x8_8_1x1_intrawave_v3,829.86,512.23,0.0
gfx942,304,72576,4096,2048,ck,0,0,1499.9311,a8w8_blockscale_1x128x128_256x128x128x128_16x16_32x32_2x2_8x32x1_8x32x1_1x32x1x8_8_1x1_intrawave_v3,811.79,501.07,0.0
gfx942,304,72704,4096,2048,ck,0,0,1493.5356,a8w8_blockscale_1x128x128_256x128x128x128_16x16_32x32_2x2_8x32x1_8x32x1_1x32x1x8_8_1x1_intrawave_v3,816.7,504.09,0.0
gfx942,304,72832,4096,2048,ck,0,0,1503.8366,a8w8_blockscale_1x128x128_256x128x128x128_16x16_32x32_2x2_8x32x1_8x32x1_1x32x1x8_8_1x1_intrawave_v3,812.53,501.51,0.0
gfx942,304,72960,4096,2048,ck,0,0,1483.0882,a8w8_blockscale_1x128x128_256x128x128x128_16x16_32x32_2x2_8x32x1_8x32x1_1x32x1x8_8_1x1_intrawave_v3,825.35,509.41,0.0
gfx942,304,73088,4096,2048,ck,0,0,1473.1496,a8w8_blockscale_1x128x128_256x128x128x128_16x16_32x32_2x2_8x32x1_8x32x1_1x32x1x8_8_1x1_intrawave_v3,832.38,513.74,0.0
gfx942,304,73216,4096,2048,ck,0,0,1488.4533,a8w8_blockscale_1x128x128_256x128x128x128_16x16_32x32_2x2_8x32x1_8x32x1_1x32x1x8_8_1x1_intrawave_v3,825.26,509.33,0.0
gfx942,304,73344,4096,2048,ck,0,0,1511.177,a8w8_blockscale_1x128x128_256x128x128x128_16x16_32x32_2x2_8x32x1_8x32x1_1x32x1x8_8_1x1_intrawave_v3,814.27,502.54,0.0
gfx942,304,73472,4096,2048,ck,0,0,1494.2488,a8w8_blockscale_1x128x128_256x128x128x128_16x16_32x32_2x2_8x32x1_8x32x1_1x32x1x8_8_1x1_intrawave_v3,824.93,509.11,0.0
gfx942,304,73600,4096,2048,ck,0,0,1518.0175,a8w8_blockscale_1x128x128_256x128x128x128_16x16_32x32_2x2_8x32x1_8x32x1_1x32x1x8_8_1x1_intrawave_v3,813.43,502.01,0.0
gfx942,304,73728,4096,2048,ck,0,0,1523.1805,a8w8_blockscale_1x128x128_256x128x128x128_16x16_32x32_2x2_8x32x1_8x32x1_1x32x1x8_8_1x1_intrawave_v3,812.08,501.16,0.0
gfx942,304,73856,4096,2048,ck,0,0,1509.6879,a8w8_blockscale_1x128x128_256x128x128x128_16x16_32x32_2x2_8x32x1_8x32x1_1x32x1x8_8_1x1_intrawave_v3,820.76,506.51,0.0
gfx942,304,73984,4096,2048,ck,0,0,1552.5782,a8w8_blockscale_1x128x128_256x128x128x128_16x16_32x32_2x2_8x32x1_8x32x1_1x32x1x8_8_1x1_intrawave_v3,799.47,493.36,0.0
gfx942,304,74112,4096,2048,ck,0,0,1509.9018,a8w8_blockscale_1x128x128_256x128x128x128_16x16_32x32_2x2_8x32x1_8x32x1_1x32x1x8_8_1x1_intrawave_v3,823.49,508.18,0.0
gfx942,304,74240,4096,2048,ck,0,0,1511.7899,a8w8_blockscale_1x128x128_256x128x128x128_16x16_32x32_2x2_8x32x1_8x32x1_1x32x1x8_8_1x1_intrawave_v3,823.88,508.41,0.0
gfx942,304,74368,4096,2048,ck,0,0,1547.7803,a8w8_blockscale_1x128x128_256x128x128x128_16x16_32x32_2x2_8x32x1_8x32x1_1x32x1x8_8_1x1_intrawave_v3,806.11,497.43,0.0
gfx942,304,74496,4096,2048,ck,0,0,1518.1401,a8w8_blockscale_1x128x128_256x128x128x128_16x16_32x32_2x2_8x32x1_8x32x1_1x32x1x8_8_1x1_intrawave_v3,823.27,508.01,0.0
gfx942,304,74624,4096,2048,ck,0,0,1543.2196,a8w8_blockscale_1x128x128_256x128x128x128_16x16_32x32_2x2_8x32x1_8x32x1_1x32x1x8_8_1x1_intrawave_v3,811.28,500.6,0.0
gfx942,304,74752,4096,2048,ck,0,0,1515.1135,a8w8_blockscale_1x128x128_256x128x128x128_16x16_32x32_2x2_8x32x1_8x32x1_1x32x1x8_8_1x1_intrawave_v3,827.75,510.75,0.0
gfx942,304,74880,4096,2048,ck,0,0,1512.9369,a8w8_blockscale_1x128x128_256x128x128x128_16x16_32x32_2x2_8x32x1_8x32x1_1x32x1x8_8_1x1_intrawave_v3,830.36,512.35,0.0
gfx942,304,75008,4096,2048,ck,0,0,1554.8766,a8w8_blockscale_1x128x128_256x128x128x128_16x16_32x32_2x2_8x32x1_8x32x1_1x32x1x8_8_1x1_intrawave_v3,809.34,499.38,0.0
gfx942,304,75136,4096,2048,ck,0,0,1567.8022,a8w8_blockscale_1x128x128_256x128x128x128_16x16_32x32_2x2_8x32x1_8x32x1_1x32x1x8_8_1x1_intrawave_v3,804.04,496.1,0.0
gfx942,304,75264,4096,2048,ck,0,0,1522.108,a8w8_blockscale_1x128x128_256x128x128x128_16x16_32x32_2x2_8x32x1_8x32x1_1x32x1x8_8_1x1_intrawave_v3,829.59,511.85,0.0
gfx942,304,75392,4096,2048,ck,0,0,1538.2468,a8w8_blockscale_1x128x128_256x128x128x128_16x16_32x32_2x2_8x32x1_8x32x1_1x32x1x8_8_1x1_intrawave_v3,822.28,507.33,0.0
gfx942,304,75520,4096,2048,ck,0,0,1577.8075,a8w8_blockscale_1x128x128_256x128x128x128_16x16_32x32_2x2_8x32x1_8x32x1_1x32x1x8_8_1x1_intrawave_v3,803.02,495.44,0.0
gfx942,304,75648,4096,2048,ck,0,0,1537.5813,a8w8_blockscale_1x128x128_256x128x128x128_16x16_32x32_2x2_8x32x1_8x32x1_1x32x1x8_8_1x1_intrawave_v3,825.43,509.26,0.0
gfx942,304,75776,4096,2048,ck,0,0,1524.6308,a8w8_blockscale_1x128x128_256x128x128x128_16x16_32x32_2x2_8x32x1_8x32x1_1x32x1x8_8_1x1_intrawave_v3,833.85,514.44,0.0
gfx942,304,75904,4096,2048,ck,0,0,1559.8954,a8w8_blockscale_1x128x128_256x128x128x128_16x16_32x32_2x2_8x32x1_8x32x1_1x32x1x8_8_1x1_intrawave_v3,816.37,503.65,0.0
gfx942,304,76032,4096,2048,ck,0,0,1538.8218,a8w8_blockscale_1x128x128_256x128x128x128_16x16_32x32_2x2_8x32x1_8x32x1_1x32x1x8_8_1x1_intrawave_v3,828.95,511.4,0.0
gfx942,304,76160,4096,2048,ck,0,0,1540.6975,a8w8_blockscale_1x128x128_256x128x128x128_16x16_32x32_2x2_8x32x1_8x32x1_1x32x1x8_8_1x1_intrawave_v3,829.33,511.63,0.0
gfx942,304,76288,4096,2048,ck,0,0,1599.0479,a8w8_blockscale_1x128x128_256x128x128x128_16x16_32x32_2x2_8x32x1_8x32x1_1x32x1x8_8_1x1_intrawave_v3,800.41,493.78,0.0
gfx942,304,76416,4096,2048,ck,0,0,1558.706,a8w8_blockscale_1x128x128_256x128x128x128_16x16_32x32_2x2_8x32x1_8x32x1_1x32x1x8_8_1x1_intrawave_v3,822.51,507.4,0.0
gfx942,304,76544,4096,2048,ck,0,0,1553.0587,a8w8_blockscale_1x128x128_256x128x128x128_16x16_32x32_2x2_8x32x1_8x32x1_1x32x1x8_8_1x1_intrawave_v3,826.88,510.09,0.0
gfx942,304,76672,4096,2048,ck,0,0,1608.9375,a8w8_blockscale_1x128x128_256x128x128x128_16x16_32x32_2x2_8x32x1_8x32x1_1x32x1x8_8_1x1_intrawave_v3,799.5,493.19,0.0
gfx942,304,76800,4096,2048,ck,0,0,1559.2482,a8w8_blockscale_1x128x128_256x128x128x128_16x16_32x32_2x2_8x32x1_8x32x1_1x32x1x8_8_1x1_intrawave_v3,826.35,509.75,0.0
gfx942,304,76928,4096,2048,ck,0,0,1561.0154,a8w8_blockscale_1x128x128_256x128x128x128_16x16_32x32_2x2_8x32x1_8x32x1_1x32x1x8_8_1x1_intrawave_v3,826.79,510.01,0.0
gfx942,304,77056,4096,2048,ck,0,0,1569.4901,a8w8_blockscale_1x128x128_256x128x128x128_16x16_32x32_2x2_8x32x1_8x32x1_1x32x1x8_8_1x1_intrawave_v3,823.7,508.09,0.0
gfx942,304,77184,4096,2048,ck,0,0,1559.1689,a8w8_blockscale_1x128x128_256x128x128x128_16x16_32x32_2x2_8x32x1_8x32x1_1x32x1x8_8_1x1_intrawave_v3,830.53,512.29,0.0
gfx942,304,77312,4096,2048,ck,0,0,1561.4739,a8w8_blockscale_1x128x128_256x128x128x128_16x16_32x32_2x2_8x32x1_8x32x1_1x32x1x8_8_1x1_intrawave_v3,830.68,512.38,0.0
gfx942,304,77440,4096,2048,ck,0,0,1562.5079,a8w8_blockscale_1x128x128_256x128x128x128_16x16_32x32_2x2_8x32x1_8x32x1_1x32x1x8_8_1x1_intrawave_v3,831.5,512.88,0.0
gfx942,304,77568,4096,2048,ck,0,0,1634.1025,a8w8_blockscale_1x128x128_256x128x128x128_16x16_32x32_2x2_8x32x1_8x32x1_1x32x1x8_8_1x1_intrawave_v3,796.39,491.21,0.0
gfx942,304,77696,4096,2048,ck,0,0,1623.9914,a8w8_blockscale_1x128x128_256x128x128x128_16x16_32x32_2x2_8x32x1_8x32x1_1x32x1x8_8_1x1_intrawave_v3,802.67,495.07,0.0
gfx942,304,77824,4096,2048,ck,0,0,1615.697,a8w8_blockscale_1x128x128_256x128x128x128_16x16_32x32_2x2_8x32x1_8x32x1_1x32x1x8_8_1x1_intrawave_v3,808.12,498.43,0.0
gfx942,304,77952,4096,2048,ck,0,0,1623.0617,a8w8_blockscale_1x128x128_256x128x128x128_16x16_32x32_2x2_8x32x1_8x32x1_1x32x1x8_8_1x1_intrawave_v3,805.77,496.97,0.0
gfx942,304,78080,4096,2048,ck,0,0,1647.4775,a8w8_blockscale_1x128x128_256x128x128x128_16x16_32x32_2x2_8x32x1_8x32x1_1x32x1x8_8_1x1_intrawave_v3,795.13,490.4,0.0
gfx942,304,78208,4096,2048,ck,0,0,1590.8903,a8w8_blockscale_1x128x128_256x128x128x128_16x16_32x32_2x2_8x32x1_8x32x1_1x32x1x8_8_1x1_intrawave_v3,824.77,508.67,0.0
gfx942,304,78336,4096,2048,ck,0,0,1615.8727,a8w8_blockscale_1x128x128_256x128x128x128_16x16_32x32_2x2_8x32x1_8x32x1_1x32x1x8_8_1x1_intrawave_v3,813.34,501.62,0.0
gfx942,304,78464,4096,2048,ck,0,0,1592.164,a8w8_blockscale_1x128x128_256x128x128x128_16x16_32x32_2x2_8x32x1_8x32x1_1x32x1x8_8_1x1_intrawave_v3,826.8,509.91,0.0
gfx942,304,78592,4096,2048,ck,0,0,1604.7318,a8w8_blockscale_1x128x128_256x128x128x128_16x16_32x32_2x2_8x32x1_8x32x1_1x32x1x8_8_1x1_intrawave_v3,821.67,506.73,0.0
gfx942,304,78720,4096,2048,ck,0,0,1584.5161,a8w8_blockscale_1x128x128_256x128x128x128_16x16_32x32_2x2_8x32x1_8x32x1_1x32x1x8_8_1x1_intrawave_v3,833.51,514.03,0.0
gfx942,304,78848,4096,2048,ck,0,0,1633.0099,a8w8_blockscale_1x128x128_256x128x128x128_16x16_32x32_2x2_8x32x1_8x32x1_1x32x1x8_8_1x1_intrawave_v3,810.07,499.56,0.0
gfx942,304,78976,4096,2048,ck,0,0,1606.4144,a8w8_blockscale_1x128x128_256x128x128x128_16x16_32x32_2x2_8x32x1_8x32x1_1x32x1x8_8_1x1_intrawave_v3,824.82,508.65,0.0
gfx942,304,79104,4096,2048,ck,0,0,1633.1229,a8w8_blockscale_1x128x128_256x128x128x128_16x16_32x32_2x2_8x32x1_8x32x1_1x32x1x8_8_1x1_intrawave_v3,812.64,501.13,0.0
gfx942,304,79232,4096,2048,ck,0,0,1614.7039,a8w8_blockscale_1x128x128_256x128x128x128_16x16_32x32_2x2_8x32x1_8x32x1_1x32x1x8_8_1x1_intrawave_v3,823.24,507.66,0.0
gfx942,304,79360,4096,2048,ck,0,0,1644.4664,a8w8_blockscale_1x128x128_256x128x128x128_16x16_32x32_2x2_8x32x1_8x32x1_1x32x1x8_8_1x1_intrawave_v3,809.65,499.27,0.0
gfx942,304,79488,4096,2048,ck,0,0,1665.835,a8w8_blockscale_1x128x128_256x128x128x128_16x16_32x32_2x2_8x32x1_8x32x1_1x32x1x8_8_1x1_intrawave_v3,800.55,493.65,0.0
gfx942,304,79616,4096,2048,ck,0,0,1618.2358,a8w8_blockscale_1x128x128_256x128x128x128_16x16_32x32_2x2_8x32x1_8x32x1_1x32x1x8_8_1x1_intrawave_v3,825.43,508.98,0.0
gfx942,304,79744,4096,2048,ck,0,0,1677.7887,a8w8_blockscale_1x128x128_256x128x128x128_16x16_32x32_2x2_8x32x1_8x32x1_1x32x1x8_8_1x1_intrawave_v3,797.41,491.7,0.0
gfx942,304,79872,4096,2048,ck,0,0,1632.6589,a8w8_blockscale_1x128x128_256x128x128x128_16x16_32x32_2x2_8x32x1_8x32x1_1x32x1x8_8_1x1_intrawave_v3,820.77,506.09,0.0
gfx942,304,80000,4096,2048,ck,0,0,1659.0054,a8w8_blockscale_1x128x128_256x128x128x128_16x16_32x32_2x2_8x32x1_8x32x1_1x32x1x8_8_1x1_intrawave_v3,809.03,498.85,0.0
