aiter/configs/model_configs/a8w8_blockscale_tuned_fmoe_ds_v3.csv
cu_num,token,model_dim,inter_dim,expert,topk,act_type,dtype,q_dtype_a,q_dtype_w,q_type,use_g1u1,doweight_stage1,block_m,ksplit,us1,kernelName1,err1,us2,kernelName2,err2,us,run_1stage,tflops,bw,_tag
256,1,7168,256,257,9,ActivationType.Silu,torch.bfloat16,torch.float8_e4m3fn,torch.float8_e4m3fn,QuantType.per_1x128,1,0,16,0,58.0631,_ZN5aiter47fmoe_bf16_blockscaleFp8_g1u1_vs_pf2_silu_16x128E,0.0%,0.0,,0.0%,58.0631,1,1.71,24366.81,
256,2,7168,256,257,9,ActivationType.Silu,torch.bfloat16,torch.float8_e4m3fn,torch.float8_e4m3fn,QuantType.per_1x128,1,0,16,0,59.7066,_ZN5aiter47fmoe_bf16_blockscaleFp8_g1u1_vs_pf2_silu_16x128E,0.0%,0.0,,0.0%,59.7066,1,3.32,23696.45,
256,4,7168,256,257,9,ActivationType.Silu,torch.bfloat16,torch.float8_e4m3fn,torch.float8_e4m3fn,QuantType.per_1x128,1,0,16,0,69.2492,_ZN5aiter47fmoe_bf16_blockscaleFp8_g1u1_vs_pf2_silu_16x128E,0.0%,0.0,,0.0%,69.2492,1,5.72,20431.68,
256,8,7168,256,257,9,ActivationType.Silu,torch.bfloat16,torch.float8_e4m3fn,torch.float8_e4m3fn,QuantType.per_1x128,1,0,16,0,74.4901,_ZN5aiter47fmoe_bf16_blockscaleFp8_g1u1_vs_pf2_silu_16x128E,0.0%,0.0,,0.0%,74.4901,1,10.64,18995.32,
256,16,7168,256,257,9,ActivationType.Silu,torch.bfloat16,torch.float8_e4m3fn,torch.float8_e4m3fn,QuantType.per_1x128,1,0,16,0,110.6518,_ZN5aiter47fmoe_bf16_blockscaleFp8_g1u1_vs_pf2_silu_16x128E,0.0%,0.0,,0.0%,110.6518,1,14.33,12789.08,
256,32,7168,256,257,9,ActivationType.Silu,torch.bfloat16,torch.float8_e4m3fn,torch.float8_e4m3fn,QuantType.per_1x128,1,0,32,0,168.0641,_ZN5aiter47fmoe_bf16_blockscaleFp8_g1u1_vs_silu_1tg_32x256E,0.0%,0.0,,0.0%,168.0641,1,18.87,8422.26,
256,64,7168,256,257,9,ActivationType.Silu,torch.bfloat16,torch.float8_e4m3fn,torch.float8_e4m3fn,QuantType.per_1x128,1,0,16,0,216.6726,_ZN5aiter47fmoe_bf16_blockscaleFp8_g1u1_vs_pf2_silu_16x256E,0.0%,0.0,,0.0%,216.6726,1,29.27,6535.98,
256,128,7168,256,257,9,ActivationType.Silu,torch.bfloat16,torch.float8_e4m3fn,torch.float8_e4m3fn,QuantType.per_1x128,1,0,16,0,246.3749,_ZN5aiter47fmoe_bf16_blockscaleFp8_g1u1_vs_pf2_silu_16x256E,0.0%,0.0,,0.0%,246.3749,1,51.48,5753.6,
256,256,7168,256,257,9,ActivationType.Silu,torch.bfloat16,torch.float8_e4m3fn,torch.float8_e4m3fn,QuantType.per_1x128,1,0,32,0,195.0379,moe_ck2stages_gemm1_256x32x128x128_1x4_MulABScaleExpertWeightA8W8blkscale_v1_Nswizzle0_Quant4_MulRoutedWeight0_silu_F8_F8_B16,0.1%,91.3138,moe_ck2stages_gemm2_256x32x128x128_1x4_MulABScaleExpertWeightA8W8blkscale_v1_Nswizzle0_Quant4_MulRoutedWeight1_F8_F8_B16,16.8%,286.3517,0,88.59,4959.97,
256,512,7168,256,257,9,ActivationType.Silu,torch.bfloat16,torch.float8_e4m3fn,torch.float8_e4m3fn,QuantType.per_1x128,1,0,32,0,207.1386,moe_ck2stages_gemm1_256x32x128x128_1x4_MulABScaleExpertWeightA8W8blkscale_v1_Nswizzle0_Quant4_MulRoutedWeight0_silu_F8_F8_B16,0.1%,98.2686,moe_ck2stages_gemm2_256x32x128x128_1x4_MulABScaleExpertWeightA8W8blkscale_v1_Nswizzle0_Quant4_MulRoutedWeight1_F8_F8_B16,16.7%,305.4072,0,166.12,4668.53,
256,1024,7168,256,257,9,ActivationType.Silu,torch.bfloat16,torch.float8_e4m3fn,torch.float8_e4m3fn,QuantType.per_1x128,1,0,32,0,382.315,_ZN5aiter49fmoe_bf16_blockscaleFp8_g1u1_novs_silu_1tg_32x256E,0.0%,0.0,,0.0%,382.315,1,265.41,3758.19,
256,2048,7168,256,257,9,ActivationType.Silu,torch.bfloat16,torch.float8_e4m3fn,torch.float8_e4m3fn,QuantType.per_1x128,1,0,64,0,450.1469,_ZN5aiter46fmoe_bf16_blockscaleFp8_g1u1_vs_ps_silu_64x256E,0.0%,0.0,,0.0%,450.1469,1,450.82,3240.79,
256,4096,7168,256,257,9,ActivationType.Silu,torch.bfloat16,torch.float8_e4m3fn,torch.float8_e4m3fn,QuantType.per_1x128,1,0,64,0,671.6328,_ZN5aiter46fmoe_bf16_blockscaleFp8_g1u1_vs_ps_silu_64x256E,0.0%,0.0,,0.0%,671.6328,1,604.31,2237.64,
256,8192,7168,256,257,9,ActivationType.Silu,torch.bfloat16,torch.float8_e4m3fn,torch.float8_e4m3fn,QuantType.per_1x128,1,0,64,0,1270.8187,_ZN5aiter46fmoe_bf16_blockscaleFp8_g1u1_vs_ps_silu_64x256E,0.0%,0.0,,0.0%,1270.8187,1,638.76,1251.91,
256,16384,7168,256,257,9,ActivationType.Silu,torch.bfloat16,torch.float8_e4m3fn,torch.float8_e4m3fn,QuantType.per_1x128,1,0,64,0,2280.181,_ZN5aiter46fmoe_bf16_blockscaleFp8_g1u1_vs_ps_silu_64x256E,0.0%,0.0,,0.0%,2280.181,1,712.0,774.99,
256,32768,7168,256,257,9,ActivationType.Silu,torch.bfloat16,torch.float8_e4m3fn,torch.float8_e4m3fn,QuantType.per_1x128,1,0,64,0,4509.3245,_ZN5aiter46fmoe_bf16_blockscaleFp8_g1u1_vs_ps_silu_64x256E,0.0%,0.0,,0.0%,4509.3245,1,720.06,470.01,
256,1,7168,512,257,9,ActivationType.Silu,torch.bfloat16,torch.float8_e4m3fn,torch.float8_e4m3fn,QuantType.per_1x128,1,0,16,0,58.3842,_ZN5aiter47fmoe_bf16_blockscaleFp8_g1u1_vs_pf2_silu_16x128E,0.0%,0.0,,0.0%,58.3842,1,3.39,48465.23,
256,2,7168,512,257,9,ActivationType.Silu,torch.bfloat16,torch.float8_e4m3fn,torch.float8_e4m3fn,QuantType.per_1x128,1,0,16,0,65.708,_ZN5aiter47fmoe_bf16_blockscaleFp8_g1u1_vs_pf2_silu_16x128E,0.0%,0.0,,0.0%,65.708,1,6.03,43063.64,
256,4,7168,512,257,9,ActivationType.Silu,torch.bfloat16,torch.float8_e4m3fn,torch.float8_e4m3fn,QuantType.per_1x128,1,0,16,0,78.1208,_ZN5aiter47fmoe_bf16_blockscaleFp8_g1u1_vs_pf2_silu_16x128E,0.0%,0.0,,0.0%,78.1208,1,10.15,36221.7,
256,8,7168,512,257,9,ActivationType.Silu,torch.bfloat16,torch.float8_e4m3fn,torch.float8_e4m3fn,QuantType.per_1x128,1,0,16,0,128.0734,_ZN5aiter47fmoe_bf16_blockscaleFp8_g1u1_vs_pf2_silu_16x128E,0.0%,0.0,,0.0%,128.0734,1,12.38,22094.79,
256,16,7168,512,257,9,ActivationType.Silu,torch.bfloat16,torch.float8_e4m3fn,torch.float8_e4m3fn,QuantType.per_1x128,1,0,16,0,212.7395,_ZN5aiter47fmoe_bf16_blockscaleFp8_g1u1_vs_pf2_silu_16x256E,0.0%,0.0,,0.0%,212.7395,1,14.91,13302.31,
256,32,7168,512,257,9,ActivationType.Silu,torch.bfloat16,torch.float8_e4m3fn,torch.float8_e4m3fn,QuantType.per_1x128,1,0,32,0,224.9755,moe_ck2stages_gemm1_256x32x128x128_1x4_MulABScaleExpertWeightA8W8blkscale_v1_Nswizzle0_Quant4_MulRoutedWeight0_silu_F8_F8_B16,0.1%,112.8008,moe_ck2stages_gemm2_256x32x128x128_1x4_MulABScaleExpertWeightA8W8blkscale_v1_Nswizzle0_Quant4_MulRoutedWeight1_F8_F8_B16,17.2%,337.7763,0,18.78,8379.13,
256,64,7168,512,257,9,ActivationType.Silu,torch.bfloat16,torch.float8_e4m3fn,torch.float8_e4m3fn,QuantType.per_1x128,1,0,16,0,422.1958,_ZN5aiter47fmoe_bf16_blockscaleFp8_g1u1_vs_pf2_silu_16x256E,0.0%,0.0,,0.0%,422.1958,1,30.04,6705.32,
256,128,7168,512,257,9,ActivationType.Silu,torch.bfloat16,torch.float8_e4m3fn,torch.float8_e4m3fn,QuantType.per_1x128,1,0,32,0,315.6131,moe_ck2stages_gemm1_256x32x128x128_1x4_MulABScaleExpertWeightA8W8blkscale_v1_Nswizzle0_Quant4_MulRoutedWeight0_silu_F8_F8_B16,0.1%,163.7944,moe_ck2stages_gemm2_256x32x128x128_1x4_MulABScaleExpertWeightA8W8blkscale_v1_Nswizzle0_Quant4_MulRoutedWeight1_F8_F8_B16,17.0%,479.4075,0,52.91,5907.99,
256,256,7168,512,257,9,ActivationType.Silu,torch.bfloat16,torch.float8_e4m3fn,torch.float8_e4m3fn,QuantType.per_1x128,1,0,32,0,348.5746,moe_ck2stages_gemm1_256x32x128x128_1x4_MulABScaleExpertWeightA8W8blkscale_v1_Nswizzle0_Quant4_MulRoutedWeight0_silu_F8_F8_B16,0.1%,170.9514,moe_ck2stages_gemm2_256x32x128x128_1x4_MulABScaleExpertWeightA8W8blkscale_v1_Nswizzle0_Quant4_MulRoutedWeight1_F8_F8_B16,16.9%,519.526,0,97.65,5457.07,
256,512,7168,512,257,9,ActivationType.Silu,torch.bfloat16,torch.float8_e4m3fn,torch.float8_e4m3fn,QuantType.per_1x128,1,0,32,0,359.2184,moe_ck2stages_gemm1_256x32x128x128_1x4_MulABScaleExpertWeightA8W8blkscale_v1_Nswizzle0_Quant4_MulRoutedWeight0_silu_F8_F8_B16,0.1%,182.5367,moe_ck2stages_gemm2_256x32x128x128_1x4_MulABScaleExpertWeightA8W8blkscale_v1_Nswizzle0_Quant4_MulRoutedWeight1_F8_F8_B16,16.8%,541.7551,0,187.3,5243.31,
256,1024,7168,512,257,9,ActivationType.Silu,torch.bfloat16,torch.float8_e4m3fn,torch.float8_e4m3fn,QuantType.per_1x128,1,0,64,0,665.9825,_ZN5aiter46fmoe_bf16_blockscaleFp8_g1u1_vs_ps_silu_64x256E,0.0%,0.0,,0.0%,665.9825,1,304.72,4281.8,
256,2048,7168,512,257,9,ActivationType.Silu,torch.bfloat16,torch.float8_e4m3fn,torch.float8_e4m3fn,QuantType.per_1x128,1,0,64,0,873.11,_ZN5aiter46fmoe_bf16_blockscaleFp8_g1u1_vs_ps_silu_64x256E,0.0%,0.0,,0.0%,873.11,1,464.86,3291.25,
256,4096,7168,512,257,9,ActivationType.Silu,torch.bfloat16,torch.float8_e4m3fn,torch.float8_e4m3fn,QuantType.per_1x128,1,0,64,0,1291.7424,_ZN5aiter46fmoe_bf16_blockscaleFp8_g1u1_vs_ps_silu_64x256E,0.0%,0.0,,0.0%,1291.7424,1,628.41,2258.7,
256,8192,7168,512,257,9,ActivationType.Silu,torch.bfloat16,torch.float8_e4m3fn,torch.float8_e4m3fn,QuantType.per_1x128,1,0,64,0,2302.1098,_ZN5aiter46fmoe_bf16_blockscaleFp8_g1u1_vs_ps_silu_64x256E,0.0%,0.0,,0.0%,2302.1098,1,705.22,1305.65,
256,16384,7168,512,257,9,ActivationType.Silu,torch.bfloat16,torch.float8_e4m3fn,torch.float8_e4m3fn,QuantType.per_1x128,1,0,64,0,4252.984,_ZN5aiter46fmoe_bf16_blockscaleFp8_g1u1_vs_ps_silu_64x256E,0.0%,0.0,,0.0%,4252.984,1,763.46,748.16,
256,32768,7168,512,257,9,ActivationType.Silu,torch.bfloat16,torch.float8_e4m3fn,torch.float8_e4m3fn,QuantType.per_1x128,1,0,64,0,8268.0128,_ZN5aiter46fmoe_bf16_blockscaleFp8_g1u1_vs_ps_silu_64x256E,0.0%,0.0,,0.0%,8268.0128,1,785.44,427.46,
