aiter/configs/model_configs/a8w8_blockscale_tuned_fmoe_glm5_1.csv
cu_num,token,model_dim,inter_dim,expert,topk,act_type,dtype,q_dtype_a,q_dtype_w,q_type,use_g1u1,doweight_stage1,block_m,ksplit,us1,kernelName1,err1,us2,kernelName2,err2,us,run_1stage,xbf16,tflops,bw,_tag
304,1,6144,2048,32,8,ActivationType.Silu,torch.bfloat16,torch.float8_e4m3fnuz,torch.float8_e4m3fnuz,QuantType.per_1x128,1,0,32,0,85.1113,_ZN5aiter50fmoe_bf16_blockscaleFp8_g1u1_vs_silu_1tg_ps_32x128E,0.0%,0.0,,0.0%,85.1113,1,0,7.1,14192.92,
304,2,6144,2048,32,8,ActivationType.Silu,torch.bfloat16,torch.float8_e4m3fnuz,torch.float8_e4m3fnuz,QuantType.per_1x128,1,0,32,0,139.3279,_ZN5aiter50fmoe_bf16_blockscaleFp8_g1u1_vs_silu_1tg_ps_32x256E,0.0%,0.0,,0.0%,139.3279,1,0,8.67,8670.17,
304,4,6144,2048,32,8,ActivationType.Silu,torch.bfloat16,torch.float8_e4m3fnuz,torch.float8_e4m3fnuz,QuantType.per_1x128,1,0,32,0,207.6314,_ZN5aiter47fmoe_bf16_blockscaleFp8_g1u1_vs_silu_1tg_32x256E,0.0%,0.0,,0.0%,207.6314,1,0,11.64,5818.16,
304,8,6144,2048,32,8,ActivationType.Silu,torch.bfloat16,torch.float8_e4m3fnuz,torch.float8_e4m3fnuz,QuantType.per_1x128,1,0,32,0,241.8714,_ZN5aiter47fmoe_bf16_blockscaleFp8_g1u1_vs_silu_1tg_32x256E,0.0%,0.0,,0.0%,241.8714,1,0,19.98,4994.83,
304,16,6144,2048,32,8,ActivationType.Silu,torch.bfloat16,torch.float8_e4m3fnuz,torch.float8_e4m3fnuz,QuantType.per_1x128,1,0,32,0,279.8341,_ZN5aiter50fmoe_bf16_blockscaleFp8_g1u1_vs_silu_1tg_ps_32x256E,0.0%,0.0,,0.0%,279.8341,1,0,34.53,4317.75,
304,32,6144,2048,32,8,ActivationType.Silu,torch.bfloat16,torch.float8_e4m3fnuz,torch.float8_e4m3fnuz,QuantType.per_1x128,1,0,32,0,293.5291,_ZN5aiter49fmoe_bf16_blockscaleFp8_g1u1_novs_silu_1tg_32x256E,0.0%,0.0,,0.0%,293.5291,1,0,65.84,4117.31,
304,64,6144,2048,32,8,ActivationType.Silu,torch.bfloat16,torch.float8_e4m3fnuz,torch.float8_e4m3fnuz,QuantType.per_1x128,1,0,32,0,302.1429,_ZN5aiter52fmoe_bf16_blockscaleFp8_g1u1_novs_silu_1tg_ps_32x256E,0.0%,0.0,,0.0%,302.1429,1,0,127.94,4001.88,
304,128,6144,2048,32,8,ActivationType.Silu,torch.bfloat16,torch.float8_e4m3fnuz,torch.float8_e4m3fnuz,QuantType.per_1x128,1,0,64,0,334.8752,_ZN5aiter43fmoe_bf16_blockscaleFp8_g1u1_vs_silu_64x256E,0.0%,0.0,,0.0%,334.8752,1,0,230.86,3614.24,
304,256,6144,2048,32,8,ActivationType.Silu,torch.bfloat16,torch.float8_e4m3fnuz,torch.float8_e4m3fnuz,QuantType.per_1x128,1,0,32,0,447.7594,_ZN5aiter47fmoe_bf16_blockscaleFp8_g1u1_vs_silu_1tg_32x256E,0.0%,0.0,,0.0%,447.7594,1,0,345.32,2708.33,
304,1024,6144,2048,32,8,ActivationType.Silu,torch.bfloat16,torch.float8_e4m3fnuz,torch.float8_e4m3fnuz,QuantType.per_1x128,1,0,64,0,986.9189,_ZN5aiter43fmoe_bf16_blockscaleFp8_g1u1_vs_silu_64x256E,0.0%,0.0,,0.0%,986.9189,1,0,626.67,1243.09,
304,2048,6144,2048,32,8,ActivationType.Silu,torch.bfloat16,torch.float8_e4m3fnuz,torch.float8_e4m3fnuz,QuantType.per_1x128,1,0,32,0,1875.2839,_ZN5aiter47fmoe_bf16_blockscaleFp8_g1u1_vs_silu_1tg_32x256E,0.0%,0.0,,0.0%,1875.2839,1,0,659.61,664.28,
304,4096,6144,2048,32,8,ActivationType.Silu,torch.bfloat16,torch.float8_e4m3fnuz,torch.float8_e4m3fnuz,QuantType.per_1x128,1,0,64,0,3401.6051,_ZN5aiter43fmoe_bf16_blockscaleFp8_g1u1_vs_silu_64x256E,0.0%,0.0,,0.0%,3401.6051,1,0,727.27,377.31,
304,8192,6144,2048,32,8,ActivationType.Silu,torch.bfloat16,torch.float8_e4m3fnuz,torch.float8_e4m3fnuz,QuantType.per_1x128,1,0,64,0,6655.1026,_ZN5aiter43fmoe_bf16_blockscaleFp8_g1u1_vs_silu_64x256E,0.0%,0.0,,0.0%,6655.1026,1,0,743.46,204.2,
304,16384,6144,2048,32,8,ActivationType.Silu,torch.bfloat16,torch.float8_e4m3fnuz,torch.float8_e4m3fnuz,QuantType.per_1x128,1,0,64,0,13155.6144,_ZN5aiter43fmoe_bf16_blockscaleFp8_g1u1_vs_silu_64x256E,0.0%,0.0,,0.0%,13155.6144,1,0,752.2,114.78,
304,1,6144,256,257,9,ActivationType.Silu,torch.bfloat16,torch.float8_e4m3fnuz,torch.float8_e4m3fnuz,QuantType.per_1x128,1,0,16,0,35.95,moe_ck2stages_gemm1_256x16x128x256_1x4_MulABScaleExpertWeightA8W8blkscale_v1_Nswizzle0_Quant4_MulRoutedWeight0_silu_F8_F8_B16,0.0%,9.5927,moe_ck2stages_gemm2_256x16x128x256_1x4_MulABScaleExpertWeightA8W8blkscale_v1_Nswizzle0_Quant4_MulRoutedWeight1_F8_F8_B16,10.6%,45.5427,0,0,1.86,26627.68,
304,2,6144,256,257,9,ActivationType.Silu,torch.bfloat16,torch.float8_e4m3fnuz,torch.float8_e4m3fnuz,QuantType.per_1x128,1,0,16,0,36.6764,moe_ck2stages_gemm1_256x16x128x256_1x4_MulABScaleExpertWeightA8W8blkscale_v1_Nswizzle0_Quant4_MulRoutedWeight0_silu_F8_F8_B16,0.0%,15.892,moe_ck2stages_gemm2_128x16x128x128_1x2_MulABScaleExpertWeightA8W8blkscale_v1_Nswizzle0_Quant4_MulRoutedWeight1_F8_F8_B16,13.6%,52.5684,0,0,3.23,23069.28,
304,4,6144,256,257,9,ActivationType.Silu,torch.bfloat16,torch.float8_e4m3fnuz,torch.float8_e4m3fnuz,QuantType.per_1x128,1,0,16,0,39.6469,moe_ck2stages_gemm1_256x16x128x256_1x4_MulABScaleExpertWeightA8W8blkscale_v1_Nswizzle0_Quant4_MulRoutedWeight0_silu_F8_F8_B16,0.0%,22.427,moe_ck2stages_gemm2_256x16x128x256_1x4_MulABScaleExpertWeightA8W8blkscale_v1_Nswizzle0_Quant4_MulRoutedWeight1_F8_F8_B16,15.7%,62.0739,0,0,5.47,19537.23,
304,8,6144,256,257,9,ActivationType.Silu,torch.bfloat16,torch.float8_e4m3fnuz,torch.float8_e4m3fnuz,QuantType.per_1x128,1,0,16,0,49.738,_ZN5aiter59fmoe_stage1_bf16_pertokenFp8_blockscale_g1u1_16x128_4tg_pf3E,33.1%,32.932,moe_ck2stages_gemm2_256x16x128x256_1x4_MulABScaleExpertWeightA8W8blkscale_v1_Nswizzle0_Quant4_MulRoutedWeight1_F8_F8_B16,16.5%,82.67,0,0,8.22,14670.69,
304,16,6144,256,257,9,ActivationType.Silu,torch.bfloat16,torch.float8_e4m3fnuz,torch.float8_e4m3fnuz,QuantType.per_1x128,1,0,16,0,78.7462,_ZN5aiter59fmoe_stage1_bf16_pertokenFp8_blockscale_g1u1_16x128_4tg_pf3E,35.9%,47.935,moe_ck2stages_gemm2_256x16x128x256_1x4_MulABScaleExpertWeightA8W8blkscale_v1_Nswizzle0_Quant4_MulRoutedWeight1_F8_F8_B16,16.5%,126.6812,0,0,10.73,9575.0,
304,32,6144,256,257,9,ActivationType.Silu,torch.bfloat16,torch.float8_e4m3fnuz,torch.float8_e4m3fnuz,QuantType.per_1x128,1,0,16,0,120.6439,_ZN5aiter59fmoe_stage1_bf16_pertokenFp8_blockscale_g1u1_16x128_4tg_pf2E,36.5%,70.4947,moe_ck2stages_gemm2_256x16x128x256_1x4_MulABScaleExpertWeightA8W8blkscale_v1_Nswizzle0_Quant4_MulRoutedWeight1_F8_F8_B16,16.4%,191.1386,0,0,14.22,6347.58,
304,64,6144,256,257,9,ActivationType.Silu,torch.bfloat16,torch.float8_e4m3fnuz,torch.float8_e4m3fnuz,QuantType.per_1x128,1,0,16,0,160.2061,_ZN5aiter59fmoe_stage1_bf16_pertokenFp8_blockscale_g1u1_16x256_2tg_pf3E,19.9%,91.5157,moe_ck2stages_gemm2_256x16x128x256_1x4_MulABScaleExpertWeightA8W8blkscale_v1_Nswizzle0_Quant4_MulRoutedWeight1_F8_F8_B16,16.5%,251.7218,0,0,21.59,4822.22,
304,128,6144,256,257,9,ActivationType.Silu,torch.bfloat16,torch.float8_e4m3fnuz,torch.float8_e4m3fnuz,QuantType.per_1x128,1,0,16,0,177.7069,_ZN5aiter59fmoe_stage1_bf16_pertokenFp8_blockscale_g1u1_16x256_2tg_pf3E,20.1%,100.9798,moe_ck2stages_gemm2_128x16x128x128_1x2_MulABScaleExpertWeightA8W8blkscale_v1_Nswizzle0_Quant4_MulRoutedWeight1_F8_F8_B16,16.5%,278.6867,0,0,39.01,4359.87,
304,256,6144,256,257,9,ActivationType.Silu,torch.bfloat16,torch.float8_e4m3fnuz,torch.float8_e4m3fnuz,QuantType.per_1x128,1,0,16,0,181.2318,_ZN5aiter59fmoe_stage1_bf16_pertokenFp8_blockscale_g1u1_16x256_2tg_pf3E,20.2%,107.7383,moe_ck2stages_gemm2_256x16x128x256_1x4_MulABScaleExpertWeightA8W8blkscale_v1_Nswizzle0_Quant4_MulRoutedWeight1_F8_F8_B16,16.6%,288.9701,0,0,75.24,4212.88,
304,512,6144,256,257,9,ActivationType.Silu,torch.bfloat16,torch.float8_e4m3fnuz,torch.float8_e4m3fnuz,QuantType.per_1x128,1,0,32,0,190.2452,_ZN5aiter59fmoe_stage1_bf16_pertokenFp8_blockscale_g1u1_32x256_2tg_pf3E,6.2%,119.5123,moe_ck2stages_gemm2_256x32x128x128_1x4_MulABScaleExpertWeightA8W8blkscale_v1_Nswizzle0_Quant4_MulRoutedWeight1_F8_F8_B16,16.6%,309.7575,0,0,140.39,3945.39,
304,1024,6144,256,257,9,ActivationType.Silu,torch.bfloat16,torch.float8_e4m3fnuz,torch.float8_e4m3fnuz,QuantType.per_1x128,1,0,32,0,285.1628,_ZN5aiter59fmoe_stage1_bf16_pertokenFp8_blockscale_g1u1_32x256_2tg_pf3E,10.0%,154.3751,moe_ck2stages_gemm2_256x32x128x128_1x4_MulABScaleExpertWeightA8W8blkscale_v1_Nswizzle0_Quant4_MulRoutedWeight1_F8_F8_B16,16.6%,439.5379,0,0,197.87,2801.93,
304,2048,6144,256,257,9,ActivationType.Silu,torch.bfloat16,torch.float8_e4m3fnuz,torch.float8_e4m3fnuz,QuantType.per_1x128,1,0,64,0,324.3111,_ZN5aiter55fmoe_stage1_bf16_pertokenFp8_blockscale_g1u1_64x256_pf2E,7.4%,314.2848,moe_ck2stages_gemm2_256x64x128x128_1x4_MulABScaleExpertWeightA8W8blkscale_v1_Nswizzle0_Quant4_MulRoutedWeight1_F8_F8_B16,16.5%,638.5959,0,0,272.39,1958.09,
304,4096,6144,256,257,9,ActivationType.Silu,torch.bfloat16,torch.float8_e4m3fnuz,torch.float8_e4m3fnuz,QuantType.per_1x128,1,0,64,0,521.335,_ZN5aiter55fmoe_stage1_bf16_pertokenFp8_blockscale_g1u1_64x256_pf3E,7.4%,524.2763,moe_ck2stages_gemm2_256x64x128x128_1x4_MulABScaleExpertWeightA8W8blkscale_v1_Nswizzle0_Quant4_MulRoutedWeight1_F8_F8_B16,16.5%,1045.6113,0,0,332.72,1231.98,
304,8192,6144,256,257,9,ActivationType.Silu,torch.bfloat16,torch.float8_e4m3fnuz,torch.float8_e4m3fnuz,QuantType.per_1x128,1,0,16,0,1006.637,_ZN5aiter59fmoe_stage1_bf16_pertokenFp8_blockscale_g1u1_16x128_4tg_pf3E,35.8%,792.9318,moe_ck2stages_gemm2_128x16x128x128_1x2_MulABScaleExpertWeightA8W8blkscale_v1_Nswizzle0_Quant4_MulRoutedWeight1_F8_F8_B16,16.5%,1799.5688,0,0,386.64,757.78,
304,16384,6144,256,257,9,ActivationType.Silu,torch.bfloat16,torch.float8_e4m3fnuz,torch.float8_e4m3fnuz,QuantType.per_1x128,1,0,32,0,1338.2048,_ZN5aiter59fmoe_stage1_bf16_pertokenFp8_blockscale_g1u1_32x128_3tg_pf2E,18.1%,1577.2405,moe_ck2stages_gemm2_256x32x128x128_1x4_MulABScaleExpertWeightA8W8blkscale_v1_Nswizzle0_Quant4_MulRoutedWeight1_F8_F8_B16,16.5%,2915.4453,0,0,477.31,519.53,
