aiter/configs/model_configs/a8w8_blockscale_tuned_fmoe_glm5.2.csv
gfx,cu_num,token,model_dim,inter_dim,expert,topk,act_type,dtype,q_dtype_a,q_dtype_w,q_type,use_g1u1,doweight_stage1,block_m,ksplit,us1,kernelName1,err1,us2,kernelName2,err2,us,run_1stage,xbf16,flat,tflops,bw,_tag
gfx950,256,1,6144,512,257,9,ActivationType.Silu,torch.bfloat16,torch.float8_e4m3fn,torch.float8_e4m3fn,QuantType.per_1x128,1,0,1,0,51.5356,_ZN5aiter48fmoe_bf16_blockscaleBf16_g1u1_flat_vs_silu_1x128E,0.0%,0.0,,0.0%,51.5356,1,1,1,3.3,47062.12,
gfx950,256,2,6144,512,257,9,ActivationType.Silu,torch.bfloat16,torch.float8_e4m3fn,torch.float8_e4m3fn,QuantType.per_1x128,1,0,16,0,57.7338,_ZN5aiter48fmoe_bf16_blockscaleBf16_g1u1_vs_pf2_silu_16x128E,0.0%,0.0,,0.0%,57.7338,1,1,0,5.88,42009.93,
gfx950,256,4,6144,512,257,9,ActivationType.Silu,torch.bfloat16,torch.float8_e4m3fn,torch.float8_e4m3fn,QuantType.per_1x128,1,0,1,0,64.8158,_ZN5aiter48fmoe_bf16_blockscaleBf16_g1u1_flat_vs_silu_1x128E,0.0%,0.0,,0.0%,64.8158,1,1,1,10.48,37420.35,
gfx950,256,8,6144,512,257,9,ActivationType.Silu,torch.bfloat16,torch.float8_e4m3fn,torch.float8_e4m3fn,QuantType.per_1x128,1,0,1,0,125.7277,_ZN5aiter48fmoe_bf16_blockscaleBf16_g1u1_flat_vs_silu_1x256E,0.0%,0.0,,0.0%,125.7277,1,1,1,10.81,19291.72,
gfx950,256,16,6144,512,257,9,ActivationType.Silu,torch.bfloat16,torch.float8_e4m3fn,torch.float8_e4m3fn,QuantType.per_1x128,1,0,16,0,190.9139,_ZN5aiter48fmoe_bf16_blockscaleBf16_g1u1_vs_pf2_silu_16x256E,0.0%,0.0,,0.0%,190.9139,1,1,0,14.24,12705.47,
gfx950,256,32,6144,512,257,9,ActivationType.Silu,torch.bfloat16,torch.float8_e4m3fn,torch.float8_e4m3fn,QuantType.per_1x128,1,0,16,0,286.7466,_ZN5aiter48fmoe_bf16_blockscaleBf16_g1u1_vs_pf2_silu_16x128E,0.0%,0.0,,0.0%,286.7466,1,1,0,18.96,8460.24,
gfx950,256,64,6144,512,257,9,ActivationType.Silu,torch.bfloat16,torch.float8_e4m3fn,torch.float8_e4m3fn,QuantType.per_1x128,1,0,16,0,371.8268,_ZN5aiter48fmoe_bf16_blockscaleBf16_g1u1_vs_pf2_silu_16x256E,0.0%,0.0,,0.0%,371.8268,1,1,0,29.24,6525.98,
gfx950,256,128,6144,512,257,9,ActivationType.Silu,torch.bfloat16,torch.float8_e4m3fn,torch.float8_e4m3fn,QuantType.per_1x128,1,0,16,0,415.2849,_ZN5aiter48fmoe_bf16_blockscaleBf16_g1u1_vs_pf2_silu_16x256E,0.0%,0.0,,0.0%,415.2849,1,1,0,52.36,5845.9,
gfx950,256,256,6144,512,257,9,ActivationType.Silu,torch.bfloat16,torch.float8_e4m3fn,torch.float8_e4m3fn,QuantType.per_1x128,1,0,16,0,494.7497,_ZN5aiter48fmoe_bf16_blockscaleBf16_g1u1_vs_pf2_silu_16x128E,0.0%,0.0,,0.0%,494.7497,1,1,0,87.9,4911.73,
gfx950,256,512,6144,512,257,9,ActivationType.Silu,torch.bfloat16,torch.float8_e4m3fn,torch.float8_e4m3fn,QuantType.per_1x128,1,0,32,0,533.407,_ZN5aiter47fmoe_bf16_blockscaleFp8_g1u1_vs_silu_1tg_32x256E,0.0%,0.0,,0.0%,533.407,1,0,0,163.05,4564.61,
gfx950,256,1024,6144,512,257,9,ActivationType.Silu,torch.bfloat16,torch.float8_e4m3fn,torch.float8_e4m3fn,QuantType.per_1x128,1,0,64,0,576.4085999999999,_ZN5aiter46fmoe_bf16_blockscaleFp8_g1u1_vs_ps_silu_64x256E,0.0%,0.0,,0.0%,576.4086,1,0,0,301.78,4240.45,
gfx950,256,2048,6144,512,257,9,ActivationType.Silu,torch.bfloat16,torch.float8_e4m3fn,torch.float8_e4m3fn,QuantType.per_1x128,1,0,64,0,784.5818,_ZN5aiter46fmoe_bf16_blockscaleFp8_g1u1_vs_ps_silu_64x256E,0.0%,0.0,,0.0%,784.5818,1,0,0,443.41,3139.39,
gfx950,256,4096,6144,512,257,9,ActivationType.Silu,torch.bfloat16,torch.float8_e4m3fn,torch.float8_e4m3fn,QuantType.per_1x128,1,0,64,0,1149.1644,_ZN5aiter46fmoe_bf16_blockscaleFp8_g1u1_vs_ps_silu_64x256E,0.0%,0.0,,0.0%,1149.1644,1,0,0,605.47,2176.24,
gfx950,256,8192,6144,512,257,9,ActivationType.Silu,torch.bfloat16,torch.float8_e4m3fn,torch.float8_e4m3fn,QuantType.per_1x128,1,0,64,0,2010.3323,_ZN5aiter46fmoe_bf16_blockscaleFp8_g1u1_vs_ps_silu_64x256E,0.0%,0.0,,0.0%,2010.3323,1,0,0,692.21,1281.55,
gfx950,256,16384,6144,512,257,9,ActivationType.Silu,torch.bfloat16,torch.float8_e4m3fn,torch.float8_e4m3fn,QuantType.per_1x128,1,0,64,0,3746.2206,_ZN5aiter46fmoe_bf16_blockscaleFp8_g1u1_vs_ps_silu_64x256E,0.0%,0.0,,0.0%,3746.2206,1,0,0,742.92,728.03,
gfx950,256,32768,6144,512,257,9,ActivationType.Silu,torch.bfloat16,torch.float8_e4m3fn,torch.float8_e4m3fn,QuantType.per_1x128,1,0,64,0,7388.1451,_ZN5aiter46fmoe_bf16_blockscaleFp8_g1u1_vs_ps_silu_64x256E,0.0%,0.0,,0.0%,7388.1451,1,0,0,753.41,410.03,
