aiter/configs/model_configs/a8w8_blockscale_tuned_gemm_glm5_1.csv
gfx,cu_num,M,N,K,libtype,kernelId,splitK,us,kernelName,tflops,bw,errRatio
gfx942,304,1,512,6144,ck,13,3,6.5425,a8w8_blockscale_1x128x128_256x32x64x256_16x16_16x16_2x1_16x16x1_16x16x1_1x32x1x8_8_2x1_intrawave_v1,0.96,481.91,0.0
gfx942,304,2,512,6144,ck,8,3,4.9581,a8w8_blockscale_1x128x128_256x16x64x256_16x16_16x16_1x1_16x16x1_16x16x1_1x16x1x16_4_1x1_intrawave_v1,2.54,637.35,0.0
gfx942,304,4,512,6144,ck,8,3,6.0716,a8w8_blockscale_1x128x128_256x16x64x256_16x16_16x16_1x1_16x16x1_16x16x1_1x16x1x16_4_1x1_intrawave_v1,4.14,522.83,0.0
gfx942,304,8,512,6144,ck,8,3,4.9916,a8w8_blockscale_1x128x128_256x16x64x256_16x16_16x16_1x1_16x16x1_16x16x1_1x16x1x16_4_1x1_intrawave_v1,10.08,641.69,0.0
gfx942,304,16,512,6144,ck,8,3,5.1914,a8w8_blockscale_1x128x128_256x16x64x256_16x16_16x16_1x1_16x16x1_16x16x1_1x16x1x16_4_1x1_intrawave_v1,19.39,628.04,0.0
gfx942,304,32,512,6144,ck,8,3,7.6906,a8w8_blockscale_1x128x128_256x16x64x256_16x16_16x16_1x1_16x16x1_16x16x1_1x16x1x16_4_1x1_intrawave_v1,26.18,438.86,0.0001
gfx942,304,48,512,6144,ck,8,3,8.3615,a8w8_blockscale_1x128x128_256x16x64x256_16x16_16x16_1x1_16x16x1_16x16x1_1x16x1x16_4_1x1_intrawave_v1,36.12,417.36,0.0002
gfx942,304,64,512,6144,ck,8,3,7.6306,a8w8_blockscale_1x128x128_256x16x64x256_16x16_16x16_1x1_16x16x1_16x16x1_1x16x1x16_4_1x1_intrawave_v1,52.77,472.37,0.0001
gfx942,304,80,512,6144,ck,8,2,11.8702,a8w8_blockscale_1x128x128_256x16x64x256_16x16_16x16_1x1_16x16x1_16x16x1_1x16x1x16_4_1x1_intrawave_v1,42.4,313.32,0.0
gfx942,304,96,512,6144,ck,8,3,11.5501,a8w8_blockscale_1x128x128_256x16x64x256_16x16_16x16_1x1_16x16x1_16x16x1_1x16x1x16_4_1x1_intrawave_v1,52.29,331.93,0.0001
gfx942,304,112,512,6144,ck,8,2,11.6648,a8w8_blockscale_1x128x128_256x16x64x256_16x16_16x16_1x1_16x16x1_16x16x1_1x16x1x16_4_1x1_intrawave_v1,60.41,338.5,0.0
gfx942,304,128,512,6144,ck,8,3,10.8236,a8w8_blockscale_1x128x128_256x16x64x256_16x16_16x16_1x1_16x16x1_16x16x1_1x16x1x16_4_1x1_intrawave_v1,74.4,375.4,0.0002
gfx942,304,144,512,6144,ck,8,3,11.6741,a8w8_blockscale_1x128x128_256x16x64x256_16x16_16x16_1x1_16x16x1_16x16x1_1x16x1x16_4_1x1_intrawave_v1,77.61,357.88,0.0002
gfx942,304,160,512,6144,ck,8,3,11.8804,a8w8_blockscale_1x128x128_256x16x64x256_16x16_16x16_1x1_16x16x1_16x16x1_1x16x1x16_4_1x1_intrawave_v1,84.73,361.32,0.0002
gfx942,304,176,512,6144,ck,8,3,12.1368,a8w8_blockscale_1x128x128_256x16x64x256_16x16_16x16_1x1_16x16x1_16x16x1_1x16x1x16_4_1x1_intrawave_v1,91.23,363.13,0.0002
gfx942,304,192,512,6144,ck,8,3,12.2839,a8w8_blockscale_1x128x128_256x16x64x256_16x16_16x16_1x1_16x16x1_16x16x1_1x16x1x16_4_1x1_intrawave_v1,98.34,368.12,0.0002
gfx942,304,208,512,6144,ck,8,3,12.4624,a8w8_blockscale_1x128x128_256x16x64x256_16x16_16x16_1x1_16x16x1_16x16x1_1x16x1x16_4_1x1_intrawave_v1,105.01,372.05,0.0002
gfx942,304,224,512,6144,ck,8,3,12.4708,a8w8_blockscale_1x128x128_256x16x64x256_16x16_16x16_1x1_16x16x1_16x16x1_1x16x1x16_4_1x1_intrawave_v1,113.01,381.0,0.0002
gfx942,304,240,512,6144,ck,8,3,13.9877,a8w8_blockscale_1x128x128_256x16x64x256_16x16_16x16_1x1_16x16x1_16x16x1_1x16x1x16_4_1x1_intrawave_v1,107.95,347.88,0.0001
gfx942,304,256,512,6144,ck,8,3,13.6069,a8w8_blockscale_1x128x128_256x16x64x256_16x16_16x16_1x1_16x16x1_16x16x1_1x16x1x16_4_1x1_intrawave_v1,118.37,366.04,0.0002
gfx942,304,288,512,6144,ck,8,3,14.0531,a8w8_blockscale_1x128x128_256x16x64x256_16x16_16x16_1x1_16x16x1_16x16x1_1x16x1x16_4_1x1_intrawave_v1,128.94,370.74,0.0002
gfx942,304,320,512,6144,ck,8,3,15.6049,a8w8_blockscale_1x128x128_256x16x64x256_16x16_16x16_1x1_16x16x1_16x16x1_1x16x1x16_4_1x1_intrawave_v1,129.01,348.58,0.0002
gfx942,304,352,512,6144,ck,8,3,15.9463,a8w8_blockscale_1x128x128_256x16x64x256_16x16_16x16_1x1_16x16x1_16x16x1_1x16x1x16_4_1x1_intrawave_v1,138.88,355.5,0.0002
gfx942,304,384,512,6144,ck,8,3,17.2483,a8w8_blockscale_1x128x128_256x16x64x256_16x16_16x16_1x1_16x16x1_16x16x1_1x16x1x16_4_1x1_intrawave_v1,140.07,341.96,0.0001
gfx942,304,416,512,6144,ck,8,3,18.1794,a8w8_blockscale_1x128x128_256x16x64x256_16x16_16x16_1x1_16x16x1_16x16x1_1x16x1x16_4_1x1_intrawave_v1,143.97,337.06,0.0003
gfx942,304,448,512,6144,ck,8,3,17.9902,a8w8_blockscale_1x128x128_256x16x64x256_16x16_16x16_1x1_16x16x1_16x16x1_1x16x1x16_4_1x1_intrawave_v1,156.67,353.36,0.0003
gfx942,304,480,512,6144,ck,8,3,19.5921,a8w8_blockscale_1x128x128_256x16x64x256_16x16_16x16_1x1_16x16x1_16x16x1_1x16x1x16_4_1x1_intrawave_v1,154.14,336.17,0.0003
gfx942,304,512,512,6144,ck,18,2,19.3143,a8w8_blockscale_1x128x128_256x64x64x256_16x16_32x32_1x1_16x16x1_16x16x1_1x32x1x8_8_1x1_intrawave_v1,166.78,352.89,0.0
gfx942,304,544,512,6144,ck,18,2,20.0574,a8w8_blockscale_1x128x128_256x64x64x256_16x16_32x32_1x1_16x16x1_16x16x1_1x32x1x8_8_1x1_intrawave_v1,170.64,351.25,0.0
gfx942,304,576,512,6144,ck,18,2,20.8771,a8w8_blockscale_1x128x128_256x64x64x256_16x16_32x32_1x1_16x16x1_16x16x1_1x32x1x8_8_1x1_intrawave_v1,173.58,348.44,0.0
gfx942,304,608,512,6144,ck,8,0,20.5945,a8w8_blockscale_1x128x128_256x16x64x256_16x16_16x16_1x1_16x16x1_16x16x1_1x16x1x16_4_1x1_intrawave_v1,185.74,364.36,0.0
gfx942,304,640,512,6144,ck,18,1,22.6306,a8w8_blockscale_1x128x128_256x64x64x256_16x16_32x32_1x1_16x16x1_16x16x1_1x32x1x8_8_1x1_intrawave_v1,177.92,341.72,0.0
gfx942,304,672,512,6144,ck,8,3,23.495,a8w8_blockscale_1x128x128_256x16x64x256_16x16_16x16_1x1_16x16x1_16x16x1_1x16x1x16_4_1x1_intrawave_v1,179.95,338.91,0.0003
gfx942,304,704,512,6144,ck,18,1,22.8259,a8w8_blockscale_1x128x128_256x64x64x256_16x16_32x32_1x1_16x16x1_16x16x1_1x32x1x8_8_1x1_intrawave_v1,194.04,358.89,0.0
gfx942,304,736,512,6144,ck,18,1,24.2035,a8w8_blockscale_1x128x128_256x64x64x256_16x16_32x32_1x1_16x16x1_16x16x1_1x32x1x8_8_1x1_intrawave_v1,191.32,347.94,0.0
gfx942,304,768,512,6144,ck,18,1,23.1971,a8w8_blockscale_1x128x128_256x64x64x256_16x16_32x32_1x1_16x16x1_16x16x1_1x32x1x8_8_1x1_intrawave_v1,208.29,372.92,0.0
gfx942,304,800,512,6144,ck,18,1,24.7127,a8w8_blockscale_1x128x128_256x64x64x256_16x16_32x32_1x1_16x16x1_16x16x1_1x32x1x8_8_1x1_intrawave_v1,203.67,359.33,0.0
gfx942,304,832,512,6144,ck,18,1,24.0978,a8w8_blockscale_1x128x128_256x64x64x256_16x16_32x32_1x1_16x16x1_16x16x1_1x32x1x8_8_1x1_intrawave_v1,217.22,378.02,0.0
gfx942,304,864,512,6144,ck,18,1,25.3548,a8w8_blockscale_1x128x128_256x64x64x256_16x16_32x32_1x1_16x16x1_16x16x1_1x32x1x8_8_1x1_intrawave_v1,214.39,368.33,0.0
gfx942,304,896,512,6144,ck,18,1,24.5241,a8w8_blockscale_1x128x128_256x64x64x256_16x16_32x32_1x1_16x16x1_16x16x1_1x32x1x8_8_1x1_intrawave_v1,229.86,390.16,0.0
gfx942,304,928,512,6144,ck,18,1,25.5061,a8w8_blockscale_1x128x128_256x64x64x256_16x16_32x32_1x1_16x16x1_16x16x1_1x32x1x8_8_1x1_intrawave_v1,228.9,384.13,0.0
gfx942,304,960,512,6144,ck,18,1,24.1508,a8w8_blockscale_1x128x128_256x64x64x256_16x16_32x32_1x1_16x16x1_16x16x1_1x32x1x8_8_1x1_intrawave_v1,250.09,415.18,0.0
gfx942,304,992,512,6144,ck,18,1,26.0671,a8w8_blockscale_1x128x128_256x64x64x256_16x16_32x32_1x1_16x16x1_16x16x1_1x32x1x8_8_1x1_intrawave_v1,239.43,393.46,0.0
gfx942,304,1024,512,6144,ck,18,1,24.8106,a8w8_blockscale_1x128x128_256x64x64x256_16x16_32x32_1x1_16x16x1_16x16x1_1x32x1x8_8_1x1_intrawave_v1,259.67,422.63,0.0
gfx942,304,1088,512,6144,ck,18,1,26.0173,a8w8_blockscale_1x128x128_256x64x64x256_16x16_32x32_1x1_16x16x1_16x16x1_1x32x1x8_8_1x1_intrawave_v1,263.1,420.66,0.0
gfx942,304,1152,512,6144,ck,18,0,26.8577,a8w8_blockscale_1x128x128_256x64x64x256_16x16_32x32_1x1_16x16x1_16x16x1_1x32x1x8_8_1x1_intrawave_v1,269.86,424.58,0.0
gfx942,304,1216,512,6144,ck,18,0,26.876,a8w8_blockscale_1x128x128_256x64x64x256_16x16_32x32_1x1_16x16x1_16x16x1_1x32x1x8_8_1x1_intrawave_v1,284.66,441.36,0.0
gfx942,304,1280,512,6144,ck,18,0,26.9399,a8w8_blockscale_1x128x128_256x64x64x256_16x16_32x32_1x1_16x16x1_16x16x1_1x32x1x8_8_1x1_intrawave_v1,298.93,457.34,0.0
gfx942,304,1344,512,6144,ck,18,0,27.0195,a8w8_blockscale_1x128x128_256x64x64x256_16x16_32x32_1x1_16x16x1_16x16x1_1x32x1x8_8_1x1_intrawave_v1,312.95,472.97,0.0
gfx942,304,1408,512,6144,ck,18,0,27.2563,a8w8_blockscale_1x128x128_256x64x64x256_16x16_32x32_1x1_16x16x1_16x16x1_1x32x1x8_8_1x1_intrawave_v1,325.0,485.7,0.0
gfx942,304,1472,512,6144,ck,18,0,27.7044,a8w8_blockscale_1x128x128_256x64x64x256_16x16_32x32_1x1_16x16x1_16x16x1_1x32x1x8_8_1x1_intrawave_v1,334.28,494.4,0.0
gfx942,304,1536,512,6144,ck,18,0,26.7989,a8w8_blockscale_1x128x128_256x64x64x256_16x16_32x32_1x1_16x16x1_16x16x1_1x32x1x8_8_1x1_intrawave_v1,360.6,528.22,0.0
gfx942,304,1600,512,6144,ck,18,0,28.1696,a8w8_blockscale_1x128x128_256x64x64x256_16x16_32x32_1x1_16x16x1_16x16x1_1x32x1x8_8_1x1_intrawave_v1,357.35,518.8,0.0
gfx942,304,1664,512,6144,ck,18,0,27.8702,a8w8_blockscale_1x128x128_256x64x64x256_16x16_32x32_1x1_16x16x1_16x16x1_1x32x1x8_8_1x1_intrawave_v1,375.63,540.84,0.0
gfx942,304,1728,512,6144,ck,18,0,28.8486,a8w8_blockscale_1x128x128_256x64x64x256_16x16_32x32_1x1_16x16x1_16x16x1_1x32x1x8_8_1x1_intrawave_v1,376.85,538.4,0.0
gfx942,304,1792,512,6144,ck,18,0,29.7737,a8w8_blockscale_1x128x128_256x64x64x256_16x16_32x32_1x1_16x16x1_16x16x1_1x32x1x8_8_1x1_intrawave_v1,378.67,537.08,0.0
gfx942,304,1856,512,6144,ck,18,0,29.7567,a8w8_blockscale_1x128x128_256x64x64x256_16x16_32x32_1x1_16x16x1_16x16x1_1x32x1x8_8_1x1_intrawave_v1,392.41,552.8,0.0
gfx942,304,1920,512,6144,ck,18,0,29.6104,a8w8_blockscale_1x128x128_256x64x64x256_16x16_32x32_1x1_16x16x1_16x16x1_1x32x1x8_8_1x1_intrawave_v1,407.95,571.03,0.0
gfx942,304,1984,512,6144,ck,18,0,29.5996,a8w8_blockscale_1x128x128_256x64x64x256_16x16_32x32_1x1_16x16x1_16x16x1_1x32x1x8_8_1x1_intrawave_v1,421.7,586.73,0.0
gfx942,304,2048,512,6144,ck,18,0,29.8656,a8w8_blockscale_1x128x128_256x64x64x256_16x16_32x32_1x1_16x16x1_16x16x1_1x32x1x8_8_1x1_intrawave_v1,431.43,596.87,0.0
gfx942,304,2112,512,6144,ck,18,0,29.8626,a8w8_blockscale_1x128x128_256x64x64x256_16x16_32x32_1x1_16x16x1_16x16x1_1x32x1x8_8_1x1_intrawave_v1,444.96,612.29,0.0
gfx942,304,2176,512,6144,ck,18,0,29.1988,a8w8_blockscale_1x128x128_256x64x64x256_16x16_32x32_1x1_16x16x1_16x16x1_1x32x1x8_8_1x1_intrawave_v1,468.86,641.92,0.0
gfx942,304,2240,512,6144,ck,18,0,28.6645,a8w8_blockscale_1x128x128_256x64x64x256_16x16_32x32_1x1_16x16x1_16x16x1_1x32x1x8_8_1x1_intrawave_v1,491.65,669.89,0.0
gfx942,304,2304,512,6144,ck,18,0,31.2467,a8w8_blockscale_1x128x128_256x64x64x256_16x16_32x32_1x1_16x16x1_16x16x1_1x32x1x8_8_1x1_intrawave_v1,463.91,629.21,0.0
gfx942,304,2368,512,6144,ck,18,0,32.8039,a8w8_blockscale_1x128x128_256x64x64x256_16x16_32x32_1x1_16x16x1_16x16x1_1x32x1x8_8_1x1_intrawave_v1,454.16,613.33,0.0
gfx942,304,2432,512,6144,ck,18,0,31.9868,a8w8_blockscale_1x128x128_256x64x64x256_16x16_32x32_1x1_16x16x1_16x16x1_1x32x1x8_8_1x1_intrawave_v1,478.35,643.34,0.0
gfx942,304,2496,512,6144,ck,3,0,48.4027,a8w8_blockscale_1x128x128_256x64x64x128_16x16_32x32_1x1_8x32x1_8x32x1_1x32x1x8_8_1x1_intrawave_v3,324.43,434.63,0.0
gfx942,304,2560,512,6144,ck,3,0,44.8005,a8w8_blockscale_1x128x128_256x64x64x128_16x16_32x32_1x1_8x32x1_8x32x1_1x32x1x8_8_1x1_intrawave_v3,359.51,479.81,0.0
gfx942,304,2624,512,6144,ck,3,0,49.2105,a8w8_blockscale_1x128x128_256x64x64x128_16x16_32x32_1x1_8x32x1_8x32x1_1x32x1x8_8_1x1_intrawave_v3,335.47,446.14,0.0
gfx942,304,2688,512,6144,ck,3,0,49.7845,a8w8_blockscale_1x128x128_256x64x64x128_16x16_32x32_1x1_8x32x1_8x32x1_1x32x1x8_8_1x1_intrawave_v3,339.69,450.21,0.0
gfx942,304,2752,512,6144,ck,3,0,46.1198,a8w8_blockscale_1x128x128_256x64x64x128_16x16_32x32_1x1_8x32x1_8x32x1_1x32x1x8_8_1x1_intrawave_v3,375.42,495.93,0.0
gfx942,304,2816,512,6144,ck,3,0,48.0495,a8w8_blockscale_1x128x128_256x64x64x128_16x16_32x32_1x1_8x32x1_8x32x1_1x32x1x8_8_1x1_intrawave_v3,368.72,485.56,0.0
gfx942,304,2880,512,6144,ck,3,0,49.6395,a8w8_blockscale_1x128x128_256x64x64x128_16x16_32x32_1x1_8x32x1_8x32x1_1x32x1x8_8_1x1_intrawave_v3,365.02,479.25,0.0
gfx942,304,2944,512,6144,ck,3,0,49.1249,a8w8_blockscale_1x128x128_256x64x64x128_16x16_32x32_1x1_8x32x1_8x32x1_1x32x1x8_8_1x1_intrawave_v3,377.04,493.61,0.0
gfx942,304,3008,512,6144,ck,3,0,49.2158,a8w8_blockscale_1x128x128_256x64x64x128_16x16_32x32_1x1_8x32x1_8x32x1_1x32x1x8_8_1x1_intrawave_v3,384.52,502.02,0.0
gfx942,304,3072,512,6144,ck,3,0,45.5966,a8w8_blockscale_1x128x128_256x64x64x128_16x16_32x32_1x1_8x32x1_8x32x1_1x32x1x8_8_1x1_intrawave_v3,423.88,551.92,0.0
gfx942,304,3136,512,6144,ck,3,0,53.5755,a8w8_blockscale_1x128x128_256x64x64x128_16x16_32x32_1x1_8x32x1_8x32x1_1x32x1x8_8_1x1_intrawave_v3,368.27,478.29,0.0
gfx942,304,3200,512,6144,ck,3,0,47.8487,a8w8_blockscale_1x128x128_256x64x64x128_16x16_32x32_1x1_8x32x1_8x32x1_1x32x1x8_8_1x1_intrawave_v3,420.76,545.12,0.0
gfx942,304,3264,512,6144,ck,3,0,47.5616,a8w8_blockscale_1x128x128_256x64x64x128_16x16_32x32_1x1_8x32x1_8x32x1_1x32x1x8_8_1x1_intrawave_v3,431.76,558.06,0.0
gfx942,304,3328,512,6144,ck,3,0,49.3427,a8w8_blockscale_1x128x128_256x64x64x128_16x16_32x32_1x1_8x32x1_8x32x1_1x32x1x8_8_1x1_intrawave_v3,424.34,547.21,0.0
gfx942,304,3392,512,6144,ck,3,0,52.7098,a8w8_blockscale_1x128x128_256x64x64x128_16x16_32x32_1x1_8x32x1_8x32x1_1x32x1x8_8_1x1_intrawave_v3,404.87,520.96,0.0
gfx942,304,3456,512,6144,ck,3,0,51.3267,a8w8_blockscale_1x128x128_256x64x64x128_16x16_32x32_1x1_8x32x1_8x32x1_1x32x1x8_8_1x1_intrawave_v3,423.62,543.93,0.0
gfx942,304,3520,512,6144,ck,3,0,53.8536,a8w8_blockscale_1x128x128_256x64x64x128_16x16_32x32_1x1_8x32x1_8x32x1_1x32x1x8_8_1x1_intrawave_v3,411.22,526.93,0.0
gfx942,304,3584,512,6144,ck,3,0,53.622,a8w8_blockscale_1x128x128_256x64x64x128_16x16_32x32_1x1_8x32x1_8x32x1_1x32x1x8_8_1x1_intrawave_v3,420.51,537.76,0.0
gfx942,304,3648,512,6144,ck,3,0,53.8845,a8w8_blockscale_1x128x128_256x64x64x128_16x16_32x32_1x1_8x32x1_8x32x1_1x32x1x8_8_1x1_intrawave_v3,425.93,543.66,0.0
gfx942,304,3712,512,6144,ck,3,0,54.0457,a8w8_blockscale_1x128x128_256x64x64x128_16x16_32x32_1x1_8x32x1_8x32x1_1x32x1x8_8_1x1_intrawave_v3,432.11,550.52,0.0
gfx942,304,3776,512,6144,ck,3,0,54.3724,a8w8_blockscale_1x128x128_256x64x64x128_16x16_32x32_1x1_8x32x1_8x32x1_1x32x1x8_8_1x1_intrawave_v3,436.92,555.65,0.0
gfx942,304,3840,512,6144,ck,3,0,54.946,a8w8_blockscale_1x128x128_256x64x64x128_16x16_32x32_1x1_8x32x1_8x32x1_1x32x1x8_8_1x1_intrawave_v3,439.69,558.2,0.0
gfx942,304,3904,512,6144,ck,3,0,54.3554,a8w8_blockscale_1x128x128_256x64x64x128_16x16_32x32_1x1_8x32x1_8x32x1_1x32x1x8_8_1x1_intrawave_v3,451.87,572.7,0.0
gfx942,304,3968,512,6144,ck,3,0,55.9928,a8w8_blockscale_1x128x128_256x64x64x128_16x16_32x32_1x1_8x32x1_8x32x1_1x32x1x8_8_1x1_intrawave_v3,445.85,564.15,0.0
gfx942,304,4032,512,6144,ck,3,0,55.5314,a8w8_blockscale_1x128x128_256x64x64x128_16x16_32x32_1x1_8x32x1_8x32x1_1x32x1x8_8_1x1_intrawave_v3,456.81,577.1,0.0
gfx942,304,4096,512,6144,ck,3,0,53.6314,a8w8_blockscale_1x128x128_256x64x64x128_16x16_32x32_1x1_8x32x1_8x32x1_1x32x1x8_8_1x1_intrawave_v3,480.5,606.1,0.0
gfx942,304,4224,512,6144,ck,3,0,56.4868,a8w8_blockscale_1x128x128_256x64x64x128_16x16_32x32_1x1_8x32x1_8x32x1_1x32x1x8_8_1x1_intrawave_v3,470.47,591.7,0.0
gfx942,304,4352,512,6144,ck,3,0,57.0004,a8w8_blockscale_1x128x128_256x64x64x128_16x16_32x32_1x1_8x32x1_8x32x1_1x32x1x8_8_1x1_intrawave_v3,480.35,602.47,0.0
gfx942,304,4480,512,6144,ck,3,0,57.8402,a8w8_blockscale_1x128x128_256x64x64x128_16x16_32x32_1x1_8x32x1_8x32x1_1x32x1x8_8_1x1_intrawave_v3,487.3,609.58,0.0
gfx942,304,4608,512,6144,ck,3,0,58.4308,a8w8_blockscale_1x128x128_256x64x64x128_16x16_32x32_1x1_8x32x1_8x32x1_1x32x1x8_8_1x1_intrawave_v3,496.16,619.12,0.0
gfx942,304,4736,512,6144,ck,3,0,58.8596,a8w8_blockscale_1x128x128_256x64x64x128_16x16_32x32_1x1_8x32x1_8x32x1_1x32x1x8_8_1x1_intrawave_v3,506.23,630.2,0.0
gfx942,304,4864,512,6144,ck,2,0,59.9758,a8w8_blockscale_1x128x128_256x64x128x128_16x16_32x32_1x2_8x32x1_8x32x1_1x32x1x8_8_1x1_intrawave_v3,510.23,633.77,0.0
gfx942,304,4992,512,6144,ck,2,0,75.0548,a8w8_blockscale_1x128x128_256x64x128x128_16x16_32x32_1x2_8x32x1_8x32x1_1x32x1x8_8_1x1_intrawave_v3,418.45,518.67,0.0
gfx942,304,5120,512,6144,ck,2,0,74.717,a8w8_blockscale_1x128x128_256x64x128x128_16x16_32x32_1x2_8x32x1_8x32x1_1x32x1x8_8_1x1_intrawave_v3,431.12,533.29,0.0
gfx942,304,5248,512,6144,ck,2,0,76.9503,a8w8_blockscale_1x128x128_256x64x128x128_16x16_32x32_1x2_8x32x1_8x32x1_1x32x1x8_8_1x1_intrawave_v3,429.08,529.74,0.0
gfx942,304,5376,512,6144,ck,2,0,75.787,a8w8_blockscale_1x128x128_256x64x128x128_16x16_32x32_1x2_8x32x1_8x32x1_1x32x1x8_8_1x1_intrawave_v3,446.29,549.97,0.0
gfx942,304,5504,512,6144,ck,2,0,75.6374,a8w8_blockscale_1x128x128_256x64x128x128_16x16_32x32_1x2_8x32x1_8x32x1_1x32x1x8_8_1x1_intrawave_v3,457.82,563.19,0.0
gfx942,304,5632,512,6144,ck,2,0,75.8894,a8w8_blockscale_1x128x128_256x64x128x128_16x16_32x32_1x2_8x32x1_8x32x1_1x32x1x8_8_1x1_intrawave_v3,466.91,573.41,0.0
gfx942,304,5760,512,6144,ck,2,0,77.8077,a8w8_blockscale_1x128x128_256x64x128x128_16x16_32x32_1x2_8x32x1_8x32x1_1x32x1x8_8_1x1_intrawave_v3,465.75,571.07,0.0
gfx942,304,5888,512,6144,ck,2,0,76.3548,a8w8_blockscale_1x128x128_256x64x128x128_16x16_32x32_1x2_8x32x1_8x32x1_1x32x1x8_8_1x1_intrawave_v3,485.16,593.95,0.0
gfx942,304,6016,512,6144,ck,3,0,79.83,a8w8_blockscale_1x128x128_256x64x64x128_16x16_32x32_1x1_8x32x1_8x32x1_1x32x1x8_8_1x1_intrawave_v3,474.13,579.59,0.0
gfx942,304,6144,512,6144,ck,3,0,76.5647,a8w8_blockscale_1x128x128_256x64x64x128_16x16_32x32_1x1_8x32x1_8x32x1_1x32x1x8_8_1x1_intrawave_v3,504.86,616.29,0.0
gfx942,304,6272,512,6144,ck,2,0,78.5846,a8w8_blockscale_1x128x128_256x64x128x128_16x16_32x32_1x2_8x32x1_8x32x1_1x32x1x8_8_1x1_intrawave_v3,502.13,612.12,0.0
gfx942,304,6400,512,6144,ck,2,0,80.4134,a8w8_blockscale_1x128x128_256x64x128x128_16x16_32x32_1x2_8x32x1_8x32x1_1x32x1x8_8_1x1_intrawave_v3,500.73,609.61,0.0
gfx942,304,6528,512,6144,ck,2,0,78.6634,a8w8_blockscale_1x128x128_256x64x128x128_16x16_32x32_1x2_8x32x1_8x32x1_1x32x1x8_8_1x1_intrawave_v3,522.11,634.84,0.0
gfx942,304,6656,512,6144,ck,2,0,80.2823,a8w8_blockscale_1x128x128_256x64x128x128_16x16_32x32_1x2_8x32x1_8x32x1_1x32x1x8_8_1x1_intrawave_v3,521.61,633.46,0.0
gfx942,304,6784,512,6144,ck,2,0,81.9042,a8w8_blockscale_1x128x128_256x64x128x128_16x16_32x32_1x2_8x32x1_8x32x1_1x32x1x8_8_1x1_intrawave_v3,521.11,632.12,0.0
gfx942,304,6912,512,6144,ck,2,0,81.5827,a8w8_blockscale_1x128x128_256x64x128x128_16x16_32x32_1x2_8x32x1_8x32x1_1x32x1x8_8_1x1_intrawave_v3,533.04,645.86,0.0
gfx942,304,7040,512,6144,ck,2,0,80.3233,a8w8_blockscale_1x128x128_256x64x128x128_16x16_32x32_1x2_8x32x1_8x32x1_1x32x1x8_8_1x1_intrawave_v3,551.42,667.41,0.0
gfx942,304,7168,512,6144,ck,2,0,81.8524,a8w8_blockscale_1x128x128_256x64x128x128_16x16_32x32_1x2_8x32x1_8x32x1_1x32x1x8_8_1x1_intrawave_v3,550.96,666.15,0.0
gfx942,304,7296,512,6144,ck,2,0,84.1223,a8w8_blockscale_1x128x128_256x64x128x128_16x16_32x32_1x2_8x32x1_8x32x1_1x32x1x8_8_1x1_intrawave_v3,545.66,659.08,0.0
gfx942,304,7424,512,6144,ck,2,0,81.6736,a8w8_blockscale_1x128x128_256x64x128x128_16x16_32x32_1x2_8x32x1_8x32x1_1x32x1x8_8_1x1_intrawave_v3,571.88,690.08,0.0
gfx942,304,7552,512,6144,ck,2,0,83.7007,a8w8_blockscale_1x128x128_256x64x128x128_16x16_32x32_1x2_8x32x1_8x32x1_1x32x1x8_8_1x1_intrawave_v3,567.65,684.32,0.0
gfx942,304,7680,512,6144,ck,2,0,82.9325,a8w8_blockscale_1x128x128_256x64x128x128_16x16_32x32_1x2_8x32x1_8x32x1_1x32x1x8_8_1x1_intrawave_v3,582.62,701.73,0.0
gfx942,304,7808,512,6144,ck,2,0,83.587,a8w8_blockscale_1x128x128_256x64x128x128_16x16_32x32_1x2_8x32x1_8x32x1_1x32x1x8_8_1x1_intrawave_v3,587.7,707.21,0.0
gfx942,304,7936,512,6144,ck,2,0,83.5625,a8w8_blockscale_1x128x128_256x64x128x128_16x16_32x32_1x2_8x32x1_8x32x1_1x32x1x8_8_1x1_intrawave_v3,597.5,718.4,0.0
gfx942,304,8064,512,6144,ck,2,0,85.9581,a8w8_blockscale_1x128x128_256x64x128x128_16x16_32x32_1x2_8x32x1_8x32x1_1x32x1x8_8_1x1_intrawave_v3,590.22,709.05,0.0
gfx942,304,8192,512,6144,ck,2,0,84.4281,a8w8_blockscale_1x128x128_256x64x128x128_16x16_32x32_1x2_8x32x1_8x32x1_1x32x1x8_8_1x1_intrawave_v3,610.46,732.77,0.0
gfx942,304,8320,512,6144,ck,2,0,85.6995,a8w8_blockscale_1x128x128_256x64x128x128_16x16_32x32_1x2_8x32x1_8x32x1_1x32x1x8_8_1x1_intrawave_v3,610.8,732.6,0.0
gfx942,304,8448,512,6144,ck,2,0,84.1051,a8w8_blockscale_1x128x128_256x64x128x128_16x16_32x32_1x2_8x32x1_8x32x1_1x32x1x8_8_1x1_intrawave_v3,631.95,757.4,0.0
gfx942,304,8576,512,6144,ck,2,0,86.808,a8w8_blockscale_1x128x128_256x64x128x128_16x16_32x32_1x2_8x32x1_8x32x1_1x32x1x8_8_1x1_intrawave_v3,621.55,744.38,0.0
gfx942,304,8704,512,6144,ck,2,0,87.7821,a8w8_blockscale_1x128x128_256x64x128x128_16x16_32x32_1x2_8x32x1_8x32x1_1x32x1x8_8_1x1_intrawave_v3,623.83,746.58,0.0
gfx942,304,8832,512,6144,ck,2,0,87.6477,a8w8_blockscale_1x128x128_256x64x128x128_16x16_32x32_1x2_8x32x1_8x32x1_1x32x1x8_8_1x1_intrawave_v3,633.97,758.19,0.0
gfx942,304,8960,512,6144,ck,2,0,87.0296,a8w8_blockscale_1x128x128_256x64x128x128_16x16_32x32_1x2_8x32x1_8x32x1_1x32x1x8_8_1x1_intrawave_v3,647.73,774.12,0.0
gfx942,304,9088,512,6144,ck,2,0,86.8532,a8w8_blockscale_1x128x128_256x64x128x128_16x16_32x32_1x2_8x32x1_8x32x1_1x32x1x8_8_1x1_intrawave_v3,658.31,786.25,0.0
gfx942,304,9216,512,6144,ck,2,0,88.9097,a8w8_blockscale_1x128x128_256x64x128x128_16x16_32x32_1x2_8x32x1_8x32x1_1x32x1x8_8_1x1_intrawave_v3,652.15,778.39,0.0
gfx942,304,9344,512,6144,ck,2,0,89.3807,a8w8_blockscale_1x128x128_256x64x128x128_16x16_32x32_1x2_8x32x1_8x32x1_1x32x1x8_8_1x1_intrawave_v3,657.72,784.55,0.0
gfx942,304,9472,512,6144,ck,0,0,90.1434,a8w8_blockscale_1x128x128_256x128x128x128_16x16_32x32_2x2_8x32x1_8x32x1_1x32x1x8_8_1x1_intrawave_v3,661.09,788.09,0.0
gfx942,304,9600,512,6144,ck,0,0,90.0629,a8w8_blockscale_1x128x128_256x128x128x128_16x16_32x32_2x2_8x32x1_8x32x1_1x32x1x8_8_1x1_intrawave_v3,670.62,798.98,0.0
gfx942,304,9728,512,6144,ck,0,0,90.6888,a8w8_blockscale_1x128x128_256x128x128x128_16x16_32x32_2x2_8x32x1_8x32x1_1x32x1x8_8_1x1_intrawave_v3,674.87,803.58,0.0
gfx942,304,9856,512,6144,ck,0,0,113.4593,a8w8_blockscale_1x128x128_256x128x128x128_16x16_32x32_2x2_8x32x1_8x32x1_1x32x1x8_8_1x1_intrawave_v3,546.53,650.4,0.0
gfx942,304,9984,512,6144,ck,0,0,115.2319,a8w8_blockscale_1x128x128_256x128x128x128_16x16_32x32_2x2_8x32x1_8x32x1_1x32x1x8_8_1x1_intrawave_v3,545.11,648.35,0.0
gfx942,304,10112,512,6144,ck,0,0,114.9299,a8w8_blockscale_1x128x128_256x128x128x128_16x16_32x32_2x2_8x32x1_8x32x1_1x32x1x8_8_1x1_intrawave_v3,553.55,658.04,0.0
gfx942,304,10240,512,6144,ck,0,0,113.2025,a8w8_blockscale_1x128x128_256x128x128x128_16x16_32x32_2x2_8x32x1_8x32x1_1x32x1x8_8_1x1_intrawave_v3,569.11,676.19,0.0
gfx942,304,10368,512,6144,ck,0,0,115.7077,a8w8_blockscale_1x128x128_256x128x128x128_16x16_32x32_2x2_8x32x1_8x32x1_1x32x1x8_8_1x1_intrawave_v3,563.75,669.48,0.0
gfx942,304,10496,512,6144,ck,0,0,117.9192,a8w8_blockscale_1x128x128_256x128x128x128_16x16_32x32_2x2_8x32x1_8x32x1_1x32x1x8_8_1x1_intrawave_v3,560.0,664.7,0.0
gfx942,304,10624,512,6144,ck,0,0,115.6057,a8w8_blockscale_1x128x128_256x128x128x128_16x16_32x32_2x2_8x32x1_8x32x1_1x32x1x8_8_1x1_intrawave_v3,578.18,685.94,0.0
gfx942,304,10752,512,6144,ck,0,0,115.8854,a8w8_blockscale_1x128x128_256x128x128x128_16x16_32x32_2x2_8x32x1_8x32x1_1x32x1x8_8_1x1_intrawave_v3,583.73,692.2,0.0
gfx942,304,10880,512,6144,ck,0,0,116.4719,a8w8_blockscale_1x128x128_256x128x128x128_16x16_32x32_2x2_8x32x1_8x32x1_1x32x1x8_8_1x1_intrawave_v3,587.7,696.59,0.0
gfx942,304,11008,512,6144,ck,0,0,114.9268,a8w8_blockscale_1x128x128_256x128x128x128_16x16_32x32_2x2_8x32x1_8x32x1_1x32x1x8_8_1x1_intrawave_v3,602.61,713.94,0.0
gfx942,304,11136,512,6144,ck,0,0,114.2545,a8w8_blockscale_1x128x128_256x128x128x128_16x16_32x32_2x2_8x32x1_8x32x1_1x32x1x8_8_1x1_intrawave_v3,613.21,726.17,0.0
gfx942,304,11264,512,6144,ck,0,0,114.7145,a8w8_blockscale_1x128x128_256x128x128x128_16x16_32x32_2x2_8x32x1_8x32x1_1x32x1x8_8_1x1_intrawave_v3,617.77,731.26,0.0
gfx942,304,11392,512,6144,ck,0,0,120.466,a8w8_blockscale_1x128x128_256x128x128x128_16x16_32x32_2x2_8x32x1_8x32x1_1x32x1x8_8_1x1_intrawave_v3,594.96,703.96,0.0
gfx942,304,11520,512,6144,ck,0,0,120.9229,a8w8_blockscale_1x128x128_256x128x128x128_16x16_32x32_2x2_8x32x1_8x32x1_1x32x1x8_8_1x1_intrawave_v3,599.37,708.89,0.0
gfx942,304,11648,512,6144,ck,0,0,123.3852,a8w8_blockscale_1x128x128_256x128x128x128_16x16_32x32_2x2_8x32x1_8x32x1_1x32x1x8_8_1x1_intrawave_v3,593.94,702.18,0.0
gfx942,304,11776,512,6144,ck,0,0,124.6739,a8w8_blockscale_1x128x128_256x128x128x128_16x16_32x32_2x2_8x32x1_8x32x1_1x32x1x8_8_1x1_intrawave_v3,594.26,702.28,0.0
gfx942,304,11904,512,6144,ck,2,0,125.6687,a8w8_blockscale_1x128x128_256x64x128x128_16x16_32x32_1x2_8x32x1_8x32x1_1x32x1x8_8_1x1_intrawave_v3,595.96,704.02,0.0
gfx942,304,12032,512,6144,ck,2,0,125.3455,a8w8_blockscale_1x128x128_256x64x128x128_16x16_32x32_1x2_8x32x1_8x32x1_1x32x1x8_8_1x1_intrawave_v3,603.92,713.16,0.0
gfx942,304,12160,512,6144,ck,0,0,114.9325,a8w8_blockscale_1x128x128_256x128x128x128_16x16_32x32_2x2_8x32x1_8x32x1_1x32x1x8_8_1x1_intrawave_v3,665.64,785.75,0.0
gfx942,304,12288,512,6144,ck,0,0,115.9582,a8w8_blockscale_1x128x128_256x128x128x128_16x16_32x32_2x2_8x32x1_8x32x1_1x32x1x8_8_1x1_intrawave_v3,666.7,786.72,0.0
gfx942,304,12416,512,6144,ck,0,0,121.2148,a8w8_blockscale_1x128x128_256x128x128x128_16x16_32x32_2x2_8x32x1_8x32x1_1x32x1x8_8_1x1_intrawave_v3,644.43,760.17,0.0
gfx942,304,12544,512,6144,ck,0,0,125.1084,a8w8_blockscale_1x128x128_256x128x128x128_16x16_32x32_2x2_8x32x1_8x32x1_1x32x1x8_8_1x1_intrawave_v3,630.81,743.84,0.0
gfx942,304,12672,512,6144,ck,2,0,126.6322,a8w8_blockscale_1x128x128_256x64x128x128_16x16_32x32_1x2_8x32x1_8x32x1_1x32x1x8_8_1x1_intrawave_v3,629.58,742.14,0.0
gfx942,304,12800,512,6144,ck,0,0,130.8199,a8w8_blockscale_1x128x128_256x128x128x128_16x16_32x32_2x2_8x32x1_8x32x1_1x32x1x8_8_1x1_intrawave_v3,615.58,725.4,0.0
gfx942,304,12928,512,6144,ck,2,0,128.7998,a8w8_blockscale_1x128x128_256x64x128x128_16x16_32x32_1x2_8x32x1_8x32x1_1x32x1x8_8_1x1_intrawave_v3,631.49,743.9,0.0
gfx942,304,13056,512,6144,ck,2,0,128.0755,a8w8_blockscale_1x128x128_256x64x128x128_16x16_32x32_1x2_8x32x1_8x32x1_1x32x1x8_8_1x1_intrawave_v3,641.35,755.27,0.0
gfx942,304,13184,512,6144,ck,0,0,129.8751,a8w8_blockscale_1x128x128_256x128x128x128_16x16_32x32_2x2_8x32x1_8x32x1_1x32x1x8_8_1x1_intrawave_v3,638.66,751.87,0.0
gfx942,304,13312,512,6144,ck,2,0,131.0491,a8w8_blockscale_1x128x128_256x64x128x128_16x16_32x32_1x2_8x32x1_8x32x1_1x32x1x8_8_1x1_intrawave_v3,639.09,752.13,0.0
gfx942,304,13440,512,6144,ck,0,0,130.6219,a8w8_blockscale_1x128x128_256x128x128x128_16x16_32x32_2x2_8x32x1_8x32x1_1x32x1x8_8_1x1_intrawave_v3,647.34,761.62,0.0
gfx942,304,13568,512,6144,ck,2,0,131.0911,a8w8_blockscale_1x128x128_256x64x128x128_16x16_32x32_1x2_8x32x1_8x32x1_1x32x1x8_8_1x1_intrawave_v3,651.17,765.89,0.0
gfx942,304,13696,512,6144,ck,0,0,131.4656,a8w8_blockscale_1x128x128_256x128x128x128_16x16_32x32_2x2_8x32x1_8x32x1_1x32x1x8_8_1x1_intrawave_v3,655.44,770.69,0.0
gfx942,304,13824,512,6144,ck,0,0,130.5988,a8w8_blockscale_1x128x128_256x128x128x128_16x16_32x32_2x2_8x32x1_8x32x1_1x32x1x8_8_1x1_intrawave_v3,665.96,782.83,0.0
gfx942,304,13952,512,6144,ck,0,0,130.9021,a8w8_blockscale_1x128x128_256x128x128x128_16x16_32x32_2x2_8x32x1_8x32x1_1x32x1x8_8_1x1_intrawave_v3,670.57,788.02,0.0
gfx942,304,14080,512,6144,ck,0,0,131.1621,a8w8_blockscale_1x128x128_256x128x128x128_16x16_32x32_2x2_8x32x1_8x32x1_1x32x1x8_8_1x1_intrawave_v3,675.38,793.45,0.0
gfx942,304,14208,512,6144,ck,0,0,132.1899,a8w8_blockscale_1x128x128_256x128x128x128_16x16_32x32_2x2_8x32x1_8x32x1_1x32x1x8_8_1x1_intrawave_v3,676.22,794.23,0.0
gfx942,304,14336,512,6144,ck,0,0,131.8427,a8w8_blockscale_1x128x128_256x128x128x128_16x16_32x32_2x2_8x32x1_8x32x1_1x32x1x8_8_1x1_intrawave_v3,684.11,803.28,0.0
gfx942,304,14464,512,6144,ck,0,0,129.4974,a8w8_blockscale_1x128x128_256x128x128x128_16x16_32x32_2x2_8x32x1_8x32x1_1x32x1x8_8_1x1_intrawave_v3,702.71,824.91,0.0
gfx942,304,14592,512,6144,ck,0,0,133.8169,a8w8_blockscale_1x128x128_256x128x128x128_16x16_32x32_2x2_8x32x1_8x32x1_1x32x1x8_8_1x1_intrawave_v3,686.05,805.14,0.0
gfx942,304,14720,512,6144,ck,0,0,132.8211,a8w8_blockscale_1x128x128_256x128x128x128_16x16_32x32_2x2_8x32x1_8x32x1_1x32x1x8_8_1x1_intrawave_v3,697.26,818.08,0.0
gfx942,304,14848,512,6144,ck,0,0,131.463,a8w8_blockscale_1x128x128_256x128x128x128_16x16_32x32_2x2_8x32x1_8x32x1_1x32x1x8_8_1x1_intrawave_v3,710.58,833.51,0.0
gfx942,304,14976,512,6144,ck,0,0,132.3216,a8w8_blockscale_1x128x128_256x128x128x128_16x16_32x32_2x2_8x32x1_8x32x1_1x32x1x8_8_1x1_intrawave_v3,712.06,835.04,0.0
gfx942,304,15104,512,6144,ck,0,0,133.7873,a8w8_blockscale_1x128x128_256x128x128x128_16x16_32x32_2x2_8x32x1_8x32x1_1x32x1x8_8_1x1_intrawave_v3,710.28,832.75,0.0
gfx942,304,15232,512,6144,ck,0,0,131.7009,a8w8_blockscale_1x128x128_256x128x128x128_16x16_32x32_2x2_8x32x1_8x32x1_1x32x1x8_8_1x1_intrawave_v3,727.64,852.91,0.0
gfx942,304,15360,512,6144,ck,0,0,133.7478,a8w8_blockscale_1x128x128_256x128x128x128_16x16_32x32_2x2_8x32x1_8x32x1_1x32x1x8_8_1x1_intrawave_v3,722.53,846.71,0.0
gfx942,304,15488,512,6144,ck,0,0,136.6642,a8w8_blockscale_1x128x128_256x128x128x128_16x16_32x32_2x2_8x32x1_8x32x1_1x32x1x8_8_1x1_intrawave_v3,713.0,835.36,0.0
gfx942,304,15616,512,6144,ck,0,0,134.3135,a8w8_blockscale_1x128x128_256x128x128x128_16x16_32x32_2x2_8x32x1_8x32x1_1x32x1x8_8_1x1_intrawave_v3,731.48,856.81,0.0
gfx942,304,15744,512,6144,ck,0,0,135.7691,a8w8_blockscale_1x128x128_256x128x128x128_16x16_32x32_2x2_8x32x1_8x32x1_1x32x1x8_8_1x1_intrawave_v3,729.57,854.38,0.0
gfx942,304,15872,512,6144,ck,0,0,133.3137,a8w8_blockscale_1x128x128_256x128x128x128_16x16_32x32_2x2_8x32x1_8x32x1_1x32x1x8_8_1x1_intrawave_v3,749.05,877.0,0.0
gfx942,304,16000,512,6144,ck,0,0,139.8611,a8w8_blockscale_1x128x128_256x128x128x128_16x16_32x32_2x2_8x32x1_8x32x1_1x32x1x8_8_1x1_intrawave_v3,719.74,842.51,0.0
gfx942,304,16128,512,6144,ck,0,0,136.2899,a8w8_blockscale_1x128x128_256x128x128x128_16x16_32x32_2x2_8x32x1_8x32x1_1x32x1x8_8_1x1_intrawave_v3,744.51,871.31,0.0
gfx942,304,16256,512,6144,ck,0,0,134.5467,a8w8_blockscale_1x128x128_256x128x128x128_16x16_32x32_2x2_8x32x1_8x32x1_1x32x1x8_8_1x1_intrawave_v3,760.14,889.42,0.0
gfx942,304,16384,512,6144,ck,0,0,128.6837,a8w8_blockscale_1x128x128_256x128x128x128_16x16_32x32_2x2_8x32x1_8x32x1_1x32x1x8_8_1x1_intrawave_v3,801.03,937.07,0.0
gfx942,304,16512,512,6144,ck,0,0,134.9455,a8w8_blockscale_1x128x128_256x128x128x128_16x16_32x32_2x2_8x32x1_8x32x1_1x32x1x8_8_1x1_intrawave_v3,769.83,900.39,0.0
gfx942,304,1,2048,2048,ck,8,2,5.2213,a8w8_blockscale_1x128x128_256x16x64x256_16x16_16x16_1x1_16x16x1_16x16x1_1x16x1x16_4_1x1_intrawave_v1,1.61,804.48,0.0
gfx942,304,2,2048,2048,ck,8,2,5.1371,a8w8_blockscale_1x128x128_256x16x64x256_16x16_16x16_1x1_16x16x1_16x16x1_1x16x1x16_4_1x1_intrawave_v1,3.27,818.87,0.0
gfx942,304,4,2048,2048,ck,6,3,6.5547,a8w8_blockscale_1x128x128_256x16x64x128_8x16_16x16_1x1_16x16x1_8x32x1_1x16x1x16_4_1x1_intrawave_v1,5.12,643.64,0.0
gfx942,304,8,2048,2048,ck,8,3,8.087,a8w8_blockscale_1x128x128_256x16x64x256_16x16_16x16_1x1_16x16x1_16x16x1_1x16x1x16_4_1x1_intrawave_v1,8.3,524.73,0.0
gfx942,304,16,2048,2048,ck,6,3,6.7277,a8w8_blockscale_1x128x128_256x16x64x128_8x16_16x16_1x1_16x16x1_8x32x1_1x16x1x16_4_1x1_intrawave_v1,19.95,638.05,0.0
gfx942,304,32,2048,2048,ck,8,2,7.4262,a8w8_blockscale_1x128x128_256x16x64x256_16x16_16x16_1x1_16x16x1_16x16x1_1x16x1x16_4_1x1_intrawave_v1,36.15,591.27,0.0
gfx942,304,48,2048,2048,ck,8,2,7.2953,a8w8_blockscale_1x128x128_256x16x64x256_16x16_16x16_1x1_16x16x1_16x16x1_1x16x1x16_4_1x1_intrawave_v1,55.19,615.36,0.0
gfx942,304,64,2048,2048,ck,8,2,7.7236,a8w8_blockscale_1x128x128_256x16x64x256_16x16_16x16_1x1_16x16x1_16x16x1_1x16x1x16_4_1x1_intrawave_v1,69.51,593.96,0.0
gfx942,304,80,2048,2048,ck,8,0,8.3529,a8w8_blockscale_1x128x128_256x16x64x256_16x16_16x16_1x1_16x16x1_16x16x1_1x16x1x16_4_1x1_intrawave_v1,80.34,560.98,0.0
gfx942,304,96,2048,2048,ck,8,0,8.4249,a8w8_blockscale_1x128x128_256x16x64x256_16x16_16x16_1x1_16x16x1_16x16x1_1x16x1x16_4_1x1_intrawave_v1,95.59,567.86,0.0
gfx942,304,112,2048,2048,ck,8,0,8.3482,a8w8_blockscale_1x128x128_256x16x64x256_16x16_16x16_1x1_16x16x1_16x16x1_1x16x1x16_4_1x1_intrawave_v1,112.54,584.85,0.0
gfx942,304,128,2048,2048,ck,8,0,8.4088,a8w8_blockscale_1x128x128_256x16x64x256_16x16_16x16_1x1_16x16x1_16x16x1_1x16x1x16_4_1x1_intrawave_v1,127.69,592.32,0.0
gfx942,304,144,2048,2048,ck,8,0,8.7269,a8w8_blockscale_1x128x128_256x16x64x256_16x16_16x16_1x1_16x16x1_16x16x1_1x16x1x16_4_1x1_intrawave_v1,138.42,582.0,0.0
gfx942,304,160,2048,2048,ck,13,0,10.8718,a8w8_blockscale_1x128x128_256x32x64x256_16x16_16x16_2x1_16x16x1_16x16x1_1x32x1x8_8_2x1_intrawave_v1,123.45,476.22,0.0
gfx942,304,176,2048,2048,ck,13,0,10.974,a8w8_blockscale_1x128x128_256x32x64x256_16x16_16x16_2x1_16x16x1_16x16x1_1x32x1x8_8_2x1_intrawave_v1,134.54,480.74,0.0
gfx942,304,192,2048,2048,ck,13,0,10.9516,a8w8_blockscale_1x128x128_256x32x64x256_16x16_16x16_2x1_16x16x1_16x16x1_1x32x1x8_8_2x1_intrawave_v1,147.07,490.7,0.0
gfx942,304,208,2048,2048,ck,13,0,10.9881,a8w8_blockscale_1x128x128_256x32x64x256_16x16_16x16_2x1_16x16x1_16x16x1_1x32x1x8_8_2x1_intrawave_v1,158.79,498.02,0.0
gfx942,304,224,2048,2048,ck,13,0,10.7316,a8w8_blockscale_1x128x128_256x32x64x256_16x16_16x16_2x1_16x16x1_16x16x1_1x32x1x8_8_2x1_intrawave_v1,175.09,519.08,0.0
gfx942,304,240,2048,2048,ck,13,0,10.7019,a8w8_blockscale_1x128x128_256x32x64x256_16x16_16x16_2x1_16x16x1_16x16x1_1x32x1x8_8_2x1_intrawave_v1,188.12,529.71,0.0
gfx942,304,256,2048,2048,ck,13,0,10.6421,a8w8_blockscale_1x128x128_256x32x64x256_16x16_16x16_2x1_16x16x1_16x16x1_1x32x1x8_8_2x1_intrawave_v1,201.79,541.92,0.0
gfx942,304,288,2048,2048,ck,13,0,11.0703,a8w8_blockscale_1x128x128_256x32x64x256_16x16_16x16_2x1_16x16x1_16x16x1_1x32x1x8_8_2x1_intrawave_v1,218.23,538.72,0.0
gfx942,304,320,2048,2048,ck,18,0,11.0619,a8w8_blockscale_1x128x128_256x64x64x256_16x16_32x32_1x1_16x16x1_16x16x1_1x32x1x8_8_1x1_intrawave_v1,242.67,556.9,0.0
gfx942,304,352,2048,2048,ck,18,0,11.9698,a8w8_blockscale_1x128x128_256x64x64x256_16x16_32x32_1x1_16x16x1_16x16x1_1x32x1x8_8_1x1_intrawave_v1,246.69,531.09,0.0
gfx942,304,384,2048,2048,ck,18,0,11.1774,a8w8_blockscale_1x128x128_256x64x64x256_16x16_32x32_1x1_16x16x1_16x16x1_1x32x1x8_8_1x1_intrawave_v1,288.19,586.33,0.0
gfx942,304,416,2048,2048,ck,18,0,12.0233,a8w8_blockscale_1x128x128_256x64x64x256_16x16_32x32_1x1_16x16x1_16x16x1_1x32x1x8_8_1x1_intrawave_v1,290.24,561.43,0.0
gfx942,304,448,2048,2048,ck,18,0,11.3023,a8w8_blockscale_1x128x128_256x64x64x256_16x16_32x32_1x1_16x16x1_16x16x1_1x32x1x8_8_1x1_intrawave_v1,332.51,614.64,0.0
gfx942,304,480,2048,2048,ck,18,0,12.2411,a8w8_blockscale_1x128x128_256x64x64x256_16x16_32x32_1x1_16x16x1_16x16x1_1x32x1x8_8_1x1_intrawave_v1,328.94,583.56,0.0
gfx942,304,512,2048,2048,ck,18,0,11.3952,a8w8_blockscale_1x128x128_256x64x64x256_16x16_32x32_1x1_16x16x1_16x16x1_1x32x1x8_8_1x1_intrawave_v1,376.91,644.13,0.0
gfx942,304,544,2048,2048,ck,18,0,12.6138,a8w8_blockscale_1x128x128_256x64x64x256_16x16_32x32_1x1_16x16x1_16x16x1_1x32x1x8_8_1x1_intrawave_v1,361.78,597.49,0.0
gfx942,304,576,2048,2048,ck,18,0,12.6212,a8w8_blockscale_1x128x128_256x64x64x256_16x16_32x32_1x1_16x16x1_16x16x1_1x32x1x8_8_1x1_intrawave_v1,382.84,612.72,0.0
gfx942,304,608,2048,2048,ck,12,0,14.5566,a8w8_blockscale_1x128x128_256x32x128x256_16x16_32x32_1x1_16x16x1_16x16x1_1x32x1x8_8_1x1_intrawave_v1,350.38,544.76,0.0
gfx942,304,640,2048,2048,ck,3,0,17.7006,a8w8_blockscale_1x128x128_256x64x64x128_16x16_32x32_1x1_8x32x1_8x32x1_1x32x1x8_8_1x1_intrawave_v3,303.31,459.11,0.0
gfx942,304,672,2048,2048,ck,3,0,18.0632,a8w8_blockscale_1x128x128_256x64x64x128_16x16_32x32_1x1_8x32x1_8x32x1_1x32x1x8_8_1x1_intrawave_v3,312.08,460.78,0.0
gfx942,304,704,2048,2048,ck,3,0,17.9226,a8w8_blockscale_1x128x128_256x64x64x128_16x16_32x32_1x1_8x32x1_8x32x1_1x32x1x8_8_1x1_intrawave_v3,329.5,475.36,0.0
gfx942,304,736,2048,2048,ck,3,0,17.226,a8w8_blockscale_1x128x128_256x64x64x128_16x16_32x32_1x1_8x32x1_8x32x1_1x32x1x8_8_1x1_intrawave_v3,358.41,506.0,0.0
gfx942,304,768,2048,2048,ck,3,0,17.5381,a8w8_blockscale_1x128x128_256x64x64x128_16x16_32x32_1x1_8x32x1_8x32x1_1x32x1x8_8_1x1_intrawave_v3,367.34,508.2,0.0
gfx942,304,800,2048,2048,ck,3,0,18.7027,a8w8_blockscale_1x128x128_256x64x64x128_16x16_32x32_1x1_8x32x1_8x32x1_1x32x1x8_8_1x1_intrawave_v3,358.82,487.07,0.0
gfx942,304,832,2048,2048,ck,3,0,18.5799,a8w8_blockscale_1x128x128_256x64x64x128_16x16_32x32_1x1_8x32x1_8x32x1_1x32x1x8_8_1x1_intrawave_v3,375.64,500.87,0.0
gfx942,304,864,2048,2048,ck,3,0,18.51,a8w8_blockscale_1x128x128_256x64x64x128_16x16_32x32_1x1_8x32x1_8x32x1_1x32x1x8_8_1x1_intrawave_v3,391.56,513.38,0.0
gfx942,304,896,2048,2048,ck,3,0,18.9905,a8w8_blockscale_1x128x128_256x64x64x128_16x16_32x32_1x1_8x32x1_8x32x1_1x32x1x8_8_1x1_intrawave_v3,395.79,510.75,0.0
gfx942,304,928,2048,2048,ck,3,0,19.3498,a8w8_blockscale_1x128x128_256x64x64x128_16x16_32x32_1x1_8x32x1_8x32x1_1x32x1x8_8_1x1_intrawave_v3,402.31,511.42,0.0
gfx942,304,960,2048,2048,ck,3,0,19.6618,a8w8_blockscale_1x128x128_256x64x64x128_16x16_32x32_1x1_8x32x1_8x32x1_1x32x1x8_8_1x1_intrawave_v3,409.58,513.31,0.0
gfx942,304,992,2048,2048,ck,3,0,19.7498,a8w8_blockscale_1x128x128_256x64x64x128_16x16_32x32_1x1_8x32x1_8x32x1_1x32x1x8_8_1x1_intrawave_v3,421.35,520.97,0.0
gfx942,304,1024,2048,2048,ck,18,0,20.6782,a8w8_blockscale_1x128x128_256x64x64x256_16x16_32x32_1x1_16x16x1_16x16x1_1x32x1x8_8_1x1_intrawave_v1,415.41,507.09,0.0
gfx942,304,1088,2048,2048,ck,3,0,20.3729,a8w8_blockscale_1x128x128_256x64x64x128_16x16_32x32_1x1_8x32x1_8x32x1_1x32x1x8_8_1x1_intrawave_v3,447.99,533.99,0.0
gfx942,304,1152,2048,2048,ck,18,0,21.3677,a8w8_blockscale_1x128x128_256x64x64x256_16x16_32x32_1x1_16x16x1_16x16x1_1x32x1x8_8_1x1_intrawave_v1,452.26,527.53,0.0
gfx942,304,1216,2048,2048,ck,18,0,21.0238,a8w8_blockscale_1x128x128_256x64x64x256_16x16_32x32_1x1_16x16x1_16x16x1_1x32x1x8_8_1x1_intrawave_v1,485.19,554.87,0.0
gfx942,304,1280,2048,2048,ck,3,0,27.3172,a8w8_blockscale_1x128x128_256x64x64x128_16x16_32x32_1x1_8x32x1_8x32x1_1x32x1x8_8_1x1_intrawave_v3,393.06,441.43,0.0
gfx942,304,1344,2048,2048,ck,3,0,28.2527,a8w8_blockscale_1x128x128_256x64x64x128_16x16_32x32_1x1_8x32x1_8x32x1_1x32x1x8_8_1x1_intrawave_v3,399.05,440.73,0.0
gfx942,304,1408,2048,2048,ck,3,0,27.9085,a8w8_blockscale_1x128x128_256x64x64x128_16x16_32x32_1x1_8x32x1_8x32x1_1x32x1x8_8_1x1_intrawave_v3,423.21,460.26,0.0
gfx942,304,1472,2048,2048,ck,0,0,28.6069,a8w8_blockscale_1x128x128_256x128x128x128_16x16_32x32_2x2_8x32x1_8x32x1_1x32x1x8_8_1x1_intrawave_v3,431.65,462.76,0.0
gfx942,304,1536,2048,2048,ck,3,0,28.8096,a8w8_blockscale_1x128x128_256x64x64x128_16x16_32x32_1x1_8x32x1_8x32x1_1x32x1x8_8_1x1_intrawave_v3,447.24,473.16,0.0
gfx942,304,1600,2048,2048,ck,0,0,29.2154,a8w8_blockscale_1x128x128_256x128x128x128_16x16_32x32_2x2_8x32x1_8x32x1_1x32x1x8_8_1x1_intrawave_v3,459.41,480.04,0.0
gfx942,304,1664,2048,2048,ck,3,0,29.2905,a8w8_blockscale_1x128x128_256x64x64x128_16x16_32x32_1x1_8x32x1_8x32x1_1x32x1x8_8_1x1_intrawave_v3,476.56,492.24,0.0
gfx942,304,1728,2048,2048,ck,18,0,28.6633,a8w8_blockscale_1x128x128_256x64x64x256_16x16_32x32_1x1_16x16x1_16x16x1_1x32x1x8_8_1x1_intrawave_v1,505.72,516.73,0.0
gfx942,304,1792,2048,2048,ck,18,0,28.8497,a8w8_blockscale_1x128x128_256x64x64x256_16x16_32x32_1x1_16x16x1_16x16x1_1x32x1x8_8_1x1_intrawave_v1,521.06,527.02,0.0
gfx942,304,1856,2048,2048,ck,0,0,30.4947,a8w8_blockscale_1x128x128_256x128x128x128_16x16_32x32_2x2_8x32x1_8x32x1_1x32x1x8_8_1x1_intrawave_v3,510.56,511.48,0.0
gfx942,304,1920,2048,2048,ck,0,0,30.9739,a8w8_blockscale_1x128x128_256x128x128x128_16x16_32x32_2x2_8x32x1_8x32x1_1x32x1x8_8_1x1_intrawave_v3,519.99,516.27,0.0
gfx942,304,1984,2048,2048,ck,0,0,30.4759,a8w8_blockscale_1x128x128_256x128x128x128_16x16_32x32_2x2_8x32x1_8x32x1_1x32x1x8_8_1x1_intrawave_v3,546.1,537.61,0.0
gfx942,304,2048,2048,2048,ck,2,0,32.4811,a8w8_blockscale_1x128x128_256x64x128x128_16x16_32x32_1x2_8x32x1_8x32x1_1x32x1x8_8_1x1_intrawave_v3,528.92,516.52,0.0
gfx942,304,2112,2048,2048,ck,0,0,30.79,a8w8_blockscale_1x128x128_256x128x128x128_16x16_32x32_2x2_8x32x1_8x32x1_1x32x1x8_8_1x1_intrawave_v3,575.41,557.66,0.0
gfx942,304,2176,2048,2048,ck,0,0,31.9047,a8w8_blockscale_1x128x128_256x128x128x128_16x16_32x32_2x2_8x32x1_8x32x1_1x32x1x8_8_1x1_intrawave_v3,572.13,550.5,0.0
gfx942,304,2240,2048,2048,ck,0,0,31.7741,a8w8_blockscale_1x128x128_256x128x128x128_16x16_32x32_2x2_8x32x1_8x32x1_1x32x1x8_8_1x1_intrawave_v3,591.38,565.14,0.0
gfx942,304,2304,2048,2048,ck,0,0,33.4654,a8w8_blockscale_1x128x128_256x128x128x128_16x16_32x32_2x2_8x32x1_8x32x1_1x32x1x8_8_1x1_intrawave_v3,577.53,548.33,0.0
gfx942,304,2368,2048,2048,ck,0,0,33.2818,a8w8_blockscale_1x128x128_256x128x128x128_16x16_32x32_2x2_8x32x1_8x32x1_1x32x1x8_8_1x1_intrawave_v3,596.85,563.17,0.0
gfx942,304,2432,2048,2048,ck,0,0,33.3838,a8w8_blockscale_1x128x128_256x128x128x128_16x16_32x32_2x2_8x32x1_8x32x1_1x32x1x8_8_1x1_intrawave_v3,611.11,573.23,0.0
gfx942,304,2496,2048,2048,ck,0,0,42.4761,a8w8_blockscale_1x128x128_256x128x128x128_16x16_32x32_2x2_8x32x1_8x32x1_1x32x1x8_8_1x1_intrawave_v3,492.94,459.78,0.0
gfx942,304,2560,2048,2048,ck,0,0,43.8637,a8w8_blockscale_1x128x128_256x128x128x128_16x16_32x32_2x2_8x32x1_8x32x1_1x32x1x8_8_1x1_intrawave_v3,489.58,454.2,0.0
gfx942,304,2624,2048,2048,ck,0,0,45.575,a8w8_blockscale_1x128x128_256x128x128x128_16x16_32x32_2x2_8x32x1_8x32x1_1x32x1x8_8_1x1_intrawave_v3,482.98,445.77,0.0
gfx942,304,2688,2048,2048,ck,0,0,44.8575,a8w8_blockscale_1x128x128_256x128x128x128_16x16_32x32_2x2_8x32x1_8x32x1_1x32x1x8_8_1x1_intrawave_v3,502.67,461.67,0.0
gfx942,304,2752,2048,2048,ck,0,0,43.6837,a8w8_blockscale_1x128x128_256x128x128x128_16x16_32x32_2x2_8x32x1_8x32x1_1x32x1x8_8_1x1_intrawave_v3,528.47,483.08,0.0
gfx942,304,2816,2048,2048,ck,0,0,44.3223,a8w8_blockscale_1x128x128_256x128x128x128_16x16_32x32_2x2_8x32x1_8x32x1_1x32x1x8_8_1x1_intrawave_v3,532.97,484.99,0.0
gfx942,304,2880,2048,2048,ck,0,0,45.4474,a8w8_blockscale_1x128x128_256x128x128x128_16x16_32x32_2x2_8x32x1_8x32x1_1x32x1x8_8_1x1_intrawave_v3,531.59,481.63,0.0
gfx942,304,2944,2048,2048,ck,0,0,45.2506,a8w8_blockscale_1x128x128_256x128x128x128_16x16_32x32_2x2_8x32x1_8x32x1_1x32x1x8_8_1x1_intrawave_v3,545.76,492.42,0.0
gfx942,304,3008,2048,2048,ck,0,0,44.4137,a8w8_blockscale_1x128x128_256x128x128x128_16x16_32x32_2x2_8x32x1_8x32x1_1x32x1x8_8_1x1_intrawave_v3,568.13,510.55,0.0
gfx942,304,3072,2048,2048,ck,0,0,46.9155,a8w8_blockscale_1x128x128_256x128x128x128_16x16_32x32_2x2_8x32x1_8x32x1_1x32x1x8_8_1x1_intrawave_v3,549.28,491.71,0.0
gfx942,304,3136,2048,2048,ck,0,0,45.6034,a8w8_blockscale_1x128x128_256x128x128x128_16x16_32x32_2x2_8x32x1_8x32x1_1x32x1x8_8_1x1_intrawave_v3,576.86,514.48,0.0
gfx942,304,3200,2048,2048,ck,0,0,47.2032,a8w8_blockscale_1x128x128_256x128x128x128_16x16_32x32_2x2_8x32x1_8x32x1_1x32x1x8_8_1x1_intrawave_v3,568.68,505.37,0.0
gfx942,304,3264,2048,2048,ck,0,0,47.0706,a8w8_blockscale_1x128x128_256x128x128x128_16x16_32x32_2x2_8x32x1_8x32x1_1x32x1x8_8_1x1_intrawave_v3,581.69,515.15,0.0
gfx942,304,3328,2048,2048,ck,0,0,47.522,a8w8_blockscale_1x128x128_256x128x128x128_16x16_32x32_2x2_8x32x1_8x32x1_1x32x1x8_8_1x1_intrawave_v3,587.46,518.53,0.0
gfx942,304,3392,2048,2048,ck,0,0,48.4742,a8w8_blockscale_1x128x128_256x128x128x128_16x16_32x32_2x2_8x32x1_8x32x1_1x32x1x8_8_1x1_intrawave_v3,587.0,516.46,0.0
gfx942,304,3456,2048,2048,ck,0,0,48.8923,a8w8_blockscale_1x128x128_256x128x128x128_16x16_32x32_2x2_8x32x1_8x32x1_1x32x1x8_8_1x1_intrawave_v3,592.96,520.08,0.0
gfx942,304,3520,2048,2048,ck,0,0,48.7475,a8w8_blockscale_1x128x128_256x128x128x128_16x16_32x32_2x2_8x32x1_8x32x1_1x32x1x8_8_1x1_intrawave_v3,605.73,529.69,0.0
gfx942,304,3584,2048,2048,ck,0,0,47.3535,a8w8_blockscale_1x128x128_256x128x128x128_16x16_32x32_2x2_8x32x1_8x32x1_1x32x1x8_8_1x1_intrawave_v3,634.9,553.59,0.0
gfx942,304,3648,2048,2048,ck,0,0,47.3593,a8w8_blockscale_1x128x128_256x128x128x128_16x16_32x32_2x2_8x32x1_8x32x1_1x32x1x8_8_1x1_intrawave_v3,646.16,561.82,0.0
gfx942,304,3712,2048,2048,ck,0,0,47.5985,a8w8_blockscale_1x128x128_256x128x128x128_16x16_32x32_2x2_8x32x1_8x32x1_1x32x1x8_8_1x1_intrawave_v3,654.19,567.26,0.0
gfx942,304,3776,2048,2048,ck,0,0,47.5768,a8w8_blockscale_1x128x128_256x128x128x128_16x16_32x32_2x2_8x32x1_8x32x1_1x32x1x8_8_1x1_intrawave_v3,665.77,575.79,0.0
gfx942,304,3840,2048,2048,ck,0,0,50.3699,a8w8_blockscale_1x128x128_256x128x128x128_16x16_32x32_2x2_8x32x1_8x32x1_1x32x1x8_8_1x1_intrawave_v3,639.51,551.66,0.0
gfx942,304,3904,2048,2048,ck,0,0,49.5573,a8w8_blockscale_1x128x128_256x128x128x128_16x16_32x32_2x2_8x32x1_8x32x1_1x32x1x8_8_1x1_intrawave_v3,660.83,568.64,0.0
gfx942,304,3968,2048,2048,ck,0,0,49.7307,a8w8_blockscale_1x128x128_256x128x128x128_16x16_32x32_2x2_8x32x1_8x32x1_1x32x1x8_8_1x1_intrawave_v3,669.32,574.57,0.0
gfx942,304,4032,2048,2048,ck,0,0,49.4053,a8w8_blockscale_1x128x128_256x128x128x128_16x16_32x32_2x2_8x32x1_8x32x1_1x32x1x8_8_1x1_intrawave_v3,684.6,586.31,0.0
gfx942,304,4096,2048,2048,ck,0,0,49.5981,a8w8_blockscale_1x128x128_256x128x128x128_16x16_32x32_2x2_8x32x1_8x32x1_1x32x1x8_8_1x1_intrawave_v3,692.76,591.96,0.0
gfx942,304,4224,2048,2048,ck,0,0,51.2164,a8w8_blockscale_1x128x128_256x128x128x128_16x16_32x32_2x2_8x32x1_8x32x1_1x32x1x8_8_1x1_intrawave_v3,691.84,588.61,0.0
gfx942,304,4352,2048,2048,ck,0,0,52.8477,a8w8_blockscale_1x128x128_256x128x128x128_16x16_32x32_2x2_8x32x1_8x32x1_1x32x1x8_8_1x1_intrawave_v3,690.8,585.32,0.0
gfx942,304,4480,2048,2048,ck,0,0,53.8743,a8w8_blockscale_1x128x128_256x128x128x128_16x16_32x32_2x2_8x32x1_8x32x1_1x32x1x8_8_1x1_intrawave_v3,697.57,588.77,0.0
gfx942,304,4608,2048,2048,ck,0,0,53.5085,a8w8_blockscale_1x128x128_256x128x128x128_16x16_32x32_2x2_8x32x1_8x32x1_1x32x1x8_8_1x1_intrawave_v3,722.4,607.49,0.0
gfx942,304,4736,2048,2048,ck,0,0,54.3708,a8w8_blockscale_1x128x128_256x128x128x128_16x16_32x32_2x2_8x32x1_8x32x1_1x32x1x8_8_1x1_intrawave_v3,730.69,612.32,0.0
gfx942,304,4864,2048,2048,ck,0,0,57.0733,a8w8_blockscale_1x128x128_256x128x128x128_16x16_32x32_2x2_8x32x1_8x32x1_1x32x1x8_8_1x1_intrawave_v3,714.91,597.1,0.0
gfx942,304,4992,2048,2048,ck,0,0,73.2075,a8w8_blockscale_1x128x128_256x128x128x128_16x16_32x32_2x2_8x32x1_8x32x1_1x32x1x8_8_1x1_intrawave_v3,572.02,476.25,0.0
gfx942,304,5120,2048,2048,ck,0,0,70.2335,a8w8_blockscale_1x128x128_256x128x128x128_16x16_32x32_2x2_8x32x1_8x32x1_1x32x1x8_8_1x1_intrawave_v3,611.53,507.62,0.0
gfx942,304,5248,2048,2048,ck,0,0,70.2296,a8w8_blockscale_1x128x128_256x128x128x128_16x16_32x32_2x2_8x32x1_8x32x1_1x32x1x8_8_1x1_intrawave_v3,626.85,518.84,0.0
gfx942,304,5376,2048,2048,ck,0,0,71.1018,a8w8_blockscale_1x128x128_256x128x128x128_16x16_32x32_2x2_8x32x1_8x32x1_1x32x1x8_8_1x1_intrawave_v3,634.26,523.54,0.0
gfx942,304,5504,2048,2048,ck,0,0,70.7098,a8w8_blockscale_1x128x128_256x128x128x128_16x16_32x32_2x2_8x32x1_8x32x1_1x32x1x8_8_1x1_intrawave_v3,652.96,537.56,0.0
gfx942,304,5632,2048,2048,ck,0,0,71.3349,a8w8_blockscale_1x128x128_256x128x128x128_16x16_32x32_2x2_8x32x1_8x32x1_1x32x1x8_8_1x1_intrawave_v3,662.29,543.88,0.0
gfx942,304,5760,2048,2048,ck,0,0,72.5048,a8w8_blockscale_1x128x128_256x128x128x128_16x16_32x32_2x2_8x32x1_8x32x1_1x32x1x8_8_1x1_intrawave_v3,666.42,545.95,0.0
gfx942,304,5888,2048,2048,ck,0,0,72.814,a8w8_blockscale_1x128x128_256x128x128x128_16x16_32x32_2x2_8x32x1_8x32x1_1x32x1x8_8_1x1_intrawave_v3,678.33,554.43,0.0
gfx942,304,6016,2048,2048,ck,0,0,71.6364,a8w8_blockscale_1x128x128_256x128x128x128_16x16_32x32_2x2_8x32x1_8x32x1_1x32x1x8_8_1x1_intrawave_v3,704.47,574.52,0.0
gfx942,304,6144,2048,2048,ck,0,0,72.0549,a8w8_blockscale_1x128x128_256x128x128x128_16x16_32x32_2x2_8x32x1_8x32x1_1x32x1x8_8_1x1_intrawave_v3,715.28,582.1,0.0
gfx942,304,6272,2048,2048,ck,0,0,76.2236,a8w8_blockscale_1x128x128_256x128x128x128_16x16_32x32_2x2_8x32x1_8x32x1_1x32x1x8_8_1x1_intrawave_v3,690.25,560.58,0.0
gfx942,304,6400,2048,2048,ck,0,0,76.9141,a8w8_blockscale_1x128x128_256x128x128x128_16x16_32x32_2x2_8x32x1_8x32x1_1x32x1x8_8_1x1_intrawave_v3,698.01,565.77,0.0
gfx942,304,6528,2048,2048,ck,0,0,76.2983,a8w8_blockscale_1x128x128_256x128x128x128_16x16_32x32_2x2_8x32x1_8x32x1_1x32x1x8_8_1x1_intrawave_v3,717.72,580.65,0.0
gfx942,304,6656,2048,2048,ck,0,0,73.8022,a8w8_blockscale_1x128x128_256x128x128x128_16x16_32x32_2x2_8x32x1_8x32x1_1x32x1x8_8_1x1_intrawave_v3,756.54,610.94,0.0
gfx942,304,6784,2048,2048,ck,0,0,77.7558,a8w8_blockscale_1x128x128_256x128x128x128_16x16_32x32_2x2_8x32x1_8x32x1_1x32x1x8_8_1x1_intrawave_v3,731.89,589.99,0.0
gfx942,304,6912,2048,2048,ck,0,0,82.3889,a8w8_blockscale_1x128x128_256x128x128x128_16x16_32x32_2x2_8x32x1_8x32x1_1x32x1x8_8_1x1_intrawave_v3,703.76,566.36,0.0
gfx942,304,7040,2048,2048,ck,0,0,76.5275,a8w8_blockscale_1x128x128_256x128x128x128_16x16_32x32_2x2_8x32x1_8x32x1_1x32x1x8_8_1x1_intrawave_v3,771.69,620.01,0.0
gfx942,304,7168,2048,2048,ck,0,0,77.5276,a8w8_blockscale_1x128x128_256x128x128x128_16x16_32x32_2x2_8x32x1_8x32x1_1x32x1x8_8_1x1_intrawave_v3,775.59,622.16,0.0
gfx942,304,7296,2048,2048,ck,0,0,79.2692,a8w8_blockscale_1x128x128_256x128x128x128_16x16_32x32_2x2_8x32x1_8x32x1_1x32x1x8_8_1x1_intrawave_v3,772.09,618.41,0.0
gfx942,304,7424,2048,2048,ck,0,0,91.3364,a8w8_blockscale_1x128x128_256x128x128x128_16x16_32x32_2x2_8x32x1_8x32x1_1x32x1x8_8_1x1_intrawave_v3,681.84,545.32,0.0
gfx942,304,7552,2048,2048,ck,0,0,89.3041,a8w8_blockscale_1x128x128_256x128x128x128_16x16_32x32_2x2_8x32x1_8x32x1_1x32x1x8_8_1x1_intrawave_v3,709.38,566.53,0.0
gfx942,304,7680,2048,2048,ck,0,0,89.7012,a8w8_blockscale_1x128x128_256x128x128x128_16x16_32x32_2x2_8x32x1_8x32x1_1x32x1x8_8_1x1_intrawave_v3,718.21,572.79,0.0
gfx942,304,7808,2048,2048,ck,0,0,96.3999,a8w8_blockscale_1x128x128_256x128x128x128_16x16_32x32_2x2_8x32x1_8x32x1_1x32x1x8_8_1x1_intrawave_v3,679.44,541.15,0.0
gfx942,304,7936,2048,2048,ck,0,0,92.9942,a8w8_blockscale_1x128x128_256x128x128x128_16x16_32x32_2x2_8x32x1_8x32x1_1x32x1x8_8_1x1_intrawave_v3,715.87,569.42,0.0
gfx942,304,8064,2048,2048,ck,0,0,92.4847,a8w8_blockscale_1x128x128_256x128x128x128_16x16_32x32_2x2_8x32x1_8x32x1_1x32x1x8_8_1x1_intrawave_v3,731.43,581.06,0.0
gfx942,304,8192,2048,2048,ck,0,0,93.2993,a8w8_blockscale_1x128x128_256x128x128x128_16x16_32x32_2x2_8x32x1_8x32x1_1x32x1x8_8_1x1_intrawave_v3,736.55,584.42,0.0
gfx942,304,8320,2048,2048,ck,0,0,95.1258,a8w8_blockscale_1x128x128_256x128x128x128_16x16_32x32_2x2_8x32x1_8x32x1_1x32x1x8_8_1x1_intrawave_v3,733.69,581.47,0.0
gfx942,304,8448,2048,2048,ck,0,0,95.2042,a8w8_blockscale_1x128x128_256x128x128x128_16x16_32x32_2x2_8x32x1_8x32x1_1x32x1x8_8_1x1_intrawave_v3,744.37,589.25,0.0
gfx942,304,8576,2048,2048,ck,0,0,94.994,a8w8_blockscale_1x128x128_256x128x128x128_16x16_32x32_2x2_8x32x1_8x32x1_1x32x1x8_8_1x1_intrawave_v3,757.32,598.83,0.0
gfx942,304,8704,2048,2048,ck,0,0,95.3203,a8w8_blockscale_1x128x128_256x128x128x128_16x16_32x32_2x2_8x32x1_8x32x1_1x32x1x8_8_1x1_intrawave_v3,765.99,605.03,0.0
gfx942,304,8832,2048,2048,ck,0,0,99.9884,a8w8_blockscale_1x128x128_256x128x128x128_16x16_32x32_2x2_8x32x1_8x32x1_1x32x1x8_8_1x1_intrawave_v3,740.97,584.65,0.0
gfx942,304,8960,2048,2048,ck,0,0,97.9682,a8w8_blockscale_1x128x128_256x128x128x128_16x16_32x32_2x2_8x32x1_8x32x1_1x32x1x8_8_1x1_intrawave_v3,767.21,604.73,0.0
gfx942,304,9088,2048,2048,ck,0,0,97.7221,a8w8_blockscale_1x128x128_256x128x128x128_16x16_32x32_2x2_8x32x1_8x32x1_1x32x1x8_8_1x1_intrawave_v3,780.13,614.3,0.0
gfx942,304,9216,2048,2048,ck,0,0,98.6998,a8w8_blockscale_1x128x128_256x128x128x128_16x16_32x32_2x2_8x32x1_8x32x1_1x32x1x8_8_1x1_intrawave_v3,783.28,616.19,0.0
gfx942,304,9344,2048,2048,ck,0,0,101.0106,a8w8_blockscale_1x128x128_256x128x128x128_16x16_32x32_2x2_8x32x1_8x32x1_1x32x1x8_8_1x1_intrawave_v3,775.99,609.88,0.0
gfx942,304,9472,2048,2048,ck,0,0,99.5311,a8w8_blockscale_1x128x128_256x128x128x128_16x16_32x32_2x2_8x32x1_8x32x1_1x32x1x8_8_1x1_intrawave_v3,798.31,626.84,0.0
gfx942,304,9600,2048,2048,ck,0,0,100.4214,a8w8_blockscale_1x128x128_256x128x128x128_16x16_32x32_2x2_8x32x1_8x32x1_1x32x1x8_8_1x1_intrawave_v3,801.93,629.12,0.0
gfx942,304,9728,2048,2048,ck,0,0,102.2229,a8w8_blockscale_1x128x128_256x128x128x128_16x16_32x32_2x2_8x32x1_8x32x1_1x32x1x8_8_1x1_intrawave_v3,798.3,625.72,0.0
gfx942,304,9856,2048,2048,ck,0,0,111.6954,a8w8_blockscale_1x128x128_256x128x128x128_16x16_32x32_2x2_8x32x1_8x32x1_1x32x1x8_8_1x1_intrawave_v3,740.21,579.7,0.0
gfx942,304,9984,2048,2048,ck,0,0,111.6934,a8w8_blockscale_1x128x128_256x128x128x128_16x16_32x32_2x2_8x32x1_8x32x1_1x32x1x8_8_1x1_intrawave_v3,749.84,586.75,0.0
gfx942,304,10112,2048,2048,ck,0,0,113.0169,a8w8_blockscale_1x128x128_256x128x128x128_16x16_32x32_2x2_8x32x1_8x32x1_1x32x1x8_8_1x1_intrawave_v3,750.56,586.84,0.0
gfx942,304,10240,2048,2048,ck,0,0,112.8327,a8w8_blockscale_1x128x128_256x128x128x128_16x16_32x32_2x2_8x32x1_8x32x1_1x32x1x8_8_1x1_intrawave_v3,761.3,594.76,0.0
gfx942,304,10368,2048,2048,ck,0,0,118.1034,a8w8_blockscale_1x128x128_256x128x128x128_16x16_32x32_2x2_8x32x1_8x32x1_1x32x1x8_8_1x1_intrawave_v3,736.41,574.88,0.0
gfx942,304,10496,2048,2048,ck,0,0,115.8657,a8w8_blockscale_1x128x128_256x128x128x128_16x16_32x32_2x2_8x32x1_8x32x1_1x32x1x8_8_1x1_intrawave_v3,759.9,592.77,0.0
gfx942,304,10624,2048,2048,ck,0,0,118.5749,a8w8_blockscale_1x128x128_256x128x128x128_16x16_32x32_2x2_8x32x1_8x32x1_1x32x1x8_8_1x1_intrawave_v3,751.6,585.86,0.0
gfx942,304,10752,2048,2048,ck,0,0,118.0218,a8w8_blockscale_1x128x128_256x128x128x128_16x16_32x32_2x2_8x32x1_8x32x1_1x32x1x8_8_1x1_intrawave_v3,764.22,595.27,0.0
gfx942,304,10880,2048,2048,ck,0,0,115.6058,a8w8_blockscale_1x128x128_256x128x128x128_16x16_32x32_2x2_8x32x1_8x32x1_1x32x1x8_8_1x1_intrawave_v3,789.48,614.51,0.0
gfx942,304,11008,2048,2048,ck,0,0,116.7691,a8w8_blockscale_1x128x128_256x128x128x128_16x16_32x32_2x2_8x32x1_8x32x1_1x32x1x8_8_1x1_intrawave_v3,790.81,615.12,0.0
gfx942,304,11136,2048,2048,ck,0,0,118.4316,a8w8_blockscale_1x128x128_256x128x128x128_16x16_32x32_2x2_8x32x1_8x32x1_1x32x1x8_8_1x1_intrawave_v3,788.77,613.13,0.0
gfx942,304,11264,2048,2048,ck,0,0,118.6862,a8w8_blockscale_1x128x128_256x128x128x128_16x16_32x32_2x2_8x32x1_8x32x1_1x32x1x8_8_1x1_intrawave_v3,796.13,618.44,0.0
gfx942,304,11392,2048,2048,ck,0,0,121.9137,a8w8_blockscale_1x128x128_256x128x128x128_16x16_32x32_2x2_8x32x1_8x32x1_1x32x1x8_8_1x1_intrawave_v3,783.86,608.52,0.0
gfx942,304,11520,2048,2048,ck,0,0,118.9792,a8w8_blockscale_1x128x128_256x128x128x128_16x16_32x32_2x2_8x32x1_8x32x1_1x32x1x8_8_1x1_intrawave_v3,812.22,630.14,0.0
gfx942,304,11648,2048,2048,ck,0,0,122.6031,a8w8_blockscale_1x128x128_256x128x128x128_16x16_32x32_2x2_8x32x1_8x32x1_1x32x1x8_8_1x1_intrawave_v3,796.97,617.93,0.0
gfx942,304,11776,2048,2048,ck,0,0,122.0815,a8w8_blockscale_1x128x128_256x128x128x128_16x16_32x32_2x2_8x32x1_8x32x1_1x32x1x8_8_1x1_intrawave_v3,809.17,627.01,0.0
gfx942,304,11904,2048,2048,ck,0,0,125.2374,a8w8_blockscale_1x128x128_256x128x128x128_16x16_32x32_2x2_8x32x1_8x32x1_1x32x1x8_8_1x1_intrawave_v3,797.35,617.49,0.0
gfx942,304,12032,2048,2048,ck,0,0,124.0858,a8w8_blockscale_1x128x128_256x128x128x128_16x16_32x32_2x2_8x32x1_8x32x1_1x32x1x8_8_1x1_intrawave_v3,813.4,629.56,0.0
gfx942,304,12160,2048,2048,ck,0,0,127.032,a8w8_blockscale_1x128x128_256x128x128x128_16x16_32x32_2x2_8x32x1_8x32x1_1x32x1x8_8_1x1_intrawave_v3,802.99,621.15,0.0
gfx942,304,12288,2048,2048,ck,0,0,132.1612,a8w8_blockscale_1x128x128_256x128x128x128_16x16_32x32_2x2_8x32x1_8x32x1_1x32x1x8_8_1x1_intrawave_v3,779.95,602.99,0.0
gfx942,304,12416,2048,2048,ck,0,0,135.3733,a8w8_blockscale_1x128x128_256x128x128x128_16x16_32x32_2x2_8x32x1_8x32x1_1x32x1x8_8_1x1_intrawave_v3,769.38,594.49,0.0
gfx942,304,12544,2048,2048,ck,0,0,135.753,a8w8_blockscale_1x128x128_256x128x128x128_16x16_32x32_2x2_8x32x1_8x32x1_1x32x1x8_8_1x1_intrawave_v3,775.13,598.62,0.0
gfx942,304,12672,2048,2048,ck,0,0,135.932,a8w8_blockscale_1x128x128_256x128x128x128_16x16_32x32_2x2_8x32x1_8x32x1_1x32x1x8_8_1x1_intrawave_v3,782.01,603.62,0.0
gfx942,304,12800,2048,2048,ck,0,0,132.8503,a8w8_blockscale_1x128x128_256x128x128x128_16x16_32x32_2x2_8x32x1_8x32x1_1x32x1x8_8_1x1_intrawave_v3,808.23,623.54,0.0
gfx942,304,12928,2048,2048,ck,0,0,135.803,a8w8_blockscale_1x128x128_256x128x128x128_16x16_32x32_2x2_8x32x1_8x32x1_1x32x1x8_8_1x1_intrawave_v3,798.57,615.77,0.0
gfx942,304,13056,2048,2048,ck,0,0,135.3356,a8w8_blockscale_1x128x128_256x128x128x128_16x16_32x32_2x2_8x32x1_8x32x1_1x32x1x8_8_1x1_intrawave_v3,809.26,623.71,0.0
gfx942,304,13184,2048,2048,ck,0,0,138.8741,a8w8_blockscale_1x128x128_256x128x128x128_16x16_32x32_2x2_8x32x1_8x32x1_1x32x1x8_8_1x1_intrawave_v3,796.37,613.48,0.0
gfx942,304,13312,2048,2048,ck,0,0,137.8481,a8w8_blockscale_1x128x128_256x128x128x128_16x16_32x32_2x2_8x32x1_8x32x1_1x32x1x8_8_1x1_intrawave_v3,810.09,623.75,0.0
gfx942,304,13440,2048,2048,ck,0,0,140.9656,a8w8_blockscale_1x128x128_256x128x128x128_16x16_32x32_2x2_8x32x1_8x32x1_1x32x1x8_8_1x1_intrawave_v3,799.79,615.54,0.0
gfx942,304,13568,2048,2048,ck,0,0,142.3296,a8w8_blockscale_1x128x128_256x128x128x128_16x16_32x32_2x2_8x32x1_8x32x1_1x32x1x8_8_1x1_intrawave_v3,799.67,615.16,0.0
gfx942,304,13696,2048,2048,ck,0,0,138.7305,a8w8_blockscale_1x128x128_256x128x128x128_16x16_32x32_2x2_8x32x1_8x32x1_1x32x1x8_8_1x1_intrawave_v3,828.16,636.79,0.0
gfx942,304,13824,2048,2048,ck,0,0,143.8238,a8w8_blockscale_1x128x128_256x128x128x128_16x16_32x32_2x2_8x32x1_8x32x1_1x32x1x8_8_1x1_intrawave_v3,806.29,619.71,0.0
gfx942,304,13952,2048,2048,ck,0,0,142.7226,a8w8_blockscale_1x128x128_256x128x128x128_16x16_32x32_2x2_8x32x1_8x32x1_1x32x1x8_8_1x1_intrawave_v3,820.04,630.0,0.0
gfx942,304,14080,2048,2048,ck,0,0,144.8448,a8w8_blockscale_1x128x128_256x128x128x128_16x16_32x32_2x2_8x32x1_8x32x1_1x32x1x8_8_1x1_intrawave_v3,815.44,626.2,0.0
gfx942,304,14208,2048,2048,ck,0,0,142.2142,a8w8_blockscale_1x128x128_256x128x128x128_16x16_32x32_2x2_8x32x1_8x32x1_1x32x1x8_8_1x1_intrawave_v3,838.07,643.31,0.0
gfx942,304,14336,2048,2048,ck,0,0,146.01,a8w8_blockscale_1x128x128_256x128x128x128_16x16_32x32_2x2_8x32x1_8x32x1_1x32x1x8_8_1x1_intrawave_v3,823.64,631.98,0.0
gfx942,304,14592,2048,2048,ck,0,0,150.8704,a8w8_blockscale_1x128x128_256x128x128x128_16x16_32x32_2x2_8x32x1_8x32x1_1x32x1x8_8_1x1_intrawave_v3,811.34,622.04,0.0
gfx942,304,14720,2048,2048,ck,0,0,152.5174,a8w8_blockscale_1x128x128_256x128x128x128_16x16_32x32_2x2_8x32x1_8x32x1_1x32x1x8_8_1x1_intrawave_v3,809.61,620.48,0.0
gfx942,304,14848,2048,2048,ck,0,0,155.845,a8w8_blockscale_1x128x128_256x128x128x128_16x16_32x32_2x2_8x32x1_8x32x1_1x32x1x8_8_1x1_intrawave_v3,799.22,612.28,0.0
gfx942,304,14976,2048,2048,ck,0,0,161.9983,a8w8_blockscale_1x128x128_256x128x128x128_16x16_32x32_2x2_8x32x1_8x32x1_1x32x1x8_8_1x1_intrawave_v3,775.49,593.88,0.0
gfx942,304,15104,2048,2048,ck,0,0,155.2062,a8w8_blockscale_1x128x128_256x128x128x128_16x16_32x32_2x2_8x32x1_8x32x1_1x32x1x8_8_1x1_intrawave_v3,816.34,624.93,0.0
gfx942,304,15232,2048,2048,ck,0,0,159.4089,a8w8_blockscale_1x128x128_256x128x128x128_16x16_32x32_2x2_8x32x1_8x32x1_1x32x1x8_8_1x1_intrawave_v3,801.56,613.39,0.0
gfx942,304,15360,2048,2048,ck,0,0,159.8669,a8w8_blockscale_1x128x128_256x128x128x128_16x16_32x32_2x2_8x32x1_8x32x1_1x32x1x8_8_1x1_intrawave_v3,805.98,616.55,0.0
gfx942,304,15488,2048,2048,ck,0,0,160.8389,a8w8_blockscale_1x128x128_256x128x128x128_16x16_32x32_2x2_8x32x1_8x32x1_1x32x1x8_8_1x1_intrawave_v3,807.78,617.71,0.0
gfx942,304,15616,2048,2048,ck,0,0,159.2419,a8w8_blockscale_1x128x128_256x128x128x128_16x16_32x32_2x2_8x32x1_8x32x1_1x32x1x8_8_1x1_intrawave_v3,822.63,628.85,0.0
gfx942,304,15744,2048,2048,ck,0,0,162.0473,a8w8_blockscale_1x128x128_256x128x128x128_16x16_32x32_2x2_8x32x1_8x32x1_1x32x1x8_8_1x1_intrawave_v3,815.01,622.81,0.0
gfx942,304,15872,2048,2048,ck,0,0,159.2481,a8w8_blockscale_1x128x128_256x128x128x128_16x16_32x32_2x2_8x32x1_8x32x1_1x32x1x8_8_1x1_intrawave_v3,836.08,638.7,0.0
gfx942,304,16000,2048,2048,ck,0,0,164.9866,a8w8_blockscale_1x128x128_256x128x128x128_16x16_32x32_2x2_8x32x1_8x32x1_1x32x1x8_8_1x1_intrawave_v3,813.51,621.25,0.0
gfx942,304,16128,2048,2048,ck,0,0,162.546,a8w8_blockscale_1x128x128_256x128x128x128_16x16_32x32_2x2_8x32x1_8x32x1_1x32x1x8_8_1x1_intrawave_v3,832.33,635.42,0.0
gfx942,304,16256,2048,2048,ck,0,0,164.5637,a8w8_blockscale_1x128x128_256x128x128x128_16x16_32x32_2x2_8x32x1_8x32x1_1x32x1x8_8_1x1_intrawave_v3,828.65,632.41,0.0
gfx942,304,16384,2048,2048,ck,0,0,162.1406,a8w8_blockscale_1x128x128_256x128x128x128_16x16_32x32_2x2_8x32x1_8x32x1_1x32x1x8_8_1x1_intrawave_v3,847.65,646.71,0.0
gfx942,304,16512,2048,2048,ck,0,0,170.3812,a8w8_blockscale_1x128x128_256x128x128x128_16x16_32x32_2x2_8x32x1_8x32x1_1x32x1x8_8_1x1_intrawave_v3,812.96,620.05,0.0
gfx942,304,1,2624,6144,ck,8,2,12.1224,a8w8_blockscale_1x128x128_256x16x64x256_16x16_16x16_1x1_16x16x1_16x16x1_1x16x1x16_4_1x1_intrawave_v1,2.66,1330.86,0.0
gfx942,304,2,2624,6144,ck,8,2,11.8411,a8w8_blockscale_1x128x128_256x16x64x256_16x16_16x16_1x1_16x16x1_16x16x1_1x16x1x16_4_1x1_intrawave_v1,5.45,1363.44,0.0
gfx942,304,4,2624,6144,ck,8,2,11.8985,a8w8_blockscale_1x128x128_256x16x64x256_16x16_16x16_1x1_16x16x1_16x16x1_1x16x1x16_4_1x1_intrawave_v1,10.84,1358.78,0.0
gfx942,304,8,2624,6144,ck,8,2,12.0719,a8w8_blockscale_1x128x128_256x16x64x256_16x16_16x16_1x1_16x16x1_16x16x1_1x16x1x16_4_1x1_intrawave_v1,21.37,1343.04,0.0
gfx942,304,16,2624,6144,ck,8,2,11.952,a8w8_blockscale_1x128x128_256x16x64x256_16x16_16x16_1x1_16x16x1_16x16x1_1x16x1x16_4_1x1_intrawave_v1,43.16,1364.13,0.0
gfx942,304,32,2624,6144,ck,8,3,13.255,a8w8_blockscale_1x128x128_256x16x64x256_16x16_16x16_1x1_16x16x1_16x16x1_1x16x1x16_4_1x1_intrawave_v1,77.84,1243.79,0.0001
gfx942,304,48,2624,6144,ck,8,3,14.9327,a8w8_blockscale_1x128x128_256x16x64x256_16x16_16x16_1x1_16x16x1_16x16x1_1x16x1x16_4_1x1_intrawave_v1,103.64,1116.25,0.0002
gfx942,304,64,2624,6144,ck,8,3,16.8353,a8w8_blockscale_1x128x128_256x16x64x256_16x16_16x16_1x1_16x16x1_16x16x1_1x16x1x16_4_1x1_intrawave_v1,122.58,1000.93,0.0002
gfx942,304,80,2624,6144,ck,8,3,18.6765,a8w8_blockscale_1x128x128_256x16x64x256_16x16_16x16_1x1_16x16x1_16x16x1_1x16x1x16_4_1x1_intrawave_v1,138.11,912.01,0.0002
gfx942,304,96,2624,6144,ck,8,3,20.0621,a8w8_blockscale_1x128x128_256x16x64x256_16x16_16x16_1x1_16x16x1_16x16x1_1x16x1x16_4_1x1_intrawave_v1,154.29,858.11,0.0002
gfx942,304,112,2624,6144,ck,8,3,21.4316,a8w8_blockscale_1x128x128_256x16x64x256_16x16_16x16_1x1_16x16x1_16x16x1_1x16x1x16_4_1x1_intrawave_v1,168.5,811.78,0.0002
gfx942,304,128,2624,6144,ck,18,1,23.3378,a8w8_blockscale_1x128x128_256x64x64x256_16x16_32x32_1x1_16x16x1_16x16x1_1x32x1x8_8_1x1_intrawave_v1,176.85,753.29,0.0
gfx942,304,144,2624,6144,ck,18,1,24.8799,a8w8_blockscale_1x128x128_256x64x64x256_16x16_32x32_1x1_16x16x1_16x16x1_1x32x1x8_8_1x1_intrawave_v1,186.62,713.92,0.0
gfx942,304,160,2624,6144,ck,18,1,25.4704,a8w8_blockscale_1x128x128_256x64x64x256_16x16_32x32_1x1_16x16x1_16x16x1_1x32x1x8_8_1x1_intrawave_v1,202.55,704.53,0.0
gfx942,304,176,2624,6144,ck,18,1,26.0607,a8w8_blockscale_1x128x128_256x64x64x256_16x16_32x32_1x1_16x16x1_16x16x1_1x32x1x8_8_1x1_intrawave_v1,217.76,695.56,0.0
gfx942,304,192,2624,6144,ck,18,1,25.3157,a8w8_blockscale_1x128x128_256x64x64x256_16x16_32x32_1x1_16x16x1_16x16x1_1x32x1x8_8_1x1_intrawave_v1,244.54,723.23,0.0
gfx942,304,208,2624,6144,ck,18,0,28.8963,a8w8_blockscale_1x128x128_256x64x64x256_16x16_32x32_1x1_16x16x1_16x16x1_1x32x1x8_8_1x1_intrawave_v1,232.1,639.92,0.0
gfx942,304,224,2624,6144,ck,18,0,28.6319,a8w8_blockscale_1x128x128_256x64x64x256_16x16_32x32_1x1_16x16x1_16x16x1_1x32x1x8_8_1x1_intrawave_v1,252.26,652.2,0.0
gfx942,304,240,2624,6144,ck,18,0,29.6686,a8w8_blockscale_1x128x128_256x64x64x256_16x16_32x32_1x1_16x16x1_16x16x1_1x32x1x8_8_1x1_intrawave_v1,260.83,635.55,0.0
gfx942,304,256,2624,6144,ck,18,0,26.9639,a8w8_blockscale_1x128x128_256x64x64x256_16x16_32x32_1x1_16x16x1_16x16x1_1x32x1x8_8_1x1_intrawave_v1,306.13,706.06,0.0
gfx942,304,288,2624,6144,ck,18,0,29.4503,a8w8_blockscale_1x128x128_256x64x64x256_16x16_32x32_1x1_16x16x1_16x16x1_1x32x1x8_8_1x1_intrawave_v1,315.32,658.83,0.0
gfx942,304,320,2624,6144,ck,18,0,27.7782,a8w8_blockscale_1x128x128_256x64x64x256_16x16_32x32_1x1_16x16x1_16x16x1_1x32x1x8_8_1x1_intrawave_v1,371.44,711.61,0.0
gfx942,304,352,2624,6144,ck,18,0,32.6838,a8w8_blockscale_1x128x128_256x64x64x256_16x16_32x32_1x1_16x16x1_16x16x1_1x32x1x8_8_1x1_intrawave_v1,347.26,615.96,0.0
gfx942,304,384,2624,6144,ck,18,0,28.7802,a8w8_blockscale_1x128x128_256x64x64x256_16x16_32x32_1x1_16x16x1_16x16x1_1x32x1x8_8_1x1_intrawave_v1,430.21,712.17,0.0
gfx942,304,416,2624,6144,ck,18,0,32.6724,a8w8_blockscale_1x128x128_256x64x64x256_16x16_32x32_1x1_16x16x1_16x16x1_1x32x1x8_8_1x1_intrawave_v1,410.54,638.49,0.0
gfx942,304,448,2624,6144,ck,18,0,29.8471,a8w8_blockscale_1x128x128_256x64x64x256_16x16_32x32_1x1_16x16x1_16x16x1_1x32x1x8_8_1x1_intrawave_v1,483.97,711.14,0.0
gfx942,304,480,2624,6144,ck,2,0,49.0242,a8w8_blockscale_1x128x128_256x64x128x128_16x16_32x32_1x2_8x32x1_8x32x1_1x32x1x8_8_1x1_intrawave_v3,315.7,440.4,0.0
gfx942,304,512,2624,6144,ck,3,0,51.4567,a8w8_blockscale_1x128x128_256x64x64x128_16x16_32x32_1x1_8x32x1_8x32x1_1x32x1x8_8_1x1_intrawave_v3,320.83,426.66,0.0
gfx942,304,544,2624,6144,ck,3,0,48.9843,a8w8_blockscale_1x128x128_256x64x64x128_16x16_32x32_1x1_8x32x1_8x32x1_1x32x1x8_8_1x1_intrawave_v3,358.09,455.64,0.0
gfx942,304,576,2624,6144,ck,2,0,53.5829,a8w8_blockscale_1x128x128_256x64x128x128_16x16_32x32_1x2_8x32x1_8x32x1_1x32x1x8_8_1x1_intrawave_v3,346.61,423.34,0.0
gfx942,304,608,2624,6144,ck,2,0,51.0797,a8w8_blockscale_1x128x128_256x64x128x128_16x16_32x32_1x2_8x32x1_8x32x1_1x32x1x8_8_1x1_intrawave_v3,383.8,451.22,0.0
gfx942,304,640,2624,6144,ck,3,0,52.9297,a8w8_blockscale_1x128x128_256x64x64x128_16x16_32x32_1x1_8x32x1_8x32x1_1x32x1x8_8_1x1_intrawave_v3,389.88,442.34,0.0
gfx942,304,672,2624,6144,ck,3,0,52.5871,a8w8_blockscale_1x128x128_256x64x64x128_16x16_32x32_1x1_8x32x1_8x32x1_1x32x1x8_8_1x1_intrawave_v3,412.04,452.15,0.0
gfx942,304,704,2624,6144,ck,2,0,54.1189,a8w8_blockscale_1x128x128_256x64x128x128_16x16_32x32_1x2_8x32x1_8x32x1_1x32x1x8_8_1x1_intrawave_v3,419.44,446.09,0.0
gfx942,304,736,2624,6144,ck,2,0,52.0478,a8w8_blockscale_1x128x128_256x64x128x128_16x16_32x32_1x2_8x32x1_8x32x1_1x32x1x8_8_1x1_intrawave_v3,455.95,470.84,0.0
gfx942,304,768,2624,6144,ck,2,0,53.2373,a8w8_blockscale_1x128x128_256x64x128x128_16x16_32x32_1x2_8x32x1_8x32x1_1x32x1x8_8_1x1_intrawave_v3,465.15,467.17,0.0
gfx942,304,800,2624,6144,ck,2,0,53.3503,a8w8_blockscale_1x128x128_256x64x128x128_16x16_32x32_1x2_8x32x1_8x32x1_1x32x1x8_8_1x1_intrawave_v3,483.5,473.01,0.0
gfx942,304,832,2624,6144,ck,2,0,54.7653,a8w8_blockscale_1x128x128_256x64x128x128_16x16_32x32_1x2_8x32x1_8x32x1_1x32x1x8_8_1x1_intrawave_v3,489.85,467.45,0.0
gfx942,304,864,2624,6144,ck,2,0,54.1227,a8w8_blockscale_1x128x128_256x64x128x128_16x16_32x32_1x2_8x32x1_8x32x1_1x32x1x8_8_1x1_intrawave_v3,514.73,479.73,0.0
gfx942,304,896,2624,6144,ck,2,0,55.9578,a8w8_blockscale_1x128x128_256x64x128x128_16x16_32x32_1x2_8x32x1_8x32x1_1x32x1x8_8_1x1_intrawave_v3,516.29,470.52,0.0
gfx942,304,928,2624,6144,ck,0,0,67.0022,a8w8_blockscale_1x128x128_256x128x128x128_16x16_32x32_2x2_8x32x1_8x32x1_1x32x1x8_8_1x1_intrawave_v3,446.58,398.4,0.0
gfx942,304,960,2624,6144,ck,0,0,68.1496,a8w8_blockscale_1x128x128_256x128x128x128_16x16_32x32_2x2_8x32x1_8x32x1_1x32x1x8_8_1x1_intrawave_v3,454.21,397.04,0.0
gfx942,304,992,2624,6144,ck,0,0,68.6092,a8w8_blockscale_1x128x128_256x128x128x128_16x16_32x32_2x2_8x32x1_8x32x1_1x32x1x8_8_1x1_intrawave_v3,466.2,399.69,0.0
gfx942,304,1024,2624,6144,ck,0,0,73.9402,a8w8_blockscale_1x128x128_256x128x128x128_16x16_32x32_2x2_8x32x1_8x32x1_1x32x1x8_8_1x1_intrawave_v3,446.54,375.81,0.0
gfx942,304,1088,2624,6144,ck,0,0,68.4377,a8w8_blockscale_1x128x128_256x128x128x128_16x16_32x32_2x2_8x32x1_8x32x1_1x32x1x8_8_1x1_intrawave_v3,512.6,416.68,0.0
gfx942,304,1152,2624,6144,ck,0,0,73.7898,a8w8_blockscale_1x128x128_256x128x128x128_16x16_32x32_2x2_8x32x1_8x32x1_1x32x1x8_8_1x1_intrawave_v3,503.39,396.33,0.0
gfx942,304,1216,2624,6144,ck,0,0,71.3763,a8w8_blockscale_1x128x128_256x128x128x128_16x16_32x32_2x2_8x32x1_8x32x1_1x32x1x8_8_1x1_intrawave_v3,549.32,419.95,0.0
gfx942,304,1280,2624,6144,ck,2,0,75.1868,a8w8_blockscale_1x128x128_256x64x128x128_16x16_32x32_1x2_8x32x1_8x32x1_1x32x1x8_8_1x1_intrawave_v3,548.93,408.36,0.0
gfx942,304,1344,2624,6144,ck,0,0,70.4504,a8w8_blockscale_1x128x128_256x128x128x128_16x16_32x32_2x2_8x32x1_8x32x1_1x32x1x8_8_1x1_intrawave_v3,615.12,446.17,0.0
gfx942,304,1408,2624,6144,ck,0,0,74.418,a8w8_blockscale_1x128x128_256x128x128x128_16x16_32x32_2x2_8x32x1_8x32x1_1x32x1x8_8_1x1_intrawave_v3,610.06,432.18,0.0
gfx942,304,1472,2624,6144,ck,0,0,73.6872,a8w8_blockscale_1x128x128_256x128x128x128_16x16_32x32_2x2_8x32x1_8x32x1_1x32x1x8_8_1x1_intrawave_v3,644.11,446.36,0.0
gfx942,304,1536,2624,6144,ck,0,0,74.8913,a8w8_blockscale_1x128x128_256x128x128x128_16x16_32x32_2x2_8x32x1_8x32x1_1x32x1x8_8_1x1_intrawave_v3,661.31,448.92,0.0
gfx942,304,1600,2624,6144,ck,0,0,73.358,a8w8_blockscale_1x128x128_256x128x128x128_16x16_32x32_2x2_8x32x1_8x32x1_1x32x1x8_8_1x1_intrawave_v3,703.26,468.24,0.0
gfx942,304,1664,2624,6144,ck,0,0,79.5274,a8w8_blockscale_1x128x128_256x128x128x128_16x16_32x32_2x2_8x32x1_8x32x1_1x32x1x8_8_1x1_intrawave_v3,674.65,441.08,0.0
gfx942,304,1728,2624,6144,ck,0,0,75.3071,a8w8_blockscale_1x128x128_256x128x128x128_16x16_32x32_2x2_8x32x1_8x32x1_1x32x1x8_8_1x1_intrawave_v3,739.87,475.48,0.0
gfx942,304,1792,2624,6144,ck,0,0,78.7028,a8w8_blockscale_1x128x128_256x128x128x128_16x16_32x32_2x2_8x32x1_8x32x1_1x32x1x8_8_1x1_intrawave_v3,734.16,464.23,0.0
gfx942,304,1856,2624,6144,ck,3,0,112.1911,a8w8_blockscale_1x128x128_256x64x64x128_16x16_32x32_1x1_8x32x1_8x32x1_1x32x1x8_8_1x1_intrawave_v3,533.41,332.16,0.0
gfx942,304,1920,2624,6144,ck,0,0,113.4625,a8w8_blockscale_1x128x128_256x128x128x128_16x16_32x32_2x2_8x32x1_8x32x1_1x32x1x8_8_1x1_intrawave_v3,545.62,334.86,0.0
gfx942,304,1984,2624,6144,ck,0,0,109.1546,a8w8_blockscale_1x128x128_256x128x128x128_16x16_32x32_2x2_8x32x1_8x32x1_1x32x1x8_8_1x1_intrawave_v3,586.06,354.76,0.0
gfx942,304,2048,2624,6144,ck,0,0,111.778,a8w8_blockscale_1x128x128_256x128x128x128_16x16_32x32_2x2_8x32x1_8x32x1_1x32x1x8_8_1x1_intrawave_v3,590.77,352.96,0.0
gfx942,304,2112,2624,6144,ck,0,0,109.0513,a8w8_blockscale_1x128x128_256x128x128x128_16x16_32x32_2x2_8x32x1_8x32x1_1x32x1x8_8_1x1_intrawave_v3,624.46,368.47,0.0
gfx942,304,2176,2624,6144,ck,0,0,114.7435,a8w8_blockscale_1x128x128_256x128x128x128_16x16_32x32_2x2_8x32x1_8x32x1_1x32x1x8_8_1x1_intrawave_v3,611.47,356.54,0.0
gfx942,304,2240,2624,6144,ck,0,0,111.8226,a8w8_blockscale_1x128x128_256x128x128x128_16x16_32x32_2x2_8x32x1_8x32x1_1x32x1x8_8_1x1_intrawave_v3,645.9,372.37,0.0
gfx942,304,2304,2624,6144,ck,0,0,113.1729,a8w8_blockscale_1x128x128_256x128x128x128_16x16_32x32_2x2_8x32x1_8x32x1_1x32x1x8_8_1x1_intrawave_v3,656.42,374.37,0.0
gfx942,304,2368,2624,6144,ck,0,0,112.3188,a8w8_blockscale_1x128x128_256x128x128x128_16x16_32x32_2x2_8x32x1_8x32x1_1x32x1x8_8_1x1_intrawave_v3,679.79,383.71,0.0
gfx942,304,2432,2624,6144,ck,0,0,114.7127,a8w8_blockscale_1x128x128_256x128x128x128_16x16_32x32_2x2_8x32x1_8x32x1_1x32x1x8_8_1x1_intrawave_v3,683.59,382.06,0.0
gfx942,304,2496,2624,6144,ck,0,0,111.796,a8w8_blockscale_1x128x128_256x128x128x128_16x16_32x32_2x2_8x32x1_8x32x1_1x32x1x8_8_1x1_intrawave_v3,719.89,398.55,0.0
gfx942,304,2560,2624,6144,ck,0,0,118.9273,a8w8_blockscale_1x128x128_256x128x128x128_16x16_32x32_2x2_8x32x1_8x32x1_1x32x1x8_8_1x1_intrawave_v3,694.07,380.78,0.0
gfx942,304,2624,2624,6144,ck,0,0,119.0862,a8w8_blockscale_1x128x128_256x128x128x128_16x16_32x32_2x2_8x32x1_8x32x1_1x32x1x8_8_1x1_intrawave_v3,710.47,386.4,0.0
gfx942,304,2688,2624,6144,ck,0,0,120.259,a8w8_blockscale_1x128x128_256x128x128x128_16x16_32x32_2x2_8x32x1_8x32x1_1x32x1x8_8_1x1_intrawave_v3,720.7,388.69,0.0
gfx942,304,2752,2624,6144,ck,0,0,119.1024,a8w8_blockscale_1x128x128_256x128x128x128_16x16_32x32_2x2_8x32x1_8x32x1_1x32x1x8_8_1x1_intrawave_v3,745.03,398.59,0.0
gfx942,304,2816,2624,6144,ck,0,0,118.9704,a8w8_blockscale_1x128x128_256x128x128x128_16x16_32x32_2x2_8x32x1_8x32x1_1x32x1x8_8_1x1_intrawave_v3,763.2,405.16,0.0
gfx942,304,2880,2624,6144,ck,0,0,120.5075,a8w8_blockscale_1x128x128_256x128x128x128_16x16_32x32_2x2_8x32x1_8x32x1_1x32x1x8_8_1x1_intrawave_v3,770.59,406.04,0.0
gfx942,304,2944,2624,6144,ck,0,0,122.6916,a8w8_blockscale_1x128x128_256x128x128x128_16x16_32x32_2x2_8x32x1_8x32x1_1x32x1x8_8_1x1_intrawave_v3,773.69,404.75,0.0
gfx942,304,3008,2624,6144,ck,0,0,123.592,a8w8_blockscale_1x128x128_256x128x128x128_16x16_32x32_2x2_8x32x1_8x32x1_1x32x1x8_8_1x1_intrawave_v3,784.75,407.7,0.0
gfx942,304,3072,2624,6144,ck,0,0,127.6259,a8w8_blockscale_1x128x128_256x128x128x128_16x16_32x32_2x2_8x32x1_8x32x1_1x32x1x8_8_1x1_intrawave_v3,776.12,400.53,0.0
gfx942,304,3136,2624,6144,ck,0,0,123.2975,a8w8_blockscale_1x128x128_256x128x128x128_16x16_32x32_2x2_8x32x1_8x32x1_1x32x1x8_8_1x1_intrawave_v3,820.1,420.5,0.0
gfx942,304,3200,2624,6144,ck,0,0,128.1358,a8w8_blockscale_1x128x128_256x128x128x128_16x16_32x32_2x2_8x32x1_8x32x1_1x32x1x8_8_1x1_intrawave_v3,805.24,410.32,0.0
gfx942,304,3264,2624,6144,ck,0,0,130.2543,a8w8_blockscale_1x128x128_256x128x128x128_16x16_32x32_2x2_8x32x1_8x32x1_1x32x1x8_8_1x1_intrawave_v3,807.98,409.24,0.0
gfx942,304,3328,2624,6144,ck,0,0,130.1081,a8w8_blockscale_1x128x128_256x128x128x128_16x16_32x32_2x2_8x32x1_8x32x1_1x32x1x8_8_1x1_intrawave_v3,824.75,415.3,0.0
gfx942,304,3392,2624,6144,ck,0,0,130.2315,a8w8_blockscale_1x128x128_256x128x128x128_16x16_32x32_2x2_8x32x1_8x32x1_1x32x1x8_8_1x1_intrawave_v3,839.82,420.51,0.0
gfx942,304,3456,2624,6144,ck,0,0,130.2469,a8w8_blockscale_1x128x128_256x128x128x128_16x16_32x32_2x2_8x32x1_8x32x1_1x32x1x8_8_1x1_intrawave_v3,855.56,426.06,0.0
gfx942,304,3520,2624,6144,ck,0,0,135.8045,a8w8_blockscale_1x128x128_256x128x128x128_16x16_32x32_2x2_8x32x1_8x32x1_1x32x1x8_8_1x1_intrawave_v3,835.74,413.99,0.0
gfx942,304,3584,2624,6144,ck,0,0,134.6016,a8w8_blockscale_1x128x128_256x128x128x128_16x16_32x32_2x2_8x32x1_8x32x1_1x32x1x8_8_1x1_intrawave_v3,858.54,423.11,0.0
gfx942,304,3648,2624,6144,ck,2,0,169.6795,a8w8_blockscale_1x128x128_256x64x128x128_16x16_32x32_1x2_8x32x1_8x32x1_1x32x1x8_8_1x1_intrawave_v3,693.22,339.93,0.0
gfx942,304,3712,2624,6144,ck,0,0,178.0245,a8w8_blockscale_1x128x128_256x128x128x128_16x16_32x32_2x2_8x32x1_8x32x1_1x32x1x8_8_1x1_intrawave_v3,672.32,328.1,0.0
gfx942,304,3776,2624,6144,ck,0,0,182.3288,a8w8_blockscale_1x128x128_256x128x128x128_16x16_32x32_2x2_8x32x1_8x32x1_1x32x1x8_8_1x1_intrawave_v3,667.76,324.35,0.0
gfx942,304,3840,2624,6144,ck,0,0,186.9925,a8w8_blockscale_1x128x128_256x128x128x128_16x16_32x32_2x2_8x32x1_8x32x1_1x32x1x8_8_1x1_intrawave_v3,662.14,320.16,0.0
gfx942,304,3904,2624,6144,ck,0,0,174.6057,a8w8_blockscale_1x128x128_256x128x128x128_16x16_32x32_2x2_8x32x1_8x32x1_1x32x1x8_8_1x1_intrawave_v3,720.94,347.05,0.0
gfx942,304,3968,2624,6144,ck,0,0,182.9351,a8w8_blockscale_1x128x128_256x128x128x128_16x16_32x32_2x2_8x32x1_8x32x1_1x32x1x8_8_1x1_intrawave_v3,699.39,335.23,0.0
gfx942,304,4032,2624,6144,ck,0,0,181.0025,a8w8_blockscale_1x128x128_256x128x128x128_16x16_32x32_2x2_8x32x1_8x32x1_1x32x1x8_8_1x1_intrawave_v3,718.26,342.84,0.0
gfx942,304,4096,2624,6144,ck,0,0,182.8584,a8w8_blockscale_1x128x128_256x128x128x128_16x16_32x32_2x2_8x32x1_8x32x1_1x32x1x8_8_1x1_intrawave_v3,722.25,343.34,0.0
gfx942,304,4224,2624,6144,ck,0,0,191.6534,a8w8_blockscale_1x128x128_256x128x128x128_16x16_32x32_2x2_8x32x1_8x32x1_1x32x1x8_8_1x1_intrawave_v3,710.64,335.2,0.0
gfx942,304,4352,2624,6144,ck,0,0,190.8708,a8w8_blockscale_1x128x128_256x128x128x128_16x16_32x32_2x2_8x32x1_8x32x1_1x32x1x8_8_1x1_intrawave_v3,735.18,344.21,0.0
gfx942,304,4480,2624,6144,ck,0,0,185.3015,a8w8_blockscale_1x128x128_256x128x128x128_16x16_32x32_2x2_8x32x1_8x32x1_1x32x1x8_8_1x1_intrawave_v3,779.55,362.43,0.0
gfx942,304,4608,2624,6144,ck,0,0,191.5994,a8w8_blockscale_1x128x128_256x128x128x128_16x16_32x32_2x2_8x32x1_8x32x1_1x32x1x8_8_1x1_intrawave_v3,775.47,358.12,0.0
gfx942,304,4736,2624,6144,ck,0,0,195.402,a8w8_blockscale_1x128x128_256x128x128x128_16x16_32x32_2x2_8x32x1_8x32x1_1x32x1x8_8_1x1_intrawave_v3,781.5,358.62,0.0
gfx942,304,4864,2624,6144,ck,0,0,200.0743,a8w8_blockscale_1x128x128_256x128x128x128_16x16_32x32_2x2_8x32x1_8x32x1_1x32x1x8_8_1x1_intrawave_v3,783.88,357.53,0.0
gfx942,304,4992,2624,6144,ck,0,0,198.0719,a8w8_blockscale_1x128x128_256x128x128x128_16x16_32x32_2x2_8x32x1_8x32x1_1x32x1x8_8_1x1_intrawave_v3,812.64,368.51,0.0
gfx942,304,5120,2624,6144,ck,0,0,205.0622,a8w8_blockscale_1x128x128_256x128x128x128_16x16_32x32_2x2_8x32x1_8x32x1_1x32x1x8_8_1x1_intrawave_v3,805.06,363.06,0.0
gfx942,304,5248,2624,6144,ck,0,0,206.5297,a8w8_blockscale_1x128x128_256x128x128x128_16x16_32x32_2x2_8x32x1_8x32x1_1x32x1x8_8_1x1_intrawave_v3,819.33,367.54,0.0
gfx942,304,5376,2624,6144,ck,0,0,222.367,a8w8_blockscale_1x128x128_256x128x128x128_16x16_32x32_2x2_8x32x1_8x32x1_1x32x1x8_8_1x1_intrawave_v3,779.53,347.92,0.0
gfx942,304,5504,2624,6144,ck,0,0,229.4274,a8w8_blockscale_1x128x128_256x128x128x128_16x16_32x32_2x2_8x32x1_8x32x1_1x32x1x8_8_1x1_intrawave_v3,773.53,343.57,0.0
gfx942,304,5632,2624,6144,ck,0,0,240.8513,a8w8_blockscale_1x128x128_256x128x128x128_16x16_32x32_2x2_8x32x1_8x32x1_1x32x1x8_8_1x1_intrawave_v3,753.98,333.32,0.0
gfx942,304,5760,2624,6144,ck,0,0,247.0745,a8w8_blockscale_1x128x128_256x128x128x128_16x16_32x32_2x2_8x32x1_8x32x1_1x32x1x8_8_1x1_intrawave_v3,751.69,330.83,0.0
gfx942,304,5888,2624,6144,ck,0,0,245.5871,a8w8_blockscale_1x128x128_256x128x128x128_16x16_32x32_2x2_8x32x1_8x32x1_1x32x1x8_8_1x1_intrawave_v3,773.05,338.77,0.0
gfx942,304,6016,2624,6144,ck,0,0,245.3755,a8w8_blockscale_1x128x128_256x128x128x128_16x16_32x32_2x2_8x32x1_8x32x1_1x32x1x8_8_1x1_intrawave_v3,790.54,345.01,0.0
gfx942,304,6144,2624,6144,ck,0,0,250.5649,a8w8_blockscale_1x128x128_256x128x128x128_16x16_32x32_2x2_8x32x1_8x32x1_1x32x1x8_8_1x1_intrawave_v3,790.63,343.68,0.0
gfx942,304,6272,2624,6144,ck,0,0,250.4132,a8w8_blockscale_1x128x128_256x128x128x128_16x16_32x32_2x2_8x32x1_8x32x1_1x32x1x8_8_1x1_intrawave_v3,807.6,349.71,0.0
gfx942,304,6400,2624,6144,ck,0,0,245.8891,a8w8_blockscale_1x128x128_256x128x128x128_16x16_32x32_2x2_8x32x1_8x32x1_1x32x1x8_8_1x1_intrawave_v3,839.24,362.08,0.0
gfx942,304,6528,2624,6144,ck,0,0,250.558,a8w8_blockscale_1x128x128_256x128x128x128_16x16_32x32_2x2_8x32x1_8x32x1_1x32x1x8_8_1x1_intrawave_v3,840.07,361.15,0.0
gfx942,304,6656,2624,6144,ck,0,0,254.4621,a8w8_blockscale_1x128x128_256x128x128x128_16x16_32x32_2x2_8x32x1_8x32x1_1x32x1x8_8_1x1_intrawave_v3,843.4,361.34,0.0
gfx942,304,6784,2624,6144,ck,0,0,256.1725,a8w8_blockscale_1x128x128_256x128x128x128_16x16_32x32_2x2_8x32x1_8x32x1_1x32x1x8_8_1x1_intrawave_v3,853.88,364.62,0.0
gfx942,304,6912,2624,6144,ck,0,0,261.1131,a8w8_blockscale_1x128x128_256x128x128x128_16x16_32x32_2x2_8x32x1_8x32x1_1x32x1x8_8_1x1_intrawave_v3,853.53,363.3,0.0
gfx942,304,7040,2624,6144,ck,0,0,259.6037,a8w8_blockscale_1x128x128_256x128x128x128_16x16_32x32_2x2_8x32x1_8x32x1_1x32x1x8_8_1x1_intrawave_v3,874.39,371.03,0.0
gfx942,304,7168,2624,6144,ck,0,0,265.4678,a8w8_blockscale_1x128x128_256x128x128x128_16x16_32x32_2x2_8x32x1_8x32x1_1x32x1x8_8_1x1_intrawave_v3,870.63,368.33,0.0
gfx942,304,7296,2624,6144,ck,0,0,266.4214,a8w8_blockscale_1x128x128_256x128x128x128_16x16_32x32_2x2_8x32x1_8x32x1_1x32x1x8_8_1x1_intrawave_v3,883.0,372.48,0.0
gfx942,304,7424,2624,6144,ck,0,0,298.2279,a8w8_blockscale_1x128x128_256x128x128x128_16x16_32x32_2x2_8x32x1_8x32x1_1x32x1x8_8_1x1_intrawave_v3,802.67,337.65,0.0
gfx942,304,7552,2624,6144,ck,0,0,297.397,a8w8_blockscale_1x128x128_256x128x128x128_16x16_32x32_2x2_8x32x1_8x32x1_1x32x1x8_8_1x1_intrawave_v3,818.79,343.49,0.0
gfx942,304,7680,2624,6144,ck,0,0,304.2446,a8w8_blockscale_1x128x128_256x128x128x128_16x16_32x32_2x2_8x32x1_8x32x1_1x32x1x8_8_1x1_intrawave_v3,813.92,340.56,0.0
gfx942,304,7808,2624,6144,ck,0,0,305.1909,a8w8_blockscale_1x128x128_256x128x128x128_16x16_32x32_2x2_8x32x1_8x32x1_1x32x1x8_8_1x1_intrawave_v3,824.92,344.28,0.0
gfx942,304,7936,2624,6144,ck,0,0,305.6578,a8w8_blockscale_1x128x128_256x128x128x128_16x16_32x32_2x2_8x32x1_8x32x1_1x32x1x8_8_1x1_intrawave_v3,837.17,348.52,0.0
gfx942,304,8064,2624,6144,ck,0,0,302.5687,a8w8_blockscale_1x128x128_256x128x128x128_16x16_32x32_2x2_8x32x1_8x32x1_1x32x1x8_8_1x1_intrawave_v3,859.35,356.9,0.0
gfx942,304,8192,2624,6144,ck,0,0,314.982,a8w8_blockscale_1x128x128_256x128x128x128_16x16_32x32_2x2_8x32x1_8x32x1_1x32x1x8_8_1x1_intrawave_v3,838.59,347.46,0.0
gfx942,304,8320,2624,6144,ck,0,0,311.8614,a8w8_blockscale_1x128x128_256x128x128x128_16x16_32x32_2x2_8x32x1_8x32x1_1x32x1x8_8_1x1_intrawave_v3,860.21,355.62,0.0
gfx942,304,8448,2624,6144,ck,0,0,313.1576,a8w8_blockscale_1x128x128_256x128x128x128_16x16_32x32_2x2_8x32x1_8x32x1_1x32x1x8_8_1x1_intrawave_v3,869.83,358.8,0.0
gfx942,304,8576,2624,6144,ck,0,0,317.8539,a8w8_blockscale_1x128x128_256x128x128x128_16x16_32x32_2x2_8x32x1_8x32x1_1x32x1x8_8_1x1_intrawave_v3,869.97,358.09,0.0
gfx942,304,8704,2624,6144,ck,0,0,323.1469,a8w8_blockscale_1x128x128_256x128x128x128_16x16_32x32_2x2_8x32x1_8x32x1_1x32x1x8_8_1x1_intrawave_v3,868.49,356.74,0.0
gfx942,304,8832,2624,6144,ck,0,0,324.4414,a8w8_blockscale_1x128x128_256x128x128x128_16x16_32x32_2x2_8x32x1_8x32x1_1x32x1x8_8_1x1_intrawave_v3,877.74,359.81,0.0
gfx942,304,8960,2624,6144,ck,0,0,325.4218,a8w8_blockscale_1x128x128_256x128x128x128_16x16_32x32_2x2_8x32x1_8x32x1_1x32x1x8_8_1x1_intrawave_v3,887.78,363.2,0.0
gfx942,304,9088,2624,6144,ck,0,0,340.7727,a8w8_blockscale_1x128x128_256x128x128x128_16x16_32x32_2x2_8x32x1_8x32x1_1x32x1x8_8_1x1_intrawave_v3,859.9,351.12,0.0
gfx942,304,9216,2624,6144,ck,0,0,345.7257,a8w8_blockscale_1x128x128_256x128x128x128_16x16_32x32_2x2_8x32x1_8x32x1_1x32x1x8_8_1x1_intrawave_v3,859.52,350.31,0.0
gfx942,304,9344,2624,6144,ck,0,0,353.8024,a8w8_blockscale_1x128x128_256x128x128x128_16x16_32x32_2x2_8x32x1_8x32x1_1x32x1x8_8_1x1_intrawave_v3,851.56,346.43,0.0
gfx942,304,9472,2624,6144,ck,0,0,356.1999,a8w8_blockscale_1x128x128_256x128x128x128_16x16_32x32_2x2_8x32x1_8x32x1_1x32x1x8_8_1x1_intrawave_v3,857.42,348.19,0.0
gfx942,304,9728,2624,6144,ck,0,0,363.7283,a8w8_blockscale_1x128x128_256x128x128x128_16x16_32x32_2x2_8x32x1_8x32x1_1x32x1x8_8_1x1_intrawave_v3,862.37,349.01,0.0
gfx942,304,9856,2624,6144,ck,0,0,365.5212,a8w8_blockscale_1x128x128_256x128x128x128_16x16_32x32_2x2_8x32x1_8x32x1_1x32x1x8_8_1x1_intrawave_v3,869.43,351.28,0.0
gfx942,304,9984,2624,6144,ck,0,0,364.2336,a8w8_blockscale_1x128x128_256x128x128x128_16x16_32x32_2x2_8x32x1_8x32x1_1x32x1x8_8_1x1_intrawave_v3,883.83,356.53,0.0
gfx942,304,10112,2624,6144,ck,0,0,365.3563,a8w8_blockscale_1x128x128_256x128x128x128_16x16_32x32_2x2_8x32x1_8x32x1_1x32x1x8_8_1x1_intrawave_v3,892.41,359.42,0.0
gfx942,304,10240,2624,6144,ck,0,0,371.2284,a8w8_blockscale_1x128x128_256x128x128x128_16x16_32x32_2x2_8x32x1_8x32x1_1x32x1x8_8_1x1_intrawave_v3,889.41,357.67,0.0
gfx942,304,10368,2624,6144,ck,0,0,381.7445,a8w8_blockscale_1x128x128_256x128x128x128_16x16_32x32_2x2_8x32x1_8x32x1_1x32x1x8_8_1x1_intrawave_v3,875.72,351.63,0.0
gfx942,304,10496,2624,6144,ck,0,0,375.477,a8w8_blockscale_1x128x128_256x128x128x128_16x16_32x32_2x2_8x32x1_8x32x1_1x32x1x8_8_1x1_intrawave_v3,901.33,361.39,0.0
gfx942,304,10624,2624,6144,ck,0,0,381.1132,a8w8_blockscale_1x128x128_256x128x128x128_16x16_32x32_2x2_8x32x1_8x32x1_1x32x1x8_8_1x1_intrawave_v3,898.83,359.87,0.0
gfx942,304,10752,2624,6144,ck,0,0,382.7311,a8w8_blockscale_1x128x128_256x128x128x128_16x16_32x32_2x2_8x32x1_8x32x1_1x32x1x8_8_1x1_intrawave_v3,905.82,362.16,0.0
gfx942,304,10880,2624,6144,ck,0,0,387.5552,a8w8_blockscale_1x128x128_256x128x128x128_16x16_32x32_2x2_8x32x1_8x32x1_1x32x1x8_8_1x1_intrawave_v3,905.19,361.41,0.0
gfx942,304,11008,2624,6144,ck,0,0,392.2953,a8w8_blockscale_1x128x128_256x128x128x128_16x16_32x32_2x2_8x32x1_8x32x1_1x32x1x8_8_1x1_intrawave_v3,904.77,360.76,0.0
gfx942,304,11136,2624,6144,ck,0,0,411.302,a8w8_blockscale_1x128x128_256x128x128x128_16x16_32x32_2x2_8x32x1_8x32x1_1x32x1x8_8_1x1_intrawave_v3,873.0,347.64,0.0
gfx942,304,11264,2624,6144,ck,0,0,418.1685,a8w8_blockscale_1x128x128_256x128x128x128_16x16_32x32_2x2_8x32x1_8x32x1_1x32x1x8_8_1x1_intrawave_v3,868.53,345.41,0.0
gfx942,304,11392,2624,6144,ck,0,0,424.3084,a8w8_blockscale_1x128x128_256x128x128x128_16x16_32x32_2x2_8x32x1_8x32x1_1x32x1x8_8_1x1_intrawave_v3,865.69,343.85,0.0
gfx942,304,11520,2624,6144,ck,0,0,426.2831,a8w8_blockscale_1x128x128_256x128x128x128_16x16_32x32_2x2_8x32x1_8x32x1_1x32x1x8_8_1x1_intrawave_v3,871.36,345.68,0.0
gfx942,304,11648,2624,6144,ck,0,0,426.8795,a8w8_blockscale_1x128x128_256x128x128x128_16x16_32x32_2x2_8x32x1_8x32x1_1x32x1x8_8_1x1_intrawave_v3,879.81,348.61,0.0
gfx942,304,11776,2624,6144,ck,0,0,429.0445,a8w8_blockscale_1x128x128_256x128x128x128_16x16_32x32_2x2_8x32x1_8x32x1_1x32x1x8_8_1x1_intrawave_v3,884.99,350.25,0.0
gfx942,304,12032,2624,6144,ck,0,0,430.1322,a8w8_blockscale_1x128x128_256x128x128x128_16x16_32x32_2x2_8x32x1_8x32x1_1x32x1x8_8_1x1_intrawave_v3,901.95,356.15,0.0
gfx942,304,12160,2624,6144,ck,0,0,436.5972,a8w8_blockscale_1x128x128_256x128x128x128_16x16_32x32_2x2_8x32x1_8x32x1_1x32x1x8_8_1x1_intrawave_v3,898.04,354.21,0.0
gfx942,304,12288,2624,6144,ck,0,0,439.6498,a8w8_blockscale_1x128x128_256x128x128x128_16x16_32x32_2x2_8x32x1_8x32x1_1x32x1x8_8_1x1_intrawave_v3,901.2,355.07,0.0
gfx942,304,12416,2624,6144,ck,0,0,440.3912,a8w8_blockscale_1x128x128_256x128x128x128_16x16_32x32_2x2_8x32x1_8x32x1_1x32x1x8_8_1x1_intrawave_v3,909.05,357.78,0.0
gfx942,304,12544,2624,6144,ck,0,0,448.9657,a8w8_blockscale_1x128x128_256x128x128x128_16x16_32x32_2x2_8x32x1_8x32x1_1x32x1x8_8_1x1_intrawave_v3,900.88,354.2,0.0
gfx942,304,12672,2624,6144,ck,0,0,450.3209,a8w8_blockscale_1x128x128_256x128x128x128_16x16_32x32_2x2_8x32x1_8x32x1_1x32x1x8_8_1x1_intrawave_v3,907.34,356.37,0.0
gfx942,304,12800,2624,6144,ck,0,0,462.5794,a8w8_blockscale_1x128x128_256x128x128x128_16x16_32x32_2x2_8x32x1_8x32x1_1x32x1x8_8_1x1_intrawave_v3,892.21,350.08,0.0
gfx942,304,12928,2624,6144,ck,0,0,475.4226,a8w8_blockscale_1x128x128_256x128x128x128_16x16_32x32_2x2_8x32x1_8x32x1_1x32x1x8_8_1x1_intrawave_v3,876.79,343.69,0.0
gfx942,304,13056,2624,6144,ck,0,0,472.978,a8w8_blockscale_1x128x128_256x128x128x128_16x16_32x32_2x2_8x32x1_8x32x1_1x32x1x8_8_1x1_intrawave_v3,890.05,348.55,0.0
gfx942,304,13184,2624,6144,ck,0,0,481.6731,a8w8_blockscale_1x128x128_256x128x128x128_16x16_32x32_2x2_8x32x1_8x32x1_1x32x1x8_8_1x1_intrawave_v3,882.55,345.28,0.0
gfx942,304,13440,2624,6144,ck,0,0,492.2911,a8w8_blockscale_1x128x128_256x128x128x128_16x16_32x32_2x2_8x32x1_8x32x1_1x32x1x8_8_1x1_intrawave_v3,880.28,343.76,0.0
gfx942,304,13568,2624,6144,ck,0,0,488.6487,a8w8_blockscale_1x128x128_256x128x128x128_16x16_32x32_2x2_8x32x1_8x32x1_1x32x1x8_8_1x1_intrawave_v3,895.29,349.31,0.0
gfx942,304,13696,2624,6144,ck,0,0,497.1054,a8w8_blockscale_1x128x128_256x128x128x128_16x16_32x32_2x2_8x32x1_8x32x1_1x32x1x8_8_1x1_intrawave_v3,888.36,346.3,0.0
gfx942,304,13824,2624,6144,ck,0,0,500.6324,a8w8_blockscale_1x128x128_256x128x128x128_16x16_32x32_2x2_8x32x1_8x32x1_1x32x1x8_8_1x1_intrawave_v3,890.35,346.77,0.0
gfx942,304,13952,2624,6144,ck,0,0,495.6988,a8w8_blockscale_1x128x128_256x128x128x128_16x16_32x32_2x2_8x32x1_8x32x1_1x32x1x8_8_1x1_intrawave_v3,907.54,353.16,0.0
gfx942,304,14080,2624,6144,ck,0,0,499.5119,a8w8_blockscale_1x128x128_256x128x128x128_16x16_32x32_2x2_8x32x1_8x32x1_1x32x1x8_8_1x1_intrawave_v3,908.87,353.39,0.0
gfx942,304,14208,2624,6144,ck,0,0,500.9514,a8w8_blockscale_1x128x128_256x128x128x128_16x16_32x32_2x2_8x32x1_8x32x1_1x32x1x8_8_1x1_intrawave_v3,914.5,355.28,0.0
gfx942,304,14336,2624,6144,ck,0,0,515.7095,a8w8_blockscale_1x128x128_256x128x128x128_16x16_32x32_2x2_8x32x1_8x32x1_1x32x1x8_8_1x1_intrawave_v3,896.33,347.94,0.0
gfx942,304,14464,2624,6144,ck,0,0,520.5136,a8w8_blockscale_1x128x128_256x128x128x128_16x16_32x32_2x2_8x32x1_8x32x1_1x32x1x8_8_1x1_intrawave_v3,895.99,347.53,0.0
gfx942,304,14592,2624,6144,ck,0,0,513.2532,a8w8_blockscale_1x128x128_256x128x128x128_16x16_32x32_2x2_8x32x1_8x32x1_1x32x1x8_8_1x1_intrawave_v3,916.7,355.29,0.0
gfx942,304,14848,2624,6144,ck,0,0,549.0064,a8w8_blockscale_1x128x128_256x128x128x128_16x16_32x32_2x2_8x32x1_8x32x1_1x32x1x8_8_1x1_intrawave_v3,872.04,337.46,0.0
gfx942,304,14976,2624,6144,ck,0,0,539.4852,a8w8_blockscale_1x128x128_256x128x128x128_16x16_32x32_2x2_8x32x1_8x32x1_1x32x1x8_8_1x1_intrawave_v3,895.08,346.12,0.0
gfx942,304,15104,2624,6144,ck,0,0,546.0937,a8w8_blockscale_1x128x128_256x128x128x128_16x16_32x32_2x2_8x32x1_8x32x1_1x32x1x8_8_1x1_intrawave_v3,891.8,344.61,0.0
gfx942,304,15232,2624,6144,ck,0,0,552.0901,a8w8_blockscale_1x128x128_256x128x128x128_16x16_32x32_2x2_8x32x1_8x32x1_1x32x1x8_8_1x1_intrawave_v3,889.59,343.5,0.0
gfx942,304,15360,2624,6144,ck,0,0,547.7255,a8w8_blockscale_1x128x128_256x128x128x128_16x16_32x32_2x2_8x32x1_8x32x1_1x32x1x8_8_1x1_intrawave_v3,904.22,348.9,0.0
gfx942,304,15488,2624,6144,ck,0,0,555.2187,a8w8_blockscale_1x128x128_256x128x128x128_16x16_32x32_2x2_8x32x1_8x32x1_1x32x1x8_8_1x1_intrawave_v3,899.45,346.82,0.0
gfx942,304,15616,2624,6144,ck,0,0,551.6244,a8w8_blockscale_1x128x128_256x128x128x128_16x16_32x32_2x2_8x32x1_8x32x1_1x32x1x8_8_1x1_intrawave_v3,912.79,351.72,0.0
gfx942,304,15744,2624,6144,ck,0,0,570.8623,a8w8_blockscale_1x128x128_256x128x128x128_16x16_32x32_2x2_8x32x1_8x32x1_1x32x1x8_8_1x1_intrawave_v3,889.26,342.42,0.0
gfx942,304,15872,2624,6144,ck,0,0,575.5692,a8w8_blockscale_1x128x128_256x128x128x128_16x16_32x32_2x2_8x32x1_8x32x1_1x32x1x8_8_1x1_intrawave_v3,889.16,342.16,0.0
gfx942,304,16000,2624,6144,ck,0,0,560.3546,a8w8_blockscale_1x128x128_256x128x128x128_16x16_32x32_2x2_8x32x1_8x32x1_1x32x1x8_8_1x1_intrawave_v3,920.67,354.05,0.0
gfx942,304,16256,2624,6144,ck,0,0,580.9461,a8w8_blockscale_1x128x128_256x128x128x128_16x16_32x32_2x2_8x32x1_8x32x1_1x32x1x8_8_1x1_intrawave_v3,902.24,346.52,0.0
gfx942,304,16384,2624,6144,ck,0,0,582.3619,a8w8_blockscale_1x128x128_256x128x128x128_16x16_32x32_2x2_8x32x1_8x32x1_1x32x1x8_8_1x1_intrawave_v3,907.14,348.18,0.0
gfx942,304,16512,2624,6144,ck,0,0,581.4329,a8w8_blockscale_1x128x128_256x128x128x128_16x16_32x32_2x2_8x32x1_8x32x1_1x32x1x8_8_1x1_intrawave_v3,915.68,351.25,0.0
gfx942,304,1,3072,6144,ck,7,3,12.1829,a8w8_blockscale_1x128x128_256x16x128x256_16x16_16x16_1x2_16x16x1_16x16x1_1x16x1x16_8_1x2_intrawave_v1,3.1,1550.26,0.0
gfx942,304,2,3072,6144,ck,8,2,12.2541,a8w8_blockscale_1x128x128_256x16x64x256_16x16_16x16_1x1_16x16x1_16x16x1_1x16x1x16_4_1x1_intrawave_v1,6.16,1542.25,0.0
gfx942,304,4,3072,6144,ck,8,2,12.3505,a8w8_blockscale_1x128x128_256x16x64x256_16x16_16x16_1x1_16x16x1_16x16x1_1x16x1x16_4_1x1_intrawave_v1,12.23,1532.21,0.0
gfx942,304,8,3072,6144,ck,8,2,12.3263,a8w8_blockscale_1x128x128_256x16x64x256_16x16_16x16_1x1_16x16x1_16x16x1_1x16x1x16_4_1x1_intrawave_v1,24.5,1539.2,0.0
gfx942,304,16,3072,6144,ck,8,2,12.4817,a8w8_blockscale_1x128x128_256x16x64x256_16x16_16x16_1x1_16x16x1_16x16x1_1x16x1x16_4_1x1_intrawave_v1,48.39,1527.91,0.0
gfx942,304,32,3072,6144,ck,8,3,13.5196,a8w8_blockscale_1x128x128_256x16x64x256_16x16_16x16_1x1_16x16x1_16x16x1_1x16x1x16_4_1x1_intrawave_v1,89.35,1425.16,0.0001
gfx942,304,48,3072,6144,ck,8,2,15.667,a8w8_blockscale_1x128x128_256x16x64x256_16x16_16x16_1x1_16x16x1_16x16x1_1x16x1x16_4_1x1_intrawave_v1,115.65,1242.37,0.0
gfx942,304,64,3072,6144,ck,8,3,17.5008,a8w8_blockscale_1x128x128_256x16x64x256_16x16_16x16_1x1_16x16x1_16x16x1_1x16x1x16_4_1x1_intrawave_v1,138.05,1123.42,0.0001
gfx942,304,80,3072,6144,ck,13,2,20.8184,a8w8_blockscale_1x128x128_256x32x64x256_16x16_16x16_2x1_16x16x1_16x16x1_1x32x1x8_8_2x1_intrawave_v1,145.06,953.84,0.0
gfx942,304,96,3072,6144,ck,8,0,21.4501,a8w8_blockscale_1x128x128_256x16x64x256_16x16_16x16_1x1_16x16x1_16x16x1_1x16x1x16_4_1x1_intrawave_v1,168.94,934.91,0.0
gfx942,304,112,3072,6144,ck,18,1,23.7604,a8w8_blockscale_1x128x128_256x64x64x256_16x16_32x32_1x1_16x16x1_16x16x1_1x32x1x8_8_1x1_intrawave_v1,177.94,852.28,0.0
gfx942,304,128,3072,6144,ck,18,1,23.6732,a8w8_blockscale_1x128x128_256x64x64x256_16x16_32x32_1x1_16x16x1_16x16x1_1x32x1x8_8_1x1_intrawave_v1,204.11,863.73,0.0
gfx942,304,144,3072,6144,ck,18,1,26.0008,a8w8_blockscale_1x128x128_256x64x64x256_16x16_32x32_1x1_16x16x1_16x16x1_1x32x1x8_8_1x1_intrawave_v1,209.06,793.97,0.0
gfx942,304,160,3072,6144,ck,18,1,26.1991,a8w8_blockscale_1x128x128_256x64x64x256_16x16_32x32_1x1_16x16x1_16x16x1_1x32x1x8_8_1x1_intrawave_v1,230.53,795.46,0.0
gfx942,304,176,3072,6144,ck,18,1,27.5706,a8w8_blockscale_1x128x128_256x64x64x256_16x16_32x32_1x1_16x16x1_16x16x1_1x32x1x8_8_1x1_intrawave_v1,240.97,763.02,0.0
gfx942,304,192,3072,6144,ck,18,0,26.3168,a8w8_blockscale_1x128x128_256x64x64x256_16x16_32x32_1x1_16x16x1_16x16x1_1x32x1x8_8_1x1_intrawave_v1,275.4,806.85,0.0
gfx942,304,208,3072,6144,ck,18,0,29.3077,a8w8_blockscale_1x128x128_256x64x64x256_16x16_32x32_1x1_16x16x1_16x16x1_1x32x1x8_8_1x1_intrawave_v1,267.91,731.22,0.0
gfx942,304,224,3072,6144,ck,18,0,29.1889,a8w8_blockscale_1x128x128_256x64x64x256_16x16_32x32_1x1_16x16x1_16x16x1_1x32x1x8_8_1x1_intrawave_v1,289.69,740.93,0.0
gfx942,304,240,3072,6144,ck,18,0,29.7903,a8w8_blockscale_1x128x128_256x64x64x256_16x16_32x32_1x1_16x16x1_16x16x1_1x32x1x8_8_1x1_intrawave_v1,304.12,732.57,0.0
gfx942,304,256,3072,6144,ck,18,0,27.0334,a8w8_blockscale_1x128x128_256x64x64x256_16x16_32x32_1x1_16x16x1_16x16x1_1x32x1x8_8_1x1_intrawave_v1,357.47,814.55,0.0
gfx942,304,288,3072,6144,ck,18,0,31.5584,a8w8_blockscale_1x128x128_256x64x64x256_16x16_32x32_1x1_16x16x1_16x16x1_1x32x1x8_8_1x1_intrawave_v1,344.49,710.22,0.0
gfx942,304,320,3072,6144,ck,18,0,30.1357,a8w8_blockscale_1x128x128_256x64x64x256_16x16_32x32_1x1_16x16x1_16x16x1_1x32x1x8_8_1x1_intrawave_v1,400.84,756.79,0.0
gfx942,304,352,3072,6144,ck,18,0,32.9328,a8w8_blockscale_1x128x128_256x64x64x256_16x16_32x32_1x1_16x16x1_16x16x1_1x32x1x8_8_1x1_intrawave_v1,403.47,704.46,0.0
gfx942,304,384,3072,6144,ck,18,0,30.1461,a8w8_blockscale_1x128x128_256x64x64x256_16x16_32x32_1x1_16x16x1_16x16x1_1x32x1x8_8_1x1_intrawave_v1,480.84,782.62,0.0
gfx942,304,416,3072,6144,ck,3,0,47.6076,a8w8_blockscale_1x128x128_256x64x64x128_16x16_32x32_1x1_8x32x1_8x32x1_1x32x1x8_8_1x1_intrawave_v3,329.85,503.83,0.0
gfx942,304,448,3072,6144,ck,3,0,48.7426,a8w8_blockscale_1x128x128_256x64x64x128_16x16_32x32_1x1_8x32x1_8x32x1_1x32x1x8_8_1x1_intrawave_v3,346.95,500.17,0.0
gfx942,304,480,3072,6144,ck,2,0,49.962,a8w8_blockscale_1x128x128_256x64x128x128_16x16_32x32_1x2_8x32x1_8x32x1_1x32x1x8_8_1x1_intrawave_v3,362.66,495.83,0.0
gfx942,304,512,3072,6144,ck,3,0,51.5232,a8w8_blockscale_1x128x128_256x64x64x128_16x16_32x32_1x1_8x32x1_8x32x1_1x32x1x8_8_1x1_intrawave_v3,375.12,488.44,0.0
gfx942,304,544,3072,6144,ck,3,0,51.3971,a8w8_blockscale_1x128x128_256x64x64x128_16x16_32x32_1x1_8x32x1_8x32x1_1x32x1x8_8_1x1_intrawave_v3,399.54,497.29,0.0
gfx942,304,576,3072,6144,ck,18,0,53.1325,a8w8_blockscale_1x128x128_256x64x64x256_16x16_32x32_1x1_16x16x1_16x16x1_1x32x1x8_8_1x1_intrawave_v1,409.23,488.44,0.0
gfx942,304,608,3072,6144,ck,2,0,53.1171,a8w8_blockscale_1x128x128_256x64x128x128_16x16_32x32_1x2_8x32x1_8x32x1_1x32x1x8_8_1x1_intrawave_v3,432.09,495.99,0.0
gfx942,304,640,3072,6144,ck,3,0,55.5269,a8w8_blockscale_1x128x128_256x64x64x128_16x16_32x32_1x1_8x32x1_8x32x1_1x32x1x8_8_1x1_intrawave_v3,435.09,481.54,0.0
gfx942,304,672,3072,6144,ck,3,0,54.8294,a8w8_blockscale_1x128x128_256x64x64x128_16x16_32x32_1x1_8x32x1_8x32x1_1x32x1x8_8_1x1_intrawave_v3,462.66,494.84,0.0
gfx942,304,704,3072,6144,ck,3,0,56.9206,a8w8_blockscale_1x128x128_256x64x64x128_16x16_32x32_1x1_8x32x1_8x32x1_1x32x1x8_8_1x1_intrawave_v3,466.88,483.57,0.0
gfx942,304,736,3072,6144,ck,2,0,53.8002,a8w8_blockscale_1x128x128_256x64x128x128_16x16_32x32_1x2_8x32x1_8x32x1_1x32x1x8_8_1x1_intrawave_v3,516.41,518.93,0.0
gfx942,304,768,3072,6144,ck,3,0,56.8422,a8w8_blockscale_1x128x128_256x64x64x128_16x16_32x32_1x1_8x32x1_8x32x1_1x32x1x8_8_1x1_intrawave_v3,510.03,498.07,0.0
gfx942,304,800,3072,6144,ck,0,0,69.3917,a8w8_blockscale_1x128x128_256x128x128x128_16x16_32x32_2x2_8x32x1_8x32x1_1x32x1x8_8_1x1_intrawave_v3,435.2,413.66,0.0
gfx942,304,832,3072,6144,ck,0,0,70.0916,a8w8_blockscale_1x128x128_256x128x128x128_16x16_32x32_2x2_8x32x1_8x32x1_1x32x1x8_8_1x1_intrawave_v3,448.08,415.14,0.0
gfx942,304,864,3072,6144,ck,0,0,71.6718,a8w8_blockscale_1x128x128_256x128x128x128_16x16_32x32_2x2_8x32x1_8x32x1_1x32x1x8_8_1x1_intrawave_v3,455.06,411.48,0.0
gfx942,304,896,3072,6144,ck,3,0,76.6989,a8w8_blockscale_1x128x128_256x64x64x128_16x16_32x32_1x1_8x32x1_8x32x1_1x32x1x8_8_1x1_intrawave_v3,440.98,389.63,0.0
gfx942,304,928,3072,6144,ck,0,0,70.8336,a8w8_blockscale_1x128x128_256x128x128x128_16x16_32x32_2x2_8x32x1_8x32x1_1x32x1x8_8_1x1_intrawave_v3,494.55,427.45,0.0
gfx942,304,960,3072,6144,ck,0,0,69.4043,a8w8_blockscale_1x128x128_256x128x128x128_16x16_32x32_2x2_8x32x1_8x32x1_1x32x1x8_8_1x1_intrawave_v3,522.14,441.92,0.0
gfx942,304,992,3072,6144,ck,0,0,75.7422,a8w8_blockscale_1x128x128_256x128x128x128_16x16_32x32_2x2_8x32x1_8x32x1_1x32x1x8_8_1x1_intrawave_v3,494.4,410.13,0.0
gfx942,304,1024,3072,6144,ck,3,0,79.338,a8w8_blockscale_1x128x128_256x64x64x128_16x16_32x32_1x1_8x32x1_8x32x1_1x32x1x8_8_1x1_intrawave_v3,487.22,396.5,0.0
gfx942,304,1088,3072,6144,ck,0,0,73.5788,a8w8_blockscale_1x128x128_256x128x128x128_16x16_32x32_2x2_8x32x1_8x32x1_1x32x1x8_8_1x1_intrawave_v3,558.19,438.22,0.0
gfx942,304,1152,3072,6144,ck,2,0,79.7964,a8w8_blockscale_1x128x128_256x64x128x128_16x16_32x32_1x2_8x32x1_8x32x1_1x32x1x8_8_1x1_intrawave_v3,544.97,413.93,0.0
gfx942,304,1216,3072,6144,ck,0,0,73.261,a8w8_blockscale_1x128x128_256x128x128x128_16x16_32x32_2x2_8x32x1_8x32x1_1x32x1x8_8_1x1_intrawave_v3,626.56,461.59,0.0
gfx942,304,1280,3072,6144,ck,2,0,81.4479,a8w8_blockscale_1x128x128_256x64x128x128_16x16_32x32_1x2_8x32x1_8x32x1_1x32x1x8_8_1x1_intrawave_v3,593.24,424.85,0.0
gfx942,304,1344,3072,6144,ck,0,0,76.2752,a8w8_blockscale_1x128x128_256x128x128x128_16x16_32x32_2x2_8x32x1_8x32x1_1x32x1x8_8_1x1_intrawave_v3,665.15,463.97,0.0
gfx942,304,1408,3072,6144,ck,0,0,84.8075,a8w8_blockscale_1x128x128_256x128x128x128_16x16_32x32_2x2_8x32x1_8x32x1_1x32x1x8_8_1x1_intrawave_v3,626.72,426.56,0.0
gfx942,304,1472,3072,6144,ck,0,0,77.0732,a8w8_blockscale_1x128x128_256x128x128x128_16x16_32x32_2x2_8x32x1_8x32x1_1x32x1x8_8_1x1_intrawave_v3,720.95,479.57,0.0
gfx942,304,1536,3072,6144,ck,0,0,87.026,a8w8_blockscale_1x128x128_256x128x128x128_16x16_32x32_2x2_8x32x1_8x32x1_1x32x1x8_8_1x1_intrawave_v3,666.26,433.76,0.0
gfx942,304,1600,3072,6144,ck,2,0,92.1474,a8w8_blockscale_1x128x128_256x64x128x128_16x16_32x32_1x2_8x32x1_8x32x1_1x32x1x8_8_1x1_intrawave_v3,655.45,418.19,0.0
gfx942,304,1664,3072,6144,ck,0,0,118.0044,a8w8_blockscale_1x128x128_256x128x128x128_16x16_32x32_2x2_8x32x1_8x32x1_1x32x1x8_8_1x1_intrawave_v3,532.3,333.22,0.0
gfx942,304,1728,3072,6144,ck,0,0,114.1549,a8w8_blockscale_1x128x128_256x128x128x128_16x16_32x32_2x2_8x32x1_8x32x1_1x32x1x8_8_1x1_intrawave_v3,571.41,351.35,0.0
gfx942,304,1792,3072,6144,ck,0,0,114.6327,a8w8_blockscale_1x128x128_256x128x128x128_16x16_32x32_2x2_8x32x1_8x32x1_1x32x1x8_8_1x1_intrawave_v3,590.11,356.74,0.0
gfx942,304,1856,3072,6144,ck,0,0,113.7211,a8w8_blockscale_1x128x128_256x128x128x128_16x16_32x32_2x2_8x32x1_8x32x1_1x32x1x8_8_1x1_intrawave_v3,616.08,366.52,0.0
gfx942,304,1920,3072,6144,ck,0,0,113.7785,a8w8_blockscale_1x128x128_256x128x128x128_16x16_32x32_2x2_8x32x1_8x32x1_1x32x1x8_8_1x1_intrawave_v3,637.01,373.25,0.0
gfx942,304,1984,3072,6144,ck,0,0,115.3306,a8w8_blockscale_1x128x128_256x128x128x128_16x16_32x32_2x2_8x32x1_8x32x1_1x32x1x8_8_1x1_intrawave_v3,649.38,375.04,0.0
gfx942,304,2048,3072,6144,ck,0,0,114.2355,a8w8_blockscale_1x128x128_256x128x128x128_16x16_32x32_2x2_8x32x1_8x32x1_1x32x1x8_8_1x1_intrawave_v3,676.75,385.52,0.0
gfx942,304,2112,3072,6144,ck,0,0,121.2098,a8w8_blockscale_1x128x128_256x128x128x128_16x16_32x32_2x2_8x32x1_8x32x1_1x32x1x8_8_1x1_intrawave_v3,657.75,369.83,0.0
gfx942,304,2176,3072,6144,ck,0,0,119.1578,a8w8_blockscale_1x128x128_256x128x128x128_16x16_32x32_2x2_8x32x1_8x32x1_1x32x1x8_8_1x1_intrawave_v3,689.35,382.8,0.0
gfx942,304,2240,3072,6144,ck,0,0,118.5062,a8w8_blockscale_1x128x128_256x128x128x128_16x16_32x32_2x2_8x32x1_8x32x1_1x32x1x8_8_1x1_intrawave_v3,713.53,391.54,0.0
gfx942,304,2304,3072,6144,ck,0,0,120.1882,a8w8_blockscale_1x128x128_256x128x128x128_16x16_32x32_2x2_8x32x1_8x32x1_1x32x1x8_8_1x1_intrawave_v3,723.64,392.6,0.0
gfx942,304,2368,3072,6144,ck,0,0,121.6514,a8w8_blockscale_1x128x128_256x128x128x128_16x16_32x32_2x2_8x32x1_8x32x1_1x32x1x8_8_1x1_intrawave_v3,734.8,394.34,0.0
gfx942,304,2432,3072,6144,ck,0,0,122.2534,a8w8_blockscale_1x128x128_256x128x128x128_16x16_32x32_2x2_8x32x1_8x32x1_1x32x1x8_8_1x1_intrawave_v3,750.94,398.83,0.0
gfx942,304,2496,3072,6144,ck,0,0,121.3771,a8w8_blockscale_1x128x128_256x128x128x128_16x16_32x32_2x2_8x32x1_8x32x1_1x32x1x8_8_1x1_intrawave_v3,776.27,408.19,0.0
gfx942,304,2560,3072,6144,ck,0,0,125.1387,a8w8_blockscale_1x128x128_256x128x128x128_16x16_32x32_2x2_8x32x1_8x32x1_1x32x1x8_8_1x1_intrawave_v3,772.24,402.21,0.0
gfx942,304,2624,3072,6144,ck,0,0,128.1466,a8w8_blockscale_1x128x128_256x128x128x128_16x16_32x32_2x2_8x32x1_8x32x1_1x32x1x8_8_1x1_intrawave_v3,772.96,398.9,0.0
gfx942,304,2688,3072,6144,ck,0,0,131.0803,a8w8_blockscale_1x128x128_256x128x128x128_16x16_32x32_2x2_8x32x1_8x32x1_1x32x1x8_8_1x1_intrawave_v3,774.09,395.97,0.0
gfx942,304,2752,3072,6144,ck,0,0,132.1122,a8w8_blockscale_1x128x128_256x128x128x128_16x16_32x32_2x2_8x32x1_8x32x1_1x32x1x8_8_1x1_intrawave_v3,786.34,398.83,0.0
gfx942,304,2816,3072,6144,ck,0,0,131.9322,a8w8_blockscale_1x128x128_256x128x128x128_16x16_32x32_2x2_8x32x1_8x32x1_1x32x1x8_8_1x1_intrawave_v3,805.72,405.34,0.0
gfx942,304,2880,3072,6144,ck,0,0,131.6894,a8w8_blockscale_1x128x128_256x128x128x128_16x16_32x32_2x2_8x32x1_8x32x1_1x32x1x8_8_1x1_intrawave_v3,825.55,412.06,0.0
gfx942,304,2944,3072,6144,ck,0,0,134.8239,a8w8_blockscale_1x128x128_256x128x128x128_16x16_32x32_2x2_8x32x1_8x32x1_1x32x1x8_8_1x1_intrawave_v3,824.28,408.31,0.0
gfx942,304,3008,3072,6144,ck,0,0,133.6875,a8w8_blockscale_1x128x128_256x128x128x128_16x16_32x32_2x2_8x32x1_8x32x1_1x32x1x8_8_1x1_intrawave_v3,849.36,417.67,0.0
gfx942,304,3072,3072,6144,ck,0,0,135.7249,a8w8_blockscale_1x128x128_256x128x128x128_16x16_32x32_2x2_8x32x1_8x32x1_1x32x1x8_8_1x1_intrawave_v3,854.41,417.19,0.0
gfx942,304,3136,3072,6144,ck,0,0,134.8282,a8w8_blockscale_1x128x128_256x128x128x128_16x16_32x32_2x2_8x32x1_8x32x1_1x32x1x8_8_1x1_intrawave_v3,878.01,425.8,0.0
gfx942,304,3200,3072,6144,ck,0,0,138.0679,a8w8_blockscale_1x128x128_256x128x128x128_16x16_32x32_2x2_8x32x1_8x32x1_1x32x1x8_8_1x1_intrawave_v3,874.9,421.5,0.0
gfx942,304,3264,3072,6144,ck,0,0,179.3568,a8w8_blockscale_1x128x128_256x128x128x128_16x16_32x32_2x2_8x32x1_8x32x1_1x32x1x8_8_1x1_intrawave_v3,686.97,328.86,0.0
gfx942,304,3328,3072,6144,ck,0,0,184.8753,a8w8_blockscale_1x128x128_256x128x128x128_16x16_32x32_2x2_8x32x1_8x32x1_1x32x1x8_8_1x1_intrawave_v3,679.53,323.29,0.0
gfx942,304,3392,3072,6144,ck,0,0,183.0189,a8w8_blockscale_1x128x128_256x128x128x128_16x16_32x32_2x2_8x32x1_8x32x1_1x32x1x8_8_1x1_intrawave_v3,699.62,330.87,0.0
gfx942,304,3456,3072,6144,ck,0,0,187.4272,a8w8_blockscale_1x128x128_256x128x128x128_16x16_32x32_2x2_8x32x1_8x32x1_1x32x1x8_8_1x1_intrawave_v3,696.05,327.28,0.0
gfx942,304,3520,3072,6144,ck,0,0,185.4431,a8w8_blockscale_1x128x128_256x128x128x128_16x16_32x32_2x2_8x32x1_8x32x1_1x32x1x8_8_1x1_intrawave_v3,716.53,335.03,0.0
gfx942,304,3584,3072,6144,ck,0,0,179.0989,a8w8_blockscale_1x128x128_256x128x128x128_16x16_32x32_2x2_8x32x1_8x32x1_1x32x1x8_8_1x1_intrawave_v3,755.4,351.28,0.0
gfx942,304,3648,3072,6144,ck,0,0,190.0365,a8w8_blockscale_1x128x128_256x128x128x128_16x16_32x32_2x2_8x32x1_8x32x1_1x32x1x8_8_1x1_intrawave_v3,724.64,335.2,0.0
gfx942,304,3712,3072,6144,ck,0,0,191.3664,a8w8_blockscale_1x128x128_256x128x128x128_16x16_32x32_2x2_8x32x1_8x32x1_1x32x1x8_8_1x1_intrawave_v3,732.23,336.98,0.0
gfx942,304,3776,3072,6144,ck,0,0,185.6248,a8w8_blockscale_1x128x128_256x128x128x128_16x16_32x32_2x2_8x32x1_8x32x1_1x32x1x8_8_1x1_intrawave_v3,767.89,351.64,0.0
gfx942,304,3840,3072,6144,ck,0,0,188.3957,a8w8_blockscale_1x128x128_256x128x128x128_16x16_32x32_2x2_8x32x1_8x32x1_1x32x1x8_8_1x1_intrawave_v3,769.42,350.65,0.0
gfx942,304,3904,3072,6144,ck,0,0,191.4594,a8w8_blockscale_1x128x128_256x128x128x128_16x16_32x32_2x2_8x32x1_8x32x1_1x32x1x8_8_1x1_intrawave_v3,769.72,349.14,0.0
gfx942,304,3968,3072,6144,ck,0,0,191.6575,a8w8_blockscale_1x128x128_256x128x128x128_16x16_32x32_2x2_8x32x1_8x32x1_1x32x1x8_8_1x1_intrawave_v3,781.53,352.89,0.0
gfx942,304,4032,3072,6144,ck,0,0,191.5597,a8w8_blockscale_1x128x128_256x128x128x128_16x16_32x32_2x2_8x32x1_8x32x1_1x32x1x8_8_1x1_intrawave_v3,794.55,357.17,0.0
gfx942,304,4096,3072,6144,ck,0,0,197.0929,a8w8_blockscale_1x128x128_256x128x128x128_16x16_32x32_2x2_8x32x1_8x32x1_1x32x1x8_8_1x1_intrawave_v3,784.5,351.13,0.0
gfx942,304,4224,3072,6144,ck,0,0,204.2533,a8w8_blockscale_1x128x128_256x128x128x128_16x16_32x32_2x2_8x32x1_8x32x1_1x32x1x8_8_1x1_intrawave_v3,780.65,346.53,0.0
gfx942,304,4352,3072,6144,ck,0,0,205.6802,a8w8_blockscale_1x128x128_256x128x128x128_16x16_32x32_2x2_8x32x1_8x32x1_1x32x1x8_8_1x1_intrawave_v3,798.73,351.77,0.0
gfx942,304,4480,3072,6144,ck,0,0,199.0632,a8w8_blockscale_1x128x128_256x128x128x128_16x16_32x32_2x2_8x32x1_8x32x1_1x32x1x8_8_1x1_intrawave_v3,849.55,371.36,0.0
gfx942,304,4608,3072,6144,ck,0,0,207.7598,a8w8_blockscale_1x128x128_256x128x128x128_16x16_32x32_2x2_8x32x1_8x32x1_1x32x1x8_8_1x1_intrawave_v3,837.25,363.39,0.0
gfx942,304,4736,3072,6144,ck,0,0,205.7444,a8w8_blockscale_1x128x128_256x128x128x128_16x16_32x32_2x2_8x32x1_8x32x1_1x32x1x8_8_1x1_intrawave_v3,868.93,374.59,0.0
gfx942,304,4864,3072,6144,ck,0,0,214.1192,a8w8_blockscale_1x128x128_256x128x128x128_16x16_32x32_2x2_8x32x1_8x32x1_1x32x1x8_8_1x1_intrawave_v3,857.51,367.29,0.0
gfx942,304,4992,3072,6144,ck,0,0,250.3211,a8w8_blockscale_1x128x128_256x128x128x128_16x16_32x32_2x2_8x32x1_8x32x1_1x32x1x8_8_1x1_intrawave_v3,752.8,320.45,0.0
gfx942,304,5120,3072,6144,ck,0,0,248.0919,a8w8_blockscale_1x128x128_256x128x128x128_16x16_32x32_2x2_8x32x1_8x32x1_1x32x1x8_8_1x1_intrawave_v3,779.04,329.67,0.0
gfx942,304,5248,3072,6144,ck,0,0,241.9346,a8w8_blockscale_1x128x128_256x128x128x128_16x16_32x32_2x2_8x32x1_8x32x1_1x32x1x8_8_1x1_intrawave_v3,818.84,344.56,0.0
gfx942,304,5376,3072,6144,ck,0,0,244.2997,a8w8_blockscale_1x128x128_256x128x128x128_16x16_32x32_2x2_8x32x1_8x32x1_1x32x1x8_8_1x1_intrawave_v3,830.69,347.67,0.0
gfx942,304,5504,3072,6144,ck,0,0,246.9624,a8w8_blockscale_1x128x128_256x128x128x128_16x16_32x32_2x2_8x32x1_8x32x1_1x32x1x8_8_1x1_intrawave_v3,841.3,350.29,0.0
gfx942,304,5632,3072,6144,ck,0,0,251.3149,a8w8_blockscale_1x128x128_256x128x128x128_16x16_32x32_2x2_8x32x1_8x32x1_1x32x1x8_8_1x1_intrawave_v3,845.95,350.48,0.0
gfx942,304,5760,3072,6144,ck,0,0,255.8113,a8w8_blockscale_1x128x128_256x128x128x128_16x16_32x32_2x2_8x32x1_8x32x1_1x32x1x8_8_1x1_intrawave_v3,849.97,350.47,0.0
gfx942,304,5888,3072,6144,ck,0,0,255.2288,a8w8_blockscale_1x128x128_256x128x128x128_16x16_32x32_2x2_8x32x1_8x32x1_1x32x1x8_8_1x1_intrawave_v3,870.84,357.43,0.0
gfx942,304,6016,3072,6144,ck,0,0,257.4696,a8w8_blockscale_1x128x128_256x128x128x128_16x16_32x32_2x2_8x32x1_8x32x1_1x32x1x8_8_1x1_intrawave_v3,882.03,360.43,0.0
gfx942,304,6144,3072,6144,ck,0,0,260.6808,a8w8_blockscale_1x128x128_256x128x128x128_16x16_32x32_2x2_8x32x1_8x32x1_1x32x1x8_8_1x1_intrawave_v3,889.7,362.02,0.0
gfx942,304,6272,3072,6144,ck,0,0,265.8097,a8w8_blockscale_1x128x128_256x128x128x128_16x16_32x32_2x2_8x32x1_8x32x1_1x32x1x8_8_1x1_intrawave_v3,890.71,360.95,0.0
gfx942,304,6400,3072,6144,ck,0,0,268.0115,a8w8_blockscale_1x128x128_256x128x128x128_16x16_32x32_2x2_8x32x1_8x32x1_1x32x1x8_8_1x1_intrawave_v3,901.42,363.86,0.0
gfx942,304,6528,3072,6144,ck,0,0,303.1864,a8w8_blockscale_1x128x128_256x128x128x128_16x16_32x32_2x2_8x32x1_8x32x1_1x32x1x8_8_1x1_intrawave_v3,812.78,326.83,0.0
gfx942,304,6656,3072,6144,ck,0,0,298.177,a8w8_blockscale_1x128x128_256x128x128x128_16x16_32x32_2x2_8x32x1_8x32x1_1x32x1x8_8_1x1_intrawave_v3,842.64,337.6,0.0
gfx942,304,6784,3072,6144,ck,0,0,303.0922,a8w8_blockscale_1x128x128_256x128x128x128_16x16_32x32_2x2_8x32x1_8x32x1_1x32x1x8_8_1x1_intrawave_v3,844.92,337.31,0.0
gfx942,304,6912,3072,6144,ck,0,0,303.0998,a8w8_blockscale_1x128x128_256x128x128x128_16x16_32x32_2x2_8x32x1_8x32x1_1x32x1x8_8_1x1_intrawave_v3,860.84,342.49,0.0
gfx942,304,7040,3072,6144,ck,0,0,310.8408,a8w8_blockscale_1x128x128_256x128x128x128_16x16_32x32_2x2_8x32x1_8x32x1_1x32x1x8_8_1x1_intrawave_v3,854.94,339.02,0.0
gfx942,304,7168,3072,6144,ck,0,0,305.2085,a8w8_blockscale_1x128x128_256x128x128x128_16x16_32x32_2x2_8x32x1_8x32x1_1x32x1x8_8_1x1_intrawave_v3,886.55,350.43,0.0
gfx942,304,7296,3072,6144,ck,0,0,311.6752,a8w8_blockscale_1x128x128_256x128x128x128_16x16_32x32_2x2_8x32x1_8x32x1_1x32x1x8_8_1x1_intrawave_v3,883.66,348.21,0.0
gfx942,304,7424,3072,6144,ck,0,0,313.9218,a8w8_blockscale_1x128x128_256x128x128x128_16x16_32x32_2x2_8x32x1_8x32x1_1x32x1x8_8_1x1_intrawave_v3,892.73,350.73,0.0
gfx942,304,7552,3072,6144,ck,0,0,320.7729,a8w8_blockscale_1x128x128_256x128x128x128_16x16_32x32_2x2_8x32x1_8x32x1_1x32x1x8_8_1x1_intrawave_v3,888.72,348.14,0.0
gfx942,304,7680,3072,6144,ck,0,0,318.2778,a8w8_blockscale_1x128x128_256x128x128x128_16x16_32x32_2x2_8x32x1_8x32x1_1x32x1x8_8_1x1_intrawave_v3,910.87,355.81,0.0
gfx942,304,7808,3072,6144,ck,0,0,325.148,a8w8_blockscale_1x128x128_256x128x128x128_16x16_32x32_2x2_8x32x1_8x32x1_1x32x1x8_8_1x1_intrawave_v3,906.49,353.13,0.0
gfx942,304,7936,3072,6144,ck,0,0,327.0286,a8w8_blockscale_1x128x128_256x128x128x128_16x16_32x32_2x2_8x32x1_8x32x1_1x32x1x8_8_1x1_intrawave_v3,916.05,355.91,0.0
gfx942,304,8064,3072,6144,ck,0,0,332.8522,a8w8_blockscale_1x128x128_256x128x128x128_16x16_32x32_2x2_8x32x1_8x32x1_1x32x1x8_8_1x1_intrawave_v3,914.54,354.41,0.0
gfx942,304,8192,3072,6144,ck,0,0,352.6805,a8w8_blockscale_1x128x128_256x128x128x128_16x16_32x32_2x2_8x32x1_8x32x1_1x32x1x8_8_1x1_intrawave_v3,876.82,338.94,0.0
gfx942,304,8320,3072,6144,ck,0,0,362.0541,a8w8_blockscale_1x128x128_256x128x128x128_16x16_32x32_2x2_8x32x1_8x32x1_1x32x1x8_8_1x1_intrawave_v3,867.47,334.51,0.0
gfx942,304,8448,3072,6144,ck,0,0,361.9907,a8w8_blockscale_1x128x128_256x128x128x128_16x16_32x32_2x2_8x32x1_8x32x1_1x32x1x8_8_1x1_intrawave_v3,880.97,338.91,0.0
gfx942,304,8576,3072,6144,ck,0,0,363.2253,a8w8_blockscale_1x128x128_256x128x128x128_16x16_32x32_2x2_8x32x1_8x32x1_1x32x1x8_8_1x1_intrawave_v3,891.27,342.09,0.0
gfx942,304,8704,3072,6144,ck,0,0,368.5392,a8w8_blockscale_1x128x128_256x128x128x128_16x16_32x32_2x2_8x32x1_8x32x1_1x32x1x8_8_1x1_intrawave_v3,891.53,341.43,0.0
gfx942,304,8832,3072,6144,ck,0,0,369.065,a8w8_blockscale_1x128x128_256x128x128x128_16x16_32x32_2x2_8x32x1_8x32x1_1x32x1x8_8_1x1_intrawave_v3,903.36,345.2,0.0
gfx942,304,8960,3072,6144,ck,0,0,374.0871,a8w8_blockscale_1x128x128_256x128x128x128_16x16_32x32_2x2_8x32x1_8x32x1_1x32x1x8_8_1x1_intrawave_v3,904.14,344.77,0.0
gfx942,304,9088,3072,6144,ck,0,0,372.6651,a8w8_blockscale_1x128x128_256x128x128x128_16x16_32x32_2x2_8x32x1_8x32x1_1x32x1x8_8_1x1_intrawave_v3,920.56,350.31,0.0
gfx942,304,9216,3072,6144,ck,0,0,376.9184,a8w8_blockscale_1x128x128_256x128x128x128_16x16_32x32_2x2_8x32x1_8x32x1_1x32x1x8_8_1x1_intrawave_v3,922.99,350.53,0.0
gfx942,304,9344,3072,6144,ck,0,0,388.0955,a8w8_blockscale_1x128x128_256x128x128x128_16x16_32x32_2x2_8x32x1_8x32x1_1x32x1x8_8_1x1_intrawave_v3,908.86,344.49,0.0
gfx942,304,9472,3072,6144,ck,0,0,391.5048,a8w8_blockscale_1x128x128_256x128x128x128_16x16_32x32_2x2_8x32x1_8x32x1_1x32x1x8_8_1x1_intrawave_v3,913.29,345.5,0.0
gfx942,304,9728,3072,6144,ck,0,0,400.6584,a8w8_blockscale_1x128x128_256x128x128x128_16x16_32x32_2x2_8x32x1_8x32x1_1x32x1x8_8_1x1_intrawave_v3,916.54,345.46,0.0
gfx942,304,9856,3072,6144,ck,0,0,417.387,a8w8_blockscale_1x128x128_256x128x128x128_16x16_32x32_2x2_8x32x1_8x32x1_1x32x1x8_8_1x1_intrawave_v3,891.38,335.38,0.0
gfx942,304,10112,3072,6144,ck,0,0,426.4669,a8w8_blockscale_1x128x128_256x128x128x128_16x16_32x32_2x2_8x32x1_8x32x1_1x32x1x8_8_1x1_intrawave_v3,895.06,335.62,0.0
gfx942,304,10240,3072,6144,ck,0,0,423.4021,a8w8_blockscale_1x128x128_256x128x128x128_16x16_32x32_2x2_8x32x1_8x32x1_1x32x1x8_8_1x1_intrawave_v3,912.95,341.76,0.0
gfx942,304,10368,3072,6144,ck,0,0,434.677,a8w8_blockscale_1x128x128_256x128x128x128_16x16_32x32_2x2_8x32x1_8x32x1_1x32x1x8_8_1x1_intrawave_v3,900.39,336.52,0.0
gfx942,304,10496,3072,6144,ck,0,0,428.7945,a8w8_blockscale_1x128x128_256x128x128x128_16x16_32x32_2x2_8x32x1_8x32x1_1x32x1x8_8_1x1_intrawave_v3,924.01,344.8,0.0
gfx942,304,10624,3072,6144,ck,0,0,437.2517,a8w8_blockscale_1x128x128_256x128x128x128_16x16_32x32_2x2_8x32x1_8x32x1_1x32x1x8_8_1x1_intrawave_v3,917.19,341.73,0.0
gfx942,304,10752,3072,6144,ck,0,0,434.5615,a8w8_blockscale_1x128x128_256x128x128x128_16x16_32x32_2x2_8x32x1_8x32x1_1x32x1x8_8_1x1_intrawave_v3,933.99,347.47,0.0
gfx942,304,10880,3072,6144,ck,0,0,436.5745,a8w8_blockscale_1x128x128_256x128x128x128_16x16_32x32_2x2_8x32x1_8x32x1_1x32x1x8_8_1x1_intrawave_v3,940.75,349.47,0.0
gfx942,304,11008,3072,6144,ck,0,0,440.6121,a8w8_blockscale_1x128x128_256x128x128x128_16x16_32x32_2x2_8x32x1_8x32x1_1x32x1x8_8_1x1_intrawave_v3,943.09,349.83,0.0
gfx942,304,11136,3072,6144,ck,0,0,448.09,a8w8_blockscale_1x128x128_256x128x128x128_16x16_32x32_2x2_8x32x1_8x32x1_1x32x1x8_8_1x1_intrawave_v3,938.14,347.51,0.0
gfx942,304,11264,3072,6144,ck,0,0,459.3966,a8w8_blockscale_1x128x128_256x128x128x128_16x16_32x32_2x2_8x32x1_8x32x1_1x32x1x8_8_1x1_intrawave_v3,925.57,342.38,0.0
gfx942,304,11392,3072,6144,ck,0,0,476.2512,a8w8_blockscale_1x128x128_256x128x128x128_16x16_32x32_2x2_8x32x1_8x32x1_1x32x1x8_8_1x1_intrawave_v3,902.96,333.56,0.0
gfx942,304,11648,3072,6144,ck,0,0,483.602,a8w8_blockscale_1x128x128_256x128x128x128_16x16_32x32_2x2_8x32x1_8x32x1_1x32x1x8_8_1x1_intrawave_v3,909.21,335.0,0.0
gfx942,304,11776,3072,6144,ck,0,0,481.3634,a8w8_blockscale_1x128x128_256x128x128x128_16x16_32x32_2x2_8x32x1_8x32x1_1x32x1x8_8_1x1_intrawave_v3,923.48,339.82,0.0
gfx942,304,12032,3072,6144,ck,0,0,484.7036,a8w8_blockscale_1x128x128_256x128x128x128_16x16_32x32_2x2_8x32x1_8x32x1_1x32x1x8_8_1x1_intrawave_v3,937.05,343.97,0.0
gfx942,304,12160,3072,6144,ck,0,0,493.0439,a8w8_blockscale_1x128x128_256x128x128x128_16x16_32x32_2x2_8x32x1_8x32x1_1x32x1x8_8_1x1_intrawave_v3,931.0,341.34,0.0
gfx942,304,12288,3072,6144,ck,0,0,499.2101,a8w8_blockscale_1x128x128_256x128x128x128_16x16_32x32_2x2_8x32x1_8x32x1_1x32x1x8_8_1x1_intrawave_v3,929.18,340.28,0.0
gfx942,304,12416,3072,6144,ck,0,0,498.5895,a8w8_blockscale_1x128x128_256x128x128x128_16x16_32x32_2x2_8x32x1_8x32x1_1x32x1x8_8_1x1_intrawave_v3,940.03,343.85,0.0
gfx942,304,12544,3072,6144,ck,0,0,500.0308,a8w8_blockscale_1x128x128_256x128x128x128_16x16_32x32_2x2_8x32x1_8x32x1_1x32x1x8_8_1x1_intrawave_v3,946.98,346.01,0.0
gfx942,304,12672,3072,6144,ck,0,0,510.6952,a8w8_blockscale_1x128x128_256x128x128x128_16x16_32x32_2x2_8x32x1_8x32x1_1x32x1x8_8_1x1_intrawave_v3,936.67,341.86,0.0
gfx942,304,12800,3072,6144,ck,0,0,510.0149,a8w8_blockscale_1x128x128_256x128x128x128_16x16_32x32_2x2_8x32x1_8x32x1_1x32x1x8_8_1x1_intrawave_v3,947.39,345.4,0.0
gfx942,304,12928,3072,6144,ck,0,0,536.0966,a8w8_blockscale_1x128x128_256x128x128x128_16x16_32x32_2x2_8x32x1_8x32x1_1x32x1x8_8_1x1_intrawave_v3,910.31,331.53,0.0
gfx942,304,13056,3072,6144,ck,0,0,539.7636,a8w8_blockscale_1x128x128_256x128x128x128_16x16_32x32_2x2_8x32x1_8x32x1_1x32x1x8_8_1x1_intrawave_v3,913.08,332.19,0.0
gfx942,304,13184,3072,6144,ck,0,0,545.4816,a8w8_blockscale_1x128x128_256x128x128x128_16x16_32x32_2x2_8x32x1_8x32x1_1x32x1x8_8_1x1_intrawave_v3,912.37,331.6,0.0
gfx942,304,13440,3072,6144,ck,0,0,552.2906,a8w8_blockscale_1x128x128_256x128x128x128_16x16_32x32_2x2_8x32x1_8x32x1_1x32x1x8_8_1x1_intrawave_v3,918.62,333.2,0.0
gfx942,304,13568,3072,6144,ck,0,0,554.2862,a8w8_blockscale_1x128x128_256x128x128x128_16x16_32x32_2x2_8x32x1_8x32x1_1x32x1x8_8_1x1_intrawave_v3,924.03,334.84,0.0
gfx942,304,13696,3072,6144,ck,0,0,549.2008,a8w8_blockscale_1x128x128_256x128x128x128_16x16_32x32_2x2_8x32x1_8x32x1_1x32x1x8_8_1x1_intrawave_v3,941.38,340.81,0.0
gfx942,304,13824,3072,6144,ck,0,0,568.2494,a8w8_blockscale_1x128x128_256x128x128x128_16x16_32x32_2x2_8x32x1_8x32x1_1x32x1x8_8_1x1_intrawave_v3,918.33,332.15,0.0
gfx942,304,13952,3072,6144,ck,0,0,556.1211,a8w8_blockscale_1x128x128_256x128x128x128_16x16_32x32_2x2_8x32x1_8x32x1_1x32x1x8_8_1x1_intrawave_v3,947.04,342.22,0.0
gfx942,304,14080,3072,6144,ck,0,0,561.1191,a8w8_blockscale_1x128x128_256x128x128x128_16x16_32x32_2x2_8x32x1_8x32x1_1x32x1x8_8_1x1_intrawave_v3,947.22,341.98,0.0
gfx942,304,14208,3072,6144,ck,0,0,565.5391,a8w8_blockscale_1x128x128_256x128x128x128_16x16_32x32_2x2_8x32x1_8x32x1_1x32x1x8_8_1x1_intrawave_v3,948.36,342.08,0.0
gfx942,304,14336,3072,6144,ck,0,0,572.8699,a8w8_blockscale_1x128x128_256x128x128x128_16x16_32x32_2x2_8x32x1_8x32x1_1x32x1x8_8_1x1_intrawave_v3,944.66,340.45,0.0
gfx942,304,14464,3072,6144,ck,0,0,581.5099,a8w8_blockscale_1x128x128_256x128x128x128_16x16_32x32_2x2_8x32x1_8x32x1_1x32x1x8_8_1x1_intrawave_v3,938.93,338.1,0.0
gfx942,304,14592,3072,6144,ck,0,0,588.727,a8w8_blockscale_1x128x128_256x128x128x128_16x16_32x32_2x2_8x32x1_8x32x1_1x32x1x8_8_1x1_intrawave_v3,935.63,336.63,0.0
gfx942,304,14848,3072,6144,ck,0,0,597.6206,a8w8_blockscale_1x128x128_256x128x128x128_16x16_32x32_2x2_8x32x1_8x32x1_1x32x1x8_8_1x1_intrawave_v3,937.87,336.88,0.0
gfx942,304,14976,3072,6144,ck,0,0,605.1482,a8w8_blockscale_1x128x128_256x128x128x128_16x16_32x32_2x2_8x32x1_8x32x1_1x32x1x8_8_1x1_intrawave_v3,934.19,335.29,0.0
gfx942,304,15104,3072,6144,ck,0,0,606.9859,a8w8_blockscale_1x128x128_256x128x128x128_16x16_32x32_2x2_8x32x1_8x32x1_1x32x1x8_8_1x1_intrawave_v3,939.32,336.87,0.0
gfx942,304,15232,3072,6144,ck,0,0,618.1413,a8w8_blockscale_1x128x128_256x128x128x128_16x16_32x32_2x2_8x32x1_8x32x1_1x32x1x8_8_1x1_intrawave_v3,930.19,333.33,0.0
gfx942,304,15360,3072,6144,ck,0,0,608.5896,a8w8_blockscale_1x128x128_256x128x128x128_16x16_32x32_2x2_8x32x1_8x32x1_1x32x1x8_8_1x1_intrawave_v3,952.73,341.15,0.0
gfx942,304,15488,3072,6144,ck,0,0,630.3562,a8w8_blockscale_1x128x128_256x128x128x128_16x16_32x32_2x2_8x32x1_8x32x1_1x32x1x8_8_1x1_intrawave_v3,927.5,331.86,0.0
gfx942,304,15616,3072,6144,ck,0,0,617.534,a8w8_blockscale_1x128x128_256x128x128x128_16x16_32x32_2x2_8x32x1_8x32x1_1x32x1x8_8_1x1_intrawave_v3,954.58,341.3,0.0
gfx942,304,15744,3072,6144,ck,0,0,637.4867,a8w8_blockscale_1x128x128_256x128x128x128_16x16_32x32_2x2_8x32x1_8x32x1_1x32x1x8_8_1x1_intrawave_v3,932.28,333.08,0.0
gfx942,304,15872,3072,6144,ck,0,0,642.3407,a8w8_blockscale_1x128x128_256x128x128x128_16x16_32x32_2x2_8x32x1_8x32x1_1x32x1x8_8_1x1_intrawave_v3,932.76,333.02,0.0
gfx942,304,16000,3072,6144,ck,0,0,637.3622,a8w8_blockscale_1x128x128_256x128x128x128_16x16_32x32_2x2_8x32x1_8x32x1_1x32x1x8_8_1x1_intrawave_v3,947.62,338.08,0.0
gfx942,304,16256,3072,6144,ck,0,0,658.8442,a8w8_blockscale_1x128x128_256x128x128x128_16x16_32x32_2x2_8x32x1_8x32x1_1x32x1x8_8_1x1_intrawave_v3,931.39,331.84,0.0
gfx942,304,16384,3072,6144,ck,0,0,656.196,a8w8_blockscale_1x128x128_256x128x128x128_16x16_32x32_2x2_8x32x1_8x32x1_1x32x1x8_8_1x1_intrawave_v3,942.52,335.57,0.0
gfx942,304,16512,3072,6144,ck,0,0,664.7514,a8w8_blockscale_1x128x128_256x128x128x128_16x16_32x32_2x2_8x32x1_8x32x1_1x32x1x8_8_1x1_intrawave_v3,937.65,333.62,0.0
gfx942,304,1,4096,2048,ck,8,2,7.2474,a8w8_blockscale_1x128x128_256x16x64x256_16x16_16x16_1x1_16x16x1_16x16x1_1x16x1x16_4_1x1_intrawave_v1,2.31,1158.88,0.0
gfx942,304,2,4096,2048,ck,8,2,8.2156,a8w8_blockscale_1x128x128_256x16x64x256_16x16_16x16_1x1_16x16x1_16x16x1_1x16x1x16_4_1x1_intrawave_v1,4.08,1023.55,0.0
gfx942,304,4,4096,2048,ck,8,0,8.5586,a8w8_blockscale_1x128x128_256x16x64x256_16x16_16x16_1x1_16x16x1_16x16x1_1x16x1x16_4_1x1_intrawave_v1,7.84,984.92,0.0
gfx942,304,8,4096,2048,ck,8,0,8.4613,a8w8_blockscale_1x128x128_256x16x64x256_16x16_16x16_1x1_16x16x1_16x16x1_1x16x1x16_4_1x1_intrawave_v1,15.86,1001.09,0.0
gfx942,304,16,4096,2048,ck,8,0,8.8052,a8w8_blockscale_1x128x128_256x16x64x256_16x16_16x16_1x1_16x16x1_16x16x1_1x16x1x16_4_1x1_intrawave_v1,30.49,971.3,0.0
gfx942,304,48,4096,2048,ck,8,0,8.725,a8w8_blockscale_1x128x128_256x16x64x256_16x16_16x16_1x1_16x16x1_16x16x1_1x16x1x16_4_1x1_intrawave_v1,92.3,1017.78,0.0
gfx942,304,64,4096,2048,ck,8,0,8.9017,a8w8_blockscale_1x128x128_256x16x64x256_16x16_16x16_1x1_16x16x1_16x16x1_1x16x1x16_4_1x1_intrawave_v1,120.62,1015.98,0.0
gfx942,304,80,4096,2048,ck,13,0,11.3883,a8w8_blockscale_1x128x128_256x32x64x256_16x16_16x16_2x1_16x16x1_16x16x1_1x32x1x8_8_2x1_intrawave_v1,117.86,808.53,0.0
gfx942,304,96,4096,2048,ck,13,0,11.3002,a8w8_blockscale_1x128x128_256x32x64x256_16x16_16x16_2x1_16x16x1_16x16x1_1x32x1x8_8_2x1_intrawave_v1,142.53,829.33,0.0
gfx942,304,128,4096,2048,ck,13,0,11.2858,a8w8_blockscale_1x128x128_256x32x64x256_16x16_16x16_2x1_16x16x1_16x16x1_1x32x1x8_8_2x1_intrawave_v1,190.28,859.43,0.0
gfx942,304,144,4096,2048,ck,18,0,11.9845,a8w8_blockscale_1x128x128_256x64x64x256_16x16_32x32_1x1_16x16x1_16x16x1_1x32x1x8_8_1x1_intrawave_v1,201.59,822.99,0.0
gfx942,304,176,4096,2048,ck,18,0,12.0218,a8w8_blockscale_1x128x128_256x64x64x256_16x16_32x32_1x1_16x16x1_16x16x1_1x32x1x8_8_1x1_intrawave_v1,245.62,847.7,0.0
gfx942,304,192,4096,2048,ck,18,0,11.4583,a8w8_blockscale_1x128x128_256x64x64x256_16x16_32x32_1x1_16x16x1_16x16x1_1x32x1x8_8_1x1_intrawave_v1,281.13,903.68,0.0
gfx942,304,208,4096,2048,ck,18,0,12.1923,a8w8_blockscale_1x128x128_256x64x64x256_16x16_32x32_1x1_16x16x1_16x16x1_1x32x1x8_8_1x1_intrawave_v1,286.22,862.72,0.0
gfx942,304,224,4096,2048,ck,18,0,12.2096,a8w8_blockscale_1x128x128_256x64x64x256_16x16_32x32_1x1_16x16x1_16x16x1_1x32x1x8_8_1x1_intrawave_v1,307.8,874.92,0.0
gfx942,304,240,4096,2048,ck,18,0,12.2404,a8w8_blockscale_1x128x128_256x64x64x256_16x16_32x32_1x1_16x16x1_16x16x1_1x32x1x8_8_1x1_intrawave_v1,328.95,886.1,0.0
gfx942,304,256,4096,2048,ck,18,0,11.6597,a8w8_blockscale_1x128x128_256x64x64x256_16x16_32x32_1x1_16x16x1_16x16x1_1x32x1x8_8_1x1_intrawave_v1,368.36,944.28,0.0
gfx942,304,288,4096,2048,ck,12,0,15.1924,a8w8_blockscale_1x128x128_256x32x128x256_16x16_32x32_1x1_16x16x1_16x16x1_1x32x1x8_8_1x1_intrawave_v1,318.04,746.28,0.0
gfx942,304,320,4096,2048,ck,3,0,20.4519,a8w8_blockscale_1x128x128_256x64x64x128_16x16_32x32_1x1_8x32x1_8x32x1_1x32x1x8_8_1x1_intrawave_v3,262.5,570.38,0.0
gfx942,304,352,4096,2048,ck,3,0,19.2524,a8w8_blockscale_1x128x128_256x64x64x128_16x16_32x32_1x1_8x32x1_8x32x1_1x32x1x8_8_1x1_intrawave_v3,306.75,622.94,0.0
gfx942,304,384,4096,2048,ck,3,0,20.3831,a8w8_blockscale_1x128x128_256x64x64x128_16x16_32x32_1x1_8x32x1_8x32x1_1x32x1x8_8_1x1_intrawave_v3,316.07,604.46,0.0
gfx942,304,416,4096,2048,ck,3,0,19.871,a8w8_blockscale_1x128x128_256x64x64x128_16x16_32x32_1x1_8x32x1_8x32x1_1x32x1x8_8_1x1_intrawave_v3,351.23,636.53,0.0
gfx942,304,448,4096,2048,ck,3,0,20.6631,a8w8_blockscale_1x128x128_256x64x64x128_16x16_32x32_1x1_8x32x1_8x32x1_1x32x1x8_8_1x1_intrawave_v3,363.75,627.99,0.0
gfx942,304,480,4096,2048,ck,3,0,20.1837,a8w8_blockscale_1x128x128_256x64x64x128_16x16_32x32_1x1_8x32x1_8x32x1_1x32x1x8_8_1x1_intrawave_v3,398.99,659.14,0.0
gfx942,304,512,4096,2048,ck,18,0,20.6594,a8w8_blockscale_1x128x128_256x64x64x256_16x16_32x32_1x1_16x16x1_16x16x1_1x32x1x8_8_1x1_intrawave_v1,415.79,659.82,0.0
gfx942,304,544,4096,2048,ck,2,0,22.0536,a8w8_blockscale_1x128x128_256x64x128x128_16x16_32x32_1x2_8x32x1_8x32x1_1x32x1x8_8_1x1_intrawave_v3,413.85,632.97,0.0
gfx942,304,576,4096,2048,ck,18,0,21.8006,a8w8_blockscale_1x128x128_256x64x64x256_16x16_32x32_1x1_16x16x1_16x16x1_1x32x1x8_8_1x1_intrawave_v1,443.28,655.34,0.0
gfx942,304,608,4096,2048,ck,12,0,27.059,a8w8_blockscale_1x128x128_256x32x128x256_16x16_32x32_1x1_16x16x1_16x16x1_1x32x1x8_8_1x1_intrawave_v1,376.97,540.1,0.0
gfx942,304,640,4096,2048,ck,3,0,28.3706,a8w8_blockscale_1x128x128_256x64x64x128_16x16_32x32_1x1_8x32x1_8x32x1_1x32x1x8_8_1x1_intrawave_v3,378.47,526.68,0.0
gfx942,304,672,4096,2048,ck,3,0,27.6702,a8w8_blockscale_1x128x128_256x64x64x128_16x16_32x32_1x1_8x32x1_8x32x1_1x32x1x8_8_1x1_intrawave_v3,407.45,551.85,0.0
gfx942,304,704,4096,2048,ck,0,0,27.7731,a8w8_blockscale_1x128x128_256x128x128x128_16x16_32x32_2x2_8x32x1_8x32x1_1x32x1x8_8_1x1_intrawave_v3,425.27,561.61,0.0
gfx942,304,736,4096,2048,ck,3,0,28.3314,a8w8_blockscale_1x128x128_256x64x64x128_16x16_32x32_1x1_8x32x1_8x32x1_1x32x1x8_8_1x1_intrawave_v3,435.84,562.11,0.0
gfx942,304,768,4096,2048,ck,18,0,29.3368,a8w8_blockscale_1x128x128_256x64x64x256_16x16_32x32_1x1_16x16x1_16x16x1_1x32x1x8_8_1x1_intrawave_v1,439.21,554.01,0.0
gfx942,304,800,4096,2048,ck,0,0,28.1123,a8w8_blockscale_1x128x128_256x128x128x128_16x16_32x32_2x2_8x32x1_8x32x1_1x32x1x8_8_1x1_intrawave_v3,477.43,589.8,0.0
gfx942,304,832,4096,2048,ck,0,0,28.0961,a8w8_blockscale_1x128x128_256x128x128x128_16x16_32x32_2x2_8x32x1_8x32x1_1x32x1x8_8_1x1_intrawave_v3,496.82,601.8,0.0
gfx942,304,864,4096,2048,ck,0,0,30.6447,a8w8_blockscale_1x128x128_256x128x128x128_16x16_32x32_2x2_8x32x1_8x32x1_1x32x1x8_8_1x1_intrawave_v3,473.02,562.45,0.0
gfx942,304,896,4096,2048,ck,18,0,30.9162,a8w8_blockscale_1x128x128_256x64x64x256_16x16_32x32_1x1_16x16x1_16x16x1_1x32x1x8_8_1x1_intrawave_v1,486.23,568.11,0.0
gfx942,304,928,4096,2048,ck,0,0,28.3812,a8w8_blockscale_1x128x128_256x128x128x128_16x16_32x32_2x2_8x32x1_8x32x1_1x32x1x8_8_1x1_intrawave_v3,548.58,630.39,0.0
gfx942,304,960,4096,2048,ck,0,0,28.6915,a8w8_blockscale_1x128x128_256x128x128x128_16x16_32x32_2x2_8x32x1_8x32x1_1x32x1x8_8_1x1_intrawave_v3,561.36,635.0,0.0
gfx942,304,992,4096,2048,ck,0,0,30.3831,a8w8_blockscale_1x128x128_256x128x128x128_16x16_32x32_2x2_8x32x1_8x32x1_1x32x1x8_8_1x1_intrawave_v3,547.77,610.43,0.0
gfx942,304,1024,4096,2048,ck,2,0,33.3532,a8w8_blockscale_1x128x128_256x64x128x128_16x16_32x32_1x2_8x32x1_8x32x1_1x32x1x8_8_1x1_intrawave_v3,515.09,565.89,0.0
gfx942,304,1088,4096,2048,ck,0,0,31.3893,a8w8_blockscale_1x128x128_256x128x128x128_16x16_32x32_2x2_8x32x1_8x32x1_1x32x1x8_8_1x1_intrawave_v3,581.52,622.18,0.0
gfx942,304,1152,4096,2048,ck,0,0,33.0619,a8w8_blockscale_1x128x128_256x128x128x128_16x16_32x32_2x2_8x32x1_8x32x1_1x32x1x8_8_1x1_intrawave_v3,584.58,610.52,0.0
gfx942,304,1216,4096,2048,ck,2,0,35.0961,a8w8_blockscale_1x128x128_256x64x128x128_16x16_32x32_1x2_8x32x1_8x32x1_1x32x1x8_8_1x1_intrawave_v3,581.29,593.81,0.0
gfx942,304,1280,4096,2048,ck,0,0,44.2788,a8w8_blockscale_1x128x128_256x128x128x128_16x16_32x32_2x2_8x32x1_8x32x1_1x32x1x8_8_1x1_intrawave_v3,484.99,485.47,0.0
gfx942,304,1344,4096,2048,ck,0,0,45.52,a8w8_blockscale_1x128x128_256x128x128x128_16x16_32x32_2x2_8x32x1_8x32x1_1x32x1x8_8_1x1_intrawave_v3,495.36,486.62,0.0
gfx942,304,1408,4096,2048,ck,0,0,44.9017,a8w8_blockscale_1x128x128_256x128x128x128_16x16_32x32_2x2_8x32x1_8x32x1_1x32x1x8_8_1x1_intrawave_v3,526.09,507.92,0.0
gfx942,304,1472,4096,2048,ck,0,0,44.2853,a8w8_blockscale_1x128x128_256x128x128x128_16x16_32x32_2x2_8x32x1_8x32x1_1x32x1x8_8_1x1_intrawave_v3,557.66,529.79,0.0
gfx942,304,1536,4096,2048,ck,0,0,46.0651,a8w8_blockscale_1x128x128_256x128x128x128_16x16_32x32_2x2_8x32x1_8x32x1_1x32x1x8_8_1x1_intrawave_v3,559.42,523.55,0.0
gfx942,304,1600,4096,2048,ck,0,0,45.5655,a8w8_blockscale_1x128x128_256x128x128x128_16x16_32x32_2x2_8x32x1_8x32x1_1x32x1x8_8_1x1_intrawave_v3,589.12,543.67,0.0
gfx942,304,1664,4096,2048,ck,0,0,47.3952,a8w8_blockscale_1x128x128_256x128x128x128_16x16_32x32_2x2_8x32x1_8x32x1_1x32x1x8_8_1x1_intrawave_v3,589.03,536.51,0.0
gfx942,304,1728,4096,2048,ck,0,0,46.6212,a8w8_blockscale_1x128x128_256x128x128x128_16x16_32x32_2x2_8x32x1_8x32x1_1x32x1x8_8_1x1_intrawave_v3,621.84,559.47,0.0
gfx942,304,1792,4096,2048,ck,0,0,48.8872,a8w8_blockscale_1x128x128_256x128x128x128_16x16_32x32_2x2_8x32x1_8x32x1_1x32x1x8_8_1x1_intrawave_v3,614.98,546.95,0.0
gfx942,304,1856,4096,2048,ck,0,0,51.0227,a8w8_blockscale_1x128x128_256x128x128x128_16x16_32x32_2x2_8x32x1_8x32x1_1x32x1x8_8_1x1_intrawave_v3,610.29,536.9,0.0
gfx942,304,1920,4096,2048,ck,0,0,50.4919,a8w8_blockscale_1x128x128_256x128x128x128_16x16_32x32_2x2_8x32x1_8x32x1_1x32x1x8_8_1x1_intrawave_v3,637.97,555.52,0.0
gfx942,304,1984,4096,2048,ck,0,0,51.8599,a8w8_blockscale_1x128x128_256x128x128x128_16x16_32x32_2x2_8x32x1_8x32x1_1x32x1x8_8_1x1_intrawave_v3,641.84,553.51,0.0
gfx942,304,2048,4096,2048,ck,0,0,49.2441,a8w8_blockscale_1x128x128_256x128x128x128_16x16_32x32_2x2_8x32x1_8x32x1_1x32x1x8_8_1x1_intrawave_v3,697.74,596.22,0.0
gfx942,304,2112,4096,2048,ck,0,0,52.8234,a8w8_blockscale_1x128x128_256x128x128x128_16x16_32x32_2x2_8x32x1_8x32x1_1x32x1x8_8_1x1_intrawave_v3,670.79,568.22,0.0
gfx942,304,2176,4096,2048,ck,0,0,51.7248,a8w8_blockscale_1x128x128_256x128x128x128_16x16_32x32_2x2_8x32x1_8x32x1_1x32x1x8_8_1x1_intrawave_v3,705.8,592.96,0.0
gfx942,304,2240,4096,2048,ck,0,0,53.4541,a8w8_blockscale_1x128x128_256x128x128x128_16x16_32x32_2x2_8x32x1_8x32x1_1x32x1x8_8_1x1_intrawave_v3,703.05,586.04,0.0
gfx942,304,2304,4096,2048,ck,0,0,54.6862,a8w8_blockscale_1x128x128_256x128x128x128_16x16_32x32_2x2_8x32x1_8x32x1_1x32x1x8_8_1x1_intrawave_v3,706.85,584.82,0.0
gfx942,304,2368,4096,2048,ck,0,0,54.7761,a8w8_blockscale_1x128x128_256x128x128x128_16x16_32x32_2x2_8x32x1_8x32x1_1x32x1x8_8_1x1_intrawave_v3,725.29,595.82,0.0
gfx942,304,2432,4096,2048,ck,0,0,56.6112,a8w8_blockscale_1x128x128_256x128x128x128_16x16_32x32_2x2_8x32x1_8x32x1_1x32x1x8_8_1x1_intrawave_v3,720.74,588.09,0.0
gfx942,304,2496,4096,2048,ck,0,0,72.0854,a8w8_blockscale_1x128x128_256x128x128x128_16x16_32x32_2x2_8x32x1_8x32x1_1x32x1x8_8_1x1_intrawave_v3,580.92,470.94,0.0
gfx942,304,2560,4096,2048,ck,0,0,70.0763,a8w8_blockscale_1x128x128_256x128x128x128_16x16_32x32_2x2_8x32x1_8x32x1_1x32x1x8_8_1x1_intrawave_v3,612.9,493.79,0.0
gfx942,304,2624,4096,2048,ck,0,0,70.6467,a8w8_blockscale_1x128x128_256x128x128x128_16x16_32x32_2x2_8x32x1_8x32x1_1x32x1x8_8_1x1_intrawave_v3,623.15,499.08,0.0
gfx942,304,2688,4096,2048,ck,0,0,74.1248,a8w8_blockscale_1x128x128_256x128x128x128_16x16_32x32_2x2_8x32x1_8x32x1_1x32x1x8_8_1x1_intrawave_v3,608.39,484.5,0.0
gfx942,304,2752,4096,2048,ck,0,0,73.7447,a8w8_blockscale_1x128x128_256x128x128x128_16x16_32x32_2x2_8x32x1_8x32x1_1x32x1x8_8_1x1_intrawave_v3,626.09,495.89,0.0
gfx942,304,2816,4096,2048,ck,0,0,72.4229,a8w8_blockscale_1x128x128_256x128x128x128_16x16_32x32_2x2_8x32x1_8x32x1_1x32x1x8_8_1x1_intrawave_v3,652.34,513.99,0.0
gfx942,304,2880,4096,2048,ck,0,0,74.4103,a8w8_blockscale_1x128x128_256x128x128x128_16x16_32x32_2x2_8x32x1_8x32x1_1x32x1x8_8_1x1_intrawave_v3,649.35,509.07,0.0
gfx942,304,2944,4096,2048,ck,0,0,71.4761,a8w8_blockscale_1x128x128_256x128x128x128_16x16_32x32_2x2_8x32x1_8x32x1_1x32x1x8_8_1x1_intrawave_v3,691.03,539.13,0.0
gfx942,304,3008,4096,2048,ck,0,0,74.1669,a8w8_blockscale_1x128x128_256x128x128x128_16x16_32x32_2x2_8x32x1_8x32x1_1x32x1x8_8_1x1_intrawave_v3,680.44,528.41,0.0
gfx942,304,3072,4096,2048,ck,0,0,75.0055,a8w8_blockscale_1x128x128_256x128x128x128_16x16_32x32_2x2_8x32x1_8x32x1_1x32x1x8_8_1x1_intrawave_v3,687.14,531.24,0.0
gfx942,304,3136,4096,2048,ck,0,0,76.3471,a8w8_blockscale_1x128x128_256x128x128x128_16x16_32x32_2x2_8x32x1_8x32x1_1x32x1x8_8_1x1_intrawave_v3,689.13,530.49,0.0
gfx942,304,3200,4096,2048,ck,0,0,73.1662,a8w8_blockscale_1x128x128_256x128x128x128_16x16_32x32_2x2_8x32x1_8x32x1_1x32x1x8_8_1x1_intrawave_v3,733.77,562.51,0.0
gfx942,304,3264,4096,2048,ck,0,0,76.4116,a8w8_blockscale_1x128x128_256x128x128x128_16x16_32x32_2x2_8x32x1_8x32x1_1x32x1x8_8_1x1_intrawave_v3,716.66,547.19,0.0
gfx942,304,3328,4096,2048,ck,0,0,78.6403,a8w8_blockscale_1x128x128_256x128x128x128_16x16_32x32_2x2_8x32x1_8x32x1_1x32x1x8_8_1x1_intrawave_v3,710.0,540.02,0.0
gfx942,304,3392,4096,2048,ck,0,0,75.3615,a8w8_blockscale_1x128x128_256x128x128x128_16x16_32x32_2x2_8x32x1_8x32x1_1x32x1x8_8_1x1_intrawave_v3,755.14,572.21,0.0
gfx942,304,3456,4096,2048,ck,0,0,76.7723,a8w8_blockscale_1x128x128_256x128x128x128_16x16_32x32_2x2_8x32x1_8x32x1_1x32x1x8_8_1x1_intrawave_v3,755.25,570.23,0.0
gfx942,304,3520,4096,2048,ck,0,0,78.2745,a8w8_blockscale_1x128x128_256x128x128x128_16x16_32x32_2x2_8x32x1_8x32x1_1x32x1x8_8_1x1_intrawave_v3,754.47,567.66,0.0
gfx942,304,3584,4096,2048,ck,0,0,80.2992,a8w8_blockscale_1x128x128_256x128x128x128_16x16_32x32_2x2_8x32x1_8x32x1_1x32x1x8_8_1x1_intrawave_v3,748.82,561.51,0.0
gfx942,304,3648,4096,2048,ck,0,0,89.2746,a8w8_blockscale_1x128x128_256x128x128x128_16x16_32x32_2x2_8x32x1_8x32x1_1x32x1x8_8_1x1_intrawave_v3,685.56,512.4,0.0
gfx942,304,3712,4096,2048,ck,0,0,91.2141,a8w8_blockscale_1x128x128_256x128x128x128_16x16_32x32_2x2_8x32x1_8x32x1_1x32x1x8_8_1x1_intrawave_v3,682.76,508.69,0.0
gfx942,304,3776,4096,2048,ck,0,0,91.9373,a8w8_blockscale_1x128x128_256x128x128x128_16x16_32x32_2x2_8x32x1_8x32x1_1x32x1x8_8_1x1_intrawave_v3,689.06,511.81,0.0
gfx942,304,3840,4096,2048,ck,0,0,92.1032,a8w8_blockscale_1x128x128_256x128x128x128_16x16_32x32_2x2_8x32x1_8x32x1_1x32x1x8_8_1x1_intrawave_v3,699.48,518.01,0.0
gfx942,304,3904,4096,2048,ck,0,0,91.2044,a8w8_blockscale_1x128x128_256x128x128x128_16x16_32x32_2x2_8x32x1_8x32x1_1x32x1x8_8_1x1_intrawave_v3,718.15,530.3,0.0
gfx942,304,3968,4096,2048,ck,0,0,94.5817,a8w8_blockscale_1x128x128_256x128x128x128_16x16_32x32_2x2_8x32x1_8x32x1_1x32x1x8_8_1x1_intrawave_v3,703.86,518.29,0.0
gfx942,304,4032,4096,2048,ck,0,0,94.4294,a8w8_blockscale_1x128x128_256x128x128x128_16x16_32x32_2x2_8x32x1_8x32x1_1x32x1x8_8_1x1_intrawave_v3,716.36,526.07,0.0
gfx942,304,4096,4096,2048,ck,0,0,94.7199,a8w8_blockscale_1x128x128_256x128x128x128_16x16_32x32_2x2_8x32x1_8x32x1_1x32x1x8_8_1x1_intrawave_v3,725.5,531.37,0.0
gfx942,304,4224,4096,2048,ck,0,0,95.8283,a8w8_blockscale_1x128x128_256x128x128x128_16x16_32x32_2x2_8x32x1_8x32x1_1x32x1x8_8_1x1_intrawave_v3,739.52,538.91,0.0
gfx942,304,4352,4096,2048,ck,0,0,97.4893,a8w8_blockscale_1x128x128_256x128x128x128_16x16_32x32_2x2_8x32x1_8x32x1_1x32x1x8_8_1x1_intrawave_v3,748.95,543.17,0.0
gfx942,304,4480,4096,2048,ck,0,0,98.3272,a8w8_blockscale_1x128x128_256x128x128x128_16x16_32x32_2x2_8x32x1_8x32x1_1x32x1x8_8_1x1_intrawave_v3,764.41,551.87,0.0
gfx942,304,4608,4096,2048,ck,0,0,97.3759,a8w8_blockscale_1x128x128_256x128x128x128_16x16_32x32_2x2_8x32x1_8x32x1_1x32x1x8_8_1x1_intrawave_v3,793.93,570.72,0.0
gfx942,304,4736,4096,2048,ck,0,0,97.7984,a8w8_blockscale_1x128x128_256x128x128x128_16x16_32x32_2x2_8x32x1_8x32x1_1x32x1x8_8_1x1_intrawave_v3,812.46,581.66,0.0
gfx942,304,4864,4096,2048,ck,0,0,100.2965,a8w8_blockscale_1x128x128_256x128x128x128_16x16_32x32_2x2_8x32x1_8x32x1_1x32x1x8_8_1x1_intrawave_v3,813.63,580.24,0.0
gfx942,304,4992,4096,2048,ck,0,0,107.8465,a8w8_blockscale_1x128x128_256x128x128x128_16x16_32x32_2x2_8x32x1_8x32x1_1x32x1x8_8_1x1_intrawave_v3,776.58,551.77,0.0
gfx942,304,5120,4096,2048,ck,0,0,112.0749,a8w8_blockscale_1x128x128_256x128x128x128_16x16_32x32_2x2_8x32x1_8x32x1_1x32x1x8_8_1x1_intrawave_v3,766.45,542.65,0.0
gfx942,304,5248,4096,2048,ck,0,0,115.7448,a8w8_blockscale_1x128x128_256x128x128x128_16x16_32x32_2x2_8x32x1_8x32x1_1x32x1x8_8_1x1_intrawave_v3,760.7,536.77,0.0
gfx942,304,5376,4096,2048,ck,0,0,118.8871,a8w8_blockscale_1x128x128_256x128x128x128_16x16_32x32_2x2_8x32x1_8x32x1_1x32x1x8_8_1x1_intrawave_v3,758.66,533.61,0.0
gfx942,304,5504,4096,2048,ck,0,0,119.9355,a8w8_blockscale_1x128x128_256x128x128x128_16x16_32x32_2x2_8x32x1_8x32x1_1x32x1x8_8_1x1_intrawave_v3,769.93,539.87,0.0
gfx942,304,5632,4096,2048,ck,0,0,119.0631,a8w8_blockscale_1x128x128_256x128x128x128_16x16_32x32_2x2_8x32x1_8x32x1_1x32x1x8_8_1x1_intrawave_v3,793.61,554.83,0.0
gfx942,304,5760,4096,2048,ck,0,0,119.9934,a8w8_blockscale_1x128x128_256x128x128x128_16x16_32x32_2x2_8x32x1_8x32x1_1x32x1x8_8_1x1_intrawave_v3,805.35,561.46,0.0
gfx942,304,5888,4096,2048,ck,0,0,119.017,a8w8_blockscale_1x128x128_256x128x128x128_16x16_32x32_2x2_8x32x1_8x32x1_1x32x1x8_8_1x1_intrawave_v3,830.0,577.07,0.0
gfx942,304,6016,4096,2048,ck,0,0,122.039,a8w8_blockscale_1x128x128_256x128x128x128_16x16_32x32_2x2_8x32x1_8x32x1_1x32x1x8_8_1x1_intrawave_v3,827.04,573.53,0.0
gfx942,304,6144,4096,2048,ck,0,0,133.1934,a8w8_blockscale_1x128x128_256x128x128x128_16x16_32x32_2x2_8x32x1_8x32x1_1x32x1x8_8_1x1_intrawave_v3,773.91,535.34,0.0
gfx942,304,6272,4096,2048,ck,0,0,135.7187,a8w8_blockscale_1x128x128_256x128x128x128_16x16_32x32_2x2_8x32x1_8x32x1_1x32x1x8_8_1x1_intrawave_v3,775.33,535.03,0.0
gfx942,304,6400,4096,2048,ck,0,0,136.6489,a8w8_blockscale_1x128x128_256x128x128x128_16x16_32x32_2x2_8x32x1_8x32x1_1x32x1x8_8_1x1_intrawave_v3,785.77,540.98,0.0
gfx942,304,6528,4096,2048,ck,0,0,137.1975,a8w8_blockscale_1x128x128_256x128x128x128_16x16_32x32_2x2_8x32x1_8x32x1_1x32x1x8_8_1x1_intrawave_v3,798.28,548.37,0.0
gfx942,304,6656,4096,2048,ck,0,0,137.3158,a8w8_blockscale_1x128x128_256x128x128x128_16x16_32x32_2x2_8x32x1_8x32x1_1x32x1x8_8_1x1_intrawave_v3,813.23,557.45,0.0
gfx942,304,6784,4096,2048,ck,0,0,139.8751,a8w8_blockscale_1x128x128_256x128x128x128_16x16_32x32_2x2_8x32x1_8x32x1_1x32x1x8_8_1x1_intrawave_v3,813.7,556.62,0.0
gfx942,304,6912,4096,2048,ck,0,0,136.7639,a8w8_blockscale_1x128x128_256x128x128x128_16x16_32x32_2x2_8x32x1_8x32x1_1x32x1x8_8_1x1_intrawave_v3,847.91,578.86,0.0
gfx942,304,7040,4096,2048,ck,0,0,139.7784,a8w8_blockscale_1x128x128_256x128x128x128_16x16_32x32_2x2_8x32x1_8x32x1_1x32x1x8_8_1x1_intrawave_v3,844.99,575.76,0.0
gfx942,304,7168,4096,2048,ck,0,0,144.2037,a8w8_blockscale_1x128x128_256x128x128x128_16x16_32x32_2x2_8x32x1_8x32x1_1x32x1x8_8_1x1_intrawave_v3,833.95,567.18,0.0
gfx942,304,7296,4096,2048,ck,0,0,149.6321,a8w8_blockscale_1x128x128_256x128x128x128_16x16_32x32_2x2_8x32x1_8x32x1_1x32x1x8_8_1x1_intrawave_v3,818.05,555.36,0.0
gfx942,304,7424,4096,2048,ck,0,0,152.7927,a8w8_blockscale_1x128x128_256x128x128x128_16x16_32x32_2x2_8x32x1_8x32x1_1x32x1x8_8_1x1_intrawave_v3,815.18,552.45,0.0
gfx942,304,7552,4096,2048,ck,0,0,158.4597,a8w8_blockscale_1x128x128_256x128x128x128_16x16_32x32_2x2_8x32x1_8x32x1_1x32x1x8_8_1x1_intrawave_v3,799.58,540.96,0.0
gfx942,304,7680,4096,2048,ck,0,0,158.1844,a8w8_blockscale_1x128x128_256x128x128x128_16x16_32x32_2x2_8x32x1_8x32x1_1x32x1x8_8_1x1_intrawave_v3,814.55,550.19,0.0
gfx942,304,7808,4096,2048,ck,0,0,161.5248,a8w8_blockscale_1x128x128_256x128x128x128_16x16_32x32_2x2_8x32x1_8x32x1_1x32x1x8_8_1x1_intrawave_v3,811.0,546.93,0.0
gfx942,304,7936,4096,2048,ck,0,0,159.8906,a8w8_blockscale_1x128x128_256x128x128x128_16x16_32x32_2x2_8x32x1_8x32x1_1x32x1x8_8_1x1_intrawave_v3,832.72,560.72,0.0
gfx942,304,8064,4096,2048,ck,0,0,161.9575,a8w8_blockscale_1x128x128_256x128x128x128_16x16_32x32_2x2_8x32x1_8x32x1_1x32x1x8_8_1x1_intrawave_v3,835.35,561.65,0.0
gfx942,304,8192,4096,2048,ck,0,0,163.9345,a8w8_blockscale_1x128x128_256x128x128x128_16x16_32x32_2x2_8x32x1_8x32x1_1x32x1x8_8_1x1_intrawave_v3,838.38,562.88,0.0
gfx942,304,8320,4096,2048,ck,0,0,166.6807,a8w8_blockscale_1x128x128_256x128x128x128_16x16_32x32_2x2_8x32x1_8x32x1_1x32x1x8_8_1x1_intrawave_v3,837.45,561.47,0.0
gfx942,304,8448,4096,2048,ck,0,0,167.1902,a8w8_blockscale_1x128x128_256x128x128x128_16x16_32x32_2x2_8x32x1_8x32x1_1x32x1x8_8_1x1_intrawave_v3,847.74,567.59,0.0
gfx942,304,8576,4096,2048,ck,0,0,173.4449,a8w8_blockscale_1x128x128_256x128x128x128_16x16_32x32_2x2_8x32x1_8x32x1_1x32x1x8_8_1x1_intrawave_v3,829.55,554.68,0.0
gfx942,304,8704,4096,2048,ck,0,0,176.8896,a8w8_blockscale_1x128x128_256x128x128x128_16x16_32x32_2x2_8x32x1_8x32x1_1x32x1x8_8_1x1_intrawave_v3,825.54,551.29,0.0
gfx942,304,8832,4096,2048,ck,0,0,180.1158,a8w8_blockscale_1x128x128_256x128x128x128_16x16_32x32_2x2_8x32x1_8x32x1_1x32x1x8_8_1x1_intrawave_v3,822.67,548.69,0.0
gfx942,304,8960,4096,2048,ck,0,0,181.5099,a8w8_blockscale_1x128x128_256x128x128x128_16x16_32x32_2x2_8x32x1_8x32x1_1x32x1x8_8_1x1_intrawave_v3,828.19,551.7,0.0
gfx942,304,9088,4096,2048,ck,0,0,182.0846,a8w8_blockscale_1x128x128_256x128x128x128_16x16_32x32_2x2_8x32x1_8x32x1_1x32x1x8_8_1x1_intrawave_v3,837.37,557.16,0.0
gfx942,304,9216,4096,2048,ck,0,0,184.9483,a8w8_blockscale_1x128x128_256x128x128x128_16x16_32x32_2x2_8x32x1_8x32x1_1x32x1x8_8_1x1_intrawave_v3,836.01,555.62,0.0
gfx942,304,9344,4096,2048,ck,0,0,184.9644,a8w8_blockscale_1x128x128_256x128x128x128_16x16_32x32_2x2_8x32x1_8x32x1_1x32x1x8_8_1x1_intrawave_v3,847.55,562.66,0.0
gfx942,304,9472,4096,2048,ck,0,0,184.7817,a8w8_blockscale_1x128x128_256x128x128x128_16x16_32x32_2x2_8x32x1_8x32x1_1x32x1x8_8_1x1_intrawave_v3,860.01,570.3,0.0
gfx942,304,9728,4096,2048,ck,0,0,185.4447,a8w8_blockscale_1x128x128_256x128x128x128_16x16_32x32_2x2_8x32x1_8x32x1_1x32x1x8_8_1x1_intrawave_v3,880.09,582.4,0.0
gfx942,304,9856,4096,2048,ck,0,0,199.5775,a8w8_blockscale_1x128x128_256x128x128x128_16x16_32x32_2x2_8x32x1_8x32x1_1x32x1x8_8_1x1_intrawave_v3,828.53,547.73,0.0
gfx942,304,9984,4096,2048,ck,0,0,196.6453,a8w8_blockscale_1x128x128_256x128x128x128_16x16_32x32_2x2_8x32x1_8x32x1_1x32x1x8_8_1x1_intrawave_v3,851.81,562.56,0.0
gfx942,304,10112,4096,2048,ck,0,0,202.2591,a8w8_blockscale_1x128x128_256x128x128x128_16x16_32x32_2x2_8x32x1_8x32x1_1x32x1x8_8_1x1_intrawave_v3,838.78,553.43,0.0
gfx942,304,10240,4096,2048,ck,0,0,201.9253,a8w8_blockscale_1x128x128_256x128x128x128_16x16_32x32_2x2_8x32x1_8x32x1_1x32x1x8_8_1x1_intrawave_v3,850.8,560.83,0.0
gfx942,304,10368,4096,2048,ck,0,0,202.8894,a8w8_blockscale_1x128x128_256x128x128x128_16x16_32x32_2x2_8x32x1_8x32x1_1x32x1x8_8_1x1_intrawave_v3,857.34,564.63,0.0
gfx942,304,10496,4096,2048,ck,0,0,205.2715,a8w8_blockscale_1x128x128_256x128x128x128_16x16_32x32_2x2_8x32x1_8x32x1_1x32x1x8_8_1x1_intrawave_v3,857.86,564.46,0.0
gfx942,304,10624,4096,2048,ck,0,0,205.4827,a8w8_blockscale_1x128x128_256x128x128x128_16x16_32x32_2x2_8x32x1_8x32x1_1x32x1x8_8_1x1_intrawave_v3,867.43,570.26,0.0
gfx942,304,10752,4096,2048,ck,0,0,202.7332,a8w8_blockscale_1x128x128_256x128x128x128_16x16_32x32_2x2_8x32x1_8x32x1_1x32x1x8_8_1x1_intrawave_v3,889.78,584.46,0.0
gfx942,304,10880,4096,2048,ck,0,0,212.3157,a8w8_blockscale_1x128x128_256x128x128x128_16x16_32x32_2x2_8x32x1_8x32x1_1x32x1x8_8_1x1_intrawave_v3,859.74,564.25,0.0
gfx942,304,11008,4096,2048,ck,0,0,219.6034,a8w8_blockscale_1x128x128_256x128x128x128_16x16_32x32_2x2_8x32x1_8x32x1_1x32x1x8_8_1x1_intrawave_v3,840.99,551.5,0.0
gfx942,304,11136,4096,2048,ck,0,0,219.2499,a8w8_blockscale_1x128x128_256x128x128x128_16x16_32x32_2x2_8x32x1_8x32x1_1x32x1x8_8_1x1_intrawave_v3,852.14,558.36,0.0
gfx942,304,11264,4096,2048,ck,0,0,216.8645,a8w8_blockscale_1x128x128_256x128x128x128_16x16_32x32_2x2_8x32x1_8x32x1_1x32x1x8_8_1x1_intrawave_v3,871.41,570.55,0.0
gfx942,304,11392,4096,2048,ck,0,0,223.1431,a8w8_blockscale_1x128x128_256x128x128x128_16x16_32x32_2x2_8x32x1_8x32x1_1x32x1x8_8_1x1_intrawave_v3,856.52,560.37,0.0
gfx942,304,11520,4096,2048,ck,0,0,220.5022,a8w8_blockscale_1x128x128_256x128x128x128_16x16_32x32_2x2_8x32x1_8x32x1_1x32x1x8_8_1x1_intrawave_v3,876.52,573.03,0.0
gfx942,304,11648,4096,2048,ck,0,0,223.6377,a8w8_blockscale_1x128x128_256x128x128x128_16x16_32x32_2x2_8x32x1_8x32x1_1x32x1x8_8_1x1_intrawave_v3,873.83,570.85,0.0
gfx942,304,11776,4096,2048,ck,0,0,223.9282,a8w8_blockscale_1x128x128_256x128x128x128_16x16_32x32_2x2_8x32x1_8x32x1_1x32x1x8_8_1x1_intrawave_v3,882.29,575.97,0.0
gfx942,304,11904,4096,2048,ck,0,0,228.7399,a8w8_blockscale_1x128x128_256x128x128x128_16x16_32x32_2x2_8x32x1_8x32x1_1x32x1x8_8_1x1_intrawave_v3,873.11,569.58,0.0
gfx942,304,12032,4096,2048,ck,0,0,229.9278,a8w8_blockscale_1x128x128_256x128x128x128_16x16_32x32_2x2_8x32x1_8x32x1_1x32x1x8_8_1x1_intrawave_v3,877.94,572.34,0.0
gfx942,304,12160,4096,2048,ck,0,0,232.5353,a8w8_blockscale_1x128x128_256x128x128x128_16x16_32x32_2x2_8x32x1_8x32x1_1x32x1x8_8_1x1_intrawave_v3,877.33,571.56,0.0
gfx942,304,12288,4096,2048,ck,0,0,237.7962,a8w8_blockscale_1x128x128_256x128x128x128_16x16_32x32_2x2_8x32x1_8x32x1_1x32x1x8_8_1x1_intrawave_v3,866.95,564.42,0.0
gfx942,304,12416,4096,2048,ck,0,0,245.2568,a8w8_blockscale_1x128x128_256x128x128x128_16x16_32x32_2x2_8x32x1_8x32x1_1x32x1x8_8_1x1_intrawave_v3,849.34,552.6,0.0
gfx942,304,12544,4096,2048,ck,0,0,239.2643,a8w8_blockscale_1x128x128_256x128x128x128_16x16_32x32_2x2_8x32x1_8x32x1_1x32x1x8_8_1x1_intrawave_v3,879.59,571.92,0.0
gfx942,304,12672,4096,2048,ck,0,0,238.4353,a8w8_blockscale_1x128x128_256x128x128x128_16x16_32x32_2x2_8x32x1_8x32x1_1x32x1x8_8_1x1_intrawave_v3,891.65,579.4,0.0
gfx942,304,12800,4096,2048,ck,0,0,244.6115,a8w8_blockscale_1x128x128_256x128x128x128_16x16_32x32_2x2_8x32x1_8x32x1_1x32x1x8_8_1x1_intrawave_v3,877.92,570.13,0.0
gfx942,304,13056,4096,2048,ck,0,0,251.385,a8w8_blockscale_1x128x128_256x128x128x128_16x16_32x32_2x2_8x32x1_8x32x1_1x32x1x8_8_1x1_intrawave_v3,871.35,565.2,0.0
gfx942,304,13184,4096,2048,ck,0,0,246.2387,a8w8_blockscale_1x128x128_256x128x128x128_16x16_32x32_2x2_8x32x1_8x32x1_1x32x1x8_8_1x1_intrawave_v3,898.28,582.33,0.0
gfx942,304,13440,4096,2048,ck,0,0,256.523,a8w8_blockscale_1x128x128_256x128x128x128_16x16_32x32_2x2_8x32x1_8x32x1_1x32x1x8_8_1x1_intrawave_v3,879.01,569.21,0.0
gfx942,304,13568,4096,2048,ck,0,0,263.4101,a8w8_blockscale_1x128x128_256x128x128x128_16x16_32x32_2x2_8x32x1_8x32x1_1x32x1x8_8_1x1_intrawave_v3,864.18,559.3,0.0
gfx942,304,13696,4096,2048,ck,0,0,262.6563,a8w8_blockscale_1x128x128_256x128x128x128_16x16_32x32_2x2_8x32x1_8x32x1_1x32x1x8_8_1x1_intrawave_v3,874.83,565.89,0.0
gfx942,304,13824,4096,2048,ck,0,0,264.2141,a8w8_blockscale_1x128x128_256x128x128x128_16x16_32x32_2x2_8x32x1_8x32x1_1x32x1x8_8_1x1_intrawave_v3,877.8,567.52,0.0
gfx942,304,13952,4096,2048,ck,0,0,263.1127,a8w8_blockscale_1x128x128_256x128x128x128_16x16_32x32_2x2_8x32x1_8x32x1_1x32x1x8_8_1x1_intrawave_v3,889.64,574.88,0.0
gfx942,304,14080,4096,2048,ck,0,0,265.9444,a8w8_blockscale_1x128x128_256x128x128x128_16x16_32x32_2x2_8x32x1_8x32x1_1x32x1x8_8_1x1_intrawave_v3,888.24,573.68,0.0
gfx942,304,14208,4096,2048,ck,0,0,266.2062,a8w8_blockscale_1x128x128_256x128x128x128_16x16_32x32_2x2_8x32x1_8x32x1_1x32x1x8_8_1x1_intrawave_v3,895.44,578.04,0.0
gfx942,304,14336,4096,2048,ck,0,0,270.8062,a8w8_blockscale_1x128x128_256x128x128x128_16x16_32x32_2x2_8x32x1_8x32x1_1x32x1x8_8_1x1_intrawave_v3,888.16,573.06,0.0
gfx942,304,14464,4096,2048,ck,0,0,271.2959,a8w8_blockscale_1x128x128_256x128x128x128_16x16_32x32_2x2_8x32x1_8x32x1_1x32x1x8_8_1x1_intrawave_v3,894.47,576.86,0.0
gfx942,304,14592,4096,2048,ck,0,0,272.1626,a8w8_blockscale_1x128x128_256x128x128x128_16x16_32x32_2x2_8x32x1_8x32x1_1x32x1x8_8_1x1_intrawave_v3,899.51,579.84,0.0
gfx942,304,14848,4096,2048,ck,0,0,279.5618,a8w8_blockscale_1x128x128_256x128x128x128_16x16_32x32_2x2_8x32x1_8x32x1_1x32x1x8_8_1x1_intrawave_v3,891.07,573.87,0.0
gfx942,304,14976,4096,2048,ck,0,0,291.3712,a8w8_blockscale_1x128x128_256x128x128x128_16x16_32x32_2x2_8x32x1_8x32x1_1x32x1x8_8_1x1_intrawave_v3,862.32,555.11,0.0
gfx942,304,15104,4096,2048,ck,0,0,281.2903,a8w8_blockscale_1x128x128_256x128x128x128_16x16_32x32_2x2_8x32x1_8x32x1_1x32x1x8_8_1x1_intrawave_v3,900.86,579.66,0.0
gfx942,304,15232,4096,2048,ck,0,0,284.152,a8w8_blockscale_1x128x128_256x128x128x128_16x16_32x32_2x2_8x32x1_8x32x1_1x32x1x8_8_1x1_intrawave_v3,899.34,578.44,0.0
gfx942,304,15360,4096,2048,ck,0,0,286.3362,a8w8_blockscale_1x128x128_256x128x128x128_16x16_32x32_2x2_8x32x1_8x32x1_1x32x1x8_8_1x1_intrawave_v3,899.98,578.6,0.0
gfx942,304,15488,4096,2048,ck,0,0,290.831,a8w8_blockscale_1x128x128_256x128x128x128_16x16_32x32_2x2_8x32x1_8x32x1_1x32x1x8_8_1x1_intrawave_v3,893.46,574.17,0.0
gfx942,304,15616,4096,2048,ck,0,0,291.7742,a8w8_blockscale_1x128x128_256x128x128x128_16x16_32x32_2x2_8x32x1_8x32x1_1x32x1x8_8_1x1_intrawave_v3,897.93,576.8,0.0
gfx942,304,15744,4096,2048,ck,0,0,294.4724,a8w8_blockscale_1x128x128_256x128x128x128_16x16_32x32_2x2_8x32x1_8x32x1_1x32x1x8_8_1x1_intrawave_v3,897.0,575.97,0.0
gfx942,304,15872,4096,2048,ck,0,0,301.2079,a8w8_blockscale_1x128x128_256x128x128x128_16x16_32x32_2x2_8x32x1_8x32x1_1x32x1x8_8_1x1_intrawave_v3,884.07,567.44,0.0
gfx942,304,16000,4096,2048,ck,0,0,301.6716,a8w8_blockscale_1x128x128_256x128x128x128_16x16_32x32_2x2_8x32x1_8x32x1_1x32x1x8_8_1x1_intrawave_v3,889.83,570.91,0.0
gfx942,304,16256,4096,2048,ck,0,0,303.6899,a8w8_blockscale_1x128x128_256x128x128x128_16x16_32x32_2x2_8x32x1_8x32x1_1x32x1x8_8_1x1_intrawave_v3,898.06,575.75,0.0
gfx942,304,16384,4096,2048,ck,0,0,308.0796,a8w8_blockscale_1x128x128_256x128x128x128_16x16_32x32_2x2_8x32x1_8x32x1_1x32x1x8_8_1x1_intrawave_v3,892.23,571.8,0.0
gfx942,304,16512,4096,2048,ck,0,0,309.4348,a8w8_blockscale_1x128x128_256x128x128x128_16x16_32x32_2x2_8x32x1_8x32x1_1x32x1x8_8_1x1_intrawave_v3,895.26,573.53,0.0
gfx942,304,1,6144,256,ck,8,0,3.0403,a8w8_blockscale_1x128x128_256x16x64x256_16x16_16x16_1x1_16x16x1_16x16x1_1x16x1x16_4_1x1_intrawave_v1,1.03,521.46,0.0
gfx942,304,2,6144,256,ck,8,0,3.036,a8w8_blockscale_1x128x128_256x16x64x256_16x16_16x16_1x1_16x16x1_16x16x1_1x16x1x16_4_1x1_intrawave_v1,2.07,526.33,0.0
gfx942,304,4,6144,256,ck,8,0,3.5625,a8w8_blockscale_1x128x128_256x16x64x256_16x16_16x16_1x1_16x16x1_16x16x1_1x16x1x16_4_1x1_intrawave_v1,3.53,455.59,0.0
gfx942,304,8,6144,256,ck,8,0,3.0758,a8w8_blockscale_1x128x128_256x16x64x256_16x16_16x16_1x1_16x16x1_16x16x1_1x16x1x16_4_1x1_intrawave_v1,8.18,543.99,0.0
gfx942,304,16,6144,256,ck,6,0,3.1518,a8w8_blockscale_1x128x128_256x16x64x128_8x16_16x16_1x1_16x16x1_8x32x1_1x16x1x16_4_1x1_intrawave_v1,15.97,562.72,0.0
gfx942,304,32,6144,256,ck,8,0,3.3471,a8w8_blockscale_1x128x128_256x16x64x256_16x16_16x16_1x1_16x16x1_16x16x1_1x16x1x16_4_1x1_intrawave_v1,30.07,589.85,0.0
gfx942,304,48,6144,256,ck,6,0,3.3991,a8w8_blockscale_1x128x128_256x16x64x128_8x16_16x16_1x1_16x16x1_8x32x1_1x16x1x16_4_1x1_intrawave_v1,44.42,639.87,0.0
gfx942,304,64,6144,256,ck,8,0,4.3362,a8w8_blockscale_1x128x128_256x16x64x256_16x16_16x16_1x1_16x16x1_16x16x1_1x16x1x16_4_1x1_intrawave_v1,46.43,547.87,0.0
gfx942,304,80,6144,256,ck,11,0,4.4283,a8w8_blockscale_1x128x128_256x32x64x128_16x16_16x16_2x1_8x32x1_8x32x1_1x32x1x8_8_2x1_intrawave_v1,56.83,581.8,0.0
gfx942,304,96,6144,256,ck,8,0,4.4487,a8w8_blockscale_1x128x128_256x16x64x256_16x16_16x16_1x1_16x16x1_16x16x1_1x16x1x16_4_1x1_intrawave_v1,67.88,624.25,0.0
gfx942,304,112,6144,256,ck,8,0,4.2951,a8w8_blockscale_1x128x128_256x16x64x256_16x16_16x16_1x1_16x16x1_16x16x1_1x16x1x16_4_1x1_intrawave_v1,82.03,693.3,0.0
gfx942,304,128,6144,256,ck,8,0,4.3604,a8w8_blockscale_1x128x128_256x16x64x256_16x16_16x16_1x1_16x16x1_16x16x1_1x16x1x16_4_1x1_intrawave_v1,92.34,728.95,0.0
gfx942,304,144,6144,256,ck,10,0,4.3137,a8w8_blockscale_1x128x128_256x32x128x128_16x16_32x32_1x1_8x32x1_8x32x1_1x32x1x8_8_1x1_intrawave_v1,105.01,783.36,0.0
gfx942,304,160,6144,256,ck,16,0,5.1011,a8w8_blockscale_1x128x128_256x64x64x128_16x16_32x32_1x1_8x32x1_8x32x1_1x32x1x8_8_1x1_intrawave_v1,98.67,701.79,0.0
gfx942,304,176,6144,256,ck,16,0,4.5532,a8w8_blockscale_1x128x128_256x64x64x128_16x16_32x32_1x1_8x32x1_8x32x1_1x32x1x8_8_1x1_intrawave_v1,121.6,830.32,0.0
gfx942,304,192,6144,256,ck,18,0,4.4708,a8w8_blockscale_1x128x128_256x64x64x256_16x16_32x32_1x1_16x16x1_16x16x1_1x32x1x8_8_1x1_intrawave_v1,135.09,890.51,0.0
gfx942,304,208,6144,256,ck,11,0,5.1621,a8w8_blockscale_1x128x128_256x32x64x128_16x16_16x16_2x1_8x32x1_8x32x1_1x32x1x8_8_2x1_intrawave_v1,126.75,810.14,0.0
gfx942,304,224,6144,256,ck,6,0,5.2465,a8w8_blockscale_1x128x128_256x16x64x128_8x16_16x16_1x1_16x16x1_8x32x1_1x16x1x16_4_1x1_intrawave_v1,134.31,835.36,0.0
gfx942,304,240,6144,256,ck,11,0,5.4867,a8w8_blockscale_1x128x128_256x32x64x128_16x16_16x16_2x1_8x32x1_8x32x1_1x32x1x8_8_2x1_intrawave_v1,137.6,835.37,0.0
gfx942,304,256,6144,256,ck,6,0,5.2709,a8w8_blockscale_1x128x128_256x16x64x128_8x16_16x16_1x1_16x16x1_8x32x1_1x16x1x16_4_1x1_intrawave_v1,152.78,907.65,0.0
gfx942,304,288,6144,256,ck,11,0,5.3401,a8w8_blockscale_1x128x128_256x32x64x128_16x16_16x16_2x1_8x32x1_8x32x1_1x32x1x8_8_2x1_intrawave_v1,169.65,971.06,0.0
gfx942,304,320,6144,256,ck,16,0,6.9523,a8w8_blockscale_1x128x128_256x64x64x128_16x16_32x32_1x1_8x32x1_8x32x1_1x32x1x8_8_1x1_intrawave_v1,144.79,803.61,0.0
gfx942,304,352,6144,256,ck,18,0,6.383,a8w8_blockscale_1x128x128_256x64x64x256_16x16_32x32_1x1_16x16x1_16x16x1_1x32x1x8_8_1x1_intrawave_v1,173.48,938.17,0.0
gfx942,304,384,6144,256,ck,11,0,6.1237,a8w8_blockscale_1x128x128_256x32x64x128_16x16_16x16_2x1_8x32x1_8x32x1_1x32x1x8_8_2x1_intrawave_v1,197.26,1043.45,0.0
gfx942,304,416,6144,256,ck,11,0,8.3422,a8w8_blockscale_1x128x128_256x32x64x128_16x16_16x16_2x1_8x32x1_8x32x1_1x32x1x8_8_2x1_intrawave_v1,156.87,814.07,0.0
gfx942,304,448,6144,256,ck,11,0,7.4736,a8w8_blockscale_1x128x128_256x32x64x128_16x16_16x16_2x1_8x32x1_8x32x1_1x32x1x8_8_2x1_intrawave_v1,188.57,962.4,0.0
gfx942,304,480,6144,256,ck,11,0,8.1375,a8w8_blockscale_1x128x128_256x32x64x128_16x16_16x16_2x1_8x32x1_8x32x1_1x32x1x8_8_2x1_intrawave_v1,185.55,933.21,0.0
gfx942,304,512,6144,256,ck,16,0,7.9359,a8w8_blockscale_1x128x128_256x64x64x128_16x16_32x32_1x1_8x32x1_8x32x1_1x32x1x8_8_1x1_intrawave_v1,202.95,1007.5,0.0
gfx942,304,544,6144,256,ck,16,0,8.0527,a8w8_blockscale_1x128x128_256x64x64x128_16x16_32x32_1x1_8x32x1_8x32x1_1x32x1x8_8_1x1_intrawave_v1,212.51,1042.73,0.0
gfx942,304,576,6144,256,ck,16,0,8.0717,a8w8_blockscale_1x128x128_256x64x64x128_16x16_32x32_1x1_8x32x1_8x32x1_1x32x1x8_8_1x1_intrawave_v1,224.48,1090.01,0.0
gfx942,304,608,6144,256,ck,10,0,9.0516,a8w8_blockscale_1x128x128_256x32x128x128_16x16_32x32_1x1_8x32x1_8x32x1_1x32x1x8_8_1x1_intrawave_v1,211.3,1016.35,0.0
gfx942,304,640,6144,256,ck,16,0,9.149,a8w8_blockscale_1x128x128_256x64x64x128_16x16_32x32_1x1_8x32x1_8x32x1_1x32x1x8_8_1x1_intrawave_v1,220.05,1049.41,0.0
gfx942,304,672,6144,256,ck,16,0,9.3623,a8w8_blockscale_1x128x128_256x64x64x128_16x16_32x32_1x1_8x32x1_8x32x1_1x32x1x8_8_1x1_intrawave_v1,225.79,1068.37,0.0
gfx942,304,704,6144,256,ck,11,0,9.4642,a8w8_blockscale_1x128x128_256x32x64x128_16x16_16x16_2x1_8x32x1_8x32x1_1x32x1x8_8_2x1_intrawave_v1,234.0,1099.28,0.0
gfx942,304,736,6144,256,ck,16,0,9.6234,a8w8_blockscale_1x128x128_256x64x64x128_16x16_32x32_1x1_8x32x1_8x32x1_1x32x1x8_8_1x1_intrawave_v1,240.59,1122.81,0.0
gfx942,304,768,6144,256,ck,16,0,10.4406,a8w8_blockscale_1x128x128_256x64x64x128_16x16_32x32_1x1_8x32x1_8x32x1_1x32x1x8_8_1x1_intrawave_v1,231.4,1073.37,0.0
gfx942,304,800,6144,256,ck,11,0,10.3591,a8w8_blockscale_1x128x128_256x32x64x128_16x16_16x16_2x1_8x32x1_8x32x1_1x32x1x8_8_2x1_intrawave_v1,242.93,1120.57,0.0
gfx942,304,832,6144,256,ck,11,0,11.5785,a8w8_blockscale_1x128x128_256x32x64x128_16x16_16x16_2x1_8x32x1_8x32x1_1x32x1x8_8_2x1_intrawave_v1,226.04,1037.22,0.0
gfx942,304,864,6144,256,ck,11,0,11.3865,a8w8_blockscale_1x128x128_256x32x64x128_16x16_16x16_2x1_8x32x1_8x32x1_1x32x1x8_8_2x1_intrawave_v1,238.7,1089.96,0.0
gfx942,304,896,6144,256,ck,11,0,11.3715,a8w8_blockscale_1x128x128_256x32x64x128_16x16_16x16_2x1_8x32x1_8x32x1_1x32x1x8_8_2x1_intrawave_v1,247.86,1126.7,0.0
gfx942,304,928,6144,256,ck,16,0,12.1085,a8w8_blockscale_1x128x128_256x64x64x128_16x16_32x32_1x1_8x32x1_8x32x1_1x32x1x8_8_1x1_intrawave_v1,241.09,1091.27,0.0
gfx942,304,960,6144,256,ck,11,0,11.8949,a8w8_blockscale_1x128x128_256x32x64x128_16x16_16x16_2x1_8x32x1_8x32x1_1x32x1x8_8_2x1_intrawave_v1,253.88,1144.62,0.0
gfx942,304,992,6144,256,ck,11,0,11.8446,a8w8_blockscale_1x128x128_256x32x64x128_16x16_16x16_2x1_8x32x1_8x32x1_1x32x1x8_8_2x1_intrawave_v1,263.46,1183.37,0.0
gfx942,304,1024,6144,256,ck,16,0,12.6792,a8w8_blockscale_1x128x128_256x64x64x128_16x16_32x32_1x1_8x32x1_8x32x1_1x32x1x8_8_1x1_intrawave_v1,254.06,1137.13,0.0
gfx942,304,1088,6144,256,ck,11,0,13.4146,a8w8_blockscale_1x128x128_256x32x64x128_16x16_16x16_2x1_8x32x1_8x32x1_1x32x1x8_8_2x1_intrawave_v1,255.14,1134.64,0.0
gfx942,304,1152,6144,256,ck,10,0,13.8895,a8w8_blockscale_1x128x128_256x32x128x128_16x16_32x32_1x1_8x32x1_8x32x1_1x32x1x8_8_1x1_intrawave_v1,260.91,1153.64,0.0
gfx942,304,1216,6144,256,ck,16,0,13.7173,a8w8_blockscale_1x128x128_256x64x64x128_16x16_32x32_1x1_8x32x1_8x32x1_1x32x1x8_8_1x1_intrawave_v1,278.86,1226.65,0.0
gfx942,304,1280,6144,256,ck,16,0,14.8156,a8w8_blockscale_1x128x128_256x64x64x128_16x16_32x32_1x1_8x32x1_8x32x1_1x32x1x8_8_1x1_intrawave_v1,271.78,1189.91,0.0
gfx942,304,1344,6144,256,ck,16,0,14.3684,a8w8_blockscale_1x128x128_256x64x64x128_16x16_32x32_1x1_8x32x1_8x32x1_1x32x1x8_8_1x1_intrawave_v1,294.25,1282.82,0.0
gfx942,304,1408,6144,256,ck,16,0,14.637,a8w8_blockscale_1x128x128_256x64x64x128_16x16_32x32_1x1_8x32x1_8x32x1_1x32x1x8_8_1x1_intrawave_v1,302.6,1314.12,0.0
gfx942,304,1472,6144,256,ck,16,0,16.1277,a8w8_blockscale_1x128x128_256x64x64x128_16x16_32x32_1x1_8x32x1_8x32x1_1x32x1x8_8_1x1_intrawave_v1,287.12,1242.44,0.0
gfx942,304,1536,6144,256,ck,16,0,16.0528,a8w8_blockscale_1x128x128_256x64x64x128_16x16_32x32_1x1_8x32x1_8x32x1_1x32x1x8_8_1x1_intrawave_v1,301.0,1298.24,0.0
gfx942,304,1600,6144,256,ck,16,0,16.7752,a8w8_blockscale_1x128x128_256x64x64x128_16x16_32x32_1x1_8x32x1_8x32x1_1x32x1x8_8_1x1_intrawave_v1,300.04,1290.19,0.0
gfx942,304,1664,6144,256,ck,11,0,18.1659,a8w8_blockscale_1x128x128_256x32x64x128_16x16_16x16_2x1_8x32x1_8x32x1_1x32x1x8_8_2x1_intrawave_v1,288.15,1235.62,0.0
gfx942,304,1728,6144,256,ck,16,0,17.9202,a8w8_blockscale_1x128x128_256x64x64x128_16x16_32x32_1x1_8x32x1_8x32x1_1x32x1x8_8_1x1_intrawave_v1,303.33,1297.36,0.0
gfx942,304,1792,6144,256,ck,16,0,18.7412,a8w8_blockscale_1x128x128_256x64x64x128_16x16_32x32_1x1_8x32x1_8x32x1_1x32x1x8_8_1x1_intrawave_v1,300.79,1283.36,0.0
gfx942,304,1856,6144,256,ck,16,0,19.3365,a8w8_blockscale_1x128x128_256x64x64x128_16x16_32x32_1x1_8x32x1_8x32x1_1x32x1x8_8_1x1_intrawave_v1,301.94,1285.37,0.0
gfx942,304,1920,6144,256,ck,16,0,19.0186,a8w8_blockscale_1x128x128_256x64x64x128_16x16_32x32_1x1_8x32x1_8x32x1_1x32x1x8_8_1x1_intrawave_v1,317.57,1349.07,0.0
gfx942,304,1984,6144,256,ck,16,0,19.2638,a8w8_blockscale_1x128x128_256x64x64x128_16x16_32x32_1x1_8x32x1_8x32x1_1x32x1x8_8_1x1_intrawave_v1,323.98,1373.57,0.0
gfx942,304,2048,6144,256,ck,16,0,19.7537,a8w8_blockscale_1x128x128_256x64x64x128_16x16_32x32_1x1_8x32x1_8x32x1_1x32x1x8_8_1x1_intrawave_v1,326.14,1380.15,0.0
gfx942,304,2112,6144,256,ck,16,0,21.4496,a8w8_blockscale_1x128x128_256x64x64x128_16x16_32x32_1x1_8x32x1_8x32x1_1x32x1x8_8_1x1_intrawave_v1,309.74,1308.45,0.0
gfx942,304,2176,6144,256,ck,16,0,21.6322,a8w8_blockscale_1x128x128_256x64x64x128_16x16_32x32_1x1_8x32x1_8x32x1_1x32x1x8_8_1x1_intrawave_v1,316.43,1334.52,0.0
gfx942,304,2240,6144,256,ck,16,0,22.2412,a8w8_blockscale_1x128x128_256x64x64x128_16x16_32x32_1x1_8x32x1_8x32x1_1x32x1x8_8_1x1_intrawave_v1,316.82,1334.07,0.0
gfx942,304,2304,6144,256,ck,16,0,22.5839,a8w8_blockscale_1x128x128_256x64x64x128_16x16_32x32_1x1_8x32x1_8x32x1_1x32x1x8_8_1x1_intrawave_v1,320.93,1349.38,0.0
gfx942,304,2368,6144,256,ck,16,0,22.5196,a8w8_blockscale_1x128x128_256x64x64x128_16x16_32x32_1x1_8x32x1_8x32x1_1x32x1x8_8_1x1_intrawave_v1,330.78,1388.88,0.0
gfx942,304,2432,6144,256,ck,16,0,22.6839,a8w8_blockscale_1x128x128_256x64x64x128_16x16_32x32_1x1_8x32x1_8x32x1_1x32x1x8_8_1x1_intrawave_v1,337.26,1414.21,0.0
gfx942,304,2496,6144,256,ck,16,0,24.31,a8w8_blockscale_1x128x128_256x64x64x128_16x16_32x32_1x1_8x32x1_8x32x1_1x32x1x8_8_1x1_intrawave_v1,322.98,1352.64,0.0
gfx942,304,2560,6144,256,ck,16,0,24.0748,a8w8_blockscale_1x128x128_256x64x64x128_16x16_32x32_1x1_8x32x1_8x32x1_1x32x1x8_8_1x1_intrawave_v1,334.5,1399.2,0.0
gfx942,304,2624,6144,256,ck,16,0,24.2376,a8w8_blockscale_1x128x128_256x64x64x128_16x16_32x32_1x1_8x32x1_8x32x1_1x32x1x8_8_1x1_intrawave_v1,340.56,1422.93,0.0
gfx942,304,2688,6144,256,ck,16,0,24.7675,a8w8_blockscale_1x128x128_256x64x64x128_16x16_32x32_1x1_8x32x1_8x32x1_1x32x1x8_8_1x1_intrawave_v1,341.4,1424.9,0.0
gfx942,304,2752,6144,256,ck,16,0,25.6043,a8w8_blockscale_1x128x128_256x64x64x128_16x16_32x32_1x1_8x32x1_8x32x1_1x32x1x8_8_1x1_intrawave_v1,338.11,1409.68,0.0
gfx942,304,2816,6144,256,ck,16,0,25.3162,a8w8_blockscale_1x128x128_256x64x64x128_16x16_32x32_1x1_8x32x1_8x32x1_1x32x1x8_8_1x1_intrawave_v1,349.91,1457.44,0.0
gfx942,304,2880,6144,256,ck,16,0,26.0859,a8w8_blockscale_1x128x128_256x64x64x128_16x16_32x32_1x1_8x32x1_8x32x1_1x32x1x8_8_1x1_intrawave_v1,347.3,1445.21,0.0
gfx942,304,2944,6144,256,ck,11,0,28.0976,a8w8_blockscale_1x128x128_256x32x64x128_16x16_16x16_2x1_8x32x1_8x32x1_1x32x1x8_8_2x1_intrawave_v1,329.6,1370.31,0.0
gfx942,304,3008,6144,256,ck,16,0,27.442,a8w8_blockscale_1x128x128_256x64x64x128_16x16_32x32_1x1_8x32x1_8x32x1_1x32x1x8_8_1x1_intrawave_v1,344.81,1432.3,0.0
gfx942,304,3072,6144,256,ck,16,0,28.728,a8w8_blockscale_1x128x128_256x64x64x128_16x16_32x32_1x1_8x32x1_8x32x1_1x32x1x8_8_1x1_intrawave_v1,336.39,1396.13,0.0
gfx942,304,3136,6144,256,ck,16,0,29.1929,a8w8_blockscale_1x128x128_256x64x64x128_16x16_32x32_1x1_8x32x1_8x32x1_1x32x1x8_8_1x1_intrawave_v1,337.92,1401.4,0.0
gfx942,304,3200,6144,256,ck,16,0,27.2802,a8w8_blockscale_1x128x128_256x64x64x128_16x16_32x32_1x1_8x32x1_8x32x1_1x32x1x8_8_1x1_intrawave_v1,369.0,1529.08,0.0
gfx942,304,3264,6144,256,ck,16,0,29.8648,a8w8_blockscale_1x128x128_256x64x64x128_16x16_32x32_1x1_8x32x1_8x32x1_1x32x1x8_8_1x1_intrawave_v1,343.8,1423.63,0.0
gfx942,304,3328,6144,256,ck,16,0,28.898,a8w8_blockscale_1x128x128_256x64x64x128_16x16_32x32_1x1_8x32x1_8x32x1_1x32x1x8_8_1x1_intrawave_v1,362.27,1499.04,0.0
gfx942,304,3392,6144,256,ck,16,0,30.4116,a8w8_blockscale_1x128x128_256x64x64x128_16x16_32x32_1x1_8x32x1_8x32x1_1x32x1x8_8_1x1_intrawave_v1,350.86,1450.83,0.0
gfx942,304,3456,6144,256,ck,16,0,31.553,a8w8_blockscale_1x128x128_256x64x64x128_16x16_32x32_1x1_8x32x1_8x32x1_1x32x1x8_8_1x1_intrawave_v1,344.55,1423.79,0.0
gfx942,304,3520,6144,256,ck,16,0,31.1691,a8w8_blockscale_1x128x128_256x64x64x128_16x16_32x32_1x1_8x32x1_8x32x1_1x32x1x8_8_1x1_intrawave_v1,355.25,1467.09,0.0
gfx942,304,3584,6144,256,ck,16,0,32.4712,a8w8_blockscale_1x128x128_256x64x64x128_16x16_32x32_1x1_8x32x1_8x32x1_1x32x1x8_8_1x1_intrawave_v1,347.21,1432.98,0.0
gfx942,304,3648,6144,256,ck,16,0,32.7718,a8w8_blockscale_1x128x128_256x64x64x128_16x16_32x32_1x1_8x32x1_8x32x1_1x32x1x8_8_1x1_intrawave_v1,350.17,1444.33,0.0
gfx942,304,3712,6144,256,ck,16,0,33.0263,a8w8_blockscale_1x128x128_256x64x64x128_16x16_32x32_1x1_8x32x1_8x32x1_1x32x1x8_8_1x1_intrawave_v1,353.56,1457.51,0.0
gfx942,304,3776,6144,256,ck,16,0,32.5219,a8w8_blockscale_1x128x128_256x64x64x128_16x16_32x32_1x1_8x32x1_8x32x1_1x32x1x8_8_1x1_intrawave_v1,365.24,1504.8,0.0
gfx942,304,3840,6144,256,ck,16,0,33.7155,a8w8_blockscale_1x128x128_256x64x64x128_16x16_32x32_1x1_8x32x1_8x32x1_1x32x1x8_8_1x1_intrawave_v1,358.28,1475.34,0.0
gfx942,304,3904,6144,256,ck,16,0,33.3442,a8w8_blockscale_1x128x128_256x64x64x128_16x16_32x32_1x1_8x32x1_8x32x1_1x32x1x8_8_1x1_intrawave_v1,368.31,1515.85,0.0
gfx942,304,3968,6144,256,ck,16,0,33.6189,a8w8_blockscale_1x128x128_256x64x64x128_16x16_32x32_1x1_8x32x1_8x32x1_1x32x1x8_8_1x1_intrawave_v1,371.29,1527.34,0.0
gfx942,304,4032,6144,256,ck,16,0,34.9449,a8w8_blockscale_1x128x128_256x64x64x128_16x16_32x32_1x1_8x32x1_8x32x1_1x32x1x8_8_1x1_intrawave_v1,362.96,1492.36,0.0
gfx942,304,4096,6144,256,ck,16,0,34.9672,a8w8_blockscale_1x128x128_256x64x64x128_16x16_32x32_1x1_8x32x1_8x32x1_1x32x1x8_8_1x1_intrawave_v1,368.49,1514.36,0.0
gfx942,304,4224,6144,256,ck,16,0,38.7852,a8w8_blockscale_1x128x128_256x64x64x128_16x16_32x32_1x1_8x32x1_8x32x1_1x32x1x8_8_1x1_intrawave_v1,342.59,1406.69,0.0
gfx942,304,4352,6144,256,ck,16,0,38.7344,a8w8_blockscale_1x128x128_256x64x64x128_16x16_32x32_1x1_8x32x1_8x32x1_1x32x1x8_8_1x1_intrawave_v1,353.44,1449.99,0.0
gfx942,304,4480,6144,256,ck,16,0,37.1721,a8w8_blockscale_1x128x128_256x64x64x128_16x16_32x32_1x1_8x32x1_8x32x1_1x32x1x8_8_1x1_intrawave_v1,379.12,1554.12,0.0
gfx942,304,4608,6144,256,ck,16,0,40.7708,a8w8_blockscale_1x128x128_256x64x64x128_16x16_32x32_1x1_8x32x1_8x32x1_1x32x1x8_8_1x1_intrawave_v1,355.54,1456.33,0.0
gfx942,304,4736,6144,256,ck,16,0,41.4708,a8w8_blockscale_1x128x128_256x64x64x128_16x16_32x32_1x1_8x32x1_8x32x1_1x32x1x8_8_1x1_intrawave_v1,359.24,1470.46,0.0
gfx942,304,4864,6144,256,ck,16,0,41.781,a8w8_blockscale_1x128x128_256x64x64x128_16x16_32x32_1x1_8x32x1_8x32x1_1x32x1x8_8_1x1_intrawave_v1,366.21,1497.97,0.0
gfx942,304,4992,6144,256,ck,16,0,41.5189,a8w8_blockscale_1x128x128_256x64x64x128_16x16_32x32_1x1_8x32x1_8x32x1_1x32x1x8_8_1x1_intrawave_v1,378.22,1546.1,0.0
gfx942,304,5120,6144,256,ck,16,0,43.9705,a8w8_blockscale_1x128x128_256x64x64x128_16x16_32x32_1x1_8x32x1_8x32x1_1x32x1x8_8_1x1_intrawave_v1,366.29,1496.42,0.0
gfx942,304,5248,6144,256,ck,16,0,45.2221,a8w8_blockscale_1x128x128_256x64x64x128_16x16_32x32_1x1_8x32x1_8x32x1_1x32x1x8_8_1x1_intrawave_v1,365.06,1490.51,0.0
gfx942,304,5376,6144,256,ck,16,0,46.0634,a8w8_blockscale_1x128x128_256x64x64x128_16x16_32x32_1x1_8x32x1_8x32x1_1x32x1x8_8_1x1_intrawave_v1,367.13,1498.14,0.0
gfx942,304,5504,6144,256,ck,16,0,46.3829,a8w8_blockscale_1x128x128_256x64x64x128_16x16_32x32_1x1_8x32x1_8x32x1_1x32x1x8_8_1x1_intrawave_v1,373.29,1522.44,0.0
gfx942,304,5632,6144,256,ck,16,0,47.4471,a8w8_blockscale_1x128x128_256x64x64x128_16x16_32x32_1x1_8x32x1_8x32x1_1x32x1x8_8_1x1_intrawave_v1,373.4,1522.13,0.0
gfx942,304,5760,6144,256,ck,16,0,48.5153,a8w8_blockscale_1x128x128_256x64x64x128_16x16_32x32_1x1_8x32x1_8x32x1_1x32x1x8_8_1x1_intrawave_v1,373.48,1521.71,0.0
gfx942,304,5888,6144,256,ck,16,0,50.2929,a8w8_blockscale_1x128x128_256x64x64x128_16x16_32x32_1x1_8x32x1_8x32x1_1x32x1x8_8_1x1_intrawave_v1,368.28,1499.85,0.0
gfx942,304,6016,6144,256,ck,16,0,50.1999,a8w8_blockscale_1x128x128_256x64x64x128_16x16_32x32_1x1_8x32x1_8x32x1_1x32x1x8_8_1x1_intrawave_v1,376.99,1534.62,0.0
gfx942,304,6144,6144,256,ck,16,0,50.9672,a8w8_blockscale_1x128x128_256x64x64x128_16x16_32x32_1x1_8x32x1_8x32x1_1x32x1x8_8_1x1_intrawave_v1,379.21,1543.02,0.0
gfx942,304,6272,6144,256,ck,16,0,51.2692,a8w8_blockscale_1x128x128_256x64x64x128_16x16_32x32_1x1_8x32x1_8x32x1_1x32x1x8_8_1x1_intrawave_v1,384.83,1565.24,0.0
gfx942,304,6400,6144,256,ck,16,0,52.243,a8w8_blockscale_1x128x128_256x64x64x128_16x16_32x32_1x1_8x32x1_8x32x1_1x32x1x8_8_1x1_intrawave_v1,385.37,1566.8,0.0
gfx942,304,6528,6144,256,ck,16,0,55.4966,a8w8_blockscale_1x128x128_256x64x64x128_16x16_32x32_1x1_8x32x1_8x32x1_1x32x1x8_8_1x1_intrawave_v1,370.03,1503.88,0.0
gfx942,304,6656,6144,256,ck,16,0,54.7211,a8w8_blockscale_1x128x128_256x64x64x128_16x16_32x32_1x1_8x32x1_8x32x1_1x32x1x8_8_1x1_intrawave_v1,382.63,1554.53,0.0
gfx942,304,6784,6144,256,ck,16,0,55.9085,a8w8_blockscale_1x128x128_256x64x64x128_16x16_32x32_1x1_8x32x1_8x32x1_1x32x1x8_8_1x1_intrawave_v1,381.71,1550.24,0.0
gfx942,304,6912,6144,256,ck,16,0,57.4519,a8w8_blockscale_1x128x128_256x64x64x128_16x16_32x32_1x1_8x32x1_8x32x1_1x32x1x8_8_1x1_intrawave_v1,378.46,1536.54,0.0
gfx942,304,7040,6144,256,ck,16,0,58.1452,a8w8_blockscale_1x128x128_256x64x64x128_16x16_32x32_1x1_8x32x1_8x32x1_1x32x1x8_8_1x1_intrawave_v1,380.87,1545.83,0.0
gfx942,304,7168,6144,256,ck,16,0,60.1185,a8w8_blockscale_1x128x128_256x64x64x128_16x16_32x32_1x1_8x32x1_8x32x1_1x32x1x8_8_1x1_intrawave_v1,375.07,1521.8,0.0
gfx942,304,7296,6144,256,ck,16,0,60.4138,a8w8_blockscale_1x128x128_256x64x64x128_16x16_32x32_1x1_8x32x1_8x32x1_1x32x1x8_8_1x1_intrawave_v1,379.9,1540.94,0.0
gfx942,304,7424,6144,256,ck,16,0,60.8827,a8w8_blockscale_1x128x128_256x64x64x128_16x16_32x32_1x1_8x32x1_8x32x1_1x32x1x8_8_1x1_intrawave_v1,383.59,1555.44,0.0
gfx942,304,7552,6144,256,ck,16,0,63.358,a8w8_blockscale_1x128x128_256x64x64x128_16x16_32x32_1x1_8x32x1_8x32x1_1x32x1x8_8_1x1_intrawave_v1,374.96,1520.02,0.0
gfx942,304,7680,6144,256,ck,16,0,62.9099,a8w8_blockscale_1x128x128_256x64x64x128_16x16_32x32_1x1_8x32x1_8x32x1_1x32x1x8_8_1x1_intrawave_v1,384.03,1556.37,0.0
gfx942,304,7808,6144,256,ck,16,0,64.3752,a8w8_blockscale_1x128x128_256x64x64x128_16x16_32x32_1x1_8x32x1_8x32x1_1x32x1x8_8_1x1_intrawave_v1,381.54,1545.88,0.0
gfx942,304,7936,6144,256,ck,16,0,66.2124,a8w8_blockscale_1x128x128_256x64x64x128_16x16_32x32_1x1_8x32x1_8x32x1_1x32x1x8_8_1x1_intrawave_v1,377.04,1527.24,0.0
gfx942,304,8064,6144,256,ck,16,0,66.4583,a8w8_blockscale_1x128x128_256x64x64x128_16x16_32x32_1x1_8x32x1_8x32x1_1x32x1x8_8_1x1_intrawave_v1,381.7,1545.75,0.0
gfx942,304,8192,6144,256,ck,16,0,67.1902,a8w8_blockscale_1x128x128_256x64x64x128_16x16_32x32_1x1_8x32x1_8x32x1_1x32x1x8_8_1x1_intrawave_v1,383.54,1552.81,0.0
gfx942,304,8320,6144,256,ck,16,0,69.9708,a8w8_blockscale_1x128x128_256x64x64x128_16x16_32x32_1x1_8x32x1_8x32x1_1x32x1x8_8_1x1_intrawave_v1,374.05,1514.05,0.0
gfx942,304,8448,6144,256,ck,16,0,69.469,a8w8_blockscale_1x128x128_256x64x64x128_16x16_32x32_1x1_8x32x1_8x32x1_1x32x1x8_8_1x1_intrawave_v1,382.55,1548.09,0.0
gfx942,304,8576,6144,256,ck,16,0,71.188,a8w8_blockscale_1x128x128_256x64x64x128_16x16_32x32_1x1_8x32x1_8x32x1_1x32x1x8_8_1x1_intrawave_v1,378.97,1533.27,0.0
gfx942,304,8704,6144,256,ck,16,0,73.4756,a8w8_blockscale_1x128x128_256x64x64x128_16x16_32x32_1x1_8x32x1_8x32x1_1x32x1x8_8_1x1_intrawave_v1,372.65,1507.38,0.0
gfx942,304,8832,6144,256,ck,16,0,70.788,a8w8_blockscale_1x128x128_256x64x64x128_16x16_32x32_1x1_8x32x1_8x32x1_1x32x1x8_8_1x1_intrawave_v1,392.48,1587.3,0.0
gfx942,304,8960,6144,256,ck,16,0,72.6107,a8w8_blockscale_1x128x128_256x64x64x128_16x16_32x32_1x1_8x32x1_8x32x1_1x32x1x8_8_1x1_intrawave_v1,388.18,1569.56,0.0
gfx942,304,9088,6144,256,ck,16,0,75.9432,a8w8_blockscale_1x128x128_256x64x64x128_16x16_32x32_1x1_8x32x1_8x32x1_1x32x1x8_8_1x1_intrawave_v1,376.44,1521.83,0.0
gfx942,304,9216,6144,256,ck,16,0,77.0703,a8w8_blockscale_1x128x128_256x64x64x128_16x16_32x32_1x1_8x32x1_8x32x1_1x32x1x8_8_1x1_intrawave_v1,376.16,1520.41,0.0
gfx942,304,9344,6144,256,ck,16,0,76.0764,a8w8_blockscale_1x128x128_256x64x64x128_16x16_32x32_1x1_8x32x1_8x32x1_1x32x1x8_8_1x1_intrawave_v1,386.37,1561.38,0.0
gfx942,304,9472,6144,256,ck,16,0,77.942,a8w8_blockscale_1x128x128_256x64x64x128_16x16_32x32_1x1_8x32x1_8x32x1_1x32x1x8_8_1x1_intrawave_v1,382.29,1544.61,0.0
gfx942,304,9600,6144,256,ck,16,0,78.607,a8w8_blockscale_1x128x128_256x64x64x128_16x16_32x32_1x1_8x32x1_8x32x1_1x32x1x8_8_1x1_intrawave_v1,384.18,1551.96,0.0
gfx942,304,9728,6144,256,ck,16,0,79.9089,a8w8_blockscale_1x128x128_256x64x64x128_16x16_32x32_1x1_8x32x1_8x32x1_1x32x1x8_8_1x1_intrawave_v1,382.96,1546.77,0.0
gfx942,304,9856,6144,256,ck,16,0,78.8293,a8w8_blockscale_1x128x128_256x64x64x128_16x16_32x32_1x1_8x32x1_8x32x1_1x32x1x8_8_1x1_intrawave_v1,393.31,1588.32,0.0
gfx942,304,9984,6144,256,ck,16,0,83.2212,a8w8_blockscale_1x128x128_256x64x64x128_16x16_32x32_1x1_8x32x1_8x32x1_1x32x1x8_8_1x1_intrawave_v1,377.39,1523.8,0.0
gfx942,304,10112,6144,256,ck,16,0,84.3357,a8w8_blockscale_1x128x128_256x64x64x128_16x16_32x32_1x1_8x32x1_8x32x1_1x32x1x8_8_1x1_intrawave_v1,377.18,1522.7,0.0
gfx942,304,10240,6144,256,ck,16,0,83.9632,a8w8_blockscale_1x128x128_256x64x64x128_16x16_32x32_1x1_8x32x1_8x32x1_1x32x1x8_8_1x1_intrawave_v1,383.65,1548.58,0.0
gfx942,304,10368,6144,256,ck,16,0,85.0958,a8w8_blockscale_1x128x128_256x64x64x128_16x16_32x32_1x1_8x32x1_8x32x1_1x32x1x8_8_1x1_intrawave_v1,383.27,1546.83,0.0
gfx942,304,10496,6144,256,ck,16,0,86.3682,a8w8_blockscale_1x128x128_256x64x64x128_16x16_32x32_1x1_8x32x1_8x32x1_1x32x1x8_8_1x1_intrawave_v1,382.29,1542.64,0.0
gfx942,304,10624,6144,256,ck,16,0,87.2399,a8w8_blockscale_1x128x128_256x64x64x128_16x16_32x32_1x1_8x32x1_8x32x1_1x32x1x8_8_1x1_intrawave_v1,383.08,1545.63,0.0
gfx942,304,10752,6144,256,ck,16,0,87.3793,a8w8_blockscale_1x128x128_256x64x64x128_16x16_32x32_1x1_8x32x1_8x32x1_1x32x1x8_8_1x1_intrawave_v1,387.08,1561.54,0.0
gfx942,304,10880,6144,256,ck,16,0,88.4444,a8w8_blockscale_1x128x128_256x64x64x128_16x16_32x32_1x1_8x32x1_8x32x1_1x32x1x8_8_1x1_intrawave_v1,386.97,1560.89,0.0
gfx942,304,11008,6144,256,ck,16,0,89.2835,a8w8_blockscale_1x128x128_256x64x64x128_16x16_32x32_1x1_8x32x1_8x32x1_1x32x1x8_8_1x1_intrawave_v1,387.85,1564.2,0.0
gfx942,304,11136,6144,256,ck,16,0,91.5346,a8w8_blockscale_1x128x128_256x64x64x128_16x16_32x32_1x1_8x32x1_8x32x1_1x32x1x8_8_1x1_intrawave_v1,382.71,1543.27,0.0
gfx942,304,11264,6144,256,ck,16,0,90.8141,a8w8_blockscale_1x128x128_256x64x64x128_16x16_32x32_1x1_8x32x1_8x32x1_1x32x1x8_8_1x1_intrawave_v1,390.18,1573.2,0.0
gfx942,304,11392,6144,256,ck,16,0,93.0488,a8w8_blockscale_1x128x128_256x64x64x128_16x16_32x32_1x1_8x32x1_8x32x1_1x32x1x8_8_1x1_intrawave_v1,385.13,1552.67,0.0
gfx942,304,11520,6144,256,ck,16,0,94.6712,a8w8_blockscale_1x128x128_256x64x64x128_16x16_32x32_1x1_8x32x1_8x32x1_1x32x1x8_8_1x1_intrawave_v1,382.79,1543.02,0.0
gfx942,304,11648,6144,256,ck,16,0,94.8516,a8w8_blockscale_1x128x128_256x64x64x128_16x16_32x32_1x1_8x32x1_8x32x1_1x32x1x8_8_1x1_intrawave_v1,386.3,1557.02,0.0
gfx942,304,11776,6144,256,ck,16,0,93.3693,a8w8_blockscale_1x128x128_256x64x64x128_16x16_32x32_1x1_8x32x1_8x32x1_1x32x1x8_8_1x1_intrawave_v1,396.75,1598.93,0.0
gfx942,304,11904,6144,256,ck,16,0,95.6228,a8w8_blockscale_1x128x128_256x64x64x128_16x16_32x32_1x1_8x32x1_8x32x1_1x32x1x8_8_1x1_intrawave_v1,391.61,1578.04,0.0
gfx942,304,12032,6144,256,ck,16,0,99.6818,a8w8_blockscale_1x128x128_256x64x64x128_16x16_32x32_1x1_8x32x1_8x32x1_1x32x1x8_8_1x1_intrawave_v1,379.7,1529.89,0.0
gfx942,304,12160,6144,256,ck,16,0,98.3541,a8w8_blockscale_1x128x128_256x64x64x128_16x16_32x32_1x1_8x32x1_8x32x1_1x32x1x8_8_1x1_intrawave_v1,388.92,1566.87,0.0
gfx942,304,12288,6144,256,ck,16,0,99.2622,a8w8_blockscale_1x128x128_256x64x64x128_16x16_32x32_1x1_8x32x1_8x32x1_1x32x1x8_8_1x1_intrawave_v1,389.42,1568.71,0.0
gfx942,304,12416,6144,256,ck,16,0,99.135,a8w8_blockscale_1x128x128_256x64x64x128_16x16_32x32_1x1_8x32x1_8x32x1_1x32x1x8_8_1x1_intrawave_v1,393.98,1586.92,0.0
gfx942,304,12544,6144,256,ck,16,0,101.1081,a8w8_blockscale_1x128x128_256x64x64x128_16x16_32x32_1x1_8x32x1_8x32x1_1x32x1x8_8_1x1_intrawave_v1,390.28,1571.83,0.0
gfx942,304,12672,6144,256,ck,16,0,100.5695,a8w8_blockscale_1x128x128_256x64x64x128_16x16_32x32_1x1_8x32x1_8x32x1_1x32x1x8_8_1x1_intrawave_v1,396.37,1596.21,0.0
gfx942,304,12800,6144,256,ck,16,0,103.5537,a8w8_blockscale_1x128x128_256x64x64x128_16x16_32x32_1x1_8x32x1_8x32x1_1x32x1x8_8_1x1_intrawave_v1,388.84,1565.72,0.0
gfx942,304,12928,6144,256,ck,16,0,103.5639,a8w8_blockscale_1x128x128_256x64x64x128_16x16_32x32_1x1_8x32x1_8x32x1_1x32x1x8_8_1x1_intrawave_v1,392.68,1581.07,0.0
gfx942,304,13056,6144,256,ck,16,0,104.4524,a8w8_blockscale_1x128x128_256x64x64x128_16x16_32x32_1x1_8x32x1_8x32x1_1x32x1x8_8_1x1_intrawave_v1,393.2,1582.99,0.0
gfx942,304,13184,6144,256,ck,16,0,103.5685,a8w8_blockscale_1x128x128_256x64x64x128_16x16_32x32_1x1_8x32x1_8x32x1_1x32x1x8_8_1x1_intrawave_v1,400.44,1612.01,0.0
gfx942,304,13312,6144,256,ck,16,0,105.8399,a8w8_blockscale_1x128x128_256x64x64x128_16x16_32x32_1x1_8x32x1_8x32x1_1x32x1x8_8_1x1_intrawave_v1,395.65,1592.58,0.0
gfx942,304,13440,6144,256,ck,16,0,111.6829,a8w8_blockscale_1x128x128_256x64x64x128_16x16_32x32_1x1_8x32x1_8x32x1_1x32x1x8_8_1x1_intrawave_v1,378.56,1523.64,0.0
gfx942,304,13568,6144,256,ck,16,0,106.5711,a8w8_blockscale_1x128x128_256x64x64x128_16x16_32x32_1x1_8x32x1_8x32x1_1x32x1x8_8_1x1_intrawave_v1,400.5,1611.79,0.0
gfx942,304,13696,6144,256,ck,16,0,108.9656,a8w8_blockscale_1x128x128_256x64x64x128_16x16_32x32_1x1_8x32x1_8x32x1_1x32x1x8_8_1x1_intrawave_v1,395.39,1591.1,0.0
gfx942,304,13824,6144,256,ck,16,0,108.181,a8w8_blockscale_1x128x128_256x64x64x128_16x16_32x32_1x1_8x32x1_8x32x1_1x32x1x8_8_1x1_intrawave_v1,401.98,1617.48,0.0
gfx942,304,13952,6144,256,ck,16,0,110.8245,a8w8_blockscale_1x128x128_256x64x64x128_16x16_32x32_1x1_8x32x1_8x32x1_1x32x1x8_8_1x1_intrawave_v1,396.02,1593.39,0.0
gfx942,304,14080,6144,256,ck,16,0,111.2216,a8w8_blockscale_1x128x128_256x64x64x128_16x16_32x32_1x1_8x32x1_8x32x1_1x32x1x8_8_1x1_intrawave_v1,398.23,1602.14,0.0
gfx942,304,14208,6144,256,ck,16,0,113.2265,a8w8_blockscale_1x128x128_256x64x64x128_16x16_32x32_1x1_8x32x1_8x32x1_1x32x1x8_8_1x1_intrawave_v1,394.74,1587.95,0.0
gfx942,304,14336,6144,256,ck,16,0,113.8625,a8w8_blockscale_1x128x128_256x64x64x128_16x16_32x32_1x1_8x32x1_8x32x1_1x32x1x8_8_1x1_intrawave_v1,396.07,1593.18,0.0
gfx942,304,14464,6144,256,ck,16,0,113.8062,a8w8_blockscale_1x128x128_256x64x64x128_16x16_32x32_1x1_8x32x1_8x32x1_1x32x1x8_8_1x1_intrawave_v1,399.8,1608.08,0.0
gfx942,304,14592,6144,256,ck,16,0,114.9394,a8w8_blockscale_1x128x128_256x64x64x128_16x16_32x32_1x1_8x32x1_8x32x1_1x32x1x8_8_1x1_intrawave_v1,399.36,1606.19,0.0
gfx942,304,14720,6144,256,ck,16,0,117.7375,a8w8_blockscale_1x128x128_256x64x64x128_16x16_32x32_1x1_8x32x1_8x32x1_1x32x1x8_8_1x1_intrawave_v1,393.29,1581.66,0.0
gfx942,304,14848,6144,256,ck,16,0,118.7743,a8w8_blockscale_1x128x128_256x64x64x128_16x16_32x32_1x1_8x32x1_8x32x1_1x32x1x8_8_1x1_intrawave_v1,393.25,1581.37,0.0
gfx942,304,14976,6144,256,ck,16,0,121.0181,a8w8_blockscale_1x128x128_256x64x64x128_16x16_32x32_1x1_8x32x1_8x32x1_1x32x1x8_8_1x1_intrawave_v1,389.28,1565.32,0.0
gfx942,304,15104,6144,256,ck,16,0,116.0431,a8w8_blockscale_1x128x128_256x64x64x128_16x16_32x32_1x1_8x32x1_8x32x1_1x32x1x8_8_1x1_intrawave_v1,409.44,1646.26,0.0
gfx942,304,15232,6144,256,ck,16,0,124.4228,a8w8_blockscale_1x128x128_256x64x64x128_16x16_32x32_1x1_8x32x1_8x32x1_1x32x1x8_8_1x1_intrawave_v1,385.1,1548.29,0.0
gfx942,304,15360,6144,256,ck,16,0,123.4495,a8w8_blockscale_1x128x128_256x64x64x128_16x16_32x32_1x1_8x32x1_8x32x1_1x32x1x8_8_1x1_intrawave_v1,391.4,1573.51,0.0
gfx942,304,15488,6144,256,ck,16,0,123.4137,a8w8_blockscale_1x128x128_256x64x64x128_16x16_32x32_1x1_8x32x1_8x32x1_1x32x1x8_8_1x1_intrawave_v1,394.78,1586.97,0.0
gfx942,304,15616,6144,256,ck,16,0,121.9193,a8w8_blockscale_1x128x128_256x64x64x128_16x16_32x32_1x1_8x32x1_8x32x1_1x32x1x8_8_1x1_intrawave_v1,402.92,1619.6,0.0
gfx942,304,15744,6144,256,ck,16,0,134.1381,a8w8_blockscale_1x128x128_256x64x64x128_16x16_32x32_1x1_8x32x1_8x32x1_1x32x1x8_8_1x1_intrawave_v1,369.22,1484.03,0.0
gfx942,304,15872,6144,256,ck,16,0,126.2867,a8w8_blockscale_1x128x128_256x64x64x128_16x16_32x32_1x1_8x32x1_8x32x1_1x32x1x8_8_1x1_intrawave_v1,395.36,1589.01,0.0
gfx942,304,16000,6144,256,ck,16,0,126.9179,a8w8_blockscale_1x128x128_256x64x64x128_16x16_32x32_1x1_8x32x1_8x32x1_1x32x1x8_8_1x1_intrawave_v1,396.57,1593.76,0.0
gfx942,304,16128,6144,256,ck,16,0,127.8252,a8w8_blockscale_1x128x128_256x64x64x128_16x16_32x32_1x1_8x32x1_8x32x1_1x32x1x8_8_1x1_intrawave_v1,396.9,1595.01,0.0
gfx942,304,16256,6144,256,ck,16,0,129.6051,a8w8_blockscale_1x128x128_256x64x64x128_16x16_32x32_1x1_8x32x1_8x32x1_1x32x1x8_8_1x1_intrawave_v1,394.56,1585.49,0.0
gfx942,304,16384,6144,256,ck,16,0,128.4986,a8w8_blockscale_1x128x128_256x64x64x128_16x16_32x32_1x1_8x32x1_8x32x1_1x32x1x8_8_1x1_intrawave_v1,401.09,1611.64,0.0
gfx942,304,16512,6144,256,ck,16,0,131.3545,a8w8_blockscale_1x128x128_256x64x64x128_16x16_32x32_1x1_8x32x1_8x32x1_1x32x1x8_8_1x1_intrawave_v1,395.44,1588.83,0.0
gfx942,304,1,6144,1536,ck,8,0,7.3828,a8w8_blockscale_1x128x128_256x16x64x256_16x16_16x16_1x1_16x16x1_16x16x1_1x16x1x16_4_1x1_intrawave_v1,2.56,1280.14,0.0
gfx942,304,2,6144,1536,ck,8,0,7.8929,a8w8_blockscale_1x128x128_256x16x64x256_16x16_16x16_1x1_16x16x1_16x16x1_1x16x1x16_4_1x1_intrawave_v1,4.78,1199.16,0.0
gfx942,304,4,6144,1536,ck,8,0,7.5745,a8w8_blockscale_1x128x128_256x16x64x256_16x16_16x16_1x1_16x16x1_16x16x1_1x16x1x16_4_1x1_intrawave_v1,9.97,1253.22,0.0
gfx942,304,8,6144,1536,ck,8,0,8.2221,a8w8_blockscale_1x128x128_256x16x64x256_16x16_16x16_1x1_16x16x1_16x16x1_1x16x1x16_4_1x1_intrawave_v1,18.36,1161.23,0.0
gfx942,304,16,6144,1536,ck,8,0,7.6267,a8w8_blockscale_1x128x128_256x16x64x256_16x16_16x16_1x1_16x16x1_16x16x1_1x16x1x16_4_1x1_intrawave_v1,39.6,1266.39,0.0
gfx942,304,32,6144,1536,ck,8,0,8.0415,a8w8_blockscale_1x128x128_256x16x64x256_16x16_16x16_1x1_16x16x1_16x16x1_1x16x1x16_4_1x1_intrawave_v1,75.11,1228.57,0.0
gfx942,304,48,6144,1536,ck,8,0,7.5468,a8w8_blockscale_1x128x128_256x16x64x256_16x16_16x16_1x1_16x16x1_16x16x1_1x16x1x16_4_1x1_intrawave_v1,120.05,1338.41,0.0
gfx942,304,64,6144,1536,ck,13,0,9.1379,a8w8_blockscale_1x128x128_256x32x64x256_16x16_16x16_2x1_16x16x1_16x16x1_1x32x1x8_8_2x1_intrawave_v1,132.19,1129.57,0.0
gfx942,304,80,6144,1536,ck,13,0,9.2667,a8w8_blockscale_1x128x128_256x32x64x256_16x16_16x16_2x1_16x16x1_16x16x1_1x32x1x8_8_2x1_intrawave_v1,162.94,1137.74,0.0
gfx942,304,96,6144,1536,ck,13,0,9.1262,a8w8_blockscale_1x128x128_256x32x64x256_16x16_16x16_2x1_16x16x1_16x16x1_1x32x1x8_8_2x1_intrawave_v1,198.54,1179.49,0.0
gfx942,304,112,6144,1536,ck,18,0,10.3437,a8w8_blockscale_1x128x128_256x64x64x256_16x16_32x32_1x1_16x16x1_16x16x1_1x32x1x8_8_1x1_intrawave_v1,204.37,1062.04,0.0
gfx942,304,128,6144,1536,ck,18,0,9.9208,a8w8_blockscale_1x128x128_256x64x64x256_16x16_32x32_1x1_16x16x1_16x16x1_1x32x1x8_8_1x1_intrawave_v1,243.52,1129.61,0.0
gfx942,304,144,6144,1536,ck,18,0,10.4527,a8w8_blockscale_1x128x128_256x64x64x256_16x16_32x32_1x1_16x16x1_16x16x1_1x32x1x8_8_1x1_intrawave_v1,260.02,1093.29,0.0
gfx942,304,160,6144,1536,ck,18,0,10.6891,a8w8_blockscale_1x128x128_256x64x64x256_16x16_32x32_1x1_16x16x1_16x16x1_1x32x1x8_8_1x1_intrawave_v1,282.52,1089.8,0.0
gfx942,304,176,6144,1536,ck,18,0,10.7891,a8w8_blockscale_1x128x128_256x64x64x256_16x16_32x32_1x1_16x16x1_16x16x1_1x32x1x8_8_1x1_intrawave_v1,307.89,1100.2,0.0
gfx942,304,192,6144,1536,ck,18,0,10.5734,a8w8_blockscale_1x128x128_256x64x64x256_16x16_32x32_1x1_16x16x1_16x16x1_1x32x1x8_8_1x1_intrawave_v1,342.74,1143.57,0.0
gfx942,304,208,6144,1536,ck,3,0,14.5344,a8w8_blockscale_1x128x128_256x64x64x128_16x16_32x32_1x1_8x32x1_8x32x1_1x32x1x8_8_1x1_intrawave_v3,270.11,847.13,0.0
gfx942,304,224,6144,1536,ck,3,0,14.7591,a8w8_blockscale_1x128x128_256x64x64x128_16x16_32x32_1x1_8x32x1_8x32x1_1x32x1x8_8_1x1_intrawave_v3,286.46,849.22,0.0
gfx942,304,240,6144,1536,ck,3,0,15.0758,a8w8_blockscale_1x128x128_256x64x64x128_16x16_32x32_1x1_8x32x1_8x32x1_1x32x1x8_8_1x1_intrawave_v3,300.47,846.05,0.0
gfx942,304,256,6144,1536,ck,3,0,15.5631,a8w8_blockscale_1x128x128_256x64x64x128_16x16_32x32_1x1_8x32x1_8x32x1_1x32x1x8_8_1x1_intrawave_v3,310.47,833.78,0.0
gfx942,304,288,6144,1536,ck,3,0,16.5155,a8w8_blockscale_1x128x128_256x64x64x128_16x16_32x32_1x1_8x32x1_8x32x1_1x32x1x8_8_1x1_intrawave_v3,329.13,812.48,0.0
gfx942,304,320,6144,1536,ck,3,0,17.6076,a8w8_blockscale_1x128x128_256x64x64x128_16x16_32x32_1x1_8x32x1_8x32x1_1x32x1x8_8_1x1_intrawave_v3,343.02,787.21,0.0
gfx942,304,352,6144,1536,ck,2,0,17.6469,a8w8_blockscale_1x128x128_256x64x128x128_16x16_32x32_1x2_8x32x1_8x32x1_1x32x1x8_8_1x1_intrawave_v3,376.48,810.52,0.0
gfx942,304,384,6144,1536,ck,18,0,17.844,a8w8_blockscale_1x128x128_256x64x64x256_16x16_32x32_1x1_16x16x1_16x16x1_1x32x1x8_8_1x1_intrawave_v1,406.17,826.36,0.0
gfx942,304,416,6144,1536,ck,3,0,21.9695,a8w8_blockscale_1x128x128_256x64x64x128_16x16_32x32_1x1_8x32x1_8x32x1_1x32x1x8_8_1x1_intrawave_v3,357.39,691.32,0.0
gfx942,304,448,6144,1536,ck,3,0,22.4909,a8w8_blockscale_1x128x128_256x64x64x128_16x16_32x32_1x1_8x32x1_8x32x1_1x32x1x8_8_1x1_intrawave_v3,375.96,694.96,0.0
gfx942,304,480,6144,1536,ck,3,0,22.8381,a8w8_blockscale_1x128x128_256x64x64x128_16x16_32x32_1x1_8x32x1_8x32x1_1x32x1x8_8_1x1_intrawave_v3,396.69,703.77,0.0
gfx942,304,512,6144,1536,ck,3,0,23.2854,a8w8_blockscale_1x128x128_256x64x64x128_16x16_32x32_1x1_8x32x1_8x32x1_1x32x1x8_8_1x1_intrawave_v3,415.01,709.25,0.0
gfx942,304,544,6144,1536,ck,3,0,23.4616,a8w8_blockscale_1x128x128_256x64x64x128_16x16_32x32_1x1_8x32x1_8x32x1_1x32x1x8_8_1x1_intrawave_v3,437.64,722.77,0.0
gfx942,304,576,6144,1536,ck,18,0,24.4724,a8w8_blockscale_1x128x128_256x64x64x256_16x16_32x32_1x1_16x16x1_16x16x1_1x32x1x8_8_1x1_intrawave_v1,444.24,711.0,0.0
gfx942,304,608,6144,1536,ck,0,0,24.8345,a8w8_blockscale_1x128x128_256x128x128x128_16x16_32x32_2x2_8x32x1_8x32x1_1x32x1x8_8_1x1_intrawave_v3,462.08,718.44,0.0
gfx942,304,640,6144,1536,ck,0,0,26.7872,a8w8_blockscale_1x128x128_256x128x128x128_16x16_32x32_2x2_8x32x1_8x32x1_1x32x1x8_8_1x1_intrawave_v3,450.95,682.59,0.0
gfx942,304,672,6144,1536,ck,0,0,25.2979,a8w8_blockscale_1x128x128_256x128x128x128_16x16_32x32_2x2_8x32x1_8x32x1_1x32x1x8_8_1x1_intrawave_v3,501.37,740.26,0.0
gfx942,304,704,6144,1536,ck,0,0,27.1033,a8w8_blockscale_1x128x128_256x128x128x128_16x16_32x32_2x2_8x32x1_8x32x1_1x32x1x8_8_1x1_intrawave_v3,490.26,707.27,0.0
gfx942,304,736,6144,1536,ck,0,0,26.1996,a8w8_blockscale_1x128x128_256x128x128x128_16x16_32x32_2x2_8x32x1_8x32x1_1x32x1x8_8_1x1_intrawave_v3,530.22,748.55,0.0
gfx942,304,768,6144,1536,ck,0,0,26.9884,a8w8_blockscale_1x128x128_256x128x128x128_16x16_32x32_2x2_8x32x1_8x32x1_1x32x1x8_8_1x1_intrawave_v3,537.1,743.06,0.0
gfx942,304,800,6144,1536,ck,3,0,34.1833,a8w8_blockscale_1x128x128_256x64x64x128_16x16_32x32_1x1_8x32x1_8x32x1_1x32x1x8_8_1x1_intrawave_v3,441.72,599.6,0.0
gfx942,304,832,6144,1536,ck,0,0,35.4702,a8w8_blockscale_1x128x128_256x128x128x128_16x16_32x32_2x2_8x32x1_8x32x1_1x32x1x8_8_1x1_intrawave_v3,442.72,590.32,0.0
gfx942,304,864,6144,1536,ck,3,0,35.5948,a8w8_blockscale_1x128x128_256x64x64x128_16x16_32x32_1x1_8x32x1_8x32x1_1x32x1x8_8_1x1_intrawave_v3,458.14,600.68,0.0
gfx942,304,896,6144,1536,ck,3,0,35.0182,a8w8_blockscale_1x128x128_256x64x64x128_16x16_32x32_1x1_8x32x1_8x32x1_1x32x1x8_8_1x1_intrawave_v3,482.93,623.2,0.0
gfx942,304,928,6144,1536,ck,3,0,35.0306,a8w8_blockscale_1x128x128_256x64x64x128_16x16_32x32_1x1_8x32x1_8x32x1_1x32x1x8_8_1x1_intrawave_v3,500.0,635.61,0.0
gfx942,304,960,6144,1536,ck,18,0,35.1072,a8w8_blockscale_1x128x128_256x64x64x256_16x16_32x32_1x1_16x16x1_16x16x1_1x32x1x8_8_1x1_intrawave_v1,516.12,646.83,0.0
gfx942,304,992,6144,1536,ck,0,0,38.7292,a8w8_blockscale_1x128x128_256x128x128x128_16x16_32x32_2x2_8x32x1_8x32x1_1x32x1x8_8_1x1_intrawave_v3,483.44,597.76,0.0
gfx942,304,1024,6144,1536,ck,0,0,37.5681,a8w8_blockscale_1x128x128_256x128x128x128_16x16_32x32_2x2_8x32x1_8x32x1_1x32x1x8_8_1x1_intrawave_v3,514.46,628.01,0.0
gfx942,304,1088,6144,1536,ck,0,0,38.7472,a8w8_blockscale_1x128x128_256x128x128x128_16x16_32x32_2x2_8x32x1_8x32x1_1x32x1x8_8_1x1_intrawave_v3,529.98,631.73,0.0
gfx942,304,1152,6144,1536,ck,0,0,39.2942,a8w8_blockscale_1x128x128_256x128x128x128_16x16_32x32_2x2_8x32x1_8x32x1_1x32x1x8_8_1x1_intrawave_v3,553.35,645.45,0.0
gfx942,304,1216,6144,1536,ck,0,0,38.7439,a8w8_blockscale_1x128x128_256x128x128x128_16x16_32x32_2x2_8x32x1_8x32x1_1x32x1x8_8_1x1_intrawave_v3,592.38,677.45,0.0
gfx942,304,1280,6144,1536,ck,0,0,39.6907,a8w8_blockscale_1x128x128_256x128x128x128_16x16_32x32_2x2_8x32x1_8x32x1_1x32x1x8_8_1x1_intrawave_v3,608.69,683.58,0.0
gfx942,304,1344,6144,1536,ck,0,0,40.8833,a8w8_blockscale_1x128x128_256x128x128x128_16x16_32x32_2x2_8x32x1_8x32x1_1x32x1x8_8_1x1_intrawave_v3,620.48,685.28,0.0
gfx942,304,1408,6144,1536,ck,0,0,40.7549,a8w8_blockscale_1x128x128_256x128x128x128_16x16_32x32_2x2_8x32x1_8x32x1_1x32x1x8_8_1x1_intrawave_v3,652.07,709.15,0.0
gfx942,304,1472,6144,1536,ck,0,0,41.7513,a8w8_blockscale_1x128x128_256x128x128x128_16x16_32x32_2x2_8x32x1_8x32x1_1x32x1x8_8_1x1_intrawave_v3,665.44,713.42,0.0
gfx942,304,1536,6144,1536,ck,0,0,43.3956,a8w8_blockscale_1x128x128_256x128x128x128_16x16_32x32_2x2_8x32x1_8x32x1_1x32x1x8_8_1x1_intrawave_v3,668.06,706.77,0.0
gfx942,304,1600,6144,1536,ck,2,0,54.7358,a8w8_blockscale_1x128x128_256x64x128x128_16x16_32x32_1x2_8x32x1_8x32x1_1x32x1x8_8_1x1_intrawave_v3,551.72,576.51,0.0
gfx942,304,1664,6144,1536,ck,0,0,56.1479,a8w8_blockscale_1x128x128_256x128x128x128_16x16_32x32_2x2_8x32x1_8x32x1_1x32x1x8_8_1x1_intrawave_v3,559.36,577.77,0.0
gfx942,304,1728,6144,1536,ck,0,0,55.8741,a8w8_blockscale_1x128x128_256x128x128x128_16x16_32x32_2x2_8x32x1_8x32x1_1x32x1x8_8_1x1_intrawave_v3,583.72,596.43,0.0
gfx942,304,1792,6144,1536,ck,0,0,56.454,a8w8_blockscale_1x128x128_256x128x128x128_16x16_32x32_2x2_8x32x1_8x32x1_1x32x1x8_8_1x1_intrawave_v3,599.12,605.98,0.0
gfx942,304,1856,6144,1536,ck,0,0,56.0806,a8w8_blockscale_1x128x128_256x128x128x128_16x16_32x32_2x2_8x32x1_8x32x1_1x32x1x8_8_1x1_intrawave_v3,624.65,625.79,0.0
gfx942,304,1920,6144,1536,ck,0,0,57.7703,a8w8_blockscale_1x128x128_256x128x128x128_16x16_32x32_2x2_8x32x1_8x32x1_1x32x1x8_8_1x1_intrawave_v3,627.29,622.8,0.0
gfx942,304,1984,6144,1536,ck,0,0,58.698,a8w8_blockscale_1x128x128_256x128x128x128_16x16_32x32_2x2_8x32x1_8x32x1_1x32x1x8_8_1x1_intrawave_v3,637.96,628.03,0.0
gfx942,304,2048,6144,1536,ck,0,0,58.8802,a8w8_blockscale_1x128x128_256x128x128x128_16x16_32x32_2x2_8x32x1_8x32x1_1x32x1x8_8_1x1_intrawave_v3,656.5,641.11,0.0
gfx942,304,2112,6144,1536,ck,0,0,58.2413,a8w8_blockscale_1x128x128_256x128x128x128_16x16_32x32_2x2_8x32x1_8x32x1_1x32x1x8_8_1x1_intrawave_v3,684.44,663.33,0.0
gfx942,304,2176,6144,1536,ck,0,0,60.3234,a8w8_blockscale_1x128x128_256x128x128x128_16x16_32x32_2x2_8x32x1_8x32x1_1x32x1x8_8_1x1_intrawave_v3,680.84,655.11,0.0
gfx942,304,2240,6144,1536,ck,0,0,60.0291,a8w8_blockscale_1x128x128_256x128x128x128_16x16_32x32_2x2_8x32x1_8x32x1_1x32x1x8_8_1x1_intrawave_v3,704.3,673.06,0.0
gfx942,304,2304,6144,1536,ck,0,0,60.7687,a8w8_blockscale_1x128x128_256x128x128x128_16x16_32x32_2x2_8x32x1_8x32x1_1x32x1x8_8_1x1_intrawave_v3,715.61,679.42,0.0
gfx942,304,2368,6144,1536,ck,0,0,61.0599,a8w8_blockscale_1x128x128_256x128x128x128_16x16_32x32_2x2_8x32x1_8x32x1_1x32x1x8_8_1x1_intrawave_v3,731.98,690.67,0.0
gfx942,304,2432,6144,1536,ck,0,0,62.1945,a8w8_blockscale_1x128x128_256x128x128x128_16x16_32x32_2x2_8x32x1_8x32x1_1x32x1x8_8_1x1_intrawave_v3,738.05,692.3,0.0
gfx942,304,2496,6144,1536,ck,0,0,75.2898,a8w8_blockscale_1x128x128_256x128x128x128_16x16_32x32_2x2_8x32x1_8x32x1_1x32x1x8_8_1x1_intrawave_v3,625.72,583.64,0.0
gfx942,304,2560,6144,1536,ck,0,0,75.0221,a8w8_blockscale_1x128x128_256x128x128x128_16x16_32x32_2x2_8x32x1_8x32x1_1x32x1x8_8_1x1_intrawave_v3,644.06,597.51,0.0
gfx942,304,2624,6144,1536,ck,0,0,74.2726,a8w8_blockscale_1x128x128_256x128x128x128_16x16_32x32_2x2_8x32x1_8x32x1_1x32x1x8_8_1x1_intrawave_v3,666.82,615.45,0.0
gfx942,304,2688,6144,1536,ck,0,0,75.6691,a8w8_blockscale_1x128x128_256x128x128x128_16x16_32x32_2x2_8x32x1_8x32x1_1x32x1x8_8_1x1_intrawave_v3,670.48,615.79,0.0
gfx942,304,2752,6144,1536,ck,0,0,76.8478,a8w8_blockscale_1x128x128_256x128x128x128_16x16_32x32_2x2_8x32x1_8x32x1_1x32x1x8_8_1x1_intrawave_v3,675.91,617.86,0.0
gfx942,304,2816,6144,1536,ck,0,0,76.9192,a8w8_blockscale_1x128x128_256x128x128x128_16x16_32x32_2x2_8x32x1_8x32x1_1x32x1x8_8_1x1_intrawave_v3,690.99,628.78,0.0
gfx942,304,2880,6144,1536,ck,0,0,74.6909,a8w8_blockscale_1x128x128_256x128x128x128_16x16_32x32_2x2_8x32x1_8x32x1_1x32x1x8_8_1x1_intrawave_v3,727.78,659.39,0.0
gfx942,304,2944,6144,1536,ck,0,0,76.0784,a8w8_blockscale_1x128x128_256x128x128x128_16x16_32x32_2x2_8x32x1_8x32x1_1x32x1x8_8_1x1_intrawave_v3,730.38,658.99,0.0
gfx942,304,3008,6144,1536,ck,0,0,81.9078,a8w8_blockscale_1x128x128_256x128x128x128_16x16_32x32_2x2_8x32x1_8x32x1_1x32x1x8_8_1x1_intrawave_v3,693.15,622.89,0.0
gfx942,304,3072,6144,1536,ck,0,0,78.4142,a8w8_blockscale_1x128x128_256x128x128x128_16x16_32x32_2x2_8x32x1_8x32x1_1x32x1x8_8_1x1_intrawave_v3,739.43,661.93,0.0
gfx942,304,3136,6144,1536,ck,0,0,79.6473,a8w8_blockscale_1x128x128_256x128x128x128_16x16_32x32_2x2_8x32x1_8x32x1_1x32x1x8_8_1x1_intrawave_v3,743.15,662.79,0.0
gfx942,304,3200,6144,1536,ck,0,0,80.4969,a8w8_blockscale_1x128x128_256x128x128x128_16x16_32x32_2x2_8x32x1_8x32x1_1x32x1x8_8_1x1_intrawave_v3,750.31,666.78,0.0
gfx942,304,3264,6144,1536,ck,0,0,90.5316,a8w8_blockscale_1x128x128_256x128x128x128_16x16_32x32_2x2_8x32x1_8x32x1_1x32x1x8_8_1x1_intrawave_v3,680.49,602.65,0.0
gfx942,304,3328,6144,1536,ck,0,0,87.0721,a8w8_blockscale_1x128x128_256x128x128x128_16x16_32x32_2x2_8x32x1_8x32x1_1x32x1x8_8_1x1_intrawave_v3,721.4,636.75,0.0
gfx942,304,3392,6144,1536,ck,0,0,89.8593,a8w8_blockscale_1x128x128_256x128x128x128_16x16_32x32_2x2_8x32x1_8x32x1_1x32x1x8_8_1x1_intrawave_v3,712.47,626.85,0.0
gfx942,304,3456,6144,1536,ck,0,0,91.9297,a8w8_blockscale_1x128x128_256x128x128x128_16x16_32x32_2x2_8x32x1_8x32x1_1x32x1x8_8_1x1_intrawave_v3,709.56,622.36,0.0
gfx942,304,3520,6144,1536,ck,0,0,91.1869,a8w8_blockscale_1x128x128_256x128x128x128_16x16_32x32_2x2_8x32x1_8x32x1_1x32x1x8_8_1x1_intrawave_v3,728.59,637.13,0.0
gfx942,304,3584,6144,1536,ck,0,0,90.6127,a8w8_blockscale_1x128x128_256x128x128x128_16x16_32x32_2x2_8x32x1_8x32x1_1x32x1x8_8_1x1_intrawave_v3,746.54,650.93,0.0
gfx942,304,3648,6144,1536,ck,0,0,94.61,a8w8_blockscale_1x128x128_256x128x128x128_16x16_32x32_2x2_8x32x1_8x32x1_1x32x1x8_8_1x1_intrawave_v3,727.76,632.78,0.0
gfx942,304,3712,6144,1536,ck,0,0,94.9444,a8w8_blockscale_1x128x128_256x128x128x128_16x16_32x32_2x2_8x32x1_8x32x1_1x32x1x8_8_1x1_intrawave_v3,737.92,639.87,0.0
gfx942,304,3776,6144,1536,ck,0,0,95.7486,a8w8_blockscale_1x128x128_256x128x128x128_16x16_32x32_2x2_8x32x1_8x32x1_1x32x1x8_8_1x1_intrawave_v3,744.34,643.73,0.0
gfx942,304,3840,6144,1536,ck,0,0,94.6882,a8w8_blockscale_1x128x128_256x128x128x128_16x16_32x32_2x2_8x32x1_8x32x1_1x32x1x8_8_1x1_intrawave_v3,765.43,660.29,0.0
gfx942,304,3904,6144,1536,ck,0,0,96.3506,a8w8_blockscale_1x128x128_256x128x128x128_16x16_32x32_2x2_8x32x1_8x32x1_1x32x1x8_8_1x1_intrawave_v3,764.76,658.08,0.0
gfx942,304,3968,6144,1536,ck,0,0,95.8362,a8w8_blockscale_1x128x128_256x128x128x128_16x16_32x32_2x2_8x32x1_8x32x1_1x32x1x8_8_1x1_intrawave_v3,781.47,670.84,0.0
gfx942,304,4032,6144,1536,ck,0,0,109.4545,a8w8_blockscale_1x128x128_256x128x128x128_16x16_32x32_2x2_8x32x1_8x32x1_1x32x1x8_8_1x1_intrawave_v3,695.28,595.46,0.0
gfx942,304,4096,6144,1536,ck,0,0,109.2799,a8w8_blockscale_1x128x128_256x128x128x128_16x16_32x32_2x2_8x32x1_8x32x1_1x32x1x8_8_1x1_intrawave_v3,707.44,604.51,0.0
gfx942,304,4224,6144,1536,ck,0,0,109.777,a8w8_blockscale_1x128x128_256x128x128x128_16x16_32x32_2x2_8x32x1_8x32x1_1x32x1x8_8_1x1_intrawave_v3,726.25,617.89,0.0
gfx942,304,4352,6144,1536,ck,0,0,112.1625,a8w8_blockscale_1x128x128_256x128x128x128_16x16_32x32_2x2_8x32x1_8x32x1_1x32x1x8_8_1x1_intrawave_v3,732.34,620.52,0.0
gfx942,304,4480,6144,1536,ck,0,0,110.6008,a8w8_blockscale_1x128x128_256x128x128x128_16x16_32x32_2x2_8x32x1_8x32x1_1x32x1x8_8_1x1_intrawave_v3,764.53,645.28,0.0
gfx942,304,4608,6144,1536,ck,0,0,109.4201,a8w8_blockscale_1x128x128_256x128x128x128_16x16_32x32_2x2_8x32x1_8x32x1_1x32x1x8_8_1x1_intrawave_v3,794.85,668.42,0.0
gfx942,304,4736,6144,1536,ck,0,0,112.4317,a8w8_blockscale_1x128x128_256x128x128x128_16x16_32x32_2x2_8x32x1_8x32x1_1x32x1x8_8_1x1_intrawave_v3,795.05,666.25,0.0
gfx942,304,4864,6144,1536,ck,0,0,121.9641,a8w8_blockscale_1x128x128_256x128x128x128_16x16_32x32_2x2_8x32x1_8x32x1_1x32x1x8_8_1x1_intrawave_v3,752.72,628.69,0.0
gfx942,304,4992,6144,1536,ck,0,0,123.5809,a8w8_blockscale_1x128x128_256x128x128x128_16x16_32x32_2x2_8x32x1_8x32x1_1x32x1x8_8_1x1_intrawave_v3,762.42,634.78,0.0
gfx942,304,5120,6144,1536,ck,0,0,122.7576,a8w8_blockscale_1x128x128_256x128x128x128_16x16_32x32_2x2_8x32x1_8x32x1_1x32x1x8_8_1x1_intrawave_v3,787.22,653.45,0.0
gfx942,304,5248,6144,1536,ck,0,0,128.4917,a8w8_blockscale_1x128x128_256x128x128x128_16x16_32x32_2x2_8x32x1_8x32x1_1x32x1x8_8_1x1_intrawave_v3,770.89,638.06,0.0
gfx942,304,5376,6144,1536,ck,0,0,132.7485,a8w8_blockscale_1x128x128_256x128x128x128_16x16_32x32_2x2_8x32x1_8x32x1_1x32x1x8_8_1x1_intrawave_v3,764.37,630.93,0.0
gfx942,304,5504,6144,1536,ck,0,0,130.3121,a8w8_blockscale_1x128x128_256x128x128x128_16x16_32x32_2x2_8x32x1_8x32x1_1x32x1x8_8_1x1_intrawave_v3,797.2,656.3,0.0
gfx942,304,5632,6144,1536,ck,0,0,130.9279,a8w8_blockscale_1x128x128_256x128x128x128_16x16_32x32_2x2_8x32x1_8x32x1_1x32x1x8_8_1x1_intrawave_v3,811.9,666.73,0.0
gfx942,304,5760,6144,1536,ck,0,0,144.0267,a8w8_blockscale_1x128x128_256x128x128x128_16x16_32x32_2x2_8x32x1_8x32x1_1x32x1x8_8_1x1_intrawave_v3,754.83,618.38,0.0
gfx942,304,5888,6144,1536,ck,0,0,143.0015,a8w8_blockscale_1x128x128_256x128x128x128_16x16_32x32_2x2_8x32x1_8x32x1_1x32x1x8_8_1x1_intrawave_v3,777.14,635.19,0.0
gfx942,304,6016,6144,1536,ck,0,0,143.9239,a8w8_blockscale_1x128x128_256x128x128x128_16x16_32x32_2x2_8x32x1_8x32x1_1x32x1x8_8_1x1_intrawave_v3,788.95,643.41,0.0
gfx942,304,6144,6144,1536,ck,0,0,145.6974,a8w8_blockscale_1x128x128_256x128x128x128_16x16_32x32_2x2_8x32x1_8x32x1_1x32x1x8_8_1x1_intrawave_v3,795.92,647.72,0.0
gfx942,304,6272,6144,1536,ck,0,0,144.608,a8w8_blockscale_1x128x128_256x128x128x128_16x16_32x32_2x2_8x32x1_8x32x1_1x32x1x8_8_1x1_intrawave_v3,818.63,664.84,0.0
gfx942,304,6400,6144,1536,ck,0,0,146.9109,a8w8_blockscale_1x128x128_256x128x128x128_16x16_32x32_2x2_8x32x1_8x32x1_1x32x1x8_8_1x1_intrawave_v3,822.24,666.46,0.0
gfx942,304,6528,6144,1536,ck,0,0,157.3889,a8w8_blockscale_1x128x128_256x128x128x128_16x16_32x32_2x2_8x32x1_8x32x1_1x32x1x8_8_1x1_intrawave_v3,782.85,633.34,0.0
gfx942,304,6656,6144,1536,ck,0,0,159.0385,a8w8_blockscale_1x128x128_256x128x128x128_16x16_32x32_2x2_8x32x1_8x32x1_1x32x1x8_8_1x1_intrawave_v3,789.92,637.89,0.0
gfx942,304,6784,6144,1536,ck,0,0,164.4932,a8w8_blockscale_1x128x128_256x128x128x128_16x16_32x32_2x2_8x32x1_8x32x1_1x32x1x8_8_1x1_intrawave_v3,778.41,627.5,0.0
gfx942,304,6912,6144,1536,ck,0,0,163.3668,a8w8_blockscale_1x128x128_256x128x128x128_16x16_32x32_2x2_8x32x1_8x32x1_1x32x1x8_8_1x1_intrawave_v3,798.57,642.66,0.0
gfx942,304,7040,6144,1536,ck,0,0,164.9454,a8w8_blockscale_1x128x128_256x128x128x128_16x16_32x32_2x2_8x32x1_8x32x1_1x32x1x8_8_1x1_intrawave_v3,805.57,647.23,0.0
gfx942,304,7168,6144,1536,ck,0,0,164.2232,a8w8_blockscale_1x128x128_256x128x128x128_16x16_32x32_2x2_8x32x1_8x32x1_1x32x1x8_8_1x1_intrawave_v3,823.83,660.85,0.0
gfx942,304,7296,6144,1536,ck,0,0,173.1894,a8w8_blockscale_1x128x128_256x128x128x128_16x16_32x32_2x2_8x32x1_8x32x1_1x32x1x8_8_1x1_intrawave_v3,795.13,636.86,0.0
gfx942,304,7424,6144,1536,ck,0,0,172.617,a8w8_blockscale_1x128x128_256x128x128x128_16x16_32x32_2x2_8x32x1_8x32x1_1x32x1x8_8_1x1_intrawave_v3,811.76,649.22,0.0
gfx942,304,7552,6144,1536,ck,0,0,173.6446,a8w8_blockscale_1x128x128_256x128x128x128_16x16_32x32_2x2_8x32x1_8x32x1_1x32x1x8_8_1x1_intrawave_v3,820.87,655.57,0.0
gfx942,304,7680,6144,1536,ck,0,0,178.4373,a8w8_blockscale_1x128x128_256x128x128x128_16x16_32x32_2x2_8x32x1_8x32x1_1x32x1x8_8_1x1_intrawave_v3,812.36,647.88,0.0
gfx942,304,7808,6144,1536,ck,0,0,182.6439,a8w8_blockscale_1x128x128_256x128x128x128_16x16_32x32_2x2_8x32x1_8x32x1_1x32x1x8_8_1x1_intrawave_v3,806.88,642.64,0.0
gfx942,304,7936,6144,1536,ck,0,0,181.4482,a8w8_blockscale_1x128x128_256x128x128x128_16x16_32x32_2x2_8x32x1_8x32x1_1x32x1x8_8_1x1_intrawave_v3,825.51,656.63,0.0
gfx942,304,8064,6144,1536,ck,0,0,184.4539,a8w8_blockscale_1x128x128_256x128x128x128_16x16_32x32_2x2_8x32x1_8x32x1_1x32x1x8_8_1x1_intrawave_v3,825.15,655.52,0.0
gfx942,304,8192,6144,1536,ck,0,0,193.3308,a8w8_blockscale_1x128x128_256x128x128x128_16x16_32x32_2x2_8x32x1_8x32x1_1x32x1x8_8_1x1_intrawave_v3,799.76,634.58,0.0
gfx942,304,8320,6144,1536,ck,0,0,194.0786,a8w8_blockscale_1x128x128_256x128x128x128_16x16_32x32_2x2_8x32x1_8x32x1_1x32x1x8_8_1x1_intrawave_v3,809.13,641.25,0.0
gfx942,304,8448,6144,1536,ck,0,0,191.7643,a8w8_blockscale_1x128x128_256x128x128x128_16x16_32x32_2x2_8x32x1_8x32x1_1x32x1x8_8_1x1_intrawave_v3,831.49,658.22,0.0
gfx942,304,8576,6144,1536,ck,0,0,191.7572,a8w8_blockscale_1x128x128_256x128x128x128_16x16_32x32_2x2_8x32x1_8x32x1_1x32x1x8_8_1x1_intrawave_v3,844.12,667.47,0.0
gfx942,304,8704,6144,1536,ck,0,0,198.6311,a8w8_blockscale_1x128x128_256x128x128x128_16x16_32x32_2x2_8x32x1_8x32x1_1x32x1x8_8_1x1_intrawave_v3,827.07,653.28,0.0
gfx942,304,8832,6144,1536,ck,0,0,196.2388,a8w8_blockscale_1x128x128_256x128x128x128_16x16_32x32_2x2_8x32x1_8x32x1_1x32x1x8_8_1x1_intrawave_v3,849.47,670.26,0.0
gfx942,304,8960,6144,1536,ck,0,0,207.8924,a8w8_blockscale_1x128x128_256x128x128x128_16x16_32x32_2x2_8x32x1_8x32x1_1x32x1x8_8_1x1_intrawave_v3,813.47,641.2,0.0
gfx942,304,9088,6144,1536,ck,0,0,206.0372,a8w8_blockscale_1x128x128_256x128x128x128_16x16_32x32_2x2_8x32x1_8x32x1_1x32x1x8_8_1x1_intrawave_v3,832.52,655.56,0.0
gfx942,304,9216,6144,1536,ck,0,0,212.3659,a8w8_blockscale_1x128x128_256x128x128x128_16x16_32x32_2x2_8x32x1_8x32x1_1x32x1x8_8_1x1_intrawave_v3,819.09,644.36,0.0
gfx942,304,9344,6144,1536,ck,0,0,212.7329,a8w8_blockscale_1x128x128_256x128x128x128_16x16_32x32_2x2_8x32x1_8x32x1_1x32x1x8_8_1x1_intrawave_v3,829.03,651.56,0.0
gfx942,304,9472,6144,1536,ck,0,0,215.4225,a8w8_blockscale_1x128x128_256x128x128x128_16x16_32x32_2x2_8x32x1_8x32x1_1x32x1x8_8_1x1_intrawave_v3,829.89,651.64,0.0
gfx942,304,9600,6144,1536,ck,0,0,225.0172,a8w8_blockscale_1x128x128_256x128x128x128_16x16_32x32_2x2_8x32x1_8x32x1_1x32x1x8_8_1x1_intrawave_v3,805.24,631.72,0.0
gfx942,304,9728,6144,1536,ck,0,0,219.0995,a8w8_blockscale_1x128x128_256x128x128x128_16x16_32x32_2x2_8x32x1_8x32x1_1x32x1x8_8_1x1_intrawave_v3,838.02,656.86,0.0
gfx942,304,9856,6144,1536,ck,0,0,219.661,a8w8_blockscale_1x128x128_256x128x128x128_16x16_32x32_2x2_8x32x1_8x32x1_1x32x1x8_8_1x1_intrawave_v3,846.88,663.23,0.0
gfx942,304,9984,6144,1536,ck,0,0,226.2422,a8w8_blockscale_1x128x128_256x128x128x128_16x16_32x32_2x2_8x32x1_8x32x1_1x32x1x8_8_1x1_intrawave_v3,832.92,651.76,0.0
gfx942,304,10112,6144,1536,ck,0,0,224.4141,a8w8_blockscale_1x128x128_256x128x128x128_16x16_32x32_2x2_8x32x1_8x32x1_1x32x1x8_8_1x1_intrawave_v3,850.47,664.96,0.0
gfx942,304,10240,6144,1536,ck,0,0,229.6364,a8w8_blockscale_1x128x128_256x128x128x128_16x16_32x32_2x2_8x32x1_8x32x1_1x32x1x8_8_1x1_intrawave_v3,841.65,657.54,0.0
gfx942,304,10368,6144,1536,ck,0,0,231.9769,a8w8_blockscale_1x128x128_256x128x128x128_16x16_32x32_2x2_8x32x1_8x32x1_1x32x1x8_8_1x1_intrawave_v3,843.57,658.53,0.0
gfx942,304,10496,6144,1536,ck,0,0,234.5698,a8w8_blockscale_1x128x128_256x128x128x128_16x16_32x32_2x2_8x32x1_8x32x1_1x32x1x8_8_1x1_intrawave_v3,844.55,658.8,0.0
gfx942,304,10624,6144,1536,ck,0,0,242.8143,a8w8_blockscale_1x128x128_256x128x128x128_16x16_32x32_2x2_8x32x1_8x32x1_1x32x1x8_8_1x1_intrawave_v3,825.82,643.72,0.0
gfx942,304,10752,6144,1536,ck,0,0,242.1115,a8w8_blockscale_1x128x128_256x128x128x128_16x16_32x32_2x2_8x32x1_8x32x1_1x32x1x8_8_1x1_intrawave_v3,838.2,652.89,0.0
gfx942,304,10880,6144,1536,ck,0,0,246.0617,a8w8_blockscale_1x128x128_256x128x128x128_16x16_32x32_2x2_8x32x1_8x32x1_1x32x1x8_8_1x1_intrawave_v3,834.56,649.6,0.0
gfx942,304,11008,6144,1536,ck,0,0,245.1166,a8w8_blockscale_1x128x128_256x128x128x128_16x16_32x32_2x2_8x32x1_8x32x1_1x32x1x8_8_1x1_intrawave_v3,847.63,659.33,0.0
gfx942,304,11136,6144,1536,ck,0,0,243.99,a8w8_blockscale_1x128x128_256x128x128x128_16x16_32x32_2x2_8x32x1_8x32x1_1x32x1x8_8_1x1_intrawave_v3,861.45,669.62,0.0
gfx942,304,11264,6144,1536,ck,0,0,248.0139,a8w8_blockscale_1x128x128_256x128x128x128_16x16_32x32_2x2_8x32x1_8x32x1_1x32x1x8_8_1x1_intrawave_v3,857.21,665.89,0.0
gfx942,304,11392,6144,1536,ck,0,0,258.1787,a8w8_blockscale_1x128x128_256x128x128x128_16x16_32x32_2x2_8x32x1_8x32x1_1x32x1x8_8_1x1_intrawave_v3,832.82,646.53,0.0
gfx942,304,11520,6144,1536,ck,0,0,253.8243,a8w8_blockscale_1x128x128_256x128x128x128_16x16_32x32_2x2_8x32x1_8x32x1_1x32x1x8_8_1x1_intrawave_v3,856.63,664.59,0.0
gfx942,304,11648,6144,1536,ck,0,0,260.743,a8w8_blockscale_1x128x128_256x128x128x128_16x16_32x32_2x2_8x32x1_8x32x1_1x32x1x8_8_1x1_intrawave_v3,843.16,653.74,0.0
gfx942,304,11776,6144,1536,ck,0,0,259.0593,a8w8_blockscale_1x128x128_256x128x128x128_16x16_32x32_2x2_8x32x1_8x32x1_1x32x1x8_8_1x1_intrawave_v3,857.97,664.82,0.0
gfx942,304,11904,6144,1536,ck,0,0,263.5932,a8w8_blockscale_1x128x128_256x128x128x128_16x16_32x32_2x2_8x32x1_8x32x1_1x32x1x8_8_1x1_intrawave_v3,852.38,660.1,0.0
gfx942,304,12032,6144,1536,ck,0,0,266.9993,a8w8_blockscale_1x128x128_256x128x128x128_16x16_32x32_2x2_8x32x1_8x32x1_1x32x1x8_8_1x1_intrawave_v3,850.55,658.31,0.0
gfx942,304,12160,6144,1536,ck,0,0,264.1417,a8w8_blockscale_1x128x128_256x128x128x128_16x16_32x32_2x2_8x32x1_8x32x1_1x32x1x8_8_1x1_intrawave_v3,868.9,672.13,0.0
gfx942,304,12288,6144,1536,ck,0,0,282.1497,a8w8_blockscale_1x128x128_256x128x128x128_16x16_32x32_2x2_8x32x1_8x32x1_1x32x1x8_8_1x1_intrawave_v3,822.0,635.5,0.0
gfx942,304,12416,6144,1536,ck,0,0,282.4815,a8w8_blockscale_1x128x128_256x128x128x128_16x16_32x32_2x2_8x32x1_8x32x1_1x32x1x8_8_1x1_intrawave_v3,829.59,641.02,0.0
gfx942,304,12544,6144,1536,ck,0,0,284.2416,a8w8_blockscale_1x128x128_256x128x128x128_16x16_32x32_2x2_8x32x1_8x32x1_1x32x1x8_8_1x1_intrawave_v3,832.95,643.27,0.0
gfx942,304,12672,6144,1536,ck,0,0,275.8895,a8w8_blockscale_1x128x128_256x128x128x128_16x16_32x32_2x2_8x32x1_8x32x1_1x32x1x8_8_1x1_intrawave_v3,866.93,669.16,0.0
gfx942,304,12800,6144,1536,ck,0,0,279.3772,a8w8_blockscale_1x128x128_256x128x128x128_16x16_32x32_2x2_8x32x1_8x32x1_1x32x1x8_8_1x1_intrawave_v3,864.75,667.14,0.0
gfx942,304,12928,6144,1536,ck,0,0,288.8434,a8w8_blockscale_1x128x128_256x128x128x128_16x16_32x32_2x2_8x32x1_8x32x1_1x32x1x8_8_1x1_intrawave_v3,844.78,651.4,0.0
gfx942,304,13056,6144,1536,ck,0,0,288.8124,a8w8_blockscale_1x128x128_256x128x128x128_16x16_32x32_2x2_8x32x1_8x32x1_1x32x1x8_8_1x1_intrawave_v3,853.23,657.6,0.0
gfx942,304,13184,6144,1536,ck,0,0,286.5812,a8w8_blockscale_1x128x128_256x128x128x128_16x16_32x32_2x2_8x32x1_8x32x1_1x32x1x8_8_1x1_intrawave_v3,868.3,668.9,0.0
gfx942,304,13312,6144,1536,ck,0,0,289.0565,a8w8_blockscale_1x128x128_256x128x128x128_16x16_32x32_2x2_8x32x1_8x32x1_1x32x1x8_8_1x1_intrawave_v3,869.23,669.29,0.0
gfx942,304,13440,6144,1536,ck,0,0,299.3585,a8w8_blockscale_1x128x128_256x128x128x128_16x16_32x32_2x2_8x32x1_8x32x1_1x32x1x8_8_1x1_intrawave_v3,847.38,652.17,0.0
gfx942,304,13568,6144,1536,ck,0,0,296.1536,a8w8_blockscale_1x128x128_256x128x128x128_16x16_32x32_2x2_8x32x1_8x32x1_1x32x1x8_8_1x1_intrawave_v3,864.71,665.2,0.0
gfx942,304,13696,6144,1536,ck,0,0,295.4661,a8w8_blockscale_1x128x128_256x128x128x128_16x16_32x32_2x2_8x32x1_8x32x1_1x32x1x8_8_1x1_intrawave_v3,874.9,672.74,0.0
gfx942,304,13824,6144,1536,ck,0,0,305.3987,a8w8_blockscale_1x128x128_256x128x128x128_16x16_32x32_2x2_8x32x1_8x32x1_1x32x1x8_8_1x1_intrawave_v3,854.36,656.65,0.0
gfx942,304,13952,6144,1536,ck,0,0,308.937,a8w8_blockscale_1x128x128_256x128x128x128_16x16_32x32_2x2_8x32x1_8x32x1_1x32x1x8_8_1x1_intrawave_v3,852.39,654.86,0.0
gfx942,304,14080,6144,1536,ck,0,0,302.6904,a8w8_blockscale_1x128x128_256x128x128x128_16x16_32x32_2x2_8x32x1_8x32x1_1x32x1x8_8_1x1_intrawave_v3,877.96,674.22,0.0
gfx942,304,14208,6144,1536,ck,0,0,306.8781,a8w8_blockscale_1x128x128_256x128x128x128_16x16_32x32_2x2_8x32x1_8x32x1_1x32x1x8_8_1x1_intrawave_v3,873.86,670.78,0.0
gfx942,304,14336,6144,1536,ck,0,0,313.8021,a8w8_blockscale_1x128x128_256x128x128x128_16x16_32x32_2x2_8x32x1_8x32x1_1x32x1x8_8_1x1_intrawave_v3,862.27,661.62,0.0
gfx942,304,14464,6144,1536,ck,0,0,324.7587,a8w8_blockscale_1x128x128_256x128x128x128_16x16_32x32_2x2_8x32x1_8x32x1_1x32x1x8_8_1x1_intrawave_v3,840.62,644.75,0.0
gfx942,304,14592,6144,1536,ck,0,0,313.8456,a8w8_blockscale_1x128x128_256x128x128x128_16x16_32x32_2x2_8x32x1_8x32x1_1x32x1x8_8_1x1_intrawave_v3,877.55,672.81,0.0
gfx942,304,14720,6144,1536,ck,0,0,325.7054,a8w8_blockscale_1x128x128_256x128x128x128_16x16_32x32_2x2_8x32x1_8x32x1_1x32x1x8_8_1x1_intrawave_v3,853.01,653.74,0.0
gfx942,304,14848,6144,1536,ck,0,0,325.7293,a8w8_blockscale_1x128x128_256x128x128x128_16x16_32x32_2x2_8x32x1_8x32x1_1x32x1x8_8_1x1_intrawave_v3,860.37,659.12,0.0
gfx942,304,14976,6144,1536,ck,0,0,327.1007,a8w8_blockscale_1x128x128_256x128x128x128_16x16_32x32_2x2_8x32x1_8x32x1_1x32x1x8_8_1x1_intrawave_v3,864.15,661.77,0.0
gfx942,304,15104,6144,1536,ck,0,0,327.4809,a8w8_blockscale_1x128x128_256x128x128x128_16x16_32x32_2x2_8x32x1_8x32x1_1x32x1x8_8_1x1_intrawave_v3,870.52,666.4,0.0
gfx942,304,15232,6144,1536,ck,0,0,330.0257,a8w8_blockscale_1x128x128_256x128x128x128_16x16_32x32_2x2_8x32x1_8x32x1_1x32x1x8_8_1x1_intrawave_v3,871.13,666.63,0.0
gfx942,304,15360,6144,1536,ck,0,0,341.8095,a8w8_blockscale_1x128x128_256x128x128x128_16x16_32x32_2x2_8x32x1_8x32x1_1x32x1x8_8_1x1_intrawave_v3,848.16,648.82,0.0
gfx942,304,15488,6144,1536,ck,0,0,337.9285,a8w8_blockscale_1x128x128_256x128x128x128_16x16_32x32_2x2_8x32x1_8x32x1_1x32x1x8_8_1x1_intrawave_v3,865.05,661.51,0.0
gfx942,304,15616,6144,1536,ck,0,0,333.9982,a8w8_blockscale_1x128x128_256x128x128x128_16x16_32x32_2x2_8x32x1_8x32x1_1x32x1x8_8_1x1_intrawave_v3,882.47,674.59,0.0
gfx942,304,15744,6144,1536,ck,0,0,336.4247,a8w8_blockscale_1x128x128_256x128x128x128_16x16_32x32_2x2_8x32x1_8x32x1_1x32x1x8_8_1x1_intrawave_v3,883.28,674.99,0.0
gfx942,304,15872,6144,1536,ck,0,0,345.4559,a8w8_blockscale_1x128x128_256x128x128x128_16x16_32x32_2x2_8x32x1_8x32x1_1x32x1x8_8_1x1_intrawave_v3,867.18,662.46,0.0
gfx942,304,16000,6144,1536,ck,0,0,343.7695,a8w8_blockscale_1x128x128_256x128x128x128_16x16_32x32_2x2_8x32x1_8x32x1_1x32x1x8_8_1x1_intrawave_v3,878.47,670.86,0.0
gfx942,304,16128,6144,1536,ck,0,0,347.7012,a8w8_blockscale_1x128x128_256x128x128x128_16x16_32x32_2x2_8x32x1_8x32x1_1x32x1x8_8_1x1_intrawave_v3,875.48,668.36,0.0
gfx942,304,16256,6144,1536,ck,0,0,358.8288,a8w8_blockscale_1x128x128_256x128x128x128_16x16_32x32_2x2_8x32x1_8x32x1_1x32x1x8_8_1x1_intrawave_v3,855.06,652.57,0.0
gfx942,304,16384,6144,1536,ck,0,0,365.7975,a8w8_blockscale_1x128x128_256x128x128x128_16x16_32x32_2x2_8x32x1_8x32x1_1x32x1x8_8_1x1_intrawave_v3,845.38,644.97,0.0
gfx942,304,16512,6144,1536,ck,0,0,359.7265,a8w8_blockscale_1x128x128_256x128x128x128_16x16_32x32_2x2_8x32x1_8x32x1_1x32x1x8_8_1x1_intrawave_v3,866.36,660.78,0.0
gfx942,304,1,6144,2048,ck,8,0,8.397,a8w8_blockscale_1x128x128_256x16x64x256_16x16_16x16_1x1_16x16x1_16x16x1_1x16x1x16_4_1x1_intrawave_v1,3.0,1500.21,0.0
gfx942,304,2,6144,2048,ck,8,0,8.805,a8w8_blockscale_1x128x128_256x16x64x256_16x16_16x16_1x1_16x16x1_16x16x1_1x16x1x16_4_1x1_intrawave_v1,5.72,1432.32,0.0
gfx942,304,4,6144,2048,ck,8,0,8.5233,a8w8_blockscale_1x128x128_256x16x64x256_16x16_16x16_1x1_16x16x1_16x16x1_1x16x1x16_4_1x1_intrawave_v1,11.81,1483.02,0.0
gfx942,304,8,6144,2048,ck,8,0,8.6372,a8w8_blockscale_1x128x128_256x16x64x256_16x16_16x16_1x1_16x16x1_16x16x1_1x16x1x16_4_1x1_intrawave_v1,23.31,1470.11,0.0
gfx942,304,16,6144,2048,ck,8,0,8.6747,a8w8_blockscale_1x128x128_256x16x64x256_16x16_16x16_1x1_16x16x1_16x16x1_1x16x1x16_4_1x1_intrawave_v1,46.42,1476.97,0.0
gfx942,304,32,6144,2048,ck,8,0,8.7197,a8w8_blockscale_1x128x128_256x16x64x256_16x16_16x16_1x1_16x16x1_16x16x1_1x16x1x16_4_1x1_intrawave_v1,92.35,1495.66,0.0
gfx942,304,48,6144,2048,ck,8,0,8.786,a8w8_blockscale_1x128x128_256x16x64x256_16x16_16x16_1x1_16x16x1_16x16x1_1x16x1x16_4_1x1_intrawave_v1,137.49,1510.48,0.0
gfx942,304,64,6144,2048,ck,13,0,11.2986,a8w8_blockscale_1x128x128_256x32x64x256_16x16_16x16_2x1_16x16x1_16x16x1_1x32x1x8_8_2x1_intrawave_v1,142.55,1194.88,0.0
gfx942,304,80,6144,2048,ck,13,0,11.3452,a8w8_blockscale_1x128x128_256x32x64x256_16x16_16x16_2x1_16x16x1_16x16x1_1x32x1x8_8_2x1_intrawave_v1,177.46,1210.19,0.0
gfx942,304,96,6144,2048,ck,13,0,11.2715,a8w8_blockscale_1x128x128_256x32x64x256_16x16_16x16_2x1_16x16x1_16x16x1_1x32x1x8_8_2x1_intrawave_v1,214.34,1238.45,0.0
gfx942,304,112,6144,2048,ck,18,0,11.9765,a8w8_blockscale_1x128x128_256x64x64x256_16x16_32x32_1x1_16x16x1_16x16x1_1x32x1x8_8_1x1_intrawave_v1,235.34,1184.7,0.0
gfx942,304,128,6144,2048,ck,18,0,11.464,a8w8_blockscale_1x128x128_256x64x64x256_16x16_32x32_1x1_16x16x1_16x16x1_1x32x1x8_8_1x1_intrawave_v1,280.99,1257.67,0.0
gfx942,304,144,6144,2048,ck,18,0,12.7682,a8w8_blockscale_1x128x128_256x64x64x256_16x16_32x32_1x1_16x16x1_16x16x1_1x32x1x8_8_1x1_intrawave_v1,283.82,1147.17,0.0
gfx942,304,160,6144,2048,ck,18,0,12.46,a8w8_blockscale_1x128x128_256x64x64x256_16x16_32x32_1x1_16x16x1_16x16x1_1x32x1x8_8_1x1_intrawave_v1,323.16,1193.95,0.0
gfx942,304,176,6144,2048,ck,18,0,12.8382,a8w8_blockscale_1x128x128_256x64x64x256_16x16_32x32_1x1_16x16x1_16x16x1_1x32x1x8_8_1x1_intrawave_v1,345.0,1176.65,0.0
gfx942,304,192,6144,2048,ck,18,0,12.3672,a8w8_blockscale_1x128x128_256x64x64x256_16x16_32x32_1x1_16x16x1_16x16x1_1x32x1x8_8_1x1_intrawave_v1,390.7,1240.01,0.0
gfx942,304,208,6144,2048,ck,3,0,19.6104,a8w8_blockscale_1x128x128_256x64x64x128_16x16_32x32_1x1_8x32x1_8x32x1_1x32x1x8_8_1x1_intrawave_v3,266.92,793.7,0.0
gfx942,304,224,6144,2048,ck,3,0,18.8376,a8w8_blockscale_1x128x128_256x64x64x128_16x16_32x32_1x1_8x32x1_8x32x1_1x32x1x8_8_1x1_intrawave_v3,299.25,838.44,0.0
gfx942,304,240,6144,2048,ck,3,0,19.66,a8w8_blockscale_1x128x128_256x64x64x128_16x16_32x32_1x1_8x32x1_8x32x1_1x32x1x8_8_1x1_intrawave_v3,307.21,815.03,0.0
gfx942,304,256,6144,2048,ck,18,0,20.4594,a8w8_blockscale_1x128x128_256x64x64x256_16x16_32x32_1x1_16x16x1_16x16x1_1x32x1x8_8_1x1_intrawave_v1,314.89,794.4,0.0
gfx942,304,288,6144,2048,ck,2,0,21.6047,a8w8_blockscale_1x128x128_256x64x128x128_16x16_32x32_1x2_8x32x1_8x32x1_1x32x1x8_8_1x1_intrawave_v3,335.47,773.52,0.0
gfx942,304,320,6144,2048,ck,18,0,21.5249,a8w8_blockscale_1x128x128_256x64x64x256_16x16_32x32_1x1_16x16x1_16x16x1_1x32x1x8_8_1x1_intrawave_v1,374.13,797.7,0.0
gfx942,304,352,6144,2048,ck,3,0,21.54,a8w8_blockscale_1x128x128_256x64x64x128_16x16_32x32_1x1_8x32x1_8x32x1_1x32x1x8_8_1x1_intrawave_v3,411.25,818.44,0.0
gfx942,304,384,6144,2048,ck,18,0,21.7397,a8w8_blockscale_1x128x128_256x64x64x256_16x16_32x32_1x1_16x16x1_16x16x1_1x32x1x8_8_1x1_intrawave_v1,444.52,832.02,0.0
gfx942,304,416,6144,2048,ck,0,0,27.2041,a8w8_blockscale_1x128x128_256x128x128x128_16x16_32x32_2x2_8x32x1_8x32x1_1x32x1x8_8_1x1_intrawave_v3,384.83,681.76,0.0
gfx942,304,448,6144,2048,ck,0,0,27.1475,a8w8_blockscale_1x128x128_256x128x128x128_16x16_32x32_2x2_8x32x1_8x32x1_1x32x1x8_8_1x1_intrawave_v3,415.3,700.08,0.0
gfx942,304,480,6144,2048,ck,3,0,29.7432,a8w8_blockscale_1x128x128_256x64x64x128_16x16_32x32_1x1_8x32x1_8x32x1_1x32x1x8_8_1x1_intrawave_v3,406.13,654.41,0.0
gfx942,304,512,6144,2048,ck,18,0,29.1032,a8w8_blockscale_1x128x128_256x64x64x256_16x16_32x32_1x1_16x16x1_16x16x1_1x32x1x8_8_1x1_intrawave_v1,442.73,684.56,0.0
gfx942,304,544,6144,2048,ck,0,0,29.8081,a8w8_blockscale_1x128x128_256x128x128x128_16x16_32x32_2x2_8x32x1_8x32x1_1x32x1x8_8_1x1_intrawave_v3,459.28,683.76,0.0
gfx942,304,576,6144,2048,ck,0,0,30.3998,a8w8_blockscale_1x128x128_256x128x128x128_16x16_32x32_2x2_8x32x1_8x32x1_1x32x1x8_8_1x1_intrawave_v3,476.83,685.55,0.0
gfx942,304,608,6144,2048,ck,0,0,31.0966,a8w8_blockscale_1x128x128_256x128x128x128_16x16_32x32_2x2_8x32x1_8x32x1_1x32x1x8_8_1x1_intrawave_v3,492.04,684.94,0.0
gfx942,304,640,6144,2048,ck,0,0,33.6746,a8w8_blockscale_1x128x128_256x128x128x128_16x16_32x32_2x2_8x32x1_8x32x1_1x32x1x8_8_1x1_intrawave_v3,478.29,646.12,0.0
gfx942,304,672,6144,2048,ck,0,0,31.0511,a8w8_blockscale_1x128x128_256x128x128x128_16x16_32x32_2x2_8x32x1_8x32x1_1x32x1x8_8_1x1_intrawave_v3,544.63,715.49,0.0
gfx942,304,704,6144,2048,ck,0,0,32.1207,a8w8_blockscale_1x128x128_256x128x128x128_16x16_32x32_2x2_8x32x1_8x32x1_1x32x1x8_8_1x1_intrawave_v3,551.57,705.95,0.0
gfx942,304,736,6144,2048,ck,0,0,32.6704,a8w8_blockscale_1x128x128_256x128x128x128_16x16_32x32_2x2_8x32x1_8x32x1_1x32x1x8_8_1x1_intrawave_v3,566.94,708.11,0.0
gfx942,304,768,6144,2048,ck,0,0,33.7972,a8w8_blockscale_1x128x128_256x128x128x128_16x16_32x32_2x2_8x32x1_8x32x1_1x32x1x8_8_1x1_intrawave_v3,571.86,698.07,0.0
gfx942,304,800,6144,2048,ck,0,0,43.1625,a8w8_blockscale_1x128x128_256x128x128x128_16x16_32x32_2x2_8x32x1_8x32x1_1x32x1x8_8_1x1_intrawave_v3,466.44,557.24,0.0
gfx942,304,832,6144,2048,ck,0,0,44.1725,a8w8_blockscale_1x128x128_256x128x128x128_16x16_32x32_2x2_8x32x1_8x32x1_1x32x1x8_8_1x1_intrawave_v3,474.0,554.88,0.0
gfx942,304,864,6144,2048,ck,0,0,44.1629,a8w8_blockscale_1x128x128_256x128x128x128_16x16_32x32_2x2_8x32x1_8x32x1_1x32x1x8_8_1x1_intrawave_v3,492.34,565.39,0.0
gfx942,304,896,6144,2048,ck,0,0,44.5136,a8w8_blockscale_1x128x128_256x128x128x128_16x16_32x32_2x2_8x32x1_8x32x1_1x32x1x8_8_1x1_intrawave_v3,506.55,571.24,0.0
gfx942,304,928,6144,2048,ck,0,0,45.7418,a8w8_blockscale_1x128x128_256x128x128x128_16x16_32x32_2x2_8x32x1_8x32x1_1x32x1x8_8_1x1_intrawave_v3,510.56,565.93,0.0
gfx942,304,960,6144,2048,ck,0,0,46.689,a8w8_blockscale_1x128x128_256x128x128x128_16x16_32x32_2x2_8x32x1_8x32x1_1x32x1x8_8_1x1_intrawave_v3,517.45,564.28,0.0
gfx942,304,992,6144,2048,ck,0,0,47.8687,a8w8_blockscale_1x128x128_256x128x128x128_16x16_32x32_2x2_8x32x1_8x32x1_1x32x1x8_8_1x1_intrawave_v3,521.52,559.95,0.0
gfx942,304,1024,6144,2048,ck,0,0,47.2211,a8w8_blockscale_1x128x128_256x128x128x128_16x16_32x32_2x2_8x32x1_8x32x1_1x32x1x8_8_1x1_intrawave_v3,545.73,577.35,0.0
gfx942,304,1088,6144,2048,ck,0,0,48.6827,a8w8_blockscale_1x128x128_256x128x128x128_16x16_32x32_2x2_8x32x1_8x32x1_1x32x1x8_8_1x1_intrawave_v3,562.43,578.86,0.0
gfx942,304,1152,6144,2048,ck,0,0,49.0828,a8w8_blockscale_1x128x128_256x128x128x128_16x16_32x32_2x2_8x32x1_8x32x1_1x32x1x8_8_1x1_intrawave_v3,590.66,592.83,0.0
gfx942,304,1216,6144,2048,ck,0,0,50.2517,a8w8_blockscale_1x128x128_256x128x128x128_16x16_32x32_2x2_8x32x1_8x32x1_1x32x1x8_8_1x1_intrawave_v3,608.97,597.3,0.0
gfx942,304,1280,6144,2048,ck,0,0,50.3622,a8w8_blockscale_1x128x128_256x128x128x128_16x16_32x32_2x2_8x32x1_8x32x1_1x32x1x8_8_1x1_intrawave_v3,639.61,614.21,0.0
gfx942,304,1344,6144,2048,ck,0,0,51.201,a8w8_blockscale_1x128x128_256x128x128x128_16x16_32x32_2x2_8x32x1_8x32x1_1x32x1x8_8_1x1_intrawave_v3,660.59,622.07,0.0
gfx942,304,1408,6144,2048,ck,0,0,51.6123,a8w8_blockscale_1x128x128_256x128x128x128_16x16_32x32_2x2_8x32x1_8x32x1_1x32x1x8_8_1x1_intrawave_v3,686.53,634.89,0.0
gfx942,304,1472,6144,2048,ck,0,0,53.1069,a8w8_blockscale_1x128x128_256x128x128x128_16x16_32x32_2x2_8x32x1_8x32x1_1x32x1x8_8_1x1_intrawave_v3,697.54,634.3,0.0
gfx942,304,1536,6144,2048,ck,0,0,54.0159,a8w8_blockscale_1x128x128_256x128x128x128_16x16_32x32_2x2_8x32x1_8x32x1_1x32x1x8_8_1x1_intrawave_v3,715.62,640.61,0.0
gfx942,304,1600,6144,2048,ck,2,0,67.7849,a8w8_blockscale_1x128x128_256x64x128x128_16x16_32x32_1x2_8x32x1_8x32x1_1x32x1x8_8_1x1_intrawave_v3,594.02,524.02,0.0
gfx942,304,1664,6144,2048,ck,0,0,71.8684,a8w8_blockscale_1x128x128_256x128x128x128_16x16_32x32_2x2_8x32x1_8x32x1_1x32x1x8_8_1x1_intrawave_v3,582.68,507.01,0.0
gfx942,304,1728,6144,2048,ck,0,0,74.318,a8w8_blockscale_1x128x128_256x128x128x128_16x16_32x32_2x2_8x32x1_8x32x1_1x32x1x8_8_1x1_intrawave_v3,585.14,502.64,0.0
gfx942,304,1792,6144,2048,ck,0,0,71.8198,a8w8_blockscale_1x128x128_256x128x128x128_16x16_32x32_2x2_8x32x1_8x32x1_1x32x1x8_8_1x1_intrawave_v3,627.92,532.9,0.0
gfx942,304,1856,6144,2048,ck,0,0,70.0226,a8w8_blockscale_1x128x128_256x128x128x128_16x16_32x32_2x2_8x32x1_8x32x1_1x32x1x8_8_1x1_intrawave_v3,667.04,559.68,0.0
gfx942,304,1920,6144,2048,ck,0,0,70.3625,a8w8_blockscale_1x128x128_256x128x128x128_16x16_32x32_2x2_8x32x1_8x32x1_1x32x1x8_8_1x1_intrawave_v3,686.71,570.02,0.0
gfx942,304,1984,6144,2048,ck,0,0,75.2275,a8w8_blockscale_1x128x128_256x128x128x128_16x16_32x32_2x2_8x32x1_8x32x1_1x32x1x8_8_1x1_intrawave_v3,663.71,545.35,0.0
gfx942,304,2048,6144,2048,ck,0,0,76.3017,a8w8_blockscale_1x128x128_256x128x128x128_16x16_32x32_2x2_8x32x1_8x32x1_1x32x1x8_8_1x1_intrawave_v3,675.47,549.7,0.0
gfx942,304,2112,6144,2048,ck,0,0,76.4549,a8w8_blockscale_1x128x128_256x128x128x128_16x16_32x32_2x2_8x32x1_8x32x1_1x32x1x8_8_1x1_intrawave_v3,695.18,560.6,0.0
gfx942,304,2176,6144,2048,ck,0,0,76.6152,a8w8_blockscale_1x128x128_256x128x128x128_16x16_32x32_2x2_8x32x1_8x32x1_1x32x1x8_8_1x1_intrawave_v3,714.75,571.4,0.0
gfx942,304,2240,6144,2048,ck,0,0,79.6218,a8w8_blockscale_1x128x128_256x128x128x128_16x16_32x32_2x2_8x32x1_8x32x1_1x32x1x8_8_1x1_intrawave_v3,707.99,561.35,0.0
gfx942,304,2304,6144,2048,ck,0,0,80.0165,a8w8_blockscale_1x128x128_256x128x128x128_16x16_32x32_2x2_8x32x1_8x32x1_1x32x1x8_8_1x1_intrawave_v3,724.63,570.05,0.0
gfx942,304,2368,6144,2048,ck,0,0,78.5894,a8w8_blockscale_1x128x128_256x128x128x128_16x16_32x32_2x2_8x32x1_8x32x1_1x32x1x8_8_1x1_intrawave_v3,758.28,592.07,0.0
gfx942,304,2432,6144,2048,ck,0,0,81.5067,a8w8_blockscale_1x128x128_256x128x128x128_16x16_32x32_2x2_8x32x1_8x32x1_1x32x1x8_8_1x1_intrawave_v3,750.9,582.14,0.0
gfx942,304,2496,6144,2048,ck,0,0,90.463,a8w8_blockscale_1x128x128_256x128x128x128_16x16_32x32_2x2_8x32x1_8x32x1_1x32x1x8_8_1x1_intrawave_v3,694.36,534.64,0.0
gfx942,304,2560,6144,2048,ck,0,0,92.8887,a8w8_blockscale_1x128x128_256x128x128x128_16x16_32x32_2x2_8x32x1_8x32x1_1x32x1x8_8_1x1_intrawave_v3,693.57,530.56,0.0
gfx942,304,2624,6144,2048,ck,0,0,93.9879,a8w8_blockscale_1x128x128_256x128x128x128_16x16_32x32_2x2_8x32x1_8x32x1_1x32x1x8_8_1x1_intrawave_v3,702.59,534.12,0.0
gfx942,304,2688,6144,2048,ck,0,0,97.8637,a8w8_blockscale_1x128x128_256x128x128x128_16x16_32x32_2x2_8x32x1_8x32x1_1x32x1x8_8_1x1_intrawave_v3,691.22,522.34,0.0
gfx942,304,2752,6144,2048,ck,0,0,94.6736,a8w8_blockscale_1x128x128_256x128x128x128_16x16_32x32_2x2_8x32x1_8x32x1_1x32x1x8_8_1x1_intrawave_v3,731.53,549.63,0.0
gfx942,304,2816,6144,2048,ck,0,0,96.3999,a8w8_blockscale_1x128x128_256x128x128x128_16x16_32x32_2x2_8x32x1_8x32x1_1x32x1x8_8_1x1_intrawave_v3,735.14,549.31,0.0
gfx942,304,2880,6144,2048,ck,0,0,95.4842,a8w8_blockscale_1x128x128_256x128x128x128_16x16_32x32_2x2_8x32x1_8x32x1_1x32x1x8_8_1x1_intrawave_v3,759.05,564.18,0.0
gfx942,304,2944,6144,2048,ck,0,0,94.5494,a8w8_blockscale_1x128x128_256x128x128x128_16x16_32x32_2x2_8x32x1_8x32x1_1x32x1x8_8_1x1_intrawave_v3,783.59,579.47,0.0
gfx942,304,3008,6144,2048,ck,0,0,98.4646,a8w8_blockscale_1x128x128_256x128x128x128_16x16_32x32_2x2_8x32x1_8x32x1_1x32x1x8_8_1x1_intrawave_v3,768.79,565.74,0.0
gfx942,304,3072,6144,2048,ck,0,0,97.3371,a8w8_blockscale_1x128x128_256x128x128x128_16x16_32x32_2x2_8x32x1_8x32x1_1x32x1x8_8_1x1_intrawave_v3,794.24,581.72,0.0
gfx942,304,3136,6144,2048,ck,0,0,101.4625,a8w8_blockscale_1x128x128_256x128x128x128_16x16_32x32_2x2_8x32x1_8x32x1_1x32x1x8_8_1x1_intrawave_v3,777.82,567.11,0.0
gfx942,304,3200,6144,2048,ck,0,0,100.6151,a8w8_blockscale_1x128x128_256x128x128x128_16x16_32x32_2x2_8x32x1_8x32x1_1x32x1x8_8_1x1_intrawave_v3,800.38,581.01,0.0
gfx942,304,3264,6144,2048,ck,0,0,112.7224,a8w8_blockscale_1x128x128_256x128x128x128_16x16_32x32_2x2_8x32x1_8x32x1_1x32x1x8_8_1x1_intrawave_v3,728.7,526.74,0.0
gfx942,304,3328,6144,2048,ck,0,0,114.921,a8w8_blockscale_1x128x128_256x128x128x128_16x16_32x32_2x2_8x32x1_8x32x1_1x32x1x8_8_1x1_intrawave_v3,728.78,524.65,0.0
gfx942,304,3392,6144,2048,ck,0,0,115.5233,a8w8_blockscale_1x128x128_256x128x128x128_16x16_32x32_2x2_8x32x1_8x32x1_1x32x1x8_8_1x1_intrawave_v3,738.92,529.86,0.0
gfx942,304,3456,6144,2048,ck,0,0,113.38,a8w8_blockscale_1x128x128_256x128x128x128_16x16_32x32_2x2_8x32x1_8x32x1_1x32x1x8_8_1x1_intrawave_v3,767.09,547.96,0.0
gfx942,304,3520,6144,2048,ck,0,0,117.9971,a8w8_blockscale_1x128x128_256x128x128x128_16x16_32x32_2x2_8x32x1_8x32x1_1x32x1x8_8_1x1_intrawave_v3,750.73,534.3,0.0
gfx942,304,3584,6144,2048,ck,0,0,116.3356,a8w8_blockscale_1x128x128_256x128x128x128_16x16_32x32_2x2_8x32x1_8x32x1_1x32x1x8_8_1x1_intrawave_v3,775.29,549.82,0.0
gfx942,304,3648,6144,2048,ck,0,0,119.4468,a8w8_blockscale_1x128x128_256x128x128x128_16x16_32x32_2x2_8x32x1_8x32x1_1x32x1x8_8_1x1_intrawave_v3,768.58,543.18,0.0
gfx942,304,3712,6144,2048,ck,0,0,117.5592,a8w8_blockscale_1x128x128_256x128x128x128_16x16_32x32_2x2_8x32x1_8x32x1_1x32x1x8_8_1x1_intrawave_v3,794.63,559.7,0.0
gfx942,304,3776,6144,2048,ck,0,0,123.1844,a8w8_blockscale_1x128x128_256x128x128x128_16x16_32x32_2x2_8x32x1_8x32x1_1x32x1x8_8_1x1_intrawave_v3,771.41,541.59,0.0
gfx942,304,3840,6144,2048,ck,0,0,118.0582,a8w8_blockscale_1x128x128_256x128x128x128_16x16_32x32_2x2_8x32x1_8x32x1_1x32x1x8_8_1x1_intrawave_v3,818.55,572.88,0.0
gfx942,304,3904,6144,2048,ck,0,0,120.9416,a8w8_blockscale_1x128x128_256x128x128x128_16x16_32x32_2x2_8x32x1_8x32x1_1x32x1x8_8_1x1_intrawave_v3,812.35,566.81,0.0
gfx942,304,3968,6144,2048,ck,0,0,122.3799,a8w8_blockscale_1x128x128_256x128x128x128_16x16_32x32_2x2_8x32x1_8x32x1_1x32x1x8_8_1x1_intrawave_v3,815.97,567.64,0.0
gfx942,304,4032,6144,2048,ck,0,0,133.6159,a8w8_blockscale_1x128x128_256x128x128x128_16x16_32x32_2x2_8x32x1_8x32x1_1x32x1x8_8_1x1_intrawave_v3,759.41,526.78,0.0
gfx942,304,4096,6144,2048,ck,0,0,139.4442,a8w8_blockscale_1x128x128_256x128x128x128_16x16_32x32_2x2_8x32x1_8x32x1_1x32x1x8_8_1x1_intrawave_v3,739.21,511.34,0.0
gfx942,304,4224,6144,2048,ck,0,0,137.8971,a8w8_blockscale_1x128x128_256x128x128x128_16x16_32x32_2x2_8x32x1_8x32x1_1x32x1x8_8_1x1_intrawave_v3,770.87,530.38,0.0
gfx942,304,4352,6144,2048,ck,0,0,138.8549,a8w8_blockscale_1x128x128_256x128x128x128_16x16_32x32_2x2_8x32x1_8x32x1_1x32x1x8_8_1x1_intrawave_v3,788.75,539.94,0.0
gfx942,304,4480,6144,2048,ck,0,0,136.8892,a8w8_blockscale_1x128x128_256x128x128x128_16x16_32x32_2x2_8x32x1_8x32x1_1x32x1x8_8_1x1_intrawave_v3,823.61,561.1,0.0
gfx942,304,4608,6144,2048,ck,0,0,141.2086,a8w8_blockscale_1x128x128_256x128x128x128_16x16_32x32_2x2_8x32x1_8x32x1_1x32x1x8_8_1x1_intrawave_v3,821.23,556.93,0.0
gfx942,304,4736,6144,2048,ck,0,0,145.8582,a8w8_blockscale_1x128x128_256x128x128x128_16x16_32x32_2x2_8x32x1_8x32x1_1x32x1x8_8_1x1_intrawave_v3,817.13,551.76,0.0
gfx942,304,4864,6144,2048,ck,0,0,146.0002,a8w8_blockscale_1x128x128_256x128x128x128_16x16_32x32_2x2_8x32x1_8x32x1_1x32x1x8_8_1x1_intrawave_v3,838.4,563.79,0.0
gfx942,304,4992,6144,2048,ck,0,0,156.4253,a8w8_blockscale_1x128x128_256x128x128x128_16x16_32x32_2x2_8x32x1_8x32x1_1x32x1x8_8_1x1_intrawave_v3,803.12,537.95,0.0
gfx942,304,5120,6144,2048,ck,0,0,158.4332,a8w8_blockscale_1x128x128_256x128x128x128_16x16_32x32_2x2_8x32x1_8x32x1_1x32x1x8_8_1x1_intrawave_v3,813.27,542.71,0.0
gfx942,304,5248,6144,2048,ck,0,0,164.1772,a8w8_blockscale_1x128x128_256x128x128x128_16x16_32x32_2x2_8x32x1_8x32x1_1x32x1x8_8_1x1_intrawave_v3,804.44,534.9,0.0
gfx942,304,5376,6144,2048,ck,0,0,163.5542,a8w8_blockscale_1x128x128_256x128x128x128_16x16_32x32_2x2_8x32x1_8x32x1_1x32x1x8_8_1x1_intrawave_v3,827.2,548.16,0.0
gfx942,304,5504,6144,2048,ck,0,0,164.4446,a8w8_blockscale_1x128x128_256x128x128x128_16x16_32x32_2x2_8x32x1_8x32x1_1x32x1x8_8_1x1_intrawave_v3,842.31,556.35,0.0
gfx942,304,5632,6144,2048,ck,0,0,167.087,a8w8_blockscale_1x128x128_256x128x128x128_16x16_32x32_2x2_8x32x1_8x32x1_1x32x1x8_8_1x1_intrawave_v3,848.26,558.53,0.0
gfx942,304,5760,6144,2048,ck,0,0,178.2529,a8w8_blockscale_1x128x128_256x128x128x128_16x16_32x32_2x2_8x32x1_8x32x1_1x32x1x8_8_1x1_intrawave_v3,813.2,533.84,0.0
gfx942,304,5888,6144,2048,ck,0,0,178.9449,a8w8_blockscale_1x128x128_256x128x128x128_16x16_32x32_2x2_8x32x1_8x32x1_1x32x1x8_8_1x1_intrawave_v3,828.06,542.03,0.0
gfx942,304,6016,6144,2048,ck,0,0,179.9561,a8w8_blockscale_1x128x128_256x128x128x128_16x16_32x32_2x2_8x32x1_8x32x1_1x32x1x8_8_1x1_intrawave_v3,841.3,549.18,0.0
gfx942,304,6144,6144,2048,ck,0,0,184.9094,a8w8_blockscale_1x128x128_256x128x128x128_16x16_32x32_2x2_8x32x1_8x32x1_1x32x1x8_8_1x1_intrawave_v3,836.19,544.39,0.0
gfx942,304,6272,6144,2048,ck,0,0,184.3412,a8w8_blockscale_1x128x128_256x128x128x128_16x16_32x32_2x2_8x32x1_8x32x1_1x32x1x8_8_1x1_intrawave_v3,856.24,556.02,0.0
gfx942,304,6400,6144,2048,ck,0,0,187.0441,a8w8_blockscale_1x128x128_256x128x128x128_16x16_32x32_2x2_8x32x1_8x32x1_1x32x1x8_8_1x1_intrawave_v3,861.09,557.8,0.0
gfx942,304,6528,6144,2048,ck,0,0,194.5982,a8w8_blockscale_1x128x128_256x128x128x128_16x16_32x32_2x2_8x32x1_8x32x1_1x32x1x8_8_1x1_intrawave_v3,844.21,545.58,0.0
gfx942,304,6656,6144,2048,ck,0,0,201.3714,a8w8_blockscale_1x128x128_256x128x128x128_16x16_32x32_2x2_8x32x1_8x32x1_1x32x1x8_8_1x1_intrawave_v3,831.81,536.34,0.0
gfx942,304,6784,6144,2048,ck,0,0,207.0168,a8w8_blockscale_1x128x128_256x128x128x128_16x16_32x32_2x2_8x32x1_8x32x1_1x32x1x8_8_1x1_intrawave_v3,824.69,530.58,0.0
gfx942,304,6912,6144,2048,ck,0,0,202.7404,a8w8_blockscale_1x128x128_256x128x128x128_16x16_32x32_2x2_8x32x1_8x32x1_1x32x1x8_8_1x1_intrawave_v3,857.97,550.82,0.0
gfx942,304,7040,6144,2048,ck,0,0,204.6441,a8w8_blockscale_1x128x128_256x128x128x128_16x16_32x32_2x2_8x32x1_8x32x1_1x32x1x8_8_1x1_intrawave_v3,865.73,554.66,0.0
gfx942,304,7168,6144,2048,ck,0,0,210.0055,a8w8_blockscale_1x128x128_256x128x128x128_16x16_32x32_2x2_8x32x1_8x32x1_1x32x1x8_8_1x1_intrawave_v3,858.97,549.24,0.0
gfx942,304,7296,6144,2048,ck,0,0,206.4829,a8w8_blockscale_1x128x128_256x128x128x128_16x16_32x32_2x2_8x32x1_8x32x1_1x32x1x8_8_1x1_intrawave_v3,889.23,567.5,0.0
gfx942,304,7424,6144,2048,ck,0,0,217.3567,a8w8_blockscale_1x128x128_256x128x128x128_16x16_32x32_2x2_8x32x1_8x32x1_1x32x1x8_8_1x1_intrawave_v3,859.56,547.55,0.0
gfx942,304,7552,6144,2048,ck,0,0,224.4424,a8w8_blockscale_1x128x128_256x128x128x128_16x16_32x32_2x2_8x32x1_8x32x1_1x32x1x8_8_1x1_intrawave_v3,846.78,538.44,0.0
gfx942,304,7680,6144,2048,ck,0,0,225.8374,a8w8_blockscale_1x128x128_256x128x128x128_16x16_32x32_2x2_8x32x1_8x32x1_1x32x1x8_8_1x1_intrawave_v3,855.81,543.24,0.0
gfx942,304,7808,6144,2048,ck,0,0,228.3621,a8w8_blockscale_1x128x128_256x128x128x128_16x16_32x32_2x2_8x32x1_8x32x1_1x32x1x8_8_1x1_intrawave_v3,860.45,545.27,0.0
gfx942,304,7936,6144,2048,ck,0,0,230.6388,a8w8_blockscale_1x128x128_256x128x128x128_16x16_32x32_2x2_8x32x1_8x32x1_1x32x1x8_8_1x1_intrawave_v3,865.93,547.84,0.0
gfx942,304,8064,6144,2048,ck,0,0,227.7406,a8w8_blockscale_1x128x128_256x128x128x128_16x16_32x32_2x2_8x32x1_8x32x1_1x32x1x8_8_1x1_intrawave_v3,891.09,562.87,0.0
gfx942,304,8192,6144,2048,ck,0,0,243.2067,a8w8_blockscale_1x128x128_256x128x128x128_16x16_32x32_2x2_8x32x1_8x32x1_1x32x1x8_8_1x1_intrawave_v3,847.67,534.62,0.0
gfx942,304,8320,6144,2048,ck,0,0,246.6901,a8w8_blockscale_1x128x128_256x128x128x128_16x16_32x32_2x2_8x32x1_8x32x1_1x32x1x8_8_1x1_intrawave_v3,848.76,534.51,0.0
gfx942,304,8448,6144,2048,ck,0,0,244.7929,a8w8_blockscale_1x128x128_256x128x128x128_16x16_32x32_2x2_8x32x1_8x32x1_1x32x1x8_8_1x1_intrawave_v3,868.49,546.15,0.0
gfx942,304,8576,6144,2048,ck,0,0,244.9862,a8w8_blockscale_1x128x128_256x128x128x128_16x16_32x32_2x2_8x32x1_8x32x1_1x32x1x8_8_1x1_intrawave_v3,880.96,553.21,0.0
gfx942,304,8704,6144,2048,ck,0,0,246.5672,a8w8_blockscale_1x128x128_256x128x128x128_16x16_32x32_2x2_8x32x1_8x32x1_1x32x1x8_8_1x1_intrawave_v3,888.37,557.1,0.0
gfx942,304,8832,6144,2048,ck,0,0,247.0781,a8w8_blockscale_1x128x128_256x128x128x128_16x16_32x32_2x2_8x32x1_8x32x1_1x32x1x8_8_1x1_intrawave_v3,899.57,563.38,0.0
gfx942,304,8960,6144,2048,ck,0,0,262.2789,a8w8_blockscale_1x128x128_256x128x128x128_16x16_32x32_2x2_8x32x1_8x32x1_1x32x1x8_8_1x1_intrawave_v3,859.72,537.72,0.0
gfx942,304,9088,6144,2048,ck,0,0,257.5541,a8w8_blockscale_1x128x128_256x128x128x128_16x16_32x32_2x2_8x32x1_8x32x1_1x32x1x8_8_1x1_intrawave_v3,888.0,554.71,0.0
gfx942,304,9216,6144,2048,ck,0,0,261.5549,a8w8_blockscale_1x128x128_256x128x128x128_16x16_32x32_2x2_8x32x1_8x32x1_1x32x1x8_8_1x1_intrawave_v3,886.73,553.24,0.0
gfx942,304,9344,6144,2048,ck,0,0,265.6629,a8w8_blockscale_1x128x128_256x128x128x128_16x16_32x32_2x2_8x32x1_8x32x1_1x32x1x8_8_1x1_intrawave_v3,885.14,551.6,0.0
gfx942,304,9472,6144,2048,ck,0,0,269.8894,a8w8_blockscale_1x128x128_256x128x128x128_16x16_32x32_2x2_8x32x1_8x32x1_1x32x1x8_8_1x1_intrawave_v3,883.22,549.76,0.0
gfx942,304,9728,6144,2048,ck,0,0,274.5115,a8w8_blockscale_1x128x128_256x128x128x128_16x16_32x32_2x2_8x32x1_8x32x1_1x32x1x8_8_1x1_intrawave_v3,891.81,553.87,0.0
gfx942,304,9856,6144,2048,ck,0,0,278.6899,a8w8_blockscale_1x128x128_256x128x128x128_16x16_32x32_2x2_8x32x1_8x32x1_1x32x1x8_8_1x1_intrawave_v3,890.0,552.15,0.0
gfx942,304,9984,6144,2048,ck,0,0,281.6898,a8w8_blockscale_1x128x128_256x128x128x128_16x16_32x32_2x2_8x32x1_8x32x1_1x32x1x8_8_1x1_intrawave_v3,891.96,552.78,0.0
gfx942,304,10112,6144,2048,ck,0,0,281.1778,a8w8_blockscale_1x128x128_256x128x128x128_16x16_32x32_2x2_8x32x1_8x32x1_1x32x1x8_8_1x1_intrawave_v3,905.04,560.32,0.0
gfx942,304,10240,6144,2048,ck,0,0,286.4596,a8w8_blockscale_1x128x128_256x128x128x128_16x16_32x32_2x2_8x32x1_8x32x1_1x32x1x8_8_1x1_intrawave_v3,899.6,556.39,0.0
gfx942,304,10368,6144,2048,ck,0,0,295.0319,a8w8_blockscale_1x128x128_256x128x128x128_16x16_32x32_2x2_8x32x1_8x32x1_1x32x1x8_8_1x1_intrawave_v3,884.38,546.44,0.0
gfx942,304,10496,6144,2048,ck,0,0,291.6704,a8w8_blockscale_1x128x128_256x128x128x128_16x16_32x32_2x2_8x32x1_8x32x1_1x32x1x8_8_1x1_intrawave_v3,905.61,559.03,0.0
gfx942,304,10624,6144,2048,ck,0,0,303.3753,a8w8_blockscale_1x128x128_256x128x128x128_16x16_32x32_2x2_8x32x1_8x32x1_1x32x1x8_8_1x1_intrawave_v3,881.29,543.51,0.0
gfx942,304,10752,6144,2048,ck,0,0,308.0338,a8w8_blockscale_1x128x128_256x128x128x128_16x16_32x32_2x2_8x32x1_8x32x1_1x32x1x8_8_1x1_intrawave_v3,878.42,541.25,0.0
gfx942,304,10880,6144,2048,ck,0,0,304.0453,a8w8_blockscale_1x128x128_256x128x128x128_16x16_32x32_2x2_8x32x1_8x32x1_1x32x1x8_8_1x1_intrawave_v3,900.54,554.39,0.0
gfx942,304,11008,6144,2048,ck,0,0,309.2197,a8w8_blockscale_1x128x128_256x128x128x128_16x16_32x32_2x2_8x32x1_8x32x1_1x32x1x8_8_1x1_intrawave_v3,895.89,551.04,0.0
gfx942,304,11136,6144,2048,ck,0,0,309.9009,a8w8_blockscale_1x128x128_256x128x128x128_16x16_32x32_2x2_8x32x1_8x32x1_1x32x1x8_8_1x1_intrawave_v3,904.31,555.75,0.0
gfx942,304,11264,6144,2048,ck,0,0,316.9958,a8w8_blockscale_1x128x128_256x128x128x128_16x16_32x32_2x2_8x32x1_8x32x1_1x32x1x8_8_1x1_intrawave_v3,894.23,549.1,0.0
gfx942,304,11648,6144,2048,ck,0,0,325.6356,a8w8_blockscale_1x128x128_256x128x128x128_16x16_32x32_2x2_8x32x1_8x32x1_1x32x1x8_8_1x1_intrawave_v3,900.18,551.44,0.0
gfx942,304,11904,6144,2048,ck,0,0,331.6632,a8w8_blockscale_1x128x128_256x128x128x128_16x16_32x32_2x2_8x32x1_8x32x1_1x32x1x8_8_1x1_intrawave_v3,903.25,552.48,0.0
gfx942,304,12032,6144,2048,ck,0,0,336.8872,a8w8_blockscale_1x128x128_256x128x128x128_16x16_32x32_2x2_8x32x1_8x32x1_1x32x1x8_8_1x1_intrawave_v3,898.8,549.36,0.0
gfx942,304,12160,6144,2048,ck,0,0,340.2158,a8w8_blockscale_1x128x128_256x128x128x128_16x16_32x32_2x2_8x32x1_8x32x1_1x32x1x8_8_1x1_intrawave_v3,899.48,549.38,0.0
gfx942,304,12288,6144,2048,ck,0,0,351.9394,a8w8_blockscale_1x128x128_256x128x128x128_16x16_32x32_2x2_8x32x1_8x32x1_1x32x1x8_8_1x1_intrawave_v3,878.67,536.3,0.0
gfx942,304,12416,6144,2048,ck,0,0,349.2713,a8w8_blockscale_1x128x128_256x128x128x128_16x16_32x32_2x2_8x32x1_8x32x1_1x32x1x8_8_1x1_intrawave_v3,894.6,545.65,0.0
gfx942,304,12544,6144,2048,ck,0,0,348.5741,a8w8_blockscale_1x128x128_256x128x128x128_16x16_32x32_2x2_8x32x1_8x32x1_1x32x1x8_8_1x1_intrawave_v3,905.63,552.0,0.0
gfx942,304,12672,6144,2048,ck,0,0,353.3976,a8w8_blockscale_1x128x128_256x128x128x128_16x16_32x32_2x2_8x32x1_8x32x1_1x32x1x8_8_1x1_intrawave_v3,902.39,549.66,0.0
gfx942,304,12800,6144,2048,ck,0,0,350.5178,a8w8_blockscale_1x128x128_256x128x128x128_16x16_32x32_2x2_8x32x1_8x32x1_1x32x1x8_8_1x1_intrawave_v3,918.99,559.41,0.0
gfx942,304,13056,6144,2048,ck,0,0,365.8993,a8w8_blockscale_1x128x128_256x128x128x128_16x16_32x32_2x2_8x32x1_8x32x1_1x32x1x8_8_1x1_intrawave_v3,897.97,545.93,0.0
gfx942,304,13312,6144,2048,ck,0,0,363.4975,a8w8_blockscale_1x128x128_256x128x128x128_16x16_32x32_2x2_8x32x1_8x32x1_1x32x1x8_8_1x1_intrawave_v3,921.62,559.63,0.0
gfx942,304,13440,6144,2048,ck,0,0,372.9337,a8w8_blockscale_1x128x128_256x128x128x128_16x16_32x32_2x2_8x32x1_8x32x1_1x32x1x8_8_1x1_intrawave_v3,906.94,550.39,0.0
gfx942,304,13568,6144,2048,ck,0,0,374.8386,a8w8_blockscale_1x128x128_256x128x128x128_16x16_32x32_2x2_8x32x1_8x32x1_1x32x1x8_8_1x1_intrawave_v3,910.93,552.49,0.0
gfx942,304,13696,6144,2048,ck,0,0,374.3178,a8w8_blockscale_1x128x128_256x128x128x128_16x16_32x32_2x2_8x32x1_8x32x1_1x32x1x8_8_1x1_intrawave_v3,920.8,558.16,0.0
gfx942,304,13824,6144,2048,ck,0,0,383.3469,a8w8_blockscale_1x128x128_256x128x128x128_16x16_32x32_2x2_8x32x1_8x32x1_1x32x1x8_8_1x1_intrawave_v3,907.51,549.8,0.0
gfx942,304,13952,6144,2048,ck,0,0,387.8155,a8w8_blockscale_1x128x128_256x128x128x128_16x16_32x32_2x2_8x32x1_8x32x1_1x32x1x8_8_1x1_intrawave_v3,905.36,548.2,0.0
gfx942,304,14080,6144,2048,ck,0,0,389.8572,a8w8_blockscale_1x128x128_256x128x128x128_16x16_32x32_2x2_8x32x1_8x32x1_1x32x1x8_8_1x1_intrawave_v3,908.88,550.03,0.0
gfx942,304,14208,6144,2048,ck,0,0,391.2021,a8w8_blockscale_1x128x128_256x128x128x128_16x16_32x32_2x2_8x32x1_8x32x1_1x32x1x8_8_1x1_intrawave_v3,913.99,552.83,0.0
gfx942,304,14464,6144,2048,ck,0,0,395.1243,a8w8_blockscale_1x128x128_256x128x128x128_16x16_32x32_2x2_8x32x1_8x32x1_1x32x1x8_8_1x1_intrawave_v3,921.23,556.63,0.0
gfx942,304,14592,6144,2048,ck,0,0,402.2312,a8w8_blockscale_1x128x128_256x128x128x128_16x16_32x32_2x2_8x32x1_8x32x1_1x32x1x8_8_1x1_intrawave_v3,912.96,551.36,0.0
gfx942,304,14720,6144,2048,ck,0,0,412.9413,a8w8_blockscale_1x128x128_256x128x128x128_16x16_32x32_2x2_8x32x1_8x32x1_1x32x1x8_8_1x1_intrawave_v3,897.08,541.5,0.0
gfx942,304,14848,6144,2048,ck,0,0,409.9644,a8w8_blockscale_1x128x128_256x128x128x128_16x16_32x32_2x2_8x32x1_8x32x1_1x32x1x8_8_1x1_intrawave_v3,911.45,549.91,0.0
gfx942,304,14976,6144,2048,ck,0,0,410.8751,a8w8_blockscale_1x128x128_256x128x128x128_16x16_32x32_2x2_8x32x1_8x32x1_1x32x1x8_8_1x1_intrawave_v3,917.27,553.16,0.0
gfx942,304,15104,6144,2048,ck,0,0,410.8134,a8w8_blockscale_1x128x128_256x128x128x128_16x16_32x32_2x2_8x32x1_8x32x1_1x32x1x8_8_1x1_intrawave_v3,925.25,557.71,0.0
gfx942,304,15232,6144,2048,ck,0,0,416.5962,a8w8_blockscale_1x128x128_256x128x128x128_16x16_32x32_2x2_8x32x1_8x32x1_1x32x1x8_8_1x1_intrawave_v3,920.14,554.37,0.0
gfx942,304,15360,6144,2048,ck,0,0,425.7098,a8w8_blockscale_1x128x128_256x128x128x128_16x16_32x32_2x2_8x32x1_8x32x1_1x32x1x8_8_1x1_intrawave_v3,908.01,546.81,0.0
gfx942,304,15488,6144,2048,ck,0,0,423.1741,a8w8_blockscale_1x128x128_256x128x128x128_16x16_32x32_2x2_8x32x1_8x32x1_1x32x1x8_8_1x1_intrawave_v3,921.06,554.43,0.0
gfx942,304,15616,6144,2048,ck,0,0,436.1023,a8w8_blockscale_1x128x128_256x128x128x128_16x16_32x32_2x2_8x32x1_8x32x1_1x32x1x8_8_1x1_intrawave_v3,901.14,542.2,0.0
gfx942,304,15872,6144,2048,ck,0,0,432.0599,a8w8_blockscale_1x128x128_256x128x128x128_16x16_32x32_2x2_8x32x1_8x32x1_1x32x1x8_8_1x1_intrawave_v3,924.48,555.77,0.0
gfx942,304,16000,6144,2048,ck,0,0,445.3753,a8w8_blockscale_1x128x128_256x128x128x128_16x16_32x32_2x2_8x32x1_8x32x1_1x32x1x8_8_1x1_intrawave_v3,904.08,543.27,0.0
gfx942,304,16256,6144,2048,ck,0,0,447.0238,a8w8_blockscale_1x128x128_256x128x128x128_16x16_32x32_2x2_8x32x1_8x32x1_1x32x1x8_8_1x1_intrawave_v3,915.15,549.48,0.0
gfx942,304,16384,6144,2048,ck,0,0,460.2042,a8w8_blockscale_1x128x128_256x128x128x128_16x16_32x32_2x2_8x32x1_8x32x1_1x32x1x8_8_1x1_intrawave_v3,895.94,537.73,0.0
gfx942,304,16512,6144,2048,ck,0,0,455.967,a8w8_blockscale_1x128x128_256x128x128x128_16x16_32x32_2x2_8x32x1_8x32x1_1x32x1x8_8_1x1_intrawave_v3,911.33,546.75,0.0
