aiter/configs/model_configs/a8w8_blockscale_tuned_gemm_qwen3_5_397b_a13b.csv
gfx,cu_num,M,N,K,libtype,kernelId,splitK,us,kernelName,tflops,bw,errRatio
gfx950,256,16,256,4096,ck,8,0,11.6965,a8w8_blockscale_1x128x128_256x16x64x256_16x16_16x16_1x1_16x16x1_16x16x1_1x16x1x16_4_1x1_intrawave_v1,0.18,90.04,0.0
gfx950,256,32,256,4096,ck,8,0,12.2103,a8w8_blockscale_1x128x128_256x16x64x256_16x16_16x16_1x1_16x16x1_16x16x1_1x16x1x16_4_1x1_intrawave_v1,4.12,94.93,0.0
gfx950,256,48,256,4096,ck,8,0,12.208,a8w8_blockscale_1x128x128_256x16x64x256_16x16_16x16_1x1_16x16x1_16x16x1_1x16x1x16_4_1x1_intrawave_v1,6.87,100.99,0.0
gfx950,256,64,256,4096,ck,8,0,12.2484,a8w8_blockscale_1x128x128_256x16x64x256_16x16_16x16_1x1_16x16x1_16x16x1_1x16x1x16_4_1x1_intrawave_v1,9.59,106.68,0.0
gfx950,256,768,256,4096,ck,8,0,12.895,a8w8_blockscale_1x128x128_256x16x64x256_16x16_16x16_1x1_16x16x1_16x16x1_1x16x1x16_4_1x1_intrawave_v1,124.9,355.76,0.0
gfx950,256,832,256,4096,ck,8,0,13.3192,a8w8_blockscale_1x128x128_256x16x64x256_16x16_16x16_1x1_16x16x1_16x16x1_1x16x1x16_4_1x1_intrawave_v1,128.64,361.38,0.0
gfx950,256,864,256,4096,ck,8,0,13.3665,a8w8_blockscale_1x128x128_256x16x64x256_16x16_16x16_1x1_16x16x1_16x16x1_1x16x1x16_4_1x1_intrawave_v1,130.85,365.96,0.0
gfx950,256,896,256,4096,ck,8,0,13.5159,a8w8_blockscale_1x128x128_256x16x64x256_16x16_16x16_1x1_16x16x1_16x16x1_1x16x1x16_4_1x1_intrawave_v1,134.21,372.49,0.0
gfx950,256,928,256,4096,ck,8,0,13.396,a8w8_blockscale_1x128x128_256x16x64x256_16x16_16x16_1x1_16x16x1_16x16x1_1x16x1x16_4_1x1_intrawave_v1,140.74,387.52,0.0
gfx950,256,960,256,4096,ck,8,0,13.584,a8w8_blockscale_1x128x128_256x16x64x256_16x16_16x16_1x1_16x16x1_16x16x1_1x16x1x16_4_1x1_intrawave_v1,143.58,392.67,0.0
gfx950,256,992,256,4096,ck,8,0,13.3313,a8w8_blockscale_1x128x128_256x16x64x256_16x16_16x16_1x1_16x16x1_16x16x1_1x16x1x16_4_1x1_intrawave_v1,151.33,411.17,0.0
gfx950,256,1024,256,4096,ck,8,0,13.7184,a8w8_blockscale_1x128x128_256x16x64x256_16x16_16x16_1x1_16x16x1_16x16x1_1x16x1x16_4_1x1_intrawave_v1,151.95,410.32,0.0
gfx950,256,1216,256,4096,ck,7,0,16.3449,a8w8_blockscale_1x128x128_256x16x128x256_16x16_16x16_1x2_16x16x1_16x16x1_1x16x1x16_8_1x2_intrawave_v1,153.71,401.9,0.0
gfx950,256,1280,256,4096,ck,18,0,15.9773,a8w8_blockscale_1x128x128_256x64x64x256_16x16_32x32_1x1_16x16x1_16x16x1_1x32x1x8_8_1x1_intrawave_v1,168.01,434.79,0.0
gfx950,256,1536,256,4096,ck,7,0,16.5728,a8w8_blockscale_1x128x128_256x16x128x256_16x16_16x16_1x2_16x16x1_16x16x1_1x16x1x16_8_1x2_intrawave_v1,191.96,485.07,0.0
gfx950,256,2048,256,4096,ck,7,0,16.9213,a8w8_blockscale_1x128x128_256x16x128x256_16x16_16x16_1x2_16x16x1_16x16x1_1x16x1x16_8_1x2_intrawave_v1,251.47,614.5,0.0
gfx950,256,4096,256,4096,ck,18,0,20.9363,a8w8_blockscale_1x128x128_256x64x64x256_16x16_32x32_1x1_16x16x1_16x16x1_1x32x1x8_8_1x1_intrawave_v1,408.19,946.98,0.0
gfx950,256,8192,256,4096,ck,2,0,27.4086,a8w8_blockscale_1x128x128_256x64x128x128_16x16_32x32_1x2_8x32x1_8x32x1_1x32x1x8_8_1x1_intrawave_v3,619.92,1400.38,0.0
gfx950,256,16384,256,4096,ck,0,0,38.0411,a8w8_blockscale_1x128x128_256x128x128x128_16x16_32x32_2x2_8x32x1_8x32x1_1x32x1x8_8_1x1_intrawave_v3,901.02,2007.35,0.0
gfx950,256,16,1024,4096,ck,8,0,13.1276,a8w8_blockscale_1x128x128_256x16x64x256_16x16_16x16_1x1_16x16x1_16x16x1_1x16x1x16_4_1x1_intrawave_v1,0.64,319.97,0.0
gfx950,256,32,1024,4096,ck,8,0,13.4521,a8w8_blockscale_1x128x128_256x16x64x256_16x16_16x16_1x1_16x16x1_16x16x1_1x16x1x16_4_1x1_intrawave_v1,14.97,322.76,0.0
gfx950,256,48,1024,4096,ck,8,0,13.2544,a8w8_blockscale_1x128x128_256x16x64x256_16x16_16x16_1x1_16x16x1_16x16x1_1x16x1x16_4_1x1_intrawave_v1,25.32,334.99,0.0
gfx950,256,64,1024,4096,ck,8,0,13.3221,a8w8_blockscale_1x128x128_256x16x64x256_16x16_16x16_1x1_16x16x1_16x16x1_1x16x1x16_4_1x1_intrawave_v1,35.26,340.66,0.0
gfx950,256,768,1024,4096,ck,18,0,16.4325,a8w8_blockscale_1x128x128_256x64x64x256_16x16_32x32_1x1_16x16x1_16x16x1_1x32x1x8_8_1x1_intrawave_v1,392.06,542.39,0.0
gfx950,256,832,1024,4096,ck,18,0,20.6277,a8w8_blockscale_1x128x128_256x64x64x256_16x16_32x32_1x1_16x16x1_16x16x1_1x32x1x8_8_1x1_intrawave_v1,332.25,446.68,0.0
gfx950,256,864,1024,4096,ck,18,0,20.7111,a8w8_blockscale_1x128x128_256x64x64x256_16x16_32x32_1x1_16x16x1_16x16x1_1x32x1x8_8_1x1_intrawave_v1,337.79,449.92,0.0
gfx950,256,896,1024,4096,ck,18,0,20.7092,a8w8_blockscale_1x128x128_256x64x64x256_16x16_32x32_1x1_16x16x1_16x16x1_1x32x1x8_8_1x1_intrawave_v1,350.38,459.16,0.0
gfx950,256,928,1024,4096,ck,18,0,20.7299,a8w8_blockscale_1x128x128_256x64x64x256_16x16_32x32_1x1_16x16x1_16x16x1_1x32x1x8_8_1x1_intrawave_v1,363.79,468.78,0.0
gfx950,256,960,1024,4096,ck,18,0,20.7661,a8w8_blockscale_1x128x128_256x64x64x256_16x16_32x32_1x1_16x16x1_16x16x1_1x32x1x8_8_1x1_intrawave_v1,375.68,477.13,0.0
gfx950,256,992,1024,4096,ck,18,0,20.9593,a8w8_blockscale_1x128x128_256x64x64x256_16x16_32x32_1x1_16x16x1_16x16x1_1x32x1x8_8_1x1_intrawave_v1,385.02,482.12,0.0
gfx950,256,1024,1024,4096,ck,18,0,20.8715,a8w8_blockscale_1x128x128_256x64x64x256_16x16_32x32_1x1_16x16x1_16x16x1_1x32x1x8_8_1x1_intrawave_v1,399.51,493.56,0.0
gfx950,256,1216,1024,4096,ck,2,0,25.8517,a8w8_blockscale_1x128x128_256x64x128x128_16x16_32x32_1x2_8x32x1_8x32x1_1x32x1x8_8_1x1_intrawave_v3,388.74,446.97,0.0
gfx950,256,1280,1024,4096,ck,3,0,24.8162,a8w8_blockscale_1x128x128_256x64x64x128_16x16_32x32_1x1_8x32x1_8x32x1_1x32x1x8_8_1x1_intrawave_v3,432.68,485.92,0.0
gfx950,256,1536,1024,4096,ck,2,0,26.1639,a8w8_blockscale_1x128x128_256x64x128x128_16x16_32x32_1x2_8x32x1_8x32x1_1x32x1x8_8_1x1_intrawave_v3,486.38,516.54,0.0
gfx950,256,2048,1024,4096,ck,2,0,26.2741,a8w8_blockscale_1x128x128_256x64x128x128_16x16_32x32_1x2_8x32x1_8x32x1_1x32x1x8_8_1x1_intrawave_v3,647.8,634.1,0.0
gfx950,256,4096,1024,4096,ck,0,0,36.2164,a8w8_blockscale_1x128x128_256x128x128x128_16x16_32x32_2x2_8x32x1_8x32x1_1x32x1x8_8_1x1_intrawave_v3,943.87,807.12,0.0
gfx950,256,8192,1024,4096,ck,0,0,61.7018,a8w8_blockscale_1x128x128_256x128x128x128_16x16_32x32_2x2_8x32x1_8x32x1_1x32x1x8_8_1x1_intrawave_v3,1101.5,874.74,0.0
gfx950,256,16384,1024,4096,ck,0,0,115.4381,a8w8_blockscale_1x128x128_256x128x128x128_16x16_32x32_2x2_8x32x1_8x32x1_1x32x1x8_8_1x1_intrawave_v3,1187.68,906.22,0.0
gfx950,256,16,1536,4096,ck,8,0,13.5333,a8w8_blockscale_1x128x128_256x16x64x256_16x16_16x16_1x1_16x16x1_16x16x1_1x16x1x16_4_1x1_intrawave_v1,0.93,465.42,0.0
gfx950,256,32,1536,4096,ck,8,0,13.9034,a8w8_blockscale_1x128x128_256x16x64x256_16x16_16x16_1x1_16x16x1_16x16x1_1x16x1x16_4_1x1_intrawave_v1,21.72,464.89,0.0
gfx950,256,48,1536,4096,ck,8,0,13.8133,a8w8_blockscale_1x128x128_256x16x64x256_16x16_16x16_1x1_16x16x1_16x16x1_1x16x1x16_4_1x1_intrawave_v1,36.44,476.22,0.0
gfx950,256,64,1536,4096,ck,8,0,13.7676,a8w8_blockscale_1x128x128_256x16x64x256_16x16_16x16_1x1_16x16x1_16x16x1_1x16x1x16_4_1x1_intrawave_v1,51.18,486.13,0.0
gfx950,256,768,1536,4096,ck,3,0,24.8201,a8w8_blockscale_1x128x128_256x64x64x128_16x16_32x32_1x1_8x32x1_8x32x1_1x32x1x8_8_1x1_intrawave_v3,389.35,475.28,0.0
gfx950,256,832,1536,4096,ck,2,0,25.7589,a8w8_blockscale_1x128x128_256x64x128x128_16x16_32x32_1x2_8x32x1_8x32x1_1x32x1x8_8_1x1_intrawave_v3,399.09,471.59,0.0
gfx950,256,864,1536,4096,ck,2,0,25.6811,a8w8_blockscale_1x128x128_256x64x128x128_16x16_32x32_1x2_8x32x1_8x32x1_1x32x1x8_8_1x1_intrawave_v3,408.63,477.77,0.0
gfx950,256,896,1536,4096,ck,2,0,25.8585,a8w8_blockscale_1x128x128_256x64x128x128_16x16_32x32_1x2_8x32x1_8x32x1_1x32x1x8_8_1x1_intrawave_v3,420.91,483.08,0.0
gfx950,256,928,1536,4096,ck,2,0,26.0381,a8w8_blockscale_1x128x128_256x64x128x128_16x16_32x32_1x2_8x32x1_8x32x1_1x32x1x8_8_1x1_intrawave_v3,434.44,489.11,0.0
gfx950,256,960,1536,4096,ck,2,0,25.9117,a8w8_blockscale_1x128x128_256x64x128x128_16x16_32x32_1x2_8x32x1_8x32x1_1x32x1x8_8_1x1_intrawave_v3,451.61,500.07,0.0
gfx950,256,992,1536,4096,ck,2,0,25.6287,a8w8_blockscale_1x128x128_256x64x128x128_16x16_32x32_1x2_8x32x1_8x32x1_1x32x1x8_8_1x1_intrawave_v3,472.31,514.54,0.0
gfx950,256,1024,1536,4096,ck,2,0,25.9951,a8w8_blockscale_1x128x128_256x64x128x128_16x16_32x32_1x2_8x32x1_8x32x1_1x32x1x8_8_1x1_intrawave_v3,481.15,516.11,0.0
gfx950,256,1216,1536,4096,ck,2,0,26.4181,a8w8_blockscale_1x128x128_256x64x128x128_16x16_32x32_1x2_8x32x1_8x32x1_1x32x1x8_8_1x1_intrawave_v3,570.61,563.2,0.0
gfx950,256,1280,1536,4096,ck,2,0,26.0995,a8w8_blockscale_1x128x128_256x64x128x128_16x16_32x32_1x2_8x32x1_8x32x1_1x32x1x8_8_1x1_intrawave_v3,617.1,592.6,0.0
gfx950,256,1536,1536,4096,ck,2,0,32.599,a8w8_blockscale_1x128x128_256x64x128x128_16x16_32x32_1x2_8x32x1_8x32x1_1x32x1x8_8_1x1_intrawave_v3,585.55,526.56,0.0
gfx950,256,2048,1536,4096,ck,0,0,33.4431,a8w8_blockscale_1x128x128_256x128x128x128_16x16_32x32_2x2_8x32x1_8x32x1_1x32x1x8_8_1x1_intrawave_v3,763.41,623.01,0.0
gfx950,256,4096,1536,4096,ck,0,0,53.8425,a8w8_blockscale_1x128x128_256x128x128x128_16x16_32x32_2x2_8x32x1_8x32x1_1x32x1x8_8_1x1_intrawave_v3,952.32,659.35,0.0
gfx950,256,8192,1536,4096,ck,0,0,92.8961,a8w8_blockscale_1x128x128_256x128x128x128_16x16_32x32_2x2_8x32x1_8x32x1_1x32x1x8_8_1x1_intrawave_v3,1097.43,692.89,0.0
gfx950,256,16384,1536,4096,cktile,11,0,153.7171,a8w8_blockscale_cktile_192x256x128_4x2x1_16x16x128_intrawave_0x1x0_1,1337.88,803.07,0.0
gfx950,256,16,2560,4096,ck,8,0,13.4887,a8w8_blockscale_1x128x128_256x16x64x256_16x16_16x16_1x1_16x16x1_16x16x1_1x16x1x16_4_1x1_intrawave_v1,1.55,778.06,0.0
gfx950,256,32,2560,4096,ck,8,0,13.7977,a8w8_blockscale_1x128x128_256x16x64x256_16x16_16x16_1x1_16x16x1_16x16x1_1x16x1x16_4_1x1_intrawave_v1,36.48,775.99,0.0
gfx950,256,48,2560,4096,ck,8,0,13.8918,a8w8_blockscale_1x128x128_256x16x64x256_16x16_16x16_1x1_16x16x1_16x16x1_1x16x1x16_4_1x1_intrawave_v1,60.39,781.35,0.0
gfx950,256,64,2560,4096,ck,8,0,13.6447,a8w8_blockscale_1x128x128_256x16x64x256_16x16_16x16_1x1_16x16x1_16x16x1_1x16x1x16_4_1x1_intrawave_v1,86.07,806.31,0.0
gfx950,256,768,2560,4096,ck,2,0,25.9198,a8w8_blockscale_1x128x128_256x64x128x128_16x16_32x32_1x2_8x32x1_8x32x1_1x32x1x8_8_1x1_intrawave_v3,621.38,677.62,0.0
gfx950,256,832,2560,4096,ck,2,0,32.0203,a8w8_blockscale_1x128x128_256x64x128x128_16x16_32x32_1x2_8x32x1_8x32x1_1x32x1x8_8_1x1_intrawave_v3,535.09,562.62,0.0
gfx950,256,864,2560,4096,ck,2,0,32.4532,a8w8_blockscale_1x128x128_256x64x128x128_16x16_32x32_1x2_8x32x1_8x32x1_1x32x1x8_8_1x1_intrawave_v3,538.94,559.94,0.0
gfx950,256,896,2560,4096,ck,2,0,32.484,a8w8_blockscale_1x128x128_256x64x128x128_16x16_32x32_1x2_8x32x1_8x32x1_1x32x1x8_8_1x1_intrawave_v3,558.44,568.21,0.0
gfx950,256,928,2560,4096,ck,0,0,32.3089,a8w8_blockscale_1x128x128_256x128x128x128_16x16_32x32_2x2_8x32x1_8x32x1_1x32x1x8_8_1x1_intrawave_v3,583.54,580.98,0.0
gfx950,256,960,2560,4096,ck,0,0,32.3746,a8w8_blockscale_1x128x128_256x128x128x128_16x16_32x32_2x2_8x32x1_8x32x1_1x32x1x8_8_1x1_intrawave_v3,602.43,588.63,0.0
gfx950,256,992,2560,4096,ck,0,0,32.9496,a8w8_blockscale_1x128x128_256x128x128x128_16x16_32x32_2x2_8x32x1_8x32x1_1x32x1x8_8_1x1_intrawave_v3,612.29,587.31,0.0
gfx950,256,1024,2560,4096,ck,0,0,33.0949,a8w8_blockscale_1x128x128_256x128x128x128_16x16_32x32_2x2_8x32x1_8x32x1_1x32x1x8_8_1x1_intrawave_v3,629.88,593.64,0.0
gfx950,256,1216,2560,4096,ck,0,0,33.5298,a8w8_blockscale_1x128x128_256x128x128x128_16x16_32x32_2x2_8x32x1_8x32x1_1x32x1x8_8_1x1_intrawave_v3,749.3,642.01,0.0
gfx950,256,1280,2560,4096,ck,0,0,32.9542,a8w8_blockscale_1x128x128_256x128x128x128_16x16_32x32_2x2_8x32x1_8x32x1_1x32x1x8_8_1x1_intrawave_v3,814.57,676.16,0.0
gfx950,256,1536,2560,4096,ck,0,0,34.5836,a8w8_blockscale_1x128x128_256x128x128x128_16x16_32x32_2x2_8x32x1_8x32x1_1x32x1x8_8_1x1_intrawave_v3,919.91,707.46,0.0
gfx950,256,2048,2560,4096,ck,2,0,50.9098,a8w8_blockscale_1x128x128_256x64x128x128_16x16_32x32_1x2_8x32x1_8x32x1_1x32x1x8_8_1x1_intrawave_v3,835.82,573.27,0.0
gfx950,256,4096,2560,4096,cktile,11,0,61.9183,a8w8_blockscale_cktile_192x256x128_4x2x1_16x16x128_intrawave_0x1x0_1,1380.19,775.88,0.0
gfx950,256,8192,2560,4096,cktile,11,0,117.5766,a8w8_blockscale_cktile_192x256x128_4x2x1_16x16x128_intrawave_0x1x0_1,1445.11,724.24,0.0
gfx950,256,16384,2560,4096,cktile,11,0,226.3441,a8w8_blockscale_cktile_192x256x128_4x2x1_16x16x128_intrawave_0x1x0_1,1514.32,711.8,0.0
gfx950,256,16,4096,128,ck,8,0,2.8465,a8w8_blockscale_1x128x128_256x16x64x256_16x16_16x16_1x1_16x16x1_16x16x1_1x16x1x16_4_1x1_intrawave_v1,0.37,187.11,0.0
gfx950,256,32,4096,128,ck,11,0,3.0103,a8w8_blockscale_1x128x128_256x32x64x128_16x16_16x16_2x1_8x32x1_8x32x1_1x32x1x8_8_2x1_intrawave_v1,8.36,240.5,0.0
gfx950,256,48,4096,128,cktile,7,0,3.0027,a8w8_blockscale_cktile_32x128x128_1x4x1_16x16x64_intrawave_0x1x0_2,13.97,285.44,0.0
gfx950,256,64,4096,128,ck,8,0,3.1557,a8w8_blockscale_1x128x128_256x16x64x256_16x16_16x16_1x1_16x16x1_16x16x1_1x16x1x16_4_1x1_intrawave_v1,18.61,313.78,0.0
gfx950,256,768,4096,128,cktile,6,0,5.9999,a8w8_blockscale_cktile_32x128x128_1x4x1_16x16x64_intrawave_0x1x0_1,134.22,1152.36,0.0
gfx950,256,832,4096,128,cktile,7,0,6.809,a8w8_blockscale_cktile_32x128x128_1x4x1_16x16x64_intrawave_0x1x0_2,125.82,1075.3,0.0
gfx950,256,864,4096,128,cktile,10,0,6.0445,a8w8_blockscale_cktile_128x128x128_2x2x1_16x16x128_intrawave_0x1x0_2,144.68,1234.7,0.0
gfx950,256,896,4096,128,cktile,7,0,6.6084,a8w8_blockscale_cktile_32x128x128_1x4x1_16x16x64_intrawave_0x1x0_2,137.25,1168.37,0.0
gfx950,256,928,4096,128,cktile,7,0,6.2697,a8w8_blockscale_cktile_32x128x128_1x4x1_16x16x64_intrawave_0x1x0_2,150.35,1276.61,0.0
gfx950,256,960,4096,128,cktile,4,0,6.3954,a8w8_blockscale_cktile_32x128x128_1x4x1_16x16x128_intrawave_0x1x0_1,152.48,1291.85,0.0
gfx950,256,992,4096,128,cktile,10,0,6.2668,a8w8_blockscale_cktile_128x128x128_2x2x1_16x16x128_intrawave_0x1x0_2,160.96,1360.84,0.0
gfx950,256,1024,4096,128,cktile,4,0,6.5738,a8w8_blockscale_cktile_32x128x128_1x4x1_16x16x128_intrawave_0x1x0_1,158.55,1337.79,0.0
gfx950,256,1216,4096,128,cktile,7,0,7.388,a8w8_blockscale_cktile_32x128x128_1x4x1_16x16x64_intrawave_0x1x0_2,170.03,1420.09,0.0
gfx950,256,1280,4096,128,cktile,7,0,7.3956,a8w8_blockscale_cktile_32x128x128_1x4x1_16x16x64_intrawave_0x1x0_2,181.48,1510.88,0.0
gfx950,256,1536,4096,128,cktile,10,0,7.9103,a8w8_blockscale_cktile_128x128x128_2x2x1_16x16x128_intrawave_0x1x0_2,201.09,1661.85,0.0
gfx950,256,2048,4096,128,cktile,10,0,8.5809,a8w8_blockscale_cktile_128x128x128_2x2x1_16x16x128_intrawave_0x1x0_2,247.94,2028.41,0.0
gfx950,256,4096,4096,128,cktile,10,0,12.0446,a8w8_blockscale_cktile_128x128x128_2x2x1_16x16x128_intrawave_0x1x0_2,354.76,2858.4,0.0
gfx950,256,8192,4096,128,cktile,10,0,21.4001,a8w8_blockscale_cktile_128x128x128_2x2x1_16x16x128_intrawave_0x1x0_2,396.99,3174.42,0.0
gfx950,256,16384,4096,128,cktile,10,0,39.0112,a8w8_blockscale_cktile_128x128x128_2x2x1_16x16x128_intrawave_0x1x0_2,439.31,3499.16,0.0
gfx950,256,256,256,4096,ck,8,0,11.6735,a8w8_blockscale_1x128x128_256x16x64x256_16x16_16x16_1x1_16x16x1_16x16x1_1x16x1x16_4_1x1_intrawave_v1,45.99,190.88,0.0
gfx950,256,256,1024,4096,ck,8,0,13.1167,a8w8_blockscale_1x128x128_256x16x64x256_16x16_16x16_1x1_16x16x1_16x16x1_1x16x1x16_4_1x1_intrawave_v1,163.72,439.68,0.0
gfx950,256,256,1536,4096,ck,18,0,16.0602,a8w8_blockscale_1x128x128_256x64x64x256_16x16_32x32_1x1_16x16x1_16x16x1_1x32x1x8_8_1x1_intrawave_v1,200.57,506.0,0.0
gfx950,256,256,2560,4096,ck,18,0,16.2721,a8w8_blockscale_1x128x128_256x64x64x256_16x16_32x32_1x1_16x16x1_16x16x1_1x32x1x8_8_1x1_intrawave_v1,329.93,789.39,0.0
gfx950,256,256,4096,128,cktile,7,0,3.9178,a8w8_blockscale_cktile_32x128x128_1x4x1_16x16x64_intrawave_0x1x0_2,68.52,677.47,0.0
gfx942,304,16,256,4096,ck,8,3,13.1428,a8w8_blockscale_1x128x128_256x16x64x256_16x16_16x16_1x1_16x16x1_16x16x1_1x16x1x16_4_1x1_intrawave_v1,2.55,85.39,0.0
gfx942,304,32,256,4096,ck,8,1,13.4618,a8w8_blockscale_1x128x128_256x16x64x256_16x16_16x16_1x1_16x16x1_16x16x1_1x16x1x16_4_1x1_intrawave_v1,4.99,88.85,0.0
gfx942,304,48,256,4096,ck,8,3,13.4496,a8w8_blockscale_1x128x128_256x16x64x256_16x16_16x16_1x1_16x16x1_16x16x1_1x16x1x16_4_1x1_intrawave_v1,7.48,94.41,0.0
gfx942,304,64,256,4096,ck,8,1,13.473,a8w8_blockscale_1x128x128_256x16x64x256_16x16_16x16_1x1_16x16x1_16x16x1_1x16x1x16_4_1x1_intrawave_v1,9.96,99.72,0.0
gfx942,304,80,256,4096,ck,8,2,13.4791,a8w8_blockscale_1x128x128_256x16x64x256_16x16_16x16_1x1_16x16x1_16x16x1_1x16x1x16_4_1x1_intrawave_v1,12.45,105.14,0.0
gfx942,304,96,256,4096,ck,8,3,13.4966,a8w8_blockscale_1x128x128_256x16x64x256_16x16_16x16_1x1_16x16x1_16x16x1_1x16x1x16_4_1x1_intrawave_v1,14.92,110.47,0.0
gfx942,304,112,256,4096,ck,8,1,13.521,a8w8_blockscale_1x128x128_256x16x64x256_16x16_16x16_1x1_16x16x1_16x16x1_1x16x1x16_4_1x1_intrawave_v1,17.37,115.72,0.0
gfx942,304,128,256,4096,ck,8,0,13.5067,a8w8_blockscale_1x128x128_256x16x64x256_16x16_16x16_1x1_16x16x1_16x16x1_1x16x1x16_4_1x1_intrawave_v1,19.87,121.3,0.0
gfx942,304,144,256,4096,ck,8,3,13.5166,a8w8_blockscale_1x128x128_256x16x64x256_16x16_16x16_1x1_16x16x1_16x16x1_1x16x1x16_4_1x1_intrawave_v1,22.34,126.67,0.0
gfx942,304,160,256,4096,ck,8,0,13.5426,a8w8_blockscale_1x128x128_256x16x64x256_16x16_16x16_1x1_16x16x1_16x16x1_1x16x1x16_4_1x1_intrawave_v1,24.78,131.87,0.0
gfx942,304,176,256,4096,ck,8,0,13.5391,a8w8_blockscale_1x128x128_256x16x64x256_16x16_16x16_1x1_16x16x1_16x16x1_1x16x1x16_4_1x1_intrawave_v1,27.26,137.35,0.0
gfx942,304,192,256,4096,ck,8,1,13.5525,a8w8_blockscale_1x128x128_256x16x64x256_16x16_16x16_1x1_16x16x1_16x16x1_1x16x1x16_4_1x1_intrawave_v1,29.71,142.65,0.0
gfx942,304,208,256,4096,ck,8,3,13.561,a8w8_blockscale_1x128x128_256x16x64x256_16x16_16x16_1x1_16x16x1_16x16x1_1x16x1x16_4_1x1_intrawave_v1,32.17,148.0,0.0
gfx942,304,224,256,4096,ck,8,3,13.5482,a8w8_blockscale_1x128x128_256x16x64x256_16x16_16x16_1x1_16x16x1_16x16x1_1x16x1x16_4_1x1_intrawave_v1,34.67,153.58,0.0
gfx942,304,240,256,4096,ck,8,2,13.5415,a8w8_blockscale_1x128x128_256x16x64x256_16x16_16x16_1x1_16x16x1_16x16x1_1x16x1x16_4_1x1_intrawave_v1,37.17,159.1,0.0
gfx942,304,256,256,4096,ck,8,0,13.5506,a8w8_blockscale_1x128x128_256x16x64x256_16x16_16x16_1x1_16x16x1_16x16x1_1x16x1x16_4_1x1_intrawave_v1,39.62,164.44,0.0
gfx942,304,288,256,4096,ck,8,3,13.601,a8w8_blockscale_1x128x128_256x16x64x256_16x16_16x16_1x1_16x16x1_16x16x1_1x16x1x16_4_1x1_intrawave_v1,44.41,174.67,0.0
gfx942,304,320,256,4096,ck,8,3,13.6159,a8w8_blockscale_1x128x128_256x16x64x256_16x16_16x16_1x1_16x16x1_16x16x1_1x16x1x16_4_1x1_intrawave_v1,49.29,185.31,0.0
gfx942,304,352,256,4096,ck,8,1,13.8138,a8w8_blockscale_1x128x128_256x16x64x256_16x16_16x16_1x1_16x16x1_16x16x1_1x16x1x16_4_1x1_intrawave_v1,53.44,193.33,0.0
gfx942,304,384,256,4096,ck,8,3,13.8597,a8w8_blockscale_1x128x128_256x16x64x256_16x16_16x16_1x1_16x16x1_16x16x1_1x16x1x16_4_1x1_intrawave_v1,58.1,203.33,0.0
gfx942,304,416,256,4096,ck,8,0,13.9879,a8w8_blockscale_1x128x128_256x16x64x256_16x16_16x16_1x1_16x16x1_16x16x1_1x16x1x16_4_1x1_intrawave_v1,62.37,212.0,0.0
gfx942,304,448,256,4096,ck,8,1,14.0849,a8w8_blockscale_1x128x128_256x16x64x256_16x16_16x16_1x1_16x16x1_16x16x1_1x16x1x16_4_1x1_intrawave_v1,66.7,221.01,0.0
gfx942,304,480,256,4096,ck,8,1,14.0661,a8w8_blockscale_1x128x128_256x16x64x256_16x16_16x16_1x1_16x16x1_16x16x1_1x16x1x16_4_1x1_intrawave_v1,71.56,231.79,0.0
gfx942,304,512,256,4096,ck,8,1,14.0863,a8w8_blockscale_1x128x128_256x16x64x256_16x16_16x16_1x1_16x16x1_16x16x1_1x16x1x16_4_1x1_intrawave_v1,76.23,241.93,0.0
gfx942,304,544,256,4096,ck,8,0,14.2194,a8w8_blockscale_1x128x128_256x16x64x256_16x16_16x16_1x1_16x16x1_16x16x1_1x16x1x16_4_1x1_intrawave_v1,80.23,250.03,0.0
gfx942,304,576,256,4096,ck,8,2,14.2568,a8w8_blockscale_1x128x128_256x16x64x256_16x16_16x16_1x1_16x16x1_16x16x1_1x16x1x16_4_1x1_intrawave_v1,84.73,259.72,0.0
gfx942,304,608,256,4096,ck,8,2,14.276,a8w8_blockscale_1x128x128_256x16x64x256_16x16_16x16_1x1_16x16x1_16x16x1_1x16x1x16_4_1x1_intrawave_v1,89.32,269.7,0.0
gfx942,304,640,256,4096,ck,8,3,14.2618,a8w8_blockscale_1x128x128_256x16x64x256_16x16_16x16_1x1_16x16x1_16x16x1_1x16x1x16_4_1x1_intrawave_v1,94.11,280.31,0.0
gfx942,304,672,256,4096,ck,8,3,14.2911,a8w8_blockscale_1x128x128_256x16x64x256_16x16_16x16_1x1_16x16x1_16x16x1_1x16x1x16_4_1x1_intrawave_v1,98.61,290.05,0.0
gfx942,304,704,256,4096,ck,8,1,14.3095,a8w8_blockscale_1x128x128_256x16x64x256_16x16_16x16_1x1_16x16x1_16x16x1_1x16x1x16_4_1x1_intrawave_v1,103.18,299.98,0.0
gfx942,304,736,256,4096,ck,8,2,14.3036,a8w8_blockscale_1x128x128_256x16x64x256_16x16_16x16_1x1_16x16x1_16x16x1_1x16x1x16_4_1x1_intrawave_v1,107.91,310.42,0.0
gfx942,304,768,256,4096,ck,8,1,14.3479,a8w8_blockscale_1x128x128_256x16x64x256_16x16_16x16_1x1_16x16x1_16x16x1_1x16x1x16_4_1x1_intrawave_v1,112.25,319.73,0.0
gfx942,304,800,256,4096,ck,8,3,14.2958,a8w8_blockscale_1x128x128_256x16x64x256_16x16_16x16_1x1_16x16x1_16x16x1_1x16x1x16_4_1x1_intrawave_v1,117.36,331.21,0.0
gfx942,304,832,256,4096,ck,8,1,14.3764,a8w8_blockscale_1x128x128_256x16x64x256_16x16_16x16_1x1_16x16x1_16x16x1_1x16x1x16_4_1x1_intrawave_v1,121.37,339.61,0.0
gfx942,304,864,256,4096,ck,8,0,14.3934,a8w8_blockscale_1x128x128_256x16x64x256_16x16_16x16_1x1_16x16x1_16x16x1_1x16x1x16_4_1x1_intrawave_v1,125.89,349.46,0.0
gfx942,304,896,256,4096,ck,8,3,14.4335,a8w8_blockscale_1x128x128_256x16x64x256_16x16_16x16_1x1_16x16x1_16x16x1_1x16x1x16_4_1x1_intrawave_v1,130.19,358.7,0.0
gfx942,304,928,256,4096,ck,8,0,14.4157,a8w8_blockscale_1x128x128_256x16x64x256_16x16_16x16_1x1_16x16x1_16x16x1_1x16x1x16_4_1x1_intrawave_v1,135.0,369.38,0.0
gfx942,304,960,256,4096,ck,8,0,14.4249,a8w8_blockscale_1x128x128_256x16x64x256_16x16_16x16_1x1_16x16x1_16x16x1_1x16x1x16_4_1x1_intrawave_v1,139.57,379.36,0.0
gfx942,304,992,256,4096,ck,8,2,14.4454,a8w8_blockscale_1x128x128_256x16x64x256_16x16_16x16_1x1_16x16x1_16x16x1_1x16x1x16_4_1x1_intrawave_v1,144.02,389.03,0.0
gfx942,304,1024,256,4096,ck,8,2,14.4314,a8w8_blockscale_1x128x128_256x16x64x256_16x16_16x16_1x1_16x16x1_16x16x1_1x16x1x16_4_1x1_intrawave_v1,148.81,399.63,0.0
gfx942,304,1088,256,4096,ck,8,1,14.5404,a8w8_blockscale_1x128x128_256x16x64x256_16x16_16x16_1x1_16x16x1_16x16x1_1x16x1x16_4_1x1_intrawave_v1,156.92,416.91,0.0
gfx942,304,1152,256,4096,ck,8,2,14.5621,a8w8_blockscale_1x128x128_256x16x64x256_16x16_16x16_1x1_16x16x1_16x16x1_1x16x1x16_4_1x1_intrawave_v1,165.9,436.54,0.0
gfx942,304,1216,256,4096,ck,8,2,14.6616,a8w8_blockscale_1x128x128_256x16x64x256_16x16_16x16_1x1_16x16x1_16x16x1_1x16x1x16_4_1x1_intrawave_v1,173.93,453.7,0.0
gfx942,304,1280,256,4096,ck,18,3,18.1718,a8w8_blockscale_1x128x128_256x64x64x256_16x16_32x32_1x1_16x16x1_16x16x1_1x32x1x8_8_1x1_intrawave_v1,147.72,382.29,0.0
gfx942,304,1344,256,4096,ck,18,3,18.2208,a8w8_blockscale_1x128x128_256x64x64x256_16x16_32x32_1x1_16x16x1_16x16x1_1x32x1x8_8_1x1_intrawave_v1,154.69,397.44,0.0
gfx942,304,1408,256,4096,ck,18,1,18.1539,a8w8_blockscale_1x128x128_256x64x64x256_16x16_32x32_1x1_16x16x1_16x16x1_1x32x1x8_8_1x1_intrawave_v1,162.65,415.15,0.0
gfx942,304,1472,256,4096,ck,18,3,18.203,a8w8_blockscale_1x128x128_256x64x64x256_16x16_32x32_1x1_16x16x1_16x16x1_1x32x1x8_8_1x1_intrawave_v1,169.59,430.23,0.0
gfx942,304,1536,256,4096,ck,18,0,18.222,a8w8_blockscale_1x128x128_256x64x64x256_16x16_32x32_1x1_16x16x1_16x16x1_1x32x1x8_8_1x1_intrawave_v1,176.78,445.97,0.0
gfx942,304,1600,256,4096,ck,18,1,18.2604,a8w8_blockscale_1x128x128_256x64x64x256_16x16_32x32_1x1_16x16x1_16x16x1_1x32x1x8_8_1x1_intrawave_v1,183.76,461.18,0.0
gfx942,304,1664,256,4096,ck,18,0,18.4377,a8w8_blockscale_1x128x128_256x64x64x256_16x16_32x32_1x1_16x16x1_16x16x1_1x32x1x8_8_1x1_intrawave_v1,189.27,472.74,0.0
gfx942,304,1728,256,4096,ck,18,1,18.4658,a8w8_blockscale_1x128x128_256x64x64x256_16x16_32x32_1x1_16x16x1_16x16x1_1x32x1x8_8_1x1_intrawave_v1,196.25,487.99,0.0
gfx942,304,1792,256,4096,ck,18,2,18.4609,a8w8_blockscale_1x128x128_256x64x64x256_16x16_32x32_1x1_16x16x1_16x16x1_1x32x1x8_8_1x1_intrawave_v1,203.57,504.1,0.0
gfx942,304,1856,256,4096,ck,18,1,18.4925,a8w8_blockscale_1x128x128_256x64x64x256_16x16_32x32_1x1_16x16x1_16x16x1_1x32x1x8_8_1x1_intrawave_v1,210.48,519.18,0.0
gfx942,304,1920,256,4096,ck,18,1,18.6205,a8w8_blockscale_1x128x128_256x64x64x256_16x16_32x32_1x1_16x16x1_16x16x1_1x32x1x8_8_1x1_intrawave_v1,216.24,531.45,0.0
gfx942,304,1984,256,4096,ck,18,2,18.5892,a8w8_blockscale_1x128x128_256x64x64x256_16x16_32x32_1x1_16x16x1_16x16x1_1x32x1x8_8_1x1_intrawave_v1,223.83,548.21,0.0
gfx942,304,2048,256,4096,ck,18,1,18.3072,a8w8_blockscale_1x128x128_256x64x64x256_16x16_32x32_1x1_16x16x1_16x16x1_1x32x1x8_8_1x1_intrawave_v1,234.61,572.77,0.0
gfx942,304,2112,256,4096,ck,18,3,18.3061,a8w8_blockscale_1x128x128_256x64x64x256_16x16_32x32_1x1_16x16x1_16x16x1_1x32x1x8_8_1x1_intrawave_v1,241.95,588.91,0.0
gfx942,304,2176,256,4096,ck,18,1,18.5415,a8w8_blockscale_1x128x128_256x64x64x256_16x16_32x32_1x1_16x16x1_16x16x1_1x32x1x8_8_1x1_intrawave_v1,246.12,597.34,0.0
gfx942,304,2240,256,4096,ck,18,2,18.4782,a8w8_blockscale_1x128x128_256x64x64x256_16x16_32x32_1x1_16x16x1_16x16x1_1x32x1x8_8_1x1_intrawave_v1,254.23,615.35,0.0
gfx942,304,2304,256,4096,ck,18,1,18.7653,a8w8_blockscale_1x128x128_256x64x64x256_16x16_32x32_1x1_16x16x1_16x16x1_1x32x1x8_8_1x1_intrawave_v1,257.49,621.65,0.0
gfx942,304,2432,256,4096,ck,18,3,18.4048,a8w8_blockscale_1x128x128_256x64x64x256_16x16_32x32_1x1_16x16x1_16x16x1_1x32x1x8_8_1x1_intrawave_v1,277.12,665.87,0.0
gfx942,304,2496,256,4096,ck,18,1,18.5212,a8w8_blockscale_1x128x128_256x64x64x256_16x16_32x32_1x1_16x16x1_16x16x1_1x32x1x8_8_1x1_intrawave_v1,282.62,677.61,0.0
gfx942,304,2560,256,4096,ck,18,1,18.466,a8w8_blockscale_1x128x128_256x64x64x256_16x16_32x32_1x1_16x16x1_16x16x1_1x32x1x8_8_1x1_intrawave_v1,290.73,695.61,0.0
gfx942,304,2624,256,4096,ck,18,0,18.5283,a8w8_blockscale_1x128x128_256x64x64x256_16x16_32x32_1x1_16x16x1_16x16x1_1x32x1x8_8_1x1_intrawave_v1,297.0,709.18,0.0
gfx942,304,2688,256,4096,ck,18,0,18.5716,a8w8_blockscale_1x128x128_256x64x64x256_16x16_32x32_1x1_16x16x1_16x16x1_1x32x1x8_8_1x1_intrawave_v1,303.54,723.41,0.0
gfx942,304,2752,256,4096,ck,18,0,19.3913,a8w8_blockscale_1x128x128_256x64x64x256_16x16_32x32_1x1_16x16x1_16x16x1_1x32x1x8_8_1x1_intrawave_v1,297.63,708.04,0.0
gfx942,304,2816,256,4096,ck,18,2,18.7187,a8w8_blockscale_1x128x128_256x64x64x256_16x16_32x32_1x1_16x16x1_16x16x1_1x32x1x8_8_1x1_intrawave_v1,315.49,749.23,0.0
gfx942,304,2880,256,4096,ck,18,0,18.6644,a8w8_blockscale_1x128x128_256x64x64x256_16x16_32x32_1x1_16x16x1_16x16x1_1x32x1x8_8_1x1_intrawave_v1,323.6,767.22,0.0
gfx942,304,2944,256,4096,ck,18,3,19.1216,a8w8_blockscale_1x128x128_256x64x64x256_16x16_32x32_1x1_16x16x1_16x16x1_1x32x1x8_8_1x1_intrawave_v1,322.88,764.29,0.0
gfx942,304,3008,256,4096,ck,18,1,19.3957,a8w8_blockscale_1x128x128_256x64x64x256_16x16_32x32_1x1_16x16x1_16x16x1_1x32x1x8_8_1x1_intrawave_v1,325.24,768.7,0.0
gfx942,304,3072,256,4096,ck,18,3,18.8231,a8w8_blockscale_1x128x128_256x64x64x256_16x16_32x32_1x1_16x16x1_16x16x1_1x32x1x8_8_1x1_intrawave_v1,342.26,807.75,0.0
gfx942,304,3136,256,4096,ck,18,2,18.9374,a8w8_blockscale_1x128x128_256x64x64x256_16x16_32x32_1x1_16x16x1_16x16x1_1x32x1x8_8_1x1_intrawave_v1,347.28,818.45,0.0
gfx942,304,3200,256,4096,ck,18,2,19.0072,a8w8_blockscale_1x128x128_256x64x64x256_16x16_32x32_1x1_16x16x1_16x16x1_1x32x1x8_8_1x1_intrawave_v1,353.07,830.96,0.0
gfx942,304,3264,256,4096,ck,18,3,20.0643,a8w8_blockscale_1x128x128_256x64x64x256_16x16_32x32_1x1_16x16x1_16x16x1_1x32x1x8_8_1x1_intrawave_v1,341.16,801.88,0.0
gfx942,304,3328,256,4096,ck,18,3,19.257,a8w8_blockscale_1x128x128_256x64x64x256_16x16_32x32_1x1_16x16x1_16x16x1_1x32x1x8_8_1x1_intrawave_v1,362.43,850.81,0.0
gfx942,304,3392,256,4096,ck,18,2,19.5132,a8w8_blockscale_1x128x128_256x64x64x256_16x16_32x32_1x1_16x16x1_16x16x1_1x32x1x8_8_1x1_intrawave_v1,364.55,854.75,0.0
gfx942,304,3456,256,4096,ck,18,1,20.1352,a8w8_blockscale_1x128x128_256x64x64x256_16x16_32x32_1x1_16x16x1_16x16x1_1x32x1x8_8_1x1_intrawave_v1,359.95,842.99,0.0
gfx942,304,3520,256,4096,ck,18,0,20.2762,a8w8_blockscale_1x128x128_256x64x64x256_16x16_32x32_1x1_16x16x1_16x16x1_1x32x1x8_8_1x1_intrawave_v1,364.07,851.68,0.0
gfx942,304,3584,256,4096,ck,18,0,20.3556,a8w8_blockscale_1x128x128_256x64x64x256_16x16_32x32_1x1_16x16x1_16x16x1_1x32x1x8_8_1x1_intrawave_v1,369.24,862.84,0.0
gfx942,304,3648,256,4096,ck,18,1,21.1697,a8w8_blockscale_1x128x128_256x64x64x256_16x16_32x32_1x1_16x16x1_16x16x1_1x32x1x8_8_1x1_intrawave_v1,361.38,843.59,0.0
gfx942,304,3712,256,4096,ck,18,1,21.1423,a8w8_blockscale_1x128x128_256x64x64x256_16x16_32x32_1x1_16x16x1_16x16x1_1x32x1x8_8_1x1_intrawave_v1,368.2,858.63,0.0
gfx942,304,3776,256,4096,ck,18,3,21.4011,a8w8_blockscale_1x128x128_256x64x64x256_16x16_32x32_1x1_16x16x1_16x16x1_1x32x1x8_8_1x1_intrawave_v1,370.02,862.03,0.0
gfx942,304,3840,256,4096,ck,18,3,21.4055,a8w8_blockscale_1x128x128_256x64x64x256_16x16_32x32_1x1_16x16x1_16x16x1_1x32x1x8_8_1x1_intrawave_v1,376.21,875.63,0.0
gfx942,304,3904,256,4096,ck,18,2,22.6769,a8w8_blockscale_1x128x128_256x64x64x256_16x16_32x32_1x1_16x16x1_16x16x1_1x32x1x8_8_1x1_intrawave_v1,361.04,839.54,0.0
gfx942,304,3968,256,4096,ck,18,3,21.3592,a8w8_blockscale_1x128x128_256x64x64x256_16x16_32x32_1x1_16x16x1_16x16x1_1x32x1x8_8_1x1_intrawave_v1,389.6,905.14,0.0
gfx942,304,4032,256,4096,ck,18,0,22.4867,a8w8_blockscale_1x128x128_256x64x64x256_16x16_32x32_1x1_16x16x1_16x16x1_1x32x1x8_8_1x1_intrawave_v1,376.03,872.87,0.0
gfx942,304,4096,256,4096,ck,18,2,22.345,a8w8_blockscale_1x128x128_256x64x64x256_16x16_32x32_1x1_16x16x1_16x16x1_1x32x1x8_8_1x1_intrawave_v1,384.42,891.61,0.0
gfx942,304,4224,256,4096,ck,18,3,22.7105,a8w8_blockscale_1x128x128_256x64x64x256_16x16_32x32_1x1_16x16x1_16x16x1_1x32x1x8_8_1x1_intrawave_v1,390.06,903.23,0.0
gfx942,304,4352,256,4096,ck,18,3,23.2356,a8w8_blockscale_1x128x128_256x64x64x256_16x16_32x32_1x1_16x16x1_16x16x1_1x32x1x8_8_1x1_intrawave_v1,392.79,908.2,0.0
gfx942,304,4480,256,4096,ck,18,0,25.1274,a8w8_blockscale_1x128x128_256x64x64x256_16x16_32x32_1x1_16x16x1_16x16x1_1x32x1x8_8_1x1_intrawave_v1,373.9,863.3,0.0
gfx942,304,4608,256,4096,ck,18,3,23.6465,a8w8_blockscale_1x128x128_256x64x64x256_16x16_32x32_1x1_16x16x1_16x16x1_1x32x1x8_8_1x1_intrawave_v1,408.67,942.31,0.0
gfx942,304,4736,256,4096,ck,18,0,23.9955,a8w8_blockscale_1x128x128_256x64x64x256_16x16_32x32_1x1_16x16x1_16x16x1_1x32x1x8_8_1x1_intrawave_v1,413.92,953.18,0.0
gfx942,304,4864,256,4096,ck,18,1,25.163,a8w8_blockscale_1x128x128_256x64x64x256_16x16_32x32_1x1_16x16x1_16x16x1_1x32x1x8_8_1x1_intrawave_v1,405.38,932.4,0.0
gfx942,304,4992,256,4096,ck,3,3,34.4829,a8w8_blockscale_1x128x128_256x64x64x128_16x16_32x32_1x1_8x32x1_8x32x1_1x32x1x8_8_1x1_intrawave_v3,303.6,697.5,0.0
gfx942,304,5120,256,4096,ck,3,2,32.9228,a8w8_blockscale_1x128x128_256x64x64x128_16x16_32x32_1x1_8x32x1_8x32x1_1x32x1x8_8_1x1_intrawave_v3,326.14,748.46,0.0
gfx942,304,5248,256,4096,ck,3,1,35.1823,a8w8_blockscale_1x128x128_256x64x64x128_16x16_32x32_1x1_8x32x1_8x32x1_1x32x1x8_8_1x1_intrawave_v3,312.82,717.16,0.0
gfx942,304,5376,256,4096,ck,3,0,35.6321,a8w8_blockscale_1x128x128_256x64x64x128_16x16_32x32_1x1_8x32x1_8x32x1_1x32x1x8_8_1x1_intrawave_v3,316.41,724.66,0.0
gfx942,304,5504,256,4096,ck,3,3,35.7347,a8w8_blockscale_1x128x128_256x64x64x128_16x16_32x32_1x1_8x32x1_8x32x1_1x32x1x8_8_1x1_intrawave_v3,323.01,739.09,0.0
gfx942,304,5632,256,4096,ck,3,1,34.8899,a8w8_blockscale_1x128x128_256x64x64x128_16x16_32x32_1x1_8x32x1_8x32x1_1x32x1x8_8_1x1_intrawave_v3,338.53,773.89,0.0
gfx942,304,5760,256,4096,ck,3,3,39.7049,a8w8_blockscale_1x128x128_256x64x64x128_16x16_32x32_1x1_8x32x1_8x32x1_1x32x1x8_8_1x1_intrawave_v3,304.23,694.89,0.0
gfx942,304,5888,256,4096,ck,3,0,39.3106,a8w8_blockscale_1x128x128_256x64x64x128_16x16_32x32_1x1_8x32x1_8x32x1_1x32x1x8_8_1x1_intrawave_v3,314.11,716.87,0.0
gfx942,304,6016,256,4096,ck,3,3,40.2239,a8w8_blockscale_1x128x128_256x64x64x128_16x16_32x32_1x1_8x32x1_8x32x1_1x32x1x8_8_1x1_intrawave_v3,313.66,715.25,0.0
gfx942,304,6144,256,4096,ck,3,2,35.1204,a8w8_blockscale_1x128x128_256x64x64x128_16x16_32x32_1x1_8x32x1_8x32x1_1x32x1x8_8_1x1_intrawave_v3,366.88,835.99,0.0
gfx942,304,6272,256,4096,ck,3,0,39.3869,a8w8_blockscale_1x128x128_256x64x64x128_16x16_32x32_1x1_8x32x1_8x32x1_1x32x1x8_8_1x1_intrawave_v3,333.95,760.4,0.0
gfx942,304,6400,256,4096,ck,2,1,39.9716,a8w8_blockscale_1x128x128_256x64x128x128_16x16_32x32_1x2_8x32x1_8x32x1_1x32x1x8_8_1x1_intrawave_v3,335.78,764.04,0.0
gfx942,304,6528,256,4096,ck,2,3,40.1587,a8w8_blockscale_1x128x128_256x64x128x128_16x16_32x32_1x2_8x32x1_8x32x1_1x32x1x8_8_1x1_intrawave_v3,340.9,775.16,0.0
gfx942,304,6656,256,4096,ck,2,1,41.0524,a8w8_blockscale_1x128x128_256x64x128x128_16x16_32x32_1x2_8x32x1_8x32x1_1x32x1x8_8_1x1_intrawave_v3,340.02,772.66,0.0
gfx942,304,6784,256,4096,ck,18,2,40.5684,a8w8_blockscale_1x128x128_256x64x64x256_16x16_32x32_1x1_16x16x1_16x16x1_1x32x1x8_8_1x1_intrawave_v1,350.69,796.41,0.0
gfx942,304,6912,256,4096,ck,3,3,40.8594,a8w8_blockscale_1x128x128_256x64x64x128_16x16_32x32_1x1_8x32x1_8x32x1_1x32x1x8_8_1x1_intrawave_v3,354.77,805.18,0.0
gfx942,304,7040,256,4096,ck,18,0,41.1567,a8w8_blockscale_1x128x128_256x64x64x256_16x16_32x32_1x1_16x16x1_16x16x1_1x32x1x8_8_1x1_intrawave_v1,358.73,813.69,0.0
gfx942,304,7168,256,4096,ck,18,3,41.0991,a8w8_blockscale_1x128x128_256x64x64x256_16x16_32x32_1x1_16x16x1_16x16x1_1x32x1x8_8_1x1_intrawave_v1,365.76,829.18,0.0
gfx942,304,7296,256,4096,ck,18,1,41.703,a8w8_blockscale_1x128x128_256x64x64x256_16x16_32x32_1x1_16x16x1_16x16x1_1x32x1x8_8_1x1_intrawave_v1,366.9,831.32,0.0
gfx942,304,7424,256,4096,ck,2,0,41.4266,a8w8_blockscale_1x128x128_256x64x128x128_16x16_32x32_1x2_8x32x1_8x32x1_1x32x1x8_8_1x1_intrawave_v3,375.83,851.1,0.0
gfx942,304,7552,256,4096,ck,18,1,42.1775,a8w8_blockscale_1x128x128_256x64x64x256_16x16_32x32_1x1_16x16x1_16x16x1_1x32x1x8_8_1x1_intrawave_v1,375.5,849.94,0.0
gfx942,304,7680,256,4096,ck,2,2,41.4934,a8w8_blockscale_1x128x128_256x64x128x128_16x16_32x32_1x2_8x32x1_8x32x1_1x32x1x8_8_1x1_intrawave_v3,388.16,878.16,0.0
gfx942,304,7808,256,4096,ck,18,2,42.416,a8w8_blockscale_1x128x128_256x64x64x256_16x16_32x32_1x1_16x16x1_16x16x1_1x32x1x8_8_1x1_intrawave_v1,386.05,872.97,0.0
gfx942,304,7936,256,4096,ck,2,2,42.2852,a8w8_blockscale_1x128x128_256x64x128x128_16x16_32x32_1x2_8x32x1_8x32x1_1x32x1x8_8_1x1_intrawave_v3,393.59,889.62,0.0
gfx942,304,8064,256,4096,ck,2,0,42.987,a8w8_blockscale_1x128x128_256x64x128x128_16x16_32x32_1x2_8x32x1_8x32x1_1x32x1x8_8_1x1_intrawave_v3,393.41,888.81,0.0
gfx942,304,8192,256,4096,ck,2,1,43.0883,a8w8_blockscale_1x128x128_256x64x128x128_16x16_32x32_1x2_8x32x1_8x32x1_1x32x1x8_8_1x1_intrawave_v3,398.71,900.41,0.0
gfx942,304,8320,256,4096,ck,2,2,43.4752,a8w8_blockscale_1x128x128_256x64x128x128_16x16_32x32_1x2_8x32x1_8x32x1_1x32x1x8_8_1x1_intrawave_v3,401.34,905.97,0.0
gfx942,304,8704,256,4096,ck,2,3,43.6647,a8w8_blockscale_1x128x128_256x64x128x128_16x16_32x32_1x2_8x32x1_8x32x1_1x32x1x8_8_1x1_intrawave_v3,418.04,942.56,0.0
gfx942,304,8832,256,4096,ck,2,2,44.6399,a8w8_blockscale_1x128x128_256x64x128x128_16x16_32x32_1x2_8x32x1_8x32x1_1x32x1x8_8_1x1_intrawave_v3,414.92,935.18,0.0
gfx942,304,8960,256,4096,ck,2,2,45.0027,a8w8_blockscale_1x128x128_256x64x128x128_16x16_32x32_1x2_8x32x1_8x32x1_1x32x1x8_8_1x1_intrawave_v3,417.54,940.75,0.0
gfx942,304,9216,256,4096,ck,2,3,45.197,a8w8_blockscale_1x128x128_256x64x128x128_16x16_32x32_1x2_8x32x1_8x32x1_1x32x1x8_8_1x1_intrawave_v3,427.62,962.81,0.0
gfx942,304,9344,256,4096,ck,2,0,43.9442,a8w8_blockscale_1x128x128_256x64x128x128_16x16_32x32_1x2_8x32x1_8x32x1_1x32x1x8_8_1x1_intrawave_v3,445.92,1003.68,0.0
gfx942,304,9472,256,4096,ck,2,3,46.1648,a8w8_blockscale_1x128x128_256x64x128x128_16x16_32x32_1x2_8x32x1_8x32x1_1x32x1x8_8_1x1_intrawave_v3,430.29,968.17,0.0
gfx942,304,9856,256,4096,ck,2,1,56.7064,a8w8_blockscale_1x128x128_256x64x128x128_16x16_32x32_1x2_8x32x1_8x32x1_1x32x1x8_8_1x1_intrawave_v3,364.5,819.4,0.0
gfx942,304,9984,256,4096,ck,2,3,58.1793,a8w8_blockscale_1x128x128_256x64x128x128_16x16_32x32_1x2_8x32x1_8x32x1_1x32x1x8_8_1x1_intrawave_v3,359.89,808.79,0.0
gfx942,304,10112,256,4096,ck,2,1,58.1389,a8w8_blockscale_1x128x128_256x64x128x128_16x16_32x32_1x2_8x32x1_8x32x1_1x32x1x8_8_1x1_intrawave_v3,364.75,819.5,0.0
gfx942,304,10240,256,4096,ck,2,0,57.0205,a8w8_blockscale_1x128x128_256x64x128x128_16x16_32x32_1x2_8x32x1_8x32x1_1x32x1x8_8_1x1_intrawave_v3,376.62,845.91,0.0
gfx942,304,10624,256,4096,ck,0,1,59.8226,a8w8_blockscale_1x128x128_256x128x128x128_16x16_32x32_2x2_8x32x1_8x32x1_1x32x1x8_8_1x1_intrawave_v3,372.44,835.87,0.0
gfx942,304,10752,256,4096,ck,0,0,60.3712,a8w8_blockscale_1x128x128_256x128x128x128_16x16_32x32_2x2_8x32x1_8x32x1_1x32x1x8_8_1x1_intrawave_v3,373.5,838.05,0.0
gfx942,304,10880,256,4096,ck,0,1,59.8557,a8w8_blockscale_1x128x128_256x128x128x128_16x16_32x32_2x2_8x32x1_8x32x1_1x32x1x8_8_1x1_intrawave_v3,381.2,855.12,0.0
gfx942,304,11264,256,4096,ck,3,0,60.0645,a8w8_blockscale_1x128x128_256x64x64x128_16x16_32x32_1x1_8x32x1_8x32x1_1x32x1x8_8_1x1_intrawave_v3,393.28,881.6,0.0
gfx942,304,11904,256,4096,ck,0,3,61.2875,a8w8_blockscale_1x128x128_256x128x128x128_16x16_32x32_2x2_8x32x1_8x32x1_1x32x1x8_8_1x1_intrawave_v3,407.33,912.13,0.0
gfx942,304,12544,256,4096,ck,0,3,62.5198,a8w8_blockscale_1x128x128_256x128x128x128_16x16_32x32_2x2_8x32x1_8x32x1_1x32x1x8_8_1x1_intrawave_v3,420.77,941.32,0.0
gfx942,304,12800,256,4096,ck,0,3,62.7962,a8w8_blockscale_1x128x128_256x128x128x128_16x16_32x32_2x2_8x32x1_8x32x1_1x32x1x8_8_1x1_intrawave_v3,427.47,955.97,0.0
gfx942,304,13312,256,4096,ck,0,0,64.3351,a8w8_blockscale_1x128x128_256x128x128x128_16x16_32x32_2x2_8x32x1_8x32x1_1x32x1x8_8_1x1_intrawave_v3,433.94,969.77,0.0
gfx942,304,13824,256,4096,ck,0,3,64.4974,a8w8_blockscale_1x128x128_256x128x128x128_16x16_32x32_2x2_8x32x1_8x32x1_1x32x1x8_8_1x1_intrawave_v3,449.49,1003.91,0.0
gfx942,304,13952,256,4096,ck,0,0,65.0523,a8w8_blockscale_1x128x128_256x128x128x128_16x16_32x32_2x2_8x32x1_8x32x1_1x32x1x8_8_1x1_intrawave_v3,449.78,1004.41,0.0
gfx942,304,14208,256,4096,ck,0,3,65.837,a8w8_blockscale_1x128x128_256x128x128x128_16x16_32x32_2x2_8x32x1_8x32x1_1x32x1x8_8_1x1_intrawave_v3,452.58,1010.36,0.0
gfx942,304,16384,256,4096,ck,0,3,69.3918,a8w8_blockscale_1x128x128_256x128x128x128_16x16_32x32_2x2_8x32x1_8x32x1_1x32x1x8_8_1x1_intrawave_v3,495.16,1103.1,0.0
gfx942,304,16,1024,4096,ck,8,0,14.4769,a8w8_blockscale_1x128x128_256x16x64x256_16x16_16x16_1x1_16x16x1_16x16x1_1x16x1x16_4_1x1_intrawave_v1,9.27,296.51,0.0
gfx942,304,32,1024,4096,ck,8,0,14.4036,a8w8_blockscale_1x128x128_256x16x64x256_16x16_16x16_1x1_16x16x1_16x16x1_1x16x1x16_4_1x1_intrawave_v1,18.64,304.85,0.0
gfx942,304,48,1024,4096,ck,8,2,14.3574,a8w8_blockscale_1x128x128_256x16x64x256_16x16_16x16_1x1_16x16x1_16x16x1_1x16x1x16_4_1x1_intrawave_v1,28.04,312.68,0.0
gfx942,304,64,1024,4096,ck,8,1,14.3614,a8w8_blockscale_1x128x128_256x16x64x256_16x16_16x16_1x1_16x16x1_16x16x1_1x16x1x16_4_1x1_intrawave_v1,37.38,319.43,0.0
gfx942,304,80,1024,4096,ck,8,1,14.3301,a8w8_blockscale_1x128x128_256x16x64x256_16x16_16x16_1x1_16x16x1_16x16x1_1x16x1x16_4_1x1_intrawave_v1,46.83,326.99,0.0
gfx942,304,96,1024,4096,ck,8,0,14.2776,a8w8_blockscale_1x128x128_256x16x64x256_16x16_16x16_1x1_16x16x1_16x16x1_1x16x1x16_4_1x1_intrawave_v1,56.4,335.08,0.0
gfx942,304,112,1024,4096,ck,8,2,14.2649,a8w8_blockscale_1x128x128_256x16x64x256_16x16_16x16_1x1_16x16x1_16x16x1_1x16x1x16_4_1x1_intrawave_v1,65.86,342.27,0.0
gfx942,304,128,1024,4096,ck,8,3,14.2533,a8w8_blockscale_1x128x128_256x16x64x256_16x16_16x16_1x1_16x16x1_16x16x1_1x16x1x16_4_1x1_intrawave_v1,75.33,349.44,0.0
gfx942,304,144,1024,4096,ck,8,2,14.2968,a8w8_blockscale_1x128x128_256x16x64x256_16x16_16x16_1x1_16x16x1_16x16x1_1x16x1x16_4_1x1_intrawave_v1,84.49,355.26,0.0
gfx942,304,160,1024,4096,ck,8,2,14.2891,a8w8_blockscale_1x128x128_256x16x64x256_16x16_16x16_1x1_16x16x1_16x16x1_1x16x1x16_4_1x1_intrawave_v1,93.93,362.33,0.0
gfx942,304,176,1024,4096,ck,8,0,14.312,a8w8_blockscale_1x128x128_256x16x64x256_16x16_16x16_1x1_16x16x1_16x16x1_1x16x1x16_4_1x1_intrawave_v1,103.16,368.62,0.0
gfx942,304,192,1024,4096,ck,8,3,14.3318,a8w8_blockscale_1x128x128_256x16x64x256_16x16_16x16_1x1_16x16x1_16x16x1_1x16x1x16_4_1x1_intrawave_v1,112.38,374.97,0.0
gfx942,304,208,1024,4096,ck,8,1,14.3856,a8w8_blockscale_1x128x128_256x16x64x256_16x16_16x16_1x1_16x16x1_16x16x1_1x16x1x16_4_1x1_intrawave_v1,121.29,380.4,0.0
gfx942,304,224,1024,4096,ck,8,2,14.4193,a8w8_blockscale_1x128x128_256x16x64x256_16x16_16x16_1x1_16x16x1_16x16x1_1x16x1x16_4_1x1_intrawave_v1,130.31,386.33,0.0
gfx942,304,240,1024,4096,ck,8,3,14.4268,a8w8_blockscale_1x128x128_256x16x64x256_16x16_16x16_1x1_16x16x1_16x16x1_1x16x1x16_4_1x1_intrawave_v1,139.55,392.94,0.0
gfx942,304,256,1024,4096,ck,8,2,14.527,a8w8_blockscale_1x128x128_256x16x64x256_16x16_16x16_1x1_16x16x1_16x16x1_1x16x1x16_4_1x1_intrawave_v1,147.83,397.0,0.0
gfx942,304,288,1024,4096,ck,8,0,14.6194,a8w8_blockscale_1x128x128_256x16x64x256_16x16_16x16_1x1_16x16x1_16x16x1_1x16x1x16_4_1x1_intrawave_v1,165.25,407.94,0.0
gfx942,304,320,1024,4096,ck,18,2,18.1981,a8w8_blockscale_1x128x128_256x64x64x256_16x16_32x32_1x1_16x16x1_16x16x1_1x32x1x8_8_1x1_intrawave_v1,147.51,338.52,0.0
gfx942,304,352,1024,4096,ck,18,2,20.1163,a8w8_blockscale_1x128x128_256x64x64x256_16x16_32x32_1x1_16x16x1_16x16x1_1x32x1x8_8_1x1_intrawave_v1,146.79,316.01,0.0
gfx942,304,384,1024,4096,ck,18,3,18.2357,a8w8_blockscale_1x128x128_256x64x64x256_16x16_32x32_1x1_16x16x1_16x16x1_1x32x1x8_8_1x1_intrawave_v1,176.64,359.38,0.0
gfx942,304,416,1024,4096,ck,18,2,20.2427,a8w8_blockscale_1x128x128_256x64x64x256_16x16_32x32_1x1_16x16x1_16x16x1_1x32x1x8_8_1x1_intrawave_v1,172.39,333.46,0.0
gfx942,304,448,1024,4096,ck,18,3,18.2884,a8w8_blockscale_1x128x128_256x64x64x256_16x16_32x32_1x1_16x16x1_16x16x1_1x32x1x8_8_1x1_intrawave_v1,205.49,379.85,0.0
gfx942,304,480,1024,4096,ck,18,1,20.3111,a8w8_blockscale_1x128x128_256x64x64x256_16x16_32x32_1x1_16x16x1_16x16x1_1x32x1x8_8_1x1_intrawave_v1,198.24,351.7,0.0
gfx942,304,512,1024,4096,ck,18,1,18.3654,a8w8_blockscale_1x128x128_256x64x64x256_16x16_32x32_1x1_16x16x1_16x16x1_1x32x1x8_8_1x1_intrawave_v1,233.86,399.67,0.0
gfx942,304,544,1024,4096,ck,18,3,20.484,a8w8_blockscale_1x128x128_256x64x64x256_16x16_32x32_1x1_16x16x1_16x16x1_1x32x1x8_8_1x1_intrawave_v1,222.78,367.93,0.0
gfx942,304,576,1024,4096,ck,18,2,18.2568,a8w8_blockscale_1x128x128_256x64x64x256_16x16_32x32_1x1_16x16x1_16x16x1_1x32x1x8_8_1x1_intrawave_v1,264.66,423.58,0.0
gfx942,304,608,1024,4096,ck,18,2,20.8337,a8w8_blockscale_1x128x128_256x64x64x256_16x16_32x32_1x1_16x16x1_16x16x1_1x32x1x8_8_1x1_intrawave_v1,244.81,380.63,0.0
gfx942,304,640,1024,4096,ck,18,3,18.3844,a8w8_blockscale_1x128x128_256x64x64x256_16x16_32x32_1x1_16x16x1_16x16x1_1x32x1x8_8_1x1_intrawave_v1,292.03,442.03,0.0
gfx942,304,672,1024,4096,ck,18,0,20.8446,a8w8_blockscale_1x128x128_256x64x64x256_16x16_32x32_1x1_16x16x1_16x16x1_1x32x1x8_8_1x1_intrawave_v1,270.44,399.29,0.0
gfx942,304,704,1024,4096,ck,18,1,18.5986,a8w8_blockscale_1x128x128_256x64x64x256_16x16_32x32_1x1_16x16x1_16x16x1_1x32x1x8_8_1x1_intrawave_v1,317.53,458.08,0.0
gfx942,304,736,1024,4096,ck,18,3,20.6919,a8w8_blockscale_1x128x128_256x64x64x256_16x16_32x32_1x1_16x16x1_16x16x1_1x32x1x8_8_1x1_intrawave_v1,298.38,421.24,0.0
gfx942,304,768,1024,4096,ck,18,1,18.7105,a8w8_blockscale_1x128x128_256x64x64x256_16x16_32x32_1x1_16x16x1_16x16x1_1x32x1x8_8_1x1_intrawave_v1,344.32,476.36,0.0
gfx942,304,800,1024,4096,ck,18,2,20.8575,a8w8_blockscale_1x128x128_256x64x64x256_16x16_32x32_1x1_16x16x1_16x16x1_1x32x1x8_8_1x1_intrawave_v1,321.75,436.75,0.0
gfx942,304,832,1024,4096,ck,18,0,19.4544,a8w8_blockscale_1x128x128_256x64x64x256_16x16_32x32_1x1_16x16x1_16x16x1_1x32x1x8_8_1x1_intrawave_v1,358.75,478.36,0.0
gfx942,304,864,1024,4096,ck,18,1,21.3148,a8w8_blockscale_1x128x128_256x64x64x256_16x16_32x32_1x1_16x16x1_16x16x1_1x32x1x8_8_1x1_intrawave_v1,340.03,445.83,0.0
gfx942,304,896,1024,4096,ck,18,2,21.0129,a8w8_blockscale_1x128x128_256x64x64x256_16x16_32x32_1x1_16x16x1_16x16x1_1x32x1x8_8_1x1_intrawave_v1,357.69,461.59,0.0
gfx942,304,928,1024,4096,ck,18,0,22.9371,a8w8_blockscale_1x128x128_256x64x64x256_16x16_32x32_1x1_16x16x1_16x16x1_1x32x1x8_8_1x1_intrawave_v1,339.39,431.44,0.0
gfx942,304,960,1024,4096,ck,18,2,20.438,a8w8_blockscale_1x128x128_256x64x64x256_16x16_32x32_1x1_16x16x1_16x16x1_1x32x1x8_8_1x1_intrawave_v1,394.02,493.81,0.0
gfx942,304,992,1024,4096,ck,18,2,23.5004,a8w8_blockscale_1x128x128_256x64x64x256_16x16_32x32_1x1_16x16x1_16x16x1_1x32x1x8_8_1x1_intrawave_v1,354.1,437.83,0.0
gfx942,304,1024,1024,4096,ck,18,2,22.4528,a8w8_blockscale_1x128x128_256x64x64x256_16x16_32x32_1x1_16x16x1_16x16x1_1x32x1x8_8_1x1_intrawave_v1,382.58,467.01,0.0
gfx942,304,1088,1024,4096,ck,18,2,22.7606,a8w8_blockscale_1x128x128_256x64x64x256_16x16_32x32_1x1_16x16x1_16x16x1_1x32x1x8_8_1x1_intrawave_v1,400.99,477.97,0.0
gfx942,304,1152,1024,4096,ck,18,0,23.5621,a8w8_blockscale_1x128x128_256x64x64x256_16x16_32x32_1x1_16x16x1_16x16x1_1x32x1x8_8_1x1_intrawave_v1,410.14,478.4,0.0
gfx942,304,1216,1024,4096,ck,18,1,23.5855,a8w8_blockscale_1x128x128_256x64x64x256_16x16_32x32_1x1_16x16x1_16x16x1_1x32x1x8_8_1x1_intrawave_v1,432.49,494.6,0.0
gfx942,304,1280,1024,4096,ck,3,0,31.765,a8w8_blockscale_1x128x128_256x64x64x128_16x16_32x32_1x1_8x32x1_8x32x1_1x32x1x8_8_1x1_intrawave_v3,338.03,379.62,0.0
gfx942,304,1344,1024,4096,ck,3,0,34.4485,a8w8_blockscale_1x128x128_256x64x64x128_16x16_32x32_1x1_8x32x1_8x32x1_1x32x1x8_8_1x1_intrawave_v3,327.28,361.46,0.0
gfx942,304,1408,1024,4096,ck,3,1,33.6205,a8w8_blockscale_1x128x128_256x64x64x128_16x16_32x32_1x1_8x32x1_8x32x1_1x32x1x8_8_1x1_intrawave_v3,351.31,382.06,0.0
gfx942,304,1472,1024,4096,ck,3,3,34.685,a8w8_blockscale_1x128x128_256x64x64x128_16x16_32x32_1x1_8x32x1_8x32x1_1x32x1x8_8_1x1_intrawave_v3,356.0,381.67,0.0
gfx942,304,1536,1024,4096,ck,3,2,33.2821,a8w8_blockscale_1x128x128_256x64x64x128_16x16_32x32_1x1_8x32x1_8x32x1_1x32x1x8_8_1x1_intrawave_v3,387.14,409.57,0.0
gfx942,304,1600,1024,4096,ck,3,0,35.7131,a8w8_blockscale_1x128x128_256x64x64x128_16x16_32x32_1x1_8x32x1_8x32x1_1x32x1x8_8_1x1_intrawave_v3,375.82,392.7,0.0
gfx942,304,1664,1024,4096,ck,3,3,35.6871,a8w8_blockscale_1x128x128_256x64x64x128_16x16_32x32_1x1_8x32x1_8x32x1_1x32x1x8_8_1x1_intrawave_v3,391.14,404.01,0.0
gfx942,304,1728,1024,4096,ck,3,1,37.0777,a8w8_blockscale_1x128x128_256x64x64x128_16x16_32x32_1x1_8x32x1_8x32x1_1x32x1x8_8_1x1_intrawave_v3,390.95,399.46,0.0
gfx942,304,1792,1024,4096,ck,3,3,38.0824,a8w8_blockscale_1x128x128_256x64x64x128_16x16_32x32_1x1_8x32x1_8x32x1_1x32x1x8_8_1x1_intrawave_v3,394.73,399.25,0.0
gfx942,304,1856,1024,4096,ck,3,3,38.94,a8w8_blockscale_1x128x128_256x64x64x128_16x16_32x32_1x1_8x32x1_8x32x1_1x32x1x8_8_1x1_intrawave_v3,399.83,400.55,0.0
gfx942,304,1920,1024,4096,ck,3,2,39.201,a8w8_blockscale_1x128x128_256x64x64x128_16x16_32x32_1x1_8x32x1_8x32x1_1x32x1x8_8_1x1_intrawave_v3,410.86,407.92,0.0
gfx942,304,1984,1024,4096,ck,18,2,40.5166,a8w8_blockscale_1x128x128_256x64x64x256_16x16_32x32_1x1_16x16x1_16x16x1_1x32x1x8_8_1x1_intrawave_v1,410.77,404.38,0.0
gfx942,304,2048,1024,4096,ck,3,2,40.0542,a8w8_blockscale_1x128x128_256x64x64x128_16x16_32x32_1x1_8x32x1_8x32x1_1x32x1x8_8_1x1_intrawave_v3,428.92,418.86,0.0
gfx942,304,2112,1024,4096,ck,3,2,41.2399,a8w8_blockscale_1x128x128_256x64x64x128_16x16_32x32_1x1_8x32x1_8x32x1_1x32x1x8_8_1x1_intrawave_v3,429.6,416.35,0.0
gfx942,304,2176,1024,4096,ck,2,1,41.6915,a8w8_blockscale_1x128x128_256x64x128x128_16x16_32x32_1x2_8x32x1_8x32x1_1x32x1x8_8_1x1_intrawave_v3,437.83,421.28,0.0
gfx942,304,2240,1024,4096,ck,2,3,41.8482,a8w8_blockscale_1x128x128_256x64x128x128_16x16_32x32_1x2_8x32x1_8x32x1_1x32x1x8_8_1x1_intrawave_v3,449.02,429.1,0.0
gfx942,304,2304,1024,4096,ck,2,1,42.329,a8w8_blockscale_1x128x128_256x64x128x128_16x16_32x32_1x2_8x32x1_8x32x1_1x32x1x8_8_1x1_intrawave_v3,456.6,433.51,0.0
gfx942,304,2432,1024,4096,ck,2,1,42.5282,a8w8_blockscale_1x128x128_256x64x128x128_16x16_32x32_1x2_8x32x1_8x32x1_1x32x1x8_8_1x1_intrawave_v3,479.71,449.97,0.0
gfx942,304,2496,1024,4096,ck,0,1,51.6785,a8w8_blockscale_1x128x128_256x128x128x128_16x16_32x32_2x2_8x32x1_8x32x1_1x32x1x8_8_1x1_intrawave_v3,405.16,377.91,0.0
gfx942,304,2560,1024,4096,ck,2,3,53.9967,a8w8_blockscale_1x128x128_256x64x128x128_16x16_32x32_1x2_8x32x1_8x32x1_1x32x1x8_8_1x1_intrawave_v3,397.71,368.97,0.0
gfx942,304,2624,1024,4096,ck,0,2,53.2237,a8w8_blockscale_1x128x128_256x128x128x128_16x16_32x32_2x2_8x32x1_8x32x1_1x32x1x8_8_1x1_intrawave_v3,413.57,381.71,0.0
gfx942,304,2688,1024,4096,ck,2,0,54.6794,a8w8_blockscale_1x128x128_256x64x128x128_16x16_32x32_1x2_8x32x1_8x32x1_1x32x1x8_8_1x1_intrawave_v3,412.38,378.74,0.0
gfx942,304,2752,1024,4096,ck,0,1,52.8813,a8w8_blockscale_1x128x128_256x128x128x128_16x16_32x32_2x2_8x32x1_8x32x1_1x32x1x8_8_1x1_intrawave_v3,436.55,399.06,0.0
gfx942,304,2816,1024,4096,ck,2,2,56.233,a8w8_blockscale_1x128x128_256x64x128x128_16x16_32x32_1x2_8x32x1_8x32x1_1x32x1x8_8_1x1_intrawave_v3,420.08,382.26,0.0
gfx942,304,2880,1024,4096,ck,0,2,53.6735,a8w8_blockscale_1x128x128_256x128x128x128_16x16_32x32_2x2_8x32x1_8x32x1_1x32x1x8_8_1x1_intrawave_v3,450.11,407.82,0.0
gfx942,304,2944,1024,4096,ck,2,1,56.3669,a8w8_blockscale_1x128x128_256x64x128x128_16x16_32x32_1x2_8x32x1_8x32x1_1x32x1x8_8_1x1_intrawave_v3,438.13,395.31,0.0
gfx942,304,3008,1024,4096,ck,0,2,54.7356,a8w8_blockscale_1x128x128_256x128x128x128_16x16_32x32_2x2_8x32x1_8x32x1_1x32x1x8_8_1x1_intrawave_v3,461.0,414.27,0.0
gfx942,304,3072,1024,4096,ck,2,3,57.0271,a8w8_blockscale_1x128x128_256x64x128x128_16x16_32x32_1x2_8x32x1_8x32x1_1x32x1x8_8_1x1_intrawave_v3,451.89,404.52,0.0
gfx942,304,3136,1024,4096,ck,0,2,54.7558,a8w8_blockscale_1x128x128_256x128x128x128_16x16_32x32_2x2_8x32x1_8x32x1_1x32x1x8_8_1x1_intrawave_v3,480.44,428.48,0.0
gfx942,304,3200,1024,4096,ck,2,0,57.4624,a8w8_blockscale_1x128x128_256x64x128x128_16x16_32x32_1x2_8x32x1_8x32x1_1x32x1x8_8_1x1_intrawave_v3,467.15,415.14,0.0
gfx942,304,3264,1024,4096,ck,0,2,55.5619,a8w8_blockscale_1x128x128_256x128x128x128_16x16_32x32_2x2_8x32x1_8x32x1_1x32x1x8_8_1x1_intrawave_v3,492.79,436.42,0.0
gfx942,304,3328,1024,4096,ck,2,0,58.0264,a8w8_blockscale_1x128x128_256x64x128x128_16x16_32x32_1x2_8x32x1_8x32x1_1x32x1x8_8_1x1_intrawave_v3,481.11,424.66,0.0
gfx942,304,3392,1024,4096,ck,0,0,57.5818,a8w8_blockscale_1x128x128_256x128x128x128_16x16_32x32_2x2_8x32x1_8x32x1_1x32x1x8_8_1x1_intrawave_v3,494.15,434.77,0.0
gfx942,304,3456,1024,4096,ck,2,3,59.2916,a8w8_blockscale_1x128x128_256x64x128x128_16x16_32x32_1x2_8x32x1_8x32x1_1x32x1x8_8_1x1_intrawave_v3,488.96,428.86,0.0
gfx942,304,3520,1024,4096,ck,0,1,57.6402,a8w8_blockscale_1x128x128_256x128x128x128_16x16_32x32_2x2_8x32x1_8x32x1_1x32x1x8_8_1x1_intrawave_v3,512.28,447.97,0.0
gfx942,304,3584,1024,4096,ck,2,3,59.6727,a8w8_blockscale_1x128x128_256x64x128x128_16x16_32x32_1x2_8x32x1_8x32x1_1x32x1x8_8_1x1_intrawave_v3,503.83,439.3,0.0
gfx942,304,3648,1024,4096,ck,0,1,59.7515,a8w8_blockscale_1x128x128_256x128x128x128_16x16_32x32_2x2_8x32x1_8x32x1_1x32x1x8_8_1x1_intrawave_v3,512.15,445.3,0.0
gfx942,304,3712,1024,4096,ck,2,3,59.8604,a8w8_blockscale_1x128x128_256x64x128x128_16x16_32x32_1x2_8x32x1_8x32x1_1x32x1x8_8_1x1_intrawave_v3,520.19,451.06,0.0
gfx942,304,3776,1024,4096,ck,0,3,59.2624,a8w8_blockscale_1x128x128_256x128x128x128_16x16_32x32_2x2_8x32x1_8x32x1_1x32x1x8_8_1x1_intrawave_v3,534.49,462.25,0.0
gfx942,304,3840,1024,4096,ck,2,2,62.3187,a8w8_blockscale_1x128x128_256x64x128x128_16x16_32x32_1x2_8x32x1_8x32x1_1x32x1x8_8_1x1_intrawave_v3,516.9,445.89,0.0
gfx942,304,3904,1024,4096,ck,0,3,58.9645,a8w8_blockscale_1x128x128_256x128x128x128_16x16_32x32_2x2_8x32x1_8x32x1_1x32x1x8_8_1x1_intrawave_v3,555.4,477.92,0.0
gfx942,304,3968,1024,4096,ck,0,1,61.9863,a8w8_blockscale_1x128x128_256x128x128x128_16x16_32x32_2x2_8x32x1_8x32x1_1x32x1x8_8_1x1_intrawave_v3,536.99,460.97,0.0
gfx942,304,4032,1024,4096,ck,0,3,59.758,a8w8_blockscale_1x128x128_256x128x128x128_16x16_32x32_2x2_8x32x1_8x32x1_1x32x1x8_8_1x1_intrawave_v3,566.0,484.74,0.0
gfx942,304,4096,1024,4096,ck,2,2,62.5889,a8w8_blockscale_1x128x128_256x64x128x128_16x16_32x32_1x2_8x32x1_8x32x1_1x32x1x8_8_1x1_intrawave_v3,548.97,469.09,0.0
gfx942,304,4224,1024,4096,ck,0,2,63.3859,a8w8_blockscale_1x128x128_256x128x128x128_16x16_32x32_2x2_8x32x1_8x32x1_1x32x1x8_8_1x1_intrawave_v3,559.01,475.6,0.0
gfx942,304,4352,1024,4096,ck,0,3,63.9638,a8w8_blockscale_1x128x128_256x128x128x128_16x16_32x32_2x2_8x32x1_8x32x1_1x32x1x8_8_1x1_intrawave_v3,570.75,483.6,0.0
gfx942,304,4480,1024,4096,ck,0,3,63.9188,a8w8_blockscale_1x128x128_256x128x128x128_16x16_32x32_2x2_8x32x1_8x32x1_1x32x1x8_8_1x1_intrawave_v3,587.95,496.25,0.0
gfx942,304,4608,1024,4096,ck,0,2,65.8508,a8w8_blockscale_1x128x128_256x128x128x128_16x16_32x32_2x2_8x32x1_8x32x1_1x32x1x8_8_1x1_intrawave_v3,587.0,493.63,0.0
gfx942,304,4736,1024,4096,ck,0,3,65.4611,a8w8_blockscale_1x128x128_256x128x128x128_16x16_32x32_2x2_8x32x1_8x32x1_1x32x1x8_8_1x1_intrawave_v3,606.9,508.58,0.0
gfx942,304,4864,1024,4096,ck,0,1,66.0152,a8w8_blockscale_1x128x128_256x128x128x128_16x16_32x32_2x2_8x32x1_8x32x1_1x32x1x8_8_1x1_intrawave_v3,618.07,516.23,0.0
gfx942,304,4992,1024,4096,ck,0,2,82.8189,a8w8_blockscale_1x128x128_256x128x128x128_16x16_32x32_2x2_8x32x1_8x32x1_1x32x1x8_8_1x1_intrawave_v3,505.63,420.98,0.0
gfx942,304,5120,1024,4096,ck,0,0,81.4061,a8w8_blockscale_1x128x128_256x128x128x128_16x16_32x32_2x2_8x32x1_8x32x1_1x32x1x8_8_1x1_intrawave_v3,527.6,437.95,0.0
gfx942,304,5248,1024,4096,ck,0,1,84.465,a8w8_blockscale_1x128x128_256x128x128x128_16x16_32x32_2x2_8x32x1_8x32x1_1x32x1x8_8_1x1_intrawave_v3,521.2,431.4,0.0
gfx942,304,5376,1024,4096,ck,0,3,84.1271,a8w8_blockscale_1x128x128_256x128x128x128_16x16_32x32_2x2_8x32x1_8x32x1_1x32x1x8_8_1x1_intrawave_v3,536.06,442.48,0.0
gfx942,304,5504,1024,4096,ck,0,2,82.4319,a8w8_blockscale_1x128x128_256x128x128x128_16x16_32x32_2x2_8x32x1_8x32x1_1x32x1x8_8_1x1_intrawave_v3,560.11,461.12,0.0
gfx942,304,5632,1024,4096,ck,0,1,84.9731,a8w8_blockscale_1x128x128_256x128x128x128_16x16_32x32_2x2_8x32x1_8x32x1_1x32x1x8_8_1x1_intrawave_v3,556.0,456.58,0.0
gfx942,304,5760,1024,4096,ck,0,3,83.8651,a8w8_blockscale_1x128x128_256x128x128x128_16x16_32x32_2x2_8x32x1_8x32x1_1x32x1x8_8_1x1_intrawave_v3,576.14,471.99,0.0
gfx942,304,5888,1024,4096,ck,0,2,84.8858,a8w8_blockscale_1x128x128_256x128x128x128_16x16_32x32_2x2_8x32x1_8x32x1_1x32x1x8_8_1x1_intrawave_v3,581.87,475.58,0.0
gfx942,304,6016,1024,4096,ck,0,2,85.2523,a8w8_blockscale_1x128x128_256x128x128x128_16x16_32x32_2x2_8x32x1_8x32x1_1x32x1x8_8_1x1_intrawave_v3,591.96,482.76,0.0
gfx942,304,6144,1024,4096,ck,0,3,85.1094,a8w8_blockscale_1x128x128_256x128x128x128_16x16_32x32_2x2_8x32x1_8x32x1_1x32x1x8_8_1x1_intrawave_v3,605.57,492.81,0.0
gfx942,304,6272,1024,4096,ck,0,0,87.4085,a8w8_blockscale_1x128x128_256x128x128x128_16x16_32x32_2x2_8x32x1_8x32x1_1x32x1x8_8_1x1_intrawave_v3,601.92,488.85,0.0
gfx942,304,6400,1024,4096,ck,0,2,87.3406,a8w8_blockscale_1x128x128_256x128x128x128_16x16_32x32_2x2_8x32x1_8x32x1_1x32x1x8_8_1x1_intrawave_v3,614.69,498.23,0.0
gfx942,304,6528,1024,4096,ck,0,2,88.8287,a8w8_blockscale_1x128x128_256x128x128x128_16x16_32x32_2x2_8x32x1_8x32x1_1x32x1x8_8_1x1_intrawave_v3,616.48,498.74,0.0
gfx942,304,6656,1024,4096,ck,0,2,88.8726,a8w8_blockscale_1x128x128_256x128x128x128_16x16_32x32_2x2_8x32x1_8x32x1_1x32x1x8_8_1x1_intrawave_v3,628.25,507.34,0.0
gfx942,304,6784,1024,4096,ck,0,2,89.5989,a8w8_blockscale_1x128x128_256x128x128x128_16x16_32x32_2x2_8x32x1_8x32x1_1x32x1x8_8_1x1_intrawave_v3,635.15,512.01,0.0
gfx942,304,6912,1024,4096,ck,0,3,91.7104,a8w8_blockscale_1x128x128_256x128x128x128_16x16_32x32_2x2_8x32x1_8x32x1_1x32x1x8_8_1x1_intrawave_v3,632.23,508.79,0.0
gfx942,304,7040,1024,4096,ck,0,0,92.4242,a8w8_blockscale_1x128x128_256x128x128x128_16x16_32x32_2x2_8x32x1_8x32x1_1x32x1x8_8_1x1_intrawave_v3,638.96,513.37,0.0
gfx942,304,7168,1024,4096,ck,0,0,93.1672,a8w8_blockscale_1x128x128_256x128x128x128_16x16_32x32_2x2_8x32x1_8x32x1_1x32x1x8_8_1x1_intrawave_v3,645.39,517.72,0.0
gfx942,304,7296,1024,4096,ck,0,0,93.4238,a8w8_blockscale_1x128x128_256x128x128x128_16x16_32x32_2x2_8x32x1_8x32x1_1x32x1x8_8_1x1_intrawave_v3,655.11,524.72,0.0
gfx942,304,7424,1024,4096,ck,0,0,97.3096,a8w8_blockscale_1x128x128_256x128x128x128_16x16_32x32_2x2_8x32x1_8x32x1_1x32x1x8_8_1x1_intrawave_v3,639.99,511.84,0.0
gfx942,304,7552,1024,4096,ck,0,0,94.4799,a8w8_blockscale_1x128x128_256x128x128x128_16x16_32x32_2x2_8x32x1_8x32x1_1x32x1x8_8_1x1_intrawave_v3,670.52,535.5,0.0
gfx942,304,7680,1024,4096,ck,0,2,96.4579,a8w8_blockscale_1x128x128_256x128x128x128_16x16_32x32_2x2_8x32x1_8x32x1_1x32x1x8_8_1x1_intrawave_v3,667.9,532.67,0.0
gfx942,304,7808,1024,4096,ck,0,3,96.9579,a8w8_blockscale_1x128x128_256x128x128x128_16x16_32x32_2x2_8x32x1_8x32x1_1x32x1x8_8_1x1_intrawave_v3,675.53,538.03,0.0
gfx942,304,7936,1024,4096,ck,0,0,97.9617,a8w8_blockscale_1x128x128_256x128x128x128_16x16_32x32_2x2_8x32x1_8x32x1_1x32x1x8_8_1x1_intrawave_v3,679.57,540.55,0.0
gfx942,304,8064,1024,4096,ck,0,1,100.6923,a8w8_blockscale_1x128x128_256x128x128x128_16x16_32x32_2x2_8x32x1_8x32x1_1x32x1x8_8_1x1_intrawave_v3,671.81,533.7,0.0
gfx942,304,8192,1024,4096,ck,0,1,93.7935,a8w8_blockscale_1x128x128_256x128x128x128_16x16_32x32_2x2_8x32x1_8x32x1_1x32x1x8_8_1x1_intrawave_v3,732.67,581.34,0.0
gfx942,304,8320,1024,4096,ck,0,2,98.458,a8w8_blockscale_1x128x128_256x128x128x128_16x16_32x32_2x2_8x32x1_8x32x1_1x32x1x8_8_1x1_intrawave_v3,708.86,561.79,0.0
gfx942,304,8704,1024,4096,ck,0,2,105.6098,a8w8_blockscale_1x128x128_256x128x128x128_16x16_32x32_2x2_8x32x1_8x32x1_1x32x1x8_8_1x1_intrawave_v3,691.36,546.08,0.0
gfx942,304,8832,1024,4096,ck,0,3,105.719,a8w8_blockscale_1x128x128_256x128x128x128_16x16_32x32_2x2_8x32x1_8x32x1_1x32x1x8_8_1x1_intrawave_v3,700.8,552.96,0.0
gfx942,304,8960,1024,4096,ck,0,3,104.6016,a8w8_blockscale_1x128x128_256x128x128x128_16x16_32x32_2x2_8x32x1_8x32x1_1x32x1x8_8_1x1_intrawave_v3,718.55,566.38,0.0
gfx942,304,9216,1024,4096,ck,0,3,105.3429,a8w8_blockscale_1x128x128_256x128x128x128_16x16_32x32_2x2_8x32x1_8x32x1_1x32x1x8_8_1x1_intrawave_v3,733.88,577.33,0.0
gfx942,304,9344,1024,4096,ck,0,3,107.7626,a8w8_blockscale_1x128x128_256x128x128x128_16x16_32x32_2x2_8x32x1_8x32x1_1x32x1x8_8_1x1_intrawave_v3,727.37,571.66,0.0
gfx942,304,9472,1024,4096,ck,0,1,108.9607,a8w8_blockscale_1x128x128_256x128x128x128_16x16_32x32_2x2_8x32x1_8x32x1_1x32x1x8_8_1x1_intrawave_v3,729.23,572.59,0.0
gfx942,304,9856,1024,4096,ck,0,1,140.5557,a8w8_blockscale_1x128x128_256x128x128x128_16x16_32x32_2x2_8x32x1_8x32x1_1x32x1x8_8_1x1_intrawave_v3,588.22,460.67,0.0
gfx942,304,9984,1024,4096,ck,0,1,137.2847,a8w8_blockscale_1x128x128_256x128x128x128_16x16_32x32_2x2_8x32x1_8x32x1_1x32x1x8_8_1x1_intrawave_v3,610.06,477.37,0.0
gfx942,304,10112,1024,4096,ck,0,1,144.4128,a8w8_blockscale_1x128x128_256x128x128x128_16x16_32x32_2x2_8x32x1_8x32x1_1x32x1x8_8_1x1_intrawave_v3,587.38,459.26,0.0
gfx942,304,10240,1024,4096,ck,0,3,137.3183,a8w8_blockscale_1x128x128_256x128x128x128_16x16_32x32_2x2_8x32x1_8x32x1_1x32x1x8_8_1x1_intrawave_v3,625.55,488.71,0.0
gfx942,304,10624,1024,4096,ck,0,2,139.5503,a8w8_blockscale_1x128x128_256x128x128x128_16x16_32x32_2x2_8x32x1_8x32x1_1x32x1x8_8_1x1_intrawave_v3,638.63,497.8,0.0
gfx942,304,10752,1024,4096,ck,0,2,138.9578,a8w8_blockscale_1x128x128_256x128x128x128_16x16_32x32_2x2_8x32x1_8x32x1_1x32x1x8_8_1x1_intrawave_v3,649.08,505.58,0.0
gfx942,304,10880,1024,4096,ck,0,1,141.4522,a8w8_blockscale_1x128x128_256x128x128x128_16x16_32x32_2x2_8x32x1_8x32x1_1x32x1x8_8_1x1_intrawave_v3,645.22,502.23,0.0
gfx942,304,11264,1024,4096,ck,0,2,140.012,a8w8_blockscale_1x128x128_256x128x128x128_16x16_32x32_2x2_8x32x1_8x32x1_1x32x1x8_8_1x1_intrawave_v3,674.87,524.24,0.0
gfx942,304,11904,1024,4096,ck,0,1,143.9202,a8w8_blockscale_1x128x128_256x128x128x128_16x16_32x32_2x2_8x32x1_8x32x1_1x32x1x8_8_1x1_intrawave_v3,693.84,537.33,0.0
gfx942,304,12544,1024,4096,ck,0,1,147.5424,a8w8_blockscale_1x128x128_256x128x128x128_16x16_32x32_2x2_8x32x1_8x32x1_1x32x1x8_8_1x1_intrawave_v3,713.2,550.79,0.0
gfx942,304,12800,1024,4096,ck,0,0,151.5087,a8w8_blockscale_1x128x128_256x128x128x128_16x16_32x32_2x2_8x32x1_8x32x1_1x32x1x8_8_1x1_intrawave_v3,708.7,546.75,0.0
gfx942,304,13312,1024,4096,ck,0,2,150.7136,a8w8_blockscale_1x128x128_256x128x128x128_16x16_32x32_2x2_8x32x1_8x32x1_1x32x1x8_8_1x1_intrawave_v3,740.94,570.51,0.0
gfx942,304,13824,1024,4096,ck,0,3,157.2407,a8w8_blockscale_1x128x128_256x128x128x128_16x16_32x32_2x2_8x32x1_8x32x1_1x32x1x8_8_1x1_intrawave_v3,737.49,566.83,0.0
gfx942,304,13952,1024,4096,ck,0,1,157.2464,a8w8_blockscale_1x128x128_256x128x128x128_16x16_32x32_2x2_8x32x1_8x32x1_1x32x1x8_8_1x1_intrawave_v3,744.3,571.81,0.0
gfx942,304,14208,1024,4096,ck,0,1,160.284,a8w8_blockscale_1x128x128_256x128x128x128_16x16_32x32_2x2_8x32x1_8x32x1_1x32x1x8_8_1x1_intrawave_v3,743.59,570.79,0.0
gfx942,304,16384,1024,4096,ck,0,3,187.7854,a8w8_blockscale_1x128x128_256x128x128x128_16x16_32x32_2x2_8x32x1_8x32x1_1x32x1x8_8_1x1_intrawave_v3,731.89,558.39,0.0
gfx942,304,16,1536,4096,ck,8,0,14.7784,a8w8_blockscale_1x128x128_256x16x64x256_16x16_16x16_1x1_16x16x1_16x16x1_1x16x1x16_4_1x1_intrawave_v1,13.62,433.48,0.0
gfx942,304,32,1536,4096,ck,8,2,14.7848,a8w8_blockscale_1x128x128_256x16x64x256_16x16_16x16_1x1_16x16x1_16x16x1_1x16x1x16_4_1x1_intrawave_v1,27.23,441.05,0.0
gfx942,304,48,1536,4096,ck,8,3,14.6102,a8w8_blockscale_1x128x128_256x16x64x256_16x16_16x16_1x1_16x16x1_16x16x1_1x16x1x16_4_1x1_intrawave_v1,41.34,454.17,0.0
gfx942,304,64,1536,4096,ck,8,0,14.553,a8w8_blockscale_1x128x128_256x16x64x256_16x16_16x16_1x1_16x16x1_16x16x1_1x16x1x16_4_1x1_intrawave_v1,55.34,463.84,0.0
gfx942,304,80,1536,4096,ck,8,0,14.5239,a8w8_blockscale_1x128x128_256x16x64x256_16x16_16x16_1x1_16x16x1_16x16x1_1x16x1x16_4_1x1_intrawave_v1,69.31,472.66,0.0
gfx942,304,96,1536,4096,ck,8,0,14.4821,a8w8_blockscale_1x128x128_256x16x64x256_16x16_16x16_1x1_16x16x1_16x16x1_1x16x1x16_4_1x1_intrawave_v1,83.41,481.95,0.0
gfx942,304,112,1536,4096,ck,8,3,14.3865,a8w8_blockscale_1x128x128_256x16x64x256_16x16_16x16_1x1_16x16x1_16x16x1_1x16x1x16_4_1x1_intrawave_v1,97.96,493.12,0.0
gfx942,304,128,1536,4096,ck,8,2,14.4676,a8w8_blockscale_1x128x128_256x16x64x256_16x16_16x16_1x1_16x16x1_16x16x1_1x16x1x16_4_1x1_intrawave_v1,111.33,498.28,0.0
gfx942,304,144,1536,4096,ck,8,3,14.6931,a8w8_blockscale_1x128x128_256x16x64x256_16x16_16x16_1x1_16x16x1_16x16x1_1x16x1x16_4_1x1_intrawave_v1,123.32,498.44,0.0
gfx942,304,160,1536,4096,ck,8,2,14.6382,a8w8_blockscale_1x128x128_256x16x64x256_16x16_16x16_1x1_16x16x1_16x16x1_1x16x1x16_4_1x1_intrawave_v1,137.54,508.15,0.0
gfx942,304,176,1536,4096,ck,8,2,14.6348,a8w8_blockscale_1x128x128_256x16x64x256_16x16_16x16_1x1_16x16x1_16x16x1_1x16x1x16_4_1x1_intrawave_v1,151.32,516.1,0.0
gfx942,304,192,1536,4096,ck,8,1,14.6371,a8w8_blockscale_1x128x128_256x16x64x256_16x16_16x16_1x1_16x16x1_16x16x1_1x16x1x16_4_1x1_intrawave_v1,165.05,523.85,0.0
gfx942,304,208,1536,4096,ck,13,2,20.0699,a8w8_blockscale_1x128x128_256x32x64x256_16x16_16x16_2x1_16x16x1_16x16x1_1x32x1x8_8_2x1_intrawave_v1,130.41,387.76,0.0
gfx942,304,224,1536,4096,ck,18,2,20.1704,a8w8_blockscale_1x128x128_256x64x64x256_16x16_32x32_1x1_16x16x1_16x16x1_1x32x1x8_8_1x1_intrawave_v1,139.74,391.52,0.0
gfx942,304,240,1536,4096,ck,18,1,20.2011,a8w8_blockscale_1x128x128_256x64x64x256_16x16_32x32_1x1_16x16x1_16x16x1_1x32x1x8_8_1x1_intrawave_v1,149.49,396.6,0.0
gfx942,304,256,1536,4096,ck,18,2,18.3059,a8w8_blockscale_1x128x128_256x64x64x256_16x16_32x32_1x1_16x16x1_16x16x1_1x32x1x8_8_1x1_intrawave_v1,175.97,443.93,0.0
gfx942,304,288,1536,4096,ck,18,1,20.2436,a8w8_blockscale_1x128x128_256x64x64x256_16x16_32x32_1x1_16x16x1_16x16x1_1x32x1x8_8_1x1_intrawave_v1,179.01,412.76,0.0
gfx942,304,320,1536,4096,ck,18,3,18.5545,a8w8_blockscale_1x128x128_256x64x64x256_16x16_32x32_1x1_16x16x1_16x16x1_1x32x1x8_8_1x1_intrawave_v1,217.01,462.7,0.0
gfx942,304,352,1536,4096,ck,18,3,20.4773,a8w8_blockscale_1x128x128_256x64x64x256_16x16_32x32_1x1_16x16x1_16x16x1_1x32x1x8_8_1x1_intrawave_v1,216.3,430.46,0.0
gfx942,304,384,1536,4096,ck,18,0,18.7128,a8w8_blockscale_1x128x128_256x64x64x256_16x16_32x32_1x1_16x16x1_16x16x1_1x32x1x8_8_1x1_intrawave_v1,258.21,483.3,0.0
gfx942,304,416,1536,4096,ck,18,3,20.5303,a8w8_blockscale_1x128x128_256x64x64x256_16x16_32x32_1x1_16x16x1_16x16x1_1x32x1x8_8_1x1_intrawave_v1,254.96,451.69,0.0
gfx942,304,448,1536,4096,ck,18,3,18.8864,a8w8_blockscale_1x128x128_256x64x64x256_16x16_32x32_1x1_16x16x1_16x16x1_1x32x1x8_8_1x1_intrawave_v1,298.48,503.15,0.0
gfx942,304,480,1536,4096,ck,18,0,20.6777,a8w8_blockscale_1x128x128_256x64x64x256_16x16_32x32_1x1_16x16x1_16x16x1_1x32x1x8_8_1x1_intrawave_v1,292.09,470.66,0.0
gfx942,304,512,1536,4096,ck,18,3,19.1415,a8w8_blockscale_1x128x128_256x64x64x256_16x16_32x32_1x1_16x16x1_16x16x1_1x32x1x8_8_1x1_intrawave_v1,336.57,520.41,0.0
gfx942,304,544,1536,4096,ck,18,3,22.375,a8w8_blockscale_1x128x128_256x64x64x256_16x16_32x32_1x1_16x16x1_16x16x1_1x32x1x8_8_1x1_intrawave_v1,305.93,455.46,0.0
gfx942,304,576,1536,4096,ck,18,2,19.4555,a8w8_blockscale_1x128x128_256x64x64x256_16x16_32x32_1x1_16x16x1_16x16x1_1x32x1x8_8_1x1_intrawave_v1,372.53,535.59,0.0
gfx942,304,608,1536,4096,ck,18,2,23.7224,a8w8_blockscale_1x128x128_256x64x64x256_16x16_32x32_1x1_16x16x1_16x16x1_1x32x1x8_8_1x1_intrawave_v1,322.5,448.93,0.0
gfx942,304,640,1536,4096,ck,18,2,20.2266,a8w8_blockscale_1x128x128_256x64x64x256_16x16_32x32_1x1_16x16x1_16x16x1_1x32x1x8_8_1x1_intrawave_v1,398.14,537.85,0.0
gfx942,304,672,1536,4096,ck,18,1,23.7289,a8w8_blockscale_1x128x128_256x64x64x256_16x16_32x32_1x1_16x16x1_16x16x1_1x32x1x8_8_1x1_intrawave_v1,356.35,468.14,0.0
gfx942,304,704,1536,4096,ck,18,3,22.4889,a8w8_blockscale_1x128x128_256x64x64x256_16x16_32x32_1x1_16x16x1_16x16x1_1x32x1x8_8_1x1_intrawave_v1,393.9,504.15,0.0
gfx942,304,736,1536,4096,ck,18,0,25.0683,a8w8_blockscale_1x128x128_256x64x64x256_16x16_32x32_1x1_16x16x1_16x16x1_1x32x1x8_8_1x1_intrawave_v1,369.43,461.42,0.0
gfx942,304,768,1536,4096,ck,18,3,23.5545,a8w8_blockscale_1x128x128_256x64x64x256_16x16_32x32_1x1_16x16x1_16x16x1_1x32x1x8_8_1x1_intrawave_v1,410.27,500.82,0.0
gfx942,304,800,1536,4096,ck,12,3,28.4674,a8w8_blockscale_1x128x128_256x32x128x256_16x16_32x32_1x1_16x16x1_16x16x1_1x32x1x8_8_1x1_intrawave_v1,353.61,422.44,0.0
gfx942,304,832,1536,4096,ck,3,0,32.5562,a8w8_blockscale_1x128x128_256x64x64x128_16x16_32x32_1x1_8x32x1_8x32x1_1x32x1x8_8_1x1_intrawave_v3,321.57,376.43,0.0
gfx942,304,864,1536,4096,ck,3,2,32.0468,a8w8_blockscale_1x128x128_256x64x64x128_16x16_32x32_1x1_8x32x1_8x32x1_1x32x1x8_8_1x1_intrawave_v3,339.24,389.57,0.0
gfx942,304,896,1536,4096,ck,3,1,33.4016,a8w8_blockscale_1x128x128_256x64x64x128_16x16_32x32_1x1_8x32x1_8x32x1_1x32x1x8_8_1x1_intrawave_v3,337.54,380.64,0.0
gfx942,304,928,1536,4096,ck,2,3,34.2167,a8w8_blockscale_1x128x128_256x64x128x128_16x16_32x32_1x2_8x32x1_8x32x1_1x32x1x8_8_1x1_intrawave_v3,341.26,378.28,0.0
gfx942,304,960,1536,4096,ck,3,1,34.8754,a8w8_blockscale_1x128x128_256x64x64x128_16x16_32x32_1x1_8x32x1_8x32x1_1x32x1x8_8_1x1_intrawave_v3,346.36,377.71,0.0
gfx942,304,992,1536,4096,ck,3,0,34.5793,a8w8_blockscale_1x128x128_256x64x64x128_16x16_32x32_1x1_8x32x1_8x32x1_1x32x1x8_8_1x1_intrawave_v3,360.97,387.58,0.0
gfx942,304,1024,1536,4096,ck,3,1,35.6099,a8w8_blockscale_1x128x128_256x64x64x128_16x16_32x32_1x1_8x32x1_8x32x1_1x32x1x8_8_1x1_intrawave_v3,361.83,382.8,0.0
gfx942,304,1088,1536,4096,ck,3,3,37.0833,a8w8_blockscale_1x128x128_256x64x64x128_16x16_32x32_1x1_8x32x1_8x32x1_1x32x1x8_8_1x1_intrawave_v3,369.17,379.96,0.0
gfx942,304,1152,1536,4096,ck,2,1,39.2808,a8w8_blockscale_1x128x128_256x64x128x128_16x16_32x32_1x2_8x32x1_8x32x1_1x32x1x8_8_1x1_intrawave_v3,369.02,370.38,0.0
gfx942,304,1216,1536,4096,ck,18,0,39.1978,a8w8_blockscale_1x128x128_256x64x64x256_16x16_32x32_1x1_16x16x1_16x16x1_1x32x1x8_8_1x1_intrawave_v1,390.35,382.87,0.0
gfx942,304,1280,1536,4096,ck,3,2,38.7834,a8w8_blockscale_1x128x128_256x64x64x128_16x16_32x32_1x1_8x32x1_8x32x1_1x32x1x8_8_1x1_intrawave_v3,415.28,398.79,0.0
gfx942,304,1344,1536,4096,ck,2,1,40.8335,a8w8_blockscale_1x128x128_256x64x128x128_16x16_32x32_1x2_8x32x1_8x32x1_1x32x1x8_8_1x1_intrawave_v3,414.16,390.0,0.0
gfx942,304,1408,1536,4096,ck,3,3,40.7902,a8w8_blockscale_1x128x128_256x64x64x128_16x16_32x32_1x1_8x32x1_8x32x1_1x32x1x8_8_1x1_intrawave_v3,434.34,401.67,0.0
gfx942,304,1472,1536,4096,ck,3,0,41.3748,a8w8_blockscale_1x128x128_256x64x64x128_16x16_32x32_1x1_8x32x1_8x32x1_1x32x1x8_8_1x1_intrawave_v3,447.66,407.08,0.0
gfx942,304,1536,1536,4096,ck,3,1,41.6631,a8w8_blockscale_1x128x128_256x64x64x128_16x16_32x32_1x1_8x32x1_8x32x1_1x32x1x8_8_1x1_intrawave_v3,463.9,415.27,0.0
gfx942,304,1600,1536,4096,ck,2,3,42.7796,a8w8_blockscale_1x128x128_256x64x128x128_16x16_32x32_1x2_8x32x1_8x32x1_1x32x1x8_8_1x1_intrawave_v3,470.61,415.16,0.0
gfx942,304,1664,1536,4096,ck,2,0,53.8417,a8w8_blockscale_1x128x128_256x64x128x128_16x16_32x32_1x2_8x32x1_8x32x1_1x32x1x8_8_1x1_intrawave_v3,388.88,338.38,0.0
gfx942,304,1728,1536,4096,ck,0,1,50.2709,a8w8_blockscale_1x128x128_256x128x128x128_16x16_32x32_2x2_8x32x1_8x32x1_1x32x1x8_8_1x1_intrawave_v3,432.52,371.54,0.0
gfx942,304,1792,1536,4096,ck,2,1,55.4317,a8w8_blockscale_1x128x128_256x64x128x128_16x16_32x32_1x2_8x32x1_8x32x1_1x32x1x8_8_1x1_intrawave_v3,406.78,345.23,0.0
gfx942,304,1856,1536,4096,ck,0,1,52.2889,a8w8_blockscale_1x128x128_256x128x128x128_16x16_32x32_2x2_8x32x1_8x32x1_1x32x1x8_8_1x1_intrawave_v3,446.63,374.75,0.0
gfx942,304,1920,1536,4096,ck,2,0,56.8425,a8w8_blockscale_1x128x128_256x64x128x128_16x16_32x32_1x2_8x32x1_8x32x1_1x32x1x8_8_1x1_intrawave_v3,425.02,352.8,0.0
gfx942,304,1984,1536,4096,ck,0,1,53.7782,a8w8_blockscale_1x128x128_256x128x128x128_16x16_32x32_2x2_8x32x1_8x32x1_1x32x1x8_8_1x1_intrawave_v3,464.21,381.43,0.0
gfx942,304,2048,1536,4096,ck,0,0,56.8962,a8w8_blockscale_1x128x128_256x128x128x128_16x16_32x32_2x2_8x32x1_8x32x1_1x32x1x8_8_1x1_intrawave_v3,452.93,368.59,0.0
gfx942,304,2112,1536,4096,ck,0,3,53.7377,a8w8_blockscale_1x128x128_256x128x128x128_16x16_32x32_2x2_8x32x1_8x32x1_1x32x1x8_8_1x1_intrawave_v3,494.53,398.79,0.0
gfx942,304,2176,1536,4096,ck,2,2,57.9378,a8w8_blockscale_1x128x128_256x64x128x128_16x16_32x32_1x2_8x32x1_8x32x1_1x32x1x8_8_1x1_intrawave_v3,472.58,377.8,0.0
gfx942,304,2240,1536,4096,ck,0,1,54.7816,a8w8_blockscale_1x128x128_256x128x128x128_16x16_32x32_2x2_8x32x1_8x32x1_1x32x1x8_8_1x1_intrawave_v3,514.51,407.94,0.0
gfx942,304,2304,1536,4096,ck,0,1,59.4516,a8w8_blockscale_1x128x128_256x128x128x128_16x16_32x32_2x2_8x32x1_8x32x1_1x32x1x8_8_1x1_intrawave_v3,487.64,383.62,0.0
gfx942,304,2432,1536,4096,ck,0,0,60.644,a8w8_blockscale_1x128x128_256x128x128x128_16x16_32x32_2x2_8x32x1_8x32x1_1x32x1x8_8_1x1_intrawave_v3,504.61,391.2,0.0
gfx942,304,2496,1536,4096,ck,0,0,57.3445,a8w8_blockscale_1x128x128_256x128x128x128_16x16_32x32_2x2_8x32x1_8x32x1_1x32x1x8_8_1x1_intrawave_v3,547.69,421.71,0.0
gfx942,304,2560,1536,4096,ck,0,3,61.4656,a8w8_blockscale_1x128x128_256x128x128x128_16x16_32x32_2x2_8x32x1_8x32x1_1x32x1x8_8_1x1_intrawave_v3,524.07,400.9,0.0
gfx942,304,2624,1536,4096,ck,0,1,57.8622,a8w8_blockscale_1x128x128_256x128x128x128_16x16_32x32_2x2_8x32x1_8x32x1_1x32x1x8_8_1x1_intrawave_v3,570.62,433.79,0.0
gfx942,304,2688,1536,4096,ck,0,3,61.3496,a8w8_blockscale_1x128x128_256x128x128x128_16x16_32x32_2x2_8x32x1_8x32x1_1x32x1x8_8_1x1_intrawave_v3,551.31,416.61,0.0
gfx942,304,2752,1536,4096,ck,0,1,59.4249,a8w8_blockscale_1x128x128_256x128x128x128_16x16_32x32_2x2_8x32x1_8x32x1_1x32x1x8_8_1x1_intrawave_v3,582.72,437.83,0.0
gfx942,304,2816,1536,4096,ck,0,1,63.521,a8w8_blockscale_1x128x128_256x128x128x128_16x16_32x32_2x2_8x32x1_8x32x1_1x32x1x8_8_1x1_intrawave_v3,557.82,416.82,0.0
gfx942,304,2880,1536,4096,ck,0,0,60.8016,a8w8_blockscale_1x128x128_256x128x128x128_16x16_32x32_2x2_8x32x1_8x32x1_1x32x1x8_8_1x1_intrawave_v3,596.02,443.0,0.0
gfx942,304,2944,1536,4096,ck,0,0,64.4713,a8w8_blockscale_1x128x128_256x128x128x128_16x16_32x32_2x2_8x32x1_8x32x1_1x32x1x8_8_1x1_intrawave_v3,574.58,424.9,0.0
gfx942,304,3008,1536,4096,ck,0,0,60.9936,a8w8_blockscale_1x128x128_256x128x128x128_16x16_32x32_2x2_8x32x1_8x32x1_1x32x1x8_8_1x1_intrawave_v3,620.55,456.65,0.0
gfx942,304,3072,1536,4096,ck,0,1,64.561,a8w8_blockscale_1x128x128_256x128x128x128_16x16_32x32_2x2_8x32x1_8x32x1_1x32x1x8_8_1x1_intrawave_v3,598.73,438.52,0.0
gfx942,304,3136,1536,4096,ck,0,3,62.0771,a8w8_blockscale_1x128x128_256x128x128x128_16x16_32x32_2x2_8x32x1_8x32x1_1x32x1x8_8_1x1_intrawave_v3,635.66,463.46,0.0
gfx942,304,3200,1536,4096,ck,0,0,65.9254,a8w8_blockscale_1x128x128_256x128x128x128_16x16_32x32_2x2_8x32x1_8x32x1_1x32x1x8_8_1x1_intrawave_v3,610.77,443.37,0.0
gfx942,304,3264,1536,4096,ck,0,3,85.9103,a8w8_blockscale_1x128x128_256x128x128x128_16x16_32x32_2x2_8x32x1_8x32x1_1x32x1x8_8_1x1_intrawave_v3,478.06,345.57,0.0
gfx942,304,3328,1536,4096,ck,0,1,82.9316,a8w8_blockscale_1x128x128_256x128x128x128_16x16_32x32_2x2_8x32x1_8x32x1_1x32x1x8_8_1x1_intrawave_v3,504.95,363.51,0.0
gfx942,304,3392,1536,4096,ck,0,1,86.2398,a8w8_blockscale_1x128x128_256x128x128x128_16x16_32x32_2x2_8x32x1_8x32x1_1x32x1x8_8_1x1_intrawave_v3,494.91,354.89,0.0
gfx942,304,3456,1536,4096,ck,0,2,85.1327,a8w8_blockscale_1x128x128_256x128x128x128_16x16_32x32_2x2_8x32x1_8x32x1_1x32x1x8_8_1x1_intrawave_v3,510.81,364.89,0.0
gfx942,304,3520,1536,4096,ck,0,0,87.814,a8w8_blockscale_1x128x128_256x128x128x128_16x16_32x32_2x2_8x32x1_8x32x1_1x32x1x8_8_1x1_intrawave_v3,504.38,358.97,0.0
gfx942,304,3584,1536,4096,ck,0,0,85.4019,a8w8_blockscale_1x128x128_256x128x128x128_16x16_32x32_2x2_8x32x1_8x32x1_1x32x1x8_8_1x1_intrawave_v3,528.06,374.48,0.0
gfx942,304,3648,1536,4096,ck,0,0,87.6338,a8w8_blockscale_1x128x128_256x128x128x128_16x16_32x32_2x2_8x32x1_8x32x1_1x32x1x8_8_1x1_intrawave_v3,523.8,370.18,0.0
gfx942,304,3712,1536,4096,ck,0,3,87.3319,a8w8_blockscale_1x128x128_256x128x128x128_16x16_32x32_2x2_8x32x1_8x32x1_1x32x1x8_8_1x1_intrawave_v3,534.83,376.71,0.0
gfx942,304,3776,1536,4096,ck,0,1,85.6807,a8w8_blockscale_1x128x128_256x128x128x128_16x16_32x32_2x2_8x32x1_8x32x1_1x32x1x8_8_1x1_intrawave_v3,554.54,389.33,0.0
gfx942,304,3840,1536,4096,ck,0,2,86.1491,a8w8_blockscale_1x128x128_256x128x128x128_16x16_32x32_2x2_8x32x1_8x32x1_1x32x1x8_8_1x1_intrawave_v3,560.87,392.54,0.0
gfx942,304,3904,1536,4096,ck,0,0,87.9487,a8w8_blockscale_1x128x128_256x128x128x128_16x16_32x32_2x2_8x32x1_8x32x1_1x32x1x8_8_1x1_intrawave_v3,558.55,389.72,0.0
gfx942,304,3968,1536,4096,ck,0,2,88.9468,a8w8_blockscale_1x128x128_256x128x128x128_16x16_32x32_2x2_8x32x1_8x32x1_1x32x1x8_8_1x1_intrawave_v3,561.34,390.5,0.0
gfx942,304,4032,1536,4096,ck,0,1,82.7041,a8w8_blockscale_1x128x128_256x128x128x128_16x16_32x32_2x2_8x32x1_8x32x1_1x32x1x8_8_1x1_intrawave_v3,613.44,425.53,0.0
gfx942,304,4096,1536,4096,ck,0,3,84.4201,a8w8_blockscale_1x128x128_256x128x128x128_16x16_32x32_2x2_8x32x1_8x32x1_1x32x1x8_8_1x1_intrawave_v3,610.51,422.31,0.0
gfx942,304,4224,1536,4096,ck,0,2,86.4686,a8w8_blockscale_1x128x128_256x128x128x128_16x16_32x32_2x2_8x32x1_8x32x1_1x32x1x8_8_1x1_intrawave_v3,614.68,422.92,0.0
gfx942,304,4352,1536,4096,ck,0,1,86.3749,a8w8_blockscale_1x128x128_256x128x128x128_16x16_32x32_2x2_8x32x1_8x32x1_1x32x1x8_8_1x1_intrawave_v3,633.99,434.0,0.0
gfx942,304,4480,1536,4096,ck,0,2,89.0332,a8w8_blockscale_1x128x128_256x128x128x128_16x16_32x32_2x2_8x32x1_8x32x1_1x32x1x8_8_1x1_intrawave_v3,633.15,431.35,0.0
gfx942,304,4608,1536,4096,ck,0,3,88.6972,a8w8_blockscale_1x128x128_256x128x128x128_16x16_32x32_2x2_8x32x1_8x32x1_1x32x1x8_8_1x1_intrawave_v3,653.71,443.32,0.0
gfx942,304,4736,1536,4096,ck,0,3,90.2774,a8w8_blockscale_1x128x128_256x128x128x128_16x16_32x32_2x2_8x32x1_8x32x1_1x32x1x8_8_1x1_intrawave_v3,660.11,445.73,0.0
gfx942,304,4864,1536,4096,ck,0,0,91.7775,a8w8_blockscale_1x128x128_256x128x128x128_16x16_32x32_2x2_8x32x1_8x32x1_1x32x1x8_8_1x1_intrawave_v3,666.87,448.44,0.0
gfx942,304,4992,1536,4096,ck,0,3,92.1706,a8w8_blockscale_1x128x128_256x128x128x128_16x16_32x32_2x2_8x32x1_8x32x1_1x32x1x8_8_1x1_intrawave_v3,681.5,456.48,0.0
gfx942,304,5120,1536,4096,ck,0,3,91.879,a8w8_blockscale_1x128x128_256x128x128x128_16x16_32x32_2x2_8x32x1_8x32x1_1x32x1x8_8_1x1_intrawave_v3,701.19,467.92,0.0
gfx942,304,5248,1536,4096,ck,0,0,96.0751,a8w8_blockscale_1x128x128_256x128x128x128_16x16_32x32_2x2_8x32x1_8x32x1_1x32x1x8_8_1x1_intrawave_v3,687.33,457.03,0.0
gfx942,304,5376,1536,4096,ck,0,3,98.3263,a8w8_blockscale_1x128x128_256x128x128x128_16x16_32x32_2x2_8x32x1_8x32x1_1x32x1x8_8_1x1_intrawave_v3,687.97,455.9,0.0
gfx942,304,5504,1536,4096,ck,0,0,96.7486,a8w8_blockscale_1x128x128_256x128x128x128_16x16_32x32_2x2_8x32x1_8x32x1_1x32x1x8_8_1x1_intrawave_v3,715.84,472.81,0.0
gfx942,304,5632,1536,4096,ck,0,0,97.6285,a8w8_blockscale_1x128x128_256x128x128x128_16x16_32x32_2x2_8x32x1_8x32x1_1x32x1x8_8_1x1_intrawave_v3,725.88,477.95,0.0
gfx942,304,5760,1536,4096,ck,0,0,100.9268,a8w8_blockscale_1x128x128_256x128x128x128_16x16_32x32_2x2_8x32x1_8x32x1_1x32x1x8_8_1x1_intrawave_v3,718.12,471.42,0.0
gfx942,304,5888,1536,4096,ck,0,1,100.369,a8w8_blockscale_1x128x128_256x128x128x128_16x16_32x32_2x2_8x32x1_8x32x1_1x32x1x8_8_1x1_intrawave_v3,738.16,483.18,0.0
gfx942,304,6016,1536,4096,ck,0,2,102.1546,a8w8_blockscale_1x128x128_256x128x128x128_16x16_32x32_2x2_8x32x1_8x32x1_1x32x1x8_8_1x1_intrawave_v3,741.02,483.72,0.0
gfx942,304,6144,1536,4096,ck,0,3,101.7078,a8w8_blockscale_1x128x128_256x128x128x128_16x16_32x32_2x2_8x32x1_8x32x1_1x32x1x8_8_1x1_intrawave_v3,760.11,494.87,0.0
gfx942,304,6272,1536,4096,ck,0,1,106.7998,a8w8_blockscale_1x128x128_256x128x128x128_16x16_32x32_2x2_8x32x1_8x32x1_1x32x1x8_8_1x1_intrawave_v3,738.95,479.86,0.0
gfx942,304,6400,1536,4096,ck,0,0,110.1158,a8w8_blockscale_1x128x128_256x128x128x128_16x16_32x32_2x2_8x32x1_8x32x1_1x32x1x8_8_1x1_intrawave_v3,731.33,473.74,0.0
gfx942,304,6528,1536,4096,ck,0,3,144.3609,a8w8_blockscale_1x128x128_256x128x128x128_16x16_32x32_2x2_8x32x1_8x32x1_1x32x1x8_8_1x1_intrawave_v3,569.0,367.72,0.0
gfx942,304,6656,1536,4096,ck,0,1,141.7863,a8w8_blockscale_1x128x128_256x128x128x128_16x16_32x32_2x2_8x32x1_8x32x1_1x32x1x8_8_1x1_intrawave_v3,590.69,380.87,0.0
gfx942,304,6784,1536,4096,ck,0,3,139.8279,a8w8_blockscale_1x128x128_256x128x128x128_16x16_32x32_2x2_8x32x1_8x32x1_1x32x1x8_8_1x1_intrawave_v3,610.48,392.76,0.0
gfx942,304,6912,1536,4096,ck,0,1,139.8419,a8w8_blockscale_1x128x128_256x128x128x128_16x16_32x32_2x2_8x32x1_8x32x1_1x32x1x8_8_1x1_intrawave_v3,621.94,399.28,0.0
gfx942,304,7040,1536,4096,ck,0,0,142.9164,a8w8_blockscale_1x128x128_256x128x128x128_16x16_32x32_2x2_8x32x1_8x32x1_1x32x1x8_8_1x1_intrawave_v3,619.83,397.11,0.0
gfx942,304,7168,1536,4096,ck,0,3,135.8498,a8w8_blockscale_1x128x128_256x128x128x128_16x16_32x32_2x2_8x32x1_8x32x1_1x32x1x8_8_1x1_intrawave_v3,663.93,424.53,0.0
gfx942,304,7296,1536,4096,ck,0,2,139.5045,a8w8_blockscale_1x128x128_256x128x128x128_16x16_32x32_2x2_8x32x1_8x32x1_1x32x1x8_8_1x1_intrawave_v3,658.08,419.98,0.0
gfx942,304,7424,1536,4096,ck,0,0,140.1239,a8w8_blockscale_1x128x128_256x128x128x128_16x16_32x32_2x2_8x32x1_8x32x1_1x32x1x8_8_1x1_intrawave_v3,666.66,424.67,0.0
gfx942,304,7552,1536,4096,ck,0,3,136.2497,a8w8_blockscale_1x128x128_256x128x128x128_16x16_32x32_2x2_8x32x1_8x32x1_1x32x1x8_8_1x1_intrawave_v3,697.44,443.48,0.0
gfx942,304,7680,1536,4096,ck,0,1,140.9223,a8w8_blockscale_1x128x128_256x128x128x128_16x16_32x32_2x2_8x32x1_8x32x1_1x32x1x8_8_1x1_intrawave_v3,685.75,435.29,0.0
gfx942,304,7808,1536,4096,ck,0,1,142.3979,a8w8_blockscale_1x128x128_256x128x128x128_16x16_32x32_2x2_8x32x1_8x32x1_1x32x1x8_8_1x1_intrawave_v3,689.95,437.22,0.0
gfx942,304,7936,1536,4096,ck,0,3,146.7048,a8w8_blockscale_1x128x128_256x128x128x128_16x16_32x32_2x2_8x32x1_8x32x1_1x32x1x8_8_1x1_intrawave_v3,680.67,430.64,0.0
gfx942,304,8064,1536,4096,ck,0,0,143.5935,a8w8_blockscale_1x128x128_256x128x128x128_16x16_32x32_2x2_8x32x1_8x32x1_1x32x1x8_8_1x1_intrawave_v3,706.64,446.36,0.0
gfx942,304,8192,1536,4096,ck,0,0,144.4723,a8w8_blockscale_1x128x128_256x128x128x128_16x16_32x32_2x2_8x32x1_8x32x1_1x32x1x8_8_1x1_intrawave_v3,713.49,449.99,0.0
gfx942,304,8320,1536,4096,ck,0,2,147.1976,a8w8_blockscale_1x128x128_256x128x128x128_16x16_32x32_2x2_8x32x1_8x32x1_1x32x1x8_8_1x1_intrawave_v3,711.22,447.9,0.0
gfx942,304,8704,1536,4096,ck,0,2,149.3086,a8w8_blockscale_1x128x128_256x128x128x128_16x16_32x32_2x2_8x32x1_8x32x1_1x32x1x8_8_1x1_intrawave_v3,733.53,460.0,0.0
gfx942,304,8832,1536,4096,ck,0,0,151.7984,a8w8_blockscale_1x128x128_256x128x128x128_16x16_32x32_2x2_8x32x1_8x32x1_1x32x1x8_8_1x1_intrawave_v3,732.1,458.5,0.0
gfx942,304,8960,1536,4096,ck,0,3,153.0454,a8w8_blockscale_1x128x128_256x128x128x128_16x16_32x32_2x2_8x32x1_8x32x1_1x32x1x8_8_1x1_intrawave_v3,736.66,460.76,0.0
gfx942,304,9216,1536,4096,ck,0,3,149.2239,a8w8_blockscale_1x128x128_256x128x128x128_16x16_32x32_2x2_8x32x1_8x32x1_1x32x1x8_8_1x1_intrawave_v3,777.11,484.85,0.0
gfx942,304,9344,1536,4096,ck,0,2,161.674,a8w8_blockscale_1x128x128_256x128x128x128_16x16_32x32_2x2_8x32x1_8x32x1_1x32x1x8_8_1x1_intrawave_v3,727.23,453.19,0.0
gfx942,304,9472,1536,4096,ck,0,3,163.0999,a8w8_blockscale_1x128x128_256x128x128x128_16x16_32x32_2x2_8x32x1_8x32x1_1x32x1x8_8_1x1_intrawave_v3,730.75,454.85,0.0
gfx942,304,9856,1536,4096,ck,0,3,180.9683,a8w8_blockscale_1x128x128_256x128x128x128_16x16_32x32_2x2_8x32x1_8x32x1_1x32x1x8_8_1x1_intrawave_v3,685.3,425.15,0.0
gfx942,304,9984,1536,4096,ck,0,0,178.8131,a8w8_blockscale_1x128x128_256x128x128x128_16x16_32x32_2x2_8x32x1_8x32x1_1x32x1x8_8_1x1_intrawave_v3,702.56,435.41,0.0
gfx942,304,10112,1536,4096,ck,0,1,181.6882,a8w8_blockscale_1x128x128_256x128x128x128_16x16_32x32_2x2_8x32x1_8x32x1_1x32x1x8_8_1x1_intrawave_v3,700.31,433.57,0.0
gfx942,304,10240,1536,4096,ck,0,1,180.6725,a8w8_blockscale_1x128x128_256x128x128x128_16x16_32x32_2x2_8x32x1_8x32x1_1x32x1x8_8_1x1_intrawave_v3,713.16,441.08,0.0
gfx942,304,10624,1536,4096,ck,0,0,184.5561,a8w8_blockscale_1x128x128_256x128x128x128_16x16_32x32_2x2_8x32x1_8x32x1_1x32x1x8_8_1x1_intrawave_v3,724.34,446.72,0.0
gfx942,304,10752,1536,4096,ck,0,1,186.2303,a8w8_blockscale_1x128x128_256x128x128x128_16x16_32x32_2x2_8x32x1_8x32x1_1x32x1x8_8_1x1_intrawave_v3,726.47,447.63,0.0
gfx942,304,10880,1536,4096,ck,0,1,188.3371,a8w8_blockscale_1x128x128_256x128x128x128_16x16_32x32_2x2_8x32x1_8x32x1_1x32x1x8_8_1x1_intrawave_v3,726.9,447.49,0.0
gfx942,304,11264,1536,4096,ck,0,1,192.5694,a8w8_blockscale_1x128x128_256x128x128x128_16x16_32x32_2x2_8x32x1_8x32x1_1x32x1x8_8_1x1_intrawave_v3,736.01,451.95,0.0
gfx942,304,11904,1536,4096,ck,0,1,197.6109,a8w8_blockscale_1x128x128_256x128x128x128_16x16_32x32_2x2_8x32x1_8x32x1_1x32x1x8_8_1x1_intrawave_v3,757.99,463.63,0.0
gfx942,304,12544,1536,4096,ck,0,3,207.101,a8w8_blockscale_1x128x128_256x128x128x128_16x16_32x32_2x2_8x32x1_8x32x1_1x32x1x8_8_1x1_intrawave_v3,762.14,464.54,0.0
gfx942,304,12800,1536,4096,ck,0,1,214.1464,a8w8_blockscale_1x128x128_256x128x128x128_16x16_32x32_2x2_8x32x1_8x32x1_1x32x1x8_8_1x1_intrawave_v3,752.11,457.83,0.0
gfx942,304,13312,1536,4096,ck,0,1,230.7181,a8w8_blockscale_1x128x128_256x128x128x128_16x16_32x32_2x2_8x32x1_8x32x1_1x32x1x8_8_1x1_intrawave_v3,726.01,440.85,0.0
gfx942,304,13824,1536,4096,ck,0,0,233.8128,a8w8_blockscale_1x128x128_256x128x128x128_16x16_32x32_2x2_8x32x1_8x32x1_1x32x1x8_8_1x1_intrawave_v3,743.95,450.71,0.0
gfx942,304,13952,1536,4096,ck,0,3,232.0296,a8w8_blockscale_1x128x128_256x128x128x128_16x16_32x32_2x2_8x32x1_8x32x1_1x32x1x8_8_1x1_intrawave_v3,756.61,458.13,0.0
gfx942,304,14208,1536,4096,ck,0,2,238.6988,a8w8_blockscale_1x128x128_256x128x128x128_16x16_32x32_2x2_8x32x1_8x32x1_1x32x1x8_8_1x1_intrawave_v3,748.97,453.02,0.0
gfx942,304,16384,1536,4096,ck,0,3,271.7477,a8w8_blockscale_1x128x128_256x128x128x128_16x16_32x32_2x2_8x32x1_8x32x1_1x32x1x8_8_1x1_intrawave_v3,758.64,455.32,0.0
gfx942,304,16,2560,4096,ck,8,1,14.8225,a8w8_blockscale_1x128x128_256x16x64x256_16x16_16x16_1x1_16x16x1_16x16x1_1x16x1x16_4_1x1_intrawave_v1,22.64,717.37,0.0
gfx942,304,32,2560,4096,ck,8,1,14.7794,a8w8_blockscale_1x128x128_256x16x64x256_16x16_16x16_1x1_16x16x1_16x16x1_1x16x1x16_4_1x1_intrawave_v1,45.41,729.44,0.0
gfx942,304,48,2560,4096,ck,8,1,14.6312,a8w8_blockscale_1x128x128_256x16x64x256_16x16_16x16_1x1_16x16x1_16x16x1_1x16x1x16_4_1x1_intrawave_v1,68.8,746.91,0.0
gfx942,304,64,2560,4096,ck,8,3,14.5049,a8w8_blockscale_1x128x128_256x16x64x256_16x16_16x16_1x1_16x16x1_16x16x1_1x16x1x16_4_1x1_intrawave_v1,92.53,763.58,0.0
gfx942,304,80,2560,4096,ck,8,1,14.682,a8w8_blockscale_1x128x128_256x16x64x256_16x16_16x16_1x1_16x16x1_16x16x1_1x16x1x16_4_1x1_intrawave_v1,114.27,764.41,0.0
gfx942,304,96,2560,4096,ck,8,1,14.7564,a8w8_blockscale_1x128x128_256x16x64x256_16x16_16x16_1x1_16x16x1_16x16x1_1x16x1x16_4_1x1_intrawave_v1,136.43,770.55,0.0
gfx942,304,112,2560,4096,ck,8,3,14.6984,a8w8_blockscale_1x128x128_256x16x64x256_16x16_16x16_1x1_16x16x1_16x16x1_1x16x1x16_4_1x1_intrawave_v1,159.8,783.62,0.0
gfx942,304,128,2560,4096,ck,18,3,18.4638,a8w8_blockscale_1x128x128_256x64x64x256_16x16_32x32_1x1_16x16x1_16x16x1_1x32x1x8_8_1x1_intrawave_v1,145.38,631.8,0.0
gfx942,304,144,2560,4096,ck,18,3,20.4225,a8w8_blockscale_1x128x128_256x64x64x256_16x16_32x32_1x1_16x16x1_16x16x1_1x32x1x8_8_1x1_intrawave_v1,147.87,578.42,0.0
gfx942,304,160,2560,4096,ck,18,1,20.3921,a8w8_blockscale_1x128x128_256x64x64x256_16x16_32x32_1x1_16x16x1_16x16x1_1x32x1x8_8_1x1_intrawave_v1,164.55,586.52,0.0
gfx942,304,176,2560,4096,ck,18,2,20.2484,a8w8_blockscale_1x128x128_256x64x64x256_16x16_32x32_1x1_16x16x1_16x16x1_1x32x1x8_8_1x1_intrawave_v1,182.29,597.96,0.0
gfx942,304,192,2560,4096,ck,18,2,18.5112,a8w8_blockscale_1x128x128_256x64x64x256_16x16_32x32_1x1_16x16x1_16x16x1_1x32x1x8_8_1x1_intrawave_v1,217.52,662.04,0.0
gfx942,304,208,2560,4096,ck,18,1,20.5215,a8w8_blockscale_1x128x128_256x64x64x256_16x16_32x32_1x1_16x16x1_16x16x1_1x32x1x8_8_1x1_intrawave_v1,212.56,604.38,0.0
gfx942,304,224,2560,4096,ck,18,1,20.5555,a8w8_blockscale_1x128x128_256x64x64x256_16x16_32x32_1x1_16x16x1_16x16x1_1x32x1x8_8_1x1_intrawave_v1,228.53,610.55,0.0
gfx942,304,240,2560,4096,ck,18,3,20.9277,a8w8_blockscale_1x128x128_256x64x64x256_16x16_32x32_1x1_16x16x1_16x16x1_1x32x1x8_8_1x1_intrawave_v1,240.5,606.74,0.0
gfx942,304,256,2560,4096,ck,18,3,18.614,a8w8_blockscale_1x128x128_256x64x64x256_16x16_32x32_1x1_16x16x1_16x16x1_1x32x1x8_8_1x1_intrawave_v1,288.42,690.07,0.0
gfx942,304,288,2560,4096,ck,18,3,21.3331,a8w8_blockscale_1x128x128_256x64x64x256_16x16_32x32_1x1_16x16x1_16x16x1_1x32x1x8_8_1x1_intrawave_v1,283.12,615.94,0.0
gfx942,304,320,2560,4096,ck,18,3,19.128,a8w8_blockscale_1x128x128_256x64x64x256_16x16_32x32_1x1_16x16x1_16x16x1_1x32x1x8_8_1x1_intrawave_v1,350.84,702.37,0.0
gfx942,304,352,2560,4096,ck,18,0,23.1768,a8w8_blockscale_1x128x128_256x64x64x256_16x16_32x32_1x1_16x16x1_16x16x1_1x32x1x8_8_1x1_intrawave_v1,318.51,592.39,0.0
gfx942,304,384,2560,4096,ck,18,2,21.1229,a8w8_blockscale_1x128x128_256x64x64x256_16x16_32x32_1x1_16x16x1_16x16x1_1x32x1x8_8_1x1_intrawave_v1,381.25,663.96,0.0
gfx942,304,416,2560,4096,ck,18,0,25.9179,a8w8_blockscale_1x128x128_256x64x64x256_16x16_32x32_1x1_16x16x1_16x16x1_1x32x1x8_8_1x1_intrawave_v1,336.61,552.5,0.0
gfx942,304,448,2560,4096,ck,18,2,23.0856,a8w8_blockscale_1x128x128_256x64x64x256_16x16_32x32_1x1_16x16x1_16x16x1_1x32x1x8_8_1x1_intrawave_v1,406.97,633.06,0.0
gfx942,304,480,2560,4096,ck,12,0,28.2698,a8w8_blockscale_1x128x128_256x32x128x256_16x16_32x32_1x1_16x16x1_16x16x1_1x32x1x8_8_1x1_intrawave_v1,356.08,527.4,0.0
gfx942,304,512,2560,4096,ck,3,0,32.1274,a8w8_blockscale_1x128x128_256x64x64x128_16x16_32x32_1x1_8x32x1_8x32x1_1x32x1x8_8_1x1_intrawave_v3,334.21,473.25,0.0
gfx942,304,544,2560,4096,ck,3,2,34.6858,a8w8_blockscale_1x128x128_256x64x64x128_16x16_32x32_1x1_8x32x1_8x32x1_1x32x1x8_8_1x1_intrawave_v3,328.91,446.85,0.0
gfx942,304,576,2560,4096,ck,2,2,38.8899,a8w8_blockscale_1x128x128_256x64x128x128_16x16_32x32_1x2_8x32x1_8x32x1_1x32x1x8_8_1x1_intrawave_v3,310.61,406.13,0.0
gfx942,304,608,2560,4096,ck,2,0,35.6825,a8w8_blockscale_1x128x128_256x64x128x128_16x16_32x32_1x2_8x32x1_8x32x1_1x32x1x8_8_1x1_intrawave_v3,357.34,450.9,0.0
gfx942,304,640,2560,4096,ck,3,1,37.4465,a8w8_blockscale_1x128x128_256x64x64x128_16x16_32x32_1x1_8x32x1_8x32x1_1x32x1x8_8_1x1_intrawave_v3,358.43,437.53,0.0
gfx942,304,672,2560,4096,ck,2,3,35.8527,a8w8_blockscale_1x128x128_256x64x128x128_16x16_32x32_1x2_8x32x1_8x32x1_1x32x1x8_8_1x1_intrawave_v3,393.08,465.21,0.0
gfx942,304,704,2560,4096,ck,3,1,38.9981,a8w8_blockscale_1x128x128_256x64x64x128_16x16_32x32_1x1_8x32x1_8x32x1_1x32x1x8_8_1x1_intrawave_v3,378.58,435.25,0.0
gfx942,304,736,2560,4096,ck,2,2,36.7043,a8w8_blockscale_1x128x128_256x64x128x128_16x16_32x32_1x2_8x32x1_8x32x1_1x32x1x8_8_1x1_intrawave_v3,420.52,470.48,0.0
gfx942,304,768,2560,4096,ck,3,0,39.5341,a8w8_blockscale_1x128x128_256x64x64x128_16x16_32x32_1x1_8x32x1_8x32x1_1x32x1x8_8_1x1_intrawave_v3,407.4,444.27,0.0
gfx942,304,800,2560,4096,ck,2,1,39.3471,a8w8_blockscale_1x128x128_256x64x128x128_16x16_32x32_1x2_8x32x1_8x32x1_1x32x1x8_8_1x1_intrawave_v3,426.39,453.87,0.0
gfx942,304,832,2560,4096,ck,18,0,41.3384,a8w8_blockscale_1x128x128_256x64x64x256_16x16_32x32_1x1_16x16x1_16x16x1_1x32x1x8_8_1x1_intrawave_v1,422.08,439.14,0.0
gfx942,304,864,2560,4096,ck,2,1,39.1292,a8w8_blockscale_1x128x128_256x64x128x128_16x16_32x32_1x2_8x32x1_8x32x1_1x32x1x8_8_1x1_intrawave_v3,463.07,471.47,0.0
gfx942,304,896,2560,4096,ck,2,2,41.8086,a8w8_blockscale_1x128x128_256x64x128x128_16x16_32x32_1x2_8x32x1_8x32x1_1x32x1x8_8_1x1_intrawave_v3,449.44,448.31,0.0
gfx942,304,928,2560,4096,ck,2,2,39.5975,a8w8_blockscale_1x128x128_256x64x128x128_16x16_32x32_1x2_8x32x1_8x32x1_1x32x1x8_8_1x1_intrawave_v3,491.48,480.79,0.0
gfx942,304,960,2560,4096,ck,2,0,43.5924,a8w8_blockscale_1x128x128_256x64x128x128_16x16_32x32_1x2_8x32x1_8x32x1_1x32x1x8_8_1x1_intrawave_v3,461.84,443.5,0.0
gfx942,304,992,2560,4096,ck,0,1,51.5411,a8w8_blockscale_1x128x128_256x128x128x128_16x16_32x32_2x2_8x32x1_8x32x1_1x32x1x8_8_1x1_intrawave_v3,403.63,380.82,0.0
gfx942,304,1024,2560,4096,ck,2,0,54.4762,a8w8_blockscale_1x128x128_256x64x128x128_16x16_32x32_1x2_8x32x1_8x32x1_1x32x1x8_8_1x1_intrawave_v3,394.21,365.72,0.0
gfx942,304,1088,2560,4096,ck,0,2,51.7134,a8w8_blockscale_1x128x128_256x128x128x128_16x16_32x32_2x2_8x32x1_8x32x1_1x32x1x8_8_1x1_intrawave_v3,441.22,396.66,0.0
gfx942,304,1152,2560,4096,ck,0,0,56.8849,a8w8_blockscale_1x128x128_256x128x128x128_16x16_32x32_2x2_8x32x1_8x32x1_1x32x1x8_8_1x1_intrawave_v3,424.7,370.97,0.0
gfx942,304,1216,2560,4096,ck,0,2,52.7692,a8w8_blockscale_1x128x128_256x128x128x128_16x16_32x32_2x2_8x32x1_8x32x1_1x32x1x8_8_1x1_intrawave_v3,483.26,411.08,0.0
gfx942,304,1280,2560,4096,ck,0,1,58.1099,a8w8_blockscale_1x128x128_256x128x128x128_16x16_32x32_2x2_8x32x1_8x32x1_1x32x1x8_8_1x1_intrawave_v3,461.94,383.45,0.0
gfx942,304,1344,2560,4096,ck,0,0,55.529,a8w8_blockscale_1x128x128_256x128x128x128_16x16_32x32_2x2_8x32x1_8x32x1_1x32x1x8_8_1x1_intrawave_v3,507.59,411.89,0.0
gfx942,304,1408,2560,4096,ck,0,2,59.124,a8w8_blockscale_1x128x128_256x128x128x128_16x16_32x32_2x2_8x32x1_8x32x1_1x32x1x8_8_1x1_intrawave_v3,499.42,396.83,0.0
gfx942,304,1472,2560,4096,ck,0,2,56.5117,a8w8_blockscale_1x128x128_256x128x128x128_16x16_32x32_2x2_8x32x1_8x32x1_1x32x1x8_8_1x1_intrawave_v3,546.26,425.61,0.0
gfx942,304,1536,2560,4096,ck,0,2,60.3117,a8w8_blockscale_1x128x128_256x128x128x128_16x16_32x32_2x2_8x32x1_8x32x1_1x32x1x8_8_1x1_intrawave_v3,534.1,408.57,0.0
gfx942,304,1600,2560,4096,ck,0,3,59.1131,a8w8_blockscale_1x128x128_256x128x128x128_16x16_32x32_2x2_8x32x1_8x32x1_1x32x1x8_8_1x1_intrawave_v3,567.63,426.83,0.0
gfx942,304,1664,2560,4096,ck,0,0,62.4121,a8w8_blockscale_1x128x128_256x128x128x128_16x16_32x32_2x2_8x32x1_8x32x1_1x32x1x8_8_1x1_intrawave_v3,559.13,413.72,0.0
gfx942,304,1728,2560,4096,ck,0,1,59.6849,a8w8_blockscale_1x128x128_256x128x128x128_16x16_32x32_2x2_8x32x1_8x32x1_1x32x1x8_8_1x1_intrawave_v3,607.17,442.51,0.0
gfx942,304,1792,2560,4096,ck,0,0,63.9157,a8w8_blockscale_1x128x128_256x128x128x128_16x16_32x32_2x2_8x32x1_8x32x1_1x32x1x8_8_1x1_intrawave_v3,587.98,422.44,0.0
gfx942,304,1856,2560,4096,ck,0,3,60.8889,a8w8_blockscale_1x128x128_256x128x128x128_16x16_32x32_2x2_8x32x1_8x32x1_1x32x1x8_8_1x1_intrawave_v3,639.25,453.13,0.0
gfx942,304,1920,2560,4096,ck,0,3,64.7224,a8w8_blockscale_1x128x128_256x128x128x128_16x16_32x32_2x2_8x32x1_8x32x1_1x32x1x8_8_1x1_intrawave_v3,622.12,435.41,0.0
gfx942,304,1984,2560,4096,ck,0,0,77.2794,a8w8_blockscale_1x128x128_256x128x128x128_16x16_32x32_2x2_8x32x1_8x32x1_1x32x1x8_8_1x1_intrawave_v3,538.4,372.29,0.0
gfx942,304,2048,2560,4096,ck,0,3,79.9755,a8w8_blockscale_1x128x128_256x128x128x128_16x16_32x32_2x2_8x32x1_8x32x1_1x32x1x8_8_1x1_intrawave_v3,537.04,367.11,0.0
gfx942,304,2112,2560,4096,ck,0,2,88.4854,a8w8_blockscale_1x128x128_256x128x128x128_16x16_32x32_2x2_8x32x1_8x32x1_1x32x1x8_8_1x1_intrawave_v3,500.56,338.47,0.0
gfx942,304,2176,2560,4096,ck,0,1,86.7479,a8w8_blockscale_1x128x128_256x128x128x128_16x16_32x32_2x2_8x32x1_8x32x1_1x32x1x8_8_1x1_intrawave_v3,526.05,352.05,0.0
gfx942,304,2240,2560,4096,ck,0,3,85.7395,a8w8_blockscale_1x128x128_256x128x128x128_16x16_32x32_2x2_8x32x1_8x32x1_1x32x1x8_8_1x1_intrawave_v3,547.89,363.07,0.0
gfx942,304,2304,2560,4096,ck,0,3,85.5129,a8w8_blockscale_1x128x128_256x128x128x128_16x16_32x32_2x2_8x32x1_8x32x1_1x32x1x8_8_1x1_intrawave_v3,565.04,370.93,0.0
gfx942,304,2432,2560,4096,ck,0,3,85.0284,a8w8_blockscale_1x128x128_256x128x128x128_16x16_32x32_2x2_8x32x1_8x32x1_1x32x1x8_8_1x1_intrawave_v3,599.83,386.92,0.0
gfx942,304,2496,2560,4096,ck,0,2,85.8616,a8w8_blockscale_1x128x128_256x128x128x128_16x16_32x32_2x2_8x32x1_8x32x1_1x32x1x8_8_1x1_intrawave_v3,609.64,390.03,0.0
gfx942,304,2560,2560,4096,ck,0,2,87.0202,a8w8_blockscale_1x128x128_256x128x128x128_16x16_32x32_2x2_8x32x1_8x32x1_1x32x1x8_8_1x1_intrawave_v3,616.95,391.62,0.0
gfx942,304,2624,2560,4096,ck,0,1,87.9566,a8w8_blockscale_1x128x128_256x128x128x128_16x16_32x32_2x2_8x32x1_8x32x1_1x32x1x8_8_1x1_intrawave_v3,625.64,394.16,0.0
gfx942,304,2688,2560,4096,ck,0,0,88.2291,a8w8_blockscale_1x128x128_256x128x128x128_16x16_32x32_2x2_8x32x1_8x32x1_1x32x1x8_8_1x1_intrawave_v3,638.92,399.62,0.0
gfx942,304,2752,2560,4096,ck,0,0,87.2767,a8w8_blockscale_1x128x128_256x128x128x128_16x16_32x32_2x2_8x32x1_8x32x1_1x32x1x8_8_1x1_intrawave_v3,661.27,410.74,0.0
gfx942,304,2816,2560,4096,ck,0,0,90.0359,a8w8_blockscale_1x128x128_256x128x128x128_16x16_32x32_2x2_8x32x1_8x32x1_1x32x1x8_8_1x1_intrawave_v3,655.91,404.71,0.0
gfx942,304,2880,2560,4096,ck,0,3,89.8246,a8w8_blockscale_1x128x128_256x128x128x128_16x16_32x32_2x2_8x32x1_8x32x1_1x32x1x8_8_1x1_intrawave_v3,672.4,412.22,0.0
gfx942,304,2944,2560,4096,ck,0,3,90.3347,a8w8_blockscale_1x128x128_256x128x128x128_16x16_32x32_2x2_8x32x1_8x32x1_1x32x1x8_8_1x1_intrawave_v3,683.46,416.43,0.0
gfx942,304,3008,2560,4096,ck,0,3,92.5154,a8w8_blockscale_1x128x128_256x128x128x128_16x16_32x32_2x2_8x32x1_8x32x1_1x32x1x8_8_1x1_intrawave_v3,681.86,412.99,0.0
gfx942,304,3072,2560,4096,ck,0,3,90.3238,a8w8_blockscale_1x128x128_256x128x128x128_16x16_32x32_2x2_8x32x1_8x32x1_1x32x1x8_8_1x1_intrawave_v3,713.26,429.54,0.0
gfx942,304,3136,2560,4096,ck,0,2,97.0456,a8w8_blockscale_1x128x128_256x128x128x128_16x16_32x32_2x2_8x32x1_8x32x1_1x32x1x8_8_1x1_intrawave_v3,677.69,405.86,0.0
gfx942,304,3200,2560,4096,ck,0,0,94.7394,a8w8_blockscale_1x128x128_256x128x128x128_16x16_32x32_2x2_8x32x1_8x32x1_1x32x1x8_8_1x1_intrawave_v3,708.35,421.97,0.0
gfx942,304,3264,2560,4096,ck,0,3,94.1132,a8w8_blockscale_1x128x128_256x128x128x128_16x16_32x32_2x2_8x32x1_8x32x1_1x32x1x8_8_1x1_intrawave_v3,727.33,431.04,0.0
gfx942,304,3328,2560,4096,ck,0,0,100.2396,a8w8_blockscale_1x128x128_256x128x128x128_16x16_32x32_2x2_8x32x1_8x32x1_1x32x1x8_8_1x1_intrawave_v3,696.26,410.58,0.0
gfx942,304,3392,2560,4096,ck,0,2,94.8242,a8w8_blockscale_1x128x128_256x128x128x128_16x16_32x32_2x2_8x32x1_8x32x1_1x32x1x8_8_1x1_intrawave_v3,750.18,440.25,0.0
gfx942,304,3456,2560,4096,ck,0,2,99.9261,a8w8_blockscale_1x128x128_256x128x128x128_16x16_32x32_2x2_8x32x1_8x32x1_1x32x1x8_8_1x1_intrawave_v3,725.31,423.68,0.0
gfx942,304,3520,2560,4096,ck,0,2,98.3782,a8w8_blockscale_1x128x128_256x128x128x128_16x16_32x32_2x2_8x32x1_8x32x1_1x32x1x8_8_1x1_intrawave_v3,750.37,436.34,0.0
gfx942,304,3584,2560,4096,ck,0,2,103.9487,a8w8_blockscale_1x128x128_256x128x128x128_16x16_32x32_2x2_8x32x1_8x32x1_1x32x1x8_8_1x1_intrawave_v3,723.07,418.63,0.0
gfx942,304,3648,2560,4096,ck,0,2,103.1267,a8w8_blockscale_1x128x128_256x128x128x128_16x16_32x32_2x2_8x32x1_8x32x1_1x32x1x8_8_1x1_intrawave_v3,741.85,427.68,0.0
gfx942,304,3712,2560,4096,ck,0,2,104.4562,a8w8_blockscale_1x128x128_256x128x128x128_16x16_32x32_2x2_8x32x1_8x32x1_1x32x1x8_8_1x1_intrawave_v3,745.25,427.89,0.0
gfx942,304,3776,2560,4096,ck,0,2,106.1067,a8w8_blockscale_1x128x128_256x128x128x128_16x16_32x32_2x2_8x32x1_8x32x1_1x32x1x8_8_1x1_intrawave_v3,746.31,426.79,0.0
gfx942,304,3840,2560,4096,ck,0,2,106.5354,a8w8_blockscale_1x128x128_256x128x128x128_16x16_32x32_2x2_8x32x1_8x32x1_1x32x1x8_8_1x1_intrawave_v3,755.9,430.61,0.0
gfx942,304,3904,2560,4096,ck,2,0,143.1153,a8w8_blockscale_1x128x128_256x64x128x128_16x16_32x32_1x2_8x32x1_8x32x1_1x32x1x8_8_1x1_intrawave_v3,572.08,324.67,0.0
gfx942,304,3968,2560,4096,ck,0,3,142.5188,a8w8_blockscale_1x128x128_256x128x128x128_16x16_32x32_2x2_8x32x1_8x32x1_1x32x1x8_8_1x1_intrawave_v3,583.89,330.17,0.0
gfx942,304,4032,2560,4096,ck,0,0,141.0837,a8w8_blockscale_1x128x128_256x128x128x128_16x16_32x32_2x2_8x32x1_8x32x1_1x32x1x8_8_1x1_intrawave_v3,599.34,337.71,0.0
gfx942,304,4096,2560,4096,ck,0,0,138.5365,a8w8_blockscale_1x128x128_256x128x128x128_16x16_32x32_2x2_8x32x1_8x32x1_1x32x1x8_8_1x1_intrawave_v3,620.05,348.17,0.0
gfx942,304,4224,2560,4096,ck,0,2,140.2741,a8w8_blockscale_1x128x128_256x128x128x128_16x16_32x32_2x2_8x32x1_8x32x1_1x32x1x8_8_1x1_intrawave_v3,631.5,352.27,0.0
gfx942,304,4352,2560,4096,ck,0,0,137.9165,a8w8_blockscale_1x128x128_256x128x128x128_16x16_32x32_2x2_8x32x1_8x32x1_1x32x1x8_8_1x1_intrawave_v3,661.76,366.84,0.0
gfx942,304,4480,2560,4096,ck,0,0,136.7299,a8w8_blockscale_1x128x128_256x128x128x128_16x16_32x32_2x2_8x32x1_8x32x1_1x32x1x8_8_1x1_intrawave_v3,687.14,378.65,0.0
gfx942,304,4608,2560,4096,ck,0,1,139.4346,a8w8_blockscale_1x128x128_256x128x128x128_16x16_32x32_2x2_8x32x1_8x32x1_1x32x1x8_8_1x1_intrawave_v3,693.06,379.77,0.0
gfx942,304,4736,2560,4096,ck,0,3,140.4779,a8w8_blockscale_1x128x128_256x128x128x128_16x16_32x32_2x2_8x32x1_8x32x1_1x32x1x8_8_1x1_intrawave_v3,707.02,385.35,0.0
gfx942,304,4864,2560,4096,ck,0,0,142.1484,a8w8_blockscale_1x128x128_256x128x128x128_16x16_32x32_2x2_8x32x1_8x32x1_1x32x1x8_8_1x1_intrawave_v3,717.6,389.12,0.0
gfx942,304,4992,2560,4096,ck,0,0,142.4994,a8w8_blockscale_1x128x128_256x128x128x128_16x16_32x32_2x2_8x32x1_8x32x1_1x32x1x8_8_1x1_intrawave_v3,734.67,396.44,0.0
gfx942,304,5120,2560,4096,ck,0,0,146.5538,a8w8_blockscale_1x128x128_256x128x128x128_16x16_32x32_2x2_8x32x1_8x32x1_1x32x1x8_8_1x1_intrawave_v3,732.66,393.52,0.0
gfx942,304,5248,2560,4096,ck,0,2,146.5585,a8w8_blockscale_1x128x128_256x128x128x128_16x16_32x32_2x2_8x32x1_8x32x1_1x32x1x8_8_1x1_intrawave_v3,750.95,401.56,0.0
gfx942,304,5376,2560,4096,ck,0,3,149.9943,a8w8_blockscale_1x128x128_256x128x128x128_16x16_32x32_2x2_8x32x1_8x32x1_1x32x1x8_8_1x1_intrawave_v3,751.65,400.22,0.0
gfx942,304,5504,2560,4096,ck,0,1,148.699,a8w8_blockscale_1x128x128_256x128x128x128_16x16_32x32_2x2_8x32x1_8x32x1_1x32x1x8_8_1x1_intrawave_v3,776.25,411.64,0.0
gfx942,304,5632,2560,4096,ck,0,3,152.6065,a8w8_blockscale_1x128x128_256x128x128x128_16x16_32x32_2x2_8x32x1_8x32x1_1x32x1x8_8_1x1_intrawave_v3,773.96,408.83,0.0
gfx942,304,5760,2560,4096,ck,0,0,155.2228,a8w8_blockscale_1x128x128_256x128x128x128_16x16_32x32_2x2_8x32x1_8x32x1_1x32x1x8_8_1x1_intrawave_v3,778.21,409.54,0.0
gfx942,304,5888,2560,4096,ck,0,3,179.5924,a8w8_blockscale_1x128x128_256x128x128x128_16x16_32x32_2x2_8x32x1_8x32x1_1x32x1x8_8_1x1_intrawave_v3,687.56,360.54,0.0
gfx942,304,6016,2560,4096,ck,0,2,179.2685,a8w8_blockscale_1x128x128_256x128x128x128_16x16_32x32_2x2_8x32x1_8x32x1_1x32x1x8_8_1x1_intrawave_v3,703.77,367.77,0.0
gfx942,304,6144,2560,4096,ck,0,2,180.1106,a8w8_blockscale_1x128x128_256x128x128x128_16x16_32x32_2x2_8x32x1_8x32x1_1x32x1x8_8_1x1_intrawave_v3,715.39,372.6,0.0
gfx942,304,6272,2560,4096,ck,0,1,183.0504,a8w8_blockscale_1x128x128_256x128x128x128_16x16_32x32_2x2_8x32x1_8x32x1_1x32x1x8_8_1x1_intrawave_v3,718.56,373.06,0.0
gfx942,304,6400,2560,4096,ck,0,1,183.5861,a8w8_blockscale_1x128x128_256x128x128x128_16x16_32x32_2x2_8x32x1_8x32x1_1x32x1x8_8_1x1_intrawave_v3,731.09,378.4,0.0
gfx942,304,6528,2560,4096,ck,0,0,184.9058,a8w8_blockscale_1x128x128_256x128x128x128_16x16_32x32_2x2_8x32x1_8x32x1_1x32x1x8_8_1x1_intrawave_v3,740.39,382.07,0.0
gfx942,304,6656,2560,4096,ck,0,0,187.0812,a8w8_blockscale_1x128x128_256x128x128x128_16x16_32x32_2x2_8x32x1_8x32x1_1x32x1x8_8_1x1_intrawave_v3,746.13,383.94,0.0
gfx942,304,6784,2560,4096,ck,0,0,187.473,a8w8_blockscale_1x128x128_256x128x128x128_16x16_32x32_2x2_8x32x1_8x32x1_1x32x1x8_8_1x1_intrawave_v3,758.89,389.43,0.0
gfx942,304,6912,2560,4096,ck,0,2,193.2592,a8w8_blockscale_1x128x128_256x128x128x128_16x16_32x32_2x2_8x32x1_8x32x1_1x32x1x8_8_1x1_intrawave_v3,750.06,383.87,0.0
gfx942,304,7040,2560,4096,ck,0,3,192.3111,a8w8_blockscale_1x128x128_256x128x128x128_16x16_32x32_2x2_8x32x1_8x32x1_1x32x1x8_8_1x1_intrawave_v3,767.71,391.9,0.0
gfx942,304,7168,2560,4096,ck,0,2,197.8054,a8w8_blockscale_1x128x128_256x128x128x128_16x16_32x32_2x2_8x32x1_8x32x1_1x32x1x8_8_1x1_intrawave_v3,759.96,386.98,0.0
gfx942,304,7296,2560,4096,ck,0,1,199.9418,a8w8_blockscale_1x128x128_256x128x128x128_16x16_32x32_2x2_8x32x1_8x32x1_1x32x1x8_8_1x1_intrawave_v3,765.26,388.74,0.0
gfx942,304,7424,2560,4096,ck,0,3,202.2895,a8w8_blockscale_1x128x128_256x128x128x128_16x16_32x32_2x2_8x32x1_8x32x1_1x32x1x8_8_1x1_intrawave_v3,769.65,390.06,0.0
gfx942,304,7552,2560,4096,ck,0,1,201.7602,a8w8_blockscale_1x128x128_256x128x128x128_16x16_32x32_2x2_8x32x1_8x32x1_1x32x1x8_8_1x1_intrawave_v3,784.98,396.93,0.0
gfx942,304,7680,2560,4096,ck,0,0,206.6794,a8w8_blockscale_1x128x128_256x128x128x128_16x16_32x32_2x2_8x32x1_8x32x1_1x32x1x8_8_1x1_intrawave_v3,779.28,393.19,0.0
gfx942,304,7808,2560,4096,ck,0,1,228.037,a8w8_blockscale_1x128x128_256x128x128x128_16x16_32x32_2x2_8x32x1_8x32x1_1x32x1x8_8_1x1_intrawave_v3,718.07,361.54,0.0
gfx942,304,7936,2560,4096,ck,0,1,228.6075,a8w8_blockscale_1x128x128_256x128x128x128_16x16_32x32_2x2_8x32x1_8x32x1_1x32x1x8_8_1x1_intrawave_v3,728.02,365.8,0.0
gfx942,304,8064,2560,4096,ck,0,0,229.8525,a8w8_blockscale_1x128x128_256x128x128x128_16x16_32x32_2x2_8x32x1_8x32x1_1x32x1x8_8_1x1_intrawave_v3,735.75,368.95,0.0
gfx942,304,8192,2560,4096,ck,0,3,227.334,a8w8_blockscale_1x128x128_256x128x128x128_16x16_32x32_2x2_8x32x1_8x32x1_1x32x1x8_8_1x1_intrawave_v3,755.71,378.22,0.0
gfx942,304,8320,2560,4096,ck,0,1,232.9597,a8w8_blockscale_1x128x128_256x128x128x128_16x16_32x32_2x2_8x32x1_8x32x1_1x32x1x8_8_1x1_intrawave_v3,748.98,374.15,0.0
gfx942,304,8704,2560,4096,ck,0,2,238.5419,a8w8_blockscale_1x128x128_256x128x128x128_16x16_32x32_2x2_8x32x1_8x32x1_1x32x1x8_8_1x1_intrawave_v3,765.22,380.23,0.0
gfx942,304,8832,2560,4096,ck,0,1,241.7712,a8w8_blockscale_1x128x128_256x128x128x128_16x16_32x32_2x2_8x32x1_8x32x1_1x32x1x8_8_1x1_intrawave_v3,766.1,380.03,0.0
gfx942,304,8960,2560,4096,ck,0,3,248.6632,a8w8_blockscale_1x128x128_256x128x128x128_16x16_32x32_2x2_8x32x1_8x32x1_1x32x1x8_8_1x1_intrawave_v3,755.66,374.25,0.0
gfx942,304,9216,2560,4096,ck,0,3,245.7029,a8w8_blockscale_1x128x128_256x128x128x128_16x16_32x32_2x2_8x32x1_8x32x1_1x32x1x8_8_1x1_intrawave_v3,786.61,388.36,0.0
gfx942,304,9344,2560,4096,ck,0,1,250.334,a8w8_blockscale_1x128x128_256x128x128x128_16x16_32x32_2x2_8x32x1_8x32x1_1x32x1x8_8_1x1_intrawave_v3,782.79,385.88,0.0
gfx942,304,9472,2560,4096,ck,0,0,253.1115,a8w8_blockscale_1x128x128_256x128x128x128_16x16_32x32_2x2_8x32x1_8x32x1_1x32x1x8_8_1x1_intrawave_v3,784.8,386.31,0.0
gfx942,304,9856,2560,4096,ck,0,3,274.6639,a8w8_blockscale_1x128x128_256x128x128x128_16x16_32x32_2x2_8x32x1_8x32x1_1x32x1x8_8_1x1_intrawave_v3,752.54,368.88,0.0
gfx942,304,9984,2560,4096,ck,0,2,277.7264,a8w8_blockscale_1x128x128_256x128x128x128_16x16_32x32_2x2_8x32x1_8x32x1_1x32x1x8_8_1x1_intrawave_v3,753.91,369.06,0.0
gfx942,304,10112,2560,4096,ck,0,0,279.2448,a8w8_blockscale_1x128x128_256x128x128x128_16x16_32x32_2x2_8x32x1_8x32x1_1x32x1x8_8_1x1_intrawave_v3,759.42,371.28,0.0
gfx942,304,10240,2560,4096,ck,0,2,284.4621,a8w8_blockscale_1x128x128_256x128x128x128_16x16_32x32_2x2_8x32x1_8x32x1_1x32x1x8_8_1x1_intrawave_v3,754.93,368.62,0.0
gfx942,304,10624,2560,4096,ck,0,2,287.7181,a8w8_blockscale_1x128x128_256x128x128x128_16x16_32x32_2x2_8x32x1_8x32x1_1x32x1x8_8_1x1_intrawave_v3,774.37,376.75,0.0
gfx942,304,10752,2560,4096,ck,0,1,292.7218,a8w8_blockscale_1x128x128_256x128x128x128_16x16_32x32_2x2_8x32x1_8x32x1_1x32x1x8_8_1x1_intrawave_v3,770.31,374.34,0.0
gfx942,304,10880,2560,4096,ck,0,0,297.2195,a8w8_blockscale_1x128x128_256x128x128x128_16x16_32x32_2x2_8x32x1_8x32x1_1x32x1x8_8_1x1_intrawave_v3,767.68,372.64,0.0
gfx942,304,11264,2560,4096,ck,0,2,300.7229,a8w8_blockscale_1x128x128_256x128x128x128_16x16_32x32_2x2_8x32x1_8x32x1_1x32x1x8_8_1x1_intrawave_v3,785.52,380.07,0.0
gfx942,304,11904,2560,4096,ck,0,2,331.1525,a8w8_blockscale_1x128x128_256x128x128x128_16x16_32x32_2x2_8x32x1_8x32x1_1x32x1x8_8_1x1_intrawave_v3,753.87,362.95,0.0
gfx942,304,12544,2560,4096,ck,0,0,337.3955,a8w8_blockscale_1x128x128_256x128x128x128_16x16_32x32_2x2_8x32x1_8x32x1_1x32x1x8_8_1x1_intrawave_v3,779.7,373.72,0.0
gfx942,304,12800,2560,4096,ck,0,1,341.1121,a8w8_blockscale_1x128x128_256x128x128x128_16x16_32x32_2x2_8x32x1_8x32x1_1x32x1x8_8_1x1_intrawave_v3,786.94,376.56,0.0
gfx942,304,13312,2560,4096,ck,0,1,354.2023,a8w8_blockscale_1x128x128_256x128x128x128_16x16_32x32_2x2_8x32x1_8x32x1_1x32x1x8_8_1x1_intrawave_v3,788.17,375.97,0.0
gfx942,304,13824,2560,4096,ck,0,3,375.582,a8w8_blockscale_1x128x128_256x128x128x128_16x16_32x32_2x2_8x32x1_8x32x1_1x32x1x8_8_1x1_intrawave_v3,771.9,367.13,0.0
gfx942,304,13952,2560,4096,ck,0,2,376.0754,a8w8_blockscale_1x128x128_256x128x128x128_16x16_32x32_2x2_8x32x1_8x32x1_1x32x1x8_8_1x1_intrawave_v3,778.02,369.79,0.0
gfx942,304,14208,2560,4096,ck,0,1,380.589,a8w8_blockscale_1x128x128_256x128x128x128_16x16_32x32_2x2_8x32x1_8x32x1_1x32x1x8_8_1x1_intrawave_v3,782.9,371.6,0.0
gfx942,304,16384,2560,4096,ck,0,0,434.4723,a8w8_blockscale_1x128x128_256x128x128x128_16x16_32x32_2x2_8x32x1_8x32x1_1x32x1x8_8_1x1_intrawave_v3,790.84,371.67,0.0
gfx942,304,16,4096,128,ck,8,1,2.9007,a8w8_blockscale_1x128x128_256x16x64x256_16x16_16x16_1x1_16x16x1_16x16x1_1x16x1x16_4_1x1_intrawave_v1,5.78,226.64,0.0
gfx942,304,32,4096,128,ck,8,3,3.0901,a8w8_blockscale_1x128x128_256x16x64x256_16x16_16x16_1x1_16x16x1_16x16x1_1x16x1x16_4_1x1_intrawave_v1,10.86,255.83,0.0
gfx942,304,48,4096,128,ck,11,2,3.2368,a8w8_blockscale_1x128x128_256x32x64x128_16x16_16x16_2x1_8x32x1_8x32x1_1x32x1x8_8_2x1_intrawave_v1,15.55,285.36,0.0
gfx942,304,64,4096,128,ck,11,1,3.2044,a8w8_blockscale_1x128x128_256x32x64x128_16x16_16x16_2x1_8x32x1_8x32x1_1x32x1x8_8_2x1_intrawave_v1,20.94,329.79,0.0
gfx942,304,80,4096,128,ck,11,0,3.2489,a8w8_blockscale_1x128x128_256x32x64x128_16x16_16x16_2x1_8x32x1_8x32x1_1x32x1x8_8_2x1_intrawave_v1,25.82,366.24,0.0
gfx942,304,96,4096,128,ck,6,1,3.3351,a8w8_blockscale_1x128x128_256x16x64x128_8x16_16x16_1x1_16x16x1_8x32x1_1x16x1x16_4_1x1_intrawave_v1,30.18,396.69,0.0
gfx942,304,112,4096,128,ck,8,0,3.6807,a8w8_blockscale_1x128x128_256x16x64x256_16x16_16x16_1x1_16x16x1_16x16x1_1x16x1x16_4_1x1_intrawave_v1,31.91,395.61,0.0
gfx942,304,128,4096,128,ck,11,0,3.3343,a8w8_blockscale_1x128x128_256x32x64x128_16x16_16x16_2x1_8x32x1_8x32x1_1x32x1x8_8_2x1_intrawave_v1,40.25,476.64,0.0
gfx942,304,144,4096,128,ck,6,1,3.3848,a8w8_blockscale_1x128x128_256x16x64x128_8x16_16x16_1x1_16x16x1_8x32x1_1x16x1x16_4_1x1_intrawave_v1,44.61,508.85,0.0
gfx942,304,160,4096,128,ck,11,3,3.8029,a8w8_blockscale_1x128x128_256x32x64x128_16x16_16x16_2x1_8x32x1_8x32x1_1x32x1x8_8_2x1_intrawave_v1,44.12,487.91,0.0
gfx942,304,176,4096,128,ck,6,1,3.7462,a8w8_blockscale_1x128x128_256x16x64x128_8x16_16x16_1x1_16x16x1_8x32x1_1x16x1x16_4_1x1_intrawave_v1,49.26,530.83,0.0
gfx942,304,192,4096,128,ck,11,1,3.8996,a8w8_blockscale_1x128x128_256x32x64x128_16x16_16x16_2x1_8x32x1_8x32x1_1x32x1x8_8_2x1_intrawave_v1,51.63,544.09,0.0
gfx942,304,208,4096,128,ck,6,0,3.8434,a8w8_blockscale_1x128x128_256x16x64x128_8x16_16x16_1x1_16x16x1_8x32x1_1x16x1x16_4_1x1_intrawave_v1,56.75,586.68,0.0
gfx942,304,224,4096,128,ck,11,2,3.9931,a8w8_blockscale_1x128x128_256x32x64x128_16x16_16x16_2x1_8x32x1_8x32x1_1x32x1x8_8_2x1_intrawave_v1,58.82,598.02,0.0
gfx942,304,240,4096,128,ck,11,2,4.0772,a8w8_blockscale_1x128x128_256x32x64x128_16x16_16x16_2x1_8x32x1_8x32x1_1x32x1x8_8_2x1_intrawave_v1,61.72,618.34,0.0
gfx942,304,256,4096,128,ck,16,0,4.1261,a8w8_blockscale_1x128x128_256x64x64x128_16x16_32x32_1x1_8x32x1_8x32x1_1x32x1x8_8_1x1_intrawave_v1,65.06,643.27,0.0
gfx942,304,288,4096,128,ck,6,2,4.3339,a8w8_blockscale_1x128x128_256x16x64x128_8x16_16x16_1x1_16x16x1_8x32x1_1x16x1x16_4_1x1_intrawave_v1,69.68,673.86,0.0
gfx942,304,320,4096,128,ck,6,1,4.6769,a8w8_blockscale_1x128x128_256x16x64x128_8x16_16x16_1x1_16x16x1_8x32x1_1x16x1x16_4_1x1_intrawave_v1,71.75,681.37,0.0
gfx942,304,352,4096,128,ck,11,0,4.7548,a8w8_blockscale_1x128x128_256x32x64x128_16x16_16x16_2x1_8x32x1_8x32x1_1x32x1x8_8_2x1_intrawave_v1,77.63,726.2,0.0
gfx942,304,384,4096,128,ck,6,1,5.1063,a8w8_blockscale_1x128x128_256x16x64x128_8x16_16x16_1x1_16x16x1_8x32x1_1x16x1x16_4_1x1_intrawave_v1,78.85,728.35,0.0
gfx942,304,416,4096,128,ck,6,1,5.2685,a8w8_blockscale_1x128x128_256x16x64x128_8x16_16x16_1x1_16x16x1_8x32x1_1x16x1x16_4_1x1_intrawave_v1,82.8,756.46,0.0
gfx942,304,448,4096,128,ck,11,1,4.9964,a8w8_blockscale_1x128x128_256x32x64x128_16x16_16x16_2x1_8x32x1_8x32x1_1x32x1x8_8_2x1_intrawave_v1,94.02,850.94,0.0
gfx942,304,480,4096,128,ck,16,0,5.5063,a8w8_blockscale_1x128x128_256x64x64x128_16x16_32x32_1x1_8x32x1_8x32x1_1x32x1x8_8_1x1_intrawave_v1,91.41,820.49,0.0
gfx942,304,512,4096,128,ck,11,1,5.4772,a8w8_blockscale_1x128x128_256x32x64x128_16x16_16x16_2x1_8x32x1_8x32x1_1x32x1x8_8_2x1_intrawave_v1,98.02,873.46,0.0
gfx942,304,544,4096,128,ck,16,3,5.6783,a8w8_blockscale_1x128x128_256x64x64x128_16x16_32x32_1x1_8x32x1_8x32x1_1x32x1x8_8_1x1_intrawave_v1,100.46,889.42,0.0
gfx942,304,576,4096,128,ck,11,0,5.6447,a8w8_blockscale_1x128x128_256x32x64x128_16x16_16x16_2x1_8x32x1_8x32x1_1x32x1x8_8_2x1_intrawave_v1,107.0,941.88,0.0
gfx942,304,608,4096,128,ck,11,3,6.1339,a8w8_blockscale_1x128x128_256x32x64x128_16x16_16x16_2x1_8x32x1_8x32x1_1x32x1x8_8_2x1_intrawave_v1,103.94,910.16,0.0
gfx942,304,640,4096,128,ck,11,2,6.2122,a8w8_blockscale_1x128x128_256x32x64x128_16x16_16x16_2x1_8x32x1_8x32x1_1x32x1x8_8_2x1_intrawave_v1,108.03,941.55,0.0
gfx942,304,672,4096,128,ck,11,0,6.2587,a8w8_blockscale_1x128x128_256x32x64x128_16x16_16x16_2x1_8x32x1_8x32x1_1x32x1x8_8_2x1_intrawave_v1,112.59,977.09,0.0
gfx942,304,704,4096,128,ck,11,2,6.4474,a8w8_blockscale_1x128x128_256x32x64x128_16x16_16x16_2x1_8x32x1_8x32x1_1x32x1x8_8_2x1_intrawave_v1,114.5,989.79,0.0
gfx942,304,736,4096,128,ck,11,3,6.6458,a8w8_blockscale_1x128x128_256x32x64x128_16x16_16x16_2x1_8x32x1_8x32x1_1x32x1x8_8_2x1_intrawave_v1,116.13,1000.3,0.0
gfx942,304,768,4096,128,ck,16,0,6.7575,a8w8_blockscale_1x128x128_256x64x64x128_16x16_32x32_1x1_8x32x1_8x32x1_1x32x1x8_8_1x1_intrawave_v1,119.17,1023.17,0.0
