aiter/configs/model_configs/a8w8_blockscale_bpreshuffle_tuned_gemm_qwen3_32b.csv
gfx,cu_num,M,N,K,libtype,kernelId,splitK,us,kernelName,tflops,bw,errRatio
gfx942,80,1,5120,8192,ck,7,3,25.2197,a8w8_blockscale_bpreshuffle_1x128x128_256x16x64x256_16x16_16x16_16x16x1_16x16x1_1x16x1x16_4_1x1_intrawave_v1,3.33,1663.84,0.0
gfx942,80,1,5120,25600,ck,7,2,69.8001,a8w8_blockscale_bpreshuffle_1x128x128_256x16x64x256_16x16_16x16_16x16x1_16x16x1_1x16x1x16_4_1x1_intrawave_v1,3.76,1878.33,0.0
gfx942,80,2,5120,8192,ck,7,2,25.2378,a8w8_blockscale_bpreshuffle_1x128x128_256x16x64x256_16x16_16x16_16x16x1_16x16x1_1x16x1x16_4_1x1_intrawave_v1,6.65,1663.37,0.0
gfx942,80,2,5120,25600,ck,7,1,69.6441,a8w8_blockscale_bpreshuffle_1x128x128_256x16x64x256_16x16_16x16_16x16x1_16x16x1_1x16x1x16_4_1x1_intrawave_v1,7.53,1883.06,0.0
gfx942,80,4,5120,8192,ck,7,0,25.1766,a8w8_blockscale_bpreshuffle_1x128x128_256x16x64x256_16x16_16x16_16x16x1_16x16x1_1x16x1x16_4_1x1_intrawave_v1,13.33,1668.88,0.0
gfx942,80,4,5120,25600,ck,7,0,69.8449,a8w8_blockscale_bpreshuffle_1x128x128_256x16x64x256_16x16_16x16_16x16x1_16x16x1_1x16x1x16_4_1x1_intrawave_v1,15.01,1878.67,0.0
gfx942,80,8,5120,8192,ck,7,2,25.3068,a8w8_blockscale_bpreshuffle_1x128x128_256x16x64x256_16x16_16x16_16x16x1_16x16x1_1x16x1x16_4_1x1_intrawave_v1,26.52,1663.21,0.0
gfx942,80,8,5120,25600,ck,7,1,70.5935,a8w8_blockscale_bpreshuffle_1x128x128_256x16x64x256_16x16_16x16_16x16x1_16x16x1_1x16x1x16_4_1x1_intrawave_v1,29.71,1860.78,0.0
gfx942,80,16,5120,8192,ck,7,0,21.3823,a8w8_blockscale_bpreshuffle_1x128x128_256x16x64x256_16x16_16x16_16x16x1_16x16x1_1x16x1x16_4_1x1_intrawave_v1,62.77,1975.37,0.0
gfx942,80,16,5120,25600,ck,7,0,59.6089,a8w8_blockscale_bpreshuffle_1x128x128_256x16x64x256_16x16_16x16_16x16x1_16x16x1_1x16x1x16_4_1x1_intrawave_v1,70.36,2208.49,0.0
gfx942,80,32,5120,8192,ck,12,1,25.5604,a8w8_blockscale_bpreshuffle_1x128x128_256x32x64x256_16x16_16x16_16x16x1_16x16x1_1x32x1x8_8_2x1_intrawave_v1,105.02,1664.01,0.0
gfx942,80,32,5120,25600,ck,12,1,69.6561,a8w8_blockscale_bpreshuffle_1x128x128_256x32x64x256_16x16_16x16_16x16x1_16x16x1_1x32x1x8_8_2x1_intrawave_v1,120.43,1898.17,0.0
gfx942,80,64,5120,8192,ck,11,1,36.6252,a8w8_blockscale_bpreshuffle_1x128x128_256x32x128x256_16x16_16x16_16x16x1_16x16x1_1x32x1x8_8_2x1_intrawave_v1,146.59,1177.4,0.0
gfx942,80,64,5120,25600,ck,11,2,101.6721,a8w8_blockscale_bpreshuffle_1x128x128_256x32x128x256_16x16_16x16_16x16x1_16x16x1_1x32x1x8_8_2x1_intrawave_v1,165.01,1311.72,0.0
gfx942,80,128,5120,8192,ck,9,3,57.0881,a8w8_blockscale_bpreshuffle_1x128x128_256x32x128x128_16x16_16x16_8x32x1_8x32x1_1x32x1x8_8_2x1_intrawave_v1,188.09,776.03,0.0
gfx942,80,128,5120,25600,ck,14,2,163.3863,a8w8_blockscale_bpreshuffle_1x128x128_256x64x128x128_16x16_16x16_8x32x1_8x32x1_1x32x1x8_8_2x1_intrawave_v1,205.37,830.3,0.0
gfx942,80,256,5120,8192,ck,14,0,89.2444,a8w8_blockscale_bpreshuffle_1x128x128_256x64x128x128_16x16_16x16_8x32x1_8x32x1_1x32x1x8_8_2x1_intrawave_v1,240.63,522.85,0.0
gfx942,80,256,5120,25600,ck,14,0,259.0343,a8w8_blockscale_bpreshuffle_1x128x128_256x64x128x128_16x16_16x16_8x32x1_8x32x1_1x32x1x8_8_2x1_intrawave_v1,259.07,541.42,0.0
gfx942,80,512,5120,8192,ck,13,2,159.5329,a8w8_blockscale_bpreshuffle_1x128x128_256x64x256x128_16x16_16x16_8x32x1_8x32x1_1x32x1x8_8_2x1_intrawave_v1,269.22,322.07,0.0
gfx942,80,512,5120,25600,ck,13,1,466.8016,a8w8_blockscale_bpreshuffle_1x128x128_256x64x256x128_16x16_16x16_8x32x1_8x32x1_1x32x1x8_8_2x1_intrawave_v1,287.53,320.1,0.0
gfx942,80,1024,5120,8192,ck,13,1,308.7685,a8w8_blockscale_bpreshuffle_1x128x128_256x64x256x128_16x16_16x16_8x32x1_8x32x1_1x32x1x8_8_2x1_intrawave_v1,278.2,196.97,0.0
gfx942,80,1024,5120,25600,ck,13,3,912.2075,a8w8_blockscale_bpreshuffle_1x128x128_256x64x256x128_16x16_16x16_8x32x1_8x32x1_1x32x1x8_8_2x1_intrawave_v1,294.27,183.92,0.0
gfx942,80,2048,5120,8192,ck,13,3,600.8191,a8w8_blockscale_bpreshuffle_1x128x128_256x64x256x128_16x16_16x16_8x32x1_8x32x1_1x32x1x8_8_2x1_intrawave_v1,285.94,132.64,0.0
gfx942,80,2048,5120,25600,ck,13,2,1787.6172,a8w8_blockscale_bpreshuffle_1x128x128_256x64x256x128_16x16_16x16_8x32x1_8x32x1_1x32x1x8_8_2x1_intrawave_v1,300.33,114.38,0.0
gfx942,80,4096,5120,8192,ck,13,1,1180.6173,a8w8_blockscale_bpreshuffle_1x128x128_256x64x256x128_16x16_16x16_8x32x1_8x32x1_1x32x1x8_8_2x1_intrawave_v1,291.03,99.47,0.0
gfx942,80,4096,5120,25600,ck,13,2,3549.0881,a8w8_blockscale_bpreshuffle_1x128x128_256x64x256x128_16x16_16x16_8x32x1_8x32x1_1x32x1x8_8_2x1_intrawave_v1,302.54,78.29,0.0
gfx942,80,8192,5120,8192,ck,13,1,2342.2056,a8w8_blockscale_bpreshuffle_1x128x128_256x64x256x128_16x16_16x16_8x32x1_8x32x1_1x32x1x8_8_2x1_intrawave_v1,293.4,82.37,0.0
gfx942,80,8192,5120,25600,ck,13,0,7045.0948,a8w8_blockscale_bpreshuffle_1x128x128_256x64x256x128_16x16_16x16_8x32x1_8x32x1_1x32x1x8_8_2x1_intrawave_v1,304.82,60.28,0.0
gfx942,80,16384,5120,8192,ck,13,1,4668.7267,a8w8_blockscale_bpreshuffle_1x128x128_256x64x256x128_16x16_16x16_8x32x1_8x32x1_1x32x1x8_8_2x1_intrawave_v1,294.38,73.67,0.0
gfx942,80,16384,5120,25600,ck,13,1,14040.7208,a8w8_blockscale_bpreshuffle_1x128x128_256x64x256x128_16x16_16x16_8x32x1_8x32x1_1x32x1x8_8_2x1_intrawave_v1,305.89,51.16,0.0
gfx942,80,1,10240,5120,ck,6,2,18.8096,a8w8_blockscale_bpreshuffle_1x128x128_256x16x128x256_16x16_16x16_16x16x1_16x16x1_1x16x1x16_8_1x2_intrawave_v1,5.57,2788.7,0.0
gfx942,80,2,10240,5120,ck,6,0,19.0068,a8w8_blockscale_bpreshuffle_1x128x128_256x16x128x256_16x16_16x16_16x16x1_16x16x1_1x16x1x16_8_1x2_intrawave_v1,11.03,2761.12,0.0
gfx942,80,4,10240,5120,ck,6,3,19.0679,a8w8_blockscale_bpreshuffle_1x128x128_256x16x128x256_16x16_16x16_16x16x1_16x16x1_1x16x1x16_8_1x2_intrawave_v1,22.0,2754.95,0.0
gfx942,80,8,10240,5120,ck,6,2,19.0863,a8w8_blockscale_bpreshuffle_1x128x128_256x16x128x256_16x16_16x16_16x16x1_16x16x1_1x16x1x16_8_1x2_intrawave_v1,43.95,2757.66,0.0
gfx942,80,16,10240,5120,ck,7,3,18.9301,a8w8_blockscale_bpreshuffle_1x128x128_256x16x64x256_16x16_16x16_16x16x1_16x16x1_1x16x1x16_4_1x1_intrawave_v1,88.63,2791.24,0.0
gfx942,80,32,10240,5120,ck,12,2,25.5879,a8w8_blockscale_bpreshuffle_1x128x128_256x32x64x256_16x16_16x16_16x16x1_16x16x1_1x32x1x8_8_2x1_intrawave_v1,131.13,2080.98,0.0
gfx942,80,64,10240,5120,ck,9,0,39.1941,a8w8_blockscale_bpreshuffle_1x128x128_256x32x128x128_16x16_16x16_8x32x1_8x32x1_1x32x1x8_8_2x1_intrawave_v1,171.22,1379.47,0.0
gfx942,80,128,10240,5120,ck,14,2,60.7899,a8w8_blockscale_bpreshuffle_1x128x128_256x64x128x128_16x16_16x16_8x32x1_8x32x1_1x32x1x8_8_2x1_intrawave_v1,220.79,916.36,0.0
gfx942,80,256,10240,5120,ck,13,3,105.4196,a8w8_blockscale_bpreshuffle_1x128x128_256x64x256x128_16x16_16x16_8x32x1_8x32x1_1x32x1x8_8_2x1_intrawave_v1,254.64,559.5,0.0
gfx942,80,512,10240,5120,ck,13,0,202.1796,a8w8_blockscale_bpreshuffle_1x128x128_256x64x256x128_16x16_16x16_8x32x1_8x32x1_1x32x1x8_8_2x1_intrawave_v1,265.54,324.15,0.0
gfx942,80,1024,10240,5120,ck,13,1,392.3491,a8w8_blockscale_bpreshuffle_1x128x128_256x64x256x128_16x16_16x16_8x32x1_8x32x1_1x32x1x8_8_2x1_intrawave_v1,273.67,200.44,0.0
gfx942,80,2048,10240,5120,ck,13,3,768.2403,a8w8_blockscale_bpreshuffle_1x128x128_256x64x256x128_16x16_16x16_8x32x1_8x32x1_1x32x1x8_8_2x1_intrawave_v1,279.53,136.49,0.0
gfx942,80,4096,10240,5120,ck,14,1,1524.6572,a8w8_blockscale_bpreshuffle_1x128x128_256x64x128x128_16x16_16x16_8x32x1_8x32x1_1x32x1x8_8_2x1_intrawave_v1,281.7,103.16,0.0
gfx942,80,8192,10240,5120,ck,13,2,3027.9282,a8w8_blockscale_bpreshuffle_1x128x128_256x64x256x128_16x16_16x16_8x32x1_8x32x1_1x32x1x8_8_2x1_intrawave_v1,283.69,86.58,0.0
gfx942,80,16384,10240,5120,ck,13,0,6062.5943,a8w8_blockscale_bpreshuffle_1x128x128_256x64x256x128_16x16_16x16_8x32x1_8x32x1_1x32x1x8_8_2x1_intrawave_v1,283.37,77.83,0.0
gfx942,80,1,51200,5120,ck,6,0,72.2764,a8w8_blockscale_bpreshuffle_1x128x128_256x16x128x256_16x16_16x16_16x16x1_16x16x1_1x16x1x16_8_1x2_intrawave_v1,7.25,3628.45,0.0
gfx942,80,2,51200,5120,ck,6,0,72.3672,a8w8_blockscale_bpreshuffle_1x128x128_256x16x128x256_16x16_16x16_16x16x1_16x16x1_1x16x1x16_8_1x2_intrawave_v1,14.49,3625.39,0.0
gfx942,80,4,51200,5120,ck,6,2,73.8737,a8w8_blockscale_bpreshuffle_1x128x128_256x16x128x256_16x16_16x16_16x16x1_16x16x1_1x16x1x16_8_1x2_intrawave_v1,28.39,3554.36,0.0
gfx942,80,8,51200,5120,ck,6,1,75.0189,a8w8_blockscale_bpreshuffle_1x128x128_256x16x128x256_16x16_16x16_16x16x1_16x16x1_1x16x1x16_8_1x2_intrawave_v1,55.91,3505.84,0.0
gfx942,80,16,51200,5120,ck,6,0,78.8547,a8w8_blockscale_bpreshuffle_1x128x128_256x16x128x256_16x16_16x16_16x16x1_16x16x1_1x16x1x16_8_1x2_intrawave_v1,106.38,3346.21,0.0
gfx942,80,32,51200,5120,ck,11,1,99.1542,a8w8_blockscale_bpreshuffle_1x128x128_256x32x128x256_16x16_16x16_16x16x1_16x16x1_1x32x1x8_8_2x1_intrawave_v1,169.2,2678.5,0.0
gfx942,80,64,51200,5120,ck,14,0,144.0234,a8w8_blockscale_bpreshuffle_1x128x128_256x64x128x128_16x16_16x16_8x32x1_8x32x1_1x32x1x8_8_2x1_intrawave_v1,232.98,1867.93,0.0
gfx942,80,128,51200,5120,ck,13,2,258.2743,a8w8_blockscale_bpreshuffle_1x128x128_256x64x256x128_16x16_16x16_8x32x1_8x32x1_1x32x1x8_8_2x1_intrawave_v1,259.84,1068.27,0.0
gfx942,80,256,51200,5120,ck,13,3,494.4368,a8w8_blockscale_bpreshuffle_1x128x128_256x64x256x128_16x16_16x16_8x32x1_8x32x1_1x32x1x8_8_2x1_intrawave_v1,271.46,585.86,0.0
gfx942,80,512,51200,5120,ck,13,2,965.648,a8w8_blockscale_bpreshuffle_1x128x128_256x64x256x128_16x16_16x16_8x32x1_8x32x1_1x32x1x8_8_2x1_intrawave_v1,277.98,328.48,0.0
gfx942,80,1024,51200,5120,ck,13,0,1905.5321,a8w8_blockscale_bpreshuffle_1x128x128_256x64x256x128_16x16_16x16_8x32x1_8x32x1_1x32x1x8_8_2x1_intrawave_v1,281.74,195.35,0.0
gfx942,80,2048,51200,5120,ck,13,1,3783.1343,a8w8_blockscale_bpreshuffle_1x128x128_256x64x256x128_16x16_16x16_8x32x1_8x32x1_1x32x1x8_8_2x1_intrawave_v1,283.82,127.5,0.0
gfx942,80,4096,51200,5120,ck,14,2,7583.4443,a8w8_blockscale_bpreshuffle_1x128x128_256x64x128x128_16x16_16x16_8x32x1_8x32x1_1x32x1x8_8_2x1_intrawave_v1,283.18,92.64,0.0
gfx942,80,8192,51200,5120,ck,13,1,15115.7558,a8w8_blockscale_bpreshuffle_1x128x128_256x64x256x128_16x16_16x16_8x32x1_8x32x1_1x32x1x8_8_2x1_intrawave_v1,284.14,75.61,0.0
gfx942,80,16384,51200,5120,ck,13,1,30239.0053,a8w8_blockscale_bpreshuffle_1x128x128_256x64x256x128_16x16_16x16_8x32x1_8x32x1_1x32x1x8_8_2x1_intrawave_v1,284.07,66.93,0.0
