aiter/configs/model_configs/a8w8_blockscale_bpreshuffle_tuned_gemm_dsv3.csv
cu_num,M,N,K,libtype,kernelId,splitK,us,kernelName,tflops,bw,errRatio
256,16,128,7168,asm,22,7,8.0753,_ZN5aiter42fp8gemm_bf16_blockscale_BpreShuffle_64x128E,3.64,128.33,0.0073
256,32,128,7168,asm,7,8,6.9954,_ZN5aiter42fp8gemm_bf16_blockscale_BpreShuffle_32x128E,8.39,165.12,0.0203
256,48,128,7168,asm,14,7,7.896,_ZN5aiter42fp8gemm_bf16_blockscale_BpreShuffle_48x128E,11.16,161.33,0.0015
256,64,128,7168,asm,5,6,7.8203,_ZN5aiter42fp8gemm_bf16_blockscale_BpreShuffle_32x128E,15.02,178.08,0.0042
256,80,128,7168,asm,15,8,8.0018,_ZN5aiter42fp8gemm_bf16_blockscale_BpreShuffle_48x128E,18.35,188.89,0.0078
256,96,128,7168,asm,15,8,8.7223,_ZN5aiter42fp8gemm_bf16_blockscale_BpreShuffle_48x128E,20.2,186.9,0.0064
256,112,128,7168,asm,6,7,8.6641,_ZN5aiter42fp8gemm_bf16_blockscale_BpreShuffle_32x128E,23.72,201.87,0.0031
256,128,128,7168,asm,6,7,8.8842,_ZN5aiter42fp8gemm_bf16_blockscale_BpreShuffle_32x128E,26.44,210.24,0.0039
256,144,128,7168,asm,6,7,8.4726,_ZN5aiter42fp8gemm_bf16_blockscale_BpreShuffle_32x128E,31.19,234.47,0.0117
256,160,128,7168,asm,7,8,8.2926,_ZN5aiter42fp8gemm_bf16_blockscale_BpreShuffle_32x128E,35.41,253.88,0.0094
256,176,128,7168,asm,6,7,8.5825,_ZN5aiter42fp8gemm_bf16_blockscale_BpreShuffle_32x128E,37.63,259.15,0.0008
256,192,128,7168,asm,5,6,9.3687,_ZN5aiter42fp8gemm_bf16_blockscale_BpreShuffle_32x128E,37.61,250.08,0.0016
256,208,128,7168,asm,7,8,10.4867,_ZN5aiter42fp8gemm_bf16_blockscale_BpreShuffle_32x128E,36.4,234.74,0.0154
256,224,128,7168,asm,7,8,10.2703,_ZN5aiter42fp8gemm_bf16_blockscale_BpreShuffle_32x128E,40.02,251.26,0.0126
256,240,128,7168,asm,15,8,10.2488,_ZN5aiter42fp8gemm_bf16_blockscale_BpreShuffle_48x128E,42.97,263.37,0.0124
256,256,128,7168,asm,15,8,9.6915,_ZN5aiter42fp8gemm_bf16_blockscale_BpreShuffle_48x128E,48.47,290.78,0.0112
256,288,128,7168,asm,7,8,10.8034,_ZN5aiter42fp8gemm_bf16_blockscale_BpreShuffle_32x128E,48.92,282.84,0.0069
256,320,128,7168,asm,15,8,9.8213,_ZN5aiter42fp8gemm_bf16_blockscale_BpreShuffle_48x128E,59.79,335.31,0.0115
256,352,128,7168,asm,15,8,10.1826,_ZN5aiter42fp8gemm_bf16_blockscale_BpreShuffle_48x128E,63.43,346.74,0.0048
256,384,128,7168,asm,7,8,10.9976,_ZN5aiter42fp8gemm_bf16_blockscale_BpreShuffle_32x128E,64.07,342.65,0.0123
256,416,128,7168,asm,7,8,12.6791,_ZN5aiter42fp8gemm_bf16_blockscale_BpreShuffle_32x128E,60.21,315.94,0.0088
256,448,128,7168,asm,7,8,10.215,_ZN5aiter42fp8gemm_bf16_blockscale_BpreShuffle_32x128E,80.48,415.41,0.0097
256,480,128,7168,asm,15,8,11.9779,_ZN5aiter42fp8gemm_bf16_blockscale_BpreShuffle_48x128E,73.54,374.11,0.0045
256,512,128,7168,asm,7,8,13.3559,_ZN5aiter42fp8gemm_bf16_blockscale_BpreShuffle_32x128E,70.35,353.3,0.0026
256,544,128,7168,asm,6,7,13.2595,_ZN5aiter42fp8gemm_bf16_blockscale_BpreShuffle_32x128E,75.29,373.78,0.0092
256,576,128,7168,asm,7,8,10.035,_ZN5aiter42fp8gemm_bf16_blockscale_BpreShuffle_32x128E,105.33,517.56,0.013
256,608,128,7168,asm,6,7,12.4351,_ZN5aiter42fp8gemm_bf16_blockscale_BpreShuffle_32x128E,89.72,436.77,0.0069
256,640,128,7168,asm,15,8,11.9397,_ZN5aiter42fp8gemm_bf16_blockscale_BpreShuffle_48x128E,98.36,474.79,0.0122
256,672,128,7168,asm,5,6,14.2711,_ZN5aiter42fp8gemm_bf16_blockscale_BpreShuffle_32x128E,86.41,413.87,0.0015
256,704,128,7168,asm,6,7,13.5715,_ZN5aiter42fp8gemm_bf16_blockscale_BpreShuffle_32x128E,95.19,452.71,0.0093
256,736,128,7168,asm,15,8,12.7275,_ZN5aiter42fp8gemm_bf16_blockscale_BpreShuffle_48x128E,106.11,501.4,0.0076
256,768,128,7168,asm,15,8,14.5259,_ZN5aiter42fp8gemm_bf16_blockscale_BpreShuffle_48x128E,97.02,455.68,0.0139
256,800,128,7168,asm,7,8,14.5195,_ZN5aiter42fp8gemm_bf16_blockscale_BpreShuffle_32x128E,101.11,472.24,0.0064
256,832,128,7168,asm,6,7,14.4499,_ZN5aiter42fp8gemm_bf16_blockscale_BpreShuffle_32x128E,105.66,490.96,0.0049
256,864,128,7168,asm,6,7,13.0619,_ZN5aiter42fp8gemm_bf16_blockscale_BpreShuffle_32x128E,121.38,561.31,0.0073
256,896,128,7168,asm,7,8,11.2138,_ZN5aiter42fp8gemm_bf16_blockscale_BpreShuffle_32x128E,146.62,675.01,0.0074
256,928,128,7168,asm,15,8,16.242,_ZN5aiter42fp8gemm_bf16_blockscale_BpreShuffle_48x128E,104.84,480.67,0.0107
256,960,128,7168,asm,7,8,15.1451,_ZN5aiter42fp8gemm_bf16_blockscale_BpreShuffle_32x128E,116.32,531.16,0.004
256,992,128,7168,asm,7,8,12.5414,_ZN5aiter42fp8gemm_bf16_blockscale_BpreShuffle_32x128E,145.15,660.38,0.0089
256,1024,128,7168,asm,7,8,12.2974,_ZN5aiter42fp8gemm_bf16_blockscale_BpreShuffle_32x128E,152.8,692.8,0.0102
256,1088,128,7168,asm,15,8,14.4883,_ZN5aiter42fp8gemm_bf16_blockscale_BpreShuffle_48x128E,137.8,620.83,0.0062
256,1152,128,7168,ck,7,3,17.2339,a8w8_blockscale_bpreshuffle_1x128x128_256x16x64x256_16x16_16x16_16x16x1_16x16x1_1x16x1x16_4_1x1_intrawave_v1,122.66,549.5,0.0
256,1216,128,7168,asm,14,7,14.8887,_ZN5aiter42fp8gemm_bf16_blockscale_BpreShuffle_48x128E,149.87,667.96,0.0023
256,1280,128,7168,asm,14,7,17.1158,_ZN5aiter42fp8gemm_bf16_blockscale_BpreShuffle_48x128E,137.23,608.81,0.0009
256,1344,128,7168,asm,15,8,16.6044,_ZN5aiter42fp8gemm_bf16_blockscale_BpreShuffle_48x128E,148.53,656.17,0.0084
256,1408,128,7168,asm,15,8,14.5467,_ZN5aiter42fp8gemm_bf16_blockscale_BpreShuffle_48x128E,177.61,781.65,0.0116
256,1472,128,7168,asm,15,8,16.2415,_ZN5aiter42fp8gemm_bf16_blockscale_BpreShuffle_48x128E,166.31,729.34,0.0079
256,1536,128,7168,asm,15,8,16.6507,_ZN5aiter42fp8gemm_bf16_blockscale_BpreShuffle_48x128E,169.28,739.95,0.0153
256,1600,128,7168,ck,7,3,16.6801,a8w8_blockscale_bpreshuffle_1x128x128_256x16x64x256_16x16_16x16_16x16x1_16x16x1_1x16x1x16_4_1x1_intrawave_v1,176.02,767.14,0.0
256,1664,128,7168,ck,7,1,16.6914,a8w8_blockscale_bpreshuffle_1x128x128_256x16x64x256_16x16_16x16_16x16x1_16x16x1_1x16x1x16_4_1x1_intrawave_v1,182.94,795.08,0.0
256,1728,128,7168,ck,7,1,16.6641,a8w8_blockscale_bpreshuffle_1x128x128_256x16x64x256_16x16_16x16_16x16x1_16x16x1_1x16x1x16_4_1x1_intrawave_v1,190.28,824.9,0.0
256,1792,128,7168,ck,7,0,17.0019,a8w8_blockscale_bpreshuffle_1x128x128_256x16x64x256_16x16_16x16_16x16x1_16x16x1_1x16x1x16_4_1x1_intrawave_v1,193.41,836.45,0.0
256,1856,128,7168,ck,7,1,16.709,a8w8_blockscale_bpreshuffle_1x128x128_256x16x64x256_16x16_16x16_16x16x1_16x16x1_1x16x1x16_4_1x1_intrawave_v1,203.83,879.55,0.0
256,1920,128,7168,ck,7,3,16.7774,a8w8_blockscale_bpreshuffle_1x128x128_256x16x64x256_16x16_16x16_16x16x1_16x16x1_1x16x1x16_4_1x1_intrawave_v1,210.0,904.29,0.0
256,1984,128,7168,ck,7,0,16.8024,a8w8_blockscale_bpreshuffle_1x128x128_256x16x64x256_16x16_16x16_16x16x1_16x16x1_1x16x1x16_4_1x1_intrawave_v1,216.67,931.22,0.0
256,2048,128,7168,ck,7,2,16.8229,a8w8_blockscale_bpreshuffle_1x128x128_256x16x64x256_16x16_16x16_16x16x1_16x16x1_1x16x1x16_4_1x1_intrawave_v1,223.39,958.33,0.0
256,4096,128,7168,ck,12,1,18.3291,a8w8_blockscale_bpreshuffle_1x128x128_256x32x64x256_16x16_16x16_16x16x1_16x16x1_1x32x1x8_8_2x1_intrawave_v1,410.07,1709.1,0.0
256,8192,128,7168,ck,17,2,23.0108,a8w8_blockscale_bpreshuffle_1x128x128_256x64x64x256_16x16_16x16_16x16x1_16x16x1_1x32x1x8_8_2x1_intrawave_v1,653.28,2682.87,0.0
256,16384,128,7168,ck,14,0,39.6572,a8w8_blockscale_bpreshuffle_1x128x128_256x64x128x128_16x16_16x16_8x32x1_8x32x1_1x32x1x8_8_2x1_intrawave_v1,758.12,3090.29,0.0
256,32768,128,7168,ck,0,0,59.0516,a8w8_blockscale_bpreshuffle_1x128x128_256x128x128x128_16x16_16x16_8x32x1_8x32x1_1x32x1x8_8_2x1_intrawave_v3,1018.25,4135.15,0.0
256,16,2112,7168,ck,7,3,17.4923,a8w8_blockscale_bpreshuffle_1x128x128_256x16x64x256_16x16_16x16_16x16x1_16x16x1_1x16x1x16_4_1x1_intrawave_v1,27.69,875.88,0.0
256,32,2112,7168,ck,7,2,17.3668,a8w8_blockscale_bpreshuffle_1x128x128_256x16x64x256_16x16_16x16_16x16x1_16x16x1_1x16x1x16_4_1x1_intrawave_v1,55.79,892.7,0.0
256,48,2112,7168,ck,7,3,17.2581,a8w8_blockscale_bpreshuffle_1x128x128_256x16x64x256_16x16_16x16_16x16x1_16x16x1_1x16x1x16_4_1x1_intrawave_v1,84.21,908.89,0.0
256,64,2112,7168,ck,7,2,16.9886,a8w8_blockscale_bpreshuffle_1x128x128_256x16x64x256_16x16_16x16_16x16x1_16x16x1_1x16x1x16_4_1x1_intrawave_v1,114.06,934.03,0.0
256,80,2112,7168,ck,7,0,17.1132,a8w8_blockscale_bpreshuffle_1x128x128_256x16x64x256_16x16_16x16_16x16x1_16x16x1_1x16x1x16_4_1x1_intrawave_v1,141.54,937.88,0.0
256,96,2112,7168,ck,7,3,17.1586,a8w8_blockscale_bpreshuffle_1x128x128_256x16x64x256_16x16_16x16_16x16x1_16x16x1_1x16x1x16_4_1x1_intrawave_v1,169.4,946.02,0.0
256,112,2112,7168,ck,7,3,17.2268,a8w8_blockscale_bpreshuffle_1x128x128_256x16x64x256_16x16_16x16_16x16x1_16x16x1_1x16x1x16_4_1x1_intrawave_v1,196.85,952.86,0.0
256,128,2112,7168,ck,7,1,17.231,a8w8_blockscale_bpreshuffle_1x128x128_256x16x64x256_16x16_16x16_16x16x1_16x16x1_1x16x1x16_4_1x1_intrawave_v1,224.92,963.21,0.0
256,144,2112,7168,ck,7,3,17.5087,a8w8_blockscale_bpreshuffle_1x128x128_256x16x64x256_16x16_16x16_16x16x1_16x16x1_1x16x1x16_4_1x1_intrawave_v1,249.02,958.34,0.0
256,160,2112,7168,ck,12,0,18.434,a8w8_blockscale_bpreshuffle_1x128x128_256x32x64x256_16x16_16x16_16x16x1_16x16x1_1x32x1x8_8_2x1_intrawave_v1,262.8,920.12,0.0
256,176,2112,7168,ck,7,0,19.529,a8w8_blockscale_bpreshuffle_1x128x128_256x16x64x256_16x16_16x16_16x16x1_16x16x1_1x16x1x16_4_1x1_intrawave_v1,272.87,877.86,0.0
256,192,2112,7168,ck,12,2,18.6041,a8w8_blockscale_bpreshuffle_1x128x128_256x32x64x256_16x16_16x16_16x16x1_16x16x1_1x32x1x8_8_2x1_intrawave_v1,312.47,931.3,0.0
256,208,2112,7168,ck,7,2,19.5946,a8w8_blockscale_bpreshuffle_1x128x128_256x16x64x256_16x16_16x16_16x16x1_16x16x1_1x16x1x16_4_1x1_intrawave_v1,321.4,893.53,0.0
256,224,2112,7168,ck,12,0,18.2639,a8w8_blockscale_bpreshuffle_1x128x128_256x32x64x256_16x16_16x16_16x16x1_16x16x1_1x32x1x8_8_2x1_intrawave_v1,371.34,968.61,0.0
256,240,2112,7168,ck,7,2,20.3091,a8w8_blockscale_bpreshuffle_1x128x128_256x16x64x256_16x16_16x16_16x16x1_16x16x1_1x16x1x16_4_1x1_intrawave_v1,357.8,880.04,0.0
256,256,2112,7168,ck,12,0,19.5367,a8w8_blockscale_bpreshuffle_1x128x128_256x32x64x256_16x16_16x16_16x16x1_16x16x1_1x32x1x8_8_2x1_intrawave_v1,396.74,924.17,0.0
256,288,2112,7168,ck,12,1,19.965,a8w8_blockscale_bpreshuffle_1x128x128_256x32x64x256_16x16_16x16_16x16x1_16x16x1_1x32x1x8_8_2x1_intrawave_v1,436.76,922.6,0.0
256,320,2112,7168,ck,17,3,21.485,a8w8_blockscale_bpreshuffle_1x128x128_256x64x64x256_16x16_16x16_16x16x1_16x16x1_1x32x1x8_8_2x1_intrawave_v1,450.96,874.3,0.0
256,352,2112,7168,ck,17,1,22.3606,a8w8_blockscale_bpreshuffle_1x128x128_256x64x64x256_16x16_16x16_16x16x1_16x16x1_1x32x1x8_8_2x1_intrawave_v1,476.63,856.36,0.0
256,384,2112,7168,ck,17,3,21.4274,a8w8_blockscale_bpreshuffle_1x128x128_256x64x64x256_16x16_16x16_16x16x1_16x16x1_1x32x1x8_8_2x1_intrawave_v1,542.6,910.67,0.0
256,416,2112,7168,ck,17,3,22.5557,a8w8_blockscale_bpreshuffle_1x128x128_256x64x64x256_16x16_16x16_16x16x1_16x16x1_1x32x1x8_8_2x1_intrawave_v1,558.42,881.28,0.0
256,448,2112,7168,ck,17,1,21.5053,a8w8_blockscale_bpreshuffle_1x128x128_256x64x64x256_16x16_16x16_16x16x1_16x16x1_1x32x1x8_8_2x1_intrawave_v1,630.75,941.28,0.0
256,480,2112,7168,ck,12,1,23.8143,a8w8_blockscale_bpreshuffle_1x128x128_256x32x64x256_16x16_16x16_16x16x1_16x16x1_1x32x1x8_8_2x1_intrawave_v1,610.27,865.32,0.0
256,512,2112,7168,ck,17,3,28.3953,a8w8_blockscale_bpreshuffle_1x128x128_256x64x64x256_16x16_16x16_16x16x1_16x16x1_1x32x1x8_8_2x1_intrawave_v1,545.94,738.56,0.0
256,544,2112,7168,ck,17,1,29.6663,a8w8_blockscale_bpreshuffle_1x128x128_256x64x64x256_16x16_16x16_16x16x1_16x16x1_1x32x1x8_8_2x1_intrawave_v1,555.21,719.2,0.0
256,576,2112,7168,ck,17,3,29.335,a8w8_blockscale_bpreshuffle_1x128x128_256x64x64x256_16x16_16x16_16x16x1_16x16x1_1x32x1x8_8_2x1_intrawave_v1,594.51,739.75,0.0
256,608,2112,7168,ck,12,0,31.2219,a8w8_blockscale_bpreshuffle_1x128x128_256x32x64x256_16x16_16x16_16x16x1_16x16x1_1x32x1x8_8_2x1_intrawave_v1,589.61,706.72,0.0
256,640,2112,7168,ck,12,3,31.441,a8w8_blockscale_bpreshuffle_1x128x128_256x32x64x256_16x16_16x16_16x16x1_16x16x1_1x32x1x8_8_2x1_intrawave_v1,616.32,713.39,0.0
256,672,2112,7168,ck,17,1,32.6662,a8w8_blockscale_bpreshuffle_1x128x128_256x64x64x256_16x16_16x16_16x16x1_16x16x1_1x32x1x8_8_2x1_intrawave_v1,622.86,697.79,0.0
256,704,2112,7168,ck,17,2,31.7696,a8w8_blockscale_bpreshuffle_1x128x128_256x64x64x256_16x16_16x16_16x16x1_16x16x1_1x32x1x8_8_2x1_intrawave_v1,670.94,728.96,0.0
256,736,2112,7168,ck,17,0,32.2792,a8w8_blockscale_bpreshuffle_1x128x128_256x64x64x256_16x16_16x16_16x16x1_16x16x1_1x32x1x8_8_2x1_intrawave_v1,690.36,728.75,0.0
256,768,2112,7168,ck,17,2,31.502,a8w8_blockscale_bpreshuffle_1x128x128_256x64x64x256_16x16_16x16_16x16x1_16x16x1_1x32x1x8_8_2x1_intrawave_v1,738.15,758.3,0.0
256,800,2112,7168,ck,17,2,33.5387,a8w8_blockscale_bpreshuffle_1x128x128_256x64x64x256_16x16_16x16_16x16x1_16x16x1_1x32x1x8_8_2x1_intrawave_v1,722.21,723.12,0.0
256,832,2112,7168,ck,17,2,32.7939,a8w8_blockscale_bpreshuffle_1x128x128_256x64x64x256_16x16_16x16_16x16x1_16x16x1_1x32x1x8_8_2x1_intrawave_v1,768.16,750.66,0.0
256,864,2112,7168,ck,17,0,34.3682,a8w8_blockscale_bpreshuffle_1x128x128_256x64x64x256_16x16_16x16_16x16x1_16x16x1_1x32x1x8_8_2x1_intrawave_v1,761.17,726.88,0.0
256,896,2112,7168,ck,17,2,32.9244,a8w8_blockscale_bpreshuffle_1x128x128_256x64x64x256_16x16_16x16_16x16x1_16x16x1_1x32x1x8_8_2x1_intrawave_v1,823.97,769.83,0.0
256,928,2112,7168,ck,17,3,34.4111,a8w8_blockscale_bpreshuffle_1x128x128_256x64x64x256_16x16_16x16_16x16x1_16x16x1_1x32x1x8_8_2x1_intrawave_v1,816.53,747.16,0.0
256,960,2112,7168,ck,17,0,34.0396,a8w8_blockscale_bpreshuffle_1x128x128_256x64x64x256_16x16_16x16_16x16x1_16x16x1_1x32x1x8_8_2x1_intrawave_v1,853.9,766.02,0.0
256,992,2112,7168,ck,15,0,42.8641,a8w8_blockscale_bpreshuffle_1x128x128_256x64x64x128_16x16_16x16_8x32x1_8x32x1_1x32x1x8_8_2x1_intrawave_v1,700.71,616.83,0.016
256,1024,2112,7168,ck,15,2,42.8458,a8w8_blockscale_bpreshuffle_1x128x128_256x64x64x128_16x16_16x16_8x32x1_8x32x1_1x32x1x8_8_2x1_intrawave_v1,723.63,625.6,0.0126
256,1088,2112,7168,ck,15,0,41.6044,a8w8_blockscale_bpreshuffle_1x128x128_256x64x64x128_16x16_16x16_8x32x1_8x32x1_1x32x1x8_8_2x1_intrawave_v1,791.79,661.79,0.0122
256,1152,2112,7168,ck,15,2,41.8143,a8w8_blockscale_bpreshuffle_1x128x128_256x64x64x128_16x16_16x16_8x32x1_8x32x1_1x32x1x8_8_2x1_intrawave_v1,834.16,675.9,0.0102
256,1216,2112,7168,ck,15,3,43.2251,a8w8_blockscale_bpreshuffle_1x128x128_256x64x64x128_16x16_16x16_8x32x1_8x32x1_1x32x1x8_8_2x1_intrawave_v1,851.76,670.71,0.0116
256,1280,2112,7168,ck,15,1,43.7351,a8w8_blockscale_bpreshuffle_1x128x128_256x64x64x128_16x16_16x16_8x32x1_8x32x1_1x32x1x8_8_2x1_intrawave_v1,886.14,679.56,0.0134
256,1344,2112,7168,ck,15,3,46.9456,a8w8_blockscale_bpreshuffle_1x128x128_256x64x64x128_16x16_16x16_8x32x1_8x32x1_1x32x1x8_8_2x1_intrawave_v1,866.81,648.62,0.0138
256,1408,2112,7168,ck,15,1,46.568,a8w8_blockscale_bpreshuffle_1x128x128_256x64x64x128_16x16_16x16_8x32x1_8x32x1_1x32x1x8_8_2x1_intrawave_v1,915.45,669.53,0.0105
256,1472,2112,7168,ck,15,0,47.6897,a8w8_blockscale_bpreshuffle_1x128x128_256x64x64x128_16x16_16x16_8x32x1_8x32x1_1x32x1x8_8_2x1_intrawave_v1,934.56,669.07,0.0105
256,1536,2112,7168,ck,2,2,56.5135,a8w8_blockscale_bpreshuffle_1x128x128_256x64x64x128_16x16_16x16_8x32x1_8x32x1_1x32x1x8_8_2x1_intrawave_v3,822.93,577.51,0.0
256,1600,2112,7168,ck,15,1,56.8499,a8w8_blockscale_bpreshuffle_1x128x128_256x64x64x128_16x16_16x16_8x32x1_8x32x1_1x32x1x8_8_2x1_intrawave_v1,852.14,586.91,0.0145
256,1664,2112,7168,ck,15,1,57.8475,a8w8_blockscale_bpreshuffle_1x128x128_256x64x64x128_16x16_16x16_8x32x1_8x32x1_1x32x1x8_8_2x1_intrawave_v1,870.94,589.4,0.0135
256,1728,2112,7168,ck,2,3,58.8751,a8w8_blockscale_bpreshuffle_1x128x128_256x64x64x128_16x16_16x16_8x32x1_8x32x1_1x32x1x8_8_2x1_intrawave_v3,888.66,591.49,0.0
256,1792,2112,7168,ck,15,3,59.9682,a8w8_blockscale_bpreshuffle_1x128x128_256x64x64x128_16x16_16x16_8x32x1_8x32x1_1x32x1x8_8_2x1_intrawave_v1,904.77,592.87,0.0142
256,1856,2112,7168,ck,15,3,60.775,a8w8_blockscale_bpreshuffle_1x128x128_256x64x64x128_16x16_16x16_8x32x1_8x32x1_1x32x1x8_8_2x1_intrawave_v1,924.64,596.99,0.014
256,1920,2112,7168,ck,17,0,62.6654,a8w8_blockscale_bpreshuffle_1x128x128_256x64x64x256_16x16_16x16_16x16x1_16x16x1_1x32x1x8_8_2x1_intrawave_v1,927.67,590.62,0.0
256,1984,2112,7168,ck,15,2,64.4296,a8w8_blockscale_bpreshuffle_1x128x128_256x64x64x128_16x16_16x16_8x32x1_8x32x1_1x32x1x8_8_2x1_intrawave_v1,932.35,585.76,0.0151
256,2048,2112,7168,ck,17,0,75.4845,a8w8_blockscale_bpreshuffle_1x128x128_256x64x64x256_16x16_16x16_16x16x1_16x16x1_1x32x1x8_8_2x1_intrawave_v1,821.47,509.64,0.0
256,4096,2112,7168,ck,15,2,122.6718,a8w8_blockscale_bpreshuffle_1x128x128_256x64x64x128_16x16_16x16_8x32x1_8x32x1_1x32x1x8_8_2x1_intrawave_v1,1010.97,503.79,0.0162
256,8192,2112,7168,ck,15,0,222.6644,a8w8_blockscale_bpreshuffle_1x128x128_256x64x64x128_16x16_16x16_8x32x1_8x32x1_1x32x1x8_8_2x1_intrawave_v1,1113.94,487.11,0.017
256,16384,2112,7168,ck,15,3,422.0033,a8w8_blockscale_bpreshuffle_1x128x128_256x64x64x128_16x16_16x16_8x32x1_8x32x1_1x32x1x8_8_2x1_intrawave_v1,1175.51,478.16,0.0164
256,32768,2112,7168,ck,15,3,818.962,a8w8_blockscale_bpreshuffle_1x128x128_256x64x64x128_16x16_16x16_8x32x1_8x32x1_1x32x1x8_8_2x1_intrawave_v1,1211.46,474.3,0.0158
256,16,2240,7168,ck,7,3,17.4436,a8w8_blockscale_bpreshuffle_1x128x128_256x16x64x256_16x16_16x16_16x16x1_16x16x1_1x16x1x16_4_1x1_intrawave_v1,29.46,931.15,0.0
256,32,2240,7168,ck,7,2,17.5411,a8w8_blockscale_bpreshuffle_1x128x128_256x16x64x256_16x16_16x16_16x16x1_16x16x1_1x16x1x16_4_1x1_intrawave_v1,58.58,936.6,0.0
256,48,2240,7168,ck,7,1,17.6643,a8w8_blockscale_bpreshuffle_1x128x128_256x16x64x256_16x16_16x16_16x16x1_16x16x1_1x16x1x16_4_1x1_intrawave_v1,87.26,940.62,0.0
256,64,2240,7168,ck,7,0,17.2445,a8w8_blockscale_bpreshuffle_1x128x128_256x16x64x256_16x16_16x16_16x16x1_16x16x1_1x16x1x16_4_1x1_intrawave_v1,119.18,974.33,0.0
256,80,2240,7168,ck,7,0,17.1527,a8w8_blockscale_bpreshuffle_1x128x128_256x16x64x256_16x16_16x16_16x16x1_16x16x1_1x16x1x16_4_1x1_intrawave_v1,149.77,990.41,0.0
256,96,2240,7168,ck,7,2,17.2554,a8w8_blockscale_bpreshuffle_1x128x128_256x16x64x256_16x16_16x16_16x16x1_16x16x1_1x16x1x16_4_1x1_intrawave_v1,178.66,995.31,0.0
256,112,2240,7168,ck,7,0,17.0055,a8w8_blockscale_bpreshuffle_1x128x128_256x16x64x256_16x16_16x16_16x16x1_16x16x1_1x16x1x16_4_1x1_intrawave_v1,211.5,1020.9,0.0
256,128,2240,7168,ck,12,0,18.3348,a8w8_blockscale_bpreshuffle_1x128x128_256x32x64x256_16x16_16x16_16x16x1_16x16x1_1x32x1x8_8_2x1_intrawave_v1,224.19,957.05,0.0
256,144,2240,7168,ck,7,0,17.9836,a8w8_blockscale_bpreshuffle_1x128x128_256x16x64x256_16x16_16x16_16x16x1_16x16x1_1x16x1x16_4_1x1_intrawave_v1,257.14,986.1,0.0
256,160,2240,7168,ck,12,1,18.3899,a8w8_blockscale_bpreshuffle_1x128x128_256x32x64x256_16x16_16x16_16x16x1_16x16x1_1x32x1x8_8_2x1_intrawave_v1,279.39,974.45,0.0
256,176,2240,7168,ck,7,2,19.6569,a8w8_blockscale_bpreshuffle_1x128x128_256x16x64x256_16x16_16x16_16x16x1_16x16x1_1x16x1x16_4_1x1_intrawave_v1,287.52,921.12,0.0
256,192,2240,7168,ck,12,3,18.2475,a8w8_blockscale_bpreshuffle_1x128x128_256x32x64x256_16x16_16x16_16x16x1_16x16x1_1x32x1x8_8_2x1_intrawave_v1,337.89,1002.48,0.0
256,208,2240,7168,ck,7,1,19.9635,a8w8_blockscale_bpreshuffle_1x128x128_256x16x64x256_16x16_16x16_16x16x1_16x16x1_1x16x1x16_4_1x1_intrawave_v1,334.58,925.64,0.0
256,224,2240,7168,ck,12,0,18.5265,a8w8_blockscale_bpreshuffle_1x128x128_256x32x64x256_16x16_16x16_16x16x1_16x16x1_1x32x1x8_8_2x1_intrawave_v1,388.27,1007.5,0.0
256,240,2240,7168,ck,17,0,22.0174,a8w8_blockscale_bpreshuffle_1x128x128_256x64x64x256_16x16_16x16_16x16x1_16x16x1_1x32x1x8_8_2x1_intrawave_v1,350.04,856.22,0.0
256,256,2240,7168,ck,17,1,21.4466,a8w8_blockscale_bpreshuffle_1x128x128_256x64x64x256_16x16_16x16_16x16x1_16x16x1_1x32x1x8_8_2x1_intrawave_v1,383.32,887.7,0.0
256,288,2240,7168,ck,12,3,19.951,a8w8_blockscale_bpreshuffle_1x128x128_256x32x64x256_16x16_16x16_16x16x1_16x16x1_1x32x1x8_8_2x1_intrawave_v1,463.56,972.93,0.0
256,320,2240,7168,ck,17,3,21.4806,a8w8_blockscale_bpreshuffle_1x128x128_256x64x64x256_16x16_16x16_16x16x1_16x16x1_1x32x1x8_8_2x1_intrawave_v1,478.39,921.0,0.0
256,352,2240,7168,ck,17,0,22.3508,a8w8_blockscale_bpreshuffle_1x128x128_256x64x64x256_16x16_16x16_16x16x1_16x16x1_1x32x1x8_8_2x1_intrawave_v1,505.74,901.82,0.0
256,384,2240,7168,ck,17,0,21.665,a8w8_blockscale_bpreshuffle_1x128x128_256x64x64x256_16x16_16x16_16x16x1_16x16x1_1x32x1x8_8_2x1_intrawave_v1,569.18,947.57,0.0
256,416,2240,7168,ck,17,0,22.4312,a8w8_blockscale_bpreshuffle_1x128x128_256x64x64x256_16x16_16x16_16x16x1_16x16x1_1x32x1x8_8_2x1_intrawave_v1,595.55,931.82,0.0
256,448,2240,7168,ck,17,2,21.8102,a8w8_blockscale_bpreshuffle_1x128x128_256x64x64x256_16x16_16x16_16x16x1_16x16x1_1x32x1x8_8_2x1_intrawave_v1,659.62,975.44,0.0
256,480,2240,7168,ck,10,2,30.0287,a8w8_blockscale_bpreshuffle_1x128x128_256x32x64x128_16x16_16x16_8x32x1_8x32x1_1x32x1x8_8_2x1_intrawave_v1,513.31,720.89,0.0228
256,512,2240,7168,ck,17,1,31.5666,a8w8_blockscale_bpreshuffle_1x128x128_256x64x64x256_16x16_16x16_16x16x1_16x16x1_1x32x1x8_8_2x1_intrawave_v1,520.86,697.58,0.0
256,544,2240,7168,ck,17,2,29.8601,a8w8_blockscale_bpreshuffle_1x128x128_256x64x64x256_16x16_16x16_16x16x1_16x16x1_1x32x1x8_8_2x1_intrawave_v1,585.04,749.92,0.0
256,576,2240,7168,ck,17,0,29.1782,a8w8_blockscale_bpreshuffle_1x128x128_256x64x64x256_16x16_16x16_16x16x1_16x16x1_1x32x1x8_8_2x1_intrawave_v1,633.93,780.23,0.0
256,608,2240,7168,ck,12,1,32.2224,a8w8_blockscale_bpreshuffle_1x128x128_256x32x64x256_16x16_16x16_16x16x1_16x16x1_1x32x1x8_8_2x1_intrawave_v1,605.93,718.08,0.0
256,640,2240,7168,ck,17,0,31.7297,a8w8_blockscale_bpreshuffle_1x128x128_256x64x64x256_16x16_16x16_16x16x1_16x16x1_1x32x1x8_8_2x1_intrawave_v1,647.72,740.98,0.0
256,672,2240,7168,ck,17,0,32.5643,a8w8_blockscale_bpreshuffle_1x128x128_256x64x64x256_16x16_16x16_16x16x1_16x16x1_1x32x1x8_8_2x1_intrawave_v1,662.68,733.43,0.0
256,704,2240,7168,ck,17,1,32.1833,a8w8_blockscale_bpreshuffle_1x128x128_256x64x64x256_16x16_16x16_16x16x1_16x16x1_1x32x1x8_8_2x1_intrawave_v1,702.45,753.7,0.0
256,736,2240,7168,ck,17,2,33.3339,a8w8_blockscale_bpreshuffle_1x128x128_256x64x64x256_16x16_16x16_16x16x1_16x16x1_1x32x1x8_8_2x1_intrawave_v1,709.04,738.86,0.0
256,768,2240,7168,ck,17,1,32.7716,a8w8_blockscale_bpreshuffle_1x128x128_256x64x64x256_16x16_16x16_16x16x1_16x16x1_1x32x1x8_8_2x1_intrawave_v1,752.56,762.92,0.0
256,800,2240,7168,ck,17,0,33.7771,a8w8_blockscale_bpreshuffle_1x128x128_256x64x64x256_16x16_16x16_16x16x1_16x16x1_1x32x1x8_8_2x1_intrawave_v1,760.58,751.24,0.0
256,832,2240,7168,ck,17,2,32.9865,a8w8_blockscale_bpreshuffle_1x128x128_256x64x64x256_16x16_16x16_16x16x1_16x16x1_1x32x1x8_8_2x1_intrawave_v1,809.96,780.55,0.0
256,864,2240,7168,ck,17,2,34.2316,a8w8_blockscale_bpreshuffle_1x128x128_256x64x64x256_16x16_16x16_16x16x1_16x16x1_1x32x1x8_8_2x1_intrawave_v1,810.52,763.04,0.0
256,896,2240,7168,ck,17,1,33.975,a8w8_blockscale_bpreshuffle_1x128x128_256x64x64x256_16x16_16x16_16x16x1_16x16x1_1x32x1x8_8_2x1_intrawave_v1,846.89,779.78,0.0
256,928,2240,7168,ck,15,3,42.7989,a8w8_blockscale_bpreshuffle_1x128x128_256x64x64x128_16x16_16x16_8x32x1_8x32x1_1x32x1x8_8_2x1_intrawave_v1,696.29,627.72,0.0161
256,960,2240,7168,ck,15,0,40.8158,a8w8_blockscale_bpreshuffle_1x128x128_256x64x64x128_16x16_16x16_8x32x1_8x32x1_1x32x1x8_8_2x1_intrawave_v1,755.3,667.35,0.0119
256,992,2240,7168,ck,15,3,44.6098,a8w8_blockscale_bpreshuffle_1x128x128_256x64x64x128_16x16_16x16_8x32x1_8x32x1_1x32x1x8_8_2x1_intrawave_v1,714.1,618.95,0.0175
256,1024,2240,7168,ck,15,3,45.6329,a8w8_blockscale_bpreshuffle_1x128x128_256x64x64x128_16x16_16x16_8x32x1_8x32x1_1x32x1x8_8_2x1_intrawave_v1,720.61,613.24,0.0096
256,1088,2240,7168,ck,15,0,42.1227,a8w8_blockscale_bpreshuffle_1x128x128_256x64x64x128_16x16_16x16_8x32x1_8x32x1_1x32x1x8_8_2x1_intrawave_v1,829.45,682.04,0.0122
256,1152,2240,7168,ck,15,0,43.2389,a8w8_blockscale_bpreshuffle_1x128x128_256x64x64x128_16x16_16x16_8x32x1_8x32x1_1x32x1x8_8_2x1_intrawave_v1,855.57,681.67,0.0109
256,1216,2240,7168,ck,15,1,44.7841,a8w8_blockscale_bpreshuffle_1x128x128_256x64x64x128_16x16_16x16_8x32x1_8x32x1_1x32x1x8_8_2x1_intrawave_v1,871.94,674.8,0.0111
256,1280,2240,7168,ck,15,3,46.6105,a8w8_blockscale_bpreshuffle_1x128x128_256x64x64x128_16x16_16x16_8x32x1_8x32x1_1x32x1x8_8_2x1_intrawave_v1,881.87,664.35,0.0126
256,1344,2240,7168,ck,15,0,47.7345,a8w8_blockscale_bpreshuffle_1x128x128_256x64x64x128_16x16_16x16_8x32x1_8x32x1_1x32x1x8_8_2x1_intrawave_v1,904.16,664.33,0.013
256,1408,2240,7168,ck,15,0,55.909,a8w8_blockscale_bpreshuffle_1x128x128_256x64x64x128_16x16_16x16_8x32x1_8x32x1_1x32x1x8_8_2x1_intrawave_v1,808.72,580.53,0.0131
256,1472,2240,7168,ck,15,0,56.4785,a8w8_blockscale_bpreshuffle_1x128x128_256x64x64x128_16x16_16x16_8x32x1_8x32x1_1x32x1x8_8_2x1_intrawave_v1,836.95,587.87,0.0147
256,1536,2240,7168,ck,17,3,57.4782,a8w8_blockscale_bpreshuffle_1x128x128_256x64x64x256_16x16_16x16_16x16x1_16x16x1_1x32x1x8_8_2x1_intrawave_v1,858.15,590.62,0.0
256,1600,2240,7168,ck,15,3,58.877,a8w8_blockscale_bpreshuffle_1x128x128_256x64x64x128_16x16_16x16_8x32x1_8x32x1_1x32x1x8_8_2x1_intrawave_v1,872.67,589.25,0.0165
256,1664,2240,7168,ck,15,0,59.3694,a8w8_blockscale_bpreshuffle_1x128x128_256x64x64x128_16x16_16x16_8x32x1_8x32x1_1x32x1x8_8_2x1_intrawave_v1,900.05,596.92,0.0132
256,1728,2240,7168,ck,15,1,60.6418,a8w8_blockscale_bpreshuffle_1x128x128_256x64x64x128_16x16_16x16_8x32x1_8x32x1_1x32x1x8_8_2x1_intrawave_v1,915.06,596.69,0.0159
256,1792,2240,7168,ck,15,0,61.657,a8w8_blockscale_bpreshuffle_1x128x128_256x64x64x128_16x16_16x16_8x32x1_8x32x1_1x32x1x8_8_2x1_intrawave_v1,933.32,598.95,0.0158
256,1856,2240,7168,ck,15,3,62.8742,a8w8_blockscale_bpreshuffle_1x128x128_256x64x64x128_16x16_16x16_8x32x1_8x32x1_1x32x1x8_8_2x1_intrawave_v1,947.94,599.21,0.0164
256,1920,2240,7168,ck,17,0,70.4915,a8w8_blockscale_bpreshuffle_1x128x128_256x64x64x256_16x16_16x16_16x16x1_16x16x1_1x32x1x8_8_2x1_intrawave_v1,874.66,545.04,0.0
256,1984,2240,7168,ck,15,0,73.4679,a8w8_blockscale_bpreshuffle_1x128x128_256x64x64x128_16x16_16x16_8x32x1_8x32x1_1x32x1x8_8_2x1_intrawave_v1,867.2,533.1,0.0155
256,2048,2240,7168,ck,17,0,76.9526,a8w8_blockscale_bpreshuffle_1x128x128_256x64x64x256_16x16_16x16_16x16x1_16x16x1_1x32x1x8_8_2x1_intrawave_v1,854.64,518.65,0.0
256,4096,2240,7168,ck,15,1,124.9118,a8w8_blockscale_bpreshuffle_1x128x128_256x64x64x128_16x16_16x16_8x32x1_8x32x1_1x32x1x8_8_2x1_intrawave_v1,1053.01,510.49,0.0152
256,8192,2240,7168,ck,15,1,234.8998,a8w8_blockscale_bpreshuffle_1x128x128_256x64x64x128_16x16_16x16_8x32x1_8x32x1_1x32x1x8_8_2x1_intrawave_v1,1119.91,474.57,0.0164
256,16384,2240,7168,ck,15,3,435.1184,a8w8_blockscale_bpreshuffle_1x128x128_256x64x64x128_16x16_16x16_8x32x1_8x32x1_1x32x1x8_8_2x1_intrawave_v1,1209.17,475.5,0.016
256,32768,2240,7168,ck,15,2,854.8483,a8w8_blockscale_bpreshuffle_1x128x128_256x64x64x128_16x16_16x16_8x32x1_8x32x1_1x32x1x8_8_2x1_intrawave_v1,1230.94,465.27,0.0166
256,16,3072,1536,ck,12,3,6.4854,a8w8_blockscale_bpreshuffle_1x128x128_256x32x64x256_16x16_16x16_16x16x1_16x16x1_1x32x1x8_8_2x1_intrawave_v1,23.28,746.52,0.0
256,32,3072,1536,ck,7,2,6.4766,a8w8_blockscale_bpreshuffle_1x128x128_256x16x64x256_16x16_16x16_16x16x1_16x16x1_1x16x1x16_4_1x1_intrawave_v1,46.63,766.51,0.0
256,48,3072,1536,ck,7,1,6.2713,a8w8_blockscale_bpreshuffle_1x128x128_256x16x64x256_16x16_16x16_16x16x1_16x16x1_1x16x1x16_4_1x1_intrawave_v1,72.23,811.19,0.0
256,64,3072,1536,ck,12,2,6.4424,a8w8_blockscale_bpreshuffle_1x128x128_256x32x64x256_16x16_16x16_16x16x1_16x16x1_1x32x1x8_8_2x1_intrawave_v1,93.75,808.72,0.0
256,80,3072,1536,ck,7,0,6.522,a8w8_blockscale_bpreshuffle_1x128x128_256x16x64x256_16x16_16x16_16x16x1_16x16x1_1x16x1x16_4_1x1_intrawave_v1,115.76,817.69,0.0
256,96,3072,1536,ck,7,0,6.4436,a8w8_blockscale_bpreshuffle_1x128x128_256x16x64x256_16x16_16x16_16x16x1_16x16x1_1x16x1x16_4_1x1_intrawave_v1,140.6,846.71,0.0
256,112,3072,1536,ck,7,0,6.1807,a8w8_blockscale_bpreshuffle_1x128x128_256x16x64x256_16x16_16x16_16x16x1_16x16x1_1x16x1x16_4_1x1_intrawave_v1,171.01,902.61,0.0
256,128,3072,1536,ck,7,1,6.4756,a8w8_blockscale_bpreshuffle_1x128x128_256x16x64x256_16x16_16x16_16x16x1_16x16x1_1x16x1x16_4_1x1_intrawave_v1,186.54,880.48,0.0
256,144,3072,1536,ck,12,0,6.1269,a8w8_blockscale_bpreshuffle_1x128x128_256x32x64x256_16x16_16x16_16x16x1_16x16x1_1x32x1x8_8_2x1_intrawave_v1,221.8,950.65,0.0
256,160,3072,1536,ck,7,1,6.5485,a8w8_blockscale_bpreshuffle_1x128x128_256x16x64x256_16x16_16x16_16x16x1_16x16x1_1x16x1x16_4_1x1_intrawave_v1,230.58,908.21,0.0
256,176,3072,1536,ck,12,3,6.4938,a8w8_blockscale_bpreshuffle_1x128x128_256x32x64x256_16x16_16x16_16x16x1_16x16x1_1x32x1x8_8_2x1_intrawave_v1,255.77,934.78,0.0
256,192,3072,1536,ck,12,0,7.0224,a8w8_blockscale_bpreshuffle_1x128x128_256x32x64x256_16x16_16x16_16x16x1_16x16x1_1x32x1x8_8_2x1_intrawave_v1,258.02,881.91,0.0
256,208,3072,1536,ck,12,0,7.2558,a8w8_blockscale_bpreshuffle_1x128x128_256x32x64x256_16x16_16x16_16x16x1_16x16x1_1x32x1x8_8_2x1_intrawave_v1,270.53,870.48,0.0
256,224,3072,1536,ck,12,1,6.89,a8w8_blockscale_bpreshuffle_1x128x128_256x32x64x256_16x16_16x16_16x16x1_16x16x1_1x32x1x8_8_2x1_intrawave_v1,306.81,934.53,0.0
256,240,3072,1536,ck,12,3,7.8195,a8w8_blockscale_bpreshuffle_1x128x128_256x32x64x256_16x16_16x16_16x16x1_16x16x1_1x32x1x8_8_2x1_intrawave_v1,289.65,839.16,0.0
256,256,3072,1536,ck,11,2,7.2611,a8w8_blockscale_bpreshuffle_1x128x128_256x32x128x256_16x16_16x16_16x16x1_16x16x1_1x32x1x8_8_2x1_intrawave_v1,332.72,920.61,0.0
256,288,3072,1536,ck,12,3,7.8326,a8w8_blockscale_bpreshuffle_1x128x128_256x32x64x256_16x16_16x16_16x16x1_16x16x1_1x32x1x8_8_2x1_intrawave_v1,347.0,884.82,0.0
256,320,3072,1536,ck,12,3,7.402,a8w8_blockscale_bpreshuffle_1x128x128_256x32x64x256_16x16_16x16_16x16x1_16x16x1_1x32x1x8_8_2x1_intrawave_v1,407.98,969.49,0.0
256,352,3072,1536,ck,12,1,9.0419,a8w8_blockscale_bpreshuffle_1x128x128_256x32x64x256_16x16_16x16_16x16x1_16x16x1_1x32x1x8_8_2x1_intrawave_v1,367.39,820.84,0.0
256,384,3072,1536,ck,12,2,9.3187,a8w8_blockscale_bpreshuffle_1x128x128_256x32x64x256_16x16_16x16_16x16x1_16x16x1_1x32x1x8_8_2x1_intrawave_v1,388.88,822.83,0.0
256,416,3072,1536,ck,12,0,10.1748,a8w8_blockscale_bpreshuffle_1x128x128_256x32x64x256_16x16_16x16_16x16x1_16x16x1_1x32x1x8_8_2x1_intrawave_v1,385.84,777.75,0.0
256,448,3072,1536,ck,12,3,9.9309,a8w8_blockscale_bpreshuffle_1x128x128_256x32x64x256_16x16_16x16_16x16x1_16x16x1_1x32x1x8_8_2x1_intrawave_v1,425.73,821.6,0.0
256,480,3072,1536,ck,12,3,10.1658,a8w8_blockscale_bpreshuffle_1x128x128_256x32x64x256_16x16_16x16_16x16x1_16x16x1_1x32x1x8_8_2x1_intrawave_v1,445.6,826.79,0.0
256,512,3072,1536,ck,12,3,10.4465,a8w8_blockscale_bpreshuffle_1x128x128_256x32x64x256_16x16_16x16_16x16x1_16x16x1_1x32x1x8_8_2x1_intrawave_v1,462.53,828.1,0.0
256,544,3072,1536,ck,11,0,10.5433,a8w8_blockscale_bpreshuffle_1x128x128_256x32x128x256_16x16_16x16_16x16x1_16x16x1_1x32x1x8_8_2x1_intrawave_v1,486.93,843.81,0.0
256,576,3072,1536,ck,17,2,10.5249,a8w8_blockscale_bpreshuffle_1x128x128_256x64x64x256_16x16_16x16_16x16x1_16x16x1_1x32x1x8_8_2x1_intrawave_v1,516.47,868.63,0.0
256,608,3072,1536,ck,11,0,10.7271,a8w8_blockscale_bpreshuffle_1x128x128_256x32x128x256_16x16_16x16_16x16x1_16x16x1_1x32x1x8_8_2x1_intrawave_v1,534.89,875.17,0.0
256,640,3072,1536,ck,17,1,10.747,a8w8_blockscale_bpreshuffle_1x128x128_256x64x64x256_16x16_16x16_16x16x1_16x16x1_1x32x1x8_8_2x1_intrawave_v1,562.0,896.42,0.0
256,672,3072,1536,ck,11,3,11.0288,a8w8_blockscale_bpreshuffle_1x128x128_256x32x128x256_16x16_16x16_16x16x1_16x16x1_1x32x1x8_8_2x1_intrawave_v1,575.02,895.8,0.0
256,704,3072,1536,ck,15,2,12.4844,a8w8_blockscale_bpreshuffle_1x128x128_256x64x64x128_16x16_16x16_8x32x1_8x32x1_1x32x1x8_8_2x1_intrawave_v1,532.17,811.04,0.0124
256,736,3072,1536,ck,15,0,13.0097,a8w8_blockscale_bpreshuffle_1x128x128_256x64x64x128_16x16_16x16_8x32x1_8x32x1_1x32x1x8_8_2x1_intrawave_v1,533.89,797.18,0.0135
256,768,3072,1536,ck,15,0,12.7154,a8w8_blockscale_bpreshuffle_1x128x128_256x64x64x128_16x16_16x16_8x32x1_8x32x1_1x32x1x8_8_2x1_intrawave_v1,570.0,834.96,0.0129
256,800,3072,1536,ck,11,3,13.2314,a8w8_blockscale_bpreshuffle_1x128x128_256x32x128x256_16x16_16x16_16x16x1_16x16x1_1x32x1x8_8_2x1_intrawave_v1,570.59,820.97,0.0
256,832,3072,1536,ck,11,2,13.3318,a8w8_blockscale_bpreshuffle_1x128x128_256x32x128x256_16x16_16x16_16x16x1_16x16x1_1x32x1x8_8_2x1_intrawave_v1,588.95,833.22,0.0
256,864,3072,1536,ck,11,1,13.442,a8w8_blockscale_bpreshuffle_1x128x128_256x32x128x256_16x16_16x16_16x16x1_16x16x1_1x32x1x8_8_2x1_intrawave_v1,606.59,844.67,0.0
256,896,3072,1536,ck,11,1,13.4966,a8w8_blockscale_bpreshuffle_1x128x128_256x32x128x256_16x16_16x16_16x16x1_16x16x1_1x32x1x8_8_2x1_intrawave_v1,626.51,859.47,0.0
256,928,3072,1536,ck,11,3,13.732,a8w8_blockscale_bpreshuffle_1x128x128_256x32x128x256_16x16_16x16_16x16x1_16x16x1_1x32x1x8_8_2x1_intrawave_v1,637.76,862.63,0.0
256,960,3072,1536,ck,11,0,13.957,a8w8_blockscale_bpreshuffle_1x128x128_256x32x128x256_16x16_16x16_16x16x1_16x16x1_1x32x1x8_8_2x1_intrawave_v1,649.11,866.33,0.0
256,992,3072,1536,ck,15,0,14.264,a8w8_blockscale_bpreshuffle_1x128x128_256x64x64x128_16x16_16x16_8x32x1_8x32x1_1x32x1x8_8_2x1_intrawave_v1,656.32,864.92,0.0138
256,1024,3072,1536,ck,15,3,14.3396,a8w8_blockscale_bpreshuffle_1x128x128_256x64x64x128_16x16_16x16_8x32x1_8x32x1_1x32x1x8_8_2x1_intrawave_v1,673.92,877.49,0.0133
256,1088,3072,1536,ck,14,2,14.3872,a8w8_blockscale_bpreshuffle_1x128x128_256x64x128x128_16x16_16x16_8x32x1_8x32x1_1x32x1x8_8_2x1_intrawave_v1,713.67,908.75,0.0
256,1152,3072,1536,ck,14,2,14.4904,a8w8_blockscale_bpreshuffle_1x128x128_256x64x128x128_16x16_16x16_8x32x1_8x32x1_1x32x1x8_8_2x1_intrawave_v1,750.26,936.2,0.0
256,1216,3072,1536,ck,14,0,14.7284,a8w8_blockscale_bpreshuffle_1x128x128_256x64x128x128_16x16_16x16_8x32x1_8x32x1_1x32x1x8_8_2x1_intrawave_v1,779.15,954.45,0.0
256,1280,3072,1536,ck,14,2,14.9876,a8w8_blockscale_bpreshuffle_1x128x128_256x64x128x128_16x16_16x16_8x32x1_8x32x1_1x32x1x8_8_2x1_intrawave_v1,805.97,970.74,0.0
256,1344,3072,1536,ck,14,3,15.1951,a8w8_blockscale_bpreshuffle_1x128x128_256x64x128x128_16x16_16x16_8x32x1_8x32x1_1x32x1x8_8_2x1_intrawave_v1,834.71,989.83,0.0
256,1408,3072,1536,ck,14,0,18.249,a8w8_blockscale_bpreshuffle_1x128x128_256x64x128x128_16x16_16x16_8x32x1_8x32x1_1x32x1x8_8_2x1_intrawave_v1,728.13,851.12,0.0
256,1472,3072,1536,ck,14,1,18.584,a8w8_blockscale_bpreshuffle_1x128x128_256x64x128x128_16x16_16x16_8x32x1_8x32x1_1x32x1x8_8_2x1_intrawave_v1,747.5,862.22,0.0
256,1536,3072,1536,ck,14,0,18.6817,a8w8_blockscale_bpreshuffle_1x128x128_256x64x128x128_16x16_16x16_8x32x1_8x32x1_1x32x1x8_8_2x1_intrawave_v1,775.92,884.02,0.0
256,1600,3072,1536,ck,14,0,18.9474,a8w8_blockscale_bpreshuffle_1x128x128_256x64x128x128_16x16_16x16_8x32x1_8x32x1_1x32x1x8_8_2x1_intrawave_v1,796.92,897.57,0.0001
256,1664,3072,1536,ck,14,2,19.1396,a8w8_blockscale_bpreshuffle_1x128x128_256x64x128x128_16x16_16x16_8x32x1_8x32x1_1x32x1x8_8_2x1_intrawave_v1,820.47,914.24,0.0001
256,1728,3072,1536,ck,14,1,19.3538,a8w8_blockscale_bpreshuffle_1x128x128_256x64x128x128_16x16_16x16_8x32x1_8x32x1_1x32x1x8_8_2x1_intrawave_v1,842.6,929.51,0.0001
256,1792,3072,1536,ck,14,2,19.5763,a8w8_blockscale_bpreshuffle_1x128x128_256x64x128x128_16x16_16x16_8x32x1_8x32x1_1x32x1x8_8_2x1_intrawave_v1,863.87,944.06,0.0002
256,1856,3072,1536,ck,14,1,19.6113,a8w8_blockscale_bpreshuffle_1x128x128_256x64x128x128_16x16_16x16_8x32x1_8x32x1_1x32x1x8_8_2x1_intrawave_v1,893.13,967.44,0.0001
256,1920,3072,1536,ck,14,1,19.9192,a8w8_blockscale_bpreshuffle_1x128x128_256x64x128x128_16x16_16x16_8x32x1_8x32x1_1x32x1x8_8_2x1_intrawave_v1,909.64,977.16,0.0002
256,1984,3072,1536,ck,14,1,20.3927,a8w8_blockscale_bpreshuffle_1x128x128_256x64x128x128_16x16_16x16_8x32x1_8x32x1_1x32x1x8_8_2x1_intrawave_v1,918.14,978.57,0.0002
256,2048,3072,1536,ck,14,1,20.3673,a8w8_blockscale_bpreshuffle_1x128x128_256x64x128x128_16x16_16x16_8x32x1_8x32x1_1x32x1x8_8_2x1_intrawave_v1,948.94,1003.92,0.0002
256,4096,3072,1536,ck,13,3,33.1911,a8w8_blockscale_bpreshuffle_1x128x128_256x64x256x128_16x16_16x16_8x32x1_8x32x1_1x32x1x8_8_2x1_intrawave_v1,1164.61,1089.93,0.0
256,8192,3072,1536,ck,13,0,61.9664,a8w8_blockscale_bpreshuffle_1x128x128_256x64x256x128_16x16_16x16_8x32x1_8x32x1_1x32x1x8_8_2x1_intrawave_v1,1247.6,1091.45,0.0
256,16384,3072,1536,ck,13,3,112.7176,a8w8_blockscale_bpreshuffle_1x128x128_256x64x256x128_16x16_16x16_8x32x1_8x32x1_1x32x1x8_8_2x1_intrawave_v1,1371.74,1158.18,0.0
256,32768,3072,1536,ck,13,3,208.9152,a8w8_blockscale_bpreshuffle_1x128x128_256x64x256x128_16x16_16x16_8x32x1_8x32x1_1x32x1x8_8_2x1_intrawave_v1,1480.21,1227.18,0.0
256,16,4096,512,ck,7,1,3.0552,a8w8_blockscale_bpreshuffle_1x128x128_256x16x64x256_16x16_16x16_16x16x1_16x16x1_1x16x1x16_4_1x1_intrawave_v1,21.97,732.0,0.0
256,32,4096,512,ck,7,1,3.3208,a8w8_blockscale_bpreshuffle_1x128x128_256x16x64x256_16x16_16x16_16x16x1_16x16x1_1x16x1x16_4_1x1_intrawave_v1,40.42,715.39,0.0
256,48,4096,512,ck,7,3,3.3772,a8w8_blockscale_bpreshuffle_1x128x128_256x16x64x256_16x16_16x16_16x16x1_16x16x1_1x16x1x16_4_1x1_intrawave_v1,59.61,744.68,0.0
256,64,4096,512,ck,7,1,3.4741,a8w8_blockscale_bpreshuffle_1x128x128_256x16x64x256_16x16_16x16_16x16x1_16x16x1_1x16x1x16_4_1x1_intrawave_v1,77.27,764.0,0.0
256,80,4096,512,ck,7,3,3.9462,a8w8_blockscale_bpreshuffle_1x128x128_256x16x64x256_16x16_16x16_16x16x1_16x16x1_1x16x1x16_4_1x1_intrawave_v1,85.03,707.89,0.0
256,96,4096,512,ck,6,1,3.9702,a8w8_blockscale_bpreshuffle_1x128x128_256x16x128x256_16x16_16x16_16x16x1_16x16x1_1x16x1x16_8_1x2_intrawave_v1,101.42,738.69,0.0
256,112,4096,512,ck,6,2,4.0011,a8w8_blockscale_bpreshuffle_1x128x128_256x16x128x256_16x16_16x16_16x16x1_16x16x1_1x16x1x16_8_1x2_intrawave_v1,117.41,767.79,0.0
256,128,4096,512,ck,6,0,3.9503,a8w8_blockscale_bpreshuffle_1x128x128_256x16x128x256_16x16_16x16_16x16x1_16x16x1_1x16x1x16_8_1x2_intrawave_v1,135.91,812.92,0.0
256,144,4096,512,ck,7,1,4.5982,a8w8_blockscale_bpreshuffle_1x128x128_256x16x64x256_16x16_16x16_16x16x1_16x16x1_1x16x1x16_4_1x1_intrawave_v1,131.35,728.66,0.0
256,160,4096,512,ck,7,1,4.6716,a8w8_blockscale_bpreshuffle_1x128x128_256x16x64x256_16x16_16x16_16x16x1_16x16x1_1x16x1x16_4_1x1_intrawave_v1,143.65,747.02,0.0
256,176,4096,512,ck,7,2,4.656,a8w8_blockscale_bpreshuffle_1x128x128_256x16x64x256_16x16_16x16_16x16x1_16x16x1_1x16x1x16_4_1x1_intrawave_v1,158.55,779.44,0.0
256,192,4096,512,ck,7,1,4.6786,a8w8_blockscale_bpreshuffle_1x128x128_256x16x64x256_16x16_16x16_16x16x1_16x16x1_1x16x1x16_4_1x1_intrawave_v1,172.13,805.44,0.0
256,208,4096,512,ck,11,2,4.7496,a8w8_blockscale_bpreshuffle_1x128x128_256x32x128x256_16x16_16x16_16x16x1_16x16x1_1x32x1x8_8_2x1_intrawave_v1,183.68,822.72,0.0
256,224,4096,512,ck,11,1,4.7672,a8w8_blockscale_bpreshuffle_1x128x128_256x32x128x256_16x16_16x16_16x16x1_16x16x1_1x32x1x8_8_2x1_intrawave_v1,197.08,848.89,0.0
256,240,4096,512,ck,12,1,4.7507,a8w8_blockscale_bpreshuffle_1x128x128_256x32x64x256_16x16_16x16_16x16x1_16x16x1_1x32x1x8_8_2x1_intrawave_v1,211.89,881.16,0.0
256,256,4096,512,ck,11,1,4.7256,a8w8_blockscale_bpreshuffle_1x128x128_256x32x128x256_16x16_16x16_16x16x1_16x16x1_1x32x1x8_8_2x1_intrawave_v1,227.22,915.31,0.0
256,288,4096,512,ck,12,2,5.7446,a8w8_blockscale_bpreshuffle_1x128x128_256x32x64x256_16x16_16x16_16x16x1_16x16x1_1x32x1x8_8_2x1_intrawave_v1,210.28,801.43,0.0
256,320,4096,512,ck,12,2,5.755,a8w8_blockscale_bpreshuffle_1x128x128_256x32x64x256_16x16_16x16_16x16x1_16x16x1_1x32x1x8_8_2x1_intrawave_v1,233.22,848.38,0.0
256,352,4096,512,ck,12,1,5.7994,a8w8_blockscale_bpreshuffle_1x128x128_256x32x64x256_16x16_16x16_16x16x1_16x16x1_1x32x1x8_8_2x1_intrawave_v1,254.58,889.91,0.0
256,384,4096,512,ck,12,2,5.8756,a8w8_blockscale_bpreshuffle_1x128x128_256x32x64x256_16x16_16x16_16x16x1_16x16x1_1x32x1x8_8_2x1_intrawave_v1,274.12,925.78,0.0
256,416,4096,512,ck,16,3,6.2048,a8w8_blockscale_bpreshuffle_1x128x128_256x64x128x256_16x16_16x16_16x16x1_16x16x1_1x32x1x8_8_2x1_intrawave_v1,281.21,921.55,0.0
256,448,4096,512,ck,14,2,6.1561,a8w8_blockscale_bpreshuffle_1x128x128_256x64x128x128_16x16_16x16_8x32x1_8x32x1_1x32x1x8_8_2x1_intrawave_v1,305.23,974.08,0.0
256,480,4096,512,ck,1,0,5.9825,a8w8_blockscale_bpreshuffle_1x128x128_256x64x128x128_16x16_16x16_8x32x1_8x32x1_1x32x1x8_8_2x1_intrawave_v3,336.53,1048.9,0.0
256,512,4096,512,ck,16,2,6.2492,a8w8_blockscale_bpreshuffle_1x128x128_256x64x128x256_16x16_16x16_16x16x1_16x16x1_1x32x1x8_8_2x1_intrawave_v1,343.64,1048.71,0.0
256,544,4096,512,ck,15,3,6.4914,a8w8_blockscale_bpreshuffle_1x128x128_256x64x64x128_16x16_16x16_8x32x1_8x32x1_1x32x1x8_8_2x1_intrawave_v1,351.5,1052.49,0.0113
256,576,4096,512,ck,12,0,6.3882,a8w8_blockscale_bpreshuffle_1x128x128_256x32x64x256_16x16_16x16_16x16x1_16x16x1_1x32x1x8_8_2x1_intrawave_v1,378.18,1113.09,0.0
256,608,4096,512,ck,12,2,6.4268,a8w8_blockscale_bpreshuffle_1x128x128_256x32x64x256_16x16_16x16_16x16x1_16x16x1_1x32x1x8_8_2x1_intrawave_v1,396.8,1149.75,0.0
256,640,4096,512,ck,15,1,6.5563,a8w8_blockscale_bpreshuffle_1x128x128_256x64x64x128_16x16_16x16_8x32x1_8x32x1_1x32x1x8_8_2x1_intrawave_v1,409.43,1169.52,0.0116
256,672,4096,512,ck,11,1,6.5676,a8w8_blockscale_bpreshuffle_1x128x128_256x32x128x256_16x16_16x16_16x16x1_16x16x1_1x32x1x8_8_2x1_intrawave_v1,429.16,1209.92,0.0
256,704,4096,512,ck,9,3,6.3586,a8w8_blockscale_bpreshuffle_1x128x128_256x32x128x128_16x16_16x16_8x32x1_8x32x1_1x32x1x8_8_2x1_intrawave_v1,464.38,1293.49,0.0
256,736,4096,512,ck,11,2,6.7443,a8w8_blockscale_bpreshuffle_1x128x128_256x32x128x256_16x16_16x16_16x16x1_16x16x1_1x32x1x8_8_2x1_intrawave_v1,457.72,1260.81,0.0
256,768,4096,512,ck,11,0,7.0254,a8w8_blockscale_bpreshuffle_1x128x128_256x32x128x256_16x16_16x16_16x16x1_16x16x1_1x32x1x8_8_2x1_intrawave_v1,458.51,1250.01,0.0
256,800,4096,512,ck,1,0,8.7332,a8w8_blockscale_bpreshuffle_1x128x128_256x64x128x128_16x16_16x16_8x32x1_8x32x1_1x32x1x8_8_2x1_intrawave_v3,384.22,1037.46,0.0
256,832,4096,512,ck,16,0,8.3249,a8w8_blockscale_bpreshuffle_1x128x128_256x64x128x256_16x16_16x16_16x16x1_16x16x1_1x32x1x8_8_2x1_intrawave_v1,419.18,1121.8,0.0
256,864,4096,512,ck,1,0,9.1833,a8w8_blockscale_bpreshuffle_1x128x128_256x64x128x128_16x16_16x16_8x32x1_8x32x1_1x32x1x8_8_2x1_intrawave_v3,394.62,1047.27,0.0
256,896,4096,512,ck,16,1,9.2055,a8w8_blockscale_bpreshuffle_1x128x128_256x64x128x256_16x16_16x16_16x16x1_16x16x1_1x32x1x8_8_2x1_intrawave_v1,408.24,1075.0,0.0
256,928,4096,512,ck,14,1,9.5269,a8w8_blockscale_bpreshuffle_1x128x128_256x64x128x128_16x16_16x16_8x32x1_8x32x1_1x32x1x8_8_2x1_intrawave_v1,408.56,1067.97,0.0
256,960,4096,512,ck,16,2,8.7076,a8w8_blockscale_bpreshuffle_1x128x128_256x64x128x256_16x16_16x16_16x16x1_16x16x1_1x32x1x8_8_2x1_intrawave_v1,462.42,1200.44,0.0
256,992,4096,512,ck,17,1,9.5017,a8w8_blockscale_bpreshuffle_1x128x128_256x64x64x256_16x16_16x16_16x16x1_16x16x1_1x32x1x8_8_2x1_intrawave_v1,437.9,1129.43,0.0
256,1024,4096,512,ck,14,2,9.0308,a8w8_blockscale_bpreshuffle_1x128x128_256x64x128x128_16x16_16x16_8x32x1_8x32x1_1x32x1x8_8_2x1_intrawave_v1,475.59,1219.17,0.0
256,1088,4096,512,ck,11,3,10.2159,a8w8_blockscale_bpreshuffle_1x128x128_256x32x128x256_16x16_16x16_16x16x1_16x16x1_1x32x1x8_8_2x1_intrawave_v1,446.7,1132.26,0.0
256,1152,4096,512,ck,11,0,10.083,a8w8_blockscale_bpreshuffle_1x128x128_256x32x128x256_16x16_16x16_16x16x1_16x16x1_1x32x1x8_8_2x1_intrawave_v1,479.21,1202.44,0.0
256,1216,4096,512,ck,11,3,10.2352,a8w8_blockscale_bpreshuffle_1x128x128_256x32x128x256_16x16_16x16_16x16x1_16x16x1_1x32x1x8_8_2x1_intrawave_v1,498.31,1238.98,0.0
256,1280,4096,512,ck,11,0,10.1863,a8w8_blockscale_bpreshuffle_1x128x128_256x32x128x256_16x16_16x16_16x16x1_16x16x1_1x32x1x8_8_2x1_intrawave_v1,527.05,1299.62,0.0
256,1344,4096,512,ck,11,0,10.9281,a8w8_blockscale_bpreshuffle_1x128x128_256x32x128x256_16x16_16x16_16x16x1_16x16x1_1x32x1x8_8_2x1_intrawave_v1,515.84,1262.37,0.0
256,1408,4096,512,ck,11,2,11.1125,a8w8_blockscale_bpreshuffle_1x128x128_256x32x128x256_16x16_16x16_16x16x1_16x16x1_1x32x1x8_8_2x1_intrawave_v1,531.44,1291.55,0.0
256,1472,4096,512,ck,11,2,11.2089,a8w8_blockscale_bpreshuffle_1x128x128_256x32x128x256_16x16_16x16_16x16x1_16x16x1_1x32x1x8_8_2x1_intrawave_v1,550.81,1330.14,0.0
256,1536,4096,512,ck,11,3,11.5137,a8w8_blockscale_bpreshuffle_1x128x128_256x32x128x256_16x16_16x16_16x16x1_16x16x1_1x32x1x8_8_2x1_intrawave_v1,559.55,1343.31,0.0
256,1600,4096,512,ck,11,1,12.1335,a8w8_blockscale_bpreshuffle_1x128x128_256x32x128x256_16x16_16x16_16x16x1_16x16x1_1x32x1x8_8_2x1_intrawave_v1,553.09,1320.6,0.0
256,1664,4096,512,ck,11,3,12.2809,a8w8_blockscale_bpreshuffle_1x128x128_256x32x128x256_16x16_16x16_16x16x1_16x16x1_1x32x1x8_8_2x1_intrawave_v1,568.31,1350.11,0.0
256,1728,4096,512,ck,11,0,12.4003,a8w8_blockscale_bpreshuffle_1x128x128_256x32x128x256_16x16_16x16_16x16x1_16x16x1_1x32x1x8_8_2x1_intrawave_v1,584.48,1382.04,0.0
256,1792,4096,512,ck,11,3,12.5208,a8w8_blockscale_bpreshuffle_1x128x128_256x32x128x256_16x16_16x16_16x16x1_16x16x1_1x32x1x8_8_2x1_intrawave_v1,600.3,1413.23,0.0
256,1856,4096,512,ck,11,1,13.3404,a8w8_blockscale_bpreshuffle_1x128x128_256x32x128x256_16x16_16x16_16x16x1_16x16x1_1x32x1x8_8_2x1_intrawave_v1,583.54,1368.16,0.0
256,1920,4096,512,ck,11,0,13.6572,a8w8_blockscale_bpreshuffle_1x128x128_256x32x128x256_16x16_16x16_16x16x1_16x16x1_1x32x1x8_8_2x1_intrawave_v1,589.66,1377.21,0.0
256,1984,4096,512,ck,16,3,13.9085,a8w8_blockscale_bpreshuffle_1x128x128_256x64x128x256_16x16_16x16_16x16x1_16x16x1_1x32x1x8_8_2x1_intrawave_v1,598.3,1392.38,0.0
256,2048,4096,512,ck,9,0,14.4711,a8w8_blockscale_bpreshuffle_1x128x128_256x32x128x128_16x16_16x16_8x32x1_8x32x1_1x32x1x8_8_2x1_intrawave_v1,593.59,1376.74,0.0007
256,4096,4096,512,ck,16,2,24.0494,a8w8_blockscale_bpreshuffle_1x128x128_256x64x128x256_16x16_16x16_16x16x1_16x16x1_1x32x1x8_8_2x1_intrawave_v1,714.36,1569.63,0.0
256,8192,4096,512,ck,16,1,42.0698,a8w8_blockscale_bpreshuffle_1x128x128_256x64x128x256_16x16_16x16_16x16x1_16x16x1_1x32x1x8_8_2x1_intrawave_v1,816.73,1744.73,0.0
256,16384,4096,512,ck,16,3,78.6463,a8w8_blockscale_bpreshuffle_1x128x128_256x64x128x256_16x16_16x16_16x16x1_16x16x1_1x32x1x8_8_2x1_intrawave_v1,873.78,1839.93,0.0
256,32768,4096,512,ck,16,3,145.9367,a8w8_blockscale_bpreshuffle_1x128x128_256x64x128x256_16x16_16x16_16x16x1_16x16x1_1x32x1x8_8_2x1_intrawave_v1,941.77,1968.73,0.0
256,16,4608,7168,asm,6,7,15.2716,_ZN5aiter42fp8gemm_bf16_blockscale_BpreShuffle_32x128E,69.21,2180.01,0.0061
256,32,4608,7168,asm,5,6,18.0016,_ZN5aiter42fp8gemm_bf16_blockscale_BpreShuffle_32x128E,117.43,1863.97,0.0038
256,48,4608,7168,ck,7,1,17.7843,a8w8_blockscale_bpreshuffle_1x128x128_256x16x64x256_16x16_16x16_16x16x1_16x16x1_1x16x1x16_4_1x1_intrawave_v1,178.3,1901.48,0.0
256,64,4608,7168,ck,12,1,19.3293,a8w8_blockscale_bpreshuffle_1x128x128_256x32x64x256_16x16_16x16_16x16x1_16x16x1_1x32x1x8_8_2x1_intrawave_v1,218.73,1763.06,0.0
256,80,4608,7168,asm,29,6,20.482,_ZN5aiter42fp8gemm_bf16_blockscale_BpreShuffle_80x128E,258.02,1676.64,0.0039
256,96,4608,7168,ck,12,2,19.1124,a8w8_blockscale_bpreshuffle_1x128x128_256x32x64x256_16x16_16x16_16x16x1_16x16x1_1x32x1x8_8_2x1_intrawave_v1,331.82,1810.5,0.0
256,112,4608,7168,ck,7,0,20.8298,a8w8_blockscale_bpreshuffle_1x128x128_256x16x64x256_16x16_16x16_16x16x1_16x16x1_1x16x1x16_4_1x1_intrawave_v1,355.2,1673.81,0.0
256,128,4608,7168,ck,17,3,21.9978,a8w8_blockscale_bpreshuffle_1x128x128_256x64x64x256_16x16_16x16_16x16x1_16x16x1_1x32x1x8_8_2x1_intrawave_v1,384.39,1596.85,0.0
256,144,4608,7168,ck,17,2,22.7318,a8w8_blockscale_bpreshuffle_1x128x128_256x64x64x256_16x16_16x16_16x16x1_16x16x1_1x32x1x8_8_2x1_intrawave_v1,418.47,1556.83,0.0
256,160,4608,7168,ck,17,1,22.8638,a8w8_blockscale_bpreshuffle_1x128x128_256x64x64x256_16x16_16x16_16x16x1_16x16x1_1x32x1x8_8_2x1_intrawave_v1,462.29,1559.3,0.0
256,176,4608,7168,ck,17,3,22.7904,a8w8_blockscale_bpreshuffle_1x128x128_256x64x64x256_16x16_16x16_16x16x1_16x16x1_1x32x1x8_8_2x1_intrawave_v1,510.15,1575.83,0.0
256,192,4608,7168,ck,17,0,22.1243,a8w8_blockscale_bpreshuffle_1x128x128_256x64x64x256_16x16_16x16_16x16x1_16x16x1_1x32x1x8_8_2x1_intrawave_v1,573.29,1635.12,0.0
256,208,4608,7168,ck,12,3,24.4541,a8w8_blockscale_bpreshuffle_1x128x128_256x32x64x256_16x16_16x16_16x16x1_16x16x1_1x32x1x8_8_2x1_intrawave_v1,561.89,1490.06,0.0
256,224,4608,7168,ck,11,1,23.2825,a8w8_blockscale_bpreshuffle_1x128x128_256x32x128x256_16x16_16x16_16x16x1_16x16x1_1x32x1x8_8_2x1_intrawave_v1,635.56,1576.3,0.0
256,240,4608,7168,asm,25,2,29.5662,_ZN5aiter42fp8gemm_bf16_blockscale_BpreShuffle_80x128E,536.24,1250.15,0.0
256,256,4608,7168,asm,33,2,30.6975,_ZN5aiter42fp8gemm_bf16_blockscale_BpreShuffle_96x128E,550.91,1212.62,0.0
256,288,4608,7168,asm,33,2,32.1444,_ZN5aiter42fp8gemm_bf16_blockscale_BpreShuffle_96x128E,591.87,1174.35,0.0
256,320,4608,7168,ck,17,1,32.9067,a8w8_blockscale_bpreshuffle_1x128x128_256x64x64x256_16x16_16x16_16x16x1_16x16x1_1x32x1x8_8_2x1_intrawave_v1,642.4,1163.08,0.0
256,352,4608,7168,ck,17,0,34.18,a8w8_blockscale_bpreshuffle_1x128x128_256x64x64x256_16x16_16x16_16x16x1_16x16x1_1x32x1x8_8_2x1_intrawave_v1,680.32,1135.09,0.0
256,384,4608,7168,ck,17,0,33.6281,a8w8_blockscale_bpreshuffle_1x128x128_256x64x64x256_16x16_16x16_16x16x1_16x16x1_1x32x1x8_8_2x1_intrawave_v1,754.34,1169.31,0.0
256,416,4608,7168,ck,17,2,34.9307,a8w8_blockscale_bpreshuffle_1x128x128_256x64x64x256_16x16_16x16_16x16x1_16x16x1_1x32x1x8_8_2x1_intrawave_v1,786.73,1140.71,0.0
256,448,4608,7168,ck,17,1,34.9288,a8w8_blockscale_bpreshuffle_1x128x128_256x64x64x256_16x16_16x16_16x16x1_16x16x1_1x32x1x8_8_2x1_intrawave_v1,847.3,1155.78,0.0
256,480,4608,7168,asm,24,1,38.712,_ZN5aiter42fp8gemm_bf16_blockscale_BpreShuffle_80x128E,819.1,1056.38,0.0
256,512,4608,7168,asm,24,1,39.7384,_ZN5aiter42fp8gemm_bf16_blockscale_BpreShuffle_80x128E,851.14,1042.29,0.0
256,544,4608,7168,asm,24,1,39.5096,_ZN5aiter42fp8gemm_bf16_blockscale_BpreShuffle_80x128E,909.57,1061.59,0.0
256,576,4608,7168,ck,14,2,41.2326,a8w8_blockscale_bpreshuffle_1x128x128_256x64x128x128_16x16_16x16_8x32x1_8x32x1_1x32x1x8_8_2x1_intrawave_v1,922.83,1029.95,0.0
256,608,4608,7168,asm,32,1,43.0284,_ZN5aiter42fp8gemm_bf16_blockscale_BpreShuffle_96x128E,933.45,999.15,0.0
256,640,4608,7168,asm,32,1,43.5543,_ZN5aiter42fp8gemm_bf16_blockscale_BpreShuffle_96x128E,970.71,999.12,0.0
256,672,4608,7168,asm,32,1,44.5176,_ZN5aiter42fp8gemm_bf16_blockscale_BpreShuffle_96x128E,997.19,989.28,0.0
256,704,4608,7168,ck,14,2,46.003,a8w8_blockscale_bpreshuffle_1x128x128_256x64x128x128_16x16_16x16_8x32x1_8x32x1_1x32x1x8_8_2x1_intrawave_v1,1010.94,968.73,0.0001
256,736,4608,7168,ck,14,2,48.4991,a8w8_blockscale_bpreshuffle_1x128x128_256x64x128x128_16x16_16x16_8x32x1_8x32x1_1x32x1x8_8_2x1_intrawave_v1,1002.5,929.68,0.0
256,768,4608,7168,ck,14,0,47.6445,a8w8_blockscale_bpreshuffle_1x128x128_256x64x128x128_16x16_16x16_8x32x1_8x32x1_1x32x1x8_8_2x1_intrawave_v1,1064.85,957.36,0.0001
256,800,4608,7168,ck,14,1,50.0325,a8w8_blockscale_bpreshuffle_1x128x128_256x64x128x128_16x16_16x16_8x32x1_8x32x1_1x32x1x8_8_2x1_intrawave_v1,1056.28,922.15,0.0
256,832,4608,7168,ck,14,1,48.3763,a8w8_blockscale_bpreshuffle_1x128x128_256x64x128x128_16x16_16x16_8x32x1_8x32x1_1x32x1x8_8_2x1_intrawave_v1,1136.14,964.56,0.0001
256,864,4608,7168,ck,14,0,49.9305,a8w8_blockscale_bpreshuffle_1x128x128_256x64x128x128_16x16_16x16_8x32x1_8x32x1_1x32x1x8_8_2x1_intrawave_v1,1143.11,945.03,0.0001
256,896,4608,7168,ck,14,0,49.8244,a8w8_blockscale_bpreshuffle_1x128x128_256x64x128x128_16x16_16x16_8x32x1_8x32x1_1x32x1x8_8_2x1_intrawave_v1,1187.97,957.57,0.0002
256,928,4608,7168,ck,13,3,61.8834,a8w8_blockscale_bpreshuffle_1x128x128_256x64x256x128_16x16_16x16_8x32x1_8x32x1_1x32x1x8_8_2x1_intrawave_v1,990.64,779.44,0.0
256,960,4608,7168,ck,13,3,60.9068,a8w8_blockscale_bpreshuffle_1x128x128_256x64x256x128_16x16_16x16_8x32x1_8x32x1_1x32x1x8_8_2x1_intrawave_v1,1041.23,800.55,0.0
256,992,4608,7168,ck,14,0,66.1205,a8w8_blockscale_bpreshuffle_1x128x128_256x64x128x128_16x16_16x16_8x32x1_8x32x1_1x32x1x8_8_2x1_intrawave_v1,991.1,745.35,0.0001
256,1024,4608,7168,ck,14,2,65.7386,a8w8_blockscale_bpreshuffle_1x128x128_256x64x128x128_16x16_16x16_8x32x1_8x32x1_1x32x1x8_8_2x1_intrawave_v1,1029.01,757.66,0.0001
256,1088,4608,7168,ck,13,2,63.8805,a8w8_blockscale_bpreshuffle_1x128x128_256x64x256x128_16x16_16x16_8x32x1_8x32x1_1x32x1x8_8_2x1_intrawave_v1,1125.13,796.11,0.0
256,1152,4608,7168,ck,13,3,63.2225,a8w8_blockscale_bpreshuffle_1x128x128_256x64x256x128_16x16_16x16_8x32x1_8x32x1_1x32x1x8_8_2x1_intrawave_v1,1203.71,820.98,0.0
256,1216,4608,7168,ck,13,3,64.0487,a8w8_blockscale_bpreshuffle_1x128x128_256x64x256x128_16x16_16x16_8x32x1_8x32x1_1x32x1x8_8_2x1_intrawave_v1,1254.19,826.76,0.0
256,1280,4608,7168,ck,13,0,65.3535,a8w8_blockscale_bpreshuffle_1x128x128_256x64x256x128_16x16_16x16_8x32x1_8x32x1_1x32x1x8_8_2x1_intrawave_v1,1293.84,826.3,0.0
256,1344,4608,7168,ck,14,2,68.5361,a8w8_blockscale_bpreshuffle_1x128x128_256x64x128x128_16x16_16x16_8x32x1_8x32x1_1x32x1x8_8_2x1_intrawave_v1,1295.45,803.23,0.0002
256,1408,4608,7168,ck,13,3,66.8949,a8w8_blockscale_bpreshuffle_1x128x128_256x64x256x128_16x16_16x16_8x32x1_8x32x1_1x32x1x8_8_2x1_intrawave_v1,1390.43,838.61,0.0
256,1472,4608,7168,ck,13,1,69.2041,a8w8_blockscale_bpreshuffle_1x128x128_256x64x256x128_16x16_16x16_8x32x1_8x32x1_1x32x1x8_8_2x1_intrawave_v1,1405.13,825.78,0.0
256,1536,4608,7168,ck,13,1,74.7941,a8w8_blockscale_bpreshuffle_1x128x128_256x64x256x128_16x16_16x16_8x32x1_8x32x1_1x32x1x8_8_2x1_intrawave_v1,1356.64,778.08,0.0
256,1600,4608,7168,ck,13,0,76.1542,a8w8_blockscale_bpreshuffle_1x128x128_256x64x256x128_16x16_16x16_8x32x1_8x32x1_1x32x1x8_8_2x1_intrawave_v1,1387.93,777.96,0.0
256,1664,4608,7168,ck,13,2,76.6414,a8w8_blockscale_bpreshuffle_1x128x128_256x64x256x128_16x16_16x16_8x32x1_8x32x1_1x32x1x8_8_2x1_intrawave_v1,1434.27,786.69,0.0
256,1728,4608,7168,ck,13,2,77.3014,a8w8_blockscale_bpreshuffle_1x128x128_256x64x256x128_16x16_16x16_8x32x1_8x32x1_1x32x1x8_8_2x1_intrawave_v1,1476.72,793.54,0.0
256,1792,4608,7168,ck,13,3,78.0298,a8w8_blockscale_bpreshuffle_1x128x128_256x64x256x128_16x16_16x16_8x32x1_8x32x1_1x32x1x8_8_2x1_intrawave_v1,1517.11,799.57,0.0
256,1856,4608,7168,ck,14,0,99.5324,a8w8_blockscale_bpreshuffle_1x128x128_256x64x128x128_16x16_16x16_8x32x1_8x32x1_1x32x1x8_8_2x1_intrawave_v1,1231.84,637.37,0.0002
256,1920,4608,7168,ck,14,3,101.1285,a8w8_blockscale_bpreshuffle_1x128x128_256x64x128x128_16x16_16x16_8x32x1_8x32x1_1x32x1x8_8_2x1_intrawave_v1,1254.2,637.68,0.0002
256,1984,4608,7168,ck,14,1,103.4824,a8w8_blockscale_bpreshuffle_1x128x128_256x64x128x128_16x16_16x16_8x32x1_8x32x1_1x32x1x8_8_2x1_intrawave_v1,1266.53,633.31,0.0002
256,2048,4608,7168,ck,14,0,106.9562,a8w8_blockscale_bpreshuffle_1x128x128_256x64x128x128_16x16_16x16_8x32x1_8x32x1_1x32x1x8_8_2x1_intrawave_v1,1264.92,622.54,0.0002
256,4096,4608,7168,ck,13,3,170.5003,a8w8_blockscale_bpreshuffle_1x128x128_256x64x256x128_16x16_16x16_8x32x1_8x32x1_1x32x1x8_8_2x1_intrawave_v1,1586.99,587.32,0.0
256,8192,4608,7168,ck,13,2,304.9512,a8w8_blockscale_bpreshuffle_1x128x128_256x64x256x128_16x16_16x16_8x32x1_8x32x1_1x32x1x8_8_2x1_intrawave_v1,1774.6,548.44,0.0
256,16384,4608,7168,ck,13,0,576.4421,a8w8_blockscale_bpreshuffle_1x128x128_256x64x256x128_16x16_16x16_8x32x1_8x32x1_1x32x1x8_8_2x1_intrawave_v1,1877.61,522.98,0.0
256,32768,4608,7168,ck,13,2,1141.1482,a8w8_blockscale_bpreshuffle_1x128x128_256x64x256x128_16x16_16x16_8x32x1_8x32x1_1x32x1x8_8_2x1_intrawave_v1,1896.92,499.41,0.0
256,16,7168,2048,ck,7,3,6.76,a8w8_blockscale_bpreshuffle_1x128x128_256x16x64x256_16x16_16x16_16x16x1_16x16x1_1x16x1x16_4_1x1_intrawave_v1,69.49,2210.39,0.0
256,16,7168,2304,ck,7,0,7.8837,a8w8_blockscale_bpreshuffle_1x128x128_256x16x64x256_16x16_16x16_16x16x1_16x16x1_1x16x1x16_4_1x1_intrawave_v1,67.03,2128.61,0.0
256,32,7168,2048,ck,7,1,7.1321,a8w8_blockscale_bpreshuffle_1x128x128_256x16x64x256_16x16_16x16_16x16x1_16x16x1_1x16x1x16_4_1x1_intrawave_v1,131.73,2131.82,0.0
256,32,7168,2304,ck,7,1,8.2693,a8w8_blockscale_bpreshuffle_1x128x128_256x16x64x256_16x16_16x16_16x16x1_16x16x1_1x16x1x16_4_1x1_intrawave_v1,127.82,2061.55,0.0
256,48,7168,2048,ck,12,2,8.5295,a8w8_blockscale_bpreshuffle_1x128x128_256x32x64x256_16x16_16x16_16x16x1_16x16x1_1x32x1x8_8_2x1_intrawave_v1,165.22,1813.29,0.0
256,48,7168,2304,ck,7,2,9.3385,a8w8_blockscale_bpreshuffle_1x128x128_256x16x64x256_16x16_16x16_16x16x1_16x16x1_1x16x1x16_4_1x1_intrawave_v1,169.78,1854.02,0.0
256,64,7168,2048,ck,12,3,7.7241,a8w8_blockscale_bpreshuffle_1x128x128_256x32x64x256_16x16_16x16_16x16x1_16x16x1_1x32x1x8_8_2x1_intrawave_v1,243.27,2036.31,0.0
256,64,7168,2304,ck,7,1,9.3707,a8w8_blockscale_bpreshuffle_1x128x128_256x16x64x256_16x16_16x16_16x16x1_16x16x1_1x16x1x16_4_1x1_intrawave_v1,225.59,1876.06,0.0
256,80,7168,2048,ck,11,0,9.6843,a8w8_blockscale_bpreshuffle_1x128x128_256x32x128x256_16x16_16x16_16x16x1_16x16x1_1x32x1x8_8_2x1_intrawave_v1,242.54,1651.21,0.0
256,80,7168,2304,ck,17,2,9.9447,a8w8_blockscale_bpreshuffle_1x128x128_256x64x64x256_16x16_16x16_16x16x1_16x16x1_1x32x1x8_8_2x1_intrawave_v1,265.71,1794.55,0.0
256,96,7168,2048,ck,11,3,9.464,a8w8_blockscale_bpreshuffle_1x128x128_256x32x128x256_16x16_16x16_16x16x1_16x16x1_1x32x1x8_8_2x1_intrawave_v1,297.82,1717.34,0.0
256,96,7168,2304,ck,17,2,10.0,a8w8_blockscale_bpreshuffle_1x128x128_256x64x64x256_16x16_16x16_16x16x1_16x16x1_1x32x1x8_8_2x1_intrawave_v1,317.09,1811.25,0.0
256,112,7168,2048,ck,12,3,9.7353,a8w8_blockscale_bpreshuffle_1x128x128_256x32x64x256_16x16_16x16_16x16x1_16x16x1_1x32x1x8_8_2x1_intrawave_v1,337.77,1696.41,0.0
256,112,7168,2304,ck,17,2,10.0724,a8w8_blockscale_bpreshuffle_1x128x128_256x64x64x256_16x16_16x16_16x16x1_16x16x1_1x32x1x8_8_2x1_intrawave_v1,367.28,1824.66,0.0
256,128,7168,2048,ck,12,1,9.4236,a8w8_blockscale_bpreshuffle_1x128x128_256x32x64x256_16x16_16x16_16x16x1_16x16x1_1x32x1x8_8_2x1_intrawave_v1,398.8,1780.34,0.0
256,128,7168,2304,ck,17,1,10.103,a8w8_blockscale_bpreshuffle_1x128x128_256x64x64x256_16x16_16x16_16x16x1_16x16x1_1x32x1x8_8_2x1_intrawave_v1,418.48,1845.49,0.0
256,144,7168,2048,ck,12,1,11.5513,a8w8_blockscale_bpreshuffle_1x128x128_256x32x64x256_16x16_16x16_16x16x1_16x16x1_1x32x1x8_8_2x1_intrawave_v1,366.01,1475.1,0.0
256,144,7168,2304,ck,12,2,13.2039,a8w8_blockscale_bpreshuffle_1x128x128_256x32x64x256_16x16_16x16_16x16x1_16x16x1_1x32x1x8_8_2x1_intrawave_v1,360.22,1432.25,0.0
256,160,7168,2048,ck,10,1,11.6557,a8w8_blockscale_bpreshuffle_1x128x128_256x32x64x128_16x16_16x16_8x32x1_8x32x1_1x32x1x8_8_2x1_intrawave_v1,403.03,1484.38,0.0248
256,160,7168,2304,ck,10,0,13.2729,a8w8_blockscale_bpreshuffle_1x128x128_256x32x64x128_16x16_16x16_8x32x1_8x32x1_1x32x1x8_8_2x1_intrawave_v1,398.17,1444.86,0.0222
256,176,7168,2048,ck,12,3,11.8709,a8w8_blockscale_bpreshuffle_1x128x128_256x32x64x256_16x16_16x16_16x16x1_16x16x1_1x32x1x8_8_2x1_intrawave_v1,435.3,1479.55,0.0
256,176,7168,2304,ck,16,3,13.4573,a8w8_blockscale_bpreshuffle_1x128x128_256x64x128x256_16x16_16x16_16x16x1_16x16x1_1x32x1x8_8_2x1_intrawave_v1,431.98,1444.84,0.0
256,192,7168,2048,ck,10,0,11.952,a8w8_blockscale_bpreshuffle_1x128x128_256x32x64x128_16x16_16x16_8x32x1_8x32x1_1x32x1x8_8_2x1_intrawave_v1,471.65,1491.45,0.0221
256,192,7168,2304,ck,10,0,13.7345,a8w8_blockscale_bpreshuffle_1x128x128_256x32x64x128_16x16_16x16_8x32x1_8x32x1_1x32x1x8_8_2x1_intrawave_v1,461.74,1435.07,0.0224
256,208,7168,2048,ck,17,2,12.3367,a8w8_blockscale_bpreshuffle_1x128x128_256x64x64x256_16x16_16x16_16x16x1_16x16x1_1x32x1x8_8_2x1_intrawave_v1,495.02,1466.19,0.0
256,208,7168,2304,ck,16,1,13.3867,a8w8_blockscale_bpreshuffle_1x128x128_256x64x128x256_16x16_16x16_16x16x1_16x16x1_1x32x1x8_8_2x1_intrawave_v1,513.22,1492.24,0.0
256,224,7168,2048,ck,17,3,12.4917,a8w8_blockscale_bpreshuffle_1x128x128_256x64x64x256_16x16_16x16_16x16x1_16x16x1_1x32x1x8_8_2x1_intrawave_v1,526.48,1468.98,0.0
256,224,7168,2304,ck,16,0,13.4387,a8w8_blockscale_bpreshuffle_1x128x128_256x64x128x256_16x16_16x16_16x16x1_16x16x1_1x32x1x8_8_2x1_intrawave_v1,550.56,1506.28,0.0
256,240,7168,2048,ck,17,3,12.6292,a8w8_blockscale_bpreshuffle_1x128x128_256x64x64x256_16x16_16x16_16x16x1_16x16x1_1x32x1x8_8_2x1_intrawave_v1,557.95,1473.75,0.0
256,240,7168,2304,ck,16,1,13.4556,a8w8_blockscale_bpreshuffle_1x128x128_256x64x128x256_16x16_16x16_16x16x1_16x16x1_1x32x1x8_8_2x1_intrawave_v1,589.14,1524.17,0.0
256,256,7168,2048,ck,17,2,12.5786,a8w8_blockscale_bpreshuffle_1x128x128_256x64x64x256_16x16_16x16_16x16x1_16x16x1_1x32x1x8_8_2x1_intrawave_v1,597.54,1500.51,0.0
256,256,7168,2304,ck,17,0,14.5139,a8w8_blockscale_bpreshuffle_1x128x128_256x64x64x256_16x16_16x16_16x16x1_16x16x1_1x32x1x8_8_2x1_intrawave_v1,582.59,1431.38,0.0
256,288,7168,2048,ck,9,2,14.7239,a8w8_blockscale_bpreshuffle_1x128x128_256x32x128x128_16x16_16x16_8x32x1_8x32x1_1x32x1x8_8_2x1_intrawave_v1,574.29,1317.49,0.0
256,288,7168,2304,ck,9,2,16.2348,a8w8_blockscale_bpreshuffle_1x128x128_256x32x128x128_16x16_16x16_8x32x1_8x32x1_1x32x1x8_8_2x1_intrawave_v1,585.94,1312.45,0.0
256,320,7168,2048,ck,15,3,15.5092,a8w8_blockscale_bpreshuffle_1x128x128_256x64x64x128_16x16_16x16_8x32x1_8x32x1_1x32x1x8_8_2x1_intrawave_v1,605.79,1284.59,0.0122
256,320,7168,2304,ck,14,1,17.2897,a8w8_blockscale_bpreshuffle_1x128x128_256x64x128x128_16x16_16x16_8x32x1_8x32x1_1x32x1x8_8_2x1_intrawave_v1,611.33,1263.17,0.0
256,352,7168,2048,ck,15,3,16.1679,a8w8_blockscale_bpreshuffle_1x128x128_256x64x64x128_16x16_16x16_8x32x1_8x32x1_1x32x1x8_8_2x1_intrawave_v1,639.22,1264.68,0.0138
256,352,7168,2304,ck,15,0,18.2158,a8w8_blockscale_bpreshuffle_1x128x128_256x64x64x128_16x16_16x16_8x32x1_8x32x1_1x32x1x8_8_2x1_intrawave_v1,638.27,1228.18,0.0139
256,384,7168,2048,ck,14,0,16.3874,a8w8_blockscale_bpreshuffle_1x128x128_256x64x128x128_16x16_16x16_8x32x1_8x32x1_1x32x1x8_8_2x1_intrawave_v1,687.99,1279.73,0.0001
256,384,7168,2304,ck,15,2,18.5314,a8w8_blockscale_bpreshuffle_1x128x128_256x64x64x128_16x16_16x16_8x32x1_8x32x1_1x32x1x8_8_2x1_intrawave_v1,684.44,1236.0,0.0123
256,416,7168,2048,ck,14,3,16.982,a8w8_blockscale_bpreshuffle_1x128x128_256x64x128x128_16x16_16x16_8x32x1_8x32x1_1x32x1x8_8_2x1_intrawave_v1,719.22,1265.8,0.0
256,416,7168,2304,ck,14,0,19.0898,a8w8_blockscale_bpreshuffle_1x128x128_256x64x128x128_16x16_16x16_8x32x1_8x32x1_1x32x1x8_8_2x1_intrawave_v1,719.78,1227.74,0.0
256,448,7168,2048,ck,14,0,16.8488,a8w8_blockscale_bpreshuffle_1x128x128_256x64x128x128_16x16_16x16_8x32x1_8x32x1_1x32x1x8_8_2x1_intrawave_v1,780.67,1306.92,0.0001
256,448,7168,2304,ck,14,2,19.0185,a8w8_blockscale_bpreshuffle_1x128x128_256x64x128x128_16x16_16x16_8x32x1_8x32x1_1x32x1x8_8_2x1_intrawave_v1,778.06,1260.34,0.0001
256,480,7168,2048,ck,14,3,17.3269,a8w8_blockscale_bpreshuffle_1x128x128_256x64x128x128_16x16_16x16_8x32x1_8x32x1_1x32x1x8_8_2x1_intrawave_v1,813.35,1301.12,0.0001
256,480,7168,2304,ck,14,0,19.3924,a8w8_blockscale_bpreshuffle_1x128x128_256x64x128x128_16x16_16x16_8x32x1_8x32x1_1x32x1x8_8_2x1_intrawave_v1,817.56,1263.5,0.0
256,512,7168,2048,ck,14,2,17.2778,a8w8_blockscale_bpreshuffle_1x128x128_256x64x128x128_16x16_16x16_8x32x1_8x32x1_1x32x1x8_8_2x1_intrawave_v1,870.04,1335.16,0.0002
256,512,7168,2304,ck,14,2,19.4597,a8w8_blockscale_bpreshuffle_1x128x128_256x64x128x128_16x16_16x16_8x32x1_8x32x1_1x32x1x8_8_2x1_intrawave_v1,869.05,1286.49,0.0001
256,544,7168,2048,ck,14,2,17.9439,a8w8_blockscale_bpreshuffle_1x128x128_256x64x128x128_16x16_16x16_8x32x1_8x32x1_1x32x1x8_8_2x1_intrawave_v1,890.1,1314.82,0.0001
256,544,7168,2304,ck,14,0,20.3449,a8w8_blockscale_bpreshuffle_1x128x128_256x64x128x128_16x16_16x16_8x32x1_8x32x1_1x32x1x8_8_2x1_intrawave_v1,883.19,1256.69,0.0
256,576,7168,2048,ck,14,2,17.7556,a8w8_blockscale_bpreshuffle_1x128x128_256x64x128x128_16x16_16x16_8x32x1_8x32x1_1x32x1x8_8_2x1_intrawave_v1,952.46,1358.29,0.0001
256,576,7168,2304,ck,14,3,20.1282,a8w8_blockscale_bpreshuffle_1x128x128_256x64x128x128_16x16_16x16_8x32x1_8x32x1_1x32x1x8_8_2x1_intrawave_v1,945.21,1296.67,0.0
256,608,7168,2048,ck,14,2,22.09,a8w8_blockscale_bpreshuffle_1x128x128_256x64x128x128_16x16_16x16_8x32x1_8x32x1_1x32x1x8_8_2x1_intrawave_v1,808.1,1115.51,0.0002
256,608,7168,2304,ck,14,0,24.7818,a8w8_blockscale_bpreshuffle_1x128x128_256x64x128x128_16x16_16x16_8x32x1_8x32x1_1x32x1x8_8_2x1_intrawave_v1,810.37,1074.67,0.0001
256,640,7168,2048,ck,14,1,21.8899,a8w8_blockscale_bpreshuffle_1x128x128_256x64x128x128_16x16_16x16_8x32x1_8x32x1_1x32x1x8_8_2x1_intrawave_v1,858.41,1149.65,0.0002
256,640,7168,2304,ck,14,0,24.6135,a8w8_blockscale_bpreshuffle_1x128x128_256x64x128x128_16x16_16x16_8x32x1_8x32x1_1x32x1x8_8_2x1_intrawave_v1,858.85,1103.65,0.0001
256,672,7168,2048,ck,14,1,22.7809,a8w8_blockscale_bpreshuffle_1x128x128_256x64x128x128_16x16_16x16_8x32x1_8x32x1_1x32x1x8_8_2x1_intrawave_v1,866.08,1127.7,0.0002
256,672,7168,2304,ck,14,1,25.4115,a8w8_blockscale_bpreshuffle_1x128x128_256x64x128x128_16x16_16x16_8x32x1_8x32x1_1x32x1x8_8_2x1_intrawave_v1,873.47,1089.95,0.0001
256,704,7168,2048,ck,14,2,22.64,a8w8_blockscale_bpreshuffle_1x128x128_256x64x128x128_16x16_16x16_8x32x1_8x32x1_1x32x1x8_8_2x1_intrawave_v1,912.97,1157.88,0.0002
256,704,7168,2304,ck,14,3,25.2838,a8w8_blockscale_bpreshuffle_1x128x128_256x64x128x128_16x16_16x16_8x32x1_8x32x1_1x32x1x8_8_2x1_intrawave_v1,919.69,1116.51,0.0001
256,736,7168,2048,ck,14,2,23.2608,a8w8_blockscale_bpreshuffle_1x128x128_256x64x128x128_16x16_16x16_8x32x1_8x32x1_1x32x1x8_8_2x1_intrawave_v1,928.99,1149.52,0.0003
256,736,7168,2304,ck,14,2,25.877,a8w8_blockscale_bpreshuffle_1x128x128_256x64x128x128_16x16_16x16_8x32x1_8x32x1_1x32x1x8_8_2x1_intrawave_v1,939.45,1111.49,0.0001
256,768,7168,2048,ck,14,0,22.9339,a8w8_blockscale_bpreshuffle_1x128x128_256x64x128x128_16x16_16x16_8x32x1_8x32x1_1x32x1x8_8_2x1_intrawave_v1,983.2,1188.76,0.0002
256,768,7168,2304,ck,14,0,25.9197,a8w8_blockscale_bpreshuffle_1x128x128_256x64x128x128_16x16_16x16_8x32x1_8x32x1_1x32x1x8_8_2x1_intrawave_v1,978.68,1130.21,0.0001
256,800,7168,2048,ck,14,0,23.8231,a8w8_blockscale_bpreshuffle_1x128x128_256x64x128x128_16x16_16x16_8x32x1_8x32x1_1x32x1x8_8_2x1_intrawave_v1,985.94,1166.4,0.0002
256,800,7168,2304,ck,14,0,26.9001,a8w8_blockscale_bpreshuffle_1x128x128_256x64x128x128_16x16_16x16_8x32x1_8x32x1_1x32x1x8_8_2x1_intrawave_v1,982.31,1108.81,0.0002
256,832,7168,2048,ck,14,2,23.6429,a8w8_blockscale_bpreshuffle_1x128x128_256x64x128x128_16x16_16x16_8x32x1_8x32x1_1x32x1x8_8_2x1_intrawave_v1,1033.19,1197.47,0.0003
256,832,7168,2304,ck,13,3,27.1405,a8w8_blockscale_bpreshuffle_1x128x128_256x64x256x128_16x16_16x16_8x32x1_8x32x1_1x32x1x8_8_2x1_intrawave_v1,1012.55,1118.61,0.0
256,864,7168,2048,ck,13,1,25.6968,a8w8_blockscale_bpreshuffle_1x128x128_256x64x256x128_16x16_16x16_8x32x1_8x32x1_1x32x1x8_8_2x1_intrawave_v1,987.17,1122.16,0.0
256,864,7168,2304,ck,13,1,28.7091,a8w8_blockscale_bpreshuffle_1x128x128_256x64x256x128_16x16_16x16_8x32x1_8x32x1_1x32x1x8_8_2x1_intrawave_v1,994.04,1076.04,0.0
256,896,7168,2048,ck,13,3,25.601,a8w8_blockscale_bpreshuffle_1x128x128_256x64x256x128_16x16_16x16_8x32x1_8x32x1_1x32x1x8_8_2x1_intrawave_v1,1027.56,1146.84,0.0
256,896,7168,2304,ck,13,2,28.1095,a8w8_blockscale_bpreshuffle_1x128x128_256x64x256x128_16x16_16x16_8x32x1_8x32x1_1x32x1x8_8_2x1_intrawave_v1,1052.85,1117.93,0.0
256,928,7168,2048,ck,13,3,26.6972,a8w8_blockscale_bpreshuffle_1x128x128_256x64x256x128_16x16_16x16_8x32x1_8x32x1_1x32x1x8_8_2x1_intrawave_v1,1020.56,1119.38,0.0
256,928,7168,2304,ck,13,2,29.6328,a8w8_blockscale_bpreshuffle_1x128x128_256x64x256x128_16x16_16x16_8x32x1_8x32x1_1x32x1x8_8_2x1_intrawave_v1,1034.39,1078.43,0.0
256,960,7168,2048,ck,13,2,26.592,a8w8_blockscale_bpreshuffle_1x128x128_256x64x256x128_16x16_16x16_8x32x1_8x32x1_1x32x1x8_8_2x1_intrawave_v1,1059.93,1143.53,0.0
256,960,7168,2304,ck,13,2,29.5323,a8w8_blockscale_bpreshuffle_1x128x128_256x64x256x128_16x16_16x16_8x32x1_8x32x1_1x32x1x8_8_2x1_intrawave_v1,1073.7,1100.13,0.0
256,992,7168,2048,ck,13,1,27.2401,a8w8_blockscale_bpreshuffle_1x128x128_256x64x256x128_16x16_16x16_8x32x1_8x32x1_1x32x1x8_8_2x1_intrawave_v1,1069.2,1135.57,0.0
256,992,7168,2304,ck,13,0,30.5967,a8w8_blockscale_bpreshuffle_1x128x128_256x64x256x128_16x16_16x16_8x32x1_8x32x1_1x32x1x8_8_2x1_intrawave_v1,1070.9,1079.27,0.0
256,1024,7168,2048,ck,13,1,27.4554,a8w8_blockscale_bpreshuffle_1x128x128_256x64x256x128_16x16_16x16_8x32x1_8x32x1_1x32x1x8_8_2x1_intrawave_v1,1095.04,1145.76,0.0
256,1024,7168,2304,ck,13,2,30.5559,a8w8_blockscale_bpreshuffle_1x128x128_256x64x256x128_16x16_16x16_8x32x1_8x32x1_1x32x1x8_8_2x1_intrawave_v1,1106.92,1098.13,0.0
256,1088,7168,2048,ck,13,2,27.5885,a8w8_blockscale_bpreshuffle_1x128x128_256x64x256x128_16x16_16x16_8x32x1_8x32x1_1x32x1x8_8_2x1_intrawave_v1,1157.87,1178.24,0.0
256,1088,7168,2304,ck,13,0,30.4326,a8w8_blockscale_bpreshuffle_1x128x128_256x64x256x128_16x16_16x16_8x32x1_8x32x1_1x32x1x8_8_2x1_intrawave_v1,1180.87,1137.58,0.0
256,1152,7168,2048,ck,13,3,27.7309,a8w8_blockscale_bpreshuffle_1x128x128_256x64x256x128_16x16_16x16_8x32x1_8x32x1_1x32x1x8_8_2x1_intrawave_v1,1219.68,1210.0,0.0
256,1152,7168,2304,ck,13,2,30.8397,a8w8_blockscale_bpreshuffle_1x128x128_256x64x256x128_16x16_16x16_8x32x1_8x32x1_1x32x1x8_8_2x1_intrawave_v1,1233.82,1157.09,0.0
256,1216,7168,2048,ck,14,1,33.7601,a8w8_blockscale_bpreshuffle_1x128x128_256x64x128x128_16x16_16x16_8x32x1_8x32x1_1x32x1x8_8_2x1_intrawave_v1,1057.52,1024.97,0.0004
256,1216,7168,2304,ck,14,0,36.4059,a8w8_blockscale_bpreshuffle_1x128x128_256x64x128x128_16x16_16x16_8x32x1_8x32x1_1x32x1x8_8_2x1_intrawave_v1,1103.25,1009.43,0.0003
256,1280,7168,2048,ck,14,0,33.9157,a8w8_blockscale_bpreshuffle_1x128x128_256x64x128x128_16x16_16x16_8x32x1_8x32x1_1x32x1x8_8_2x1_intrawave_v1,1108.07,1051.18,0.0003
256,1280,7168,2304,ck,14,3,39.1358,a8w8_blockscale_bpreshuffle_1x128x128_256x64x128x128_16x16_16x16_8x32x1_8x32x1_1x32x1x8_8_2x1_intrawave_v1,1080.3,966.23,0.0003
256,1344,7168,2048,ck,14,1,35.1352,a8w8_blockscale_bpreshuffle_1x128x128_256x64x128x128_16x16_16x16_8x32x1_8x32x1_1x32x1x8_8_2x1_intrawave_v1,1123.09,1044.54,0.0003
256,1344,7168,2304,ck,14,2,40.0838,a8w8_blockscale_bpreshuffle_1x128x128_256x64x128x128_16x16_16x16_8x32x1_8x32x1_1x32x1x8_8_2x1_intrawave_v1,1107.49,969.95,0.0003
256,1408,7168,2048,ck,1,3,35.6424,a8w8_blockscale_bpreshuffle_1x128x128_256x64x128x128_16x16_16x16_8x32x1_8x32x1_1x32x1x8_8_2x1_intrawave_v3,1159.83,1059.1,0.0
256,1408,7168,2304,ck,14,3,41.0862,a8w8_blockscale_bpreshuffle_1x128x128_256x64x128x128_16x16_16x16_8x32x1_8x32x1_1x32x1x8_8_2x1_intrawave_v1,1131.92,972.2,0.0003
256,1472,7168,2048,ck,13,3,37.8806,a8w8_blockscale_bpreshuffle_1x128x128_256x64x256x128_16x16_16x16_8x32x1_8x32x1_1x32x1x8_8_2x1_intrawave_v1,1140.9,1024.2,0.0
256,1472,7168,2304,ck,13,3,42.4662,a8w8_blockscale_bpreshuffle_1x128x128_256x64x256x128_16x16_16x16_8x32x1_8x32x1_1x32x1x8_8_2x1_intrawave_v1,1144.92,965.69,0.0
256,1536,7168,2048,ck,13,0,38.5678,a8w8_blockscale_bpreshuffle_1x128x128_256x64x256x128_16x16_16x16_8x32x1_8x32x1_1x32x1x8_8_2x1_intrawave_v1,1169.3,1033.14,0.0
256,1536,7168,2304,ck,13,2,43.045,a8w8_blockscale_bpreshuffle_1x128x128_256x64x256x128_16x16_16x16_8x32x1_8x32x1_1x32x1x8_8_2x1_intrawave_v1,1178.63,977.44,0.0
256,1600,7168,2048,ck,13,1,39.5246,a8w8_blockscale_bpreshuffle_1x128x128_256x64x256x128_16x16_16x16_8x32x1_8x32x1_1x32x1x8_8_2x1_intrawave_v1,1188.53,1034.66,0.0
256,1600,7168,2304,ck,13,1,43.9294,a8w8_blockscale_bpreshuffle_1x128x128_256x64x256x128_16x16_16x16_8x32x1_8x32x1_1x32x1x8_8_2x1_intrawave_v1,1203.03,982.01,0.0
256,1664,7168,2048,ck,13,0,39.2749,a8w8_blockscale_bpreshuffle_1x128x128_256x64x256x128_16x16_16x16_8x32x1_8x32x1_1x32x1x8_8_2x1_intrawave_v1,1243.93,1067.93,0.0
256,1664,7168,2304,ck,13,0,44.9279,a8w8_blockscale_bpreshuffle_1x128x128_256x64x256x128_16x16_16x16_8x32x1_8x32x1_1x32x1x8_8_2x1_intrawave_v1,1223.34,983.89,0.0
256,1728,7168,2048,ck,13,3,40.2886,a8w8_blockscale_bpreshuffle_1x128x128_256x64x256x128_16x16_16x16_8x32x1_8x32x1_1x32x1x8_8_2x1_intrawave_v1,1259.27,1067.09,0.0
256,1728,7168,2304,ck,13,3,44.9686,a8w8_blockscale_bpreshuffle_1x128x128_256x64x256x128_16x16_16x16_8x32x1_8x32x1_1x32x1x8_8_2x1_intrawave_v1,1269.24,1006.68,0.0
256,1792,7168,2048,ck,13,3,45.9439,a8w8_blockscale_bpreshuffle_1x128x128_256x64x256x128_16x16_16x16_8x32x1_8x32x1_1x32x1x8_8_2x1_intrawave_v1,1145.17,958.56,0.0
256,1792,7168,2304,ck,13,0,50.3128,a8w8_blockscale_bpreshuffle_1x128x128_256x64x256x128_16x16_16x16_8x32x1_8x32x1_1x32x1x8_8_2x1_intrawave_v1,1176.44,920.92,0.0
256,1856,7168,2048,ck,14,2,47.4559,a8w8_blockscale_bpreshuffle_1x128x128_256x64x128x128_16x16_16x16_8x32x1_8x32x1_1x32x1x8_8_2x1_intrawave_v1,1148.27,950.12,0.0003
256,1856,7168,2304,ck,14,2,51.9863,a8w8_blockscale_bpreshuffle_1x128x128_256x64x128x128_16x16_16x16_8x32x1_8x32x1_1x32x1x8_8_2x1_intrawave_v1,1179.23,911.76,0.0003
256,1920,7168,2048,ck,13,2,47.5799,a8w8_blockscale_bpreshuffle_1x128x128_256x64x256x128_16x16_16x16_8x32x1_8x32x1_1x32x1x8_8_2x1_intrawave_v1,1184.77,969.68,0.0
256,1920,7168,2304,ck,13,1,53.7779,a8w8_blockscale_bpreshuffle_1x128x128_256x64x256x128_16x16_16x16_8x32x1_8x32x1_1x32x1x8_8_2x1_intrawave_v1,1179.26,901.19,0.0
256,1984,7168,2048,ck,13,3,49.1847,a8w8_blockscale_bpreshuffle_1x128x128_256x64x256x128_16x16_16x16_8x32x1_8x32x1_1x32x1x8_8_2x1_intrawave_v1,1184.32,959.36,0.0
256,1984,7168,2304,ck,13,2,54.4404,a8w8_blockscale_bpreshuffle_1x128x128_256x64x256x128_16x16_16x16_8x32x1_8x32x1_1x32x1x8_8_2x1_intrawave_v1,1203.73,909.78,0.0
256,2048,7168,2048,ck,13,3,50.7001,a8w8_blockscale_bpreshuffle_1x128x128_256x64x256x128_16x16_16x16_8x32x1_8x32x1_1x32x1x8_8_2x1_intrawave_v1,1185.98,951.37,0.0
256,2048,7168,2304,ck,13,1,55.9764,a8w8_blockscale_bpreshuffle_1x128x128_256x64x256x128_16x16_16x16_8x32x1_8x32x1_1x32x1x8_8_2x1_intrawave_v1,1208.47,903.84,0.0
256,4096,7168,2048,ck,13,2,86.1039,a8w8_blockscale_bpreshuffle_1x128x128_256x64x256x128_16x16_16x16_8x32x1_8x32x1_1x32x1x8_8_2x1_intrawave_v1,1396.67,949.89,0.0
256,4096,7168,2304,ck,13,3,94.6836,a8w8_blockscale_bpreshuffle_1x128x128_256x64x256x128_16x16_16x16_8x32x1_8x32x1_1x32x1x8_8_2x1_intrawave_v1,1428.88,894.27,0.0
256,8192,7168,2048,ck,13,3,159.1634,a8w8_blockscale_bpreshuffle_1x128x128_256x64x256x128_16x16_16x16_8x32x1_8x32x1_1x32x1x8_8_2x1_intrawave_v1,1511.14,935.5,0.0
256,8192,7168,2304,ck,13,0,170.429,a8w8_blockscale_bpreshuffle_1x128x128_256x64x256x128_16x16_16x16_8x32x1_8x32x1_1x32x1x8_8_2x1_intrawave_v1,1587.66,896.74,0.0
256,16384,7168,2048,ck,13,2,297.153,a8w8_blockscale_bpreshuffle_1x128x128_256x64x256x128_16x16_16x16_8x32x1_8x32x1_1x32x1x8_8_2x1_intrawave_v1,1618.82,952.76,0.0
256,16384,7168,2304,ck,13,3,323.1174,a8w8_blockscale_bpreshuffle_1x128x128_256x64x256x128_16x16_16x16_8x32x1_8x32x1_1x32x1x8_8_2x1_intrawave_v1,1674.83,894.86,0.0
256,32768,7168,2048,ck,13,3,567.023,a8w8_blockscale_bpreshuffle_1x128x128_256x64x256x128_16x16_16x16_8x32x1_8x32x1_1x32x1x8_8_2x1_intrawave_v1,1696.71,972.71,0.0
256,32768,7168,2304,ck,13,1,628.1102,a8w8_blockscale_bpreshuffle_1x128x128_256x64x256x128_16x16_16x16_8x32x1_8x32x1_1x32x1x8_8_2x1_intrawave_v1,1723.16,894.39,0.0
256,16,8192,1536,ck,7,2,6.5488,a8w8_blockscale_bpreshuffle_1x128x128_256x16x64x256_16x16_16x16_16x16x1_16x16x1_1x16x1x16_4_1x1_intrawave_v1,61.49,1965.19,0.0
256,32,8192,1536,ck,7,3,6.6866,a8w8_blockscale_bpreshuffle_1x128x128_256x16x64x256_16x16_16x16_16x16x1_16x16x1_1x16x1x16_4_1x1_intrawave_v1,120.44,1967.57,0.0
256,48,8192,1536,ck,6,3,6.8421,a8w8_blockscale_bpreshuffle_1x128x128_256x16x128x256_16x16_16x16_16x16x1_16x16x1_1x16x1x16_8_1x2_intrawave_v1,176.55,1964.76,0.0
256,64,8192,1536,ck,7,3,6.8973,a8w8_blockscale_bpreshuffle_1x128x128_256x16x64x256_16x16_16x16_16x16x1_16x16x1_1x16x1x16_4_1x1_intrawave_v1,233.51,1990.6,0.0
256,80,8192,1536,ck,12,0,8.4683,a8w8_blockscale_bpreshuffle_1x128x128_256x32x64x256_16x16_16x16_16x16x1_16x16x1_1x32x1x8_8_2x1_intrawave_v1,237.74,1655.17,0.0
256,96,8192,1536,ck,12,1,8.352,a8w8_blockscale_bpreshuffle_1x128x128_256x32x64x256_16x16_16x16_16x16x1_16x16x1_1x32x1x8_8_2x1_intrawave_v1,289.26,1712.55,0.0
256,112,8192,1536,ck,12,3,8.7755,a8w8_blockscale_bpreshuffle_1x128x128_256x32x64x256_16x16_16x16_16x16x1_16x16x1_1x32x1x8_8_2x1_intrawave_v1,321.19,1662.58,0.0
256,128,8192,1536,ck,12,3,8.1309,a8w8_blockscale_bpreshuffle_1x128x128_256x32x64x256_16x16_16x16_16x16x1_16x16x1_1x32x1x8_8_2x1_intrawave_v1,396.17,1829.65,0.0
256,144,8192,1536,ck,12,3,10.1102,a8w8_blockscale_bpreshuffle_1x128x128_256x32x64x256_16x16_16x16_16x16x1_16x16x1_1x32x1x8_8_2x1_intrawave_v1,358.44,1499.81,0.0
256,160,8192,1536,ck,12,0,10.2613,a8w8_blockscale_bpreshuffle_1x128x128_256x32x64x256_16x16_16x16_16x16x1_16x16x1_1x32x1x8_8_2x1_intrawave_v1,392.4,1505.67,0.0
256,176,8192,1536,ck,12,1,10.2579,a8w8_blockscale_bpreshuffle_1x128x128_256x32x64x256_16x16_16x16_16x16x1_16x16x1_1x32x1x8_8_2x1_intrawave_v1,431.78,1534.12,0.0
256,192,8192,1536,ck,12,3,10.4949,a8w8_blockscale_bpreshuffle_1x128x128_256x32x64x256_16x16_16x16_16x16x1_16x16x1_1x32x1x8_8_2x1_intrawave_v1,460.4,1526.79,0.0
256,208,8192,1536,ck,17,2,10.7942,a8w8_blockscale_bpreshuffle_1x128x128_256x64x64x256_16x16_16x16_16x16x1_16x16x1_1x32x1x8_8_2x1_intrawave_v1,484.94,1511.02,0.0
256,224,8192,1536,ck,17,1,10.8584,a8w8_blockscale_bpreshuffle_1x128x128_256x64x64x256_16x16_16x16_16x16x1_16x16x1_1x32x1x8_8_2x1_intrawave_v1,519.15,1528.49,0.0
256,240,8192,1536,ck,17,0,11.0897,a8w8_blockscale_bpreshuffle_1x128x128_256x64x64x256_16x16_16x16_16x16x1_16x16x1_1x32x1x8_8_2x1_intrawave_v1,544.63,1522.47,0.0
256,256,8192,1536,ck,17,2,10.9827,a8w8_blockscale_bpreshuffle_1x128x128_256x64x64x256_16x16_16x16_16x16x1_16x16x1_1x32x1x8_8_2x1_intrawave_v1,586.6,1563.41,0.0
256,288,8192,1536,ck,15,3,13.7931,a8w8_blockscale_bpreshuffle_1x128x128_256x64x64x128_16x16_16x16_8x32x1_8x32x1_1x32x1x8_8_2x1_intrawave_v1,525.46,1286.43,0.013
256,320,8192,1536,ck,11,2,13.7756,a8w8_blockscale_bpreshuffle_1x128x128_256x32x128x256_16x16_16x16_16x16x1_16x16x1_1x32x1x8_8_2x1_intrawave_v1,584.59,1329.69,0.0
256,352,8192,1536,ck,11,1,14.3727,a8w8_blockscale_bpreshuffle_1x128x128_256x32x128x256_16x16_16x16_16x16x1_16x16x1_1x32x1x8_8_2x1_intrawave_v1,616.33,1314.35,0.0
256,384,8192,1536,ck,11,1,14.4392,a8w8_blockscale_bpreshuffle_1x128x128_256x32x128x256_16x16_16x16_16x16x1_16x16x1_1x32x1x8_8_2x1_intrawave_v1,669.27,1348.01,0.0
256,416,8192,1536,ck,14,0,15.1561,a8w8_blockscale_bpreshuffle_1x128x128_256x64x128x128_16x16_16x16_8x32x1_8x32x1_1x32x1x8_8_2x1_intrawave_v1,690.74,1322.08,0.0
256,448,8192,1536,ck,14,1,15.1196,a8w8_blockscale_bpreshuffle_1x128x128_256x64x128x128_16x16_16x16_8x32x1_8x32x1_1x32x1x8_8_2x1_intrawave_v1,745.67,1363.2,0.0
256,480,8192,1536,ck,14,3,15.389,a8w8_blockscale_bpreshuffle_1x128x128_256x64x128x128_16x16_16x16_8x32x1_8x32x1_1x32x1x8_8_2x1_intrawave_v1,784.95,1376.6,0.0
256,512,8192,1536,ck,14,2,15.3534,a8w8_blockscale_bpreshuffle_1x128x128_256x64x128x128_16x16_16x16_8x32x1_8x32x1_1x32x1x8_8_2x1_intrawave_v1,839.22,1417.14,0.0
256,544,8192,1536,ck,14,3,19.3997,a8w8_blockscale_bpreshuffle_1x128x128_256x64x128x128_16x16_16x16_8x32x1_8x32x1_1x32x1x8_8_2x1_intrawave_v1,705.69,1151.12,0.0001
256,576,8192,1536,ck,14,0,19.4215,a8w8_blockscale_bpreshuffle_1x128x128_256x64x128x128_16x16_16x16_8x32x1_8x32x1_1x32x1x8_8_2x1_intrawave_v1,746.36,1179.35,0.0001
256,608,8192,1536,ck,14,0,19.5054,a8w8_blockscale_bpreshuffle_1x128x128_256x64x128x128_16x16_16x16_8x32x1_8x32x1_1x32x1x8_8_2x1_intrawave_v1,784.44,1203.68,0.0001
256,640,8192,1536,ck,14,1,19.4462,a8w8_blockscale_bpreshuffle_1x128x128_256x64x128x128_16x16_16x16_8x32x1_8x32x1_1x32x1x8_8_2x1_intrawave_v1,828.24,1236.83,0.0001
256,672,8192,1536,ck,14,0,20.0511,a8w8_blockscale_bpreshuffle_1x128x128_256x64x128x128_16x16_16x16_8x32x1_8x32x1_1x32x1x8_8_2x1_intrawave_v1,843.42,1228.12,0.0002
256,704,8192,1536,ck,14,3,19.9844,a8w8_blockscale_bpreshuffle_1x128x128_256x64x128x128_16x16_16x16_8x32x1_8x32x1_1x32x1x8_8_2x1_intrawave_v1,886.53,1260.91,0.0001
256,736,8192,1536,ck,14,3,20.6813,a8w8_blockscale_bpreshuffle_1x128x128_256x64x128x128_16x16_16x16_8x32x1_8x32x1_1x32x1x8_8_2x1_intrawave_v1,895.59,1246.15,0.0002
256,768,8192,1536,ck,14,1,20.0788,a8w8_blockscale_bpreshuffle_1x128x128_256x64x128x128_16x16_16x16_8x32x1_8x32x1_1x32x1x8_8_2x1_intrawave_v1,962.58,1312.1,0.0001
256,800,8192,1536,ck,13,3,22.3926,a8w8_blockscale_bpreshuffle_1x128x128_256x64x256x128_16x16_16x16_8x32x1_8x32x1_1x32x1x8_8_2x1_intrawave_v1,899.08,1202.13,0.0
256,832,8192,1536,ck,13,1,22.1652,a8w8_blockscale_bpreshuffle_1x128x128_256x64x256x128_16x16_16x16_8x32x1_8x32x1_1x32x1x8_8_2x1_intrawave_v1,944.63,1240.34,0.0
256,864,8192,1536,ck,13,3,22.9782,a8w8_blockscale_bpreshuffle_1x128x128_256x64x256x128_16x16_16x16_8x32x1_8x32x1_1x32x1x8_8_2x1_intrawave_v1,946.26,1221.41,0.0
256,896,8192,1536,ck,13,2,22.8258,a8w8_blockscale_bpreshuffle_1x128x128_256x64x256x128_16x16_16x16_8x32x1_8x32x1_1x32x1x8_8_2x1_intrawave_v1,987.85,1254.69,0.0
256,928,8192,1536,ck,13,2,23.3938,a8w8_blockscale_bpreshuffle_1x128x128_256x64x256x128_16x16_16x16_8x32x1_8x32x1_1x32x1x8_8_2x1_intrawave_v1,998.29,1248.74,0.0
256,960,8192,1536,ck,13,0,23.0724,a8w8_blockscale_bpreshuffle_1x128x128_256x64x256x128_16x16_16x16_8x32x1_8x32x1_1x32x1x8_8_2x1_intrawave_v1,1047.1,1290.98,0.0
256,992,8192,1536,ck,13,1,24.4538,a8w8_blockscale_bpreshuffle_1x128x128_256x64x256x128_16x16_16x16_8x32x1_8x32x1_1x32x1x8_8_2x1_intrawave_v1,1020.88,1241.51,0.0
256,1024,8192,1536,ck,13,3,23.8784,a8w8_blockscale_bpreshuffle_1x128x128_256x64x256x128_16x16_16x16_8x32x1_8x32x1_1x32x1x8_8_2x1_intrawave_v1,1079.21,1295.44,0.0
256,1088,8192,1536,ck,14,2,28.9968,a8w8_blockscale_bpreshuffle_1x128x128_256x64x128x128_16x16_16x16_8x32x1_8x32x1_1x32x1x8_8_2x1_intrawave_v1,944.26,1106.32,0.0002
256,1152,8192,1536,ck,14,0,28.6479,a8w8_blockscale_bpreshuffle_1x128x128_256x64x128x128_16x16_16x16_8x32x1_8x32x1_1x32x1x8_8_2x1_intrawave_v1,1011.98,1159.83,0.0002
256,1216,8192,1536,ck,14,0,29.8281,a8w8_blockscale_bpreshuffle_1x128x128_256x64x128x128_16x16_16x16_8x32x1_8x32x1_1x32x1x8_8_2x1_intrawave_v1,1025.93,1152.39,0.0002
256,1280,8192,1536,ck,14,2,30.0821,a8w8_blockscale_bpreshuffle_1x128x128_256x64x128x128_16x16_16x16_8x32x1_8x32x1_1x32x1x8_8_2x1_intrawave_v1,1070.81,1180.79,0.0002
256,1344,8192,1536,ck,13,1,32.0651,a8w8_blockscale_bpreshuffle_1x128x128_256x64x256x128_16x16_16x16_8x32x1_8x32x1_1x32x1x8_8_2x1_intrawave_v1,1054.82,1143.53,0.0
256,1408,8192,1536,ck,13,1,32.7122,a8w8_blockscale_bpreshuffle_1x128x128_256x64x256x128_16x16_16x16_8x32x1_8x32x1_1x32x1x8_8_2x1_intrawave_v1,1083.19,1155.97,0.0
256,1472,8192,1536,ck,13,2,32.6754,a8w8_blockscale_bpreshuffle_1x128x128_256x64x256x128_16x16_16x16_8x32x1_8x32x1_1x32x1x8_8_2x1_intrawave_v1,1133.7,1192.37,0.0
256,1536,8192,1536,ck,13,2,33.3817,a8w8_blockscale_bpreshuffle_1x128x128_256x64x256x128_16x16_16x16_8x32x1_8x32x1_1x32x1x8_8_2x1_intrawave_v1,1157.96,1201.5,0.0
256,1600,8192,1536,ck,14,0,39.3126,a8w8_blockscale_bpreshuffle_1x128x128_256x64x128x128_16x16_16x16_8x32x1_8x32x1_1x32x1x8_8_2x1_intrawave_v1,1024.23,1049.41,0.0003
256,1664,8192,1536,ck,13,1,39.207,a8w8_blockscale_bpreshuffle_1x128x128_256x64x256x128_16x16_16x16_8x32x1_8x32x1_1x32x1x8_8_2x1_intrawave_v1,1068.07,1081.49,0.0
256,1728,8192,1536,ck,14,1,39.3462,a8w8_blockscale_bpreshuffle_1x128x128_256x64x128x128_16x16_16x16_8x32x1_8x32x1_1x32x1x8_8_2x1_intrawave_v1,1105.23,1106.81,0.0002
256,1792,8192,1536,ck,13,1,39.9591,a8w8_blockscale_bpreshuffle_1x128x128_256x64x256x128_16x16_16x16_8x32x1_8x32x1_1x32x1x8_8_2x1_intrawave_v1,1128.58,1118.53,0.0
256,1856,8192,1536,ck,13,0,40.9413,a8w8_blockscale_bpreshuffle_1x128x128_256x64x256x128_16x16_16x16_8x32x1_8x32x1_1x32x1x8_8_2x1_intrawave_v1,1140.85,1119.71,0.0
256,1920,8192,1536,ck,13,1,41.4403,a8w8_blockscale_bpreshuffle_1x128x128_256x64x256x128_16x16_16x16_8x32x1_8x32x1_1x32x1x8_8_2x1_intrawave_v1,1165.98,1133.9,0.0
256,1984,8192,1536,ck,13,2,43.6011,a8w8_blockscale_bpreshuffle_1x128x128_256x64x256x128_16x16_16x16_8x32x1_8x32x1_1x32x1x8_8_2x1_intrawave_v1,1145.13,1104.01,0.0
256,2048,8192,1536,ck,13,0,45.5371,a8w8_blockscale_bpreshuffle_1x128x128_256x64x256x128_16x16_16x16_8x32x1_8x32x1_1x32x1x8_8_2x1_intrawave_v1,1131.82,1082.26,0.0
256,4096,8192,1536,ck,13,2,79.9483,a8w8_blockscale_bpreshuffle_1x128x128_256x64x256x128_16x16_16x16_8x32x1_8x32x1_1x32x1x8_8_2x1_intrawave_v1,1289.32,1075.49,0.0
256,8192,8192,1536,ck,13,1,146.1826,a8w8_blockscale_bpreshuffle_1x128x128_256x64x256x128_16x16_16x16_8x32x1_8x32x1_1x32x1x8_8_2x1_intrawave_v1,1410.28,1090.3,0.0
256,16384,8192,1536,ck,13,1,272.1772,a8w8_blockscale_bpreshuffle_1x128x128_256x64x256x128_16x16_16x16_8x32x1_8x32x1_1x32x1x8_8_2x1_intrawave_v1,1514.88,1124.94,0.0
256,32768,8192,1536,ck,13,3,521.0597,a8w8_blockscale_bpreshuffle_1x128x128_256x64x256x128_16x16_16x16_8x32x1_8x32x1_1x32x1x8_8_2x1_intrawave_v1,1582.61,1151.09,0.0
256,16,11264,1536,ck,7,2,6.7791,a8w8_blockscale_bpreshuffle_1x128x128_256x16x64x256_16x16_16x16_16x16x1_16x16x1_1x16x1x16_4_1x1_intrawave_v1,81.67,2608.98,0.0
256,32,11264,1536,ck,12,1,6.7625,a8w8_blockscale_bpreshuffle_1x128x128_256x32x64x256_16x16_16x16_16x16x1_16x16x1_1x32x1x8_8_2x1_intrawave_v1,163.74,2672.32,0.0
256,48,11264,1536,ck,6,0,7.7777,a8w8_blockscale_bpreshuffle_1x128x128_256x16x128x256_16x16_16x16_16x16x1_16x16x1_1x16x1x16_8_1x2_intrawave_v1,213.55,2373.01,0.0
256,64,11264,1536,ck,12,3,9.2568,a8w8_blockscale_bpreshuffle_1x128x128_256x32x64x256_16x16_16x16_16x16x1_16x16x1_1x32x1x8_8_2x1_intrawave_v1,239.24,2035.43,0.0
256,80,11264,1536,ck,12,2,9.39,a8w8_blockscale_bpreshuffle_1x128x128_256x32x64x256_16x16_16x16_16x16x1_16x16x1_1x32x1x8_8_2x1_intrawave_v1,294.81,2047.56,0.0
256,96,11264,1536,ck,11,0,9.7292,a8w8_blockscale_bpreshuffle_1x128x128_256x32x128x256_16x16_16x16_16x16x1_16x16x1_1x32x1x8_8_2x1_intrawave_v1,341.43,2015.75,0.0
256,112,11264,1536,ck,12,1,10.4151,a8w8_blockscale_bpreshuffle_1x128x128_256x32x64x256_16x16_16x16_16x16x1_16x16x1_1x32x1x8_8_2x1_intrawave_v1,372.11,1919.97,0.0
256,128,11264,1536,ck,10,1,10.6647,a8w8_blockscale_bpreshuffle_1x128x128_256x32x64x128_16x16_16x16_8x32x1_8x32x1_1x32x1x8_8_2x1_intrawave_v1,415.31,1911.14,0.0226
256,144,11264,1536,ck,9,0,11.9647,a8w8_blockscale_bpreshuffle_1x128x128_256x32x128x128_16x16_16x16_8x32x1_8x32x1_1x32x1x8_8_2x1_intrawave_v1,416.46,1735.67,0.0
256,160,11264,1536,ck,9,0,12.0716,a8w8_blockscale_bpreshuffle_1x128x128_256x32x128x128_16x16_16x16_8x32x1_8x32x1_1x32x1x8_8_2x1_intrawave_v1,458.64,1752.19,0.0
256,176,11264,1536,ck,15,2,12.9926,a8w8_blockscale_bpreshuffle_1x128x128_256x64x64x128_16x16_16x16_8x32x1_8x32x1_1x32x1x8_8_2x1_intrawave_v1,468.74,1657.62,0.0092
256,192,11264,1536,ck,15,1,12.9623,a8w8_blockscale_bpreshuffle_1x128x128_256x64x64x128_16x16_16x16_8x32x1_8x32x1_1x32x1x8_8_2x1_intrawave_v1,512.55,1691.2,0.0126
256,208,11264,1536,ck,15,2,13.7471,a8w8_blockscale_bpreshuffle_1x128x128_256x64x64x128_16x16_16x16_8x32x1_8x32x1_1x32x1x8_8_2x1_intrawave_v1,523.56,1622.66,0.0139
256,224,11264,1536,ck,15,0,13.8719,a8w8_blockscale_bpreshuffle_1x128x128_256x64x64x128_16x16_16x16_8x32x1_8x32x1_1x32x1x8_8_2x1_intrawave_v1,558.76,1635.81,0.0117
256,240,11264,1536,ck,15,2,14.2492,a8w8_blockscale_bpreshuffle_1x128x128_256x64x64x128_16x16_16x16_8x32x1_8x32x1_1x32x1x8_8_2x1_intrawave_v1,582.82,1619.52,0.0119
256,256,11264,1536,ck,15,1,14.4019,a8w8_blockscale_bpreshuffle_1x128x128_256x64x64x128_16x16_16x16_8x32x1_8x32x1_1x32x1x8_8_2x1_intrawave_v1,615.08,1629.08,0.0126
256,288,11264,1536,ck,14,2,15.2168,a8w8_blockscale_bpreshuffle_1x128x128_256x64x128x128_16x16_16x16_8x32x1_8x32x1_1x32x1x8_8_2x1_intrawave_v1,654.91,1592.45,0.0
256,320,11264,1536,ck,14,0,15.373,a8w8_blockscale_bpreshuffle_1x128x128_256x64x128x128_16x16_16x16_8x32x1_8x32x1_1x32x1x8_8_2x1_intrawave_v1,720.29,1626.36,0.0
256,352,11264,1536,ck,8,2,17.7951,a8w8_blockscale_bpreshuffle_1x128x128_256x32x256x128_16x16_16x16_8x32x1_8x32x1_1x32x1x8_8_2x1_intrawave_v1,684.47,1448.27,0.0
256,384,11264,1536,ck,14,2,18.7214,a8w8_blockscale_bpreshuffle_1x128x128_256x64x128x128_16x16_16x16_8x32x1_8x32x1_1x32x1x8_8_2x1_intrawave_v1,709.75,1417.74,0.0
256,416,11264,1536,ck,14,2,19.59,a8w8_blockscale_bpreshuffle_1x128x128_256x64x128x128_16x16_16x16_8x32x1_8x32x1_1x32x1x8_8_2x1_intrawave_v1,734.81,1394.19,0.0001
256,448,11264,1536,ck,14,1,19.5306,a8w8_blockscale_bpreshuffle_1x128x128_256x64x128x128_16x16_16x16_8x32x1_8x32x1_1x32x1x8_8_2x1_intrawave_v1,793.74,1437.86,0.0001
256,480,11264,1536,ck,14,2,20.0957,a8w8_blockscale_bpreshuffle_1x128x128_256x64x128x128_16x16_16x16_8x32x1_8x32x1_1x32x1x8_8_2x1_intrawave_v1,826.52,1435.74,0.0002
256,512,11264,1536,ck,14,3,20.0951,a8w8_blockscale_bpreshuffle_1x128x128_256x64x128x128_16x16_16x16_8x32x1_8x32x1_1x32x1x8_8_2x1_intrawave_v1,881.64,1474.1,0.0002
256,544,11264,1536,ck,13,0,22.5239,a8w8_blockscale_bpreshuffle_1x128x128_256x64x256x128_16x16_16x16_8x32x1_8x32x1_1x32x1x8_8_2x1_intrawave_v1,835.74,1349.34,0.0
256,576,11264,1536,ck,13,2,22.4972,a8w8_blockscale_bpreshuffle_1x128x128_256x64x256x128_16x16_16x16_8x32x1_8x32x1_1x32x1x8_8_2x1_intrawave_v1,885.95,1385.17,0.0
256,608,11264,1536,ck,13,3,23.3136,a8w8_blockscale_bpreshuffle_1x128x128_256x64x256x128_16x16_16x16_8x32x1_8x32x1_1x32x1x8_8_2x1_intrawave_v1,902.42,1369.69,0.0
256,640,11264,1536,ck,13,2,23.0517,a8w8_blockscale_bpreshuffle_1x128x128_256x64x256x128_16x16_16x16_8x32x1_8x32x1_1x32x1x8_8_2x1_intrawave_v1,960.71,1418.66,0.0
256,672,11264,1536,ck,13,3,23.3509,a8w8_blockscale_bpreshuffle_1x128x128_256x64x256x128_16x16_16x16_8x32x1_8x32x1_1x32x1x8_8_2x1_intrawave_v1,995.82,1433.46,0.0
256,704,11264,1536,ck,13,1,23.5657,a8w8_blockscale_bpreshuffle_1x128x128_256x64x256x128_16x16_16x16_8x32x1_8x32x1_1x32x1x8_8_2x1_intrawave_v1,1033.73,1453.07,0.0
256,736,11264,1536,ck,14,3,28.1682,a8w8_blockscale_bpreshuffle_1x128x128_256x64x128x128_16x16_16x16_8x32x1_8x32x1_1x32x1x8_8_2x1_intrawave_v1,904.13,1242.98,0.0002
256,768,11264,1536,ck,14,0,27.9929,a8w8_blockscale_bpreshuffle_1x128x128_256x64x128x128_16x16_16x16_8x32x1_8x32x1_1x32x1x8_8_2x1_intrawave_v1,949.35,1278.28,0.0002
256,800,11264,1536,ck,14,2,29.5405,a8w8_blockscale_bpreshuffle_1x128x128_256x64x128x128_16x16_16x16_8x32x1_8x32x1_1x32x1x8_8_2x1_intrawave_v1,937.1,1237.38,0.0002
256,832,11264,1536,ck,14,3,29.7321,a8w8_blockscale_bpreshuffle_1x128x128_256x64x128x128_16x16_16x16_8x32x1_8x32x1_1x32x1x8_8_2x1_intrawave_v1,968.3,1255.3,0.0002
256,864,11264,1536,ck,14,2,30.6221,a8w8_blockscale_bpreshuffle_1x128x128_256x64x128x128_16x16_16x16_8x32x1_8x32x1_1x32x1x8_8_2x1_intrawave_v1,976.32,1243.96,0.0002
256,896,11264,1536,ck,14,1,30.0197,a8w8_blockscale_bpreshuffle_1x128x128_256x64x128x128_16x16_16x16_8x32x1_8x32x1_1x32x1x8_8_2x1_intrawave_v1,1032.8,1294.58,0.0002
256,928,11264,1536,ck,13,1,32.1836,a8w8_blockscale_bpreshuffle_1x128x128_256x64x256x128_16x16_16x16_8x32x1_8x32x1_1x32x1x8_8_2x1_intrawave_v1,997.76,1231.46,0.0
256,960,11264,1536,ck,13,3,31.8863,a8w8_blockscale_bpreshuffle_1x128x128_256x64x256x128_16x16_16x16_8x32x1_8x32x1_1x32x1x8_8_2x1_intrawave_v1,1041.79,1267.09,0.0
256,992,11264,1536,ck,14,1,36.2052,a8w8_blockscale_bpreshuffle_1x128x128_256x64x128x128_16x16_16x16_8x32x1_8x32x1_1x32x1x8_8_2x1_intrawave_v1,948.1,1137.21,0.0002
256,1024,11264,1536,ck,13,0,35.3402,a8w8_blockscale_bpreshuffle_1x128x128_256x64x256x128_16x16_16x16_8x32x1_8x32x1_1x32x1x8_8_2x1_intrawave_v1,1002.64,1186.84,0.0
256,1088,11264,1536,ck,13,0,34.2443,a8w8_blockscale_bpreshuffle_1x128x128_256x64x256x128_16x16_16x16_8x32x1_8x32x1_1x32x1x8_8_2x1_intrawave_v1,1099.4,1269.79,0.0
256,1152,11264,1536,ck,13,2,38.6326,a8w8_blockscale_bpreshuffle_1x128x128_256x64x256x128_16x16_16x16_8x32x1_8x32x1_1x32x1x8_8_2x1_intrawave_v1,1031.84,1165.42,0.0
256,1216,11264,1536,ck,14,0,38.981,a8w8_blockscale_bpreshuffle_1x128x128_256x64x128x128_16x16_16x16_8x32x1_8x32x1_1x32x1x8_8_2x1_intrawave_v1,1079.43,1194.51,0.0003
256,1280,11264,1536,ck,13,0,39.7787,a8w8_blockscale_bpreshuffle_1x128x128_256x64x256x128_16x16_16x16_8x32x1_8x32x1_1x32x1x8_8_2x1_intrawave_v1,1113.46,1209.28,0.0
256,1344,11264,1536,ck,13,3,42.1884,a8w8_blockscale_bpreshuffle_1x128x128_256x64x256x128_16x16_16x16_8x32x1_8x32x1_1x32x1x8_8_2x1_intrawave_v1,1102.35,1176.71,0.0
256,1408,11264,1536,ck,13,2,41.2262,a8w8_blockscale_bpreshuffle_1x128x128_256x64x256x128_16x16_16x16_8x32x1_8x32x1_1x32x1x8_8_2x1_intrawave_v1,1181.8,1241.53,0.0
256,1472,11264,1536,ck,13,3,41.4195,a8w8_blockscale_bpreshuffle_1x128x128_256x64x256x128_16x16_16x16_8x32x1_8x32x1_1x32x1x8_8_2x1_intrawave_v1,1229.75,1272.92,0.0
256,1536,11264,1536,ck,13,1,47.9219,a8w8_blockscale_bpreshuffle_1x128x128_256x64x256x128_16x16_16x16_8x32x1_8x32x1_1x32x1x8_8_2x1_intrawave_v1,1109.1,1132.34,0.0
256,1600,11264,1536,ck,14,1,48.8271,a8w8_blockscale_bpreshuffle_1x128x128_256x64x128x128_16x16_16x16_8x32x1_8x32x1_1x32x1x8_8_2x1_intrawave_v1,1133.9,1142.89,0.0003
256,1664,11264,1536,ck,13,3,48.6899,a8w8_blockscale_bpreshuffle_1x128x128_256x64x256x128_16x16_16x16_8x32x1_8x32x1_1x32x1x8_8_2x1_intrawave_v1,1182.57,1177.74,0.0
256,1728,11264,1536,ck,13,1,50.6143,a8w8_blockscale_bpreshuffle_1x128x128_256x64x256x128_16x16_16x16_8x32x1_8x32x1_1x32x1x8_8_2x1_intrawave_v1,1181.37,1163.39,0.0
256,1792,11264,1536,ck,13,2,49.4151,a8w8_blockscale_bpreshuffle_1x128x128_256x64x256x128_16x16_16x16_8x32x1_8x32x1_1x32x1x8_8_2x1_intrawave_v1,1254.85,1222.79,0.0
256,1856,11264,1536,ck,13,2,52.378,a8w8_blockscale_bpreshuffle_1x128x128_256x64x256x128_16x16_16x16_8x32x1_8x32x1_1x32x1x8_8_2x1_intrawave_v1,1226.15,1183.02,0.0
256,1920,11264,1536,ck,13,0,58.3876,a8w8_blockscale_bpreshuffle_1x128x128_256x64x256x128_16x16_16x16_8x32x1_8x32x1_1x32x1x8_8_2x1_intrawave_v1,1137.87,1087.63,0.0
256,1984,11264,1536,ck,13,1,58.6248,a8w8_blockscale_bpreshuffle_1x128x128_256x64x256x128_16x16_16x16_8x32x1_8x32x1_1x32x1x8_8_2x1_intrawave_v1,1171.05,1109.5,0.0
256,2048,11264,1536,ck,13,3,62.7237,a8w8_blockscale_bpreshuffle_1x128x128_256x64x256x128_16x16_16x16_8x32x1_8x32x1_1x32x1x8_8_2x1_intrawave_v1,1129.83,1061.55,0.0
256,4096,11264,1536,ck,13,2,105.4009,a8w8_blockscale_bpreshuffle_1x128x128_256x64x256x128_16x16_16x16_8x32x1_8x32x1_1x32x1x8_8_2x1_intrawave_v1,1344.71,1099.3,0.0
256,8192,11264,1536,ck,13,3,191.9427,a8w8_blockscale_bpreshuffle_1x128x128_256x64x256x128_16x16_16x16_8x32x1_8x32x1_1x32x1x8_8_2x1_intrawave_v1,1476.84,1117.18,0.0
256,16384,11264,1536,ck,13,1,361.7374,a8w8_blockscale_bpreshuffle_1x128x128_256x64x256x128_16x16_16x16_8x32x1_8x32x1_1x32x1x8_8_2x1_intrawave_v1,1567.26,1137.75,0.0
256,32768,11264,1536,ck,13,2,698.3751,a8w8_blockscale_bpreshuffle_1x128x128_256x64x256x128_16x16_16x16_8x32x1_8x32x1_1x32x1x8_8_2x1_intrawave_v1,1623.59,1153.87,0.0
256,16,512,7168,ck,7,0,18.2056,a8w8_blockscale_bpreshuffle_1x128x128_256x16x64x256_16x16_16x16_16x16x1_16x16x1_1x16x1x16_4_1x1_intrawave_v1,6.45,208.79,0.0
256,32,512,7168,ck,7,0,18.1904,a8w8_blockscale_bpreshuffle_1x128x128_256x16x64x256_16x16_16x16_16x16x1_16x16x1_1x16x1x16_4_1x1_intrawave_v1,12.91,216.17,0.0
256,64,512,7168,ck,7,0,17.7712,a8w8_blockscale_bpreshuffle_1x128x128_256x16x64x256_16x16_16x16_16x16x1_16x16x1_1x16x1x16_4_1x1_intrawave_v1,26.43,236.02,0.0
256,128,512,7168,ck,7,0,17.429,a8w8_blockscale_bpreshuffle_1x128x128_256x16x64x256_16x16_16x16_16x16x1_16x16x1_1x16x1x16_4_1x1_intrawave_v1,53.91,270.73,0.0
256,256,512,7168,ck,7,0,17.7881,a8w8_blockscale_bpreshuffle_1x128x128_256x16x64x256_16x16_16x16_16x16x1_16x16x1_1x16x1x16_4_1x1_intrawave_v1,105.64,324.21,0.0
256,512,512,7168,ck,7,0,18.1479,a8w8_blockscale_bpreshuffle_1x128x128_256x16x64x256_16x16_16x16_16x16x1_16x16x1_1x16x1x16_4_1x1_intrawave_v1,207.08,433.35,0.0
256,1024,512,7168,ck,12,0,19.1531,a8w8_blockscale_bpreshuffle_1x128x128_256x32x64x256_16x16_16x16_16x16x1_16x16x1_1x32x1x8_8_2x1_intrawave_v1,392.43,629.59,0.0
256,1536,512,7168,ck,17,0,22.4382,a8w8_blockscale_bpreshuffle_1x128x128_256x64x64x256_16x16_16x16_16x16x1_16x16x1_1x32x1x8_8_2x1_intrawave_v1,502.46,724.34,0.0
256,2048,512,7168,ck,17,0,23.2257,a8w8_blockscale_bpreshuffle_1x128x128_256x64x64x256_16x16_16x16_16x16x1_16x16x1_1x32x1x8_8_2x1_intrawave_v1,647.23,880.37,0.0
256,4096,512,7168,ck,14,0,39.233,a8w8_blockscale_bpreshuffle_1x128x128_256x64x128x128_16x16_16x16_8x32x1_8x32x1_1x32x1x8_8_2x1_intrawave_v1,766.31,948.8,0.0
256,8192,512,7168,ck,13,0,57.2306,a8w8_blockscale_bpreshuffle_1x128x128_256x64x256x128_16x16_16x16_8x32x1_8x32x1_1x32x1x8_8_2x1_intrawave_v1,1050.65,1236.73,0.0
256,16384,512,7168,ck,13,0,94.1084,a8w8_blockscale_bpreshuffle_1x128x128_256x64x256x128_16x16_16x16_8x32x1_8x32x1_1x32x1x8_8_2x1_intrawave_v1,1277.88,1465.2,0.0
256,20480,512,7168,cktile,11,0,106.7849,a8w8_blockscale_cktile_192x256x128_4x2x1_16x16x128_intrawave_0x1x0_1,1407.73,1605.49,0.0
256,16,576,7168,ck,7,0,18.3422,a8w8_blockscale_bpreshuffle_1x128x128_256x16x64x256_16x16_16x16_16x16x1_16x16x1_1x16x1x16_4_1x1_intrawave_v1,7.2,232.35,0.0
256,32,576,7168,ck,7,0,18.2172,a8w8_blockscale_bpreshuffle_1x128x128_256x16x64x256_16x16_16x16_16x16x1_16x16x1_1x16x1x16_4_1x1_intrawave_v1,14.51,241.26,0.0
256,64,576,7168,ck,7,0,17.8832,a8w8_blockscale_bpreshuffle_1x128x128_256x16x64x256_16x16_16x16_16x16x1_16x16x1_1x16x1x16_4_1x1_intrawave_v1,29.55,260.65,0.0
256,128,576,7168,ck,7,0,17.5733,a8w8_blockscale_bpreshuffle_1x128x128_256x16x64x256_16x16_16x16_16x16x1_16x16x1_1x16x1x16_4_1x1_intrawave_v1,60.15,295.55,0.0
256,256,576,7168,ck,7,0,17.9259,a8w8_blockscale_bpreshuffle_1x128x128_256x16x64x256_16x16_16x16_16x16x1_16x16x1_1x16x1x16_4_1x1_intrawave_v1,117.93,349.14,0.0
256,512,576,7168,ck,12,0,19.2487,a8w8_blockscale_bpreshuffle_1x128x128_256x32x64x256_16x16_16x16_16x16x1_16x16x1_1x32x1x8_8_2x1_intrawave_v1,219.64,435.8,0.0
256,1024,576,7168,ck,17,0,22.593,a8w8_blockscale_bpreshuffle_1x128x128_256x64x64x256_16x16_16x16_16x16x1_16x16x1_1x32x1x8_8_2x1_intrawave_v1,374.26,559.84,0.0
256,1536,576,7168,ck,17,0,23.2441,a8w8_blockscale_bpreshuffle_1x128x128_256x64x64x256_16x16_16x16_16x16x1_16x16x1_1x32x1x8_8_2x1_intrawave_v1,545.67,727.42,0.0
256,2048,576,7168,ck,17,0,33.3774,a8w8_blockscale_bpreshuffle_1x128x128_256x64x64x256_16x16_16x16_16x16x1_16x16x1_1x32x1x8_8_2x1_intrawave_v1,506.67,634.21,0.0
256,4096,576,7168,ck,15,0,50.3338,a8w8_blockscale_bpreshuffle_1x128x128_256x64x64x128_16x16_16x16_8x32x1_8x32x1_1x32x1x8_8_2x1_intrawave_v1,671.97,759.08,0.0038
256,8192,576,7168,cktile,11,0,90.0231,a8w8_blockscale_cktile_192x256x128_4x2x1_16x16x128_intrawave_0x1x0_1,751.43,802.97,0.0
256,16384,576,7168,cktile,11,0,150.8,a8w8_blockscale_cktile_192x256x128_4x2x1_16x16x128_intrawave_0x1x0_1,897.16,931.32,0.0
256,20480,576,7168,cktile,11,0,180.1012,a8w8_blockscale_cktile_192x256x128_4x2x1_16x16x128_intrawave_0x1x0_1,939.0,969.02,0.0
256,128,1024,4096,ck,7,0,11.4896,a8w8_blockscale_bpreshuffle_1x128x128_256x16x64x256_16x16_16x16_16x16x1_16x16x1_1x16x1x16_4_1x1_intrawave_v1,93.45,433.5,0.0
256,16,1536,7168,ck,7,0,18.7145,a8w8_blockscale_bpreshuffle_1x128x128_256x16x64x256_16x16_16x16_16x16x1_16x16x1_1x16x1x16_4_1x1_intrawave_v1,18.83,597.07,0.0
256,32,1536,7168,ck,7,0,18.6961,a8w8_blockscale_bpreshuffle_1x128x128_256x16x64x256_16x16_16x16_16x16x1_16x16x1_1x16x1x16_4_1x1_intrawave_v1,37.69,606.42,0.0
256,64,1536,7168,ck,7,0,18.2775,a8w8_blockscale_bpreshuffle_1x128x128_256x16x64x256_16x16_16x16_16x16x1_16x16x1_1x16x1x16_4_1x1_intrawave_v1,77.1,638.24,0.0
256,128,1536,7168,ck,7,0,18.0795,a8w8_blockscale_bpreshuffle_1x128x128_256x16x64x256_16x16_16x16_16x16x1_16x16x1_1x16x1x16_4_1x1_intrawave_v1,155.9,681.48,0.0
256,256,1536,7168,ck,12,0,18.6241,a8w8_blockscale_bpreshuffle_1x128x128_256x32x64x256_16x16_16x16_16x16x1_16x16x1_1x32x1x8_8_2x1_intrawave_v1,302.68,731.93,0.0
256,512,1536,7168,ck,17,0,22.9966,a8w8_blockscale_bpreshuffle_1x128x128_256x64x64x256_16x16_16x16_16x16x1_16x16x1_1x32x1x8_8_2x1_intrawave_v1,490.26,706.75,0.0
256,1024,1536,7168,ck,17,0,34.7438,a8w8_blockscale_bpreshuffle_1x128x128_256x64x64x256_16x16_16x16_16x16x1_16x16x1_1x32x1x8_8_2x1_intrawave_v1,649.0,618.69,0.0
256,1536,1536,7168,ck,14,0,44.8241,a8w8_blockscale_bpreshuffle_1x128x128_256x64x128x128_16x16_16x16_8x32x1_8x32x1_1x32x1x8_8_2x1_intrawave_v1,754.57,596.52,0.0
256,2048,1536,7168,ck,14,0,51.3806,a8w8_blockscale_bpreshuffle_1x128x128_256x64x128x128_16x16_16x16_8x32x1_8x32x1_1x32x1x8_8_2x1_intrawave_v1,877.71,622.44,0.0001
256,4096,1536,7168,ck,13,0,82.4912,a8w8_blockscale_bpreshuffle_1x128x128_256x64x256x128_16x16_16x16_8x32x1_8x32x1_1x32x1x8_8_2x1_intrawave_v1,1093.38,641.92,0.0
256,8192,1536,7168,ck,13,0,136.0356,a8w8_blockscale_bpreshuffle_1x128x128_256x64x256x128_16x16_16x16_8x32x1_8x32x1_1x32x1x8_8_2x1_intrawave_v1,1326.04,697.58,0.0
256,16384,1536,7168,cktile,11,0,249.8869,a8w8_blockscale_cktile_192x256x128_4x2x1_16x16x128_intrawave_0x1x0_1,1443.76,715.45,0.0
256,20480,1536,7168,cktile,11,0,294.3538,a8w8_blockscale_cktile_192x256x128_4x2x1_16x16x128_intrawave_0x1x0_1,1532.07,749.86,0.0
256,20480,3072,1536,cktile,11,0,161.6298,a8w8_blockscale_cktile_192x256x128_4x2x1_16x16x128_intrawave_0x1x0_1,1195.78,1002.32,0.0
256,128,4096,1280,ck,7,0,6.7501,a8w8_blockscale_bpreshuffle_1x128x128_256x16x64x256_16x16_16x16_16x16x1_16x16x1_1x16x1x16_4_1x1_intrawave_v1,198.84,956.33,0.0
256,20480,4096,512,cktile,10,0,112.727,a8w8_blockscale_cktile_128x128x128_2x2x1_16x16x128_intrawave_0x1x0_2,762.01,1599.93,0.0
256,32768,4096,2048,cktile,11,0,417.4786,a8w8_blockscale_cktile_192x256x128_4x2x1_16x16x128_intrawave_0x1x0_1,1316.85,823.83,0.0
256,20480,4608,7168,cktile,11,0,769.2192,a8w8_blockscale_cktile_192x256x128_4x2x1_16x16x128_intrawave_0x1x0_1,1758.82,479.15,0.0
256,16,7168,256,ck,7,0,2.8963,a8w8_blockscale_bpreshuffle_1x128x128_256x16x64x256_16x16_16x16_16x16x1_16x16x1_1x16x1x16_4_1x1_intrawave_v1,20.27,714.18,0.0
256,32,7168,256,ck,7,0,3.2073,a8w8_blockscale_bpreshuffle_1x128x128_256x16x64x256_16x16_16x16_16x16x1_16x16x1_1x16x1x16_4_1x1_intrawave_v1,36.62,717.72,0.0
256,64,7168,256,ck,7,0,3.6924,a8w8_blockscale_bpreshuffle_1x128x128_256x16x64x256_16x16_16x16_16x16x1_16x16x1_1x16x1x16_4_1x1_intrawave_v1,63.61,749.89,0.0
256,128,7168,256,ck,7,0,4.4087,a8w8_blockscale_bpreshuffle_1x128x128_256x16x64x256_16x16_16x16_16x16x1_16x16x1_1x16x1x16_4_1x1_intrawave_v1,106.55,839.88,0.0
256,256,7168,256,ck,7,0,5.6622,a8w8_blockscale_bpreshuffle_1x128x128_256x16x64x256_16x16_16x16_16x16x1_16x16x1_1x16x1x16_4_1x1_intrawave_v1,165.93,983.82,0.0
256,512,7168,256,ck,12,0,7.905,a8w8_blockscale_bpreshuffle_1x128x128_256x32x64x256_16x16_16x16_16x16x1_16x16x1_1x32x1x8_8_2x1_intrawave_v1,237.7,1177.24,0.0
256,1024,7168,256,cktile,10,0,11.1158,a8w8_blockscale_cktile_128x128x128_2x2x1_16x16x128_intrawave_0x1x0_2,338.09,1509.31,0.0
256,1536,7168,256,cktile,10,0,16.1764,a8w8_blockscale_cktile_128x128x128_2x2x1_16x16x128_intrawave_0x1x0_2,348.48,1498.99,0.0
256,2048,7168,256,cktile,10,0,18.4829,a8w8_blockscale_cktile_128x128x128_2x2x1_16x16x128_intrawave_0x1x0_2,406.66,1716.15,0.0
256,4096,7168,256,cktile,10,0,32.9637,a8w8_blockscale_cktile_128x128x128_2x2x1_16x16x128_intrawave_0x1x0_2,456.03,1868.84,0.0
256,8192,7168,256,cktile,10,0,57.3798,a8w8_blockscale_cktile_128x128x128_2x2x1_16x16x128_intrawave_0x1x0_2,523.96,2115.25,0.0
256,16384,7168,256,cktile,10,0,105.3891,a8w8_blockscale_cktile_128x128x128_2x2x1_16x16x128_intrawave_0x1x0_2,570.55,2285.91,0.0
256,20480,7168,256,cktile,10,0,129.606,a8w8_blockscale_cktile_128x128x128_2x2x1_16x16x128_intrawave_0x1x0_2,579.93,2319.95,0.0
256,20480,7168,2048,cktile,11,0,423.63,a8w8_blockscale_cktile_192x256x128_4x2x1_16x16x128_intrawave_0x1x0_1,1419.39,826.72,0.0
256,20480,7168,2304,cktile,11,0,459.6829,a8w8_blockscale_cktile_192x256x128_4x2x1_16x16x128_intrawave_0x1x0_1,1471.57,777.28,0.0
80,16,128,7168,asm,25,8,9.879,_ZN5aiter42fp8gemm_bf16_blockscale_BpreShuffle_32x128E,2.97,104.9,0.0137
80,32,128,7168,asm,25,8,10.0287,_ZN5aiter42fp8gemm_bf16_blockscale_BpreShuffle_32x128E,5.86,115.18,0.009
80,48,128,7168,asm,25,8,10.4256,_ZN5aiter42fp8gemm_bf16_blockscale_BpreShuffle_32x128E,8.45,122.19,0.0062
80,64,128,7168,asm,25,8,9.9917,_ZN5aiter42fp8gemm_bf16_blockscale_BpreShuffle_32x128E,11.75,139.38,0.0065
80,80,128,7168,asm,25,8,10.3255,_ZN5aiter42fp8gemm_bf16_blockscale_BpreShuffle_32x128E,14.22,146.38,0.0063
80,96,128,7168,asm,25,8,10.4727,_ZN5aiter42fp8gemm_bf16_blockscale_BpreShuffle_32x128E,16.82,155.66,0.0079
80,112,128,7168,asm,25,8,10.6035,_ZN5aiter42fp8gemm_bf16_blockscale_BpreShuffle_32x128E,19.38,164.94,0.0145
80,128,128,7168,asm,25,8,10.5586,_ZN5aiter42fp8gemm_bf16_blockscale_BpreShuffle_32x128E,22.25,176.9,0.0128
80,144,128,7168,asm,25,8,10.529,_ZN5aiter42fp8gemm_bf16_blockscale_BpreShuffle_32x128E,25.1,188.68,0.0114
80,160,128,7168,asm,25,8,10.5045,_ZN5aiter42fp8gemm_bf16_blockscale_BpreShuffle_32x128E,27.95,200.42,0.0088
80,176,128,7168,asm,25,8,10.8439,_ZN5aiter42fp8gemm_bf16_blockscale_BpreShuffle_32x128E,29.78,205.1,0.0134
80,192,128,7168,asm,25,8,10.5898,_ZN5aiter42fp8gemm_bf16_blockscale_BpreShuffle_32x128E,33.27,221.24,0.0062
80,208,128,7168,asm,25,8,11.0951,_ZN5aiter42fp8gemm_bf16_blockscale_BpreShuffle_32x128E,34.4,221.87,0.0115
80,224,128,7168,asm,25,8,10.6523,_ZN5aiter42fp8gemm_bf16_blockscale_BpreShuffle_32x128E,38.59,242.25,0.0145
80,240,128,7168,asm,25,8,10.9822,_ZN5aiter42fp8gemm_bf16_blockscale_BpreShuffle_32x128E,40.1,245.79,0.0128
80,256,128,7168,asm,25,8,11.2736,_ZN5aiter42fp8gemm_bf16_blockscale_BpreShuffle_32x128E,41.67,249.97,0.0093
80,288,128,7168,asm,25,8,11.2192,_ZN5aiter42fp8gemm_bf16_blockscale_BpreShuffle_32x128E,47.11,272.36,0.0099
80,320,128,7168,asm,25,8,11.1438,_ZN5aiter42fp8gemm_bf16_blockscale_BpreShuffle_32x128E,52.69,295.52,0.0043
80,352,128,7168,asm,24,7,11.8266,_ZN5aiter42fp8gemm_bf16_blockscale_BpreShuffle_32x128E,54.62,298.54,0.0093
80,384,128,7168,asm,33,8,12.2919,_ZN5aiter42fp8gemm_bf16_blockscale_BpreShuffle_48x128E,57.33,306.57,0.0154
80,416,128,7168,asm,33,8,12.1656,_ZN5aiter42fp8gemm_bf16_blockscale_BpreShuffle_48x128E,62.75,329.28,0.0076
80,448,128,7168,asm,33,8,12.2078,_ZN5aiter42fp8gemm_bf16_blockscale_BpreShuffle_48x128E,67.34,347.6,0.015
80,480,128,7168,asm,33,8,12.4854,_ZN5aiter42fp8gemm_bf16_blockscale_BpreShuffle_48x128E,70.55,358.9,0.013
80,512,128,7168,asm,32,7,13.0192,_ZN5aiter42fp8gemm_bf16_blockscale_BpreShuffle_48x128E,72.16,362.43,0.007
80,544,128,7168,asm,41,8,13.6482,_ZN5aiter42fp8gemm_bf16_blockscale_BpreShuffle_64x128E,73.14,363.14,0.0122
80,576,128,7168,asm,41,8,14.0794,_ZN5aiter42fp8gemm_bf16_blockscale_BpreShuffle_64x128E,75.07,368.89,0.0032
80,608,128,7168,asm,41,8,13.9259,_ZN5aiter42fp8gemm_bf16_blockscale_BpreShuffle_64x128E,80.12,390.01,0.0129
80,640,128,7168,asm,41,8,13.891,_ZN5aiter42fp8gemm_bf16_blockscale_BpreShuffle_64x128E,84.54,408.1,0.0061
80,672,128,7168,asm,40,7,14.5385,_ZN5aiter42fp8gemm_bf16_blockscale_BpreShuffle_64x128E,84.82,406.26,0.0058
80,704,128,7168,asm,40,7,14.9166,_ZN5aiter42fp8gemm_bf16_blockscale_BpreShuffle_64x128E,86.6,411.89,0.001
80,736,128,7168,asm,30,5,15.3798,_ZN5aiter42fp8gemm_bf16_blockscale_BpreShuffle_48x128E,87.81,414.93,0.0013
80,768,128,7168,asm,49,8,15.2034,_ZN5aiter42fp8gemm_bf16_blockscale_BpreShuffle_80x128E,92.7,435.37,0.0145
80,800,128,7168,asm,39,6,15.7022,_ZN5aiter42fp8gemm_bf16_blockscale_BpreShuffle_64x128E,93.49,436.67,0.0052
80,832,128,7168,asm,48,7,16.0103,_ZN5aiter42fp8gemm_bf16_blockscale_BpreShuffle_80x128E,95.36,443.11,0.002
80,864,128,7168,asm,29,4,16.2406,_ZN5aiter42fp8gemm_bf16_blockscale_BpreShuffle_48x128E,97.62,451.45,0.0021
80,896,128,7168,asm,29,4,16.4535,_ZN5aiter42fp8gemm_bf16_blockscale_BpreShuffle_48x128E,99.93,460.05,0.0022
80,928,128,7168,asm,29,4,15.9481,_ZN5aiter42fp8gemm_bf16_blockscale_BpreShuffle_48x128E,106.78,489.52,0.0022
80,960,128,7168,asm,29,4,16.0702,_ZN5aiter42fp8gemm_bf16_blockscale_BpreShuffle_48x128E,109.62,500.59,0.0014
80,992,128,7168,asm,38,5,16.8743,_ZN5aiter42fp8gemm_bf16_blockscale_BpreShuffle_64x128E,107.88,490.81,0.0029
80,1024,128,7168,asm,38,5,17.0382,_ZN5aiter42fp8gemm_bf16_blockscale_BpreShuffle_64x128E,110.28,500.03,0.0025
80,1088,128,7168,asm,37,4,18.7986,_ZN5aiter42fp8gemm_bf16_blockscale_BpreShuffle_64x128E,106.2,478.48,0.0023
80,1152,128,7168,asm,37,4,17.9265,_ZN5aiter42fp8gemm_bf16_blockscale_BpreShuffle_64x128E,117.92,528.27,0.0016
80,1216,128,7168,asm,37,4,18.446,_ZN5aiter42fp8gemm_bf16_blockscale_BpreShuffle_64x128E,120.97,539.15,0.0019
80,1280,128,7168,asm,37,4,18.2221,_ZN5aiter42fp8gemm_bf16_blockscale_BpreShuffle_64x128E,128.9,571.85,0.0019
80,1344,128,7168,asm,54,5,26.4722,_ZN5aiter42fp8gemm_bf16_blockscale_BpreShuffle_96x128E,93.16,411.58,0.0042
80,1408,128,7168,asm,45,4,26.4329,_ZN5aiter42fp8gemm_bf16_blockscale_BpreShuffle_80x128E,97.75,430.16,0.0017
80,1472,128,7168,asm,45,4,25.009,_ZN5aiter42fp8gemm_bf16_blockscale_BpreShuffle_80x128E,108.01,473.65,0.0014
80,1536,128,7168,asm,45,4,25.6409,_ZN5aiter42fp8gemm_bf16_blockscale_BpreShuffle_80x128E,109.92,480.51,0.0013
80,1600,128,7168,asm,45,4,25.7442,_ZN5aiter42fp8gemm_bf16_blockscale_BpreShuffle_80x128E,114.05,497.04,0.0028
80,1664,128,7168,asm,36,3,26.6521,_ZN5aiter42fp8gemm_bf16_blockscale_BpreShuffle_64x128E,114.57,497.94,0.0004
80,1728,128,7168,asm,27,2,29.3559,_ZN5aiter42fp8gemm_bf16_blockscale_BpreShuffle_48x128E,108.02,468.26,0.0
80,1792,128,7168,asm,53,4,28.8844,_ZN5aiter42fp8gemm_bf16_blockscale_BpreShuffle_96x128E,113.84,492.35,0.0005
80,1856,128,7168,asm,27,2,29.1481,_ZN5aiter42fp8gemm_bf16_blockscale_BpreShuffle_48x128E,116.84,504.2,0.0
80,1920,128,7168,asm,53,4,28.901,_ZN5aiter42fp8gemm_bf16_blockscale_BpreShuffle_96x128E,121.91,524.95,0.0022
80,1984,128,7168,asm,44,3,29.8906,_ZN5aiter42fp8gemm_bf16_blockscale_BpreShuffle_80x128E,121.8,523.47,0.0013
80,2048,128,7168,asm,44,3,30.9528,_ZN5aiter42fp8gemm_bf16_blockscale_BpreShuffle_80x128E,121.41,520.85,0.0001
80,4096,128,7168,asm,34,1,44.1047,_ZN5aiter42fp8gemm_bf16_blockscale_BpreShuffle_64x128E,170.42,710.27,0.0
80,8192,128,7168,asm,58,1,73.2632,_ZN5aiter43fp8gemm_bf16_blockscale_BpreShuffle_128x128E,205.18,842.65,0.0
80,16384,128,7168,asm,42,1,138.1319,_ZN5aiter42fp8gemm_bf16_blockscale_BpreShuffle_80x128E,217.65,887.21,0.0
80,32768,128,7168,asm,50,1,263.1977,_ZN5aiter42fp8gemm_bf16_blockscale_BpreShuffle_96x128E,228.46,927.77,0.0
80,16,2112,7168,ck,7,1,18.614,a8w8_blockscale_bpreshuffle_1x128x128_256x16x64x256_16x16_16x16_16x16x1_16x16x1_1x16x1x16_4_1x1_intrawave_v1,26.03,823.09,0.0
80,32,2112,7168,ck,7,2,18.7138,a8w8_blockscale_bpreshuffle_1x128x128_256x16x64x256_16x16_16x16_16x16x1_16x16x1_1x16x1x16_4_1x1_intrawave_v1,51.77,828.45,0.0
80,48,2112,7168,ck,7,2,22.5194,a8w8_blockscale_bpreshuffle_1x128x128_256x16x64x256_16x16_16x16_16x16x1_16x16x1_1x16x1x16_4_1x1_intrawave_v1,64.54,696.54,0.0
80,64,2112,7168,ck,12,3,22.0789,a8w8_blockscale_bpreshuffle_1x128x128_256x32x64x256_16x16_16x16_16x16x1_16x16x1_1x32x1x8_8_2x1_intrawave_v1,87.77,718.69,0.0
80,80,2112,7168,ck,7,3,30.7127,a8w8_blockscale_bpreshuffle_1x128x128_256x16x64x256_16x16_16x16_16x16x1_16x16x1_1x16x1x16_4_1x1_intrawave_v1,78.87,522.59,0.0
80,96,2112,7168,ck,12,1,30.846,a8w8_blockscale_bpreshuffle_1x128x128_256x32x64x256_16x16_16x16_16x16x1_16x16x1_1x32x1x8_8_2x1_intrawave_v1,94.23,526.24,0.0
80,112,2112,7168,ck,12,3,31.7799,a8w8_blockscale_bpreshuffle_1x128x128_256x32x64x256_16x16_16x16_16x16x1_16x16x1_1x32x1x8_8_2x1_intrawave_v1,106.71,516.51,0.0
80,128,2112,7168,ck,12,0,31.1227,a8w8_blockscale_bpreshuffle_1x128x128_256x32x64x256_16x16_16x16_16x16x1_16x16x1_1x32x1x8_8_2x1_intrawave_v1,124.52,533.28,0.0
80,144,2112,7168,ck,10,0,38.1321,a8w8_blockscale_bpreshuffle_1x128x128_256x32x64x128_16x16_16x16_8x32x1_8x32x1_1x32x1x8_8_2x1_intrawave_v1,114.34,440.03,0.0
80,160,2112,7168,ck,10,0,37.5138,a8w8_blockscale_bpreshuffle_1x128x128_256x32x64x128_16x16_16x16_8x32x1_8x32x1_1x32x1x8_8_2x1_intrawave_v1,129.14,452.14,0.0
80,176,2112,7168,ck,10,3,40.2538,a8w8_blockscale_bpreshuffle_1x128x128_256x32x64x128_16x16_16x16_8x32x1_8x32x1_1x32x1x8_8_2x1_intrawave_v1,132.38,425.89,0.0
80,192,2112,7168,ck,10,0,40.3012,a8w8_blockscale_bpreshuffle_1x128x128_256x32x64x128_16x16_16x16_8x32x1_8x32x1_1x32x1x8_8_2x1_intrawave_v1,144.25,429.91,0.0
80,208,2112,7168,ck,10,0,41.3547,a8w8_blockscale_bpreshuffle_1x128x128_256x32x64x128_16x16_16x16_8x32x1_8x32x1_1x32x1x8_8_2x1_intrawave_v1,152.29,423.37,0.0
80,224,2112,7168,ck,10,2,41.3347,a8w8_blockscale_bpreshuffle_1x128x128_256x32x64x128_16x16_16x16_8x32x1_8x32x1_1x32x1x8_8_2x1_intrawave_v1,164.08,427.98,0.0
80,240,2112,7168,ck,17,3,54.6251,a8w8_blockscale_bpreshuffle_1x128x128_256x64x64x256_16x16_16x16_16x16x1_16x16x1_1x32x1x8_8_2x1_intrawave_v1,133.03,327.19,0.0
80,256,2112,7168,ck,15,0,53.3899,a8w8_blockscale_bpreshuffle_1x128x128_256x64x64x128_16x16_16x16_8x32x1_8x32x1_1x32x1x8_8_2x1_intrawave_v1,145.18,338.18,0.0
80,288,2112,7168,ck,10,1,56.4072,a8w8_blockscale_bpreshuffle_1x128x128_256x32x64x128_16x16_16x16_8x32x1_8x32x1_1x32x1x8_8_2x1_intrawave_v1,154.59,326.55,0.0
80,320,2112,7168,ck,10,3,67.5824,a8w8_blockscale_bpreshuffle_1x128x128_256x32x64x128_16x16_16x16_8x32x1_8x32x1_1x32x1x8_8_2x1_intrawave_v1,143.36,277.95,0.0
80,352,2112,7168,ck,12,1,68.1193,a8w8_blockscale_bpreshuffle_1x128x128_256x32x64x256_16x16_16x16_16x16x1_16x16x1_1x32x1x8_8_2x1_intrawave_v1,156.46,281.11,0.0
80,384,2112,7168,ck,10,3,68.4076,a8w8_blockscale_bpreshuffle_1x128x128_256x32x64x128_16x16_16x16_8x32x1_8x32x1_1x32x1x8_8_2x1_intrawave_v1,169.96,285.25,0.0
80,416,2112,7168,ck,15,2,76.2152,a8w8_blockscale_bpreshuffle_1x128x128_256x64x64x128_16x16_16x16_8x32x1_8x32x1_1x32x1x8_8_2x1_intrawave_v1,165.26,260.81,0.0
80,448,2112,7168,ck,15,2,73.8936,a8w8_blockscale_bpreshuffle_1x128x128_256x64x64x128_16x16_16x16_8x32x1_8x32x1_1x32x1x8_8_2x1_intrawave_v1,183.57,273.94,0.0
80,480,2112,7168,ck,10,1,90.8423,a8w8_blockscale_bpreshuffle_1x128x128_256x32x64x128_16x16_16x16_8x32x1_8x32x1_1x32x1x8_8_2x1_intrawave_v1,159.98,226.84,0.0
80,512,2112,7168,ck,10,2,91.1228,a8w8_blockscale_bpreshuffle_1x128x128_256x32x64x128_16x16_16x16_8x32x1_8x32x1_1x32x1x8_8_2x1_intrawave_v1,170.12,230.15,0.0
80,544,2112,7168,ck,15,2,96.2046,a8w8_blockscale_bpreshuffle_1x128x128_256x64x64x128_16x16_16x16_8x32x1_8x32x1_1x32x1x8_8_2x1_intrawave_v1,171.21,221.78,0.0
80,576,2112,7168,ck,15,0,100.5351,a8w8_blockscale_bpreshuffle_1x128x128_256x64x64x128_16x16_16x16_8x32x1_8x32x1_1x32x1x8_8_2x1_intrawave_v1,173.47,215.85,0.0
80,608,2112,7168,ck,10,2,102.6055,a8w8_blockscale_bpreshuffle_1x128x128_256x32x64x128_16x16_16x16_8x32x1_8x32x1_1x32x1x8_8_2x1_intrawave_v1,179.41,215.05,0.0
80,640,2112,7168,ck,10,3,112.471,a8w8_blockscale_bpreshuffle_1x128x128_256x32x64x128_16x16_16x16_8x32x1_8x32x1_1x32x1x8_8_2x1_intrawave_v1,172.29,199.43,0.0
80,672,2112,7168,ck,10,2,114.4302,a8w8_blockscale_bpreshuffle_1x128x128_256x32x64x128_16x16_16x16_8x32x1_8x32x1_1x32x1x8_8_2x1_intrawave_v1,177.81,199.2,0.0
80,704,2112,7168,ck,15,0,119.672,a8w8_blockscale_bpreshuffle_1x128x128_256x64x64x128_16x16_16x16_8x32x1_8x32x1_1x32x1x8_8_2x1_intrawave_v1,178.12,193.52,0.0
80,736,2112,7168,ck,15,0,122.7596,a8w8_blockscale_bpreshuffle_1x128x128_256x64x64x128_16x16_16x16_8x32x1_8x32x1_1x32x1x8_8_2x1_intrawave_v1,181.53,191.62,0.0
80,768,2112,7168,ck,15,0,120.5289,a8w8_blockscale_bpreshuffle_1x128x128_256x64x64x128_16x16_16x16_8x32x1_8x32x1_1x32x1x8_8_2x1_intrawave_v1,192.93,198.19,0.0
80,800,2112,7168,ck,10,3,135.9819,a8w8_blockscale_bpreshuffle_1x128x128_256x32x64x128_16x16_16x16_8x32x1_8x32x1_1x32x1x8_8_2x1_intrawave_v1,178.13,178.35,0.0
80,832,2112,7168,ck,10,1,137.3697,a8w8_blockscale_bpreshuffle_1x128x128_256x32x64x128_16x16_16x16_8x32x1_8x32x1_1x32x1x8_8_2x1_intrawave_v1,183.38,179.2,0.0
80,864,2112,7168,ck,15,2,142.4245,a8w8_blockscale_bpreshuffle_1x128x128_256x64x64x128_16x16_16x16_8x32x1_8x32x1_1x32x1x8_8_2x1_intrawave_v1,183.68,175.4,0.0
80,896,2112,7168,ck,15,1,140.8795,a8w8_blockscale_bpreshuffle_1x128x128_256x64x64x128_16x16_16x16_8x32x1_8x32x1_1x32x1x8_8_2x1_intrawave_v1,192.57,179.91,0.0
80,928,2112,7168,ck,10,3,150.1273,a8w8_blockscale_bpreshuffle_1x128x128_256x32x64x128_16x16_16x16_8x32x1_8x32x1_1x32x1x8_8_2x1_intrawave_v1,187.16,171.26,0.0
80,960,2112,7168,ck,10,0,162.7642,a8w8_blockscale_bpreshuffle_1x128x128_256x32x64x128_16x16_16x16_8x32x1_8x32x1_1x32x1x8_8_2x1_intrawave_v1,178.58,160.2,0.0
80,992,2112,7168,ck,15,2,158.795,a8w8_blockscale_bpreshuffle_1x128x128_256x64x64x128_16x16_16x16_8x32x1_8x32x1_1x32x1x8_8_2x1_intrawave_v1,189.15,166.5,0.0
80,1024,2112,7168,ck,2,2,161.2571,a8w8_blockscale_bpreshuffle_1x128x128_256x64x64x128_16x16_16x16_8x32x1_8x32x1_1x32x1x8_8_2x1_intrawave_v3,192.27,166.22,0.0
80,1088,2112,7168,ck,2,0,178.63,a8w8_blockscale_bpreshuffle_1x128x128_256x64x64x128_16x16_16x16_8x32x1_8x32x1_1x32x1x8_8_2x1_intrawave_v3,184.42,154.14,0.0
80,1152,2112,7168,ck,10,3,180.7208,a8w8_blockscale_bpreshuffle_1x128x128_256x32x64x128_16x16_16x16_8x32x1_8x32x1_1x32x1x8_8_2x1_intrawave_v1,193.0,156.39,0.0
80,1216,2112,7168,ck,15,0,185.4486,a8w8_blockscale_bpreshuffle_1x128x128_256x64x64x128_16x16_16x16_8x32x1_8x32x1_1x32x1x8_8_2x1_intrawave_v1,198.53,156.33,0.0
80,1280,2112,7168,ck,10,2,199.3941,a8w8_blockscale_bpreshuffle_1x128x128_256x32x64x128_16x16_16x16_8x32x1_8x32x1_1x32x1x8_8_2x1_intrawave_v1,194.37,149.05,0.0
80,1344,2112,7168,ck,15,1,206.0237,a8w8_blockscale_bpreshuffle_1x128x128_256x64x64x128_16x16_16x16_8x32x1_8x32x1_1x32x1x8_8_2x1_intrawave_v1,197.52,147.8,0.0
80,1408,2112,7168,ck,10,2,226.8597,a8w8_blockscale_bpreshuffle_1x128x128_256x32x64x128_16x16_16x16_8x32x1_8x32x1_1x32x1x8_8_2x1_intrawave_v1,187.92,137.44,0.0
80,1472,2112,7168,ck,15,2,227.6633,a8w8_blockscale_bpreshuffle_1x128x128_256x64x64x128_16x16_16x16_8x32x1_8x32x1_1x32x1x8_8_2x1_intrawave_v1,195.77,140.15,0.0
80,1536,2112,7168,ck,15,3,227.4455,a8w8_blockscale_bpreshuffle_1x128x128_256x64x64x128_16x16_16x16_8x32x1_8x32x1_1x32x1x8_8_2x1_intrawave_v1,204.47,143.49,0.0
80,1600,2112,7168,ck,15,3,248.8618,a8w8_blockscale_bpreshuffle_1x128x128_256x64x64x128_16x16_16x16_8x32x1_8x32x1_1x32x1x8_8_2x1_intrawave_v1,194.66,134.07,0.0
80,1664,2112,7168,ck,15,2,250.2157,a8w8_blockscale_bpreshuffle_1x128x128_256x64x64x128_16x16_16x16_8x32x1_8x32x1_1x32x1x8_8_2x1_intrawave_v1,201.35,136.26,0.0
80,1728,2112,7168,ck,15,3,269.457,a8w8_blockscale_bpreshuffle_1x128x128_256x64x64x128_16x16_16x16_8x32x1_8x32x1_1x32x1x8_8_2x1_intrawave_v1,194.17,129.24,0.0
80,1792,2112,7168,ck,15,2,270.4745,a8w8_blockscale_bpreshuffle_1x128x128_256x64x64x128_16x16_16x16_8x32x1_8x32x1_1x32x1x8_8_2x1_intrawave_v1,200.6,131.45,0.0
80,1856,2112,7168,ck,15,3,272.9626,a8w8_blockscale_bpreshuffle_1x128x128_256x64x64x128_16x16_16x16_8x32x1_8x32x1_1x32x1x8_8_2x1_intrawave_v1,205.87,132.92,0.0
80,1920,2112,7168,ck,2,2,295.7117,a8w8_blockscale_bpreshuffle_1x128x128_256x64x64x128_16x16_16x16_8x32x1_8x32x1_1x32x1x8_8_2x1_intrawave_v3,196.59,125.16,0.0
80,1984,2112,7168,ck,15,2,296.5961,a8w8_blockscale_bpreshuffle_1x128x128_256x64x64x128_16x16_16x16_8x32x1_8x32x1_1x32x1x8_8_2x1_intrawave_v1,202.53,127.25,0.0
80,2048,2112,7168,ck,2,1,306.8584,a8w8_blockscale_bpreshuffle_1x128x128_256x64x64x128_16x16_16x16_8x32x1_8x32x1_1x32x1x8_8_2x1_intrawave_v3,202.08,125.37,0.0
80,4096,2112,7168,ck,2,3,583.1979,a8w8_blockscale_bpreshuffle_1x128x128_256x64x64x128_16x16_16x16_8x32x1_8x32x1_1x32x1x8_8_2x1_intrawave_v3,212.65,105.97,0.0
80,8192,2112,7168,ck,2,3,1145.1035,a8w8_blockscale_bpreshuffle_1x128x128_256x64x64x128_16x16_16x16_8x32x1_8x32x1_1x32x1x8_8_2x1_intrawave_v3,216.6,94.72,0.0
80,16384,2112,7168,ck,2,1,2264.6791,a8w8_blockscale_bpreshuffle_1x128x128_256x64x64x128_16x16_16x16_8x32x1_8x32x1_1x32x1x8_8_2x1_intrawave_v3,219.05,89.1,0.0
80,32768,2112,7168,ck,2,2,4502.063,a8w8_blockscale_bpreshuffle_1x128x128_256x64x64x128_16x16_16x16_8x32x1_8x32x1_1x32x1x8_8_2x1_intrawave_v3,220.37,86.28,0.0
80,16,2240,7168,ck,7,3,18.4058,a8w8_blockscale_bpreshuffle_1x128x128_256x16x64x256_16x16_16x16_16x16x1_16x16x1_1x16x1x16_4_1x1_intrawave_v1,27.92,882.48,0.0
80,32,2240,7168,ck,7,1,18.4351,a8w8_blockscale_bpreshuffle_1x128x128_256x16x64x256_16x16_16x16_16x16x1_16x16x1_1x16x1x16_4_1x1_intrawave_v1,55.74,891.18,0.0
80,48,2240,7168,ck,7,0,22.8737,a8w8_blockscale_bpreshuffle_1x128x128_256x16x64x256_16x16_16x16_16x16x1_16x16x1_1x16x1x16_4_1x1_intrawave_v1,67.39,726.4,0.0
80,64,2240,7168,ck,12,1,22.0832,a8w8_blockscale_bpreshuffle_1x128x128_256x32x64x256_16x16_16x16_16x16x1_16x16x1_1x32x1x8_8_2x1_intrawave_v1,93.07,760.84,0.0
80,80,2240,7168,ck,7,3,31.1418,a8w8_blockscale_bpreshuffle_1x128x128_256x16x64x256_16x16_16x16_16x16x1_16x16x1_1x16x1x16_4_1x1_intrawave_v1,82.49,545.51,0.0
80,96,2240,7168,ck,12,2,31.0865,a8w8_blockscale_bpreshuffle_1x128x128_256x32x64x256_16x16_16x16_16x16x1_16x16x1_1x32x1x8_8_2x1_intrawave_v1,99.17,552.48,0.0
80,112,2240,7168,ck,12,2,32.0533,a8w8_blockscale_bpreshuffle_1x128x128_256x32x64x256_16x16_16x16_16x16x1_16x16x1_1x32x1x8_8_2x1_intrawave_v1,112.21,541.63,0.0
80,128,2240,7168,ck,12,0,31.2775,a8w8_blockscale_bpreshuffle_1x128x128_256x32x64x256_16x16_16x16_16x16x1_16x16x1_1x32x1x8_8_2x1_intrawave_v1,131.42,561.02,0.0
80,144,2240,7168,ck,10,2,38.4394,a8w8_blockscale_bpreshuffle_1x128x128_256x32x64x128_16x16_16x16_8x32x1_8x32x1_1x32x1x8_8_2x1_intrawave_v1,120.3,461.34,0.0
80,160,2240,7168,ck,10,1,37.9676,a8w8_blockscale_bpreshuffle_1x128x128_256x32x64x128_16x16_16x16_8x32x1_8x32x1_1x32x1x8_8_2x1_intrawave_v1,135.33,471.98,0.0
80,176,2240,7168,ck,10,1,41.5396,a8w8_blockscale_bpreshuffle_1x128x128_256x32x64x128_16x16_16x16_8x32x1_8x32x1_1x32x1x8_8_2x1_intrawave_v1,136.06,435.88,0.0
80,192,2240,7168,ck,10,2,41.6669,a8w8_blockscale_bpreshuffle_1x128x128_256x32x64x128_16x16_16x16_8x32x1_8x32x1_1x32x1x8_8_2x1_intrawave_v1,147.97,439.02,0.0
80,208,2240,7168,ck,10,2,52.8784,a8w8_blockscale_bpreshuffle_1x128x128_256x32x64x128_16x16_16x16_8x32x1_8x32x1_1x32x1x8_8_2x1_intrawave_v1,126.32,349.46,0.0
80,224,2240,7168,ck,10,3,53.7534,a8w8_blockscale_bpreshuffle_1x128x128_256x32x64x128_16x16_16x16_8x32x1_8x32x1_1x32x1x8_8_2x1_intrawave_v1,133.82,347.24,0.0
80,240,2240,7168,ck,17,0,54.5984,a8w8_blockscale_bpreshuffle_1x128x128_256x64x64x256_16x16_16x16_16x16x1_16x16x1_1x32x1x8_8_2x1_intrawave_v1,141.16,345.28,0.0
80,256,2240,7168,ck,15,0,53.9384,a8w8_blockscale_bpreshuffle_1x128x128_256x64x64x128_16x16_16x16_8x32x1_8x32x1_1x32x1x8_8_2x1_intrawave_v1,152.41,352.96,0.0
80,288,2240,7168,ck,10,3,57.1698,a8w8_blockscale_bpreshuffle_1x128x128_256x32x64x128_16x16_16x16_8x32x1_8x32x1_1x32x1x8_8_2x1_intrawave_v1,161.77,339.53,0.0
80,320,2240,7168,ck,12,2,67.9809,a8w8_blockscale_bpreshuffle_1x128x128_256x32x64x256_16x16_16x16_16x16x1_16x16x1_1x32x1x8_8_2x1_intrawave_v1,151.16,291.02,0.0
80,352,2240,7168,ck,12,3,68.7044,a8w8_blockscale_bpreshuffle_1x128x128_256x32x64x256_16x16_16x16_16x16x1_16x16x1_1x32x1x8_8_2x1_intrawave_v1,164.53,293.38,0.0
80,384,2240,7168,ck,15,0,73.1543,a8w8_blockscale_bpreshuffle_1x128x128_256x64x64x128_16x16_16x16_8x32x1_8x32x1_1x32x1x8_8_2x1_intrawave_v1,168.56,280.63,0.0
80,416,2240,7168,ck,12,3,80.3017,a8w8_blockscale_bpreshuffle_1x128x128_256x32x64x256_16x16_16x16_16x16x1_16x16x1_1x32x1x8_8_2x1_intrawave_v1,166.36,260.29,0.0
80,448,2240,7168,ck,10,1,90.5933,a8w8_blockscale_bpreshuffle_1x128x128_256x32x64x128_16x16_16x16_8x32x1_8x32x1_1x32x1x8_8_2x1_intrawave_v1,158.8,234.84,0.0
80,480,2240,7168,ck,10,1,92.9873,a8w8_blockscale_bpreshuffle_1x128x128_256x32x64x128_16x16_16x16_8x32x1_8x32x1_1x32x1x8_8_2x1_intrawave_v1,165.77,232.8,0.0
80,512,2240,7168,ck,10,2,93.0176,a8w8_blockscale_bpreshuffle_1x128x128_256x32x64x128_16x16_16x16_8x32x1_8x32x1_1x32x1x8_8_2x1_intrawave_v1,176.76,236.73,0.0
80,544,2240,7168,ck,15,2,97.637,a8w8_blockscale_bpreshuffle_1x128x128_256x64x64x128_16x16_16x16_8x32x1_8x32x1_1x32x1x8_8_2x1_intrawave_v1,178.92,229.35,0.0
80,576,2240,7168,ck,15,3,101.0378,a8w8_blockscale_bpreshuffle_1x128x128_256x64x64x128_16x16_16x16_8x32x1_8x32x1_1x32x1x8_8_2x1_intrawave_v1,183.07,225.32,0.0
80,608,2240,7168,ck,10,3,113.0023,a8w8_blockscale_bpreshuffle_1x128x128_256x32x64x128_16x16_16x16_8x32x1_8x32x1_1x32x1x8_8_2x1_intrawave_v1,172.78,204.76,0.0
80,640,2240,7168,ck,10,1,113.0931,a8w8_blockscale_bpreshuffle_1x128x128_256x32x64x128_16x16_16x16_8x32x1_8x32x1_1x32x1x8_8_2x1_intrawave_v1,181.73,207.89,0.0
80,672,2240,7168,ck,15,2,123.069,a8w8_blockscale_bpreshuffle_1x128x128_256x64x64x128_16x16_16x16_8x32x1_8x32x1_1x32x1x8_8_2x1_intrawave_v1,175.35,194.07,0.0
80,704,2240,7168,ck,15,0,120.9296,a8w8_blockscale_bpreshuffle_1x128x128_256x64x64x128_16x16_16x16_8x32x1_8x32x1_1x32x1x8_8_2x1_intrawave_v1,186.95,200.58,0.0
80,736,2240,7168,ck,10,1,134.982,a8w8_blockscale_bpreshuffle_1x128x128_256x32x64x128_16x16_16x16_8x32x1_8x32x1_1x32x1x8_8_2x1_intrawave_v1,175.1,182.46,0.0
80,768,2240,7168,ck,10,0,134.3272,a8w8_blockscale_bpreshuffle_1x128x128_256x32x64x128_16x16_16x16_8x32x1_8x32x1_1x32x1x8_8_2x1_intrawave_v1,183.6,186.13,0.0
80,800,2240,7168,ck,10,3,138.247,a8w8_blockscale_bpreshuffle_1x128x128_256x32x64x128_16x16_16x16_8x32x1_8x32x1_1x32x1x8_8_2x1_intrawave_v1,185.83,183.55,0.0
80,832,2240,7168,ck,15,2,141.5727,a8w8_blockscale_bpreshuffle_1x128x128_256x64x64x128_16x16_16x16_8x32x1_8x32x1_1x32x1x8_8_2x1_intrawave_v1,188.72,181.87,0.0
80,864,2240,7168,ck,10,0,147.7769,a8w8_blockscale_bpreshuffle_1x128x128_256x32x64x128_16x16_16x16_8x32x1_8x32x1_1x32x1x8_8_2x1_intrawave_v1,187.75,176.75,0.0
80,896,2240,7168,ck,10,3,158.3106,a8w8_blockscale_bpreshuffle_1x128x128_256x32x64x128_16x16_16x16_8x32x1_8x32x1_1x32x1x8_8_2x1_intrawave_v1,181.75,167.35,0.0
80,928,2240,7168,ck,10,3,160.9495,a8w8_blockscale_bpreshuffle_1x128x128_256x32x64x128_16x16_16x16_8x32x1_8x32x1_1x32x1x8_8_2x1_intrawave_v1,185.15,166.92,0.0
80,960,2240,7168,ck,15,0,165.5893,a8w8_blockscale_bpreshuffle_1x128x128_256x64x64x128_16x16_16x16_8x32x1_8x32x1_1x32x1x8_8_2x1_intrawave_v1,186.17,164.49,0.0
80,992,2240,7168,ck,15,2,160.266,a8w8_blockscale_bpreshuffle_1x128x128_256x64x64x128_16x16_16x16_8x32x1_8x32x1_1x32x1x8_8_2x1_intrawave_v1,198.77,172.28,0.0
80,1024,2240,7168,ck,15,2,163.7511,a8w8_blockscale_bpreshuffle_1x128x128_256x64x64x128_16x16_16x16_8x32x1_8x32x1_1x32x1x8_8_2x1_intrawave_v1,200.81,170.89,0.0
80,1088,2240,7168,ck,15,1,185.8187,a8w8_blockscale_bpreshuffle_1x128x128_256x64x64x128_16x16_16x16_8x32x1_8x32x1_1x32x1x8_8_2x1_intrawave_v1,188.02,154.61,0.0
80,1152,2240,7168,ck,15,0,184.4807,a8w8_blockscale_bpreshuffle_1x128x128_256x64x64x128_16x16_16x16_8x32x1_8x32x1_1x32x1x8_8_2x1_intrawave_v1,200.53,159.77,0.0
80,1216,2240,7168,ck,10,2,203.0375,a8w8_blockscale_bpreshuffle_1x128x128_256x32x64x128_16x16_16x16_8x32x1_8x32x1_1x32x1x8_8_2x1_intrawave_v1,192.32,148.84,0.0
80,1280,2240,7168,ck,15,2,206.6986,a8w8_blockscale_bpreshuffle_1x128x128_256x64x64x128_16x16_16x16_8x32x1_8x32x1_1x32x1x8_8_2x1_intrawave_v1,198.86,149.81,0.0
80,1344,2240,7168,ck,10,2,225.844,a8w8_blockscale_bpreshuffle_1x128x128_256x32x64x128_16x16_16x16_8x32x1_8x32x1_1x32x1x8_8_2x1_intrawave_v1,191.1,140.41,0.0
80,1408,2240,7168,ck,15,2,228.1718,a8w8_blockscale_bpreshuffle_1x128x128_256x64x64x128_16x16_16x16_8x32x1_8x32x1_1x32x1x8_8_2x1_intrawave_v1,198.16,142.25,0.0
80,1472,2240,7168,ck,15,0,247.637,a8w8_blockscale_bpreshuffle_1x128x128_256x64x64x128_16x16_16x16_8x32x1_8x32x1_1x32x1x8_8_2x1_intrawave_v1,190.88,134.08,0.0
80,1536,2240,7168,ck,15,3,245.5553,a8w8_blockscale_bpreshuffle_1x128x128_256x64x64x128_16x16_16x16_8x32x1_8x32x1_1x32x1x8_8_2x1_intrawave_v1,200.87,138.25,0.0
80,1600,2240,7168,ck,15,1,250.2818,a8w8_blockscale_bpreshuffle_1x128x128_256x64x64x128_16x16_16x16_8x32x1_8x32x1_1x32x1x8_8_2x1_intrawave_v1,205.29,138.62,0.0
80,1664,2240,7168,ck,15,2,271.2408,a8w8_blockscale_bpreshuffle_1x128x128_256x64x64x128_16x16_16x16_8x32x1_8x32x1_1x32x1x8_8_2x1_intrawave_v1,197.0,130.65,0.0
80,1728,2240,7168,ck,15,3,271.8589,a8w8_blockscale_bpreshuffle_1x128x128_256x64x64x128_16x16_16x16_8x32x1_8x32x1_1x32x1x8_8_2x1_intrawave_v1,204.12,133.1,0.0
80,1792,2240,7168,ck,10,2,289.0369,a8w8_blockscale_bpreshuffle_1x128x128_256x32x64x128_16x16_16x16_8x32x1_8x32x1_1x32x1x8_8_2x1_intrawave_v1,199.1,127.77,0.0
80,1856,2240,7168,ck,15,0,293.488,a8w8_blockscale_bpreshuffle_1x128x128_256x64x64x128_16x16_16x16_8x32x1_8x32x1_1x32x1x8_8_2x1_intrawave_v1,203.08,128.37,0.0
80,1920,2240,7168,ck,10,0,316.0607,a8w8_blockscale_bpreshuffle_1x128x128_256x32x64x128_16x16_16x16_8x32x1_8x32x1_1x32x1x8_8_2x1_intrawave_v1,195.08,121.56,0.0
80,1984,2240,7168,ck,15,3,317.0029,a8w8_blockscale_bpreshuffle_1x128x128_256x64x64x128_16x16_16x16_8x32x1_8x32x1_1x32x1x8_8_2x1_intrawave_v1,200.98,123.55,0.0
80,2048,2240,7168,ck,2,2,311.4693,a8w8_blockscale_bpreshuffle_1x128x128_256x64x64x128_16x16_16x16_8x32x1_8x32x1_1x32x1x8_8_2x1_intrawave_v3,211.15,128.14,0.0
80,4096,2240,7168,ck,2,3,605.4374,a8w8_blockscale_bpreshuffle_1x128x128_256x64x64x128_16x16_16x16_8x32x1_8x32x1_1x32x1x8_8_2x1_intrawave_v3,217.25,105.32,0.0
80,8192,2240,7168,ck,2,1,1194.0163,a8w8_blockscale_bpreshuffle_1x128x128_256x64x64x128_16x16_16x16_8x32x1_8x32x1_1x32x1x8_8_2x1_intrawave_v3,220.32,93.36,0.0
80,16384,2240,7168,ck,2,2,2369.0955,a8w8_blockscale_bpreshuffle_1x128x128_256x64x64x128_16x16_16x16_8x32x1_8x32x1_1x32x1x8_8_2x1_intrawave_v3,222.08,87.33,0.0
80,32768,2240,7168,ck,2,2,4721.3426,a8w8_blockscale_bpreshuffle_1x128x128_256x64x64x128_16x16_16x16_8x32x1_8x32x1_1x32x1x8_8_2x1_intrawave_v3,222.87,84.24,0.0
80,16,3072,1536,ck,7,0,6.9946,a8w8_blockscale_bpreshuffle_1x128x128_256x16x64x256_16x16_16x16_16x16x1_16x16x1_1x16x1x16_4_1x1_intrawave_v1,21.59,692.17,0.0
80,32,3072,1536,ck,12,0,8.2174,a8w8_blockscale_bpreshuffle_1x128x128_256x32x64x256_16x16_16x16_16x16x1_16x16x1_1x32x1x8_8_2x1_intrawave_v1,36.75,604.13,0.0
80,48,3072,1536,ck,7,3,8.4298,a8w8_blockscale_bpreshuffle_1x128x128_256x16x64x256_16x16_16x16_16x16x1_16x16x1_1x16x1x16_4_1x1_intrawave_v1,53.74,603.48,0.0
80,64,3072,1536,ck,7,1,10.2366,a8w8_blockscale_bpreshuffle_1x128x128_256x16x64x256_16x16_16x16_16x16x1_16x16x1_1x16x1x16_4_1x1_intrawave_v1,59.0,508.97,0.0
80,80,3072,1536,ck,7,2,10.3553,a8w8_blockscale_bpreshuffle_1x128x128_256x16x64x256_16x16_16x16_16x16x1_16x16x1_1x16x1x16_4_1x1_intrawave_v1,72.91,515.0,0.0
80,96,3072,1536,ck,12,1,10.7666,a8w8_blockscale_bpreshuffle_1x128x128_256x32x64x256_16x16_16x16_16x16x1_16x16x1_1x32x1x8_8_2x1_intrawave_v1,84.15,506.74,0.0
80,112,3072,1536,asm,26,1,13.416,_ZN5aiter42fp8gemm_bf16_blockscale_BpreShuffle_48x128E,78.78,415.83,0.0
80,128,3072,1536,ck,10,1,13.4382,a8w8_blockscale_bpreshuffle_1x128x128_256x32x64x128_16x16_16x16_8x32x1_8x32x1_1x32x1x8_8_2x1_intrawave_v1,89.89,424.29,0.0
80,144,3072,1536,asm,26,1,13.7175,_ZN5aiter42fp8gemm_bf16_blockscale_BpreShuffle_48x128E,99.07,424.6,0.0
80,160,3072,1536,ck,10,1,13.763,a8w8_blockscale_bpreshuffle_1x128x128_256x32x64x128_16x16_16x16_8x32x1_8x32x1_1x32x1x8_8_2x1_intrawave_v1,109.71,432.13,0.0
80,176,3072,1536,ck,9,2,14.1603,a8w8_blockscale_bpreshuffle_1x128x128_256x32x128x128_16x16_16x16_8x32x1_8x32x1_1x32x1x8_8_2x1_intrawave_v1,117.3,428.68,0.0
80,192,3072,1536,ck,9,2,15.2709,a8w8_blockscale_bpreshuffle_1x128x128_256x32x128x128_16x16_16x16_8x32x1_8x32x1_1x32x1x8_8_2x1_intrawave_v1,118.65,405.55,0.0
80,208,3072,1536,ck,6,2,18.2522,a8w8_blockscale_bpreshuffle_1x128x128_256x16x128x256_16x16_16x16_16x16x1_16x16x1_1x16x1x16_8_1x2_intrawave_v1,107.55,346.04,0.0
80,224,3072,1536,ck,10,2,19.3084,a8w8_blockscale_bpreshuffle_1x128x128_256x32x64x128_16x16_16x16_8x32x1_8x32x1_1x32x1x8_8_2x1_intrawave_v1,109.48,333.48,0.0
80,240,3072,1536,ck,9,1,19.727,a8w8_blockscale_bpreshuffle_1x128x128_256x32x128x128_16x16_16x16_8x32x1_8x32x1_1x32x1x8_8_2x1_intrawave_v1,114.81,332.63,0.0
80,256,3072,1536,ck,10,3,19.6431,a8w8_blockscale_bpreshuffle_1x128x128_256x32x64x128_16x16_16x16_8x32x1_8x32x1_1x32x1x8_8_2x1_intrawave_v1,122.99,340.31,0.0
80,288,3072,1536,ck,9,0,20.1377,a8w8_blockscale_bpreshuffle_1x128x128_256x32x128x128_16x16_16x16_8x32x1_8x32x1_1x32x1x8_8_2x1_intrawave_v1,134.97,344.15,0.0
80,320,3072,1536,ck,9,1,20.2442,a8w8_blockscale_bpreshuffle_1x128x128_256x32x128x128_16x16_16x16_8x32x1_8x32x1_1x32x1x8_8_2x1_intrawave_v1,149.17,354.48,0.0
80,352,3072,1536,ck,8,1,24.0014,a8w8_blockscale_bpreshuffle_1x128x128_256x32x256x128_16x16_16x16_8x32x1_8x32x1_1x32x1x8_8_2x1_intrawave_v1,138.4,309.23,0.0
80,384,3072,1536,ck,8,2,24.3133,a8w8_blockscale_bpreshuffle_1x128x128_256x32x256x128_16x16_16x16_8x32x1_8x32x1_1x32x1x8_8_2x1_intrawave_v1,149.05,315.37,0.0
80,416,3072,1536,ck,8,2,24.8153,a8w8_blockscale_bpreshuffle_1x128x128_256x32x256x128_16x16_16x16_8x32x1_8x32x1_1x32x1x8_8_2x1_intrawave_v1,158.2,318.89,0.0
80,448,3072,1536,ck,10,1,29.6121,a8w8_blockscale_bpreshuffle_1x128x128_256x32x64x128_16x16_16x16_8x32x1_8x32x1_1x32x1x8_8_2x1_intrawave_v1,142.77,275.54,0.0
80,480,3072,1536,ck,9,1,29.8129,a8w8_blockscale_bpreshuffle_1x128x128_256x32x128x128_16x16_16x16_8x32x1_8x32x1_1x32x1x8_8_2x1_intrawave_v1,151.94,281.92,0.0
80,512,3072,1536,ck,9,0,29.7573,a8w8_blockscale_bpreshuffle_1x128x128_256x32x128x128_16x16_16x16_8x32x1_8x32x1_1x32x1x8_8_2x1_intrawave_v1,162.37,290.71,0.0
80,544,3072,1536,ck,14,3,33.1613,a8w8_blockscale_bpreshuffle_1x128x128_256x64x128x128_16x16_16x16_8x32x1_8x32x1_1x32x1x8_8_2x1_intrawave_v1,154.81,268.28,0.0
80,576,3072,1536,ck,14,2,32.8737,a8w8_blockscale_bpreshuffle_1x128x128_256x64x128x128_16x16_16x16_8x32x1_8x32x1_1x32x1x8_8_2x1_intrawave_v1,165.35,278.1,0.0
80,608,3072,1536,ck,14,0,33.491,a8w8_blockscale_bpreshuffle_1x128x128_256x64x128x128_16x16_16x16_8x32x1_8x32x1_1x32x1x8_8_2x1_intrawave_v1,171.32,280.32,0.0
80,640,3072,1536,ck,14,2,33.2038,a8w8_blockscale_bpreshuffle_1x128x128_256x64x128x128_16x16_16x16_8x32x1_8x32x1_1x32x1x8_8_2x1_intrawave_v1,181.9,290.14,0.0
80,672,3072,1536,ck,9,2,38.2921,a8w8_blockscale_bpreshuffle_1x128x128_256x32x128x128_16x16_16x16_8x32x1_8x32x1_1x32x1x8_8_2x1_intrawave_v1,165.62,258.0,0.0
80,704,3072,1536,ck,9,3,38.4661,a8w8_blockscale_bpreshuffle_1x128x128_256x32x128x128_16x16_16x16_8x32x1_8x32x1_1x32x1x8_8_2x1_intrawave_v1,172.72,263.23,0.0
80,736,3072,1536,ck,9,0,38.9581,a8w8_blockscale_bpreshuffle_1x128x128_256x32x128x128_16x16_16x16_8x32x1_8x32x1_1x32x1x8_8_2x1_intrawave_v1,178.29,266.21,0.0
80,768,3072,1536,ck,13,1,41.9005,a8w8_blockscale_bpreshuffle_1x128x128_256x64x256x128_16x16_16x16_8x32x1_8x32x1_1x32x1x8_8_2x1_intrawave_v1,172.98,253.38,0.0
80,800,3072,1536,ck,9,0,43.0058,a8w8_blockscale_bpreshuffle_1x128x128_256x32x128x128_16x16_16x16_8x32x1_8x32x1_1x32x1x8_8_2x1_intrawave_v1,175.55,252.58,0.0
80,832,3072,1536,ck,13,2,42.3765,a8w8_blockscale_bpreshuffle_1x128x128_256x64x256x128_16x16_16x16_8x32x1_8x32x1_1x32x1x8_8_2x1_intrawave_v1,185.29,262.13,0.0
80,864,3072,1536,ck,9,2,47.3281,a8w8_blockscale_bpreshuffle_1x128x128_256x32x128x128_16x16_16x16_8x32x1_8x32x1_1x32x1x8_8_2x1_intrawave_v1,172.28,239.9,0.0
80,896,3072,1536,ck,9,0,47.6647,a8w8_blockscale_bpreshuffle_1x128x128_256x32x128x128_16x16_16x16_8x32x1_8x32x1_1x32x1x8_8_2x1_intrawave_v1,177.4,243.36,0.0
80,928,3072,1536,ck,9,3,47.9505,a8w8_blockscale_bpreshuffle_1x128x128_256x32x128x128_16x16_16x16_8x32x1_8x32x1_1x32x1x8_8_2x1_intrawave_v1,182.64,247.04,0.0
80,960,3072,1536,ck,9,3,48.6958,a8w8_blockscale_bpreshuffle_1x128x128_256x32x128x128_16x16_16x16_8x32x1_8x32x1_1x32x1x8_8_2x1_intrawave_v1,186.05,248.3,0.0
80,992,3072,1536,ck,14,1,51.0597,a8w8_blockscale_bpreshuffle_1x128x128_256x64x128x128_16x16_16x16_8x32x1_8x32x1_1x32x1x8_8_2x1_intrawave_v1,183.35,241.62,0.0
80,1024,3072,1536,ck,14,2,50.6685,a8w8_blockscale_bpreshuffle_1x128x128_256x64x128x128_16x16_16x16_8x32x1_8x32x1_1x32x1x8_8_2x1_intrawave_v1,190.72,248.34,0.0
80,1088,3072,1536,ck,9,1,56.1888,a8w8_blockscale_bpreshuffle_1x128x128_256x32x128x128_16x16_16x16_8x32x1_8x32x1_1x32x1x8_8_2x1_intrawave_v1,182.73,232.69,0.0
80,1152,3072,1536,ck,9,2,56.7626,a8w8_blockscale_bpreshuffle_1x128x128_256x32x128x128_16x16_16x16_8x32x1_8x32x1_1x32x1x8_8_2x1_intrawave_v1,191.53,238.99,0.0
80,1216,3072,1536,ck,14,0,58.7832,a8w8_blockscale_bpreshuffle_1x128x128_256x64x128x128_16x16_16x16_8x32x1_8x32x1_1x32x1x8_8_2x1_intrawave_v1,195.22,239.14,0.0
80,1280,3072,1536,ck,14,0,59.5633,a8w8_blockscale_bpreshuffle_1x128x128_256x64x128x128_16x16_16x16_8x32x1_8x32x1_1x32x1x8_8_2x1_intrawave_v1,202.8,244.26,0.0
80,1344,3072,1536,ck,9,0,65.2655,a8w8_blockscale_bpreshuffle_1x128x128_256x32x128x128_16x16_16x16_8x32x1_8x32x1_1x32x1x8_8_2x1_intrawave_v1,194.34,230.45,0.0
80,1408,3072,1536,ck,14,1,67.6978,a8w8_blockscale_bpreshuffle_1x128x128_256x64x128x128_16x16_16x16_8x32x1_8x32x1_1x32x1x8_8_2x1_intrawave_v1,196.28,229.43,0.0
80,1472,3072,1536,ck,14,3,68.4388,a8w8_blockscale_bpreshuffle_1x128x128_256x64x128x128_16x16_16x16_8x32x1_8x32x1_1x32x1x8_8_2x1_intrawave_v1,202.98,234.13,0.0
80,1536,3072,1536,ck,9,3,73.9423,a8w8_blockscale_bpreshuffle_1x128x128_256x32x128x128_16x16_16x16_8x32x1_8x32x1_1x32x1x8_8_2x1_intrawave_v1,196.04,223.35,0.0
80,1600,3072,1536,ck,9,2,74.615,a8w8_blockscale_bpreshuffle_1x128x128_256x32x128x128_16x16_16x16_8x32x1_8x32x1_1x32x1x8_8_2x1_intrawave_v1,202.37,227.92,0.0
80,1664,3072,1536,ck,14,2,76.8792,a8w8_blockscale_bpreshuffle_1x128x128_256x64x128x128_16x16_16x16_8x32x1_8x32x1_1x32x1x8_8_2x1_intrawave_v1,204.26,227.61,0.0
80,1728,3072,1536,ck,9,1,82.4824,a8w8_blockscale_bpreshuffle_1x128x128_256x32x128x128_16x16_16x16_8x32x1_8x32x1_1x32x1x8_8_2x1_intrawave_v1,197.71,218.1,0.0
80,1792,3072,1536,ck,9,2,83.1592,a8w8_blockscale_bpreshuffle_1x128x128_256x32x128x128_16x16_16x16_8x32x1_8x32x1_1x32x1x8_8_2x1_intrawave_v1,203.36,222.24,0.0
80,1856,3072,1536,ck,14,2,85.1644,a8w8_blockscale_bpreshuffle_1x128x128_256x64x128x128_16x16_16x16_8x32x1_8x32x1_1x32x1x8_8_2x1_intrawave_v1,205.67,222.78,0.0
80,1920,3072,1536,ck,14,2,85.6053,a8w8_blockscale_bpreshuffle_1x128x128_256x64x128x128_16x16_16x16_8x32x1_8x32x1_1x32x1x8_8_2x1_intrawave_v1,211.66,227.37,0.0
80,1984,3072,1536,ck,9,2,92.2363,a8w8_blockscale_bpreshuffle_1x128x128_256x32x128x128_16x16_16x16_8x32x1_8x32x1_1x32x1x8_8_2x1_intrawave_v1,202.99,216.35,0.0
80,2048,3072,1536,ck,14,0,93.5703,a8w8_blockscale_bpreshuffle_1x128x128_256x64x128x128_16x16_16x16_8x32x1_8x32x1_1x32x1x8_8_2x1_intrawave_v1,206.55,218.52,0.0
80,4096,3072,1536,ck,14,2,178.2567,a8w8_blockscale_bpreshuffle_1x128x128_256x64x128x128_16x16_16x16_8x32x1_8x32x1_1x32x1x8_8_2x1_intrawave_v1,216.85,202.94,0.0
80,8192,3072,1536,ck,14,0,341.8696,a8w8_blockscale_bpreshuffle_1x128x128_256x64x128x128_16x16_16x16_8x32x1_8x32x1_1x32x1x8_8_2x1_intrawave_v1,226.14,197.83,0.0
80,16384,3072,1536,ck,14,3,668.2869,a8w8_blockscale_bpreshuffle_1x128x128_256x64x128x128_16x16_16x16_8x32x1_8x32x1_1x32x1x8_8_2x1_intrawave_v1,231.37,195.35,0.0
80,32768,3072,1536,ck,13,1,1320.6598,a8w8_blockscale_bpreshuffle_1x128x128_256x64x256x128_16x16_16x16_8x32x1_8x32x1_1x32x1x8_8_2x1_intrawave_v1,234.15,194.13,0.0
80,16,4096,512,ck,7,3,3.587,a8w8_blockscale_bpreshuffle_1x128x128_256x16x64x256_16x16_16x16_16x16x1_16x16x1_1x16x1x16_4_1x1_intrawave_v1,18.71,623.48,0.0
80,32,4096,512,ck,7,3,4.8343,a8w8_blockscale_bpreshuffle_1x128x128_256x16x64x256_16x16_16x16_16x16x1_16x16x1_1x16x1x16_4_1x1_intrawave_v1,27.76,491.42,0.0
80,48,4096,512,ck,7,0,5.5152,a8w8_blockscale_bpreshuffle_1x128x128_256x16x64x256_16x16_16x16_16x16x1_16x16x1_1x16x1x16_4_1x1_intrawave_v1,36.5,456.0,0.0
80,64,4096,512,ck,7,2,6.2619,a8w8_blockscale_bpreshuffle_1x128x128_256x16x64x256_16x16_16x16_16x16x1_16x16x1_1x16x1x16_4_1x1_intrawave_v1,42.87,423.87,0.0
80,80,4096,512,ck,7,2,6.4411,a8w8_blockscale_bpreshuffle_1x128x128_256x16x64x256_16x16_16x16_16x16x1_16x16x1_1x16x1x16_4_1x1_intrawave_v1,52.09,433.69,0.0
80,96,4096,512,ck,7,1,7.2774,a8w8_blockscale_bpreshuffle_1x128x128_256x16x64x256_16x16_16x16_16x16x1_16x16x1_1x16x1x16_4_1x1_intrawave_v1,55.33,402.99,0.0
80,112,4096,512,ck,7,1,7.965,a8w8_blockscale_bpreshuffle_1x128x128_256x16x64x256_16x16_16x16_16x16x1_16x16x1_1x16x1x16_4_1x1_intrawave_v1,58.98,385.69,0.0
80,128,4096,512,ck,11,3,8.6168,a8w8_blockscale_bpreshuffle_1x128x128_256x32x128x256_16x16_16x16_16x16x1_16x16x1_1x32x1x8_8_2x1_intrawave_v1,62.31,372.67,0.0
80,144,4096,512,ck,11,0,8.7944,a8w8_blockscale_bpreshuffle_1x128x128_256x32x128x256_16x16_16x16_16x16x1_16x16x1_1x32x1x8_8_2x1_intrawave_v1,68.68,380.98,0.0
80,160,4096,512,ck,11,0,8.8154,a8w8_blockscale_bpreshuffle_1x128x128_256x32x128x256_16x16_16x16_16x16x1_16x16x1_1x32x1x8_8_2x1_intrawave_v1,76.13,395.87,0.0
80,176,4096,512,ck,7,2,10.5148,a8w8_blockscale_bpreshuffle_1x128x128_256x16x64x256_16x16_16x16_16x16x1_16x16x1_1x16x1x16_4_1x1_intrawave_v1,70.21,345.14,0.0
80,192,4096,512,ck,10,1,10.5719,a8w8_blockscale_bpreshuffle_1x128x128_256x32x64x128_16x16_16x16_8x32x1_8x32x1_1x32x1x8_8_2x1_intrawave_v1,76.17,356.45,0.0
80,208,4096,512,ck,11,2,11.2642,a8w8_blockscale_bpreshuffle_1x128x128_256x32x128x256_16x16_16x16_16x16x1_16x16x1_1x32x1x8_8_2x1_intrawave_v1,77.45,346.9,0.0
80,224,4096,512,ck,11,1,11.2325,a8w8_blockscale_bpreshuffle_1x128x128_256x32x128x256_16x16_16x16_16x16x1_16x16x1_1x32x1x8_8_2x1_intrawave_v1,83.64,360.28,0.0
80,240,4096,512,ck,6,1,12.0561,a8w8_blockscale_bpreshuffle_1x128x128_256x16x128x256_16x16_16x16_16x16x1_16x16x1_1x16x1x16_8_1x2_intrawave_v1,83.5,347.22,0.0
80,256,4096,512,ck,10,2,12.8842,a8w8_blockscale_bpreshuffle_1x128x128_256x32x64x128_16x16_16x16_8x32x1_8x32x1_1x32x1x8_8_2x1_intrawave_v1,83.34,335.71,0.0
80,288,4096,512,ck,11,2,13.181,a8w8_blockscale_bpreshuffle_1x128x128_256x32x128x256_16x16_16x16_16x16x1_16x16x1_1x32x1x8_8_2x1_intrawave_v1,91.64,349.28,0.0
80,320,4096,512,ck,11,2,13.3821,a8w8_blockscale_bpreshuffle_1x128x128_256x32x128x256_16x16_16x16_16x16x1_16x16x1_1x32x1x8_8_2x1_intrawave_v1,100.3,364.85,0.0
80,352,4096,512,ck,10,1,15.2782,a8w8_blockscale_bpreshuffle_1x128x128_256x32x64x128_16x16_16x16_8x32x1_8x32x1_1x32x1x8_8_2x1_intrawave_v1,96.63,337.8,0.0
80,384,4096,512,ck,11,0,15.552,a8w8_blockscale_bpreshuffle_1x128x128_256x32x128x256_16x16_16x16_16x16x1_16x16x1_1x32x1x8_8_2x1_intrawave_v1,103.56,349.76,0.0
80,416,4096,512,ck,11,3,17.1946,a8w8_blockscale_bpreshuffle_1x128x128_256x32x128x256_16x16_16x16_16x16x1_16x16x1_1x32x1x8_8_2x1_intrawave_v1,101.48,332.55,0.0
80,448,4096,512,ck,11,1,17.3268,a8w8_blockscale_bpreshuffle_1x128x128_256x32x128x256_16x16_16x16_16x16x1_16x16x1_1x32x1x8_8_2x1_intrawave_v1,108.45,346.08,0.0
80,480,4096,512,ck,11,2,17.8372,a8w8_blockscale_bpreshuffle_1x128x128_256x32x128x256_16x16_16x16_16x16x1_16x16x1_1x32x1x8_8_2x1_intrawave_v1,112.87,351.8,0.0
80,512,4096,512,ck,11,2,19.6701,a8w8_blockscale_bpreshuffle_1x128x128_256x32x128x256_16x16_16x16_16x16x1_16x16x1_1x32x1x8_8_2x1_intrawave_v1,109.18,333.18,0.0
80,544,4096,512,ck,11,0,19.6294,a8w8_blockscale_bpreshuffle_1x128x128_256x32x128x256_16x16_16x16_16x16x1_16x16x1_1x32x1x8_8_2x1_intrawave_v1,116.24,348.06,0.0
80,576,4096,512,ck,11,1,21.449,a8w8_blockscale_bpreshuffle_1x128x128_256x32x128x256_16x16_16x16_16x16x1_16x16x1_1x32x1x8_8_2x1_intrawave_v1,112.64,331.51,0.0
80,608,4096,512,ck,11,0,21.5482,a8w8_blockscale_bpreshuffle_1x128x128_256x32x128x256_16x16_16x16_16x16x1_16x16x1_1x32x1x8_8_2x1_intrawave_v1,118.35,342.91,0.0
80,640,4096,512,ck,11,2,21.8726,a8w8_blockscale_bpreshuffle_1x128x128_256x32x128x256_16x16_16x16_16x16x1_16x16x1_1x32x1x8_8_2x1_intrawave_v1,122.73,350.56,0.0
80,672,4096,512,ck,11,2,23.5961,a8w8_blockscale_bpreshuffle_1x128x128_256x32x128x256_16x16_16x16_16x16x1_16x16x1_1x32x1x8_8_2x1_intrawave_v1,119.45,336.76,0.0
80,704,4096,512,ck,11,0,23.8684,a8w8_blockscale_bpreshuffle_1x128x128_256x32x128x256_16x16_16x16_16x16x1_16x16x1_1x32x1x8_8_2x1_intrawave_v1,123.71,344.59,0.0
80,736,4096,512,ck,11,0,25.5779,a8w8_blockscale_bpreshuffle_1x128x128_256x32x128x256_16x16_16x16_16x16x1_16x16x1_1x32x1x8_8_2x1_intrawave_v1,120.69,332.45,0.0
80,768,4096,512,ck,11,1,25.8717,a8w8_blockscale_bpreshuffle_1x128x128_256x32x128x256_16x16_16x16_16x16x1_16x16x1_1x32x1x8_8_2x1_intrawave_v1,124.51,339.44,0.0
80,800,4096,512,ck,11,2,26.2075,a8w8_blockscale_bpreshuffle_1x128x128_256x32x128x256_16x16_16x16_16x16x1_16x16x1_1x32x1x8_8_2x1_intrawave_v1,128.03,345.72,0.0
80,832,4096,512,ck,11,1,27.8321,a8w8_blockscale_bpreshuffle_1x128x128_256x32x128x256_16x16_16x16_16x16x1_16x16x1_1x32x1x8_8_2x1_intrawave_v1,125.38,335.54,0.0
80,864,4096,512,ck,11,0,28.066,a8w8_blockscale_bpreshuffle_1x128x128_256x32x128x256_16x16_16x16_16x16x1_16x16x1_1x32x1x8_8_2x1_intrawave_v1,129.12,342.67,0.0
80,896,4096,512,ck,11,3,29.5692,a8w8_blockscale_bpreshuffle_1x128x128_256x32x128x256_16x16_16x16_16x16x1_16x16x1_1x32x1x8_8_2x1_intrawave_v1,127.09,334.67,0.0
80,928,4096,512,ck,11,1,29.8985,a8w8_blockscale_bpreshuffle_1x128x128_256x32x128x256_16x16_16x16_16x16x1_16x16x1_1x32x1x8_8_2x1_intrawave_v1,130.18,340.3,0.0
80,960,4096,512,ck,11,3,30.3557,a8w8_blockscale_bpreshuffle_1x128x128_256x32x128x256_16x16_16x16_16x16x1_16x16x1_1x32x1x8_8_2x1_intrawave_v1,132.65,344.35,0.0
80,992,4096,512,ck,11,3,32.0157,a8w8_blockscale_bpreshuffle_1x128x128_256x32x128x256_16x16_16x16_16x16x1_16x16x1_1x32x1x8_8_2x1_intrawave_v1,129.96,335.2,0.0
80,1024,4096,512,ck,11,2,32.2631,a8w8_blockscale_bpreshuffle_1x128x128_256x32x128x256_16x16_16x16_16x16x1_16x16x1_1x32x1x8_8_2x1_intrawave_v1,133.12,341.26,0.0
80,1088,4096,512,ck,11,2,34.1007,a8w8_blockscale_bpreshuffle_1x128x128_256x32x128x256_16x16_16x16_16x16x1_16x16x1_1x32x1x8_8_2x1_intrawave_v1,133.82,339.2,0.0
80,1152,4096,512,ck,11,3,36.0018,a8w8_blockscale_bpreshuffle_1x128x128_256x32x128x256_16x16_16x16_16x16x1_16x16x1_1x32x1x8_8_2x1_intrawave_v1,134.21,336.77,0.0
80,1216,4096,512,ck,11,3,37.9277,a8w8_blockscale_bpreshuffle_1x128x128_256x32x128x256_16x16_16x16_16x16x1_16x16x1_1x32x1x8_8_2x1_intrawave_v1,134.47,334.35,0.0
80,1280,4096,512,ck,11,0,38.6298,a8w8_blockscale_bpreshuffle_1x128x128_256x32x128x256_16x16_16x16_16x16x1_16x16x1_1x32x1x8_8_2x1_intrawave_v1,138.98,342.7,0.0
80,1344,4096,512,ck,11,3,40.3313,a8w8_blockscale_bpreshuffle_1x128x128_256x32x128x256_16x16_16x16_16x16x1_16x16x1_1x32x1x8_8_2x1_intrawave_v1,139.77,342.05,0.0
80,1408,4096,512,ck,11,2,42.2838,a8w8_blockscale_bpreshuffle_1x128x128_256x32x128x256_16x16_16x16_16x16x1_16x16x1_1x32x1x8_8_2x1_intrawave_v1,139.67,339.43,0.0
80,1472,4096,512,ck,11,3,44.1834,a8w8_blockscale_bpreshuffle_1x128x128_256x32x128x256_16x16_16x16_16x16x1_16x16x1_1x32x1x8_8_2x1_intrawave_v1,139.74,337.44,0.0
80,1536,4096,512,ck,11,2,46.1161,a8w8_blockscale_bpreshuffle_1x128x128_256x32x128x256_16x16_16x16_16x16x1_16x16x1_1x32x1x8_8_2x1_intrawave_v1,139.7,335.38,0.0
80,1600,4096,512,ck,11,1,46.749,a8w8_blockscale_bpreshuffle_1x128x128_256x32x128x256_16x16_16x16_16x16x1_16x16x1_1x32x1x8_8_2x1_intrawave_v1,143.55,342.76,0.0
80,1664,4096,512,ck,11,0,48.4557,a8w8_blockscale_bpreshuffle_1x128x128_256x32x128x256_16x16_16x16_16x16x1_16x16x1_1x32x1x8_8_2x1_intrawave_v1,144.04,342.18,0.0
80,1728,4096,512,ck,11,3,50.3513,a8w8_blockscale_bpreshuffle_1x128x128_256x32x128x256_16x16_16x16_16x16x1_16x16x1_1x32x1x8_8_2x1_intrawave_v1,143.94,340.36,0.0
80,1792,4096,512,ck,11,1,52.3727,a8w8_blockscale_bpreshuffle_1x128x128_256x32x128x256_16x16_16x16_16x16x1_16x16x1_1x32x1x8_8_2x1_intrawave_v1,143.51,337.86,0.0
80,1856,4096,512,ck,11,3,54.0421,a8w8_blockscale_bpreshuffle_1x128x128_256x32x128x256_16x16_16x16_16x16x1_16x16x1_1x32x1x8_8_2x1_intrawave_v1,144.05,337.73,0.0
80,1920,4096,512,ck,11,1,55.0288,a8w8_blockscale_bpreshuffle_1x128x128_256x32x128x256_16x16_16x16_16x16x1_16x16x1_1x32x1x8_8_2x1_intrawave_v1,146.34,341.8,0.0
80,1984,4096,512,ck,11,2,56.7093,a8w8_blockscale_bpreshuffle_1x128x128_256x32x128x256_16x16_16x16_16x16x1_16x16x1_1x32x1x8_8_2x1_intrawave_v1,146.74,341.49,0.0
80,2048,4096,512,ck,11,3,58.7274,a8w8_blockscale_bpreshuffle_1x128x128_256x32x128x256_16x16_16x16_16x16x1_16x16x1_1x32x1x8_8_2x1_intrawave_v1,146.27,339.24,0.0
80,4096,4096,512,ck,11,2,111.1039,a8w8_blockscale_bpreshuffle_1x128x128_256x32x128x256_16x16_16x16_16x16x1_16x16x1_1x32x1x8_8_2x1_intrawave_v1,154.63,339.76,0.0
80,8192,4096,512,ck,11,2,214.8628,a8w8_blockscale_bpreshuffle_1x128x128_256x32x128x256_16x16_16x16_16x16x1_16x16x1_1x32x1x8_8_2x1_intrawave_v1,159.91,341.61,0.0
80,16384,4096,512,ck,11,1,423.0004,a8w8_blockscale_bpreshuffle_1x128x128_256x32x128x256_16x16_16x16_16x16x1_16x16x1_1x32x1x8_8_2x1_intrawave_v1,162.46,342.09,0.0
80,32768,4096,512,ck,11,0,838.7932,a8w8_blockscale_bpreshuffle_1x128x128_256x32x128x256_16x16_16x16_16x16x1_16x16x1_1x32x1x8_8_2x1_intrawave_v1,163.85,342.53,0.0
80,16,4608,7168,ck,7,2,19.3998,a8w8_blockscale_bpreshuffle_1x128x128_256x16x64x256_16x16_16x16_16x16x1_16x16x1_1x16x1x16_4_1x1_intrawave_v1,54.48,1716.12,0.0
80,32,4608,7168,ck,12,3,22.186,a8w8_blockscale_bpreshuffle_1x128x128_256x32x64x256_16x16_16x16_16x16x1_16x16x1_1x32x1x8_8_2x1_intrawave_v1,95.28,1512.41,0.0
80,48,4608,7168,asm,27,2,29.3771,_ZN5aiter42fp8gemm_bf16_blockscale_BpreShuffle_48x128E,107.94,1151.12,0.0
80,64,4608,7168,ck,11,1,32.2763,a8w8_blockscale_bpreshuffle_1x128x128_256x32x128x256_16x16_16x16_16x16x1_16x16x1_1x32x1x8_8_2x1_intrawave_v1,130.99,1055.84,0.0
80,80,4608,7168,asm,43,2,36.4532,_ZN5aiter42fp8gemm_bf16_blockscale_BpreShuffle_80x128E,144.98,942.05,0.0
80,96,4608,7168,asm,26,1,38.2251,_ZN5aiter42fp8gemm_bf16_blockscale_BpreShuffle_48x128E,165.91,905.24,0.0
80,112,4608,7168,asm,34,1,43.302,_ZN5aiter42fp8gemm_bf16_blockscale_BpreShuffle_64x128E,170.86,805.16,0.0
80,128,4608,7168,asm,34,1,44.4839,_ZN5aiter42fp8gemm_bf16_blockscale_BpreShuffle_64x128E,190.08,789.66,0.0
80,144,4608,7168,asm,42,1,50.6275,_ZN5aiter42fp8gemm_bf16_blockscale_BpreShuffle_80x128E,187.9,699.02,0.0
80,160,4608,7168,asm,42,1,51.0315,_ZN5aiter42fp8gemm_bf16_blockscale_BpreShuffle_80x128E,207.12,698.62,0.0
80,176,4608,7168,asm,50,1,57.6685,_ZN5aiter42fp8gemm_bf16_blockscale_BpreShuffle_96x128E,201.61,622.76,0.0
80,192,4608,7168,asm,50,1,57.7157,_ZN5aiter42fp8gemm_bf16_blockscale_BpreShuffle_96x128E,219.76,626.79,0.0
80,208,4608,7168,asm,58,1,71.9281,_ZN5aiter43fp8gemm_bf16_blockscale_BpreShuffle_128x128E,191.03,506.59,0.0
80,224,4608,7168,asm,58,1,72.0668,_ZN5aiter43fp8gemm_bf16_blockscale_BpreShuffle_128x128E,205.33,509.25,0.0
80,240,4608,7168,asm,58,1,72.1093,_ZN5aiter43fp8gemm_bf16_blockscale_BpreShuffle_128x128E,219.87,512.59,0.0
80,256,4608,7168,asm,58,1,72.5216,_ZN5aiter43fp8gemm_bf16_blockscale_BpreShuffle_128x128E,233.19,513.29,0.0
80,288,4608,7168,asm,42,1,92.5926,_ZN5aiter42fp8gemm_bf16_blockscale_BpreShuffle_80x128E,205.47,407.69,0.0
80,320,4608,7168,asm,42,1,93.2438,_ZN5aiter42fp8gemm_bf16_blockscale_BpreShuffle_80x128E,226.71,410.46,0.0
80,352,4608,7168,asm,50,1,107.636,_ZN5aiter42fp8gemm_bf16_blockscale_BpreShuffle_96x128E,216.04,360.45,0.0
80,384,4608,7168,asm,50,1,108.292,_ZN5aiter42fp8gemm_bf16_blockscale_BpreShuffle_96x128E,234.25,363.11,0.0
80,416,4608,7168,ck,8,3,126.1034,a8w8_blockscale_bpreshuffle_1x128x128_256x32x256x128_16x16_16x16_8x32x1_8x32x1_1x32x1x8_8_2x1_intrawave_v1,217.92,315.98,0.0
80,448,4608,7168,asm,42,1,135.0389,_ZN5aiter42fp8gemm_bf16_blockscale_BpreShuffle_80x128E,219.16,298.95,0.0
80,480,4608,7168,asm,42,1,135.3278,_ZN5aiter42fp8gemm_bf16_blockscale_BpreShuffle_80x128E,234.31,302.19,0.0
80,512,4608,7168,asm,58,1,136.4475,_ZN5aiter43fp8gemm_bf16_blockscale_BpreShuffle_128x128E,247.88,303.55,0.0
80,544,4608,7168,asm,50,1,156.6776,_ZN5aiter42fp8gemm_bf16_blockscale_BpreShuffle_96x128E,229.37,267.7,0.0
80,576,4608,7168,asm,50,1,156.9357,_ZN5aiter42fp8gemm_bf16_blockscale_BpreShuffle_96x128E,242.46,270.6,0.0
80,608,4608,7168,asm,42,1,178.1192,_ZN5aiter42fp8gemm_bf16_blockscale_BpreShuffle_80x128E,225.49,241.36,0.0
80,640,4608,7168,ck,14,3,177.5914,a8w8_blockscale_bpreshuffle_1x128x128_256x64x128x128_16x16_16x16_8x32x1_8x32x1_1x32x1x8_8_2x1_intrawave_v1,238.07,245.03,0.0
80,672,4608,7168,ck,14,0,184.0676,a8w8_blockscale_bpreshuffle_1x128x128_256x64x128x128_16x16_16x16_8x32x1_8x32x1_1x32x1x8_8_2x1_intrawave_v1,241.18,239.26,0.0
80,704,4608,7168,ck,14,0,178.2718,a8w8_blockscale_bpreshuffle_1x128x128_256x64x128x128_16x16_16x16_8x32x1_8x32x1_1x32x1x8_8_2x1_intrawave_v1,260.87,249.98,0.0
80,736,4608,7168,asm,58,1,199.8279,_ZN5aiter43fp8gemm_bf16_blockscale_BpreShuffle_128x128E,243.31,225.64,0.0
80,768,4608,7168,asm,58,1,200.2929,_ZN5aiter43fp8gemm_bf16_blockscale_BpreShuffle_128x128E,253.3,227.73,0.0
80,800,4608,7168,ck,14,3,217.4725,a8w8_blockscale_bpreshuffle_1x128x128_256x64x128x128_16x16_16x16_8x32x1_8x32x1_1x32x1x8_8_2x1_intrawave_v1,243.01,212.15,0.0
80,832,4608,7168,ck,14,1,209.8002,a8w8_blockscale_bpreshuffle_1x128x128_256x64x128x128_16x16_16x16_8x32x1_8x32x1_1x32x1x8_8_2x1_intrawave_v1,261.97,222.41,0.0
80,864,4608,7168,asm,42,1,220.8345,_ZN5aiter42fp8gemm_bf16_blockscale_BpreShuffle_80x128E,258.46,213.67,0.0
80,896,4608,7168,ck,14,0,241.9605,a8w8_blockscale_bpreshuffle_1x128x128_256x64x128x128_16x16_16x16_8x32x1_8x32x1_1x32x1x8_8_2x1_intrawave_v1,244.63,197.18,0.0
80,928,4608,7168,ck,14,2,252.3494,a8w8_blockscale_bpreshuffle_1x128x128_256x64x128x128_16x16_16x16_8x32x1_8x32x1_1x32x1x8_8_2x1_intrawave_v1,242.93,191.14,0.0
80,960,4608,7168,ck,14,0,244.6477,a8w8_blockscale_bpreshuffle_1x128x128_256x64x128x128_16x16_16x16_8x32x1_8x32x1_1x32x1x8_8_2x1_intrawave_v1,259.22,199.3,0.0
80,992,4608,7168,asm,50,1,256.7527,_ZN5aiter42fp8gemm_bf16_blockscale_BpreShuffle_96x128E,255.23,191.95,0.0
80,1024,4608,7168,asm,50,1,258.3109,_ZN5aiter42fp8gemm_bf16_blockscale_BpreShuffle_96x128E,261.88,192.82,0.0
80,1088,4608,7168,ck,13,1,274.3179,a8w8_blockscale_bpreshuffle_1x128x128_256x64x256x128_16x16_16x16_8x32x1_8x32x1_1x32x1x8_8_2x1_intrawave_v1,262.01,185.39,0.0
80,1152,4608,7168,asm,42,1,304.7147,_ZN5aiter42fp8gemm_bf16_blockscale_BpreShuffle_80x128E,249.75,170.34,0.0
80,1216,4608,7168,asm,50,1,305.9989,_ZN5aiter42fp8gemm_bf16_blockscale_BpreShuffle_96x128E,262.52,173.05,0.0
80,1280,4608,7168,ck,14,2,308.4799,a8w8_blockscale_bpreshuffle_1x128x128_256x64x128x128_16x16_16x16_8x32x1_8x32x1_1x32x1x8_8_2x1_intrawave_v1,274.11,175.06,0.0
80,1344,4608,7168,asm,58,1,329.2137,_ZN5aiter43fp8gemm_bf16_blockscale_BpreShuffle_128x128E,269.69,167.22,0.0
80,1408,4608,7168,asm,58,1,329.7733,_ZN5aiter43fp8gemm_bf16_blockscale_BpreShuffle_128x128E,282.05,170.11,0.0
80,1472,4608,7168,ck,14,2,371.7323,a8w8_blockscale_bpreshuffle_1x128x128_256x64x128x128_16x16_16x16_8x32x1_8x32x1_1x32x1x8_8_2x1_intrawave_v1,261.59,153.73,0.0
80,1536,4608,7168,ck,14,3,372.6504,a8w8_blockscale_bpreshuffle_1x128x128_256x64x128x128_16x16_16x16_8x32x1_8x32x1_1x32x1x8_8_2x1_intrawave_v1,272.29,156.17,0.0
80,1600,4608,7168,asm,58,1,392.7521,_ZN5aiter43fp8gemm_bf16_blockscale_BpreShuffle_128x128E,269.12,150.84,0.0
80,1664,4608,7168,asm,58,1,393.3385,_ZN5aiter43fp8gemm_bf16_blockscale_BpreShuffle_128x128E,279.46,153.29,0.0
80,1728,4608,7168,asm,42,1,432.8314,_ZN5aiter42fp8gemm_bf16_blockscale_BpreShuffle_80x128E,263.73,141.72,0.0
80,1792,4608,7168,ck,14,3,438.3566,a8w8_blockscale_bpreshuffle_1x128x128_256x64x128x128_16x16_16x16_8x32x1_8x32x1_1x32x1x8_8_2x1_intrawave_v1,270.05,142.33,0.0
80,1856,4608,7168,asm,50,1,455.3095,_ZN5aiter42fp8gemm_bf16_blockscale_BpreShuffle_96x128E,269.28,139.33,0.0
80,1920,4608,7168,asm,50,1,456.6525,_ZN5aiter42fp8gemm_bf16_blockscale_BpreShuffle_96x128E,277.75,141.22,0.0
80,1984,4608,7168,ck,14,3,475.3003,a8w8_blockscale_bpreshuffle_1x128x128_256x64x128x128_16x16_16x16_8x32x1_8x32x1_1x32x1x8_8_2x1_intrawave_v1,275.75,137.88,0.0
80,2048,4608,7168,ck,14,0,501.1333,a8w8_blockscale_bpreshuffle_1x128x128_256x64x128x128_16x16_16x16_8x32x1_8x32x1_1x32x1x8_8_2x1_intrawave_v1,269.97,132.87,0.0
80,4096,4608,7168,ck,14,0,958.7327,a8w8_blockscale_bpreshuffle_1x128x128_256x64x128x128_16x16_16x16_8x32x1_8x32x1_1x32x1x8_8_2x1_intrawave_v1,282.23,104.45,0.0
80,8192,4608,7168,asm,58,1,1867.7262,_ZN5aiter43fp8gemm_bf16_blockscale_BpreShuffle_128x128E,289.75,89.55,0.0
80,16384,4608,7168,asm,58,1,3729.4024,_ZN5aiter43fp8gemm_bf16_blockscale_BpreShuffle_128x128E,290.22,80.83,0.0
80,32768,4608,7168,asm,58,1,7435.3162,_ZN5aiter43fp8gemm_bf16_blockscale_BpreShuffle_128x128E,291.13,76.65,0.0
80,1,7168,16384,ck,6,3,49.5276,a8w8_blockscale_bpreshuffle_1x128x128_256x16x128x256_16x16_16x16_16x16x1_16x16x1_1x16x1x16_8_1x2_intrawave_v1,4.74,2371.83,0.0
80,2,7168,16384,ck,6,1,49.6433,a8w8_blockscale_bpreshuffle_1x128x128_256x16x128x256_16x16_16x16_16x16x1_16x16x1_1x16x1x16_8_1x2_intrawave_v1,9.46,2366.92,0.0
80,4,7168,16384,ck,6,3,49.6226,a8w8_blockscale_bpreshuffle_1x128x128_256x16x128x256_16x16_16x16_16x16x1_16x16x1_1x16x1x16_8_1x2_intrawave_v1,18.93,2369.15,0.0
80,8,7168,16384,ck,6,3,49.5676,a8w8_blockscale_bpreshuffle_1x128x128_256x16x128x256_16x16_16x16_16x16x1_16x16x1_1x16x1x16_8_1x2_intrawave_v1,37.91,2374.26,0.0
80,16,7168,2048,ck,7,0,9.5084,a8w8_blockscale_bpreshuffle_1x128x128_256x16x64x256_16x16_16x16_16x16x1_16x16x1_1x16x1x16_4_1x1_intrawave_v1,49.4,1571.47,0.0
80,16,7168,2304,ck,7,1,10.1871,a8w8_blockscale_bpreshuffle_1x128x128_256x16x64x256_16x16_16x16_16x16x1_16x16x1_1x16x1x16_4_1x1_intrawave_v1,51.88,1647.31,0.0
80,16,7168,16384,ck,6,3,49.2141,a8w8_blockscale_bpreshuffle_1x128x128_256x16x128x256_16x16_16x16_16x16x1_16x16x1_1x16x1x16_8_1x2_intrawave_v1,76.36,2396.31,0.0
80,32,7168,2048,ck,7,1,12.4414,a8w8_blockscale_bpreshuffle_1x128x128_256x16x64x256_16x16_16x16_16x16x1_16x16x1_1x16x1x16_4_1x1_intrawave_v1,75.52,1222.08,0.0
80,32,7168,2304,ck,12,3,13.2934,a8w8_blockscale_bpreshuffle_1x128x128_256x32x64x256_16x16_16x16_16x16x1_16x16x1_1x32x1x8_8_2x1_intrawave_v1,79.51,1282.41,0.0
80,32,7168,16384,asm,21,4,66.1581,_ZN5aiter42fp8gemm_bf16_blockscale_BpreShuffle_32x128E,113.61,1790.01,0.008
80,48,7168,2048,ck,10,0,15.2298,a8w8_blockscale_bpreshuffle_1x128x128_256x32x64x128_16x16_16x16_8x32x1_8x32x1_1x32x1x8_8_2x1_intrawave_v1,92.53,1015.54,0.0
80,48,7168,2304,ck,10,0,17.7794,a8w8_blockscale_bpreshuffle_1x128x128_256x32x64x128_16x16_16x16_8x32x1_8x32x1_1x32x1x8_8_2x1_intrawave_v1,89.17,973.81,0.0
80,64,7168,2048,ck,10,0,16.897,a8w8_blockscale_bpreshuffle_1x128x128_256x32x64x128_16x16_16x16_8x32x1_8x32x1_1x32x1x8_8_2x1_intrawave_v1,111.21,930.85,0.0
80,64,7168,2304,ck,10,2,16.7754,a8w8_blockscale_bpreshuffle_1x128x128_256x32x64x128_16x16_16x16_8x32x1_8x32x1_1x32x1x8_8_2x1_intrawave_v1,126.01,1047.96,0.0
80,64,7168,16384,asm,37,4,82.0453,_ZN5aiter42fp8gemm_bf16_blockscale_BpreShuffle_64x128E,183.22,1455.37,0.0066
80,80,7168,2048,ck,6,2,21.9309,a8w8_blockscale_bpreshuffle_1x128x128_256x16x128x256_16x16_16x16_16x16x1_16x16x1_1x16x1x16_8_1x2_intrawave_v1,107.1,729.14,0.0
80,80,7168,2304,asm,42,1,23.9658,_ZN5aiter42fp8gemm_bf16_blockscale_BpreShuffle_80x128E,110.26,744.66,0.0
80,96,7168,2048,ck,9,1,22.9864,a8w8_blockscale_bpreshuffle_1x128x128_256x32x128x128_16x16_16x16_8x32x1_8x32x1_1x32x1x8_8_2x1_intrawave_v1,122.62,707.07,0.0
80,96,7168,2304,ck,10,3,24.2127,a8w8_blockscale_bpreshuffle_1x128x128_256x32x64x128_16x16_16x16_8x32x1_8x32x1_1x32x1x8_8_2x1_intrawave_v1,130.96,748.06,0.0
80,112,7168,2048,ck,9,2,23.9102,a8w8_blockscale_bpreshuffle_1x128x128_256x32x128x128_16x16_16x16_8x32x1_8x32x1_1x32x1x8_8_2x1_intrawave_v1,137.53,690.71,0.0
80,112,7168,2304,ck,9,0,25.4449,a8w8_blockscale_bpreshuffle_1x128x128_256x32x128x128_16x16_16x16_8x32x1_8x32x1_1x32x1x8_8_2x1_intrawave_v1,145.39,722.3,0.0
80,128,7168,2048,ck,9,0,24.3853,a8w8_blockscale_bpreshuffle_1x128x128_256x32x128x128_16x16_16x16_8x32x1_8x32x1_1x32x1x8_8_2x1_intrawave_v1,154.11,688.01,0.0
80,128,7168,2304,ck,9,3,25.7878,a8w8_blockscale_bpreshuffle_1x128x128_256x32x128x128_16x16_16x16_8x32x1_8x32x1_1x32x1x8_8_2x1_intrawave_v1,163.95,723.02,0.0
80,128,7168,16384,asm,61,4,130.687,_ZN5aiter43fp8gemm_bf16_blockscale_BpreShuffle_128x128E,230.05,928.73,0.0073
80,144,7168,2048,ck,9,3,29.6414,a8w8_blockscale_bpreshuffle_1x128x128_256x32x128x128_16x16_16x16_8x32x1_8x32x1_1x32x1x8_8_2x1_intrawave_v1,142.63,574.85,0.0
80,144,7168,2304,ck,9,2,31.6389,a8w8_blockscale_bpreshuffle_1x128x128_256x32x128x128_16x16_16x16_8x32x1_8x32x1_1x32x1x8_8_2x1_intrawave_v1,150.33,597.72,0.0
80,160,7168,2048,ck,8,2,29.5909,a8w8_blockscale_bpreshuffle_1x128x128_256x32x256x128_16x16_16x16_8x32x1_8x32x1_1x32x1x8_8_2x1_intrawave_v1,158.75,584.69,0.0
80,160,7168,2304,ck,8,1,31.8288,a8w8_blockscale_bpreshuffle_1x128x128_256x32x256x128_16x16_16x16_8x32x1_8x32x1_1x32x1x8_8_2x1_intrawave_v1,166.04,602.52,0.0
80,176,7168,2048,ck,9,2,36.3514,a8w8_blockscale_bpreshuffle_1x128x128_256x32x128x128_16x16_16x16_8x32x1_8x32x1_1x32x1x8_8_2x1_intrawave_v1,142.15,483.16,0.0
80,176,7168,2304,ck,9,3,39.1851,a8w8_blockscale_bpreshuffle_1x128x128_256x32x128x128_16x16_16x16_8x32x1_8x32x1_1x32x1x8_8_2x1_intrawave_v1,148.35,496.2,0.0
80,192,7168,2048,ck,9,2,36.4236,a8w8_blockscale_bpreshuffle_1x128x128_256x32x128x128_16x16_16x16_8x32x1_8x32x1_1x32x1x8_8_2x1_intrawave_v1,154.77,489.4,0.0
80,192,7168,2304,ck,9,0,38.918,a8w8_blockscale_bpreshuffle_1x128x128_256x32x128x128_16x16_16x16_8x32x1_8x32x1_1x32x1x8_8_2x1_intrawave_v1,162.95,506.45,0.0
80,208,7168,2048,ck,9,1,36.9079,a8w8_blockscale_bpreshuffle_1x128x128_256x32x128x128_16x16_16x16_8x32x1_8x32x1_1x32x1x8_8_2x1_intrawave_v1,165.46,490.08,0.0
80,208,7168,2304,ck,9,0,39.7129,a8w8_blockscale_bpreshuffle_1x128x128_256x32x128x128_16x16_16x16_8x32x1_8x32x1_1x32x1x8_8_2x1_intrawave_v1,173.0,503.02,0.0
80,224,7168,2048,ck,9,1,37.0242,a8w8_blockscale_bpreshuffle_1x128x128_256x32x128x128_16x16_16x16_8x32x1_8x32x1_1x32x1x8_8_2x1_intrawave_v1,177.63,495.62,0.0
80,224,7168,2304,ck,9,3,39.3943,a8w8_blockscale_bpreshuffle_1x128x128_256x32x128x128_16x16_16x16_8x32x1_8x32x1_1x32x1x8_8_2x1_intrawave_v1,187.81,513.84,0.0
80,240,7168,2048,ck,14,1,40.1769,a8w8_blockscale_bpreshuffle_1x128x128_256x64x128x128_16x16_16x16_8x32x1_8x32x1_1x32x1x8_8_2x1_intrawave_v1,175.39,463.26,0.0
80,240,7168,2304,ck,14,1,43.2768,a8w8_blockscale_bpreshuffle_1x128x128_256x64x128x128_16x16_16x16_8x32x1_8x32x1_1x32x1x8_8_2x1_intrawave_v1,183.18,473.9,0.0
80,256,7168,2048,ck,14,1,39.5562,a8w8_blockscale_bpreshuffle_1x128x128_256x64x128x128_16x16_16x16_8x32x1_8x32x1_1x32x1x8_8_2x1_intrawave_v1,190.01,477.15,0.0
80,256,7168,2304,ck,14,0,42.0697,a8w8_blockscale_bpreshuffle_1x128x128_256x64x128x128_16x16_16x16_8x32x1_8x32x1_1x32x1x8_8_2x1_intrawave_v1,200.99,493.82,0.0
80,256,7168,16384,asm,59,2,228.5274,_ZN5aiter43fp8gemm_bf16_blockscale_BpreShuffle_128x128E,263.12,548.31,0.0
80,288,7168,2048,ck,9,1,47.5417,a8w8_blockscale_bpreshuffle_1x128x128_256x32x128x128_16x16_16x16_8x32x1_8x32x1_1x32x1x8_8_2x1_intrawave_v1,177.86,408.03,0.0
80,288,7168,2304,ck,9,3,51.18,a8w8_blockscale_bpreshuffle_1x128x128_256x32x128x128_16x16_16x16_8x32x1_8x32x1_1x32x1x8_8_2x1_intrawave_v1,185.87,416.32,0.0
80,320,7168,2048,ck,9,3,49.2756,a8w8_blockscale_bpreshuffle_1x128x128_256x32x128x128_16x16_16x16_8x32x1_8x32x1_1x32x1x8_8_2x1_intrawave_v1,190.67,404.32,0.0
80,320,7168,2304,ck,9,2,52.1948,a8w8_blockscale_bpreshuffle_1x128x128_256x32x128x128_16x16_16x16_8x32x1_8x32x1_1x32x1x8_8_2x1_intrawave_v1,202.5,418.43,0.0
80,352,7168,2048,ck,8,3,54.6775,a8w8_blockscale_bpreshuffle_1x128x128_256x32x256x128_16x16_16x16_8x32x1_8x32x1_1x32x1x8_8_2x1_intrawave_v1,189.01,373.96,0.0
80,352,7168,2304,ck,9,2,58.0145,a8w8_blockscale_bpreshuffle_1x128x128_256x32x128x128_16x16_16x16_8x32x1_8x32x1_1x32x1x8_8_2x1_intrawave_v1,200.41,385.63,0.0
80,384,7168,2048,ck,9,2,59.0357,a8w8_blockscale_bpreshuffle_1x128x128_256x32x128x128_16x16_16x16_8x32x1_8x32x1_1x32x1x8_8_2x1_intrawave_v1,190.97,355.23,0.0
80,384,7168,2304,ck,9,1,63.8488,a8w8_blockscale_bpreshuffle_1x128x128_256x32x128x128_16x16_16x16_8x32x1_8x32x1_1x32x1x8_8_2x1_intrawave_v1,198.65,358.74,0.0
80,416,7168,2048,ck,14,2,63.113,a8w8_blockscale_bpreshuffle_1x128x128_256x64x128x128_16x16_16x16_8x32x1_8x32x1_1x32x1x8_8_2x1_intrawave_v1,193.52,340.59,0.0
80,416,7168,2304,ck,14,3,68.6593,a8w8_blockscale_bpreshuffle_1x128x128_256x64x128x128_16x16_16x16_8x32x1_8x32x1_1x32x1x8_8_2x1_intrawave_v1,200.13,341.36,0.0
80,448,7168,2048,ck,14,1,62.4393,a8w8_blockscale_bpreshuffle_1x128x128_256x64x128x128_16x16_16x16_8x32x1_8x32x1_1x32x1x8_8_2x1_intrawave_v1,210.66,352.66,0.0
80,448,7168,2304,ck,14,3,66.8746,a8w8_blockscale_bpreshuffle_1x128x128_256x64x128x128_16x16_16x16_8x32x1_8x32x1_1x32x1x8_8_2x1_intrawave_v1,221.27,358.43,0.0
80,480,7168,2048,ck,9,3,72.4714,a8w8_blockscale_bpreshuffle_1x128x128_256x32x128x128_16x16_16x16_8x32x1_8x32x1_1x32x1x8_8_2x1_intrawave_v1,194.46,311.08,0.0
80,480,7168,2304,ck,9,1,77.5899,a8w8_blockscale_bpreshuffle_1x128x128_256x32x128x128_16x16_16x16_8x32x1_8x32x1_1x32x1x8_8_2x1_intrawave_v1,204.34,315.79,0.0
80,512,7168,2048,ck,14,1,72.4895,a8w8_blockscale_bpreshuffle_1x128x128_256x64x128x128_16x16_16x16_8x32x1_8x32x1_1x32x1x8_8_2x1_intrawave_v1,207.37,318.23,0.0
80,512,7168,2304,ck,14,3,78.0287,a8w8_blockscale_bpreshuffle_1x128x128_256x64x128x128_16x16_16x16_8x32x1_8x32x1_1x32x1x8_8_2x1_intrawave_v1,216.73,320.84,0.0
80,512,7168,16384,asm,58,1,421.2318,_ZN5aiter43fp8gemm_bf16_blockscale_BpreShuffle_128x128E,285.49,316.14,0.0
80,544,7168,2048,ck,9,2,78.2294,a8w8_blockscale_bpreshuffle_1x128x128_256x32x128x128_16x16_16x16_8x32x1_8x32x1_1x32x1x8_8_2x1_intrawave_v1,204.17,301.59,0.0
80,544,7168,2304,ck,9,3,83.8617,a8w8_blockscale_bpreshuffle_1x128x128_256x32x128x128_16x16_16x16_8x32x1_8x32x1_1x32x1x8_8_2x1_intrawave_v1,214.26,304.87,0.0
80,576,7168,2048,ck,9,1,82.3548,a8w8_blockscale_bpreshuffle_1x128x128_256x32x128x128_16x16_16x16_8x32x1_8x32x1_1x32x1x8_8_2x1_intrawave_v1,205.35,292.85,0.0
80,576,7168,2304,ck,9,0,89.3804,a8w8_blockscale_bpreshuffle_1x128x128_256x32x128x128_16x16_16x16_8x32x1_8x32x1_1x32x1x8_8_2x1_intrawave_v1,212.86,292.01,0.0
80,608,7168,2048,ck,14,0,85.7273,a8w8_blockscale_bpreshuffle_1x128x128_256x64x128x128_16x16_16x16_8x32x1_8x32x1_1x32x1x8_8_2x1_intrawave_v1,208.23,287.44,0.0
80,608,7168,2304,ck,14,0,93.0439,a8w8_blockscale_bpreshuffle_1x128x128_256x64x128x128_16x16_16x16_8x32x1_8x32x1_1x32x1x8_8_2x1_intrawave_v1,215.84,286.23,0.0
80,640,7168,2048,ck,14,1,84.4573,a8w8_blockscale_bpreshuffle_1x128x128_256x64x128x128_16x16_16x16_8x32x1_8x32x1_1x32x1x8_8_2x1_intrawave_v1,222.48,297.97,0.0
80,640,7168,2304,ck,14,2,90.9714,a8w8_blockscale_bpreshuffle_1x128x128_256x64x128x128_16x16_16x16_8x32x1_8x32x1_1x32x1x8_8_2x1_intrawave_v1,232.37,298.61,0.0
80,672,7168,2048,ck,9,0,95.09,a8w8_blockscale_bpreshuffle_1x128x128_256x32x128x128_16x16_16x16_8x32x1_8x32x1_1x32x1x8_8_2x1_intrawave_v1,207.49,270.17,0.0
80,672,7168,2304,ck,9,0,102.3412,a8w8_blockscale_bpreshuffle_1x128x128_256x32x128x128_16x16_16x16_8x32x1_8x32x1_1x32x1x8_8_2x1_intrawave_v1,216.88,270.64,0.0
80,704,7168,2048,ck,14,2,94.37,a8w8_blockscale_bpreshuffle_1x128x128_256x64x128x128_16x16_16x16_8x32x1_8x32x1_1x32x1x8_8_2x1_intrawave_v1,219.03,277.78,0.0
80,704,7168,2304,ck,14,2,102.1902,a8w8_blockscale_bpreshuffle_1x128x128_256x64x128x128_16x16_16x16_8x32x1_8x32x1_1x32x1x8_8_2x1_intrawave_v1,227.55,276.25,0.0
80,736,7168,2048,ck,9,2,104.2765,a8w8_blockscale_bpreshuffle_1x128x128_256x32x128x128_16x16_16x16_8x32x1_8x32x1_1x32x1x8_8_2x1_intrawave_v1,207.23,256.42,0.0
80,736,7168,2304,ck,9,0,113.7471,a8w8_blockscale_bpreshuffle_1x128x128_256x32x128x128_16x16_16x16_8x32x1_8x32x1_1x32x1x8_8_2x1_intrawave_v1,213.72,252.86,0.0
80,768,7168,2048,ck,14,1,104.5179,a8w8_blockscale_bpreshuffle_1x128x128_256x64x128x128_16x16_16x16_8x32x1_8x32x1_1x32x1x8_8_2x1_intrawave_v1,215.74,260.85,0.0
80,768,7168,2304,ck,14,2,113.3153,a8w8_blockscale_bpreshuffle_1x128x128_256x64x128x128_16x16_16x16_8x32x1_8x32x1_1x32x1x8_8_2x1_intrawave_v1,223.86,258.52,0.0
80,800,7168,2048,ck,9,3,111.0142,a8w8_blockscale_bpreshuffle_1x128x128_256x32x128x128_16x16_16x16_8x32x1_8x32x1_1x32x1x8_8_2x1_intrawave_v1,211.58,250.3,0.0
80,800,7168,2304,ck,9,3,120.7178,a8w8_blockscale_bpreshuffle_1x128x128_256x32x128x128_16x16_16x16_8x32x1_8x32x1_1x32x1x8_8_2x1_intrawave_v1,218.89,247.08,0.0
80,832,7168,2048,ck,14,1,114.7356,a8w8_blockscale_bpreshuffle_1x128x128_256x64x128x128_16x16_16x16_8x32x1_8x32x1_1x32x1x8_8_2x1_intrawave_v1,212.9,246.75,0.0
80,832,7168,2304,ck,14,3,124.6856,a8w8_blockscale_bpreshuffle_1x128x128_256x64x128x128_16x16_16x16_8x32x1_8x32x1_1x32x1x8_8_2x1_intrawave_v1,220.4,243.49,0.0
80,864,7168,2048,ck,9,2,116.9859,a8w8_blockscale_bpreshuffle_1x128x128_256x32x128x128_16x16_16x16_8x32x1_8x32x1_1x32x1x8_8_2x1_intrawave_v1,216.84,246.49,0.0
80,864,7168,2304,ck,9,2,127.4996,a8w8_blockscale_bpreshuffle_1x128x128_256x32x128x128_16x16_16x16_8x32x1_8x32x1_1x32x1x8_8_2x1_intrawave_v1,223.83,242.29,0.0
80,896,7168,2048,ck,14,2,115.9901,a8w8_blockscale_bpreshuffle_1x128x128_256x64x128x128_16x16_16x16_8x32x1_8x32x1_1x32x1x8_8_2x1_intrawave_v1,226.8,253.13,0.0
80,896,7168,2304,ck,14,1,125.944,a8w8_blockscale_bpreshuffle_1x128x128_256x64x128x128_16x16_16x16_8x32x1_8x32x1_1x32x1x8_8_2x1_intrawave_v1,234.99,249.51,0.0
80,928,7168,2048,ck,9,0,128.9019,a8w8_blockscale_bpreshuffle_1x128x128_256x32x128x128_16x16_16x16_8x32x1_8x32x1_1x32x1x8_8_2x1_intrawave_v1,211.37,231.84,0.0
80,928,7168,2304,ck,9,0,139.7491,a8w8_blockscale_bpreshuffle_1x128x128_256x32x128x128_16x16_16x16_8x32x1_8x32x1_1x32x1x8_8_2x1_intrawave_v1,219.34,228.67,0.0
80,960,7168,2048,ck,14,2,127.0151,a8w8_blockscale_bpreshuffle_1x128x128_256x64x128x128_16x16_16x16_8x32x1_8x32x1_1x32x1x8_8_2x1_intrawave_v1,221.91,239.41,0.0
80,960,7168,2304,ck,14,0,137.3481,a8w8_blockscale_bpreshuffle_1x128x128_256x64x128x128_16x16_16x16_8x32x1_8x32x1_1x32x1x8_8_2x1_intrawave_v1,230.87,236.55,0.0
80,992,7168,2048,ck,9,0,138.3855,a8w8_blockscale_bpreshuffle_1x128x128_256x32x128x128_16x16_16x16_8x32x1_8x32x1_1x32x1x8_8_2x1_intrawave_v1,210.46,223.53,0.0
80,992,7168,2304,ck,9,0,149.418,a8w8_blockscale_bpreshuffle_1x128x128_256x32x128x128_16x16_16x16_8x32x1_8x32x1_1x32x1x8_8_2x1_intrawave_v1,219.29,221.0,0.0
80,1024,7168,2048,ck,14,0,136.574,a8w8_blockscale_bpreshuffle_1x128x128_256x64x128x128_16x16_16x16_8x32x1_8x32x1_1x32x1x8_8_2x1_intrawave_v1,220.14,230.33,0.0
80,1024,7168,2304,ck,14,2,148.2795,a8w8_blockscale_bpreshuffle_1x128x128_256x64x128x128_16x16_16x16_8x32x1_8x32x1_1x32x1x8_8_2x1_intrawave_v1,228.1,226.29,0.0
80,1024,7168,16384,asm,58,1,839.1182,_ZN5aiter43fp8gemm_bf16_blockscale_BpreShuffle_128x128E,286.63,177.45,0.0
80,1088,7168,2048,ck,14,3,138.5767,a8w8_blockscale_bpreshuffle_1x128x128_256x64x128x128_16x16_16x16_8x32x1_8x32x1_1x32x1x8_8_2x1_intrawave_v1,230.51,234.57,0.0
80,1088,7168,2304,ck,14,3,149.6339,a8w8_blockscale_bpreshuffle_1x128x128_256x64x128x128_16x16_16x16_8x32x1_8x32x1_1x32x1x8_8_2x1_intrawave_v1,240.16,231.36,0.0
80,1152,7168,2048,ck,14,2,148.2346,a8w8_blockscale_bpreshuffle_1x128x128_256x64x128x128_16x16_16x16_8x32x1_8x32x1_1x32x1x8_8_2x1_intrawave_v1,228.17,226.36,0.0
80,1152,7168,2304,ck,14,3,160.9771,a8w8_blockscale_bpreshuffle_1x128x128_256x64x128x128_16x16_16x16_8x32x1_8x32x1_1x32x1x8_8_2x1_intrawave_v1,236.37,221.67,0.0
80,1216,7168,2048,ck,14,0,157.9938,a8w8_blockscale_bpreshuffle_1x128x128_256x64x128x128_16x16_16x16_8x32x1_8x32x1_1x32x1x8_8_2x1_intrawave_v1,225.97,219.01,0.0
80,1216,7168,2304,ck,14,2,172.0942,a8w8_blockscale_bpreshuffle_1x128x128_256x64x128x128_16x16_16x16_8x32x1_8x32x1_1x32x1x8_8_2x1_intrawave_v1,233.39,213.54,0.0
80,1280,7168,2048,ck,14,3,159.3363,a8w8_blockscale_bpreshuffle_1x128x128_256x64x128x128_16x16_16x16_8x32x1_8x32x1_1x32x1x8_8_2x1_intrawave_v1,235.86,223.75,0.0
80,1280,7168,2304,ck,14,2,173.2516,a8w8_blockscale_bpreshuffle_1x128x128_256x64x128x128_16x16_16x16_8x32x1_8x32x1_1x32x1x8_8_2x1_intrawave_v1,244.03,218.26,0.0
80,1344,7168,2048,ck,14,1,169.6204,a8w8_blockscale_bpreshuffle_1x128x128_256x64x128x128_16x16_16x16_8x32x1_8x32x1_1x32x1x8_8_2x1_intrawave_v1,232.64,216.37,0.0
80,1344,7168,2304,ck,14,3,184.4304,a8w8_blockscale_bpreshuffle_1x128x128_256x64x128x128_16x16_16x16_8x32x1_8x32x1_1x32x1x8_8_2x1_intrawave_v1,240.7,210.81,0.0
80,1408,7168,2048,ck,14,1,179.8549,a8w8_blockscale_bpreshuffle_1x128x128_256x64x128x128_16x16_16x16_8x32x1_8x32x1_1x32x1x8_8_2x1_intrawave_v1,229.85,209.88,0.0
80,1408,7168,2304,ck,14,0,195.8741,a8w8_blockscale_bpreshuffle_1x128x128_256x64x128x128_16x16_16x16_8x32x1_8x32x1_1x32x1x8_8_2x1_intrawave_v1,237.43,203.93,0.0
80,1472,7168,2048,ck,14,1,189.8631,a8w8_blockscale_bpreshuffle_1x128x128_256x64x128x128_16x16_16x16_8x32x1_8x32x1_1x32x1x8_8_2x1_intrawave_v1,227.63,204.34,0.0
80,1472,7168,2304,ck,14,0,206.7855,a8w8_blockscale_bpreshuffle_1x128x128_256x64x128x128_16x16_16x16_8x32x1_8x32x1_1x32x1x8_8_2x1_intrawave_v1,235.12,198.32,0.0
80,1536,7168,2048,ck,14,2,190.8686,a8w8_blockscale_bpreshuffle_1x128x128_256x64x128x128_16x16_16x16_8x32x1_8x32x1_1x32x1x8_8_2x1_intrawave_v1,236.27,208.76,0.0
80,1536,7168,2304,ck,14,1,208.3679,a8w8_blockscale_bpreshuffle_1x128x128_256x64x128x128_16x16_16x16_8x32x1_8x32x1_1x32x1x8_8_2x1_intrawave_v1,243.48,201.92,0.0
80,1600,7168,2048,ck,14,0,201.5047,a8w8_blockscale_bpreshuffle_1x128x128_256x64x128x128_16x16_16x16_8x32x1_8x32x1_1x32x1x8_8_2x1_intrawave_v1,233.13,202.95,0.0
80,1600,7168,2304,ck,14,1,219.3246,a8w8_blockscale_bpreshuffle_1x128x128_256x64x128x128_16x16_16x16_8x32x1_8x32x1_1x32x1x8_8_2x1_intrawave_v1,240.96,196.69,0.0
80,1664,7168,2048,ck,14,0,211.4536,a8w8_blockscale_bpreshuffle_1x128x128_256x64x128x128_16x16_16x16_8x32x1_8x32x1_1x32x1x8_8_2x1_intrawave_v1,231.04,198.36,0.0
80,1664,7168,2304,ck,14,1,230.9006,a8w8_blockscale_bpreshuffle_1x128x128_256x64x128x128_16x16_16x16_8x32x1_8x32x1_1x32x1x8_8_2x1_intrawave_v1,238.03,191.44,0.0
80,1728,7168,2048,ck,14,3,212.913,a8w8_blockscale_bpreshuffle_1x128x128_256x64x128x128_16x16_16x16_8x32x1_8x32x1_1x32x1x8_8_2x1_intrawave_v1,238.29,201.92,0.0
80,1728,7168,2304,ck,14,1,232.0005,a8w8_blockscale_bpreshuffle_1x128x128_256x64x128x128_16x16_16x16_8x32x1_8x32x1_1x32x1x8_8_2x1_intrawave_v1,246.02,195.12,0.0
80,1792,7168,2048,ck,14,1,222.8705,a8w8_blockscale_bpreshuffle_1x128x128_256x64x128x128_16x16_16x16_8x32x1_8x32x1_1x32x1x8_8_2x1_intrawave_v1,236.07,197.6,0.0
80,1792,7168,2304,ck,14,2,243.0117,a8w8_blockscale_bpreshuffle_1x128x128_256x64x128x128_16x16_16x16_8x32x1_8x32x1_1x32x1x8_8_2x1_intrawave_v1,243.57,190.67,0.0
80,1856,7168,2048,ck,14,2,233.4155,a8w8_blockscale_bpreshuffle_1x128x128_256x64x128x128_16x16_16x16_8x32x1_8x32x1_1x32x1x8_8_2x1_intrawave_v1,233.46,193.17,0.0
80,1856,7168,2304,ck,14,0,254.3855,a8w8_blockscale_bpreshuffle_1x128x128_256x64x128x128_16x16_16x16_8x32x1_8x32x1_1x32x1x8_8_2x1_intrawave_v1,240.99,186.33,0.0
80,1920,7168,2048,ck,14,1,235.8358,a8w8_blockscale_bpreshuffle_1x128x128_256x64x128x128_16x16_16x16_8x32x1_8x32x1_1x32x1x8_8_2x1_intrawave_v1,239.03,195.63,0.0
80,1920,7168,2304,ck,14,0,256.0518,a8w8_blockscale_bpreshuffle_1x128x128_256x64x128x128_16x16_16x16_8x32x1_8x32x1_1x32x1x8_8_2x1_intrawave_v1,247.68,189.27,0.0
80,1984,7168,2048,ck,14,2,246.6337,a8w8_blockscale_bpreshuffle_1x128x128_256x64x128x128_16x16_16x16_8x32x1_8x32x1_1x32x1x8_8_2x1_intrawave_v1,236.18,191.32,0.0
80,1984,7168,2304,ck,14,2,268.3263,a8w8_blockscale_bpreshuffle_1x128x128_256x64x128x128_16x16_16x16_8x32x1_8x32x1_1x32x1x8_8_2x1_intrawave_v1,244.22,184.58,0.0
80,2048,7168,2048,ck,14,3,254.3665,a8w8_blockscale_bpreshuffle_1x128x128_256x64x128x128_16x16_16x16_8x32x1_8x32x1_1x32x1x8_8_2x1_intrawave_v1,236.39,189.63,0.0
80,2048,7168,2304,ck,14,0,277.7633,a8w8_blockscale_bpreshuffle_1x128x128_256x64x128x128_16x16_16x16_8x32x1_8x32x1_1x32x1x8_8_2x1_intrawave_v1,243.54,182.15,0.0
80,2048,7168,16384,asm,58,1,1659.4133,_ZN5aiter43fp8gemm_bf16_blockscale_BpreShuffle_128x128E,289.88,108.69,0.0
80,4096,7168,2048,ck,14,0,490.9567,a8w8_blockscale_bpreshuffle_1x128x128_256x64x128x128_16x16_16x16_8x32x1_8x32x1_1x32x1x8_8_2x1_intrawave_v1,244.95,166.59,0.0
80,4096,7168,2304,ck,14,2,537.1159,a8w8_blockscale_bpreshuffle_1x128x128_256x64x128x128_16x16_16x16_8x32x1_8x32x1_1x32x1x8_8_2x1_intrawave_v1,251.89,157.64,0.0
80,4096,7168,16384,asm,58,1,3172.9026,_ZN5aiter43fp8gemm_bf16_blockscale_BpreShuffle_128x128E,303.22,76.67,0.0
80,6144,7168,16384,asm,58,1,4695.0985,_ZN5aiter43fp8gemm_bf16_blockscale_BpreShuffle_128x128E,307.37,65.21,0.0
80,8120,7168,16384,asm,58,1,6221.3981,_ZN5aiter43fp8gemm_bf16_blockscale_BpreShuffle_128x128E,306.56,58.97,0.0
80,8192,7168,2048,ck,14,3,972.3165,a8w8_blockscale_bpreshuffle_1x128x128_256x64x128x128_16x16_16x16_8x32x1_8x32x1_1x32x1x8_8_2x1_intrawave_v1,247.37,153.14,0.0
80,8192,7168,2304,ck,14,1,1065.2684,a8w8_blockscale_bpreshuffle_1x128x128_256x64x128x128_16x16_16x16_8x32x1_8x32x1_1x32x1x8_8_2x1_intrawave_v1,254.0,143.47,0.0
80,10240,7168,16384,asm,58,1,7714.6463,_ZN5aiter43fp8gemm_bf16_blockscale_BpreShuffle_128x128E,311.77,56.0,0.0
80,12288,7168,16384,asm,58,1,9367.2861,_ZN5aiter43fp8gemm_bf16_blockscale_BpreShuffle_128x128E,308.12,52.84,0.0
80,14336,7168,16384,asm,58,1,10897.7728,_ZN5aiter43fp8gemm_bf16_blockscale_BpreShuffle_128x128E,308.99,51.19,0.0
80,16384,7168,2048,ck,14,3,1928.5945,a8w8_blockscale_bpreshuffle_1x128x128_256x64x128x128_16x16_16x16_8x32x1_8x32x1_1x32x1x8_8_2x1_intrawave_v1,249.42,146.8,0.0
80,16384,7168,2304,ck,14,1,2115.6427,a8w8_blockscale_bpreshuffle_1x128x128_256x64x128x128_16x16_16x16_8x32x1_8x32x1_1x32x1x8_8_2x1_intrawave_v1,255.79,136.67,0.0
80,16384,7168,16384,asm,58,1,12376.0535,_ZN5aiter43fp8gemm_bf16_blockscale_BpreShuffle_128x128E,310.95,50.16,0.0
80,32768,7168,2048,ck,14,2,3836.6655,a8w8_blockscale_bpreshuffle_1x128x128_256x64x128x128_16x16_16x16_8x32x1_8x32x1_1x32x1x8_8_2x1_intrawave_v1,250.76,143.76,0.0
80,32768,7168,2304,ck,14,3,4212.8476,a8w8_blockscale_bpreshuffle_1x128x128_256x64x128x128_16x16_16x16_8x32x1_8x32x1_1x32x1x8_8_2x1_intrawave_v1,256.91,133.35,0.0
80,16,8192,1536,ck,6,2,8.589,a8w8_blockscale_bpreshuffle_1x128x128_256x16x128x256_16x16_16x16_16x16x1_16x16x1_1x16x1x16_8_1x2_intrawave_v1,46.88,1498.39,0.0
80,32,8192,1536,ck,12,2,10.5648,a8w8_blockscale_bpreshuffle_1x128x128_256x32x64x256_16x16_16x16_16x16x1_16x16x1_1x32x1x8_8_2x1_intrawave_v1,76.23,1245.3,0.0
80,48,8192,1536,asm,26,1,13.6138,_ZN5aiter42fp8gemm_bf16_blockscale_BpreShuffle_48x128E,88.73,987.46,0.0
80,64,8192,1536,ck,9,0,15.3667,a8w8_blockscale_bpreshuffle_1x128x128_256x32x128x128_16x16_16x16_8x32x1_8x32x1_1x32x1x8_8_2x1_intrawave_v1,104.81,893.48,0.0
80,80,8192,1536,ck,6,3,18.425,a8w8_blockscale_bpreshuffle_1x128x128_256x16x128x256_16x16_16x16_16x16x1_16x16x1_1x16x1x16_8_1x2_intrawave_v1,109.27,760.73,0.0
80,96,8192,1536,ck,9,1,19.6509,a8w8_blockscale_bpreshuffle_1x128x128_256x32x128x128_16x16_16x16_8x32x1_8x32x1_1x32x1x8_8_2x1_intrawave_v1,122.94,727.87,0.0
80,112,8192,1536,ck,9,3,23.9737,a8w8_blockscale_bpreshuffle_1x128x128_256x32x128x128_16x16_16x16_8x32x1_8x32x1_1x32x1x8_8_2x1_intrawave_v1,117.57,608.58,0.0
80,128,8192,1536,ck,9,1,24.0066,a8w8_blockscale_bpreshuffle_1x128x128_256x32x128x128_16x16_16x16_8x32x1_8x32x1_1x32x1x8_8_2x1_intrawave_v1,134.18,619.69,0.0
80,144,8192,1536,ck,9,2,24.9663,a8w8_blockscale_bpreshuffle_1x128x128_256x32x128x128_16x16_16x16_8x32x1_8x32x1_1x32x1x8_8_2x1_intrawave_v1,145.15,607.35,0.0
80,160,8192,1536,ck,8,2,24.9133,a8w8_blockscale_bpreshuffle_1x128x128_256x32x256x128_16x16_16x16_8x32x1_8x32x1_1x32x1x8_8_2x1_intrawave_v1,161.62,620.16,0.0
80,176,8192,1536,ck,9,0,30.0688,a8w8_blockscale_bpreshuffle_1x128x128_256x32x128x128_16x16_16x16_8x32x1_8x32x1_1x32x1x8_8_2x1_intrawave_v1,147.3,523.36,0.0
80,192,8192,1536,ck,9,0,30.0558,a8w8_blockscale_bpreshuffle_1x128x128_256x32x128x128_16x16_16x16_8x32x1_8x32x1_1x32x1x8_8_2x1_intrawave_v1,160.76,533.13,0.0
80,208,8192,1536,ck,8,3,33.8628,a8w8_blockscale_bpreshuffle_1x128x128_256x32x256x128_16x16_16x16_8x32x1_8x32x1_1x32x1x8_8_2x1_intrawave_v1,154.58,481.66,0.0
80,224,8192,1536,ck,9,0,34.3754,a8w8_blockscale_bpreshuffle_1x128x128_256x32x128x128_16x16_16x16_8x32x1_8x32x1_1x32x1x8_8_2x1_intrawave_v1,163.99,482.82,0.0
80,240,8192,1536,ck,9,0,38.1589,a8w8_blockscale_bpreshuffle_1x128x128_256x32x128x128_16x16_16x16_8x32x1_8x32x1_1x32x1x8_8_2x1_intrawave_v1,158.28,442.46,0.0
80,256,8192,1536,ck,9,3,38.4101,a8w8_blockscale_bpreshuffle_1x128x128_256x32x128x128_16x16_16x16_8x32x1_8x32x1_1x32x1x8_8_2x1_intrawave_v1,167.73,447.03,0.0
80,288,8192,1536,ck,9,3,42.6189,a8w8_blockscale_bpreshuffle_1x128x128_256x32x128x128_16x16_16x16_8x32x1_8x32x1_1x32x1x8_8_2x1_intrawave_v1,170.06,416.34,0.0
80,320,8192,1536,ck,13,2,42.6097,a8w8_blockscale_bpreshuffle_1x128x128_256x64x256x128_16x16_16x16_8x32x1_8x32x1_1x32x1x8_8_2x1_intrawave_v1,189.0,429.89,0.0
80,352,8192,1536,ck,9,3,48.7471,a8w8_blockscale_bpreshuffle_1x128x128_256x32x128x128_16x16_16x16_8x32x1_8x32x1_1x32x1x8_8_2x1_intrawave_v1,181.72,387.53,0.0
80,384,8192,1536,ck,14,3,50.6187,a8w8_blockscale_bpreshuffle_1x128x128_256x64x128x128_16x16_16x16_8x32x1_8x32x1_1x32x1x8_8_2x1_intrawave_v1,190.91,384.53,0.0
80,416,8192,1536,ck,9,2,56.8334,a8w8_blockscale_bpreshuffle_1x128x128_256x32x128x128_16x16_16x16_8x32x1_8x32x1_1x32x1x8_8_2x1_intrawave_v1,184.2,352.57,0.0
80,448,8192,1536,ck,14,2,58.7409,a8w8_blockscale_bpreshuffle_1x128x128_256x64x128x128_16x16_16x16_8x32x1_8x32x1_1x32x1x8_8_2x1_intrawave_v1,191.93,350.88,0.0
80,480,8192,1536,ck,9,0,63.1233,a8w8_blockscale_bpreshuffle_1x128x128_256x32x128x128_16x16_16x16_8x32x1_8x32x1_1x32x1x8_8_2x1_intrawave_v1,191.37,335.61,0.0
80,512,8192,1536,ck,9,3,66.0731,a8w8_blockscale_bpreshuffle_1x128x128_256x32x128x128_16x16_16x16_8x32x1_8x32x1_1x32x1x8_8_2x1_intrawave_v1,195.01,329.3,0.0
80,544,8192,1536,ck,9,2,70.7525,a8w8_blockscale_bpreshuffle_1x128x128_256x32x128x128_16x16_16x16_8x32x1_8x32x1_1x32x1x8_8_2x1_intrawave_v1,193.49,315.63,0.0
80,576,8192,1536,ck,9,3,74.2016,a8w8_blockscale_bpreshuffle_1x128x128_256x32x128x128_16x16_16x16_8x32x1_8x32x1_1x32x1x8_8_2x1_intrawave_v1,195.35,308.68,0.0
80,608,8192,1536,ck,14,1,77.8662,a8w8_blockscale_bpreshuffle_1x128x128_256x64x128x128_16x16_16x16_8x32x1_8x32x1_1x32x1x8_8_2x1_intrawave_v1,196.5,301.52,0.0
80,640,8192,1536,ck,14,0,77.0993,a8w8_blockscale_bpreshuffle_1x128x128_256x64x128x128_16x16_16x16_8x32x1_8x32x1_1x32x1x8_8_2x1_intrawave_v1,208.9,311.96,0.0
80,672,8192,1536,ck,9,2,84.3534,a8w8_blockscale_bpreshuffle_1x128x128_256x32x128x128_16x16_16x16_8x32x1_8x32x1_1x32x1x8_8_2x1_intrawave_v1,200.48,291.93,0.0
80,704,8192,1536,ck,14,3,85.1891,a8w8_blockscale_bpreshuffle_1x128x128_256x64x128x128_16x16_16x16_8x32x1_8x32x1_1x32x1x8_8_2x1_intrawave_v1,207.97,295.8,0.0
80,736,8192,1536,ck,9,0,91.5201,a8w8_blockscale_bpreshuffle_1x128x128_256x32x128x128_16x16_16x16_8x32x1_8x32x1_1x32x1x8_8_2x1_intrawave_v1,202.38,281.6,0.0
80,768,8192,1536,ck,14,3,93.6868,a8w8_blockscale_bpreshuffle_1x128x128_256x64x128x128_16x16_16x16_8x32x1_8x32x1_1x32x1x8_8_2x1_intrawave_v1,206.3,281.21,0.0
80,800,8192,1536,ck,9,3,97.0836,a8w8_blockscale_bpreshuffle_1x128x128_256x32x128x128_16x16_16x16_8x32x1_8x32x1_1x32x1x8_8_2x1_intrawave_v1,207.37,277.28,0.0
80,832,8192,1536,ck,9,1,101.2715,a8w8_blockscale_bpreshuffle_1x128x128_256x32x128x128_16x16_16x16_8x32x1_8x32x1_1x32x1x8_8_2x1_intrawave_v1,206.75,271.47,0.0
80,864,8192,1536,ck,9,3,105.302,a8w8_blockscale_bpreshuffle_1x128x128_256x32x128x128_16x16_16x16_8x32x1_8x32x1_1x32x1x8_8_2x1_intrawave_v1,206.48,266.53,0.0
80,896,8192,1536,ck,9,0,109.468,a8w8_blockscale_bpreshuffle_1x128x128_256x32x128x128_16x16_16x16_8x32x1_8x32x1_1x32x1x8_8_2x1_intrawave_v1,205.98,261.62,0.0
80,928,8192,1536,ck,14,0,113.3522,a8w8_blockscale_bpreshuffle_1x128x128_256x64x128x128_16x16_16x16_8x32x1_8x32x1_1x32x1x8_8_2x1_intrawave_v1,206.03,257.72,0.0
80,960,8192,1536,ck,14,2,111.9428,a8w8_blockscale_bpreshuffle_1x128x128_256x64x128x128_16x16_16x16_8x32x1_8x32x1_1x32x1x8_8_2x1_intrawave_v1,215.82,266.08,0.0
80,992,8192,1536,ck,14,1,121.2475,a8w8_blockscale_bpreshuffle_1x128x128_256x64x128x128_16x16_16x16_8x32x1_8x32x1_1x32x1x8_8_2x1_intrawave_v1,205.9,250.39,0.0
80,1024,8192,1536,ck,14,3,119.5832,a8w8_blockscale_bpreshuffle_1x128x128_256x64x128x128_16x16_16x16_8x32x1_8x32x1_1x32x1x8_8_2x1_intrawave_v1,215.5,258.67,0.0
80,1088,8192,1536,ck,14,1,128.6765,a8w8_blockscale_bpreshuffle_1x128x128_256x64x128x128_16x16_16x16_8x32x1_8x32x1_1x32x1x8_8_2x1_intrawave_v1,212.78,249.31,0.0
80,1152,8192,1536,ck,14,0,136.0684,a8w8_blockscale_bpreshuffle_1x128x128_256x64x128x128_16x16_16x16_8x32x1_8x32x1_1x32x1x8_8_2x1_intrawave_v1,213.06,244.19,0.0
80,1216,8192,1536,ck,14,3,144.2879,a8w8_blockscale_bpreshuffle_1x128x128_256x64x128x128_16x16_16x16_8x32x1_8x32x1_1x32x1x8_8_2x1_intrawave_v1,212.09,238.23,0.0
80,1280,8192,1536,ck,14,2,145.6025,a8w8_blockscale_bpreshuffle_1x128x128_256x64x128x128_16x16_16x16_8x32x1_8x32x1_1x32x1x8_8_2x1_intrawave_v1,221.23,243.96,0.0
80,1344,8192,1536,ck,14,3,154.2619,a8w8_blockscale_bpreshuffle_1x128x128_256x64x128x128_16x16_16x16_8x32x1_8x32x1_1x32x1x8_8_2x1_intrawave_v1,219.26,237.7,0.0
80,1408,8192,1536,ck,14,2,162.4064,a8w8_blockscale_bpreshuffle_1x128x128_256x64x128x128_16x16_16x16_8x32x1_8x32x1_1x32x1x8_8_2x1_intrawave_v1,218.18,232.84,0.0
80,1472,8192,1536,ck,14,0,170.3813,a8w8_blockscale_bpreshuffle_1x128x128_256x64x128x128_16x16_16x16_8x32x1_8x32x1_1x32x1x8_8_2x1_intrawave_v1,217.42,228.67,0.0
80,1536,8192,1536,ck,14,2,178.3647,a8w8_blockscale_bpreshuffle_1x128x128_256x64x128x128_16x16_16x16_8x32x1_8x32x1_1x32x1x8_8_2x1_intrawave_v1,216.72,224.87,0.0
80,1600,8192,1536,ck,14,1,180.2063,a8w8_blockscale_bpreshuffle_1x128x128_256x64x128x128_16x16_16x16_8x32x1_8x32x1_1x32x1x8_8_2x1_intrawave_v1,223.44,228.93,0.0
80,1664,8192,1536,ck,14,0,188.3759,a8w8_blockscale_bpreshuffle_1x128x128_256x64x128x128_16x16_16x16_8x32x1_8x32x1_1x32x1x8_8_2x1_intrawave_v1,222.3,225.09,0.0
80,1728,8192,1536,ck,14,1,196.5755,a8w8_blockscale_bpreshuffle_1x128x128_256x64x128x128_16x16_16x16_8x32x1_8x32x1_1x32x1x8_8_2x1_intrawave_v1,221.22,221.54,0.0
80,1792,8192,1536,ck,14,2,204.4983,a8w8_blockscale_bpreshuffle_1x128x128_256x64x128x128_16x16_16x16_8x32x1_8x32x1_1x32x1x8_8_2x1_intrawave_v1,220.53,218.56,0.0
80,1856,8192,1536,ck,14,3,213.6048,a8w8_blockscale_bpreshuffle_1x128x128_256x64x128x128_16x16_16x16_8x32x1_8x32x1_1x32x1x8_8_2x1_intrawave_v1,218.66,214.61,0.0
80,1920,8192,1536,ck,14,0,215.6348,a8w8_blockscale_bpreshuffle_1x128x128_256x64x128x128_16x16_16x16_8x32x1_8x32x1_1x32x1x8_8_2x1_intrawave_v1,224.08,217.91,0.0
80,1984,8192,1536,ck,14,0,224.6937,a8w8_blockscale_bpreshuffle_1x128x128_256x64x128x128_16x16_16x16_8x32x1_8x32x1_1x32x1x8_8_2x1_intrawave_v1,222.21,214.23,0.0
80,2048,8192,1536,ck,14,1,230.2685,a8w8_blockscale_bpreshuffle_1x128x128_256x64x128x128_16x16_16x16_8x32x1_8x32x1_1x32x1x8_8_2x1_intrawave_v1,223.82,214.02,0.0
80,4096,8192,1536,ck,14,2,451.4481,a8w8_blockscale_bpreshuffle_1x128x128_256x64x128x128_16x16_16x16_8x32x1_8x32x1_1x32x1x8_8_2x1_intrawave_v1,228.33,190.46,0.0
80,8192,8192,1536,ck,14,1,888.845,a8w8_blockscale_bpreshuffle_1x128x128_256x64x128x128_16x16_16x16_8x32x1_8x32x1_1x32x1x8_8_2x1_intrawave_v1,231.94,179.32,0.0
80,16384,8192,1536,ck,13,0,1750.2878,a8w8_blockscale_bpreshuffle_1x128x128_256x64x256x128_16x16_16x16_8x32x1_8x32x1_1x32x1x8_8_2x1_intrawave_v1,235.57,174.93,0.0
80,32768,8192,1536,ck,13,0,3467.3613,a8w8_blockscale_bpreshuffle_1x128x128_256x64x256x128_16x16_16x16_8x32x1_8x32x1_1x32x1x8_8_2x1_intrawave_v1,237.83,172.98,0.0
80,16,11264,1536,ck,7,0,10.5925,a8w8_blockscale_bpreshuffle_1x128x128_256x16x64x256_16x16_16x16_16x16x1_16x16x1_1x16x1x16_4_1x1_intrawave_v1,52.27,1669.72,0.0
80,32,11264,1536,ck,10,2,13.2879,a8w8_blockscale_bpreshuffle_1x128x128_256x32x64x128_16x16_16x16_8x32x1_8x32x1_1x32x1x8_8_2x1_intrawave_v1,83.33,1360.0,0.0
80,48,11264,1536,ck,6,1,19.0229,a8w8_blockscale_bpreshuffle_1x128x128_256x16x128x256_16x16_16x16_16x16x1_16x16x1_1x16x1x16_8_1x2_intrawave_v1,87.31,970.23,0.0
80,64,11264,1536,ck,9,3,20.5394,a8w8_blockscale_bpreshuffle_1x128x128_256x32x128x128_16x16_16x16_8x32x1_8x32x1_1x32x1x8_8_2x1_intrawave_v1,107.82,917.34,0.0
80,80,11264,1536,ck,9,1,24.5938,a8w8_blockscale_bpreshuffle_1x128x128_256x32x128x128_16x16_16x16_8x32x1_8x32x1_1x32x1x8_8_2x1_intrawave_v1,112.56,781.77,0.0
80,96,11264,1536,ck,9,0,24.7399,a8w8_blockscale_bpreshuffle_1x128x128_256x32x128x128_16x16_16x16_8x32x1_8x32x1_1x32x1x8_8_2x1_intrawave_v1,134.27,792.71,0.0
80,112,11264,1536,ck,9,0,30.5867,a8w8_blockscale_bpreshuffle_1x128x128_256x32x128x128_16x16_16x16_8x32x1_8x32x1_1x32x1x8_8_2x1_intrawave_v1,126.71,653.77,0.0
80,128,11264,1536,ck,9,1,30.3412,a8w8_blockscale_bpreshuffle_1x128x128_256x32x128x128_16x16_16x16_8x32x1_8x32x1_1x32x1x8_8_2x1_intrawave_v1,145.98,671.75,0.0
80,144,11264,1536,ck,8,0,34.0789,a8w8_blockscale_bpreshuffle_1x128x128_256x32x256x128_16x16_16x16_8x32x1_8x32x1_1x32x1x8_8_2x1_intrawave_v1,146.21,609.37,0.0
80,160,11264,1536,ck,9,1,34.958,a8w8_blockscale_bpreshuffle_1x128x128_256x32x128x128_16x16_16x16_8x32x1_8x32x1_1x32x1x8_8_2x1_intrawave_v1,158.38,605.06,0.0
80,176,11264,1536,ck,9,0,38.9934,a8w8_blockscale_bpreshuffle_1x128x128_256x32x128x128_16x16_16x16_8x32x1_8x32x1_1x32x1x8_8_2x1_intrawave_v1,156.18,552.32,0.0
80,192,11264,1536,ck,9,3,39.3879,a8w8_blockscale_bpreshuffle_1x128x128_256x32x128x128_16x16_16x16_8x32x1_8x32x1_1x32x1x8_8_2x1_intrawave_v1,168.68,556.56,0.0
80,208,11264,1536,ck,9,3,44.1068,a8w8_blockscale_bpreshuffle_1x128x128_256x32x128x128_16x16_16x16_8x32x1_8x32x1_1x32x1x8_8_2x1_intrawave_v1,163.18,505.75,0.0
80,224,11264,1536,ck,9,0,44.3709,a8w8_blockscale_bpreshuffle_1x128x128_256x32x128x128_16x16_16x16_8x32x1_8x32x1_1x32x1x8_8_2x1_intrawave_v1,174.69,511.41,0.0
80,240,11264,1536,ck,9,0,48.6637,a8w8_blockscale_bpreshuffle_1x128x128_256x32x128x128_16x16_16x16_8x32x1_8x32x1_1x32x1x8_8_2x1_intrawave_v1,170.66,474.21,0.0
80,256,11264,1536,ck,9,0,48.597,a8w8_blockscale_bpreshuffle_1x128x128_256x32x128x128_16x16_16x16_8x32x1_8x32x1_1x32x1x8_8_2x1_intrawave_v1,182.28,482.78,0.0
80,288,11264,1536,ck,9,1,52.8752,a8w8_blockscale_bpreshuffle_1x128x128_256x32x128x128_16x16_16x16_8x32x1_8x32x1_1x32x1x8_8_2x1_intrawave_v1,188.48,458.29,0.0
80,320,11264,1536,ck,9,0,58.5327,a8w8_blockscale_bpreshuffle_1x128x128_256x32x128x128_16x16_16x16_8x32x1_8x32x1_1x32x1x8_8_2x1_intrawave_v1,189.18,427.15,0.0
80,352,11264,1536,ck,9,1,66.1836,a8w8_blockscale_bpreshuffle_1x128x128_256x32x128x128_16x16_16x16_8x32x1_8x32x1_1x32x1x8_8_2x1_intrawave_v1,184.04,389.4,0.0
80,384,11264,1536,ck,14,2,68.4606,a8w8_blockscale_bpreshuffle_1x128x128_256x64x128x128_16x16_16x16_8x32x1_8x32x1_1x32x1x8_8_2x1_intrawave_v1,194.09,387.7,0.0
80,416,11264,1536,ck,9,0,75.1251,a8w8_blockscale_bpreshuffle_1x128x128_256x32x128x128_16x16_16x16_8x32x1_8x32x1_1x32x1x8_8_2x1_intrawave_v1,191.61,363.56,0.0
80,448,11264,1536,ck,14,2,77.1197,a8w8_blockscale_bpreshuffle_1x128x128_256x64x128x128_16x16_16x16_8x32x1_8x32x1_1x32x1x8_8_2x1_intrawave_v1,201.01,364.14,0.0
80,480,11264,1536,ck,9,0,85.6433,a8w8_blockscale_bpreshuffle_1x128x128_256x32x128x128_16x16_16x16_8x32x1_8x32x1_1x32x1x8_8_2x1_intrawave_v1,193.94,336.89,0.0
80,512,11264,1536,ck,14,0,85.6524,a8w8_blockscale_bpreshuffle_1x128x128_256x64x128x128_16x16_16x16_8x32x1_8x32x1_1x32x1x8_8_2x1_intrawave_v1,206.84,345.84,0.0
80,544,11264,1536,ck,9,1,94.2152,a8w8_blockscale_bpreshuffle_1x128x128_256x32x128x128_16x16_16x16_8x32x1_8x32x1_1x32x1x8_8_2x1_intrawave_v1,199.8,322.58,0.0
80,576,11264,1536,ck,14,2,94.5832,a8w8_blockscale_bpreshuffle_1x128x128_256x64x128x128_16x16_16x16_8x32x1_8x32x1_1x32x1x8_8_2x1_intrawave_v1,210.73,329.47,0.0
80,608,11264,1536,ck,9,3,102.5964,a8w8_blockscale_bpreshuffle_1x128x128_256x32x128x128_16x16_16x16_8x32x1_8x32x1_1x32x1x8_8_2x1_intrawave_v1,205.06,311.24,0.0
80,640,11264,1536,ck,14,0,103.6134,a8w8_blockscale_bpreshuffle_1x128x128_256x64x128x128_16x16_16x16_8x32x1_8x32x1_1x32x1x8_8_2x1_intrawave_v1,213.74,315.62,0.0
80,672,11264,1536,ck,9,1,115.2748,a8w8_blockscale_bpreshuffle_1x128x128_256x32x128x128_16x16_16x16_8x32x1_8x32x1_1x32x1x8_8_2x1_intrawave_v1,201.72,290.37,0.0
80,704,11264,1536,ck,9,3,118.6969,a8w8_blockscale_bpreshuffle_1x128x128_256x32x128x128_16x16_16x16_8x32x1_8x32x1_1x32x1x8_8_2x1_intrawave_v1,205.23,288.49,0.0
80,736,11264,1536,ck,9,0,123.0563,a8w8_blockscale_bpreshuffle_1x128x128_256x32x128x128_16x16_16x16_8x32x1_8x32x1_1x32x1x8_8_2x1_intrawave_v1,206.96,284.53,0.0
80,768,11264,1536,ck,9,2,127.82,a8w8_blockscale_bpreshuffle_1x128x128_256x32x128x128_16x16_16x16_8x32x1_8x32x1_1x32x1x8_8_2x1_intrawave_v1,207.91,279.95,0.0
80,800,11264,1536,ck,9,1,132.7991,a8w8_blockscale_bpreshuffle_1x128x128_256x32x128x128_16x16_16x16_8x32x1_8x32x1_1x32x1x8_8_2x1_intrawave_v1,208.45,275.25,0.0
80,832,11264,1536,ck,14,1,136.9369,a8w8_blockscale_bpreshuffle_1x128x128_256x64x128x128_16x16_16x16_8x32x1_8x32x1_1x32x1x8_8_2x1_intrawave_v1,210.24,272.55,0.0
80,864,11264,1536,ck,9,0,141.7019,a8w8_blockscale_bpreshuffle_1x128x128_256x32x128x128_16x16_16x16_8x32x1_8x32x1_1x32x1x8_8_2x1_intrawave_v1,210.99,268.82,0.0
80,896,11264,1536,ck,14,2,145.1565,a8w8_blockscale_bpreshuffle_1x128x128_256x64x128x128_16x16_16x16_8x32x1_8x32x1_1x32x1x8_8_2x1_intrawave_v1,213.59,267.73,0.0
80,928,11264,1536,ck,9,1,152.0454,a8w8_blockscale_bpreshuffle_1x128x128_256x32x128x128_16x16_16x16_8x32x1_8x32x1_1x32x1x8_8_2x1_intrawave_v1,211.2,260.66,0.0
80,960,11264,1536,ck,14,3,154.5607,a8w8_blockscale_bpreshuffle_1x128x128_256x64x128x128_16x16_16x16_8x32x1_8x32x1_1x32x1x8_8_2x1_intrawave_v1,214.92,261.41,0.0
80,992,11264,1536,ck,14,3,165.0761,a8w8_blockscale_bpreshuffle_1x128x128_256x64x128x128_16x16_16x16_8x32x1_8x32x1_1x32x1x8_8_2x1_intrawave_v1,207.94,249.42,0.0
80,1024,11264,1536,ck,14,2,162.3986,a8w8_blockscale_bpreshuffle_1x128x128_256x64x128x128_16x16_16x16_8x32x1_8x32x1_1x32x1x8_8_2x1_intrawave_v1,218.19,258.27,0.0
80,1088,11264,1536,ck,14,1,171.4212,a8w8_blockscale_bpreshuffle_1x128x128_256x64x128x128_16x16_16x16_8x32x1_8x32x1_1x32x1x8_8_2x1_intrawave_v1,219.62,253.66,0.0
80,1152,11264,1536,ck,14,2,180.4621,a8w8_blockscale_bpreshuffle_1x128x128_256x64x128x128_16x16_16x16_8x32x1_8x32x1_1x32x1x8_8_2x1_intrawave_v1,220.89,249.49,0.0
80,1216,11264,1536,ck,14,1,189.1773,a8w8_blockscale_bpreshuffle_1x128x128_256x64x128x128_16x16_16x16_8x32x1_8x32x1_1x32x1x8_8_2x1_intrawave_v1,222.42,246.14,0.0
80,1280,11264,1536,ck,14,2,197.9742,a8w8_blockscale_bpreshuffle_1x128x128_256x64x128x128_16x16_16x16_8x32x1_8x32x1_1x32x1x8_8_2x1_intrawave_v1,223.73,242.98,0.0
80,1344,11264,1536,ck,14,0,213.9509,a8w8_blockscale_bpreshuffle_1x128x128_256x64x128x128_16x16_16x16_8x32x1_8x32x1_1x32x1x8_8_2x1_intrawave_v1,217.37,232.03,0.0
80,1408,11264,1536,ck,14,2,221.829,a8w8_blockscale_bpreshuffle_1x128x128_256x64x128x128_16x16_16x16_8x32x1_8x32x1_1x32x1x8_8_2x1_intrawave_v1,219.63,230.73,0.0
80,1472,11264,1536,ck,14,0,230.8699,a8w8_blockscale_bpreshuffle_1x128x128_256x64x128x128_16x16_16x16_8x32x1_8x32x1_1x32x1x8_8_2x1_intrawave_v1,220.62,228.37,0.0
80,1536,11264,1536,ck,14,0,239.3468,a8w8_blockscale_bpreshuffle_1x128x128_256x64x128x128_16x16_16x16_8x32x1_8x32x1_1x32x1x8_8_2x1_intrawave_v1,222.06,226.72,0.0
80,1600,11264,1536,ck,14,0,248.7858,a8w8_blockscale_bpreshuffle_1x128x128_256x64x128x128_16x16_16x16_8x32x1_8x32x1_1x32x1x8_8_2x1_intrawave_v1,222.54,224.31,0.0
80,1664,11264,1536,ck,14,1,257.2367,a8w8_blockscale_bpreshuffle_1x128x128_256x64x128x128_16x16_16x16_8x32x1_8x32x1_1x32x1x8_8_2x1_intrawave_v1,223.84,222.92,0.0
80,1728,11264,1536,ck,14,2,266.1765,a8w8_blockscale_bpreshuffle_1x128x128_256x64x128x128_16x16_16x16_8x32x1_8x32x1_1x32x1x8_8_2x1_intrawave_v1,224.64,221.22,0.0
80,1792,11264,1536,ck,14,2,274.6632,a8w8_blockscale_bpreshuffle_1x128x128_256x64x128x128_16x16_16x16_8x32x1_8x32x1_1x32x1x8_8_2x1_intrawave_v1,225.76,219.99,0.0
80,1856,11264,1536,ck,14,3,284.1294,a8w8_blockscale_bpreshuffle_1x128x128_256x64x128x128_16x16_16x16_8x32x1_8x32x1_1x32x1x8_8_2x1_intrawave_v1,226.03,218.08,0.0
80,1920,11264,1536,ck,14,2,294.1162,a8w8_blockscale_bpreshuffle_1x128x128_256x64x128x128_16x16_16x16_8x32x1_8x32x1_1x32x1x8_8_2x1_intrawave_v1,225.89,215.92,0.0
80,1984,11264,1536,ck,14,2,311.0036,a8w8_blockscale_bpreshuffle_1x128x128_256x64x128x128_16x16_16x16_8x32x1_8x32x1_1x32x1x8_8_2x1_intrawave_v1,220.74,209.14,0.0
80,2048,11264,1536,ck,14,3,315.5353,a8w8_blockscale_bpreshuffle_1x128x128_256x64x128x128_16x16_16x16_8x32x1_8x32x1_1x32x1x8_8_2x1_intrawave_v1,224.59,211.02,0.0
80,4096,11264,1536,ck,14,2,614.8212,a8w8_blockscale_bpreshuffle_1x128x128_256x64x128x128_16x16_16x16_8x32x1_8x32x1_1x32x1x8_8_2x1_intrawave_v1,230.53,188.46,0.0
80,8192,11264,1536,ck,14,0,1214.1836,a8w8_blockscale_bpreshuffle_1x128x128_256x64x128x128_16x16_16x16_8x32x1_8x32x1_1x32x1x8_8_2x1_intrawave_v1,233.46,176.61,0.0
80,16384,11264,1536,ck,13,2,2400.2734,a8w8_blockscale_bpreshuffle_1x128x128_256x64x256x128_16x16_16x16_8x32x1_8x32x1_1x32x1x8_8_2x1_intrawave_v1,236.2,171.47,0.0
80,32768,11264,1536,ck,13,2,4773.0939,a8w8_blockscale_bpreshuffle_1x128x128_256x64x256x128_16x16_16x16_8x32x1_8x32x1_1x32x1x8_8_2x1_intrawave_v1,237.55,168.83,0.0
80,1,36864,7168,ck,6,2,81.0033,a8w8_blockscale_bpreshuffle_1x128x128_256x16x128x256_16x16_16x16_16x16x1_16x16x1_1x16x1x16_8_1x2_intrawave_v1,6.52,3263.1,0.0
80,2,36864,7168,ck,3,2,79.6093,a8w8_blockscale_bpreshuffle_1x128x128_256x16x256x128_8x16_16x16_16x16x1_8x32x1_1x16x1x16_8_1x2_intrawave_v1,13.28,3321.26,0.0
80,4,36864,7168,ck,3,0,80.8946,a8w8_blockscale_bpreshuffle_1x128x128_256x16x256x128_8x16_16x16_16x16x1_8x32x1_1x16x1x16_8_1x2_intrawave_v1,26.13,3270.49,0.0
80,8,36864,7168,ck,3,1,83.0602,a8w8_blockscale_bpreshuffle_1x128x128_256x16x256x128_8x16_16x16_16x16x1_8x32x1_1x16x1x16_8_1x2_intrawave_v1,50.9,3189.11,0.0
80,16,36864,7168,ck,3,2,85.2998,a8w8_blockscale_bpreshuffle_1x128x128_256x16x256x128_8x16_16x16_16x16x1_8x32x1_1x16x1x16_8_1x2_intrawave_v1,99.13,3112.97,0.0
80,32,36864,7168,ck,8,0,102.3943,a8w8_blockscale_bpreshuffle_1x128x128_256x32x256x128_16x16_16x16_8x32x1_8x32x1_1x32x1x8_8_2x1_intrawave_v1,165.16,2605.91,0.0
80,64,36864,7168,ck,13,0,152.2575,a8w8_blockscale_bpreshuffle_1x128x128_256x64x256x128_16x16_16x16_8x32x1_8x32x1_1x32x1x8_8_2x1_intrawave_v1,222.14,1769.49,0.0
80,128,36864,7168,asm,58,1,265.6663,_ZN5aiter43fp8gemm_bf16_blockscale_BpreShuffle_128x128E,254.63,1033.61,0.0
80,256,36864,7168,ck,14,2,512.1268,a8w8_blockscale_bpreshuffle_1x128x128_256x64x128x128_16x16_16x16_8x32x1_8x32x1_1x32x1x8_8_2x1_intrawave_v1,264.18,556.41,0.0
80,512,36864,7168,ck,14,1,968.2728,a8w8_blockscale_bpreshuffle_1x128x128_256x64x128x128_16x16_16x16_8x32x1_8x32x1_1x32x1x8_8_2x1_intrawave_v1,279.45,315.68,0.0
80,1024,36864,7168,asm,58,1,1872.3821,_ZN5aiter43fp8gemm_bf16_blockscale_BpreShuffle_128x128E,289.03,185.37,0.0
80,2048,36864,7168,asm,58,1,3739.5871,_ZN5aiter43fp8gemm_bf16_blockscale_BpreShuffle_128x128E,289.43,114.96,0.0
80,4096,36864,7168,asm,58,1,7439.1074,_ZN5aiter43fp8gemm_bf16_blockscale_BpreShuffle_128x128E,290.98,80.06,0.0
80,6144,36864,7168,asm,58,1,11122.1302,_ZN5aiter43fp8gemm_bf16_blockscale_BpreShuffle_128x128E,291.94,68.45,0.0
80,8120,36864,7168,asm,58,1,14827.2305,_ZN5aiter43fp8gemm_bf16_blockscale_BpreShuffle_128x128E,289.42,62.12,0.0
80,10240,36864,7168,asm,58,1,18495.6513,_ZN5aiter43fp8gemm_bf16_blockscale_BpreShuffle_128x128E,292.59,59.07,0.0
80,12288,36864,7168,asm,58,1,22212.5986,_ZN5aiter43fp8gemm_bf16_blockscale_BpreShuffle_128x128E,292.36,56.65,0.0
80,14336,36864,7168,asm,58,1,25924.0184,_ZN5aiter43fp8gemm_bf16_blockscale_BpreShuffle_128x128E,292.25,54.93,0.0
80,16384,36864,7168,asm,58,1,29650.9222,_ZN5aiter43fp8gemm_bf16_blockscale_BpreShuffle_128x128E,292.02,53.61,0.0
