aiter/configs/model_configs/a8w8_blockscale_tuned_gemm_qwen3_vl_32b_tp4.csv
gfx,cu_num,M,N,K,libtype,kernelId,splitK,us,kernelName,tflops,bw,errRatio
gfx942,304,16,2560,5120,ck,8,0,17.4553,a8w8_blockscale_1x128x128_256x16x64x256_16x16_16x16_1x1_16x16x1_16x16x1_1x16x1x16_4_1x1_intrawave_v1,24.03,760.29,0.0
gfx942,304,32,2560,5120,ck,8,0,17.4816,a8w8_blockscale_1x128x128_256x16x64x256_16x16_16x16_1x1_16x16x1_16x16x1_1x16x1x16_4_1x1_intrawave_v1,47.99,768.52,0.0
gfx942,304,48,2560,5120,ck,8,0,17.3029,a8w8_blockscale_1x128x128_256x16x64x256_16x16_16x16_1x1_16x16x1_16x16x1_1x16x1x16_4_1x1_intrawave_v1,72.72,785.92,0.0
gfx942,304,64,2560,5120,ck,8,0,17.3048,a8w8_blockscale_1x128x128_256x16x64x256_16x16_16x16_1x1_16x16x1_16x16x1_1x16x1x16_4_1x1_intrawave_v1,96.95,795.3,0.0
gfx942,304,80,2560,5120,ck,8,0,17.7669,a8w8_blockscale_1x128x128_256x16x64x256_16x16_16x16_1x1_16x16x1_16x16x1_1x16x1x16_4_1x1_intrawave_v1,118.04,783.84,0.0
gfx942,304,96,2560,5120,ck,8,0,17.3122,a8w8_blockscale_1x128x128_256x16x64x256_16x16_16x16_1x1_16x16x1_16x16x1_1x16x1x16_4_1x1_intrawave_v1,145.36,813.89,0.0
gfx942,304,112,2560,5120,ck,8,0,17.9891,a8w8_blockscale_1x128x128_256x16x64x256_16x16_16x16_1x1_16x16x1_16x16x1_1x16x1x16_4_1x1_intrawave_v1,163.21,792.37,0.0
gfx942,304,128,2560,5120,ck,18,0,21.8816,a8w8_blockscale_1x128x128_256x64x64x256_16x16_32x32_1x1_16x16x1_16x16x1_1x32x1x8_8_1x1_intrawave_v1,153.35,658.91,0.0
gfx942,304,144,2560,5120,ck,13,0,23.6102,a8w8_blockscale_1x128x128_256x32x64x256_16x16_16x16_2x1_16x16x1_16x16x1_1x32x1x8_8_2x1_intrawave_v1,159.88,617.6,0.0
gfx942,304,160,2560,5120,ck,13,0,22.646,a8w8_blockscale_1x128x128_256x32x64x256_16x16_16x16_2x1_16x16x1_16x16x1_1x32x1x8_8_2x1_intrawave_v1,185.21,651.13,0.0
gfx942,304,176,2560,5120,ck,18,0,23.8634,a8w8_blockscale_1x128x128_256x64x64x256_16x16_32x32_1x1_16x16x1_16x16x1_1x32x1x8_8_1x1_intrawave_v1,193.34,624.78,0.0
gfx942,304,192,2560,5120,ck,18,0,22.5378,a8w8_blockscale_1x128x128_256x64x64x256_16x16_32x32_1x1_16x16x1_16x16x1_1x32x1x8_8_1x1_intrawave_v1,223.32,668.8,0.0
gfx942,304,208,2560,5120,ck,13,0,24.099,a8w8_blockscale_1x128x128_256x32x64x256_16x16_16x16_2x1_16x16x1_16x16x1_1x32x1x8_8_2x1_intrawave_v1,226.26,632.27,0.0
gfx942,304,224,2560,5120,ck,13,0,23.712,a8w8_blockscale_1x128x128_256x32x64x256_16x16_16x16_2x1_16x16x1_16x16x1_1x32x1x8_8_2x1_intrawave_v1,247.64,649.5,0.0
gfx942,304,240,2560,5120,ck,18,0,25.4722,a8w8_blockscale_1x128x128_256x64x64x256_16x16_32x32_1x1_16x16x1_16x16x1_1x32x1x8_8_1x1_intrawave_v1,246.99,611.05,0.0
gfx942,304,256,2560,5120,ck,18,0,23.4163,a8w8_blockscale_1x128x128_256x64x64x256_16x16_32x32_1x1_16x16x1_16x16x1_1x32x1x8_8_1x1_intrawave_v1,286.59,671.7,0.0
gfx942,304,288,2560,5120,ck,18,0,27.3097,a8w8_blockscale_1x128x128_256x64x64x256_16x16_32x32_1x1_16x16x1_16x16x1_1x32x1x8_8_1x1_intrawave_v1,276.45,587.93,0.0
gfx942,304,320,2560,5120,ck,18,0,25.1021,a8w8_blockscale_1x128x128_256x64x64x256_16x16_32x32_1x1_16x16x1_16x16x1_1x32x1x8_8_1x1_intrawave_v1,334.18,652.69,0.0
gfx942,304,352,2560,5120,ck,18,0,29.7883,a8w8_blockscale_1x128x128_256x64x64x256_16x16_32x32_1x1_16x16x1_16x16x1_1x32x1x8_8_1x1_intrawave_v1,309.77,561.01,0.0
gfx942,304,384,2560,5120,ck,18,0,27.8341,a8w8_blockscale_1x128x128_256x64x64x256_16x16_32x32_1x1_16x16x1_16x16x1_1x32x1x8_8_1x1_intrawave_v1,361.65,612.18,0.0
gfx942,304,416,2560,5120,ck,18,0,31.8289,a8w8_blockscale_1x128x128_256x64x64x256_16x16_32x32_1x1_16x16x1_16x16x1_1x32x1x8_8_1x1_intrawave_v1,342.62,545.64,0.0
gfx942,304,448,2560,5120,ck,18,0,30.1215,a8w8_blockscale_1x128x128_256x64x64x256_16x16_32x32_1x1_16x16x1_16x16x1_1x32x1x8_8_1x1_intrawave_v1,389.89,587.44,0.0
gfx942,304,480,2560,5120,ck,12,0,35.7367,a8w8_blockscale_1x128x128_256x32x128x256_16x16_32x32_1x1_16x16x1_16x16x1_1x32x1x8_8_1x1_intrawave_v1,352.1,504.31,0.0
gfx942,304,512,2560,5120,ck,3,0,38.3182,a8w8_blockscale_1x128x128_256x64x64x128_16x16_32x32_1x1_8x32x1_8x32x1_1x32x1x8_8_1x1_intrawave_v3,350.27,478.89,0.0
gfx942,304,544,2560,5120,ck,3,0,42.5906,a8w8_blockscale_1x128x128_256x64x64x128_16x16_32x32_1x1_8x32x1_8x32x1_1x32x1x8_8_1x1_intrawave_v3,334.83,438.54,0.0
gfx942,304,576,2560,5120,ck,3,0,47.4246,a8w8_blockscale_1x128x128_256x64x64x128_16x16_32x32_1x1_8x32x1_8x32x1_1x32x1x8_8_1x1_intrawave_v3,318.39,400.75,0.0
gfx942,304,608,2560,5120,ck,2,0,44.6012,a8w8_blockscale_1x128x128_256x64x128x128_16x16_32x32_1x2_8x32x1_8x32x1_1x32x1x8_8_1x1_intrawave_v3,357.35,433.47,0.0
gfx942,304,640,2560,5120,ck,3,0,48.1164,a8w8_blockscale_1x128x128_256x64x64x128_16x16_32x32_1x1_8x32x1_8x32x1_1x32x1x8_8_1x1_intrawave_v3,348.68,408.61,0.0
gfx942,304,672,2560,5120,ck,2,0,45.3679,a8w8_blockscale_1x128x128_256x64x128x128_16x16_32x32_1x2_8x32x1_8x32x1_1x32x1x8_8_1x1_intrawave_v3,388.29,440.59,0.0
gfx942,304,704,2560,5120,ck,3,0,48.6019,a8w8_blockscale_1x128x128_256x64x64x128_16x16_32x32_1x1_8x32x1_8x32x1_1x32x1x8_8_1x1_intrawave_v3,379.72,418.01,0.0
gfx942,304,736,2560,5120,ck,2,0,48.1618,a8w8_blockscale_1x128x128_256x64x128x128_16x16_32x32_1x2_8x32x1_8x32x1_1x32x1x8_8_1x1_intrawave_v3,400.6,428.64,0.0
gfx942,304,768,2560,5120,ck,3,0,47.6742,a8w8_blockscale_1x128x128_256x64x64x128_16x16_32x32_1x1_8x32x1_8x32x1_1x32x1x8_8_1x1_intrawave_v3,422.3,439.89,0.0
gfx942,304,800,2560,5120,ck,2,0,48.4625,a8w8_blockscale_1x128x128_256x64x128x128_16x16_32x32_1x2_8x32x1_8x32x1_1x32x1x8_8_1x1_intrawave_v3,432.74,439.5,0.0
gfx942,304,832,2560,5120,ck,2,0,52.0427,a8w8_blockscale_1x128x128_256x64x128x128_16x16_32x32_1x2_8x32x1_8x32x1_1x32x1x8_8_1x1_intrawave_v3,419.09,415.56,0.0
gfx942,304,864,2560,5120,ck,2,0,50.8349,a8w8_blockscale_1x128x128_256x64x128x128_16x16_32x32_1x2_8x32x1_8x32x1_1x32x1x8_8_1x1_intrawave_v3,445.55,431.88,0.0
gfx942,304,896,2560,5120,ck,2,0,53.3725,a8w8_blockscale_1x128x128_256x64x128x128_16x16_32x32_1x2_8x32x1_8x32x1_1x32x1x8_8_1x1_intrawave_v3,440.08,417.49,0.0
gfx942,304,928,2560,5120,ck,2,0,50.5741,a8w8_blockscale_1x128x128_256x64x128x128_16x16_32x32_1x2_8x32x1_8x32x1_1x32x1x8_8_1x1_intrawave_v3,481.02,447.07,0.0
gfx942,304,960,2560,5120,ck,2,0,54.5507,a8w8_blockscale_1x128x128_256x64x128x128_16x16_32x32_1x2_8x32x1_8x32x1_1x32x1x8_8_1x1_intrawave_v3,461.33,420.48,0.0
gfx942,304,992,2560,5120,ck,2,0,65.6979,a8w8_blockscale_1x128x128_256x64x128x128_16x16_32x32_1x2_8x32x1_8x32x1_1x32x1x8_8_1x1_intrawave_v3,395.82,354.13,0.0
gfx942,304,1024,2560,5120,ck,3,0,63.3561,a8w8_blockscale_1x128x128_256x64x64x128_16x16_32x32_1x1_8x32x1_8x32x1_1x32x1x8_8_1x1_intrawave_v3,423.69,372.39,0.0
gfx942,304,1088,2560,5120,ck,0,0,62.9342,a8w8_blockscale_1x128x128_256x128x128x128_16x16_32x32_2x2_8x32x1_8x32x1_1x32x1x8_8_1x1_intrawave_v3,453.19,385.3,0.0
gfx942,304,1152,2560,5120,ck,2,0,70.8472,a8w8_blockscale_1x128x128_256x64x128x128_16x16_32x32_1x2_8x32x1_8x32x1_1x32x1x8_8_1x1_intrawave_v3,426.26,351.51,0.0
gfx942,304,1216,2560,5120,ck,0,0,63.6144,a8w8_blockscale_1x128x128_256x128x128x128_16x16_32x32_2x2_8x32x1_8x32x1_1x32x1x8_8_1x1_intrawave_v3,501.09,401.78,0.0
gfx942,304,1280,2560,5120,ck,3,0,71.1042,a8w8_blockscale_1x128x128_256x64x64x128_16x16_32x32_1x1_8x32x1_8x32x1_1x32x1x8_8_1x1_intrawave_v3,471.91,368.68,0.0
gfx942,304,1344,2560,5120,ck,0,0,65.6346,a8w8_blockscale_1x128x128_256x128x128x128_16x16_32x32_2x2_8x32x1_8x32x1_1x32x1x8_8_1x1_intrawave_v3,536.79,409.38,0.0
gfx942,304,1408,2560,5120,ck,0,0,75.087,a8w8_blockscale_1x128x128_256x128x128x128_16x16_32x32_2x2_8x32x1_8x32x1_1x32x1x8_8_1x1_intrawave_v3,491.56,366.58,0.0
gfx942,304,1472,2560,5120,ck,0,0,68.914,a8w8_blockscale_1x128x128_256x128x128x128_16x16_32x32_2x2_8x32x1_8x32x1_1x32x1x8_8_1x1_intrawave_v3,559.94,408.92,0.0
gfx942,304,1536,2560,5120,ck,2,0,75.2363,a8w8_blockscale_1x128x128_256x64x128x128_16x16_32x32_1x2_8x32x1_8x32x1_1x32x1x8_8_1x1_intrawave_v3,535.18,383.27,0.0
gfx942,304,1600,2560,5120,ck,0,0,69.0275,a8w8_blockscale_1x128x128_256x128x128x128_16x16_32x32_2x2_8x32x1_8x32x1_1x32x1x8_8_1x1_intrawave_v3,607.63,427.24,0.0
gfx942,304,1664,2560,5120,ck,0,0,78.2795,a8w8_blockscale_1x128x128_256x128x128x128_16x16_32x32_2x2_8x32x1_8x32x1_1x32x1x8_8_1x1_intrawave_v3,557.24,385.11,0.0
gfx942,304,1728,2560,5120,ck,0,0,73.5028,a8w8_blockscale_1x128x128_256x128x128x128_16x16_32x32_2x2_8x32x1_8x32x1_1x32x1x8_8_1x1_intrawave_v3,616.28,419.06,0.0
gfx942,304,1792,2560,5120,ck,2,0,80.3322,a8w8_blockscale_1x128x128_256x64x128x128_16x16_32x32_1x2_8x32x1_8x32x1_1x32x1x8_8_1x1_intrawave_v3,584.77,391.59,0.0
gfx942,304,1856,2560,5120,ck,0,0,73.1425,a8w8_blockscale_1x128x128_256x128x128x128_16x16_32x32_2x2_8x32x1_8x32x1_1x32x1x8_8_1x1_intrawave_v3,665.19,439.04,0.0
gfx942,304,1920,2560,5120,ck,0,0,81.3369,a8w8_blockscale_1x128x128_256x128x128x128_16x16_32x32_2x2_8x32x1_8x32x1_1x32x1x8_8_1x1_intrawave_v3,618.8,402.87,0.0
gfx942,304,1984,2560,5120,ck,0,0,95.4611,a8w8_blockscale_1x128x128_256x128x128x128_16x16_32x32_2x2_8x32x1_8x32x1_1x32x1x8_8_1x1_intrawave_v3,544.82,350.13,0.0
gfx942,304,2048,2560,5120,ck,0,0,99.9013,a8w8_blockscale_1x128x128_256x128x128x128_16x16_32x32_2x2_8x32x1_8x32x1_1x32x1x8_8_1x1_intrawave_v3,537.4,341.12,0.0
gfx942,304,2112,2560,5120,ck,0,0,105.9151,a8w8_blockscale_1x128x128_256x128x128x128_16x16_32x32_2x2_8x32x1_8x32x1_1x32x1x8_8_1x1_intrawave_v3,522.73,327.94,0.0
gfx942,304,2176,2560,5120,ck,0,0,103.2024,a8w8_blockscale_1x128x128_256x128x128x128_16x16_32x32_2x2_8x32x1_8x32x1_1x32x1x8_8_1x1_intrawave_v3,552.72,342.91,0.0
gfx942,304,2240,2560,5120,ck,0,0,105.2002,a8w8_blockscale_1x128x128_256x128x128x128_16x16_32x32_2x2_8x32x1_8x32x1_1x32x1x8_8_1x1_intrawave_v3,558.18,342.63,0.0
gfx942,304,2304,2560,5120,ck,0,0,105.7908,a8w8_blockscale_1x128x128_256x128x128x128_16x16_32x32_2x2_8x32x1_8x32x1_1x32x1x8_8_1x1_intrawave_v3,570.92,346.91,0.0
gfx942,304,2368,2560,5120,ck,0,0,110.456,a8w8_blockscale_1x128x128_256x128x128x128_16x16_32x32_2x2_8x32x1_8x32x1_1x32x1x8_8_1x1_intrawave_v3,561.99,338.19,0.0
gfx942,304,2432,2560,5120,ck,0,0,106.9283,a8w8_blockscale_1x128x128_256x128x128x128_16x16_32x32_2x2_8x32x1_8x32x1_1x32x1x8_8_1x1_intrawave_v3,596.23,355.48,0.0
gfx942,304,2496,2560,5120,ck,0,0,107.2766,a8w8_blockscale_1x128x128_256x128x128x128_16x16_32x32_2x2_8x32x1_8x32x1_1x32x1x8_8_1x1_intrawave_v3,609.93,360.43,0.0
gfx942,304,2560,2560,5120,ck,0,0,107.2602,a8w8_blockscale_1x128x128_256x128x128x128_16x16_32x32_2x2_8x32x1_8x32x1_1x32x1x8_8_1x1_intrawave_v3,625.66,366.6,0.0
gfx942,304,2624,2560,5120,ck,0,0,109.5413,a8w8_blockscale_1x128x128_256x128x128x128_16x16_32x32_2x2_8x32x1_8x32x1_1x32x1x8_8_1x1_intrawave_v3,627.95,364.95,0.0
gfx942,304,2688,2560,5120,ck,0,0,112.1636,a8w8_blockscale_1x128x128_256x128x128x128_16x16_32x32_2x2_8x32x1_8x32x1_1x32x1x8_8_1x1_intrawave_v3,628.23,362.26,0.0
gfx942,304,2752,2560,5120,ck,0,0,108.1775,a8w8_blockscale_1x128x128_256x128x128x128_16x16_32x32_2x2_8x32x1_8x32x1_1x32x1x8_8_1x1_intrawave_v3,666.89,381.67,0.0
gfx942,304,2816,2560,5120,ck,0,0,110.3004,a8w8_blockscale_1x128x128_256x128x128x128_16x16_32x32_2x2_8x32x1_8x32x1_1x32x1x8_8_1x1_intrawave_v3,669.26,380.26,0.0
gfx942,304,2880,2560,5120,ck,0,0,113.6447,a8w8_blockscale_1x128x128_256x128x128x128_16x16_32x32_2x2_8x32x1_8x32x1_1x32x1x8_8_1x1_intrawave_v3,664.33,374.84,0.0
gfx942,304,2944,2560,5120,ck,0,0,114.321,a8w8_blockscale_1x128x128_256x128x128x128_16x16_32x32_2x2_8x32x1_8x32x1_1x32x1x8_8_1x1_intrawave_v3,675.07,378.35,0.0
gfx942,304,3008,2560,5120,ck,0,0,114.4052,a8w8_blockscale_1x128x128_256x128x128x128_16x16_32x32_2x2_8x32x1_8x32x1_1x32x1x8_8_1x1_intrawave_v3,689.24,383.8,0.0
gfx942,304,3072,2560,5120,ck,0,0,114.0885,a8w8_blockscale_1x128x128_256x128x128x128_16x16_32x32_2x2_8x32x1_8x32x1_1x32x1x8_8_1x1_intrawave_v3,705.86,390.61,0.0
gfx942,304,3136,2560,5120,ck,0,0,120.2614,a8w8_blockscale_1x128x128_256x128x128x128_16x16_32x32_2x2_8x32x1_8x32x1_1x32x1x8_8_1x1_intrawave_v3,683.58,376.01,0.0
gfx942,304,3200,2560,5120,ck,0,0,120.4757,a8w8_blockscale_1x128x128_256x128x128x128_16x16_32x32_2x2_8x32x1_8x32x1_1x32x1x8_8_1x1_intrawave_v3,696.29,380.78,0.0
gfx942,304,3264,2560,5120,ck,0,0,119.0697,a8w8_blockscale_1x128x128_256x128x128x128_16x16_32x32_2x2_8x32x1_8x32x1_1x32x1x8_8_1x1_intrawave_v3,718.6,390.78,0.0
gfx942,304,3328,2560,5120,ck,0,0,118.9679,a8w8_blockscale_1x128x128_256x128x128x128_16x16_32x32_2x2_8x32x1_8x32x1_1x32x1x8_8_1x1_intrawave_v3,733.32,396.63,0.0
gfx942,304,3392,2560,5120,ck,0,0,120.7058,a8w8_blockscale_1x128x128_256x128x128x128_16x16_32x32_2x2_8x32x1_8x32x1_1x32x1x8_8_1x1_intrawave_v3,736.66,396.35,0.0
gfx942,304,3456,2560,5120,ck,0,0,120.7701,a8w8_blockscale_1x128x128_256x128x128x128_16x16_32x32_2x2_8x32x1_8x32x1_1x32x1x8_8_1x1_intrawave_v3,750.16,401.56,0.0
gfx942,304,3520,2560,5120,ck,0,0,125.4117,a8w8_blockscale_1x128x128_256x128x128x128_16x16_32x32_2x2_8x32x1_8x32x1_1x32x1x8_8_1x1_intrawave_v3,735.77,391.93,0.0
gfx942,304,3584,2560,5120,ck,0,0,122.868,a8w8_blockscale_1x128x128_256x128x128x128_16x16_32x32_2x2_8x32x1_8x32x1_1x32x1x8_8_1x1_intrawave_v3,764.66,405.37,0.0
gfx942,304,3648,2560,5120,ck,0,0,126.5882,a8w8_blockscale_1x128x128_256x128x128x128_16x16_32x32_2x2_8x32x1_8x32x1_1x32x1x8_8_1x1_intrawave_v3,755.44,398.64,0.0
gfx942,304,3712,2560,5120,ck,0,0,125.0587,a8w8_blockscale_1x128x128_256x128x128x128_16x16_32x32_2x2_8x32x1_8x32x1_1x32x1x8_8_1x1_intrawave_v3,778.1,408.75,0.0
gfx942,304,3776,2560,5120,ck,0,0,133.2897,a8w8_blockscale_1x128x128_256x128x128x128_16x16_32x32_2x2_8x32x1_8x32x1_1x32x1x8_8_1x1_intrawave_v3,742.63,388.43,0.0
gfx942,304,3840,2560,5120,ck,0,0,134.9555,a8w8_blockscale_1x128x128_256x128x128x128_16x16_32x32_2x2_8x32x1_8x32x1_1x32x1x8_8_1x1_intrawave_v3,745.9,388.49,0.0
gfx942,304,3904,2560,5120,ck,2,0,177.1739,a8w8_blockscale_1x128x128_256x64x128x128_16x16_32x32_1x2_8x32x1_8x32x1_1x32x1x8_8_1x1_intrawave_v3,577.63,299.62,0.0
gfx942,304,3968,2560,5120,ck,2,0,178.5585,a8w8_blockscale_1x128x128_256x64x128x128_16x16_32x32_1x2_8x32x1_8x32x1_1x32x1x8_8_1x1_intrawave_v3,582.55,300.96,0.0
gfx942,304,4032,2560,5120,ck,0,0,178.8716,a8w8_blockscale_1x128x128_256x128x128x128_16x16_32x32_2x2_8x32x1_8x32x1_1x32x1x8_8_1x1_intrawave_v3,590.91,304.1,0.0
gfx942,304,4096,2560,5120,ck,0,0,181.4554,a8w8_blockscale_1x128x128_256x128x128x128_16x16_32x32_2x2_8x32x1_8x32x1_1x32x1x8_8_1x1_intrawave_v3,591.74,303.38,0.0
gfx942,304,4224,2560,5120,ck,0,0,180.7696,a8w8_blockscale_1x128x128_256x128x128x128_16x16_32x32_2x2_8x32x1_8x32x1_1x32x1x8_8_1x1_intrawave_v3,612.55,311.78,0.0
gfx942,304,4352,2560,5120,ck,0,0,178.0189,a8w8_blockscale_1x128x128_256x128x128x128_16x16_32x32_2x2_8x32x1_8x32x1_1x32x1x8_8_1x1_intrawave_v3,640.86,323.96,0.0
gfx942,304,4480,2560,5120,ck,0,0,172.7887,a8w8_blockscale_1x128x128_256x128x128x128_16x16_32x32_2x2_8x32x1_8x32x1_1x32x1x8_8_1x1_intrawave_v3,679.68,341.36,0.0
gfx942,304,4608,2560,5120,ck,0,0,175.0289,a8w8_blockscale_1x128x128_256x128x128x128_16x16_32x32_2x2_8x32x1_8x32x1_1x32x1x8_8_1x1_intrawave_v3,690.15,344.48,0.0
gfx942,304,4736,2560,5120,ck,0,0,178.3295,a8w8_blockscale_1x128x128_256x128x128x128_16x16_32x32_2x2_8x32x1_8x32x1_1x32x1x8_8_1x1_intrawave_v3,696.19,345.45,0.0
gfx942,304,4864,2560,5120,ck,0,0,180.1209,a8w8_blockscale_1x128x128_256x128x128x128_16x16_32x32_2x2_8x32x1_8x32x1_1x32x1x8_8_1x1_intrawave_v3,707.9,349.29,0.0
gfx942,304,4992,2560,5120,ck,0,0,179.3835,a8w8_blockscale_1x128x128_256x128x128x128_16x16_32x32_2x2_8x32x1_8x32x1_1x32x1x8_8_1x1_intrawave_v3,729.51,358.03,0.0
gfx942,304,5120,2560,5120,ck,0,0,181.3989,a8w8_blockscale_1x128x128_256x128x128x128_16x16_32x32_2x2_8x32x1_8x32x1_1x32x1x8_8_1x1_intrawave_v3,739.9,361.28,0.0
gfx942,304,5248,2560,5120,ck,0,0,186.7298,a8w8_blockscale_1x128x128_256x128x128x128_16x16_32x32_2x2_8x32x1_8x32x1_1x32x1x8_8_1x1_intrawave_v3,736.75,357.99,0.0
gfx942,304,5376,2560,5120,ck,0,0,192.3206,a8w8_blockscale_1x128x128_256x128x128x128_16x16_32x32_2x2_8x32x1_8x32x1_1x32x1x8_8_1x1_intrawave_v3,732.78,354.39,0.0
gfx942,304,5504,2560,5120,ck,0,0,192.4298,a8w8_blockscale_1x128x128_256x128x128x128_16x16_32x32_2x2_8x32x1_8x32x1_1x32x1x8_8_1x1_intrawave_v3,749.8,361.01,0.0
gfx942,304,5632,2560,5120,ck,0,0,193.7237,a8w8_blockscale_1x128x128_256x128x128x128_16x16_32x32_2x2_8x32x1_8x32x1_1x32x1x8_8_1x1_intrawave_v3,762.11,365.36,0.0
gfx942,304,5760,2560,5120,ck,0,0,204.2422,a8w8_blockscale_1x128x128_256x128x128x128_16x16_32x32_2x2_8x32x1_8x32x1_1x32x1x8_8_1x1_intrawave_v3,739.29,352.96,0.0
gfx942,304,5888,2560,5120,ck,0,0,232.7358,a8w8_blockscale_1x128x128_256x128x128x128_16x16_32x32_2x2_8x32x1_8x32x1_1x32x1x8_8_1x1_intrawave_v3,663.2,315.38,0.0
gfx942,304,6016,2560,5120,ck,0,0,231.8226,a8w8_blockscale_1x128x128_256x128x128x128_16x16_32x32_2x2_8x32x1_8x32x1_1x32x1x8_8_1x1_intrawave_v3,680.29,322.28,0.0
gfx942,304,6144,2560,5120,ck,0,0,225.7263,a8w8_blockscale_1x128x128_256x128x128x128_16x16_32x32_2x2_8x32x1_8x32x1_1x32x1x8_8_1x1_intrawave_v3,713.52,336.79,0.0
gfx942,304,6272,2560,5120,ck,0,0,230.4221,a8w8_blockscale_1x128x128_256x128x128x128_16x16_32x32_2x2_8x32x1_8x32x1_1x32x1x8_8_1x1_intrawave_v3,713.55,335.61,0.0
gfx942,304,6400,2560,5120,ck,0,0,231.8572,a8w8_blockscale_1x128x128_256x128x128x128_16x16_32x32_2x2_8x32x1_8x32x1_1x32x1x8_8_1x1_intrawave_v3,723.6,339.19,0.0
gfx942,304,6528,2560,5120,ck,0,0,231.8925,a8w8_blockscale_1x128x128_256x128x128x128_16x16_32x32_2x2_8x32x1_8x32x1_1x32x1x8_8_1x1_intrawave_v3,737.96,344.79,0.0
gfx942,304,6656,2560,5120,ck,0,0,237.1109,a8w8_blockscale_1x128x128_256x128x128x128_16x16_32x32_2x2_8x32x1_8x32x1_1x32x1x8_8_1x1_intrawave_v3,735.87,342.73,0.0
gfx942,304,6784,2560,5120,ck,0,0,238.1178,a8w8_blockscale_1x128x128_256x128x128x128_16x16_32x32_2x2_8x32x1_8x32x1_1x32x1x8_8_1x1_intrawave_v3,746.85,346.78,0.0
gfx942,304,6912,2560,5120,ck,0,0,244.3444,a8w8_blockscale_1x128x128_256x128x128x128_16x16_32x32_2x2_8x32x1_8x32x1_1x32x1x8_8_1x1_intrawave_v3,741.55,343.31,0.0
gfx942,304,7040,2560,5120,ck,0,0,243.9498,a8w8_blockscale_1x128x128_256x128x128x128_16x16_32x32_2x2_8x32x1_8x32x1_1x32x1x8_8_1x1_intrawave_v3,756.51,349.24,0.0
gfx942,304,7168,2560,5120,ck,0,0,247.5213,a8w8_blockscale_1x128x128_256x128x128x128_16x16_32x32_2x2_8x32x1_8x32x1_1x32x1x8_8_1x1_intrawave_v3,759.15,349.5,0.0
gfx942,304,7296,2560,5120,ck,0,0,248.7977,a8w8_blockscale_1x128x128_256x128x128x128_16x16_32x32_2x2_8x32x1_8x32x1_1x32x1x8_8_1x1_intrawave_v3,768.74,352.97,0.0
gfx942,304,7424,2560,5120,ck,0,0,254.5227,a8w8_blockscale_1x128x128_256x128x128x128_16x16_32x32_2x2_8x32x1_8x32x1_1x32x1x8_8_1x1_intrawave_v3,764.63,350.18,0.0
gfx942,304,7552,2560,5120,ck,0,0,254.4315,a8w8_blockscale_1x128x128_256x128x128x128_16x16_32x32_2x2_8x32x1_8x32x1_1x32x1x8_8_1x1_intrawave_v3,778.09,355.46,0.0
gfx942,304,7680,2560,5120,ck,0,0,260.9039,a8w8_blockscale_1x128x128_256x128x128x128_16x16_32x32_2x2_8x32x1_8x32x1_1x32x1x8_8_1x1_intrawave_v3,771.65,351.66,0.0
gfx942,304,7808,2560,5120,ck,0,0,285.7383,a8w8_blockscale_1x128x128_256x128x128x128_16x16_32x32_2x2_8x32x1_8x32x1_1x32x1x8_8_1x1_intrawave_v3,716.33,325.69,0.0
gfx942,304,7936,2560,5120,ck,0,0,289.3136,a8w8_blockscale_1x128x128_256x128x128x128_16x16_32x32_2x2_8x32x1_8x32x1_1x32x1x8_8_1x1_intrawave_v3,719.07,326.19,0.0
gfx942,304,8064,2560,5120,ck,0,0,282.4878,a8w8_blockscale_1x128x128_256x128x128x128_16x16_32x32_2x2_8x32x1_8x32x1_1x32x1x8_8_1x1_intrawave_v3,748.33,338.71,0.0
gfx942,304,8192,2560,5120,ck,0,0,285.7861,a8w8_blockscale_1x128x128_256x128x128x128_16x16_32x32_2x2_8x32x1_8x32x1_1x32x1x8_8_1x1_intrawave_v3,751.43,339.39,0.0
gfx942,304,8320,2560,5120,ck,0,0,299.2714,a8w8_blockscale_1x128x128_256x128x128x128_16x16_32x32_2x2_8x32x1_8x32x1_1x32x1x8_8_1x1_intrawave_v3,728.78,328.48,0.0
gfx942,304,8448,2560,5120,ck,0,0,299.2756,a8w8_blockscale_1x128x128_256x128x128x128_16x16_32x32_2x2_8x32x1_8x32x1_1x32x1x8_8_1x1_intrawave_v3,739.98,332.85,0.0
gfx942,304,8576,2560,5120,ck,0,0,294.5097,a8w8_blockscale_1x128x128_256x128x128x128_16x16_32x32_2x2_8x32x1_8x32x1_1x32x1x8_8_1x1_intrawave_v3,763.35,342.69,0.0
gfx942,304,8704,2560,5120,ck,0,0,304.6811,a8w8_blockscale_1x128x128_256x128x128x128_16x16_32x32_2x2_8x32x1_8x32x1_1x32x1x8_8_1x1_intrawave_v3,748.88,335.55,0.0
gfx942,304,8832,2560,5120,ck,0,0,301.6697,a8w8_blockscale_1x128x128_256x128x128x128_16x16_32x32_2x2_8x32x1_8x32x1_1x32x1x8_8_1x1_intrawave_v3,767.48,343.25,0.0
gfx942,304,8960,2560,5120,ck,0,0,310.3472,a8w8_blockscale_1x128x128_256x128x128x128_16x16_32x32_2x2_8x32x1_8x32x1_1x32x1x8_8_1x1_intrawave_v3,756.83,337.87,0.0
gfx942,304,9088,2560,5120,ck,0,0,302.6947,a8w8_blockscale_1x128x128_256x128x128x128_16x16_32x32_2x2_8x32x1_8x32x1_1x32x1x8_8_1x1_intrawave_v3,787.05,350.74,0.0
gfx942,304,9216,2560,5120,ck,0,0,306.1601,a8w8_blockscale_1x128x128_256x128x128x128_16x16_32x32_2x2_8x32x1_8x32x1_1x32x1x8_8_1x1_intrawave_v3,789.1,351.06,0.0
gfx942,304,9344,2560,5120,ck,0,0,313.9858,a8w8_blockscale_1x128x128_256x128x128x128_16x16_32x32_2x2_8x32x1_8x32x1_1x32x1x8_8_1x1_intrawave_v3,780.12,346.48,0.0
gfx942,304,9472,2560,5120,ck,0,0,322.3451,a8w8_blockscale_1x128x128_256x128x128x128_16x16_32x32_2x2_8x32x1_8x32x1_1x32x1x8_8_1x1_intrawave_v3,770.3,341.56,0.0
gfx942,304,9600,2560,5120,ck,0,0,319.9815,a8w8_blockscale_1x128x128_256x128x128x128_16x16_32x32_2x2_8x32x1_8x32x1_1x32x1x8_8_1x1_intrawave_v3,786.48,348.18,0.0
gfx942,304,9728,2560,5120,ck,0,0,329.3288,a8w8_blockscale_1x128x128_256x128x128x128_16x16_32x32_2x2_8x32x1_8x32x1_1x32x1x8_8_1x1_intrawave_v3,774.34,342.28,0.0
gfx942,304,9856,2560,5120,ck,0,0,347.3409,a8w8_blockscale_1x128x128_256x128x128x128_16x16_32x32_2x2_8x32x1_8x32x1_1x32x1x8_8_1x1_intrawave_v3,743.85,328.3,0.0
gfx942,304,9984,2560,5120,ck,0,0,352.8189,a8w8_blockscale_1x128x128_256x128x128x128_16x16_32x32_2x2_8x32x1_8x32x1_1x32x1x8_8_1x1_intrawave_v3,741.81,326.92,0.0
gfx942,304,10112,2560,5120,ck,0,0,344.8067,a8w8_blockscale_1x128x128_256x128x128x128_16x16_32x32_2x2_8x32x1_8x32x1_1x32x1x8_8_1x1_intrawave_v3,768.78,338.32,0.0
gfx942,304,10240,2560,5120,ck,0,0,351.6225,a8w8_blockscale_1x128x128_256x128x128x128_16x16_32x32_2x2_8x32x1_8x32x1_1x32x1x8_8_1x1_intrawave_v3,763.42,335.49,0.0
gfx942,304,10368,2560,5120,ck,0,0,355.2678,a8w8_blockscale_1x128x128_256x128x128x128_16x16_32x32_2x2_8x32x1_8x32x1_1x32x1x8_8_1x1_intrawave_v3,765.03,335.73,0.0
gfx942,304,10496,2560,5120,ck,0,0,359.9446,a8w8_blockscale_1x128x128_256x128x128x128_16x16_32x32_2x2_8x32x1_8x32x1_1x32x1x8_8_1x1_intrawave_v3,764.41,335.01,0.0
gfx942,304,10624,2560,5120,ck,0,0,358.4093,a8w8_blockscale_1x128x128_256x128x128x128_16x16_32x32_2x2_8x32x1_8x32x1_1x32x1x8_8_1x1_intrawave_v3,777.05,340.11,0.0
gfx942,304,10752,2560,5120,ck,0,0,362.4871,a8w8_blockscale_1x128x128_256x128x128x128_16x16_32x32_2x2_8x32x1_8x32x1_1x32x1x8_8_1x1_intrawave_v3,777.56,339.9,0.0
gfx942,304,10880,2560,5120,ck,0,0,365.9865,a8w8_blockscale_1x128x128_256x128x128x128_16x16_32x32_2x2_8x32x1_8x32x1_1x32x1x8_8_1x1_intrawave_v3,779.3,340.23,0.0
gfx942,304,11008,2560,5120,ck,0,0,363.5036,a8w8_blockscale_1x128x128_256x128x128x128_16x16_32x32_2x2_8x32x1_8x32x1_1x32x1x8_8_1x1_intrawave_v3,793.85,346.16,0.0
gfx942,304,11136,2560,5120,ck,0,0,369.1549,a8w8_blockscale_1x128x128_256x128x128x128_16x16_32x32_2x2_8x32x1_8x32x1_1x32x1x8_8_1x1_intrawave_v3,790.79,344.41,0.0
gfx942,304,11264,2560,5120,ck,0,0,370.9225,a8w8_blockscale_1x128x128_256x128x128x128_16x16_32x32_2x2_8x32x1_8x32x1_1x32x1x8_8_1x1_intrawave_v3,796.07,346.3,0.0
gfx942,304,11392,2560,5120,ck,0,0,380.1644,a8w8_blockscale_1x128x128_256x128x128x128_16x16_32x32_2x2_8x32x1_8x32x1_1x32x1x8_8_1x1_intrawave_v3,785.54,341.33,0.0
gfx942,304,11520,2560,5120,ck,0,0,384.4397,a8w8_blockscale_1x128x128_256x128x128x128_16x16_32x32_2x2_8x32x1_8x32x1_1x32x1x8_8_1x1_intrawave_v3,785.53,340.94,0.0
gfx942,304,11648,2560,5120,ck,0,0,394.1854,a8w8_blockscale_1x128x128_256x128x128x128_16x16_32x32_2x2_8x32x1_8x32x1_1x32x1x8_8_1x1_intrawave_v3,774.62,335.84,0.0
gfx942,304,11776,2560,5120,ck,0,0,401.2109,a8w8_blockscale_1x128x128_256x128x128x128_16x16_32x32_2x2_8x32x1_8x32x1_1x32x1x8_8_1x1_intrawave_v3,769.42,333.22,0.0
gfx942,304,11904,2560,5120,ck,0,0,412.6304,a8w8_blockscale_1x128x128_256x128x128x128_16x16_32x32_2x2_8x32x1_8x32x1_1x32x1x8_8_1x1_intrawave_v3,756.26,327.18,0.0
gfx942,304,12032,2560,5120,ck,0,0,413.7866,a8w8_blockscale_1x128x128_256x128x128x128_16x16_32x32_2x2_8x32x1_8x32x1_1x32x1x8_8_1x1_intrawave_v3,762.26,329.43,0.0
gfx942,304,12160,2560,5120,ck,0,0,415.0474,a8w8_blockscale_1x128x128_256x128x128x128_16x16_32x32_2x2_8x32x1_8x32x1_1x32x1x8_8_1x1_intrawave_v3,768.03,331.59,0.0
gfx942,304,12288,2560,5120,ck,0,0,414.5484,a8w8_blockscale_1x128x128_256x128x128x128_16x16_32x32_2x2_8x32x1_8x32x1_1x32x1x8_8_1x1_intrawave_v3,777.04,335.15,0.0
gfx942,304,12416,2560,5120,ck,0,0,418.2115,a8w8_blockscale_1x128x128_256x128x128x128_16x16_32x32_2x2_8x32x1_8x32x1_1x32x1x8_8_1x1_intrawave_v3,778.26,335.35,0.0
gfx942,304,12544,2560,5120,ck,0,0,425.173,a8w8_blockscale_1x128x128_256x128x128x128_16x16_32x32_2x2_8x32x1_8x32x1_1x32x1x8_8_1x1_intrawave_v3,773.41,332.94,0.0
gfx942,304,12672,2560,5120,ck,0,0,417.9712,a8w8_blockscale_1x128x128_256x128x128x128_16x16_32x32_2x2_8x32x1_8x32x1_1x32x1x8_8_1x1_intrawave_v3,794.76,341.81,0.0
gfx942,304,12800,2560,5120,ck,0,0,427.0403,a8w8_blockscale_1x128x128_256x128x128x128_16x16_32x32_2x2_8x32x1_8x32x1_1x32x1x8_8_1x1_intrawave_v3,785.74,337.62,0.0
gfx942,304,12928,2560,5120,ck,0,0,430.6085,a8w8_blockscale_1x128x128_256x128x128x128_16x16_32x32_2x2_8x32x1_8x32x1_1x32x1x8_8_1x1_intrawave_v3,787.03,337.87,0.0
gfx942,304,13056,2560,5120,ck,0,0,437.7502,a8w8_blockscale_1x128x128_256x128x128x128_16x16_32x32_2x2_8x32x1_8x32x1_1x32x1x8_8_1x1_intrawave_v3,781.85,335.35,0.0
gfx942,304,13184,2560,5120,ck,0,0,431.7587,a8w8_blockscale_1x128x128_256x128x128x128_16x16_32x32_2x2_8x32x1_8x32x1_1x32x1x8_8_1x1_intrawave_v3,800.47,343.04,0.0
gfx942,304,13312,2560,5120,ck,0,0,438.753,a8w8_blockscale_1x128x128_256x128x128x128_16x16_32x32_2x2_8x32x1_8x32x1_1x32x1x8_8_1x1_intrawave_v3,795.36,340.56,0.0
gfx942,304,13440,2560,5120,ck,0,0,446.6204,a8w8_blockscale_1x128x128_256x128x128x128_16x16_32x32_2x2_8x32x1_8x32x1_1x32x1x8_8_1x1_intrawave_v3,788.86,337.5,0.0
gfx942,304,13568,2560,5120,ck,0,0,460.6219,a8w8_blockscale_1x128x128_256x128x128x128_16x16_32x32_2x2_8x32x1_8x32x1_1x32x1x8_8_1x1_intrawave_v3,772.17,330.08,0.0
gfx942,304,13696,2560,5120,ck,0,0,459.7571,a8w8_blockscale_1x128x128_256x128x128x128_16x16_32x32_2x2_8x32x1_8x32x1_1x32x1x8_8_1x1_intrawave_v3,780.92,333.55,0.0
gfx942,304,13824,2560,5120,ck,0,0,473.0581,a8w8_blockscale_1x128x128_256x128x128x128_16x16_32x32_2x2_8x32x1_8x32x1_1x32x1x8_8_1x1_intrawave_v3,766.05,326.95,0.0
gfx942,304,13952,2560,5120,ck,0,0,473.3625,a8w8_blockscale_1x128x128_256x128x128x128_16x16_32x32_2x2_8x32x1_8x32x1_1x32x1x8_8_1x1_intrawave_v3,772.65,329.51,0.0
gfx942,304,14080,2560,5120,ck,0,0,474.5039,a8w8_blockscale_1x128x128_256x128x128x128_16x16_32x32_2x2_8x32x1_8x32x1_1x32x1x8_8_1x1_intrawave_v3,777.86,331.48,0.0
gfx942,304,14208,2560,5120,ck,0,0,476.3031,a8w8_blockscale_1x128x128_256x128x128x128_16x16_32x32_2x2_8x32x1_8x32x1_1x32x1x8_8_1x1_intrawave_v3,781.97,332.98,0.0
gfx942,304,14336,2560,5120,ck,0,0,477.7301,a8w8_blockscale_1x128x128_256x128x128x128_16x16_32x32_2x2_8x32x1_8x32x1_1x32x1x8_8_1x1_intrawave_v3,786.66,334.72,0.0
gfx942,304,14464,2560,5120,ck,0,0,482.8084,a8w8_blockscale_1x128x128_256x128x128x128_16x16_32x32_2x2_8x32x1_8x32x1_1x32x1x8_8_1x1_intrawave_v3,785.33,333.92,0.0
gfx942,304,14592,2560,5120,ck,0,0,484.1976,a8w8_blockscale_1x128x128_256x128x128x128_16x16_32x32_2x2_8x32x1_8x32x1_1x32x1x8_8_1x1_intrawave_v3,790.01,335.67,0.0
gfx942,304,14720,2560,5120,ck,0,0,488.9526,a8w8_blockscale_1x128x128_256x128x128x128_16x16_32x32_2x2_8x32x1_8x32x1_1x32x1x8_8_1x1_intrawave_v3,789.19,335.08,0.0
gfx942,304,14848,2560,5120,ck,0,0,482.5175,a8w8_blockscale_1x128x128_256x128x128x128_16x16_32x32_2x2_8x32x1_8x32x1_1x32x1x8_8_1x1_intrawave_v3,806.67,342.27,0.0
gfx942,304,14976,2560,5120,ck,0,0,497.674,a8w8_blockscale_1x128x128_256x128x128x128_16x16_32x32_2x2_8x32x1_8x32x1_1x32x1x8_8_1x1_intrawave_v3,788.84,334.48,0.0
gfx942,304,15104,2560,5120,ck,0,0,497.0925,a8w8_blockscale_1x128x128_256x128x128x128_16x16_32x32_2x2_8x32x1_8x32x1_1x32x1x8_8_1x1_intrawave_v3,796.52,337.51,0.0
gfx942,304,15232,2560,5120,ck,0,0,506.0759,a8w8_blockscale_1x128x128_256x128x128x128_16x16_32x32_2x2_8x32x1_8x32x1_1x32x1x8_8_1x1_intrawave_v3,789.01,334.11,0.0
gfx942,304,15360,2560,5120,ck,0,0,513.7685,a8w8_blockscale_1x128x128_256x128x128x128_16x16_32x32_2x2_8x32x1_8x32x1_1x32x1x8_8_1x1_intrawave_v3,783.72,331.65,0.0
gfx942,304,15488,2560,5120,ck,0,0,513.2553,a8w8_blockscale_1x128x128_256x128x128x128_16x16_32x32_2x2_8x32x1_8x32x1_1x32x1x8_8_1x1_intrawave_v3,791.05,334.54,0.0
gfx942,304,15616,2560,5120,ck,0,0,536.6516,a8w8_blockscale_1x128x128_256x128x128x128_16x16_32x32_2x2_8x32x1_8x32x1_1x32x1x8_8_1x1_intrawave_v3,762.81,322.4,0.0
gfx942,304,15744,2560,5120,ck,0,0,531.1452,a8w8_blockscale_1x128x128_256x128x128x128_16x16_32x32_2x2_8x32x1_8x32x1_1x32x1x8_8_1x1_intrawave_v3,777.04,328.21,0.0
gfx942,304,15872,2560,5120,ck,0,0,539.4958,a8w8_blockscale_1x128x128_256x128x128x128_16x16_32x32_2x2_8x32x1_8x32x1_1x32x1x8_8_1x1_intrawave_v3,771.23,325.56,0.0
gfx942,304,16000,2560,5120,ck,0,0,534.3727,a8w8_blockscale_1x128x128_256x128x128x128_16x16_32x32_2x2_8x32x1_8x32x1_1x32x1x8_8_1x1_intrawave_v3,784.9,331.13,0.0
gfx942,304,16128,2560,5120,ck,0,0,542.3896,a8w8_blockscale_1x128x128_256x128x128x128_16x16_32x32_2x2_8x32x1_8x32x1_1x32x1x8_8_1x1_intrawave_v3,779.49,328.65,0.0
gfx942,304,16256,2560,5120,ck,0,0,547.6692,a8w8_blockscale_1x128x128_256x128x128x128_16x16_32x32_2x2_8x32x1_8x32x1_1x32x1x8_8_1x1_intrawave_v3,778.1,327.88,0.0
gfx942,304,16384,2560,5120,ck,0,0,543.4199,a8w8_blockscale_1x128x128_256x128x128x128_16x16_32x32_2x2_8x32x1_8x32x1_1x32x1x8_8_1x1_intrawave_v3,790.36,332.85,0.0
gfx942,304,16512,2560,5120,ck,0,0,556.0854,a8w8_blockscale_1x128x128_256x128x128x128_16x16_32x32_2x2_8x32x1_8x32x1_1x32x1x8_8_1x1_intrawave_v3,778.39,327.63,0.0
gfx942,304,16640,2560,5120,ck,0,0,558.9989,a8w8_blockscale_1x128x128_256x128x128x128_16x16_32x32_2x2_8x32x1_8x32x1_1x32x1x8_8_1x1_intrawave_v3,780.34,328.27,0.0
gfx942,304,16768,2560,5120,ck,0,0,552.112,a8w8_blockscale_1x128x128_256x128x128x128_16x16_32x32_2x2_8x32x1_8x32x1_1x32x1x8_8_1x1_intrawave_v3,796.15,334.74,0.0
gfx942,304,16896,2560,5120,ck,0,0,554.7719,a8w8_blockscale_1x128x128_256x128x128x128_16x16_32x32_2x2_8x32x1_8x32x1_1x32x1x8_8_1x1_intrawave_v3,798.38,335.49,0.0
gfx942,304,17024,2560,5120,ck,0,0,560.0199,a8w8_blockscale_1x128x128_256x128x128x128_16x16_32x32_2x2_8x32x1_8x32x1_1x32x1x8_8_1x1_intrawave_v3,796.89,334.69,0.0
gfx942,304,17152,2560,5120,ck,0,0,573.866,a8w8_blockscale_1x128x128_256x128x128x128_16x16_32x32_2x2_8x32x1_8x32x1_1x32x1x8_8_1x1_intrawave_v3,783.51,328.9,0.0
gfx942,304,17280,2560,5120,ck,0,0,578.5441,a8w8_blockscale_1x128x128_256x128x128x128_16x16_32x32_2x2_8x32x1_8x32x1_1x32x1x8_8_1x1_intrawave_v3,782.97,328.5,0.0
gfx942,304,17408,2560,5120,ck,0,0,578.8641,a8w8_blockscale_1x128x128_256x128x128x128_16x16_32x32_2x2_8x32x1_8x32x1_1x32x1x8_8_1x1_intrawave_v3,788.34,330.59,0.0
gfx942,304,17536,2560,5120,ck,0,0,595.5527,a8w8_blockscale_1x128x128_256x128x128x128_16x16_32x32_2x2_8x32x1_8x32x1_1x32x1x8_8_1x1_intrawave_v3,771.88,323.52,0.0
gfx942,304,17664,2560,5120,ck,0,0,600.4065,a8w8_blockscale_1x128x128_256x128x128x128_16x16_32x32_2x2_8x32x1_8x32x1_1x32x1x8_8_1x1_intrawave_v3,771.23,323.09,0.0
gfx942,304,17792,2560,5120,ck,0,0,591.1669,a8w8_blockscale_1x128x128_256x128x128x128_16x16_32x32_2x2_8x32x1_8x32x1_1x32x1x8_8_1x1_intrawave_v3,788.96,330.36,0.0
gfx942,304,17920,2560,5120,ck,0,0,587.5108,a8w8_blockscale_1x128x128_256x128x128x128_16x16_32x32_2x2_8x32x1_8x32x1_1x32x1x8_8_1x1_intrawave_v3,799.58,334.65,0.0
gfx942,304,18048,2560,5120,ck,0,0,605.6993,a8w8_blockscale_1x128x128_256x128x128x128_16x16_32x32_2x2_8x32x1_8x32x1_1x32x1x8_8_1x1_intrawave_v3,781.11,326.76,0.0
gfx942,304,18176,2560,5120,ck,0,0,597.1564,a8w8_blockscale_1x128x128_256x128x128x128_16x16_32x32_2x2_8x32x1_8x32x1_1x32x1x8_8_1x1_intrawave_v3,797.9,333.63,0.0
gfx942,304,18304,2560,5120,ck,0,0,597.3073,a8w8_blockscale_1x128x128_256x128x128x128_16x16_32x32_2x2_8x32x1_8x32x1_1x32x1x8_8_1x1_intrawave_v3,803.32,335.74,0.0
gfx942,304,18432,2560,5120,ck,0,0,606.7626,a8w8_blockscale_1x128x128_256x128x128x128_16x16_32x32_2x2_8x32x1_8x32x1_1x32x1x8_8_1x1_intrawave_v3,796.33,332.67,0.0
gfx942,304,18560,2560,5120,ck,0,0,616.1779,a8w8_blockscale_1x128x128_256x128x128x128_16x16_32x32_2x2_8x32x1_8x32x1_1x32x1x8_8_1x1_intrawave_v3,789.61,329.71,0.0
gfx942,304,18688,2560,5120,ck,0,0,618.7874,a8w8_blockscale_1x128x128_256x128x128x128_16x16_32x32_2x2_8x32x1_8x32x1_1x32x1x8_8_1x1_intrawave_v3,791.7,330.44,0.0
gfx942,304,18816,2560,5120,ck,0,0,614.2336,a8w8_blockscale_1x128x128_256x128x128x128_16x16_32x32_2x2_8x32x1_8x32x1_1x32x1x8_8_1x1_intrawave_v3,803.03,335.02,0.0
gfx942,304,18944,2560,5120,ck,0,0,616.8824,a8w8_blockscale_1x128x128_256x128x128x128_16x16_32x32_2x2_8x32x1_8x32x1_1x32x1x8_8_1x1_intrawave_v3,805.02,335.71,0.0
gfx942,304,19072,2560,5120,ck,0,0,627.705,a8w8_blockscale_1x128x128_256x128x128x128_16x16_32x32_2x2_8x32x1_8x32x1_1x32x1x8_8_1x1_intrawave_v3,796.49,332.01,0.0
gfx942,304,19200,2560,5120,ck,0,0,636.8085,a8w8_blockscale_1x128x128_256x128x128x128_16x16_32x32_2x2_8x32x1_8x32x1_1x32x1x8_8_1x1_intrawave_v3,790.37,329.32,0.0
gfx942,304,19328,2560,5120,ck,0,0,643.3251,a8w8_blockscale_1x128x128_256x128x128x128_16x16_32x32_2x2_8x32x1_8x32x1_1x32x1x8_8_1x1_intrawave_v3,787.58,328.02,0.0
gfx942,304,19456,2560,5120,ck,0,0,643.7982,a8w8_blockscale_1x128x128_256x128x128x128_16x16_32x32_2x2_8x32x1_8x32x1_1x32x1x8_8_1x1_intrawave_v3,792.22,329.82,0.0
gfx942,304,19584,2560,5120,ck,0,0,666.6876,a8w8_blockscale_1x128x128_256x128x128x128_16x16_32x32_2x2_8x32x1_8x32x1_1x32x1x8_8_1x1_intrawave_v3,770.05,320.46,0.0
gfx942,304,19712,2560,5120,ck,0,0,658.2994,a8w8_blockscale_1x128x128_256x128x128x128_16x16_32x32_2x2_8x32x1_8x32x1_1x32x1x8_8_1x1_intrawave_v3,784.96,326.54,0.0
gfx942,304,19840,2560,5120,ck,0,0,660.6084,a8w8_blockscale_1x128x128_256x128x128x128_16x16_32x32_2x2_8x32x1_8x32x1_1x32x1x8_8_1x1_intrawave_v3,787.3,327.38,0.0
gfx942,304,19968,2560,5120,ck,0,0,658.1205,a8w8_blockscale_1x128x128_256x128x128x128_16x16_32x32_2x2_8x32x1_8x32x1_1x32x1x8_8_1x1_intrawave_v3,795.37,330.61,0.0
gfx942,304,20096,2560,5120,ck,0,0,668.5599,a8w8_blockscale_1x128x128_256x128x128x128_16x16_32x32_2x2_8x32x1_8x32x1_1x32x1x8_8_1x1_intrawave_v3,787.97,327.41,0.0
gfx942,304,20224,2560,5120,ck,0,0,669.4489,a8w8_blockscale_1x128x128_256x128x128x128_16x16_32x32_2x2_8x32x1_8x32x1_1x32x1x8_8_1x1_intrawave_v3,791.94,328.93,0.0
gfx942,304,20352,2560,5120,ck,0,0,662.9679,a8w8_blockscale_1x128x128_256x128x128x128_16x16_32x32_2x2_8x32x1_8x32x1_1x32x1x8_8_1x1_intrawave_v3,804.74,334.12,0.0
gfx942,304,20480,2560,5120,ck,0,0,677.5222,a8w8_blockscale_1x128x128_256x128x128x128_16x16_32x32_2x2_8x32x1_8x32x1_1x32x1x8_8_1x1_intrawave_v3,792.4,328.88,0.0
gfx942,304,20608,2560,5120,ck,0,0,688.7997,a8w8_blockscale_1x128x128_256x128x128x128_16x16_32x32_2x2_8x32x1_8x32x1_1x32x1x8_8_1x1_intrawave_v3,784.3,325.4,0.0
gfx942,304,20736,2560,5120,ck,0,0,683.1822,a8w8_blockscale_1x128x128_256x128x128x128_16x16_32x32_2x2_8x32x1_8x32x1_1x32x1x8_8_1x1_intrawave_v3,795.66,329.99,0.0
gfx942,304,20864,2560,5120,ck,0,0,684.8573,a8w8_blockscale_1x128x128_256x128x128x128_16x16_32x32_2x2_8x32x1_8x32x1_1x32x1x8_8_1x1_intrawave_v3,798.61,331.1,0.0
gfx942,304,20992,2560,5120,ck,0,0,684.642,a8w8_blockscale_1x128x128_256x128x128x128_16x16_32x32_2x2_8x32x1_8x32x1_1x32x1x8_8_1x1_intrawave_v3,803.77,333.12,0.0
gfx942,304,21120,2560,5120,ck,0,0,703.1336,a8w8_blockscale_1x128x128_256x128x128x128_16x16_32x32_2x2_8x32x1_8x32x1_1x32x1x8_8_1x1_intrawave_v3,787.4,326.22,0.0
gfx942,304,21248,2560,5120,ck,0,0,714.3763,a8w8_blockscale_1x128x128_256x128x128x128_16x16_32x32_2x2_8x32x1_8x32x1_1x32x1x8_8_1x1_intrawave_v3,779.71,322.92,0.0
gfx942,304,21376,2560,5120,ck,0,0,708.8766,a8w8_blockscale_1x128x128_256x128x128x128_16x16_32x32_2x2_8x32x1_8x32x1_1x32x1x8_8_1x1_intrawave_v3,790.49,327.27,0.0
gfx942,304,21504,2560,5120,ck,0,0,711.0703,a8w8_blockscale_1x128x128_256x128x128x128_16x16_32x32_2x2_8x32x1_8x32x1_1x32x1x8_8_1x1_intrawave_v3,792.77,328.11,0.0
gfx942,304,21632,2560,5120,ck,0,0,713.9376,a8w8_blockscale_1x128x128_256x128x128x128_16x16_32x32_2x2_8x32x1_8x32x1_1x32x1x8_8_1x1_intrawave_v3,794.28,328.63,0.0
gfx942,304,21760,2560,5120,ck,0,0,715.8632,a8w8_blockscale_1x128x128_256x128x128x128_16x16_32x32_2x2_8x32x1_8x32x1_1x32x1x8_8_1x1_intrawave_v3,796.84,329.57,0.0
gfx942,304,21888,2560,5120,ck,0,0,717.3474,a8w8_blockscale_1x128x128_256x128x128x128_16x16_32x32_2x2_8x32x1_8x32x1_1x32x1x8_8_1x1_intrawave_v3,799.86,330.72,0.0
gfx942,304,22016,2560,5120,ck,0,0,729.7969,a8w8_blockscale_1x128x128_256x128x128x128_16x16_32x32_2x2_8x32x1_8x32x1_1x32x1x8_8_1x1_intrawave_v3,790.82,326.87,0.0
gfx942,304,22144,2560,5120,ck,0,0,739.3042,a8w8_blockscale_1x128x128_256x128x128x128_16x16_32x32_2x2_8x32x1_8x32x1_1x32x1x8_8_1x1_intrawave_v3,785.19,324.44,0.0
gfx942,304,22272,2560,5120,ck,0,0,728.639,a8w8_blockscale_1x128x128_256x128x128x128_16x16_32x32_2x2_8x32x1_8x32x1_1x32x1x8_8_1x1_intrawave_v3,801.28,330.99,0.0
gfx942,304,22400,2560,5120,ck,0,0,735.1648,a8w8_blockscale_1x128x128_256x128x128x128_16x16_32x32_2x2_8x32x1_8x32x1_1x32x1x8_8_1x1_intrawave_v3,798.74,329.84,0.0
gfx942,304,22528,2560,5120,ck,0,0,735.3062,a8w8_blockscale_1x128x128_256x128x128x128_16x16_32x32_2x2_8x32x1_8x32x1_1x32x1x8_8_1x1_intrawave_v3,803.15,331.55,0.0
gfx942,304,22656,2560,5120,ck,0,0,740.0999,a8w8_blockscale_1x128x128_256x128x128x128_16x16_32x32_2x2_8x32x1_8x32x1_1x32x1x8_8_1x1_intrawave_v3,802.48,331.18,0.0
gfx942,304,22784,2560,5120,ck,0,0,750.3834,a8w8_blockscale_1x128x128_256x128x128x128_16x16_32x32_2x2_8x32x1_8x32x1_1x32x1x8_8_1x1_intrawave_v3,795.95,328.39,0.0
gfx942,304,22912,2560,5120,ck,0,0,751.9112,a8w8_blockscale_1x128x128_256x128x128x128_16x16_32x32_2x2_8x32x1_8x32x1_1x32x1x8_8_1x1_intrawave_v3,798.8,329.46,0.0
gfx942,304,23040,2560,5120,ck,0,0,757.8043,a8w8_blockscale_1x128x128_256x128x128x128_16x16_32x32_2x2_8x32x1_8x32x1_1x32x1x8_8_1x1_intrawave_v3,797.01,328.63,0.0
gfx942,304,23168,2560,5120,ck,0,0,765.4291,a8w8_blockscale_1x128x128_256x128x128x128_16x16_32x32_2x2_8x32x1_8x32x1_1x32x1x8_8_1x1_intrawave_v3,793.46,327.07,0.0
gfx942,304,23296,2560,5120,ck,0,0,767.2823,a8w8_blockscale_1x128x128_256x128x128x128_16x16_32x32_2x2_8x32x1_8x32x1_1x32x1x8_8_1x1_intrawave_v3,795.91,327.99,0.0
gfx942,304,23424,2560,5120,ck,0,0,763.4142,a8w8_blockscale_1x128x128_256x128x128x128_16x16_32x32_2x2_8x32x1_8x32x1_1x32x1x8_8_1x1_intrawave_v3,804.34,331.37,0.0
gfx942,304,23552,2560,5120,ck,0,0,778.2926,a8w8_blockscale_1x128x128_256x128x128x128_16x16_32x32_2x2_8x32x1_8x32x1_1x32x1x8_8_1x1_intrawave_v3,793.28,326.71,0.0
gfx942,304,23680,2560,5120,ck,0,0,776.5287,a8w8_blockscale_1x128x128_256x128x128x128_16x16_32x32_2x2_8x32x1_8x32x1_1x32x1x8_8_1x1_intrawave_v3,799.4,329.14,0.0
gfx942,304,23808,2560,5120,ck,0,0,781.9496,a8w8_blockscale_1x128x128_256x128x128x128_16x16_32x32_2x2_8x32x1_8x32x1_1x32x1x8_8_1x1_intrawave_v3,798.15,328.54,0.0
gfx942,304,23936,2560,5120,ck,0,0,783.7776,a8w8_blockscale_1x128x128_256x128x128x128_16x16_32x32_2x2_8x32x1_8x32x1_1x32x1x8_8_1x1_intrawave_v3,800.57,329.45,0.0
gfx942,304,24064,2560,5120,ck,0,0,783.4259,a8w8_blockscale_1x128x128_256x128x128x128_16x16_32x32_2x2_8x32x1_8x32x1_1x32x1x8_8_1x1_intrawave_v3,805.21,331.27,0.0
gfx942,304,24192,2560,5120,ck,0,0,802.1027,a8w8_blockscale_1x128x128_256x128x128x128_16x16_32x32_2x2_8x32x1_8x32x1_1x32x1x8_8_1x1_intrawave_v3,790.65,325.19,0.0
gfx942,304,24320,2560,5120,ck,0,0,794.2832,a8w8_blockscale_1x128x128_256x128x128x128_16x16_32x32_2x2_8x32x1_8x32x1_1x32x1x8_8_1x1_intrawave_v3,802.65,330.04,0.0
gfx942,304,24448,2560,5120,ck,0,0,801.361,a8w8_blockscale_1x128x128_256x128x128x128_16x16_32x32_2x2_8x32x1_8x32x1_1x32x1x8_8_1x1_intrawave_v3,799.75,328.76,0.0
gfx942,304,24576,2560,5120,ck,0,0,794.7705,a8w8_blockscale_1x128x128_256x128x128x128_16x16_32x32_2x2_8x32x1_8x32x1_1x32x1x8_8_1x1_intrawave_v3,810.61,333.13,0.0
gfx942,304,24704,2560,5120,ck,0,0,806.9915,a8w8_blockscale_1x128x128_256x128x128x128_16x16_32x32_2x2_8x32x1_8x32x1_1x32x1x8_8_1x1_intrawave_v3,802.49,329.71,0.0
gfx942,304,24832,2560,5120,ck,0,0,809.234,a8w8_blockscale_1x128x128_256x128x128x128_16x16_32x32_2x2_8x32x1_8x32x1_1x32x1x8_8_1x1_intrawave_v3,804.41,330.42,0.0
gfx942,304,24960,2560,5120,ck,0,0,822.3934,a8w8_blockscale_1x128x128_256x128x128x128_16x16_32x32_2x2_8x32x1_8x32x1_1x32x1x8_8_1x1_intrawave_v3,795.62,326.73,0.0
gfx942,304,25088,2560,5120,ck,0,0,823.0821,a8w8_blockscale_1x128x128_256x128x128x128_16x16_32x32_2x2_8x32x1_8x32x1_1x32x1x8_8_1x1_intrawave_v3,799.03,328.05,0.0
gfx942,304,25216,2560,5120,ck,0,0,837.0471,a8w8_blockscale_1x128x128_256x128x128x128_16x16_32x32_2x2_8x32x1_8x32x1_1x32x1x8_8_1x1_intrawave_v3,789.71,324.14,0.0
gfx942,304,25344,2560,5120,ck,0,0,829.3193,a8w8_blockscale_1x128x128_256x128x128x128_16x16_32x32_2x2_8x32x1_8x32x1_1x32x1x8_8_1x1_intrawave_v3,801.11,328.74,0.0
gfx942,304,25472,2560,5120,ck,0,0,838.5335,a8w8_blockscale_1x128x128_256x128x128x128_16x16_32x32_2x2_8x32x1_8x32x1_1x32x1x8_8_1x1_intrawave_v3,796.31,326.69,0.0
gfx942,304,25600,2560,5120,ck,0,0,832.8753,a8w8_blockscale_1x128x128_256x128x128x128_16x16_32x32_2x2_8x32x1_8x32x1_1x32x1x8_8_1x1_intrawave_v3,805.75,330.48,0.0
gfx942,304,25728,2560,5120,ck,0,0,847.0821,a8w8_blockscale_1x128x128_256x128x128x128_16x16_32x32_2x2_8x32x1_8x32x1_1x32x1x8_8_1x1_intrawave_v3,796.2,326.49,0.0
gfx942,304,25856,2560,5120,ck,0,0,859.2778,a8w8_blockscale_1x128x128_256x128x128x128_16x16_32x32_2x2_8x32x1_8x32x1_1x32x1x8_8_1x1_intrawave_v3,788.8,323.38,0.0
gfx942,304,25984,2560,5120,ck,0,0,843.1494,a8w8_blockscale_1x128x128_256x128x128x128_16x16_32x32_2x2_8x32x1_8x32x1_1x32x1x8_8_1x1_intrawave_v3,807.87,331.12,0.0
gfx942,304,26112,2560,5120,ck,0,0,847.7339,a8w8_blockscale_1x128x128_256x128x128x128_16x16_32x32_2x2_8x32x1_8x32x1_1x32x1x8_8_1x1_intrawave_v3,807.46,330.88,0.0
gfx942,304,26240,2560,5120,ck,0,0,862.8395,a8w8_blockscale_1x128x128_256x128x128x128_16x16_32x32_2x2_8x32x1_8x32x1_1x32x1x8_8_1x1_intrawave_v3,797.21,326.6,0.0
gfx942,304,26368,2560,5120,ck,0,0,857.0845,a8w8_blockscale_1x128x128_256x128x128x128_16x16_32x32_2x2_8x32x1_8x32x1_1x32x1x8_8_1x1_intrawave_v3,806.48,330.32,0.0
gfx942,304,26496,2560,5120,ck,0,0,873.3472,a8w8_blockscale_1x128x128_256x128x128x128_16x16_32x32_2x2_8x32x1_8x32x1_1x32x1x8_8_1x1_intrawave_v3,795.3,325.67,0.0
gfx942,304,26624,2560,5120,ck,0,0,858.6891,a8w8_blockscale_1x128x128_256x128x128x128_16x16_32x32_2x2_8x32x1_8x32x1_1x32x1x8_8_1x1_intrawave_v3,812.79,332.76,0.0
gfx942,304,26752,2560,5120,ck,0,0,877.7221,a8w8_blockscale_1x128x128_256x128x128x128_16x16_32x32_2x2_8x32x1_8x32x1_1x32x1x8_8_1x1_intrawave_v3,798.99,327.04,0.0
gfx942,304,26880,2560,5120,ck,0,0,895.3595,a8w8_blockscale_1x128x128_256x128x128x128_16x16_32x32_2x2_8x32x1_8x32x1_1x32x1x8_8_1x1_intrawave_v3,786.99,322.06,0.0
gfx942,304,27008,2560,5120,ck,0,0,886.0049,a8w8_blockscale_1x128x128_256x128x128x128_16x16_32x32_2x2_8x32x1_8x32x1_1x32x1x8_8_1x1_intrawave_v3,799.09,326.94,0.0
gfx942,304,27136,2560,5120,ck,0,0,895.9068,a8w8_blockscale_1x128x128_256x128x128x128_16x16_32x32_2x2_8x32x1_8x32x1_1x32x1x8_8_1x1_intrawave_v3,794.0,324.79,0.0
gfx942,304,27264,2560,5120,ck,0,0,898.9656,a8w8_blockscale_1x128x128_256x128x128x128_16x16_32x32_2x2_8x32x1_8x32x1_1x32x1x8_8_1x1_intrawave_v3,795.04,325.14,0.0
gfx942,304,27392,2560,5120,ck,0,0,909.8732,a8w8_blockscale_1x128x128_256x128x128x128_16x16_32x32_2x2_8x32x1_8x32x1_1x32x1x8_8_1x1_intrawave_v3,789.19,322.68,0.0
gfx942,304,27520,2560,5120,ck,0,0,899.6517,a8w8_blockscale_1x128x128_256x128x128x128_16x16_32x32_2x2_8x32x1_8x32x1_1x32x1x8_8_1x1_intrawave_v3,801.89,327.81,0.0
gfx942,304,27648,2560,5120,ck,0,0,920.8961,a8w8_blockscale_1x128x128_256x128x128x128_16x16_32x32_2x2_8x32x1_8x32x1_1x32x1x8_8_1x1_intrawave_v3,787.03,321.67,0.0
gfx942,304,27776,2560,5120,ck,0,0,906.267,a8w8_blockscale_1x128x128_256x128x128x128_16x16_32x32_2x2_8x32x1_8x32x1_1x32x1x8_8_1x1_intrawave_v3,803.44,328.31,0.0
gfx942,304,27904,2560,5120,ck,0,0,915.8272,a8w8_blockscale_1x128x128_256x128x128x128_16x16_32x32_2x2_8x32x1_8x32x1_1x32x1x8_8_1x1_intrawave_v3,798.72,326.31,0.0
gfx942,304,28032,2560,5120,ck,0,0,918.5575,a8w8_blockscale_1x128x128_256x128x128x128_16x16_32x32_2x2_8x32x1_8x32x1_1x32x1x8_8_1x1_intrawave_v3,800.0,326.77,0.0
gfx942,304,28160,2560,5120,ck,0,0,913.9907,a8w8_blockscale_1x128x128_256x128x128x128_16x16_32x32_2x2_8x32x1_8x32x1_1x32x1x8_8_1x1_intrawave_v3,807.66,329.83,0.0
gfx942,304,28288,2560,5120,ck,0,0,941.5524,a8w8_blockscale_1x128x128_256x128x128x128_16x16_32x32_2x2_8x32x1_8x32x1_1x32x1x8_8_1x1_intrawave_v3,787.59,321.57,0.0
gfx942,304,28416,2560,5120,ck,0,0,932.5842,a8w8_blockscale_1x128x128_256x128x128x128_16x16_32x32_2x2_8x32x1_8x32x1_1x32x1x8_8_1x1_intrawave_v3,798.76,326.07,0.0
gfx942,304,28544,2560,5120,ck,0,0,937.1827,a8w8_blockscale_1x128x128_256x128x128x128_16x16_32x32_2x2_8x32x1_8x32x1_1x32x1x8_8_1x1_intrawave_v3,798.42,325.87,0.0
gfx942,304,28672,2560,5120,ck,0,0,929.8052,a8w8_blockscale_1x128x128_256x128x128x128_16x16_32x32_2x2_8x32x1_8x32x1_1x32x1x8_8_1x1_intrawave_v3,808.36,329.86,0.0
gfx942,304,28800,2560,5120,ck,0,0,950.0663,a8w8_blockscale_1x128x128_256x128x128x128_16x16_32x32_2x2_8x32x1_8x32x1_1x32x1x8_8_1x1_intrawave_v3,794.65,324.21,0.0
gfx942,304,28928,2560,5120,ck,0,0,951.1554,a8w8_blockscale_1x128x128_256x128x128x128_16x16_32x32_2x2_8x32x1_8x32x1_1x32x1x8_8_1x1_intrawave_v3,797.27,325.21,0.0
gfx942,304,29056,2560,5120,ck,0,0,967.1672,a8w8_blockscale_1x128x128_256x128x128x128_16x16_32x32_2x2_8x32x1_8x32x1_1x32x1x8_8_1x1_intrawave_v3,787.54,321.19,0.0
gfx942,304,29184,2560,5120,ck,0,0,946.3874,a8w8_blockscale_1x128x128_256x128x128x128_16x16_32x32_2x2_8x32x1_8x32x1_1x32x1x8_8_1x1_intrawave_v3,808.38,329.62,0.0
gfx942,304,29312,2560,5120,ck,0,0,957.3079,a8w8_blockscale_1x128x128_256x128x128x128_16x16_32x32_2x2_8x32x1_8x32x1_1x32x1x8_8_1x1_intrawave_v3,802.66,327.23,0.0
gfx942,304,29440,2560,5120,ck,0,0,986.0641,a8w8_blockscale_1x128x128_256x128x128x128_16x16_32x32_2x2_8x32x1_8x32x1_1x32x1x8_8_1x1_intrawave_v3,782.66,319.02,0.0
gfx942,304,29568,2560,5120,ck,0,0,969.5244,a8w8_blockscale_1x128x128_256x128x128x128_16x16_32x32_2x2_8x32x1_8x32x1_1x32x1x8_8_1x1_intrawave_v3,799.47,325.81,0.0
gfx942,304,29696,2560,5120,ck,0,0,969.3488,a8w8_blockscale_1x128x128_256x128x128x128_16x16_32x32_2x2_8x32x1_8x32x1_1x32x1x8_8_1x1_intrawave_v3,803.08,327.22,0.0
gfx942,304,29824,2560,5120,ck,0,0,973.1344,a8w8_blockscale_1x128x128_256x128x128x128_16x16_32x32_2x2_8x32x1_8x32x1_1x32x1x8_8_1x1_intrawave_v3,803.4,327.3,0.0
gfx942,304,29952,2560,5120,ck,0,0,987.2509,a8w8_blockscale_1x128x128_256x128x128x128_16x16_32x32_2x2_8x32x1_8x32x1_1x32x1x8_8_1x1_intrawave_v3,795.31,323.95,0.0
gfx942,304,30080,2560,5120,ck,0,0,985.3046,a8w8_blockscale_1x128x128_256x128x128x128_16x16_32x32_2x2_8x32x1_8x32x1_1x32x1x8_8_1x1_intrawave_v3,800.29,325.92,0.0
gfx942,304,30208,2560,5120,ck,0,0,996.9153,a8w8_blockscale_1x128x128_256x128x128x128_16x16_32x32_2x2_8x32x1_8x32x1_1x32x1x8_8_1x1_intrawave_v3,794.33,323.43,0.0
gfx942,304,30336,2560,5120,ck,0,0,1008.3082,a8w8_blockscale_1x128x128_256x128x128x128_16x16_32x32_2x2_8x32x1_8x32x1_1x32x1x8_8_1x1_intrawave_v3,788.69,321.08,0.0
gfx942,304,30464,2560,5120,ck,0,0,1016.8689,a8w8_blockscale_1x128x128_256x128x128x128_16x16_32x32_2x2_8x32x1_8x32x1_1x32x1x8_8_1x1_intrawave_v3,785.35,319.67,0.0
gfx942,304,30592,2560,5120,ck,0,0,1006.6252,a8w8_blockscale_1x128x128_256x128x128x128_16x16_32x32_2x2_8x32x1_8x32x1_1x32x1x8_8_1x1_intrawave_v3,796.67,324.22,0.0
gfx942,304,30720,2560,5120,ck,0,0,999.6782,a8w8_blockscale_1x128x128_256x128x128x128_16x16_32x32_2x2_8x32x1_8x32x1_1x32x1x8_8_1x1_intrawave_v3,805.57,327.79,0.0
gfx942,304,30848,2560,5120,ck,0,0,1006.9812,a8w8_blockscale_1x128x128_256x128x128x128_16x16_32x32_2x2_8x32x1_8x32x1_1x32x1x8_8_1x1_intrawave_v3,803.06,326.71,0.0
gfx942,304,30976,2560,5120,ck,0,0,1018.6803,a8w8_blockscale_1x128x128_256x128x128x128_16x16_32x32_2x2_8x32x1_8x32x1_1x32x1x8_8_1x1_intrawave_v3,797.13,324.24,0.0
gfx942,304,31104,2560,5120,ck,0,0,1021.6279,a8w8_blockscale_1x128x128_256x128x128x128_16x16_32x32_2x2_8x32x1_8x32x1_1x32x1x8_8_1x1_intrawave_v3,798.11,324.59,0.0
gfx942,304,31232,2560,5120,ck,0,0,1021.1632,a8w8_blockscale_1x128x128_256x128x128x128_16x16_32x32_2x2_8x32x1_8x32x1_1x32x1x8_8_1x1_intrawave_v3,801.76,326.02,0.0
gfx942,304,31360,2560,5120,ck,0,0,1033.111,a8w8_blockscale_1x128x128_256x128x128x128_16x16_32x32_2x2_8x32x1_8x32x1_1x32x1x8_8_1x1_intrawave_v3,795.74,323.52,0.0
gfx942,304,31488,2560,5120,ck,0,0,1034.3467,a8w8_blockscale_1x128x128_256x128x128x128_16x16_32x32_2x2_8x32x1_8x32x1_1x32x1x8_8_1x1_intrawave_v3,798.03,324.4,0.0
gfx942,304,31616,2560,5120,ck,0,0,1046.6838,a8w8_blockscale_1x128x128_256x128x128x128_16x16_32x32_2x2_8x32x1_8x32x1_1x32x1x8_8_1x1_intrawave_v3,791.83,321.83,0.0
gfx942,304,31744,2560,5120,ck,0,0,1050.0579,a8w8_blockscale_1x128x128_256x128x128x128_16x16_32x32_2x2_8x32x1_8x32x1_1x32x1x8_8_1x1_intrawave_v3,792.48,322.04,0.0
gfx942,304,31872,2560,5120,ck,0,0,1034.7072,a8w8_blockscale_1x128x128_256x128x128x128_16x16_32x32_2x2_8x32x1_8x32x1_1x32x1x8_8_1x1_intrawave_v3,807.48,328.09,0.0
gfx942,304,32000,2560,5120,ck,0,0,1039.5961,a8w8_blockscale_1x128x128_256x128x128x128_16x16_32x32_2x2_8x32x1_8x32x1_1x32x1x8_8_1x1_intrawave_v3,806.91,327.81,0.0
gfx942,304,32128,2560,5120,ck,0,0,1049.5813,a8w8_blockscale_1x128x128_256x128x128x128_16x16_32x32_2x2_8x32x1_8x32x1_1x32x1x8_8_1x1_intrawave_v3,802.43,325.94,0.0
gfx942,304,32256,2560,5120,ck,0,0,1071.615,a8w8_blockscale_1x128x128_256x128x128x128_16x16_32x32_2x2_8x32x1_8x32x1_1x32x1x8_8_1x1_intrawave_v3,789.06,320.46,0.0
gfx942,304,32384,2560,5120,ck,0,0,1066.896,a8w8_blockscale_1x128x128_256x128x128x128_16x16_32x32_2x2_8x32x1_8x32x1_1x32x1x8_8_1x1_intrawave_v3,795.7,323.1,0.0
gfx942,304,32512,2560,5120,ck,0,0,1070.4059,a8w8_blockscale_1x128x128_256x128x128x128_16x16_32x32_2x2_8x32x1_8x32x1_1x32x1x8_8_1x1_intrawave_v3,796.22,323.27,0.0
gfx942,304,32640,2560,5120,ck,0,0,1068.6625,a8w8_blockscale_1x128x128_256x128x128x128_16x16_32x32_2x2_8x32x1_8x32x1_1x32x1x8_8_1x1_intrawave_v3,800.66,325.02,0.0
gfx942,304,32768,2560,5120,ck,0,0,1074.2803,a8w8_blockscale_1x128x128_256x128x128x128_16x16_32x32_2x2_8x32x1_8x32x1_1x32x1x8_8_1x1_intrawave_v3,799.6,324.54,0.0
gfx942,304,32896,2560,5120,ck,0,0,1081.3288,a8w8_blockscale_1x128x128_256x128x128x128_16x16_32x32_2x2_8x32x1_8x32x1_1x32x1x8_8_1x1_intrawave_v3,797.49,323.64,0.0
gfx942,304,33024,2560,5120,ck,0,0,1097.9334,a8w8_blockscale_1x128x128_256x128x128x128_16x16_32x32_2x2_8x32x1_8x32x1_1x32x1x8_8_1x1_intrawave_v3,788.49,319.94,0.0
gfx942,304,33152,2560,5120,ck,0,0,1077.0875,a8w8_blockscale_1x128x128_256x128x128x128_16x16_32x32_2x2_8x32x1_8x32x1_1x32x1x8_8_1x1_intrawave_v3,806.86,327.35,0.0
gfx942,304,33280,2560,5120,ck,0,0,1084.6256,a8w8_blockscale_1x128x128_256x128x128x128_16x16_32x32_2x2_8x32x1_8x32x1_1x32x1x8_8_1x1_intrawave_v3,804.35,326.28,0.0
gfx942,304,33408,2560,5120,ck,0,0,1107.4629,a8w8_blockscale_1x128x128_256x128x128x128_16x16_32x32_2x2_8x32x1_8x32x1_1x32x1x8_8_1x1_intrawave_v3,790.79,320.74,0.0
gfx942,304,33536,2560,5120,ck,0,0,1094.7635,a8w8_blockscale_1x128x128_256x128x128x128_16x16_32x32_2x2_8x32x1_8x32x1_1x32x1x8_8_1x1_intrawave_v3,803.03,325.66,0.0
gfx942,304,33664,2560,5120,ck,0,0,1116.1763,a8w8_blockscale_1x128x128_256x128x128x128_16x16_32x32_2x2_8x32x1_8x32x1_1x32x1x8_8_1x1_intrawave_v3,790.63,320.58,0.0
gfx942,304,33792,2560,5120,ck,0,0,1118.7703,a8w8_blockscale_1x128x128_256x128x128x128_16x16_32x32_2x2_8x32x1_8x32x1_1x32x1x8_8_1x1_intrawave_v3,791.8,321.01,0.0
gfx942,304,33920,2560,5120,ck,0,0,1107.2521,a8w8_blockscale_1x128x128_256x128x128x128_16x16_32x32_2x2_8x32x1_8x32x1_1x32x1x8_8_1x1_intrawave_v3,803.06,325.53,0.0
gfx942,304,34048,2560,5120,ck,0,0,1111.4462,a8w8_blockscale_1x128x128_256x128x128x128_16x16_32x32_2x2_8x32x1_8x32x1_1x32x1x8_8_1x1_intrawave_v3,803.05,325.48,0.0
gfx942,304,34176,2560,5120,ck,0,0,1136.8062,a8w8_blockscale_1x128x128_256x128x128x128_16x16_32x32_2x2_8x32x1_8x32x1_1x32x1x8_8_1x1_intrawave_v3,788.09,319.38,0.0
gfx942,304,34304,2560,5120,ck,0,0,1128.1684,a8w8_blockscale_1x128x128_256x128x128x128_16x16_32x32_2x2_8x32x1_8x32x1_1x32x1x8_8_1x1_intrawave_v3,797.1,322.98,0.0
gfx942,304,34432,2560,5120,ck,0,0,1150.1689,a8w8_blockscale_1x128x128_256x128x128x128_16x16_32x32_2x2_8x32x1_8x32x1_1x32x1x8_8_1x1_intrawave_v3,784.77,317.95,0.0
gfx942,304,34560,2560,5120,ck,0,0,1152.5412,a8w8_blockscale_1x128x128_256x128x128x128_16x16_32x32_2x2_8x32x1_8x32x1_1x32x1x8_8_1x1_intrawave_v3,786.06,318.43,0.0
gfx942,304,34688,2560,5120,ck,0,0,1142.705,a8w8_blockscale_1x128x128_256x128x128x128_16x16_32x32_2x2_8x32x1_8x32x1_1x32x1x8_8_1x1_intrawave_v3,795.77,322.32,0.0
gfx942,304,34816,2560,5120,ck,0,0,1122.9142,a8w8_blockscale_1x128x128_256x128x128x128_16x16_32x32_2x2_8x32x1_8x32x1_1x32x1x8_8_1x1_intrawave_v3,812.78,329.16,0.0
gfx942,304,34944,2560,5120,ck,0,0,1141.3676,a8w8_blockscale_1x128x128_256x128x128x128_16x16_32x32_2x2_8x32x1_8x32x1_1x32x1x8_8_1x1_intrawave_v3,802.58,324.99,0.0
gfx942,304,35072,2560,5120,ck,0,0,1160.3379,a8w8_blockscale_1x128x128_256x128x128x128_16x16_32x32_2x2_8x32x1_8x32x1_1x32x1x8_8_1x1_intrawave_v3,792.35,320.81,0.0
gfx942,304,35200,2560,5120,ck,0,0,1147.4114,a8w8_blockscale_1x128x128_256x128x128x128_16x16_32x32_2x2_8x32x1_8x32x1_1x32x1x8_8_1x1_intrawave_v3,804.2,325.56,0.0
gfx942,304,35328,2560,5120,ck,0,0,1154.9166,a8w8_blockscale_1x128x128_256x128x128x128_16x16_32x32_2x2_8x32x1_8x32x1_1x32x1x8_8_1x1_intrawave_v3,801.88,324.58,0.0
gfx942,304,35456,2560,5120,ck,0,0,1171.3674,a8w8_blockscale_1x128x128_256x128x128x128_16x16_32x32_2x2_8x32x1_8x32x1_1x32x1x8_8_1x1_intrawave_v3,793.48,321.14,0.0
gfx942,304,35584,2560,5120,ck,0,0,1158.0777,a8w8_blockscale_1x128x128_256x128x128x128_16x16_32x32_2x2_8x32x1_8x32x1_1x32x1x8_8_1x1_intrawave_v3,805.48,325.96,0.0
gfx942,304,35712,2560,5120,ck,0,0,1193.8911,a8w8_blockscale_1x128x128_256x128x128x128_16x16_32x32_2x2_8x32x1_8x32x1_1x32x1x8_8_1x1_intrawave_v3,784.13,317.28,0.0
gfx942,304,35840,2560,5120,ck,0,0,1169.6018,a8w8_blockscale_1x128x128_256x128x128x128_16x16_32x32_2x2_8x32x1_8x32x1_1x32x1x8_8_1x1_intrawave_v3,803.29,324.99,0.0
gfx942,304,35968,2560,5120,ck,0,0,1185.6103,a8w8_blockscale_1x128x128_256x128x128x128_16x16_32x32_2x2_8x32x1_8x32x1_1x32x1x8_8_1x1_intrawave_v3,795.27,321.71,0.0
gfx942,304,36096,2560,5120,ck,0,0,1194.7827,a8w8_blockscale_1x128x128_256x128x128x128_16x16_32x32_2x2_8x32x1_8x32x1_1x32x1x8_8_1x1_intrawave_v3,791.97,320.33,0.0
gfx942,304,36224,2560,5120,ck,0,0,1168.0974,a8w8_blockscale_1x128x128_256x128x128x128_16x16_32x32_2x2_8x32x1_8x32x1_1x32x1x8_8_1x1_intrawave_v3,812.94,328.77,0.0
gfx942,304,36352,2560,5120,ck,0,0,1189.8213,a8w8_blockscale_1x128x128_256x128x128x128_16x16_32x32_2x2_8x32x1_8x32x1_1x32x1x8_8_1x1_intrawave_v3,800.92,323.87,0.0
gfx942,304,36480,2560,5120,ck,0,0,1182.0975,a8w8_blockscale_1x128x128_256x128x128x128_16x16_32x32_2x2_8x32x1_8x32x1_1x32x1x8_8_1x1_intrawave_v3,808.99,327.1,0.0
gfx942,304,36608,2560,5120,ck,0,0,1204.6481,a8w8_blockscale_1x128x128_256x128x128x128_16x16_32x32_2x2_8x32x1_8x32x1_1x32x1x8_8_1x1_intrawave_v3,796.63,322.06,0.0
gfx942,304,36736,2560,5120,ck,0,0,1209.3892,a8w8_blockscale_1x128x128_256x128x128x128_16x16_32x32_2x2_8x32x1_8x32x1_1x32x1x8_8_1x1_intrawave_v3,796.28,321.88,0.0
gfx942,304,36864,2560,5120,ck,0,0,1197.188,a8w8_blockscale_1x128x128_256x128x128x128_16x16_32x32_2x2_8x32x1_8x32x1_1x32x1x8_8_1x1_intrawave_v3,807.2,326.26,0.0
gfx942,304,36992,2560,5120,ck,0,0,1213.5482,a8w8_blockscale_1x128x128_256x128x128x128_16x16_32x32_2x2_8x32x1_8x32x1_1x32x1x8_8_1x1_intrawave_v3,799.08,322.94,0.0
gfx942,304,37120,2560,5120,ck,0,0,1224.4281,a8w8_blockscale_1x128x128_256x128x128x128_16x16_32x32_2x2_8x32x1_8x32x1_1x32x1x8_8_1x1_intrawave_v3,794.72,321.14,0.0
gfx942,304,37248,2560,5120,ck,0,0,1215.8542,a8w8_blockscale_1x128x128_256x128x128x128_16x16_32x32_2x2_8x32x1_8x32x1_1x32x1x8_8_1x1_intrawave_v3,803.08,324.49,0.0
gfx942,304,37376,2560,5120,ck,0,0,1223.8615,a8w8_blockscale_1x128x128_256x128x128x128_16x16_32x32_2x2_8x32x1_8x32x1_1x32x1x8_8_1x1_intrawave_v3,800.57,323.43,0.0
gfx942,304,37504,2560,5120,ck,0,0,1224.9416,a8w8_blockscale_1x128x128_256x128x128x128_16x16_32x32_2x2_8x32x1_8x32x1_1x32x1x8_8_1x1_intrawave_v3,802.61,324.22,0.0
gfx942,304,37632,2560,5120,ck,0,0,1245.2356,a8w8_blockscale_1x128x128_256x128x128x128_16x16_32x32_2x2_8x32x1_8x32x1_1x32x1x8_8_1x1_intrawave_v3,792.22,319.99,0.0
gfx942,304,37760,2560,5120,ck,0,0,1243.6369,a8w8_blockscale_1x128x128_256x128x128x128_16x16_32x32_2x2_8x32x1_8x32x1_1x32x1x8_8_1x1_intrawave_v3,795.94,321.45,0.0
gfx942,304,37888,2560,5120,ck,0,0,1242.2436,a8w8_blockscale_1x128x128_256x128x128x128_16x16_32x32_2x2_8x32x1_8x32x1_1x32x1x8_8_1x1_intrawave_v3,799.53,322.87,0.0
gfx942,304,38016,2560,5120,ck,0,0,1246.1038,a8w8_blockscale_1x128x128_256x128x128x128_16x16_32x32_2x2_8x32x1_8x32x1_1x32x1x8_8_1x1_intrawave_v3,799.75,322.92,0.0
gfx942,304,38144,2560,5120,ck,0,0,1256.2451,a8w8_blockscale_1x128x128_256x128x128x128_16x16_32x32_2x2_8x32x1_8x32x1_1x32x1x8_8_1x1_intrawave_v3,795.96,321.36,0.0
gfx942,304,38272,2560,5120,ck,0,0,1263.7011,a8w8_blockscale_1x128x128_256x128x128x128_16x16_32x32_2x2_8x32x1_8x32x1_1x32x1x8_8_1x1_intrawave_v3,793.92,320.5,0.0
gfx942,304,38400,2560,5120,ck,0,0,1255.9356,a8w8_blockscale_1x128x128_256x128x128x128_16x16_32x32_2x2_8x32x1_8x32x1_1x32x1x8_8_1x1_intrawave_v3,801.5,323.52,0.0
gfx942,304,38528,2560,5120,ck,0,0,1277.1217,a8w8_blockscale_1x128x128_256x128x128x128_16x16_32x32_2x2_8x32x1_8x32x1_1x32x1x8_8_1x1_intrawave_v3,790.83,319.18,0.0
gfx942,304,38656,2560,5120,ck,0,0,1280.097,a8w8_blockscale_1x128x128_256x128x128x128_16x16_32x32_2x2_8x32x1_8x32x1_1x32x1x8_8_1x1_intrawave_v3,791.61,319.46,0.0
gfx942,304,38784,2560,5120,ck,0,0,1270.9161,a8w8_blockscale_1x128x128_256x128x128x128_16x16_32x32_2x2_8x32x1_8x32x1_1x32x1x8_8_1x1_intrawave_v3,799.97,322.8,0.0
gfx942,304,38912,2560,5120,ck,0,0,1260.1653,a8w8_blockscale_1x128x128_256x128x128x128_16x16_32x32_2x2_8x32x1_8x32x1_1x32x1x8_8_1x1_intrawave_v3,809.46,326.6,0.0
gfx942,304,39040,2560,5120,ck,0,0,1288.7553,a8w8_blockscale_1x128x128_256x128x128x128_16x16_32x32_2x2_8x32x1_8x32x1_1x32x1x8_8_1x1_intrawave_v3,794.11,320.37,0.0
gfx942,304,39168,2560,5120,ck,0,0,1308.2531,a8w8_blockscale_1x128x128_256x128x128x128_16x16_32x32_2x2_8x32x1_8x32x1_1x32x1x8_8_1x1_intrawave_v3,784.84,316.6,0.0
gfx942,304,39296,2560,5120,ck,0,0,1286.9321,a8w8_blockscale_1x128x128_256x128x128x128_16x16_32x32_2x2_8x32x1_8x32x1_1x32x1x8_8_1x1_intrawave_v3,800.45,322.86,0.0
gfx942,304,39424,2560,5120,ck,0,0,1297.2992,a8w8_blockscale_1x128x128_256x128x128x128_16x16_32x32_2x2_8x32x1_8x32x1_1x32x1x8_8_1x1_intrawave_v3,796.64,321.29,0.0
gfx942,304,39552,2560,5120,ck,0,0,1316.7795,a8w8_blockscale_1x128x128_256x128x128x128_16x16_32x32_2x2_8x32x1_8x32x1_1x32x1x8_8_1x1_intrawave_v3,787.4,317.53,0.0
gfx942,304,39680,2560,5120,ck,0,0,1309.6032,a8w8_blockscale_1x128x128_256x128x128x128_16x16_32x32_2x2_8x32x1_8x32x1_1x32x1x8_8_1x1_intrawave_v3,794.28,320.27,0.0
gfx942,304,39808,2560,5120,ck,0,0,1296.024,a8w8_blockscale_1x128x128_256x128x128x128_16x16_32x32_2x2_8x32x1_8x32x1_1x32x1x8_8_1x1_intrawave_v3,805.19,324.64,0.0
gfx942,304,39936,2560,5120,ck,0,0,1310.9586,a8w8_blockscale_1x128x128_256x128x128x128_16x16_32x32_2x2_8x32x1_8x32x1_1x32x1x8_8_1x1_intrawave_v3,798.57,321.94,0.0
gfx942,304,40064,2560,5120,ck,0,0,1325.8449,a8w8_blockscale_1x128x128_256x128x128x128_16x16_32x32_2x2_8x32x1_8x32x1_1x32x1x8_8_1x1_intrawave_v3,792.14,319.32,0.0
gfx942,304,40192,2560,5120,ck,0,0,1335.0527,a8w8_blockscale_1x128x128_256x128x128x128_16x16_32x32_2x2_8x32x1_8x32x1_1x32x1x8_8_1x1_intrawave_v3,789.19,318.09,0.0
gfx942,304,40320,2560,5120,ck,0,0,1325.5537,a8w8_blockscale_1x128x128_256x128x128x128_16x16_32x32_2x2_8x32x1_8x32x1_1x32x1x8_8_1x1_intrawave_v3,797.38,321.36,0.0
gfx942,304,40448,2560,5120,ck,0,0,1326.4346,a8w8_blockscale_1x128x128_256x128x128x128_16x16_32x32_2x2_8x32x1_8x32x1_1x32x1x8_8_1x1_intrawave_v3,799.38,322.14,0.0
gfx942,304,40576,2560,5120,ck,0,0,1363.5635,a8w8_blockscale_1x128x128_256x128x128x128_16x16_32x32_2x2_8x32x1_8x32x1_1x32x1x8_8_1x1_intrawave_v3,780.07,314.33,0.0
gfx942,304,40704,2560,5120,ck,0,0,1342.7668,a8w8_blockscale_1x128x128_256x128x128x128_16x16_32x32_2x2_8x32x1_8x32x1_1x32x1x8_8_1x1_intrawave_v3,794.65,320.17,0.0
gfx942,304,40832,2560,5120,ck,0,0,1346.5438,a8w8_blockscale_1x128x128_256x128x128x128_16x16_32x32_2x2_8x32x1_8x32x1_1x32x1x8_8_1x1_intrawave_v3,794.91,320.25,0.0
gfx942,304,40960,2560,5120,ck,0,0,1327.7371,a8w8_blockscale_1x128x128_256x128x128x128_16x16_32x32_2x2_8x32x1_8x32x1_1x32x1x8_8_1x1_intrawave_v3,808.7,325.77,0.0
gfx942,304,41088,2560,5120,ck,0,0,1384.1754,a8w8_blockscale_1x128x128_256x128x128x128_16x16_32x32_2x2_8x32x1_8x32x1_1x32x1x8_8_1x1_intrawave_v3,778.15,313.43,0.0
gfx942,304,41216,2560,5120,ck,0,0,1381.5524,a8w8_blockscale_1x128x128_256x128x128x128_16x16_32x32_2x2_8x32x1_8x32x1_1x32x1x8_8_1x1_intrawave_v3,782.06,314.98,0.0
gfx942,304,41344,2560,5120,ck,0,0,1359.3586,a8w8_blockscale_1x128x128_256x128x128x128_16x16_32x32_2x2_8x32x1_8x32x1_1x32x1x8_8_1x1_intrawave_v3,797.29,321.09,0.0
gfx942,304,41472,2560,5120,ck,0,0,1358.2964,a8w8_blockscale_1x128x128_256x128x128x128_16x16_32x32_2x2_8x32x1_8x32x1_1x32x1x8_8_1x1_intrawave_v3,800.39,322.3,0.0
gfx942,304,41600,2560,5120,ck,0,0,1371.8834,a8w8_blockscale_1x128x128_256x128x128x128_16x16_32x32_2x2_8x32x1_8x32x1_1x32x1x8_8_1x1_intrawave_v3,794.91,320.06,0.0
gfx942,304,41728,2560,5120,ck,0,0,1381.7287,a8w8_blockscale_1x128x128_256x128x128x128_16x16_32x32_2x2_8x32x1_8x32x1_1x32x1x8_8_1x1_intrawave_v3,791.67,318.73,0.0
gfx942,304,41856,2560,5120,ck,0,0,1375.6648,a8w8_blockscale_1x128x128_256x128x128x128_16x16_32x32_2x2_8x32x1_8x32x1_1x32x1x8_8_1x1_intrawave_v3,797.6,321.09,0.0
gfx942,304,41984,2560,5120,ck,0,0,1395.1904,a8w8_blockscale_1x128x128_256x128x128x128_16x16_32x32_2x2_8x32x1_8x32x1_1x32x1x8_8_1x1_intrawave_v3,788.84,317.54,0.0
gfx942,304,42112,2560,5120,ck,0,0,1380.0241,a8w8_blockscale_1x128x128_256x128x128x128_16x16_32x32_2x2_8x32x1_8x32x1_1x32x1x8_8_1x1_intrawave_v3,799.94,321.98,0.0
gfx942,304,42240,2560,5120,ck,0,0,1400.1059,a8w8_blockscale_1x128x128_256x128x128x128_16x16_32x32_2x2_8x32x1_8x32x1_1x32x1x8_8_1x1_intrawave_v3,790.87,318.29,0.0
gfx942,304,42368,2560,5120,ck,0,0,1403.4641,a8w8_blockscale_1x128x128_256x128x128x128_16x16_32x32_2x2_8x32x1_8x32x1_1x32x1x8_8_1x1_intrawave_v3,791.36,318.47,0.0
gfx942,304,42496,2560,5120,ck,0,0,1391.5949,a8w8_blockscale_1x128x128_256x128x128x128_16x16_32x32_2x2_8x32x1_8x32x1_1x32x1x8_8_1x1_intrawave_v3,800.53,322.12,0.0
gfx942,304,42624,2560,5120,ck,0,0,1395.9806,a8w8_blockscale_1x128x128_256x128x128x128_16x16_32x32_2x2_8x32x1_8x32x1_1x32x1x8_8_1x1_intrawave_v3,800.41,322.05,0.0
gfx942,304,42752,2560,5120,ck,0,0,1437.5721,a8w8_blockscale_1x128x128_256x128x128x128_16x16_32x32_2x2_8x32x1_8x32x1_1x32x1x8_8_1x1_intrawave_v3,779.59,313.65,0.0
gfx942,304,42880,2560,5120,ck,0,0,1431.1288,a8w8_blockscale_1x128x128_256x128x128x128_16x16_32x32_2x2_8x32x1_8x32x1_1x32x1x8_8_1x1_intrawave_v3,785.45,315.97,0.0
gfx942,304,43008,2560,5120,ck,0,0,1401.2346,a8w8_blockscale_1x128x128_256x128x128x128_16x16_32x32_2x2_8x32x1_8x32x1_1x32x1x8_8_1x1_intrawave_v3,804.6,323.65,0.0
gfx942,304,43136,2560,5120,ck,0,0,1422.9032,a8w8_blockscale_1x128x128_256x128x128x128_16x16_32x32_2x2_8x32x1_8x32x1_1x32x1x8_8_1x1_intrawave_v3,794.7,319.64,0.0
gfx942,304,43264,2560,5120,ck,0,0,1439.7725,a8w8_blockscale_1x128x128_256x128x128x128_16x16_32x32_2x2_8x32x1_8x32x1_1x32x1x8_8_1x1_intrawave_v3,787.72,316.81,0.0
gfx942,304,43392,2560,5120,ck,0,0,1441.072,a8w8_blockscale_1x128x128_256x128x128x128_16x16_32x32_2x2_8x32x1_8x32x1_1x32x1x8_8_1x1_intrawave_v3,789.34,317.43,0.0
gfx942,304,43520,2560,5120,ck,0,0,1445.0772,a8w8_blockscale_1x128x128_256x128x128x128_16x16_32x32_2x2_8x32x1_8x32x1_1x32x1x8_8_1x1_intrawave_v3,789.47,317.46,0.0
gfx942,304,43648,2560,5120,ck,0,0,1450.6254,a8w8_blockscale_1x128x128_256x128x128x128_16x16_32x32_2x2_8x32x1_8x32x1_1x32x1x8_8_1x1_intrawave_v3,788.77,317.15,0.0
gfx942,304,43776,2560,5120,ck,0,0,1451.4414,a8w8_blockscale_1x128x128_256x128x128x128_16x16_32x32_2x2_8x32x1_8x32x1_1x32x1x8_8_1x1_intrawave_v3,790.64,317.87,0.0
gfx942,304,43904,2560,5120,ck,0,0,1463.7337,a8w8_blockscale_1x128x128_256x128x128x128_16x16_32x32_2x2_8x32x1_8x32x1_1x32x1x8_8_1x1_intrawave_v3,786.29,316.1,0.0
gfx942,304,44032,2560,5120,ck,0,0,1461.4857,a8w8_blockscale_1x128x128_256x128x128x128_16x16_32x32_2x2_8x32x1_8x32x1_1x32x1x8_8_1x1_intrawave_v3,789.79,317.48,0.0
gfx942,304,44160,2560,5120,ck,0,0,1457.6371,a8w8_blockscale_1x128x128_256x128x128x128_16x16_32x32_2x2_8x32x1_8x32x1_1x32x1x8_8_1x1_intrawave_v3,794.18,319.22,0.0
gfx942,304,44288,2560,5120,ck,0,0,1484.5802,a8w8_blockscale_1x128x128_256x128x128x128_16x16_32x32_2x2_8x32x1_8x32x1_1x32x1x8_8_1x1_intrawave_v3,782.03,314.31,0.0
gfx942,304,44416,2560,5120,ck,0,0,1480.702,a8w8_blockscale_1x128x128_256x128x128x128_16x16_32x32_2x2_8x32x1_8x32x1_1x32x1x8_8_1x1_intrawave_v3,786.34,316.02,0.0
gfx942,304,44544,2560,5120,ck,0,0,1471.84,a8w8_blockscale_1x128x128_256x128x128x128_16x16_32x32_2x2_8x32x1_8x32x1_1x32x1x8_8_1x1_intrawave_v3,793.36,318.81,0.0
gfx942,304,44672,2560,5120,ck,0,0,1482.5543,a8w8_blockscale_1x128x128_256x128x128x128_16x16_32x32_2x2_8x32x1_8x32x1_1x32x1x8_8_1x1_intrawave_v3,789.89,317.39,0.0
gfx942,304,44800,2560,5120,ck,0,0,1488.0625,a8w8_blockscale_1x128x128_256x128x128x128_16x16_32x32_2x2_8x32x1_8x32x1_1x32x1x8_8_1x1_intrawave_v3,789.22,317.1,0.0
gfx942,304,44928,2560,5120,ck,0,0,1485.9222,a8w8_blockscale_1x128x128_256x128x128x128_16x16_32x32_2x2_8x32x1_8x32x1_1x32x1x8_8_1x1_intrawave_v3,792.61,318.44,0.0
gfx942,304,45056,2560,5120,ck,0,0,1469.7416,a8w8_blockscale_1x128x128_256x128x128x128_16x16_32x32_2x2_8x32x1_8x32x1_1x32x1x8_8_1x1_intrawave_v3,803.62,322.83,0.0
gfx942,304,45184,2560,5120,ck,0,0,1508.4593,a8w8_blockscale_1x128x128_256x128x128x128_16x16_32x32_2x2_8x32x1_8x32x1_1x32x1x8_8_1x1_intrawave_v3,785.22,315.42,0.0
gfx942,304,45312,2560,5120,ck,0,0,1493.7821,a8w8_blockscale_1x128x128_256x128x128x128_16x16_32x32_2x2_8x32x1_8x32x1_1x32x1x8_8_1x1_intrawave_v3,795.18,319.39,0.0
gfx942,304,45440,2560,5120,ck,0,0,1494.4292,a8w8_blockscale_1x128x128_256x128x128x128_16x16_32x32_2x2_8x32x1_8x32x1_1x32x1x8_8_1x1_intrawave_v3,797.08,320.13,0.0
gfx942,304,45568,2560,5120,ck,0,0,1499.5401,a8w8_blockscale_1x128x128_256x128x128x128_16x16_32x32_2x2_8x32x1_8x32x1_1x32x1x8_8_1x1_intrawave_v3,796.6,319.91,0.0
gfx942,304,45696,2560,5120,ck,0,0,1519.3263,a8w8_blockscale_1x128x128_256x128x128x128_16x16_32x32_2x2_8x32x1_8x32x1_1x32x1x8_8_1x1_intrawave_v3,788.44,316.61,0.0
gfx942,304,45824,2560,5120,ck,0,0,1507.4498,a8w8_blockscale_1x128x128_256x128x128x128_16x16_32x32_2x2_8x32x1_8x32x1_1x32x1x8_8_1x1_intrawave_v3,796.87,319.97,0.0
gfx942,304,45952,2560,5120,ck,0,0,1522.7977,a8w8_blockscale_1x128x128_256x128x128x128_16x16_32x32_2x2_8x32x1_8x32x1_1x32x1x8_8_1x1_intrawave_v3,791.05,317.61,0.0
gfx942,304,46080,2560,5120,ck,0,0,1534.2935,a8w8_blockscale_1x128x128_256x128x128x128_16x16_32x32_2x2_8x32x1_8x32x1_1x32x1x8_8_1x1_intrawave_v3,787.31,316.08,0.0
gfx942,304,46208,2560,5120,ck,0,0,1571.8141,a8w8_blockscale_1x128x128_256x128x128x128_16x16_32x32_2x2_8x32x1_8x32x1_1x32x1x8_8_1x1_intrawave_v3,770.65,309.37,0.0
gfx942,304,46336,2560,5120,ck,0,0,1559.435,a8w8_blockscale_1x128x128_256x128x128x128_16x16_32x32_2x2_8x32x1_8x32x1_1x32x1x8_8_1x1_intrawave_v3,778.92,312.67,0.0
gfx942,304,46464,2560,5120,ck,0,0,1522.1554,a8w8_blockscale_1x128x128_256x128x128x128_16x16_32x32_2x2_8x32x1_8x32x1_1x32x1x8_8_1x1_intrawave_v3,800.2,321.19,0.0
gfx942,304,46592,2560,5120,ck,0,0,1531.7738,a8w8_blockscale_1x128x128_256x128x128x128_16x16_32x32_2x2_8x32x1_8x32x1_1x32x1x8_8_1x1_intrawave_v3,797.36,320.03,0.0
gfx942,304,46720,2560,5120,ck,0,0,1535.5439,a8w8_blockscale_1x128x128_256x128x128x128_16x16_32x32_2x2_8x32x1_8x32x1_1x32x1x8_8_1x1_intrawave_v3,797.59,320.1,0.0
gfx942,304,46848,2560,5120,ck,0,0,1538.9931,a8w8_blockscale_1x128x128_256x128x128x128_16x16_32x32_2x2_8x32x1_8x32x1_1x32x1x8_8_1x1_intrawave_v3,797.98,320.23,0.0
gfx942,304,46976,2560,5120,ck,0,0,1552.4564,a8w8_blockscale_1x128x128_256x128x128x128_16x16_32x32_2x2_8x32x1_8x32x1_1x32x1x8_8_1x1_intrawave_v3,793.23,318.3,0.0
gfx942,304,47104,2560,5120,ck,0,0,1534.1038,a8w8_blockscale_1x128x128_256x128x128x128_16x16_32x32_2x2_8x32x1_8x32x1_1x32x1x8_8_1x1_intrawave_v3,804.9,322.96,0.0
gfx942,304,47232,2560,5120,ck,0,0,1574.9781,a8w8_blockscale_1x128x128_256x128x128x128_16x16_32x32_2x2_8x32x1_8x32x1_1x32x1x8_8_1x1_intrawave_v3,786.14,315.41,0.0
gfx942,304,47360,2560,5120,ck,0,0,1574.6586,a8w8_blockscale_1x128x128_256x128x128x128_16x16_32x32_2x2_8x32x1_8x32x1_1x32x1x8_8_1x1_intrawave_v3,788.43,316.31,0.0
gfx942,304,47488,2560,5120,ck,0,0,1567.7985,a8w8_blockscale_1x128x128_256x128x128x128_16x16_32x32_2x2_8x32x1_8x32x1_1x32x1x8_8_1x1_intrawave_v3,794.02,318.53,0.0
gfx942,304,47616,2560,5120,ck,0,0,1572.3913,a8w8_blockscale_1x128x128_256x128x128x128_16x16_32x32_2x2_8x32x1_8x32x1_1x32x1x8_8_1x1_intrawave_v3,793.84,318.43,0.0
gfx942,304,47744,2560,5120,ck,0,0,1579.2026,a8w8_blockscale_1x128x128_256x128x128x128_16x16_32x32_2x2_8x32x1_8x32x1_1x32x1x8_8_1x1_intrawave_v3,792.54,317.89,0.0
gfx942,304,47872,2560,5120,ck,0,0,1630.3759,a8w8_blockscale_1x128x128_256x128x128x128_16x16_32x32_2x2_8x32x1_8x32x1_1x32x1x8_8_1x1_intrawave_v3,769.72,308.71,0.0
gfx942,304,48000,2560,5120,ck,0,0,1617.9225,a8w8_blockscale_1x128x128_256x128x128x128_16x16_32x32_2x2_8x32x1_8x32x1_1x32x1x8_8_1x1_intrawave_v3,777.72,311.9,0.0
gfx942,304,48128,2560,5120,ck,0,0,1582.3402,a8w8_blockscale_1x128x128_256x128x128x128_16x16_32x32_2x2_8x32x1_8x32x1_1x32x1x8_8_1x1_intrawave_v3,797.33,319.74,0.0
gfx942,304,48256,2560,5120,ck,0,0,1618.5431,a8w8_blockscale_1x128x128_256x128x128x128_16x16_32x32_2x2_8x32x1_8x32x1_1x32x1x8_8_1x1_intrawave_v3,781.57,313.4,0.0
gfx942,304,48384,2560,5120,ck,0,0,1640.8541,a8w8_blockscale_1x128x128_256x128x128x128_16x16_32x32_2x2_8x32x1_8x32x1_1x32x1x8_8_1x1_intrawave_v3,772.99,309.94,0.0
gfx942,304,48512,2560,5120,ck,0,0,1606.0055,a8w8_blockscale_1x128x128_256x128x128x128_16x16_32x32_2x2_8x32x1_8x32x1_1x32x1x8_8_1x1_intrawave_v3,791.85,317.48,0.0
gfx942,304,48640,2560,5120,ck,0,0,1604.5262,a8w8_blockscale_1x128x128_256x128x128x128_16x16_32x32_2x2_8x32x1_8x32x1_1x32x1x8_8_1x1_intrawave_v3,794.67,318.59,0.0
gfx942,304,48768,2560,5120,ck,0,0,1608.2682,a8w8_blockscale_1x128x128_256x128x128x128_16x16_32x32_2x2_8x32x1_8x32x1_1x32x1x8_8_1x1_intrawave_v3,794.91,318.66,0.0
gfx942,304,48896,2560,5120,ck,0,0,1606.2095,a8w8_blockscale_1x128x128_256x128x128x128_16x16_32x32_2x2_8x32x1_8x32x1_1x32x1x8_8_1x1_intrawave_v3,798.02,319.88,0.0
gfx942,304,49024,2560,5120,ck,0,0,1594.9577,a8w8_blockscale_1x128x128_256x128x128x128_16x16_32x32_2x2_8x32x1_8x32x1_1x32x1x8_8_1x1_intrawave_v3,805.75,322.96,0.0
gfx942,304,49152,2560,5120,ck,0,0,1620.2165,a8w8_blockscale_1x128x128_256x128x128x128_16x16_32x32_2x2_8x32x1_8x32x1_1x32x1x8_8_1x1_intrawave_v3,795.26,318.74,0.0
gfx942,304,49280,2560,5120,ck,0,0,1613.7407,a8w8_blockscale_1x128x128_256x128x128x128_16x16_32x32_2x2_8x32x1_8x32x1_1x32x1x8_8_1x1_intrawave_v3,800.53,320.83,0.0
gfx942,304,49408,2560,5120,ck,0,0,1652.3016,a8w8_blockscale_1x128x128_256x128x128x128_16x16_32x32_2x2_8x32x1_8x32x1_1x32x1x8_8_1x1_intrawave_v3,783.88,314.13,0.0
gfx942,304,49536,2560,5120,ck,0,0,1621.5372,a8w8_blockscale_1x128x128_256x128x128x128_16x16_32x32_2x2_8x32x1_8x32x1_1x32x1x8_8_1x1_intrawave_v3,800.82,320.9,0.0
gfx942,304,49664,2560,5120,ck,0,0,1638.9074,a8w8_blockscale_1x128x128_256x128x128x128_16x16_32x32_2x2_8x32x1_8x32x1_1x32x1x8_8_1x1_intrawave_v3,794.38,318.3,0.0
gfx942,304,49792,2560,5120,ck,0,0,1644.3009,a8w8_blockscale_1x128x128_256x128x128x128_16x16_32x32_2x2_8x32x1_8x32x1_1x32x1x8_8_1x1_intrawave_v3,793.81,318.05,0.0
gfx942,304,49920,2560,5120,ck,0,0,1647.2836,a8w8_blockscale_1x128x128_256x128x128x128_16x16_32x32_2x2_8x32x1_8x32x1_1x32x1x8_8_1x1_intrawave_v3,794.41,318.27,0.0
gfx942,304,50048,2560,5120,ck,0,0,1664.1047,a8w8_blockscale_1x128x128_256x128x128x128_16x16_32x32_2x2_8x32x1_8x32x1_1x32x1x8_8_1x1_intrawave_v3,788.4,315.84,0.0
gfx942,304,50176,2560,5120,ck,0,0,1640.0928,a8w8_blockscale_1x128x128_256x128x128x128_16x16_32x32_2x2_8x32x1_8x32x1_1x32x1x8_8_1x1_intrawave_v3,801.99,321.27,0.0
gfx942,304,50304,2560,5120,ck,0,0,1664.734,a8w8_blockscale_1x128x128_256x128x128x128_16x16_32x32_2x2_8x32x1_8x32x1_1x32x1x8_8_1x1_intrawave_v3,792.13,317.3,0.0
gfx942,304,50432,2560,5120,ck,0,0,1706.8003,a8w8_blockscale_1x128x128_256x128x128x128_16x16_32x32_2x2_8x32x1_8x32x1_1x32x1x8_8_1x1_intrawave_v3,774.57,310.25,0.0
gfx942,304,50560,2560,5120,ck,0,0,1694.5691,a8w8_blockscale_1x128x128_256x128x128x128_16x16_32x32_2x2_8x32x1_8x32x1_1x32x1x8_8_1x1_intrawave_v3,782.15,313.26,0.0
gfx942,304,50688,2560,5120,ck,0,0,1649.6103,a8w8_blockscale_1x128x128_256x128x128x128_16x16_32x32_2x2_8x32x1_8x32x1_1x32x1x8_8_1x1_intrawave_v3,805.5,322.59,0.0
gfx942,304,50816,2560,5120,ck,0,0,1666.6142,a8w8_blockscale_1x128x128_256x128x128x128_16x16_32x32_2x2_8x32x1_8x32x1_1x32x1x8_8_1x1_intrawave_v3,799.29,320.09,0.0
gfx942,304,50944,2560,5120,ck,0,0,1681.4014,a8w8_blockscale_1x128x128_256x128x128x128_16x16_32x32_2x2_8x32x1_8x32x1_1x32x1x8_8_1x1_intrawave_v3,794.26,318.05,0.0
gfx942,304,51072,2560,5120,ck,0,0,1680.6299,a8w8_blockscale_1x128x128_256x128x128x128_16x16_32x32_2x2_8x32x1_8x32x1_1x32x1x8_8_1x1_intrawave_v3,796.62,318.98,0.0
gfx942,304,51200,2560,5120,ck,0,0,1664.4347,a8w8_blockscale_1x128x128_256x128x128x128_16x16_32x32_2x2_8x32x1_8x32x1_1x32x1x8_8_1x1_intrawave_v3,806.39,322.87,0.0
gfx942,304,51328,2560,5120,ck,0,0,1690.2981,a8w8_blockscale_1x128x128_256x128x128x128_16x16_32x32_2x2_8x32x1_8x32x1_1x32x1x8_8_1x1_intrawave_v3,796.03,318.7,0.0
gfx942,304,51456,2560,5120,ck,0,0,1702.9759,a8w8_blockscale_1x128x128_256x128x128x128_16x16_32x32_2x2_8x32x1_8x32x1_1x32x1x8_8_1x1_intrawave_v3,792.08,317.1,0.0
gfx942,304,51584,2560,5120,ck,0,0,1705.624,a8w8_blockscale_1x128x128_256x128x128x128_16x16_32x32_2x2_8x32x1_8x32x1_1x32x1x8_8_1x1_intrawave_v3,792.81,317.38,0.0
gfx942,304,51712,2560,5120,ck,0,0,1703.6748,a8w8_blockscale_1x128x128_256x128x128x128_16x16_32x32_2x2_8x32x1_8x32x1_1x32x1x8_8_1x1_intrawave_v3,795.69,318.51,0.0
gfx942,304,51840,2560,5120,ck,0,0,1757.2376,a8w8_blockscale_1x128x128_256x128x128x128_16x16_32x32_2x2_8x32x1_8x32x1_1x32x1x8_8_1x1_intrawave_v3,773.35,309.55,0.0
gfx942,304,51968,2560,5120,ck,0,0,1727.7291,a8w8_blockscale_1x128x128_256x128x128x128_16x16_32x32_2x2_8x32x1_8x32x1_1x32x1x8_8_1x1_intrawave_v3,788.5,315.59,0.0
gfx942,304,52096,2560,5120,ck,0,0,1735.7012,a8w8_blockscale_1x128x128_256x128x128x128_16x16_32x32_2x2_8x32x1_8x32x1_1x32x1x8_8_1x1_intrawave_v3,786.81,314.9,0.0
gfx942,304,52224,2560,5120,ck,0,0,1765.1012,a8w8_blockscale_1x128x128_256x128x128x128_16x16_32x32_2x2_8x32x1_8x32x1_1x32x1x8_8_1x1_intrawave_v3,775.6,310.4,0.0
gfx942,304,52352,2560,5120,ck,0,0,1742.5118,a8w8_blockscale_1x128x128_256x128x128x128_16x16_32x32_2x2_8x32x1_8x32x1_1x32x1x8_8_1x1_intrawave_v3,787.59,315.17,0.0
gfx942,304,52480,2560,5120,ck,0,0,1750.0985,a8w8_blockscale_1x128x128_256x128x128x128_16x16_32x32_2x2_8x32x1_8x32x1_1x32x1x8_8_1x1_intrawave_v3,786.09,314.56,0.0
gfx942,304,52608,2560,5120,ck,0,0,1717.8001,a8w8_blockscale_1x128x128_256x128x128x128_16x16_32x32_2x2_8x32x1_8x32x1_1x32x1x8_8_1x1_intrawave_v3,802.82,321.23,0.0
gfx942,304,52736,2560,5120,ck,0,0,1781.8958,a8w8_blockscale_1x128x128_256x128x128x128_16x16_32x32_2x2_8x32x1_8x32x1_1x32x1x8_8_1x1_intrawave_v3,775.83,310.41,0.0
gfx942,304,52864,2560,5120,ck,0,0,1744.2939,a8w8_blockscale_1x128x128_256x128x128x128_16x16_32x32_2x2_8x32x1_8x32x1_1x32x1x8_8_1x1_intrawave_v3,794.48,317.86,0.0
gfx942,304,52992,2560,5120,ck,0,0,1762.8326,a8w8_blockscale_1x128x128_256x128x128x128_16x16_32x32_2x2_8x32x1_8x32x1_1x32x1x8_8_1x1_intrawave_v3,788.02,315.26,0.0
gfx942,304,53120,2560,5120,ck,0,0,1774.8804,a8w8_blockscale_1x128x128_256x128x128x128_16x16_32x32_2x2_8x32x1_8x32x1_1x32x1x8_8_1x1_intrawave_v3,784.56,313.86,0.0
gfx942,304,53248,2560,5120,ck,0,0,1780.6618,a8w8_blockscale_1x128x128_256x128x128x128_16x16_32x32_2x2_8x32x1_8x32x1_1x32x1x8_8_1x1_intrawave_v3,783.9,313.57,0.0
gfx942,304,53376,2560,5120,ck,0,0,1787.4449,a8w8_blockscale_1x128x128_256x128x128x128_16x16_32x32_2x2_8x32x1_8x32x1_1x32x1x8_8_1x1_intrawave_v3,782.8,313.12,0.0
gfx942,304,53504,2560,5120,ck,0,0,1789.9207,a8w8_blockscale_1x128x128_256x128x128x128_16x16_32x32_2x2_8x32x1_8x32x1_1x32x1x8_8_1x1_intrawave_v3,783.6,313.42,0.0
gfx942,304,53632,2560,5120,ck,0,0,1794.7678,a8w8_blockscale_1x128x128_256x128x128x128_16x16_32x32_2x2_8x32x1_8x32x1_1x32x1x8_8_1x1_intrawave_v3,783.35,313.3,0.0
gfx942,304,53760,2560,5120,ck,0,0,1797.9254,a8w8_blockscale_1x128x128_256x128x128x128_16x16_32x32_2x2_8x32x1_8x32x1_1x32x1x8_8_1x1_intrawave_v3,783.84,313.48,0.0
gfx942,304,53888,2560,5120,ck,0,0,1776.1194,a8w8_blockscale_1x128x128_256x128x128x128_16x16_32x32_2x2_8x32x1_8x32x1_1x32x1x8_8_1x1_intrawave_v3,795.35,318.06,0.0
gfx942,304,54016,2560,5120,ck,0,0,1792.2089,a8w8_blockscale_1x128x128_256x128x128x128_16x16_32x32_2x2_8x32x1_8x32x1_1x32x1x8_8_1x1_intrawave_v3,790.08,315.94,0.0
gfx942,304,54144,2560,5120,ck,0,0,1777.4476,a8w8_blockscale_1x128x128_256x128x128x128_16x16_32x32_2x2_8x32x1_8x32x1_1x32x1x8_8_1x1_intrawave_v3,798.53,319.3,0.0
gfx942,304,54272,2560,5120,ck,0,0,1839.3084,a8w8_blockscale_1x128x128_256x128x128x128_16x16_32x32_2x2_8x32x1_8x32x1_1x32x1x8_8_1x1_intrawave_v3,773.5,309.28,0.0
gfx942,304,54400,2560,5120,ck,0,0,1800.8862,a8w8_blockscale_1x128x128_256x128x128x128_16x16_32x32_2x2_8x32x1_8x32x1_1x32x1x8_8_1x1_intrawave_v3,791.87,316.6,0.0
gfx942,304,54528,2560,5120,ck,0,0,1849.6657,a8w8_blockscale_1x128x128_256x128x128x128_16x16_32x32_2x2_8x32x1_8x32x1_1x32x1x8_8_1x1_intrawave_v3,772.8,308.96,0.0
gfx942,304,54656,2560,5120,ck,0,0,1825.7568,a8w8_blockscale_1x128x128_256x128x128x128_16x16_32x32_2x2_8x32x1_8x32x1_1x32x1x8_8_1x1_intrawave_v3,784.76,313.72,0.0
gfx942,304,54784,2560,5120,ck,0,0,1859.9024,a8w8_blockscale_1x128x128_256x128x128x128_16x16_32x32_2x2_8x32x1_8x32x1_1x32x1x8_8_1x1_intrawave_v3,772.15,308.67,0.0
gfx942,304,54912,2560,5120,ck,0,0,1811.8568,a8w8_blockscale_1x128x128_256x128x128x128_16x16_32x32_2x2_8x32x1_8x32x1_1x32x1x8_8_1x1_intrawave_v3,794.48,317.58,0.0
gfx942,304,55040,2560,5120,ck,0,0,1821.3441,a8w8_blockscale_1x128x128_256x128x128x128_16x16_32x32_2x2_8x32x1_8x32x1_1x32x1x8_8_1x1_intrawave_v3,792.18,316.64,0.0
gfx942,304,55168,2560,5120,ck,0,0,1844.9969,a8w8_blockscale_1x128x128_256x128x128x128_16x16_32x32_2x2_8x32x1_8x32x1_1x32x1x8_8_1x1_intrawave_v3,783.85,313.29,0.0
gfx942,304,55296,2560,5120,ck,0,0,1813.745,a8w8_blockscale_1x128x128_256x128x128x128_16x16_32x32_2x2_8x32x1_8x32x1_1x32x1x8_8_1x1_intrawave_v3,799.2,319.42,0.0
gfx942,304,55424,2560,5120,ck,0,0,1833.2464,a8w8_blockscale_1x128x128_256x128x128x128_16x16_32x32_2x2_8x32x1_8x32x1_1x32x1x8_8_1x1_intrawave_v3,792.53,316.73,0.0
gfx942,304,55552,2560,5120,ck,0,0,1833.0673,a8w8_blockscale_1x128x128_256x128x128x128_16x16_32x32_2x2_8x32x1_8x32x1_1x32x1x8_8_1x1_intrawave_v3,794.44,317.48,0.0
gfx942,304,55680,2560,5120,ck,0,0,1832.5966,a8w8_blockscale_1x128x128_256x128x128x128_16x16_32x32_2x2_8x32x1_8x32x1_1x32x1x8_8_1x1_intrawave_v3,796.48,318.28,0.0
gfx942,304,55808,2560,5120,ck,0,0,1865.9526,a8w8_blockscale_1x128x128_256x128x128x128_16x16_32x32_2x2_8x32x1_8x32x1_1x32x1x8_8_1x1_intrawave_v3,784.04,313.29,0.0
gfx942,304,55936,2560,5120,ck,0,0,1848.6061,a8w8_blockscale_1x128x128_256x128x128x128_16x16_32x32_2x2_8x32x1_8x32x1_1x32x1x8_8_1x1_intrawave_v3,793.21,316.94,0.0
gfx942,304,56064,2560,5120,ck,0,0,1851.0223,a8w8_blockscale_1x128x128_256x128x128x128_16x16_32x32_2x2_8x32x1_8x32x1_1x32x1x8_8_1x1_intrawave_v3,793.99,317.23,0.0
gfx942,304,56192,2560,5120,ck,0,0,1849.341,a8w8_blockscale_1x128x128_256x128x128x128_16x16_32x32_2x2_8x32x1_8x32x1_1x32x1x8_8_1x1_intrawave_v3,796.52,318.23,0.0
gfx942,304,56320,2560,5120,ck,0,0,1892.2357,a8w8_blockscale_1x128x128_256x128x128x128_16x16_32x32_2x2_8x32x1_8x32x1_1x32x1x8_8_1x1_intrawave_v3,780.24,311.71,0.0
gfx942,304,56448,2560,5120,ck,0,0,1868.1727,a8w8_blockscale_1x128x128_256x128x128x128_16x16_32x32_2x2_8x32x1_8x32x1_1x32x1x8_8_1x1_intrawave_v3,792.08,316.42,0.0
gfx942,304,56576,2560,5120,ck,0,0,1863.5343,a8w8_blockscale_1x128x128_256x128x128x128_16x16_32x32_2x2_8x32x1_8x32x1_1x32x1x8_8_1x1_intrawave_v3,795.86,317.91,0.0
gfx942,304,56704,2560,5120,ck,0,0,1877.1022,a8w8_blockscale_1x128x128_256x128x128x128_16x16_32x32_2x2_8x32x1_8x32x1_1x32x1x8_8_1x1_intrawave_v3,791.89,316.32,0.0
gfx942,304,56832,2560,5120,ck,0,0,1898.7272,a8w8_blockscale_1x128x128_256x128x128x128_16x16_32x32_2x2_8x32x1_8x32x1_1x32x1x8_8_1x1_intrawave_v3,784.64,313.4,0.0
gfx942,304,56960,2560,5120,ck,0,0,1933.8544,a8w8_blockscale_1x128x128_256x128x128x128_16x16_32x32_2x2_8x32x1_8x32x1_1x32x1x8_8_1x1_intrawave_v3,772.12,308.39,0.0
gfx942,304,57088,2560,5120,ck,0,0,1882.1177,a8w8_blockscale_1x128x128_256x128x128x128_16x16_32x32_2x2_8x32x1_8x32x1_1x32x1x8_8_1x1_intrawave_v3,795.13,317.56,0.0
gfx942,304,57216,2560,5120,ck,0,0,1890.177,a8w8_blockscale_1x128x128_256x128x128x128_16x16_32x32_2x2_8x32x1_8x32x1_1x32x1x8_8_1x1_intrawave_v3,793.51,316.9,0.0
gfx942,304,57344,2560,5120,ck,0,0,1911.8827,a8w8_blockscale_1x128x128_256x128x128x128_16x16_32x32_2x2_8x32x1_8x32x1_1x32x1x8_8_1x1_intrawave_v3,786.26,313.99,0.0
gfx942,304,57472,2560,5120,ck,0,0,1951.1291,a8w8_blockscale_1x128x128_256x128x128x128_16x16_32x32_2x2_8x32x1_8x32x1_1x32x1x8_8_1x1_intrawave_v3,772.17,308.34,0.0
gfx942,304,57600,2560,5120,ck,0,0,1936.2515,a8w8_blockscale_1x128x128_256x128x128x128_16x16_32x32_2x2_8x32x1_8x32x1_1x32x1x8_8_1x1_intrawave_v3,779.83,311.39,0.0
gfx942,304,57728,2560,5120,ck,0,0,1902.5725,a8w8_blockscale_1x128x128_256x128x128x128_16x16_32x32_2x2_8x32x1_8x32x1_1x32x1x8_8_1x1_intrawave_v3,795.4,317.59,0.0
gfx942,304,57856,2560,5120,ck,0,0,1908.5314,a8w8_blockscale_1x128x128_256x128x128x128_16x16_32x32_2x2_8x32x1_8x32x1_1x32x1x8_8_1x1_intrawave_v3,794.67,317.29,0.0
gfx942,304,57984,2560,5120,ck,0,0,1934.985,a8w8_blockscale_1x128x128_256x128x128x128_16x16_32x32_2x2_8x32x1_8x32x1_1x32x1x8_8_1x1_intrawave_v3,785.54,313.63,0.0
gfx942,304,58112,2560,5120,ck,0,0,1938.4159,a8w8_blockscale_1x128x128_256x128x128x128_16x16_32x32_2x2_8x32x1_8x32x1_1x32x1x8_8_1x1_intrawave_v3,785.88,313.75,0.0
gfx942,304,58240,2560,5120,ck,0,0,1940.7758,a8w8_blockscale_1x128x128_256x128x128x128_16x16_32x32_2x2_8x32x1_8x32x1_1x32x1x8_8_1x1_intrawave_v3,786.66,314.04,0.0
gfx942,304,58368,2560,5120,ck,0,0,1938.8995,a8w8_blockscale_1x128x128_256x128x128x128_16x16_32x32_2x2_8x32x1_8x32x1_1x32x1x8_8_1x1_intrawave_v3,789.15,315.02,0.0
gfx942,304,58496,2560,5120,ck,0,0,1944.011,a8w8_blockscale_1x128x128_256x128x128x128_16x16_32x32_2x2_8x32x1_8x32x1_1x32x1x8_8_1x1_intrawave_v3,788.8,314.87,0.0
gfx942,304,58624,2560,5120,ck,0,0,1947.9021,a8w8_blockscale_1x128x128_256x128x128x128_16x16_32x32_2x2_8x32x1_8x32x1_1x32x1x8_8_1x1_intrawave_v3,788.95,314.91,0.0
gfx942,304,58752,2560,5120,ck,0,0,1959.4146,a8w8_blockscale_1x128x128_256x128x128x128_16x16_32x32_2x2_8x32x1_8x32x1_1x32x1x8_8_1x1_intrawave_v3,786.02,313.73,0.0
gfx942,304,58880,2560,5120,ck,0,0,1941.8603,a8w8_blockscale_1x128x128_256x128x128x128_16x16_32x32_2x2_8x32x1_8x32x1_1x32x1x8_8_1x1_intrawave_v3,794.86,317.24,0.0
gfx942,304,59008,2560,5120,ck,0,0,1967.5346,a8w8_blockscale_1x128x128_256x128x128x128_16x16_32x32_2x2_8x32x1_8x32x1_1x32x1x8_8_1x1_intrawave_v3,786.19,313.77,0.0
gfx942,304,59136,2560,5120,ck,0,0,1975.5274,a8w8_blockscale_1x128x128_256x128x128x128_16x16_32x32_2x2_8x32x1_8x32x1_1x32x1x8_8_1x1_intrawave_v3,784.71,313.16,0.0
gfx942,304,59264,2560,5120,ck,0,0,1950.8038,a8w8_blockscale_1x128x128_256x128x128x128_16x16_32x32_2x2_8x32x1_8x32x1_1x32x1x8_8_1x1_intrawave_v3,796.37,317.8,0.0
gfx942,304,59392,2560,5120,ck,0,0,1949.7707,a8w8_blockscale_1x128x128_256x128x128x128_16x16_32x32_2x2_8x32x1_8x32x1_1x32x1x8_8_1x1_intrawave_v3,798.52,318.64,0.0
gfx942,304,59520,2560,5120,ck,0,0,1964.0629,a8w8_blockscale_1x128x128_256x128x128x128_16x16_32x32_2x2_8x32x1_8x32x1_1x32x1x8_8_1x1_intrawave_v3,794.42,316.99,0.0
gfx942,304,59648,2560,5120,ck,0,0,1982.2885,a8w8_blockscale_1x128x128_256x128x128x128_16x16_32x32_2x2_8x32x1_8x32x1_1x32x1x8_8_1x1_intrawave_v3,788.8,314.74,0.0
gfx942,304,59776,2560,5120,ck,0,0,2031.0156,a8w8_blockscale_1x128x128_256x128x128x128_16x16_32x32_2x2_8x32x1_8x32x1_1x32x1x8_8_1x1_intrawave_v3,771.53,307.83,0.0
gfx942,304,59904,2560,5120,ck,0,0,1999.504,a8w8_blockscale_1x128x128_256x128x128x128_16x16_32x32_2x2_8x32x1_8x32x1_1x32x1x8_8_1x1_intrawave_v3,785.37,313.34,0.0
gfx942,304,60032,2560,5120,ck,0,0,2040.3607,a8w8_blockscale_1x128x128_256x128x128x128_16x16_32x32_2x2_8x32x1_8x32x1_1x32x1x8_8_1x1_intrawave_v3,771.29,307.71,0.0
gfx942,304,60160,2560,5120,ck,0,0,1986.438,a8w8_blockscale_1x128x128_256x128x128x128_16x16_32x32_2x2_8x32x1_8x32x1_1x32x1x8_8_1x1_intrawave_v3,793.91,316.72,0.0
gfx942,304,60288,2560,5120,ck,0,0,2008.5478,a8w8_blockscale_1x128x128_256x128x128x128_16x16_32x32_2x2_8x32x1_8x32x1_1x32x1x8_8_1x1_intrawave_v3,786.84,313.89,0.0
gfx942,304,60416,2560,5120,ck,0,0,1992.0836,a8w8_blockscale_1x128x128_256x128x128x128_16x16_32x32_2x2_8x32x1_8x32x1_1x32x1x8_8_1x1_intrawave_v3,795.03,317.14,0.0
gfx942,304,60544,2560,5120,ck,0,0,2002.3098,a8w8_blockscale_1x128x128_256x128x128x128_16x16_32x32_2x2_8x32x1_8x32x1_1x32x1x8_8_1x1_intrawave_v3,792.65,316.17,0.0
gfx942,304,60672,2560,5120,ck,0,0,2043.1389,a8w8_blockscale_1x128x128_256x128x128x128_16x16_32x32_2x2_8x32x1_8x32x1_1x32x1x8_8_1x1_intrawave_v3,778.45,310.5,0.0
gfx942,304,60800,2560,5120,ck,0,0,2006.9309,a8w8_blockscale_1x128x128_256x128x128x128_16x16_32x32_2x2_8x32x1_8x32x1_1x32x1x8_8_1x1_intrawave_v3,794.17,316.75,0.0
gfx942,304,60928,2560,5120,ck,0,0,2016.6742,a8w8_blockscale_1x128x128_256x128x128x128_16x16_32x32_2x2_8x32x1_8x32x1_1x32x1x8_8_1x1_intrawave_v3,791.99,315.87,0.0
gfx942,304,61056,2560,5120,ck,0,0,2019.4287,a8w8_blockscale_1x128x128_256x128x128x128_16x16_32x32_2x2_8x32x1_8x32x1_1x32x1x8_8_1x1_intrawave_v3,792.57,316.09,0.0
gfx942,304,61184,2560,5120,ck,0,0,2034.7356,a8w8_blockscale_1x128x128_256x128x128x128_16x16_32x32_2x2_8x32x1_8x32x1_1x32x1x8_8_1x1_intrawave_v3,788.26,314.36,0.0
gfx942,304,61312,2560,5120,ck,0,0,2044.3815,a8w8_blockscale_1x128x128_256x128x128x128_16x16_32x32_2x2_8x32x1_8x32x1_1x32x1x8_8_1x1_intrawave_v3,786.18,313.51,0.0
gfx942,304,61440,2560,5120,ck,0,0,2077.5273,a8w8_blockscale_1x128x128_256x128x128x128_16x16_32x32_2x2_8x32x1_8x32x1_1x32x1x8_8_1x1_intrawave_v3,775.25,309.14,0.0
gfx942,304,61568,2560,5120,ck,0,0,2044.32,a8w8_blockscale_1x128x128_256x128x128x128_16x16_32x32_2x2_8x32x1_8x32x1_1x32x1x8_8_1x1_intrawave_v3,789.49,314.81,0.0
gfx942,304,61696,2560,5120,ck,0,0,2060.8587,a8w8_blockscale_1x128x128_256x128x128x128_16x16_32x32_2x2_8x32x1_8x32x1_1x32x1x8_8_1x1_intrawave_v3,784.78,312.92,0.0
gfx942,304,61824,2560,5120,ck,0,0,2006.0083,a8w8_blockscale_1x128x128_256x128x128x128_16x16_32x32_2x2_8x32x1_8x32x1_1x32x1x8_8_1x1_intrawave_v3,807.91,322.12,0.0
gfx942,304,61952,2560,5120,ck,0,0,2056.8082,a8w8_blockscale_1x128x128_256x128x128x128_16x16_32x32_2x2_8x32x1_8x32x1_1x32x1x8_8_1x1_intrawave_v3,789.59,314.81,0.0
gfx942,304,62080,2560,5120,ck,0,0,2066.5995,a8w8_blockscale_1x128x128_256x128x128x128_16x16_32x32_2x2_8x32x1_8x32x1_1x32x1x8_8_1x1_intrawave_v3,787.47,313.95,0.0
gfx942,304,62208,2560,5120,ck,0,0,2039.4842,a8w8_blockscale_1x128x128_256x128x128x128_16x16_32x32_2x2_8x32x1_8x32x1_1x32x1x8_8_1x1_intrawave_v3,799.59,318.77,0.0
gfx942,304,62336,2560,5120,ck,0,0,2056.8997,a8w8_blockscale_1x128x128_256x128x128x128_16x16_32x32_2x2_8x32x1_8x32x1_1x32x1x8_8_1x1_intrawave_v3,794.45,316.7,0.0
gfx942,304,62464,2560,5120,ck,0,0,2047.7263,a8w8_blockscale_1x128x128_256x128x128x128_16x16_32x32_2x2_8x32x1_8x32x1_1x32x1x8_8_1x1_intrawave_v3,799.65,318.76,0.0
gfx942,304,62592,2560,5120,ck,0,0,2055.7145,a8w8_blockscale_1x128x128_256x128x128x128_16x16_32x32_2x2_8x32x1_8x32x1_1x32x1x8_8_1x1_intrawave_v3,798.17,318.16,0.0
gfx942,304,62720,2560,5120,ck,0,0,2067.1676,a8w8_blockscale_1x128x128_256x128x128x128_16x16_32x32_2x2_8x32x1_8x32x1_1x32x1x8_8_1x1_intrawave_v3,795.37,317.03,0.0
gfx942,304,62848,2560,5120,ck,0,0,2062.4123,a8w8_blockscale_1x128x128_256x128x128x128_16x16_32x32_2x2_8x32x1_8x32x1_1x32x1x8_8_1x1_intrawave_v3,798.83,318.4,0.0
gfx942,304,62976,2560,5120,ck,0,0,2057.3373,a8w8_blockscale_1x128x128_256x128x128x128_16x16_32x32_2x2_8x32x1_8x32x1_1x32x1x8_8_1x1_intrawave_v3,802.43,319.82,0.0
gfx942,304,63104,2560,5120,ck,0,0,2115.9899,a8w8_blockscale_1x128x128_256x128x128x128_16x16_32x32_2x2_8x32x1_8x32x1_1x32x1x8_8_1x1_intrawave_v3,781.78,311.58,0.0
gfx942,304,63232,2560,5120,ck,0,0,2104.8315,a8w8_blockscale_1x128x128_256x128x128x128_16x16_32x32_2x2_8x32x1_8x32x1_1x32x1x8_8_1x1_intrawave_v3,787.52,313.85,0.0
gfx942,304,63360,2560,5120,ck,0,0,2078.6656,a8w8_blockscale_1x128x128_256x128x128x128_16x16_32x32_2x2_8x32x1_8x32x1_1x32x1x8_8_1x1_intrawave_v3,799.04,318.43,0.0
gfx942,304,63488,2560,5120,ck,0,0,2072.831,a8w8_blockscale_1x128x128_256x128x128x128_16x16_32x32_2x2_8x32x1_8x32x1_1x32x1x8_8_1x1_intrawave_v3,802.91,319.96,0.0
gfx942,304,63616,2560,5120,ck,0,0,2111.8242,a8w8_blockscale_1x128x128_256x128x128x128_16x16_32x32_2x2_8x32x1_8x32x1_1x32x1x8_8_1x1_intrawave_v3,789.68,314.67,0.0
gfx942,304,63744,2560,5120,ck,0,0,2095.1249,a8w8_blockscale_1x128x128_256x128x128x128_16x16_32x32_2x2_8x32x1_8x32x1_1x32x1x8_8_1x1_intrawave_v3,797.57,317.81,0.0
gfx942,304,63872,2560,5120,ck,0,0,2119.7154,a8w8_blockscale_1x128x128_256x128x128x128_16x16_32x32_2x2_8x32x1_8x32x1_1x32x1x8_8_1x1_intrawave_v3,789.9,314.74,0.0
gfx942,304,64000,2560,5120,ck,0,0,2130.6348,a8w8_blockscale_1x128x128_256x128x128x128_16x16_32x32_2x2_8x32x1_8x32x1_1x32x1x8_8_1x1_intrawave_v3,787.43,313.74,0.0
gfx942,304,64128,2560,5120,ck,0,0,2139.0251,a8w8_blockscale_1x128x128_256x128x128x128_16x16_32x32_2x2_8x32x1_8x32x1_1x32x1x8_8_1x1_intrawave_v3,785.91,313.12,0.0
gfx942,304,64256,2560,5120,ck,0,0,2117.9688,a8w8_blockscale_1x128x128_256x128x128x128_16x16_32x32_2x2_8x32x1_8x32x1_1x32x1x8_8_1x1_intrawave_v3,795.31,316.85,0.0
gfx942,304,64384,2560,5120,ck,0,0,2183.1083,a8w8_blockscale_1x128x128_256x128x128x128_16x16_32x32_2x2_8x32x1_8x32x1_1x32x1x8_8_1x1_intrawave_v3,773.11,308.0,0.0
gfx942,304,64512,2560,5120,ck,0,0,2146.675,a8w8_blockscale_1x128x128_256x128x128x128_16x16_32x32_2x2_8x32x1_8x32x1_1x32x1x8_8_1x1_intrawave_v3,787.8,313.84,0.0
gfx942,304,64640,2560,5120,ck,0,0,2125.1009,a8w8_blockscale_1x128x128_256x128x128x128_16x16_32x32_2x2_8x32x1_8x32x1_1x32x1x8_8_1x1_intrawave_v3,797.37,317.64,0.0
gfx942,304,64768,2560,5120,ck,0,0,2196.2059,a8w8_blockscale_1x128x128_256x128x128x128_16x16_32x32_2x2_8x32x1_8x32x1_1x32x1x8_8_1x1_intrawave_v3,773.09,307.95,0.0
gfx942,304,64896,2560,5120,ck,0,0,2203.4277,a8w8_blockscale_1x128x128_256x128x128x128_16x16_32x32_2x2_8x32x1_8x32x1_1x32x1x8_8_1x1_intrawave_v3,772.07,307.54,0.0
gfx942,304,65024,2560,5120,ck,0,0,2145.2319,a8w8_blockscale_1x128x128_256x128x128x128_16x16_32x32_2x2_8x32x1_8x32x1_1x32x1x8_8_1x1_intrawave_v3,794.58,316.49,0.0
gfx942,304,65152,2560,5120,ck,0,0,2155.8317,a8w8_blockscale_1x128x128_256x128x128x128_16x16_32x32_2x2_8x32x1_8x32x1_1x32x1x8_8_1x1_intrawave_v3,792.23,315.55,0.0
gfx942,304,65280,2560,5120,ck,0,0,2149.95,a8w8_blockscale_1x128x128_256x128x128x128_16x16_32x32_2x2_8x32x1_8x32x1_1x32x1x8_8_1x1_intrawave_v3,795.96,317.02,0.0
gfx942,304,65408,2560,5120,ck,0,0,2158.2624,a8w8_blockscale_1x128x128_256x128x128x128_16x16_32x32_2x2_8x32x1_8x32x1_1x32x1x8_8_1x1_intrawave_v3,794.45,316.41,0.0
gfx942,304,65536,2560,5120,ck,0,0,2214.2777,a8w8_blockscale_1x128x128_256x128x128x128_16x16_32x32_2x2_8x32x1_8x32x1_1x32x1x8_8_1x1_intrawave_v3,775.87,308.99,0.0
gfx942,304,65664,2560,5120,ck,0,0,2162.5204,a8w8_blockscale_1x128x128_256x128x128x128_16x16_32x32_2x2_8x32x1_8x32x1_1x32x1x8_8_1x1_intrawave_v3,795.99,316.99,0.0
gfx942,304,65792,2560,5120,ck,0,0,2174.1334,a8w8_blockscale_1x128x128_256x128x128x128_16x16_32x32_2x2_8x32x1_8x32x1_1x32x1x8_8_1x1_intrawave_v3,793.28,315.9,0.0
gfx942,304,65920,2560,5120,ck,0,0,2233.8856,a8w8_blockscale_1x128x128_256x128x128x128_16x16_32x32_2x2_8x32x1_8x32x1_1x32x1x8_8_1x1_intrawave_v3,773.56,308.04,0.0
gfx942,304,66048,2560,5120,ck,0,0,2179.3553,a8w8_blockscale_1x128x128_256x128x128x128_16x16_32x32_2x2_8x32x1_8x32x1_1x32x1x8_8_1x1_intrawave_v3,794.46,316.35,0.0
gfx942,304,66176,2560,5120,ck,0,0,2210.0559,a8w8_blockscale_1x128x128_256x128x128x128_16x16_32x32_2x2_8x32x1_8x32x1_1x32x1x8_8_1x1_intrawave_v3,784.94,312.55,0.0
gfx942,304,66304,2560,5120,ck,0,0,2223.4981,a8w8_blockscale_1x128x128_256x128x128x128_16x16_32x32_2x2_8x32x1_8x32x1_1x32x1x8_8_1x1_intrawave_v3,781.7,311.25,0.0
gfx942,304,66432,2560,5120,ck,0,0,2218.8741,a8w8_blockscale_1x128x128_256x128x128x128_16x16_32x32_2x2_8x32x1_8x32x1_1x32x1x8_8_1x1_intrawave_v3,784.85,312.49,0.0
gfx942,304,66560,2560,5120,ck,0,0,2224.268,a8w8_blockscale_1x128x128_256x128x128x128_16x16_32x32_2x2_8x32x1_8x32x1_1x32x1x8_8_1x1_intrawave_v3,784.45,312.32,0.0
gfx942,304,66688,2560,5120,ck,0,0,2230.1145,a8w8_blockscale_1x128x128_256x128x128x128_16x16_32x32_2x2_8x32x1_8x32x1_1x32x1x8_8_1x1_intrawave_v3,783.9,312.09,0.0
gfx942,304,66816,2560,5120,ck,0,0,2238.0423,a8w8_blockscale_1x128x128_256x128x128x128_16x16_32x32_2x2_8x32x1_8x32x1_1x32x1x8_8_1x1_intrawave_v3,782.62,311.57,0.0
gfx942,304,66944,2560,5120,ck,0,0,2217.1764,a8w8_blockscale_1x128x128_256x128x128x128_16x16_32x32_2x2_8x32x1_8x32x1_1x32x1x8_8_1x1_intrawave_v3,791.5,315.09,0.0
gfx942,304,67072,2560,5120,ck,0,0,2235.3027,a8w8_blockscale_1x128x128_256x128x128x128_16x16_32x32_2x2_8x32x1_8x32x1_1x32x1x8_8_1x1_intrawave_v3,786.58,313.12,0.0
gfx942,304,67200,2560,5120,ck,0,0,2215.7967,a8w8_blockscale_1x128x128_256x128x128x128_16x16_32x32_2x2_8x32x1_8x32x1_1x32x1x8_8_1x1_intrawave_v3,795.02,316.47,0.0
gfx942,304,67328,2560,5120,ck,0,0,2248.2967,a8w8_blockscale_1x128x128_256x128x128x128_16x16_32x32_2x2_8x32x1_8x32x1_1x32x1x8_8_1x1_intrawave_v3,785.02,312.48,0.0
gfx942,304,67456,2560,5120,ck,0,0,2292.887,a8w8_blockscale_1x128x128_256x128x128x128_16x16_32x32_2x2_8x32x1_8x32x1_1x32x1x8_8_1x1_intrawave_v3,771.22,306.97,0.0
gfx942,304,67584,2560,5120,ck,0,0,2225.3152,a8w8_blockscale_1x128x128_256x128x128x128_16x16_32x32_2x2_8x32x1_8x32x1_1x32x1x8_8_1x1_intrawave_v3,796.15,316.88,0.0
gfx942,304,67712,2560,5120,ck,0,0,2277.6515,a8w8_blockscale_1x128x128_256x128x128x128_16x16_32x32_2x2_8x32x1_8x32x1_1x32x1x8_8_1x1_intrawave_v3,779.32,310.18,0.0
gfx942,304,67840,2560,5120,ck,0,0,2226.4267,a8w8_blockscale_1x128x128_256x128x128x128_16x16_32x32_2x2_8x32x1_8x32x1_1x32x1x8_8_1x1_intrawave_v3,798.76,317.9,0.0
gfx942,304,67968,2560,5120,ck,0,0,2247.6841,a8w8_blockscale_1x128x128_256x128x128x128_16x16_32x32_2x2_8x32x1_8x32x1_1x32x1x8_8_1x1_intrawave_v3,792.7,315.48,0.0
gfx942,304,68096,2560,5120,ck,0,0,2313.4307,a8w8_blockscale_1x128x128_256x128x128x128_16x16_32x32_2x2_8x32x1_8x32x1_1x32x1x8_8_1x1_intrawave_v3,771.62,307.08,0.0
gfx942,304,68224,2560,5120,ck,0,0,2253.4719,a8w8_blockscale_1x128x128_256x128x128x128_16x16_32x32_2x2_8x32x1_8x32x1_1x32x1x8_8_1x1_intrawave_v3,793.64,315.83,0.0
gfx942,304,68352,2560,5120,ck,0,0,2263.0444,a8w8_blockscale_1x128x128_256x128x128x128_16x16_32x32_2x2_8x32x1_8x32x1_1x32x1x8_8_1x1_intrawave_v3,791.77,315.08,0.0
gfx942,304,68480,2560,5120,ck,0,0,2286.737,a8w8_blockscale_1x128x128_256x128x128x128_16x16_32x32_2x2_8x32x1_8x32x1_1x32x1x8_8_1x1_intrawave_v3,785.03,312.39,0.0
gfx942,304,68608,2560,5120,ck,0,0,2261.2334,a8w8_blockscale_1x128x128_256x128x128x128_16x16_32x32_2x2_8x32x1_8x32x1_1x32x1x8_8_1x1_intrawave_v3,795.37,316.49,0.0
gfx942,304,68736,2560,5120,ck,0,0,2276.7747,a8w8_blockscale_1x128x128_256x128x128x128_16x16_32x32_2x2_8x32x1_8x32x1_1x32x1x8_8_1x1_intrawave_v3,791.41,314.9,0.0
gfx942,304,68864,2560,5120,ck,0,0,2279.5395,a8w8_blockscale_1x128x128_256x128x128x128_16x16_32x32_2x2_8x32x1_8x32x1_1x32x1x8_8_1x1_intrawave_v3,791.93,315.1,0.0
gfx942,304,68992,2560,5120,ck,0,0,2281.1894,a8w8_blockscale_1x128x128_256x128x128x128_16x16_32x32_2x2_8x32x1_8x32x1_1x32x1x8_8_1x1_intrawave_v3,792.82,315.44,0.0
gfx942,304,69120,2560,5120,ck,0,0,2292.2838,a8w8_blockscale_1x128x128_256x128x128x128_16x16_32x32_2x2_8x32x1_8x32x1_1x32x1x8_8_1x1_intrawave_v3,790.45,314.49,0.0
gfx942,304,69248,2560,5120,ck,0,0,2315.5165,a8w8_blockscale_1x128x128_256x128x128x128_16x16_32x32_2x2_8x32x1_8x32x1_1x32x1x8_8_1x1_intrawave_v3,783.97,311.9,0.0
gfx942,304,69376,2560,5120,ck,0,0,2326.1595,a8w8_blockscale_1x128x128_256x128x128x128_16x16_32x32_2x2_8x32x1_8x32x1_1x32x1x8_8_1x1_intrawave_v3,781.83,311.04,0.0
gfx942,304,69504,2560,5120,ck,0,0,2299.9765,a8w8_blockscale_1x128x128_256x128x128x128_16x16_32x32_2x2_8x32x1_8x32x1_1x32x1x8_8_1x1_intrawave_v3,792.18,315.15,0.0
gfx942,304,69632,2560,5120,ck,0,0,2308.4445,a8w8_blockscale_1x128x128_256x128x128x128_16x16_32x32_2x2_8x32x1_8x32x1_1x32x1x8_8_1x1_intrawave_v3,790.73,314.56,0.0
gfx942,304,69760,2560,5120,ck,0,0,2313.9556,a8w8_blockscale_1x128x128_256x128x128x128_16x16_32x32_2x2_8x32x1_8x32x1_1x32x1x8_8_1x1_intrawave_v3,790.3,314.37,0.0
gfx942,304,69888,2560,5120,ck,0,0,2354.6012,a8w8_blockscale_1x128x128_256x128x128x128_16x16_32x32_2x2_8x32x1_8x32x1_1x32x1x8_8_1x1_intrawave_v3,778.08,309.5,0.0
gfx942,304,70016,2560,5120,ck,0,0,2338.6083,a8w8_blockscale_1x128x128_256x128x128x128_16x16_32x32_2x2_8x32x1_8x32x1_1x32x1x8_8_1x1_intrawave_v3,784.84,312.18,0.0
gfx942,304,70144,2560,5120,ck,0,0,2368.724,a8w8_blockscale_1x128x128_256x128x128x128_16x16_32x32_2x2_8x32x1_8x32x1_1x32x1x8_8_1x1_intrawave_v3,776.28,308.77,0.0
gfx942,304,70272,2560,5120,ck,0,0,2395.2088,a8w8_blockscale_1x128x128_256x128x128x128_16x16_32x32_2x2_8x32x1_8x32x1_1x32x1x8_8_1x1_intrawave_v3,769.09,305.9,0.0
gfx942,304,70400,2560,5120,ck,0,0,2327.5943,a8w8_blockscale_1x128x128_256x128x128x128_16x16_32x32_2x2_8x32x1_8x32x1_1x32x1x8_8_1x1_intrawave_v3,792.88,315.35,0.0
gfx942,304,70528,2560,5120,ck,0,0,2325.9405,a8w8_blockscale_1x128x128_256x128x128x128_16x16_32x32_2x2_8x32x1_8x32x1_1x32x1x8_8_1x1_intrawave_v3,794.88,316.14,0.0
gfx942,304,70656,2560,5120,ck,0,0,2331.0157,a8w8_blockscale_1x128x128_256x128x128x128_16x16_32x32_2x2_8x32x1_8x32x1_1x32x1x8_8_1x1_intrawave_v3,794.59,316.01,0.0
gfx942,304,70784,2560,5120,ck,0,0,2348.3615,a8w8_blockscale_1x128x128_256x128x128x128_16x16_32x32_2x2_8x32x1_8x32x1_1x32x1x8_8_1x1_intrawave_v3,790.15,314.23,0.0
gfx942,304,70912,2560,5120,ck,0,0,2387.2838,a8w8_blockscale_1x128x128_256x128x128x128_16x16_32x32_2x2_8x32x1_8x32x1_1x32x1x8_8_1x1_intrawave_v3,778.67,309.66,0.0
gfx942,304,71040,2560,5120,ck,0,0,2338.6463,a8w8_blockscale_1x128x128_256x128x128x128_16x16_32x32_2x2_8x32x1_8x32x1_1x32x1x8_8_1x1_intrawave_v3,796.3,316.66,0.0
gfx942,304,71168,2560,5120,ck,0,0,2353.7358,a8w8_blockscale_1x128x128_256x128x128x128_16x16_32x32_2x2_8x32x1_8x32x1_1x32x1x8_8_1x1_intrawave_v3,792.62,315.19,0.0
gfx942,304,71296,2560,5120,ck,0,0,2387.2361,a8w8_blockscale_1x128x128_256x128x128x128_16x16_32x32_2x2_8x32x1_8x32x1_1x32x1x8_8_1x1_intrawave_v3,782.91,311.31,0.0
gfx942,304,71424,2560,5120,ck,0,0,2426.2916,a8w8_blockscale_1x128x128_256x128x128x128_16x16_32x32_2x2_8x32x1_8x32x1_1x32x1x8_8_1x1_intrawave_v3,771.69,306.84,0.0
gfx942,304,71552,2560,5120,ck,0,0,2391.0797,a8w8_blockscale_1x128x128_256x128x128x128_16x16_32x32_2x2_8x32x1_8x32x1_1x32x1x8_8_1x1_intrawave_v3,784.45,311.91,0.0
gfx942,304,71680,2560,5120,ck,0,0,2345.5986,a8w8_blockscale_1x128x128_256x128x128x128_16x16_32x32_2x2_8x32x1_8x32x1_1x32x1x8_8_1x1_intrawave_v3,801.1,318.52,0.0
gfx942,304,71808,2560,5120,ck,0,0,2397.7933,a8w8_blockscale_1x128x128_256x128x128x128_16x16_32x32_2x2_8x32x1_8x32x1_1x32x1x8_8_1x1_intrawave_v3,785.06,312.13,0.0
gfx942,304,71936,2560,5120,ck,0,0,2408.5634,a8w8_blockscale_1x128x128_256x128x128x128_16x16_32x32_2x2_8x32x1_8x32x1_1x32x1x8_8_1x1_intrawave_v3,782.94,311.28,0.0
gfx942,304,72064,2560,5120,ck,0,0,2376.2614,a8w8_blockscale_1x128x128_256x128x128x128_16x16_32x32_2x2_8x32x1_8x32x1_1x32x1x8_8_1x1_intrawave_v3,794.99,316.06,0.0
gfx942,304,72192,2560,5120,ck,0,0,2381.4024,a8w8_blockscale_1x128x128_256x128x128x128_16x16_32x32_2x2_8x32x1_8x32x1_1x32x1x8_8_1x1_intrawave_v3,794.69,315.93,0.0
gfx942,304,72320,2560,5120,ck,0,0,2393.6448,a8w8_blockscale_1x128x128_256x128x128x128_16x16_32x32_2x2_8x32x1_8x32x1_1x32x1x8_8_1x1_intrawave_v3,792.02,314.86,0.0
gfx942,304,72448,2560,5120,ck,0,0,2395.0538,a8w8_blockscale_1x128x128_256x128x128x128_16x16_32x32_2x2_8x32x1_8x32x1_1x32x1x8_8_1x1_intrawave_v3,792.96,315.22,0.0
gfx942,304,72576,2560,5120,ck,0,0,2431.7008,a8w8_blockscale_1x128x128_256x128x128x128_16x16_32x32_2x2_8x32x1_8x32x1_1x32x1x8_8_1x1_intrawave_v3,782.39,311.01,0.0
gfx942,304,72704,2560,5120,ck,0,0,2427.9996,a8w8_blockscale_1x128x128_256x128x128x128_16x16_32x32_2x2_8x32x1_8x32x1_1x32x1x8_8_1x1_intrawave_v3,784.96,312.02,0.0
gfx942,304,72832,2560,5120,ck,0,0,2482.4845,a8w8_blockscale_1x128x128_256x128x128x128_16x16_32x32_2x2_8x32x1_8x32x1_1x32x1x8_8_1x1_intrawave_v3,769.09,305.7,0.0
gfx942,304,72960,2560,5120,ck,0,0,2412.532,a8w8_blockscale_1x128x128_256x128x128x128_16x16_32x32_2x2_8x32x1_8x32x1_1x32x1x8_8_1x1_intrawave_v3,792.78,315.11,0.0
gfx942,304,73088,2560,5120,ck,0,0,2412.8084,a8w8_blockscale_1x128x128_256x128x128x128_16x16_32x32_2x2_8x32x1_8x32x1_1x32x1x8_8_1x1_intrawave_v3,794.08,315.62,0.0
gfx942,304,73216,2560,5120,ck,0,0,2445.3155,a8w8_blockscale_1x128x128_256x128x128x128_16x16_32x32_2x2_8x32x1_8x32x1_1x32x1x8_8_1x1_intrawave_v3,784.89,311.96,0.0
gfx942,304,73344,2560,5120,ck,0,0,2447.1753,a8w8_blockscale_1x128x128_256x128x128x128_16x16_32x32_2x2_8x32x1_8x32x1_1x32x1x8_8_1x1_intrawave_v3,785.67,312.26,0.0
gfx942,304,73472,2560,5120,ck,0,0,2495.1112,a8w8_blockscale_1x128x128_256x128x128x128_16x16_32x32_2x2_8x32x1_8x32x1_1x32x1x8_8_1x1_intrawave_v3,771.92,306.78,0.0
gfx942,304,73600,2560,5120,ck,0,0,2477.5223,a8w8_blockscale_1x128x128_256x128x128x128_16x16_32x32_2x2_8x32x1_8x32x1_1x32x1x8_8_1x1_intrawave_v3,778.75,309.49,0.0
gfx942,304,73728,2560,5120,ck,0,0,2454.5606,a8w8_blockscale_1x128x128_256x128x128x128_16x16_32x32_2x2_8x32x1_8x32x1_1x32x1x8_8_1x1_intrawave_v3,787.41,312.92,0.0
gfx942,304,73856,2560,5120,ck,0,0,2441.8344,a8w8_blockscale_1x128x128_256x128x128x128_16x16_32x32_2x2_8x32x1_8x32x1_1x32x1x8_8_1x1_intrawave_v3,792.88,315.09,0.0
gfx942,304,73984,2560,5120,ck,0,0,2441.9732,a8w8_blockscale_1x128x128_256x128x128x128_16x16_32x32_2x2_8x32x1_8x32x1_1x32x1x8_8_1x1_intrawave_v3,794.21,315.61,0.0
gfx942,304,74112,2560,5120,ck,0,0,2468.6125,a8w8_blockscale_1x128x128_256x128x128x128_16x16_32x32_2x2_8x32x1_8x32x1_1x32x1x8_8_1x1_intrawave_v3,787.0,312.73,0.0
gfx942,304,74240,2560,5120,ck,0,0,2454.8819,a8w8_blockscale_1x128x128_256x128x128x128_16x16_32x32_2x2_8x32x1_8x32x1_1x32x1x8_8_1x1_intrawave_v3,792.77,315.02,0.0
gfx942,304,74368,2560,5120,ck,0,0,2487.0574,a8w8_blockscale_1x128x128_256x128x128x128_16x16_32x32_2x2_8x32x1_8x32x1_1x32x1x8_8_1x1_intrawave_v3,783.86,311.47,0.0
gfx942,304,74496,2560,5120,ck,0,0,2461.0428,a8w8_blockscale_1x128x128_256x128x128x128_16x16_32x32_2x2_8x32x1_8x32x1_1x32x1x8_8_1x1_intrawave_v3,793.51,315.29,0.0
gfx942,304,74624,2560,5120,ck,0,0,2418.6284,a8w8_blockscale_1x128x128_256x128x128x128_16x16_32x32_2x2_8x32x1_8x32x1_1x32x1x8_8_1x1_intrawave_v3,808.82,321.36,0.0
gfx942,304,74752,2560,5120,ck,0,0,2456.1936,a8w8_blockscale_1x128x128_256x128x128x128_16x16_32x32_2x2_8x32x1_8x32x1_1x32x1x8_8_1x1_intrawave_v3,797.81,316.98,0.0
gfx942,304,74880,2560,5120,ck,0,0,2448.9698,a8w8_blockscale_1x128x128_256x128x128x128_16x16_32x32_2x2_8x32x1_8x32x1_1x32x1x8_8_1x1_intrawave_v3,801.53,318.45,0.0
gfx942,304,75008,2560,5120,ck,0,0,2488.6286,a8w8_blockscale_1x128x128_256x128x128x128_16x16_32x32_2x2_8x32x1_8x32x1_1x32x1x8_8_1x1_intrawave_v3,790.11,313.9,0.0
gfx942,304,75136,2560,5120,ck,0,0,2545.668,a8w8_blockscale_1x128x128_256x128x128x128_16x16_32x32_2x2_8x32x1_8x32x1_1x32x1x8_8_1x1_intrawave_v3,773.72,307.38,0.0
gfx942,304,75264,2560,5120,ck,0,0,2495.1105,a8w8_blockscale_1x128x128_256x128x128x128_16x16_32x32_2x2_8x32x1_8x32x1_1x32x1x8_8_1x1_intrawave_v3,790.75,314.14,0.0
gfx942,304,75392,2560,5120,ck,0,0,2507.8333,a8w8_blockscale_1x128x128_256x128x128x128_16x16_32x32_2x2_8x32x1_8x32x1_1x32x1x8_8_1x1_intrawave_v3,788.07,313.07,0.0
gfx942,304,75520,2560,5120,ck,0,0,2500.8137,a8w8_blockscale_1x128x128_256x128x128x128_16x16_32x32_2x2_8x32x1_8x32x1_1x32x1x8_8_1x1_intrawave_v3,791.63,314.47,0.0
gfx942,304,75648,2560,5120,ck,0,0,2493.3173,a8w8_blockscale_1x128x128_256x128x128x128_16x16_32x32_2x2_8x32x1_8x32x1_1x32x1x8_8_1x1_intrawave_v3,795.35,315.94,0.0
gfx942,304,75776,2560,5120,ck,0,0,2470.2093,a8w8_blockscale_1x128x128_256x128x128x128_16x16_32x32_2x2_8x32x1_8x32x1_1x32x1x8_8_1x1_intrawave_v3,804.15,319.43,0.0
gfx942,304,75904,2560,5120,ck,0,0,2568.9085,a8w8_blockscale_1x128x128_256x128x128x128_16x16_32x32_2x2_8x32x1_8x32x1_1x32x1x8_8_1x1_intrawave_v3,774.56,307.67,0.0
gfx942,304,76032,2560,5120,ck,0,0,2573.5451,a8w8_blockscale_1x128x128_256x128x128x128_16x16_32x32_2x2_8x32x1_8x32x1_1x32x1x8_8_1x1_intrawave_v3,774.47,307.62,0.0
gfx942,304,76160,2560,5120,ck,0,0,2523.2824,a8w8_blockscale_1x128x128_256x128x128x128_16x16_32x32_2x2_8x32x1_8x32x1_1x32x1x8_8_1x1_intrawave_v3,791.23,314.27,0.0
gfx942,304,76288,2560,5120,ck,0,0,2533.6923,a8w8_blockscale_1x128x128_256x128x128x128_16x16_32x32_2x2_8x32x1_8x32x1_1x32x1x8_8_1x1_intrawave_v3,789.3,313.49,0.0
gfx942,304,76416,2560,5120,ck,0,0,2531.3805,a8w8_blockscale_1x128x128_256x128x128x128_16x16_32x32_2x2_8x32x1_8x32x1_1x32x1x8_8_1x1_intrawave_v3,791.35,314.3,0.0
gfx942,304,76544,2560,5120,ck,0,0,2554.3007,a8w8_blockscale_1x128x128_256x128x128x128_16x16_32x32_2x2_8x32x1_8x32x1_1x32x1x8_8_1x1_intrawave_v3,785.56,311.99,0.0
gfx942,304,76672,2560,5120,ck,0,0,2519.3663,a8w8_blockscale_1x128x128_256x128x128x128_16x16_32x32_2x2_8x32x1_8x32x1_1x32x1x8_8_1x1_intrawave_v3,797.78,316.84,0.0
gfx942,304,76800,2560,5120,ck,0,0,2597.6341,a8w8_blockscale_1x128x128_256x128x128x128_16x16_32x32_2x2_8x32x1_8x32x1_1x32x1x8_8_1x1_intrawave_v3,775.04,307.8,0.0
gfx942,304,76928,2560,5120,ck,0,0,2523.4944,a8w8_blockscale_1x128x128_256x128x128x128_16x16_32x32_2x2_8x32x1_8x32x1_1x32x1x8_8_1x1_intrawave_v3,799.14,317.36,0.0
gfx942,304,77056,2560,5120,ck,0,0,2529.2725,a8w8_blockscale_1x128x128_256x128x128x128_16x16_32x32_2x2_8x32x1_8x32x1_1x32x1x8_8_1x1_intrawave_v3,798.64,317.15,0.0
gfx942,304,77184,2560,5120,ck,0,0,2545.0806,a8w8_blockscale_1x128x128_256x128x128x128_16x16_32x32_2x2_8x32x1_8x32x1_1x32x1x8_8_1x1_intrawave_v3,795.0,315.7,0.0
gfx942,304,77312,2560,5120,ck,0,0,2573.4583,a8w8_blockscale_1x128x128_256x128x128x128_16x16_32x32_2x2_8x32x1_8x32x1_1x32x1x8_8_1x1_intrawave_v3,787.53,312.72,0.0
gfx942,304,77440,2560,5120,ck,0,0,2555.5586,a8w8_blockscale_1x128x128_256x128x128x128_16x16_32x32_2x2_8x32x1_8x32x1_1x32x1x8_8_1x1_intrawave_v3,794.36,315.43,0.0
gfx942,304,77568,2560,5120,ck,0,0,2586.0168,a8w8_blockscale_1x128x128_256x128x128x128_16x16_32x32_2x2_8x32x1_8x32x1_1x32x1x8_8_1x1_intrawave_v3,786.31,312.22,0.0
gfx942,304,77696,2560,5120,ck,0,0,2594.0223,a8w8_blockscale_1x128x128_256x128x128x128_16x16_32x32_2x2_8x32x1_8x32x1_1x32x1x8_8_1x1_intrawave_v3,785.17,311.76,0.0
gfx942,304,77824,2560,5120,ck,0,0,2554.7023,a8w8_blockscale_1x128x128_256x128x128x128_16x16_32x32_2x2_8x32x1_8x32x1_1x32x1x8_8_1x1_intrawave_v3,798.57,317.07,0.0
gfx942,304,77952,2560,5120,ck,0,0,2568.5259,a8w8_blockscale_1x128x128_256x128x128x128_16x16_32x32_2x2_8x32x1_8x32x1_1x32x1x8_8_1x1_intrawave_v3,795.58,315.88,0.0
gfx942,304,78080,2560,5120,ck,0,0,2620.4392,a8w8_blockscale_1x128x128_256x128x128x128_16x16_32x32_2x2_8x32x1_8x32x1_1x32x1x8_8_1x1_intrawave_v3,781.1,310.12,0.0
gfx942,304,78208,2560,5120,ck,0,0,2568.2959,a8w8_blockscale_1x128x128_256x128x128x128_16x16_32x32_2x2_8x32x1_8x32x1_1x32x1x8_8_1x1_intrawave_v3,798.26,316.92,0.0
gfx942,304,78336,2560,5120,ck,0,0,2574.5011,a8w8_blockscale_1x128x128_256x128x128x128_16x16_32x32_2x2_8x32x1_8x32x1_1x32x1x8_8_1x1_intrawave_v3,797.64,316.67,0.0
gfx942,304,78464,2560,5120,ck,0,0,2669.1205,a8w8_blockscale_1x128x128_256x128x128x128_16x16_32x32_2x2_8x32x1_8x32x1_1x32x1x8_8_1x1_intrawave_v3,770.62,305.94,0.0
gfx942,304,78592,2560,5120,ck,0,0,2600.0694,a8w8_blockscale_1x128x128_256x128x128x128_16x16_32x32_2x2_8x32x1_8x32x1_1x32x1x8_8_1x1_intrawave_v3,792.38,314.56,0.0
gfx942,304,78720,2560,5120,ck,0,0,2630.2597,a8w8_blockscale_1x128x128_256x128x128x128_16x16_32x32_2x2_8x32x1_8x32x1_1x32x1x8_8_1x1_intrawave_v3,784.56,311.45,0.0
gfx942,304,78848,2560,5120,ck,0,0,2596.9155,a8w8_blockscale_1x128x128_256x128x128x128_16x16_32x32_2x2_8x32x1_8x32x1_1x32x1x8_8_1x1_intrawave_v3,795.93,315.96,0.0
gfx942,304,78976,2560,5120,ck,0,0,2642.9606,a8w8_blockscale_1x128x128_256x128x128x128_16x16_32x32_2x2_8x32x1_8x32x1_1x32x1x8_8_1x1_intrawave_v3,783.33,310.95,0.0
gfx942,304,79104,2560,5120,ck,0,0,2654.1582,a8w8_blockscale_1x128x128_256x128x128x128_16x16_32x32_2x2_8x32x1_8x32x1_1x32x1x8_8_1x1_intrawave_v3,781.29,310.13,0.0
gfx942,304,79232,2560,5120,ck,0,0,2649.1768,a8w8_blockscale_1x128x128_256x128x128x128_16x16_32x32_2x2_8x32x1_8x32x1_1x32x1x8_8_1x1_intrawave_v3,784.02,311.21,0.0
gfx942,304,79360,2560,5120,ck,0,0,2648.9833,a8w8_blockscale_1x128x128_256x128x128x128_16x16_32x32_2x2_8x32x1_8x32x1_1x32x1x8_8_1x1_intrawave_v3,785.35,311.72,0.0
gfx942,304,79488,2560,5120,ck,0,0,2625.2266,a8w8_blockscale_1x128x128_256x128x128x128_16x16_32x32_2x2_8x32x1_8x32x1_1x32x1x8_8_1x1_intrawave_v3,793.73,315.04,0.0
gfx942,304,79616,2560,5120,ck,0,0,2636.4746,a8w8_blockscale_1x128x128_256x128x128x128_16x16_32x32_2x2_8x32x1_8x32x1_1x32x1x8_8_1x1_intrawave_v3,791.62,314.2,0.0
gfx942,304,79744,2560,5120,ck,0,0,2634.8406,a8w8_blockscale_1x128x128_256x128x128x128_16x16_32x32_2x2_8x32x1_8x32x1_1x32x1x8_8_1x1_intrawave_v3,793.38,314.89,0.0
gfx942,304,79872,2560,5120,ck,0,0,2710.0661,a8w8_blockscale_1x128x128_256x128x128x128_16x16_32x32_2x2_8x32x1_8x32x1_1x32x1x8_8_1x1_intrawave_v3,772.6,306.63,0.0
gfx942,304,80000,2560,5120,ck,0,0,2678.0322,a8w8_blockscale_1x128x128_256x128x128x128_16x16_32x32_2x2_8x32x1_8x32x1_1x32x1x8_8_1x1_intrawave_v3,783.09,310.79,0.0
gfx942,304,16,5120,2048,ck,8,0,9.3638,a8w8_blockscale_1x128x128_256x16x64x256_16x16_16x16_1x1_16x16x1_16x16x1_1x16x1x16_4_1x1_intrawave_v1,35.83,1140.82,0.0
gfx942,304,16,5120,6400,ck,8,0,20.5645,a8w8_blockscale_1x128x128_256x16x64x256_16x16_16x16_1x1_16x16x1_16x16x1_1x16x1x16_4_1x1_intrawave_v1,50.99,1606.37,0.0
gfx942,304,32,5120,2048,ck,8,0,9.572,a8w8_blockscale_1x128x128_256x16x64x256_16x16_16x16_1x1_16x16x1_16x16x1_1x16x1x16_4_1x1_intrawave_v1,70.11,1136.54,0.0
gfx942,304,32,5120,6400,ck,8,0,20.7848,a8w8_blockscale_1x128x128_256x16x64x256_16x16_16x16_1x1_16x16x1_16x16x1_1x16x1x16_4_1x1_intrawave_v1,100.9,1602.16,0.0
gfx942,304,48,5120,2048,ck,8,0,9.0145,a8w8_blockscale_1x128x128_256x16x64x256_16x16_16x16_1x1_16x16x1_16x16x1_1x16x1x16_4_1x1_intrawave_v1,111.67,1228.64,0.0
gfx942,304,48,5120,6400,ck,8,0,21.822,a8w8_blockscale_1x128x128_256x16x64x256_16x16_16x16_1x1_16x16x1_16x16x1_1x16x1x16_4_1x1_intrawave_v1,144.15,1538.21,0.0
gfx942,304,64,5120,2048,ck,7,0,11.4053,a8w8_blockscale_1x128x128_256x16x128x256_16x16_16x16_1x2_16x16x1_16x16x1_1x16x1x16_8_1x2_intrawave_v1,117.68,988.33,0.0
gfx942,304,64,5120,6400,ck,13,0,25.2708,a8w8_blockscale_1x128x128_256x32x64x256_16x16_16x16_2x1_16x16x1_16x16x1_1x32x1x8_8_2x1_intrawave_v1,165.97,1338.82,0.0
gfx942,304,80,5120,2048,ck,13,0,11.1201,a8w8_blockscale_1x128x128_256x32x64x256_16x16_16x16_2x1_16x16x1_16x16x1_1x32x1x8_8_2x1_intrawave_v1,150.87,1031.36,0.0
gfx942,304,80,5120,6400,ck,13,0,27.9328,a8w8_blockscale_1x128x128_256x32x64x256_16x16_16x16_2x1_16x16x1_16x16x1_1x32x1x8_8_2x1_intrawave_v1,187.7,1220.76,0.0
gfx942,304,96,5120,2048,ck,18,0,11.7082,a8w8_blockscale_1x128x128_256x64x64x256_16x16_32x32_1x1_16x16x1_16x16x1_1x32x1x8_8_1x1_intrawave_v1,171.95,996.35,0.0
gfx942,304,96,5120,6400,ck,13,0,26.6217,a8w8_blockscale_1x128x128_256x32x64x256_16x16_16x16_2x1_16x16x1_16x16x1_1x32x1x8_8_2x1_intrawave_v1,236.33,1290.88,0.0
gfx942,304,112,5120,2048,ck,18,0,11.7265,a8w8_blockscale_1x128x128_256x64x64x256_16x16_32x32_1x1_16x16x1_16x16x1_1x32x1x8_8_1x1_intrawave_v1,200.3,1011.56,0.0
gfx942,304,112,5120,6400,ck,18,0,30.5434,a8w8_blockscale_1x128x128_256x64x64x256_16x16_32x32_1x1_16x16x1_16x16x1_1x32x1x8_8_1x1_intrawave_v1,240.31,1133.85,0.0
gfx942,304,128,5120,2048,ck,18,0,11.8355,a8w8_blockscale_1x128x128_256x64x64x256_16x16_32x32_1x1_16x16x1_16x16x1_1x32x1x8_8_1x1_intrawave_v1,226.81,1018.85,0.0
gfx942,304,128,5120,6400,ck,18,0,28.6862,a8w8_blockscale_1x128x128_256x64x64x256_16x16_32x32_1x1_16x16x1_16x16x1_1x32x1x8_8_1x1_intrawave_v1,292.43,1216.54,0.0
gfx942,304,144,5120,2048,ck,18,0,14.2234,a8w8_blockscale_1x128x128_256x64x64x256_16x16_32x32_1x1_16x16x1_16x16x1_1x32x1x8_8_1x1_intrawave_v1,212.32,861.62,0.0
gfx942,304,144,5120,6400,ck,3,0,35.6953,a8w8_blockscale_1x128x128_256x64x64x128_16x16_32x32_1x1_8x32x1_8x32x1_1x32x1x8_8_1x1_intrawave_v3,264.38,985.12,0.0
gfx942,304,160,5120,2048,ck,18,0,14.7157,a8w8_blockscale_1x128x128_256x64x64x256_16x16_32x32_1x1_16x16x1_16x16x1_1x32x1x8_8_1x1_intrawave_v1,228.02,846.16,0.0
gfx942,304,160,5120,6400,ck,3,0,35.3705,a8w8_blockscale_1x128x128_256x64x64x128_16x16_32x32_1x1_8x32x1_8x32x1_1x32x1x8_8_1x1_intrawave_v3,296.45,1001.69,0.0
gfx942,304,176,5120,2048,ck,18,0,15.1612,a8w8_blockscale_1x128x128_256x64x64x256_16x16_32x32_1x1_16x16x1_16x16x1_1x32x1x8_8_1x1_intrawave_v1,243.45,834.26,0.0
gfx942,304,176,5120,6400,ck,3,0,36.1135,a8w8_blockscale_1x128x128_256x64x64x128_16x16_32x32_1x1_8x32x1_8x32x1_1x32x1x8_8_1x1_intrawave_v3,319.39,988.46,0.0
gfx942,304,192,5120,2048,ck,18,0,13.8397,a8w8_blockscale_1x128x128_256x64x64x256_16x16_32x32_1x1_16x16x1_16x16x1_1x32x1x8_8_1x1_intrawave_v1,290.94,928.13,0.0
gfx942,304,192,5120,6400,ck,18,0,35.1302,a8w8_blockscale_1x128x128_256x64x64x256_16x16_32x32_1x1_16x16x1_16x16x1_1x32x1x8_8_1x1_intrawave_v1,358.18,1023.7,0.0
gfx942,304,208,5120,2048,ck,12,0,17.3056,a8w8_blockscale_1x128x128_256x32x128x256_16x16_32x32_1x1_16x16x1_16x16x1_1x32x1x8_8_1x1_intrawave_v1,252.06,753.61,0.0
gfx942,304,208,5120,6400,ck,12,0,43.0766,a8w8_blockscale_1x128x128_256x32x128x256_16x16_32x32_1x1_16x16x1_16x16x1_1x32x1x8_8_1x1_intrawave_v1,316.45,841.04,0.0
gfx942,304,224,5120,2048,ck,12,0,17.4682,a8w8_blockscale_1x128x128_256x32x128x256_16x16_32x32_1x1_16x16x1_16x16x1_1x32x1x8_8_1x1_intrawave_v1,268.92,757.85,0.0
gfx942,304,224,5120,6400,ck,12,0,42.504,a8w8_blockscale_1x128x128_256x32x128x256_16x16_32x32_1x1_16x16x1_16x16x1_1x32x1x8_8_1x1_intrawave_v1,345.38,858.63,0.0
gfx942,304,240,5120,2048,ck,3,0,19.6549,a8w8_blockscale_1x128x128_256x64x64x128_16x16_32x32_1x1_8x32x1_8x32x1_1x32x1x8_8_1x1_intrawave_v3,256.08,683.54,0.0
gfx942,304,240,5120,6400,ck,2,0,45.1276,a8w8_blockscale_1x128x128_256x64x128x128_16x16_32x32_1x2_8x32x1_8x32x1_1x32x1x8_8_1x1_intrawave_v3,348.54,814.61,0.0
gfx942,304,256,5120,2048,ck,3,0,19.1222,a8w8_blockscale_1x128x128_256x64x64x128_16x16_32x32_1x1_8x32x1_8x32x1_1x32x1x8_8_1x1_intrawave_v3,280.76,712.86,0.0
gfx942,304,256,5120,6400,ck,2,0,43.8733,a8w8_blockscale_1x128x128_256x64x128x128_16x16_32x32_1x2_8x32x1_8x32x1_1x32x1x8_8_1x1_intrawave_v3,382.4,843.97,0.0
gfx942,304,288,5120,2048,ck,2,0,20.9755,a8w8_blockscale_1x128x128_256x64x128x128_16x16_32x32_1x2_8x32x1_8x32x1_1x32x1x8_8_1x1_intrawave_v3,287.95,668.62,0.0
gfx942,304,288,5120,6400,ck,2,0,47.9955,a8w8_blockscale_1x128x128_256x64x128x128_16x16_32x32_1x2_8x32x1_8x32x1_1x32x1x8_8_1x1_intrawave_v3,393.25,782.58,0.0
gfx942,304,320,5120,2048,ck,2,0,22.0886,a8w8_blockscale_1x128x128_256x64x128x128_16x16_32x32_1x2_8x32x1_8x32x1_1x32x1x8_8_1x1_intrawave_v3,303.82,652.73,0.0
gfx942,304,320,5120,6400,ck,2,0,49.5892,a8w8_blockscale_1x128x128_256x64x128x128_16x16_32x32_1x2_8x32x1_8x32x1_1x32x1x8_8_1x1_intrawave_v3,422.9,768.17,0.0
gfx942,304,352,5120,2048,ck,2,0,22.3968,a8w8_blockscale_1x128x128_256x64x128x128_16x16_32x32_1x2_8x32x1_8x32x1_1x32x1x8_8_1x1_intrawave_v3,329.6,661.31,0.0
gfx942,304,352,5120,6400,ck,2,0,52.0034,a8w8_blockscale_1x128x128_256x64x128x128_16x16_32x32_1x2_8x32x1_8x32x1_1x32x1x8_8_1x1_intrawave_v3,443.6,742.75,0.0
gfx942,304,384,5120,2048,ck,2,0,23.2918,a8w8_blockscale_1x128x128_256x64x128x128_16x16_32x32_1x2_8x32x1_8x32x1_1x32x1x8_8_1x1_intrawave_v3,345.75,652.78,0.0
gfx942,304,384,5120,6400,ck,2,0,53.4951,a8w8_blockscale_1x128x128_256x64x128x128_16x16_32x32_1x2_8x32x1_8x32x1_1x32x1x8_8_1x1_intrawave_v3,470.43,731.99,0.0
gfx942,304,416,5120,2048,ck,2,0,24.2492,a8w8_blockscale_1x128x128_256x64x128x128_16x16_32x32_1x2_8x32x1_8x32x1_1x32x1x8_8_1x1_intrawave_v3,359.77,643.22,0.0
gfx942,304,416,5120,6400,ck,2,0,55.0937,a8w8_blockscale_1x128x128_256x64x128x128_16x16_32x32_1x2_8x32x1_8x32x1_1x32x1x8_8_1x1_intrawave_v3,494.85,720.41,0.0
gfx942,304,448,5120,2048,ck,2,0,24.6009,a8w8_blockscale_1x128x128_256x64x128x128_16x16_32x32_1x2_8x32x1_8x32x1_1x32x1x8_8_1x1_intrawave_v3,381.91,650.01,0.0
gfx942,304,448,5120,6400,ck,2,0,55.3728,a8w8_blockscale_1x128x128_256x64x128x128_16x16_32x32_1x2_8x32x1_8x32x1_1x32x1x8_8_1x1_intrawave_v3,530.23,726.4,0.0
gfx942,304,480,5120,2048,ck,0,0,29.2823,a8w8_blockscale_1x128x128_256x128x128x128_16x16_32x32_2x2_8x32x1_8x32x1_1x32x1x8_8_1x1_intrawave_v3,343.77,559.52,0.0
gfx942,304,480,5120,6400,ck,0,0,62.4174,a8w8_blockscale_1x128x128_256x128x128x128_16x16_32x32_2x2_8x32x1_8x32x1_1x32x1x8_8_1x1_intrawave_v3,503.98,652.95,0.0
gfx942,304,512,5120,2048,ck,0,0,31.2295,a8w8_blockscale_1x128x128_256x128x128x128_16x16_32x32_2x2_8x32x1_8x32x1_1x32x1x8_8_1x1_intrawave_v3,343.82,537.22,0.0
gfx942,304,512,5120,6400,ck,0,0,66.7325,a8w8_blockscale_1x128x128_256x128x128x128_16x16_32x32_2x2_8x32x1_8x32x1_1x32x1x8_8_1x1_intrawave_v3,502.82,618.7,0.0
gfx942,304,544,5120,2048,ck,0,0,29.876,a8w8_blockscale_1x128x128_256x128x128x128_16x16_32x32_2x2_8x32x1_8x32x1_1x32x1x8_8_1x1_intrawave_v3,381.86,574.72,0.0
gfx942,304,544,5120,6400,ck,0,0,69.024,a8w8_blockscale_1x128x128_256x128x128x128_16x16_32x32_2x2_8x32x1_8x32x1_1x32x1x8_8_1x1_intrawave_v3,516.51,605.88,0.0
gfx942,304,576,5120,2048,ck,0,0,29.9225,a8w8_blockscale_1x128x128_256x128x128x128_16x16_32x32_2x2_8x32x1_8x32x1_1x32x1x8_8_1x1_intrawave_v3,403.7,586.97,0.0
gfx942,304,576,5120,6400,ck,0,0,68.7052,a8w8_blockscale_1x128x128_256x128x128x128_16x16_32x32_2x2_8x32x1_8x32x1_1x32x1x8_8_1x1_intrawave_v3,549.43,616.44,0.0
gfx942,304,608,5120,2048,ck,0,0,31.4932,a8w8_blockscale_1x128x128_256x128x128x128_16x16_32x32_2x2_8x32x1_8x32x1_1x32x1x8_8_1x1_intrawave_v3,404.87,570.18,0.0
gfx942,304,608,5120,6400,ck,0,0,69.8851,a8w8_blockscale_1x128x128_256x128x128x128_16x16_32x32_2x2_8x32x1_8x32x1_1x32x1x8_8_1x1_intrawave_v3,570.16,613.65,0.0
gfx942,304,640,5120,2048,ck,0,0,33.3729,a8w8_blockscale_1x128x128_256x128x128x128_16x16_32x32_2x2_8x32x1_8x32x1_1x32x1x8_8_1x1_intrawave_v3,402.18,549.85,0.0
gfx942,304,640,5120,6400,ck,0,0,73.134,a8w8_blockscale_1x128x128_256x128x128x128_16x16_32x32_2x2_8x32x1_8x32x1_1x32x1x8_8_1x1_intrawave_v3,573.51,593.67,0.0
gfx942,304,672,5120,2048,ck,0,0,32.0296,a8w8_blockscale_1x128x128_256x128x128x128_16x16_32x32_2x2_8x32x1_8x32x1_1x32x1x8_8_1x1_intrawave_v3,439.99,585.19,0.0
gfx942,304,672,5120,6400,ck,0,0,69.9726,a8w8_blockscale_1x128x128_256x128x128x128_16x16_32x32_2x2_8x32x1_8x32x1_1x32x1x8_8_1x1_intrawave_v3,629.39,628.1,0.0
gfx942,304,704,5120,2048,ck,0,0,33.1509,a8w8_blockscale_1x128x128_256x128x128x128_16x16_32x32_2x2_8x32x1_8x32x1_1x32x1x8_8_1x1_intrawave_v3,445.36,577.25,0.0
gfx942,304,704,5120,6400,ck,0,0,70.5451,a8w8_blockscale_1x128x128_256x128x128x128_16x16_32x32_2x2_8x32x1_8x32x1_1x32x1x8_8_1x1_intrawave_v3,654.01,630.55,0.0
gfx942,304,736,5120,2048,ck,0,0,33.6594,a8w8_blockscale_1x128x128_256x128x128x128_16x16_32x32_2x2_8x32x1_8x32x1_1x32x1x8_8_1x1_intrawave_v3,458.57,580.22,0.0
gfx942,304,736,5120,6400,ck,0,0,71.6765,a8w8_blockscale_1x128x128_256x128x128x128_16x16_32x32_2x2_8x32x1_8x32x1_1x32x1x8_8_1x1_intrawave_v3,672.95,628.03,0.0
gfx942,304,768,5120,2048,ck,0,0,35.5146,a8w8_blockscale_1x128x128_256x128x128x128_16x16_32x32_2x2_8x32x1_8x32x1_1x32x1x8_8_1x1_intrawave_v3,453.51,560.98,0.0
gfx942,304,768,5120,6400,ck,0,0,75.3031,a8w8_blockscale_1x128x128_256x128x128x128_16x16_32x32_2x2_8x32x1_8x32x1_1x32x1x8_8_1x1_intrawave_v3,668.39,604.86,0.0
gfx942,304,800,5120,2048,ck,0,0,34.4308,a8w8_blockscale_1x128x128_256x128x128x128_16x16_32x32_2x2_8x32x1_8x32x1_1x32x1x8_8_1x1_intrawave_v3,487.27,590.06,0.0
gfx942,304,800,5120,6400,ck,0,0,76.8452,a8w8_blockscale_1x128x128_256x128x128x128_16x16_32x32_2x2_8x32x1_8x32x1_1x32x1x8_8_1x1_intrawave_v3,682.27,599.65,0.0
gfx942,304,832,5120,2048,ck,0,0,35.0854,a8w8_blockscale_1x128x128_256x128x128x128_16x16_32x32_2x2_8x32x1_8x32x1_1x32x1x8_8_1x1_intrawave_v3,497.31,590.26,0.0
gfx942,304,832,5120,6400,ck,0,0,81.6417,a8w8_blockscale_1x128x128_256x128x128x128_16x16_32x32_2x2_8x32x1_8x32x1_1x32x1x8_8_1x1_intrawave_v3,667.87,570.94,0.0
gfx942,304,864,5120,2048,ck,0,0,36.7455,a8w8_blockscale_1x128x128_256x128x128x128_16x16_32x32_2x2_8x32x1_8x32x1_1x32x1x8_8_1x1_intrawave_v3,493.11,574.29,0.0
gfx942,304,864,5120,6400,ck,0,0,77.1933,a8w8_blockscale_1x128x128_256x128x128x128_16x16_32x32_2x2_8x32x1_8x32x1_1x32x1x8_8_1x1_intrawave_v3,733.52,610.74,0.0
gfx942,304,896,5120,2048,ck,0,0,36.834,a8w8_blockscale_1x128x128_256x128x128x128_16x16_32x32_2x2_8x32x1_8x32x1_1x32x1x8_8_1x1_intrawave_v3,510.14,583.59,0.0
gfx942,304,896,5120,6400,ck,0,0,80.5239,a8w8_blockscale_1x128x128_256x128x128x128_16x16_32x32_2x2_8x32x1_8x32x1_1x32x1x8_8_1x1_intrawave_v3,729.23,592.09,0.0
gfx942,304,928,5120,2048,ck,2,0,41.6368,a8w8_blockscale_1x128x128_256x64x128x128_16x16_32x32_1x2_8x32x1_8x32x1_1x32x1x8_8_1x1_intrawave_v3,467.41,525.71,0.0
gfx942,304,928,5120,6400,ck,2,0,94.7932,a8w8_blockscale_1x128x128_256x64x128x128_16x16_32x32_1x2_8x32x1_8x32x1_1x32x1x8_8_1x1_intrawave_v3,641.58,508.58,0.0
gfx942,304,960,5120,2048,ck,2,0,41.7405,a8w8_blockscale_1x128x128_256x64x128x128_16x16_32x32_1x2_8x32x1_8x32x1_1x32x1x8_8_1x1_intrawave_v3,482.33,533.83,0.0
gfx942,304,960,5120,6400,ck,2,0,97.5147,a8w8_blockscale_1x128x128_256x64x128x128_16x16_32x32_1x2_8x32x1_8x32x1_1x32x1x8_8_1x1_intrawave_v3,645.18,499.85,0.0
gfx942,304,992,5120,2048,ck,0,0,46.8176,a8w8_blockscale_1x128x128_256x128x128x128_16x16_32x32_2x2_8x32x1_8x32x1_1x32x1x8_8_1x1_intrawave_v3,444.36,484.34,0.0
gfx942,304,992,5120,6400,ck,0,0,117.4892,a8w8_blockscale_1x128x128_256x128x128x128_16x16_32x32_2x2_8x32x1_8x32x1_1x32x1x8_8_1x1_intrawave_v3,553.34,419.4,0.0
gfx942,304,1024,5120,2048,ck,0,0,48.3373,a8w8_blockscale_1x128x128_256x128x128x128_16x16_32x32_2x2_8x32x1_8x32x1_1x32x1x8_8_1x1_intrawave_v3,444.27,477.24,0.0
gfx942,304,1024,5120,6400,ck,0,0,121.3958,a8w8_blockscale_1x128x128_256x128x128x128_16x16_32x32_2x2_8x32x1_8x32x1_1x32x1x8_8_1x1_intrawave_v3,552.81,410.29,0.0
gfx942,304,1088,5120,2048,ck,0,0,49.7929,a8w8_blockscale_1x128x128_256x128x128x128_16x16_32x32_2x2_8x32x1_8x32x1_1x32x1x8_8_1x1_intrawave_v3,458.24,479.09,0.0
gfx942,304,1088,5120,6400,ck,0,0,120.3944,a8w8_blockscale_1x128x128_256x128x128x128_16x16_32x32_2x2_8x32x1_8x32x1_1x32x1x8_8_1x1_intrawave_v3,592.25,422.55,0.0
gfx942,304,1152,5120,2048,ck,0,0,51.9545,a8w8_blockscale_1x128x128_256x128x128x128_16x16_32x32_2x2_8x32x1_8x32x1_1x32x1x8_8_1x1_intrawave_v3,465.01,474.29,0.0
gfx942,304,1152,5120,6400,ck,0,0,122.1293,a8w8_blockscale_1x128x128_256x128x128x128_16x16_32x32_2x2_8x32x1_8x32x1_1x32x1x8_8_1x1_intrawave_v3,618.18,425.26,0.0
gfx942,304,1216,5120,2048,ck,0,0,51.5801,a8w8_blockscale_1x128x128_256x128x128x128_16x16_32x32_2x2_8x32x1_8x32x1_1x32x1x8_8_1x1_intrawave_v3,494.4,492.98,0.0
gfx942,304,1216,5120,6400,ck,0,0,121.1854,a8w8_blockscale_1x128x128_256x128x128x128_16x16_32x32_2x2_8x32x1_8x32x1_1x32x1x8_8_1x1_intrawave_v3,657.6,437.36,0.0
gfx942,304,1280,5120,2048,ck,0,0,51.3597,a8w8_blockscale_1x128x128_256x128x128x128_16x16_32x32_2x2_8x32x1_8x32x1_1x32x1x8_8_1x1_intrawave_v3,522.66,510.41,0.0
gfx942,304,1280,5120,6400,ck,0,0,121.0844,a8w8_blockscale_1x128x128_256x128x128x128_16x16_32x32_2x2_8x32x1_8x32x1_1x32x1x8_8_1x1_intrawave_v3,692.79,446.52,0.0
gfx942,304,1344,5120,2048,ck,0,0,53.9247,a8w8_blockscale_1x128x128_256x128x128x128_16x16_32x32_2x2_8x32x1_8x32x1_1x32x1x8_8_1x1_intrawave_v3,522.69,500.71,0.0
gfx942,304,1344,5120,6400,ck,0,0,123.8186,a8w8_blockscale_1x128x128_256x128x128x128_16x16_32x32_2x2_8x32x1_8x32x1_1x32x1x8_8_1x1_intrawave_v3,711.37,445.27,0.0
gfx942,304,1408,5120,2048,ck,0,0,53.7225,a8w8_blockscale_1x128x128_256x128x128x128_16x16_32x32_2x2_8x32x1_8x32x1_1x32x1x8_8_1x1_intrawave_v3,549.64,517.24,0.0
gfx942,304,1408,5120,6400,ck,0,0,129.514,a8w8_blockscale_1x128x128_256x128x128x128_16x16_32x32_2x2_8x32x1_8x32x1_1x32x1x8_8_1x1_intrawave_v3,712.47,433.91,0.0
gfx942,304,1472,5120,2048,ck,0,0,53.6273,a8w8_blockscale_1x128x128_256x128x128x128_16x16_32x32_2x2_8x32x1_8x32x1_1x32x1x8_8_1x1_intrawave_v3,575.64,532.82,0.0
gfx942,304,1472,5120,6400,ck,0,0,131.5131,a8w8_blockscale_1x128x128_256x128x128x128_16x16_32x32_2x2_8x32x1_8x32x1_1x32x1x8_8_1x1_intrawave_v3,733.53,435.41,0.0
gfx942,304,1536,5120,2048,ck,0,0,54.6786,a8w8_blockscale_1x128x128_256x128x128x128_16x16_32x32_2x2_8x32x1_8x32x1_1x32x1x8_8_1x1_intrawave_v3,589.12,536.96,0.0
gfx942,304,1536,5120,6400,ck,0,0,131.1881,a8w8_blockscale_1x128x128_256x128x128x128_16x16_32x32_2x2_8x32x1_8x32x1_1x32x1x8_8_1x1_intrawave_v3,767.32,444.61,0.0
gfx942,304,1600,5120,2048,ck,0,0,57.2153,a8w8_blockscale_1x128x128_256x128x128x128_16x16_32x32_2x2_8x32x1_8x32x1_1x32x1x8_8_1x1_intrawave_v3,586.46,526.9,0.0
gfx942,304,1600,5120,6400,ck,0,0,140.8879,a8w8_blockscale_1x128x128_256x128x128x128_16x16_32x32_2x2_8x32x1_8x32x1_1x32x1x8_8_1x1_intrawave_v3,744.26,421.56,0.0
gfx942,304,1664,5120,2048,ck,0,0,57.343,a8w8_blockscale_1x128x128_256x128x128x128_16x16_32x32_2x2_8x32x1_8x32x1_1x32x1x8_8_1x1_intrawave_v3,608.56,539.44,0.0
gfx942,304,1664,5120,6400,ck,0,0,136.5576,a8w8_blockscale_1x128x128_256x128x128x128_16x16_32x32_2x2_8x32x1_8x32x1_1x32x1x8_8_1x1_intrawave_v3,798.58,442.72,0.0
gfx942,304,1728,5120,2048,ck,0,0,58.5135,a8w8_blockscale_1x128x128_256x128x128x128_16x16_32x32_2x2_8x32x1_8x32x1_1x32x1x8_8_1x1_intrawave_v3,619.32,542.09,0.0
gfx942,304,1728,5120,6400,ck,0,0,141.8516,a8w8_blockscale_1x128x128_256x128x128x128_16x16_32x32_2x2_8x32x1_8x32x1_1x32x1x8_8_1x1_intrawave_v3,798.34,433.71,0.0
gfx942,304,1792,5120,2048,ck,0,0,60.3285,a8w8_blockscale_1x128x128_256x128x128x128_16x16_32x32_2x2_8x32x1_8x32x1_1x32x1x8_8_1x1_intrawave_v3,622.94,538.81,0.0
gfx942,304,1792,5120,6400,ck,0,0,140.3493,a8w8_blockscale_1x128x128_256x128x128x128_16x16_32x32_2x2_8x32x1_8x32x1_1x32x1x8_8_1x1_intrawave_v3,836.77,445.94,0.0
gfx942,304,1856,5120,2048,ck,0,0,61.9831,a8w8_blockscale_1x128x128_256x128x128x128_16x16_32x32_2x2_8x32x1_8x32x1_1x32x1x8_8_1x1_intrawave_v3,627.96,537.12,0.0
gfx942,304,1856,5120,6400,ck,0,0,146.6794,a8w8_blockscale_1x128x128_256x128x128x128_16x16_32x32_2x2_8x32x1_8x32x1_1x32x1x8_8_1x1_intrawave_v3,829.26,433.95,0.0
gfx942,304,1920,5120,2048,ck,0,0,61.1864,a8w8_blockscale_1x128x128_256x128x128x128_16x16_32x32_2x2_8x32x1_8x32x1_1x32x1x8_8_1x1_intrawave_v3,658.08,556.97,0.0
gfx942,304,1920,5120,6400,ck,0,0,151.3558,a8w8_blockscale_1x128x128_256x128x128x128_16x16_32x32_2x2_8x32x1_8x32x1_1x32x1x8_8_1x1_intrawave_v3,831.35,427.58,0.0
gfx942,304,1984,5120,2048,ck,0,0,79.4118,a8w8_blockscale_1x128x128_256x128x128x128_16x16_32x32_2x2_8x32x1_8x32x1_1x32x1x8_8_1x1_intrawave_v3,523.95,439.04,0.0
gfx942,304,1984,5120,6400,ck,0,0,200.7509,a8w8_blockscale_1x128x128_256x128x128x128_16x16_32x32_2x2_8x32x1_8x32x1_1x32x1x8_8_1x1_intrawave_v3,647.69,327.68,0.0
gfx942,304,2048,5120,2048,ck,0,0,81.5003,a8w8_blockscale_1x128x128_256x128x128x128_16x16_32x32_2x2_8x32x1_8x32x1_1x32x1x8_8_1x1_intrawave_v3,526.99,437.44,0.0
gfx942,304,2048,5120,6400,ck,0,0,198.6049,a8w8_blockscale_1x128x128_256x128x128x128_16x16_32x32_2x2_8x32x1_8x32x1_1x32x1x8_8_1x1_intrawave_v3,675.8,336.58,0.0
gfx942,304,2112,5120,2048,ck,0,0,80.5991,a8w8_blockscale_1x128x128_256x128x128x128_16x16_32x32_2x2_8x32x1_8x32x1_1x32x1x8_8_1x1_intrawave_v3,549.53,452.09,0.0
gfx942,304,2112,5120,6400,ck,0,0,199.316,a8w8_blockscale_1x128x128_256x128x128x128_16x16_32x32_2x2_8x32x1_8x32x1_1x32x1x8_8_1x1_intrawave_v3,694.44,340.72,0.0
gfx942,304,2176,5120,2048,ck,0,0,78.5319,a8w8_blockscale_1x128x128_256x128x128x128_16x16_32x32_2x2_8x32x1_8x32x1_1x32x1x8_8_1x1_intrawave_v3,581.09,474.0,0.0
gfx942,304,2176,5120,6400,ck,0,0,195.5747,a8w8_blockscale_1x128x128_256x128x128x128_16x16_32x32_2x2_8x32x1_8x32x1_1x32x1x8_8_1x1_intrawave_v3,729.17,352.69,0.0
gfx942,304,2240,5120,2048,ck,0,0,79.5535,a8w8_blockscale_1x128x128_256x128x128x128_16x16_32x32_2x2_8x32x1_8x32x1_1x32x1x8_8_1x1_intrawave_v3,590.5,477.8,0.0
gfx942,304,2240,5120,6400,ck,0,0,195.9926,a8w8_blockscale_1x128x128_256x128x128x128_16x16_32x32_2x2_8x32x1_8x32x1_1x32x1x8_8_1x1_intrawave_v3,749.01,357.37,0.0
gfx942,304,2304,5120,2048,ck,0,0,77.9762,a8w8_blockscale_1x128x128_256x128x128x128_16x16_32x32_2x2_8x32x1_8x32x1_1x32x1x8_8_1x1_intrawave_v3,619.66,497.55,0.0
gfx942,304,2304,5120,6400,ck,0,0,198.9555,a8w8_blockscale_1x128x128_256x128x128x128_16x16_32x32_2x2_8x32x1_8x32x1_1x32x1x8_8_1x1_intrawave_v3,758.94,357.4,0.0
gfx942,304,2368,5120,2048,ck,0,0,79.401,a8w8_blockscale_1x128x128_256x128x128x128_16x16_32x32_2x2_8x32x1_8x32x1_1x32x1x8_8_1x1_intrawave_v3,625.44,498.53,0.0
gfx942,304,2368,5120,6400,ck,0,0,202.7963,a8w8_blockscale_1x128x128_256x128x128x128_16x16_32x32_2x2_8x32x1_8x32x1_1x32x1x8_8_1x1_intrawave_v3,765.25,355.88,0.0
gfx942,304,2432,5120,2048,ck,0,0,81.0031,a8w8_blockscale_1x128x128_256x128x128x128_16x16_32x32_2x2_8x32x1_8x32x1_1x32x1x8_8_1x1_intrawave_v3,629.64,498.38,0.0
gfx942,304,2432,5120,6400,ck,0,0,197.5009,a8w8_blockscale_1x128x128_256x128x128x128_16x16_32x32_2x2_8x32x1_8x32x1_1x32x1x8_8_1x1_intrawave_v3,807.0,370.82,0.0
gfx942,304,2496,5120,2048,ck,0,0,82.0286,a8w8_blockscale_1x128x128_256x128x128x128_16x16_32x32_2x2_8x32x1_8x32x1_1x32x1x8_8_1x1_intrawave_v3,638.13,501.73,0.0
gfx942,304,2496,5120,6400,ck,0,0,207.0364,a8w8_blockscale_1x128x128_256x128x128x128_16x16_32x32_2x2_8x32x1_8x32x1_1x32x1x8_8_1x1_intrawave_v3,790.09,358.88,0.0
gfx942,304,2560,5120,2048,ck,0,0,82.1379,a8w8_blockscale_1x128x128_256x128x128x128_16x16_32x32_2x2_8x32x1_8x32x1_1x32x1x8_8_1x1_intrawave_v3,653.62,510.64,0.0
gfx942,304,2560,5120,6400,ck,0,0,205.5075,a8w8_blockscale_1x128x128_256x128x128x128_16x16_32x32_2x2_8x32x1_8x32x1_1x32x1x8_8_1x1_intrawave_v3,816.38,366.73,0.0
gfx942,304,2624,5120,2048,ck,0,0,87.2804,a8w8_blockscale_1x128x128_256x128x128x128_16x16_32x32_2x2_8x32x1_8x32x1_1x32x1x8_8_1x1_intrawave_v3,630.49,489.57,0.0
gfx942,304,2624,5120,6400,ck,0,0,207.2097,a8w8_blockscale_1x128x128_256x128x128x128_16x16_32x32_2x2_8x32x1_8x32x1_1x32x1x8_8_1x1_intrawave_v3,829.92,368.86,0.0
gfx942,304,2688,5120,2048,ck,0,0,82.5213,a8w8_blockscale_1x128x128_256x128x128x128_16x16_32x32_2x2_8x32x1_8x32x1_1x32x1x8_8_1x1_intrawave_v3,683.11,527.33,0.0
gfx942,304,2688,5120,6400,ck,0,0,207.9512,a8w8_blockscale_1x128x128_256x128x128x128_16x16_32x32_2x2_8x32x1_8x32x1_1x32x1x8_8_1x1_intrawave_v3,847.13,372.67,0.0
gfx942,304,2752,5120,2048,ck,0,0,84.57,a8w8_blockscale_1x128x128_256x128x128x128_16x16_32x32_2x2_8x32x1_8x32x1_1x32x1x8_8_1x1_intrawave_v3,682.44,523.85,0.0
gfx942,304,2752,5120,6400,ck,0,0,214.7362,a8w8_blockscale_1x128x128_256x128x128x128_16x16_32x32_2x2_8x32x1_8x32x1_1x32x1x8_8_1x1_intrawave_v3,839.89,365.85,0.0
gfx942,304,2816,5120,2048,ck,0,0,85.0294,a8w8_blockscale_1x128x128_256x128x128x128_16x16_32x32_2x2_8x32x1_8x32x1_1x32x1x8_8_1x1_intrawave_v3,694.53,530.27,0.0
gfx942,304,2816,5120,6400,ck,0,0,216.0998,a8w8_blockscale_1x128x128_256x128x128x128_16x16_32x32_2x2_8x32x1_8x32x1_1x32x1x8_8_1x1_intrawave_v3,854.0,368.47,0.0
gfx942,304,2880,5120,2048,ck,0,0,99.3859,a8w8_blockscale_1x128x128_256x128x128x128_16x16_32x32_2x2_8x32x1_8x32x1_1x32x1x8_8_1x1_intrawave_v3,607.71,461.59,0.0
gfx942,304,2880,5120,6400,ck,0,0,253.322,a8w8_blockscale_1x128x128_256x128x128x128_16x16_32x32_2x2_8x32x1_8x32x1_1x32x1x8_8_1x1_intrawave_v3,745.07,318.53,0.0
gfx942,304,2944,5120,2048,ck,0,0,97.6524,a8w8_blockscale_1x128x128_256x128x128x128_16x16_32x32_2x2_8x32x1_8x32x1_1x32x1x8_8_1x1_intrawave_v3,632.24,477.83,0.0
gfx942,304,2944,5120,6400,ck,0,0,251.9895,a8w8_blockscale_1x128x128_256x128x128x128_16x16_32x32_2x2_8x32x1_8x32x1_1x32x1x8_8_1x1_intrawave_v3,765.66,324.44,0.0
gfx942,304,3008,5120,2048,ck,0,0,99.257,a8w8_blockscale_1x128x128_256x128x128x128_16x16_32x32_2x2_8x32x1_8x32x1_1x32x1x8_8_1x1_intrawave_v3,635.55,478.03,0.0
gfx942,304,3008,5120,6400,ck,0,0,247.9579,a8w8_blockscale_1x128x128_256x128x128x128_16x16_32x32_2x2_8x32x1_8x32x1_1x32x1x8_8_1x1_intrawave_v3,795.02,334.01,0.0
gfx942,304,3072,5120,2048,ck,0,0,102.4797,a8w8_blockscale_1x128x128_256x128x128x128_16x16_32x32_2x2_8x32x1_8x32x1_1x32x1x8_8_1x1_intrawave_v3,628.66,470.67,0.0
gfx942,304,3072,5120,6400,ck,0,0,251.5084,a8w8_blockscale_1x128x128_256x128x128x128_16x16_32x32_2x2_8x32x1_8x32x1_1x32x1x8_8_1x1_intrawave_v3,800.48,333.53,0.0
gfx942,304,3136,5120,2048,ck,0,0,100.3717,a8w8_blockscale_1x128x128_256x128x128x128_16x16_32x32_2x2_8x32x1_8x32x1_1x32x1x8_8_1x1_intrawave_v3,655.23,488.39,0.0
gfx942,304,3136,5120,6400,ck,0,0,259.6384,a8w8_blockscale_1x128x128_256x128x128x128_16x16_32x32_2x2_8x32x1_8x32x1_1x32x1x8_8_1x1_intrawave_v3,791.57,327.19,0.0
gfx942,304,3200,5120,2048,ck,0,0,104.8723,a8w8_blockscale_1x128x128_256x128x128x128_16x16_32x32_2x2_8x32x1_8x32x1_1x32x1x8_8_1x1_intrawave_v3,639.91,474.93,0.0
gfx942,304,3200,5120,6400,ck,0,0,253.6258,a8w8_blockscale_1x128x128_256x128x128x128_16x16_32x32_2x2_8x32x1_8x32x1_1x32x1x8_8_1x1_intrawave_v3,826.87,339.15,0.0
gfx942,304,3264,5120,2048,ck,0,0,102.7929,a8w8_blockscale_1x128x128_256x128x128x128_16x16_32x32_2x2_8x32x1_8x32x1_1x32x1x8_8_1x1_intrawave_v3,665.91,492.19,0.0
gfx942,304,3264,5120,6400,ck,0,0,260.4928,a8w8_blockscale_1x128x128_256x128x128x128_16x16_32x32_2x2_8x32x1_8x32x1_1x32x1x8_8_1x1_intrawave_v3,821.17,334.29,0.0
gfx942,304,3328,5120,2048,ck,0,0,104.3622,a8w8_blockscale_1x128x128_256x128x128x128_16x16_32x32_2x2_8x32x1_8x32x1_1x32x1x8_8_1x1_intrawave_v3,668.76,492.33,0.0
gfx942,304,3328,5120,6400,ck,0,0,257.2594,a8w8_blockscale_1x128x128_256x128x128x128_16x16_32x32_2x2_8x32x1_8x32x1_1x32x1x8_8_1x1_intrawave_v3,847.8,342.63,0.0
gfx942,304,3392,5120,2048,ck,0,0,105.1736,a8w8_blockscale_1x128x128_256x128x128x128_16x16_32x32_2x2_8x32x1_8x32x1_1x32x1x8_8_1x1_intrawave_v3,676.36,496.01,0.0
gfx942,304,3392,5120,6400,ck,0,0,263.3648,a8w8_blockscale_1x128x128_256x128x128x128_16x16_32x32_2x2_8x32x1_8x32x1_1x32x1x8_8_1x1_intrawave_v3,844.07,338.74,0.0
gfx942,304,3456,5120,2048,ck,0,0,103.9252,a8w8_blockscale_1x128x128_256x128x128x128_16x16_32x32_2x2_8x32x1_8x32x1_1x32x1x8_8_1x1_intrawave_v3,697.4,509.53,0.0
gfx942,304,3456,5120,6400,ck,0,0,263.8137,a8w8_blockscale_1x128x128_256x128x128x128_16x16_32x32_2x2_8x32x1_8x32x1_1x32x1x8_8_1x1_intrawave_v3,858.53,342.2,0.0
gfx942,304,3520,5120,2048,ck,0,0,109.0969,a8w8_blockscale_1x128x128_256x128x128x128_16x16_32x32_2x2_8x32x1_8x32x1_1x32x1x8_8_1x1_intrawave_v3,676.64,492.59,0.0
gfx942,304,3520,5120,6400,ck,0,0,268.1179,a8w8_blockscale_1x128x128_256x128x128x128_16x16_32x32_2x2_8x32x1_8x32x1_1x32x1x8_8_1x1_intrawave_v3,860.39,340.67,0.0
gfx942,304,3584,5120,2048,ck,0,0,107.5907,a8w8_blockscale_1x128x128_256x128x128x128_16x16_32x32_2x2_8x32x1_8x32x1_1x32x1x8_8_1x1_intrawave_v3,698.59,506.79,0.0
gfx942,304,3584,5120,6400,ck,0,0,267.0513,a8w8_blockscale_1x128x128_256x128x128x128_16x16_32x32_2x2_8x32x1_8x32x1_1x32x1x8_8_1x1_intrawave_v3,879.54,346.02,0.0
gfx942,304,3648,5120,2048,ck,0,0,107.3583,a8w8_blockscale_1x128x128_256x128x128x128_16x16_32x32_2x2_8x32x1_8x32x1_1x32x1x8_8_1x1_intrawave_v3,712.61,515.21,0.0
gfx942,304,3648,5120,6400,ck,0,0,280.1258,a8w8_blockscale_1x128x128_256x128x128x128_16x16_32x32_2x2_8x32x1_8x32x1_1x32x1x8_8_1x1_intrawave_v3,853.46,333.67,0.0
gfx942,304,3712,5120,2048,ck,0,0,110.6825,a8w8_blockscale_1x128x128_256x128x128x128_16x16_32x32_2x2_8x32x1_8x32x1_1x32x1x8_8_1x1_intrawave_v3,703.33,506.84,0.0
gfx942,304,3712,5120,6400,ck,0,0,276.9592,a8w8_blockscale_1x128x128_256x128x128x128_16x16_32x32_2x2_8x32x1_8x32x1_1x32x1x8_8_1x1_intrawave_v3,878.36,341.33,0.0
gfx942,304,3776,5120,2048,ck,0,0,111.748,a8w8_blockscale_1x128x128_256x128x128x128_16x16_32x32_2x2_8x32x1_8x32x1_1x32x1x8_8_1x1_intrawave_v3,708.63,509.05,0.0
gfx942,304,3776,5120,6400,ck,0,0,278.6979,a8w8_blockscale_1x128x128_256x128x128x128_16x16_32x32_2x2_8x32x1_8x32x1_1x32x1x8_8_1x1_intrawave_v3,887.93,343.03,0.0
gfx942,304,3840,5120,2048,ck,0,0,114.3305,a8w8_blockscale_1x128x128_256x128x128x128_16x16_32x32_2x2_8x32x1_8x32x1_1x32x1x8_8_1x1_intrawave_v3,704.37,504.43,0.0
gfx942,304,3840,5120,6400,ck,0,0,285.0979,a8w8_blockscale_1x128x128_256x128x128x128_16x16_32x32_2x2_8x32x1_8x32x1_1x32x1x8_8_1x1_intrawave_v3,882.71,339.06,0.0
gfx942,304,3904,5120,2048,ck,0,0,124.4888,a8w8_blockscale_1x128x128_256x128x128x128_16x16_32x32_2x2_8x32x1_8x32x1_1x32x1x8_8_1x1_intrawave_v3,657.67,469.59,0.0
gfx942,304,3904,5120,6400,ck,0,0,311.5222,a8w8_blockscale_1x128x128_256x128x128x128_16x16_32x32_2x2_8x32x1_8x32x1_1x32x1x8_8_1x1_intrawave_v3,821.3,313.72,0.0
gfx942,304,3968,5120,2048,ck,0,0,124.1179,a8w8_blockscale_1x128x128_256x128x128x128_16x16_32x32_2x2_8x32x1_8x32x1_1x32x1x8_8_1x1_intrawave_v3,670.45,477.32,0.0
gfx942,304,3968,5120,6400,ck,0,0,313.204,a8w8_blockscale_1x128x128_256x128x128x128_16x16_32x32_2x2_8x32x1_8x32x1_1x32x1x8_8_1x1_intrawave_v3,830.28,315.44,0.0
gfx942,304,4032,5120,2048,ck,0,0,125.2052,a8w8_blockscale_1x128x128_256x128x128x128_16x16_32x32_2x2_8x32x1_8x32x1_1x32x1x8_8_1x1_intrawave_v3,675.35,479.46,0.0
gfx942,304,4032,5120,6400,ck,0,0,318.6082,a8w8_blockscale_1x128x128_256x128x128x128_16x16_32x32_2x2_8x32x1_8x32x1_1x32x1x8_8_1x1_intrawave_v3,829.36,313.43,0.0
gfx942,304,4096,5120,2048,ck,0,0,125.7918,a8w8_blockscale_1x128x128_256x128x128x128_16x16_32x32_2x2_8x32x1_8x32x1_1x32x1x8_8_1x1_intrawave_v3,682.87,483.48,0.0
gfx942,304,4096,5120,6400,ck,0,0,322.6621,a8w8_blockscale_1x128x128_256x128x128x128_16x16_32x32_2x2_8x32x1_8x32x1_1x32x1x8_8_1x1_intrawave_v3,831.94,312.79,0.0
gfx942,304,4224,5120,2048,ck,0,0,129.8374,a8w8_blockscale_1x128x128_256x128x128x128_16x16_32x32_2x2_8x32x1_8x32x1_1x32x1x8_8_1x1_intrawave_v3,682.27,480.53,0.0
gfx942,304,4224,5120,6400,ck,0,0,325.5889,a8w8_blockscale_1x128x128_256x128x128x128_16x16_32x32_2x2_8x32x1_8x32x1_1x32x1x8_8_1x1_intrawave_v3,850.23,316.52,0.0
gfx942,304,4352,5120,2048,ck,0,0,130.3112,a8w8_blockscale_1x128x128_256x128x128x128_16x16_32x32_2x2_8x32x1_8x32x1_1x32x1x8_8_1x1_intrawave_v3,700.39,490.85,0.0
gfx942,304,4352,5120,6400,ck,0,0,330.0651,a8w8_blockscale_1x128x128_256x128x128x128_16x16_32x32_2x2_8x32x1_8x32x1_1x32x1x8_8_1x1_intrawave_v3,864.11,318.68,0.0
gfx942,304,4480,5120,2048,ck,0,0,133.772,a8w8_blockscale_1x128x128_256x128x128x128_16x16_32x32_2x2_8x32x1_8x32x1_1x32x1x8_8_1x1_intrawave_v3,702.33,489.91,0.0
gfx942,304,4480,5120,6400,ck,0,0,337.1779,a8w8_blockscale_1x128x128_256x128x128x128_16x16_32x32_2x2_8x32x1_8x32x1_1x32x1x8_8_1x1_intrawave_v3,870.76,318.27,0.0
gfx942,304,4608,5120,2048,ck,0,0,133.4869,a8w8_blockscale_1x128x128_256x128x128x128_16x16_32x32_2x2_8x32x1_8x32x1_1x32x1x8_8_1x1_intrawave_v3,723.94,502.74,0.0
gfx942,304,4608,5120,6400,ck,0,0,348.8536,a8w8_blockscale_1x128x128_256x128x128x128_16x16_32x32_2x2_8x32x1_8x32x1_1x32x1x8_8_1x1_intrawave_v3,865.66,313.73,0.0
gfx942,304,4736,5120,2048,ck,0,0,135.6717,a8w8_blockscale_1x128x128_256x128x128x128_16x16_32x32_2x2_8x32x1_8x32x1_1x32x1x8_8_1x1_intrawave_v3,732.07,506.23,0.0
gfx942,304,4736,5120,6400,ck,0,0,349.1999,a8w8_blockscale_1x128x128_256x128x128x128_16x16_32x32_2x2_8x32x1_8x32x1_1x32x1x8_8_1x1_intrawave_v3,888.83,319.52,0.0
gfx942,304,4864,5120,2048,ck,0,0,141.4047,a8w8_blockscale_1x128x128_256x128x128x128_16x16_32x32_2x2_8x32x1_8x32x1_1x32x1x8_8_1x1_intrawave_v3,721.37,496.83,0.0
gfx942,304,4864,5120,6400,ck,0,0,348.792,a8w8_blockscale_1x128x128_256x128x128x128_16x16_32x32_2x2_8x32x1_8x32x1_1x32x1x8_8_1x1_intrawave_v3,913.92,326.0,0.0
gfx942,304,4992,5120,2048,ck,0,0,153.4475,a8w8_blockscale_1x128x128_256x128x128x128_16x16_32x32_2x2_8x32x1_8x32x1_1x32x1x8_8_1x1_intrawave_v3,682.25,468.09,0.0
gfx942,304,4992,5120,6400,ck,0,0,386.1357,a8w8_blockscale_1x128x128_256x128x128x128_16x16_32x32_2x2_8x32x1_8x32x1_1x32x1x8_8_1x1_intrawave_v3,847.26,299.98,0.0
gfx942,304,5120,5120,2048,ck,0,0,149.6366,a8w8_blockscale_1x128x128_256x128x128x128_16x16_32x32_2x2_8x32x1_8x32x1_1x32x1x8_8_1x1_intrawave_v3,717.57,490.52,0.0
gfx942,304,5120,5120,6400,ck,0,0,385.218,a8w8_blockscale_1x128x128_256x128x128x128_16x16_32x32_2x2_8x32x1_8x32x1_1x32x1x8_8_1x1_intrawave_v3,871.05,306.23,0.0
gfx942,304,5248,5120,2048,ck,0,0,155.2425,a8w8_blockscale_1x128x128_256x128x128x128_16x16_32x32_2x2_8x32x1_8x32x1_1x32x1x8_8_1x1_intrawave_v3,708.95,482.94,0.0
gfx942,304,5248,5120,6400,ck,0,0,390.0554,a8w8_blockscale_1x128x128_256x128x128x128_16x16_32x32_2x2_8x32x1_8x32x1_1x32x1x8_8_1x1_intrawave_v3,881.75,307.89,0.0
gfx942,304,5376,5120,2048,ck,0,0,153.9452,a8w8_blockscale_1x128x128_256x128x128x128_16x16_32x32_2x2_8x32x1_8x32x1_1x32x1x8_8_1x1_intrawave_v3,732.36,497.23,0.0
gfx942,304,5376,5120,6400,ck,0,0,405.0643,a8w8_blockscale_1x128x128_256x128x128x128_16x16_32x32_2x2_8x32x1_8x32x1_1x32x1x8_8_1x1_intrawave_v3,869.79,301.74,0.0
gfx942,304,5504,5120,2048,ck,0,0,154.4861,a8w8_blockscale_1x128x128_256x128x128x128_16x16_32x32_2x2_8x32x1_8x32x1_1x32x1x8_8_1x1_intrawave_v3,747.17,505.67,0.0
gfx942,304,5504,5120,6400,ck,0,0,400.4662,a8w8_blockscale_1x128x128_256x128x128x128_16x16_32x32_2x2_8x32x1_8x32x1_1x32x1x8_8_1x1_intrawave_v3,900.73,310.52,0.0
gfx942,304,5632,5120,2048,ck,0,0,156.4081,a8w8_blockscale_1x128x128_256x128x128x128_16x16_32x32_2x2_8x32x1_8x32x1_1x32x1x8_8_1x1_intrawave_v3,755.15,509.51,0.0
gfx942,304,5632,5120,6400,ck,0,0,409.1015,a8w8_blockscale_1x128x128_256x128x128x128_16x16_32x32_2x2_8x32x1_8x32x1_1x32x1x8_8_1x1_intrawave_v3,902.22,309.18,0.0
gfx942,304,5760,5120,2048,ck,0,0,162.3383,a8w8_blockscale_1x128x128_256x128x128x128_16x16_32x32_2x2_8x32x1_8x32x1_1x32x1x8_8_1x1_intrawave_v3,744.1,500.59,0.0
gfx942,304,5760,5120,6400,ck,0,0,417.997,a8w8_blockscale_1x128x128_256x128x128x128_16x16_32x32_2x2_8x32x1_8x32x1_1x32x1x8_8_1x1_intrawave_v3,903.09,307.69,0.0
gfx942,304,5888,5120,2048,ck,0,0,171.1711,a8w8_blockscale_1x128x128_256x128x128x128_16x16_32x32_2x2_8x32x1_8x32x1_1x32x1x8_8_1x1_intrawave_v3,721.39,483.95,0.0
gfx942,304,5888,5120,6400,ck,0,0,454.8113,a8w8_blockscale_1x128x128_256x128x128x128_16x16_32x32_2x2_8x32x1_8x32x1_1x32x1x8_8_1x1_intrawave_v3,848.43,287.47,0.0
gfx942,304,6016,5120,2048,ck,0,0,176.5346,a8w8_blockscale_1x128x128_256x128x128x128_16x16_32x32_2x2_8x32x1_8x32x1_1x32x1x8_8_1x1_intrawave_v3,714.67,478.15,0.0
gfx942,304,6016,5120,6400,ck,0,0,449.6514,a8w8_blockscale_1x128x128_256x128x128x128_16x16_32x32_2x2_8x32x1_8x32x1_1x32x1x8_8_1x1_intrawave_v3,876.82,295.51,0.0
gfx942,304,6144,5120,2048,ck,0,0,175.5807,a8w8_blockscale_1x128x128_256x128x128x128_16x16_32x32_2x2_8x32x1_8x32x1_1x32x1x8_8_1x1_intrawave_v3,733.85,489.71,0.0
gfx942,304,6144,5120,6400,ck,0,0,455.4955,a8w8_blockscale_1x128x128_256x128x128x128_16x16_32x32_2x2_8x32x1_8x32x1_1x32x1x8_8_1x1_intrawave_v3,883.99,296.39,0.0
gfx942,304,6272,5120,2048,ck,0,0,179.141,a8w8_blockscale_1x128x128_256x128x128x128_16x16_32x32_2x2_8x32x1_8x32x1_1x32x1x8_8_1x1_intrawave_v3,734.24,488.76,0.0
gfx942,304,6272,5120,6400,ck,0,0,471.1658,a8w8_blockscale_1x128x128_256x128x128x128_16x16_32x32_2x2_8x32x1_8x32x1_1x32x1x8_8_1x1_intrawave_v3,872.39,291.05,0.0
gfx942,304,6400,5120,2048,ck,0,0,180.2561,a8w8_blockscale_1x128x128_256x128x128x128_16x16_32x32_2x2_8x32x1_8x32x1_1x32x1x8_8_1x1_intrawave_v3,744.59,494.46,0.0
gfx942,304,6400,5120,6400,ck,0,0,466.5719,a8w8_blockscale_1x128x128_256x128x128x128_16x16_32x32_2x2_8x32x1_8x32x1_1x32x1x8_8_1x1_intrawave_v3,898.96,298.48,0.0
gfx942,304,6528,5120,2048,ck,0,0,181.6287,a8w8_blockscale_1x128x128_256x128x128x128_16x16_32x32_2x2_8x32x1_8x32x1_1x32x1x8_8_1x1_intrawave_v3,753.75,499.38,0.0
gfx942,304,6528,5120,6400,ck,0,0,474.8396,a8w8_blockscale_1x128x128_256x128x128x128_16x16_32x32_2x2_8x32x1_8x32x1_1x32x1x8_8_1x1_intrawave_v3,900.98,297.77,0.0
gfx942,304,6656,5120,2048,ck,0,0,181.0404,a8w8_blockscale_1x128x128_256x128x128x128_16x16_32x32_2x2_8x32x1_8x32x1_1x32x1x8_8_1x1_intrawave_v3,771.02,509.69,0.0
gfx942,304,6656,5120,6400,ck,0,0,481.5559,a8w8_blockscale_1x128x128_256x128x128x128_16x16_32x32_2x2_8x32x1_8x32x1_1x32x1x8_8_1x1_intrawave_v3,905.83,298.04,0.0
gfx942,304,6784,5120,2048,ck,0,0,189.4722,a8w8_blockscale_1x128x128_256x128x128x128_16x16_32x32_2x2_8x32x1_8x32x1_1x32x1x8_8_1x1_intrawave_v3,750.88,495.31,0.0
gfx942,304,6784,5120,6400,ck,0,0,501.6607,a8w8_blockscale_1x128x128_256x128x128x128_16x16_32x32_2x2_8x32x1_8x32x1_1x32x1x8_8_1x1_intrawave_v3,886.25,290.34,0.0
gfx942,304,6912,5120,2048,ck,0,0,200.0672,a8w8_blockscale_1x128x128_256x128x128x128_16x16_32x32_2x2_8x32x1_8x32x1_1x32x1x8_8_1x1_intrawave_v3,724.53,476.94,0.0
gfx942,304,6912,5120,6400,ck,0,0,513.8238,a8w8_blockscale_1x128x128_256x128x128x128_16x16_32x32_2x2_8x32x1_8x32x1_1x32x1x8_8_1x1_intrawave_v3,881.6,287.62,0.0
gfx942,304,7040,5120,2048,ck,0,0,204.4092,a8w8_blockscale_1x128x128_256x128x128x128_16x16_32x32_2x2_8x32x1_8x32x1_1x32x1x8_8_1x1_intrawave_v3,722.27,474.51,0.0
gfx942,304,7040,5120,6400,ck,0,0,522.1696,a8w8_blockscale_1x128x128_256x128x128x128_16x16_32x32_2x2_8x32x1_8x32x1_1x32x1x8_8_1x1_intrawave_v3,883.57,287.1,0.0
gfx942,304,7168,5120,2048,ck,0,0,201.5353,a8w8_blockscale_1x128x128_256x128x128x128_16x16_32x32_2x2_8x32x1_8x32x1_1x32x1x8_8_1x1_intrawave_v3,745.89,489.08,0.0
gfx942,304,7168,5120,6400,ck,0,0,525.1801,a8w8_blockscale_1x128x128_256x128x128x128_16x16_32x32_2x2_8x32x1_8x32x1_1x32x1x8_8_1x1_intrawave_v3,894.48,289.51,0.0
gfx942,304,7296,5120,2048,ck,0,0,205.5917,a8w8_blockscale_1x128x128_256x128x128x128_16x16_32x32_2x2_8x32x1_8x32x1_1x32x1x8_8_1x1_intrawave_v3,744.23,487.08,0.0
gfx942,304,7296,5120,6400,ck,0,0,531.028,a8w8_blockscale_1x128x128_256x128x128x128_16x16_32x32_2x2_8x32x1_8x32x1_1x32x1x8_8_1x1_intrawave_v3,900.42,290.33,0.0
gfx942,304,7424,5120,2048,ck,0,0,207.3244,a8w8_blockscale_1x128x128_256x128x128x128_16x16_32x32_2x2_8x32x1_8x32x1_1x32x1x8_8_1x1_intrawave_v3,750.96,490.59,0.0
gfx942,304,7424,5120,6400,ck,0,0,536.6811,a8w8_blockscale_1x128x128_256x128x128x128_16x16_32x32_2x2_8x32x1_8x32x1_1x32x1x8_8_1x1_intrawave_v3,906.57,291.24,0.0
gfx942,304,7552,5120,2048,ck,0,0,204.6619,a8w8_blockscale_1x128x128_256x128x128x128_16x16_32x32_2x2_8x32x1_8x32x1_1x32x1x8_8_1x1_intrawave_v3,773.85,504.66,0.0
gfx942,304,7552,5120,6400,ck,0,0,547.4347,a8w8_blockscale_1x128x128_256x128x128x128_16x16_32x32_2x2_8x32x1_8x32x1_1x32x1x8_8_1x1_intrawave_v3,904.09,289.41,0.0
gfx942,304,7680,5120,2048,ck,0,0,209.2552,a8w8_blockscale_1x128x128_256x128x128x128_16x16_32x32_2x2_8x32x1_8x32x1_1x32x1x8_8_1x1_intrawave_v3,769.69,501.1,0.0
gfx942,304,7680,5120,6400,ck,0,0,545.6228,a8w8_blockscale_1x128x128_256x128x128x128_16x16_32x32_2x2_8x32x1_8x32x1_1x32x1x8_8_1x1_intrawave_v3,922.46,294.28,0.0
gfx942,304,7808,5120,2048,ck,0,0,227.3026,a8w8_blockscale_1x128x128_256x128x128x128_16x16_32x32_2x2_8x32x1_8x32x1_1x32x1x8_8_1x1_intrawave_v3,720.39,468.23,0.0
gfx942,304,7808,5120,6400,ck,0,0,585.4113,a8w8_blockscale_1x128x128_256x128x128x128_16x16_32x32_2x2_8x32x1_8x32x1_1x32x1x8_8_1x1_intrawave_v3,874.09,277.91,0.0
gfx942,304,7936,5120,2048,ck,0,0,225.7162,a8w8_blockscale_1x128x128_256x128x128x128_16x16_32x32_2x2_8x32x1_8x32x1_1x32x1x8_8_1x1_intrawave_v3,737.34,478.49,0.0
gfx942,304,7936,5120,6400,ck,0,0,587.7699,a8w8_blockscale_1x128x128_256x128x128x128_16x16_32x32_2x2_8x32x1_8x32x1_1x32x1x8_8_1x1_intrawave_v3,884.86,280.42,0.0
gfx942,304,8064,5120,2048,ck,0,0,218.1717,a8w8_blockscale_1x128x128_256x128x128x128_16x16_32x32_2x2_8x32x1_8x32x1_1x32x1x8_8_1x1_intrawave_v3,775.14,502.25,0.0
gfx942,304,8064,5120,6400,ck,0,0,605.1745,a8w8_blockscale_1x128x128_256x128x128x128_16x16_32x32_2x2_8x32x1_8x32x1_1x32x1x8_8_1x1_intrawave_v3,873.27,275.88,0.0
gfx942,304,8192,5120,2048,ck,0,0,230.7667,a8w8_blockscale_1x128x128_256x128x128x128_16x16_32x32_2x2_8x32x1_8x32x1_1x32x1x8_8_1x1_intrawave_v3,744.47,481.65,0.0
gfx942,304,8192,5120,6400,ck,0,0,589.7238,a8w8_blockscale_1x128x128_256x128x128x128_16x16_32x32_2x2_8x32x1_8x32x1_1x32x1x8_8_1x1_intrawave_v3,910.38,286.72,0.0
gfx942,304,8320,5120,2048,ck,0,0,227.9733,a8w8_blockscale_1x128x128_256x128x128x128_16x16_32x32_2x2_8x32x1_8x32x1_1x32x1x8_8_1x1_intrawave_v3,765.37,494.45,0.0
gfx942,304,8320,5120,6400,ck,0,0,610.2741,a8w8_blockscale_1x128x128_256x128x128x128_16x16_32x32_2x2_8x32x1_8x32x1_1x32x1x8_8_1x1_intrawave_v3,893.47,280.55,0.0
gfx942,304,8448,5120,2048,ck,0,0,234.5662,a8w8_blockscale_1x128x128_256x128x128x128_16x16_32x32_2x2_8x32x1_8x32x1_1x32x1x8_8_1x1_intrawave_v3,755.3,487.26,0.0
gfx942,304,8448,5120,6400,ck,0,0,607.9874,a8w8_blockscale_1x128x128_256x128x128x128_16x16_32x32_2x2_8x32x1_8x32x1_1x32x1x8_8_1x1_intrawave_v3,910.62,285.11,0.0
gfx942,304,8576,5120,2048,ck,0,0,232.3906,a8w8_blockscale_1x128x128_256x128x128x128_16x16_32x32_2x2_8x32x1_8x32x1_1x32x1x8_8_1x1_intrawave_v3,773.92,498.59,0.0
gfx942,304,8576,5120,6400,ck,0,0,617.5319,a8w8_blockscale_1x128x128_256x128x128x128_16x16_32x32_2x2_8x32x1_8x32x1_1x32x1x8_8_1x1_intrawave_v3,910.13,284.15,0.0
gfx942,304,8704,5120,2048,ck,0,0,235.5275,a8w8_blockscale_1x128x128_256x128x128x128_16x16_32x32_2x2_8x32x1_8x32x1_1x32x1x8_8_1x1_intrawave_v3,775.01,498.63,0.0
gfx942,304,8704,5120,6400,ck,0,0,632.0317,a8w8_blockscale_1x128x128_256x128x128x128_16x16_32x32_2x2_8x32x1_8x32x1_1x32x1x8_8_1x1_intrawave_v3,902.53,281.0,0.0
gfx942,304,8832,5120,2048,ck,0,0,247.8446,a8w8_blockscale_1x128x128_256x128x128x128_16x16_32x32_2x2_8x32x1_8x32x1_1x32x1x8_8_1x1_intrawave_v3,747.32,480.19,0.0
gfx942,304,8832,5120,6400,ck,0,0,660.6344,a8w8_blockscale_1x128x128_256x128x128x128_16x16_32x32_2x2_8x32x1_8x32x1_1x32x1x8_8_1x1_intrawave_v3,876.15,272.06,0.0
gfx942,304,8960,5120,2048,ck,0,0,250.7899,a8w8_blockscale_1x128x128_256x128x128x128_16x16_32x32_2x2_8x32x1_8x32x1_1x32x1x8_8_1x1_intrawave_v3,749.25,480.83,0.0
gfx942,304,8960,5120,6400,ck,0,0,652.5689,a8w8_blockscale_1x128x128_256x128x128x128_16x16_32x32_2x2_8x32x1_8x32x1_1x32x1x8_8_1x1_intrawave_v3,899.83,278.69,0.0
gfx942,304,9088,5120,2048,ck,0,0,245.3318,a8w8_blockscale_1x128x128_256x128x128x128_16x16_32x32_2x2_8x32x1_8x32x1_1x32x1x8_8_1x1_intrawave_v3,776.86,497.93,0.0
gfx942,304,9088,5120,6400,ck,0,0,671.6307,a8w8_blockscale_1x128x128_256x128x128x128_16x16_32x32_2x2_8x32x1_8x32x1_1x32x1x8_8_1x1_intrawave_v3,886.78,273.95,0.0
gfx942,304,9216,5120,2048,ck,0,0,252.366,a8w8_blockscale_1x128x128_256x128x128x128_16x16_32x32_2x2_8x32x1_8x32x1_1x32x1x8_8_1x1_intrawave_v3,765.85,490.29,0.0
gfx942,304,9216,5120,6400,ck,0,0,678.8929,a8w8_blockscale_1x128x128_256x128x128x128_16x16_32x32_2x2_8x32x1_8x32x1_1x32x1x8_8_1x1_intrawave_v3,889.65,274.16,0.0
gfx942,304,9344,5120,2048,ck,0,0,254.6604,a8w8_blockscale_1x128x128_256x128x128x128_16x16_32x32_2x2_8x32x1_8x32x1_1x32x1x8_8_1x1_intrawave_v3,769.49,492.05,0.0
gfx942,304,9344,5120,6400,ck,0,0,672.6202,a8w8_blockscale_1x128x128_256x128x128x128_16x16_32x32_2x2_8x32x1_8x32x1_1x32x1x8_8_1x1_intrawave_v3,910.42,279.88,0.0
gfx942,304,9472,5120,2048,ck,0,0,254.3345,a8w8_blockscale_1x128x128_256x128x128x128_16x16_32x32_2x2_8x32x1_8x32x1_1x32x1x8_8_1x1_intrawave_v3,781.03,498.86,0.0
gfx942,304,9472,5120,6400,ck,0,0,677.7788,a8w8_blockscale_1x128x128_256x128x128x128_16x16_32x32_2x2_8x32x1_8x32x1_1x32x1x8_8_1x1_intrawave_v3,915.87,280.89,0.0
gfx942,304,9600,5120,2048,ck,0,0,262.0646,a8w8_blockscale_1x128x128_256x128x128x128_16x16_32x32_2x2_8x32x1_8x32x1_1x32x1x8_8_1x1_intrawave_v3,768.23,490.15,0.0
gfx942,304,9600,5120,6400,ck,0,0,698.3341,a8w8_blockscale_1x128x128_256x128x128x128_16x16_32x32_2x2_8x32x1_8x32x1_1x32x1x8_8_1x1_intrawave_v3,900.92,275.67,0.0
gfx942,304,9728,5120,2048,ck,0,0,261.1909,a8w8_blockscale_1x128x128_256x128x128x128_16x16_32x32_2x2_8x32x1_8x32x1_1x32x1x8_8_1x1_intrawave_v3,781.08,497.81,0.0
gfx942,304,9728,5120,6400,ck,0,0,716.5774,a8w8_blockscale_1x128x128_256x128x128x128_16x16_32x32_2x2_8x32x1_8x32x1_1x32x1x8_8_1x1_intrawave_v3,889.69,271.63,0.0
gfx942,304,9856,5120,2048,ck,0,0,271.971,a8w8_blockscale_1x128x128_256x128x128x128_16x16_32x32_2x2_8x32x1_8x32x1_1x32x1x8_8_1x1_intrawave_v3,759.99,483.86,0.0
gfx942,304,9856,5120,6400,ck,0,0,724.9212,a8w8_blockscale_1x128x128_256x128x128x128_16x16_32x32_2x2_8x32x1_8x32x1_1x32x1x8_8_1x1_intrawave_v3,891.02,271.44,0.0
gfx942,304,9984,5120,2048,ck,0,0,271.1683,a8w8_blockscale_1x128x128_256x128x128x128_16x16_32x32_2x2_8x32x1_8x32x1_1x32x1x8_8_1x1_intrawave_v3,772.14,491.09,0.0
gfx942,304,9984,5120,6400,ck,0,0,735.9456,a8w8_blockscale_1x128x128_256x128x128x128_16x16_32x32_2x2_8x32x1_8x32x1_1x32x1x8_8_1x1_intrawave_v3,889.08,270.27,0.0
gfx942,304,10112,5120,2048,ck,0,0,272.946,a8w8_blockscale_1x128x128_256x128x128x128_16x16_32x32_2x2_8x32x1_8x32x1_1x32x1x8_8_1x1_intrawave_v3,776.94,493.66,0.0
gfx942,304,10112,5120,6400,ck,0,0,739.5453,a8w8_blockscale_1x128x128_256x128x128x128_16x16_32x32_2x2_8x32x1_8x32x1_1x32x1x8_8_1x1_intrawave_v3,896.09,271.83,0.0
gfx942,304,10240,5120,2048,ck,0,0,276.9263,a8w8_blockscale_1x128x128_256x128x128x128_16x16_32x32_2x2_8x32x1_8x32x1_1x32x1x8_8_1x1_intrawave_v3,775.47,492.24,0.0
gfx942,304,10240,5120,6400,ck,0,0,734.8901,a8w8_blockscale_1x128x128_256x128x128x128_16x16_32x32_2x2_8x32x1_8x32x1_1x32x1x8_8_1x1_intrawave_v3,913.18,276.45,0.0
gfx942,304,10368,5120,2048,ck,0,0,276.8545,a8w8_blockscale_1x128x128_256x128x128x128_16x16_32x32_2x2_8x32x1_8x32x1_1x32x1x8_8_1x1_intrawave_v3,785.37,498.05,0.0
gfx942,304,10368,5120,6400,ck,0,0,741.0592,a8w8_blockscale_1x128x128_256x128x128x128_16x16_32x32_2x2_8x32x1_8x32x1_1x32x1x8_8_1x1_intrawave_v3,916.9,277.02,0.0
gfx942,304,10496,5120,2048,ck,0,0,281.3409,a8w8_blockscale_1x128x128_256x128x128x128_16x16_32x32_2x2_8x32x1_8x32x1_1x32x1x8_8_1x1_intrawave_v3,782.39,495.7,0.0
gfx942,304,10496,5120,6400,ck,0,0,776.1295,a8w8_blockscale_1x128x128_256x128x128x128_16x16_32x32_2x2_8x32x1_8x32x1_1x32x1x8_8_1x1_intrawave_v3,886.28,267.25,0.0
gfx942,304,10624,5120,2048,ck,0,0,285.0858,a8w8_blockscale_1x128x128_256x128x128x128_16x16_32x32_2x2_8x32x1_8x32x1_1x32x1x8_8_1x1_intrawave_v3,781.52,494.71,0.0
gfx942,304,10624,5120,6400,ck,0,0,760.3641,a8w8_blockscale_1x128x128_256x128x128x128_16x16_32x32_2x2_8x32x1_8x32x1_1x32x1x8_8_1x1_intrawave_v3,915.69,275.59,0.0
gfx942,304,10752,5120,2048,ck,0,0,294.3726,a8w8_blockscale_1x128x128_256x128x128x128_16x16_32x32_2x2_8x32x1_8x32x1_1x32x1x8_8_1x1_intrawave_v3,765.99,484.44,0.0
gfx942,304,10752,5120,6400,ck,0,0,774.7374,a8w8_blockscale_1x128x128_256x128x128x128_16x16_32x32_2x2_8x32x1_8x32x1_1x32x1x8_8_1x1_intrawave_v3,909.53,273.23,0.0
gfx942,304,10880,5120,2048,ck,0,0,300.3433,a8w8_blockscale_1x128x128_256x128x128x128_16x16_32x32_2x2_8x32x1_8x32x1_1x32x1x8_8_1x1_intrawave_v3,759.7,480.05,0.0
gfx942,304,10880,5120,6400,ck,0,0,788.5543,a8w8_blockscale_1x128x128_256x128x128x128_16x16_32x32_2x2_8x32x1_8x32x1_1x32x1x8_8_1x1_intrawave_v3,904.23,271.14,0.0
gfx942,304,11008,5120,2048,ck,0,0,297.5146,a8w8_blockscale_1x128x128_256x128x128x128_16x16_32x32_2x2_8x32x1_8x32x1_1x32x1x8_8_1x1_intrawave_v3,775.94,489.9,0.0
gfx942,304,11008,5120,6400,ck,0,0,823.6578,a8w8_blockscale_1x128x128_256x128x128x128_16x16_32x32_2x2_8x32x1_8x32x1_1x32x1x8_8_1x1_intrawave_v3,875.87,262.17,0.0
gfx942,304,11136,5120,2048,ck,0,0,305.2192,a8w8_blockscale_1x128x128_256x128x128x128_16x16_32x32_2x2_8x32x1_8x32x1_1x32x1x8_8_1x1_intrawave_v3,765.15,482.69,0.0
gfx942,304,11136,5120,6400,ck,0,0,824.4411,a8w8_blockscale_1x128x128_256x128x128x128_16x16_32x32_2x2_8x32x1_8x32x1_1x32x1x8_8_1x1_intrawave_v3,885.22,264.51,0.0
gfx942,304,11264,5120,2048,ck,0,0,295.2161,a8w8_blockscale_1x128x128_256x128x128x128_16x16_32x32_2x2_8x32x1_8x32x1_1x32x1x8_8_1x1_intrawave_v3,800.17,504.37,0.0
gfx942,304,11264,5120,6400,ck,0,0,829.9036,a8w8_blockscale_1x128x128_256x128x128x128_16x16_32x32_2x2_8x32x1_8x32x1_1x32x1x8_8_1x1_intrawave_v3,889.5,265.33,0.0
gfx942,304,11392,5120,2048,ck,0,0,310.2844,a8w8_blockscale_1x128x128_256x128x128x128_16x16_32x32_2x2_8x32x1_8x32x1_1x32x1x8_8_1x1_intrawave_v3,769.96,484.94,0.0
gfx942,304,11392,5120,6400,ck,0,0,830.6092,a8w8_blockscale_1x128x128_256x128x128x128_16x16_32x32_2x2_8x32x1_8x32x1_1x32x1x8_8_1x1_intrawave_v3,898.84,267.67,0.0
gfx942,304,11520,5120,2048,ck,0,0,304.872,a8w8_blockscale_1x128x128_256x128x128x128_16x16_32x32_2x2_8x32x1_8x32x1_1x32x1x8_8_1x1_intrawave_v3,792.44,498.71,0.0
gfx942,304,11520,5120,6400,ck,0,0,832.7553,a8w8_blockscale_1x128x128_256x128x128x128_16x16_32x32_2x2_8x32x1_8x32x1_1x32x1x8_8_1x1_intrawave_v3,906.6,269.54,0.0
gfx942,304,11648,5120,2048,ck,0,0,308.8441,a8w8_blockscale_1x128x128_256x128x128x128_16x16_32x32_2x2_8x32x1_8x32x1_1x32x1x8_8_1x1_intrawave_v3,790.94,497.39,0.0
gfx942,304,11648,5120,6400,ck,0,0,827.7515,a8w8_blockscale_1x128x128_256x128x128x128_16x16_32x32_2x2_8x32x1_8x32x1_1x32x1x8_8_1x1_intrawave_v3,922.21,273.74,0.0
gfx942,304,11776,5120,2048,ck,0,0,325.8358,a8w8_blockscale_1x128x128_256x128x128x128_16x16_32x32_2x2_8x32x1_8x32x1_1x32x1x8_8_1x1_intrawave_v3,757.93,476.28,0.0
gfx942,304,11776,5120,6400,ck,0,0,865.4034,a8w8_blockscale_1x128x128_256x128x128x128_16x16_32x32_2x2_8x32x1_8x32x1_1x32x1x8_8_1x1_intrawave_v3,891.78,264.29,0.0
gfx942,304,11904,5120,2048,ck,0,0,323.9466,a8w8_blockscale_1x128x128_256x128x128x128_16x16_32x32_2x2_8x32x1_8x32x1_1x32x1x8_8_1x1_intrawave_v3,770.64,483.91,0.0
gfx942,304,11904,5120,6400,ck,0,0,865.0139,a8w8_blockscale_1x128x128_256x128x128x128_16x16_32x32_2x2_8x32x1_8x32x1_1x32x1x8_8_1x1_intrawave_v3,901.88,266.87,0.0
gfx942,304,12032,5120,2048,ck,0,0,319.8618,a8w8_blockscale_1x128x128_256x128x128x128_16x16_32x32_2x2_8x32x1_8x32x1_1x32x1x8_8_1x1_intrawave_v3,788.87,495.01,0.0
gfx942,304,12032,5120,6400,ck,0,0,877.9258,a8w8_blockscale_1x128x128_256x128x128x128_16x16_32x32_2x2_8x32x1_8x32x1_1x32x1x8_8_1x1_intrawave_v3,898.17,265.38,0.0
gfx942,304,12160,5120,2048,ck,0,0,326.6815,a8w8_blockscale_1x128x128_256x128x128x128_16x16_32x32_2x2_8x32x1_8x32x1_1x32x1x8_8_1x1_intrawave_v3,780.62,489.49,0.0
gfx942,304,12160,5120,6400,ck,0,0,909.558,a8w8_blockscale_1x128x128_256x128x128x128_16x16_32x32_2x2_8x32x1_8x32x1_1x32x1x8_8_1x1_intrawave_v3,876.16,258.49,0.0
gfx942,304,12288,5120,2048,ck,0,0,323.7538,a8w8_blockscale_1x128x128_256x128x128x128_16x16_32x32_2x2_8x32x1_8x32x1_1x32x1x8_8_1x1_intrawave_v3,795.97,498.78,0.0
gfx942,304,12288,5120,6400,ck,0,0,903.5267,a8w8_blockscale_1x128x128_256x128x128x128_16x16_32x32_2x2_8x32x1_8x32x1_1x32x1x8_8_1x1_intrawave_v3,891.29,262.57,0.0
gfx942,304,12416,5120,2048,ck,0,0,326.9911,a8w8_blockscale_1x128x128_256x128x128x128_16x16_32x32_2x2_8x32x1_8x32x1_1x32x1x8_8_1x1_intrawave_v3,796.3,498.65,0.0
gfx942,304,12416,5120,6400,ck,0,0,901.9714,a8w8_blockscale_1x128x128_256x128x128x128_16x16_32x32_2x2_8x32x1_8x32x1_1x32x1x8_8_1x1_intrawave_v3,902.13,265.39,0.0
gfx942,304,12544,5120,2048,ck,0,0,330.9813,a8w8_blockscale_1x128x128_256x128x128x128_16x16_32x32_2x2_8x32x1_8x32x1_1x32x1x8_8_1x1_intrawave_v3,794.81,497.39,0.0
gfx942,304,12544,5120,6400,ck,0,0,923.9093,a8w8_blockscale_1x128x128_256x128x128x128_16x16_32x32_2x2_8x32x1_8x32x1_1x32x1x8_8_1x1_intrawave_v3,889.79,261.39,0.0
gfx942,304,12672,5120,2048,ck,0,0,345.8057,a8w8_blockscale_1x128x128_256x128x128x128_16x16_32x32_2x2_8x32x1_8x32x1_1x32x1x8_8_1x1_intrawave_v3,768.5,480.61,0.0
gfx942,304,12672,5120,6400,ck,0,0,919.2308,a8w8_blockscale_1x128x128_256x128x128x128_16x16_32x32_2x2_8x32x1_8x32x1_1x32x1x8_8_1x1_intrawave_v3,903.44,265.04,0.0
gfx942,304,12800,5120,2048,ck,0,0,347.4053,a8w8_blockscale_1x128x128_256x128x128x128_16x16_32x32_2x2_8x32x1_8x32x1_1x32x1x8_8_1x1_intrawave_v3,772.69,482.93,0.0
gfx942,304,12800,5120,6400,ck,0,0,918.1434,a8w8_blockscale_1x128x128_256x128x128x128_16x16_32x32_2x2_8x32x1_8x32x1_1x32x1x8_8_1x1_intrawave_v3,913.65,267.67,0.0
gfx942,304,12928,5120,2048,ck,0,0,345.1858,a8w8_blockscale_1x128x128_256x128x128x128_16x16_32x32_2x2_8x32x1_8x32x1_1x32x1x8_8_1x1_intrawave_v3,785.43,490.59,0.0
gfx942,304,12928,5120,6400,ck,0,0,966.0532,a8w8_blockscale_1x128x128_256x128x128x128_16x16_32x32_2x2_8x32x1_8x32x1_1x32x1x8_8_1x1_intrawave_v3,877.02,256.6,0.0
gfx942,304,13056,5120,2048,ck,0,0,341.3184,a8w8_blockscale_1x128x128_256x128x128x128_16x16_32x32_2x2_8x32x1_8x32x1_1x32x1x8_8_1x1_intrawave_v3,802.2,500.76,0.0
gfx942,304,13056,5120,6400,ck,0,0,961.4957,a8w8_blockscale_1x128x128_256x128x128x128_16x16_32x32_2x2_8x32x1_8x32x1_1x32x1x8_8_1x1_intrawave_v3,889.9,260.03,0.0
gfx942,304,13184,5120,2048,ck,0,0,354.9424,a8w8_blockscale_1x128x128_256x128x128x128_16x16_32x32_2x2_8x32x1_8x32x1_1x32x1x8_8_1x1_intrawave_v3,778.97,485.97,0.0
gfx942,304,13184,5120,6400,ck,0,0,939.8968,a8w8_blockscale_1x128x128_256x128x128x128_16x16_32x32_2x2_8x32x1_8x32x1_1x32x1x8_8_1x1_intrawave_v3,919.28,268.27,0.0
gfx942,304,13312,5120,2048,ck,0,0,353.9138,a8w8_blockscale_1x128x128_256x128x128x128_16x16_32x32_2x2_8x32x1_8x32x1_1x32x1x8_8_1x1_intrawave_v3,788.82,491.82,0.0
gfx942,304,13312,5120,6400,ck,0,0,979.3983,a8w8_blockscale_1x128x128_256x128x128x128_16x16_32x32_2x2_8x32x1_8x32x1_1x32x1x8_8_1x1_intrawave_v3,890.77,259.63,0.0
gfx942,304,13440,5120,2048,ck,0,0,360.473,a8w8_blockscale_1x128x128_256x128x128x128_16x16_32x32_2x2_8x32x1_8x32x1_1x32x1x8_8_1x1_intrawave_v3,781.91,487.24,0.0
gfx942,304,13440,5120,6400,ck,0,0,972.5678,a8w8_blockscale_1x128x128_256x128x128x128_16x16_32x32_2x2_8x32x1_8x32x1_1x32x1x8_8_1x1_intrawave_v3,905.65,263.64,0.0
gfx942,304,13568,5120,2048,ck,0,0,359.2776,a8w8_blockscale_1x128x128_256x128x128x128_16x16_32x32_2x2_8x32x1_8x32x1_1x32x1x8_8_1x1_intrawave_v3,791.98,493.24,0.0
gfx942,304,13568,5120,6400,ck,0,0,966.69,a8w8_blockscale_1x128x128_256x128x128x128_16x16_32x32_2x2_8x32x1_8x32x1_1x32x1x8_8_1x1_intrawave_v3,919.83,267.45,0.0
gfx942,304,13696,5120,2048,ck,0,0,369.0614,a8w8_blockscale_1x128x128_256x128x128x128_16x16_32x32_2x2_8x32x1_8x32x1_1x32x1x8_8_1x1_intrawave_v3,778.26,484.42,0.0
gfx942,304,13696,5120,6400,ck,0,0,999.8523,a8w8_blockscale_1x128x128_256x128x128x128_16x16_32x32_2x2_8x32x1_8x32x1_1x32x1x8_8_1x1_intrawave_v3,897.71,260.71,0.0
gfx942,304,13824,5120,2048,ck,0,0,365.9152,a8w8_blockscale_1x128x128_256x128x128x128_16x16_32x32_2x2_8x32x1_8x32x1_1x32x1x8_8_1x1_intrawave_v3,792.29,492.89,0.0
gfx942,304,13824,5120,6400,ck,0,0,1022.75,a8w8_blockscale_1x128x128_256x128x128x128_16x16_32x32_2x2_8x32x1_8x32x1_1x32x1x8_8_1x1_intrawave_v3,885.82,256.95,0.0
gfx942,304,13952,5120,2048,ck,0,0,372.9183,a8w8_blockscale_1x128x128_256x128x128x128_16x16_32x32_2x2_8x32x1_8x32x1_1x32x1x8_8_1x1_intrawave_v3,784.61,487.85,0.0
gfx942,304,13952,5120,6400,ck,0,0,1033.2972,a8w8_blockscale_1x128x128_256x128x128x128_16x16_32x32_2x2_8x32x1_8x32x1_1x32x1x8_8_1x1_intrawave_v3,884.89,256.39,0.0
gfx942,304,14080,5120,2048,ck,0,0,372.294,a8w8_blockscale_1x128x128_256x128x128x128_16x16_32x32_2x2_8x32x1_8x32x1_1x32x1x8_8_1x1_intrawave_v3,793.13,492.89,0.0
gfx942,304,14080,5120,6400,ck,0,0,1035.0436,a8w8_blockscale_1x128x128_256x128x128x128_16x16_32x32_2x2_8x32x1_8x32x1_1x32x1x8_8_1x1_intrawave_v3,891.51,258.02,0.0
gfx942,304,14208,5120,2048,ck,0,0,373.8888,a8w8_blockscale_1x128x128_256x128x128x128_16x16_32x32_2x2_8x32x1_8x32x1_1x32x1x8_8_1x1_intrawave_v3,796.93,495.0,0.0
gfx942,304,14208,5120,6400,ck,0,0,1024.1033,a8w8_blockscale_1x128x128_256x128x128x128_16x16_32x32_2x2_8x32x1_8x32x1_1x32x1x8_8_1x1_intrawave_v3,909.22,262.85,0.0
gfx942,304,14336,5120,2048,ck,0,0,380.2493,a8w8_blockscale_1x128x128_256x128x128x128_16x16_32x32_2x2_8x32x1_8x32x1_1x32x1x8_8_1x1_intrawave_v3,790.66,490.85,0.0
gfx942,304,14336,5120,6400,ck,0,0,1055.3884,a8w8_blockscale_1x128x128_256x128x128x128_16x16_32x32_2x2_8x32x1_8x32x1_1x32x1x8_8_1x1_intrawave_v3,890.22,257.08,0.0
gfx942,304,14464,5120,2048,ck,0,0,379.621,a8w8_blockscale_1x128x128_256x128x128x128_16x16_32x32_2x2_8x32x1_8x32x1_1x32x1x8_8_1x1_intrawave_v3,799.04,495.81,0.0
gfx942,304,14464,5120,6400,ck,0,0,1028.9378,a8w8_blockscale_1x128x128_256x128x128x128_16x16_32x32_2x2_8x32x1_8x32x1_1x32x1x8_8_1x1_intrawave_v3,921.25,265.76,0.0
gfx942,304,14592,5120,2048,ck,0,0,390.0539,a8w8_blockscale_1x128x128_256x128x128x128_16x16_32x32_2x2_8x32x1_8x32x1_1x32x1x8_8_1x1_intrawave_v3,784.55,486.58,0.0
gfx942,304,14592,5120,6400,ck,0,0,1039.164,a8w8_blockscale_1x128x128_256x128x128x128_16x16_32x32_2x2_8x32x1_8x32x1_1x32x1x8_8_1x1_intrawave_v3,920.26,265.19,0.0
gfx942,304,14720,5120,2048,ck,0,0,390.3994,a8w8_blockscale_1x128x128_256x128x128x128_16x16_32x32_2x2_8x32x1_8x32x1_1x32x1x8_8_1x1_intrawave_v3,790.73,490.18,0.0
gfx942,304,14720,5120,6400,ck,0,0,1081.5529,a8w8_blockscale_1x128x128_256x128x128x128_16x16_32x32_2x2_8x32x1_8x32x1_1x32x1x8_8_1x1_intrawave_v3,891.95,256.77,0.0
gfx942,304,14848,5120,2048,ck,0,0,395.4817,a8w8_blockscale_1x128x128_256x128x128x128_16x16_32x32_2x2_8x32x1_8x32x1_1x32x1x8_8_1x1_intrawave_v3,787.36,487.86,0.0
gfx942,304,14848,5120,6400,ck,0,0,1071.0127,a8w8_blockscale_1x128x128_256x128x128x128_16x16_32x32_2x2_8x32x1_8x32x1_1x32x1x8_8_1x1_intrawave_v3,908.56,261.28,0.0
gfx942,304,14976,5120,2048,ck,0,0,395.0507,a8w8_blockscale_1x128x128_256x128x128x128_16x16_32x32_2x2_8x32x1_8x32x1_1x32x1x8_8_1x1_intrawave_v3,795.01,492.37,0.0
gfx942,304,14976,5120,6400,ck,0,0,1086.8694,a8w8_blockscale_1x128x128_256x128x128x128_16x16_32x32_2x2_8x32x1_8x32x1_1x32x1x8_8_1x1_intrawave_v3,903.02,259.43,0.0
gfx942,304,15104,5120,2048,ck,0,0,406.2044,a8w8_blockscale_1x128x128_256x128x128x128_16x16_32x32_2x2_8x32x1_8x32x1_1x32x1x8_8_1x1_intrawave_v3,779.79,482.72,0.0
gfx942,304,15104,5120,6400,ck,0,0,1078.6825,a8w8_blockscale_1x128x128_256x128x128x128_16x16_32x32_2x2_8x32x1_8x32x1_1x32x1x8_8_1x1_intrawave_v3,917.65,263.38,0.0
gfx942,304,15232,5120,2048,ck,0,0,396.4475,a8w8_blockscale_1x128x128_256x128x128x128_16x16_32x32_2x2_8x32x1_8x32x1_1x32x1x8_8_1x1_intrawave_v3,805.75,498.57,0.0
gfx942,304,15232,5120,6400,ck,0,0,1116.6703,a8w8_blockscale_1x128x128_256x128x128x128_16x16_32x32_2x2_8x32x1_8x32x1_1x32x1x8_8_1x1_intrawave_v3,893.95,256.32,0.0
gfx942,304,15360,5120,2048,ck,0,0,404.6142,a8w8_blockscale_1x128x128_256x128x128x128_16x16_32x32_2x2_8x32x1_8x32x1_1x32x1x8_8_1x1_intrawave_v3,796.12,492.39,0.0
gfx942,304,15360,5120,6400,ck,0,0,1114.9168,a8w8_blockscale_1x128x128_256x128x128x128_16x16_32x32_2x2_8x32x1_8x32x1_1x32x1x8_8_1x1_intrawave_v3,902.88,258.64,0.0
gfx942,304,15488,5120,2048,ck,0,0,414.4244,a8w8_blockscale_1x128x128_256x128x128x128_16x16_32x32_2x2_8x32x1_8x32x1_1x32x1x8_8_1x1_intrawave_v3,783.75,484.53,0.0
gfx942,304,15488,5120,6400,ck,0,0,1109.9838,a8w8_blockscale_1x128x128_256x128x128x128_16x16_32x32_2x2_8x32x1_8x32x1_1x32x1x8_8_1x1_intrawave_v3,914.45,261.71,0.0
gfx942,304,15616,5120,2048,ck,0,0,420.7438,a8w8_blockscale_1x128x128_256x128x128x128_16x16_32x32_2x2_8x32x1_8x32x1_1x32x1x8_8_1x1_intrawave_v3,778.36,480.99,0.0
gfx942,304,15616,5120,6400,ck,0,0,1142.2215,a8w8_blockscale_1x128x128_256x128x128x128_16x16_32x32_2x2_8x32x1_8x32x1_1x32x1x8_8_1x1_intrawave_v3,895.98,256.18,0.0
gfx942,304,15744,5120,2048,ck,0,0,414.3055,a8w8_blockscale_1x128x128_256x128x128x128_16x16_32x32_2x2_8x32x1_8x32x1_1x32x1x8_8_1x1_intrawave_v3,796.94,492.26,0.0
gfx942,304,15744,5120,6400,ck,0,0,1151.4006,a8w8_blockscale_1x128x128_256x128x128x128_16x16_32x32_2x2_8x32x1_8x32x1_1x32x1x8_8_1x1_intrawave_v3,896.12,255.99,0.0
gfx942,304,15872,5120,2048,ck,0,0,413.0036,a8w8_blockscale_1x128x128_256x128x128x128_16x16_32x32_2x2_8x32x1_8x32x1_1x32x1x8_8_1x1_intrawave_v3,805.95,497.62,0.0
gfx942,304,15872,5120,6400,ck,0,0,1167.2276,a8w8_blockscale_1x128x128_256x128x128x128_16x16_32x32_2x2_8x32x1_8x32x1_1x32x1x8_8_1x1_intrawave_v3,891.16,254.34,0.0
gfx942,304,16000,5120,2048,ck,0,0,422.7875,a8w8_blockscale_1x128x128_256x128x128x128_16x16_32x32_2x2_8x32x1_8x32x1_1x32x1x8_8_1x1_intrawave_v3,793.65,489.83,0.0
gfx942,304,16000,5120,6400,ck,0,0,1196.0993,a8w8_blockscale_1x128x128_256x128x128x128_16x16_32x32_2x2_8x32x1_8x32x1_1x32x1x8_8_1x1_intrawave_v3,876.66,249.99,0.0
gfx942,304,16128,5120,2048,ck,0,0,430.9277,a8w8_blockscale_1x128x128_256x128x128x128_16x16_32x32_2x2_8x32x1_8x32x1_1x32x1x8_8_1x1_intrawave_v3,784.88,484.23,0.0
gfx942,304,16128,5120,6400,ck,0,0,1164.2473,a8w8_blockscale_1x128x128_256x128x128x128_16x16_32x32_2x2_8x32x1_8x32x1_1x32x1x8_8_1x1_intrawave_v3,907.85,258.65,0.0
gfx942,304,16256,5120,2048,ck,0,0,429.6227,a8w8_blockscale_1x128x128_256x128x128x128_16x16_32x32_2x2_8x32x1_8x32x1_1x32x1x8_8_1x1_intrawave_v3,793.52,489.36,0.0
gfx942,304,16256,5120,6400,ck,0,0,1180.9924,a8w8_blockscale_1x128x128_256x128x128x128_16x16_32x32_2x2_8x32x1_8x32x1_1x32x1x8_8_1x1_intrawave_v3,902.08,256.79,0.0
gfx942,304,16384,5120,2048,ck,0,0,439.9503,a8w8_blockscale_1x128x128_256x128x128x128_16x16_32x32_2x2_8x32x1_8x32x1_1x32x1x8_8_1x1_intrawave_v3,780.99,481.45,0.0
gfx942,304,16384,5120,6400,ck,0,0,1161.656,a8w8_blockscale_1x128x128_256x128x128x128_16x16_32x32_2x2_8x32x1_8x32x1_1x32x1x8_8_1x1_intrawave_v3,924.32,262.9,0.0
gfx942,304,16512,5120,2048,ck,0,0,431.7537,a8w8_blockscale_1x128x128_256x128x128x128_16x16_32x32_2x2_8x32x1_8x32x1_1x32x1x8_8_1x1_intrawave_v3,802.04,494.23,0.0
gfx942,304,16512,5120,6400,ck,0,0,1202.3967,a8w8_blockscale_1x128x128_256x128x128x128_16x16_32x32_2x2_8x32x1_8x32x1_1x32x1x8_8_1x1_intrawave_v3,899.98,255.76,0.0
gfx942,304,16640,5120,2048,ck,0,0,442.2649,a8w8_blockscale_1x128x128_256x128x128x128_16x16_32x32_2x2_8x32x1_8x32x1_1x32x1x8_8_1x1_intrawave_v3,789.04,486.04,0.0
gfx942,304,16640,5120,6400,ck,0,0,1230.381,a8w8_blockscale_1x128x128_256x128x128x128_16x16_32x32_2x2_8x32x1_8x32x1_1x32x1x8_8_1x1_intrawave_v3,886.33,251.68,0.0
gfx942,304,16768,5120,2048,ck,0,0,445.4412,a8w8_blockscale_1x128x128_256x128x128x128_16x16_32x32_2x2_8x32x1_8x32x1_1x32x1x8_8_1x1_intrawave_v3,789.44,486.1,0.0
gfx942,304,16768,5120,6400,ck,0,0,1221.3166,a8w8_blockscale_1x128x128_256x128x128x128_16x16_32x32_2x2_8x32x1_8x32x1_1x32x1x8_8_1x1_intrawave_v3,899.77,255.29,0.0
gfx942,304,16896,5120,2048,ck,0,0,437.0104,a8w8_blockscale_1x128x128_256x128x128x128_16x16_32x32_2x2_8x32x1_8x32x1_1x32x1x8_8_1x1_intrawave_v3,810.82,499.08,0.0
gfx942,304,16896,5120,6400,ck,0,0,1212.6643,a8w8_blockscale_1x128x128_256x128x128x128_16x16_32x32_2x2_8x32x1_8x32x1_1x32x1x8_8_1x1_intrawave_v3,913.11,258.87,0.0
gfx942,304,17024,5120,2048,ck,0,0,450.3065,a8w8_blockscale_1x128x128_256x128x128x128_16x16_32x32_2x2_8x32x1_8x32x1_1x32x1x8_8_1x1_intrawave_v3,792.84,487.84,0.0
gfx942,304,17024,5120,6400,ck,0,0,1245.9183,a8w8_blockscale_1x128x128_256x128x128x128_16x16_32x32_2x2_8x32x1_8x32x1_1x32x1x8_8_1x1_intrawave_v3,895.47,253.67,0.0
gfx942,304,17152,5120,2048,ck,0,0,450.0218,a8w8_blockscale_1x128x128_256x128x128x128_16x16_32x32_2x2_8x32x1_8x32x1_1x32x1x8_8_1x1_intrawave_v3,799.3,491.64,0.0
gfx942,304,17152,5120,6400,ck,0,0,1250.1659,a8w8_blockscale_1x128x128_256x128x128x128_16x16_32x32_2x2_8x32x1_8x32x1_1x32x1x8_8_1x1_intrawave_v3,899.14,254.51,0.0
gfx942,304,17280,5120,2048,ck,0,0,455.4687,a8w8_blockscale_1x128x128_256x128x128x128_16x16_32x32_2x2_8x32x1_8x32x1_1x32x1x8_8_1x1_intrawave_v3,795.64,489.22,0.0
gfx942,304,17280,5120,6400,ck,0,0,1251.8884,a8w8_blockscale_1x128x128_256x128x128x128_16x16_32x32_2x2_8x32x1_8x32x1_1x32x1x8_8_1x1_intrawave_v3,904.6,255.86,0.0
gfx942,304,17408,5120,2048,ck,0,0,455.6115,a8w8_blockscale_1x128x128_256x128x128x128_16x16_32x32_2x2_8x32x1_8x32x1_1x32x1x8_8_1x1_intrawave_v3,801.28,492.51,0.0
gfx942,304,17408,5120,6400,ck,0,0,1297.0533,a8w8_blockscale_1x128x128_256x128x128x128_16x16_32x32_2x2_8x32x1_8x32x1_1x32x1x8_8_1x1_intrawave_v3,879.57,248.59,0.0
gfx942,304,17536,5120,2048,ck,0,0,465.7425,a8w8_blockscale_1x128x128_256x128x128x128_16x16_32x32_2x2_8x32x1_8x32x1_1x32x1x8_8_1x1_intrawave_v3,789.61,485.18,0.0
gfx942,304,17536,5120,6400,ck,0,0,1293.0278,a8w8_blockscale_1x128x128_256x128x128x128_16x16_32x32_2x2_8x32x1_8x32x1_1x32x1x8_8_1x1_intrawave_v3,888.8,251.01,0.0
gfx942,304,17664,5120,2048,ck,0,0,468.8354,a8w8_blockscale_1x128x128_256x128x128x128_16x16_32x32_2x2_8x32x1_8x32x1_1x32x1x8_8_1x1_intrawave_v3,790.13,485.33,0.0
gfx942,304,17664,5120,6400,ck,0,0,1299.1848,a8w8_blockscale_1x128x128_256x128x128x128_16x16_32x32_2x2_8x32x1_8x32x1_1x32x1x8_8_1x1_intrawave_v3,891.04,251.46,0.0
gfx942,304,17792,5120,2048,ck,0,0,477.2984,a8w8_blockscale_1x128x128_256x128x128x128_16x16_32x32_2x2_8x32x1_8x32x1_1x32x1x8_8_1x1_intrawave_v3,781.74,480.02,0.0
gfx942,304,17792,5120,6400,ck,0,0,1291.3695,a8w8_blockscale_1x128x128_256x128x128x128_16x16_32x32_2x2_8x32x1_8x32x1_1x32x1x8_8_1x1_intrawave_v3,902.93,254.63,0.0
gfx942,304,17920,5120,2048,ck,0,0,472.3062,a8w8_blockscale_1x128x128_256x128x128x128_16x16_32x32_2x2_8x32x1_8x32x1_1x32x1x8_8_1x1_intrawave_v3,795.69,488.43,0.0
gfx942,304,17920,5120,6400,ck,0,0,1311.975,a8w8_blockscale_1x128x128_256x128x128x128_16x16_32x32_2x2_8x32x1_8x32x1_1x32x1x8_8_1x1_intrawave_v3,895.14,252.26,0.0
gfx942,304,18048,5120,2048,ck,0,0,476.0064,a8w8_blockscale_1x128x128_256x128x128x128_16x16_32x32_2x2_8x32x1_8x32x1_1x32x1x8_8_1x1_intrawave_v3,795.14,487.93,0.0
gfx942,304,18048,5120,6400,ck,0,0,1332.8048,a8w8_blockscale_1x128x128_256x128x128x128_16x16_32x32_2x2_8x32x1_8x32x1_1x32x1x8_8_1x1_intrawave_v3,887.45,249.91,0.0
gfx942,304,18176,5120,2048,ck,0,0,492.4326,a8w8_blockscale_1x128x128_256x128x128x128_16x16_32x32_2x2_8x32x1_8x32x1_1x32x1x8_8_1x1_intrawave_v3,774.07,474.85,0.0
gfx942,304,18176,5120,6400,ck,0,0,1357.423,a8w8_blockscale_1x128x128_256x128x128x128_16x16_32x32_2x2_8x32x1_8x32x1_1x32x1x8_8_1x1_intrawave_v3,877.53,246.95,0.0
gfx942,304,18304,5120,2048,ck,0,0,477.337,a8w8_blockscale_1x128x128_256x128x128x128_16x16_32x32_2x2_8x32x1_8x32x1_1x32x1x8_8_1x1_intrawave_v3,804.18,493.16,0.0
gfx942,304,18304,5120,6400,ck,0,0,1324.1197,a8w8_blockscale_1x128x128_256x128x128x128_16x16_32x32_2x2_8x32x1_8x32x1_1x32x1x8_8_1x1_intrawave_v3,905.94,254.77,0.0
gfx942,304,18432,5120,2048,ck,0,0,487.383,a8w8_blockscale_1x128x128_256x128x128x128_16x16_32x32_2x2_8x32x1_8x32x1_1x32x1x8_8_1x1_intrawave_v3,793.11,486.23,0.0
gfx942,304,18432,5120,6400,ck,0,0,1325.3138,a8w8_blockscale_1x128x128_256x128x128x128_16x16_32x32_2x2_8x32x1_8x32x1_1x32x1x8_8_1x1_intrawave_v3,911.45,256.15,0.0
gfx942,304,18560,5120,2048,ck,0,0,492.0009,a8w8_blockscale_1x128x128_256x128x128x128_16x16_32x32_2x2_8x32x1_8x32x1_1x32x1x8_8_1x1_intrawave_v3,791.12,484.86,0.0
gfx942,304,18560,5120,6400,ck,0,0,1339.1169,a8w8_blockscale_1x128x128_256x128x128x128_16x16_32x32_2x2_8x32x1_8x32x1_1x32x1x8_8_1x1_intrawave_v3,908.32,255.1,0.0
gfx942,304,18688,5120,2048,ck,0,0,492.7707,a8w8_blockscale_1x128x128_256x128x128x128_16x16_32x32_2x2_8x32x1_8x32x1_1x32x1x8_8_1x1_intrawave_v3,795.33,487.29,0.0
gfx942,304,18688,5120,6400,ck,0,0,1358.0161,a8w8_blockscale_1x128x128_256x128x128x128_16x16_32x32_2x2_8x32x1_8x32x1_1x32x1x8_8_1x1_intrawave_v3,901.86,253.12,0.0
gfx942,304,18816,5120,2048,ck,0,0,498.5789,a8w8_blockscale_1x128x128_256x128x128x128_16x16_32x32_2x2_8x32x1_8x32x1_1x32x1x8_8_1x1_intrawave_v3,791.45,484.77,0.0
gfx942,304,18816,5120,6400,ck,0,0,1409.4034,a8w8_blockscale_1x128x128_256x128x128x128_16x16_32x32_2x2_8x32x1_8x32x1_1x32x1x8_8_1x1_intrawave_v3,874.93,245.4,0.0
gfx942,304,18944,5120,2048,ck,0,0,493.882,a8w8_blockscale_1x128x128_256x128x128x128_16x16_32x32_2x2_8x32x1_8x32x1_1x32x1x8_8_1x1_intrawave_v3,804.41,492.57,0.0
gfx942,304,18944,5120,6400,ck,0,0,1398.0347,a8w8_blockscale_1x128x128_256x128x128x128_16x16_32x32_2x2_8x32x1_8x32x1_1x32x1x8_8_1x1_intrawave_v3,888.04,248.92,0.0
gfx942,304,19072,5120,2048,ck,0,0,503.1213,a8w8_blockscale_1x128x128_256x128x128x128_16x16_32x32_2x2_8x32x1_8x32x1_1x32x1x8_8_1x1_intrawave_v3,794.97,486.65,0.0
gfx942,304,19072,5120,6400,ck,0,0,1380.7481,a8w8_blockscale_1x128x128_256x128x128x128_16x16_32x32_2x2_8x32x1_8x32x1_1x32x1x8_8_1x1_intrawave_v3,905.24,253.58,0.0
gfx942,304,19200,5120,2048,ck,0,0,508.2433,a8w8_blockscale_1x128x128_256x128x128x128_16x16_32x32_2x2_8x32x1_8x32x1_1x32x1x8_8_1x1_intrawave_v3,792.24,484.84,0.0
gfx942,304,19200,5120,6400,ck,0,0,1386.6746,a8w8_blockscale_1x128x128_256x128x128x128_16x16_32x32_2x2_8x32x1_8x32x1_1x32x1x8_8_1x1_intrawave_v3,907.42,254.03,0.0
gfx942,304,19328,5120,2048,ck,0,0,501.8012,a8w8_blockscale_1x128x128_256x128x128x128_16x16_32x32_2x2_8x32x1_8x32x1_1x32x1x8_8_1x1_intrawave_v3,807.77,494.2,0.0
gfx942,304,19328,5120,6400,ck,0,0,1396.3133,a8w8_blockscale_1x128x128_256x128x128x128_16x16_32x32_2x2_8x32x1_8x32x1_1x32x1x8_8_1x1_intrawave_v3,907.16,253.8,0.0
gfx942,304,19456,5120,2048,ck,0,0,512.9209,a8w8_blockscale_1x128x128_256x128x128x128_16x16_32x32_2x2_8x32x1_8x32x1_1x32x1x8_8_1x1_intrawave_v3,795.49,486.55,0.0
gfx942,304,19456,5120,6400,ck,0,0,1430.6985,a8w8_blockscale_1x128x128_256x128x128x128_16x16_32x32_2x2_8x32x1_8x32x1_1x32x1x8_8_1x1_intrawave_v3,891.22,249.19,0.0
gfx942,304,19584,5120,2048,ck,0,0,523.0741,a8w8_blockscale_1x128x128_256x128x128x128_16x16_32x32_2x2_8x32x1_8x32x1_1x32x1x8_8_1x1_intrawave_v3,785.18,480.11,0.0
gfx942,304,19584,5120,6400,ck,0,0,1431.6583,a8w8_blockscale_1x128x128_256x128x128x128_16x16_32x32_2x2_8x32x1_8x32x1_1x32x1x8_8_1x1_intrawave_v3,896.48,250.51,0.0
gfx942,304,19712,5120,2048,ck,0,0,519.3964,a8w8_blockscale_1x128x128_256x128x128x128_16x16_32x32_2x2_8x32x1_8x32x1_1x32x1x8_8_1x1_intrawave_v3,795.91,486.54,0.0
gfx942,304,19712,5120,6400,ck,0,0,1463.8251,a8w8_blockscale_1x128x128_256x128x128x128_16x16_32x32_2x2_8x32x1_8x32x1_1x32x1x8_8_1x1_intrawave_v3,882.51,246.46,0.0
gfx942,304,19840,5120,2048,ck,0,0,524.6622,a8w8_blockscale_1x128x128_256x128x128x128_16x16_32x32_2x2_8x32x1_8x32x1_1x32x1x8_8_1x1_intrawave_v3,793.03,484.65,0.0
gfx942,304,19840,5120,6400,ck,0,0,1424.6744,a8w8_blockscale_1x128x128_256x128x128x128_16x16_32x32_2x2_8x32x1_8x32x1_1x32x1x8_8_1x1_intrawave_v3,912.65,254.73,0.0
gfx942,304,19968,5120,2048,ck,0,0,522.8794,a8w8_blockscale_1x128x128_256x128x128x128_16x16_32x32_2x2_8x32x1_8x32x1_1x32x1x8_8_1x1_intrawave_v3,800.87,489.31,0.0
gfx942,304,19968,5120,6400,ck,0,0,1461.5551,a8w8_blockscale_1x128x128_256x128x128x128_16x16_32x32_2x2_8x32x1_8x32x1_1x32x1x8_8_1x1_intrawave_v3,895.36,249.76,0.0
gfx942,304,20096,5120,2048,ck,0,0,533.4967,a8w8_blockscale_1x128x128_256x128x128x128_16x16_32x32_2x2_8x32x1_8x32x1_1x32x1x8_8_1x1_intrawave_v3,789.96,482.52,0.0
gfx942,304,20096,5120,6400,ck,0,0,1442.5934,a8w8_blockscale_1x128x128_256x128x128x128_16x16_32x32_2x2_8x32x1_8x32x1_1x32x1x8_8_1x1_intrawave_v3,912.95,254.52,0.0
gfx942,304,20224,5120,2048,ck,0,0,524.5442,a8w8_blockscale_1x128x128_256x128x128x128_16x16_32x32_2x2_8x32x1_8x32x1_1x32x1x8_8_1x1_intrawave_v3,808.56,493.76,0.0
gfx942,304,20224,5120,6400,ck,0,0,1469.3686,a8w8_blockscale_1x128x128_256x128x128x128_16x16_32x32_2x2_8x32x1_8x32x1_1x32x1x8_8_1x1_intrawave_v3,902.02,251.33,0.0
gfx942,304,20352,5120,2048,ck,0,0,532.8404,a8w8_blockscale_1x128x128_256x128x128x128_16x16_32x32_2x2_8x32x1_8x32x1_1x32x1x8_8_1x1_intrawave_v3,801.01,489.02,0.0
gfx942,304,20352,5120,6400,ck,0,0,1460.057,a8w8_blockscale_1x128x128_256x128x128x128_16x16_32x32_2x2_8x32x1_8x32x1_1x32x1x8_8_1x1_intrawave_v3,913.52,254.39,0.0
gfx942,304,20480,5120,2048,ck,0,0,535.1006,a8w8_blockscale_1x128x128_256x128x128x128_16x16_32x32_2x2_8x32x1_8x32x1_1x32x1x8_8_1x1_intrawave_v3,802.65,489.9,0.0
gfx942,304,20480,5120,6400,ck,0,0,1482.1957,a8w8_blockscale_1x128x128_256x128x128x128_16x16_32x32_2x2_8x32x1_8x32x1_1x32x1x8_8_1x1_intrawave_v3,905.53,252.03,0.0
gfx942,304,20608,5120,2048,ck,0,0,540.2059,a8w8_blockscale_1x128x128_256x128x128x128_16x16_32x32_2x2_8x32x1_8x32x1_1x32x1x8_8_1x1_intrawave_v3,800.03,488.18,0.0
gfx942,304,20608,5120,6400,ck,0,0,1490.4707,a8w8_blockscale_1x128x128_256x128x128x128_16x16_32x32_2x2_8x32x1_8x32x1_1x32x1x8_8_1x1_intrawave_v3,906.13,252.06,0.0
gfx942,304,20736,5120,2048,ck,0,0,545.0043,a8w8_blockscale_1x128x128_256x128x128x128_16x16_32x32_2x2_8x32x1_8x32x1_1x32x1x8_8_1x1_intrawave_v3,797.91,486.77,0.0
gfx942,304,20736,5120,6400,ck,0,0,1496.0365,a8w8_blockscale_1x128x128_256x128x128x128_16x16_32x32_2x2_8x32x1_8x32x1_1x32x1x8_8_1x1_intrawave_v3,908.37,252.54,0.0
gfx942,304,20864,5120,2048,ck,0,0,541.0498,a8w8_blockscale_1x128x128_256x128x128x128_16x16_32x32_2x2_8x32x1_8x32x1_1x32x1x8_8_1x1_intrawave_v3,808.71,493.23,0.0
gfx942,304,20864,5120,6400,ck,0,0,1519.5543,a8w8_blockscale_1x128x128_256x128x128x128_16x16_32x32_2x2_8x32x1_8x32x1_1x32x1x8_8_1x1_intrawave_v3,899.83,250.04,0.0
gfx942,304,20992,5120,2048,ck,0,0,552.0829,a8w8_blockscale_1x128x128_256x128x128x128_16x16_32x32_2x2_8x32x1_8x32x1_1x32x1x8_8_1x1_intrawave_v3,797.41,486.22,0.0
gfx942,304,20992,5120,6400,ck,0,0,1484.4182,a8w8_blockscale_1x128x128_256x128x128x128_16x16_32x32_2x2_8x32x1_8x32x1_1x32x1x8_8_1x1_intrawave_v3,926.78,257.39,0.0
gfx942,304,21120,5120,2048,ck,0,0,557.6247,a8w8_blockscale_1x128x128_256x128x128x128_16x16_32x32_2x2_8x32x1_8x32x1_1x32x1x8_8_1x1_intrawave_v3,794.29,484.21,0.0
gfx942,304,21120,5120,6400,ck,0,0,1495.6594,a8w8_blockscale_1x128x128_256x128x128x128_16x16_32x32_2x2_8x32x1_8x32x1_1x32x1x8_8_1x1_intrawave_v3,925.42,256.88,0.0
gfx942,304,21248,5120,2048,ck,0,0,550.7,a8w8_blockscale_1x128x128_256x128x128x128_16x16_32x32_2x2_8x32x1_8x32x1_1x32x1x8_8_1x1_intrawave_v3,809.16,493.16,0.0
gfx942,304,21248,5120,6400,ck,0,0,1529.9306,a8w8_blockscale_1x128x128_256x128x128x128_16x16_32x32_2x2_8x32x1_8x32x1_1x32x1x8_8_1x1_intrawave_v3,910.18,252.52,0.0
gfx942,304,21376,5120,2048,ck,0,0,556.7063,a8w8_blockscale_1x128x128_256x128x128x128_16x16_32x32_2x2_8x32x1_8x32x1_1x32x1x8_8_1x1_intrawave_v3,805.25,490.66,0.0
gfx942,304,21376,5120,6400,ck,0,0,1544.9089,a8w8_blockscale_1x128x128_256x128x128x128_16x16_32x32_2x2_8x32x1_8x32x1_1x32x1x8_8_1x1_intrawave_v3,906.78,251.45,0.0
gfx942,304,21504,5120,2048,ck,0,0,562.1823,a8w8_blockscale_1x128x128_256x128x128x128_16x16_32x32_2x2_8x32x1_8x32x1_1x32x1x8_8_1x1_intrawave_v3,802.18,488.68,0.0
gfx942,304,21504,5120,6400,ck,0,0,1558.7398,a8w8_blockscale_1x128x128_256x128x128x128_16x16_32x32_2x2_8x32x1_8x32x1_1x32x1x8_8_1x1_intrawave_v3,904.12,250.58,0.0
gfx942,304,21632,5120,2048,ck,0,0,578.8829,a8w8_blockscale_1x128x128_256x128x128x128_16x16_32x32_2x2_8x32x1_8x32x1_1x32x1x8_8_1x1_intrawave_v3,783.67,477.3,0.0
gfx942,304,21632,5120,6400,ck,0,0,1543.5107,a8w8_blockscale_1x128x128_256x128x128x128_16x16_32x32_2x2_8x32x1_8x32x1_1x32x1x8_8_1x1_intrawave_v3,918.47,254.44,0.0
gfx942,304,21760,5120,2048,ck,0,0,568.501,a8w8_blockscale_1x128x128_256x128x128x128_16x16_32x32_2x2_8x32x1_8x32x1_1x32x1x8_8_1x1_intrawave_v3,802.71,488.78,0.0
gfx942,304,21760,5120,6400,ck,0,0,1567.4199,a8w8_blockscale_1x128x128_256x128x128x128_16x16_32x32_2x2_8x32x1_8x32x1_1x32x1x8_8_1x1_intrawave_v3,909.82,251.91,0.0
gfx942,304,21888,5120,2048,ck,0,0,570.6215,a8w8_blockscale_1x128x128_256x128x128x128_16x16_32x32_2x2_8x32x1_8x32x1_1x32x1x8_8_1x1_intrawave_v3,804.43,489.72,0.0
gfx942,304,21888,5120,6400,ck,0,0,1572.5894,a8w8_blockscale_1x128x128_256x128x128x128_16x16_32x32_2x2_8x32x1_8x32x1_1x32x1x8_8_1x1_intrawave_v3,912.16,252.44,0.0
gfx942,304,22016,5120,2048,ck,0,0,569.8339,a8w8_blockscale_1x128x128_256x128x128x128_16x16_32x32_2x2_8x32x1_8x32x1_1x32x1x8_8_1x1_intrawave_v3,810.25,493.16,0.0
gfx942,304,22016,5120,6400,ck,0,0,1590.0514,a8w8_blockscale_1x128x128_256x128x128x128_16x16_32x32_2x2_8x32x1_8x32x1_1x32x1x8_8_1x1_intrawave_v3,907.42,251.01,0.0
gfx942,304,22144,5120,2048,ck,0,0,578.1303,a8w8_blockscale_1x128x128_256x128x128x128_16x16_32x32_2x2_8x32x1_8x32x1_1x32x1x8_8_1x1_intrawave_v3,803.27,488.8,0.0
gfx942,304,22144,5120,6400,ck,0,0,1577.4284,a8w8_blockscale_1x128x128_256x128x128x128_16x16_32x32_2x2_8x32x1_8x32x1_1x32x1x8_8_1x1_intrawave_v3,920.0,254.37,0.0
gfx942,304,22272,5120,2048,ck,0,0,577.482,a8w8_blockscale_1x128x128_256x128x128x128_16x16_32x32_2x2_8x32x1_8x32x1_1x32x1x8_8_1x1_intrawave_v3,808.82,492.07,0.0
gfx942,304,22272,5120,6400,ck,0,0,1614.155,a8w8_blockscale_1x128x128_256x128x128x128_16x16_32x32_2x2_8x32x1_8x32x1_1x32x1x8_8_1x1_intrawave_v3,904.26,249.9,0.0
gfx942,304,22400,5120,2048,ck,0,0,583.9604,a8w8_blockscale_1x128x128_256x128x128x128_16x16_32x32_2x2_8x32x1_8x32x1_1x32x1x8_8_1x1_intrawave_v3,804.44,489.31,0.0
gfx942,304,22400,5120,6400,ck,0,0,1595.0809,a8w8_blockscale_1x128x128_256x128x128x128_16x16_32x32_2x2_8x32x1_8x32x1_1x32x1x8_8_1x1_intrawave_v3,920.33,254.22,0.0
gfx942,304,22528,5120,2048,ck,0,0,590.9292,a8w8_blockscale_1x128x128_256x128x128x128_16x16_32x32_2x2_8x32x1_8x32x1_1x32x1x8_8_1x1_intrawave_v3,799.5,486.2,0.0
gfx942,304,22528,5120,6400,ck,0,0,1626.3713,a8w8_blockscale_1x128x128_256x128x128x128_16x16_32x32_2x2_8x32x1_8x32x1_1x32x1x8_8_1x1_intrawave_v3,907.78,250.64,0.0
gfx942,304,22656,5120,2048,ck,0,0,602.1305,a8w8_blockscale_1x128x128_256x128x128x128_16x16_32x32_2x2_8x32x1_8x32x1_1x32x1x8_8_1x1_intrawave_v3,789.08,479.77,0.0
gfx942,304,22656,5120,6400,ck,0,0,1650.1881,a8w8_blockscale_1x128x128_256x128x128x128_16x16_32x32_2x2_8x32x1_8x32x1_1x32x1x8_8_1x1_intrawave_v3,899.77,248.31,0.0
gfx942,304,22784,5120,2048,ck,0,0,604.8687,a8w8_blockscale_1x128x128_256x128x128x128_16x16_32x32_2x2_8x32x1_8x32x1_1x32x1x8_8_1x1_intrawave_v3,789.95,480.2,0.0
gfx942,304,22784,5120,6400,ck,0,0,1626.2382,a8w8_blockscale_1x128x128_256x128x128x128_16x16_32x32_2x2_8x32x1_8x32x1_1x32x1x8_8_1x1_intrawave_v3,918.18,253.28,0.0
gfx942,304,22912,5120,2048,ck,0,0,588.2698,a8w8_blockscale_1x128x128_256x128x128x128_16x16_32x32_2x2_8x32x1_8x32x1_1x32x1x8_8_1x1_intrawave_v3,816.8,496.42,0.0
gfx942,304,22912,5120,6400,ck,0,0,1660.3706,a8w8_blockscale_1x128x128_256x128x128x128_16x16_32x32_2x2_8x32x1_8x32x1_1x32x1x8_8_1x1_intrawave_v3,904.35,249.36,0.0
gfx942,304,23040,5120,2048,ck,0,0,599.1525,a8w8_blockscale_1x128x128_256x128x128x128_16x16_32x32_2x2_8x32x1_8x32x1_1x32x1x8_8_1x1_intrawave_v3,806.45,490.03,0.0
gfx942,304,23040,5120,6400,ck,0,0,1664.4582,a8w8_blockscale_1x128x128_256x128x128x128_16x16_32x32_2x2_8x32x1_8x32x1_1x32x1x8_8_1x1_intrawave_v3,907.17,250.02,0.0
gfx942,304,23168,5120,2048,ck,0,0,611.6057,a8w8_blockscale_1x128x128_256x128x128x128_16x16_32x32_2x2_8x32x1_8x32x1_1x32x1x8_8_1x1_intrawave_v3,794.41,482.62,0.0
gfx942,304,23168,5120,6400,ck,0,0,1646.8921,a8w8_blockscale_1x128x128_256x128x128x128_16x16_32x32_2x2_8x32x1_8x32x1_1x32x1x8_8_1x1_intrawave_v3,921.94,253.98,0.0
gfx942,304,23296,5120,2048,ck,0,0,607.908,a8w8_blockscale_1x128x128_256x128x128x128_16x16_32x32_2x2_8x32x1_8x32x1_1x32x1x8_8_1x1_intrawave_v3,803.66,488.14,0.0
gfx942,304,23296,5120,6400,ck,0,0,1667.6827,a8w8_blockscale_1x128x128_256x128x128x128_16x16_32x32_2x2_8x32x1_8x32x1_1x32x1x8_8_1x1_intrawave_v3,915.48,252.09,0.0
gfx942,304,23424,5120,2048,ck,0,0,609.5714,a8w8_blockscale_1x128x128_256x128x128x128_16x16_32x32_2x2_8x32x1_8x32x1_1x32x1x8_8_1x1_intrawave_v3,805.87,489.39,0.0
gfx942,304,23424,5120,6400,ck,0,0,1676.0001,a8w8_blockscale_1x128x128_256x128x128x128_16x16_32x32_2x2_8x32x1_8x32x1_1x32x1x8_8_1x1_intrawave_v3,915.94,252.11,0.0
gfx942,304,23552,5120,2048,ck,0,0,617.606,a8w8_blockscale_1x128x128_256x128x128x128_16x16_32x32_2x2_8x32x1_8x32x1_1x32x1x8_8_1x1_intrawave_v3,799.74,485.57,0.0
gfx942,304,23552,5120,6400,ck,0,0,1701.6919,a8w8_blockscale_1x128x128_256x128x128x128_16x16_32x32_2x2_8x32x1_8x32x1_1x32x1x8_8_1x1_intrawave_v3,907.04,249.56,0.0
gfx942,304,23680,5120,2048,ck,0,0,629.6674,a8w8_blockscale_1x128x128_256x128x128x128_16x16_32x32_2x2_8x32x1_8x32x1_1x32x1x8_8_1x1_intrawave_v3,788.68,478.77,0.0
gfx942,304,23680,5120,6400,ck,0,0,1740.0703,a8w8_blockscale_1x128x128_256x128x128x128_16x16_32x32_2x2_8x32x1_8x32x1_1x32x1x8_8_1x1_intrawave_v3,891.86,245.28,0.0
gfx942,304,23808,5120,2048,ck,0,0,622.7158,a8w8_blockscale_1x128x128_256x128x128x128_16x16_32x32_2x2_8x32x1_8x32x1_1x32x1x8_8_1x1_intrawave_v3,801.79,486.64,0.0
gfx942,304,23808,5120,6400,ck,0,0,1760.211,a8w8_blockscale_1x128x128_256x128x128x128_16x16_32x32_2x2_8x32x1_8x32x1_1x32x1x8_8_1x1_intrawave_v3,886.42,243.68,0.0
gfx942,304,23936,5120,2048,ck,0,0,620.4857,a8w8_blockscale_1x128x128_256x128x128x128_16x16_32x32_2x2_8x32x1_8x32x1_1x32x1x8_8_1x1_intrawave_v3,809.0,490.92,0.0
gfx942,304,23936,5120,6400,ck,0,0,1735.7484,a8w8_blockscale_1x128x128_256x128x128x128_16x16_32x32_2x2_8x32x1_8x32x1_1x32x1x8_8_1x1_intrawave_v3,903.74,248.34,0.0
gfx942,304,24064,5120,2048,ck,0,0,633.726,a8w8_blockscale_1x128x128_256x128x128x128_16x16_32x32_2x2_8x32x1_8x32x1_1x32x1x8_8_1x1_intrawave_v3,796.34,483.15,0.0
gfx942,304,24064,5120,6400,ck,0,0,1722.798,a8w8_blockscale_1x128x128_256x128x128x128_16x16_32x32_2x2_8x32x1_8x32x1_1x32x1x8_8_1x1_intrawave_v3,915.41,251.45,0.0
gfx942,304,24192,5120,2048,ck,0,0,632.8803,a8w8_blockscale_1x128x128_256x128x128x128_16x16_32x32_2x2_8x32x1_8x32x1_1x32x1x8_8_1x1_intrawave_v3,801.64,486.28,0.0
gfx942,304,24192,5120,6400,ck,0,0,1743.0089,a8w8_blockscale_1x128x128_256x128x128x128_16x16_32x32_2x2_8x32x1_8x32x1_1x32x1x8_8_1x1_intrawave_v3,909.6,249.75,0.0
gfx942,304,24320,5120,2048,ck,0,0,633.4923,a8w8_blockscale_1x128x128_256x128x128x128_16x16_32x32_2x2_8x32x1_8x32x1_1x32x1x8_8_1x1_intrawave_v3,805.1,488.29,0.0
gfx942,304,24320,5120,6400,ck,0,0,1723.2121,a8w8_blockscale_1x128x128_256x128x128x128_16x16_32x32_2x2_8x32x1_8x32x1_1x32x1x8_8_1x1_intrawave_v3,924.92,253.86,0.0
gfx942,304,24448,5120,2048,ck,0,0,640.6913,a8w8_blockscale_1x128x128_256x128x128x128_16x16_32x32_2x2_8x32x1_8x32x1_1x32x1x8_8_1x1_intrawave_v3,800.25,485.26,0.0
gfx942,304,24448,5120,6400,ck,0,0,1776.8522,a8w8_blockscale_1x128x128_256x128x128x128_16x16_32x32_2x2_8x32x1_8x32x1_1x32x1x8_8_1x1_intrawave_v3,901.72,247.39,0.0
gfx942,304,24576,5120,2048,ck,0,0,643.4761,a8w8_blockscale_1x128x128_256x128x128x128_16x16_32x32_2x2_8x32x1_8x32x1_1x32x1x8_8_1x1_intrawave_v3,800.96,485.61,0.0
gfx942,304,24576,5120,6400,ck,0,0,1792.4074,a8w8_blockscale_1x128x128_256x128x128x128_16x16_32x32_2x2_8x32x1_8x32x1_1x32x1x8_8_1x1_intrawave_v3,898.58,246.44,0.0
gfx942,304,24704,5120,2048,ck,0,0,645.1719,a8w8_blockscale_1x128x128_256x128x128x128_16x16_32x32_2x2_8x32x1_8x32x1_1x32x1x8_8_1x1_intrawave_v3,803.01,486.77,0.0
gfx942,304,24704,5120,6400,ck,0,0,1781.3231,a8w8_blockscale_1x128x128_256x128x128x128_16x16_32x32_2x2_8x32x1_8x32x1_1x32x1x8_8_1x1_intrawave_v3,908.88,249.16,0.0
gfx942,304,24832,5120,2048,ck,0,0,653.4951,a8w8_blockscale_1x128x128_256x128x128x128_16x16_32x32_2x2_8x32x1_8x32x1_1x32x1x8_8_1x1_intrawave_v3,796.89,482.97,0.0
gfx942,304,24832,5120,6400,ck,0,0,1802.9553,a8w8_blockscale_1x128x128_256x128x128x128_16x16_32x32_2x2_8x32x1_8x32x1_1x32x1x8_8_1x1_intrawave_v3,902.62,247.36,0.0
gfx942,304,24960,5120,2048,ck,0,0,664.2951,a8w8_blockscale_1x128x128_256x128x128x128_16x16_32x32_2x2_8x32x1_8x32x1_1x32x1x8_8_1x1_intrawave_v3,787.98,477.49,0.0
gfx942,304,24960,5120,6400,ck,0,0,1802.3584,a8w8_blockscale_1x128x128_256x128x128x128_16x16_32x32_2x2_8x32x1_8x32x1_1x32x1x8_8_1x1_intrawave_v3,907.58,248.62,0.0
gfx942,304,25088,5120,2048,ck,0,0,651.8815,a8w8_blockscale_1x128x128_256x128x128x128_16x16_32x32_2x2_8x32x1_8x32x1_1x32x1x8_8_1x1_intrawave_v3,807.1,489.0,0.0
gfx942,304,25088,5120,6400,ck,0,0,1807.3027,a8w8_blockscale_1x128x128_256x128x128x128_16x16_32x32_2x2_8x32x1_8x32x1_1x32x1x8_8_1x1_intrawave_v3,909.74,249.12,0.0
gfx942,304,25216,5120,2048,ck,0,0,661.62,a8w8_blockscale_1x128x128_256x128x128x128_16x16_32x32_2x2_8x32x1_8x32x1_1x32x1x8_8_1x1_intrawave_v3,799.28,484.18,0.0
gfx942,304,25216,5120,6400,ck,0,0,1799.9601,a8w8_blockscale_1x128x128_256x128x128x128_16x16_32x32_2x2_8x32x1_8x32x1_1x32x1x8_8_1x1_intrawave_v3,918.11,251.32,0.0
gfx942,304,25344,5120,2048,ck,0,0,675.1091,a8w8_blockscale_1x128x128_256x128x128x128_16x16_32x32_2x2_8x32x1_8x32x1_1x32x1x8_8_1x1_intrawave_v3,787.28,476.83,0.0
gfx942,304,25344,5120,6400,ck,0,0,1860.6314,a8w8_blockscale_1x128x128_256x128x128x128_16x16_32x32_2x2_8x32x1_8x32x1_1x32x1x8_8_1x1_intrawave_v3,892.68,244.27,0.0
gfx942,304,25472,5120,2048,ck,0,0,678.5502,a8w8_blockscale_1x128x128_256x128x128x128_16x16_32x32_2x2_8x32x1_8x32x1_1x32x1x8_8_1x1_intrawave_v3,787.25,476.73,0.0
gfx942,304,25472,5120,6400,ck,0,0,1820.6169,a8w8_blockscale_1x128x128_256x128x128x128_16x16_32x32_2x2_8x32x1_8x32x1_1x32x1x8_8_1x1_intrawave_v3,916.91,250.81,0.0
gfx942,304,25600,5120,2048,ck,0,0,689.9508,a8w8_blockscale_1x128x128_256x128x128x128_16x16_32x32_2x2_8x32x1_8x32x1_1x32x1x8_8_1x1_intrawave_v3,778.13,471.13,0.0
gfx942,304,25600,5120,6400,ck,0,0,1834.5043,a8w8_blockscale_1x128x128_256x128x128x128_16x16_32x32_2x2_8x32x1_8x32x1_1x32x1x8_8_1x1_intrawave_v3,914.54,250.07,0.0
gfx942,304,25728,5120,2048,ck,0,0,681.361,a8w8_blockscale_1x128x128_256x128x128x128_16x16_32x32_2x2_8x32x1_8x32x1_1x32x1x8_8_1x1_intrawave_v3,791.88,479.38,0.0
gfx942,304,25728,5120,6400,ck,0,0,1842.4231,a8w8_blockscale_1x128x128_256x128x128x128_16x16_32x32_2x2_8x32x1_8x32x1_1x32x1x8_8_1x1_intrawave_v3,915.16,250.15,0.0
gfx942,304,25856,5120,2048,ck,0,0,666.0279,a8w8_blockscale_1x128x128_256x128x128x128_16x16_32x32_2x2_8x32x1_8x32x1_1x32x1x8_8_1x1_intrawave_v3,814.14,492.78,0.0
gfx942,304,25856,5120,6400,ck,0,0,1862.315,a8w8_blockscale_1x128x128_256x128x128x128_16x16_32x32_2x2_8x32x1_8x32x1_1x32x1x8_8_1x1_intrawave_v3,909.89,248.62,0.0
gfx942,304,25984,5120,2048,ck,0,0,690.6813,a8w8_blockscale_1x128x128_256x128x128x128_16x16_32x32_2x2_8x32x1_8x32x1_1x32x1x8_8_1x1_intrawave_v3,788.97,477.47,0.0
gfx942,304,25984,5120,6400,ck,0,0,1887.6299,a8w8_blockscale_1x128x128_256x128x128x128_16x16_32x32_2x2_8x32x1_8x32x1_1x32x1x8_8_1x1_intrawave_v3,902.13,246.42,0.0
gfx942,304,26112,5120,2048,ck,0,0,676.3581,a8w8_blockscale_1x128x128_256x128x128x128_16x16_32x32_2x2_8x32x1_8x32x1_1x32x1x8_8_1x1_intrawave_v3,809.64,489.9,0.0
gfx942,304,26112,5120,6400,ck,0,0,1931.1604,a8w8_blockscale_1x128x128_256x128x128x128_16x16_32x32_2x2_8x32x1_8x32x1_1x32x1x8_8_1x1_intrawave_v3,886.14,241.96,0.0
gfx942,304,26240,5120,2048,ck,0,0,679.2807,a8w8_blockscale_1x128x128_256x128x128x128_16x16_32x32_2x2_8x32x1_8x32x1_1x32x1x8_8_1x1_intrawave_v3,810.11,490.11,0.0
gfx942,304,26240,5120,6400,ck,0,0,1883.6891,a8w8_blockscale_1x128x128_256x128x128x128_16x16_32x32_2x2_8x32x1_8x32x1_1x32x1x8_8_1x1_intrawave_v3,912.92,249.19,0.0
gfx942,304,26368,5120,2048,ck,0,0,696.8087,a8w8_blockscale_1x128x128_256x128x128x128_16x16_32x32_2x2_8x32x1_8x32x1_1x32x1x8_8_1x1_intrawave_v3,793.59,480.04,0.0
gfx942,304,26368,5120,6400,ck,0,0,1891.4389,a8w8_blockscale_1x128x128_256x128x128x128_16x16_32x32_2x2_8x32x1_8x32x1_1x32x1x8_8_1x1_intrawave_v3,913.62,249.3,0.0
gfx942,304,26496,5120,2048,ck,0,0,689.5414,a8w8_blockscale_1x128x128_256x128x128x128_16x16_32x32_2x2_8x32x1_8x32x1_1x32x1x8_8_1x1_intrawave_v3,805.84,487.38,0.0
gfx942,304,26496,5120,6400,ck,0,0,1933.5587,a8w8_blockscale_1x128x128_256x128x128x128_16x16_32x32_2x2_8x32x1_8x32x1_1x32x1x8_8_1x1_intrawave_v3,898.05,244.97,0.0
gfx942,304,26624,5120,2048,ck,0,0,698.0954,a8w8_blockscale_1x128x128_256x128x128x128_16x16_32x32_2x2_8x32x1_8x32x1_1x32x1x8_8_1x1_intrawave_v3,799.81,483.66,0.0
gfx942,304,26624,5120,6400,ck,0,0,1921.6959,a8w8_blockscale_1x128x128_256x128x128x128_16x16_32x32_2x2_8x32x1_8x32x1_1x32x1x8_8_1x1_intrawave_v3,907.96,247.59,0.0
gfx942,304,26752,5120,2048,ck,0,0,701.6936,a8w8_blockscale_1x128x128_256x128x128x128_16x16_32x32_2x2_8x32x1_8x32x1_1x32x1x8_8_1x1_intrawave_v3,799.54,483.42,0.0
gfx942,304,26752,5120,6400,ck,0,0,1951.3308,a8w8_blockscale_1x128x128_256x128x128x128_16x16_32x32_2x2_8x32x1_8x32x1_1x32x1x8_8_1x1_intrawave_v3,898.47,244.92,0.0
gfx942,304,26880,5120,2048,ck,0,0,699.6756,a8w8_blockscale_1x128x128_256x128x128x128_16x16_32x32_2x2_8x32x1_8x32x1_1x32x1x8_8_1x1_intrawave_v3,805.68,487.06,0.0
gfx942,304,26880,5120,6400,ck,0,0,1940.396,a8w8_blockscale_1x128x128_256x128x128x128_16x16_32x32_2x2_8x32x1_8x32x1_1x32x1x8_8_1x1_intrawave_v3,907.86,247.4,0.0
gfx942,304,27008,5120,2048,ck,0,0,701.5427,a8w8_blockscale_1x128x128_256x128x128x128_16x16_32x32_2x2_8x32x1_8x32x1_1x32x1x8_8_1x1_intrawave_v3,807.36,488.01,0.0
gfx942,304,27008,5120,6400,ck,0,0,1953.956,a8w8_blockscale_1x128x128_256x128x128x128_16x16_32x32_2x2_8x32x1_8x32x1_1x32x1x8_8_1x1_intrawave_v3,905.85,246.77,0.0
gfx942,304,27136,5120,2048,ck,0,0,702.3384,a8w8_blockscale_1x128x128_256x128x128x128_16x16_32x32_2x2_8x32x1_8x32x1_1x32x1x8_8_1x1_intrawave_v3,810.27,489.7,0.0
gfx942,304,27136,5120,6400,ck,0,0,1967.8568,a8w8_blockscale_1x128x128_256x128x128x128_16x16_32x32_2x2_8x32x1_8x32x1_1x32x1x8_8_1x1_intrawave_v3,903.72,246.11,0.0
gfx942,304,27264,5120,2048,ck,0,0,725.5728,a8w8_blockscale_1x128x128_256x128x128x128_16x16_32x32_2x2_8x32x1_8x32x1_1x32x1x8_8_1x1_intrawave_v3,788.02,476.18,0.0
gfx942,304,27264,5120,6400,ck,0,0,2018.8291,a8w8_blockscale_1x128x128_256x128x128x128_16x16_32x32_2x2_8x32x1_8x32x1_1x32x1x8_8_1x1_intrawave_v3,885.05,240.95,0.0
gfx942,304,27392,5120,2048,ck,0,0,717.4687,a8w8_blockscale_1x128x128_256x128x128x128_16x16_32x32_2x2_8x32x1_8x32x1_1x32x1x8_8_1x1_intrawave_v3,800.66,483.75,0.0
gfx942,304,27392,5120,6400,ck,0,0,1996.9443,a8w8_blockscale_1x128x128_256x128x128x128_16x16_32x32_2x2_8x32x1_8x32x1_1x32x1x8_8_1x1_intrawave_v3,898.95,244.66,0.0
gfx942,304,27520,5120,2048,ck,0,0,720.5417,a8w8_blockscale_1x128x128_256x128x128x128_16x16_32x32_2x2_8x32x1_8x32x1_1x32x1x8_8_1x1_intrawave_v3,800.98,483.87,0.0
gfx942,304,27520,5120,6400,ck,0,0,1966.5365,a8w8_blockscale_1x128x128_256x128x128x128_16x16_32x32_2x2_8x32x1_8x32x1_1x32x1x8_8_1x1_intrawave_v3,917.12,249.53,0.0
gfx942,304,27648,5120,2048,ck,0,0,720.1569,a8w8_blockscale_1x128x128_256x128x128x128_16x16_32x32_2x2_8x32x1_8x32x1_1x32x1x8_8_1x1_intrawave_v3,805.13,486.32,0.0
gfx942,304,27648,5120,6400,ck,0,0,1975.7482,a8w8_blockscale_1x128x128_256x128x128x128_16x16_32x32_2x2_8x32x1_8x32x1_1x32x1x8_8_1x1_intrawave_v3,917.09,249.44,0.0
gfx942,304,27776,5120,2048,ck,0,0,722.2226,a8w8_blockscale_1x128x128_256x128x128x128_16x16_32x32_2x2_8x32x1_8x32x1_1x32x1x8_8_1x1_intrawave_v3,806.54,487.1,0.0
gfx942,304,27776,5120,6400,ck,0,0,1994.2669,a8w8_blockscale_1x128x128_256x128x128x128_16x16_32x32_2x2_8x32x1_8x32x1_1x32x1x8_8_1x1_intrawave_v3,912.78,248.19,0.0
gfx942,304,27904,5120,2048,ck,0,0,727.631,a8w8_blockscale_1x128x128_256x128x128x128_16x16_32x32_2x2_8x32x1_8x32x1_1x32x1x8_8_1x1_intrawave_v3,804.24,485.64,0.0
gfx942,304,27904,5120,6400,ck,0,0,2022.4859,a8w8_blockscale_1x128x128_256x128x128x128_16x16_32x32_2x2_8x32x1_8x32x1_1x32x1x8_8_1x1_intrawave_v3,904.19,245.78,0.0
gfx942,304,28032,5120,2048,ck,0,0,732.0902,a8w8_blockscale_1x128x128_256x128x128x128_16x16_32x32_2x2_8x32x1_8x32x1_1x32x1x8_8_1x1_intrawave_v3,803.01,484.84,0.0
gfx942,304,28032,5120,6400,ck,0,0,2008.1144,a8w8_blockscale_1x128x128_256x128x128x128_16x16_32x32_2x2_8x32x1_8x32x1_1x32x1x8_8_1x1_intrawave_v3,914.84,248.6,0.0
gfx942,304,28160,5120,2048,ck,0,0,731.6167,a8w8_blockscale_1x128x128_256x128x128x128_16x16_32x32_2x2_8x32x1_8x32x1_1x32x1x8_8_1x1_intrawave_v3,807.2,487.3,0.0
gfx942,304,28160,5120,6400,ck,0,0,2036.2473,a8w8_blockscale_1x128x128_256x128x128x128_16x16_32x32_2x2_8x32x1_8x32x1_1x32x1x8_8_1x1_intrawave_v3,906.32,246.21,0.0
gfx942,304,28288,5120,2048,ck,0,0,739.0017,a8w8_blockscale_1x128x128_256x128x128x128_16x16_32x32_2x2_8x32x1_8x32x1_1x32x1x8_8_1x1_intrawave_v3,802.76,484.56,0.0
gfx942,304,28288,5120,6400,ck,0,0,2048.2891,a8w8_blockscale_1x128x128_256x128x128x128_16x16_32x32_2x2_8x32x1_8x32x1_1x32x1x8_8_1x1_intrawave_v3,905.09,245.81,0.0
gfx942,304,28416,5120,2048,ck,0,0,738.3686,a8w8_blockscale_1x128x128_256x128x128x128_16x16_32x32_2x2_8x32x1_8x32x1_1x32x1x8_8_1x1_intrawave_v3,807.09,487.1,0.0
gfx942,304,28416,5120,6400,ck,0,0,2065.3659,a8w8_blockscale_1x128x128_256x128x128x128_16x16_32x32_2x2_8x32x1_8x32x1_1x32x1x8_8_1x1_intrawave_v3,901.67,244.8,0.0
gfx942,304,28544,5120,2048,ck,0,0,738.6046,a8w8_blockscale_1x128x128_256x128x128x128_16x16_32x32_2x2_8x32x1_8x32x1_1x32x1x8_8_1x1_intrawave_v3,810.46,489.08,0.0
gfx942,304,28544,5120,6400,ck,0,0,2060.3007,a8w8_blockscale_1x128x128_256x128x128x128_16x16_32x32_2x2_8x32x1_8x32x1_1x32x1x8_8_1x1_intrawave_v3,907.95,246.44,0.0
gfx942,304,28672,5120,2048,ck,0,0,744.2734,a8w8_blockscale_1x128x128_256x128x128x128_16x16_32x32_2x2_8x32x1_8x32x1_1x32x1x8_8_1x1_intrawave_v3,807.9,487.47,0.0
gfx942,304,28672,5120,6400,ck,0,0,2083.8591,a8w8_blockscale_1x128x128_256x128x128x128_16x16_32x32_2x2_8x32x1_8x32x1_1x32x1x8_8_1x1_intrawave_v3,901.72,244.68,0.0
gfx942,304,28800,5120,2048,ck,0,0,750.0118,a8w8_blockscale_1x128x128_256x128x128x128_16x16_32x32_2x2_8x32x1_8x32x1_1x32x1x8_8_1x1_intrawave_v3,805.29,485.83,0.0
gfx942,304,28800,5120,6400,ck,0,0,2096.5898,a8w8_blockscale_1x128x128_256x128x128x128_16x16_32x32_2x2_8x32x1_8x32x1_1x32x1x8_8_1x1_intrawave_v3,900.24,244.21,0.0
gfx942,304,28928,5120,2048,ck,0,0,750.4607,a8w8_blockscale_1x128x128_256x128x128x128_16x16_32x32_2x2_8x32x1_8x32x1_1x32x1x8_8_1x1_intrawave_v3,808.39,487.64,0.0
gfx942,304,28928,5120,6400,ck,0,0,2096.2864,a8w8_blockscale_1x128x128_256x128x128x128_16x16_32x32_2x2_8x32x1_8x32x1_1x32x1x8_8_1x1_intrawave_v3,904.37,245.26,0.0
gfx942,304,29056,5120,2048,ck,0,0,751.4083,a8w8_blockscale_1x128x128_256x128x128x128_16x16_32x32_2x2_8x32x1_8x32x1_1x32x1x8_8_1x1_intrawave_v3,810.94,489.12,0.0
gfx942,304,29056,5120,6400,ck,0,0,2070.7874,a8w8_blockscale_1x128x128_256x128x128x128_16x16_32x32_2x2_8x32x1_8x32x1_1x32x1x8_8_1x1_intrawave_v3,919.56,249.31,0.0
gfx942,304,29184,5120,2048,ck,0,0,755.2317,a8w8_blockscale_1x128x128_256x128x128x128_16x16_32x32_2x2_8x32x1_8x32x1_1x32x1x8_8_1x1_intrawave_v3,810.39,488.72,0.0
gfx942,304,29184,5120,6400,ck,0,0,2077.4632,a8w8_blockscale_1x128x128_256x128x128x128_16x16_32x32_2x2_8x32x1_8x32x1_1x32x1x8_8_1x1_intrawave_v3,920.64,249.53,0.0
gfx942,304,29312,5120,2048,ck,0,0,764.6225,a8w8_blockscale_1x128x128_256x128x128x128_16x16_32x32_2x2_8x32x1_8x32x1_1x32x1x8_8_1x1_intrawave_v3,803.95,484.78,0.0
gfx942,304,29312,5120,6400,ck,0,0,2128.2537,a8w8_blockscale_1x128x128_256x128x128x128_16x16_32x32_2x2_8x32x1_8x32x1_1x32x1x8_8_1x1_intrawave_v3,902.61,244.58,0.0
gfx942,304,29440,5120,2048,ck,0,0,789.1882,a8w8_blockscale_1x128x128_256x128x128x128_16x16_32x32_2x2_8x32x1_8x32x1_1x32x1x8_8_1x1_intrawave_v3,782.32,471.68,0.0
gfx942,304,29440,5120,6400,ck,0,0,2132.6619,a8w8_blockscale_1x128x128_256x128x128x128_16x16_32x32_2x2_8x32x1_8x32x1_1x32x1x8_8_1x1_intrawave_v3,904.68,245.07,0.0
gfx942,304,29568,5120,2048,ck,0,0,764.4343,a8w8_blockscale_1x128x128_256x128x128x128_16x16_32x32_2x2_8x32x1_8x32x1_1x32x1x8_8_1x1_intrawave_v3,811.17,489.01,0.0
gfx942,304,29568,5120,6400,ck,0,0,2131.088,a8w8_blockscale_1x128x128_256x128x128x128_16x16_32x32_2x2_8x32x1_8x32x1_1x32x1x8_8_1x1_intrawave_v3,909.29,246.25,0.0
gfx942,304,29696,5120,2048,ck,0,0,778.3818,a8w8_blockscale_1x128x128_256x128x128x128_16x16_32x32_2x2_8x32x1_8x32x1_1x32x1x8_8_1x1_intrawave_v3,800.08,482.27,0.0
gfx942,304,29696,5120,6400,ck,0,0,2197.5665,a8w8_blockscale_1x128x128_256x128x128x128_16x16_32x32_2x2_8x32x1_8x32x1_1x32x1x8_8_1x1_intrawave_v3,885.6,239.77,0.0
gfx942,304,29824,5120,2048,ck,0,0,782.8868,a8w8_blockscale_1x128x128_256x128x128x128_16x16_32x32_2x2_8x32x1_8x32x1_1x32x1x8_8_1x1_intrawave_v3,798.91,481.5,0.0
gfx942,304,29824,5120,6400,ck,0,0,2154.1732,a8w8_blockscale_1x128x128_256x128x128x128_16x16_32x32_2x2_8x32x1_8x32x1_1x32x1x8_8_1x1_intrawave_v3,907.33,245.59,0.0
gfx942,304,29952,5120,2048,ck,0,0,776.7487,a8w8_blockscale_1x128x128_256x128x128x128_16x16_32x32_2x2_8x32x1_8x32x1_1x32x1x8_8_1x1_intrawave_v3,808.68,487.33,0.0
gfx942,304,29952,5120,6400,ck,0,0,2160.5277,a8w8_blockscale_1x128x128_256x128x128x128_16x16_32x32_2x2_8x32x1_8x32x1_1x32x1x8_8_1x1_intrawave_v3,908.54,245.85,0.0
gfx942,304,30080,5120,2048,ck,0,0,798.7914,a8w8_blockscale_1x128x128_256x128x128x128_16x16_32x32_2x2_8x32x1_8x32x1_1x32x1x8_8_1x1_intrawave_v3,789.72,475.85,0.0
gfx942,304,30080,5120,6400,ck,0,0,2174.8065,a8w8_blockscale_1x128x128_256x128x128x128_16x16_32x32_2x2_8x32x1_8x32x1_1x32x1x8_8_1x1_intrawave_v3,906.44,245.22,0.0
gfx942,304,30208,5120,2048,ck,0,0,786.7974,a8w8_blockscale_1x128x128_256x128x128x128_16x16_32x32_2x2_8x32x1_8x32x1_1x32x1x8_8_1x1_intrawave_v3,805.17,485.11,0.0
gfx942,304,30208,5120,6400,ck,0,0,2187.3795,a8w8_blockscale_1x128x128_256x128x128x128_16x16_32x32_2x2_8x32x1_8x32x1_1x32x1x8_8_1x1_intrawave_v3,905.06,244.78,0.0
gfx942,304,30336,5120,2048,ck,0,0,795.4402,a8w8_blockscale_1x128x128_256x128x128x128_16x16_32x32_2x2_8x32x1_8x32x1_1x32x1x8_8_1x1_intrawave_v3,799.8,481.81,0.0
gfx942,304,30336,5120,6400,ck,0,0,2218.2846,a8w8_blockscale_1x128x128_256x128x128x128_16x16_32x32_2x2_8x32x1_8x32x1_1x32x1x8_8_1x1_intrawave_v3,896.23,242.33,0.0
gfx942,304,30464,5120,2048,ck,0,0,812.2158,a8w8_blockscale_1x128x128_256x128x128x128_16x16_32x32_2x2_8x32x1_8x32x1_1x32x1x8_8_1x1_intrawave_v3,786.58,473.8,0.0
gfx942,304,30464,5120,6400,ck,0,0,2185.3782,a8w8_blockscale_1x128x128_256x128x128x128_16x16_32x32_2x2_8x32x1_8x32x1_1x32x1x8_8_1x1_intrawave_v3,913.57,246.95,0.0
gfx942,304,30592,5120,2048,ck,0,0,802.1329,a8w8_blockscale_1x128x128_256x128x128x128_16x16_32x32_2x2_8x32x1_8x32x1_1x32x1x8_8_1x1_intrawave_v3,799.82,481.72,0.0
gfx942,304,30592,5120,6400,ck,0,0,2272.4404,a8w8_blockscale_1x128x128_256x128x128x128_16x16_32x32_2x2_8x32x1_8x32x1_1x32x1x8_8_1x1_intrawave_v3,882.26,238.43,0.0
gfx942,304,30720,5120,2048,ck,0,0,811.8441,a8w8_blockscale_1x128x128_256x128x128x128_16x16_32x32_2x2_8x32x1_8x32x1_1x32x1x8_8_1x1_intrawave_v3,793.56,477.89,0.0
gfx942,304,30720,5120,6400,ck,0,0,2184.8889,a8w8_blockscale_1x128x128_256x128x128x128_16x16_32x32_2x2_8x32x1_8x32x1_1x32x1x8_8_1x1_intrawave_v3,921.45,248.96,0.0
gfx942,304,30848,5120,2048,ck,0,0,804.341,a8w8_blockscale_1x128x128_256x128x128x128_16x16_32x32_2x2_8x32x1_8x32x1_1x32x1x8_8_1x1_intrawave_v3,804.3,484.3,0.0
gfx942,304,30848,5120,6400,ck,0,0,2251.9664,a8w8_blockscale_1x128x128_256x128x128x128_16x16_32x32_2x2_8x32x1_8x32x1_1x32x1x8_8_1x1_intrawave_v3,897.73,242.49,0.0
gfx942,304,30976,5120,2048,ck,0,0,802.0788,a8w8_blockscale_1x128x128_256x128x128x128_16x16_32x32_2x2_8x32x1_8x32x1_1x32x1x8_8_1x1_intrawave_v3,809.91,487.63,0.0
gfx942,304,30976,5120,6400,ck,0,0,2218.1167,a8w8_blockscale_1x128x128_256x128x128x128_16x16_32x32_2x2_8x32x1_8x32x1_1x32x1x8_8_1x1_intrawave_v3,915.21,247.15,0.0
gfx942,304,31104,5120,2048,ck,0,0,815.2207,a8w8_blockscale_1x128x128_256x128x128x128_16x16_32x32_2x2_8x32x1_8x32x1_1x32x1x8_8_1x1_intrawave_v3,800.15,481.7,0.0
gfx942,304,31104,5120,6400,ck,0,0,2256.6341,a8w8_blockscale_1x128x128_256x128x128x128_16x16_32x32_2x2_8x32x1_8x32x1_1x32x1x8_8_1x1_intrawave_v3,903.31,243.88,0.0
gfx942,304,31232,5120,2048,ck,0,0,810.9051,a8w8_blockscale_1x128x128_256x128x128x128_16x16_32x32_2x2_8x32x1_8x32x1_1x32x1x8_8_1x1_intrawave_v3,807.72,486.2,0.0
gfx942,304,31232,5120,6400,ck,0,0,2322.0196,a8w8_blockscale_1x128x128_256x128x128x128_16x16_32x32_2x2_8x32x1_8x32x1_1x32x1x8_8_1x1_intrawave_v3,881.48,237.93,0.0
gfx942,304,31360,5120,2048,ck,0,0,823.0271,a8w8_blockscale_1x128x128_256x128x128x128_16x16_32x32_2x2_8x32x1_8x32x1_1x32x1x8_8_1x1_intrawave_v3,799.08,480.95,0.0
gfx942,304,31360,5120,6400,ck,0,0,2282.7695,a8w8_blockscale_1x128x128_256x128x128x128_16x16_32x32_2x2_8x32x1_8x32x1_1x32x1x8_8_1x1_intrawave_v3,900.31,242.95,0.0
gfx942,304,31488,5120,2048,ck,0,0,825.1509,a8w8_blockscale_1x128x128_256x128x128x128_16x16_32x32_2x2_8x32x1_8x32x1_1x32x1x8_8_1x1_intrawave_v3,800.28,481.62,0.0
gfx942,304,31488,5120,6400,ck,0,0,2248.5399,a8w8_blockscale_1x128x128_256x128x128x128_16x16_32x32_2x2_8x32x1_8x32x1_1x32x1x8_8_1x1_intrawave_v3,917.75,247.6,0.0
gfx942,304,31616,5120,2048,ck,0,0,837.0007,a8w8_blockscale_1x128x128_256x128x128x128_16x16_32x32_2x2_8x32x1_8x32x1_1x32x1x8_8_1x1_intrawave_v3,792.16,476.68,0.0
gfx942,304,31616,5120,6400,ck,0,0,2254.0831,a8w8_blockscale_1x128x128_256x128x128x128_16x16_32x32_2x2_8x32x1_8x32x1_1x32x1x8_8_1x1_intrawave_v3,919.21,247.93,0.0
gfx942,304,31744,5120,2048,ck,0,0,837.5376,a8w8_blockscale_1x128x128_256x128x128x128_16x16_32x32_2x2_8x32x1_8x32x1_1x32x1x8_8_1x1_intrawave_v3,794.85,478.25,0.0
gfx942,304,31744,5120,6400,ck,0,0,2292.7243,a8w8_blockscale_1x128x128_256x128x128x128_16x16_32x32_2x2_8x32x1_8x32x1_1x32x1x8_8_1x1_intrawave_v3,907.38,244.68,0.0
gfx942,304,31872,5120,2048,ck,0,0,838.54,a8w8_blockscale_1x128x128_256x128x128x128_16x16_32x32_2x2_8x32x1_8x32x1_1x32x1x8_8_1x1_intrawave_v3,797.1,479.56,0.0
gfx942,304,31872,5120,6400,ck,0,0,2270.6731,a8w8_blockscale_1x128x128_256x128x128x128_16x16_32x32_2x2_8x32x1_8x32x1_1x32x1x8_8_1x1_intrawave_v3,919.89,248.0,0.0
gfx942,304,32000,5120,2048,ck,0,0,846.5651,a8w8_blockscale_1x128x128_256x128x128x128_16x16_32x32_2x2_8x32x1_8x32x1_1x32x1x8_8_1x1_intrawave_v3,792.72,476.87,0.0
gfx942,304,32000,5120,6400,ck,0,0,2318.6385,a8w8_blockscale_1x128x128_256x128x128x128_16x16_32x32_2x2_8x32x1_8x32x1_1x32x1x8_8_1x1_intrawave_v3,904.48,243.78,0.0
gfx942,304,32128,5120,2048,ck,0,0,840.8589,a8w8_blockscale_1x128x128_256x128x128x128_16x16_32x32_2x2_8x32x1_8x32x1_1x32x1x8_8_1x1_intrawave_v3,801.29,481.98,0.0
gfx942,304,32128,5120,6400,ck,0,0,2341.7813,a8w8_blockscale_1x128x128_256x128x128x128_16x16_32x32_2x2_8x32x1_8x32x1_1x32x1x8_8_1x1_intrawave_v3,899.12,242.28,0.0
gfx942,304,32256,5120,2048,ck,0,0,839.2065,a8w8_blockscale_1x128x128_256x128x128x128_16x16_32x32_2x2_8x32x1_8x32x1_1x32x1x8_8_1x1_intrawave_v3,806.07,484.8,0.0
gfx942,304,32256,5120,6400,ck,0,0,2392.0875,a8w8_blockscale_1x128x128_256x128x128x128_16x16_32x32_2x2_8x32x1_8x32x1_1x32x1x8_8_1x1_intrawave_v3,883.72,238.08,0.0
gfx942,304,32384,5120,2048,ck,0,0,839.8953,a8w8_blockscale_1x128x128_256x128x128x128_16x16_32x32_2x2_8x32x1_8x32x1_1x32x1x8_8_1x1_intrawave_v3,808.6,486.28,0.0
gfx942,304,32384,5120,6400,ck,0,0,2398.3262,a8w8_blockscale_1x128x128_256x128x128x128_16x16_32x32_2x2_8x32x1_8x32x1_1x32x1x8_8_1x1_intrawave_v3,884.92,238.35,0.0
gfx942,304,32512,5120,2048,ck,0,0,851.8024,a8w8_blockscale_1x128x128_256x128x128x128_16x16_32x32_2x2_8x32x1_8x32x1_1x32x1x8_8_1x1_intrawave_v3,800.45,481.32,0.0
gfx942,304,32512,5120,6400,ck,0,0,2323.5488,a8w8_blockscale_1x128x128_256x128x128x128_16x16_32x32_2x2_8x32x1_8x32x1_1x32x1x8_8_1x1_intrawave_v3,917.01,246.94,0.0
gfx942,304,32640,5120,2048,ck,0,0,864.2788,a8w8_blockscale_1x128x128_256x128x128x128_16x16_32x32_2x2_8x32x1_8x32x1_1x32x1x8_8_1x1_intrawave_v3,792.0,476.2,0.0
gfx942,304,32640,5120,6400,ck,0,0,2342.2067,a8w8_blockscale_1x128x128_256x128x128x128_16x16_32x32_2x2_8x32x1_8x32x1_1x32x1x8_8_1x1_intrawave_v3,913.28,245.88,0.0
gfx942,304,32768,5120,2048,ck,0,0,846.9765,a8w8_blockscale_1x128x128_256x128x128x128_16x16_32x32_2x2_8x32x1_8x32x1_1x32x1x8_8_1x1_intrawave_v3,811.35,487.78,0.0
gfx942,304,32768,5120,6400,ck,0,0,2418.1339,a8w8_blockscale_1x128x128_256x128x128x128_16x16_32x32_2x2_8x32x1_8x32x1_1x32x1x8_8_1x1_intrawave_v3,888.07,239.04,0.0
gfx942,304,32896,5120,2048,ck,0,0,860.871,a8w8_blockscale_1x128x128_256x128x128x128_16x16_32x32_2x2_8x32x1_8x32x1_1x32x1x8_8_1x1_intrawave_v3,801.37,481.74,0.0
gfx942,304,32896,5120,6400,ck,0,0,2382.0467,a8w8_blockscale_1x128x128_256x128x128x128_16x16_32x32_2x2_8x32x1_8x32x1_1x32x1x8_8_1x1_intrawave_v3,905.05,243.55,0.0
gfx942,304,33024,5120,2048,ck,0,0,860.7639,a8w8_blockscale_1x128x128_256x128x128x128_16x16_32x32_2x2_8x32x1_8x32x1_1x32x1x8_8_1x1_intrawave_v3,804.59,483.62,0.0
gfx942,304,33024,5120,6400,ck,0,0,2386.4943,a8w8_blockscale_1x128x128_256x128x128x128_16x16_32x32_2x2_8x32x1_8x32x1_1x32x1x8_8_1x1_intrawave_v3,906.88,243.99,0.0
gfx942,304,33152,5120,2048,ck,0,0,862.3622,a8w8_blockscale_1x128x128_256x128x128x128_16x16_32x32_2x2_8x32x1_8x32x1_1x32x1x8_8_1x1_intrawave_v3,806.21,484.55,0.0
gfx942,304,33152,5120,6400,ck,0,0,2389.0233,a8w8_blockscale_1x128x128_256x128x128x128_16x16_32x32_2x2_8x32x1_8x32x1_1x32x1x8_8_1x1_intrawave_v3,909.43,244.63,0.0
gfx942,304,33280,5120,2048,ck,0,0,889.6057,a8w8_blockscale_1x128x128_256x128x128x128_16x16_32x32_2x2_8x32x1_8x32x1_1x32x1x8_8_1x1_intrawave_v3,784.54,471.48,0.0
gfx942,304,33280,5120,6400,ck,0,0,2473.307,a8w8_blockscale_1x128x128_256x128x128x128_16x16_32x32_2x2_8x32x1_8x32x1_1x32x1x8_8_1x1_intrawave_v3,881.83,237.15,0.0
gfx942,304,33408,5120,2048,ck,0,0,869.5096,a8w8_blockscale_1x128x128_256x128x128x128_16x16_32x32_2x2_8x32x1_8x32x1_1x32x1x8_8_1x1_intrawave_v3,805.76,484.18,0.0
gfx942,304,33408,5120,6400,ck,0,0,2445.719,a8w8_blockscale_1x128x128_256x128x128x128_16x16_32x32_2x2_8x32x1_8x32x1_1x32x1x8_8_1x1_intrawave_v3,895.21,240.7,0.0
gfx942,304,33536,5120,2048,ck,0,0,865.774,a8w8_blockscale_1x128x128_256x128x128x128_16x16_32x32_2x2_8x32x1_8x32x1_1x32x1x8_8_1x1_intrawave_v3,812.34,488.09,0.0
gfx942,304,33536,5120,6400,ck,0,0,2439.4978,a8w8_blockscale_1x128x128_256x128x128x128_16x16_32x32_2x2_8x32x1_8x32x1_1x32x1x8_8_1x1_intrawave_v3,900.93,242.18,0.0
gfx942,304,33664,5120,2048,ck,0,0,881.0462,a8w8_blockscale_1x128x128_256x128x128x128_16x16_32x32_2x2_8x32x1_8x32x1_1x32x1x8_8_1x1_intrawave_v3,801.3,481.42,0.0
gfx942,304,33664,5120,6400,ck,0,0,2404.5954,a8w8_blockscale_1x128x128_256x128x128x128_16x16_32x32_2x2_8x32x1_8x32x1_1x32x1x8_8_1x1_intrawave_v3,917.49,246.58,0.0
gfx942,304,33792,5120,2048,ck,0,0,875.4492,a8w8_blockscale_1x128x128_256x128x128x128_16x16_32x32_2x2_8x32x1_8x32x1_1x32x1x8_8_1x1_intrawave_v3,809.49,486.29,0.0
gfx942,304,33792,5120,6400,ck,0,0,2377.831,a8w8_blockscale_1x128x128_256x128x128x128_16x16_32x32_2x2_8x32x1_8x32x1_1x32x1x8_8_1x1_intrawave_v3,931.35,250.26,0.0
gfx942,304,33920,5120,2048,ck,0,0,900.0693,a8w8_blockscale_1x128x128_256x128x128x128_16x16_32x32_2x2_8x32x1_8x32x1_1x32x1x8_8_1x1_intrawave_v3,790.33,474.74,0.0
gfx942,304,33920,5120,6400,ck,0,0,2433.2109,a8w8_blockscale_1x128x128_256x128x128x128_16x16_32x32_2x2_8x32x1_8x32x1_1x32x1x8_8_1x1_intrawave_v3,913.6,245.44,0.0
gfx942,304,34048,5120,2048,ck,0,0,886.6936,a8w8_blockscale_1x128x128_256x128x128x128_16x16_32x32_2x2_8x32x1_8x32x1_1x32x1x8_8_1x1_intrawave_v3,805.28,483.67,0.0
gfx942,304,34048,5120,6400,ck,0,0,2445.2111,a8w8_blockscale_1x128x128_256x128x128x128_16x16_32x32_2x2_8x32x1_8x32x1_1x32x1x8_8_1x1_intrawave_v3,912.55,245.1,0.0
gfx942,304,34176,5120,2048,ck,0,0,880.3,a8w8_blockscale_1x128x128_256x128x128x128_16x16_32x32_2x2_8x32x1_8x32x1_1x32x1x8_8_1x1_intrawave_v3,814.18,488.97,0.0
gfx942,304,34176,5120,6400,ck,0,0,2463.4449,a8w8_blockscale_1x128x128_256x128x128x128_16x16_32x32_2x2_8x32x1_8x32x1_1x32x1x8_8_1x1_intrawave_v3,909.2,244.15,0.0
gfx942,304,34304,5120,2048,ck,0,0,894.1657,a8w8_blockscale_1x128x128_256x128x128x128_16x16_32x32_2x2_8x32x1_8x32x1_1x32x1x8_8_1x1_intrawave_v3,804.56,483.15,0.0
gfx942,304,34304,5120,6400,ck,0,0,2484.5346,a8w8_blockscale_1x128x128_256x128x128x128_16x16_32x32_2x2_8x32x1_8x32x1_1x32x1x8_8_1x1_intrawave_v3,904.86,242.94,0.0
gfx942,304,34432,5120,2048,ck,0,0,899.0119,a8w8_blockscale_1x128x128_256x128x128x128_16x16_32x32_2x2_8x32x1_8x32x1_1x32x1x8_8_1x1_intrawave_v3,803.21,482.29,0.0
gfx942,304,34432,5120,6400,ck,0,0,2438.594,a8w8_blockscale_1x128x128_256x128x128x128_16x16_32x32_2x2_8x32x1_8x32x1_1x32x1x8_8_1x1_intrawave_v3,925.34,248.39,0.0
gfx942,304,34560,5120,2048,ck,0,0,904.6514,a8w8_blockscale_1x128x128_256x128x128x128_16x16_32x32_2x2_8x32x1_8x32x1_1x32x1x8_8_1x1_intrawave_v3,801.17,481.02,0.0
gfx942,304,34560,5120,6400,ck,0,0,2463.1887,a8w8_blockscale_1x128x128_256x128x128x128_16x16_32x32_2x2_8x32x1_8x32x1_1x32x1x8_8_1x1_intrawave_v3,919.51,246.77,0.0
gfx942,304,34688,5120,2048,ck,0,0,924.8381,a8w8_blockscale_1x128x128_256x128x128x128_16x16_32x32_2x2_8x32x1_8x32x1_1x32x1x8_8_1x1_intrawave_v3,786.58,472.23,0.0
gfx942,304,34688,5120,6400,ck,0,0,2496.0326,a8w8_blockscale_1x128x128_256x128x128x128_16x16_32x32_2x2_8x32x1_8x32x1_1x32x1x8_8_1x1_intrawave_v3,910.77,244.38,0.0
gfx942,304,34816,5120,2048,ck,0,0,902.7829,a8w8_blockscale_1x128x128_256x128x128x128_16x16_32x32_2x2_8x32x1_8x32x1_1x32x1x8_8_1x1_intrawave_v3,808.77,485.5,0.0
gfx942,304,34816,5120,6400,ck,0,0,2525.4921,a8w8_blockscale_1x128x128_256x128x128x128_16x16_32x32_2x2_8x32x1_8x32x1_1x32x1x8_8_1x1_intrawave_v3,903.47,242.37,0.0
gfx942,304,34944,5120,2048,ck,0,0,907.5896,a8w8_blockscale_1x128x128_256x128x128x128_16x16_32x32_2x2_8x32x1_8x32x1_1x32x1x8_8_1x1_intrawave_v3,807.45,484.67,0.0
gfx942,304,34944,5120,6400,ck,0,0,2529.4594,a8w8_blockscale_1x128x128_256x128x128x128_16x16_32x32_2x2_8x32x1_8x32x1_1x32x1x8_8_1x1_intrawave_v3,905.37,242.83,0.0
gfx942,304,35072,5120,2048,ck,0,0,905.2781,a8w8_blockscale_1x128x128_256x128x128x128_16x16_32x32_2x2_8x32x1_8x32x1_1x32x1x8_8_1x1_intrawave_v3,812.47,487.64,0.0
gfx942,304,35072,5120,6400,ck,0,0,2528.0964,a8w8_blockscale_1x128x128_256x128x128x128_16x16_32x32_2x2_8x32x1_8x32x1_1x32x1x8_8_1x1_intrawave_v3,909.17,243.81,0.0
gfx942,304,35200,5120,2048,ck,0,0,914.4271,a8w8_blockscale_1x128x128_256x128x128x128_16x16_32x32_2x2_8x32x1_8x32x1_1x32x1x8_8_1x1_intrawave_v3,807.28,484.48,0.0
gfx942,304,35200,5120,6400,ck,0,0,2520.0192,a8w8_blockscale_1x128x128_256x128x128x128_16x16_32x32_2x2_8x32x1_8x32x1_1x32x1x8_8_1x1_intrawave_v3,915.42,245.43,0.0
gfx942,304,35328,5120,2048,ck,0,0,915.2172,a8w8_blockscale_1x128x128_256x128x128x128_16x16_32x32_2x2_8x32x1_8x32x1_1x32x1x8_8_1x1_intrawave_v3,809.51,485.78,0.0
gfx942,304,35328,5120,6400,ck,0,0,2508.5628,a8w8_blockscale_1x128x128_256x128x128x128_16x16_32x32_2x2_8x32x1_8x32x1_1x32x1x8_8_1x1_intrawave_v3,922.94,247.4,0.0
gfx942,304,35456,5120,2048,ck,0,0,934.3768,a8w8_blockscale_1x128x128_256x128x128x128_16x16_32x32_2x2_8x32x1_8x32x1_1x32x1x8_8_1x1_intrawave_v3,795.79,477.5,0.0
gfx942,304,35456,5120,6400,ck,0,0,2534.9258,a8w8_blockscale_1x128x128_256x128x128x128_16x16_32x32_2x2_8x32x1_8x32x1_1x32x1x8_8_1x1_intrawave_v3,916.65,245.67,0.0
gfx942,304,35584,5120,2048,ck,0,0,932.7945,a8w8_blockscale_1x128x128_256x128x128x128_16x16_32x32_2x2_8x32x1_8x32x1_1x32x1x8_8_1x1_intrawave_v3,800.02,480.0,0.0
gfx942,304,35584,5120,6400,ck,0,0,2570.6082,a8w8_blockscale_1x128x128_256x128x128x128_16x16_32x32_2x2_8x32x1_8x32x1_1x32x1x8_8_1x1_intrawave_v3,907.19,243.09,0.0
gfx942,304,35712,5120,2048,ck,0,0,927.978,a8w8_blockscale_1x128x128_256x128x128x128_16x16_32x32_2x2_8x32x1_8x32x1_1x32x1x8_8_1x1_intrawave_v3,807.06,484.19,0.0
gfx942,304,35712,5120,6400,ck,0,0,2530.7485,a8w8_blockscale_1x128x128_256x128x128x128_16x16_32x32_2x2_8x32x1_8x32x1_1x32x1x8_8_1x1_intrawave_v3,924.79,247.76,0.0
gfx942,304,35840,5120,2048,ck,0,0,934.5907,a8w8_blockscale_1x128x128_256x128x128x128_16x16_32x32_2x2_8x32x1_8x32x1_1x32x1x8_8_1x1_intrawave_v3,804.22,482.44,0.0
gfx942,304,35840,5120,6400,ck,0,0,2555.2686,a8w8_blockscale_1x128x128_256x128x128x128_16x16_32x32_2x2_8x32x1_8x32x1_1x32x1x8_8_1x1_intrawave_v3,919.2,246.22,0.0
gfx942,304,35968,5120,2048,ck,0,0,931.0703,a8w8_blockscale_1x128x128_256x128x128x128_16x16_32x32_2x2_8x32x1_8x32x1_1x32x1x8_8_1x1_intrawave_v3,810.15,485.96,0.0
gfx942,304,35968,5120,6400,ck,0,0,2598.4283,a8w8_blockscale_1x128x128_256x128x128x128_16x16_32x32_2x2_8x32x1_8x32x1_1x32x1x8_8_1x1_intrawave_v3,907.16,242.95,0.0
gfx942,304,36096,5120,2048,ck,0,0,930.4529,a8w8_blockscale_1x128x128_256x128x128x128_16x16_32x32_2x2_8x32x1_8x32x1_1x32x1x8_8_1x1_intrawave_v3,813.57,487.97,0.0
gfx942,304,36096,5120,6400,ck,0,0,2616.522,a8w8_blockscale_1x128x128_256x128x128x128_16x16_32x32_2x2_8x32x1_8x32x1_1x32x1x8_8_1x1_intrawave_v3,904.1,242.08,0.0
gfx942,304,36224,5120,2048,ck,0,0,938.699,a8w8_blockscale_1x128x128_256x128x128x128_16x16_32x32_2x2_8x32x1_8x32x1_1x32x1x8_8_1x1_intrawave_v3,809.28,485.36,0.0
gfx942,304,36224,5120,6400,ck,0,0,2575.5573,a8w8_blockscale_1x128x128_256x128x128x128_16x16_32x32_2x2_8x32x1_8x32x1_1x32x1x8_8_1x1_intrawave_v3,921.73,246.76,0.0
gfx942,304,36352,5120,2048,ck,0,0,939.8499,a8w8_blockscale_1x128x128_256x128x128x128_16x16_32x32_2x2_8x32x1_8x32x1_1x32x1x8_8_1x1_intrawave_v3,811.15,486.44,0.0
gfx942,304,36352,5120,6400,ck,0,0,2690.3772,a8w8_blockscale_1x128x128_256x128x128x128_16x16_32x32_2x2_8x32x1_8x32x1_1x32x1x8_8_1x1_intrawave_v3,885.51,237.02,0.0
gfx942,304,36480,5120,2048,ck,0,0,937.4627,a8w8_blockscale_1x128x128_256x128x128x128_16x16_32x32_2x2_8x32x1_8x32x1_1x32x1x8_8_1x1_intrawave_v3,816.08,489.35,0.0
gfx942,304,36480,5120,6400,ck,0,0,2622.1627,a8w8_blockscale_1x128x128_256x128x128x128_16x16_32x32_2x2_8x32x1_8x32x1_1x32x1x8_8_1x1_intrawave_v3,911.75,244.0,0.0
gfx942,304,36608,5120,2048,ck,0,0,951.6018,a8w8_blockscale_1x128x128_256x128x128x128_16x16_32x32_2x2_8x32x1_8x32x1_1x32x1x8_8_1x1_intrawave_v3,806.77,483.74,0.0
gfx942,304,36608,5120,6400,ck,0,0,2665.2874,a8w8_blockscale_1x128x128_256x128x128x128_16x16_32x32_2x2_8x32x1_8x32x1_1x32x1x8_8_1x1_intrawave_v3,900.14,240.85,0.0
gfx942,304,36736,5120,2048,ck,0,0,951.8527,a8w8_blockscale_1x128x128_256x128x128x128_16x16_32x32_2x2_8x32x1_8x32x1_1x32x1x8_8_1x1_intrawave_v3,809.38,485.26,0.0
gfx942,304,36736,5120,6400,ck,0,0,2676.7838,a8w8_blockscale_1x128x128_256x128x128x128_16x16_32x32_2x2_8x32x1_8x32x1_1x32x1x8_8_1x1_intrawave_v3,899.41,240.61,0.0
gfx942,304,36864,5120,2048,ck,0,0,974.4569,a8w8_blockscale_1x128x128_256x128x128x128_16x16_32x32_2x2_8x32x1_8x32x1_1x32x1x8_8_1x1_intrawave_v3,793.36,475.62,0.0
gfx942,304,36864,5120,6400,ck,0,0,2666.1015,a8w8_blockscale_1x128x128_256x128x128x128_16x16_32x32_2x2_8x32x1_8x32x1_1x32x1x8_8_1x1_intrawave_v3,906.16,242.37,0.0
gfx942,304,36992,5120,2048,ck,0,0,985.7594,a8w8_blockscale_1x128x128_256x128x128x128_16x16_32x32_2x2_8x32x1_8x32x1_1x32x1x8_8_1x1_intrawave_v3,786.99,471.76,0.0
gfx942,304,36992,5120,6400,ck,0,0,2693.4061,a8w8_blockscale_1x128x128_256x128x128x128_16x16_32x32_2x2_8x32x1_8x32x1_1x32x1x8_8_1x1_intrawave_v3,900.09,240.7,0.0
gfx942,304,37120,5120,2048,ck,0,0,968.3166,a8w8_blockscale_1x128x128_256x128x128x128_16x16_32x32_2x2_8x32x1_8x32x1_1x32x1x8_8_1x1_intrawave_v3,803.93,481.88,0.0
gfx942,304,37120,5120,6400,ck,0,0,2696.4454,a8w8_blockscale_1x128x128_256x128x128x128_16x16_32x32_2x2_8x32x1_8x32x1_1x32x1x8_8_1x1_intrawave_v3,902.19,241.22,0.0
gfx942,304,37248,5120,2048,ck,0,0,975.9236,a8w8_blockscale_1x128x128_256x128x128x128_16x16_32x32_2x2_8x32x1_8x32x1_1x32x1x8_8_1x1_intrawave_v3,800.42,479.74,0.0
gfx942,304,37248,5120,6400,ck,0,0,2763.4464,a8w8_blockscale_1x128x128_256x128x128x128_16x16_32x32_2x2_8x32x1_8x32x1_1x32x1x8_8_1x1_intrawave_v3,883.35,236.15,0.0
gfx942,304,37376,5120,2048,ck,0,0,981.1508,a8w8_blockscale_1x128x128_256x128x128x128_16x16_32x32_2x2_8x32x1_8x32x1_1x32x1x8_8_1x1_intrawave_v3,798.89,478.79,0.0
gfx942,304,37376,5120,6400,ck,0,0,2682.8352,a8w8_blockscale_1x128x128_256x128x128x128_16x16_32x32_2x2_8x32x1_8x32x1_1x32x1x8_8_1x1_intrawave_v3,913.02,244.03,0.0
gfx942,304,37504,5120,2048,ck,0,0,976.7924,a8w8_blockscale_1x128x128_256x128x128x128_16x16_32x32_2x2_8x32x1_8x32x1_1x32x1x8_8_1x1_intrawave_v3,805.2,482.53,0.0
gfx942,304,37504,5120,6400,ck,0,0,2694.4599,a8w8_blockscale_1x128x128_256x128x128x128_16x16_32x32_2x2_8x32x1_8x32x1_1x32x1x8_8_1x1_intrawave_v3,912.19,243.77,0.0
gfx942,304,37632,5120,2048,ck,0,0,980.0453,a8w8_blockscale_1x128x128_256x128x128x128_16x16_32x32_2x2_8x32x1_8x32x1_1x32x1x8_8_1x1_intrawave_v3,805.27,482.54,0.0
gfx942,304,37632,5120,6400,ck,0,0,2700.2355,a8w8_blockscale_1x128x128_256x128x128x128_16x16_32x32_2x2_8x32x1_8x32x1_1x32x1x8_8_1x1_intrawave_v3,913.35,244.04,0.0
gfx942,304,37760,5120,2048,ck,0,0,971.3318,a8w8_blockscale_1x128x128_256x128x128x128_16x16_32x32_2x2_8x32x1_8x32x1_1x32x1x8_8_1x1_intrawave_v3,815.26,488.48,0.0
gfx942,304,37760,5120,6400,ck,0,0,2710.9498,a8w8_blockscale_1x128x128_256x128x128x128_16x16_32x32_2x2_8x32x1_8x32x1_1x32x1x8_8_1x1_intrawave_v3,912.83,243.86,0.0
gfx942,304,37888,5120,2048,ck,0,0,984.1415,a8w8_blockscale_1x128x128_256x128x128x128_16x16_32x32_2x2_8x32x1_8x32x1_1x32x1x8_8_1x1_intrawave_v3,807.37,483.72,0.0
gfx942,304,37888,5120,6400,ck,0,0,2718.5063,a8w8_blockscale_1x128x128_256x128x128x128_16x16_32x32_2x2_8x32x1_8x32x1_1x32x1x8_8_1x1_intrawave_v3,913.38,243.97,0.0
gfx942,304,38016,5120,2048,ck,0,0,979.6863,a8w8_blockscale_1x128x128_256x128x128x128_16x16_32x32_2x2_8x32x1_8x32x1_1x32x1x8_8_1x1_intrawave_v3,813.78,487.53,0.0
gfx942,304,38016,5120,6400,ck,0,0,2774.0776,a8w8_blockscale_1x128x128_256x128x128x128_16x16_32x32_2x2_8x32x1_8x32x1_1x32x1x8_8_1x1_intrawave_v3,898.11,239.85,0.0
gfx942,304,38144,5120,2048,ck,0,0,991.0856,a8w8_blockscale_1x128x128_256x128x128x128_16x16_32x32_2x2_8x32x1_8x32x1_1x32x1x8_8_1x1_intrawave_v3,807.13,483.51,0.0
gfx942,304,38144,5120,6400,ck,0,0,2753.6452,a8w8_blockscale_1x128x128_256x128x128x128_16x16_32x32_2x2_8x32x1_8x32x1_1x32x1x8_8_1x1_intrawave_v3,907.82,242.4,0.0
gfx942,304,38272,5120,2048,ck,0,0,990.1023,a8w8_blockscale_1x128x128_256x128x128x128_16x16_32x32_2x2_8x32x1_8x32x1_1x32x1x8_8_1x1_intrawave_v3,810.65,485.58,0.0
gfx942,304,38272,5120,6400,ck,0,0,2776.7942,a8w8_blockscale_1x128x128_256x128x128x128_16x16_32x32_2x2_8x32x1_8x32x1_1x32x1x8_8_1x1_intrawave_v3,903.27,241.15,0.0
gfx942,304,38400,5120,2048,ck,0,0,988.2204,a8w8_blockscale_1x128x128_256x128x128x128_16x16_32x32_2x2_8x32x1_8x32x1_1x32x1x8_8_1x1_intrawave_v3,814.91,488.09,0.0
gfx942,304,38400,5120,6400,ck,0,0,2782.3606,a8w8_blockscale_1x128x128_256x128x128x128_16x16_32x32_2x2_8x32x1_8x32x1_1x32x1x8_8_1x1_intrawave_v3,904.48,241.43,0.0
gfx942,304,38528,5120,2048,ck,0,0,996.024,a8w8_blockscale_1x128x128_256x128x128x128_16x16_32x32_2x2_8x32x1_8x32x1_1x32x1x8_8_1x1_intrawave_v3,811.22,485.85,0.0
gfx942,304,38528,5120,6400,ck,0,0,2766.7635,a8w8_blockscale_1x128x128_256x128x128x128_16x16_32x32_2x2_8x32x1_8x32x1_1x32x1x8_8_1x1_intrawave_v3,912.61,243.56,0.0
gfx942,304,38656,5120,2048,ck,0,0,985.3002,a8w8_blockscale_1x128x128_256x128x128x128_16x16_32x32_2x2_8x32x1_8x32x1_1x32x1x8_8_1x1_intrawave_v3,822.77,492.73,0.0
gfx942,304,38656,5120,6400,ck,0,0,2756.6373,a8w8_blockscale_1x128x128_256x128x128x128_16x16_32x32_2x2_8x32x1_8x32x1_1x32x1x8_8_1x1_intrawave_v3,919.0,245.23,0.0
gfx942,304,38784,5120,2048,ck,0,0,987.5607,a8w8_blockscale_1x128x128_256x128x128x128_16x16_32x32_2x2_8x32x1_8x32x1_1x32x1x8_8_1x1_intrawave_v3,823.6,493.2,0.0
gfx942,304,38784,5120,6400,ck,0,0,2879.2266,a8w8_blockscale_1x128x128_256x128x128x128_16x16_32x32_2x2_8x32x1_8x32x1_1x32x1x8_8_1x1_intrawave_v3,882.79,235.53,0.0
gfx942,304,38912,5120,2048,ck,0,0,1014.3727,a8w8_blockscale_1x128x128_256x128x128x128_16x16_32x32_2x2_8x32x1_8x32x1_1x32x1x8_8_1x1_intrawave_v3,804.48,481.71,0.0
gfx942,304,38912,5120,6400,ck,0,0,2787.8991,a8w8_blockscale_1x128x128_256x128x128x128_16x16_32x32_2x2_8x32x1_8x32x1_1x32x1x8_8_1x1_intrawave_v3,914.72,244.01,0.0
gfx942,304,39040,5120,2048,ck,0,0,1025.202,a8w8_blockscale_1x128x128_256x128x128x128_16x16_32x32_2x2_8x32x1_8x32x1_1x32x1x8_8_1x1_intrawave_v3,798.6,478.16,0.0
gfx942,304,39040,5120,6400,ck,0,0,2803.7187,a8w8_blockscale_1x128x128_256x128x128x128_16x16_32x32_2x2_8x32x1_8x32x1_1x32x1x8_8_1x1_intrawave_v3,912.55,243.39,0.0
gfx942,304,39168,5120,2048,ck,0,0,1004.7256,a8w8_blockscale_1x128x128_256x128x128x128_16x16_32x32_2x2_8x32x1_8x32x1_1x32x1x8_8_1x1_intrawave_v3,817.55,489.47,0.0
gfx942,304,39168,5120,6400,ck,0,0,2800.8356,a8w8_blockscale_1x128x128_256x128x128x128_16x16_32x32_2x2_8x32x1_8x32x1_1x32x1x8_8_1x1_intrawave_v3,916.48,244.4,0.0
gfx942,304,39296,5120,2048,ck,0,0,1019.4244,a8w8_blockscale_1x128x128_256x128x128x128_16x16_32x32_2x2_8x32x1_8x32x1_1x32x1x8_8_1x1_intrawave_v3,808.39,483.95,0.0
gfx942,304,39296,5120,6400,ck,0,0,2830.2203,a8w8_blockscale_1x128x128_256x128x128x128_16x16_32x32_2x2_8x32x1_8x32x1_1x32x1x8_8_1x1_intrawave_v3,909.93,242.61,0.0
gfx942,304,39424,5120,2048,ck,0,0,1006.7609,a8w8_blockscale_1x128x128_256x128x128x128_16x16_32x32_2x2_8x32x1_8x32x1_1x32x1x8_8_1x1_intrawave_v3,821.23,491.6,0.0
gfx942,304,39424,5120,6400,ck,0,0,2935.9073,a8w8_blockscale_1x128x128_256x128x128x128_16x16_32x32_2x2_8x32x1_8x32x1_1x32x1x8_8_1x1_intrawave_v3,880.03,234.61,0.0
gfx942,304,39552,5120,2048,ck,0,0,1019.6887,a8w8_blockscale_1x128x128_256x128x128x128_16x16_32x32_2x2_8x32x1_8x32x1_1x32x1x8_8_1x1_intrawave_v3,813.45,486.91,0.0
gfx942,304,39552,5120,6400,ck,0,0,2855.8557,a8w8_blockscale_1x128x128_256x128x128x128_16x16_32x32_2x2_8x32x1_8x32x1_1x32x1x8_8_1x1_intrawave_v3,907.64,241.93,0.0
gfx942,304,39680,5120,2048,ck,0,0,1015.7488,a8w8_blockscale_1x128x128_256x128x128x128_16x16_32x32_2x2_8x32x1_8x32x1_1x32x1x8_8_1x1_intrawave_v3,819.25,490.35,0.0
gfx942,304,39680,5120,6400,ck,0,0,2854.1064,a8w8_blockscale_1x128x128_256x128x128x128_16x16_32x32_2x2_8x32x1_8x32x1_1x32x1x8_8_1x1_intrawave_v3,911.13,242.82,0.0
gfx942,304,39808,5120,2048,ck,0,0,1020.5337,a8w8_blockscale_1x128x128_256x128x128x128_16x16_32x32_2x2_8x32x1_8x32x1_1x32x1x8_8_1x1_intrawave_v3,818.04,489.59,0.0
gfx942,304,39808,5120,6400,ck,0,0,2879.2307,a8w8_blockscale_1x128x128_256x128x128x128_16x16_32x32_2x2_8x32x1_8x32x1_1x32x1x8_8_1x1_intrawave_v3,906.1,241.44,0.0
gfx942,304,39936,5120,2048,ck,0,0,1043.6621,a8w8_blockscale_1x128x128_256x128x128x128_16x16_32x32_2x2_8x32x1_8x32x1_1x32x1x8_8_1x1_intrawave_v3,802.48,480.25,0.0
gfx942,304,39936,5120,6400,ck,0,0,2881.6705,a8w8_blockscale_1x128x128_256x128x128x128_16x16_32x32_2x2_8x32x1_8x32x1_1x32x1x8_8_1x1_intrawave_v3,908.24,241.98,0.0
gfx942,304,40064,5120,2048,ck,0,0,1028.9706,a8w8_blockscale_1x128x128_256x128x128x128_16x16_32x32_2x2_8x32x1_8x32x1_1x32x1x8_8_1x1_intrawave_v3,816.55,488.64,0.0
gfx942,304,40064,5120,6400,ck,0,0,2904.4827,a8w8_blockscale_1x128x128_256x128x128x128_16x16_32x32_2x2_8x32x1_8x32x1_1x32x1x8_8_1x1_intrawave_v3,903.99,240.81,0.0
gfx942,304,40192,5120,2048,ck,0,0,1059.9585,a8w8_blockscale_1x128x128_256x128x128x128_16x16_32x32_2x2_8x32x1_8x32x1_1x32x1x8_8_1x1_intrawave_v3,795.21,475.83,0.0
gfx942,304,40192,5120,6400,ck,0,0,2874.5799,a8w8_blockscale_1x128x128_256x128x128x128_16x16_32x32_2x2_8x32x1_8x32x1_1x32x1x8_8_1x1_intrawave_v3,916.32,244.06,0.0
gfx942,304,40320,5120,2048,ck,0,0,1029.5628,a8w8_blockscale_1x128x128_256x128x128x128_16x16_32x32_2x2_8x32x1_8x32x1_1x32x1x8_8_1x1_intrawave_v3,821.29,491.41,0.0
gfx942,304,40320,5120,6400,ck,0,0,2958.2167,a8w8_blockscale_1x128x128_256x128x128x128_16x16_32x32_2x2_8x32x1_8x32x1_1x32x1x8_8_1x1_intrawave_v3,893.24,237.88,0.0
gfx942,304,40448,5120,2048,ck,0,0,1029.7103,a8w8_blockscale_1x128x128_256x128x128x128_16x16_32x32_2x2_8x32x1_8x32x1_1x32x1x8_8_1x1_intrawave_v3,823.78,492.87,0.0
gfx942,304,40448,5120,6400,ck,0,0,2931.0024,a8w8_blockscale_1x128x128_256x128x128x128_16x16_32x32_2x2_8x32x1_8x32x1_1x32x1x8_8_1x1_intrawave_v3,904.4,240.81,0.0
gfx942,304,40576,5120,2048,ck,0,0,1056.7864,a8w8_blockscale_1x128x128_256x128x128x128_16x16_32x32_2x2_8x32x1_8x32x1_1x32x1x8_8_1x1_intrawave_v3,805.22,481.73,0.0
gfx942,304,40576,5120,6400,ck,0,0,2944.7245,a8w8_blockscale_1x128x128_256x128x128x128_16x16_32x32_2x2_8x32x1_8x32x1_1x32x1x8_8_1x1_intrawave_v3,903.03,240.41,0.0
gfx942,304,40704,5120,2048,ck,0,0,1060.2114,a8w8_blockscale_1x128x128_256x128x128x128_16x16_32x32_2x2_8x32x1_8x32x1_1x32x1x8_8_1x1_intrawave_v3,805.15,481.66,0.0
gfx942,304,40704,5120,6400,ck,0,0,2940.8595,a8w8_blockscale_1x128x128_256x128x128x128_16x16_32x32_2x2_8x32x1_8x32x1_1x32x1x8_8_1x1_intrawave_v3,907.07,241.45,0.0
gfx942,304,40832,5120,2048,ck,0,0,1065.1996,a8w8_blockscale_1x128x128_256x128x128x128_16x16_32x32_2x2_8x32x1_8x32x1_1x32x1x8_8_1x1_intrawave_v3,803.9,480.88,0.0
gfx942,304,40832,5120,6400,ck,0,0,2951.9509,a8w8_blockscale_1x128x128_256x128x128x128_16x16_32x32_2x2_8x32x1_8x32x1_1x32x1x8_8_1x1_intrawave_v3,906.51,241.27,0.0
gfx942,304,40960,5120,2048,ck,0,0,1058.548,a8w8_blockscale_1x128x128_256x128x128x128_16x16_32x32_2x2_8x32x1_8x32x1_1x32x1x8_8_1x1_intrawave_v3,811.48,485.38,0.0
gfx942,304,40960,5120,6400,ck,0,0,2994.3831,a8w8_blockscale_1x128x128_256x128x128x128_16x16_32x32_2x2_8x32x1_8x32x1_1x32x1x8_8_1x1_intrawave_v3,896.46,238.56,0.0
gfx942,304,41088,5120,2048,ck,0,0,1060.2638,a8w8_blockscale_1x128x128_256x128x128x128_16x16_32x32_2x2_8x32x1_8x32x1_1x32x1x8_8_1x1_intrawave_v3,812.7,486.08,0.0
gfx942,304,41088,5120,6400,ck,0,0,2957.5619,a8w8_blockscale_1x128x128_256x128x128x128_16x16_32x32_2x2_8x32x1_8x32x1_1x32x1x8_8_1x1_intrawave_v3,910.46,242.25,0.0
gfx942,304,41216,5120,2048,ck,0,0,1053.4229,a8w8_blockscale_1x128x128_256x128x128x128_16x16_32x32_2x2_8x32x1_8x32x1_1x32x1x8_8_1x1_intrawave_v3,820.53,490.73,0.0
gfx942,304,41216,5120,6400,ck,0,0,2954.6927,a8w8_blockscale_1x128x128_256x128x128x128_16x16_32x32_2x2_8x32x1_8x32x1_1x32x1x8_8_1x1_intrawave_v3,914.18,243.21,0.0
gfx942,304,41344,5120,2048,ck,0,0,1055.9924,a8w8_blockscale_1x128x128_256x128x128x128_16x16_32x32_2x2_8x32x1_8x32x1_1x32x1x8_8_1x1_intrawave_v3,821.07,491.03,0.0
gfx942,304,41344,5120,6400,ck,0,0,2974.1152,a8w8_blockscale_1x128x128_256x128x128x128_16x16_32x32_2x2_8x32x1_8x32x1_1x32x1x8_8_1x1_intrawave_v3,911.03,242.33,0.0
gfx942,304,41472,5120,2048,ck,0,0,1058.9011,a8w8_blockscale_1x128x128_256x128x128x128_16x16_32x32_2x2_8x32x1_8x32x1_1x32x1x8_8_1x1_intrawave_v3,821.35,491.16,0.0
gfx942,304,41472,5120,6400,ck,0,0,3011.3534,a8w8_blockscale_1x128x128_256x128x128x128_16x16_32x32_2x2_8x32x1_8x32x1_1x32x1x8_8_1x1_intrawave_v3,902.55,240.05,0.0
gfx942,304,41600,5120,2048,ck,0,0,1096.9765,a8w8_blockscale_1x128x128_256x128x128x128_16x16_32x32_2x2_8x32x1_8x32x1_1x32x1x8_8_1x1_intrawave_v3,795.29,475.55,0.0
gfx942,304,41600,5120,6400,ck,0,0,3096.2431,a8w8_blockscale_1x128x128_256x128x128x128_16x16_32x32_2x2_8x32x1_8x32x1_1x32x1x8_8_1x1_intrawave_v3,880.52,234.15,0.0
gfx942,304,41728,5120,2048,ck,0,0,1089.8396,a8w8_blockscale_1x128x128_256x128x128x128_16x16_32x32_2x2_8x32x1_8x32x1_1x32x1x8_8_1x1_intrawave_v3,802.96,480.11,0.0
gfx942,304,41728,5120,6400,ck,0,0,2998.3918,a8w8_blockscale_1x128x128_256x128x128x128_16x16_32x32_2x2_8x32x1_8x32x1_1x32x1x8_8_1x1_intrawave_v3,912.05,242.5,0.0
gfx942,304,41856,5120,2048,ck,0,0,1078.8739,a8w8_blockscale_1x128x128_256x128x128x128_16x16_32x32_2x2_8x32x1_8x32x1_1x32x1x8_8_1x1_intrawave_v3,813.61,486.44,0.0
gfx942,304,41856,5120,6400,ck,0,0,3048.3006,a8w8_blockscale_1x128x128_256x128x128x128_16x16_32x32_2x2_8x32x1_8x32x1_1x32x1x8_8_1x1_intrawave_v3,899.87,239.23,0.0
gfx942,304,41984,5120,2048,ck,0,0,1088.0816,a8w8_blockscale_1x128x128_256x128x128x128_16x16_32x32_2x2_8x32x1_8x32x1_1x32x1x8_8_1x1_intrawave_v3,809.19,483.77,0.0
gfx942,304,41984,5120,6400,ck,0,0,3017.2564,a8w8_blockscale_1x128x128_256x128x128x128_16x16_32x32_2x2_8x32x1_8x32x1_1x32x1x8_8_1x1_intrawave_v3,911.91,242.4,0.0
gfx942,304,42112,5120,2048,ck,0,0,1090.4531,a8w8_blockscale_1x128x128_256x128x128x128_16x16_32x32_2x2_8x32x1_8x32x1_1x32x1x8_8_1x1_intrawave_v3,809.9,484.16,0.0
gfx942,304,42112,5120,6400,ck,0,0,3134.8484,a8w8_blockscale_1x128x128_256x128x128x128_16x16_32x32_2x2_8x32x1_8x32x1_1x32x1x8_8_1x1_intrawave_v3,880.38,233.99,0.0
gfx942,304,42240,5120,2048,ck,0,0,1093.9783,a8w8_blockscale_1x128x128_256x128x128x128_16x16_32x32_2x2_8x32x1_8x32x1_1x32x1x8_8_1x1_intrawave_v3,809.74,484.04,0.0
gfx942,304,42240,5120,6400,ck,0,0,3074.8162,a8w8_blockscale_1x128x128_256x128x128x128_16x16_32x32_2x2_8x32x1_8x32x1_1x32x1x8_8_1x1_intrawave_v3,900.29,239.25,0.0
gfx942,304,42368,5120,2048,ck,0,0,1099.8059,a8w8_blockscale_1x128x128_256x128x128x128_16x16_32x32_2x2_8x32x1_8x32x1_1x32x1x8_8_1x1_intrawave_v3,807.89,482.91,0.0
gfx942,304,42368,5120,6400,ck,0,0,3053.1748,a8w8_blockscale_1x128x128_256x128x128x128_16x16_32x32_2x2_8x32x1_8x32x1_1x32x1x8_8_1x1_intrawave_v3,909.42,241.64,0.0
gfx942,304,42496,5120,2048,ck,0,0,1111.2875,a8w8_blockscale_1x128x128_256x128x128x128_16x16_32x32_2x2_8x32x1_8x32x1_1x32x1x8_8_1x1_intrawave_v3,801.96,479.33,0.0
gfx942,304,42496,5120,6400,ck,0,0,3031.9975,a8w8_blockscale_1x128x128_256x128x128x128_16x16_32x32_2x2_8x32x1_8x32x1_1x32x1x8_8_1x1_intrawave_v3,918.54,244.03,0.0
gfx942,304,42624,5120,2048,ck,0,0,1109.702,a8w8_blockscale_1x128x128_256x128x128x128_16x16_32x32_2x2_8x32x1_8x32x1_1x32x1x8_8_1x1_intrawave_v3,805.52,481.44,0.0
gfx942,304,42624,5120,6400,ck,0,0,3093.2753,a8w8_blockscale_1x128x128_256x128x128x128_16x16_32x32_2x2_8x32x1_8x32x1_1x32x1x8_8_1x1_intrawave_v3,903.06,239.89,0.0
gfx942,304,42752,5120,2048,ck,0,0,1095.2538,a8w8_blockscale_1x128x128_256x128x128x128_16x16_32x32_2x2_8x32x1_8x32x1_1x32x1x8_8_1x1_intrawave_v3,818.6,489.22,0.0
gfx942,304,42752,5120,6400,ck,0,0,3061.9771,a8w8_blockscale_1x128x128_256x128x128x128_16x16_32x32_2x2_8x32x1_8x32x1_1x32x1x8_8_1x1_intrawave_v3,915.03,243.03,0.0
gfx942,304,42880,5120,2048,ck,0,0,1107.7222,a8w8_blockscale_1x128x128_256x128x128x128_16x16_32x32_2x2_8x32x1_8x32x1_1x32x1x8_8_1x1_intrawave_v3,811.81,485.14,0.0
gfx942,304,42880,5120,6400,ck,0,0,3088.4251,a8w8_blockscale_1x128x128_256x128x128x128_16x16_32x32_2x2_8x32x1_8x32x1_1x32x1x8_8_1x1_intrawave_v3,909.91,241.64,0.0
gfx942,304,43008,5120,2048,ck,0,0,1130.932,a8w8_blockscale_1x128x128_256x128x128x128_16x16_32x32_2x2_8x32x1_8x32x1_1x32x1x8_8_1x1_intrawave_v3,797.52,476.57,0.0
gfx942,304,43008,5120,6400,ck,0,0,3120.626,a8w8_blockscale_1x128x128_256x128x128x128_16x16_32x32_2x2_8x32x1_8x32x1_1x32x1x8_8_1x1_intrawave_v3,903.21,239.83,0.0
gfx942,304,43136,5120,2048,ck,0,0,1107.727,a8w8_blockscale_1x128x128_256x128x128x128_16x16_32x32_2x2_8x32x1_8x32x1_1x32x1x8_8_1x1_intrawave_v3,816.65,487.97,0.0
gfx942,304,43136,5120,6400,ck,0,0,3142.1879,a8w8_blockscale_1x128x128_256x128x128x128_16x16_32x32_2x2_8x32x1_8x32x1_1x32x1x8_8_1x1_intrawave_v3,899.68,238.86,0.0
gfx942,304,43264,5120,2048,ck,0,0,1115.7745,a8w8_blockscale_1x128x128_256x128x128x128_16x16_32x32_2x2_8x32x1_8x32x1_1x32x1x8_8_1x1_intrawave_v3,813.17,485.86,0.0
gfx942,304,43264,5120,6400,ck,0,0,3218.7485,a8w8_blockscale_1x128x128_256x128x128x128_16x16_32x32_2x2_8x32x1_8x32x1_1x32x1x8_8_1x1_intrawave_v3,880.89,233.84,0.0
gfx942,304,43392,5120,2048,ck,0,0,1114.5547,a8w8_blockscale_1x128x128_256x128x128x128_16x16_32x32_2x2_8x32x1_8x32x1_1x32x1x8_8_1x1_intrawave_v3,816.47,487.81,0.0
gfx942,304,43392,5120,6400,ck,0,0,3171.8985,a8w8_blockscale_1x128x128_256x128x128x128_16x16_32x32_2x2_8x32x1_8x32x1_1x32x1x8_8_1x1_intrawave_v3,896.54,237.97,0.0
gfx942,304,43520,5120,2048,ck,0,0,1125.078,a8w8_blockscale_1x128x128_256x128x128x128_16x16_32x32_2x2_8x32x1_8x32x1_1x32x1x8_8_1x1_intrawave_v3,811.22,484.64,0.0
gfx942,304,43520,5120,6400,ck,0,0,3142.7763,a8w8_blockscale_1x128x128_256x128x128x128_16x16_32x32_2x2_8x32x1_8x32x1_1x32x1x8_8_1x1_intrawave_v3,907.52,240.85,0.0
gfx942,304,43648,5120,2048,ck,0,0,1127.9771,a8w8_blockscale_1x128x128_256x128x128x128_16x16_32x32_2x2_8x32x1_8x32x1_1x32x1x8_8_1x1_intrawave_v3,811.51,484.79,0.0
gfx942,304,43648,5120,6400,ck,0,0,3120.6349,a8w8_blockscale_1x128x128_256x128x128x128_16x16_32x32_2x2_8x32x1_8x32x1_1x32x1x8_8_1x1_intrawave_v3,916.65,243.24,0.0
gfx942,304,43776,5120,2048,ck,0,0,1125.1462,a8w8_blockscale_1x128x128_256x128x128x128_16x16_32x32_2x2_8x32x1_8x32x1_1x32x1x8_8_1x1_intrawave_v3,815.94,487.41,0.0
gfx942,304,43776,5120,6400,ck,0,0,3177.6607,a8w8_blockscale_1x128x128_256x128x128x128_16x16_32x32_2x2_8x32x1_8x32x1_1x32x1x8_8_1x1_intrawave_v3,902.84,239.55,0.0
gfx942,304,43904,5120,2048,ck,0,0,1131.9385,a8w8_blockscale_1x128x128_256x128x128x128_16x16_32x32_2x2_8x32x1_8x32x1_1x32x1x8_8_1x1_intrawave_v3,813.41,485.87,0.0
gfx942,304,43904,5120,6400,ck,0,0,3200.2252,a8w8_blockscale_1x128x128_256x128x128x128_16x16_32x32_2x2_8x32x1_8x32x1_1x32x1x8_8_1x1_intrawave_v3,899.09,238.52,0.0
gfx942,304,44032,5120,2048,ck,0,0,1134.1976,a8w8_blockscale_1x128x128_256x128x128x128_16x16_32x32_2x2_8x32x1_8x32x1_1x32x1x8_8_1x1_intrawave_v3,814.16,486.29,0.0
gfx942,304,44032,5120,6400,ck,0,0,3165.6035,a8w8_blockscale_1x128x128_256x128x128x128_16x16_32x32_2x2_8x32x1_8x32x1_1x32x1x8_8_1x1_intrawave_v3,911.57,241.81,0.0
gfx942,304,44160,5120,2048,ck,0,0,1148.9989,a8w8_blockscale_1x128x128_256x128x128x128_16x16_32x32_2x2_8x32x1_8x32x1_1x32x1x8_8_1x1_intrawave_v3,806.01,481.4,0.0
gfx942,304,44160,5120,6400,ck,0,0,3219.8982,a8w8_blockscale_1x128x128_256x128x128x128_16x16_32x32_2x2_8x32x1_8x32x1_1x32x1x8_8_1x1_intrawave_v3,898.81,238.39,0.0
gfx942,304,44288,5120,2048,ck,0,0,1129.9266,a8w8_blockscale_1x128x128_256x128x128x128_16x16_32x32_2x2_8x32x1_8x32x1_1x32x1x8_8_1x1_intrawave_v3,821.99,490.91,0.0
gfx942,304,44288,5120,6400,ck,0,0,3182.8933,a8w8_blockscale_1x128x128_256x128x128x128_16x16_32x32_2x2_8x32x1_8x32x1_1x32x1x8_8_1x1_intrawave_v3,911.89,241.83,0.0
gfx942,304,44416,5120,2048,ck,0,0,1132.0084,a8w8_blockscale_1x128x128_256x128x128x128_16x16_32x32_2x2_8x32x1_8x32x1_1x32x1x8_8_1x1_intrawave_v3,822.85,491.4,0.0
gfx942,304,44416,5120,6400,ck,0,0,3225.4741,a8w8_blockscale_1x128x128_256x128x128x128_16x16_32x32_2x2_8x32x1_8x32x1_1x32x1x8_8_1x1_intrawave_v3,902.46,239.3,0.0
gfx942,304,44544,5120,2048,ck,0,0,1147.643,a8w8_blockscale_1x128x128_256x128x128x128_16x16_32x32_2x2_8x32x1_8x32x1_1x32x1x8_8_1x1_intrawave_v3,813.98,486.08,0.0
gfx942,304,44544,5120,6400,ck,0,0,3233.6017,a8w8_blockscale_1x128x128_256x128x128x128_16x16_32x32_2x2_8x32x1_8x32x1_1x32x1x8_8_1x1_intrawave_v3,902.78,239.36,0.0
gfx942,304,44672,5120,2048,ck,0,0,1146.245,a8w8_blockscale_1x128x128_256x128x128x128_16x16_32x32_2x2_8x32x1_8x32x1_1x32x1x8_8_1x1_intrawave_v3,817.31,488.04,0.0
gfx942,304,44672,5120,6400,ck,0,0,3218.5225,a8w8_blockscale_1x128x128_256x128x128x128_16x16_32x32_2x2_8x32x1_8x32x1_1x32x1x8_8_1x1_intrawave_v3,909.62,241.14,0.0
gfx942,304,44800,5120,2048,ck,0,0,1156.4773,a8w8_blockscale_1x128x128_256x128x128x128_16x16_32x32_2x2_8x32x1_8x32x1_1x32x1x8_8_1x1_intrawave_v3,812.4,485.08,0.0
gfx942,304,44800,5120,6400,ck,0,0,3338.0385,a8w8_blockscale_1x128x128_256x128x128x128_16x16_32x32_2x2_8x32x1_8x32x1_1x32x1x8_8_1x1_intrawave_v3,879.56,233.14,0.0
gfx942,304,44928,5120,2048,ck,0,0,1162.9984,a8w8_blockscale_1x128x128_256x128x128x128_16x16_32x32_2x2_8x32x1_8x32x1_1x32x1x8_8_1x1_intrawave_v3,810.15,483.72,0.0
gfx942,304,44928,5120,6400,ck,0,0,3262.3407,a8w8_blockscale_1x128x128_256x128x128x128_16x16_32x32_2x2_8x32x1_8x32x1_1x32x1x8_8_1x1_intrawave_v3,902.54,239.21,0.0
gfx942,304,45056,5120,2048,ck,0,0,1158.6636,a8w8_blockscale_1x128x128_256x128x128x128_16x16_32x32_2x2_8x32x1_8x32x1_1x32x1x8_8_1x1_intrawave_v3,815.5,486.88,0.0
gfx942,304,45056,5120,6400,ck,0,0,3238.5574,a8w8_blockscale_1x128x128_256x128x128x128_16x16_32x32_2x2_8x32x1_8x32x1_1x32x1x8_8_1x1_intrawave_v3,911.76,241.62,0.0
gfx942,304,45184,5120,2048,ck,0,0,1164.5122,a8w8_blockscale_1x128x128_256x128x128x128_16x16_32x32_2x2_8x32x1_8x32x1_1x32x1x8_8_1x1_intrawave_v3,813.71,485.79,0.0
gfx942,304,45184,5120,6400,ck,0,0,3305.3887,a8w8_blockscale_1x128x128_256x128x128x128_16x16_32x32_2x2_8x32x1_8x32x1_1x32x1x8_8_1x1_intrawave_v3,895.86,237.38,0.0
gfx942,304,45312,5120,2048,ck,0,0,1161.4203,a8w8_blockscale_1x128x128_256x128x128x128_16x16_32x32_2x2_8x32x1_8x32x1_1x32x1x8_8_1x1_intrawave_v3,818.19,488.44,0.0
gfx942,304,45312,5120,6400,ck,0,0,3263.3907,a8w8_blockscale_1x128x128_256x128x128x128_16x16_32x32_2x2_8x32x1_8x32x1_1x32x1x8_8_1x1_intrawave_v3,909.96,241.09,0.0
gfx942,304,45440,5120,2048,ck,0,0,1179.3453,a8w8_blockscale_1x128x128_256x128x128x128_16x16_32x32_2x2_8x32x1_8x32x1_1x32x1x8_8_1x1_intrawave_v3,808.03,482.35,0.0
gfx942,304,45440,5120,6400,ck,0,0,3302.4138,a8w8_blockscale_1x128x128_256x128x128x128_16x16_32x32_2x2_8x32x1_8x32x1_1x32x1x8_8_1x1_intrawave_v3,901.75,238.88,0.0
gfx942,304,45568,5120,2048,ck,0,0,1168.9802,a8w8_blockscale_1x128x128_256x128x128x128_16x16_32x32_2x2_8x32x1_8x32x1_1x32x1x8_8_1x1_intrawave_v3,817.49,487.97,0.0
gfx942,304,45568,5120,6400,ck,0,0,3386.4597,a8w8_blockscale_1x128x128_256x128x128x128_16x16_32x32_2x2_8x32x1_8x32x1_1x32x1x8_8_1x1_intrawave_v3,881.85,233.58,0.0
gfx942,304,45696,5120,2048,ck,0,0,1202.6434,a8w8_blockscale_1x128x128_256x128x128x128_16x16_32x32_2x2_8x32x1_8x32x1_1x32x1x8_8_1x1_intrawave_v3,796.84,475.62,0.0
gfx942,304,45696,5120,6400,ck,0,0,3318.1937,a8w8_blockscale_1x128x128_256x128x128x128_16x16_32x32_2x2_8x32x1_8x32x1_1x32x1x8_8_1x1_intrawave_v3,902.52,239.03,0.0
gfx942,304,45824,5120,2048,ck,0,0,1215.1217,a8w8_blockscale_1x128x128_256x128x128x128_16x16_32x32_2x2_8x32x1_8x32x1_1x32x1x8_8_1x1_intrawave_v3,790.87,472.03,0.0
gfx942,304,45824,5120,6400,ck,0,0,3282.8003,a8w8_blockscale_1x128x128_256x128x128x128_16x16_32x32_2x2_8x32x1_8x32x1_1x32x1x8_8_1x1_intrawave_v3,914.8,242.26,0.0
gfx942,304,45952,5120,2048,ck,0,0,1176.4782,a8w8_blockscale_1x128x128_256x128x128x128_16x16_32x32_2x2_8x32x1_8x32x1_1x32x1x8_8_1x1_intrawave_v3,819.13,488.87,0.0
gfx942,304,45952,5120,6400,ck,0,0,3362.5602,a8w8_blockscale_1x128x128_256x128x128x128_16x16_32x32_2x2_8x32x1_8x32x1_1x32x1x8_8_1x1_intrawave_v3,895.6,237.14,0.0
gfx942,304,46080,5120,2048,ck,0,0,1181.6941,a8w8_blockscale_1x128x128_256x128x128x128_16x16_32x32_2x2_8x32x1_8x32x1_1x32x1x8_8_1x1_intrawave_v3,817.78,488.04,0.0
gfx942,304,46080,5120,6400,ck,0,0,3320.4499,a8w8_blockscale_1x128x128_256x128x128x128_16x16_32x32_2x2_8x32x1_8x32x1_1x32x1x8_8_1x1_intrawave_v3,909.48,240.79,0.0
gfx942,304,46208,5120,2048,ck,0,0,1198.2066,a8w8_blockscale_1x128x128_256x128x128x128_16x16_32x32_2x2_8x32x1_8x32x1_1x32x1x8_8_1x1_intrawave_v3,808.75,482.63,0.0
gfx942,304,46208,5120,6400,ck,0,0,3355.7866,a8w8_blockscale_1x128x128_256x128x128x128_16x16_32x32_2x2_8x32x1_8x32x1_1x32x1x8_8_1x1_intrawave_v3,902.41,238.89,0.0
gfx942,304,46336,5120,2048,ck,0,0,1219.1489,a8w8_blockscale_1x128x128_256x128x128x128_16x16_32x32_2x2_8x32x1_8x32x1_1x32x1x8_8_1x1_intrawave_v3,797.06,475.63,0.0
gfx942,304,46336,5120,6400,ck,0,0,3302.5402,a8w8_blockscale_1x128x128_256x128x128x128_16x16_32x32_2x2_8x32x1_8x32x1_1x32x1x8_8_1x1_intrawave_v3,919.5,243.39,0.0
gfx942,304,46464,5120,2048,ck,0,0,1192.2956,a8w8_blockscale_1x128x128_256x128x128x128_16x16_32x32_2x2_8x32x1_8x32x1_1x32x1x8_8_1x1_intrawave_v3,817.26,487.66,0.0
gfx942,304,46464,5120,6400,ck,0,0,3398.756,a8w8_blockscale_1x128x128_256x128x128x128_16x16_32x32_2x2_8x32x1_8x32x1_1x32x1x8_8_1x1_intrawave_v3,895.94,237.12,0.0
gfx942,304,46592,5120,2048,ck,0,0,1194.0531,a8w8_blockscale_1x128x128_256x128x128x128_16x16_32x32_2x2_8x32x1_8x32x1_1x32x1x8_8_1x1_intrawave_v3,818.31,488.26,0.0
gfx942,304,46592,5120,6400,ck,0,0,3290.3803,a8w8_blockscale_1x128x128_256x128x128x128_16x16_32x32_2x2_8x32x1_8x32x1_1x32x1x8_8_1x1_intrawave_v3,927.99,245.58,0.0
gfx942,304,46720,5120,2048,ck,0,0,1219.484,a8w8_blockscale_1x128x128_256x128x128x128_16x16_32x32_2x2_8x32x1_8x32x1_1x32x1x8_8_1x1_intrawave_v3,803.45,479.37,0.0
gfx942,304,46720,5120,6400,ck,0,0,3346.6936,a8w8_blockscale_1x128x128_256x128x128x128_16x16_32x32_2x2_8x32x1_8x32x1_1x32x1x8_8_1x1_intrawave_v3,914.89,242.09,0.0
gfx942,304,46848,5120,2048,ck,0,0,1205.9566,a8w8_blockscale_1x128x128_256x128x128x128_16x16_32x32_2x2_8x32x1_8x32x1_1x32x1x8_8_1x1_intrawave_v3,814.68,486.05,0.0
gfx942,304,46848,5120,6400,ck,0,0,3350.8667,a8w8_blockscale_1x128x128_256x128x128x128_16x16_32x32_2x2_8x32x1_8x32x1_1x32x1x8_8_1x1_intrawave_v3,916.25,242.42,0.0
gfx942,304,46976,5120,2048,ck,0,0,1212.7445,a8w8_blockscale_1x128x128_256x128x128x128_16x16_32x32_2x2_8x32x1_8x32x1_1x32x1x8_8_1x1_intrawave_v3,812.34,484.63,0.0
gfx942,304,46976,5120,6400,ck,0,0,3369.1496,a8w8_blockscale_1x128x128_256x128x128x128_16x16_32x32_2x2_8x32x1_8x32x1_1x32x1x8_8_1x1_intrawave_v3,913.77,241.74,0.0
gfx942,304,47104,5120,2048,ck,0,0,1209.6802,a8w8_blockscale_1x128x128_256x128x128x128_16x16_32x32_2x2_8x32x1_8x32x1_1x32x1x8_8_1x1_intrawave_v3,816.61,487.15,0.0
gfx942,304,47104,5120,6400,ck,0,0,3386.4445,a8w8_blockscale_1x128x128_256x128x128x128_16x16_32x32_2x2_8x32x1_8x32x1_1x32x1x8_8_1x1_intrawave_v3,911.58,241.13,0.0
gfx942,304,47232,5120,2048,ck,0,0,1221.5379,a8w8_blockscale_1x128x128_256x128x128x128_16x16_32x32_2x2_8x32x1_8x32x1_1x32x1x8_8_1x1_intrawave_v3,810.89,483.71,0.0
gfx942,304,47232,5120,6400,ck,0,0,3413.7807,a8w8_blockscale_1x128x128_256x128x128x128_16x16_32x32_2x2_8x32x1_8x32x1_1x32x1x8_8_1x1_intrawave_v3,906.74,239.82,0.0
gfx942,304,47360,5120,2048,ck,0,0,1209.6596,a8w8_blockscale_1x128x128_256x128x128x128_16x16_32x32_2x2_8x32x1_8x32x1_1x32x1x8_8_1x1_intrawave_v3,821.07,489.76,0.0
gfx942,304,47360,5120,6400,ck,0,0,3448.7852,a8w8_blockscale_1x128x128_256x128x128x128_16x16_32x32_2x2_8x32x1_8x32x1_1x32x1x8_8_1x1_intrawave_v3,899.96,238.01,0.0
gfx942,304,47488,5120,2048,ck,0,0,1247.1539,a8w8_blockscale_1x128x128_256x128x128x128_16x16_32x32_2x2_8x32x1_8x32x1_1x32x1x8_8_1x1_intrawave_v3,798.53,476.3,0.0
gfx942,304,47488,5120,6400,ck,0,0,3403.3955,a8w8_blockscale_1x128x128_256x128x128x128_16x16_32x32_2x2_8x32x1_8x32x1_1x32x1x8_8_1x1_intrawave_v3,914.43,241.81,0.0
gfx942,304,47616,5120,2048,ck,0,0,1234.2243,a8w8_blockscale_1x128x128_256x128x128x128_16x16_32x32_2x2_8x32x1_8x32x1_1x32x1x8_8_1x1_intrawave_v3,809.07,482.56,0.0
gfx942,304,47616,5120,6400,ck,0,0,3442.5095,a8w8_blockscale_1x128x128_256x128x128x128_16x16_32x32_2x2_8x32x1_8x32x1_1x32x1x8_8_1x1_intrawave_v3,906.48,239.68,0.0
gfx942,304,47744,5120,2048,ck,0,0,1224.0599,a8w8_blockscale_1x128x128_256x128x128x128_16x16_32x32_2x2_8x32x1_8x32x1_1x32x1x8_8_1x1_intrawave_v3,817.99,487.86,0.0
gfx942,304,47744,5120,6400,ck,0,0,3427.1378,a8w8_blockscale_1x128x128_256x128x128x128_16x16_32x32_2x2_8x32x1_8x32x1_1x32x1x8_8_1x1_intrawave_v3,912.99,241.38,0.0
gfx942,304,47872,5120,2048,ck,0,0,1224.8053,a8w8_blockscale_1x128x128_256x128x128x128_16x16_32x32_2x2_8x32x1_8x32x1_1x32x1x8_8_1x1_intrawave_v3,819.68,488.84,0.0
gfx942,304,47872,5120,6400,ck,0,0,3460.5087,a8w8_blockscale_1x128x128_256x128x128x128_16x16_32x32_2x2_8x32x1_8x32x1_1x32x1x8_8_1x1_intrawave_v3,906.61,239.66,0.0
gfx942,304,48000,5120,2048,ck,0,0,1234.5822,a8w8_blockscale_1x128x128_256x128x128x128_16x16_32x32_2x2_8x32x1_8x32x1_1x32x1x8_8_1x1_intrawave_v3,815.36,486.25,0.0
gfx942,304,48000,5120,6400,ck,0,0,3490.9313,a8w8_blockscale_1x128x128_256x128x128x128_16x16_32x32_2x2_8x32x1_8x32x1_1x32x1x8_8_1x1_intrawave_v3,901.11,238.19,0.0
gfx942,304,48128,5120,2048,ck,0,0,1255.3723,a8w8_blockscale_1x128x128_256x128x128x128_16x16_32x32_2x2_8x32x1_8x32x1_1x32x1x8_8_1x1_intrawave_v3,804.0,479.45,0.0
gfx942,304,48128,5120,6400,ck,0,0,3456.3044,a8w8_blockscale_1x128x128_256x128x128x128_16x16_32x32_2x2_8x32x1_8x32x1_1x32x1x8_8_1x1_intrawave_v3,912.57,241.19,0.0
gfx942,304,48256,5120,2048,ck,0,0,1246.1191,a8w8_blockscale_1x128x128_256x128x128x128_16x16_32x32_2x2_8x32x1_8x32x1_1x32x1x8_8_1x1_intrawave_v3,812.12,484.27,0.0
gfx942,304,48256,5120,6400,ck,0,0,3491.016,a8w8_blockscale_1x128x128_256x128x128x128_16x16_32x32_2x2_8x32x1_8x32x1_1x32x1x8_8_1x1_intrawave_v3,905.9,239.4,0.0
gfx942,304,48384,5120,2048,ck,0,0,1244.8818,a8w8_blockscale_1x128x128_256x128x128x128_16x16_32x32_2x2_8x32x1_8x32x1_1x32x1x8_8_1x1_intrawave_v3,815.09,486.01,0.0
gfx942,304,48384,5120,6400,ck,0,0,3490.9826,a8w8_blockscale_1x128x128_256x128x128x128_16x16_32x32_2x2_8x32x1_8x32x1_1x32x1x8_8_1x1_intrawave_v3,908.31,240.01,0.0
gfx942,304,48512,5120,2048,ck,0,0,1249.1462,a8w8_blockscale_1x128x128_256x128x128x128_16x16_32x32_2x2_8x32x1_8x32x1_1x32x1x8_8_1x1_intrawave_v3,814.45,485.61,0.0
gfx942,304,48512,5120,6400,ck,0,0,3471.7881,a8w8_blockscale_1x128x128_256x128x128x128_16x16_32x32_2x2_8x32x1_8x32x1_1x32x1x8_8_1x1_intrawave_v3,915.75,241.95,0.0
gfx942,304,48640,5120,2048,ck,0,0,1238.2358,a8w8_blockscale_1x128x128_256x128x128x128_16x16_32x32_2x2_8x32x1_8x32x1_1x32x1x8_8_1x1_intrawave_v3,823.8,491.16,0.0
gfx942,304,48640,5120,6400,ck,0,0,3518.1356,a8w8_blockscale_1x128x128_256x128x128x128_16x16_32x32_2x2_8x32x1_8x32x1_1x32x1x8_8_1x1_intrawave_v3,906.07,239.37,0.0
gfx942,304,48768,5120,2048,ck,0,0,1254.3081,a8w8_blockscale_1x128x128_256x128x128x128_16x16_32x32_2x2_8x32x1_8x32x1_1x32x1x8_8_1x1_intrawave_v3,815.38,486.12,0.0
gfx942,304,48768,5120,6400,ck,0,0,3511.5487,a8w8_blockscale_1x128x128_256x128x128x128_16x16_32x32_2x2_8x32x1_8x32x1_1x32x1x8_8_1x1_intrawave_v3,910.16,240.43,0.0
gfx942,304,48896,5120,2048,ck,0,0,1253.3271,a8w8_blockscale_1x128x128_256x128x128x128_16x16_32x32_2x2_8x32x1_8x32x1_1x32x1x8_8_1x1_intrawave_v3,818.16,487.76,0.0
gfx942,304,48896,5120,6400,ck,0,0,3510.6721,a8w8_blockscale_1x128x128_256x128x128x128_16x16_32x32_2x2_8x32x1_8x32x1_1x32x1x8_8_1x1_intrawave_v3,912.77,241.09,0.0
gfx942,304,49024,5120,2048,ck,0,0,1258.4194,a8w8_blockscale_1x128x128_256x128x128x128_16x16_32x32_2x2_8x32x1_8x32x1_1x32x1x8_8_1x1_intrawave_v3,816.98,487.03,0.0
gfx942,304,49024,5120,6400,ck,0,0,3492.3683,a8w8_blockscale_1x128x128_256x128x128x128_16x16_32x32_2x2_8x32x1_8x32x1_1x32x1x8_8_1x1_intrawave_v3,919.96,242.97,0.0
gfx942,304,49152,5120,2048,ck,0,0,1262.6319,a8w8_blockscale_1x128x128_256x128x128x128_16x16_32x32_2x2_8x32x1_8x32x1_1x32x1x8_8_1x1_intrawave_v3,816.38,486.65,0.0
gfx942,304,49152,5120,6400,ck,0,0,3561.2367,a8w8_blockscale_1x128x128_256x128x128x128_16x16_32x32_2x2_8x32x1_8x32x1_1x32x1x8_8_1x1_intrawave_v3,904.52,238.87,0.0
gfx942,304,49280,5120,2048,ck,0,0,1272.8444,a8w8_blockscale_1x128x128_256x128x128x128_16x16_32x32_2x2_8x32x1_8x32x1_1x32x1x8_8_1x1_intrawave_v3,811.94,483.99,0.0
gfx942,304,49280,5120,6400,ck,0,0,3585.1782,a8w8_blockscale_1x128x128_256x128x128x128_16x16_32x32_2x2_8x32x1_8x32x1_1x32x1x8_8_1x1_intrawave_v3,900.82,237.86,0.0
gfx942,304,49408,5120,2048,ck,0,0,1305.8161,a8w8_blockscale_1x128x128_256x128x128x128_16x16_32x32_2x2_8x32x1_8x32x1_1x32x1x8_8_1x1_intrawave_v3,793.5,472.97,0.0
gfx942,304,49408,5120,6400,ck,0,0,3597.2617,a8w8_blockscale_1x128x128_256x128x128x128_16x16_32x32_2x2_8x32x1_8x32x1_1x32x1x8_8_1x1_intrawave_v3,900.13,237.66,0.0
gfx942,304,49536,5120,2048,ck,0,0,1281.4029,a8w8_blockscale_1x128x128_256x128x128x128_16x16_32x32_2x2_8x32x1_8x32x1_1x32x1x8_8_1x1_intrawave_v3,810.71,483.21,0.0
gfx942,304,49536,5120,6400,ck,0,0,3605.6931,a8w8_blockscale_1x128x128_256x128x128x128_16x16_32x32_2x2_8x32x1_8x32x1_1x32x1x8_8_1x1_intrawave_v3,900.35,237.69,0.0
gfx942,304,49664,5120,2048,ck,0,0,1265.2157,a8w8_blockscale_1x128x128_256x128x128x128_16x16_32x32_2x2_8x32x1_8x32x1_1x32x1x8_8_1x1_intrawave_v3,823.2,490.63,0.0
gfx942,304,49664,5120,6400,ck,0,0,3692.4722,a8w8_blockscale_1x128x128_256x128x128x128_16x16_32x32_2x2_8x32x1_8x32x1_1x32x1x8_8_1x1_intrawave_v3,881.46,232.68,0.0
gfx942,304,49792,5120,2048,ck,0,0,1310.6516,a8w8_blockscale_1x128x128_256x128x128x128_16x16_32x32_2x2_8x32x1_8x32x1_1x32x1x8_8_1x1_intrawave_v3,796.71,474.82,0.0
gfx942,304,49792,5120,6400,ck,0,0,3623.3811,a8w8_blockscale_1x128x128_256x128x128x128_16x16_32x32_2x2_8x32x1_8x32x1_1x32x1x8_8_1x1_intrawave_v3,900.59,237.71,0.0
gfx942,304,49920,5120,2048,ck,0,0,1312.8133,a8w8_blockscale_1x128x128_256x128x128x128_16x16_32x32_2x2_8x32x1_8x32x1_1x32x1x8_8_1x1_intrawave_v3,797.45,475.24,0.0
gfx942,304,49920,5120,6400,ck,0,0,3718.4494,a8w8_blockscale_1x128x128_256x128x128x128_16x16_32x32_2x2_8x32x1_8x32x1_1x32x1x8_8_1x1_intrawave_v3,879.82,232.2,0.0
gfx942,304,50048,5120,2048,ck,0,0,1288.9569,a8w8_blockscale_1x128x128_256x128x128x128_16x16_32x32_2x2_8x32x1_8x32x1_1x32x1x8_8_1x1_intrawave_v3,814.29,485.26,0.0
gfx942,304,50048,5120,6400,ck,0,0,3725.0925,a8w8_blockscale_1x128x128_256x128x128x128_16x16_32x32_2x2_8x32x1_8x32x1_1x32x1x8_8_1x1_intrawave_v3,880.5,232.36,0.0
gfx942,304,50176,5120,2048,ck,0,0,1300.5929,a8w8_blockscale_1x128x128_256x128x128x128_16x16_32x32_2x2_8x32x1_8x32x1_1x32x1x8_8_1x1_intrawave_v3,809.07,482.13,0.0
gfx942,304,50176,5120,6400,ck,0,0,3610.5928,a8w8_blockscale_1x128x128_256x128x128x128_16x16_32x32_2x2_8x32x1_8x32x1_1x32x1x8_8_1x1_intrawave_v3,910.75,240.32,0.0
gfx942,304,50304,5120,2048,ck,0,0,1331.5652,a8w8_blockscale_1x128x128_256x128x128x128_16x16_32x32_2x2_8x32x1_8x32x1_1x32x1x8_8_1x1_intrawave_v3,792.26,472.09,0.0
gfx942,304,50304,5120,6400,ck,0,0,3657.0765,a8w8_blockscale_1x128x128_256x128x128x128_16x16_32x32_2x2_8x32x1_8x32x1_1x32x1x8_8_1x1_intrawave_v3,901.46,237.85,0.0
gfx942,304,50432,5120,2048,ck,0,0,1320.1339,a8w8_blockscale_1x128x128_256x128x128x128_16x16_32x32_2x2_8x32x1_8x32x1_1x32x1x8_8_1x1_intrawave_v3,801.16,477.37,0.0
gfx942,304,50432,5120,6400,ck,0,0,3627.9439,a8w8_blockscale_1x128x128_256x128x128x128_16x16_32x32_2x2_8x32x1_8x32x1_1x32x1x8_8_1x1_intrawave_v3,911.02,240.34,0.0
gfx942,304,50560,5120,2048,ck,0,0,1295.948,a8w8_blockscale_1x128x128_256x128x128x128_16x16_32x32_2x2_8x32x1_8x32x1_1x32x1x8_8_1x1_intrawave_v3,818.18,487.49,0.0
gfx942,304,50560,5120,6400,ck,0,0,3754.2744,a8w8_blockscale_1x128x128_256x128x128x128_16x16_32x32_2x2_8x32x1_8x32x1_1x32x1x8_8_1x1_intrawave_v3,882.59,232.82,0.0
gfx942,304,50688,5120,2048,ck,0,0,1300.2412,a8w8_blockscale_1x128x128_256x128x128x128_16x16_32x32_2x2_8x32x1_8x32x1_1x32x1x8_8_1x1_intrawave_v3,817.54,487.09,0.0
gfx942,304,50688,5120,6400,ck,0,0,3773.2812,a8w8_blockscale_1x128x128_256x128x128x128_16x16_32x32_2x2_8x32x1_8x32x1_1x32x1x8_8_1x1_intrawave_v3,880.37,232.22,0.0
gfx942,304,50816,5120,2048,ck,0,0,1304.5285,a8w8_blockscale_1x128x128_256x128x128x128_16x16_32x32_2x2_8x32x1_8x32x1_1x32x1x8_8_1x1_intrawave_v3,816.91,486.7,0.0
gfx942,304,50816,5120,6400,ck,0,0,3684.6221,a8w8_blockscale_1x128x128_256x128x128x128_16x16_32x32_2x2_8x32x1_8x32x1_1x32x1x8_8_1x1_intrawave_v3,903.83,238.38,0.0
gfx942,304,50944,5120,2048,ck,0,0,1314.1295,a8w8_blockscale_1x128x128_256x128x128x128_16x16_32x32_2x2_8x32x1_8x32x1_1x32x1x8_8_1x1_intrawave_v3,812.99,484.34,0.0
gfx942,304,50944,5120,6400,ck,0,0,3700.4289,a8w8_blockscale_1x128x128_256x128x128x128_16x16_32x32_2x2_8x32x1_8x32x1_1x32x1x8_8_1x1_intrawave_v3,902.24,237.94,0.0
gfx942,304,51072,5120,2048,ck,0,0,1337.5619,a8w8_blockscale_1x128x128_256x128x128x128_16x16_32x32_2x2_8x32x1_8x32x1_1x32x1x8_8_1x1_intrawave_v3,800.75,477.03,0.0
gfx942,304,51072,5120,6400,ck,0,0,3710.8748,a8w8_blockscale_1x128x128_256x128x128x128_16x16_32x32_2x2_8x32x1_8x32x1_1x32x1x8_8_1x1_intrawave_v3,901.96,237.84,0.0
