aiter/configs/model_configs/a8w8_blockscale_tuned_gemm_qwen3_vl_235b_tp2.csv
gfx,cu_num,M,N,K,libtype,kernelId,splitK,us,kernelName,tflops,bw,errRatio
gfx942,304,16,4096,4096,ck,8,0,15.537,a8w8_blockscale_1x128x128_256x16x64x256_16x16_16x16_1x1_16x16x1_16x16x1_1x16x1x16_4_1x1_intrawave_v1,34.55,1092.48,0.0
gfx942,304,32,4096,4096,ck,8,0,15.6443,a8w8_blockscale_1x128x128_256x16x64x256_16x16_16x16_1x1_16x16x1_16x16x1_1x16x1x16_4_1x1_intrawave_v1,68.63,1097.55,0.0
gfx942,304,48,4096,4096,ck,8,0,15.481,a8w8_blockscale_1x128x128_256x16x64x256_16x16_16x16_1x1_16x16x1_16x16x1_1x16x1x16_4_1x1_intrawave_v1,104.04,1121.83,0.0
gfx942,304,64,4096,4096,ck,8,0,15.5985,a8w8_blockscale_1x128x128_256x16x64x256_16x16_16x16_1x1_16x16x1_16x16x1_1x16x1x16_4_1x1_intrawave_v1,137.67,1125.98,0.0
gfx942,304,80,4096,4096,ck,18,0,20.2729,a8w8_blockscale_1x128x128_256x64x64x256_16x16_32x32_1x1_16x16x1_16x16x1_1x32x1x8_8_1x1_intrawave_v1,132.41,876.06,0.0
gfx942,304,96,4096,4096,ck,18,0,19.9242,a8w8_blockscale_1x128x128_256x64x64x256_16x16_32x32_1x1_16x16x1_16x16x1_1x32x1x8_8_1x1_intrawave_v1,161.67,901.26,0.0
gfx942,304,112,4096,4096,ck,18,0,20.2901,a8w8_blockscale_1x128x128_256x64x64x256_16x16_32x32_1x1_16x16x1_16x16x1_1x32x1x8_8_1x1_intrawave_v1,185.22,894.7,0.0
gfx942,304,128,4096,4096,ck,18,0,19.2353,a8w8_blockscale_1x128x128_256x64x64x256_16x16_32x32_1x1_16x16x1_16x16x1_1x32x1x8_8_1x1_intrawave_v1,223.29,953.98,0.0
gfx942,304,144,4096,4096,ck,18,0,21.5347,a8w8_blockscale_1x128x128_256x64x64x256_16x16_32x32_1x1_16x16x1_16x16x1_1x32x1x8_8_1x1_intrawave_v1,224.37,861.25,0.0
gfx942,304,160,4096,4096,ck,18,0,21.5239,a8w8_blockscale_1x128x128_256x64x64x256_16x16_32x32_1x1_16x16x1_16x16x1_1x32x1x8_8_1x1_intrawave_v1,249.43,870.81,0.0
gfx942,304,176,4096,4096,ck,18,0,22.0314,a8w8_blockscale_1x128x128_256x64x64x256_16x16_32x32_1x1_16x16x1_16x16x1_1x32x1x8_8_1x1_intrawave_v1,268.05,859.68,0.0
gfx942,304,192,4096,4096,ck,18,0,20.9671,a8w8_blockscale_1x128x128_256x64x64x256_16x16_32x32_1x1_16x16x1_16x16x1_1x32x1x8_8_1x1_intrawave_v1,307.26,912.69,0.0
gfx942,304,208,4096,4096,ck,18,0,24.8661,a8w8_blockscale_1x128x128_256x64x64x256_16x16_32x32_1x1_16x16x1_16x16x1_1x32x1x8_8_1x1_intrawave_v1,280.68,777.49,0.0
gfx942,304,224,4096,4096,ck,18,0,25.5724,a8w8_blockscale_1x128x128_256x64x64x256_16x16_32x32_1x1_16x16x1_16x16x1_1x32x1x8_8_1x1_intrawave_v1,293.92,763.7,0.0
gfx942,304,240,4096,4096,ck,18,0,25.6793,a8w8_blockscale_1x128x128_256x64x64x256_16x16_32x32_1x1_16x16x1_16x16x1_1x32x1x8_8_1x1_intrawave_v1,313.6,768.18,0.0
gfx942,304,256,4096,4096,ck,18,0,24.5733,a8w8_blockscale_1x128x128_256x64x64x256_16x16_32x32_1x1_16x16x1_16x16x1_1x32x1x8_8_1x1_intrawave_v1,349.56,810.76,0.0
gfx942,304,288,4096,4096,ck,12,0,31.8041,a8w8_blockscale_1x128x128_256x32x128x256_16x16_32x32_1x1_16x16x1_16x16x1_1x32x1x8_8_1x1_intrawave_v1,303.85,638.79,0.0
gfx942,304,320,4096,4096,ck,2,0,39.2756,a8w8_blockscale_1x128x128_256x64x128x128_16x16_32x32_1x2_8x32x1_8x32x1_1x32x1x8_8_1x1_intrawave_v3,273.39,527.28,0.0
gfx942,304,352,4096,4096,ck,2,0,35.8068,a8w8_blockscale_1x128x128_256x64x128x128_16x16_32x32_1x2_8x32x1_8x32x1_1x32x1x8_8_1x1_intrawave_v3,329.86,589.35,0.0
gfx942,304,384,4096,4096,ck,3,0,40.6678,a8w8_blockscale_1x128x128_256x64x64x128_16x16_32x32_1x1_8x32x1_8x32x1_1x32x1x8_8_1x1_intrawave_v3,316.83,528.57,0.0
gfx942,304,416,4096,4096,ck,2,0,36.1635,a8w8_blockscale_1x128x128_256x64x128x128_16x16_32x32_1x2_8x32x1_8x32x1_1x32x1x8_8_1x1_intrawave_v3,385.99,605.28,0.0
gfx942,304,448,4096,4096,ck,2,0,40.5099,a8w8_blockscale_1x128x128_256x64x128x128_16x16_32x32_1x2_8x32x1_8x32x1_1x32x1x8_8_1x1_intrawave_v3,371.08,550.04,0.0
gfx942,304,480,4096,4096,ck,2,0,39.1026,a8w8_blockscale_1x128x128_256x64x128x128_16x16_32x32_1x2_8x32x1_8x32x1_1x32x1x8_8_1x1_intrawave_v3,411.89,579.9,0.0
gfx942,304,512,4096,4096,ck,3,0,42.1807,a8w8_blockscale_1x128x128_256x64x64x128_16x16_32x32_1x1_8x32x1_8x32x1_1x32x1x8_8_1x1_intrawave_v3,407.29,546.9,0.0
gfx942,304,544,4096,4096,ck,2,0,42.1861,a8w8_blockscale_1x128x128_256x64x128x128_16x16_32x32_1x2_8x32x1_8x32x1_1x32x1x8_8_1x1_intrawave_v3,432.69,556.15,0.0
gfx942,304,576,4096,4096,ck,2,0,44.2925,a8w8_blockscale_1x128x128_256x64x128x128_16x16_32x32_1x2_8x32x1_8x32x1_1x32x1x8_8_1x1_intrawave_v3,436.36,538.58,0.0
gfx942,304,608,4096,4096,ck,0,0,52.1861,a8w8_blockscale_1x128x128_256x128x128x128_16x16_32x32_2x2_8x32x1_8x32x1_1x32x1x8_8_1x1_intrawave_v3,390.93,464.65,0.0
gfx942,304,640,4096,4096,ck,0,0,57.5993,a8w8_blockscale_1x128x128_256x128x128x128_16x16_32x32_2x2_8x32x1_8x32x1_1x32x1x8_8_1x1_intrawave_v3,372.83,427.81,0.0
gfx942,304,672,4096,4096,ck,0,0,51.7959,a8w8_blockscale_1x128x128_256x128x128x128_16x16_32x32_2x2_8x32x1_8x32x1_1x32x1x8_8_1x1_intrawave_v3,435.34,483.33,0.0
gfx942,304,704,4096,4096,ck,0,0,52.1528,a8w8_blockscale_1x128x128_256x128x128x128_16x16_32x32_2x2_8x32x1_8x32x1_1x32x1x8_8_1x1_intrawave_v3,452.94,487.57,0.0
gfx942,304,736,4096,4096,ck,0,0,53.9167,a8w8_blockscale_1x128x128_256x128x128x128_16x16_32x32_2x2_8x32x1_8x32x1_1x32x1x8_8_1x1_intrawave_v3,458.04,478.91,0.0
gfx942,304,768,4096,4096,ck,0,0,58.7623,a8w8_blockscale_1x128x128_256x128x128x128_16x16_32x32_2x2_8x32x1_8x32x1_1x32x1x8_8_1x1_intrawave_v3,438.54,446.11,0.0
gfx942,304,800,4096,4096,ck,0,0,55.9882,a8w8_blockscale_1x128x128_256x128x128x128_16x16_32x32_2x2_8x32x1_8x32x1_1x32x1x8_8_1x1_intrawave_v3,479.45,475.24,0.0
gfx942,304,832,4096,4096,ck,0,0,56.0835,a8w8_blockscale_1x128x128_256x128x128x128_16x16_32x32_2x2_8x32x1_8x32x1_1x32x1x8_8_1x1_intrawave_v3,497.78,481.44,0.0
gfx942,304,864,4096,4096,ck,0,0,55.9737,a8w8_blockscale_1x128x128_256x128x128x128_16x16_32x32_2x2_8x32x1_8x32x1_1x32x1x8_8_1x1_intrawave_v3,517.94,489.41,0.0
gfx942,304,896,4096,4096,ck,2,0,61.0387,a8w8_blockscale_1x128x128_256x64x128x128_16x16_32x32_1x2_8x32x1_8x32x1_1x32x1x8_8_1x1_intrawave_v3,492.55,455.24,0.0
gfx942,304,928,4096,4096,ck,0,0,56.5834,a8w8_blockscale_1x128x128_256x128x128x128_16x16_32x32_2x2_8x32x1_8x32x1_1x32x1x8_8_1x1_intrawave_v3,550.31,498.03,0.0
gfx942,304,960,4096,4096,ck,0,0,58.554,a8w8_blockscale_1x128x128_256x128x128x128_16x16_32x32_2x2_8x32x1_8x32x1_1x32x1x8_8_1x1_intrawave_v3,550.13,487.99,0.0
gfx942,304,992,4096,4096,ck,0,0,59.2654,a8w8_blockscale_1x128x128_256x128x128x128_16x16_32x32_2x2_8x32x1_8x32x1_1x32x1x8_8_1x1_intrawave_v3,561.64,488.77,0.0
gfx942,304,1024,4096,4096,ck,0,0,63.7009,a8w8_blockscale_1x128x128_256x128x128x128_16x16_32x32_2x2_8x32x1_8x32x1_1x32x1x8_8_1x1_intrawave_v3,539.39,460.91,0.0
gfx942,304,1088,4096,4096,ck,0,0,62.3129,a8w8_blockscale_1x128x128_256x128x128x128_16x16_32x32_2x2_8x32x1_8x32x1_1x32x1x8_8_1x1_intrawave_v3,585.87,483.79,0.0
gfx942,304,1152,4096,4096,ck,0,0,64.9562,a8w8_blockscale_1x128x128_256x128x128x128_16x16_32x32_2x2_8x32x1_8x32x1_1x32x1x8_8_1x1_intrawave_v3,595.09,476.21,0.0
gfx942,304,1216,4096,4096,ck,2,0,72.412,a8w8_blockscale_1x128x128_256x64x128x128_16x16_32x32_1x2_8x32x1_8x32x1_1x32x1x8_8_1x1_intrawave_v3,563.47,438.04,0.0
gfx942,304,1280,4096,4096,ck,0,0,87.4022,a8w8_blockscale_1x128x128_256x128x128x128_16x16_32x32_2x2_8x32x1_8x32x1_1x32x1x8_8_1x1_intrawave_v3,491.4,371.91,0.0
gfx942,304,1344,4096,4096,ck,0,0,84.0963,a8w8_blockscale_1x128x128_256x128x128x128_16x16_32x32_2x2_8x32x1_8x32x1_1x32x1x8_8_1x1_intrawave_v3,536.26,395.88,0.0
gfx942,304,1408,4096,4096,ck,0,0,85.4987,a8w8_blockscale_1x128x128_256x128x128x128_16x16_32x32_2x2_8x32x1_8x32x1_1x32x1x8_8_1x1_intrawave_v3,552.58,398.59,0.0
gfx942,304,1472,4096,4096,ck,0,0,83.7787,a8w8_blockscale_1x128x128_256x128x128x128_16x16_32x32_2x2_8x32x1_8x32x1_1x32x1x8_8_1x1_intrawave_v3,589.55,416.16,0.0
gfx942,304,1536,4096,4096,ck,0,0,86.0246,a8w8_blockscale_1x128x128_256x128x128x128_16x16_32x32_2x2_8x32x1_8x32x1_1x32x1x8_8_1x1_intrawave_v3,599.13,414.43,0.0
gfx942,304,1600,4096,4096,ck,0,0,88.7799,a8w8_blockscale_1x128x128_256x128x128x128_16x16_32x32_2x2_8x32x1_8x32x1_1x32x1x8_8_1x1_intrawave_v3,604.72,410.43,0.0
gfx942,304,1664,4096,4096,ck,0,0,91.7409,a8w8_blockscale_1x128x128_256x128x128x128_16x16_32x32_2x2_8x32x1_8x32x1_1x32x1x8_8_1x1_intrawave_v3,608.61,405.76,0.0
gfx942,304,1728,4096,4096,ck,0,0,88.8998,a8w8_blockscale_1x128x128_256x128x128x128_16x16_32x32_2x2_8x32x1_8x32x1_1x32x1x8_8_1x1_intrawave_v3,652.22,427.57,0.0
gfx942,304,1792,4096,4096,ck,0,0,88.1801,a8w8_blockscale_1x128x128_256x128x128x128_16x16_32x32_2x2_8x32x1_8x32x1_1x32x1x8_8_1x1_intrawave_v3,681.89,439.98,0.0
gfx942,304,1856,4096,4096,ck,0,0,94.1404,a8w8_blockscale_1x128x128_256x128x128x128_16x16_32x32_2x2_8x32x1_8x32x1_1x32x1x8_8_1x1_intrawave_v3,661.53,420.48,0.0
gfx942,304,1920,4096,4096,ck,0,0,93.4586,a8w8_blockscale_1x128x128_256x128x128x128_16x16_32x32_2x2_8x32x1_8x32x1_1x32x1x8_8_1x1_intrawave_v3,689.34,431.96,0.0
gfx942,304,1984,4096,4096,ck,0,0,92.8625,a8w8_blockscale_1x128x128_256x128x128x128_16x16_32x32_2x2_8x32x1_8x32x1_1x32x1x8_8_1x1_intrawave_v3,716.89,443.2,0.0
gfx942,304,2048,4096,4096,ck,0,0,94.0344,a8w8_blockscale_1x128x128_256x128x128x128_16x16_32x32_2x2_8x32x1_8x32x1_1x32x1x8_8_1x1_intrawave_v3,730.79,446.04,0.0
gfx942,304,2112,4096,4096,ck,0,0,104.0534,a8w8_blockscale_1x128x128_256x128x128x128_16x16_32x32_2x2_8x32x1_8x32x1_1x32x1x8_8_1x1_intrawave_v3,681.06,410.65,0.0
gfx942,304,2176,4096,4096,ck,0,0,103.8277,a8w8_blockscale_1x128x128_256x128x128x128_16x16_32x32_2x2_8x32x1_8x32x1_1x32x1x8_8_1x1_intrawave_v3,703.23,419.12,0.0
gfx942,304,2240,4096,4096,ck,0,0,106.6763,a8w8_blockscale_1x128x128_256x128x128x128_16x16_32x32_2x2_8x32x1_8x32x1_1x32x1x8_8_1x1_intrawave_v3,704.58,415.3,0.0
gfx942,304,2304,4096,4096,ck,0,0,105.4828,a8w8_blockscale_1x128x128_256x128x128x128_16x16_32x32_2x2_8x32x1_8x32x1_1x32x1x8_8_1x1_intrawave_v3,732.91,427.45,0.0
gfx942,304,2368,4096,4096,ck,0,0,103.1845,a8w8_blockscale_1x128x128_256x128x128x128_16x16_32x32_2x2_8x32x1_8x32x1_1x32x1x8_8_1x1_intrawave_v3,770.05,444.59,0.0
gfx942,304,2432,4096,4096,ck,0,0,111.2275,a8w8_blockscale_1x128x128_256x128x128x128_16x16_32x32_2x2_8x32x1_8x32x1_1x32x1x8_8_1x1_intrawave_v3,733.67,419.52,0.0
gfx942,304,2496,4096,4096,ck,0,0,140.2253,a8w8_blockscale_1x128x128_256x128x128x128_16x16_32x32_2x2_8x32x1_8x32x1_1x32x1x8_8_1x1_intrawave_v3,597.27,338.37,0.0
gfx942,304,2560,4096,4096,ck,0,0,139.1874,a8w8_blockscale_1x128x128_256x128x128x128_16x16_32x32_2x2_8x32x1_8x32x1_1x32x1x8_8_1x1_intrawave_v3,617.15,346.54,0.0
gfx942,304,2624,4096,4096,ck,0,0,138.6207,a8w8_blockscale_1x128x128_256x128x128x128_16x16_32x32_2x2_8x32x1_8x32x1_1x32x1x8_8_1x1_intrawave_v3,635.16,353.63,0.0
gfx942,304,2688,4096,4096,ck,0,0,140.8341,a8w8_blockscale_1x128x128_256x128x128x128_16x16_32x32_2x2_8x32x1_8x32x1_1x32x1x8_8_1x1_intrawave_v3,640.43,353.66,0.0
gfx942,304,2752,4096,4096,ck,0,0,138.4417,a8w8_blockscale_1x128x128_256x128x128x128_16x16_32x32_2x2_8x32x1_8x32x1_1x32x1x8_8_1x1_intrawave_v3,667.01,365.45,0.0
gfx942,304,2816,4096,4096,ck,0,0,142.3848,a8w8_blockscale_1x128x128_256x128x128x128_16x16_32x32_2x2_8x32x1_8x32x1_1x32x1x8_8_1x1_intrawave_v3,663.62,360.85,0.0
gfx942,304,2880,4096,4096,ck,0,0,143.292,a8w8_blockscale_1x128x128_256x128x128x128_16x16_32x32_2x2_8x32x1_8x32x1_1x32x1x8_8_1x1_intrawave_v3,674.4,364.06,0.0
gfx942,304,2944,4096,4096,ck,0,0,139.6084,a8w8_blockscale_1x128x128_256x128x128x128_16x16_32x32_2x2_8x32x1_8x32x1_1x32x1x8_8_1x1_intrawave_v3,707.58,379.3,0.0
gfx942,304,3008,4096,4096,ck,0,0,140.182,a8w8_blockscale_1x128x128_256x128x128x128_16x16_32x32_2x2_8x32x1_8x32x1_1x32x1x8_8_1x1_intrawave_v3,720.0,383.36,0.0
gfx942,304,3072,4096,4096,ck,0,0,142.3961,a8w8_blockscale_1x128x128_256x128x128x128_16x16_32x32_2x2_8x32x1_8x32x1_1x32x1x8_8_1x1_intrawave_v3,723.89,382.92,0.0
gfx942,304,3136,4096,4096,ck,0,0,147.1861,a8w8_blockscale_1x128x128_256x128x128x128_16x16_32x32_2x2_8x32x1_8x32x1_1x32x1x8_8_1x1_intrawave_v3,714.92,375.8,0.0
gfx942,304,3200,4096,4096,ck,0,0,146.6849,a8w8_blockscale_1x128x128_256x128x128x128_16x16_32x32_2x2_8x32x1_8x32x1_1x32x1x8_8_1x1_intrawave_v3,732.01,382.44,0.0
gfx942,304,3264,4096,4096,ck,0,0,148.0267,a8w8_blockscale_1x128x128_256x128x128x128_16x16_32x32_2x2_8x32x1_8x32x1_1x32x1x8_8_1x1_intrawave_v3,739.88,384.29,0.0
gfx942,304,3328,4096,4096,ck,0,0,152.2472,a8w8_blockscale_1x128x128_256x128x128x128_16x16_32x32_2x2_8x32x1_8x32x1_1x32x1x8_8_1x1_intrawave_v3,733.47,378.8,0.0
gfx942,304,3392,4096,4096,ck,0,0,152.9048,a8w8_blockscale_1x128x128_256x128x128x128_16x16_32x32_2x2_8x32x1_8x32x1_1x32x1x8_8_1x1_intrawave_v3,744.36,382.32,0.0
gfx942,304,3456,4096,4096,ck,0,0,152.192,a8w8_blockscale_1x128x128_256x128x128x128_16x16_32x32_2x2_8x32x1_8x32x1_1x32x1x8_8_1x1_intrawave_v3,761.96,389.28,0.0
gfx942,304,3520,4096,4096,ck,0,0,155.8725,a8w8_blockscale_1x128x128_256x128x128x128_16x16_32x32_2x2_8x32x1_8x32x1_1x32x1x8_8_1x1_intrawave_v3,757.74,385.13,0.0
gfx942,304,3584,4096,4096,ck,0,0,158.3493,a8w8_blockscale_1x128x128_256x128x128x128_16x16_32x32_2x2_8x32x1_8x32x1_1x32x1x8_8_1x1_intrawave_v3,759.45,384.07,0.0
gfx942,304,3648,4096,4096,ck,0,0,175.3817,a8w8_blockscale_1x128x128_256x128x128x128_16x16_32x32_2x2_8x32x1_8x32x1_1x32x1x8_8_1x1_intrawave_v3,697.94,351.26,0.0
gfx942,304,3712,4096,4096,ck,0,0,177.8622,a8w8_blockscale_1x128x128_256x128x128x128_16x16_32x32_2x2_8x32x1_8x32x1_1x32x1x8_8_1x1_intrawave_v3,700.28,350.78,0.0
gfx942,304,3776,4096,4096,ck,0,0,179.8027,a8w8_blockscale_1x128x128_256x128x128x128_16x16_32x32_2x2_8x32x1_8x32x1_1x32x1x8_8_1x1_intrawave_v3,704.67,351.37,0.0
gfx942,304,3840,4096,4096,ck,0,0,177.2812,a8w8_blockscale_1x128x128_256x128x128x128_16x16_32x32_2x2_8x32x1_8x32x1_1x32x1x8_8_1x1_intrawave_v3,726.81,360.8,0.0
gfx942,304,3904,4096,4096,ck,0,0,178.3565,a8w8_blockscale_1x128x128_256x128x128x128_16x16_32x32_2x2_8x32x1_8x32x1_1x32x1x8_8_1x1_intrawave_v3,734.46,363.03,0.0
gfx942,304,3968,4096,4096,ck,0,0,179.1119,a8w8_blockscale_1x128x128_256x128x128x128_16x16_32x32_2x2_8x32x1_8x32x1_1x32x1x8_8_1x1_intrawave_v3,743.36,365.89,0.0
gfx942,304,4032,4096,4096,ck,0,0,177.558,a8w8_blockscale_1x128x128_256x128x128x128_16x16_32x32_2x2_8x32x1_8x32x1_1x32x1x8_8_1x1_intrawave_v3,761.96,373.53,0.0
gfx942,304,4096,4096,4096,ck,0,0,182.6582,a8w8_blockscale_1x128x128_256x128x128x128_16x16_32x32_2x2_8x32x1_8x32x1_1x32x1x8_8_1x1_intrawave_v3,752.44,367.4,0.0
gfx942,304,4224,4096,4096,ck,0,0,188.2589,a8w8_blockscale_1x128x128_256x128x128x128_16x16_32x32_2x2_8x32x1_8x32x1_1x32x1x8_8_1x1_intrawave_v3,752.87,364.83,0.0
gfx942,304,4352,4096,4096,ck,0,0,191.0806,a8w8_blockscale_1x128x128_256x128x128x128_16x16_32x32_2x2_8x32x1_8x32x1_1x32x1x8_8_1x1_intrawave_v3,764.23,367.67,0.0
gfx942,304,4480,4096,4096,ck,0,0,195.0464,a8w8_blockscale_1x128x128_256x128x128x128_16x16_32x32_2x2_8x32x1_8x32x1_1x32x1x8_8_1x1_intrawave_v3,770.71,368.26,0.0
gfx942,304,4608,4096,4096,ck,0,0,200.2305,a8w8_blockscale_1x128x128_256x128x128x128_16x16_32x32_2x2_8x32x1_8x32x1_1x32x1x8_8_1x1_intrawave_v3,772.2,366.58,0.0
gfx942,304,4736,4096,4096,ck,0,0,202.4853,a8w8_blockscale_1x128x128_256x128x128x128_16x16_32x32_2x2_8x32x1_8x32x1_1x32x1x8_8_1x1_intrawave_v3,784.82,370.26,0.0
gfx942,304,4864,4096,4096,ck,0,0,205.6435,a8w8_blockscale_1x128x128_256x128x128x128_16x16_32x32_2x2_8x32x1_8x32x1_1x32x1x8_8_1x1_intrawave_v3,793.65,372.23,0.0
gfx942,304,4992,4096,4096,ck,0,0,228.7846,a8w8_blockscale_1x128x128_256x128x128x128_16x16_32x32_2x2_8x32x1_8x32x1_1x32x1x8_8_1x1_intrawave_v3,732.15,341.45,0.0
gfx942,304,5120,4096,4096,ck,0,0,227.3109,a8w8_blockscale_1x128x128_256x128x128x128_16x16_32x32_2x2_8x32x1_8x32x1_1x32x1x8_8_1x1_intrawave_v3,755.79,350.58,0.0
gfx942,304,5248,4096,4096,ck,0,0,231.9592,a8w8_blockscale_1x128x128_256x128x128x128_16x16_32x32_2x2_8x32x1_8x32x1_1x32x1x8_8_1x1_intrawave_v3,759.16,350.34,0.0
gfx942,304,5376,4096,4096,ck,0,0,232.165,a8w8_blockscale_1x128x128_256x128x128x128_16x16_32x32_2x2_8x32x1_8x32x1_1x32x1x8_8_1x1_intrawave_v3,776.98,356.8,0.0
gfx942,304,5504,4096,4096,ck,0,0,235.0904,a8w8_blockscale_1x128x128_256x128x128x128_16x16_32x32_2x2_8x32x1_8x32x1_1x32x1x8_8_1x1_intrawave_v3,785.59,359.05,0.0
gfx942,304,5632,4096,4096,ck,0,0,237.0473,a8w8_blockscale_1x128x128_256x128x128x128_16x16_32x32_2x2_8x32x1_8x32x1_1x32x1x8_8_1x1_intrawave_v3,797.22,362.73,0.0
gfx942,304,5760,4096,4096,ck,0,0,245.5132,a8w8_blockscale_1x128x128_256x128x128x128_16x16_32x32_2x2_8x32x1_8x32x1_1x32x1x8_8_1x1_intrawave_v3,787.22,356.62,0.0
gfx942,304,5888,4096,4096,ck,0,0,245.1665,a8w8_blockscale_1x128x128_256x128x128x128_16x16_32x32_2x2_8x32x1_8x32x1_1x32x1x8_8_1x1_intrawave_v3,805.85,363.54,0.0
gfx942,304,6016,4096,4096,ck,0,0,252.7031,a8w8_blockscale_1x128x128_256x128x128x128_16x16_32x32_2x2_8x32x1_8x32x1_1x32x1x8_8_1x1_intrawave_v3,798.82,358.93,0.0
gfx942,304,6144,4096,4096,ck,0,0,265.899,a8w8_blockscale_1x128x128_256x128x128x128_16x16_32x32_2x2_8x32x1_8x32x1_1x32x1x8_8_1x1_intrawave_v3,775.33,347.03,0.0
gfx942,304,6272,4096,4096,ck,0,0,274.888,a8w8_blockscale_1x128x128_256x128x128x128_16x16_32x32_2x2_8x32x1_8x32x1_1x32x1x8_8_1x1_intrawave_v3,765.6,341.4,0.0
gfx942,304,6400,4096,4096,ck,0,0,281.8666,a8w8_blockscale_1x128x128_256x128x128x128_16x16_32x32_2x2_8x32x1_8x32x1_1x32x1x8_8_1x1_intrawave_v3,761.88,338.53,0.0
gfx942,304,6528,4096,4096,ck,0,0,281.823,a8w8_blockscale_1x128x128_256x128x128x128_16x16_32x32_2x2_8x32x1_8x32x1_1x32x1x8_8_1x1_intrawave_v3,777.24,344.16,0.0
gfx942,304,6656,4096,4096,ck,0,0,281.0002,a8w8_blockscale_1x128x128_256x128x128x128_16x16_32x32_2x2_8x32x1_8x32x1_1x32x1x8_8_1x1_intrawave_v3,794.8,350.77,0.0
gfx942,304,6784,4096,4096,ck,0,0,286.0724,a8w8_blockscale_1x128x128_256x128x128x128_16x16_32x32_2x2_8x32x1_8x32x1_1x32x1x8_8_1x1_intrawave_v3,795.72,350.05,0.0
gfx942,304,6912,4096,4096,ck,0,0,296.8582,a8w8_blockscale_1x128x128_256x128x128x128_16x16_32x32_2x2_8x32x1_8x32x1_1x32x1x8_8_1x1_intrawave_v3,781.28,342.63,0.0
gfx942,304,7040,4096,4096,ck,0,0,286.1235,a8w8_blockscale_1x128x128_256x128x128x128_16x16_32x32_2x2_8x32x1_8x32x1_1x32x1x8_8_1x1_intrawave_v3,825.6,360.98,0.0
gfx942,304,7168,4096,4096,ck,0,0,298.3299,a8w8_blockscale_1x128x128_256x128x128x128_16x16_32x32_2x2_8x32x1_8x32x1_1x32x1x8_8_1x1_intrawave_v3,806.22,351.48,0.0
gfx942,304,7296,4096,4096,ck,0,0,299.3326,a8w8_blockscale_1x128x128_256x128x128x128_16x16_32x32_2x2_8x32x1_8x32x1_1x32x1x8_8_1x1_intrawave_v3,817.86,355.56,0.0
gfx942,304,7424,4096,4096,ck,0,0,318.5523,a8w8_blockscale_1x128x128_256x128x128x128_16x16_32x32_2x2_8x32x1_8x32x1_1x32x1x8_8_1x1_intrawave_v3,782.0,339.04,0.0
gfx942,304,7552,4096,4096,ck,0,0,320.9765,a8w8_blockscale_1x128x128_256x128x128x128_16x16_32x32_2x2_8x32x1_8x32x1_1x32x1x8_8_1x1_intrawave_v3,789.48,341.38,0.0
gfx942,304,7680,4096,4096,ck,0,0,325.6618,a8w8_blockscale_1x128x128_256x128x128x128_16x16_32x32_2x2_8x32x1_8x32x1_1x32x1x8_8_1x1_intrawave_v3,791.31,341.3,0.0
gfx942,304,7808,4096,4096,ck,0,0,333.7727,a8w8_blockscale_1x128x128_256x128x128x128_16x16_32x32_2x2_8x32x1_8x32x1_1x32x1x8_8_1x1_intrawave_v3,784.94,337.72,0.0
gfx942,304,7936,4096,4096,ck,0,0,331.5005,a8w8_blockscale_1x128x128_256x128x128x128_16x16_32x32_2x2_8x32x1_8x32x1_1x32x1x8_8_1x1_intrawave_v3,803.28,344.78,0.0
gfx942,304,8064,4096,4096,ck,0,0,335.8743,a8w8_blockscale_1x128x128_256x128x128x128_16x16_32x32_2x2_8x32x1_8x32x1_1x32x1x8_8_1x1_intrawave_v3,805.61,344.97,0.0
gfx942,304,8192,4096,4096,ck,0,0,333.8404,a8w8_blockscale_1x128x128_256x128x128x128_16x16_32x32_2x2_8x32x1_8x32x1_1x32x1x8_8_1x1_intrawave_v3,823.38,351.79,0.0
gfx942,304,8320,4096,4096,ck,0,0,339.1027,a8w8_blockscale_1x128x128_256x128x128x128_16x16_32x32_2x2_8x32x1_8x32x1_1x32x1x8_8_1x1_intrawave_v3,823.27,350.97,0.0
gfx942,304,8448,4096,4096,ck,0,0,344.3156,a8w8_blockscale_1x128x128_256x128x128x128_16x16_32x32_2x2_8x32x1_8x32x1_1x32x1x8_8_1x1_intrawave_v3,823.28,350.22,0.0
gfx942,304,8576,4096,4096,ck,0,0,360.8177,a8w8_blockscale_1x128x128_256x128x128x128_16x16_32x32_2x2_8x32x1_8x32x1_1x32x1x8_8_1x1_intrawave_v3,797.53,338.56,0.0
gfx942,304,8704,4096,4096,ck,0,0,362.3507,a8w8_blockscale_1x128x128_256x128x128x128_16x16_32x32_2x2_8x32x1_8x32x1_1x32x1x8_8_1x1_intrawave_v3,806.01,341.47,0.0
gfx942,304,8832,4096,4096,ck,0,0,375.9387,a8w8_blockscale_1x128x128_256x128x128x128_16x16_32x32_2x2_8x32x1_8x32x1_1x32x1x8_8_1x1_intrawave_v3,788.3,333.31,0.0
gfx942,304,8960,4096,4096,ck,0,0,378.1723,a8w8_blockscale_1x128x128_256x128x128x128_16x16_32x32_2x2_8x32x1_8x32x1_1x32x1x8_8_1x1_intrawave_v3,795.0,335.5,0.0
gfx942,304,9088,4096,4096,ck,0,0,374.7317,a8w8_blockscale_1x128x128_256x128x128x128_16x16_32x32_2x2_8x32x1_8x32x1_1x32x1x8_8_1x1_intrawave_v3,813.76,342.78,0.0
gfx942,304,9216,4096,4096,ck,0,0,378.8146,a8w8_blockscale_1x128x128_256x128x128x128_16x16_32x32_2x2_8x32x1_8x32x1_1x32x1x8_8_1x1_intrawave_v3,816.33,343.24,0.0
gfx942,304,9344,4096,4096,ck,0,0,386.9282,a8w8_blockscale_1x128x128_256x128x128x128_16x16_32x32_2x2_8x32x1_8x32x1_1x32x1x8_8_1x1_intrawave_v3,810.31,340.11,0.0
gfx942,304,9472,4096,4096,ck,0,0,390.1658,a8w8_blockscale_1x128x128_256x128x128x128_16x16_32x32_2x2_8x32x1_8x32x1_1x32x1x8_8_1x1_intrawave_v3,814.6,341.31,0.0
gfx942,304,9600,4096,4096,ck,0,0,393.3161,a8w8_blockscale_1x128x128_256x128x128x128_16x16_32x32_2x2_8x32x1_8x32x1_1x32x1x8_8_1x1_intrawave_v3,818.99,342.58,0.0
gfx942,304,9728,4096,4096,ck,0,0,401.0329,a8w8_blockscale_1x128x128_256x128x128x128_16x16_32x32_2x2_8x32x1_8x32x1_1x32x1x8_8_1x1_intrawave_v3,813.94,339.91,0.0
gfx942,304,9856,4096,4096,ck,0,0,412.4544,a8w8_blockscale_1x128x128_256x128x128x128_16x16_32x32_2x2_8x32x1_8x32x1_1x32x1x8_8_1x1_intrawave_v3,801.82,334.31,0.0
gfx942,304,9984,4096,4096,ck,0,0,420.4362,a8w8_blockscale_1x128x128_256x128x128x128_16x16_32x32_2x2_8x32x1_8x32x1_1x32x1x8_8_1x1_intrawave_v3,796.81,331.7,0.0
gfx942,304,10112,4096,4096,ck,0,0,422.795,a8w8_blockscale_1x128x128_256x128x128x128_16x16_32x32_2x2_8x32x1_8x32x1_1x32x1x8_8_1x1_intrawave_v3,802.52,333.57,0.0
gfx942,304,10240,4096,4096,ck,0,0,423.0339,a8w8_blockscale_1x128x128_256x128x128x128_16x16_32x32_2x2_8x32x1_8x32x1_1x32x1x8_8_1x1_intrawave_v3,812.22,337.1,0.0
gfx942,304,10368,4096,4096,ck,0,0,433.0614,a8w8_blockscale_1x128x128_256x128x128x128_16x16_32x32_2x2_8x32x1_8x32x1_1x32x1x8_8_1x1_intrawave_v3,803.33,332.93,0.0
gfx942,304,10496,4096,4096,ck,0,0,435.2805,a8w8_blockscale_1x128x128_256x128x128x128_16x16_32x32_2x2_8x32x1_8x32x1_1x32x1x8_8_1x1_intrawave_v3,809.1,334.85,0.0
gfx942,304,10624,4096,4096,ck,0,0,434.4243,a8w8_blockscale_1x128x128_256x128x128x128_16x16_32x32_2x2_8x32x1_8x32x1_1x32x1x8_8_1x1_intrawave_v3,820.59,339.13,0.0
gfx942,304,10752,4096,4096,ck,0,0,436.7199,a8w8_blockscale_1x128x128_256x128x128x128_16x16_32x32_2x2_8x32x1_8x32x1_1x32x1x8_8_1x1_intrawave_v3,826.11,340.95,0.0
gfx942,304,10880,4096,4096,ck,0,0,446.7323,a8w8_blockscale_1x128x128_256x128x128x128_16x16_32x32_2x2_8x32x1_8x32x1_1x32x1x8_8_1x1_intrawave_v3,817.21,336.83,0.0
gfx942,304,11008,4096,4096,ck,0,0,458.0037,a8w8_blockscale_1x128x128_256x128x128x128_16x16_32x32_2x2_8x32x1_8x32x1_1x32x1x8_8_1x1_intrawave_v3,806.47,331.97,0.0
gfx942,304,11136,4096,4096,ck,0,0,458.6425,a8w8_blockscale_1x128x128_256x128x128x128_16x16_32x32_2x2_8x32x1_8x32x1_1x32x1x8_8_1x1_intrawave_v3,814.71,334.94,0.0
gfx942,304,11264,4096,4096,ck,0,0,470.9909,a8w8_blockscale_1x128x128_256x128x128x128_16x16_32x32_2x2_8x32x1_8x32x1_1x32x1x8_8_1x1_intrawave_v3,802.47,329.5,0.0
gfx942,304,11392,4096,4096,ck,0,0,473.9819,a8w8_blockscale_1x128x128_256x128x128x128_16x16_32x32_2x2_8x32x1_8x32x1_1x32x1x8_8_1x1_intrawave_v3,806.47,330.73,0.0
gfx942,304,11520,4096,4096,ck,0,0,472.8725,a8w8_blockscale_1x128x128_256x128x128x128_16x16_32x32_2x2_8x32x1_8x32x1_1x32x1x8_8_1x1_intrawave_v3,817.44,334.84,0.0
gfx942,304,11648,4096,4096,ck,0,0,481.4582,a8w8_blockscale_1x128x128_256x128x128x128_16x16_32x32_2x2_8x32x1_8x32x1_1x32x1x8_8_1x1_intrawave_v3,811.79,332.13,0.0
gfx942,304,11776,4096,4096,ck,0,0,487.6816,a8w8_blockscale_1x128x128_256x128x128x128_16x16_32x32_2x2_8x32x1_8x32x1_1x32x1x8_8_1x1_intrawave_v3,810.24,331.12,0.0
gfx942,304,11904,4096,4096,ck,0,0,487.636,a8w8_blockscale_1x128x128_256x128x128x128_16x16_32x32_2x2_8x32x1_8x32x1_1x32x1x8_8_1x1_intrawave_v3,819.12,334.38,0.0
gfx942,304,12032,4096,4096,ck,0,0,496.5666,a8w8_blockscale_1x128x128_256x128x128x128_16x16_32x32_2x2_8x32x1_8x32x1_1x32x1x8_8_1x1_intrawave_v3,813.04,331.53,0.0
gfx942,304,12160,4096,4096,ck,0,0,496.7258,a8w8_blockscale_1x128x128_256x128x128x128_16x16_32x32_2x2_8x32x1_8x32x1_1x32x1x8_8_1x1_intrawave_v3,821.42,334.59,0.0
gfx942,304,12288,4096,4096,ck,0,0,508.4326,a8w8_blockscale_1x128x128_256x128x128x128_16x16_32x32_2x2_8x32x1_8x32x1_1x32x1x8_8_1x1_intrawave_v3,810.96,329.98,0.0
gfx942,304,12416,4096,4096,ck,0,0,508.0609,a8w8_blockscale_1x128x128_256x128x128x128_16x16_32x32_2x2_8x32x1_8x32x1_1x32x1x8_8_1x1_intrawave_v3,820.0,333.32,0.0
gfx942,304,12544,4096,4096,ck,0,0,514.4644,a8w8_blockscale_1x128x128_256x128x128x128_16x16_32x32_2x2_8x32x1_8x32x1_1x32x1x8_8_1x1_intrawave_v3,818.15,332.22,0.0
gfx942,304,12672,4096,4096,ck,0,0,524.7666,a8w8_blockscale_1x128x128_256x128x128x128_16x16_32x32_2x2_8x32x1_8x32x1_1x32x1x8_8_1x1_intrawave_v3,810.27,328.7,0.0
gfx942,304,12800,4096,4096,ck,0,0,521.4691,a8w8_blockscale_1x128x128_256x128x128x128_16x16_32x32_2x2_8x32x1_8x32x1_1x32x1x8_8_1x1_intrawave_v3,823.63,333.79,0.0
gfx942,304,12928,4096,4096,ck,0,0,526.016,a8w8_blockscale_1x128x128_256x128x128x128_16x16_32x32_2x2_8x32x1_8x32x1_1x32x1x8_8_1x1_intrawave_v3,824.67,333.9,0.0
gfx942,304,13056,4096,4096,ck,0,0,531.0465,a8w8_blockscale_1x128x128_256x128x128x128_16x16_32x32_2x2_8x32x1_8x32x1_1x32x1x8_8_1x1_intrawave_v3,824.95,333.7,0.0
gfx942,304,13184,4096,4096,ck,0,0,540.0826,a8w8_blockscale_1x128x128_256x128x128x128_16x16_32x32_2x2_8x32x1_8x32x1_1x32x1x8_8_1x1_intrawave_v3,819.1,331.03,0.0
gfx942,304,13312,4096,4096,ck,0,0,554.3686,a8w8_blockscale_1x128x128_256x128x128x128_16x16_32x32_2x2_8x32x1_8x32x1_1x32x1x8_8_1x1_intrawave_v3,805.74,325.33,0.0
gfx942,304,13440,4096,4096,ck,0,0,547.0813,a8w8_blockscale_1x128x128_256x128x128x128_16x16_32x32_2x2_8x32x1_8x32x1_1x32x1x8_8_1x1_intrawave_v3,824.32,332.54,0.0
gfx942,304,13568,4096,4096,ck,0,0,558.7595,a8w8_blockscale_1x128x128_256x128x128x128_16x16_32x32_2x2_8x32x1_8x32x1_1x32x1x8_8_1x1_intrawave_v3,814.78,328.41,0.0
gfx942,304,13696,4096,4096,ck,0,0,567.0778,a8w8_blockscale_1x128x128_256x128x128x128_16x16_32x32_2x2_8x32x1_8x32x1_1x32x1x8_8_1x1_intrawave_v3,810.4,326.36,0.0
gfx942,304,13824,4096,4096,ck,0,0,565.5711,a8w8_blockscale_1x128x128_256x128x128x128_16x16_32x32_2x2_8x32x1_8x32x1_1x32x1x8_8_1x1_intrawave_v3,820.16,330.01,0.0
gfx942,304,13952,4096,4096,ck,0,0,576.747,a8w8_blockscale_1x128x128_256x128x128x128_16x16_32x32_2x2_8x32x1_8x32x1_1x32x1x8_8_1x1_intrawave_v3,811.71,326.35,0.0
gfx942,304,14080,4096,4096,ck,0,0,570.3618,a8w8_blockscale_1x128x128_256x128x128x128_16x16_32x32_2x2_8x32x1_8x32x1_1x32x1x8_8_1x1_intrawave_v3,828.33,332.76,0.0
gfx942,304,14208,4096,4096,ck,0,0,579.8566,a8w8_blockscale_1x128x128_256x128x128x128_16x16_32x32_2x2_8x32x1_8x32x1_1x32x1x8_8_1x1_intrawave_v3,822.17,330.02,0.0
gfx942,304,14336,4096,4096,ck,0,0,583.466,a8w8_blockscale_1x128x128_256x128x128x128_16x16_32x32_2x2_8x32x1_8x32x1_1x32x1x8_8_1x1_intrawave_v3,824.45,330.68,0.0
gfx942,304,14464,4096,4096,ck,0,0,582.7835,a8w8_blockscale_1x128x128_256x128x128x128_16x16_32x32_2x2_8x32x1_8x32x1_1x32x1x8_8_1x1_intrawave_v3,832.78,333.76,0.0
gfx942,304,14592,4096,4096,ck,0,0,594.7378,a8w8_blockscale_1x128x128_256x128x128x128_16x16_32x32_2x2_8x32x1_8x32x1_1x32x1x8_8_1x1_intrawave_v3,823.26,329.7,0.0
gfx942,304,14720,4096,4096,ck,0,0,617.239,a8w8_blockscale_1x128x128_256x128x128x128_16x16_32x32_2x2_8x32x1_8x32x1_1x32x1x8_8_1x1_intrawave_v3,800.21,320.23,0.0
gfx942,304,14848,4096,4096,ck,0,0,606.0734,a8w8_blockscale_1x128x128_256x128x128x128_16x16_32x32_2x2_8x32x1_8x32x1_1x32x1x8_8_1x1_intrawave_v3,822.04,328.72,0.0
gfx942,304,14976,4096,4096,ck,0,0,617.0055,a8w8_blockscale_1x128x128_256x128x128x128_16x16_32x32_2x2_8x32x1_8x32x1_1x32x1x8_8_1x1_intrawave_v3,814.44,325.45,0.0
gfx942,304,15104,4096,4096,ck,0,0,620.425,a8w8_blockscale_1x128x128_256x128x128x128_16x16_32x32_2x2_8x32x1_8x32x1_1x32x1x8_8_1x1_intrawave_v3,816.87,326.19,0.0
gfx942,304,15232,4096,4096,ck,0,0,620.2751,a8w8_blockscale_1x128x128_256x128x128x128_16x16_32x32_2x2_8x32x1_8x32x1_1x32x1x8_8_1x1_intrawave_v3,823.99,328.8,0.0
gfx942,304,15360,4096,4096,ck,0,0,629.0305,a8w8_blockscale_1x128x128_256x128x128x128_16x16_32x32_2x2_8x32x1_8x32x1_1x32x1x8_8_1x1_intrawave_v3,819.35,326.73,0.0
gfx942,304,15488,4096,4096,ck,0,0,635.37,a8w8_blockscale_1x128x128_256x128x128x128_16x16_32x32_2x2_8x32x1_8x32x1_1x32x1x8_8_1x1_intrawave_v3,817.93,325.94,0.0
gfx942,304,15616,4096,4096,ck,0,0,632.8497,a8w8_blockscale_1x128x128_256x128x128x128_16x16_32x32_2x2_8x32x1_8x32x1_1x32x1x8_8_1x1_intrawave_v3,827.98,329.73,0.0
gfx942,304,15744,4096,4096,ck,0,0,640.3638,a8w8_blockscale_1x128x128_256x128x128x128_16x16_32x32_2x2_8x32x1_8x32x1_1x32x1x8_8_1x1_intrawave_v3,824.97,328.31,0.0
gfx942,304,15872,4096,4096,ck,0,0,639.8093,a8w8_blockscale_1x128x128_256x128x128x128_16x16_32x32_2x2_8x32x1_8x32x1_1x32x1x8_8_1x1_intrawave_v3,832.4,331.06,0.0
gfx942,304,16000,4096,4096,ck,0,0,655.8035,a8w8_blockscale_1x128x128_256x128x128x128_16x16_32x32_2x2_8x32x1_8x32x1_1x32x1x8_8_1x1_intrawave_v3,818.65,325.38,0.0
gfx942,304,16128,4096,4096,ck,0,0,659.1549,a8w8_blockscale_1x128x128_256x128x128x128_16x16_32x32_2x2_8x32x1_8x32x1_1x32x1x8_8_1x1_intrawave_v3,821.0,326.11,0.0
gfx942,304,16256,4096,4096,ck,0,0,656.0444,a8w8_blockscale_1x128x128_256x128x128x128_16x16_32x32_2x2_8x32x1_8x32x1_1x32x1x8_8_1x1_intrawave_v3,831.44,330.06,0.0
gfx942,304,16384,4096,4096,ck,0,0,671.1405,a8w8_blockscale_1x128x128_256x128x128x128_16x16_32x32_2x2_8x32x1_8x32x1_1x32x1x8_8_1x1_intrawave_v3,819.14,324.97,0.0
gfx942,304,16512,4096,4096,ck,0,0,671.9313,a8w8_blockscale_1x128x128_256x128x128x128_16x16_32x32_2x2_8x32x1_8x32x1_1x32x1x8_8_1x1_intrawave_v3,824.56,326.93,0.0
gfx942,304,16640,4096,4096,ck,0,0,679.2493,a8w8_blockscale_1x128x128_256x128x128x128_16x16_32x32_2x2_8x32x1_8x32x1_1x32x1x8_8_1x1_intrawave_v3,822.0,325.73,0.0
gfx942,304,16768,4096,4096,ck,0,0,677.3726,a8w8_blockscale_1x128x128_256x128x128x128_16x16_32x32_2x2_8x32x1_8x32x1_1x32x1x8_8_1x1_intrawave_v3,830.62,328.95,0.0
gfx942,304,16896,4096,4096,ck,0,0,678.8387,a8w8_blockscale_1x128x128_256x128x128x128_16x16_32x32_2x2_8x32x1_8x32x1_1x32x1x8_8_1x1_intrawave_v3,835.16,330.56,0.0
gfx942,304,17024,4096,4096,ck,0,0,689.0411,a8w8_blockscale_1x128x128_256x128x128x128_16x16_32x32_2x2_8x32x1_8x32x1_1x32x1x8_8_1x1_intrawave_v3,829.02,327.95,0.0
gfx942,304,17152,4096,4096,ck,0,0,701.7941,a8w8_blockscale_1x128x128_256x128x128x128_16x16_32x32_2x2_8x32x1_8x32x1_1x32x1x8_8_1x1_intrawave_v3,820.08,324.23,0.0
gfx942,304,17280,4096,4096,ck,0,0,707.3733,a8w8_blockscale_1x128x128_256x128x128x128_16x16_32x32_2x2_8x32x1_8x32x1_1x32x1x8_8_1x1_intrawave_v3,819.68,323.89,0.0
gfx942,304,17408,4096,4096,ck,0,0,711.3992,a8w8_blockscale_1x128x128_256x128x128x128_16x16_32x32_2x2_8x32x1_8x32x1_1x32x1x8_8_1x1_intrawave_v3,821.08,324.27,0.0
gfx942,304,17536,4096,4096,ck,0,0,706.1971,a8w8_blockscale_1x128x128_256x128x128x128_16x16_32x32_2x2_8x32x1_8x32x1_1x32x1x8_8_1x1_intrawave_v3,833.21,328.89,0.0
gfx942,304,17664,4096,4096,ck,0,0,711.9342,a8w8_blockscale_1x128x128_256x128x128x128_16x16_32x32_2x2_8x32x1_8x32x1_1x32x1x8_8_1x1_intrawave_v3,832.53,328.45,0.0
gfx942,304,17792,4096,4096,ck,0,0,733.5339,a8w8_blockscale_1x128x128_256x128x128x128_16x16_32x32_2x2_8x32x1_8x32x1_1x32x1x8_8_1x1_intrawave_v3,813.87,320.92,0.0
gfx942,304,17920,4096,4096,ck,0,0,730.0035,a8w8_blockscale_1x128x128_256x128x128x128_16x16_32x32_2x2_8x32x1_8x32x1_1x32x1x8_8_1x1_intrawave_v3,823.69,324.63,0.0
gfx942,304,18048,4096,4096,ck,0,0,732.8722,a8w8_blockscale_1x128x128_256x128x128x128_16x16_32x32_2x2_8x32x1_8x32x1_1x32x1x8_8_1x1_intrawave_v3,826.32,325.5,0.0
gfx942,304,18176,4096,4096,ck,0,0,738.8862,a8w8_blockscale_1x128x128_256x128x128x128_16x16_32x32_2x2_8x32x1_8x32x1_1x32x1x8_8_1x1_intrawave_v3,825.41,324.98,0.0
gfx942,304,18304,4096,4096,ck,0,0,761.8245,a8w8_blockscale_1x128x128_256x128x128x128_16x16_32x32_2x2_8x32x1_8x32x1_1x32x1x8_8_1x1_intrawave_v3,806.2,317.26,0.0
gfx942,304,18432,4096,4096,ck,0,0,745.6879,a8w8_blockscale_1x128x128_256x128x128x128_16x16_32x32_2x2_8x32x1_8x32x1_1x32x1x8_8_1x1_intrawave_v3,829.4,326.24,0.0
gfx942,304,18560,4096,4096,ck,0,0,759.6098,a8w8_blockscale_1x128x128_256x128x128x128_16x16_32x32_2x2_8x32x1_8x32x1_1x32x1x8_8_1x1_intrawave_v3,819.86,322.33,0.0
gfx942,304,18688,4096,4096,ck,0,0,762.4618,a8w8_blockscale_1x128x128_256x128x128x128_16x16_32x32_2x2_8x32x1_8x32x1_1x32x1x8_8_1x1_intrawave_v3,822.42,323.18,0.0
gfx942,304,18816,4096,4096,ck,0,0,776.4105,a8w8_blockscale_1x128x128_256x128x128x128_16x16_32x32_2x2_8x32x1_8x32x1_1x32x1x8_8_1x1_intrawave_v3,813.18,319.4,0.0
gfx942,304,18944,4096,4096,ck,0,0,769.2953,a8w8_blockscale_1x128x128_256x128x128x128_16x16_32x32_2x2_8x32x1_8x32x1_1x32x1x8_8_1x1_intrawave_v3,826.28,324.4,0.0
gfx942,304,19072,4096,4096,ck,0,0,776.0945,a8w8_blockscale_1x128x128_256x128x128x128_16x16_32x32_2x2_8x32x1_8x32x1_1x32x1x8_8_1x1_intrawave_v3,824.58,323.59,0.0
gfx942,304,19200,4096,4096,ck,0,0,773.8613,a8w8_blockscale_1x128x128_256x128x128x128_16x16_32x32_2x2_8x32x1_8x32x1_1x32x1x8_8_1x1_intrawave_v3,832.51,326.55,0.0
gfx942,304,19328,4096,4096,ck,0,0,784.6476,a8w8_blockscale_1x128x128_256x128x128x128_16x16_32x32_2x2_8x32x1_8x32x1_1x32x1x8_8_1x1_intrawave_v3,826.54,324.07,0.0
gfx942,304,19456,4096,4096,ck,0,0,807.6664,a8w8_blockscale_1x128x128_256x128x128x128_16x16_32x32_2x2_8x32x1_8x32x1_1x32x1x8_8_1x1_intrawave_v3,808.3,316.78,0.0
gfx942,304,19584,4096,4096,ck,0,0,799.6934,a8w8_blockscale_1x128x128_256x128x128x128_16x16_32x32_2x2_8x32x1_8x32x1_1x32x1x8_8_1x1_intrawave_v3,821.73,321.91,0.0
gfx942,304,19712,4096,4096,ck,0,0,799.4064,a8w8_blockscale_1x128x128_256x128x128x128_16x16_32x32_2x2_8x32x1_8x32x1_1x32x1x8_8_1x1_intrawave_v3,827.4,323.99,0.0
gfx942,304,19840,4096,4096,ck,0,0,811.7672,a8w8_blockscale_1x128x128_256x128x128x128_16x16_32x32_2x2_8x32x1_8x32x1_1x32x1x8_8_1x1_intrawave_v3,820.09,320.99,0.0
gfx942,304,19968,4096,4096,ck,0,0,795.7484,a8w8_blockscale_1x128x128_256x128x128x128_16x16_32x32_2x2_8x32x1_8x32x1_1x32x1x8_8_1x1_intrawave_v3,841.99,329.43,0.0
gfx942,304,20096,4096,4096,ck,0,0,815.2696,a8w8_blockscale_1x128x128_256x128x128x128_16x16_32x32_2x2_8x32x1_8x32x1_1x32x1x8_8_1x1_intrawave_v3,827.1,323.47,0.0
gfx942,304,20224,4096,4096,ck,0,0,817.1002,a8w8_blockscale_1x128x128_256x128x128x128_16x16_32x32_2x2_8x32x1_8x32x1_1x32x1x8_8_1x1_intrawave_v3,830.5,324.67,0.0
gfx942,304,20352,4096,4096,ck,0,0,830.0399,a8w8_blockscale_1x128x128_256x128x128x128_16x16_32x32_2x2_8x32x1_8x32x1_1x32x1x8_8_1x1_intrawave_v3,822.73,321.51,0.0
gfx942,304,20480,4096,4096,ck,0,0,831.5635,a8w8_blockscale_1x128x128_256x128x128x128_16x16_32x32_2x2_8x32x1_8x32x1_1x32x1x8_8_1x1_intrawave_v3,826.39,322.81,0.0
gfx942,304,20608,4096,4096,ck,0,0,824.8001,a8w8_blockscale_1x128x128_256x128x128x128_16x16_32x32_2x2_8x32x1_8x32x1_1x32x1x8_8_1x1_intrawave_v3,838.37,327.36,0.0
gfx942,304,20736,4096,4096,ck,0,0,842.419,a8w8_blockscale_1x128x128_256x128x128x128_16x16_32x32_2x2_8x32x1_8x32x1_1x32x1x8_8_1x1_intrawave_v3,825.94,322.38,0.0
gfx942,304,20864,4096,4096,ck,0,0,850.0635,a8w8_blockscale_1x128x128_256x128x128x128_16x16_32x32_2x2_8x32x1_8x32x1_1x32x1x8_8_1x1_intrawave_v3,823.56,321.33,0.0
gfx942,304,20992,4096,4096,ck,0,0,826.7744,a8w8_blockscale_1x128x128_256x128x128x128_16x16_32x32_2x2_8x32x1_8x32x1_1x32x1x8_8_1x1_intrawave_v3,851.96,332.29,0.0
gfx942,304,21120,4096,4096,ck,0,0,848.59,a8w8_blockscale_1x128x128_256x128x128x128_16x16_32x32_2x2_8x32x1_8x32x1_1x32x1x8_8_1x1_intrawave_v3,835.11,325.6,0.0
gfx942,304,21248,4096,4096,ck,0,0,870.774,a8w8_blockscale_1x128x128_256x128x128x128_16x16_32x32_2x2_8x32x1_8x32x1_1x32x1x8_8_1x1_intrawave_v3,818.77,319.11,0.0
gfx942,304,21376,4096,4096,ck,0,0,857.8678,a8w8_blockscale_1x128x128_256x128x128x128_16x16_32x32_2x2_8x32x1_8x32x1_1x32x1x8_8_1x1_intrawave_v3,836.1,325.74,0.0
gfx942,304,21504,4096,4096,ck,0,0,863.5219,a8w8_blockscale_1x128x128_256x128x128x128_16x16_32x32_2x2_8x32x1_8x32x1_1x32x1x8_8_1x1_intrawave_v3,835.59,325.43,0.0
gfx942,304,21632,4096,4096,ck,0,0,865.1874,a8w8_blockscale_1x128x128_256x128x128x128_16x16_32x32_2x2_8x32x1_8x32x1_1x32x1x8_8_1x1_intrawave_v3,838.95,326.62,0.0
gfx942,304,21760,4096,4096,ck,0,0,900.2281,a8w8_blockscale_1x128x128_256x128x128x128_16x16_32x32_2x2_8x32x1_8x32x1_1x32x1x8_8_1x1_intrawave_v3,811.07,315.66,0.0
gfx942,304,21888,4096,4096,ck,0,0,892.4338,a8w8_blockscale_1x128x128_256x128x128x128_16x16_32x32_2x2_8x32x1_8x32x1_1x32x1x8_8_1x1_intrawave_v3,822.96,320.18,0.0
gfx942,304,22016,4096,4096,ck,0,0,898.072,a8w8_blockscale_1x128x128_256x128x128x128_16x16_32x32_2x2_8x32x1_8x32x1_1x32x1x8_8_1x1_intrawave_v3,822.58,319.92,0.0
gfx942,304,22144,4096,4096,ck,0,0,892.4725,a8w8_blockscale_1x128x128_256x128x128x128_16x16_32x32_2x2_8x32x1_8x32x1_1x32x1x8_8_1x1_intrawave_v3,832.55,323.69,0.0
gfx942,304,22272,4096,4096,ck,0,0,900.5324,a8w8_blockscale_1x128x128_256x128x128x128_16x16_32x32_2x2_8x32x1_8x32x1_1x32x1x8_8_1x1_intrawave_v3,829.87,322.54,0.0
gfx942,304,22400,4096,4096,ck,0,0,924.3439,a8w8_blockscale_1x128x128_256x128x128x128_16x16_32x32_2x2_8x32x1_8x32x1_1x32x1x8_8_1x1_intrawave_v3,813.14,315.93,0.0
gfx942,304,22528,4096,4096,ck,0,0,917.0382,a8w8_blockscale_1x128x128_256x128x128x128_16x16_32x32_2x2_8x32x1_8x32x1_1x32x1x8_8_1x1_intrawave_v3,824.3,320.16,0.0
gfx942,304,22656,4096,4096,ck,0,0,916.6864,a8w8_blockscale_1x128x128_256x128x128x128_16x16_32x32_2x2_8x32x1_8x32x1_1x32x1x8_8_1x1_intrawave_v3,829.3,322.0,0.0
gfx942,304,22784,4096,4096,ck,0,0,911.998,a8w8_blockscale_1x128x128_256x128x128x128_16x16_32x32_2x2_8x32x1_8x32x1_1x32x1x8_8_1x1_intrawave_v3,838.27,325.38,0.0
gfx942,304,22912,4096,4096,ck,0,0,917.3046,a8w8_blockscale_1x128x128_256x128x128x128_16x16_32x32_2x2_8x32x1_8x32x1_1x32x1x8_8_1x1_intrawave_v3,838.11,325.21,0.0
gfx942,304,23040,4096,4096,ck,0,0,928.8101,a8w8_blockscale_1x128x128_256x128x128x128_16x16_32x32_2x2_8x32x1_8x32x1_1x32x1x8_8_1x1_intrawave_v3,832.35,322.88,0.0
gfx942,304,23168,4096,4096,ck,0,0,931.5209,a8w8_blockscale_1x128x128_256x128x128x128_16x16_32x32_2x2_8x32x1_8x32x1_1x32x1x8_8_1x1_intrawave_v3,834.54,323.63,0.0
gfx942,304,23296,4096,4096,ck,0,0,945.2677,a8w8_blockscale_1x128x128_256x128x128x128_16x16_32x32_2x2_8x32x1_8x32x1_1x32x1x8_8_1x1_intrawave_v3,826.94,320.58,0.0
gfx942,304,23424,4096,4096,ck,0,0,946.8723,a8w8_blockscale_1x128x128_256x128x128x128_16x16_32x32_2x2_8x32x1_8x32x1_1x32x1x8_8_1x1_intrawave_v3,830.08,321.7,0.0
gfx942,304,23552,4096,4096,ck,0,0,944.0665,a8w8_blockscale_1x128x128_256x128x128x128_16x16_32x32_2x2_8x32x1_8x32x1_1x32x1x8_8_1x1_intrawave_v3,837.1,324.32,0.0
gfx942,304,23680,4096,4096,ck,0,0,948.8468,a8w8_blockscale_1x128x128_256x128x128x128_16x16_32x32_2x2_8x32x1_8x32x1_1x32x1x8_8_1x1_intrawave_v3,837.4,324.35,0.0
gfx942,304,23808,4096,4096,ck,0,0,953.393,a8w8_blockscale_1x128x128_256x128x128x128_16x16_32x32_2x2_8x32x1_8x32x1_1x32x1x8_8_1x1_intrawave_v3,837.92,324.45,0.0
gfx942,304,23936,4096,4096,ck,0,0,962.3782,a8w8_blockscale_1x128x128_256x128x128x128_16x16_32x32_2x2_8x32x1_8x32x1_1x32x1x8_8_1x1_intrawave_v3,834.56,323.06,0.0
gfx942,304,24064,4096,4096,ck,0,0,964.8326,a8w8_blockscale_1x128x128_256x128x128x128_16x16_32x32_2x2_8x32x1_8x32x1_1x32x1x8_8_1x1_intrawave_v3,836.88,323.87,0.0
gfx942,304,24192,4096,4096,ck,0,0,965.3689,a8w8_blockscale_1x128x128_256x128x128x128_16x16_32x32_2x2_8x32x1_8x32x1_1x32x1x8_8_1x1_intrawave_v3,840.87,325.31,0.0
gfx942,304,24320,4096,4096,ck,0,0,990.2812,a8w8_blockscale_1x128x128_256x128x128x128_16x16_32x32_2x2_8x32x1_8x32x1_1x32x1x8_8_1x1_intrawave_v3,824.05,318.72,0.0
gfx942,304,24448,4096,4096,ck,0,0,1009.0268,a8w8_blockscale_1x128x128_256x128x128x128_16x16_32x32_2x2_8x32x1_8x32x1_1x32x1x8_8_1x1_intrawave_v3,813.0,314.36,0.0
gfx942,304,24576,4096,4096,ck,0,0,988.7471,a8w8_blockscale_1x128x128_256x128x128x128_16x16_32x32_2x2_8x32x1_8x32x1_1x32x1x8_8_1x1_intrawave_v3,834.02,322.39,0.0
gfx942,304,24704,4096,4096,ck,0,0,996.1019,a8w8_blockscale_1x128x128_256x128x128x128_16x16_32x32_2x2_8x32x1_8x32x1_1x32x1x8_8_1x1_intrawave_v3,832.17,321.59,0.0
gfx942,304,24832,4096,4096,ck,0,0,1009.998,a8w8_blockscale_1x128x128_256x128x128x128_16x16_32x32_2x2_8x32x1_8x32x1_1x32x1x8_8_1x1_intrawave_v3,824.98,318.73,0.0
gfx942,304,24960,4096,4096,ck,0,0,1011.8161,a8w8_blockscale_1x128x128_256x128x128x128_16x16_32x32_2x2_8x32x1_8x32x1_1x32x1x8_8_1x1_intrawave_v3,827.74,319.71,0.0
gfx942,304,25088,4096,4096,ck,0,0,1002.815,a8w8_blockscale_1x128x128_256x128x128x128_16x16_32x32_2x2_8x32x1_8x32x1_1x32x1x8_8_1x1_intrawave_v3,839.45,324.15,0.0
gfx942,304,25216,4096,4096,ck,0,0,1043.9265,a8w8_blockscale_1x128x128_256x128x128x128_16x16_32x32_2x2_8x32x1_8x32x1_1x32x1x8_8_1x1_intrawave_v3,810.51,312.89,0.0
gfx942,304,25344,4096,4096,ck,0,0,1015.39,a8w8_blockscale_1x128x128_256x128x128x128_16x16_32x32_2x2_8x32x1_8x32x1_1x32x1x8_8_1x1_intrawave_v3,837.51,323.23,0.0
gfx942,304,25472,4096,4096,ck,0,0,1036.5099,a8w8_blockscale_1x128x128_256x128x128x128_16x16_32x32_2x2_8x32x1_8x32x1_1x32x1x8_8_1x1_intrawave_v3,824.59,318.16,0.0
gfx942,304,25600,4096,4096,ck,0,0,1042.1169,a8w8_blockscale_1x128x128_256x128x128x128_16x16_32x32_2x2_8x32x1_8x32x1_1x32x1x8_8_1x1_intrawave_v3,824.28,317.96,0.0
gfx942,304,25728,4096,4096,ck,0,0,1046.23,a8w8_blockscale_1x128x128_256x128x128x128_16x16_32x32_2x2_8x32x1_8x32x1_1x32x1x8_8_1x1_intrawave_v3,825.14,318.21,0.0
gfx942,304,25856,4096,4096,ck,0,0,1035.9269,a8w8_blockscale_1x128x128_256x128x128x128_16x16_32x32_2x2_8x32x1_8x32x1_1x32x1x8_8_1x1_intrawave_v3,837.49,322.9,0.0
gfx942,304,25984,4096,4096,ck,0,0,1058.6469,a8w8_blockscale_1x128x128_256x128x128x128_16x16_32x32_2x2_8x32x1_8x32x1_1x32x1x8_8_1x1_intrawave_v3,823.58,317.45,0.0
gfx942,304,26112,4096,4096,ck,0,0,1047.1017,a8w8_blockscale_1x128x128_256x128x128x128_16x16_32x32_2x2_8x32x1_8x32x1_1x32x1x8_8_1x1_intrawave_v3,836.76,322.45,0.0
gfx942,304,26240,4096,4096,ck,0,0,1047.6603,a8w8_blockscale_1x128x128_256x128x128x128_16x16_32x32_2x2_8x32x1_8x32x1_1x32x1x8_8_1x1_intrawave_v3,840.41,323.78,0.0
gfx942,304,26368,4096,4096,ck,0,0,1049.9184,a8w8_blockscale_1x128x128_256x128x128x128_16x16_32x32_2x2_8x32x1_8x32x1_1x32x1x8_8_1x1_intrawave_v3,842.7,324.58,0.0
gfx942,304,26496,4096,4096,ck,0,0,1081.2916,a8w8_blockscale_1x128x128_256x128x128x128_16x16_32x32_2x2_8x32x1_8x32x1_1x32x1x8_8_1x1_intrawave_v3,822.22,316.62,0.0
gfx942,304,26624,4096,4096,ck,0,0,1058.7317,a8w8_blockscale_1x128x128_256x128x128x128_16x16_32x32_2x2_8x32x1_8x32x1_1x32x1x8_8_1x1_intrawave_v3,843.8,324.85,0.0
gfx942,304,26752,4096,4096,ck,0,0,1074.6698,a8w8_blockscale_1x128x128_256x128x128x128_16x16_32x32_2x2_8x32x1_8x32x1_1x32x1x8_8_1x1_intrawave_v3,835.28,321.5,0.0
gfx942,304,26880,4096,4096,ck,0,0,1076.0604,a8w8_blockscale_1x128x128_256x128x128x128_16x16_32x32_2x2_8x32x1_8x32x1_1x32x1x8_8_1x1_intrawave_v3,838.19,322.55,0.0
gfx942,304,27008,4096,4096,ck,0,0,1077.3094,a8w8_blockscale_1x128x128_256x128x128x128_16x16_32x32_2x2_8x32x1_8x32x1_1x32x1x8_8_1x1_intrawave_v3,841.21,323.63,0.0
gfx942,304,27136,4096,4096,ck,0,0,1113.831,a8w8_blockscale_1x128x128_256x128x128x128_16x16_32x32_2x2_8x32x1_8x32x1_1x32x1x8_8_1x1_intrawave_v3,817.48,314.43,0.0
gfx942,304,27264,4096,4096,ck,0,0,1093.7067,a8w8_blockscale_1x128x128_256x128x128x128_16x16_32x32_2x2_8x32x1_8x32x1_1x32x1x8_8_1x1_intrawave_v3,836.45,321.66,0.0
gfx942,304,27392,4096,4096,ck,0,0,1107.6105,a8w8_blockscale_1x128x128_256x128x128x128_16x16_32x32_2x2_8x32x1_8x32x1_1x32x1x8_8_1x1_intrawave_v3,829.83,319.04,0.0
gfx942,304,27520,4096,4096,ck,0,0,1118.9052,a8w8_blockscale_1x128x128_256x128x128x128_16x16_32x32_2x2_8x32x1_8x32x1_1x32x1x8_8_1x1_intrawave_v3,825.29,317.22,0.0
gfx942,304,27648,4096,4096,ck,0,0,1103.0872,a8w8_blockscale_1x128x128_256x128x128x128_16x16_32x32_2x2_8x32x1_8x32x1_1x32x1x8_8_1x1_intrawave_v3,841.02,323.2,0.0
gfx942,304,27776,4096,4096,ck,0,0,1132.8231,a8w8_blockscale_1x128x128_256x128x128x128_16x16_32x32_2x2_8x32x1_8x32x1_1x32x1x8_8_1x1_intrawave_v3,822.73,316.1,0.0
gfx942,304,27904,4096,4096,ck,0,0,1143.3013,a8w8_blockscale_1x128x128_256x128x128x128_16x16_32x32_2x2_8x32x1_8x32x1_1x32x1x8_8_1x1_intrawave_v3,818.95,314.58,0.0
gfx942,304,28032,4096,4096,ck,0,0,1122.0135,a8w8_blockscale_1x128x128_256x128x128x128_16x16_32x32_2x2_8x32x1_8x32x1_1x32x1x8_8_1x1_intrawave_v3,838.31,321.95,0.0
gfx942,304,28160,4096,4096,ck,0,0,1135.6187,a8w8_blockscale_1x128x128_256x128x128x128_16x16_32x32_2x2_8x32x1_8x32x1_1x32x1x8_8_1x1_intrawave_v3,832.05,319.48,0.0
gfx942,304,28288,4096,4096,ck,0,0,1154.5231,a8w8_blockscale_1x128x128_256x128x128x128_16x16_32x32_2x2_8x32x1_8x32x1_1x32x1x8_8_1x1_intrawave_v3,822.15,315.61,0.0
gfx942,304,28416,4096,4096,ck,0,0,1132.3159,a8w8_blockscale_1x128x128_256x128x128x128_16x16_32x32_2x2_8x32x1_8x32x1_1x32x1x8_8_1x1_intrawave_v3,842.06,323.19,0.0
gfx942,304,28544,4096,4096,ck,0,0,1139.4405,a8w8_blockscale_1x128x128_256x128x128x128_16x16_32x32_2x2_8x32x1_8x32x1_1x32x1x8_8_1x1_intrawave_v3,840.57,322.55,0.0
gfx942,304,28672,4096,4096,ck,0,0,1152.2455,a8w8_blockscale_1x128x128_256x128x128x128_16x16_32x32_2x2_8x32x1_8x32x1_1x32x1x8_8_1x1_intrawave_v3,834.95,320.33,0.0
gfx942,304,28800,4096,4096,ck,0,0,1168.8497,a8w8_blockscale_1x128x128_256x128x128x128_16x16_32x32_2x2_8x32x1_8x32x1_1x32x1x8_8_1x1_intrawave_v3,826.77,317.13,0.0
gfx942,304,28928,4096,4096,ck,0,0,1180.0842,a8w8_blockscale_1x128x128_256x128x128x128_16x16_32x32_2x2_8x32x1_8x32x1_1x32x1x8_8_1x1_intrawave_v3,822.54,315.44,0.0
gfx942,304,29056,4096,4096,ck,0,0,1159.0903,a8w8_blockscale_1x128x128_256x128x128x128_16x16_32x32_2x2_8x32x1_8x32x1_1x32x1x8_8_1x1_intrawave_v3,841.14,322.51,0.0
gfx942,304,29184,4096,4096,ck,0,0,1178.9127,a8w8_blockscale_1x128x128_256x128x128x128_16x16_32x32_2x2_8x32x1_8x32x1_1x32x1x8_8_1x1_intrawave_v3,830.64,318.42,0.0
gfx942,304,29312,4096,4096,ck,0,0,1214.4625,a8w8_blockscale_1x128x128_256x128x128x128_16x16_32x32_2x2_8x32x1_8x32x1_1x32x1x8_8_1x1_intrawave_v3,809.86,310.39,0.0
gfx942,304,29440,4096,4096,ck,0,0,1195.9677,a8w8_blockscale_1x128x128_256x128x128x128_16x16_32x32_2x2_8x32x1_8x32x1_1x32x1x8_8_1x1_intrawave_v3,825.98,316.51,0.0
gfx942,304,29568,4096,4096,ck,0,0,1212.6609,a8w8_blockscale_1x128x128_256x128x128x128_16x16_32x32_2x2_8x32x1_8x32x1_1x32x1x8_8_1x1_intrawave_v3,818.15,313.45,0.0
gfx942,304,29696,4096,4096,ck,0,0,1194.79,a8w8_blockscale_1x128x128_256x128x128x128_16x16_32x32_2x2_8x32x1_8x32x1_1x32x1x8_8_1x1_intrawave_v3,833.98,319.46,0.0
gfx942,304,29824,4096,4096,ck,0,0,1196.1205,a8w8_blockscale_1x128x128_256x128x128x128_16x16_32x32_2x2_8x32x1_8x32x1_1x32x1x8_8_1x1_intrawave_v3,836.64,320.41,0.0
gfx942,304,29952,4096,4096,ck,0,0,1196.5202,a8w8_blockscale_1x128x128_256x128x128x128_16x16_32x32_2x2_8x32x1_8x32x1_1x32x1x8_8_1x1_intrawave_v3,839.95,321.62,0.0
gfx942,304,30080,4096,4096,ck,0,0,1201.0951,a8w8_blockscale_1x128x128_256x128x128x128_16x16_32x32_2x2_8x32x1_8x32x1_1x32x1x8_8_1x1_intrawave_v3,840.33,321.71,0.0
gfx942,304,30208,4096,4096,ck,0,0,1200.0804,a8w8_blockscale_1x128x128_256x128x128x128_16x16_32x32_2x2_8x32x1_8x32x1_1x32x1x8_8_1x1_intrawave_v3,844.62,323.29,0.0
gfx942,304,30336,4096,4096,ck,0,0,1250.1004,a8w8_blockscale_1x128x128_256x128x128x128_16x16_32x32_2x2_8x32x1_8x32x1_1x32x1x8_8_1x1_intrawave_v3,814.26,311.61,0.0
gfx942,304,30464,4096,4096,ck,0,0,1248.3129,a8w8_blockscale_1x128x128_256x128x128x128_16x16_32x32_2x2_8x32x1_8x32x1_1x32x1x8_8_1x1_intrawave_v3,818.87,313.32,0.0
gfx942,304,30592,4096,4096,ck,0,0,1226.1373,a8w8_blockscale_1x128x128_256x128x128x128_16x16_32x32_2x2_8x32x1_8x32x1_1x32x1x8_8_1x1_intrawave_v3,837.18,320.27,0.0
gfx942,304,30720,4096,4096,ck,0,0,1229.0115,a8w8_blockscale_1x128x128_256x128x128x128_16x16_32x32_2x2_8x32x1_8x32x1_1x32x1x8_8_1x1_intrawave_v3,838.72,320.8,0.0
gfx942,304,30848,4096,4096,ck,0,0,1250.3841,a8w8_blockscale_1x128x128_256x128x128x128_16x16_32x32_2x2_8x32x1_8x32x1_1x32x1x8_8_1x1_intrawave_v3,827.82,316.57,0.0
gfx942,304,30976,4096,4096,ck,0,0,1237.0298,a8w8_blockscale_1x128x128_256x128x128x128_16x16_32x32_2x2_8x32x1_8x32x1_1x32x1x8_8_1x1_intrawave_v3,840.22,321.26,0.0
gfx942,304,31104,4096,4096,ck,0,0,1250.7954,a8w8_blockscale_1x128x128_256x128x128x128_16x16_32x32_2x2_8x32x1_8x32x1_1x32x1x8_8_1x1_intrawave_v3,834.41,318.98,0.0
gfx942,304,31232,4096,4096,ck,0,0,1288.4096,a8w8_blockscale_1x128x128_256x128x128x128_16x16_32x32_2x2_8x32x1_8x32x1_1x32x1x8_8_1x1_intrawave_v3,813.38,310.89,0.0
gfx942,304,31360,4096,4096,ck,0,0,1270.3818,a8w8_blockscale_1x128x128_256x128x128x128_16x16_32x32_2x2_8x32x1_8x32x1_1x32x1x8_8_1x1_intrawave_v3,828.31,316.54,0.0
gfx942,304,31488,4096,4096,ck,0,0,1273.2235,a8w8_blockscale_1x128x128_256x128x128x128_16x16_32x32_2x2_8x32x1_8x32x1_1x32x1x8_8_1x1_intrawave_v3,829.83,317.07,0.0
gfx942,304,31616,4096,4096,ck,0,0,1266.2266,a8w8_blockscale_1x128x128_256x128x128x128_16x16_32x32_2x2_8x32x1_8x32x1_1x32x1x8_8_1x1_intrawave_v3,837.81,320.06,0.0
gfx942,304,31744,4096,4096,ck,0,0,1262.8646,a8w8_blockscale_1x128x128_256x128x128x128_16x16_32x32_2x2_8x32x1_8x32x1_1x32x1x8_8_1x1_intrawave_v3,843.44,322.16,0.0
gfx942,304,31872,4096,4096,ck,0,0,1307.4844,a8w8_blockscale_1x128x128_256x128x128x128_16x16_32x32_2x2_8x32x1_8x32x1_1x32x1x8_8_1x1_intrawave_v3,817.94,312.37,0.0
gfx942,304,32000,4096,4096,ck,0,0,1292.9538,a8w8_blockscale_1x128x128_256x128x128x128_16x16_32x32_2x2_8x32x1_8x32x1_1x32x1x8_8_1x1_intrawave_v3,830.46,317.1,0.0
gfx942,304,32128,4096,4096,ck,0,0,1278.6233,a8w8_blockscale_1x128x128_256x128x128x128_16x16_32x32_2x2_8x32x1_8x32x1_1x32x1x8_8_1x1_intrawave_v3,843.12,321.88,0.0
gfx942,304,32256,4096,4096,ck,0,0,1278.0472,a8w8_blockscale_1x128x128_256x128x128x128_16x16_32x32_2x2_8x32x1_8x32x1_1x32x1x8_8_1x1_intrawave_v3,846.86,323.26,0.0
gfx942,304,32384,4096,4096,ck,0,0,1289.2595,a8w8_blockscale_1x128x128_256x128x128x128_16x16_32x32_2x2_8x32x1_8x32x1_1x32x1x8_8_1x1_intrawave_v3,842.83,321.67,0.0
gfx942,304,32512,4096,4096,ck,0,0,1322.6967,a8w8_blockscale_1x128x128_256x128x128x128_16x16_32x32_2x2_8x32x1_8x32x1_1x32x1x8_8_1x1_intrawave_v3,824.77,314.72,0.0
gfx942,304,32640,4096,4096,ck,0,0,1303.2911,a8w8_blockscale_1x128x128_256x128x128x128_16x16_32x32_2x2_8x32x1_8x32x1_1x32x1x8_8_1x1_intrawave_v3,840.35,320.62,0.0
gfx942,304,32768,4096,4096,ck,0,0,1312.9033,a8w8_blockscale_1x128x128_256x128x128x128_16x16_32x32_2x2_8x32x1_8x32x1_1x32x1x8_8_1x1_intrawave_v3,837.47,319.47,0.0
gfx942,304,32896,4096,4096,ck,0,0,1314.6354,a8w8_blockscale_1x128x128_256x128x128x128_16x16_32x32_2x2_8x32x1_8x32x1_1x32x1x8_8_1x1_intrawave_v3,839.63,320.24,0.0
gfx942,304,33024,4096,4096,ck,0,0,1330.5294,a8w8_blockscale_1x128x128_256x128x128x128_16x16_32x32_2x2_8x32x1_8x32x1_1x32x1x8_8_1x1_intrawave_v3,832.83,317.6,0.0
gfx942,304,33152,4096,4096,ck,0,0,1330.5372,a8w8_blockscale_1x128x128_256x128x128x128_16x16_32x32_2x2_8x32x1_8x32x1_1x32x1x8_8_1x1_intrawave_v3,836.05,318.78,0.0
gfx942,304,33280,4096,4096,ck,0,0,1345.8461,a8w8_blockscale_1x128x128_256x128x128x128_16x16_32x32_2x2_8x32x1_8x32x1_1x32x1x8_8_1x1_intrawave_v3,829.73,316.32,0.0
gfx942,304,33408,4096,4096,ck,0,0,1346.6465,a8w8_blockscale_1x128x128_256x128x128x128_16x16_32x32_2x2_8x32x1_8x32x1_1x32x1x8_8_1x1_intrawave_v3,832.43,317.3,0.0
gfx942,304,33536,4096,4096,ck,0,0,1331.6612,a8w8_blockscale_1x128x128_256x128x128x128_16x16_32x32_2x2_8x32x1_8x32x1_1x32x1x8_8_1x1_intrawave_v3,845.02,322.05,0.0
gfx942,304,33664,4096,4096,ck,0,0,1338.2818,a8w8_blockscale_1x128x128_256x128x128x128_16x16_32x32_2x2_8x32x1_8x32x1_1x32x1x8_8_1x1_intrawave_v3,844.05,321.64,0.0
gfx942,304,33792,4096,4096,ck,0,0,1324.6036,a8w8_blockscale_1x128x128_256x128x128x128_16x16_32x32_2x2_8x32x1_8x32x1_1x32x1x8_8_1x1_intrawave_v3,856.01,326.15,0.0
gfx942,304,33920,4096,4096,ck,0,0,1347.6763,a8w8_blockscale_1x128x128_256x128x128x128_16x16_32x32_2x2_8x32x1_8x32x1_1x32x1x8_8_1x1_intrawave_v3,844.54,321.73,0.0
gfx942,304,34048,4096,4096,ck,0,0,1360.7066,a8w8_blockscale_1x128x128_256x128x128x128_16x16_32x32_2x2_8x32x1_8x32x1_1x32x1x8_8_1x1_intrawave_v3,839.61,319.8,0.0
gfx942,304,34176,4096,4096,ck,0,0,1357.5703,a8w8_blockscale_1x128x128_256x128x128x128_16x16_32x32_2x2_8x32x1_8x32x1_1x32x1x8_8_1x1_intrawave_v3,844.71,321.7,0.0
gfx942,304,34304,4096,4096,ck,0,0,1355.914,a8w8_blockscale_1x128x128_256x128x128x128_16x16_32x32_2x2_8x32x1_8x32x1_1x32x1x8_8_1x1_intrawave_v3,848.91,323.25,0.0
gfx942,304,34432,4096,4096,ck,0,0,1381.2712,a8w8_blockscale_1x128x128_256x128x128x128_16x16_32x32_2x2_8x32x1_8x32x1_1x32x1x8_8_1x1_intrawave_v3,836.44,318.46,0.0
gfx942,304,34560,4096,4096,ck,0,0,1378.5758,a8w8_blockscale_1x128x128_256x128x128x128_16x16_32x32_2x2_8x32x1_8x32x1_1x32x1x8_8_1x1_intrawave_v3,841.19,320.22,0.0
gfx942,304,34688,4096,4096,ck,0,0,1364.2757,a8w8_blockscale_1x128x128_256x128x128x128_16x16_32x32_2x2_8x32x1_8x32x1_1x32x1x8_8_1x1_intrawave_v3,853.15,324.73,0.0
gfx942,304,34816,4096,4096,ck,0,0,1385.4984,a8w8_blockscale_1x128x128_256x128x128x128_16x16_32x32_2x2_8x32x1_8x32x1_1x32x1x8_8_1x1_intrawave_v3,843.18,320.89,0.0
gfx942,304,34944,4096,4096,ck,0,0,1389.0155,a8w8_blockscale_1x128x128_256x128x128x128_16x16_32x32_2x2_8x32x1_8x32x1_1x32x1x8_8_1x1_intrawave_v3,844.14,321.21,0.0
gfx942,304,35072,4096,4096,ck,0,0,1408.8809,a8w8_blockscale_1x128x128_256x128x128x128_16x16_32x32_2x2_8x32x1_8x32x1_1x32x1x8_8_1x1_intrawave_v3,835.29,317.8,0.0
gfx942,304,35200,4096,4096,ck,0,0,1387.2041,a8w8_blockscale_1x128x128_256x128x128x128_16x16_32x32_2x2_8x32x1_8x32x1_1x32x1x8_8_1x1_intrawave_v3,851.44,323.9,0.0
gfx942,304,35328,4096,4096,ck,0,0,1385.3826,a8w8_blockscale_1x128x128_256x128x128x128_16x16_32x32_2x2_8x32x1_8x32x1_1x32x1x8_8_1x1_intrawave_v3,855.66,325.46,0.0
gfx942,304,35456,4096,4096,ck,0,0,1414.9259,a8w8_blockscale_1x128x128_256x128x128x128_16x16_32x32_2x2_8x32x1_8x32x1_1x32x1x8_8_1x1_intrawave_v3,840.83,319.78,0.0
gfx942,304,35584,4096,4096,ck,0,0,1413.6409,a8w8_blockscale_1x128x128_256x128x128x128_16x16_32x32_2x2_8x32x1_8x32x1_1x32x1x8_8_1x1_intrawave_v3,844.63,321.18,0.0
gfx942,304,35712,4096,4096,ck,0,0,1403.5442,a8w8_blockscale_1x128x128_256x128x128x128_16x16_32x32_2x2_8x32x1_8x32x1_1x32x1x8_8_1x1_intrawave_v3,853.76,324.61,0.0
gfx942,304,35840,4096,4096,ck,0,0,1428.1383,a8w8_blockscale_1x128x128_256x128x128x128_16x16_32x32_2x2_8x32x1_8x32x1_1x32x1x8_8_1x1_intrawave_v3,842.07,320.12,0.0
gfx942,304,35968,4096,4096,ck,0,0,1434.4129,a8w8_blockscale_1x128x128_256x128x128x128_16x16_32x32_2x2_8x32x1_8x32x1_1x32x1x8_8_1x1_intrawave_v3,841.38,319.82,0.0
gfx942,304,36096,4096,4096,ck,0,0,1418.0502,a8w8_blockscale_1x128x128_256x128x128x128_16x16_32x32_2x2_8x32x1_8x32x1_1x32x1x8_8_1x1_intrawave_v3,854.12,324.62,0.0
gfx942,304,36224,4096,4096,ck,0,0,1426.8124,a8w8_blockscale_1x128x128_256x128x128x128_16x16_32x32_2x2_8x32x1_8x32x1_1x32x1x8_8_1x1_intrawave_v3,851.88,323.73,0.0
gfx942,304,36352,4096,4096,ck,0,0,1426.0011,a8w8_blockscale_1x128x128_256x128x128x128_16x16_32x32_2x2_8x32x1_8x32x1_1x32x1x8_8_1x1_intrawave_v3,855.38,325.01,0.0
gfx942,304,36480,4096,4096,ck,0,0,1456.2963,a8w8_blockscale_1x128x128_256x128x128x128_16x16_32x32_2x2_8x32x1_8x32x1_1x32x1x8_8_1x1_intrawave_v3,840.53,319.33,0.0
gfx942,304,36608,4096,4096,ck,0,0,1436.9544,a8w8_blockscale_1x128x128_256x128x128x128_16x16_32x32_2x2_8x32x1_8x32x1_1x32x1x8_8_1x1_intrawave_v3,854.84,324.73,0.0
gfx942,304,36736,4096,4096,ck,0,0,1468.6839,a8w8_blockscale_1x128x128_256x128x128x128_16x16_32x32_2x2_8x32x1_8x32x1_1x32x1x8_8_1x1_intrawave_v3,839.29,318.78,0.0
gfx942,304,36864,4096,4096,ck,0,0,1442.6405,a8w8_blockscale_1x128x128_256x128x128x128_16x16_32x32_2x2_8x32x1_8x32x1_1x32x1x8_8_1x1_intrawave_v3,857.42,325.63,0.0
gfx942,304,36992,4096,4096,ck,0,0,1460.0221,a8w8_blockscale_1x128x128_256x128x128x128_16x16_32x32_2x2_8x32x1_8x32x1_1x32x1x8_8_1x1_intrawave_v3,850.16,322.83,0.0
gfx942,304,37120,4096,4096,ck,0,0,1474.1601,a8w8_blockscale_1x128x128_256x128x128x128_16x16_32x32_2x2_8x32x1_8x32x1_1x32x1x8_8_1x1_intrawave_v3,844.92,320.8,0.0
gfx942,304,37248,4096,4096,ck,0,0,1491.1805,a8w8_blockscale_1x128x128_256x128x128x128_16x16_32x32_2x2_8x32x1_8x32x1_1x32x1x8_8_1x1_intrawave_v3,838.15,318.19,0.0
gfx942,304,37376,4096,4096,ck,0,0,1466.6703,a8w8_blockscale_1x128x128_256x128x128x128_16x16_32x32_2x2_8x32x1_8x32x1_1x32x1x8_8_1x1_intrawave_v3,855.09,324.58,0.0
gfx942,304,37504,4096,4096,ck,0,0,1475.9902,a8w8_blockscale_1x128x128_256x128x128x128_16x16_32x32_2x2_8x32x1_8x32x1_1x32x1x8_8_1x1_intrawave_v3,852.6,323.6,0.0
gfx942,304,37632,4096,4096,ck,0,0,1474.447,a8w8_blockscale_1x128x128_256x128x128x128_16x16_32x32_2x2_8x32x1_8x32x1_1x32x1x8_8_1x1_intrawave_v3,856.4,325.0,0.0
gfx942,304,37760,4096,4096,ck,0,0,1538.096,a8w8_blockscale_1x128x128_256x128x128x128_16x16_32x32_2x2_8x32x1_8x32x1_1x32x1x8_8_1x1_intrawave_v3,823.76,312.58,0.0
gfx942,304,37888,4096,4096,ck,0,0,1491.1626,a8w8_blockscale_1x128x128_256x128x128x128_16x16_32x32_2x2_8x32x1_8x32x1_1x32x1x8_8_1x1_intrawave_v3,852.56,323.47,0.0
gfx942,304,38016,4096,4096,ck,0,0,1528.2715,a8w8_blockscale_1x128x128_256x128x128x128_16x16_32x32_2x2_8x32x1_8x32x1_1x32x1x8_8_1x1_intrawave_v3,834.67,316.64,0.0
gfx942,304,38144,4096,4096,ck,0,0,1512.5887,a8w8_blockscale_1x128x128_256x128x128x128_16x16_32x32_2x2_8x32x1_8x32x1_1x32x1x8_8_1x1_intrawave_v3,846.17,320.97,0.0
gfx942,304,38272,4096,4096,ck,0,0,1500.8434,a8w8_blockscale_1x128x128_256x128x128x128_16x16_32x32_2x2_8x32x1_8x32x1_1x32x1x8_8_1x1_intrawave_v3,855.65,324.53,0.0
gfx942,304,38400,4096,4096,ck,0,0,1561.0036,a8w8_blockscale_1x128x128_256x128x128x128_16x16_32x32_2x2_8x32x1_8x32x1_1x32x1x8_8_1x1_intrawave_v3,825.42,313.03,0.0
gfx942,304,38528,4096,4096,ck,0,0,1548.1534,a8w8_blockscale_1x128x128_256x128x128x128_16x16_32x32_2x2_8x32x1_8x32x1_1x32x1x8_8_1x1_intrawave_v3,835.05,316.64,0.0
gfx942,304,38656,4096,4096,ck,0,0,1546.2406,a8w8_blockscale_1x128x128_256x128x128x128_16x16_32x32_2x2_8x32x1_8x32x1_1x32x1x8_8_1x1_intrawave_v3,838.86,318.05,0.0
gfx942,304,38784,4096,4096,ck,0,0,1526.7983,a8w8_blockscale_1x128x128_256x128x128x128_16x16_32x32_2x2_8x32x1_8x32x1_1x32x1x8_8_1x1_intrawave_v3,852.36,323.13,0.0
gfx942,304,38912,4096,4096,ck,0,0,1532.0408,a8w8_blockscale_1x128x128_256x128x128x128_16x16_32x32_2x2_8x32x1_8x32x1_1x32x1x8_8_1x1_intrawave_v3,852.24,323.05,0.0
gfx942,304,39040,4096,4096,ck,0,0,1566.6367,a8w8_blockscale_1x128x128_256x128x128x128_16x16_32x32_2x2_8x32x1_8x32x1_1x32x1x8_8_1x1_intrawave_v3,836.16,316.92,0.0
gfx942,304,39168,4096,4096,ck,0,0,1546.402,a8w8_blockscale_1x128x128_256x128x128x128_16x16_32x32_2x2_8x32x1_8x32x1_1x32x1x8_8_1x1_intrawave_v3,849.88,322.09,0.0
gfx942,304,39296,4096,4096,ck,0,0,1545.2349,a8w8_blockscale_1x128x128_256x128x128x128_16x16_32x32_2x2_8x32x1_8x32x1_1x32x1x8_8_1x1_intrawave_v3,853.3,323.35,0.0
gfx942,304,39424,4096,4096,ck,0,0,1553.5104,a8w8_blockscale_1x128x128_256x128x128x128_16x16_32x32_2x2_8x32x1_8x32x1_1x32x1x8_8_1x1_intrawave_v3,851.52,322.64,0.0
gfx942,304,39552,4096,4096,ck,0,0,1573.0943,a8w8_blockscale_1x128x128_256x128x128x128_16x16_32x32_2x2_8x32x1_8x32x1_1x32x1x8_8_1x1_intrawave_v3,843.65,319.62,0.0
gfx942,304,39680,4096,4096,ck,0,0,1582.7518,a8w8_blockscale_1x128x128_256x128x128x128_16x16_32x32_2x2_8x32x1_8x32x1_1x32x1x8_8_1x1_intrawave_v3,841.22,318.66,0.0
gfx942,304,39808,4096,4096,ck,0,0,1589.3414,a8w8_blockscale_1x128x128_256x128x128x128_16x16_32x32_2x2_8x32x1_8x32x1_1x32x1x8_8_1x1_intrawave_v3,840.43,318.33,0.0
gfx942,304,39936,4096,4096,ck,0,0,1607.0009,a8w8_blockscale_1x128x128_256x128x128x128_16x16_32x32_2x2_8x32x1_8x32x1_1x32x1x8_8_1x1_intrawave_v3,833.87,315.81,0.0
gfx942,304,40064,4096,4096,ck,0,0,1584.3266,a8w8_blockscale_1x128x128_256x128x128x128_16x16_32x32_2x2_8x32x1_8x32x1_1x32x1x8_8_1x1_intrawave_v3,848.51,321.32,0.0
gfx942,304,40192,4096,4096,ck,0,0,1617.4338,a8w8_blockscale_1x128x128_256x128x128x128_16x16_32x32_2x2_8x32x1_8x32x1_1x32x1x8_8_1x1_intrawave_v3,833.8,315.72,0.0
gfx942,304,40320,4096,4096,ck,0,0,1634.3095,a8w8_blockscale_1x128x128_256x128x128x128_16x16_32x32_2x2_8x32x1_8x32x1_1x32x1x8_8_1x1_intrawave_v3,827.82,313.42,0.0
gfx942,304,40448,4096,4096,ck,0,0,1617.1472,a8w8_blockscale_1x128x128_256x128x128x128_16x16_32x32_2x2_8x32x1_8x32x1_1x32x1x8_8_1x1_intrawave_v3,839.26,317.72,0.0
gfx942,304,40576,4096,4096,ck,0,0,1599.9846,a8w8_blockscale_1x128x128_256x128x128x128_16x16_32x32_2x2_8x32x1_8x32x1_1x32x1x8_8_1x1_intrawave_v3,850.95,322.11,0.0
gfx942,304,40704,4096,4096,ck,0,0,1593.2904,a8w8_blockscale_1x128x128_256x128x128x128_16x16_32x32_2x2_8x32x1_8x32x1_1x32x1x8_8_1x1_intrawave_v3,857.22,324.45,0.0
gfx942,304,40832,4096,4096,ck,0,0,1654.9496,a8w8_blockscale_1x128x128_256x128x128x128_16x16_32x32_2x2_8x32x1_8x32x1_1x32x1x8_8_1x1_intrawave_v3,827.88,313.32,0.0
gfx942,304,40960,4096,4096,ck,0,0,1629.0919,a8w8_blockscale_1x128x128_256x128x128x128_16x16_32x32_2x2_8x32x1_8x32x1_1x32x1x8_8_1x1_intrawave_v3,843.65,319.25,0.0
gfx942,304,41088,4096,4096,ck,0,0,1649.8056,a8w8_blockscale_1x128x128_256x128x128x128_16x16_32x32_2x2_8x32x1_8x32x1_1x32x1x8_8_1x1_intrawave_v3,835.66,316.2,0.0
gfx942,304,41216,4096,4096,ck,0,0,1627.5887,a8w8_blockscale_1x128x128_256x128x128x128_16x16_32x32_2x2_8x32x1_8x32x1_1x32x1x8_8_1x1_intrawave_v3,849.71,321.48,0.0
gfx942,304,41344,4096,4096,ck,0,0,1620.6312,a8w8_blockscale_1x128x128_256x128x128x128_16x16_32x32_2x2_8x32x1_8x32x1_1x32x1x8_8_1x1_intrawave_v3,856.01,323.83,0.0
gfx942,304,41472,4096,4096,ck,0,0,1633.3344,a8w8_blockscale_1x128x128_256x128x128x128_16x16_32x32_2x2_8x32x1_8x32x1_1x32x1x8_8_1x1_intrawave_v3,851.98,322.28,0.0
gfx942,304,41600,4096,4096,ck,0,0,1678.5571,a8w8_blockscale_1x128x128_256x128x128x128_16x16_32x32_2x2_8x32x1_8x32x1_1x32x1x8_8_1x1_intrawave_v3,831.59,314.53,0.0
gfx942,304,41728,4096,4096,ck,0,0,1692.719,a8w8_blockscale_1x128x128_256x128x128x128_16x16_32x32_2x2_8x32x1_8x32x1_1x32x1x8_8_1x1_intrawave_v3,827.17,312.83,0.0
gfx942,304,41856,4096,4096,ck,0,0,1670.384,a8w8_blockscale_1x128x128_256x128x128x128_16x16_32x32_2x2_8x32x1_8x32x1_1x32x1x8_8_1x1_intrawave_v3,840.8,317.95,0.0
gfx942,304,41984,4096,4096,ck,0,0,1651.9156,a8w8_blockscale_1x128x128_256x128x128x128_16x16_32x32_2x2_8x32x1_8x32x1_1x32x1x8_8_1x1_intrawave_v3,852.8,322.46,0.0
gfx942,304,42112,4096,4096,ck,0,0,1670.2267,a8w8_blockscale_1x128x128_256x128x128x128_16x16_32x32_2x2_8x32x1_8x32x1_1x32x1x8_8_1x1_intrawave_v3,846.02,319.87,0.0
gfx942,304,42240,4096,4096,ck,0,0,1682.8766,a8w8_blockscale_1x128x128_256x128x128x128_16x16_32x32_2x2_8x32x1_8x32x1_1x32x1x8_8_1x1_intrawave_v3,842.21,318.4,0.0
gfx942,304,42368,4096,4096,ck,0,0,1686.447,a8w8_blockscale_1x128x128_256x128x128x128_16x16_32x32_2x2_8x32x1_8x32x1_1x32x1x8_8_1x1_intrawave_v3,842.98,318.66,0.0
gfx942,304,42496,4096,4096,ck,0,0,1663.2318,a8w8_blockscale_1x128x128_256x128x128x128_16x16_32x32_2x2_8x32x1_8x32x1_1x32x1x8_8_1x1_intrawave_v3,857.32,324.05,0.0
gfx942,304,42624,4096,4096,ck,0,0,1699.4201,a8w8_blockscale_1x128x128_256x128x128x128_16x16_32x32_2x2_8x32x1_8x32x1_1x32x1x8_8_1x1_intrawave_v3,841.6,318.07,0.0
gfx942,304,42752,4096,4096,ck,0,0,1685.8933,a8w8_blockscale_1x128x128_256x128x128x128_16x16_32x32_2x2_8x32x1_8x32x1_1x32x1x8_8_1x1_intrawave_v3,850.9,321.56,0.0
gfx942,304,42880,4096,4096,ck,0,0,1687.0669,a8w8_blockscale_1x128x128_256x128x128x128_16x16_32x32_2x2_8x32x1_8x32x1_1x32x1x8_8_1x1_intrawave_v3,852.85,322.27,0.0
gfx942,304,43008,4096,4096,ck,0,0,1694.8793,a8w8_blockscale_1x128x128_256x128x128x128_16x16_32x32_2x2_8x32x1_8x32x1_1x32x1x8_8_1x1_intrawave_v3,851.45,321.71,0.0
gfx942,304,43136,4096,4096,ck,0,0,1699.9448,a8w8_blockscale_1x128x128_256x128x128x128_16x16_32x32_2x2_8x32x1_8x32x1_1x32x1x8_8_1x1_intrawave_v3,851.44,321.68,0.0
gfx942,304,43264,4096,4096,ck,0,0,1701.2398,a8w8_blockscale_1x128x128_256x128x128x128_16x16_32x32_2x2_8x32x1_8x32x1_1x32x1x8_8_1x1_intrawave_v3,853.32,322.36,0.0
gfx942,304,43392,4096,4096,ck,0,0,1722.0864,a8w8_blockscale_1x128x128_256x128x128x128_16x16_32x32_2x2_8x32x1_8x32x1_1x32x1x8_8_1x1_intrawave_v3,845.48,319.37,0.0
gfx942,304,43520,4096,4096,ck,0,0,1718.6659,a8w8_blockscale_1x128x128_256x128x128x128_16x16_32x32_2x2_8x32x1_8x32x1_1x32x1x8_8_1x1_intrawave_v3,849.66,320.92,0.0
gfx942,304,43648,4096,4096,ck,0,0,1742.2614,a8w8_blockscale_1x128x128_256x128x128x128_16x16_32x32_2x2_8x32x1_8x32x1_1x32x1x8_8_1x1_intrawave_v3,840.62,317.47,0.0
gfx942,304,43776,4096,4096,ck,0,0,1756.2185,a8w8_blockscale_1x128x128_256x128x128x128_16x16_32x32_2x2_8x32x1_8x32x1_1x32x1x8_8_1x1_intrawave_v3,836.39,315.85,0.0
gfx942,304,43904,4096,4096,ck,0,0,1754.5891,a8w8_blockscale_1x128x128_256x128x128x128_16x16_32x32_2x2_8x32x1_8x32x1_1x32x1x8_8_1x1_intrawave_v3,839.61,317.04,0.0
gfx942,304,44032,4096,4096,ck,0,0,1749.6487,a8w8_blockscale_1x128x128_256x128x128x128_16x16_32x32_2x2_8x32x1_8x32x1_1x32x1x8_8_1x1_intrawave_v3,844.44,318.83,0.0
gfx942,304,44160,4096,4096,ck,0,0,1775.4285,a8w8_blockscale_1x128x128_256x128x128x128_16x16_32x32_2x2_8x32x1_8x32x1_1x32x1x8_8_1x1_intrawave_v3,834.59,315.09,0.0
gfx942,304,44288,4096,4096,ck,0,0,1775.5782,a8w8_blockscale_1x128x128_256x128x128x128_16x16_32x32_2x2_8x32x1_8x32x1_1x32x1x8_8_1x1_intrawave_v3,836.94,315.95,0.0
gfx942,304,44416,4096,4096,ck,0,0,1739.6512,a8w8_blockscale_1x128x128_256x128x128x128_16x16_32x32_2x2_8x32x1_8x32x1_1x32x1x8_8_1x1_intrawave_v3,856.7,323.38,0.0
gfx942,304,44544,4096,4096,ck,0,0,1749.8589,a8w8_blockscale_1x128x128_256x128x128x128_16x16_32x32_2x2_8x32x1_8x32x1_1x32x1x8_8_1x1_intrawave_v3,854.15,322.39,0.0
gfx942,304,44672,4096,4096,ck,0,0,1791.6525,a8w8_blockscale_1x128x128_256x128x128x128_16x16_32x32_2x2_8x32x1_8x32x1_1x32x1x8_8_1x1_intrawave_v3,836.63,315.75,0.0
gfx942,304,44800,4096,4096,ck,0,0,1778.6901,a8w8_blockscale_1x128x128_256x128x128x128_16x16_32x32_2x2_8x32x1_8x32x1_1x32x1x8_8_1x1_intrawave_v3,845.14,318.93,0.0
gfx942,304,44928,4096,4096,ck,0,0,1764.5316,a8w8_blockscale_1x128x128_256x128x128x128_16x16_32x32_2x2_8x32x1_8x32x1_1x32x1x8_8_1x1_intrawave_v3,854.35,322.38,0.0
gfx942,304,45056,4096,4096,ck,0,0,1789.9551,a8w8_blockscale_1x128x128_256x128x128x128_16x16_32x32_2x2_8x32x1_8x32x1_1x32x1x8_8_1x1_intrawave_v3,844.62,318.68,0.0
gfx942,304,45184,4096,4096,ck,0,0,1815.1499,a8w8_blockscale_1x128x128_256x128x128x128_16x16_32x32_2x2_8x32x1_8x32x1_1x32x1x8_8_1x1_intrawave_v3,835.26,315.12,0.0
gfx942,304,45312,4096,4096,ck,0,0,1790.7927,a8w8_blockscale_1x128x128_256x128x128x128_16x16_32x32_2x2_8x32x1_8x32x1_1x32x1x8_8_1x1_intrawave_v3,849.02,320.29,0.0
gfx942,304,45440,4096,4096,ck,0,0,1783.1974,a8w8_blockscale_1x128x128_256x128x128x128_16x16_32x32_2x2_8x32x1_8x32x1_1x32x1x8_8_1x1_intrawave_v3,855.04,322.54,0.0
gfx942,304,45568,4096,4096,ck,0,0,1803.6973,a8w8_blockscale_1x128x128_256x128x128x128_16x16_32x32_2x2_8x32x1_8x32x1_1x32x1x8_8_1x1_intrawave_v3,847.71,319.74,0.0
gfx942,304,45696,4096,4096,ck,0,0,1821.8742,a8w8_blockscale_1x128x128_256x128x128x128_16x16_32x32_2x2_8x32x1_8x32x1_1x32x1x8_8_1x1_intrawave_v3,841.61,317.41,0.0
gfx942,304,45824,4096,4096,ck,0,0,1813.1048,a8w8_blockscale_1x128x128_256x128x128x128_16x16_32x32_2x2_8x32x1_8x32x1_1x32x1x8_8_1x1_intrawave_v3,848.05,319.82,0.0
gfx942,304,45952,4096,4096,ck,0,0,1808.5772,a8w8_blockscale_1x128x128_256x128x128x128_16x16_32x32_2x2_8x32x1_8x32x1_1x32x1x8_8_1x1_intrawave_v3,852.54,321.49,0.0
gfx942,304,46080,4096,4096,ck,0,0,1842.7159,a8w8_blockscale_1x128x128_256x128x128x128_16x16_32x32_2x2_8x32x1_8x32x1_1x32x1x8_8_1x1_intrawave_v3,839.08,316.39,0.0
gfx942,304,46208,4096,4096,ck,0,0,1816.096,a8w8_blockscale_1x128x128_256x128x128x128_16x16_32x32_2x2_8x32x1_8x32x1_1x32x1x8_8_1x1_intrawave_v3,853.75,321.89,0.0
gfx942,304,46336,4096,4096,ck,0,0,1835.4407,a8w8_blockscale_1x128x128_256x128x128x128_16x16_32x32_2x2_8x32x1_8x32x1_1x32x1x8_8_1x1_intrawave_v3,847.09,319.35,0.0
gfx942,304,46464,4096,4096,ck,0,0,1828.6497,a8w8_blockscale_1x128x128_256x128x128x128_16x16_32x32_2x2_8x32x1_8x32x1_1x32x1x8_8_1x1_intrawave_v3,852.58,321.4,0.0
gfx942,304,46592,4096,4096,ck,0,0,1799.4005,a8w8_blockscale_1x128x128_256x128x128x128_16x16_32x32_2x2_8x32x1_8x32x1_1x32x1x8_8_1x1_intrawave_v3,868.83,327.5,0.0
gfx942,304,46720,4096,4096,ck,0,0,1845.4795,a8w8_blockscale_1x128x128_256x128x128x128_16x16_32x32_2x2_8x32x1_8x32x1_1x32x1x8_8_1x1_intrawave_v3,849.46,320.17,0.0
gfx942,304,46848,4096,4096,ck,0,0,1834.4554,a8w8_blockscale_1x128x128_256x128x128x128_16x16_32x32_2x2_8x32x1_8x32x1_1x32x1x8_8_1x1_intrawave_v3,856.91,322.95,0.0
gfx942,304,46976,4096,4096,ck,0,0,1836.2748,a8w8_blockscale_1x128x128_256x128x128x128_16x16_32x32_2x2_8x32x1_8x32x1_1x32x1x8_8_1x1_intrawave_v3,858.4,323.49,0.0
gfx942,304,47104,4096,4096,ck,0,0,1864.7171,a8w8_blockscale_1x128x128_256x128x128x128_16x16_32x32_2x2_8x32x1_8x32x1_1x32x1x8_8_1x1_intrawave_v3,847.61,319.4,0.0
gfx942,304,47232,4096,4096,ck,0,0,1849.344,a8w8_blockscale_1x128x128_256x128x128x128_16x16_32x32_2x2_8x32x1_8x32x1_1x32x1x8_8_1x1_intrawave_v3,856.98,322.91,0.0
gfx942,304,47360,4096,4096,ck,0,0,1889.0128,a8w8_blockscale_1x128x128_256x128x128x128_16x16_32x32_2x2_8x32x1_8x32x1_1x32x1x8_8_1x1_intrawave_v3,841.25,316.96,0.0
gfx942,304,47488,4096,4096,ck,0,0,1848.5998,a8w8_blockscale_1x128x128_256x128x128x128_16x16_32x32_2x2_8x32x1_8x32x1_1x32x1x8_8_1x1_intrawave_v3,861.97,324.74,0.0
gfx942,304,47616,4096,4096,ck,0,0,1855.5535,a8w8_blockscale_1x128x128_256x128x128x128_16x16_32x32_2x2_8x32x1_8x32x1_1x32x1x8_8_1x1_intrawave_v3,861.05,324.37,0.0
gfx942,304,47744,4096,4096,ck,0,0,1913.3374,a8w8_blockscale_1x128x128_256x128x128x128_16x16_32x32_2x2_8x32x1_8x32x1_1x32x1x8_8_1x1_intrawave_v3,837.29,315.39,0.0
gfx942,304,47872,4096,4096,ck,0,0,1859.8991,a8w8_blockscale_1x128x128_256x128x128x128_16x16_32x32_2x2_8x32x1_8x32x1_1x32x1x8_8_1x1_intrawave_v3,863.66,325.3,0.0
gfx942,304,48000,4096,4096,ck,0,0,1905.6027,a8w8_blockscale_1x128x128_256x128x128x128_16x16_32x32_2x2_8x32x1_8x32x1_1x32x1x8_8_1x1_intrawave_v3,845.2,318.33,0.0
gfx942,304,48128,4096,4096,ck,0,0,1885.8654,a8w8_blockscale_1x128x128_256x128x128x128_16x16_32x32_2x2_8x32x1_8x32x1_1x32x1x8_8_1x1_intrawave_v3,856.32,322.49,0.0
gfx942,304,48256,4096,4096,ck,0,0,1891.3483,a8w8_blockscale_1x128x128_256x128x128x128_16x16_32x32_2x2_8x32x1_8x32x1_1x32x1x8_8_1x1_intrawave_v3,856.11,322.39,0.0
gfx942,304,48384,4096,4096,ck,0,0,1905.6243,a8w8_blockscale_1x128x128_256x128x128x128_16x16_32x32_2x2_8x32x1_8x32x1_1x32x1x8_8_1x1_intrawave_v3,851.95,320.8,0.0
gfx942,304,48512,4096,4096,ck,0,0,1949.0387,a8w8_blockscale_1x128x128_256x128x128x128_16x16_32x32_2x2_8x32x1_8x32x1_1x32x1x8_8_1x1_intrawave_v3,835.18,314.46,0.0
gfx942,304,48640,4096,4096,ck,0,0,1959.7695,a8w8_blockscale_1x128x128_256x128x128x128_16x16_32x32_2x2_8x32x1_8x32x1_1x32x1x8_8_1x1_intrawave_v3,832.8,313.54,0.0
gfx942,304,48768,4096,4096,ck,0,0,1941.0611,a8w8_blockscale_1x128x128_256x128x128x128_16x16_32x32_2x2_8x32x1_8x32x1_1x32x1x8_8_1x1_intrawave_v3,843.04,317.37,0.0
gfx942,304,48896,4096,4096,ck,0,0,1912.5736,a8w8_blockscale_1x128x128_256x128x128x128_16x16_32x32_2x2_8x32x1_8x32x1_1x32x1x8_8_1x1_intrawave_v3,857.84,322.92,0.0
gfx942,304,49024,4096,4096,ck,0,0,1941.8699,a8w8_blockscale_1x128x128_256x128x128x128_16x16_32x32_2x2_8x32x1_8x32x1_1x32x1x8_8_1x1_intrawave_v3,847.11,318.86,0.0
gfx942,304,49152,4096,4096,ck,0,0,1906.3004,a8w8_blockscale_1x128x128_256x128x128x128_16x16_32x32_2x2_8x32x1_8x32x1_1x32x1x8_8_1x1_intrawave_v3,865.17,325.63,0.0
gfx942,304,49280,4096,4096,ck,0,0,1939.3311,a8w8_blockscale_1x128x128_256x128x128x128_16x16_32x32_2x2_8x32x1_8x32x1_1x32x1x8_8_1x1_intrawave_v3,852.65,320.9,0.0
gfx942,304,49408,4096,4096,ck,0,0,1944.8692,a8w8_blockscale_1x128x128_256x128x128x128_16x16_32x32_2x2_8x32x1_8x32x1_1x32x1x8_8_1x1_intrawave_v3,852.43,320.79,0.0
gfx942,304,49536,4096,4096,ck,0,0,1938.5801,a8w8_blockscale_1x128x128_256x128x128x128_16x16_32x32_2x2_8x32x1_8x32x1_1x32x1x8_8_1x1_intrawave_v3,857.41,322.65,0.0
gfx942,304,49664,4096,4096,ck,0,0,1948.6778,a8w8_blockscale_1x128x128_256x128x128x128_16x16_32x32_2x2_8x32x1_8x32x1_1x32x1x8_8_1x1_intrawave_v3,855.17,321.78,0.0
gfx942,304,49792,4096,4096,ck,0,0,1979.3633,a8w8_blockscale_1x128x128_256x128x128x128_16x16_32x32_2x2_8x32x1_8x32x1_1x32x1x8_8_1x1_intrawave_v3,844.08,317.59,0.0
gfx942,304,49920,4096,4096,ck,0,0,1963.9057,a8w8_blockscale_1x128x128_256x128x128x128_16x16_32x32_2x2_8x32x1_8x32x1_1x32x1x8_8_1x1_intrawave_v3,852.91,320.89,0.0
gfx942,304,50048,4096,4096,ck,0,0,1982.4236,a8w8_blockscale_1x128x128_256x128x128x128_16x16_32x32_2x2_8x32x1_8x32x1_1x32x1x8_8_1x1_intrawave_v3,847.11,318.68,0.0
gfx942,304,50176,4096,4096,ck,0,0,1986.548,a8w8_blockscale_1x128x128_256x128x128x128_16x16_32x32_2x2_8x32x1_8x32x1_1x32x1x8_8_1x1_intrawave_v3,847.51,318.81,0.0
gfx942,304,50304,4096,4096,ck,0,0,1999.3803,a8w8_blockscale_1x128x128_256x128x128x128_16x16_32x32_2x2_8x32x1_8x32x1_1x32x1x8_8_1x1_intrawave_v3,844.22,317.55,0.0
gfx942,304,50432,4096,4096,ck,0,0,2004.3009,a8w8_blockscale_1x128x128_256x128x128x128_16x16_32x32_2x2_8x32x1_8x32x1_1x32x1x8_8_1x1_intrawave_v3,844.29,317.56,0.0
gfx942,304,50560,4096,4096,ck,0,0,1980.7187,a8w8_blockscale_1x128x128_256x128x128x128_16x16_32x32_2x2_8x32x1_8x32x1_1x32x1x8_8_1x1_intrawave_v3,856.51,322.13,0.0
gfx942,304,50688,4096,4096,ck,0,0,2055.4133,a8w8_blockscale_1x128x128_256x128x128x128_16x16_32x32_2x2_8x32x1_8x32x1_1x32x1x8_8_1x1_intrawave_v3,827.48,311.19,0.0
gfx942,304,50816,4096,4096,ck,0,0,2018.782,a8w8_blockscale_1x128x128_256x128x128x128_16x16_32x32_2x2_8x32x1_8x32x1_1x32x1x8_8_1x1_intrawave_v3,844.62,317.62,0.0
gfx942,304,50944,4096,4096,ck,0,0,2000.1792,a8w8_blockscale_1x128x128_256x128x128x128_16x16_32x32_2x2_8x32x1_8x32x1_1x32x1x8_8_1x1_intrawave_v3,854.62,321.36,0.0
gfx942,304,51072,4096,4096,ck,0,0,2021.0806,a8w8_blockscale_1x128x128_256x128x128x128_16x16_32x32_2x2_8x32x1_8x32x1_1x32x1x8_8_1x1_intrawave_v3,847.91,318.81,0.0
gfx942,304,51200,4096,4096,ck,0,0,2025.3023,a8w8_blockscale_1x128x128_256x128x128x128_16x16_32x32_2x2_8x32x1_8x32x1_1x32x1x8_8_1x1_intrawave_v3,848.26,318.93,0.0
gfx942,304,51328,4096,4096,ck,0,0,2020.6653,a8w8_blockscale_1x128x128_256x128x128x128_16x16_32x32_2x2_8x32x1_8x32x1_1x32x1x8_8_1x1_intrawave_v3,852.33,320.44,0.0
gfx942,304,51456,4096,4096,ck,0,0,2017.1058,a8w8_blockscale_1x128x128_256x128x128x128_16x16_32x32_2x2_8x32x1_8x32x1_1x32x1x8_8_1x1_intrawave_v3,855.97,321.78,0.0
gfx942,304,51584,4096,4096,ck,0,0,2045.3578,a8w8_blockscale_1x128x128_256x128x128x128_16x16_32x32_2x2_8x32x1_8x32x1_1x32x1x8_8_1x1_intrawave_v3,846.24,318.11,0.0
gfx942,304,51712,4096,4096,ck,0,0,2050.0317,a8w8_blockscale_1x128x128_256x128x128x128_16x16_32x32_2x2_8x32x1_8x32x1_1x32x1x8_8_1x1_intrawave_v3,846.41,318.15,0.0
gfx942,304,51840,4096,4096,ck,0,0,2108.6318,a8w8_blockscale_1x128x128_256x128x128x128_16x16_32x32_2x2_8x32x1_8x32x1_1x32x1x8_8_1x1_intrawave_v3,824.92,310.05,0.0
gfx942,304,51968,4096,4096,ck,0,0,2071.9344,a8w8_blockscale_1x128x128_256x128x128x128_16x16_32x32_2x2_8x32x1_8x32x1_1x32x1x8_8_1x1_intrawave_v3,841.61,316.3,0.0
gfx942,304,52096,4096,4096,ck,0,0,2036.9557,a8w8_blockscale_1x128x128_256x128x128x128_16x16_32x32_2x2_8x32x1_8x32x1_1x32x1x8_8_1x1_intrawave_v3,858.17,322.51,0.0
gfx942,304,52224,4096,4096,ck,0,0,2114.8079,a8w8_blockscale_1x128x128_256x128x128x128_16x16_32x32_2x2_8x32x1_8x32x1_1x32x1x8_8_1x1_intrawave_v3,828.61,311.38,0.0
gfx942,304,52352,4096,4096,ck,0,0,2053.8366,a8w8_blockscale_1x128x128_256x128x128x128_16x16_32x32_2x2_8x32x1_8x32x1_1x32x1x8_8_1x1_intrawave_v3,855.3,321.39,0.0
gfx942,304,52480,4096,4096,ck,0,0,2089.3292,a8w8_blockscale_1x128x128_256x128x128x128_16x16_32x32_2x2_8x32x1_8x32x1_1x32x1x8_8_1x1_intrawave_v3,842.82,316.68,0.0
gfx942,304,52608,4096,4096,ck,0,0,2061.0838,a8w8_blockscale_1x128x128_256x128x128x128_16x16_32x32_2x2_8x32x1_8x32x1_1x32x1x8_8_1x1_intrawave_v3,856.46,321.78,0.0
gfx942,304,52736,4096,4096,ck,0,0,2096.2972,a8w8_blockscale_1x128x128_256x128x128x128_16x16_32x32_2x2_8x32x1_8x32x1_1x32x1x8_8_1x1_intrawave_v3,844.12,317.13,0.0
gfx942,304,52864,4096,4096,ck,0,0,2079.6631,a8w8_blockscale_1x128x128_256x128x128x128_16x16_32x32_2x2_8x32x1_8x32x1_1x32x1x8_8_1x1_intrawave_v3,852.94,320.42,0.0
gfx942,304,52992,4096,4096,ck,0,0,2078.3337,a8w8_blockscale_1x128x128_256x128x128x128_16x16_32x32_2x2_8x32x1_8x32x1_1x32x1x8_8_1x1_intrawave_v3,855.55,321.38,0.0
gfx942,304,53120,4096,4096,ck,0,0,2100.3473,a8w8_blockscale_1x128x128_256x128x128x128_16x16_32x32_2x2_8x32x1_8x32x1_1x32x1x8_8_1x1_intrawave_v3,848.63,318.76,0.0
gfx942,304,53248,4096,4096,ck,0,0,2113.5379,a8w8_blockscale_1x128x128_256x128x128x128_16x16_32x32_2x2_8x32x1_8x32x1_1x32x1x8_8_1x1_intrawave_v3,845.36,317.52,0.0
gfx942,304,53376,4096,4096,ck,0,0,2178.7346,a8w8_blockscale_1x128x128_256x128x128x128_16x16_32x32_2x2_8x32x1_8x32x1_1x32x1x8_8_1x1_intrawave_v3,822.04,308.74,0.0
gfx942,304,53504,4096,4096,ck,0,0,2130.2466,a8w8_blockscale_1x128x128_256x128x128x128_16x16_32x32_2x2_8x32x1_8x32x1_1x32x1x8_8_1x1_intrawave_v3,842.76,316.51,0.0
gfx942,304,53632,4096,4096,ck,0,0,2104.2849,a8w8_blockscale_1x128x128_256x128x128x128_16x16_32x32_2x2_8x32x1_8x32x1_1x32x1x8_8_1x1_intrawave_v3,855.2,321.16,0.0
gfx942,304,53760,4096,4096,ck,0,0,2135.0666,a8w8_blockscale_1x128x128_256x128x128x128_16x16_32x32_2x2_8x32x1_8x32x1_1x32x1x8_8_1x1_intrawave_v3,844.89,317.26,0.0
gfx942,304,53888,4096,4096,ck,0,0,2188.3224,a8w8_blockscale_1x128x128_256x128x128x128_16x16_32x32_2x2_8x32x1_8x32x1_1x32x1x8_8_1x1_intrawave_v3,826.29,310.26,0.0
gfx942,304,54016,4096,4096,ck,0,0,2150.5296,a8w8_blockscale_1x128x128_256x128x128x128_16x16_32x32_2x2_8x32x1_8x32x1_1x32x1x8_8_1x1_intrawave_v3,842.8,316.45,0.0
gfx942,304,54144,4096,4096,ck,0,0,2124.3727,a8w8_blockscale_1x128x128_256x128x128x128_16x16_32x32_2x2_8x32x1_8x32x1_1x32x1x8_8_1x1_intrawave_v3,855.2,321.08,0.0
gfx942,304,54272,4096,4096,ck,0,0,2116.5805,a8w8_blockscale_1x128x128_256x128x128x128_16x16_32x32_2x2_8x32x1_8x32x1_1x32x1x8_8_1x1_intrawave_v3,860.38,323.01,0.0
gfx942,304,54400,4096,4096,ck,0,0,2158.5296,a8w8_blockscale_1x128x128_256x128x128x128_16x16_32x32_2x2_8x32x1_8x32x1_1x32x1x8_8_1x1_intrawave_v3,845.65,317.46,0.0
gfx942,304,54528,4096,4096,ck,0,0,2168.8269,a8w8_blockscale_1x128x128_256x128x128x128_16x16_32x32_2x2_8x32x1_8x32x1_1x32x1x8_8_1x1_intrawave_v3,843.62,316.68,0.0
gfx942,304,54656,4096,4096,ck,0,0,2218.8467,a8w8_blockscale_1x128x128_256x128x128x128_16x16_32x32_2x2_8x32x1_8x32x1_1x32x1x8_8_1x1_intrawave_v3,826.53,310.25,0.0
gfx942,304,54784,4096,4096,ck,0,0,2162.4343,a8w8_blockscale_1x128x128_256x128x128x128_16x16_32x32_2x2_8x32x1_8x32x1_1x32x1x8_8_1x1_intrawave_v3,850.08,319.07,0.0
gfx942,304,54912,4096,4096,ck,0,0,2188.0476,a8w8_blockscale_1x128x128_256x128x128x128_16x16_32x32_2x2_8x32x1_8x32x1_1x32x1x8_8_1x1_intrawave_v3,842.09,316.05,0.0
gfx942,304,55040,4096,4096,ck,0,0,2160.1258,a8w8_blockscale_1x128x128_256x128x128x128_16x16_32x32_2x2_8x32x1_8x32x1_1x32x1x8_8_1x1_intrawave_v3,854.97,320.86,0.0
gfx942,304,55168,4096,4096,ck,0,0,2185.7347,a8w8_blockscale_1x128x128_256x128x128x128_16x16_32x32_2x2_8x32x1_8x32x1_1x32x1x8_8_1x1_intrawave_v3,846.91,317.83,0.0
gfx942,304,55296,4096,4096,ck,0,0,2168.6557,a8w8_blockscale_1x128x128_256x128x128x128_16x16_32x32_2x2_8x32x1_8x32x1_1x32x1x8_8_1x1_intrawave_v3,855.56,321.05,0.0
gfx942,304,55424,4096,4096,ck,0,0,2173.8011,a8w8_blockscale_1x128x128_256x128x128x128_16x16_32x32_2x2_8x32x1_8x32x1_1x32x1x8_8_1x1_intrawave_v3,855.52,321.02,0.0
gfx942,304,55552,4096,4096,ck,0,0,2169.3173,a8w8_blockscale_1x128x128_256x128x128x128_16x16_32x32_2x2_8x32x1_8x32x1_1x32x1x8_8_1x1_intrawave_v3,859.26,322.41,0.0
gfx942,304,55680,4096,4096,ck,0,0,2173.8001,a8w8_blockscale_1x128x128_256x128x128x128_16x16_32x32_2x2_8x32x1_8x32x1_1x32x1x8_8_1x1_intrawave_v3,859.47,322.46,0.0
gfx942,304,55808,4096,4096,ck,0,0,2235.2658,a8w8_blockscale_1x128x128_256x128x128x128_16x16_32x32_2x2_8x32x1_8x32x1_1x32x1x8_8_1x1_intrawave_v3,837.76,314.3,0.0
gfx942,304,55936,4096,4096,ck,0,0,2246.8436,a8w8_blockscale_1x128x128_256x128x128x128_16x16_32x32_2x2_8x32x1_8x32x1_1x32x1x8_8_1x1_intrawave_v3,835.35,313.38,0.0
gfx942,304,56064,4096,4096,ck,0,0,2224.7011,a8w8_blockscale_1x128x128_256x128x128x128_16x16_32x32_2x2_8x32x1_8x32x1_1x32x1x8_8_1x1_intrawave_v3,845.59,317.21,0.0
gfx942,304,56192,4096,4096,ck,0,0,2228.9344,a8w8_blockscale_1x128x128_256x128x128x128_16x16_32x32_2x2_8x32x1_8x32x1_1x32x1x8_8_1x1_intrawave_v3,845.92,317.31,0.0
gfx942,304,56320,4096,4096,ck,0,0,2259.0653,a8w8_blockscale_1x128x128_256x128x128x128_16x16_32x32_2x2_8x32x1_8x32x1_1x32x1x8_8_1x1_intrawave_v3,836.53,313.77,0.0
gfx942,304,56448,4096,4096,ck,0,0,2213.502,a8w8_blockscale_1x128x128_256x128x128x128_16x16_32x32_2x2_8x32x1_8x32x1_1x32x1x8_8_1x1_intrawave_v3,855.69,320.94,0.0
gfx942,304,56576,4096,4096,ck,0,0,2253.4007,a8w8_blockscale_1x128x128_256x128x128x128_16x16_32x32_2x2_8x32x1_8x32x1_1x32x1x8_8_1x1_intrawave_v3,842.45,315.96,0.0
gfx942,304,56704,4096,4096,ck,0,0,2219.3578,a8w8_blockscale_1x128x128_256x128x128x128_16x16_32x32_2x2_8x32x1_8x32x1_1x32x1x8_8_1x1_intrawave_v3,857.31,321.51,0.0
gfx942,304,56832,4096,4096,ck,0,0,2277.8855,a8w8_blockscale_1x128x128_256x128x128x128_16x16_32x32_2x2_8x32x1_8x32x1_1x32x1x8_8_1x1_intrawave_v3,837.16,313.94,0.0
gfx942,304,56960,4096,4096,ck,0,0,2257.9589,a8w8_blockscale_1x128x128_256x128x128x128_16x16_32x32_2x2_8x32x1_8x32x1_1x32x1x8_8_1x1_intrawave_v3,846.45,317.41,0.0
gfx942,304,57088,4096,4096,ck,0,0,2235.8801,a8w8_blockscale_1x128x128_256x128x128x128_16x16_32x32_2x2_8x32x1_8x32x1_1x32x1x8_8_1x1_intrawave_v3,856.73,321.25,0.0
gfx942,304,57216,4096,4096,ck,0,0,2238.1825,a8w8_blockscale_1x128x128_256x128x128x128_16x16_32x32_2x2_8x32x1_8x32x1_1x32x1x8_8_1x1_intrawave_v3,857.77,321.62,0.0
gfx942,304,57344,4096,4096,ck,0,0,2244.4028,a8w8_blockscale_1x128x128_256x128x128x128_16x16_32x32_2x2_8x32x1_8x32x1_1x32x1x8_8_1x1_intrawave_v3,857.31,321.43,0.0
gfx942,304,57472,4096,4096,ck,0,0,2261.7416,a8w8_blockscale_1x128x128_256x128x128x128_16x16_32x32_2x2_8x32x1_8x32x1_1x32x1x8_8_1x1_intrawave_v3,852.64,319.66,0.0
gfx942,304,57600,4096,4096,ck,0,0,2340.9838,a8w8_blockscale_1x128x128_256x128x128x128_16x16_32x32_2x2_8x32x1_8x32x1_1x32x1x8_8_1x1_intrawave_v3,825.61,309.51,0.0
gfx942,304,57728,4096,4096,ck,0,0,2279.5667,a8w8_blockscale_1x128x128_256x128x128x128_16x16_32x32_2x2_8x32x1_8x32x1_1x32x1x8_8_1x1_intrawave_v3,849.74,318.54,0.0
gfx942,304,57856,4096,4096,ck,0,0,2292.3851,a8w8_blockscale_1x128x128_256x128x128x128_16x16_32x32_2x2_8x32x1_8x32x1_1x32x1x8_8_1x1_intrawave_v3,846.86,317.45,0.0
gfx942,304,57984,4096,4096,ck,0,0,2279.2283,a8w8_blockscale_1x128x128_256x128x128x128_16x16_32x32_2x2_8x32x1_8x32x1_1x32x1x8_8_1x1_intrawave_v3,853.63,319.97,0.0
gfx942,304,58112,4096,4096,ck,0,0,2273.7836,a8w8_blockscale_1x128x128_256x128x128x128_16x16_32x32_2x2_8x32x1_8x32x1_1x32x1x8_8_1x1_intrawave_v3,857.56,321.43,0.0
gfx942,304,58240,4096,4096,ck,0,0,2317.6182,a8w8_blockscale_1x128x128_256x128x128x128_16x16_32x32_2x2_8x32x1_8x32x1_1x32x1x8_8_1x1_intrawave_v3,843.2,316.03,0.0
gfx942,304,58368,4096,4096,ck,0,0,2321.0731,a8w8_blockscale_1x128x128_256x128x128x128_16x16_32x32_2x2_8x32x1_8x32x1_1x32x1x8_8_1x1_intrawave_v3,843.79,316.23,0.0
gfx942,304,58496,4096,4096,ck,0,0,2290.5527,a8w8_blockscale_1x128x128_256x128x128x128_16x16_32x32_2x2_8x32x1_8x32x1_1x32x1x8_8_1x1_intrawave_v3,856.91,321.13,0.0
gfx942,304,58624,4096,4096,ck,0,0,2318.0229,a8w8_blockscale_1x128x128_256x128x128x128_16x16_32x32_2x2_8x32x1_8x32x1_1x32x1x8_8_1x1_intrawave_v3,848.61,318.01,0.0
gfx942,304,58752,4096,4096,ck,0,0,2298.2109,a8w8_blockscale_1x128x128_256x128x128x128_16x16_32x32_2x2_8x32x1_8x32x1_1x32x1x8_8_1x1_intrawave_v3,857.79,321.43,0.0
gfx942,304,58880,4096,4096,ck,0,0,2305.4077,a8w8_blockscale_1x128x128_256x128x128x128_16x16_32x32_2x2_8x32x1_8x32x1_1x32x1x8_8_1x1_intrawave_v3,856.98,321.11,0.0
gfx942,304,59008,4096,4096,ck,0,0,2345.1789,a8w8_blockscale_1x128x128_256x128x128x128_16x16_32x32_2x2_8x32x1_8x32x1_1x32x1x8_8_1x1_intrawave_v3,844.28,316.34,0.0
gfx942,304,59136,4096,4096,ck,0,0,2401.5942,a8w8_blockscale_1x128x128_256x128x128x128_16x16_32x32_2x2_8x32x1_8x32x1_1x32x1x8_8_1x1_intrawave_v3,826.23,309.56,0.0
gfx942,304,59264,4096,4096,ck,0,0,2315.8097,a8w8_blockscale_1x128x128_256x128x128x128_16x16_32x32_2x2_8x32x1_8x32x1_1x32x1x8_8_1x1_intrawave_v3,858.69,321.71,0.0
gfx942,304,59392,4096,4096,ck,0,0,2296.9598,a8w8_blockscale_1x128x128_256x128x128x128_16x16_32x32_2x2_8x32x1_8x32x1_1x32x1x8_8_1x1_intrawave_v3,867.61,325.03,0.0
gfx942,304,59520,4096,4096,ck,0,0,2387.6295,a8w8_blockscale_1x128x128_256x128x128x128_16x16_32x32_2x2_8x32x1_8x32x1_1x32x1x8_8_1x1_intrawave_v3,836.46,313.35,0.0
gfx942,304,59648,4096,4096,ck,0,0,2309.1039,a8w8_blockscale_1x128x128_256x128x128x128_16x16_32x32_2x2_8x32x1_8x32x1_1x32x1x8_8_1x1_intrawave_v3,866.77,324.69,0.0
gfx942,304,59776,4096,4096,ck,0,0,2328.3813,a8w8_blockscale_1x128x128_256x128x128x128_16x16_32x32_2x2_8x32x1_8x32x1_1x32x1x8_8_1x1_intrawave_v3,861.44,322.67,0.0
gfx942,304,59904,4096,4096,ck,0,0,2376.6013,a8w8_blockscale_1x128x128_256x128x128x128_16x16_32x32_2x2_8x32x1_8x32x1_1x32x1x8_8_1x1_intrawave_v3,845.76,316.79,0.0
gfx942,304,60032,4096,4096,ck,0,0,2388.6422,a8w8_blockscale_1x128x128_256x128x128x128_16x16_32x32_2x2_8x32x1_8x32x1_1x32x1x8_8_1x1_intrawave_v3,843.3,315.85,0.0
gfx942,304,60160,4096,4096,ck,0,0,2365.0814,a8w8_blockscale_1x128x128_256x128x128x128_16x16_32x32_2x2_8x32x1_8x32x1_1x32x1x8_8_1x1_intrawave_v3,853.52,319.66,0.0
gfx942,304,60288,4096,4096,ck,0,0,2344.611,a8w8_blockscale_1x128x128_256x128x128x128_16x16_32x32_2x2_8x32x1_8x32x1_1x32x1x8_8_1x1_intrawave_v3,862.8,323.12,0.0
gfx942,304,60416,4096,4096,ck,0,0,2432.8092,a8w8_blockscale_1x128x128_256x128x128x128_16x16_32x32_2x2_8x32x1_8x32x1_1x32x1x8_8_1x1_intrawave_v3,833.29,312.05,0.0
gfx942,304,60544,4096,4096,ck,0,0,2386.4955,a8w8_blockscale_1x128x128_256x128x128x128_16x16_32x32_2x2_8x32x1_8x32x1_1x32x1x8_8_1x1_intrawave_v3,851.26,318.77,0.0
gfx942,304,60672,4096,4096,ck,0,0,2453.635,a8w8_blockscale_1x128x128_256x128x128x128_16x16_32x32_2x2_8x32x1_8x32x1_1x32x1x8_8_1x1_intrawave_v3,829.71,310.69,0.0
gfx942,304,60800,4096,4096,ck,0,0,2365.73,a8w8_blockscale_1x128x128_256x128x128x128_16x16_32x32_2x2_8x32x1_8x32x1_1x32x1x8_8_1x1_intrawave_v3,862.36,322.9,0.0
gfx942,304,60928,4096,4096,ck,0,0,2418.142,a8w8_blockscale_1x128x128_256x128x128x128_16x16_32x32_2x2_8x32x1_8x32x1_1x32x1x8_8_1x1_intrawave_v3,845.44,316.55,0.0
gfx942,304,61056,4096,4096,ck,0,0,2399.5239,a8w8_blockscale_1x128x128_256x128x128x128_16x16_32x32_2x2_8x32x1_8x32x1_1x32x1x8_8_1x1_intrawave_v3,853.79,319.66,0.0
gfx942,304,61184,4096,4096,ck,0,0,2412.8885,a8w8_blockscale_1x128x128_256x128x128x128_16x16_32x32_2x2_8x32x1_8x32x1_1x32x1x8_8_1x1_intrawave_v3,850.85,318.54,0.0
gfx942,304,61312,4096,4096,ck,0,0,2444.6959,a8w8_blockscale_1x128x128_256x128x128x128_16x16_32x32_2x2_8x32x1_8x32x1_1x32x1x8_8_1x1_intrawave_v3,841.53,315.04,0.0
gfx942,304,61440,4096,4096,ck,0,0,2392.8788,a8w8_blockscale_1x128x128_256x128x128x128_16x16_32x32_2x2_8x32x1_8x32x1_1x32x1x8_8_1x1_intrawave_v3,861.55,322.52,0.0
gfx942,304,61568,4096,4096,ck,0,0,2423.9402,a8w8_blockscale_1x128x128_256x128x128x128_16x16_32x32_2x2_8x32x1_8x32x1_1x32x1x8_8_1x1_intrawave_v3,852.28,319.04,0.0
gfx942,304,61696,4096,4096,ck,0,0,2463.0802,a8w8_blockscale_1x128x128_256x128x128x128_16x16_32x32_2x2_8x32x1_8x32x1_1x32x1x8_8_1x1_intrawave_v3,840.48,314.61,0.0
gfx942,304,61824,4096,4096,ck,0,0,2409.567,a8w8_blockscale_1x128x128_256x128x128x128_16x16_32x32_2x2_8x32x1_8x32x1_1x32x1x8_8_1x1_intrawave_v3,860.93,322.24,0.0
gfx942,304,61952,4096,4096,ck,0,0,2429.2108,a8w8_blockscale_1x128x128_256x128x128x128_16x16_32x32_2x2_8x32x1_8x32x1_1x32x1x8_8_1x1_intrawave_v3,855.74,320.29,0.0
gfx942,304,62080,4096,4096,ck,0,0,2462.4934,a8w8_blockscale_1x128x128_256x128x128x128_16x16_32x32_2x2_8x32x1_8x32x1_1x32x1x8_8_1x1_intrawave_v3,845.91,316.6,0.0
gfx942,304,62208,4096,4096,ck,0,0,2432.5761,a8w8_blockscale_1x128x128_256x128x128x128_16x16_32x32_2x2_8x32x1_8x32x1_1x32x1x8_8_1x1_intrawave_v3,858.08,321.14,0.0
gfx942,304,62336,4096,4096,ck,0,0,2436.3587,a8w8_blockscale_1x128x128_256x128x128x128_16x16_32x32_2x2_8x32x1_8x32x1_1x32x1x8_8_1x1_intrawave_v3,858.51,321.28,0.0
gfx942,304,62464,4096,4096,ck,0,0,2445.1388,a8w8_blockscale_1x128x128_256x128x128x128_16x16_32x32_2x2_8x32x1_8x32x1_1x32x1x8_8_1x1_intrawave_v3,857.19,320.77,0.0
gfx942,304,62592,4096,4096,ck,0,0,2483.9105,a8w8_blockscale_1x128x128_256x128x128x128_16x16_32x32_2x2_8x32x1_8x32x1_1x32x1x8_8_1x1_intrawave_v3,845.54,316.4,0.0
gfx942,304,62720,4096,4096,ck,0,0,2482.2082,a8w8_blockscale_1x128x128_256x128x128x128_16x16_32x32_2x2_8x32x1_8x32x1_1x32x1x8_8_1x1_intrawave_v3,847.85,317.25,0.0
gfx942,304,62848,4096,4096,ck,0,0,2496.6179,a8w8_blockscale_1x128x128_256x128x128x128_16x16_32x32_2x2_8x32x1_8x32x1_1x32x1x8_8_1x1_intrawave_v3,844.67,316.05,0.0
gfx942,304,62976,4096,4096,ck,0,0,2460.4166,a8w8_blockscale_1x128x128_256x128x128x128_16x16_32x32_2x2_8x32x1_8x32x1_1x32x1x8_8_1x1_intrawave_v3,858.85,321.34,0.0
gfx942,304,63104,4096,4096,ck,0,0,2472.3439,a8w8_blockscale_1x128x128_256x128x128x128_16x16_32x32_2x2_8x32x1_8x32x1_1x32x1x8_8_1x1_intrawave_v3,856.44,320.42,0.0
gfx942,304,63232,4096,4096,ck,0,0,2468.6662,a8w8_blockscale_1x128x128_256x128x128x128_16x16_32x32_2x2_8x32x1_8x32x1_1x32x1x8_8_1x1_intrawave_v3,859.46,321.54,0.0
gfx942,304,63360,4096,4096,ck,0,0,2476.388,a8w8_blockscale_1x128x128_256x128x128x128_16x16_32x32_2x2_8x32x1_8x32x1_1x32x1x8_8_1x1_intrawave_v3,858.51,321.17,0.0
gfx942,304,63488,4096,4096,ck,0,0,2478.5356,a8w8_blockscale_1x128x128_256x128x128x128_16x16_32x32_2x2_8x32x1_8x32x1_1x32x1x8_8_1x1_intrawave_v3,859.5,321.53,0.0
gfx942,304,63616,4096,4096,ck,0,0,2559.4394,a8w8_blockscale_1x128x128_256x128x128x128_16x16_32x32_2x2_8x32x1_8x32x1_1x32x1x8_8_1x1_intrawave_v3,834.01,311.98,0.0
gfx942,304,63744,4096,4096,ck,0,0,2497.016,a8w8_blockscale_1x128x128_256x128x128x128_16x16_32x32_2x2_8x32x1_8x32x1_1x32x1x8_8_1x1_intrawave_v3,856.58,320.41,0.0
gfx942,304,63872,4096,4096,ck,0,0,2550.8591,a8w8_blockscale_1x128x128_256x128x128x128_16x16_32x32_2x2_8x32x1_8x32x1_1x32x1x8_8_1x1_intrawave_v3,840.18,314.26,0.0
gfx942,304,64000,4096,4096,ck,0,0,2542.5422,a8w8_blockscale_1x128x128_256x128x128x128_16x16_32x32_2x2_8x32x1_8x32x1_1x32x1x8_8_1x1_intrawave_v3,844.62,315.91,0.0
gfx942,304,64128,4096,4096,ck,0,0,2505.8354,a8w8_blockscale_1x128x128_256x128x128x128_16x16_32x32_2x2_8x32x1_8x32x1_1x32x1x8_8_1x1_intrawave_v3,858.71,321.16,0.0
gfx942,304,64256,4096,4096,ck,0,0,2560.1971,a8w8_blockscale_1x128x128_256x128x128x128_16x16_32x32_2x2_8x32x1_8x32x1_1x32x1x8_8_1x1_intrawave_v3,842.15,314.96,0.0
gfx942,304,64384,4096,4096,ck,0,0,2619.5853,a8w8_blockscale_1x128x128_256x128x128x128_16x16_32x32_2x2_8x32x1_8x32x1_1x32x1x8_8_1x1_intrawave_v3,824.7,308.42,0.0
gfx942,304,64512,4096,4096,ck,0,0,2565.642,a8w8_blockscale_1x128x128_256x128x128x128_16x16_32x32_2x2_8x32x1_8x32x1_1x32x1x8_8_1x1_intrawave_v3,843.71,315.52,0.0
gfx942,304,64640,4096,4096,ck,0,0,2524.3102,a8w8_blockscale_1x128x128_256x128x128x128_16x16_32x32_2x2_8x32x1_8x32x1_1x32x1x8_8_1x1_intrawave_v3,859.23,321.31,0.0
gfx942,304,64768,4096,4096,ck,0,0,2532.4796,a8w8_blockscale_1x128x128_256x128x128x128_16x16_32x32_2x2_8x32x1_8x32x1_1x32x1x8_8_1x1_intrawave_v3,858.15,320.89,0.0
gfx942,304,64896,4096,4096,ck,0,0,2527.1528,a8w8_blockscale_1x128x128_256x128x128x128_16x16_32x32_2x2_8x32x1_8x32x1_1x32x1x8_8_1x1_intrawave_v3,861.66,322.19,0.0
gfx942,304,65024,4096,4096,ck,0,0,2533.2474,a8w8_blockscale_1x128x128_256x128x128x128_16x16_32x32_2x2_8x32x1_8x32x1_1x32x1x8_8_1x1_intrawave_v3,861.28,322.03,0.0
gfx942,304,65152,4096,4096,ck,0,0,2596.5137,a8w8_blockscale_1x128x128_256x128x128x128_16x16_32x32_2x2_8x32x1_8x32x1_1x32x1x8_8_1x1_intrawave_v3,841.95,314.79,0.0
gfx942,304,65280,4096,4096,ck,0,0,2587.2098,a8w8_blockscale_1x128x128_256x128x128x128_16x16_32x32_2x2_8x32x1_8x32x1_1x32x1x8_8_1x1_intrawave_v3,846.64,316.53,0.0
gfx942,304,65408,4096,4096,ck,0,0,2560.159,a8w8_blockscale_1x128x128_256x128x128x128_16x16_32x32_2x2_8x32x1_8x32x1_1x32x1x8_8_1x1_intrawave_v3,857.26,320.49,0.0
gfx942,304,65536,4096,4096,ck,0,0,2598.3875,a8w8_blockscale_1x128x128_256x128x128x128_16x16_32x32_2x2_8x32x1_8x32x1_1x32x1x8_8_1x1_intrawave_v3,846.3,316.38,0.0
gfx942,304,65664,4096,4096,ck,0,0,2596.7966,a8w8_blockscale_1x128x128_256x128x128x128_16x16_32x32_2x2_8x32x1_8x32x1_1x32x1x8_8_1x1_intrawave_v3,848.48,317.18,0.0
gfx942,304,65792,4096,4096,ck,0,0,2574.0321,a8w8_blockscale_1x128x128_256x128x128x128_16x16_32x32_2x2_8x32x1_8x32x1_1x32x1x8_8_1x1_intrawave_v3,857.65,320.6,0.0
gfx942,304,65920,4096,4096,ck,0,0,2633.2085,a8w8_blockscale_1x128x128_256x128x128x128_16x16_32x32_2x2_8x32x1_8x32x1_1x32x1x8_8_1x1_intrawave_v3,840.0,313.99,0.0
gfx942,304,66048,4096,4096,ck,0,0,2590.9575,a8w8_blockscale_1x128x128_256x128x128x128_16x16_32x32_2x2_8x32x1_8x32x1_1x32x1x8_8_1x1_intrawave_v3,855.36,319.72,0.0
gfx942,304,66176,4096,4096,ck,0,0,2589.5565,a8w8_blockscale_1x128x128_256x128x128x128_16x16_32x32_2x2_8x32x1_8x32x1_1x32x1x8_8_1x1_intrawave_v3,857.48,320.5,0.0
gfx942,304,66304,4096,4096,ck,0,0,2652.5427,a8w8_blockscale_1x128x128_256x128x128x128_16x16_32x32_2x2_8x32x1_8x32x1_1x32x1x8_8_1x1_intrawave_v3,838.74,313.48,0.0
gfx942,304,66432,4096,4096,ck,0,0,2598.5989,a8w8_blockscale_1x128x128_256x128x128x128_16x16_32x32_2x2_8x32x1_8x32x1_1x32x1x8_8_1x1_intrawave_v3,857.8,320.59,0.0
gfx942,304,66560,4096,4096,ck,0,0,2651.5976,a8w8_blockscale_1x128x128_256x128x128x128_16x16_32x32_2x2_8x32x1_8x32x1_1x32x1x8_8_1x1_intrawave_v3,842.28,314.78,0.0
gfx942,304,66688,4096,4096,ck,0,0,2655.7077,a8w8_blockscale_1x128x128_256x128x128x128_16x16_32x32_2x2_8x32x1_8x32x1_1x32x1x8_8_1x1_intrawave_v3,842.59,314.88,0.0
gfx942,304,66816,4096,4096,ck,0,0,2631.1969,a8w8_blockscale_1x128x128_256x128x128x128_16x16_32x32_2x2_8x32x1_8x32x1_1x32x1x8_8_1x1_intrawave_v3,852.07,318.41,0.0
gfx942,304,66944,4096,4096,ck,0,0,2646.7021,a8w8_blockscale_1x128x128_256x128x128x128_16x16_32x32_2x2_8x32x1_8x32x1_1x32x1x8_8_1x1_intrawave_v3,848.7,317.14,0.0
gfx942,304,67072,4096,4096,ck,0,0,2615.1302,a8w8_blockscale_1x128x128_256x128x128x128_16x16_32x32_2x2_8x32x1_8x32x1_1x32x1x8_8_1x1_intrawave_v3,860.59,321.57,0.0
gfx942,304,67200,4096,4096,ck,0,0,2652.8873,a8w8_blockscale_1x128x128_256x128x128x128_16x16_32x32_2x2_8x32x1_8x32x1_1x32x1x8_8_1x1_intrawave_v3,849.96,317.59,0.0
gfx942,304,67328,4096,4096,ck,0,0,2681.8807,a8w8_blockscale_1x128x128_256x128x128x128_16x16_32x32_2x2_8x32x1_8x32x1_1x32x1x8_8_1x1_intrawave_v3,842.38,314.74,0.0
gfx942,304,67456,4096,4096,ck,0,0,2684.2973,a8w8_blockscale_1x128x128_256x128x128x128_16x16_32x32_2x2_8x32x1_8x32x1_1x32x1x8_8_1x1_intrawave_v3,843.22,315.05,0.0
gfx942,304,67584,4096,4096,ck,0,0,2701.0795,a8w8_blockscale_1x128x128_256x128x128x128_16x16_32x32_2x2_8x32x1_8x32x1_1x32x1x8_8_1x1_intrawave_v3,839.57,313.67,0.0
gfx942,304,67712,4096,4096,ck,0,0,2661.3546,a8w8_blockscale_1x128x128_256x128x128x128_16x16_32x32_2x2_8x32x1_8x32x1_1x32x1x8_8_1x1_intrawave_v3,853.71,318.94,0.0
gfx942,304,67840,4096,4096,ck,0,0,2675.0929,a8w8_blockscale_1x128x128_256x128x128x128_16x16_32x32_2x2_8x32x1_8x32x1_1x32x1x8_8_1x1_intrawave_v3,850.94,317.89,0.0
gfx942,304,67968,4096,4096,ck,0,0,2685.7224,a8w8_blockscale_1x128x128_256x128x128x128_16x16_32x32_2x2_8x32x1_8x32x1_1x32x1x8_8_1x1_intrawave_v3,849.17,317.22,0.0
gfx942,304,68096,4096,4096,ck,0,0,2669.9319,a8w8_blockscale_1x128x128_256x128x128x128_16x16_32x32_2x2_8x32x1_8x32x1_1x32x1x8_8_1x1_intrawave_v3,855.8,319.69,0.0
gfx942,304,68224,4096,4096,ck,0,0,2694.6026,a8w8_blockscale_1x128x128_256x128x128x128_16x16_32x32_2x2_8x32x1_8x32x1_1x32x1x8_8_1x1_intrawave_v3,849.56,317.34,0.0
gfx942,304,68352,4096,4096,ck,0,0,2662.8171,a8w8_blockscale_1x128x128_256x128x128x128_16x16_32x32_2x2_8x32x1_8x32x1_1x32x1x8_8_1x1_intrawave_v3,861.31,321.72,0.0
gfx942,304,68480,4096,4096,ck,0,0,2676.919,a8w8_blockscale_1x128x128_256x128x128x128_16x16_32x32_2x2_8x32x1_8x32x1_1x32x1x8_8_1x1_intrawave_v3,858.38,320.61,0.0
gfx942,304,68608,4096,4096,ck,0,0,2676.028,a8w8_blockscale_1x128x128_256x128x128x128_16x16_32x32_2x2_8x32x1_8x32x1_1x32x1x8_8_1x1_intrawave_v3,860.27,321.31,0.0
gfx942,304,68736,4096,4096,ck,0,0,2691.8307,a8w8_blockscale_1x128x128_256x128x128x128_16x16_32x32_2x2_8x32x1_8x32x1_1x32x1x8_8_1x1_intrawave_v3,856.81,320.01,0.0
gfx942,304,68864,4096,4096,ck,0,0,2693.4584,a8w8_blockscale_1x128x128_256x128x128x128_16x16_32x32_2x2_8x32x1_8x32x1_1x32x1x8_8_1x1_intrawave_v3,857.89,320.4,0.0
gfx942,304,68992,4096,4096,ck,0,0,2703.1577,a8w8_blockscale_1x128x128_256x128x128x128_16x16_32x32_2x2_8x32x1_8x32x1_1x32x1x8_8_1x1_intrawave_v3,856.4,319.83,0.0
gfx942,304,69120,4096,4096,ck,0,0,2804.0111,a8w8_blockscale_1x128x128_256x128x128x128_16x16_32x32_2x2_8x32x1_8x32x1_1x32x1x8_8_1x1_intrawave_v3,827.13,308.89,0.0
gfx942,304,69248,4096,4096,ck,0,0,2730.4394,a8w8_blockscale_1x128x128_256x128x128x128_16x16_32x32_2x2_8x32x1_8x32x1_1x32x1x8_8_1x1_intrawave_v3,850.99,317.79,0.0
gfx942,304,69376,4096,4096,ck,0,0,2710.3272,a8w8_blockscale_1x128x128_256x128x128x128_16x16_32x32_2x2_8x32x1_8x32x1_1x32x1x8_8_1x1_intrawave_v3,858.89,320.72,0.0
gfx942,304,69504,4096,4096,ck,0,0,2700.1338,a8w8_blockscale_1x128x128_256x128x128x128_16x16_32x32_2x2_8x32x1_8x32x1_1x32x1x8_8_1x1_intrawave_v3,863.72,322.52,0.0
gfx942,304,69632,4096,4096,ck,0,0,2731.703,a8w8_blockscale_1x128x128_256x128x128x128_16x16_32x32_2x2_8x32x1_8x32x1_1x32x1x8_8_1x1_intrawave_v3,855.31,319.37,0.0
gfx942,304,69760,4096,4096,ck,0,0,2776.3739,a8w8_blockscale_1x128x128_256x128x128x128_16x16_32x32_2x2_8x32x1_8x32x1_1x32x1x8_8_1x1_intrawave_v3,843.1,314.79,0.0
gfx942,304,69888,4096,4096,ck,0,0,2775.7724,a8w8_blockscale_1x128x128_256x128x128x128_16x16_32x32_2x2_8x32x1_8x32x1_1x32x1x8_8_1x1_intrawave_v3,844.83,315.43,0.0
gfx942,304,70016,4096,4096,ck,0,0,2752.0419,a8w8_blockscale_1x128x128_256x128x128x128_16x16_32x32_2x2_8x32x1_8x32x1_1x32x1x8_8_1x1_intrawave_v3,853.67,318.72,0.0
gfx942,304,70144,4096,4096,ck,0,0,2797.281,a8w8_blockscale_1x128x128_256x128x128x128_16x16_32x32_2x2_8x32x1_8x32x1_1x32x1x8_8_1x1_intrawave_v3,841.4,314.13,0.0
gfx942,304,70272,4096,4096,ck,0,0,2861.7893,a8w8_blockscale_1x128x128_256x128x128x128_16x16_32x32_2x2_8x32x1_8x32x1_1x32x1x8_8_1x1_intrawave_v3,823.94,307.6,0.0
gfx942,304,70400,4096,4096,ck,0,0,2758.5957,a8w8_blockscale_1x128x128_256x128x128x128_16x16_32x32_2x2_8x32x1_8x32x1_1x32x1x8_8_1x1_intrawave_v3,856.32,319.67,0.0
gfx942,304,70528,4096,4096,ck,0,0,2789.6126,a8w8_blockscale_1x128x128_256x128x128x128_16x16_32x32_2x2_8x32x1_8x32x1_1x32x1x8_8_1x1_intrawave_v3,848.34,316.68,0.0
gfx942,304,70656,4096,4096,ck,0,0,2758.765,a8w8_blockscale_1x128x128_256x128x128x128_16x16_32x32_2x2_8x32x1_8x32x1_1x32x1x8_8_1x1_intrawave_v3,859.38,320.8,0.0
gfx942,304,70784,4096,4096,ck,0,0,2875.3538,a8w8_blockscale_1x128x128_256x128x128x128_16x16_32x32_2x2_8x32x1_8x32x1_1x32x1x8_8_1x1_intrawave_v3,826.03,308.33,0.0
gfx942,304,70912,4096,4096,ck,0,0,2773.9827,a8w8_blockscale_1x128x128_256x128x128x128_16x16_32x32_2x2_8x32x1_8x32x1_1x32x1x8_8_1x1_intrawave_v3,857.76,320.17,0.0
gfx942,304,71040,4096,4096,ck,0,0,2844.1282,a8w8_blockscale_1x128x128_256x128x128x128_16x16_32x32_2x2_8x32x1_8x32x1_1x32x1x8_8_1x1_intrawave_v3,838.12,312.83,0.0
gfx942,304,71168,4096,4096,ck,0,0,2821.9667,a8w8_blockscale_1x128x128_256x128x128x128_16x16_32x32_2x2_8x32x1_8x32x1_1x32x1x8_8_1x1_intrawave_v3,846.22,315.84,0.0
gfx942,304,71296,4096,4096,ck,0,0,2834.1707,a8w8_blockscale_1x128x128_256x128x128x128_16x16_32x32_2x2_8x32x1_8x32x1_1x32x1x8_8_1x1_intrawave_v3,844.09,315.03,0.0
gfx942,304,71424,4096,4096,ck,0,0,2793.1701,a8w8_blockscale_1x128x128_256x128x128x128_16x16_32x32_2x2_8x32x1_8x32x1_1x32x1x8_8_1x1_intrawave_v3,858.02,320.22,0.0
gfx942,304,71552,4096,4096,ck,0,0,2843.2048,a8w8_blockscale_1x128x128_256x128x128x128_16x16_32x32_2x2_8x32x1_8x32x1_1x32x1x8_8_1x1_intrawave_v3,844.43,315.14,0.0
gfx942,304,71680,4096,4096,ck,0,0,2845.9151,a8w8_blockscale_1x128x128_256x128x128x128_16x16_32x32_2x2_8x32x1_8x32x1_1x32x1x8_8_1x1_intrawave_v3,845.13,315.39,0.0
gfx942,304,71808,4096,4096,ck,0,0,2798.9244,a8w8_blockscale_1x128x128_256x128x128x128_16x16_32x32_2x2_8x32x1_8x32x1_1x32x1x8_8_1x1_intrawave_v3,860.86,321.25,0.0
gfx942,304,71936,4096,4096,ck,0,0,2810.6271,a8w8_blockscale_1x128x128_256x128x128x128_16x16_32x32_2x2_8x32x1_8x32x1_1x32x1x8_8_1x1_intrawave_v3,858.8,320.47,0.0
gfx942,304,72064,4096,4096,ck,0,0,2802.8144,a8w8_blockscale_1x128x128_256x128x128x128_16x16_32x32_2x2_8x32x1_8x32x1_1x32x1x8_8_1x1_intrawave_v3,862.73,321.93,0.0
gfx942,304,72192,4096,4096,ck,0,0,2785.3203,a8w8_blockscale_1x128x128_256x128x128x128_16x16_32x32_2x2_8x32x1_8x32x1_1x32x1x8_8_1x1_intrawave_v3,869.69,324.51,0.0
gfx942,304,72320,4096,4096,ck,0,0,2842.8813,a8w8_blockscale_1x128x128_256x128x128x128_16x16_32x32_2x2_8x32x1_8x32x1_1x32x1x8_8_1x1_intrawave_v3,853.59,318.5,0.0
gfx942,304,72448,4096,4096,ck,0,0,2887.387,a8w8_blockscale_1x128x128_256x128x128x128_16x16_32x32_2x2_8x32x1_8x32x1_1x32x1x8_8_1x1_intrawave_v3,841.92,314.13,0.0
gfx942,304,72576,4096,4096,ck,0,0,2864.5145,a8w8_blockscale_1x128x128_256x128x128x128_16x16_32x32_2x2_8x32x1_8x32x1_1x32x1x8_8_1x1_intrawave_v3,850.14,317.19,0.0
gfx942,304,72704,4096,4096,ck,0,0,2863.3899,a8w8_blockscale_1x128x128_256x128x128x128_16x16_32x32_2x2_8x32x1_8x32x1_1x32x1x8_8_1x1_intrawave_v3,851.98,317.86,0.0
gfx942,304,72832,4096,4096,ck,0,0,2896.1488,a8w8_blockscale_1x128x128_256x128x128x128_16x16_32x32_2x2_8x32x1_8x32x1_1x32x1x8_8_1x1_intrawave_v3,843.82,314.81,0.0
gfx942,304,72960,4096,4096,ck,0,0,2921.3181,a8w8_blockscale_1x128x128_256x128x128x128_16x16_32x32_2x2_8x32x1_8x32x1_1x32x1x8_8_1x1_intrawave_v3,838.02,312.64,0.0
gfx942,304,73088,4096,4096,ck,0,0,2843.7791,a8w8_blockscale_1x128x128_256x128x128x128_16x16_32x32_2x2_8x32x1_8x32x1_1x32x1x8_8_1x1_intrawave_v3,862.38,321.71,0.0
gfx942,304,73216,4096,4096,ck,0,0,2899.8681,a8w8_blockscale_1x128x128_256x128x128x128_16x16_32x32_2x2_8x32x1_8x32x1_1x32x1x8_8_1x1_intrawave_v3,847.18,316.03,0.0
gfx942,304,73344,4096,4096,ck,0,0,2898.204,a8w8_blockscale_1x128x128_256x128x128x128_16x16_32x32_2x2_8x32x1_8x32x1_1x32x1x8_8_1x1_intrawave_v3,849.15,316.76,0.0
gfx942,304,73472,4096,4096,ck,0,0,2855.3272,a8w8_blockscale_1x128x128_256x128x128x128_16x16_32x32_2x2_8x32x1_8x32x1_1x32x1x8_8_1x1_intrawave_v3,863.41,322.07,0.0
gfx942,304,73600,4096,4096,ck,0,0,2920.3194,a8w8_blockscale_1x128x128_256x128x128x128_16x16_32x32_2x2_8x32x1_8x32x1_1x32x1x8_8_1x1_intrawave_v3,845.66,315.44,0.0
gfx942,304,73728,4096,4096,ck,0,0,2985.2997,a8w8_blockscale_1x128x128_256x128x128x128_16x16_32x32_2x2_8x32x1_8x32x1_1x32x1x8_8_1x1_intrawave_v3,828.69,309.1,0.0
gfx942,304,73856,4096,4096,ck,0,0,2939.8033,a8w8_blockscale_1x128x128_256x128x128x128_16x16_32x32_2x2_8x32x1_8x32x1_1x32x1x8_8_1x1_intrawave_v3,842.98,314.42,0.0
gfx942,304,73984,4096,4096,ck,0,0,2939.156,a8w8_blockscale_1x128x128_256x128x128x128_16x16_32x32_2x2_8x32x1_8x32x1_1x32x1x8_8_1x1_intrawave_v3,844.63,315.02,0.0
gfx942,304,74112,4096,4096,ck,0,0,2894.056,a8w8_blockscale_1x128x128_256x128x128x128_16x16_32x32_2x2_8x32x1_8x32x1_1x32x1x8_8_1x1_intrawave_v3,859.27,320.47,0.0
gfx942,304,74240,4096,4096,ck,0,0,3012.3971,a8w8_blockscale_1x128x128_256x128x128x128_16x16_32x32_2x2_8x32x1_8x32x1_1x32x1x8_8_1x1_intrawave_v3,826.94,308.41,0.0
gfx942,304,74368,4096,4096,ck,0,0,2976.1698,a8w8_blockscale_1x128x128_256x128x128x128_16x16_32x32_2x2_8x32x1_8x32x1_1x32x1x8_8_1x1_intrawave_v3,838.45,312.69,0.0
gfx942,304,74496,4096,4096,ck,0,0,2925.4197,a8w8_blockscale_1x128x128_256x128x128x128_16x16_32x32_2x2_8x32x1_8x32x1_1x32x1x8_8_1x1_intrawave_v3,854.47,318.65,0.0
gfx942,304,74624,4096,4096,ck,0,0,2969.3066,a8w8_blockscale_1x128x128_256x128x128x128_16x16_32x32_2x2_8x32x1_8x32x1_1x32x1x8_8_1x1_intrawave_v3,843.28,314.47,0.0
gfx942,304,74752,4096,4096,ck,0,0,2976.4643,a8w8_blockscale_1x128x128_256x128x128x128_16x16_32x32_2x2_8x32x1_8x32x1_1x32x1x8_8_1x1_intrawave_v3,842.7,314.24,0.0
gfx942,304,74880,4096,4096,ck,0,0,2957.0851,a8w8_blockscale_1x128x128_256x128x128x128_16x16_32x32_2x2_8x32x1_8x32x1_1x32x1x8_8_1x1_intrawave_v3,849.67,316.83,0.0
gfx942,304,75008,4096,4096,ck,0,0,2962.0349,a8w8_blockscale_1x128x128_256x128x128x128_16x16_32x32_2x2_8x32x1_8x32x1_1x32x1x8_8_1x1_intrawave_v3,849.7,316.83,0.0
gfx942,304,75136,4096,4096,ck,0,0,3058.7366,a8w8_blockscale_1x128x128_256x128x128x128_16x16_32x32_2x2_8x32x1_8x32x1_1x32x1x8_8_1x1_intrawave_v3,824.24,307.33,0.0
gfx942,304,75264,4096,4096,ck,0,0,3012.043,a8w8_blockscale_1x128x128_256x128x128x128_16x16_32x32_2x2_8x32x1_8x32x1_1x32x1x8_8_1x1_intrawave_v3,838.45,312.62,0.0
gfx942,304,75392,4096,4096,ck,0,0,2995.5639,a8w8_blockscale_1x128x128_256x128x128x128_16x16_32x32_2x2_8x32x1_8x32x1_1x32x1x8_8_1x1_intrawave_v3,844.49,314.86,0.0
gfx942,304,75520,4096,4096,ck,0,0,2981.5426,a8w8_blockscale_1x128x128_256x128x128x128_16x16_32x32_2x2_8x32x1_8x32x1_1x32x1x8_8_1x1_intrawave_v3,849.91,316.87,0.0
gfx942,304,75648,4096,4096,ck,0,0,2965.8606,a8w8_blockscale_1x128x128_256x128x128x128_16x16_32x32_2x2_8x32x1_8x32x1_1x32x1x8_8_1x1_intrawave_v3,855.85,319.08,0.0
gfx942,304,75776,4096,4096,ck,0,0,3013.1332,a8w8_blockscale_1x128x128_256x128x128x128_16x16_32x32_2x2_8x32x1_8x32x1_1x32x1x8_8_1x1_intrawave_v3,843.85,314.59,0.0
gfx942,304,75904,4096,4096,ck,0,0,2993.7662,a8w8_blockscale_1x128x128_256x128x128x128_16x16_32x32_2x2_8x32x1_8x32x1_1x32x1x8_8_1x1_intrawave_v3,850.74,317.15,0.0
gfx942,304,76032,4096,4096,ck,0,0,2972.8258,a8w8_blockscale_1x128x128_256x128x128x128_16x16_32x32_2x2_8x32x1_8x32x1_1x32x1x8_8_1x1_intrawave_v3,858.18,319.92,0.0
gfx942,304,76160,4096,4096,ck,0,0,3015.4202,a8w8_blockscale_1x128x128_256x128x128x128_16x16_32x32_2x2_8x32x1_8x32x1_1x32x1x8_8_1x1_intrawave_v3,847.48,315.92,0.0
gfx942,304,76288,4096,4096,ck,0,0,3031.6963,a8w8_blockscale_1x128x128_256x128x128x128_16x16_32x32_2x2_8x32x1_8x32x1_1x32x1x8_8_1x1_intrawave_v3,844.35,314.74,0.0
gfx942,304,76416,4096,4096,ck,0,0,3028.1535,a8w8_blockscale_1x128x128_256x128x128x128_16x16_32x32_2x2_8x32x1_8x32x1_1x32x1x8_8_1x1_intrawave_v3,846.75,315.63,0.0
gfx942,304,76544,4096,4096,ck,0,0,3011.3389,a8w8_blockscale_1x128x128_256x128x128x128_16x16_32x32_2x2_8x32x1_8x32x1_1x32x1x8_8_1x1_intrawave_v3,852.91,317.92,0.0
gfx942,304,76672,4096,4096,ck,0,0,2991.5373,a8w8_blockscale_1x128x128_256x128x128x128_16x16_32x32_2x2_8x32x1_8x32x1_1x32x1x8_8_1x1_intrawave_v3,859.99,320.55,0.0
gfx942,304,76800,4096,4096,ck,0,0,2992.3131,a8w8_blockscale_1x128x128_256x128x128x128_16x16_32x32_2x2_8x32x1_8x32x1_1x32x1x8_8_1x1_intrawave_v3,861.2,320.99,0.0
gfx942,304,76928,4096,4096,ck,0,0,3061.0042,a8w8_blockscale_1x128x128_256x128x128x128_16x16_32x32_2x2_8x32x1_8x32x1_1x32x1x8_8_1x1_intrawave_v3,843.28,314.3,0.0
gfx942,304,77056,4096,4096,ck,0,0,2997.4839,a8w8_blockscale_1x128x128_256x128x128x128_16x16_32x32_2x2_8x32x1_8x32x1_1x32x1x8_8_1x1_intrawave_v3,862.58,321.48,0.0
gfx942,304,77184,4096,4096,ck,0,0,3073.6132,a8w8_blockscale_1x128x128_256x128x128x128_16x16_32x32_2x2_8x32x1_8x32x1_1x32x1x8_8_1x1_intrawave_v3,842.61,314.03,0.0
gfx942,304,77312,4096,4096,ck,0,0,3130.0296,a8w8_blockscale_1x128x128_256x128x128x128_16x16_32x32_2x2_8x32x1_8x32x1_1x32x1x8_8_1x1_intrawave_v3,828.8,308.87,0.0
gfx942,304,77440,4096,4096,ck,0,0,3024.1691,a8w8_blockscale_1x128x128_256x128x128x128_16x16_32x32_2x2_8x32x1_8x32x1_1x32x1x8_8_1x1_intrawave_v3,859.23,320.21,0.0
gfx942,304,77568,4096,4096,ck,0,0,3022.5436,a8w8_blockscale_1x128x128_256x128x128x128_16x16_32x32_2x2_8x32x1_8x32x1_1x32x1x8_8_1x1_intrawave_v3,861.11,320.9,0.0
gfx942,304,77696,4096,4096,ck,0,0,3051.2063,a8w8_blockscale_1x128x128_256x128x128x128_16x16_32x32_2x2_8x32x1_8x32x1_1x32x1x8_8_1x1_intrawave_v3,854.43,318.4,0.0
gfx942,304,77824,4096,4096,ck,0,0,3098.9044,a8w8_blockscale_1x128x128_256x128x128x128_16x16_32x32_2x2_8x32x1_8x32x1_1x32x1x8_8_1x1_intrawave_v3,842.67,314.01,0.0
gfx942,304,77952,4096,4096,ck,0,0,3038.7188,a8w8_blockscale_1x128x128_256x128x128x128_16x16_32x32_2x2_8x32x1_8x32x1_1x32x1x8_8_1x1_intrawave_v3,860.77,320.74,0.0
gfx942,304,78080,4096,4096,ck,0,0,3108.3933,a8w8_blockscale_1x128x128_256x128x128x128_16x16_32x32_2x2_8x32x1_8x32x1_1x32x1x8_8_1x1_intrawave_v3,842.86,314.06,0.0
gfx942,304,78208,4096,4096,ck,0,0,3039.5987,a8w8_blockscale_1x128x128_256x128x128x128_16x16_32x32_2x2_8x32x1_8x32x1_1x32x1x8_8_1x1_intrawave_v3,863.35,321.69,0.0
gfx942,304,78336,4096,4096,ck,0,0,3057.473,a8w8_blockscale_1x128x128_256x128x128x128_16x16_32x32_2x2_8x32x1_8x32x1_1x32x1x8_8_1x1_intrawave_v3,859.7,320.32,0.0
gfx942,304,78464,4096,4096,ck,0,0,3115.3617,a8w8_blockscale_1x128x128_256x128x128x128_16x16_32x32_2x2_8x32x1_8x32x1_1x32x1x8_8_1x1_intrawave_v3,845.11,314.87,0.0
gfx942,304,78592,4096,4096,ck,0,0,3116.7222,a8w8_blockscale_1x128x128_256x128x128x128_16x16_32x32_2x2_8x32x1_8x32x1_1x32x1x8_8_1x1_intrawave_v3,846.12,315.24,0.0
gfx942,304,78720,4096,4096,ck,0,0,3101.5172,a8w8_blockscale_1x128x128_256x128x128x128_16x16_32x32_2x2_8x32x1_8x32x1_1x32x1x8_8_1x1_intrawave_v3,851.65,317.29,0.0
gfx942,304,78848,4096,4096,ck,0,0,3080.7565,a8w8_blockscale_1x128x128_256x128x128x128_16x16_32x32_2x2_8x32x1_8x32x1_1x32x1x8_8_1x1_intrawave_v3,858.78,319.94,0.0
gfx942,304,78976,4096,4096,ck,0,0,3087.1191,a8w8_blockscale_1x128x128_256x128x128x128_16x16_32x32_2x2_8x32x1_8x32x1_1x32x1x8_8_1x1_intrawave_v3,858.4,319.79,0.0
gfx942,304,79104,4096,4096,ck,0,0,3206.6875,a8w8_blockscale_1x128x128_256x128x128x128_16x16_32x32_2x2_8x32x1_8x32x1_1x32x1x8_8_1x1_intrawave_v3,827.74,308.36,0.0
gfx942,304,79232,4096,4096,ck,0,0,3086.819,a8w8_blockscale_1x128x128_256x128x128x128_16x16_32x32_2x2_8x32x1_8x32x1_1x32x1x8_8_1x1_intrawave_v3,861.27,320.84,0.0
gfx942,304,79360,4096,4096,ck,0,0,3091.8026,a8w8_blockscale_1x128x128_256x128x128x128_16x16_32x32_2x2_8x32x1_8x32x1_1x32x1x8_8_1x1_intrawave_v3,861.27,320.83,0.0
gfx942,304,79488,4096,4096,ck,0,0,3149.4259,a8w8_blockscale_1x128x128_256x128x128x128_16x16_32x32_2x2_8x32x1_8x32x1_1x32x1x8_8_1x1_intrawave_v3,846.88,315.46,0.0
gfx942,304,79616,4096,4096,ck,0,0,3146.0111,a8w8_blockscale_1x128x128_256x128x128x128_16x16_32x32_2x2_8x32x1_8x32x1_1x32x1x8_8_1x1_intrawave_v3,849.16,316.3,0.0
gfx942,304,79744,4096,4096,ck,0,0,3123.8897,a8w8_blockscale_1x128x128_256x128x128x128_16x16_32x32_2x2_8x32x1_8x32x1_1x32x1x8_8_1x1_intrawave_v3,856.55,319.05,0.0
gfx942,304,79872,4096,4096,ck,0,0,3109.9327,a8w8_blockscale_1x128x128_256x128x128x128_16x16_32x32_2x2_8x32x1_8x32x1_1x32x1x8_8_1x1_intrawave_v3,861.77,320.99,0.0
gfx942,304,80000,4096,4096,ck,0,0,3153.8564,a8w8_blockscale_1x128x128_256x128x128x128_16x16_32x32_2x2_8x32x1_8x32x1_1x32x1x8_8_1x1_intrawave_v3,851.13,317.01,0.0
gfx942,304,16,4608,4096,ck,8,0,15.4943,a8w8_blockscale_1x128x128_256x16x64x256_16x16_16x16_1x1_16x16x1_16x16x1_1x16x1x16_4_1x1_intrawave_v1,38.98,1231.9,0.0
gfx942,304,32,4608,4096,ck,8,0,15.6442,a8w8_blockscale_1x128x128_256x16x64x256_16x16_16x16_1x1_16x16x1_16x16x1_1x16x1x16_4_1x1_intrawave_v1,77.21,1233.71,0.0
gfx942,304,48,4608,4096,ck,8,0,15.4671,a8w8_blockscale_1x128x128_256x16x64x256_16x16_16x16_1x1_16x16x1_16x16x1_1x16x1x16_4_1x1_intrawave_v1,117.15,1261.6,0.0
gfx942,304,64,4608,4096,ck,8,0,15.473,a8w8_blockscale_1x128x128_256x16x64x256_16x16_16x16_1x1_16x16x1_16x16x1_1x16x1x16_4_1x1_intrawave_v1,156.14,1274.89,0.0
gfx942,304,80,4608,4096,ck,18,0,20.0139,a8w8_blockscale_1x128x128_256x64x64x256_16x16_32x32_1x1_16x16x1_16x16x1_1x32x1x8_8_1x1_intrawave_v1,150.89,996.27,0.0
gfx942,304,96,4608,4096,ck,7,0,20.4666,a8w8_blockscale_1x128x128_256x16x128x256_16x16_16x16_1x2_16x16x1_16x16x1_1x16x1x16_8_1x2_intrawave_v1,177.06,984.64,0.0
gfx942,304,112,4608,4096,ck,18,0,21.0448,a8w8_blockscale_1x128x128_256x64x64x256_16x16_32x32_1x1_16x16x1_16x16x1_1x32x1x8_8_1x1_intrawave_v1,200.9,967.71,0.0
gfx942,304,128,4608,4096,ck,18,0,19.1526,a8w8_blockscale_1x128x128_256x64x64x256_16x16_32x32_1x1_16x16x1_16x16x1_1x32x1x8_8_1x1_intrawave_v1,252.28,1074.44,0.0
gfx942,304,144,4608,4096,ck,18,0,22.6823,a8w8_blockscale_1x128x128_256x64x64x256_16x16_32x32_1x1_16x16x1_16x16x1_1x32x1x8_8_1x1_intrawave_v1,239.65,916.63,0.0
gfx942,304,160,4608,4096,ck,18,0,23.0112,a8w8_blockscale_1x128x128_256x64x64x256_16x16_32x32_1x1_16x16x1_16x16x1_1x32x1x8_8_1x1_intrawave_v1,262.47,912.79,0.0
gfx942,304,176,4608,4096,ck,18,0,24.7395,a8w8_blockscale_1x128x128_256x64x64x256_16x16_32x32_1x1_16x16x1_16x16x1_1x32x1x8_8_1x1_intrawave_v1,268.55,857.63,0.0
gfx942,304,192,4608,4096,ck,18,0,23.145,a8w8_blockscale_1x128x128_256x64x64x256_16x16_32x32_1x1_16x16x1_16x16x1_1x32x1x8_8_1x1_intrawave_v1,313.15,925.91,0.0
gfx942,304,208,4608,4096,ck,18,0,26.1536,a8w8_blockscale_1x128x128_256x64x64x256_16x16_32x32_1x1_16x16x1_16x16x1_1x32x1x8_8_1x1_intrawave_v1,300.22,827.54,0.0
gfx942,304,224,4608,4096,ck,18,0,27.8669,a8w8_blockscale_1x128x128_256x64x64x256_16x16_32x32_1x1_16x16x1_16x16x1_1x32x1x8_8_1x1_intrawave_v1,303.43,784.31,0.0
gfx942,304,240,4608,4096,ck,18,0,27.5581,a8w8_blockscale_1x128x128_256x64x64x256_16x16_32x32_1x1_16x16x1_16x16x1_1x32x1x8_8_1x1_intrawave_v1,328.75,800.83,0.0
gfx942,304,256,4608,4096,ck,18,0,25.435,a8w8_blockscale_1x128x128_256x64x64x256_16x16_32x32_1x1_16x16x1_16x16x1_1x32x1x8_8_1x1_intrawave_v1,379.94,876.05,0.0
gfx942,304,288,4608,4096,ck,2,0,35.7254,a8w8_blockscale_1x128x128_256x64x128x128_16x16_32x32_1x2_8x32x1_8x32x1_1x32x1x8_8_1x1_intrawave_v3,304.31,635.63,0.0
gfx942,304,320,4608,4096,ck,1,0,39.6198,a8w8_blockscale_1x128x128_256x128x64x128_16x16_32x32_2x1_8x32x1_8x32x1_1x32x1x8_8_1x1_intrawave_v3,304.89,583.91,0.0
gfx942,304,352,4608,4096,ck,2,0,36.3977,a8w8_blockscale_1x128x128_256x64x128x128_16x16_32x32_1x2_8x32x1_8x32x1_1x32x1x8_8_1x1_intrawave_v3,365.07,647.3,0.0
gfx942,304,384,4608,4096,ck,2,0,40.7214,a8w8_blockscale_1x128x128_256x64x128x128_16x16_32x32_1x2_8x32x1_8x32x1_1x32x1x8_8_1x1_intrawave_v3,355.97,589.03,0.0
gfx942,304,416,4608,4096,ck,2,0,37.9973,a8w8_blockscale_1x128x128_256x64x128x128_16x16_32x32_1x2_8x32x1_8x32x1_1x32x1x8_8_1x1_intrawave_v3,413.28,642.47,0.0
gfx942,304,448,4608,4096,ck,2,0,42.2308,a8w8_blockscale_1x128x128_256x64x128x128_16x16_32x32_1x2_8x32x1_8x32x1_1x32x1x8_8_1x1_intrawave_v3,400.45,588.15,0.0
gfx942,304,480,4608,4096,ck,2,0,41.243,a8w8_blockscale_1x128x128_256x64x128x128_16x16_32x32_1x2_8x32x1_8x32x1_1x32x1x8_8_1x1_intrawave_v3,439.33,612.57,0.0
gfx942,304,512,4608,4096,ck,2,0,43.6437,a8w8_blockscale_1x128x128_256x64x128x128_16x16_32x32_1x2_8x32x1_8x32x1_1x32x1x8_8_1x1_intrawave_v3,442.84,588.63,0.0
gfx942,304,544,4608,4096,ck,0,0,51.1265,a8w8_blockscale_1x128x128_256x128x128x128_16x16_32x32_2x2_8x32x1_8x32x1_1x32x1x8_8_1x1_intrawave_v3,401.66,510.81,0.0
gfx942,304,576,4608,4096,ck,0,0,51.1485,a8w8_blockscale_1x128x128_256x128x128x128_16x16_32x32_2x2_8x32x1_8x32x1_1x32x1x8_8_1x1_intrawave_v3,425.1,518.92,0.0
gfx942,304,608,4608,4096,ck,0,0,54.2179,a8w8_blockscale_1x128x128_256x128x128x128_16x16_32x32_2x2_8x32x1_8x32x1_1x32x1x8_8_1x1_intrawave_v3,423.31,497.4,0.0
gfx942,304,640,4608,4096,ck,2,0,57.9219,a8w8_blockscale_1x128x128_256x64x128x128_16x16_32x32_1x2_8x32x1_8x32x1_1x32x1x8_8_1x1_intrawave_v3,417.1,472.95,0.0
gfx942,304,672,4608,4096,ck,0,0,54.7849,a8w8_blockscale_1x128x128_256x128x128x128_16x16_32x32_2x2_8x32x1_8x32x1_1x32x1x8_8_1x1_intrawave_v3,463.03,507.8,0.0
gfx942,304,704,4608,4096,ck,0,0,55.0827,a8w8_blockscale_1x128x128_256x128x128x128_16x16_32x32_2x2_8x32x1_8x32x1_1x32x1x8_8_1x1_intrawave_v3,482.46,512.79,0.0
gfx942,304,736,4608,4096,ck,0,0,56.43,a8w8_blockscale_1x128x128_256x128x128x128_16x16_32x32_2x2_8x32x1_8x32x1_1x32x1x8_8_1x1_intrawave_v3,492.35,508.1,0.0
gfx942,304,768,4608,4096,ck,0,0,60.0664,a8w8_blockscale_1x128x128_256x128x128x128_16x16_32x32_2x2_8x32x1_8x32x1_1x32x1x8_8_1x1_intrawave_v3,482.65,484.43,0.0
gfx942,304,800,4608,4096,ck,0,0,57.516,a8w8_blockscale_1x128x128_256x128x128x128_16x16_32x32_2x2_8x32x1_8x32x1_1x32x1x8_8_1x1_intrawave_v3,525.05,513.32,0.0
gfx942,304,832,4608,4096,ck,0,0,57.8545,a8w8_blockscale_1x128x128_256x128x128x128_16x16_32x32_2x2_8x32x1_8x32x1_1x32x1x8_8_1x1_intrawave_v3,542.86,517.68,0.0
gfx942,304,864,4608,4096,ck,0,0,59.9405,a8w8_blockscale_1x128x128_256x128x128x128_16x16_32x32_2x2_8x32x1_8x32x1_1x32x1x8_8_1x1_intrawave_v3,544.12,506.77,0.0
gfx942,304,896,4608,4096,ck,0,0,63.0968,a8w8_blockscale_1x128x128_256x128x128x128_16x16_32x32_2x2_8x32x1_8x32x1_1x32x1x8_8_1x1_intrawave_v3,536.05,488.17,0.0
gfx942,304,928,4608,4096,ck,0,0,59.6805,a8w8_blockscale_1x128x128_256x128x128x128_16x16_32x32_2x2_8x32x1_8x32x1_1x32x1x8_8_1x1_intrawave_v3,586.97,523.25,0.0
gfx942,304,960,4608,4096,ck,0,0,61.1153,a8w8_blockscale_1x128x128_256x128x128x128_16x16_32x32_2x2_8x32x1_8x32x1_1x32x1x8_8_1x1_intrawave_v3,592.96,517.94,0.0
gfx942,304,992,4608,4096,ck,0,0,62.9221,a8w8_blockscale_1x128x128_256x128x128x128_16x16_32x32_2x2_8x32x1_8x32x1_1x32x1x8_8_1x1_intrawave_v3,595.13,509.83,0.0
gfx942,304,1024,4608,4096,ck,0,0,65.7711,a8w8_blockscale_1x128x128_256x128x128x128_16x16_32x32_2x2_8x32x1_8x32x1_1x32x1x8_8_1x1_intrawave_v3,587.72,494.23,0.0
gfx942,304,1088,4608,4096,ck,0,0,89.0123,a8w8_blockscale_1x128x128_256x128x128x128_16x16_32x32_2x2_8x32x1_8x32x1_1x32x1x8_8_1x1_intrawave_v3,461.4,374.76,0.0
gfx942,304,1152,4608,4096,ck,2,0,92.5942,a8w8_blockscale_1x128x128_256x64x128x128_16x16_32x32_1x2_8x32x1_8x32x1_1x32x1x8_8_1x1_intrawave_v3,469.65,369.46,0.0
gfx942,304,1216,4608,4096,ck,0,0,87.0841,a8w8_blockscale_1x128x128_256x128x128x128_16x16_32x32_2x2_8x32x1_8x32x1_1x32x1x8_8_1x1_intrawave_v3,527.1,402.62,0.0
gfx942,304,1280,4608,4096,ck,0,0,85.5671,a8w8_blockscale_1x128x128_256x128x128x128_16x16_32x32_2x2_8x32x1_8x32x1_1x32x1x8_8_1x1_intrawave_v3,564.68,419.71,0.0
gfx942,304,1344,4608,4096,ck,0,0,89.3764,a8w8_blockscale_1x128x128_256x128x128x128_16x16_32x32_2x2_8x32x1_8x32x1_1x32x1x8_8_1x1_intrawave_v3,567.65,411.36,0.0
gfx942,304,1408,4608,4096,ck,0,0,88.1874,a8w8_blockscale_1x128x128_256x128x128x128_16x16_32x32_2x2_8x32x1_8x32x1_1x32x1x8_8_1x1_intrawave_v3,602.7,426.57,0.0
gfx942,304,1472,4608,4096,ck,0,0,87.1598,a8w8_blockscale_1x128x128_256x128x128x128_16x16_32x32_2x2_8x32x1_8x32x1_1x32x1x8_8_1x1_intrawave_v3,637.52,441.37,0.0
gfx942,304,1536,4608,4096,ck,0,0,88.5929,a8w8_blockscale_1x128x128_256x128x128x128_16x16_32x32_2x2_8x32x1_8x32x1_1x32x1x8_8_1x1_intrawave_v3,654.48,443.85,0.0
gfx942,304,1600,4608,4096,ck,0,0,96.6846,a8w8_blockscale_1x128x128_256x128x128x128_16x16_32x32_2x2_8x32x1_8x32x1_1x32x1x8_8_1x1_intrawave_v3,624.69,415.51,0.0
gfx942,304,1664,4608,4096,ck,0,0,95.8042,a8w8_blockscale_1x128x128_256x128x128x128_16x16_32x32_2x2_8x32x1_8x32x1_1x32x1x8_8_1x1_intrawave_v3,655.65,428.22,0.0
gfx942,304,1728,4608,4096,ck,0,0,96.4565,a8w8_blockscale_1x128x128_256x128x128x128_16x16_32x32_2x2_8x32x1_8x32x1_1x32x1x8_8_1x1_intrawave_v3,676.26,434.16,0.0
gfx942,304,1792,4608,4096,ck,0,0,95.3779,a8w8_blockscale_1x128x128_256x128x128x128_16x16_32x32_2x2_8x32x1_8x32x1_1x32x1x8_8_1x1_intrawave_v3,709.24,448.0,0.0
gfx942,304,1856,4608,4096,ck,0,0,102.32,a8w8_blockscale_1x128x128_256x128x128x128_16x16_32x32_2x2_8x32x1_8x32x1_1x32x1x8_8_1x1_intrawave_v3,684.73,425.93,0.0
gfx942,304,1920,4608,4096,ck,0,0,100.6765,a8w8_blockscale_1x128x128_256x128x128x128_16x16_32x32_2x2_8x32x1_8x32x1_1x32x1x8_8_1x1_intrawave_v3,719.91,441.35,0.0
gfx942,304,1984,4608,4096,ck,0,0,100.4461,a8w8_blockscale_1x128x128_256x128x128x128_16x16_32x32_2x2_8x32x1_8x32x1_1x32x1x8_8_1x1_intrawave_v3,745.61,450.84,0.0
gfx942,304,2048,4608,4096,ck,0,0,100.597,a8w8_blockscale_1x128x128_256x128x128x128_16x16_32x32_2x2_8x32x1_8x32x1_1x32x1x8_8_1x1_intrawave_v3,768.51,458.64,0.0
gfx942,304,2112,4608,4096,ck,2,0,133.2206,a8w8_blockscale_1x128x128_256x64x128x128_16x16_32x32_1x2_8x32x1_8x32x1_1x32x1x8_8_1x1_intrawave_v3,598.45,352.72,0.0
gfx942,304,2176,4608,4096,ck,0,0,149.0243,a8w8_blockscale_1x128x128_256x128x128x128_16x16_32x32_2x2_8x32x1_8x32x1_1x32x1x8_8_1x1_intrawave_v3,551.19,321.03,0.0
gfx942,304,2240,4608,4096,ck,0,0,146.6422,a8w8_blockscale_1x128x128_256x128x128x128_16x16_32x32_2x2_8x32x1_8x32x1_1x32x1x8_8_1x1_intrawave_v3,576.62,332.05,0.0
gfx942,304,2304,4608,4096,ck,0,0,139.4098,a8w8_blockscale_1x128x128_256x128x128x128_16x16_32x32_2x2_8x32x1_8x32x1_1x32x1x8_8_1x1_intrawave_v3,623.87,355.39,0.0
gfx942,304,2368,4608,4096,ck,0,0,140.1729,a8w8_blockscale_1x128x128_256x128x128x128_16x16_32x32_2x2_8x32x1_8x32x1_1x32x1x8_8_1x1_intrawave_v3,637.71,359.54,0.0
gfx942,304,2432,4608,4096,ck,0,0,140.4134,a8w8_blockscale_1x128x128_256x128x128x128_16x16_32x32_2x2_8x32x1_8x32x1_1x32x1x8_8_1x1_intrawave_v3,653.82,364.99,0.0
gfx942,304,2496,4608,4096,ck,0,0,137.8311,a8w8_blockscale_1x128x128_256x128x128x128_16x16_32x32_2x2_8x32x1_8x32x1_1x32x1x8_8_1x1_intrawave_v3,683.6,378.01,0.0
gfx942,304,2560,4608,4096,ck,0,0,138.5919,a8w8_blockscale_1x128x128_256x128x128x128_16x16_32x32_2x2_8x32x1_8x32x1_1x32x1x8_8_1x1_intrawave_v3,697.28,382.08,0.0
gfx942,304,2624,4608,4096,ck,0,0,142.6341,a8w8_blockscale_1x128x128_256x128x128x128_16x16_32x32_2x2_8x32x1_8x32x1_1x32x1x8_8_1x1_intrawave_v3,694.45,377.22,0.0
gfx942,304,2688,4608,4096,ck,0,0,144.6841,a8w8_blockscale_1x128x128_256x128x128x128_16x16_32x32_2x2_8x32x1_8x32x1_1x32x1x8_8_1x1_intrawave_v3,701.31,377.77,0.0
gfx942,304,2752,4608,4096,ck,0,0,148.3845,a8w8_blockscale_1x128x128_256x128x128x128_16x16_32x32_2x2_8x32x1_8x32x1_1x32x1x8_8_1x1_intrawave_v3,700.1,374.09,0.0
gfx942,304,2816,4608,4096,ck,0,0,148.372,a8w8_blockscale_1x128x128_256x128x128x128_16x16_32x32_2x2_8x32x1_8x32x1_1x32x1x8_8_1x1_intrawave_v3,716.45,379.86,0.0
gfx942,304,2880,4608,4096,ck,0,0,148.8409,a8w8_blockscale_1x128x128_256x128x128x128_16x16_32x32_2x2_8x32x1_8x32x1_1x32x1x8_8_1x1_intrawave_v3,730.42,384.39,0.0
gfx942,304,2944,4608,4096,ck,0,0,146.149,a8w8_blockscale_1x128x128_256x128x128x128_16x16_32x32_2x2_8x32x1_8x32x1_1x32x1x8_8_1x1_intrawave_v3,760.4,397.3,0.0
gfx942,304,3008,4608,4096,ck,0,0,153.7178,a8w8_blockscale_1x128x128_256x128x128x128_16x16_32x32_2x2_8x32x1_8x32x1_1x32x1x8_8_1x1_intrawave_v3,738.68,383.28,0.0
gfx942,304,3072,4608,4096,ck,0,0,148.6127,a8w8_blockscale_1x128x128_256x128x128x128_16x16_32x32_2x2_8x32x1_8x32x1_1x32x1x8_8_1x1_intrawave_v3,780.31,402.18,0.0
gfx942,304,3136,4608,4096,ck,0,0,160.2315,a8w8_blockscale_1x128x128_256x128x128x128_16x16_32x32_2x2_8x32x1_8x32x1_1x32x1x8_8_1x1_intrawave_v3,738.81,378.33,0.0
gfx942,304,3200,4608,4096,ck,0,0,157.2764,a8w8_blockscale_1x128x128_256x128x128x128_16x16_32x32_2x2_8x32x1_8x32x1_1x32x1x8_8_1x1_intrawave_v3,768.05,390.86,0.0
gfx942,304,3264,4608,4096,ck,0,0,180.3221,a8w8_blockscale_1x128x128_256x128x128x128_16x16_32x32_2x2_8x32x1_8x32x1_1x32x1x8_8_1x1_intrawave_v3,683.29,345.63,0.0
gfx942,304,3328,4608,4096,ck,0,0,182.4006,a8w8_blockscale_1x128x128_256x128x128x128_16x16_32x32_2x2_8x32x1_8x32x1_1x32x1x8_8_1x1_intrawave_v3,688.75,346.36,0.0
gfx942,304,3392,4608,4096,ck,0,0,180.9799,a8w8_blockscale_1x128x128_256x128x128x128_16x16_32x32_2x2_8x32x1_8x32x1_1x32x1x8_8_1x1_intrawave_v3,707.5,353.79,0.0
gfx942,304,3456,4608,4096,ck,0,0,181.5095,a8w8_blockscale_1x128x128_256x128x128x128_16x16_32x32_2x2_8x32x1_8x32x1_1x32x1x8_8_1x1_intrawave_v3,718.75,357.45,0.0
gfx942,304,3520,4608,4096,ck,0,0,181.5674,a8w8_blockscale_1x128x128_256x128x128x128_16x16_32x32_2x2_8x32x1_8x32x1_1x32x1x8_8_1x1_intrawave_v3,731.82,362.03,0.0
gfx942,304,3584,4608,4096,ck,0,0,181.0584,a8w8_blockscale_1x128x128_256x128x128x128_16x16_32x32_2x2_8x32x1_8x32x1_1x32x1x8_8_1x1_intrawave_v3,747.23,367.75,0.0
gfx942,304,3648,4608,4096,ck,0,0,187.3425,a8w8_blockscale_1x128x128_256x128x128x128_16x16_32x32_2x2_8x32x1_8x32x1_1x32x1x8_8_1x1_intrawave_v3,735.06,359.96,0.0
gfx942,304,3712,4608,4096,ck,0,0,187.4885,a8w8_blockscale_1x128x128_256x128x128x128_16x16_32x32_2x2_8x32x1_8x32x1_1x32x1x8_8_1x1_intrawave_v3,747.37,364.23,0.0
gfx942,304,3776,4608,4096,ck,0,0,189.8257,a8w8_blockscale_1x128x128_256x128x128x128_16x16_32x32_2x2_8x32x1_8x32x1_1x32x1x8_8_1x1_intrawave_v3,750.9,364.23,0.0
gfx942,304,3840,4608,4096,ck,0,0,189.3057,a8w8_blockscale_1x128x128_256x128x128x128_16x16_32x32_2x2_8x32x1_8x32x1_1x32x1x8_8_1x1_intrawave_v3,765.72,369.73,0.0
gfx942,304,3904,4608,4096,ck,0,0,193.0151,a8w8_blockscale_1x128x128_256x128x128x128_16x16_32x32_2x2_8x32x1_8x32x1_1x32x1x8_8_1x1_intrawave_v3,763.52,367.04,0.0
gfx942,304,3968,4608,4096,ck,0,0,193.406,a8w8_blockscale_1x128x128_256x128x128x128_16x16_32x32_2x2_8x32x1_8x32x1_1x32x1x8_8_1x1_intrawave_v3,774.47,370.7,0.0
gfx942,304,4032,4608,4096,ck,0,0,196.1444,a8w8_blockscale_1x128x128_256x128x128x128_16x16_32x32_2x2_8x32x1_8x32x1_1x32x1x8_8_1x1_intrawave_v3,775.97,369.87,0.0
gfx942,304,4096,4608,4096,ck,0,0,194.5585,a8w8_blockscale_1x128x128_256x128x128x128_16x16_32x32_2x2_8x32x1_8x32x1_1x32x1x8_8_1x1_intrawave_v3,794.72,377.27,0.0
gfx942,304,4224,4608,4096,ck,0,0,207.122,a8w8_blockscale_1x128x128_256x128x128x128_16x16_32x32_2x2_8x32x1_8x32x1_1x32x1x8_8_1x1_intrawave_v3,769.84,362.61,0.0
gfx942,304,4352,4608,4096,ck,0,0,226.911,a8w8_blockscale_1x128x128_256x128x128x128_16x16_32x32_2x2_8x32x1_8x32x1_1x32x1x8_8_1x1_intrawave_v3,724.0,338.49,0.0
gfx942,304,4480,4608,4096,ck,0,0,229.5648,a8w8_blockscale_1x128x128_256x128x128x128_16x16_32x32_2x2_8x32x1_8x32x1_1x32x1x8_8_1x1_intrawave_v3,736.67,342.0,0.0
gfx942,304,4608,4608,4096,ck,0,0,230.7306,a8w8_blockscale_1x128x128_256x128x128x128_16x16_32x32_2x2_8x32x1_8x32x1_1x32x1x8_8_1x1_intrawave_v3,753.89,347.66,0.0
gfx942,304,4736,4608,4096,ck,0,0,231.9968,a8w8_blockscale_1x128x128_256x128x128x128_16x16_32x32_2x2_8x32x1_8x32x1_1x32x1x8_8_1x1_intrawave_v3,770.61,353.11,0.0
gfx942,304,4864,4608,4096,ck,0,0,244.9901,a8w8_blockscale_1x128x128_256x128x128x128_16x16_32x32_2x2_8x32x1_8x32x1_1x32x1x8_8_1x1_intrawave_v3,749.46,341.34,0.0
gfx942,304,4992,4608,4096,ck,0,0,239.2972,a8w8_blockscale_1x128x128_256x128x128x128_16x16_32x32_2x2_8x32x1_8x32x1_1x32x1x8_8_1x1_intrawave_v3,787.48,356.58,0.0
gfx942,304,5120,4608,4096,ck,0,0,241.4493,a8w8_blockscale_1x128x128_256x128x128x128_16x16_32x32_2x2_8x32x1_8x32x1_1x32x1x8_8_1x1_intrawave_v3,800.47,360.46,0.0
gfx942,304,5248,4608,4096,ck,0,0,246.8316,a8w8_blockscale_1x128x128_256x128x128x128_16x16_32x32_2x2_8x32x1_8x32x1_1x32x1x8_8_1x1_intrawave_v3,802.59,359.5,0.0
gfx942,304,5376,4608,4096,ck,0,0,254.1448,a8w8_blockscale_1x128x128_256x128x128x128_16x16_32x32_2x2_8x32x1_8x32x1_1x32x1x8_8_1x1_intrawave_v3,798.51,355.86,0.0
gfx942,304,5504,4608,4096,ck,0,0,279.1331,a8w8_blockscale_1x128x128_256x128x128x128_16x16_32x32_2x2_8x32x1_8x32x1_1x32x1x8_8_1x1_intrawave_v3,744.34,330.11,0.0
gfx942,304,5632,4608,4096,ck,0,0,271.4842,a8w8_blockscale_1x128x128_256x128x128x128_16x16_32x32_2x2_8x32x1_8x32x1_1x32x1x8_8_1x1_intrawave_v3,783.11,345.68,0.0
gfx942,304,5760,4608,4096,ck,0,0,282.009,a8w8_blockscale_1x128x128_256x128x128x128_16x16_32x32_2x2_8x32x1_8x32x1_1x32x1x8_8_1x1_intrawave_v3,771.01,338.82,0.0
gfx942,304,5888,4608,4096,ck,0,0,279.5991,a8w8_blockscale_1x128x128_256x128x128x128_16x16_32x32_2x2_8x32x1_8x32x1_1x32x1x8_8_1x1_intrawave_v3,794.94,347.84,0.0
gfx942,304,6016,4608,4096,ck,0,0,284.7526,a8w8_blockscale_1x128x128_256x128x128x128_16x16_32x32_2x2_8x32x1_8x32x1_1x32x1x8_8_1x1_intrawave_v3,797.52,347.53,0.0
gfx942,304,6144,4608,4096,ck,0,0,284.8102,a8w8_blockscale_1x128x128_256x128x128x128_16x16_32x32_2x2_8x32x1_8x32x1_1x32x1x8_8_1x1_intrawave_v3,814.33,353.44,0.0
gfx942,304,6272,4608,4096,ck,0,0,291.4552,a8w8_blockscale_1x128x128_256x128x128x128_16x16_32x32_2x2_8x32x1_8x32x1_1x32x1x8_8_1x1_intrawave_v3,812.34,351.23,0.0
gfx942,304,6400,4608,4096,ck,0,0,296.4343,a8w8_blockscale_1x128x128_256x128x128x128_16x16_32x32_2x2_8x32x1_8x32x1_1x32x1x8_8_1x1_intrawave_v3,814.99,351.08,0.0
gfx942,304,6528,4608,4096,ck,0,0,323.9373,a8w8_blockscale_1x128x128_256x128x128x128_16x16_32x32_2x2_8x32x1_8x32x1_1x32x1x8_8_1x1_intrawave_v3,760.71,326.53,0.0
gfx942,304,6656,4608,4096,ck,0,0,321.7436,a8w8_blockscale_1x128x128_256x128x128x128_16x16_32x32_2x2_8x32x1_8x32x1_1x32x1x8_8_1x1_intrawave_v3,780.92,334.05,0.0
gfx942,304,6784,4608,4096,ck,0,0,326.9759,a8w8_blockscale_1x128x128_256x128x128x128_16x16_32x32_2x2_8x32x1_8x32x1_1x32x1x8_8_1x1_intrawave_v3,783.2,333.92,0.0
gfx942,304,6912,4608,4096,ck,0,0,330.0061,a8w8_blockscale_1x128x128_256x128x128x128_16x16_32x32_2x2_8x32x1_8x32x1_1x32x1x8_8_1x1_intrawave_v3,790.65,336.01,0.0
gfx942,304,7040,4608,4096,ck,0,0,326.6653,a8w8_blockscale_1x128x128_256x128x128x128_16x16_32x32_2x2_8x32x1_8x32x1_1x32x1x8_8_1x1_intrawave_v3,813.53,344.67,0.0
gfx942,304,7168,4608,4096,ck,0,0,330.0301,a8w8_blockscale_1x128x128_256x128x128x128_16x16_32x32_2x2_8x32x1_8x32x1_1x32x1x8_8_1x1_intrawave_v3,819.87,346.32,0.0
gfx942,304,7296,4608,4096,ck,0,0,346.5362,a8w8_blockscale_1x128x128_256x128x128x128_16x16_32x32_2x2_8x32x1_8x32x1_1x32x1x8_8_1x1_intrawave_v3,794.76,334.74,0.0
gfx942,304,7424,4608,4096,ck,0,0,348.443,a8w8_blockscale_1x128x128_256x128x128x128_16x16_32x32_2x2_8x32x1_8x32x1_1x32x1x8_8_1x1_intrawave_v3,804.28,337.8,0.0
gfx942,304,7552,4608,4096,ck,0,0,355.6124,a8w8_blockscale_1x128x128_256x128x128x128_16x16_32x32_2x2_8x32x1_8x32x1_1x32x1x8_8_1x1_intrawave_v3,801.65,335.78,0.0
gfx942,304,7680,4608,4096,ck,0,0,367.2434,a8w8_blockscale_1x128x128_256x128x128x128_16x16_32x32_2x2_8x32x1_8x32x1_1x32x1x8_8_1x1_intrawave_v3,789.42,329.78,0.0
gfx942,304,7808,4608,4096,ck,0,0,374.5499,a8w8_blockscale_1x128x128_256x128x128x128_16x16_32x32_2x2_8x32x1_8x32x1_1x32x1x8_8_1x1_intrawave_v3,786.92,327.9,0.0
gfx942,304,7936,4608,4096,ck,0,0,379.2379,a8w8_blockscale_1x128x128_256x128x128x128_16x16_32x32_2x2_8x32x1_8x32x1_1x32x1x8_8_1x1_intrawave_v3,789.94,328.34,0.0
gfx942,304,8064,4608,4096,ck,0,0,381.7112,a8w8_blockscale_1x128x128_256x128x128x128_16x16_32x32_2x2_8x32x1_8x32x1_1x32x1x8_8_1x1_intrawave_v3,797.48,330.67,0.0
gfx942,304,8192,4608,4096,ck,0,0,375.938,a8w8_blockscale_1x128x128_256x128x128x128_16x16_32x32_2x2_8x32x1_8x32x1_1x32x1x8_8_1x1_intrawave_v3,822.58,340.29,0.0
gfx942,304,8320,4608,4096,ck,0,0,394.8777,a8w8_blockscale_1x128x128_256x128x128x128_16x16_32x32_2x2_8x32x1_8x32x1_1x32x1x8_8_1x1_intrawave_v3,795.36,328.28,0.0
gfx942,304,8448,4608,4096,ck,0,0,392.8288,a8w8_blockscale_1x128x128_256x128x128x128_16x16_32x32_2x2_8x32x1_8x32x1_1x32x1x8_8_1x1_intrawave_v3,811.81,334.33,0.0
gfx942,304,8576,4608,4096,ck,0,0,396.2088,a8w8_blockscale_1x128x128_256x128x128x128_16x16_32x32_2x2_8x32x1_8x32x1_1x32x1x8_8_1x1_intrawave_v3,817.08,335.78,0.0
gfx942,304,8704,4608,4096,ck,0,0,414.0054,a8w8_blockscale_1x128x128_256x128x128x128_16x16_32x32_2x2_8x32x1_8x32x1_1x32x1x8_8_1x1_intrawave_v3,793.62,325.46,0.0
gfx942,304,8832,4608,4096,ck,0,0,420.3275,a8w8_blockscale_1x128x128_256x128x128x128_16x16_32x32_2x2_8x32x1_8x32x1_1x32x1x8_8_1x1_intrawave_v3,793.18,324.62,0.0
gfx942,304,8960,4608,4096,ck,0,0,427.2386,a8w8_blockscale_1x128x128_256x128x128x128_16x16_32x32_2x2_8x32x1_8x32x1_1x32x1x8_8_1x1_intrawave_v3,791.66,323.36,0.0
gfx942,304,9088,4608,4096,ck,0,0,424.0216,a8w8_blockscale_1x128x128_256x128x128x128_16x16_32x32_2x2_8x32x1_8x32x1_1x32x1x8_8_1x1_intrawave_v3,809.06,329.83,0.0
gfx942,304,9216,4608,4096,ck,0,0,427.8505,a8w8_blockscale_1x128x128_256x128x128x128_16x16_32x32_2x2_8x32x1_8x32x1_1x32x1x8_8_1x1_intrawave_v3,813.12,330.86,0.0
gfx942,304,9344,4608,4096,ck,0,0,434.6304,a8w8_blockscale_1x128x128_256x128x128x128_16x16_32x32_2x2_8x32x1_8x32x1_1x32x1x8_8_1x1_intrawave_v3,811.55,329.62,0.0
gfx942,304,9472,4608,4096,ck,0,0,438.321,a8w8_blockscale_1x128x128_256x128x128x128_16x16_32x32_2x2_8x32x1_8x32x1_1x32x1x8_8_1x1_intrawave_v3,815.74,330.73,0.0
gfx942,304,9600,4608,4096,ck,0,0,440.4067,a8w8_blockscale_1x128x128_256x128x128x128_16x16_32x32_2x2_8x32x1_8x32x1_1x32x1x8_8_1x1_intrawave_v3,822.85,333.03,0.0
gfx942,304,9728,4608,4096,ck,0,0,457.0741,a8w8_blockscale_1x128x128_256x128x128x128_16x16_32x32_2x2_8x32x1_8x32x1_1x32x1x8_8_1x1_intrawave_v3,803.41,324.62,0.0
gfx942,304,9856,4608,4096,ck,0,0,466.3585,a8w8_blockscale_1x128x128_256x128x128x128_16x16_32x32_2x2_8x32x1_8x32x1_1x32x1x8_8_1x1_intrawave_v3,797.78,321.81,0.0
gfx942,304,9984,4608,4096,ck,0,0,472.1944,a8w8_blockscale_1x128x128_256x128x128x128_16x16_32x32_2x2_8x32x1_8x32x1_1x32x1x8_8_1x1_intrawave_v3,798.15,321.44,0.0
gfx942,304,10112,4608,4096,ck,0,0,482.8385,a8w8_blockscale_1x128x128_256x128x128x128_16x16_32x32_2x2_8x32x1_8x32x1_1x32x1x8_8_1x1_intrawave_v3,790.56,317.88,0.0
gfx942,304,10240,4608,4096,ck,0,0,471.7187,a8w8_blockscale_1x128x128_256x128x128x128_16x16_32x32_2x2_8x32x1_8x32x1_1x32x1x8_8_1x1_intrawave_v3,819.44,328.99,0.0
gfx942,304,10368,4608,4096,ck,0,0,488.2675,a8w8_blockscale_1x128x128_256x128x128x128_16x16_32x32_2x2_8x32x1_8x32x1_1x32x1x8_8_1x1_intrawave_v3,801.57,321.33,0.0
gfx942,304,10496,4608,4096,ck,0,0,480.6845,a8w8_blockscale_1x128x128_256x128x128x128_16x16_32x32_2x2_8x32x1_8x32x1_1x32x1x8_8_1x1_intrawave_v3,824.26,329.94,0.0
gfx942,304,10624,4608,4096,ck,0,0,492.3685,a8w8_blockscale_1x128x128_256x128x128x128_16x16_32x32_2x2_8x32x1_8x32x1_1x32x1x8_8_1x1_intrawave_v3,814.52,325.57,0.0
gfx942,304,10752,4608,4096,ck,0,0,503.57,a8w8_blockscale_1x128x128_256x128x128x128_16x16_32x32_2x2_8x32x1_8x32x1_1x32x1x8_8_1x1_intrawave_v3,805.99,321.71,0.0
gfx942,304,10880,4608,4096,ck,0,0,518.3549,a8w8_blockscale_1x128x128_256x128x128x128_16x16_32x32_2x2_8x32x1_8x32x1_1x32x1x8_8_1x1_intrawave_v3,792.33,315.82,0.0
gfx942,304,11008,4608,4096,ck,0,0,518.8829,a8w8_blockscale_1x128x128_256x128x128x128_16x16_32x32_2x2_8x32x1_8x32x1_1x32x1x8_8_1x1_intrawave_v3,800.83,318.79,0.0
gfx942,304,11136,4608,4096,ck,0,0,516.7997,a8w8_blockscale_1x128x128_256x128x128x128_16x16_32x32_2x2_8x32x1_8x32x1_1x32x1x8_8_1x1_intrawave_v3,813.41,323.37,0.0
gfx942,304,11264,4608,4096,ck,0,0,528.0856,a8w8_blockscale_1x128x128_256x128x128x128_16x16_32x32_2x2_8x32x1_8x32x1_1x32x1x8_8_1x1_intrawave_v3,805.18,319.68,0.0
gfx942,304,11392,4608,4096,ck,0,0,531.7512,a8w8_blockscale_1x128x128_256x128x128x128_16x16_32x32_2x2_8x32x1_8x32x1_1x32x1x8_8_1x1_intrawave_v3,808.71,320.69,0.0
gfx942,304,11520,4608,4096,ck,0,0,530.6164,a8w8_blockscale_1x128x128_256x128x128x128_16x16_32x32_2x2_8x32x1_8x32x1_1x32x1x8_8_1x1_intrawave_v3,819.55,324.58,0.0
gfx942,304,11648,4608,4096,ck,0,0,533.6027,a8w8_blockscale_1x128x128_256x128x128x128_16x16_32x32_2x2_8x32x1_8x32x1_1x32x1x8_8_1x1_intrawave_v3,824.02,325.96,0.0
gfx942,304,11776,4608,4096,ck,0,0,540.9397,a8w8_blockscale_1x128x128_256x128x128x128_16x16_32x32_2x2_8x32x1_8x32x1_1x32x1x8_8_1x1_intrawave_v3,821.77,324.69,0.0
gfx942,304,11904,4608,4096,ck,0,0,562.5198,a8w8_blockscale_1x128x128_256x128x128x128_16x16_32x32_2x2_8x32x1_8x32x1_1x32x1x8_8_1x1_intrawave_v3,798.84,315.26,0.0
gfx942,304,12032,4608,4096,ck,0,0,569.7167,a8w8_blockscale_1x128x128_256x128x128x128_16x16_32x32_2x2_8x32x1_8x32x1_1x32x1x8_8_1x1_intrawave_v3,797.23,314.27,0.0
gfx942,304,12160,4608,4096,ck,0,0,568.9857,a8w8_blockscale_1x128x128_256x128x128x128_16x16_32x32_2x2_8x32x1_8x32x1_1x32x1x8_8_1x1_intrawave_v3,806.74,317.67,0.0
gfx942,304,12288,4608,4096,ck,0,0,561.844,a8w8_blockscale_1x128x128_256x128x128x128_16x16_32x32_2x2_8x32x1_8x32x1_1x32x1x8_8_1x1_intrawave_v3,825.6,324.74,0.0
gfx942,304,12416,4608,4096,ck,0,0,575.8099,a8w8_blockscale_1x128x128_256x128x128x128_16x16_32x32_2x2_8x32x1_8x32x1_1x32x1x8_8_1x1_intrawave_v3,813.96,319.82,0.0
gfx942,304,12544,4608,4096,ck,0,0,579.4921,a8w8_blockscale_1x128x128_256x128x128x128_16x16_32x32_2x2_8x32x1_8x32x1_1x32x1x8_8_1x1_intrawave_v3,817.13,320.73,0.0
gfx942,304,12672,4608,4096,ck,0,0,582.9126,a8w8_blockscale_1x128x128_256x128x128x128_16x16_32x32_2x2_8x32x1_8x32x1_1x32x1x8_8_1x1_intrawave_v3,820.62,321.77,0.0
gfx942,304,12800,4608,4096,ck,0,0,586.9703,a8w8_blockscale_1x128x128_256x128x128x128_16x16_32x32_2x2_8x32x1_8x32x1_1x32x1x8_8_1x1_intrawave_v3,823.18,322.45,0.0
gfx942,304,12928,4608,4096,ck,0,0,596.4671,a8w8_blockscale_1x128x128_256x128x128x128_16x16_32x32_2x2_8x32x1_8x32x1_1x32x1x8_8_1x1_intrawave_v3,818.18,320.17,0.0
gfx942,304,13056,4608,4096,ck,0,0,615.0339,a8w8_blockscale_1x128x128_256x128x128x128_16x16_32x32_2x2_8x32x1_8x32x1_1x32x1x8_8_1x1_intrawave_v3,801.33,313.28,0.0
gfx942,304,13184,4608,4096,ck,0,0,619.3217,a8w8_blockscale_1x128x128_256x128x128x128_16x16_32x32_2x2_8x32x1_8x32x1_1x32x1x8_8_1x1_intrawave_v3,803.59,313.86,0.0
gfx942,304,13312,4608,4096,ck,0,0,616.9642,a8w8_blockscale_1x128x128_256x128x128x128_16x16_32x32_2x2_8x32x1_8x32x1_1x32x1x8_8_1x1_intrawave_v3,814.49,317.82,0.0
gfx942,304,13440,4608,4096,ck,0,0,622.7758,a8w8_blockscale_1x128x128_256x128x128x128_16x16_32x32_2x2_8x32x1_8x32x1_1x32x1x8_8_1x1_intrawave_v3,814.65,317.59,0.0
gfx942,304,13568,4608,4096,ck,0,0,630.114,a8w8_blockscale_1x128x128_256x128x128x128_16x16_32x32_2x2_8x32x1_8x32x1_1x32x1x8_8_1x1_intrawave_v3,812.83,316.6,0.0
gfx942,304,13696,4608,4096,ck,0,0,622.1292,a8w8_blockscale_1x128x128_256x128x128x128_16x16_32x32_2x2_8x32x1_8x32x1_1x32x1x8_8_1x1_intrawave_v3,831.03,323.4,0.0
gfx942,304,13824,4608,4096,ck,0,0,625.8324,a8w8_blockscale_1x128x128_256x128x128x128_16x16_32x32_2x2_8x32x1_8x32x1_1x32x1x8_8_1x1_intrawave_v3,833.83,324.21,0.0
gfx942,304,13952,4608,4096,ck,0,0,643.7125,a8w8_blockscale_1x128x128_256x128x128x128_16x16_32x32_2x2_8x32x1_8x32x1_1x32x1x8_8_1x1_intrawave_v3,818.18,317.85,0.0
gfx942,304,14080,4608,4096,ck,0,0,657.7533,a8w8_blockscale_1x128x128_256x128x128x128_16x16_32x32_2x2_8x32x1_8x32x1_1x32x1x8_8_1x1_intrawave_v3,808.06,313.65,0.0
gfx942,304,14208,4608,4096,ck,0,0,670.7279,a8w8_blockscale_1x128x128_256x128x128x128_16x16_32x32_2x2_8x32x1_8x32x1_1x32x1x8_8_1x1_intrawave_v3,799.63,310.13,0.0
gfx942,304,14336,4608,4096,ck,0,0,657.8558,a8w8_blockscale_1x128x128_256x128x128x128_16x16_32x32_2x2_8x32x1_8x32x1_1x32x1x8_8_1x1_intrawave_v3,822.62,318.79,0.0
gfx942,304,14464,4608,4096,ck,0,0,674.2098,a8w8_blockscale_1x128x128_256x128x128x128_16x16_32x32_2x2_8x32x1_8x32x1_1x32x1x8_8_1x1_intrawave_v3,809.83,313.58,0.0
gfx942,304,14592,4608,4096,ck,0,0,673.4888,a8w8_blockscale_1x128x128_256x128x128x128_16x16_32x32_2x2_8x32x1_8x32x1_1x32x1x8_8_1x1_intrawave_v3,817.87,316.45,0.0
gfx942,304,14720,4608,4096,ck,0,0,671.0083,a8w8_blockscale_1x128x128_256x128x128x128_16x16_32x32_2x2_8x32x1_8x32x1_1x32x1x8_8_1x1_intrawave_v3,828.1,320.16,0.0
gfx942,304,14848,4608,4096,ck,0,0,679.5939,a8w8_blockscale_1x128x128_256x128x128x128_16x16_32x32_2x2_8x32x1_8x32x1_1x32x1x8_8_1x1_intrawave_v3,824.75,318.62,0.0
gfx942,304,14976,4608,4096,ck,0,0,695.8602,a8w8_blockscale_1x128x128_256x128x128x128_16x16_32x32_2x2_8x32x1_8x32x1_1x32x1x8_8_1x1_intrawave_v3,812.41,313.62,0.0
gfx942,304,15104,4608,4096,ck,0,0,706.8374,a8w8_blockscale_1x128x128_256x128x128x128_16x16_32x32_2x2_8x32x1_8x32x1_1x32x1x8_8_1x1_intrawave_v3,806.63,311.16,0.0
gfx942,304,15232,4608,4096,ck,0,0,714.7304,a8w8_blockscale_1x128x128_256x128x128x128_16x16_32x32_2x2_8x32x1_8x32x1_1x32x1x8_8_1x1_intrawave_v3,804.48,310.11,0.0
gfx942,304,15360,4608,4096,ck,0,0,704.5669,a8w8_blockscale_1x128x128_256x128x128x128_16x16_32x32_2x2_8x32x1_8x32x1_1x32x1x8_8_1x1_intrawave_v3,822.95,317.0,0.0
gfx942,304,15488,4608,4096,ck,0,0,716.7347,a8w8_blockscale_1x128x128_256x128x128x128_16x16_32x32_2x2_8x32x1_8x32x1_1x32x1x8_8_1x1_intrawave_v3,815.72,313.99,0.0
gfx942,304,15616,4608,4096,ck,0,0,711.5493,a8w8_blockscale_1x128x128_256x128x128x128_16x16_32x32_2x2_8x32x1_8x32x1_1x32x1x8_8_1x1_intrawave_v3,828.45,318.68,0.0
gfx942,304,15744,4608,4096,ck,0,0,722.7907,a8w8_blockscale_1x128x128_256x128x128x128_16x16_32x32_2x2_8x32x1_8x32x1_1x32x1x8_8_1x1_intrawave_v3,822.25,316.08,0.0
gfx942,304,15872,4608,4096,ck,0,0,726.2909,a8w8_blockscale_1x128x128_256x128x128x128_16x16_32x32_2x2_8x32x1_8x32x1_1x32x1x8_8_1x1_intrawave_v3,824.94,316.9,0.0
gfx942,304,16000,4608,4096,ck,0,0,734.7459,a8w8_blockscale_1x128x128_256x128x128x128_16x16_32x32_2x2_8x32x1_8x32x1_1x32x1x8_8_1x1_intrawave_v3,822.03,315.57,0.0
gfx942,304,16128,4608,4096,ck,0,0,740.682,a8w8_blockscale_1x128x128_256x128x128x128_16x16_32x32_2x2_8x32x1_8x32x1_1x32x1x8_8_1x1_intrawave_v3,821.96,315.34,0.0
gfx942,304,16256,4608,4096,ck,0,0,761.3937,a8w8_blockscale_1x128x128_256x128x128x128_16x16_32x32_2x2_8x32x1_8x32x1_1x32x1x8_8_1x1_intrawave_v3,805.95,309.0,0.0
gfx942,304,16384,4608,4096,ck,0,0,749.7377,a8w8_blockscale_1x128x128_256x128x128x128_16x16_32x32_2x2_8x32x1_8x32x1_1x32x1x8_8_1x1_intrawave_v3,824.92,316.08,0.0
gfx942,304,16512,4608,4096,ck,0,0,755.2931,a8w8_blockscale_1x128x128_256x128x128x128_16x16_32x32_2x2_8x32x1_8x32x1_1x32x1x8_8_1x1_intrawave_v3,825.25,316.01,0.0
gfx942,304,16640,4608,4096,ck,0,0,762.327,a8w8_blockscale_1x128x128_256x128x128x128_16x16_32x32_2x2_8x32x1_8x32x1_1x32x1x8_8_1x1_intrawave_v3,823.98,315.33,0.0
gfx942,304,16768,4608,4096,ck,0,0,777.1711,a8w8_blockscale_1x128x128_256x128x128x128_16x16_32x32_2x2_8x32x1_8x32x1_1x32x1x8_8_1x1_intrawave_v3,814.45,311.5,0.0
gfx942,304,16896,4608,4096,ck,0,0,785.6024,a8w8_blockscale_1x128x128_256x128x128x128_16x16_32x32_2x2_8x32x1_8x32x1_1x32x1x8_8_1x1_intrawave_v3,811.86,310.33,0.0
gfx942,304,17024,4608,4096,ck,0,0,780.1498,a8w8_blockscale_1x128x128_256x128x128x128_16x16_32x32_2x2_8x32x1_8x32x1_1x32x1x8_8_1x1_intrawave_v3,823.73,314.68,0.0
gfx942,304,17152,4608,4096,ck,0,0,784.3238,a8w8_blockscale_1x128x128_256x128x128x128_16x16_32x32_2x2_8x32x1_8x32x1_1x32x1x8_8_1x1_intrawave_v3,825.51,315.18,0.0
gfx942,304,17280,4608,4096,ck,0,0,793.6406,a8w8_blockscale_1x128x128_256x128x128x128_16x16_32x32_2x2_8x32x1_8x32x1_1x32x1x8_8_1x1_intrawave_v3,821.91,313.63,0.0
gfx942,304,17408,4608,4096,ck,0,0,799.0972,a8w8_blockscale_1x128x128_256x128x128x128_16x16_32x32_2x2_8x32x1_8x32x1_1x32x1x8_8_1x1_intrawave_v3,822.34,313.62,0.0
gfx942,304,17536,4608,4096,ck,0,0,808.3351,a8w8_blockscale_1x128x128_256x128x128x128_16x16_32x32_2x2_8x32x1_8x32x1_1x32x1x8_8_1x1_intrawave_v3,818.92,312.14,0.0
gfx942,304,17664,4608,4096,ck,0,0,805.3215,a8w8_blockscale_1x128x128_256x128x128x128_16x16_32x32_2x2_8x32x1_8x32x1_1x32x1x8_8_1x1_intrawave_v3,827.98,315.42,0.0
gfx942,304,17792,4608,4096,ck,0,0,816.9924,a8w8_blockscale_1x128x128_256x128x128x128_16x16_32x32_2x2_8x32x1_8x32x1_1x32x1x8_8_1x1_intrawave_v3,822.07,313.0,0.0
gfx942,304,17920,4608,4096,ck,0,0,818.0307,a8w8_blockscale_1x128x128_256x128x128x128_16x16_32x32_2x2_8x32x1_8x32x1_1x32x1x8_8_1x1_intrawave_v3,826.93,314.69,0.0
gfx942,304,18048,4608,4096,ck,0,0,826.4418,a8w8_blockscale_1x128x128_256x128x128x128_16x16_32x32_2x2_8x32x1_8x32x1_1x32x1x8_8_1x1_intrawave_v3,824.36,313.55,0.0
gfx942,304,18176,4608,4096,ck,0,0,840.1398,a8w8_blockscale_1x128x128_256x128x128x128_16x16_32x32_2x2_8x32x1_8x32x1_1x32x1x8_8_1x1_intrawave_v3,816.67,310.46,0.0
gfx942,304,18304,4608,4096,ck,0,0,843.9933,a8w8_blockscale_1x128x128_256x128x128x128_16x16_32x32_2x2_8x32x1_8x32x1_1x32x1x8_8_1x1_intrawave_v3,818.67,311.07,0.0
gfx942,304,18432,4608,4096,ck,0,0,854.7423,a8w8_blockscale_1x128x128_256x128x128x128_16x16_32x32_2x2_8x32x1_8x32x1_1x32x1x8_8_1x1_intrawave_v3,814.03,309.15,0.0
gfx942,304,18560,4608,4096,ck,0,0,839.9731,a8w8_blockscale_1x128x128_256x128x128x128_16x16_32x32_2x2_8x32x1_8x32x1_1x32x1x8_8_1x1_intrawave_v3,834.09,316.61,0.0
gfx942,304,18688,4608,4096,ck,0,0,850.2221,a8w8_blockscale_1x128x128_256x128x128x128_16x16_32x32_2x2_8x32x1_8x32x1_1x32x1x8_8_1x1_intrawave_v3,829.72,314.8,0.0
gfx942,304,18816,4608,4096,ck,0,0,868.5214,a8w8_blockscale_1x128x128_256x128x128x128_16x16_32x32_2x2_8x32x1_8x32x1_1x32x1x8_8_1x1_intrawave_v3,817.8,310.13,0.0
gfx942,304,18944,4608,4096,ck,0,0,856.4728,a8w8_blockscale_1x128x128_256x128x128x128_16x16_32x32_2x2_8x32x1_8x32x1_1x32x1x8_8_1x1_intrawave_v3,834.95,316.48,0.0
gfx942,304,19072,4608,4096,ck,0,0,867.4731,a8w8_blockscale_1x128x128_256x128x128x128_16x16_32x32_2x2_8x32x1_8x32x1_1x32x1x8_8_1x1_intrawave_v3,829.93,314.43,0.0
gfx942,304,19200,4608,4096,ck,0,0,878.567,a8w8_blockscale_1x128x128_256x128x128x128_16x16_32x32_2x2_8x32x1_8x32x1_1x32x1x8_8_1x1_intrawave_v3,824.95,312.4,0.0
gfx942,304,19328,4608,4096,ck,0,0,874.9207,a8w8_blockscale_1x128x128_256x128x128x128_16x16_32x32_2x2_8x32x1_8x32x1_1x32x1x8_8_1x1_intrawave_v3,833.91,315.65,0.0
gfx942,304,19456,4608,4096,ck,0,0,903.9794,a8w8_blockscale_1x128x128_256x128x128x128_16x16_32x32_2x2_8x32x1_8x32x1_1x32x1x8_8_1x1_intrawave_v3,812.45,307.39,0.0
gfx942,304,19584,4608,4096,ck,0,0,927.0397,a8w8_blockscale_1x128x128_256x128x128x128_16x16_32x32_2x2_8x32x1_8x32x1_1x32x1x8_8_1x1_intrawave_v3,797.45,301.58,0.0
gfx942,304,19712,4608,4096,ck,0,0,897.1543,a8w8_blockscale_1x128x128_256x128x128x128_16x16_32x32_2x2_8x32x1_8x32x1_1x32x1x8_8_1x1_intrawave_v3,829.4,313.53,0.0
gfx942,304,19840,4608,4096,ck,0,0,914.6778,a8w8_blockscale_1x128x128_256x128x128x128_16x16_32x32_2x2_8x32x1_8x32x1_1x32x1x8_8_1x1_intrawave_v3,818.8,309.38,0.0
gfx942,304,19968,4608,4096,ck,0,0,918.8521,a8w8_blockscale_1x128x128_256x128x128x128_16x16_32x32_2x2_8x32x1_8x32x1_1x32x1x8_8_1x1_intrawave_v3,820.34,309.83,0.0
gfx942,304,20096,4608,4096,ck,0,0,925.7932,a8w8_blockscale_1x128x128_256x128x128x128_16x16_32x32_2x2_8x32x1_8x32x1_1x32x1x8_8_1x1_intrawave_v3,819.4,309.35,0.0
gfx942,304,20224,4608,4096,ck,0,0,921.75,a8w8_blockscale_1x128x128_256x128x128x128_16x16_32x32_2x2_8x32x1_8x32x1_1x32x1x8_8_1x1_intrawave_v3,828.24,312.55,0.0
gfx942,304,20352,4608,4096,ck,0,0,925.7585,a8w8_blockscale_1x128x128_256x128x128x128_16x16_32x32_2x2_8x32x1_8x32x1_1x32x1x8_8_1x1_intrawave_v3,829.87,313.04,0.0
gfx942,304,20480,4608,4096,ck,0,0,921.6452,a8w8_blockscale_1x128x128_256x128x128x128_16x16_32x32_2x2_8x32x1_8x32x1_1x32x1x8_8_1x1_intrawave_v3,838.82,316.29,0.0
gfx942,304,20608,4608,4096,ck,0,0,940.2916,a8w8_blockscale_1x128x128_256x128x128x128_16x16_32x32_2x2_8x32x1_8x32x1_1x32x1x8_8_1x1_intrawave_v3,827.32,311.83,0.0
gfx942,304,20736,4608,4096,ck,0,0,932.7077,a8w8_blockscale_1x128x128_256x128x128x128_16x16_32x32_2x2_8x32x1_8x32x1_1x32x1x8_8_1x1_intrawave_v3,839.23,316.19,0.0
gfx942,304,20864,4608,4096,ck,0,0,953.6852,a8w8_blockscale_1x128x128_256x128x128x128_16x16_32x32_2x2_8x32x1_8x32x1_1x32x1x8_8_1x1_intrawave_v3,825.84,311.02,0.0
gfx942,304,20992,4608,4096,ck,0,0,936.0771,a8w8_blockscale_1x128x128_256x128x128x128_16x16_32x32_2x2_8x32x1_8x32x1_1x32x1x8_8_1x1_intrawave_v3,846.53,318.69,0.0
gfx942,304,21120,4608,4096,ck,0,0,951.3901,a8w8_blockscale_1x128x128_256x128x128x128_16x16_32x32_2x2_8x32x1_8x32x1_1x32x1x8_8_1x1_intrawave_v3,837.99,315.35,0.0
gfx942,304,21248,4608,4096,ck,0,0,958.3718,a8w8_blockscale_1x128x128_256x128x128x128_16x16_32x32_2x2_8x32x1_8x32x1_1x32x1x8_8_1x1_intrawave_v3,836.92,314.83,0.0
gfx942,304,21376,4608,4096,ck,0,0,977.2151,a8w8_blockscale_1x128x128_256x128x128x128_16x16_32x32_2x2_8x32x1_8x32x1_1x32x1x8_8_1x1_intrawave_v3,825.73,310.51,0.0
gfx942,304,21504,4608,4096,ck,0,0,980.4177,a8w8_blockscale_1x128x128_256x128x128x128_16x16_32x32_2x2_8x32x1_8x32x1_1x32x1x8_8_1x1_intrawave_v3,827.96,311.23,0.0
gfx942,304,21632,4608,4096,ck,0,0,987.2513,a8w8_blockscale_1x128x128_256x128x128x128_16x16_32x32_2x2_8x32x1_8x32x1_1x32x1x8_8_1x1_intrawave_v3,827.13,310.8,0.0
gfx942,304,21760,4608,4096,ck,0,0,988.8579,a8w8_blockscale_1x128x128_256x128x128x128_16x16_32x32_2x2_8x32x1_8x32x1_1x32x1x8_8_1x1_intrawave_v3,830.67,312.02,0.0
gfx942,304,21888,4608,4096,ck,0,0,1012.7127,a8w8_blockscale_1x128x128_256x128x128x128_16x16_32x32_2x2_8x32x1_8x32x1_1x32x1x8_8_1x1_intrawave_v3,815.87,306.35,0.0
gfx942,304,22016,4608,4096,ck,0,0,995.727,a8w8_blockscale_1x128x128_256x128x128x128_16x16_32x32_2x2_8x32x1_8x32x1_1x32x1x8_8_1x1_intrawave_v3,834.64,313.29,0.0
gfx942,304,22144,4608,4096,ck,0,0,1031.4572,a8w8_blockscale_1x128x128_256x128x128x128_16x16_32x32_2x2_8x32x1_8x32x1_1x32x1x8_8_1x1_intrawave_v3,810.41,304.09,0.0
gfx942,304,22272,4608,4096,ck,0,0,1033.6792,a8w8_blockscale_1x128x128_256x128x128x128_16x16_32x32_2x2_8x32x1_8x32x1_1x32x1x8_8_1x1_intrawave_v3,813.35,305.08,0.0
gfx942,304,22400,4608,4096,ck,0,0,1012.7963,a8w8_blockscale_1x128x128_256x128x128x128_16x16_32x32_2x2_8x32x1_8x32x1_1x32x1x8_8_1x1_intrawave_v3,834.89,313.06,0.0
gfx942,304,22528,4608,4096,ck,0,0,1007.2818,a8w8_blockscale_1x128x128_256x128x128x128_16x16_32x32_2x2_8x32x1_8x32x1_1x32x1x8_8_1x1_intrawave_v3,844.26,316.46,0.0
gfx942,304,22656,4608,4096,ck,0,0,1037.0439,a8w8_blockscale_1x128x128_256x128x128x128_16x16_32x32_2x2_8x32x1_8x32x1_1x32x1x8_8_1x1_intrawave_v3,824.69,309.02,0.0
gfx942,304,22784,4608,4096,ck,0,0,1033.2135,a8w8_blockscale_1x128x128_256x128x128x128_16x16_32x32_2x2_8x32x1_8x32x1_1x32x1x8_8_1x1_intrawave_v3,832.42,311.82,0.0
gfx942,304,22912,4608,4096,ck,0,0,1042.2759,a8w8_blockscale_1x128x128_256x128x128x128_16x16_32x32_2x2_8x32x1_8x32x1_1x32x1x8_8_1x1_intrawave_v3,829.82,310.74,0.0
gfx942,304,23040,4608,4096,ck,0,0,1047.132,a8w8_blockscale_1x128x128_256x128x128x128_16x16_32x32_2x2_8x32x1_8x32x1_1x32x1x8_8_1x1_intrawave_v3,830.58,310.93,0.0
gfx942,304,23168,4608,4096,ck,0,0,1046.2411,a8w8_blockscale_1x128x128_256x128x128x128_16x16_32x32_2x2_8x32x1_8x32x1_1x32x1x8_8_1x1_intrawave_v3,835.91,312.82,0.0
gfx942,304,23296,4608,4096,ck,0,0,1070.8423,a8w8_blockscale_1x128x128_256x128x128x128_16x16_32x32_2x2_8x32x1_8x32x1_1x32x1x8_8_1x1_intrawave_v3,821.22,307.23,0.0
gfx942,304,23424,4608,4096,ck,0,0,1053.4927,a8w8_blockscale_1x128x128_256x128x128x128_16x16_32x32_2x2_8x32x1_8x32x1_1x32x1x8_8_1x1_intrawave_v3,839.33,313.9,0.0
gfx942,304,23552,4608,4096,ck,0,0,1083.5005,a8w8_blockscale_1x128x128_256x128x128x128_16x16_32x32_2x2_8x32x1_8x32x1_1x32x1x8_8_1x1_intrawave_v3,820.54,306.78,0.0
gfx942,304,23680,4608,4096,ck,0,0,1065.3235,a8w8_blockscale_1x128x128_256x128x128x128_16x16_32x32_2x2_8x32x1_8x32x1_1x32x1x8_8_1x1_intrawave_v3,839.08,313.62,0.0
gfx942,304,23808,4608,4096,ck,0,0,1074.6865,a8w8_blockscale_1x128x128_256x128x128x128_16x16_32x32_2x2_8x32x1_8x32x1_1x32x1x8_8_1x1_intrawave_v3,836.26,312.47,0.0
gfx942,304,23936,4608,4096,ck,0,0,1090.1965,a8w8_blockscale_1x128x128_256x128x128x128_16x16_32x32_2x2_8x32x1_8x32x1_1x32x1x8_8_1x1_intrawave_v3,828.8,309.59,0.0
gfx942,304,24064,4608,4096,ck,0,0,1103.1686,a8w8_blockscale_1x128x128_256x128x128x128_16x16_32x32_2x2_8x32x1_8x32x1_1x32x1x8_8_1x1_intrawave_v3,823.43,307.49,0.0
gfx942,304,24192,4608,4096,ck,0,0,1093.4716,a8w8_blockscale_1x128x128_256x128x128x128_16x16_32x32_2x2_8x32x1_8x32x1_1x32x1x8_8_1x1_intrawave_v3,835.15,311.78,0.0
gfx942,304,24320,4608,4096,ck,0,0,1101.4512,a8w8_blockscale_1x128x128_256x128x128x128_16x16_32x32_2x2_8x32x1_8x32x1_1x32x1x8_8_1x1_intrawave_v3,833.49,311.06,0.0
gfx942,304,24448,4608,4096,ck,0,0,1116.2104,a8w8_blockscale_1x128x128_256x128x128x128_16x16_32x32_2x2_8x32x1_8x32x1_1x32x1x8_8_1x1_intrawave_v3,826.8,308.48,0.0
gfx942,304,24576,4608,4096,ck,0,0,1132.0644,a8w8_blockscale_1x128x128_256x128x128x128_16x16_32x32_2x2_8x32x1_8x32x1_1x32x1x8_8_1x1_intrawave_v3,819.49,305.66,0.0
gfx942,304,24704,4608,4096,ck,0,0,1129.2365,a8w8_blockscale_1x128x128_256x128x128x128_16x16_32x32_2x2_8x32x1_8x32x1_1x32x1x8_8_1x1_intrawave_v3,825.82,307.94,0.0
gfx942,304,24832,4608,4096,ck,0,0,1113.0804,a8w8_blockscale_1x128x128_256x128x128x128_16x16_32x32_2x2_8x32x1_8x32x1_1x32x1x8_8_1x1_intrawave_v3,842.15,313.94,0.0
gfx942,304,24960,4608,4096,ck,0,0,1131.089,a8w8_blockscale_1x128x128_256x128x128x128_16x16_32x32_2x2_8x32x1_8x32x1_1x32x1x8_8_1x1_intrawave_v3,833.01,310.45,0.0
gfx942,304,25088,4608,4096,ck,0,0,1119.5692,a8w8_blockscale_1x128x128_256x128x128x128_16x16_32x32_2x2_8x32x1_8x32x1_1x32x1x8_8_1x1_intrawave_v3,845.9,315.16,0.0
gfx942,304,25216,4608,4096,ck,0,0,1135.0826,a8w8_blockscale_1x128x128_256x128x128x128_16x16_32x32_2x2_8x32x1_8x32x1_1x32x1x8_8_1x1_intrawave_v3,838.59,312.36,0.0
gfx942,304,25344,4608,4096,ck,0,0,1164.2122,a8w8_blockscale_1x128x128_256x128x128x128_16x16_32x32_2x2_8x32x1_8x32x1_1x32x1x8_8_1x1_intrawave_v3,821.76,306.0,0.0
gfx942,304,25472,4608,4096,ck,0,0,1169.5306,a8w8_blockscale_1x128x128_256x128x128x128_16x16_32x32_2x2_8x32x1_8x32x1_1x32x1x8_8_1x1_intrawave_v3,822.16,306.07,0.0
gfx942,304,25600,4608,4096,ck,0,0,1148.2452,a8w8_blockscale_1x128x128_256x128x128x128_16x16_32x32_2x2_8x32x1_8x32x1_1x32x1x8_8_1x1_intrawave_v3,841.6,313.23,0.0
gfx942,304,25728,4608,4096,ck,0,0,1157.1699,a8w8_blockscale_1x128x128_256x128x128x128_16x16_32x32_2x2_8x32x1_8x32x1_1x32x1x8_8_1x1_intrawave_v3,839.29,312.28,0.0
gfx942,304,25856,4608,4096,ck,0,0,1162.3091,a8w8_blockscale_1x128x128_256x128x128x128_16x16_32x32_2x2_8x32x1_8x32x1_1x32x1x8_8_1x1_intrawave_v3,839.73,312.37,0.0
gfx942,304,25984,4608,4096,ck,0,0,1184.8365,a8w8_blockscale_1x128x128_256x128x128x128_16x16_32x32_2x2_8x32x1_8x32x1_1x32x1x8_8_1x1_intrawave_v3,827.85,307.87,0.0
gfx942,304,26112,4608,4096,ck,0,0,1202.4994,a8w8_blockscale_1x128x128_256x128x128x128_16x16_32x32_2x2_8x32x1_8x32x1_1x32x1x8_8_1x1_intrawave_v3,819.71,304.76,0.0
gfx942,304,26240,4608,4096,ck,0,0,1181.8413,a8w8_blockscale_1x128x128_256x128x128x128_16x16_32x32_2x2_8x32x1_8x32x1_1x32x1x8_8_1x1_intrawave_v3,838.12,311.53,0.0
gfx942,304,26368,4608,4096,ck,0,0,1184.9289,a8w8_blockscale_1x128x128_256x128x128x128_16x16_32x32_2x2_8x32x1_8x32x1_1x32x1x8_8_1x1_intrawave_v3,840.02,312.16,0.0
gfx942,304,26496,4608,4096,ck,0,0,1203.3216,a8w8_blockscale_1x128x128_256x128x128x128_16x16_32x32_2x2_8x32x1_8x32x1_1x32x1x8_8_1x1_intrawave_v3,831.19,308.8,0.0
gfx942,304,26624,4608,4096,ck,0,0,1189.5345,a8w8_blockscale_1x128x128_256x128x128x128_16x16_32x32_2x2_8x32x1_8x32x1_1x32x1x8_8_1x1_intrawave_v3,844.89,313.81,0.0
gfx942,304,26752,4608,4096,ck,0,0,1203.0123,a8w8_blockscale_1x128x128_256x128x128x128_16x16_32x32_2x2_8x32x1_8x32x1_1x32x1x8_8_1x1_intrawave_v3,839.44,311.72,0.0
gfx942,304,26880,4608,4096,ck,0,0,1214.0473,a8w8_blockscale_1x128x128_256x128x128x128_16x16_32x32_2x2_8x32x1_8x32x1_1x32x1x8_8_1x1_intrawave_v3,835.79,310.29,0.0
gfx942,304,27008,4608,4096,ck,0,0,1210.242,a8w8_blockscale_1x128x128_256x128x128x128_16x16_32x32_2x2_8x32x1_8x32x1_1x32x1x8_8_1x1_intrawave_v3,842.41,312.67,0.0
gfx942,304,27136,4608,4096,ck,0,0,1240.6867,a8w8_blockscale_1x128x128_256x128x128x128_16x16_32x32_2x2_8x32x1_8x32x1_1x32x1x8_8_1x1_intrawave_v3,825.63,306.37,0.0
gfx942,304,27264,4608,4096,ck,0,0,1241.7749,a8w8_blockscale_1x128x128_256x128x128x128_16x16_32x32_2x2_8x32x1_8x32x1_1x32x1x8_8_1x1_intrawave_v3,828.8,307.47,0.0
gfx942,304,27392,4608,4096,ck,0,0,1223.6477,a8w8_blockscale_1x128x128_256x128x128x128_16x16_32x32_2x2_8x32x1_8x32x1_1x32x1x8_8_1x1_intrawave_v3,845.03,313.42,0.0
gfx942,304,27520,4608,4096,ck,0,0,1264.6019,a8w8_blockscale_1x128x128_256x128x128x128_16x16_32x32_2x2_8x32x1_8x32x1_1x32x1x8_8_1x1_intrawave_v3,821.48,304.62,0.0
gfx942,304,27648,4608,4096,ck,0,0,1250.2816,a8w8_blockscale_1x128x128_256x128x128x128_16x16_32x32_2x2_8x32x1_8x32x1_1x32x1x8_8_1x1_intrawave_v3,834.75,309.47,0.0
gfx942,304,27776,4608,4096,ck,0,0,1261.3313,a8w8_blockscale_1x128x128_256x128x128x128_16x16_32x32_2x2_8x32x1_8x32x1_1x32x1x8_8_1x1_intrawave_v3,831.27,308.11,0.0
gfx942,304,27904,4608,4096,ck,0,0,1265.6406,a8w8_blockscale_1x128x128_256x128x128x128_16x16_32x32_2x2_8x32x1_8x32x1_1x32x1x8_8_1x1_intrawave_v3,832.26,308.41,0.0
gfx942,304,28032,4608,4096,ck,0,0,1253.3091,a8w8_blockscale_1x128x128_256x128x128x128_16x16_32x32_2x2_8x32x1_8x32x1_1x32x1x8_8_1x1_intrawave_v3,844.3,312.8,0.0
gfx942,304,28160,4608,4096,ck,0,0,1260.3416,a8w8_blockscale_1x128x128_256x128x128x128_16x16_32x32_2x2_8x32x1_8x32x1_1x32x1x8_8_1x1_intrawave_v3,843.43,312.41,0.0
gfx942,304,28288,4608,4096,ck,0,0,1270.549,a8w8_blockscale_1x128x128_256x128x128x128_16x16_32x32_2x2_8x32x1_8x32x1_1x32x1x8_8_1x1_intrawave_v3,840.45,311.24,0.0
gfx942,304,28416,4608,4096,ck,0,0,1308.7611,a8w8_blockscale_1x128x128_256x128x128x128_16x16_32x32_2x2_8x32x1_8x32x1_1x32x1x8_8_1x1_intrawave_v3,819.61,303.45,0.0
gfx942,304,28544,4608,4096,ck,0,0,1273.3003,a8w8_blockscale_1x128x128_256x128x128x128_16x16_32x32_2x2_8x32x1_8x32x1_1x32x1x8_8_1x1_intrawave_v3,846.23,313.24,0.0
gfx942,304,28672,4608,4096,ck,0,0,1273.7962,a8w8_blockscale_1x128x128_256x128x128x128_16x16_32x32_2x2_8x32x1_8x32x1_1x32x1x8_8_1x1_intrawave_v3,849.69,314.46,0.0
gfx942,304,28800,4608,4096,ck,0,0,1284.7469,a8w8_blockscale_1x128x128_256x128x128x128_16x16_32x32_2x2_8x32x1_8x32x1_1x32x1x8_8_1x1_intrawave_v3,846.21,313.1,0.0
gfx942,304,28928,4608,4096,ck,0,0,1287.3683,a8w8_blockscale_1x128x128_256x128x128x128_16x16_32x32_2x2_8x32x1_8x32x1_1x32x1x8_8_1x1_intrawave_v3,848.24,313.79,0.0
gfx942,304,29056,4608,4096,ck,0,0,1305.6195,a8w8_blockscale_1x128x128_256x128x128x128_16x16_32x32_2x2_8x32x1_8x32x1_1x32x1x8_8_1x1_intrawave_v3,840.08,310.71,0.0
gfx942,304,29184,4608,4096,ck,0,0,1298.8852,a8w8_blockscale_1x128x128_256x128x128x128_16x16_32x32_2x2_8x32x1_8x32x1_1x32x1x8_8_1x1_intrawave_v3,848.16,313.63,0.0
gfx942,304,29312,4608,4096,ck,0,0,1332.8484,a8w8_blockscale_1x128x128_256x128x128x128_16x16_32x32_2x2_8x32x1_8x32x1_1x32x1x8_8_1x1_intrawave_v3,830.17,306.92,0.0
gfx942,304,29440,4608,4096,ck,0,0,1332.6698,a8w8_blockscale_1x128x128_256x128x128x128_16x16_32x32_2x2_8x32x1_8x32x1_1x32x1x8_8_1x1_intrawave_v3,833.91,308.24,0.0
gfx942,304,29568,4608,4096,ck,0,0,1311.8858,a8w8_blockscale_1x128x128_256x128x128x128_16x16_32x32_2x2_8x32x1_8x32x1_1x32x1x8_8_1x1_intrawave_v3,850.8,314.42,0.0
gfx942,304,29696,4608,4096,ck,0,0,1332.4088,a8w8_blockscale_1x128x128_256x128x128x128_16x16_32x32_2x2_8x32x1_8x32x1_1x32x1x8_8_1x1_intrawave_v3,841.32,310.86,0.0
gfx942,304,29824,4608,4096,ck,0,0,1344.0995,a8w8_blockscale_1x128x128_256x128x128x128_16x16_32x32_2x2_8x32x1_8x32x1_1x32x1x8_8_1x1_intrawave_v3,837.6,309.42,0.0
gfx942,304,29952,4608,4096,ck,0,0,1344.4797,a8w8_blockscale_1x128x128_256x128x128x128_16x16_32x32_2x2_8x32x1_8x32x1_1x32x1x8_8_1x1_intrawave_v3,840.96,310.6,0.0
gfx942,304,30080,4608,4096,ck,0,0,1334.8041,a8w8_blockscale_1x128x128_256x128x128x128_16x16_32x32_2x2_8x32x1_8x32x1_1x32x1x8_8_1x1_intrawave_v3,850.67,314.13,0.0
gfx942,304,30208,4608,4096,ck,0,0,1352.567,a8w8_blockscale_1x128x128_256x128x128x128_16x16_32x32_2x2_8x32x1_8x32x1_1x32x1x8_8_1x1_intrawave_v3,843.07,311.26,0.0
gfx942,304,30336,4608,4096,ck,0,0,1380.661,a8w8_blockscale_1x128x128_256x128x128x128_16x16_32x32_2x2_8x32x1_8x32x1_1x32x1x8_8_1x1_intrawave_v3,829.42,306.16,0.0
gfx942,304,30464,4608,4096,ck,0,0,1356.7734,a8w8_blockscale_1x128x128_256x128x128x128_16x16_32x32_2x2_8x32x1_8x32x1_1x32x1x8_8_1x1_intrawave_v3,847.58,312.81,0.0
gfx942,304,30592,4608,4096,ck,0,0,1393.2175,a8w8_blockscale_1x128x128_256x128x128x128_16x16_32x32_2x2_8x32x1_8x32x1_1x32x1x8_8_1x1_intrawave_v3,828.88,305.85,0.0
gfx942,304,30720,4608,4096,ck,0,0,1353.9376,a8w8_blockscale_1x128x128_256x128x128x128_16x16_32x32_2x2_8x32x1_8x32x1_1x32x1x8_8_1x1_intrawave_v3,856.5,315.98,0.0
gfx942,304,30848,4608,4096,ck,0,0,1396.6319,a8w8_blockscale_1x128x128_256x128x128x128_16x16_32x32_2x2_8x32x1_8x32x1_1x32x1x8_8_1x1_intrawave_v3,833.77,307.54,0.0
gfx942,304,30976,4608,4096,ck,0,0,1373.2509,a8w8_blockscale_1x128x128_256x128x128x128_16x16_32x32_2x2_8x32x1_8x32x1_1x32x1x8_8_1x1_intrawave_v3,851.49,314.02,0.0
gfx942,304,31104,4608,4096,ck,0,0,1383.5032,a8w8_blockscale_1x128x128_256x128x128x128_16x16_32x32_2x2_8x32x1_8x32x1_1x32x1x8_8_1x1_intrawave_v3,848.67,312.92,0.0
gfx942,304,31232,4608,4096,ck,0,0,1403.9535,a8w8_blockscale_1x128x128_256x128x128x128_16x16_32x32_2x2_8x32x1_8x32x1_1x32x1x8_8_1x1_intrawave_v3,839.75,309.58,0.0
gfx942,304,31360,4608,4096,ck,0,0,1374.6444,a8w8_blockscale_1x128x128_256x128x128x128_16x16_32x32_2x2_8x32x1_8x32x1_1x32x1x8_8_1x1_intrawave_v3,861.17,317.42,0.0
gfx942,304,31488,4608,4096,ck,0,0,1415.6641,a8w8_blockscale_1x128x128_256x128x128x128_16x16_32x32_2x2_8x32x1_8x32x1_1x32x1x8_8_1x1_intrawave_v3,839.63,309.43,0.0
gfx942,304,31616,4608,4096,ck,0,0,1402.7972,a8w8_blockscale_1x128x128_256x128x128x128_16x16_32x32_2x2_8x32x1_8x32x1_1x32x1x8_8_1x1_intrawave_v3,850.77,313.48,0.0
gfx942,304,31744,4608,4096,ck,0,0,1422.047,a8w8_blockscale_1x128x128_256x128x128x128_16x16_32x32_2x2_8x32x1_8x32x1_1x32x1x8_8_1x1_intrawave_v3,842.66,310.43,0.0
gfx942,304,31872,4608,4096,ck,0,0,1463.7548,a8w8_blockscale_1x128x128_256x128x128x128_16x16_32x32_2x2_8x32x1_8x32x1_1x32x1x8_8_1x1_intrawave_v3,821.95,302.75,0.0
gfx942,304,32000,4608,4096,ck,0,0,1459.6256,a8w8_blockscale_1x128x128_256x128x128x128_16x16_32x32_2x2_8x32x1_8x32x1_1x32x1x8_8_1x1_intrawave_v3,827.58,304.78,0.0
gfx942,304,32128,4608,4096,ck,0,0,1420.141,a8w8_blockscale_1x128x128_256x128x128x128_16x16_32x32_2x2_8x32x1_8x32x1_1x32x1x8_8_1x1_intrawave_v3,853.99,314.45,0.0
gfx942,304,32256,4608,4096,ck,0,0,1456.6446,a8w8_blockscale_1x128x128_256x128x128x128_16x16_32x32_2x2_8x32x1_8x32x1_1x32x1x8_8_1x1_intrawave_v3,835.91,307.74,0.0
gfx942,304,32384,4608,4096,ck,0,0,1454.9059,a8w8_blockscale_1x128x128_256x128x128x128_16x16_32x32_2x2_8x32x1_8x32x1_1x32x1x8_8_1x1_intrawave_v3,840.23,309.28,0.0
gfx942,304,32512,4608,4096,ck,0,0,1456.6497,a8w8_blockscale_1x128x128_256x128x128x128_16x16_32x32_2x2_8x32x1_8x32x1_1x32x1x8_8_1x1_intrawave_v3,842.54,310.08,0.0
gfx942,304,32640,4608,4096,ck,0,0,1460.1361,a8w8_blockscale_1x128x128_256x128x128x128_16x16_32x32_2x2_8x32x1_8x32x1_1x32x1x8_8_1x1_intrawave_v3,843.84,310.5,0.0
gfx942,304,32768,4608,4096,ck,0,0,1443.6632,a8w8_blockscale_1x128x128_256x128x128x128_16x16_32x32_2x2_8x32x1_8x32x1_1x32x1x8_8_1x1_intrawave_v3,856.81,315.23,0.0
gfx942,304,32896,4608,4096,ck,0,0,1469.117,a8w8_blockscale_1x128x128_256x128x128x128_16x16_32x32_2x2_8x32x1_8x32x1_1x32x1x8_8_1x1_intrawave_v3,845.26,310.93,0.0
gfx942,304,33024,4608,4096,ck,0,0,1485.9271,a8w8_blockscale_1x128x128_256x128x128x128_16x16_32x32_2x2_8x32x1_8x32x1_1x32x1x8_8_1x1_intrawave_v3,838.95,308.55,0.0
gfx942,304,33152,4608,4096,ck,0,0,1471.7825,a8w8_blockscale_1x128x128_256x128x128x128_16x16_32x32_2x2_8x32x1_8x32x1_1x32x1x8_8_1x1_intrawave_v3,850.29,312.68,0.0
gfx942,304,33280,4608,4096,ck,0,0,1469.4655,a8w8_blockscale_1x128x128_256x128x128x128_16x16_32x32_2x2_8x32x1_8x32x1_1x32x1x8_8_1x1_intrawave_v3,854.92,314.33,0.0
gfx942,304,33408,4608,4096,ck,0,0,1473.9137,a8w8_blockscale_1x128x128_256x128x128x128_16x16_32x32_2x2_8x32x1_8x32x1_1x32x1x8_8_1x1_intrawave_v3,855.62,314.54,0.0
gfx942,304,33536,4608,4096,ck,0,0,1538.4393,a8w8_blockscale_1x128x128_256x128x128x128_16x16_32x32_2x2_8x32x1_8x32x1_1x32x1x8_8_1x1_intrawave_v3,822.87,302.45,0.0
gfx942,304,33664,4608,4096,ck,0,0,1522.7998,a8w8_blockscale_1x128x128_256x128x128x128_16x16_32x32_2x2_8x32x1_8x32x1_1x32x1x8_8_1x1_intrawave_v3,834.5,306.68,0.0
gfx942,304,33792,4608,4096,ck,0,0,1491.5928,a8w8_blockscale_1x128x128_256x128x128x128_16x16_32x32_2x2_8x32x1_8x32x1_1x32x1x8_8_1x1_intrawave_v3,855.2,314.24,0.0
gfx942,304,33920,4608,4096,ck,0,0,1518.7671,a8w8_blockscale_1x128x128_256x128x128x128_16x16_32x32_2x2_8x32x1_8x32x1_1x32x1x8_8_1x1_intrawave_v3,843.08,309.74,0.0
gfx942,304,34048,4608,4096,ck,0,0,1508.9806,a8w8_blockscale_1x128x128_256x128x128x128_16x16_32x32_2x2_8x32x1_8x32x1_1x32x1x8_8_1x1_intrawave_v3,851.75,312.87,0.0
gfx942,304,34176,4608,4096,ck,0,0,1539.9489,a8w8_blockscale_1x128x128_256x128x128x128_16x16_32x32_2x2_8x32x1_8x32x1_1x32x1x8_8_1x1_intrawave_v3,837.76,307.69,0.0
gfx942,304,34304,4608,4096,ck,0,0,1513.7584,a8w8_blockscale_1x128x128_256x128x128x128_16x16_32x32_2x2_8x32x1_8x32x1_1x32x1x8_8_1x1_intrawave_v3,855.44,314.14,0.0
gfx942,304,34432,4608,4096,ck,0,0,1533.182,a8w8_blockscale_1x128x128_256x128x128x128_16x16_32x32_2x2_8x32x1_8x32x1_1x32x1x8_8_1x1_intrawave_v3,847.76,311.27,0.0
gfx942,304,34560,4608,4096,ck,0,0,1560.5092,a8w8_blockscale_1x128x128_256x128x128x128_16x16_32x32_2x2_8x32x1_8x32x1_1x32x1x8_8_1x1_intrawave_v3,836.01,306.91,0.0
gfx942,304,34688,4608,4096,ck,0,0,1564.5607,a8w8_blockscale_1x128x128_256x128x128x128_16x16_32x32_2x2_8x32x1_8x32x1_1x32x1x8_8_1x1_intrawave_v3,836.93,307.21,0.0
gfx942,304,34816,4608,4096,ck,0,0,1537.431,a8w8_blockscale_1x128x128_256x128x128x128_16x16_32x32_2x2_8x32x1_8x32x1_1x32x1x8_8_1x1_intrawave_v3,854.84,313.73,0.0
gfx942,304,34944,4608,4096,ck,0,0,1591.8653,a8w8_blockscale_1x128x128_256x128x128x128_16x16_32x32_2x2_8x32x1_8x32x1_1x32x1x8_8_1x1_intrawave_v3,828.65,304.08,0.0
gfx942,304,35072,4608,4096,ck,0,0,1585.3381,a8w8_blockscale_1x128x128_256x128x128x128_16x16_32x32_2x2_8x32x1_8x32x1_1x32x1x8_8_1x1_intrawave_v3,835.1,306.4,0.0
gfx942,304,35200,4608,4096,ck,0,0,1562.4052,a8w8_blockscale_1x128x128_256x128x128x128_16x16_32x32_2x2_8x32x1_8x32x1_1x32x1x8_8_1x1_intrawave_v3,850.46,311.99,0.0
gfx942,304,35328,4608,4096,ck,0,0,1618.6872,a8w8_blockscale_1x128x128_256x128x128x128_16x16_32x32_2x2_8x32x1_8x32x1_1x32x1x8_8_1x1_intrawave_v3,823.87,302.2,0.0
gfx942,304,35456,4608,4096,ck,0,0,1578.6871,a8w8_blockscale_1x128x128_256x128x128x128_16x16_32x32_2x2_8x32x1_8x32x1_1x32x1x8_8_1x1_intrawave_v3,847.81,310.93,0.0
gfx942,304,35584,4608,4096,ck,0,0,1577.0987,a8w8_blockscale_1x128x128_256x128x128x128_16x16_32x32_2x2_8x32x1_8x32x1_1x32x1x8_8_1x1_intrawave_v3,851.72,312.33,0.0
gfx942,304,35712,4608,4096,ck,0,0,1609.9674,a8w8_blockscale_1x128x128_256x128x128x128_16x16_32x32_2x2_8x32x1_8x32x1_1x32x1x8_8_1x1_intrawave_v3,837.34,307.01,0.0
gfx942,304,35840,4608,4096,ck,0,0,1618.6729,a8w8_blockscale_1x128x128_256x128x128x128_16x16_32x32_2x2_8x32x1_8x32x1_1x32x1x8_8_1x1_intrawave_v3,835.82,306.41,0.0
gfx942,304,35968,4608,4096,ck,0,0,1601.4497,a8w8_blockscale_1x128x128_256x128x128x128_16x16_32x32_2x2_8x32x1_8x32x1_1x32x1x8_8_1x1_intrawave_v3,847.82,310.77,0.0
gfx942,304,36096,4608,4096,ck,0,0,1633.0102,a8w8_blockscale_1x128x128_256x128x128x128_16x16_32x32_2x2_8x32x1_8x32x1_1x32x1x8_8_1x1_intrawave_v3,834.4,305.81,0.0
gfx942,304,36224,4608,4096,ck,0,0,1623.1341,a8w8_blockscale_1x128x128_256x128x128x128_16x16_32x32_2x2_8x32x1_8x32x1_1x32x1x8_8_1x1_intrawave_v3,842.45,308.72,0.0
gfx942,304,36352,4608,4096,ck,0,0,1638.3235,a8w8_blockscale_1x128x128_256x128x128x128_16x16_32x32_2x2_8x32x1_8x32x1_1x32x1x8_8_1x1_intrawave_v3,837.59,306.89,0.0
gfx942,304,36480,4608,4096,ck,0,0,1651.5381,a8w8_blockscale_1x128x128_256x128x128x128_16x16_32x32_2x2_8x32x1_8x32x1_1x32x1x8_8_1x1_intrawave_v3,833.81,305.47,0.0
gfx942,304,36608,4608,4096,ck,0,0,1628.5144,a8w8_blockscale_1x128x128_256x128x128x128_16x16_32x32_2x2_8x32x1_8x32x1_1x32x1x8_8_1x1_intrawave_v3,848.57,310.84,0.0
gfx942,304,36736,4608,4096,ck,0,0,1629.0697,a8w8_blockscale_1x128x128_256x128x128x128_16x16_32x32_2x2_8x32x1_8x32x1_1x32x1x8_8_1x1_intrawave_v3,851.25,311.78,0.0
gfx942,304,36864,4608,4096,ck,0,0,1651.4239,a8w8_blockscale_1x128x128_256x128x128x128_16x16_32x32_2x2_8x32x1_8x32x1_1x32x1x8_8_1x1_intrawave_v3,842.65,308.59,0.0
gfx942,304,36992,4608,4096,ck,0,0,1678.9462,a8w8_blockscale_1x128x128_256x128x128x128_16x16_32x32_2x2_8x32x1_8x32x1_1x32x1x8_8_1x1_intrawave_v3,831.71,304.54,0.0
gfx942,304,37120,4608,4096,ck,0,0,1687.5966,a8w8_blockscale_1x128x128_256x128x128x128_16x16_32x32_2x2_8x32x1_8x32x1_1x32x1x8_8_1x1_intrawave_v3,830.31,303.99,0.0
gfx942,304,37248,4608,4096,ck,0,0,1717.707,a8w8_blockscale_1x128x128_256x128x128x128_16x16_32x32_2x2_8x32x1_8x32x1_1x32x1x8_8_1x1_intrawave_v3,818.57,299.66,0.0
gfx942,304,37376,4608,4096,ck,0,0,1653.0776,a8w8_blockscale_1x128x128_256x128x128x128_16x16_32x32_2x2_8x32x1_8x32x1_1x32x1x8_8_1x1_intrawave_v3,853.5,312.4,0.0
gfx942,304,37504,4608,4096,ck,0,0,1660.7208,a8w8_blockscale_1x128x128_256x128x128x128_16x16_32x32_2x2_8x32x1_8x32x1_1x32x1x8_8_1x1_intrawave_v3,852.48,311.99,0.0
gfx942,304,37632,4608,4096,ck,0,0,1673.776,a8w8_blockscale_1x128x128_256x128x128x128_16x16_32x32_2x2_8x32x1_8x32x1_1x32x1x8_8_1x1_intrawave_v3,848.72,310.57,0.0
gfx942,304,37760,4608,4096,ck,0,0,1672.6837,a8w8_blockscale_1x128x128_256x128x128x128_16x16_32x32_2x2_8x32x1_8x32x1_1x32x1x8_8_1x1_intrawave_v3,852.16,311.8,0.0
gfx942,304,37888,4608,4096,ck,0,0,1705.9073,a8w8_blockscale_1x128x128_256x128x128x128_16x16_32x32_2x2_8x32x1_8x32x1_1x32x1x8_8_1x1_intrawave_v3,838.39,306.72,0.0
gfx942,304,38016,4608,4096,ck,0,0,1710.2239,a8w8_blockscale_1x128x128_256x128x128x128_16x16_32x32_2x2_8x32x1_8x32x1_1x32x1x8_8_1x1_intrawave_v3,839.1,306.94,0.0
gfx942,304,38144,4608,4096,ck,0,0,1725.8976,a8w8_blockscale_1x128x128_256x128x128x128_16x16_32x32_2x2_8x32x1_8x32x1_1x32x1x8_8_1x1_intrawave_v3,834.28,305.14,0.0
gfx942,304,38272,4608,4096,ck,0,0,1721.8858,a8w8_blockscale_1x128x128_256x128x128x128_16x16_32x32_2x2_8x32x1_8x32x1_1x32x1x8_8_1x1_intrawave_v3,839.03,306.84,0.0
gfx942,304,38400,4608,4096,ck,0,0,1706.759,a8w8_blockscale_1x128x128_256x128x128x128_16x16_32x32_2x2_8x32x1_8x32x1_1x32x1x8_8_1x1_intrawave_v3,849.3,310.56,0.0
gfx942,304,38528,4608,4096,ck,0,0,1722.8654,a8w8_blockscale_1x128x128_256x128x128x128_16x16_32x32_2x2_8x32x1_8x32x1_1x32x1x8_8_1x1_intrawave_v3,844.17,308.65,0.0
gfx942,304,38656,4608,4096,ck,0,0,1760.6077,a8w8_blockscale_1x128x128_256x128x128x128_16x16_32x32_2x2_8x32x1_8x32x1_1x32x1x8_8_1x1_intrawave_v3,828.81,303.0,0.0
gfx942,304,38784,4608,4096,ck,0,0,1747.7664,a8w8_blockscale_1x128x128_256x128x128x128_16x16_32x32_2x2_8x32x1_8x32x1_1x32x1x8_8_1x1_intrawave_v3,837.67,306.2,0.0
gfx942,304,38912,4608,4096,ck,0,0,1751.637,a8w8_blockscale_1x128x128_256x128x128x128_16x16_32x32_2x2_8x32x1_8x32x1_1x32x1x8_8_1x1_intrawave_v3,838.57,306.5,0.0
gfx942,304,39040,4608,4096,ck,0,0,1753.2141,a8w8_blockscale_1x128x128_256x128x128x128_16x16_32x32_2x2_8x32x1_8x32x1_1x32x1x8_8_1x1_intrawave_v3,840.58,307.19,0.0
gfx942,304,39168,4608,4096,ck,0,0,1760.389,a8w8_blockscale_1x128x128_256x128x128x128_16x16_32x32_2x2_8x32x1_8x32x1_1x32x1x8_8_1x1_intrawave_v3,839.9,306.91,0.0
gfx942,304,39296,4608,4096,ck,0,0,1758.0073,a8w8_blockscale_1x128x128_256x128x128x128_16x16_32x32_2x2_8x32x1_8x32x1_1x32x1x8_8_1x1_intrawave_v3,843.78,308.29,0.0
gfx942,304,39424,4608,4096,ck,0,0,1770.894,a8w8_blockscale_1x128x128_256x128x128x128_16x16_32x32_2x2_8x32x1_8x32x1_1x32x1x8_8_1x1_intrawave_v3,840.37,307.01,0.0
gfx942,304,39552,4608,4096,ck,0,0,1787.7298,a8w8_blockscale_1x128x128_256x128x128x128_16x16_32x32_2x2_8x32x1_8x32x1_1x32x1x8_8_1x1_intrawave_v3,835.16,305.07,0.0
gfx942,304,39680,4608,4096,ck,0,0,1790.9538,a8w8_blockscale_1x128x128_256x128x128x128_16x16_32x32_2x2_8x32x1_8x32x1_1x32x1x8_8_1x1_intrawave_v3,836.35,305.48,0.0
gfx942,304,39808,4608,4096,ck,0,0,1771.089,a8w8_blockscale_1x128x128_256x128x128x128_16x16_32x32_2x2_8x32x1_8x32x1_1x32x1x8_8_1x1_intrawave_v3,848.46,309.86,0.0
gfx942,304,39936,4608,4096,ck,0,0,1798.2867,a8w8_blockscale_1x128x128_256x128x128x128_16x16_32x32_2x2_8x32x1_8x32x1_1x32x1x8_8_1x1_intrawave_v3,838.32,306.13,0.0
gfx942,304,40064,4608,4096,ck,0,0,1812.8314,a8w8_blockscale_1x128x128_256x128x128x128_16x16_32x32_2x2_8x32x1_8x32x1_1x32x1x8_8_1x1_intrawave_v3,834.26,304.61,0.0
gfx942,304,40192,4608,4096,ck,0,0,1811.666,a8w8_blockscale_1x128x128_256x128x128x128_16x16_32x32_2x2_8x32x1_8x32x1_1x32x1x8_8_1x1_intrawave_v3,837.46,305.75,0.0
gfx942,304,40320,4608,4096,ck,0,0,1809.5893,a8w8_blockscale_1x128x128_256x128x128x128_16x16_32x32_2x2_8x32x1_8x32x1_1x32x1x8_8_1x1_intrawave_v3,841.09,307.04,0.0
gfx942,304,40448,4608,4096,ck,0,0,1821.4579,a8w8_blockscale_1x128x128_256x128x128x128_16x16_32x32_2x2_8x32x1_8x32x1_1x32x1x8_8_1x1_intrawave_v3,838.26,305.97,0.0
gfx942,304,40576,4608,4096,ck,0,0,1809.2186,a8w8_blockscale_1x128x128_256x128x128x128_16x16_32x32_2x2_8x32x1_8x32x1_1x32x1x8_8_1x1_intrawave_v3,846.6,308.99,0.0
gfx942,304,40704,4608,4096,ck,0,0,1840.1492,a8w8_blockscale_1x128x128_256x128x128x128_16x16_32x32_2x2_8x32x1_8x32x1_1x32x1x8_8_1x1_intrawave_v3,835.0,304.72,0.0
gfx942,304,40832,4608,4096,ck,0,0,1808.7029,a8w8_blockscale_1x128x128_256x128x128x128_16x16_32x32_2x2_8x32x1_8x32x1_1x32x1x8_8_1x1_intrawave_v3,852.19,310.96,0.0
gfx942,304,40960,4608,4096,ck,0,0,1809.8094,a8w8_blockscale_1x128x128_256x128x128x128_16x16_32x32_2x2_8x32x1_8x32x1_1x32x1x8_8_1x1_intrawave_v3,854.34,311.71,0.0
gfx942,304,41088,4608,4096,ck,0,0,1853.1861,a8w8_blockscale_1x128x128_256x128x128x128_16x16_32x32_2x2_8x32x1_8x32x1_1x32x1x8_8_1x1_intrawave_v3,836.95,305.33,0.0
gfx942,304,41216,4608,4096,ck,0,0,1870.6939,a8w8_blockscale_1x128x128_256x128x128x128_16x16_32x32_2x2_8x32x1_8x32x1_1x32x1x8_8_1x1_intrawave_v3,831.7,303.39,0.0
gfx942,304,41344,4608,4096,ck,0,0,1837.3836,a8w8_blockscale_1x128x128_256x128x128x128_16x16_32x32_2x2_8x32x1_8x32x1_1x32x1x8_8_1x1_intrawave_v3,849.41,309.81,0.0
gfx942,304,41472,4608,4096,ck,0,0,1838.3808,a8w8_blockscale_1x128x128_256x128x128x128_16x16_32x32_2x2_8x32x1_8x32x1_1x32x1x8_8_1x1_intrawave_v3,851.57,310.57,0.0
gfx942,304,41600,4608,4096,ck,0,0,1880.6956,a8w8_blockscale_1x128x128_256x128x128x128_16x16_32x32_2x2_8x32x1_8x32x1_1x32x1x8_8_1x1_intrawave_v3,834.98,304.49,0.0
gfx942,304,41728,4608,4096,ck,0,0,1877.5135,a8w8_blockscale_1x128x128_256x128x128x128_16x16_32x32_2x2_8x32x1_8x32x1_1x32x1x8_8_1x1_intrawave_v3,838.97,305.91,0.0
gfx942,304,41856,4608,4096,ck,0,0,1856.6624,a8w8_blockscale_1x128x128_256x128x128x128_16x16_32x32_2x2_8x32x1_8x32x1_1x32x1x8_8_1x1_intrawave_v3,851.0,310.27,0.0
gfx942,304,41984,4608,4096,ck,0,0,1870.1833,a8w8_blockscale_1x128x128_256x128x128x128_16x16_32x32_2x2_8x32x1_8x32x1_1x32x1x8_8_1x1_intrawave_v3,847.43,308.94,0.0
gfx942,304,42112,4608,4096,ck,0,0,1935.995,a8w8_blockscale_1x128x128_256x128x128x128_16x16_32x32_2x2_8x32x1_8x32x1_1x32x1x8_8_1x1_intrawave_v3,821.12,299.31,0.0
gfx942,304,42240,4608,4096,ck,0,0,1895.0751,a8w8_blockscale_1x128x128_256x128x128x128_16x16_32x32_2x2_8x32x1_8x32x1_1x32x1x8_8_1x1_intrawave_v3,841.39,306.68,0.0
gfx942,304,42368,4608,4096,ck,0,0,1904.7966,a8w8_blockscale_1x128x128_256x128x128x128_16x16_32x32_2x2_8x32x1_8x32x1_1x32x1x8_8_1x1_intrawave_v3,839.64,306.0,0.0
gfx942,304,42496,4608,4096,ck,0,0,1880.5663,a8w8_blockscale_1x128x128_256x128x128x128_16x16_32x32_2x2_8x32x1_8x32x1_1x32x1x8_8_1x1_intrawave_v3,853.03,310.85,0.0
gfx942,304,42624,4608,4096,ck,0,0,1888.8647,a8w8_blockscale_1x128x128_256x128x128x128_16x16_32x32_2x2_8x32x1_8x32x1_1x32x1x8_8_1x1_intrawave_v3,851.84,310.39,0.0
gfx942,304,42752,4608,4096,ck,0,0,1897.7086,a8w8_blockscale_1x128x128_256x128x128x128_16x16_32x32_2x2_8x32x1_8x32x1_1x32x1x8_8_1x1_intrawave_v3,850.41,309.84,0.0
gfx942,304,42880,4608,4096,ck,0,0,1905.5757,a8w8_blockscale_1x128x128_256x128x128x128_16x16_32x32_2x2_8x32x1_8x32x1_1x32x1x8_8_1x1_intrawave_v3,849.44,309.46,0.0
gfx942,304,43008,4608,4096,ck,0,0,1930.938,a8w8_blockscale_1x128x128_256x128x128x128_16x16_32x32_2x2_8x32x1_8x32x1_1x32x1x8_8_1x1_intrawave_v3,840.78,306.27,0.0
gfx942,304,43136,4608,4096,ck,0,0,1991.7058,a8w8_blockscale_1x128x128_256x128x128x128_16x16_32x32_2x2_8x32x1_8x32x1_1x32x1x8_8_1x1_intrawave_v3,817.56,297.79,0.0
gfx942,304,43264,4608,4096,ck,0,0,1921.3942,a8w8_blockscale_1x128x128_256x128x128x128_16x16_32x32_2x2_8x32x1_8x32x1_1x32x1x8_8_1x1_intrawave_v3,849.99,309.57,0.0
gfx942,304,43392,4608,4096,ck,0,0,1922.724,a8w8_blockscale_1x128x128_256x128x128x128_16x16_32x32_2x2_8x32x1_8x32x1_1x32x1x8_8_1x1_intrawave_v3,851.91,310.24,0.0
gfx942,304,43520,4608,4096,ck,0,0,1955.5682,a8w8_blockscale_1x128x128_256x128x128x128_16x16_32x32_2x2_8x32x1_8x32x1_1x32x1x8_8_1x1_intrawave_v3,840.08,305.9,0.0
gfx942,304,43648,4608,4096,ck,0,0,1937.77,a8w8_blockscale_1x128x128_256x128x128x128_16x16_32x32_2x2_8x32x1_8x32x1_1x32x1x8_8_1x1_intrawave_v3,850.29,309.59,0.0
gfx942,304,43776,4608,4096,ck,0,0,1940.167,a8w8_blockscale_1x128x128_256x128x128x128_16x16_32x32_2x2_8x32x1_8x32x1_1x32x1x8_8_1x1_intrawave_v3,851.72,310.09,0.0
gfx942,304,43904,4608,4096,ck,0,0,1963.3966,a8w8_blockscale_1x128x128_256x128x128x128_16x16_32x32_2x2_8x32x1_8x32x1_1x32x1x8_8_1x1_intrawave_v3,844.11,307.29,0.0
gfx942,304,44032,4608,4096,ck,0,0,1963.0907,a8w8_blockscale_1x128x128_256x128x128x128_16x16_32x32_2x2_8x32x1_8x32x1_1x32x1x8_8_1x1_intrawave_v3,846.7,308.2,0.0
gfx942,304,44160,4608,4096,ck,0,0,1941.8407,a8w8_blockscale_1x128x128_256x128x128x128_16x16_32x32_2x2_8x32x1_8x32x1_1x32x1x8_8_1x1_intrawave_v3,858.46,312.45,0.0
gfx942,304,44288,4608,4096,ck,0,0,1942.7106,a8w8_blockscale_1x128x128_256x128x128x128_16x16_32x32_2x2_8x32x1_8x32x1_1x32x1x8_8_1x1_intrawave_v3,860.56,313.19,0.0
gfx942,304,44416,4608,4096,ck,0,0,1959.8277,a8w8_blockscale_1x128x128_256x128x128x128_16x16_32x32_2x2_8x32x1_8x32x1_1x32x1x8_8_1x1_intrawave_v3,855.51,311.32,0.0
gfx942,304,44544,4608,4096,ck,0,0,1993.597,a8w8_blockscale_1x128x128_256x128x128x128_16x16_32x32_2x2_8x32x1_8x32x1_1x32x1x8_8_1x1_intrawave_v3,843.44,306.9,0.0
gfx942,304,44672,4608,4096,ck,0,0,2040.827,a8w8_blockscale_1x128x128_256x128x128x128_16x16_32x32_2x2_8x32x1_8x32x1_1x32x1x8_8_1x1_intrawave_v3,826.29,300.64,0.0
gfx942,304,44800,4608,4096,ck,0,0,1968.0943,a8w8_blockscale_1x128x128_256x128x128x128_16x16_32x32_2x2_8x32x1_8x32x1_1x32x1x8_8_1x1_intrawave_v3,859.28,312.61,0.0
gfx942,304,44928,4608,4096,ck,0,0,1973.4708,a8w8_blockscale_1x128x128_256x128x128x128_16x16_32x32_2x2_8x32x1_8x32x1_1x32x1x8_8_1x1_intrawave_v3,859.39,312.62,0.0
gfx942,304,45056,4608,4096,ck,0,0,1969.1193,a8w8_blockscale_1x128x128_256x128x128x128_16x16_32x32_2x2_8x32x1_8x32x1_1x32x1x8_8_1x1_intrawave_v3,863.74,314.18,0.0
gfx942,304,45184,4608,4096,ck,0,0,1994.4341,a8w8_blockscale_1x128x128_256x128x128x128_16x16_32x32_2x2_8x32x1_8x32x1_1x32x1x8_8_1x1_intrawave_v3,855.2,311.05,0.0
gfx942,304,45312,4608,4096,ck,0,0,2004.0706,a8w8_blockscale_1x128x128_256x128x128x128_16x16_32x32_2x2_8x32x1_8x32x1_1x32x1x8_8_1x1_intrawave_v3,853.5,310.4,0.0
gfx942,304,45440,4608,4096,ck,0,0,2012.0481,a8w8_blockscale_1x128x128_256x128x128x128_16x16_32x32_2x2_8x32x1_8x32x1_1x32x1x8_8_1x1_intrawave_v3,852.52,310.02,0.0
gfx942,304,45568,4608,4096,ck,0,0,2081.6976,a8w8_blockscale_1x128x128_256x128x128x128_16x16_32x32_2x2_8x32x1_8x32x1_1x32x1x8_8_1x1_intrawave_v3,826.31,300.46,0.0
gfx942,304,45696,4608,4096,ck,0,0,2091.4086,a8w8_blockscale_1x128x128_256x128x128x128_16x16_32x32_2x2_8x32x1_8x32x1_1x32x1x8_8_1x1_intrawave_v3,824.79,299.88,0.0
gfx942,304,45824,4608,4096,ck,0,0,2017.6803,a8w8_blockscale_1x128x128_256x128x128x128_16x16_32x32_2x2_8x32x1_8x32x1_1x32x1x8_8_1x1_intrawave_v3,857.32,311.69,0.0
gfx942,304,45952,4608,4096,ck,0,0,2046.8427,a8w8_blockscale_1x128x128_256x128x128x128_16x16_32x32_2x2_8x32x1_8x32x1_1x32x1x8_8_1x1_intrawave_v3,847.47,308.08,0.0
gfx942,304,46080,4608,4096,ck,0,0,2056.5783,a8w8_blockscale_1x128x128_256x128x128x128_16x16_32x32_2x2_8x32x1_8x32x1_1x32x1x8_8_1x1_intrawave_v3,845.8,307.45,0.0
gfx942,304,46208,4608,4096,ck,0,0,2048.4046,a8w8_blockscale_1x128x128_256x128x128x128_16x16_32x32_2x2_8x32x1_8x32x1_1x32x1x8_8_1x1_intrawave_v3,851.54,309.51,0.0
gfx942,304,46336,4608,4096,ck,0,0,2125.888,a8w8_blockscale_1x128x128_256x128x128x128_16x16_32x32_2x2_8x32x1_8x32x1_1x32x1x8_8_1x1_intrawave_v3,822.77,299.03,0.0
gfx942,304,46464,4608,4096,ck,0,0,2067.4077,a8w8_blockscale_1x128x128_256x128x128x128_16x16_32x32_2x2_8x32x1_8x32x1_1x32x1x8_8_1x1_intrawave_v3,848.38,308.31,0.0
gfx942,304,46592,4608,4096,ck,0,0,2052.6369,a8w8_blockscale_1x128x128_256x128x128x128_16x16_32x32_2x2_8x32x1_8x32x1_1x32x1x8_8_1x1_intrawave_v3,856.84,311.36,0.0
gfx942,304,46720,4608,4096,ck,0,0,2085.1917,a8w8_blockscale_1x128x128_256x128x128x128_16x16_32x32_2x2_8x32x1_8x32x1_1x32x1x8_8_1x1_intrawave_v3,845.78,307.32,0.0
gfx942,304,46848,4608,4096,ck,0,0,2077.4007,a8w8_blockscale_1x128x128_256x128x128x128_16x16_32x32_2x2_8x32x1_8x32x1_1x32x1x8_8_1x1_intrawave_v3,851.28,309.29,0.0
gfx942,304,46976,4608,4096,ck,0,0,2077.9145,a8w8_blockscale_1x128x128_256x128x128x128_16x16_32x32_2x2_8x32x1_8x32x1_1x32x1x8_8_1x1_intrawave_v3,853.4,310.03,0.0
gfx942,304,47104,4608,4096,ck,0,0,2071.9127,a8w8_blockscale_1x128x128_256x128x128x128_16x16_32x32_2x2_8x32x1_8x32x1_1x32x1x8_8_1x1_intrawave_v3,858.2,311.75,0.0
gfx942,304,47232,4608,4096,ck,0,0,2095.5037,a8w8_blockscale_1x128x128_256x128x128x128_16x16_32x32_2x2_8x32x1_8x32x1_1x32x1x8_8_1x1_intrawave_v3,850.84,309.06,0.0
gfx942,304,47360,4608,4096,ck,0,0,2118.7399,a8w8_blockscale_1x128x128_256x128x128x128_16x16_32x32_2x2_8x32x1_8x32x1_1x32x1x8_8_1x1_intrawave_v3,843.79,306.47,0.0
gfx942,304,47488,4608,4096,ck,0,0,2121.3054,a8w8_blockscale_1x128x128_256x128x128x128_16x16_32x32_2x2_8x32x1_8x32x1_1x32x1x8_8_1x1_intrawave_v3,845.05,306.9,0.0
gfx942,304,47616,4608,4096,ck,0,0,2122.0409,a8w8_blockscale_1x128x128_256x128x128x128_16x16_32x32_2x2_8x32x1_8x32x1_1x32x1x8_8_1x1_intrawave_v3,847.04,307.6,0.0
gfx942,304,47744,4608,4096,ck,0,0,2163.2184,a8w8_blockscale_1x128x128_256x128x128x128_16x16_32x32_2x2_8x32x1_8x32x1_1x32x1x8_8_1x1_intrawave_v3,833.15,302.53,0.0
gfx942,304,47872,4608,4096,ck,0,0,2125.3316,a8w8_blockscale_1x128x128_256x128x128x128_16x16_32x32_2x2_8x32x1_8x32x1_1x32x1x8_8_1x1_intrawave_v3,850.27,308.73,0.0
gfx942,304,48000,4608,4096,ck,0,0,2148.4637,a8w8_blockscale_1x128x128_256x128x128x128_16x16_32x32_2x2_8x32x1_8x32x1_1x32x1x8_8_1x1_intrawave_v3,843.37,306.2,0.0
gfx942,304,48128,4608,4096,ck,0,0,2133.9093,a8w8_blockscale_1x128x128_256x128x128x128_16x16_32x32_2x2_8x32x1_8x32x1_1x32x1x8_8_1x1_intrawave_v3,851.38,309.08,0.0
gfx942,304,48256,4608,4096,ck,0,0,2135.7712,a8w8_blockscale_1x128x128_256x128x128x128_16x16_32x32_2x2_8x32x1_8x32x1_1x32x1x8_8_1x1_intrawave_v3,852.9,309.61,0.0
gfx942,304,48384,4608,4096,ck,0,0,2144.0628,a8w8_blockscale_1x128x128_256x128x128x128_16x16_32x32_2x2_8x32x1_8x32x1_1x32x1x8_8_1x1_intrawave_v3,851.86,309.21,0.0
gfx942,304,48512,4608,4096,ck,0,0,2170.8449,a8w8_blockscale_1x128x128_256x128x128x128_16x16_32x32_2x2_8x32x1_8x32x1_1x32x1x8_8_1x1_intrawave_v3,843.57,306.18,0.0
gfx942,304,48640,4608,4096,ck,0,0,2192.4049,a8w8_blockscale_1x128x128_256x128x128x128_16x16_32x32_2x2_8x32x1_8x32x1_1x32x1x8_8_1x1_intrawave_v3,837.48,303.94,0.0
gfx942,304,48768,4608,4096,ck,0,0,2162.3181,a8w8_blockscale_1x128x128_256x128x128x128_16x16_32x32_2x2_8x32x1_8x32x1_1x32x1x8_8_1x1_intrawave_v3,851.37,308.96,0.0
gfx942,304,48896,4608,4096,ck,0,0,2163.4743,a8w8_blockscale_1x128x128_256x128x128x128_16x16_32x32_2x2_8x32x1_8x32x1_1x32x1x8_8_1x1_intrawave_v3,853.15,309.58,0.0
gfx942,304,49024,4608,4096,ck,0,0,2221.2323,a8w8_blockscale_1x128x128_256x128x128x128_16x16_32x32_2x2_8x32x1_8x32x1_1x32x1x8_8_1x1_intrawave_v3,833.14,302.3,0.0
gfx942,304,49152,4608,4096,ck,0,0,2173.2488,a8w8_blockscale_1x128x128_256x128x128x128_16x16_32x32_2x2_8x32x1_8x32x1_1x32x1x8_8_1x1_intrawave_v3,853.76,309.76,0.0
gfx942,304,49280,4608,4096,ck,0,0,2202.6033,a8w8_blockscale_1x128x128_256x128x128x128_16x16_32x32_2x2_8x32x1_8x32x1_1x32x1x8_8_1x1_intrawave_v3,844.57,306.41,0.0
gfx942,304,49408,4608,4096,ck,0,0,2217.1414,a8w8_blockscale_1x128x128_256x128x128x128_16x16_32x32_2x2_8x32x1_8x32x1_1x32x1x8_8_1x1_intrawave_v3,841.21,305.16,0.0
gfx942,304,49536,4608,4096,ck,0,0,2186.5311,a8w8_blockscale_1x128x128_256x128x128x128_16x16_32x32_2x2_8x32x1_8x32x1_1x32x1x8_8_1x1_intrawave_v3,855.2,310.22,0.0
gfx942,304,49664,4608,4096,ck,0,0,2191.6048,a8w8_blockscale_1x128x128_256x128x128x128_16x16_32x32_2x2_8x32x1_8x32x1_1x32x1x8_8_1x1_intrawave_v3,855.42,310.28,0.0
gfx942,304,49792,4608,4096,ck,0,0,2242.0375,a8w8_blockscale_1x128x128_256x128x128x128_16x16_32x32_2x2_8x32x1_8x32x1_1x32x1x8_8_1x1_intrawave_v3,838.34,304.06,0.0
gfx942,304,49920,4608,4096,ck,0,0,2205.8636,a8w8_blockscale_1x128x128_256x128x128x128_16x16_32x32_2x2_8x32x1_8x32x1_1x32x1x8_8_1x1_intrawave_v3,854.28,309.81,0.0
gfx942,304,50048,4608,4096,ck,0,0,2213.6072,a8w8_blockscale_1x128x128_256x128x128x128_16x16_32x32_2x2_8x32x1_8x32x1_1x32x1x8_8_1x1_intrawave_v3,853.47,309.5,0.0
gfx942,304,50176,4608,4096,ck,0,0,2247.3034,a8w8_blockscale_1x128x128_256x128x128x128_16x16_32x32_2x2_8x32x1_8x32x1_1x32x1x8_8_1x1_intrawave_v3,842.82,305.62,0.0
gfx942,304,50304,4608,4096,ck,0,0,2251.3686,a8w8_blockscale_1x128x128_256x128x128x128_16x16_32x32_2x2_8x32x1_8x32x1_1x32x1x8_8_1x1_intrawave_v3,843.45,305.82,0.0
gfx942,304,50432,4608,4096,ck,0,0,2255.351,a8w8_blockscale_1x128x128_256x128x128x128_16x16_32x32_2x2_8x32x1_8x32x1_1x32x1x8_8_1x1_intrawave_v3,844.1,306.04,0.0
gfx942,304,50560,4608,4096,ck,0,0,2325.4679,a8w8_blockscale_1x128x128_256x128x128x128_16x16_32x32_2x2_8x32x1_8x32x1_1x32x1x8_8_1x1_intrawave_v3,820.73,297.54,0.0
gfx942,304,50688,4608,4096,ck,0,0,2321.8188,a8w8_blockscale_1x128x128_256x128x128x128_16x16_32x32_2x2_8x32x1_8x32x1_1x32x1x8_8_1x1_intrawave_v3,824.1,298.75,0.0
gfx942,304,50816,4608,4096,ck,0,0,2299.9065,a8w8_blockscale_1x128x128_256x128x128x128_16x16_32x32_2x2_8x32x1_8x32x1_1x32x1x8_8_1x1_intrawave_v3,834.05,302.33,0.0
gfx942,304,50944,4608,4096,ck,0,0,2303.5969,a8w8_blockscale_1x128x128_256x128x128x128_16x16_32x32_2x2_8x32x1_8x32x1_1x32x1x8_8_1x1_intrawave_v3,834.81,302.59,0.0
gfx942,304,51072,4608,4096,ck,0,0,2339.8985,a8w8_blockscale_1x128x128_256x128x128x128_16x16_32x32_2x2_8x32x1_8x32x1_1x32x1x8_8_1x1_intrawave_v3,823.93,298.62,0.0
gfx942,304,51200,4608,4096,ck,0,0,2309.1749,a8w8_blockscale_1x128x128_256x128x128x128_16x16_32x32_2x2_8x32x1_8x32x1_1x32x1x8_8_1x1_intrawave_v3,836.98,303.33,0.0
gfx942,304,51328,4608,4096,ck,0,0,2294.3349,a8w8_blockscale_1x128x128_256x128x128x128_16x16_32x32_2x2_8x32x1_8x32x1_1x32x1x8_8_1x1_intrawave_v3,844.5,306.04,0.0
gfx942,304,51456,4608,4096,ck,0,0,2299.5157,a8w8_blockscale_1x128x128_256x128x128x128_16x16_32x32_2x2_8x32x1_8x32x1_1x32x1x8_8_1x1_intrawave_v3,844.7,306.09,0.0
gfx942,304,51584,4608,4096,ck,0,0,2324.2419,a8w8_blockscale_1x128x128_256x128x128x128_16x16_32x32_2x2_8x32x1_8x32x1_1x32x1x8_8_1x1_intrawave_v3,837.79,303.57,0.0
gfx942,304,51712,4608,4096,ck,0,0,2320.7901,a8w8_blockscale_1x128x128_256x128x128x128_16x16_32x32_2x2_8x32x1_8x32x1_1x32x1x8_8_1x1_intrawave_v3,841.12,304.75,0.0
gfx942,304,51840,4608,4096,ck,0,0,2346.9175,a8w8_blockscale_1x128x128_256x128x128x128_16x16_32x32_2x2_8x32x1_8x32x1_1x32x1x8_8_1x1_intrawave_v3,833.81,302.08,0.0
gfx942,304,51968,4608,4096,ck,0,0,2293.8272,a8w8_blockscale_1x128x128_256x128x128x128_16x16_32x32_2x2_8x32x1_8x32x1_1x32x1x8_8_1x1_intrawave_v3,855.22,309.82,0.0
gfx942,304,52096,4608,4096,ck,0,0,2340.8476,a8w8_blockscale_1x128x128_256x128x128x128_16x16_32x32_2x2_8x32x1_8x32x1_1x32x1x8_8_1x1_intrawave_v3,840.11,304.32,0.0
gfx942,304,52224,4608,4096,ck,0,0,2342.5608,a8w8_blockscale_1x128x128_256x128x128x128_16x16_32x32_2x2_8x32x1_8x32x1_1x32x1x8_8_1x1_intrawave_v3,841.55,304.83,0.0
gfx942,304,52352,4608,4096,ck,0,0,2399.2554,a8w8_blockscale_1x128x128_256x128x128x128_16x16_32x32_2x2_8x32x1_8x32x1_1x32x1x8_8_1x1_intrawave_v3,823.68,298.34,0.0
gfx942,304,52480,4608,4096,ck,0,0,2312.4104,a8w8_blockscale_1x128x128_256x128x128x128_16x16_32x32_2x2_8x32x1_8x32x1_1x32x1x8_8_1x1_intrawave_v3,856.71,310.28,0.0
gfx942,304,52608,4608,4096,ck,0,0,2322.7944,a8w8_blockscale_1x128x128_256x128x128x128_16x16_32x32_2x2_8x32x1_8x32x1_1x32x1x8_8_1x1_intrawave_v3,854.96,309.62,0.0
gfx942,304,52736,4608,4096,ck,0,0,2367.4262,a8w8_blockscale_1x128x128_256x128x128x128_16x16_32x32_2x2_8x32x1_8x32x1_1x32x1x8_8_1x1_intrawave_v3,840.88,304.51,0.0
gfx942,304,52864,4608,4096,ck,0,0,2372.8289,a8w8_blockscale_1x128x128_256x128x128x128_16x16_32x32_2x2_8x32x1_8x32x1_1x32x1x8_8_1x1_intrawave_v3,841.0,304.53,0.0
gfx942,304,52992,4608,4096,ck,0,0,2338.9143,a8w8_blockscale_1x128x128_256x128x128x128_16x16_32x32_2x2_8x32x1_8x32x1_1x32x1x8_8_1x1_intrawave_v3,855.26,309.68,0.0
gfx942,304,53120,4608,4096,ck,0,0,2401.1433,a8w8_blockscale_1x128x128_256x128x128x128_16x16_32x32_2x2_8x32x1_8x32x1_1x32x1x8_8_1x1_intrawave_v3,835.11,302.36,0.0
gfx942,304,53248,4608,4096,ck,0,0,2347.6934,a8w8_blockscale_1x128x128_256x128x128x128_16x16_32x32_2x2_8x32x1_8x32x1_1x32x1x8_8_1x1_intrawave_v3,856.18,309.97,0.0
gfx942,304,53376,4608,4096,ck,0,0,2440.1126,a8w8_blockscale_1x128x128_256x128x128x128_16x16_32x32_2x2_8x32x1_8x32x1_1x32x1x8_8_1x1_intrawave_v3,825.73,298.93,0.0
gfx942,304,53504,4608,4096,ck,0,0,2362.9048,a8w8_blockscale_1x128x128_256x128x128x128_16x16_32x32_2x2_8x32x1_8x32x1_1x32x1x8_8_1x1_intrawave_v3,854.76,309.42,0.0
gfx942,304,53632,4608,4096,ck,0,0,2391.9672,a8w8_blockscale_1x128x128_256x128x128x128_16x16_32x32_2x2_8x32x1_8x32x1_1x32x1x8_8_1x1_intrawave_v3,846.39,306.37,0.0
gfx942,304,53760,4608,4096,ck,0,0,2380.2019,a8w8_blockscale_1x128x128_256x128x128x128_16x16_32x32_2x2_8x32x1_8x32x1_1x32x1x8_8_1x1_intrawave_v3,852.61,308.6,0.0
gfx942,304,53888,4608,4096,ck,0,0,2376.8942,a8w8_blockscale_1x128x128_256x128x128x128_16x16_32x32_2x2_8x32x1_8x32x1_1x32x1x8_8_1x1_intrawave_v3,855.82,309.75,0.0
gfx942,304,54016,4608,4096,ck,0,0,2406.7857,a8w8_blockscale_1x128x128_256x128x128x128_16x16_32x32_2x2_8x32x1_8x32x1_1x32x1x8_8_1x1_intrawave_v3,847.2,306.61,0.0
gfx942,304,54144,4608,4096,ck,0,0,2408.4444,a8w8_blockscale_1x128x128_256x128x128x128_16x16_32x32_2x2_8x32x1_8x32x1_1x32x1x8_8_1x1_intrawave_v3,848.63,307.1,0.0
gfx942,304,54272,4608,4096,ck,0,0,2388.6861,a8w8_blockscale_1x128x128_256x128x128x128_16x16_32x32_2x2_8x32x1_8x32x1_1x32x1x8_8_1x1_intrawave_v3,857.67,310.36,0.0
gfx942,304,54400,4608,4096,ck,0,0,2443.3806,a8w8_blockscale_1x128x128_256x128x128x128_16x16_32x32_2x2_8x32x1_8x32x1_1x32x1x8_8_1x1_intrawave_v3,840.45,304.11,0.0
gfx942,304,54528,4608,4096,ck,0,0,2415.1347,a8w8_blockscale_1x128x128_256x128x128x128_16x16_32x32_2x2_8x32x1_8x32x1_1x32x1x8_8_1x1_intrawave_v3,852.28,308.37,0.0
gfx942,304,54656,4608,4096,ck,0,0,2436.1809,a8w8_blockscale_1x128x128_256x128x128x128_16x16_32x32_2x2_8x32x1_8x32x1_1x32x1x8_8_1x1_intrawave_v3,846.9,306.4,0.0
gfx942,304,54784,4608,4096,ck,0,0,2418.3608,a8w8_blockscale_1x128x128_256x128x128x128_16x16_32x32_2x2_8x32x1_8x32x1_1x32x1x8_8_1x1_intrawave_v3,855.14,309.37,0.0
gfx942,304,54912,4608,4096,ck,0,0,2512.0506,a8w8_blockscale_1x128x128_256x128x128x128_16x16_32x32_2x2_8x32x1_8x32x1_1x32x1x8_8_1x1_intrawave_v3,825.17,298.51,0.0
gfx942,304,55040,4608,4096,ck,0,0,2422.4384,a8w8_blockscale_1x128x128_256x128x128x128_16x16_32x32_2x2_8x32x1_8x32x1_1x32x1x8_8_1x1_intrawave_v3,857.69,310.25,0.0
gfx942,304,55168,4608,4096,ck,0,0,2432.5832,a8w8_blockscale_1x128x128_256x128x128x128_16x16_32x32_2x2_8x32x1_8x32x1_1x32x1x8_8_1x1_intrawave_v3,856.09,309.66,0.0
gfx942,304,55296,4608,4096,ck,0,0,2481.4528,a8w8_blockscale_1x128x128_256x128x128x128_16x16_32x32_2x2_8x32x1_8x32x1_1x32x1x8_8_1x1_intrawave_v3,841.18,304.25,0.0
gfx942,304,55424,4608,4096,ck,0,0,2540.7035,a8w8_blockscale_1x128x128_256x128x128x128_16x16_32x32_2x2_8x32x1_8x32x1_1x32x1x8_8_1x1_intrawave_v3,823.47,297.82,0.0
gfx942,304,55552,4608,4096,ck,0,0,2448.7883,a8w8_blockscale_1x128x128_256x128x128x128_16x16_32x32_2x2_8x32x1_8x32x1_1x32x1x8_8_1x1_intrawave_v3,856.35,309.7,0.0
gfx942,304,55680,4608,4096,ck,0,0,2510.8711,a8w8_blockscale_1x128x128_256x128x128x128_16x16_32x32_2x2_8x32x1_8x32x1_1x32x1x8_8_1x1_intrawave_v3,837.1,302.72,0.0
gfx942,304,55808,4608,4096,ck,0,0,2459.5186,a8w8_blockscale_1x128x128_256x128x128x128_16x16_32x32_2x2_8x32x1_8x32x1_1x32x1x8_8_1x1_intrawave_v3,856.54,309.73,0.0
gfx942,304,55936,4608,4096,ck,0,0,2511.0447,a8w8_blockscale_1x128x128_256x128x128x128_16x16_32x32_2x2_8x32x1_8x32x1_1x32x1x8_8_1x1_intrawave_v3,840.89,304.05,0.0
gfx942,304,56064,4608,4096,ck,0,0,2561.5748,a8w8_blockscale_1x128x128_256x128x128x128_16x16_32x32_2x2_8x32x1_8x32x1_1x32x1x8_8_1x1_intrawave_v3,826.19,298.72,0.0
gfx942,304,56192,4608,4096,ck,0,0,2503.8954,a8w8_blockscale_1x128x128_256x128x128x128_16x16_32x32_2x2_8x32x1_8x32x1_1x32x1x8_8_1x1_intrawave_v3,847.15,306.28,0.0
gfx942,304,56320,4608,4096,ck,0,0,2495.1358,a8w8_blockscale_1x128x128_256x128x128x128_16x16_32x32_2x2_8x32x1_8x32x1_1x32x1x8_8_1x1_intrawave_v3,852.06,308.04,0.0
gfx942,304,56448,4608,4096,ck,0,0,2506.2744,a8w8_blockscale_1x128x128_256x128x128x128_16x16_32x32_2x2_8x32x1_8x32x1_1x32x1x8_8_1x1_intrawave_v3,850.2,307.35,0.0
gfx942,304,56576,4608,4096,ck,0,0,2488.1444,a8w8_blockscale_1x128x128_256x128x128x128_16x16_32x32_2x2_8x32x1_8x32x1_1x32x1x8_8_1x1_intrawave_v3,858.34,310.28,0.0
gfx942,304,56704,4608,4096,ck,0,0,2553.1488,a8w8_blockscale_1x128x128_256x128x128x128_16x16_32x32_2x2_8x32x1_8x32x1_1x32x1x8_8_1x1_intrawave_v3,838.38,303.04,0.0
gfx942,304,56832,4608,4096,ck,0,0,2493.9339,a8w8_blockscale_1x128x128_256x128x128x128_16x16_32x32_2x2_8x32x1_8x32x1_1x32x1x8_8_1x1_intrawave_v3,860.22,310.92,0.0
gfx942,304,56960,4608,4096,ck,0,0,2477.2965,a8w8_blockscale_1x128x128_256x128x128x128_16x16_32x32_2x2_8x32x1_8x32x1_1x32x1x8_8_1x1_intrawave_v3,867.95,313.7,0.0
gfx942,304,57088,4608,4096,ck,0,0,2494.5998,a8w8_blockscale_1x128x128_256x128x128x128_16x16_32x32_2x2_8x32x1_8x32x1_1x32x1x8_8_1x1_intrawave_v3,863.87,312.21,0.0
gfx942,304,57216,4608,4096,ck,0,0,2501.4698,a8w8_blockscale_1x128x128_256x128x128x128_16x16_32x32_2x2_8x32x1_8x32x1_1x32x1x8_8_1x1_intrawave_v3,863.43,312.03,0.0
gfx942,304,57344,4608,4096,ck,0,0,2533.8732,a8w8_blockscale_1x128x128_256x128x128x128_16x16_32x32_2x2_8x32x1_8x32x1_1x32x1x8_8_1x1_intrawave_v3,854.29,308.71,0.0
gfx942,304,57472,4608,4096,ck,0,0,2556.3741,a8w8_blockscale_1x128x128_256x128x128x128_16x16_32x32_2x2_8x32x1_8x32x1_1x32x1x8_8_1x1_intrawave_v3,848.66,306.66,0.0
gfx942,304,57600,4608,4096,ck,0,0,2522.559,a8w8_blockscale_1x128x128_256x128x128x128_16x16_32x32_2x2_8x32x1_8x32x1_1x32x1x8_8_1x1_intrawave_v3,861.95,311.45,0.0
gfx942,304,57728,4608,4096,ck,0,0,2532.4921,a8w8_blockscale_1x128x128_256x128x128x128_16x16_32x32_2x2_8x32x1_8x32x1_1x32x1x8_8_1x1_intrawave_v3,860.48,310.9,0.0
gfx942,304,57856,4608,4096,ck,0,0,2525.678,a8w8_blockscale_1x128x128_256x128x128x128_16x16_32x32_2x2_8x32x1_8x32x1_1x32x1x8_8_1x1_intrawave_v3,864.71,312.41,0.0
gfx942,304,57984,4608,4096,ck,0,0,2539.821,a8w8_blockscale_1x128x128_256x128x128x128_16x16_32x32_2x2_8x32x1_8x32x1_1x32x1x8_8_1x1_intrawave_v3,861.8,311.34,0.0
gfx942,304,58112,4608,4096,ck,0,0,2543.2896,a8w8_blockscale_1x128x128_256x128x128x128_16x16_32x32_2x2_8x32x1_8x32x1_1x32x1x8_8_1x1_intrawave_v3,862.53,311.59,0.0
gfx942,304,58240,4608,4096,ck,0,0,2547.9207,a8w8_blockscale_1x128x128_256x128x128x128_16x16_32x32_2x2_8x32x1_8x32x1_1x32x1x8_8_1x1_intrawave_v3,862.86,311.69,0.0
gfx942,304,58368,4608,4096,ck,0,0,2556.6533,a8w8_blockscale_1x128x128_256x128x128x128_16x16_32x32_2x2_8x32x1_8x32x1_1x32x1x8_8_1x1_intrawave_v3,861.8,311.29,0.0
gfx942,304,58496,4608,4096,ck,0,0,2624.2775,a8w8_blockscale_1x128x128_256x128x128x128_16x16_32x32_2x2_8x32x1_8x32x1_1x32x1x8_8_1x1_intrawave_v3,841.43,303.92,0.0
gfx942,304,58624,4608,4096,ck,0,0,2604.9413,a8w8_blockscale_1x128x128_256x128x128x128_16x16_32x32_2x2_8x32x1_8x32x1_1x32x1x8_8_1x1_intrawave_v3,849.53,306.83,0.0
gfx942,304,58752,4608,4096,ck,0,0,2610.532,a8w8_blockscale_1x128x128_256x128x128x128_16x16_32x32_2x2_8x32x1_8x32x1_1x32x1x8_8_1x1_intrawave_v3,849.56,306.83,0.0
gfx942,304,58880,4608,4096,ck,0,0,2625.7313,a8w8_blockscale_1x128x128_256x128x128x128_16x16_32x32_2x2_8x32x1_8x32x1_1x32x1x8_8_1x1_intrawave_v3,846.49,305.7,0.0
gfx942,304,59008,4608,4096,ck,0,0,2604.6752,a8w8_blockscale_1x128x128_256x128x128x128_16x16_32x32_2x2_8x32x1_8x32x1_1x32x1x8_8_1x1_intrawave_v3,855.18,308.83,0.0
gfx942,304,59136,4608,4096,ck,0,0,2602.1032,a8w8_blockscale_1x128x128_256x128x128x128_16x16_32x32_2x2_8x32x1_8x32x1_1x32x1x8_8_1x1_intrawave_v3,857.89,309.79,0.0
gfx942,304,59264,4608,4096,ck,0,0,2603.8871,a8w8_blockscale_1x128x128_256x128x128x128_16x16_32x32_2x2_8x32x1_8x32x1_1x32x1x8_8_1x1_intrawave_v3,859.15,310.23,0.0
gfx942,304,59392,4608,4096,ck,0,0,2604.3182,a8w8_blockscale_1x128x128_256x128x128x128_16x16_32x32_2x2_8x32x1_8x32x1_1x32x1x8_8_1x1_intrawave_v3,860.87,310.83,0.0
gfx942,304,59520,4608,4096,ck,0,0,2620.0862,a8w8_blockscale_1x128x128_256x128x128x128_16x16_32x32_2x2_8x32x1_8x32x1_1x32x1x8_8_1x1_intrawave_v3,857.53,309.61,0.0
gfx942,304,59648,4608,4096,ck,0,0,2718.8085,a8w8_blockscale_1x128x128_256x128x128x128_16x16_32x32_2x2_8x32x1_8x32x1_1x32x1x8_8_1x1_intrawave_v3,828.17,298.99,0.0
gfx942,304,59776,4608,4096,ck,0,0,2728.0973,a8w8_blockscale_1x128x128_256x128x128x128_16x16_32x32_2x2_8x32x1_8x32x1_1x32x1x8_8_1x1_intrawave_v3,827.12,298.6,0.0
gfx942,304,59904,4608,4096,ck,0,0,2641.4536,a8w8_blockscale_1x128x128_256x128x128x128_16x16_32x32_2x2_8x32x1_8x32x1_1x32x1x8_8_1x1_intrawave_v3,856.08,309.04,0.0
gfx942,304,60032,4608,4096,ck,0,0,2663.4756,a8w8_blockscale_1x128x128_256x128x128x128_16x16_32x32_2x2_8x32x1_8x32x1_1x32x1x8_8_1x1_intrawave_v3,850.82,307.13,0.0
gfx942,304,60160,4608,4096,ck,0,0,2639.7498,a8w8_blockscale_1x128x128_256x128x128x128_16x16_32x32_2x2_8x32x1_8x32x1_1x32x1x8_8_1x1_intrawave_v3,860.3,310.53,0.0
gfx942,304,60288,4608,4096,ck,0,0,2645.3846,a8w8_blockscale_1x128x128_256x128x128x128_16x16_32x32_2x2_8x32x1_8x32x1_1x32x1x8_8_1x1_intrawave_v3,860.29,310.51,0.0
gfx942,304,60416,4608,4096,ck,0,0,2698.9053,a8w8_blockscale_1x128x128_256x128x128x128_16x16_32x32_2x2_8x32x1_8x32x1_1x32x1x8_8_1x1_intrawave_v3,845.02,304.99,0.0
gfx942,304,60544,4608,4096,ck,0,0,2717.7204,a8w8_blockscale_1x128x128_256x128x128x128_16x16_32x32_2x2_8x32x1_8x32x1_1x32x1x8_8_1x1_intrawave_v3,840.95,303.5,0.0
gfx942,304,60672,4608,4096,ck,0,0,2667.8821,a8w8_blockscale_1x128x128_256x128x128x128_16x16_32x32_2x2_8x32x1_8x32x1_1x32x1x8_8_1x1_intrawave_v3,858.47,309.81,0.0
gfx942,304,60800,4608,4096,ck,0,0,2709.1664,a8w8_blockscale_1x128x128_256x128x128x128_16x16_32x32_2x2_8x32x1_8x32x1_1x32x1x8_8_1x1_intrawave_v3,847.17,305.72,0.0
gfx942,304,60928,4608,4096,ck,0,0,2702.8442,a8w8_blockscale_1x128x128_256x128x128x128_16x16_32x32_2x2_8x32x1_8x32x1_1x32x1x8_8_1x1_intrawave_v3,850.94,307.06,0.0
gfx942,304,61056,4608,4096,ck,0,0,2773.4822,a8w8_blockscale_1x128x128_256x128x128x128_16x16_32x32_2x2_8x32x1_8x32x1_1x32x1x8_8_1x1_intrawave_v3,831.01,299.86,0.0
gfx942,304,61184,4608,4096,ck,0,0,2718.5079,a8w8_blockscale_1x128x128_256x128x128x128_16x16_32x32_2x2_8x32x1_8x32x1_1x32x1x8_8_1x1_intrawave_v3,849.59,306.55,0.0
gfx942,304,61312,4608,4096,ck,0,0,2738.7708,a8w8_blockscale_1x128x128_256x128x128x128_16x16_32x32_2x2_8x32x1_8x32x1_1x32x1x8_8_1x1_intrawave_v3,845.07,304.9,0.0
gfx942,304,61440,4608,4096,ck,0,0,2690.3036,a8w8_blockscale_1x128x128_256x128x128x128_16x16_32x32_2x2_8x32x1_8x32x1_1x32x1x8_8_1x1_intrawave_v3,862.09,311.03,0.0
gfx942,304,61568,4608,4096,ck,0,0,2784.6465,a8w8_blockscale_1x128x128_256x128x128x128_16x16_32x32_2x2_8x32x1_8x32x1_1x32x1x8_8_1x1_intrawave_v3,834.62,301.1,0.0
gfx942,304,61696,4608,4096,ck,0,0,2717.9802,a8w8_blockscale_1x128x128_256x128x128x128_16x16_32x32_2x2_8x32x1_8x32x1_1x32x1x8_8_1x1_intrawave_v3,856.87,309.12,0.0
gfx942,304,61824,4608,4096,ck,0,0,2723.4251,a8w8_blockscale_1x128x128_256x128x128x128_16x16_32x32_2x2_8x32x1_8x32x1_1x32x1x8_8_1x1_intrawave_v3,856.93,309.12,0.0
gfx942,304,61952,4608,4096,ck,0,0,2754.2495,a8w8_blockscale_1x128x128_256x128x128x128_16x16_32x32_2x2_8x32x1_8x32x1_1x32x1x8_8_1x1_intrawave_v3,849.09,306.28,0.0
gfx942,304,62080,4608,4096,ck,0,0,2798.123,a8w8_blockscale_1x128x128_256x128x128x128_16x16_32x32_2x2_8x32x1_8x32x1_1x32x1x8_8_1x1_intrawave_v3,837.5,302.09,0.0
gfx942,304,62208,4608,4096,ck,0,0,2843.2027,a8w8_blockscale_1x128x128_256x128x128x128_16x16_32x32_2x2_8x32x1_8x32x1_1x32x1x8_8_1x1_intrawave_v3,825.93,297.9,0.0
gfx942,304,62336,4608,4096,ck,0,0,2740.0698,a8w8_blockscale_1x128x128_256x128x128x128_16x16_32x32_2x2_8x32x1_8x32x1_1x32x1x8_8_1x1_intrawave_v3,858.78,309.73,0.0
gfx942,304,62464,4608,4096,ck,0,0,2738.5064,a8w8_blockscale_1x128x128_256x128x128x128_16x16_32x32_2x2_8x32x1_8x32x1_1x32x1x8_8_1x1_intrawave_v3,861.03,310.53,0.0
gfx942,304,62592,4608,4096,ck,0,0,2816.4107,a8w8_blockscale_1x128x128_256x128x128x128_16x16_32x32_2x2_8x32x1_8x32x1_1x32x1x8_8_1x1_intrawave_v3,838.93,302.55,0.0
gfx942,304,62720,4608,4096,ck,0,0,2864.9455,a8w8_blockscale_1x128x128_256x128x128x128_16x16_32x32_2x2_8x32x1_8x32x1_1x32x1x8_8_1x1_intrawave_v3,826.4,298.02,0.0
gfx942,304,62848,4608,4096,ck,0,0,2760.8434,a8w8_blockscale_1x128x128_256x128x128x128_16x16_32x32_2x2_8x32x1_8x32x1_1x32x1x8_8_1x1_intrawave_v3,859.31,309.87,0.0
gfx942,304,62976,4608,4096,ck,0,0,2857.1237,a8w8_blockscale_1x128x128_256x128x128x128_16x16_32x32_2x2_8x32x1_8x32x1_1x32x1x8_8_1x1_intrawave_v3,832.05,300.03,0.0
gfx942,304,63104,4608,4096,ck,0,0,2812.5394,a8w8_blockscale_1x128x128_256x128x128x128_16x16_32x32_2x2_8x32x1_8x32x1_1x32x1x8_8_1x1_intrawave_v3,846.96,305.39,0.0
gfx942,304,63232,4608,4096,ck,0,0,2802.0301,a8w8_blockscale_1x128x128_256x128x128x128_16x16_32x32_2x2_8x32x1_8x32x1_1x32x1x8_8_1x1_intrawave_v3,851.86,307.14,0.0
gfx942,304,63360,4608,4096,ck,0,0,2819.2874,a8w8_blockscale_1x128x128_256x128x128x128_16x16_32x32_2x2_8x32x1_8x32x1_1x32x1x8_8_1x1_intrawave_v3,848.36,305.87,0.0
gfx942,304,63488,4608,4096,ck,0,0,2781.9052,a8w8_blockscale_1x128x128_256x128x128x128_16x16_32x32_2x2_8x32x1_8x32x1_1x32x1x8_8_1x1_intrawave_v3,861.49,310.59,0.0
gfx942,304,63616,4608,4096,ck,0,0,2840.8981,a8w8_blockscale_1x128x128_256x128x128x128_16x16_32x32_2x2_8x32x1_8x32x1_1x32x1x8_8_1x1_intrawave_v3,845.3,304.74,0.0
gfx942,304,63744,4608,4096,ck,0,0,2855.2447,a8w8_blockscale_1x128x128_256x128x128x128_16x16_32x32_2x2_8x32x1_8x32x1_1x32x1x8_8_1x1_intrawave_v3,842.75,303.8,0.0
gfx942,304,63872,4608,4096,ck,0,0,2812.1127,a8w8_blockscale_1x128x128_256x128x128x128_16x16_32x32_2x2_8x32x1_8x32x1_1x32x1x8_8_1x1_intrawave_v3,857.39,309.07,0.0
gfx942,304,64000,4608,4096,ck,0,0,2817.4114,a8w8_blockscale_1x128x128_256x128x128x128_16x16_32x32_2x2_8x32x1_8x32x1_1x32x1x8_8_1x1_intrawave_v3,857.5,309.09,0.0
gfx942,304,64128,4608,4096,ck,0,0,2822.0536,a8w8_blockscale_1x128x128_256x128x128x128_16x16_32x32_2x2_8x32x1_8x32x1_1x32x1x8_8_1x1_intrawave_v3,857.8,309.19,0.0
gfx942,304,64256,4608,4096,ck,0,0,2942.7781,a8w8_blockscale_1x128x128_256x128x128x128_16x16_32x32_2x2_8x32x1_8x32x1_1x32x1x8_8_1x1_intrawave_v3,824.25,297.08,0.0
gfx942,304,64384,4608,4096,ck,0,0,2862.6612,a8w8_blockscale_1x128x128_256x128x128x128_16x16_32x32_2x2_8x32x1_8x32x1_1x32x1x8_8_1x1_intrawave_v3,849.01,305.99,0.0
gfx942,304,64512,4608,4096,ck,0,0,2845.0871,a8w8_blockscale_1x128x128_256x128x128x128_16x16_32x32_2x2_8x32x1_8x32x1_1x32x1x8_8_1x1_intrawave_v3,855.95,308.48,0.0
gfx942,304,64640,4608,4096,ck,0,0,2876.1904,a8w8_blockscale_1x128x128_256x128x128x128_16x16_32x32_2x2_8x32x1_8x32x1_1x32x1x8_8_1x1_intrawave_v3,848.37,305.74,0.0
gfx942,304,64768,4608,4096,ck,0,0,2915.3601,a8w8_blockscale_1x128x128_256x128x128x128_16x16_32x32_2x2_8x32x1_8x32x1_1x32x1x8_8_1x1_intrawave_v3,838.63,302.22,0.0
gfx942,304,64896,4608,4096,ck,0,0,2923.6824,a8w8_blockscale_1x128x128_256x128x128x128_16x16_32x32_2x2_8x32x1_8x32x1_1x32x1x8_8_1x1_intrawave_v3,837.9,301.94,0.0
gfx942,304,65024,4608,4096,ck,0,0,2863.9468,a8w8_blockscale_1x128x128_256x128x128x128_16x16_32x32_2x2_8x32x1_8x32x1_1x32x1x8_8_1x1_intrawave_v3,857.06,308.83,0.0
gfx942,304,65152,4608,4096,ck,0,0,2870.6534,a8w8_blockscale_1x128x128_256x128x128x128_16x16_32x32_2x2_8x32x1_8x32x1_1x32x1x8_8_1x1_intrawave_v3,856.74,308.7,0.0
gfx942,304,65280,4608,4096,ck,0,0,2855.7909,a8w8_blockscale_1x128x128_256x128x128x128_16x16_32x32_2x2_8x32x1_8x32x1_1x32x1x8_8_1x1_intrawave_v3,862.89,310.91,0.0
gfx942,304,65408,4608,4096,ck,0,0,2879.3542,a8w8_blockscale_1x128x128_256x128x128x128_16x16_32x32_2x2_8x32x1_8x32x1_1x32x1x8_8_1x1_intrawave_v3,857.51,308.95,0.0
gfx942,304,65536,4608,4096,ck,0,0,2884.9767,a8w8_blockscale_1x128x128_256x128x128x128_16x16_32x32_2x2_8x32x1_8x32x1_1x32x1x8_8_1x1_intrawave_v3,857.51,308.94,0.0
gfx942,304,65664,4608,4096,ck,0,0,2899.5223,a8w8_blockscale_1x128x128_256x128x128x128_16x16_32x32_2x2_8x32x1_8x32x1_1x32x1x8_8_1x1_intrawave_v3,854.88,307.98,0.0
gfx942,304,65792,4608,4096,ck,0,0,2972.3749,a8w8_blockscale_1x128x128_256x128x128x128_16x16_32x32_2x2_8x32x1_8x32x1_1x32x1x8_8_1x1_intrawave_v3,835.55,301.0,0.0
gfx942,304,65920,4608,4096,ck,0,0,2911.3691,a8w8_blockscale_1x128x128_256x128x128x128_16x16_32x32_2x2_8x32x1_8x32x1_1x32x1x8_8_1x1_intrawave_v3,854.72,307.9,0.0
gfx942,304,66048,4608,4096,ck,0,0,2909.2597,a8w8_blockscale_1x128x128_256x128x128x128_16x16_32x32_2x2_8x32x1_8x32x1_1x32x1x8_8_1x1_intrawave_v3,857.0,308.71,0.0
gfx942,304,66176,4608,4096,ck,0,0,2927.3331,a8w8_blockscale_1x128x128_256x128x128x128_16x16_32x32_2x2_8x32x1_8x32x1_1x32x1x8_8_1x1_intrawave_v3,853.36,307.38,0.0
gfx942,304,66304,4608,4096,ck,0,0,2960.62,a8w8_blockscale_1x128x128_256x128x128x128_16x16_32x32_2x2_8x32x1_8x32x1_1x32x1x8_8_1x1_intrawave_v3,845.39,304.5,0.0
gfx942,304,66432,4608,4096,ck,0,0,2976.1656,a8w8_blockscale_1x128x128_256x128x128x128_16x16_32x32_2x2_8x32x1_8x32x1_1x32x1x8_8_1x1_intrawave_v3,842.6,303.48,0.0
gfx942,304,66560,4608,4096,ck,0,0,2989.5639,a8w8_blockscale_1x128x128_256x128x128x128_16x16_32x32_2x2_8x32x1_8x32x1_1x32x1x8_8_1x1_intrawave_v3,840.44,302.69,0.0
gfx942,304,66688,4608,4096,ck,0,0,2976.2206,a8w8_blockscale_1x128x128_256x128x128x128_16x16_32x32_2x2_8x32x1_8x32x1_1x32x1x8_8_1x1_intrawave_v3,845.83,304.62,0.0
gfx942,304,66816,4608,4096,ck,0,0,2976.2999,a8w8_blockscale_1x128x128_256x128x128x128_16x16_32x32_2x2_8x32x1_8x32x1_1x32x1x8_8_1x1_intrawave_v3,847.43,305.19,0.0
gfx942,304,66944,4608,4096,ck,0,0,2989.2341,a8w8_blockscale_1x128x128_256x128x128x128_16x16_32x32_2x2_8x32x1_8x32x1_1x32x1x8_8_1x1_intrawave_v3,845.38,304.44,0.0
gfx942,304,67072,4608,4096,ck,0,0,2946.1411,a8w8_blockscale_1x128x128_256x128x128x128_16x16_32x32_2x2_8x32x1_8x32x1_1x32x1x8_8_1x1_intrawave_v3,859.39,309.47,0.0
gfx942,304,67200,4608,4096,ck,0,0,3013.7389,a8w8_blockscale_1x128x128_256x128x128x128_16x16_32x32_2x2_8x32x1_8x32x1_1x32x1x8_8_1x1_intrawave_v3,841.72,303.09,0.0
gfx942,304,67328,4608,4096,ck,0,0,3073.3009,a8w8_blockscale_1x128x128_256x128x128x128_16x16_32x32_2x2_8x32x1_8x32x1_1x32x1x8_8_1x1_intrawave_v3,826.98,297.77,0.0
gfx942,304,67456,4608,4096,ck,0,0,3023.0942,a8w8_blockscale_1x128x128_256x128x128x128_16x16_32x32_2x2_8x32x1_8x32x1_1x32x1x8_8_1x1_intrawave_v3,842.31,303.28,0.0
gfx942,304,67584,4608,4096,ck,0,0,2965.135,a8w8_blockscale_1x128x128_256x128x128x128_16x16_32x32_2x2_8x32x1_8x32x1_1x32x1x8_8_1x1_intrawave_v3,860.4,309.78,0.0
gfx942,304,67712,4608,4096,ck,0,0,3055.4375,a8w8_blockscale_1x128x128_256x128x128x128_16x16_32x32_2x2_8x32x1_8x32x1_1x32x1x8_8_1x1_intrawave_v3,836.56,301.19,0.0
gfx942,304,67840,4608,4096,ck,0,0,2971.4942,a8w8_blockscale_1x128x128_256x128x128x128_16x16_32x32_2x2_8x32x1_8x32x1_1x32x1x8_8_1x1_intrawave_v3,861.81,310.27,0.0
gfx942,304,67968,4608,4096,ck,0,0,3029.394,a8w8_blockscale_1x128x128_256x128x128x128_16x16_32x32_2x2_8x32x1_8x32x1_1x32x1x8_8_1x1_intrawave_v3,846.94,304.9,0.0
gfx942,304,68096,4608,4096,ck,0,0,3032.9275,a8w8_blockscale_1x128x128_256x128x128x128_16x16_32x32_2x2_8x32x1_8x32x1_1x32x1x8_8_1x1_intrawave_v3,847.54,305.11,0.0
gfx942,304,68224,4608,4096,ck,0,0,3047.635,a8w8_blockscale_1x128x128_256x128x128x128_16x16_32x32_2x2_8x32x1_8x32x1_1x32x1x8_8_1x1_intrawave_v3,845.04,304.19,0.0
gfx942,304,68352,4608,4096,ck,0,0,3118.6873,a8w8_blockscale_1x128x128_256x128x128x128_16x16_32x32_2x2_8x32x1_8x32x1_1x32x1x8_8_1x1_intrawave_v3,827.34,297.81,0.0
gfx942,304,68480,4608,4096,ck,0,0,3047.9125,a8w8_blockscale_1x128x128_256x128x128x128_16x16_32x32_2x2_8x32x1_8x32x1_1x32x1x8_8_1x1_intrawave_v3,848.13,305.28,0.0
gfx942,304,68608,4608,4096,ck,0,0,3079.1497,a8w8_blockscale_1x128x128_256x128x128x128_16x16_32x32_2x2_8x32x1_8x32x1_1x32x1x8_8_1x1_intrawave_v3,841.1,302.74,0.0
gfx942,304,68736,4608,4096,ck,0,0,3029.9543,a8w8_blockscale_1x128x128_256x128x128x128_16x16_32x32_2x2_8x32x1_8x32x1_1x32x1x8_8_1x1_intrawave_v3,856.35,308.22,0.0
gfx942,304,68864,4608,4096,ck,0,0,3106.3293,a8w8_blockscale_1x128x128_256x128x128x128_16x16_32x32_2x2_8x32x1_8x32x1_1x32x1x8_8_1x1_intrawave_v3,836.85,301.19,0.0
gfx942,304,68992,4608,4096,ck,0,0,3092.5405,a8w8_blockscale_1x128x128_256x128x128x128_16x16_32x32_2x2_8x32x1_8x32x1_1x32x1x8_8_1x1_intrawave_v3,842.14,303.08,0.0
gfx942,304,69120,4608,4096,ck,0,0,3087.7862,a8w8_blockscale_1x128x128_256x128x128x128_16x16_32x32_2x2_8x32x1_8x32x1_1x32x1x8_8_1x1_intrawave_v3,845.0,304.1,0.0
gfx942,304,69248,4608,4096,ck,0,0,3103.7632,a8w8_blockscale_1x128x128_256x128x128x128_16x16_32x32_2x2_8x32x1_8x32x1_1x32x1x8_8_1x1_intrawave_v3,842.21,303.08,0.0
gfx942,304,69376,4608,4096,ck,0,0,3107.5621,a8w8_blockscale_1x128x128_256x128x128x128_16x16_32x32_2x2_8x32x1_8x32x1_1x32x1x8_8_1x1_intrawave_v3,842.74,303.26,0.0
gfx942,304,69504,4608,4096,ck,0,0,3124.9608,a8w8_blockscale_1x128x128_256x128x128x128_16x16_32x32_2x2_8x32x1_8x32x1_1x32x1x8_8_1x1_intrawave_v3,839.59,302.12,0.0
gfx942,304,69632,4608,4096,ck,0,0,3056.5692,a8w8_blockscale_1x128x128_256x128x128x128_16x16_32x32_2x2_8x32x1_8x32x1_1x32x1x8_8_1x1_intrawave_v3,859.96,309.44,0.0
gfx942,304,69760,4608,4096,ck,0,0,3061.91,a8w8_blockscale_1x128x128_256x128x128x128_16x16_32x32_2x2_8x32x1_8x32x1_1x32x1x8_8_1x1_intrawave_v3,860.04,309.45,0.0
gfx942,304,69888,4608,4096,ck,0,0,3103.4991,a8w8_blockscale_1x128x128_256x128x128x128_16x16_32x32_2x2_8x32x1_8x32x1_1x32x1x8_8_1x1_intrawave_v3,850.07,305.86,0.0
gfx942,304,70016,4608,4096,ck,0,0,3110.0401,a8w8_blockscale_1x128x128_256x128x128x128_16x16_32x32_2x2_8x32x1_8x32x1_1x32x1x8_8_1x1_intrawave_v3,849.83,305.76,0.0
gfx942,304,70144,4608,4096,ck,0,0,3064.9361,a8w8_blockscale_1x128x128_256x128x128x128_16x16_32x32_2x2_8x32x1_8x32x1_1x32x1x8_8_1x1_intrawave_v3,863.92,310.82,0.0
gfx942,304,70272,4608,4096,ck,0,0,3077.1674,a8w8_blockscale_1x128x128_256x128x128x128_16x16_32x32_2x2_8x32x1_8x32x1_1x32x1x8_8_1x1_intrawave_v3,862.05,310.13,0.0
gfx942,304,70400,4608,4096,ck,0,0,3120.0455,a8w8_blockscale_1x128x128_256x128x128x128_16x16_32x32_2x2_8x32x1_8x32x1_1x32x1x8_8_1x1_intrawave_v3,851.75,306.42,0.0
gfx942,304,70528,4608,4096,ck,0,0,3087.6855,a8w8_blockscale_1x128x128_256x128x128x128_16x16_32x32_2x2_8x32x1_8x32x1_1x32x1x8_8_1x1_intrawave_v3,862.25,310.18,0.0
gfx942,304,70656,4608,4096,ck,0,0,3092.3379,a8w8_blockscale_1x128x128_256x128x128x128_16x16_32x32_2x2_8x32x1_8x32x1_1x32x1x8_8_1x1_intrawave_v3,862.51,310.27,0.0
gfx942,304,70784,4608,4096,ck,0,0,3149.7939,a8w8_blockscale_1x128x128_256x128x128x128_16x16_32x32_2x2_8x32x1_8x32x1_1x32x1x8_8_1x1_intrawave_v3,848.31,305.15,0.0
gfx942,304,70912,4608,4096,ck,0,0,3152.4611,a8w8_blockscale_1x128x128_256x128x128x128_16x16_32x32_2x2_8x32x1_8x32x1_1x32x1x8_8_1x1_intrawave_v3,849.13,305.43,0.0
gfx942,304,71040,4608,4096,ck,0,0,3187.6115,a8w8_blockscale_1x128x128_256x128x128x128_16x16_32x32_2x2_8x32x1_8x32x1_1x32x1x8_8_1x1_intrawave_v3,841.28,302.6,0.0
gfx942,304,71168,4608,4096,ck,0,0,3193.6692,a8w8_blockscale_1x128x128_256x128x128x128_16x16_32x32_2x2_8x32x1_8x32x1_1x32x1x8_8_1x1_intrawave_v3,841.2,302.56,0.0
gfx942,304,71296,4608,4096,ck,0,0,3138.0031,a8w8_blockscale_1x128x128_256x128x128x128_16x16_32x32_2x2_8x32x1_8x32x1_1x32x1x8_8_1x1_intrawave_v3,857.66,308.47,0.0
gfx942,304,71424,4608,4096,ck,0,0,3118.615,a8w8_blockscale_1x128x128_256x128x128x128_16x16_32x32_2x2_8x32x1_8x32x1_1x32x1x8_8_1x1_intrawave_v3,864.54,310.93,0.0
gfx942,304,71552,4608,4096,ck,0,0,3179.0869,a8w8_blockscale_1x128x128_256x128x128x128_16x16_32x32_2x2_8x32x1_8x32x1_1x32x1x8_8_1x1_intrawave_v3,849.61,305.55,0.0
gfx942,304,71680,4608,4096,ck,0,0,3207.3117,a8w8_blockscale_1x128x128_256x128x128x128_16x16_32x32_2x2_8x32x1_8x32x1_1x32x1x8_8_1x1_intrawave_v3,843.64,303.39,0.0
gfx942,304,71808,4608,4096,ck,0,0,3189.042,a8w8_blockscale_1x128x128_256x128x128x128_16x16_32x32_2x2_8x32x1_8x32x1_1x32x1x8_8_1x1_intrawave_v3,849.99,305.67,0.0
gfx942,304,71936,4608,4096,ck,0,0,3198.1541,a8w8_blockscale_1x128x128_256x128x128x128_16x16_32x32_2x2_8x32x1_8x32x1_1x32x1x8_8_1x1_intrawave_v3,849.08,305.33,0.0
gfx942,304,72064,4608,4096,ck,0,0,3208.7631,a8w8_blockscale_1x128x128_256x128x128x128_16x16_32x32_2x2_8x32x1_8x32x1_1x32x1x8_8_1x1_intrawave_v3,847.78,304.85,0.0
gfx942,304,72192,4608,4096,ck,0,0,3224.7971,a8w8_blockscale_1x128x128_256x128x128x128_16x16_32x32_2x2_8x32x1_8x32x1_1x32x1x8_8_1x1_intrawave_v3,845.06,303.86,0.0
gfx942,304,72320,4608,4096,ck,0,0,3239.15,a8w8_blockscale_1x128x128_256x128x128x128_16x16_32x32_2x2_8x32x1_8x32x1_1x32x1x8_8_1x1_intrawave_v3,842.81,303.04,0.0
gfx942,304,72448,4608,4096,ck,0,0,3244.3843,a8w8_blockscale_1x128x128_256x128x128x128_16x16_32x32_2x2_8x32x1_8x32x1_1x32x1x8_8_1x1_intrawave_v3,842.94,303.08,0.0
gfx942,304,72576,4608,4096,ck,0,0,3250.3531,a8w8_blockscale_1x128x128_256x128x128x128_16x16_32x32_2x2_8x32x1_8x32x1_1x32x1x8_8_1x1_intrawave_v3,842.88,303.05,0.0
gfx942,304,72704,4608,4096,ck,0,0,3247.6556,a8w8_blockscale_1x128x128_256x128x128x128_16x16_32x32_2x2_8x32x1_8x32x1_1x32x1x8_8_1x1_intrawave_v3,845.07,303.82,0.0
gfx942,304,72832,4608,4096,ck,0,0,3268.1814,a8w8_blockscale_1x128x128_256x128x128x128_16x16_32x32_2x2_8x32x1_8x32x1_1x32x1x8_8_1x1_intrawave_v3,841.24,302.44,0.0
gfx942,304,72960,4608,4096,ck,0,0,3266.8334,a8w8_blockscale_1x128x128_256x128x128x128_16x16_32x32_2x2_8x32x1_8x32x1_1x32x1x8_8_1x1_intrawave_v3,843.06,303.08,0.0
gfx942,304,73088,4608,4096,ck,0,0,3217.2041,a8w8_blockscale_1x128x128_256x128x128x128_16x16_32x32_2x2_8x32x1_8x32x1_1x32x1x8_8_1x1_intrawave_v3,857.57,308.29,0.0
gfx942,304,73216,4608,4096,ck,0,0,3241.3381,a8w8_blockscale_1x128x128_256x128x128x128_16x16_32x32_2x2_8x32x1_8x32x1_1x32x1x8_8_1x1_intrawave_v3,852.68,306.52,0.0
gfx942,304,73344,4608,4096,ck,0,0,3264.1769,a8w8_blockscale_1x128x128_256x128x128x128_16x16_32x32_2x2_8x32x1_8x32x1_1x32x1x8_8_1x1_intrawave_v3,848.19,304.89,0.0
gfx942,304,73472,4608,4096,ck,0,0,3233.2143,a8w8_blockscale_1x128x128_256x128x128x128_16x16_32x32_2x2_8x32x1_8x32x1_1x32x1x8_8_1x1_intrawave_v3,857.81,308.34,0.0
gfx942,304,73600,4608,4096,ck,0,0,3232.3188,a8w8_blockscale_1x128x128_256x128x128x128_16x16_32x32_2x2_8x32x1_8x32x1_1x32x1x8_8_1x1_intrawave_v3,859.54,308.95,0.0
gfx942,304,73728,4608,4096,ck,0,0,3240.2948,a8w8_blockscale_1x128x128_256x128x128x128_16x16_32x32_2x2_8x32x1_8x32x1_1x32x1x8_8_1x1_intrawave_v3,858.92,308.72,0.0
gfx942,304,73856,4608,4096,ck,0,0,3315.78,a8w8_blockscale_1x128x128_256x128x128x128_16x16_32x32_2x2_8x32x1_8x32x1_1x32x1x8_8_1x1_intrawave_v3,840.82,302.21,0.0
gfx942,304,73984,4608,4096,ck,0,0,3289.872,a8w8_blockscale_1x128x128_256x128x128x128_16x16_32x32_2x2_8x32x1_8x32x1_1x32x1x8_8_1x1_intrawave_v3,848.91,305.1,0.0
gfx942,304,74112,4608,4096,ck,0,0,3300.6463,a8w8_blockscale_1x128x128_256x128x128x128_16x16_32x32_2x2_8x32x1_8x32x1_1x32x1x8_8_1x1_intrawave_v3,847.6,304.62,0.0
gfx942,304,74240,4608,4096,ck,0,0,3344.1148,a8w8_blockscale_1x128x128_256x128x128x128_16x16_32x32_2x2_8x32x1_8x32x1_1x32x1x8_8_1x1_intrawave_v3,838.03,301.17,0.0
gfx942,304,74368,4608,4096,ck,0,0,3367.6984,a8w8_blockscale_1x128x128_256x128x128x128_16x16_32x32_2x2_8x32x1_8x32x1_1x32x1x8_8_1x1_intrawave_v3,833.6,299.57,0.0
gfx942,304,74496,4608,4096,ck,0,0,3330.248,a8w8_blockscale_1x128x128_256x128x128x128_16x16_32x32_2x2_8x32x1_8x32x1_1x32x1x8_8_1x1_intrawave_v3,844.42,303.45,0.0
gfx942,304,74624,4608,4096,ck,0,0,3283.8124,a8w8_blockscale_1x128x128_256x128x128x128_16x16_32x32_2x2_8x32x1_8x32x1_1x32x1x8_8_1x1_intrawave_v3,857.83,308.26,0.0
gfx942,304,74752,4608,4096,ck,0,0,3347.8318,a8w8_blockscale_1x128x128_256x128x128x128_16x16_32x32_2x2_8x32x1_8x32x1_1x32x1x8_8_1x1_intrawave_v3,842.87,302.87,0.0
gfx942,304,74880,4608,4096,ck,0,0,3363.2375,a8w8_blockscale_1x128x128_256x128x128x128_16x16_32x32_2x2_8x32x1_8x32x1_1x32x1x8_8_1x1_intrawave_v3,840.45,301.99,0.0
gfx942,304,75008,4608,4096,ck,0,0,3298.1165,a8w8_blockscale_1x128x128_256x128x128x128_16x16_32x32_2x2_8x32x1_8x32x1_1x32x1x8_8_1x1_intrawave_v3,858.51,308.47,0.0
gfx942,304,75136,4608,4096,ck,0,0,3403.8059,a8w8_blockscale_1x128x128_256x128x128x128_16x16_32x32_2x2_8x32x1_8x32x1_1x32x1x8_8_1x1_intrawave_v3,833.27,299.4,0.0
gfx942,304,75264,4608,4096,ck,0,0,3343.6745,a8w8_blockscale_1x128x128_256x128x128x128_16x16_32x32_2x2_8x32x1_8x32x1_1x32x1x8_8_1x1_intrawave_v3,849.7,305.29,0.0
gfx942,304,75392,4608,4096,ck,0,0,3359.0445,a8w8_blockscale_1x128x128_256x128x128x128_16x16_32x32_2x2_8x32x1_8x32x1_1x32x1x8_8_1x1_intrawave_v3,847.25,304.4,0.0
gfx942,304,75520,4608,4096,ck,0,0,3318.7622,a8w8_blockscale_1x128x128_256x128x128x128_16x16_32x32_2x2_8x32x1_8x32x1_1x32x1x8_8_1x1_intrawave_v3,858.99,308.61,0.0
gfx942,304,75648,4608,4096,ck,0,0,3462.229,a8w8_blockscale_1x128x128_256x128x128x128_16x16_32x32_2x2_8x32x1_8x32x1_1x32x1x8_8_1x1_intrawave_v3,824.79,296.31,0.0
gfx942,304,75776,4608,4096,ck,0,0,3404.2597,a8w8_blockscale_1x128x128_256x128x128x128_16x16_32x32_2x2_8x32x1_8x32x1_1x32x1x8_8_1x1_intrawave_v3,840.26,301.86,0.0
gfx942,304,75904,4608,4096,ck,0,0,3409.1233,a8w8_blockscale_1x128x128_256x128x128x128_16x16_32x32_2x2_8x32x1_8x32x1_1x32x1x8_8_1x1_intrawave_v3,840.47,301.93,0.0
gfx942,304,76032,4608,4096,ck,0,0,3344.6199,a8w8_blockscale_1x128x128_256x128x128x128_16x16_32x32_2x2_8x32x1_8x32x1_1x32x1x8_8_1x1_intrawave_v3,858.13,308.26,0.0
gfx942,304,76160,4608,4096,ck,0,0,3378.7915,a8w8_blockscale_1x128x128_256x128x128x128_16x16_32x32_2x2_8x32x1_8x32x1_1x32x1x8_8_1x1_intrawave_v3,850.88,305.65,0.0
gfx942,304,76288,4608,4096,ck,0,0,3354.8836,a8w8_blockscale_1x128x128_256x128x128x128_16x16_32x32_2x2_8x32x1_8x32x1_1x32x1x8_8_1x1_intrawave_v3,858.38,308.33,0.0
gfx942,304,76416,4608,4096,ck,0,0,3363.4623,a8w8_blockscale_1x128x128_256x128x128x128_16x16_32x32_2x2_8x32x1_8x32x1_1x32x1x8_8_1x1_intrawave_v3,857.63,308.05,0.0
gfx942,304,76544,4608,4096,ck,0,0,3378.3446,a8w8_blockscale_1x128x128_256x128x128x128_16x16_32x32_2x2_8x32x1_8x32x1_1x32x1x8_8_1x1_intrawave_v3,855.28,307.2,0.0
gfx942,304,76672,4608,4096,ck,0,0,3372.2478,a8w8_blockscale_1x128x128_256x128x128x128_16x16_32x32_2x2_8x32x1_8x32x1_1x32x1x8_8_1x1_intrawave_v3,858.26,308.26,0.0
gfx942,304,76800,4608,4096,ck,0,0,3510.7306,a8w8_blockscale_1x128x128_256x128x128x128_16x16_32x32_2x2_8x32x1_8x32x1_1x32x1x8_8_1x1_intrawave_v3,825.78,296.59,0.0
gfx942,304,76928,4608,4096,ck,0,0,3381.3664,a8w8_blockscale_1x128x128_256x128x128x128_16x16_32x32_2x2_8x32x1_8x32x1_1x32x1x8_8_1x1_intrawave_v3,858.81,308.44,0.0
gfx942,304,77056,4608,4096,ck,0,0,3383.4152,a8w8_blockscale_1x128x128_256x128x128x128_16x16_32x32_2x2_8x32x1_8x32x1_1x32x1x8_8_1x1_intrawave_v3,859.71,308.75,0.0
gfx942,304,77184,4608,4096,ck,0,0,3412.1169,a8w8_blockscale_1x128x128_256x128x128x128_16x16_32x32_2x2_8x32x1_8x32x1_1x32x1x8_8_1x1_intrawave_v3,853.9,306.66,0.0
gfx942,304,77312,4608,4096,ck,0,0,3392.2553,a8w8_blockscale_1x128x128_256x128x128x128_16x16_32x32_2x2_8x32x1_8x32x1_1x32x1x8_8_1x1_intrawave_v3,860.32,308.95,0.0
gfx942,304,77440,4608,4096,ck,0,0,3410.6426,a8w8_blockscale_1x128x128_256x128x128x128_16x16_32x32_2x2_8x32x1_8x32x1_1x32x1x8_8_1x1_intrawave_v3,857.1,307.79,0.0
gfx942,304,77568,4608,4096,ck,0,0,3403.5029,a8w8_blockscale_1x128x128_256x128x128x128_16x16_32x32_2x2_8x32x1_8x32x1_1x32x1x8_8_1x1_intrawave_v3,860.32,308.93,0.0
gfx942,304,77696,4608,4096,ck,0,0,3535.5353,a8w8_blockscale_1x128x128_256x128x128x128_16x16_32x32_2x2_8x32x1_8x32x1_1x32x1x8_8_1x1_intrawave_v3,829.56,297.88,0.0
gfx942,304,77824,4608,4096,ck,0,0,3413.2107,a8w8_blockscale_1x128x128_256x128x128x128_16x16_32x32_2x2_8x32x1_8x32x1_1x32x1x8_8_1x1_intrawave_v3,860.7,309.05,0.0
gfx942,304,77952,4608,4096,ck,0,0,3467.5548,a8w8_blockscale_1x128x128_256x128x128x128_16x16_32x32_2x2_8x32x1_8x32x1_1x32x1x8_8_1x1_intrawave_v3,848.61,304.7,0.0
gfx942,304,78080,4608,4096,ck,0,0,3516.7997,a8w8_blockscale_1x128x128_256x128x128x128_16x16_32x32_2x2_8x32x1_8x32x1_1x32x1x8_8_1x1_intrawave_v3,838.1,300.92,0.0
gfx942,304,78208,4608,4096,ck,0,0,3443.2471,a8w8_blockscale_1x128x128_256x128x128x128_16x16_32x32_2x2_8x32x1_8x32x1_1x32x1x8_8_1x1_intrawave_v3,857.4,307.84,0.0
gfx942,304,78336,4608,4096,ck,0,0,3486.8991,a8w8_blockscale_1x128x128_256x128x128x128_16x16_32x32_2x2_8x32x1_8x32x1_1x32x1x8_8_1x1_intrawave_v3,848.06,304.48,0.0
gfx942,304,78464,4608,4096,ck,0,0,3450.7646,a8w8_blockscale_1x128x128_256x128x128x128_16x16_32x32_2x2_8x32x1_8x32x1_1x32x1x8_8_1x1_intrawave_v3,858.34,308.16,0.0
gfx942,304,78592,4608,4096,ck,0,0,3541.9472,a8w8_blockscale_1x128x128_256x128x128x128_16x16_32x32_2x2_8x32x1_8x32x1_1x32x1x8_8_1x1_intrawave_v3,837.6,300.71,0.0
gfx942,304,78720,4608,4096,ck,0,0,3473.9534,a8w8_blockscale_1x128x128_256x128x128x128_16x16_32x32_2x2_8x32x1_8x32x1_1x32x1x8_8_1x1_intrawave_v3,855.39,307.08,0.0
gfx942,304,78848,4608,4096,ck,0,0,3459.9595,a8w8_blockscale_1x128x128_256x128x128x128_16x16_32x32_2x2_8x32x1_8x32x1_1x32x1x8_8_1x1_intrawave_v3,860.24,308.82,0.0
gfx942,304,78976,4608,4096,ck,0,0,3487.7972,a8w8_blockscale_1x128x128_256x128x128x128_16x16_32x32_2x2_8x32x1_8x32x1_1x32x1x8_8_1x1_intrawave_v3,854.76,306.84,0.0
gfx942,304,79104,4608,4096,ck,0,0,3483.8319,a8w8_blockscale_1x128x128_256x128x128x128_16x16_32x32_2x2_8x32x1_8x32x1_1x32x1x8_8_1x1_intrawave_v3,857.12,307.68,0.0
gfx942,304,79232,4608,4096,ck,0,0,3552.3768,a8w8_blockscale_1x128x128_256x128x128x128_16x16_32x32_2x2_8x32x1_8x32x1_1x32x1x8_8_1x1_intrawave_v3,841.95,302.22,0.0
gfx942,304,79360,4608,4096,ck,0,0,3546.0542,a8w8_blockscale_1x128x128_256x128x128x128_16x16_32x32_2x2_8x32x1_8x32x1_1x32x1x8_8_1x1_intrawave_v3,844.81,303.24,0.0
gfx942,304,79488,4608,4096,ck,0,0,3501.8282,a8w8_blockscale_1x128x128_256x128x128x128_16x16_32x32_2x2_8x32x1_8x32x1_1x32x1x8_8_1x1_intrawave_v3,856.86,307.56,0.0
gfx942,304,79616,4608,4096,ck,0,0,3644.6277,a8w8_blockscale_1x128x128_256x128x128x128_16x16_32x32_2x2_8x32x1_8x32x1_1x32x1x8_8_1x1_intrawave_v3,824.61,295.98,0.0
gfx942,304,79744,4608,4096,ck,0,0,3513.2241,a8w8_blockscale_1x128x128_256x128x128x128_16x16_32x32_2x2_8x32x1_8x32x1_1x32x1x8_8_1x1_intrawave_v3,856.83,307.53,0.0
gfx942,304,79872,4608,4096,ck,0,0,3512.1976,a8w8_blockscale_1x128x128_256x128x128x128_16x16_32x32_2x2_8x32x1_8x32x1_1x32x1x8_8_1x1_intrawave_v3,858.46,308.11,0.0
gfx942,304,80000,4608,4096,ck,0,0,3668.166,a8w8_blockscale_1x128x128_256x128x128x128_16x16_32x32_2x2_8x32x1_8x32x1_1x32x1x8_8_1x1_intrawave_v3,823.27,295.47,0.0
