aiter/configs/model_configs/a8w8_blockscale_tuned_gemm_ds_v3.csv
cu_num,M,N,K,libtype,kernelId,preshuffleB,splitK,us,kernelName,tflops,bw,errRatio
256,1,128,7168,ck,7,True,0,12.1246,a8w8_blockscale_bpreshuffle_1x128x128_256x16x64x256_16x16_16x16_16x16x1_16x16x1_1x16x1x16_4_1x1_intrawave_v1,0.15,76.29,0.0
256,1,512,7168,ck,7,True,0,20.2952,a8w8_blockscale_bpreshuffle_1x128x128_256x16x64x256_16x16_16x16_16x16x1_16x16x1_1x16x1x16_4_1x1_intrawave_v1,0.36,181.24,0.0
256,1,1024,7168,ck,7,True,0,20.9079,a8w8_blockscale_bpreshuffle_1x128x128_256x16x64x256_16x16_16x16_16x16x1_16x16x1_1x16x1x16_4_1x1_intrawave_v1,0.7,351.51,0.0
256,1,2112,7168,ck,7,True,0,20.3806,a8w8_blockscale_bpreshuffle_1x128x128_256x16x64x256_16x16_16x16_16x16x1_16x16x1_1x16x1x16_4_1x1_intrawave_v1,1.49,743.36,0.0
256,1,2240,7168,ck,7,True,0,20.4298,a8w8_blockscale_bpreshuffle_1x128x128_256x16x64x256_16x16_16x16_16x16x1_16x16x1_1x16x1x16_4_1x1_intrawave_v1,1.57,786.5,0.0
256,1,3072,1536,ck,8,False,0,6.2581,a8w8_blockscale_1x128x128_256x16x64x256_16x16_16x16_1x1_16x16x1_16x16x1_1x16x1x16_4_1x1_intrawave_v1,1.51,755.22,0.0
256,1,4096,512,ck,7,True,0,3.0537,a8w8_blockscale_bpreshuffle_1x128x128_256x16x64x256_16x16_16x16_16x16x1_16x16x1_1x16x1x16_4_1x1_intrawave_v1,1.37,689.61,0.0
256,1,4096,7168,ck,7,True,0,20.7968,a8w8_blockscale_bpreshuffle_1x128x128_256x16x64x256_16x16_16x16_16x16x1_16x16x1_1x16x1x16_4_1x1_intrawave_v1,2.82,1412.5,0.0
256,1,4608,7168,ck,7,True,0,20.8945,a8w8_blockscale_bpreshuffle_1x128x128_256x16x64x256_16x16_16x16_16x16x1_16x16x1_1x16x1x16_4_1x1_intrawave_v1,3.16,1581.59,0.0
256,1,7168,256,ck,7,True,0,2.7615,a8w8_blockscale_bpreshuffle_1x128x128_256x16x64x256_16x16_16x16_16x16x1_16x16x1_1x16x1x16_4_1x1_intrawave_v1,1.33,669.78,0.0
256,1,7168,512,ck,7,True,0,3.81,a8w8_blockscale_bpreshuffle_1x128x128_256x16x64x256_16x16_16x16_16x16x1_16x16x1_1x16x1x16_4_1x1_intrawave_v1,1.93,967.16,0.0
256,1,7168,2048,ck,7,True,0,7.6765,a8w8_blockscale_bpreshuffle_1x128x128_256x16x64x256_16x16_16x16_16x16x1_16x16x1_1x16x1x16_4_1x1_intrawave_v1,3.82,1914.47,0.0
256,1,7168,2304,ck,7,True,0,8.3811,a8w8_blockscale_bpreshuffle_1x128x128_256x16x64x256_16x16_16x16_16x16x1_16x16x1_1x16x1x16_4_1x1_intrawave_v1,3.94,1972.5,0.0
256,1,7168,4096,ck,7,True,0,13.4009,a8w8_blockscale_bpreshuffle_1x128x128_256x16x64x256_16x16_16x16_16x16x1_16x16x1_1x16x1x16_4_1x1_intrawave_v1,4.38,2192.28,0.0
256,1,7168,4608,ck,7,True,0,14.8055,a8w8_blockscale_bpreshuffle_1x128x128_256x16x64x256_16x16_16x16_16x16x1_16x16x1_1x16x1x16_4_1x1_intrawave_v1,4.46,2232.22,0.0
256,1,7168,16384,ck,7,True,0,45.5067,a8w8_blockscale_bpreshuffle_1x128x128_256x16x64x256_16x16_16x16_16x16x1_16x16x1_1x16x1x16_4_1x1_intrawave_v1,5.16,2581.41,0.0
256,1,7168,18432,ck,7,True,0,51.3942,a8w8_blockscale_bpreshuffle_1x128x128_256x16x64x256_16x16_16x16_16x16x1_16x16x1_1x16x1x16_4_1x1_intrawave_v1,5.14,2571.37,0.0
256,1,8192,512,ck,7,True,0,3.803,a8w8_blockscale_bpreshuffle_1x128x128_256x16x64x256_16x16_16x16_16x16x1_16x16x1_1x16x1x16_4_1x1_intrawave_v1,2.21,1107.34,0.0
256,1,8192,1536,ck,7,True,0,6.8348,a8w8_blockscale_bpreshuffle_1x128x128_256x16x64x256_16x16_16x16_16x16x1_16x16x1_1x16x1x16_4_1x1_intrawave_v1,3.68,1843.63,0.0
256,1,9216,7168,ck,7,True,0,22.2901,a8w8_blockscale_bpreshuffle_1x128x128_256x16x64x256_16x16_16x16_16x16x1_16x16x1_1x16x1x16_4_1x1_intrawave_v1,5.93,2964.81,0.0
256,1,11264,1536,ck,7,True,0,7.0323,a8w8_blockscale_bpreshuffle_1x128x128_256x16x64x256_16x16_16x16_16x16x1_16x16x1_1x16x1x16_4_1x1_intrawave_v1,4.92,2463.71,0.0
256,1,12288,1536,ck,7,True,0,7.1048,a8w8_blockscale_bpreshuffle_1x128x128_256x16x64x256_16x16_16x16_16x16x1_16x16x1_1x16x1x16_4_1x1_intrawave_v1,5.31,2660.24,0.0
256,1,14336,1536,ck,7,True,0,7.2995,a8w8_blockscale_bpreshuffle_1x128x128_256x16x64x256_16x16_16x16_16x16x1_16x16x1_1x16x1x16_4_1x1_intrawave_v1,6.03,3020.8,0.0
256,1,16384,512,ck,7,True,0,4.3774,a8w8_blockscale_bpreshuffle_1x128x128_256x16x64x256_16x16_16x16_16x16x1_16x16x1_1x16x1x16_4_1x1_intrawave_v1,3.83,1923.95,0.0
256,1,20480,1536,ck,7,True,0,8.0809,a8w8_blockscale_bpreshuffle_1x128x128_256x16x64x256_16x16_16x16_16x16x1_16x16x1_1x16x1x16_4_1x1_intrawave_v1,7.79,3898.05,0.0
256,1,24576,1536,ck,6,True,0,8.5905,a8w8_blockscale_bpreshuffle_1x128x128_256x16x128x256_16x16_16x16_16x16x1_16x16x1_1x16x1x16_8_1x2_intrawave_v1,8.79,4400.14,0.0
256,1,32768,512,ck,7,True,0,5.12,a8w8_blockscale_bpreshuffle_1x128x128_256x16x64x256_16x16_16x16_16x16x1_16x16x1_1x16x1x16_4_1x1_intrawave_v1,6.55,3289.7,0.0
256,1,32768,1536,ck,6,True,0,10.832,a8w8_blockscale_bpreshuffle_1x128x128_256x16x128x256_16x16_16x16_16x16x1_16x16x1_1x16x1x16_8_1x2_intrawave_v1,9.29,4652.76,0.0
256,1,36864,7168,ck,5,True,0,46.1145,a8w8_blockscale_bpreshuffle_1x128x128_256x16x64x128_8x16_16x16_16x16x1_8x32x1_1x16x1x16_4_1x1_intrawave_v1,11.46,5731.86,0.0
256,2,128,7168,ck,7,True,0,12.2128,a8w8_blockscale_bpreshuffle_1x128x128_256x16x64x256_16x16_16x16_16x16x1_16x16x1_1x16x1x16_4_1x1_intrawave_v1,0.3,76.34,0.0
256,2,512,7168,ck,7,True,0,20.2236,a8w8_blockscale_bpreshuffle_1x128x128_256x16x64x256_16x16_16x16_16x16x1_16x16x1_1x16x1x16_4_1x1_intrawave_v1,0.73,182.28,0.0
256,2,1024,7168,ck,7,True,0,20.9159,a8w8_blockscale_bpreshuffle_1x128x128_256x16x64x256_16x16_16x16_16x16x1_16x16x1_1x16x1x16_4_1x1_intrawave_v1,1.4,351.81,0.0
256,2,2112,7168,ck,7,True,0,20.3446,a8w8_blockscale_bpreshuffle_1x128x128_256x16x64x256_16x16_16x16_16x16x1_16x16x1_1x16x1x16_4_1x1_intrawave_v1,2.98,745.24,0.0
256,2,2240,7168,ck,7,True,0,20.5065,a8w8_blockscale_bpreshuffle_1x128x128_256x16x64x256_16x16_16x16_16x16x1_16x16x1_1x16x1x16_4_1x1_intrawave_v1,3.13,784.12,0.0
256,2,3072,1536,ck,8,False,0,6.3642,a8w8_blockscale_1x128x128_256x16x64x256_16x16_16x16_1x1_16x16x1_16x16x1_1x16x1x16_4_1x1_intrawave_v1,2.97,743.84,0.0
256,2,4096,512,ck,7,True,0,3.0702,a8w8_blockscale_bpreshuffle_1x128x128_256x16x64x256_16x16_16x16_16x16x1_16x16x1_1x16x1x16_4_1x1_intrawave_v1,2.73,688.74,0.0
256,2,4096,7168,ck,7,True,0,20.7782,a8w8_blockscale_bpreshuffle_1x128x128_256x16x64x256_16x16_16x16_16x16x1_16x16x1_1x16x1x16_4_1x1_intrawave_v1,5.65,1414.5,0.0
256,2,4608,7168,ck,7,True,0,20.7675,a8w8_blockscale_bpreshuffle_1x128x128_256x16x64x256_16x16_16x16_16x16x1_16x16x1_1x16x1x16_4_1x1_intrawave_v1,6.36,1592.05,0.0
256,2,7168,256,ck,7,True,0,2.7782,a8w8_blockscale_bpreshuffle_1x128x128_256x16x64x256_16x16_16x16_16x16x1_16x16x1_1x16x1x16_4_1x1_intrawave_v1,2.64,671.01,0.0
256,2,7168,512,ck,7,True,0,3.8288,a8w8_blockscale_bpreshuffle_1x128x128_256x16x64x256_16x16_16x16_16x16x1_16x16x1_1x16x1x16_4_1x1_intrawave_v1,3.83,966.28,0.0
256,2,7168,2048,ck,7,True,0,7.7147,a8w8_blockscale_bpreshuffle_1x128x128_256x16x64x256_16x16_16x16_16x16x1_16x16x1_1x16x1x16_4_1x1_intrawave_v1,7.61,1907.12,0.0
256,2,7168,2304,ck,7,True,0,8.0694,a8w8_blockscale_bpreshuffle_1x128x128_256x16x64x256_16x16_16x16_16x16x1_16x16x1_1x16x1x16_4_1x1_intrawave_v1,8.19,2050.75,0.0
256,2,7168,4096,ck,7,True,0,13.3928,a8w8_blockscale_bpreshuffle_1x128x128_256x16x64x256_16x16_16x16_16x16x1_16x16x1_1x16x1x16_4_1x1_intrawave_v1,8.77,2194.98,0.0
256,2,7168,4608,ck,7,True,0,14.76,a8w8_blockscale_bpreshuffle_1x128x128_256x16x64x256_16x16_16x16_16x16x1_16x16x1_1x16x1x16_4_1x1_intrawave_v1,8.95,2240.38,0.0
256,2,7168,16384,ck,7,True,0,45.0534,a8w8_blockscale_bpreshuffle_1x128x128_256x16x64x256_16x16_16x16_16x16x1_16x16x1_1x16x1x16_4_1x1_intrawave_v1,10.43,2608.06,0.0
256,2,7168,18432,ck,7,True,0,51.9487,a8w8_blockscale_bpreshuffle_1x128x128_256x16x64x256_16x16_16x16_16x16x1_16x16x1_1x16x1x16_4_1x1_intrawave_v1,10.17,2544.55,0.0
256,2,8192,512,ck,7,True,0,3.7978,a8w8_blockscale_bpreshuffle_1x128x128_256x16x64x256_16x16_16x16_16x16x1_16x16x1_1x16x1x16_4_1x1_intrawave_v1,4.42,1113.3,0.0
256,2,8192,1536,ck,7,True,0,6.8642,a8w8_blockscale_bpreshuffle_1x128x128_256x16x64x256_16x16_16x16_16x16x1_16x16x1_1x16x1x16_4_1x1_intrawave_v1,7.33,1838.34,0.0
256,2,9216,7168,ck,7,True,0,22.143,a8w8_blockscale_bpreshuffle_1x128x128_256x16x64x256_16x16_16x16_16x16x1_16x16x1_1x16x1x16_4_1x1_intrawave_v1,11.93,2985.66,0.0
256,2,11264,1536,ck,8,False,0,6.5708,a8w8_blockscale_1x128x128_256x16x64x256_16x16_16x16_1x1_16x16x1_16x16x1_1x16x1x16_4_1x1_intrawave_v1,10.53,2640.41,0.0
256,2,12288,1536,ck,7,True,0,7.1083,a8w8_blockscale_bpreshuffle_1x128x128_256x16x64x256_16x16_16x16_16x16x1_16x16x1_1x16x1x16_4_1x1_intrawave_v1,10.62,2662.6,0.0
256,2,14336,1536,ck,7,True,0,7.3108,a8w8_blockscale_bpreshuffle_1x128x128_256x16x64x256_16x16_16x16_16x16x1_16x16x1_1x16x1x16_4_1x1_intrawave_v1,12.05,3020.26,0.0
256,2,16384,512,ck,7,True,0,4.385,a8w8_blockscale_bpreshuffle_1x128x128_256x16x64x256_16x16_16x16_16x16x1_16x16x1_1x16x1x16_4_1x1_intrawave_v1,7.65,1928.2,0.0
256,2,20480,1536,ck,6,True,0,8.0573,a8w8_blockscale_bpreshuffle_1x128x128_256x16x128x256_16x16_16x16_16x16x1_16x16x1_1x16x1x16_8_1x2_intrawave_v1,15.62,3914.74,0.0
256,2,24576,1536,ck,7,True,0,8.4703,a8w8_blockscale_bpreshuffle_1x128x128_256x16x64x256_16x16_16x16_16x16x1_16x16x1_1x16x1x16_4_1x1_intrawave_v1,17.83,4468.57,0.0
256,2,32768,512,ck,7,True,0,5.1062,a8w8_blockscale_bpreshuffle_1x128x128_256x16x64x256_16x16_16x16_16x16x1_16x16x1_1x16x1x16_4_1x1_intrawave_v1,13.14,3311.53,0.0
256,2,32768,1536,ck,6,True,0,10.8528,a8w8_blockscale_bpreshuffle_1x128x128_256x16x128x256_16x16_16x16_16x16x1_16x16x1_1x16x1x16_8_1x2_intrawave_v1,18.55,4650.03,0.0
256,2,36864,7168,ck,5,True,0,45.9894,a8w8_blockscale_bpreshuffle_1x128x128_256x16x64x128_8x16_16x16_16x16x1_8x32x1_1x16x1x16_4_1x1_intrawave_v1,22.98,5749.21,0.0
256,4,128,7168,ck,7,True,0,12.3748,a8w8_blockscale_bpreshuffle_1x128x128_256x16x64x256_16x16_16x16_16x16x1_16x16x1_1x16x1x16_4_1x1_intrawave_v1,0.59,76.54,0.0
256,4,512,7168,ck,7,True,0,20.3787,a8w8_blockscale_bpreshuffle_1x128x128_256x16x64x256_16x16_16x16_16x16x1_16x16x1_1x16x1x16_4_1x1_intrawave_v1,1.44,181.7,0.0
256,4,1024,7168,ck,7,True,0,21.0207,a8w8_blockscale_bpreshuffle_1x128x128_256x16x64x256_16x16_16x16_16x16x1_16x16x1_1x16x1x16_4_1x1_intrawave_v1,2.79,350.93,0.0
256,4,2112,7168,ck,7,True,0,20.4523,a8w8_blockscale_bpreshuffle_1x128x128_256x16x64x256_16x16_16x16_16x16x1_16x16x1_1x16x1x16_4_1x1_intrawave_v1,5.92,742.43,0.0
256,4,2240,7168,ck,7,True,0,20.4391,a8w8_blockscale_bpreshuffle_1x128x128_256x16x64x256_16x16_16x16_16x16x1_16x16x1_1x16x1x16_4_1x1_intrawave_v1,6.28,787.85,0.0
256,4,3072,1536,ck,8,False,0,6.8458,a8w8_blockscale_1x128x128_256x16x64x256_16x16_16x16_1x1_16x16x1_16x16x1_1x16x1x16_4_1x1_intrawave_v1,5.51,693.76,0.0
256,4,4096,512,ck,7,True,0,3.1082,a8w8_blockscale_bpreshuffle_1x128x128_256x16x64x256_16x16_16x16_16x16x1_16x16x1_1x16x1x16_4_1x1_intrawave_v1,5.4,685.92,0.0
256,4,4096,7168,ck,7,True,0,20.8707,a8w8_blockscale_bpreshuffle_1x128x128_256x16x64x256_16x16_16x16_16x16x1_16x16x1_1x16x1x16_4_1x1_intrawave_v1,11.25,1409.71,0.0
256,4,4608,7168,ck,7,True,0,20.9046,a8w8_blockscale_bpreshuffle_1x128x128_256x16x64x256_16x16_16x16_16x16x1_16x16x1_1x16x1x16_4_1x1_intrawave_v1,12.64,1583.18,0.0
256,4,7168,256,ck,7,True,0,2.8018,a8w8_blockscale_bpreshuffle_1x128x128_256x16x64x256_16x16_16x16_16x16x1_16x16x1_1x16x1x16_4_1x1_intrawave_v1,5.24,675.77,0.0
256,4,7168,512,ck,7,True,0,3.8436,a8w8_blockscale_bpreshuffle_1x128x128_256x16x64x256_16x16_16x16_16x16x1_16x16x1_1x16x1x16_4_1x1_intrawave_v1,7.64,970.29,0.0
256,4,7168,2048,ck,7,True,0,7.7376,a8w8_blockscale_bpreshuffle_1x128x128_256x16x64x256_16x16_16x16_16x16x1_16x16x1_1x16x1x16_4_1x1_intrawave_v1,15.18,1905.71,0.0
256,4,7168,2304,ck,7,True,0,8.0424,a8w8_blockscale_bpreshuffle_1x128x128_256x16x64x256_16x16_16x16_16x16x1_16x16x1_1x16x1x16_4_1x1_intrawave_v1,16.43,2061.78,0.0
256,4,7168,4096,ck,7,True,0,13.5169,a8w8_blockscale_bpreshuffle_1x128x128_256x16x64x256_16x16_16x16_16x16x1_16x16x1_1x16x1x16_4_1x1_intrawave_v1,17.38,2177.56,0.0
256,4,7168,4608,ck,7,True,0,14.8365,a8w8_blockscale_bpreshuffle_1x128x128_256x16x64x256_16x16_16x16_16x16x1_16x16x1_1x16x1x16_4_1x1_intrawave_v1,17.81,2231.38,0.0
256,4,7168,16384,ck,7,True,0,44.5848,a8w8_blockscale_bpreshuffle_1x128x128_256x16x64x256_16x16_16x16_16x16x1_16x16x1_1x16x1x16_4_1x1_intrawave_v1,21.07,2636.85,0.0
256,4,7168,18432,ck,7,True,0,51.0718,a8w8_blockscale_bpreshuffle_1x128x128_256x16x64x256_16x16_16x16_16x16x1_16x16x1_1x16x1x16_4_1x1_intrawave_v1,20.7,2589.52,0.0
256,4,8192,512,ck,7,True,0,3.8034,a8w8_blockscale_bpreshuffle_1x128x128_256x16x64x256_16x16_16x16_16x16x1_16x16x1_1x16x1x16_4_1x1_intrawave_v1,8.82,1120.55,0.0
256,4,8192,1536,ck,8,False,0,6.4915,a8w8_blockscale_1x128x128_256x16x64x256_16x16_16x16_1x1_16x16x1_16x16x1_1x16x1x16_4_1x1_intrawave_v1,15.51,1949.41,0.0
256,4,9216,7168,ck,7,True,0,22.2522,a8w8_blockscale_bpreshuffle_1x128x128_256x16x64x256_16x16_16x16_16x16x1_16x16x1_1x16x1x16_4_1x1_intrawave_v1,23.75,2973.31,0.0
256,4,11264,1536,ck,7,True,0,7.18,a8w8_blockscale_bpreshuffle_1x128x128_256x16x64x256_16x16_16x16_16x16x1_16x16x1_1x16x1x16_4_1x1_intrawave_v1,19.28,2423.09,0.0
256,4,12288,1536,ck,7,True,0,7.1266,a8w8_blockscale_bpreshuffle_1x128x128_256x16x64x256_16x16_16x16_16x16x1_16x16x1_1x16x1x16_4_1x1_intrawave_v1,21.19,2663.1,0.0
256,4,14336,1536,ck,7,True,0,7.3349,a8w8_blockscale_bpreshuffle_1x128x128_256x16x64x256_16x16_16x16_16x16x1_16x16x1_1x16x1x16_4_1x1_intrawave_v1,24.02,3018.57,0.0
256,4,16384,512,ck,7,True,0,4.3854,a8w8_blockscale_bpreshuffle_1x128x128_256x16x64x256_16x16_16x16_16x16x1_16x16x1_1x16x1x16_4_1x1_intrawave_v1,15.3,1943.2,0.0
256,4,20480,1536,ck,6,True,0,8.0471,a8w8_blockscale_bpreshuffle_1x128x128_256x16x128x256_16x16_16x16_16x16x1_16x16x1_1x16x1x16_8_1x2_intrawave_v1,31.27,3930.27,0.0
256,4,24576,1536,ck,6,True,0,8.553,a8w8_blockscale_bpreshuffle_1x128x128_256x16x128x256_16x16_16x16_16x16x1_16x16x1_1x16x1x16_8_1x2_intrawave_v1,35.31,4437.21,0.0
256,4,32768,512,ck,7,True,0,5.1529,a8w8_blockscale_bpreshuffle_1x128x128_256x16x64x256_16x16_16x16_16x16x1_16x16x1_1x16x1x16_4_1x1_intrawave_v1,26.05,3307.15,0.0
256,4,32768,1536,ck,7,True,0,10.531,a8w8_blockscale_bpreshuffle_1x128x128_256x16x64x256_16x16_16x16_16x16x1_16x16x1_1x16x1x16_4_1x1_intrawave_v1,38.24,4804.86,0.0
256,4,36864,7168,ck,5,True,0,46.4114,a8w8_blockscale_bpreshuffle_1x128x128_256x16x64x128_8x16_16x16_16x16x1_8x32x1_1x16x1x16_4_1x1_intrawave_v1,45.55,5700.43,0.0
256,8,128,7168,ck,7,True,0,12.5251,a8w8_blockscale_bpreshuffle_1x128x128_256x16x64x256_16x16_16x16_16x16x1_16x16x1_1x16x1x16_4_1x1_intrawave_v1,1.17,78.0,0.0
256,8,512,7168,ck,7,True,0,20.4566,a8w8_blockscale_bpreshuffle_1x128x128_256x16x64x256_16x16_16x16_16x16x1_16x16x1_1x16x1x16_4_1x1_intrawave_v1,2.87,182.61,0.0
256,8,1024,7168,ck,7,True,0,21.0043,a8w8_blockscale_bpreshuffle_1x128x128_256x16x64x256_16x16_16x16_16x16x1_16x16x1_1x16x1x16_4_1x1_intrawave_v1,5.59,352.96,0.0
256,8,2112,7168,ck,7,True,0,20.3758,a8w8_blockscale_bpreshuffle_1x128x128_256x16x64x256_16x16_16x16_16x16x1_16x16x1_1x16x1x16_4_1x1_intrawave_v1,11.89,747.45,0.0
256,8,2240,7168,ck,7,True,0,20.55,a8w8_blockscale_bpreshuffle_1x128x128_256x16x64x256_16x16_16x16_16x16x1_16x16x1_1x16x1x16_4_1x1_intrawave_v1,12.5,785.86,0.0
256,8,3072,1536,ck,7,True,0,6.8828,a8w8_blockscale_bpreshuffle_1x128x128_256x16x64x256_16x16_16x16_16x16x1_16x16x1_1x16x1x16_4_1x1_intrawave_v1,10.97,694.49,0.0
256,8,4096,512,ck,7,True,0,3.1106,a8w8_blockscale_bpreshuffle_1x128x128_256x16x64x256_16x16_16x16_16x16x1_16x16x1_1x16x1x16_4_1x1_intrawave_v1,10.79,696.58,0.0
256,8,4096,7168,ck,7,True,0,20.8838,a8w8_blockscale_bpreshuffle_1x128x128_256x16x64x256_16x16_16x16_16x16x1_16x16x1_1x16x1x16_4_1x1_intrawave_v1,22.49,1411.76,0.0
256,8,4608,7168,ck,7,True,0,20.7682,a8w8_blockscale_bpreshuffle_1x128x128_256x16x64x256_16x16_16x16_16x16x1_16x16x1_1x16x1x16_4_1x1_intrawave_v1,25.45,1596.73,0.0
256,8,7168,256,ck,7,True,0,2.8098,a8w8_blockscale_bpreshuffle_1x128x128_256x16x64x256_16x16_16x16_16x16x1_16x16x1_1x16x1x16_4_1x1_intrawave_v1,10.45,694.62,0.0
256,8,7168,512,ck,7,True,0,3.8085,a8w8_blockscale_bpreshuffle_1x128x128_256x16x64x256_16x16_16x16_16x16x1_16x16x1_1x16x1x16_4_1x1_intrawave_v1,15.42,994.83,0.0
256,8,7168,2048,ck,7,True,0,7.7028,a8w8_blockscale_bpreshuffle_1x128x128_256x16x64x256_16x16_16x16_16x16x1_16x16x1_1x16x1x16_4_1x1_intrawave_v1,30.49,1922.82,0.0
256,8,7168,2304,ck,7,True,0,8.5191,a8w8_blockscale_bpreshuffle_1x128x128_256x16x64x256_16x16_16x16_16x16x1_16x16x1_1x16x1x16_4_1x1_intrawave_v1,31.02,1954.22,0.0
256,8,7168,4096,ck,7,True,0,13.4709,a8w8_blockscale_bpreshuffle_1x128x128_256x16x64x256_16x16_16x16_16x16x1_16x16x1_1x16x1x16_4_1x1_intrawave_v1,34.87,2190.47,0.0
256,8,7168,4608,ck,7,True,0,14.7847,a8w8_blockscale_bpreshuffle_1x128x128_256x16x64x256_16x16_16x16_16x16x1_16x16x1_1x16x1x16_4_1x1_intrawave_v1,35.75,2244.33,0.0
256,8,7168,16384,ck,7,True,0,45.3367,a8w8_blockscale_bpreshuffle_1x128x128_256x16x64x256_16x16_16x16_16x16x1_16x16x1_1x16x1x16_4_1x1_intrawave_v1,41.45,2595.83,0.0
256,8,7168,18432,ck,7,True,0,51.6624,a8w8_blockscale_bpreshuffle_1x128x128_256x16x64x256_16x16_16x16_16x16x1_16x16x1_1x16x1x16_4_1x1_intrawave_v1,40.92,2562.46,0.0
256,8,8192,512,ck,7,True,0,3.8415,a8w8_blockscale_bpreshuffle_1x128x128_256x16x64x256_16x16_16x16_16x16x1_16x16x1_1x16x1x16_4_1x1_intrawave_v1,17.47,1127.03,0.0
256,8,8192,1536,ck,7,True,0,6.9221,a8w8_blockscale_bpreshuffle_1x128x128_256x16x64x256_16x16_16x16_16x16x1_16x16x1_1x16x1x16_4_1x1_intrawave_v1,29.08,1838.5,0.0
256,8,9216,7168,ck,7,True,0,22.2499,a8w8_blockscale_bpreshuffle_1x128x128_256x16x64x256_16x16_16x16_16x16x1_16x16x1_1x16x1x16_4_1x1_intrawave_v1,47.5,2978.22,0.0
256,8,11264,1536,ck,7,True,0,7.1343,a8w8_blockscale_bpreshuffle_1x128x128_256x16x64x256_16x16_16x16_16x16x1_16x16x1_1x16x1x16_4_1x1_intrawave_v1,38.8,2452.1,0.0
256,8,12288,1536,ck,7,True,0,7.2428,a8w8_blockscale_bpreshuffle_1x128x128_256x16x64x256_16x16_16x16_16x16x1_16x16x1_1x16x1x16_4_1x1_intrawave_v1,41.7,2634.79,0.0
256,8,14336,1536,ck,7,True,0,7.3611,a8w8_blockscale_bpreshuffle_1x128x128_256x16x64x256_16x16_16x16_16x16x1_16x16x1_1x16x1x16_4_1x1_intrawave_v1,47.86,3024.24,0.0
256,8,16384,512,ck,7,True,0,4.4015,a8w8_blockscale_bpreshuffle_1x128x128_256x16x64x256_16x16_16x16_16x16x1_16x16x1_1x16x1x16_4_1x1_intrawave_v1,30.49,1966.34,0.0
256,8,20480,1536,ck,6,True,0,8.1128,a8w8_blockscale_bpreshuffle_1x128x128_256x16x128x256_16x16_16x16_16x16x1_16x16x1_1x16x1x16_8_1x2_intrawave_v1,62.04,3919.39,0.0
256,8,24576,1536,ck,7,True,0,8.6704,a8w8_blockscale_bpreshuffle_1x128x128_256x16x64x256_16x16_16x16_16x16x1_16x16x1_1x16x1x16_4_1x1_intrawave_v1,69.66,4400.52,0.0
256,8,32768,512,ck,7,True,0,5.2014,a8w8_blockscale_bpreshuffle_1x128x128_256x16x64x256_16x16_16x16_16x16x1_16x16x1_1x16x1x16_4_1x1_intrawave_v1,51.61,3327.1,0.0
256,8,32768,1536,ck,6,True,0,10.9524,a8w8_blockscale_bpreshuffle_1x128x128_256x16x128x256_16x16_16x16_16x16x1_16x16x1_1x16x1x16_8_1x2_intrawave_v1,73.53,4644.48,0.0
256,8,36864,7168,ck,5,True,0,46.4452,a8w8_blockscale_bpreshuffle_1x128x128_256x16x64x128_8x16_16x16_16x16x1_8x32x1_1x16x1x16_4_1x1_intrawave_v1,91.03,5703.24,0.0
256,16,64,7168,ck,7,True,0,11.7603,a8w8_blockscale_bpreshuffle_1x128x128_256x16x64x256_16x16_16x16_16x16x1_16x16x1_1x16x1x16_4_1x1_intrawave_v1,1.25,48.93,0.0
256,16,128,7168,ck,7,True,0,11.5476,a8w8_blockscale_bpreshuffle_1x128x128_256x16x64x256_16x16_16x16_16x16x1_16x16x1_1x16x1x16_4_1x1_intrawave_v1,2.54,89.74,0.0
256,16,512,7168,ck,7,True,0,18.224,a8w8_blockscale_bpreshuffle_1x128x128_256x16x64x256_16x16_16x16_16x16x1_16x16x1_1x16x1x16_4_1x1_intrawave_v1,6.44,208.58,0.0
256,16,576,7168,ck,7,True,0,18.3195,a8w8_blockscale_bpreshuffle_1x128x128_256x16x64x256_16x16_16x16_16x16x1_16x16x1_1x16x1x16_4_1x1_intrawave_v1,7.21,232.64,0.0
256,16,1024,7168,ck,7,True,0,18.6651,a8w8_blockscale_bpreshuffle_1x128x128_256x16x64x256_16x16_16x16_16x16x1_16x16x1_1x16x1x16_4_1x1_intrawave_v1,12.58,401.15,0.0
256,16,1536,7168,ck,7,True,0,18.7647,a8w8_blockscale_bpreshuffle_1x128x128_256x16x64x256_16x16_16x16_16x16x1_16x16x1_1x16x1x16_4_1x1_intrawave_v1,18.78,595.47,0.0
256,16,2112,7168,ck,7,True,0,18.1319,a8w8_blockscale_bpreshuffle_1x128x128_256x16x64x256_16x16_16x16_16x16x1_16x16x1_1x16x1x16_4_1x1_intrawave_v1,26.72,844.98,0.0
256,16,2240,7168,ck,7,True,0,18.069,a8w8_blockscale_bpreshuffle_1x128x128_256x16x64x256_16x16_16x16_16x16x1_16x16x1_1x16x1x16_4_1x1_intrawave_v1,28.44,898.93,0.0
256,16,3072,1536,ck,8,False,0,6.3307,a8w8_blockscale_1x128x128_256x16x64x256_16x16_16x16_1x1_16x16x1_16x16x1_1x16x1x16_4_1x1_intrawave_v1,23.85,764.76,0.0
256,16,4096,512,ck,7,True,0,3.1218,a8w8_blockscale_bpreshuffle_1x128x128_256x16x64x256_16x16_16x16_16x16x1_16x16x1_1x16x1x16_4_1x1_intrawave_v1,21.5,716.39,0.0
256,16,4096,7168,ck,7,True,0,18.5047,a8w8_blockscale_bpreshuffle_1x128x128_256x16x64x256_16x16_16x16_16x16x1_16x16x1_1x16x1x16_4_1x1_intrawave_v1,50.77,1599.91,0.0
256,16,4608,7168,ck,7,True,0,18.5191,a8w8_blockscale_bpreshuffle_1x128x128_256x16x64x256_16x16_16x16_16x16x1_16x16x1_1x16x1x16_4_1x1_intrawave_v1,57.07,1797.73,0.0
256,16,7168,256,ck,7,True,0,2.8698,a8w8_blockscale_bpreshuffle_1x128x128_256x16x64x256_16x16_16x16_16x16x1_16x16x1_1x16x1x16_4_1x1_intrawave_v1,20.46,720.77,0.0
256,16,7168,512,ck,7,True,0,3.8578,a8w8_blockscale_bpreshuffle_1x128x128_256x16x64x256_16x16_16x16_16x16x1_16x16x1_1x16x1x16_4_1x1_intrawave_v1,30.44,1012.9,0.0
256,16,7168,2048,ck,7,True,0,7.5115,a8w8_blockscale_bpreshuffle_1x128x128_256x16x64x256_16x16_16x16_16x16x1_16x16x1_1x16x1x16_4_1x1_intrawave_v1,62.54,1989.24,0.0
256,16,7168,2304,ck,7,True,0,8.0795,a8w8_blockscale_bpreshuffle_1x128x128_256x16x64x256_16x16_16x16_16x16x1_16x16x1_1x16x1x16_4_1x1_intrawave_v1,65.41,2077.02,0.0
256,16,7168,4096,ck,7,True,0,12.4768,a8w8_blockscale_bpreshuffle_1x128x128_256x16x64x256_16x16_16x16_16x16x1_16x16x1_1x16x1x16_4_1x1_intrawave_v1,75.3,2376.81,0.0
256,16,7168,4608,ck,7,True,0,13.4238,a8w8_blockscale_bpreshuffle_1x128x128_256x16x64x256_16x16_16x16_16x16x1_16x16x1_1x16x1x16_4_1x1_intrawave_v1,78.74,2483.15,0.0
256,16,7168,16384,ck,7,True,0,40.6956,a8w8_blockscale_bpreshuffle_1x128x128_256x16x64x256_16x16_16x16_16x16x1_16x16x1_1x16x1x16_4_1x1_intrawave_v1,92.35,2897.91,0.0
256,16,7168,18432,ck,7,True,0,45.34,a8w8_blockscale_bpreshuffle_1x128x128_256x16x64x256_16x16_16x16_16x16x1_16x16x1_1x16x1x16_4_1x1_intrawave_v1,93.25,2925.56,0.0
256,16,8192,512,ck,7,True,0,3.7799,a8w8_blockscale_bpreshuffle_1x128x128_256x16x64x256_16x16_16x16_16x16x1_16x16x1_1x16x1x16_4_1x1_intrawave_v1,35.51,1181.15,0.0
256,16,8192,1536,ck,7,True,0,6.6836,a8w8_blockscale_bpreshuffle_1x128x128_256x16x64x256_16x16_16x16_16x16x1_16x16x1_1x16x1x16_4_1x1_intrawave_v1,60.24,1925.55,0.0
256,16,9216,7168,ck,7,True,0,19.9506,a8w8_blockscale_bpreshuffle_1x128x128_256x16x64x256_16x16_16x16_16x16x1_16x16x1_1x16x1x16_4_1x1_intrawave_v1,105.96,3331.72,0.0
256,16,11264,1536,ck,8,False,0,6.4848,a8w8_blockscale_1x128x128_256x16x64x256_16x16_16x16_1x1_16x16x1_16x16x1_1x16x1x16_4_1x1_intrawave_v1,85.38,2727.38,0.0
256,16,12288,1536,ck,7,True,0,7.2568,a8w8_blockscale_bpreshuffle_1x128x128_256x16x64x256_16x16_16x16_16x16x1_16x16x1_1x16x1x16_4_1x1_intrawave_v1,83.23,2658.49,0.0
256,16,14336,1536,ck,7,True,0,7.3453,a8w8_blockscale_bpreshuffle_1x128x128_256x16x64x256_16x16_16x16_16x16x1_16x16x1_1x16x1x16_4_1x1_intrawave_v1,95.93,3063.65,0.0
256,16,16384,512,ck,7,True,0,4.4598,a8w8_blockscale_bpreshuffle_1x128x128_256x16x64x256_16x16_16x16_16x16x1_16x16x1_1x16x1x16_4_1x1_intrawave_v1,60.19,2000.33,0.0
256,16,20480,1536,ck,7,True,0,8.5995,a8w8_blockscale_bpreshuffle_1x128x128_256x16x64x256_16x16_16x16_16x16x1_16x16x1_1x16x1x16_4_1x1_intrawave_v1,117.06,3737.1,0.0
256,16,24576,1536,ck,7,True,0,9.7254,a8w8_blockscale_bpreshuffle_1x128x128_256x16x64x256_16x16_16x16_16x16x1_16x16x1_1x16x1x16_4_1x1_intrawave_v1,124.21,3964.85,0.0
256,16,32768,512,ck,7,True,0,5.3444,a8w8_blockscale_bpreshuffle_1x128x128_256x16x64x256_16x16_16x16_16x16x1_16x16x1_1x16x1x16_4_1x1_intrawave_v1,100.45,3336.95,0.0
256,16,32768,1536,ck,6,True,0,11.2521,a8w8_blockscale_bpreshuffle_1x128x128_256x16x128x256_16x16_16x16_16x16x1_16x16x1_1x16x1x16_8_1x2_intrawave_v1,143.14,4568.46,0.0
256,16,36864,7168,ck,5,True,0,46.6877,a8w8_blockscale_bpreshuffle_1x128x128_256x16x64x128_8x16_16x16_16x16x1_8x32x1_1x16x1x16_4_1x1_intrawave_v1,181.11,5687.48,0.0
256,32,64,7168,ck,7,True,0,11.7403,a8w8_blockscale_bpreshuffle_1x128x128_256x16x64x256_16x16_16x16_16x16x1_16x16x1_1x16x1x16_4_1x1_intrawave_v1,2.5,58.96,0.0
256,32,128,7168,ck,7,True,0,11.8167,a8w8_blockscale_bpreshuffle_1x128x128_256x16x64x256_16x16_16x16_16x16x1_16x16x1_1x16x1x16_4_1x1_intrawave_v1,4.97,97.75,0.0
256,32,512,7168,ck,7,True,0,18.0064,a8w8_blockscale_bpreshuffle_1x128x128_256x16x64x256_16x16_16x16_16x16x1_16x16x1_1x16x1x16_4_1x1_intrawave_v1,13.04,218.38,0.0
256,32,576,7168,ck,7,True,0,18.1608,a8w8_blockscale_bpreshuffle_1x128x128_256x16x64x256_16x16_16x16_16x16x1_16x16x1_1x16x1x16_4_1x1_intrawave_v1,14.55,242.01,0.0
256,32,1024,7168,ck,7,True,0,18.6319,a8w8_blockscale_bpreshuffle_1x128x128_256x16x64x256_16x16_16x16_16x16x1_16x16x1_1x16x1x16_4_1x1_intrawave_v1,25.21,409.78,0.0
256,32,1536,7168,ck,7,True,0,18.1285,a8w8_blockscale_bpreshuffle_1x128x128_256x16x64x256_16x16_16x16_16x16x1_16x16x1_1x16x1x16_4_1x1_intrawave_v1,38.87,625.41,0.0
256,32,2112,7168,ck,7,True,0,17.9156,a8w8_blockscale_bpreshuffle_1x128x128_256x16x64x256_16x16_16x16_16x16x1_16x16x1_1x16x1x16_4_1x1_intrawave_v1,54.08,865.36,0.0
256,32,2240,7168,ck,7,True,0,17.9913,a8w8_blockscale_bpreshuffle_1x128x128_256x16x64x256_16x16_16x16_16x16x1_16x16x1_1x16x1x16_4_1x1_intrawave_v1,57.12,913.17,0.0
256,32,3072,1536,ck,8,False,0,6.4403,a8w8_blockscale_1x128x128_256x16x64x256_16x16_16x16_1x1_16x16x1_16x16x1_1x16x1x16_4_1x1_intrawave_v1,46.89,770.83,0.0
256,32,4096,512,ck,7,True,0,3.4331,a8w8_blockscale_bpreshuffle_1x128x128_256x16x64x256_16x16_16x16_16x16x1_16x16x1_1x16x1x16_4_1x1_intrawave_v1,39.1,691.99,0.0
256,32,4096,7168,ck,7,True,0,18.5098,a8w8_blockscale_bpreshuffle_1x128x128_256x16x64x256_16x16_16x16_16x16x1_16x16x1_1x16x1x16_4_1x1_intrawave_v1,101.52,1612.75,0.0
256,32,4608,7168,ck,7,True,0,18.5064,a8w8_blockscale_bpreshuffle_1x128x128_256x16x64x256_16x16_16x16_16x16x1_16x16x1_1x16x1x16_4_1x1_intrawave_v1,114.23,1813.13,0.0
256,32,7168,256,ck,12,True,0,3.1524,a8w8_blockscale_bpreshuffle_1x128x128_256x32x64x256_16x16_16x16_16x16x1_16x16x1_1x32x1x8_8_2x1_intrawave_v1,37.25,730.22,0.0
256,32,7168,512,ck,7,True,0,4.0919,a8w8_blockscale_bpreshuffle_1x128x128_256x16x64x256_16x16_16x16_16x16x1_16x16x1_1x16x1x16_4_1x1_intrawave_v1,57.4,1013.01,0.0
256,32,7168,2048,ck,7,True,0,7.8011,a8w8_blockscale_bpreshuffle_1x128x128_256x16x64x256_16x16_16x16_16x16x1_16x16x1_1x16x1x16_4_1x1_intrawave_v1,120.43,1949.0,0.0
256,32,7168,2304,ck,7,True,0,8.6515,a8w8_blockscale_bpreshuffle_1x128x128_256x16x64x256_16x16_16x16_16x16x1_16x16x1_1x16x1x16_4_1x1_intrawave_v1,122.17,1970.47,0.0
256,32,7168,4096,ck,7,True,0,12.5358,a8w8_blockscale_bpreshuffle_1x128x128_256x16x64x256_16x16_16x16_16x16x1_16x16x1_1x16x1x16_4_1x1_intrawave_v1,149.89,2389.15,0.0
256,32,7168,4608,ck,7,True,0,13.5644,a8w8_blockscale_bpreshuffle_1x128x128_256x16x64x256_16x16_16x16_16x16x1_16x16x1_1x16x1x16_4_1x1_intrawave_v1,155.84,2479.75,0.0
256,32,7168,16384,ck,7,True,0,40.5323,a8w8_blockscale_bpreshuffle_1x128x128_256x16x64x256_16x16_16x16_16x16x1_16x16x1_1x16x1x16_4_1x1_intrawave_v1,185.44,2921.71,0.0
256,32,7168,18432,ck,7,True,0,45.094,a8w8_blockscale_bpreshuffle_1x128x128_256x16x64x256_16x16_16x16_16x16x1_16x16x1_1x16x1x16_4_1x1_intrawave_v1,187.51,2953.15,0.0
256,32,8192,512,ck,7,True,0,4.0881,a8w8_blockscale_bpreshuffle_1x128x128_256x16x64x256_16x16_16x16_16x16x1_16x16x1_1x16x1x16_4_1x1_intrawave_v1,65.66,1158.23,0.0
256,32,8192,1536,ck,7,True,0,7.0089,a8w8_blockscale_bpreshuffle_1x128x128_256x16x64x256_16x16_16x16_16x16x1_16x16x1_1x16x1x16_4_1x1_intrawave_v1,114.9,1877.09,0.0
256,32,9216,7168,ck,12,True,0,21.4836,a8w8_blockscale_bpreshuffle_1x128x128_256x32x64x256_16x16_16x16_16x16x1_16x16x1_1x32x1x8_8_2x1_intrawave_v1,196.79,3113.05,0.0
256,32,11264,1536,ck,12,True,0,7.8654,a8w8_blockscale_bpreshuffle_1x128x128_256x32x64x256_16x16_16x16_16x16x1_16x16x1_1x32x1x8_8_2x1_intrawave_v1,140.78,2297.6,0.0
256,32,12288,1536,ck,12,True,0,7.7741,a8w8_blockscale_bpreshuffle_1x128x128_256x32x64x256_16x16_16x16_16x16x1_16x16x1_1x32x1x8_8_2x1_intrawave_v1,155.38,2535.34,0.0
256,32,14336,1536,ck,12,True,0,8.0274,a8w8_blockscale_bpreshuffle_1x128x128_256x32x64x256_16x16_16x16_16x16x1_16x16x1_1x32x1x8_8_2x1_intrawave_v1,175.56,2863.54,0.0
256,32,16384,512,ck,12,True,0,4.8122,a8w8_blockscale_bpreshuffle_1x128x128_256x32x64x256_16x16_16x16_16x16x1_16x16x1_1x32x1x8_8_2x1_intrawave_v1,111.56,1964.5,0.0
256,32,20480,1536,ck,12,False,0,10.4923,a8w8_blockscale_1x128x128_256x32x128x256_16x16_32x32_1x1_16x16x1_16x16x1_1x32x1x8_8_1x1_intrawave_v1,191.88,3127.74,0.0
256,32,24576,1536,ck,12,True,0,10.7943,a8w8_blockscale_bpreshuffle_1x128x128_256x32x64x256_16x16_16x16_16x16x1_16x16x1_1x32x1x8_8_2x1_intrawave_v1,223.81,3647.36,0.0
256,32,32768,512,ck,13,False,0,5.393,a8w8_blockscale_1x128x128_256x32x64x256_16x16_16x16_2x1_16x16x1_16x16x1_1x32x1x8_8_2x1_intrawave_v1,199.1,3502.83,0.0
256,32,32768,1536,ck,12,True,0,12.1742,a8w8_blockscale_bpreshuffle_1x128x128_256x32x64x256_16x16_16x16_16x16x1_16x16x1_1x32x1x8_8_2x1_intrawave_v1,264.59,4310.59,0.0
256,32,36864,7168,ck,10,True,0,51.9181,a8w8_blockscale_bpreshuffle_1x128x128_256x32x64x128_16x16_16x16_8x32x1_8x32x1_1x32x1x8_8_2x1_intrawave_v1,325.73,5139.44,0.0195
256,64,64,7168,ck,7,True,0,11.6013,a8w8_blockscale_bpreshuffle_1x128x128_256x16x64x256_16x16_16x16_16x16x1_16x16x1_1x16x1x16_4_1x1_intrawave_v1,5.06,79.79,0.0
256,64,128,7168,ck,7,True,0,11.9886,a8w8_blockscale_bpreshuffle_1x128x128_256x16x64x256_16x16_16x16_16x16x1_16x16x1_1x16x1x16_4_1x1_intrawave_v1,9.8,116.16,0.0
256,64,512,7168,ck,7,True,0,17.7671,a8w8_blockscale_bpreshuffle_1x128x128_256x16x64x256_16x16_16x16_16x16x1_16x16x1_1x16x1x16_4_1x1_intrawave_v1,26.44,236.07,0.0
256,64,576,7168,ck,7,True,0,17.8185,a8w8_blockscale_bpreshuffle_1x128x128_256x16x64x256_16x16_16x16_16x16x1_16x16x1_1x16x1x16_4_1x1_intrawave_v1,29.66,261.6,0.0
256,64,1024,7168,ck,7,True,0,18.2731,a8w8_blockscale_bpreshuffle_1x128x128_256x16x64x256_16x16_16x16_16x16x1_16x16x1_1x16x1x16_4_1x1_intrawave_v1,51.42,433.96,0.0
256,64,1536,7168,ck,7,True,0,17.6006,a8w8_blockscale_bpreshuffle_1x128x128_256x16x64x256_16x16_16x16_16x16x1_16x16x1_1x16x1x16_4_1x1_intrawave_v1,80.07,662.78,0.0
256,64,2112,7168,ck,7,True,0,17.8105,a8w8_blockscale_bpreshuffle_1x128x128_256x16x64x256_16x16_16x16_16x16x1_16x16x1_1x16x1x16_4_1x1_intrawave_v1,108.8,890.93,0.0
256,64,2240,7168,ck,7,True,0,17.8623,a8w8_blockscale_bpreshuffle_1x128x128_256x16x64x256_16x16_16x16_16x16x1_16x16x1_1x16x1x16_4_1x1_intrawave_v1,115.06,940.63,0.0
256,64,3072,1536,ck,7,True,0,6.8366,a8w8_blockscale_bpreshuffle_1x128x128_256x16x64x256_16x16_16x16_16x16x1_16x16x1_1x16x1x16_4_1x1_intrawave_v1,88.35,762.09,0.0
256,64,4096,512,ck,7,True,0,3.6802,a8w8_blockscale_bpreshuffle_1x128x128_256x16x64x256_16x16_16x16_16x16x1_16x16x1_1x16x1x16_4_1x1_intrawave_v1,72.94,721.21,0.0
256,64,4096,7168,ck,7,True,0,18.2461,a8w8_blockscale_bpreshuffle_1x128x128_256x16x64x256_16x16_16x16_16x16x1_16x16x1_1x16x1x16_4_1x1_intrawave_v1,205.97,1662.99,0.0
256,64,4608,7168,ck,12,True,0,19.78,a8w8_blockscale_bpreshuffle_1x128x128_256x32x64x256_16x16_16x16_16x16x1_16x16x1_1x32x1x8_8_2x1_intrawave_v1,213.74,1722.89,0.0
256,64,7168,256,ck,12,True,0,3.6334,a8w8_blockscale_bpreshuffle_1x128x128_256x32x64x256_16x16_16x16_16x16x1_16x16x1_1x32x1x8_8_2x1_intrawave_v1,64.64,762.07,0.0
256,64,7168,512,ck,12,True,0,4.4675,a8w8_blockscale_bpreshuffle_1x128x128_256x32x64x256_16x16_16x16_16x16x1_16x16x1_1x32x1x8_8_2x1_intrawave_v1,105.15,1034.2,0.0
256,64,7168,2048,ck,12,True,0,8.1619,a8w8_blockscale_bpreshuffle_1x128x128_256x32x64x256_16x16_16x16_16x16x1_16x16x1_1x32x1x8_8_2x1_intrawave_v1,230.22,1927.08,0.0
256,64,7168,2304,ck,6,True,0,9.1633,a8w8_blockscale_bpreshuffle_1x128x128_256x16x128x256_16x16_16x16_16x16x1_16x16x1_1x16x1x16_8_1x2_intrawave_v1,230.7,1918.53,0.0
256,64,7168,4096,ck,12,True,0,13.396,a8w8_blockscale_bpreshuffle_1x128x128_256x32x64x256_16x16_16x16_16x16x1_16x16x1_1x32x1x8_8_2x1_intrawave_v1,280.54,2279.77,0.0
256,64,7168,4608,ck,12,True,0,14.5849,a8w8_blockscale_bpreshuffle_1x128x128_256x32x64x256_16x16_16x16_16x16x1_16x16x1_1x32x1x8_8_2x1_intrawave_v1,289.88,2347.81,0.0
256,64,7168,16384,ck,12,True,0,43.8389,a8w8_blockscale_bpreshuffle_1x128x128_256x32x64x256_16x16_16x16_16x16x1_16x16x1_1x32x1x8_8_2x1_intrawave_v1,342.9,2723.76,0.0
256,64,7168,18432,ck,12,True,0,47.9519,a8w8_blockscale_bpreshuffle_1x128x128_256x32x64x256_16x16_16x16_16x16x1_16x16x1_1x32x1x8_8_2x1_intrawave_v1,352.67,2799.01,0.0
256,64,8192,512,ck,12,True,0,4.4884,a8w8_blockscale_bpreshuffle_1x128x128_256x32x64x256_16x16_16x16_16x16x1_16x16x1_1x32x1x8_8_2x1_intrawave_v1,119.61,1175.4,0.0
256,64,8192,1536,ck,6,True,0,7.4598,a8w8_blockscale_bpreshuffle_1x128x128_256x16x128x256_16x16_16x16_16x16x1_16x16x1_1x16x1x16_8_1x2_intrawave_v1,215.91,1840.5,0.0
256,64,9216,7168,ck,17,True,0,24.5836,a8w8_blockscale_bpreshuffle_1x128x128_256x64x64x256_16x16_16x16_16x16x1_16x16x1_1x32x1x8_8_2x1_intrawave_v1,343.96,2753.82,0.0
256,64,11264,1536,ck,18,False,0,8.2338,a8w8_blockscale_1x128x128_256x64x64x256_16x16_32x32_1x1_16x16x1_16x16x1_1x32x1x8_8_1x1_intrawave_v1,268.96,2288.32,0.0
256,64,12288,1536,ck,18,False,0,8.4172,a8w8_blockscale_1x128x128_256x64x64x256_16x16_32x32_1x1_16x16x1_16x16x1_1x32x1x8_8_1x1_intrawave_v1,287.02,2440.9,0.0
256,64,14336,1536,ck,18,False,0,8.8409,a8w8_blockscale_1x128x128_256x64x64x256_16x16_32x32_1x1_16x16x1_16x16x1_1x32x1x8_8_1x1_intrawave_v1,318.81,2709.39,0.0
256,64,16384,512,ck,13,False,0,5.3818,a8w8_blockscale_1x128x128_256x32x64x256_16x16_16x16_2x1_16x16x1_16x16x1_1x32x1x8_8_2x1_intrawave_v1,199.51,1954.46,0.0
256,64,20480,1536,ck,10,True,0,12.5306,a8w8_blockscale_bpreshuffle_1x128x128_256x32x64x128_16x16_16x16_8x32x1_8x32x1_1x32x1x8_8_2x1_intrawave_v1,321.34,2727.49,0.0229
256,64,24576,1536,ck,12,True,0,13.1101,a8w8_blockscale_bpreshuffle_1x128x128_256x32x64x256_16x16_16x16_16x16x1_16x16x1_1x32x1x8_8_2x1_intrawave_v1,368.56,3126.81,0.0
256,64,32768,512,ck,17,True,0,7.3433,a8w8_blockscale_bpreshuffle_1x128x128_256x64x64x256_16x16_16x16_16x16x1_16x16x1_1x32x1x8_8_2x1_intrawave_v1,292.44,2860.33,0.0
256,64,32768,1536,ck,17,True,0,14.3863,a8w8_blockscale_bpreshuffle_1x128x128_256x64x64x256_16x16_16x16_16x16x1_16x16x1_1x32x1x8_8_2x1_intrawave_v1,447.82,3796.96,0.0
256,64,36864,7168,ck,13,True,0,65.5291,a8w8_blockscale_bpreshuffle_1x128x128_256x64x256x128_16x16_16x16_8x32x1_8x32x1_1x32x1x8_8_2x1_intrawave_v1,516.15,4111.43,0.0
256,96,128,7168,ck,7,True,0,12.1691,a8w8_blockscale_bpreshuffle_1x128x128_256x16x64x256_16x16_16x16_16x16x1_16x16x1_1x16x1x16_4_1x1_intrawave_v1,14.48,133.96,0.0
256,96,512,7168,ck,7,True,0,17.4529,a8w8_blockscale_bpreshuffle_1x128x128_256x16x64x256_16x16_16x16_16x16x1_16x16x1_1x16x1x16_4_1x1_intrawave_v1,40.37,255.34,0.0
256,96,1024,7168,ck,7,True,0,18.2011,a8w8_blockscale_bpreshuffle_1x128x128_256x16x64x256_16x16_16x16_16x16x1_16x16x1_1x16x1x16_4_1x1_intrawave_v1,77.43,451.88,0.0
256,96,2112,7168,ck,7,True,0,17.5641,a8w8_blockscale_bpreshuffle_1x128x128_256x16x64x256_16x16_16x16_16x16x1_16x16x1_1x16x1x16_4_1x1_intrawave_v1,165.49,924.18,0.0
256,96,2240,7168,ck,7,True,0,17.6536,a8w8_blockscale_bpreshuffle_1x128x128_256x16x64x256_16x16_16x16_16x16x1_16x16x1_1x16x1x16_4_1x1_intrawave_v1,174.63,972.86,0.0
256,96,3072,1536,ck,8,False,0,6.9873,a8w8_blockscale_1x128x128_256x16x64x256_16x16_16x16_1x1_16x16x1_16x16x1_1x16x1x16_4_1x1_intrawave_v1,129.66,780.83,0.0
256,96,4096,512,ck,6,True,0,4.0664,a8w8_blockscale_bpreshuffle_1x128x128_256x16x128x256_16x16_16x16_16x16x1_16x16x1_1x16x1x16_8_1x2_intrawave_v1,99.02,721.21,0.0
256,96,4096,7168,ck,12,True,0,19.7019,a8w8_blockscale_bpreshuffle_1x128x128_256x32x64x256_16x16_16x16_16x16x1_16x16x1_1x32x1x8_8_2x1_intrawave_v1,286.12,1565.06,0.0
256,96,4608,7168,ck,12,True,0,19.8423,a8w8_blockscale_bpreshuffle_1x128x128_256x32x64x256_16x16_16x16_16x16x1_16x16x1_1x32x1x8_8_2x1_intrawave_v1,319.61,1743.9,0.0
256,96,7168,256,ck,7,True,0,4.1673,a8w8_blockscale_bpreshuffle_1x128x128_256x16x64x256_16x16_16x16_16x16x1_16x16x1_1x16x1x16_4_1x1_intrawave_v1,84.54,776.48,0.0
256,96,7168,512,ck,12,True,0,5.149,a8w8_blockscale_bpreshuffle_1x128x128_256x32x64x256_16x16_16x16_16x16x1_16x16x1_1x32x1x8_8_2x1_intrawave_v1,136.85,989.59,0.0
256,96,7168,2048,ck,18,False,0,9.5917,a8w8_blockscale_1x128x128_256x64x64x256_16x16_32x32_1x1_16x16x1_16x16x1_1x32x1x8_8_1x1_intrawave_v1,293.86,1694.48,0.0
256,96,7168,2304,ck,18,False,0,10.387,a8w8_blockscale_1x128x128_256x64x64x256_16x16_32x32_1x1_16x16x1_16x16x1_1x32x1x8_8_1x1_intrawave_v1,305.28,1743.77,0.0
256,96,7168,4096,ck,17,True,0,15.7209,a8w8_blockscale_bpreshuffle_1x128x128_256x64x64x256_16x16_16x16_16x16x1_16x16x1_1x32x1x8_8_2x1_intrawave_v1,358.58,1980.14,0.0
256,96,7168,4608,ck,11,True,0,17.3373,a8w8_blockscale_bpreshuffle_1x128x128_256x32x128x256_16x16_16x16_16x16x1_16x16x1_1x32x1x8_8_2x1_intrawave_v1,365.79,2010.05,0.0
256,96,7168,16384,ck,11,True,0,51.6695,a8w8_blockscale_bpreshuffle_1x128x128_256x32x128x256_16x16_16x16_16x16x1_16x16x1_1x32x1x8_8_2x1_intrawave_v1,436.4,2329.99,0.0
256,96,7168,18432,ck,11,True,0,58.3712,a8w8_blockscale_bpreshuffle_1x128x128_256x32x128x256_16x16_16x16_16x16x1_16x16x1_1x32x1x8_8_2x1_intrawave_v1,434.58,2317.35,0.0
256,96,8192,512,ck,12,True,0,5.1873,a8w8_blockscale_bpreshuffle_1x128x128_256x32x64x256_16x16_16x16_16x16x1_16x16x1_1x32x1x8_8_2x1_intrawave_v1,155.25,1121.26,0.0
256,96,8192,1536,ck,18,False,0,8.175,a8w8_blockscale_1x128x128_256x64x64x256_16x16_32x32_1x1_16x16x1_16x16x1_1x32x1x8_8_1x1_intrawave_v1,295.53,1749.63,0.0
256,96,9216,7168,ck,11,True,0,26.3802,a8w8_blockscale_bpreshuffle_1x128x128_256x32x128x256_16x16_16x16_16x16x1_16x16x1_1x32x1x8_8_2x1_intrawave_v1,480.8,2597.32,0.0
256,96,11264,1536,ck,11,True,0,10.6121,a8w8_blockscale_bpreshuffle_1x128x128_256x32x128x256_16x16_16x16_16x16x1_16x16x1_1x32x1x8_8_2x1_intrawave_v1,313.03,1848.05,0.0
256,96,12288,1536,ck,12,True,0,10.9793,a8w8_blockscale_bpreshuffle_1x128x128_256x32x64x256_16x16_16x16_16x16x1_16x16x1_1x32x1x8_8_2x1_intrawave_v1,330.06,1947.4,0.0
256,96,14336,1536,ck,12,True,0,11.4418,a8w8_blockscale_bpreshuffle_1x128x128_256x32x64x256_16x16_16x16_16x16x1_16x16x1_1x32x1x8_8_2x1_intrawave_v1,369.51,2177.98,0.0
256,96,16384,512,ck,13,False,0,6.188,a8w8_blockscale_1x128x128_256x32x64x256_16x16_16x16_2x1_16x16x1_16x16x1_1x32x1x8_8_2x1_intrawave_v1,260.28,1871.93,0.0
256,96,20480,1536,ck,11,True,0,12.9819,a8w8_blockscale_bpreshuffle_1x128x128_256x32x128x256_16x16_16x16_16x16x1_16x16x1_1x32x1x8_8_2x1_intrawave_v1,465.25,2737.42,0.0
256,96,24576,1536,ck,2,True,0,16.2655,a8w8_blockscale_bpreshuffle_1x128x128_256x64x64x128_16x16_16x16_8x32x1_8x32x1_1x32x1x8_8_2x1_intrawave_v3,445.59,2619.95,0.0069
256,96,32768,512,ck,9,True,0,9.217,a8w8_blockscale_bpreshuffle_1x128x128_256x32x128x128_16x16_16x16_8x32x1_8x32x1_1x32x1x8_8_2x1_intrawave_v1,349.49,2508.17,0.0
256,96,32768,1536,ck,14,True,0,18.0221,a8w8_blockscale_bpreshuffle_1x128x128_256x64x128x128_16x16_16x16_8x32x1_8x32x1_1x32x1x8_8_2x1_intrawave_v1,536.21,3150.05,0.0
256,96,36864,7168,ck,8,True,0,81.6658,a8w8_blockscale_bpreshuffle_1x128x128_256x32x256x128_16x16_16x16_8x32x1_8x32x1_1x32x1x8_8_2x1_intrawave_v1,621.24,3330.74,0.0
256,128,64,7168,ck,7,True,0,11.8248,a8w8_blockscale_bpreshuffle_1x128x128_256x16x64x256_16x16_16x16_16x16x1_16x16x1_1x16x1x16_4_1x1_intrawave_v1,9.93,117.77,0.0
256,128,128,7168,ck,7,True,0,11.9497,a8w8_blockscale_bpreshuffle_1x128x128_256x16x64x256_16x16_16x16_16x16x1_16x16x1_1x16x1x16_4_1x1_intrawave_v1,19.66,156.3,0.0
256,128,512,7168,ck,7,True,0,17.4653,a8w8_blockscale_bpreshuffle_1x128x128_256x16x64x256_16x16_16x16_16x16x1_16x16x1_1x16x1x16_4_1x1_intrawave_v1,53.79,270.17,0.0
256,128,576,7168,ck,7,True,0,17.5219,a8w8_blockscale_bpreshuffle_1x128x128_256x16x64x256_16x16_16x16_16x16x1_16x16x1_1x16x1x16_4_1x1_intrawave_v1,60.32,296.41,0.0
256,128,1024,7168,ck,7,True,0,17.8483,a8w8_blockscale_bpreshuffle_1x128x128_256x16x64x256_16x16_16x16_16x16x1_16x16x1_1x16x1x16_4_1x1_intrawave_v1,105.28,477.34,0.0
256,128,1536,7168,ck,7,True,0,17.3942,a8w8_blockscale_bpreshuffle_1x128x128_256x16x64x256_16x16_16x16_16x16x1_16x16x1_1x16x1x16_4_1x1_intrawave_v1,162.04,708.33,0.0
256,128,2112,7168,ck,7,True,0,17.9576,a8w8_blockscale_bpreshuffle_1x128x128_256x16x64x256_16x16_16x16_16x16x1_16x16x1_1x16x1x16_4_1x1_intrawave_v1,215.82,924.23,0.0
256,128,2240,7168,ck,12,True,0,19.0132,a8w8_blockscale_bpreshuffle_1x128x128_256x32x64x256_16x16_16x16_16x16x1_16x16x1_1x32x1x8_8_2x1_intrawave_v1,216.19,922.9,0.0
256,128,3072,1536,ck,6,True,0,7.1706,a8w8_blockscale_bpreshuffle_1x128x128_256x16x128x256_16x16_16x16_16x16x1_16x16x1_1x16x1x16_8_1x2_intrawave_v1,168.46,795.14,0.0
256,128,4096,512,ck,6,True,0,4.1708,a8w8_blockscale_bpreshuffle_1x128x128_256x16x128x256_16x16_16x16_16x16x1_16x16x1_1x16x1x16_8_1x2_intrawave_v1,128.72,769.94,0.0
256,128,4096,7168,ck,12,True,0,19.567,a8w8_blockscale_bpreshuffle_1x128x128_256x32x64x256_16x16_16x16_16x16x1_16x16x1_1x32x1x8_8_2x1_intrawave_v1,384.13,1600.97,0.0
256,128,4608,7168,ck,17,True,0,22.709,a8w8_blockscale_bpreshuffle_1x128x128_256x64x64x256_16x16_16x16_16x16x1_16x16x1_1x32x1x8_8_2x1_intrawave_v1,372.35,1546.84,0.0
256,128,7168,256,ck,7,True,0,4.3784,a8w8_blockscale_bpreshuffle_1x128x128_256x16x64x256_16x16_16x16_16x16x1_16x16x1_1x16x1x16_4_1x1_intrawave_v1,107.29,845.69,0.0
256,128,7168,512,ck,11,True,0,5.2254,a8w8_blockscale_bpreshuffle_1x128x128_256x32x128x256_16x16_16x16_16x16x1_16x16x1_1x32x1x8_8_2x1_intrawave_v1,179.8,1066.05,0.0
256,128,7168,2048,ck,18,False,0,9.52,a8w8_blockscale_1x128x128_256x64x64x256_16x16_32x32_1x1_16x16x1_16x16x1_1x32x1x8_8_1x1_intrawave_v1,394.76,1762.31,0.0
256,128,7168,2304,ck,18,False,0,10.3467,a8w8_blockscale_1x128x128_256x64x64x256_16x16_32x32_1x1_16x16x1_16x16x1_1x32x1x8_8_1x1_intrawave_v1,408.62,1802.02,0.0
256,128,7168,4096,ck,17,True,0,15.5487,a8w8_blockscale_bpreshuffle_1x128x128_256x64x64x256_16x16_16x16_16x16x1_16x16x1_1x32x1x8_8_2x1_intrawave_v1,483.4,2040.0,0.0
256,128,7168,4608,ck,17,True,0,16.9844,a8w8_blockscale_bpreshuffle_1x128x128_256x64x64x256_16x16_16x16_16x16x1_16x16x1_1x32x1x8_8_2x1_intrawave_v1,497.85,2087.5,0.0
256,128,7168,16384,ck,17,True,0,51.8501,a8w8_blockscale_bpreshuffle_1x128x128_256x64x64x256_16x16_16x16_16x16x1_16x16x1_1x32x1x8_8_2x1_intrawave_v1,579.84,2340.84,0.0
256,128,7168,18432,ck,17,True,0,58.8185,a8w8_blockscale_bpreshuffle_1x128x128_256x64x64x256_16x16_16x16_16x16x1_16x16x1_1x32x1x8_8_2x1_intrawave_v1,575.04,2317.55,0.0
256,128,8192,512,ck,12,True,0,5.2677,a8w8_blockscale_bpreshuffle_1x128x128_256x32x64x256_16x16_16x16_16x16x1_16x16x1_1x32x1x8_8_2x1_intrawave_v1,203.84,1206.79,0.0
256,128,8192,1536,ck,18,False,0,8.1576,a8w8_blockscale_1x128x128_256x64x64x256_16x16_32x32_1x1_16x16x1_16x16x1_1x32x1x8_8_1x1_intrawave_v1,394.87,1823.66,0.0
256,128,9216,7168,ck,17,True,0,38.3596,a8w8_blockscale_bpreshuffle_1x128x128_256x64x64x256_16x16_16x16_16x16x1_16x16x1_1x32x1x8_8_2x1_intrawave_v1,440.87,1807.56,0.0
256,128,11264,1536,ck,10,True,0,11.195,a8w8_blockscale_bpreshuffle_1x128x128_256x32x64x128_16x16_16x16_8x32x1_8x32x1_1x32x1x8_8_2x1_intrawave_v1,395.64,1820.61,0.0229
256,128,12288,1536,ck,10,True,0,11.6702,a8w8_blockscale_bpreshuffle_1x128x128_256x32x64x128_16x16_16x16_8x32x1_8x32x1_1x32x1x8_8_2x1_intrawave_v1,414.03,1903.71,0.0219
256,128,14336,1536,ck,17,True,0,12.1222,a8w8_blockscale_bpreshuffle_1x128x128_256x64x64x256_16x16_16x16_16x16x1_16x16x1_1x32x1x8_8_2x1_intrawave_v1,465.03,2135.48,0.0
256,128,16384,512,ck,11,True,0,6.9482,a8w8_blockscale_bpreshuffle_1x128x128_256x32x128x256_16x16_16x16_16x16x1_16x16x1_1x32x1x8_8_2x1_intrawave_v1,309.07,1820.39,0.0
256,128,20480,1536,ck,15,True,0,16.2761,a8w8_blockscale_bpreshuffle_1x128x128_256x64x64x128_16x16_16x16_8x32x1_8x32x1_1x32x1x8_8_2x1_intrawave_v1,494.78,2266.93,0.0109
256,128,24576,1536,ck,15,True,0,16.78,a8w8_blockscale_bpreshuffle_1x128x128_256x64x64x128_16x16_16x16_8x32x1_8x32x1_1x32x1x8_8_2x1_intrawave_v1,575.9,2636.28,0.0109
256,128,32768,512,ck,2,False,0,10.8355,a8w8_blockscale_1x128x128_256x64x128x128_16x16_32x32_1x2_8x32x1_8x32x1_1x32x1x8_8_1x1_intrawave_v3,396.38,2328.58,0.0
256,128,32768,1536,ck,14,True,0,18.8689,a8w8_blockscale_bpreshuffle_1x128x128_256x64x128x128_16x16_16x16_8x32x1_8x32x1_1x32x1x8_8_2x1_intrawave_v1,682.86,3122.43,0.0
256,128,36864,7168,ck,14,True,0,89.0047,a8w8_blockscale_bpreshuffle_1x128x128_256x64x128x128_16x16_16x16_8x32x1_8x32x1_1x32x1x8_8_2x1_intrawave_v1,760.02,3085.18,0.0001
256,160,128,7168,ck,7,True,0,13.4343,a8w8_blockscale_bpreshuffle_1x128x128_256x16x64x256_16x16_16x16_16x16x1_16x16x1_1x16x1x16_4_1x1_intrawave_v1,21.85,156.71,0.0
256,160,512,7168,ck,7,True,0,17.5133,a8w8_blockscale_bpreshuffle_1x128x128_256x16x64x256_16x16_16x16_16x16x1_16x16x1_1x16x1x16_4_1x1_intrawave_v1,67.06,284.4,0.0
256,160,1024,7168,ck,7,True,0,18.1291,a8w8_blockscale_bpreshuffle_1x128x128_256x16x64x256_16x16_16x16_16x16x1_16x16x1_1x16x1x16_4_1x1_intrawave_v1,129.56,486.21,0.0
256,160,2112,7168,ck,12,True,0,19.0323,a8w8_blockscale_bpreshuffle_1x128x128_256x32x64x256_16x16_16x16_16x16x1_16x16x1_1x32x1x8_8_2x1_intrawave_v1,254.54,891.2,0.0
256,160,2240,7168,ck,12,True,0,19.0347,a8w8_blockscale_bpreshuffle_1x128x128_256x32x64x256_16x16_16x16_16x16x1_16x16x1_1x32x1x8_8_2x1_intrawave_v1,269.93,941.44,0.0
256,160,3072,1536,ck,6,True,0,7.327,a8w8_blockscale_bpreshuffle_1x128x128_256x16x128x256_16x16_16x16_16x16x1_16x16x1_1x16x1x16_8_1x2_intrawave_v1,206.08,811.71,0.0
256,160,4096,512,ck,7,True,0,4.9372,a8w8_blockscale_bpreshuffle_1x128x128_256x16x64x256_16x16_16x16_16x16x1_16x16x1_1x16x1x16_4_1x1_intrawave_v1,135.92,706.84,0.0
256,160,4096,7168,ck,11,True,0,23.628,a8w8_blockscale_bpreshuffle_1x128x128_256x32x128x256_16x16_16x16_16x16x1_16x16x1_1x32x1x8_8_2x1_intrawave_v1,397.63,1346.61,0.0
256,160,4608,7168,ck,17,True,0,24.373,a8w8_blockscale_bpreshuffle_1x128x128_256x64x64x256_16x16_16x16_16x16x1_16x16x1_1x32x1x8_8_2x1_intrawave_v1,433.66,1462.75,0.0
256,160,7168,256,ck,7,True,0,4.7881,a8w8_blockscale_bpreshuffle_1x128x128_256x16x64x256_16x16_16x16_16x16x1_16x16x1_1x16x1x16_4_1x1_intrawave_v1,122.64,870.85,0.0
256,160,7168,512,ck,13,False,0,5.6231,a8w8_blockscale_1x128x128_256x32x64x256_16x16_16x16_2x1_16x16x1_16x16x1_1x32x1x8_8_2x1_intrawave_v1,208.85,1075.15,0.0
256,160,7168,2048,ck,10,True,0,12.0569,a8w8_blockscale_bpreshuffle_1x128x128_256x32x64x128_16x16_16x16_8x32x1_8x32x1_1x32x1x8_8_2x1_intrawave_v1,389.62,1434.99,0.0209
256,160,7168,2304,ck,10,True,0,13.7144,a8w8_blockscale_bpreshuffle_1x128x128_256x32x64x128_16x16_16x16_8x32x1_8x32x1_1x32x1x8_8_2x1_intrawave_v1,385.35,1398.35,0.0201
256,160,7168,4096,ck,10,True,0,21.3531,a8w8_blockscale_bpreshuffle_1x128x128_256x32x64x128_16x16_16x16_8x32x1_8x32x1_1x32x1x8_8_2x1_intrawave_v1,439.99,1513.09,0.0156
256,160,7168,4608,ck,10,True,0,24.3268,a8w8_blockscale_bpreshuffle_1x128x128_256x32x64x128_16x16_16x16_8x32x1_8x32x1_1x32x1x8_8_2x1_intrawave_v1,434.49,1482.36,0.0199
256,160,7168,16384,ck,10,True,0,76.3694,a8w8_blockscale_bpreshuffle_1x128x128_256x32x64x128_16x16_16x16_8x32x1_8x32x1_1x32x1x8_8_2x1_intrawave_v1,492.09,1602.16,0.0124
256,160,7168,18432,ck,17,True,0,86.131,a8w8_blockscale_bpreshuffle_1x128x128_256x64x64x256_16x16_16x16_16x16x1_16x16x1_1x32x1x8_8_2x1_intrawave_v1,490.86,1594.82,0.0
256,160,8192,512,ck,13,False,0,6.0426,a8w8_blockscale_1x128x128_256x32x64x256_16x16_16x16_2x1_16x16x1_16x16x1_1x32x1x8_8_2x1_intrawave_v1,222.12,1141.51,0.0
256,160,8192,1536,ck,12,True,0,10.7645,a8w8_blockscale_bpreshuffle_1x128x128_256x32x64x256_16x16_16x16_16x16x1_16x16x1_1x32x1x8_8_2x1_intrawave_v1,374.06,1435.28,0.0
256,160,9216,7168,ck,15,True,0,38.8518,a8w8_blockscale_bpreshuffle_1x128x128_256x64x64x128_16x16_16x16_8x32x1_8x32x1_1x32x1x8_8_2x1_intrawave_v1,544.1,1805.74,0.0075
256,160,11264,1536,ck,9,True,0,12.571,a8w8_blockscale_bpreshuffle_1x128x128_256x32x128x128_16x16_16x16_8x32x1_8x32x1_1x32x1x8_8_2x1_intrawave_v1,440.42,1682.58,0.0
256,160,12288,1536,ck,9,True,0,12.8682,a8w8_blockscale_bpreshuffle_1x128x128_256x32x128x128_16x16_16x16_8x32x1_8x32x1_1x32x1x8_8_2x1_intrawave_v1,469.36,1791.42,0.0
256,160,14336,1536,ck,15,True,0,14.9268,a8w8_blockscale_bpreshuffle_1x128x128_256x64x64x128_16x16_16x16_8x32x1_8x32x1_1x32x1x8_8_2x1_intrawave_v1,472.07,1799.0,0.0096
256,160,16384,512,ck,17,True,0,8.2075,a8w8_blockscale_bpreshuffle_1x128x128_256x64x64x256_16x16_16x16_16x16x1_16x16x1_1x32x1x8_8_2x1_intrawave_v1,327.06,1670.84,0.0
256,160,20480,1536,ck,14,True,0,16.2875,a8w8_blockscale_bpreshuffle_1x128x128_256x64x128x128_16x16_16x16_8x32x1_8x32x1_1x32x1x8_8_2x1_intrawave_v1,618.04,2348.83,0.0
256,160,24576,1536,ck,14,True,0,21.2778,a8w8_blockscale_bpreshuffle_1x128x128_256x64x128x128_16x16_16x16_8x32x1_8x32x1_1x32x1x8_8_2x1_intrawave_v1,567.71,2155.24,0.0001
256,160,32768,512,ck,9,True,0,12.425,a8w8_blockscale_bpreshuffle_1x128x128_256x32x128x128_16x16_16x16_8x32x1_8x32x1_1x32x1x8_8_2x1_intrawave_v1,432.09,2200.8,0.0004
256,160,32768,1536,ck,14,True,0,23.7699,a8w8_blockscale_bpreshuffle_1x128x128_256x64x128x128_16x16_16x16_8x32x1_8x32x1_1x32x1x8_8_2x1_intrawave_v1,677.58,2568.93,0.0002
256,160,36864,7168,ck,13,True,0,96.5627,a8w8_blockscale_bpreshuffle_1x128x128_256x64x256x128_16x16_16x16_8x32x1_8x32x1_1x32x1x8_8_2x1_intrawave_v1,875.67,2870.51,0.0
256,192,128,7168,ck,7,True,0,13.8323,a8w8_blockscale_bpreshuffle_1x128x128_256x16x64x256_16x16_16x16_16x16x1_16x16x1_1x16x1x16_4_1x1_intrawave_v1,25.47,169.38,0.0
256,192,512,7168,ck,7,True,0,17.5036,a8w8_blockscale_bpreshuffle_1x128x128_256x16x64x256_16x16_16x16_16x16x1_16x16x1_1x16x1x16_4_1x1_intrawave_v1,80.51,299.53,0.0
256,192,1024,7168,ck,7,True,0,18.0291,a8w8_blockscale_bpreshuffle_1x128x128_256x16x64x256_16x16_16x16_16x16x1_16x16x1_1x16x1x16_4_1x1_intrawave_v1,156.33,505.27,0.0
256,192,2112,7168,ck,12,True,0,18.9756,a8w8_blockscale_bpreshuffle_1x128x128_256x32x64x256_16x16_16x16_16x16x1_16x16x1_1x32x1x8_8_2x1_intrawave_v1,306.36,913.07,0.0
256,192,2240,7168,ck,12,True,0,19.0286,a8w8_blockscale_bpreshuffle_1x128x128_256x32x64x256_16x16_16x16_16x16x1_16x16x1_1x32x1x8_8_2x1_intrawave_v1,324.02,961.33,0.0
256,192,3072,1536,ck,12,True,0,7.8349,a8w8_blockscale_bpreshuffle_1x128x128_256x32x64x256_16x16_16x16_16x16x1_16x16x1_1x32x1x8_8_2x1_intrawave_v1,231.27,790.46,0.0
256,192,4096,512,ck,12,True,0,4.951,a8w8_blockscale_bpreshuffle_1x128x128_256x32x64x256_16x16_16x16_16x16x1_16x16x1_1x32x1x8_8_2x1_intrawave_v1,162.66,761.12,0.0
256,192,4096,7168,ck,17,True,0,23.0265,a8w8_blockscale_bpreshuffle_1x128x128_256x64x64x256_16x16_16x16_16x16x1_16x16x1_1x32x1x8_8_2x1_intrawave_v1,489.62,1403.13,0.0
256,192,4608,7168,ck,17,True,0,23.2494,a8w8_blockscale_bpreshuffle_1x128x128_256x64x64x256_16x16_16x16_16x16x1_16x16x1_1x32x1x8_8_2x1_intrawave_v1,545.54,1555.99,0.0
256,192,7168,256,ck,12,True,0,4.9231,a8w8_blockscale_bpreshuffle_1x128x128_256x32x64x256_16x16_16x16_16x16x1_16x16x1_1x32x1x8_8_2x1_intrawave_v1,143.13,941.82,0.0
256,192,7168,512,ck,13,False,0,5.9142,a8w8_blockscale_1x128x128_256x32x64x256_16x16_16x16_2x1_16x16x1_16x16x1_1x32x1x8_8_2x1_intrawave_v1,238.29,1102.57,0.0
256,192,7168,2048,ck,10,True,0,12.5576,a8w8_blockscale_bpreshuffle_1x128x128_256x32x64x128_16x16_16x16_8x32x1_8x32x1_1x32x1x8_8_2x1_intrawave_v1,448.9,1419.52,0.0203
256,192,7168,2304,ck,16,True,0,14.2093,a8w8_blockscale_bpreshuffle_1x128x128_256x64x128x256_16x16_16x16_16x16x1_16x16x1_1x32x1x8_8_2x1_intrawave_v1,446.31,1387.12,0.0
256,192,7168,4096,ck,17,True,0,22.2383,a8w8_blockscale_bpreshuffle_1x128x128_256x64x64x256_16x16_16x16_16x16x1_16x16x1_1x32x1x8_8_2x1_intrawave_v1,506.98,1479.39,0.0
256,192,7168,4608,ck,17,True,0,25.4532,a8w8_blockscale_bpreshuffle_1x128x128_256x64x64x256_16x16_16x16_16x16x1_16x16x1_1x32x1x8_8_2x1_intrawave_v1,498.31,1440.58,0.0
256,192,7168,16384,ck,17,True,0,76.7386,a8w8_blockscale_bpreshuffle_1x128x128_256x64x64x256_16x16_16x16_16x16x1_16x16x1_1x32x1x8_8_2x1_intrawave_v1,587.67,1607.26,0.0
256,192,7168,18432,ck,17,True,0,86.2342,a8w8_blockscale_bpreshuffle_1x128x128_256x64x64x256_16x16_16x16_16x16x1_16x16x1_1x32x1x8_8_2x1_intrawave_v1,588.33,1605.07,0.0
256,192,8192,512,ck,12,True,0,6.3758,a8w8_blockscale_bpreshuffle_1x128x128_256x32x64x256_16x16_16x16_16x16x1_16x16x1_1x32x1x8_8_2x1_intrawave_v1,252.61,1166.65,0.0
256,192,8192,1536,ck,12,True,0,11.0193,a8w8_blockscale_bpreshuffle_1x128x128_256x32x64x256_16x16_16x16_16x16x1_16x16x1_1x32x1x8_8_2x1_intrawave_v1,438.49,1454.14,0.0
256,192,9216,7168,ck,17,True,0,39.7824,a8w8_blockscale_bpreshuffle_1x128x128_256x64x64x256_16x16_16x16_16x16x1_16x16x1_1x32x1x8_8_2x1_intrawave_v1,637.65,1784.09,0.0
256,192,11264,1536,ck,15,True,0,13.6993,a8w8_blockscale_bpreshuffle_1x128x128_256x64x64x128_16x16_16x16_8x32x1_8x32x1_1x32x1x8_8_2x1_intrawave_v1,484.97,1600.21,0.012
256,192,12288,1536,ck,11,True,0,14.6898,a8w8_blockscale_bpreshuffle_1x128x128_256x32x128x256_16x16_16x16_16x16x1_16x16x1_1x32x1x8_8_2x1_intrawave_v1,493.39,1626.15,0.0
256,192,14336,1536,ck,15,True,0,15.5817,a8w8_blockscale_bpreshuffle_1x128x128_256x64x64x128_16x16_16x16_8x32x1_8x32x1_1x32x1x8_8_2x1_intrawave_v1,542.67,1785.43,0.0107
256,192,16384,512,ck,17,True,0,8.2315,a8w8_blockscale_bpreshuffle_1x128x128_256x64x64x256_16x16_16x16_16x16x1_16x16x1_1x32x1x8_8_2x1_intrawave_v1,391.33,1795.34,0.0
256,192,20480,1536,ck,14,True,0,16.6903,a8w8_blockscale_bpreshuffle_1x128x128_256x64x128x128_16x16_16x16_8x32x1_8x32x1_1x32x1x8_8_2x1_intrawave_v1,723.75,2373.62,0.0
256,192,24576,1536,ck,14,True,0,21.5986,a8w8_blockscale_bpreshuffle_1x128x128_256x64x128x128_16x16_16x16_8x32x1_8x32x1_1x32x1x8_8_2x1_intrawave_v1,671.13,2198.33,0.0001
256,192,32768,512,ck,8,True,0,13.6328,a8w8_blockscale_bpreshuffle_1x128x128_256x32x256x128_16x16_16x16_8x32x1_8x32x1_1x32x1x8_8_2x1_intrawave_v1,472.57,2160.85,0.0
256,192,32768,1536,ck,14,True,0,24.3107,a8w8_blockscale_bpreshuffle_1x128x128_256x64x128x128_16x16_16x16_8x32x1_8x32x1_1x32x1x8_8_2x1_intrawave_v1,795.01,2600.07,0.0002
256,192,36864,7168,ck,13,True,0,98.1342,a8w8_blockscale_bpreshuffle_1x128x128_256x64x256x128_16x16_16x16_8x32x1_8x32x1_1x32x1x8_8_2x1_intrawave_v1,1033.98,2850.92,0.0
256,224,128,7168,ck,7,True,0,14.0363,a8w8_blockscale_bpreshuffle_1x128x128_256x16x64x256_16x16_16x16_16x16x1_16x16x1_1x16x1x16_4_1x1_intrawave_v1,29.28,183.84,0.0
256,224,512,7168,ck,7,True,0,17.5856,a8w8_blockscale_bpreshuffle_1x128x128_256x16x64x256_16x16_16x16_16x16x1_16x16x1_1x16x1x16_4_1x1_intrawave_v1,93.5,313.04,0.0
256,224,1024,7168,ck,7,True,0,18.3287,a8w8_blockscale_bpreshuffle_1x128x128_256x16x64x256_16x16_16x16_16x16x1_16x16x1_1x16x1x16_4_1x1_intrawave_v1,179.41,513.1,0.0
256,224,2112,7168,ck,12,True,0,18.8416,a8w8_blockscale_bpreshuffle_1x128x128_256x32x64x256_16x16_16x16_16x16x1_16x16x1_1x32x1x8_8_2x1_intrawave_v1,359.96,938.91,0.0
256,224,2240,7168,ck,12,True,0,19.1493,a8w8_blockscale_bpreshuffle_1x128x128_256x32x64x256_16x16_16x16_16x16x1_16x16x1_1x32x1x8_8_2x1_intrawave_v1,375.64,974.73,0.0
256,224,3072,1536,ck,12,True,0,8.2354,a8w8_blockscale_bpreshuffle_1x128x128_256x32x64x256_16x16_16x16_16x16x1_16x16x1_1x32x1x8_8_2x1_intrawave_v1,256.69,781.86,0.0
256,224,4096,512,ck,11,True,0,5.0753,a8w8_blockscale_bpreshuffle_1x128x128_256x32x128x256_16x16_16x16_16x16x1_16x16x1_1x32x1x8_8_2x1_intrawave_v1,185.12,797.36,0.0
256,224,4096,7168,ck,11,True,0,23.7568,a8w8_blockscale_bpreshuffle_1x128x128_256x32x128x256_16x16_16x16_16x16x1_16x16x1_1x32x1x8_8_2x1_intrawave_v1,553.67,1380.69,0.0
256,224,4608,7168,ck,11,True,0,24.332,a8w8_blockscale_bpreshuffle_1x128x128_256x32x128x256_16x16_16x16_16x16x1_16x16x1_1x32x1x8_8_2x1_intrawave_v1,608.15,1508.31,0.0
256,224,7168,256,ck,12,True,0,5.35,a8w8_blockscale_bpreshuffle_1x128x128_256x32x64x256_16x16_16x16_16x16x1_16x16x1_1x32x1x8_8_2x1_intrawave_v1,153.66,953.95,0.0
256,224,7168,512,ck,11,True,0,6.717,a8w8_blockscale_bpreshuffle_1x128x128_256x32x128x256_16x16_16x16_16x16x1_16x16x1_1x32x1x8_8_2x1_intrawave_v1,244.78,1041.53,0.0
256,224,7168,2048,ck,18,False,0,13.3224,a8w8_blockscale_1x128x128_256x64x64x256_16x16_32x32_1x1_16x16x1_16x16x1_1x32x1x8_8_1x1_intrawave_v1,493.65,1377.39,0.0
256,224,7168,2304,ck,16,True,0,14.3981,a8w8_blockscale_bpreshuffle_1x128x128_256x64x128x256_16x16_16x16_16x16x1_16x16x1_1x32x1x8_8_2x1_intrawave_v1,513.87,1405.91,0.0
256,224,7168,4096,ck,17,True,0,23.2383,a8w8_blockscale_bpreshuffle_1x128x128_256x64x64x256_16x16_16x16_16x16x1_16x16x1_1x32x1x8_8_2x1_intrawave_v1,566.02,1441.11,0.0
256,224,7168,4608,ck,17,True,0,25.7327,a8w8_blockscale_bpreshuffle_1x128x128_256x64x64x256_16x16_16x16_16x16x1_16x16x1_1x32x1x8_8_2x1_intrawave_v1,575.05,1448.49,0.0
256,224,7168,16384,ck,17,True,0,81.6706,a8w8_blockscale_bpreshuffle_1x128x128_256x64x64x256_16x16_16x16_16x16x1_16x16x1_1x32x1x8_8_2x1_intrawave_v1,644.21,1522.23,0.0
256,224,7168,18432,ck,17,True,0,92.2559,a8w8_blockscale_bpreshuffle_1x128x128_256x64x64x256_16x16_16x16_16x16x1_16x16x1_1x32x1x8_8_2x1_intrawave_v1,641.59,1511.67,0.0
256,224,8192,512,ck,18,False,0,6.5453,a8w8_blockscale_1x128x128_256x64x64x256_16x16_32x32_1x1_16x16x1_16x16x1_1x32x1x8_8_1x1_intrawave_v1,287.08,1219.04,0.0
256,224,8192,1536,ck,18,False,0,11.5769,a8w8_blockscale_1x128x128_256x64x64x256_16x16_32x32_1x1_16x16x1_16x16x1_1x32x1x8_8_1x1_intrawave_v1,486.93,1433.63,0.0
256,224,9216,7168,ck,9,True,0,43.1437,a8w8_blockscale_bpreshuffle_1x128x128_256x32x128x128_16x16_16x16_8x32x1_8x32x1_1x32x1x8_8_2x1_intrawave_v1,685.96,1664.08,0.0
256,224,11264,1536,ck,15,True,0,14.688,a8w8_blockscale_bpreshuffle_1x128x128_256x64x64x128_16x16_16x16_8x32x1_8x32x1_1x32x1x8_8_2x1_intrawave_v1,527.71,1544.92,0.0094
256,224,12288,1536,ck,14,True,0,15.3191,a8w8_blockscale_bpreshuffle_1x128x128_256x64x128x128_16x16_16x16_8x32x1_8x32x1_1x32x1x8_8_2x1_intrawave_v1,551.97,1613.9,0.0
256,224,14336,1536,ck,14,True,0,15.6791,a8w8_blockscale_bpreshuffle_1x128x128_256x64x128x128_16x16_16x16_8x32x1_8x32x1_1x32x1x8_8_2x1_intrawave_v1,629.18,1835.99,0.0
256,224,16384,512,ck,16,True,0,9.3718,a8w8_blockscale_bpreshuffle_1x128x128_256x64x128x256_16x16_16x16_16x16x1_16x16x1_1x32x1x8_8_2x1_intrawave_v1,401.0,1690.53,0.0
256,224,20480,1536,ck,14,True,0,21.8266,a8w8_blockscale_bpreshuffle_1x128x128_256x64x128x128_16x16_16x16_8x32x1_8x32x1_1x32x1x8_8_2x1_intrawave_v1,645.67,1877.36,0.0002
256,224,24576,1536,ck,14,True,0,22.9199,a8w8_blockscale_bpreshuffle_1x128x128_256x64x128x128_16x16_16x16_8x32x1_8x32x1_1x32x1x8_8_2x1_intrawave_v1,737.85,2142.37,0.0002
256,224,32768,512,ck,11,True,0,15.0312,a8w8_blockscale_bpreshuffle_1x128x128_256x32x128x256_16x16_16x16_16x16x1_16x16x1_1x32x1x8_8_2x1_intrawave_v1,500.04,2100.43,0.0
256,224,32768,1536,ck,13,True,0,28.5907,a8w8_blockscale_bpreshuffle_1x128x128_256x64x256x128_16x16_16x16_8x32x1_8x32x1_1x32x1x8_8_2x1_intrawave_v1,788.67,2285.91,0.0
256,224,36864,7168,ck,13,True,0,131.1485,a8w8_blockscale_bpreshuffle_1x128x128_256x64x256x128_16x16_16x16_8x32x1_8x32x1_1x32x1x8_8_2x1_intrawave_v1,902.64,2152.99,0.0
256,256,64,7168,ck,7,True,0,12.5467,a8w8_blockscale_bpreshuffle_1x128x128_256x16x64x256_16x16_16x16_16x16x1_16x16x1_1x16x1x16_4_1x1_intrawave_v1,18.72,185.43,0.0
256,256,128,7168,ck,7,True,0,15.6116,a8w8_blockscale_bpreshuffle_1x128x128_256x16x64x256_16x16_16x16_16x16x1_16x16x1_1x16x1x16_4_1x1_intrawave_v1,30.09,180.51,0.0
256,256,512,7168,ck,7,True,0,17.7315,a8w8_blockscale_bpreshuffle_1x128x128_256x16x64x256_16x16_16x16_16x16x1_16x16x1_1x16x1x16_4_1x1_intrawave_v1,105.97,325.25,0.0
256,256,576,7168,ck,7,True,0,17.8682,a8w8_blockscale_bpreshuffle_1x128x128_256x16x64x256_16x16_16x16_16x16x1_16x16x1_1x16x1x16_4_1x1_intrawave_v1,118.31,350.27,0.0
256,256,1024,7168,ck,7,True,0,18.2011,a8w8_blockscale_bpreshuffle_1x128x128_256x16x64x256_16x16_16x16_16x16x1_16x16x1_1x16x1x16_4_1x1_intrawave_v1,206.48,532.9,0.0
256,256,1536,7168,ck,12,True,0,18.69,a8w8_blockscale_bpreshuffle_1x128x128_256x32x64x256_16x16_16x16_16x16x1_16x16x1_1x32x1x8_8_2x1_intrawave_v1,301.61,729.35,0.0
256,256,2112,7168,ck,12,True,0,20.7274,a8w8_blockscale_bpreshuffle_1x128x128_256x32x64x256_16x16_16x16_16x16x1_16x16x1_1x32x1x8_8_2x1_intrawave_v1,373.95,871.08,0.0
256,256,2240,7168,ck,17,True,0,22.2105,a8w8_blockscale_bpreshuffle_1x128x128_256x64x64x256_16x16_16x16_16x16x1_16x16x1_1x32x1x8_8_2x1_intrawave_v1,370.13,857.17,0.0
256,256,3072,1536,ck,12,True,0,8.3182,a8w8_blockscale_bpreshuffle_1x128x128_256x32x64x256_16x16_16x16_16x16x1_16x16x1_1x32x1x8_8_2x1_intrawave_v1,290.44,803.62,0.0
256,256,4096,512,ck,11,True,0,5.0091,a8w8_blockscale_bpreshuffle_1x128x128_256x32x128x256_16x16_16x16_16x16x1_16x16x1_1x32x1x8_8_2x1_intrawave_v1,214.36,863.5,0.0
256,256,4096,7168,ck,17,True,0,23.9232,a8w8_blockscale_bpreshuffle_1x128x128_256x64x64x256_16x16_16x16_16x16x1_16x16x1_1x32x1x8_8_2x1_intrawave_v1,628.36,1391.63,0.0
256,256,4608,7168,ck,17,True,0,34.5297,a8w8_blockscale_bpreshuffle_1x128x128_256x64x64x256_16x16_16x16_16x16x1_16x16x1_1x32x1x8_8_2x1_intrawave_v1,489.76,1078.04,0.0
256,256,7168,256,ck,9,True,0,5.3517,a8w8_blockscale_bpreshuffle_1x128x128_256x32x128x128_16x16_16x16_8x32x1_8x32x1_1x32x1x8_8_2x1_intrawave_v1,175.56,1040.9,0.0
256,256,7168,512,ck,11,True,0,6.6868,a8w8_blockscale_bpreshuffle_1x128x128_256x32x128x256_16x16_16x16_16x16x1_16x16x1_1x32x1x8_8_2x1_intrawave_v1,281.01,1117.29,0.0
256,256,7168,2048,ck,17,True,0,13.4468,a8w8_blockscale_bpreshuffle_1x128x128_256x64x64x256_16x16_16x16_16x16x1_16x16x1_1x32x1x8_8_2x1_intrawave_v1,558.96,1403.63,0.0
256,256,7168,2304,ck,16,True,0,14.4062,a8w8_blockscale_bpreshuffle_1x128x128_256x64x128x256_16x16_16x16_16x16x1_16x16x1_1x32x1x8_8_2x1_intrawave_v1,586.95,1442.08,0.0
256,256,7168,4096,ck,15,True,0,23.0655,a8w8_blockscale_bpreshuffle_1x128x128_256x64x64x128_16x16_16x16_8x32x1_8x32x1_1x32x1x8_8_2x1_intrawave_v1,651.73,1477.48,0.0087
256,256,7168,4608,ck,17,True,0,25.8932,a8w8_blockscale_bpreshuffle_1x128x128_256x64x64x256_16x16_16x16_16x16x1_16x16x1_1x32x1x8_8_2x1_intrawave_v1,653.12,1462.92,0.0
256,256,7168,16384,ck,14,True,0,81.1096,a8w8_blockscale_bpreshuffle_1x128x128_256x64x128x128_16x16_16x16_8x32x1_8x32x1_1x32x1x8_8_2x1_intrawave_v1,741.34,1544.88,0.0
256,256,7168,18432,ck,17,True,0,91.1047,a8w8_blockscale_bpreshuffle_1x128x128_256x64x64x256_16x16_16x16_16x16x1_16x16x1_1x32x1x8_8_2x1_intrawave_v1,742.51,1542.28,0.0
256,256,8192,512,ck,17,True,0,6.884,a8w8_blockscale_bpreshuffle_1x128x128_256x64x64x256_16x16_16x16_16x16x1_16x16x1_1x32x1x8_8_2x1_intrawave_v1,311.95,1237.61,0.0
256,256,8192,1536,ck,17,True,0,11.6511,a8w8_blockscale_bpreshuffle_1x128x128_256x64x64x256_16x16_16x16_16x16x1_16x16x1_1x32x1x8_8_2x1_intrawave_v1,552.95,1473.72,0.0
256,256,9216,7168,ck,13,True,0,50.5901,a8w8_blockscale_bpreshuffle_1x128x128_256x64x256x128_16x16_16x16_8x32x1_8x32x1_1x32x1x8_8_2x1_intrawave_v1,668.57,1435.34,0.0
256,256,11264,1536,ck,15,True,0,15.1241,a8w8_blockscale_bpreshuffle_1x128x128_256x64x64x128_16x16_16x16_8x32x1_8x32x1_1x32x1x8_8_2x1_intrawave_v1,585.71,1551.29,0.0098
256,256,12288,1536,ck,15,True,0,15.3026,a8w8_blockscale_bpreshuffle_1x128x128_256x64x64x128_16x16_16x16_8x32x1_8x32x1_1x32x1x8_8_2x1_intrawave_v1,631.51,1670.24,0.0102
256,256,14336,1536,ck,14,True,0,16.2964,a8w8_blockscale_bpreshuffle_1x128x128_256x64x128x128_16x16_16x16_8x32x1_8x32x1_1x32x1x8_8_2x1_intrawave_v1,691.83,1825.76,0.0
256,256,16384,512,ck,16,True,0,9.305,a8w8_blockscale_bpreshuffle_1x128x128_256x64x128x256_16x16_16x16_16x16x1_16x16x1_1x32x1x8_8_2x1_intrawave_v1,461.58,1817.12,0.0
256,256,20480,1536,ck,14,True,0,22.1152,a8w8_blockscale_bpreshuffle_1x128x128_256x64x128x128_16x16_16x16_8x32x1_8x32x1_1x32x1x8_8_2x1_intrawave_v1,728.28,1914.35,0.0001
256,256,24576,1536,ck,14,True,0,23.0217,a8w8_blockscale_bpreshuffle_1x128x128_256x64x128x128_16x16_16x16_8x32x1_8x32x1_1x32x1x8_8_2x1_intrawave_v1,839.53,2203.35,0.0002
256,256,32768,512,ck,16,True,0,15.7346,a8w8_blockscale_bpreshuffle_1x128x128_256x64x128x256_16x16_16x16_16x16x1_16x16x1_1x32x1x8_8_2x1_intrawave_v1,545.93,2140.86,0.0
256,256,32768,1536,ck,13,True,0,27.0563,a8w8_blockscale_bpreshuffle_1x128x128_256x64x256x128_16x16_16x16_8x32x1_8x32x1_1x32x1x8_8_2x1_intrawave_v1,952.45,2494.87,0.0
256,256,36864,7168,ck,13,True,0,130.4921,a8w8_blockscale_bpreshuffle_1x128x128_256x64x256x128_16x16_16x16_8x32x1_8x32x1_1x32x1x8_8_2x1_intrawave_v1,1036.78,2183.66,0.0
256,288,128,7168,ck,7,True,0,16.2795,a8w8_blockscale_bpreshuffle_1x128x128_256x16x64x256_16x16_16x16_16x16x1_16x16x1_1x16x1x16_4_1x1_intrawave_v1,32.46,187.7,0.0
256,288,512,7168,ck,7,True,0,17.8471,a8w8_blockscale_bpreshuffle_1x128x128_256x16x64x256_16x16_16x16_16x16x1_16x16x1_1x16x1x16_4_1x1_intrawave_v1,118.45,337.83,0.0
256,288,1024,7168,ck,7,True,0,18.4694,a8w8_blockscale_bpreshuffle_1x128x128_256x16x64x256_16x16_16x16_16x16x1_16x16x1_1x16x1x16_4_1x1_intrawave_v1,228.91,541.12,0.0
256,288,2112,7168,ck,12,True,0,20.9224,a8w8_blockscale_bpreshuffle_1x128x128_256x32x64x256_16x16_16x16_16x16x1_16x16x1_1x32x1x8_8_2x1_intrawave_v1,416.78,880.38,0.0
256,288,2240,7168,ck,12,True,0,20.9168,a8w8_blockscale_bpreshuffle_1x128x128_256x32x64x256_16x16_16x16_16x16x1_16x16x1_1x32x1x8_8_2x1_intrawave_v1,442.15,928.01,0.0
256,288,3072,1536,ck,12,True,0,8.5078,a8w8_blockscale_bpreshuffle_1x128x128_256x32x64x256_16x16_16x16_16x16x1_16x16x1_1x32x1x8_8_2x1_intrawave_v1,319.46,814.6,0.0
256,288,4096,512,ck,13,False,0,5.6418,a8w8_blockscale_1x128x128_256x32x64x256_16x16_16x16_2x1_16x16x1_16x16x1_1x32x1x8_8_2x1_intrawave_v1,214.11,816.03,0.0
256,288,4096,7168,ck,10,True,0,33.7239,a8w8_blockscale_bpreshuffle_1x128x128_256x32x64x128_16x16_16x16_8x32x1_8x32x1_1x32x1x8_8_2x1_intrawave_v1,501.47,1001.78,0.0189
256,288,4608,7168,ck,10,True,0,34.7701,a8w8_blockscale_bpreshuffle_1x128x128_256x32x64x128_16x16_16x16_8x32x1_8x32x1_1x32x1x8_8_2x1_intrawave_v1,547.18,1085.67,0.0163
256,288,7168,256,ck,9,True,0,5.5837,a8w8_blockscale_bpreshuffle_1x128x128_256x32x128x128_16x16_16x16_8x32x1_8x32x1_1x32x1x8_8_2x1_intrawave_v1,189.29,1081.27,0.0
256,288,7168,512,ck,13,False,0,6.9456,a8w8_blockscale_1x128x128_256x32x64x256_16x16_16x16_2x1_16x16x1_16x16x1_1x32x1x8_8_2x1_intrawave_v1,304.36,1144.07,0.0
256,288,7168,2048,ck,9,True,0,15.1734,a8w8_blockscale_bpreshuffle_1x128x128_256x32x128x128_16x16_16x16_8x32x1_8x32x1_1x32x1x8_8_2x1_intrawave_v1,557.27,1278.46,0.0
256,288,7168,2304,ck,9,True,0,16.649,a8w8_blockscale_bpreshuffle_1x128x128_256x32x128x128_16x16_16x16_8x32x1_8x32x1_1x32x1x8_8_2x1_intrawave_v1,571.37,1279.8,0.0
256,288,7168,4096,ck,11,True,0,26.9297,a8w8_blockscale_bpreshuffle_1x128x128_256x32x128x256_16x16_16x16_16x16x1_16x16x1_1x32x1x8_8_2x1_intrawave_v1,627.98,1287.37,0.0
256,288,7168,4608,ck,9,True,0,29.7744,a8w8_blockscale_bpreshuffle_1x128x128_256x32x128x128_16x16_16x16_8x32x1_8x32x1_1x32x1x8_8_2x1_intrawave_v1,638.98,1292.59,0.0
256,288,7168,16384,ck,9,True,0,94.9799,a8w8_blockscale_bpreshuffle_1x128x128_256x32x128x128_16x16_16x16_8x32x1_8x32x1_1x32x1x8_8_2x1_intrawave_v1,712.21,1329.63,0.0
256,288,7168,18432,ck,9,True,0,106.5256,a8w8_blockscale_bpreshuffle_1x128x128_256x32x128x128_16x16_16x16_8x32x1_8x32x1_1x32x1x8_8_2x1_intrawave_v1,714.4,1328.86,0.0
256,288,8192,512,ck,12,True,0,8.2003,a8w8_blockscale_bpreshuffle_1x128x128_256x32x64x256_16x16_16x16_16x16x1_16x16x1_1x32x1x8_8_2x1_intrawave_v1,294.61,1104.88,0.0
256,288,8192,1536,ck,15,True,0,14.5176,a8w8_blockscale_bpreshuffle_1x128x128_256x64x64x128_16x16_16x16_8x32x1_8x32x1_1x32x1x8_8_2x1_intrawave_v1,499.24,1222.23,0.0102
256,288,9216,7168,ck,14,True,0,52.4677,a8w8_blockscale_bpreshuffle_1x128x128_256x64x128x128_16x16_16x16_8x32x1_8x32x1_1x32x1x8_8_2x1_intrawave_v1,725.22,1399.59,0.0
256,288,11264,1536,ck,14,True,0,15.7932,a8w8_blockscale_bpreshuffle_1x128x128_256x64x128x128_16x16_16x16_8x32x1_8x32x1_1x32x1x8_8_2x1_intrawave_v1,631.01,1534.33,0.0
256,288,12288,1536,ck,14,True,0,15.9817,a8w8_blockscale_bpreshuffle_1x128x128_256x64x128x128_16x16_16x16_8x32x1_8x32x1_1x32x1x8_8_2x1_intrawave_v1,680.26,1651.55,0.0
256,288,14336,1536,ck,14,True,0,20.7195,a8w8_blockscale_bpreshuffle_1x128x128_256x64x128x128_16x16_16x16_8x32x1_8x32x1_1x32x1x8_8_2x1_intrawave_v1,612.16,1482.66,0.0001
256,288,16384,512,ck,11,True,0,11.5364,a8w8_blockscale_bpreshuffle_1x128x128_256x32x128x256_16x16_16x16_16x16x1_16x16x1_1x32x1x8_8_2x1_intrawave_v1,418.83,1557.96,0.0
256,288,20480,1536,ck,13,True,0,25.2622,a8w8_blockscale_bpreshuffle_1x128x128_256x64x256x128_16x16_16x16_8x32x1_8x32x1_1x32x1x8_8_2x1_intrawave_v1,717.25,1729.7,0.0
256,288,24576,1536,ck,13,True,0,27.4031,a8w8_blockscale_bpreshuffle_1x128x128_256x64x256x128_16x16_16x16_8x32x1_8x32x1_1x32x1x8_8_2x1_intrawave_v1,793.46,1910.25,0.0
256,288,32768,512,ck,16,True,0,18.2787,a8w8_blockscale_bpreshuffle_1x128x128_256x64x128x256_16x16_16x16_16x16x1_16x16x1_1x32x1x8_8_2x1_intrawave_v1,528.69,1958.51,0.0
256,288,32768,1536,ck,14,True,0,37.012,a8w8_blockscale_bpreshuffle_1x128x128_256x64x128x128_16x16_16x16_8x32x1_8x32x1_1x32x1x8_8_2x1_intrawave_v1,783.29,1881.78,0.0002
256,288,36864,7168,ck,13,True,0,160.3655,a8w8_blockscale_bpreshuffle_1x128x128_256x64x256x128_16x16_16x16_8x32x1_8x32x1_1x32x1x8_8_2x1_intrawave_v1,949.1,1793.02,0.0
256,320,128,7168,ck,7,True,0,16.6906,a8w8_blockscale_bpreshuffle_1x128x128_256x16x64x256_16x16_16x16_16x16x1_16x16x1_1x16x1x16_4_1x1_intrawave_v1,35.18,197.31,0.0
256,320,512,7168,ck,7,True,0,17.8167,a8w8_blockscale_bpreshuffle_1x128x128_256x16x64x256_16x16_16x16_16x16x1_16x16x1_1x16x1x16_4_1x1_intrawave_v1,131.83,353.12,0.0
256,320,1024,7168,ck,7,True,0,18.4954,a8w8_blockscale_bpreshuffle_1x128x128_256x16x64x256_16x16_16x16_16x16x1_16x16x1_1x16x1x16_4_1x1_intrawave_v1,253.99,556.31,0.0
256,320,2112,7168,ck,17,True,0,22.326,a8w8_blockscale_bpreshuffle_1x128x128_256x64x64x256_16x16_16x16_16x16x1_16x16x1_1x32x1x8_8_2x1_intrawave_v1,433.97,841.36,0.0
256,320,2240,7168,ck,17,True,0,22.3507,a8w8_blockscale_bpreshuffle_1x128x128_256x64x64x256_16x16_16x16_16x16x1_16x16x1_1x32x1x8_8_2x1_intrawave_v1,459.76,885.15,0.0
256,320,3072,1536,ck,18,False,0,8.1293,a8w8_blockscale_1x128x128_256x64x64x256_16x16_32x32_1x1_16x16x1_16x16x1_1x32x1x8_8_1x1_intrawave_v1,371.48,882.76,0.0
256,320,4096,512,ck,13,False,0,5.5223,a8w8_blockscale_1x128x128_256x32x64x256_16x16_16x16_2x1_16x16x1_16x16x1_1x32x1x8_8_2x1_intrawave_v1,243.05,884.13,0.0
256,320,4096,7168,ck,17,True,0,34.5638,a8w8_blockscale_bpreshuffle_1x128x128_256x64x64x256_16x16_16x16_16x16x1_16x16x1_1x32x1x8_8_2x1_intrawave_v1,543.65,991.65,0.0
256,320,4608,7168,ck,17,True,0,34.4835,a8w8_blockscale_bpreshuffle_1x128x128_256x64x64x256_16x16_16x16_16x16x1_16x16x1_1x32x1x8_8_2x1_intrawave_v1,613.03,1109.89,0.0
256,320,7168,256,ck,12,True,0,6.0015,a8w8_blockscale_bpreshuffle_1x128x128_256x32x64x256_16x16_16x16_16x16x1_16x16x1_1x32x1x8_8_2x1_intrawave_v1,195.69,1083.8,0.0
256,320,7168,512,ck,12,True,0,7.7279,a8w8_blockscale_bpreshuffle_1x128x128_256x32x64x256_16x16_16x16_16x16x1_16x16x1_1x32x1x8_8_2x1_intrawave_v1,303.94,1089.74,0.0
256,320,7168,2048,ck,9,True,0,16.0415,a8w8_blockscale_bpreshuffle_1x128x128_256x32x128x128_16x16_16x16_8x32x1_8x32x1_1x32x1x8_8_2x1_intrawave_v1,585.68,1241.96,0.0001
256,320,7168,2304,ck,14,True,0,18.1546,a8w8_blockscale_bpreshuffle_1x128x128_256x64x128x128_16x16_16x16_8x32x1_8x32x1_1x32x1x8_8_2x1_intrawave_v1,582.2,1202.99,0.0
256,320,7168,4096,ck,14,True,0,28.2141,a8w8_blockscale_bpreshuffle_1x128x128_256x64x128x128_16x16_16x16_8x32x1_8x32x1_1x32x1x8_8_2x1_intrawave_v1,666.0,1249.67,0.0
256,320,7168,4608,ck,14,True,0,31.1499,a8w8_blockscale_bpreshuffle_1x128x128_256x64x128x128_16x16_16x16_8x32x1_8x32x1_1x32x1x8_8_2x1_intrawave_v1,678.63,1254.97,0.0
256,320,7168,16384,ck,14,True,0,95.2247,a8w8_blockscale_bpreshuffle_1x128x128_256x64x128x128_16x16_16x16_8x32x1_8x32x1_1x32x1x8_8_2x1_intrawave_v1,789.31,1336.53,0.0
256,320,7168,18432,ck,14,True,0,106.2104,a8w8_blockscale_bpreshuffle_1x128x128_256x64x128x128_16x16_16x16_8x32x1_8x32x1_1x32x1x8_8_2x1_intrawave_v1,796.13,1342.68,0.0
256,320,8192,512,ck,12,True,0,8.03,a8w8_blockscale_bpreshuffle_1x128x128_256x32x64x256_16x16_16x16_16x16x1_16x16x1_1x32x1x8_8_2x1_intrawave_v1,334.29,1195.64,0.0
256,320,8192,1536,ck,11,True,0,14.6256,a8w8_blockscale_bpreshuffle_1x128x128_256x32x128x256_16x16_16x16_16x16x1_16x16x1_1x32x1x8_8_2x1_intrawave_v1,550.61,1252.41,0.0
256,320,9216,7168,ck,14,True,0,51.8705,a8w8_blockscale_bpreshuffle_1x128x128_256x64x128x128_16x16_16x16_8x32x1_8x32x1_1x32x1x8_8_2x1_intrawave_v1,815.08,1431.49,0.0001
256,320,11264,1536,ck,14,True,0,16.3723,a8w8_blockscale_bpreshuffle_1x128x128_256x64x128x128_16x16_16x16_8x32x1_8x32x1_1x32x1x8_8_2x1_intrawave_v1,676.32,1527.09,0.0
256,320,12288,1536,ck,14,True,0,16.3576,a8w8_blockscale_bpreshuffle_1x128x128_256x64x128x128_16x16_16x16_8x32x1_8x32x1_1x32x1x8_8_2x1_intrawave_v1,738.47,1664.68,0.0
256,320,14336,1536,ck,14,True,0,20.9337,a8w8_blockscale_bpreshuffle_1x128x128_256x64x128x128_16x16_16x16_8x32x1_8x32x1_1x32x1x8_8_2x1_intrawave_v1,673.21,1513.67,0.0001
256,320,16384,512,ck,11,True,0,11.6567,a8w8_blockscale_bpreshuffle_1x128x128_256x32x128x256_16x16_16x16_16x16x1_16x16x1_1x32x1x8_8_2x1_intrawave_v1,460.57,1633.24,0.0
256,320,20480,1536,ck,13,True,0,26.4073,a8w8_blockscale_bpreshuffle_1x128x128_256x64x256x128_16x16_16x16_8x32x1_8x32x1_1x32x1x8_8_2x1_intrawave_v1,762.39,1706.19,0.0
256,320,24576,1536,ck,13,True,0,27.8296,a8w8_blockscale_bpreshuffle_1x128x128_256x64x256x128_16x16_16x16_8x32x1_8x32x1_1x32x1x8_8_2x1_intrawave_v1,868.11,1939.26,0.0
256,320,32768,512,ck,16,True,0,19.0643,a8w8_blockscale_bpreshuffle_1x128x128_256x64x128x256_16x16_16x16_16x16x1_16x16x1_1x32x1x8_8_2x1_intrawave_v1,563.22,1988.67,0.0
256,320,32768,1536,ck,14,True,0,38.5456,a8w8_blockscale_bpreshuffle_1x128x128_256x64x128x128_16x16_16x16_8x32x1_8x32x1_1x32x1x8_8_2x1_intrawave_v1,835.69,1862.59,0.0003
256,320,36864,7168,ck,13,True,0,170.0691,a8w8_blockscale_bpreshuffle_1x128x128_256x64x256x128_16x16_16x16_8x32x1_8x32x1_1x32x1x8_8_2x1_intrawave_v1,994.39,1705.94,0.0
256,352,128,7168,ck,7,True,0,17.0314,a8w8_blockscale_bpreshuffle_1x128x128_256x16x64x256_16x16_16x16_16x16x1_16x16x1_1x16x1x16_4_1x1_intrawave_v1,37.93,207.31,0.0
256,352,512,7168,ck,7,True,0,17.9607,a8w8_blockscale_bpreshuffle_1x128x128_256x16x64x256_16x16_16x16_16x16x1_16x16x1_1x16x1x16_4_1x1_intrawave_v1,143.85,364.89,0.0
256,352,1024,7168,ck,7,True,0,18.7409,a8w8_blockscale_bpreshuffle_1x128x128_256x16x64x256_16x16_16x16_16x16x1_16x16x1_1x16x1x16_4_1x1_intrawave_v1,275.73,564.76,0.0
256,352,2112,7168,ck,17,True,0,23.4253,a8w8_blockscale_bpreshuffle_1x128x128_256x64x64x256_16x16_16x16_16x16x1_16x16x1_1x32x1x8_8_2x1_intrawave_v1,454.97,817.44,0.0
256,352,2240,7168,ck,12,True,0,24.4266,a8w8_blockscale_bpreshuffle_1x128x128_256x32x64x256_16x16_16x16_16x16x1_16x16x1_1x32x1x8_8_2x1_intrawave_v1,462.76,825.18,0.0
256,352,3072,1536,ck,12,True,0,9.2568,a8w8_blockscale_bpreshuffle_1x128x128_256x32x64x256_16x16_16x16_16x16x1_16x16x1_1x32x1x8_8_2x1_intrawave_v1,358.86,801.78,0.0
256,352,4096,512,ck,12,True,0,6.0671,a8w8_blockscale_bpreshuffle_1x128x128_256x32x64x256_16x16_16x16_16x16x1_16x16x1_1x32x1x8_8_2x1_intrawave_v1,243.34,850.65,0.0
256,352,4096,7168,ck,15,True,0,35.0211,a8w8_blockscale_bpreshuffle_1x128x128_256x64x64x128_16x16_16x16_8x32x1_8x32x1_1x32x1x8_8_2x1_intrawave_v1,590.2,992.74,0.0073
256,352,4608,7168,ck,17,True,0,35.332,a8w8_blockscale_bpreshuffle_1x128x128_256x64x64x256_16x16_16x16_16x16x1_16x16x1_1x32x1x8_8_2x1_intrawave_v1,658.13,1098.08,0.0
256,352,7168,256,ck,12,True,0,6.1454,a8w8_blockscale_bpreshuffle_1x128x128_256x32x64x256_16x16_16x16_16x16x1_16x16x1_1x32x1x8_8_2x1_intrawave_v1,210.21,1134.41,0.0
256,352,7168,512,ck,9,True,0,8.0617,a8w8_blockscale_bpreshuffle_1x128x128_256x32x128x128_16x16_16x16_8x32x1_8x32x1_1x32x1x8_8_2x1_intrawave_v1,320.49,1103.55,0.0
256,352,7168,2048,ck,14,True,0,17.2156,a8w8_blockscale_bpreshuffle_1x128x128_256x64x128x128_16x16_16x16_8x32x1_8x32x1_1x32x1x8_8_2x1_intrawave_v1,600.31,1187.72,0.0001
256,352,7168,2304,ck,14,True,0,19.3752,a8w8_blockscale_bpreshuffle_1x128x128_256x64x128x128_16x16_16x16_8x32x1_8x32x1_1x32x1x8_8_2x1_intrawave_v1,600.08,1154.69,0.0001
256,352,7168,4096,ck,14,True,0,29.7697,a8w8_blockscale_bpreshuffle_1x128x128_256x64x128x128_16x16_16x16_8x32x1_8x32x1_1x32x1x8_8_2x1_intrawave_v1,694.31,1204.18,0.0001
256,352,7168,4608,ck,15,True,0,34.2977,a8w8_blockscale_bpreshuffle_1x128x128_256x64x64x128_16x16_16x16_8x32x1_8x32x1_1x32x1x8_8_2x1_intrawave_v1,677.98,1157.47,0.0111
256,352,7168,16384,ck,14,True,0,102.9604,a8w8_blockscale_bpreshuffle_1x128x128_256x64x128x128_16x16_16x16_8x32x1_8x32x1_1x32x1x8_8_2x1_intrawave_v1,803.01,1245.66,0.0
256,352,7168,18432,ck,14,True,0,117.8976,a8w8_blockscale_bpreshuffle_1x128x128_256x64x128x128_16x16_16x16_8x32x1_8x32x1_1x32x1x8_8_2x1_intrawave_v1,788.93,1218.47,0.0
256,352,8192,512,ck,9,True,0,8.4706,a8w8_blockscale_bpreshuffle_1x128x128_256x32x128x128_16x16_16x16_8x32x1_8x32x1_1x32x1x8_8_2x1_intrawave_v1,348.59,1197.28,0.0
256,352,8192,1536,ck,11,True,0,15.1143,a8w8_blockscale_bpreshuffle_1x128x128_256x32x128x256_16x16_16x16_16x16x1_16x16x1_1x32x1x8_8_2x1_intrawave_v1,586.09,1249.86,0.0
256,352,9216,7168,ck,14,True,0,55.5253,a8w8_blockscale_bpreshuffle_1x128x128_256x64x128x128_16x16_16x16_8x32x1_8x32x1_1x32x1x8_8_2x1_intrawave_v1,837.57,1352.02,0.0001
256,352,11264,1536,ck,8,True,0,18.3382,a8w8_blockscale_bpreshuffle_1x128x128_256x32x256x128_16x16_16x16_8x32x1_8x32x1_1x32x1x8_8_2x1_intrawave_v1,664.2,1405.37,0.0
256,352,12288,1536,ck,14,True,0,20.6379,a8w8_blockscale_bpreshuffle_1x128x128_256x64x128x128_16x16_16x16_8x32x1_8x32x1_1x32x1x8_8_2x1_intrawave_v1,643.84,1359.92,0.0001
256,352,14336,1536,ck,14,True,0,22.4463,a8w8_blockscale_bpreshuffle_1x128x128_256x64x128x128_16x16_16x16_8x32x1_8x32x1_1x32x1x8_8_2x1_intrawave_v1,690.63,1454.73,0.0002
256,352,16384,512,ck,11,True,0,12.5158,a8w8_blockscale_bpreshuffle_1x128x128_256x32x128x256_16x16_16x16_16x16x1_16x16x1_1x32x1x8_8_2x1_intrawave_v1,471.85,1606.22,0.0
256,352,20480,1536,ck,13,True,0,26.6747,a8w8_blockscale_bpreshuffle_1x128x128_256x64x256x128_16x16_16x16_8x32x1_8x32x1_1x32x1x8_8_2x1_intrawave_v1,830.22,1740.07,0.0
256,352,24576,1536,ck,14,True,0,33.6368,a8w8_blockscale_bpreshuffle_1x128x128_256x64x128x128_16x16_16x16_8x32x1_8x32x1_1x32x1x8_8_2x1_intrawave_v1,790.06,1652.68,0.0002
256,352,32768,512,ck,16,True,0,21.3507,a8w8_blockscale_bpreshuffle_1x128x128_256x64x128x256_16x16_16x16_16x16x1_16x16x1_1x32x1x8_8_2x1_intrawave_v1,553.2,1874.7,0.0
256,352,32768,1536,ck,13,True,0,42.1004,a8w8_blockscale_bpreshuffle_1x128x128_256x64x256x128_16x16_16x16_8x32x1_8x32x1_1x32x1x8_8_2x1_intrawave_v1,841.64,1756.3,0.0
256,352,36864,7168,ck,13,True,0,176.3847,a8w8_blockscale_bpreshuffle_1x128x128_256x64x256x128_16x16_16x16_8x32x1_8x32x1_1x32x1x8_8_2x1_intrawave_v1,1054.66,1659.53,0.0
256,384,128,7168,ck,7,True,0,17.3611,a8w8_blockscale_bpreshuffle_1x128x128_256x16x64x256_16x16_16x16_16x16x1_16x16x1_1x16x1x16_4_1x1_intrawave_v1,40.59,217.06,0.0
256,384,512,7168,ck,7,True,0,17.9971,a8w8_blockscale_bpreshuffle_1x128x128_256x16x64x256_16x16_16x16_16x16x1_16x16x1_1x16x1x16_4_1x1_intrawave_v1,156.61,378.71,0.0
256,384,1024,7168,ck,7,True,0,19.0459,a8w8_blockscale_bpreshuffle_1x128x128_256x16x64x256_16x16_16x16_16x16x1_16x16x1_1x16x1x16_4_1x1_intrawave_v1,295.98,571.2,0.0
256,384,2112,7168,ck,17,True,0,22.4315,a8w8_blockscale_bpreshuffle_1x128x128_256x64x64x256_16x16_16x16_16x16x1_16x16x1_1x32x1x8_8_2x1_intrawave_v1,518.32,869.91,0.0
256,384,2240,7168,ck,17,True,0,22.9447,a8w8_blockscale_bpreshuffle_1x128x128_256x64x64x256_16x16_16x16_16x16x1_16x16x1_1x32x1x8_8_2x1_intrawave_v1,537.43,894.72,0.0
256,384,3072,1536,ck,12,True,0,9.2395,a8w8_blockscale_bpreshuffle_1x128x128_256x32x64x256_16x16_16x16_16x16x1_16x16x1_1x32x1x8_8_2x1_intrawave_v1,392.22,829.88,0.0
256,384,4096,512,ck,12,True,0,6.1541,a8w8_blockscale_bpreshuffle_1x128x128_256x32x64x256_16x16_16x16_16x16x1_16x16x1_1x32x1x8_8_2x1_intrawave_v1,261.71,883.88,0.0
256,384,4096,7168,ck,17,True,0,34.3034,a8w8_blockscale_bpreshuffle_1x128x128_256x64x64x256_16x16_16x16_16x16x1_16x16x1_1x32x1x8_8_2x1_intrawave_v1,657.33,1027.84,0.0
256,384,4608,7168,ck,17,True,0,35.4196,a8w8_blockscale_bpreshuffle_1x128x128_256x64x64x256_16x16_16x16_16x16x1_16x16x1_1x32x1x8_8_2x1_intrawave_v1,716.19,1110.16,0.0
256,384,7168,256,ck,12,True,0,6.4926,a8w8_blockscale_bpreshuffle_1x128x128_256x32x64x256_16x16_16x16_16x16x1_16x16x1_1x32x1x8_8_2x1_intrawave_v1,217.06,1145.66,0.0
256,384,7168,512,ck,11,True,0,8.2123,a8w8_blockscale_bpreshuffle_1x128x128_256x32x128x256_16x16_16x16_16x16x1_16x16x1_1x32x1x8_8_2x1_intrawave_v1,343.21,1141.17,0.0
256,384,7168,2048,ck,14,True,0,17.1374,a8w8_blockscale_bpreshuffle_1x128x128_256x64x128x128_16x16_16x16_8x32x1_8x32x1_1x32x1x8_8_2x1_intrawave_v1,657.88,1223.73,0.0001
256,384,7168,2304,ck,14,True,0,19.4683,a8w8_blockscale_bpreshuffle_1x128x128_256x64x128x128_16x16_16x16_8x32x1_8x32x1_1x32x1x8_8_2x1_intrawave_v1,651.5,1176.52,0.0
256,384,7168,4096,ck,14,True,0,29.9402,a8w8_blockscale_bpreshuffle_1x128x128_256x64x128x128_16x16_16x16_8x32x1_8x32x1_1x32x1x8_8_2x1_intrawave_v1,753.12,1217.03,0.0001
256,384,7168,4608,ck,14,True,0,33.6211,a8w8_blockscale_bpreshuffle_1x128x128_256x64x128x128_16x16_16x16_8x32x1_8x32x1_1x32x1x8_8_2x1_intrawave_v1,754.5,1198.79,0.0001
256,384,7168,16384,ck,14,True,0,103.788,a8w8_blockscale_bpreshuffle_1x128x128_256x64x128x128_16x16_16x16_8x32x1_8x32x1_1x32x1x8_8_2x1_intrawave_v1,869.02,1245.2,0.0
256,384,7168,18432,ck,14,True,0,116.8,a8w8_blockscale_bpreshuffle_1x128x128_256x64x128x128_16x16_16x16_8x32x1_8x32x1_1x32x1x8_8_2x1_intrawave_v1,868.74,1238.9,0.0
256,384,8192,512,ck,17,True,0,8.1302,a8w8_blockscale_bpreshuffle_1x128x128_256x64x64x256_16x16_16x16_16x16x1_16x16x1_1x32x1x8_8_2x1_intrawave_v1,396.2,1313.91,0.0
256,384,8192,1536,ck,11,True,0,15.1441,a8w8_blockscale_bpreshuffle_1x128x128_256x32x128x256_16x16_16x16_16x16x1_16x16x1_1x32x1x8_8_2x1_intrawave_v1,638.11,1285.27,0.0
256,384,9216,7168,ck,14,True,0,55.6177,a8w8_blockscale_bpreshuffle_1x128x128_256x64x128x128_16x16_16x16_8x32x1_8x32x1_1x32x1x8_8_2x1_intrawave_v1,912.2,1364.51,0.0001
256,384,11264,1536,ck,14,True,0,19.8139,a8w8_blockscale_bpreshuffle_1x128x128_256x64x128x128_16x16_16x16_8x32x1_8x32x1_1x32x1x8_8_2x1_intrawave_v1,670.62,1339.57,0.0
256,384,12288,1536,ck,14,True,0,20.5735,a8w8_blockscale_bpreshuffle_1x128x128_256x64x128x128_16x16_16x16_8x32x1_8x32x1_1x32x1x8_8_2x1_intrawave_v1,704.57,1404.79,0.0001
256,384,14336,1536,ck,14,True,0,21.2406,a8w8_blockscale_bpreshuffle_1x128x128_256x64x128x128_16x16_16x16_8x32x1_8x32x1_1x32x1x8_8_2x1_intrawave_v1,796.18,1582.82,0.0001
256,384,16384,512,ck,16,True,0,12.6684,a8w8_blockscale_bpreshuffle_1x128x128_256x64x128x256_16x16_16x16_16x16x1_16x16x1_1x32x1x8_8_2x1_intrawave_v1,508.54,1670.94,0.0
256,384,20480,1536,ck,13,True,0,26.6319,a8w8_blockscale_bpreshuffle_1x128x128_256x64x256x128_16x16_16x16_8x32x1_8x32x1_1x32x1x8_8_2x1_intrawave_v1,907.15,1793.93,0.0
256,384,24576,1536,ck,13,True,0,34.4128,a8w8_blockscale_bpreshuffle_1x128x128_256x64x256x128_16x16_16x16_8x32x1_8x32x1_1x32x1x8_8_2x1_intrawave_v1,842.45,1662.55,0.0
256,384,32768,512,ck,16,True,0,21.6088,a8w8_blockscale_bpreshuffle_1x128x128_256x64x128x256_16x16_16x16_16x16x1_16x16x1_1x32x1x8_8_2x1_intrawave_v1,596.28,1950.12,0.0
256,384,32768,1536,ck,13,True,0,41.499,a8w8_blockscale_bpreshuffle_1x128x128_256x64x256x128_16x16_16x16_8x32x1_8x32x1_1x32x1x8_8_2x1_intrawave_v1,931.46,1833.47,0.0
256,384,36864,7168,ck,13,True,0,179.6594,a8w8_blockscale_bpreshuffle_1x128x128_256x64x256x128_16x16_16x16_8x32x1_8x32x1_1x32x1x8_8_2x1_intrawave_v1,1129.57,1643.69,0.0
256,416,128,7168,ck,7,True,0,17.4577,a8w8_blockscale_bpreshuffle_1x128x128_256x16x64x256_16x16_16x16_16x16x1_16x16x1_1x16x1x16_4_1x1_intrawave_v1,43.73,229.46,0.0
256,416,512,7168,ck,7,True,0,17.9273,a8w8_blockscale_bpreshuffle_1x128x128_256x16x64x256_16x16_16x16_16x16x1_16x16x1_1x16x1x16_4_1x1_intrawave_v1,170.32,394.81,0.0
256,416,1024,7168,ck,7,True,0,19.1847,a8w8_blockscale_bpreshuffle_1x128x128_256x16x64x256_16x16_16x16_16x16x1_16x16x1_1x16x1x16_4_1x1_intrawave_v1,318.32,582.44,0.0
256,416,2112,7168,ck,17,True,0,23.8866,a8w8_blockscale_bpreshuffle_1x128x128_256x64x64x256_16x16_16x16_16x16x1_16x16x1_1x32x1x8_8_2x1_intrawave_v1,527.3,832.18,0.0
256,416,2240,7168,ck,17,True,0,24.3615,a8w8_blockscale_bpreshuffle_1x128x128_256x64x64x256_16x16_16x16_16x16x1_16x16x1_1x32x1x8_8_2x1_intrawave_v1,548.36,857.99,0.0
256,416,3072,1536,ck,10,True,0,10.6762,a8w8_blockscale_bpreshuffle_1x128x128_256x32x64x128_16x16_16x16_8x32x1_8x32x1_1x32x1x8_8_2x1_intrawave_v1,367.72,741.23,0.0216
256,416,4096,512,ck,11,True,0,6.6062,a8w8_blockscale_bpreshuffle_1x128x128_256x32x128x256_16x16_16x16_16x16x1_16x16x1_1x32x1x8_8_2x1_intrawave_v1,264.12,865.55,0.0
256,416,4096,7168,ck,14,True,0,38.2392,a8w8_blockscale_bpreshuffle_1x128x128_256x64x128x128_16x16_16x16_8x32x1_8x32x1_1x32x1x8_8_2x1_intrawave_v1,638.81,934.9,0.0
256,416,4608,7168,ck,11,True,0,39.0192,a8w8_blockscale_bpreshuffle_1x128x128_256x32x128x256_16x16_16x16_16x16x1_16x16x1_1x32x1x8_8_2x1_intrawave_v1,704.3,1021.19,0.0
256,416,7168,256,ck,13,False,0,6.5969,a8w8_blockscale_1x128x128_256x32x64x256_16x16_16x16_2x1_16x16x1_16x16x1_1x32x1x8_8_2x1_intrawave_v1,231.43,1198.33,0.0
256,416,7168,512,ck,9,True,0,8.4395,a8w8_blockscale_bpreshuffle_1x128x128_256x32x128x128_16x16_16x16_8x32x1_8x32x1_1x32x1x8_8_2x1_intrawave_v1,361.81,1166.75,0.0
256,416,7168,2048,ck,14,True,0,17.7278,a8w8_blockscale_bpreshuffle_1x128x128_256x64x128x128_16x16_16x16_8x32x1_8x32x1_1x32x1x8_8_2x1_intrawave_v1,688.96,1212.55,0.0001
256,416,7168,2304,ck,14,True,0,19.7625,a8w8_blockscale_bpreshuffle_1x128x128_256x64x128x128_16x16_16x16_8x32x1_8x32x1_1x32x1x8_8_2x1_intrawave_v1,695.28,1185.95,0.0
256,416,7168,4096,ck,14,True,0,31.7256,a8w8_blockscale_bpreshuffle_1x128x128_256x64x128x128_16x16_16x16_8x32x1_8x32x1_1x32x1x8_8_2x1_intrawave_v1,769.97,1167.13,0.0001
256,416,7168,4608,ck,14,True,0,34.6196,a8w8_blockscale_bpreshuffle_1x128x128_256x64x128x128_16x16_16x16_8x32x1_8x32x1_1x32x1x8_8_2x1_intrawave_v1,793.8,1181.73,0.0001
256,416,7168,16384,ck,14,True,0,111.0408,a8w8_blockscale_bpreshuffle_1x128x128_256x64x128x128_16x16_16x16_8x32x1_8x32x1_1x32x1x8_8_2x1_intrawave_v1,879.95,1172.72,0.0001
256,416,7168,18432,ck,13,True,0,121.5951,a8w8_blockscale_bpreshuffle_1x128x128_256x64x256x128_16x16_16x16_8x32x1_8x32x1_1x32x1x8_8_2x1_intrawave_v1,904.02,1198.67,0.0
256,416,8192,512,ck,1,True,0,9.2584,a8w8_blockscale_bpreshuffle_1x128x128_256x64x128x128_16x16_16x16_8x32x1_8x32x1_1x32x1x8_8_2x1_intrawave_v3,376.92,1212.2,0.0007
256,416,8192,1536,ck,14,True,0,16.0742,a8w8_blockscale_bpreshuffle_1x128x128_256x64x128x128_16x16_16x16_8x32x1_8x32x1_1x32x1x8_8_2x1_intrawave_v1,651.29,1246.57,0.0
256,416,9216,7168,ck,13,True,0,59.0749,a8w8_blockscale_bpreshuffle_1x128x128_256x64x256x128_16x16_16x16_8x32x1_8x32x1_1x32x1x8_8_2x1_intrawave_v1,930.38,1298.52,0.0
256,416,11264,1536,ck,14,True,0,20.574,a8w8_blockscale_bpreshuffle_1x128x128_256x64x128x128_16x16_16x16_8x32x1_8x32x1_1x32x1x8_8_2x1_intrawave_v1,699.66,1327.51,0.0002
256,416,12288,1536,ck,14,True,0,22.0791,a8w8_blockscale_bpreshuffle_1x128x128_256x64x128x128_16x16_16x16_8x32x1_8x32x1_1x32x1x8_8_2x1_intrawave_v1,711.24,1346.84,0.0002
256,416,14336,1536,ck,13,True,0,25.1927,a8w8_blockscale_bpreshuffle_1x128x128_256x64x256x128_16x16_16x16_8x32x1_8x32x1_1x32x1x8_8_2x1_intrawave_v1,727.22,1372.88,0.0
256,416,16384,512,ck,11,True,0,14.2607,a8w8_blockscale_bpreshuffle_1x128x128_256x32x128x256_16x16_16x16_16x16x1_16x16x1_1x32x1x8_8_2x1_intrawave_v1,489.41,1559.05,0.0
256,416,20480,1536,ck,14,True,0,33.4116,a8w8_blockscale_bpreshuffle_1x128x128_256x64x128x128_16x16_16x16_8x32x1_8x32x1_1x32x1x8_8_2x1_intrawave_v1,783.33,1470.62,0.0002
256,416,24576,1536,ck,13,True,0,40.126,a8w8_blockscale_bpreshuffle_1x128x128_256x64x256x128_16x16_16x16_8x32x1_8x32x1_1x32x1x8_8_2x1_intrawave_v1,782.71,1466.25,0.0
256,416,32768,512,ck,16,True,0,23.8605,a8w8_blockscale_bpreshuffle_1x128x128_256x64x128x256_16x16_16x16_16x16x1_16x16x1_1x32x1x8_8_2x1_intrawave_v1,585.01,1854.66,0.0
256,416,32768,1536,ck,13,True,0,50.6189,a8w8_blockscale_bpreshuffle_1x128x128_256x64x256x128_16x16_16x16_8x32x1_8x32x1_1x32x1x8_8_2x1_intrawave_v1,827.28,1545.54,0.0
256,416,36864,7168,ck,13,True,0,190.6524,a8w8_blockscale_bpreshuffle_1x128x128_256x64x256x128_16x16_16x16_8x32x1_8x32x1_1x32x1x8_8_2x1_intrawave_v1,1153.14,1562.5,0.0
256,448,128,7168,ck,7,True,0,17.4962,a8w8_blockscale_bpreshuffle_1x128x128_256x16x64x256_16x16_16x16_16x16x1_16x16x1_1x16x1x16_4_1x1_intrawave_v1,46.99,242.54,0.0
256,448,512,7168,ck,7,True,0,18.1255,a8w8_blockscale_bpreshuffle_1x128x128_256x16x64x256_16x16_16x16_16x16x1_16x16x1_1x16x1x16_4_1x1_intrawave_v1,181.42,404.96,0.0
256,448,1024,7168,ck,12,True,0,19.4876,a8w8_blockscale_bpreshuffle_1x128x128_256x32x64x256_16x16_16x16_16x16x1_16x16x1_1x32x1x8_8_2x1_intrawave_v1,337.48,588.52,0.0
256,448,2112,7168,ck,17,True,0,22.614,a8w8_blockscale_bpreshuffle_1x128x128_256x64x64x256_16x16_16x16_16x16x1_16x16x1_1x32x1x8_8_2x1_intrawave_v1,599.82,895.13,0.0
256,448,2240,7168,ck,17,True,0,23.8583,a8w8_blockscale_bpreshuffle_1x128x128_256x64x64x256_16x16_16x16_16x16x1_16x16x1_1x32x1x8_8_2x1_intrawave_v1,603.0,891.71,0.0
256,448,3072,1536,ck,18,False,0,10.8484,a8w8_blockscale_1x128x128_256x64x64x256_16x16_32x32_1x1_16x16x1_16x16x1_1x32x1x8_8_1x1_intrawave_v1,389.72,752.11,0.0
256,448,4096,512,ck,18,False,0,6.313,a8w8_blockscale_1x128x128_256x64x64x256_16x16_32x32_1x1_16x16x1_16x16x1_1x32x1x8_8_1x1_intrawave_v1,297.65,949.87,0.0
256,448,4096,7168,ck,15,True,0,36.5521,a8w8_blockscale_bpreshuffle_1x128x128_256x64x64x128_16x16_16x16_8x32x1_8x32x1_1x32x1x8_8_2x1_intrawave_v1,719.7,991.5,0.008
256,448,4608,7168,ck,14,True,0,39.0964,a8w8_blockscale_bpreshuffle_1x128x128_256x64x128x128_16x16_16x16_8x32x1_8x32x1_1x32x1x8_8_2x1_intrawave_v1,756.98,1032.58,0.0
256,448,7168,256,ck,12,True,0,7.017,a8w8_blockscale_bpreshuffle_1x128x128_256x32x64x256_16x16_16x16_16x16x1_16x16x1_1x32x1x8_8_2x1_intrawave_v1,234.31,1193.13,0.0
256,448,7168,512,ck,11,True,0,9.1118,a8w8_blockscale_bpreshuffle_1x128x128_256x32x128x256_16x16_16x16_16x16x1_16x16x1_1x32x1x8_8_2x1_intrawave_v1,360.89,1132.81,0.0
256,448,7168,2048,ck,14,True,0,17.7209,a8w8_blockscale_bpreshuffle_1x128x128_256x64x128x128_16x16_16x16_8x32x1_8x32x1_1x32x1x8_8_2x1_intrawave_v1,742.25,1242.61,0.0001
256,448,7168,2304,ck,14,True,0,20.669,a8w8_blockscale_bpreshuffle_1x128x128_256x64x128x128_16x16_16x16_8x32x1_8x32x1_1x32x1x8_8_2x1_intrawave_v1,715.93,1159.7,0.0
256,448,7168,4096,ck,14,True,0,30.86,a8w8_blockscale_bpreshuffle_1x128x128_256x64x128x128_16x16_16x16_8x32x1_8x32x1_1x32x1x8_8_2x1_intrawave_v1,852.45,1218.98,0.0001
256,448,7168,4608,ck,14,True,0,34.8188,a8w8_blockscale_bpreshuffle_1x128x128_256x64x128x128_16x16_16x16_8x32x1_8x32x1_1x32x1x8_8_2x1_intrawave_v1,849.97,1192.37,0.0001
256,448,7168,16384,ck,14,True,0,107.692,a8w8_blockscale_bpreshuffle_1x128x128_256x64x128x128_16x16_16x16_8x32x1_8x32x1_1x32x1x8_8_2x1_intrawave_v1,977.11,1218.32,0.0
256,448,7168,18432,ck,13,True,0,120.3229,a8w8_blockscale_bpreshuffle_1x128x128_256x64x256x128_16x16_16x16_8x32x1_8x32x1_1x32x1x8_8_2x1_intrawave_v1,983.85,1220.06,0.0
256,448,8192,512,ck,14,True,0,9.2353,a8w8_blockscale_bpreshuffle_1x128x128_256x64x128x128_16x16_16x16_8x32x1_8x32x1_1x32x1x8_8_2x1_intrawave_v1,406.93,1273.78,0.0
256,448,8192,1536,ck,14,True,0,15.8526,a8w8_blockscale_bpreshuffle_1x128x128_256x64x128x128_16x16_16x16_8x32x1_8x32x1_1x32x1x8_8_2x1_intrawave_v1,711.19,1300.17,0.0
256,448,9216,7168,ck,13,True,0,57.8461,a8w8_blockscale_bpreshuffle_1x128x128_256x64x256x128_16x16_16x16_8x32x1_8x32x1_1x32x1x8_8_2x1_intrawave_v1,1023.23,1340.26,0.0
256,448,11264,1536,ck,14,True,0,21.105,a8w8_blockscale_bpreshuffle_1x128x128_256x64x128x128_16x16_16x16_8x32x1_8x32x1_1x32x1x8_8_2x1_intrawave_v1,734.52,1330.59,0.0001
256,448,12288,1536,ck,14,True,0,21.5227,a8w8_blockscale_bpreshuffle_1x128x128_256x64x128x128_16x16_16x16_8x32x1_8x32x1_1x32x1x8_8_2x1_intrawave_v1,785.75,1420.48,0.0001
256,448,14336,1536,ck,13,True,0,25.3787,a8w8_blockscale_bpreshuffle_1x128x128_256x64x256x128_16x16_16x16_8x32x1_8x32x1_1x32x1x8_8_2x1_intrawave_v1,777.42,1400.91,0.0
256,448,16384,512,ck,11,True,0,14.4152,a8w8_blockscale_bpreshuffle_1x128x128_256x32x128x256_16x16_16x16_16x16x1_16x16x1_1x32x1x8_8_2x1_intrawave_v1,521.41,1616.21,0.0
256,448,20480,1536,ck,14,True,0,33.058,a8w8_blockscale_bpreshuffle_1x128x128_256x64x128x128_16x16_16x16_8x32x1_8x32x1_1x32x1x8_8_2x1_intrawave_v1,852.61,1527.48,0.0002
256,448,24576,1536,ck,13,True,0,39.8476,a8w8_blockscale_bpreshuffle_1x128x128_256x64x256x128_16x16_16x16_8x32x1_8x32x1_1x32x1x8_8_2x1_intrawave_v1,848.81,1517.2,0.0
256,448,32768,512,ck,16,True,0,24.0225,a8w8_blockscale_bpreshuffle_1x128x128_256x64x128x256_16x16_16x16_16x16x1_16x16x1_1x32x1x8_8_2x1_intrawave_v1,625.76,1930.14,0.0
256,448,32768,1536,ck,14,True,0,48.7441,a8w8_blockscale_bpreshuffle_1x128x128_256x64x128x128_16x16_16x16_8x32x1_8x32x1_1x32x1x8_8_2x1_intrawave_v1,925.18,1649.02,0.0003
256,448,36864,7168,ck,13,True,0,191.1383,a8w8_blockscale_bpreshuffle_1x128x128_256x64x256x128_16x16_16x16_8x32x1_8x32x1_1x32x1x8_8_2x1_intrawave_v1,1238.68,1572.07,0.0
256,480,128,7168,ck,7,True,0,17.5549,a8w8_blockscale_bpreshuffle_1x128x128_256x16x64x256_16x16_16x16_16x16x1_16x16x1_1x16x1x16_4_1x1_intrawave_v1,50.17,255.26,0.0
256,480,512,7168,ck,7,True,0,18.0007,a8w8_blockscale_bpreshuffle_1x128x128_256x16x64x256_16x16_16x16_16x16x1_16x16x1_1x16x1x16_4_1x1_intrawave_v1,195.73,422.33,0.0
256,480,1024,7168,ck,12,True,0,19.2022,a8w8_blockscale_bpreshuffle_1x128x128_256x32x64x256_16x16_16x16_16x16x1_16x16x1_1x32x1x8_8_2x1_intrawave_v1,366.96,612.62,0.0
256,480,2112,7168,ck,12,True,0,26.4916,a8w8_blockscale_bpreshuffle_1x128x128_256x32x64x256_16x16_16x16_16x16x1_16x16x1_1x32x1x8_8_2x1_intrawave_v1,548.6,777.87,0.0
256,480,2240,7168,ck,10,True,0,31.6473,a8w8_blockscale_bpreshuffle_1x128x128_256x32x64x128_16x16_16x16_8x32x1_8x32x1_1x32x1x8_8_2x1_intrawave_v1,487.06,684.02,0.0213
256,480,3072,1536,ck,10,True,0,11.115,a8w8_blockscale_bpreshuffle_1x128x128_256x32x64x128_16x16_16x16_8x32x1_8x32x1_1x32x1x8_8_2x1_intrawave_v1,407.54,756.18,0.0216
256,480,4096,512,ck,11,True,0,6.7291,a8w8_blockscale_bpreshuffle_1x128x128_256x32x128x256_16x16_16x16_16x16x1_16x16x1_1x32x1x8_8_2x1_intrawave_v1,299.19,932.53,0.0
256,480,4096,7168,ck,15,True,0,39.332,a8w8_blockscale_bpreshuffle_1x128x128_256x64x64x128_16x16_16x16_8x32x1_8x32x1_1x32x1x8_8_2x1_intrawave_v1,716.61,933.92,0.0089
256,480,4608,7168,ck,9,True,0,49.1001,a8w8_blockscale_bpreshuffle_1x128x128_256x32x128x128_16x16_16x16_8x32x1_8x32x1_1x32x1x8_8_2x1_intrawave_v1,645.8,832.88,0.0001
256,480,7168,256,ck,12,True,0,7.0844,a8w8_blockscale_bpreshuffle_1x128x128_256x32x64x256_16x16_16x16_16x16x1_16x16x1_1x32x1x8_8_2x1_intrawave_v1,248.66,1247.69,0.0
256,480,7168,512,ck,16,True,0,9.4007,a8w8_blockscale_bpreshuffle_1x128x128_256x64x128x256_16x16_16x16_16x16x1_16x16x1_1x32x1x8_8_2x1_intrawave_v1,374.78,1148.54,0.0
256,480,7168,2048,ck,14,True,0,18.6659,a8w8_blockscale_bpreshuffle_1x128x128_256x64x128x128_16x16_16x16_8x32x1_8x32x1_1x32x1x8_8_2x1_intrawave_v1,755.01,1207.78,0.0002
256,480,7168,2304,ck,14,True,0,20.4308,a8w8_blockscale_bpreshuffle_1x128x128_256x64x128x128_16x16_16x16_8x32x1_8x32x1_1x32x1x8_8_2x1_intrawave_v1,776.01,1199.28,0.0001
256,480,7168,4096,ck,13,True,0,33.771,a8w8_blockscale_bpreshuffle_1x128x128_256x64x256x128_16x16_16x16_8x32x1_8x32x1_1x32x1x8_8_2x1_intrawave_v1,834.61,1131.37,0.0
256,480,7168,4608,ck,13,True,0,35.1654,a8w8_blockscale_bpreshuffle_1x128x128_256x64x256x128_16x16_16x16_8x32x1_8x32x1_1x32x1x8_8_2x1_intrawave_v1,901.71,1197.86,0.0
256,480,7168,16384,ck,14,True,0,114.8698,a8w8_blockscale_bpreshuffle_1x128x128_256x64x128x128_16x16_16x16_8x32x1_8x32x1_1x32x1x8_8_2x1_intrawave_v1,981.48,1150.75,0.0001
256,480,7168,18432,ck,13,True,0,126.8077,a8w8_blockscale_bpreshuffle_1x128x128_256x64x256x128_16x16_16x16_8x32x1_8x32x1_1x32x1x8_8_2x1_intrawave_v1,1000.22,1165.93,0.0
256,480,8192,512,ck,14,True,0,9.1232,a8w8_blockscale_bpreshuffle_1x128x128_256x64x128x128_16x16_16x16_8x32x1_8x32x1_1x32x1x8_8_2x1_intrawave_v1,441.35,1348.69,0.0
256,480,8192,1536,ck,14,True,0,16.0262,a8w8_blockscale_bpreshuffle_1x128x128_256x64x128x128_16x16_16x16_8x32x1_8x32x1_1x32x1x8_8_2x1_intrawave_v1,753.74,1321.87,0.0001
256,480,9216,7168,ck,14,True,0,75.4241,a8w8_blockscale_bpreshuffle_1x128x128_256x64x128x128_16x16_16x16_8x32x1_8x32x1_1x32x1x8_8_2x1_intrawave_v1,840.82,1038.77,0.0002
256,480,11264,1536,ck,14,True,0,21.7599,a8w8_blockscale_bpreshuffle_1x128x128_256x64x128x128_16x16_16x16_8x32x1_8x32x1_1x32x1x8_8_2x1_intrawave_v1,763.31,1325.94,0.0002
256,480,12288,1536,ck,14,True,0,21.7915,a8w8_blockscale_bpreshuffle_1x128x128_256x64x128x128_16x16_16x16_8x32x1_8x32x1_1x32x1x8_8_2x1_intrawave_v1,831.49,1441.3,0.0002
256,480,14336,1536,ck,13,True,0,25.9318,a8w8_blockscale_bpreshuffle_1x128x128_256x64x256x128_16x16_16x16_8x32x1_8x32x1_1x32x1x8_8_2x1_intrawave_v1,815.19,1408.31,0.0
256,480,16384,512,ck,8,True,0,15.5361,a8w8_blockscale_bpreshuffle_1x128x128_256x32x256x128_16x16_16x16_8x32x1_8x32x1_1x32x1x8_8_2x1_intrawave_v1,518.35,1568.15,0.0
256,480,20480,1536,ck,14,True,0,34.2792,a8w8_blockscale_bpreshuffle_1x128x128_256x64x128x128_16x16_16x16_8x32x1_8x32x1_1x32x1x8_8_2x1_intrawave_v1,880.97,1512.74,0.0003
256,480,24576,1536,ck,13,True,0,41.7424,a8w8_blockscale_bpreshuffle_1x128x128_256x64x256x128_16x16_16x16_8x32x1_8x32x1_1x32x1x8_8_2x1_intrawave_v1,868.15,1487.19,0.0
256,480,32768,512,ck,16,True,0,28.0204,a8w8_blockscale_bpreshuffle_1x128x128_256x64x128x256_16x16_16x16_16x16x1_16x16x1_1x32x1x8_8_2x1_intrawave_v1,574.8,1730.18,0.0
256,480,32768,1536,ck,13,True,0,54.5313,a8w8_blockscale_bpreshuffle_1x128x128_256x64x256x128_16x16_16x16_8x32x1_8x32x1_1x32x1x8_8_2x1_intrawave_v1,886.07,1513.37,0.0
256,480,36864,7168,ck,13,True,0,214.474,a8w8_blockscale_bpreshuffle_1x128x128_256x64x256x128_16x16_16x16_8x32x1_8x32x1_1x32x1x8_8_2x1_intrawave_v1,1182.76,1413.09,0.0
256,512,64,7168,ck,7,True,0,17.0375,a8w8_blockscale_bpreshuffle_1x128x128_256x16x64x256_16x16_16x16_16x16x1_16x16x1_1x16x1x16_4_1x1_intrawave_v1,27.57,246.18,0.0
256,512,128,7168,ck,7,True,0,17.6153,a8w8_blockscale_bpreshuffle_1x128x128_256x16x64x256_16x16_16x16_16x16x1_16x16x1_1x16x1x16_4_1x1_intrawave_v1,53.34,267.87,0.0
256,512,512,7168,ck,7,True,0,18.1199,a8w8_blockscale_bpreshuffle_1x128x128_256x16x64x256_16x16_16x16_16x16x1_16x16x1_1x16x1x16_4_1x1_intrawave_v1,207.4,434.02,0.0
256,512,576,7168,ck,12,True,0,19.0516,a8w8_blockscale_bpreshuffle_1x128x128_256x32x64x256_16x16_16x16_16x16x1_16x16x1_1x32x1x8_8_2x1_intrawave_v1,221.92,440.31,0.0
256,512,1024,7168,ck,12,True,0,19.0855,a8w8_blockscale_bpreshuffle_1x128x128_256x32x64x256_16x16_16x16_16x16x1_16x16x1_1x32x1x8_8_2x1_intrawave_v1,393.82,631.82,0.0
256,512,1536,7168,ck,17,True,0,22.2181,a8w8_blockscale_bpreshuffle_1x128x128_256x64x64x256_16x16_16x16_16x16x1_16x16x1_1x32x1x8_8_2x1_intrawave_v1,507.44,731.52,0.0
256,512,2112,7168,ck,17,True,0,29.7023,a8w8_blockscale_bpreshuffle_1x128x128_256x64x64x256_16x16_16x16_16x16x1_16x16x1_1x32x1x8_8_2x1_intrawave_v1,521.92,706.06,0.0
256,512,2240,7168,ck,15,True,0,33.0136,a8w8_blockscale_bpreshuffle_1x128x128_256x64x64x128_16x16_16x16_8x32x1_8x32x1_1x32x1x8_8_2x1_intrawave_v1,498.03,667.0,0.0077
256,512,3072,1536,ck,12,True,0,11.0189,a8w8_blockscale_bpreshuffle_1x128x128_256x32x64x256_16x16_16x16_16x16x1_16x16x1_1x32x1x8_8_2x1_intrawave_v1,438.5,785.08,0.0
256,512,4096,512,ck,17,True,0,6.7309,a8w8_blockscale_bpreshuffle_1x128x128_256x64x64x256_16x16_16x16_16x16x1_16x16x1_1x32x1x8_8_2x1_intrawave_v1,319.05,973.66,0.0
256,512,4096,7168,ck,14,True,0,38.9288,a8w8_blockscale_bpreshuffle_1x128x128_256x64x128x128_16x16_16x16_8x32x1_8x32x1_1x32x1x8_8_2x1_intrawave_v1,772.3,956.22,0.0
256,512,4608,7168,ck,14,True,0,46.6871,a8w8_blockscale_bpreshuffle_1x128x128_256x64x128x128_16x16_16x16_8x32x1_8x32x1_1x32x1x8_8_2x1_intrawave_v1,724.46,887.16,0.0
256,512,7168,256,ck,12,True,0,7.1399,a8w8_blockscale_bpreshuffle_1x128x128_256x32x64x256_16x16_16x16_16x16x1_16x16x1_1x32x1x8_8_2x1_intrawave_v1,263.18,1303.4,0.0
256,512,7168,512,ck,16,True,0,9.3009,a8w8_blockscale_bpreshuffle_1x128x128_256x64x128x256_16x16_16x16_16x16x1_16x16x1_1x32x1x8_8_2x1_intrawave_v1,404.06,1211.95,0.0
256,512,7168,2048,ck,14,True,0,18.8511,a8w8_blockscale_bpreshuffle_1x128x128_256x64x128x128_16x16_16x16_8x32x1_8x32x1_1x32x1x8_8_2x1_intrawave_v1,797.43,1223.73,0.0002
256,512,7168,2304,ck,14,True,0,20.8258,a8w8_blockscale_bpreshuffle_1x128x128_256x64x128x128_16x16_16x16_8x32x1_8x32x1_1x32x1x8_8_2x1_intrawave_v1,812.04,1202.1,0.0001
256,512,7168,4096,ck,14,True,0,33.284,a8w8_blockscale_bpreshuffle_1x128x128_256x64x128x128_16x16_16x16_8x32x1_8x32x1_1x32x1x8_8_2x1_intrawave_v1,903.28,1165.64,0.0001
256,512,7168,4608,ck,13,True,0,35.007,a8w8_blockscale_bpreshuffle_1x128x128_256x64x256x128_16x16_16x16_8x32x1_8x32x1_1x32x1x8_8_2x1_intrawave_v1,966.17,1220.6,0.0
256,512,7168,16384,ck,14,True,0,114.3188,a8w8_blockscale_bpreshuffle_1x128x128_256x64x128x128_16x16_16x16_8x32x1_8x32x1_1x32x1x8_8_2x1_intrawave_v1,1051.96,1164.89,0.0001
256,512,7168,18432,ck,13,True,0,122.6997,a8w8_blockscale_bpreshuffle_1x128x128_256x64x256x128_16x16_16x16_8x32x1_8x32x1_1x32x1x8_8_2x1_intrawave_v1,1102.62,1213.51,0.0
256,512,8192,512,ck,16,True,0,9.1958,a8w8_blockscale_bpreshuffle_1x128x128_256x64x128x256_16x16_16x16_16x16x1_16x16x1_1x32x1x8_8_2x1_intrawave_v1,467.06,1396.84,0.0
256,512,8192,1536,ck,14,True,0,16.4575,a8w8_blockscale_bpreshuffle_1x128x128_256x64x128x128_16x16_16x16_8x32x1_8x32x1_1x32x1x8_8_2x1_intrawave_v1,782.92,1322.07,0.0
256,512,9216,7168,ck,14,True,0,77.1035,a8w8_blockscale_bpreshuffle_1x128x128_256x64x128x128_16x16_16x16_8x32x1_8x32x1_1x32x1x8_8_2x1_intrawave_v1,877.34,1026.77,0.0001
256,512,11264,1536,ck,14,True,0,21.4346,a8w8_blockscale_bpreshuffle_1x128x128_256x64x128x128_16x16_16x16_8x32x1_8x32x1_1x32x1x8_8_2x1_intrawave_v1,826.55,1381.98,0.0002
256,512,12288,1536,ck,14,True,0,21.9955,a8w8_blockscale_bpreshuffle_1x128x128_256x64x128x128_16x16_16x16_8x32x1_8x32x1_1x32x1x8_8_2x1_intrawave_v1,878.7,1465.92,0.0003
256,512,14336,1536,ck,13,True,0,25.4872,a8w8_blockscale_bpreshuffle_1x128x128_256x64x256x128_16x16_16x16_8x32x1_8x32x1_1x32x1x8_8_2x1_intrawave_v1,884.7,1470.8,0.0
256,512,16384,512,ck,16,True,0,15.7842,a8w8_blockscale_bpreshuffle_1x128x128_256x64x128x256_16x16_16x16_16x16x1_16x16x1_1x32x1x8_8_2x1_intrawave_v1,544.21,1610.98,0.0
256,512,20480,1536,ck,14,True,0,35.0036,a8w8_blockscale_bpreshuffle_1x128x128_256x64x128x128_16x16_16x16_8x32x1_8x32x1_1x32x1x8_8_2x1_intrawave_v1,920.26,1520.28,0.0003
256,512,24576,1536,ck,13,True,0,40.5996,a8w8_blockscale_bpreshuffle_1x128x128_256x64x256x128_16x16_16x16_8x32x1_8x32x1_1x32x1x8_8_2x1_intrawave_v1,952.1,1569.01,0.0
256,512,32768,512,ck,16,True,0,28.2992,a8w8_blockscale_bpreshuffle_1x128x128_256x64x128x256_16x16_16x16_16x16x1_16x16x1_1x32x1x8_8_2x1_intrawave_v1,607.08,1787.82,0.0
256,512,32768,1536,ck,13,True,0,52.0969,a8w8_blockscale_bpreshuffle_1x128x128_256x64x256x128_16x16_16x16_8x32x1_8x32x1_1x32x1x8_8_2x1_intrawave_v1,989.3,1625.29,0.0
256,512,36864,7168,ck,13,True,0,211.2567,a8w8_blockscale_bpreshuffle_1x128x128_256x64x256x128_16x16_16x16_8x32x1_8x32x1_1x32x1x8_8_2x1_intrawave_v1,1280.83,1446.86,0.0
256,1024,64,7168,ck,7,True,0,17.3687,a8w8_blockscale_bpreshuffle_1x128x128_256x16x64x256_16x16_16x16_16x16x1_16x16x1_1x16x1x16_4_1x1_intrawave_v1,54.09,456.56,0.0
256,1024,128,7168,ck,7,True,0,17.6427,a8w8_blockscale_bpreshuffle_1x128x128_256x16x64x256_16x16_16x16_16x16x1_16x16x1_1x16x1x16_4_1x1_intrawave_v1,106.51,482.9,0.0
256,1024,512,7168,ck,12,True,0,19.3918,a8w8_blockscale_bpreshuffle_1x128x128_256x32x64x256_16x16_16x16_16x16x1_16x16x1_1x32x1x8_8_2x1_intrawave_v1,387.6,621.84,0.0
256,1024,576,7168,ck,17,True,0,22.2024,a8w8_blockscale_bpreshuffle_1x128x128_256x64x64x256_16x16_16x16_16x16x1_16x16x1_1x32x1x8_8_2x1_intrawave_v1,380.85,569.69,0.0
256,1024,1024,7168,ck,17,True,0,23.1599,a8w8_blockscale_bpreshuffle_1x128x128_256x64x64x256_16x16_16x16_16x16x1_16x16x1_1x32x1x8_8_2x1_intrawave_v1,649.07,724.41,0.0
256,1024,1536,7168,ck,18,False,0,35.1877,a8w8_blockscale_1x128x128_256x64x64x256_16x16_32x32_1x1_16x16x1_16x16x1_1x32x1x8_8_1x1_intrawave_v1,640.81,610.89,0.0
256,1024,2112,7168,ck,15,True,0,46.2529,a8w8_blockscale_bpreshuffle_1x128x128_256x64x64x128_16x16_16x16_8x32x1_8x32x1_1x32x1x8_8_2x1_intrawave_v1,670.32,579.51,0.0092
256,1024,2240,7168,ck,15,True,0,49.7345,a8w8_blockscale_bpreshuffle_1x128x128_256x64x64x128_16x16_16x16_8x32x1_8x32x1_1x32x1x8_8_2x1_intrawave_v1,661.18,562.67,0.0094
256,1024,3072,1536,ck,15,True,0,14.9878,a8w8_blockscale_bpreshuffle_1x128x128_256x64x64x128_16x16_16x16_8x32x1_8x32x1_1x32x1x8_8_2x1_intrawave_v1,644.77,839.54,0.0107
256,1024,4096,512,ck,16,True,0,9.0852,a8w8_blockscale_bpreshuffle_1x128x128_256x64x128x256_16x16_16x16_16x16x1_16x16x1_1x32x1x8_8_2x1_intrawave_v1,472.74,1211.87,0.0
256,1024,4096,7168,ck,14,True,0,56.2229,a8w8_blockscale_bpreshuffle_1x128x128_256x64x128x128_16x16_16x16_8x32x1_8x32x1_1x32x1x8_8_2x1_intrawave_v1,1069.48,801.96,0.0001
256,1024,4608,7168,ck,14,True,0,74.5438,a8w8_blockscale_bpreshuffle_1x128x128_256x64x128x128_16x16_16x16_8x32x1_8x32x1_1x32x1x8_8_2x1_intrawave_v1,907.46,668.16,0.0001
256,1024,7168,256,ck,9,True,0,10.7681,a8w8_blockscale_bpreshuffle_1x128x128_256x32x128x128_16x16_16x16_8x32x1_8x32x1_1x32x1x8_8_2x1_intrawave_v1,349.0,1558.05,0.0
256,1024,7168,512,ck,16,True,0,14.7966,a8w8_blockscale_bpreshuffle_1x128x128_256x64x128x256_16x16_16x16_16x16x1_16x16x1_1x32x1x8_8_2x1_intrawave_v1,507.97,1275.59,0.0
256,1024,7168,2048,ck,13,True,0,30.4947,a8w8_blockscale_bpreshuffle_1x128x128_256x64x256x128_16x16_16x16_8x32x1_8x32x1_1x32x1x8_8_2x1_intrawave_v1,985.9,1031.57,0.0
256,1024,7168,2304,ck,13,True,0,33.1888,a8w8_blockscale_bpreshuffle_1x128x128_256x64x256x128_16x16_16x16_8x32x1_8x32x1_1x32x1x8_8_2x1_intrawave_v1,1019.1,1011.02,0.0
256,1024,7168,4096,ck,13,True,0,55.0669,a8w8_blockscale_bpreshuffle_1x128x128_256x64x256x128_16x16_16x16_8x32x1_8x32x1_1x32x1x8_8_2x1_intrawave_v1,1091.94,875.93,0.0
256,1024,7168,4608,ck,13,True,0,59.9458,a8w8_blockscale_bpreshuffle_1x128x128_256x64x256x128_16x16_16x16_8x32x1_8x32x1_1x32x1x8_8_2x1_intrawave_v1,1128.45,874.6,0.0
256,1024,7168,16384,ck,13,True,0,188.236,a8w8_blockscale_bpreshuffle_1x128x128_256x64x256x128_16x16_16x16_8x32x1_8x32x1_1x32x1x8_8_2x1_intrawave_v1,1277.75,791.02,0.0
256,1024,7168,18432,ck,13,True,0,206.9924,a8w8_blockscale_bpreshuffle_1x128x128_256x64x256x128_16x16_16x16_8x32x1_8x32x1_1x32x1x8_8_2x1_intrawave_v1,1307.21,800.39,0.0
256,1024,8192,512,ck,16,True,0,15.4506,a8w8_blockscale_bpreshuffle_1x128x128_256x64x128x256_16x16_16x16_16x16x1_16x16x1_1x32x1x8_8_2x1_intrawave_v1,555.96,1391.26,0.0
256,1024,8192,1536,ck,13,True,0,26.44,a8w8_blockscale_bpreshuffle_1x128x128_256x64x256x128_16x16_16x16_8x32x1_8x32x1_1x32x1x8_8_2x1_intrawave_v1,974.65,1169.93,0.0
256,1024,9216,7168,ck,13,True,0,125.0914,a8w8_blockscale_bpreshuffle_1x128x128_256x64x256x128_16x16_16x16_8x32x1_8x32x1_1x32x1x8_8_2x1_intrawave_v1,1081.54,737.66,0.0
256,1024,11264,1536,ck,13,True,0,39.5332,a8w8_blockscale_bpreshuffle_1x128x128_256x64x256x128_16x16_16x16_8x32x1_8x32x1_1x32x1x8_8_2x1_intrawave_v1,896.3,1060.96,0.0
256,1024,12288,1536,ck,13,True,0,40.9196,a8w8_blockscale_bpreshuffle_1x128x128_256x64x256x128_16x16_16x16_8x32x1_8x32x1_1x32x1x8_8_2x1_intrawave_v1,944.65,1114.7,0.0
256,1024,14336,1536,ck,13,True,0,48.9205,a8w8_blockscale_bpreshuffle_1x128x128_256x64x256x128_16x16_16x16_8x32x1_8x32x1_1x32x1x8_8_2x1_intrawave_v1,921.85,1082.43,0.0
256,1024,16384,512,ck,16,True,0,27.4764,a8w8_blockscale_bpreshuffle_1x128x128_256x64x128x256_16x16_16x16_16x16x1_16x16x1_1x32x1x8_8_2x1_intrawave_v1,625.26,1545.59,0.0
256,1024,20480,1536,ck,13,True,0,64.1062,a8w8_blockscale_bpreshuffle_1x128x128_256x64x256x128_16x16_16x16_8x32x1_8x32x1_1x32x1x8_8_2x1_intrawave_v1,1004.97,1169.52,0.0
256,1024,24576,1536,ck,13,True,0,75.7578,a8w8_blockscale_bpreshuffle_1x128x128_256x64x256x128_16x16_16x16_8x32x1_8x32x1_1x32x1x8_8_2x1_intrawave_v1,1020.48,1183.42,0.0
256,1024,32768,512,ck,16,True,0,52.5805,a8w8_blockscale_bpreshuffle_1x128x128_256x64x128x256_16x16_16x16_16x16x1_16x16x1_1x32x1x8_8_2x1_intrawave_v1,653.47,1605.35,0.0
256,1024,32768,1536,ck,13,True,0,98.4418,a8w8_blockscale_bpreshuffle_1x128x128_256x64x256x128_16x16_16x16_8x32x1_8x32x1_1x32x1x8_8_2x1_intrawave_v1,1047.11,1208.97,0.0
256,1024,36864,7168,ck,13,True,0,375.7986,a8w8_blockscale_bpreshuffle_1x128x128_256x64x256x128_16x16_16x16_8x32x1_8x32x1_1x32x1x8_8_2x1_intrawave_v1,1440.04,923.58,0.0
256,1536,512,7168,ck,17,True,0,22.6184,a8w8_blockscale_bpreshuffle_1x128x128_256x64x64x256_16x16_16x16_16x16x1_16x16x1_1x32x1x8_8_2x1_intrawave_v1,498.46,718.57,0.0
256,1536,576,7168,ck,17,True,0,23.4548,a8w8_blockscale_bpreshuffle_1x128x128_256x64x64x256_16x16_16x16_16x16x1_16x16x1_1x32x1x8_8_2x1_intrawave_v1,540.77,720.89,0.0
256,1536,1536,7168,ck,14,True,0,43.0461,a8w8_blockscale_bpreshuffle_1x128x128_256x64x128x128_16x16_16x16_8x32x1_8x32x1_1x32x1x8_8_2x1_intrawave_v1,785.74,621.16,0.0
256,1536,3072,1536,ck,14,True,0,20.09,a8w8_blockscale_bpreshuffle_1x128x128_256x64x128x128_16x16_16x16_8x32x1_8x32x1_1x32x1x8_8_2x1_intrawave_v1,721.53,822.05,0.0001
256,1536,4096,512,ck,11,True,0,12.3437,a8w8_blockscale_bpreshuffle_1x128x128_256x32x128x256_16x16_16x16_16x16x1_16x16x1_1x32x1x8_8_2x1_intrawave_v1,521.92,1252.99,0.0
256,1536,4608,7168,ck,13,True,0,88.6959,a8w8_blockscale_bpreshuffle_1x128x128_256x64x256x128_16x16_16x16_8x32x1_8x32x1_1x32x1x8_8_2x1_intrawave_v1,1144.01,656.13,0.0
256,1536,7168,256,ck,9,True,0,13.7448,a8w8_blockscale_bpreshuffle_1x128x128_256x32x128x128_16x16_16x16_8x32x1_8x32x1_1x32x1x8_8_2x1_intrawave_v1,410.13,1764.18,0.0
256,1536,7168,2048,ck,13,True,0,44.0549,a8w8_blockscale_bpreshuffle_1x128x128_256x64x256x128_16x16_16x16_8x32x1_8x32x1_1x32x1x8_8_2x1_intrawave_v1,1023.66,904.46,0.0
256,1536,7168,2304,ck,13,True,0,48.3473,a8w8_blockscale_bpreshuffle_1x128x128_256x64x256x128_16x16_16x16_8x32x1_8x32x1_1x32x1x8_8_2x1_intrawave_v1,1049.37,870.25,0.0
256,2048,64,7168,ck,7,True,0,16.7697,a8w8_blockscale_bpreshuffle_1x128x128_256x16x64x256_16x16_16x16_16x16x1_16x16x1_1x16x1x16_4_1x1_intrawave_v1,112.05,918.38,0.0
256,2048,128,7168,ck,7,True,0,17.2874,a8w8_blockscale_bpreshuffle_1x128x128_256x16x64x256_16x16_16x16_16x16x1_16x16x1_1x16x1x16_4_1x1_intrawave_v1,217.39,932.58,0.0
256,2048,512,7168,ck,17,True,0,23.0923,a8w8_blockscale_bpreshuffle_1x128x128_256x64x64x256_16x16_16x16_16x16x1_16x16x1_1x32x1x8_8_2x1_intrawave_v1,650.97,885.46,0.0
256,2048,576,7168,ck,17,True,0,32.9097,a8w8_blockscale_bpreshuffle_1x128x128_256x64x64x256_16x16_16x16_16x16x1_16x16x1_1x32x1x8_8_2x1_intrawave_v1,513.87,643.22,0.0
256,2048,1024,7168,ck,15,True,0,39.21,a8w8_blockscale_bpreshuffle_1x128x128_256x64x64x128_16x16_16x16_8x32x1_8x32x1_1x32x1x8_8_2x1_intrawave_v1,766.76,668.56,0.0062
256,2048,1536,7168,ck,13,True,0,51.1209,a8w8_blockscale_bpreshuffle_1x128x128_256x64x256x128_16x16_16x16_8x32x1_8x32x1_1x32x1x8_8_2x1_intrawave_v1,882.17,625.61,0.0
256,2048,2112,7168,ck,15,True,0,83.1007,a8w8_blockscale_bpreshuffle_1x128x128_256x64x64x128_16x16_16x16_8x32x1_8x32x1_1x32x1x8_8_2x1_intrawave_v1,746.19,462.93,0.0128
256,2048,2240,7168,ck,17,True,0,86.4003,a8w8_blockscale_bpreshuffle_1x128x128_256x64x64x256_16x16_16x16_16x16x1_16x16x1_1x32x1x8_8_2x1_intrawave_v1,761.19,461.94,0.0
256,2048,3072,1536,ck,14,True,0,22.1631,a8w8_blockscale_bpreshuffle_1x128x128_256x64x128x128_16x16_16x16_8x32x1_8x32x1_1x32x1x8_8_2x1_intrawave_v1,872.05,922.58,0.0002
256,2048,4096,512,ck,16,True,0,15.4446,a8w8_blockscale_bpreshuffle_1x128x128_256x64x128x256_16x16_16x16_16x16x1_16x16x1_1x32x1x8_8_2x1_intrawave_v1,556.18,1289.96,0.0
256,2048,4096,7168,ck,13,True,0,94.241,a8w8_blockscale_bpreshuffle_1x128x128_256x64x256x128_16x16_16x16_8x32x1_8x32x1_1x32x1x8_8_2x1_intrawave_v1,1276.08,645.34,0.0
256,2048,4608,7168,ck,13,True,0,124.6677,a8w8_blockscale_bpreshuffle_1x128x128_256x64x256x128_16x16_16x16_8x32x1_8x32x1_1x32x1x8_8_2x1_intrawave_v1,1085.22,534.1,0.0
256,2048,7168,256,ck,9,True,0,16.5221,a8w8_blockscale_bpreshuffle_1x128x128_256x32x128x128_16x16_16x16_8x32x1_8x32x1_1x32x1x8_8_2x1_intrawave_v1,454.92,1919.82,0.0
256,2048,7168,512,ck,16,True,0,24.5739,a8w8_blockscale_bpreshuffle_1x128x128_256x64x128x256_16x16_16x16_16x16x1_16x16x1_1x32x1x8_8_2x1_intrawave_v1,611.72,1386.79,0.0
256,2048,7168,2048,ck,13,True,0,57.5653,a8w8_blockscale_bpreshuffle_1x128x128_256x64x256x128_16x16_16x16_8x32x1_8x32x1_1x32x1x8_8_2x1_intrawave_v1,1044.54,837.91,0.0
256,2048,7168,2304,ck,13,True,0,64.239,a8w8_blockscale_bpreshuffle_1x128x128_256x64x256x128_16x16_16x16_8x32x1_8x32x1_1x32x1x8_8_2x1_intrawave_v1,1053.03,787.59,0.0
256,2048,7168,4096,ck,13,True,0,102.1224,a8w8_blockscale_bpreshuffle_1x128x128_256x64x256x128_16x16_16x16_8x32x1_8x32x1_1x32x1x8_8_2x1_intrawave_v1,1177.6,657.14,0.0
256,2048,7168,4608,ck,13,True,0,112.7313,a8w8_blockscale_bpreshuffle_1x128x128_256x64x256x128_16x16_16x16_8x32x1_8x32x1_1x32x1x8_8_2x1_intrawave_v1,1200.12,637.16,0.0
256,2048,7168,16384,ck,13,True,0,346.2227,a8w8_blockscale_bpreshuffle_1x128x128_256x64x256x128_16x16_16x16_8x32x1_8x32x1_1x32x1x8_8_2x1_intrawave_v1,1389.38,520.92,0.0
256,2048,7168,18432,ck,13,True,0,387.1187,a8w8_blockscale_bpreshuffle_1x128x128_256x64x256x128_16x16_16x16_8x32x1_8x32x1_1x32x1x8_8_2x1_intrawave_v1,1397.93,514.65,0.0
256,2048,8192,512,ck,16,True,0,27.6024,a8w8_blockscale_bpreshuffle_1x128x128_256x64x128x256_16x16_16x16_16x16x1_16x16x1_1x32x1x8_8_2x1_intrawave_v1,622.4,1405.58,0.0
256,2048,8192,1536,ck,13,True,0,51.0289,a8w8_blockscale_bpreshuffle_1x128x128_256x64x256x128_16x16_16x16_8x32x1_8x32x1_1x32x1x8_8_2x1_intrawave_v1,1010.01,965.79,0.0
256,2048,9216,7168,ck,13,True,0,206.9826,a8w8_blockscale_bpreshuffle_1x128x128_256x64x256x128_16x16_16x16_8x32x1_8x32x1_1x32x1x8_8_2x1_intrawave_v1,1307.27,572.46,0.0
256,2048,11264,1536,ck,13,True,0,71.9306,a8w8_blockscale_bpreshuffle_1x128x128_256x64x256x128_16x16_16x16_8x32x1_8x32x1_1x32x1x8_8_2x1_intrawave_v1,985.21,925.68,0.0
256,2048,12288,1536,ck,13,True,0,75.0286,a8w8_blockscale_bpreshuffle_1x128x128_256x64x256x128_16x16_16x16_8x32x1_8x32x1_1x32x1x8_8_2x1_intrawave_v1,1030.4,964.32,0.0
256,2048,14336,1536,ck,13,True,0,85.7983,a8w8_blockscale_bpreshuffle_1x128x128_256x64x256x128_16x16_16x16_8x32x1_8x32x1_1x32x1x8_8_2x1_intrawave_v1,1051.24,977.71,0.0
256,2048,16384,512,ck,16,True,0,51.5381,a8w8_blockscale_bpreshuffle_1x128x128_256x64x128x256_16x16_16x16_16x16x1_16x16x1_1x32x1x8_8_2x1_intrawave_v1,666.69,1485.23,0.0
256,2048,20480,1536,ck,13,True,0,120.3768,a8w8_blockscale_bpreshuffle_1x128x128_256x64x256x128_16x16_16x16_8x32x1_8x32x1_1x32x1x8_8_2x1_intrawave_v1,1070.38,984.32,0.0
256,2048,24576,1536,ck,13,True,0,139.5488,a8w8_blockscale_bpreshuffle_1x128x128_256x64x256x128_16x16_16x16_8x32x1_8x32x1_1x32x1x8_8_2x1_intrawave_v1,1107.99,1014.4,0.0
256,2048,32768,512,ck,16,True,0,96.3468,a8w8_blockscale_bpreshuffle_1x128x128_256x64x128x256_16x16_16x16_16x16x1_16x16x1_1x32x1x8_8_2x1_intrawave_v1,713.25,1578.09,0.0
256,2048,32768,1536,ck,13,True,0,183.2077,a8w8_blockscale_bpreshuffle_1x128x128_256x64x256x128_16x16_16x16_8x32x1_8x32x1_1x32x1x8_8_2x1_intrawave_v1,1125.27,1024.49,0.0
256,2048,36864,7168,ck,13,True,0,722.2518,a8w8_blockscale_bpreshuffle_1x128x128_256x64x256x128_16x16_16x16_8x32x1_8x32x1_1x32x1x8_8_2x1_intrawave_v1,1498.55,595.24,0.0
256,4096,64,7168,ck,7,True,0,17.6182,a8w8_blockscale_bpreshuffle_1x128x128_256x16x64x256_16x16_16x16_16x16x1_16x16x1_1x16x1x16_4_1x1_intrawave_v1,213.31,1722.26,0.0
256,4096,128,7168,ck,12,True,0,19.2623,a8w8_blockscale_bpreshuffle_1x128x128_256x32x64x256_16x16_16x16_16x16x1_16x16x1_1x32x1x8_8_2x1_intrawave_v1,390.2,1626.3,0.0
256,4096,512,7168,ck,14,True,0,38.3567,a8w8_blockscale_bpreshuffle_1x128x128_256x64x128x128_16x16_16x16_8x32x1_8x32x1_1x32x1x8_8_2x1_intrawave_v1,783.82,970.48,0.0
256,4096,576,7168,ck,15,True,0,49.2169,a8w8_blockscale_bpreshuffle_1x128x128_256x64x64x128_16x16_16x16_8x32x1_8x32x1_1x32x1x8_8_2x1_intrawave_v1,687.22,776.31,0.0118
256,4096,1024,7168,ck,13,True,0,54.9137,a8w8_blockscale_bpreshuffle_1x128x128_256x64x256x128_16x16_16x16_8x32x1_8x32x1_1x32x1x8_8_2x1_intrawave_v1,1094.98,821.08,0.0
256,4096,1536,7168,ck,13,True,0,82.0635,a8w8_blockscale_bpreshuffle_1x128x128_256x64x256x128_16x16_16x16_8x32x1_8x32x1_1x32x1x8_8_2x1_intrawave_v1,1099.08,645.27,0.0
256,4096,2112,7168,ck,0,False,0,142.9991,a8w8_blockscale_1x128x128_256x128x128x128_16x16_32x32_2x2_8x32x1_8x32x1_1x32x1x8_8_1x1_intrawave_v3,867.26,432.17,0.0
256,4096,2240,7168,ck,0,False,0,145.6221,a8w8_blockscale_1x128x128_256x128x128x128_16x16_32x32_2x2_8x32x1_8x32x1_1x32x1x8_8_1x1_intrawave_v3,903.25,437.89,0.0
256,4096,3072,1536,ck,13,True,0,38.1936,a8w8_blockscale_bpreshuffle_1x128x128_256x64x256x128_16x16_16x16_8x32x1_8x32x1_1x32x1x8_8_2x1_intrawave_v1,1012.07,947.17,0.0
256,4096,4096,512,ck,16,True,0,26.4897,a8w8_blockscale_bpreshuffle_1x128x128_256x64x128x256_16x16_16x16_16x16x1_16x16x1_1x32x1x8_8_2x1_intrawave_v1,648.55,1425.03,0.0
256,4096,4096,7168,ck,13,True,0,178.7626,a8w8_blockscale_bpreshuffle_1x128x128_256x64x256x128_16x16_16x16_8x32x1_8x32x1_1x32x1x8_8_2x1_intrawave_v1,1345.46,516.19,0.0
256,4096,4608,7168,ck,13,True,0,202.4146,a8w8_blockscale_bpreshuffle_1x128x128_256x64x256x128_16x16_16x16_8x32x1_8x32x1_1x32x1x8_8_2x1_intrawave_v1,1336.78,494.72,0.0
256,4096,7168,256,ck,8,True,0,29.4172,a8w8_blockscale_bpreshuffle_1x128x128_256x32x256x128_16x16_16x16_8x32x1_8x32x1_1x32x1x8_8_2x1_intrawave_v1,511.01,2094.14,0.0
256,4096,7168,512,ck,13,True,0,45.2241,a8w8_blockscale_bpreshuffle_1x128x128_256x64x256x128_16x16_16x16_8x32x1_8x32x1_1x32x1x8_8_2x1_intrawave_v1,664.8,1425.95,0.0
256,4096,7168,2048,ck,13,True,0,104.4884,a8w8_blockscale_bpreshuffle_1x128x128_256x64x256x128_16x16_16x16_8x32x1_8x32x1_1x32x1x8_8_2x1_intrawave_v1,1150.93,782.76,0.0
256,4096,7168,2304,ck,13,True,0,117.0643,a8w8_blockscale_bpreshuffle_1x128x128_256x64x256x128_16x16_16x16_8x32x1_8x32x1_1x32x1x8_8_2x1_intrawave_v1,1155.7,723.3,0.0
256,4096,7168,4096,ck,13,True,0,178.5565,a8w8_blockscale_bpreshuffle_1x128x128_256x64x256x128_16x16_16x16_8x32x1_8x32x1_1x32x1x8_8_2x1_intrawave_v1,1347.01,587.25,0.0
256,4096,7168,4608,ck,13,True,0,198.451,a8w8_blockscale_bpreshuffle_1x128x128_256x64x256x128_16x16_16x16_8x32x1_8x32x1_1x32x1x8_8_2x1_intrawave_v1,1363.47,557.44,0.0
256,4096,7168,16384,ck,13,True,0,627.8415,a8w8_blockscale_bpreshuffle_1x128x128_256x64x256x128_16x16_16x16_8x32x1_8x32x1_1x32x1x8_8_2x1_intrawave_v1,1532.35,387.47,0.0
256,4096,7168,18432,ck,13,True,0,705.2222,a8w8_blockscale_bpreshuffle_1x128x128_256x64x256x128_16x16_16x16_8x32x1_8x32x1_1x32x1x8_8_2x1_intrawave_v1,1534.74,377.67,0.0
256,4096,8192,512,ck,16,True,0,50.2769,a8w8_blockscale_bpreshuffle_1x128x128_256x64x128x256_16x16_16x16_16x16x1_16x16x1_1x32x1x8_8_2x1_intrawave_v1,683.41,1459.92,0.0
256,4096,8192,1536,ck,13,True,0,96.1856,a8w8_blockscale_bpreshuffle_1x128x128_256x64x256x128_16x16_16x16_8x32x1_8x32x1_1x32x1x8_8_2x1_intrawave_v1,1071.67,893.93,0.0
256,4096,9216,7168,ck,13,True,0,365.784,a8w8_blockscale_bpreshuffle_1x128x128_256x64x256x128_16x16_16x16_8x32x1_8x32x1_1x32x1x8_8_2x1_intrawave_v1,1479.47,467.26,0.0
256,4096,11264,1536,ck,13,True,0,125.9162,a8w8_blockscale_bpreshuffle_1x128x128_256x64x256x128_16x16_16x16_8x32x1_8x32x1_1x32x1x8_8_2x1_intrawave_v1,1125.62,920.2,0.0
256,4096,12288,1536,ck,13,True,0,136.4758,a8w8_blockscale_bpreshuffle_1x128x128_256x64x256x128_16x16_16x16_8x32x1_8x32x1_1x32x1x8_8_2x1_intrawave_v1,1132.94,921.99,0.0
256,4096,14336,1536,ck,13,True,0,156.3195,a8w8_blockscale_bpreshuffle_1x128x128_256x64x256x128_16x16_16x16_8x32x1_8x32x1_1x32x1x8_8_2x1_intrawave_v1,1153.97,932.4,0.0
256,4096,16384,512,ck,13,True,0,95.1105,a8w8_blockscale_bpreshuffle_1x128x128_256x64x256x128_16x16_16x16_8x32x1_8x32x1_1x32x1x8_8_2x1_intrawave_v1,722.52,1521.42,0.0
256,4096,20480,1536,ck,13,True,0,214.6311,a8w8_blockscale_bpreshuffle_1x128x128_256x64x256x128_16x16_16x16_8x32x1_8x32x1_1x32x1x8_8_2x1_intrawave_v1,1200.66,957.55,0.0
256,4096,24576,1536,ck,13,True,0,253.1107,a8w8_blockscale_bpreshuffle_1x128x128_256x64x256x128_16x16_16x16_8x32x1_8x32x1_1x32x1x8_8_2x1_intrawave_v1,1221.75,969.41,0.0
256,4096,32768,512,ck,16,True,0,175.9703,a8w8_blockscale_bpreshuffle_1x128x128_256x64x128x256_16x16_16x16_16x16x1_16x16x1_1x32x1x8_8_2x1_intrawave_v1,781.03,1632.72,0.0
256,4096,32768,1536,ck,13,True,0,337.1783,a8w8_blockscale_bpreshuffle_1x128x128_256x64x256x128_16x16_16x16_8x32x1_8x32x1_1x32x1x8_8_2x1_intrawave_v1,1222.85,964.06,0.0
256,4096,36864,7168,ck,13,True,0,1446.4257,a8w8_blockscale_bpreshuffle_1x128x128_256x64x256x128_16x16_16x16_8x32x1_8x32x1_1x32x1x8_8_2x1_intrawave_v1,1496.56,411.77,0.0
256,6144,128,7168,ck,17,True,0,23.4775,a8w8_blockscale_bpreshuffle_1x128x128_256x64x64x256_16x16_16x16_16x16x1_16x16x1_1x32x1x8_8_2x1_intrawave_v1,480.22,1981.92,0.0
256,6144,512,7168,ck,13,True,0,51.3519,a8w8_blockscale_bpreshuffle_1x128x128_256x64x256x128_16x16_16x16_8x32x1_8x32x1_1x32x1x8_8_2x1_intrawave_v1,878.2,1051.6,0.0
256,6144,1024,7168,ck,14,True,0,84.0823,a8w8_blockscale_bpreshuffle_1x128x128_256x64x128x128_16x16_16x16_8x32x1_8x32x1_1x32x1x8_8_2x1_intrawave_v1,1072.69,760.72,0.0002
256,6144,2112,7168,ck,0,False,0,193.4194,a8w8_blockscale_1x128x128_256x128x128x128_16x16_32x32_2x2_8x32x1_8x32x1_1x32x1x8_8_1x1_intrawave_v3,961.77,440.14,0.0
256,6144,2240,7168,ck,0,False,0,198.0481,a8w8_blockscale_1x128x128_256x128x128x128_16x16_32x32_2x2_8x32x1_8x32x1_1x32x1x8_8_1x1_intrawave_v3,996.22,442.43,0.0
256,6144,3072,1536,ck,13,True,0,58.9038,a8w8_blockscale_bpreshuffle_1x128x128_256x64x256x128_16x16_16x16_8x32x1_8x32x1_1x32x1x8_8_2x1_intrawave_v1,984.35,881.17,0.0
256,6144,4096,512,ck,1,True,0,36.685,a8w8_blockscale_bpreshuffle_1x128x128_256x64x128x128_16x16_16x16_8x32x1_8x32x1_1x32x1x8_8_2x1_intrawave_v3,702.46,1514.91,0.0015
256,6144,4096,7168,ck,13,True,0,255.223,a8w8_blockscale_bpreshuffle_1x128x128_256x64x256x128_16x16_16x16_8x32x1_8x32x1_1x32x1x8_8_2x1_intrawave_v1,1413.58,484.8,0.0
256,6144,4608,7168,ck,13,True,0,285.1532,a8w8_blockscale_bpreshuffle_1x128x128_256x64x256x128_16x16_16x16_8x32x1_8x32x1_1x32x1x8_8_2x1_intrawave_v1,1423.36,468.85,0.0
256,6144,7168,256,ck,16,True,0,42.9877,a8w8_blockscale_bpreshuffle_1x128x128_256x64x128x256_16x16_16x16_16x16x1_16x16x1_1x32x1x8_8_2x1_intrawave_v1,524.54,2128.24,0.0
256,6144,7168,512,ck,16,True,0,62.1546,a8w8_blockscale_bpreshuffle_1x128x128_256x64x128x256_16x16_16x16_16x16x1_16x16x1_1x32x1x8_8_2x1_intrawave_v1,725.56,1526.78,0.0
256,6144,7168,2048,ck,13,True,0,148.4535,a8w8_blockscale_bpreshuffle_1x128x128_256x64x256x128_16x16_16x16_8x32x1_8x32x1_1x32x1x8_8_2x1_intrawave_v1,1215.12,776.97,0.0
256,6144,7168,2304,ck,13,True,0,163.587,a8w8_blockscale_bpreshuffle_1x128x128_256x64x256x128_16x16_16x16_8x32x1_8x32x1_1x32x1x8_8_2x1_intrawave_v1,1240.55,725.92,0.0
256,6144,7168,4096,ck,13,True,0,261.9149,a8w8_blockscale_bpreshuffle_1x128x128_256x64x256x128_16x16_16x16_8x32x1_8x32x1_1x32x1x8_8_2x1_intrawave_v1,1377.46,544.48,0.0
256,6144,7168,4608,ck,13,True,0,292.27,a8w8_blockscale_bpreshuffle_1x128x128_256x64x256x128_16x16_16x16_8x32x1_8x32x1_1x32x1x8_8_2x1_intrawave_v1,1388.7,511.25,0.0
256,6144,7168,16384,ck,13,True,0,938.385,a8w8_blockscale_bpreshuffle_1x128x128_256x64x256x128_16x16_16x16_8x32x1_8x32x1_1x32x1x8_8_2x1_intrawave_v1,1537.86,326.29,0.0
256,6144,7168,18432,ck,13,True,0,1058.1385,a8w8_blockscale_bpreshuffle_1x128x128_256x64x256x128_16x16_16x16_8x32x1_8x32x1_1x32x1x8_8_2x1_intrawave_v1,1534.3,315.13,0.0
256,6144,8192,512,ck,16,True,0,72.3806,a8w8_blockscale_bpreshuffle_1x128x128_256x64x128x256_16x16_16x16_16x16x1_16x16x1_1x32x1x8_8_2x1_intrawave_v1,712.06,1492.16,0.0
256,6144,8192,1536,ck,13,True,0,137.8944,a8w8_blockscale_bpreshuffle_1x128x128_256x64x256x128_16x16_16x16_8x32x1_8x32x1_1x32x1x8_8_2x1_intrawave_v1,1121.28,889.69,0.0
256,6144,9216,7168,ck,13,True,0,541.6459,a8w8_blockscale_bpreshuffle_1x128x128_256x64x256x128_16x16_16x16_8x32x1_8x32x1_1x32x1x8_8_2x1_intrawave_v1,1498.67,412.35,0.0
256,6144,11264,1536,ck,13,True,0,182.1678,a8w8_blockscale_bpreshuffle_1x128x128_256x64x256x128_16x16_16x16_8x32x1_8x32x1_1x32x1x8_8_2x1_intrawave_v1,1167.06,906.59,0.0
256,6144,12288,1536,ck,13,True,0,193.2705,a8w8_blockscale_bpreshuffle_1x128x128_256x64x256x128_16x16_16x16_8x32x1_8x32x1_1x32x1x8_8_2x1_intrawave_v1,1200.02,927.75,0.0
256,6144,14336,1536,ck,13,True,0,221.729,a8w8_blockscale_bpreshuffle_1x128x128_256x64x256x128_16x16_16x16_8x32x1_8x32x1_1x32x1x8_8_2x1_intrawave_v1,1220.33,936.36,0.0
256,6144,16384,512,ck,13,True,0,128.4266,a8w8_blockscale_bpreshuffle_1x128x128_256x64x256x128_16x16_16x16_8x32x1_8x32x1_1x32x1x8_8_2x1_intrawave_v1,802.63,1657.45,0.0
256,6144,20480,1536,ck,13,True,0,310.5847,a8w8_blockscale_bpreshuffle_1x128x128_256x64x256x128_16x16_16x16_8x32x1_8x32x1_1x32x1x8_8_2x1_intrawave_v1,1244.58,941.94,0.0
256,6144,24576,1536,ck,13,True,0,368.6759,a8w8_blockscale_bpreshuffle_1x128x128_256x64x256x128_16x16_16x16_8x32x1_8x32x1_1x32x1x8_8_2x1_intrawave_v1,1258.17,947.11,0.0
256,6144,32768,512,ck,13,True,0,248.0637,a8w8_blockscale_bpreshuffle_1x128x128_256x64x256x128_16x16_16x16_8x32x1_8x32x1_1x32x1x8_8_2x1_intrawave_v1,831.07,1703.5,0.0
256,6144,32768,1536,ck,13,True,0,489.9077,a8w8_blockscale_bpreshuffle_1x128x128_256x64x256x128_16x16_16x16_8x32x1_8x32x1_1x32x1x8_8_2x1_intrawave_v1,1262.43,943.9,0.0
256,6144,36864,7168,ck,13,True,0,2172.0366,a8w8_blockscale_bpreshuffle_1x128x128_256x64x256x128_16x16_16x16_8x32x1_8x32x1_1x32x1x8_8_2x1_intrawave_v1,1494.91,350.48,0.0
256,8192,64,7168,ck,12,True,0,21.2305,a8w8_blockscale_bpreshuffle_1x128x128_256x32x64x256_16x16_16x16_16x16x1_16x16x1_1x32x1x8_8_2x1_intrawave_v1,354.03,2836.84,0.0
256,8192,128,7168,ck,17,True,0,24.9657,a8w8_blockscale_bpreshuffle_1x128x128_256x64x64x256_16x16_16x16_16x16x1_16x16x1_1x32x1x8_8_2x1_intrawave_v1,602.12,2472.79,0.0
256,8192,576,7168,ck,15,True,0,86.7779,a8w8_blockscale_bpreshuffle_1x128x128_256x64x64x128_16x16_16x16_8x32x1_8x32x1_1x32x1x8_8_2x1_intrawave_v1,779.53,833.0,0.0119
256,8192,1024,7168,ck,13,True,0,97.2781,a8w8_blockscale_bpreshuffle_1x128x128_256x64x256x128_16x16_16x16_8x32x1_8x32x1_1x32x1x8_8_2x1_intrawave_v1,1236.24,851.55,0.0
256,8192,1536,7168,ck,13,True,0,138.2682,a8w8_blockscale_bpreshuffle_1x128x128_256x64x256x128_16x16_16x16_8x32x1_8x32x1_1x32x1x8_8_2x1_intrawave_v1,1304.63,686.32,0.0
256,8192,2112,7168,ck,0,False,0,244.7372,a8w8_blockscale_1x128x128_256x128x128x128_16x16_32x32_2x2_8x32x1_8x32x1_1x32x1x8_8_1x1_intrawave_v3,1013.47,443.18,0.0
256,8192,2240,7168,ck,0,False,0,251.8737,a8w8_blockscale_1x128x128_256x128x128x128_16x16_32x32_2x2_8x32x1_8x32x1_1x32x1x8_8_1x1_intrawave_v3,1044.44,442.59,0.0
256,8192,3072,1536,ck,13,True,0,72.8366,a8w8_blockscale_bpreshuffle_1x128x128_256x64x256x128_16x16_16x16_8x32x1_8x32x1_1x32x1x8_8_2x1_intrawave_v1,1061.41,928.56,0.0
256,8192,4096,512,ck,16,True,0,48.5425,a8w8_blockscale_bpreshuffle_1x128x128_256x64x128x256_16x16_16x16_16x16x1_16x16x1_1x32x1x8_8_2x1_intrawave_v1,707.83,1512.08,0.0
256,8192,4096,7168,ck,13,True,0,329.7822,a8w8_blockscale_bpreshuffle_1x128x128_256x64x256x128_16x16_16x16_8x32x1_8x32x1_1x32x1x8_8_2x1_intrawave_v1,1458.65,470.58,0.0
256,8192,4608,7168,ck,13,True,0,369.85,a8w8_blockscale_bpreshuffle_1x128x128_256x64x256x128_16x16_16x16_8x32x1_8x32x1_1x32x1x8_8_2x1_intrawave_v1,1463.2,452.2,0.0
256,8192,7168,256,ck,16,True,0,54.5117,a8w8_blockscale_bpreshuffle_1x128x128_256x64x128x256_16x16_16x16_16x16x1_16x16x1_1x32x1x8_8_2x1_intrawave_v1,551.53,2226.54,0.0
256,8192,7168,512,ck,13,True,0,80.1235,a8w8_blockscale_bpreshuffle_1x128x128_256x64x256x128_16x16_16x16_8x32x1_8x32x1_1x32x1x8_8_2x1_intrawave_v1,750.46,1563.9,0.0
256,8192,7168,2048,ck,13,True,0,191.3993,a8w8_blockscale_bpreshuffle_1x128x128_256x64x256x128_16x16_16x16_8x32x1_8x32x1_1x32x1x8_8_2x1_intrawave_v1,1256.63,777.94,0.0
256,8192,7168,2304,ck,13,True,0,207.149,a8w8_blockscale_bpreshuffle_1x128x128_256x64x256x128_16x16_16x16_8x32x1_8x32x1_1x32x1x8_8_2x1_intrawave_v1,1306.22,737.78,0.0
256,8192,7168,4096,ck,13,True,0,333.917,a8w8_blockscale_bpreshuffle_1x128x128_256x64x256x128_16x16_16x16_8x32x1_8x32x1_1x32x1x8_8_2x1_intrawave_v1,1440.59,540.12,0.0
256,8192,7168,4608,ck,13,True,0,373.55,a8w8_blockscale_bpreshuffle_1x128x128_256x64x256x128_16x16_16x16_8x32x1_8x32x1_1x32x1x8_8_2x1_intrawave_v1,1448.71,503.87,0.0
256,8192,7168,16384,ck,13,True,0,1227.3503,a8w8_blockscale_bpreshuffle_1x128x128_256x64x256x128_16x16_16x16_8x32x1_8x32x1_1x32x1x8_8_2x1_intrawave_v1,1567.72,300.73,0.0
256,8192,7168,18432,ck,13,True,0,1386.5458,a8w8_blockscale_bpreshuffle_1x128x128_256x64x256x128_16x16_16x16_8x32x1_8x32x1_1x32x1x8_8_2x1_intrawave_v1,1561.19,288.89,0.0
256,8192,8192,512,ck,13,True,0,92.1291,a8w8_blockscale_bpreshuffle_1x128x128_256x64x256x128_16x16_16x16_8x32x1_8x32x1_1x32x1x8_8_2x1_intrawave_v1,745.9,1547.9,0.0
256,8192,8192,1536,ck,13,True,0,173.08,a8w8_blockscale_bpreshuffle_1x128x128_256x64x256x128_16x16_16x16_8x32x1_8x32x1_1x32x1x8_8_2x1_intrawave_v1,1191.12,920.87,0.0
256,8192,9216,7168,ck,13,True,0,712.2006,a8w8_blockscale_bpreshuffle_1x128x128_256x64x256x128_16x16_16x16_8x32x1_8x32x1_1x32x1x8_8_2x1_intrawave_v1,1519.7,387.22,0.0
256,8192,11264,1536,ck,13,True,0,232.973,a8w8_blockscale_bpreshuffle_1x128x128_256x64x256x128_16x16_16x16_8x32x1_8x32x1_1x32x1x8_8_2x1_intrawave_v1,1216.74,920.42,0.0
256,8192,12288,1536,ck,13,True,0,250.573,a8w8_blockscale_bpreshuffle_1x128x128_256x64x256x128_16x16_16x16_8x32x1_8x32x1_1x32x1x8_8_2x1_intrawave_v1,1234.12,929.01,0.0
256,8192,14336,1536,ck,13,True,0,289.0398,a8w8_blockscale_bpreshuffle_1x128x128_256x64x256x128_16x16_16x16_8x32x1_8x32x1_1x32x1x8_8_2x1_intrawave_v1,1248.19,932.34,0.0
256,8192,16384,512,ck,13,True,0,167.9344,a8w8_blockscale_bpreshuffle_1x128x128_256x64x256x128_16x16_16x16_8x32x1_8x32x1_1x32x1x8_8_2x1_intrawave_v1,818.41,1673.38,0.0
256,8192,20480,1536,ck,13,True,0,408.8409,a8w8_blockscale_bpreshuffle_1x128x128_256x64x256x128_16x16_16x16_8x32x1_8x32x1_1x32x1x8_8_2x1_intrawave_v1,1260.63,928.44,0.0
256,8192,24576,1536,ck,13,True,0,485.5862,a8w8_blockscale_bpreshuffle_1x128x128_256x64x256x128_16x16_16x16_8x32x1_8x32x1_1x32x1x8_8_2x1_intrawave_v1,1273.67,932.86,0.0
256,8192,32768,512,ck,13,True,0,324.4653,a8w8_blockscale_bpreshuffle_1x128x128_256x64x256x128_16x16_16x16_8x32x1_8x32x1_1x32x1x8_8_2x1_intrawave_v1,847.17,1719.27,0.0
256,8192,32768,1536,ck,13,True,0,648.684,a8w8_blockscale_bpreshuffle_1x128x128_256x64x256x128_16x16_16x16_8x32x1_8x32x1_1x32x1x8_8_2x1_intrawave_v1,1271.24,924.62,0.0
256,8192,36864,7168,ck,13,True,0,2895.4604,a8w8_blockscale_bpreshuffle_1x128x128_256x64x256x128_16x16_16x16_8x32x1_8x32x1_1x32x1x8_8_2x1_intrawave_v1,1495.21,320.14,0.0
256,10240,128,7168,ck,14,True,0,37.8406,a8w8_blockscale_bpreshuffle_1x128x128_256x64x128x128_16x16_16x16_8x32x1_8x32x1_1x32x1x8_8_2x1_intrawave_v1,496.57,2033.25,0.0
256,10240,512,7168,ck,14,True,0,80.1219,a8w8_blockscale_bpreshuffle_1x128x128_256x64x128x128_16x16_16x16_8x32x1_8x32x1_1x32x1x8_8_2x1_intrawave_v1,938.09,1092.79,0.0002
256,10240,1024,7168,ck,13,True,0,127.4151,a8w8_blockscale_bpreshuffle_1x128x128_256x64x256x128_16x16_16x16_8x32x1_8x32x1_1x32x1x8_8_2x1_intrawave_v1,1179.8,798.27,0.0
256,10240,2112,7168,ck,0,False,0,288.8228,a8w8_blockscale_1x128x128_256x128x128x128_16x16_32x32_2x2_8x32x1_8x32x1_1x32x1x8_8_1x1_intrawave_v3,1073.47,456.31,0.0
256,10240,2240,7168,ck,0,False,0,300.1527,a8w8_blockscale_1x128x128_256x128x128x128_16x16_32x32_2x2_8x32x1_8x32x1_1x32x1x8_8_1x1_intrawave_v3,1095.55,450.88,0.0
256,10240,3072,1536,ck,13,True,0,90.6108,a8w8_blockscale_bpreshuffle_1x128x128_256x64x256x128_16x16_16x16_8x32x1_8x32x1_1x32x1x8_8_2x1_intrawave_v1,1066.5,920.0,0.0
256,10240,4096,512,ck,16,True,0,60.1018,a8w8_blockscale_bpreshuffle_1x128x128_256x64x128x256_16x16_16x16_16x16x1_16x16x1_1x32x1x8_8_2x1_intrawave_v1,714.62,1517.86,0.0
256,10240,4096,7168,ck,13,True,0,409.0909,a8w8_blockscale_bpreshuffle_1x128x128_256x64x256x128_16x16_16x16_8x32x1_8x32x1_1x32x1x8_8_2x1_intrawave_v1,1469.83,456.25,0.0
256,10240,4608,7168,ck,13,True,0,459.4526,a8w8_blockscale_bpreshuffle_1x128x128_256x64x256x128_16x16_16x16_8x32x1_8x32x1_1x32x1x8_8_2x1_intrawave_v1,1472.31,437.05,0.0
256,10240,7168,256,ck,13,True,0,66.5062,a8w8_blockscale_bpreshuffle_1x128x128_256x64x256x128_16x16_16x16_8x32x1_8x32x1_1x32x1x8_8_2x1_intrawave_v1,565.07,2274.33,0.0
256,10240,7168,512,ck,13,True,0,94.8448,a8w8_blockscale_bpreshuffle_1x128x128_256x64x256x128_16x16_16x16_8x32x1_8x32x1_1x32x1x8_8_2x1_intrawave_v1,792.47,1641.77,0.0
256,10240,7168,2048,ck,13,True,0,231.916,a8w8_blockscale_bpreshuffle_1x128x128_256x64x256x128_16x16_16x16_8x32x1_8x32x1_1x32x1x8_8_2x1_intrawave_v1,1296.36,786.72,0.0
256,10240,7168,2304,ck,13,True,0,259.3372,a8w8_blockscale_bpreshuffle_1x128x128_256x64x256x128_16x16_16x16_8x32x1_8x32x1_1x32x1x8_8_2x1_intrawave_v1,1304.2,720.72,0.0
256,10240,7168,4096,ck,13,True,0,417.7901,a8w8_blockscale_bpreshuffle_1x128x128_256x64x256x128_16x16_16x16_8x32x1_8x32x1_1x32x1x8_8_2x1_intrawave_v1,1439.23,522.04,0.0
256,10240,7168,4608,ck,13,True,0,465.7922,a8w8_blockscale_bpreshuffle_1x128x128_256x64x256x128_16x16_16x16_8x32x1_8x32x1_1x32x1x8_8_2x1_intrawave_v1,1452.27,487.38,0.0
256,10240,7168,16384,ck,13,True,0,1547.9137,a8w8_blockscale_bpreshuffle_1x128x128_256x64x256x128_16x16_16x16_8x32x1_8x32x1_1x32x1x8_8_2x1_intrawave_v1,1553.82,279.09,0.0
256,10240,7168,18432,ck,13,True,0,1756.8843,a8w8_blockscale_bpreshuffle_1x128x128_256x64x256x128_16x16_16x16_8x32x1_8x32x1_1x32x1x8_8_2x1_intrawave_v1,1540.13,266.19,0.0
256,10240,8192,512,ck,16,True,0,108.5165,a8w8_blockscale_bpreshuffle_1x128x128_256x64x128x256_16x16_16x16_16x16x1_16x16x1_1x32x1x8_8_2x1_intrawave_v1,791.58,1633.02,0.0
256,10240,8192,1536,ck,13,True,0,213.4435,a8w8_blockscale_bpreshuffle_1x128x128_256x64x256x128_16x16_16x16_8x32x1_8x32x1_1x32x1x8_8_2x1_intrawave_v1,1207.34,918.67,0.0
256,10240,9216,7168,ck,13,True,0,890.7733,a8w8_blockscale_bpreshuffle_1x128x128_256x64x256x128_16x16_16x16_8x32x1_8x32x1_1x32x1x8_8_2x1_intrawave_v1,1518.81,368.45,0.0
256,10240,11264,1536,ck,13,True,0,286.8647,a8w8_blockscale_bpreshuffle_1x128x128_256x64x256x128_16x16_16x16_8x32x1_8x32x1_1x32x1x8_8_2x1_intrawave_v1,1235.2,919.31,0.0
256,10240,12288,1536,ck,13,True,0,309.609,a8w8_blockscale_bpreshuffle_1x128x128_256x64x256x128_16x16_16x16_8x32x1_8x32x1_1x32x1x8_8_2x1_intrawave_v1,1248.5,924.59,0.0
256,10240,14336,1536,ck,13,True,0,361.1822,a8w8_blockscale_bpreshuffle_1x128x128_256x64x256x128_16x16_16x16_8x32x1_8x32x1_1x32x1x8_8_2x1_intrawave_v1,1248.6,917.4,0.0
256,10240,16384,512,ck,13,True,0,204.6842,a8w8_blockscale_bpreshuffle_1x128x128_256x64x256x128_16x16_16x16_8x32x1_8x32x1_1x32x1x8_8_2x1_intrawave_v1,839.34,1705.92,0.0
256,10240,20480,1536,ck,13,True,0,506.2555,a8w8_blockscale_bpreshuffle_1x128x128_256x64x256x128_16x16_16x16_8x32x1_8x32x1_1x32x1x8_8_2x1_intrawave_v1,1272.57,921.7,0.0
256,10240,24576,1536,ck,13,True,0,606.4427,a8w8_blockscale_bpreshuffle_1x128x128_256x64x256x128_16x16_16x16_8x32x1_8x32x1_1x32x1x8_8_2x1_intrawave_v1,1274.8,918.13,0.0
256,10240,32768,512,ck,13,True,0,399.719,a8w8_blockscale_bpreshuffle_1x128x128_256x64x256x128_16x16_16x16_8x32x1_8x32x1_1x32x1x8_8_2x1_intrawave_v1,859.6,1733.99,0.0
256,10240,32768,1536,ck,13,True,0,807.3714,a8w8_blockscale_bpreshuffle_1x128x128_256x64x256x128_16x16_16x16_8x32x1_8x32x1_1x32x1x8_8_2x1_intrawave_v1,1276.73,913.02,0.0
256,10240,36864,7168,ck,13,True,0,3637.1032,a8w8_blockscale_bpreshuffle_1x128x128_256x64x256x128_16x16_16x16_8x32x1_8x32x1_1x32x1x8_8_2x1_intrawave_v1,1487.9,300.41,0.0
256,12288,128,7168,ck,14,True,0,39.5192,a8w8_blockscale_bpreshuffle_1x128x128_256x64x128x128_16x16_16x16_8x32x1_8x32x1_1x32x1x8_8_2x1_intrawave_v1,570.57,2331.62,0.0
256,12288,512,7168,ck,13,True,0,83.5271,a8w8_blockscale_bpreshuffle_1x128x128_256x64x256x128_16x16_16x16_8x32x1_8x32x1_1x32x1x8_8_2x1_intrawave_v1,1079.82,1249.1,0.0
256,12288,1024,7168,ck,13,True,0,135.9241,a8w8_blockscale_bpreshuffle_1x128x128_256x64x256x128_16x16_16x16_8x32x1_8x32x1_1x32x1x8_8_2x1_intrawave_v1,1327.13,887.16,0.0
256,12288,2112,7168,ck,0,False,0,341.1215,a8w8_blockscale_1x128x128_256x128x128x128_16x16_32x32_2x2_8x32x1_8x32x1_1x32x1x8_8_1x1_intrawave_v3,1090.67,454.75,0.0
256,12288,2240,7168,ck,0,False,0,354.0748,a8w8_blockscale_1x128x128_256x128x128x128_16x16_32x32_2x2_8x32x1_8x32x1_1x32x1x8_8_1x1_intrawave_v3,1114.45,449.59,0.0
256,12288,3072,1536,ck,13,True,0,105.362,a8w8_blockscale_bpreshuffle_1x128x128_256x64x256x128_16x16_16x16_8x32x1_8x32x1_1x32x1x8_8_2x1_intrawave_v1,1100.63,940.48,0.0
256,12288,4096,512,ck,16,True,0,68.095,a8w8_blockscale_bpreshuffle_1x128x128_256x64x128x256_16x16_16x16_16x16x1_16x16x1_1x32x1x8_8_2x1_intrawave_v1,756.88,1601.47,0.0
256,12288,4096,7168,ck,13,True,0,484.7161,a8w8_blockscale_bpreshuffle_1x128x128_256x64x256x128_16x16_16x16_8x32x1_8x32x1_1x32x1x8_8_2x1_intrawave_v1,1488.61,449.96,0.0
256,12288,4608,7168,ck,13,True,0,548.733,a8w8_blockscale_bpreshuffle_1x128x128_256x64x256x128_16x16_16x16_8x32x1_8x32x1_1x32x1x8_8_2x1_intrawave_v1,1479.31,427.09,0.0
256,12288,7168,256,ck,13,True,0,78.9663,a8w8_blockscale_bpreshuffle_1x128x128_256x64x256x128_16x16_16x16_8x32x1_8x32x1_1x32x1x8_8_2x1_intrawave_v1,571.09,2293.91,0.0
256,12288,7168,512,ck,13,True,0,112.5061,a8w8_blockscale_bpreshuffle_1x128x128_256x64x256x128_16x16_16x16_8x32x1_8x32x1_1x32x1x8_8_2x1_intrawave_v1,801.68,1654.33,0.0
256,12288,7168,2048,ck,13,True,0,276.5475,a8w8_blockscale_bpreshuffle_1x128x128_256x64x256x128_16x16_16x16_8x32x1_8x32x1_1x32x1x8_8_2x1_intrawave_v1,1304.58,781.08,0.0
256,12288,7168,2304,ck,13,True,0,304.5188,a8w8_blockscale_bpreshuffle_1x128x128_256x64x256x128_16x16_16x16_8x32x1_8x32x1_1x32x1x8_8_2x1_intrawave_v1,1332.84,725.69,0.0
256,12288,7168,4096,ck,13,True,0,490.7789,a8w8_blockscale_bpreshuffle_1x128x128_256x64x256x128_16x16_16x16_8x32x1_8x32x1_1x32x1x8_8_2x1_intrawave_v1,1470.22,521.32,0.0
256,12288,7168,4608,ck,13,True,0,553.449,a8w8_blockscale_bpreshuffle_1x128x128_256x64x256x128_16x16_16x16_8x32x1_8x32x1_1x32x1x8_8_2x1_intrawave_v1,1466.71,480.29,0.0
256,12288,7168,16384,ck,13,True,0,1834.1553,a8w8_blockscale_bpreshuffle_1x128x128_256x64x256x128_16x16_16x16_8x32x1_8x32x1_1x32x1x8_8_2x1_intrawave_v1,1573.6,269.84,0.0
256,12288,7168,18432,ck,13,True,0,2074.6305,a8w8_blockscale_bpreshuffle_1x128x128_256x64x256x128_16x16_16x16_8x32x1_8x32x1_1x32x1x8_8_2x1_intrawave_v1,1565.1,257.77,0.0
256,12288,8192,512,ck,13,True,0,129.6926,a8w8_blockscale_bpreshuffle_1x128x128_256x64x256x128_16x16_16x16_8x32x1_8x32x1_1x32x1x8_8_2x1_intrawave_v1,794.8,1633.19,0.0
256,12288,8192,1536,ck,13,True,0,252.8138,a8w8_blockscale_bpreshuffle_1x128x128_256x64x256x128_16x16_16x16_8x32x1_8x32x1_1x32x1x8_8_2x1_intrawave_v1,1223.18,920.77,0.0
256,12288,9216,7168,ck,13,True,0,1057.9199,a8w8_blockscale_bpreshuffle_1x128x128_256x64x256x128_16x16_16x16_8x32x1_8x32x1_1x32x1x8_8_2x1_intrawave_v1,1534.61,359.79,0.0
256,12288,11264,1536,ck,13,True,0,338.1994,a8w8_blockscale_bpreshuffle_1x128x128_256x64x256x128_16x16_16x16_8x32x1_8x32x1_1x32x1x8_8_2x1_intrawave_v1,1257.25,925.49,0.0
256,12288,12288,1536,ck,13,True,0,372.1706,a8w8_blockscale_bpreshuffle_1x128x128_256x64x256x128_16x16_16x16_8x32x1_8x32x1_1x32x1x8_8_2x1_intrawave_v1,1246.35,912.86,0.0
256,12288,14336,1536,ck,13,True,0,429.5075,a8w8_blockscale_bpreshuffle_1x128x128_256x64x256x128_16x16_16x16_8x32x1_8x32x1_1x32x1x8_8_2x1_intrawave_v1,1259.97,915.5,0.0
256,12288,16384,512,ck,13,True,0,243.3553,a8w8_blockscale_bpreshuffle_1x128x128_256x64x256x128_16x16_16x16_8x32x1_8x32x1_1x32x1x8_8_2x1_intrawave_v1,847.15,1714.91,0.0
256,12288,20480,1536,ck,13,True,0,606.22,a8w8_blockscale_bpreshuffle_1x128x128_256x64x256x128_16x16_16x16_8x32x1_8x32x1_1x32x1x8_8_2x1_intrawave_v1,1275.27,913.28,0.0
256,12288,24576,1536,ck,13,True,0,727.9521,a8w8_blockscale_bpreshuffle_1x128x128_256x64x256x128_16x16_16x16_8x32x1_8x32x1_1x32x1x8_8_2x1_intrawave_v1,1274.41,907.48,0.0
256,12288,32768,512,ck,13,True,0,473.8403,a8w8_blockscale_bpreshuffle_1x128x128_256x64x256x128_16x16_16x16_8x32x1_8x32x1_1x32x1x8_8_2x1_intrawave_v1,870.16,1748.22,0.0
256,12288,32768,1536,ck,13,True,0,964.8058,a8w8_blockscale_bpreshuffle_1x128x128_256x64x256x128_16x16_16x16_8x32x1_8x32x1_1x32x1x8_8_2x1_intrawave_v1,1282.07,906.41,0.0
256,12288,36864,7168,ck,13,True,0,4375.7728,a8w8_blockscale_bpreshuffle_1x128x128_256x64x256x128_16x16_16x16_8x32x1_8x32x1_1x32x1x8_8_2x1_intrawave_v1,1484.08,287.56,0.0
256,14336,128,7168,ck,14,True,0,41.9035,a8w8_blockscale_bpreshuffle_1x128x128_256x64x128x128_16x16_16x16_8x32x1_8x32x1_1x32x1x8_8_2x1_intrawave_v1,627.79,2561.79,0.0
256,14336,512,7168,ck,13,True,0,92.1186,a8w8_blockscale_bpreshuffle_1x128x128_256x64x256x128_16x16_16x16_8x32x1_8x32x1_1x32x1x8_8_2x1_intrawave_v1,1142.3,1314.72,0.0
256,14336,1024,7168,ck,13,True,0,163.7443,a8w8_blockscale_bpreshuffle_1x128x128_256x64x256x128_16x16_16x16_8x32x1_8x32x1_1x32x1x8_8_2x1_intrawave_v1,1285.26,851.7,0.0
256,14336,2112,7168,ck,0,False,0,393.6439,a8w8_blockscale_1x128x128_256x128x128x128_16x16_32x32_2x2_8x32x1_8x32x1_1x32x1x8_8_1x1_intrawave_v3,1102.67,453.34,0.0
256,14336,2240,7168,ck,0,False,0,406.6305,a8w8_blockscale_1x128x128_256x128x128x128_16x16_32x32_2x2_8x32x1_8x32x1_1x32x1x8_8_1x1_intrawave_v3,1132.15,450.14,0.0
256,14336,3072,1536,ck,13,True,0,123.3485,a8w8_blockscale_bpreshuffle_1x128x128_256x64x256x128_16x16_16x16_8x32x1_8x32x1_1x32x1x8_8_2x1_intrawave_v1,1096.82,930.85,0.0
256,14336,4096,512,ck,16,True,0,81.1907,a8w8_blockscale_bpreshuffle_1x128x128_256x64x128x256_16x16_16x16_16x16x1_16x16x1_1x32x1x8_8_2x1_intrawave_v1,740.6,1562.71,0.0
256,14336,4096,7168,ck,13,True,0,563.6577,a8w8_blockscale_bpreshuffle_1x128x128_256x64x256x128_16x16_16x16_8x32x1_8x32x1_1x32x1x8_8_2x1_intrawave_v1,1493.48,442.75,0.0
256,14336,4608,7168,ck,13,True,0,637.3068,a8w8_blockscale_bpreshuffle_1x128x128_256x64x256x128_16x16_16x16_8x32x1_8x32x1_1x32x1x8_8_2x1_intrawave_v1,1486.0,420.38,0.0
256,14336,7168,256,ck,13,True,0,91.6652,a8w8_blockscale_bpreshuffle_1x128x128_256x64x256x128_16x16_16x16_8x32x1_8x32x1_1x32x1x8_8_2x1_intrawave_v1,573.97,2302.14,0.0
256,14336,7168,512,ck,13,True,0,127.9678,a8w8_blockscale_bpreshuffle_1x128x128_256x64x256x128_16x16_16x16_8x32x1_8x32x1_1x32x1x8_8_2x1_intrawave_v1,822.29,1692.07,0.0
256,14336,7168,2048,ck,13,True,0,321.4993,a8w8_blockscale_bpreshuffle_1x128x128_256x64x256x128_16x16_16x16_8x32x1_8x32x1_1x32x1x8_8_2x1_intrawave_v1,1309.2,776.24,0.0
256,14336,7168,2304,ck,13,True,0,355.2214,a8w8_blockscale_bpreshuffle_1x128x128_256x64x256x128_16x16_16x16_8x32x1_8x32x1_1x32x1x8_8_2x1_intrawave_v1,1333.03,718.05,0.0
256,14336,7168,4096,ck,13,True,0,574.0672,a8w8_blockscale_bpreshuffle_1x128x128_256x64x256x128_16x16_16x16_8x32x1_8x32x1_1x32x1x8_8_2x1_intrawave_v1,1466.4,511.44,0.0
256,14336,7168,4608,ck,13,True,0,645.0984,a8w8_blockscale_bpreshuffle_1x128x128_256x64x256x128_16x16_16x16_8x32x1_8x32x1_1x32x1x8_8_2x1_intrawave_v1,1468.06,472.19,0.0
256,14336,7168,16384,ck,13,True,0,2146.6443,a8w8_blockscale_bpreshuffle_1x128x128_256x64x256x128_16x16_16x16_8x32x1_8x32x1_1x32x1x8_8_2x1_intrawave_v1,1568.61,259.87,0.0
256,14336,7168,18432,ck,13,True,0,2440.0208,a8w8_blockscale_bpreshuffle_1x128x128_256x64x256x128_16x16_16x16_8x32x1_8x32x1_1x32x1x8_8_2x1_intrawave_v1,1552.51,246.67,0.0
256,14336,8192,512,ck,13,True,0,149.5943,a8w8_blockscale_bpreshuffle_1x128x128_256x64x256x128_16x16_16x16_8x32x1_8x32x1_1x32x1x8_8_2x1_intrawave_v1,803.9,1647.22,0.0
256,14336,8192,1536,ck,13,True,0,291.6854,a8w8_blockscale_bpreshuffle_1x128x128_256x64x256x128_16x16_16x16_8x32x1_8x32x1_1x32x1x8_8_2x1_intrawave_v1,1236.87,923.89,0.0
256,14336,9216,7168,ck,13,True,0,1235.9593,a8w8_blockscale_bpreshuffle_1x128x128_256x64x256x128_16x16_16x16_8x32x1_8x32x1_1x32x1x8_8_2x1_intrawave_v1,1532.48,350.39,0.0
256,14336,11264,1536,ck,13,True,0,391.4198,a8w8_blockscale_bpreshuffle_1x128x128_256x64x256x128_16x16_16x16_8x32x1_8x32x1_1x32x1x8_8_2x1_intrawave_v1,1267.36,925.56,0.0
256,14336,12288,1536,ck,13,True,0,429.3833,a8w8_blockscale_bpreshuffle_1x128x128_256x64x256x128_16x16_16x16_8x32x1_8x32x1_1x32x1x8_8_2x1_intrawave_v1,1260.33,915.77,0.0
256,14336,14336,1536,ck,13,True,0,496.3032,a8w8_blockscale_bpreshuffle_1x128x128_256x64x256x128_16x16_16x16_8x32x1_8x32x1_1x32x1x8_8_2x1_intrawave_v1,1272.13,916.94,0.0
256,14336,16384,512,ck,13,True,0,282.2497,a8w8_blockscale_bpreshuffle_1x128x128_256x64x256x128_16x16_16x16_8x32x1_8x32x1_1x32x1x8_8_2x1_intrawave_v1,852.15,1720.08,0.0
256,14336,20480,1536,ck,13,True,0,707.8026,a8w8_blockscale_bpreshuffle_1x128x128_256x64x256x128_16x16_16x16_8x32x1_8x32x1_1x32x1x8_8_2x1_intrawave_v1,1274.29,905.17,0.0
256,14336,24576,1536,ck,13,True,0,843.8251,a8w8_blockscale_bpreshuffle_1x128x128_256x64x256x128_16x16_16x16_8x32x1_8x32x1_1x32x1x8_8_2x1_intrawave_v1,1282.65,905.89,0.0
256,14336,32768,512,ck,13,True,0,549.8952,a8w8_blockscale_bpreshuffle_1x128x128_256x64x256x128_16x16_16x16_8x32x1_8x32x1_1x32x1x8_8_2x1_intrawave_v1,874.78,1752.41,0.0
256,14336,32768,1536,ck,13,True,0,1121.2443,a8w8_blockscale_bpreshuffle_1x128x128_256x64x256x128_16x16_16x16_8x32x1_8x32x1_1x32x1x8_8_2x1_intrawave_v1,1287.06,902.46,0.0
256,14336,36864,7168,ck,13,True,0,5094.9407,a8w8_blockscale_bpreshuffle_1x128x128_256x64x256x128_16x16_16x16_8x32x1_8x32x1_1x32x1x8_8_2x1_intrawave_v1,1487.03,279.49,0.0
256,16384,64,7168,ck,17,True,0,31.1755,a8w8_blockscale_bpreshuffle_1x128x128_256x64x64x256_16x16_16x16_16x16x1_16x16x1_1x32x1x8_8_2x1_intrawave_v1,482.19,3849.06,0.0
256,16384,128,7168,ck,14,True,0,43.1453,a8w8_blockscale_bpreshuffle_1x128x128_256x64x128x128_16x16_16x16_8x32x1_8x32x1_1x32x1x8_8_2x1_intrawave_v1,696.83,2840.46,0.0
256,16384,576,7168,ck,0,False,0,154.808,a8w8_blockscale_1x128x128_256x128x128x128_16x16_32x32_2x2_8x32x1_8x32x1_1x32x1x8_8_1x1_intrawave_v3,873.93,907.21,0.0
256,16384,1024,7168,ck,13,True,0,172.4995,a8w8_blockscale_bpreshuffle_1x128x128_256x64x256x128_16x16_16x16_8x32x1_8x32x1_1x32x1x8_8_2x1_intrawave_v1,1394.31,917.89,0.0
256,16384,1536,7168,ck,13,True,0,254.9467,a8w8_blockscale_bpreshuffle_1x128x128_256x64x256x128_16x16_16x16_8x32x1_8x32x1_1x32x1x8_8_2x1_intrawave_v1,1415.11,701.25,0.0
256,16384,2112,7168,ck,0,False,0,444.4663,a8w8_blockscale_1x128x128_256x128x128x128_16x16_32x32_2x2_8x32x1_8x32x1_1x32x1x8_8_1x1_intrawave_v3,1116.1,453.99,0.0
256,16384,2240,7168,ck,0,False,0,462.9859,a8w8_blockscale_1x128x128_256x128x128x128_16x16_32x32_2x2_8x32x1_8x32x1_1x32x1x8_8_1x1_intrawave_v3,1136.39,446.88,0.0
256,16384,3072,1536,ck,13,True,0,134.7739,a8w8_blockscale_bpreshuffle_1x128x128_256x64x256x128_16x16_16x16_8x32x1_8x32x1_1x32x1x8_8_2x1_intrawave_v1,1147.25,968.64,0.0
256,16384,4096,512,ck,16,True,0,91.8828,a8w8_blockscale_bpreshuffle_1x128x128_256x64x128x256_16x16_16x16_16x16x1_16x16x1_1x32x1x8_8_2x1_intrawave_v1,747.9,1574.87,0.0
256,16384,4096,7168,ck,13,True,0,643.193,a8w8_blockscale_bpreshuffle_1x128x128_256x64x256x128_16x16_16x16_8x32x1_8x32x1_1x32x1x8_8_2x1_intrawave_v1,1495.78,436.91,0.0
256,16384,4608,7168,ck,13,True,0,721.3031,a8w8_blockscale_bpreshuffle_1x128x128_256x64x256x128_16x16_16x16_8x32x1_8x32x1_1x32x1x8_8_2x1_intrawave_v1,1500.52,417.95,0.0
256,16384,6144,1536,ck,13,True,0,253.8655,a8w8_blockscale_bpreshuffle_1x128x128_256x64x256x128_16x16_16x16_8x32x1_8x32x1_1x32x1x8_8_2x1_intrawave_v1,1218.12,929.35,0.0
256,16384,7168,256,ck,8,True,0,101.9856,a8w8_blockscale_bpreshuffle_1x128x128_256x32x256x128_16x16_16x16_8x32x1_8x32x1_1x32x1x8_8_2x1_intrawave_v1,589.59,2362.2,0.0
256,16384,7168,512,ck,13,True,0,146.1223,a8w8_blockscale_bpreshuffle_1x128x128_256x64x256x128_16x16_16x16_8x32x1_8x32x1_1x32x1x8_8_2x1_intrawave_v1,823.0,1689.95,0.0
256,16384,7168,2048,ck,13,True,0,364.0228,a8w8_blockscale_bpreshuffle_1x128x128_256x64x256x128_16x16_16x16_8x32x1_8x32x1_1x32x1x8_8_2x1_intrawave_v1,1321.45,777.74,0.0
256,16384,7168,2304,ck,13,True,0,399.7933,a8w8_blockscale_bpreshuffle_1x128x128_256x64x256x128_16x16_16x16_8x32x1_8x32x1_1x32x1x8_8_2x1_intrawave_v1,1353.61,723.24,0.0
256,16384,7168,4096,ck,13,True,0,652.167,a8w8_blockscale_bpreshuffle_1x128x128_256x64x256x128_16x16_16x16_8x32x1_8x32x1_1x32x1x8_8_2x1_intrawave_v1,1475.19,508.08,0.0
256,16384,7168,4608,ck,13,True,0,731.1873,a8w8_blockscale_bpreshuffle_1x128x128_256x64x256x128_16x16_16x16_8x32x1_8x32x1_1x32x1x8_8_2x1_intrawave_v1,1480.24,469.66,0.0
256,16384,7168,16384,ck,13,True,0,2423.2559,a8w8_blockscale_bpreshuffle_1x128x128_256x64x256x128_16x16_16x16_8x32x1_8x32x1_1x32x1x8_8_2x1_intrawave_v1,1588.07,256.17,0.0
256,16384,7168,18432,ck,13,True,0,2750.3759,a8w8_blockscale_bpreshuffle_1x128x128_256x64x256x128_16x16_16x16_8x32x1_8x32x1_1x32x1x8_8_2x1_intrawave_v1,1574.09,243.24,0.0
256,16384,8192,512,ck,13,True,0,168.1069,a8w8_blockscale_bpreshuffle_1x128x128_256x64x256x128_16x16_16x16_8x32x1_8x32x1_1x32x1x8_8_2x1_intrawave_v1,817.57,1671.66,0.0
256,16384,8192,1536,ck,13,True,0,327.7081,a8w8_blockscale_bpreshuffle_1x128x128_256x64x256x128_16x16_16x16_8x32x1_8x32x1_1x32x1x8_8_2x1_intrawave_v1,1258.18,934.32,0.0
256,16384,9216,7168,ck,13,True,0,1398.9094,a8w8_blockscale_bpreshuffle_1x128x128_256x64x256x128_16x16_16x16_8x32x1_8x32x1_1x32x1x8_8_2x1_intrawave_v1,1547.39,347.05,0.0
256,16384,11264,1536,ck,13,True,0,443.0367,a8w8_blockscale_bpreshuffle_1x128x128_256x64x256x128_16x16_16x16_8x32x1_8x32x1_1x32x1x8_8_2x1_intrawave_v1,1279.66,928.97,0.0
256,16384,12288,1536,ck,13,True,0,489.3884,a8w8_blockscale_bpreshuffle_1x128x128_256x64x256x128_16x16_16x16_8x32x1_8x32x1_1x32x1x8_8_2x1_intrawave_v1,1263.77,912.76,0.0
256,16384,14336,1536,ck,13,True,0,564.5896,a8w8_blockscale_bpreshuffle_1x128x128_256x64x256x128_16x16_16x16_8x32x1_8x32x1_1x32x1x8_8_2x1_intrawave_v1,1278.02,915.62,0.0
256,16384,16384,512,ck,13,True,0,317.8655,a8w8_blockscale_bpreshuffle_1x128x128_256x64x256x128_16x16_16x16_8x32x1_8x32x1_1x32x1x8_8_2x1_intrawave_v1,864.76,1741.77,0.0
256,16384,20480,1536,ck,13,True,0,803.7588,a8w8_blockscale_bpreshuffle_1x128x128_256x64x256x128_16x16_16x16_8x32x1_8x32x1_1x32x1x8_8_2x1_intrawave_v1,1282.46,905.39,0.0
256,16384,24576,1536,ck,13,True,0,960.3261,a8w8_blockscale_bpreshuffle_1x128x128_256x64x256x128_16x16_16x16_8x32x1_8x32x1_1x32x1x8_8_2x1_intrawave_v1,1288.05,904.09,0.0
256,16384,32768,512,ck,13,True,0,623.1324,a8w8_blockscale_bpreshuffle_1x128x128_256x64x256x128_16x16_16x16_8x32x1_8x32x1_1x32x1x8_8_2x1_intrawave_v1,882.25,1763.52,0.0
256,16384,32768,1536,ck,13,True,0,1275.5245,a8w8_blockscale_bpreshuffle_1x128x128_256x64x256x128_16x16_16x16_8x32x1_8x32x1_1x32x1x8_8_2x1_intrawave_v1,1293.01,900.99,0.0
256,16384,36864,7168,ck,13,True,0,5818.798,a8w8_blockscale_bpreshuffle_1x128x128_256x64x256x128_16x16_16x16_8x32x1_8x32x1_1x32x1x8_8_2x1_intrawave_v1,1488.05,273.19,0.0
256,20480,576,7168,ck,0,False,0,193.4224,a8w8_blockscale_1x128x128_256x128x128x128_16x16_32x32_2x2_8x32x1_8x32x1_1x32x1x8_8_1x1_intrawave_v3,874.33,902.29,0.0
256,20480,1536,7168,ck,13,True,0,318.9724,a8w8_blockscale_bpreshuffle_1x128x128_256x64x256x128_16x16_16x16_8x32x1_8x32x1_1x32x1x8_8_2x1_intrawave_v1,1413.83,691.99,0.0
256,20480,3072,1536,ck,13,True,0,163.5094,a8w8_blockscale_bpreshuffle_1x128x128_256x64x256x128_16x16_16x16_8x32x1_8x32x1_1x32x1x8_8_2x1_intrawave_v1,1182.03,990.8,0.0
256,20480,4096,512,ck,16,True,0,109.2602,a8w8_blockscale_bpreshuffle_1x128x128_256x64x128x256_16x16_16x16_16x16x1_16x16x1_1x32x1x8_8_2x1_intrawave_v1,786.19,1650.69,0.0
256,20480,4608,7168,ck,13,True,0,895.3838,a8w8_blockscale_bpreshuffle_1x128x128_256x64x256x128_16x16_16x16_8x32x1_8x32x1_1x32x1x8_8_2x1_intrawave_v1,1510.99,411.64,0.0
256,20480,7168,256,ck,13,True,0,125.6251,a8w8_blockscale_bpreshuffle_1x128x128_256x64x256x128_16x16_16x16_8x32x1_8x32x1_1x32x1x8_8_2x1_intrawave_v1,598.3,2393.46,0.0
256,20480,7168,2048,ck,13,True,0,449.8955,a8w8_blockscale_bpreshuffle_1x128x128_256x64x256x128_16x16_16x16_8x32x1_8x32x1_1x32x1x8_8_2x1_intrawave_v1,1336.52,778.46,0.0
256,20480,7168,2304,ck,13,True,0,497.8571,a8w8_blockscale_bpreshuffle_1x128x128_256x64x256x128_16x16_16x16_8x32x1_8x32x1_1x32x1x8_8_2x1_intrawave_v1,1358.74,717.68,0.0
256,32768,64,7168,ck,15,True,0,53.7978,a8w8_blockscale_bpreshuffle_1x128x128_256x64x64x128_16x16_16x16_8x32x1_8x32x1_1x32x1x8_8_2x1_intrawave_v1,558.85,4452.49,0.0112
256,32768,128,7168,ck,14,True,0,67.6411,a8w8_blockscale_bpreshuffle_1x128x128_256x64x128x128_16x16_16x16_8x32x1_8x32x1_1x32x1x8_8_2x1_intrawave_v1,888.95,3610.04,0.0
256,32768,512,7168,ck,13,True,0,181.5814,a8w8_blockscale_bpreshuffle_1x128x128_256x64x256x128_16x16_16x16_8x32x1_8x32x1_1x32x1x8_8_2x1_intrawave_v1,1324.57,1498.53,0.0
256,32768,576,7168,ck,0,False,0,283.3709,a8w8_blockscale_1x128x128_256x128x128x128_16x16_32x32_2x2_8x32x1_8x32x1_1x32x1x8_8_1x1_intrawave_v3,954.87,976.67,0.0
256,32768,1024,7168,ck,13,True,0,332.2435,a8w8_blockscale_bpreshuffle_1x128x128_256x64x256x128_16x16_16x16_8x32x1_8x32x1_1x32x1x8_8_2x1_intrawave_v1,1447.84,931.03,0.0
256,32768,1536,7168,ck,13,True,0,489.6665,a8w8_blockscale_bpreshuffle_1x128x128_256x64x256x128_16x16_16x16_8x32x1_8x32x1_1x32x1x8_8_2x1_intrawave_v1,1473.56,707.74,0.0
256,32768,2112,7168,ck,0,False,0,870.5281,a8w8_blockscale_1x128x128_256x128x128x128_16x16_32x32_2x2_8x32x1_8x32x1_1x32x1x8_8_1x1_intrawave_v3,1139.7,446.2,0.0
256,32768,2240,7168,ck,0,False,0,908.6838,a8w8_blockscale_1x128x128_256x128x128x128_16x16_32x32_2x2_8x32x1_8x32x1_1x32x1x8_8_1x1_intrawave_v3,1158.01,437.71,0.0
256,32768,3072,1536,ck,13,True,0,253.9657,a8w8_blockscale_bpreshuffle_1x128x128_256x64x256x128_16x16_16x16_8x32x1_8x32x1_1x32x1x8_8_2x1_intrawave_v1,1217.64,1009.49,0.0
256,32768,4096,512,ck,13,True,0,169.4542,a8w8_blockscale_bpreshuffle_1x128x128_256x64x256x128_16x16_16x16_8x32x1_8x32x1_1x32x1x8_8_2x1_intrawave_v1,811.07,1695.5,0.0
256,32768,4096,7168,ck,13,True,0,1268.9207,a8w8_blockscale_bpreshuffle_1x128x128_256x64x256x128_16x16_16x16_8x32x1_8x32x1_1x32x1x8_8_2x1_intrawave_v1,1516.36,419.79,0.0
256,32768,4608,7168,ck,13,True,0,1430.1393,a8w8_blockscale_bpreshuffle_1x128x128_256x64x256x128_16x16_16x16_8x32x1_8x32x1_1x32x1x8_8_2x1_intrawave_v1,1513.6,398.49,0.0
256,32768,6144,1536,ck,13,True,0,492.3155,a8w8_blockscale_bpreshuffle_1x128x128_256x64x256x128_16x16_16x16_8x32x1_8x32x1_1x32x1x8_8_2x1_intrawave_v1,1256.26,939.28,0.0
256,32768,7168,256,ck,13,True,0,195.4432,a8w8_blockscale_bpreshuffle_1x128x128_256x64x256x128_16x16_16x16_8x32x1_8x32x1_1x32x1x8_8_2x1_intrawave_v1,615.31,2455.88,0.0
256,32768,7168,512,ck,13,True,0,278.4786,a8w8_blockscale_bpreshuffle_1x128x128_256x64x256x128_16x16_16x16_8x32x1_8x32x1_1x32x1x8_8_2x1_intrawave_v1,863.69,1760.31,0.0
256,32768,7168,2048,ck,13,True,0,711.3855,a8w8_blockscale_bpreshuffle_1x128x128_256x64x256x128_16x16_16x16_8x32x1_8x32x1_1x32x1x8_8_2x1_intrawave_v1,1352.39,775.32,0.0
256,32768,7168,2304,ck,13,True,0,788.7604,a8w8_blockscale_bpreshuffle_1x128x128_256x64x256x128_16x16_16x16_8x32x1_8x32x1_1x32x1x8_8_2x1_intrawave_v1,1372.19,712.22,0.0
256,32768,7168,4096,ck,13,True,0,1300.9622,a8w8_blockscale_bpreshuffle_1x128x128_256x64x256x128_16x16_16x16_8x32x1_8x32x1_1x32x1x8_8_2x1_intrawave_v1,1479.02,486.82,0.0
256,32768,7168,4608,ck,13,True,0,1455.2197,a8w8_blockscale_bpreshuffle_1x128x128_256x64x256x128_16x16_16x16_8x32x1_8x32x1_1x32x1x8_8_2x1_intrawave_v1,1487.52,449.27,0.0
256,32768,7168,16384,ck,13,True,0,4851.5514,a8w8_blockscale_bpreshuffle_1x128x128_256x64x256x128_16x16_16x16_8x32x1_8x32x1_1x32x1x8_8_2x1_intrawave_v1,1586.42,231.69,0.0
256,32768,7168,18432,ck,13,True,0,5530.3263,a8w8_blockscale_bpreshuffle_1x128x128_256x64x256x128_16x16_16x16_8x32x1_8x32x1_1x32x1x8_8_2x1_intrawave_v1,1565.67,218.05,0.0
256,32768,8192,512,ck,13,True,0,323.1419,a8w8_blockscale_bpreshuffle_1x128x128_256x64x256x128_16x16_16x16_8x32x1_8x32x1_1x32x1x8_8_2x1_intrawave_v1,850.64,1726.31,0.0
256,32768,8192,1536,ck,13,True,0,645.7688,a8w8_blockscale_bpreshuffle_1x128x128_256x64x256x128_16x16_16x16_8x32x1_8x32x1_1x32x1x8_8_2x1_intrawave_v1,1276.98,928.79,0.0
256,32768,9216,7168,ck,13,True,0,2805.608,a8w8_blockscale_bpreshuffle_1x128x128_256x64x256x128_16x16_16x16_8x32x1_8x32x1_1x32x1x8_8_2x1_intrawave_v1,1543.1,322.54,0.0
256,32768,11264,1536,ck,13,True,0,881.6201,a8w8_blockscale_bpreshuffle_1x128x128_256x64x256x128_16x16_16x16_8x32x1_8x32x1_1x32x1x8_8_2x1_intrawave_v1,1286.12,914.03,0.0
256,32768,12288,1536,ck,13,True,0,967.5408,a8w8_blockscale_bpreshuffle_1x128x128_256x64x256x128_16x16_16x16_8x32x1_8x32x1_1x32x1x8_8_2x1_intrawave_v1,1278.45,903.85,0.0
256,32768,14336,1536,ck,13,True,0,1120.3221,a8w8_blockscale_bpreshuffle_1x128x128_256x64x256x128_16x16_16x16_8x32x1_8x32x1_1x32x1x8_8_2x1_intrawave_v1,1288.12,903.2,0.0
256,32768,16384,512,ck,13,True,0,621.1461,a8w8_blockscale_bpreshuffle_1x128x128_256x64x256x128_16x16_16x16_8x32x1_8x32x1_1x32x1x8_8_2x1_intrawave_v1,885.07,1769.16,0.0
256,32768,20480,1536,ck,13,True,0,1594.901,a8w8_blockscale_bpreshuffle_1x128x128_256x64x256x128_16x16_16x16_8x32x1_8x32x1_1x32x1x8_8_2x1_intrawave_v1,1292.61,892.82,0.0
256,32768,24576,1536,ck,13,True,0,1913.7446,a8w8_blockscale_bpreshuffle_1x128x128_256x64x256x128_16x16_16x16_8x32x1_8x32x1_1x32x1x8_8_2x1_intrawave_v1,1292.7,887.63,0.0
256,32768,32768,512,ck,13,True,0,1226.2877,a8w8_blockscale_bpreshuffle_1x128x128_256x64x256x128_16x16_16x16_8x32x1_8x32x1_1x32x1x8_8_2x1_intrawave_v1,896.62,1778.57,0.0
256,32768,32768,1536,ck,13,True,0,2540.8018,a8w8_blockscale_bpreshuffle_1x128x128_256x64x256x128_16x16_16x16_8x32x1_8x32x1_1x32x1x8_8_2x1_intrawave_v1,1298.23,884.82,0.0
256,32768,36864,7168,ck,13,True,0,11651.9167,a8w8_blockscale_bpreshuffle_1x128x128_256x64x256x128_16x16_16x16_8x32x1_8x32x1_1x32x1x8_8_2x1_intrawave_v1,1486.22,250.18,0.0
256,65536,64,7168,ck,17,True,0,107.4478,a8w8_blockscale_bpreshuffle_1x128x128_256x64x64x256_16x16_16x16_16x16x1_16x16x1_1x32x1x8_8_2x1_intrawave_v1,559.62,4454.34,0.0
256,65536,128,7168,ck,0,True,0,131.1121,a8w8_blockscale_bpreshuffle_1x128x128_256x128x128x128_16x16_16x16_8x32x1_8x32x1_1x32x1x8_8_2x1_intrawave_v3,917.22,3717.86,0.0
256,65536,512,7168,ck,13,True,0,355.1998,a8w8_blockscale_bpreshuffle_1x128x128_256x64x256x128_16x16_16x16_8x32x1_8x32x1_1x32x1x8_8_2x1_intrawave_v1,1354.27,1521.79,0.0
256,65536,576,7168,ck,0,False,0,547.4965,a8w8_blockscale_1x128x128_256x128x128x128_16x16_32x32_2x2_8x32x1_8x32x1_1x32x1x8_8_1x1_intrawave_v3,988.44,1003.46,0.0
256,65536,1024,7168,ck,13,True,0,654.722,a8w8_blockscale_bpreshuffle_1x128x128_256x64x256x128_16x16_16x16_8x32x1_8x32x1_1x32x1x8_8_2x1_intrawave_v1,1469.44,933.71,0.0
256,65536,1536,7168,ck,13,True,0,977.507,a8w8_blockscale_bpreshuffle_1x128x128_256x64x256x128_16x16_16x16_8x32x1_8x32x1_1x32x1x8_8_2x1_intrawave_v1,1476.32,697.79,0.0
256,65536,2112,7168,ck,0,False,0,1756.7427,a8w8_blockscale_1x128x128_256x128x128x128_16x16_32x32_2x2_8x32x1_8x32x1_1x32x1x8_8_1x1_intrawave_v3,1129.52,433.6,0.0
256,65536,2240,7168,ck,0,False,0,1822.7917,a8w8_blockscale_1x128x128_256x128x128x128_16x16_32x32_2x2_8x32x1_8x32x1_1x32x1x8_8_1x1_intrawave_v3,1154.57,427.6,0.0
256,65536,3072,1536,ck,13,True,0,494.8383,a8w8_blockscale_bpreshuffle_1x128x128_256x64x256x128_16x16_16x16_8x32x1_8x32x1_1x32x1x8_8_2x1_intrawave_v1,1249.85,1026.67,0.0
256,65536,4096,512,ck,13,True,0,330.1253,a8w8_blockscale_bpreshuffle_1x128x128_256x64x256x128_16x16_16x16_8x32x1_8x32x1_1x32x1x8_8_2x1_intrawave_v1,832.65,1734.26,0.0
256,65536,4096,7168,ck,13,True,0,2535.663,a8w8_blockscale_bpreshuffle_1x128x128_256x64x256x128_16x16_16x16_8x32x1_8x32x1_1x32x1x8_8_2x1_intrawave_v1,1517.67,408.57,0.0
256,65536,4608,7168,ck,13,True,0,2859.4369,a8w8_blockscale_bpreshuffle_1x128x128_256x64x256x128_16x16_16x16_8x32x1_8x32x1_1x32x1x8_8_2x1_intrawave_v1,1514.05,387.06,0.0
256,65536,6144,1536,ck,13,True,0,973.2772,a8w8_blockscale_bpreshuffle_1x128x128_256x64x256x128_16x16_16x16_8x32x1_8x32x1_1x32x1x8_8_2x1_intrawave_v1,1270.91,940.54,0.0
256,65536,7168,256,ck,13,True,0,381.6446,a8w8_blockscale_bpreshuffle_1x128x128_256x64x256x128_16x16_16x16_8x32x1_8x32x1_1x32x1x8_8_2x1_intrawave_v1,630.22,2510.55,0.0
256,65536,7168,512,ck,13,True,0,546.7195,a8w8_blockscale_bpreshuffle_1x128x128_256x64x256x128_16x16_16x16_8x32x1_8x32x1_1x32x1x8_8_2x1_intrawave_v1,879.86,1786.56,0.0
256,65536,7168,2048,ck,13,True,0,1422.2447,a8w8_blockscale_bpreshuffle_1x128x128_256x64x256x128_16x16_16x16_8x32x1_8x32x1_1x32x1x8_8_2x1_intrawave_v1,1352.89,765.28,0.0
256,65536,7168,2304,ck,13,True,0,1575.4864,a8w8_blockscale_bpreshuffle_1x128x128_256x64x256x128_16x16_16x16_8x32x1_8x32x1_1x32x1x8_8_2x1_intrawave_v1,1373.97,702.66,0.0
256,65536,7168,4096,ck,13,True,0,2596.3903,a8w8_blockscale_bpreshuffle_1x128x128_256x64x256x128_16x16_16x16_8x32x1_8x32x1_1x32x1x8_8_2x1_intrawave_v1,1482.17,476.55,0.0
256,65536,7168,4608,ck,13,True,0,2904.1382,a8w8_blockscale_bpreshuffle_1x128x128_256x64x256x128_16x16_16x16_8x32x1_8x32x1_1x32x1x8_8_2x1_intrawave_v1,1490.74,438.87,0.0
256,65536,7168,9216,ck,13,True,0,5557.2962,a8w8_blockscale_bpreshuffle_1x128x128_256x64x256x128_16x16_16x16_8x32x1_8x32x1_1x32x1x8_8_2x1_intrawave_v1,1558.07,289.63,0.0
256,65536,7168,16384,ck,13,True,0,9729.558,a8w8_blockscale_bpreshuffle_1x128x128_256x64x256x128_16x16_16x16_8x32x1_8x32x1_1x32x1x8_8_2x1_intrawave_v1,1582.1,218.99,0.0
256,65536,7168,18432,ck,13,True,0,11058.7043,a8w8_blockscale_bpreshuffle_1x128x128_256x64x256x128_16x16_16x16_8x32x1_8x32x1_1x32x1x8_8_2x1_intrawave_v1,1565.94,206.14,0.0
256,65536,8192,512,ck,13,True,0,632.2405,a8w8_blockscale_bpreshuffle_1x128x128_256x64x256x128_16x16_16x16_8x32x1_8x32x1_1x32x1x8_8_2x1_intrawave_v1,869.54,1758.02,0.0
256,65536,8192,1536,ck,13,True,0,1292.6709,a8w8_blockscale_bpreshuffle_1x128x128_256x64x256x128_16x16_16x16_8x32x1_8x32x1_1x32x1x8_8_2x1_intrawave_v1,1275.86,918.24,0.0
256,65536,9216,7168,ck,13,True,0,5600.1111,a8w8_blockscale_bpreshuffle_1x128x128_256x64x256x128_16x16_16x16_8x32x1_8x32x1_1x32x1x8_8_2x1_intrawave_v1,1546.16,311.38,0.0
256,65536,11264,1536,ck,13,True,0,1756.6562,a8w8_blockscale_bpreshuffle_1x128x128_256x64x256x128_16x16_16x16_8x32x1_8x32x1_1x32x1x8_8_2x1_intrawave_v1,1290.94,907.61,0.0
256,65536,12288,1536,ck,13,True,0,1920.9503,a8w8_blockscale_bpreshuffle_1x128x128_256x64x256x128_16x16_16x16_8x32x1_8x32x1_1x32x1x8_8_2x1_intrawave_v1,1287.85,900.67,0.0
256,65536,14336,1536,ck,13,True,0,2239.2007,a8w8_blockscale_bpreshuffle_1x128x128_256x64x256x128_16x16_16x16_8x32x1_8x32x1_1x32x1x8_8_2x1_intrawave_v1,1288.95,893.95,0.0
256,65536,16384,512,ck,13,True,0,1230.0844,a8w8_blockscale_bpreshuffle_1x128x128_256x64x256x128_16x16_16x16_8x32x1_8x32x1_1x32x1x8_8_2x1_intrawave_v1,893.85,1779.9,0.0
256,65536,20480,1536,ck,13,True,0,3182.7711,a8w8_blockscale_bpreshuffle_1x128x128_256x64x256x128_16x16_16x16_8x32x1_8x32x1_1x32x1x8_8_2x1_intrawave_v1,1295.47,884.91,0.0
256,65536,24576,1536,ck,13,True,0,3815.9009,a8w8_blockscale_bpreshuffle_1x128x128_256x64x256x128_16x16_16x16_8x32x1_8x32x1_1x32x1x8_8_2x1_intrawave_v1,1296.63,880.43,0.0
256,98304,7168,4096,ck,13,True,0,3880.2506,a8w8_blockscale_bpreshuffle_1x128x128_256x64x256x128_16x16_16x16_8x32x1_8x32x1_1x32x1x8_8_2x1_intrawave_v1,1487.65,474.53,0.0
256,98304,7168,4608,ck,13,True,0,4357.069,a8w8_blockscale_bpreshuffle_1x128x128_256x64x256x128_16x16_16x16_8x32x1_8x32x1_1x32x1x8_8_2x1_intrawave_v1,1490.45,434.99,0.0
256,98304,7168,9216,ck,13,True,0,8347.2245,a8w8_blockscale_bpreshuffle_1x128x128_256x64x256x128_16x16_16x16_8x32x1_8x32x1_1x32x1x8_8_2x1_intrawave_v1,1555.96,285.28,0.0
256,98304,7168,16384,ck,13,True,0,14578.5965,a8w8_blockscale_bpreshuffle_1x128x128_256x64x256x128_16x16_16x16_8x32x1_8x32x1_1x32x1x8_8_2x1_intrawave_v1,1583.81,215.2,0.0
256,98304,7168,18432,ck,13,True,0,16468.2768,a8w8_blockscale_bpreshuffle_1x128x128_256x64x256x128_16x16_16x16_8x32x1_8x32x1_1x32x1x8_8_2x1_intrawave_v1,1577.33,203.62,0.0
256,98304,8192,512,ck,13,True,0,938.6132,a8w8_blockscale_bpreshuffle_1x128x128_256x64x256x128_16x16_16x16_8x32x1_8x32x1_1x32x1x8_8_2x1_intrawave_v1,878.57,1774.04,0.0
256,98304,8192,1536,ck,13,True,0,1927.8151,a8w8_blockscale_bpreshuffle_1x128x128_256x64x256x128_16x16_16x16_8x32x1_8x32x1_1x32x1x8_8_2x1_intrawave_v1,1283.27,920.31,0.0
256,98304,9216,7168,ck,13,True,0,8427.5255,a8w8_blockscale_bpreshuffle_1x128x128_256x64x256x128_16x16_16x16_8x32x1_8x32x1_1x32x1x8_8_2x1_intrawave_v1,1541.14,306.45,0.0
256,98304,11264,1536,ck,13,True,0,2634.3259,a8w8_blockscale_bpreshuffle_1x128x128_256x64x256x128_16x16_16x16_8x32x1_8x32x1_1x32x1x8_8_2x1_intrawave_v1,1291.27,904.55,0.0
256,98304,12288,1536,ck,13,True,0,2881.8387,a8w8_blockscale_bpreshuffle_1x128x128_256x64x256x128_16x16_16x16_8x32x1_8x32x1_1x32x1x8_8_2x1_intrawave_v1,1287.67,897.27,0.0
256,98304,14336,1536,ck,13,True,0,3352.6389,a8w8_blockscale_bpreshuffle_1x128x128_256x64x256x128_16x16_16x16_8x32x1_8x32x1_1x32x1x8_8_2x1_intrawave_v1,1291.32,892.31,0.0
256,98304,16384,512,ck,13,True,0,1841.4236,a8w8_blockscale_bpreshuffle_1x128x128_256x64x256x128_16x16_16x16_8x32x1_8x32x1_1x32x1x8_8_2x1_intrawave_v1,895.65,1781.2,0.0
256,98304,20480,1536,ck,13,True,0,4787.2231,a8w8_blockscale_bpreshuffle_1x128x128_256x64x256x128_16x16_16x16_8x32x1_8x32x1_1x32x1x8_8_2x1_intrawave_v1,1291.93,879.21,0.0
256,131072,128,7168,ck,0,True,0,264.9435,a8w8_blockscale_bpreshuffle_1x128x128_256x128x128x128_16x16_16x16_8x32x1_8x32x1_1x32x1x8_8_2x1_intrawave_v3,907.81,3676.24,0.0
256,131072,512,7168,ck,13,True,0,697.4609,a8w8_blockscale_bpreshuffle_1x128x128_256x64x256x128_16x16_16x16_8x32x1_8x32x1_1x32x1x8_8_2x1_intrawave_v1,1379.39,1544.76,0.0
256,131072,576,7168,ck,0,False,0,1098.1242,a8w8_blockscale_1x128x128_256x128x128x128_16x16_32x32_2x2_8x32x1_8x32x1_1x32x1x8_8_1x1_intrawave_v3,985.62,996.83,0.0
256,131072,1024,7168,ck,13,True,0,1305.0496,a8w8_blockscale_bpreshuffle_1x128x128_256x64x256x128_16x16_16x16_8x32x1_8x32x1_1x32x1x8_8_2x1_intrawave_v1,1474.38,931.23,0.0
256,131072,1536,7168,ck,13,True,0,1951.2335,a8w8_blockscale_bpreshuffle_1x128x128_256x64x256x128_16x16_16x16_8x32x1_8x32x1_1x32x1x8_8_2x1_intrawave_v1,1479.18,693.5,0.0
256,131072,2112,7168,ck,0,False,0,3572.4844,a8w8_blockscale_1x128x128_256x128x128x128_16x16_32x32_2x2_8x32x1_8x32x1_1x32x1x8_8_1x1_intrawave_v3,1110.87,422.2,0.0
256,131072,2240,7168,ck,0,False,0,3677.8881,a8w8_blockscale_1x128x128_256x128x128x128_16x16_32x32_2x2_8x32x1_8x32x1_1x32x1x8_8_1x1_intrawave_v3,1144.43,419.48,0.0
256,131072,3072,1536,ck,13,True,0,982.3398,a8w8_blockscale_bpreshuffle_1x128x128_256x64x256x128_16x16_16x16_8x32x1_8x32x1_1x32x1x8_8_2x1_intrawave_v1,1259.19,1029.53,0.0
256,131072,4096,512,ck,13,True,0,648.6031,a8w8_blockscale_bpreshuffle_1x128x128_256x64x256x128_16x16_16x16_8x32x1_8x32x1_1x32x1x8_8_2x1_intrawave_v1,847.6,1762.17,0.0
256,131072,4096,7168,ck,13,True,0,5075.0628,a8w8_blockscale_bpreshuffle_1x128x128_256x64x256x128_16x16_16x16_8x32x1_8x32x1_1x32x1x8_8_2x1_intrawave_v1,1516.55,402.48,0.0
256,131072,6144,1536,ck,13,True,0,1939.5308,a8w8_blockscale_bpreshuffle_1x128x128_256x64x256x128_16x16_16x16_8x32x1_8x32x1_1x32x1x8_8_2x1_intrawave_v1,1275.52,939.08,0.0
256,131072,7168,256,ck,13,True,0,756.7098,a8w8_blockscale_bpreshuffle_1x128x128_256x64x256x128_16x16_16x16_8x32x1_8x32x1_1x32x1x8_8_2x1_intrawave_v1,635.69,2529.95,0.0
256,131072,7168,512,ck,13,True,0,1084.2048,a8w8_blockscale_bpreshuffle_1x128x128_256x64x256x128_16x16_16x16_8x32x1_8x32x1_1x32x1x8_8_2x1_intrawave_v1,887.35,1798.39,0.0
256,131072,7168,2048,ck,13,True,0,2847.1197,a8w8_blockscale_bpreshuffle_1x128x128_256x64x256x128_16x16_16x16_8x32x1_8x32x1_1x32x1x8_8_2x1_intrawave_v1,1351.64,759.42,0.0
256,131072,7168,4096,ck,13,True,0,5198.5363,a8w8_blockscale_bpreshuffle_1x128x128_256x64x256x128_16x16_16x16_8x32x1_8x32x1_1x32x1x8_8_2x1_intrawave_v1,1480.53,470.38,0.0
256,131072,7168,4608,ck,13,True,0,5805.3535,a8w8_blockscale_bpreshuffle_1x128x128_256x64x256x128_16x16_16x16_8x32x1_8x32x1_1x32x1x8_8_2x1_intrawave_v1,1491.49,433.4,0.0
256,131072,7168,9216,ck,13,True,0,11153.3594,a8w8_blockscale_bpreshuffle_1x128x128_256x64x256x128_16x16_16x16_8x32x1_8x32x1_1x32x1x8_8_2x1_intrawave_v1,1552.65,282.7,0.0
256,131072,7168,16384,ck,13,True,0,19541.4144,a8w8_blockscale_bpreshuffle_1x128x128_256x64x256x128_16x16_16x16_8x32x1_8x32x1_1x32x1x8_8_2x1_intrawave_v1,1575.44,212.06,0.0
256,131072,7168,18432,ck,13,True,0,22012.1505,a8w8_blockscale_bpreshuffle_1x128x128_256x64x256x128_16x16_16x16_8x32x1_8x32x1_1x32x1x8_8_2x1_intrawave_v1,1573.43,201.12,0.0
256,131072,8192,512,ck,13,True,0,1253.9241,a8w8_blockscale_bpreshuffle_1x128x128_256x64x256x128_16x16_16x16_8x32x1_8x32x1_1x32x1x8_8_2x1_intrawave_v1,876.86,1769.47,0.0
256,131072,8192,1536,ck,13,True,0,2568.4829,a8w8_blockscale_bpreshuffle_1x128x128_256x64x256x128_16x16_16x16_8x32x1_8x32x1_1x32x1x8_8_2x1_intrawave_v1,1284.23,919.37,0.0
256,131072,9216,7168,ck,13,True,0,11242.24,a8w8_blockscale_bpreshuffle_1x128x128_256x64x256x128_16x16_16x16_8x32x1_8x32x1_1x32x1x8_8_2x1_intrawave_v1,1540.38,304.34,0.0
256,131072,12288,1536,ck,13,True,0,3840.5249,a8w8_blockscale_bpreshuffle_1x128x128_256x64x256x128_16x16_16x16_8x32x1_8x32x1_1x32x1x8_8_2x1_intrawave_v1,1288.31,896.08,0.0
256,131072,14336,1536,ck,13,True,0,4471.951,a8w8_blockscale_bpreshuffle_1x128x128_256x64x256x128_16x16_16x16_8x32x1_8x32x1_1x32x1x8_8_2x1_intrawave_v1,1290.81,890.31,0.0
