aiter/configs/model_configs/a8w8_blockscale_tuned_gemm_qwen3_5-35B-A3B.csv
cu_num,M,N,K,libtype,kernelId,splitK,us,kernelName,tflops,bw,errRatio
64,1,512,2048,ck,7,0,10.4379,a8w8_blockscale_1x128x128_256x16x128x256_16x16_16x16_1x2_16x16x1_16x16x1_1x16x1x16_8_1x2_intrawave_v1,0.2,100.75,0.0
64,2,512,2048,ck,5,0,8.9695,a8w8_blockscale_1x128x128_256x16x128x128_8x16_16x16_1x2_16x16x1_8x32x1_1x16x1x16_8_1x2_intrawave_v1,0.47,117.59,0.0
64,4,512,2048,ck,7,0,8.0667,a8w8_blockscale_1x128x128_256x16x128x256_16x16_16x16_1x2_16x16x1_16x16x1_1x16x1x16_8_1x2_intrawave_v1,1.04,131.51,0.0
64,8,512,2048,ck,7,0,8.1379,a8w8_blockscale_1x128x128_256x16x128x256_16x16_16x16_1x2_16x16x1_16x16x1_1x16x1x16_8_1x2_intrawave_v1,2.06,131.87,0.0
64,16,512,2048,ck,7,0,8.1691,a8w8_blockscale_1x128x128_256x16x128x256_16x16_16x16_1x2_16x16x1_16x16x1_1x16x1x16_8_1x2_intrawave_v1,4.11,134.38,0.0
64,16,512,7168,ck,5,0,19.6937,a8w8_blockscale_1x128x128_256x16x128x128_8x16_16x16_1x2_16x16x1_8x32x1_1x16x1x16_8_1x2_intrawave_v1,5.96,193.01,0.0
64,24,512,2048,ck,5,0,8.7289,a8w8_blockscale_1x128x128_256x16x128x128_8x16_16x16_1x2_16x16x1_8x32x1_1x16x1x16_8_1x2_intrawave_v1,5.77,128.57,0.0
64,32,512,2048,ck,5,0,8.7023,a8w8_blockscale_1x128x128_256x16x128x128_8x16_16x16_1x2_16x16x1_8x32x1_1x16x1x16_8_1x2_intrawave_v1,7.71,131.79,0.0
64,32,512,7168,ck,5,0,21.4889,a8w8_blockscale_1x128x128_256x16x128x128_8x16_16x16_1x2_16x16x1_8x32x1_1x16x1x16_8_1x2_intrawave_v1,10.93,182.99,0.0
64,40,512,2048,ck,5,0,9.5387,a8w8_blockscale_1x128x128_256x16x128x128_8x16_16x16_1x2_16x16x1_8x32x1_1x16x1x16_8_1x2_intrawave_v1,8.79,122.81,0.0
64,48,512,2048,ck,7,0,8.5526,a8w8_blockscale_1x128x128_256x16x128x256_16x16_16x16_1x2_16x16x1_16x16x1_1x16x1x16_8_1x2_intrawave_v1,11.77,139.84,0.0
64,56,512,2048,ck,7,0,8.5462,a8w8_blockscale_1x128x128_256x16x128x256_16x16_16x16_1x2_16x16x1_16x16x1_1x16x1x16_8_1x2_intrawave_v1,13.74,142.82,0.0
64,64,512,2048,ck,7,0,8.5303,a8w8_blockscale_1x128x128_256x16x128x256_16x16_16x16_1x2_16x16x1_16x16x1_1x16x1x16_8_1x2_intrawave_v1,15.73,145.97,0.0
64,64,512,7168,ck,7,0,21.5809,a8w8_blockscale_1x128x128_256x16x128x256_16x16_16x16_1x2_16x16x1_16x16x1_1x16x1x16_8_1x2_intrawave_v1,21.77,194.35,0.0
64,72,512,2048,ck,7,0,8.6839,a8w8_blockscale_1x128x128_256x16x128x256_16x16_16x16_1x2_16x16x1_16x16x1_1x16x1x16_8_1x2_intrawave_v1,17.39,146.22,0.0
64,80,512,2048,ck,5,0,9.0587,a8w8_blockscale_1x128x128_256x16x128x128_8x16_16x16_1x2_16x16x1_8x32x1_1x16x1x16_8_1x2_intrawave_v1,18.52,142.88,0.0
64,88,512,2048,ck,7,0,8.6947,a8w8_blockscale_1x128x128_256x16x128x256_16x16_16x16_1x2_16x16x1_16x16x1_1x16x1x16_8_1x2_intrawave_v1,21.23,151.69,0.0
64,96,512,2048,ck,7,0,8.8059,a8w8_blockscale_1x128x128_256x16x128x256_16x16_16x16_1x2_16x16x1_16x16x1_1x16x1x16_8_1x2_intrawave_v1,22.86,152.57,0.0
64,104,512,2048,ck,7,0,8.8682,a8w8_blockscale_1x128x128_256x16x128x256_16x16_16x16_1x2_16x16x1_16x16x1_1x16x1x16_8_1x2_intrawave_v1,24.59,154.27,0.0
64,112,512,2048,ck,7,0,8.9047,a8w8_blockscale_1x128x128_256x16x128x256_16x16_16x16_1x2_16x16x1_16x16x1_1x16x1x16_8_1x2_intrawave_v1,26.38,156.39,0.0
64,120,512,2048,ck,7,0,8.9783,a8w8_blockscale_1x128x128_256x16x128x256_16x16_16x16_1x2_16x16x1_16x16x1_1x16x1x16_8_1x2_intrawave_v1,28.03,157.85,0.0
64,128,512,2048,ck,5,0,9.3691,a8w8_blockscale_1x128x128_256x16x128x128_8x16_16x16_1x2_16x16x1_8x32x1_1x16x1x16_8_1x2_intrawave_v1,28.65,153.89,0.0
64,128,512,7168,ck,7,0,22.2689,a8w8_blockscale_1x128x128_256x16x128x256_16x16_16x16_1x2_16x16x1_16x16x1_1x16x1x16_8_1x2_intrawave_v1,42.19,211.89,0.0
64,136,512,2048,ck,4,0,10.4347,a8w8_blockscale_1x128x128_256x16x256x128_8x16_16x16_1x4_16x16x1_8x32x1_1x16x1x16_8_1x2_intrawave_v1,27.33,140.53,0.0
64,144,512,2048,ck,5,0,9.7955,a8w8_blockscale_1x128x128_256x16x128x128_8x16_16x16_1x2_16x16x1_8x32x1_1x16x1x16_8_1x2_intrawave_v1,30.83,152.21,0.0
64,152,512,2048,ck,5,0,10.1127,a8w8_blockscale_1x128x128_256x16x128x128_8x16_16x16_1x2_16x16x1_8x32x1_1x16x1x16_8_1x2_intrawave_v1,31.52,149.86,0.0
64,160,512,2048,ck,5,0,9.8719,a8w8_blockscale_1x128x128_256x16x128x128_8x16_16x16_1x2_16x16x1_8x32x1_1x16x1x16_8_1x2_intrawave_v1,33.99,156.01,0.0
64,168,512,2048,ck,5,0,10.1304,a8w8_blockscale_1x128x128_256x16x128x128_8x16_16x16_1x2_16x16x1_8x32x1_1x16x1x16_8_1x2_intrawave_v1,34.78,154.45,0.0
64,176,512,2048,ck,5,0,10.1107,a8w8_blockscale_1x128x128_256x16x128x128_8x16_16x16_1x2_16x16x1_8x32x1_1x16x1x16_8_1x2_intrawave_v1,36.51,157.18,0.0
64,184,512,2048,ck,4,0,10.7847,a8w8_blockscale_1x128x128_256x16x256x128_8x16_16x16_1x4_16x16x1_8x32x1_1x16x1x16_8_1x2_intrawave_v1,35.78,149.64,0.0
64,192,512,2048,ck,5,0,10.1391,a8w8_blockscale_1x128x128_256x16x128x128_8x16_16x16_1x2_16x16x1_8x32x1_1x16x1x16_8_1x2_intrawave_v1,39.71,161.59,0.0
64,200,512,2048,ck,5,0,10.4691,a8w8_blockscale_1x128x128_256x16x128x128_8x16_16x16_1x2_16x16x1_8x32x1_1x16x1x16_8_1x2_intrawave_v1,40.06,158.85,0.0
64,208,512,2048,ck,5,0,10.2647,a8w8_blockscale_1x128x128_256x16x128x128_8x16_16x16_1x2_16x16x1_8x32x1_1x16x1x16_8_1x2_intrawave_v1,42.5,164.4,0.0
64,216,512,2048,ck,5,0,10.45,a8w8_blockscale_1x128x128_256x16x128x128_8x16_16x16_1x2_16x16x1_8x32x1_1x16x1x16_8_1x2_intrawave_v1,43.35,163.84,0.0
64,224,512,2048,ck,5,0,10.3259,a8w8_blockscale_1x128x128_256x16x128x128_8x16_16x16_1x2_16x16x1_8x32x1_1x16x1x16_8_1x2_intrawave_v1,45.49,168.19,0.0
64,232,512,2048,ck,5,0,10.5303,a8w8_blockscale_1x128x128_256x16x128x128_8x16_16x16_1x2_16x16x1_8x32x1_1x16x1x16_8_1x2_intrawave_v1,46.2,167.26,0.0
64,240,512,2048,ck,7,0,12.408,a8w8_blockscale_1x128x128_256x16x128x256_16x16_16x16_1x2_16x16x1_16x16x1_1x16x1x16_8_1x2_intrawave_v1,40.56,143.93,0.0
64,248,512,2048,ck,5,0,10.568,a8w8_blockscale_1x128x128_256x16x128x128_8x16_16x16_1x2_16x16x1_8x32x1_1x16x1x16_8_1x2_intrawave_v1,49.21,171.31,0.0
64,256,512,2048,ck,5,0,10.2971,a8w8_blockscale_1x128x128_256x16x128x128_8x16_16x16_1x2_16x16x1_8x32x1_1x16x1x16_8_1x2_intrawave_v1,52.14,178.21,0.0
64,256,512,7168,ck,5,0,25.7121,a8w8_blockscale_1x128x128_256x16x128x128_8x16_16x16_1x2_16x16x1_8x32x1_1x16x1x16_8_1x2_intrawave_v1,73.08,224.3,0.0
64,264,512,2048,ck,5,0,11.4352,a8w8_blockscale_1x128x128_256x16x128x128_8x16_16x16_1x2_16x16x1_8x32x1_1x16x1x16_8_1x2_intrawave_v1,48.42,162.62,0.0
64,272,512,2048,ck,5,0,11.5199,a8w8_blockscale_1x128x128_256x16x128x128_8x16_16x16_1x2_16x16x1_8x32x1_1x16x1x16_8_1x2_intrawave_v1,49.52,163.56,0.0
64,280,512,2048,ck,5,0,11.4795,a8w8_blockscale_1x128x128_256x16x128x128_8x16_16x16_1x2_16x16x1_8x32x1_1x16x1x16_8_1x2_intrawave_v1,51.15,166.27,0.0
64,288,512,2048,ck,5,0,11.5487,a8w8_blockscale_1x128x128_256x16x128x128_8x16_16x16_1x2_16x16x1_8x32x1_1x16x1x16_8_1x2_intrawave_v1,52.3,167.41,0.0
64,296,512,2048,ck,5,0,11.5739,a8w8_blockscale_1x128x128_256x16x128x128_8x16_16x16_1x2_16x16x1_8x32x1_1x16x1x16_8_1x2_intrawave_v1,53.63,169.16,0.0
64,304,512,2048,ck,5,0,11.6232,a8w8_blockscale_1x128x128_256x16x128x128_8x16_16x16_1x2_16x16x1_8x32x1_1x16x1x16_8_1x2_intrawave_v1,54.85,170.56,0.0
64,312,512,2048,ck,5,0,11.7611,a8w8_blockscale_1x128x128_256x16x128x128_8x16_16x16_1x2_16x16x1_8x32x1_1x16x1x16_8_1x2_intrawave_v1,55.63,170.65,0.0
64,320,512,2048,ck,5,0,11.6451,a8w8_blockscale_1x128x128_256x16x128x128_8x16_16x16_1x2_16x16x1_8x32x1_1x16x1x16_8_1x2_intrawave_v1,57.63,174.46,0.0
64,328,512,2048,ck,5,0,10.5267,a8w8_blockscale_1x128x128_256x16x128x128_8x16_16x16_1x2_16x16x1_8x32x1_1x16x1x16_8_1x2_intrawave_v1,65.34,195.33,0.0
64,336,512,2048,ck,5,0,11.8467,a8w8_blockscale_1x128x128_256x16x128x128_8x16_16x16_1x2_16x16x1_8x32x1_1x16x1x16_8_1x2_intrawave_v1,59.48,175.64,0.0
64,344,512,2048,ck,5,0,12.6728,a8w8_blockscale_1x128x128_256x16x128x128_8x16_16x16_1x2_16x16x1_8x32x1_1x16x1x16_8_1x2_intrawave_v1,56.93,166.13,0.0
64,352,512,2048,ck,5,0,11.946,a8w8_blockscale_1x128x128_256x16x128x128_8x16_16x16_1x2_16x16x1_8x32x1_1x16x1x16_8_1x2_intrawave_v1,61.79,178.3,0.0
64,360,512,2048,ck,4,0,13.8909,a8w8_blockscale_1x128x128_256x16x256x128_8x16_16x16_1x4_16x16x1_8x32x1_1x16x1x16_8_1x2_intrawave_v1,54.35,155.1,0.0
64,368,512,2048,ck,5,0,12.034,a8w8_blockscale_1x128x128_256x16x128x128_8x16_16x16_1x2_16x16x1_8x32x1_1x16x1x16_8_1x2_intrawave_v1,64.13,181.08,0.0
64,376,512,2048,ck,4,0,13.3212,a8w8_blockscale_1x128x128_256x16x256x128_8x16_16x16_1x4_16x16x1_8x32x1_1x16x1x16_8_1x2_intrawave_v1,59.19,165.42,0.0
64,384,512,2048,ck,5,0,12.0636,a8w8_blockscale_1x128x128_256x16x128x128_8x16_16x16_1x2_16x16x1_8x32x1_1x16x1x16_8_1x2_intrawave_v1,66.76,184.71,0.0
64,392,512,2048,ck,4,0,13.9527,a8w8_blockscale_1x128x128_256x16x256x128_8x16_16x16_1x4_16x16x1_8x32x1_1x16x1x16_8_1x2_intrawave_v1,58.92,161.46,0.0
64,400,512,2048,ck,5,0,15.5927,a8w8_blockscale_1x128x128_256x16x128x128_8x16_16x16_1x2_16x16x1_8x32x1_1x16x1x16_8_1x2_intrawave_v1,53.8,146.05,0.0
64,408,512,2048,ck,4,0,13.7392,a8w8_blockscale_1x128x128_256x16x256x128_8x16_16x16_1x4_16x16x1_8x32x1_1x16x1x16_8_1x2_intrawave_v1,62.28,167.55,0.0
64,416,512,2048,ck,5,0,13.9519,a8w8_blockscale_1x128x128_256x16x128x128_8x16_16x16_1x2_16x16x1_8x32x1_1x16x1x16_8_1x2_intrawave_v1,62.53,166.75,0.0
64,424,512,2048,ck,4,0,13.894,a8w8_blockscale_1x128x128_256x16x256x128_8x16_16x16_1x4_16x16x1_8x32x1_1x16x1x16_8_1x2_intrawave_v1,64.0,169.22,0.0
64,432,512,2048,ck,4,0,13.9791,a8w8_blockscale_1x128x128_256x16x256x128_8x16_16x16_1x4_16x16x1_8x32x1_1x16x1x16_8_1x2_intrawave_v1,64.81,169.95,0.0
64,440,512,2048,ck,4,0,13.8468,a8w8_blockscale_1x128x128_256x16x256x128_8x16_16x16_1x4_16x16x1_8x32x1_1x16x1x16_8_1x2_intrawave_v1,66.64,173.34,0.0
64,448,512,2048,ck,5,0,13.8824,a8w8_blockscale_1x128x128_256x16x128x128_8x16_16x16_1x2_16x16x1_8x32x1_1x16x1x16_8_1x2_intrawave_v1,67.68,174.67,0.0
64,456,512,2048,ck,5,0,14.176,a8w8_blockscale_1x128x128_256x16x128x128_8x16_16x16_1x2_16x16x1_8x32x1_1x16x1x16_8_1x2_intrawave_v1,67.46,172.79,0.0
64,464,512,2048,ck,5,0,14.486,a8w8_blockscale_1x128x128_256x16x128x128_8x16_16x16_1x2_16x16x1_8x32x1_1x16x1x16_8_1x2_intrawave_v1,67.17,170.78,0.0
64,472,512,2048,ck,4,0,14.3331,a8w8_blockscale_1x128x128_256x16x256x128_8x16_16x16_1x4_16x16x1_8x32x1_1x16x1x16_8_1x2_intrawave_v1,69.06,174.32,0.0
64,480,512,2048,ck,5,0,13.3496,a8w8_blockscale_1x128x128_256x16x128x128_8x16_16x16_1x2_16x16x1_8x32x1_1x16x1x16_8_1x2_intrawave_v1,75.41,189.0,0.0
64,488,512,2048,ck,4,0,13.1844,a8w8_blockscale_1x128x128_256x16x256x128_8x16_16x16_1x4_16x16x1_8x32x1_1x16x1x16_8_1x2_intrawave_v1,77.62,193.24,0.0
64,496,512,2048,ck,5,0,12.9779,a8w8_blockscale_1x128x128_256x16x128x128_8x16_16x16_1x2_16x16x1_8x32x1_1x16x1x16_8_1x2_intrawave_v1,80.15,198.21,0.0
64,504,512,2048,ck,4,0,13.7907,a8w8_blockscale_1x128x128_256x16x256x128_8x16_16x16_1x4_16x16x1_8x32x1_1x16x1x16_8_1x2_intrawave_v1,76.64,188.31,0.0
64,512,512,2048,ck,5,0,13.9824,a8w8_blockscale_1x128x128_256x16x128x128_8x16_16x16_1x2_16x16x1_8x32x1_1x16x1x16_8_1x2_intrawave_v1,76.79,187.48,0.0
64,512,512,7168,ck,4,0,37.4301,a8w8_blockscale_1x128x128_256x16x256x128_8x16_16x16_1x4_16x16x1_8x32x1_1x16x1x16_8_1x2_intrawave_v1,100.4,210.11,0.0
64,1024,512,2048,ck,5,0,22.7933,a8w8_blockscale_1x128x128_256x16x128x128_8x16_16x16_1x2_16x16x1_8x32x1_1x16x1x16_8_1x2_intrawave_v1,94.22,184.01,0.0
64,1024,512,7168,ck,5,0,70.906,a8w8_blockscale_1x128x128_256x16x128x128_8x16_16x16_1x2_16x16x1_8x32x1_1x16x1x16_8_1x2_intrawave_v1,106.0,170.06,0.0
64,1536,512,7168,ck,4,0,83.1748,a8w8_blockscale_1x128x128_256x16x256x128_8x16_16x16_1x4_16x16x1_8x32x1_1x16x1x16_8_1x2_intrawave_v1,135.55,195.41,0.0
64,2048,512,2048,ck,4,0,42.2697,a8w8_blockscale_1x128x128_256x16x256x128_8x16_16x16_1x4_16x16x1_8x32x1_1x16x1x16_8_1x2_intrawave_v1,101.61,173.65,0.0
64,2048,512,7168,ck,4,0,116.6605,a8w8_blockscale_1x128x128_256x16x256x128_8x16_16x16_1x4_16x16x1_8x32x1_1x16x1x16_8_1x2_intrawave_v1,128.86,175.27,0.0
64,4096,512,2048,ck,4,0,76.8486,a8w8_blockscale_1x128x128_256x16x256x128_8x16_16x16_1x4_16x16x1_8x32x1_1x16x1x16_8_1x2_intrawave_v1,111.78,177.38,0.0
64,4096,512,7168,ck,4,0,213.7524,a8w8_blockscale_1x128x128_256x16x256x128_8x16_16x16_1x4_16x16x1_8x32x1_1x16x1x16_8_1x2_intrawave_v1,140.65,174.15,0.0
64,8192,512,2048,ck,4,0,131.9558,a8w8_blockscale_1x128x128_256x16x256x128_8x16_16x16_1x4_16x16x1_8x32x1_1x16x1x16_8_1x2_intrawave_v1,130.19,198.66,0.0
64,8192,512,7168,ck,4,0,417.0123,a8w8_blockscale_1x128x128_256x16x256x128_8x16_16x16_1x4_16x16x1_8x32x1_1x16x1x16_8_1x2_intrawave_v1,144.19,169.73,0.0
64,16384,512,2048,ck,4,0,265.9049,a8w8_blockscale_1x128x128_256x16x256x128_8x16_16x16_1x4_16x16x1_8x32x1_1x16x1x16_8_1x2_intrawave_v1,129.22,193.23,0.0
64,16384,512,7168,ck,4,0,818.9168,a8w8_blockscale_1x128x128_256x16x256x128_8x16_16x16_1x4_16x16x1_8x32x1_1x16x1x16_8_1x2_intrawave_v1,146.85,168.38,0.0
64,20480,512,2048,ck,4,0,331.4829,a8w8_blockscale_1x128x128_256x16x256x128_8x16_16x16_1x4_16x16x1_8x32x1_1x16x1x16_8_1x2_intrawave_v1,129.57,192.96,0.0
64,20480,512,7168,ck,4,0,1020.2685,a8w8_blockscale_1x128x128_256x16x256x128_8x16_16x16_1x4_16x16x1_8x32x1_1x16x1x16_8_1x2_intrawave_v1,147.34,168.04,0.0
64,16,576,7168,ck,7,0,25.2051,a8w8_blockscale_1x128x128_256x16x128x256_16x16_16x16_1x2_16x16x1_16x16x1_1x16x1x16_8_1x2_intrawave_v1,5.24,169.09,0.0
64,32,576,7168,ck,7,0,27.8155,a8w8_blockscale_1x128x128_256x16x128x256_16x16_16x16_1x2_16x16x1_16x16x1_1x16x1x16_8_1x2_intrawave_v1,9.5,158.01,0.0
64,64,576,7168,ck,7,0,28.1682,a8w8_blockscale_1x128x128_256x16x128x256_16x16_16x16_1x2_16x16x1_16x16x1_1x16x1x16_8_1x2_intrawave_v1,18.76,165.48,0.0
64,128,576,7168,ck,5,0,31.7294,a8w8_blockscale_1x128x128_256x16x128x128_8x16_16x16_1x2_16x16x1_8x32x1_1x16x1x16_8_1x2_intrawave_v1,33.31,163.69,0.0
64,256,576,7168,ck,5,0,42.8623,a8w8_blockscale_1x128x128_256x16x128x128_8x16_16x16_1x2_16x16x1_8x32x1_1x16x1x16_8_1x2_intrawave_v1,49.32,146.02,0.0
64,512,576,7168,ck,5,0,66.3525,a8w8_blockscale_1x128x128_256x16x128x128_8x16_16x16_1x2_16x16x1_8x32x1_1x16x1x16_8_1x2_intrawave_v1,63.72,126.42,0.0
64,1024,576,7168,ck,5,0,122.1949,a8w8_blockscale_1x128x128_256x16x128x128_8x16_16x16_1x2_16x16x1_8x32x1_1x16x1x16_8_1x2_intrawave_v1,69.2,103.51,0.0
64,1536,576,7168,ck,5,0,172.8024,a8w8_blockscale_1x128x128_256x16x128x128_8x16_16x16_1x2_16x16x1_8x32x1_1x16x1x16_8_1x2_intrawave_v1,73.4,97.85,0.0
64,2048,576,7168,ck,5,0,228.4508,a8w8_blockscale_1x128x128_256x16x128x128_8x16_16x16_1x2_16x16x1_8x32x1_1x16x1x16_8_1x2_intrawave_v1,74.03,92.66,0.0
64,4096,576,7168,ck,5,0,447.9123,a8w8_blockscale_1x128x128_256x16x128x128_8x16_16x16_1x2_16x16x1_8x32x1_1x16x1x16_8_1x2_intrawave_v1,75.51,85.3,0.0
64,8192,576,7168,ck,5,0,877.6341,a8w8_blockscale_1x128x128_256x16x128x128_8x16_16x16_1x2_16x16x1_8x32x1_1x16x1x16_8_1x2_intrawave_v1,77.08,82.36,0.0
64,16384,576,7168,ck,5,0,1711.816,a8w8_blockscale_1x128x128_256x16x128x128_8x16_16x16_1x2_16x16x1_8x32x1_1x16x1x16_8_1x2_intrawave_v1,79.03,82.04,0.0
64,20480,576,7168,ck,5,0,2132.8093,a8w8_blockscale_1x128x128_256x16x128x128_8x16_16x16_1x2_16x16x1_8x32x1_1x16x1x16_8_1x2_intrawave_v1,79.29,81.83,0.0
64,128,1024,4096,ck,5,0,16.8606,a8w8_blockscale_1x128x128_256x16x128x128_8x16_16x16_1x2_16x16x1_8x32x1_1x16x1x16_8_1x2_intrawave_v1,63.68,295.41,0.0
64,16,1536,7168,ck,7,0,25.6659,a8w8_blockscale_1x128x128_256x16x128x256_16x16_16x16_1x2_16x16x1_16x16x1_1x16x1x16_8_1x2_intrawave_v1,13.73,435.36,0.0
64,32,1536,7168,ck,7,0,25.6437,a8w8_blockscale_1x128x128_256x16x128x256_16x16_16x16_1x2_16x16x1_16x16x1_1x16x1x16_8_1x2_intrawave_v1,27.48,442.13,0.0
64,64,1536,7168,ck,5,0,33.7328,a8w8_blockscale_1x128x128_256x16x128x128_8x16_16x16_1x2_16x16x1_8x32x1_1x16x1x16_8_1x2_intrawave_v1,41.78,345.82,0.0
64,128,1536,7168,ck,5,0,36.4975,a8w8_blockscale_1x128x128_256x16x128x128_8x16_16x16_1x2_16x16x1_8x32x1_1x16x1x16_8_1x2_intrawave_v1,77.23,337.58,0.0
64,256,1536,7168,ck,4,0,53.0244,a8w8_blockscale_1x128x128_256x16x256x128_8x16_16x16_1x4_16x16x1_8x32x1_1x16x1x16_8_1x2_intrawave_v1,106.31,257.08,0.0
64,512,1536,7168,ck,4,0,86.4729,a8w8_blockscale_1x128x128_256x16x256x128_8x16_16x16_1x4_16x16x1_8x32x1_1x16x1x16_8_1x2_intrawave_v1,130.38,187.95,0.0
64,1024,1536,7168,ck,4,0,164.6679,a8w8_blockscale_1x128x128_256x16x256x128_8x16_16x16_1x4_16x16x1_8x32x1_1x16x1x16_8_1x2_intrawave_v1,136.93,130.54,0.0
64,1536,1536,7168,ck,4,0,239.2314,a8w8_blockscale_1x128x128_256x16x256x128_8x16_16x16_1x4_16x16x1_8x32x1_1x16x1x16_8_1x2_intrawave_v1,141.38,111.77,0.0
64,2048,1536,7168,ck,4,0,313.7759,a8w8_blockscale_1x128x128_256x16x256x128_8x16_16x16_1x4_16x16x1_8x32x1_1x16x1x16_8_1x2_intrawave_v1,143.72,101.92,0.0
64,4096,1536,7168,ck,4,0,642.2216,a8w8_blockscale_1x128x128_256x16x256x128_8x16_16x16_1x4_16x16x1_8x32x1_1x16x1x16_8_1x2_intrawave_v1,140.44,82.45,0.0
64,8192,1536,7168,ck,4,0,1218.5593,a8w8_blockscale_1x128x128_256x16x256x128_8x16_16x16_1x4_16x16x1_8x32x1_1x16x1x16_8_1x2_intrawave_v1,148.03,77.88,0.0
64,16384,1536,7168,ck,4,0,2464.8862,a8w8_blockscale_1x128x128_256x16x256x128_8x16_16x16_1x4_16x16x1_8x32x1_1x16x1x16_8_1x2_intrawave_v1,146.37,72.53,0.0
64,20480,1536,7168,ck,4,0,3096.6507,a8w8_blockscale_1x128x128_256x16x256x128_8x16_16x16_1x4_16x16x1_8x32x1_1x16x1x16_8_1x2_intrawave_v1,145.63,71.28,0.0
64,1,2048,256,ck,7,0,3.218,a8w8_blockscale_1x128x128_256x16x128x256_16x16_16x16_1x2_16x16x1_16x16x1_1x16x1x16_8_1x2_intrawave_v1,0.33,164.28,0.0
64,1,2048,2048,ck,7,0,12.39,a8w8_blockscale_1x128x128_256x16x128x256_16x16_16x16_1x2_16x16x1_16x16x1_1x16x1x16_8_1x2_intrawave_v1,0.68,339.02,0.0
64,2,2048,256,ck,7,0,2.7482,a8w8_blockscale_1x128x128_256x16x128x256_16x16_16x16_1x2_16x16x1_16x16x1_1x16x1x16_8_1x2_intrawave_v1,0.76,193.94,0.0
64,2,2048,2048,ck,7,0,11.5069,a8w8_blockscale_1x128x128_256x16x128x256_16x16_16x16_1x2_16x16x1_16x16x1_1x16x1x16_8_1x2_intrawave_v1,1.46,365.57,0.0
64,4,2048,256,ck,5,0,2.8438,a8w8_blockscale_1x128x128_256x16x128x128_8x16_16x16_1x2_16x16x1_8x32x1_1x16x1x16_8_1x2_intrawave_v1,1.47,190.48,0.0
64,4,2048,2048,ck,7,0,11.4914,a8w8_blockscale_1x128x128_256x16x128x256_16x16_16x16_1x2_16x16x1_16x16x1_1x16x1x16_8_1x2_intrawave_v1,2.92,367.13,0.0
64,8,2048,256,ck,7,0,3.238,a8w8_blockscale_1x128x128_256x16x128x256_16x16_16x16_1x2_16x16x1_16x16x1_1x16x1x16_8_1x2_intrawave_v1,2.59,172.67,0.0
64,8,2048,2048,ck,7,0,11.4504,a8w8_blockscale_1x128x128_256x16x128x256_16x16_16x16_1x2_16x16x1_16x16x1_1x16x1x16_8_1x2_intrawave_v1,5.86,370.59,0.0
64,16,2048,256,ck,7,0,3.3793,a8w8_blockscale_1x128x128_256x16x128x256_16x16_16x16_1x2_16x16x1_16x16x1_1x16x1x16_8_1x2_intrawave_v1,4.96,175.75,0.0
64,16,2048,2048,ck,7,0,11.4601,a8w8_blockscale_1x128x128_256x16x128x256_16x16_16x16_1x2_16x16x1_16x16x1_1x16x1x16_8_1x2_intrawave_v1,11.71,374.57,0.0
64,24,2048,256,ck,5,0,3.6475,a8w8_blockscale_1x128x128_256x16x128x128_8x16_16x16_1x2_16x16x1_8x32x1_1x16x1x16_8_1x2_intrawave_v1,6.9,172.37,0.0
64,24,2048,2048,ck,7,0,12.2285,a8w8_blockscale_1x128x128_256x16x128x256_16x16_16x16_1x2_16x16x1_16x16x1_1x16x1x16_8_1x2_intrawave_v1,16.46,355.05,0.0
64,32,2048,256,ck,7,0,3.3543,a8w8_blockscale_1x128x128_256x16x128x256_16x16_16x16_1x2_16x16x1_16x16x1_1x16x1x16_8_1x2_intrawave_v1,10.0,197.82,0.0
64,32,2048,2048,ck,7,0,12.0861,a8w8_blockscale_1x128x128_256x16x128x256_16x16_16x16_1x2_16x16x1_16x16x1_1x16x1x16_8_1x2_intrawave_v1,22.21,363.3,0.0
64,40,2048,256,ck,4,0,6.9311,a8w8_blockscale_1x128x128_256x16x256x128_8x16_16x16_1x4_16x16x1_8x32x1_1x16x1x16_8_1x2_intrawave_v1,6.05,100.76,0.0
64,40,2048,2048,ck,7,0,13.8578,a8w8_blockscale_1x128x128_256x16x128x256_16x16_16x16_1x2_16x16x1_16x16x1_1x16x1x16_8_1x2_intrawave_v1,24.21,320.4,0.0
64,48,2048,256,ck,5,0,4.0333,a8w8_blockscale_1x128x128_256x16x128x128_8x16_16x16_1x2_16x16x1_8x32x1_1x16x1x16_8_1x2_intrawave_v1,12.48,181.78,0.0
64,48,2048,2048,ck,7,0,13.969,a8w8_blockscale_1x128x128_256x16x128x256_16x16_16x16_1x2_16x16x1_16x16x1_1x16x1x16_8_1x2_intrawave_v1,28.82,321.37,0.0
64,56,2048,256,ck,5,0,4.0432,a8w8_blockscale_1x128x128_256x16x128x128_8x16_16x16_1x2_16x16x1_8x32x1_1x16x1x16_8_1x2_intrawave_v1,14.52,189.95,0.0
64,56,2048,2048,ck,7,0,13.593,a8w8_blockscale_1x128x128_256x16x128x256_16x16_16x16_1x2_16x16x1_16x16x1_1x16x1x16_8_1x2_intrawave_v1,34.56,333.88,0.0
64,64,2048,256,ck,5,0,4.3025,a8w8_blockscale_1x128x128_256x16x128x128_8x16_16x16_1x2_16x16x1_8x32x1_1x16x1x16_8_1x2_intrawave_v1,15.6,186.59,0.0
64,64,2048,2048,ck,7,0,13.6859,a8w8_blockscale_1x128x128_256x16x128x256_16x16_16x16_1x2_16x16x1_16x16x1_1x16x1x16_8_1x2_intrawave_v1,39.23,335.2,0.0
64,72,2048,256,ck,7,0,4.5555,a8w8_blockscale_1x128x128_256x16x128x256_16x16_16x16_1x2_16x16x1_16x16x1_1x16x1x16_8_1x2_intrawave_v1,16.57,183.87,0.0
64,72,2048,2048,ck,5,0,15.8397,a8w8_blockscale_1x128x128_256x16x128x128_8x16_16x16_1x2_16x16x1_8x32x1_1x16x1x16_8_1x2_intrawave_v1,38.13,292.72,0.0
64,80,2048,256,ck,5,0,4.8103,a8w8_blockscale_1x128x128_256x16x128x128_8x16_16x16_1x2_16x16x1_8x32x1_1x16x1x16_8_1x2_intrawave_v1,17.44,181.37,0.0
64,80,2048,2048,ck,5,0,14.6585,a8w8_blockscale_1x128x128_256x16x128x128_8x16_16x16_1x2_16x16x1_8x32x1_1x16x1x16_8_1x2_intrawave_v1,45.78,319.67,0.0
64,88,2048,256,ck,7,0,4.4529,a8w8_blockscale_1x128x128_256x16x128x256_16x16_16x16_1x2_16x16x1_16x16x1_1x16x1x16_8_1x2_intrawave_v1,20.72,203.75,0.0
64,88,2048,2048,ck,5,0,14.9206,a8w8_blockscale_1x128x128_256x16x128x128_8x16_16x16_1x2_16x16x1_8x32x1_1x16x1x16_8_1x2_intrawave_v1,49.48,317.34,0.0
64,96,2048,256,ck,7,0,4.4844,a8w8_blockscale_1x128x128_256x16x128x256_16x16_16x16_1x2_16x16x1_16x16x1_1x16x1x16_8_1x2_intrawave_v1,22.45,210.08,0.0
64,96,2048,2048,ck,5,0,16.233,a8w8_blockscale_1x128x128_256x16x128x128_8x16_16x16_1x2_16x16x1_8x32x1_1x16x1x16_8_1x2_intrawave_v1,49.61,294.72,0.0
64,104,2048,256,ck,7,0,4.9629,a8w8_blockscale_1x128x128_256x16x128x256_16x16_16x16_1x2_16x16x1_16x16x1_1x16x1x16_8_1x2_intrawave_v1,21.97,196.84,0.0
64,104,2048,2048,ck,5,0,15.779,a8w8_blockscale_1x128x128_256x16x128x128_8x16_16x16_1x2_16x16x1_8x32x1_1x16x1x16_8_1x2_intrawave_v1,55.29,306.31,0.0
64,112,2048,256,ck,7,0,5.0764,a8w8_blockscale_1x128x128_256x16x128x256_16x16_16x16_1x2_16x16x1_16x16x1_1x16x1x16_8_1x2_intrawave_v1,23.13,199.3,0.0
64,112,2048,2048,ck,4,0,16.8734,a8w8_blockscale_1x128x128_256x16x256x128_8x16_16x16_1x4_16x16x1_8x32x1_1x16x1x16_8_1x2_intrawave_v1,55.68,289.36,0.0
64,120,2048,256,ck,5,0,4.8226,a8w8_blockscale_1x128x128_256x16x128x128_8x16_16x16_1x2_16x16x1_8x32x1_1x16x1x16_8_1x2_intrawave_v1,26.09,217.0,0.0
64,120,2048,2048,ck,5,0,16.0642,a8w8_blockscale_1x128x128_256x16x128x128_8x16_16x16_1x2_16x16x1_8x32x1_1x16x1x16_8_1x2_intrawave_v1,62.66,306.99,0.0
64,128,2048,256,ck,7,0,5.2336,a8w8_blockscale_1x128x128_256x16x128x256_16x16_16x16_1x2_16x16x1_16x16x1_1x16x1x16_8_1x2_intrawave_v1,25.65,206.62,0.0
64,128,2048,2048,ck,5,0,16.4074,a8w8_blockscale_1x128x128_256x16x128x128_8x16_16x16_1x2_16x16x1_8x32x1_1x16x1x16_8_1x2_intrawave_v1,65.44,303.57,0.0
64,136,2048,256,ck,5,0,5.8396,a8w8_blockscale_1x128x128_256x16x128x128_8x16_16x16_1x2_16x16x1_8x32x1_1x16x1x16_8_1x2_intrawave_v1,24.42,191.14,0.0
64,136,2048,2048,ck,5,0,17.5211,a8w8_blockscale_1x128x128_256x16x128x128_8x16_16x16_1x2_16x16x1_8x32x1_1x16x1x16_8_1x2_intrawave_v1,65.11,287.08,0.0
64,144,2048,256,ck,7,0,5.8184,a8w8_blockscale_1x128x128_256x16x128x256_16x16_16x16_1x2_16x16x1_16x16x1_1x16x1x16_8_1x2_intrawave_v1,25.95,197.82,0.0
64,144,2048,2048,ck,5,0,17.7004,a8w8_blockscale_1x128x128_256x16x128x128_8x16_16x16_1x2_16x16x1_8x32x1_1x16x1x16_8_1x2_intrawave_v1,68.24,286.94,0.0
64,152,2048,256,ck,5,0,5.6989,a8w8_blockscale_1x128x128_256x16x128x128_8x16_16x16_1x2_16x16x1_8x32x1_1x16x1x16_8_1x2_intrawave_v1,27.97,208.07,0.0
64,152,2048,2048,ck,5,0,17.4914,a8w8_blockscale_1x128x128_256x16x128x128_8x16_16x16_1x2_16x16x1_8x32x1_1x16x1x16_8_1x2_intrawave_v1,72.9,293.18,0.0
64,160,2048,256,ck,5,0,5.767,a8w8_blockscale_1x128x128_256x16x128x128_8x16_16x16_1x2_16x16x1_8x32x1_1x16x1x16_8_1x2_intrawave_v1,29.09,211.65,0.0
64,160,2048,2048,ck,5,0,17.5621,a8w8_blockscale_1x128x128_256x16x128x128_8x16_16x16_1x2_16x16x1_8x32x1_1x16x1x16_8_1x2_intrawave_v1,76.42,294.8,0.0
64,168,2048,256,ck,7,0,6.1672,a8w8_blockscale_1x128x128_256x16x128x256_16x16_16x16_1x2_16x16x1_16x16x1_1x16x1x16_8_1x2_intrawave_v1,28.56,203.56,0.0
64,168,2048,2048,ck,4,0,18.7568,a8w8_blockscale_1x128x128_256x16x256x128_8x16_16x16_1x4_16x16x1_8x32x1_1x16x1x16_8_1x2_intrawave_v1,75.13,278.65,0.0
64,176,2048,256,ck,5,0,6.3305,a8w8_blockscale_1x128x128_256x16x128x128_8x16_16x16_1x2_16x16x1_8x32x1_1x16x1x16_8_1x2_intrawave_v1,29.15,203.81,0.0
64,176,2048,2048,ck,4,0,18.9101,a8w8_blockscale_1x128x128_256x16x256x128_8x16_16x16_1x4_16x16x1_8x32x1_1x16x1x16_8_1x2_intrawave_v1,78.07,278.99,0.0
64,184,2048,256,ck,7,0,6.2998,a8w8_blockscale_1x128x128_256x16x128x256_16x16_16x16_1x2_16x16x1_16x16x1_1x16x1x16_8_1x2_intrawave_v1,30.63,210.33,0.0
64,184,2048,2048,ck,5,0,19.6285,a8w8_blockscale_1x128x128_256x16x128x128_8x16_16x16_1x2_16x16x1_8x32x1_1x16x1x16_8_1x2_intrawave_v1,78.64,271.28,0.0
64,192,2048,256,ck,7,0,6.4041,a8w8_blockscale_1x128x128_256x16x128x256_16x16_16x16_1x2_16x16x1_16x16x1_1x16x1x16_8_1x2_intrawave_v1,31.44,212.34,0.0
64,192,2048,2048,ck,5,0,19.9932,a8w8_blockscale_1x128x128_256x16x128x128_8x16_16x16_1x2_16x16x1_8x32x1_1x16x1x16_8_1x2_intrawave_v1,80.56,268.79,0.0
64,200,2048,256,ck,7,0,6.5945,a8w8_blockscale_1x128x128_256x16x128x256_16x16_16x16_1x2_16x16x1_16x16x1_1x16x1x16_8_1x2_intrawave_v1,31.8,211.49,0.0
64,200,2048,2048,ck,5,0,23.2685,a8w8_blockscale_1x128x128_256x16x128x128_8x16_16x16_1x2_16x16x1_8x32x1_1x16x1x16_8_1x2_intrawave_v1,72.1,233.07,0.0
64,208,2048,256,ck,7,0,6.7368,a8w8_blockscale_1x128x128_256x16x128x256_16x16_16x16_1x2_16x16x1_16x16x1_1x16x1x16_8_1x2_intrawave_v1,32.37,212.19,0.0
64,208,2048,2048,ck,5,0,23.8354,a8w8_blockscale_1x128x128_256x16x128x128_8x16_16x16_1x2_16x16x1_8x32x1_1x16x1x16_8_1x2_intrawave_v1,73.2,229.59,0.0
64,216,2048,256,ck,7,0,6.7891,a8w8_blockscale_1x128x128_256x16x128x256_16x16_16x16_1x2_16x16x1_16x16x1_1x16x1x16_8_1x2_intrawave_v1,33.36,215.69,0.0
64,216,2048,2048,ck,5,0,25.3111,a8w8_blockscale_1x128x128_256x16x128x128_8x16_16x16_1x2_16x16x1_8x32x1_1x16x1x16_8_1x2_intrawave_v1,71.59,218.14,0.0
64,224,2048,256,ck,7,0,6.9045,a8w8_blockscale_1x128x128_256x16x128x256_16x16_16x16_1x2_16x16x1_16x16x1_1x16x1x16_8_1x2_intrawave_v1,34.02,217.12,0.0
64,224,2048,2048,ck,5,0,25.2653,a8w8_blockscale_1x128x128_256x16x128x128_8x16_16x16_1x2_16x16x1_8x32x1_1x16x1x16_8_1x2_intrawave_v1,74.37,220.48,0.0
64,232,2048,256,ck,5,0,7.1914,a8w8_blockscale_1x128x128_256x16x128x128_8x16_16x16_1x2_16x16x1_8x32x1_1x16x1x16_8_1x2_intrawave_v1,33.83,213.3,0.0
64,232,2048,2048,ck,5,0,25.1212,a8w8_blockscale_1x128x128_256x16x128x128_8x16_16x16_1x2_16x16x1_8x32x1_1x16x1x16_8_1x2_intrawave_v1,77.47,223.7,0.0
64,240,2048,256,ck,5,0,7.0217,a8w8_blockscale_1x128x128_256x16x128x128_8x16_16x16_1x2_16x16x1_8x32x1_1x16x1x16_8_1x2_intrawave_v1,35.84,223.42,0.0
64,240,2048,2048,ck,5,0,25.2065,a8w8_blockscale_1x128x128_256x16x128x128_8x16_16x16_1x2_16x16x1_8x32x1_1x16x1x16_8_1x2_intrawave_v1,79.87,224.9,0.0
64,248,2048,256,ck,5,0,6.7561,a8w8_blockscale_1x128x128_256x16x128x128_8x16_16x16_1x2_16x16x1_8x32x1_1x16x1x16_8_1x2_intrawave_v1,38.49,237.35,0.0
64,248,2048,2048,ck,5,0,23.8498,a8w8_blockscale_1x128x128_256x16x128x128_8x16_16x16_1x2_16x16x1_8x32x1_1x16x1x16_8_1x2_intrawave_v1,87.23,239.75,0.0
64,256,2048,256,ck,5,0,6.9801,a8w8_blockscale_1x128x128_256x16x128x128_8x16_16x16_1x2_16x16x1_8x32x1_1x16x1x16_8_1x2_intrawave_v1,38.46,234.72,0.0
64,256,2048,2048,ck,5,0,24.0041,a8w8_blockscale_1x128x128_256x16x128x128_8x16_16x16_1x2_16x16x1_8x32x1_1x16x1x16_8_1x2_intrawave_v1,89.46,240.26,0.0
64,264,2048,256,ck,5,0,7.6262,a8w8_blockscale_1x128x128_256x16x128x128_8x16_16x16_1x2_16x16x1_8x32x1_1x16x1x16_8_1x2_intrawave_v1,36.3,219.4,0.0
64,264,2048,2048,ck,5,0,26.923,a8w8_blockscale_1x128x128_256x16x128x128_8x16_16x16_1x2_16x16x1_8x32x1_1x16x1x16_8_1x2_intrawave_v1,82.26,216.04,0.0
64,272,2048,256,ck,5,0,7.6995,a8w8_blockscale_1x128x128_256x16x128x128_8x16_16x16_1x2_16x16x1_8x32x1_1x16x1x16_8_1x2_intrawave_v1,37.04,221.84,0.0
64,272,2048,2048,ck,5,0,28.8829,a8w8_blockscale_1x128x128_256x16x128x128_8x16_16x16_1x2_16x16x1_8x32x1_1x16x1x16_8_1x2_intrawave_v1,79.0,203.08,0.0
64,280,2048,256,ck,7,0,8.1211,a8w8_blockscale_1x128x128_256x16x128x256_16x16_16x16_1x2_16x16x1_16x16x1_1x16x1x16_8_1x2_intrawave_v1,36.15,214.61,0.0
64,280,2048,2048,ck,5,0,29.2356,a8w8_blockscale_1x128x128_256x16x128x128_8x16_16x16_1x2_16x16x1_8x32x1_1x16x1x16_8_1x2_intrawave_v1,80.34,202.31,0.0
64,288,2048,256,ck,5,0,8.3939,a8w8_blockscale_1x128x128_256x16x128x128_8x16_16x16_1x2_16x16x1_8x32x1_1x16x1x16_8_1x2_intrawave_v1,35.98,211.78,0.0
64,288,2048,2048,ck,5,0,29.7398,a8w8_blockscale_1x128x128_256x16x128x128_8x16_16x16_1x2_16x16x1_8x32x1_1x16x1x16_8_1x2_intrawave_v1,81.24,200.53,0.0
64,296,2048,256,ck,5,0,8.5529,a8w8_blockscale_1x128x128_256x16x128x128_8x16_16x16_1x2_16x16x1_8x32x1_1x16x1x16_8_1x2_intrawave_v1,36.29,211.91,0.0
64,296,2048,2048,ck,5,0,29.8122,a8w8_blockscale_1x128x128_256x16x128x128_8x16_16x16_1x2_16x16x1_8x32x1_1x16x1x16_8_1x2_intrawave_v1,83.29,201.69,0.0
64,304,2048,256,ck,7,0,8.4051,a8w8_blockscale_1x128x128_256x16x128x256_16x16_16x16_1x2_16x16x1_16x16x1_1x16x1x16_8_1x2_intrawave_v1,37.93,219.78,0.0
64,304,2048,2048,ck,5,0,29.9148,a8w8_blockscale_1x128x128_256x16x128x128_8x16_16x16_1x2_16x16x1_8x32x1_1x16x1x16_8_1x2_intrawave_v1,85.25,202.64,0.0
64,312,2048,256,ck,7,0,8.6367,a8w8_blockscale_1x128x128_256x16x128x256_16x16_16x16_1x2_16x16x1_16x16x1_1x16x1x16_8_1x2_intrawave_v1,37.88,217.92,0.0
64,312,2048,2048,ck,5,0,32.2663,a8w8_blockscale_1x128x128_256x16x128x128_8x16_16x16_1x2_16x16x1_8x32x1_1x16x1x16_8_1x2_intrawave_v1,81.11,189.4,0.0
64,320,2048,256,ck,5,0,8.7431,a8w8_blockscale_1x128x128_256x16x128x128_8x16_16x16_1x2_16x16x1_8x32x1_1x16x1x16_8_1x2_intrawave_v1,38.38,219.25,0.0
64,320,2048,2048,ck,5,0,32.5607,a8w8_blockscale_1x128x128_256x16x128x128_8x16_16x16_1x2_16x16x1_8x32x1_1x16x1x16_8_1x2_intrawave_v1,82.44,189.2,0.0
64,328,2048,256,ck,5,0,8.7899,a8w8_blockscale_1x128x128_256x16x128x128_8x16_16x16_1x2_16x16x1_8x32x1_1x16x1x16_8_1x2_intrawave_v1,39.13,222.04,0.0
64,328,2048,2048,ck,5,0,32.5465,a8w8_blockscale_1x128x128_256x16x128x128_8x16_16x16_1x2_16x16x1_8x32x1_1x16x1x16_8_1x2_intrawave_v1,84.54,190.79,0.0
64,336,2048,256,ck,5,0,8.7335,a8w8_blockscale_1x128x128_256x16x128x128_8x16_16x16_1x2_16x16x1_8x32x1_1x16x1x16_8_1x2_intrawave_v1,40.34,227.46,0.0
64,336,2048,2048,ck,5,0,33.1155,a8w8_blockscale_1x128x128_256x16x128x128_8x16_16x16_1x2_16x16x1_8x32x1_1x16x1x16_8_1x2_intrawave_v1,85.11,189.0,0.0
64,344,2048,256,ck,7,0,9.2273,a8w8_blockscale_1x128x128_256x16x128x256_16x16_16x16_1x2_16x16x1_16x16x1_1x16x1x16_8_1x2_intrawave_v1,39.09,219.06,0.0
64,344,2048,2048,ck,5,0,34.3755,a8w8_blockscale_1x128x128_256x16x128x128_8x16_16x16_1x2_16x16x1_8x32x1_1x16x1x16_8_1x2_intrawave_v1,83.95,183.5,0.0
64,352,2048,256,ck,5,0,9.0859,a8w8_blockscale_1x128x128_256x16x128x128_8x16_16x16_1x2_16x16x1_8x32x1_1x16x1x16_8_1x2_intrawave_v1,40.62,226.31,0.0
64,352,2048,2048,ck,5,0,34.2199,a8w8_blockscale_1x128x128_256x16x128x128_8x16_16x16_1x2_16x16x1_8x32x1_1x16x1x16_8_1x2_intrawave_v1,86.29,185.77,0.0
64,360,2048,256,ck,5,0,9.6983,a8w8_blockscale_1x128x128_256x16x128x128_8x16_16x16_1x2_16x16x1_8x32x1_1x16x1x16_8_1x2_intrawave_v1,38.92,215.61,0.0
64,360,2048,2048,ck,4,0,34.9894,a8w8_blockscale_1x128x128_256x16x256x128_8x16_16x16_1x4_16x16x1_8x32x1_1x16x1x16_8_1x2_intrawave_v1,86.31,183.09,0.0
64,368,2048,256,ck,5,0,9.6687,a8w8_blockscale_1x128x128_256x16x128x128_8x16_16x16_1x2_16x16x1_8x32x1_1x16x1x16_8_1x2_intrawave_v1,39.91,219.87,0.0
64,368,2048,2048,ck,4,0,35.059,a8w8_blockscale_1x128x128_256x16x256x128_8x16_16x16_1x4_16x16x1_8x32x1_1x16x1x16_8_1x2_intrawave_v1,88.05,184.13,0.0
64,376,2048,256,ck,5,0,9.3422,a8w8_blockscale_1x128x128_256x16x128x128_8x16_16x16_1x2_16x16x1_8x32x1_1x16x1x16_8_1x2_intrawave_v1,42.2,231.28,0.0
64,376,2048,2048,ck,5,0,35.5759,a8w8_blockscale_1x128x128_256x16x128x128_8x16_16x16_1x2_16x16x1_8x32x1_1x16x1x16_8_1x2_intrawave_v1,88.66,182.83,0.0
64,384,2048,256,ck,5,0,9.5223,a8w8_blockscale_1x128x128_256x16x128x128_8x16_16x16_1x2_16x16x1_8x32x1_1x16x1x16_8_1x2_intrawave_v1,42.29,230.56,0.0
64,384,2048,2048,ck,4,0,35.5943,a8w8_blockscale_1x128x128_256x16x256x128_8x16_16x16_1x4_16x16x1_8x32x1_1x16x1x16_8_1x2_intrawave_v1,90.5,184.12,0.0
64,392,2048,256,ck,5,0,10.1043,a8w8_blockscale_1x128x128_256x16x128x128_8x16_16x16_1x2_16x16x1_8x32x1_1x16x1x16_8_1x2_intrawave_v1,40.68,220.73,0.0
64,392,2048,2048,ck,5,0,39.0868,a8w8_blockscale_1x128x128_256x16x128x128_8x16_16x16_1x2_16x16x1_8x32x1_1x16x1x16_8_1x2_intrawave_v1,84.13,168.93,0.0
64,400,2048,256,ck,5,0,10.1839,a8w8_blockscale_1x128x128_256x16x128x128_8x16_16x16_1x2_16x16x1_8x32x1_1x16x1x16_8_1x2_intrawave_v1,41.19,222.42,0.0
64,400,2048,2048,ck,5,0,38.6522,a8w8_blockscale_1x128x128_256x16x128x128_8x16_16x16_1x2_16x16x1_8x32x1_1x16x1x16_8_1x2_intrawave_v1,86.81,172.1,0.0
64,408,2048,256,ck,5,0,10.1271,a8w8_blockscale_1x128x128_256x16x128x128_8x16_16x16_1x2_16x16x1_8x32x1_1x16x1x16_8_1x2_intrawave_v1,42.24,227.1,0.0
64,408,2048,2048,ck,5,0,39.0666,a8w8_blockscale_1x128x128_256x16x128x128_8x16_16x16_1x2_16x16x1_8x32x1_1x16x1x16_8_1x2_intrawave_v1,87.61,171.53,0.0
64,416,2048,256,ck,5,0,10.1383,a8w8_blockscale_1x128x128_256x16x128x128_8x16_16x16_1x2_16x16x1_8x32x1_1x16x1x16_8_1x2_intrawave_v1,43.03,230.29,0.0
64,416,2048,2048,ck,5,0,38.9967,a8w8_blockscale_1x128x128_256x16x128x128_8x16_16x16_1x2_16x16x1_8x32x1_1x16x1x16_8_1x2_intrawave_v1,89.49,173.1,0.0
64,424,2048,256,ck,5,0,10.6291,a8w8_blockscale_1x128x128_256x16x128x128_8x16_16x16_1x2_16x16x1_8x32x1_1x16x1x16_8_1x2_intrawave_v1,41.83,222.93,0.0
64,424,2048,2048,ck,5,0,40.9917,a8w8_blockscale_1x128x128_256x16x128x128_8x16_16x16_1x2_16x16x1_8x32x1_1x16x1x16_8_1x2_intrawave_v1,86.77,165.87,0.0
64,432,2048,256,ck,7,0,10.7703,a8w8_blockscale_1x128x128_256x16x128x256_16x16_16x16_1x2_16x16x1_16x16x1_1x16x1x16_8_1x2_intrawave_v1,42.06,223.24,0.0
64,432,2048,2048,ck,5,0,40.4778,a8w8_blockscale_1x128x128_256x16x128x128_8x16_16x16_1x2_16x16x1_8x32x1_1x16x1x16_8_1x2_intrawave_v1,89.53,169.19,0.0
64,440,2048,256,ck,5,0,10.7499,a8w8_blockscale_1x128x128_256x16x128x128_8x16_16x16_1x2_16x16x1_8x32x1_1x16x1x16_8_1x2_intrawave_v1,42.92,226.9,0.0
64,440,2048,2048,ck,5,0,41.8265,a8w8_blockscale_1x128x128_256x16x128x128_8x16_16x16_1x2_16x16x1_8x32x1_1x16x1x16_8_1x2_intrawave_v1,88.25,164.91,0.0
64,448,2048,256,ck,4,0,11.2083,a8w8_blockscale_1x128x128_256x16x256x128_8x16_16x16_1x4_16x16x1_8x32x1_1x16x1x16_8_1x2_intrawave_v1,41.91,220.73,0.0
64,448,2048,2048,ck,5,0,42.0404,a8w8_blockscale_1x128x128_256x16x128x128_8x16_16x16_1x2_16x16x1_8x32x1_1x16x1x16_8_1x2_intrawave_v1,89.39,165.24,0.0
64,456,2048,256,ck,5,0,11.0796,a8w8_blockscale_1x128x128_256x16x128x128_8x16_16x16_1x2_16x16x1_8x32x1_1x16x1x16_8_1x2_intrawave_v1,43.16,226.43,0.0
64,456,2048,2048,ck,5,0,42.5618,a8w8_blockscale_1x128x128_256x16x128x128_8x16_16x16_1x2_16x16x1_8x32x1_1x16x1x16_8_1x2_intrawave_v1,89.87,164.37,0.0
64,464,2048,256,ck,5,0,11.1379,a8w8_blockscale_1x128x128_256x16x128x128_8x16_16x16_1x2_16x16x1_8x32x1_1x16x1x16_8_1x2_intrawave_v1,43.68,228.37,0.0
64,464,2048,2048,ck,5,0,42.954,a8w8_blockscale_1x128x128_256x16x128x128_8x16_16x16_1x2_16x16x1_8x32x1_1x16x1x16_8_1x2_intrawave_v1,90.62,164.02,0.0
64,472,2048,256,ck,5,0,10.8839,a8w8_blockscale_1x128x128_256x16x128x128_8x16_16x16_1x2_16x16x1_8x32x1_1x16x1x16_8_1x2_intrawave_v1,45.47,236.9,0.0
64,472,2048,2048,ck,5,0,40.9894,a8w8_blockscale_1x128x128_256x16x128x128_8x16_16x16_1x2_16x16x1_8x32x1_1x16x1x16_8_1x2_intrawave_v1,96.6,173.08,0.0
64,480,2048,256,ck,5,0,11.2177,a8w8_blockscale_1x128x128_256x16x128x128_8x16_16x16_1x2_16x16x1_8x32x1_1x16x1x16_8_1x2_intrawave_v1,44.87,232.96,0.0
64,480,2048,2048,ck,5,0,41.7296,a8w8_blockscale_1x128x128_256x16x128x128_8x16_16x16_1x2_16x16x1_8x32x1_1x16x1x16_8_1x2_intrawave_v1,96.49,171.18,0.0
64,488,2048,256,ck,5,0,10.9083,a8w8_blockscale_1x128x128_256x16x128x128_8x16_16x16_1x2_16x16x1_8x32x1_1x16x1x16_8_1x2_intrawave_v1,46.91,242.76,0.0
64,488,2048,2048,ck,4,0,41.6525,a8w8_blockscale_1x128x128_256x16x256x128_8x16_16x16_1x4_16x16x1_8x32x1_1x16x1x16_8_1x2_intrawave_v1,98.28,172.68,0.0
64,496,2048,256,ck,5,0,10.9664,a8w8_blockscale_1x128x128_256x16x128x128_8x16_16x16_1x2_16x16x1_8x32x1_1x16x1x16_8_1x2_intrawave_v1,47.43,244.65,0.0
64,496,2048,2048,ck,4,0,41.9262,a8w8_blockscale_1x128x128_256x16x256x128_8x16_16x16_1x4_16x16x1_8x32x1_1x16x1x16_8_1x2_intrawave_v1,99.24,172.73,0.0
64,504,2048,256,ck,5,0,11.648,a8w8_blockscale_1x128x128_256x16x128x128_8x16_16x16_1x2_16x16x1_8x32x1_1x16x1x16_8_1x2_intrawave_v1,45.37,233.32,0.0
64,504,2048,2048,ck,5,0,41.8391,a8w8_blockscale_1x128x128_256x16x128x128_8x16_16x16_1x2_16x16x1_8x32x1_1x16x1x16_8_1x2_intrawave_v1,101.05,174.26,0.0
64,512,2048,256,ck,5,0,10.7788,a8w8_blockscale_1x128x128_256x16x128x128_8x16_16x16_1x2_16x16x1_8x32x1_1x16x1x16_8_1x2_intrawave_v1,49.81,255.36,0.0
64,512,2048,2048,ck,5,0,42.2431,a8w8_blockscale_1x128x128_256x16x128x128_8x16_16x16_1x2_16x16x1_8x32x1_1x16x1x16_8_1x2_intrawave_v1,101.67,173.76,0.0
64,1024,2048,256,ck,5,0,19.2941,a8w8_blockscale_1x128x128_256x16x128x128_8x16_16x16_1x2_16x16x1_8x32x1_1x16x1x16_8_1x2_intrawave_v1,55.65,258.15,0.0
64,1024,2048,2048,ck,4,0,70.2808,a8w8_blockscale_1x128x128_256x16x256x128_8x16_16x16_1x4_16x16x1_8x32x1_1x16x1x16_8_1x2_intrawave_v1,122.22,149.2,0.0
64,2048,2048,256,ck,5,0,35.1713,a8w8_blockscale_1x128x128_256x16x128x128_8x16_16x16_1x2_16x16x1_8x32x1_1x16x1x16_8_1x2_intrawave_v1,61.06,268.32,0.0
64,2048,2048,2048,ck,4,0,134.0017,a8w8_blockscale_1x128x128_256x16x256x128_8x16_16x16_1x4_16x16x1_8x32x1_1x16x1x16_8_1x2_intrawave_v1,128.21,125.2,0.0
64,4096,2048,256,ck,5,0,65.9647,a8w8_blockscale_1x128x128_256x16x128x128_8x16_16x16_1x2_16x16x1_8x32x1_1x16x1x16_8_1x2_intrawave_v1,65.11,278.18,0.0
64,4096,2048,2048,ck,4,0,263.3279,a8w8_blockscale_1x128x128_256x16x256x128_8x16_16x16_1x4_16x16x1_8x32x1_1x16x1x16_8_1x2_intrawave_v1,130.48,111.5,0.0
64,8192,2048,256,ck,4,0,124.1623,a8w8_blockscale_1x128x128_256x16x256x128_8x16_16x16_1x4_16x16x1_8x32x1_1x16x1x16_8_1x2_intrawave_v1,69.18,291.36,0.0
64,8192,2048,2048,ck,4,0,520.1263,a8w8_blockscale_1x128x128_256x16x256x128_8x16_16x16_1x4_16x16x1_8x32x1_1x16x1x16_8_1x2_intrawave_v1,132.12,104.83,0.0
64,16384,2048,256,ck,5,0,235.6501,a8w8_blockscale_1x128x128_256x16x128x128_8x16_16x16_1x2_16x16x1_8x32x1_1x16x1x16_8_1x2_intrawave_v1,72.9,304.81,0.0
64,16384,2048,2048,ck,4,0,1034.023,a8w8_blockscale_1x128x128_256x16x256x128_8x16_16x16_1x4_16x16x1_8x32x1_1x16x1x16_8_1x2_intrawave_v1,132.92,101.41,0.0
64,20480,2048,256,ck,5,0,293.0381,a8w8_blockscale_1x128x128_256x16x128x128_8x16_16x16_1x2_16x16x1_8x32x1_1x16x1x16_8_1x2_intrawave_v1,73.28,305.94,0.0
64,20480,2048,2048,ck,4,0,1287.5347,a8w8_blockscale_1x128x128_256x16x256x128_8x16_16x16_1x4_16x16x1_8x32x1_1x16x1x16_8_1x2_intrawave_v1,133.43,100.99,0.0
64,1,2560,2048,ck,7,0,14.4911,a8w8_blockscale_1x128x128_256x16x128x256_16x16_16x16_1x2_16x16x1_16x16x1_1x16x1x16_8_1x2_intrawave_v1,0.72,362.29,0.0
64,2,2560,2048,ck,7,0,13.2125,a8w8_blockscale_1x128x128_256x16x128x256_16x16_16x16_1x2_16x16x1_16x16x1_1x16x1x16_8_1x2_intrawave_v1,1.59,397.9,0.0
64,4,2560,2048,ck,7,0,13.2684,a8w8_blockscale_1x128x128_256x16x128x256_16x16_16x16_1x2_16x16x1_16x16x1_1x16x1x16_8_1x2_intrawave_v1,3.16,397.3,0.0
64,8,2560,2048,ck,7,0,13.3721,a8w8_blockscale_1x128x128_256x16x128x256_16x16_16x16_1x2_16x16x1_16x16x1_1x16x1x16_8_1x2_intrawave_v1,6.27,396.36,0.0
64,16,2560,2048,ck,7,0,13.5109,a8w8_blockscale_1x128x128_256x16x128x256_16x16_16x16_1x2_16x16x1_16x16x1_1x16x1x16_8_1x2_intrawave_v1,12.42,396.54,0.0
64,24,2560,2048,ck,7,0,15.002,a8w8_blockscale_1x128x128_256x16x128x256_16x16_16x16_1x2_16x16x1_16x16x1_1x16x1x16_8_1x2_intrawave_v1,16.77,360.95,0.0
64,32,2560,2048,ck,7,0,15.2073,a8w8_blockscale_1x128x128_256x16x128x256_16x16_16x16_1x2_16x16x1_16x16x1_1x16x1x16_8_1x2_intrawave_v1,22.06,359.84,0.0
64,40,2560,2048,ck,7,0,14.9051,a8w8_blockscale_1x128x128_256x16x128x256_16x16_16x16_1x2_16x16x1_16x16x1_1x16x1x16_8_1x2_intrawave_v1,28.14,370.99,0.0
64,48,2560,2048,ck,7,0,14.9905,a8w8_blockscale_1x128x128_256x16x128x256_16x16_16x16_1x2_16x16x1_16x16x1_1x16x1x16_8_1x2_intrawave_v1,33.58,372.7,0.0
64,56,2560,2048,ck,5,0,16.3004,a8w8_blockscale_1x128x128_256x16x128x128_8x16_16x16_1x2_16x16x1_8x32x1_1x16x1x16_8_1x2_intrawave_v1,36.02,346.27,0.0
64,64,2560,2048,ck,4,0,18.6764,a8w8_blockscale_1x128x128_256x16x256x128_8x16_16x16_1x4_16x16x1_8x32x1_1x16x1x16_8_1x2_intrawave_v1,35.93,305.29,0.0
64,72,2560,2048,ck,5,0,17.5906,a8w8_blockscale_1x128x128_256x16x128x128_8x16_16x16_1x2_16x16x1_8x32x1_1x16x1x16_8_1x2_intrawave_v1,42.92,327.39,0.0
64,80,2560,2048,ck,4,0,18.5466,a8w8_blockscale_1x128x128_256x16x256x128_8x16_16x16_1x4_16x16x1_8x32x1_1x16x1x16_8_1x2_intrawave_v1,45.23,313.61,0.0
64,88,2560,2048,ck,5,0,17.5771,a8w8_blockscale_1x128x128_256x16x128x128_8x16_16x16_1x2_16x16x1_8x32x1_1x16x1x16_8_1x2_intrawave_v1,52.5,334.17,0.0
64,96,2560,2048,ck,5,0,17.9183,a8w8_blockscale_1x128x128_256x16x128x128_8x16_16x16_1x2_16x16x1_8x32x1_1x16x1x16_8_1x2_intrawave_v1,56.18,331.0,0.0
64,104,2560,2048,ck,5,0,19.1607,a8w8_blockscale_1x128x128_256x16x128x128_8x16_16x16_1x2_16x16x1_8x32x1_1x16x1x16_8_1x2_intrawave_v1,56.91,312.53,0.0
64,112,2560,2048,ck,5,0,19.769,a8w8_blockscale_1x128x128_256x16x128x128_8x16_16x16_1x2_16x16x1_8x32x1_1x16x1x16_8_1x2_intrawave_v1,59.41,305.82,0.0
64,120,2560,2048,ck,5,0,19.6431,a8w8_blockscale_1x128x128_256x16x128x128_8x16_16x16_1x2_16x16x1_8x32x1_1x16x1x16_8_1x2_intrawave_v1,64.06,310.7,0.0
64,128,2560,2048,ck,4,0,20.135,a8w8_blockscale_1x128x128_256x16x256x128_8x16_16x16_1x4_16x16x1_8x32x1_1x16x1x16_8_1x2_intrawave_v1,66.66,305.95,0.0
64,136,2560,2048,ck,4,0,20.2559,a8w8_blockscale_1x128x128_256x16x256x128_8x16_16x16_1x4_16x16x1_8x32x1_1x16x1x16_8_1x2_intrawave_v1,70.4,306.96,0.0
64,144,2560,2048,ck,4,0,20.3461,a8w8_blockscale_1x128x128_256x16x256x128_8x16_16x16_1x4_16x16x1_8x32x1_1x16x1x16_8_1x2_intrawave_v1,74.21,308.42,0.0
64,152,2560,2048,ck,5,0,24.0417,a8w8_blockscale_1x128x128_256x16x128x128_8x16_16x16_1x2_16x16x1_8x32x1_1x16x1x16_8_1x2_intrawave_v1,66.29,263.39,0.0
64,160,2560,2048,ck,5,0,24.1438,a8w8_blockscale_1x128x128_256x16x128x128_8x16_16x16_1x2_16x16x1_8x32x1_1x16x1x16_8_1x2_intrawave_v1,69.49,264.65,0.0
64,168,2560,2048,ck,5,0,26.5122,a8w8_blockscale_1x128x128_256x16x128x128_8x16_16x16_1x2_16x16x1_8x32x1_1x16x1x16_8_1x2_intrawave_v1,66.45,243.17,0.0
64,176,2560,2048,ck,5,0,26.8536,a8w8_blockscale_1x128x128_256x16x128x128_8x16_16x16_1x2_16x16x1_8x32x1_1x16x1x16_8_1x2_intrawave_v1,68.72,242.22,0.0
64,184,2560,2048,ck,5,0,29.9102,a8w8_blockscale_1x128x128_256x16x128x128_8x16_16x16_1x2_16x16x1_8x32x1_1x16x1x16_8_1x2_intrawave_v1,64.51,219.38,0.0
64,192,2560,2048,ck,5,0,30.9032,a8w8_blockscale_1x128x128_256x16x128x128_8x16_16x16_1x2_16x16x1_8x32x1_1x16x1x16_8_1x2_intrawave_v1,65.15,214.19,0.0
64,200,2560,2048,ck,5,0,31.3765,a8w8_blockscale_1x128x128_256x16x128x128_8x16_16x16_1x2_16x16x1_8x32x1_1x16x1x16_8_1x2_intrawave_v1,66.84,212.79,0.0
64,208,2560,2048,ck,4,0,32.6094,a8w8_blockscale_1x128x128_256x16x256x128_8x16_16x16_1x4_16x16x1_8x32x1_1x16x1x16_8_1x2_intrawave_v1,66.88,206.5,0.0
64,216,2560,2048,ck,5,0,32.6098,a8w8_blockscale_1x128x128_256x16x128x128_8x16_16x16_1x2_16x16x1_8x32x1_1x16x1x16_8_1x2_intrawave_v1,69.46,208.26,0.0
64,224,2560,2048,ck,5,0,32.4252,a8w8_blockscale_1x128x128_256x16x128x128_8x16_16x16_1x2_16x16x1_8x32x1_1x16x1x16_8_1x2_intrawave_v1,72.44,211.21,0.0
64,232,2560,2048,ck,5,0,33.0569,a8w8_blockscale_1x128x128_256x16x128x128_8x16_16x16_1x2_16x16x1_8x32x1_1x16x1x16_8_1x2_intrawave_v1,73.59,208.91,0.0
64,240,2560,2048,ck,5,0,34.3665,a8w8_blockscale_1x128x128_256x16x128x128_8x16_16x16_1x2_16x16x1_8x32x1_1x16x1x16_8_1x2_intrawave_v1,73.23,202.62,0.0
64,248,2560,2048,ck,5,0,27.542,a8w8_blockscale_1x128x128_256x16x128x128_8x16_16x16_1x2_16x16x1_8x32x1_1x16x1x16_8_1x2_intrawave_v1,94.42,254.9,0.0
64,256,2560,2048,ck,5,0,27.9832,a8w8_blockscale_1x128x128_256x16x128x128_8x16_16x16_1x2_16x16x1_8x32x1_1x16x1x16_8_1x2_intrawave_v1,95.93,252.93,0.0
64,272,2560,2048,ck,4,0,36.3576,a8w8_blockscale_1x128x128_256x16x256x128_8x16_16x16_1x4_16x16x1_8x32x1_1x16x1x16_8_1x2_intrawave_v1,78.45,197.83,0.0
64,288,2560,2048,ck,4,0,37.6533,a8w8_blockscale_1x128x128_256x16x256x128_8x16_16x16_1x4_16x16x1_8x32x1_1x16x1x16_8_1x2_intrawave_v1,80.2,194.07,0.0
64,304,2560,2048,ck,4,0,37.611,a8w8_blockscale_1x128x128_256x16x256x128_8x16_16x16_1x4_16x16x1_8x32x1_1x16x1x16_8_1x2_intrawave_v1,84.75,197.33,0.0
64,320,2560,2048,ck,5,0,42.4025,a8w8_blockscale_1x128x128_256x16x128x128_8x16_16x16_1x2_16x16x1_8x32x1_1x16x1x16_8_1x2_intrawave_v1,79.13,177.74,0.0
64,336,2560,2048,ck,5,0,43.7114,a8w8_blockscale_1x128x128_256x16x128x128_8x16_16x16_1x2_16x16x1_8x32x1_1x16x1x16_8_1x2_intrawave_v1,80.6,175.04,0.0
64,352,2560,2048,ck,5,0,45.0782,a8w8_blockscale_1x128x128_256x16x128x128_8x16_16x16_1x2_16x16x1_8x32x1_1x16x1x16_8_1x2_intrawave_v1,81.88,172.28,0.0
64,368,2560,2048,ck,5,0,46.3952,a8w8_blockscale_1x128x128_256x16x128x128_8x16_16x16_1x2_16x16x1_8x32x1_1x16x1x16_8_1x2_intrawave_v1,83.17,169.86,0.0
64,384,2560,2048,ck,4,0,45.1242,a8w8_blockscale_1x128x128_256x16x256x128_8x16_16x16_1x4_16x16x1_8x32x1_1x16x1x16_8_1x2_intrawave_v1,89.23,177.19,0.0
64,400,2560,2048,ck,4,0,49.2663,a8w8_blockscale_1x128x128_256x16x256x128_8x16_16x16_1x4_16x16x1_8x32x1_1x16x1x16_8_1x2_intrawave_v1,85.14,164.62,0.0
64,416,2560,2048,ck,5,0,50.1851,a8w8_blockscale_1x128x128_256x16x128x128_8x16_16x16_1x2_16x16x1_8x32x1_1x16x1x16_8_1x2_intrawave_v1,86.92,163.89,0.0
64,432,2560,2048,ck,5,0,52.3525,a8w8_blockscale_1x128x128_256x16x128x128_8x16_16x16_1x2_16x16x1_8x32x1_1x16x1x16_8_1x2_intrawave_v1,86.53,159.29,0.0
64,448,2560,2048,ck,4,0,52.7866,a8w8_blockscale_1x128x128_256x16x256x128_8x16_16x16_1x4_16x16x1_8x32x1_1x16x1x16_8_1x2_intrawave_v1,88.99,160.16,0.0
64,464,2560,2048,ck,5,0,54.8,a8w8_blockscale_1x128x128_256x16x128x128_8x16_16x16_1x2_16x16x1_8x32x1_1x16x1x16_8_1x2_intrawave_v1,88.78,156.37,0.0
64,480,2560,2048,ck,5,0,52.8143,a8w8_blockscale_1x128x128_256x16x128x128_8x16_16x16_1x2_16x16x1_8x32x1_1x16x1x16_8_1x2_intrawave_v1,95.3,164.42,0.0
64,496,2560,2048,ck,4,0,52.4525,a8w8_blockscale_1x128x128_256x16x256x128_8x16_16x16_1x4_16x16x1_8x32x1_1x16x1x16_8_1x2_intrawave_v1,99.16,167.74,0.0
64,512,2560,2048,ck,5,0,51.7684,a8w8_blockscale_1x128x128_256x16x128x128_8x16_16x16_1x2_16x16x1_8x32x1_1x16x1x16_8_1x2_intrawave_v1,103.71,172.17,0.0
64,8192,2560,2048,ck,4,0,648.9185,a8w8_blockscale_1x128x128_256x16x256x128_8x16_16x16_1x4_16x16x1_8x32x1_1x16x1x16_8_1x2_intrawave_v1,132.37,98.57,0.0
64,128,4096,1280,ck,5,0,15.6544,a8w8_blockscale_1x128x128_256x16x128x128_8x16_16x16_1x2_16x16x1_8x32x1_1x16x1x16_8_1x2_intrawave_v1,85.74,412.36,0.0
64,1,4608,2048,ck,7,0,21.8652,a8w8_blockscale_1x128x128_256x16x128x256_16x16_16x16_1x2_16x16x1_16x16x1_1x16x1x16_8_1x2_intrawave_v1,0.86,432.12,0.0
64,2,4608,2048,ck,7,0,22.0835,a8w8_blockscale_1x128x128_256x16x128x256_16x16_16x16_1x2_16x16x1_16x16x1_1x16x1x16_8_1x2_intrawave_v1,1.71,428.36,0.0
64,4,4608,2048,ck,7,0,22.2302,a8w8_blockscale_1x128x128_256x16x128x256_16x16_16x16_1x2_16x16x1_16x16x1_1x16x1x16_8_1x2_intrawave_v1,3.4,426.55,0.0
64,8,4608,2048,ck,7,0,22.3048,a8w8_blockscale_1x128x128_256x16x128x256_16x16_16x16_1x2_16x16x1_16x16x1_1x16x1x16_8_1x2_intrawave_v1,6.77,427.14,0.0
64,16,4608,2048,ck,7,0,22.5907,a8w8_blockscale_1x128x128_256x16x128x256_16x16_16x16_1x2_16x16x1_16x16x1_1x16x1x16_8_1x2_intrawave_v1,13.37,425.72,0.0
64,16,4608,7168,ck,7,0,61.196,a8w8_blockscale_1x128x128_256x16x128x256_16x16_16x16_1x2_16x16x1_16x16x1_1x16x1x16_8_1x2_intrawave_v1,17.27,544.03,0.0
64,24,4608,2048,ck,7,0,24.6725,a8w8_blockscale_1x128x128_256x16x128x256_16x16_16x16_1x2_16x16x1_16x16x1_1x16x1x16_8_1x2_intrawave_v1,18.36,393.46,0.0
64,32,4608,2048,ck,7,0,24.7515,a8w8_blockscale_1x128x128_256x16x128x256_16x16_16x16_1x2_16x16x1_16x16x1_1x16x1x16_8_1x2_intrawave_v1,24.4,395.84,0.0
64,32,4608,7168,ck,5,0,65.4147,a8w8_blockscale_1x128x128_256x16x128x128_8x16_16x16_1x2_16x16x1_8x32x1_1x16x1x16_8_1x2_intrawave_v1,32.32,512.95,0.0
64,40,4608,2048,ck,5,0,26.7606,a8w8_blockscale_1x128x128_256x16x128x128_8x16_16x16_1x2_16x16x1_8x32x1_1x16x1x16_8_1x2_intrawave_v1,28.21,369.49,0.0
64,48,4608,2048,ck,4,0,27.1449,a8w8_blockscale_1x128x128_256x16x256x128_8x16_16x16_1x4_16x16x1_8x32x1_1x16x1x16_8_1x2_intrawave_v1,33.38,367.58,0.0
64,56,4608,2048,ck,5,0,26.7624,a8w8_blockscale_1x128x128_256x16x128x128_8x16_16x16_1x2_16x16x1_8x32x1_1x16x1x16_8_1x2_intrawave_v1,39.49,376.2,0.0
64,64,4608,2048,ck,5,0,28.055,a8w8_blockscale_1x128x128_256x16x128x128_8x16_16x16_1x2_16x16x1_8x32x1_1x16x1x16_8_1x2_intrawave_v1,43.06,362.08,0.0
64,64,4608,7168,ck,5,0,70.5849,a8w8_blockscale_1x128x128_256x16x128x128_8x16_16x16_1x2_16x16x1_8x32x1_1x16x1x16_8_1x2_intrawave_v1,59.9,482.8,0.0
64,72,4608,2048,ck,4,0,28.1445,a8w8_blockscale_1x128x128_256x16x256x128_8x16_16x16_1x4_16x16x1_8x32x1_1x16x1x16_8_1x2_intrawave_v1,48.28,364.13,0.0
64,80,4608,2048,ck,4,0,28.4329,a8w8_blockscale_1x128x128_256x16x256x128_8x16_16x16_1x4_16x16x1_8x32x1_1x16x1x16_8_1x2_intrawave_v1,53.11,363.6,0.0
64,88,4608,2048,ck,5,0,36.0626,a8w8_blockscale_1x128x128_256x16x128x128_8x16_16x16_1x2_16x16x1_8x32x1_1x16x1x16_8_1x2_intrawave_v1,46.06,289.18,0.0
64,96,4608,2048,ck,5,0,35.8703,a8w8_blockscale_1x128x128_256x16x128x128_8x16_16x16_1x2_16x16x1_8x32x1_1x16x1x16_8_1x2_intrawave_v1,50.51,293.24,0.0
64,104,4608,2048,ck,5,0,37.595,a8w8_blockscale_1x128x128_256x16x128x128_8x16_16x16_1x2_16x16x1_8x32x1_1x16x1x16_8_1x2_intrawave_v1,52.21,282.18,0.0
64,112,4608,2048,ck,5,0,39.1637,a8w8_blockscale_1x128x128_256x16x128x128_8x16_16x16_1x2_16x16x1_8x32x1_1x16x1x16_8_1x2_intrawave_v1,53.98,273.18,0.0
64,120,4608,2048,ck,5,0,36.3764,a8w8_blockscale_1x128x128_256x16x128x128_8x16_16x16_1x2_16x16x1_8x32x1_1x16x1x16_8_1x2_intrawave_v1,62.26,296.59,0.0
64,128,4608,2048,ck,5,0,37.1152,a8w8_blockscale_1x128x128_256x16x128x128_8x16_16x16_1x2_16x16x1_8x32x1_1x16x1x16_8_1x2_intrawave_v1,65.09,293.11,0.0
64,128,4608,7168,ck,5,0,97.1681,a8w8_blockscale_1x128x128_256x16x128x128_8x16_16x16_1x2_16x16x1_8x32x1_1x16x1x16_8_1x2_intrawave_v1,87.02,361.51,0.0
64,136,4608,2048,ck,4,0,45.3808,a8w8_blockscale_1x128x128_256x16x256x128_8x16_16x16_1x4_16x16x1_8x32x1_1x16x1x16_8_1x2_intrawave_v1,56.56,241.71,0.0
64,144,4608,2048,ck,4,0,45.6162,a8w8_blockscale_1x128x128_256x16x256x128_8x16_16x16_1x4_16x16x1_8x32x1_1x16x1x16_8_1x2_intrawave_v1,59.58,242.44,0.0
64,152,4608,2048,ck,5,0,41.2897,a8w8_blockscale_1x128x128_256x16x128x128_8x16_16x16_1x2_16x16x1_8x32x1_1x16x1x16_8_1x2_intrawave_v1,69.48,270.03,0.0
64,160,4608,2048,ck,4,0,41.3532,a8w8_blockscale_1x128x128_256x16x256x128_8x16_16x16_1x4_16x16x1_8x32x1_1x16x1x16_8_1x2_intrawave_v1,73.03,271.79,0.0
64,168,4608,2048,ck,5,0,45.6617,a8w8_blockscale_1x128x128_256x16x128x128_8x16_16x16_1x2_16x16x1_8x32x1_1x16x1x16_8_1x2_intrawave_v1,69.44,248.12,0.0
64,176,4608,2048,ck,5,0,45.576,a8w8_blockscale_1x128x128_256x16x128x128_8x16_16x16_1x2_16x16x1_8x32x1_1x16x1x16_8_1x2_intrawave_v1,72.89,250.56,0.0
64,184,4608,2048,ck,4,0,53.2196,a8w8_blockscale_1x128x128_256x16x256x128_8x16_16x16_1x4_16x16x1_8x32x1_1x16x1x16_8_1x2_intrawave_v1,65.26,216.27,0.0
64,192,4608,2048,ck,4,0,53.7164,a8w8_blockscale_1x128x128_256x16x256x128_8x16_16x16_1x4_16x16x1_8x32x1_1x16x1x16_8_1x2_intrawave_v1,67.46,215.95,0.0
64,200,4608,2048,ck,4,0,53.3531,a8w8_blockscale_1x128x128_256x16x256x128_8x16_16x16_1x4_16x16x1_8x32x1_1x16x1x16_8_1x2_intrawave_v1,70.75,219.11,0.0
64,208,4608,2048,ck,4,0,53.7077,a8w8_blockscale_1x128x128_256x16x256x128_8x16_16x16_1x4_16x16x1_8x32x1_1x16x1x16_8_1x2_intrawave_v1,73.1,219.34,0.0
64,216,4608,2048,ck,4,0,56.0011,a8w8_blockscale_1x128x128_256x16x256x128_8x16_16x16_1x4_16x16x1_8x32x1_1x16x1x16_8_1x2_intrawave_v1,72.8,211.96,0.0
64,224,4608,2048,ck,4,0,57.1927,a8w8_blockscale_1x128x128_256x16x256x128_8x16_16x16_1x4_16x16x1_8x32x1_1x16x1x16_8_1x2_intrawave_v1,73.92,209.12,0.0
64,232,4608,2048,ck,4,0,52.4809,a8w8_blockscale_1x128x128_256x16x256x128_8x16_16x16_1x4_16x16x1_8x32x1_1x16x1x16_8_1x2_intrawave_v1,83.44,229.62,0.0
64,240,4608,2048,ck,4,0,52.5518,a8w8_blockscale_1x128x128_256x16x256x128_8x16_16x16_1x4_16x16x1_8x32x1_1x16x1x16_8_1x2_intrawave_v1,86.2,231.02,0.0
64,248,4608,2048,ck,4,0,46.7871,a8w8_blockscale_1x128x128_256x16x256x128_8x16_16x16_1x4_16x16x1_8x32x1_1x16x1x16_8_1x2_intrawave_v1,100.05,261.41,0.0
64,256,4608,2048,ck,5,0,46.6065,a8w8_blockscale_1x128x128_256x16x128x128_8x16_16x16_1x2_16x16x1_8x32x1_1x16x1x16_8_1x2_intrawave_v1,103.67,264.36,0.0
64,256,4608,7168,ck,4,0,129.3305,a8w8_blockscale_1x128x128_256x16x256x128_8x16_16x16_1x4_16x16x1_8x32x1_1x16x1x16_8_1x2_intrawave_v1,130.76,287.82,0.0
64,264,4608,2048,ck,5,0,58.4321,a8w8_blockscale_1x128x128_256x16x128x128_8x16_16x16_1x2_16x16x1_8x32x1_1x16x1x16_8_1x2_intrawave_v1,85.28,212.4,0.0
64,272,4608,2048,ck,5,0,59.044,a8w8_blockscale_1x128x128_256x16x128x128_8x16_16x16_1x2_16x16x1_8x32x1_1x16x1x16_8_1x2_intrawave_v1,86.95,211.72,0.0
64,280,4608,2048,ck,4,0,66.6974,a8w8_blockscale_1x128x128_256x16x256x128_8x16_16x16_1x4_16x16x1_8x32x1_1x16x1x16_8_1x2_intrawave_v1,79.24,188.78,0.0
64,288,4608,2048,ck,4,0,67.7728,a8w8_blockscale_1x128x128_256x16x256x128_8x16_16x16_1x4_16x16x1_8x32x1_1x16x1x16_8_1x2_intrawave_v1,80.21,187.11,0.0
64,296,4608,2048,ck,4,0,65.8927,a8w8_blockscale_1x128x128_256x16x256x128_8x16_16x16_1x4_16x16x1_8x32x1_1x16x1x16_8_1x2_intrawave_v1,84.79,193.82,0.0
64,304,4608,2048,ck,4,0,66.4709,a8w8_blockscale_1x128x128_256x16x256x128_8x16_16x16_1x4_16x16x1_8x32x1_1x16x1x16_8_1x2_intrawave_v1,86.32,193.49,0.0
64,312,4608,2048,ck,4,0,72.7388,a8w8_blockscale_1x128x128_256x16x256x128_8x16_16x16_1x4_16x16x1_8x32x1_1x16x1x16_8_1x2_intrawave_v1,80.96,178.06,0.0
64,320,4608,2048,ck,4,0,72.6712,a8w8_blockscale_1x128x128_256x16x256x128_8x16_16x16_1x4_16x16x1_8x32x1_1x16x1x16_8_1x2_intrawave_v1,83.11,179.46,0.0
64,328,4608,2048,ck,4,0,61.6997,a8w8_blockscale_1x128x128_256x16x256x128_8x16_16x16_1x4_16x16x1_8x32x1_1x16x1x16_8_1x2_intrawave_v1,100.34,212.83,0.0
64,336,4608,2048,ck,4,0,63.5835,a8w8_blockscale_1x128x128_256x16x256x128_8x16_16x16_1x4_16x16x1_8x32x1_1x16x1x16_8_1x2_intrawave_v1,99.74,207.95,0.0
64,344,4608,2048,ck,4,0,67.6465,a8w8_blockscale_1x128x128_256x16x256x128_8x16_16x16_1x4_16x16x1_8x32x1_1x16x1x16_8_1x2_intrawave_v1,95.98,196.79,0.0
64,352,4608,2048,ck,4,0,68.7362,a8w8_blockscale_1x128x128_256x16x256x128_8x16_16x16_1x4_16x16x1_8x32x1_1x16x1x16_8_1x2_intrawave_v1,96.66,194.98,0.0
64,360,4608,2048,ck,4,0,68.5411,a8w8_blockscale_1x128x128_256x16x256x128_8x16_16x16_1x4_16x16x1_8x32x1_1x16x1x16_8_1x2_intrawave_v1,99.13,196.85,0.0
64,368,4608,2048,ck,4,0,69.4557,a8w8_blockscale_1x128x128_256x16x256x128_8x16_16x16_1x4_16x16x1_8x32x1_1x16x1x16_8_1x2_intrawave_v1,100.0,195.55,0.0
64,376,4608,2048,ck,4,0,71.4828,a8w8_blockscale_1x128x128_256x16x256x128_8x16_16x16_1x4_16x16x1_8x32x1_1x16x1x16_8_1x2_intrawave_v1,99.28,191.27,0.0
64,384,4608,2048,ck,4,0,72.0933,a8w8_blockscale_1x128x128_256x16x256x128_8x16_16x16_1x4_16x16x1_8x32x1_1x16x1x16_8_1x2_intrawave_v1,100.53,190.9,0.0
64,392,4608,2048,ck,4,0,78.0831,a8w8_blockscale_1x128x128_256x16x256x128_8x16_16x16_1x4_16x16x1_8x32x1_1x16x1x16_8_1x2_intrawave_v1,94.75,177.41,0.0
64,400,4608,2048,ck,4,0,85.573,a8w8_blockscale_1x128x128_256x16x256x128_8x16_16x16_1x4_16x16x1_8x32x1_1x16x1x16_8_1x2_intrawave_v1,88.23,162.93,0.0
64,408,4608,2048,ck,4,0,74.8713,a8w8_blockscale_1x128x128_256x16x256x128_8x16_16x16_1x4_16x16x1_8x32x1_1x16x1x16_8_1x2_intrawave_v1,102.85,187.43,0.0
64,416,4608,2048,ck,4,0,75.1986,a8w8_blockscale_1x128x128_256x16x256x128_8x16_16x16_1x4_16x16x1_8x32x1_1x16x1x16_8_1x2_intrawave_v1,104.41,187.81,0.0
64,424,4608,2048,ck,4,0,79.1491,a8w8_blockscale_1x128x128_256x16x256x128_8x16_16x16_1x4_16x16x1_8x32x1_1x16x1x16_8_1x2_intrawave_v1,101.11,179.57,0.0
64,432,4608,2048,ck,4,0,80.8701,a8w8_blockscale_1x128x128_256x16x256x128_8x16_16x16_1x4_16x16x1_8x32x1_1x16x1x16_8_1x2_intrawave_v1,100.82,176.87,0.0
64,440,4608,2048,ck,4,0,84.0773,a8w8_blockscale_1x128x128_256x16x256x128_8x16_16x16_1x4_16x16x1_8x32x1_1x16x1x16_8_1x2_intrawave_v1,98.77,171.19,0.0
64,448,4608,2048,ck,4,0,85.0858,a8w8_blockscale_1x128x128_256x16x256x128_8x16_16x16_1x4_16x16x1_8x32x1_1x16x1x16_8_1x2_intrawave_v1,99.38,170.22,0.0
64,456,4608,2048,ck,5,0,90.1317,a8w8_blockscale_1x128x128_256x16x128x128_8x16_16x16_1x2_16x16x1_8x32x1_1x16x1x16_8_1x2_intrawave_v1,95.49,161.69,0.0
64,464,4608,2048,ck,4,0,84.2516,a8w8_blockscale_1x128x128_256x16x256x128_8x16_16x16_1x4_16x16x1_8x32x1_1x16x1x16_8_1x2_intrawave_v1,103.95,174.05,0.0
64,472,4608,2048,ck,5,0,86.5888,a8w8_blockscale_1x128x128_256x16x128x128_8x16_16x16_1x2_16x16x1_8x32x1_1x16x1x16_8_1x2_intrawave_v1,102.89,170.39,0.0
64,480,4608,2048,ck,4,0,80.6333,a8w8_blockscale_1x128x128_256x16x256x128_8x16_16x16_1x4_16x16x1_8x32x1_1x16x1x16_8_1x2_intrawave_v1,112.36,184.09,0.0
64,488,4608,2048,ck,4,0,78.5308,a8w8_blockscale_1x128x128_256x16x256x128_8x16_16x16_1x4_16x16x1_8x32x1_1x16x1x16_8_1x2_intrawave_v1,117.29,190.17,0.0
64,496,4608,2048,ck,5,0,82.9216,a8w8_blockscale_1x128x128_256x16x128x128_8x16_16x16_1x2_16x16x1_8x32x1_1x16x1x16_8_1x2_intrawave_v1,112.9,181.18,0.0
64,504,4608,2048,ck,5,0,80.9207,a8w8_blockscale_1x128x128_256x16x128x128_8x16_16x16_1x2_16x16x1_8x32x1_1x16x1x16_8_1x2_intrawave_v1,117.56,186.78,0.0
64,512,4608,2048,ck,4,0,75.5376,a8w8_blockscale_1x128x128_256x16x256x128_8x16_16x16_1x4_16x16x1_8x32x1_1x16x1x16_8_1x2_intrawave_v1,127.93,201.28,0.0
64,512,4608,7168,ck,4,0,245.3308,a8w8_blockscale_1x128x128_256x16x256x128_8x16_16x16_1x4_16x16x1_8x32x1_1x16x1x16_8_1x2_intrawave_v1,137.87,168.83,0.0
64,1024,4608,2048,ck,4,0,146.3894,a8w8_blockscale_1x128x128_256x16x256x128_8x16_16x16_1x4_16x16x1_8x32x1_1x16x1x16_8_1x2_intrawave_v1,132.03,143.26,0.0
64,1024,4608,7168,ck,4,0,470.4402,a8w8_blockscale_1x128x128_256x16x256x128_8x16_16x16_1x4_16x16x1_8x32x1_1x16x1x16_8_1x2_intrawave_v1,143.79,105.87,0.0
64,1536,4608,7168,ck,4,0,706.1958,a8w8_blockscale_1x128x128_256x16x256x128_8x16_16x16_1x4_16x16x1_8x32x1_1x16x1x16_8_1x2_intrawave_v1,143.68,82.41,0.0
64,2048,4608,2048,ck,4,0,288.709,a8w8_blockscale_1x128x128_256x16x256x128_8x16_16x16_1x4_16x16x1_8x32x1_1x16x1x16_8_1x2_intrawave_v1,133.89,112.59,0.0
64,2048,4608,7168,ck,4,0,925.3082,a8w8_blockscale_1x128x128_256x16x256x128_8x16_16x16_1x4_16x16x1_8x32x1_1x16x1x16_8_1x2_intrawave_v1,146.21,71.96,0.0
64,4096,4608,2048,ck,4,0,590.6784,a8w8_blockscale_1x128x128_256x16x256x128_8x16_16x16_1x4_16x16x1_8x32x1_1x16x1x16_8_1x2_intrawave_v1,130.88,94.09,0.0
64,4096,4608,7168,ck,4,0,1856.4598,a8w8_blockscale_1x128x128_256x16x256x128_8x16_16x16_1x4_16x16x1_8x32x1_1x16x1x16_8_1x2_intrawave_v1,145.75,53.94,0.0
64,8192,4608,2048,ck,4,0,1144.8114,a8w8_blockscale_1x128x128_256x16x256x128_8x16_16x16_1x4_16x16x1_8x32x1_1x16x1x16_8_1x2_intrawave_v1,135.06,88.85,0.0
64,8192,4608,7168,ck,4,0,3706.059,a8w8_blockscale_1x128x128_256x16x256x128_8x16_16x16_1x4_16x16x1_8x32x1_1x16x1x16_8_1x2_intrawave_v1,146.02,45.13,0.0
64,16384,4608,2048,ck,4,0,2321.4591,a8w8_blockscale_1x128x128_256x16x256x128_8x16_16x16_1x4_16x16x1_8x32x1_1x16x1x16_8_1x2_intrawave_v1,133.21,83.56,0.0
64,16384,4608,7168,ck,4,0,7509.3088,a8w8_blockscale_1x128x128_256x16x256x128_8x16_16x16_1x4_16x16x1_8x32x1_1x16x1x16_8_1x2_intrawave_v1,144.13,40.15,0.0
64,20480,4608,2048,ck,4,0,2907.8671,a8w8_blockscale_1x128x128_256x16x256x128_8x16_16x16_1x4_16x16x1_8x32x1_1x16x1x16_8_1x2_intrawave_v1,132.93,82.58,0.0
64,20480,4608,7168,ck,4,0,9434.4568,a8w8_blockscale_1x128x128_256x16x256x128_8x16_16x16_1x4_16x16x1_8x32x1_1x16x1x16_8_1x2_intrawave_v1,143.4,39.07,0.0
64,1,6144,2048,ck,7,0,28.1272,a8w8_blockscale_1x128x128_256x16x128x256_16x16_16x16_1x2_16x16x1_16x16x1_1x16x1x16_8_1x2_intrawave_v1,0.89,447.87,0.0
64,2,6144,2048,ck,4,0,30.3999,a8w8_blockscale_1x128x128_256x16x256x128_8x16_16x16_1x4_16x16x1_8x32x1_1x16x1x16_8_1x2_intrawave_v1,1.66,414.86,0.0
64,4,6144,2048,ck,7,0,28.4451,a8w8_blockscale_1x128x128_256x16x128x256_16x16_16x16_1x2_16x16x1_16x16x1_1x16x1x16_8_1x2_intrawave_v1,3.54,444.37,0.0
64,8,6144,2048,ck,7,0,28.6326,a8w8_blockscale_1x128x128_256x16x128x256_16x16_16x16_1x2_16x16x1_16x16x1_1x16x1x16_8_1x2_intrawave_v1,7.03,443.47,0.0
64,16,6144,2048,ck,7,0,28.8897,a8w8_blockscale_1x128x128_256x16x128x256_16x16_16x16_1x2_16x16x1_16x16x1_1x16x1x16_8_1x2_intrawave_v1,13.94,443.49,0.0
64,24,6144,2048,ck,7,0,31.2273,a8w8_blockscale_1x128x128_256x16x128x256_16x16_16x16_1x2_16x16x1_16x16x1_1x16x1x16_8_1x2_intrawave_v1,19.34,413.96,0.0
64,32,6144,2048,ck,7,0,31.7942,a8w8_blockscale_1x128x128_256x16x128x256_16x16_16x16_1x2_16x16x1_16x16x1_1x16x1x16_8_1x2_intrawave_v1,25.33,410.19,0.0
64,40,6144,2048,ck,7,0,32.5022,a8w8_blockscale_1x128x128_256x16x128x256_16x16_16x16_1x2_16x16x1_16x16x1_1x16x1x16_8_1x2_intrawave_v1,30.97,404.78,0.0
64,48,6144,2048,ck,5,0,36.0501,a8w8_blockscale_1x128x128_256x16x128x128_8x16_16x16_1x2_16x16x1_8x32x1_1x16x1x16_8_1x2_intrawave_v1,33.51,368.13,0.0
64,56,6144,2048,ck,7,0,32.2193,a8w8_blockscale_1x128x128_256x16x128x256_16x16_16x16_1x2_16x16x1_16x16x1_1x16x1x16_8_1x2_intrawave_v1,43.74,415.46,0.0
64,64,6144,2048,ck,7,0,32.2696,a8w8_blockscale_1x128x128_256x16x128x256_16x16_16x16_1x2_16x16x1_16x16x1_1x16x1x16_8_1x2_intrawave_v1,49.91,418.36,0.0
64,72,6144,2048,ck,4,0,44.6024,a8w8_blockscale_1x128x128_256x16x256x128_8x16_16x16_1x4_16x16x1_8x32x1_1x16x1x16_8_1x2_intrawave_v1,40.62,305.25,0.0
64,80,6144,2048,ck,7,0,43.7239,a8w8_blockscale_1x128x128_256x16x128x256_16x16_16x16_1x2_16x16x1_16x16x1_1x16x1x16_8_1x2_intrawave_v1,46.04,314.01,0.0
64,88,6144,2048,ck,4,0,44.7597,a8w8_blockscale_1x128x128_256x16x256x128_8x16_16x16_1x4_16x16x1_8x32x1_1x16x1x16_8_1x2_intrawave_v1,49.48,309.31,0.0
64,96,6144,2048,ck,4,0,44.8335,a8w8_blockscale_1x128x128_256x16x256x128_8x16_16x16_1x4_16x16x1_8x32x1_1x16x1x16_8_1x2_intrawave_v1,53.89,311.36,0.0
64,104,6144,2048,ck,4,0,43.575,a8w8_blockscale_1x128x128_256x16x256x128_8x16_16x16_1x4_16x16x1_8x32x1_1x16x1x16_8_1x2_intrawave_v1,60.06,322.98,0.0
64,112,6144,2048,ck,5,0,45.7558,a8w8_blockscale_1x128x128_256x16x128x128_8x16_16x16_1x2_16x16x1_8x32x1_1x16x1x16_8_1x2_intrawave_v1,61.6,310.09,0.0
64,120,6144,2048,ck,4,0,41.5737,a8w8_blockscale_1x128x128_256x16x256x128_8x16_16x16_1x4_16x16x1_8x32x1_1x16x1x16_8_1x2_intrawave_v1,72.64,344.05,0.0
64,128,6144,2048,ck,4,0,42.0674,a8w8_blockscale_1x128x128_256x16x256x128_8x16_16x16_1x4_16x16x1_8x32x1_1x16x1x16_8_1x2_intrawave_v1,76.57,342.73,0.0
64,136,6144,2048,ck,5,0,56.7687,a8w8_blockscale_1x128x128_256x16x128x128_8x16_16x16_1x2_16x16x1_8x32x1_1x16x1x16_8_1x2_intrawave_v1,60.29,256.0,0.0
64,144,6144,2048,ck,5,0,57.7782,a8w8_blockscale_1x128x128_256x16x128x128_8x16_16x16_1x2_16x16x1_8x32x1_1x16x1x16_8_1x2_intrawave_v1,62.72,253.51,0.0
64,152,6144,2048,ck,4,0,52.2986,a8w8_blockscale_1x128x128_256x16x256x128_8x16_16x16_1x4_16x16x1_8x32x1_1x16x1x16_8_1x2_intrawave_v1,73.14,282.26,0.0
64,160,6144,2048,ck,4,0,52.0028,a8w8_blockscale_1x128x128_256x16x256x128_8x16_16x16_1x4_16x16x1_8x32x1_1x16x1x16_8_1x2_intrawave_v1,77.43,286.07,0.0
64,168,6144,2048,ck,5,0,54.5057,a8w8_blockscale_1x128x128_256x16x128x128_8x16_16x16_1x2_16x16x1_8x32x1_1x16x1x16_8_1x2_intrawave_v1,77.57,275.04,0.0
64,176,6144,2048,ck,4,0,52.0801,a8w8_blockscale_1x128x128_256x16x256x128_8x16_16x16_1x4_16x16x1_8x32x1_1x16x1x16_8_1x2_intrawave_v1,85.05,290.05,0.0
64,184,6144,2048,ck,4,0,67.6618,a8w8_blockscale_1x128x128_256x16x256x128_8x16_16x16_1x4_16x16x1_8x32x1_1x16x1x16_8_1x2_intrawave_v1,68.44,224.95,0.0
64,192,6144,2048,ck,4,0,63.5511,a8w8_blockscale_1x128x128_256x16x256x128_8x16_16x16_1x4_16x16x1_8x32x1_1x16x1x16_8_1x2_intrawave_v1,76.03,241.31,0.0
64,200,6144,2048,ck,4,0,60.9457,a8w8_blockscale_1x128x128_256x16x256x128_8x16_16x16_1x4_16x16x1_8x32x1_1x16x1x16_8_1x2_intrawave_v1,82.58,253.51,0.0
64,208,6144,2048,ck,4,0,59.9919,a8w8_blockscale_1x128x128_256x16x256x128_8x16_16x16_1x4_16x16x1_8x32x1_1x16x1x16_8_1x2_intrawave_v1,87.25,259.45,0.0
64,216,6144,2048,ck,4,0,64.338,a8w8_blockscale_1x128x128_256x16x256x128_8x16_16x16_1x4_16x16x1_8x32x1_1x16x1x16_8_1x2_intrawave_v1,84.49,243.7,0.0
64,224,6144,2048,ck,4,0,64.7067,a8w8_blockscale_1x128x128_256x16x256x128_8x16_16x16_1x4_16x16x1_8x32x1_1x16x1x16_8_1x2_intrawave_v1,87.12,244.09,0.0
64,232,6144,2048,ck,4,0,62.3486,a8w8_blockscale_1x128x128_256x16x256x128_8x16_16x16_1x4_16x16x1_8x32x1_1x16x1x16_8_1x2_intrawave_v1,93.64,255.16,0.0
64,240,6144,2048,ck,4,0,62.0497,a8w8_blockscale_1x128x128_256x16x256x128_8x16_16x16_1x4_16x16x1_8x32x1_1x16x1x16_8_1x2_intrawave_v1,97.34,258.24,0.0
64,248,6144,2048,ck,4,0,54.3603,a8w8_blockscale_1x128x128_256x16x256x128_8x16_16x16_1x4_16x16x1_8x32x1_1x16x1x16_8_1x2_intrawave_v1,114.81,296.88,0.0
64,256,6144,2048,ck,4,0,54.7972,a8w8_blockscale_1x128x128_256x16x256x128_8x16_16x16_1x4_16x16x1_8x32x1_1x16x1x16_8_1x2_intrawave_v1,117.57,296.6,0.0
64,264,6144,2048,ck,4,0,69.7711,a8w8_blockscale_1x128x128_256x16x256x128_8x16_16x16_1x4_16x16x1_8x32x1_1x16x1x16_8_1x2_intrawave_v1,95.22,234.59,0.0
64,272,6144,2048,ck,4,0,70.3541,a8w8_blockscale_1x128x128_256x16x256x128_8x16_16x16_1x4_16x16x1_8x32x1_1x16x1x16_8_1x2_intrawave_v1,97.3,234.28,0.0
64,280,6144,2048,ck,4,0,78.0416,a8w8_blockscale_1x128x128_256x16x256x128_8x16_16x16_1x4_16x16x1_8x32x1_1x16x1x16_8_1x2_intrawave_v1,90.29,212.67,0.0
64,288,6144,2048,ck,4,0,78.2285,a8w8_blockscale_1x128x128_256x16x256x128_8x16_16x16_1x4_16x16x1_8x32x1_1x16x1x16_8_1x2_intrawave_v1,92.65,213.63,0.0
64,296,6144,2048,ck,4,0,77.9038,a8w8_blockscale_1x128x128_256x16x256x128_8x16_16x16_1x4_16x16x1_8x32x1_1x16x1x16_8_1x2_intrawave_v1,95.62,215.99,0.0
64,304,6144,2048,ck,4,0,78.5257,a8w8_blockscale_1x128x128_256x16x256x128_8x16_16x16_1x4_16x16x1_8x32x1_1x16x1x16_8_1x2_intrawave_v1,97.43,215.74,0.0
64,312,6144,2048,ck,4,0,87.1662,a8w8_blockscale_1x128x128_256x16x256x128_8x16_16x16_1x4_16x16x1_8x32x1_1x16x1x16_8_1x2_intrawave_v1,90.08,195.67,0.0
64,320,6144,2048,ck,4,0,88.2706,a8w8_blockscale_1x128x128_256x16x256x128_8x16_16x16_1x4_16x16x1_8x32x1_1x16x1x16_8_1x2_intrawave_v1,91.23,194.52,0.0
64,328,6144,2048,ck,4,0,80.165,a8w8_blockscale_1x128x128_256x16x256x128_8x16_16x16_1x4_16x16x1_8x32x1_1x16x1x16_8_1x2_intrawave_v1,102.97,215.62,0.0
64,336,6144,2048,ck,4,0,81.2065,a8w8_blockscale_1x128x128_256x16x256x128_8x16_16x16_1x4_16x16x1_8x32x1_1x16x1x16_8_1x2_intrawave_v1,104.13,214.27,0.0
64,344,6144,2048,ck,4,0,84.0024,a8w8_blockscale_1x128x128_256x16x256x128_8x16_16x16_1x4_16x16x1_8x32x1_1x16x1x16_8_1x2_intrawave_v1,103.06,208.5,0.0
64,352,6144,2048,ck,4,0,84.9616,a8w8_blockscale_1x128x128_256x16x256x128_8x16_16x16_1x4_16x16x1_8x32x1_1x16x1x16_8_1x2_intrawave_v1,104.26,207.5,0.0
64,360,6144,2048,ck,4,0,92.7986,a8w8_blockscale_1x128x128_256x16x256x128_8x16_16x16_1x4_16x16x1_8x32x1_1x16x1x16_8_1x2_intrawave_v1,97.63,191.21,0.0
64,368,6144,2048,ck,4,0,93.5784,a8w8_blockscale_1x128x128_256x16x256x128_8x16_16x16_1x4_16x16x1_8x32x1_1x16x1x16_8_1x2_intrawave_v1,98.97,190.84,0.0
64,376,6144,2048,ck,4,0,89.1997,a8w8_blockscale_1x128x128_256x16x256x128_8x16_16x16_1x4_16x16x1_8x32x1_1x16x1x16_8_1x2_intrawave_v1,106.08,201.49,0.0
64,384,6144,2048,ck,4,0,90.4864,a8w8_blockscale_1x128x128_256x16x256x128_8x16_16x16_1x4_16x16x1_8x32x1_1x16x1x16_8_1x2_intrawave_v1,106.8,199.9,0.0
64,392,6144,2048,ck,4,0,97.0628,a8w8_blockscale_1x128x128_256x16x256x128_8x16_16x16_1x4_16x16x1_8x32x1_1x16x1x16_8_1x2_intrawave_v1,101.64,187.53,0.0
64,400,6144,2048,ck,4,0,97.3049,a8w8_blockscale_1x128x128_256x16x256x128_8x16_16x16_1x4_16x16x1_8x32x1_1x16x1x16_8_1x2_intrawave_v1,103.45,188.25,0.0
64,408,6144,2048,ck,4,0,99.0865,a8w8_blockscale_1x128x128_256x16x256x128_8x16_16x16_1x4_16x16x1_8x32x1_1x16x1x16_8_1x2_intrawave_v1,103.62,186.02,0.0
64,416,6144,2048,ck,4,0,105.1378,a8w8_blockscale_1x128x128_256x16x256x128_8x16_16x16_1x4_16x16x1_8x32x1_1x16x1x16_8_1x2_intrawave_v1,99.57,176.4,0.0
64,424,6144,2048,ck,4,0,103.7592,a8w8_blockscale_1x128x128_256x16x256x128_8x16_16x16_1x4_16x16x1_8x32x1_1x16x1x16_8_1x2_intrawave_v1,102.84,179.85,0.0
64,432,6144,2048,ck,5,0,112.6845,a8w8_blockscale_1x128x128_256x16x128x128_8x16_16x16_1x2_16x16x1_8x32x1_1x16x1x16_8_1x2_intrawave_v1,96.48,166.63,0.0
64,440,6144,2048,ck,4,0,114.717,a8w8_blockscale_1x128x128_256x16x256x128_8x16_16x16_1x4_16x16x1_8x32x1_1x16x1x16_8_1x2_intrawave_v1,96.52,164.67,0.0
64,448,6144,2048,ck,4,0,118.2953,a8w8_blockscale_1x128x128_256x16x256x128_8x16_16x16_1x4_16x16x1_8x32x1_1x16x1x16_8_1x2_intrawave_v1,95.31,160.66,0.0
64,456,6144,2048,ck,4,0,107.9807,a8w8_blockscale_1x128x128_256x16x256x128_8x16_16x16_1x4_16x16x1_8x32x1_1x16x1x16_8_1x2_intrawave_v1,106.27,177.07,0.0
64,464,6144,2048,ck,4,0,106.883,a8w8_blockscale_1x128x128_256x16x256x128_8x16_16x16_1x4_16x16x1_8x32x1_1x16x1x16_8_1x2_intrawave_v1,109.25,179.96,0.0
64,472,6144,2048,ck,4,0,106.8688,a8w8_blockscale_1x128x128_256x16x256x128_8x16_16x16_1x4_16x16x1_8x32x1_1x16x1x16_8_1x2_intrawave_v1,111.15,181.06,0.0
64,480,6144,2048,ck,4,0,106.2816,a8w8_blockscale_1x128x128_256x16x256x128_8x16_16x16_1x4_16x16x1_8x32x1_1x16x1x16_8_1x2_intrawave_v1,113.66,183.14,0.0
64,488,6144,2048,ck,4,0,103.5695,a8w8_blockscale_1x128x128_256x16x256x128_8x16_16x16_1x4_16x16x1_8x32x1_1x16x1x16_8_1x2_intrawave_v1,118.58,189.04,0.0
64,496,6144,2048,ck,5,0,112.6771,a8w8_blockscale_1x128x128_256x16x128x128_8x16_16x16_1x2_16x16x1_8x32x1_1x16x1x16_8_1x2_intrawave_v1,110.78,174.78,0.0
64,504,6144,2048,ck,4,0,106.0555,a8w8_blockscale_1x128x128_256x16x256x128_8x16_16x16_1x4_16x16x1_8x32x1_1x16x1x16_8_1x2_intrawave_v1,119.59,186.77,0.0
64,512,6144,2048,ck,4,0,100.4293,a8w8_blockscale_1x128x128_256x16x256x128_8x16_16x16_1x4_16x16x1_8x32x1_1x16x1x16_8_1x2_intrawave_v1,128.3,198.38,0.0
64,1024,6144,2048,ck,4,0,196.5693,a8w8_blockscale_1x128x128_256x16x256x128_8x16_16x16_1x4_16x16x1_8x32x1_1x16x1x16_8_1x2_intrawave_v1,131.1,138.69,0.0
64,2048,6144,2048,ck,4,0,396.6876,a8w8_blockscale_1x128x128_256x16x256x128_8x16_16x16_1x4_16x16x1_8x32x1_1x16x1x16_8_1x2_intrawave_v1,129.92,105.73,0.0
64,4096,6144,2048,ck,4,0,798.5085,a8w8_blockscale_1x128x128_256x16x256x128_8x16_16x16_1x4_16x16x1_8x32x1_1x16x1x16_8_1x2_intrawave_v1,129.09,89.3,0.0
64,8192,6144,2048,ck,4,0,1549.4403,a8w8_blockscale_1x128x128_256x16x256x128_8x16_16x16_1x4_16x16x1_8x32x1_1x16x1x16_8_1x2_intrawave_v1,133.05,83.92,0.0
64,16384,6144,2048,ck,4,0,3096.8893,a8w8_blockscale_1x128x128_256x16x256x128_8x16_16x16_1x4_16x16x1_8x32x1_1x16x1x16_8_1x2_intrawave_v1,133.14,79.91,0.0
64,20480,6144,2048,ck,4,0,3931.7623,a8w8_blockscale_1x128x128_256x16x256x128_8x16_16x16_1x4_16x16x1_8x32x1_1x16x1x16_8_1x2_intrawave_v1,131.09,77.87,0.0
64,16,7168,256,ck,5,0,7.5942,a8w8_blockscale_1x128x128_256x16x128x128_8x16_16x16_1x2_16x16x1_8x32x1_1x16x1x16_8_1x2_intrawave_v1,7.73,272.38,0.0
64,16,7168,2304,ck,5,0,29.7999,a8w8_blockscale_1x128x128_256x16x128x128_8x16_16x16_1x2_16x16x1_8x32x1_1x16x1x16_8_1x2_intrawave_v1,17.73,563.13,0.0
64,32,7168,256,ck,7,0,6.7547,a8w8_blockscale_1x128x128_256x16x128x256_16x16_16x16_1x2_16x16x1_16x16x1_1x16x1x16_8_1x2_intrawave_v1,17.39,340.79,0.0
64,32,7168,2304,ck,5,0,31.5786,a8w8_blockscale_1x128x128_256x16x128x128_8x16_16x16_1x2_16x16x1_8x32x1_1x16x1x16_8_1x2_intrawave_v1,33.47,539.85,0.0
64,64,7168,256,ck,7,0,8.0483,a8w8_blockscale_1x128x128_256x16x128x256_16x16_16x16_1x2_16x16x1_16x16x1_1x16x1x16_8_1x2_intrawave_v1,29.18,344.03,0.0
64,64,7168,2304,ck,5,0,35.8219,a8w8_blockscale_1x128x128_256x16x128x128_8x16_16x16_1x2_16x16x1_8x32x1_1x16x1x16_8_1x2_intrawave_v1,59.01,490.76,0.0
64,128,7168,256,ck,5,0,10.4942,a8w8_blockscale_1x128x128_256x16x128x128_8x16_16x16_1x2_16x16x1_8x32x1_1x16x1x16_8_1x2_intrawave_v1,44.76,352.84,0.0
64,128,7168,2304,ck,4,0,44.49,a8w8_blockscale_1x128x128_256x16x256x128_8x16_16x16_1x4_16x16x1_8x32x1_1x16x1x16_8_1x2_intrawave_v1,95.03,419.08,0.0
64,256,7168,256,ck,5,0,17.0442,a8w8_blockscale_1x128x128_256x16x128x128_8x16_16x16_1x2_16x16x1_8x32x1_1x16x1x16_8_1x2_intrawave_v1,55.12,326.83,0.0
64,256,7168,2304,ck,5,0,70.6064,a8w8_blockscale_1x128x128_256x16x128x128_8x16_16x16_1x2_16x16x1_8x32x1_1x16x1x16_8_1x2_intrawave_v1,119.76,294.24,0.0
64,512,7168,256,ck,5,0,31.2223,a8w8_blockscale_1x128x128_256x16x128x128_8x16_16x16_1x2_16x16x1_8x32x1_1x16x1x16_8_1x2_intrawave_v1,60.18,298.06,0.0
64,512,7168,2304,ck,4,0,126.6107,a8w8_blockscale_1x128x128_256x16x256x128_8x16_16x16_1x4_16x16x1_8x32x1_1x16x1x16_8_1x2_intrawave_v1,133.57,197.73,0.0
64,1024,7168,256,ck,5,0,59.2074,a8w8_blockscale_1x128x128_256x16x128x128_8x16_16x16_1x2_16x16x1_8x32x1_1x16x1x16_8_1x2_intrawave_v1,63.47,283.36,0.0
64,1024,7168,2304,ck,4,0,250.469,a8w8_blockscale_1x128x128_256x16x256x128_8x16_16x16_1x4_16x16x1_8x32x1_1x16x1x16_8_1x2_intrawave_v1,135.04,133.97,0.0
64,1536,7168,256,ck,5,0,86.3696,a8w8_blockscale_1x128x128_256x16x128x128_8x16_16x16_1x2_16x16x1_8x32x1_1x16x1x16_8_1x2_intrawave_v1,65.27,280.75,0.0
64,1536,7168,2304,ck,4,0,376.9631,a8w8_blockscale_1x128x128_256x16x256x128_8x16_16x16_1x4_16x16x1_8x32x1_1x16x1x16_8_1x2_intrawave_v1,134.59,111.61,0.0
64,2048,7168,256,ck,4,0,113.1272,a8w8_blockscale_1x128x128_256x16x256x128_8x16_16x16_1x4_16x16x1_8x32x1_1x16x1x16_8_1x2_intrawave_v1,66.44,280.39,0.0
64,2048,7168,2304,ck,4,0,518.9176,a8w8_blockscale_1x128x128_256x16x256x128_8x16_16x16_1x4_16x16x1_8x32x1_1x16x1x16_8_1x2_intrawave_v1,130.36,97.5,0.0
64,4096,7168,256,ck,5,0,206.5246,a8w8_blockscale_1x128x128_256x16x128x128_8x16_16x16_1x2_16x16x1_8x32x1_1x16x1x16_8_1x2_intrawave_v1,72.79,298.29,0.0
64,4096,7168,2304,ck,4,0,1016.5121,a8w8_blockscale_1x128x128_256x16x256x128_8x16_16x16_1x4_16x16x1_8x32x1_1x16x1x16_8_1x2_intrawave_v1,133.09,83.3,0.0
64,8192,7168,256,ck,5,0,429.9034,a8w8_blockscale_1x128x128_256x16x128x128_8x16_16x16_1x2_16x16x1_8x32x1_1x16x1x16_8_1x2_intrawave_v1,69.93,282.33,0.0
64,8192,7168,2304,ck,4,0,2010.797,a8w8_blockscale_1x128x128_256x16x256x128_8x16_16x16_1x4_16x16x1_8x32x1_1x16x1x16_8_1x2_intrawave_v1,134.57,76.0,0.0
64,16384,7168,256,ck,5,0,859.6215,a8w8_blockscale_1x128x128_256x16x128x128_8x16_16x16_1x2_16x16x1_8x32x1_1x16x1x16_8_1x2_intrawave_v1,69.95,280.25,0.0
64,16384,7168,2304,ck,4,0,4047.0059,a8w8_blockscale_1x128x128_256x16x256x128_8x16_16x16_1x4_16x16x1_8x32x1_1x16x1x16_8_1x2_intrawave_v1,133.72,71.45,0.0
64,20480,7168,256,ck,5,0,1043.3434,a8w8_blockscale_1x128x128_256x16x128x128_8x16_16x16_1x2_16x16x1_8x32x1_1x16x1x16_8_1x2_intrawave_v1,72.04,288.19,0.0
64,20480,7168,2304,ck,4,0,5075.6717,a8w8_blockscale_1x128x128_256x16x256x128_8x16_16x16_1x4_16x16x1_8x32x1_1x16x1x16_8_1x2_intrawave_v1,133.27,70.4,0.0
