aiter/configs/model_configs/a8w8_blockscale_tuned_gemm_qwen3_vl_32b_tp2.csv
gfx,cu_num,M,N,K,libtype,kernelId,splitK,us,kernelName,tflops,bw,errRatio
gfx942,304,16,5120,4096,ck,8,0,16.1284,a8w8_blockscale_1x128x128_256x16x64x256_16x16_16x16_1x1_16x16x1_16x16x1_1x16x1x16_4_1x1_intrawave_v1,41.61,1314.51,0.0
gfx942,304,16,5120,5120,ck,8,0,17.9804,a8w8_blockscale_1x128x128_256x16x64x256_16x16_16x16_1x1_16x16x1_16x16x1_1x16x1x16_4_1x1_intrawave_v1,46.65,1471.61,0.0
gfx942,304,16,5120,12800,ck,8,0,41.4968,a8w8_blockscale_1x128x128_256x16x64x256_16x16_16x16_1x1_16x16x1_16x16x1_1x16x1x16_4_1x1_intrawave_v1,50.54,1588.19,0.0
gfx942,304,32,5120,4096,ck,8,0,16.3091,a8w8_blockscale_1x128x128_256x16x64x256_16x16_16x16_1x1_16x16x1_16x16x1_1x16x1x16_4_1x1_intrawave_v1,82.3,1314.01,0.0
gfx942,304,32,5120,5120,ck,8,0,17.9569,a8w8_blockscale_1x128x128_256x16x64x256_16x16_16x16_1x1_16x16x1_16x16x1_1x16x1x16_4_1x1_intrawave_v1,93.43,1487.22,0.0
gfx942,304,32,5120,12800,ck,8,0,42.397,a8w8_blockscale_1x128x128_256x16x64x256_16x16_16x16_1x1_16x16x1_16x16x1_1x16x1x16_4_1x1_intrawave_v1,98.93,1563.16,0.0
gfx942,304,48,5120,4096,ck,8,0,16.3078,a8w8_blockscale_1x128x128_256x16x64x256_16x16_16x16_1x1_16x16x1_16x16x1_1x16x1x16_4_1x1_intrawave_v1,123.45,1328.18,0.0
gfx942,304,48,5120,5120,ck,8,0,17.7922,a8w8_blockscale_1x128x128_256x16x64x256_16x16_16x16_1x1_16x16x1_16x16x1_1x16x1x16_4_1x1_intrawave_v1,141.44,1514.8,0.0
gfx942,304,48,5120,12800,ck,8,0,44.7843,a8w8_blockscale_1x128x128_256x16x64x256_16x16_16x16_1x1_16x16x1_16x16x1_1x16x1x16_4_1x1_intrawave_v1,140.48,1488.06,0.0
gfx942,304,64,5120,4096,ck,18,0,19.9052,a8w8_blockscale_1x128x128_256x64x64x256_16x16_32x32_1x1_16x16x1_16x16x1_1x32x1x8_8_1x1_intrawave_v1,134.86,1099.66,0.0
gfx942,304,64,5120,5120,ck,18,0,22.758,a8w8_blockscale_1x128x128_256x64x64x256_16x16_32x32_1x1_16x16x1_16x16x1_1x32x1x8_8_1x1_intrawave_v1,147.44,1195.07,0.0
gfx942,304,64,5120,12800,ck,18,0,51.6148,a8w8_blockscale_1x128x128_256x64x64x256_16x16_32x32_1x1_16x16x1_16x16x1_1x32x1x8_8_1x1_intrawave_v1,162.52,1298.28,0.0
gfx942,304,80,5120,4096,ck,18,0,20.1139,a8w8_blockscale_1x128x128_256x64x64x256_16x16_32x32_1x1_16x16x1_16x16x1_1x32x1x8_8_1x1_intrawave_v1,166.82,1099.66,0.0
gfx942,304,80,5120,5120,ck,13,0,24.1204,a8w8_blockscale_1x128x128_256x32x64x256_16x16_16x16_2x1_16x16x1_16x16x1_1x32x1x8_8_2x1_intrawave_v1,173.89,1137.76,0.0
gfx942,304,80,5120,12800,ck,13,0,58.783,a8w8_blockscale_1x128x128_256x32x64x256_16x16_16x16_2x1_16x16x1_16x16x1_1x32x1x8_8_2x1_intrawave_v1,178.38,1146.24,0.0
gfx942,304,96,5120,4096,ck,18,0,21.1452,a8w8_blockscale_1x128x128_256x64x64x256_16x16_32x32_1x1_16x16x1_16x16x1_1x32x1x8_8_1x1_intrawave_v1,190.42,1056.87,0.0
gfx942,304,96,5120,5120,ck,13,0,23.7675,a8w8_blockscale_1x128x128_256x32x64x256_16x16_16x16_2x1_16x16x1_16x16x1_1x32x1x8_8_2x1_intrawave_v1,211.77,1164.99,0.0
gfx942,304,96,5120,12800,ck,13,0,56.9455,a8w8_blockscale_1x128x128_256x32x64x256_16x16_16x16_2x1_16x16x1_16x16x1_1x32x1x8_8_2x1_intrawave_v1,220.96,1189.7,0.0
gfx942,304,112,5120,4096,ck,18,0,21.8034,a8w8_blockscale_1x128x128_256x64x64x256_16x16_32x32_1x1_16x16x1_16x16x1_1x32x1x8_8_1x1_intrawave_v1,215.45,1035.49,0.0
gfx942,304,112,5120,5120,ck,18,0,25.7997,a8w8_blockscale_1x128x128_256x64x64x256_16x16_32x32_1x1_16x16x1_16x16x1_1x32x1x8_8_1x1_intrawave_v1,227.6,1082.75,0.0
gfx942,304,112,5120,12800,ck,18,0,62.6776,a8w8_blockscale_1x128x128_256x64x64x256_16x16_32x32_1x1_16x16x1_16x16x1_1x32x1x8_8_1x1_intrawave_v1,234.22,1086.78,0.0
gfx942,304,128,5120,4096,ck,18,0,20.8779,a8w8_blockscale_1x128x128_256x64x64x256_16x16_32x32_1x1_16x16x1_16x16x1_1x32x1x8_8_1x1_intrawave_v1,257.15,1092.38,0.0
gfx942,304,128,5120,5120,ck,18,0,23.9041,a8w8_blockscale_1x128x128_256x64x64x256_16x16_32x32_1x1_16x16x1_16x16x1_1x32x1x8_8_1x1_intrawave_v1,280.74,1178.9,0.0
gfx942,304,128,5120,12800,ck,18,0,56.9115,a8w8_blockscale_1x128x128_256x64x64x256_16x16_32x32_1x1_16x16x1_16x16x1_1x32x1x8_8_1x1_intrawave_v1,294.79,1203.36,0.0
gfx942,304,144,5120,4096,ck,18,0,24.4369,a8w8_blockscale_1x128x128_256x64x64x256_16x16_32x32_1x1_16x16x1_16x16x1_1x32x1x8_8_1x1_intrawave_v1,247.16,942.67,0.0
gfx942,304,144,5120,5120,ck,18,0,29.5464,a8w8_blockscale_1x128x128_256x64x64x256_16x16_32x32_1x1_16x16x1_16x16x1_1x32x1x8_8_1x1_intrawave_v1,255.52,962.09,0.0
gfx942,304,144,5120,12800,ck,18,0,73.802,a8w8_blockscale_1x128x128_256x64x64x256_16x16_32x32_1x1_16x16x1_16x16x1_1x32x1x8_8_1x1_intrawave_v1,255.74,932.95,0.0
gfx942,304,160,5120,4096,ck,18,0,24.6783,a8w8_blockscale_1x128x128_256x64x64x256_16x16_32x32_1x1_16x16x1_16x16x1_1x32x1x8_8_1x1_intrawave_v1,271.93,942.74,0.0
gfx942,304,160,5120,5120,ck,18,0,30.5878,a8w8_blockscale_1x128x128_256x64x64x256_16x16_32x32_1x1_16x16x1_16x16x1_1x32x1x8_8_1x1_intrawave_v1,274.25,937.37,0.0
gfx942,304,160,5120,12800,ck,18,0,72.3388,a8w8_blockscale_1x128x128_256x64x64x256_16x16_32x32_1x1_16x16x1_16x16x1_1x32x1x8_8_1x1_intrawave_v1,289.91,956.92,0.0
gfx942,304,176,5120,4096,ck,18,0,27.1473,a8w8_blockscale_1x128x128_256x64x64x256_16x16_32x32_1x1_16x16x1_16x16x1_1x32x1x8_8_1x1_intrawave_v1,271.92,865.45,0.0
gfx942,304,176,5120,5120,ck,18,0,31.114,a8w8_blockscale_1x128x128_256x64x64x256_16x16_32x32_1x1_16x16x1_16x16x1_1x32x1x8_8_1x1_intrawave_v1,296.57,929.41,0.0
gfx942,304,176,5120,12800,ck,18,0,73.608,a8w8_blockscale_1x128x128_256x64x64x256_16x16_32x32_1x1_16x16x1_16x16x1_1x32x1x8_8_1x1_intrawave_v1,313.4,945.43,0.0
gfx942,304,192,5120,4096,ck,18,0,25.0802,a8w8_blockscale_1x128x128_256x64x64x256_16x16_32x32_1x1_16x16x1_16x16x1_1x32x1x8_8_1x1_intrawave_v1,321.09,945.93,0.0
gfx942,304,192,5120,5120,ck,18,0,28.6203,a8w8_blockscale_1x128x128_256x64x64x256_16x16_32x32_1x1_16x16x1_16x16x1_1x32x1x8_8_1x1_intrawave_v1,351.72,1018.98,0.0
gfx942,304,192,5120,12800,ck,18,0,68.429,a8w8_blockscale_1x128x128_256x64x64x256_16x16_32x32_1x1_16x16x1_16x16x1_1x32x1x8_8_1x1_intrawave_v1,367.77,1022.37,0.0
gfx942,304,208,5120,4096,ck,3,0,31.4637,a8w8_blockscale_1x128x128_256x64x64x128_16x16_32x32_1x1_8x32x1_8x32x1_1x32x1x8_8_1x1_intrawave_v3,277.28,761.3,0.0
gfx942,304,208,5120,5120,ck,12,0,37.9385,a8w8_blockscale_1x128x128_256x32x128x256_16x16_32x32_1x1_16x16x1_16x16x1_1x32x1x8_8_1x1_intrawave_v1,287.44,775.18,0.0
gfx942,304,208,5120,12800,ck,3,0,87.4297,a8w8_blockscale_1x128x128_256x64x64x128_16x16_32x32_1x1_8x32x1_8x32x1_1x32x1x8_8_1x1_intrawave_v3,311.83,804.4,0.0
gfx942,304,224,5120,4096,ck,12,0,30.7306,a8w8_blockscale_1x128x128_256x32x128x256_16x16_32x32_1x1_16x16x1_16x16x1_1x32x1x8_8_1x1_intrawave_v1,305.73,786.93,0.0
gfx942,304,224,5120,5120,ck,12,0,36.129,a8w8_blockscale_1x128x128_256x32x128x256_16x16_32x32_1x1_16x16x1_16x16x1_1x32x1x8_8_1x1_intrawave_v1,325.06,820.81,0.0
gfx942,304,224,5120,12800,ck,12,0,83.142,a8w8_blockscale_1x128x128_256x32x128x256_16x16_32x32_1x1_16x16x1_16x16x1_1x32x1x8_8_1x1_intrawave_v1,353.13,850.32,0.0
gfx942,304,240,5120,4096,ck,3,0,33.5328,a8w8_blockscale_1x128x128_256x64x64x128_16x16_32x32_1x1_8x32x1_8x32x1_1x32x1x8_8_1x1_intrawave_v3,300.19,728.01,0.0
gfx942,304,240,5120,5120,ck,3,0,41.3509,a8w8_blockscale_1x128x128_256x64x64x128_16x16_32x32_1x1_8x32x1_8x32x1_1x32x1x8_8_1x1_intrawave_v3,304.3,723.1,0.0
gfx942,304,240,5120,12800,ck,3,0,91.069,a8w8_blockscale_1x128x128_256x64x64x128_16x16_32x32_1x1_8x32x1_8x32x1_1x32x1x8_8_1x1_intrawave_v3,345.42,780.35,0.0
gfx942,304,256,5120,4096,ck,3,0,34.0768,a8w8_blockscale_1x128x128_256x64x64x128_16x16_32x32_1x1_8x32x1_8x32x1_1x32x1x8_8_1x1_intrawave_v3,315.09,723.12,0.0
gfx942,304,256,5120,5120,ck,3,0,39.1824,a8w8_blockscale_1x128x128_256x64x64x128_16x16_32x32_1x1_8x32x1_8x32x1_1x32x1x8_8_1x1_intrawave_v3,342.55,769.39,0.0
gfx942,304,256,5120,12800,ck,3,0,92.1538,a8w8_blockscale_1x128x128_256x64x64x128_16x16_32x32_1x1_8x32x1_8x32x1_1x32x1x8_8_1x1_intrawave_v3,364.11,775.16,0.0
gfx942,304,288,5120,4096,ck,2,0,36.0845,a8w8_blockscale_1x128x128_256x64x128x128_16x16_32x32_1x2_8x32x1_8x32x1_1x32x1x8_8_1x1_intrawave_v3,334.76,695.6,0.0
gfx942,304,288,5120,5120,ck,2,0,46.3518,a8w8_blockscale_1x128x128_256x64x128x128_16x16_32x32_1x2_8x32x1_8x32x1_1x32x1x8_8_1x1_intrawave_v3,325.76,660.99,0.0
gfx942,304,288,5120,12800,ck,2,0,102.1562,a8w8_blockscale_1x128x128_256x64x128x128_16x16_32x32_1x2_8x32x1_8x32x1_1x32x1x8_8_1x1_intrawave_v3,369.52,706.48,0.0
gfx942,304,320,5120,4096,ck,2,0,41.2394,a8w8_blockscale_1x128x128_256x64x128x128_16x16_32x32_1x2_8x32x1_8x32x1_1x32x1x8_8_1x1_intrawave_v3,325.46,619.77,0.0
gfx942,304,320,5120,5120,ck,2,0,50.3794,a8w8_blockscale_1x128x128_256x64x128x128_16x16_32x32_1x2_8x32x1_8x32x1_1x32x1x8_8_1x1_intrawave_v3,333.02,617.9,0.0
gfx942,304,320,5120,12800,ck,3,0,106.8839,a8w8_blockscale_1x128x128_256x64x64x128_16x16_32x32_1x1_8x32x1_8x32x1_1x32x1x8_8_1x1_intrawave_v3,392.42,682.13,0.0
gfx942,304,352,5120,4096,ck,2,0,39.1913,a8w8_blockscale_1x128x128_256x64x128x128_16x16_32x32_1x2_8x32x1_8x32x1_1x32x1x8_8_1x1_intrawave_v3,376.71,663.87,0.0
gfx942,304,352,5120,5120,ck,2,0,48.0252,a8w8_blockscale_1x128x128_256x64x128x128_16x16_32x32_1x2_8x32x1_8x32x1_1x32x1x8_8_1x1_intrawave_v3,384.28,658.43,0.0
gfx942,304,352,5120,12800,ck,3,0,106.762,a8w8_blockscale_1x128x128_256x64x64x128_16x16_32x32_1x1_8x32x1_8x32x1_1x32x1x8_8_1x1_intrawave_v3,432.15,689.82,0.0
gfx942,304,384,5120,4096,ck,2,0,42.5492,a8w8_blockscale_1x128x128_256x64x128x128_16x16_32x32_1x2_8x32x1_8x32x1_1x32x1x8_8_1x1_intrawave_v3,378.53,622.26,0.0
gfx942,304,384,5120,5120,ck,2,0,51.8645,a8w8_blockscale_1x128x128_256x64x128x128_16x16_32x32_1x2_8x32x1_8x32x1_1x32x1x8_8_1x1_intrawave_v3,388.18,619.16,0.0
gfx942,304,384,5120,12800,ck,3,0,118.2801,a8w8_blockscale_1x128x128_256x64x64x128_16x16_32x32_1x1_8x32x1_8x32x1_1x32x1x8_8_1x1_intrawave_v3,425.53,628.87,0.0
gfx942,304,416,5120,4096,ck,2,0,41.1937,a8w8_blockscale_1x128x128_256x64x128x128_16x16_32x32_1x2_8x32x1_8x32x1_1x32x1x8_8_1x1_intrawave_v3,423.57,653.87,0.0
gfx942,304,416,5120,5120,ck,2,0,50.8475,a8w8_blockscale_1x128x128_256x64x128x128_16x16_32x32_1x2_8x32x1_8x32x1_1x32x1x8_8_1x1_intrawave_v3,428.94,641.21,0.0
gfx942,304,416,5120,12800,ck,2,0,113.0081,a8w8_blockscale_1x128x128_256x64x128x128_16x16_32x32_1x2_8x32x1_8x32x1_1x32x1x8_8_1x1_intrawave_v3,482.5,664.74,0.0
gfx942,304,448,5120,4096,ck,2,0,44.4326,a8w8_blockscale_1x128x128_256x64x128x128_16x16_32x32_1x2_8x32x1_8x32x1_1x32x1x8_8_1x1_intrawave_v3,422.9,616.53,0.0
gfx942,304,448,5120,5120,ck,2,0,52.5877,a8w8_blockscale_1x128x128_256x64x128x128_16x16_32x32_1x2_8x32x1_8x32x1_1x32x1x8_8_1x1_intrawave_v3,446.65,629.34,0.0
gfx942,304,448,5120,12800,ck,3,0,112.0912,a8w8_blockscale_1x128x128_256x64x64x128_16x16_32x32_1x1_8x32x1_8x32x1_1x32x1x8_8_1x1_intrawave_v3,523.86,676.75,0.0
gfx942,304,480,5120,4096,ck,0,0,53.6795,a8w8_blockscale_1x128x128_256x128x128x128_16x16_32x32_2x2_8x32x1_8x32x1_1x32x1x8_8_1x1_intrawave_v3,375.05,518.87,0.0
gfx942,304,480,5120,5120,ck,0,0,64.0443,a8w8_blockscale_1x128x128_256x128x128x128_16x16_32x32_2x2_8x32x1_8x32x1_1x32x1x8_8_1x1_intrawave_v3,392.94,524.44,0.0
gfx942,304,480,5120,12800,ck,0,0,146.3459,a8w8_blockscale_1x128x128_256x128x128x128_16x16_32x32_2x2_8x32x1_8x32x1_1x32x1x8_8_1x1_intrawave_v3,429.9,523.38,0.0
gfx942,304,512,5120,4096,ck,2,0,57.1824,a8w8_blockscale_1x128x128_256x64x128x128_16x16_32x32_1x2_8x32x1_8x32x1_1x32x1x8_8_1x1_intrawave_v3,375.55,495.11,0.0
gfx942,304,512,5120,5120,ck,2,0,67.9422,a8w8_blockscale_1x128x128_256x64x128x128_16x16_32x32_1x2_8x32x1_8x32x1_1x32x1x8_8_1x1_intrawave_v3,395.09,501.58,0.0
gfx942,304,512,5120,12800,ck,2,0,156.9503,a8w8_blockscale_1x128x128_256x64x128x128_16x16_32x32_1x2_8x32x1_8x32x1_1x32x1x8_8_1x1_intrawave_v3,427.58,492.72,0.0
gfx942,304,544,5120,4096,ck,0,0,53.8445,a8w8_blockscale_1x128x128_256x128x128x128_16x16_32x32_2x2_8x32x1_8x32x1_1x32x1x8_8_1x1_intrawave_v3,423.76,534.32,0.0
gfx942,304,544,5120,5120,ck,0,0,66.2353,a8w8_blockscale_1x128x128_256x128x128x128_16x16_32x32_2x2_8x32x1_8x32x1_1x32x1x8_8_1x1_intrawave_v3,430.61,521.93,0.0
gfx942,304,544,5120,12800,ck,0,0,150.6249,a8w8_blockscale_1x128x128_256x128x128x128_16x16_32x32_2x2_8x32x1_8x32x1_1x32x1x8_8_1x1_intrawave_v3,473.38,518.31,0.0
gfx942,304,576,5120,4096,ck,0,0,54.7303,a8w8_blockscale_1x128x128_256x128x128x128_16x16_32x32_2x2_8x32x1_8x32x1_1x32x1x8_8_1x1_intrawave_v3,441.42,534.06,0.0
gfx942,304,576,5120,5120,ck,0,0,64.3156,a8w8_blockscale_1x128x128_256x128x128x128_16x16_32x32_2x2_8x32x1_8x32x1_1x32x1x8_8_1x1_intrawave_v3,469.54,545.15,0.0
gfx942,304,576,5120,12800,ck,0,0,150.8042,a8w8_blockscale_1x128x128_256x128x128x128_16x16_32x32_2x2_8x32x1_8x32x1_1x32x1x8_8_1x1_intrawave_v3,500.63,522.58,0.0
gfx942,304,608,5120,4096,ck,0,0,57.2763,a8w8_blockscale_1x128x128_256x128x128x128_16x16_32x32_2x2_8x32x1_8x32x1_1x32x1x8_8_1x1_intrawave_v3,445.23,518.33,0.0
gfx942,304,608,5120,5120,ck,0,0,68.2186,a8w8_blockscale_1x128x128_256x128x128x128_16x16_32x32_2x2_8x32x1_8x32x1_1x32x1x8_8_1x1_intrawave_v3,467.27,521.17,0.0
gfx942,304,608,5120,12800,ck,0,0,157.1183,a8w8_blockscale_1x128x128_256x128x128x128_16x16_32x32_2x2_8x32x1_8x32x1_1x32x1x8_8_1x1_intrawave_v3,507.21,506.27,0.0
gfx942,304,640,5120,4096,ck,0,0,60.8262,a8w8_blockscale_1x128x128_256x128x128x128_16x16_32x32_2x2_8x32x1_8x32x1_1x32x1x8_8_1x1_intrawave_v3,441.32,495.62,0.0
gfx942,304,640,5120,5120,ck,3,0,74.7301,a8w8_blockscale_1x128x128_256x64x64x128_16x16_32x32_1x1_8x32x1_8x32x1_1x32x1x8_8_1x1_intrawave_v3,449.01,482.33,0.0
gfx942,304,640,5120,12800,ck,3,0,166.6986,a8w8_blockscale_1x128x128_256x64x64x128_16x16_32x32_1x1_8x32x1_8x32x1_1x32x1x8_8_1x1_intrawave_v3,503.22,481.6,0.0
gfx942,304,672,5120,4096,ck,0,0,57.7587,a8w8_blockscale_1x128x128_256x128x128x128_16x16_32x32_2x2_8x32x1_8x32x1_1x32x1x8_8_1x1_intrawave_v3,487.99,529.88,0.0
gfx942,304,672,5120,5120,ck,0,0,67.3057,a8w8_blockscale_1x128x128_256x128x128x128_16x16_32x32_2x2_8x32x1_8x32x1_1x32x1x8_8_1x1_intrawave_v3,523.46,542.84,0.0
gfx942,304,672,5120,12800,ck,0,0,156.3284,a8w8_blockscale_1x128x128_256x128x128x128_16x16_32x32_2x2_8x32x1_8x32x1_1x32x1x8_8_1x1_intrawave_v3,563.43,518.26,0.0
gfx942,304,704,5120,4096,ck,0,0,57.8296,a8w8_blockscale_1x128x128_256x128x128x128_16x16_32x32_2x2_8x32x1_8x32x1_1x32x1x8_8_1x1_intrawave_v3,510.6,537.17,0.0
gfx942,304,704,5120,5120,ck,0,0,67.0573,a8w8_blockscale_1x128x128_256x128x128x128_16x16_32x32_2x2_8x32x1_8x32x1_1x32x1x8_8_1x1_intrawave_v3,550.42,552.18,0.0
gfx942,304,704,5120,12800,ck,0,0,157.9351,a8w8_blockscale_1x128x128_256x128x128x128_16x16_32x32_2x2_8x32x1_8x32x1_1x32x1x8_8_1x1_intrawave_v3,584.26,517.66,0.0
gfx942,304,736,5120,4096,ck,0,0,58.4814,a8w8_blockscale_1x128x128_256x128x128x128_16x16_32x32_2x2_8x32x1_8x32x1_1x32x1x8_8_1x1_intrawave_v3,527.86,539.02,0.0
gfx942,304,736,5120,5120,ck,0,0,69.4366,a8w8_blockscale_1x128x128_256x128x128x128_16x16_32x32_2x2_8x32x1_8x32x1_1x32x1x8_8_1x1_intrawave_v3,555.72,540.34,0.0
gfx942,304,736,5120,12800,ck,0,0,162.1361,a8w8_blockscale_1x128x128_256x128x128x128_16x16_32x32_2x2_8x32x1_8x32x1_1x32x1x8_8_1x1_intrawave_v3,594.99,508.79,0.0
gfx942,304,768,5120,4096,ck,2,0,62.8503,a8w8_blockscale_1x128x128_256x64x128x128_16x16_32x32_1x2_8x32x1_8x32x1_1x32x1x8_8_1x1_intrawave_v3,512.52,508.85,0.0
gfx942,304,768,5120,5120,ck,2,0,74.6072,a8w8_blockscale_1x128x128_256x64x128x128_16x16_32x32_1x2_8x32x1_8x32x1_1x32x1x8_8_1x1_intrawave_v3,539.7,509.48,0.0
gfx942,304,768,5120,12800,ck,2,0,176.413,a8w8_blockscale_1x128x128_256x64x128x128_16x16_32x32_1x2_8x32x1_8x32x1_1x32x1x8_8_1x1_intrawave_v3,570.61,471.79,0.0
gfx942,304,800,5120,4096,ck,0,0,59.4239,a8w8_blockscale_1x128x128_256x128x128x128_16x16_32x32_2x2_8x32x1_8x32x1_1x32x1x8_8_1x1_intrawave_v3,564.66,545.91,0.0
gfx942,304,800,5120,5120,ck,0,0,70.7402,a8w8_blockscale_1x128x128_256x128x128x128_16x16_32x32_2x2_8x32x1_8x32x1_1x32x1x8_8_1x1_intrawave_v3,592.92,544.28,0.0
gfx942,304,800,5120,12800,ck,0,0,162.5428,a8w8_blockscale_1x128x128_256x128x128x128_16x16_32x32_2x2_8x32x1_8x32x1_1x32x1x8_8_1x1_intrawave_v3,645.11,516.59,0.0
gfx942,304,832,5120,4096,ck,0,0,62.4996,a8w8_blockscale_1x128x128_256x128x128x128_16x16_32x32_2x2_8x32x1_8x32x1_1x32x1x8_8_1x1_intrawave_v3,558.35,526.39,0.0
gfx942,304,832,5120,5120,ck,0,0,69.6371,a8w8_blockscale_1x128x128_256x128x128x128_16x16_32x32_2x2_8x32x1_8x32x1_1x32x1x8_8_1x1_intrawave_v3,626.4,559.96,0.0
gfx942,304,832,5120,12800,ck,0,0,166.4724,a8w8_blockscale_1x128x128_256x128x128x128_16x16_32x32_2x2_8x32x1_8x32x1_1x32x1x8_8_1x1_intrawave_v3,655.07,508.82,0.0
gfx942,304,864,5120,4096,ck,0,0,61.516,a8w8_blockscale_1x128x128_256x128x128x128_16x16_32x32_2x2_8x32x1_8x32x1_1x32x1x8_8_1x1_intrawave_v3,589.1,542.26,0.0
gfx942,304,864,5120,5120,ck,0,0,75.9222,a8w8_blockscale_1x128x128_256x128x128x128_16x16_32x32_2x2_8x32x1_8x32x1_1x32x1x8_8_1x1_intrawave_v3,596.64,520.08,0.0
gfx942,304,864,5120,12800,ck,0,0,170.9169,a8w8_blockscale_1x128x128_256x128x128x128_16x16_32x32_2x2_8x32x1_8x32x1_1x32x1x8_8_1x1_intrawave_v3,662.58,499.91,0.0
gfx942,304,896,5120,4096,ck,0,0,67.3137,a8w8_blockscale_1x128x128_256x128x128x128_16x16_32x32_2x2_8x32x1_8x32x1_1x32x1x8_8_1x1_intrawave_v3,558.3,502.37,0.0
gfx942,304,896,5120,5120,ck,0,0,82.8329,a8w8_blockscale_1x128x128_256x128x128x128_16x16_32x32_2x2_8x32x1_8x32x1_1x32x1x8_8_1x1_intrawave_v3,567.12,482.62,0.0
gfx942,304,896,5120,12800,ck,0,0,181.4335,a8w8_blockscale_1x128x128_256x128x128x128_16x16_32x32_2x2_8x32x1_8x32x1_1x32x1x8_8_1x1_intrawave_v3,647.29,474.99,0.0
gfx942,304,928,5120,4096,ck,2,0,75.3906,a8w8_blockscale_1x128x128_256x64x128x128_16x16_32x32_1x2_8x32x1_8x32x1_1x32x1x8_8_1x1_intrawave_v3,516.29,454.64,0.0
gfx942,304,928,5120,5120,ck,2,0,88.5659,a8w8_blockscale_1x128x128_256x64x128x128_16x16_32x32_1x2_8x32x1_8x32x1_1x32x1x8_8_1x1_intrawave_v3,549.35,456.93,0.0
gfx942,304,928,5120,12800,ck,14,0,207.9815,a8w8_blockscale_1x128x128_256x64x256x128_16x16_32x32_2x2_8x32x1_8x32x1_1x32x1x8_8_1x1_intrawave_v1,584.83,417.91,0.0
gfx942,304,960,5120,4096,ck,2,0,75.036,a8w8_blockscale_1x128x128_256x64x128x128_16x16_32x32_1x2_8x32x1_8x32x1_1x32x1x8_8_1x1_intrawave_v3,536.61,462.9,0.0
gfx942,304,960,5120,5120,ck,2,0,88.7601,a8w8_blockscale_1x128x128_256x64x128x128_16x16_32x32_1x2_8x32x1_8x32x1_1x32x1x8_8_1x1_intrawave_v3,567.05,461.47,0.0
gfx942,304,960,5120,12800,ck,2,0,208.4212,a8w8_blockscale_1x128x128_256x64x128x128_16x16_32x32_1x2_8x32x1_8x32x1_1x32x1x8_8_1x1_intrawave_v3,603.73,420.56,0.0
gfx942,304,992,5120,4096,ck,0,0,81.5944,a8w8_blockscale_1x128x128_256x128x128x128_16x16_32x32_2x2_8x32x1_8x32x1_1x32x1x8_8_1x1_intrawave_v3,509.93,431.31,0.0
gfx942,304,992,5120,5120,ck,0,0,96.9486,a8w8_blockscale_1x128x128_256x128x128x128_16x16_32x32_2x2_8x32x1_8x32x1_1x32x1x8_8_1x1_intrawave_v3,536.46,427.56,0.0
gfx942,304,992,5120,12800,ck,0,0,215.0465,a8w8_blockscale_1x128x128_256x128x128x128_16x16_32x32_2x2_8x32x1_8x32x1_1x32x1x8_8_1x1_intrawave_v3,604.63,411.04,0.0
gfx942,304,1024,5120,4096,ck,0,0,82.8514,a8w8_blockscale_1x128x128_256x128x128x128_16x16_32x32_2x2_8x32x1_8x32x1_1x32x1x8_8_1x1_intrawave_v3,518.39,430.31,0.0
gfx942,304,1024,5120,5120,ck,0,0,102.5938,a8w8_blockscale_1x128x128_256x128x128x128_16x16_32x32_2x2_8x32x1_8x32x1_1x32x1x8_8_1x1_intrawave_v3,523.3,408.83,0.0
gfx942,304,1024,5120,12800,ck,0,0,235.4814,a8w8_blockscale_1x128x128_256x128x128x128_16x16_32x32_2x2_8x32x1_8x32x1_1x32x1x8_8_1x1_intrawave_v3,569.97,378.5,0.0
gfx942,304,1088,5120,4096,ck,0,0,87.8414,a8w8_blockscale_1x128x128_256x128x128x128_16x16_32x32_2x2_8x32x1_8x32x1_1x32x1x8_8_1x1_intrawave_v3,519.5,416.31,0.0
gfx942,304,1088,5120,5120,ck,0,0,103.2238,a8w8_blockscale_1x128x128_256x128x128x128_16x16_32x32_2x2_8x32x1_8x32x1_1x32x1x8_8_1x1_intrawave_v3,552.61,415.85,0.0
gfx942,304,1088,5120,12800,ck,0,0,236.8807,a8w8_blockscale_1x128x128_256x128x128x128_16x16_32x32_2x2_8x32x1_8x32x1_1x32x1x8_8_1x1_intrawave_v3,602.02,382.49,0.0
gfx942,304,1152,5120,4096,ck,0,0,89.0549,a8w8_blockscale_1x128x128_256x128x128x128_16x16_32x32_2x2_8x32x1_8x32x1_1x32x1x8_8_1x1_intrawave_v3,542.57,420.94,0.0
gfx942,304,1152,5120,5120,ck,0,0,114.8231,a8w8_blockscale_1x128x128_256x128x128x128_16x16_32x32_2x2_8x32x1_8x32x1_1x32x1x8_8_1x1_intrawave_v3,526.01,382.41,0.0
gfx942,304,1152,5120,12800,ck,0,0,254.7419,a8w8_blockscale_1x128x128_256x128x128x128_16x16_32x32_2x2_8x32x1_8x32x1_1x32x1x8_8_1x1_intrawave_v3,592.74,361.46,0.0
gfx942,304,1216,5120,4096,ck,0,0,91.764,a8w8_blockscale_1x128x128_256x128x128x128_16x16_32x32_2x2_8x32x1_8x32x1_1x32x1x8_8_1x1_intrawave_v3,555.8,418.51,0.0
gfx942,304,1216,5120,5120,ck,0,0,111.2288,a8w8_blockscale_1x128x128_256x128x128x128_16x16_32x32_2x2_8x32x1_8x32x1_1x32x1x8_8_1x1_intrawave_v3,573.17,403.6,0.0
gfx942,304,1216,5120,12800,ck,0,0,251.1877,a8w8_blockscale_1x128x128_256x128x128x128_16x16_32x32_2x2_8x32x1_8x32x1_1x32x1x8_8_1x1_intrawave_v3,634.52,372.44,0.0
gfx942,304,1280,5120,4096,ck,0,0,92.3488,a8w8_blockscale_1x128x128_256x128x128x128_16x16_32x32_2x2_8x32x1_8x32x1_1x32x1x8_8_1x1_intrawave_v3,581.35,425.79,0.0
gfx942,304,1280,5120,5120,ck,0,0,113.884,a8w8_blockscale_1x128x128_256x128x128x128_16x16_32x32_2x2_8x32x1_8x32x1_1x32x1x8_8_1x1_intrawave_v3,589.27,402.82,0.0
gfx942,304,1280,5120,12800,ck,0,0,257.3519,a8w8_blockscale_1x128x128_256x128x128x128_16x16_32x32_2x2_8x32x1_8x32x1_1x32x1x8_8_1x1_intrawave_v3,651.92,369.25,0.0
gfx942,304,1344,5120,4096,ck,0,0,92.4417,a8w8_blockscale_1x128x128_256x128x128x128_16x16_32x32_2x2_8x32x1_8x32x1_1x32x1x8_8_1x1_intrawave_v3,609.81,435.29,0.0
gfx942,304,1344,5120,5120,ck,0,0,110.6424,a8w8_blockscale_1x128x128_256x128x128x128_16x16_32x32_2x2_8x32x1_8x32x1_1x32x1x8_8_1x1_intrawave_v3,636.87,423.51,0.0
gfx942,304,1344,5120,12800,ck,0,0,262.5428,a8w8_blockscale_1x128x128_256x128x128x128_16x16_32x32_2x2_8x32x1_8x32x1_1x32x1x8_8_1x1_intrawave_v3,670.98,367.57,0.0
gfx942,304,1408,5120,4096,ck,0,0,96.1928,a8w8_blockscale_1x128x128_256x128x128x128_16x16_32x32_2x2_8x32x1_8x32x1_1x32x1x8_8_1x1_intrawave_v3,613.93,427.86,0.0
gfx942,304,1408,5120,5120,ck,0,0,113.8447,a8w8_blockscale_1x128x128_256x128x128x128_16x16_32x32_2x2_8x32x1_8x32x1_1x32x1x8_8_1x1_intrawave_v3,648.43,420.23,0.0
gfx942,304,1408,5120,12800,ck,0,0,267.5107,a8w8_blockscale_1x128x128_256x128x128x128_16x16_32x32_2x2_8x32x1_8x32x1_1x32x1x8_8_1x1_intrawave_v3,689.88,366.25,0.0
gfx942,304,1472,5120,4096,ck,0,0,93.3535,a8w8_blockscale_1x128x128_256x128x128x128_16x16_32x32_2x2_8x32x1_8x32x1_1x32x1x8_8_1x1_intrawave_v3,661.36,450.7,0.0
gfx942,304,1472,5120,5120,ck,0,0,112.6123,a8w8_blockscale_1x128x128_256x128x128x128_16x16_32x32_2x2_8x32x1_8x32x1_1x32x1x8_8_1x1_intrawave_v3,685.32,433.56,0.0
gfx942,304,1472,5120,12800,ck,0,0,261.8559,a8w8_blockscale_1x128x128_256x128x128x128_16x16_32x32_2x2_8x32x1_8x32x1_1x32x1x8_8_1x1_intrawave_v3,736.81,379.79,0.0
gfx942,304,1536,5120,4096,ck,0,0,94.1702,a8w8_blockscale_1x128x128_256x128x128x128_16x16_32x32_2x2_8x32x1_8x32x1_1x32x1x8_8_1x1_intrawave_v3,684.13,456.53,0.0
gfx942,304,1536,5120,5120,ck,0,0,114.2162,a8w8_blockscale_1x128x128_256x128x128x128_16x16_32x32_2x2_8x32x1_8x32x1_1x32x1x8_8_1x1_intrawave_v3,705.07,436.08,0.0
gfx942,304,1536,5120,12800,ck,0,0,275.3023,a8w8_blockscale_1x128x128_256x128x128x128_16x16_32x32_2x2_8x32x1_8x32x1_1x32x1x8_8_1x1_intrawave_v3,731.29,366.6,0.0
gfx942,304,1600,5120,4096,ck,0,0,99.6904,a8w8_blockscale_1x128x128_256x128x128x128_16x16_32x32_2x2_8x32x1_8x32x1_1x32x1x8_8_1x1_intrawave_v3,673.17,440.45,0.0
gfx942,304,1600,5120,5120,ck,0,0,121.4913,a8w8_blockscale_1x128x128_256x128x128x128_16x16_32x32_2x2_8x32x1_8x32x1_1x32x1x8_8_1x1_intrawave_v3,690.47,418.06,0.0
gfx942,304,1600,5120,12800,ck,0,0,278.0019,a8w8_blockscale_1x128x128_256x128x128x128_16x16_32x32_2x2_8x32x1_8x32x1_1x32x1x8_8_1x1_intrawave_v3,754.37,368.34,0.0
gfx942,304,1664,5120,4096,ck,0,0,97.4651,a8w8_blockscale_1x128x128_256x128x128x128_16x16_32x32_2x2_8x32x1_8x32x1_1x32x1x8_8_1x1_intrawave_v3,716.08,459.92,0.0
gfx942,304,1664,5120,5120,ck,0,0,124.1679,a8w8_blockscale_1x128x128_256x128x128x128_16x16_32x32_2x2_8x32x1_8x32x1_1x32x1x8_8_1x1_intrawave_v3,702.61,416.96,0.0
gfx942,304,1664,5120,12800,ck,0,0,286.8438,a8w8_blockscale_1x128x128_256x128x128x128_16x16_32x32_2x2_8x32x1_8x32x1_1x32x1x8_8_1x1_intrawave_v3,760.36,362.13,0.0
gfx942,304,1728,5120,4096,ck,0,0,102.3379,a8w8_blockscale_1x128x128_256x128x128x128_16x16_32x32_2x2_8x32x1_8x32x1_1x32x1x8_8_1x1_intrawave_v3,708.22,446.99,0.0
gfx942,304,1728,5120,5120,ck,0,0,125.5045,a8w8_blockscale_1x128x128_256x128x128x128_16x16_32x32_2x2_8x32x1_8x32x1_1x32x1x8_8_1x1_intrawave_v3,721.86,420.36,0.0
gfx942,304,1728,5120,12800,ck,0,0,285.3792,a8w8_blockscale_1x128x128_256x128x128x128_16x16_32x32_2x2_8x32x1_8x32x1_1x32x1x8_8_1x1_intrawave_v3,793.65,369.15,0.0
gfx942,304,1792,5120,4096,ck,0,0,106.4362,a8w8_blockscale_1x128x128_256x128x128x128_16x16_32x32_2x2_8x32x1_8x32x1_1x32x1x8_8_1x1_intrawave_v3,706.17,438.4,0.0
gfx942,304,1792,5120,5120,ck,0,0,124.0619,a8w8_blockscale_1x128x128_256x128x128x128_16x16_32x32_2x2_8x32x1_8x32x1_1x32x1x8_8_1x1_intrawave_v3,757.3,433.17,0.0
gfx942,304,1792,5120,12800,ck,0,0,296.2237,a8w8_blockscale_1x128x128_256x128x128x128_16x16_32x32_2x2_8x32x1_8x32x1_1x32x1x8_8_1x1_intrawave_v3,792.92,360.62,0.0
gfx942,304,1856,5120,4096,ck,0,0,111.0866,a8w8_blockscale_1x128x128_256x128x128x128_16x16_32x32_2x2_8x32x1_8x32x1_1x32x1x8_8_1x1_intrawave_v3,700.77,428.31,0.0
gfx942,304,1856,5120,5120,ck,0,0,134.2028,a8w8_blockscale_1x128x128_256x128x128x128_16x16_32x32_2x2_8x32x1_8x32x1_1x32x1x8_8_1x1_intrawave_v3,725.08,407.76,0.0
gfx942,304,1856,5120,12800,ck,0,0,303.6412,a8w8_blockscale_1x128x128_256x128x128x128_16x16_32x32_2x2_8x32x1_8x32x1_1x32x1x8_8_1x1_intrawave_v3,801.17,356.67,0.0
gfx942,304,1920,5120,4096,ck,0,0,105.1082,a8w8_blockscale_1x128x128_256x128x128x128_16x16_32x32_2x2_8x32x1_8x32x1_1x32x1x8_8_1x1_intrawave_v3,766.17,461.4,0.0
gfx942,304,1920,5120,5120,ck,0,0,134.8574,a8w8_blockscale_1x128x128_256x128x128x128_16x16_32x32_2x2_8x32x1_8x32x1_1x32x1x8_8_1x1_intrawave_v3,746.44,413.07,0.0
gfx942,304,1920,5120,12800,ck,0,0,323.8336,a8w8_blockscale_1x128x128_256x128x128x128_16x16_32x32_2x2_8x32x1_8x32x1_1x32x1x8_8_1x1_intrawave_v3,777.12,338.98,0.0
gfx942,304,1984,5120,4096,ck,0,0,137.4182,a8w8_blockscale_1x128x128_256x128x128x128_16x16_32x32_2x2_8x32x1_8x32x1_1x32x1x8_8_1x1_intrawave_v3,605.56,359.59,0.0
gfx942,304,1984,5120,5120,ck,0,0,174.611,a8w8_blockscale_1x128x128_256x128x128x128_16x16_32x32_2x2_8x32x1_8x32x1_1x32x1x8_8_1x1_intrawave_v3,595.72,324.66,0.0
gfx942,304,1984,5120,12800,ck,0,0,422.5468,a8w8_blockscale_1x128x128_256x128x128x128_16x16_32x32_2x2_8x32x1_8x32x1_1x32x1x8_8_1x1_intrawave_v3,615.43,263.28,0.0
gfx942,304,2048,5120,4096,ck,0,0,148.7347,a8w8_blockscale_1x128x128_256x128x128x128_16x16_32x32_2x2_8x32x1_8x32x1_1x32x1x8_8_1x1_intrawave_v3,577.53,338.4,0.0
gfx942,304,2048,5120,5120,ck,0,0,180.5483,a8w8_blockscale_1x128x128_256x128x128x128_16x16_32x32_2x2_8x32x1_8x32x1_1x32x1x8_8_1x1_intrawave_v3,594.71,319.43,0.0
gfx942,304,2048,5120,12800,ck,0,0,451.191,a8w8_blockscale_1x128x128_256x128x128x128_16x16_32x32_2x2_8x32x1_8x32x1_1x32x1x8_8_1x1_intrawave_v3,594.95,249.83,0.0
gfx942,304,2112,5120,4096,ck,0,0,139.6678,a8w8_blockscale_1x128x128_256x128x128x128_16x16_32x32_2x2_8x32x1_8x32x1_1x32x1x8_8_1x1_intrawave_v3,634.25,366.94,0.0
gfx942,304,2112,5120,5120,ck,0,0,178.2493,a8w8_blockscale_1x128x128_256x128x128x128_16x16_32x32_2x2_8x32x1_8x32x1_1x32x1x8_8_1x1_intrawave_v3,621.21,329.06,0.0
gfx942,304,2112,5120,12800,ck,0,0,386.285,a8w8_blockscale_1x128x128_256x128x128x128_16x16_32x32_2x2_8x32x1_8x32x1_1x32x1x8_8_1x1_intrawave_v3,716.63,295.63,0.0
gfx942,304,2176,5120,4096,ck,0,0,143.9945,a8w8_blockscale_1x128x128_256x128x128x128_16x16_32x32_2x2_8x32x1_8x32x1_1x32x1x8_8_1x1_intrawave_v3,633.83,362.28,0.0
gfx942,304,2176,5120,5120,ck,0,0,180.9014,a8w8_blockscale_1x128x128_256x128x128x128_16x16_32x32_2x2_8x32x1_8x32x1_1x32x1x8_8_1x1_intrawave_v3,630.65,329.67,0.0
gfx942,304,2176,5120,12800,ck,0,0,401.7447,a8w8_blockscale_1x128x128_256x128x128x128_16x16_32x32_2x2_8x32x1_8x32x1_1x32x1x8_8_1x1_intrawave_v3,709.94,287.92,0.0
gfx942,304,2240,5120,4096,ck,0,0,141.2271,a8w8_blockscale_1x128x128_256x128x128x128_16x16_32x32_2x2_8x32x1_8x32x1_1x32x1x8_8_1x1_intrawave_v3,665.26,375.88,0.0
gfx942,304,2240,5120,5120,ck,0,0,174.7748,a8w8_blockscale_1x128x128_256x128x128x128_16x16_32x32_2x2_8x32x1_8x32x1_1x32x1x8_8_1x1_intrawave_v3,671.95,346.85,0.0
gfx942,304,2240,5120,12800,ck,0,0,400.9439,a8w8_blockscale_1x128x128_256x128x128x128_16x16_32x32_2x2_8x32x1_8x32x1_1x32x1x8_8_1x1_intrawave_v3,732.28,292.17,0.0
gfx942,304,2304,5120,4096,ck,0,0,144.1969,a8w8_blockscale_1x128x128_256x128x128x128_16x16_32x32_2x2_8x32x1_8x32x1_1x32x1x8_8_1x1_intrawave_v3,670.17,374.5,0.0
gfx942,304,2304,5120,5120,ck,0,0,172.9523,a8w8_blockscale_1x128x128_256x128x128x128_16x16_32x32_2x2_8x32x1_8x32x1_1x32x1x8_8_1x1_intrawave_v3,698.44,356.19,0.0
gfx942,304,2304,5120,12800,ck,0,0,405.702,a8w8_blockscale_1x128x128_256x128x128x128_16x16_32x32_2x2_8x32x1_8x32x1_1x32x1x8_8_1x1_intrawave_v3,744.36,292.38,0.0
gfx942,304,2368,5120,4096,ck,0,0,146.5906,a8w8_blockscale_1x128x128_256x128x128x128_16x16_32x32_2x2_8x32x1_8x32x1_1x32x1x8_8_1x1_intrawave_v3,677.54,374.64,0.0
gfx942,304,2368,5120,5120,ck,0,0,174.0662,a8w8_blockscale_1x128x128_256x128x128x128_16x16_32x32_2x2_8x32x1_8x32x1_1x32x1x8_8_1x1_intrawave_v3,713.24,359.56,0.0
gfx942,304,2368,5120,12800,ck,0,0,403.8184,a8w8_blockscale_1x128x128_256x128x128x128_16x16_32x32_2x2_8x32x1_8x32x1_1x32x1x8_8_1x1_intrawave_v3,768.61,297.4,0.0
gfx942,304,2432,5120,4096,ck,0,0,146.1046,a8w8_blockscale_1x128x128_256x128x128x128_16x16_32x32_2x2_8x32x1_8x32x1_1x32x1x8_8_1x1_intrawave_v3,698.17,382.17,0.0
gfx942,304,2432,5120,5120,ck,0,0,176.0233,a8w8_blockscale_1x128x128_256x128x128x128_16x16_32x32_2x2_8x32x1_8x32x1_1x32x1x8_8_1x1_intrawave_v3,724.37,361.14,0.0
gfx942,304,2432,5120,12800,ck,0,0,433.5934,a8w8_blockscale_1x128x128_256x128x128x128_16x16_32x32_2x2_8x32x1_8x32x1_1x32x1x8_8_1x1_intrawave_v3,735.18,280.38,0.0
gfx942,304,2496,5120,4096,ck,0,0,145.8103,a8w8_blockscale_1x128x128_256x128x128x128_16x16_32x32_2x2_8x32x1_8x32x1_1x32x1x8_8_1x1_intrawave_v3,717.99,389.23,0.0
gfx942,304,2496,5120,5120,ck,0,0,180.8962,a8w8_blockscale_1x128x128_256x128x128x128_16x16_32x32_2x2_8x32x1_8x32x1_1x32x1x8_8_1x1_intrawave_v3,723.41,356.85,0.0
gfx942,304,2496,5120,12800,ck,0,0,433.0577,a8w8_blockscale_1x128x128_256x128x128x128_16x16_32x32_2x2_8x32x1_8x32x1_1x32x1x8_8_1x1_intrawave_v3,755.46,284.13,0.0
gfx942,304,2560,5120,4096,ck,0,0,144.2695,a8w8_blockscale_1x128x128_256x128x128x128_16x16_32x32_2x2_8x32x1_8x32x1_1x32x1x8_8_1x1_intrawave_v3,744.26,399.75,0.0
gfx942,304,2560,5120,5120,ck,0,0,181.5305,a8w8_blockscale_1x128x128_256x128x128x128_16x16_32x32_2x2_8x32x1_8x32x1_1x32x1x8_8_1x1_intrawave_v3,739.37,361.02,0.0
gfx942,304,2560,5120,12800,ck,0,0,436.6402,a8w8_blockscale_1x128x128_256x128x128x128_16x16_32x32_2x2_8x32x1_8x32x1_1x32x1x8_8_1x1_intrawave_v3,768.47,285.17,0.0
gfx942,304,2624,5120,4096,ck,0,0,149.9298,a8w8_blockscale_1x128x128_256x128x128x128_16x16_32x32_2x2_8x32x1_8x32x1_1x32x1x8_8_1x1_intrawave_v3,734.07,390.78,0.0
gfx942,304,2624,5120,5120,ck,0,0,192.0046,a8w8_blockscale_1x128x128_256x128x128x128_16x16_32x32_2x2_8x32x1_8x32x1_1x32x1x8_8_1x1_intrawave_v3,716.51,346.45,0.0
gfx942,304,2624,5120,12800,ck,0,0,436.3131,a8w8_blockscale_1x128x128_256x128x128x128_16x16_32x32_2x2_8x32x1_8x32x1_1x32x1x8_8_1x1_intrawave_v3,788.27,288.77,0.0
gfx942,304,2688,5120,4096,ck,0,0,152.781,a8w8_blockscale_1x128x128_256x128x128x128_16x16_32x32_2x2_8x32x1_8x32x1_1x32x1x8_8_1x1_intrawave_v3,737.94,389.49,0.0
gfx942,304,2688,5120,5120,ck,0,0,185.5892,a8w8_blockscale_1x128x128_256x128x128x128_16x16_32x32_2x2_8x32x1_8x32x1_1x32x1x8_8_1x1_intrawave_v3,759.36,363.72,0.0
gfx942,304,2688,5120,12800,ck,0,0,449.8665,a8w8_blockscale_1x128x128_256x128x128x128_16x16_32x32_2x2_8x32x1_8x32x1_1x32x1x8_8_1x1_intrawave_v3,783.17,283.35,0.0
gfx942,304,2752,5120,4096,ck,0,0,157.2715,a8w8_blockscale_1x128x128_256x128x128x128_16x16_32x32_2x2_8x32x1_8x32x1_1x32x1x8_8_1x1_intrawave_v3,733.94,384.2,0.0
gfx942,304,2752,5120,5120,ck,0,0,198.2175,a8w8_blockscale_1x128x128_256x128x128x128_16x16_32x32_2x2_8x32x1_8x32x1_1x32x1x8_8_1x1_intrawave_v3,727.91,345.5,0.0
gfx942,304,2752,5120,12800,ck,0,0,485.4671,a8w8_blockscale_1x128x128_256x128x128x128_16x16_32x32_2x2_8x32x1_8x32x1_1x32x1x8_8_1x1_intrawave_v3,743.02,265.6,0.0
gfx942,304,2816,5120,4096,ck,0,0,152.6036,a8w8_blockscale_1x128x128_256x128x128x128_16x16_32x32_2x2_8x32x1_8x32x1_1x32x1x8_8_1x1_intrawave_v3,773.98,401.97,0.0
gfx942,304,2816,5120,5120,ck,0,0,189.7991,a8w8_blockscale_1x128x128_256x128x128x128_16x16_32x32_2x2_8x32x1_8x32x1_1x32x1x8_8_1x1_intrawave_v3,777.87,366.01,0.0
gfx942,304,2816,5120,12800,ck,0,0,463.1424,a8w8_blockscale_1x128x128_256x128x128x128_16x16_32x32_2x2_8x32x1_8x32x1_1x32x1x8_8_1x1_intrawave_v3,796.94,281.59,0.0
gfx942,304,2880,5120,4096,ck,0,0,178.8325,a8w8_blockscale_1x128x128_256x128x128x128_16x16_32x32_2x2_8x32x1_8x32x1_1x32x1x8_8_1x1_intrawave_v3,675.47,348.14,0.0
gfx942,304,2880,5120,5120,ck,0,0,224.9359,a8w8_blockscale_1x128x128_256x128x128x128_16x16_32x32_2x2_8x32x1_8x32x1_1x32x1x8_8_1x1_intrawave_v3,671.28,313.21,0.0
gfx942,304,2880,5120,12800,ck,0,0,557.1989,a8w8_blockscale_1x128x128_256x128x128x128_16x16_32x32_2x2_8x32x1_8x32x1_1x32x1x8_8_1x1_intrawave_v3,677.47,236.7,0.0
gfx942,304,2944,5120,4096,ck,0,0,183.024,a8w8_blockscale_1x128x128_256x128x128x128_16x16_32x32_2x2_8x32x1_8x32x1_1x32x1x8_8_1x1_intrawave_v3,674.67,345.18,0.0
gfx942,304,2944,5120,5120,ck,0,0,227.7513,a8w8_blockscale_1x128x128_256x128x128x128_16x16_32x32_2x2_8x32x1_8x32x1_1x32x1x8_8_1x1_intrawave_v3,677.71,313.65,0.0
gfx942,304,2944,5120,12800,ck,0,0,532.5907,a8w8_blockscale_1x128x128_256x128x128x128_16x16_32x32_2x2_8x32x1_8x32x1_1x32x1x8_8_1x1_intrawave_v3,724.53,250.41,0.0
gfx942,304,3008,5120,4096,ck,0,0,175.6638,a8w8_blockscale_1x128x128_256x128x128x128_16x16_32x32_2x2_8x32x1_8x32x1_1x32x1x8_8_1x1_intrawave_v3,718.22,364.87,0.0
gfx942,304,3008,5120,5120,ck,0,0,223.9385,a8w8_blockscale_1x128x128_256x128x128x128_16x16_32x32_2x2_8x32x1_8x32x1_1x32x1x8_8_1x1_intrawave_v3,704.24,323.38,0.0
gfx942,304,3008,5120,12800,ck,0,0,541.683,a8w8_blockscale_1x128x128_256x128x128x128_16x16_32x32_2x2_8x32x1_8x32x1_1x32x1x8_8_1x1_intrawave_v3,727.85,248.93,0.0
gfx942,304,3072,5120,4096,ck,0,0,183.341,a8w8_blockscale_1x128x128_256x128x128x128_16x16_32x32_2x2_8x32x1_8x32x1_1x32x1x8_8_1x1_intrawave_v3,702.78,354.59,0.0
gfx942,304,3072,5120,5120,ck,0,0,225.2065,a8w8_blockscale_1x128x128_256x128x128x128_16x16_32x32_2x2_8x32x1_8x32x1_1x32x1x8_8_1x1_intrawave_v3,715.17,325.92,0.0
gfx942,304,3072,5120,12800,ck,0,0,538.3117,a8w8_blockscale_1x128x128_256x128x128x128_16x16_32x32_2x2_8x32x1_8x32x1_1x32x1x8_8_1x1_intrawave_v3,747.99,253.23,0.0
gfx942,304,3136,5120,4096,ck,0,0,186.1317,a8w8_blockscale_1x128x128_256x128x128x128_16x16_32x32_2x2_8x32x1_8x32x1_1x32x1x8_8_1x1_intrawave_v3,706.67,354.21,0.0
gfx942,304,3136,5120,5120,ck,0,0,230.4835,a8w8_blockscale_1x128x128_256x128x128x128_16x16_32x32_2x2_8x32x1_8x32x1_1x32x1x8_8_1x1_intrawave_v3,713.36,322.73,0.0
gfx942,304,3136,5120,12800,ck,0,0,547.708,a8w8_blockscale_1x128x128_256x128x128x128_16x16_32x32_2x2_8x32x1_8x32x1_1x32x1x8_8_1x1_intrawave_v3,750.48,251.57,0.0
gfx942,304,3200,5120,4096,ck,0,0,184.7825,a8w8_blockscale_1x128x128_256x128x128x128_16x16_32x32_2x2_8x32x1_8x32x1_1x32x1x8_8_1x1_intrawave_v3,726.36,361.76,0.0
gfx942,304,3200,5120,5120,ck,0,0,233.6008,a8w8_blockscale_1x128x128_256x128x128x128_16x16_32x32_2x2_8x32x1_8x32x1_1x32x1x8_8_1x1_intrawave_v3,718.2,322.63,0.0
gfx942,304,3200,5120,12800,ck,0,0,558.5569,a8w8_blockscale_1x128x128_256x128x128x128_16x16_32x32_2x2_8x32x1_8x32x1_1x32x1x8_8_1x1_intrawave_v3,750.92,249.33,0.0
gfx942,304,3264,5120,4096,ck,0,0,189.5459,a8w8_blockscale_1x128x128_256x128x128x128_16x16_32x32_2x2_8x32x1_8x32x1_1x32x1x8_8_1x1_intrawave_v3,722.26,357.51,0.0
gfx942,304,3264,5120,5120,ck,0,0,232.3203,a8w8_blockscale_1x128x128_256x128x128x128_16x16_32x32_2x2_8x32x1_8x32x1_1x32x1x8_8_1x1_intrawave_v3,736.6,328.64,0.0
gfx942,304,3264,5120,12800,ck,0,0,572.3015,a8w8_blockscale_1x128x128_256x128x128x128_16x16_32x32_2x2_8x32x1_8x32x1_1x32x1x8_8_1x1_intrawave_v3,747.54,245.92,0.0
gfx942,304,3328,5120,4096,ck,0,0,189.9707,a8w8_blockscale_1x128x128_256x128x128x128_16x16_32x32_2x2_8x32x1_8x32x1_1x32x1x8_8_1x1_intrawave_v3,734.78,361.54,0.0
gfx942,304,3328,5120,5120,ck,0,0,240.4309,a8w8_blockscale_1x128x128_256x128x128x128_16x16_32x32_2x2_8x32x1_8x32x1_1x32x1x8_8_1x1_intrawave_v3,725.71,321.64,0.0
gfx942,304,3328,5120,12800,ck,0,0,557.3171,a8w8_blockscale_1x128x128_256x128x128x128_16x16_32x32_2x2_8x32x1_8x32x1_1x32x1x8_8_1x1_intrawave_v3,782.69,255.17,0.0
gfx942,304,3392,5120,4096,ck,0,0,188.9482,a8w8_blockscale_1x128x128_256x128x128x128_16x16_32x32_2x2_8x32x1_8x32x1_1x32x1x8_8_1x1_intrawave_v3,752.96,368.35,0.0
gfx942,304,3392,5120,5120,ck,0,0,237.9044,a8w8_blockscale_1x128x128_256x128x128x128_16x16_32x32_2x2_8x32x1_8x32x1_1x32x1x8_8_1x1_intrawave_v3,747.52,329.19,0.0
gfx942,304,3392,5120,12800,ck,0,0,563.2892,a8w8_blockscale_1x128x128_256x128x128x128_16x16_32x32_2x2_8x32x1_8x32x1_1x32x1x8_8_1x1_intrawave_v3,789.29,255.09,0.0
gfx942,304,3456,5120,4096,ck,0,0,189.4623,a8w8_blockscale_1x128x128_256x128x128x128_16x16_32x32_2x2_8x32x1_8x32x1_1x32x1x8_8_1x1_intrawave_v3,765.09,372.19,0.0
gfx942,304,3456,5120,5120,ck,0,0,238.78,a8w8_blockscale_1x128x128_256x128x128x128_16x16_32x32_2x2_8x32x1_8x32x1_1x32x1x8_8_1x1_intrawave_v3,758.83,332.1,0.0
gfx942,304,3456,5120,12800,ck,0,0,577.5296,a8w8_blockscale_1x128x128_256x128x128x128_16x16_32x32_2x2_8x32x1_8x32x1_1x32x1x8_8_1x1_intrawave_v3,784.35,251.35,0.0
gfx942,304,3520,5120,4096,ck,0,0,192.7062,a8w8_blockscale_1x128x128_256x128x128x128_16x16_32x32_2x2_8x32x1_8x32x1_1x32x1x8_8_1x1_intrawave_v3,766.14,370.69,0.0
gfx942,304,3520,5120,5120,ck,0,0,247.3124,a8w8_blockscale_1x128x128_256x128x128x128_16x16_32x32_2x2_8x32x1_8x32x1_1x32x1x8_8_1x1_intrawave_v3,746.22,324.62,0.0
gfx942,304,3520,5120,12800,ck,0,0,576.4983,a8w8_blockscale_1x128x128_256x128x128x128_16x16_32x32_2x2_8x32x1_8x32x1_1x32x1x8_8_1x1_intrawave_v3,800.3,254.36,0.0
gfx942,304,3584,5120,4096,ck,0,0,197.1479,a8w8_blockscale_1x128x128_256x128x128x128_16x16_32x32_2x2_8x32x1_8x32x1_1x32x1x8_8_1x1_intrawave_v3,762.49,366.99,0.0
gfx942,304,3584,5120,5120,ck,0,0,244.2636,a8w8_blockscale_1x128x128_256x128x128x128_16x16_32x32_2x2_8x32x1_8x32x1_1x32x1x8_8_1x1_intrawave_v3,769.27,332.69,0.0
gfx942,304,3584,5120,12800,ck,0,0,590.025,a8w8_blockscale_1x128x128_256x128x128x128_16x16_32x32_2x2_8x32x1_8x32x1_1x32x1x8_8_1x1_intrawave_v3,796.17,251.03,0.0
gfx942,304,3648,5120,4096,ck,0,0,198.2143,a8w8_blockscale_1x128x128_256x128x128x128_16x16_32x32_2x2_8x32x1_8x32x1_1x32x1x8_8_1x1_intrawave_v3,771.93,369.65,0.0
gfx942,304,3648,5120,5120,ck,0,0,252.7946,a8w8_blockscale_1x128x128_256x128x128x128_16x16_32x32_2x2_8x32x1_8x32x1_1x32x1x8_8_1x1_intrawave_v3,756.58,325.35,0.0
gfx942,304,3648,5120,12800,ck,0,0,614.2311,a8w8_blockscale_1x128x128_256x128x128x128_16x16_32x32_2x2_8x32x1_8x32x1_1x32x1x8_8_1x1_intrawave_v3,778.45,243.53,0.0
gfx942,304,3712,5120,4096,ck,0,0,203.2902,a8w8_blockscale_1x128x128_256x128x128x128_16x16_32x32_2x2_8x32x1_8x32x1_1x32x1x8_8_1x1_intrawave_v3,765.86,364.93,0.0
gfx942,304,3712,5120,5120,ck,0,0,259.4421,a8w8_blockscale_1x128x128_256x128x128x128_16x16_32x32_2x2_8x32x1_8x32x1_1x32x1x8_8_1x1_intrawave_v3,750.13,320.81,0.0
gfx942,304,3712,5120,12800,ck,0,0,621.1435,a8w8_blockscale_1x128x128_256x128x128x128_16x16_32x32_2x2_8x32x1_8x32x1_1x32x1x8_8_1x1_intrawave_v3,783.3,243.2,0.0
gfx942,304,3776,5120,4096,ck,0,0,209.2111,a8w8_blockscale_1x128x128_256x128x128x128_16x16_32x32_2x2_8x32x1_8x32x1_1x32x1x8_8_1x1_intrawave_v3,757.02,358.99,0.0
gfx942,304,3776,5120,5120,ck,0,0,251.2453,a8w8_blockscale_1x128x128_256x128x128x128_16x16_32x32_2x2_8x32x1_8x32x1_1x32x1x8_8_1x1_intrawave_v3,787.96,335.19,0.0
gfx942,304,3776,5120,12800,ck,0,0,616.1784,a8w8_blockscale_1x128x128_256x128x128x128_16x16_32x32_2x2_8x32x1_8x32x1_1x32x1x8_8_1x1_intrawave_v3,803.22,247.55,0.0
gfx942,304,3840,5120,4096,ck,0,0,202.636,a8w8_blockscale_1x128x128_256x128x128x128_16x16_32x32_2x2_8x32x1_8x32x1_1x32x1x8_8_1x1_intrawave_v3,794.83,375.16,0.0
gfx942,304,3840,5120,5120,ck,0,0,262.2719,a8w8_blockscale_1x128x128_256x128x128x128_16x16_32x32_2x2_8x32x1_8x32x1_1x32x1x8_8_1x1_intrawave_v3,767.63,324.84,0.0
gfx942,304,3840,5120,12800,ck,0,0,626.1463,a8w8_blockscale_1x128x128_256x128x128x128_16x16_32x32_2x2_8x32x1_8x32x1_1x32x1x8_8_1x1_intrawave_v3,803.83,245.96,0.0
gfx942,304,3904,5120,4096,ck,0,0,231.2517,a8w8_blockscale_1x128x128_256x128x128x128_16x16_32x32_2x2_8x32x1_8x32x1_1x32x1x8_8_1x1_intrawave_v3,708.08,332.71,0.0
gfx942,304,3904,5120,5120,ck,0,0,290.0396,a8w8_blockscale_1x128x128_256x128x128x128_16x16_32x32_2x2_8x32x1_8x32x1_1x32x1x8_8_1x1_intrawave_v3,705.7,297.13,0.0
gfx942,304,3904,5120,12800,ck,0,0,669.2113,a8w8_blockscale_1x128x128_256x128x128x128_16x16_32x32_2x2_8x32x1_8x32x1_1x32x1x8_8_1x1_intrawave_v3,764.64,232.34,0.0
gfx942,304,3968,5120,4096,ck,0,0,228.5211,a8w8_blockscale_1x128x128_256x128x128x128_16x16_32x32_2x2_8x32x1_8x32x1_1x32x1x8_8_1x1_intrawave_v3,728.29,340.7,0.0
gfx942,304,3968,5120,5120,ck,0,0,290.7199,a8w8_blockscale_1x128x128_256x128x128x128_16x16_32x32_2x2_8x32x1_8x32x1_1x32x1x8_8_1x1_intrawave_v3,715.59,299.82,0.0
gfx942,304,3968,5120,12800,ck,0,0,685.4254,a8w8_blockscale_1x128x128_256x128x128x128_16x16_32x32_2x2_8x32x1_8x32x1_1x32x1x8_8_1x1_intrawave_v3,758.79,228.99,0.0
gfx942,304,4032,5120,4096,ck,0,0,225.5581,a8w8_blockscale_1x128x128_256x128x128x128_16x16_32x32_2x2_8x32x1_8x32x1_1x32x1x8_8_1x1_intrawave_v3,749.76,349.24,0.0
gfx942,304,4032,5120,5120,ck,0,0,278.2677,a8w8_blockscale_1x128x128_256x128x128x128_16x16_32x32_2x2_8x32x1_8x32x1_1x32x1x8_8_1x1_intrawave_v3,759.67,316.77,0.0
gfx942,304,4032,5120,12800,ck,0,0,672.7761,a8w8_blockscale_1x128x128_256x128x128x128_16x16_32x32_2x2_8x32x1_8x32x1_1x32x1x8_8_1x1_intrawave_v3,785.52,235.49,0.0
gfx942,304,4096,5120,4096,ck,0,0,225.9757,a8w8_blockscale_1x128x128_256x128x128x128_16x16_32x32_2x2_8x32x1_8x32x1_1x32x1x8_8_1x1_intrawave_v3,760.25,352.66,0.0
gfx942,304,4096,5120,5120,ck,0,0,282.9578,a8w8_blockscale_1x128x128_256x128x128x128_16x16_32x32_2x2_8x32x1_8x32x1_1x32x1x8_8_1x1_intrawave_v3,758.94,314.99,0.0
gfx942,304,4096,5120,12800,ck,0,0,680.7122,a8w8_blockscale_1x128x128_256x128x128x128_16x16_32x32_2x2_8x32x1_8x32x1_1x32x1x8_8_1x1_intrawave_v3,788.69,234.91,0.0
gfx942,304,4224,5120,4096,ck,0,0,232.6633,a8w8_blockscale_1x128x128_256x128x128x128_16x16_32x32_2x2_8x32x1_8x32x1_1x32x1x8_8_1x1_intrawave_v3,761.48,350.41,0.0
gfx942,304,4224,5120,5120,ck,0,0,295.1634,a8w8_blockscale_1x128x128_256x128x128x128_16x16_32x32_2x2_8x32x1_8x32x1_1x32x1x8_8_1x1_intrawave_v3,750.29,308.63,0.0
gfx942,304,4224,5120,12800,ck,0,0,708.9356,a8w8_blockscale_1x128x128_256x128x128x128_16x16_32x32_2x2_8x32x1_8x32x1_1x32x1x8_8_1x1_intrawave_v3,780.96,229.72,0.0
gfx942,304,4352,5120,4096,ck,0,0,236.3423,a8w8_blockscale_1x128x128_256x128x128x128_16x16_32x32_2x2_8x32x1_8x32x1_1x32x1x8_8_1x1_intrawave_v3,772.34,352.72,0.0
gfx942,304,4352,5120,5120,ck,0,0,294.1181,a8w8_blockscale_1x128x128_256x128x128x128_16x16_32x32_2x2_8x32x1_8x32x1_1x32x1x8_8_1x1_intrawave_v3,775.78,316.41,0.0
gfx942,304,4352,5120,12800,ck,0,0,744.1034,a8w8_blockscale_1x128x128_256x128x128x128_16x16_32x32_2x2_8x32x1_8x32x1_1x32x1x8_8_1x1_intrawave_v3,766.59,222.83,0.0
gfx942,304,4480,5120,4096,ck,0,0,236.0374,a8w8_blockscale_1x128x128_256x128x128x128_16x16_32x32_2x2_8x32x1_8x32x1_1x32x1x8_8_1x1_intrawave_v3,796.08,360.95,0.0
gfx942,304,4480,5120,5120,ck,0,0,297.4847,a8w8_blockscale_1x128x128_256x128x128x128_16x16_32x32_2x2_8x32x1_8x32x1_1x32x1x8_8_1x1_intrawave_v3,789.56,319.44,0.0
gfx942,304,4480,5120,12800,ck,0,0,751.4583,a8w8_blockscale_1x128x128_256x128x128x128_16x16_32x32_2x2_8x32x1_8x32x1_1x32x1x8_8_1x1_intrawave_v3,781.42,224.57,0.0
gfx942,304,4608,5120,4096,ck,0,0,241.2999,a8w8_blockscale_1x128x128_256x128x128x128_16x16_32x32_2x2_8x32x1_8x32x1_1x32x1x8_8_1x1_intrawave_v3,800.97,360.68,0.0
gfx942,304,4608,5120,5120,ck,0,0,300.6519,a8w8_blockscale_1x128x128_256x128x128x128_16x16_32x32_2x2_8x32x1_8x32x1_1x32x1x8_8_1x1_intrawave_v3,803.56,322.61,0.0
gfx942,304,4608,5120,12800,ck,0,0,745.8489,a8w8_blockscale_1x128x128_256x128x128x128_16x16_32x32_2x2_8x32x1_8x32x1_1x32x1x8_8_1x1_intrawave_v3,809.79,230.21,0.0
gfx942,304,4736,5120,4096,ck,0,0,254.3173,a8w8_blockscale_1x128x128_256x128x128x128_16x16_32x32_2x2_8x32x1_8x32x1_1x32x1x8_8_1x1_intrawave_v3,781.08,349.43,0.0
gfx942,304,4736,5120,5120,ck,0,0,318.2134,a8w8_blockscale_1x128x128_256x128x128x128_16x16_32x32_2x2_8x32x1_8x32x1_1x32x1x8_8_1x1_intrawave_v3,780.3,310.98,0.0
gfx942,304,4736,5120,12800,ck,0,0,767.0412,a8w8_blockscale_1x128x128_256x128x128x128_16x16_32x32_2x2_8x32x1_8x32x1_1x32x1x8_8_1x1_intrawave_v3,809.29,227.7,0.0
gfx942,304,4864,5120,4096,ck,0,0,253.7901,a8w8_blockscale_1x128x128_256x128x128x128_16x16_32x32_2x2_8x32x1_8x32x1_1x32x1x8_8_1x1_intrawave_v3,803.86,357.39,0.0
gfx942,304,4864,5120,5120,ck,0,0,323.7473,a8w8_blockscale_1x128x128_256x128x128x128_16x16_32x32_2x2_8x32x1_8x32x1_1x32x1x8_8_1x1_intrawave_v3,787.69,311.74,0.0
gfx942,304,4864,5120,12800,ck,0,0,801.651,a8w8_blockscale_1x128x128_256x128x128x128_16x16_32x32_2x2_8x32x1_8x32x1_1x32x1x8_8_1x1_intrawave_v3,795.28,221.55,0.0
gfx942,304,4992,5120,4096,ck,0,0,281.6146,a8w8_blockscale_1x128x128_256x128x128x128_16x16_32x32_2x2_8x32x1_8x32x1_1x32x1x8_8_1x1_intrawave_v3,743.5,328.59,0.0
gfx942,304,4992,5120,5120,ck,0,0,347.5579,a8w8_blockscale_1x128x128_256x128x128x128_16x16_32x32_2x2_8x32x1_8x32x1_1x32x1x8_8_1x1_intrawave_v3,753.04,296.04,0.0
gfx942,304,4992,5120,12800,ck,0,0,847.434,a8w8_blockscale_1x128x128_256x128x128x128_16x16_32x32_2x2_8x32x1_8x32x1_1x32x1x8_8_1x1_intrawave_v3,772.11,213.06,0.0
gfx942,304,5120,5120,4096,ck,0,0,276.1479,a8w8_blockscale_1x128x128_256x128x128x128_16x16_32x32_2x2_8x32x1_8x32x1_1x32x1x8_8_1x1_intrawave_v3,777.66,341.74,0.0
gfx942,304,5120,5120,5120,ck,0,0,341.5535,a8w8_blockscale_1x128x128_256x128x128x128_16x16_32x32_2x2_8x32x1_8x32x1_1x32x1x8_8_1x1_intrawave_v3,785.93,307.0,0.0
gfx942,304,5120,5120,12800,ck,0,0,853.2869,a8w8_blockscale_1x128x128_256x128x128x128_16x16_32x32_2x2_8x32x1_8x32x1_1x32x1x8_8_1x1_intrawave_v3,786.47,215.05,0.0
gfx942,304,5248,5120,4096,ck,0,0,285.7971,a8w8_blockscale_1x128x128_256x128x128x128_16x16_32x32_2x2_8x32x1_8x32x1_1x32x1x8_8_1x1_intrawave_v3,770.19,336.63,0.0
gfx942,304,5248,5120,5120,ck,0,0,358.1615,a8w8_blockscale_1x128x128_256x128x128x128_16x16_32x32_2x2_8x32x1_8x32x1_1x32x1x8_8_1x1_intrawave_v3,768.22,298.26,0.0
gfx942,304,5248,5120,12800,ck,0,0,865.7578,a8w8_blockscale_1x128x128_256x128x128x128_16x16_32x32_2x2_8x32x1_8x32x1_1x32x1x8_8_1x1_intrawave_v3,794.52,215.36,0.0
gfx942,304,5376,5120,4096,ck,0,0,287.4014,a8w8_blockscale_1x128x128_256x128x128x128_16x16_32x32_2x2_8x32x1_8x32x1_1x32x1x8_8_1x1_intrawave_v3,784.57,341.13,0.0
gfx942,304,5376,5120,5120,ck,0,0,361.2374,a8w8_blockscale_1x128x128_256x128x128x128_16x16_32x32_2x2_8x32x1_8x32x1_1x32x1x8_8_1x1_intrawave_v3,780.25,301.16,0.0
gfx942,304,5376,5120,12800,ck,0,0,897.3205,a8w8_blockscale_1x128x128_256x128x128x128_16x16_32x32_2x2_8x32x1_8x32x1_1x32x1x8_8_1x1_intrawave_v3,785.27,211.07,0.0
gfx942,304,5504,5120,4096,ck,0,0,293.2569,a8w8_blockscale_1x128x128_256x128x128x128_16x16_32x32_2x2_8x32x1_8x32x1_1x32x1x8_8_1x1_intrawave_v3,787.21,340.58,0.0
gfx942,304,5504,5120,5120,ck,0,0,361.4645,a8w8_blockscale_1x128x128_256x128x128x128_16x16_32x32_2x2_8x32x1_8x32x1_1x32x1x8_8_1x1_intrawave_v3,798.33,306.41,0.0
gfx942,304,5504,5120,12800,ck,0,0,909.5318,a8w8_blockscale_1x128x128_256x128x128x128_16x16_32x32_2x2_8x32x1_8x32x1_1x32x1x8_8_1x1_intrawave_v3,793.18,211.48,0.0
gfx942,304,5632,5120,4096,ck,0,0,295.0312,a8w8_blockscale_1x128x128_256x128x128x128_16x16_32x32_2x2_8x32x1_8x32x1_1x32x1x8_8_1x1_intrawave_v3,800.67,344.75,0.0
gfx942,304,5632,5120,5120,ck,0,0,363.2365,a8w8_blockscale_1x128x128_256x128x128x128_16x16_32x32_2x2_8x32x1_8x32x1_1x32x1x8_8_1x1_intrawave_v3,812.91,310.33,0.0
gfx942,304,5632,5120,12800,ck,0,0,927.8479,a8w8_blockscale_1x128x128_256x128x128x128_16x16_32x32_2x2_8x32x1_8x32x1_1x32x1x8_8_1x1_intrawave_v3,795.6,210.48,0.0
gfx942,304,5760,5120,4096,ck,0,0,305.8066,a8w8_blockscale_1x128x128_256x128x128x128_16x16_32x32_2x2_8x32x1_8x32x1_1x32x1x8_8_1x1_intrawave_v3,790.02,338.6,0.0
gfx942,304,5760,5120,5120,ck,0,0,378.2319,a8w8_blockscale_1x128x128_256x128x128x128_16x16_32x32_2x2_8x32x1_8x32x1_1x32x1x8_8_1x1_intrawave_v3,798.43,303.22,0.0
gfx942,304,5760,5120,12800,ck,0,0,960.6359,a8w8_blockscale_1x128x128_256x128x128x128_16x16_32x32_2x2_8x32x1_8x32x1_1x32x1x8_8_1x1_intrawave_v3,785.91,206.37,0.0
gfx942,304,5888,5120,4096,ck,0,0,328.9048,a8w8_blockscale_1x128x128_256x128x128x128_16x16_32x32_2x2_8x32x1_8x32x1_1x32x1x8_8_1x1_intrawave_v3,750.86,320.4,0.0
gfx942,304,5888,5120,5120,ck,0,0,399.1426,a8w8_blockscale_1x128x128_256x128x128x128_16x16_32x32_2x2_8x32x1_8x32x1_1x32x1x8_8_1x1_intrawave_v3,773.41,292.26,0.0
gfx942,304,5888,5120,12800,ck,0,0,997.4935,a8w8_blockscale_1x128x128_256x128x128x128_16x16_32x32_2x2_8x32x1_8x32x1_1x32x1x8_8_1x1_intrawave_v3,773.69,201.7,0.0
gfx942,304,6016,5120,4096,ck,0,0,333.4721,a8w8_blockscale_1x128x128_256x128x128x128_16x16_32x32_2x2_8x32x1_8x32x1_1x32x1x8_8_1x1_intrawave_v3,756.67,321.52,0.0
gfx942,304,6016,5120,5120,ck,0,0,399.3483,a8w8_blockscale_1x128x128_256x128x128x128_16x16_32x32_2x2_8x32x1_8x32x1_1x32x1x8_8_1x1_intrawave_v3,789.82,297.03,0.0
gfx942,304,6016,5120,12800,ck,0,0,1033.4861,a8w8_blockscale_1x128x128_256x128x128x128_16x16_32x32_2x2_8x32x1_8x32x1_1x32x1x8_8_1x1_intrawave_v3,762.98,197.53,0.0
gfx942,304,6144,5120,4096,ck,0,0,328.7546,a8w8_blockscale_1x128x128_256x128x128x128_16x16_32x32_2x2_8x32x1_8x32x1_1x32x1x8_8_1x1_intrawave_v3,783.86,331.71,0.0
gfx942,304,6144,5120,5120,ck,0,0,406.6136,a8w8_blockscale_1x128x128_256x128x128x128_16x16_32x32_2x2_8x32x1_8x32x1_1x32x1x8_8_1x1_intrawave_v3,792.21,296.56,0.0
gfx942,304,6144,5120,12800,ck,0,0,1033.9129,a8w8_blockscale_1x128x128_256x128x128x128_16x16_32x32_2x2_8x32x1_8x32x1_1x32x1x8_8_1x1_intrawave_v3,778.89,200.3,0.0
gfx942,304,6272,5120,4096,ck,0,0,341.6475,a8w8_blockscale_1x128x128_256x128x128x128_16x16_32x32_2x2_8x32x1_8x32x1_1x32x1x8_8_1x1_intrawave_v3,769.99,324.57,0.0
gfx942,304,6272,5120,5120,ck,0,0,424.7035,a8w8_blockscale_1x128x128_256x128x128x128_16x16_32x32_2x2_8x32x1_8x32x1_1x32x1x8_8_1x1_intrawave_v3,774.27,288.56,0.0
gfx942,304,6272,5120,12800,ck,0,0,1042.2035,a8w8_blockscale_1x128x128_256x128x128x128_16x16_32x32_2x2_8x32x1_8x32x1_1x32x1x8_8_1x1_intrawave_v3,788.79,201.54,0.0
gfx942,304,6400,5120,4096,ck,0,0,345.0953,a8w8_blockscale_1x128x128_256x128x128x128_16x16_32x32_2x2_8x32x1_8x32x1_1x32x1x8_8_1x1_intrawave_v3,777.86,326.64,0.0
gfx942,304,6400,5120,5120,ck,0,0,414.2506,a8w8_blockscale_1x128x128_256x128x128x128_16x16_32x32_2x2_8x32x1_8x32x1_1x32x1x8_8_1x1_intrawave_v3,810.0,300.59,0.0
gfx942,304,6400,5120,12800,ck,0,0,1039.0299,a8w8_blockscale_1x128x128_256x128x128x128_16x16_32x32_2x2_8x32x1_8x32x1_1x32x1x8_8_1x1_intrawave_v3,807.35,204.99,0.0
gfx942,304,6528,5120,4096,ck,0,0,337.8795,a8w8_blockscale_1x128x128_256x128x128x128_16x16_32x32_2x2_8x32x1_8x32x1_1x32x1x8_8_1x1_intrawave_v3,810.36,339.05,0.0
gfx942,304,6528,5120,5120,ck,0,0,428.0272,a8w8_blockscale_1x128x128_256x128x128x128_16x16_32x32_2x2_8x32x1_8x32x1_1x32x1x8_8_1x1_intrawave_v3,799.61,295.51,0.0
gfx942,304,6528,5120,12800,ck,0,0,1076.7924,a8w8_blockscale_1x128x128_256x128x128x128_16x16_32x32_2x2_8x32x1_8x32x1_1x32x1x8_8_1x1_intrawave_v3,794.62,200.54,0.0
gfx942,304,6656,5120,4096,ck,0,0,345.4104,a8w8_blockscale_1x128x128_256x128x128x128_16x16_32x32_2x2_8x32x1_8x32x1_1x32x1x8_8_1x1_intrawave_v3,808.24,336.97,0.0
gfx942,304,6656,5120,5120,ck,0,0,433.2441,a8w8_blockscale_1x128x128_256x128x128x128_16x16_32x32_2x2_8x32x1_8x32x1_1x32x1x8_8_1x1_intrawave_v3,805.47,296.49,0.0
gfx942,304,6656,5120,12800,ck,0,0,1116.9786,a8w8_blockscale_1x128x128_256x128x128x128_16x16_32x32_2x2_8x32x1_8x32x1_1x32x1x8_8_1x1_intrawave_v3,781.05,195.97,0.0
gfx942,304,6784,5120,4096,ck,0,0,354.8474,a8w8_blockscale_1x128x128_256x128x128x128_16x16_32x32_2x2_8x32x1_8x32x1_1x32x1x8_8_1x1_intrawave_v3,801.87,333.18,0.0
gfx942,304,6784,5120,5120,ck,0,0,456.8006,a8w8_blockscale_1x128x128_256x128x128x128_16x16_32x32_2x2_8x32x1_8x32x1_1x32x1x8_8_1x1_intrawave_v3,778.63,285.5,0.0
gfx942,304,6784,5120,12800,ck,0,0,1132.4882,a8w8_blockscale_1x128x128_256x128x128x128_16x16_32x32_2x2_8x32x1_8x32x1_1x32x1x8_8_1x1_intrawave_v3,785.17,195.89,0.0
gfx942,304,6912,5120,4096,ck,0,0,370.3283,a8w8_blockscale_1x128x128_256x128x128x128_16x16_32x32_2x2_8x32x1_8x32x1_1x32x1x8_8_1x1_intrawave_v3,782.85,324.2,0.0
gfx942,304,6912,5120,5120,ck,0,0,454.1295,a8w8_blockscale_1x128x128_256x128x128x128_16x16_32x32_2x2_8x32x1_8x32x1_1x32x1x8_8_1x1_intrawave_v3,797.98,291.51,0.0
gfx942,304,6912,5120,12800,ck,0,0,1162.4174,a8w8_blockscale_1x128x128_256x128x128x128_16x16_32x32_2x2_8x32x1_8x32x1_1x32x1x8_8_1x1_intrawave_v3,779.38,193.38,0.0
gfx942,304,7040,5120,4096,ck,0,0,374.7147,a8w8_blockscale_1x128x128_256x128x128x128_16x16_32x32_2x2_8x32x1_8x32x1_1x32x1x8_8_1x1_intrawave_v3,788.01,325.31,0.0
gfx942,304,7040,5120,5120,ck,0,0,462.8843,a8w8_blockscale_1x128x128_256x128x128x128_16x16_32x32_2x2_8x32x1_8x32x1_1x32x1x8_8_1x1_intrawave_v3,797.39,290.24,0.0
gfx942,304,7040,5120,12800,ck,0,0,1206.8924,a8w8_blockscale_1x128x128_256x128x128x128_16x16_32x32_2x2_8x32x1_8x32x1_1x32x1x8_8_1x1_intrawave_v3,764.56,188.7,0.0
gfx942,304,7168,5120,4096,ck,0,0,375.8581,a8w8_blockscale_1x128x128_256x128x128x128_16x16_32x32_2x2_8x32x1_8x32x1_1x32x1x8_8_1x1_intrawave_v3,799.9,329.2,0.0
gfx942,304,7168,5120,5120,ck,0,0,473.0451,a8w8_blockscale_1x128x128_256x128x128x128_16x16_32x32_2x2_8x32x1_8x32x1_1x32x1x8_8_1x1_intrawave_v3,794.45,288.16,0.0
gfx942,304,7168,5120,12800,ck,0,0,1162.9022,a8w8_blockscale_1x128x128_256x128x128x128_16x16_32x32_2x2_8x32x1_8x32x1_1x32x1x8_8_1x1_intrawave_v3,807.91,198.37,0.0
gfx942,304,7296,5120,4096,ck,0,0,381.9245,a8w8_blockscale_1x128x128_256x128x128x128_16x16_32x32_2x2_8x32x1_8x32x1_1x32x1x8_8_1x1_intrawave_v3,801.25,328.77,0.0
gfx942,304,7296,5120,5120,ck,0,0,484.4699,a8w8_blockscale_1x128x128_256x128x128x128_16x16_32x32_2x2_8x32x1_8x32x1_1x32x1x8_8_1x1_intrawave_v3,789.57,285.43,0.0
gfx942,304,7296,5120,12800,ck,0,0,1214.7445,a8w8_blockscale_1x128x128_256x128x128x128_16x16_32x32_2x2_8x32x1_8x32x1_1x32x1x8_8_1x1_intrawave_v3,787.24,192.33,0.0
gfx942,304,7424,5120,4096,ck,0,0,390.9999,a8w8_blockscale_1x128x128_256x128x128x128_16x16_32x32_2x2_8x32x1_8x32x1_1x32x1x8_8_1x1_intrawave_v3,796.38,325.84,0.0
gfx942,304,7424,5120,5120,ck,0,0,486.5595,a8w8_blockscale_1x128x128_256x128x128x128_16x16_32x32_2x2_8x32x1_8x32x1_1x32x1x8_8_1x1_intrawave_v3,799.97,288.24,0.0
gfx942,304,7424,5120,12800,ck,0,0,1209.195,a8w8_blockscale_1x128x128_256x128x128x128_16x16_32x32_2x2_8x32x1_8x32x1_1x32x1x8_8_1x1_intrawave_v3,804.73,195.65,0.0
gfx942,304,7552,5120,4096,ck,0,0,395.1442,a8w8_blockscale_1x128x128_256x128x128x128_16x16_32x32_2x2_8x32x1_8x32x1_1x32x1x8_8_1x1_intrawave_v3,801.62,327.06,0.0
gfx942,304,7552,5120,5120,ck,0,0,492.1593,a8w8_blockscale_1x128x128_256x128x128x128_16x16_32x32_2x2_8x32x1_8x32x1_1x32x1x8_8_1x1_intrawave_v3,804.5,288.96,0.0
gfx942,304,7552,5120,12800,ck,0,0,1252.3128,a8w8_blockscale_1x128x128_256x128x128x128_16x16_32x32_2x2_8x32x1_8x32x1_1x32x1x8_8_1x1_intrawave_v3,790.42,191.27,0.0
gfx942,304,7680,5120,4096,ck,0,0,398.5045,a8w8_blockscale_1x128x128_256x128x128x128_16x16_32x32_2x2_8x32x1_8x32x1_1x32x1x8_8_1x1_intrawave_v3,808.33,328.91,0.0
gfx942,304,7680,5120,5120,ck,0,0,502.6849,a8w8_blockscale_1x128x128_256x128x128x128_16x16_32x32_2x2_8x32x1_8x32x1_1x32x1x8_8_1x1_intrawave_v3,801.01,286.82,0.0
gfx942,304,7680,5120,12800,ck,0,0,1273.5591,a8w8_blockscale_1x128x128_256x128x128x128_16x16_32x32_2x2_8x32x1_8x32x1_1x32x1x8_8_1x1_intrawave_v3,790.41,190.4,0.0
gfx942,304,7808,5120,4096,ck,0,0,415.4642,a8w8_blockscale_1x128x128_256x128x128x128_16x16_32x32_2x2_8x32x1_8x32x1_1x32x1x8_8_1x1_intrawave_v3,788.25,319.9,0.0
gfx942,304,7808,5120,5120,ck,0,0,524.7024,a8w8_blockscale_1x128x128_256x128x128x128_16x16_32x32_2x2_8x32x1_8x32x1_1x32x1x8_8_1x1_intrawave_v3,780.18,278.53,0.0
gfx942,304,7808,5120,12800,ck,0,0,1320.0473,a8w8_blockscale_1x128x128_256x128x128x128_16x16_32x32_2x2_8x32x1_8x32x1_1x32x1x8_8_1x1_intrawave_v3,775.28,185.93,0.0
gfx942,304,7936,5120,4096,ck,0,0,417.486,a8w8_blockscale_1x128x128_256x128x128x128_16x16_32x32_2x2_8x32x1_8x32x1_1x32x1x8_8_1x1_intrawave_v3,797.3,322.75,0.0
gfx942,304,7936,5120,5120,ck,0,0,524.9794,a8w8_blockscale_1x128x128_256x128x128x128_16x16_32x32_2x2_8x32x1_8x32x1_1x32x1x8_8_1x1_intrawave_v3,792.55,282.13,0.0
gfx942,304,7936,5120,12800,ck,0,0,1333.6164,a8w8_blockscale_1x128x128_256x128x128x128_16x16_32x32_2x2_8x32x1_8x32x1_1x32x1x8_8_1x1_intrawave_v3,779.97,186.25,0.0
gfx942,304,8064,5120,4096,ck,0,0,428.2379,a8w8_blockscale_1x128x128_256x128x128x128_16x16_32x32_2x2_8x32x1_8x32x1_1x32x1x8_8_1x1_intrawave_v3,789.81,318.93,0.0
gfx942,304,8064,5120,5120,ck,0,0,530.9405,a8w8_blockscale_1x128x128_256x128x128x128_16x16_32x32_2x2_8x32x1_8x32x1_1x32x1x8_8_1x1_intrawave_v3,796.3,282.66,0.0
gfx942,304,8064,5120,12800,ck,0,0,1334.6036,a8w8_blockscale_1x128x128_256x128x128x128_16x16_32x32_2x2_8x32x1_8x32x1_1x32x1x8_8_1x1_intrawave_v3,791.97,188.32,0.0
gfx942,304,8192,5120,4096,ck,0,0,418.7147,a8w8_blockscale_1x128x128_256x128x128x128_16x16_32x32_2x2_8x32x1_8x32x1_1x32x1x8_8_1x1_intrawave_v3,820.6,330.56,0.0
gfx942,304,8192,5120,5120,ck,0,0,523.5376,a8w8_blockscale_1x128x128_256x128x128x128_16x16_32x32_2x2_8x32x1_8x32x1_1x32x1x8_8_1x1_intrawave_v3,820.37,290.42,0.0
gfx942,304,8192,5120,12800,ck,0,0,1333.4379,a8w8_blockscale_1x128x128_256x128x128x128_16x16_32x32_2x2_8x32x1_8x32x1_1x32x1x8_8_1x1_intrawave_v3,805.24,190.69,0.0
gfx942,304,8320,5120,4096,ck,0,0,433.712,a8w8_blockscale_1x128x128_256x128x128x128_16x16_32x32_2x2_8x32x1_8x32x1_1x32x1x8_8_1x1_intrawave_v3,804.6,323.36,0.0
gfx942,304,8320,5120,5120,ck,0,0,549.7297,a8w8_blockscale_1x128x128_256x128x128x128_16x16_32x32_2x2_8x32x1_8x32x1_1x32x1x8_8_1x1_intrawave_v3,793.49,280.16,0.0
gfx942,304,8320,5120,12800,ck,0,0,1360.1897,a8w8_blockscale_1x128x128_256x128x128x128_16x16_32x32_2x2_8x32x1_8x32x1_1x32x1x8_8_1x1_intrawave_v3,801.74,189.11,0.0
gfx942,304,8448,5120,4096,ck,0,0,434.3084,a8w8_blockscale_1x128x128_256x128x128x128_16x16_32x32_2x2_8x32x1_8x32x1_1x32x1x8_8_1x1_intrawave_v3,815.86,327.15,0.0
gfx942,304,8448,5120,5120,ck,0,0,541.8635,a8w8_blockscale_1x128x128_256x128x128x128_16x16_32x32_2x2_8x32x1_8x32x1_1x32x1x8_8_1x1_intrawave_v3,817.4,287.85,0.0
gfx942,304,8448,5120,12800,ck,0,0,1378.2518,a8w8_blockscale_1x128x128_256x128x128x128_16x16_32x32_2x2_8x32x1_8x32x1_1x32x1x8_8_1x1_intrawave_v3,803.41,188.77,0.0
gfx942,304,8576,5120,4096,ck,0,0,444.1657,a8w8_blockscale_1x128x128_256x128x128x128_16x16_32x32_2x2_8x32x1_8x32x1_1x32x1x8_8_1x1_intrawave_v3,809.84,324.02,0.0
gfx942,304,8576,5120,5120,ck,0,0,566.5714,a8w8_blockscale_1x128x128_256x128x128x128_16x16_32x32_2x2_8x32x1_8x32x1_1x32x1x8_8_1x1_intrawave_v3,793.6,278.77,0.0
gfx942,304,8576,5120,12800,ck,0,0,1395.6684,a8w8_blockscale_1x128x128_256x128x128x128_16x16_32x32_2x2_8x32x1_8x32x1_1x32x1x8_8_1x1_intrawave_v3,805.4,188.53,0.0
gfx942,304,8704,5120,4096,ck,0,0,456.4975,a8w8_blockscale_1x128x128_256x128x128x128_16x16_32x32_2x2_8x32x1_8x32x1_1x32x1x8_8_1x1_intrawave_v3,799.72,319.28,0.0
gfx942,304,8704,5120,5120,ck,0,0,569.0418,a8w8_blockscale_1x128x128_256x128x128x128_16x16_32x32_2x2_8x32x1_8x32x1_1x32x1x8_8_1x1_intrawave_v3,801.95,281.01,0.0
gfx942,304,8704,5120,12800,ck,0,0,1440.2894,a8w8_blockscale_1x128x128_256x128x128x128_16x16_32x32_2x2_8x32x1_8x32x1_1x32x1x8_8_1x1_intrawave_v3,792.1,184.74,0.0
gfx942,304,8832,5120,4096,ck,0,0,466.0862,a8w8_blockscale_1x128x128_256x128x128x128_16x16_32x32_2x2_8x32x1_8x32x1_1x32x1x8_8_1x1_intrawave_v3,794.79,316.65,0.0
gfx942,304,8832,5120,5120,ck,0,0,590.2959,a8w8_blockscale_1x128x128_256x128x128x128_16x16_32x32_2x2_8x32x1_8x32x1_1x32x1x8_8_1x1_intrawave_v3,784.44,274.23,0.0
gfx942,304,8832,5120,12800,ck,0,0,1501.8957,a8w8_blockscale_1x128x128_256x128x128x128_16x16_32x32_2x2_8x32x1_8x32x1_1x32x1x8_8_1x1_intrawave_v3,770.78,179.12,0.0
gfx942,304,8960,5120,4096,ck,0,0,466.4408,a8w8_blockscale_1x128x128_256x128x128x128_16x16_32x32_2x2_8x32x1_8x32x1_1x32x1x8_8_1x1_intrawave_v3,805.7,320.35,0.0
gfx942,304,8960,5120,5120,ck,0,0,585.7712,a8w8_blockscale_1x128x128_256x128x128x128_16x16_32x32_2x2_8x32x1_8x32x1_1x32x1x8_8_1x1_intrawave_v3,801.95,279.7,0.0
gfx942,304,8960,5120,12800,ck,0,0,1513.8661,a8w8_blockscale_1x128x128_256x128x128x128_16x16_32x32_2x2_8x32x1_8x32x1_1x32x1x8_8_1x1_intrawave_v3,775.77,179.66,0.0
gfx942,304,9088,5120,4096,ck,0,0,478.4041,a8w8_blockscale_1x128x128_256x128x128x128_16x16_32x32_2x2_8x32x1_8x32x1_1x32x1x8_8_1x1_intrawave_v3,796.77,316.17,0.0
gfx942,304,9088,5120,5120,ck,0,0,598.6515,a8w8_blockscale_1x128x128_256x128x128x128_16x16_32x32_2x2_8x32x1_8x32x1_1x32x1x8_8_1x1_intrawave_v3,795.91,276.97,0.0
gfx942,304,9088,5120,12800,ck,0,0,1484.9173,a8w8_blockscale_1x128x128_256x128x128x128_16x16_32x32_2x2_8x32x1_8x32x1_1x32x1x8_8_1x1_intrawave_v3,802.19,185.14,0.0
gfx942,304,9216,5120,4096,ck,0,0,477.5228,a8w8_blockscale_1x128x128_256x128x128x128_16x16_32x32_2x2_8x32x1_8x32x1_1x32x1x8_8_1x1_intrawave_v3,809.48,320.6,0.0
gfx942,304,9216,5120,5120,ck,0,0,603.1068,a8w8_blockscale_1x128x128_256x128x128x128_16x16_32x32_2x2_8x32x1_8x32x1_1x32x1x8_8_1x1_intrawave_v3,801.16,278.18,0.0
gfx942,304,9216,5120,12800,ck,0,0,1507.1602,a8w8_blockscale_1x128x128_256x128x128x128_16x16_32x32_2x2_8x32x1_8x32x1_1x32x1x8_8_1x1_intrawave_v3,801.48,184.37,0.0
gfx942,304,9344,5120,4096,ck,0,0,488.9425,a8w8_blockscale_1x128x128_256x128x128x128_16x16_32x32_2x2_8x32x1_8x32x1_1x32x1x8_8_1x1_intrawave_v3,801.56,316.86,0.0
gfx942,304,9344,5120,5120,ck,0,0,602.4309,a8w8_blockscale_1x128x128_256x128x128x128_16x16_32x32_2x2_8x32x1_8x32x1_1x32x1x8_8_1x1_intrawave_v3,813.2,281.76,0.0
gfx942,304,9344,5120,12800,ck,0,0,1556.3837,a8w8_blockscale_1x128x128_256x128x128x128_16x16_32x32_2x2_8x32x1_8x32x1_1x32x1x8_8_1x1_intrawave_v3,786.91,180.43,0.0
gfx942,304,9472,5120,4096,ck,0,0,487.8925,a8w8_blockscale_1x128x128_256x128x128x128_16x16_32x32_2x2_8x32x1_8x32x1_1x32x1x8_8_1x1_intrawave_v3,814.29,321.3,0.0
gfx942,304,9472,5120,5120,ck,0,0,615.2422,a8w8_blockscale_1x128x128_256x128x128x128_16x16_32x32_2x2_8x32x1_8x32x1_1x32x1x8_8_1x1_intrawave_v3,807.17,279.08,0.0
gfx942,304,9472,5120,12800,ck,0,0,1568.9445,a8w8_blockscale_1x128x128_256x128x128x128_16x16_32x32_2x2_8x32x1_8x32x1_1x32x1x8_8_1x1_intrawave_v3,791.31,180.87,0.0
gfx942,304,9600,5120,4096,ck,0,0,497.0638,a8w8_blockscale_1x128x128_256x128x128x128_16x16_32x32_2x2_8x32x1_8x32x1_1x32x1x8_8_1x1_intrawave_v3,810.06,319.07,0.0
gfx942,304,9600,5120,5120,ck,0,0,630.8395,a8w8_blockscale_1x128x128_256x128x128x128_16x16_32x32_2x2_8x32x1_8x32x1_1x32x1x8_8_1x1_intrawave_v3,797.85,275.3,0.0
gfx942,304,9600,5120,12800,ck,0,0,1607.1512,a8w8_blockscale_1x128x128_256x128x128x128_16x16_32x32_2x2_8x32x1_8x32x1_1x32x1x8_8_1x1_intrawave_v3,782.93,178.4,0.0
gfx942,304,9728,5120,4096,ck,0,0,496.9434,a8w8_blockscale_1x128x128_256x128x128x128_16x16_32x32_2x2_8x32x1_8x32x1_1x32x1x8_8_1x1_intrawave_v3,821.06,322.84,0.0
gfx942,304,9728,5120,5120,ck,0,0,634.6735,a8w8_blockscale_1x128x128_256x128x128x128_16x16_32x32_2x2_8x32x1_8x32x1_1x32x1x8_8_1x1_intrawave_v3,803.61,276.74,0.0
gfx942,304,9728,5120,12800,ck,0,0,1599.0073,a8w8_blockscale_1x128x128_256x128x128x128_16x16_32x32_2x2_8x32x1_8x32x1_1x32x1x8_8_1x1_intrawave_v3,797.41,181.16,0.0
gfx942,304,9856,5120,4096,ck,0,0,515.8408,a8w8_blockscale_1x128x128_256x128x128x128_16x16_32x32_2x2_8x32x1_8x32x1_1x32x1x8_8_1x1_intrawave_v3,801.39,314.57,0.0
gfx942,304,9856,5120,5120,ck,0,0,647.2769,a8w8_blockscale_1x128x128_256x128x128x128_16x16_32x32_2x2_8x32x1_8x32x1_1x32x1x8_8_1x1_intrawave_v3,798.33,274.38,0.0
gfx942,304,9856,5120,12800,ck,0,0,1674.2827,a8w8_blockscale_1x128x128_256x128x128x128_16x16_32x32_2x2_8x32x1_8x32x1_1x32x1x8_8_1x1_intrawave_v3,771.58,174.77,0.0
gfx942,304,9984,5120,4096,ck,0,0,532.8511,a8w8_blockscale_1x128x128_256x128x128x128_16x16_32x32_2x2_8x32x1_8x32x1_1x32x1x8_8_1x1_intrawave_v3,785.88,307.97,0.0
gfx942,304,9984,5120,5120,ck,0,0,654.2205,a8w8_blockscale_1x128x128_256x128x128x128_16x16_32x32_2x2_8x32x1_8x32x1_1x32x1x8_8_1x1_intrawave_v3,800.11,274.48,0.0
gfx942,304,9984,5120,12800,ck,0,0,1661.9673,a8w8_blockscale_1x128x128_256x128x128x128_16x16_32x32_2x2_8x32x1_8x32x1_1x32x1x8_8_1x1_intrawave_v3,787.39,177.84,0.0
gfx942,304,10112,5120,4096,ck,0,0,525.166,a8w8_blockscale_1x128x128_256x128x128x128_16x16_32x32_2x2_8x32x1_8x32x1_1x32x1x8_8_1x1_intrawave_v3,807.61,315.97,0.0
gfx942,304,10112,5120,5120,ck,0,0,658.5958,a8w8_blockscale_1x128x128_256x128x128x128_16x16_32x32_2x2_8x32x1_8x32x1_1x32x1x8_8_1x1_intrawave_v3,804.99,275.64,0.0
gfx942,304,10112,5120,12800,ck,0,0,1664.0381,a8w8_blockscale_1x128x128_256x128x128x128_16x16_32x32_2x2_8x32x1_8x32x1_1x32x1x8_8_1x1_intrawave_v3,796.5,179.39,0.0
gfx942,304,10240,5120,4096,ck,0,0,526.7606,a8w8_blockscale_1x128x128_256x128x128x128_16x16_32x32_2x2_8x32x1_8x32x1_1x32x1x8_8_1x1_intrawave_v3,815.35,318.5,0.0
gfx942,304,10240,5120,5120,ck,0,0,657.8425,a8w8_blockscale_1x128x128_256x128x128x128_16x16_32x32_2x2_8x32x1_8x32x1_1x32x1x8_8_1x1_intrawave_v3,816.11,278.94,0.0
gfx942,304,10240,5120,12800,ck,0,0,1705.0302,a8w8_blockscale_1x128x128_256x128x128x128_16x16_32x32_2x2_8x32x1_8x32x1_1x32x1x8_8_1x1_intrawave_v3,787.19,176.81,0.0
gfx942,304,10368,5120,4096,ck,0,0,534.5105,a8w8_blockscale_1x128x128_256x128x128x128_16x16_32x32_2x2_8x32x1_8x32x1_1x32x1x8_8_1x1_intrawave_v3,813.58,317.31,0.0
gfx942,304,10368,5120,5120,ck,0,0,668.095,a8w8_blockscale_1x128x128_256x128x128x128_16x16_32x32_2x2_8x32x1_8x32x1_1x32x1x8_8_1x1_intrawave_v3,813.63,277.61,0.0
gfx942,304,10368,5120,12800,ck,0,0,1726.4311,a8w8_blockscale_1x128x128_256x128x128x128_16x16_32x32_2x2_8x32x1_8x32x1_1x32x1x8_8_1x1_intrawave_v3,787.15,176.33,0.0
gfx942,304,10496,5120,4096,ck,0,0,547.0916,a8w8_blockscale_1x128x128_256x128x128x128_16x16_32x32_2x2_8x32x1_8x32x1_1x32x1x8_8_1x1_intrawave_v3,804.68,313.37,0.0
gfx942,304,10496,5120,5120,ck,0,0,684.567,a8w8_blockscale_1x128x128_256x128x128x128_16x16_32x32_2x2_8x32x1_8x32x1_1x32x1x8_8_1x1_intrawave_v3,803.86,273.8,0.0
gfx942,304,10496,5120,12800,ck,0,0,1740.9959,a8w8_blockscale_1x128x128_256x128x128x128_16x16_32x32_2x2_8x32x1_8x32x1_1x32x1x8_8_1x1_intrawave_v3,790.2,176.54,0.0
gfx942,304,10624,5120,4096,ck,0,0,544.9085,a8w8_blockscale_1x128x128_256x128x128x128_16x16_32x32_2x2_8x32x1_8x32x1_1x32x1x8_8_1x1_intrawave_v3,817.76,317.99,0.0
gfx942,304,10624,5120,5120,ck,0,0,677.8497,a8w8_blockscale_1x128x128_256x128x128x128_16x16_32x32_2x2_8x32x1_8x32x1_1x32x1x8_8_1x1_intrawave_v3,821.72,279.41,0.0
gfx942,304,10624,5120,12800,ck,0,0,1769.0889,a8w8_blockscale_1x128x128_256x128x128x128_16x16_32x32_2x2_8x32x1_8x32x1_1x32x1x8_8_1x1_intrawave_v3,787.13,175.41,0.0
gfx942,304,10752,5120,4096,ck,0,0,550.7153,a8w8_blockscale_1x128x128_256x128x128x128_16x16_32x32_2x2_8x32x1_8x32x1_1x32x1x8_8_1x1_intrawave_v3,818.88,317.97,0.0
gfx942,304,10752,5120,5120,ck,0,0,688.3047,a8w8_blockscale_1x128x128_256x128x128x128_16x16_32x32_2x2_8x32x1_8x32x1_1x32x1x8_8_1x1_intrawave_v3,818.99,278.02,0.0
gfx942,304,10752,5120,12800,ck,0,0,1849.3351,a8w8_blockscale_1x128x128_256x128x128x128_16x16_32x32_2x2_8x32x1_8x32x1_1x32x1x8_8_1x1_intrawave_v3,762.05,169.39,0.0
gfx942,304,10880,5120,4096,ck,0,0,568.987,a8w8_blockscale_1x128x128_256x128x128x128_16x16_32x32_2x2_8x32x1_8x32x1_1x32x1x8_8_1x1_intrawave_v3,802.02,310.99,0.0
gfx942,304,10880,5120,5120,ck,0,0,711.101,a8w8_blockscale_1x128x128_256x128x128x128_16x16_32x32_2x2_8x32x1_8x32x1_1x32x1x8_8_1x1_intrawave_v3,802.17,271.88,0.0
gfx942,304,10880,5120,12800,ck,0,0,1843.8343,a8w8_blockscale_1x128x128_256x128x128x128_16x16_32x32_2x2_8x32x1_8x32x1_1x32x1x8_8_1x1_intrawave_v3,773.42,171.5,0.0
gfx942,304,11008,5120,4096,ck,0,0,574.6431,a8w8_blockscale_1x128x128_256x128x128x128_16x16_32x32_2x2_8x32x1_8x32x1_1x32x1x8_8_1x1_intrawave_v3,803.47,311.12,0.0
gfx942,304,11008,5120,5120,ck,0,0,709.5481,a8w8_blockscale_1x128x128_256x128x128x128_16x16_32x32_2x2_8x32x1_8x32x1_1x32x1x8_8_1x1_intrawave_v3,813.39,275.24,0.0
gfx942,304,11008,5120,12800,ck,0,0,1840.5845,a8w8_blockscale_1x128x128_256x128x128x128_16x16_32x32_2x2_8x32x1_8x32x1_1x32x1x8_8_1x1_intrawave_v3,783.9,173.4,0.0
gfx942,304,11136,5120,4096,ck,0,0,571.3397,a8w8_blockscale_1x128x128_256x128x128x128_16x16_32x32_2x2_8x32x1_8x32x1_1x32x1x8_8_1x1_intrawave_v3,817.51,316.13,0.0
gfx942,304,11136,5120,5120,ck,0,0,720.3065,a8w8_blockscale_1x128x128_256x128x128x128_16x16_32x32_2x2_8x32x1_8x32x1_1x32x1x8_8_1x1_intrawave_v3,810.55,273.86,0.0
gfx942,304,11136,5120,12800,ck,0,0,1844.4127,a8w8_blockscale_1x128x128_256x128x128x128_16x16_32x32_2x2_8x32x1_8x32x1_1x32x1x8_8_1x1_intrawave_v3,791.37,174.64,0.0
gfx942,304,11264,5120,4096,ck,0,0,568.9471,a8w8_blockscale_1x128x128_256x128x128x128_16x16_32x32_2x2_8x32x1_8x32x1_1x32x1x8_8_1x1_intrawave_v3,830.39,320.68,0.0
gfx942,304,11264,5120,5120,ck,0,0,724.6154,a8w8_blockscale_1x128x128_256x128x128x128_16x16_32x32_2x2_8x32x1_8x32x1_1x32x1x8_8_1x1_intrawave_v3,815.0,274.95,0.0
gfx942,304,11264,5120,12800,ck,0,0,1848.3728,a8w8_blockscale_1x128x128_256x128x128x128_16x16_32x32_2x2_8x32x1_8x32x1_1x32x1x8_8_1x1_intrawave_v3,798.75,175.86,0.0
gfx942,304,11392,5120,4096,ck,0,0,584.1964,a8w8_blockscale_1x128x128_256x128x128x128_16x16_32x32_2x2_8x32x1_8x32x1_1x32x1x8_8_1x1_intrawave_v3,817.9,315.45,0.0
gfx942,304,11392,5120,5120,ck,0,0,733.8463,a8w8_blockscale_1x128x128_256x128x128x128_16x16_32x32_2x2_8x32x1_8x32x1_1x32x1x8_8_1x1_intrawave_v3,813.89,274.17,0.0
gfx942,304,11392,5120,12800,ck,0,0,1939.6514,a8w8_blockscale_1x128x128_256x128x128x128_16x16_32x32_2x2_8x32x1_8x32x1_1x32x1x8_8_1x1_intrawave_v3,769.81,169.11,0.0
gfx942,304,11520,5120,4096,ck,0,0,583.4121,a8w8_blockscale_1x128x128_256x128x128x128_16x16_32x32_2x2_8x32x1_8x32x1_1x32x1x8_8_1x1_intrawave_v3,828.2,319.02,0.0
gfx942,304,11520,5120,5120,ck,0,0,738.1443,a8w8_blockscale_1x128x128_256x128x128x128_16x16_32x32_2x2_8x32x1_8x32x1_1x32x1x8_8_1x1_intrawave_v3,818.24,275.23,0.0
gfx942,304,11520,5120,12800,ck,0,0,1944.394,a8w8_blockscale_1x128x128_256x128x128x128_16x16_32x32_2x2_8x32x1_8x32x1_1x32x1x8_8_1x1_intrawave_v3,776.57,170.21,0.0
gfx942,304,11648,5120,4096,ck,0,0,611.4492,a8w8_blockscale_1x128x128_256x128x128x128_16x16_32x32_2x2_8x32x1_8x32x1_1x32x1x8_8_1x1_intrawave_v3,799.01,307.4,0.0
gfx942,304,11648,5120,5120,ck,0,0,739.7522,a8w8_blockscale_1x128x128_256x128x128x128_16x16_32x32_2x2_8x32x1_8x32x1_1x32x1x8_8_1x1_intrawave_v3,825.53,277.29,0.0
gfx942,304,11648,5120,12800,ck,0,0,1967.2581,a8w8_blockscale_1x128x128_256x128x128x128_16x16_32x32_2x2_8x32x1_8x32x1_1x32x1x8_8_1x1_intrawave_v3,776.07,169.73,0.0
gfx942,304,11776,5120,4096,ck,0,0,614.6846,a8w8_blockscale_1x128x128_256x128x128x128_16x16_32x32_2x2_8x32x1_8x32x1_1x32x1x8_8_1x1_intrawave_v3,803.54,308.76,0.0
gfx942,304,11776,5120,5120,ck,0,0,752.1351,a8w8_blockscale_1x128x128_256x128x128x128_16x16_32x32_2x2_8x32x1_8x32x1_1x32x1x8_8_1x1_intrawave_v3,820.87,275.34,0.0
gfx942,304,11776,5120,12800,ck,0,0,2034.9161,a8w8_blockscale_1x128x128_256x128x128x128_16x16_32x32_2x2_8x32x1_8x32x1_1x32x1x8_8_1x1_intrawave_v3,758.51,165.54,0.0
gfx942,304,11904,5120,4096,ck,0,0,615.5573,a8w8_blockscale_1x128x128_256x128x128x128_16x16_32x32_2x2_8x32x1_8x32x1_1x32x1x8_8_1x1_intrawave_v3,811.12,311.31,0.0
gfx942,304,11904,5120,5120,ck,0,0,768.9075,a8w8_blockscale_1x128x128_256x128x128x128_16x16_32x32_2x2_8x32x1_8x32x1_1x32x1x8_8_1x1_intrawave_v3,811.69,271.89,0.0
gfx942,304,11904,5120,12800,ck,0,0,2007.8767,a8w8_blockscale_1x128x128_256x128x128x128_16x16_32x32_2x2_8x32x1_8x32x1_1x32x1x8_8_1x1_intrawave_v3,777.08,169.24,0.0
gfx942,304,12032,5120,4096,ck,0,0,617.2579,a8w8_blockscale_1x128x128_256x128x128x128_16x16_32x32_2x2_8x32x1_8x32x1_1x32x1x8_8_1x1_intrawave_v3,817.58,313.42,0.0
gfx942,304,12032,5120,5120,ck,0,0,767.9193,a8w8_blockscale_1x128x128_256x128x128x128_16x16_32x32_2x2_8x32x1_8x32x1_1x32x1x8_8_1x1_intrawave_v3,821.47,274.8,0.0
gfx942,304,12032,5120,12800,ck,0,0,2024.3397,a8w8_blockscale_1x128x128_256x128x128x128_16x16_32x32_2x2_8x32x1_8x32x1_1x32x1x8_8_1x1_intrawave_v3,779.05,169.32,0.0
gfx942,304,12160,5120,4096,ck,0,0,619.7974,a8w8_blockscale_1x128x128_256x128x128x128_16x16_32x32_2x2_8x32x1_8x32x1_1x32x1x8_8_1x1_intrawave_v3,822.89,315.1,0.0
gfx942,304,12160,5120,5120,ck,0,0,770.0108,a8w8_blockscale_1x128x128_256x128x128x128_16x16_32x32_2x2_8x32x1_8x32x1_1x32x1x8_8_1x1_intrawave_v3,827.95,276.61,0.0
gfx942,304,12160,5120,12800,ck,0,0,2013.9489,a8w8_blockscale_1x128x128_256x128x128x128_16x16_32x32_2x2_8x32x1_8x32x1_1x32x1x8_8_1x1_intrawave_v3,791.4,171.65,0.0
gfx942,304,12288,5120,4096,ck,0,0,641.4416,a8w8_blockscale_1x128x128_256x128x128x128_16x16_32x32_2x2_8x32x1_8x32x1_1x32x1x8_8_1x1_intrawave_v3,803.5,307.33,0.0
gfx942,304,12288,5120,5120,ck,0,0,783.7007,a8w8_blockscale_1x128x128_256x128x128x128_16x16_32x32_2x2_8x32x1_8x32x1_1x32x1x8_8_1x1_intrawave_v3,822.06,274.29,0.0
gfx942,304,12288,5120,12800,ck,0,0,2071.7449,a8w8_blockscale_1x128x128_256x128x128x128_16x16_32x32_2x2_8x32x1_8x32x1_1x32x1x8_8_1x1_intrawave_v3,777.42,168.29,0.0
gfx942,304,12416,5120,4096,ck,0,0,635.4439,a8w8_blockscale_1x128x128_256x128x128x128_16x16_32x32_2x2_8x32x1_8x32x1_1x32x1x8_8_1x1_intrawave_v3,819.53,313.12,0.0
gfx942,304,12416,5120,5120,ck,0,0,800.9605,a8w8_blockscale_1x128x128_256x128x128x128_16x16_32x32_2x2_8x32x1_8x32x1_1x32x1x8_8_1x1_intrawave_v3,812.72,270.83,0.0
gfx942,304,12416,5120,12800,ck,0,0,2108.4788,a8w8_blockscale_1x128x128_256x128x128x128_16x16_32x32_2x2_8x32x1_8x32x1_1x32x1x8_8_1x1_intrawave_v3,771.83,166.76,0.0
gfx942,304,12544,5120,4096,ck,0,0,641.1003,a8w8_blockscale_1x128x128_256x128x128x128_16x16_32x32_2x2_8x32x1_8x32x1_1x32x1x8_8_1x1_intrawave_v3,820.67,313.22,0.0
gfx942,304,12544,5120,5120,ck,0,0,810.9698,a8w8_blockscale_1x128x128_256x128x128x128_16x16_32x32_2x2_8x32x1_8x32x1_1x32x1x8_8_1x1_intrawave_v3,810.96,269.91,0.0
gfx942,304,12544,5120,12800,ck,0,0,2093.9197,a8w8_blockscale_1x128x128_256x128x128x128_16x16_32x32_2x2_8x32x1_8x32x1_1x32x1x8_8_1x1_intrawave_v3,785.21,169.32,0.0
gfx942,304,12672,5120,4096,ck,0,0,656.5495,a8w8_blockscale_1x128x128_256x128x128x128_16x16_32x32_2x2_8x32x1_8x32x1_1x32x1x8_8_1x1_intrawave_v3,809.54,308.64,0.0
gfx942,304,12672,5120,5120,ck,0,0,818.5383,a8w8_blockscale_1x128x128_256x128x128x128_16x16_32x32_2x2_8x32x1_8x32x1_1x32x1x8_8_1x1_intrawave_v3,811.66,269.82,0.0
gfx942,304,12672,5120,12800,ck,0,0,2203.0277,a8w8_blockscale_1x128x128_256x128x128x128_16x16_32x32_2x2_8x32x1_8x32x1_1x32x1x8_8_1x1_intrawave_v3,753.94,162.28,0.0
gfx942,304,12800,5120,4096,ck,0,0,660.662,a8w8_blockscale_1x128x128_256x128x128x128_16x16_32x32_2x2_8x32x1_8x32x1_1x32x1x8_8_1x1_intrawave_v3,812.63,309.5,0.0
gfx942,304,12800,5120,5120,ck,0,0,825.1341,a8w8_blockscale_1x128x128_256x128x128x128_16x16_32x32_2x2_8x32x1_8x32x1_1x32x1x8_8_1x1_intrawave_v3,813.31,270.04,0.0
gfx942,304,12800,5120,12800,ck,0,0,2113.1846,a8w8_blockscale_1x128x128_256x128x128x128_16x16_32x32_2x2_8x32x1_8x32x1_1x32x1x8_8_1x1_intrawave_v3,793.93,170.57,0.0
gfx942,304,12928,5120,4096,ck,0,0,668.6732,a8w8_blockscale_1x128x128_256x128x128x128_16x16_32x32_2x2_8x32x1_8x32x1_1x32x1x8_8_1x1_intrawave_v3,810.92,308.53,0.0
gfx942,304,12928,5120,5120,ck,0,0,836.4991,a8w8_blockscale_1x128x128_256x128x128x128_16x16_32x32_2x2_8x32x1_8x32x1_1x32x1x8_8_1x1_intrawave_v3,810.28,268.73,0.0
gfx942,304,12928,5120,12800,ck,0,0,2170.879,a8w8_blockscale_1x128x128_256x128x128x128_16x16_32x32_2x2_8x32x1_8x32x1_1x32x1x8_8_1x1_intrawave_v3,780.56,167.4,0.0
gfx942,304,13056,5120,4096,ck,0,0,651.519,a8w8_blockscale_1x128x128_256x128x128x128_16x16_32x32_2x2_8x32x1_8x32x1_1x32x1x8_8_1x1_intrawave_v3,840.51,319.47,0.0
gfx942,304,13056,5120,5120,ck,0,0,844.2753,a8w8_blockscale_1x128x128_256x128x128x128_16x16_32x32_2x2_8x32x1_8x32x1_1x32x1x8_8_1x1_intrawave_v3,810.77,268.58,0.0
gfx942,304,13056,5120,12800,ck,0,0,2215.2628,a8w8_blockscale_1x128x128_256x128x128x128_16x16_32x32_2x2_8x32x1_8x32x1_1x32x1x8_8_1x1_intrawave_v3,772.49,165.37,0.0
gfx942,304,13184,5120,4096,ck,0,0,678.2252,a8w8_blockscale_1x128x128_256x128x128x128_16x16_32x32_2x2_8x32x1_8x32x1_1x32x1x8_8_1x1_intrawave_v3,815.33,309.6,0.0
gfx942,304,13184,5120,5120,ck,0,0,862.5894,a8w8_blockscale_1x128x128_256x128x128x128_16x16_32x32_2x2_8x32x1_8x32x1_1x32x1x8_8_1x1_intrawave_v3,801.33,265.16,0.0
gfx942,304,13184,5120,12800,ck,0,0,2207.0213,a8w8_blockscale_1x128x128_256x128x128x128_16x16_32x32_2x2_8x32x1_8x32x1_1x32x1x8_8_1x1_intrawave_v3,782.98,167.33,0.0
gfx942,304,13312,5120,4096,ck,0,0,668.978,a8w8_blockscale_1x128x128_256x128x128x128_16x16_32x32_2x2_8x32x1_8x32x1_1x32x1x8_8_1x1_intrawave_v3,834.62,316.62,0.0
gfx942,304,13312,5120,5120,ck,0,0,843.5945,a8w8_blockscale_1x128x128_256x128x128x128_16x16_32x32_2x2_8x32x1_8x32x1_1x32x1x8_8_1x1_intrawave_v3,827.33,273.46,0.0
gfx942,304,13312,5120,12800,ck,0,0,2209.1431,a8w8_blockscale_1x128x128_256x128x128x128_16x16_32x32_2x2_8x32x1_8x32x1_1x32x1x8_8_1x1_intrawave_v3,789.82,168.5,0.0
gfx942,304,13440,5120,4096,ck,0,0,684.6546,a8w8_blockscale_1x128x128_256x128x128x128_16x16_32x32_2x2_8x32x1_8x32x1_1x32x1x8_8_1x1_intrawave_v3,823.36,312.05,0.0
gfx942,304,13440,5120,5120,ck,0,0,871.2515,a8w8_blockscale_1x128x128_256x128x128x128_16x16_32x32_2x2_8x32x1_8x32x1_1x32x1x8_8_1x1_intrawave_v3,808.77,267.03,0.0
gfx942,304,13440,5120,12800,ck,0,0,2309.5421,a8w8_blockscale_1x128x128_256x128x128x128_16x16_32x32_2x2_8x32x1_8x32x1_1x32x1x8_8_1x1_intrawave_v3,762.75,162.45,0.0
gfx942,304,13568,5120,4096,ck,0,0,695.4854,a8w8_blockscale_1x128x128_256x128x128x128_16x16_32x32_2x2_8x32x1_8x32x1_1x32x1x8_8_1x1_intrawave_v3,818.25,309.83,0.0
gfx942,304,13568,5120,5120,ck,0,0,873.4532,a8w8_blockscale_1x128x128_256x128x128x128_16x16_32x32_2x2_8x32x1_8x32x1_1x32x1x8_8_1x1_intrawave_v3,814.42,268.61,0.0
gfx942,304,13568,5120,12800,ck,0,0,2298.1979,a8w8_blockscale_1x128x128_256x128x128x128_16x16_32x32_2x2_8x32x1_8x32x1_1x32x1x8_8_1x1_intrawave_v3,773.82,164.54,0.0
gfx942,304,13696,5120,4096,ck,0,0,708.8432,a8w8_blockscale_1x128x128_256x128x128x128_16x16_32x32_2x2_8x32x1_8x32x1_1x32x1x8_8_1x1_intrawave_v3,810.41,306.58,0.0
gfx942,304,13696,5120,5120,ck,0,0,878.1168,a8w8_blockscale_1x128x128_256x128x128x128_16x16_32x32_2x2_8x32x1_8x32x1_1x32x1x8_8_1x1_intrawave_v3,817.73,269.42,0.0
gfx942,304,13696,5120,12800,ck,0,0,2385.88,a8w8_blockscale_1x128x128_256x128x128x128_16x16_32x32_2x2_8x32x1_8x32x1_1x32x1x8_8_1x1_intrawave_v3,752.41,159.73,0.0
gfx942,304,13824,5120,4096,ck,0,0,690.6568,a8w8_blockscale_1x128x128_256x128x128x128_16x16_32x32_2x2_8x32x1_8x32x1_1x32x1x8_8_1x1_intrawave_v3,839.52,317.31,0.0
gfx942,304,13824,5120,5120,ck,0,0,875.691,a8w8_blockscale_1x128x128_256x128x128x128_16x16_32x32_2x2_8x32x1_8x32x1_1x32x1x8_8_1x1_intrawave_v3,827.66,272.41,0.0
gfx942,304,13824,5120,12800,ck,0,0,2328.5826,a8w8_blockscale_1x128x128_256x128x128x128_16x16_32x32_2x2_8x32x1_8x32x1_1x32x1x8_8_1x1_intrawave_v3,778.13,164.92,0.0
gfx942,304,13952,5120,4096,ck,0,0,720.5756,a8w8_blockscale_1x128x128_256x128x128x128_16x16_32x32_2x2_8x32x1_8x32x1_1x32x1x8_8_1x1_intrawave_v3,812.11,306.68,0.0
gfx942,304,13952,5120,5120,ck,0,0,887.261,a8w8_blockscale_1x128x128_256x128x128x128_16x16_32x32_2x2_8x32x1_8x32x1_1x32x1x8_8_1x1_intrawave_v3,824.43,271.08,0.0
gfx942,304,13952,5120,12800,ck,0,0,2414.1658,a8w8_blockscale_1x128x128_256x128x128x128_16x16_32x32_2x2_8x32x1_8x32x1_1x32x1x8_8_1x1_intrawave_v3,757.49,160.3,0.0
gfx942,304,14080,5120,4096,ck,0,0,722.9301,a8w8_blockscale_1x128x128_256x128x128x128_16x16_32x32_2x2_8x32x1_8x32x1_1x32x1x8_8_1x1_intrawave_v3,816.9,308.22,0.0
gfx942,304,14080,5120,5120,ck,0,0,886.9723,a8w8_blockscale_1x128x128_256x128x128x128_16x16_32x32_2x2_8x32x1_8x32x1_1x32x1x8_8_1x1_intrawave_v3,832.27,273.38,0.0
gfx942,304,14080,5120,12800,ck,0,0,2337.3746,a8w8_blockscale_1x128x128_256x128x128x128_16x16_32x32_2x2_8x32x1_8x32x1_1x32x1x8_8_1x1_intrawave_v3,789.56,166.83,0.0
gfx942,304,14208,5120,4096,ck,0,0,707.9767,a8w8_blockscale_1x128x128_256x128x128x128_16x16_32x32_2x2_8x32x1_8x32x1_1x32x1x8_8_1x1_intrawave_v3,841.73,317.32,0.0
gfx942,304,14208,5120,5120,ck,0,0,920.3739,a8w8_blockscale_1x128x128_256x128x128x128_16x16_32x32_2x2_8x32x1_8x32x1_1x32x1x8_8_1x1_intrawave_v3,809.35,265.6,0.0
gfx942,304,14208,5120,12800,ck,0,0,2419.0074,a8w8_blockscale_1x128x128_256x128x128x128_16x16_32x32_2x2_8x32x1_8x32x1_1x32x1x8_8_1x1_intrawave_v3,769.85,162.42,0.0
gfx942,304,14336,5120,4096,ck,0,0,739.138,a8w8_blockscale_1x128x128_256x128x128x128_16x16_32x32_2x2_8x32x1_8x32x1_1x32x1x8_8_1x1_intrawave_v3,813.51,306.43,0.0
gfx942,304,14336,5120,5120,ck,0,0,913.3619,a8w8_blockscale_1x128x128_256x128x128x128_16x16_32x32_2x2_8x32x1_8x32x1_1x32x1x8_8_1x1_intrawave_v3,822.92,269.79,0.0
gfx942,304,14336,5120,12800,ck,0,0,2442.1013,a8w8_blockscale_1x128x128_256x128x128x128_16x16_32x32_2x2_8x32x1_8x32x1_1x32x1x8_8_1x1_intrawave_v3,769.44,162.09,0.0
gfx942,304,14464,5120,4096,ck,0,0,736.3106,a8w8_blockscale_1x128x128_256x128x128x128_16x16_32x32_2x2_8x32x1_8x32x1_1x32x1x8_8_1x1_intrawave_v3,823.92,310.1,0.0
gfx942,304,14464,5120,5120,ck,0,0,931.711,a8w8_blockscale_1x128x128_256x128x128x128_16x16_32x32_2x2_8x32x1_8x32x1_1x32x1x8_8_1x1_intrawave_v3,813.91,266.59,0.0
gfx942,304,14464,5120,12800,ck,0,0,2432.6092,a8w8_blockscale_1x128x128_256x128x128x128_16x16_32x32_2x2_8x32x1_8x32x1_1x32x1x8_8_1x1_intrawave_v3,779.34,163.93,0.0
gfx942,304,14592,5120,4096,ck,0,0,744.2496,a8w8_blockscale_1x128x128_256x128x128x128_16x16_32x32_2x2_8x32x1_8x32x1_1x32x1x8_8_1x1_intrawave_v3,822.35,309.25,0.0
gfx942,304,14592,5120,5120,ck,0,0,936.0907,a8w8_blockscale_1x128x128_256x128x128x128_16x16_32x32_2x2_8x32x1_8x32x1_1x32x1x8_8_1x1_intrawave_v3,817.27,267.44,0.0
gfx942,304,14592,5120,12800,ck,0,0,2491.5151,a8w8_blockscale_1x128x128_256x128x128x128_16x16_32x32_2x2_8x32x1_8x32x1_1x32x1x8_8_1x1_intrawave_v3,767.65,161.24,0.0
gfx942,304,14720,5120,4096,ck,0,0,760.1177,a8w8_blockscale_1x128x128_256x128x128x128_16x16_32x32_2x2_8x32x1_8x32x1_1x32x1x8_8_1x1_intrawave_v3,812.24,305.21,0.0
gfx942,304,14720,5120,5120,ck,0,0,935.3508,a8w8_blockscale_1x128x128_256x128x128x128_16x16_32x32_2x2_8x32x1_8x32x1_1x32x1x8_8_1x1_intrawave_v3,825.09,269.75,0.0
gfx942,304,14720,5120,12800,ck,0,0,2531.3239,a8w8_blockscale_1x128x128_256x128x128x128_16x16_32x32_2x2_8x32x1_8x32x1_1x32x1x8_8_1x1_intrawave_v3,762.2,159.87,0.0
gfx942,304,14848,5120,4096,ck,0,0,763.6249,a8w8_blockscale_1x128x128_256x128x128x128_16x16_32x32_2x2_8x32x1_8x32x1_1x32x1x8_8_1x1_intrawave_v3,815.54,306.21,0.0
gfx942,304,14848,5120,5120,ck,0,0,949.9783,a8w8_blockscale_1x128x128_256x128x128x128_16x16_32x32_2x2_8x32x1_8x32x1_1x32x1x8_8_1x1_intrawave_v3,819.45,267.67,0.0
gfx942,304,14848,5120,12800,ck,0,0,2513.9922,a8w8_blockscale_1x128x128_256x128x128x128_16x16_32x32_2x2_8x32x1_8x32x1_1x32x1x8_8_1x1_intrawave_v3,774.13,162.15,0.0
gfx942,304,14976,5120,4096,ck,0,0,774.284,a8w8_blockscale_1x128x128_256x128x128x128_16x16_32x32_2x2_8x32x1_8x32x1_1x32x1x8_8_1x1_intrawave_v3,811.25,304.37,0.0
gfx942,304,14976,5120,5120,ck,0,0,946.4694,a8w8_blockscale_1x128x128_256x128x128x128_16x16_32x32_2x2_8x32x1_8x32x1_1x32x1x8_8_1x1_intrawave_v3,829.58,270.74,0.0
gfx942,304,14976,5120,12800,ck,0,0,2503.1786,a8w8_blockscale_1x128x128_256x128x128x128_16x16_32x32_2x2_8x32x1_8x32x1_1x32x1x8_8_1x1_intrawave_v3,784.18,164.02,0.0
gfx942,304,15104,5120,4096,ck,0,0,755.5764,a8w8_blockscale_1x128x128_256x128x128x128_16x16_32x32_2x2_8x32x1_8x32x1_1x32x1x8_8_1x1_intrawave_v3,838.44,314.33,0.0
gfx942,304,15104,5120,5120,ck,0,0,950.1577,a8w8_blockscale_1x128x128_256x128x128x128_16x16_32x32_2x2_8x32x1_8x32x1_1x32x1x8_8_1x1_intrawave_v3,833.42,271.76,0.0
gfx942,304,15104,5120,12800,ck,0,0,2612.4712,a8w8_blockscale_1x128x128_256x128x128x128_16x16_32x32_2x2_8x32x1_8x32x1_1x32x1x8_8_1x1_intrawave_v3,757.79,158.29,0.0
gfx942,304,15232,5120,4096,ck,0,0,776.4665,a8w8_blockscale_1x128x128_256x128x128x128_16x16_32x32_2x2_8x32x1_8x32x1_1x32x1x8_8_1x1_intrawave_v3,822.8,308.24,0.0
gfx942,304,15232,5120,5120,ck,0,0,976.854,a8w8_blockscale_1x128x128_256x128x128x128_16x16_32x32_2x2_8x32x1_8x32x1_1x32x1x8_8_1x1_intrawave_v3,817.52,266.34,0.0
gfx942,304,15232,5120,12800,ck,0,0,2601.4231,a8w8_blockscale_1x128x128_256x128x128x128_16x16_32x32_2x2_8x32x1_8x32x1_1x32x1x8_8_1x1_intrawave_v3,767.46,160.1,0.0
gfx942,304,15360,5120,4096,ck,0,0,788.5066,a8w8_blockscale_1x128x128_256x128x128x128_16x16_32x32_2x2_8x32x1_8x32x1_1x32x1x8_8_1x1_intrawave_v3,817.04,305.86,0.0
gfx942,304,15360,5120,5120,ck,0,0,992.5413,a8w8_blockscale_1x128x128_256x128x128x128_16x16_32x32_2x2_8x32x1_8x32x1_1x32x1x8_8_1x1_intrawave_v3,811.36,264.11,0.0
gfx942,304,15360,5120,12800,ck,0,0,2604.1547,a8w8_blockscale_1x128x128_256x128x128x128_16x16_32x32_2x2_8x32x1_8x32x1_1x32x1x8_8_1x1_intrawave_v3,773.1,161.06,0.0
gfx942,304,15488,5120,4096,ck,0,0,786.5437,a8w8_blockscale_1x128x128_256x128x128x128_16x16_32x32_2x2_8x32x1_8x32x1_1x32x1x8_8_1x1_intrawave_v3,825.91,308.96,0.0
gfx942,304,15488,5120,5120,ck,0,0,1007.7119,a8w8_blockscale_1x128x128_256x128x128x128_16x16_32x32_2x2_8x32x1_8x32x1_1x32x1x8_8_1x1_intrawave_v3,805.8,262.09,0.0
gfx942,304,15488,5120,12800,ck,0,0,2694.7921,a8w8_blockscale_1x128x128_256x128x128x128_16x16_32x32_2x2_8x32x1_8x32x1_1x32x1x8_8_1x1_intrawave_v3,753.32,156.74,0.0
gfx942,304,15616,5120,4096,ck,0,0,791.677,a8w8_blockscale_1x128x128_256x128x128x128_16x16_32x32_2x2_8x32x1_8x32x1_1x32x1x8_8_1x1_intrawave_v3,827.34,309.27,0.0
gfx942,304,15616,5120,5120,ck,0,0,998.7934,a8w8_blockscale_1x128x128_256x128x128x128_16x16_32x32_2x2_8x32x1_8x32x1_1x32x1x8_8_1x1_intrawave_v3,819.72,266.4,0.0
gfx942,304,15616,5120,12800,ck,0,0,2606.5912,a8w8_blockscale_1x128x128_256x128x128x128_16x16_32x32_2x2_8x32x1_8x32x1_1x32x1x8_8_1x1_intrawave_v3,785.25,163.17,0.0
gfx942,304,15744,5120,4096,ck,0,0,804.3785,a8w8_blockscale_1x128x128_256x128x128x128_16x16_32x32_2x2_8x32x1_8x32x1_1x32x1x8_8_1x1_intrawave_v3,820.95,306.67,0.0
gfx942,304,15744,5120,5120,ck,0,0,1006.6486,a8w8_blockscale_1x128x128_256x128x128x128_16x16_32x32_2x2_8x32x1_8x32x1_1x32x1x8_8_1x1_intrawave_v3,819.99,266.27,0.0
gfx942,304,15744,5120,12800,ck,0,0,2736.2299,a8w8_blockscale_1x128x128_256x128x128x128_16x16_32x32_2x2_8x32x1_8x32x1_1x32x1x8_8_1x1_intrawave_v3,754.18,156.52,0.0
gfx942,304,15872,5120,4096,ck,0,0,816.838,a8w8_blockscale_1x128x128_256x128x128x128_16x16_32x32_2x2_8x32x1_8x32x1_1x32x1x8_8_1x1_intrawave_v3,815.0,304.24,0.0
gfx942,304,15872,5120,5120,ck,0,0,1012.0212,a8w8_blockscale_1x128x128_256x128x128x128_16x16_32x32_2x2_8x32x1_8x32x1_1x32x1x8_8_1x1_intrawave_v3,822.27,266.8,0.0
gfx942,304,15872,5120,12800,ck,0,0,2706.456,a8w8_blockscale_1x128x128_256x128x128x128_16x16_32x32_2x2_8x32x1_8x32x1_1x32x1x8_8_1x1_intrawave_v3,768.67,159.33,0.0
gfx942,304,16000,5120,4096,ck,0,0,818.0913,a8w8_blockscale_1x128x128_256x128x128x128_16x16_32x32_2x2_8x32x1_8x32x1_1x32x1x8_8_1x1_intrawave_v3,820.31,306.01,0.0
gfx942,304,16000,5120,5120,ck,0,0,1018.2367,a8w8_blockscale_1x128x128_256x128x128x128_16x16_32x32_2x2_8x32x1_8x32x1_1x32x1x8_8_1x1_intrawave_v3,823.84,267.1,0.0
gfx942,304,16000,5120,12800,ck,0,0,2739.449,a8w8_blockscale_1x128x128_256x128x128x128_16x16_32x32_2x2_8x32x1_8x32x1_1x32x1x8_8_1x1_intrawave_v3,765.54,158.49,0.0
gfx942,304,16128,5120,4096,ck,0,0,813.615,a8w8_blockscale_1x128x128_256x128x128x128_16x16_32x32_2x2_8x32x1_8x32x1_1x32x1x8_8_1x1_intrawave_v3,831.42,309.95,0.0
gfx942,304,16128,5120,5120,ck,0,0,1041.2419,a8w8_blockscale_1x128x128_256x128x128x128_16x16_32x32_2x2_8x32x1_8x32x1_1x32x1x8_8_1x1_intrawave_v3,812.08,263.09,0.0
gfx942,304,16128,5120,12800,ck,0,0,2810.0817,a8w8_blockscale_1x128x128_256x128x128x128_16x16_32x32_2x2_8x32x1_8x32x1_1x32x1x8_8_1x1_intrawave_v3,752.27,155.56,0.0
gfx942,304,16256,5120,4096,ck,0,0,823.2509,a8w8_blockscale_1x128x128_256x128x128x128_16x16_32x32_2x2_8x32x1_8x32x1_1x32x1x8_8_1x1_intrawave_v3,828.21,308.55,0.0
gfx942,304,16256,5120,5120,ck,0,0,1039.7386,a8w8_blockscale_1x128x128_256x128x128x128_16x16_32x32_2x2_8x32x1_8x32x1_1x32x1x8_8_1x1_intrawave_v3,819.71,265.36,0.0
gfx942,304,16256,5120,12800,ck,0,0,2792.8009,a8w8_blockscale_1x128x128_256x128x128x128_16x16_32x32_2x2_8x32x1_8x32x1_1x32x1x8_8_1x1_intrawave_v3,762.93,157.57,0.0
gfx942,304,16384,5120,4096,ck,0,0,829.0603,a8w8_blockscale_1x128x128_256x128x128x128_16x16_32x32_2x2_8x32x1_8x32x1_1x32x1x8_8_1x1_intrawave_v3,828.88,308.61,0.0
gfx942,304,16384,5120,5120,ck,0,0,1035.0217,a8w8_blockscale_1x128x128_256x128x128x128_16x16_32x32_2x2_8x32x1_8x32x1_1x32x1x8_8_1x1_intrawave_v3,829.93,268.47,0.0
gfx942,304,16384,5120,12800,ck,0,0,2782.7934,a8w8_blockscale_1x128x128_256x128x128x128_16x16_32x32_2x2_8x32x1_8x32x1_1x32x1x8_8_1x1_intrawave_v3,771.7,159.2,0.0
gfx942,304,16512,5120,4096,ck,0,0,850.1126,a8w8_blockscale_1x128x128_256x128x128x128_16x16_32x32_2x2_8x32x1_8x32x1_1x32x1x8_8_1x1_intrawave_v3,814.67,303.12,0.0
gfx942,304,16512,5120,5120,ck,0,0,1051.162,a8w8_blockscale_1x128x128_256x128x128x128_16x16_32x32_2x2_8x32x1_8x32x1_1x32x1x8_8_1x1_intrawave_v3,823.57,266.22,0.0
gfx942,304,16512,5120,12800,ck,0,0,2784.2665,a8w8_blockscale_1x128x128_256x128x128x128_16x16_32x32_2x2_8x32x1_8x32x1_1x32x1x8_8_1x1_intrawave_v3,777.32,160.18,0.0
gfx942,304,16640,5120,4096,ck,0,0,846.2604,a8w8_blockscale_1x128x128_256x128x128x128_16x16_32x32_2x2_8x32x1_8x32x1_1x32x1x8_8_1x1_intrawave_v3,824.73,306.67,0.0
gfx942,304,16640,5120,5120,ck,0,0,1081.9504,a8w8_blockscale_1x128x128_256x128x128x128_16x16_32x32_2x2_8x32x1_8x32x1_1x32x1x8_8_1x1_intrawave_v3,806.34,260.46,0.0
gfx942,304,16640,5120,12800,ck,0,0,2848.2648,a8w8_blockscale_1x128x128_256x128x128x128_16x16_32x32_2x2_8x32x1_8x32x1_1x32x1x8_8_1x1_intrawave_v3,765.74,157.61,0.0
gfx942,304,16768,5120,4096,ck,0,0,857.9048,a8w8_blockscale_1x128x128_256x128x128x128_16x16_32x32_2x2_8x32x1_8x32x1_1x32x1x8_8_1x1_intrawave_v3,819.79,304.65,0.0
gfx942,304,16768,5120,5120,ck,0,0,1075.8539,a8w8_blockscale_1x128x128_256x128x128x128_16x16_32x32_2x2_8x32x1_8x32x1_1x32x1x8_8_1x1_intrawave_v3,817.14,263.76,0.0
gfx942,304,16768,5120,12800,ck,0,0,2845.5906,a8w8_blockscale_1x128x128_256x128x128x128_16x16_32x32_2x2_8x32x1_8x32x1_1x32x1x8_8_1x1_intrawave_v3,772.36,158.8,0.0
gfx942,304,16896,5120,4096,ck,0,0,855.7119,a8w8_blockscale_1x128x128_256x128x128x128_16x16_32x32_2x2_8x32x1_8x32x1_1x32x1x8_8_1x1_intrawave_v3,828.16,307.57,0.0
gfx942,304,16896,5120,5120,ck,0,0,1084.2646,a8w8_blockscale_1x128x128_256x128x128x128_16x16_32x32_2x2_8x32x1_8x32x1_1x32x1x8_8_1x1_intrawave_v3,816.99,263.53,0.0
gfx942,304,16896,5120,12800,ck,0,0,2874.8772,a8w8_blockscale_1x128x128_256x128x128x128_16x16_32x32_2x2_8x32x1_8x32x1_1x32x1x8_8_1x1_intrawave_v3,770.33,158.2,0.0
gfx942,304,17024,5120,4096,ck,0,0,872.4651,a8w8_blockscale_1x128x128_256x128x128x128_16x16_32x32_2x2_8x32x1_8x32x1_1x32x1x8_8_1x1_intrawave_v3,818.41,303.77,0.0
gfx942,304,17024,5120,5120,ck,0,0,1096.9568,a8w8_blockscale_1x128x128_256x128x128x128_16x16_32x32_2x2_8x32x1_8x32x1_1x32x1x8_8_1x1_intrawave_v3,813.66,262.27,0.0
gfx942,304,17024,5120,12800,ck,0,0,2847.433,a8w8_blockscale_1x128x128_256x128x128x128_16x16_32x32_2x2_8x32x1_8x32x1_1x32x1x8_8_1x1_intrawave_v3,783.64,160.77,0.0
gfx942,304,17152,5120,4096,ck,0,0,880.7266,a8w8_blockscale_1x128x128_256x128x128x128_16x16_32x32_2x2_8x32x1_8x32x1_1x32x1x8_8_1x1_intrawave_v3,816.83,303.0,0.0
gfx942,304,17152,5120,5120,ck,0,0,1087.3115,a8w8_blockscale_1x128x128_256x128x128x128_16x16_32x32_2x2_8x32x1_8x32x1_1x32x1x8_8_1x1_intrawave_v3,827.05,266.41,0.0
gfx942,304,17152,5120,12800,ck,0,0,2938.7467,a8w8_blockscale_1x128x128_256x128x128x128_16x16_32x32_2x2_8x32x1_8x32x1_1x32x1x8_8_1x1_intrawave_v3,765.0,156.77,0.0
gfx942,304,17280,5120,4096,ck,0,0,856.6166,a8w8_blockscale_1x128x128_256x128x128x128_16x16_32x32_2x2_8x32x1_8x32x1_1x32x1x8_8_1x1_intrawave_v3,846.09,313.67,0.0
gfx942,304,17280,5120,5120,ck,0,0,1097.6002,a8w8_blockscale_1x128x128_256x128x128x128_16x16_32x32_2x2_8x32x1_8x32x1_1x32x1x8_8_1x1_intrawave_v3,825.41,265.7,0.0
gfx942,304,17280,5120,12800,ck,0,0,2963.5033,a8w8_blockscale_1x128x128_256x128x128x128_16x16_32x32_2x2_8x32x1_8x32x1_1x32x1x8_8_1x1_intrawave_v3,764.27,156.46,0.0
gfx942,304,17408,5120,4096,ck,0,0,882.0798,a8w8_blockscale_1x128x128_256x128x128x128_16x16_32x32_2x2_8x32x1_8x32x1_1x32x1x8_8_1x1_intrawave_v3,827.75,306.7,0.0
gfx942,304,17408,5120,5120,ck,0,0,1105.5795,a8w8_blockscale_1x128x128_256x128x128x128_16x16_32x32_2x2_8x32x1_8x32x1_1x32x1x8_8_1x1_intrawave_v3,825.52,265.56,0.0
gfx942,304,17408,5120,12800,ck,0,0,3018.7787,a8w8_blockscale_1x128x128_256x128x128x128_16x16_32x32_2x2_8x32x1_8x32x1_1x32x1x8_8_1x1_intrawave_v3,755.84,154.57,0.0
gfx942,304,17536,5120,4096,ck,0,0,910.4248,a8w8_blockscale_1x128x128_256x128x128x128_16x16_32x32_2x2_8x32x1_8x32x1_1x32x1x8_8_1x1_intrawave_v3,807.88,299.17,0.0
gfx942,304,17536,5120,5120,ck,0,0,1121.0907,a8w8_blockscale_1x128x128_256x128x128x128_16x16_32x32_2x2_8x32x1_8x32x1_1x32x1x8_8_1x1_intrawave_v3,820.09,263.64,0.0
gfx942,304,17536,5120,12800,ck,0,0,2973.9666,a8w8_blockscale_1x128x128_256x128x128x128_16x16_32x32_2x2_8x32x1_8x32x1_1x32x1x8_8_1x1_intrawave_v3,772.87,157.89,0.0
gfx942,304,17664,5120,4096,ck,0,0,884.5103,a8w8_blockscale_1x128x128_256x128x128x128_16x16_32x32_2x2_8x32x1_8x32x1_1x32x1x8_8_1x1_intrawave_v3,837.62,310.01,0.0
gfx942,304,17664,5120,5120,ck,0,0,1123.1588,a8w8_blockscale_1x128x128_256x128x128x128_16x16_32x32_2x2_8x32x1_8x32x1_1x32x1x8_8_1x1_intrawave_v3,824.55,264.91,0.0
gfx942,304,17664,5120,12800,ck,0,0,3040.1925,a8w8_blockscale_1x128x128_256x128x128x128_16x16_32x32_2x2_8x32x1_8x32x1_1x32x1x8_8_1x1_intrawave_v3,761.55,155.42,0.0
gfx942,304,17792,5120,4096,ck,0,0,885.843,a8w8_blockscale_1x128x128_256x128x128x128_16x16_32x32_2x2_8x32x1_8x32x1_1x32x1x8_8_1x1_intrawave_v3,842.42,311.61,0.0
gfx942,304,17792,5120,5120,ck,0,0,1138.136,a8w8_blockscale_1x128x128_256x128x128x128_16x16_32x32_2x2_8x32x1_8x32x1_1x32x1x8_8_1x1_intrawave_v3,819.6,263.15,0.0
gfx942,304,17792,5120,12800,ck,0,0,3154.803,a8w8_blockscale_1x128x128_256x128x128x128_16x16_32x32_2x2_8x32x1_8x32x1_1x32x1x8_8_1x1_intrawave_v3,739.2,150.71,0.0
gfx942,304,17920,5120,4096,ck,0,0,909.6245,a8w8_blockscale_1x128x128_256x128x128x128_16x16_32x32_2x2_8x32x1_8x32x1_1x32x1x8_8_1x1_intrawave_v3,826.3,305.48,0.0
gfx942,304,17920,5120,5120,ck,0,0,1154.1657,a8w8_blockscale_1x128x128_256x128x128x128_16x16_32x32_2x2_8x32x1_8x32x1_1x32x1x8_8_1x1_intrawave_v3,814.03,261.2,0.0
gfx942,304,17920,5120,12800,ck,0,0,3004.4344,a8w8_blockscale_1x128x128_256x128x128x128_16x16_32x32_2x2_8x32x1_8x32x1_1x32x1x8_8_1x1_intrawave_v3,781.78,159.24,0.0
gfx942,304,18048,5120,4096,ck,0,0,928.3354,a8w8_blockscale_1x128x128_256x128x128x128_16x16_32x32_2x2_8x32x1_8x32x1_1x32x1x8_8_1x1_intrawave_v3,815.43,301.3,0.0
gfx942,304,18048,5120,5120,ck,0,0,1143.8886,a8w8_blockscale_1x128x128_256x128x128x128_16x16_32x32_2x2_8x32x1_8x32x1_1x32x1x8_8_1x1_intrawave_v3,827.21,265.26,0.0
gfx942,304,18048,5120,12800,ck,0,0,3121.0096,a8w8_blockscale_1x128x128_256x128x128x128_16x16_32x32_2x2_8x32x1_8x32x1_1x32x1x8_8_1x1_intrawave_v3,757.96,154.23,0.0
gfx942,304,18176,5120,4096,ck,0,0,924.3627,a8w8_blockscale_1x128x128_256x128x128x128_16x16_32x32_2x2_8x32x1_8x32x1_1x32x1x8_8_1x1_intrawave_v3,824.74,304.58,0.0
gfx942,304,18176,5120,5120,ck,0,0,1157.8034,a8w8_blockscale_1x128x128_256x128x128x128_16x16_32x32_2x2_8x32x1_8x32x1_1x32x1x8_8_1x1_intrawave_v3,823.06,263.77,0.0
gfx942,304,18176,5120,12800,ck,0,0,3075.7064,a8w8_blockscale_1x128x128_256x128x128x128_16x16_32x32_2x2_8x32x1_8x32x1_1x32x1x8_8_1x1_intrawave_v3,774.57,157.46,0.0
gfx942,304,18304,5120,4096,ck,0,0,927.8158,a8w8_blockscale_1x128x128_256x128x128x128_16x16_32x32_2x2_8x32x1_8x32x1_1x32x1x8_8_1x1_intrawave_v3,827.45,305.42,0.0
gfx942,304,18304,5120,5120,ck,0,0,1159.7634,a8w8_blockscale_1x128x128_256x128x128x128_16x16_32x32_2x2_8x32x1_8x32x1_1x32x1x8_8_1x1_intrawave_v3,827.46,265.02,0.0
gfx942,304,18304,5120,12800,ck,0,0,3139.7119,a8w8_blockscale_1x128x128_256x128x128x128_16x16_32x32_2x2_8x32x1_8x32x1_1x32x1x8_8_1x1_intrawave_v3,764.13,155.19,0.0
gfx942,304,18432,5120,4096,ck,0,0,929.1162,a8w8_blockscale_1x128x128_256x128x128x128_16x16_32x32_2x2_8x32x1_8x32x1_1x32x1x8_8_1x1_intrawave_v3,832.07,306.97,0.0
gfx942,304,18432,5120,5120,ck,0,0,1162.7731,a8w8_blockscale_1x128x128_256x128x128x128_16x16_32x32_2x2_8x32x1_8x32x1_1x32x1x8_8_1x1_intrawave_v3,831.09,266.03,0.0
gfx942,304,18432,5120,12800,ck,0,0,3159.3199,a8w8_blockscale_1x128x128_256x128x128x128_16x16_32x32_2x2_8x32x1_8x32x1_1x32x1x8_8_1x1_intrawave_v3,764.7,155.16,0.0
gfx942,304,18560,5120,4096,ck,0,0,961.9197,a8w8_blockscale_1x128x128_256x128x128x128_16x16_32x32_2x2_8x32x1_8x32x1_1x32x1x8_8_1x1_intrawave_v3,809.28,298.41,0.0
gfx942,304,18560,5120,5120,ck,0,0,1198.9032,a8w8_blockscale_1x128x128_256x128x128x128_16x16_32x32_2x2_8x32x1_8x32x1_1x32x1x8_8_1x1_intrawave_v3,811.64,259.65,0.0
gfx942,304,18560,5120,12800,ck,0,0,3281.7601,a8w8_blockscale_1x128x128_256x128x128x128_16x16_32x32_2x2_8x32x1_8x32x1_1x32x1x8_8_1x1_intrawave_v3,741.28,150.27,0.0
gfx942,304,18688,5120,4096,ck,0,0,934.316,a8w8_blockscale_1x128x128_256x128x128x128_16x16_32x32_2x2_8x32x1_8x32x1_1x32x1x8_8_1x1_intrawave_v3,838.94,309.19,0.0
gfx942,304,18688,5120,5120,ck,0,0,1211.7068,a8w8_blockscale_1x128x128_256x128x128x128_16x16_32x32_2x2_8x32x1_8x32x1_1x32x1x8_8_1x1_intrawave_v3,808.6,258.53,0.0
gfx942,304,18688,5120,12800,ck,0,0,3209.1442,a8w8_blockscale_1x128x128_256x128x128x128_16x16_32x32_2x2_8x32x1_8x32x1_1x32x1x8_8_1x1_intrawave_v3,763.28,154.59,0.0
gfx942,304,18816,5120,4096,ck,0,0,954.4712,a8w8_blockscale_1x128x128_256x128x128x128_16x16_32x32_2x2_8x32x1_8x32x1_1x32x1x8_8_1x1_intrawave_v3,826.85,304.59,0.0
gfx942,304,18816,5120,5120,ck,0,0,1213.2027,a8w8_blockscale_1x128x128_256x128x128x128_16x16_32x32_2x2_8x32x1_8x32x1_1x32x1x8_8_1x1_intrawave_v3,813.14,259.83,0.0
gfx942,304,18816,5120,12800,ck,0,0,3169.2669,a8w8_blockscale_1x128x128_256x128x128x128_16x16_32x32_2x2_8x32x1_8x32x1_1x32x1x8_8_1x1_intrawave_v3,778.18,157.47,0.0
gfx942,304,18944,5120,4096,ck,0,0,962.0559,a8w8_blockscale_1x128x128_256x128x128x128_16x16_32x32_2x2_8x32x1_8x32x1_1x32x1x8_8_1x1_intrawave_v3,825.91,304.09,0.0
gfx942,304,18944,5120,5120,ck,0,0,1197.8771,a8w8_blockscale_1x128x128_256x128x128x128_16x16_32x32_2x2_8x32x1_8x32x1_1x32x1x8_8_1x1_intrawave_v3,829.14,264.8,0.0
gfx942,304,18944,5120,12800,ck,0,0,3207.5249,a8w8_blockscale_1x128x128_256x128x128x128_16x16_32x32_2x2_8x32x1_8x32x1_1x32x1x8_8_1x1_intrawave_v3,774.13,156.51,0.0
gfx942,304,19072,5120,4096,ck,0,0,959.9415,a8w8_blockscale_1x128x128_256x128x128x128_16x16_32x32_2x2_8x32x1_8x32x1_1x32x1x8_8_1x1_intrawave_v3,833.32,306.67,0.0
gfx942,304,19072,5120,5120,ck,0,0,1227.5313,a8w8_blockscale_1x128x128_256x128x128x128_16x16_32x32_2x2_8x32x1_8x32x1_1x32x1x8_8_1x1_intrawave_v3,814.58,260.0,0.0
gfx942,304,19072,5120,12800,ck,0,0,3216.0968,a8w8_blockscale_1x128x128_256x128x128x128_16x16_32x32_2x2_8x32x1_8x32x1_1x32x1x8_8_1x1_intrawave_v3,777.28,157.01,0.0
gfx942,304,19200,5120,4096,ck,0,0,976.097,a8w8_blockscale_1x128x128_256x128x128x128_16x16_32x32_2x2_8x32x1_8x32x1_1x32x1x8_8_1x1_intrawave_v3,825.03,303.48,0.0
gfx942,304,19200,5120,5120,ck,0,0,1244.7519,a8w8_blockscale_1x128x128_256x128x128x128_16x16_32x32_2x2_8x32x1_8x32x1_1x32x1x8_8_1x1_intrawave_v3,808.7,257.98,0.0
gfx942,304,19200,5120,12800,ck,0,0,3271.9926,a8w8_blockscale_1x128x128_256x128x128x128_16x16_32x32_2x2_8x32x1_8x32x1_1x32x1x8_8_1x1_intrawave_v3,769.13,155.23,0.0
gfx942,304,19328,5120,4096,ck,0,0,986.0452,a8w8_blockscale_1x128x128_256x128x128x128_16x16_32x32_2x2_8x32x1_8x32x1_1x32x1x8_8_1x1_intrawave_v3,822.15,302.28,0.0
gfx942,304,19328,5120,5120,ck,0,0,1249.1781,a8w8_blockscale_1x128x128_256x128x128x128_16x16_32x32_2x2_8x32x1_8x32x1_1x32x1x8_8_1x1_intrawave_v3,811.21,258.64,0.0
gfx942,304,19328,5120,12800,ck,0,0,3339.3819,a8w8_blockscale_1x128x128_256x128x128x128_16x16_32x32_2x2_8x32x1_8x32x1_1x32x1x8_8_1x1_intrawave_v3,758.63,152.98,0.0
gfx942,304,19456,5120,4096,ck,0,0,996.7715,a8w8_blockscale_1x128x128_256x128x128x128_16x16_32x32_2x2_8x32x1_8x32x1_1x32x1x8_8_1x1_intrawave_v3,818.69,300.86,0.0
gfx942,304,19456,5120,5120,ck,0,0,1233.5061,a8w8_blockscale_1x128x128_256x128x128x128_16x16_32x32_2x2_8x32x1_8x32x1_1x32x1x8_8_1x1_intrawave_v3,826.96,263.52,0.0
gfx942,304,19456,5120,12800,ck,0,0,3259.7992,a8w8_blockscale_1x128x128_256x128x128x128_16x16_32x32_2x2_8x32x1_8x32x1_1x32x1x8_8_1x1_intrawave_v3,782.3,157.62,0.0
gfx942,304,19584,5120,4096,ck,0,0,1010.0887,a8w8_blockscale_1x128x128_256x128x128x128_16x16_32x32_2x2_8x32x1_8x32x1_1x32x1x8_8_1x1_intrawave_v3,813.21,298.71,0.0
gfx942,304,19584,5120,5120,ck,0,0,1248.3044,a8w8_blockscale_1x128x128_256x128x128x128_16x16_32x32_2x2_8x32x1_8x32x1_1x32x1x8_8_1x1_intrawave_v3,822.53,261.98,0.0
gfx942,304,19584,5120,12800,ck,0,0,3315.1749,a8w8_blockscale_1x128x128_256x128x128x128_16x16_32x32_2x2_8x32x1_8x32x1_1x32x1x8_8_1x1_intrawave_v3,774.29,155.87,0.0
gfx942,304,19712,5120,4096,ck,0,0,996.2572,a8w8_blockscale_1x128x128_256x128x128x128_16x16_32x32_2x2_8x32x1_8x32x1_1x32x1x8_8_1x1_intrawave_v3,829.89,304.7,0.0
gfx942,304,19712,5120,5120,ck,0,0,1259.7551,a8w8_blockscale_1x128x128_256x128x128x128_16x16_32x32_2x2_8x32x1_8x32x1_1x32x1x8_8_1x1_intrawave_v3,820.38,261.15,0.0
gfx942,304,19712,5120,12800,ck,0,0,3383.9339,a8w8_blockscale_1x128x128_256x128x128x128_16x16_32x32_2x2_8x32x1_8x32x1_1x32x1x8_8_1x1_intrawave_v3,763.52,153.58,0.0
gfx942,304,19840,5120,4096,ck,0,0,1015.3512,a8w8_blockscale_1x128x128_256x128x128x128_16x16_32x32_2x2_8x32x1_8x32x1_1x32x1x8_8_1x1_intrawave_v3,819.57,300.78,0.0
gfx942,304,19840,5120,5120,ck,0,0,1246.1019,a8w8_blockscale_1x128x128_256x128x128x128_16x16_32x32_2x2_8x32x1_8x32x1_1x32x1x8_8_1x1_intrawave_v3,834.75,265.59,0.0
gfx942,304,19840,5120,12800,ck,0,0,3405.5871,a8w8_blockscale_1x128x128_256x128x128x128_16x16_32x32_2x2_8x32x1_8x32x1_1x32x1x8_8_1x1_intrawave_v3,763.59,153.47,0.0
gfx942,304,19968,5120,4096,ck,0,0,1023.91,a8w8_blockscale_1x128x128_256x128x128x128_16x16_32x32_2x2_8x32x1_8x32x1_1x32x1x8_8_1x1_intrawave_v3,817.96,300.06,0.0
gfx942,304,19968,5120,5120,ck,0,0,1260.9498,a8w8_blockscale_1x128x128_256x128x128x128_16x16_32x32_2x2_8x32x1_8x32x1_1x32x1x8_8_1x1_intrawave_v3,830.25,264.03,0.0
gfx942,304,19968,5120,12800,ck,0,0,3408.5651,a8w8_blockscale_1x128x128_256x128x128x128_16x16_32x32_2x2_8x32x1_8x32x1_1x32x1x8_8_1x1_intrawave_v3,767.84,154.2,0.0
gfx942,304,20096,5120,4096,ck,0,0,1020.9717,a8w8_blockscale_1x128x128_256x128x128x128_16x16_32x32_2x2_8x32x1_8x32x1_1x32x1x8_8_1x1_intrawave_v3,825.57,302.72,0.0
gfx942,304,20096,5120,5120,ck,0,0,1292.6678,a8w8_blockscale_1x128x128_256x128x128x128_16x16_32x32_2x2_8x32x1_8x32x1_1x32x1x8_8_1x1_intrawave_v3,815.07,259.07,0.0
gfx942,304,20096,5120,12800,ck,0,0,3376.4726,a8w8_blockscale_1x128x128_256x128x128x128_16x16_32x32_2x2_8x32x1_8x32x1_1x32x1x8_8_1x1_intrawave_v3,780.11,156.54,0.0
gfx942,304,20224,5120,4096,ck,0,0,1004.2049,a8w8_blockscale_1x128x128_256x128x128x128_16x16_32x32_2x2_8x32x1_8x32x1_1x32x1x8_8_1x1_intrawave_v3,844.7,309.6,0.0
gfx942,304,20224,5120,5120,ck,0,0,1318.2962,a8w8_blockscale_1x128x128_256x128x128x128_16x16_32x32_2x2_8x32x1_8x32x1_1x32x1x8_8_1x1_intrawave_v3,804.31,255.52,0.0
gfx942,304,20224,5120,12800,ck,0,0,3456.6541,a8w8_blockscale_1x128x128_256x128x128x128_16x16_32x32_2x2_8x32x1_8x32x1_1x32x1x8_8_1x1_intrawave_v3,766.87,153.76,0.0
gfx942,304,20352,5120,4096,ck,0,0,1026.309,a8w8_blockscale_1x128x128_256x128x128x128_16x16_32x32_2x2_8x32x1_8x32x1_1x32x1x8_8_1x1_intrawave_v3,831.74,304.72,0.0
gfx942,304,20352,5120,5120,ck,0,0,1317.8673,a8w8_blockscale_1x128x128_256x128x128x128_16x16_32x32_2x2_8x32x1_8x32x1_1x32x1x8_8_1x1_intrawave_v3,809.66,257.1,0.0
gfx942,304,20352,5120,12800,ck,0,0,3502.6284,a8w8_blockscale_1x128x128_256x128x128x128_16x16_32x32_2x2_8x32x1_8x32x1_1x32x1x8_8_1x1_intrawave_v3,761.59,152.58,0.0
gfx942,304,20480,5120,4096,ck,0,0,1018.7682,a8w8_blockscale_1x128x128_256x128x128x128_16x16_32x32_2x2_8x32x1_8x32x1_1x32x1x8_8_1x1_intrawave_v3,843.17,308.78,0.0
gfx942,304,20480,5120,5120,ck,0,0,1304.6369,a8w8_blockscale_1x128x128_256x128x128x128_16x16_32x32_2x2_8x32x1_8x32x1_1x32x1x8_8_1x1_intrawave_v3,823.02,261.21,0.0
gfx942,304,20480,5120,12800,ck,0,0,3465.3114,a8w8_blockscale_1x128x128_256x128x128x128_16x16_32x32_2x2_8x32x1_8x32x1_1x32x1x8_8_1x1_intrawave_v3,774.64,155.08,0.0
gfx942,304,20608,5120,4096,ck,0,0,1042.2222,a8w8_blockscale_1x128x128_256x128x128x128_16x16_32x32_2x2_8x32x1_8x32x1_1x32x1x8_8_1x1_intrawave_v3,829.35,303.59,0.0
gfx942,304,20608,5120,5120,ck,0,0,1314.1128,a8w8_blockscale_1x128x128_256x128x128x128_16x16_32x32_2x2_8x32x1_8x32x1_1x32x1x8_8_1x1_intrawave_v3,822.19,260.82,0.0
gfx942,304,20608,5120,12800,ck,0,0,3655.6858,a8w8_blockscale_1x128x128_256x128x128x128_16x16_32x32_2x2_8x32x1_8x32x1_1x32x1x8_8_1x1_intrawave_v3,738.89,147.81,0.0
gfx942,304,20736,5120,4096,ck,0,0,1069.7519,a8w8_blockscale_1x128x128_256x128x128x128_16x16_32x32_2x2_8x32x1_8x32x1_1x32x1x8_8_1x1_intrawave_v3,813.02,297.49,0.0
gfx942,304,20736,5120,5120,ck,0,0,1340.1657,a8w8_blockscale_1x128x128_256x128x128x128_16x16_32x32_2x2_8x32x1_8x32x1_1x32x1x8_8_1x1_intrawave_v3,811.22,257.22,0.0
gfx942,304,20736,5120,12800,ck,0,0,3603.2721,a8w8_blockscale_1x128x128_256x128x128x128_16x16_32x32_2x2_8x32x1_8x32x1_1x32x1x8_8_1x1_intrawave_v3,754.29,150.78,0.0
gfx942,304,20864,5120,4096,ck,0,0,1059.7177,a8w8_blockscale_1x128x128_256x128x128x128_16x16_32x32_2x2_8x32x1_8x32x1_1x32x1x8_8_1x1_intrawave_v3,825.79,302.04,0.0
gfx942,304,20864,5120,5120,ck,0,0,1350.0137,a8w8_blockscale_1x128x128_256x128x128x128_16x16_32x32_2x2_8x32x1_8x32x1_1x32x1x8_8_1x1_intrawave_v3,810.27,256.8,0.0
gfx942,304,20864,5120,12800,ck,0,0,3649.2886,a8w8_blockscale_1x128x128_256x128x128x128_16x16_32x32_2x2_8x32x1_8x32x1_1x32x1x8_8_1x1_intrawave_v3,749.38,149.68,0.0
gfx942,304,20992,5120,4096,ck,0,0,1066.4297,a8w8_blockscale_1x128x128_256x128x128x128_16x16_32x32_2x2_8x32x1_8x32x1_1x32x1x8_8_1x1_intrawave_v3,825.62,301.86,0.0
gfx942,304,20992,5120,5120,ck,0,0,1324.1599,a8w8_blockscale_1x128x128_256x128x128x128_16x16_32x32_2x2_8x32x1_8x32x1_1x32x1x8_8_1x1_intrawave_v3,831.16,263.3,0.0
gfx942,304,20992,5120,12800,ck,0,0,3579.2311,a8w8_blockscale_1x128x128_256x128x128x128_16x16_32x32_2x2_8x32x1_8x32x1_1x32x1x8_8_1x1_intrawave_v3,768.73,153.44,0.0
gfx942,304,21120,5120,4096,ck,0,0,1063.1492,a8w8_blockscale_1x128x128_256x128x128x128_16x16_32x32_2x2_8x32x1_8x32x1_1x32x1x8_8_1x1_intrawave_v3,833.22,304.52,0.0
gfx942,304,21120,5120,5120,ck,0,0,1364.667,a8w8_blockscale_1x128x128_256x128x128x128_16x16_32x32_2x2_8x32x1_8x32x1_1x32x1x8_8_1x1_intrawave_v3,811.4,256.93,0.0
gfx942,304,21120,5120,12800,ck,0,0,3583.8031,a8w8_blockscale_1x128x128_256x128x128x128_16x16_32x32_2x2_8x32x1_8x32x1_1x32x1x8_8_1x1_intrawave_v3,772.43,154.07,0.0
gfx942,304,21248,5120,4096,ck,0,0,1088.5027,a8w8_blockscale_1x128x128_256x128x128x128_16x16_32x32_2x2_8x32x1_8x32x1_1x32x1x8_8_1x1_intrawave_v3,818.74,299.11,0.0
gfx942,304,21248,5120,5120,ck,0,0,1366.6921,a8w8_blockscale_1x128x128_256x128x128x128_16x16_32x32_2x2_8x32x1_8x32x1_1x32x1x8_8_1x1_intrawave_v3,815.11,257.98,0.0
gfx942,304,21248,5120,12800,ck,0,0,3683.2436,a8w8_blockscale_1x128x128_256x128x128x128_16x16_32x32_2x2_8x32x1_8x32x1_1x32x1x8_8_1x1_intrawave_v3,756.13,150.71,0.0
gfx942,304,21376,5120,4096,ck,0,0,1083.3667,a8w8_blockscale_1x128x128_256x128x128x128_16x16_32x32_2x2_8x32x1_8x32x1_1x32x1x8_8_1x1_intrawave_v3,827.58,302.22,0.0
gfx942,304,21376,5120,5120,ck,0,0,1363.2926,a8w8_blockscale_1x128x128_256x128x128x128_16x16_32x32_2x2_8x32x1_8x32x1_1x32x1x8_8_1x1_intrawave_v3,822.07,260.07,0.0
gfx942,304,21376,5120,12800,ck,0,0,3656.3183,a8w8_blockscale_1x128x128_256x128x128x128_16x16_32x32_2x2_8x32x1_8x32x1_1x32x1x8_8_1x1_intrawave_v3,766.29,152.62,0.0
gfx942,304,21504,5120,4096,ck,0,0,1094.2896,a8w8_blockscale_1x128x128_256x128x128x128_16x16_32x32_2x2_8x32x1_8x32x1_1x32x1x8_8_1x1_intrawave_v3,824.23,300.88,0.0
gfx942,304,21504,5120,5120,ck,0,0,1395.924,a8w8_blockscale_1x128x128_256x128x128x128_16x16_32x32_2x2_8x32x1_8x32x1_1x32x1x8_8_1x1_intrawave_v3,807.66,255.4,0.0
gfx942,304,21504,5120,12800,ck,0,0,3721.6536,a8w8_blockscale_1x128x128_256x128x128x128_16x16_32x32_2x2_8x32x1_8x32x1_1x32x1x8_8_1x1_intrawave_v3,757.34,150.74,0.0
gfx942,304,21632,5120,4096,ck,0,0,1086.9951,a8w8_blockscale_1x128x128_256x128x128x128_16x16_32x32_2x2_8x32x1_8x32x1_1x32x1x8_8_1x1_intrawave_v3,834.7,304.59,0.0
gfx942,304,21632,5120,5120,ck,0,0,1369.8265,a8w8_blockscale_1x128x128_256x128x128x128_16x16_32x32_2x2_8x32x1_8x32x1_1x32x1x8_8_1x1_intrawave_v3,827.94,261.7,0.0
gfx942,304,21632,5120,12800,ck,0,0,3632.1391,a8w8_blockscale_1x128x128_256x128x128x128_16x16_32x32_2x2_8x32x1_8x32x1_1x32x1x8_8_1x1_intrawave_v3,780.63,155.26,0.0
gfx942,304,21760,5120,4096,ck,0,0,1108.1196,a8w8_blockscale_1x128x128_256x128x128x128_16x16_32x32_2x2_8x32x1_8x32x1_1x32x1x8_8_1x1_intrawave_v3,823.63,300.44,0.0
gfx942,304,21760,5120,5120,ck,0,0,1410.3063,a8w8_blockscale_1x128x128_256x128x128x128_16x16_32x32_2x2_8x32x1_8x32x1_1x32x1x8_8_1x1_intrawave_v3,808.94,255.58,0.0
gfx942,304,21760,5120,12800,ck,0,0,3663.9991,a8w8_blockscale_1x128x128_256x128x128x128_16x16_32x32_2x2_8x32x1_8x32x1_1x32x1x8_8_1x1_intrawave_v3,778.42,154.72,0.0
gfx942,304,21888,5120,4096,ck,0,0,1079.9724,a8w8_blockscale_1x128x128_256x128x128x128_16x16_32x32_2x2_8x32x1_8x32x1_1x32x1x8_8_1x1_intrawave_v3,850.07,309.97,0.0
gfx942,304,21888,5120,5120,ck,0,0,1426.1843,a8w8_blockscale_1x128x128_256x128x128x128_16x16_32x32_2x2_8x32x1_8x32x1_1x32x1x8_8_1x1_intrawave_v3,804.64,254.11,0.0
gfx942,304,21888,5120,12800,ck,0,0,3885.4079,a8w8_blockscale_1x128x128_256x128x128x128_16x16_32x32_2x2_8x32x1_8x32x1_1x32x1x8_8_1x1_intrawave_v3,738.38,146.66,0.0
gfx942,304,22016,5120,4096,ck,0,0,1121.8912,a8w8_blockscale_1x128x128_256x128x128x128_16x16_32x32_2x2_8x32x1_8x32x1_1x32x1x8_8_1x1_intrawave_v3,823.09,300.02,0.0
gfx942,304,22016,5120,5120,ck,0,0,1388.5554,a8w8_blockscale_1x128x128_256x128x128x128_16x16_32x32_2x2_8x32x1_8x32x1_1x32x1x8_8_1x1_intrawave_v3,831.28,262.42,0.0
gfx942,304,22016,5120,12800,ck,0,0,3782.4994,a8w8_blockscale_1x128x128_256x128x128x128_16x16_32x32_2x2_8x32x1_8x32x1_1x32x1x8_8_1x1_intrawave_v3,762.9,151.43,0.0
gfx942,304,22144,5120,4096,ck,0,0,1120.286,a8w8_blockscale_1x128x128_256x128x128x128_16x16_32x32_2x2_8x32x1_8x32x1_1x32x1x8_8_1x1_intrawave_v3,829.06,302.09,0.0
gfx942,304,22144,5120,5120,ck,0,0,1414.9764,a8w8_blockscale_1x128x128_256x128x128x128_16x16_32x32_2x2_8x32x1_8x32x1_1x32x1x8_8_1x1_intrawave_v3,820.5,258.91,0.0
gfx942,304,22144,5120,12800,ck,0,0,3814.2546,a8w8_blockscale_1x128x128_256x128x128x128_16x16_32x32_2x2_8x32x1_8x32x1_1x32x1x8_8_1x1_intrawave_v3,760.95,150.94,0.0
gfx942,304,22272,5120,4096,ck,0,0,1137.9368,a8w8_blockscale_1x128x128_256x128x128x128_16x16_32x32_2x2_8x32x1_8x32x1_1x32x1x8_8_1x1_intrawave_v3,820.92,299.02,0.0
gfx942,304,22272,5120,5120,ck,0,0,1431.1028,a8w8_blockscale_1x128x128_256x128x128x128_16x16_32x32_2x2_8x32x1_8x32x1_1x32x1x8_8_1x1_intrawave_v3,815.94,257.36,0.0
gfx942,304,22272,5120,12800,ck,0,0,3781.6588,a8w8_blockscale_1x128x128_256x128x128x128_16x16_32x32_2x2_8x32x1_8x32x1_1x32x1x8_8_1x1_intrawave_v3,771.95,153.02,0.0
gfx942,304,22400,5120,4096,ck,0,0,1115.6515,a8w8_blockscale_1x128x128_256x128x128x128_16x16_32x32_2x2_8x32x1_8x32x1_1x32x1x8_8_1x1_intrawave_v3,842.13,306.64,0.0
gfx942,304,22400,5120,5120,ck,0,0,1413.7605,a8w8_blockscale_1x128x128_256x128x128x128_16x16_32x32_2x2_8x32x1_8x32x1_1x32x1x8_8_1x1_intrawave_v3,830.7,261.91,0.0
gfx942,304,22400,5120,12800,ck,0,0,3872.9648,a8w8_blockscale_1x128x128_256x128x128x128_16x16_32x32_2x2_8x32x1_8x32x1_1x32x1x8_8_1x1_intrawave_v3,758.08,150.18,0.0
gfx942,304,22528,5120,4096,ck,0,0,1125.4163,a8w8_blockscale_1x128x128_256x128x128x128_16x16_32x32_2x2_8x32x1_8x32x1_1x32x1x8_8_1x1_intrawave_v3,839.59,305.61,0.0
gfx942,304,22528,5120,5120,ck,0,0,1452.5433,a8w8_blockscale_1x128x128_256x128x128x128_16x16_32x32_2x2_8x32x1_8x32x1_1x32x1x8_8_1x1_intrawave_v3,813.14,256.27,0.0
gfx942,304,22528,5120,12800,ck,0,0,3768.0261,a8w8_blockscale_1x128x128_256x128x128x128_16x16_32x32_2x2_8x32x1_8x32x1_1x32x1x8_8_1x1_intrawave_v3,783.64,155.14,0.0
gfx942,304,22656,5120,4096,ck,0,0,1157.4034,a8w8_blockscale_1x128x128_256x128x128x128_16x16_32x32_2x2_8x32x1_8x32x1_1x32x1x8_8_1x1_intrawave_v3,821.03,298.74,0.0
gfx942,304,22656,5120,5120,ck,0,0,1432.3287,a8w8_blockscale_1x128x128_256x128x128x128_16x16_32x32_2x2_8x32x1_8x32x1_1x32x1x8_8_1x1_intrawave_v3,829.3,261.26,0.0
gfx942,304,22656,5120,12800,ck,0,0,3805.6748,a8w8_blockscale_1x128x128_256x128x128x128_16x16_32x32_2x2_8x32x1_8x32x1_1x32x1x8_8_1x1_intrawave_v3,780.3,154.38,0.0
gfx942,304,22784,5120,4096,ck,0,0,1170.8058,a8w8_blockscale_1x128x128_256x128x128x128_16x16_32x32_2x2_8x32x1_8x32x1_1x32x1x8_8_1x1_intrawave_v3,816.22,296.89,0.0
gfx942,304,22784,5120,5120,ck,0,0,1444.4072,a8w8_blockscale_1x128x128_256x128x128x128_16x16_32x32_2x2_8x32x1_8x32x1_1x32x1x8_8_1x1_intrawave_v3,827.01,260.44,0.0
gfx942,304,22784,5120,12800,ck,0,0,3829.205,a8w8_blockscale_1x128x128_256x128x128x128_16x16_32x32_2x2_8x32x1_8x32x1_1x32x1x8_8_1x1_intrawave_v3,779.89,154.2,0.0
gfx942,304,22912,5120,4096,ck,0,0,1161.5341,a8w8_blockscale_1x128x128_256x128x128x128_16x16_32x32_2x2_8x32x1_8x32x1_1x32x1x8_8_1x1_intrawave_v3,827.35,300.84,0.0
gfx942,304,22912,5120,5120,ck,0,0,1483.6232,a8w8_blockscale_1x128x128_256x128x128x128_16x16_32x32_2x2_8x32x1_8x32x1_1x32x1x8_8_1x1_intrawave_v3,809.67,254.88,0.0
gfx942,304,22912,5120,12800,ck,0,0,3981.3323,a8w8_blockscale_1x128x128_256x128x128x128_16x16_32x32_2x2_8x32x1_8x32x1_1x32x1x8_8_1x1_intrawave_v3,754.3,149.05,0.0
gfx942,304,23040,5120,4096,ck,0,0,1149.7325,a8w8_blockscale_1x128x128_256x128x128x128_16x16_32x32_2x2_8x32x1_8x32x1_1x32x1x8_8_1x1_intrawave_v3,840.52,305.53,0.0
gfx942,304,23040,5120,5120,ck,0,0,1492.5339,a8w8_blockscale_1x128x128_256x128x128x128_16x16_32x32_2x2_8x32x1_8x32x1_1x32x1x8_8_1x1_intrawave_v3,809.33,254.67,0.0
gfx942,304,23040,5120,12800,ck,0,0,3985.5529,a8w8_blockscale_1x128x128_256x128x128x128_16x16_32x32_2x2_8x32x1_8x32x1_1x32x1x8_8_1x1_intrawave_v3,757.71,149.63,0.0
gfx942,304,23168,5120,4096,ck,0,0,1156.5338,a8w8_blockscale_1x128x128_256x128x128x128_16x16_32x32_2x2_8x32x1_8x32x1_1x32x1x8_8_1x1_intrawave_v3,840.21,305.32,0.0
gfx942,304,23168,5120,5120,ck,0,0,1489.5171,a8w8_blockscale_1x128x128_256x128x128x128_16x16_32x32_2x2_8x32x1_8x32x1_1x32x1x8_8_1x1_intrawave_v3,815.48,256.51,0.0
gfx942,304,23168,5120,12800,ck,0,0,4009.1419,a8w8_blockscale_1x128x128_256x128x128x128_16x16_32x32_2x2_8x32x1_8x32x1_1x32x1x8_8_1x1_intrawave_v3,757.44,149.49,0.0
gfx942,304,23296,5120,4096,ck,0,0,1194.5052,a8w8_blockscale_1x128x128_256x128x128x128_16x16_32x32_2x2_8x32x1_8x32x1_1x32x1x8_8_1x1_intrawave_v3,818.0,297.15,0.0
gfx942,304,23296,5120,5120,ck,0,0,1485.6061,a8w8_blockscale_1x128x128_256x128x128x128_16x16_32x32_2x2_8x32x1_8x32x1_1x32x1x8_8_1x1_intrawave_v3,822.14,258.51,0.0
gfx942,304,23296,5120,12800,ck,0,0,3975.4984,a8w8_blockscale_1x128x128_256x128x128x128_16x16_32x32_2x2_8x32x1_8x32x1_1x32x1x8_8_1x1_intrawave_v3,768.07,151.5,0.0
gfx942,304,23424,5120,4096,ck,0,0,1194.0362,a8w8_blockscale_1x128x128_256x128x128x128_16x16_32x32_2x2_8x32x1_8x32x1_1x32x1x8_8_1x1_intrawave_v3,822.82,298.8,0.0
gfx942,304,23424,5120,5120,ck,0,0,1471.7935,a8w8_blockscale_1x128x128_256x128x128x128_16x16_32x32_2x2_8x32x1_8x32x1_1x32x1x8_8_1x1_intrawave_v3,834.42,262.27,0.0
gfx942,304,23424,5120,12800,ck,0,0,4033.1403,a8w8_blockscale_1x128x128_256x128x128x128_16x16_32x32_2x2_8x32x1_8x32x1_1x32x1x8_8_1x1_intrawave_v3,761.25,150.06,0.0
gfx942,304,23552,5120,4096,ck,0,0,1198.6679,a8w8_blockscale_1x128x128_256x128x128x128_16x16_32x32_2x2_8x32x1_8x32x1_1x32x1x8_8_1x1_intrawave_v3,824.12,299.18,0.0
gfx942,304,23552,5120,5120,ck,0,0,1507.4506,a8w8_blockscale_1x128x128_256x128x128x128_16x16_32x32_2x2_8x32x1_8x32x1_1x32x1x8_8_1x1_intrawave_v3,819.13,257.37,0.0
gfx942,304,23552,5120,12800,ck,0,0,4010.9306,a8w8_blockscale_1x128x128_256x128x128x128_16x16_32x32_2x2_8x32x1_8x32x1_1x32x1x8_8_1x1_intrawave_v3,769.65,151.63,0.0
gfx942,304,23680,5120,4096,ck,0,0,1203.1558,a8w8_blockscale_1x128x128_256x128x128x128_16x16_32x32_2x2_8x32x1_8x32x1_1x32x1x8_8_1x1_intrawave_v3,825.51,299.59,0.0
gfx942,304,23680,5120,5120,ck,0,0,1495.1898,a8w8_blockscale_1x128x128_256x128x128x128_16x16_32x32_2x2_8x32x1_8x32x1_1x32x1x8_8_1x1_intrawave_v3,830.34,260.8,0.0
gfx942,304,23680,5120,12800,ck,0,0,4078.9543,a8w8_blockscale_1x128x128_256x128x128x128_16x16_32x32_2x2_8x32x1_8x32x1_1x32x1x8_8_1x1_intrawave_v3,760.93,149.82,0.0
gfx942,304,23808,5120,4096,ck,0,0,1185.6606,a8w8_blockscale_1x128x128_256x128x128x128_16x16_32x32_2x2_8x32x1_8x32x1_1x32x1x8_8_1x1_intrawave_v3,842.21,305.55,0.0
gfx942,304,23808,5120,5120,ck,0,0,1532.9051,a8w8_blockscale_1x128x128_256x128x128x128_16x16_32x32_2x2_8x32x1_8x32x1_1x32x1x8_8_1x1_intrawave_v3,814.29,255.66,0.0
gfx942,304,23808,5120,12800,ck,0,0,4175.0742,a8w8_blockscale_1x128x128_256x128x128x128_16x16_32x32_2x2_8x32x1_8x32x1_1x32x1x8_8_1x1_intrawave_v3,747.43,147.08,0.0
gfx942,304,23936,5120,4096,ck,0,0,1207.769,a8w8_blockscale_1x128x128_256x128x128x128_16x16_32x32_2x2_8x32x1_8x32x1_1x32x1x8_8_1x1_intrawave_v3,831.24,301.48,0.0
gfx942,304,23936,5120,5120,ck,0,0,1548.2917,a8w8_blockscale_1x128x128_256x128x128x128_16x16_32x32_2x2_8x32x1_8x32x1_1x32x1x8_8_1x1_intrawave_v3,810.53,254.39,0.0
gfx942,304,23936,5120,12800,ck,0,0,4148.4678,a8w8_blockscale_1x128x128_256x128x128x128_16x16_32x32_2x2_8x32x1_8x32x1_1x32x1x8_8_1x1_intrawave_v3,756.26,148.73,0.0
gfx942,304,24064,5120,4096,ck,0,0,1230.8145,a8w8_blockscale_1x128x128_256x128x128x128_16x16_32x32_2x2_8x32x1_8x32x1_1x32x1x8_8_1x1_intrawave_v3,820.04,297.33,0.0
gfx942,304,24064,5120,5120,ck,0,0,1536.0143,a8w8_blockscale_1x128x128_256x128x128x128_16x16_32x32_2x2_8x32x1_8x32x1_1x32x1x8_8_1x1_intrawave_v3,821.38,257.7,0.0
gfx942,304,24064,5120,12800,ck,0,0,4062.7126,a8w8_blockscale_1x128x128_256x128x128x128_16x16_32x32_2x2_8x32x1_8x32x1_1x32x1x8_8_1x1_intrawave_v3,776.36,152.6,0.0
gfx942,304,24192,5120,4096,ck,0,0,1201.491,a8w8_blockscale_1x128x128_256x128x128x128_16x16_32x32_2x2_8x32x1_8x32x1_1x32x1x8_8_1x1_intrawave_v3,844.52,306.11,0.0
gfx942,304,24192,5120,5120,ck,0,0,1549.0714,a8w8_blockscale_1x128x128_256x128x128x128_16x16_32x32_2x2_8x32x1_8x32x1_1x32x1x8_8_1x1_intrawave_v3,818.79,256.8,0.0
gfx942,304,24192,5120,12800,ck,0,0,4198.1448,a8w8_blockscale_1x128x128_256x128x128x128_16x16_32x32_2x2_8x32x1_8x32x1_1x32x1x8_8_1x1_intrawave_v3,755.31,148.38,0.0
gfx942,304,24320,5120,4096,ck,0,0,1249.4369,a8w8_blockscale_1x128x128_256x128x128x128_16x16_32x32_2x2_8x32x1_8x32x1_1x32x1x8_8_1x1_intrawave_v3,816.41,295.83,0.0
gfx942,304,24320,5120,5120,ck,0,0,1539.1309,a8w8_blockscale_1x128x128_256x128x128x128_16x16_32x32_2x2_8x32x1_8x32x1_1x32x1x8_8_1x1_intrawave_v3,828.43,259.74,0.0
gfx942,304,24320,5120,12800,ck,0,0,4184.5387,a8w8_blockscale_1x128x128_256x128x128x128_16x16_32x32_2x2_8x32x1_8x32x1_1x32x1x8_8_1x1_intrawave_v3,761.77,149.57,0.0
gfx942,304,24448,5120,4096,ck,0,0,1220.3132,a8w8_blockscale_1x128x128_256x128x128x128_16x16_32x32_2x2_8x32x1_8x32x1_1x32x1x8_8_1x1_intrawave_v3,840.3,304.4,0.0
gfx942,304,24448,5120,5120,ck,0,0,1561.0001,a8w8_blockscale_1x128x128_256x128x128x128_16x16_32x32_2x2_8x32x1_8x32x1_1x32x1x8_8_1x1_intrawave_v3,821.13,257.36,0.0
gfx942,304,24448,5120,12800,ck,0,0,4172.3064,a8w8_blockscale_1x128x128_256x128x128x128_16x16_32x32_2x2_8x32x1_8x32x1_1x32x1x8_8_1x1_intrawave_v3,768.03,150.71,0.0
gfx942,304,24576,5120,4096,ck,0,0,1239.4129,a8w8_blockscale_1x128x128_256x128x128x128_16x16_32x32_2x2_8x32x1_8x32x1_1x32x1x8_8_1x1_intrawave_v3,831.68,301.19,0.0
gfx942,304,24576,5120,5120,ck,0,0,1556.5416,a8w8_blockscale_1x128x128_256x128x128x128_16x16_32x32_2x2_8x32x1_8x32x1_1x32x1x8_8_1x1_intrawave_v3,827.79,259.36,0.0
gfx942,304,24576,5120,12800,ck,0,0,4359.2903,a8w8_blockscale_1x128x128_256x128x128x128_16x16_32x32_2x2_8x32x1_8x32x1_1x32x1x8_8_1x1_intrawave_v3,738.93,144.92,0.0
gfx942,304,24704,5120,4096,ck,0,0,1264.4763,a8w8_blockscale_1x128x128_256x128x128x128_16x16_32x32_2x2_8x32x1_8x32x1_1x32x1x8_8_1x1_intrawave_v3,819.44,296.67,0.0
gfx942,304,24704,5120,5120,ck,0,0,1588.1162,a8w8_blockscale_1x128x128_256x128x128x128_16x16_32x32_2x2_8x32x1_8x32x1_1x32x1x8_8_1x1_intrawave_v3,815.56,255.44,0.0
gfx942,304,24704,5120,12800,ck,0,0,4233.0907,a8w8_blockscale_1x128x128_256x128x128x128_16x16_32x32_2x2_8x32x1_8x32x1_1x32x1x8_8_1x1_intrawave_v3,764.93,149.94,0.0
gfx942,304,24832,5120,4096,ck,0,0,1250.9617,a8w8_blockscale_1x128x128_256x128x128x128_16x16_32x32_2x2_8x32x1_8x32x1_1x32x1x8_8_1x1_intrawave_v3,832.58,301.34,0.0
gfx942,304,24832,5120,5120,ck,0,0,1572.1934,a8w8_blockscale_1x128x128_256x128x128x128_16x16_32x32_2x2_8x32x1_8x32x1_1x32x1x8_8_1x1_intrawave_v3,828.09,259.28,0.0
gfx942,304,24832,5120,12800,ck,0,0,4219.371,a8w8_blockscale_1x128x128_256x128x128x128_16x16_32x32_2x2_8x32x1_8x32x1_1x32x1x8_8_1x1_intrawave_v3,771.39,151.13,0.0
gfx942,304,24960,5120,4096,ck,0,0,1260.3059,a8w8_blockscale_1x128x128_256x128x128x128_16x16_32x32_2x2_8x32x1_8x32x1_1x32x1x8_8_1x1_intrawave_v3,830.67,300.56,0.0
gfx942,304,24960,5120,5120,ck,0,0,1575.2125,a8w8_blockscale_1x128x128_256x128x128x128_16x16_32x32_2x2_8x32x1_8x32x1_1x32x1x8_8_1x1_intrawave_v3,830.76,260.03,0.0
gfx942,304,24960,5120,12800,ck,0,0,4410.1086,a8w8_blockscale_1x128x128_256x128x128x128_16x16_32x32_2x2_8x32x1_8x32x1_1x32x1x8_8_1x1_intrawave_v3,741.83,145.26,0.0
gfx942,304,25088,5120,4096,ck,0,0,1238.2757,a8w8_blockscale_1x128x128_256x128x128x128_16x16_32x32_2x2_8x32x1_8x32x1_1x32x1x8_8_1x1_intrawave_v3,849.78,307.39,0.0
gfx942,304,25088,5120,5120,ck,0,0,1610.5627,a8w8_blockscale_1x128x128_256x128x128x128_16x16_32x32_2x2_8x32x1_8x32x1_1x32x1x8_8_1x1_intrawave_v3,816.69,255.54,0.0
gfx942,304,25088,5120,12800,ck,0,0,4331.0448,a8w8_blockscale_1x128x128_256x128x128x128_16x16_32x32_2x2_8x32x1_8x32x1_1x32x1x8_8_1x1_intrawave_v3,759.25,148.59,0.0
gfx942,304,25216,5120,4096,ck,0,0,1295.5934,a8w8_blockscale_1x128x128_256x128x128x128_16x16_32x32_2x2_8x32x1_8x32x1_1x32x1x8_8_1x1_intrawave_v3,816.33,295.21,0.0
gfx942,304,25216,5120,5120,ck,0,0,1618.4325,a8w8_blockscale_1x128x128_256x128x128x128_16x16_32x32_2x2_8x32x1_8x32x1_1x32x1x8_8_1x1_intrawave_v3,816.87,255.51,0.0
gfx942,304,25216,5120,12800,ck,0,0,4287.3583,a8w8_blockscale_1x128x128_256x128x128x128_16x16_32x32_2x2_8x32x1_8x32x1_1x32x1x8_8_1x1_intrawave_v3,770.9,150.8,0.0
gfx942,304,25344,5120,4096,ck,0,0,1277.9785,a8w8_blockscale_1x128x128_256x128x128x128_16x16_32x32_2x2_8x32x1_8x32x1_1x32x1x8_8_1x1_intrawave_v3,831.79,300.71,0.0
gfx942,304,25344,5120,5120,ck,0,0,1609.3711,a8w8_blockscale_1x128x128_256x128x128x128_16x16_32x32_2x2_8x32x1_8x32x1_1x32x1x8_8_1x1_intrawave_v3,825.64,258.17,0.0
gfx942,304,25344,5120,12800,ck,0,0,4314.026,a8w8_blockscale_1x128x128_256x128x128x128_16x16_32x32_2x2_8x32x1_8x32x1_1x32x1x8_8_1x1_intrawave_v3,770.02,150.55,0.0
gfx942,304,25472,5120,4096,ck,0,0,1297.4509,a8w8_blockscale_1x128x128_256x128x128x128_16x16_32x32_2x2_8x32x1_8x32x1_1x32x1x8_8_1x1_intrawave_v3,823.44,297.61,0.0
gfx942,304,25472,5120,5120,ck,0,0,1659.5008,a8w8_blockscale_1x128x128_256x128x128x128_16x16_32x32_2x2_8x32x1_8x32x1_1x32x1x8_8_1x1_intrawave_v3,804.74,251.56,0.0
gfx942,304,25472,5120,12800,ck,0,0,4397.7047,a8w8_blockscale_1x128x128_256x128x128x128_16x16_32x32_2x2_8x32x1_8x32x1_1x32x1x8_8_1x1_intrawave_v3,759.18,148.35,0.0
gfx942,304,25600,5120,4096,ck,0,0,1275.5256,a8w8_blockscale_1x128x128_256x128x128x128_16x16_32x32_2x2_8x32x1_8x32x1_1x32x1x8_8_1x1_intrawave_v3,841.8,304.17,0.0
gfx942,304,25600,5120,5120,ck,0,0,1618.7728,a8w8_blockscale_1x128x128_256x128x128x128_16x16_32x32_2x2_8x32x1_8x32x1_1x32x1x8_8_1x1_intrawave_v3,829.13,259.1,0.0
gfx942,304,25600,5120,12800,ck,0,0,4377.6199,a8w8_blockscale_1x128x128_256x128x128x128_16x16_32x32_2x2_8x32x1_8x32x1_1x32x1x8_8_1x1_intrawave_v3,766.5,149.71,0.0
gfx942,304,25728,5120,4096,ck,0,0,1283.4528,a8w8_blockscale_1x128x128_256x128x128x128_16x16_32x32_2x2_8x32x1_8x32x1_1x32x1x8_8_1x1_intrawave_v3,840.79,303.72,0.0
gfx942,304,25728,5120,5120,ck,0,0,1664.8189,a8w8_blockscale_1x128x128_256x128x128x128_16x16_32x32_2x2_8x32x1_8x32x1_1x32x1x8_8_1x1_intrawave_v3,810.23,253.12,0.0
gfx942,304,25728,5120,12800,ck,0,0,4486.4316,a8w8_blockscale_1x128x128_256x128x128x128_16x16_32x32_2x2_8x32x1_8x32x1_1x32x1x8_8_1x1_intrawave_v3,751.65,146.73,0.0
gfx942,304,25856,5120,4096,ck,0,0,1266.5278,a8w8_blockscale_1x128x128_256x128x128x128_16x16_32x32_2x2_8x32x1_8x32x1_1x32x1x8_8_1x1_intrawave_v3,856.26,309.23,0.0
gfx942,304,25856,5120,5120,ck,0,0,1656.5857,a8w8_blockscale_1x128x128_256x128x128x128_16x16_32x32_2x2_8x32x1_8x32x1_1x32x1x8_8_1x1_intrawave_v3,818.31,255.56,0.0
gfx942,304,25856,5120,12800,ck,0,0,4584.7809,a8w8_blockscale_1x128x128_256x128x128x128_16x16_32x32_2x2_8x32x1_8x32x1_1x32x1x8_8_1x1_intrawave_v3,739.18,144.23,0.0
gfx942,304,25984,5120,4096,ck,0,0,1291.8105,a8w8_blockscale_1x128x128_256x128x128x128_16x16_32x32_2x2_8x32x1_8x32x1_1x32x1x8_8_1x1_intrawave_v3,843.66,304.59,0.0
gfx942,304,25984,5120,5120,ck,0,0,1669.1748,a8w8_blockscale_1x128x128_256x128x128x128_16x16_32x32_2x2_8x32x1_8x32x1_1x32x1x8_8_1x1_intrawave_v3,816.16,254.81,0.0
gfx942,304,25984,5120,12800,ck,0,0,4529.107,a8w8_blockscale_1x128x128_256x128x128x128_16x16_32x32_2x2_8x32x1_8x32x1_1x32x1x8_8_1x1_intrawave_v3,751.97,146.65,0.0
gfx942,304,26112,5120,4096,ck,0,0,1313.5887,a8w8_blockscale_1x128x128_256x128x128x128_16x16_32x32_2x2_8x32x1_8x32x1_1x32x1x8_8_1x1_intrawave_v3,833.76,300.94,0.0
gfx942,304,26112,5120,5120,ck,0,0,1674.5324,a8w8_blockscale_1x128x128_256x128x128x128_16x16_32x32_2x2_8x32x1_8x32x1_1x32x1x8_8_1x1_intrawave_v3,817.55,255.17,0.0
gfx942,304,26112,5120,12800,ck,0,0,4602.889,a8w8_blockscale_1x128x128_256x128x128x128_16x16_32x32_2x2_8x32x1_8x32x1_1x32x1x8_8_1x1_intrawave_v3,743.57,144.94,0.0
gfx942,304,26240,5120,4096,ck,0,0,1338.7877,a8w8_blockscale_1x128x128_256x128x128x128_16x16_32x32_2x2_8x32x1_8x32x1_1x32x1x8_8_1x1_intrawave_v3,822.08,296.65,0.0
gfx942,304,26240,5120,5120,ck,0,0,1652.6239,a8w8_blockscale_1x128x128_256x128x128x128_16x16_32x32_2x2_8x32x1_8x32x1_1x32x1x8_8_1x1_intrawave_v3,832.45,259.75,0.0
gfx942,304,26240,5120,12800,ck,0,0,4701.5863,a8w8_blockscale_1x128x128_256x128x128x128_16x16_32x32_2x2_8x32x1_8x32x1_1x32x1x8_8_1x1_intrawave_v3,731.53,142.53,0.0
gfx942,304,26368,5120,4096,ck,0,0,1352.4931,a8w8_blockscale_1x128x128_256x128x128x128_16x16_32x32_2x2_8x32x1_8x32x1_1x32x1x8_8_1x1_intrawave_v3,817.72,295.0,0.0
gfx942,304,26368,5120,5120,ck,0,0,1658.6929,a8w8_blockscale_1x128x128_256x128x128x128_16x16_32x32_2x2_8x32x1_8x32x1_1x32x1x8_8_1x1_intrawave_v3,833.45,259.98,0.0
gfx942,304,26368,5120,12800,ck,0,0,4655.5597,a8w8_blockscale_1x128x128_256x128x128x128_16x16_32x32_2x2_8x32x1_8x32x1_1x32x1x8_8_1x1_intrawave_v3,742.36,144.57,0.0
gfx942,304,26496,5120,4096,ck,0,0,1334.4985,a8w8_blockscale_1x128x128_256x128x128x128_16x16_32x32_2x2_8x32x1_8x32x1_1x32x1x8_8_1x1_intrawave_v3,832.76,300.35,0.0
gfx942,304,26496,5120,5120,ck,0,0,1695.9942,a8w8_blockscale_1x128x128_256x128x128x128_16x16_32x32_2x2_8x32x1_8x32x1_1x32x1x8_8_1x1_intrawave_v3,819.08,255.42,0.0
gfx942,304,26496,5120,12800,ck,0,0,4586.1941,a8w8_blockscale_1x128x128_256x128x128x128_16x16_32x32_2x2_8x32x1_8x32x1_1x32x1x8_8_1x1_intrawave_v3,757.25,147.4,0.0
gfx942,304,26624,5120,4096,ck,0,0,1348.7308,a8w8_blockscale_1x128x128_256x128x128x128_16x16_32x32_2x2_8x32x1_8x32x1_1x32x1x8_8_1x1_intrawave_v3,827.96,298.54,0.0
gfx942,304,26624,5120,5120,ck,0,0,1720.5568,a8w8_blockscale_1x128x128_256x128x128x128_16x16_32x32_2x2_8x32x1_8x32x1_1x32x1x8_8_1x1_intrawave_v3,811.29,252.92,0.0
gfx942,304,26624,5120,12800,ck,0,0,4634.6465,a8w8_blockscale_1x128x128_256x128x128x128_16x16_32x32_2x2_8x32x1_8x32x1_1x32x1x8_8_1x1_intrawave_v3,752.95,146.5,0.0
gfx942,304,26752,5120,4096,ck,0,0,1360.1221,a8w8_blockscale_1x128x128_256x128x128x128_16x16_32x32_2x2_8x32x1_8x32x1_1x32x1x8_8_1x1_intrawave_v3,824.97,297.39,0.0
gfx942,304,26752,5120,5120,ck,0,0,1736.5711,a8w8_blockscale_1x128x128_256x128x128x128_16x16_32x32_2x2_8x32x1_8x32x1_1x32x1x8_8_1x1_intrawave_v3,807.67,251.72,0.0
gfx942,304,26752,5120,12800,ck,0,0,4589.5006,a8w8_blockscale_1x128x128_256x128x128x128_16x16_32x32_2x2_8x32x1_8x32x1_1x32x1x8_8_1x1_intrawave_v3,764.01,148.58,0.0
gfx942,304,26880,5120,4096,ck,0,0,1336.4526,a8w8_blockscale_1x128x128_256x128x128x128_16x16_32x32_2x2_8x32x1_8x32x1_1x32x1x8_8_1x1_intrawave_v3,843.6,304.03,0.0
gfx942,304,26880,5120,5120,ck,0,0,1714.9776,a8w8_blockscale_1x128x128_256x128x128x128_16x16_32x32_2x2_8x32x1_8x32x1_1x32x1x8_8_1x1_intrawave_v3,821.75,256.03,0.0
gfx942,304,26880,5120,12800,ck,0,0,4769.5776,a8w8_blockscale_1x128x128_256x128x128x128_16x16_32x32_2x2_8x32x1_8x32x1_1x32x1x8_8_1x1_intrawave_v3,738.68,143.59,0.0
gfx942,304,27008,5120,4096,ck,0,0,1351.1471,a8w8_blockscale_1x128x128_256x128x128x128_16x16_32x32_2x2_8x32x1_8x32x1_1x32x1x8_8_1x1_intrawave_v3,838.4,302.08,0.0
gfx942,304,27008,5120,5120,ck,0,0,1717.4402,a8w8_blockscale_1x128x128_256x128x128x128_16x16_32x32_2x2_8x32x1_8x32x1_1x32x1x8_8_1x1_intrawave_v3,824.48,256.81,0.0
gfx942,304,27008,5120,12800,ck,0,0,4698.9148,a8w8_blockscale_1x128x128_256x128x128x128_16x16_32x32_2x2_8x32x1_8x32x1_1x32x1x8_8_1x1_intrawave_v3,753.36,146.37,0.0
gfx942,304,27136,5120,4096,ck,0,0,1378.8146,a8w8_blockscale_1x128x128_256x128x128x128_16x16_32x32_2x2_8x32x1_8x32x1_1x32x1x8_8_1x1_intrawave_v3,825.47,297.35,0.0
gfx942,304,27136,5120,5120,ck,0,0,1727.5611,a8w8_blockscale_1x128x128_256x128x128x128_16x16_32x32_2x2_8x32x1_8x32x1_1x32x1x8_8_1x1_intrawave_v3,823.54,256.44,0.0
gfx942,304,27136,5120,12800,ck,0,0,4793.6405,a8w8_blockscale_1x128x128_256x128x128x128_16x16_32x32_2x2_8x32x1_8x32x1_1x32x1x8_8_1x1_intrawave_v3,741.98,144.1,0.0
gfx942,304,27264,5120,4096,ck,0,0,1357.9143,a8w8_blockscale_1x128x128_256x128x128x128_16x16_32x32_2x2_8x32x1_8x32x1_1x32x1x8_8_1x1_intrawave_v3,842.13,303.28,0.0
gfx942,304,27264,5120,5120,ck,0,0,1782.8523,a8w8_blockscale_1x128x128_256x128x128x128_16x16_32x32_2x2_8x32x1_8x32x1_1x32x1x8_8_1x1_intrawave_v3,801.76,249.59,0.0
gfx942,304,27264,5120,12800,ck,0,0,4917.0448,a8w8_blockscale_1x128x128_256x128x128x128_16x16_32x32_2x2_8x32x1_8x32x1_1x32x1x8_8_1x1_intrawave_v3,726.77,141.08,0.0
gfx942,304,27392,5120,4096,ck,0,0,1376.6066,a8w8_blockscale_1x128x128_256x128x128x128_16x16_32x32_2x2_8x32x1_8x32x1_1x32x1x8_8_1x1_intrawave_v3,834.59,300.49,0.0
gfx942,304,27392,5120,5120,ck,0,0,1759.5347,a8w8_blockscale_1x128x128_256x128x128x128_16x16_32x32_2x2_8x32x1_8x32x1_1x32x1x8_8_1x1_intrawave_v3,816.2,254.02,0.0
gfx942,304,27392,5120,12800,ck,0,0,4721.8578,a8w8_blockscale_1x128x128_256x128x128x128_16x16_32x32_2x2_8x32x1_8x32x1_1x32x1x8_8_1x1_intrawave_v3,760.36,147.54,0.0
gfx942,304,27520,5120,4096,ck,0,0,1385.0284,a8w8_blockscale_1x128x128_256x128x128x128_16x16_32x32_2x2_8x32x1_8x32x1_1x32x1x8_8_1x1_intrawave_v3,833.39,299.99,0.0
gfx942,304,27520,5120,5120,ck,0,0,1758.3651,a8w8_blockscale_1x128x128_256x128x128x128_16x16_32x32_2x2_8x32x1_8x32x1_1x32x1x8_8_1x1_intrawave_v3,820.56,255.31,0.0
gfx942,304,27520,5120,12800,ck,0,0,4878.9871,a8w8_blockscale_1x128x128_256x128x128x128_16x16_32x32_2x2_8x32x1_8x32x1_1x32x1x8_8_1x1_intrawave_v3,739.31,143.39,0.0
gfx942,304,27648,5120,4096,ck,0,0,1368.9509,a8w8_blockscale_1x128x128_256x128x128x128_16x16_32x32_2x2_8x32x1_8x32x1_1x32x1x8_8_1x1_intrawave_v3,847.1,304.86,0.0
gfx942,304,27648,5120,5120,ck,0,0,1746.6622,a8w8_blockscale_1x128x128_256x128x128x128_16x16_32x32_2x2_8x32x1_8x32x1_1x32x1x8_8_1x1_intrawave_v3,829.9,258.14,0.0
gfx942,304,27648,5120,12800,ck,0,0,4965.7291,a8w8_blockscale_1x128x128_256x128x128x128_16x16_32x32_2x2_8x32x1_8x32x1_1x32x1x8_8_1x1_intrawave_v3,729.78,141.48,0.0
gfx942,304,27776,5120,4096,ck,0,0,1381.1769,a8w8_blockscale_1x128x128_256x128x128x128_16x16_32x32_2x2_8x32x1_8x32x1_1x32x1x8_8_1x1_intrawave_v3,843.49,303.49,0.0
gfx942,304,27776,5120,5120,ck,0,0,1779.6077,a8w8_blockscale_1x128x128_256x128x128x128_16x16_32x32_2x2_8x32x1_8x32x1_1x32x1x8_8_1x1_intrawave_v3,818.31,254.47,0.0
gfx942,304,27776,5120,12800,ck,0,0,4704.0976,a8w8_blockscale_1x128x128_256x128x128x128_16x16_32x32_2x2_8x32x1_8x32x1_1x32x1x8_8_1x1_intrawave_v3,773.93,149.97,0.0
gfx942,304,27904,5120,4096,ck,0,0,1383.1319,a8w8_blockscale_1x128x128_256x128x128x128_16x16_32x32_2x2_8x32x1_8x32x1_1x32x1x8_8_1x1_intrawave_v3,846.18,304.38,0.0
gfx942,304,27904,5120,5120,ck,0,0,1766.6239,a8w8_blockscale_1x128x128_256x128x128x128_16x16_32x32_2x2_8x32x1_8x32x1_1x32x1x8_8_1x1_intrawave_v3,828.12,257.45,0.0
gfx942,304,27904,5120,12800,ck,0,0,4830.0004,a8w8_blockscale_1x128x128_256x128x128x128_16x16_32x32_2x2_8x32x1_8x32x1_1x32x1x8_8_1x1_intrawave_v3,757.23,146.68,0.0
gfx942,304,28032,5120,4096,ck,0,0,1393.3718,a8w8_blockscale_1x128x128_256x128x128x128_16x16_32x32_2x2_8x32x1_8x32x1_1x32x1x8_8_1x1_intrawave_v3,843.81,303.46,0.0
gfx942,304,28032,5120,5120,ck,0,0,1810.6154,a8w8_blockscale_1x128x128_256x128x128x128_16x16_32x32_2x2_8x32x1_8x32x1_1x32x1x8_8_1x1_intrawave_v3,811.7,252.28,0.0
gfx942,304,28032,5120,12800,ck,0,0,5022.6515,a8w8_blockscale_1x128x128_256x128x128x128_16x16_32x32_2x2_8x32x1_8x32x1_1x32x1x8_8_1x1_intrawave_v3,731.53,141.64,0.0
gfx942,304,28160,5120,4096,ck,0,0,1418.0542,a8w8_blockscale_1x128x128_256x128x128x128_16x16_32x32_2x2_8x32x1_8x32x1_1x32x1x8_8_1x1_intrawave_v3,832.91,299.48,0.0
gfx942,304,28160,5120,5120,ck,0,0,1777.1918,a8w8_blockscale_1x128x128_256x128x128x128_16x16_32x32_2x2_8x32x1_8x32x1_1x32x1x8_8_1x1_intrawave_v3,830.75,258.13,0.0
gfx942,304,28160,5120,12800,ck,0,0,5051.5084,a8w8_blockscale_1x128x128_256x128x128x128_16x16_32x32_2x2_8x32x1_8x32x1_1x32x1x8_8_1x1_intrawave_v3,730.67,141.41,0.0
gfx942,304,28288,5120,4096,ck,0,0,1408.5642,a8w8_blockscale_1x128x128_256x128x128x128_16x16_32x32_2x2_8x32x1_8x32x1_1x32x1x8_8_1x1_intrawave_v3,842.34,302.8,0.0
gfx942,304,28288,5120,5120,ck,0,0,1815.0415,a8w8_blockscale_1x128x128_256x128x128x128_16x16_32x32_2x2_8x32x1_8x32x1_1x32x1x8_8_1x1_intrawave_v3,817.12,253.83,0.0
gfx942,304,28288,5120,12800,ck,0,0,4922.9766,a8w8_blockscale_1x128x128_256x128x128x128_16x16_32x32_2x2_8x32x1_8x32x1_1x32x1x8_8_1x1_intrawave_v3,753.16,145.7,0.0
gfx942,304,28416,5120,4096,ck,0,0,1428.9319,a8w8_blockscale_1x128x128_256x128x128x128_16x16_32x32_2x2_8x32x1_8x32x1_1x32x1x8_8_1x1_intrawave_v3,834.09,299.76,0.0
gfx942,304,28416,5120,5120,ck,0,0,1806.7476,a8w8_blockscale_1x128x128_256x128x128x128_16x16_32x32_2x2_8x32x1_8x32x1_1x32x1x8_8_1x1_intrawave_v3,824.58,256.09,0.0
gfx942,304,28416,5120,12800,ck,0,0,4835.5573,a8w8_blockscale_1x128x128_256x128x128x128_16x16_32x32_2x2_8x32x1_8x32x1_1x32x1x8_8_1x1_intrawave_v3,770.24,148.95,0.0
gfx942,304,28544,5120,4096,ck,0,0,1424.9511,a8w8_blockscale_1x128x128_256x128x128x128_16x16_32x32_2x2_8x32x1_8x32x1_1x32x1x8_8_1x1_intrawave_v3,840.18,301.89,0.0
gfx942,304,28544,5120,5120,ck,0,0,1860.3517,a8w8_blockscale_1x128x128_256x128x128x128_16x16_32x32_2x2_8x32x1_8x32x1_1x32x1x8_8_1x1_intrawave_v3,804.43,249.76,0.0
gfx942,304,28544,5120,12800,ck,0,0,5128.2286,a8w8_blockscale_1x128x128_256x128x128x128_16x16_32x32_2x2_8x32x1_8x32x1_1x32x1x8_8_1x1_intrawave_v3,729.55,141.02,0.0
gfx942,304,28672,5120,4096,ck,0,0,1406.6351,a8w8_blockscale_1x128x128_256x128x128x128_16x16_32x32_2x2_8x32x1_8x32x1_1x32x1x8_8_1x1_intrawave_v3,854.94,307.13,0.0
gfx942,304,28672,5120,5120,ck,0,0,1857.7465,a8w8_blockscale_1x128x128_256x128x128x128_16x16_32x32_2x2_8x32x1_8x32x1_1x32x1x8_8_1x1_intrawave_v3,809.17,251.17,0.0
gfx942,304,28672,5120,12800,ck,0,0,4882.2681,a8w8_blockscale_1x128x128_256x128x128x128_16x16_32x32_2x2_8x32x1_8x32x1_1x32x1x8_8_1x1_intrawave_v3,769.74,148.73,0.0
gfx942,304,28800,5120,4096,ck,0,0,1442.7834,a8w8_blockscale_1x128x128_256x128x128x128_16x16_32x32_2x2_8x32x1_8x32x1_1x32x1x8_8_1x1_intrawave_v3,837.24,300.7,0.0
gfx942,304,28800,5120,5120,ck,0,0,1827.2256,a8w8_blockscale_1x128x128_256x128x128x128_16x16_32x32_2x2_8x32x1_8x32x1_1x32x1x8_8_1x1_intrawave_v3,826.36,256.44,0.0
gfx942,304,28800,5120,12800,ck,0,0,5034.3015,a8w8_blockscale_1x128x128_256x128x128x128_16x16_32x32_2x2_8x32x1_8x32x1_1x32x1x8_8_1x1_intrawave_v3,749.83,144.82,0.0
gfx942,304,28928,5120,4096,ck,0,0,1464.5546,a8w8_blockscale_1x128x128_256x128x128x128_16x16_32x32_2x2_8x32x1_8x32x1_1x32x1x8_8_1x1_intrawave_v3,828.46,297.49,0.0
gfx942,304,28928,5120,5120,ck,0,0,1881.1536,a8w8_blockscale_1x128x128_256x128x128x128_16x16_32x32_2x2_8x32x1_8x32x1_1x32x1x8_8_1x1_intrawave_v3,806.24,250.14,0.0
gfx942,304,28928,5120,12800,ck,0,0,5192.1447,a8w8_blockscale_1x128x128_256x128x128x128_16x16_32x32_2x2_8x32x1_8x32x1_1x32x1x8_8_1x1_intrawave_v3,730.27,140.99,0.0
gfx942,304,29056,5120,4096,ck,0,0,1467.39,a8w8_blockscale_1x128x128_256x128x128x128_16x16_32x32_2x2_8x32x1_8x32x1_1x32x1x8_8_1x1_intrawave_v3,830.52,298.16,0.0
gfx942,304,29056,5120,5120,ck,0,0,1892.9563,a8w8_blockscale_1x128x128_256x128x128x128_16x16_32x32_2x2_8x32x1_8x32x1_1x32x1x8_8_1x1_intrawave_v3,804.76,249.62,0.0
gfx942,304,29056,5120,12800,ck,0,0,5056.3582,a8w8_blockscale_1x128x128_256x128x128x128_16x16_32x32_2x2_8x32x1_8x32x1_1x32x1x8_8_1x1_intrawave_v3,753.2,145.36,0.0
gfx942,304,29184,5120,4096,ck,0,0,1439.5917,a8w8_blockscale_1x128x128_256x128x128x128_16x16_32x32_2x2_8x32x1_8x32x1_1x32x1x8_8_1x1_intrawave_v3,850.29,305.19,0.0
gfx942,304,29184,5120,5120,ck,0,0,1881.1481,a8w8_blockscale_1x128x128_256x128x128x128_16x16_32x32_2x2_8x32x1_8x32x1_1x32x1x8_8_1x1_intrawave_v3,813.38,252.23,0.0
gfx942,304,29184,5120,12800,ck,0,0,5021.9016,a8w8_blockscale_1x128x128_256x128x128x128_16x16_32x32_2x2_8x32x1_8x32x1_1x32x1x8_8_1x1_intrawave_v3,761.7,146.94,0.0
gfx942,304,29312,5120,4096,ck,0,0,1461.6124,a8w8_blockscale_1x128x128_256x128x128x128_16x16_32x32_2x2_8x32x1_8x32x1_1x32x1x8_8_1x1_intrawave_v3,841.15,301.85,0.0
gfx942,304,29312,5120,5120,ck,0,0,1879.5326,a8w8_blockscale_1x128x128_256x128x128x128_16x16_32x32_2x2_8x32x1_8x32x1_1x32x1x8_8_1x1_intrawave_v3,817.65,253.49,0.0
gfx942,304,29312,5120,12800,ck,0,0,5113.9427,a8w8_blockscale_1x128x128_256x128x128x128_16x16_32x32_2x2_8x32x1_8x32x1_1x32x1x8_8_1x1_intrawave_v3,751.28,144.88,0.0
gfx942,304,29440,5120,4096,ck,0,0,1481.0372,a8w8_blockscale_1x128x128_256x128x128x128_16x16_32x32_2x2_8x32x1_8x32x1_1x32x1x8_8_1x1_intrawave_v3,833.74,299.13,0.0
gfx942,304,29440,5120,5120,ck,0,0,1916.5505,a8w8_blockscale_1x128x128_256x128x128x128_16x16_32x32_2x2_8x32x1_8x32x1_1x32x1x8_8_1x1_intrawave_v3,805.36,249.62,0.0
gfx942,304,29440,5120,12800,ck,0,0,5098.8716,a8w8_blockscale_1x128x128_256x128x128x128_16x16_32x32_2x2_8x32x1_8x32x1_1x32x1x8_8_1x1_intrawave_v3,756.79,145.88,0.0
gfx942,304,29568,5120,4096,ck,0,0,1471.8915,a8w8_blockscale_1x128x128_256x128x128x128_16x16_32x32_2x2_8x32x1_8x32x1_1x32x1x8_8_1x1_intrawave_v3,842.57,302.24,0.0
gfx942,304,29568,5120,5120,ck,0,0,1931.2096,a8w8_blockscale_1x128x128_256x128x128x128_16x16_32x32_2x2_8x32x1_8x32x1_1x32x1x8_8_1x1_intrawave_v3,802.72,248.75,0.0
gfx942,304,29568,5120,12800,ck,0,0,5158.3651,a8w8_blockscale_1x128x128_256x128x128x128_16x16_32x32_2x2_8x32x1_8x32x1_1x32x1x8_8_1x1_intrawave_v3,751.31,144.77,0.0
gfx942,304,29696,5120,4096,ck,0,0,1487.7617,a8w8_blockscale_1x128x128_256x128x128x128_16x16_32x32_2x2_8x32x1_8x32x1_1x32x1x8_8_1x1_intrawave_v3,837.19,300.25,0.0
gfx942,304,29696,5120,5120,ck,0,0,1891.3261,a8w8_blockscale_1x128x128_256x128x128x128_16x16_32x32_2x2_8x32x1_8x32x1_1x32x1x8_8_1x1_intrawave_v3,823.19,255.03,0.0
gfx942,304,29696,5120,12800,ck,0,0,5178.4276,a8w8_blockscale_1x128x128_256x128x128x128_16x16_32x32_2x2_8x32x1_8x32x1_1x32x1x8_8_1x1_intrawave_v3,751.64,144.78,0.0
gfx942,304,29824,5120,4096,ck,0,0,1500.355,a8w8_blockscale_1x128x128_256x128x128x128_16x16_32x32_2x2_8x32x1_8x32x1_1x32x1x8_8_1x1_intrawave_v3,833.74,298.95,0.0
gfx942,304,29824,5120,5120,ck,0,0,1940.1978,a8w8_blockscale_1x128x128_256x128x128x128_16x16_32x32_2x2_8x32x1_8x32x1_1x32x1x8_8_1x1_intrawave_v3,805.92,249.62,0.0
gfx942,304,29824,5120,12800,ck,0,0,5176.3981,a8w8_blockscale_1x128x128_256x128x128x128_16x16_32x32_2x2_8x32x1_8x32x1_1x32x1x8_8_1x1_intrawave_v3,755.18,145.41,0.0
gfx942,304,29952,5120,4096,ck,0,0,1483.9355,a8w8_blockscale_1x128x128_256x128x128x128_16x16_32x32_2x2_8x32x1_8x32x1_1x32x1x8_8_1x1_intrawave_v3,846.59,303.49,0.0
gfx942,304,29952,5120,5120,ck,0,0,1938.8131,a8w8_blockscale_1x128x128_256x128x128x128_16x16_32x32_2x2_8x32x1_8x32x1_1x32x1x8_8_1x1_intrawave_v3,809.95,250.81,0.0
gfx942,304,29952,5120,12800,ck,0,0,5289.2339,a8w8_blockscale_1x128x128_256x128x128x128_16x16_32x32_2x2_8x32x1_8x32x1_1x32x1x8_8_1x1_intrawave_v3,742.24,142.86,0.0
gfx942,304,30080,5120,4096,ck,0,0,1504.9201,a8w8_blockscale_1x128x128_256x128x128x128_16x16_32x32_2x2_8x32x1_8x32x1_1x32x1x8_8_1x1_intrawave_v3,838.35,300.48,0.0
gfx942,304,30080,5120,5120,ck,0,0,1929.1104,a8w8_blockscale_1x128x128_256x128x128x128_16x16_32x32_2x2_8x32x1_8x32x1_1x32x1x8_8_1x1_intrawave_v3,817.51,253.09,0.0
gfx942,304,30080,5120,12800,ck,0,0,5097.5696,a8w8_blockscale_1x128x128_256x128x128x128_16x16_32x32_2x2_8x32x1_8x32x1_1x32x1x8_8_1x1_intrawave_v3,773.44,148.81,0.0
gfx942,304,30208,5120,4096,ck,0,0,1485.9155,a8w8_blockscale_1x128x128_256x128x128x128_16x16_32x32_2x2_8x32x1_8x32x1_1x32x1x8_8_1x1_intrawave_v3,852.68,305.56,0.0
gfx942,304,30208,5120,5120,ck,0,0,1931.1219,a8w8_blockscale_1x128x128_256x128x128x128_16x16_32x32_2x2_8x32x1_8x32x1_1x32x1x8_8_1x1_intrawave_v3,820.13,253.85,0.0
gfx942,304,30208,5120,12800,ck,0,0,5224.6697,a8w8_blockscale_1x128x128_256x128x128x128_16x16_32x32_2x2_8x32x1_8x32x1_1x32x1x8_8_1x1_intrawave_v3,757.83,145.76,0.0
gfx942,304,30336,5120,4096,ck,0,0,1521.4302,a8w8_blockscale_1x128x128_256x128x128x128_16x16_32x32_2x2_8x32x1_8x32x1_1x32x1x8_8_1x1_intrawave_v3,836.31,299.63,0.0
gfx942,304,30336,5120,5120,ck,0,0,1948.6399,a8w8_blockscale_1x128x128_256x128x128x128_16x16_32x32_2x2_8x32x1_8x32x1_1x32x1x8_8_1x1_intrawave_v3,816.2,252.57,0.0
gfx942,304,30336,5120,12800,ck,0,0,5459.3019,a8w8_blockscale_1x128x128_256x128x128x128_16x16_32x32_2x2_8x32x1_8x32x1_1x32x1x8_8_1x1_intrawave_v3,728.33,140.03,0.0
gfx942,304,30464,5120,4096,ck,0,0,1535.3799,a8w8_blockscale_1x128x128_256x128x128x128_16x16_32x32_2x2_8x32x1_8x32x1_1x32x1x8_8_1x1_intrawave_v3,832.21,298.1,0.0
gfx942,304,30464,5120,5120,ck,0,0,1983.2942,a8w8_blockscale_1x128x128_256x128x128x128_16x16_32x32_2x2_8x32x1_8x32x1_1x32x1x8_8_1x1_intrawave_v3,805.32,249.15,0.0
gfx942,304,30464,5120,12800,ck,0,0,5319.2387,a8w8_blockscale_1x128x128_256x128x128x128_16x16_32x32_2x2_8x32x1_8x32x1_1x32x1x8_8_1x1_intrawave_v3,750.67,144.27,0.0
gfx942,304,30592,5120,4096,ck,0,0,1530.2216,a8w8_blockscale_1x128x128_256x128x128x128_16x16_32x32_2x2_8x32x1_8x32x1_1x32x1x8_8_1x1_intrawave_v3,838.52,300.31,0.0
gfx942,304,30592,5120,5120,ck,0,0,1963.2292,a8w8_blockscale_1x128x128_256x128x128x128_16x16_32x32_2x2_8x32x1_8x32x1_1x32x1x8_8_1x1_intrawave_v3,816.97,252.7,0.0
gfx942,304,30592,5120,12800,ck,0,0,5205.415,a8w8_blockscale_1x128x128_256x128x128x128_16x16_32x32_2x2_8x32x1_8x32x1_1x32x1x8_8_1x1_intrawave_v3,770.3,148.0,0.0
gfx942,304,30720,5120,4096,ck,0,0,1516.6299,a8w8_blockscale_1x128x128_256x128x128x128_16x16_32x32_2x2_8x32x1_8x32x1_1x32x1x8_8_1x1_intrawave_v3,849.57,304.21,0.0
gfx942,304,30720,5120,5120,ck,0,0,1982.9927,a8w8_blockscale_1x128x128_256x128x128x128_16x16_32x32_2x2_8x32x1_8x32x1_1x32x1x8_8_1x1_intrawave_v3,812.21,251.17,0.0
gfx942,304,30720,5120,12800,ck,0,0,5524.2229,a8w8_blockscale_1x128x128_256x128x128x128_16x16_32x32_2x2_8x32x1_8x32x1_1x32x1x8_8_1x1_intrawave_v3,728.89,139.99,0.0
gfx942,304,30848,5120,4096,ck,0,0,1570.5874,a8w8_blockscale_1x128x128_256x128x128x128_16x16_32x32_2x2_8x32x1_8x32x1_1x32x1x8_8_1x1_intrawave_v3,823.81,294.93,0.0
gfx942,304,30848,5120,5120,ck,0,0,1988.5496,a8w8_blockscale_1x128x128_256x128x128x128_16x16_32x32_2x2_8x32x1_8x32x1_1x32x1x8_8_1x1_intrawave_v3,813.32,251.46,0.0
gfx942,304,30848,5120,12800,ck,0,0,5243.7506,a8w8_blockscale_1x128x128_256x128x128x128_16x16_32x32_2x2_8x32x1_8x32x1_1x32x1x8_8_1x1_intrawave_v3,771.07,148.04,0.0
gfx942,304,30976,5120,4096,ck,0,0,1550.8136,a8w8_blockscale_1x128x128_256x128x128x128_16x16_32x32_2x2_8x32x1_8x32x1_1x32x1x8_8_1x1_intrawave_v3,837.77,299.87,0.0
gfx942,304,30976,5120,5120,ck,0,0,1969.8266,a8w8_blockscale_1x128x128_256x128x128x128_16x16_32x32_2x2_8x32x1_8x32x1_1x32x1x8_8_1x1_intrawave_v3,824.46,254.85,0.0
gfx942,304,30976,5120,12800,ck,0,0,5300.1797,a8w8_blockscale_1x128x128_256x128x128x128_16x16_32x32_2x2_8x32x1_8x32x1_1x32x1x8_8_1x1_intrawave_v3,766.03,147.02,0.0
gfx942,304,31104,5120,4096,ck,0,0,1572.4512,a8w8_blockscale_1x128x128_256x128x128x128_16x16_32x32_2x2_8x32x1_8x32x1_1x32x1x8_8_1x1_intrawave_v3,829.66,296.91,0.0
gfx942,304,31104,5120,5120,ck,0,0,1998.1163,a8w8_blockscale_1x128x128_256x128x128x128_16x16_32x32_2x2_8x32x1_8x32x1_1x32x1x8_8_1x1_intrawave_v3,816.14,252.22,0.0
gfx942,304,31104,5120,12800,ck,0,0,5306.6977,a8w8_blockscale_1x128x128_256x128x128x128_16x16_32x32_2x2_8x32x1_8x32x1_1x32x1x8_8_1x1_intrawave_v3,768.25,147.39,0.0
gfx942,304,31232,5120,4096,ck,0,0,1557.7159,a8w8_blockscale_1x128x128_256x128x128x128_16x16_32x32_2x2_8x32x1_8x32x1_1x32x1x8_8_1x1_intrawave_v3,840.95,300.9,0.0
gfx942,304,31232,5120,5120,ck,0,0,1979.6228,a8w8_blockscale_1x128x128_256x128x128x128_16x16_32x32_2x2_8x32x1_8x32x1_1x32x1x8_8_1x1_intrawave_v3,827.16,255.57,0.0
gfx942,304,31232,5120,12800,ck,0,0,5488.8014,a8w8_blockscale_1x128x128_256x128x128x128_16x16_32x32_2x2_8x32x1_8x32x1_1x32x1x8_8_1x1_intrawave_v3,745.82,143.04,0.0
gfx942,304,31360,5120,4096,ck,0,0,1605.4313,a8w8_blockscale_1x128x128_256x128x128x128_16x16_32x32_2x2_8x32x1_8x32x1_1x32x1x8_8_1x1_intrawave_v3,819.3,293.1,0.0
gfx942,304,31360,5120,5120,ck,0,0,2035.6035,a8w8_blockscale_1x128x128_256x128x128x128_16x16_32x32_2x2_8x32x1_8x32x1_1x32x1x8_8_1x1_intrawave_v3,807.71,249.51,0.0
gfx942,304,31360,5120,12800,ck,0,0,5449.3,a8w8_blockscale_1x128x128_256x128x128x128_16x16_32x32_2x2_8x32x1_8x32x1_1x32x1x8_8_1x1_intrawave_v3,754.3,144.62,0.0
gfx942,304,31488,5120,4096,ck,0,0,1548.8346,a8w8_blockscale_1x128x128_256x128x128x128_16x16_32x32_2x2_8x32x1_8x32x1_1x32x1x8_8_1x1_intrawave_v3,852.71,304.99,0.0
gfx942,304,31488,5120,5120,ck,0,0,2022.4199,a8w8_blockscale_1x128x128_256x128x128x128_16x16_32x32_2x2_8x32x1_8x32x1_1x32x1x8_8_1x1_intrawave_v3,816.29,252.11,0.0
gfx942,304,31488,5120,12800,ck,0,0,5510.5977,a8w8_blockscale_1x128x128_256x128x128x128_16x16_32x32_2x2_8x32x1_8x32x1_1x32x1x8_8_1x1_intrawave_v3,748.96,143.55,0.0
gfx942,304,31616,5120,4096,ck,0,0,1590.0959,a8w8_blockscale_1x128x128_256x128x128x128_16x16_32x32_2x2_8x32x1_8x32x1_1x32x1x8_8_1x1_intrawave_v3,833.96,298.23,0.0
gfx942,304,31616,5120,5120,ck,0,0,2028.456,a8w8_blockscale_1x128x128_256x128x128x128_16x16_32x32_2x2_8x32x1_8x32x1_1x32x1x8_8_1x1_intrawave_v3,817.17,252.33,0.0
gfx942,304,31616,5120,12800,ck,0,0,5692.1687,a8w8_blockscale_1x128x128_256x128x128x128_16x16_32x32_2x2_8x32x1_8x32x1_1x32x1x8_8_1x1_intrawave_v3,728.01,139.48,0.0
gfx942,304,31744,5120,4096,ck,0,0,1625.9053,a8w8_blockscale_1x128x128_256x128x128x128_16x16_32x32_2x2_8x32x1_8x32x1_1x32x1x8_8_1x1_intrawave_v3,818.89,292.79,0.0
gfx942,304,31744,5120,5120,ck,0,0,1995.4754,a8w8_blockscale_1x128x128_256x128x128x128_16x16_32x32_2x2_8x32x1_8x32x1_1x32x1x8_8_1x1_intrawave_v3,834.04,257.48,0.0
gfx942,304,31744,5120,12800,ck,0,0,5714.4429,a8w8_blockscale_1x128x128_256x128x128x128_16x16_32x32_2x2_8x32x1_8x32x1_1x32x1x8_8_1x1_intrawave_v3,728.11,139.46,0.0
gfx942,304,31872,5120,4096,ck,0,0,1615.2645,a8w8_blockscale_1x128x128_256x128x128x128_16x16_32x32_2x2_8x32x1_8x32x1_1x32x1x8_8_1x1_intrawave_v3,827.61,295.86,0.0
gfx942,304,31872,5120,5120,ck,0,0,2051.752,a8w8_blockscale_1x128x128_256x128x128x128_16x16_32x32_2x2_8x32x1_8x32x1_1x32x1x8_8_1x1_intrawave_v3,814.43,251.38,0.0
gfx942,304,31872,5120,12800,ck,0,0,5466.5009,a8w8_blockscale_1x128x128_256x128x128x128_16x16_32x32_2x2_8x32x1_8x32x1_1x32x1x8_8_1x1_intrawave_v3,764.2,146.32,0.0
gfx942,304,32000,5120,4096,ck,0,0,1632.9026,a8w8_blockscale_1x128x128_256x128x128x128_16x16_32x32_2x2_8x32x1_8x32x1_1x32x1x8_8_1x1_intrawave_v3,821.96,293.79,0.0
gfx942,304,32000,5120,5120,ck,0,0,2082.7203,a8w8_blockscale_1x128x128_256x128x128x128_16x16_32x32_2x2_8x32x1_8x32x1_1x32x1x8_8_1x1_intrawave_v3,805.54,248.59,0.0
gfx942,304,32000,5120,12800,ck,0,0,5534.3541,a8w8_blockscale_1x128x128_256x128x128x128_16x16_32x32_2x2_8x32x1_8x32x1_1x32x1x8_8_1x1_intrawave_v3,757.87,145.06,0.0
gfx942,304,32128,5120,4096,ck,0,0,1608.2571,a8w8_blockscale_1x128x128_256x128x128x128_16x16_32x32_2x2_8x32x1_8x32x1_1x32x1x8_8_1x1_intrawave_v3,837.89,299.43,0.0
gfx942,304,32128,5120,5120,ck,0,0,2053.5732,a8w8_blockscale_1x128x128_256x128x128x128_16x16_32x32_2x2_8x32x1_8x32x1_1x32x1x8_8_1x1_intrawave_v3,820.24,253.07,0.0
gfx942,304,32128,5120,12800,ck,0,0,5520.6823,a8w8_blockscale_1x128x128_256x128x128x128_16x16_32x32_2x2_8x32x1_8x32x1_1x32x1x8_8_1x1_intrawave_v3,762.78,145.95,0.0
gfx942,304,32256,5120,4096,ck,0,0,1621.7206,a8w8_blockscale_1x128x128_256x128x128x128_16x16_32x32_2x2_8x32x1_8x32x1_1x32x1x8_8_1x1_intrawave_v3,834.25,298.07,0.0
gfx942,304,32256,5120,5120,ck,0,0,2081.6861,a8w8_blockscale_1x128x128_256x128x128x128_16x16_32x32_2x2_8x32x1_8x32x1_1x32x1x8_8_1x1_intrawave_v3,812.39,250.6,0.0
gfx942,304,32256,5120,12800,ck,0,0,5535.5911,a8w8_blockscale_1x128x128_256x128x128x128_16x16_32x32_2x2_8x32x1_8x32x1_1x32x1x8_8_1x1_intrawave_v3,763.76,146.09,0.0
gfx942,304,32384,5120,4096,ck,0,0,1636.1933,a8w8_blockscale_1x128x128_256x128x128x128_16x16_32x32_2x2_8x32x1_8x32x1_1x32x1x8_8_1x1_intrawave_v3,830.15,296.56,0.0
gfx942,304,32384,5120,5120,ck,0,0,2088.6557,a8w8_blockscale_1x128x128_256x128x128x128_16x16_32x32_2x2_8x32x1_8x32x1_1x32x1x8_8_1x1_intrawave_v3,812.89,250.7,0.0
gfx942,304,32384,5120,12800,ck,0,0,5780.2133,a8w8_blockscale_1x128x128_256x128x128x128_16x16_32x32_2x2_8x32x1_8x32x1_1x32x1x8_8_1x1_intrawave_v3,734.34,140.42,0.0
gfx942,304,32512,5120,4096,ck,0,0,1622.3104,a8w8_blockscale_1x128x128_256x128x128x128_16x16_32x32_2x2_8x32x1_8x32x1_1x32x1x8_8_1x1_intrawave_v3,840.56,300.23,0.0
gfx942,304,32512,5120,5120,ck,0,0,2066.4853,a8w8_blockscale_1x128x128_256x128x128x128_16x16_32x32_2x2_8x32x1_8x32x1_1x32x1x8_8_1x1_intrawave_v3,824.86,254.34,0.0
gfx942,304,32512,5120,12800,ck,0,0,5554.6135,a8w8_blockscale_1x128x128_256x128x128x128_16x16_32x32_2x2_8x32x1_8x32x1_1x32x1x8_8_1x1_intrawave_v3,767.18,146.66,0.0
gfx942,304,32640,5120,4096,ck,0,0,1638.1365,a8w8_blockscale_1x128x128_256x128x128x128_16x16_32x32_2x2_8x32x1_8x32x1_1x32x1x8_8_1x1_intrawave_v3,835.72,298.45,0.0
gfx942,304,32640,5120,5120,ck,0,0,2115.6008,a8w8_blockscale_1x128x128_256x128x128x128_16x16_32x32_2x2_8x32x1_8x32x1_1x32x1x8_8_1x1_intrawave_v3,808.88,249.37,0.0
gfx942,304,32640,5120,12800,ck,0,0,5705.0471,a8w8_blockscale_1x128x128_256x128x128x128_16x16_32x32_2x2_8x32x1_8x32x1_1x32x1x8_8_1x1_intrawave_v3,749.9,143.3,0.0
gfx942,304,32768,5120,4096,ck,0,0,1645.3807,a8w8_blockscale_1x128x128_256x128x128x128_16x16_32x32_2x2_8x32x1_8x32x1_1x32x1x8_8_1x1_intrawave_v3,835.3,298.25,0.0
gfx942,304,32768,5120,5120,ck,0,0,2105.7075,a8w8_blockscale_1x128x128_256x128x128x128_16x16_32x32_2x2_8x32x1_8x32x1_1x32x1x8_8_1x1_intrawave_v3,815.87,251.47,0.0
gfx942,304,32768,5120,12800,ck,0,0,5874.2713,a8w8_blockscale_1x128x128_256x128x128x128_16x16_32x32_2x2_8x32x1_8x32x1_1x32x1x8_8_1x1_intrawave_v3,731.15,139.68,0.0
gfx942,304,32896,5120,4096,ck,0,0,1687.3651,a8w8_blockscale_1x128x128_256x128x128x128_16x16_32x32_2x2_8x32x1_8x32x1_1x32x1x8_8_1x1_intrawave_v3,817.7,291.92,0.0
gfx942,304,32896,5120,5120,ck,0,0,2107.6913,a8w8_blockscale_1x128x128_256x128x128x128_16x16_32x32_2x2_8x32x1_8x32x1_1x32x1x8_8_1x1_intrawave_v3,818.29,252.17,0.0
gfx942,304,32896,5120,12800,ck,0,0,5729.998,a8w8_blockscale_1x128x128_256x128x128x128_16x16_32x32_2x2_8x32x1_8x32x1_1x32x1x8_8_1x1_intrawave_v3,752.49,143.71,0.0
gfx942,304,33024,5120,4096,ck,0,0,1652.9987,a8w8_blockscale_1x128x128_256x128x128x128_16x16_32x32_2x2_8x32x1_8x32x1_1x32x1x8_8_1x1_intrawave_v3,837.95,299.09,0.0
gfx942,304,33024,5120,5120,ck,0,0,2149.0404,a8w8_blockscale_1x128x128_256x128x128x128_16x16_32x32_2x2_8x32x1_8x32x1_1x32x1x8_8_1x1_intrawave_v3,805.67,248.23,0.0
gfx942,304,33024,5120,12800,ck,0,0,5775.075,a8w8_blockscale_1x128x128_256x128x128x128_16x16_32x32_2x2_8x32x1_8x32x1_1x32x1x8_8_1x1_intrawave_v3,749.52,143.1,0.0
gfx942,304,33152,5120,4096,ck,0,0,1690.2991,a8w8_blockscale_1x128x128_256x128x128x128_16x16_32x32_2x2_8x32x1_8x32x1_1x32x1x8_8_1x1_intrawave_v3,822.63,293.58,0.0
gfx942,304,33152,5120,5120,ck,0,0,2132.0074,a8w8_blockscale_1x128x128_256x128x128x128_16x16_32x32_2x2_8x32x1_8x32x1_1x32x1x8_8_1x1_intrawave_v3,815.25,251.14,0.0
gfx942,304,33152,5120,12800,ck,0,0,5919.9563,a8w8_blockscale_1x128x128_256x128x128x128_16x16_32x32_2x2_8x32x1_8x32x1_1x32x1x8_8_1x1_intrawave_v3,734.01,140.1,0.0
gfx942,304,33280,5120,4096,ck,0,0,1680.12,a8w8_blockscale_1x128x128_256x128x128x128_16x16_32x32_2x2_8x32x1_8x32x1_1x32x1x8_8_1x1_intrawave_v3,830.81,296.45,0.0
gfx942,304,33280,5120,5120,ck,0,0,2139.6379,a8w8_blockscale_1x128x128_256x128x128x128_16x16_32x32_2x2_8x32x1_8x32x1_1x32x1x8_8_1x1_intrawave_v3,815.48,251.16,0.0
gfx942,304,33280,5120,12800,ck,0,0,5815.7264,a8w8_blockscale_1x128x128_256x128x128x128_16x16_32x32_2x2_8x32x1_8x32x1_1x32x1x8_8_1x1_intrawave_v3,750.05,143.11,0.0
gfx942,304,33408,5120,4096,ck,0,0,1697.0476,a8w8_blockscale_1x128x128_256x128x128x128_16x16_32x32_2x2_8x32x1_8x32x1_1x32x1x8_8_1x1_intrawave_v3,825.69,294.58,0.0
gfx942,304,33408,5120,5120,ck,0,0,2191.4094,a8w8_blockscale_1x128x128_256x128x128x128_16x16_32x32_2x2_8x32x1_8x32x1_1x32x1x8_8_1x1_intrawave_v3,799.28,246.13,0.0
gfx942,304,33408,5120,12800,ck,0,0,5686.7014,a8w8_blockscale_1x128x128_256x128x128x128_16x16_32x32_2x2_8x32x1_8x32x1_1x32x1x8_8_1x1_intrawave_v3,770.02,146.88,0.0
gfx942,304,33536,5120,4096,ck,0,0,1693.3982,a8w8_blockscale_1x128x128_256x128x128x128_16x16_32x32_2x2_8x32x1_8x32x1_1x32x1x8_8_1x1_intrawave_v3,830.64,296.29,0.0
gfx942,304,33536,5120,5120,ck,0,0,2170.2405,a8w8_blockscale_1x128x128_256x128x128x128_16x16_32x32_2x2_8x32x1_8x32x1_1x32x1x8_8_1x1_intrawave_v3,810.16,249.43,0.0
gfx942,304,33536,5120,12800,ck,0,0,5770.1151,a8w8_blockscale_1x128x128_256x128x128x128_16x16_32x32_2x2_8x32x1_8x32x1_1x32x1x8_8_1x1_intrawave_v3,761.79,145.27,0.0
gfx942,304,33664,5120,4096,ck,0,0,1675.3753,a8w8_blockscale_1x128x128_256x128x128x128_16x16_32x32_2x2_8x32x1_8x32x1_1x32x1x8_8_1x1_intrawave_v3,842.78,300.58,0.0
gfx942,304,33664,5120,5120,ck,0,0,2200.1591,a8w8_blockscale_1x128x128_256x128x128x128_16x16_32x32_2x2_8x32x1_8x32x1_1x32x1x8_8_1x1_intrawave_v3,802.2,246.93,0.0
gfx942,304,33664,5120,12800,ck,0,0,6083.759,a8w8_blockscale_1x128x128_256x128x128x128_16x16_32x32_2x2_8x32x1_8x32x1_1x32x1x8_8_1x1_intrawave_v3,725.28,138.26,0.0
gfx942,304,33792,5120,4096,ck,0,0,1688.7557,a8w8_blockscale_1x128x128_256x128x128x128_16x16_32x32_2x2_8x32x1_8x32x1_1x32x1x8_8_1x1_intrawave_v3,839.28,299.28,0.0
gfx942,304,33792,5120,5120,ck,0,0,2175.3767,a8w8_blockscale_1x128x128_256x128x128x128_16x16_32x32_2x2_8x32x1_8x32x1_1x32x1x8_8_1x1_intrawave_v3,814.42,250.65,0.0
gfx942,304,33792,5120,12800,ck,0,0,5768.7448,a8w8_blockscale_1x128x128_256x128x128x128_16x16_32x32_2x2_8x32x1_8x32x1_1x32x1x8_8_1x1_intrawave_v3,767.79,146.32,0.0
gfx942,304,33920,5120,4096,ck,0,0,1690.8075,a8w8_blockscale_1x128x128_256x128x128x128_16x16_32x32_2x2_8x32x1_8x32x1_1x32x1x8_8_1x1_intrawave_v3,841.44,300.0,0.0
gfx942,304,33920,5120,5120,ck,0,0,2212.3727,a8w8_blockscale_1x128x128_256x128x128x128_16x16_32x32_2x2_8x32x1_8x32x1_1x32x1x8_8_1x1_intrawave_v3,803.84,247.35,0.0
gfx942,304,33920,5120,12800,ck,0,0,5926.0575,a8w8_blockscale_1x128x128_256x128x128x128_16x16_32x32_2x2_8x32x1_8x32x1_1x32x1x8_8_1x1_intrawave_v3,750.24,142.94,0.0
gfx942,304,34048,5120,4096,ck,0,0,1715.8522,a8w8_blockscale_1x128x128_256x128x128x128_16x16_32x32_2x2_8x32x1_8x32x1_1x32x1x8_8_1x1_intrawave_v3,832.28,296.69,0.0
gfx942,304,34048,5120,5120,ck,0,0,2221.8636,a8w8_blockscale_1x128x128_256x128x128x128_16x16_32x32_2x2_8x32x1_8x32x1_1x32x1x8_8_1x1_intrawave_v3,803.42,247.18,0.0
gfx942,304,34048,5120,12800,ck,0,0,5892.6335,a8w8_blockscale_1x128x128_256x128x128x128_16x16_32x32_2x2_8x32x1_8x32x1_1x32x1x8_8_1x1_intrawave_v3,757.34,144.25,0.0
gfx942,304,34176,5120,4096,ck,0,0,1741.1898,a8w8_blockscale_1x128x128_256x128x128x128_16x16_32x32_2x2_8x32x1_8x32x1_1x32x1x8_8_1x1_intrawave_v3,823.26,293.43,0.0
gfx942,304,34176,5120,5120,ck,0,0,2229.7592,a8w8_blockscale_1x128x128_256x128x128x128_16x16_32x32_2x2_8x32x1_8x32x1_1x32x1x8_8_1x1_intrawave_v3,803.59,247.18,0.0
gfx942,304,34176,5120,12800,ck,0,0,5916.6035,a8w8_blockscale_1x128x128_256x128x128x128_16x16_32x32_2x2_8x32x1_8x32x1_1x32x1x8_8_1x1_intrawave_v3,757.11,144.16,0.0
gfx942,304,34304,5120,4096,ck,0,0,1722.0353,a8w8_blockscale_1x128x128_256x128x128x128_16x16_32x32_2x2_8x32x1_8x32x1_1x32x1x8_8_1x1_intrawave_v3,835.53,297.76,0.0
gfx942,304,34304,5120,5120,ck,0,0,2235.5809,a8w8_blockscale_1x128x128_256x128x128x128_16x16_32x32_2x2_8x32x1_8x32x1_1x32x1x8_8_1x1_intrawave_v3,804.5,247.42,0.0
gfx942,304,34304,5120,12800,ck,0,0,5823.9301,a8w8_blockscale_1x128x128_256x128x128x128_16x16_32x32_2x2_8x32x1_8x32x1_1x32x1x8_8_1x1_intrawave_v3,772.04,146.96,0.0
gfx942,304,34432,5120,4096,ck,0,0,1735.5274,a8w8_blockscale_1x128x128_256x128x128x128_16x16_32x32_2x2_8x32x1_8x32x1_1x32x1x8_8_1x1_intrawave_v3,832.13,296.5,0.0
gfx942,304,34432,5120,5120,ck,0,0,2228.704,a8w8_blockscale_1x128x128_256x128x128x128_16x16_32x32_2x2_8x32x1_8x32x1_1x32x1x8_8_1x1_intrawave_v3,809.99,249.06,0.0
gfx942,304,34432,5120,12800,ck,0,0,5852.0051,a8w8_blockscale_1x128x128_256x128x128x128_16x16_32x32_2x2_8x32x1_8x32x1_1x32x1x8_8_1x1_intrawave_v3,771.2,146.76,0.0
gfx942,304,34560,5120,4096,ck,0,0,1769.4039,a8w8_blockscale_1x128x128_256x128x128x128_16x16_32x32_2x2_8x32x1_8x32x1_1x32x1x8_8_1x1_intrawave_v3,819.23,291.86,0.0
gfx942,304,34560,5120,5120,ck,0,0,2199.6927,a8w8_blockscale_1x128x128_256x128x128x128_16x16_32x32_2x2_8x32x1_8x32x1_1x32x1x8_8_1x1_intrawave_v3,823.72,253.24,0.0
gfx942,304,34560,5120,12800,ck,0,0,5877.1467,a8w8_blockscale_1x128x128_256x128x128x128_16x16_32x32_2x2_8x32x1_8x32x1_1x32x1x8_8_1x1_intrawave_v3,770.76,146.64,0.0
gfx942,304,34688,5120,4096,ck,0,0,1708.5034,a8w8_blockscale_1x128x128_256x128x128x128_16x16_32x32_2x2_8x32x1_8x32x1_1x32x1x8_8_1x1_intrawave_v3,851.58,303.34,0.0
gfx942,304,34688,5120,5120,ck,0,0,2230.4678,a8w8_blockscale_1x128x128_256x128x128x128_16x16_32x32_2x2_8x32x1_8x32x1_1x32x1x8_8_1x1_intrawave_v3,815.37,250.63,0.0
gfx942,304,34688,5120,12800,ck,0,0,5908.1804,a8w8_blockscale_1x128x128_256x128x128x128_16x16_32x32_2x2_8x32x1_8x32x1_1x32x1x8_8_1x1_intrawave_v3,769.55,146.36,0.0
gfx942,304,34816,5120,4096,ck,0,0,1730.6289,a8w8_blockscale_1x128x128_256x128x128x128_16x16_32x32_2x2_8x32x1_8x32x1_1x32x1x8_8_1x1_intrawave_v3,843.79,300.52,0.0
gfx942,304,34816,5120,5120,ck,0,0,2257.104,a8w8_blockscale_1x128x128_256x128x128x128_16x16_32x32_2x2_8x32x1_8x32x1_1x32x1x8_8_1x1_intrawave_v3,808.72,248.54,0.0
gfx942,304,34816,5120,12800,ck,0,0,5937.2242,a8w8_blockscale_1x128x128_256x128x128x128_16x16_32x32_2x2_8x32x1_8x32x1_1x32x1x8_8_1x1_intrawave_v3,768.61,146.15,0.0
gfx942,304,34944,5120,4096,ck,0,0,1748.1014,a8w8_blockscale_1x128x128_256x128x128x128_16x16_32x32_2x2_8x32x1_8x32x1_1x32x1x8_8_1x1_intrawave_v3,838.43,298.57,0.0
gfx942,304,34944,5120,5120,ck,0,0,2289.0489,a8w8_blockscale_1x128x128_256x128x128x128_16x16_32x32_2x2_8x32x1_8x32x1_1x32x1x8_8_1x1_intrawave_v3,800.36,245.93,0.0
gfx942,304,34944,5120,12800,ck,0,0,6081.5535,a8w8_blockscale_1x128x128_256x128x128x128_16x16_32x32_2x2_8x32x1_8x32x1_1x32x1x8_8_1x1_intrawave_v3,753.13,143.16,0.0
gfx942,304,35072,5120,4096,ck,0,0,1741.1639,a8w8_blockscale_1x128x128_256x128x128x128_16x16_32x32_2x2_8x32x1_8x32x1_1x32x1x8_8_1x1_intrawave_v3,844.85,300.81,0.0
gfx942,304,35072,5120,5120,ck,0,0,2280.3316,a8w8_blockscale_1x128x128_256x128x128x128_16x16_32x32_2x2_8x32x1_8x32x1_1x32x1x8_8_1x1_intrawave_v3,806.37,247.74,0.0
gfx942,304,35072,5120,12800,ck,0,0,6089.8155,a8w8_blockscale_1x128x128_256x128x128x128_16x16_32x32_2x2_8x32x1_8x32x1_1x32x1x8_8_1x1_intrawave_v3,754.86,143.45,0.0
gfx942,304,35200,5120,4096,ck,0,0,1736.1884,a8w8_blockscale_1x128x128_256x128x128x128_16x16_32x32_2x2_8x32x1_8x32x1_1x32x1x8_8_1x1_intrawave_v3,850.37,302.73,0.0
gfx942,304,35200,5120,5120,ck,0,0,2259.7357,a8w8_blockscale_1x128x128_256x128x128x128_16x16_32x32_2x2_8x32x1_8x32x1_1x32x1x8_8_1x1_intrawave_v3,816.69,250.86,0.0
gfx942,304,35200,5120,12800,ck,0,0,6014.5744,a8w8_blockscale_1x128x128_256x128x128x128_16x16_32x32_2x2_8x32x1_8x32x1_1x32x1x8_8_1x1_intrawave_v3,767.09,145.74,0.0
gfx942,304,35328,5120,4096,ck,0,0,1789.9022,a8w8_blockscale_1x128x128_256x128x128x128_16x16_32x32_2x2_8x32x1_8x32x1_1x32x1x8_8_1x1_intrawave_v3,827.85,294.67,0.0
gfx942,304,35328,5120,5120,ck,0,0,2275.1454,a8w8_blockscale_1x128x128_256x128x128x128_16x16_32x32_2x2_8x32x1_8x32x1_1x32x1x8_8_1x1_intrawave_v3,814.1,250.03,0.0
gfx942,304,35328,5120,12800,ck,0,0,5990.5682,a8w8_blockscale_1x128x128_256x128x128x128_16x16_32x32_2x2_8x32x1_8x32x1_1x32x1x8_8_1x1_intrawave_v3,772.97,146.81,0.0
gfx942,304,35456,5120,4096,ck,0,0,1821.4906,a8w8_blockscale_1x128x128_256x128x128x128_16x16_32x32_2x2_8x32x1_8x32x1_1x32x1x8_8_1x1_intrawave_v3,816.44,290.57,0.0
gfx942,304,35456,5120,5120,ck,0,0,2327.328,a8w8_blockscale_1x128x128_256x128x128x128_16x16_32x32_2x2_8x32x1_8x32x1_1x32x1x8_8_1x1_intrawave_v3,798.73,245.27,0.0
gfx942,304,35456,5120,12800,ck,0,0,6329.1701,a8w8_blockscale_1x128x128_256x128x128x128_16x16_32x32_2x2_8x32x1_8x32x1_1x32x1x8_8_1x1_intrawave_v3,734.27,139.42,0.0
gfx942,304,35584,5120,4096,ck,0,0,1822.2476,a8w8_blockscale_1x128x128_256x128x128x128_16x16_32x32_2x2_8x32x1_8x32x1_1x32x1x8_8_1x1_intrawave_v3,819.04,291.46,0.0
gfx942,304,35584,5120,5120,ck,0,0,2288.3041,a8w8_blockscale_1x128x128_256x128x128x128_16x16_32x32_2x2_8x32x1_8x32x1_1x32x1x8_8_1x1_intrawave_v3,815.29,250.31,0.0
gfx942,304,35584,5120,12800,ck,0,0,6226.9007,a8w8_blockscale_1x128x128_256x128x128x128_16x16_32x32_2x2_8x32x1_8x32x1_1x32x1x8_8_1x1_intrawave_v3,749.02,142.19,0.0
gfx942,304,35712,5120,4096,ck,0,0,1760.7926,a8w8_blockscale_1x128x128_256x128x128x128_16x16_32x32_2x2_8x32x1_8x32x1_1x32x1x8_8_1x1_intrawave_v3,850.68,302.67,0.0
gfx942,304,35712,5120,5120,ck,0,0,2313.9978,a8w8_blockscale_1x128x128_256x128x128x128_16x16_32x32_2x2_8x32x1_8x32x1_1x32x1x8_8_1x1_intrawave_v3,809.14,248.38,0.0
gfx942,304,35712,5120,12800,ck,0,0,6205.5592,a8w8_blockscale_1x128x128_256x128x128x128_16x16_32x32_2x2_8x32x1_8x32x1_1x32x1x8_8_1x1_intrawave_v3,754.3,143.15,0.0
gfx942,304,35840,5120,4096,ck,0,0,1769.5559,a8w8_blockscale_1x128x128_256x128x128x128_16x16_32x32_2x2_8x32x1_8x32x1_1x32x1x8_8_1x1_intrawave_v3,849.5,302.21,0.0
gfx942,304,35840,5120,5120,ck,0,0,2290.7519,a8w8_blockscale_1x128x128_256x128x128x128_16x16_32x32_2x2_8x32x1_8x32x1_1x32x1x8_8_1x1_intrawave_v3,820.28,251.76,0.0
gfx942,304,35840,5120,12800,ck,0,0,6227.3921,a8w8_blockscale_1x128x128_256x128x128x128_16x16_32x32_2x2_8x32x1_8x32x1_1x32x1x8_8_1x1_intrawave_v3,754.35,143.12,0.0
gfx942,304,35968,5120,4096,ck,0,0,1826.5182,a8w8_blockscale_1x128x128_256x128x128x128_16x16_32x32_2x2_8x32x1_8x32x1_1x32x1x8_8_1x1_intrawave_v3,825.95,293.79,0.0
gfx942,304,35968,5120,5120,ck,0,0,2338.9046,a8w8_blockscale_1x128x128_256x128x128x128_16x16_32x32_2x2_8x32x1_8x32x1_1x32x1x8_8_1x1_intrawave_v3,806.26,247.42,0.0
gfx942,304,35968,5120,12800,ck,0,0,6516.2216,a8w8_blockscale_1x128x128_256x128x128x128_16x16_32x32_2x2_8x32x1_8x32x1_1x32x1x8_8_1x1_intrawave_v3,723.49,137.23,0.0
gfx942,304,36096,5120,4096,ck,0,0,1834.4304,a8w8_blockscale_1x128x128_256x128x128x128_16x16_32x32_2x2_8x32x1_8x32x1_1x32x1x8_8_1x1_intrawave_v3,825.31,293.52,0.0
gfx942,304,36096,5120,5120,ck,0,0,2361.5493,a8w8_blockscale_1x128x128_256x128x128x128_16x16_32x32_2x2_8x32x1_8x32x1_1x32x1x8_8_1x1_intrawave_v3,801.37,245.88,0.0
gfx942,304,36096,5120,12800,ck,0,0,6434.4594,a8w8_blockscale_1x128x128_256x128x128x128_16x16_32x32_2x2_8x32x1_8x32x1_1x32x1x8_8_1x1_intrawave_v3,735.29,139.43,0.0
gfx942,304,36224,5120,4096,ck,0,0,1860.3291,a8w8_blockscale_1x128x128_256x128x128x128_16x16_32x32_2x2_8x32x1_8x32x1_1x32x1x8_8_1x1_intrawave_v3,816.71,290.42,0.0
gfx942,304,36224,5120,5120,ck,0,0,2299.1886,a8w8_blockscale_1x128x128_256x128x128x128_16x16_32x32_2x2_8x32x1_8x32x1_1x32x1x8_8_1x1_intrawave_v3,826.02,253.4,0.0
gfx942,304,36224,5120,12800,ck,0,0,6285.0203,a8w8_blockscale_1x128x128_256x128x128x128_16x16_32x32_2x2_8x32x1_8x32x1_1x32x1x8_8_1x1_intrawave_v3,755.44,143.22,0.0
gfx942,304,36352,5120,4096,ck,0,0,1853.0042,a8w8_blockscale_1x128x128_256x128x128x128_16x16_32x32_2x2_8x32x1_8x32x1_1x32x1x8_8_1x1_intrawave_v3,822.83,292.56,0.0
gfx942,304,36352,5120,5120,ck,0,0,2330.1606,a8w8_blockscale_1x128x128_256x128x128x128_16x16_32x32_2x2_8x32x1_8x32x1_1x32x1x8_8_1x1_intrawave_v3,817.92,250.88,0.0
gfx942,304,36352,5120,12800,ck,0,0,6304.2386,a8w8_blockscale_1x128x128_256x128x128x128_16x16_32x32_2x2_8x32x1_8x32x1_1x32x1x8_8_1x1_intrawave_v3,755.8,143.25,0.0
gfx942,304,36480,5120,4096,ck,0,0,1828.8902,a8w8_blockscale_1x128x128_256x128x128x128_16x16_32x32_2x2_8x32x1_8x32x1_1x32x1x8_8_1x1_intrawave_v3,836.62,297.42,0.0
gfx942,304,36480,5120,5120,ck,0,0,2331.6195,a8w8_blockscale_1x128x128_256x128x128x128_16x16_32x32_2x2_8x32x1_8x32x1_1x32x1x8_8_1x1_intrawave_v3,820.29,251.56,0.0
gfx942,304,36480,5120,12800,ck,0,0,6335.6473,a8w8_blockscale_1x128x128_256x128x128x128_16x16_32x32_2x2_8x32x1_8x32x1_1x32x1x8_8_1x1_intrawave_v3,754.7,143.01,0.0
gfx942,304,36608,5120,4096,ck,0,0,1873.5153,a8w8_blockscale_1x128x128_256x128x128x128_16x16_32x32_2x2_8x32x1_8x32x1_1x32x1x8_8_1x1_intrawave_v3,819.56,291.32,0.0
gfx942,304,36608,5120,5120,ck,0,0,2386.6603,a8w8_blockscale_1x128x128_256x128x128x128_16x16_32x32_2x2_8x32x1_8x32x1_1x32x1x8_8_1x1_intrawave_v3,804.18,246.58,0.0
gfx942,304,36608,5120,12800,ck,0,0,6379.4329,a8w8_blockscale_1x128x128_256x128x128x128_16x16_32x32_2x2_8x32x1_8x32x1_1x32x1x8_8_1x1_intrawave_v3,752.15,142.49,0.0
gfx942,304,36736,5120,4096,ck,0,0,1838.4777,a8w8_blockscale_1x128x128_256x128x128x128_16x16_32x32_2x2_8x32x1_8x32x1_1x32x1x8_8_1x1_intrawave_v3,838.1,297.87,0.0
gfx942,304,36736,5120,5120,ck,0,0,2392.2413,a8w8_blockscale_1x128x128_256x128x128x128_16x16_32x32_2x2_8x32x1_8x32x1_1x32x1x8_8_1x1_intrawave_v3,805.11,246.83,0.0
gfx942,304,36736,5120,12800,ck,0,0,6375.56,a8w8_blockscale_1x128x128_256x128x128x128_16x16_32x32_2x2_8x32x1_8x32x1_1x32x1x8_8_1x1_intrawave_v3,755.24,143.04,0.0
gfx942,304,36864,5120,4096,ck,0,0,1832.962,a8w8_blockscale_1x128x128_256x128x128x128_16x16_32x32_2x2_8x32x1_8x32x1_1x32x1x8_8_1x1_intrawave_v3,843.55,299.76,0.0
gfx942,304,36864,5120,5120,ck,0,0,2378.0342,a8w8_blockscale_1x128x128_256x128x128x128_16x16_32x32_2x2_8x32x1_8x32x1_1x32x1x8_8_1x1_intrawave_v3,812.74,249.13,0.0
gfx942,304,36864,5120,12800,ck,0,0,6395.3834,a8w8_blockscale_1x128x128_256x128x128x128_16x16_32x32_2x2_8x32x1_8x32x1_1x32x1x8_8_1x1_intrawave_v3,755.52,143.05,0.0
gfx942,304,36992,5120,4096,ck,0,0,1895.2569,a8w8_blockscale_1x128x128_256x128x128x128_16x16_32x32_2x2_8x32x1_8x32x1_1x32x1x8_8_1x1_intrawave_v3,818.65,290.88,0.0
gfx942,304,36992,5120,5120,ck,0,0,2436.8423,a8w8_blockscale_1x128x128_256x128x128x128_16x16_32x32_2x2_8x32x1_8x32x1_1x32x1x8_8_1x1_intrawave_v3,795.88,243.93,0.0
gfx942,304,36992,5120,12800,ck,0,0,6615.1419,a8w8_blockscale_1x128x128_256x128x128x128_16x16_32x32_2x2_8x32x1_8x32x1_1x32x1x8_8_1x1_intrawave_v3,732.96,138.75,0.0
gfx942,304,37120,5120,4096,ck,0,0,1845.4122,a8w8_blockscale_1x128x128_256x128x128x128_16x16_32x32_2x2_8x32x1_8x32x1_1x32x1x8_8_1x1_intrawave_v3,843.67,299.73,0.0
gfx942,304,37120,5120,5120,ck,0,0,2397.8586,a8w8_blockscale_1x128x128_256x128x128x128_16x16_32x32_2x2_8x32x1_8x32x1_1x32x1x8_8_1x1_intrawave_v3,811.62,248.71,0.0
gfx942,304,37120,5120,12800,ck,0,0,6497.8634,a8w8_blockscale_1x128x128_256x128x128x128_16x16_32x32_2x2_8x32x1_8x32x1_1x32x1x8_8_1x1_intrawave_v3,748.77,141.71,0.0
gfx942,304,37248,5120,4096,ck,0,0,1856.4518,a8w8_blockscale_1x128x128_256x128x128x128_16x16_32x32_2x2_8x32x1_8x32x1_1x32x1x8_8_1x1_intrawave_v3,841.55,298.94,0.0
gfx942,304,37248,5120,5120,ck,0,0,2408.4341,a8w8_blockscale_1x128x128_256x128x128x128_16x16_32x32_2x2_8x32x1_8x32x1_1x32x1x8_8_1x1_intrawave_v3,810.85,248.44,0.0
gfx942,304,37248,5120,12800,ck,0,0,6544.3118,a8w8_blockscale_1x128x128_256x128x128x128_16x16_32x32_2x2_8x32x1_8x32x1_1x32x1x8_8_1x1_intrawave_v3,746.02,141.15,0.0
gfx942,304,37376,5120,4096,ck,0,0,1867.444,a8w8_blockscale_1x128x128_256x128x128x128_16x16_32x32_2x2_8x32x1_8x32x1_1x32x1x8_8_1x1_intrawave_v3,839.47,298.16,0.0
gfx942,304,37376,5120,5120,ck,0,0,2398.7579,a8w8_blockscale_1x128x128_256x128x128x128_16x16_32x32_2x2_8x32x1_8x32x1_1x32x1x8_8_1x1_intrawave_v3,816.91,250.26,0.0
gfx942,304,37376,5120,12800,ck,0,0,6355.0844,a8w8_blockscale_1x128x128_256x128x128x128_16x16_32x32_2x2_8x32x1_8x32x1_1x32x1x8_8_1x1_intrawave_v3,770.87,145.82,0.0
gfx942,304,37504,5120,4096,ck,0,0,1900.8051,a8w8_blockscale_1x128x128_256x128x128x128_16x16_32x32_2x2_8x32x1_8x32x1_1x32x1x8_8_1x1_intrawave_v3,827.56,293.89,0.0
gfx942,304,37504,5120,5120,ck,0,0,2427.3349,a8w8_blockscale_1x128x128_256x128x128x128_16x16_32x32_2x2_8x32x1_8x32x1_1x32x1x8_8_1x1_intrawave_v3,810.06,248.12,0.0
gfx942,304,37504,5120,12800,ck,0,0,6384.2549,a8w8_blockscale_1x128x128_256x128x128x128_16x16_32x32_2x2_8x32x1_8x32x1_1x32x1x8_8_1x1_intrawave_v3,769.98,145.61,0.0
gfx942,304,37632,5120,4096,ck,0,0,1883.3683,a8w8_blockscale_1x128x128_256x128x128x128_16x16_32x32_2x2_8x32x1_8x32x1_1x32x1x8_8_1x1_intrawave_v3,838.07,297.59,0.0
gfx942,304,37632,5120,5120,ck,0,0,2453.8263,a8w8_blockscale_1x128x128_256x128x128x128_16x16_32x32_2x2_8x32x1_8x32x1_1x32x1x8_8_1x1_intrawave_v3,804.05,246.24,0.0
gfx942,304,37632,5120,12800,ck,0,0,6405.5461,a8w8_blockscale_1x128x128_256x128x128x128_16x16_32x32_2x2_8x32x1_8x32x1_1x32x1x8_8_1x1_intrawave_v3,770.04,145.59,0.0
gfx942,304,37760,5120,4096,ck,0,0,1914.276,a8w8_blockscale_1x128x128_256x128x128x128_16x16_32x32_2x2_8x32x1_8x32x1_1x32x1x8_8_1x1_intrawave_v3,827.35,293.74,0.0
gfx942,304,37760,5120,5120,ck,0,0,2437.5529,a8w8_blockscale_1x128x128_256x128x128x128_16x16_32x32_2x2_8x32x1_8x32x1_1x32x1x8_8_1x1_intrawave_v3,812.17,248.7,0.0
gfx942,304,37760,5120,12800,ck,0,0,6464.171,a8w8_blockscale_1x128x128_256x128x128x128_16x16_32x32_2x2_8x32x1_8x32x1_1x32x1x8_8_1x1_intrawave_v3,765.65,144.72,0.0
gfx942,304,37888,5120,4096,ck,0,0,1934.1794,a8w8_blockscale_1x128x128_256x128x128x128_16x16_32x32_2x2_8x32x1_8x32x1_1x32x1x8_8_1x1_intrawave_v3,821.61,291.67,0.0
gfx942,304,37888,5120,5120,ck,0,0,2435.6919,a8w8_blockscale_1x128x128_256x128x128x128_16x16_32x32_2x2_8x32x1_8x32x1_1x32x1x8_8_1x1_intrawave_v3,815.55,249.69,0.0
gfx942,304,37888,5120,12800,ck,0,0,6558.1102,a8w8_blockscale_1x128x128_256x128x128x128_16x16_32x32_2x2_8x32x1_8x32x1_1x32x1x8_8_1x1_intrawave_v3,757.24,143.1,0.0
gfx942,304,38016,5120,4096,ck,0,0,1940.4572,a8w8_blockscale_1x128x128_256x128x128x128_16x16_32x32_2x2_8x32x1_8x32x1_1x32x1x8_8_1x1_intrawave_v3,821.72,291.67,0.0
gfx942,304,38016,5120,5120,ck,0,0,2492.5911,a8w8_blockscale_1x128x128_256x128x128x128_16x16_32x32_2x2_8x32x1_8x32x1_1x32x1x8_8_1x1_intrawave_v3,799.62,244.78,0.0
gfx942,304,38016,5120,12800,ck,0,0,6714.8022,a8w8_blockscale_1x128x128_256x128x128x128_16x16_32x32_2x2_8x32x1_8x32x1_1x32x1x8_8_1x1_intrawave_v3,742.07,140.2,0.0
gfx942,304,38144,5120,4096,ck,0,0,1918.8854,a8w8_blockscale_1x128x128_256x128x128x128_16x16_32x32_2x2_8x32x1_8x32x1_1x32x1x8_8_1x1_intrawave_v3,833.75,295.9,0.0
gfx942,304,38144,5120,5120,ck,0,0,2471.9857,a8w8_blockscale_1x128x128_256x128x128x128_16x16_32x32_2x2_8x32x1_8x32x1_1x32x1x8_8_1x1_intrawave_v3,809.0,247.62,0.0
gfx942,304,38144,5120,12800,ck,0,0,6524.3159,a8w8_blockscale_1x128x128_256x128x128x128_16x16_32x32_2x2_8x32x1_8x32x1_1x32x1x8_8_1x1_intrawave_v3,766.3,144.75,0.0
gfx942,304,38272,5120,4096,ck,0,0,1913.1428,a8w8_blockscale_1x128x128_256x128x128x128_16x16_32x32_2x2_8x32x1_8x32x1_1x32x1x8_8_1x1_intrawave_v3,839.06,297.75,0.0
gfx942,304,38272,5120,5120,ck,0,0,2514.4047,a8w8_blockscale_1x128x128_256x128x128x128_16x16_32x32_2x2_8x32x1_8x32x1_1x32x1x8_8_1x1_intrawave_v3,798.02,244.22,0.0
gfx942,304,38272,5120,12800,ck,0,0,6546.45,a8w8_blockscale_1x128x128_256x128x128x128_16x16_32x32_2x2_8x32x1_8x32x1_1x32x1x8_8_1x1_intrawave_v3,766.28,144.71,0.0
gfx942,304,38400,5120,4096,ck,0,0,1912.2508,a8w8_blockscale_1x128x128_256x128x128x128_16x16_32x32_2x2_8x32x1_8x32x1_1x32x1x8_8_1x1_intrawave_v3,842.26,298.85,0.0
gfx942,304,38400,5120,5120,ck,0,0,2509.1229,a8w8_blockscale_1x128x128_256x128x128x128_16x16_32x32_2x2_8x32x1_8x32x1_1x32x1x8_8_1x1_intrawave_v3,802.38,245.52,0.0
gfx942,304,38400,5120,12800,ck,0,0,6531.2692,a8w8_blockscale_1x128x128_256x128x128x128_16x16_32x32_2x2_8x32x1_8x32x1_1x32x1x8_8_1x1_intrawave_v3,770.63,145.5,0.0
gfx942,304,38528,5120,4096,ck,0,0,1937.0307,a8w8_blockscale_1x128x128_256x128x128x128_16x16_32x32_2x2_8x32x1_8x32x1_1x32x1x8_8_1x1_intrawave_v3,834.26,295.97,0.0
gfx942,304,38528,5120,5120,ck,0,0,2526.8918,a8w8_blockscale_1x128x128_256x128x128x128_16x16_32x32_2x2_8x32x1_8x32x1_1x32x1x8_8_1x1_intrawave_v3,799.39,244.57,0.0
gfx942,304,38528,5120,12800,ck,0,0,6742.1814,a8w8_blockscale_1x128x128_256x128x128x128_16x16_32x32_2x2_8x32x1_8x32x1_1x32x1x8_8_1x1_intrawave_v3,749.01,141.38,0.0
gfx942,304,38656,5120,4096,ck,0,0,1893.8846,a8w8_blockscale_1x128x128_256x128x128x128_16x16_32x32_2x2_8x32x1_8x32x1_1x32x1x8_8_1x1_intrawave_v3,856.1,303.68,0.0
gfx942,304,38656,5120,5120,ck,0,0,2504.769,a8w8_blockscale_1x128x128_256x128x128x128_16x16_32x32_2x2_8x32x1_8x32x1_1x32x1x8_8_1x1_intrawave_v3,809.13,247.52,0.0
gfx942,304,38656,5120,12800,ck,0,0,6775.5835,a8w8_blockscale_1x128x128_256x128x128x128_16x16_32x32_2x2_8x32x1_8x32x1_1x32x1x8_8_1x1_intrawave_v3,747.79,141.12,0.0
gfx942,304,38784,5120,4096,ck,0,0,1894.3433,a8w8_blockscale_1x128x128_256x128x128x128_16x16_32x32_2x2_8x32x1_8x32x1_1x32x1x8_8_1x1_intrawave_v3,858.72,304.58,0.0
gfx942,304,38784,5120,5120,ck,0,0,2534.5807,a8w8_blockscale_1x128x128_256x128x128x128_16x16_32x32_2x2_8x32x1_8x32x1_1x32x1x8_8_1x1_intrawave_v3,802.26,245.38,0.0
gfx942,304,38784,5120,12800,ck,0,0,6747.5479,a8w8_blockscale_1x128x128_256x128x128x128_16x16_32x32_2x2_8x32x1_8x32x1_1x32x1x8_8_1x1_intrawave_v3,753.38,142.14,0.0
gfx942,304,38912,5120,4096,ck,0,0,1953.0119,a8w8_blockscale_1x128x128_256x128x128x128_16x16_32x32_2x2_8x32x1_8x32x1_1x32x1x8_8_1x1_intrawave_v3,835.68,296.37,0.0
gfx942,304,38912,5120,5120,ck,0,0,2512.6466,a8w8_blockscale_1x128x128_256x128x128x128_16x16_32x32_2x2_8x32x1_8x32x1_1x32x1x8_8_1x1_intrawave_v3,811.94,248.31,0.0
gfx942,304,38912,5120,12800,ck,0,0,6965.6905,a8w8_blockscale_1x128x128_256x128x128x128_16x16_32x32_2x2_8x32x1_8x32x1_1x32x1x8_8_1x1_intrawave_v3,732.2,138.12,0.0
gfx942,304,39040,5120,4096,ck,0,0,1949.9221,a8w8_blockscale_1x128x128_256x128x128x128_16x16_32x32_2x2_8x32x1_8x32x1_1x32x1x8_8_1x1_intrawave_v3,839.75,297.78,0.0
gfx942,304,39040,5120,5120,ck,0,0,2505.4363,a8w8_blockscale_1x128x128_256x128x128x128_16x16_32x32_2x2_8x32x1_8x32x1_1x32x1x8_8_1x1_intrawave_v3,816.95,249.8,0.0
gfx942,304,39040,5120,12800,ck,0,0,6715.3642,a8w8_blockscale_1x128x128_256x128x128x128_16x16_32x32_2x2_8x32x1_8x32x1_1x32x1x8_8_1x1_intrawave_v3,761.99,143.7,0.0
gfx942,304,39168,5120,4096,ck,0,0,1989.9417,a8w8_blockscale_1x128x128_256x128x128x128_16x16_32x32_2x2_8x32x1_8x32x1_1x32x1x8_8_1x1_intrawave_v3,825.56,292.71,0.0
gfx942,304,39168,5120,5120,ck,0,0,2534.3927,a8w8_blockscale_1x128x128_256x128x128x128_16x16_32x32_2x2_8x32x1_8x32x1_1x32x1x8_8_1x1_intrawave_v3,810.27,247.73,0.0
gfx942,304,39168,5120,12800,ck,0,0,6707.4894,a8w8_blockscale_1x128x128_256x128x128x128_16x16_32x32_2x2_8x32x1_8x32x1_1x32x1x8_8_1x1_intrawave_v3,765.39,144.31,0.0
gfx942,304,39296,5120,4096,ck,0,0,1920.36,a8w8_blockscale_1x128x128_256x128x128x128_16x16_32x32_2x2_8x32x1_8x32x1_1x32x1x8_8_1x1_intrawave_v3,858.27,304.28,0.0
gfx942,304,39296,5120,5120,ck,0,0,2531.5497,a8w8_blockscale_1x128x128_256x128x128x128_16x16_32x32_2x2_8x32x1_8x32x1_1x32x1x8_8_1x1_intrawave_v3,813.83,248.78,0.0
gfx942,304,39296,5120,12800,ck,0,0,6912.0601,a8w8_blockscale_1x128x128_256x128x128x128_16x16_32x32_2x2_8x32x1_8x32x1_1x32x1x8_8_1x1_intrawave_v3,745.16,140.47,0.0
gfx942,304,39424,5120,4096,ck,0,0,1946.8059,a8w8_blockscale_1x128x128_256x128x128x128_16x16_32x32_2x2_8x32x1_8x32x1_1x32x1x8_8_1x1_intrawave_v3,849.37,301.08,0.0
gfx942,304,39424,5120,5120,ck,0,0,2561.2468,a8w8_blockscale_1x128x128_256x128x128x128_16x16_32x32_2x2_8x32x1_8x32x1_1x32x1x8_8_1x1_intrawave_v3,807.01,246.66,0.0
gfx942,304,39424,5120,12800,ck,0,0,7052.0298,a8w8_blockscale_1x128x128_256x128x128x128_16x16_32x32_2x2_8x32x1_8x32x1_1x32x1x8_8_1x1_intrawave_v3,732.75,138.1,0.0
gfx942,304,39552,5120,4096,ck,0,0,2016.2524,a8w8_blockscale_1x128x128_256x128x128x128_16x16_32x32_2x2_8x32x1_8x32x1_1x32x1x8_8_1x1_intrawave_v3,822.78,291.62,0.0
gfx942,304,39552,5120,5120,ck,0,0,2611.4574,a8w8_blockscale_1x128x128_256x128x128x128_16x16_32x32_2x2_8x32x1_8x32x1_1x32x1x8_8_1x1_intrawave_v3,794.06,242.67,0.0
gfx942,304,39552,5120,12800,ck,0,0,6947.1361,a8w8_blockscale_1x128x128_256x128x128x128_16x16_32x32_2x2_8x32x1_8x32x1_1x32x1x8_8_1x1_intrawave_v3,746.23,140.61,0.0
gfx942,304,39680,5120,4096,ck,0,0,1945.3237,a8w8_blockscale_1x128x128_256x128x128x128_16x16_32x32_2x2_8x32x1_8x32x1_1x32x1x8_8_1x1_intrawave_v3,855.54,303.2,0.0
gfx942,304,39680,5120,5120,ck,0,0,2570.7648,a8w8_blockscale_1x128x128_256x128x128x128_16x16_32x32_2x2_8x32x1_8x32x1_1x32x1x8_8_1x1_intrawave_v3,809.24,247.28,0.0
gfx942,304,39680,5120,12800,ck,0,0,6956.057,a8w8_blockscale_1x128x128_256x128x128x128_16x16_32x32_2x2_8x32x1_8x32x1_1x32x1x8_8_1x1_intrawave_v3,747.68,140.85,0.0
gfx942,304,39808,5120,4096,ck,0,0,1947.1026,a8w8_blockscale_1x128x128_256x128x128x128_16x16_32x32_2x2_8x32x1_8x32x1_1x32x1x8_8_1x1_intrawave_v3,857.51,303.87,0.0
gfx942,304,39808,5120,5120,ck,0,0,2602.2387,a8w8_blockscale_1x128x128_256x128x128x128_16x16_32x32_2x2_8x32x1_8x32x1_1x32x1x8_8_1x1_intrawave_v3,802.03,245.04,0.0
gfx942,304,39808,5120,12800,ck,0,0,7202.4611,a8w8_blockscale_1x128x128_256x128x128x128_16x16_32x32_2x2_8x32x1_8x32x1_1x32x1x8_8_1x1_intrawave_v3,724.43,136.44,0.0
gfx942,304,39936,5120,4096,ck,0,0,1998.298,a8w8_blockscale_1x128x128_256x128x128x128_16x16_32x32_2x2_8x32x1_8x32x1_1x32x1x8_8_1x1_intrawave_v3,838.23,297.0,0.0
gfx942,304,39936,5120,5120,ck,0,0,2579.1573,a8w8_blockscale_1x128x128_256x128x128x128_16x16_32x32_2x2_8x32x1_8x32x1_1x32x1x8_8_1x1_intrawave_v3,811.81,248.0,0.0
gfx942,304,39936,5120,12800,ck,0,0,6971.8684,a8w8_blockscale_1x128x128_256x128x128x128_16x16_32x32_2x2_8x32x1_8x32x1_1x32x1x8_8_1x1_intrawave_v3,750.8,141.38,0.0
gfx942,304,40064,5120,4096,ck,0,0,2025.7902,a8w8_blockscale_1x128x128_256x128x128x128_16x16_32x32_2x2_8x32x1_8x32x1_1x32x1x8_8_1x1_intrawave_v3,829.51,293.87,0.0
gfx942,304,40064,5120,5120,ck,0,0,2602.8051,a8w8_blockscale_1x128x128_256x128x128x128_16x16_32x32_2x2_8x32x1_8x32x1_1x32x1x8_8_1x1_intrawave_v3,807.02,246.5,0.0
gfx942,304,40064,5120,12800,ck,0,0,6917.3201,a8w8_blockscale_1x128x128_256x128x128x128_16x16_32x32_2x2_8x32x1_8x32x1_1x32x1x8_8_1x1_intrawave_v3,759.15,142.92,0.0
gfx942,304,40192,5120,4096,ck,0,0,2016.9856,a8w8_blockscale_1x128x128_256x128x128x128_16x16_32x32_2x2_8x32x1_8x32x1_1x32x1x8_8_1x1_intrawave_v3,835.79,296.07,0.0
gfx942,304,40192,5120,5120,ck,0,0,2616.7288,a8w8_blockscale_1x128x128_256x128x128x128_16x16_32x32_2x2_8x32x1_8x32x1_1x32x1x8_8_1x1_intrawave_v3,805.29,245.94,0.0
gfx942,304,40192,5120,12800,ck,0,0,6937.8787,a8w8_blockscale_1x128x128_256x128x128x128_16x16_32x32_2x2_8x32x1_8x32x1_1x32x1x8_8_1x1_intrawave_v3,759.32,142.92,0.0
gfx942,304,40320,5120,4096,ck,0,0,1978.3446,a8w8_blockscale_1x128x128_256x128x128x128_16x16_32x32_2x2_8x32x1_8x32x1_1x32x1x8_8_1x1_intrawave_v3,854.83,302.78,0.0
gfx942,304,40320,5120,5120,ck,0,0,2643.9987,a8w8_blockscale_1x128x128_256x128x128x128_16x16_32x32_2x2_8x32x1_8x32x1_1x32x1x8_8_1x1_intrawave_v3,799.52,244.15,0.0
gfx942,304,40320,5120,12800,ck,0,0,6898.6899,a8w8_blockscale_1x128x128_256x128x128x128_16x16_32x32_2x2_8x32x1_8x32x1_1x32x1x8_8_1x1_intrawave_v3,766.06,144.16,0.0
gfx942,304,40448,5120,4096,ck,0,0,2000.5381,a8w8_blockscale_1x128x128_256x128x128x128_16x16_32x32_2x2_8x32x1_8x32x1_1x32x1x8_8_1x1_intrawave_v3,848.03,300.34,0.0
gfx942,304,40448,5120,5120,ck,0,0,2648.4805,a8w8_blockscale_1x128x128_256x128x128x128_16x16_32x32_2x2_8x32x1_8x32x1_1x32x1x8_8_1x1_intrawave_v3,800.7,244.48,0.0
gfx942,304,40448,5120,12800,ck,0,0,7047.0848,a8w8_blockscale_1x128x128_256x128x128x128_16x16_32x32_2x2_8x32x1_8x32x1_1x32x1x8_8_1x1_intrawave_v3,752.31,141.54,0.0
gfx942,304,40576,5120,4096,ck,0,0,2030.0421,a8w8_blockscale_1x128x128_256x128x128x128_16x16_32x32_2x2_8x32x1_8x32x1_1x32x1x8_8_1x1_intrawave_v3,838.35,296.88,0.0
gfx942,304,40576,5120,5120,ck,0,0,2594.7854,a8w8_blockscale_1x128x128_256x128x128x128_16x16_32x32_2x2_8x32x1_8x32x1_1x32x1x8_8_1x1_intrawave_v3,819.86,250.29,0.0
gfx942,304,40576,5120,12800,ck,0,0,7264.3235,a8w8_blockscale_1x128x128_256x128x128x128_16x16_32x32_2x2_8x32x1_8x32x1_1x32x1x8_8_1x1_intrawave_v3,732.12,137.72,0.0
gfx942,304,40704,5120,4096,ck,0,0,2021.5781,a8w8_blockscale_1x128x128_256x128x128x128_16x16_32x32_2x2_8x32x1_8x32x1_1x32x1x8_8_1x1_intrawave_v3,844.51,299.03,0.0
gfx942,304,40704,5120,5120,ck,0,0,2612.0953,a8w8_blockscale_1x128x128_256x128x128x128_16x16_32x32_2x2_8x32x1_8x32x1_1x32x1x8_8_1x1_intrawave_v3,816.99,249.39,0.0
gfx942,304,40704,5120,12800,ck,0,0,7289.0575,a8w8_blockscale_1x128x128_256x128x128x128_16x16_32x32_2x2_8x32x1_8x32x1_1x32x1x8_8_1x1_intrawave_v3,731.94,137.65,0.0
gfx942,304,40832,5120,4096,ck,0,0,2060.2915,a8w8_blockscale_1x128x128_256x128x128x128_16x16_32x32_2x2_8x32x1_8x32x1_1x32x1x8_8_1x1_intrawave_v3,831.25,294.3,0.0
gfx942,304,40832,5120,5120,ck,0,0,2628.0743,a8w8_blockscale_1x128x128_256x128x128x128_16x16_32x32_2x2_8x32x1_8x32x1_1x32x1x8_8_1x1_intrawave_v3,814.58,248.62,0.0
gfx942,304,40832,5120,12800,ck,0,0,7332.9405,a8w8_blockscale_1x128x128_256x128x128x128_16x16_32x32_2x2_8x32x1_8x32x1_1x32x1x8_8_1x1_intrawave_v3,729.85,137.23,0.0
gfx942,304,40960,5120,4096,ck,0,0,2088.6463,a8w8_blockscale_1x128x128_256x128x128x128_16x16_32x32_2x2_8x32x1_8x32x1_1x32x1x8_8_1x1_intrawave_v3,822.54,291.18,0.0
gfx942,304,40960,5120,5120,ck,0,0,2669.017,a8w8_blockscale_1x128x128_256x128x128x128_16x16_32x32_2x2_8x32x1_8x32x1_1x32x1x8_8_1x1_intrawave_v3,804.6,245.54,0.0
gfx942,304,40960,5120,12800,ck,0,0,7168.462,a8w8_blockscale_1x128x128_256x128x128x128_16x16_32x32_2x2_8x32x1_8x32x1_1x32x1x8_8_1x1_intrawave_v3,748.93,140.79,0.0
gfx942,304,41088,5120,4096,ck,0,0,2076.0577,a8w8_blockscale_1x128x128_256x128x128x128_16x16_32x32_2x2_8x32x1_8x32x1_1x32x1x8_8_1x1_intrawave_v3,830.11,293.83,0.0
gfx942,304,41088,5120,5120,ck,0,0,2685.6382,a8w8_blockscale_1x128x128_256x128x128x128_16x16_32x32_2x2_8x32x1_8x32x1_1x32x1x8_8_1x1_intrawave_v3,802.12,244.76,0.0
gfx942,304,41088,5120,12800,ck,0,0,7202.48,a8w8_blockscale_1x128x128_256x128x128x128_16x16_32x32_2x2_8x32x1_8x32x1_1x32x1x8_8_1x1_intrawave_v3,747.73,140.54,0.0
gfx942,304,41216,5120,4096,ck,0,0,2065.3283,a8w8_blockscale_1x128x128_256x128x128x128_16x16_32x32_2x2_8x32x1_8x32x1_1x32x1x8_8_1x1_intrawave_v3,837.02,296.25,0.0
gfx942,304,41216,5120,5120,ck,0,0,2700.7164,a8w8_blockscale_1x128x128_256x128x128x128_16x16_32x32_2x2_8x32x1_8x32x1_1x32x1x8_8_1x1_intrawave_v3,800.12,244.12,0.0
gfx942,304,41216,5120,12800,ck,0,0,7386.2755,a8w8_blockscale_1x128x128_256x128x128x128_16x16_32x32_2x2_8x32x1_8x32x1_1x32x1x8_8_1x1_intrawave_v3,731.39,137.44,0.0
gfx942,304,41344,5120,4096,ck,0,0,2110.3166,a8w8_blockscale_1x128x128_256x128x128x128_16x16_32x32_2x2_8x32x1_8x32x1_1x32x1x8_8_1x1_intrawave_v3,821.72,290.8,0.0
gfx942,304,41344,5120,5120,ck,0,0,2714.6155,a8w8_blockscale_1x128x128_256x128x128x128_16x16_32x32_2x2_8x32x1_8x32x1_1x32x1x8_8_1x1_intrawave_v3,798.5,243.59,0.0
gfx942,304,41344,5120,12800,ck,0,0,7257.5418,a8w8_blockscale_1x128x128_256x128x128x128_16x16_32x32_2x2_8x32x1_8x32x1_1x32x1x8_8_1x1_intrawave_v3,746.68,140.28,0.0
gfx942,304,41472,5120,4096,ck,0,0,2107.4969,a8w8_blockscale_1x128x128_256x128x128x128_16x16_32x32_2x2_8x32x1_8x32x1_1x32x1x8_8_1x1_intrawave_v3,825.37,292.06,0.0
gfx942,304,41472,5120,5120,ck,0,0,2686.8451,a8w8_blockscale_1x128x128_256x128x128x128_16x16_32x32_2x2_8x32x1_8x32x1_1x32x1x8_8_1x1_intrawave_v3,809.25,246.84,0.0
gfx942,304,41472,5120,12800,ck,0,0,7216.4682,a8w8_blockscale_1x128x128_256x128x128x128_16x16_32x32_2x2_8x32x1_8x32x1_1x32x1x8_8_1x1_intrawave_v3,753.25,141.49,0.0
gfx942,304,41600,5120,4096,ck,0,0,2125.5307,a8w8_blockscale_1x128x128_256x128x128x128_16x16_32x32_2x2_8x32x1_8x32x1_1x32x1x8_8_1x1_intrawave_v3,820.89,290.44,0.0
gfx942,304,41600,5120,5120,ck,0,0,2739.6589,a8w8_blockscale_1x128x128_256x128x128x128_16x16_32x32_2x2_8x32x1_8x32x1_1x32x1x8_8_1x1_intrawave_v3,796.1,242.8,0.0
gfx942,304,41600,5120,12800,ck,0,0,7095.6199,a8w8_blockscale_1x128x128_256x128x128x128_16x16_32x32_2x2_8x32x1_8x32x1_1x32x1x8_8_1x1_intrawave_v3,768.45,144.31,0.0
gfx942,304,41728,5120,4096,ck,0,0,2073.3901,a8w8_blockscale_1x128x128_256x128x128x128_16x16_32x32_2x2_8x32x1_8x32x1_1x32x1x8_8_1x1_intrawave_v3,844.12,298.63,0.0
gfx942,304,41728,5120,5120,ck,0,0,2687.4978,a8w8_blockscale_1x128x128_256x128x128x128_16x16_32x32_2x2_8x32x1_8x32x1_1x32x1x8_8_1x1_intrawave_v3,814.05,248.24,0.0
gfx942,304,41728,5120,12800,ck,0,0,7481.7964,a8w8_blockscale_1x128x128_256x128x128x128_16x16_32x32_2x2_8x32x1_8x32x1_1x32x1x8_8_1x1_intrawave_v3,731.02,137.26,0.0
gfx942,304,41856,5120,4096,ck,0,0,2074.8962,a8w8_blockscale_1x128x128_256x128x128x128_16x16_32x32_2x2_8x32x1_8x32x1_1x32x1x8_8_1x1_intrawave_v3,846.1,299.3,0.0
gfx942,304,41856,5120,5120,ck,0,0,2688.8693,a8w8_blockscale_1x128x128_256x128x128x128_16x16_32x32_2x2_8x32x1_8x32x1_1x32x1x8_8_1x1_intrawave_v3,816.13,248.85,0.0
gfx942,304,41856,5120,12800,ck,0,0,7185.8596,a8w8_blockscale_1x128x128_256x128x128x128_16x16_32x32_2x2_8x32x1_8x32x1_1x32x1x8_8_1x1_intrawave_v3,763.46,143.32,0.0
gfx942,304,41984,5120,4096,ck,0,0,2076.0568,a8w8_blockscale_1x128x128_256x128x128x128_16x16_32x32_2x2_8x32x1_8x32x1_1x32x1x8_8_1x1_intrawave_v3,848.21,300.02,0.0
gfx942,304,41984,5120,5120,ck,0,0,2756.1861,a8w8_blockscale_1x128x128_256x128x128x128_16x16_32x32_2x2_8x32x1_8x32x1_1x32x1x8_8_1x1_intrawave_v3,798.63,243.48,0.0
gfx942,304,41984,5120,12800,ck,0,0,7335.6509,a8w8_blockscale_1x128x128_256x128x128x128_16x16_32x32_2x2_8x32x1_8x32x1_1x32x1x8_8_1x1_intrawave_v3,750.16,140.8,0.0
gfx942,304,42112,5120,4096,ck,0,0,2097.5137,a8w8_blockscale_1x128x128_256x128x128x128_16x16_32x32_2x2_8x32x1_8x32x1_1x32x1x8_8_1x1_intrawave_v3,842.09,297.82,0.0
gfx942,304,42112,5120,5120,ck,0,0,2768.7713,a8w8_blockscale_1x128x128_256x128x128x128_16x16_32x32_2x2_8x32x1_8x32x1_1x32x1x8_8_1x1_intrawave_v3,797.42,243.09,0.0
gfx942,304,42112,5120,12800,ck,0,0,7619.976,a8w8_blockscale_1x128x128_256x128x128x128_16x16_32x32_2x2_8x32x1_8x32x1_1x32x1x8_8_1x1_intrawave_v3,724.37,135.93,0.0
gfx942,304,42240,5120,4096,ck,0,0,2108.6688,a8w8_blockscale_1x128x128_256x128x128x128_16x16_32x32_2x2_8x32x1_8x32x1_1x32x1x8_8_1x1_intrawave_v3,840.19,297.12,0.0
gfx942,304,42240,5120,5120,ck,0,0,2788.3798,a8w8_blockscale_1x128x128_256x128x128x128_16x16_32x32_2x2_8x32x1_8x32x1_1x32x1x8_8_1x1_intrawave_v3,794.22,242.08,0.0
gfx942,304,42240,5120,12800,ck,0,0,7404.1058,a8w8_blockscale_1x128x128_256x128x128x128_16x16_32x32_2x2_8x32x1_8x32x1_1x32x1x8_8_1x1_intrawave_v3,747.76,140.29,0.0
gfx942,304,42368,5120,4096,ck,0,0,2103.8479,a8w8_blockscale_1x128x128_256x128x128x128_16x16_32x32_2x2_8x32x1_8x32x1_1x32x1x8_8_1x1_intrawave_v3,844.66,298.67,0.0
gfx942,304,42368,5120,5120,ck,0,0,2770.2689,a8w8_blockscale_1x128x128_256x128x128x128_16x16_32x32_2x2_8x32x1_8x32x1_1x32x1x8_8_1x1_intrawave_v3,801.84,244.38,0.0
gfx942,304,42368,5120,12800,ck,0,0,7593.27,a8w8_blockscale_1x128x128_256x128x128x128_16x16_32x32_2x2_8x32x1_8x32x1_1x32x1x8_8_1x1_intrawave_v3,731.34,137.19,0.0
gfx942,304,42496,5120,4096,ck,0,0,2107.6062,a8w8_blockscale_1x128x128_256x128x128x128_16x16_32x32_2x2_8x32x1_8x32x1_1x32x1x8_8_1x1_intrawave_v3,845.7,299.01,0.0
gfx942,304,42496,5120,5120,ck,0,0,2728.8142,a8w8_blockscale_1x128x128_256x128x128x128_16x16_32x32_2x2_8x32x1_8x32x1_1x32x1x8_8_1x1_intrawave_v3,816.48,248.81,0.0
gfx942,304,42496,5120,12800,ck,0,0,7681.6543,a8w8_blockscale_1x128x128_256x128x128x128_16x16_32x32_2x2_8x32x1_8x32x1_1x32x1x8_8_1x1_intrawave_v3,725.11,135.99,0.0
gfx942,304,42624,5120,4096,ck,0,0,2148.5317,a8w8_blockscale_1x128x128_256x128x128x128_16x16_32x32_2x2_8x32x1_8x32x1_1x32x1x8_8_1x1_intrawave_v3,832.09,294.17,0.0
gfx942,304,42624,5120,5120,ck,0,0,2773.32,a8w8_blockscale_1x128x128_256x128x128x128_16x16_32x32_2x2_8x32x1_8x32x1_1x32x1x8_8_1x1_intrawave_v3,805.79,245.52,0.0
gfx942,304,42624,5120,12800,ck,0,0,7512.1057,a8w8_blockscale_1x128x128_256x128x128x128_16x16_32x32_2x2_8x32x1_8x32x1_1x32x1x8_8_1x1_intrawave_v3,743.71,139.45,0.0
gfx942,304,42752,5120,4096,ck,0,0,2101.7567,a8w8_blockscale_1x128x128_256x128x128x128_16x16_32x32_2x2_8x32x1_8x32x1_1x32x1x8_8_1x1_intrawave_v3,853.17,301.59,0.0
gfx942,304,42752,5120,5120,ck,0,0,2802.425,a8w8_blockscale_1x128x128_256x128x128x128_16x16_32x32_2x2_8x32x1_8x32x1_1x32x1x8_8_1x1_intrawave_v3,799.82,243.68,0.0
gfx942,304,42752,5120,12800,ck,0,0,7416.1456,a8w8_blockscale_1x128x128_256x128x128x128_16x16_32x32_2x2_8x32x1_8x32x1_1x32x1x8_8_1x1_intrawave_v3,755.59,141.66,0.0
gfx942,304,42880,5120,4096,ck,0,0,2123.9027,a8w8_blockscale_1x128x128_256x128x128x128_16x16_32x32_2x2_8x32x1_8x32x1_1x32x1x8_8_1x1_intrawave_v3,846.8,299.31,0.0
gfx942,304,42880,5120,5120,ck,0,0,2787.3446,a8w8_blockscale_1x128x128_256x128x128x128_16x16_32x32_2x2_8x32x1_8x32x1_1x32x1x8_8_1x1_intrawave_v3,806.56,245.7,0.0
gfx942,304,42880,5120,12800,ck,0,0,7380.1681,a8w8_blockscale_1x128x128_256x128x128x128_16x16_32x32_2x2_8x32x1_8x32x1_1x32x1x8_8_1x1_intrawave_v3,761.55,142.75,0.0
gfx942,304,43008,5120,4096,ck,0,0,2171.064,a8w8_blockscale_1x128x128_256x128x128x128_16x16_32x32_2x2_8x32x1_8x32x1_1x32x1x8_8_1x1_intrawave_v3,830.88,293.65,0.0
gfx942,304,43008,5120,5120,ck,0,0,2819.0608,a8w8_blockscale_1x128x128_256x128x128x128_16x16_32x32_2x2_8x32x1_8x32x1_1x32x1x8_8_1x1_intrawave_v3,799.86,243.63,0.0
gfx942,304,43008,5120,12800,ck,0,0,7416.631,a8w8_blockscale_1x128x128_256x128x128x128_16x16_32x32_2x2_8x32x1_8x32x1_1x32x1x8_8_1x1_intrawave_v3,760.07,142.44,0.0
gfx942,304,43136,5120,4096,ck,0,0,2122.2066,a8w8_blockscale_1x128x128_256x128x128x128_16x16_32x32_2x2_8x32x1_8x32x1_1x32x1x8_8_1x1_intrawave_v3,852.53,301.28,0.0
gfx942,304,43136,5120,5120,ck,0,0,2871.0174,a8w8_blockscale_1x128x128_256x128x128x128_16x16_32x32_2x2_8x32x1_8x32x1_1x32x1x8_8_1x1_intrawave_v3,787.72,239.91,0.0
gfx942,304,43136,5120,12800,ck,0,0,7419.6158,a8w8_blockscale_1x128x128_256x128x128x128_16x16_32x32_2x2_8x32x1_8x32x1_1x32x1x8_8_1x1_intrawave_v3,762.02,142.78,0.0
gfx942,304,43264,5120,4096,ck,0,0,2196.9723,a8w8_blockscale_1x128x128_256x128x128x128_16x16_32x32_2x2_8x32x1_8x32x1_1x32x1x8_8_1x1_intrawave_v3,825.97,291.86,0.0
gfx942,304,43264,5120,5120,ck,0,0,2848.0251,a8w8_blockscale_1x128x128_256x128x128x128_16x16_32x32_2x2_8x32x1_8x32x1_1x32x1x8_8_1x1_intrawave_v3,796.44,242.54,0.0
gfx942,304,43264,5120,12800,ck,0,0,7828.0574,a8w8_blockscale_1x128x128_256x128x128x128_16x16_32x32_2x2_8x32x1_8x32x1_1x32x1x8_8_1x1_intrawave_v3,724.41,135.71,0.0
gfx942,304,43392,5120,4096,ck,0,0,2177.1894,a8w8_blockscale_1x128x128_256x128x128x128_16x16_32x32_2x2_8x32x1_8x32x1_1x32x1x8_8_1x1_intrawave_v3,835.94,295.35,0.0
gfx942,304,43392,5120,5120,ck,0,0,2784.5648,a8w8_blockscale_1x128x128_256x128x128x128_16x16_32x32_2x2_8x32x1_8x32x1_1x32x1x8_8_1x1_intrawave_v3,817.0,248.77,0.0
gfx942,304,43392,5120,12800,ck,0,0,7440.7982,a8w8_blockscale_1x128x128_256x128x128x128_16x16_32x32_2x2_8x32x1_8x32x1_1x32x1x8_8_1x1_intrawave_v3,764.36,143.17,0.0
gfx942,304,43520,5120,4096,ck,0,0,2201.4974,a8w8_blockscale_1x128x128_256x128x128x128_16x16_32x32_2x2_8x32x1_8x32x1_1x32x1x8_8_1x1_intrawave_v3,829.15,292.93,0.0
gfx942,304,43520,5120,5120,ck,0,0,2846.5129,a8w8_blockscale_1x128x128_256x128x128x128_16x16_32x32_2x2_8x32x1_8x32x1_1x32x1x8_8_1x1_intrawave_v3,801.58,244.05,0.0
gfx942,304,43520,5120,12800,ck,0,0,7567.1866,a8w8_blockscale_1x128x128_256x128x128x128_16x16_32x32_2x2_8x32x1_8x32x1_1x32x1x8_8_1x1_intrawave_v3,753.81,141.17,0.0
gfx942,304,43648,5120,4096,ck,0,0,2164.407,a8w8_blockscale_1x128x128_256x128x128x128_16x16_32x32_2x2_8x32x1_8x32x1_1x32x1x8_8_1x1_intrawave_v3,845.83,298.79,0.0
gfx942,304,43648,5120,5120,ck,0,0,2864.8236,a8w8_blockscale_1x128x128_256x128x128x128_16x16_32x32_2x2_8x32x1_8x32x1_1x32x1x8_8_1x1_intrawave_v3,798.8,243.17,0.0
gfx942,304,43648,5120,12800,ck,0,0,7714.5654,a8w8_blockscale_1x128x128_256x128x128x128_16x16_32x32_2x2_8x32x1_8x32x1_1x32x1x8_8_1x1_intrawave_v3,741.59,138.85,0.0
gfx942,304,43776,5120,4096,ck,0,0,2237.5125,a8w8_blockscale_1x128x128_256x128x128x128_16x16_32x32_2x2_8x32x1_8x32x1_1x32x1x8_8_1x1_intrawave_v3,820.6,289.85,0.0
gfx942,304,43776,5120,5120,ck,0,0,2869.4856,a8w8_blockscale_1x128x128_256x128x128x128_16x16_32x32_2x2_8x32x1_8x32x1_1x32x1x8_8_1x1_intrawave_v3,799.84,243.46,0.0
gfx942,304,43776,5120,12800,ck,0,0,7465.525,a8w8_blockscale_1x128x128_256x128x128x128_16x16_32x32_2x2_8x32x1_8x32x1_1x32x1x8_8_1x1_intrawave_v3,768.57,143.88,0.0
gfx942,304,43904,5120,4096,ck,0,0,2225.8167,a8w8_blockscale_1x128x128_256x128x128x128_16x16_32x32_2x2_8x32x1_8x32x1_1x32x1x8_8_1x1_intrawave_v3,827.32,292.2,0.0
gfx942,304,43904,5120,5120,ck,0,0,2881.2613,a8w8_blockscale_1x128x128_256x128x128x128_16x16_32x32_2x2_8x32x1_8x32x1_1x32x1x8_8_1x1_intrawave_v3,798.9,243.15,0.0
gfx942,304,43904,5120,12800,ck,0,0,7523.7554,a8w8_blockscale_1x128x128_256x128x128x128_16x16_32x32_2x2_8x32x1_8x32x1_1x32x1x8_8_1x1_intrawave_v3,764.86,143.16,0.0
gfx942,304,44032,5120,4096,ck,0,0,2253.5311,a8w8_blockscale_1x128x128_256x128x128x128_16x16_32x32_2x2_8x32x1_8x32x1_1x32x1x8_8_1x1_intrawave_v3,819.53,289.42,0.0
gfx942,304,44032,5120,5120,ck,0,0,2869.0826,a8w8_blockscale_1x128x128_256x128x128x128_16x16_32x32_2x2_8x32x1_8x32x1_1x32x1x8_8_1x1_intrawave_v3,804.63,244.87,0.0
gfx942,304,44032,5120,12800,ck,0,0,7686.9564,a8w8_blockscale_1x128x128_256x128x128x128_16x16_32x32_2x2_8x32x1_8x32x1_1x32x1x8_8_1x1_intrawave_v3,750.8,140.5,0.0
gfx942,304,44160,5120,4096,ck,0,0,2167.4299,a8w8_blockscale_1x128x128_256x128x128x128_16x16_32x32_2x2_8x32x1_8x32x1_1x32x1x8_8_1x1_intrawave_v3,854.56,301.76,0.0
gfx942,304,44160,5120,5120,ck,0,0,2894.8317,a8w8_blockscale_1x128x128_256x128x128x128_16x16_32x32_2x2_8x32x1_8x32x1_1x32x1x8_8_1x1_intrawave_v3,799.79,243.37,0.0
gfx942,304,44160,5120,12800,ck,0,0,7769.302,a8w8_blockscale_1x128x128_256x128x128x128_16x16_32x32_2x2_8x32x1_8x32x1_1x32x1x8_8_1x1_intrawave_v3,745.0,139.39,0.0
gfx942,304,44288,5120,4096,ck,0,0,2267.2641,a8w8_blockscale_1x128x128_256x128x128x128_16x16_32x32_2x2_8x32x1_8x32x1_1x32x1x8_8_1x1_intrawave_v3,819.3,289.28,0.0
gfx942,304,44288,5120,5120,ck,0,0,2878.5892,a8w8_blockscale_1x128x128_256x128x128x128_16x16_32x32_2x2_8x32x1_8x32x1_1x32x1x8_8_1x1_intrawave_v3,806.63,245.43,0.0
gfx942,304,44288,5120,12800,ck,0,0,7762.2938,a8w8_blockscale_1x128x128_256x128x128x128_16x16_32x32_2x2_8x32x1_8x32x1_1x32x1x8_8_1x1_intrawave_v3,747.84,139.9,0.0
gfx942,304,44416,5120,4096,ck,0,0,2275.1481,a8w8_blockscale_1x128x128_256x128x128x128_16x16_32x32_2x2_8x32x1_8x32x1_1x32x1x8_8_1x1_intrawave_v3,818.82,289.09,0.0
gfx942,304,44416,5120,5120,ck,0,0,2898.2119,a8w8_blockscale_1x128x128_256x128x128x128_16x16_32x32_2x2_8x32x1_8x32x1_1x32x1x8_8_1x1_intrawave_v3,803.49,244.44,0.0
gfx942,304,44416,5120,12800,ck,0,0,7783.5471,a8w8_blockscale_1x128x128_256x128x128x128_16x16_32x32_2x2_8x32x1_8x32x1_1x32x1x8_8_1x1_intrawave_v3,747.95,139.9,0.0
gfx942,304,44544,5120,4096,ck,0,0,2224.9043,a8w8_blockscale_1x128x128_256x128x128x128_16x16_32x32_2x2_8x32x1_8x32x1_1x32x1x8_8_1x1_intrawave_v3,839.73,296.44,0.0
gfx942,304,44544,5120,5120,ck,0,0,2943.5149,a8w8_blockscale_1x128x128_256x128x128x128_16x16_32x32_2x2_8x32x1_8x32x1_1x32x1x8_8_1x1_intrawave_v3,793.4,241.35,0.0
gfx942,304,44544,5120,12800,ck,0,0,7628.9745,a8w8_blockscale_1x128x128_256x128x128x128_16x16_32x32_2x2_8x32x1_8x32x1_1x32x1x8_8_1x1_intrawave_v3,765.3,143.12,0.0
gfx942,304,44672,5120,4096,ck,0,0,2190.7489,a8w8_blockscale_1x128x128_256x128x128x128_16x16_32x32_2x2_8x32x1_8x32x1_1x32x1x8_8_1x1_intrawave_v3,855.27,301.9,0.0
gfx942,304,44672,5120,5120,ck,0,0,2938.6624,a8w8_blockscale_1x128x128_256x128x128x128_16x16_32x32_2x2_8x32x1_8x32x1_1x32x1x8_8_1x1_intrawave_v3,797.0,242.42,0.0
gfx942,304,44672,5120,12800,ck,0,0,7800.1903,a8w8_blockscale_1x128x128_256x128x128x128_16x16_32x32_2x2_8x32x1_8x32x1_1x32x1x8_8_1x1_intrawave_v3,750.65,140.35,0.0
gfx942,304,44800,5120,4096,ck,0,0,2278.3307,a8w8_blockscale_1x128x128_256x128x128x128_16x16_32x32_2x2_8x32x1_8x32x1_1x32x1x8_8_1x1_intrawave_v3,824.75,291.1,0.0
gfx942,304,44800,5120,5120,ck,0,0,2932.6372,a8w8_blockscale_1x128x128_256x128x128x128_16x16_32x32_2x2_8x32x1_8x32x1_1x32x1x8_8_1x1_intrawave_v3,800.92,243.58,0.0
gfx942,304,44800,5120,12800,ck,0,0,7869.2792,a8w8_blockscale_1x128x128_256x128x128x128_16x16_32x32_2x2_8x32x1_8x32x1_1x32x1x8_8_1x1_intrawave_v3,746.2,139.5,0.0
gfx942,304,44928,5120,4096,ck,0,0,2266.3217,a8w8_blockscale_1x128x128_256x128x128x128_16x16_32x32_2x2_8x32x1_8x32x1_1x32x1x8_8_1x1_intrawave_v3,831.49,293.45,0.0
gfx942,304,44928,5120,5120,ck,0,0,2944.6937,a8w8_blockscale_1x128x128_256x128x128x128_16x16_32x32_2x2_8x32x1_8x32x1_1x32x1x8_8_1x1_intrawave_v3,799.92,243.25,0.0
gfx942,304,44928,5120,12800,ck,0,0,8054.2394,a8w8_blockscale_1x128x128_256x128x128x128_16x16_32x32_2x2_8x32x1_8x32x1_1x32x1x8_8_1x1_intrawave_v3,731.14,136.66,0.0
gfx942,304,45056,5120,4096,ck,0,0,2277.8438,a8w8_blockscale_1x128x128_256x128x128x128_16x16_32x32_2x2_8x32x1_8x32x1_1x32x1x8_8_1x1_intrawave_v3,829.64,292.77,0.0
gfx942,304,45056,5120,5120,ck,0,0,2894.8591,a8w8_blockscale_1x128x128_256x128x128x128_16x16_32x32_2x2_8x32x1_8x32x1_1x32x1x8_8_1x1_intrawave_v3,816.01,248.12,0.0
gfx942,304,45056,5120,12800,ck,0,0,7683.2286,a8w8_blockscale_1x128x128_256x128x128x128_16x16_32x32_2x2_8x32x1_8x32x1_1x32x1x8_8_1x1_intrawave_v3,768.63,143.64,0.0
gfx942,304,45184,5120,4096,ck,0,0,2308.215,a8w8_blockscale_1x128x128_256x128x128x128_16x16_32x32_2x2_8x32x1_8x32x1_1x32x1x8_8_1x1_intrawave_v3,821.05,289.72,0.0
gfx942,304,45184,5120,5120,ck,0,0,2966.6096,a8w8_blockscale_1x128x128_256x128x128x128_16x16_32x32_2x2_8x32x1_8x32x1_1x32x1x8_8_1x1_intrawave_v3,798.54,242.78,0.0
gfx942,304,45184,5120,12800,ck,0,0,8160.7912,a8w8_blockscale_1x128x128_256x128x128x128_16x16_32x32_2x2_8x32x1_8x32x1_1x32x1x8_8_1x1_intrawave_v3,725.71,135.6,0.0
gfx942,304,45312,5120,4096,ck,0,0,2240.4259,a8w8_blockscale_1x128x128_256x128x128x128_16x16_32x32_2x2_8x32x1_8x32x1_1x32x1x8_8_1x1_intrawave_v3,848.29,299.3,0.0
gfx942,304,45312,5120,5120,ck,0,0,2960.4719,a8w8_blockscale_1x128x128_256x128x128x128_16x16_32x32_2x2_8x32x1_8x32x1_1x32x1x8_8_1x1_intrawave_v3,802.46,243.95,0.0
gfx942,304,45312,5120,12800,ck,0,0,7892.9197,a8w8_blockscale_1x128x128_256x128x128x128_16x16_32x32_2x2_8x32x1_8x32x1_1x32x1x8_8_1x1_intrawave_v3,752.46,140.57,0.0
gfx942,304,45440,5120,4096,ck,0,0,2254.0746,a8w8_blockscale_1x128x128_256x128x128x128_16x16_32x32_2x2_8x32x1_8x32x1_1x32x1x8_8_1x1_intrawave_v3,845.53,298.3,0.0
gfx942,304,45440,5120,5120,ck,0,0,2931.3519,a8w8_blockscale_1x128x128_256x128x128x128_16x16_32x32_2x2_8x32x1_8x32x1_1x32x1x8_8_1x1_intrawave_v3,812.72,247.04,0.0
gfx942,304,45440,5120,12800,ck,0,0,7881.834,a8w8_blockscale_1x128x128_256x128x128x128_16x16_32x32_2x2_8x32x1_8x32x1_1x32x1x8_8_1x1_intrawave_v3,755.65,141.14,0.0
gfx942,304,45568,5120,4096,ck,0,0,2282.6797,a8w8_blockscale_1x128x128_256x128x128x128_16x16_32x32_2x2_8x32x1_8x32x1_1x32x1x8_8_1x1_intrawave_v3,837.29,295.37,0.0
gfx942,304,45568,5120,5120,ck,0,0,2962.4172,a8w8_blockscale_1x128x128_256x128x128x128_16x16_32x32_2x2_8x32x1_8x32x1_1x32x1x8_8_1x1_intrawave_v3,806.46,245.12,0.0
gfx942,304,45568,5120,12800,ck,0,0,8218.4784,a8w8_blockscale_1x128x128_256x128x128x128_16x16_32x32_2x2_8x32x1_8x32x1_1x32x1x8_8_1x1_intrawave_v3,726.74,135.72,0.0
gfx942,304,45696,5120,4096,ck,0,0,2273.2419,a8w8_blockscale_1x128x128_256x128x128x128_16x16_32x32_2x2_8x32x1_8x32x1_1x32x1x8_8_1x1_intrawave_v3,843.13,297.4,0.0
gfx942,304,45696,5120,5120,ck,0,0,3033.5473,a8w8_blockscale_1x128x128_256x128x128x128_16x16_32x32_2x2_8x32x1_8x32x1_1x32x1x8_8_1x1_intrawave_v3,789.76,240.02,0.0
gfx942,304,45696,5120,12800,ck,0,0,8265.6893,a8w8_blockscale_1x128x128_256x128x128x128_16x16_32x32_2x2_8x32x1_8x32x1_1x32x1x8_8_1x1_intrawave_v3,724.62,135.3,0.0
gfx942,304,45824,5120,4096,ck,0,0,2274.0209,a8w8_blockscale_1x128x128_256x128x128x128_16x16_32x32_2x2_8x32x1_8x32x1_1x32x1x8_8_1x1_intrawave_v3,845.2,298.11,0.0
gfx942,304,45824,5120,5120,ck,0,0,3005.8689,a8w8_blockscale_1x128x128_256x128x128x128_16x16_32x32_2x2_8x32x1_8x32x1_1x32x1x8_8_1x1_intrawave_v3,799.27,242.88,0.0
gfx942,304,45824,5120,12800,ck,0,0,7905.5635,a8w8_blockscale_1x128x128_256x128x128x128_16x16_32x32_2x2_8x32x1_8x32x1_1x32x1x8_8_1x1_intrawave_v3,759.75,141.84,0.0
gfx942,304,45952,5120,4096,ck,0,0,2255.0448,a8w8_blockscale_1x128x128_256x128x128x128_16x16_32x32_2x2_8x32x1_8x32x1_1x32x1x8_8_1x1_intrawave_v3,854.69,301.43,0.0
gfx942,304,45952,5120,5120,ck,0,0,3024.8611,a8w8_blockscale_1x128x128_256x128x128x128_16x16_32x32_2x2_8x32x1_8x32x1_1x32x1x8_8_1x1_intrawave_v3,796.47,242.01,0.0
gfx942,304,45952,5120,12800,ck,0,0,7893.178,a8w8_blockscale_1x128x128_256x128x128x128_16x16_32x32_2x2_8x32x1_8x32x1_1x32x1x8_8_1x1_intrawave_v3,763.07,142.44,0.0
gfx942,304,46080,5120,4096,ck,0,0,2336.6972,a8w8_blockscale_1x128x128_256x128x128x128_16x16_32x32_2x2_8x32x1_8x32x1_1x32x1x8_8_1x1_intrawave_v3,827.12,291.68,0.0
gfx942,304,46080,5120,5120,ck,0,0,3011.0553,a8w8_blockscale_1x128x128_256x128x128x128_16x16_32x32_2x2_8x32x1_8x32x1_1x32x1x8_8_1x1_intrawave_v3,802.35,243.77,0.0
gfx942,304,46080,5120,12800,ck,0,0,8016.3917,a8w8_blockscale_1x128x128_256x128x128x128_16x16_32x32_2x2_8x32x1_8x32x1_1x32x1x8_8_1x1_intrawave_v3,753.43,140.61,0.0
gfx942,304,46208,5120,4096,ck,0,0,2272.9932,a8w8_blockscale_1x128x128_256x128x128x128_16x16_32x32_2x2_8x32x1_8x32x1_1x32x1x8_8_1x1_intrawave_v3,852.67,300.66,0.0
gfx942,304,46208,5120,5120,ck,0,0,3041.0328,a8w8_blockscale_1x128x128_256x128x128x128_16x16_32x32_2x2_8x32x1_8x32x1_1x32x1x8_8_1x1_intrawave_v3,796.65,242.01,0.0
gfx942,304,46208,5120,12800,ck,0,0,8141.3026,a8w8_blockscale_1x128x128_256x128x128x128_16x16_32x32_2x2_8x32x1_8x32x1_1x32x1x8_8_1x1_intrawave_v3,743.93,138.82,0.0
gfx942,304,46336,5120,4096,ck,0,0,2348.6623,a8w8_blockscale_1x128x128_256x128x128x128_16x16_32x32_2x2_8x32x1_8x32x1_1x32x1x8_8_1x1_intrawave_v3,827.48,291.76,0.0
gfx942,304,46336,5120,5120,ck,0,0,2983.932,a8w8_blockscale_1x128x128_256x128x128x128_16x16_32x32_2x2_8x32x1_8x32x1_1x32x1x8_8_1x1_intrawave_v3,814.14,247.3,0.0
gfx942,304,46336,5120,12800,ck,0,0,8195.8862,a8w8_blockscale_1x128x128_256x128x128x128_16x16_32x32_2x2_8x32x1_8x32x1_1x32x1x8_8_1x1_intrawave_v3,741.02,138.25,0.0
gfx942,304,46464,5120,4096,ck,0,0,2309.6297,a8w8_blockscale_1x128x128_256x128x128x128_16x16_32x32_2x2_8x32x1_8x32x1_1x32x1x8_8_1x1_intrawave_v3,843.79,297.48,0.0
gfx942,304,46464,5120,5120,ck,0,0,3046.987,a8w8_blockscale_1x128x128_256x128x128x128_16x16_32x32_2x2_8x32x1_8x32x1_1x32x1x8_8_1x1_intrawave_v3,799.5,242.83,0.0
gfx942,304,46464,5120,12800,ck,0,0,7999.5178,a8w8_blockscale_1x128x128_256x128x128x128_16x16_32x32_2x2_8x32x1_8x32x1_1x32x1x8_8_1x1_intrawave_v3,761.31,142.02,0.0
gfx942,304,46592,5120,4096,ck,0,0,2386.7709,a8w8_blockscale_1x128x128_256x128x128x128_16x16_32x32_2x2_8x32x1_8x32x1_1x32x1x8_8_1x1_intrawave_v3,818.77,288.64,0.0
gfx942,304,46592,5120,5120,ck,0,0,3037.6013,a8w8_blockscale_1x128x128_256x128x128x128_16x16_32x32_2x2_8x32x1_8x32x1_1x32x1x8_8_1x1_intrawave_v3,804.17,244.23,0.0
gfx942,304,46592,5120,12800,ck,0,0,8070.1808,a8w8_blockscale_1x128x128_256x128x128x128_16x16_32x32_2x2_8x32x1_8x32x1_1x32x1x8_8_1x1_intrawave_v3,756.72,141.14,0.0
gfx942,304,46720,5120,4096,ck,0,0,2382.1348,a8w8_blockscale_1x128x128_256x128x128x128_16x16_32x32_2x2_8x32x1_8x32x1_1x32x1x8_8_1x1_intrawave_v3,822.61,289.97,0.0
gfx942,304,46720,5120,5120,ck,0,0,3025.6307,a8w8_blockscale_1x128x128_256x128x128x128_16x16_32x32_2x2_8x32x1_8x32x1_1x32x1x8_8_1x1_intrawave_v3,809.57,245.84,0.0
gfx942,304,46720,5120,12800,ck,0,0,8241.6242,a8w8_blockscale_1x128x128_256x128x128x128_16x16_32x32_2x2_8x32x1_8x32x1_1x32x1x8_8_1x1_intrawave_v3,743.02,138.56,0.0
gfx942,304,46848,5120,4096,ck,0,0,2303.3839,a8w8_blockscale_1x128x128_256x128x128x128_16x16_32x32_2x2_8x32x1_8x32x1_1x32x1x8_8_1x1_intrawave_v3,853.07,300.68,0.0
gfx942,304,46848,5120,5120,ck,0,0,3089.3677,a8w8_blockscale_1x128x128_256x128x128x128_16x16_32x32_2x2_8x32x1_8x32x1_1x32x1x8_8_1x1_intrawave_v3,795.04,241.41,0.0
gfx942,304,46848,5120,12800,ck,0,0,8081.8545,a8w8_blockscale_1x128x128_256x128x128x128_16x16_32x32_2x2_8x32x1_8x32x1_1x32x1x8_8_1x1_intrawave_v3,759.78,141.66,0.0
gfx942,304,46976,5120,4096,ck,0,0,2386.5325,a8w8_blockscale_1x128x128_256x128x128x128_16x16_32x32_2x2_8x32x1_8x32x1_1x32x1x8_8_1x1_intrawave_v3,825.6,290.97,0.0
gfx942,304,46976,5120,5120,ck,0,0,3083.6973,a8w8_blockscale_1x128x128_256x128x128x128_16x16_32x32_2x2_8x32x1_8x32x1_1x32x1x8_8_1x1_intrawave_v3,798.68,242.49,0.0
gfx942,304,46976,5120,12800,ck,0,0,8216.3968,a8w8_blockscale_1x128x128_256x128x128x128_16x16_32x32_2x2_8x32x1_8x32x1_1x32x1x8_8_1x1_intrawave_v3,749.38,139.7,0.0
gfx942,304,47104,5120,4096,ck,0,0,2340.6352,a8w8_blockscale_1x128x128_256x128x128x128_16x16_32x32_2x2_8x32x1_8x32x1_1x32x1x8_8_1x1_intrawave_v3,844.08,297.46,0.0
gfx942,304,47104,5120,5120,ck,0,0,3089.1295,a8w8_blockscale_1x128x128_256x128x128x128_16x16_32x32_2x2_8x32x1_8x32x1_1x32x1x8_8_1x1_intrawave_v3,799.45,242.7,0.0
gfx942,304,47104,5120,12800,ck,0,0,8227.6354,a8w8_blockscale_1x128x128_256x128x128x128_16x16_32x32_2x2_8x32x1_8x32x1_1x32x1x8_8_1x1_intrawave_v3,750.4,139.87,0.0
gfx942,304,47232,5120,4096,ck,0,0,2345.725,a8w8_blockscale_1x128x128_256x128x128x128_16x16_32x32_2x2_8x32x1_8x32x1_1x32x1x8_8_1x1_intrawave_v3,844.54,297.6,0.0
gfx942,304,47232,5120,5120,ck,0,0,3103.0107,a8w8_blockscale_1x128x128_256x128x128x128_16x16_32x32_2x2_8x32x1_8x32x1_1x32x1x8_8_1x1_intrawave_v3,798.04,242.25,0.0
gfx942,304,47232,5120,12800,ck,0,0,8168.4599,a8w8_blockscale_1x128x128_256x128x128x128_16x16_32x32_2x2_8x32x1_8x32x1_1x32x1x8_8_1x1_intrawave_v3,757.89,141.25,0.0
gfx942,304,47360,5120,4096,ck,0,0,2333.5957,a8w8_blockscale_1x128x128_256x128x128x128_16x16_32x32_2x2_8x32x1_8x32x1_1x32x1x8_8_1x1_intrawave_v3,851.23,299.93,0.0
gfx942,304,47360,5120,5120,ck,0,0,3100.5835,a8w8_blockscale_1x128x128_256x128x128x128_16x16_32x32_2x2_8x32x1_8x32x1_1x32x1x8_8_1x1_intrawave_v3,800.83,243.07,0.0
gfx942,304,47360,5120,12800,ck,0,0,8533.6575,a8w8_blockscale_1x128x128_256x128x128x128_16x16_32x32_2x2_8x32x1_8x32x1_1x32x1x8_8_1x1_intrawave_v3,727.42,135.55,0.0
gfx942,304,47488,5120,4096,ck,0,0,2336.6729,a8w8_blockscale_1x128x128_256x128x128x128_16x16_32x32_2x2_8x32x1_8x32x1_1x32x1x8_8_1x1_intrawave_v3,852.4,300.32,0.0
gfx942,304,47488,5120,5120,ck,0,0,3102.6817,a8w8_blockscale_1x128x128_256x128x128x128_16x16_32x32_2x2_8x32x1_8x32x1_1x32x1x8_8_1x1_intrawave_v3,802.45,243.54,0.0
gfx942,304,47488,5120,12800,ck,0,0,8284.0658,a8w8_blockscale_1x128x128_256x128x128x128_16x16_32x32_2x2_8x32x1_8x32x1_1x32x1x8_8_1x1_intrawave_v3,751.36,139.99,0.0
gfx942,304,47616,5120,4096,ck,0,0,2339.2844,a8w8_blockscale_1x128x128_256x128x128x128_16x16_32x32_2x2_8x32x1_8x32x1_1x32x1x8_8_1x1_intrawave_v3,853.75,300.77,0.0
gfx942,304,47616,5120,5120,ck,0,0,3166.1948,a8w8_blockscale_1x128x128_256x128x128x128_16x16_32x32_2x2_8x32x1_8x32x1_1x32x1x8_8_1x1_intrawave_v3,788.47,239.28,0.0
gfx942,304,47616,5120,12800,ck,0,0,8146.7583,a8w8_blockscale_1x128x128_256x128x128x128_16x16_32x32_2x2_8x32x1_8x32x1_1x32x1x8_8_1x1_intrawave_v3,766.09,142.71,0.0
gfx942,304,47744,5120,4096,ck,0,0,2452.6318,a8w8_blockscale_1x128x128_256x128x128x128_16x16_32x32_2x2_8x32x1_8x32x1_1x32x1x8_8_1x1_intrawave_v3,816.48,287.62,0.0
gfx942,304,47744,5120,5120,ck,0,0,3145.4277,a8w8_blockscale_1x128x128_256x128x128x128_16x16_32x32_2x2_8x32x1_8x32x1_1x32x1x8_8_1x1_intrawave_v3,795.81,241.48,0.0
gfx942,304,47744,5120,12800,ck,0,0,8205.6016,a8w8_blockscale_1x128x128_256x128x128x128_16x16_32x32_2x2_8x32x1_8x32x1_1x32x1x8_8_1x1_intrawave_v3,762.64,142.04,0.0
gfx942,304,47872,5120,4096,ck,0,0,2377.3992,a8w8_blockscale_1x128x128_256x128x128x128_16x16_32x32_2x2_8x32x1_8x32x1_1x32x1x8_8_1x1_intrawave_v3,844.58,297.5,0.0
gfx942,304,47872,5120,5120,ck,0,0,3137.1952,a8w8_blockscale_1x128x128_256x128x128x128_16x16_32x32_2x2_8x32x1_8x32x1_1x32x1x8_8_1x1_intrawave_v3,800.04,242.74,0.0
gfx942,304,47872,5120,12800,ck,0,0,8377.8962,a8w8_blockscale_1x128x128_256x128x128x128_16x16_32x32_2x2_8x32x1_8x32x1_1x32x1x8_8_1x1_intrawave_v3,748.96,139.47,0.0
gfx942,304,48000,5120,4096,ck,0,0,2386.8954,a8w8_blockscale_1x128x128_256x128x128x128_16x16_32x32_2x2_8x32x1_8x32x1_1x32x1x8_8_1x1_intrawave_v3,843.47,297.08,0.0
gfx942,304,48000,5120,5120,ck,0,0,3153.1381,a8w8_blockscale_1x128x128_256x128x128x128_16x16_32x32_2x2_8x32x1_8x32x1_1x32x1x8_8_1x1_intrawave_v3,798.12,242.14,0.0
gfx942,304,48000,5120,12800,ck,0,0,8415.1728,a8w8_blockscale_1x128x128_256x128x128x128_16x16_32x32_2x2_8x32x1_8x32x1_1x32x1x8_8_1x1_intrawave_v3,747.63,139.21,0.0
gfx942,304,48128,5120,4096,ck,0,0,2441.6765,a8w8_blockscale_1x128x128_256x128x128x128_16x16_32x32_2x2_8x32x1_8x32x1_1x32x1x8_8_1x1_intrawave_v3,826.74,291.17,0.0
gfx942,304,48128,5120,5120,ck,0,0,3112.9147,a8w8_blockscale_1x128x128_256x128x128x128_16x16_32x32_2x2_8x32x1_8x32x1_1x32x1x8_8_1x1_intrawave_v3,810.59,245.9,0.0
gfx942,304,48128,5120,12800,ck,0,0,8653.1966,a8w8_blockscale_1x128x128_256x128x128x128_16x16_32x32_2x2_8x32x1_8x32x1_1x32x1x8_8_1x1_intrawave_v3,729.01,135.72,0.0
gfx942,304,48256,5120,4096,ck,0,0,2454.9301,a8w8_blockscale_1x128x128_256x128x128x128_16x16_32x32_2x2_8x32x1_8x32x1_1x32x1x8_8_1x1_intrawave_v3,824.46,290.34,0.0
gfx942,304,48256,5120,5120,ck,0,0,3161.4715,a8w8_blockscale_1x128x128_256x128x128x128_16x16_32x32_2x2_8x32x1_8x32x1_1x32x1x8_8_1x1_intrawave_v3,800.26,242.74,0.0
gfx942,304,48256,5120,12800,ck,0,0,8482.9569,a8w8_blockscale_1x128x128_256x128x128x128_16x16_32x32_2x2_8x32x1_8x32x1_1x32x1x8_8_1x1_intrawave_v3,745.61,138.79,0.0
gfx942,304,48384,5120,4096,ck,0,0,2415.4711,a8w8_blockscale_1x128x128_256x128x128x128_16x16_32x32_2x2_8x32x1_8x32x1_1x32x1x8_8_1x1_intrawave_v3,840.16,295.84,0.0
gfx942,304,48384,5120,5120,ck,0,0,3165.7958,a8w8_blockscale_1x128x128_256x128x128x128_16x16_32x32_2x2_8x32x1_8x32x1_1x32x1x8_8_1x1_intrawave_v3,801.29,243.03,0.0
gfx942,304,48384,5120,12800,ck,0,0,8439.8548,a8w8_blockscale_1x128x128_256x128x128x128_16x16_32x32_2x2_8x32x1_8x32x1_1x32x1x8_8_1x1_intrawave_v3,751.41,139.85,0.0
gfx942,304,48512,5120,4096,ck,0,0,2476.1523,a8w8_blockscale_1x128x128_256x128x128x128_16x16_32x32_2x2_8x32x1_8x32x1_1x32x1x8_8_1x1_intrawave_v3,821.73,289.34,0.0
gfx942,304,48512,5120,5120,ck,0,0,3112.8136,a8w8_blockscale_1x128x128_256x128x128x128_16x16_32x32_2x2_8x32x1_8x32x1_1x32x1x8_8_1x1_intrawave_v3,817.08,247.8,0.0
gfx942,304,48512,5120,12800,ck,0,0,8683.7564,a8w8_blockscale_1x128x128_256x128x128x128_16x16_32x32_2x2_8x32x1_8x32x1_1x32x1x8_8_1x1_intrawave_v3,732.24,136.26,0.0
gfx942,304,48640,5120,4096,ck,0,0,2430.3539,a8w8_blockscale_1x128x128_256x128x128x128_16x16_32x32_2x2_8x32x1_8x32x1_1x32x1x8_8_1x1_intrawave_v3,839.43,295.54,0.0
gfx942,304,48640,5120,5120,ck,0,0,3176.6195,a8w8_blockscale_1x128x128_256x128x128x128_16x16_32x32_2x2_8x32x1_8x32x1_1x32x1x8_8_1x1_intrawave_v3,802.78,243.44,0.0
gfx942,304,48640,5120,12800,ck,0,0,8435.5675,a8w8_blockscale_1x128x128_256x128x128x128_16x16_32x32_2x2_8x32x1_8x32x1_1x32x1x8_8_1x1_intrawave_v3,755.77,140.62,0.0
gfx942,304,48768,5120,4096,ck,0,0,2473.8781,a8w8_blockscale_1x128x128_256x128x128x128_16x16_32x32_2x2_8x32x1_8x32x1_1x32x1x8_8_1x1_intrawave_v3,826.83,291.09,0.0
gfx942,304,48768,5120,5120,ck,0,0,3124.3151,a8w8_blockscale_1x128x128_256x128x128x128_16x16_32x32_2x2_8x32x1_8x32x1_1x32x1x8_8_1x1_intrawave_v3,818.37,248.15,0.0
gfx942,304,48768,5120,12800,ck,0,0,8787.0004,a8w8_blockscale_1x128x128_256x128x128x128_16x16_32x32_2x2_8x32x1_8x32x1_1x32x1x8_8_1x1_intrawave_v3,727.45,135.33,0.0
gfx942,304,48896,5120,4096,ck,0,0,2431.4678,a8w8_blockscale_1x128x128_256x128x128x128_16x16_32x32_2x2_8x32x1_8x32x1_1x32x1x8_8_1x1_intrawave_v3,843.46,296.92,0.0
gfx942,304,48896,5120,5120,ck,0,0,3206.7537,a8w8_blockscale_1x128x128_256x128x128x128_16x16_32x32_2x2_8x32x1_8x32x1_1x32x1x8_8_1x1_intrawave_v3,799.42,242.38,0.0
gfx942,304,48896,5120,12800,ck,0,0,8390.7783,a8w8_blockscale_1x128x128_256x128x128x128_16x16_32x32_2x2_8x32x1_8x32x1_1x32x1x8_8_1x1_intrawave_v3,763.8,142.07,0.0
gfx942,304,49024,5120,4096,ck,0,0,2409.628,a8w8_blockscale_1x128x128_256x128x128x128_16x16_32x32_2x2_8x32x1_8x32x1_1x32x1x8_8_1x1_intrawave_v3,853.33,300.37,0.0
gfx942,304,49024,5120,5120,ck,0,0,3167.9855,a8w8_blockscale_1x128x128_256x128x128x128_16x16_32x32_2x2_8x32x1_8x32x1_1x32x1x8_8_1x1_intrawave_v3,811.33,245.97,0.0
gfx942,304,49024,5120,12800,ck,0,0,8561.9235,a8w8_blockscale_1x128x128_256x128x128x128_16x16_32x32_2x2_8x32x1_8x32x1_1x32x1x8_8_1x1_intrawave_v3,750.49,139.58,0.0
gfx942,304,49152,5120,4096,ck,0,0,2471.4177,a8w8_blockscale_1x128x128_256x128x128x128_16x16_32x32_2x2_8x32x1_8x32x1_1x32x1x8_8_1x1_intrawave_v3,834.17,293.6,0.0
gfx942,304,49152,5120,5120,ck,0,0,3131.8793,a8w8_blockscale_1x128x128_256x128x128x128_16x16_32x32_2x2_8x32x1_8x32x1_1x32x1x8_8_1x1_intrawave_v3,822.82,249.43,0.0
gfx942,304,49152,5120,12800,ck,0,0,8404.264,a8w8_blockscale_1x128x128_256x128x128x128_16x16_32x32_2x2_8x32x1_8x32x1_1x32x1x8_8_1x1_intrawave_v3,766.57,142.55,0.0
gfx942,304,49280,5120,4096,ck,0,0,2448.8115,a8w8_blockscale_1x128x128_256x128x128x128_16x16_32x32_2x2_8x32x1_8x32x1_1x32x1x8_8_1x1_intrawave_v3,844.06,297.06,0.0
gfx942,304,49280,5120,5120,ck,0,0,3144.2002,a8w8_blockscale_1x128x128_256x128x128x128_16x16_32x32_2x2_8x32x1_8x32x1_1x32x1x8_8_1x1_intrawave_v3,821.73,249.08,0.0
gfx942,304,49280,5120,12800,ck,0,0,8652.7951,a8w8_blockscale_1x128x128_256x128x128x128_16x16_32x32_2x2_8x32x1_8x32x1_1x32x1x8_8_1x1_intrawave_v3,746.49,138.79,0.0
gfx942,304,49408,5120,4096,ck,0,0,2477.9736,a8w8_blockscale_1x128x128_256x128x128x128_16x16_32x32_2x2_8x32x1_8x32x1_1x32x1x8_8_1x1_intrawave_v3,836.3,294.31,0.0
gfx942,304,49408,5120,5120,ck,0,0,3163.9586,a8w8_blockscale_1x128x128_256x128x128x128_16x16_32x32_2x2_8x32x1_8x32x1_1x32x1x8_8_1x1_intrawave_v3,818.72,248.15,0.0
gfx942,304,49408,5120,12800,ck,0,0,8526.2266,a8w8_blockscale_1x128x128_256x128x128x128_16x16_32x32_2x2_8x32x1_8x32x1_1x32x1x8_8_1x1_intrawave_v3,759.54,141.2,0.0
gfx942,304,49536,5120,4096,ck,0,0,2543.6087,a8w8_blockscale_1x128x128_256x128x128x128_16x16_32x32_2x2_8x32x1_8x32x1_1x32x1x8_8_1x1_intrawave_v3,816.83,287.43,0.0
gfx942,304,49536,5120,5120,ck,0,0,3199.9068,a8w8_blockscale_1x128x128_256x128x128x128_16x16_32x32_2x2_8x32x1_8x32x1_1x32x1x8_8_1x1_intrawave_v3,811.62,245.97,0.0
gfx942,304,49536,5120,12800,ck,0,0,8480.9147,a8w8_blockscale_1x128x128_256x128x128x128_16x16_32x32_2x2_8x32x1_8x32x1_1x32x1x8_8_1x1_intrawave_v3,765.58,142.3,0.0
gfx942,304,49664,5120,4096,ck,0,0,2472.4969,a8w8_blockscale_1x128x128_256x128x128x128_16x16_32x32_2x2_8x32x1_8x32x1_1x32x1x8_8_1x1_intrawave_v3,842.49,296.44,0.0
gfx942,304,49664,5120,5120,ck,0,0,3211.2412,a8w8_blockscale_1x128x128_256x128x128x128_16x16_32x32_2x2_8x32x1_8x32x1_1x32x1x8_8_1x1_intrawave_v3,810.85,245.72,0.0
gfx942,304,49664,5120,12800,ck,0,0,8671.6015,a8w8_blockscale_1x128x128_256x128x128x128_16x16_32x32_2x2_8x32x1_8x32x1_1x32x1x8_8_1x1_intrawave_v3,750.68,139.51,0.0
gfx942,304,49792,5120,4096,ck,0,0,2488.0851,a8w8_blockscale_1x128x128_256x128x128x128_16x16_32x32_2x2_8x32x1_8x32x1_1x32x1x8_8_1x1_intrawave_v3,839.37,295.32,0.0
gfx942,304,49792,5120,5120,ck,0,0,3287.887,a8w8_blockscale_1x128x128_256x128x128x128_16x16_32x32_2x2_8x32x1_8x32x1_1x32x1x8_8_1x1_intrawave_v3,793.99,240.59,0.0
gfx942,304,49792,5120,12800,ck,0,0,8578.3502,a8w8_blockscale_1x128x128_256x128x128x128_16x16_32x32_2x2_8x32x1_8x32x1_1x32x1x8_8_1x1_intrawave_v3,760.79,141.37,0.0
gfx942,304,49920,5120,4096,ck,0,0,2502.6369,a8w8_blockscale_1x128x128_256x128x128x128_16x16_32x32_2x2_8x32x1_8x32x1_1x32x1x8_8_1x1_intrawave_v3,836.64,294.34,0.0
gfx942,304,49920,5120,5120,ck,0,0,3228.6944,a8w8_blockscale_1x128x128_256x128x128x128_16x16_32x32_2x2_8x32x1_8x32x1_1x32x1x8_8_1x1_intrawave_v3,810.62,245.61,0.0
gfx942,304,49920,5120,12800,ck,0,0,8560.2892,a8w8_blockscale_1x128x128_256x128x128x128_16x16_32x32_2x2_8x32x1_8x32x1_1x32x1x8_8_1x1_intrawave_v3,764.36,142.02,0.0
gfx942,304,50048,5120,4096,ck,0,0,2544.5702,a8w8_blockscale_1x128x128_256x128x128x128_16x16_32x32_2x2_8x32x1_8x32x1_1x32x1x8_8_1x1_intrawave_v3,824.96,290.21,0.0
gfx942,304,50048,5120,5120,ck,0,0,3205.4411,a8w8_blockscale_1x128x128_256x128x128x128_16x16_32x32_2x2_8x32x1_8x32x1_1x32x1x8_8_1x1_intrawave_v3,818.59,248.0,0.0
gfx942,304,50048,5120,12800,ck,0,0,8724.714,a8w8_blockscale_1x128x128_256x128x128x128_16x16_32x32_2x2_8x32x1_8x32x1_1x32x1x8_8_1x1_intrawave_v3,751.87,139.68,0.0
gfx942,304,50176,5120,4096,ck,0,0,2556.3168,a8w8_blockscale_1x128x128_256x128x128x128_16x16_32x32_2x2_8x32x1_8x32x1_1x32x1x8_8_1x1_intrawave_v3,823.27,289.59,0.0
gfx942,304,50176,5120,5120,ck,0,0,3264.7413,a8w8_blockscale_1x128x128_256x128x128x128_16x16_32x32_2x2_8x32x1_8x32x1_1x32x1x8_8_1x1_intrawave_v3,805.78,244.1,0.0
gfx942,304,50176,5120,12800,ck,0,0,8828.6233,a8w8_blockscale_1x128x128_256x128x128x128_16x16_32x32_2x2_8x32x1_8x32x1_1x32x1x8_8_1x1_intrawave_v3,744.93,138.37,0.0
gfx942,304,50304,5120,4096,ck,0,0,2540.6233,a8w8_blockscale_1x128x128_256x128x128x128_16x16_32x32_2x2_8x32x1_8x32x1_1x32x1x8_8_1x1_intrawave_v3,830.47,292.11,0.0
gfx942,304,50304,5120,5120,ck,0,0,3329.7614,a8w8_blockscale_1x128x128_256x128x128x128_16x16_32x32_2x2_8x32x1_8x32x1_1x32x1x8_8_1x1_intrawave_v3,792.06,239.92,0.0
gfx942,304,50304,5120,12800,ck,0,0,9032.2056,a8w8_blockscale_1x128x128_256x128x128x128_16x16_32x32_2x2_8x32x1_8x32x1_1x32x1x8_8_1x1_intrawave_v3,729.99,135.57,0.0
gfx942,304,50432,5120,4096,ck,0,0,2495.1923,a8w8_blockscale_1x128x128_256x128x128x128_16x16_32x32_2x2_8x32x1_8x32x1_1x32x1x8_8_1x1_intrawave_v3,847.74,298.16,0.0
gfx942,304,50432,5120,5120,ck,0,0,3270.296,a8w8_blockscale_1x128x128_256x128x128x128_16x16_32x32_2x2_8x32x1_8x32x1_1x32x1x8_8_1x1_intrawave_v3,808.52,244.89,0.0
gfx942,304,50432,5120,12800,ck,0,0,8810.9792,a8w8_blockscale_1x128x128_256x128x128x128_16x16_32x32_2x2_8x32x1_8x32x1_1x32x1x8_8_1x1_intrawave_v3,750.23,139.31,0.0
gfx942,304,50560,5120,4096,ck,0,0,2535.2068,a8w8_blockscale_1x128x128_256x128x128x128_16x16_32x32_2x2_8x32x1_8x32x1_1x32x1x8_8_1x1_intrawave_v3,836.48,294.18,0.0
gfx942,304,50560,5120,5120,ck,0,0,3344.1134,a8w8_blockscale_1x128x128_256x128x128x128_16x16_32x32_2x2_8x32x1_8x32x1_1x32x1x8_8_1x1_intrawave_v3,792.68,240.07,0.0
gfx942,304,50560,5120,12800,ck,0,0,8856.8583,a8w8_blockscale_1x128x128_256x128x128x128_16x16_32x32_2x2_8x32x1_8x32x1_1x32x1x8_8_1x1_intrawave_v3,748.23,138.92,0.0
gfx942,304,50688,5120,4096,ck,0,0,2488.964,a8w8_blockscale_1x128x128_256x128x128x128_16x16_32x32_2x2_8x32x1_8x32x1_1x32x1x8_8_1x1_intrawave_v3,854.17,300.38,0.0
gfx942,304,50688,5120,5120,ck,0,0,3284.1627,a8w8_blockscale_1x128x128_256x128x128x128_16x16_32x32_2x2_8x32x1_8x32x1_1x32x1x8_8_1x1_intrawave_v3,809.19,245.05,0.0
gfx942,304,50688,5120,12800,ck,0,0,8901.7837,a8w8_blockscale_1x128x128_256x128x128x128_16x16_32x32_2x2_8x32x1_8x32x1_1x32x1x8_8_1x1_intrawave_v3,746.34,138.56,0.0
gfx942,304,50816,5120,4096,ck,0,0,2538.0742,a8w8_blockscale_1x128x128_256x128x128x128_16x16_32x32_2x2_8x32x1_8x32x1_1x32x1x8_8_1x1_intrawave_v3,839.76,295.29,0.0
gfx942,304,50816,5120,5120,ck,0,0,3312.7484,a8w8_blockscale_1x128x128_256x128x128x128_16x16_32x32_2x2_8x32x1_8x32x1_1x32x1x8_8_1x1_intrawave_v3,804.23,243.53,0.0
gfx942,304,50816,5120,12800,ck,0,0,9168.0924,a8w8_blockscale_1x128x128_256x128x128x128_16x16_32x32_2x2_8x32x1_8x32x1_1x32x1x8_8_1x1_intrawave_v3,726.49,134.85,0.0
gfx942,304,50944,5120,4096,ck,0,0,2540.2518,a8w8_blockscale_1x128x128_256x128x128x128_16x16_32x32_2x2_8x32x1_8x32x1_1x32x1x8_8_1x1_intrawave_v3,841.16,295.76,0.0
gfx942,304,50944,5120,5120,ck,0,0,3348.3315,a8w8_blockscale_1x128x128_256x128x128x128_16x16_32x32_2x2_8x32x1_8x32x1_1x32x1x8_8_1x1_intrawave_v3,797.69,241.53,0.0
gfx942,304,50944,5120,12800,ck,0,0,8930.5463,a8w8_blockscale_1x128x128_256x128x128x128_16x16_32x32_2x2_8x32x1_8x32x1_1x32x1x8_8_1x1_intrawave_v3,747.7,138.77,0.0
gfx942,304,51072,5120,4096,ck,0,0,2529.3229,a8w8_blockscale_1x128x128_256x128x128x128_16x16_32x32_2x2_8x32x1_8x32x1_1x32x1x8_8_1x1_intrawave_v3,846.91,297.76,0.0
gfx942,304,51072,5120,5120,ck,0,0,3359.8489,a8w8_blockscale_1x128x128_256x128x128x128_16x16_32x32_2x2_8x32x1_8x32x1_1x32x1x8_8_1x1_intrawave_v3,796.95,241.28,0.0
gfx942,304,51072,5120,12800,ck,0,0,8868.2474,a8w8_blockscale_1x128x128_256x128x128x128_16x16_32x32_2x2_8x32x1_8x32x1_1x32x1x8_8_1x1_intrawave_v3,754.84,140.08,0.0
gfx942,304,51200,5120,4096,ck,0,0,2600.3262,a8w8_blockscale_1x128x128_256x128x128x128_16x16_32x32_2x2_8x32x1_8x32x1_1x32x1x8_8_1x1_intrawave_v3,825.85,290.34,0.0
gfx942,304,51200,5120,5120,ck,0,0,3336.9474,a8w8_blockscale_1x128x128_256x128x128x128_16x16_32x32_2x2_8x32x1_8x32x1_1x32x1x8_8_1x1_intrawave_v3,804.43,243.53,0.0
gfx942,304,51200,5120,12800,ck,0,0,9217.8873,a8w8_blockscale_1x128x128_256x128x128x128_16x16_32x32_2x2_8x32x1_8x32x1_1x32x1x8_8_1x1_intrawave_v3,728.03,135.08,0.0
gfx942,304,51328,5120,4096,ck,0,0,2604.1463,a8w8_blockscale_1x128x128_256x128x128x128_16x16_32x32_2x2_8x32x1_8x32x1_1x32x1x8_8_1x1_intrawave_v3,826.7,290.62,0.0
gfx942,304,51328,5120,5120,ck,0,0,3366.8967,a8w8_blockscale_1x128x128_256x128x128x128_16x16_32x32_2x2_8x32x1_8x32x1_1x32x1x8_8_1x1_intrawave_v3,799.27,241.95,0.0
gfx942,304,51328,5120,12800,ck,0,0,9029.5119,a8w8_blockscale_1x128x128_256x128x128x128_16x16_32x32_2x2_8x32x1_8x32x1_1x32x1x8_8_1x1_intrawave_v3,745.08,138.23,0.0
gfx942,304,51456,5120,4096,ck,0,0,2499.6279,a8w8_blockscale_1x128x128_256x128x128x128_16x16_32x32_2x2_8x32x1_8x32x1_1x32x1x8_8_1x1_intrawave_v3,863.42,303.5,0.0
gfx942,304,51456,5120,5120,ck,0,0,3397.2384,a8w8_blockscale_1x128x128_256x128x128x128_16x16_32x32_2x2_8x32x1_8x32x1_1x32x1x8_8_1x1_intrawave_v3,794.11,240.37,0.0
gfx942,304,51456,5120,12800,ck,0,0,8963.9076,a8w8_blockscale_1x128x128_256x128x128x128_16x16_32x32_2x2_8x32x1_8x32x1_1x32x1x8_8_1x1_intrawave_v3,752.4,139.57,0.0
gfx942,304,51584,5120,4096,ck,0,0,2522.7041,a8w8_blockscale_1x128x128_256x128x128x128_16x16_32x32_2x2_8x32x1_8x32x1_1x32x1x8_8_1x1_intrawave_v3,857.65,301.45,0.0
gfx942,304,51584,5120,5120,ck,0,0,3352.4581,a8w8_blockscale_1x128x128_256x128x128x128_16x16_32x32_2x2_8x32x1_8x32x1_1x32x1x8_8_1x1_intrawave_v3,806.72,244.16,0.0
gfx942,304,51584,5120,12800,ck,0,0,9311.5287,a8w8_blockscale_1x128x128_256x128x128x128_16x16_32x32_2x2_8x32x1_8x32x1_1x32x1x8_8_1x1_intrawave_v3,726.11,134.68,0.0
gfx942,304,51712,5120,4096,ck,0,0,2584.5815,a8w8_blockscale_1x128x128_256x128x128x128_16x16_32x32_2x2_8x32x1_8x32x1_1x32x1x8_8_1x1_intrawave_v3,839.19,294.95,0.0
gfx942,304,51712,5120,5120,ck,0,0,3396.4947,a8w8_blockscale_1x128x128_256x128x128x128_16x16_32x32_2x2_8x32x1_8x32x1_1x32x1x8_8_1x1_intrawave_v3,798.23,241.58,0.0
gfx942,304,51712,5120,12800,ck,0,0,8957.1269,a8w8_blockscale_1x128x128_256x128x128x128_16x16_32x32_2x2_8x32x1_8x32x1_1x32x1x8_8_1x1_intrawave_v3,756.72,140.33,0.0
gfx942,304,51840,5120,4096,ck,0,0,2585.8178,a8w8_blockscale_1x128x128_256x128x128x128_16x16_32x32_2x2_8x32x1_8x32x1_1x32x1x8_8_1x1_intrawave_v3,840.87,295.52,0.0
gfx942,304,51840,5120,5120,ck,0,0,3444.5719,a8w8_blockscale_1x128x128_256x128x128x128_16x16_32x32_2x2_8x32x1_8x32x1_1x32x1x8_8_1x1_intrawave_v3,789.04,238.77,0.0
gfx942,304,51840,5120,12800,ck,0,0,9286.7348,a8w8_blockscale_1x128x128_256x128x128x128_16x16_32x32_2x2_8x32x1_8x32x1_1x32x1x8_8_1x1_intrawave_v3,731.66,135.67,0.0
gfx942,304,51968,5120,4096,ck,0,0,2602.5599,a8w8_blockscale_1x128x128_256x128x128x128_16x16_32x32_2x2_8x32x1_8x32x1_1x32x1x8_8_1x1_intrawave_v3,837.52,294.32,0.0
gfx942,304,51968,5120,5120,ck,0,0,3379.9144,a8w8_blockscale_1x128x128_256x128x128x128_16x16_32x32_2x2_8x32x1_8x32x1_1x32x1x8_8_1x1_intrawave_v3,806.12,243.92,0.0
gfx942,304,51968,5120,12800,ck,0,0,9362.3042,a8w8_blockscale_1x128x128_256x128x128x128_16x16_32x32_2x2_8x32x1_8x32x1_1x32x1x8_8_1x1_intrawave_v3,727.55,134.89,0.0
gfx942,304,52096,5120,4096,ck,0,0,2553.0713,a8w8_blockscale_1x128x128_256x128x128x128_16x16_32x32_2x2_8x32x1_8x32x1_1x32x1x8_8_1x1_intrawave_v3,855.86,300.74,0.0
gfx942,304,52096,5120,5120,ck,0,0,3385.9713,a8w8_blockscale_1x128x128_256x128x128x128_16x16_32x32_2x2_8x32x1_8x32x1_1x32x1x8_8_1x1_intrawave_v3,806.66,244.07,0.0
gfx942,304,52096,5120,12800,ck,0,0,9107.5111,a8w8_blockscale_1x128x128_256x128x128x128_16x16_32x32_2x2_8x32x1_8x32x1_1x32x1x8_8_1x1_intrawave_v3,749.75,138.99,0.0
gfx942,304,52224,5120,4096,ck,0,0,2560.3257,a8w8_blockscale_1x128x128_256x128x128x128_16x16_32x32_2x2_8x32x1_8x32x1_1x32x1x8_8_1x1_intrawave_v3,855.53,300.61,0.0
gfx942,304,52224,5120,5120,ck,0,0,3461.189,a8w8_blockscale_1x128x128_256x128x128x128_16x16_32x32_2x2_8x32x1_8x32x1_1x32x1x8_8_1x1_intrawave_v3,791.07,239.33,0.0
gfx942,304,52224,5120,12800,ck,0,0,9095.8151,a8w8_blockscale_1x128x128_256x128x128x128_16x16_32x32_2x2_8x32x1_8x32x1_1x32x1x8_8_1x1_intrawave_v3,752.56,139.49,0.0
gfx942,304,52352,5120,4096,ck,0,0,2585.7094,a8w8_blockscale_1x128x128_256x128x128x128_16x16_32x32_2x2_8x32x1_8x32x1_1x32x1x8_8_1x1_intrawave_v3,849.21,298.37,0.0
gfx942,304,52352,5120,5120,ck,0,0,3469.0942,a8w8_blockscale_1x128x128_256x128x128x128_16x16_32x32_2x2_8x32x1_8x32x1_1x32x1x8_8_1x1_intrawave_v3,791.2,239.35,0.0
gfx942,304,52352,5120,12800,ck,0,0,9130.8507,a8w8_blockscale_1x128x128_256x128x128x128_16x16_32x32_2x2_8x32x1_8x32x1_1x32x1x8_8_1x1_intrawave_v3,751.51,139.28,0.0
gfx942,304,52480,5120,4096,ck,0,0,2582.0382,a8w8_blockscale_1x128x128_256x128x128x128_16x16_32x32_2x2_8x32x1_8x32x1_1x32x1x8_8_1x1_intrawave_v3,852.49,299.5,0.0
gfx942,304,52480,5120,5120,ck,0,0,3457.1889,a8w8_blockscale_1x128x128_256x128x128x128_16x16_32x32_2x2_8x32x1_8x32x1_1x32x1x8_8_1x1_intrawave_v3,795.87,240.75,0.0
gfx942,304,52480,5120,12800,ck,0,0,8951.9377,a8w8_blockscale_1x128x128_256x128x128x128_16x16_32x32_2x2_8x32x1_8x32x1_1x32x1x8_8_1x1_intrawave_v3,768.4,142.39,0.0
gfx942,304,52608,5120,4096,ck,0,0,2600.8953,a8w8_blockscale_1x128x128_256x128x128x128_16x16_32x32_2x2_8x32x1_8x32x1_1x32x1x8_8_1x1_intrawave_v3,848.38,298.04,0.0
gfx942,304,52608,5120,5120,ck,0,0,3394.6211,a8w8_blockscale_1x128x128_256x128x128x128_16x16_32x32_2x2_8x32x1_8x32x1_1x32x1x8_8_1x1_intrawave_v3,812.51,245.76,0.0
gfx942,304,52608,5120,12800,ck,0,0,9203.8591,a8w8_blockscale_1x128x128_256x128x128x128_16x16_32x32_2x2_8x32x1_8x32x1_1x32x1x8_8_1x1_intrawave_v3,749.19,138.81,0.0
gfx942,304,52736,5120,4096,ck,0,0,2673.8408,a8w8_blockscale_1x128x128_256x128x128x128_16x16_32x32_2x2_8x32x1_8x32x1_1x32x1x8_8_1x1_intrawave_v3,827.24,290.59,0.0
gfx942,304,52736,5120,5120,ck,0,0,3526.4102,a8w8_blockscale_1x128x128_256x128x128x128_16x16_32x32_2x2_8x32x1_8x32x1_1x32x1x8_8_1x1_intrawave_v3,784.05,237.14,0.0
gfx942,304,52736,5120,12800,ck,0,0,9042.6911,a8w8_blockscale_1x128x128_256x128x128x128_16x16_32x32_2x2_8x32x1_8x32x1_1x32x1x8_8_1x1_intrawave_v3,764.4,141.61,0.0
gfx942,304,52864,5120,4096,ck,0,0,2665.4113,a8w8_blockscale_1x128x128_256x128x128x128_16x16_32x32_2x2_8x32x1_8x32x1_1x32x1x8_8_1x1_intrawave_v3,831.87,292.2,0.0
gfx942,304,52864,5120,5120,ck,0,0,3523.034,a8w8_blockscale_1x128x128_256x128x128x128_16x16_32x32_2x2_8x32x1_8x32x1_1x32x1x8_8_1x1_intrawave_v3,786.71,237.92,0.0
gfx942,304,52864,5120,12800,ck,0,0,9219.8694,a8w8_blockscale_1x128x128_256x128x128x128_16x16_32x32_2x2_8x32x1_8x32x1_1x32x1x8_8_1x1_intrawave_v3,751.53,139.21,0.0
gfx942,304,52992,5120,4096,ck,0,0,2624.3362,a8w8_blockscale_1x128x128_256x128x128x128_16x16_32x32_2x2_8x32x1_8x32x1_1x32x1x8_8_1x1_intrawave_v3,846.94,297.47,0.0
gfx942,304,52992,5120,5120,ck,0,0,3449.0019,a8w8_blockscale_1x128x128_256x128x128x128_16x16_32x32_2x2_8x32x1_8x32x1_1x32x1x8_8_1x1_intrawave_v3,805.54,243.6,0.0
gfx942,304,52992,5120,12800,ck,0,0,9560.8884,a8w8_blockscale_1x128x128_256x128x128x128_16x16_32x32_2x2_8x32x1_8x32x1_1x32x1x8_8_1x1_intrawave_v3,726.48,134.56,0.0
gfx942,304,53120,5120,4096,ck,0,0,2667.3573,a8w8_blockscale_1x128x128_256x128x128x128_16x16_32x32_2x2_8x32x1_8x32x1_1x32x1x8_8_1x1_intrawave_v3,835.29,293.36,0.0
gfx942,304,53120,5120,5120,ck,0,0,3469.8787,a8w8_blockscale_1x128x128_256x128x128x128_16x16_32x32_2x2_8x32x1_8x32x1_1x32x1x8_8_1x1_intrawave_v3,802.63,242.7,0.0
gfx942,304,53120,5120,12800,ck,0,0,9108.9513,a8w8_blockscale_1x128x128_256x128x128x128_16x16_32x32_2x2_8x32x1_8x32x1_1x32x1x8_8_1x1_intrawave_v3,764.36,141.56,0.0
gfx942,304,53248,5120,4096,ck,0,0,2701.8137,a8w8_blockscale_1x128x128_256x128x128x128_16x16_32x32_2x2_8x32x1_8x32x1_1x32x1x8_8_1x1_intrawave_v3,826.62,290.3,0.0
gfx942,304,53248,5120,5120,ck,0,0,3441.756,a8w8_blockscale_1x128x128_256x128x128x128_16x16_32x32_2x2_8x32x1_8x32x1_1x32x1x8_8_1x1_intrawave_v3,811.13,245.25,0.0
gfx942,304,53248,5120,12800,ck,0,0,9359.3556,a8w8_blockscale_1x128x128_256x128x128x128_16x16_32x32_2x2_8x32x1_8x32x1_1x32x1x8_8_1x1_intrawave_v3,745.71,138.08,0.0
gfx942,304,53376,5120,4096,ck,0,0,2661.35,a8w8_blockscale_1x128x128_256x128x128x128_16x16_32x32_2x2_8x32x1_8x32x1_1x32x1x8_8_1x1_intrawave_v3,841.21,295.4,0.0
gfx942,304,53376,5120,5120,ck,0,0,3500.0843,a8w8_blockscale_1x128x128_256x128x128x128_16x16_32x32_2x2_8x32x1_8x32x1_1x32x1x8_8_1x1_intrawave_v3,799.53,241.73,0.0
gfx942,304,53376,5120,12800,ck,0,0,9563.7135,a8w8_blockscale_1x128x128_256x128x128x128_16x16_32x32_2x2_8x32x1_8x32x1_1x32x1x8_8_1x1_intrawave_v3,731.53,135.44,0.0
gfx942,304,53504,5120,4096,ck,0,0,2679.5694,a8w8_blockscale_1x128x128_256x128x128x128_16x16_32x32_2x2_8x32x1_8x32x1_1x32x1x8_8_1x1_intrawave_v3,837.49,294.08,0.0
gfx942,304,53504,5120,5120,ck,0,0,3507.575,a8w8_blockscale_1x128x128_256x128x128x128_16x16_32x32_2x2_8x32x1_8x32x1_1x32x1x8_8_1x1_intrawave_v3,799.74,241.77,0.0
gfx942,304,53504,5120,12800,ck,0,0,9444.9065,a8w8_blockscale_1x128x128_256x128x128x128_16x16_32x32_2x2_8x32x1_8x32x1_1x32x1x8_8_1x1_intrawave_v3,742.5,137.46,0.0
gfx942,304,53632,5120,4096,ck,0,0,2731.1605,a8w8_blockscale_1x128x128_256x128x128x128_16x16_32x32_2x2_8x32x1_8x32x1_1x32x1x8_8_1x1_intrawave_v3,823.64,289.2,0.0
gfx942,304,53632,5120,5120,ck,0,0,3490.2855,a8w8_blockscale_1x128x128_256x128x128x128_16x16_32x32_2x2_8x32x1_8x32x1_1x32x1x8_8_1x1_intrawave_v3,805.63,243.53,0.0
gfx942,304,53632,5120,12800,ck,0,0,9446.7881,a8w8_blockscale_1x128x128_256x128x128x128_16x16_32x32_2x2_8x32x1_8x32x1_1x32x1x8_8_1x1_intrawave_v3,744.13,137.74,0.0
gfx942,304,53760,5120,4096,ck,0,0,2652.7404,a8w8_blockscale_1x128x128_256x128x128x128_16x16_32x32_2x2_8x32x1_8x32x1_1x32x1x8_8_1x1_intrawave_v3,850.01,298.44,0.0
gfx942,304,53760,5120,5120,ck,0,0,3491.764,a8w8_blockscale_1x128x128_256x128x128x128_16x16_32x32_2x2_8x32x1_8x32x1_1x32x1x8_8_1x1_intrawave_v3,807.21,243.99,0.0
gfx942,304,53760,5120,12800,ck,0,0,9385.7761,a8w8_blockscale_1x128x128_256x128x128x128_16x16_32x32_2x2_8x32x1_8x32x1_1x32x1x8_8_1x1_intrawave_v3,750.76,138.95,0.0
gfx942,304,53888,5120,4096,ck,0,0,2674.4598,a8w8_blockscale_1x128x128_256x128x128x128_16x16_32x32_2x2_8x32x1_8x32x1_1x32x1x8_8_1x1_intrawave_v3,845.12,296.7,0.0
gfx942,304,53888,5120,5120,ck,0,0,3472.0355,a8w8_blockscale_1x128x128_256x128x128x128_16x16_32x32_2x2_8x32x1_8x32x1_1x32x1x8_8_1x1_intrawave_v3,813.73,245.95,0.0
gfx942,304,53888,5120,12800,ck,0,0,9385.0884,a8w8_blockscale_1x128x128_256x128x128x128_16x16_32x32_2x2_8x32x1_8x32x1_1x32x1x8_8_1x1_intrawave_v3,752.6,139.28,0.0
gfx942,304,54016,5120,4096,ck,0,0,2670.4093,a8w8_blockscale_1x128x128_256x128x128x128_16x16_32x32_2x2_8x32x1_8x32x1_1x32x1x8_8_1x1_intrawave_v3,848.41,297.84,0.0
gfx942,304,54016,5120,5120,ck,0,0,3458.6645,a8w8_blockscale_1x128x128_256x128x128x128_16x16_32x32_2x2_8x32x1_8x32x1_1x32x1x8_8_1x1_intrawave_v3,818.81,247.47,0.0
gfx942,304,54016,5120,12800,ck,0,0,9688.8607,a8w8_blockscale_1x128x128_256x128x128x128_16x16_32x32_2x2_8x32x1_8x32x1_1x32x1x8_8_1x1_intrawave_v3,730.73,135.21,0.0
gfx942,304,54144,5120,4096,ck,0,0,2655.0104,a8w8_blockscale_1x128x128_256x128x128x128_16x16_32x32_2x2_8x32x1_8x32x1_1x32x1x8_8_1x1_intrawave_v3,855.35,300.25,0.0
gfx942,304,54144,5120,5120,ck,0,0,3524.7698,a8w8_blockscale_1x128x128_256x128x128x128_16x16_32x32_2x2_8x32x1_8x32x1_1x32x1x8_8_1x1_intrawave_v3,805.36,243.38,0.0
gfx942,304,54144,5120,12800,ck,0,0,9785.1734,a8w8_blockscale_1x128x128_256x128x128x128_16x16_32x32_2x2_8x32x1_8x32x1_1x32x1x8_8_1x1_intrawave_v3,725.26,134.18,0.0
gfx942,304,54272,5120,4096,ck,0,0,2768.9774,a8w8_blockscale_1x128x128_256x128x128x128_16x16_32x32_2x2_8x32x1_8x32x1_1x32x1x8_8_1x1_intrawave_v3,822.08,288.56,0.0
gfx942,304,54272,5120,5120,ck,0,0,3558.1201,a8w8_blockscale_1x128x128_256x128x128x128_16x16_32x32_2x2_8x32x1_8x32x1_1x32x1x8_8_1x1_intrawave_v3,799.7,241.65,0.0
gfx942,304,54272,5120,12800,ck,0,0,9531.082,a8w8_blockscale_1x128x128_256x128x128x128_16x16_32x32_2x2_8x32x1_8x32x1_1x32x1x8_8_1x1_intrawave_v3,746.35,138.07,0.0
gfx942,304,54400,5120,4096,ck,0,0,2662.8055,a8w8_blockscale_1x128x128_256x128x128x128_16x16_32x32_2x2_8x32x1_8x32x1_1x32x1x8_8_1x1_intrawave_v3,856.88,300.75,0.0
gfx942,304,54400,5120,5120,ck,0,0,3531.945,a8w8_blockscale_1x128x128_256x128x128x128_16x16_32x32_2x2_8x32x1_8x32x1_1x32x1x8_8_1x1_intrawave_v3,807.52,244.0,0.0
gfx942,304,54400,5120,12800,ck,0,0,9512.0534,a8w8_blockscale_1x128x128_256x128x128x128_16x16_32x32_2x2_8x32x1_8x32x1_1x32x1x8_8_1x1_intrawave_v3,749.61,138.66,0.0
gfx942,304,54528,5120,4096,ck,0,0,2754.1316,a8w8_blockscale_1x128x128_256x128x128x128_16x16_32x32_2x2_8x32x1_8x32x1_1x32x1x8_8_1x1_intrawave_v3,830.41,291.45,0.0
gfx942,304,54528,5120,5120,ck,0,0,3499.1305,a8w8_blockscale_1x128x128_256x128x128x128_16x16_32x32_2x2_8x32x1_8x32x1_1x32x1x8_8_1x1_intrawave_v3,817.01,246.85,0.0
gfx942,304,54528,5120,12800,ck,0,0,9321.9713,a8w8_blockscale_1x128x128_256x128x128x128_16x16_32x32_2x2_8x32x1_8x32x1_1x32x1x8_8_1x1_intrawave_v3,766.69,141.8,0.0
gfx942,304,54656,5120,4096,ck,0,0,2697.2518,a8w8_blockscale_1x128x128_256x128x128x128_16x16_32x32_2x2_8x32x1_8x32x1_1x32x1x8_8_1x1_intrawave_v3,849.92,298.27,0.0
gfx942,304,54656,5120,5120,ck,0,0,3594.3142,a8w8_blockscale_1x128x128_256x128x128x128_16x16_32x32_2x2_8x32x1_8x32x1_1x32x1x8_8_1x1_intrawave_v3,797.24,240.86,0.0
gfx942,304,54656,5120,12800,ck,0,0,9634.2014,a8w8_blockscale_1x128x128_256x128x128x128_16x16_32x32_2x2_8x32x1_8x32x1_1x32x1x8_8_1x1_intrawave_v3,743.59,137.51,0.0
gfx942,304,54784,5120,4096,ck,0,0,2726.2778,a8w8_blockscale_1x128x128_256x128x128x128_16x16_32x32_2x2_8x32x1_8x32x1_1x32x1x8_8_1x1_intrawave_v3,842.84,295.77,0.0
gfx942,304,54784,5120,5120,ck,0,0,3587.7567,a8w8_blockscale_1x128x128_256x128x128x128_16x16_32x32_2x2_8x32x1_8x32x1_1x32x1x8_8_1x1_intrawave_v3,800.57,241.85,0.0
gfx942,304,54784,5120,12800,ck,0,0,9815.7183,a8w8_blockscale_1x128x128_256x128x128x128_16x16_32x32_2x2_8x32x1_8x32x1_1x32x1x8_8_1x1_intrawave_v3,731.55,135.27,0.0
gfx942,304,54912,5120,4096,ck,0,0,2776.138,a8w8_blockscale_1x128x128_256x128x128x128_16x16_32x32_2x2_8x32x1_8x32x1_1x32x1x8_8_1x1_intrawave_v3,829.63,291.12,0.0
gfx942,304,54912,5120,5120,ck,0,0,3636.8073,a8w8_blockscale_1x128x128_256x128x128x128_16x16_32x32_2x2_8x32x1_8x32x1_1x32x1x8_8_1x1_intrawave_v3,791.62,239.13,0.0
gfx942,304,54912,5120,12800,ck,0,0,9567.7121,a8w8_blockscale_1x128x128_256x128x128x128_16x16_32x32_2x2_8x32x1_8x32x1_1x32x1x8_8_1x1_intrawave_v3,752.26,139.08,0.0
gfx942,304,55040,5120,4096,ck,0,0,2809.2077,a8w8_blockscale_1x128x128_256x128x128x128_16x16_32x32_2x2_8x32x1_8x32x1_1x32x1x8_8_1x1_intrawave_v3,821.78,288.35,0.0
gfx942,304,55040,5120,5120,ck,0,0,3573.9249,a8w8_blockscale_1x128x128_256x128x128x128_16x16_32x32_2x2_8x32x1_8x32x1_1x32x1x8_8_1x1_intrawave_v3,807.43,243.89,0.0
gfx942,304,55040,5120,12800,ck,0,0,9690.5514,a8w8_blockscale_1x128x128_256x128x128x128_16x16_32x32_2x2_8x32x1_8x32x1_1x32x1x8_8_1x1_intrawave_v3,744.46,137.62,0.0
gfx942,304,55168,5120,4096,ck,0,0,2754.7787,a8w8_blockscale_1x128x128_256x128x128x128_16x16_32x32_2x2_8x32x1_8x32x1_1x32x1x8_8_1x1_intrawave_v3,839.96,294.71,0.0
gfx942,304,55168,5120,5120,ck,0,0,3610.1605,a8w8_blockscale_1x128x128_256x128x128x128_16x16_32x32_2x2_8x32x1_8x32x1_1x32x1x8_8_1x1_intrawave_v3,801.18,241.98,0.0
gfx942,304,55168,5120,12800,ck,0,0,9467.7416,a8w8_blockscale_1x128x128_256x128x128x128_16x16_32x32_2x2_8x32x1_8x32x1_1x32x1x8_8_1x1_intrawave_v3,763.75,141.17,0.0
gfx942,304,55296,5120,4096,ck,0,0,2761.2688,a8w8_blockscale_1x128x128_256x128x128x128_16x16_32x32_2x2_8x32x1_8x32x1_1x32x1x8_8_1x1_intrawave_v3,839.93,294.68,0.0
gfx942,304,55296,5120,5120,ck,0,0,3629.181,a8w8_blockscale_1x128x128_256x128x128x128_16x16_32x32_2x2_8x32x1_8x32x1_1x32x1x8_8_1x1_intrawave_v3,798.83,241.26,0.0
gfx942,304,55296,5120,12800,ck,0,0,9454.9738,a8w8_blockscale_1x128x128_256x128x128x128_16x16_32x32_2x2_8x32x1_8x32x1_1x32x1x8_8_1x1_intrawave_v3,766.55,141.68,0.0
gfx942,304,55424,5120,4096,ck,0,0,2740.0431,a8w8_blockscale_1x128x128_256x128x128x128_16x16_32x32_2x2_8x32x1_8x32x1_1x32x1x8_8_1x1_intrawave_v3,848.4,297.63,0.0
gfx942,304,55424,5120,5120,ck,0,0,3608.7884,a8w8_blockscale_1x128x128_256x128x128x128_16x16_32x32_2x2_8x32x1_8x32x1_1x32x1x8_8_1x1_intrawave_v3,805.2,243.16,0.0
gfx942,304,55424,5120,12800,ck,0,0,9586.0947,a8w8_blockscale_1x128x128_256x128x128x128_16x16_32x32_2x2_8x32x1_8x32x1_1x32x1x8_8_1x1_intrawave_v3,757.82,140.05,0.0
gfx942,304,55552,5120,4096,ck,0,0,2750.5447,a8w8_blockscale_1x128x128_256x128x128x128_16x16_32x32_2x2_8x32x1_8x32x1_1x32x1x8_8_1x1_intrawave_v3,847.11,297.16,0.0
gfx942,304,55552,5120,5120,ck,0,0,3632.571,a8w8_blockscale_1x128x128_256x128x128x128_16x16_32x32_2x2_8x32x1_8x32x1_1x32x1x8_8_1x1_intrawave_v3,801.78,242.11,0.0
gfx942,304,55552,5120,12800,ck,0,0,9793.8795,a8w8_blockscale_1x128x128_256x128x128x128_16x16_32x32_2x2_8x32x1_8x32x1_1x32x1x8_8_1x1_intrawave_v3,743.46,137.38,0.0
gfx942,304,55680,5120,4096,ck,0,0,2793.6307,a8w8_blockscale_1x128x128_256x128x128x128_16x16_32x32_2x2_8x32x1_8x32x1_1x32x1x8_8_1x1_intrawave_v3,835.97,293.24,0.0
gfx942,304,55680,5120,5120,ck,0,0,3622.721,a8w8_blockscale_1x128x128_256x128x128x128_16x16_32x32_2x2_8x32x1_8x32x1_1x32x1x8_8_1x1_intrawave_v3,805.81,243.31,0.0
gfx942,304,55680,5120,12800,ck,0,0,10095.2146,a8w8_blockscale_1x128x128_256x128x128x128_16x16_32x32_2x2_8x32x1_8x32x1_1x32x1x8_8_1x1_intrawave_v3,722.93,133.57,0.0
gfx942,304,55808,5120,4096,ck,0,0,2846.9674,a8w8_blockscale_1x128x128_256x128x128x128_16x16_32x32_2x2_8x32x1_8x32x1_1x32x1x8_8_1x1_intrawave_v3,822.19,288.39,0.0
gfx942,304,55808,5120,5120,ck,0,0,3730.4566,a8w8_blockscale_1x128x128_256x128x128x128_16x16_32x32_2x2_8x32x1_8x32x1_1x32x1x8_8_1x1_intrawave_v3,784.34,236.81,0.0
gfx942,304,55808,5120,12800,ck,0,0,9760.3241,a8w8_blockscale_1x128x128_256x128x128x128_16x16_32x32_2x2_8x32x1_8x32x1_1x32x1x8_8_1x1_intrawave_v3,749.45,138.45,0.0
gfx942,304,55936,5120,4096,ck,0,0,2804.6195,a8w8_blockscale_1x128x128_256x128x128x128_16x16_32x32_2x2_8x32x1_8x32x1_1x32x1x8_8_1x1_intrawave_v3,836.52,293.4,0.0
gfx942,304,55936,5120,5120,ck,0,0,3668.1333,a8w8_blockscale_1x128x128_256x128x128x128_16x16_32x32_2x2_8x32x1_8x32x1_1x32x1x8_8_1x1_intrawave_v3,799.5,241.37,0.0
gfx942,304,55936,5120,12800,ck,0,0,9804.0389,a8w8_blockscale_1x128x128_256x128x128x128_16x16_32x32_2x2_8x32x1_8x32x1_1x32x1x8_8_1x1_intrawave_v3,747.82,138.14,0.0
gfx942,304,56064,5120,4096,ck,0,0,2794.4381,a8w8_blockscale_1x128x128_256x128x128x128_16x16_32x32_2x2_8x32x1_8x32x1_1x32x1x8_8_1x1_intrawave_v3,841.49,295.12,0.0
gfx942,304,56064,5120,5120,ck,0,0,3651.4974,a8w8_blockscale_1x128x128_256x128x128x128_16x16_32x32_2x2_8x32x1_8x32x1_1x32x1x8_8_1x1_intrawave_v3,804.98,243.01,0.0
gfx942,304,56064,5120,12800,ck,0,0,10052.0741,a8w8_blockscale_1x128x128_256x128x128x128_16x16_32x32_2x2_8x32x1_8x32x1_1x32x1x8_8_1x1_intrawave_v3,731.04,135.02,0.0
gfx942,304,56192,5120,4096,ck,0,0,2787.0645,a8w8_blockscale_1x128x128_256x128x128x128_16x16_32x32_2x2_8x32x1_8x32x1_1x32x1x8_8_1x1_intrawave_v3,845.64,296.56,0.0
gfx942,304,56192,5120,5120,ck,0,0,3755.9549,a8w8_blockscale_1x128x128_256x128x128x128_16x16_32x32_2x2_8x32x1_8x32x1_1x32x1x8_8_1x1_intrawave_v3,784.38,236.78,0.0
gfx942,304,56192,5120,12800,ck,0,0,9841.0943,a8w8_blockscale_1x128x128_256x128x128x128_16x16_32x32_2x2_8x32x1_8x32x1_1x32x1x8_8_1x1_intrawave_v3,748.41,138.22,0.0
gfx942,304,56320,5120,4096,ck,0,0,2818.1729,a8w8_blockscale_1x128x128_256x128x128x128_16x16_32x32_2x2_8x32x1_8x32x1_1x32x1x8_8_1x1_intrawave_v3,838.21,293.94,0.0
gfx942,304,56320,5120,5120,ck,0,0,3675.6391,a8w8_blockscale_1x128x128_256x128x128x128_16x16_32x32_2x2_8x32x1_8x32x1_1x32x1x8_8_1x1_intrawave_v3,803.34,242.49,0.0
gfx942,304,56320,5120,12800,ck,0,0,9889.2283,a8w8_blockscale_1x128x128_256x128x128x128_16x16_32x32_2x2_8x32x1_8x32x1_1x32x1x8_8_1x1_intrawave_v3,746.47,137.84,0.0
gfx942,304,56448,5120,4096,ck,0,0,2768.7898,a8w8_blockscale_1x128x128_256x128x128x128_16x16_32x32_2x2_8x32x1_8x32x1_1x32x1x8_8_1x1_intrawave_v3,855.1,299.85,0.0
gfx942,304,56448,5120,5120,ck,0,0,3670.6851,a8w8_blockscale_1x128x128_256x128x128x128_16x16_32x32_2x2_8x32x1_8x32x1_1x32x1x8_8_1x1_intrawave_v3,806.25,243.35,0.0
gfx942,304,56448,5120,12800,ck,0,0,9871.6978,a8w8_blockscale_1x128x128_256x128x128x128_16x16_32x32_2x2_8x32x1_8x32x1_1x32x1x8_8_1x1_intrawave_v3,749.49,138.39,0.0
gfx942,304,56576,5120,4096,ck,0,0,2817.504,a8w8_blockscale_1x128x128_256x128x128x128_16x16_32x32_2x2_8x32x1_8x32x1_1x32x1x8_8_1x1_intrawave_v3,842.22,295.31,0.0
gfx942,304,56576,5120,5120,ck,0,0,3770.3001,a8w8_blockscale_1x128x128_256x128x128x128_16x16_32x32_2x2_8x32x1_8x32x1_1x32x1x8_8_1x1_intrawave_v3,786.73,237.44,0.0
gfx942,304,56576,5120,12800,ck,0,0,10125.0646,a8w8_blockscale_1x128x128_256x128x128x128_16x16_32x32_2x2_8x32x1_8x32x1_1x32x1x8_8_1x1_intrawave_v3,732.39,135.21,0.0
gfx942,304,56704,5120,4096,ck,0,0,2802.8201,a8w8_blockscale_1x128x128_256x128x128x128_16x16_32x32_2x2_8x32x1_8x32x1_1x32x1x8_8_1x1_intrawave_v3,848.55,297.51,0.0
gfx942,304,56704,5120,5120,ck,0,0,3630.0328,a8w8_blockscale_1x128x128_256x128x128x128_16x16_32x32_2x2_8x32x1_8x32x1_1x32x1x8_8_1x1_intrawave_v3,818.98,247.16,0.0
gfx942,304,56704,5120,12800,ck,0,0,9946.2298,a8w8_blockscale_1x128x128_256x128x128x128_16x16_32x32_2x2_8x32x1_8x32x1_1x32x1x8_8_1x1_intrawave_v3,747.25,137.94,0.0
gfx942,304,56832,5120,4096,ck,0,0,2778.0519,a8w8_blockscale_1x128x128_256x128x128x128_16x16_32x32_2x2_8x32x1_8x32x1_1x32x1x8_8_1x1_intrawave_v3,858.05,300.83,0.0
gfx942,304,56832,5120,5120,ck,0,0,3649.1613,a8w8_blockscale_1x128x128_256x128x128x128_16x16_32x32_2x2_8x32x1_8x32x1_1x32x1x8_8_1x1_intrawave_v3,816.53,246.4,0.0
gfx942,304,56832,5120,12800,ck,0,0,10273.2581,a8w8_blockscale_1x128x128_256x128x128x128_16x16_32x32_2x2_8x32x1_8x32x1_1x32x1x8_8_1x1_intrawave_v3,725.09,133.84,0.0
gfx942,304,56960,5120,4096,ck,0,0,2819.0972,a8w8_blockscale_1x128x128_256x128x128x128_16x16_32x32_2x2_8x32x1_8x32x1_1x32x1x8_8_1x1_intrawave_v3,847.46,297.1,0.0
gfx942,304,56960,5120,5120,ck,0,0,3787.1229,a8w8_blockscale_1x128x128_256x128x128x128_16x16_32x32_2x2_8x32x1_8x32x1_1x32x1x8_8_1x1_intrawave_v3,788.55,237.94,0.0
gfx942,304,56960,5120,12800,ck,0,0,10172.9555,a8w8_blockscale_1x128x128_256x128x128x128_16x16_32x32_2x2_8x32x1_8x32x1_1x32x1x8_8_1x1_intrawave_v3,733.89,135.45,0.0
gfx942,304,57088,5120,4096,ck,0,0,2911.4504,a8w8_blockscale_1x128x128_256x128x128x128_16x16_32x32_2x2_8x32x1_8x32x1_1x32x1x8_8_1x1_intrawave_v3,822.42,288.3,0.0
gfx942,304,57088,5120,5120,ck,0,0,3758.3323,a8w8_blockscale_1x128x128_256x128x128x128_16x16_32x32_2x2_8x32x1_8x32x1_1x32x1x8_8_1x1_intrawave_v3,796.38,240.29,0.0
gfx942,304,57088,5120,12800,ck,0,0,9989.0822,a8w8_blockscale_1x128x128_256x128x128x128_16x16_32x32_2x2_8x32x1_8x32x1_1x32x1x8_8_1x1_intrawave_v3,749.08,138.24,0.0
gfx942,304,57216,5120,4096,ck,0,0,2907.0029,a8w8_blockscale_1x128x128_256x128x128x128_16x16_32x32_2x2_8x32x1_8x32x1_1x32x1x8_8_1x1_intrawave_v3,825.53,289.38,0.0
gfx942,304,57216,5120,5120,ck,0,0,3674.8783,a8w8_blockscale_1x128x128_256x128x128x128_16x16_32x32_2x2_8x32x1_8x32x1_1x32x1x8_8_1x1_intrawave_v3,816.29,246.28,0.0
gfx942,304,57216,5120,12800,ck,0,0,10060.9034,a8w8_blockscale_1x128x128_256x128x128x128_16x16_32x32_2x2_8x32x1_8x32x1_1x32x1x8_8_1x1_intrawave_v3,745.4,137.54,0.0
gfx942,304,57344,5120,4096,ck,0,0,2807.4788,a8w8_blockscale_1x128x128_256x128x128x128_16x16_32x32_2x2_8x32x1_8x32x1_1x32x1x8_8_1x1_intrawave_v3,856.71,300.29,0.0
gfx942,304,57344,5120,5120,ck,0,0,3765.7794,a8w8_blockscale_1x128x128_256x128x128x128_16x16_32x32_2x2_8x32x1_8x32x1_1x32x1x8_8_1x1_intrawave_v3,798.37,240.86,0.0
gfx942,304,57344,5120,12800,ck,0,0,10023.5788,a8w8_blockscale_1x128x128_256x128x128x128_16x16_32x32_2x2_8x32x1_8x32x1_1x32x1x8_8_1x1_intrawave_v3,749.85,138.35,0.0
gfx942,304,57472,5120,4096,ck,0,0,2906.523,a8w8_blockscale_1x128x128_256x128x128x128_16x16_32x32_2x2_8x32x1_8x32x1_1x32x1x8_8_1x1_intrawave_v3,829.36,290.69,0.0
gfx942,304,57472,5120,5120,ck,0,0,3848.2089,a8w8_blockscale_1x128x128_256x128x128x128_16x16_32x32_2x2_8x32x1_8x32x1_1x32x1x8_8_1x1_intrawave_v3,783.01,236.21,0.0
gfx942,304,57472,5120,12800,ck,0,0,10116.4445,a8w8_blockscale_1x128x128_256x128x128x128_16x16_32x32_2x2_8x32x1_8x32x1_1x32x1x8_8_1x1_intrawave_v3,744.63,137.37,0.0
gfx942,304,57600,5120,4096,ck,0,0,2878.048,a8w8_blockscale_1x128x128_256x128x128x128_16x16_32x32_2x2_8x32x1_8x32x1_1x32x1x8_8_1x1_intrawave_v3,839.43,294.2,0.0
gfx942,304,57600,5120,5120,ck,0,0,3700.6948,a8w8_blockscale_1x128x128_256x128x128x128_16x16_32x32_2x2_8x32x1_8x32x1_1x32x1x8_8_1x1_intrawave_v3,816.04,246.16,0.0
gfx942,304,57600,5120,12800,ck,0,0,10412.762,a8w8_blockscale_1x128x128_256x128x128x128_16x16_32x32_2x2_8x32x1_8x32x1_1x32x1x8_8_1x1_intrawave_v3,725.05,133.74,0.0
gfx942,304,57728,5120,4096,ck,0,0,2932.05,a8w8_blockscale_1x128x128_256x128x128x128_16x16_32x32_2x2_8x32x1_8x32x1_1x32x1x8_8_1x1_intrawave_v3,825.8,289.41,0.0
gfx942,304,57728,5120,5120,ck,0,0,3847.2299,a8w8_blockscale_1x128x128_256x128x128x128_16x16_32x32_2x2_8x32x1_8x32x1_1x32x1x8_8_1x1_intrawave_v3,786.7,237.29,0.0
gfx942,304,57728,5120,12800,ck,0,0,10128.9421,a8w8_blockscale_1x128x128_256x128x128x128_16x16_32x32_2x2_8x32x1_8x32x1_1x32x1x8_8_1x1_intrawave_v3,747.02,137.78,0.0
gfx942,304,57856,5120,4096,ck,0,0,2852.7656,a8w8_blockscale_1x128x128_256x128x128x128_16x16_32x32_2x2_8x32x1_8x32x1_1x32x1x8_8_1x1_intrawave_v3,850.63,298.09,0.0
gfx942,304,57856,5120,5120,ck,0,0,3763.1217,a8w8_blockscale_1x128x128_256x128x128x128_16x16_32x32_2x2_8x32x1_8x32x1_1x32x1x8_8_1x1_intrawave_v3,806.06,243.12,0.0
gfx942,304,57856,5120,12800,ck,0,0,10125.1718,a8w8_blockscale_1x128x128_256x128x128x128_16x16_32x32_2x2_8x32x1_8x32x1_1x32x1x8_8_1x1_intrawave_v3,748.96,138.12,0.0
gfx942,304,57984,5120,4096,ck,0,0,2928.9438,a8w8_blockscale_1x128x128_256x128x128x128_16x16_32x32_2x2_8x32x1_8x32x1_1x32x1x8_8_1x1_intrawave_v3,830.34,290.97,0.0
gfx942,304,57984,5120,5120,ck,0,0,3799.0744,a8w8_blockscale_1x128x128_256x128x128x128_16x16_32x32_2x2_8x32x1_8x32x1_1x32x1x8_8_1x1_intrawave_v3,800.2,241.33,0.0
gfx942,304,57984,5120,12800,ck,0,0,10235.7212,a8w8_blockscale_1x128x128_256x128x128x128_16x16_32x32_2x2_8x32x1_8x32x1_1x32x1x8_8_1x1_intrawave_v3,742.51,136.92,0.0
gfx942,304,58112,5120,4096,ck,0,0,2896.0566,a8w8_blockscale_1x128x128_256x128x128x128_16x16_32x32_2x2_8x32x1_8x32x1_1x32x1x8_8_1x1_intrawave_v3,841.63,294.91,0.0
gfx942,304,58112,5120,5120,ck,0,0,3801.6999,a8w8_blockscale_1x128x128_256x128x128x128_16x16_32x32_2x2_8x32x1_8x32x1_1x32x1x8_8_1x1_intrawave_v3,801.42,241.69,0.0
gfx942,304,58112,5120,12800,ck,0,0,10181.0399,a8w8_blockscale_1x128x128_256x128x128x128_16x16_32x32_2x2_8x32x1_8x32x1_1x32x1x8_8_1x1_intrawave_v3,748.14,137.95,0.0
gfx942,304,58240,5120,4096,ck,0,0,2914.3342,a8w8_blockscale_1x128x128_256x128x128x128_16x16_32x32_2x2_8x32x1_8x32x1_1x32x1x8_8_1x1_intrawave_v3,838.19,293.69,0.0
gfx942,304,58240,5120,5120,ck,0,0,3791.7423,a8w8_blockscale_1x128x128_256x128x128x128_16x16_32x32_2x2_8x32x1_8x32x1_1x32x1x8_8_1x1_intrawave_v3,805.29,242.84,0.0
gfx942,304,58240,5120,12800,ck,0,0,10156.6493,a8w8_blockscale_1x128x128_256x128x128x128_16x16_32x32_2x2_8x32x1_8x32x1_1x32x1x8_8_1x1_intrawave_v3,751.59,138.57,0.0
gfx942,304,58368,5120,4096,ck,0,0,2862.9015,a8w8_blockscale_1x128x128_256x128x128x128_16x16_32x32_2x2_8x32x1_8x32x1_1x32x1x8_8_1x1_intrawave_v3,855.12,299.6,0.0
gfx942,304,58368,5120,5120,ck,0,0,3822.7436,a8w8_blockscale_1x128x128_256x128x128x128_16x16_32x32_2x2_8x32x1_8x32x1_1x32x1x8_8_1x1_intrawave_v3,800.52,241.38,0.0
gfx942,304,58368,5120,12800,ck,0,0,10453.0655,a8w8_blockscale_1x128x128_256x128x128x128_16x16_32x32_2x2_8x32x1_8x32x1_1x32x1x8_8_1x1_intrawave_v3,731.88,134.92,0.0
gfx942,304,58496,5120,4096,ck,0,0,2865.7959,a8w8_blockscale_1x128x128_256x128x128x128_16x16_32x32_2x2_8x32x1_8x32x1_1x32x1x8_8_1x1_intrawave_v3,856.13,299.94,0.0
gfx942,304,58496,5120,5120,ck,0,0,3853.1034,a8w8_blockscale_1x128x128_256x128x128x128_16x16_32x32_2x2_8x32x1_8x32x1_1x32x1x8_8_1x1_intrawave_v3,795.95,239.99,0.0
gfx942,304,58496,5120,12800,ck,0,0,10281.6072,a8w8_blockscale_1x128x128_256x128x128x128_16x16_32x32_2x2_8x32x1_8x32x1_1x32x1x8_8_1x1_intrawave_v3,745.72,137.46,0.0
gfx942,304,58624,5120,4096,ck,0,0,2993.0285,a8w8_blockscale_1x128x128_256x128x128x128_16x16_32x32_2x2_8x32x1_8x32x1_1x32x1x8_8_1x1_intrawave_v3,821.53,287.8,0.0
gfx942,304,58624,5120,5120,ck,0,0,3855.9937,a8w8_blockscale_1x128x128_256x128x128x128_16x16_32x32_2x2_8x32x1_8x32x1_1x32x1x8_8_1x1_intrawave_v3,797.09,240.32,0.0
gfx942,304,58624,5120,12800,ck,0,0,10516.6066,a8w8_blockscale_1x128x128_256x128x128x128_16x16_32x32_2x2_8x32x1_8x32x1_1x32x1x8_8_1x1_intrawave_v3,730.65,134.67,0.0
gfx942,304,58752,5120,4096,ck,0,0,2913.0264,a8w8_blockscale_1x128x128_256x128x128x128_16x16_32x32_2x2_8x32x1_8x32x1_1x32x1x8_8_1x1_intrawave_v3,845.94,296.34,0.0
gfx942,304,58752,5120,5120,ck,0,0,3821.1245,a8w8_blockscale_1x128x128_256x128x128x128_16x16_32x32_2x2_8x32x1_8x32x1_1x32x1x8_8_1x1_intrawave_v3,806.12,243.03,0.0
gfx942,304,58752,5120,12800,ck,0,0,10219.4522,a8w8_blockscale_1x128x128_256x128x128x128_16x16_32x32_2x2_8x32x1_8x32x1_1x32x1x8_8_1x1_intrawave_v3,753.54,138.87,0.0
gfx942,304,58880,5120,4096,ck,0,0,2968.1976,a8w8_blockscale_1x128x128_256x128x128x128_16x16_32x32_2x2_8x32x1_8x32x1_1x32x1x8_8_1x1_intrawave_v3,832.02,291.45,0.0
gfx942,304,58880,5120,5120,ck,0,0,3830.5419,a8w8_blockscale_1x128x128_256x128x128x128_16x16_32x32_2x2_8x32x1_8x32x1_1x32x1x8_8_1x1_intrawave_v3,805.89,242.95,0.0
gfx942,304,58880,5120,12800,ck,0,0,10258.2367,a8w8_blockscale_1x128x128_256x128x128x128_16x16_32x32_2x2_8x32x1_8x32x1_1x32x1x8_8_1x1_intrawave_v3,752.32,138.63,0.0
gfx942,304,59008,5120,4096,ck,0,0,2978.0385,a8w8_blockscale_1x128x128_256x128x128x128_16x16_32x32_2x2_8x32x1_8x32x1_1x32x1x8_8_1x1_intrawave_v3,831.08,291.1,0.0
gfx942,304,59008,5120,5120,ck,0,0,3864.5591,a8w8_blockscale_1x128x128_256x128x128x128_16x16_32x32_2x2_8x32x1_8x32x1_1x32x1x8_8_1x1_intrawave_v3,800.54,241.32,0.0
gfx942,304,59008,5120,12800,ck,0,0,10559.2386,a8w8_blockscale_1x128x128_256x128x128x128_16x16_32x32_2x2_8x32x1_8x32x1_1x32x1x8_8_1x1_intrawave_v3,732.47,134.96,0.0
gfx942,304,59136,5120,4096,ck,0,0,2991.7615,a8w8_blockscale_1x128x128_256x128x128x128_16x16_32x32_2x2_8x32x1_8x32x1_1x32x1x8_8_1x1_intrawave_v3,829.06,290.38,0.0
gfx942,304,59136,5120,5120,ck,0,0,3931.1103,a8w8_blockscale_1x128x128_256x128x128x128_16x16_32x32_2x2_8x32x1_8x32x1_1x32x1x8_8_1x1_intrawave_v3,788.69,237.73,0.0
gfx942,304,59136,5120,12800,ck,0,0,10399.5486,a8w8_blockscale_1x128x128_256x128x128x128_16x16_32x32_2x2_8x32x1_8x32x1_1x32x1x8_8_1x1_intrawave_v3,745.33,137.32,0.0
gfx942,304,59264,5120,4096,ck,0,0,2988.2494,a8w8_blockscale_1x128x128_256x128x128x128_16x16_32x32_2x2_8x32x1_8x32x1_1x32x1x8_8_1x1_intrawave_v3,831.83,291.33,0.0
gfx942,304,59264,5120,5120,ck,0,0,3945.7525,a8w8_blockscale_1x128x128_256x128x128x128_16x16_32x32_2x2_8x32x1_8x32x1_1x32x1x8_8_1x1_intrawave_v3,787.46,237.35,0.0
gfx942,304,59264,5120,12800,ck,0,0,10386.902,a8w8_blockscale_1x128x128_256x128x128x128_16x16_32x32_2x2_8x32x1_8x32x1_1x32x1x8_8_1x1_intrawave_v3,747.85,137.77,0.0
gfx942,304,59392,5120,4096,ck,0,0,2962.9247,a8w8_blockscale_1x128x128_256x128x128x128_16x16_32x32_2x2_8x32x1_8x32x1_1x32x1x8_8_1x1_intrawave_v3,840.75,294.44,0.0
gfx942,304,59392,5120,5120,ck,0,0,3905.5802,a8w8_blockscale_1x128x128_256x128x128x128_16x16_32x32_2x2_8x32x1_8x32x1_1x32x1x8_8_1x1_intrawave_v3,797.28,240.29,0.0
gfx942,304,59392,5120,12800,ck,0,0,10303.3068,a8w8_blockscale_1x128x128_256x128x128x128_16x16_32x32_2x2_8x32x1_8x32x1_1x32x1x8_8_1x1_intrawave_v3,755.55,139.17,0.0
gfx942,304,59520,5120,4096,ck,0,0,2919.5735,a8w8_blockscale_1x128x128_256x128x128x128_16x16_32x32_2x2_8x32x1_8x32x1_1x32x1x8_8_1x1_intrawave_v3,855.07,299.44,0.0
gfx942,304,59520,5120,5120,ck,0,0,3876.7248,a8w8_blockscale_1x128x128_256x128x128x128_16x16_32x32_2x2_8x32x1_8x32x1_1x32x1x8_8_1x1_intrawave_v3,804.95,242.59,0.0
gfx942,304,59520,5120,12800,ck,0,0,10283.3338,a8w8_blockscale_1x128x128_256x128x128x128_16x16_32x32_2x2_8x32x1_8x32x1_1x32x1x8_8_1x1_intrawave_v3,758.65,139.73,0.0
gfx942,304,59648,5120,4096,ck,0,0,3016.5244,a8w8_blockscale_1x128x128_256x128x128x128_16x16_32x32_2x2_8x32x1_8x32x1_1x32x1x8_8_1x1_intrawave_v3,829.37,290.43,0.0
gfx942,304,59648,5120,5120,ck,0,0,3880.3089,a8w8_blockscale_1x128x128_256x128x128x128_16x16_32x32_2x2_8x32x1_8x32x1_1x32x1x8_8_1x1_intrawave_v3,805.93,242.87,0.0
gfx942,304,59648,5120,12800,ck,0,0,10363.6158,a8w8_blockscale_1x128x128_256x128x128x128_16x16_32x32_2x2_8x32x1_8x32x1_1x32x1x8_8_1x1_intrawave_v3,754.39,138.93,0.0
gfx942,304,59776,5120,4096,ck,0,0,3029.4296,a8w8_blockscale_1x128x128_256x128x128x128_16x16_32x32_2x2_8x32x1_8x32x1_1x32x1x8_8_1x1_intrawave_v3,827.61,289.8,0.0
gfx942,304,59776,5120,5120,ck,0,0,3899.5928,a8w8_blockscale_1x128x128_256x128x128x128_16x16_32x32_2x2_8x32x1_8x32x1_1x32x1x8_8_1x1_intrawave_v3,803.67,242.17,0.0
gfx942,304,59776,5120,12800,ck,0,0,10461.583,a8w8_blockscale_1x128x128_256x128x128x128_16x16_32x32_2x2_8x32x1_8x32x1_1x32x1x8_8_1x1_intrawave_v3,748.93,137.91,0.0
gfx942,304,59904,5120,4096,ck,0,0,2970.7811,a8w8_blockscale_1x128x128_256x128x128x128_16x16_32x32_2x2_8x32x1_8x32x1_1x32x1x8_8_1x1_intrawave_v3,845.76,296.14,0.0
gfx942,304,59904,5120,5120,ck,0,0,3848.5782,a8w8_blockscale_1x128x128_256x128x128x128_16x16_32x32_2x2_8x32x1_8x32x1_1x32x1x8_8_1x1_intrawave_v3,816.07,245.89,0.0
gfx942,304,59904,5120,12800,ck,0,0,10266.5883,a8w8_blockscale_1x128x128_256x128x128x128_16x16_32x32_2x2_8x32x1_8x32x1_1x32x1x8_8_1x1_intrawave_v3,764.79,140.82,0.0
gfx942,304,60032,5120,4096,ck,0,0,2977.3328,a8w8_blockscale_1x128x128_256x128x128x128_16x16_32x32_2x2_8x32x1_8x32x1_1x32x1x8_8_1x1_intrawave_v3,845.7,296.1,0.0
gfx942,304,60032,5120,5120,ck,0,0,3867.7676,a8w8_blockscale_1x128x128_256x128x128x128_16x16_32x32_2x2_8x32x1_8x32x1_1x32x1x8_8_1x1_intrawave_v3,813.75,245.18,0.0
gfx942,304,60032,5120,12800,ck,0,0,10307.3252,a8w8_blockscale_1x128x128_256x128x128x128_16x16_32x32_2x2_8x32x1_8x32x1_1x32x1x8_8_1x1_intrawave_v3,763.39,140.55,0.0
gfx942,304,60160,5120,4096,ck,0,0,2981.2586,a8w8_blockscale_1x128x128_256x128x128x128_16x16_32x32_2x2_8x32x1_8x32x1_1x32x1x8_8_1x1_intrawave_v3,846.39,296.33,0.0
gfx942,304,60160,5120,5120,ck,0,0,3914.3814,a8w8_blockscale_1x128x128_256x128x128x128_16x16_32x32_2x2_8x32x1_8x32x1_1x32x1x8_8_1x1_intrawave_v3,805.78,242.76,0.0
gfx942,304,60160,5120,12800,ck,0,0,10311.6713,a8w8_blockscale_1x128x128_256x128x128x128_16x16_32x32_2x2_8x32x1_8x32x1_1x32x1x8_8_1x1_intrawave_v3,764.7,140.77,0.0
gfx942,304,60288,5120,4096,ck,0,0,2981.0326,a8w8_blockscale_1x128x128_256x128x128x128_16x16_32x32_2x2_8x32x1_8x32x1_1x32x1x8_8_1x1_intrawave_v3,848.25,296.96,0.0
gfx942,304,60288,5120,5120,ck,0,0,3967.1322,a8w8_blockscale_1x128x128_256x128x128x128_16x16_32x32_2x2_8x32x1_8x32x1_1x32x1x8_8_1x1_intrawave_v3,796.75,240.03,0.0
gfx942,304,60288,5120,12800,ck,0,0,10480.1209,a8w8_blockscale_1x128x128_256x128x128x128_16x16_32x32_2x2_8x32x1_8x32x1_1x32x1x8_8_1x1_intrawave_v3,754.01,138.79,0.0
gfx942,304,60416,5120,4096,ck,0,0,3074.2062,a8w8_blockscale_1x128x128_256x128x128x128_16x16_32x32_2x2_8x32x1_8x32x1_1x32x1x8_8_1x1_intrawave_v3,824.29,288.56,0.0
gfx942,304,60416,5120,5120,ck,0,0,3877.6422,a8w8_blockscale_1x128x128_256x128x128x128_16x16_32x32_2x2_8x32x1_8x32x1_1x32x1x8_8_1x1_intrawave_v3,816.87,246.08,0.0
gfx942,304,60416,5120,12800,ck,0,0,10558.4585,a8w8_blockscale_1x128x128_256x128x128x128_16x16_32x32_2x2_8x32x1_8x32x1_1x32x1x8_8_1x1_intrawave_v3,750.0,138.04,0.0
gfx942,304,60544,5120,4096,ck,0,0,3007.9691,a8w8_blockscale_1x128x128_256x128x128x128_16x16_32x32_2x2_8x32x1_8x32x1_1x32x1x8_8_1x1_intrawave_v3,844.22,295.53,0.0
gfx942,304,60544,5120,5120,ck,0,0,3971.5977,a8w8_blockscale_1x128x128_256x128x128x128_16x16_32x32_2x2_8x32x1_8x32x1_1x32x1x8_8_1x1_intrawave_v3,799.24,240.75,0.0
