aiter/configs/model_configs/a8w8_blockscale_tuned_gemm_qwen36_27b_tp2.csv
gfx,cu_num,M,N,K,libtype,kernelId,splitK,us,kernelName,tflops,bw,errRatio
gfx942,304,16,5120,3072,ck,8,0,11.7513,a8w8_blockscale_1x128x128_256x16x64x256_16x16_16x16_1x1_16x16x1_16x16x1_1x16x1x16_4_1x1_intrawave_v1,42.83,1356.58,0.0
gfx942,304,16,5120,8704,ck,8,0,28.8396,a8w8_blockscale_1x128x128_256x16x64x256_16x16_16x16_1x1_16x16x1_16x16x1_1x16x1x16_4_1x1_intrawave_v1,49.45,1555.76,0.0
gfx942,304,32,5120,3072,ck,8,0,11.6798,a8w8_blockscale_1x128x128_256x16x64x256_16x16_16x16_1x1_16x16x1_16x16x1_1x16x1x16_4_1x1_intrawave_v1,86.19,1383.13,0.0
gfx942,304,32,5120,8704,ck,8,0,29.1622,a8w8_blockscale_1x128x128_256x16x64x256_16x16_16x16_1x1_16x16x1_16x16x1_1x16x1x16_4_1x1_intrawave_v1,97.8,1548.95,0.0
gfx942,304,48,5120,3072,ck,8,0,11.7135,a8w8_blockscale_1x128x128_256x16x64x256_16x16_16x16_1x1_16x16x1_16x16x1_1x16x1x16_4_1x1_intrawave_v1,128.91,1397.33,0.0
gfx942,304,48,5120,8704,ck,8,0,30.5498,a8w8_blockscale_1x128x128_256x16x64x256_16x16_16x16_1x1_16x16x1_16x16x1_1x16x1x16_4_1x1_intrawave_v1,140.04,1488.51,0.0
gfx942,304,64,5120,3072,ck,13,0,14.8882,a8w8_blockscale_1x128x128_256x32x64x256_16x16_16x16_2x1_16x16x1_16x16x1_1x32x1x8_8_2x1_intrawave_v1,135.23,1113.67,0.0
gfx942,304,64,5120,8704,ck,18,0,36.2581,a8w8_blockscale_1x128x128_256x64x64x256_16x16_32x32_1x1_16x16x1_16x16x1_1x32x1x8_8_1x1_intrawave_v1,157.32,1262.53,0.0
gfx942,304,80,5120,3072,ck,13,0,15.1636,a8w8_blockscale_1x128x128_256x32x64x256_16x16_16x16_2x1_16x16x1_16x16x1_1x32x1x8_8_2x1_intrawave_v1,165.96,1107.49,0.0
gfx942,304,80,5120,8704,ck,13,0,40.0102,a8w8_blockscale_1x128x128_256x32x64x256_16x16_16x16_2x1_16x16x1_16x16x1_1x32x1x8_8_2x1_intrawave_v1,178.21,1151.71,0.0
gfx942,304,96,5120,3072,ck,13,0,14.9291,a8w8_blockscale_1x128x128_256x32x64x256_16x16_16x16_2x1_16x16x1_16x16x1_1x32x1x8_8_2x1_intrawave_v1,202.28,1139.16,0.0
gfx942,304,96,5120,8704,ck,13,0,39.8941,a8w8_blockscale_1x128x128_256x32x64x256_16x16_16x16_2x1_16x16x1_16x16x1_1x32x1x8_8_2x1_intrawave_v1,214.48,1162.66,0.0
gfx942,304,112,5120,3072,ck,18,0,15.9311,a8w8_blockscale_1x128x128_256x64x64x256_16x16_32x32_1x1_16x16x1_16x16x1_1x32x1x8_8_1x1_intrawave_v1,221.15,1080.88,0.0
gfx942,304,112,5120,8704,ck,18,0,43.9761,a8w8_blockscale_1x128x128_256x64x64x256_16x16_32x32_1x1_16x16x1_16x16x1_1x32x1x8_8_1x1_intrawave_v1,227.0,1061.63,0.0
gfx942,304,128,5120,3072,ck,18,0,15.6645,a8w8_blockscale_1x128x128_256x64x64x256_16x16_32x32_1x1_16x16x1_16x16x1_1x32x1x8_8_1x1_intrawave_v1,257.05,1112.87,0.0
gfx942,304,128,5120,8704,ck,18,0,39.1285,a8w8_blockscale_1x128x128_256x64x64x256_16x16_32x32_1x1_16x16x1_16x16x1_1x32x1x8_8_1x1_intrawave_v1,291.57,1200.9,0.0
gfx942,304,144,5120,3072,ck,18,0,19.5002,a8w8_blockscale_1x128x128_256x64x64x256_16x16_32x32_1x1_16x16x1_16x16x1_1x32x1x8_8_1x1_intrawave_v1,232.3,904.89,0.0
gfx942,304,144,5120,8704,ck,18,0,50.0851,a8w8_blockscale_1x128x128_256x64x64x256_16x16_32x32_1x1_16x16x1_16x16x1_1x32x1x8_8_1x1_intrawave_v1,256.26,944.24,0.0
gfx942,304,160,5120,3072,ck,18,0,19.8236,a8w8_blockscale_1x128x128_256x64x64x256_16x16_32x32_1x1_16x16x1_16x16x1_1x32x1x8_8_1x1_intrawave_v1,253.9,900.87,0.0
gfx942,304,160,5120,8704,ck,18,0,52.5029,a8w8_blockscale_1x128x128_256x64x64x256_16x16_32x32_1x1_16x16x1_16x16x1_1x32x1x8_8_1x1_intrawave_v1,271.62,906.53,0.0
gfx942,304,176,5120,3072,ck,18,0,21.2602,a8w8_blockscale_1x128x128_256x64x64x256_16x16_32x32_1x1_16x16x1_16x16x1_1x32x1x8_8_1x1_intrawave_v1,260.42,850.02,0.0
gfx942,304,176,5120,8704,ck,18,0,51.8451,a8w8_blockscale_1x128x128_256x64x64x256_16x16_32x32_1x1_16x16x1_16x16x1_1x32x1x8_8_1x1_intrawave_v1,302.57,923.88,0.0
gfx942,304,192,5120,3072,ck,18,0,19.0729,a8w8_blockscale_1x128x128_256x64x64x256_16x16_32x32_1x1_16x16x1_16x16x1_1x32x1x8_8_1x1_intrawave_v1,316.67,958.67,0.0
gfx942,304,192,5120,8704,ck,18,0,48.6315,a8w8_blockscale_1x128x128_256x64x64x256_16x16_32x32_1x1_16x16x1_16x16x1_1x32x1x8_8_1x1_intrawave_v1,351.89,991.16,0.0
gfx942,304,208,5120,3072,ck,12,0,24.6839,a8w8_blockscale_1x128x128_256x32x128x256_16x16_32x32_1x1_16x16x1_16x16x1_1x32x1x8_8_1x1_intrawave_v1,265.08,749.38,0.0
gfx942,304,208,5120,8704,ck,3,0,61.1199,a8w8_blockscale_1x128x128_256x64x64x128_16x16_32x32_1x1_8x32x1_8x32x1_1x32x1x8_8_1x1_intrawave_v3,303.32,793.6,0.0
gfx942,304,224,5120,3072,ck,12,0,23.4373,a8w8_blockscale_1x128x128_256x32x128x256_16x16_32x32_1x1_16x16x1_16x16x1_1x32x1x8_8_1x1_intrawave_v1,300.65,798.32,0.0
gfx942,304,224,5120,8704,ck,12,0,60.275,a8w8_blockscale_1x128x128_256x32x128x256_16x16_32x32_1x1_16x16x1_16x16x1_1x32x1x8_8_1x1_intrawave_v1,331.23,809.75,0.0
gfx942,304,240,5120,3072,ck,3,0,25.804,a8w8_blockscale_1x128x128_256x64x64x128_16x16_32x32_1x1_8x32x1_8x32x1_1x32x1x8_8_1x1_intrawave_v3,292.58,733.36,0.0
gfx942,304,240,5120,8704,ck,3,0,61.9273,a8w8_blockscale_1x128x128_256x64x64x128_16x16_32x32_1x1_8x32x1_8x32x1_1x32x1x8_8_1x1_intrawave_v3,345.42,793.04,0.0
gfx942,304,256,5120,3072,ck,3,0,25.5844,a8w8_blockscale_1x128x128_256x64x64x128_16x16_32x32_1x1_8x32x1_8x32x1_1x32x1x8_8_1x1_intrawave_v3,314.76,747.98,0.0
gfx942,304,256,5120,8704,ck,3,0,63.066,a8w8_blockscale_1x128x128_256x64x64x128_16x16_32x32_1x1_8x32x1_8x32x1_1x32x1x8_8_1x1_intrawave_v3,361.8,783.53,0.0
gfx942,304,288,5120,3072,ck,2,0,28.3699,a8w8_blockscale_1x128x128_256x64x128x128_16x16_32x32_1x2_8x32x1_8x32x1_1x32x1x8_8_1x1_intrawave_v3,319.34,689.55,0.0
gfx942,304,288,5120,8704,ck,3,0,70.4269,a8w8_blockscale_1x128x128_256x64x64x128_16x16_32x32_1x1_8x32x1_8x32x1_1x32x1x8_8_1x1_intrawave_v3,364.48,710.24,0.0
gfx942,304,320,5120,3072,ck,2,0,30.7371,a8w8_blockscale_1x128x128_256x64x128x128_16x16_32x32_1x2_8x32x1_8x32x1_1x32x1x8_8_1x1_intrawave_v3,327.5,650.3,0.0
gfx942,304,320,5120,8704,ck,3,0,77.8832,a8w8_blockscale_1x128x128_256x64x64x128_16x16_32x32_1x1_8x32x1_8x32x1_1x32x1x8_8_1x1_intrawave_v3,366.21,650.03,0.0
gfx942,304,352,5120,3072,ck,2,0,30.4874,a8w8_blockscale_1x128x128_256x64x128x128_16x16_32x32_1x2_8x32x1_8x32x1_1x32x1x8_8_1x1_intrawave_v3,363.2,669.6,0.0
gfx942,304,352,5120,8704,ck,2,0,75.5116,a8w8_blockscale_1x128x128_256x64x128x128_16x16_32x32_1x2_8x32x1_8x32x1_1x32x1x8_8_1x1_intrawave_v3,415.48,678.48,0.0
gfx942,304,384,5120,3072,ck,18,0,33.3358,a8w8_blockscale_1x128x128_256x64x64x256_16x16_32x32_1x1_16x16x1_16x16x1_1x32x1x8_8_1x1_intrawave_v1,362.36,625.17,0.0
gfx942,304,384,5120,8704,ck,3,0,83.3775,a8w8_blockscale_1x128x128_256x64x64x128_16x16_32x32_1x1_8x32x1_8x32x1_1x32x1x8_8_1x1_intrawave_v3,410.49,621.74,0.0
gfx942,304,416,5120,3072,ck,2,0,32.4971,a8w8_blockscale_1x128x128_256x64x128x128_16x16_32x32_1x2_8x32x1_8x32x1_1x32x1x8_8_1x1_intrawave_v3,402.69,654.41,0.0
gfx942,304,416,5120,8704,ck,3,0,76.6739,a8w8_blockscale_1x128x128_256x64x64x128_16x16_32x32_1x1_8x32x1_8x32x1_1x32x1x8_8_1x1_intrawave_v3,483.58,684.0,0.0
gfx942,304,448,5120,3072,ck,2,0,34.1522,a8w8_blockscale_1x128x128_256x64x128x128_16x16_32x32_1x2_8x32x1_8x32x1_1x32x1x8_8_1x1_intrawave_v3,412.65,635.17,0.0
gfx942,304,448,5120,8704,ck,3,0,78.4129,a8w8_blockscale_1x128x128_256x64x64x128_16x16_32x32_1x1_8x32x1_8x32x1_1x32x1x8_8_1x1_intrawave_v3,509.22,676.56,0.0
gfx942,304,480,5120,3072,ck,0,0,41.5333,a8w8_blockscale_1x128x128_256x128x128x128_16x16_32x32_2x2_8x32x1_8x32x1_1x32x1x8_8_1x1_intrawave_v3,363.55,532.55,0.0
gfx942,304,480,5120,8704,ck,0,0,102.7973,a8w8_blockscale_1x128x128_256x128x128x128_16x16_32x32_2x2_8x32x1_8x32x1_1x32x1x8_8_1x1_intrawave_v3,416.18,521.97,0.0
gfx942,304,512,5120,3072,ck,2,0,43.9061,a8w8_blockscale_1x128x128_256x64x128x128_16x16_32x32_1x2_8x32x1_8x32x1_1x32x1x8_8_1x1_intrawave_v3,366.83,513.47,0.0
gfx942,304,512,5120,8704,ck,1,0,108.8021,a8w8_blockscale_1x128x128_256x128x64x128_16x16_32x32_2x1_8x32x1_8x32x1_1x32x1x8_8_1x1_intrawave_v3,419.42,498.74,0.0
gfx942,304,544,5120,3072,ck,0,0,41.3147,a8w8_blockscale_1x128x128_256x128x128x128_16x16_32x32_2x2_8x32x1_8x32x1_1x32x1x8_8_1x1_intrawave_v3,414.21,555.99,0.0
gfx942,304,544,5120,8704,ck,0,0,103.0273,a8w8_blockscale_1x128x128_256x128x128x128_16x16_32x32_2x2_8x32x1_8x32x1_1x32x1x8_8_1x1_intrawave_v3,470.61,532.58,0.0
gfx942,304,576,5120,3072,ck,0,0,41.8881,a8w8_blockscale_1x128x128_256x128x128x128_16x16_32x32_2x2_8x32x1_8x32x1_1x32x1x8_8_1x1_intrawave_v3,432.57,558.54,0.0
gfx942,304,576,5120,8704,ck,0,0,104.3784,a8w8_blockscale_1x128x128_256x128x128x128_16x16_32x32_2x2_8x32x1_8x32x1_1x32x1x8_8_1x1_intrawave_v3,491.85,531.49,0.0
gfx942,304,608,5120,3072,ck,0,0,44.3921,a8w8_blockscale_1x128x128_256x128x128x128_16x16_32x32_2x2_8x32x1_8x32x1_1x32x1x8_8_1x1_intrawave_v3,430.84,536.63,0.0
gfx942,304,608,5120,8704,ck,0,0,111.889,a8w8_blockscale_1x128x128_256x128x128x128_16x16_32x32_2x2_8x32x1_8x32x1_1x32x1x8_8_1x1_intrawave_v3,484.32,501.23,0.0
gfx942,304,640,5120,3072,ck,0,0,47.4328,a8w8_blockscale_1x128x128_256x128x128x128_16x16_32x32_2x2_8x32x1_8x32x1_1x32x1x8_8_1x1_intrawave_v3,424.45,511.21,0.0
gfx942,304,640,5120,8704,ck,3,0,113.2757,a8w8_blockscale_1x128x128_256x64x64x128_16x16_32x32_1x1_8x32x1_8x32x1_1x32x1x8_8_1x1_intrawave_v3,503.57,500.45,0.0
gfx942,304,672,5120,3072,ck,0,0,43.2014,a8w8_blockscale_1x128x128_256x128x128x128_16x16_32x32_2x2_8x32x1_8x32x1_1x32x1x8_8_1x1_intrawave_v3,489.32,571.15,0.0
gfx942,304,672,5120,8704,ck,0,0,106.1661,a8w8_blockscale_1x128x128_256x128x128x128_16x16_32x32_2x2_8x32x1_8x32x1_1x32x1x8_8_1x1_intrawave_v3,564.16,539.67,0.0
gfx942,304,704,5120,3072,ck,0,0,45.4347,a8w8_blockscale_1x128x128_256x128x128x128_16x16_32x32_2x2_8x32x1_8x32x1_1x32x1x8_8_1x1_intrawave_v3,487.42,552.45,0.0
gfx942,304,704,5120,8704,ck,0,0,109.3432,a8w8_blockscale_1x128x128_256x128x128x128_16x16_32x32_2x2_8x32x1_8x32x1_1x32x1x8_8_1x1_intrawave_v3,573.85,529.54,0.0
gfx942,304,736,5120,3072,ck,0,0,46.1373,a8w8_blockscale_1x128x128_256x128x128x128_16x16_32x32_2x2_8x32x1_8x32x1_1x32x1x8_8_1x1_intrawave_v3,501.82,553.27,0.0
gfx942,304,736,5120,8704,ck,0,0,112.6531,a8w8_blockscale_1x128x128_256x128x128x128_16x16_32x32_2x2_8x32x1_8x32x1_1x32x1x8_8_1x1_intrawave_v3,582.31,519.36,0.0
gfx942,304,768,5120,3072,ck,2,0,48.7952,a8w8_blockscale_1x128x128_256x64x128x128_16x16_32x32_1x2_8x32x1_8x32x1_1x32x1x8_8_1x1_intrawave_v3,495.11,531.86,0.0
gfx942,304,768,5120,8704,ck,0,0,121.9892,a8w8_blockscale_1x128x128_256x128x128x128_16x16_32x32_2x2_8x32x1_8x32x1_1x32x1x8_8_1x1_intrawave_v3,561.12,484.58,0.0
gfx942,304,800,5120,3072,ck,0,0,47.0114,a8w8_blockscale_1x128x128_256x128x128x128_16x16_32x32_2x2_8x32x1_8x32x1_1x32x1x8_8_1x1_intrawave_v3,535.31,561.1,0.0
gfx942,304,800,5120,8704,ck,0,0,110.9452,a8w8_blockscale_1x128x128_256x128x128x128_16x16_32x32_2x2_8x32x1_8x32x1_1x32x1x8_8_1x1_intrawave_v3,642.69,538.28,0.0
gfx942,304,832,5120,3072,ck,0,0,47.0662,a8w8_blockscale_1x128x128_256x128x128x128_16x16_32x32_2x2_8x32x1_8x32x1_1x32x1x8_8_1x1_intrawave_v3,556.08,569.5,0.0
gfx942,304,832,5120,8704,ck,0,0,113.0672,a8w8_blockscale_1x128x128_256x128x128x128_16x16_32x32_2x2_8x32x1_8x32x1_1x32x1x8_8_1x1_intrawave_v3,655.85,533.54,0.0
gfx942,304,864,5120,3072,ck,0,0,49.3989,a8w8_blockscale_1x128x128_256x128x128x128_16x16_32x32_2x2_8x32x1_8x32x1_1x32x1x8_8_1x1_intrawave_v3,550.2,551.23,0.0
gfx942,304,864,5120,8704,ck,0,0,116.8101,a8w8_blockscale_1x128x128_256x128x128x128_16x16_32x32_2x2_8x32x1_8x32x1_1x32x1x8_8_1x1_intrawave_v3,659.25,521.63,0.0
gfx942,304,896,5120,3072,ck,0,0,51.2561,a8w8_blockscale_1x128x128_256x128x128x128_16x16_32x32_2x2_8x32x1_8x32x1_1x32x1x8_8_1x1_intrawave_v3,549.9,539.57,0.0
gfx942,304,896,5120,8704,ck,0,0,126.5973,a8w8_blockscale_1x128x128_256x128x128x128_16x16_32x32_2x2_8x32x1_8x32x1_1x32x1x8_8_1x1_intrawave_v3,630.82,486.09,0.0
gfx942,304,928,5120,3072,ck,2,0,57.6184,a8w8_blockscale_1x128x128_256x64x128x128_16x16_32x32_1x2_8x32x1_8x32x1_1x32x1x8_8_1x1_intrawave_v3,506.65,487.38,0.0
gfx942,304,928,5120,8704,ck,2,0,142.5819,a8w8_blockscale_1x128x128_256x64x128x128_16x16_32x32_1x2_8x32x1_8x32x1_1x32x1x8_8_1x1_intrawave_v3,580.1,435.85,0.0
gfx942,304,960,5120,3072,ck,2,0,58.7311,a8w8_blockscale_1x128x128_256x64x128x128_16x16_32x32_1x2_8x32x1_8x32x1_1x32x1x8_8_1x1_intrawave_v3,514.19,485.4,0.0
gfx942,304,960,5120,8704,ck,2,0,148.2198,a8w8_blockscale_1x128x128_256x64x128x128_16x16_32x32_1x2_8x32x1_8x32x1_1x32x1x8_8_1x1_intrawave_v3,577.28,423.36,0.0
gfx942,304,992,5120,3072,ck,0,0,62.3561,a8w8_blockscale_1x128x128_256x128x128x128_16x16_32x32_2x2_8x32x1_8x32x1_1x32x1x8_8_1x1_intrawave_v3,500.44,464.01,0.0
gfx942,304,992,5120,8704,ck,0,0,150.9271,a8w8_blockscale_1x128x128_256x128x128x128_16x16_32x32_2x2_8x32x1_8x32x1_1x32x1x8_8_1x1_intrawave_v3,585.82,419.78,0.0
gfx942,304,1024,5120,3072,ck,0,0,66.5029,a8w8_blockscale_1x128x128_256x128x128x128_16x16_32x32_2x2_8x32x1_8x32x1_1x32x1x8_8_1x1_intrawave_v3,484.37,441.49,0.0
gfx942,304,1024,5120,8704,ck,0,0,162.2238,a8w8_blockscale_1x128x128_256x128x128x128_16x16_32x32_2x2_8x32x1_8x32x1_1x32x1x8_8_1x1_intrawave_v3,562.61,394.29,0.0
gfx942,304,1088,5120,3072,ck,0,0,69.2227,a8w8_blockscale_1x128x128_256x128x128x128_16x16_32x32_2x2_8x32x1_8x32x1_1x32x1x8_8_1x1_intrawave_v3,494.43,436.45,0.0
gfx942,304,1088,5120,8704,ck,0,0,161.4594,a8w8_blockscale_1x128x128_256x128x128x128_16x16_32x32_2x2_8x32x1_8x32x1_1x32x1x8_8_1x1_intrawave_v3,600.6,403.67,0.0
gfx942,304,1152,5120,3072,ck,2,0,74.2998,a8w8_blockscale_1x128x128_256x64x128x128_16x16_32x32_1x2_8x32x1_8x32x1_1x32x1x8_8_1x1_intrawave_v3,487.74,418.09,0.0
gfx942,304,1152,5120,8704,ck,0,0,171.6629,a8w8_blockscale_1x128x128_256x128x128x128_16x16_32x32_2x2_8x32x1_8x32x1_1x32x1x8_8_1x1_intrawave_v3,598.13,386.73,0.0
gfx942,304,1216,5120,3072,ck,0,0,70.7206,a8w8_blockscale_1x128x128_256x128x128x128_16x16_32x32_2x2_8x32x1_8x32x1_1x32x1x8_8_1x1_intrawave_v3,540.89,451.3,0.0
gfx942,304,1216,5120,8704,ck,0,0,173.6113,a8w8_blockscale_1x128x128_256x128x128x128_16x16_32x32_2x2_8x32x1_8x32x1_1x32x1x8_8_1x1_intrawave_v3,624.27,389.38,0.0
gfx942,304,1280,5120,3072,ck,0,0,74.3002,a8w8_blockscale_1x128x128_256x128x128x128_16x16_32x32_2x2_8x32x1_8x32x1_1x32x1x8_8_1x1_intrawave_v3,541.93,441.02,0.0
gfx942,304,1280,5120,8704,ck,0,0,171.8147,a8w8_blockscale_1x128x128_256x128x128x128_16x16_32x32_2x2_8x32x1_8x32x1_1x32x1x8_8_1x1_intrawave_v3,664.0,400.51,0.0
gfx942,304,1344,5120,3072,ck,0,0,73.7584,a8w8_blockscale_1x128x128_256x128x128x128_16x16_32x32_2x2_8x32x1_8x32x1_1x32x1x8_8_1x1_intrawave_v3,573.2,455.81,0.0
gfx942,304,1344,5120,8704,ck,0,0,177.7443,a8w8_blockscale_1x128x128_256x128x128x128_16x16_32x32_2x2_8x32x1_8x32x1_1x32x1x8_8_1x1_intrawave_v3,673.94,393.97,0.0
gfx942,304,1408,5120,3072,ck,0,0,72.5024,a8w8_blockscale_1x128x128_256x128x128x128_16x16_32x32_2x2_8x32x1_8x32x1_1x32x1x8_8_1x1_intrawave_v3,610.9,475.46,0.0
gfx942,304,1408,5120,8704,ck,0,0,179.8445,a8w8_blockscale_1x128x128_256x128x128x128_16x16_32x32_2x2_8x32x1_8x32x1_1x32x1x8_8_1x1_intrawave_v3,697.79,396.11,0.0
gfx942,304,1472,5120,3072,ck,0,0,75.2908,a8w8_blockscale_1x128x128_256x128x128x128_16x16_32x32_2x2_8x32x1_8x32x1_1x32x1x8_8_1x1_intrawave_v3,615.02,469.17,0.0
gfx942,304,1472,5120,8704,ck,0,0,181.7227,a8w8_blockscale_1x128x128_256x128x128x128_16x16_32x32_2x2_8x32x1_8x32x1_1x32x1x8_8_1x1_intrawave_v3,721.97,398.68,0.0
gfx942,304,1536,5120,3072,ck,0,0,76.1076,a8w8_blockscale_1x128x128_256x128x128x128_16x16_32x32_2x2_8x32x1_8x32x1_1x32x1x8_8_1x1_intrawave_v3,634.87,475.33,0.0
gfx942,304,1536,5120,8704,ck,0,0,185.499,a8w8_blockscale_1x128x128_256x128x128x128_16x16_32x32_2x2_8x32x1_8x32x1_1x32x1x8_8_1x1_intrawave_v3,738.02,397.1,0.0
gfx942,304,1600,5120,3072,ck,0,0,78.6304,a8w8_blockscale_1x128x128_256x128x128x128_16x16_32x32_2x2_8x32x1_8x32x1_1x32x1x8_8_1x1_intrawave_v3,640.1,470.91,0.0
gfx942,304,1600,5120,8704,ck,0,0,193.1225,a8w8_blockscale_1x128x128_256x128x128x128_16x16_32x32_2x2_8x32x1_8x32x1_1x32x1x8_8_1x1_intrawave_v3,738.42,387.71,0.0
gfx942,304,1664,5120,3072,ck,0,0,77.3842,a8w8_blockscale_1x128x128_256x128x128x128_16x16_32x32_2x2_8x32x1_8x32x1_1x32x1x8_8_1x1_intrawave_v3,676.43,489.5,0.0
gfx942,304,1664,5120,8704,ck,0,0,196.6977,a8w8_blockscale_1x128x128_256x128x128x128_16x16_32x32_2x2_8x32x1_8x32x1_1x32x1x8_8_1x1_intrawave_v3,754.0,386.82,0.0
gfx942,304,1728,5120,3072,ck,0,0,79.0658,a8w8_blockscale_1x128x128_256x128x128x128_16x16_32x32_2x2_8x32x1_8x32x1_1x32x1x8_8_1x1_intrawave_v3,687.51,489.87,0.0
gfx942,304,1728,5120,8704,ck,0,0,198.4668,a8w8_blockscale_1x128x128_256x128x128x128_16x16_32x32_2x2_8x32x1_8x32x1_1x32x1x8_8_1x1_intrawave_v3,776.02,389.48,0.0
gfx942,304,1792,5120,3072,ck,0,0,82.0526,a8w8_blockscale_1x128x128_256x128x128x128_16x16_32x32_2x2_8x32x1_8x32x1_1x32x1x8_8_1x1_intrawave_v3,687.02,482.42,0.0
gfx942,304,1792,5120,8704,ck,0,0,205.2152,a8w8_blockscale_1x128x128_256x128x128x128_16x16_32x32_2x2_8x32x1_8x32x1_1x32x1x8_8_1x1_intrawave_v3,778.3,382.58,0.0
gfx942,304,1856,5120,3072,ck,0,0,83.9952,a8w8_blockscale_1x128x128_256x128x128x128_16x16_32x32_2x2_8x32x1_8x32x1_1x32x1x8_8_1x1_intrawave_v3,695.1,481.41,0.0
gfx942,304,1856,5120,8704,ck,0,0,212.8733,a8w8_blockscale_1x128x128_256x128x128x128_16x16_32x32_2x2_8x32x1_8x32x1_1x32x1x8_8_1x1_intrawave_v3,777.1,374.52,0.0
gfx942,304,1920,5120,3072,ck,0,0,86.5137,a8w8_blockscale_1x128x128_256x128x128x128_16x16_32x32_2x2_8x32x1_8x32x1_1x32x1x8_8_1x1_intrawave_v3,698.13,477.24,0.0
gfx942,304,1920,5120,8704,ck,0,0,215.6675,a8w8_blockscale_1x128x128_256x128x128x128_16x16_32x32_2x2_8x32x1_8x32x1_1x32x1x8_8_1x1_intrawave_v3,793.48,375.29,0.0
gfx942,304,1984,5120,3072,ck,0,0,111.9266,a8w8_blockscale_1x128x128_256x128x128x128_16x16_32x32_2x2_8x32x1_8x32x1_1x32x1x8_8_1x1_intrawave_v3,557.61,376.49,0.0
gfx942,304,1984,5120,8704,ck,0,0,281.8089,a8w8_blockscale_1x128x128_256x128x128x128_16x16_32x32_2x2_8x32x1_8x32x1_1x32x1x8_8_1x1_intrawave_v3,627.49,291.51,0.0
gfx942,304,2048,5120,3072,ck,0,0,115.2687,a8w8_blockscale_1x128x128_256x128x128x128_16x16_32x32_2x2_8x32x1_8x32x1_1x32x1x8_8_1x1_intrawave_v3,558.91,372.97,0.0
gfx942,304,2048,5120,8704,ck,0,0,297.683,a8w8_blockscale_1x128x128_256x128x128x128_16x16_32x32_2x2_8x32x1_8x32x1_1x32x1x8_8_1x1_intrawave_v3,613.19,280.04,0.0
gfx942,304,2112,5120,3072,ck,0,0,110.1319,a8w8_blockscale_1x128x128_256x128x128x128_16x16_32x32_2x2_8x32x1_8x32x1_1x32x1x8_8_1x1_intrawave_v3,603.26,398.1,0.0
gfx942,304,2112,5120,8704,ck,0,0,279.3083,a8w8_blockscale_1x128x128_256x128x128x128_16x16_32x32_2x2_8x32x1_8x32x1_1x32x1x8_8_1x1_intrawave_v3,673.95,302.8,0.0
gfx942,304,2176,5120,3072,ck,0,0,110.2305,a8w8_blockscale_1x128x128_256x128x128x128_16x16_32x32_2x2_8x32x1_8x32x1_1x32x1x8_8_1x1_intrawave_v3,620.98,405.47,0.0
gfx942,304,2176,5120,8704,ck,0,0,268.9307,a8w8_blockscale_1x128x128_256x128x128x128_16x16_32x32_2x2_8x32x1_8x32x1_1x32x1x8_8_1x1_intrawave_v3,721.17,318.99,0.0
gfx942,304,2240,5120,3072,ck,0,0,107.9962,a8w8_blockscale_1x128x128_256x128x128x128_16x16_32x32_2x2_8x32x1_8x32x1_1x32x1x8_8_1x1_intrawave_v3,652.47,421.75,0.0
gfx942,304,2240,5120,8704,ck,0,0,277.7766,a8w8_blockscale_1x128x128_256x128x128x128_16x16_32x32_2x2_8x32x1_8x32x1_1x32x1x8_8_1x1_intrawave_v3,718.74,313.2,0.0
gfx942,304,2304,5120,3072,ck,0,0,111.1374,a8w8_blockscale_1x128x128_256x128x128x128_16x16_32x32_2x2_8x32x1_8x32x1_1x32x1x8_8_1x1_intrawave_v3,652.14,417.5,0.0
gfx942,304,2304,5120,8704,ck,0,0,276.3572,a8w8_blockscale_1x128x128_256x128x128x128_16x16_32x32_2x2_8x32x1_8x32x1_1x32x1x8_8_1x1_intrawave_v3,743.07,319.19,0.0
gfx942,304,2368,5120,3072,ck,0,0,113.5721,a8w8_blockscale_1x128x128_256x128x128x128_16x16_32x32_2x2_8x32x1_8x32x1_1x32x1x8_8_1x1_intrawave_v3,655.89,416.05,0.0
gfx942,304,2368,5120,8704,ck,0,0,282.273,a8w8_blockscale_1x128x128_256x128x128x128_16x16_32x32_2x2_8x32x1_8x32x1_1x32x1x8_8_1x1_intrawave_v3,747.71,316.8,0.0
gfx942,304,2432,5120,3072,ck,0,0,111.246,a8w8_blockscale_1x128x128_256x128x128x128_16x16_32x32_2x2_8x32x1_8x32x1_1x32x1x8_8_1x1_intrawave_v3,687.7,432.41,0.0
gfx942,304,2432,5120,8704,ck,0,0,287.7133,a8w8_blockscale_1x128x128_256x128x128x128_16x16_32x32_2x2_8x32x1_8x32x1_1x32x1x8_8_1x1_intrawave_v3,753.39,315.02,0.0
gfx942,304,2496,5120,3072,ck,0,0,113.9286,a8w8_blockscale_1x128x128_256x128x128x128_16x16_32x32_2x2_8x32x1_8x32x1_1x32x1x8_8_1x1_intrawave_v3,689.18,429.7,0.0
gfx942,304,2496,5120,8704,ck,0,0,291.206,a8w8_blockscale_1x128x128_256x128x128x128_16x16_32x32_2x2_8x32x1_8x32x1_1x32x1x8_8_1x1_intrawave_v3,763.95,315.41,0.0
gfx942,304,2560,5120,3072,ck,0,0,115.17,a8w8_blockscale_1x128x128_256x128x128x128_16x16_32x32_2x2_8x32x1_8x32x1_1x32x1x8_8_1x1_intrawave_v3,699.23,432.47,0.0
gfx942,304,2560,5120,8704,ck,0,0,296.6024,a8w8_blockscale_1x128x128_256x128x128x128_16x16_32x32_2x2_8x32x1_8x32x1_1x32x1x8_8_1x1_intrawave_v3,769.28,313.76,0.0
gfx942,304,2624,5120,3072,ck,0,0,117.0815,a8w8_blockscale_1x128x128_256x128x128x128_16x16_32x32_2x2_8x32x1_8x32x1_1x32x1x8_8_1x1_intrawave_v3,705.01,432.68,0.0
gfx942,304,2624,5120,8704,ck,0,0,306.1878,a8w8_blockscale_1x128x128_256x128x128x128_16x16_32x32_2x2_8x32x1_8x32x1_1x32x1x8_8_1x1_intrawave_v3,763.83,307.89,0.0
gfx942,304,2688,5120,3072,ck,0,0,120.3064,a8w8_blockscale_1x128x128_256x128x128x128_16x16_32x32_2x2_8x32x1_8x32x1_1x32x1x8_8_1x1_intrawave_v3,702.85,428.17,0.0
gfx942,304,2688,5120,8704,ck,0,0,311.0806,a8w8_blockscale_1x128x128_256x128x128x128_16x16_32x32_2x2_8x32x1_8x32x1_1x32x1x8_8_1x1_intrawave_v3,770.15,306.95,0.0
gfx942,304,2752,5120,3072,ck,0,0,120.8304,a8w8_blockscale_1x128x128_256x128x128x128_16x16_32x32_2x2_8x32x1_8x32x1_1x32x1x8_8_1x1_intrawave_v3,716.46,433.36,0.0
gfx942,304,2752,5120,8704,ck,0,0,326.4036,a8w8_blockscale_1x128x128_256x128x128x128_16x16_32x32_2x2_8x32x1_8x32x1_1x32x1x8_8_1x1_intrawave_v3,751.47,296.25,0.0
gfx942,304,2816,5120,3072,ck,0,0,120.9878,a8w8_blockscale_1x128x128_256x128x128x128_16x16_32x32_2x2_8x32x1_8x32x1_1x32x1x8_8_1x1_intrawave_v3,732.17,439.84,0.0
gfx942,304,2816,5120,8704,ck,0,0,316.5822,a8w8_blockscale_1x128x128_256x128x128x128_16x16_32x32_2x2_8x32x1_8x32x1_1x32x1x8_8_1x1_intrawave_v3,792.8,309.27,0.0
gfx942,304,2880,5120,3072,ck,0,0,137.5551,a8w8_blockscale_1x128x128_256x128x128x128_16x16_32x32_2x2_8x32x1_8x32x1_1x32x1x8_8_1x1_intrawave_v3,658.62,393.06,0.0
gfx942,304,2880,5120,8704,ck,0,0,366.7105,a8w8_blockscale_1x128x128_256x128x128x128_16x16_32x32_2x2_8x32x1_8x32x1_1x32x1x8_8_1x1_intrawave_v3,699.98,270.3,0.0
gfx942,304,2944,5120,3072,ck,0,0,139.6314,a8w8_blockscale_1x128x128_256x128x128x128_16x16_32x32_2x2_8x32x1_8x32x1_1x32x1x8_8_1x1_intrawave_v3,663.25,393.32,0.0
gfx942,304,2944,5120,8704,ck,0,0,357.7893,a8w8_blockscale_1x128x128_256x128x128x128_16x16_32x32_2x2_8x32x1_8x32x1_1x32x1x8_8_1x1_intrawave_v3,733.38,280.43,0.0
gfx942,304,3008,5120,3072,ck,0,0,138.1725,a8w8_blockscale_1x128x128_256x128x128x128_16x16_32x32_2x2_8x32x1_8x32x1_1x32x1x8_8_1x1_intrawave_v3,684.82,403.63,0.0
gfx942,304,3008,5120,8704,ck,0,0,362.5731,a8w8_blockscale_1x128x128_256x128x128x128_16x16_32x32_2x2_8x32x1_8x32x1_1x32x1x8_8_1x1_intrawave_v3,739.44,280.08,0.0
gfx942,304,3072,5120,3072,ck,0,0,140.9493,a8w8_blockscale_1x128x128_256x128x128x128_16x16_32x32_2x2_8x32x1_8x32x1_1x32x1x8_8_1x1_intrawave_v3,685.61,401.73,0.0
gfx942,304,3072,5120,8704,ck,0,0,373.2085,a8w8_blockscale_1x128x128_256x128x128x128_16x16_32x32_2x2_8x32x1_8x32x1_1x32x1x8_8_1x1_intrawave_v3,733.65,275.34,0.0
gfx942,304,3136,5120,3072,ck,0,0,145.5561,a8w8_blockscale_1x128x128_256x128x128x128_16x16_32x32_2x2_8x32x1_8x32x1_1x32x1x8_8_1x1_intrawave_v3,677.75,394.87,0.0
gfx942,304,3136,5120,8704,ck,0,0,375.771,a8w8_blockscale_1x128x128_256x128x128x128_16x16_32x32_2x2_8x32x1_8x32x1_1x32x1x8_8_1x1_intrawave_v3,743.83,276.69,0.0
gfx942,304,3200,5120,3072,ck,0,0,144.2645,a8w8_blockscale_1x128x128_256x128x128x128_16x16_32x32_2x2_8x32x1_8x32x1_1x32x1x8_8_1x1_intrawave_v3,697.77,404.31,0.0
gfx942,304,3200,5120,8704,ck,0,0,378.8335,a8w8_blockscale_1x128x128_256x128x128x128_16x16_32x32_2x2_8x32x1_8x32x1_1x32x1x8_8_1x1_intrawave_v3,752.87,277.66,0.0
gfx942,304,3264,5120,3072,ck,0,0,148.1073,a8w8_blockscale_1x128x128_256x128x128x128_16x16_32x32_2x2_8x32x1_8x32x1_1x32x1x8_8_1x1_intrawave_v3,693.26,399.57,0.0
gfx942,304,3264,5120,8704,ck,0,0,373.8476,a8w8_blockscale_1x128x128_256x128x128x128_16x16_32x32_2x2_8x32x1_8x32x1_1x32x1x8_8_1x1_intrawave_v3,778.17,284.6,0.0
gfx942,304,3328,5120,3072,ck,0,0,146.7382,a8w8_blockscale_1x128x128_256x128x128x128_16x16_32x32_2x2_8x32x1_8x32x1_1x32x1x8_8_1x1_intrawave_v3,713.45,409.1,0.0
gfx942,304,3328,5120,8704,ck,0,0,385.6069,a8w8_blockscale_1x128x128_256x128x128x128_16x16_32x32_2x2_8x32x1_8x32x1_1x32x1x8_8_1x1_intrawave_v3,769.23,279.07,0.0
gfx942,304,3392,5120,3072,ck,0,0,148.1158,a8w8_blockscale_1x128x128_256x128x128x128_16x16_32x32_2x2_8x32x1_8x32x1_1x32x1x8_8_1x1_intrawave_v3,720.4,411.05,0.0
gfx942,304,3392,5120,8704,ck,0,0,382.0052,a8w8_blockscale_1x128x128_256x128x128x128_16x16_32x32_2x2_8x32x1_8x32x1_1x32x1x8_8_1x1_intrawave_v3,791.42,284.87,0.0
gfx942,304,3456,5120,3072,ck,0,0,146.7999,a8w8_blockscale_1x128x128_256x128x128x128_16x16_32x32_2x2_8x32x1_8x32x1_1x32x1x8_8_1x1_intrawave_v3,740.58,420.54,0.0
gfx942,304,3456,5120,8704,ck,0,0,389.978,a8w8_blockscale_1x128x128_256x128x128x128_16x16_32x32_2x2_8x32x1_8x32x1_1x32x1x8_8_1x1_intrawave_v3,789.86,282.16,0.0
gfx942,304,3520,5120,3072,ck,0,0,149.1937,a8w8_blockscale_1x128x128_256x128x128x128_16x16_32x32_2x2_8x32x1_8x32x1_1x32x1x8_8_1x1_intrawave_v3,742.19,419.5,0.0
gfx942,304,3520,5120,8704,ck,0,0,400.8062,a8w8_blockscale_1x128x128_256x128x128x128_16x16_32x32_2x2_8x32x1_8x32x1_1x32x1x8_8_1x1_intrawave_v3,782.76,277.56,0.0
gfx942,304,3584,5120,3072,ck,0,0,151.8495,a8w8_blockscale_1x128x128_256x128x128x128_16x16_32x32_2x2_8x32x1_8x32x1_1x32x1x8_8_1x1_intrawave_v3,742.46,417.77,0.0
gfx942,304,3584,5120,8704,ck,0,0,395.6218,a8w8_blockscale_1x128x128_256x128x128x128_16x16_32x32_2x2_8x32x1_8x32x1_1x32x1x8_8_1x1_intrawave_v3,807.43,284.26,0.0
gfx942,304,3648,5120,3072,ck,0,0,155.1911,a8w8_blockscale_1x128x128_256x128x128x128_16x16_32x32_2x2_8x32x1_8x32x1_1x32x1x8_8_1x1_intrawave_v3,739.45,414.27,0.0
gfx942,304,3648,5120,8704,ck,0,0,407.8757,a8w8_blockscale_1x128x128_256x128x128x128_16x16_32x32_2x2_8x32x1_8x32x1_1x32x1x8_8_1x1_intrawave_v3,797.16,278.69,0.0
gfx942,304,3712,5120,3072,ck,0,0,159.1591,a8w8_blockscale_1x128x128_256x128x128x128_16x16_32x32_2x2_8x32x1_8x32x1_1x32x1x8_8_1x1_intrawave_v3,733.66,409.29,0.0
gfx942,304,3712,5120,8704,ck,0,0,411.3532,a8w8_blockscale_1x128x128_256x128x128x128_16x16_32x32_2x2_8x32x1_8x32x1_1x32x1x8_8_1x1_intrawave_v3,804.29,279.28,0.0
gfx942,304,3776,5120,3072,ck,0,0,157.2542,a8w8_blockscale_1x128x128_256x128x128x128_16x16_32x32_2x2_8x32x1_8x32x1_1x32x1x8_8_1x1_intrawave_v3,755.35,419.67,0.0
gfx942,304,3776,5120,8704,ck,0,0,423.538,a8w8_blockscale_1x128x128_256x128x128x128_16x16_32x32_2x2_8x32x1_8x32x1_1x32x1x8_8_1x1_intrawave_v3,794.62,274.11,0.0
gfx942,304,3840,5120,3072,ck,0,0,160.78,a8w8_blockscale_1x128x128_256x128x128x128_16x16_32x32_2x2_8x32x1_8x32x1_1x32x1x8_8_1x1_intrawave_v3,751.31,415.77,0.0
gfx942,304,3840,5120,8704,ck,0,0,419.5147,a8w8_blockscale_1x128x128_256x128x128x128_16x16_32x32_2x2_8x32x1_8x32x1_1x32x1x8_8_1x1_intrawave_v3,815.84,279.63,0.0
gfx942,304,3904,5120,3072,ck,0,0,177.137,a8w8_blockscale_1x128x128_256x128x128x128_16x16_32x32_2x2_8x32x1_8x32x1_1x32x1x8_8_1x1_intrawave_v3,693.3,382.18,0.0
gfx942,304,3904,5120,8704,ck,0,0,464.6705,a8w8_blockscale_1x128x128_256x128x128x128_16x16_32x32_2x2_8x32x1_8x32x1_1x32x1x8_8_1x1_intrawave_v3,748.83,255.07,0.0
gfx942,304,3968,5120,3072,ck,0,0,178.2049,a8w8_blockscale_1x128x128_256x128x128x128_16x16_32x32_2x2_8x32x1_8x32x1_1x32x1x8_8_1x1_intrawave_v3,700.44,384.67,0.0
gfx942,304,3968,5120,8704,ck,0,0,466.7647,a8w8_blockscale_1x128x128_256x128x128x128_16x16_32x32_2x2_8x32x1_8x32x1_1x32x1x8_8_1x1_intrawave_v3,757.69,256.52,0.0
gfx942,304,4032,5120,3072,ck,0,0,175.2018,a8w8_blockscale_1x128x128_256x128x128x128_16x16_32x32_2x2_8x32x1_8x32x1_1x32x1x8_8_1x1_intrawave_v3,723.94,396.13,0.0
gfx942,304,4032,5120,8704,ck,0,0,452.3216,a8w8_blockscale_1x128x128_256x128x128x128_16x16_32x32_2x2_8x32x1_8x32x1_1x32x1x8_8_1x1_intrawave_v3,794.5,267.39,0.0
gfx942,304,4096,5120,3072,ck,0,0,177.2061,a8w8_blockscale_1x128x128_256x128x128x128_16x16_32x32_2x2_8x32x1_8x32x1_1x32x1x8_8_1x1_intrawave_v3,727.11,396.46,0.0
gfx942,304,4096,5120,8704,ck,0,0,473.4992,a8w8_blockscale_1x128x128_256x128x128x128_16x16_32x32_2x2_8x32x1_8x32x1_1x32x1x8_8_1x1_intrawave_v3,771.01,257.99,0.0
gfx942,304,4224,5120,3072,ck,0,0,180.6204,a8w8_blockscale_1x128x128_256x128x128x128_16x16_32x32_2x2_8x32x1_8x32x1_1x32x1x8_8_1x1_intrawave_v3,735.66,398.4,0.0
gfx942,304,4224,5120,8704,ck,0,0,475.7063,a8w8_blockscale_1x128x128_256x128x128x128_16x16_32x32_2x2_8x32x1_8x32x1_1x32x1x8_8_1x1_intrawave_v3,791.41,261.89,0.0
gfx942,304,4352,5120,3072,ck,0,0,181.35,a8w8_blockscale_1x128x128_256x128x128x128_16x16_32x32_2x2_8x32x1_8x32x1_1x32x1x8_8_1x1_intrawave_v3,754.91,406.19,0.0
gfx942,304,4352,5120,8704,ck,0,0,494.2348,a8w8_blockscale_1x128x128_256x128x128x128_16x16_32x32_2x2_8x32x1_8x32x1_1x32x1x8_8_1x1_intrawave_v3,784.83,256.98,0.0
gfx942,304,4480,5120,3072,ck,0,0,183.2587,a8w8_blockscale_1x128x128_256x128x128x128_16x16_32x32_2x2_8x32x1_8x32x1_1x32x1x8_8_1x1_intrawave_v3,769.01,411.26,0.0
gfx942,304,4480,5120,8704,ck,0,0,487.889,a8w8_blockscale_1x128x128_256x128x128x128_16x16_32x32_2x2_8x32x1_8x32x1_1x32x1x8_8_1x1_intrawave_v3,818.42,265.29,0.0
gfx942,304,4608,5120,3072,ck,0,0,187.726,a8w8_blockscale_1x128x128_256x128x128x128_16x16_32x32_2x2_8x32x1_8x32x1_1x32x1x8_8_1x1_intrawave_v3,772.16,410.55,0.0
gfx942,304,4608,5120,8704,ck,0,0,499.6361,a8w8_blockscale_1x128x128_256x128x128x128_16x16_32x32_2x2_8x32x1_8x32x1_1x32x1x8_8_1x1_intrawave_v3,822.01,263.91,0.0
gfx942,304,4736,5120,3072,ck,0,0,191.0437,a8w8_blockscale_1x128x128_256x128x128x128_16x16_32x32_2x2_8x32x1_8x32x1_1x32x1x8_8_1x1_intrawave_v3,779.83,412.34,0.0
gfx942,304,4736,5120,8704,ck,0,0,516.6193,a8w8_blockscale_1x128x128_256x128x128x128_16x16_32x32_2x2_8x32x1_8x32x1_1x32x1x8_8_1x1_intrawave_v3,817.07,259.93,0.0
gfx942,304,4864,5120,3072,ck,0,0,198.7931,a8w8_blockscale_1x128x128_256x128x128x128_16x16_32x32_2x2_8x32x1_8x32x1_1x32x1x8_8_1x1_intrawave_v3,769.69,404.83,0.0
gfx942,304,4864,5120,8704,ck,0,0,525.525,a8w8_blockscale_1x128x128_256x128x128x128_16x16_32x32_2x2_8x32x1_8x32x1_1x32x1x8_8_1x1_intrawave_v3,824.93,260.14,0.0
gfx942,304,4992,5120,3072,ck,0,0,210.5819,a8w8_blockscale_1x128x128_256x128x128x128_16x16_32x32_2x2_8x32x1_8x32x1_1x32x1x8_8_1x1_intrawave_v3,745.72,390.26,0.0
gfx942,304,4992,5120,8704,ck,0,0,557.7184,a8w8_blockscale_1x128x128_256x128x128x128_16x16_32x32_2x2_8x32x1_8x32x1_1x32x1x8_8_1x1_intrawave_v3,797.77,249.47,0.0
gfx942,304,5120,5120,3072,ck,0,0,209.0035,a8w8_blockscale_1x128x128_256x128x128x128_16x16_32x32_2x2_8x32x1_8x32x1_1x32x1x8_8_1x1_intrawave_v3,770.62,401.36,0.0
gfx942,304,5120,5120,8704,ck,0,0,566.1358,a8w8_blockscale_1x128x128_256x128x128x128_16x16_32x32_2x2_8x32x1_8x32x1_1x32x1x8_8_1x1_intrawave_v3,806.06,250.04,0.0
gfx942,304,5248,5120,3072,ck,0,0,220.1033,a8w8_blockscale_1x128x128_256x128x128x128_16x16_32x32_2x2_8x32x1_8x32x1_1x32x1x8_8_1x1_intrawave_v3,750.05,388.86,0.0
gfx942,304,5248,5120,8704,ck,0,0,581.6929,a8w8_blockscale_1x128x128_256x128x128x128_16x16_32x32_2x2_8x32x1_8x32x1_1x32x1x8_8_1x1_intrawave_v3,804.12,247.52,0.0
gfx942,304,5376,5120,3072,ck,0,0,222.8996,a8w8_blockscale_1x128x128_256x128x128x128_16x16_32x32_2x2_8x32x1_8x32x1_1x32x1x8_8_1x1_intrawave_v3,758.7,391.63,0.0
gfx942,304,5376,5120,8704,ck,0,0,578.8086,a8w8_blockscale_1x128x128_256x128x128x128_16x16_32x32_2x2_8x32x1_8x32x1_1x32x1x8_8_1x1_intrawave_v3,827.83,252.95,0.0
gfx942,304,5504,5120,3072,ck,0,0,222.6797,a8w8_blockscale_1x128x128_256x128x128x128_16x16_32x32_2x2_8x32x1_8x32x1_1x32x1x8_8_1x1_intrawave_v3,777.53,399.67,0.0
gfx942,304,5504,5120,8704,ck,0,0,599.2116,a8w8_blockscale_1x128x128_256x128x128x128_16x16_32x32_2x2_8x32x1_8x32x1_1x32x1x8_8_1x1_intrawave_v3,818.69,248.38,0.0
gfx942,304,5632,5120,3072,ck,0,0,222.1649,a8w8_blockscale_1x128x128_256x128x128x128_16x16_32x32_2x2_8x32x1_8x32x1_1x32x1x8_8_1x1_intrawave_v3,797.46,408.26,0.0
gfx942,304,5632,5120,8704,ck,0,0,604.1029,a8w8_blockscale_1x128x128_256x128x128x128_16x16_32x32_2x2_8x32x1_8x32x1_1x32x1x8_8_1x1_intrawave_v3,830.94,250.38,0.0
gfx942,304,5760,5120,3072,ck,0,0,233.4927,a8w8_blockscale_1x128x128_256x128x128x128_16x16_32x32_2x2_8x32x1_8x32x1_1x32x1x8_8_1x1_intrawave_v3,776.02,395.75,0.0
gfx942,304,5760,5120,8704,ck,0,0,624.8421,a8w8_blockscale_1x128x128_256x128x128x128_16x16_32x32_2x2_8x32x1_8x32x1_1x32x1x8_8_1x1_intrawave_v3,821.62,245.95,0.0
gfx942,304,5888,5120,3072,ck,0,0,244.0529,a8w8_blockscale_1x128x128_256x128x128x128_16x16_32x32_2x2_8x32x1_8x32x1_1x32x1x8_8_1x1_intrawave_v3,758.94,385.61,0.0
gfx942,304,5888,5120,8704,ck,0,0,652.2394,a8w8_blockscale_1x128x128_256x128x128x128_16x16_32x32_2x2_8x32x1_8x32x1_1x32x1x8_8_1x1_intrawave_v3,804.6,239.34,0.0
gfx942,304,6016,5120,3072,ck,0,0,248.0484,a8w8_blockscale_1x128x128_256x128x128x128_16x16_32x32_2x2_8x32x1_8x32x1_1x32x1x8_8_1x1_intrawave_v3,762.94,386.27,0.0
gfx942,304,6016,5120,8704,ck,0,0,665.6204,a8w8_blockscale_1x128x128_256x128x128x128_16x16_32x32_2x2_8x32x1_8x32x1_1x32x1x8_8_1x1_intrawave_v3,805.56,238.17,0.0
gfx942,304,6144,5120,3072,ck,0,0,250.2713,a8w8_blockscale_1x128x128_256x128x128x128_16x16_32x32_2x2_8x32x1_8x32x1_1x32x1x8_8_1x1_intrawave_v3,772.26,389.65,0.0
gfx942,304,6144,5120,8704,ck,0,0,675.3613,a8w8_blockscale_1x128x128_256x128x128x128_16x16_32x32_2x2_8x32x1_8x32x1_1x32x1x8_8_1x1_intrawave_v3,810.84,238.33,0.0
gfx942,304,6272,5120,3072,ck,0,0,257.4073,a8w8_blockscale_1x128x128_256x128x128x128_16x16_32x32_2x2_8x32x1_8x32x1_1x32x1x8_8_1x1_intrawave_v3,766.49,385.46,0.0
gfx942,304,6272,5120,8704,ck,0,0,688.5177,a8w8_blockscale_1x128x128_256x128x128x128_16x16_32x32_2x2_8x32x1_8x32x1_1x32x1x8_8_1x1_intrawave_v3,811.91,237.29,0.0
gfx942,304,6400,5120,3072,ck,0,0,256.1208,a8w8_blockscale_1x128x128_256x128x128x128_16x16_32x32_2x2_8x32x1_8x32x1_1x32x1x8_8_1x1_intrawave_v3,786.06,394.05,0.0
gfx942,304,6400,5120,8704,ck,0,0,695.0119,a8w8_blockscale_1x128x128_256x128x128x128_16x16_32x32_2x2_8x32x1_8x32x1_1x32x1x8_8_1x1_intrawave_v3,820.74,238.57,0.0
gfx942,304,6528,5120,3072,ck,0,0,259.0037,a8w8_blockscale_1x128x128_256x128x128x128_16x16_32x32_2x2_8x32x1_8x32x1_1x32x1x8_8_1x1_intrawave_v3,792.86,396.25,0.0
gfx942,304,6528,5120,8704,ck,0,0,713.915,a8w8_blockscale_1x128x128_256x128x128x128_16x16_32x32_2x2_8x32x1_8x32x1_1x32x1x8_8_1x1_intrawave_v3,814.99,235.65,0.0
gfx942,304,6656,5120,3072,ck,0,0,263.5782,a8w8_blockscale_1x128x128_256x128x128x128_16x16_32x32_2x2_8x32x1_8x32x1_1x32x1x8_8_1x1_intrawave_v3,794.37,395.83,0.0
gfx942,304,6656,5120,8704,ck,0,0,708.886,a8w8_blockscale_1x128x128_256x128x128x128_16x16_32x32_2x2_8x32x1_8x32x1_1x32x1x8_8_1x1_intrawave_v3,836.87,240.74,0.0
gfx942,304,6784,5120,3072,ck,0,0,271.153,a8w8_blockscale_1x128x128_256x128x128x128_16x16_32x32_2x2_8x32x1_8x32x1_1x32x1x8_8_1x1_intrawave_v3,787.03,391.06,0.0
gfx942,304,6784,5120,8704,ck,0,0,749.8783,a8w8_blockscale_1x128x128_256x128x128x128_16x16_32x32_2x2_8x32x1_8x32x1_1x32x1x8_8_1x1_intrawave_v3,806.33,230.81,0.0
gfx942,304,6912,5120,3072,ck,0,0,284.6087,a8w8_blockscale_1x128x128_256x128x128x128_16x16_32x32_2x2_8x32x1_8x32x1_1x32x1x8_8_1x1_intrawave_v3,763.97,378.56,0.0
gfx942,304,6912,5120,8704,ck,0,0,760.5333,a8w8_blockscale_1x128x128_256x128x128x128_16x16_32x32_2x2_8x32x1_8x32x1_1x32x1x8_8_1x1_intrawave_v3,810.04,230.77,0.0
gfx942,304,7040,5120,3072,ck,0,0,283.9753,a8w8_blockscale_1x128x128_256x128x128x128_16x16_32x32_2x2_8x32x1_8x32x1_1x32x1x8_8_1x1_intrawave_v3,779.85,385.4,0.0
gfx942,304,7040,5120,8704,ck,0,0,773.5985,a8w8_blockscale_1x128x128_256x128x128x128_16x16_32x32_2x2_8x32x1_8x32x1_1x32x1x8_8_1x1_intrawave_v3,811.1,230.0,0.0
gfx942,304,7168,5120,3072,ck,0,0,286.8967,a8w8_blockscale_1x128x128_256x128x128x128_16x16_32x32_2x2_8x32x1_8x32x1_1x32x1x8_8_1x1_intrawave_v3,785.95,387.42,0.0
gfx942,304,7168,5120,8704,ck,0,0,779.6836,a8w8_blockscale_1x128x128_256x128x128x128_16x16_32x32_2x2_8x32x1_8x32x1_1x32x1x8_8_1x1_intrawave_v3,819.4,231.32,0.0
gfx942,304,7296,5120,3072,ck,0,0,294.8767,a8w8_blockscale_1x128x128_256x128x128x128_16x16_32x32_2x2_8x32x1_8x32x1_1x32x1x8_8_1x1_intrawave_v3,778.33,382.71,0.0
gfx942,304,7296,5120,8704,ck,0,0,794.1869,a8w8_blockscale_1x128x128_256x128x128x128_16x16_32x32_2x2_8x32x1_8x32x1_1x32x1x8_8_1x1_intrawave_v3,818.81,230.15,0.0
gfx942,304,7424,5120,3072,ck,0,0,289.8551,a8w8_blockscale_1x128x128_256x128x128x128_16x16_32x32_2x2_8x32x1_8x32x1_1x32x1x8_8_1x1_intrawave_v3,805.71,395.22,0.0
gfx942,304,7424,5120,8704,ck,0,0,796.295,a8w8_blockscale_1x128x128_256x128x128x128_16x16_32x32_2x2_8x32x1_8x32x1_1x32x1x8_8_1x1_intrawave_v3,830.97,232.58,0.0
gfx942,304,7552,5120,3072,ck,0,0,293.2817,a8w8_blockscale_1x128x128_256x128x128x128_16x16_32x32_2x2_8x32x1_8x32x1_1x32x1x8_8_1x1_intrawave_v3,810.02,396.41,0.0
gfx942,304,7552,5120,8704,ck,0,0,816.2775,a8w8_blockscale_1x128x128_256x128x128x128_16x16_32x32_2x2_8x32x1_8x32x1_1x32x1x8_8_1x1_intrawave_v3,824.6,229.86,0.0
gfx942,304,7680,5120,3072,ck,0,0,297.3549,a8w8_blockscale_1x128x128_256x128x128x128_16x16_32x32_2x2_8x32x1_8x32x1_1x32x1x8_8_1x1_intrawave_v3,812.47,396.71,0.0
gfx942,304,7680,5120,8704,ck,0,0,840.7198,a8w8_blockscale_1x128x128_256x128x128x128_16x16_32x32_2x2_8x32x1_8x32x1_1x32x1x8_8_1x1_intrawave_v3,814.2,226.06,0.0
gfx942,304,7808,5120,3072,ck,0,0,316.5373,a8w8_blockscale_1x128x128_256x128x128x128_16x16_32x32_2x2_8x32x1_8x32x1_1x32x1x8_8_1x1_intrawave_v3,775.95,378.06,0.0
gfx942,304,7808,5120,8704,ck,0,0,872.4513,a8w8_blockscale_1x128x128_256x128x128x128_16x16_32x32_2x2_8x32x1_8x32x1_1x32x1x8_8_1x1_intrawave_v3,797.66,220.62,0.0
gfx942,304,7936,5120,3072,ck,0,0,323.4639,a8w8_blockscale_1x128x128_256x128x128x128_16x16_32x32_2x2_8x32x1_8x32x1_1x32x1x8_8_1x1_intrawave_v3,771.79,375.23,0.0
gfx942,304,7936,5120,8704,ck,0,0,876.8186,a8w8_blockscale_1x128x128_256x128x128x128_16x16_32x32_2x2_8x32x1_8x32x1_1x32x1x8_8_1x1_intrawave_v3,806.7,222.29,0.0
gfx942,304,8064,5120,3072,ck,0,0,321.8978,a8w8_blockscale_1x128x128_256x128x128x128_16x16_32x32_2x2_8x32x1_8x32x1_1x32x1x8_8_1x1_intrawave_v3,788.05,382.35,0.0
gfx942,304,8064,5120,8704,ck,0,0,881.3358,a8w8_blockscale_1x128x128_256x128x128x128_16x16_32x32_2x2_8x32x1_8x32x1_1x32x1x8_8_1x1_intrawave_v3,815.51,223.9,0.0
gfx942,304,8192,5120,3072,ck,0,0,322.5083,a8w8_blockscale_1x128x128_256x128x128x128_16x16_32x32_2x2_8x32x1_8x32x1_1x32x1x8_8_1x1_intrawave_v3,799.04,386.91,0.0
gfx942,304,8192,5120,8704,ck,0,0,870.3518,a8w8_blockscale_1x128x128_256x128x128x128_16x16_32x32_2x2_8x32x1_8x32x1_1x32x1x8_8_1x1_intrawave_v3,838.91,229.51,0.0
gfx942,304,8320,5120,3072,ck,0,0,327.9301,a8w8_blockscale_1x128x128_256x128x128x128_16x16_32x32_2x2_8x32x1_8x32x1_1x32x1x8_8_1x1_intrawave_v3,798.11,385.71,0.0
gfx942,304,8320,5120,8704,ck,0,0,910.9515,a8w8_blockscale_1x128x128_256x128x128x128_16x16_32x32_2x2_8x32x1_8x32x1_1x32x1x8_8_1x1_intrawave_v3,814.04,221.94,0.0
gfx942,304,8448,5120,3072,ck,0,0,335.0473,a8w8_blockscale_1x128x128_256x128x128x128_16x16_32x32_2x2_8x32x1_8x32x1_1x32x1x8_8_1x1_intrawave_v3,793.17,382.6,0.0
gfx942,304,8448,5120,8704,ck,0,0,891.7976,a8w8_blockscale_1x128x128_256x128x128x128_16x16_32x32_2x2_8x32x1_8x32x1_1x32x1x8_8_1x1_intrawave_v3,844.32,229.43,0.0
gfx942,304,8576,5120,3072,ck,0,0,331.3799,a8w8_blockscale_1x128x128_256x128x128x128_16x16_32x32_2x2_8x32x1_8x32x1_1x32x1x8_8_1x1_intrawave_v3,814.1,391.97,0.0
gfx942,304,8576,5120,8704,ck,0,0,924.8405,a8w8_blockscale_1x128x128_256x128x128x128_16x16_32x32_2x2_8x32x1_8x32x1_1x32x1x8_8_1x1_intrawave_v3,826.49,223.85,0.0
gfx942,304,8704,5120,3072,ck,0,0,335.444,a8w8_blockscale_1x128x128_256x128x128x128_16x16_32x32_2x2_8x32x1_8x32x1_1x32x1x8_8_1x1_intrawave_v3,816.24,392.3,0.0
gfx942,304,8704,5120,8704,ck,0,0,933.7731,a8w8_blockscale_1x128x128_256x128x128x128_16x16_32x32_2x2_8x32x1_8x32x1_1x32x1x8_8_1x1_intrawave_v3,830.8,224.31,0.0
gfx942,304,8832,5120,3072,ck,0,0,356.1071,a8w8_blockscale_1x128x128_256x128x128x128_16x16_32x32_2x2_8x32x1_8x32x1_1x32x1x8_8_1x1_intrawave_v3,780.19,374.33,0.0
gfx942,304,8832,5120,8704,ck,0,0,975.8873,a8w8_blockscale_1x128x128_256x128x128x128_16x16_32x32_2x2_8x32x1_8x32x1_1x32x1x8_8_1x1_intrawave_v3,806.64,217.11,0.0
gfx942,304,8960,5120,3072,ck,0,0,351.7291,a8w8_blockscale_1x128x128_256x128x128x128_16x16_32x32_2x2_8x32x1_8x32x1_1x32x1x8_8_1x1_intrawave_v3,801.35,383.83,0.0
gfx942,304,8960,5120,8704,ck,0,0,982.5694,a8w8_blockscale_1x128x128_256x128x128x128_16x16_32x32_2x2_8x32x1_8x32x1_1x32x1x8_8_1x1_intrawave_v3,812.76,218.1,0.0
gfx942,304,9088,5120,3072,ck,0,0,360.44,a8w8_blockscale_1x128x128_256x128x128x128_16x16_32x32_2x2_8x32x1_8x32x1_1x32x1x8_8_1x1_intrawave_v3,793.15,379.28,0.0
gfx942,304,9088,5120,8704,ck,0,0,1002.6527,a8w8_blockscale_1x128x128_256x128x128x128_16x16_32x32_2x2_8x32x1_8x32x1_1x32x1x8_8_1x1_intrawave_v3,807.86,216.15,0.0
gfx942,304,9216,5120,3072,ck,0,0,358.7672,a8w8_blockscale_1x128x128_256x128x128x128_16x16_32x32_2x2_8x32x1_8x32x1_1x32x1x8_8_1x1_intrawave_v3,808.07,385.8,0.0
gfx942,304,9216,5120,8704,ck,0,0,976.6903,a8w8_blockscale_1x128x128_256x128x128x128_16x16_32x32_2x2_8x32x1_8x32x1_1x32x1x8_8_1x1_intrawave_v3,841.02,224.38,0.0
gfx942,304,9344,5120,3072,ck,0,0,368.6882,a8w8_blockscale_1x128x128_256x128x128x128_16x16_32x32_2x2_8x32x1_8x32x1_1x32x1x8_8_1x1_intrawave_v3,797.25,380.04,0.0
gfx942,304,9344,5120,8704,ck,0,0,1022.4984,a8w8_blockscale_1x128x128_256x128x128x128_16x16_32x32_2x2_8x32x1_8x32x1_1x32x1x8_8_1x1_intrawave_v3,814.5,216.7,0.0
gfx942,304,9472,5120,3072,ck,0,0,371.3769,a8w8_blockscale_1x128x128_256x128x128x128_16x16_32x32_2x2_8x32x1_8x32x1_1x32x1x8_8_1x1_intrawave_v3,802.32,381.88,0.0
gfx942,304,9472,5120,8704,ck,0,0,1021.7255,a8w8_blockscale_1x128x128_256x128x128x128_16x16_32x32_2x2_8x32x1_8x32x1_1x32x1x8_8_1x1_intrawave_v3,826.28,219.24,0.0
gfx942,304,9600,5120,3072,ck,0,0,369.1466,a8w8_blockscale_1x128x128_256x128x128x128_16x16_32x32_2x2_8x32x1_8x32x1_1x32x1x8_8_1x1_intrawave_v3,818.08,388.8,0.0
gfx942,304,9600,5120,8704,ck,0,0,1060.8866,a8w8_blockscale_1x128x128_256x128x128x128_16x16_32x32_2x2_8x32x1_8x32x1_1x32x1x8_8_1x1_intrawave_v3,806.53,213.43,0.0
gfx942,304,9728,5120,3072,ck,0,0,373.7592,a8w8_blockscale_1x128x128_256x128x128x128_16x16_32x32_2x2_8x32x1_8x32x1_1x32x1x8_8_1x1_intrawave_v3,818.75,388.56,0.0
gfx942,304,9728,5120,8704,ck,0,0,1066.2363,a8w8_blockscale_1x128x128_256x128x128x128_16x16_32x32_2x2_8x32x1_8x32x1_1x32x1x8_8_1x1_intrawave_v3,813.18,214.64,0.0
gfx942,304,9856,5120,3072,ck,0,0,387.114,a8w8_blockscale_1x128x128_256x128x128x128_16x16_32x32_2x2_8x32x1_8x32x1_1x32x1x8_8_1x1_intrawave_v3,800.91,379.56,0.0
gfx942,304,9856,5120,8704,ck,0,0,1081.7661,a8w8_blockscale_1x128x128_256x128x128x128_16x16_32x32_2x2_8x32x1_8x32x1_1x32x1x8_8_1x1_intrawave_v3,812.06,213.8,0.0
gfx942,304,9984,5120,3072,ck,0,0,389.9858,a8w8_blockscale_1x128x128_256x128x128x128_16x16_32x32_2x2_8x32x1_8x32x1_1x32x1x8_8_1x1_intrawave_v3,805.34,381.13,0.0
gfx942,304,9984,5120,8704,ck,0,0,1108.1764,a8w8_blockscale_1x128x128_256x128x128x128_16x16_32x32_2x2_8x32x1_8x32x1_1x32x1x8_8_1x1_intrawave_v3,803.0,210.89,0.0
gfx942,304,10112,5120,3072,ck,0,0,391.4387,a8w8_blockscale_1x128x128_256x128x128x128_16x16_32x32_2x2_8x32x1_8x32x1_1x32x1x8_8_1x1_intrawave_v3,812.63,384.07,0.0
gfx942,304,10112,5120,8704,ck,0,0,1117.6453,a8w8_blockscale_1x128x128_256x128x128x128_16x16_32x32_2x2_8x32x1_8x32x1_1x32x1x8_8_1x1_intrawave_v3,806.4,211.27,0.0
gfx942,304,10240,5120,3072,ck,0,0,397.2672,a8w8_blockscale_1x128x128_256x128x128x128_16x16_32x32_2x2_8x32x1_8x32x1_1x32x1x8_8_1x1_intrawave_v3,810.85,382.72,0.0
gfx942,304,10240,5120,8704,ck,0,0,1123.03,a8w8_blockscale_1x128x128_256x128x128x128_16x16_32x32_2x2_8x32x1_8x32x1_1x32x1x8_8_1x1_intrawave_v3,812.69,212.42,0.0
gfx942,304,10368,5120,3072,ck,0,0,401.8729,a8w8_blockscale_1x128x128_256x128x128x128_16x16_32x32_2x2_8x32x1_8x32x1_1x32x1x8_8_1x1_intrawave_v3,811.57,382.58,0.0
gfx942,304,10368,5120,8704,ck,0,0,1138.8098,a8w8_blockscale_1x128x128_256x128x128x128_16x16_32x32_2x2_8x32x1_8x32x1_1x32x1x8_8_1x1_intrawave_v3,811.45,211.6,0.0
gfx942,304,10496,5120,3072,ck,0,0,406.9582,a8w8_blockscale_1x128x128_256x128x128x128_16x16_32x32_2x2_8x32x1_8x32x1_1x32x1x8_8_1x1_intrawave_v3,811.33,381.98,0.0
gfx942,304,10496,5120,8704,ck,0,0,1148.7073,a8w8_blockscale_1x128x128_256x128x128x128_16x16_32x32_2x2_8x32x1_8x32x1_1x32x1x8_8_1x1_intrawave_v3,814.39,211.89,0.0
gfx942,304,10624,5120,3072,ck,0,0,412.9547,a8w8_blockscale_1x128x128_256x128x128x128_16x16_32x32_2x2_8x32x1_8x32x1_1x32x1x8_8_1x1_intrawave_v3,809.29,380.56,0.0
gfx942,304,10624,5120,8704,ck,0,0,1175.453,a8w8_blockscale_1x128x128_256x128x128x128_16x16_32x32_2x2_8x32x1_8x32x1_1x32x1x8_8_1x1_intrawave_v3,805.57,209.13,0.0
gfx942,304,10752,5120,3072,ck,0,0,417.166,a8w8_blockscale_1x128x128_256x128x128x128_16x16_32x32_2x2_8x32x1_8x32x1_1x32x1x8_8_1x1_intrawave_v3,810.78,380.81,0.0
gfx942,304,10752,5120,8704,ck,0,0,1183.6504,a8w8_blockscale_1x128x128_256x128x128x128_16x16_32x32_2x2_8x32x1_8x32x1_1x32x1x8_8_1x1_intrawave_v3,809.63,209.73,0.0
gfx942,304,10880,5120,3072,ck,0,0,425.6305,a8w8_blockscale_1x128x128_256x128x128x128_16x16_32x32_2x2_8x32x1_8x32x1_1x32x1x8_8_1x1_intrawave_v3,804.11,377.24,0.0
gfx942,304,10880,5120,8704,ck,0,0,1210.8732,a8w8_blockscale_1x128x128_256x128x128x128_16x16_32x32_2x2_8x32x1_8x32x1_1x32x1x8_8_1x1_intrawave_v3,800.85,207.02,0.0
gfx942,304,11008,5120,3072,ck,0,0,425.0297,a8w8_blockscale_1x128x128_256x128x128x128_16x16_32x32_2x2_8x32x1_8x32x1_1x32x1x8_8_1x1_intrawave_v3,814.72,381.78,0.0
gfx942,304,11008,5120,8704,ck,0,0,1208.4913,a8w8_blockscale_1x128x128_256x128x128x128_16x16_32x32_2x2_8x32x1_8x32x1_1x32x1x8_8_1x1_intrawave_v3,811.86,209.43,0.0
gfx942,304,11136,5120,3072,ck,0,0,427.7021,a8w8_blockscale_1x128x128_256x128x128x128_16x16_32x32_2x2_8x32x1_8x32x1_1x32x1x8_8_1x1_intrawave_v3,819.05,383.38,0.0
gfx942,304,11136,5120,8704,ck,0,0,1224.4431,a8w8_blockscale_1x128x128_256x128x128x128_16x16_32x32_2x2_8x32x1_8x32x1_1x32x1x8_8_1x1_intrawave_v3,810.61,208.69,0.0
gfx942,304,11264,5120,3072,ck,0,0,435.2483,a8w8_blockscale_1x128x128_256x128x128x128_16x16_32x32_2x2_8x32x1_8x32x1_1x32x1x8_8_1x1_intrawave_v3,814.1,380.64,0.0
gfx942,304,11264,5120,8704,ck,0,0,1206.4068,a8w8_blockscale_1x128x128_256x128x128x128_16x16_32x32_2x2_8x32x1_8x32x1_1x32x1x8_8_1x1_intrawave_v3,832.18,213.82,0.0
gfx942,304,11392,5120,3072,ck,0,0,439.0801,a8w8_blockscale_1x128x128_256x128x128x128_16x16_32x32_2x2_8x32x1_8x32x1_1x32x1x8_8_1x1_intrawave_v3,816.16,381.2,0.0
gfx942,304,11392,5120,8704,ck,0,0,1236.2587,a8w8_blockscale_1x128x128_256x128x128x128_16x16_32x32_2x2_8x32x1_8x32x1_1x32x1x8_8_1x1_intrawave_v3,821.31,210.61,0.0
gfx942,304,11520,5120,3072,ck,0,0,442.4354,a8w8_blockscale_1x128x128_256x128x128x128_16x16_32x32_2x2_8x32x1_8x32x1_1x32x1x8_8_1x1_intrawave_v3,819.08,382.16,0.0
gfx942,304,11520,5120,8704,ck,0,0,1255.1677,a8w8_blockscale_1x128x128_256x128x128x128_16x16_32x32_2x2_8x32x1_8x32x1_1x32x1x8_8_1x1_intrawave_v3,818.03,209.37,0.0
gfx942,304,11648,5120,3072,ck,0,0,445.5332,a8w8_blockscale_1x128x128_256x128x128x128_16x16_32x32_2x2_8x32x1_8x32x1_1x32x1x8_8_1x1_intrawave_v3,822.42,383.33,0.0
gfx942,304,11648,5120,8704,ck,0,0,1290.5765,a8w8_blockscale_1x128x128_256x128x128x128_16x16_32x32_2x2_8x32x1_8x32x1_1x32x1x8_8_1x1_intrawave_v3,804.43,205.51,0.0
gfx942,304,11776,5120,3072,ck,0,0,453.0669,a8w8_blockscale_1x128x128_256x128x128x128_16x16_32x32_2x2_8x32x1_8x32x1_1x32x1x8_8_1x1_intrawave_v3,817.63,380.72,0.0
gfx942,304,11776,5120,8704,ck,0,0,1286.8174,a8w8_blockscale_1x128x128_256x128x128x128_16x16_32x32_2x2_8x32x1_8x32x1_1x32x1x8_8_1x1_intrawave_v3,815.64,207.99,0.0
gfx942,304,11904,5120,3072,ck,0,0,471.5599,a8w8_blockscale_1x128x128_256x128x128x128_16x16_32x32_2x2_8x32x1_8x32x1_1x32x1x8_8_1x1_intrawave_v3,794.1,369.4,0.0
gfx942,304,11904,5120,8704,ck,0,0,1316.0203,a8w8_blockscale_1x128x128_256x128x128x128_16x16_32x32_2x2_8x32x1_8x32x1_1x32x1x8_8_1x1_intrawave_v3,806.21,205.22,0.0
gfx942,304,12032,5120,3072,ck,0,0,472.8537,a8w8_blockscale_1x128x128_256x128x128x128_16x16_32x32_2x2_8x32x1_8x32x1_1x32x1x8_8_1x1_intrawave_v3,800.45,371.99,0.0
gfx942,304,12032,5120,8704,ck,0,0,1326.2342,a8w8_blockscale_1x128x128_256x128x128x128_16x16_32x32_2x2_8x32x1_8x32x1_1x32x1x8_8_1x1_intrawave_v3,808.61,205.47,0.0
gfx942,304,12160,5120,3072,ck,0,0,473.6071,a8w8_blockscale_1x128x128_256x128x128x128_16x16_32x32_2x2_8x32x1_8x32x1_1x32x1x8_8_1x1_intrawave_v3,807.67,375.0,0.0
gfx942,304,12160,5120,8704,ck,0,0,1321.8718,a8w8_blockscale_1x128x128_256x128x128x128_16x16_32x32_2x2_8x32x1_8x32x1_1x32x1x8_8_1x1_intrawave_v3,819.9,207.98,0.0
gfx942,304,12288,5120,3072,ck,0,0,465.3114,a8w8_blockscale_1x128x128_256x128x128x128_16x16_32x32_2x2_8x32x1_8x32x1_1x32x1x8_8_1x1_intrawave_v3,830.73,385.35,0.0
gfx942,304,12288,5120,8704,ck,0,0,1350.6479,a8w8_blockscale_1x128x128_256x128x128x128_16x16_32x32_2x2_8x32x1_8x32x1_1x32x1x8_8_1x1_intrawave_v3,810.88,205.34,0.0
gfx942,304,12416,5120,3072,ck,0,0,476.6473,a8w8_blockscale_1x128x128_256x128x128x128_16x16_32x32_2x2_8x32x1_8x32x1_1x32x1x8_8_1x1_intrawave_v3,819.42,379.76,0.0
gfx942,304,12416,5120,8704,ck,0,0,1370.6412,a8w8_blockscale_1x128x128_256x128x128x128_16x16_32x32_2x2_8x32x1_8x32x1_1x32x1x8_8_1x1_intrawave_v3,807.38,204.12,0.0
gfx942,304,12544,5120,3072,ck,0,0,481.4255,a8w8_blockscale_1x128x128_256x128x128x128_16x16_32x32_2x2_8x32x1_8x32x1_1x32x1x8_8_1x1_intrawave_v3,819.65,379.53,0.0
gfx942,304,12544,5120,8704,ck,0,0,1380.5345,a8w8_blockscale_1x128x128_256x128x128x128_16x16_32x32_2x2_8x32x1_8x32x1_1x32x1x8_8_1x1_intrawave_v3,809.86,204.41,0.0
gfx942,304,12672,5120,3072,ck,0,0,494.9905,a8w8_blockscale_1x128x128_256x128x128x128_16x16_32x32_2x2_8x32x1_8x32x1_1x32x1x8_8_1x1_intrawave_v3,805.32,372.57,0.0
gfx942,304,12672,5120,8704,ck,0,0,1397.2872,a8w8_blockscale_1x128x128_256x128x128x128_16x16_32x32_2x2_8x32x1_8x32x1_1x32x1x8_8_1x1_intrawave_v3,808.31,203.7,0.0
gfx942,304,12800,5120,3072,ck,0,0,490.2507,a8w8_blockscale_1x128x128_256x128x128x128_16x16_32x32_2x2_8x32x1_8x32x1_1x32x1x8_8_1x1_intrawave_v3,821.32,379.65,0.0
gfx942,304,12800,5120,8704,ck,0,0,1415.5522,a8w8_blockscale_1x128x128_256x128x128x128_16x16_32x32_2x2_8x32x1_8x32x1_1x32x1x8_8_1x1_intrawave_v3,805.94,202.78,0.0
gfx942,304,12928,5120,3072,ck,0,0,497.7077,a8w8_blockscale_1x128x128_256x128x128x128_16x16_32x32_2x2_8x32x1_8x32x1_1x32x1x8_8_1x1_intrawave_v3,817.11,377.38,0.0
gfx942,304,12928,5120,8704,ck,0,0,1435.9539,a8w8_blockscale_1x128x128_256x128x128x128_16x16_32x32_2x2_8x32x1_8x32x1_1x32x1x8_8_1x1_intrawave_v3,802.43,201.59,0.0
gfx942,304,13056,5120,3072,ck,0,0,498.8763,a8w8_blockscale_1x128x128_256x128x128x128_16x16_32x32_2x2_8x32x1_8x32x1_1x32x1x8_8_1x1_intrawave_v3,823.26,379.91,0.0
gfx942,304,13056,5120,8704,ck,0,0,1443.1502,a8w8_blockscale_1x128x128_256x128x128x128_16x16_32x32_2x2_8x32x1_8x32x1_1x32x1x8_8_1x1_intrawave_v3,806.34,202.26,0.0
gfx942,304,13184,5120,3072,ck,0,0,507.7389,a8w8_blockscale_1x128x128_256x128x128x128_16x16_32x32_2x2_8x32x1_8x32x1_1x32x1x8_8_1x1_intrawave_v3,816.82,376.64,0.0
gfx942,304,13184,5120,8704,ck,0,0,1463.8842,a8w8_blockscale_1x128x128_256x128x128x128_16x16_32x32_2x2_8x32x1_8x32x1_1x32x1x8_8_1x1_intrawave_v3,802.71,201.06,0.0
gfx942,304,13312,5120,3072,ck,0,0,507.8952,a8w8_blockscale_1x128x128_256x128x128x128_16x16_32x32_2x2_8x32x1_8x32x1_1x32x1x8_8_1x1_intrawave_v3,824.5,379.88,0.0
gfx942,304,13312,5120,8704,ck,0,0,1456.8116,a8w8_blockscale_1x128x128_256x128x128x128_16x16_32x32_2x2_8x32x1_8x32x1_1x32x1x8_8_1x1_intrawave_v3,814.44,203.7,0.0
gfx942,304,13440,5120,3072,ck,0,0,521.0653,a8w8_blockscale_1x128x128_256x128x128x128_16x16_32x32_2x2_8x32x1_8x32x1_1x32x1x8_8_1x1_intrawave_v3,811.39,373.55,0.0
gfx942,304,13440,5120,8704,ck,0,0,1483.6812,a8w8_blockscale_1x128x128_256x128x128x128_16x16_32x32_2x2_8x32x1_8x32x1_1x32x1x8_8_1x1_intrawave_v3,807.38,201.64,0.0
gfx942,304,13568,5120,3072,ck,0,0,515.5102,a8w8_blockscale_1x128x128_256x128x128x128_16x16_32x32_2x2_8x32x1_8x32x1_1x32x1x8_8_1x1_intrawave_v3,827.94,380.88,0.0
gfx942,304,13568,5120,8704,ck,0,0,1517.5154,a8w8_blockscale_1x128x128_256x128x128x128_16x16_32x32_2x2_8x32x1_8x32x1_1x32x1x8_8_1x1_intrawave_v3,796.9,198.74,0.0
gfx942,304,13696,5120,3072,ck,0,0,528.9835,a8w8_blockscale_1x128x128_256x128x128x128_16x16_32x32_2x2_8x32x1_8x32x1_1x32x1x8_8_1x1_intrawave_v3,814.47,374.4,0.0
gfx942,304,13696,5120,8704,ck,0,0,1547.5051,a8w8_blockscale_1x128x128_256x128x128x128_16x16_32x32_2x2_8x32x1_8x32x1_1x32x1x8_8_1x1_intrawave_v3,788.82,196.46,0.0
gfx942,304,13824,5120,3072,ck,0,0,528.5611,a8w8_blockscale_1x128x128_256x128x128x128_16x16_32x32_2x2_8x32x1_8x32x1_1x32x1x8_8_1x1_intrawave_v3,822.73,377.92,0.0
gfx942,304,13824,5120,8704,ck,0,0,1502.3306,a8w8_blockscale_1x128x128_256x128x128x128_16x16_32x32_2x2_8x32x1_8x32x1_1x32x1x8_8_1x1_intrawave_v3,820.14,203.98,0.0
gfx942,304,13952,5120,3072,ck,0,0,534.3089,a8w8_blockscale_1x128x128_256x128x128x128_16x16_32x32_2x2_8x32x1_8x32x1_1x32x1x8_8_1x1_intrawave_v3,821.42,377.04,0.0
gfx942,304,13952,5120,8704,ck,0,0,1520.9183,a8w8_blockscale_1x128x128_256x128x128x128_16x16_32x32_2x2_8x32x1_8x32x1_1x32x1x8_8_1x1_intrawave_v3,817.62,203.08,0.0
gfx942,304,14080,5120,3072,ck,0,0,540.2018,a8w8_blockscale_1x128x128_256x128x128x128_16x16_32x32_2x2_8x32x1_8x32x1_1x32x1x8_8_1x1_intrawave_v3,819.91,376.08,0.0
gfx942,304,14080,5120,8704,ck,0,0,1565.8655,a8w8_blockscale_1x128x128_256x128x128x128_16x16_32x32_2x2_8x32x1_8x32x1_1x32x1x8_8_1x1_intrawave_v3,801.43,198.8,0.0
gfx942,304,14208,5120,3072,ck,0,0,542.2811,a8w8_blockscale_1x128x128_256x128x128x128_16x16_32x32_2x2_8x32x1_8x32x1_1x32x1x8_8_1x1_intrawave_v3,824.19,377.78,0.0
gfx942,304,14208,5120,8704,ck,0,0,1577.4786,a8w8_blockscale_1x128x128_256x128x128x128_16x16_32x32_2x2_8x32x1_8x32x1_1x32x1x8_8_1x1_intrawave_v3,802.76,198.87,0.0
gfx942,304,14336,5120,3072,ck,0,0,552.941,a8w8_blockscale_1x128x128_256x128x128x128_16x16_32x32_2x2_8x32x1_8x32x1_1x32x1x8_8_1x1_intrawave_v3,815.59,373.58,0.0
gfx942,304,14336,5120,8704,ck,0,0,1573.5923,a8w8_blockscale_1x128x128_256x128x128x128_16x16_32x32_2x2_8x32x1_8x32x1_1x32x1x8_8_1x1_intrawave_v3,812.0,200.91,0.0
gfx942,304,14464,5120,3072,ck,0,0,557.5572,a8w8_blockscale_1x128x128_256x128x128x128_16x16_32x32_2x2_8x32x1_8x32x1_1x32x1x8_8_1x1_intrawave_v3,816.06,373.55,0.0
gfx942,304,14464,5120,8704,ck,0,0,1595.0408,a8w8_blockscale_1x128x128_256x128x128x128_16x16_32x32_2x2_8x32x1_8x32x1_1x32x1x8_8_1x1_intrawave_v3,808.23,199.73,0.0
gfx942,304,14592,5120,3072,ck,0,0,555.2464,a8w8_blockscale_1x128x128_256x128x128x128_16x16_32x32_2x2_8x32x1_8x32x1_1x32x1x8_8_1x1_intrawave_v3,826.7,378.17,0.0
gfx942,304,14592,5120,8704,ck,0,0,1626.1098,a8w8_blockscale_1x128x128_256x128x128x128_16x16_32x32_2x2_8x32x1_8x32x1_1x32x1x8_8_1x1_intrawave_v3,799.8,197.4,0.0
gfx942,304,14720,5120,3072,ck,0,0,575.958,a8w8_blockscale_1x128x128_256x128x128x128_16x16_32x32_2x2_8x32x1_8x32x1_1x32x1x8_8_1x1_intrawave_v3,803.97,367.53,0.0
gfx942,304,14720,5120,8704,ck,0,0,1637.9881,a8w8_blockscale_1x128x128_256x128x128x128_16x16_32x32_2x2_8x32x1_8x32x1_1x32x1x8_8_1x1_intrawave_v3,800.97,197.45,0.0
gfx942,304,14848,5120,3072,ck,0,0,573.1663,a8w8_blockscale_1x128x128_256x128x128x128_16x16_32x32_2x2_8x32x1_8x32x1_1x32x1x8_8_1x1_intrawave_v3,814.91,372.29,0.0
gfx942,304,14848,5120,8704,ck,0,0,1657.2715,a8w8_blockscale_1x128x128_256x128x128x128_16x16_32x32_2x2_8x32x1_8x32x1_1x32x1x8_8_1x1_intrawave_v3,798.53,196.62,0.0
gfx942,304,14976,5120,3072,ck,0,0,581.0024,a8w8_blockscale_1x128x128_256x128x128x128_16x16_32x32_2x2_8x32x1_8x32x1_1x32x1x8_8_1x1_intrawave_v3,810.85,370.2,0.0
gfx942,304,14976,5120,8704,ck,0,0,1646.9908,a8w8_blockscale_1x128x128_256x128x128x128_16x16_32x32_2x2_8x32x1_8x32x1_1x32x1x8_8_1x1_intrawave_v3,810.44,199.31,0.0
gfx942,304,15104,5120,3072,ck,0,0,581.0981,a8w8_blockscale_1x128x128_256x128x128x128_16x16_32x32_2x2_8x32x1_8x32x1_1x32x1x8_8_1x1_intrawave_v3,817.64,373.07,0.0
gfx942,304,15104,5120,8704,ck,0,0,1675.7252,a8w8_blockscale_1x128x128_256x128x128x128_16x16_32x32_2x2_8x32x1_8x32x1_1x32x1x8_8_1x1_intrawave_v3,803.36,197.34,0.0
gfx942,304,15232,5120,3072,ck,0,0,582.242,a8w8_blockscale_1x128x128_256x128x128x128_16x16_32x32_2x2_8x32x1_8x32x1_1x32x1x8_8_1x1_intrawave_v3,822.95,375.27,0.0
gfx942,304,15232,5120,8704,ck,0,0,1700.126,a8w8_blockscale_1x128x128_256x128x128x128_16x16_32x32_2x2_8x32x1_8x32x1_1x32x1x8_8_1x1_intrawave_v3,798.54,195.94,0.0
gfx942,304,15360,5120,3072,ck,0,0,574.8275,a8w8_blockscale_1x128x128_256x128x128x128_16x16_32x32_2x2_8x32x1_8x32x1_1x32x1x8_8_1x1_intrawave_v3,840.57,383.07,0.0
gfx942,304,15360,5120,8704,ck,0,0,1707.5924,a8w8_blockscale_1x128x128_256x128x128x128_16x16_32x32_2x2_8x32x1_8x32x1_1x32x1x8_8_1x1_intrawave_v3,801.73,196.5,0.0
gfx942,304,15488,5120,3072,ck,0,0,582.2615,a8w8_blockscale_1x128x128_256x128x128x128_16x16_32x32_2x2_8x32x1_8x32x1_1x32x1x8_8_1x1_intrawave_v3,836.76,381.11,0.0
gfx942,304,15488,5120,8704,ck,0,0,1718.5259,a8w8_blockscale_1x128x128_256x128x128x128_16x16_32x32_2x2_8x32x1_8x32x1_1x32x1x8_8_1x1_intrawave_v3,803.26,196.66,0.0
gfx942,304,15616,5120,3072,ck,0,0,600.1513,a8w8_blockscale_1x128x128_256x128x128x128_16x16_32x32_2x2_8x32x1_8x32x1_1x32x1x8_8_1x1_intrawave_v3,818.52,372.59,0.0
gfx942,304,15616,5120,8704,ck,0,0,1736.2221,a8w8_blockscale_1x128x128_256x128x128x128_16x16_32x32_2x2_8x32x1_8x32x1_1x32x1x8_8_1x1_intrawave_v3,801.65,196.05,0.0
gfx942,304,15744,5120,3072,ck,0,0,604.5094,a8w8_blockscale_1x128x128_256x128x128x128_16x16_32x32_2x2_8x32x1_8x32x1_1x32x1x8_8_1x1_intrawave_v3,819.28,372.72,0.0
gfx942,304,15744,5120,8704,ck,0,0,1757.279,a8w8_blockscale_1x128x128_256x128x128x128_16x16_32x32_2x2_8x32x1_8x32x1_1x32x1x8_8_1x1_intrawave_v3,798.53,195.09,0.0
gfx942,304,15872,5120,3072,ck,0,0,603.7159,a8w8_blockscale_1x128x128_256x128x128x128_16x16_32x32_2x2_8x32x1_8x32x1_1x32x1x8_8_1x1_intrawave_v3,827.03,376.03,0.0
gfx942,304,15872,5120,8704,ck,0,0,1731.686,a8w8_blockscale_1x128x128_256x128x128x128_16x16_32x32_2x2_8x32x1_8x32x1_1x32x1x8_8_1x1_intrawave_v3,816.92,199.37,0.0
gfx942,304,16000,5120,3072,ck,0,0,611.9275,a8w8_blockscale_1x128x128_256x128x128x128_16x16_32x32_2x2_8x32x1_8x32x1_1x32x1x8_8_1x1_intrawave_v3,822.51,373.77,0.0
gfx942,304,16000,5120,8704,ck,0,0,1760.9999,a8w8_blockscale_1x128x128_256x128x128x128_16x16_32x32_2x2_8x32x1_8x32x1_1x32x1x8_8_1x1_intrawave_v3,809.8,197.43,0.0
gfx942,304,16128,5120,3072,ck,0,0,619.8422,a8w8_blockscale_1x128x128_256x128x128x128_16x16_32x32_2x2_8x32x1_8x32x1_1x32x1x8_8_1x1_intrawave_v3,818.5,371.75,0.0
gfx942,304,16128,5120,8704,ck,0,0,1813.5256,a8w8_blockscale_1x128x128_256x128x128x128_16x16_32x32_2x2_8x32x1_8x32x1_1x32x1x8_8_1x1_intrawave_v3,792.64,193.05,0.0
gfx942,304,16256,5120,3072,ck,0,0,617.7978,a8w8_blockscale_1x128x128_256x128x128x128_16x16_32x32_2x2_8x32x1_8x32x1_1x32x1x8_8_1x1_intrawave_v3,827.73,375.74,0.0
gfx942,304,16256,5120,8704,ck,0,0,1820.3662,a8w8_blockscale_1x128x128_256x128x128x128_16x16_32x32_2x2_8x32x1_8x32x1_1x32x1x8_8_1x1_intrawave_v3,795.93,193.65,0.0
gfx942,304,16384,5120,3072,ck,0,0,616.9338,a8w8_blockscale_1x128x128_256x128x128x128_16x16_32x32_2x2_8x32x1_8x32x1_1x32x1x8_8_1x1_intrawave_v3,835.42,379.02,0.0
gfx942,304,16384,5120,8704,ck,0,0,1802.2169,a8w8_blockscale_1x128x128_256x128x128x128_16x16_32x32_2x2_8x32x1_8x32x1_1x32x1x8_8_1x1_intrawave_v3,810.27,196.95,0.0
gfx942,304,16512,5120,3072,ck,0,0,637.2856,a8w8_blockscale_1x128x128_256x128x128x128_16x16_32x32_2x2_8x32x1_8x32x1_1x32x1x8_8_1x1_intrawave_v3,815.05,369.59,0.0
gfx942,304,16512,5120,8704,ck,0,0,1822.763,a8w8_blockscale_1x128x128_256x128x128x128_16x16_32x32_2x2_8x32x1_8x32x1_1x32x1x8_8_1x1_intrawave_v3,807.4,196.06,0.0
gfx942,304,16640,5120,3072,ck,0,0,638.0799,a8w8_blockscale_1x128x128_256x128x128x128_16x16_32x32_2x2_8x32x1_8x32x1_1x32x1x8_8_1x1_intrawave_v3,820.35,371.8,0.0
gfx942,304,16640,5120,8704,ck,0,0,1871.1671,a8w8_blockscale_1x128x128_256x128x128x128_16x16_32x32_2x2_8x32x1_8x32x1_1x32x1x8_8_1x1_intrawave_v3,792.61,192.28,0.0
gfx942,304,16768,5120,3072,ck,0,0,650.059,a8w8_blockscale_1x128x128_256x128x128x128_16x16_32x32_2x2_8x32x1_8x32x1_1x32x1x8_8_1x1_intrawave_v3,811.43,367.57,0.0
gfx942,304,16768,5120,8704,ck,0,0,1871.1871,a8w8_blockscale_1x128x128_256x128x128x128_16x16_32x32_2x2_8x32x1_8x32x1_1x32x1x8_8_1x1_intrawave_v3,798.7,193.58,0.0
gfx942,304,16896,5120,3072,ck,0,0,640.9564,a8w8_blockscale_1x128x128_256x128x128x128_16x16_32x32_2x2_8x32x1_8x32x1_1x32x1x8_8_1x1_intrawave_v3,829.23,375.45,0.0
gfx942,304,16896,5120,8704,ck,0,0,1888.7537,a8w8_blockscale_1x128x128_256x128x128x128_16x16_32x32_2x2_8x32x1_8x32x1_1x32x1x8_8_1x1_intrawave_v3,797.31,193.06,0.0
gfx942,304,17024,5120,3072,ck,0,0,647.2382,a8w8_blockscale_1x128x128_256x128x128x128_16x16_32x32_2x2_8x32x1_8x32x1_1x32x1x8_8_1x1_intrawave_v3,827.41,374.44,0.0
gfx942,304,17024,5120,8704,ck,0,0,1902.6326,a8w8_blockscale_1x128x128_256x128x128x128_16x16_32x32_2x2_8x32x1_8x32x1_1x32x1x8_8_1x1_intrawave_v3,797.49,192.93,0.0
gfx942,304,17152,5120,3072,ck,0,0,653.6232,a8w8_blockscale_1x128x128_256x128x128x128_16x16_32x32_2x2_8x32x1_8x32x1_1x32x1x8_8_1x1_intrawave_v3,825.48,373.39,0.0
gfx942,304,17152,5120,8704,ck,0,0,1916.9818,a8w8_blockscale_1x128x128_256x128x128x128_16x16_32x32_2x2_8x32x1_8x32x1_1x32x1x8_8_1x1_intrawave_v3,797.47,192.75,0.0
gfx942,304,17280,5120,3072,ck,0,0,664.4856,a8w8_blockscale_1x128x128_256x128x128x128_16x16_32x32_2x2_8x32x1_8x32x1_1x32x1x8_8_1x1_intrawave_v3,818.05,369.85,0.0
gfx942,304,17280,5120,8704,ck,0,0,1951.4821,a8w8_blockscale_1x128x128_256x128x128x128_16x16_32x32_2x2_8x32x1_8x32x1_1x32x1x8_8_1x1_intrawave_v3,789.22,190.58,0.0
gfx942,304,17408,5120,3072,ck,0,0,657.0462,a8w8_blockscale_1x128x128_256x128x128x128_16x16_32x32_2x2_8x32x1_8x32x1_1x32x1x8_8_1x1_intrawave_v3,833.44,376.63,0.0
gfx942,304,17408,5120,8704,ck,0,0,1948.7224,a8w8_blockscale_1x128x128_256x128x128x128_16x16_32x32_2x2_8x32x1_8x32x1_1x32x1x8_8_1x1_intrawave_v3,796.19,192.1,0.0
gfx942,304,17536,5120,3072,ck,0,0,671.2371,a8w8_blockscale_1x128x128_256x128x128x128_16x16_32x32_2x2_8x32x1_8x32x1_1x32x1x8_8_1x1_intrawave_v3,821.82,371.21,0.0
gfx942,304,17536,5120,8704,ck,0,0,1970.6495,a8w8_blockscale_1x128x128_256x128x128x128_16x16_32x32_2x2_8x32x1_8x32x1_1x32x1x8_8_1x1_intrawave_v3,793.12,191.19,0.0
gfx942,304,17664,5120,3072,ck,0,0,677.9117,a8w8_blockscale_1x128x128_256x128x128x128_16x16_32x32_2x2_8x32x1_8x32x1_1x32x1x8_8_1x1_intrawave_v3,819.67,370.07,0.0
gfx942,304,17664,5120,8704,ck,0,0,2002.1232,a8w8_blockscale_1x128x128_256x128x128x128_16x16_32x32_2x2_8x32x1_8x32x1_1x32x1x8_8_1x1_intrawave_v3,786.35,189.39,0.0
gfx942,304,17792,5120,3072,ck,0,0,675.6398,a8w8_blockscale_1x128x128_256x128x128x128_16x16_32x32_2x2_8x32x1_8x32x1_1x32x1x8_8_1x1_intrawave_v3,828.38,373.83,0.0
gfx942,304,17792,5120,8704,ck,0,0,2009.35,a8w8_blockscale_1x128x128_256x128x128x128_16x16_32x32_2x2_8x32x1_8x32x1_1x32x1x8_8_1x1_intrawave_v3,789.2,189.92,0.0
gfx942,304,17920,5120,3072,ck,0,0,673.4009,a8w8_blockscale_1x128x128_256x128x128x128_16x16_32x32_2x2_8x32x1_8x32x1_1x32x1x8_8_1x1_intrawave_v3,837.12,377.61,0.0
gfx942,304,17920,5120,8704,ck,0,0,1986.7323,a8w8_blockscale_1x128x128_256x128x128x128_16x16_32x32_2x2_8x32x1_8x32x1_1x32x1x8_8_1x1_intrawave_v3,803.93,193.3,0.0
gfx942,304,18048,5120,3072,ck,0,0,680.2354,a8w8_blockscale_1x128x128_256x128x128x128_16x16_32x32_2x2_8x32x1_8x32x1_1x32x1x8_8_1x1_intrawave_v3,834.62,376.32,0.0
gfx942,304,18048,5120,8704,ck,0,0,1980.9376,a8w8_blockscale_1x128x128_256x128x128x128_16x16_32x32_2x2_8x32x1_8x32x1_1x32x1x8_8_1x1_intrawave_v3,812.04,195.09,0.0
gfx942,304,18176,5120,3072,ck,0,0,698.5202,a8w8_blockscale_1x128x128_256x128x128x128_16x16_32x32_2x2_8x32x1_8x32x1_1x32x1x8_8_1x1_intrawave_v3,818.54,368.9,0.0
gfx942,304,18176,5120,8704,ck,0,0,2003.866,a8w8_blockscale_1x128x128_256x128x128x128_16x16_32x32_2x2_8x32x1_8x32x1_1x32x1x8_8_1x1_intrawave_v3,808.44,194.07,0.0
gfx942,304,18304,5120,3072,ck,0,0,697.1529,a8w8_blockscale_1x128x128_256x128x128x128_16x16_32x32_2x2_8x32x1_8x32x1_1x32x1x8_8_1x1_intrawave_v3,825.92,372.07,0.0
gfx942,304,18304,5120,8704,ck,0,0,2084.3985,a8w8_blockscale_1x128x128_256x128x128x128_16x16_32x32_2x2_8x32x1_8x32x1_1x32x1x8_8_1x1_intrawave_v3,782.68,187.74,0.0
gfx942,304,18432,5120,3072,ck,0,0,699.9494,a8w8_blockscale_1x128x128_256x128x128x128_16x16_32x32_2x2_8x32x1_8x32x1_1x32x1x8_8_1x1_intrawave_v3,828.38,373.02,0.0
gfx942,304,18432,5120,8704,ck,0,0,2075.1473,a8w8_blockscale_1x128x128_256x128x128x128_16x16_32x32_2x2_8x32x1_8x32x1_1x32x1x8_8_1x1_intrawave_v3,791.67,189.74,0.0
gfx942,304,18560,5120,3072,ck,0,0,714.9676,a8w8_blockscale_1x128x128_256x128x128x128_16x16_32x32_2x2_8x32x1_8x32x1_1x32x1x8_8_1x1_intrawave_v3,816.61,367.57,0.0
gfx942,304,18560,5120,8704,ck,0,0,2038.1398,a8w8_blockscale_1x128x128_256x128x128x128_16x16_32x32_2x2_8x32x1_8x32x1_1x32x1x8_8_1x1_intrawave_v3,811.64,194.38,0.0
gfx942,304,18688,5120,3072,ck,0,0,717.9055,a8w8_blockscale_1x128x128_256x128x128x128_16x16_32x32_2x2_8x32x1_8x32x1_1x32x1x8_8_1x1_intrawave_v3,818.87,368.44,0.0
gfx942,304,18688,5120,8704,ck,0,0,2075.817,a8w8_blockscale_1x128x128_256x128x128x128_16x16_32x32_2x2_8x32x1_8x32x1_1x32x1x8_8_1x1_intrawave_v3,802.4,192.02,0.0
gfx942,304,18816,5120,3072,ck,0,0,708.1684,a8w8_blockscale_1x128x128_256x128x128x128_16x16_32x32_2x2_8x32x1_8x32x1_1x32x1x8_8_1x1_intrawave_v3,835.82,375.91,0.0
gfx942,304,18816,5120,8704,ck,0,0,2110.0321,a8w8_blockscale_1x128x128_256x128x128x128_16x16_32x32_2x2_8x32x1_8x32x1_1x32x1x8_8_1x1_intrawave_v3,794.8,190.05,0.0
gfx942,304,18944,5120,3072,ck,0,0,721.2757,a8w8_blockscale_1x128x128_256x128x128x128_16x16_32x32_2x2_8x32x1_8x32x1_1x32x1x8_8_1x1_intrawave_v3,826.21,371.44,0.0
gfx942,304,18944,5120,8704,ck,0,0,2109.9379,a8w8_blockscale_1x128x128_256x128x128x128_16x16_32x32_2x2_8x32x1_8x32x1_1x32x1x8_8_1x1_intrawave_v3,800.24,191.21,0.0
gfx942,304,19072,5120,3072,ck,0,0,726.9314,a8w8_blockscale_1x128x128_256x128x128x128_16x16_32x32_2x2_8x32x1_8x32x1_1x32x1x8_8_1x1_intrawave_v3,825.32,370.89,0.0
gfx942,304,19072,5120,8704,ck,0,0,2177.982,a8w8_blockscale_1x128x128_256x128x128x128_16x16_32x32_2x2_8x32x1_8x32x1_1x32x1x8_8_1x1_intrawave_v3,780.48,186.35,0.0
gfx942,304,19200,5120,3072,ck,0,0,730.3933,a8w8_blockscale_1x128x128_256x128x128x128_16x16_32x32_2x2_8x32x1_8x32x1_1x32x1x8_8_1x1_intrawave_v3,826.92,371.47,0.0
gfx942,304,19200,5120,8704,ck,0,0,2166.2111,a8w8_blockscale_1x128x128_256x128x128x128_16x16_32x32_2x2_8x32x1_8x32x1_1x32x1x8_8_1x1_intrawave_v3,789.99,188.48,0.0
gfx942,304,19328,5120,3072,ck,0,0,735.6218,a8w8_blockscale_1x128x128_256x128x128x128_16x16_32x32_2x2_8x32x1_8x32x1_1x32x1x8_8_1x1_intrawave_v3,826.52,371.15,0.0
gfx942,304,19328,5120,8704,ck,0,0,2190.2884,a8w8_blockscale_1x128x128_256x128x128x128_16x16_32x32_2x2_8x32x1_8x32x1_1x32x1x8_8_1x1_intrawave_v3,786.51,187.52,0.0
gfx942,304,19456,5120,3072,ck,0,0,742.8501,a8w8_blockscale_1x128x128_256x128x128x128_16x16_32x32_2x2_8x32x1_8x32x1_1x32x1x8_8_1x1_intrawave_v3,823.9,369.83,0.0
gfx942,304,19456,5120,8704,ck,0,0,2132.0121,a8w8_blockscale_1x128x128_256x128x128x128_16x16_32x32_2x2_8x32x1_8x32x1_1x32x1x8_8_1x1_intrawave_v3,813.36,193.78,0.0
gfx942,304,19584,5120,3072,ck,0,0,752.8041,a8w8_blockscale_1x128x128_256x128x128x128_16x16_32x32_2x2_8x32x1_8x32x1_1x32x1x8_8_1x1_intrawave_v3,818.35,367.2,0.0
gfx942,304,19584,5120,8704,ck,0,0,2159.3313,a8w8_blockscale_1x128x128_256x128x128x128_16x16_32x32_2x2_8x32x1_8x32x1_1x32x1x8_8_1x1_intrawave_v3,808.35,192.45,0.0
gfx942,304,19712,5120,3072,ck,0,0,755.8799,a8w8_blockscale_1x128x128_256x128x128x128_16x16_32x32_2x2_8x32x1_8x32x1_1x32x1x8_8_1x1_intrawave_v3,820.35,367.96,0.0
gfx942,304,19712,5120,8704,ck,0,0,2203.0928,a8w8_blockscale_1x128x128_256x128x128x128_16x16_32x32_2x2_8x32x1_8x32x1_1x32x1x8_8_1x1_intrawave_v3,797.47,189.73,0.0
gfx942,304,19840,5120,3072,ck,0,0,747.1108,a8w8_blockscale_1x128x128_256x128x128x128_16x16_32x32_2x2_8x32x1_8x32x1_1x32x1x8_8_1x1_intrawave_v3,835.37,374.56,0.0
gfx942,304,19840,5120,8704,ck,0,0,2247.4703,a8w8_blockscale_1x128x128_256x128x128x128_16x16_32x32_2x2_8x32x1_8x32x1_1x32x1x8_8_1x1_intrawave_v3,786.8,187.06,0.0
gfx942,304,19968,5120,3072,ck,0,0,740.9637,a8w8_blockscale_1x128x128_256x128x128x128_16x16_32x32_2x2_8x32x1_8x32x1_1x32x1x8_8_1x1_intrawave_v3,847.73,379.97,0.0
gfx942,304,19968,5120,8704,ck,0,0,2225.7181,a8w8_blockscale_1x128x128_256x128x128x128_16x16_32x32_2x2_8x32x1_8x32x1_1x32x1x8_8_1x1_intrawave_v3,799.62,189.98,0.0
gfx942,304,20096,5120,3072,ck,0,0,760.6925,a8w8_blockscale_1x128x128_256x128x128x128_16x16_32x32_2x2_8x32x1_8x32x1_1x32x1x8_8_1x1_intrawave_v3,831.04,372.35,0.0
gfx942,304,20096,5120,8704,ck,0,0,2218.1581,a8w8_blockscale_1x128x128_256x128x128x128_16x16_32x32_2x2_8x32x1_8x32x1_1x32x1x8_8_1x1_intrawave_v3,807.49,191.72,0.0
gfx942,304,20224,5120,3072,ck,0,0,760.1054,a8w8_blockscale_1x128x128_256x128x128x128_16x16_32x32_2x2_8x32x1_8x32x1_1x32x1x8_8_1x1_intrawave_v3,836.98,374.88,0.0
gfx942,304,20224,5120,8704,ck,0,0,2224.8685,a8w8_blockscale_1x128x128_256x128x128x128_16x16_32x32_2x2_8x32x1_8x32x1_1x32x1x8_8_1x1_intrawave_v3,810.18,192.23,0.0
gfx942,304,20352,5120,3072,ck,0,0,789.2939,a8w8_blockscale_1x128x128_256x128x128x128_16x16_32x32_2x2_8x32x1_8x32x1_1x32x1x8_8_1x1_intrawave_v3,811.13,363.18,0.0
gfx942,304,20352,5120,8704,ck,0,0,2260.5337,a8w8_blockscale_1x128x128_256x128x128x128_16x16_32x32_2x2_8x32x1_8x32x1_1x32x1x8_8_1x1_intrawave_v3,802.44,190.27,0.0
gfx942,304,20480,5120,3072,ck,0,0,783.5843,a8w8_blockscale_1x128x128_256x128x128x128_16x16_32x32_2x2_8x32x1_8x32x1_1x32x1x8_8_1x1_intrawave_v3,822.18,368.0,0.0
gfx942,304,20480,5120,8704,ck,0,0,2280.7481,a8w8_blockscale_1x128x128_256x128x128x128_16x16_32x32_2x2_8x32x1_8x32x1_1x32x1x8_8_1x1_intrawave_v3,800.33,189.65,0.0
gfx942,304,20608,5120,3072,ck,0,0,786.1327,a8w8_blockscale_1x128x128_256x128x128x128_16x16_32x32_2x2_8x32x1_8x32x1_1x32x1x8_8_1x1_intrawave_v3,824.63,368.97,0.0
gfx942,304,20608,5120,8704,ck,0,0,2315.9645,a8w8_blockscale_1x128x128_256x128x128x128_16x16_32x32_2x2_8x32x1_8x32x1_1x32x1x8_8_1x1_intrawave_v3,793.09,187.81,0.0
gfx942,304,20736,5120,3072,ck,0,0,787.7138,a8w8_blockscale_1x128x128_256x128x128x128_16x16_32x32_2x2_8x32x1_8x32x1_1x32x1x8_8_1x1_intrawave_v3,828.09,370.4,0.0
gfx942,304,20736,5120,8704,ck,0,0,2321.9891,a8w8_blockscale_1x128x128_256x128x128x128_16x16_32x32_2x2_8x32x1_8x32x1_1x32x1x8_8_1x1_intrawave_v3,795.95,188.37,0.0
gfx942,304,20864,5120,3072,ck,0,0,788.6387,a8w8_blockscale_1x128x128_256x128x128x128_16x16_32x32_2x2_8x32x1_8x32x1_1x32x1x8_8_1x1_intrawave_v3,832.22,372.12,0.0
gfx942,304,20864,5120,8704,ck,0,0,2335.3246,a8w8_blockscale_1x128x128_256x128x128x128_16x16_32x32_2x2_8x32x1_8x32x1_1x32x1x8_8_1x1_intrawave_v3,796.29,188.33,0.0
gfx942,304,20992,5120,3072,ck,0,0,788.6269,a8w8_blockscale_1x128x128_256x128x128x128_16x16_32x32_2x2_8x32x1_8x32x1_1x32x1x8_8_1x1_intrawave_v3,837.34,374.29,0.0
gfx942,304,20992,5120,8704,ck,0,0,2278.6468,a8w8_blockscale_1x128x128_256x128x128x128_16x16_32x32_2x2_8x32x1_8x32x1_1x32x1x8_8_1x1_intrawave_v3,821.1,194.08,0.0
gfx942,304,21120,5120,3072,ck,0,0,809.8022,a8w8_blockscale_1x128x128_256x128x128x128_16x16_32x32_2x2_8x32x1_8x32x1_1x32x1x8_8_1x1_intrawave_v3,820.42,366.61,0.0
gfx942,304,21120,5120,8704,ck,0,0,2331.0837,a8w8_blockscale_1x128x128_256x128x128x128_16x16_32x32_2x2_8x32x1_8x32x1_1x32x1x8_8_1x1_intrawave_v3,807.52,190.75,0.0
gfx942,304,21248,5120,3072,ck,0,0,805.7271,a8w8_blockscale_1x128x128_256x128x128x128_16x16_32x32_2x2_8x32x1_8x32x1_1x32x1x8_8_1x1_intrawave_v3,829.57,370.57,0.0
gfx942,304,21248,5120,8704,ck,0,0,2348.2745,a8w8_blockscale_1x128x128_256x128x128x128_16x16_32x32_2x2_8x32x1_8x32x1_1x32x1x8_8_1x1_intrawave_v3,806.47,190.39,0.0
gfx942,304,21376,5120,3072,ck,0,0,818.2729,a8w8_blockscale_1x128x128_256x128x128x128_16x16_32x32_2x2_8x32x1_8x32x1_1x32x1x8_8_1x1_intrawave_v3,821.77,366.98,0.0
gfx942,304,21376,5120,8704,ck,0,0,2366.1499,a8w8_blockscale_1x128x128_256x128x128x128_16x16_32x32_2x2_8x32x1_8x32x1_1x32x1x8_8_1x1_intrawave_v3,805.2,189.98,0.0
gfx942,304,21504,5120,3072,ck,0,0,811.8023,a8w8_blockscale_1x128x128_256x128x128x128_16x16_32x32_2x2_8x32x1_8x32x1_1x32x1x8_8_1x1_intrawave_v3,833.28,372.0,0.0
gfx942,304,21504,5120,8704,ck,0,0,2411.2444,a8w8_blockscale_1x128x128_256x128x128x128_16x16_32x32_2x2_8x32x1_8x32x1_1x32x1x8_8_1x1_intrawave_v3,794.87,187.43,0.0
gfx942,304,21632,5120,3072,ck,0,0,824.6876,a8w8_blockscale_1x128x128_256x128x128x128_16x16_32x32_2x2_8x32x1_8x32x1_1x32x1x8_8_1x1_intrawave_v3,825.14,368.25,0.0
gfx942,304,21632,5120,8704,ck,0,0,2393.7443,a8w8_blockscale_1x128x128_256x128x128x128_16x16_32x32_2x2_8x32x1_8x32x1_1x32x1x8_8_1x1_intrawave_v3,805.45,189.81,0.0
gfx942,304,21760,5120,3072,ck,0,0,822.4595,a8w8_blockscale_1x128x128_256x128x128x128_16x16_32x32_2x2_8x32x1_8x32x1_1x32x1x8_8_1x1_intrawave_v3,832.27,371.32,0.0
gfx942,304,21760,5120,8704,ck,0,0,2438.4861,a8w8_blockscale_1x128x128_256x128x128x128_16x16_32x32_2x2_8x32x1_8x32x1_1x32x1x8_8_1x1_intrawave_v3,795.35,187.32,0.0
gfx942,304,21888,5120,3072,ck,0,0,824.7203,a8w8_blockscale_1x128x128_256x128x128x128_16x16_32x32_2x2_8x32x1_8x32x1_1x32x1x8_8_1x1_intrawave_v3,834.87,372.37,0.0
gfx942,304,21888,5120,8704,ck,0,0,2457.7246,a8w8_blockscale_1x128x128_256x128x128x128_16x16_32x32_2x2_8x32x1_8x32x1_1x32x1x8_8_1x1_intrawave_v3,793.76,186.84,0.0
gfx942,304,22016,5120,3072,ck,0,0,831.5982,a8w8_blockscale_1x128x128_256x128x128x128_16x16_32x32_2x2_8x32x1_8x32x1_1x32x1x8_8_1x1_intrawave_v3,832.81,371.34,0.0
gfx942,304,22016,5120,8704,ck,0,0,2444.0458,a8w8_blockscale_1x128x128_256x128x128x128_16x16_32x32_2x2_8x32x1_8x32x1_1x32x1x8_8_1x1_intrawave_v3,802.87,188.88,0.0
gfx942,304,22144,5120,3072,ck,0,0,841.6434,a8w8_blockscale_1x128x128_256x128x128x128_16x16_32x32_2x2_8x32x1_8x32x1_1x32x1x8_8_1x1_intrawave_v3,827.65,368.93,0.0
gfx942,304,22144,5120,8704,ck,0,0,2424.8998,a8w8_blockscale_1x128x128_256x128x128x128_16x16_32x32_2x2_8x32x1_8x32x1_1x32x1x8_8_1x1_intrawave_v3,813.92,191.37,0.0
gfx942,304,22272,5120,3072,ck,0,0,832.9911,a8w8_blockscale_1x128x128_256x128x128x128_16x16_32x32_2x2_8x32x1_8x32x1_1x32x1x8_8_1x1_intrawave_v3,841.09,374.81,0.0
gfx942,304,22272,5120,8704,ck,0,0,2493.4175,a8w8_blockscale_1x128x128_256x128x128x128_16x16_32x32_2x2_8x32x1_8x32x1_1x32x1x8_8_1x1_intrawave_v3,796.13,187.09,0.0
gfx942,304,22400,5120,3072,ck,0,0,864.171,a8w8_blockscale_1x128x128_256x128x128x128_16x16_32x32_2x2_8x32x1_8x32x1_1x32x1x8_8_1x1_intrawave_v3,815.4,363.26,0.0
gfx942,304,22400,5120,8704,ck,0,0,2496.7828,a8w8_blockscale_1x128x128_256x128x128x128_16x16_32x32_2x2_8x32x1_8x32x1_1x32x1x8_8_1x1_intrawave_v3,799.62,187.81,0.0
gfx942,304,22528,5120,3072,ck,0,0,860.7134,a8w8_blockscale_1x128x128_256x128x128x128_16x16_32x32_2x2_8x32x1_8x32x1_1x32x1x8_8_1x1_intrawave_v3,823.35,366.7,0.0
gfx942,304,22528,5120,8704,ck,0,0,2536.6443,a8w8_blockscale_1x128x128_256x128x128x128_16x16_32x32_2x2_8x32x1_8x32x1_1x32x1x8_8_1x1_intrawave_v3,791.56,185.81,0.0
gfx942,304,22656,5120,3072,ck,0,0,870.185,a8w8_blockscale_1x128x128_256x128x128x128_16x16_32x32_2x2_8x32x1_8x32x1_1x32x1x8_8_1x1_intrawave_v3,819.02,364.66,0.0
gfx942,304,22656,5120,8704,ck,0,0,2540.064,a8w8_blockscale_1x128x128_256x128x128x128_16x16_32x32_2x2_8x32x1_8x32x1_1x32x1x8_8_1x1_intrawave_v3,794.98,186.51,0.0
gfx942,304,22784,5120,3072,ck,0,0,849.9297,a8w8_blockscale_1x128x128_256x128x128x128_16x16_32x32_2x2_8x32x1_8x32x1_1x32x1x8_8_1x1_intrawave_v3,843.27,375.36,0.0
gfx942,304,22784,5120,8704,ck,0,0,2561.6866,a8w8_blockscale_1x128x128_256x128x128x128_16x16_32x32_2x2_8x32x1_8x32x1_1x32x1x8_8_1x1_intrawave_v3,792.73,185.89,0.0
gfx942,304,22912,5120,3072,ck,0,0,865.1208,a8w8_blockscale_1x128x128_256x128x128x128_16x16_32x32_2x2_8x32x1_8x32x1_1x32x1x8_8_1x1_intrawave_v3,833.12,370.74,0.0
gfx942,304,22912,5120,8704,ck,0,0,2560.1962,a8w8_blockscale_1x128x128_256x128x128x128_16x16_32x32_2x2_8x32x1_8x32x1_1x32x1x8_8_1x1_intrawave_v3,797.64,186.94,0.0
gfx942,304,23040,5120,3072,ck,0,0,862.5092,a8w8_blockscale_1x128x128_256x128x128x128_16x16_32x32_2x2_8x32x1_8x32x1_1x32x1x8_8_1x1_intrawave_v3,840.31,373.84,0.0
gfx942,304,23040,5120,8704,ck,0,0,2526.2944,a8w8_blockscale_1x128x128_256x128x128x128_16x16_32x32_2x2_8x32x1_8x32x1_1x32x1x8_8_1x1_intrawave_v3,812.86,190.41,0.0
gfx942,304,23168,5120,3072,ck,0,0,881.4857,a8w8_blockscale_1x128x128_256x128x128x128_16x16_32x32_2x2_8x32x1_8x32x1_1x32x1x8_8_1x1_intrawave_v3,826.79,367.72,0.0
gfx942,304,23168,5120,8704,ck,0,0,2625.1807,a8w8_blockscale_1x128x128_256x128x128x128_16x16_32x32_2x2_8x32x1_8x32x1_1x32x1x8_8_1x1_intrawave_v3,786.59,184.16,0.0
gfx942,304,23296,5120,3072,ck,0,0,888.2611,a8w8_blockscale_1x128x128_256x128x128x128_16x16_32x32_2x2_8x32x1_8x32x1_1x32x1x8_8_1x1_intrawave_v3,825.02,366.83,0.0
gfx942,304,23296,5120,8704,ck,0,0,2610.9835,a8w8_blockscale_1x128x128_256x128x128x128_16x16_32x32_2x2_8x32x1_8x32x1_1x32x1x8_8_1x1_intrawave_v3,795.24,186.09,0.0
gfx942,304,23424,5120,3072,ck,0,0,901.0919,a8w8_blockscale_1x128x128_256x128x128x128_16x16_32x32_2x2_8x32x1_8x32x1_1x32x1x8_8_1x1_intrawave_v3,817.74,363.5,0.0
gfx942,304,23424,5120,8704,ck,0,0,2587.9261,a8w8_blockscale_1x128x128_256x128x128x128_16x16_32x32_2x2_8x32x1_8x32x1_1x32x1x8_8_1x1_intrawave_v3,806.73,188.69,0.0
gfx942,304,23552,5120,3072,ck,0,0,899.0255,a8w8_blockscale_1x128x128_256x128x128x128_16x16_32x32_2x2_8x32x1_8x32x1_1x32x1x8_8_1x1_intrawave_v3,824.09,366.23,0.0
gfx942,304,23552,5120,8704,ck,0,0,2594.9017,a8w8_blockscale_1x128x128_256x128x128x128_16x16_32x32_2x2_8x32x1_8x32x1_1x32x1x8_8_1x1_intrawave_v3,808.96,189.11,0.0
gfx942,304,23680,5120,3072,ck,0,0,894.5284,a8w8_blockscale_1x128x128_256x128x128x128_16x16_32x32_2x2_8x32x1_8x32x1_1x32x1x8_8_1x1_intrawave_v3,832.74,369.98,0.0
gfx942,304,23680,5120,8704,ck,0,0,2636.265,a8w8_blockscale_1x128x128_256x128x128x128_16x16_32x32_2x2_8x32x1_8x32x1_1x32x1x8_8_1x1_intrawave_v3,800.59,187.07,0.0
gfx942,304,23808,5120,3072,ck,0,0,905.0069,a8w8_blockscale_1x128x128_256x128x128x128_16x16_32x32_2x2_8x32x1_8x32x1_1x32x1x8_8_1x1_intrawave_v3,827.55,367.58,0.0
gfx942,304,23808,5120,8704,ck,0,0,2680.393,a8w8_blockscale_1x128x128_256x128x128x128_16x16_32x32_2x2_8x32x1_8x32x1_1x32x1x8_8_1x1_intrawave_v3,791.67,184.89,0.0
gfx942,304,23936,5120,3072,ck,0,0,900.6194,a8w8_blockscale_1x128x128_256x128x128x128_16x16_32x32_2x2_8x32x1_8x32x1_1x32x1x8_8_1x1_intrawave_v3,836.05,371.26,0.0
gfx942,304,23936,5120,8704,ck,0,0,2724.2059,a8w8_blockscale_1x128x128_256x128x128x128_16x16_32x32_2x2_8x32x1_8x32x1_1x32x1x8_8_1x1_intrawave_v3,783.12,182.81,0.0
gfx942,304,24064,5120,3072,ck,0,0,915.9819,a8w8_blockscale_1x128x128_256x128x128x128_16x16_32x32_2x2_8x32x1_8x32x1_1x32x1x8_8_1x1_intrawave_v3,826.42,366.89,0.0
gfx942,304,24064,5120,8704,ck,0,0,2650.9876,a8w8_blockscale_1x128x128_256x128x128x128_16x16_32x32_2x2_8x32x1_8x32x1_1x32x1x8_8_1x1_intrawave_v3,809.06,188.77,0.0
gfx942,304,24192,5120,3072,ck,0,0,935.4114,a8w8_blockscale_1x128x128_256x128x128x128_16x16_32x32_2x2_8x32x1_8x32x1_1x32x1x8_8_1x1_intrawave_v3,813.56,361.1,0.0
gfx942,304,24192,5120,8704,ck,0,0,2664.2776,a8w8_blockscale_1x128x128_256x128x128x128_16x16_32x32_2x2_8x32x1_8x32x1_1x32x1x8_8_1x1_intrawave_v3,809.3,188.74,0.0
gfx942,304,24320,5120,3072,ck,0,0,918.8547,a8w8_blockscale_1x128x128_256x128x128x128_16x16_32x32_2x2_8x32x1_8x32x1_1x32x1x8_8_1x1_intrawave_v3,832.6,369.46,0.0
gfx942,304,24320,5120,8704,ck,0,0,2679.487,a8w8_blockscale_1x128x128_256x128x128x128_16x16_32x32_2x2_8x32x1_8x32x1_1x32x1x8_8_1x1_intrawave_v3,808.97,188.57,0.0
gfx942,304,24448,5120,3072,ck,0,0,925.8542,a8w8_blockscale_1x128x128_256x128x128x128_16x16_32x32_2x2_8x32x1_8x32x1_1x32x1x8_8_1x1_intrawave_v3,830.66,368.5,0.0
gfx942,304,24448,5120,8704,ck,0,0,2707.6855,a8w8_blockscale_1x128x128_256x128x128x128_16x16_32x32_2x2_8x32x1_8x32x1_1x32x1x8_8_1x1_intrawave_v3,804.76,187.51,0.0
gfx942,304,24576,5120,3072,ck,0,0,930.1236,a8w8_blockscale_1x128x128_256x128x128x128_16x16_32x32_2x2_8x32x1_8x32x1_1x32x1x8_8_1x1_intrawave_v3,831.17,368.64,0.0
gfx942,304,24576,5120,8704,ck,0,0,2793.4517,a8w8_blockscale_1x128x128_256x128x128x128_16x16_32x32_2x2_8x32x1_8x32x1_1x32x1x8_8_1x1_intrawave_v3,784.13,182.62,0.0
gfx942,304,24704,5120,3072,ck,0,0,940.5321,a8w8_blockscale_1x128x128_256x128x128x128_16x16_32x32_2x2_8x32x1_8x32x1_1x32x1x8_8_1x1_intrawave_v3,826.26,366.38,0.0
gfx942,304,24704,5120,8704,ck,0,0,2764.9667,a8w8_blockscale_1x128x128_256x128x128x128_16x16_32x32_2x2_8x32x1_8x32x1_1x32x1x8_8_1x1_intrawave_v3,796.34,185.38,0.0
gfx942,304,24832,5120,3072,ck,0,0,943.7819,a8w8_blockscale_1x128x128_256x128x128x128_16x16_32x32_2x2_8x32x1_8x32x1_1x32x1x8_8_1x1_intrawave_v3,827.68,366.92,0.0
gfx942,304,24832,5120,8704,ck,0,0,2781.2548,a8w8_blockscale_1x128x128_256x128x128x128_16x16_32x32_2x2_8x32x1_8x32x1_1x32x1x8_8_1x1_intrawave_v3,795.77,185.16,0.0
gfx942,304,24960,5120,3072,ck,0,0,943.1986,a8w8_blockscale_1x128x128_256x128x128x128_16x16_32x32_2x2_8x32x1_8x32x1_1x32x1x8_8_1x1_intrawave_v3,832.46,368.95,0.0
gfx942,304,24960,5120,8704,ck,0,0,2816.6659,a8w8_blockscale_1x128x128_256x128x128x128_16x16_32x32_2x2_8x32x1_8x32x1_1x32x1x8_8_1x1_intrawave_v3,789.82,183.69,0.0
gfx942,304,25088,5120,3072,ck,0,0,958.9329,a8w8_blockscale_1x128x128_256x128x128x128_16x16_32x32_2x2_8x32x1_8x32x1_1x32x1x8_8_1x1_intrawave_v3,823.0,364.68,0.0
gfx942,304,25088,5120,8704,ck,0,0,2815.1425,a8w8_blockscale_1x128x128_256x128x128x128_16x16_32x32_2x2_8x32x1_8x32x1_1x32x1x8_8_1x1_intrawave_v3,794.3,184.66,0.0
gfx942,304,25216,5120,3072,ck,0,0,956.4717,a8w8_blockscale_1x128x128_256x128x128x128_16x16_32x32_2x2_8x32x1_8x32x1_1x32x1x8_8_1x1_intrawave_v3,829.33,367.4,0.0
gfx942,304,25216,5120,8704,ck,0,0,2862.4836,a8w8_blockscale_1x128x128_256x128x128x128_16x16_32x32_2x2_8x32x1_8x32x1_1x32x1x8_8_1x1_intrawave_v3,785.15,182.45,0.0
gfx942,304,25344,5120,3072,ck,0,0,967.1894,a8w8_blockscale_1x128x128_256x128x128x128_16x16_32x32_2x2_8x32x1_8x32x1_1x32x1x8_8_1x1_intrawave_v3,824.3,365.09,0.0
gfx942,304,25344,5120,8704,ck,0,0,2848.31,a8w8_blockscale_1x128x128_256x128x128x128_16x16_32x32_2x2_8x32x1_8x32x1_1x32x1x8_8_1x1_intrawave_v3,793.06,184.21,0.0
gfx942,304,25472,5120,3072,ck,0,0,961.7542,a8w8_blockscale_1x128x128_256x128x128x128_16x16_32x32_2x2_8x32x1_8x32x1_1x32x1x8_8_1x1_intrawave_v3,833.14,368.92,0.0
gfx942,304,25472,5120,8704,ck,0,0,2817.3135,a8w8_blockscale_1x128x128_256x128x128x128_16x16_32x32_2x2_8x32x1_8x32x1_1x32x1x8_8_1x1_intrawave_v3,805.84,187.1,0.0
gfx942,304,25600,5120,3072,ck,0,0,981.1121,a8w8_blockscale_1x128x128_256x128x128x128_16x16_32x32_2x2_8x32x1_8x32x1_1x32x1x8_8_1x1_intrawave_v3,820.81,363.38,0.0
gfx942,304,25600,5120,8704,ck,0,0,2849.7954,a8w8_blockscale_1x128x128_256x128x128x128_16x16_32x32_2x2_8x32x1_8x32x1_1x32x1x8_8_1x1_intrawave_v3,800.65,185.81,0.0
gfx942,304,25728,5120,3072,ck,0,0,981.202,a8w8_blockscale_1x128x128_256x128x128x128_16x16_32x32_2x2_8x32x1_8x32x1_1x32x1x8_8_1x1_intrawave_v3,824.84,365.08,0.0
gfx942,304,25728,5120,8704,ck,0,0,2890.9833,a8w8_blockscale_1x128x128_256x128x128x128_16x16_32x32_2x2_8x32x1_8x32x1_1x32x1x8_8_1x1_intrawave_v3,793.19,184.01,0.0
gfx942,304,25856,5120,3072,ck,0,0,978.4461,a8w8_blockscale_1x128x128_256x128x128x128_16x16_32x32_2x2_8x32x1_8x32x1_1x32x1x8_8_1x1_intrawave_v3,831.28,367.85,0.0
gfx942,304,25856,5120,8704,ck,0,0,2908.2168,a8w8_blockscale_1x128x128_256x128x128x128_16x16_32x32_2x2_8x32x1_8x32x1_1x32x1x8_8_1x1_intrawave_v3,792.42,183.75,0.0
gfx942,304,25984,5120,3072,ck,0,0,980.4291,a8w8_blockscale_1x128x128_256x128x128x128_16x16_32x32_2x2_8x32x1_8x32x1_1x32x1x8_8_1x1_intrawave_v3,833.7,368.85,0.0
gfx942,304,25984,5120,8704,ck,0,0,2871.1592,a8w8_blockscale_1x128x128_256x128x128x128_16x16_32x32_2x2_8x32x1_8x32x1_1x32x1x8_8_1x1_intrawave_v3,806.62,186.96,0.0
gfx942,304,26112,5120,3072,ck,0,0,996.1611,a8w8_blockscale_1x128x128_256x128x128x128_16x16_32x32_2x2_8x32x1_8x32x1_1x32x1x8_8_1x1_intrawave_v3,824.58,364.73,0.0
gfx942,304,26112,5120,8704,ck,0,0,2911.2148,a8w8_blockscale_1x128x128_256x128x128x128_16x16_32x32_2x2_8x32x1_8x32x1_1x32x1x8_8_1x1_intrawave_v3,799.44,185.23,0.0
gfx942,304,26240,5120,3072,ck,0,0,996.5844,a8w8_blockscale_1x128x128_256x128x128x128_16x16_32x32_2x2_8x32x1_8x32x1_1x32x1x8_8_1x1_intrawave_v3,828.27,366.29,0.0
gfx942,304,26240,5120,8704,ck,0,0,2896.5436,a8w8_blockscale_1x128x128_256x128x128x128_16x16_32x32_2x2_8x32x1_8x32x1_1x32x1x8_8_1x1_intrawave_v3,807.43,187.0,0.0
gfx942,304,26368,5120,3072,ck,0,0,992.9561,a8w8_blockscale_1x128x128_256x128x128x128_16x16_32x32_2x2_8x32x1_8x32x1_1x32x1x8_8_1x1_intrawave_v3,835.35,369.34,0.0
gfx942,304,26368,5120,8704,ck,0,0,2922.6502,a8w8_blockscale_1x128x128_256x128x128x128_16x16_32x32_2x2_8x32x1_8x32x1_1x32x1x8_8_1x1_intrawave_v3,804.12,186.16,0.0
gfx942,304,26496,5120,3072,ck,0,0,1005.4503,a8w8_blockscale_1x128x128_256x128x128x128_16x16_32x32_2x2_8x32x1_8x32x1_1x32x1x8_8_1x1_intrawave_v3,828.97,366.45,0.0
gfx942,304,26496,5120,8704,ck,0,0,2942.6519,a8w8_blockscale_1x128x128_256x128x128x128_16x16_32x32_2x2_8x32x1_8x32x1_1x32x1x8_8_1x1_intrawave_v3,802.53,185.72,0.0
gfx942,304,26624,5120,3072,ck,0,0,1009.915,a8w8_blockscale_1x128x128_256x128x128x128_16x16_32x32_2x2_8x32x1_8x32x1_1x32x1x8_8_1x1_intrawave_v3,829.3,366.51,0.0
gfx942,304,26624,5120,8704,ck,0,0,2951.5816,a8w8_blockscale_1x128x128_256x128x128x128_16x16_32x32_2x2_8x32x1_8x32x1_1x32x1x8_8_1x1_intrawave_v3,803.97,185.98,0.0
gfx942,304,26752,5120,3072,ck,0,0,1021.4831,a8w8_blockscale_1x128x128_256x128x128x128_16x16_32x32_2x2_8x32x1_8x32x1_1x32x1x8_8_1x1_intrawave_v3,823.85,364.03,0.0
gfx942,304,26752,5120,8704,ck,0,0,2970.697,a8w8_blockscale_1x128x128_256x128x128x128_16x16_32x32_2x2_8x32x1_8x32x1_1x32x1x8_8_1x1_intrawave_v3,802.63,185.6,0.0
gfx942,304,26880,5120,3072,ck,0,0,1014.606,a8w8_blockscale_1x128x128_256x128x128x128_16x16_32x32_2x2_8x32x1_8x32x1_1x32x1x8_8_1x1_intrawave_v3,833.4,368.18,0.0
gfx942,304,26880,5120,8704,ck,0,0,2986.0419,a8w8_blockscale_1x128x128_256x128x128x128_16x16_32x32_2x2_8x32x1_8x32x1_1x32x1x8_8_1x1_intrawave_v3,802.33,185.46,0.0
gfx942,304,27008,5120,3072,ck,0,0,1020.6114,a8w8_blockscale_1x128x128_256x128x128x128_16x16_32x32_2x2_8x32x1_8x32x1_1x32x1x8_8_1x1_intrawave_v3,832.44,367.68,0.0
gfx942,304,27008,5120,8704,ck,0,0,3053.8261,a8w8_blockscale_1x128x128_256x128x128x128_16x16_32x32_2x2_8x32x1_8x32x1_1x32x1x8_8_1x1_intrawave_v3,788.26,182.13,0.0
gfx942,304,27136,5120,3072,ck,0,0,1025.4516,a8w8_blockscale_1x128x128_256x128x128x128_16x16_32x32_2x2_8x32x1_8x32x1_1x32x1x8_8_1x1_intrawave_v3,832.44,367.61,0.0
gfx942,304,27136,5120,8704,ck,0,0,3065.4209,a8w8_blockscale_1x128x128_256x128x128x128_16x16_32x32_2x2_8x32x1_8x32x1_1x32x1x8_8_1x1_intrawave_v3,789.0,182.24,0.0
gfx942,304,27264,5120,3072,ck,0,0,1044.7507,a8w8_blockscale_1x128x128_256x128x128x128_16x16_32x32_2x2_8x32x1_8x32x1_1x32x1x8_8_1x1_intrawave_v3,820.91,362.45,0.0
gfx942,304,27264,5120,8704,ck,0,0,3023.2764,a8w8_blockscale_1x128x128_256x128x128x128_16x16_32x32_2x2_8x32x1_8x32x1_1x32x1x8_8_1x1_intrawave_v3,803.77,185.58,0.0
gfx942,304,27392,5120,3072,ck,0,0,1038.2497,a8w8_blockscale_1x128x128_256x128x128x128_16x16_32x32_2x2_8x32x1_8x32x1_1x32x1x8_8_1x1_intrawave_v3,829.93,366.36,0.0
gfx942,304,27392,5120,8704,ck,0,0,3021.2078,a8w8_blockscale_1x128x128_256x128x128x128_16x16_32x32_2x2_8x32x1_8x32x1_1x32x1x8_8_1x1_intrawave_v3,808.09,186.51,0.0
gfx942,304,27520,5120,3072,ck,0,0,1047.5564,a8w8_blockscale_1x128x128_256x128x128x128_16x16_32x32_2x2_8x32x1_8x32x1_1x32x1x8_8_1x1_intrawave_v3,826.4,364.73,0.0
gfx942,304,27520,5120,8704,ck,0,0,3061.5691,a8w8_blockscale_1x128x128_256x128x128x128_16x16_32x32_2x2_8x32x1_8x32x1_1x32x1x8_8_1x1_intrawave_v3,801.17,184.84,0.0
gfx942,304,27648,5120,3072,ck,0,0,1059.9772,a8w8_blockscale_1x128x128_256x128x128x128_16x16_32x32_2x2_8x32x1_8x32x1_1x32x1x8_8_1x1_intrawave_v3,820.52,362.06,0.0
gfx942,304,27648,5120,8704,ck,0,0,3104.9768,a8w8_blockscale_1x128x128_256x128x128x128_16x16_32x32_2x2_8x32x1_8x32x1_1x32x1x8_8_1x1_intrawave_v3,793.64,183.04,0.0
gfx942,304,27776,5120,3072,ck,0,0,1060.3855,a8w8_blockscale_1x128x128_256x128x128x128_16x16_32x32_2x2_8x32x1_8x32x1_1x32x1x8_8_1x1_intrawave_v3,824.0,363.53,0.0
gfx942,304,27776,5120,8704,ck,0,0,3153.8535,a8w8_blockscale_1x128x128_256x128x128x128_16x16_32x32_2x2_8x32x1_8x32x1_1x32x1x8_8_1x1_intrawave_v3,784.96,180.97,0.0
gfx942,304,27904,5120,3072,ck,0,0,1066.572,a8w8_blockscale_1x128x128_256x128x128x128_16x16_32x32_2x2_8x32x1_8x32x1_1x32x1x8_8_1x1_intrawave_v3,823.0,363.02,0.0
gfx942,304,27904,5120,8704,ck,0,0,3170.4212,a8w8_blockscale_1x128x128_256x128x128x128_16x16_32x32_2x2_8x32x1_8x32x1_1x32x1x8_8_1x1_intrawave_v3,784.46,180.79,0.0
gfx942,304,28032,5120,3072,ck,0,0,1062.5448,a8w8_blockscale_1x128x128_256x128x128x128_16x16_32x32_2x2_8x32x1_8x32x1_1x32x1x8_8_1x1_intrawave_v3,829.9,366.0,0.0
gfx942,304,28032,5120,8704,ck,0,0,3092.3338,a8w8_blockscale_1x128x128_256x128x128x128_16x16_32x32_2x2_8x32x1_8x32x1_1x32x1x8_8_1x1_intrawave_v3,807.95,186.14,0.0
gfx942,304,28160,5120,3072,ck,0,0,1076.4398,a8w8_blockscale_1x128x128_256x128x128x128_16x16_32x32_2x2_8x32x1_8x32x1_1x32x1x8_8_1x1_intrawave_v3,822.93,362.86,0.0
gfx942,304,28160,5120,8704,ck,0,0,3176.1524,a8w8_blockscale_1x128x128_256x128x128x128_16x16_32x32_2x2_8x32x1_8x32x1_1x32x1x8_8_1x1_intrawave_v3,790.22,181.99,0.0
gfx942,304,28288,5120,3072,ck,0,0,1055.1684,a8w8_blockscale_1x128x128_256x128x128x128_16x16_32x32_2x2_8x32x1_8x32x1_1x32x1x8_8_1x1_intrawave_v3,843.34,371.79,0.0
gfx942,304,28288,5120,8704,ck,0,0,3185.9035,a8w8_blockscale_1x128x128_256x128x128x128_16x16_32x32_2x2_8x32x1_8x32x1_1x32x1x8_8_1x1_intrawave_v3,791.39,182.19,0.0
gfx942,304,28416,5120,3072,ck,0,0,1081.848,a8w8_blockscale_1x128x128_256x128x128x128_16x16_32x32_2x2_8x32x1_8x32x1_1x32x1x8_8_1x1_intrawave_v3,826.26,364.19,0.0
gfx942,304,28416,5120,8704,ck,0,0,3221.5532,a8w8_blockscale_1x128x128_256x128x128x128_16x16_32x32_2x2_8x32x1_8x32x1_1x32x1x8_8_1x1_intrawave_v3,786.17,180.93,0.0
gfx942,304,28544,5120,3072,ck,0,0,1077.9627,a8w8_blockscale_1x128x128_256x128x128x128_16x16_32x32_2x2_8x32x1_8x32x1_1x32x1x8_8_1x1_intrawave_v3,832.98,367.09,0.0
gfx942,304,28544,5120,8704,ck,0,0,3249.2465,a8w8_blockscale_1x128x128_256x128x128x128_16x16_32x32_2x2_8x32x1_8x32x1_1x32x1x8_8_1x1_intrawave_v3,782.98,180.13,0.0
gfx942,304,28672,5120,3072,ck,0,0,1072.1029,a8w8_blockscale_1x128x128_256x128x128x128_16x16_32x32_2x2_8x32x1_8x32x1_1x32x1x8_8_1x1_intrawave_v3,841.28,370.68,0.0
gfx942,304,28672,5120,8704,ck,0,0,3241.4945,a8w8_blockscale_1x128x128_256x128x128x128_16x16_32x32_2x2_8x32x1_8x32x1_1x32x1x8_8_1x1_intrawave_v3,788.37,181.31,0.0
gfx942,304,28800,5120,3072,ck,0,0,1085.5667,a8w8_blockscale_1x128x128_256x128x128x128_16x16_32x32_2x2_8x32x1_8x32x1_1x32x1x8_8_1x1_intrawave_v3,834.56,367.66,0.0
gfx942,304,28800,5120,8704,ck,0,0,3249.8398,a8w8_blockscale_1x128x128_256x128x128x128_16x16_32x32_2x2_8x32x1_8x32x1_1x32x1x8_8_1x1_intrawave_v3,789.86,181.59,0.0
gfx942,304,28928,5120,3072,ck,0,0,1111.8247,a8w8_blockscale_1x128x128_256x128x128x128_16x16_32x32_2x2_8x32x1_8x32x1_1x32x1x8_8_1x1_intrawave_v3,818.47,360.5,0.0
gfx942,304,28928,5120,8704,ck,0,0,3224.1832,a8w8_blockscale_1x128x128_256x128x128x128_16x16_32x32_2x2_8x32x1_8x32x1_1x32x1x8_8_1x1_intrawave_v3,799.68,183.79,0.0
gfx942,304,29056,5120,3072,ck,0,0,1096.7045,a8w8_blockscale_1x128x128_256x128x128x128_16x16_32x32_2x2_8x32x1_8x32x1_1x32x1x8_8_1x1_intrawave_v3,833.43,367.03,0.0
gfx942,304,29056,5120,8704,ck,0,0,3307.4276,a8w8_blockscale_1x128x128_256x128x128x128_16x16_32x32_2x2_8x32x1_8x32x1_1x32x1x8_8_1x1_intrawave_v3,783.0,179.9,0.0
gfx942,304,29184,5120,3072,ck,0,0,1102.6224,a8w8_blockscale_1x128x128_256x128x128x128_16x16_32x32_2x2_8x32x1_8x32x1_1x32x1x8_8_1x1_intrawave_v3,832.61,366.6,0.0
gfx942,304,29184,5120,8704,ck,0,0,3309.0216,a8w8_blockscale_1x128x128_256x128x128x128_16x16_32x32_2x2_8x32x1_8x32x1_1x32x1x8_8_1x1_intrawave_v3,786.08,180.54,0.0
gfx942,304,29312,5120,3072,ck,0,0,1106.0098,a8w8_blockscale_1x128x128_256x128x128x128_16x16_32x32_2x2_8x32x1_8x32x1_1x32x1x8_8_1x1_intrawave_v3,833.7,367.02,0.0
gfx942,304,29312,5120,8704,ck,0,0,3243.1744,a8w8_blockscale_1x128x128_256x128x128x128_16x16_32x32_2x2_8x32x1_8x32x1_1x32x1x8_8_1x1_intrawave_v3,805.55,184.96,0.0
gfx942,304,29440,5120,3072,ck,0,0,1126.0561,a8w8_blockscale_1x128x128_256x128x128x128_16x16_32x32_2x2_8x32x1_8x32x1_1x32x1x8_8_1x1_intrawave_v3,822.43,362.0,0.0
gfx942,304,29440,5120,8704,ck,0,0,3277.9881,a8w8_blockscale_1x128x128_256x128x128x128_16x16_32x32_2x2_8x32x1_8x32x1_1x32x1x8_8_1x1_intrawave_v3,800.48,183.73,0.0
gfx942,304,29568,5120,3072,ck,0,0,1116.4681,a8w8_blockscale_1x128x128_256x128x128x128_16x16_32x32_2x2_8x32x1_8x32x1_1x32x1x8_8_1x1_intrawave_v3,833.1,366.64,0.0
gfx942,304,29568,5120,8704,ck,0,0,3348.8612,a8w8_blockscale_1x128x128_256x128x128x128_16x16_32x32_2x2_8x32x1_8x32x1_1x32x1x8_8_1x1_intrawave_v3,786.94,180.57,0.0
gfx942,304,29696,5120,3072,ck,0,0,1115.8508,a8w8_blockscale_1x128x128_256x128x128x128_16x16_32x32_2x2_8x32x1_8x32x1_1x32x1x8_8_1x1_intrawave_v3,837.17,368.37,0.0
gfx942,304,29696,5120,8704,ck,0,0,3333.8547,a8w8_blockscale_1x128x128_256x128x128x128_16x16_32x32_2x2_8x32x1_8x32x1_1x32x1x8_8_1x1_intrawave_v3,793.91,182.11,0.0
gfx942,304,29824,5120,3072,ck,0,0,1131.4297,a8w8_blockscale_1x128x128_256x128x128x128_16x16_32x32_2x2_8x32x1_8x32x1_1x32x1x8_8_1x1_intrawave_v3,829.2,364.8,0.0
gfx942,304,29824,5120,8704,ck,0,0,3310.2225,a8w8_blockscale_1x128x128_256x128x128x128_16x16_32x32_2x2_8x32x1_8x32x1_1x32x1x8_8_1x1_intrawave_v3,803.02,184.14,0.0
gfx942,304,29952,5120,3072,ck,0,0,1139.8322,a8w8_blockscale_1x128x128_256x128x128x128_16x16_32x32_2x2_8x32x1_8x32x1_1x32x1x8_8_1x1_intrawave_v3,826.62,363.61,0.0
gfx942,304,29952,5120,8704,ck,0,0,3311.5453,a8w8_blockscale_1x128x128_256x128x128x128_16x16_32x32_2x2_8x32x1_8x32x1_1x32x1x8_8_1x1_intrawave_v3,806.15,184.8,0.0
gfx942,304,30080,5120,3072,ck,0,0,1130.9118,a8w8_blockscale_1x128x128_256x128x128x128_16x16_32x32_2x2_8x32x1_8x32x1_1x32x1x8_8_1x1_intrawave_v3,836.7,367.98,0.0
gfx942,304,30080,5120,8704,ck,0,0,3413.0002,a8w8_blockscale_1x128x128_256x128x128x128_16x16_32x32_2x2_8x32x1_8x32x1_1x32x1x8_8_1x1_intrawave_v3,785.53,180.02,0.0
gfx942,304,30208,5120,3072,ck,0,0,1142.7019,a8w8_blockscale_1x128x128_256x128x128x128_16x16_32x32_2x2_8x32x1_8x32x1_1x32x1x8_8_1x1_intrawave_v3,831.59,365.68,0.0
gfx942,304,30208,5120,8704,ck,0,0,3431.1813,a8w8_blockscale_1x128x128_256x128x128x128_16x16_32x32_2x2_8x32x1_8x32x1_1x32x1x8_8_1x1_intrawave_v3,784.69,179.77,0.0
gfx942,304,30336,5120,3072,ck,0,0,1150.7583,a8w8_blockscale_1x128x128_256x128x128x128_16x16_32x32_2x2_8x32x1_8x32x1_1x32x1x8_8_1x1_intrawave_v3,829.27,364.6,0.0
gfx942,304,30336,5120,8704,ck,0,0,3351.5225,a8w8_blockscale_1x128x128_256x128x128x128_16x16_32x32_2x2_8x32x1_8x32x1_1x32x1x8_8_1x1_intrawave_v3,806.74,184.77,0.0
gfx942,304,30464,5120,3072,ck,0,0,1157.2162,a8w8_blockscale_1x128x128_256x128x128x128_16x16_32x32_2x2_8x32x1_8x32x1_1x32x1x8_8_1x1_intrawave_v3,828.12,364.03,0.0
gfx942,304,30464,5120,8704,ck,0,0,3392.2239,a8w8_blockscale_1x128x128_256x128x128x128_16x16_32x32_2x2_8x32x1_8x32x1_1x32x1x8_8_1x1_intrawave_v3,800.43,183.26,0.0
gfx942,304,30592,5120,3072,ck,0,0,1171.6484,a8w8_blockscale_1x128x128_256x128x128x128_16x16_32x32_2x2_8x32x1_8x32x1_1x32x1x8_8_1x1_intrawave_v3,821.36,361.0,0.0
gfx942,304,30592,5120,8704,ck,0,0,3447.7077,a8w8_blockscale_1x128x128_256x128x128x128_16x16_32x32_2x2_8x32x1_8x32x1_1x32x1x8_8_1x1_intrawave_v3,790.85,181.02,0.0
gfx942,304,30720,5120,3072,ck,0,0,1147.9724,a8w8_blockscale_1x128x128_256x128x128x128_16x16_32x32_2x2_8x32x1_8x32x1_1x32x1x8_8_1x1_intrawave_v3,841.8,369.93,0.0
gfx942,304,30720,5120,8704,ck,0,0,3392.3381,a8w8_blockscale_1x128x128_256x128x128x128_16x16_32x32_2x2_8x32x1_8x32x1_1x32x1x8_8_1x1_intrawave_v3,807.13,184.69,0.0
gfx942,304,30848,5120,3072,ck,0,0,1166.4333,a8w8_blockscale_1x128x128_256x128x128x128_16x16_32x32_2x2_8x32x1_8x32x1_1x32x1x8_8_1x1_intrawave_v3,831.93,365.54,0.0
gfx942,304,30848,5120,8704,ck,0,0,3405.8529,a8w8_blockscale_1x128x128_256x128x128x128_16x16_32x32_2x2_8x32x1_8x32x1_1x32x1x8_8_1x1_intrawave_v3,807.27,184.67,0.0
gfx942,304,30976,5120,3072,ck,0,0,1176.0587,a8w8_blockscale_1x128x128_256x128x128x128_16x16_32x32_2x2_8x32x1_8x32x1_1x32x1x8_8_1x1_intrawave_v3,828.55,364.0,0.0
gfx942,304,30976,5120,8704,ck,0,0,3421.0712,a8w8_blockscale_1x128x128_256x128x128x128_16x16_32x32_2x2_8x32x1_8x32x1_1x32x1x8_8_1x1_intrawave_v3,807.02,184.55,0.0
gfx942,304,31104,5120,3072,ck,0,0,1160.6353,a8w8_blockscale_1x128x128_256x128x128x128_16x16_32x32_2x2_8x32x1_8x32x1_1x32x1x8_8_1x1_intrawave_v3,843.03,370.3,0.0
gfx942,304,31104,5120,8704,ck,0,0,3549.2068,a8w8_blockscale_1x128x128_256x128x128x128_16x16_32x32_2x2_8x32x1_8x32x1_1x32x1x8_8_1x1_intrawave_v3,781.09,178.57,0.0
gfx942,304,31232,5120,3072,ck,0,0,1191.4773,a8w8_blockscale_1x128x128_256x128x128x128_16x16_32x32_2x2_8x32x1_8x32x1_1x32x1x8_8_1x1_intrawave_v3,824.58,362.15,0.0
gfx942,304,31232,5120,8704,ck,0,0,3496.0019,a8w8_blockscale_1x128x128_256x128x128x128_16x16_32x32_2x2_8x32x1_8x32x1_1x32x1x8_8_1x1_intrawave_v3,796.25,181.99,0.0
gfx942,304,31360,5120,3072,ck,0,0,1215.5855,a8w8_blockscale_1x128x128_256x128x128x128_16x16_32x32_2x2_8x32x1_8x32x1_1x32x1x8_8_1x1_intrawave_v3,811.54,356.37,0.0
gfx942,304,31360,5120,8704,ck,0,0,3497.1357,a8w8_blockscale_1x128x128_256x128x128x128_16x16_32x32_2x2_8x32x1_8x32x1_1x32x1x8_8_1x1_intrawave_v3,799.25,182.62,0.0
gfx942,304,31488,5120,3072,ck,0,0,1182.8228,a8w8_blockscale_1x128x128_256x128x128x128_16x16_32x32_2x2_8x32x1_8x32x1_1x32x1x8_8_1x1_intrawave_v3,837.43,367.68,0.0
gfx942,304,31488,5120,8704,ck,0,0,3487.5847,a8w8_blockscale_1x128x128_256x128x128x128_16x16_32x32_2x2_8x32x1_8x32x1_1x32x1x8_8_1x1_intrawave_v3,804.71,183.82,0.0
gfx942,304,31616,5120,3072,ck,0,0,1182.963,a8w8_blockscale_1x128x128_256x128x128x128_16x16_32x32_2x2_8x32x1_8x32x1_1x32x1x8_8_1x1_intrawave_v3,840.73,369.07,0.0
gfx942,304,31616,5120,8704,ck,0,0,3572.2369,a8w8_blockscale_1x128x128_256x128x128x128_16x16_32x32_2x2_8x32x1_8x32x1_1x32x1x8_8_1x1_intrawave_v3,788.83,180.14,0.0
gfx942,304,31744,5120,3072,ck,0,0,1188.9059,a8w8_blockscale_1x128x128_256x128x128x128_16x16_32x32_2x2_8x32x1_8x32x1_1x32x1x8_8_1x1_intrawave_v3,839.91,368.66,0.0
gfx942,304,31744,5120,8704,ck,0,0,3562.7586,a8w8_blockscale_1x128x128_256x128x128x128_16x16_32x32_2x2_8x32x1_8x32x1_1x32x1x8_8_1x1_intrawave_v3,794.13,181.3,0.0
gfx942,304,31872,5120,3072,ck,0,0,1199.4879,a8w8_blockscale_1x128x128_256x128x128x128_16x16_32x32_2x2_8x32x1_8x32x1_1x32x1x8_8_1x1_intrawave_v3,835.86,366.83,0.0
gfx942,304,31872,5120,8704,ck,0,0,3619.6627,a8w8_blockscale_1x128x128_256x128x128x128_16x16_32x32_2x2_8x32x1_8x32x1_1x32x1x8_8_1x1_intrawave_v3,784.8,179.12,0.0
gfx942,304,32000,5120,3072,ck,0,0,1237.6172,a8w8_blockscale_1x128x128_256x128x128x128_16x16_32x32_2x2_8x32x1_8x32x1_1x32x1x8_8_1x1_intrawave_v3,813.36,356.91,0.0
gfx942,304,32000,5120,8704,ck,0,0,3620.1386,a8w8_blockscale_1x128x128_256x128x128x128_16x16_32x32_2x2_8x32x1_8x32x1_1x32x1x8_8_1x1_intrawave_v3,787.85,179.76,0.0
gfx942,304,32128,5120,3072,ck,0,0,1210.5654,a8w8_blockscale_1x128x128_256x128x128x128_16x16_32x32_2x2_8x32x1_8x32x1_1x32x1x8_8_1x1_intrawave_v3,834.87,366.29,0.0
gfx942,304,32128,5120,8704,ck,0,0,3625.6676,a8w8_blockscale_1x128x128_256x128x128x128_16x16_32x32_2x2_8x32x1_8x32x1_1x32x1x8_8_1x1_intrawave_v3,789.8,180.16,0.0
gfx942,304,32256,5120,3072,ck,0,0,1209.8577,a8w8_blockscale_1x128x128_256x128x128x128_16x16_32x32_2x2_8x32x1_8x32x1_1x32x1x8_8_1x1_intrawave_v3,838.68,367.91,0.0
gfx942,304,32256,5120,8704,ck,0,0,3643.8159,a8w8_blockscale_1x128x128_256x128x128x128_16x16_32x32_2x2_8x32x1_8x32x1_1x32x1x8_8_1x1_intrawave_v3,788.99,179.93,0.0
gfx942,304,32384,5120,3072,ck,0,0,1235.8739,a8w8_blockscale_1x128x128_256x128x128x128_16x16_32x32_2x2_8x32x1_8x32x1_1x32x1x8_8_1x1_intrawave_v3,824.29,361.55,0.0
gfx942,304,32384,5120,8704,ck,0,0,3608.0514,a8w8_blockscale_1x128x128_256x128x128x128_16x16_32x32_2x2_8x32x1_8x32x1_1x32x1x8_8_1x1_intrawave_v3,799.98,182.38,0.0
gfx942,304,32512,5120,3072,ck,0,0,1243.3229,a8w8_blockscale_1x128x128_256x128x128x128_16x16_32x32_2x2_8x32x1_8x32x1_1x32x1x8_8_1x1_intrawave_v3,822.59,360.75,0.0
gfx942,304,32512,5120,8704,ck,0,0,3697.2724,a8w8_blockscale_1x128x128_256x128x128x128_16x16_32x32_2x2_8x32x1_8x32x1_1x32x1x8_8_1x1_intrawave_v3,783.76,178.64,0.0
gfx942,304,32640,5120,3072,ck,0,0,1222.2305,a8w8_blockscale_1x128x128_256x128x128x128_16x16_32x32_2x2_8x32x1_8x32x1_1x32x1x8_8_1x1_intrawave_v3,840.08,368.37,0.0
gfx942,304,32640,5120,8704,ck,0,0,3617.4492,a8w8_blockscale_1x128x128_256x128x128x128_16x16_32x32_2x2_8x32x1_8x32x1_1x32x1x8_8_1x1_intrawave_v3,804.2,183.25,0.0
gfx942,304,32768,5120,3072,ck,0,0,1236.6457,a8w8_blockscale_1x128x128_256x128x128x128_16x16_32x32_2x2_8x32x1_8x32x1_1x32x1x8_8_1x1_intrawave_v3,833.54,365.45,0.0
gfx942,304,32768,5120,8704,ck,0,0,3637.2126,a8w8_blockscale_1x128x128_256x128x128x128_16x16_32x32_2x2_8x32x1_8x32x1_1x32x1x8_8_1x1_intrawave_v3,802.97,182.92,0.0
gfx942,304,32896,5120,3072,ck,0,0,1249.0521,a8w8_blockscale_1x128x128_256x128x128x128_16x16_32x32_2x2_8x32x1_8x32x1_1x32x1x8_8_1x1_intrawave_v3,828.48,363.19,0.0
gfx942,304,32896,5120,8704,ck,0,0,3752.0604,a8w8_blockscale_1x128x128_256x128x128x128_16x16_32x32_2x2_8x32x1_8x32x1_1x32x1x8_8_1x1_intrawave_v3,781.43,177.97,0.0
gfx942,304,33024,5120,3072,ck,0,0,1245.3069,a8w8_blockscale_1x128x128_256x128x128x128_16x16_32x32_2x2_8x32x1_8x32x1_1x32x1x8_8_1x1_intrawave_v3,834.21,365.65,0.0
gfx942,304,33024,5120,8704,ck,0,0,3673.631,a8w8_blockscale_1x128x128_256x128x128x128_16x16_32x32_2x2_8x32x1_8x32x1_1x32x1x8_8_1x1_intrawave_v3,801.22,182.43,0.0
gfx942,304,33152,5120,3072,ck,0,0,1264.0651,a8w8_blockscale_1x128x128_256x128x128x128_16x16_32x32_2x2_8x32x1_8x32x1_1x32x1x8_8_1x1_intrawave_v3,825.01,361.57,0.0
gfx942,304,33152,5120,8704,ck,0,0,3749.4476,a8w8_blockscale_1x128x128_256x128x128x128_16x16_32x32_2x2_8x32x1_8x32x1_1x32x1x8_8_1x1_intrawave_v3,788.06,179.39,0.0
gfx942,304,33280,5120,3072,ck,0,0,1270.025,a8w8_blockscale_1x128x128_256x128x128x128_16x16_32x32_2x2_8x32x1_8x32x1_1x32x1x8_8_1x1_intrawave_v3,824.31,361.21,0.0
gfx942,304,33280,5120,8704,ck,0,0,3777.2655,a8w8_blockscale_1x128x128_256x128x128x128_16x16_32x32_2x2_8x32x1_8x32x1_1x32x1x8_8_1x1_intrawave_v3,785.28,178.71,0.0
gfx942,304,33408,5120,3072,ck,0,0,1247.5065,a8w8_blockscale_1x128x128_256x128x128x128_16x16_32x32_2x2_8x32x1_8x32x1_1x32x1x8_8_1x1_intrawave_v3,842.42,369.1,0.0
gfx942,304,33408,5120,8704,ck,0,0,3815.4626,a8w8_blockscale_1x128x128_256x128x128x128_16x16_32x32_2x2_8x32x1_8x32x1_1x32x1x8_8_1x1_intrawave_v3,780.41,177.55,0.0
gfx942,304,33536,5120,3072,ck,0,0,1266.6158,a8w8_blockscale_1x128x128_256x128x128x128_16x16_32x32_2x2_8x32x1_8x32x1_1x32x1x8_8_1x1_intrawave_v3,832.89,364.88,0.0
gfx942,304,33536,5120,8704,ck,0,0,3790.2705,a8w8_blockscale_1x128x128_256x128x128x128_16x16_32x32_2x2_8x32x1_8x32x1_1x32x1x8_8_1x1_intrawave_v3,788.61,179.37,0.0
gfx942,304,33664,5120,3072,ck,0,0,1288.4193,a8w8_blockscale_1x128x128_256x128x128x128_16x16_32x32_2x2_8x32x1_8x32x1_1x32x1x8_8_1x1_intrawave_v3,821.92,360.03,0.0
gfx942,304,33664,5120,8704,ck,0,0,3877.1163,a8w8_blockscale_1x128x128_256x128x128x128_16x16_32x32_2x2_8x32x1_8x32x1_1x32x1x8_8_1x1_intrawave_v3,773.88,175.98,0.0
gfx942,304,33792,5120,3072,ck,0,0,1271.5691,a8w8_blockscale_1x128x128_256x128x128x128_16x16_32x32_2x2_8x32x1_8x32x1_1x32x1x8_8_1x1_intrawave_v3,835.98,366.14,0.0
gfx942,304,33792,5120,8704,ck,0,0,3682.4715,a8w8_blockscale_1x128x128_256x128x128x128_16x16_32x32_2x2_8x32x1_8x32x1_1x32x1x8_8_1x1_intrawave_v3,817.89,185.94,0.0
gfx942,304,33920,5120,3072,ck,0,0,1292.8481,a8w8_blockscale_1x128x128_256x128x128x128_16x16_32x32_2x2_8x32x1_8x32x1_1x32x1x8_8_1x1_intrawave_v3,825.33,361.43,0.0
gfx942,304,33920,5120,8704,ck,0,0,3780.4999,a8w8_blockscale_1x128x128_256x128x128x128_16x16_32x32_2x2_8x32x1_8x32x1_1x32x1x8_8_1x1_intrawave_v3,799.7,181.76,0.0
gfx942,304,34048,5120,3072,ck,0,0,1313.7714,a8w8_blockscale_1x128x128_256x128x128x128_16x16_32x32_2x2_8x32x1_8x32x1_1x32x1x8_8_1x1_intrawave_v3,815.25,356.97,0.0
gfx942,304,34048,5120,8704,ck,0,0,3778.739,a8w8_blockscale_1x128x128_256x128x128x128_16x16_32x32_2x2_8x32x1_8x32x1_1x32x1x8_8_1x1_intrawave_v3,803.09,182.49,0.0
gfx942,304,34176,5120,3072,ck,0,0,1283.9066,a8w8_blockscale_1x128x128_256x128x128x128_16x16_32x32_2x2_8x32x1_8x32x1_1x32x1x8_8_1x1_intrawave_v3,837.35,366.6,0.0
gfx942,304,34176,5120,8704,ck,0,0,3813.7995,a8w8_blockscale_1x128x128_256x128x128x128_16x16_32x32_2x2_8x32x1_8x32x1_1x32x1x8_8_1x1_intrawave_v3,798.7,181.44,0.0
gfx942,304,34304,5120,3072,ck,0,0,1321.0362,a8w8_blockscale_1x128x128_256x128x128x128_16x16_32x32_2x2_8x32x1_8x32x1_1x32x1x8_8_1x1_intrawave_v3,816.87,357.59,0.0
gfx942,304,34304,5120,8704,ck,0,0,3885.6974,a8w8_blockscale_1x128x128_256x128x128x128_16x16_32x32_2x2_8x32x1_8x32x1_1x32x1x8_8_1x1_intrawave_v3,786.85,178.71,0.0
gfx942,304,34432,5120,3072,ck,0,0,1305.0108,a8w8_blockscale_1x128x128_256x128x128x128_16x16_32x32_2x2_8x32x1_8x32x1_1x32x1x8_8_1x1_intrawave_v3,829.98,363.28,0.0
gfx942,304,34432,5120,8704,ck,0,0,3829.35,a8w8_blockscale_1x128x128_256x128x128x128_16x16_32x32_2x2_8x32x1_8x32x1_1x32x1x8_8_1x1_intrawave_v3,801.41,181.97,0.0
gfx942,304,34560,5120,3072,ck,0,0,1337.6263,a8w8_blockscale_1x128x128_256x128x128x128_16x16_32x32_2x2_8x32x1_8x32x1_1x32x1x8_8_1x1_intrawave_v3,812.76,355.7,0.0
gfx942,304,34560,5120,8704,ck,0,0,3893.9636,a8w8_blockscale_1x128x128_256x128x128x128_16x16_32x32_2x2_8x32x1_8x32x1_1x32x1x8_8_1x1_intrawave_v3,791.04,179.58,0.0
gfx942,304,34688,5120,3072,ck,0,0,1323.484,a8w8_blockscale_1x128x128_256x128x128x128_16x16_32x32_2x2_8x32x1_8x32x1_1x32x1x8_8_1x1_intrawave_v3,824.48,360.79,0.0
gfx942,304,34688,5120,8704,ck,0,0,3829.5646,a8w8_blockscale_1x128x128_256x128x128x128_16x16_32x32_2x2_8x32x1_8x32x1_1x32x1x8_8_1x1_intrawave_v3,807.33,183.23,0.0
gfx942,304,34816,5120,3072,ck,0,0,1326.4339,a8w8_blockscale_1x128x128_256x128x128x128_16x16_32x32_2x2_8x32x1_8x32x1_1x32x1x8_8_1x1_intrawave_v3,825.69,361.27,0.0
gfx942,304,34816,5120,8704,ck,0,0,3842.1343,a8w8_blockscale_1x128x128_256x128x128x128_16x16_32x32_2x2_8x32x1_8x32x1_1x32x1x8_8_1x1_intrawave_v3,807.65,183.26,0.0
gfx942,304,34944,5120,3072,ck,0,0,1324.7233,a8w8_blockscale_1x128x128_256x128x128x128_16x16_32x32_2x2_8x32x1_8x32x1_1x32x1x8_8_1x1_intrawave_v3,829.79,363.02,0.0
gfx942,304,34944,5120,8704,ck,0,0,3847.4195,a8w8_blockscale_1x128x128_256x128x128x128_16x16_32x32_2x2_8x32x1_8x32x1_1x32x1x8_8_1x1_intrawave_v3,809.51,183.64,0.0
gfx942,304,35072,5120,3072,ck,0,0,1333.6169,a8w8_blockscale_1x128x128_256x128x128x128_16x16_32x32_2x2_8x32x1_8x32x1_1x32x1x8_8_1x1_intrawave_v3,827.28,361.88,0.0
gfx942,304,35072,5120,8704,ck,0,0,3953.6156,a8w8_blockscale_1x128x128_256x128x128x128_16x16_32x32_2x2_8x32x1_8x32x1_1x32x1x8_8_1x1_intrawave_v3,790.65,179.32,0.0
gfx942,304,35200,5120,3072,ck,0,0,1340.5294,a8w8_blockscale_1x128x128_256x128x128x128_16x16_32x32_2x2_8x32x1_8x32x1_1x32x1x8_8_1x1_intrawave_v3,826.01,361.28,0.0
gfx942,304,35200,5120,8704,ck,0,0,4017.5352,a8w8_blockscale_1x128x128_256x128x128x128_16x16_32x32_2x2_8x32x1_8x32x1_1x32x1x8_8_1x1_intrawave_v3,780.91,177.07,0.0
gfx942,304,35328,5120,3072,ck,0,0,1341.1776,a8w8_blockscale_1x128x128_256x128x128x128_16x16_32x32_2x2_8x32x1_8x32x1_1x32x1x8_8_1x1_intrawave_v3,828.62,362.38,0.0
gfx942,304,35328,5120,8704,ck,0,0,3956.5529,a8w8_blockscale_1x128x128_256x128x128x128_16x16_32x32_2x2_8x32x1_8x32x1_1x32x1x8_8_1x1_intrawave_v3,795.83,180.41,0.0
gfx942,304,35456,5120,3072,ck,0,0,1348.4408,a8w8_blockscale_1x128x128_256x128x128x128_16x16_32x32_2x2_8x32x1_8x32x1_1x32x1x8_8_1x1_intrawave_v3,827.14,361.69,0.0
gfx942,304,35456,5120,8704,ck,0,0,3950.2041,a8w8_blockscale_1x128x128_256x128x128x128_16x16_32x32_2x2_8x32x1_8x32x1_1x32x1x8_8_1x1_intrawave_v3,800.0,181.32,0.0
gfx942,304,35584,5120,3072,ck,0,0,1358.3302,a8w8_blockscale_1x128x128_256x128x128x128_16x16_32x32_2x2_8x32x1_8x32x1_1x32x1x8_8_1x1_intrawave_v3,824.08,360.31,0.0
gfx942,304,35584,5120,8704,ck,0,0,4053.1287,a8w8_blockscale_1x128x128_256x128x128x128_16x16_32x32_2x2_8x32x1_8x32x1_1x32x1x8_8_1x1_intrawave_v3,782.5,177.31,0.0
gfx942,304,35712,5120,3072,ck,0,0,1355.8964,a8w8_blockscale_1x128x128_256x128x128x128_16x16_32x32_2x2_8x32x1_8x32x1_1x32x1x8_8_1x1_intrawave_v3,828.53,362.22,0.0
gfx942,304,35712,5120,8704,ck,0,0,4030.3773,a8w8_blockscale_1x128x128_256x128x128x128_16x16_32x32_2x2_8x32x1_8x32x1_1x32x1x8_8_1x1_intrawave_v3,789.75,178.91,0.0
gfx942,304,35840,5120,3072,ck,0,0,1362.1681,a8w8_blockscale_1x128x128_256x128x128x128_16x16_32x32_2x2_8x32x1_8x32x1_1x32x1x8_8_1x1_intrawave_v3,827.67,361.8,0.0
gfx942,304,35840,5120,8704,ck,0,0,4026.9538,a8w8_blockscale_1x128x128_256x128x128x128_16x16_32x32_2x2_8x32x1_8x32x1_1x32x1x8_8_1x1_intrawave_v3,793.25,179.67,0.0
gfx942,304,35968,5120,3072,ck,0,0,1354.9252,a8w8_blockscale_1x128x128_256x128x128x128_16x16_32x32_2x2_8x32x1_8x32x1_1x32x1x8_8_1x1_intrawave_v3,835.07,364.99,0.0
gfx942,304,35968,5120,8704,ck,0,0,4064.3529,a8w8_blockscale_1x128x128_256x128x128x128_16x16_32x32_2x2_8x32x1_8x32x1_1x32x1x8_8_1x1_intrawave_v3,788.76,178.61,0.0
gfx942,304,36096,5120,3072,ck,0,0,1357.1773,a8w8_blockscale_1x128x128_256x128x128x128_16x16_32x32_2x2_8x32x1_8x32x1_1x32x1x8_8_1x1_intrawave_v3,836.65,365.64,0.0
gfx942,304,36096,5120,8704,ck,0,0,4044.9868,a8w8_blockscale_1x128x128_256x128x128x128_16x16_32x32_2x2_8x32x1_8x32x1_1x32x1x8_8_1x1_intrawave_v3,795.35,180.07,0.0
gfx942,304,36224,5120,3072,ck,0,0,1378.3285,a8w8_blockscale_1x128x128_256x128x128x128_16x16_32x32_2x2_8x32x1_8x32x1_1x32x1x8_8_1x1_intrawave_v3,826.73,361.27,0.0
gfx942,304,36224,5120,8704,ck,0,0,4062.0231,a8w8_blockscale_1x128x128_256x128x128x128_16x16_32x32_2x2_8x32x1_8x32x1_1x32x1x8_8_1x1_intrawave_v3,794.83,179.91,0.0
gfx942,304,36352,5120,3072,ck,0,0,1384.6445,a8w8_blockscale_1x128x128_256x128x128x128_16x16_32x32_2x2_8x32x1_8x32x1_1x32x1x8_8_1x1_intrawave_v3,825.87,360.85,0.0
gfx942,304,36352,5120,8704,ck,0,0,4079.3373,a8w8_blockscale_1x128x128_256x128x128x128_16x16_32x32_2x2_8x32x1_8x32x1_1x32x1x8_8_1x1_intrawave_v3,794.25,179.74,0.0
gfx942,304,36480,5120,3072,ck,0,0,1389.1262,a8w8_blockscale_1x128x128_256x128x128x128_16x16_32x32_2x2_8x32x1_8x32x1_1x32x1x8_8_1x1_intrawave_v3,826.1,360.91,0.0
gfx942,304,36480,5120,8704,ck,0,0,4127.5783,a8w8_blockscale_1x128x128_256x128x128x128_16x16_32x32_2x2_8x32x1_8x32x1_1x32x1x8_8_1x1_intrawave_v3,787.73,178.23,0.0
gfx942,304,36608,5120,3072,ck,0,0,1371.5948,a8w8_blockscale_1x128x128_256x128x128x128_16x16_32x32_2x2_8x32x1_8x32x1_1x32x1x8_8_1x1_intrawave_v3,839.6,366.77,0.0
gfx942,304,36608,5120,8704,ck,0,0,4145.9592,a8w8_blockscale_1x128x128_256x128x128x128_16x16_32x32_2x2_8x32x1_8x32x1_1x32x1x8_8_1x1_intrawave_v3,786.99,178.02,0.0
gfx942,304,36736,5120,3072,ck,0,0,1382.0504,a8w8_blockscale_1x128x128_256x128x128x128_16x16_32x32_2x2_8x32x1_8x32x1_1x32x1x8_8_1x1_intrawave_v3,836.16,365.22,0.0
gfx942,304,36736,5120,8704,ck,0,0,4193.889,a8w8_blockscale_1x128x128_256x128x128x128_16x16_32x32_2x2_8x32x1_8x32x1_1x32x1x8_8_1x1_intrawave_v3,780.72,176.56,0.0
gfx942,304,36864,5120,3072,ck,0,0,1407.9653,a8w8_blockscale_1x128x128_256x128x128x128_16x16_32x32_2x2_8x32x1_8x32x1_1x32x1x8_8_1x1_intrawave_v3,823.63,359.71,0.0
gfx942,304,36864,5120,8704,ck,0,0,4156.9447,a8w8_blockscale_1x128x128_256x128x128x128_16x16_32x32_2x2_8x32x1_8x32x1_1x32x1x8_8_1x1_intrawave_v3,790.4,178.72,0.0
gfx942,304,36992,5120,3072,ck,0,0,1425.4479,a8w8_blockscale_1x128x128_256x128x128x128_16x16_32x32_2x2_8x32x1_8x32x1_1x32x1x8_8_1x1_intrawave_v3,816.35,356.5,0.0
gfx942,304,36992,5120,8704,ck,0,0,4213.2105,a8w8_blockscale_1x128x128_256x128x128x128_16x16_32x32_2x2_8x32x1_8x32x1_1x32x1x8_8_1x1_intrawave_v3,782.55,176.91,0.0
gfx942,304,37120,5120,3072,ck,0,0,1437.9246,a8w8_blockscale_1x128x128_256x128x128x128_16x16_32x32_2x2_8x32x1_8x32x1_1x32x1x8_8_1x1_intrawave_v3,812.07,354.59,0.0
gfx942,304,37120,5120,8704,ck,0,0,4203.0446,a8w8_blockscale_1x128x128_256x128x128x128_16x16_32x32_2x2_8x32x1_8x32x1_1x32x1x8_8_1x1_intrawave_v3,787.16,177.91,0.0
gfx942,304,37248,5120,3072,ck,0,0,1416.4894,a8w8_blockscale_1x128x128_256x128x128x128_16x16_32x32_2x2_8x32x1_8x32x1_1x32x1x8_8_1x1_intrawave_v3,827.2,361.16,0.0
gfx942,304,37248,5120,8704,ck,0,0,4138.4609,a8w8_blockscale_1x128x128_256x128x128x128_16x16_32x32_2x2_8x32x1_8x32x1_1x32x1x8_8_1x1_intrawave_v3,802.2,181.27,0.0
gfx942,304,37376,5120,3072,ck,0,0,1419.7729,a8w8_blockscale_1x128x128_256x128x128x128_16x16_32x32_2x2_8x32x1_8x32x1_1x32x1x8_8_1x1_intrawave_v3,828.12,361.52,0.0
gfx942,304,37376,5120,8704,ck,0,0,4151.9388,a8w8_blockscale_1x128x128_256x128x128x128_16x16_32x32_2x2_8x32x1_8x32x1_1x32x1x8_8_1x1_intrawave_v3,802.34,181.27,0.0
gfx942,304,37504,5120,3072,ck,0,0,1413.295,a8w8_blockscale_1x128x128_256x128x128x128_16x16_32x32_2x2_8x32x1_8x32x1_1x32x1x8_8_1x1_intrawave_v3,834.77,364.38,0.0
gfx942,304,37504,5120,8704,ck,0,0,4258.0102,a8w8_blockscale_1x128x128_256x128x128x128_16x16_32x32_2x2_8x32x1_8x32x1_1x32x1x8_8_1x1_intrawave_v3,785.04,177.32,0.0
gfx942,304,37632,5120,3072,ck,0,0,1447.6509,a8w8_blockscale_1x128x128_256x128x128x128_16x16_32x32_2x2_8x32x1_8x32x1_1x32x1x8_8_1x1_intrawave_v3,817.74,356.91,0.0
gfx942,304,37632,5120,8704,ck,0,0,4255.676,a8w8_blockscale_1x128x128_256x128x128x128_16x16_32x32_2x2_8x32x1_8x32x1_1x32x1x8_8_1x1_intrawave_v3,788.15,177.99,0.0
gfx942,304,37760,5120,3072,ck,0,0,1422.1315,a8w8_blockscale_1x128x128_256x128x128x128_16x16_32x32_2x2_8x32x1_8x32x1_1x32x1x8_8_1x1_intrawave_v3,835.24,364.52,0.0
gfx942,304,37760,5120,8704,ck,0,0,4324.7063,a8w8_blockscale_1x128x128_256x128x128x128_16x16_32x32_2x2_8x32x1_8x32x1_1x32x1x8_8_1x1_intrawave_v3,778.21,175.71,0.0
gfx942,304,37888,5120,3072,ck,0,0,1463.9139,a8w8_blockscale_1x128x128_256x128x128x128_16x16_32x32_2x2_8x32x1_8x32x1_1x32x1x8_8_1x1_intrawave_v3,814.16,355.28,0.0
gfx942,304,37888,5120,8704,ck,0,0,4194.0202,a8w8_blockscale_1x128x128_256x128x128x128_16x16_32x32_2x2_8x32x1_8x32x1_1x32x1x8_8_1x1_intrawave_v3,805.17,181.76,0.0
gfx942,304,38016,5120,3072,ck,0,0,1445.7622,a8w8_blockscale_1x128x128_256x128x128x128_16x16_32x32_2x2_8x32x1_8x32x1_1x32x1x8_8_1x1_intrawave_v3,827.16,360.92,0.0
gfx942,304,38016,5120,8704,ck,0,0,4345.3881,a8w8_blockscale_1x128x128_256x128x128x128_16x16_32x32_2x2_8x32x1_8x32x1_1x32x1x8_8_1x1_intrawave_v3,779.75,175.99,0.0
gfx942,304,38144,5120,3072,ck,0,0,1451.9734,a8w8_blockscale_1x128x128_256x128x128x128_16x16_32x32_2x2_8x32x1_8x32x1_1x32x1x8_8_1x1_intrawave_v3,826.4,360.54,0.0
gfx942,304,38144,5120,8704,ck,0,0,4246.1827,a8w8_blockscale_1x128x128_256x128x128x128_16x16_32x32_2x2_8x32x1_8x32x1_1x32x1x8_8_1x1_intrawave_v3,800.66,180.67,0.0
gfx942,304,38272,5120,3072,ck,0,0,1470.5899,a8w8_blockscale_1x128x128_256x128x128x128_16x16_32x32_2x2_8x32x1_8x32x1_1x32x1x8_8_1x1_intrawave_v3,818.67,357.14,0.0
gfx942,304,38272,5120,8704,ck,0,0,4335.0584,a8w8_blockscale_1x128x128_256x128x128x128_16x16_32x32_2x2_8x32x1_8x32x1_1x32x1x8_8_1x1_intrawave_v3,786.87,177.53,0.0
gfx942,304,38400,5120,3072,ck,0,0,1485.2381,a8w8_blockscale_1x128x128_256x128x128x128_16x16_32x32_2x2_8x32x1_8x32x1_1x32x1x8_8_1x1_intrawave_v3,813.31,354.76,0.0
gfx942,304,38400,5120,8704,ck,0,0,4380.3896,a8w8_blockscale_1x128x128_256x128x128x128_16x16_32x32_2x2_8x32x1_8x32x1_1x32x1x8_8_1x1_intrawave_v3,781.34,176.24,0.0
gfx942,304,38528,5120,3072,ck,0,0,1474.7953,a8w8_blockscale_1x128x128_256x128x128x128_16x16_32x32_2x2_8x32x1_8x32x1_1x32x1x8_8_1x1_intrawave_v3,821.8,358.43,0.0
gfx942,304,38528,5120,8704,ck,0,0,4392.179,a8w8_blockscale_1x128x128_256x128x128x128_16x16_32x32_2x2_8x32x1_8x32x1_1x32x1x8_8_1x1_intrawave_v3,781.84,176.32,0.0
gfx942,304,38656,5120,3072,ck,0,0,1479.9936,a8w8_blockscale_1x128x128_256x128x128x128_16x16_32x32_2x2_8x32x1_8x32x1_1x32x1x8_8_1x1_intrawave_v3,821.63,358.32,0.0
gfx942,304,38656,5120,8704,ck,0,0,4378.297,a8w8_blockscale_1x128x128_256x128x128x128_16x16_32x32_2x2_8x32x1_8x32x1_1x32x1x8_8_1x1_intrawave_v3,786.92,177.44,0.0
gfx942,304,38784,5120,3072,ck,0,0,1482.7363,a8w8_blockscale_1x128x128_256x128x128x128_16x16_32x32_2x2_8x32x1_8x32x1_1x32x1x8_8_1x1_intrawave_v3,822.83,358.81,0.0
gfx942,304,38784,5120,8704,ck,0,0,4394.0299,a8w8_blockscale_1x128x128_256x128x128x128_16x16_32x32_2x2_8x32x1_8x32x1_1x32x1x8_8_1x1_intrawave_v3,786.7,177.35,0.0
gfx942,304,38912,5120,3072,ck,0,0,1457.4227,a8w8_blockscale_1x128x128_256x128x128x128_16x16_32x32_2x2_8x32x1_8x32x1_1x32x1x8_8_1x1_intrawave_v3,839.88,366.21,0.0
gfx942,304,38912,5120,8704,ck,0,0,4404.2397,a8w8_blockscale_1x128x128_256x128x128x128_16x16_32x32_2x2_8x32x1_8x32x1_1x32x1x8_8_1x1_intrawave_v3,787.47,177.49,0.0
gfx942,304,39040,5120,3072,ck,0,0,1478.6504,a8w8_blockscale_1x128x128_256x128x128x128_16x16_32x32_2x2_8x32x1_8x32x1_1x32x1x8_8_1x1_intrawave_v3,830.55,362.11,0.0
gfx942,304,39040,5120,8704,ck,0,0,4461.4516,a8w8_blockscale_1x128x128_256x128x128x128_16x16_32x32_2x2_8x32x1_8x32x1_1x32x1x8_8_1x1_intrawave_v3,779.92,175.76,0.0
gfx942,304,39168,5120,3072,ck,0,0,1510.2063,a8w8_blockscale_1x128x128_256x128x128x128_16x16_32x32_2x2_8x32x1_8x32x1_1x32x1x8_8_1x1_intrawave_v3,815.86,355.67,0.0
gfx942,304,39168,5120,8704,ck,0,0,4431.9431,a8w8_blockscale_1x128x128_256x128x128x128_16x16_32x32_2x2_8x32x1_8x32x1_1x32x1x8_8_1x1_intrawave_v3,787.69,177.48,0.0
gfx942,304,39296,5120,3072,ck,0,0,1498.264,a8w8_blockscale_1x128x128_256x128x128x128_16x16_32x32_2x2_8x32x1_8x32x1_1x32x1x8_8_1x1_intrawave_v3,825.05,359.64,0.0
gfx942,304,39296,5120,8704,ck,0,0,4373.7792,a8w8_blockscale_1x128x128_256x128x128x128_16x16_32x32_2x2_8x32x1_8x32x1_1x32x1x8_8_1x1_intrawave_v3,800.77,180.39,0.0
gfx942,304,39424,5120,3072,ck,0,0,1504.1131,a8w8_blockscale_1x128x128_256x128x128x128_16x16_32x32_2x2_8x32x1_8x32x1_1x32x1x8_8_1x1_intrawave_v3,824.52,359.38,0.0
gfx942,304,39424,5120,8704,ck,0,0,4471.5365,a8w8_blockscale_1x128x128_256x128x128x128_16x16_32x32_2x2_8x32x1_8x32x1_1x32x1x8_8_1x1_intrawave_v3,785.82,176.99,0.0
gfx942,304,39552,5120,3072,ck,0,0,1503.5218,a8w8_blockscale_1x128x128_256x128x128x128_16x16_32x32_2x2_8x32x1_8x32x1_1x32x1x8_8_1x1_intrawave_v3,827.52,360.65,0.0
gfx942,304,39552,5120,8704,ck,0,0,4410.9346,a8w8_blockscale_1x128x128_256x128x128x128_16x16_32x32_2x2_8x32x1_8x32x1_1x32x1x8_8_1x1_intrawave_v3,799.2,179.97,0.0
gfx942,304,39680,5120,3072,ck,0,0,1495.7991,a8w8_blockscale_1x128x128_256x128x128x128_16x16_32x32_2x2_8x32x1_8x32x1_1x32x1x8_8_1x1_intrawave_v3,834.49,363.65,0.0
gfx942,304,39680,5120,8704,ck,0,0,4457.1562,a8w8_blockscale_1x128x128_256x128x128x128_16x16_32x32_2x2_8x32x1_8x32x1_1x32x1x8_8_1x1_intrawave_v3,793.47,178.65,0.0
gfx942,304,39808,5120,3072,ck,0,0,1527.5552,a8w8_blockscale_1x128x128_256x128x128x128_16x16_32x32_2x2_8x32x1_8x32x1_1x32x1x8_8_1x1_intrawave_v3,819.77,357.21,0.0
gfx942,304,39808,5120,8704,ck,0,0,4485.8997,a8w8_blockscale_1x128x128_256x128x128x128_16x16_32x32_2x2_8x32x1_8x32x1_1x32x1x8_8_1x1_intrawave_v3,790.93,178.04,0.0
gfx942,304,39936,5120,3072,ck,0,0,1506.738,a8w8_blockscale_1x128x128_256x128x128x128_16x16_32x32_2x2_8x32x1_8x32x1_1x32x1x8_8_1x1_intrawave_v3,833.77,363.27,0.0
gfx942,304,39936,5120,8704,ck,0,0,4441.5189,a8w8_blockscale_1x128x128_256x128x128x128_16x16_32x32_2x2_8x32x1_8x32x1_1x32x1x8_8_1x1_intrawave_v3,801.4,180.37,0.0
gfx942,304,40064,5120,3072,ck,0,0,1536.1065,a8w8_blockscale_1x128x128_256x128x128x128_16x16_32x32_2x2_8x32x1_8x32x1_1x32x1x8_8_1x1_intrawave_v3,820.45,357.44,0.0
gfx942,304,40064,5120,8704,ck,0,0,4517.6162,a8w8_blockscale_1x128x128_256x128x128x128_16x16_32x32_2x2_8x32x1_8x32x1_1x32x1x8_8_1x1_intrawave_v3,790.43,177.87,0.0
gfx942,304,40192,5120,3072,ck,0,0,1536.0147,a8w8_blockscale_1x128x128_256x128x128x128_16x16_32x32_2x2_8x32x1_8x32x1_1x32x1x8_8_1x1_intrawave_v3,823.12,358.57,0.0
gfx942,304,40192,5120,8704,ck,0,0,4548.1974,a8w8_blockscale_1x128x128_256x128x128x128_16x16_32x32_2x2_8x32x1_8x32x1_1x32x1x8_8_1x1_intrawave_v3,787.62,177.2,0.0
gfx942,304,40320,5120,3072,ck,0,0,1543.4905,a8w8_blockscale_1x128x128_256x128x128x128_16x16_32x32_2x2_8x32x1_8x32x1_1x32x1x8_8_1x1_intrawave_v3,821.75,357.93,0.0
gfx942,304,40320,5120,8704,ck,0,0,4477.9136,a8w8_blockscale_1x128x128_256x128x128x128_16x16_32x32_2x2_8x32x1_8x32x1_1x32x1x8_8_1x1_intrawave_v3,802.53,180.53,0.0
gfx942,304,40448,5120,3072,ck,0,0,1529.1679,a8w8_blockscale_1x128x128_256x128x128x128_16x16_32x32_2x2_8x32x1_8x32x1_1x32x1x8_8_1x1_intrawave_v3,832.08,362.4,0.0
gfx942,304,40448,5120,8704,ck,0,0,4509.858,a8w8_blockscale_1x128x128_256x128x128x128_16x16_32x32_2x2_8x32x1_8x32x1_1x32x1x8_8_1x1_intrawave_v3,799.38,179.79,0.0
gfx942,304,40576,5120,3072,ck,0,0,1542.2634,a8w8_blockscale_1x128x128_256x128x128x128_16x16_32x32_2x2_8x32x1_8x32x1_1x32x1x8_8_1x1_intrawave_v3,827.62,360.43,0.0
gfx942,304,40576,5120,8704,ck,0,0,4567.4131,a8w8_blockscale_1x128x128_256x128x128x128_16x16_32x32_2x2_8x32x1_8x32x1_1x32x1x8_8_1x1_intrawave_v3,791.8,178.05,0.0
gfx942,304,40704,5120,3072,ck,0,0,1528.851,a8w8_blockscale_1x128x128_256x128x128x128_16x16_32x32_2x2_8x32x1_8x32x1_1x32x1x8_8_1x1_intrawave_v3,837.52,364.71,0.0
gfx942,304,40704,5120,8704,ck,0,0,4656.8922,a8w8_blockscale_1x128x128_256x128x128x128_16x16_32x32_2x2_8x32x1_8x32x1_1x32x1x8_8_1x1_intrawave_v3,779.04,175.15,0.0
gfx942,304,40832,5120,3072,ck,0,0,1531.6132,a8w8_blockscale_1x128x128_256x128x128x128_16x16_32x32_2x2_8x32x1_8x32x1_1x32x1x8_8_1x1_intrawave_v3,838.63,365.16,0.0
gfx942,304,40832,5120,8704,ck,0,0,4571.7777,a8w8_blockscale_1x128x128_256x128x128x128_16x16_32x32_2x2_8x32x1_8x32x1_1x32x1x8_8_1x1_intrawave_v3,796.04,178.94,0.0
gfx942,304,40960,5120,3072,ck,0,0,1544.606,a8w8_blockscale_1x128x128_256x128x128x128_16x16_32x32_2x2_8x32x1_8x32x1_1x32x1x8_8_1x1_intrawave_v3,834.19,363.19,0.0
gfx942,304,40960,5120,8704,ck,0,0,4549.7334,a8w8_blockscale_1x128x128_256x128x128x128_16x16_32x32_2x2_8x32x1_8x32x1_1x32x1x8_8_1x1_intrawave_v3,802.4,180.34,0.0
gfx942,304,41088,5120,3072,ck,0,0,1525.9189,a8w8_blockscale_1x128x128_256x128x128x128_16x16_32x32_2x2_8x32x1_8x32x1_1x32x1x8_8_1x1_intrawave_v3,847.04,368.76,0.0
gfx942,304,41088,5120,8704,ck,0,0,4571.363,a8w8_blockscale_1x128x128_256x128x128x128_16x16_32x32_2x2_8x32x1_8x32x1_1x32x1x8_8_1x1_intrawave_v3,801.1,180.02,0.0
gfx942,304,41216,5120,3072,ck,0,0,1546.795,a8w8_blockscale_1x128x128_256x128x128x128_16x16_32x32_2x2_8x32x1_8x32x1_1x32x1x8_8_1x1_intrawave_v3,838.21,364.88,0.0
gfx942,304,41216,5120,8704,ck,0,0,4591.5562,a8w8_blockscale_1x128x128_256x128x128x128_16x16_32x32_2x2_8x32x1_8x32x1_1x32x1x8_8_1x1_intrawave_v3,800.06,179.76,0.0
gfx942,304,41344,5120,3072,ck,0,0,1560.2548,a8w8_blockscale_1x128x128_256x128x128x128_16x16_32x32_2x2_8x32x1_8x32x1_1x32x1x8_8_1x1_intrawave_v3,833.56,362.83,0.0
gfx942,304,41344,5120,8704,ck,0,0,4729.2209,a8w8_blockscale_1x128x128_256x128x128x128_16x16_32x32_2x2_8x32x1_8x32x1_1x32x1x8_8_1x1_intrawave_v3,779.19,175.04,0.0
gfx942,304,41472,5120,3072,ck,0,0,1544.1514,a8w8_blockscale_1x128x128_256x128x128x128_16x16_32x32_2x2_8x32x1_8x32x1_1x32x1x8_8_1x1_intrawave_v3,844.86,367.71,0.0
gfx942,304,41472,5120,8704,ck,0,0,4604.7238,a8w8_blockscale_1x128x128_256x128x128x128_16x16_32x32_2x2_8x32x1_8x32x1_1x32x1x8_8_1x1_intrawave_v3,802.73,180.3,0.0
gfx942,304,41600,5120,3072,ck,0,0,1585.5432,a8w8_blockscale_1x128x128_256x128x128x128_16x16_32x32_2x2_8x32x1_8x32x1_1x32x1x8_8_1x1_intrawave_v3,825.35,359.19,0.0
gfx942,304,41600,5120,8704,ck,0,0,4617.2094,a8w8_blockscale_1x128x128_256x128x128x128_16x16_32x32_2x2_8x32x1_8x32x1_1x32x1x8_8_1x1_intrawave_v3,803.03,180.33,0.0
gfx942,304,41728,5120,3072,ck,0,0,1573.4238,a8w8_blockscale_1x128x128_256x128x128x128_16x16_32x32_2x2_8x32x1_8x32x1_1x32x1x8_8_1x1_intrawave_v3,834.26,363.04,0.0
gfx942,304,41728,5120,8704,ck,0,0,4637.3799,a8w8_blockscale_1x128x128_256x128x128x128_16x16_32x32_2x2_8x32x1_8x32x1_1x32x1x8_8_1x1_intrawave_v3,802.0,180.07,0.0
gfx942,304,41856,5120,3072,ck,0,0,1573.226,a8w8_blockscale_1x128x128_256x128x128x128_16x16_32x32_2x2_8x32x1_8x32x1_1x32x1x8_8_1x1_intrawave_v3,836.93,364.17,0.0
gfx942,304,41856,5120,8704,ck,0,0,4796.7993,a8w8_blockscale_1x128x128_256x128x128x128_16x16_32x32_2x2_8x32x1_8x32x1_1x32x1x8_8_1x1_intrawave_v3,777.72,174.59,0.0
gfx942,304,41984,5120,3072,ck,0,0,1587.3489,a8w8_blockscale_1x128x128_256x128x128x128_16x16_32x32_2x2_8x32x1_8x32x1_1x32x1x8_8_1x1_intrawave_v3,832.02,362.0,0.0
gfx942,304,41984,5120,8704,ck,0,0,4714.7053,a8w8_blockscale_1x128x128_256x128x128x128_16x16_32x32_2x2_8x32x1_8x32x1_1x32x1x8_8_1x1_intrawave_v3,793.68,178.15,0.0
gfx942,304,42112,5120,3072,ck,0,0,1591.4931,a8w8_blockscale_1x128x128_256x128x128x128_16x16_32x32_2x2_8x32x1_8x32x1_1x32x1x8_8_1x1_intrawave_v3,832.38,362.13,0.0
gfx942,304,42112,5120,8704,ck,0,0,4746.2002,a8w8_blockscale_1x128x128_256x128x128x128_16x16_32x32_2x2_8x32x1_8x32x1_1x32x1x8_8_1x1_intrawave_v3,790.82,177.48,0.0
gfx942,304,42240,5120,3072,ck,0,0,1611.0905,a8w8_blockscale_1x128x128_256x128x128x128_16x16_32x32_2x2_8x32x1_8x32x1_1x32x1x8_8_1x1_intrawave_v3,824.76,358.78,0.0
gfx942,304,42240,5120,8704,ck,0,0,4831.5961,a8w8_blockscale_1x128x128_256x128x128x128_16x16_32x32_2x2_8x32x1_8x32x1_1x32x1x8_8_1x1_intrawave_v3,779.21,174.84,0.0
gfx942,304,42368,5120,3072,ck,0,0,1594.7009,a8w8_blockscale_1x128x128_256x128x128x128_16x16_32x32_2x2_8x32x1_8x32x1_1x32x1x8_8_1x1_intrawave_v3,835.76,363.54,0.0
gfx942,304,42368,5120,8704,ck,0,0,4858.8356,a8w8_blockscale_1x128x128_256x128x128x128_16x16_32x32_2x2_8x32x1_8x32x1_1x32x1x8_8_1x1_intrawave_v3,777.19,174.36,0.0
gfx942,304,42496,5120,3072,ck,0,0,1621.6758,a8w8_blockscale_1x128x128_256x128x128x128_16x16_32x32_2x2_8x32x1_8x32x1_1x32x1x8_8_1x1_intrawave_v3,824.34,358.54,0.0
gfx942,304,42496,5120,8704,ck,0,0,4714.7631,a8w8_blockscale_1x128x128_256x128x128x128_16x16_32x32_2x2_8x32x1_8x32x1_1x32x1x8_8_1x1_intrawave_v3,803.35,180.2,0.0
gfx942,304,42624,5120,3072,ck,0,0,1597.123,a8w8_blockscale_1x128x128_256x128x128x128_16x16_32x32_2x2_8x32x1_8x32x1_1x32x1x8_8_1x1_intrawave_v3,839.53,365.12,0.0
gfx942,304,42624,5120,8704,ck,0,0,4837.7244,a8w8_blockscale_1x128x128_256x128x128x128_16x16_32x32_2x2_8x32x1_8x32x1_1x32x1x8_8_1x1_intrawave_v3,785.29,176.12,0.0
gfx942,304,42752,5120,3072,ck,0,0,1601.05,a8w8_blockscale_1x128x128_256x128x128x128_16x16_32x32_2x2_8x32x1_8x32x1_1x32x1x8_8_1x1_intrawave_v3,839.99,365.29,0.0
gfx942,304,42752,5120,8704,ck,0,0,4743.0073,a8w8_blockscale_1x128x128_256x128x128x128_16x16_32x32_2x2_8x32x1_8x32x1_1x32x1x8_8_1x1_intrawave_v3,803.38,180.15,0.0
gfx942,304,42880,5120,3072,ck,0,0,1621.9368,a8w8_blockscale_1x128x128_256x128x128x128_16x16_32x32_2x2_8x32x1_8x32x1_1x32x1x8_8_1x1_intrawave_v3,831.65,361.63,0.0
gfx942,304,42880,5120,8704,ck,0,0,4883.8878,a8w8_blockscale_1x128x128_256x128x128x128_16x16_32x32_2x2_8x32x1_8x32x1_1x32x1x8_8_1x1_intrawave_v3,782.54,175.45,0.0
gfx942,304,43008,5120,3072,ck,0,0,1619.6677,a8w8_blockscale_1x128x128_256x128x128x128_16x16_32x32_2x2_8x32x1_8x32x1_1x32x1x8_8_1x1_intrawave_v3,835.3,363.19,0.0
gfx942,304,43008,5120,8704,ck,0,0,4837.7843,a8w8_blockscale_1x128x128_256x128x128x128_16x16_32x32_2x2_8x32x1_8x32x1_1x32x1x8_8_1x1_intrawave_v3,792.36,177.62,0.0
gfx942,304,43136,5120,3072,ck,0,0,1631.4323,a8w8_blockscale_1x128x128_256x128x128x128_16x16_32x32_2x2_8x32x1_8x32x1_1x32x1x8_8_1x1_intrawave_v3,831.75,361.62,0.0
gfx942,304,43136,5120,8704,ck,0,0,4785.9289,a8w8_blockscale_1x128x128_256x128x128x128_16x16_32x32_2x2_8x32x1_8x32x1_1x32x1x8_8_1x1_intrawave_v3,803.33,180.06,0.0
gfx942,304,43264,5120,3072,ck,0,0,1613.0599,a8w8_blockscale_1x128x128_256x128x128x128_16x16_32x32_2x2_8x32x1_8x32x1_1x32x1x8_8_1x1_intrawave_v3,843.72,366.79,0.0
gfx942,304,43264,5120,8704,ck,0,0,4897.1453,a8w8_blockscale_1x128x128_256x128x128x128_16x16_32x32_2x2_8x32x1_8x32x1_1x32x1x8_8_1x1_intrawave_v3,787.41,176.46,0.0
gfx942,304,43392,5120,3072,ck,0,0,1615.5738,a8w8_blockscale_1x128x128_256x128x128x128_16x16_32x32_2x2_8x32x1_8x32x1_1x32x1x8_8_1x1_intrawave_v3,844.9,367.28,0.0
gfx942,304,43392,5120,8704,ck,0,0,4927.2425,a8w8_blockscale_1x128x128_256x128x128x128_16x16_32x32_2x2_8x32x1_8x32x1_1x32x1x8_8_1x1_intrawave_v3,784.92,175.88,0.0
gfx942,304,43520,5120,3072,ck,0,0,1643.1058,a8w8_blockscale_1x128x128_256x128x128x128_16x16_32x32_2x2_8x32x1_8x32x1_1x32x1x8_8_1x1_intrawave_v3,833.19,362.16,0.0
gfx942,304,43520,5120,8704,ck,0,0,4950.5836,a8w8_blockscale_1x128x128_256x128x128x128_16x16_32x32_2x2_8x32x1_8x32x1_1x32x1x8_8_1x1_intrawave_v3,783.52,175.54,0.0
gfx942,304,43648,5120,3072,ck,0,0,1632.8653,a8w8_blockscale_1x128x128_256x128x128x128_16x16_32x32_2x2_8x32x1_8x32x1_1x32x1x8_8_1x1_intrawave_v3,840.88,365.47,0.0
gfx942,304,43648,5120,8704,ck,0,0,4878.9164,a8w8_blockscale_1x128x128_256x128x128x128_16x16_32x32_2x2_8x32x1_8x32x1_1x32x1x8_8_1x1_intrawave_v3,797.37,178.61,0.0
gfx942,304,43776,5120,3072,ck,0,0,1638.521,a8w8_blockscale_1x128x128_256x128x128x128_16x16_32x32_2x2_8x32x1_8x32x1_1x32x1x8_8_1x1_intrawave_v3,840.44,365.25,0.0
gfx942,304,43776,5120,8704,ck,0,0,4987.3599,a8w8_blockscale_1x128x128_256x128x128x128_16x16_32x32_2x2_8x32x1_8x32x1_1x32x1x8_8_1x1_intrawave_v3,782.32,175.21,0.0
gfx942,304,43904,5120,3072,ck,0,0,1675.835,a8w8_blockscale_1x128x128_256x128x128x128_16x16_32x32_2x2_8x32x1_8x32x1_1x32x1x8_8_1x1_intrawave_v3,824.13,358.14,0.0
gfx942,304,43904,5120,8704,ck,0,0,4935.4823,a8w8_blockscale_1x128x128_256x128x128x128_16x16_32x32_2x2_8x32x1_8x32x1_1x32x1x8_8_1x1_intrawave_v3,792.85,177.55,0.0
gfx942,304,44032,5120,3072,ck,0,0,1670.2574,a8w8_blockscale_1x128x128_256x128x128x128_16x16_32x32_2x2_8x32x1_8x32x1_1x32x1x8_8_1x1_intrawave_v3,829.29,360.35,0.0
gfx942,304,44032,5120,8704,ck,0,0,4936.6515,a8w8_blockscale_1x128x128_256x128x128x128_16x16_32x32_2x2_8x32x1_8x32x1_1x32x1x8_8_1x1_intrawave_v3,794.98,178.0,0.0
gfx942,304,44160,5120,3072,ck,0,0,1645.1442,a8w8_blockscale_1x128x128_256x128x128x128_16x16_32x32_2x2_8x32x1_8x32x1_1x32x1x8_8_1x1_intrawave_v3,844.4,366.89,0.0
gfx942,304,44160,5120,8704,ck,0,0,4903.3087,a8w8_blockscale_1x128x128_256x128x128x128_16x16_32x32_2x2_8x32x1_8x32x1_1x32x1x8_8_1x1_intrawave_v3,802.71,179.7,0.0
gfx942,304,44288,5120,3072,ck,0,0,1696.0063,a8w8_blockscale_1x128x128_256x128x128x128_16x16_32x32_2x2_8x32x1_8x32x1_1x32x1x8_8_1x1_intrawave_v3,821.45,356.89,0.0
gfx942,304,44288,5120,8704,ck,0,0,4947.7281,a8w8_blockscale_1x128x128_256x128x128x128_16x16_32x32_2x2_8x32x1_8x32x1_1x32x1x8_8_1x1_intrawave_v3,797.81,178.58,0.0
gfx942,304,44416,5120,3072,ck,0,0,1667.6806,a8w8_blockscale_1x128x128_256x128x128x128_16x16_32x32_2x2_8x32x1_8x32x1_1x32x1x8_8_1x1_intrawave_v3,837.81,363.98,0.0
gfx942,304,44416,5120,8704,ck,0,0,4988.9191,a8w8_blockscale_1x128x128_256x128x128x128_16x16_32x32_2x2_8x32x1_8x32x1_1x32x1x8_8_1x1_intrawave_v3,793.51,177.59,0.0
gfx942,304,44544,5120,3072,ck,0,0,1689.9222,a8w8_blockscale_1x128x128_256x128x128x128_16x16_32x32_2x2_8x32x1_8x32x1_1x32x1x8_8_1x1_intrawave_v3,829.17,360.19,0.0
gfx942,304,44544,5120,8704,ck,0,0,5070.4293,a8w8_blockscale_1x128x128_256x128x128x128_16x16_32x32_2x2_8x32x1_8x32x1_1x32x1x8_8_1x1_intrawave_v3,783.0,175.21,0.0
gfx942,304,44672,5120,3072,ck,0,0,1688.3698,a8w8_blockscale_1x128x128_256x128x128x128_16x16_32x32_2x2_8x32x1_8x32x1_1x32x1x8_8_1x1_intrawave_v3,832.32,361.53,0.0
gfx942,304,44672,5120,8704,ck,0,0,4993.7041,a8w8_blockscale_1x128x128_256x128x128x128_16x16_32x32_2x2_8x32x1_8x32x1_1x32x1x8_8_1x1_intrawave_v3,797.32,178.39,0.0
gfx942,304,44800,5120,3072,ck,0,0,1715.069,a8w8_blockscale_1x128x128_256x128x128x128_16x16_32x32_2x2_8x32x1_8x32x1_1x32x1x8_8_1x1_intrawave_v3,821.71,356.9,0.0
gfx942,304,44800,5120,8704,ck,0,0,4971.4601,a8w8_blockscale_1x128x128_256x128x128x128_16x16_32x32_2x2_8x32x1_8x32x1_1x32x1x8_8_1x1_intrawave_v3,803.18,179.68,0.0
gfx942,304,44928,5120,3072,ck,0,0,1712.3104,a8w8_blockscale_1x128x128_256x128x128x128_16x16_32x32_2x2_8x32x1_8x32x1_1x32x1x8_8_1x1_intrawave_v3,825.38,358.47,0.0
gfx942,304,44928,5120,8704,ck,0,0,5087.2518,a8w8_blockscale_1x128x128_256x128x128x128_16x16_32x32_2x2_8x32x1_8x32x1_1x32x1x8_8_1x1_intrawave_v3,787.14,176.06,0.0
gfx942,304,45056,5120,3072,ck,0,0,1680.3474,a8w8_blockscale_1x128x128_256x128x128x128_16x16_32x32_2x2_8x32x1_8x32x1_1x32x1x8_8_1x1_intrawave_v3,843.48,366.3,0.0
gfx942,304,45056,5120,8704,ck,0,0,4982.6313,a8w8_blockscale_1x128x128_256x128x128x128_16x16_32x32_2x2_8x32x1_8x32x1_1x32x1x8_8_1x1_intrawave_v3,805.96,180.25,0.0
gfx942,304,45184,5120,3072,ck,0,0,1723.2743,a8w8_blockscale_1x128x128_256x128x128x128_16x16_32x32_2x2_8x32x1_8x32x1_1x32x1x8_8_1x1_intrawave_v3,824.81,358.17,0.0
gfx942,304,45184,5120,8704,ck,0,0,5120.5139,a8w8_blockscale_1x128x128_256x128x128x128_16x16_32x32_2x2_8x32x1_8x32x1_1x32x1x8_8_1x1_intrawave_v3,786.48,175.87,0.0
gfx942,304,45312,5120,3072,ck,0,0,1731.5515,a8w8_blockscale_1x128x128_256x128x128x128_16x16_32x32_2x2_8x32x1_8x32x1_1x32x1x8_8_1x1_intrawave_v3,823.19,357.44,0.0
gfx942,304,45312,5120,8704,ck,0,0,5101.6714,a8w8_blockscale_1x128x128_256x128x128x128_16x16_32x32_2x2_8x32x1_8x32x1_1x32x1x8_8_1x1_intrawave_v3,791.63,176.99,0.0
gfx942,304,45440,5120,3072,ck,0,0,1725.6444,a8w8_blockscale_1x128x128_256x128x128x128_16x16_32x32_2x2_8x32x1_8x32x1_1x32x1x8_8_1x1_intrawave_v3,828.34,359.65,0.0
gfx942,304,45440,5120,8704,ck,0,0,5162.0976,a8w8_blockscale_1x128x128_256x128x128x128_16x16_32x32_2x2_8x32x1_8x32x1_1x32x1x8_8_1x1_intrawave_v3,784.57,175.39,0.0
gfx942,304,45568,5120,3072,ck,0,0,1715.6758,a8w8_blockscale_1x128x128_256x128x128x128_16x16_32x32_2x2_8x32x1_8x32x1_1x32x1x8_8_1x1_intrawave_v3,835.5,362.73,0.0
gfx942,304,45568,5120,8704,ck,0,0,5122.9695,a8w8_blockscale_1x128x128_256x128x128x128_16x16_32x32_2x2_8x32x1_8x32x1_1x32x1x8_8_1x1_intrawave_v3,792.79,177.2,0.0
gfx942,304,45696,5120,3072,ck,0,0,1750.9408,a8w8_blockscale_1x128x128_256x128x128x128_16x16_32x32_2x2_8x32x1_8x32x1_1x32x1x8_8_1x1_intrawave_v3,820.97,356.4,0.0
gfx942,304,45696,5120,8704,ck,0,0,5153.6668,a8w8_blockscale_1x128x128_256x128x128x128_16x16_32x32_2x2_8x32x1_8x32x1_1x32x1x8_8_1x1_intrawave_v3,790.28,176.62,0.0
gfx942,304,45824,5120,3072,ck,0,0,1728.496,a8w8_blockscale_1x128x128_256x128x128x128_16x16_32x32_2x2_8x32x1_8x32x1_1x32x1x8_8_1x1_intrawave_v3,833.96,362.01,0.0
gfx942,304,45824,5120,8704,ck,0,0,5194.3008,a8w8_blockscale_1x128x128_256x128x128x128_16x16_32x32_2x2_8x32x1_8x32x1_1x32x1x8_8_1x1_intrawave_v3,786.29,175.7,0.0
gfx942,304,45952,5120,3072,ck,0,0,1719.3325,a8w8_blockscale_1x128x128_256x128x128x128_16x16_32x32_2x2_8x32x1_8x32x1_1x32x1x8_8_1x1_intrawave_v3,840.75,364.93,0.0
gfx942,304,45952,5120,8704,ck,0,0,5213.2604,a8w8_blockscale_1x128x128_256x128x128x128_16x16_32x32_2x2_8x32x1_8x32x1_1x32x1x8_8_1x1_intrawave_v3,785.62,175.53,0.0
gfx942,304,46080,5120,3072,ck,0,0,1743.16,a8w8_blockscale_1x128x128_256x128x128x128_16x16_32x32_2x2_8x32x1_8x32x1_1x32x1x8_8_1x1_intrawave_v3,831.57,360.92,0.0
gfx942,304,46080,5120,8704,ck,0,0,5195.7059,a8w8_blockscale_1x128x128_256x128x128x128_16x16_32x32_2x2_8x32x1_8x32x1_1x32x1x8_8_1x1_intrawave_v3,790.47,176.59,0.0
gfx942,304,46208,5120,3072,ck,0,0,1730.1397,a8w8_blockscale_1x128x128_256x128x128x128_16x16_32x32_2x2_8x32x1_8x32x1_1x32x1x8_8_1x1_intrawave_v3,840.15,364.62,0.0
gfx942,304,46208,5120,8704,ck,0,0,5201.7453,a8w8_blockscale_1x128x128_256x128x128x128_16x16_32x32_2x2_8x32x1_8x32x1_1x32x1x8_8_1x1_intrawave_v3,791.75,176.85,0.0
gfx942,304,46336,5120,3072,ck,0,0,1747.6374,a8w8_blockscale_1x128x128_256x128x128x128_16x16_32x32_2x2_8x32x1_8x32x1_1x32x1x8_8_1x1_intrawave_v3,834.04,361.95,0.0
gfx942,304,46336,5120,8704,ck,0,0,5214.2197,a8w8_blockscale_1x128x128_256x128x128x128_16x16_32x32_2x2_8x32x1_8x32x1_1x32x1x8_8_1x1_intrawave_v3,792.04,176.89,0.0
gfx942,304,46464,5120,3072,ck,0,0,1739.357,a8w8_blockscale_1x128x128_256x128x128x128_16x16_32x32_2x2_8x32x1_8x32x1_1x32x1x8_8_1x1_intrawave_v3,840.33,364.65,0.0
gfx942,304,46464,5120,8704,ck,0,0,5295.247,a8w8_blockscale_1x128x128_256x128x128x128_16x16_32x32_2x2_8x32x1_8x32x1_1x32x1x8_8_1x1_intrawave_v3,782.08,174.64,0.0
gfx942,304,46592,5120,3072,ck,0,0,1752.2551,a8w8_blockscale_1x128x128_256x128x128x128_16x16_32x32_2x2_8x32x1_8x32x1_1x32x1x8_8_1x1_intrawave_v3,836.44,362.94,0.0
gfx942,304,46592,5120,8704,ck,0,0,5138.6573,a8w8_blockscale_1x128x128_256x128x128x128_16x16_32x32_2x2_8x32x1_8x32x1_1x32x1x8_8_1x1_intrawave_v3,808.13,180.44,0.0
gfx942,304,46720,5120,3072,ck,0,0,1762.5439,a8w8_blockscale_1x128x128_256x128x128x128_16x16_32x32_2x2_8x32x1_8x32x1_1x32x1x8_8_1x1_intrawave_v3,833.84,361.79,0.0
gfx942,304,46720,5120,8704,ck,0,0,5220.4685,a8w8_blockscale_1x128x128_256x128x128x128_16x16_32x32_2x2_8x32x1_8x32x1_1x32x1x8_8_1x1_intrawave_v3,797.65,178.07,0.0
gfx942,304,46848,5120,3072,ck,0,0,1769.5728,a8w8_blockscale_1x128x128_256x128x128x128_16x16_32x32_2x2_8x32x1_8x32x1_1x32x1x8_8_1x1_intrawave_v3,832.81,361.31,0.0
gfx942,304,46848,5120,8704,ck,0,0,5230.7739,a8w8_blockscale_1x128x128_256x128x128x128_16x16_32x32_2x2_8x32x1_8x32x1_1x32x1x8_8_1x1_intrawave_v3,798.26,178.19,0.0
gfx942,304,46976,5120,3072,ck,0,0,1760.7865,a8w8_blockscale_1x128x128_256x128x128x128_16x16_32x32_2x2_8x32x1_8x32x1_1x32x1x8_8_1x1_intrawave_v3,839.25,364.08,0.0
gfx942,304,46976,5120,8704,ck,0,0,5237.3828,a8w8_blockscale_1x128x128_256x128x128x128_16x16_32x32_2x2_8x32x1_8x32x1_1x32x1x8_8_1x1_intrawave_v3,799.43,178.42,0.0
gfx942,304,47104,5120,3072,ck,0,0,1782.5879,a8w8_blockscale_1x128x128_256x128x128x128_16x16_32x32_2x2_8x32x1_8x32x1_1x32x1x8_8_1x1_intrawave_v3,831.24,360.59,0.0
gfx942,304,47104,5120,8704,ck,0,0,5190.3879,a8w8_blockscale_1x128x128_256x128x128x128_16x16_32x32_2x2_8x32x1_8x32x1_1x32x1x8_8_1x1_intrawave_v3,808.87,180.51,0.0
gfx942,304,47232,5120,3072,ck,0,0,1765.0856,a8w8_blockscale_1x128x128_256x128x128x128_16x16_32x32_2x2_8x32x1_8x32x1_1x32x1x8_8_1x1_intrawave_v3,841.77,365.13,0.0
gfx942,304,47232,5120,8704,ck,0,0,5307.8704,a8w8_blockscale_1x128x128_256x128x128x128_16x16_32x32_2x2_8x32x1_8x32x1_1x32x1x8_8_1x1_intrawave_v3,793.11,176.97,0.0
gfx942,304,47360,5120,3072,ck,0,0,1793.3094,a8w8_blockscale_1x128x128_256x128x128x128_16x16_32x32_2x2_8x32x1_8x32x1_1x32x1x8_8_1x1_intrawave_v3,830.76,360.33,0.0
gfx942,304,47360,5120,8704,ck,0,0,5338.2807,a8w8_blockscale_1x128x128_256x128x128x128_16x16_32x32_2x2_8x32x1_8x32x1_1x32x1x8_8_1x1_intrawave_v3,790.73,176.41,0.0
gfx942,304,47488,5120,3072,ck,0,0,1789.1015,a8w8_blockscale_1x128x128_256x128x128x128_16x16_32x32_2x2_8x32x1_8x32x1_1x32x1x8_8_1x1_intrawave_v3,834.97,362.13,0.0
gfx942,304,47488,5120,8704,ck,0,0,5390.7055,a8w8_blockscale_1x128x128_256x128x128x128_16x16_32x32_2x2_8x32x1_8x32x1_1x32x1x8_8_1x1_intrawave_v3,785.16,175.15,0.0
gfx942,304,47616,5120,3072,ck,0,0,1792.9357,a8w8_blockscale_1x128x128_256x128x128x128_16x16_32x32_2x2_8x32x1_8x32x1_1x32x1x8_8_1x1_intrawave_v3,835.43,362.31,0.0
gfx942,304,47616,5120,8704,ck,0,0,5277.4166,a8w8_blockscale_1x128x128_256x128x128x128_16x16_32x32_2x2_8x32x1_8x32x1_1x32x1x8_8_1x1_intrawave_v3,804.17,179.37,0.0
gfx942,304,47744,5120,3072,ck,0,0,1839.7361,a8w8_blockscale_1x128x128_256x128x128x128_16x16_32x32_2x2_8x32x1_8x32x1_1x32x1x8_8_1x1_intrawave_v3,816.37,354.02,0.0
gfx942,304,47744,5120,8704,ck,0,0,5424.4027,a8w8_blockscale_1x128x128_256x128x128x128_16x16_32x32_2x2_8x32x1_8x32x1_1x32x1x8_8_1x1_intrawave_v3,784.49,174.96,0.0
gfx942,304,47872,5120,3072,ck,0,0,1826.3756,a8w8_blockscale_1x128x128_256x128x128x128_16x16_32x32_2x2_8x32x1_8x32x1_1x32x1x8_8_1x1_intrawave_v3,824.54,357.54,0.0
gfx942,304,47872,5120,8704,ck,0,0,5449.8471,a8w8_blockscale_1x128x128_256x128x128x128_16x16_32x32_2x2_8x32x1_8x32x1_1x32x1x8_8_1x1_intrawave_v3,782.92,174.58,0.0
gfx942,304,48000,5120,3072,ck,0,0,1811.2907,a8w8_blockscale_1x128x128_256x128x128x128_16x16_32x32_2x2_8x32x1_8x32x1_1x32x1x8_8_1x1_intrawave_v3,833.63,361.46,0.0
gfx942,304,48000,5120,8704,ck,0,0,5433.3991,a8w8_blockscale_1x128x128_256x128x128x128_16x16_32x32_2x2_8x32x1_8x32x1_1x32x1x8_8_1x1_intrawave_v3,787.39,175.56,0.0
gfx942,304,48128,5120,3072,ck,0,0,1828.3261,a8w8_blockscale_1x128x128_256x128x128x128_16x16_32x32_2x2_8x32x1_8x32x1_1x32x1x8_8_1x1_intrawave_v3,828.07,359.02,0.0
gfx942,304,48128,5120,8704,ck,0,0,5322.6595,a8w8_blockscale_1x128x128_256x128x128x128_16x16_32x32_2x2_8x32x1_8x32x1_1x32x1x8_8_1x1_intrawave_v3,805.91,179.67,0.0
gfx942,304,48256,5120,3072,ck,0,0,1810.4474,a8w8_blockscale_1x128x128_256x128x128x128_16x16_32x32_2x2_8x32x1_8x32x1_1x32x1x8_8_1x1_intrawave_v3,838.47,363.51,0.0
gfx942,304,48256,5120,8704,ck,0,0,5475.1578,a8w8_blockscale_1x128x128_256x128x128x128_16x16_32x32_2x2_8x32x1_8x32x1_1x32x1x8_8_1x1_intrawave_v3,785.55,175.1,0.0
gfx942,304,48384,5120,3072,ck,0,0,1837.8177,a8w8_blockscale_1x128x128_256x128x128x128_16x16_32x32_2x2_8x32x1_8x32x1_1x32x1x8_8_1x1_intrawave_v3,828.17,359.02,0.0
gfx942,304,48384,5120,8704,ck,0,0,5361.1754,a8w8_blockscale_1x128x128_256x128x128x128_16x16_32x32_2x2_8x32x1_8x32x1_1x32x1x8_8_1x1_intrawave_v3,804.38,179.28,0.0
gfx942,304,48512,5120,3072,ck,0,0,1864.3174,a8w8_blockscale_1x128x128_256x128x128x128_16x16_32x32_2x2_8x32x1_8x32x1_1x32x1x8_8_1x1_intrawave_v3,818.56,354.83,0.0
gfx942,304,48512,5120,8704,ck,0,0,5382.3929,a8w8_blockscale_1x128x128_256x128x128x128_16x16_32x32_2x2_8x32x1_8x32x1_1x32x1x8_8_1x1_intrawave_v3,803.33,179.02,0.0
gfx942,304,48640,5120,3072,ck,0,0,1847.7286,a8w8_blockscale_1x128x128_256x128x128x128_16x16_32x32_2x2_8x32x1_8x32x1_1x32x1x8_8_1x1_intrawave_v3,828.09,358.94,0.0
gfx942,304,48640,5120,8704,ck,0,0,5449.9509,a8w8_blockscale_1x128x128_256x128x128x128_16x16_32x32_2x2_8x32x1_8x32x1_1x32x1x8_8_1x1_intrawave_v3,795.46,177.25,0.0
gfx942,304,48768,5120,3072,ck,0,0,1849.8171,a8w8_blockscale_1x128x128_256x128x128x128_16x16_32x32_2x2_8x32x1_8x32x1_1x32x1x8_8_1x1_intrawave_v3,829.33,359.46,0.0
gfx942,304,48768,5120,8704,ck,0,0,5414.6221,a8w8_blockscale_1x128x128_256x128x128x128_16x16_32x32_2x2_8x32x1_8x32x1_1x32x1x8_8_1x1_intrawave_v3,802.76,178.85,0.0
gfx942,304,48896,5120,3072,ck,0,0,1846.8053,a8w8_blockscale_1x128x128_256x128x128x128_16x16_32x32_2x2_8x32x1_8x32x1_1x32x1x8_8_1x1_intrawave_v3,832.86,360.97,0.0
gfx942,304,48896,5120,8704,ck,0,0,5433.8961,a8w8_blockscale_1x128x128_256x128x128x128_16x16_32x32_2x2_8x32x1_8x32x1_1x32x1x8_8_1x1_intrawave_v3,802.01,178.67,0.0
gfx942,304,49024,5120,3072,ck,0,0,1853.8392,a8w8_blockscale_1x128x128_256x128x128x128_16x16_32x32_2x2_8x32x1_8x32x1_1x32x1x8_8_1x1_intrawave_v3,831.87,360.51,0.0
gfx942,304,49024,5120,8704,ck,0,0,5451.2615,a8w8_blockscale_1x128x128_256x128x128x128_16x16_32x32_2x2_8x32x1_8x32x1_1x32x1x8_8_1x1_intrawave_v3,801.55,178.54,0.0
gfx942,304,49152,5120,3072,ck,0,0,1852.6119,a8w8_blockscale_1x128x128_256x128x128x128_16x16_32x32_2x2_8x32x1_8x32x1_1x32x1x8_8_1x1_intrawave_v3,834.6,361.67,0.0
gfx942,304,49152,5120,8704,ck,0,0,5627.3636,a8w8_blockscale_1x128x128_256x128x128x128_16x16_32x32_2x2_8x32x1_8x32x1_1x32x1x8_8_1x1_intrawave_v3,778.49,173.38,0.0
gfx942,304,49280,5120,3072,ck,0,0,1855.8502,a8w8_blockscale_1x128x128_256x128x128x128_16x16_32x32_2x2_8x32x1_8x32x1_1x32x1x8_8_1x1_intrawave_v3,835.31,361.96,0.0
gfx942,304,49280,5120,8704,ck,0,0,5645.6657,a8w8_blockscale_1x128x128_256x128x128x128_16x16_32x32_2x2_8x32x1_8x32x1_1x32x1x8_8_1x1_intrawave_v3,777.99,173.25,0.0
gfx942,304,49408,5120,3072,ck,0,0,1880.1265,a8w8_blockscale_1x128x128_256x128x128x128_16x16_32x32_2x2_8x32x1_8x32x1_1x32x1x8_8_1x1_intrawave_v3,826.67,358.19,0.0
gfx942,304,49408,5120,8704,ck,0,0,5502.3918,a8w8_blockscale_1x128x128_256x128x128x128_16x16_32x32_2x2_8x32x1_8x32x1_1x32x1x8_8_1x1_intrawave_v3,800.32,178.2,0.0
gfx942,304,49536,5120,3072,ck,0,0,1886.288,a8w8_blockscale_1x128x128_256x128x128x128_16x16_32x32_2x2_8x32x1_8x32x1_1x32x1x8_8_1x1_intrawave_v3,826.1,357.93,0.0
gfx942,304,49536,5120,8704,ck,0,0,5677.3966,a8w8_blockscale_1x128x128_256x128x128x128_16x16_32x32_2x2_8x32x1_8x32x1_1x32x1x8_8_1x1_intrawave_v3,777.66,173.14,0.0
gfx942,304,49664,5120,3072,ck,0,0,1876.0894,a8w8_blockscale_1x128x128_256x128x128x128_16x16_32x32_2x2_8x32x1_8x32x1_1x32x1x8_8_1x1_intrawave_v3,832.74,360.78,0.0
gfx942,304,49664,5120,8704,ck,0,0,5517.2733,a8w8_blockscale_1x128x128_256x128x128x128_16x16_32x32_2x2_8x32x1_8x32x1_1x32x1x8_8_1x1_intrawave_v3,802.3,178.6,0.0
gfx942,304,49792,5120,3072,ck,0,0,1879.0393,a8w8_blockscale_1x128x128_256x128x128x128_16x16_32x32_2x2_8x32x1_8x32x1_1x32x1x8_8_1x1_intrawave_v3,833.58,361.12,0.0
gfx942,304,49792,5120,8704,ck,0,0,5537.7845,a8w8_blockscale_1x128x128_256x128x128x128_16x16_32x32_2x2_8x32x1_8x32x1_1x32x1x8_8_1x1_intrawave_v3,801.39,178.38,0.0
gfx942,304,49920,5120,3072,ck,0,0,1890.6934,a8w8_blockscale_1x128x128_256x128x128x128_16x16_32x32_2x2_8x32x1_8x32x1_1x32x1x8_8_1x1_intrawave_v3,830.57,359.8,0.0
gfx942,304,49920,5120,8704,ck,0,0,5522.3607,a8w8_blockscale_1x128x128_256x128x128x128_16x16_32x32_2x2_8x32x1_8x32x1_1x32x1x8_8_1x1_intrawave_v3,805.69,179.32,0.0
gfx942,304,50048,5120,3072,ck,0,0,1887.1063,a8w8_blockscale_1x128x128_256x128x128x128_16x16_32x32_2x2_8x32x1_8x32x1_1x32x1x8_8_1x1_intrawave_v3,834.28,361.38,0.0
gfx942,304,50048,5120,8704,ck,0,0,5692.2725,a8w8_blockscale_1x128x128_256x128x128x128_16x16_32x32_2x2_8x32x1_8x32x1_1x32x1x8_8_1x1_intrawave_v3,783.65,174.39,0.0
gfx942,304,50176,5120,3072,ck,0,0,1916.2609,a8w8_blockscale_1x128x128_256x128x128x128_16x16_32x32_2x2_8x32x1_8x32x1_1x32x1x8_8_1x1_intrawave_v3,823.69,356.77,0.0
gfx942,304,50176,5120,8704,ck,0,0,5640.2559,a8w8_blockscale_1x128x128_256x128x128x128_16x16_32x32_2x2_8x32x1_8x32x1_1x32x1x8_8_1x1_intrawave_v3,792.9,176.43,0.0
gfx942,304,50304,5120,3072,ck,0,0,1903.7265,a8w8_blockscale_1x128x128_256x128x128x128_16x16_32x32_2x2_8x32x1_8x32x1_1x32x1x8_8_1x1_intrawave_v3,831.23,360.02,0.0
gfx942,304,50304,5120,8704,ck,0,0,5777.0143,a8w8_blockscale_1x128x128_256x128x128x128_16x16_32x32_2x2_8x32x1_8x32x1_1x32x1x8_8_1x1_intrawave_v3,776.1,172.67,0.0
gfx942,304,50432,5120,3072,ck,0,0,1908.7873,a8w8_blockscale_1x128x128_256x128x128x128_16x16_32x32_2x2_8x32x1_8x32x1_1x32x1x8_8_1x1_intrawave_v3,831.13,359.96,0.0
gfx942,304,50432,5120,8704,ck,0,0,5600.3039,a8w8_blockscale_1x128x128_256x128x128x128_16x16_32x32_2x2_8x32x1_8x32x1_1x32x1x8_8_1x1_intrawave_v3,802.63,178.55,0.0
gfx942,304,50560,5120,3072,ck,0,0,1924.3311,a8w8_blockscale_1x128x128_256x128x128x128_16x16_32x32_2x2_8x32x1_8x32x1_1x32x1x8_8_1x1_intrawave_v3,826.51,357.93,0.0
gfx942,304,50560,5120,8704,ck,0,0,5674.8518,a8w8_blockscale_1x128x128_256x128x128x128_16x16_32x32_2x2_8x32x1_8x32x1_1x32x1x8_8_1x1_intrawave_v3,794.09,176.63,0.0
gfx942,304,50688,5120,3072,ck,0,0,1942.6563,a8w8_blockscale_1x128x128_256x128x128x128_16x16_32x32_2x2_8x32x1_8x32x1_1x32x1x8_8_1x1_intrawave_v3,820.79,355.43,0.0
gfx942,304,50688,5120,8704,ck,0,0,5632.4922,a8w8_blockscale_1x128x128_256x128x128x128_16x16_32x32_2x2_8x32x1_8x32x1_1x32x1x8_8_1x1_intrawave_v3,802.09,178.39,0.0
gfx942,304,50816,5120,3072,ck,0,0,1927.5252,a8w8_blockscale_1x128x128_256x128x128x128_16x16_32x32_2x2_8x32x1_8x32x1_1x32x1x8_8_1x1_intrawave_v3,829.32,359.11,0.0
gfx942,304,50816,5120,8704,ck,0,0,5726.3109,a8w8_blockscale_1x128x128_256x128x128x128_16x16_32x32_2x2_8x32x1_8x32x1_1x32x1x8_8_1x1_intrawave_v3,790.94,175.89,0.0
gfx942,304,50944,5120,3072,ck,0,0,1923.0892,a8w8_blockscale_1x128x128_256x128x128x128_16x16_32x32_2x2_8x32x1_8x32x1_1x32x1x8_8_1x1_intrawave_v3,833.33,360.82,0.0
gfx942,304,50944,5120,8704,ck,0,0,5792.2621,a8w8_blockscale_1x128x128_256x128x128x128_16x16_32x32_2x2_8x32x1_8x32x1_1x32x1x8_8_1x1_intrawave_v3,783.91,174.31,0.0
gfx942,304,51072,5120,3072,ck,0,0,1901.9444,a8w8_blockscale_1x128x128_256x128x128x128_16x16_32x32_2x2_8x32x1_8x32x1_1x32x1x8_8_1x1_intrawave_v3,844.71,365.73,0.0
gfx942,304,51072,5120,8704,ck,0,0,5788.476,a8w8_blockscale_1x128x128_256x128x128x128_16x16_32x32_2x2_8x32x1_8x32x1_1x32x1x8_8_1x1_intrawave_v3,786.39,174.84,0.0
gfx942,304,51200,5120,3072,ck,0,0,1935.7969,a8w8_blockscale_1x128x128_256x128x128x128_16x16_32x32_2x2_8x32x1_8x32x1_1x32x1x8_8_1x1_intrawave_v3,832.02,360.21,0.0
gfx942,304,51200,5120,8704,ck,0,0,5674.2872,a8w8_blockscale_1x128x128_256x128x128x128_16x16_32x32_2x2_8x32x1_8x32x1_1x32x1x8_8_1x1_intrawave_v3,804.22,178.79,0.0
gfx942,304,51328,5120,3072,ck,0,0,1948.6738,a8w8_blockscale_1x128x128_256x128x128x128_16x16_32x32_2x2_8x32x1_8x32x1_1x32x1x8_8_1x1_intrawave_v3,828.58,358.71,0.0
gfx942,304,51328,5120,8704,ck,0,0,5823.3382,a8w8_blockscale_1x128x128_256x128x128x128_16x16_32x32_2x2_8x32x1_8x32x1_1x32x1x8_8_1x1_intrawave_v3,785.6,174.63,0.0
gfx942,304,51456,5120,3072,ck,0,0,1947.9636,a8w8_blockscale_1x128x128_256x128x128x128_16x16_32x32_2x2_8x32x1_8x32x1_1x32x1x8_8_1x1_intrawave_v3,830.95,359.71,0.0
gfx942,304,51456,5120,8704,ck,0,0,5832.4211,a8w8_blockscale_1x128x128_256x128x128x128_16x16_32x32_2x2_8x32x1_8x32x1_1x32x1x8_8_1x1_intrawave_v3,786.33,174.77,0.0
gfx942,304,51584,5120,3072,ck,0,0,1921.0254,a8w8_blockscale_1x128x128_256x128x128x128_16x16_32x32_2x2_8x32x1_8x32x1_1x32x1x8_8_1x1_intrawave_v3,844.7,365.65,0.0
gfx942,304,51584,5120,8704,ck,0,0,5804.5768,a8w8_blockscale_1x128x128_256x128x128x128_16x16_32x32_2x2_8x32x1_8x32x1_1x32x1x8_8_1x1_intrawave_v3,792.07,176.03,0.0
gfx942,304,51712,5120,3072,ck,0,0,1945.0101,a8w8_blockscale_1x128x128_256x128x128x128_16x16_32x32_2x2_8x32x1_8x32x1_1x32x1x8_8_1x1_intrawave_v3,836.35,362.01,0.0
gfx942,304,51712,5120,8704,ck,0,0,5774.5047,a8w8_blockscale_1x128x128_256x128x128x128_16x16_32x32_2x2_8x32x1_8x32x1_1x32x1x8_8_1x1_intrawave_v3,798.17,177.37,0.0
gfx942,304,51840,5120,3072,ck,0,0,1987.9105,a8w8_blockscale_1x128x128_256x128x128x128_16x16_32x32_2x2_8x32x1_8x32x1_1x32x1x8_8_1x1_intrawave_v3,820.33,355.06,0.0
gfx942,304,51840,5120,8704,ck,0,0,5843.5549,a8w8_blockscale_1x128x128_256x128x128x128_16x16_32x32_2x2_8x32x1_8x32x1_1x32x1x8_8_1x1_intrawave_v3,790.69,175.68,0.0
gfx942,304,51968,5120,3072,ck,0,0,1945.1219,a8w8_blockscale_1x128x128_256x128x128x128_16x16_32x32_2x2_8x32x1_8x32x1_1x32x1x8_8_1x1_intrawave_v3,840.45,363.74,0.0
gfx942,304,51968,5120,8704,ck,0,0,5773.3742,a8w8_blockscale_1x128x128_256x128x128x128_16x16_32x32_2x2_8x32x1_8x32x1_1x32x1x8_8_1x1_intrawave_v3,802.28,178.24,0.0
gfx942,304,52096,5120,3072,ck,0,0,1938.5485,a8w8_blockscale_1x128x128_256x128x128x128_16x16_32x32_2x2_8x32x1_8x32x1_1x32x1x8_8_1x1_intrawave_v3,845.37,365.86,0.0
gfx942,304,52096,5120,8704,ck,0,0,5922.5022,a8w8_blockscale_1x128x128_256x128x128x128_16x16_32x32_2x2_8x32x1_8x32x1_1x32x1x8_8_1x1_intrawave_v3,784.0,174.16,0.0
gfx942,304,52224,5120,3072,ck,0,0,2007.1853,a8w8_blockscale_1x128x128_256x128x128x128_16x16_32x32_2x2_8x32x1_8x32x1_1x32x1x8_8_1x1_intrawave_v3,818.47,354.19,0.0
gfx942,304,52224,5120,8704,ck,0,0,5841.2151,a8w8_blockscale_1x128x128_256x128x128x128_16x16_32x32_2x2_8x32x1_8x32x1_1x32x1x8_8_1x1_intrawave_v3,796.87,177.0,0.0
gfx942,304,52352,5120,3072,ck,0,0,1955.5156,a8w8_blockscale_1x128x128_256x128x128x128_16x16_32x32_2x2_8x32x1_8x32x1_1x32x1x8_8_1x1_intrawave_v3,842.16,364.42,0.0
gfx942,304,52352,5120,8704,ck,0,0,5851.5403,a8w8_blockscale_1x128x128_256x128x128x128_16x16_32x32_2x2_8x32x1_8x32x1_1x32x1x8_8_1x1_intrawave_v3,797.41,177.1,0.0
gfx942,304,52480,5120,3072,ck,0,0,1972.8934,a8w8_blockscale_1x128x128_256x128x128x128_16x16_32x32_2x2_8x32x1_8x32x1_1x32x1x8_8_1x1_intrawave_v3,836.78,362.08,0.0
gfx942,304,52480,5120,8704,ck,0,0,6008.2073,a8w8_blockscale_1x128x128_256x128x128x128_16x16_32x32_2x2_8x32x1_8x32x1_1x32x1x8_8_1x1_intrawave_v3,778.52,172.89,0.0
gfx942,304,52608,5120,3072,ck,0,0,1984.4049,a8w8_blockscale_1x128x128_256x128x128x128_16x16_32x32_2x2_8x32x1_8x32x1_1x32x1x8_8_1x1_intrawave_v3,833.96,360.84,0.0
gfx942,304,52608,5120,8704,ck,0,0,5967.0718,a8w8_blockscale_1x128x128_256x128x128x128_16x16_32x32_2x2_8x32x1_8x32x1_1x32x1x8_8_1x1_intrawave_v3,785.8,174.49,0.0
gfx942,304,52736,5120,3072,ck,0,0,1963.1629,a8w8_blockscale_1x128x128_256x128x128x128_16x16_32x32_2x2_8x32x1_8x32x1_1x32x1x8_8_1x1_intrawave_v3,845.03,365.61,0.0
gfx942,304,52736,5120,8704,ck,0,0,5864.4561,a8w8_blockscale_1x128x128_256x128x128x128_16x16_32x32_2x2_8x32x1_8x32x1_1x32x1x8_8_1x1_intrawave_v3,801.49,177.95,0.0
gfx942,304,52864,5120,3072,ck,0,0,1996.1315,a8w8_blockscale_1x128x128_256x128x128x128_16x16_32x32_2x2_8x32x1_8x32x1_1x32x1x8_8_1x1_intrawave_v3,833.09,360.42,0.0
gfx942,304,52864,5120,8704,ck,0,0,5926.7283,a8w8_blockscale_1x128x128_256x128x128x128_16x16_32x32_2x2_8x32x1_8x32x1_1x32x1x8_8_1x1_intrawave_v3,794.99,176.49,0.0
gfx942,304,52992,5120,3072,ck,0,0,2002.3311,a8w8_blockscale_1x128x128_256x128x128x128_16x16_32x32_2x2_8x32x1_8x32x1_1x32x1x8_8_1x1_intrawave_v3,832.52,360.16,0.0
gfx942,304,52992,5120,8704,ck,0,0,5899.9701,a8w8_blockscale_1x128x128_256x128x128x128_16x16_32x32_2x2_8x32x1_8x32x1_1x32x1x8_8_1x1_intrawave_v3,800.53,177.7,0.0
gfx942,304,53120,5120,3072,ck,0,0,1995.6735,a8w8_blockscale_1x128x128_256x128x128x128_16x16_32x32_2x2_8x32x1_8x32x1_1x32x1x8_8_1x1_intrawave_v3,837.32,362.21,0.0
gfx942,304,53120,5120,8704,ck,0,0,5907.5606,a8w8_blockscale_1x128x128_256x128x128x128_16x16_32x32_2x2_8x32x1_8x32x1_1x32x1x8_8_1x1_intrawave_v3,801.44,177.89,0.0
gfx942,304,53248,5120,3072,ck,0,0,2012.3046,a8w8_blockscale_1x128x128_256x128x128x128_16x16_32x32_2x2_8x32x1_8x32x1_1x32x1x8_8_1x1_intrawave_v3,832.4,360.07,0.0
gfx942,304,53248,5120,8704,ck,0,0,5988.5052,a8w8_blockscale_1x128x128_256x128x128x128_16x16_32x32_2x2_8x32x1_8x32x1_1x32x1x8_8_1x1_intrawave_v3,792.51,175.89,0.0
gfx942,304,53376,5120,3072,ck,0,0,2066.5645,a8w8_blockscale_1x128x128_256x128x128x128_16x16_32x32_2x2_8x32x1_8x32x1_1x32x1x8_8_1x1_intrawave_v3,812.49,351.44,0.0
gfx942,304,53376,5120,8704,ck,0,0,6116.0592,a8w8_blockscale_1x128x128_256x128x128x128_16x16_32x32_2x2_8x32x1_8x32x1_1x32x1x8_8_1x1_intrawave_v3,777.85,172.61,0.0
gfx942,304,53504,5120,3072,ck,0,0,2030.867,a8w8_blockscale_1x128x128_256x128x128x128_16x16_32x32_2x2_8x32x1_8x32x1_1x32x1x8_8_1x1_intrawave_v3,828.75,358.45,0.0
gfx942,304,53504,5120,8704,ck,0,0,5974.9785,a8w8_blockscale_1x128x128_256x128x128x128_16x16_32x32_2x2_8x32x1_8x32x1_1x32x1x8_8_1x1_intrawave_v3,798.12,177.1,0.0
gfx942,304,53632,5120,3072,ck,0,0,2027.8476,a8w8_blockscale_1x128x128_256x128x128x128_16x16_32x32_2x2_8x32x1_8x32x1_1x32x1x8_8_1x1_intrawave_v3,831.97,359.83,0.0
gfx942,304,53632,5120,8704,ck,0,0,5994.4552,a8w8_blockscale_1x128x128_256x128x128x128_16x16_32x32_2x2_8x32x1_8x32x1_1x32x1x8_8_1x1_intrawave_v3,797.43,176.93,0.0
gfx942,304,53760,5120,3072,ck,0,0,2036.5368,a8w8_blockscale_1x128x128_256x128x128x128_16x16_32x32_2x2_8x32x1_8x32x1_1x32x1x8_8_1x1_intrawave_v3,830.4,359.13,0.0
gfx942,304,53760,5120,8704,ck,0,0,6107.3733,a8w8_blockscale_1x128x128_256x128x128x128_16x16_32x32_2x2_8x32x1_8x32x1_1x32x1x8_8_1x1_intrawave_v3,784.56,174.05,0.0
gfx942,304,53888,5120,3072,ck,0,0,1987.1446,a8w8_blockscale_1x128x128_256x128x128x128_16x16_32x32_2x2_8x32x1_8x32x1_1x32x1x8_8_1x1_intrawave_v3,853.07,368.91,0.0
gfx942,304,53888,5120,8704,ck,0,0,6071.905,a8w8_blockscale_1x128x128_256x128x128x128_16x16_32x32_2x2_8x32x1_8x32x1_1x32x1x8_8_1x1_intrawave_v3,791.02,175.47,0.0
gfx942,304,54016,5120,3072,ck,0,0,2035.6951,a8w8_blockscale_1x128x128_256x128x128x128_16x16_32x32_2x2_8x32x1_8x32x1_1x32x1x8_8_1x1_intrawave_v3,834.7,360.95,0.0
gfx942,304,54016,5120,8704,ck,0,0,6031.405,a8w8_blockscale_1x128x128_256x128x128x128_16x16_32x32_2x2_8x32x1_8x32x1_1x32x1x8_8_1x1_intrawave_v3,798.22,177.05,0.0
gfx942,304,54144,5120,3072,ck,0,0,2028.9149,a8w8_blockscale_1x128x128_256x128x128x128_16x16_32x32_2x2_8x32x1_8x32x1_1x32x1x8_8_1x1_intrawave_v3,839.47,363.0,0.0
gfx942,304,54144,5120,8704,ck,0,0,6156.7174,a8w8_blockscale_1x128x128_256x128x128x128_16x16_32x32_2x2_8x32x1_8x32x1_1x32x1x8_8_1x1_intrawave_v3,783.83,173.84,0.0
gfx942,304,54272,5120,3072,ck,0,0,2050.3544,a8w8_blockscale_1x128x128_256x128x128x128_16x16_32x32_2x2_8x32x1_8x32x1_1x32x1x8_8_1x1_intrawave_v3,832.66,360.03,0.0
gfx942,304,54272,5120,8704,ck,0,0,6196.8598,a8w8_blockscale_1x128x128_256x128x128x128_16x16_32x32_2x2_8x32x1_8x32x1_1x32x1x8_8_1x1_intrawave_v3,780.59,173.1,0.0
gfx942,304,54400,5120,3072,ck,0,0,2055.026,a8w8_blockscale_1x128x128_256x128x128x128_16x16_32x32_2x2_8x32x1_8x32x1_1x32x1x8_8_1x1_intrawave_v3,832.73,360.04,0.0
gfx942,304,54400,5120,8704,ck,0,0,6148.9972,a8w8_blockscale_1x128x128_256x128x128x128_16x16_32x32_2x2_8x32x1_8x32x1_1x32x1x8_8_1x1_intrawave_v3,788.52,174.84,0.0
gfx942,304,54528,5120,3072,ck,0,0,2057.3206,a8w8_blockscale_1x128x128_256x128x128x128_16x16_32x32_2x2_8x32x1_8x32x1_1x32x1x8_8_1x1_intrawave_v3,833.76,360.47,0.0
gfx942,304,54528,5120,8704,ck,0,0,6268.1229,a8w8_blockscale_1x128x128_256x128x128x128_16x16_32x32_2x2_8x32x1_8x32x1_1x32x1x8_8_1x1_intrawave_v3,775.36,171.91,0.0
gfx942,304,54656,5120,3072,ck,0,0,2018.3161,a8w8_blockscale_1x128x128_256x128x128x128_16x16_32x32_2x2_8x32x1_8x32x1_1x32x1x8_8_1x1_intrawave_v3,851.86,368.28,0.0
gfx942,304,54656,5120,8704,ck,0,0,6163.9586,a8w8_blockscale_1x128x128_256x128x128x128_16x16_32x32_2x2_8x32x1_8x32x1_1x32x1x8_8_1x1_intrawave_v3,790.31,175.21,0.0
gfx942,304,54784,5120,3072,ck,0,0,2076.8625,a8w8_blockscale_1x128x128_256x128x128x128_16x16_32x32_2x2_8x32x1_8x32x1_1x32x1x8_8_1x1_intrawave_v3,829.79,358.72,0.0
gfx942,304,54784,5120,8704,ck,0,0,6096.0369,a8w8_blockscale_1x128x128_256x128x128x128_16x16_32x32_2x2_8x32x1_8x32x1_1x32x1x8_8_1x1_intrawave_v3,800.99,177.56,0.0
gfx942,304,54912,5120,3072,ck,0,0,2034.8118,a8w8_blockscale_1x128x128_256x128x128x128_16x16_32x32_2x2_8x32x1_8x32x1_1x32x1x8_8_1x1_intrawave_v3,848.91,366.97,0.0
gfx942,304,54912,5120,8704,ck,0,0,6112.0798,a8w8_blockscale_1x128x128_256x128x128x128_16x16_32x32_2x2_8x32x1_8x32x1_1x32x1x8_8_1x1_intrawave_v3,800.75,177.49,0.0
gfx942,304,55040,5120,3072,ck,0,0,2095.7833,a8w8_blockscale_1x128x128_256x128x128x128_16x16_32x32_2x2_8x32x1_8x32x1_1x32x1x8_8_1x1_intrawave_v3,826.14,357.11,0.0
gfx942,304,55040,5120,8704,ck,0,0,6108.3037,a8w8_blockscale_1x128x128_256x128x128x128_16x16_32x32_2x2_8x32x1_8x32x1_1x32x1x8_8_1x1_intrawave_v3,803.11,177.99,0.0
gfx942,304,55168,5120,3072,ck,0,0,2100.0639,a8w8_blockscale_1x128x128_256x128x128x128_16x16_32x32_2x2_8x32x1_8x32x1_1x32x1x8_8_1x1_intrawave_v3,826.37,357.19,0.0
gfx942,304,55168,5120,8704,ck,0,0,6257.7798,a8w8_blockscale_1x128x128_256x128x128x128_16x16_32x32_2x2_8x32x1_8x32x1_1x32x1x8_8_1x1_intrawave_v3,785.75,174.13,0.0
gfx942,304,55296,5120,3072,ck,0,0,2086.7728,a8w8_blockscale_1x128x128_256x128x128x128_16x16_32x32_2x2_8x32x1_8x32x1_1x32x1x8_8_1x1_intrawave_v3,833.57,360.28,0.0
gfx942,304,55296,5120,8704,ck,0,0,6280.109,a8w8_blockscale_1x128x128_256x128x128x128_16x16_32x32_2x2_8x32x1_8x32x1_1x32x1x8_8_1x1_intrawave_v3,784.78,173.9,0.0
gfx942,304,55424,5120,3072,ck,0,0,2062.9673,a8w8_blockscale_1x128x128_256x128x128x128_16x16_32x32_2x2_8x32x1_8x32x1_1x32x1x8_8_1x1_intrawave_v3,845.14,365.27,0.0
gfx942,304,55424,5120,8704,ck,0,0,6295.2073,a8w8_blockscale_1x128x128_256x128x128x128_16x16_32x32_2x2_8x32x1_8x32x1_1x32x1x8_8_1x1_intrawave_v3,784.71,173.87,0.0
gfx942,304,55552,5120,3072,ck,0,0,2052.9656,a8w8_blockscale_1x128x128_256x128x128x128_16x16_32x32_2x2_8x32x1_8x32x1_1x32x1x8_8_1x1_intrawave_v3,851.21,367.88,0.0
gfx942,304,55552,5120,8704,ck,0,0,6279.2953,a8w8_blockscale_1x128x128_256x128x128x128_16x16_32x32_2x2_8x32x1_8x32x1_1x32x1x8_8_1x1_intrawave_v3,788.51,174.69,0.0
gfx942,304,55680,5120,3072,ck,0,0,2061.9676,a8w8_blockscale_1x128x128_256x128x128x128_16x16_32x32_2x2_8x32x1_8x32x1_1x32x1x8_8_1x1_intrawave_v3,849.45,367.1,0.0
gfx942,304,55680,5120,8704,ck,0,0,6344.1193,a8w8_blockscale_1x128x128_256x128x128x128_16x16_32x32_2x2_8x32x1_8x32x1_1x32x1x8_8_1x1_intrawave_v3,782.25,173.29,0.0
gfx942,304,55808,5120,3072,ck,0,0,2084.9576,a8w8_blockscale_1x128x128_256x128x128x128_16x16_32x32_2x2_8x32x1_8x32x1_1x32x1x8_8_1x1_intrawave_v3,842.02,363.87,0.0
gfx942,304,55808,5120,8704,ck,0,0,6221.7389,a8w8_blockscale_1x128x128_256x128x128x128_16x16_32x32_2x2_8x32x1_8x32x1_1x32x1x8_8_1x1_intrawave_v3,799.47,177.09,0.0
gfx942,304,55936,5120,3072,ck,0,0,2134.0972,a8w8_blockscale_1x128x128_256x128x128x128_16x16_32x32_2x2_8x32x1_8x32x1_1x32x1x8_8_1x1_intrawave_v3,824.51,356.29,0.0
gfx942,304,55936,5120,8704,ck,0,0,6229.0921,a8w8_blockscale_1x128x128_256x128x128x128_16x16_32x32_2x2_8x32x1_8x32x1_1x32x1x8_8_1x1_intrawave_v3,800.36,177.27,0.0
gfx942,304,56064,5120,3072,ck,0,0,2149.7374,a8w8_blockscale_1x128x128_256x128x128x128_16x16_32x32_2x2_8x32x1_8x32x1_1x32x1x8_8_1x1_intrawave_v3,820.39,354.49,0.0
gfx942,304,56064,5120,8704,ck,0,0,6406.6964,a8w8_blockscale_1x128x128_256x128x128x128_16x16_32x32_2x2_8x32x1_8x32x1_1x32x1x8_8_1x1_intrawave_v3,779.95,172.73,0.0
gfx942,304,56192,5120,3072,ck,0,0,2123.9434,a8w8_blockscale_1x128x128_256x128x128x128_16x16_32x32_2x2_8x32x1_8x32x1_1x32x1x8_8_1x1_intrawave_v3,832.25,359.59,0.0
gfx942,304,56192,5120,8704,ck,0,0,6445.3659,a8w8_blockscale_1x128x128_256x128x128x128_16x16_32x32_2x2_8x32x1_8x32x1_1x32x1x8_8_1x1_intrawave_v3,777.04,172.07,0.0
gfx942,304,56320,5120,3072,ck,0,0,2133.2098,a8w8_blockscale_1x128x128_256x128x128x128_16x16_32x32_2x2_8x32x1_8x32x1_1x32x1x8_8_1x1_intrawave_v3,830.52,358.83,0.0
gfx942,304,56320,5120,8704,ck,0,0,6384.5532,a8w8_blockscale_1x128x128_256x128x128x128_16x16_32x32_2x2_8x32x1_8x32x1_1x32x1x8_8_1x1_intrawave_v3,786.23,174.09,0.0
gfx942,304,56448,5120,3072,ck,0,0,2133.513,a8w8_blockscale_1x128x128_256x128x128x128_16x16_32x32_2x2_8x32x1_8x32x1_1x32x1x8_8_1x1_intrawave_v3,832.29,359.58,0.0
gfx942,304,56448,5120,8704,ck,0,0,6476.799,a8w8_blockscale_1x128x128_256x128x128x128_16x16_32x32_2x2_8x32x1_8x32x1_1x32x1x8_8_1x1_intrawave_v3,776.8,171.99,0.0
gfx942,304,56576,5120,3072,ck,0,0,2092.1869,a8w8_blockscale_1x128x128_256x128x128x128_16x16_32x32_2x2_8x32x1_8x32x1_1x32x1x8_8_1x1_intrawave_v3,850.65,367.5,0.0
gfx942,304,56576,5120,8704,ck,0,0,6480.3575,a8w8_blockscale_1x128x128_256x128x128x128_16x16_32x32_2x2_8x32x1_8x32x1_1x32x1x8_8_1x1_intrawave_v3,778.13,172.27,0.0
gfx942,304,56704,5120,3072,ck,0,0,2108.1802,a8w8_blockscale_1x128x128_256x128x128x128_16x16_32x32_2x2_8x32x1_8x32x1_1x32x1x8_8_1x1_intrawave_v3,846.11,365.52,0.0
gfx942,304,56704,5120,8704,ck,0,0,6496.2635,a8w8_blockscale_1x128x128_256x128x128x128_16x16_32x32_2x2_8x32x1_8x32x1_1x32x1x8_8_1x1_intrawave_v3,777.98,172.22,0.0
gfx942,304,56832,5120,3072,ck,0,0,2142.037,a8w8_blockscale_1x128x128_256x128x128x128_16x16_32x32_2x2_8x32x1_8x32x1_1x32x1x8_8_1x1_intrawave_v3,834.62,360.53,0.0
gfx942,304,56832,5120,8704,ck,0,0,6494.6918,a8w8_blockscale_1x128x128_256x128x128x128_16x16_32x32_2x2_8x32x1_8x32x1_1x32x1x8_8_1x1_intrawave_v3,779.93,172.63,0.0
gfx942,304,56960,5120,3072,ck,0,0,2162.9715,a8w8_blockscale_1x128x128_256x128x128x128_16x16_32x32_2x2_8x32x1_8x32x1_1x32x1x8_8_1x1_intrawave_v3,828.4,357.83,0.0
gfx942,304,56960,5120,8704,ck,0,0,6468.5752,a8w8_blockscale_1x128x128_256x128x128x128_16x16_32x32_2x2_8x32x1_8x32x1_1x32x1x8_8_1x1_intrawave_v3,784.84,173.7,0.0
gfx942,304,57088,5120,3072,ck,0,0,2164.4407,a8w8_blockscale_1x128x128_256x128x128x128_16x16_32x32_2x2_8x32x1_8x32x1_1x32x1x8_8_1x1_intrawave_v3,829.7,358.38,0.0
gfx942,304,57088,5120,8704,ck,0,0,6483.2946,a8w8_blockscale_1x128x128_256x128x128x128_16x16_32x32_2x2_8x32x1_8x32x1_1x32x1x8_8_1x1_intrawave_v3,784.82,173.68,0.0
gfx942,304,57216,5120,3072,ck,0,0,2156.7037,a8w8_blockscale_1x128x128_256x128x128x128_16x16_32x32_2x2_8x32x1_8x32x1_1x32x1x8_8_1x1_intrawave_v3,834.54,360.45,0.0
gfx942,304,57216,5120,8704,ck,0,0,6427.2068,a8w8_blockscale_1x128x128_256x128x128x128_16x16_32x32_2x2_8x32x1_8x32x1_1x32x1x8_8_1x1_intrawave_v3,793.44,175.58,0.0
gfx942,304,57344,5120,3072,ck,0,0,2144.59,a8w8_blockscale_1x128x128_256x128x128x128_16x16_32x32_2x2_8x32x1_8x32x1_1x32x1x8_8_1x1_intrawave_v3,841.13,363.28,0.0
gfx942,304,57344,5120,8704,ck,0,0,6420.9598,a8w8_blockscale_1x128x128_256x128x128x128_16x16_32x32_2x2_8x32x1_8x32x1_1x32x1x8_8_1x1_intrawave_v3,795.99,176.12,0.0
gfx942,304,57472,5120,3072,ck,0,0,2201.6799,a8w8_blockscale_1x128x128_256x128x128x128_16x16_32x32_2x2_8x32x1_8x32x1_1x32x1x8_8_1x1_intrawave_v3,821.15,354.64,0.0
gfx942,304,57472,5120,8704,ck,0,0,6537.1335,a8w8_blockscale_1x128x128_256x128x128x128_16x16_32x32_2x2_8x32x1_8x32x1_1x32x1x8_8_1x1_intrawave_v3,783.59,173.37,0.0
gfx942,304,57600,5120,3072,ck,0,0,2200.2247,a8w8_blockscale_1x128x128_256x128x128x128_16x16_32x32_2x2_8x32x1_8x32x1_1x32x1x8_8_1x1_intrawave_v3,823.52,355.65,0.0
gfx942,304,57600,5120,8704,ck,0,0,6426.1592,a8w8_blockscale_1x128x128_256x128x128x128_16x16_32x32_2x2_8x32x1_8x32x1_1x32x1x8_8_1x1_intrawave_v3,798.9,176.74,0.0
gfx942,304,57728,5120,3072,ck,0,0,2141.7933,a8w8_blockscale_1x128x128_256x128x128x128_16x16_32x32_2x2_8x32x1_8x32x1_1x32x1x8_8_1x1_intrawave_v3,847.87,366.14,0.0
gfx942,304,57728,5120,8704,ck,0,0,6568.6847,a8w8_blockscale_1x128x128_256x128x128x128_16x16_32x32_2x2_8x32x1_8x32x1_1x32x1x8_8_1x1_intrawave_v3,783.3,173.27,0.0
gfx942,304,57856,5120,3072,ck,0,0,2203.8625,a8w8_blockscale_1x128x128_256x128x128x128_16x16_32x32_2x2_8x32x1_8x32x1_1x32x1x8_8_1x1_intrawave_v3,825.82,356.6,0.0
gfx942,304,57856,5120,8704,ck,0,0,6438.9534,a8w8_blockscale_1x128x128_256x128x128x128_16x16_32x32_2x2_8x32x1_8x32x1_1x32x1x8_8_1x1_intrawave_v3,800.85,177.14,0.0
gfx942,304,57984,5120,3072,ck,0,0,2221.3607,a8w8_blockscale_1x128x128_256x128x128x128_16x16_32x32_2x2_8x32x1_8x32x1_1x32x1x8_8_1x1_intrawave_v3,821.13,354.56,0.0
gfx942,304,57984,5120,8704,ck,0,0,6603.0275,a8w8_blockscale_1x128x128_256x128x128x128_16x16_32x32_2x2_8x32x1_8x32x1_1x32x1x8_8_1x1_intrawave_v3,782.68,173.1,0.0
gfx942,304,58112,5120,3072,ck,0,0,2169.9853,a8w8_blockscale_1x128x128_256x128x128x128_16x16_32x32_2x2_8x32x1_8x32x1_1x32x1x8_8_1x1_intrawave_v3,842.42,363.74,0.0
gfx942,304,58112,5120,8704,ck,0,0,6507.6049,a8w8_blockscale_1x128x128_256x128x128x128_16x16_32x32_2x2_8x32x1_8x32x1_1x32x1x8_8_1x1_intrawave_v3,795.91,176.02,0.0
gfx942,304,58240,5120,3072,ck,0,0,2205.2294,a8w8_blockscale_1x128x128_256x128x128x128_16x16_32x32_2x2_8x32x1_8x32x1_1x32x1x8_8_1x1_intrawave_v3,830.79,358.7,0.0
gfx942,304,58240,5120,8704,ck,0,0,6682.7892,a8w8_blockscale_1x128x128_256x128x128x128_16x16_32x32_2x2_8x32x1_8x32x1_1x32x1x8_8_1x1_intrawave_v3,776.75,171.76,0.0
gfx942,304,58368,5120,3072,ck,0,0,2225.1355,a8w8_blockscale_1x128x128_256x128x128x128_16x16_32x32_2x2_8x32x1_8x32x1_1x32x1x8_8_1x1_intrawave_v3,825.16,356.26,0.0
gfx942,304,58368,5120,8704,ck,0,0,6576.9418,a8w8_blockscale_1x128x128_256x128x128x128_16x16_32x32_2x2_8x32x1_8x32x1_1x32x1x8_8_1x1_intrawave_v3,790.99,174.9,0.0
gfx942,304,58496,5120,3072,ck,0,0,2202.4196,a8w8_blockscale_1x128x128_256x128x128x128_16x16_32x32_2x2_8x32x1_8x32x1_1x32x1x8_8_1x1_intrawave_v3,835.5,360.71,0.0
gfx942,304,58496,5120,8704,ck,0,0,6723.3909,a8w8_blockscale_1x128x128_256x128x128x128_16x16_32x32_2x2_8x32x1_8x32x1_1x32x1x8_8_1x1_intrawave_v3,775.46,171.45,0.0
gfx942,304,58624,5120,3072,ck,0,0,2213.8913,a8w8_blockscale_1x128x128_256x128x128x128_16x16_32x32_2x2_8x32x1_8x32x1_1x32x1x8_8_1x1_intrawave_v3,832.99,359.61,0.0
gfx942,304,58624,5120,8704,ck,0,0,6673.181,a8w8_blockscale_1x128x128_256x128x128x128_16x16_32x32_2x2_8x32x1_8x32x1_1x32x1x8_8_1x1_intrawave_v3,783.0,173.1,0.0
gfx942,304,58752,5120,3072,ck,0,0,2179.1386,a8w8_blockscale_1x128x128_256x128x128x128_16x16_32x32_2x2_8x32x1_8x32x1_1x32x1x8_8_1x1_intrawave_v3,848.12,366.12,0.0
gfx942,304,58752,5120,8704,ck,0,0,6544.2165,a8w8_blockscale_1x128x128_256x128x128x128_16x16_32x32_2x2_8x32x1_8x32x1_1x32x1x8_8_1x1_intrawave_v3,800.17,176.88,0.0
gfx942,304,58880,5120,3072,ck,0,0,2248.8266,a8w8_blockscale_1x128x128_256x128x128x128_16x16_32x32_2x2_8x32x1_8x32x1_1x32x1x8_8_1x1_intrawave_v3,823.63,355.54,0.0
gfx942,304,58880,5120,8704,ck,0,0,6652.8667,a8w8_blockscale_1x128x128_256x128x128x128_16x16_32x32_2x2_8x32x1_8x32x1_1x32x1x8_8_1x1_intrawave_v3,788.82,174.36,0.0
gfx942,304,59008,5120,3072,ck,0,0,2201.7916,a8w8_blockscale_1x128x128_256x128x128x128_16x16_32x32_2x2_8x32x1_8x32x1_1x32x1x8_8_1x1_intrawave_v3,843.05,363.91,0.0
gfx942,304,59008,5120,8704,ck,0,0,6786.0465,a8w8_blockscale_1x128x128_256x128x128x128_16x16_32x32_2x2_8x32x1_8x32x1_1x32x1x8_8_1x1_intrawave_v3,775.02,171.29,0.0
gfx942,304,59136,5120,3072,ck,0,0,2193.9316,a8w8_blockscale_1x128x128_256x128x128x128_16x16_32x32_2x2_8x32x1_8x32x1_1x32x1x8_8_1x1_intrawave_v3,847.91,365.99,0.0
gfx942,304,59136,5120,8704,ck,0,0,6759.0654,a8w8_blockscale_1x128x128_256x128x128x128_16x16_32x32_2x2_8x32x1_8x32x1_1x32x1x8_8_1x1_intrawave_v3,779.8,172.34,0.0
gfx942,304,59264,5120,3072,ck,0,0,2267.7782,a8w8_blockscale_1x128x128_256x128x128x128_16x16_32x32_2x2_8x32x1_8x32x1_1x32x1x8_8_1x1_intrawave_v3,822.08,354.82,0.0
gfx942,304,59264,5120,8704,ck,0,0,6676.5231,a8w8_blockscale_1x128x128_256x128x128x128_16x16_32x32_2x2_8x32x1_8x32x1_1x32x1x8_8_1x1_intrawave_v3,791.15,174.83,0.0
gfx942,304,59392,5120,3072,ck,0,0,2218.1954,a8w8_blockscale_1x128x128_256x128x128x128_16x16_32x32_2x2_8x32x1_8x32x1_1x32x1x8_8_1x1_intrawave_v3,842.27,363.52,0.0
gfx942,304,59392,5120,8704,ck,0,0,6567.6028,a8w8_blockscale_1x128x128_256x128x128x128_16x16_32x32_2x2_8x32x1_8x32x1_1x32x1x8_8_1x1_intrawave_v3,806.01,178.1,0.0
gfx942,304,59520,5120,3072,ck,0,0,2265.5107,a8w8_blockscale_1x128x128_256x128x128x128_16x16_32x32_2x2_8x32x1_8x32x1_1x32x1x8_8_1x1_intrawave_v3,826.45,356.68,0.0
gfx942,304,59520,5120,8704,ck,0,0,6718.9486,a8w8_blockscale_1x128x128_256x128x128x128_16x16_32x32_2x2_8x32x1_8x32x1_1x32x1x8_8_1x1_intrawave_v3,789.55,174.45,0.0
gfx942,304,59648,5120,3072,ck,0,0,2210.3497,a8w8_blockscale_1x128x128_256x128x128x128_16x16_32x32_2x2_8x32x1_8x32x1_1x32x1x8_8_1x1_intrawave_v3,848.9,366.35,0.0
gfx942,304,59648,5120,8704,ck,0,0,6801.8575,a8w8_blockscale_1x128x128_256x128x128x128_16x16_32x32_2x2_8x32x1_8x32x1_1x32x1x8_8_1x1_intrawave_v3,781.6,172.68,0.0
gfx942,304,59776,5120,3072,ck,0,0,2226.8756,a8w8_blockscale_1x128x128_256x128x128x128_16x16_32x32_2x2_8x32x1_8x32x1_1x32x1x8_8_1x1_intrawave_v3,844.41,364.4,0.0
gfx942,304,59776,5120,8704,ck,0,0,6787.3805,a8w8_blockscale_1x128x128_256x128x128x128_16x16_32x32_2x2_8x32x1_8x32x1_1x32x1x8_8_1x1_intrawave_v3,784.95,173.4,0.0
gfx942,304,59904,5120,3072,ck,0,0,2292.7017,a8w8_blockscale_1x128x128_256x128x128x128_16x16_32x32_2x2_8x32x1_8x32x1_1x32x1x8_8_1x1_intrawave_v3,821.92,354.68,0.0
gfx942,304,59904,5120,8704,ck,0,0,6760.7935,a8w8_blockscale_1x128x128_256x128x128x128_16x16_32x32_2x2_8x32x1_8x32x1_1x32x1x8_8_1x1_intrawave_v3,789.73,174.44,0.0
gfx942,304,60032,5120,3072,ck,0,0,2273.9243,a8w8_blockscale_1x128x128_256x128x128x128_16x16_32x32_2x2_8x32x1_8x32x1_1x32x1x8_8_1x1_intrawave_v3,830.48,358.36,0.0
gfx942,304,60032,5120,8704,ck,0,0,6665.7794,a8w8_blockscale_1x128x128_256x128x128x128_16x16_32x32_2x2_8x32x1_8x32x1_1x32x1x8_8_1x1_intrawave_v3,802.7,177.3,0.0
gfx942,304,60160,5120,3072,ck,0,0,2242.1144,a8w8_blockscale_1x128x128_256x128x128x128_16x16_32x32_2x2_8x32x1_8x32x1_1x32x1x8_8_1x1_intrawave_v3,844.06,364.2,0.0
gfx942,304,60160,5120,8704,ck,0,0,6679.7004,a8w8_blockscale_1x128x128_256x128x128x128_16x16_32x32_2x2_8x32x1_8x32x1_1x32x1x8_8_1x1_intrawave_v3,802.73,177.29,0.0
gfx942,304,60288,5120,3072,ck,0,0,2273.3818,a8w8_blockscale_1x128x128_256x128x128x128_16x16_32x32_2x2_8x32x1_8x32x1_1x32x1x8_8_1x1_intrawave_v3,834.22,359.94,0.0
gfx942,304,60288,5120,8704,ck,0,0,6733.3309,a8w8_blockscale_1x128x128_256x128x128x128_16x16_32x32_2x2_8x32x1_8x32x1_1x32x1x8_8_1x1_intrawave_v3,798.03,176.24,0.0
gfx942,304,60416,5120,3072,ck,0,0,2306.4781,a8w8_blockscale_1x128x128_256x128x128x128_16x16_32x32_2x2_8x32x1_8x32x1_1x32x1x8_8_1x1_intrawave_v3,823.99,355.51,0.0
gfx942,304,60416,5120,8704,ck,0,0,6706.1784,a8w8_blockscale_1x128x128_256x128x128x128_16x16_32x32_2x2_8x32x1_8x32x1_1x32x1x8_8_1x1_intrawave_v3,802.96,177.31,0.0
gfx942,304,60544,5120,3072,ck,0,0,2256.0063,a8w8_blockscale_1x128x128_256x128x128x128_16x16_32x32_2x2_8x32x1_8x32x1_1x32x1x8_8_1x1_intrawave_v3,844.21,364.22,0.0
gfx942,304,60544,5120,8704,ck,0,0,6883.6134,a8w8_blockscale_1x128x128_256x128x128x128_16x16_32x32_2x2_8x32x1_8x32x1_1x32x1x8_8_1x1_intrawave_v3,783.92,173.09,0.0
gfx942,304,60672,5120,3072,ck,0,0,2328.6272,a8w8_blockscale_1x128x128_256x128x128x128_16x16_32x32_2x2_8x32x1_8x32x1_1x32x1x8_8_1x1_intrawave_v3,819.61,353.6,0.0
gfx942,304,60672,5120,8704,ck,0,0,6832.1144,a8w8_blockscale_1x128x128_256x128x128x128_16x16_32x32_2x2_8x32x1_8x32x1_1x32x1x8_8_1x1_intrawave_v3,791.5,174.75,0.0
gfx942,304,60800,5120,3072,ck,0,0,2266.9035,a8w8_blockscale_1x128x128_256x128x128x128_16x16_32x32_2x2_8x32x1_8x32x1_1x32x1x8_8_1x1_intrawave_v3,843.71,363.98,0.0
gfx942,304,60800,5120,8704,ck,0,0,6921.7727,a8w8_blockscale_1x128x128_256x128x128x128_16x16_32x32_2x2_8x32x1_8x32x1_1x32x1x8_8_1x1_intrawave_v3,782.9,172.84,0.0
gfx942,304,60928,5120,3072,ck,0,0,2329.4925,a8w8_blockscale_1x128x128_256x128x128x128_16x16_32x32_2x2_8x32x1_8x32x1_1x32x1x8_8_1x1_intrawave_v3,822.77,354.93,0.0
gfx942,304,60928,5120,8704,ck,0,0,6931.7755,a8w8_blockscale_1x128x128_256x128x128x128_16x16_32x32_2x2_8x32x1_8x32x1_1x32x1x8_8_1x1_intrawave_v3,783.41,172.94,0.0
gfx942,304,61056,5120,3072,ck,0,0,2343.4348,a8w8_blockscale_1x128x128_256x128x128x128_16x16_32x32_2x2_8x32x1_8x32x1_1x32x1x8_8_1x1_intrawave_v3,819.59,353.54,0.0
gfx942,304,61056,5120,8704,ck,0,0,6886.5408,a8w8_blockscale_1x128x128_256x128x128x128_16x16_32x32_2x2_8x32x1_8x32x1_1x32x1x8_8_1x1_intrawave_v3,790.22,174.43,0.0
gfx942,304,61184,5120,3072,ck,0,0,2343.3178,a8w8_blockscale_1x128x128_256x128x128x128_16x16_32x32_2x2_8x32x1_8x32x1_1x32x1x8_8_1x1_intrawave_v3,821.35,354.29,0.0
gfx942,304,61184,5120,8704,ck,0,0,7004.5693,a8w8_blockscale_1x128x128_256x128x128x128_16x16_32x32_2x2_8x32x1_8x32x1_1x32x1x8_8_1x1_intrawave_v3,778.53,171.84,0.0
gfx942,304,61312,5120,3072,ck,0,0,2306.2643,a8w8_blockscale_1x128x128_256x128x128x128_16x16_32x32_2x2_8x32x1_8x32x1_1x32x1x8_8_1x1_intrawave_v3,836.29,360.72,0.0
gfx942,304,61312,5120,8704,ck,0,0,6920.7312,a8w8_blockscale_1x128x128_256x128x128x128_16x16_32x32_2x2_8x32x1_8x32x1_1x32x1x8_8_1x1_intrawave_v3,789.61,174.27,0.0
gfx942,304,61440,5120,3072,ck,0,0,2287.9523,a8w8_blockscale_1x128x128_256x128x128x128_16x16_32x32_2x2_8x32x1_8x32x1_1x32x1x8_8_1x1_intrawave_v3,844.74,364.35,0.0
gfx942,304,61440,5120,8704,ck,0,0,6859.47,a8w8_blockscale_1x128x128_256x128x128x128_16x16_32x32_2x2_8x32x1_8x32x1_1x32x1x8_8_1x1_intrawave_v3,798.32,176.18,0.0
gfx942,304,61568,5120,3072,ck,0,0,2314.5427,a8w8_blockscale_1x128x128_256x128x128x128_16x16_32x32_2x2_8x32x1_8x32x1_1x32x1x8_8_1x1_intrawave_v3,836.78,360.9,0.0
gfx942,304,61568,5120,8704,ck,0,0,6920.4605,a8w8_blockscale_1x128x128_256x128x128x128_16x16_32x32_2x2_8x32x1_8x32x1_1x32x1x8_8_1x1_intrawave_v3,792.94,174.98,0.0
gfx942,304,61696,5120,3072,ck,0,0,2339.4593,a8w8_blockscale_1x128x128_256x128x128x128_16x16_32x32_2x2_8x32x1_8x32x1_1x32x1x8_8_1x1_intrawave_v3,829.59,357.79,0.0
gfx942,304,61696,5120,8704,ck,0,0,6881.7627,a8w8_blockscale_1x128x128_256x128x128x128_16x16_32x32_2x2_8x32x1_8x32x1_1x32x1x8_8_1x1_intrawave_v3,799.05,176.31,0.0
gfx942,304,61824,5120,3072,ck,0,0,2314.741,a8w8_blockscale_1x128x128_256x128x128x128_16x16_32x32_2x2_8x32x1_8x32x1_1x32x1x8_8_1x1_intrawave_v3,840.19,362.34,0.0
gfx942,304,61824,5120,8704,ck,0,0,7026.8247,a8w8_blockscale_1x128x128_256x128x128x128_16x16_32x32_2x2_8x32x1_8x32x1_1x32x1x8_8_1x1_intrawave_v3,784.18,173.02,0.0
gfx942,304,61952,5120,3072,ck,0,0,2371.6526,a8w8_blockscale_1x128x128_256x128x128x128_16x16_32x32_2x2_8x32x1_8x32x1_1x32x1x8_8_1x1_intrawave_v3,821.72,354.37,0.0
gfx942,304,61952,5120,8704,ck,0,0,6973.2127,a8w8_blockscale_1x128x128_256x128x128x128_16x16_32x32_2x2_8x32x1_8x32x1_1x32x1x8_8_1x1_intrawave_v3,791.85,174.69,0.0
gfx942,304,62080,5120,3072,ck,0,0,2358.5839,a8w8_blockscale_1x128x128_256x128x128x128_16x16_32x32_2x2_8x32x1_8x32x1_1x32x1x8_8_1x1_intrawave_v3,827.98,357.05,0.0
gfx942,304,62080,5120,8704,ck,0,0,7002.3896,a8w8_blockscale_1x128x128_256x128x128x128_16x16_32x32_2x2_8x32x1_8x32x1_1x32x1x8_8_1x1_intrawave_v3,790.18,174.31,0.0
gfx942,304,62208,5120,3072,ck,0,0,2341.7823,a8w8_blockscale_1x128x128_256x128x128x128_16x16_32x32_2x2_8x32x1_8x32x1_1x32x1x8_8_1x1_intrawave_v3,835.64,360.34,0.0
gfx942,304,62208,5120,8704,ck,0,0,7130.0912,a8w8_blockscale_1x128x128_256x128x128x128_16x16_32x32_2x2_8x32x1_8x32x1_1x32x1x8_8_1x1_intrawave_v3,777.62,171.53,0.0
gfx942,304,62336,5120,3072,ck,0,0,2354.2889,a8w8_blockscale_1x128x128_256x128x128x128_16x16_32x32_2x2_8x32x1_8x32x1_1x32x1x8_8_1x1_intrawave_v3,832.91,359.15,0.0
gfx942,304,62336,5120,8704,ck,0,0,7089.0135,a8w8_blockscale_1x128x128_256x128x128x128_16x16_32x32_2x2_8x32x1_8x32x1_1x32x1x8_8_1x1_intrawave_v3,783.74,172.87,0.0
gfx942,304,62464,5120,3072,ck,0,0,2359.5214,a8w8_blockscale_1x128x128_256x128x128x128_16x16_32x32_2x2_8x32x1_8x32x1_1x32x1x8_8_1x1_intrawave_v3,832.77,359.08,0.0
gfx942,304,62464,5120,8704,ck,0,0,7152.7523,a8w8_blockscale_1x128x128_256x128x128x128_16x16_32x32_2x2_8x32x1_8x32x1_1x32x1x8_8_1x1_intrawave_v3,778.35,171.67,0.0
gfx942,304,62592,5120,3072,ck,0,0,2361.2384,a8w8_blockscale_1x128x128_256x128x128x128_16x16_32x32_2x2_8x32x1_8x32x1_1x32x1x8_8_1x1_intrawave_v3,833.87,359.54,0.0
gfx942,304,62592,5120,8704,ck,0,0,7073.1996,a8w8_blockscale_1x128x128_256x128x128x128_16x16_32x32_2x2_8x32x1_8x32x1_1x32x1x8_8_1x1_intrawave_v3,788.72,173.94,0.0
gfx942,304,62720,5120,3072,ck,0,0,2309.6183,a8w8_blockscale_1x128x128_256x128x128x128_16x16_32x32_2x2_8x32x1_8x32x1_1x32x1x8_8_1x1_intrawave_v3,854.25,368.31,0.0
gfx942,304,62720,5120,8704,ck,0,0,7137.9981,a8w8_blockscale_1x128x128_256x128x128x128_16x16_32x32_2x2_8x32x1_8x32x1_1x32x1x8_8_1x1_intrawave_v3,783.16,172.7,0.0
gfx942,304,62848,5120,3072,ck,0,0,2373.5327,a8w8_blockscale_1x128x128_256x128x128x128_16x16_32x32_2x2_8x32x1_8x32x1_1x32x1x8_8_1x1_intrawave_v3,832.95,359.11,0.0
gfx942,304,62848,5120,8704,ck,0,0,7158.6963,a8w8_blockscale_1x128x128_256x128x128x128_16x16_32x32_2x2_8x32x1_8x32x1_1x32x1x8_8_1x1_intrawave_v3,782.49,172.54,0.0
gfx942,304,62976,5120,3072,ck,0,0,2370.2998,a8w8_blockscale_1x128x128_256x128x128x128_16x16_32x32_2x2_8x32x1_8x32x1_1x32x1x8_8_1x1_intrawave_v3,835.78,360.32,0.0
gfx942,304,62976,5120,8704,ck,0,0,7224.0248,a8w8_blockscale_1x128x128_256x128x128x128_16x16_32x32_2x2_8x32x1_8x32x1_1x32x1x8_8_1x1_intrawave_v3,776.99,171.31,0.0
gfx942,304,63104,5120,3072,ck,0,0,2367.5548,a8w8_blockscale_1x128x128_256x128x128x128_16x16_32x32_2x2_8x32x1_8x32x1_1x32x1x8_8_1x1_intrawave_v3,838.45,361.46,0.0
gfx942,304,63104,5120,8704,ck,0,0,7027.2044,a8w8_blockscale_1x128x128_256x128x128x128_16x16_32x32_2x2_8x32x1_8x32x1_1x32x1x8_8_1x1_intrawave_v3,800.37,176.46,0.0
gfx942,304,63232,5120,3072,ck,0,0,2384.6564,a8w8_blockscale_1x128x128_256x128x128x128_16x16_32x32_2x2_8x32x1_8x32x1_1x32x1x8_8_1x1_intrawave_v3,834.13,359.58,0.0
gfx942,304,63232,5120,8704,ck,0,0,7231.9934,a8w8_blockscale_1x128x128_256x128x128x128_16x16_32x32_2x2_8x32x1_8x32x1_1x32x1x8_8_1x1_intrawave_v3,779.29,171.8,0.0
gfx942,304,63360,5120,3072,ck,0,0,2409.3984,a8w8_blockscale_1x128x128_256x128x128x128_16x16_32x32_2x2_8x32x1_8x32x1_1x32x1x8_8_1x1_intrawave_v3,827.23,356.59,0.0
gfx942,304,63360,5120,8704,ck,0,0,7085.3698,a8w8_blockscale_1x128x128_256x128x128x128_16x16_32x32_2x2_8x32x1_8x32x1_1x32x1x8_8_1x1_intrawave_v3,797.02,175.69,0.0
gfx942,304,63488,5120,3072,ck,0,0,2401.5192,a8w8_blockscale_1x128x128_256x128x128x128_16x16_32x32_2x2_8x32x1_8x32x1_1x32x1x8_8_1x1_intrawave_v3,831.62,358.47,0.0
gfx942,304,63488,5120,8704,ck,0,0,7225.7773,a8w8_blockscale_1x128x128_256x128x128x128_16x16_32x32_2x2_8x32x1_8x32x1_1x32x1x8_8_1x1_intrawave_v3,783.12,172.62,0.0
gfx942,304,63616,5120,3072,ck,0,0,2399.3059,a8w8_blockscale_1x128x128_256x128x128x128_16x16_32x32_2x2_8x32x1_8x32x1_1x32x1x8_8_1x1_intrawave_v3,834.07,359.51,0.0
gfx942,304,63616,5120,8704,ck,0,0,7304.8764,a8w8_blockscale_1x128x128_256x128x128x128_16x16_32x32_2x2_8x32x1_8x32x1_1x32x1x8_8_1x1_intrawave_v3,776.2,171.08,0.0
gfx942,304,63744,5120,3072,ck,0,0,2410.189,a8w8_blockscale_1x128x128_256x128x128x128_16x16_32x32_2x2_8x32x1_8x32x1_1x32x1x8_8_1x1_intrawave_v3,831.97,358.6,0.0
gfx942,304,63744,5120,8704,ck,0,0,7284.817,a8w8_blockscale_1x128x128_256x128x128x128_16x16_32x32_2x2_8x32x1_8x32x1_1x32x1x8_8_1x1_intrawave_v3,779.9,171.88,0.0
gfx942,304,63872,5120,3072,ck,0,0,2427.7993,a8w8_blockscale_1x128x128_256x128x128x128_16x16_32x32_2x2_8x32x1_8x32x1_1x32x1x8_8_1x1_intrawave_v3,827.6,356.7,0.0
gfx942,304,63872,5120,8704,ck,0,0,7223.521,a8w8_blockscale_1x128x128_256x128x128x128_16x16_32x32_2x2_8x32x1_8x32x1_1x32x1x8_8_1x1_intrawave_v3,788.1,173.68,0.0
gfx942,304,64000,5120,3072,ck,0,0,2381.5305,a8w8_blockscale_1x128x128_256x128x128x128_16x16_32x32_2x2_8x32x1_8x32x1_1x32x1x8_8_1x1_intrawave_v3,845.37,364.34,0.0
gfx942,304,64000,5120,8704,ck,0,0,7325.1839,a8w8_blockscale_1x128x128_256x128x128x128_16x16_32x32_2x2_8x32x1_8x32x1_1x32x1x8_8_1x1_intrawave_v3,778.72,171.6,0.0
gfx942,304,64128,5120,3072,ck,0,0,2457.9875,a8w8_blockscale_1x128x128_256x128x128x128_16x16_32x32_2x2_8x32x1_8x32x1_1x32x1x8_8_1x1_intrawave_v3,820.71,353.7,0.0
gfx942,304,64128,5120,8704,ck,0,0,7192.4329,a8w8_blockscale_1x128x128_256x128x128x128_16x16_32x32_2x2_8x32x1_8x32x1_1x32x1x8_8_1x1_intrawave_v3,794.68,175.1,0.0
gfx942,304,64256,5120,3072,ck,0,0,2455.3101,a8w8_blockscale_1x128x128_256x128x128x128_16x16_32x32_2x2_8x32x1_8x32x1_1x32x1x8_8_1x1_intrawave_v3,823.24,354.78,0.0
gfx942,304,64256,5120,8704,ck,0,0,7183.4402,a8w8_blockscale_1x128x128_256x128x128x128_16x16_32x32_2x2_8x32x1_8x32x1_1x32x1x8_8_1x1_intrawave_v3,797.26,175.66,0.0
gfx942,304,64384,5120,3072,ck,0,0,2447.8214,a8w8_blockscale_1x128x128_256x128x128x128_16x16_32x32_2x2_8x32x1_8x32x1_1x32x1x8_8_1x1_intrawave_v3,827.41,356.57,0.0
gfx942,304,64384,5120,8704,ck,0,0,7333.3373,a8w8_blockscale_1x128x128_256x128x128x128_16x16_32x32_2x2_8x32x1_8x32x1_1x32x1x8_8_1x1_intrawave_v3,782.52,172.4,0.0
gfx942,304,64512,5120,3072,ck,0,0,2465.4228,a8w8_blockscale_1x128x128_256x128x128x128_16x16_32x32_2x2_8x32x1_8x32x1_1x32x1x8_8_1x1_intrawave_v3,823.13,354.71,0.0
gfx942,304,64512,5120,8704,ck,0,0,7328.4084,a8w8_blockscale_1x128x128_256x128x128x128_16x16_32x32_2x2_8x32x1_8x32x1_1x32x1x8_8_1x1_intrawave_v3,784.6,172.85,0.0
gfx942,304,64640,5120,3072,ck,0,0,2448.7512,a8w8_blockscale_1x128x128_256x128x128x128_16x16_32x32_2x2_8x32x1_8x32x1_1x32x1x8_8_1x1_intrawave_v3,830.38,357.82,0.0
gfx942,304,64640,5120,8704,ck,0,0,7437.9819,a8w8_blockscale_1x128x128_256x128x128x128_16x16_32x32_2x2_8x32x1_8x32x1_1x32x1x8_8_1x1_intrawave_v3,774.58,170.62,0.0
gfx942,304,64768,5120,3072,ck,0,0,2439.2172,a8w8_blockscale_1x128x128_256x128x128x128_16x16_32x32_2x2_8x32x1_8x32x1_1x32x1x8_8_1x1_intrawave_v3,835.28,359.92,0.0
gfx942,304,64768,5120,8704,ck,0,0,7423.3402,a8w8_blockscale_1x128x128_256x128x128x128_16x16_32x32_2x2_8x32x1_8x32x1_1x32x1x8_8_1x1_intrawave_v3,777.64,171.29,0.0
gfx942,304,64896,5120,3072,ck,0,0,2410.4898,a8w8_blockscale_1x128x128_256x128x128x128_16x16_32x32_2x2_8x32x1_8x32x1_1x32x1x8_8_1x1_intrawave_v3,846.9,364.92,0.0
gfx942,304,64896,5120,8704,ck,0,0,7236.1534,a8w8_blockscale_1x128x128_256x128x128x128_16x16_32x32_2x2_8x32x1_8x32x1_1x32x1x8_8_1x1_intrawave_v3,799.34,176.05,0.0
gfx942,304,65024,5120,3072,ck,0,0,2416.2478,a8w8_blockscale_1x128x128_256x128x128x128_16x16_32x32_2x2_8x32x1_8x32x1_1x32x1x8_8_1x1_intrawave_v3,846.55,364.75,0.0
gfx942,304,65024,5120,8704,ck,0,0,7227.0792,a8w8_blockscale_1x128x128_256x128x128x128_16x16_32x32_2x2_8x32x1_8x32x1_1x32x1x8_8_1x1_intrawave_v3,801.92,176.61,0.0
gfx942,304,65152,5120,3072,ck,0,0,2503.0823,a8w8_blockscale_1x128x128_256x128x128x128_16x16_32x32_2x2_8x32x1_8x32x1_1x32x1x8_8_1x1_intrawave_v3,818.79,352.78,0.0
gfx942,304,65152,5120,8704,ck,0,0,7356.5425,a8w8_blockscale_1x128x128_256x128x128x128_16x16_32x32_2x2_8x32x1_8x32x1_1x32x1x8_8_1x1_intrawave_v3,789.36,173.83,0.0
gfx942,304,65280,5120,3072,ck,0,0,2499.0775,a8w8_blockscale_1x128x128_256x128x128x128_16x16_32x32_2x2_8x32x1_8x32x1_1x32x1x8_8_1x1_intrawave_v3,821.72,354.03,0.0
gfx942,304,65280,5120,8704,ck,0,0,7514.4382,a8w8_blockscale_1x128x128_256x128x128x128_16x16_32x32_2x2_8x32x1_8x32x1_1x32x1x8_8_1x1_intrawave_v3,774.29,170.5,0.0
gfx942,304,65408,5120,3072,ck,0,0,2465.7947,a8w8_blockscale_1x128x128_256x128x128x128_16x16_32x32_2x2_8x32x1_8x32x1_1x32x1x8_8_1x1_intrawave_v3,834.44,359.49,0.0
gfx942,304,65408,5120,8704,ck,0,0,7312.9868,a8w8_blockscale_1x128x128_256x128x128x128_16x16_32x32_2x2_8x32x1_8x32x1_1x32x1x8_8_1x1_intrawave_v3,797.18,175.53,0.0
gfx942,304,65536,5120,3072,ck,0,0,2434.5634,a8w8_blockscale_1x128x128_256x128x128x128_16x16_32x32_2x2_8x32x1_8x32x1_1x32x1x8_8_1x1_intrawave_v3,846.8,364.81,0.0
gfx942,304,65536,5120,8704,ck,0,0,7449.3768,a8w8_blockscale_1x128x128_256x128x128x128_16x16_32x32_2x2_8x32x1_8x32x1_1x32x1x8_8_1x1_intrawave_v3,784.11,172.64,0.0
gfx942,304,65664,5120,3072,ck,0,0,2484.3089,a8w8_blockscale_1x128x128_256x128x128x128_16x16_32x32_2x2_8x32x1_8x32x1_1x32x1x8_8_1x1_intrawave_v3,831.46,358.19,0.0
gfx942,304,65664,5120,8704,ck,0,0,7326.6589,a8w8_blockscale_1x128x128_256x128x128x128_16x16_32x32_2x2_8x32x1_8x32x1_1x32x1x8_8_1x1_intrawave_v3,798.8,175.87,0.0
gfx942,304,65792,5120,3072,ck,0,0,2484.2362,a8w8_blockscale_1x128x128_256x128x128x128_16x16_32x32_2x2_8x32x1_8x32x1_1x32x1x8_8_1x1_intrawave_v3,833.11,358.88,0.0
gfx942,304,65792,5120,8704,ck,0,0,7345.4466,a8w8_blockscale_1x128x128_256x128x128x128_16x16_32x32_2x2_8x32x1_8x32x1_1x32x1x8_8_1x1_intrawave_v3,798.31,175.75,0.0
gfx942,304,65920,5120,3072,ck,0,0,2464.7131,a8w8_blockscale_1x128x128_256x128x128x128_16x16_32x32_2x2_8x32x1_8x32x1_1x32x1x8_8_1x1_intrawave_v3,841.34,362.42,0.0
gfx942,304,65920,5120,8704,ck,0,0,7511.165,a8w8_blockscale_1x128x128_256x128x128x128_16x16_32x32_2x2_8x32x1_8x32x1_1x32x1x8_8_1x1_intrawave_v3,782.22,172.19,0.0
gfx942,304,66048,5120,3072,ck,0,0,2478.3024,a8w8_blockscale_1x128x128_256x128x128x128_16x16_32x32_2x2_8x32x1_8x32x1_1x32x1x8_8_1x1_intrawave_v3,838.35,361.12,0.0
gfx942,304,66048,5120,8704,ck,0,0,7460.3102,a8w8_blockscale_1x128x128_256x128x128x128_16x16_32x32_2x2_8x32x1_8x32x1_1x32x1x8_8_1x1_intrawave_v3,789.08,173.69,0.0
gfx942,304,66176,5120,3072,ck,0,0,2487.8943,a8w8_blockscale_1x128x128_256x128x128x128_16x16_32x32_2x2_8x32x1_8x32x1_1x32x1x8_8_1x1_intrawave_v3,836.74,360.41,0.0
gfx942,304,66176,5120,8704,ck,0,0,7521.0461,a8w8_blockscale_1x128x128_256x128x128x128_16x16_32x32_2x2_8x32x1_8x32x1_1x32x1x8_8_1x1_intrawave_v3,784.23,172.61,0.0
gfx942,304,66304,5120,3072,ck,0,0,2505.7918,a8w8_blockscale_1x128x128_256x128x128x128_16x16_32x32_2x2_8x32x1_8x32x1_1x32x1x8_8_1x1_intrawave_v3,832.37,358.52,0.0
gfx942,304,66304,5120,8704,ck,0,0,7434.0258,a8w8_blockscale_1x128x128_256x128x128x128_16x16_32x32_2x2_8x32x1_8x32x1_1x32x1x8_8_1x1_intrawave_v3,794.94,174.96,0.0
gfx942,304,66432,5120,3072,ck,0,0,2501.3728,a8w8_blockscale_1x128x128_256x128x128x128_16x16_32x32_2x2_8x32x1_8x32x1_1x32x1x8_8_1x1_intrawave_v3,835.45,359.83,0.0
gfx942,304,66432,5120,8704,ck,0,0,7612.8586,a8w8_blockscale_1x128x128_256x128x128x128_16x16_32x32_2x2_8x32x1_8x32x1_1x32x1x8_8_1x1_intrawave_v3,777.77,171.16,0.0
gfx942,304,66560,5120,3072,ck,0,0,2521.3508,a8w8_blockscale_1x128x128_256x128x128x128_16x16_32x32_2x2_8x32x1_8x32x1_1x32x1x8_8_1x1_intrawave_v3,830.43,357.66,0.0
gfx942,304,66560,5120,8704,ck,0,0,7570.9937,a8w8_blockscale_1x128x128_256x128x128x128_16x16_32x32_2x2_8x32x1_8x32x1_1x32x1x8_8_1x1_intrawave_v3,783.57,172.43,0.0
gfx942,304,66688,5120,3072,ck,0,0,2456.9185,a8w8_blockscale_1x128x128_256x128x128x128_16x16_32x32_2x2_8x32x1_8x32x1_1x32x1x8_8_1x1_intrawave_v3,853.84,367.73,0.0
gfx942,304,66688,5120,8704,ck,0,0,7451.2184,a8w8_blockscale_1x128x128_256x128x128x128_16x16_32x32_2x2_8x32x1_8x32x1_1x32x1x8_8_1x1_intrawave_v3,797.7,175.53,0.0
gfx942,304,66816,5120,3072,ck,0,0,2509.6031,a8w8_blockscale_1x128x128_256x128x128x128_16x16_32x32_2x2_8x32x1_8x32x1_1x32x1x8_8_1x1_intrawave_v3,837.52,360.69,0.0
gfx942,304,66816,5120,8704,ck,0,0,7448.4535,a8w8_blockscale_1x128x128_256x128x128x128_16x16_32x32_2x2_8x32x1_8x32x1_1x32x1x8_8_1x1_intrawave_v3,799.53,175.92,0.0
gfx942,304,66944,5120,3072,ck,0,0,2496.345,a8w8_blockscale_1x128x128_256x128x128x128_16x16_32x32_2x2_8x32x1_8x32x1_1x32x1x8_8_1x1_intrawave_v3,843.58,363.29,0.0
gfx942,304,66944,5120,8704,ck,0,0,7608.5761,a8w8_blockscale_1x128x128_256x128x128x128_16x16_32x32_2x2_8x32x1_8x32x1_1x32x1x8_8_1x1_intrawave_v3,784.2,172.54,0.0
gfx942,304,67072,5120,3072,ck,0,0,2492.1405,a8w8_blockscale_1x128x128_256x128x128x128_16x16_32x32_2x2_8x32x1_8x32x1_1x32x1x8_8_1x1_intrawave_v3,846.62,364.58,0.0
gfx942,304,67072,5120,8704,ck,0,0,7621.482,a8w8_blockscale_1x128x128_256x128x128x128_16x16_32x32_2x2_8x32x1_8x32x1_1x32x1x8_8_1x1_intrawave_v3,784.37,172.56,0.0
gfx942,304,67200,5120,3072,ck,0,0,2541.2843,a8w8_blockscale_1x128x128_256x128x128x128_16x16_32x32_2x2_8x32x1_8x32x1_1x32x1x8_8_1x1_intrawave_v3,831.83,358.2,0.0
gfx942,304,67200,5120,8704,ck,0,0,7497.7841,a8w8_blockscale_1x128x128_256x128x128x128_16x16_32x32_2x2_8x32x1_8x32x1_1x32x1x8_8_1x1_intrawave_v3,798.83,175.73,0.0
gfx942,304,67328,5120,3072,ck,0,0,2529.7861,a8w8_blockscale_1x128x128_256x128x128x128_16x16_32x32_2x2_8x32x1_8x32x1_1x32x1x8_8_1x1_intrawave_v3,837.21,360.5,0.0
gfx942,304,67328,5120,8704,ck,0,0,7509.8946,a8w8_blockscale_1x128x128_256x128x128x128_16x16_32x32_2x2_8x32x1_8x32x1_1x32x1x8_8_1x1_intrawave_v3,799.06,175.77,0.0
gfx942,304,67456,5120,3072,ck,0,0,2495.5996,a8w8_blockscale_1x128x128_256x128x128x128_16x16_32x32_2x2_8x32x1_8x32x1_1x32x1x8_8_1x1_intrawave_v3,850.29,366.13,0.0
gfx942,304,67456,5120,8704,ck,0,0,7682.8445,a8w8_blockscale_1x128x128_256x128x128x128_16x16_32x32_2x2_8x32x1_8x32x1_1x32x1x8_8_1x1_intrawave_v3,782.56,172.13,0.0
gfx942,304,67584,5120,3072,ck,0,0,2544.2009,a8w8_blockscale_1x128x128_256x128x128x128_16x16_32x32_2x2_8x32x1_8x32x1_1x32x1x8_8_1x1_intrawave_v3,835.63,359.8,0.0
gfx942,304,67584,5120,8704,ck,0,0,7684.3523,a8w8_blockscale_1x128x128_256x128x128x128_16x16_32x32_2x2_8x32x1_8x32x1_1x32x1x8_8_1x1_intrawave_v3,783.89,172.41,0.0
gfx942,304,67712,5120,3072,ck,0,0,2516.5124,a8w8_blockscale_1x128x128_256x128x128x128_16x16_32x32_2x2_8x32x1_8x32x1_1x32x1x8_8_1x1_intrawave_v3,846.42,364.44,0.0
gfx942,304,67712,5120,8704,ck,0,0,7718.1156,a8w8_blockscale_1x128x128_256x128x128x128_16x16_32x32_2x2_8x32x1_8x32x1_1x32x1x8_8_1x1_intrawave_v3,781.94,171.97,0.0
gfx942,304,67840,5120,3072,ck,0,0,2537.4402,a8w8_blockscale_1x128x128_256x128x128x128_16x16_32x32_2x2_8x32x1_8x32x1_1x32x1x8_8_1x1_intrawave_v3,841.03,362.1,0.0
gfx942,304,67840,5120,8704,ck,0,0,7771.963,a8w8_blockscale_1x128x128_256x128x128x128_16x16_32x32_2x2_8x32x1_8x32x1_1x32x1x8_8_1x1_intrawave_v3,777.99,171.09,0.0
gfx942,304,67968,5120,3072,ck,0,0,2507.001,a8w8_blockscale_1x128x128_256x128x128x128_16x16_32x32_2x2_8x32x1_8x32x1_1x32x1x8_8_1x1_intrawave_v3,852.85,367.18,0.0
gfx942,304,67968,5120,8704,ck,0,0,7629.2034,a8w8_blockscale_1x128x128_256x128x128x128_16x16_32x32_2x2_8x32x1_8x32x1_1x32x1x8_8_1x1_intrawave_v3,794.04,174.61,0.0
gfx942,304,68096,5120,3072,ck,0,0,2526.6372,a8w8_blockscale_1x128x128_256x128x128x128_16x16_32x32_2x2_8x32x1_8x32x1_1x32x1x8_8_1x1_intrawave_v3,847.81,365.0,0.0
gfx942,304,68096,5120,8704,ck,0,0,7589.3156,a8w8_blockscale_1x128x128_256x128x128x128_16x16_32x32_2x2_8x32x1_8x32x1_1x32x1x8_8_1x1_intrawave_v3,799.72,175.85,0.0
gfx942,304,68224,5120,3072,ck,0,0,2547.5498,a8w8_blockscale_1x128x128_256x128x128x128_16x16_32x32_2x2_8x32x1_8x32x1_1x32x1x8_8_1x1_intrawave_v3,842.43,362.67,0.0
gfx942,304,68224,5120,8704,ck,0,0,7769.1491,a8w8_blockscale_1x128x128_256x128x128x128_16x16_32x32_2x2_8x32x1_8x32x1_1x32x1x8_8_1x1_intrawave_v3,782.68,172.09,0.0
gfx942,304,68352,5120,3072,ck,0,0,2570.0798,a8w8_blockscale_1x128x128_256x128x128x128_16x16_32x32_2x2_8x32x1_8x32x1_1x32x1x8_8_1x1_intrawave_v3,836.62,360.16,0.0
gfx942,304,68352,5120,8704,ck,0,0,7740.2074,a8w8_blockscale_1x128x128_256x128x128x128_16x16_32x32_2x2_8x32x1_8x32x1_1x32x1x8_8_1x1_intrawave_v3,787.08,173.05,0.0
gfx942,304,68480,5120,3072,ck,0,0,2579.5782,a8w8_blockscale_1x128x128_256x128x128x128_16x16_32x32_2x2_8x32x1_8x32x1_1x32x1x8_8_1x1_intrawave_v3,835.1,359.49,0.0
gfx942,304,68480,5120,8704,ck,0,0,7639.0893,a8w8_blockscale_1x128x128_256x128x128x128_16x16_32x32_2x2_8x32x1_8x32x1_1x32x1x8_8_1x1_intrawave_v3,798.99,175.66,0.0
gfx942,304,68608,5120,3072,ck,0,0,2582.3387,a8w8_blockscale_1x128x128_256x128x128x128_16x16_32x32_2x2_8x32x1_8x32x1_1x32x1x8_8_1x1_intrawave_v3,835.76,359.77,0.0
gfx942,304,68608,5120,8704,ck,0,0,7632.7904,a8w8_blockscale_1x128x128_256x128x128x128_16x16_32x32_2x2_8x32x1_8x32x1_1x32x1x8_8_1x1_intrawave_v3,801.14,176.12,0.0
gfx942,304,68736,5120,3072,ck,0,0,2551.9885,a8w8_blockscale_1x128x128_256x128x128x128_16x16_32x32_2x2_8x32x1_8x32x1_1x32x1x8_8_1x1_intrawave_v3,847.28,364.71,0.0
gfx942,304,68736,5120,8704,ck,0,0,7699.7455,a8w8_blockscale_1x128x128_256x128x128x128_16x16_32x32_2x2_8x32x1_8x32x1_1x32x1x8_8_1x1_intrawave_v3,795.66,174.9,0.0
gfx942,304,68864,5120,3072,ck,0,0,2552.8967,a8w8_blockscale_1x128x128_256x128x128x128_16x16_32x32_2x2_8x32x1_8x32x1_1x32x1x8_8_1x1_intrawave_v3,848.56,365.25,0.0
gfx942,304,68864,5120,8704,ck,0,0,7811.097,a8w8_blockscale_1x128x128_256x128x128x128_16x16_32x32_2x2_8x32x1_8x32x1_1x32x1x8_8_1x1_intrawave_v3,785.78,172.72,0.0
gfx942,304,68992,5120,3072,ck,0,0,2591.1661,a8w8_blockscale_1x128x128_256x128x128x128_16x16_32x32_2x2_8x32x1_8x32x1_1x32x1x8_8_1x1_intrawave_v3,837.58,360.51,0.0
gfx942,304,68992,5120,8704,ck,0,0,7803.3236,a8w8_blockscale_1x128x128_256x128x128x128_16x16_32x32_2x2_8x32x1_8x32x1_1x32x1x8_8_1x1_intrawave_v3,788.02,173.2,0.0
gfx942,304,69120,5120,3072,ck,0,0,2605.7735,a8w8_blockscale_1x128x128_256x128x128x128_16x16_32x32_2x2_8x32x1_8x32x1_1x32x1x8_8_1x1_intrawave_v3,834.43,359.15,0.0
gfx942,304,69120,5120,8704,ck,0,0,7872.463,a8w8_blockscale_1x128x128_256x128x128x128_16x16_32x32_2x2_8x32x1_8x32x1_1x32x1x8_8_1x1_intrawave_v3,782.55,171.99,0.0
gfx942,304,69248,5120,3072,ck,0,0,2578.5069,a8w8_blockscale_1x128x128_256x128x128x128_16x16_32x32_2x2_8x32x1_8x32x1_1x32x1x8_8_1x1_intrawave_v3,844.81,363.61,0.0
gfx942,304,69248,5120,8704,ck,0,0,7767.6276,a8w8_blockscale_1x128x128_256x128x128x128_16x16_32x32_2x2_8x32x1_8x32x1_1x32x1x8_8_1x1_intrawave_v3,794.58,174.62,0.0
gfx942,304,69376,5120,3072,ck,0,0,2608.3543,a8w8_blockscale_1x128x128_256x128x128x128_16x16_32x32_2x2_8x32x1_8x32x1_1x32x1x8_8_1x1_intrawave_v3,836.69,360.1,0.0
gfx942,304,69376,5120,8704,ck,0,0,7836.5359,a8w8_blockscale_1x128x128_256x128x128x128_16x16_32x32_2x2_8x32x1_8x32x1_1x32x1x8_8_1x1_intrawave_v3,789.05,173.4,0.0
gfx942,304,69504,5120,3072,ck,0,0,2647.596,a8w8_blockscale_1x128x128_256x128x128x128_16x16_32x32_2x2_8x32x1_8x32x1_1x32x1x8_8_1x1_intrawave_v3,825.81,355.4,0.0
gfx942,304,69504,5120,8704,ck,0,0,7971.5895,a8w8_blockscale_1x128x128_256x128x128x128_16x16_32x32_2x2_8x32x1_8x32x1_1x32x1x8_8_1x1_intrawave_v3,777.11,170.76,0.0
gfx942,304,69632,5120,3072,ck,0,0,2624.8437,a8w8_blockscale_1x128x128_256x128x128x128_16x16_32x32_2x2_8x32x1_8x32x1_1x32x1x8_8_1x1_intrawave_v3,834.5,359.13,0.0
gfx942,304,69632,5120,8704,ck,0,0,7966.7296,a8w8_blockscale_1x128x128_256x128x128x128_16x16_32x32_2x2_8x32x1_8x32x1_1x32x1x8_8_1x1_intrawave_v3,779.02,171.17,0.0
gfx942,304,69760,5120,3072,ck,0,0,2645.7763,a8w8_blockscale_1x128x128_256x128x128x128_16x16_32x32_2x2_8x32x1_8x32x1_1x32x1x8_8_1x1_intrawave_v3,829.42,356.94,0.0
gfx942,304,69760,5120,8704,ck,0,0,7954.0124,a8w8_blockscale_1x128x128_256x128x128x128_16x16_32x32_2x2_8x32x1_8x32x1_1x32x1x8_8_1x1_intrawave_v3,781.7,171.75,0.0
gfx942,304,69888,5120,3072,ck,0,0,2632.0151,a8w8_blockscale_1x128x128_256x128x128x128_16x16_32x32_2x2_8x32x1_8x32x1_1x32x1x8_8_1x1_intrawave_v3,835.29,359.45,0.0
gfx942,304,69888,5120,8704,ck,0,0,7946.9852,a8w8_blockscale_1x128x128_256x128x128x128_16x16_32x32_2x2_8x32x1_8x32x1_1x32x1x8_8_1x1_intrawave_v3,783.82,172.21,0.0
gfx942,304,70016,5120,3072,ck,0,0,2601.5166,a8w8_blockscale_1x128x128_256x128x128x128_16x16_32x32_2x2_8x32x1_8x32x1_1x32x1x8_8_1x1_intrawave_v3,846.63,364.32,0.0
gfx942,304,70016,5120,8704,ck,0,0,7948.59,a8w8_blockscale_1x128x128_256x128x128x128_16x16_32x32_2x2_8x32x1_8x32x1_1x32x1x8_8_1x1_intrawave_v3,785.1,172.48,0.0
gfx942,304,70144,5120,3072,ck,0,0,2637.3546,a8w8_blockscale_1x128x128_256x128x128x128_16x16_32x32_2x2_8x32x1_8x32x1_1x32x1x8_8_1x1_intrawave_v3,836.65,360.01,0.0
gfx942,304,70144,5120,8704,ck,0,0,8054.649,a8w8_blockscale_1x128x128_256x128x128x128_16x16_32x32_2x2_8x32x1_8x32x1_1x32x1x8_8_1x1_intrawave_v3,776.18,170.51,0.0
gfx942,304,70272,5120,3072,ck,0,0,2664.8842,a8w8_blockscale_1x128x128_256x128x128x128_16x16_32x32_2x2_8x32x1_8x32x1_1x32x1x8_8_1x1_intrawave_v3,829.52,356.93,0.0
gfx942,304,70272,5120,8704,ck,0,0,7892.9011,a8w8_blockscale_1x128x128_256x128x128x128_16x16_32x32_2x2_8x32x1_8x32x1_1x32x1x8_8_1x1_intrawave_v3,793.53,174.31,0.0
gfx942,304,70400,5120,3072,ck,0,0,2666.4321,a8w8_blockscale_1x128x128_256x128x128x128_16x16_32x32_2x2_8x32x1_8x32x1_1x32x1x8_8_1x1_intrawave_v3,830.55,357.37,0.0
gfx942,304,70400,5120,8704,ck,0,0,7886.8766,a8w8_blockscale_1x128x128_256x128x128x128_16x16_32x32_2x2_8x32x1_8x32x1_1x32x1x8_8_1x1_intrawave_v3,795.58,174.75,0.0
gfx942,304,70528,5120,3072,ck,0,0,2670.3795,a8w8_blockscale_1x128x128_256x128x128x128_16x16_32x32_2x2_8x32x1_8x32x1_1x32x1x8_8_1x1_intrawave_v3,830.83,357.48,0.0
gfx942,304,70528,5120,8704,ck,0,0,7979.7393,a8w8_blockscale_1x128x128_256x128x128x128_16x16_32x32_2x2_8x32x1_8x32x1_1x32x1x8_8_1x1_intrawave_v3,787.76,173.02,0.0
gfx942,304,70656,5120,3072,ck,0,0,2644.0175,a8w8_blockscale_1x128x128_256x128x128x128_16x16_32x32_2x2_8x32x1_8x32x1_1x32x1x8_8_1x1_intrawave_v3,840.63,361.68,0.0
gfx942,304,70656,5120,8704,ck,0,0,8033.5078,a8w8_blockscale_1x128x128_256x128x128x128_16x16_32x32_2x2_8x32x1_8x32x1_1x32x1x8_8_1x1_intrawave_v3,783.9,172.16,0.0
gfx942,304,70784,5120,3072,ck,0,0,2705.7835,a8w8_blockscale_1x128x128_256x128x128x128_16x16_32x32_2x2_8x32x1_8x32x1_1x32x1x8_8_1x1_intrawave_v3,822.93,354.06,0.0
gfx942,304,70784,5120,8704,ck,0,0,8075.2772,a8w8_blockscale_1x128x128_256x128x128x128_16x16_32x32_2x2_8x32x1_8x32x1_1x32x1x8_8_1x1_intrawave_v3,781.26,171.57,0.0
gfx942,304,70912,5120,3072,ck,0,0,2640.9848,a8w8_blockscale_1x128x128_256x128x128x128_16x16_32x32_2x2_8x32x1_8x32x1_1x32x1x8_8_1x1_intrawave_v3,844.65,363.39,0.0
gfx942,304,70912,5120,8704,ck,0,0,8146.0832,a8w8_blockscale_1x128x128_256x128x128x128_16x16_32x32_2x2_8x32x1_8x32x1_1x32x1x8_8_1x1_intrawave_v3,775.87,170.38,0.0
gfx942,304,71040,5120,3072,ck,0,0,2650.2053,a8w8_blockscale_1x128x128_256x128x128x128_16x16_32x32_2x2_8x32x1_8x32x1_1x32x1x8_8_1x1_intrawave_v3,843.23,362.77,0.0
gfx942,304,71040,5120,8704,ck,0,0,8038.4119,a8w8_blockscale_1x128x128_256x128x128x128_16x16_32x32_2x2_8x32x1_8x32x1_1x32x1x8_8_1x1_intrawave_v3,787.68,172.96,0.0
gfx942,304,71168,5120,3072,ck,0,0,2681.0406,a8w8_blockscale_1x128x128_256x128x128x128_16x16_32x32_2x2_8x32x1_8x32x1_1x32x1x8_8_1x1_intrawave_v3,835.03,359.23,0.0
gfx942,304,71168,5120,8704,ck,0,0,7984.1594,a8w8_blockscale_1x128x128_256x128x128x128_16x16_32x32_2x2_8x32x1_8x32x1_1x32x1x8_8_1x1_intrawave_v3,794.46,174.44,0.0
gfx942,304,71296,5120,3072,ck,0,0,2678.1575,a8w8_blockscale_1x128x128_256x128x128x128_16x16_32x32_2x2_8x32x1_8x32x1_1x32x1x8_8_1x1_intrawave_v3,837.43,360.26,0.0
gfx942,304,71296,5120,8704,ck,0,0,7946.9556,a8w8_blockscale_1x128x128_256x128x128x128_16x16_32x32_2x2_8x32x1_8x32x1_1x32x1x8_8_1x1_intrawave_v3,799.62,175.56,0.0
gfx942,304,71424,5120,3072,ck,0,0,2657.371,a8w8_blockscale_1x128x128_256x128x128x128_16x16_32x32_2x2_8x32x1_8x32x1_1x32x1x8_8_1x1_intrawave_v3,845.5,363.71,0.0
gfx942,304,71424,5120,8704,ck,0,0,8027.0205,a8w8_blockscale_1x128x128_256x128x128x128_16x16_32x32_2x2_8x32x1_8x32x1_1x32x1x8_8_1x1_intrawave_v3,793.06,174.11,0.0
gfx942,304,71552,5120,3072,ck,0,0,2698.9971,a8w8_blockscale_1x128x128_256x128x128x128_16x16_32x32_2x2_8x32x1_8x32x1_1x32x1x8_8_1x1_intrawave_v3,833.95,358.74,0.0
gfx942,304,71552,5120,8704,ck,0,0,8077.1375,a8w8_blockscale_1x128x128_256x128x128x128_16x16_32x32_2x2_8x32x1_8x32x1_1x32x1x8_8_1x1_intrawave_v3,789.56,173.33,0.0
gfx942,304,71680,5120,3072,ck,0,0,2688.0891,a8w8_blockscale_1x128x128_256x128x128x128_16x16_32x32_2x2_8x32x1_8x32x1_1x32x1x8_8_1x1_intrawave_v3,838.83,360.83,0.0
gfx942,304,71680,5120,8704,ck,0,0,8106.2315,a8w8_blockscale_1x128x128_256x128x128x128_16x16_32x32_2x2_8x32x1_8x32x1_1x32x1x8_8_1x1_intrawave_v3,788.13,173.01,0.0
gfx942,304,71808,5120,3072,ck,0,0,2704.009,a8w8_blockscale_1x128x128_256x128x128x128_16x16_32x32_2x2_8x32x1_8x32x1_1x32x1x8_8_1x1_intrawave_v3,835.38,359.33,0.0
gfx942,304,71808,5120,8704,ck,0,0,8146.3639,a8w8_blockscale_1x128x128_256x128x128x128_16x16_32x32_2x2_8x32x1_8x32x1_1x32x1x8_8_1x1_intrawave_v3,785.65,172.46,0.0
gfx942,304,71936,5120,3072,ck,0,0,2740.0002,a8w8_blockscale_1x128x128_256x128x128x128_16x16_32x32_2x2_8x32x1_8x32x1_1x32x1x8_8_1x1_intrawave_v3,825.88,355.23,0.0
gfx942,304,71936,5120,8704,ck,0,0,8136.9535,a8w8_blockscale_1x128x128_256x128x128x128_16x16_32x32_2x2_8x32x1_8x32x1_1x32x1x8_8_1x1_intrawave_v3,787.96,172.95,0.0
gfx942,304,72064,5120,3072,ck,0,0,2751.3174,a8w8_blockscale_1x128x128_256x128x128x128_16x16_32x32_2x2_8x32x1_8x32x1_1x32x1x8_8_1x1_intrawave_v3,823.95,354.39,0.0
gfx942,304,72064,5120,8704,ck,0,0,8347.9194,a8w8_blockscale_1x128x128_256x128x128x128_16x16_32x32_2x2_8x32x1_8x32x1_1x32x1x8_8_1x1_intrawave_v3,769.41,168.87,0.0
gfx942,304,72192,5120,3072,ck,0,0,2755.183,a8w8_blockscale_1x128x128_256x128x128x128_16x16_32x32_2x2_8x32x1_8x32x1_1x32x1x8_8_1x1_intrawave_v3,824.25,354.51,0.0
gfx942,304,72192,5120,8704,ck,0,0,7999.16,a8w8_blockscale_1x128x128_256x128x128x128_16x16_32x32_2x2_8x32x1_8x32x1_1x32x1x8_8_1x1_intrawave_v3,804.38,176.54,0.0
gfx942,304,72320,5120,3072,ck,0,0,2735.3694,a8w8_blockscale_1x128x128_256x128x128x128_16x16_32x32_2x2_8x32x1_8x32x1_1x32x1x8_8_1x1_intrawave_v3,831.69,357.7,0.0
gfx942,304,72320,5120,8704,ck,0,0,7979.7672,a8w8_blockscale_1x128x128_256x128x128x128_16x16_32x32_2x2_8x32x1_8x32x1_1x32x1x8_8_1x1_intrawave_v3,807.77,177.27,0.0
gfx942,304,72448,5120,3072,ck,0,0,2738.629,a8w8_blockscale_1x128x128_256x128x128x128_16x16_32x32_2x2_8x32x1_8x32x1_1x32x1x8_8_1x1_intrawave_v3,832.17,357.9,0.0
gfx942,304,72448,5120,8704,ck,0,0,8049.705,a8w8_blockscale_1x128x128_256x128x128x128_16x16_32x32_2x2_8x32x1_8x32x1_1x32x1x8_8_1x1_intrawave_v3,802.17,176.03,0.0
gfx942,304,72576,5120,3072,ck,0,0,2737.4985,a8w8_blockscale_1x128x128_256x128x128x128_16x16_32x32_2x2_8x32x1_8x32x1_1x32x1x8_8_1x1_intrawave_v3,833.99,358.67,0.0
gfx942,304,72576,5120,8704,ck,0,0,8293.3741,a8w8_blockscale_1x128x128_256x128x128x128_16x16_32x32_2x2_8x32x1_8x32x1_1x32x1x8_8_1x1_intrawave_v3,779.97,171.15,0.0
gfx942,304,72704,5120,3072,ck,0,0,2740.9854,a8w8_blockscale_1x128x128_256x128x128x128_16x16_32x32_2x2_8x32x1_8x32x1_1x32x1x8_8_1x1_intrawave_v3,834.4,358.84,0.0
gfx942,304,72704,5120,8704,ck,0,0,8070.7527,a8w8_blockscale_1x128x128_256x128x128x128_16x16_32x32_2x2_8x32x1_8x32x1_1x32x1x8_8_1x1_intrawave_v3,802.9,176.18,0.0
gfx942,304,72832,5120,3072,ck,0,0,2722.4874,a8w8_blockscale_1x128x128_256x128x128x128_16x16_32x32_2x2_8x32x1_8x32x1_1x32x1x8_8_1x1_intrawave_v3,841.55,361.9,0.0
gfx942,304,72832,5120,8704,ck,0,0,8386.1447,a8w8_blockscale_1x128x128_256x128x128x128_16x16_32x32_2x2_8x32x1_8x32x1_1x32x1x8_8_1x1_intrawave_v3,774.07,169.84,0.0
gfx942,304,72960,5120,3072,ck,0,0,2726.5935,a8w8_blockscale_1x128x128_256x128x128x128_16x16_32x32_2x2_8x32x1_8x32x1_1x32x1x8_8_1x1_intrawave_v3,841.75,361.98,0.0
gfx942,304,72960,5120,8704,ck,0,0,8123.4968,a8w8_blockscale_1x128x128_256x128x128x128_16x16_32x32_2x2_8x32x1_8x32x1_1x32x1x8_8_1x1_intrawave_v3,800.5,175.63,0.0
gfx942,304,73088,5120,3072,ck,0,0,2720.2609,a8w8_blockscale_1x128x128_256x128x128x128_16x16_32x32_2x2_8x32x1_8x32x1_1x32x1x8_8_1x1_intrawave_v3,845.19,363.45,0.0
gfx942,304,73088,5120,8704,ck,0,0,8443.3799,a8w8_blockscale_1x128x128_256x128x128x128_16x16_32x32_2x2_8x32x1_8x32x1_1x32x1x8_8_1x1_intrawave_v3,771.52,169.26,0.0
gfx942,304,73216,5120,3072,ck,0,0,2744.4297,a8w8_blockscale_1x128x128_256x128x128x128_16x16_32x32_2x2_8x32x1_8x32x1_1x32x1x8_8_1x1_intrawave_v3,839.22,360.87,0.0
gfx942,304,73216,5120,8704,ck,0,0,8279.6798,a8w8_blockscale_1x128x128_256x128x128x128_16x16_32x32_2x2_8x32x1_8x32x1_1x32x1x8_8_1x1_intrawave_v3,788.15,172.9,0.0
gfx942,304,73344,5120,3072,ck,0,0,2777.5999,a8w8_blockscale_1x128x128_256x128x128x128_16x16_32x32_2x2_8x32x1_8x32x1_1x32x1x8_8_1x1_intrawave_v3,830.65,357.17,0.0
gfx942,304,73344,5120,8704,ck,0,0,8408.2395,a8w8_blockscale_1x128x128_256x128x128x128_16x16_32x32_2x2_8x32x1_8x32x1_1x32x1x8_8_1x1_intrawave_v3,777.46,170.55,0.0
gfx942,304,73472,5120,3072,ck,0,0,2720.6829,a8w8_blockscale_1x128x128_256x128x128x128_16x16_32x32_2x2_8x32x1_8x32x1_1x32x1x8_8_1x1_intrawave_v3,849.5,365.27,0.0
gfx942,304,73472,5120,8704,ck,0,0,8386.6986,a8w8_blockscale_1x128x128_256x128x128x128_16x16_32x32_2x2_8x32x1_8x32x1_1x32x1x8_8_1x1_intrawave_v3,780.82,171.27,0.0
gfx942,304,73600,5120,3072,ck,0,0,2771.0194,a8w8_blockscale_1x128x128_256x128x128x128_16x16_32x32_2x2_8x32x1_8x32x1_1x32x1x8_8_1x1_intrawave_v3,835.52,359.25,0.0
gfx942,304,73600,5120,8704,ck,0,0,8214.7387,a8w8_blockscale_1x128x128_256x128x128x128_16x16_32x32_2x2_8x32x1_8x32x1_1x32x1x8_8_1x1_intrawave_v3,798.55,175.15,0.0
gfx942,304,73728,5120,3072,ck,0,0,2786.8828,a8w8_blockscale_1x128x128_256x128x128x128_16x16_32x32_2x2_8x32x1_8x32x1_1x32x1x8_8_1x1_intrawave_v3,832.21,357.82,0.0
gfx942,304,73728,5120,8704,ck,0,0,8242.3917,a8w8_blockscale_1x128x128_256x128x128x128_16x16_32x32_2x2_8x32x1_8x32x1_1x32x1x8_8_1x1_intrawave_v3,797.26,174.86,0.0
gfx942,304,73856,5120,3072,ck,0,0,2829.6871,a8w8_blockscale_1x128x128_256x128x128x128_16x16_32x32_2x2_8x32x1_8x32x1_1x32x1x8_8_1x1_intrawave_v3,821.05,353.01,0.0
gfx942,304,73856,5120,8704,ck,0,0,8449.8948,a8w8_blockscale_1x128x128_256x128x128x128_16x16_32x32_2x2_8x32x1_8x32x1_1x32x1x8_8_1x1_intrawave_v3,779.03,170.85,0.0
gfx942,304,73984,5120,3072,ck,0,0,2756.9658,a8w8_blockscale_1x128x128_256x128x128x128_16x16_32x32_2x2_8x32x1_8x32x1_1x32x1x8_8_1x1_intrawave_v3,844.17,362.94,0.0
gfx942,304,73984,5120,8704,ck,0,0,8398.7111,a8w8_blockscale_1x128x128_256x128x128x128_16x16_32x32_2x2_8x32x1_8x32x1_1x32x1x8_8_1x1_intrawave_v3,785.13,172.18,0.0
gfx942,304,74112,5120,3072,ck,0,0,2760.7634,a8w8_blockscale_1x128x128_256x128x128x128_16x16_32x32_2x2_8x32x1_8x32x1_1x32x1x8_8_1x1_intrawave_v3,844.46,363.05,0.0
gfx942,304,74112,5120,8704,ck,0,0,8551.9873,a8w8_blockscale_1x128x128_256x128x128x128_16x16_32x32_2x2_8x32x1_8x32x1_1x32x1x8_8_1x1_intrawave_v3,772.4,169.38,0.0
gfx942,304,74240,5120,3072,ck,0,0,2832.2811,a8w8_blockscale_1x128x128_256x128x128x128_16x16_32x32_2x2_8x32x1_8x32x1_1x32x1x8_8_1x1_intrawave_v3,824.56,354.49,0.0
gfx942,304,74240,5120,8704,ck,0,0,8533.9856,a8w8_blockscale_1x128x128_256x128x128x128_16x16_32x32_2x2_8x32x1_8x32x1_1x32x1x8_8_1x1_intrawave_v3,775.36,170.02,0.0
gfx942,304,74368,5120,3072,ck,0,0,2777.1725,a8w8_blockscale_1x128x128_256x128x128x128_16x16_32x32_2x2_8x32x1_8x32x1_1x32x1x8_8_1x1_intrawave_v3,842.37,362.14,0.0
gfx942,304,74368,5120,8704,ck,0,0,8654.7704,a8w8_blockscale_1x128x128_256x128x128x128_16x16_32x32_2x2_8x32x1_8x32x1_1x32x1x8_8_1x1_intrawave_v3,765.86,167.93,0.0
gfx942,304,74496,5120,3072,ck,0,0,2783.1009,a8w8_blockscale_1x128x128_256x128x128x128_16x16_32x32_2x2_8x32x1_8x32x1_1x32x1x8_8_1x1_intrawave_v3,842.03,361.98,0.0
gfx942,304,74496,5120,8704,ck,0,0,8343.6854,a8w8_blockscale_1x128x128_256x128x128x128_16x16_32x32_2x2_8x32x1_8x32x1_1x32x1x8_8_1x1_intrawave_v3,795.78,174.48,0.0
gfx942,304,74624,5120,3072,ck,0,0,2816.953,a8w8_blockscale_1x128x128_256x128x128x128_16x16_32x32_2x2_8x32x1_8x32x1_1x32x1x8_8_1x1_intrawave_v3,833.34,358.23,0.0
gfx942,304,74624,5120,8704,ck,0,0,8540.3551,a8w8_blockscale_1x128x128_256x128x128x128_16x16_32x32_2x2_8x32x1_8x32x1_1x32x1x8_8_1x1_intrawave_v3,778.79,170.75,0.0
gfx942,304,74752,5120,3072,ck,0,0,2822.4872,a8w8_blockscale_1x128x128_256x128x128x128_16x16_32x32_2x2_8x32x1_8x32x1_1x32x1x8_8_1x1_intrawave_v3,833.13,358.13,0.0
gfx942,304,74752,5120,8704,ck,0,0,8528.2096,a8w8_blockscale_1x128x128_256x128x128x128_16x16_32x32_2x2_8x32x1_8x32x1_1x32x1x8_8_1x1_intrawave_v3,781.24,171.27,0.0
gfx942,304,74880,5120,3072,ck,0,0,2826.2636,a8w8_blockscale_1x128x128_256x128x128x128_16x16_32x32_2x2_8x32x1_8x32x1_1x32x1x8_8_1x1_intrawave_v3,833.44,358.26,0.0
gfx942,304,74880,5120,8704,ck,0,0,8755.0671,a8w8_blockscale_1x128x128_256x128x128x128_16x16_32x32_2x2_8x32x1_8x32x1_1x32x1x8_8_1x1_intrawave_v3,762.3,167.11,0.0
gfx942,304,75008,5120,3072,ck,0,0,2835.6559,a8w8_blockscale_1x128x128_256x128x128x128_16x16_32x32_2x2_8x32x1_8x32x1_1x32x1x8_8_1x1_intrawave_v3,832.1,357.67,0.0
gfx942,304,75008,5120,8704,ck,0,0,8657.6547,a8w8_blockscale_1x128x128_256x128x128x128_16x16_32x32_2x2_8x32x1_8x32x1_1x32x1x8_8_1x1_intrawave_v3,772.19,169.27,0.0
gfx942,304,75136,5120,3072,ck,0,0,2818.212,a8w8_blockscale_1x128x128_256x128x128x128_16x16_32x32_2x2_8x32x1_8x32x1_1x32x1x8_8_1x1_intrawave_v3,838.68,360.49,0.0
gfx942,304,75136,5120,8704,ck,0,0,8671.8605,a8w8_blockscale_1x128x128_256x128x128x128_16x16_32x32_2x2_8x32x1_8x32x1_1x32x1x8_8_1x1_intrawave_v3,772.24,169.28,0.0
gfx942,304,75264,5120,3072,ck,0,0,2834.3027,a8w8_blockscale_1x128x128_256x128x128x128_16x16_32x32_2x2_8x32x1_8x32x1_1x32x1x8_8_1x1_intrawave_v3,835.34,359.05,0.0
gfx942,304,75264,5120,8704,ck,0,0,8403.2064,a8w8_blockscale_1x128x128_256x128x128x128_16x16_32x32_2x2_8x32x1_8x32x1_1x32x1x8_8_1x1_intrawave_v3,798.29,174.98,0.0
gfx942,304,75392,5120,3072,ck,0,0,2882.0057,a8w8_blockscale_1x128x128_256x128x128x128_16x16_32x32_2x2_8x32x1_8x32x1_1x32x1x8_8_1x1_intrawave_v3,822.91,353.69,0.0
gfx942,304,75392,5120,8704,ck,0,0,8685.3508,a8w8_blockscale_1x128x128_256x128x128x128_16x16_32x32_2x2_8x32x1_8x32x1_1x32x1x8_8_1x1_intrawave_v3,773.67,169.57,0.0
gfx942,304,75520,5120,3072,ck,0,0,2853.9021,a8w8_blockscale_1x128x128_256x128x128x128_16x16_32x32_2x2_8x32x1_8x32x1_1x32x1x8_8_1x1_intrawave_v3,832.42,357.77,0.0
gfx942,304,75520,5120,8704,ck,0,0,8624.117,a8w8_blockscale_1x128x128_256x128x128x128_16x16_32x32_2x2_8x32x1_8x32x1_1x32x1x8_8_1x1_intrawave_v3,780.49,171.06,0.0
gfx942,304,75648,5120,3072,ck,0,0,2858.0278,a8w8_blockscale_1x128x128_256x128x128x128_16x16_32x32_2x2_8x32x1_8x32x1_1x32x1x8_8_1x1_intrawave_v3,832.63,357.85,0.0
gfx942,304,75648,5120,8704,ck,0,0,8644.9672,a8w8_blockscale_1x128x128_256x128x128x128_16x16_32x32_2x2_8x32x1_8x32x1_1x32x1x8_8_1x1_intrawave_v3,779.93,170.92,0.0
gfx942,304,75776,5120,3072,ck,0,0,2904.9017,a8w8_blockscale_1x128x128_256x128x128x128_16x16_32x32_2x2_8x32x1_8x32x1_1x32x1x8_8_1x1_intrawave_v3,820.58,352.67,0.0
gfx942,304,75776,5120,8704,ck,0,0,8468.8917,a8w8_blockscale_1x128x128_256x128x128x128_16x16_32x32_2x2_8x32x1_8x32x1_1x32x1x8_8_1x1_intrawave_v3,797.49,174.76,0.0
gfx942,304,75904,5120,3072,ck,0,0,2898.3408,a8w8_blockscale_1x128x128_256x128x128x128_16x16_32x32_2x2_8x32x1_8x32x1_1x32x1x8_8_1x1_intrawave_v3,823.83,354.05,0.0
gfx942,304,75904,5120,8704,ck,0,0,8480.8719,a8w8_blockscale_1x128x128_256x128x128x128_16x16_32x32_2x2_8x32x1_8x32x1_1x32x1x8_8_1x1_intrawave_v3,797.71,174.8,0.0
gfx942,304,76032,5120,3072,ck,0,0,2816.7235,a8w8_blockscale_1x128x128_256x128x128x128_16x16_32x32_2x2_8x32x1_8x32x1_1x32x1x8_8_1x1_intrawave_v3,849.13,364.92,0.0
gfx942,304,76032,5120,8704,ck,0,0,8491.5169,a8w8_blockscale_1x128x128_256x128x128x128_16x16_32x32_2x2_8x32x1_8x32x1_1x32x1x8_8_1x1_intrawave_v3,798.05,174.87,0.0
gfx942,304,76160,5120,3072,ck,0,0,2893.8502,a8w8_blockscale_1x128x128_256x128x128x128_16x16_32x32_2x2_8x32x1_8x32x1_1x32x1x8_8_1x1_intrawave_v3,827.89,355.78,0.0
gfx942,304,76160,5120,8704,ck,0,0,8718.0296,a8w8_blockscale_1x128x128_256x128x128x128_16x16_32x32_2x2_8x32x1_8x32x1_1x32x1x8_8_1x1_intrawave_v3,778.62,170.61,0.0
gfx942,304,76288,5120,3072,ck,0,0,2916.2372,a8w8_blockscale_1x128x128_256x128x128x128_16x16_32x32_2x2_8x32x1_8x32x1_1x32x1x8_8_1x1_intrawave_v3,822.91,353.63,0.0
gfx942,304,76288,5120,8704,ck,0,0,8856.4895,a8w8_blockscale_1x128x128_256x128x128x128_16x16_32x32_2x2_8x32x1_8x32x1_1x32x1x8_8_1x1_intrawave_v3,767.74,168.21,0.0
gfx942,304,76416,5120,3072,ck,0,0,2884.753,a8w8_blockscale_1x128x128_256x128x128x128_16x16_32x32_2x2_8x32x1_8x32x1_1x32x1x8_8_1x1_intrawave_v3,833.29,358.08,0.0
gfx942,304,76416,5120,8704,ck,0,0,8682.313,a8w8_blockscale_1x128x128_256x128x128x128_16x16_32x32_2x2_8x32x1_8x32x1_1x32x1x8_8_1x1_intrawave_v3,784.45,171.87,0.0
gfx942,304,76544,5120,3072,ck,0,0,2891.148,a8w8_blockscale_1x128x128_256x128x128x128_16x16_32x32_2x2_8x32x1_8x32x1_1x32x1x8_8_1x1_intrawave_v3,832.84,357.88,0.0
gfx942,304,76544,5120,8704,ck,0,0,8627.3213,a8w8_blockscale_1x128x128_256x128x128x128_16x16_32x32_2x2_8x32x1_8x32x1_1x32x1x8_8_1x1_intrawave_v3,790.78,173.24,0.0
gfx942,304,76672,5120,3072,ck,0,0,2852.6389,a8w8_blockscale_1x128x128_256x128x128x128_16x16_32x32_2x2_8x32x1_8x32x1_1x32x1x8_8_1x1_intrawave_v3,845.5,363.31,0.0
gfx942,304,76672,5120,8704,ck,0,0,8638.45,a8w8_blockscale_1x128x128_256x128x128x128_16x16_32x32_2x2_8x32x1_8x32x1_1x32x1x8_8_1x1_intrawave_v3,791.08,173.3,0.0
gfx942,304,76800,5120,3072,ck,0,0,2873.9907,a8w8_blockscale_1x128x128_256x128x128x128_16x16_32x32_2x2_8x32x1_8x32x1_1x32x1x8_8_1x1_intrawave_v3,840.61,361.2,0.0
gfx942,304,76800,5120,8704,ck,0,0,8816.0741,a8w8_blockscale_1x128x128_256x128x128x128_16x16_32x32_2x2_8x32x1_8x32x1_1x32x1x8_8_1x1_intrawave_v3,776.43,170.08,0.0
gfx942,304,76928,5120,3072,ck,0,0,2858.8279,a8w8_blockscale_1x128x128_256x128x128x128_16x16_32x32_2x2_8x32x1_8x32x1_1x32x1x8_8_1x1_intrawave_v3,846.48,363.71,0.0
gfx942,304,76928,5120,8704,ck,0,0,8741.5092,a8w8_blockscale_1x128x128_256x128x128x128_16x16_32x32_2x2_8x32x1_8x32x1_1x32x1x8_8_1x1_intrawave_v3,784.36,171.81,0.0
gfx942,304,77056,5120,3072,ck,0,0,2957.0484,a8w8_blockscale_1x128x128_256x128x128x128_16x16_32x32_2x2_8x32x1_8x32x1_1x32x1x8_8_1x1_intrawave_v3,819.73,352.21,0.0
gfx942,304,77056,5120,8704,ck,0,0,8959.171,a8w8_blockscale_1x128x128_256x128x128x128_16x16_32x32_2x2_8x32x1_8x32x1_1x32x1x8_8_1x1_intrawave_v3,766.58,167.91,0.0
gfx942,304,77184,5120,3072,ck,0,0,2918.3588,a8w8_blockscale_1x128x128_256x128x128x128_16x16_32x32_2x2_8x32x1_8x32x1_1x32x1x8_8_1x1_intrawave_v3,831.97,357.46,0.0
gfx942,304,77184,5120,8704,ck,0,0,8815.5648,a8w8_blockscale_1x128x128_256x128x128x128_16x16_32x32_2x2_8x32x1_8x32x1_1x32x1x8_8_1x1_intrawave_v3,780.36,170.92,0.0
gfx942,304,77312,5120,3072,ck,0,0,2882.4474,a8w8_blockscale_1x128x128_256x128x128x128_16x16_32x32_2x2_8x32x1_8x32x1_1x32x1x8_8_1x1_intrawave_v3,843.74,362.51,0.0
gfx942,304,77312,5120,8704,ck,0,0,8832.592,a8w8_blockscale_1x128x128_256x128x128x128_16x16_32x32_2x2_8x32x1_8x32x1_1x32x1x8_8_1x1_intrawave_v3,780.15,170.86,0.0
gfx942,304,77440,5120,3072,ck,0,0,2886.185,a8w8_blockscale_1x128x128_256x128x128x128_16x16_32x32_2x2_8x32x1_8x32x1_1x32x1x8_8_1x1_intrawave_v3,844.04,362.63,0.0
gfx942,304,77440,5120,8704,ck,0,0,8798.3965,a8w8_blockscale_1x128x128_256x128x128x128_16x16_32x32_2x2_8x32x1_8x32x1_1x32x1x8_8_1x1_intrawave_v3,784.48,171.8,0.0
gfx942,304,77568,5120,3072,ck,0,0,2929.6033,a8w8_blockscale_1x128x128_256x128x128x128_16x16_32x32_2x2_8x32x1_8x32x1_1x32x1x8_8_1x1_intrawave_v3,832.9,357.83,0.0
gfx942,304,77568,5120,8704,ck,0,0,8679.0566,a8w8_blockscale_1x128x128_256x128x128x128_16x16_32x32_2x2_8x32x1_8x32x1_1x32x1x8_8_1x1_intrawave_v3,796.58,174.44,0.0
gfx942,304,77696,5120,3072,ck,0,0,2952.3415,a8w8_blockscale_1x128x128_256x128x128x128_16x16_32x32_2x2_8x32x1_8x32x1_1x32x1x8_8_1x1_intrawave_v3,827.85,355.66,0.0
gfx942,304,77696,5120,8704,ck,0,0,8677.5878,a8w8_blockscale_1x128x128_256x128x128x128_16x16_32x32_2x2_8x32x1_8x32x1_1x32x1x8_8_1x1_intrawave_v3,798.03,174.75,0.0
gfx942,304,77824,5120,3072,ck,0,0,2999.3043,a8w8_blockscale_1x128x128_256x128x128x128_16x16_32x32_2x2_8x32x1_8x32x1_1x32x1x8_8_1x1_intrawave_v3,816.23,350.66,0.0
gfx942,304,77824,5120,8704,ck,0,0,9070.4574,a8w8_blockscale_1x128x128_256x128x128x128_16x16_32x32_2x2_8x32x1_8x32x1_1x32x1x8_8_1x1_intrawave_v3,764.72,167.45,0.0
gfx942,304,77952,5120,3072,ck,0,0,2987.2464,a8w8_blockscale_1x128x128_256x128x128x128_16x16_32x32_2x2_8x32x1_8x32x1_1x32x1x8_8_1x1_intrawave_v3,820.88,352.64,0.0
gfx942,304,77952,5120,8704,ck,0,0,8895.6923,a8w8_blockscale_1x128x128_256x128x128x128_16x16_32x32_2x2_8x32x1_8x32x1_1x32x1x8_8_1x1_intrawave_v3,781.03,171.01,0.0
gfx942,304,78080,5120,3072,ck,0,0,2921.6967,a8w8_blockscale_1x128x128_256x128x128x128_16x16_32x32_2x2_8x32x1_8x32x1_1x32x1x8_8_1x1_intrawave_v3,840.67,361.14,0.0
gfx942,304,78080,5120,8704,ck,0,0,8902.2374,a8w8_blockscale_1x128x128_256x128x128x128_16x16_32x32_2x2_8x32x1_8x32x1_1x32x1x8_8_1x1_intrawave_v3,781.73,171.16,0.0
gfx942,304,78208,5120,3072,ck,0,0,2956.7347,a8w8_blockscale_1x128x128_256x128x128x128_16x16_32x32_2x2_8x32x1_8x32x1_1x32x1x8_8_1x1_intrawave_v3,832.07,357.43,0.0
gfx942,304,78208,5120,8704,ck,0,0,8856.7333,a8w8_blockscale_1x128x128_256x128x128x128_16x16_32x32_2x2_8x32x1_8x32x1_1x32x1x8_8_1x1_intrawave_v3,787.04,172.31,0.0
gfx942,304,78336,5120,3072,ck,0,0,2950.1382,a8w8_blockscale_1x128x128_256x128x128x128_16x16_32x32_2x2_8x32x1_8x32x1_1x32x1x8_8_1x1_intrawave_v3,835.3,358.81,0.0
gfx942,304,78336,5120,8704,ck,0,0,8855.5606,a8w8_blockscale_1x128x128_256x128x128x128_16x16_32x32_2x2_8x32x1_8x32x1_1x32x1x8_8_1x1_intrawave_v3,788.43,172.61,0.0
gfx942,304,78464,5120,3072,ck,0,0,2936.383,a8w8_blockscale_1x128x128_256x128x128x128_16x16_32x32_2x2_8x32x1_8x32x1_1x32x1x8_8_1x1_intrawave_v3,840.58,361.07,0.0
gfx942,304,78464,5120,8704,ck,0,0,8759.5819,a8w8_blockscale_1x128x128_256x128x128x128_16x16_32x32_2x2_8x32x1_8x32x1_1x32x1x8_8_1x1_intrawave_v3,798.37,174.78,0.0
gfx942,304,78592,5120,3072,ck,0,0,2936.1579,a8w8_blockscale_1x128x128_256x128x128x128_16x16_32x32_2x2_8x32x1_8x32x1_1x32x1x8_8_1x1_intrawave_v3,842.02,361.68,0.0
gfx942,304,78592,5120,8704,ck,0,0,9050.2031,a8w8_blockscale_1x128x128_256x128x128x128_16x16_32x32_2x2_8x32x1_8x32x1_1x32x1x8_8_1x1_intrawave_v3,774.0,169.43,0.0
gfx942,304,78720,5120,3072,ck,0,0,2940.6065,a8w8_blockscale_1x128x128_256x128x128x128_16x16_32x32_2x2_8x32x1_8x32x1_1x32x1x8_8_1x1_intrawave_v3,842.11,361.71,0.0
gfx942,304,78720,5120,8704,ck,0,0,8788.2856,a8w8_blockscale_1x128x128_256x128x128x128_16x16_32x32_2x2_8x32x1_8x32x1_1x32x1x8_8_1x1_intrawave_v3,798.36,174.76,0.0
gfx942,304,78848,5120,3072,ck,0,0,2980.8137,a8w8_blockscale_1x128x128_256x128x128x128_16x16_32x32_2x2_8x32x1_8x32x1_1x32x1x8_8_1x1_intrawave_v3,832.1,357.4,0.0
gfx942,304,78848,5120,8704,ck,0,0,8834.78,a8w8_blockscale_1x128x128_256x128x128x128_16x16_32x32_2x2_8x32x1_8x32x1_1x32x1x8_8_1x1_intrawave_v3,795.45,174.11,0.0
gfx942,304,78976,5120,3072,ck,0,0,2980.6174,a8w8_blockscale_1x128x128_256x128x128x128_16x16_32x32_2x2_8x32x1_8x32x1_1x32x1x8_8_1x1_intrawave_v3,833.51,358.0,0.0
gfx942,304,78976,5120,8704,ck,0,0,8923.7773,a8w8_blockscale_1x128x128_256x128x128x128_16x16_32x32_2x2_8x32x1_8x32x1_1x32x1x8_8_1x1_intrawave_v3,788.8,172.65,0.0
gfx942,304,79104,5120,3072,ck,0,0,2984.7663,a8w8_blockscale_1x128x128_256x128x128x128_16x16_32x32_2x2_8x32x1_8x32x1_1x32x1x8_8_1x1_intrawave_v3,833.7,358.07,0.0
gfx942,304,79104,5120,8704,ck,0,0,8954.4965,a8w8_blockscale_1x128x128_256x128x128x128_16x16_32x32_2x2_8x32x1_8x32x1_1x32x1x8_8_1x1_intrawave_v3,787.37,172.33,0.0
gfx942,304,79232,5120,3072,ck,0,0,2940.3227,a8w8_blockscale_1x128x128_256x128x128x128_16x16_32x32_2x2_8x32x1_8x32x1_1x32x1x8_8_1x1_intrawave_v3,847.67,364.06,0.0
gfx942,304,79232,5120,8704,ck,0,0,8843.7284,a8w8_blockscale_1x128x128_256x128x128x128_16x16_32x32_2x2_8x32x1_8x32x1_1x32x1x8_8_1x1_intrawave_v3,798.52,174.76,0.0
gfx942,304,79360,5120,3072,ck,0,0,3019.4356,a8w8_blockscale_1x128x128_256x128x128x128_16x16_32x32_2x2_8x32x1_8x32x1_1x32x1x8_8_1x1_intrawave_v3,826.79,355.09,0.0
gfx942,304,79360,5120,8704,ck,0,0,9043.1136,a8w8_blockscale_1x128x128_256x128x128x128_16x16_32x32_2x2_8x32x1_8x32x1_1x32x1x8_8_1x1_intrawave_v3,782.17,171.18,0.0
gfx942,304,79488,5120,3072,ck,0,0,2918.9334,a8w8_blockscale_1x128x128_256x128x128x128_16x16_32x32_2x2_8x32x1_8x32x1_1x32x1x8_8_1x1_intrawave_v3,856.64,367.9,0.0
gfx942,304,79488,5120,8704,ck,0,0,8873.5371,a8w8_blockscale_1x128x128_256x128x128x128_16x16_32x32_2x2_8x32x1_8x32x1_1x32x1x8_8_1x1_intrawave_v3,798.41,174.72,0.0
gfx942,304,79616,5120,3072,ck,0,0,2982.5964,a8w8_blockscale_1x128x128_256x128x128x128_16x16_32x32_2x2_8x32x1_8x32x1_1x32x1x8_8_1x1_intrawave_v3,839.71,360.62,0.0
gfx942,304,79616,5120,8704,ck,0,0,9026.3909,a8w8_blockscale_1x128x128_256x128x128x128_16x16_32x32_2x2_8x32x1_8x32x1_1x32x1x8_8_1x1_intrawave_v3,786.15,172.03,0.0
gfx942,304,79744,5120,3072,ck,0,0,2993.0923,a8w8_blockscale_1x128x128_256x128x128x128_16x16_32x32_2x2_8x32x1_8x32x1_1x32x1x8_8_1x1_intrawave_v3,838.11,359.92,0.0
gfx942,304,79744,5120,8704,ck,0,0,9083.1218,a8w8_blockscale_1x128x128_256x128x128x128_16x16_32x32_2x2_8x32x1_8x32x1_1x32x1x8_8_1x1_intrawave_v3,782.5,171.22,0.0
gfx942,304,79872,5120,3072,ck,0,0,2969.0734,a8w8_blockscale_1x128x128_256x128x128x128_16x16_32x32_2x2_8x32x1_8x32x1_1x32x1x8_8_1x1_intrawave_v3,846.24,363.41,0.0
gfx942,304,79872,5120,8704,ck,0,0,9121.7837,a8w8_blockscale_1x128x128_256x128x128x128_16x16_32x32_2x2_8x32x1_8x32x1_1x32x1x8_8_1x1_intrawave_v3,780.43,170.76,0.0
gfx942,304,80000,5120,3072,ck,0,0,3016.8609,a8w8_blockscale_1x128x128_256x128x128x128_16x16_32x32_2x2_8x32x1_8x32x1_1x32x1x8_8_1x1_intrawave_v3,834.17,358.22,0.0
gfx942,304,80000,5120,8704,ck,0,0,9044.5876,a8w8_blockscale_1x128x128_256x128x128x128_16x16_32x32_2x2_8x32x1_8x32x1_1x32x1x8_8_1x1_intrawave_v3,788.35,172.49,0.0
gfx942,304,16,7168,5120,ck,8,0,18.6428,a8w8_blockscale_1x128x128_256x16x64x256_16x16_16x16_1x1_16x16x1_16x16x1_1x16x1x16_4_1x1_intrawave_v1,63.0,1985.29,0.0
gfx942,304,32,7168,5120,ck,8,0,18.823,a8w8_blockscale_1x128x128_256x16x64x256_16x16_16x16_1x1_16x16x1_16x16x1_1x16x1x16_4_1x1_intrawave_v1,124.78,1982.83,0.0
gfx942,304,48,7168,5120,ck,18,0,24.2568,a8w8_blockscale_1x128x128_256x64x64x256_16x16_32x32_1x1_16x16x1_16x16x1_1x32x1x8_8_1x1_intrawave_v1,145.25,1551.48,0.0
gfx942,304,64,7168,5120,ck,18,0,23.5287,a8w8_blockscale_1x128x128_256x64x64x256_16x16_32x32_1x1_16x16x1_16x16x1_1x32x1x8_8_1x1_intrawave_v1,199.65,1612.73,0.0
gfx942,304,80,7168,5120,ck,18,0,30.89,a8w8_blockscale_1x128x128_256x64x64x256_16x16_32x32_1x1_16x16x1_16x16x1_1x32x1x8_8_1x1_intrawave_v1,190.09,1238.48,0.0
gfx942,304,96,7168,5120,ck,12,0,30.4261,a8w8_blockscale_1x128x128_256x32x128x256_16x16_32x32_1x1_16x16x1_16x16x1_1x32x1x8_8_1x1_intrawave_v1,231.59,1267.59,0.0
gfx942,304,112,7168,5120,ck,18,0,31.9535,a8w8_blockscale_1x128x128_256x64x64x256_16x16_32x32_1x1_16x16x1_16x16x1_1x32x1x8_8_1x1_intrawave_v1,257.27,1216.74,0.0
gfx942,304,128,7168,5120,ck,18,0,30.009,a8w8_blockscale_1x128x128_256x64x64x256_16x16_32x32_1x1_16x16x1_16x16x1_1x32x1x8_8_1x1_intrawave_v1,313.08,1305.96,0.0
gfx942,304,144,7168,5120,ck,12,0,40.2486,a8w8_blockscale_1x128x128_256x32x128x256_16x16_32x32_1x1_16x16x1_16x16x1_1x32x1x8_8_1x1_intrawave_v1,262.61,981.45,0.0
gfx942,304,160,7168,5120,ck,12,0,38.1303,a8w8_blockscale_1x128x128_256x32x128x256_16x16_32x32_1x1_16x16x1_16x16x1_1x32x1x8_8_1x1_intrawave_v1,308.0,1044.13,0.0
gfx942,304,176,7168,5120,ck,3,0,46.0907,a8w8_blockscale_1x128x128_256x64x64x128_16x16_32x32_1x1_8x32x1_8x32x1_1x32x1x8_8_1x1_intrawave_v3,280.28,870.55,0.0
gfx942,304,192,7168,5120,ck,3,0,45.9176,a8w8_blockscale_1x128x128_256x64x64x128_16x16_32x32_1x1_8x32x1_8x32x1_1x32x1x8_8_1x1_intrawave_v3,306.92,880.61,0.0
gfx942,304,208,7168,5120,ck,2,0,45.689,a8w8_blockscale_1x128x128_256x64x128x128_16x16_32x32_1x2_8x32x1_8x32x1_1x32x1x8_8_1x1_intrawave_v3,334.16,891.83,0.0
gfx942,304,224,7168,5120,ck,2,0,47.2457,a8w8_blockscale_1x128x128_256x64x128x128_16x16_32x32_1x2_8x32x1_8x32x1_1x32x1x8_8_1x1_intrawave_v3,348.0,869.04,0.0
gfx942,304,240,7168,5120,ck,2,0,49.1682,a8w8_blockscale_1x128x128_256x64x128x128_16x16_32x32_1x2_8x32x1_8x32x1_1x32x1x8_8_1x1_intrawave_v3,358.28,841.39,0.0
gfx942,304,256,7168,5120,ck,3,0,49.5474,a8w8_blockscale_1x128x128_256x64x64x128_16x16_32x32_1x1_8x32x1_8x32x1_1x32x1x8_8_1x1_intrawave_v3,379.24,841.23,0.0
gfx942,304,288,7168,5120,ck,2,0,51.4422,a8w8_blockscale_1x128x128_256x64x128x128_16x16_32x32_1x2_8x32x1_8x32x1_1x32x1x8_8_1x1_intrawave_v3,410.93,822.35,0.0
gfx942,304,320,7168,5120,ck,2,0,56.375,a8w8_blockscale_1x128x128_256x64x128x128_16x16_32x32_1x2_8x32x1_8x32x1_1x32x1x8_8_1x1_intrawave_v3,416.64,761.44,0.0
gfx942,304,352,7168,5120,ck,0,0,66.1411,a8w8_blockscale_1x128x128_256x128x128x128_16x16_32x32_2x2_8x32x1_8x32x1_1x32x1x8_8_1x1_intrawave_v3,390.63,658.42,0.0
gfx942,304,384,7168,5120,ck,2,0,68.529,a8w8_blockscale_1x128x128_256x64x128x128_16x16_32x32_1x2_8x32x1_8x32x1_1x32x1x8_8_1x1_intrawave_v3,411.3,644.56,0.0
gfx942,304,416,7168,5120,ck,0,0,62.8956,a8w8_blockscale_1x128x128_256x128x128x128_16x16_32x32_2x2_8x32x1_8x32x1_1x32x1x8_8_1x1_intrawave_v3,485.48,712.19,0.0
gfx942,304,448,7168,5120,ck,0,0,64.5594,a8w8_blockscale_1x128x128_256x128x128x128_16x16_32x32_2x2_8x32x1_8x32x1_1x32x1x8_8_1x1_intrawave_v3,509.35,703.48,0.0
gfx942,304,480,7168,5120,ck,0,0,70.0558,a8w8_blockscale_1x128x128_256x128x128x128_16x16_32x32_2x2_8x32x1_8x32x1_1x32x1x8_8_1x1_intrawave_v3,502.92,657.18,0.0
gfx942,304,512,7168,5120,ck,0,0,76.5064,a8w8_blockscale_1x128x128_256x128x128x128_16x16_32x32_2x2_8x32x1_8x32x1_1x32x1x8_8_1x1_intrawave_v3,491.21,609.9,0.0
gfx942,304,544,7168,5120,ck,0,0,72.0773,a8w8_blockscale_1x128x128_256x128x128x128_16x16_32x32_2x2_8x32x1_8x32x1_1x32x1x8_8_1x1_intrawave_v3,553.99,656.02,0.0
gfx942,304,576,7168,5120,ck,0,0,72.7918,a8w8_blockscale_1x128x128_256x128x128x128_16x16_32x32_2x2_8x32x1_8x32x1_1x32x1x8_8_1x1_intrawave_v3,580.82,658.13,0.0
gfx942,304,608,7168,5120,ck,0,0,73.8598,a8w8_blockscale_1x128x128_256x128x128x128_16x16_32x32_2x2_8x32x1_8x32x1_1x32x1x8_8_1x1_intrawave_v3,604.22,657.05,0.0
gfx942,304,640,7168,5120,ck,0,0,83.7056,a8w8_blockscale_1x128x128_256x128x128x128_16x16_32x32_2x2_8x32x1_8x32x1_1x32x1x8_8_1x1_intrawave_v3,561.21,587.2,0.0
gfx942,304,672,7168,5120,ck,0,0,100.6689,a8w8_blockscale_1x128x128_256x128x128x128_16x16_32x32_2x2_8x32x1_8x32x1_1x32x1x8_8_1x1_intrawave_v3,489.97,494.44,0.0
gfx942,304,704,7168,5120,ck,0,0,104.237,a8w8_blockscale_1x128x128_256x128x128x128_16x16_32x32_2x2_8x32x1_8x32x1_1x32x1x8_8_1x1_intrawave_v3,495.73,483.49,0.0
gfx942,304,736,7168,5120,ck,0,0,101.9459,a8w8_blockscale_1x128x128_256x128x128x128_16x16_32x32_2x2_8x32x1_8x32x1_1x32x1x8_8_1x1_intrawave_v3,529.91,500.46,0.0
gfx942,304,768,7168,5120,ck,0,0,104.6643,a8w8_blockscale_1x128x128_256x128x128x128_16x16_32x32_2x2_8x32x1_8x32x1_1x32x1x8_8_1x1_intrawave_v3,538.59,493.41,0.0
gfx942,304,800,7168,5120,ck,0,0,114.5108,a8w8_blockscale_1x128x128_256x128x128x128_16x16_32x32_2x2_8x32x1_8x32x1_1x32x1x8_8_1x1_intrawave_v3,512.79,456.42,0.0
gfx942,304,832,7168,5120,ck,0,0,114.1833,a8w8_blockscale_1x128x128_256x128x128x128_16x16_32x32_2x2_8x32x1_8x32x1_1x32x1x8_8_1x1_intrawave_v3,534.83,463.18,0.0
gfx942,304,864,7168,5120,ck,0,0,116.1123,a8w8_blockscale_1x128x128_256x128x128x128_16x16_32x32_2x2_8x32x1_8x32x1_1x32x1x8_8_1x1_intrawave_v3,546.18,460.85,0.0
gfx942,304,896,7168,5120,ck,0,0,114.0143,a8w8_blockscale_1x128x128_256x128x128x128_16x16_32x32_2x2_8x32x1_8x32x1_1x32x1x8_8_1x1_intrawave_v3,576.83,474.79,0.0
gfx942,304,928,7168,5120,ck,0,0,106.9822,a8w8_blockscale_1x128x128_256x128x128x128_16x16_32x32_2x2_8x32x1_8x32x1_1x32x1x8_8_1x1_intrawave_v3,636.7,511.82,0.0
gfx942,304,960,7168,5120,ck,0,0,111.8129,a8w8_blockscale_1x128x128_256x128x128x128_16x16_32x32_2x2_8x32x1_8x32x1_1x32x1x8_8_1x1_intrawave_v3,630.2,495.27,0.0
gfx942,304,992,7168,5120,ck,0,0,114.4296,a8w8_blockscale_1x128x128_256x128x128x128_16x16_32x32_2x2_8x32x1_8x32x1_1x32x1x8_8_1x1_intrawave_v3,636.31,489.39,0.0
gfx942,304,1024,7168,5120,ck,0,0,114.7268,a8w8_blockscale_1x128x128_256x128x128x128_16x16_32x32_2x2_8x32x1_8x32x1_1x32x1x8_8_1x1_intrawave_v3,655.14,493.55,0.0
gfx942,304,1088,7168,5120,ck,0,0,121.8799,a8w8_blockscale_1x128x128_256x128x128x128_16x16_32x32_2x2_8x32x1_8x32x1_1x32x1x8_8_1x1_intrawave_v3,655.23,474.8,0.0
gfx942,304,1152,7168,5120,ck,0,0,121.599,a8w8_blockscale_1x128x128_256x128x128x128_16x16_32x32_2x2_8x32x1_8x32x1_1x32x1x8_8_1x1_intrawave_v3,695.38,486.13,0.0
gfx942,304,1216,7168,5120,ck,0,0,127.0088,a8w8_blockscale_1x128x128_256x128x128x128_16x16_32x32_2x2_8x32x1_8x32x1_1x32x1x8_8_1x1_intrawave_v3,702.74,475.23,0.0
gfx942,304,1280,7168,5120,ck,0,0,131.9594,a8w8_blockscale_1x128x128_256x128x128x128_16x16_32x32_2x2_8x32x1_8x32x1_1x32x1x8_8_1x1_intrawave_v3,711.98,466.84,0.0
gfx942,304,1344,7168,5120,ck,2,0,162.0613,a8w8_blockscale_1x128x128_256x64x128x128_16x16_32x32_1x2_8x32x1_8x32x1_1x32x1x8_8_1x1_intrawave_v3,608.72,387.81,0.0
gfx942,304,1408,7168,5120,ck,2,0,184.6777,a8w8_blockscale_1x128x128_256x64x128x128_16x16_32x32_1x2_8x32x1_8x32x1_1x32x1x8_8_1x1_intrawave_v3,559.61,347.06,0.0
gfx942,304,1472,7168,5120,ck,0,0,170.9742,a8w8_blockscale_1x128x128_256x128x128x128_16x16_32x32_2x2_8x32x1_8x32x1_1x32x1x8_8_1x1_intrawave_v3,631.94,382.16,0.0
gfx942,304,1536,7168,5120,ck,0,0,174.2807,a8w8_blockscale_1x128x128_256x128x128x128_16x16_32x32_2x2_8x32x1_8x32x1_1x32x1x8_8_1x1_intrawave_v3,646.9,382.05,0.0
gfx942,304,1600,7168,5120,ck,0,0,174.4825,a8w8_blockscale_1x128x128_256x128x128x128_16x16_32x32_2x2_8x32x1_8x32x1_1x32x1x8_8_1x1_intrawave_v3,673.08,388.75,0.0
gfx942,304,1664,7168,5120,ck,0,0,173.9971,a8w8_blockscale_1x128x128_256x128x128x128_16x16_32x32_2x2_8x32x1_8x32x1_1x32x1x8_8_1x1_intrawave_v3,701.95,396.99,0.0
gfx942,304,1728,7168,5120,ck,0,0,176.6484,a8w8_blockscale_1x128x128_256x128x128x128_16x16_32x32_2x2_8x32x1_8x32x1_1x32x1x8_8_1x1_intrawave_v3,718.01,398.08,0.0
gfx942,304,1792,7168,5120,ck,0,0,183.0068,a8w8_blockscale_1x128x128_256x128x128x128_16x16_32x32_2x2_8x32x1_8x32x1_1x32x1x8_8_1x1_intrawave_v3,718.73,391.05,0.0
gfx942,304,1856,7168,5120,ck,0,0,198.505,a8w8_blockscale_1x128x128_256x128x128x128_16x16_32x32_2x2_8x32x1_8x32x1_1x32x1x8_8_1x1_intrawave_v3,686.28,366.79,0.0
gfx942,304,1920,7168,5120,ck,0,0,183.562,a8w8_blockscale_1x128x128_256x128x128x128_16x16_32x32_2x2_8x32x1_8x32x1_1x32x1x8_8_1x1_intrawave_v3,767.74,403.44,0.0
gfx942,304,1984,7168,5120,ck,0,0,203.39,a8w8_blockscale_1x128x128_256x128x128x128_16x16_32x32_2x2_8x32x1_8x32x1_1x32x1x8_8_1x1_intrawave_v3,716.0,370.23,0.0
gfx942,304,2048,7168,5120,ck,0,0,194.7624,a8w8_blockscale_1x128x128_256x128x128x128_16x16_32x32_2x2_8x32x1_8x32x1_1x32x1x8_8_1x1_intrawave_v3,771.83,393.02,0.0
gfx942,304,2112,7168,5120,ck,0,0,223.8245,a8w8_blockscale_1x128x128_256x128x128x128_16x16_32x32_2x2_8x32x1_8x32x1_1x32x1x8_8_1x1_intrawave_v3,692.6,347.55,0.0
gfx942,304,2176,7168,5120,ck,0,0,235.4066,a8w8_blockscale_1x128x128_256x128x128x128_16x16_32x32_2x2_8x32x1_8x32x1_1x32x1x8_8_1x1_intrawave_v3,678.48,335.74,0.0
gfx942,304,2240,7168,5120,ck,0,0,224.472,a8w8_blockscale_1x128x128_256x128x128x128_16x16_32x32_2x2_8x32x1_8x32x1_1x32x1x8_8_1x1_intrawave_v3,732.46,357.65,0.0
gfx942,304,2304,7168,5120,ck,0,0,229.2755,a8w8_blockscale_1x128x128_256x128x128x128_16x16_32x32_2x2_8x32x1_8x32x1_1x32x1x8_8_1x1_intrawave_v3,737.6,355.58,0.0
gfx942,304,2368,7168,5120,ck,0,0,235.6651,a8w8_blockscale_1x128x128_256x128x128x128_16x16_32x32_2x2_8x32x1_8x32x1_1x32x1x8_8_1x1_intrawave_v3,737.54,351.23,0.0
gfx942,304,2432,7168,5120,ck,0,0,237.0866,a8w8_blockscale_1x128x128_256x128x128x128_16x16_32x32_2x2_8x32x1_8x32x1_1x32x1x8_8_1x1_intrawave_v3,752.93,354.37,0.0
gfx942,304,2496,7168,5120,ck,0,0,240.8273,a8w8_blockscale_1x128x128_256x128x128x128_16x16_32x32_2x2_8x32x1_8x32x1_1x32x1x8_8_1x1_intrawave_v3,760.74,354.04,0.0
gfx942,304,2560,7168,5120,ck,0,0,239.2439,a8w8_blockscale_1x128x128_256x128x128x128_16x16_32x32_2x2_8x32x1_8x32x1_1x32x1x8_8_1x1_intrawave_v3,785.41,361.59,0.0
gfx942,304,2624,7168,5120,ck,0,0,246.4444,a8w8_blockscale_1x128x128_256x128x128x128_16x16_32x32_2x2_8x32x1_8x32x1_1x32x1x8_8_1x1_intrawave_v3,781.52,356.08,0.0
gfx942,304,2688,7168,5120,ck,0,0,254.2206,a8w8_blockscale_1x128x128_256x128x128x128_16x16_32x32_2x2_8x32x1_8x32x1_1x32x1x8_8_1x1_intrawave_v3,776.1,350.08,0.0
gfx942,304,2752,7168,5120,ck,0,0,282.8447,a8w8_blockscale_1x128x128_256x128x128x128_16x16_32x32_2x2_8x32x1_8x32x1_1x32x1x8_8_1x1_intrawave_v3,714.16,319.06,0.0
gfx942,304,2816,7168,5120,ck,0,0,285.4303,a8w8_blockscale_1x128x128_256x128x128x128_16x16_32x32_2x2_8x32x1_8x32x1_1x32x1x8_8_1x1_intrawave_v3,724.15,320.53,0.0
gfx942,304,2880,7168,5120,ck,0,0,279.9705,a8w8_blockscale_1x128x128_256x128x128x128_16x16_32x32_2x2_8x32x1_8x32x1_1x32x1x8_8_1x1_intrawave_v3,755.05,331.23,0.0
gfx942,304,2944,7168,5120,ck,0,0,285.9037,a8w8_blockscale_1x128x128_256x128x128x128_16x16_32x32_2x2_8x32x1_8x32x1_1x32x1x8_8_1x1_intrawave_v3,755.82,328.71,0.0
gfx942,304,3008,7168,5120,ck,0,0,285.9749,a8w8_blockscale_1x128x128_256x128x128x128_16x16_32x32_2x2_8x32x1_8x32x1_1x32x1x8_8_1x1_intrawave_v3,772.05,332.98,0.0
gfx942,304,3072,7168,5120,ck,0,0,291.7499,a8w8_blockscale_1x128x128_256x128x128x128_16x16_32x32_2x2_8x32x1_8x32x1_1x32x1x8_8_1x1_intrawave_v3,772.87,330.66,0.0
gfx942,304,3136,7168,5120,ck,0,0,296.3164,a8w8_blockscale_1x128x128_256x128x128x128_16x16_32x32_2x2_8x32x1_8x32x1_1x32x1x8_8_1x1_intrawave_v3,776.82,329.76,0.0
gfx942,304,3200,7168,5120,ck,0,0,300.429,a8w8_blockscale_1x128x128_256x128x128x128_16x16_32x32_2x2_8x32x1_8x32x1_1x32x1x8_8_1x1_intrawave_v3,781.82,329.39,0.0
gfx942,304,3264,7168,5120,ck,0,0,301.7681,a8w8_blockscale_1x128x128_256x128x128x128_16x16_32x32_2x2_8x32x1_8x32x1_1x32x1x8_8_1x1_intrawave_v3,793.92,332.06,0.0
gfx942,304,3328,7168,5120,ck,0,0,309.1553,a8w8_blockscale_1x128x128_256x128x128x128_16x16_32x32_2x2_8x32x1_8x32x1_1x32x1x8_8_1x1_intrawave_v3,790.14,328.15,0.0
gfx942,304,3392,7168,5120,ck,0,0,318.566,a8w8_blockscale_1x128x128_256x128x128x128_16x16_32x32_2x2_8x32x1_8x32x1_1x32x1x8_8_1x1_intrawave_v3,781.55,322.37,0.0
gfx942,304,3456,7168,5120,ck,0,0,316.5363,a8w8_blockscale_1x128x128_256x128x128x128_16x16_32x32_2x2_8x32x1_8x32x1_1x32x1x8_8_1x1_intrawave_v3,801.4,328.37,0.0
gfx942,304,3520,7168,5120,ck,0,0,330.8665,a8w8_blockscale_1x128x128_256x128x128x128_16x16_32x32_2x2_8x32x1_8x32x1_1x32x1x8_8_1x1_intrawave_v3,780.89,317.91,0.0
gfx942,304,3584,7168,5120,ck,0,0,340.5403,a8w8_blockscale_1x128x128_256x128x128x128_16x16_32x32_2x2_8x32x1_8x32x1_1x32x1x8_8_1x1_intrawave_v3,772.5,312.53,0.0
gfx942,304,3648,7168,5120,ck,0,0,341.649,a8w8_blockscale_1x128x128_256x128x128x128_16x16_32x32_2x2_8x32x1_8x32x1_1x32x1x8_8_1x1_intrawave_v3,783.74,315.16,0.0
gfx942,304,3712,7168,5120,ck,0,0,353.6716,a8w8_blockscale_1x128x128_256x128x128x128_16x16_32x32_2x2_8x32x1_8x32x1_1x32x1x8_8_1x1_intrawave_v3,770.38,307.97,0.0
gfx942,304,3776,7168,5120,ck,0,0,349.5061,a8w8_blockscale_1x128x128_256x128x128x128_16x16_32x32_2x2_8x32x1_8x32x1_1x32x1x8_8_1x1_intrawave_v3,793.0,315.2,0.0
gfx942,304,3840,7168,5120,ck,0,0,352.4521,a8w8_blockscale_1x128x128_256x128x128x128_16x16_32x32_2x2_8x32x1_8x32x1_1x32x1x8_8_1x1_intrawave_v3,799.7,316.1,0.0
gfx942,304,3904,7168,5120,ck,0,0,357.9714,a8w8_blockscale_1x128x128_256x128x128x128_16x16_32x32_2x2_8x32x1_8x32x1_1x32x1x8_8_1x1_intrawave_v3,800.5,314.71,0.0
gfx942,304,3968,7168,5120,ck,0,0,361.4239,a8w8_blockscale_1x128x128_256x128x128x128_16x16_32x32_2x2_8x32x1_8x32x1_1x32x1x8_8_1x1_intrawave_v3,805.85,315.15,0.0
gfx942,304,4032,7168,5120,ck,0,0,362.2955,a8w8_blockscale_1x128x128_256x128x128x128_16x16_32x32_2x2_8x32x1_8x32x1_1x32x1x8_8_1x1_intrawave_v3,816.87,317.83,0.0
gfx942,304,4096,7168,5120,ck,0,0,355.1806,a8w8_blockscale_1x128x128_256x128x128x128_16x16_32x32_2x2_8x32x1_8x32x1_1x32x1x8_8_1x1_intrawave_v3,846.46,327.7,0.0
gfx942,304,4224,7168,5120,ck,0,0,403.8919,a8w8_blockscale_1x128x128_256x128x128x128_16x16_32x32_2x2_8x32x1_8x32x1_1x32x1x8_8_1x1_intrawave_v3,767.64,294.34,0.0
gfx942,304,4352,7168,5120,ck,0,0,403.9213,a8w8_blockscale_1x128x128_256x128x128x128_16x16_32x32_2x2_8x32x1_8x32x1_1x32x1x8_8_1x1_intrawave_v3,790.84,300.49,0.0
gfx942,304,4480,7168,5120,ck,0,0,410.3982,a8w8_blockscale_1x128x128_256x128x128x128_16x16_32x32_2x2_8x32x1_8x32x1_1x32x1x8_8_1x1_intrawave_v3,801.25,301.81,0.0
gfx942,304,4608,7168,5120,ck,0,0,411.4958,a8w8_blockscale_1x128x128_256x128x128x128_16x16_32x32_2x2_8x32x1_8x32x1_1x32x1x8_8_1x1_intrawave_v3,821.95,307.06,0.0
gfx942,304,4736,7168,5120,ck,0,0,434.961,a8w8_blockscale_1x128x128_256x128x128x128_16x16_32x32_2x2_8x32x1_8x32x1_1x32x1x8_8_1x1_intrawave_v3,799.21,296.22,0.0
gfx942,304,4864,7168,5120,ck,0,0,450.6983,a8w8_blockscale_1x128x128_256x128x128x128_16x16_32x32_2x2_8x32x1_8x32x1_1x32x1x8_8_1x1_intrawave_v3,792.15,291.4,0.0
gfx942,304,4992,7168,5120,ck,0,0,455.641,a8w8_blockscale_1x128x128_256x128x128x128_16x16_32x32_2x2_8x32x1_8x32x1_1x32x1x8_8_1x1_intrawave_v3,804.17,293.71,0.0
gfx942,304,5120,7168,5120,ck,0,0,462.3006,a8w8_blockscale_1x128x128_256x128x128x128_16x16_32x32_2x2_8x32x1_8x32x1_1x32x1x8_8_1x1_intrawave_v3,812.91,294.86,0.0
gfx942,304,5248,7168,5120,ck,0,0,474.6352,a8w8_blockscale_1x128x128_256x128x128x128_16x16_32x32_2x2_8x32x1_8x32x1_1x32x1x8_8_1x1_intrawave_v3,811.58,292.45,0.0
gfx942,304,5376,7168,5120,ck,0,0,484.8867,a8w8_blockscale_1x128x128_256x128x128x128_16x16_32x32_2x2_8x32x1_8x32x1_1x32x1x8_8_1x1_intrawave_v3,813.8,291.4,0.0
gfx942,304,5504,7168,5120,ck,0,0,499.507,a8w8_blockscale_1x128x128_256x128x128x128_16x16_32x32_2x2_8x32x1_8x32x1_1x32x1x8_8_1x1_intrawave_v3,808.79,287.86,0.0
gfx942,304,5632,7168,5120,ck,0,0,514.8536,a8w8_blockscale_1x128x128_256x128x128x128_16x16_32x32_2x2_8x32x1_8x32x1_1x32x1x8_8_1x1_intrawave_v3,802.93,284.11,0.0
gfx942,304,5760,7168,5120,ck,0,0,525.6181,a8w8_blockscale_1x128x128_256x128x128x128_16x16_32x32_2x2_8x32x1_8x32x1_1x32x1x8_8_1x1_intrawave_v3,804.36,283.03,0.0
gfx942,304,5888,7168,5120,ck,0,0,528.9686,a8w8_blockscale_1x128x128_256x128x128x128_16x16_32x32_2x2_8x32x1_8x32x1_1x32x1x8_8_1x1_intrawave_v3,817.03,285.95,0.0
gfx942,304,6016,7168,5120,ck,0,0,545.6316,a8w8_blockscale_1x128x128_256x128x128x128_16x16_32x32_2x2_8x32x1_8x32x1_1x32x1x8_8_1x1_intrawave_v3,809.29,281.78,0.0
gfx942,304,6144,7168,5120,ck,0,0,550.4808,a8w8_blockscale_1x128x128_256x128x128x128_16x16_32x32_2x2_8x32x1_8x32x1_1x32x1x8_8_1x1_intrawave_v3,819.23,283.82,0.0
gfx942,304,6272,7168,5120,ck,0,0,578.2151,a8w8_blockscale_1x128x128_256x128x128x128_16x16_32x32_2x2_8x32x1_8x32x1_1x32x1x8_8_1x1_intrawave_v3,796.19,274.51,0.0
gfx942,304,6400,7168,5120,ck,0,0,583.1962,a8w8_blockscale_1x128x128_256x128x128x128_16x16_32x32_2x2_8x32x1_8x32x1_1x32x1x8_8_1x1_intrawave_v3,805.5,276.44,0.0
gfx942,304,6528,7168,5120,ck,0,0,589.2725,a8w8_blockscale_1x128x128_256x128x128x128_16x16_32x32_2x2_8x32x1_8x32x1_1x32x1x8_8_1x1_intrawave_v3,813.13,277.82,0.0
gfx942,304,6656,7168,5120,ck,0,0,598.2732,a8w8_blockscale_1x128x128_256x128x128x128_16x16_32x32_2x2_8x32x1_8x32x1_1x32x1x8_8_1x1_intrawave_v3,816.6,277.8,0.0
gfx942,304,6784,7168,5120,ck,0,0,615.4561,a8w8_blockscale_1x128x128_256x128x128x128_16x16_32x32_2x2_8x32x1_8x32x1_1x32x1x8_8_1x1_intrawave_v3,809.07,274.09,0.0
gfx942,304,6912,7168,5120,ck,0,0,628.8545,a8w8_blockscale_1x128x128_256x128x128x128_16x16_32x32_2x2_8x32x1_8x32x1_1x32x1x8_8_1x1_intrawave_v3,806.77,272.21,0.0
gfx942,304,7040,7168,5120,ck,0,0,631.6936,a8w8_blockscale_1x128x128_256x128x128x128_16x16_32x32_2x2_8x32x1_8x32x1_1x32x1x8_8_1x1_intrawave_v3,818.02,274.93,0.0
gfx942,304,7168,7168,5120,ck,0,0,639.9323,a8w8_blockscale_1x128x128_256x128x128x128_16x16_32x32_2x2_8x32x1_8x32x1_1x32x1x8_8_1x1_intrawave_v3,822.17,275.28,0.0
gfx942,304,7296,7168,5120,ck,0,0,660.5001,a8w8_blockscale_1x128x128_256x128x128x128_16x16_32x32_2x2_8x32x1_8x32x1_1x32x1x8_8_1x1_intrawave_v3,810.79,270.48,0.0
gfx942,304,7424,7168,5120,ck,0,0,661.9724,a8w8_blockscale_1x128x128_256x128x128x128_16x16_32x32_2x2_8x32x1_8x32x1_1x32x1x8_8_1x1_intrawave_v3,823.18,273.64,0.0
gfx942,304,7552,7168,5120,ck,0,0,686.9652,a8w8_blockscale_1x128x128_256x128x128x128_16x16_32x32_2x2_8x32x1_8x32x1_1x32x1x8_8_1x1_intrawave_v3,806.91,267.31,0.0
gfx942,304,7680,7168,5120,ck,0,0,689.3616,a8w8_blockscale_1x128x128_256x128x128x128_16x16_32x32_2x2_8x32x1_8x32x1_1x32x1x8_8_1x1_intrawave_v3,817.73,269.99,0.0
gfx942,304,7808,7168,5120,ck,0,0,707.335,a8w8_blockscale_1x128x128_256x128x128x128_16x16_32x32_2x2_8x32x1_8x32x1_1x32x1x8_8_1x1_intrawave_v3,810.24,266.65,0.0
gfx942,304,7936,7168,5120,ck,0,0,705.352,a8w8_blockscale_1x128x128_256x128x128x128_16x16_32x32_2x2_8x32x1_8x32x1_1x32x1x8_8_1x1_intrawave_v3,825.84,270.93,0.0
gfx942,304,8064,7168,5120,ck,0,0,719.5761,a8w8_blockscale_1x128x128_256x128x128x128_16x16_32x32_2x2_8x32x1_8x32x1_1x32x1x8_8_1x1_intrawave_v3,822.57,269.04,0.0
gfx942,304,8192,7168,5120,ck,0,0,720.7378,a8w8_blockscale_1x128x128_256x128x128x128_16x16_32x32_2x2_8x32x1_8x32x1_1x32x1x8_8_1x1_intrawave_v3,834.28,272.06,0.0
gfx942,304,8320,7168,5120,ck,0,0,762.1052,a8w8_blockscale_1x128x128_256x128x128x128_16x16_32x32_2x2_8x32x1_8x32x1_1x32x1x8_8_1x1_intrawave_v3,801.32,260.56,0.0
gfx942,304,8448,7168,5120,ck,0,0,758.3531,a8w8_blockscale_1x128x128_256x128x128x128_16x16_32x32_2x2_8x32x1_8x32x1_1x32x1x8_8_1x1_intrawave_v3,817.67,265.13,0.0
gfx942,304,8576,7168,5120,ck,0,0,766.4769,a8w8_blockscale_1x128x128_256x128x128x128_16x16_32x32_2x2_8x32x1_8x32x1_1x32x1x8_8_1x1_intrawave_v3,821.27,265.57,0.0
gfx942,304,8704,7168,5120,ck,0,0,768.6719,a8w8_blockscale_1x128x128_256x128x128x128_16x16_32x32_2x2_8x32x1_8x32x1_1x32x1x8_8_1x1_intrawave_v3,831.14,268.05,0.0
gfx942,304,8832,7168,5120,ck,0,0,787.0603,a8w8_blockscale_1x128x128_256x128x128x128_16x16_32x32_2x2_8x32x1_8x32x1_1x32x1x8_8_1x1_intrawave_v3,823.66,264.95,0.0
gfx942,304,8960,7168,5120,ck,0,0,804.4983,a8w8_blockscale_1x128x128_256x128x128x128_16x16_32x32_2x2_8x32x1_8x32x1_1x32x1x8_8_1x1_intrawave_v3,817.49,262.31,0.0
gfx942,304,9088,7168,5120,ck,0,0,808.7928,a8w8_blockscale_1x128x128_256x128x128x128_16x16_32x32_2x2_8x32x1_8x32x1_1x32x1x8_8_1x1_intrawave_v3,824.76,263.99,0.0
gfx942,304,9216,7168,5120,ck,0,0,819.3607,a8w8_blockscale_1x128x128_256x128x128x128_16x16_32x32_2x2_8x32x1_8x32x1_1x32x1x8_8_1x1_intrawave_v3,825.59,263.63,0.0
gfx942,304,9344,7168,5120,ck,0,0,835.5013,a8w8_blockscale_1x128x128_256x128x128x128_16x16_32x32_2x2_8x32x1_8x32x1_1x32x1x8_8_1x1_intrawave_v3,820.89,261.52,0.0
gfx942,304,9472,7168,5120,ck,0,0,843.4222,a8w8_blockscale_1x128x128_256x128x128x128_16x16_32x32_2x2_8x32x1_8x32x1_1x32x1x8_8_1x1_intrawave_v3,824.32,262.01,0.0
gfx942,304,9600,7168,5120,ck,0,0,860.0987,a8w8_blockscale_1x128x128_256x128x128x128_16x16_32x32_2x2_8x32x1_8x32x1_1x32x1x8_8_1x1_intrawave_v3,819.26,259.83,0.0
gfx942,304,9728,7168,5120,ck,0,0,860.4094,a8w8_blockscale_1x128x128_256x128x128x128_16x16_32x32_2x2_8x32x1_8x32x1_1x32x1x8_8_1x1_intrawave_v3,829.88,262.63,0.0
gfx942,304,9856,7168,5120,ck,0,0,877.336,a8w8_blockscale_1x128x128_256x128x128x128_16x16_32x32_2x2_8x32x1_8x32x1_1x32x1x8_8_1x1_intrawave_v3,824.58,260.4,0.0
gfx942,304,9984,7168,5120,ck,0,0,882.4367,a8w8_blockscale_1x128x128_256x128x128x128_16x16_32x32_2x2_8x32x1_8x32x1_1x32x1x8_8_1x1_intrawave_v3,830.46,261.72,0.0
gfx942,304,10112,7168,5120,ck,0,0,892.9379,a8w8_blockscale_1x128x128_256x128x128x128_16x16_32x32_2x2_8x32x1_8x32x1_1x32x1x8_8_1x1_intrawave_v3,831.22,261.43,0.0
gfx942,304,10240,7168,5120,ck,0,0,906.4503,a8w8_blockscale_1x128x128_256x128x128x128_16x16_32x32_2x2_8x32x1_8x32x1_1x32x1x8_8_1x1_intrawave_v3,829.19,260.28,0.0
gfx942,304,10368,7168,5120,ck,0,0,932.5341,a8w8_blockscale_1x128x128_256x128x128x128_16x16_32x32_2x2_8x32x1_8x32x1_1x32x1x8_8_1x1_intrawave_v3,816.07,255.67,0.0
gfx942,304,10496,7168,5120,ck,0,0,929.5473,a8w8_blockscale_1x128x128_256x128x128x128_16x16_32x32_2x2_8x32x1_8x32x1_1x32x1x8_8_1x1_intrawave_v3,828.8,259.17,0.0
gfx942,304,10624,7168,5120,ck,0,0,947.0244,a8w8_blockscale_1x128x128_256x128x128x128_16x16_32x32_2x2_8x32x1_8x32x1_1x32x1x8_8_1x1_intrawave_v3,823.43,257.02,0.0
gfx942,304,10752,7168,5120,ck,0,0,950.5226,a8w8_blockscale_1x128x128_256x128x128x128_16x16_32x32_2x2_8x32x1_8x32x1_1x32x1x8_8_1x1_intrawave_v3,830.28,258.69,0.0
gfx942,304,10880,7168,5120,ck,0,0,967.2426,a8w8_blockscale_1x128x128_256x128x128x128_16x16_32x32_2x2_8x32x1_8x32x1_1x32x1x8_8_1x1_intrawave_v3,825.64,256.79,0.0
gfx942,304,11008,7168,5120,ck,0,0,980.0748,a8w8_blockscale_1x128x128_256x128x128x128_16x16_32x32_2x2_8x32x1_8x32x1_1x32x1x8_8_1x1_intrawave_v3,824.42,255.97,0.0
gfx942,304,11136,7168,5120,ck,0,0,983.2383,a8w8_blockscale_1x128x128_256x128x128x128_16x16_32x32_2x2_8x32x1_8x32x1_1x32x1x8_8_1x1_intrawave_v3,831.32,257.68,0.0
gfx942,304,11264,7168,5120,ck,0,0,988.347,a8w8_blockscale_1x128x128_256x128x128x128_16x16_32x32_2x2_8x32x1_8x32x1_1x32x1x8_8_1x1_intrawave_v3,836.53,258.87,0.0
gfx942,304,11392,7168,5120,ck,0,0,996.4105,a8w8_blockscale_1x128x128_256x128x128x128_16x16_32x32_2x2_8x32x1_8x32x1_1x32x1x8_8_1x1_intrawave_v3,839.19,259.27,0.0
gfx942,304,11520,7168,5120,ck,0,0,1017.8861,a8w8_blockscale_1x128x128_256x128x128x128_16x16_32x32_2x2_8x32x1_8x32x1_1x32x1x8_8_1x1_intrawave_v3,830.71,256.25,0.0
gfx942,304,11648,7168,5120,ck,0,0,1032.0938,a8w8_blockscale_1x128x128_256x128x128x128_16x16_32x32_2x2_8x32x1_8x32x1_1x32x1x8_8_1x1_intrawave_v3,828.38,255.14,0.0
gfx942,304,11776,7168,5120,ck,0,0,1034.1224,a8w8_blockscale_1x128x128_256x128x128x128_16x16_32x32_2x2_8x32x1_8x32x1_1x32x1x8_8_1x1_intrawave_v3,835.84,257.04,0.0
gfx942,304,11904,7168,5120,ck,0,0,1046.9412,a8w8_blockscale_1x128x128_256x128x128x128_16x16_32x32_2x2_8x32x1_8x32x1_1x32x1x8_8_1x1_intrawave_v3,834.58,256.27,0.0
gfx942,304,12032,7168,5120,ck,0,0,1060.1721,a8w8_blockscale_1x128x128_256x128x128x128_16x16_32x32_2x2_8x32x1_8x32x1_1x32x1x8_8_1x1_intrawave_v3,833.03,255.43,0.0
gfx942,304,12160,7168,5120,ck,0,0,1072.3125,a8w8_blockscale_1x128x128_256x128x128x128_16x16_32x32_2x2_8x32x1_8x32x1_1x32x1x8_8_1x1_intrawave_v3,832.36,254.86,0.0
gfx942,304,12288,7168,5120,ck,0,0,1086.8334,a8w8_blockscale_1x128x128_256x128x128x128_16x16_32x32_2x2_8x32x1_8x32x1_1x32x1x8_8_1x1_intrawave_v3,829.88,253.74,0.0
gfx942,304,12416,7168,5120,ck,0,0,1120.943,a8w8_blockscale_1x128x128_256x128x128x128_16x16_32x32_2x2_8x32x1_8x32x1_1x32x1x8_8_1x1_intrawave_v3,813.01,248.24,0.0
gfx942,304,12544,7168,5120,ck,0,0,1127.3085,a8w8_blockscale_1x128x128_256x128x128x128_16x16_32x32_2x2_8x32x1_8x32x1_1x32x1x8_8_1x1_intrawave_v3,816.75,249.05,0.0
gfx942,304,12672,7168,5120,ck,0,0,1130.4169,a8w8_blockscale_1x128x128_256x128x128x128_16x16_32x32_2x2_8x32x1_8x32x1_1x32x1x8_8_1x1_intrawave_v3,822.82,250.57,0.0
gfx942,304,12800,7168,5120,ck,0,0,1132.0486,a8w8_blockscale_1x128x128_256x128x128x128_16x16_32x32_2x2_8x32x1_8x32x1_1x32x1x8_8_1x1_intrawave_v3,829.93,252.41,0.0
gfx942,304,12928,7168,5120,ck,0,0,1137.6569,a8w8_blockscale_1x128x128_256x128x128x128_16x16_32x32_2x2_8x32x1_8x32x1_1x32x1x8_8_1x1_intrawave_v3,834.1,253.35,0.0
gfx942,304,13056,7168,5120,ck,0,0,1131.9362,a8w8_blockscale_1x128x128_256x128x128x128_16x16_32x32_2x2_8x32x1_8x32x1_1x32x1x8_8_1x1_intrawave_v3,846.62,256.83,0.0
gfx942,304,13184,7168,5120,ck,0,0,1158.9513,a8w8_blockscale_1x128x128_256x128x128x128_16x16_32x32_2x2_8x32x1_8x32x1_1x32x1x8_8_1x1_intrawave_v3,834.99,252.99,0.0
gfx942,304,13312,7168,5120,ck,0,0,1158.3607,a8w8_blockscale_1x128x128_256x128x128x128_16x16_32x32_2x2_8x32x1_8x32x1_1x32x1x8_8_1x1_intrawave_v3,843.52,255.27,0.0
gfx942,304,13440,7168,5120,ck,0,0,1173.8724,a8w8_blockscale_1x128x128_256x128x128x128_16x16_32x32_2x2_8x32x1_8x32x1_1x32x1x8_8_1x1_intrawave_v3,840.38,254.02,0.0
gfx942,304,13568,7168,5120,ck,0,0,1204.4711,a8w8_blockscale_1x128x128_256x128x128x128_16x16_32x32_2x2_8x32x1_8x32x1_1x32x1x8_8_1x1_intrawave_v3,826.83,249.64,0.0
gfx942,304,13696,7168,5120,ck,0,0,1225.2065,a8w8_blockscale_1x128x128_256x128x128x128_16x16_32x32_2x2_8x32x1_8x32x1_1x32x1x8_8_1x1_intrawave_v3,820.51,247.44,0.0
gfx942,304,13824,7168,5120,ck,0,0,1214.084,a8w8_blockscale_1x128x128_256x128x128x128_16x16_32x32_2x2_8x32x1_8x32x1_1x32x1x8_8_1x1_intrawave_v3,835.76,251.76,0.0
gfx942,304,13952,7168,5120,ck,0,0,1246.2908,a8w8_blockscale_1x128x128_256x128x128x128_16x16_32x32_2x2_8x32x1_8x32x1_1x32x1x8_8_1x1_intrawave_v3,821.7,247.25,0.0
gfx942,304,14080,7168,5120,ck,0,0,1247.3592,a8w8_blockscale_1x128x128_256x128x128x128_16x16_32x32_2x2_8x32x1_8x32x1_1x32x1x8_8_1x1_intrawave_v3,828.53,249.04,0.0
gfx942,304,14208,7168,5120,ck,0,0,1252.0225,a8w8_blockscale_1x128x128_256x128x128x128_16x16_32x32_2x2_8x32x1_8x32x1_1x32x1x8_8_1x1_intrawave_v3,832.95,250.1,0.0
gfx942,304,14336,7168,5120,ck,0,0,1271.482,a8w8_blockscale_1x128x128_256x128x128x128_16x16_32x32_2x2_8x32x1_8x32x1_1x32x1x8_8_1x1_intrawave_v3,827.59,248.23,0.0
gfx942,304,14464,7168,5120,ck,0,0,1273.0396,a8w8_blockscale_1x128x128_256x128x128x128_16x16_32x32_2x2_8x32x1_8x32x1_1x32x1x8_8_1x1_intrawave_v3,833.96,249.88,0.0
gfx942,304,14592,7168,5120,ck,0,0,1270.947,a8w8_blockscale_1x128x128_256x128x128x128_16x16_32x32_2x2_8x32x1_8x32x1_1x32x1x8_8_1x1_intrawave_v3,842.72,252.25,0.0
gfx942,304,14720,7168,5120,ck,0,0,1283.7504,a8w8_blockscale_1x128x128_256x128x128x128_16x16_32x32_2x2_8x32x1_8x32x1_1x32x1x8_8_1x1_intrawave_v3,841.64,251.68,0.0
gfx942,304,14848,7168,5120,ck,0,0,1302.1213,a8w8_blockscale_1x128x128_256x128x128x128_16x16_32x32_2x2_8x32x1_8x32x1_1x32x1x8_8_1x1_intrawave_v3,836.98,250.04,0.0
gfx942,304,14976,7168,5120,ck,0,0,1311.9736,a8w8_blockscale_1x128x128_256x128x128x128_16x16_32x32_2x2_8x32x1_8x32x1_1x32x1x8_8_1x1_intrawave_v3,837.85,250.06,0.0
gfx942,304,15104,7168,5120,ck,0,0,1334.9351,a8w8_blockscale_1x128x128_256x128x128x128_16x16_32x32_2x2_8x32x1_8x32x1_1x32x1x8_8_1x1_intrawave_v3,830.48,247.63,0.0
gfx942,304,15232,7168,5120,ck,0,0,1348.3595,a8w8_blockscale_1x128x128_256x128x128x128_16x16_32x32_2x2_8x32x1_8x32x1_1x32x1x8_8_1x1_intrawave_v3,829.18,247.01,0.0
gfx942,304,15360,7168,5120,ck,0,0,1359.7533,a8w8_blockscale_1x128x128_256x128x128x128_16x16_32x32_2x2_8x32x1_8x32x1_1x32x1x8_8_1x1_intrawave_v3,829.14,246.77,0.0
gfx942,304,15488,7168,5120,ck,0,0,1347.1391,a8w8_blockscale_1x128x128_256x128x128x128_16x16_32x32_2x2_8x32x1_8x32x1_1x32x1x8_8_1x1_intrawave_v3,843.88,250.93,0.0
gfx942,304,15616,7168,5120,ck,0,0,1370.0514,a8w8_blockscale_1x128x128_256x128x128x128_16x16_32x32_2x2_8x32x1_8x32x1_1x32x1x8_8_1x1_intrawave_v3,836.63,248.55,0.0
gfx942,304,15744,7168,5120,ck,0,0,1378.0252,a8w8_blockscale_1x128x128_256x128x128x128_16x16_32x32_2x2_8x32x1_8x32x1_1x32x1x8_8_1x1_intrawave_v3,838.6,248.92,0.0
gfx942,304,15872,7168,5120,ck,0,0,1378.5782,a8w8_blockscale_1x128x128_256x128x128x128_16x16_32x32_2x2_8x32x1_8x32x1_1x32x1x8_8_1x1_intrawave_v3,845.08,250.62,0.0
gfx942,304,16000,7168,5120,ck,0,0,1396.6945,a8w8_blockscale_1x128x128_256x128x128x128_16x16_32x32_2x2_8x32x1_8x32x1_1x32x1x8_8_1x1_intrawave_v3,840.85,249.16,0.0
gfx942,304,16128,7168,5120,ck,0,0,1423.6967,a8w8_blockscale_1x128x128_256x128x128x128_16x16_32x32_2x2_8x32x1_8x32x1_1x32x1x8_8_1x1_intrawave_v3,831.5,246.18,0.0
gfx942,304,16256,7168,5120,ck,0,0,1425.6381,a8w8_blockscale_1x128x128_256x128x128x128_16x16_32x32_2x2_8x32x1_8x32x1_1x32x1x8_8_1x1_intrawave_v3,836.96,247.59,0.0
gfx942,304,16384,7168,5120,ck,0,0,1436.3475,a8w8_blockscale_1x128x128_256x128x128x128_16x16_32x32_2x2_8x32x1_8x32x1_1x32x1x8_8_1x1_intrawave_v3,837.26,247.48,0.0
gfx942,304,16512,7168,5120,ck,0,0,1463.872,a8w8_blockscale_1x128x128_256x128x128x128_16x16_32x32_2x2_8x32x1_8x32x1_1x32x1x8_8_1x1_intrawave_v3,827.93,244.53,0.0
gfx942,304,16640,7168,5120,ck,0,0,1476.8401,a8w8_blockscale_1x128x128_256x128x128x128_16x16_32x32_2x2_8x32x1_8x32x1_1x32x1x8_8_1x1_intrawave_v3,827.02,244.07,0.0
gfx942,304,16768,7168,5120,ck,0,0,1484.7668,a8w8_blockscale_1x128x128_256x128x128x128_16x16_32x32_2x2_8x32x1_8x32x1_1x32x1x8_8_1x1_intrawave_v3,828.94,244.44,0.0
gfx942,304,16896,7168,5120,ck,0,0,1483.0239,a8w8_blockscale_1x128x128_256x128x128x128_16x16_32x32_2x2_8x32x1_8x32x1_1x32x1x8_8_1x1_intrawave_v3,836.25,246.41,0.0
gfx942,304,17024,7168,5120,ck,0,0,1511.4765,a8w8_blockscale_1x128x128_256x128x128x128_16x16_32x32_2x2_8x32x1_8x32x1_1x32x1x8_8_1x1_intrawave_v3,826.72,243.42,0.0
gfx942,304,17152,7168,5120,ck,0,0,1512.2385,a8w8_blockscale_1x128x128_256x128x128x128_16x16_32x32_2x2_8x32x1_8x32x1_1x32x1x8_8_1x1_intrawave_v3,832.52,244.94,0.0
gfx942,304,17280,7168,5120,ck,0,0,1518.7151,a8w8_blockscale_1x128x128_256x128x128x128_16x16_32x32_2x2_8x32x1_8x32x1_1x32x1x8_8_1x1_intrawave_v3,835.15,245.54,0.0
gfx942,304,17408,7168,5120,ck,0,0,1533.9816,a8w8_blockscale_1x128x128_256x128x128x128_16x16_32x32_2x2_8x32x1_8x32x1_1x32x1x8_8_1x1_intrawave_v3,832.96,244.72,0.0
gfx942,304,17536,7168,5120,ck,0,0,1554.9127,a8w8_blockscale_1x128x128_256x128x128x128_16x16_32x32_2x2_8x32x1_8x32x1_1x32x1x8_8_1x1_intrawave_v3,827.79,243.02,0.0
gfx942,304,17664,7168,5120,ck,0,0,1538.1818,a8w8_blockscale_1x128x128_256x128x128x128_16x16_32x32_2x2_8x32x1_8x32x1_1x32x1x8_8_1x1_intrawave_v3,842.91,247.29,0.0
gfx942,304,17792,7168,5120,ck,0,0,1570.5904,a8w8_blockscale_1x128x128_256x128x128x128_16x16_32x32_2x2_8x32x1_8x32x1_1x32x1x8_8_1x1_intrawave_v3,831.5,243.77,0.0
gfx942,304,17920,7168,5120,ck,0,0,1559.8031,a8w8_blockscale_1x128x128_256x128x128x128_16x16_32x32_2x2_8x32x1_8x32x1_1x32x1x8_8_1x1_intrawave_v3,843.27,247.05,0.0
gfx942,304,18048,7168,5120,ck,0,0,1595.7146,a8w8_blockscale_1x128x128_256x128x128x128_16x16_32x32_2x2_8x32x1_8x32x1_1x32x1x8_8_1x1_intrawave_v3,830.18,243.05,0.0
gfx942,304,18176,7168,5120,ck,0,0,1608.0901,a8w8_blockscale_1x128x128_256x128x128x128_16x16_32x32_2x2_8x32x1_8x32x1_1x32x1x8_8_1x1_intrawave_v3,829.63,242.73,0.0
gfx942,304,18304,7168,5120,ck,0,0,1595.8043,a8w8_blockscale_1x128x128_256x128x128x128_16x16_32x32_2x2_8x32x1_8x32x1_1x32x1x8_8_1x1_intrawave_v3,841.91,246.16,0.0
gfx942,304,18432,7168,5120,ck,0,0,1637.0996,a8w8_blockscale_1x128x128_256x128x128x128_16x16_32x32_2x2_8x32x1_8x32x1_1x32x1x8_8_1x1_intrawave_v3,826.41,241.47,0.0
gfx942,304,18560,7168,5120,ck,0,0,1644.6626,a8w8_blockscale_1x128x128_256x128x128x128_16x16_32x32_2x2_8x32x1_8x32x1_1x32x1x8_8_1x1_intrawave_v3,828.32,241.88,0.0
gfx942,304,18688,7168,5120,ck,0,0,1620.9244,a8w8_blockscale_1x128x128_256x128x128x128_16x16_32x32_2x2_8x32x1_8x32x1_1x32x1x8_8_1x1_intrawave_v3,846.25,246.95,0.0
gfx942,304,18816,7168,5120,ck,0,0,1684.0309,a8w8_blockscale_1x128x128_256x128x128x128_16x16_32x32_2x2_8x32x1_8x32x1_1x32x1x8_8_1x1_intrawave_v3,820.12,239.18,0.0
gfx942,304,18944,7168,5120,ck,0,0,1679.5735,a8w8_blockscale_1x128x128_256x128x128x128_16x16_32x32_2x2_8x32x1_8x32x1_1x32x1x8_8_1x1_intrawave_v3,827.89,241.3,0.0
gfx942,304,19072,7168,5120,ck,0,0,1672.8575,a8w8_blockscale_1x128x128_256x128x128x128_16x16_32x32_2x2_8x32x1_8x32x1_1x32x1x8_8_1x1_intrawave_v3,836.83,243.75,0.0
gfx942,304,19200,7168,5120,ck,0,0,1699.2217,a8w8_blockscale_1x128x128_256x128x128x128_16x16_32x32_2x2_8x32x1_8x32x1_1x32x1x8_8_1x1_intrawave_v3,829.37,241.44,0.0
gfx942,304,19328,7168,5120,ck,0,0,1710.5469,a8w8_blockscale_1x128x128_256x128x128x128_16x16_32x32_2x2_8x32x1_8x32x1_1x32x1x8_8_1x1_intrawave_v3,829.37,241.29,0.0
gfx942,304,19456,7168,5120,ck,0,0,1730.1932,a8w8_blockscale_1x128x128_256x128x128x128_16x16_32x32_2x2_8x32x1_8x32x1_1x32x1x8_8_1x1_intrawave_v3,825.39,239.99,0.0
gfx942,304,19584,7168,5120,ck,0,0,1707.563,a8w8_blockscale_1x128x128_256x128x128x128_16x16_32x32_2x2_8x32x1_8x32x1_1x32x1x8_8_1x1_intrawave_v3,841.83,244.63,0.0
gfx942,304,19712,7168,5120,ck,0,0,1720.1033,a8w8_blockscale_1x128x128_256x128x128x128_16x16_32x32_2x2_8x32x1_8x32x1_1x32x1x8_8_1x1_intrawave_v3,841.15,244.3,0.0
gfx942,304,19840,7168,5120,ck,0,0,1771.8449,a8w8_blockscale_1x128x128_256x128x128x128_16x16_32x32_2x2_8x32x1_8x32x1_1x32x1x8_8_1x1_intrawave_v3,821.89,238.57,0.0
gfx942,304,19968,7168,5120,ck,0,0,1759.0995,a8w8_blockscale_1x128x128_256x128x128x128_16x16_32x32_2x2_8x32x1_8x32x1_1x32x1x8_8_1x1_intrawave_v3,833.19,241.71,0.0
gfx942,304,20096,7168,5120,ck,0,0,1782.6969,a8w8_blockscale_1x128x128_256x128x128x128_16x16_32x32_2x2_8x32x1_8x32x1_1x32x1x8_8_1x1_intrawave_v3,827.43,239.91,0.0
gfx942,304,20224,7168,5120,ck,0,0,1810.0181,a8w8_blockscale_1x128x128_256x128x128x128_16x16_32x32_2x2_8x32x1_8x32x1_1x32x1x8_8_1x1_intrawave_v3,820.13,237.67,0.0
gfx942,304,20352,7168,5120,ck,0,0,1805.9642,a8w8_blockscale_1x128x128_256x128x128x128_16x16_32x32_2x2_8x32x1_8x32x1_1x32x1x8_8_1x1_intrawave_v3,827.17,239.58,0.0
gfx942,304,20480,7168,5120,ck,0,0,1782.0901,a8w8_blockscale_1x128x128_256x128x128x128_16x16_32x32_2x2_8x32x1_8x32x1_1x32x1x8_8_1x1_intrawave_v3,843.53,244.18,0.0
gfx942,304,20608,7168,5120,ck,0,0,1857.5993,a8w8_blockscale_1x128x128_256x128x128x128_16x16_32x32_2x2_8x32x1_8x32x1_1x32x1x8_8_1x1_intrawave_v3,814.29,235.6,0.0
gfx942,304,20736,7168,5120,ck,0,0,1857.5405,a8w8_blockscale_1x128x128_256x128x128x128_16x16_32x32_2x2_8x32x1_8x32x1_1x32x1x8_8_1x1_intrawave_v3,819.38,236.95,0.0
gfx942,304,20864,7168,5120,ck,0,0,1866.0989,a8w8_blockscale_1x128x128_256x128x128x128_16x16_32x32_2x2_8x32x1_8x32x1_1x32x1x8_8_1x1_intrawave_v3,820.66,237.2,0.0
gfx942,304,20992,7168,5120,ck,0,0,1849.8415,a8w8_blockscale_1x128x128_256x128x128x128_16x16_32x32_2x2_8x32x1_8x32x1_1x32x1x8_8_1x1_intrawave_v3,832.95,240.63,0.0
gfx942,304,21120,7168,5120,ck,0,0,1857.9732,a8w8_blockscale_1x128x128_256x128x128x128_16x16_32x32_2x2_8x32x1_8x32x1_1x32x1x8_8_1x1_intrawave_v3,834.36,240.91,0.0
gfx942,304,21248,7168,5120,ck,0,0,1901.3967,a8w8_blockscale_1x128x128_256x128x128x128_16x16_32x32_2x2_8x32x1_8x32x1_1x32x1x8_8_1x1_intrawave_v3,820.24,236.72,0.0
gfx942,304,21376,7168,5120,ck,0,0,1877.1491,a8w8_blockscale_1x128x128_256x128x128x128_16x16_32x32_2x2_8x32x1_8x32x1_1x32x1x8_8_1x1_intrawave_v3,835.84,241.11,0.0
gfx942,304,21504,7168,5120,ck,0,0,1894.5106,a8w8_blockscale_1x128x128_256x128x128x128_16x16_32x32_2x2_8x32x1_8x32x1_1x32x1x8_8_1x1_intrawave_v3,833.14,240.21,0.0
gfx942,304,21632,7168,5120,ck,0,0,1895.2009,a8w8_blockscale_1x128x128_256x128x128x128_16x16_32x32_2x2_8x32x1_8x32x1_1x32x1x8_8_1x1_intrawave_v3,837.8,241.44,0.0
gfx942,304,21760,7168,5120,ck,0,0,1928.8376,a8w8_blockscale_1x128x128_256x128x128x128_16x16_32x32_2x2_8x32x1_8x32x1_1x32x1x8_8_1x1_intrawave_v3,828.06,238.52,0.0
gfx942,304,21888,7168,5120,ck,0,0,1952.9224,a8w8_blockscale_1x128x128_256x128x128x128_16x16_32x32_2x2_8x32x1_8x32x1_1x32x1x8_8_1x1_intrawave_v3,822.66,236.85,0.0
gfx942,304,22016,7168,5120,ck,0,0,1927.5632,a8w8_blockscale_1x128x128_256x128x128x128_16x16_32x32_2x2_8x32x1_8x32x1_1x32x1x8_8_1x1_intrawave_v3,838.35,241.26,0.0
