aiter/configs/model_configs/a8w8_blockscale_tuned_gemm_qwen3_5_397b_a13b.csv
cu_num,M,N,K,libtype,kernelId,splitK,us,kernelName,tflops,bw,errRatio
256,16,256,4096,ck,8,0,11.6965,a8w8_blockscale_1x128x128_256x16x64x256_16x16_16x16_1x1_16x16x1_16x16x1_1x16x1x16_4_1x1_intrawave_v1,0.18,90.04,0.0
256,32,256,4096,ck,8,0,12.2103,a8w8_blockscale_1x128x128_256x16x64x256_16x16_16x16_1x1_16x16x1_16x16x1_1x16x1x16_4_1x1_intrawave_v1,4.12,94.93,0.0
256,48,256,4096,ck,8,0,12.208,a8w8_blockscale_1x128x128_256x16x64x256_16x16_16x16_1x1_16x16x1_16x16x1_1x16x1x16_4_1x1_intrawave_v1,6.87,100.99,0.0
256,64,256,4096,ck,8,0,12.2484,a8w8_blockscale_1x128x128_256x16x64x256_16x16_16x16_1x1_16x16x1_16x16x1_1x16x1x16_4_1x1_intrawave_v1,9.59,106.68,0.0
256,768,256,4096,ck,8,0,12.895,a8w8_blockscale_1x128x128_256x16x64x256_16x16_16x16_1x1_16x16x1_16x16x1_1x16x1x16_4_1x1_intrawave_v1,124.9,355.76,0.0
256,832,256,4096,ck,8,0,13.3192,a8w8_blockscale_1x128x128_256x16x64x256_16x16_16x16_1x1_16x16x1_16x16x1_1x16x1x16_4_1x1_intrawave_v1,128.64,361.38,0.0
256,864,256,4096,ck,8,0,13.3665,a8w8_blockscale_1x128x128_256x16x64x256_16x16_16x16_1x1_16x16x1_16x16x1_1x16x1x16_4_1x1_intrawave_v1,130.85,365.96,0.0
256,896,256,4096,ck,8,0,13.5159,a8w8_blockscale_1x128x128_256x16x64x256_16x16_16x16_1x1_16x16x1_16x16x1_1x16x1x16_4_1x1_intrawave_v1,134.21,372.49,0.0
256,928,256,4096,ck,8,0,13.396,a8w8_blockscale_1x128x128_256x16x64x256_16x16_16x16_1x1_16x16x1_16x16x1_1x16x1x16_4_1x1_intrawave_v1,140.74,387.52,0.0
256,960,256,4096,ck,8,0,13.584,a8w8_blockscale_1x128x128_256x16x64x256_16x16_16x16_1x1_16x16x1_16x16x1_1x16x1x16_4_1x1_intrawave_v1,143.58,392.67,0.0
256,992,256,4096,ck,8,0,13.3313,a8w8_blockscale_1x128x128_256x16x64x256_16x16_16x16_1x1_16x16x1_16x16x1_1x16x1x16_4_1x1_intrawave_v1,151.33,411.17,0.0
256,1024,256,4096,ck,8,0,13.7184,a8w8_blockscale_1x128x128_256x16x64x256_16x16_16x16_1x1_16x16x1_16x16x1_1x16x1x16_4_1x1_intrawave_v1,151.95,410.32,0.0
256,1216,256,4096,ck,7,0,16.3449,a8w8_blockscale_1x128x128_256x16x128x256_16x16_16x16_1x2_16x16x1_16x16x1_1x16x1x16_8_1x2_intrawave_v1,153.71,401.9,0.0
256,1280,256,4096,ck,18,0,15.9773,a8w8_blockscale_1x128x128_256x64x64x256_16x16_32x32_1x1_16x16x1_16x16x1_1x32x1x8_8_1x1_intrawave_v1,168.01,434.79,0.0
256,1536,256,4096,ck,7,0,16.5728,a8w8_blockscale_1x128x128_256x16x128x256_16x16_16x16_1x2_16x16x1_16x16x1_1x16x1x16_8_1x2_intrawave_v1,191.96,485.07,0.0
256,1728,256,4096,ck,7,0,16.6495,a8w8_blockscale_1x128x128_256x16x128x256_16x16_16x16_1x2_16x16x1_16x16x1_1x16x1x16_8_1x2_intrawave_v1,211.74,528.22,0.0
256,1792,256,4096,ck,7,0,16.7885,a8w8_blockscale_1x128x128_256x16x128x256_16x16_16x16_1x2_16x16x1_16x16x1_1x16x1x16_8_1x2_intrawave_v1,217.6,540.59,0.0
256,1920,256,4096,ck,7,0,16.6631,a8w8_blockscale_1x128x128_256x16x128x256_16x16_16x16_1x2_16x16x1_16x16x1_1x16x1x16_8_1x2_intrawave_v1,235.22,579.78,0.0
256,1984,256,4096,ck,7,0,16.792,a8w8_blockscale_1x128x128_256x16x128x256_16x16_16x16_1x2_16x16x1_16x16x1_1x16x1x16_8_1x2_intrawave_v1,240.79,591.52,0.0
256,2048,256,4096,ck,7,0,16.9213,a8w8_blockscale_1x128x128_256x16x128x256_16x16_16x16_1x2_16x16x1_16x16x1_1x16x1x16_8_1x2_intrawave_v1,251.47,614.5,0.0
256,2304,256,4096,ck,18,0,20.2848,a8w8_blockscale_1x128x128_256x64x64x256_16x16_32x32_1x1_16x16x1_16x16x1_1x32x1x8_8_1x1_intrawave_v1,236.24,570.77,0.0
256,2560,256,4096,ck,18,0,20.4001,a8w8_blockscale_1x128x128_256x64x64x256_16x16_32x32_1x1_16x16x1_16x16x1_1x32x1x8_8_1x1_intrawave_v1,261.01,624.91,0.0
256,2688,256,4096,ck,18,0,20.4759,a8w8_blockscale_1x128x128_256x64x64x256_16x16_32x32_1x1_16x16x1_16x16x1_1x32x1x8_8_1x1_intrawave_v1,269.57,643.53,0.0
256,2816,256,4096,ck,18,0,20.4622,a8w8_blockscale_1x128x128_256x64x64x256_16x16_32x32_1x1_16x16x1_16x16x1_1x32x1x8_8_1x1_intrawave_v1,286.46,680.67,0.0
256,3328,256,4096,ck,18,0,20.636,a8w8_blockscale_1x128x128_256x64x64x256_16x16_32x32_1x1_16x16x1_16x16x1_1x32x1x8_8_1x1_intrawave_v1,336.08,789.26,0.0
256,4096,256,4096,ck,18,0,20.9363,a8w8_blockscale_1x128x128_256x64x64x256_16x16_32x32_1x1_16x16x1_16x16x1_1x32x1x8_8_1x1_intrawave_v1,408.19,946.98,0.0
256,6656,256,4096,ck,2,0,26.7298,a8w8_blockscale_1x128x128_256x64x128x128_16x16_32x32_1x2_8x32x1_8x32x1_1x32x1x8_8_1x1_intrawave_v3,515.31,1171.5,0.0
256,6784,256,4096,ck,2,0,26.8081,a8w8_blockscale_1x128x128_256x64x128x128_16x16_32x32_1x2_8x32x1_8x32x1_1x32x1x8_8_1x1_intrawave_v3,521.7,1185.44,0.0
256,6912,256,4096,ck,2,0,26.9598,a8w8_blockscale_1x128x128_256x64x128x128_16x16_32x32_1x2_8x32x1_8x32x1_1x32x1x8_8_1x1_intrawave_v3,528.65,1200.47,0.0
256,7040,256,4096,ck,2,0,26.9363,a8w8_blockscale_1x128x128_256x64x128x128_16x16_32x32_1x2_8x32x1_8x32x1_1x32x1x8_8_1x1_intrawave_v3,541.49,1228.72,0.0
256,7168,256,4096,ck,2,0,27.0548,a8w8_blockscale_1x128x128_256x64x128x128_16x16_32x32_1x2_8x32x1_8x32x1_1x32x1x8_8_1x1_intrawave_v3,545.94,1238.33,0.0
256,7296,256,4096,ck,2,0,27.0152,a8w8_blockscale_1x128x128_256x64x128x128_16x16_32x32_1x2_8x32x1_8x32x1_1x32x1x8_8_1x1_intrawave_v3,557.37,1263.51,0.0
256,7424,256,4096,ck,2,0,27.2556,a8w8_blockscale_1x128x128_256x64x128x128_16x16_32x32_1x2_8x32x1_8x32x1_1x32x1x8_8_1x1_intrawave_v3,562.0,1273.33,0.0
256,7552,256,4096,ck,2,0,26.9557,a8w8_blockscale_1x128x128_256x64x128x128_16x16_32x32_1x2_8x32x1_8x32x1_1x32x1x8_8_1x1_intrawave_v3,577.66,1308.18,0.0
256,7680,256,4096,ck,2,0,27.2389,a8w8_blockscale_1x128x128_256x64x128x128_16x16_32x32_1x2_8x32x1_8x32x1_1x32x1x8_8_1x1_intrawave_v3,583.9,1321.48,0.0
256,7808,256,4096,ck,2,0,27.3024,a8w8_blockscale_1x128x128_256x64x128x128_16x16_32x32_1x2_8x32x1_8x32x1_1x32x1x8_8_1x1_intrawave_v3,590.99,1336.97,0.0
256,7936,256,4096,ck,2,0,27.1517,a8w8_blockscale_1x128x128_256x64x128x128_16x16_32x32_1x2_8x32x1_8x32x1_1x32x1x8_8_1x1_intrawave_v3,603.62,1364.93,0.0
256,8064,256,4096,ck,2,0,27.2566,a8w8_blockscale_1x128x128_256x64x128x128_16x16_32x32_1x2_8x32x1_8x32x1_1x32x1x8_8_1x1_intrawave_v3,610.84,1380.64,0.0
256,8192,256,4096,ck,2,0,27.4086,a8w8_blockscale_1x128x128_256x64x128x128_16x16_32x32_1x2_8x32x1_8x32x1_1x32x1x8_8_1x1_intrawave_v3,619.92,1400.38,0.0
256,9344,256,4096,ck,0,0,34.5697,a8w8_blockscale_1x128x128_256x128x128x128_16x16_32x32_2x2_8x32x1_8x32x1_1x32x1x8_8_1x1_intrawave_v3,559.69,1260.12,0.0
256,9856,256,4096,ck,0,0,34.9113,a8w8_blockscale_1x128x128_256x128x128x128_16x16_32x32_2x2_8x32x1_8x32x1_1x32x1x8_8_1x1_intrawave_v3,589.18,1324.61,0.0
256,12928,256,4096,ck,0,0,36.2732,a8w8_blockscale_1x128x128_256x128x128x128_16x16_32x32_2x2_8x32x1_8x32x1_1x32x1x8_8_1x1_intrawave_v3,741.66,1658.52,0.0
256,13440,256,4096,ck,0,0,36.2539,a8w8_blockscale_1x128x128_256x128x128x128_16x16_32x32_2x2_8x32x1_8x32x1_1x32x1x8_8_1x1_intrawave_v3,773.92,1729.44,0.0
256,13952,256,4096,ck,0,0,36.389,a8w8_blockscale_1x128x128_256x128x128x128_16x16_32x32_2x2_8x32x1_8x32x1_1x32x1x8_8_1x1_intrawave_v3,803.09,1793.43,0.0
256,14080,256,4096,ck,0,0,37.0974,a8w8_blockscale_1x128x128_256x128x128x128_16x16_32x32_2x2_8x32x1_8x32x1_1x32x1x8_8_1x1_intrawave_v3,788.89,1761.67,0.0
256,14208,256,4096,ck,0,0,36.5111,a8w8_blockscale_1x128x128_256x128x128x128_16x16_32x32_2x2_8x32x1_8x32x1_1x32x1x8_8_1x1_intrawave_v3,811.67,1812.17,0.0
256,14336,256,4096,ck,0,0,36.8554,a8w8_blockscale_1x128x128_256x128x128x128_16x16_32x32_2x2_8x32x1_8x32x1_1x32x1x8_8_1x1_intrawave_v3,809.03,1806.12,0.0
256,14464,256,4096,ck,0,0,38.1453,a8w8_blockscale_1x128x128_256x128x128x128_16x16_32x32_2x2_8x32x1_8x32x1_1x32x1x8_8_1x1_intrawave_v3,790.42,1764.25,0.0
256,14592,256,4096,ck,0,0,36.9915,a8w8_blockscale_1x128x128_256x128x128x128_16x16_32x32_2x2_8x32x1_8x32x1_1x32x1x8_8_1x1_intrawave_v3,825.11,1841.33,0.0
256,14720,256,4096,ck,0,0,36.9512,a8w8_blockscale_1x128x128_256x128x128x128_16x16_32x32_2x2_8x32x1_8x32x1_1x32x1x8_8_1x1_intrawave_v3,829.13,1850.19,0.0
256,14848,256,4096,ck,0,0,37.1703,a8w8_blockscale_1x128x128_256x128x128x128_16x16_32x32_2x2_8x32x1_8x32x1_1x32x1x8_8_1x1_intrawave_v3,835.24,1863.46,0.0
256,14976,256,4096,ck,0,0,37.4342,a8w8_blockscale_1x128x128_256x128x128x128_16x16_32x32_2x2_8x32x1_8x32x1_1x32x1x8_8_1x1_intrawave_v3,832.6,1857.46,0.0
256,15104,256,4096,ck,0,0,37.5624,a8w8_blockscale_1x128x128_256x128x128x128_16x16_32x32_2x2_8x32x1_8x32x1_1x32x1x8_8_1x1_intrawave_v3,836.91,1866.83,0.0
256,15232,256,4096,ck,0,0,37.3913,a8w8_blockscale_1x128x128_256x128x128x128_16x16_32x32_2x2_8x32x1_8x32x1_1x32x1x8_8_1x1_intrawave_v3,847.86,1891.02,0.0
256,15360,256,4096,ck,0,0,37.7203,a8w8_blockscale_1x128x128_256x128x128x128_16x16_32x32_2x2_8x32x1_8x32x1_1x32x1x8_8_1x1_intrawave_v3,851.2,1898.1,0.0
256,15488,256,4096,ck,0,0,37.2286,a8w8_blockscale_1x128x128_256x128x128x128_16x16_32x32_2x2_8x32x1_8x32x1_1x32x1x8_8_1x1_intrawave_v3,871.0,1941.99,0.0
256,15616,256,4096,ck,0,0,38.2617,a8w8_blockscale_1x128x128_256x128x128x128_16x16_32x32_2x2_8x32x1_8x32x1_1x32x1x8_8_1x1_intrawave_v3,850.44,1896.06,0.0
256,15744,256,4096,ck,0,0,37.5521,a8w8_blockscale_1x128x128_256x128x128x128_16x16_32x32_2x2_8x32x1_8x32x1_1x32x1x8_8_1x1_intrawave_v3,877.79,1956.67,0.0
256,15872,256,4096,ck,0,0,38.3095,a8w8_blockscale_1x128x128_256x128x128x128_16x16_32x32_2x2_8x32x1_8x32x1_1x32x1x8_8_1x1_intrawave_v3,863.12,1923.88,0.0
256,16128,256,4096,ck,0,0,37.8742,a8w8_blockscale_1x128x128_256x128x128x128_16x16_32x32_2x2_8x32x1_8x32x1_1x32x1x8_8_1x1_intrawave_v3,886.0,1974.46,0.0
256,16256,256,4096,ck,0,0,38.4338,a8w8_blockscale_1x128x128_256x128x128x128_16x16_32x32_2x2_8x32x1_8x32x1_1x32x1x8_8_1x1_intrawave_v3,880.63,1962.26,0.0
256,16384,256,4096,ck,0,0,38.0411,a8w8_blockscale_1x128x128_256x128x128x128_16x16_32x32_2x2_8x32x1_8x32x1_1x32x1x8_8_1x1_intrawave_v3,901.02,2007.35,0.0
256,16,1024,4096,ck,8,0,13.1276,a8w8_blockscale_1x128x128_256x16x64x256_16x16_16x16_1x1_16x16x1_16x16x1_1x16x1x16_4_1x1_intrawave_v1,0.64,319.97,0.0
256,32,1024,4096,ck,8,0,13.4521,a8w8_blockscale_1x128x128_256x16x64x256_16x16_16x16_1x1_16x16x1_16x16x1_1x16x1x16_4_1x1_intrawave_v1,14.97,322.76,0.0
256,48,1024,4096,ck,8,0,13.2544,a8w8_blockscale_1x128x128_256x16x64x256_16x16_16x16_1x1_16x16x1_16x16x1_1x16x1x16_4_1x1_intrawave_v1,25.32,334.99,0.0
256,64,1024,4096,ck,8,0,13.3221,a8w8_blockscale_1x128x128_256x16x64x256_16x16_16x16_1x1_16x16x1_16x16x1_1x16x1x16_4_1x1_intrawave_v1,35.26,340.66,0.0
256,768,1024,4096,ck,18,0,16.4325,a8w8_blockscale_1x128x128_256x64x64x256_16x16_32x32_1x1_16x16x1_16x16x1_1x32x1x8_8_1x1_intrawave_v1,392.06,542.39,0.0
256,832,1024,4096,ck,18,0,20.6277,a8w8_blockscale_1x128x128_256x64x64x256_16x16_32x32_1x1_16x16x1_16x16x1_1x32x1x8_8_1x1_intrawave_v1,332.25,446.68,0.0
256,864,1024,4096,ck,18,0,20.7111,a8w8_blockscale_1x128x128_256x64x64x256_16x16_32x32_1x1_16x16x1_16x16x1_1x32x1x8_8_1x1_intrawave_v1,337.79,449.92,0.0
256,896,1024,4096,ck,18,0,20.7092,a8w8_blockscale_1x128x128_256x64x64x256_16x16_32x32_1x1_16x16x1_16x16x1_1x32x1x8_8_1x1_intrawave_v1,350.38,459.16,0.0
256,928,1024,4096,ck,18,0,20.7299,a8w8_blockscale_1x128x128_256x64x64x256_16x16_32x32_1x1_16x16x1_16x16x1_1x32x1x8_8_1x1_intrawave_v1,363.79,468.78,0.0
256,960,1024,4096,ck,18,0,20.7661,a8w8_blockscale_1x128x128_256x64x64x256_16x16_32x32_1x1_16x16x1_16x16x1_1x32x1x8_8_1x1_intrawave_v1,375.68,477.13,0.0
256,992,1024,4096,ck,18,0,20.9593,a8w8_blockscale_1x128x128_256x64x64x256_16x16_32x32_1x1_16x16x1_16x16x1_1x32x1x8_8_1x1_intrawave_v1,385.02,482.12,0.0
256,1024,1024,4096,ck,18,0,20.8715,a8w8_blockscale_1x128x128_256x64x64x256_16x16_32x32_1x1_16x16x1_16x16x1_1x32x1x8_8_1x1_intrawave_v1,399.51,493.56,0.0
256,1216,1024,4096,ck,2,0,25.8517,a8w8_blockscale_1x128x128_256x64x128x128_16x16_32x32_1x2_8x32x1_8x32x1_1x32x1x8_8_1x1_intrawave_v3,388.74,446.97,0.0
256,1280,1024,4096,ck,3,0,24.8162,a8w8_blockscale_1x128x128_256x64x64x128_16x16_32x32_1x1_8x32x1_8x32x1_1x32x1x8_8_1x1_intrawave_v3,432.68,485.92,0.0
256,1536,1024,4096,ck,2,0,26.1639,a8w8_blockscale_1x128x128_256x64x128x128_16x16_32x32_1x2_8x32x1_8x32x1_1x32x1x8_8_1x1_intrawave_v3,486.38,516.54,0.0
256,1728,1024,4096,ck,2,0,26.0823,a8w8_blockscale_1x128x128_256x64x128x128_16x16_32x32_1x2_8x32x1_8x32x1_1x32x1x8_8_1x1_intrawave_v3,540.64,556.79,0.0
256,1792,1024,4096,ck,2,0,26.2184,a8w8_blockscale_1x128x128_256x64x128x128_16x16_32x32_1x2_8x32x1_8x32x1_1x32x1x8_8_1x1_intrawave_v3,557.35,568.19,0.0
256,1920,1024,4096,ck,2,0,26.193,a8w8_blockscale_1x128x128_256x64x128x128_16x16_32x32_1x2_8x32x1_8x32x1_1x32x1x8_8_1x1_intrawave_v3,598.57,598.54,0.0
256,1984,1024,4096,ck,2,0,26.2988,a8w8_blockscale_1x128x128_256x64x128x128_16x16_32x32_1x2_8x32x1_8x32x1_1x32x1x8_8_1x1_intrawave_v3,614.98,609.91,0.0
256,2048,1024,4096,ck,2,0,26.2741,a8w8_blockscale_1x128x128_256x64x128x128_16x16_32x32_1x2_8x32x1_8x32x1_1x32x1x8_8_1x1_intrawave_v3,647.8,634.1,0.0
256,2304,1024,4096,ck,2,0,32.6385,a8w8_blockscale_1x128x128_256x64x128x128_16x16_32x32_1x2_8x32x1_8x32x1_1x32x1x8_8_1x1_intrawave_v3,587.28,558.65,0.0
256,2560,1024,4096,ck,0,0,33.1301,a8w8_blockscale_1x128x128_256x128x128x128_16x16_32x32_2x2_8x32x1_8x32x1_1x32x1x8_8_1x1_intrawave_v3,642.88,597.46,0.0
256,2688,1024,4096,ck,0,0,33.3571,a8w8_blockscale_1x128x128_256x128x128x128_16x16_32x32_2x2_8x32x1_8x32x1_1x32x1x8_8_1x1_intrawave_v3,661.89,610.52,0.0
256,2816,1024,4096,ck,0,0,33.5011,a8w8_blockscale_1x128x128_256x128x128x128_16x16_32x32_2x2_8x32x1_8x32x1_1x32x1x8_8_1x1_intrawave_v3,699.86,637.79,0.0
256,3328,1024,4096,ck,0,0,33.9686,a8w8_blockscale_1x128x128_256x128x128x128_16x16_32x32_2x2_8x32x1_8x32x1_1x32x1x8_8_1x1_intrawave_v3,816.67,721.62,0.0
256,4096,1024,4096,ck,0,0,36.2164,a8w8_blockscale_1x128x128_256x128x128x128_16x16_32x32_2x2_8x32x1_8x32x1_1x32x1x8_8_1x1_intrawave_v3,943.87,807.12,0.0
256,6656,1024,4096,ck,0,0,56.4226,a8w8_blockscale_1x128x128_256x128x128x128_16x16_32x32_2x2_8x32x1_8x32x1_1x32x1x8_8_1x1_intrawave_v3,976.49,789.54,0.0
256,6784,1024,4096,ck,0,0,55.859,a8w8_blockscale_1x128x128_256x128x128x128_16x16_32x32_2x2_8x32x1_8x32x1_1x32x1x8_8_1x1_intrawave_v3,1001.52,808.62,0.0
256,6912,1024,4096,ck,0,0,58.0892,a8w8_blockscale_1x128x128_256x128x128x128_16x16_32x32_2x2_8x32x1_8x32x1_1x32x1x8_8_1x1_intrawave_v3,981.4,791.01,0.0
256,7040,1024,4096,ck,0,0,59.0785,a8w8_blockscale_1x128x128_256x128x128x128_16x16_32x32_2x2_8x32x1_8x32x1_1x32x1x8_8_1x1_intrawave_v3,987.55,794.3,0.0
256,7168,1024,4096,ck,0,0,57.4431,a8w8_blockscale_1x128x128_256x128x128x128_16x16_32x32_2x2_8x32x1_8x32x1_1x32x1x8_8_1x1_intrawave_v3,1028.51,826.32,0.0
256,7296,1024,4096,ck,0,0,60.3763,a8w8_blockscale_1x128x128_256x128x128x128_16x16_32x32_2x2_8x32x1_8x32x1_1x32x1x8_8_1x1_intrawave_v3,997.58,800.12,0.0
256,7424,1024,4096,ck,0,0,60.4935,a8w8_blockscale_1x128x128_256x128x128x128_16x16_32x32_2x2_8x32x1_8x32x1_1x32x1x8_8_1x1_intrawave_v3,1012.84,811.16,0.0
256,7552,1024,4096,cktile,11,0,61.353,a8w8_blockscale_cktile_192x256x128_4x2x1_16x16x128_intrawave_0x1x0_1,1015.2,811.92,0.0
256,7680,1024,4096,ck,0,0,60.2922,a8w8_blockscale_1x128x128_256x128x128x128_16x16_32x32_2x2_8x32x1_8x32x1_1x32x1x8_8_1x1_intrawave_v3,1055.18,842.4,0.0
256,7808,1024,4096,ck,0,0,61.9035,a8w8_blockscale_1x128x128_256x128x128x128_16x16_32x32_2x2_8x32x1_8x32x1_1x32x1x8_8_1x1_intrawave_v3,1042.62,831.39,0.0
256,7936,1024,4096,cktile,11,0,61.7842,a8w8_blockscale_cktile_192x256x128_4x2x1_16x16x128_intrawave_0x1x0_1,1061.06,845.03,0.0
256,8064,1024,4096,ck,0,0,61.6814,a8w8_blockscale_1x128x128_256x128x128x128_16x16_32x32_2x2_8x32x1_8x32x1_1x32x1x8_8_1x1_intrawave_v3,1079.7,858.79,0.0
256,8192,1024,4096,ck,0,0,61.7018,a8w8_blockscale_1x128x128_256x128x128x128_16x16_32x32_2x2_8x32x1_8x32x1_1x32x1x8_8_1x1_intrawave_v3,1101.5,874.74,0.0
256,9344,1024,4096,cktile,11,0,63.1961,a8w8_blockscale_cktile_192x256x128_4x2x1_16x16x128_intrawave_0x1x0_1,1224.65,963.33,0.0
256,9856,1024,4096,cktile,11,0,64.5565,a8w8_blockscale_cktile_192x256x128_4x2x1_16x16x128_intrawave_0x1x0_1,1274.47,998.42,0.0
256,12928,1024,4096,ck,0,0,103.294,a8w8_blockscale_1x128x128_256x128x128x128_16x16_32x32_2x2_8x32x1_8x32x1_1x32x1x8_8_1x1_intrawave_v3,1041.77,803.62,0.0
256,13440,1024,4096,ck,0,0,104.2039,a8w8_blockscale_1x128x128_256x128x128x128_16x16_32x32_2x2_8x32x1_8x32x1_1x32x1x8_8_1x1_intrawave_v3,1077.03,829.09,0.0
256,13952,1024,4096,ck,0,0,106.1719,a8w8_blockscale_1x128x128_256x128x128x128_16x16_32x32_2x2_8x32x1_8x32x1_1x32x1x8_8_1x1_intrawave_v3,1101.0,845.9,0.0
256,14080,1024,4096,ck,0,0,107.7503,a8w8_blockscale_1x128x128_256x128x128x128_16x16_32x32_2x2_8x32x1_8x32x1_1x32x1x8_8_1x1_intrawave_v3,1086.43,834.65,0.0
256,14208,1024,4096,ck,0,0,106.3672,a8w8_blockscale_1x128x128_256x128x128x128_16x16_32x32_2x2_8x32x1_8x32x1_1x32x1x8_8_1x1_intrawave_v3,1114.44,855.67,0.0
256,14336,1024,4096,ck,0,0,108.3428,a8w8_blockscale_1x128x128_256x128x128x128_16x16_32x32_2x2_8x32x1_8x32x1_1x32x1x8_8_1x1_intrawave_v3,1100.85,845.0,0.0
256,14464,1024,4096,ck,0,0,109.2152,a8w8_blockscale_1x128x128_256x128x128x128_16x16_32x32_2x2_8x32x1_8x32x1_1x32x1x8_8_1x1_intrawave_v3,1104.27,847.2,0.0
256,14592,1024,4096,ck,0,0,109.5125,a8w8_blockscale_1x128x128_256x128x128x128_16x16_32x32_2x2_8x32x1_8x32x1_1x32x1x8_8_1x1_intrawave_v3,1114.83,854.83,0.0
256,14720,1024,4096,ck,0,0,109.1684,a8w8_blockscale_1x128x128_256x128x128x128_16x16_32x32_2x2_8x32x1_8x32x1_1x32x1x8_8_1x1_intrawave_v3,1122.57,860.62,0.0
256,14848,1024,4096,ck,0,0,110.2472,a8w8_blockscale_1x128x128_256x128x128x128_16x16_32x32_2x2_8x32x1_8x32x1_1x32x1x8_8_1x1_intrawave_v3,1126.42,863.06,0.0
256,14976,1024,4096,ck,0,0,107.4325,a8w8_blockscale_1x128x128_256x128x128x128_16x16_32x32_2x2_8x32x1_8x32x1_1x32x1x8_8_1x1_intrawave_v3,1160.46,888.99,0.0
256,15104,1024,4096,ck,0,0,110.2112,a8w8_blockscale_1x128x128_256x128x128x128_16x16_32x32_2x2_8x32x1_8x32x1_1x32x1x8_8_1x1_intrawave_v3,1140.95,873.71,0.0
256,15232,1024,4096,ck,0,0,110.4934,a8w8_blockscale_1x128x128_256x128x128x128_16x16_32x32_2x2_8x32x1_8x32x1_1x32x1x8_8_1x1_intrawave_v3,1147.68,878.54,0.0
256,15360,1024,4096,ck,0,0,111.0816,a8w8_blockscale_1x128x128_256x128x128x128_16x16_32x32_2x2_8x32x1_8x32x1_1x32x1x8_8_1x1_intrawave_v3,1156.17,884.57,0.0
256,15488,1024,4096,ck,0,0,111.8616,a8w8_blockscale_1x128x128_256x128x128x128_16x16_32x32_2x2_8x32x1_8x32x1_1x32x1x8_8_1x1_intrawave_v3,1159.51,886.75,0.0
256,15616,1024,4096,ck,0,0,110.2424,a8w8_blockscale_1x128x128_256x128x128x128_16x16_32x32_2x2_8x32x1_8x32x1_1x32x1x8_8_1x1_intrawave_v3,1180.65,902.78,0.0
256,15744,1024,4096,ck,0,0,113.6504,a8w8_blockscale_1x128x128_256x128x128x128_16x16_32x32_2x2_8x32x1_8x32x1_1x32x1x8_8_1x1_intrawave_v3,1160.16,886.63,0.0
256,15872,1024,4096,ck,0,0,113.2325,a8w8_blockscale_1x128x128_256x128x128x128_16x16_32x32_2x2_8x32x1_8x32x1_1x32x1x8_8_1x1_intrawave_v3,1168.07,892.56,0.0
256,16128,1024,4096,ck,0,0,114.8776,a8w8_blockscale_1x128x128_256x128x128x128_16x16_32x32_2x2_8x32x1_8x32x1_1x32x1x8_8_1x1_intrawave_v3,1168.43,892.29,0.0
256,16256,1024,4096,ck,0,0,114.9189,a8w8_blockscale_1x128x128_256x128x128x128_16x16_32x32_2x2_8x32x1_8x32x1_1x32x1x8_8_1x1_intrawave_v3,1178.08,899.35,0.0
256,16384,1024,4096,ck,0,0,115.4381,a8w8_blockscale_1x128x128_256x128x128x128_16x16_32x32_2x2_8x32x1_8x32x1_1x32x1x8_8_1x1_intrawave_v3,1187.68,906.22,0.0
256,16,1536,4096,ck,8,0,13.5333,a8w8_blockscale_1x128x128_256x16x64x256_16x16_16x16_1x1_16x16x1_16x16x1_1x16x1x16_4_1x1_intrawave_v1,0.93,465.42,0.0
256,32,1536,4096,ck,8,0,13.9034,a8w8_blockscale_1x128x128_256x16x64x256_16x16_16x16_1x1_16x16x1_16x16x1_1x16x1x16_4_1x1_intrawave_v1,21.72,464.89,0.0
256,48,1536,4096,ck,8,0,13.8133,a8w8_blockscale_1x128x128_256x16x64x256_16x16_16x16_1x1_16x16x1_16x16x1_1x16x1x16_4_1x1_intrawave_v1,36.44,476.22,0.0
256,64,1536,4096,ck,8,0,13.7676,a8w8_blockscale_1x128x128_256x16x64x256_16x16_16x16_1x1_16x16x1_16x16x1_1x16x1x16_4_1x1_intrawave_v1,51.18,486.13,0.0
256,768,1536,4096,ck,3,0,24.8201,a8w8_blockscale_1x128x128_256x64x64x128_16x16_32x32_1x1_8x32x1_8x32x1_1x32x1x8_8_1x1_intrawave_v3,389.35,475.28,0.0
256,832,1536,4096,ck,2,0,25.7589,a8w8_blockscale_1x128x128_256x64x128x128_16x16_32x32_1x2_8x32x1_8x32x1_1x32x1x8_8_1x1_intrawave_v3,399.09,471.59,0.0
256,864,1536,4096,ck,2,0,25.6811,a8w8_blockscale_1x128x128_256x64x128x128_16x16_32x32_1x2_8x32x1_8x32x1_1x32x1x8_8_1x1_intrawave_v3,408.63,477.77,0.0
256,896,1536,4096,ck,2,0,25.8585,a8w8_blockscale_1x128x128_256x64x128x128_16x16_32x32_1x2_8x32x1_8x32x1_1x32x1x8_8_1x1_intrawave_v3,420.91,483.08,0.0
256,928,1536,4096,ck,2,0,26.0381,a8w8_blockscale_1x128x128_256x64x128x128_16x16_32x32_1x2_8x32x1_8x32x1_1x32x1x8_8_1x1_intrawave_v3,434.44,489.11,0.0
256,960,1536,4096,ck,2,0,25.9117,a8w8_blockscale_1x128x128_256x64x128x128_16x16_32x32_1x2_8x32x1_8x32x1_1x32x1x8_8_1x1_intrawave_v3,451.61,500.07,0.0
256,992,1536,4096,ck,2,0,25.6287,a8w8_blockscale_1x128x128_256x64x128x128_16x16_32x32_1x2_8x32x1_8x32x1_1x32x1x8_8_1x1_intrawave_v3,472.31,514.54,0.0
256,1024,1536,4096,ck,2,0,25.9951,a8w8_blockscale_1x128x128_256x64x128x128_16x16_32x32_1x2_8x32x1_8x32x1_1x32x1x8_8_1x1_intrawave_v3,481.15,516.11,0.0
256,1216,1536,4096,ck,2,0,26.4181,a8w8_blockscale_1x128x128_256x64x128x128_16x16_32x32_1x2_8x32x1_8x32x1_1x32x1x8_8_1x1_intrawave_v3,570.61,563.2,0.0
256,1280,1536,4096,ck,2,0,26.0995,a8w8_blockscale_1x128x128_256x64x128x128_16x16_32x32_1x2_8x32x1_8x32x1_1x32x1x8_8_1x1_intrawave_v3,617.1,592.6,0.0
256,1536,1536,4096,ck,2,0,32.599,a8w8_blockscale_1x128x128_256x64x128x128_16x16_32x32_1x2_8x32x1_8x32x1_1x32x1x8_8_1x1_intrawave_v3,585.55,526.56,0.0
256,1728,1536,4096,ck,0,0,32.6376,a8w8_blockscale_1x128x128_256x128x128x128_16x16_32x32_2x2_8x32x1_8x32x1_1x32x1x8_8_1x1_intrawave_v3,648.08,561.96,0.0
256,1792,1536,4096,ck,0,0,33.1867,a8w8_blockscale_1x128x128_256x128x128x128_16x16_32x32_2x2_8x32x1_8x32x1_1x32x1x8_8_1x1_intrawave_v3,660.49,565.83,0.0
256,1920,1536,4096,ck,0,0,33.3321,a8w8_blockscale_1x128x128_256x128x128x128_16x16_32x32_2x2_8x32x1_8x32x1_1x32x1x8_8_1x1_intrawave_v3,705.55,590.68,0.0
256,1984,1536,4096,ck,0,0,33.5356,a8w8_blockscale_1x128x128_256x128x128x128_16x16_32x32_2x2_8x32x1_8x32x1_1x32x1x8_8_1x1_intrawave_v3,723.41,599.7,0.0
256,2048,1536,4096,ck,0,0,33.4431,a8w8_blockscale_1x128x128_256x128x128x128_16x16_32x32_2x2_8x32x1_8x32x1_1x32x1x8_8_1x1_intrawave_v3,763.41,623.01,0.0
256,2304,1536,4096,ck,0,0,34.0403,a8w8_blockscale_1x128x128_256x128x128x128_16x16_32x32_2x2_8x32x1_8x32x1_1x32x1x8_8_1x1_intrawave_v3,844.64,665.99,0.0
256,2560,1536,4096,ck,0,0,34.8244,a8w8_blockscale_1x128x128_256x128x128x128_16x16_32x32_2x2_8x32x1_8x32x1_1x32x1x8_8_1x1_intrawave_v3,917.4,703.27,0.0
256,2688,1536,4096,ck,0,0,35.4062,a8w8_blockscale_1x128x128_256x128x128x128_16x16_32x32_2x2_8x32x1_8x32x1_1x32x1x8_8_1x1_intrawave_v3,935.38,710.54,0.0
256,2816,1536,4096,ck,2,0,47.4877,a8w8_blockscale_1x128x128_256x64x128x128_16x16_32x32_1x2_8x32x1_8x32x1_1x32x1x8_8_1x1_intrawave_v3,740.6,554.38,0.0
256,3328,1536,4096,ck,0,0,51.1697,a8w8_blockscale_1x128x128_256x128x128x128_16x16_32x32_2x2_8x32x1_8x32x1_1x32x1x8_8_1x1_intrawave_v3,813.21,586.21,0.0
256,4096,1536,4096,ck,0,0,53.8425,a8w8_blockscale_1x128x128_256x128x128x128_16x16_32x32_2x2_8x32x1_8x32x1_1x32x1x8_8_1x1_intrawave_v3,952.32,659.35,0.0
256,6656,1536,4096,cktile,11,0,63.3827,a8w8_blockscale_cktile_192x256x128_4x2x1_16x16x128_intrawave_0x1x0_1,1303.9,842.04,0.0
256,6784,1536,4096,cktile,11,0,62.5579,a8w8_blockscale_cktile_192x256x128_4x2x1_16x16x128_intrawave_0x1x0_1,1341.4,864.72,0.0
256,6912,1536,4096,cktile,11,0,63.0361,a8w8_blockscale_cktile_192x256x128_4x2x1_16x16x128_intrawave_0x1x0_1,1356.58,872.6,0.0
256,7040,1536,4096,cktile,11,0,63.4734,a8w8_blockscale_cktile_192x256x128_4x2x1_16x16x128_intrawave_0x1x0_1,1378.75,884.54,0.0
256,7168,1536,4096,cktile,11,0,63.2258,a8w8_blockscale_cktile_192x256x128_4x2x1_16x16x128_intrawave_0x1x0_1,1401.67,897.98,0.0
256,7296,1536,4096,cktile,11,0,64.1727,a8w8_blockscale_cktile_192x256x128_4x2x1_16x16x128_intrawave_0x1x0_1,1407.85,900.04,0.0
256,7424,1536,4096,cktile,11,0,64.0284,a8w8_blockscale_cktile_192x256x128_4x2x1_16x16x128_intrawave_0x1x0_1,1435.39,915.95,0.0
256,7552,1536,4096,cktile,11,0,65.3259,a8w8_blockscale_cktile_192x256x128_4x2x1_16x16x128_intrawave_0x1x0_1,1430.18,911.03,0.0
256,7680,1536,4096,cktile,11,0,66.3576,a8w8_blockscale_cktile_192x256x128_4x2x1_16x16x128_intrawave_0x1x0_1,1438.1,914.04,0.0
256,7808,1536,4096,cktile,11,0,64.8436,a8w8_blockscale_cktile_192x256x128_4x2x1_16x16x128_intrawave_0x1x0_1,1493.02,947.54,0.0
256,7936,1536,4096,cktile,11,0,66.3028,a8w8_blockscale_cktile_192x256x128_4x2x1_16x16x128_intrawave_0x1x0_1,1483.13,939.77,0.0
256,8064,1536,4096,cktile,11,0,65.5579,a8w8_blockscale_cktile_192x256x128_4x2x1_16x16x128_intrawave_0x1x0_1,1523.78,964.01,0.0
256,8192,1536,4096,ck,0,0,92.8961,a8w8_blockscale_1x128x128_256x128x128x128_16x16_32x32_2x2_8x32x1_8x32x1_1x32x1x8_8_1x1_intrawave_v3,1097.43,692.89,0.0
256,9344,1536,4096,ck,0,0,104.9693,a8w8_blockscale_1x128x128_256x128x128x128_16x16_32x32_2x2_8x32x1_8x32x1_1x32x1x8_8_1x1_intrawave_v3,1105.94,689.95,0.0
256,9856,1536,4096,ck,0,0,108.5273,a8w8_blockscale_1x128x128_256x128x128x128_16x16_32x32_2x2_8x32x1_8x32x1_1x32x1x8_8_1x1_intrawave_v3,1137.16,705.77,0.0
256,12928,1536,4096,cktile,11,0,119.0589,a8w8_blockscale_cktile_192x256x128_4x2x1_16x16x128_intrawave_0x1x0_1,1355.75,825.16,0.0
256,13440,1536,4096,cktile,11,0,121.0141,a8w8_blockscale_cktile_192x256x128_4x2x1_16x16x128_intrawave_0x1x0_1,1391.13,844.46,0.0
256,13952,1536,4096,cktile,11,0,121.1648,a8w8_blockscale_cktile_192x256x128_4x2x1_16x16x128_intrawave_0x1x0_1,1447.14,876.31,0.0
256,14080,1536,4096,cktile,11,0,121.3987,a8w8_blockscale_cktile_192x256x128_4x2x1_16x16x128_intrawave_0x1x0_1,1446.43,875.8,0.0
256,14208,1536,4096,cktile,11,0,123.5068,a8w8_blockscale_cktile_192x256x128_4x2x1_16x16x128_intrawave_0x1x0_1,1439.67,871.07,0.0
256,14336,1536,4096,cktile,11,0,121.3408,a8w8_blockscale_cktile_192x256x128_4x2x1_16x16x128_intrawave_0x1x0_1,1474.39,891.75,0.0
256,14464,1536,4096,cktile,11,0,121.6819,a8w8_blockscale_cktile_192x256x128_4x2x1_16x16x128_intrawave_0x1x0_1,1486.7,898.62,0.0
256,14592,1536,4096,cktile,11,0,123.2762,a8w8_blockscale_cktile_192x256x128_4x2x1_16x16x128_intrawave_0x1x0_1,1485.54,897.29,0.0
256,14720,1536,4096,cktile,11,0,123.5111,a8w8_blockscale_cktile_192x256x128_4x2x1_16x16x128_intrawave_0x1x0_1,1488.32,898.78,0.0
256,14848,1536,4096,cktile,11,0,123.6003,a8w8_blockscale_cktile_192x256x128_4x2x1_16x16x128_intrawave_0x1x0_1,1507.1,909.44,0.0
256,14976,1536,4096,cktile,11,0,124.152,a8w8_blockscale_cktile_192x256x128_4x2x1_16x16x128_intrawave_0x1x0_1,1506.28,908.74,0.0
256,15104,1536,4096,cktile,11,0,123.1346,a8w8_blockscale_cktile_192x256x128_4x2x1_16x16x128_intrawave_0x1x0_1,1531.8,923.7,0.0
256,15232,1536,4096,cktile,11,0,122.6925,a8w8_blockscale_cktile_192x256x128_4x2x1_16x16x128_intrawave_0x1x0_1,1550.35,934.45,0.0
256,15360,1536,4096,cktile,11,0,122.6583,a8w8_blockscale_cktile_192x256x128_4x2x1_16x16x128_intrawave_0x1x0_1,1570.58,945.99,0.0
256,15488,1536,4096,cktile,11,0,125.1675,a8w8_blockscale_cktile_192x256x128_4x2x1_16x16x128_intrawave_0x1x0_1,1554.37,935.73,0.0
256,15616,1536,4096,cktile,11,0,125.0928,a8w8_blockscale_cktile_192x256x128_4x2x1_16x16x128_intrawave_0x1x0_1,1560.73,939.38,0.0
256,15744,1536,4096,cktile,11,0,123.7464,a8w8_blockscale_cktile_192x256x128_4x2x1_16x16x128_intrawave_0x1x0_1,1598.25,961.31,0.0
256,15872,1536,4096,cktile,11,0,124.5155,a8w8_blockscale_cktile_192x256x128_4x2x1_16x16x128_intrawave_0x1x0_1,1593.33,958.19,0.0
256,16128,1536,4096,cktile,11,0,125.1061,a8w8_blockscale_cktile_192x256x128_4x2x1_16x16x128_intrawave_0x1x0_1,1609.35,967.07,0.0
256,16256,1536,4096,cktile,11,0,125.7016,a8w8_blockscale_cktile_192x256x128_4x2x1_16x16x128_intrawave_0x1x0_1,1615.54,970.36,0.0
256,16384,1536,4096,cktile,11,0,153.7171,a8w8_blockscale_cktile_192x256x128_4x2x1_16x16x128_intrawave_0x1x0_1,1337.88,803.07,0.0
256,16,2560,4096,ck,8,0,13.4887,a8w8_blockscale_1x128x128_256x16x64x256_16x16_16x16_1x1_16x16x1_16x16x1_1x16x1x16_4_1x1_intrawave_v1,1.55,778.06,0.0
256,32,2560,4096,ck,8,0,13.7977,a8w8_blockscale_1x128x128_256x16x64x256_16x16_16x16_1x1_16x16x1_16x16x1_1x16x1x16_4_1x1_intrawave_v1,36.48,775.99,0.0
256,48,2560,4096,ck,8,0,13.8918,a8w8_blockscale_1x128x128_256x16x64x256_16x16_16x16_1x1_16x16x1_16x16x1_1x16x1x16_4_1x1_intrawave_v1,60.39,781.35,0.0
256,64,2560,4096,ck,8,0,13.6447,a8w8_blockscale_1x128x128_256x16x64x256_16x16_16x16_1x1_16x16x1_16x16x1_1x16x1x16_4_1x1_intrawave_v1,86.07,806.31,0.0
256,768,2560,4096,ck,2,0,25.9198,a8w8_blockscale_1x128x128_256x64x128x128_16x16_32x32_1x2_8x32x1_8x32x1_1x32x1x8_8_1x1_intrawave_v3,621.38,677.62,0.0
256,832,2560,4096,ck,2,0,32.0203,a8w8_blockscale_1x128x128_256x64x128x128_16x16_32x32_1x2_8x32x1_8x32x1_1x32x1x8_8_1x1_intrawave_v3,535.09,562.62,0.0
256,864,2560,4096,ck,2,0,32.4532,a8w8_blockscale_1x128x128_256x64x128x128_16x16_32x32_1x2_8x32x1_8x32x1_1x32x1x8_8_1x1_intrawave_v3,538.94,559.94,0.0
256,896,2560,4096,ck,2,0,32.484,a8w8_blockscale_1x128x128_256x64x128x128_16x16_32x32_1x2_8x32x1_8x32x1_1x32x1x8_8_1x1_intrawave_v3,558.44,568.21,0.0
256,928,2560,4096,ck,0,0,32.3089,a8w8_blockscale_1x128x128_256x128x128x128_16x16_32x32_2x2_8x32x1_8x32x1_1x32x1x8_8_1x1_intrawave_v3,583.54,580.98,0.0
256,960,2560,4096,ck,0,0,32.3746,a8w8_blockscale_1x128x128_256x128x128x128_16x16_32x32_2x2_8x32x1_8x32x1_1x32x1x8_8_1x1_intrawave_v3,602.43,588.63,0.0
256,992,2560,4096,ck,0,0,32.9496,a8w8_blockscale_1x128x128_256x128x128x128_16x16_32x32_2x2_8x32x1_8x32x1_1x32x1x8_8_1x1_intrawave_v3,612.29,587.31,0.0
256,1024,2560,4096,ck,0,0,33.0949,a8w8_blockscale_1x128x128_256x128x128x128_16x16_32x32_2x2_8x32x1_8x32x1_1x32x1x8_8_1x1_intrawave_v3,629.88,593.64,0.0
256,1216,2560,4096,ck,0,0,33.5298,a8w8_blockscale_1x128x128_256x128x128x128_16x16_32x32_2x2_8x32x1_8x32x1_1x32x1x8_8_1x1_intrawave_v3,749.3,642.01,0.0
256,1280,2560,4096,ck,0,0,32.9542,a8w8_blockscale_1x128x128_256x128x128x128_16x16_32x32_2x2_8x32x1_8x32x1_1x32x1x8_8_1x1_intrawave_v3,814.57,676.16,0.0
256,1536,2560,4096,ck,0,0,34.5836,a8w8_blockscale_1x128x128_256x128x128x128_16x16_32x32_2x2_8x32x1_8x32x1_1x32x1x8_8_1x1_intrawave_v3,919.91,707.46,0.0
256,1728,2560,4096,ck,0,0,48.472,a8w8_blockscale_1x128x128_256x128x128x128_16x16_32x32_2x2_8x32x1_8x32x1_1x32x1x8_8_1x1_intrawave_v3,727.29,535.94,0.0
256,1792,2560,4096,ck,2,0,48.5947,a8w8_blockscale_1x128x128_256x64x128x128_16x16_32x32_1x2_8x32x1_8x32x1_1x32x1x8_8_1x1_intrawave_v3,751.78,546.15,0.0
256,1920,2560,4096,ck,0,0,48.7042,a8w8_blockscale_1x128x128_256x128x128x128_16x16_32x32_2x2_8x32x1_8x32x1_1x32x1x8_8_1x1_intrawave_v3,804.77,568.95,0.0
256,1984,2560,4096,ck,2,0,50.6536,a8w8_blockscale_1x128x128_256x64x128x128_16x16_32x32_1x2_8x32x1_8x32x1_1x32x1x8_8_1x1_intrawave_v3,798.23,557.79,0.0
256,2048,2560,4096,ck,2,0,50.9098,a8w8_blockscale_1x128x128_256x64x128x128_16x16_32x32_1x2_8x32x1_8x32x1_1x32x1x8_8_1x1_intrawave_v3,835.82,573.27,0.0
256,2304,2560,4096,ck,0,0,49.8068,a8w8_blockscale_1x128x128_256x128x128x128_16x16_32x32_2x2_8x32x1_8x32x1_1x32x1x8_8_1x1_intrawave_v3,962.12,633.33,0.0
256,2560,2560,4096,ck,0,0,53.5352,a8w8_blockscale_1x128x128_256x128x128x128_16x16_32x32_2x2_8x32x1_8x32x1_1x32x1x8_8_1x1_intrawave_v3,994.61,632.95,0.0
256,2688,2560,4096,ck,0,0,57.2869,a8w8_blockscale_1x128x128_256x128x128x128_16x16_32x32_2x2_8x32x1_8x32x1_1x32x1x8_8_1x1_intrawave_v3,963.52,606.46,0.0
256,2816,2560,4096,ck,0,0,56.6235,a8w8_blockscale_1x128x128_256x128x128x128_16x16_32x32_2x2_8x32x1_8x32x1_1x32x1x8_8_1x1_intrawave_v3,1035.18,640.1,0.0
256,3328,2560,4096,cktile,11,0,60.5372,a8w8_blockscale_cktile_192x256x128_4x2x1_16x16x128_intrawave_0x1x0_1,1145.62,676.66,0.0
256,4096,2560,4096,cktile,11,0,61.9183,a8w8_blockscale_cktile_192x256x128_4x2x1_16x16x128_intrawave_0x1x0_1,1380.19,775.88,0.0
256,6656,2560,4096,cktile,11,0,113.8163,a8w8_blockscale_cktile_192x256x128_4x2x1_16x16x128_intrawave_0x1x0_1,1210.2,623.96,0.0
256,6784,2560,4096,cktile,11,0,114.4346,a8w8_blockscale_cktile_192x256x128_4x2x1_16x16x128_intrawave_0x1x0_1,1222.17,628.72,0.0
256,6912,2560,4096,cktile,11,0,114.8451,a8w8_blockscale_cktile_192x256x128_4x2x1_16x16x128_intrawave_0x1x0_1,1241.0,636.66,0.0
256,7040,2560,4096,cktile,11,0,114.2106,a8w8_blockscale_cktile_192x256x128_4x2x1_16x16x128_intrawave_0x1x0_1,1277.09,653.03,0.0
256,7168,2560,4096,cktile,11,0,114.1994,a8w8_blockscale_cktile_192x256x128_4x2x1_16x16x128_intrawave_0x1x0_1,1293.37,660.2,0.0
256,7296,2560,4096,cktile,11,0,114.9804,a8w8_blockscale_cktile_192x256x128_4x2x1_16x16x128_intrawave_0x1x0_1,1309.58,666.69,0.0
256,7424,2560,4096,cktile,11,0,115.9402,a8w8_blockscale_cktile_192x256x128_4x2x1_16x16x128_intrawave_0x1x0_1,1321.16,671.03,0.0
256,7552,2560,4096,cktile,11,0,115.9998,a8w8_blockscale_cktile_192x256x128_4x2x1_16x16x128_intrawave_0x1x0_1,1342.36,680.3,0.0
256,7680,2560,4096,cktile,11,0,116.1292,a8w8_blockscale_cktile_192x256x128_4x2x1_16x16x128_intrawave_0x1x0_1,1369.58,692.16,0.0
256,7808,2560,4096,cktile,11,0,116.0244,a8w8_blockscale_cktile_192x256x128_4x2x1_16x16x128_intrawave_0x1x0_1,1390.7,701.52,0.0
256,7936,2560,4096,cktile,11,0,116.1124,a8w8_blockscale_cktile_192x256x128_4x2x1_16x16x128_intrawave_0x1x0_1,1411.5,710.59,0.0
256,8064,2560,4096,cktile,11,0,116.4398,a8w8_blockscale_cktile_192x256x128_4x2x1_16x16x128_intrawave_0x1x0_1,1429.86,718.41,0.0
256,8192,2560,4096,cktile,11,0,117.5766,a8w8_blockscale_cktile_192x256x128_4x2x1_16x16x128_intrawave_0x1x0_1,1445.11,724.24,0.0
256,9344,2560,4096,cktile,11,0,119.6425,a8w8_blockscale_cktile_192x256x128_4x2x1_16x16x128_intrawave_0x1x0_1,1617.18,798.32,0.0
256,9856,2560,4096,cktile,11,0,150.6188,a8w8_blockscale_cktile_192x256x128_4x2x1_16x16x128_intrawave_0x1x0_1,1365.62,669.75,0.0
256,12928,2560,4096,cktile,11,0,173.5287,a8w8_blockscale_cktile_192x256x128_4x2x1_16x16x128_intrawave_0x1x0_1,1550.31,741.71,0.0
256,13440,2560,4096,cktile,11,0,173.4402,a8w8_blockscale_cktile_192x256x128_4x2x1_16x16x128_intrawave_0x1x0_1,1617.72,771.37,0.0
256,13952,2560,4096,cktile,11,0,176.0802,a8w8_blockscale_cktile_192x256x128_4x2x1_16x16x128_intrawave_0x1x0_1,1659.69,788.91,0.0
256,14080,2560,4096,cktile,11,0,175.8006,a8w8_blockscale_cktile_192x256x128_4x2x1_16x16x128_intrawave_0x1x0_1,1664.71,791.21,0.0
256,14208,2560,4096,cktile,11,0,179.189,a8w8_blockscale_cktile_192x256x128_4x2x1_16x16x128_intrawave_0x1x0_1,1653.83,785.3,0.0
256,14336,2560,4096,cktile,11,0,178.7295,a8w8_blockscale_cktile_192x256x128_4x2x1_16x16x128_intrawave_0x1x0_1,1668.29,791.8,0.0
256,14464,2560,4096,cktile,11,0,176.0461,a8w8_blockscale_cktile_192x256x128_4x2x1_16x16x128_intrawave_0x1x0_1,1712.66,812.2,0.0
256,14592,2560,4096,cktile,11,0,179.893,a8w8_blockscale_cktile_192x256x128_4x2x1_16x16x128_intrawave_0x1x0_1,1696.67,803.9,0.0
256,14720,2560,4096,cktile,11,0,184.2736,a8w8_blockscale_cktile_192x256x128_4x2x1_16x16x128_intrawave_0x1x0_1,1662.6,787.54,0.0
256,14848,2560,4096,cktile,11,0,207.7703,a8w8_blockscale_cktile_192x256x128_4x2x1_16x16x128_intrawave_0x1x0_1,1494.26,707.12,0.0
256,14976,2560,4096,cktile,11,0,207.2335,a8w8_blockscale_cktile_192x256x128_4x2x1_16x16x128_intrawave_0x1x0_1,1504.0,711.54,0.0
256,15104,2560,4096,cktile,11,0,213.5073,a8w8_blockscale_cktile_192x256x128_4x2x1_16x16x128_intrawave_0x1x0_1,1472.38,696.15,0.0
256,15232,2560,4096,cktile,11,0,223.4772,a8w8_blockscale_cktile_192x256x128_4x2x1_16x16x128_intrawave_0x1x0_1,1418.61,670.33,0.0
256,15360,2560,4096,cktile,11,0,224.57,a8w8_blockscale_cktile_192x256x128_4x2x1_16x16x128_intrawave_0x1x0_1,1429.73,674.99,0.0
256,15488,2560,4096,cktile,11,0,223.2144,a8w8_blockscale_cktile_192x256x128_4x2x1_16x16x128_intrawave_0x1x0_1,1452.69,685.37,0.0
256,15616,2560,4096,cktile,11,0,224.6208,a8w8_blockscale_cktile_192x256x128_4x2x1_16x16x128_intrawave_0x1x0_1,1448.64,683.29,0.0
256,15744,2560,4096,cktile,11,0,224.8475,a8w8_blockscale_cktile_192x256x128_4x2x1_16x16x128_intrawave_0x1x0_1,1466.02,690.88,0.0
256,15872,2560,4096,cktile,11,0,225.2821,a8w8_blockscale_cktile_192x256x128_4x2x1_16x16x128_intrawave_0x1x0_1,1467.75,691.55,0.0
256,16128,2560,4096,cktile,11,0,225.3868,a8w8_blockscale_cktile_192x256x128_4x2x1_16x16x128_intrawave_0x1x0_1,1488.84,700.8,0.0
256,16256,2560,4096,cktile,11,0,224.6703,a8w8_blockscale_cktile_192x256x128_4x2x1_16x16x128_intrawave_0x1x0_1,1506.47,708.7,0.0
256,16384,2560,4096,cktile,11,0,226.3441,a8w8_blockscale_cktile_192x256x128_4x2x1_16x16x128_intrawave_0x1x0_1,1514.32,711.8,0.0
256,16,4096,128,ck,8,0,2.8465,a8w8_blockscale_1x128x128_256x16x64x256_16x16_16x16_1x1_16x16x1_16x16x1_1x16x1x16_4_1x1_intrawave_v1,0.37,187.11,0.0
256,32,4096,128,ck,11,0,3.0103,a8w8_blockscale_1x128x128_256x32x64x128_16x16_16x16_2x1_8x32x1_8x32x1_1x32x1x8_8_2x1_intrawave_v1,8.36,240.5,0.0
256,48,4096,128,cktile,7,0,3.0027,a8w8_blockscale_cktile_32x128x128_1x4x1_16x16x64_intrawave_0x1x0_2,13.97,285.44,0.0
256,64,4096,128,ck,8,0,3.1557,a8w8_blockscale_1x128x128_256x16x64x256_16x16_16x16_1x1_16x16x1_16x16x1_1x16x1x16_4_1x1_intrawave_v1,18.61,313.78,0.0
256,768,4096,128,cktile,6,0,5.9999,a8w8_blockscale_cktile_32x128x128_1x4x1_16x16x64_intrawave_0x1x0_1,134.22,1152.36,0.0
256,832,4096,128,cktile,7,0,6.809,a8w8_blockscale_cktile_32x128x128_1x4x1_16x16x64_intrawave_0x1x0_2,125.82,1075.3,0.0
256,864,4096,128,cktile,10,0,6.0445,a8w8_blockscale_cktile_128x128x128_2x2x1_16x16x128_intrawave_0x1x0_2,144.68,1234.7,0.0
256,896,4096,128,cktile,7,0,6.6084,a8w8_blockscale_cktile_32x128x128_1x4x1_16x16x64_intrawave_0x1x0_2,137.25,1168.37,0.0
256,928,4096,128,cktile,7,0,6.2697,a8w8_blockscale_cktile_32x128x128_1x4x1_16x16x64_intrawave_0x1x0_2,150.35,1276.61,0.0
256,960,4096,128,cktile,4,0,6.3954,a8w8_blockscale_cktile_32x128x128_1x4x1_16x16x128_intrawave_0x1x0_1,152.48,1291.85,0.0
256,992,4096,128,cktile,10,0,6.2668,a8w8_blockscale_cktile_128x128x128_2x2x1_16x16x128_intrawave_0x1x0_2,160.96,1360.84,0.0
256,1024,4096,128,cktile,4,0,6.5738,a8w8_blockscale_cktile_32x128x128_1x4x1_16x16x128_intrawave_0x1x0_1,158.55,1337.79,0.0
256,1216,4096,128,cktile,7,0,7.388,a8w8_blockscale_cktile_32x128x128_1x4x1_16x16x64_intrawave_0x1x0_2,170.03,1420.09,0.0
256,1280,4096,128,cktile,7,0,7.3956,a8w8_blockscale_cktile_32x128x128_1x4x1_16x16x64_intrawave_0x1x0_2,181.48,1510.88,0.0
256,1536,4096,128,cktile,10,0,7.9103,a8w8_blockscale_cktile_128x128x128_2x2x1_16x16x128_intrawave_0x1x0_2,201.09,1661.85,0.0
256,1728,4096,128,cktile,10,0,8.1348,a8w8_blockscale_cktile_128x128x128_2x2x1_16x16x128_intrawave_0x1x0_2,216.68,1783.72,0.0
256,1792,4096,128,cktile,10,0,8.2479,a8w8_blockscale_cktile_128x128x128_2x2x1_16x16x128_intrawave_0x1x0_2,221.46,1820.79,0.0
256,1920,4096,128,cktile,10,0,8.4457,a8w8_blockscale_cktile_128x128x128_2x2x1_16x16x128_intrawave_0x1x0_2,232.05,1903.26,0.0
256,1984,4096,128,cktile,10,0,8.5324,a8w8_blockscale_cktile_128x128x128_2x2x1_16x16x128_intrawave_0x1x0_2,236.94,1941.45,0.0
256,2048,4096,128,cktile,10,0,8.5809,a8w8_blockscale_cktile_128x128x128_2x2x1_16x16x128_intrawave_0x1x0_2,247.94,2028.41,0.0
256,2304,4096,128,cktile,10,0,9.8474,a8w8_blockscale_cktile_128x128x128_2x2x1_16x16x128_intrawave_0x1x0_2,243.31,1983.82,0.0
256,2560,4096,128,cktile,10,0,10.024,a8w8_blockscale_cktile_128x128x128_2x2x1_16x16x128_intrawave_0x1x0_2,265.6,2159.69,0.0
256,2688,4096,128,cktile,10,0,10.1261,a8w8_blockscale_cktile_128x128x128_2x2x1_16x16x128_intrawave_0x1x0_2,272.55,2214.33,0.0
256,2816,4096,128,cktile,10,0,10.1401,a8w8_blockscale_cktile_128x128x128_2x2x1_16x16x128_intrawave_0x1x0_2,289.03,2345.02,0.0
256,3328,4096,128,cktile,10,0,11.5838,a8w8_blockscale_cktile_128x128x128_2x2x1_16x16x128_intrawave_0x1x0_2,299.35,2420.49,0.0
256,4096,4096,128,cktile,10,0,12.0446,a8w8_blockscale_cktile_128x128x128_2x2x1_16x16x128_intrawave_0x1x0_2,354.76,2858.4,0.0
256,6656,4096,128,cktile,10,0,19.2867,a8w8_blockscale_cktile_128x128x128_2x2x1_16x16x128_intrawave_0x1x0_2,357.09,2860.52,0.0
256,6784,4096,128,cktile,10,0,19.3267,a8w8_blockscale_cktile_128x128x128_2x2x1_16x16x128_intrawave_0x1x0_2,361.83,2898.08,0.0
256,6912,4096,128,cktile,10,0,19.7588,a8w8_blockscale_cktile_128x128x128_2x2x1_16x16x128_intrawave_0x1x0_2,360.66,2888.18,0.0
256,7040,4096,128,cktile,10,0,19.6722,a8w8_blockscale_cktile_128x128x128_2x2x1_16x16x128_intrawave_0x1x0_2,370.72,2968.14,0.0
256,7168,4096,128,cktile,10,0,19.7675,a8w8_blockscale_cktile_128x128x128_2x2x1_16x16x128_intrawave_0x1x0_2,373.6,2990.87,0.0
256,7296,4096,128,cktile,10,0,19.998,a8w8_blockscale_cktile_128x128x128_2x2x1_16x16x128_intrawave_0x1x0_2,376.48,3013.4,0.0
256,7424,4096,128,cktile,10,0,20.7839,a8w8_blockscale_cktile_128x128x128_2x2x1_16x16x128_intrawave_0x1x0_2,368.5,2949.09,0.0
256,7552,4096,128,cktile,10,0,21.2801,a8w8_blockscale_cktile_128x128x128_2x2x1_16x16x128_intrawave_0x1x0_2,365.87,2927.63,0.0
256,7680,4096,128,cktile,10,0,21.5823,a8w8_blockscale_cktile_128x128x128_2x2x1_16x16x128_intrawave_0x1x0_2,368.47,2947.93,0.0
256,7808,4096,128,cktile,10,0,21.7156,a8w8_blockscale_cktile_128x128x128_2x2x1_16x16x128_intrawave_0x1x0_2,371.52,2971.98,0.0
256,7936,4096,128,cktile,10,0,21.6147,a8w8_blockscale_cktile_128x128x128_2x2x1_16x16x128_intrawave_0x1x0_2,379.12,3032.43,0.0
256,8064,4096,128,cktile,10,0,21.6541,a8w8_blockscale_cktile_128x128x128_2x2x1_16x16x128_intrawave_0x1x0_2,384.44,3074.56,0.0
256,8192,4096,128,cktile,10,0,21.4001,a8w8_blockscale_cktile_128x128x128_2x2x1_16x16x128_intrawave_0x1x0_2,396.99,3174.42,0.0
256,9344,4096,128,cktile,10,0,25.3628,a8w8_blockscale_cktile_128x128x128_2x2x1_16x16x128_intrawave_0x1x0_2,381.43,3047.16,0.0
256,9856,4096,128,cktile,10,0,26.0802,a8w8_blockscale_cktile_128x128x128_2x2x1_16x16x128_intrawave_0x1x0_2,394.34,3149.01,0.0
256,12928,4096,128,cktile,10,0,32.6785,a8w8_blockscale_cktile_128x128x128_2x2x1_16x16x128_intrawave_0x1x0_2,411.62,3282.07,0.0
256,13440,4096,128,cktile,10,0,34.473,a8w8_blockscale_cktile_128x128x128_2x2x1_16x16x128_intrawave_0x1x0_2,406.95,3244.21,0.0
256,13952,4096,128,cktile,10,0,34.459,a8w8_blockscale_cktile_128x128x128_2x2x1_16x16x128_intrawave_0x1x0_2,424.04,3379.77,0.0
256,14080,4096,128,cktile,10,0,34.5673,a8w8_blockscale_cktile_128x128x128_2x2x1_16x16x128_intrawave_0x1x0_2,423.32,3373.99,0.0
256,14208,4096,128,cktile,10,0,34.482,a8w8_blockscale_cktile_128x128x128_2x2x1_16x16x128_intrawave_0x1x0_2,429.71,3424.81,0.0
256,14336,4096,128,cktile,10,0,34.9786,a8w8_blockscale_cktile_128x128x128_2x2x1_16x16x128_intrawave_0x1x0_2,426.22,3396.88,0.0
256,14464,4096,128,cktile,10,0,37.0419,a8w8_blockscale_cktile_128x128x128_2x2x1_16x16x128_intrawave_0x1x0_2,406.98,3243.38,0.0
256,14592,4096,128,cktile,10,0,36.9443,a8w8_blockscale_cktile_128x128x128_2x2x1_16x16x128_intrawave_0x1x0_2,413.08,3291.81,0.0
256,14720,4096,128,cktile,10,0,37.2231,a8w8_blockscale_cktile_128x128x128_2x2x1_16x16x128_intrawave_0x1x0_2,411.54,3279.45,0.0
256,14848,4096,128,cktile,10,0,37.1027,a8w8_blockscale_cktile_128x128x128_2x2x1_16x16x128_intrawave_0x1x0_2,418.38,3333.82,0.0
256,14976,4096,128,cktile,10,0,36.9378,a8w8_blockscale_cktile_128x128x128_2x2x1_16x16x128_intrawave_0x1x0_2,421.9,3361.76,0.0
256,15104,4096,128,cktile,10,0,37.0131,a8w8_blockscale_cktile_128x128x128_2x2x1_16x16x128_intrawave_0x1x0_2,424.66,3383.7,0.0
256,15232,4096,128,cktile,10,0,37.5724,a8w8_blockscale_cktile_128x128x128_2x2x1_16x16x128_intrawave_0x1x0_2,421.89,3361.45,0.0
256,15360,4096,128,cktile,10,0,37.439,a8w8_blockscale_cktile_128x128x128_2x2x1_16x16x128_intrawave_0x1x0_2,428.8,3416.32,0.0
256,15488,4096,128,cktile,10,0,38.968,a8w8_blockscale_cktile_128x128x128_2x2x1_16x16x128_intrawave_0x1x0_2,416.06,3314.72,0.0
256,15616,4096,128,cktile,10,0,38.9141,a8w8_blockscale_cktile_128x128x128_2x2x1_16x16x128_intrawave_0x1x0_2,418.09,3330.86,0.0
256,15744,4096,128,cktile,10,0,39.0477,a8w8_blockscale_cktile_128x128x128_2x2x1_16x16x128_intrawave_0x1x0_2,422.09,3362.5,0.0
256,15872,4096,128,cktile,10,0,39.3741,a8w8_blockscale_cktile_128x128x128_2x2x1_16x16x128_intrawave_0x1x0_2,419.89,3344.98,0.0
256,16128,4096,128,cktile,10,0,39.0049,a8w8_blockscale_cktile_128x128x128_2x2x1_16x16x128_intrawave_0x1x0_2,430.16,3426.56,0.0
256,16256,4096,128,cktile,10,0,38.733,a8w8_blockscale_cktile_128x128x128_2x2x1_16x16x128_intrawave_0x1x0_2,436.91,3480.26,0.0
256,16384,4096,128,cktile,10,0,39.0112,a8w8_blockscale_cktile_128x128x128_2x2x1_16x16x128_intrawave_0x1x0_2,439.31,3499.16,0.0
256,256,256,4096,ck,8,0,11.6735,a8w8_blockscale_1x128x128_256x16x64x256_16x16_16x16_1x1_16x16x1_16x16x1_1x16x1x16_4_1x1_intrawave_v1,45.99,190.88,0.0
256,256,1024,4096,ck,8,0,13.1167,a8w8_blockscale_1x128x128_256x16x64x256_16x16_16x16_1x1_16x16x1_16x16x1_1x16x1x16_4_1x1_intrawave_v1,163.72,439.68,0.0
256,256,1536,4096,ck,18,0,16.0602,a8w8_blockscale_1x128x128_256x64x64x256_16x16_32x32_1x1_16x16x1_16x16x1_1x32x1x8_8_1x1_intrawave_v1,200.57,506.0,0.0
256,256,2560,4096,ck,18,0,16.2721,a8w8_blockscale_1x128x128_256x64x64x256_16x16_32x32_1x1_16x16x1_16x16x1_1x32x1x8_8_1x1_intrawave_v1,329.93,789.39,0.0
256,256,4096,128,cktile,7,0,3.9178,a8w8_blockscale_cktile_32x128x128_1x4x1_16x16x64_intrawave_0x1x0_2,68.52,677.47,0.0
