aiter/configs/model_configs/a8w8_blockscale_bpreshuffle_tuned_gemm_qwen3_5_35b_a3b.csv
cu_num,M,N,K,libtype,kernelId,splitK,us,kernelName,tflops,bw,errRatio
80,1,2048,4096,ck,7,0,11.7534,a8w8_blockscale_bpreshuffle_1x128x128_256x16x64x256_16x16_16x16_16x16x1_16x16x1_1x16x1x16_4_1x1_intrawave_v1,1.43,714.41,0.0
80,1,9216,2048,ck,7,0,8.7548,a8w8_blockscale_bpreshuffle_1x128x128_256x16x64x256_16x16_16x16_16x16x1_16x16x1_1x16x1x16_4_1x1_intrawave_v1,4.31,2158.23,0.0
80,1,12288,2048,ck,7,0,10.3136,a8w8_blockscale_bpreshuffle_1x128x128_256x16x64x256_16x16_16x16_16x16x1_16x16x1_1x16x1x16_4_1x1_intrawave_v1,4.88,2442.64,0.0
80,2,2048,4096,ck,7,0,11.8087,a8w8_blockscale_bpreshuffle_1x128x128_256x16x64x256_16x16_16x16_16x16x1_16x16x1_1x16x1x16_4_1x1_intrawave_v1,2.84,711.76,0.0
80,2,9216,2048,ck,7,0,8.8276,a8w8_blockscale_bpreshuffle_1x128x128_256x16x64x256_16x16_16x16_16x16x1_16x16x1_1x16x1x16_4_1x1_intrawave_v1,8.55,2142.75,0.0
80,2,12288,2048,ck,7,0,10.2737,a8w8_blockscale_bpreshuffle_1x128x128_256x16x64x256_16x16_16x16_16x16x1_16x16x1_1x16x1x16_4_1x1_intrawave_v1,9.8,2454.72,0.0
80,4,2048,4096,ck,7,0,11.7857,a8w8_blockscale_bpreshuffle_1x128x128_256x16x64x256_16x16_16x16_16x16x1_16x16x1_1x16x1x16_4_1x1_intrawave_v1,5.69,714.54,0.0
80,4,9216,2048,ck,7,0,8.7812,a8w8_blockscale_bpreshuffle_1x128x128_256x16x64x256_16x16_16x16_16x16x1_16x16x1_1x16x1x16_4_1x1_intrawave_v1,17.2,2158.74,0.0
80,4,12288,2048,ck,7,0,10.399,a8w8_blockscale_bpreshuffle_1x128x128_256x16x64x256_16x16_16x16_16x16x1_16x16x1_1x16x1x16_4_1x1_intrawave_v1,19.36,2430.26,0.0
80,8,2048,4096,ck,7,0,11.9631,a8w8_blockscale_bpreshuffle_1x128x128_256x16x64x256_16x16_16x16_16x16x1_16x16x1_1x16x1x16_4_1x1_intrawave_v1,11.22,706.69,0.0
80,8,9216,2048,ck,7,0,8.9105,a8w8_blockscale_bpreshuffle_1x128x128_256x16x64x256_16x16_16x16_16x16x1_16x16x1_1x16x1x16_4_1x1_intrawave_v1,33.89,2136.6,0.0
80,8,12288,2048,ck,7,0,10.6942,a8w8_blockscale_bpreshuffle_1x128x128_256x16x64x256_16x16_16x16_16x16x1_16x16x1_1x16x1x16_4_1x1_intrawave_v1,37.65,2373.14,0.0
80,16,2048,4096,ck,7,0,10.6956,a8w8_blockscale_bpreshuffle_1x128x128_256x16x64x256_16x16_16x16_16x16x1_16x16x1_1x16x1x16_4_1x1_intrawave_v1,25.1,796.56,0.0
80,16,9216,2048,ck,7,0,8.8039,a8w8_blockscale_bpreshuffle_1x128x128_256x16x64x256_16x16_16x16_16x16x1_16x16x1_1x16x1x16_4_1x1_intrawave_v1,68.6,2181.08,0.0
80,16,12288,2048,ck,7,0,11.3345,a8w8_blockscale_bpreshuffle_1x128x128_256x16x64x256_16x16_16x16_16x16x1_16x16x1_1x16x1x16_4_1x1_intrawave_v1,71.05,2257.87,0.0
80,32,2048,4096,ck,7,0,11.0289,a8w8_blockscale_bpreshuffle_1x128x128_256x16x64x256_16x16_16x16_16x16x1_16x16x1_1x16x1x16_4_1x1_intrawave_v1,48.68,784.37,0.0
80,32,9216,2048,ck,12,0,11.1186,a8w8_blockscale_bpreshuffle_1x128x128_256x32x64x256_16x16_16x16_16x16x1_16x16x1_1x32x1x8_8_2x1_intrawave_v1,108.64,1756.49,0.0
80,32,12288,2048,ck,10,0,14.3054,a8w8_blockscale_bpreshuffle_1x128x128_256x32x64x128_16x16_16x16_8x32x1_8x32x1_1x32x1x8_8_2x1_intrawave_v1,112.59,1818.74,0.0
80,48,2048,4096,ck,7,0,11.9772,a8w8_blockscale_bpreshuffle_1x128x128_256x16x64x256_16x16_16x16_16x16x1_16x16x1_1x16x1x16_4_1x1_intrawave_v1,67.24,733.21,0.0
80,48,9216,2048,ck,9,0,15.0429,a8w8_blockscale_bpreshuffle_1x128x128_256x32x128x128_16x16_16x16_8x32x1_8x32x1_1x32x1x8_8_2x1_intrawave_v1,120.45,1320.05,0.0
80,48,12288,2048,ck,3,0,19.1793,a8w8_blockscale_bpreshuffle_1x128x128_256x16x256x128_8x16_16x16_16x16x1_8x32x1_1x16x1x16_8_1x2_intrawave_v1,125.96,1378.77,0.0
80,64,2048,4096,ck,12,0,12.5578,a8w8_blockscale_bpreshuffle_1x128x128_256x32x64x256_16x16_16x16_16x16x1_16x16x1_1x32x1x8_8_2x1_intrawave_v1,85.5,709.75,0.0
80,64,9216,2048,ck,9,0,15.4342,a8w8_blockscale_bpreshuffle_1x128x128_256x32x128x128_16x16_16x16_8x32x1_8x32x1_1x32x1x8_8_2x1_intrawave_v1,156.53,1307.82,0.0
80,64,12288,2048,ck,12,0,21.089,a8w8_blockscale_bpreshuffle_1x128x128_256x32x64x256_16x16_16x16_16x16x1_16x16x1_1x32x1x8_8_2x1_intrawave_v1,152.74,1274.11,0.0
80,80,2048,4096,ck,6,0,13.1918,a8w8_blockscale_bpreshuffle_1x128x128_256x16x128x256_16x16_16x16_16x16x1_16x16x1_1x16x1x16_8_1x2_intrawave_v1,101.74,685.57,0.0
80,80,9216,2048,ck,9,0,19.3637,a8w8_blockscale_bpreshuffle_1x128x128_256x32x128x128_16x16_16x16_8x32x1_8x32x1_1x32x1x8_8_2x1_intrawave_v1,155.96,1059.34,0.0
80,80,12288,2048,ck,8,0,24.5257,a8w8_blockscale_bpreshuffle_1x128x128_256x32x256x128_16x16_16x16_8x32x1_8x32x1_1x32x1x8_8_2x1_intrawave_v1,164.18,1112.94,0.0
80,96,2048,4096,ck,12,0,15.0538,a8w8_blockscale_bpreshuffle_1x128x128_256x32x64x256_16x16_16x16_16x16x1_16x16x1_1x32x1x8_8_2x1_intrawave_v1,106.99,609.48,0.0
80,96,9216,2048,ck,9,0,20.2642,a8w8_blockscale_bpreshuffle_1x128x128_256x32x128x128_16x16_16x16_8x32x1_8x32x1_1x32x1x8_8_2x1_intrawave_v1,178.83,1028.44,0.0
80,96,12288,2048,ck,8,0,24.276,a8w8_blockscale_bpreshuffle_1x128x128_256x32x256x128_16x16_16x16_8x32x1_8x32x1_1x32x1x8_8_2x1_intrawave_v1,199.04,1141.94,0.0
80,112,2048,4096,ck,7,0,17.8827,a8w8_blockscale_bpreshuffle_1x128x128_256x16x64x256_16x16_16x16_16x16x1_16x16x1_1x16x1x16_4_1x1_intrawave_v1,105.08,520.4,0.0
80,112,9216,2048,ck,8,0,24.3464,a8w8_blockscale_bpreshuffle_1x128x128_256x32x256x128_16x16_16x16_8x32x1_8x32x1_1x32x1x8_8_2x1_intrawave_v1,173.65,869.46,0.0
80,112,12288,2048,ck,9,0,30.9223,a8w8_blockscale_bpreshuffle_1x128x128_256x32x128x128_16x16_16x16_8x32x1_8x32x1_1x32x1x8_8_2x1_intrawave_v1,182.3,910.27,0.0
80,128,2048,4096,ck,12,0,16.9344,a8w8_blockscale_bpreshuffle_1x128x128_256x32x64x256_16x16_16x16_16x16x1_16x16x1_1x32x1x8_8_2x1_intrawave_v1,126.81,557.28,0.0
80,128,9216,2048,ck,14,0,23.7177,a8w8_blockscale_bpreshuffle_1x128x128_256x64x128x128_16x16_16x16_8x32x1_8x32x1_1x32x1x8_8_2x1_intrawave_v1,203.72,906.32,0.0
80,128,12288,2048,ck,9,0,31.1959,a8w8_blockscale_bpreshuffle_1x128x128_256x32x128x128_16x16_16x16_8x32x1_8x32x1_1x32x1x8_8_2x1_intrawave_v1,206.52,915.94,0.0
80,144,2048,4096,ck,6,0,18.8362,a8w8_blockscale_bpreshuffle_1x128x128_256x16x128x256_16x16_16x16_16x16x1_16x16x1_1x16x1x16_8_1x2_intrawave_v1,128.26,507.97,0.0
80,144,9216,2048,ck,9,0,29.3153,a8w8_blockscale_bpreshuffle_1x128x128_256x32x128x128_16x16_16x16_8x32x1_8x32x1_1x32x1x8_8_2x1_intrawave_v1,185.43,744.44,0.0
80,144,12288,2048,ck,8,0,34.1146,a8w8_blockscale_bpreshuffle_1x128x128_256x32x256x128_16x16_16x16_8x32x1_8x32x1_1x32x1x8_8_2x1_intrawave_v1,212.45,850.07,0.0
80,160,2048,4096,ck,11,0,17.0076,a8w8_blockscale_bpreshuffle_1x128x128_256x32x128x256_16x16_16x16_16x16x1_16x16x1_1x32x1x8_8_2x1_intrawave_v1,157.83,570.29,0.0
80,160,9216,2048,ck,9,0,30.7942,a8w8_blockscale_bpreshuffle_1x128x128_256x32x128x128_16x16_16x16_8x32x1_8x32x1_1x32x1x8_8_2x1_intrawave_v1,196.13,719.33,0.0
80,160,12288,2048,ck,8,0,36.0453,a8w8_blockscale_bpreshuffle_1x128x128_256x32x256x128_16x16_16x16_8x32x1_8x32x1_1x32x1x8_8_2x1_intrawave_v1,223.42,816.35,0.0
80,176,2048,4096,ck,10,0,21.8787,a8w8_blockscale_bpreshuffle_1x128x128_256x32x64x128_16x16_16x16_8x32x1_8x32x1_1x32x1x8_8_2x1_intrawave_v1,134.96,449.31,0.0
80,176,9216,2048,ck,8,0,32.0814,a8w8_blockscale_bpreshuffle_1x128x128_256x32x256x128_16x16_16x16_8x32x1_8x32x1_1x32x1x8_8_2x1_intrawave_v1,207.09,700.68,0.0
80,176,12288,2048,ck,8,0,41.9108,a8w8_blockscale_bpreshuffle_1x128x128_256x32x256x128_16x16_16x16_8x32x1_8x32x1_1x32x1x8_8_2x1_intrawave_v1,211.36,712.27,0.0
80,192,2048,4096,ck,12,0,21.4071,a8w8_blockscale_bpreshuffle_1x128x128_256x32x64x256_16x16_16x16_16x16x1_16x16x1_1x32x1x8_8_2x1_intrawave_v1,150.47,465.33,0.0
80,192,9216,2048,ck,14,0,30.8229,a8w8_blockscale_bpreshuffle_1x128x128_256x64x128x128_16x16_16x16_8x32x1_8x32x1_1x32x1x8_8_2x1_intrawave_v1,235.14,739.92,0.0
80,192,12288,2048,ck,13,0,38.9683,a8w8_blockscale_bpreshuffle_1x128x128_256x64x256x128_16x16_16x16_8x32x1_8x32x1_1x32x1x8_8_2x1_intrawave_v1,247.99,776.98,0.0
80,208,2048,4096,ck,10,0,22.3995,a8w8_blockscale_bpreshuffle_1x128x128_256x32x64x128_16x16_16x16_8x32x1_8x32x1_1x32x1x8_8_2x1_intrawave_v1,155.79,450.57,0.0
80,208,9216,2048,ck,9,0,38.3496,a8w8_blockscale_bpreshuffle_1x128x128_256x32x128x128_16x16_16x16_8x32x1_8x32x1_1x32x1x8_8_2x1_intrawave_v1,204.74,603.25,0.0
80,208,12288,2048,ck,9,0,48.3681,a8w8_blockscale_bpreshuffle_1x128x128_256x32x128x128_16x16_16x16_8x32x1_8x32x1_1x32x1x8_8_2x1_intrawave_v1,216.44,634.79,0.0
80,224,2048,4096,ck,12,0,22.1433,a8w8_blockscale_bpreshuffle_1x128x128_256x32x64x256_16x16_16x16_16x16x1_16x16x1_1x32x1x8_8_2x1_intrawave_v1,169.72,461.7,0.0
80,224,9216,2048,ck,9,0,39.0619,a8w8_blockscale_bpreshuffle_1x128x128_256x32x128x128_16x16_16x16_8x32x1_8x32x1_1x32x1x8_8_2x1_intrawave_v1,216.47,600.63,0.0
80,224,12288,2048,ck,9,0,49.1653,a8w8_blockscale_bpreshuffle_1x128x128_256x32x128x128_16x16_16x16_8x32x1_8x32x1_1x32x1x8_8_2x1_intrawave_v1,229.31,633.16,0.0
80,240,2048,4096,ck,9,0,23.8772,a8w8_blockscale_bpreshuffle_1x128x128_256x32x128x128_16x16_16x16_8x32x1_8x32x1_1x32x1x8_8_2x1_intrawave_v1,168.64,433.66,0.0
80,240,9216,2048,ck,8,0,41.4934,a8w8_blockscale_bpreshuffle_1x128x128_256x32x256x128_16x16_16x16_8x32x1_8x32x1_1x32x1x8_8_2x1_intrawave_v1,218.34,573.33,0.0
80,240,12288,2048,ck,8,0,49.6713,a8w8_blockscale_bpreshuffle_1x128x128_256x32x256x128_16x16_16x16_8x32x1_8x32x1_1x32x1x8_8_2x1_intrawave_v1,243.19,635.29,0.0
80,256,2048,4096,ck,9,0,24.3705,a8w8_blockscale_bpreshuffle_1x128x128_256x32x128x128_16x16_16x16_8x32x1_8x32x1_1x32x1x8_8_2x1_intrawave_v1,176.24,430.26,0.0
80,256,9216,2048,ck,13,0,38.6822,a8w8_blockscale_bpreshuffle_1x128x128_256x64x256x128_16x16_16x16_8x32x1_8x32x1_1x32x1x8_8_2x1_intrawave_v1,249.82,623.47,0.0
80,256,12288,2048,ck,14,0,48.0805,a8w8_blockscale_bpreshuffle_1x128x128_256x64x128x128_16x16_16x16_8x32x1_8x32x1_1x32x1x8_8_2x1_intrawave_v1,267.99,665.17,0.0
80,288,2048,4096,ck,11,0,24.7641,a8w8_blockscale_bpreshuffle_1x128x128_256x32x128x256_16x16_16x16_16x16x1_16x16x1_1x32x1x8_8_2x1_intrawave_v1,195.11,434.01,0.0
80,288,9216,2048,ck,9,0,46.7259,a8w8_blockscale_bpreshuffle_1x128x128_256x32x128x128_16x16_16x16_8x32x1_8x32x1_1x32x1x8_8_2x1_intrawave_v1,232.67,530.17,0.0
80,288,12288,2048,ck,9,0,58.3026,a8w8_blockscale_bpreshuffle_1x128x128_256x32x128x128_16x16_16x16_8x32x1_8x32x1_1x32x1x8_8_2x1_intrawave_v1,248.63,563.16,0.0
80,512,2048,4096,ck,14,0,37.4145,a8w8_blockscale_bpreshuffle_1x128x128_256x64x128x128_16x16_16x16_8x32x1_8x32x1_1x32x1x8_8_2x1_intrawave_v1,229.59,336.31,0.0
80,512,9216,2048,ck,14,0,70.3699,a8w8_blockscale_bpreshuffle_1x128x128_256x64x128x128_16x16_16x16_8x32x1_8x32x1_1x32x1x8_8_2x1_intrawave_v1,274.65,417.23,0.0
80,512,12288,2048,ck,13,0,87.2381,a8w8_blockscale_bpreshuffle_1x128x128_256x64x256x128_16x16_16x16_8x32x1_8x32x1_1x32x1x8_8_2x1_intrawave_v1,295.4,444.73,0.0
80,992,2048,4096,ck,9,0,68.1943,a8w8_blockscale_bpreshuffle_1x128x128_256x32x128x128_16x16_16x16_8x32x1_8x32x1_1x32x1x8_8_2x1_intrawave_v1,244.05,242.18,0.0
80,992,9216,2048,ck,9,0,136.4313,a8w8_blockscale_bpreshuffle_1x128x128_256x32x128x128_16x16_16x16_8x32x1_8x32x1_1x32x1x8_8_2x1_intrawave_v1,274.47,287.25,0.0
80,992,12288,2048,ck,9,0,179.1904,a8w8_blockscale_bpreshuffle_1x128x128_256x32x128x128_16x16_16x16_8x32x1_8x32x1_1x32x1x8_8_2x1_intrawave_v1,278.64,287.83,0.0
80,1024,2048,4096,ck,13,0,66.0706,a8w8_blockscale_bpreshuffle_1x128x128_256x64x256x128_16x16_16x16_8x32x1_8x32x1_1x32x1x8_8_2x1_intrawave_v1,260.02,253.93,0.0
80,1024,9216,2048,ck,14,0,125.5335,a8w8_blockscale_bpreshuffle_1x128x128_256x64x128x128_16x16_16x16_8x32x1_8x32x1_1x32x1x8_8_2x1_intrawave_v1,307.92,317.41,0.0
80,1024,12288,2048,ck,13,0,164.5296,a8w8_blockscale_bpreshuffle_1x128x128_256x64x256x128_16x16_16x16_8x32x1_8x32x1_1x32x1x8_8_2x1_intrawave_v1,313.25,318.66,0.0
80,2048,2048,4096,ck,14,0,110.1838,a8w8_blockscale_bpreshuffle_1x128x128_256x64x128x128_16x16_16x16_8x32x1_8x32x1_1x32x1x8_8_2x1_intrawave_v1,311.84,228.4,0.0
80,2048,9216,2048,ck,14,0,235.8915,a8w8_blockscale_bpreshuffle_1x128x128_256x64x128x128_16x16_16x16_8x32x1_8x32x1_1x32x1x8_8_2x1_intrawave_v1,327.73,257.82,0.0
80,2048,12288,2048,ck,14,0,314.9699,a8w8_blockscale_bpreshuffle_1x128x128_256x64x128x128_16x16_16x16_8x32x1_8x32x1_1x32x1x8_8_2x1_intrawave_v1,327.27,253.01,0.0
80,4096,2048,4096,ck,14,0,198.6944,a8w8_blockscale_bpreshuffle_1x128x128_256x64x128x128_16x16_16x16_8x32x1_8x32x1_1x32x1x8_8_2x1_intrawave_v1,345.86,211.09,0.0
80,4096,9216,2048,ck,13,0,456.1365,a8w8_blockscale_bpreshuffle_1x128x128_256x64x256x128_16x16_16x16_8x32x1_8x32x1_1x32x1x8_8_2x1_intrawave_v1,338.97,225.28,0.0
80,4096,12288,2048,ck,14,0,606.4791,a8w8_blockscale_bpreshuffle_1x128x128_256x64x128x128_16x16_16x16_8x32x1_8x32x1_1x32x1x8_8_2x1_intrawave_v1,339.93,221.31,0.0
80,8192,2048,4096,ck,13,0,384.5945,a8w8_blockscale_bpreshuffle_1x128x128_256x64x256x128_16x16_16x16_8x32x1_8x32x1_1x32x1x8_8_2x1_intrawave_v1,357.36,196.3,0.0
80,8192,9216,2048,ck,14,0,895.6302,a8w8_blockscale_bpreshuffle_1x128x128_256x64x128x128_16x16_16x16_8x32x1_8x32x1_1x32x1x8_8_2x1_intrawave_v1,345.27,208.4,0.0
80,8192,12288,2048,ck,13,0,1188.7429,a8w8_blockscale_bpreshuffle_1x128x128_256x64x256x128_16x16_16x16_8x32x1_8x32x1_1x32x1x8_8_2x1_intrawave_v1,346.85,204.64,0.0
80,11264,2048,4096,ck,13,0,524.0155,a8w8_blockscale_bpreshuffle_1x128x128_256x64x256x128_16x16_16x16_8x32x1_8x32x1_1x32x1x8_8_2x1_intrawave_v1,360.64,192.1,0.0
80,11264,9216,2048,ck,14,0,1225.3711,a8w8_blockscale_bpreshuffle_1x128x128_256x64x128x128_16x16_16x16_8x32x1_8x32x1_1x32x1x8_8_2x1_intrawave_v1,347.0,203.66,0.0
80,11264,12288,2048,ck,13,0,1629.7021,a8w8_blockscale_bpreshuffle_1x128x128_256x64x256x128_16x16_16x16_8x32x1_8x32x1_1x32x1x8_8_2x1_intrawave_v1,347.88,199.46,0.0
80,15744,2048,4096,ck,13,0,726.6439,a8w8_blockscale_bpreshuffle_1x128x128_256x64x256x128_16x16_16x16_8x32x1_8x32x1_1x32x1x8_8_2x1_intrawave_v1,363.51,189.04,0.0
80,15744,9216,2048,ck,13,0,1708.5587,a8w8_blockscale_bpreshuffle_1x128x128_256x64x256x128_16x16_16x16_8x32x1_8x32x1_1x32x1x8_8_2x1_intrawave_v1,347.85,199.77,0.0
80,15744,12288,2048,ck,13,0,2275.0627,a8w8_blockscale_bpreshuffle_1x128x128_256x64x256x128_16x16_16x16_8x32x1_8x32x1_1x32x1x8_8_2x1_intrawave_v1,348.31,195.31,0.0
80,16384,2048,4096,ck,13,0,756.1926,a8w8_blockscale_bpreshuffle_1x128x128_256x64x256x128_16x16_16x16_8x32x1_8x32x1_1x32x1x8_8_2x1_intrawave_v1,363.5,188.58,0.0
