aiter/configs/model_configs/a8w8_blockscale_tuned_gemm_qwen36_27b_tp4.csv
gfx,cu_num,M,N,K,libtype,kernelId,splitK,us,kernelName,tflops,bw,errRatio
gfx942,304,16,3584,5120,ck,8,0,17.6647,a8w8_blockscale_1x128x128_256x16x64x256_16x16_16x16_1x1_16x16x1_16x16x1_1x16x1x16_4_1x1_intrawave_v1,33.24,1049.93,0.0
gfx942,304,32,3584,5120,ck,8,0,17.7034,a8w8_blockscale_1x128x128_256x16x64x256_16x16_16x16_1x1_16x16x1_16x16x1_1x16x1x16_4_1x1_intrawave_v1,66.34,1058.74,0.0
gfx942,304,48,3584,5120,ck,8,0,17.6406,a8w8_blockscale_1x128x128_256x16x64x256_16x16_16x16_1x1_16x16x1_16x16x1_1x16x1x16_4_1x1_intrawave_v1,99.86,1073.65,0.0
gfx942,304,64,3584,5120,ck,8,0,18.2544,a8w8_blockscale_1x128x128_256x16x64x256_16x16_16x16_1x1_16x16x1_16x16x1_1x16x1x16_4_1x1_intrawave_v1,128.67,1048.32,0.0
gfx942,304,80,3584,5120,ck,8,0,18.7063,a8w8_blockscale_1x128x128_256x16x64x256_16x16_16x16_1x1_16x16x1_16x16x1_1x16x1x16_4_1x1_intrawave_v1,156.95,1033.51,0.0
gfx942,304,96,3584,5120,ck,13,0,22.822,a8w8_blockscale_1x128x128_256x32x64x256_16x16_16x16_2x1_16x16x1_16x16x1_1x32x1x8_8_2x1_intrawave_v1,154.38,855.74,0.0
gfx942,304,112,3584,5120,ck,13,0,23.3714,a8w8_blockscale_1x128x128_256x32x64x256_16x16_16x16_2x1_16x16x1_16x16x1_1x32x1x8_8_2x1_intrawave_v1,175.87,844.04,0.0
gfx942,304,128,3584,5120,ck,18,0,22.3467,a8w8_blockscale_1x128x128_256x64x64x256_16x16_32x32_1x1_16x16x1_16x16x1_1x32x1x8_8_1x1_intrawave_v1,210.22,891.54,0.0
gfx942,304,144,3584,5120,ck,18,0,25.012,a8w8_blockscale_1x128x128_256x64x64x256_16x16_32x32_1x1_16x16x1_16x16x1_1x32x1x8_8_1x1_intrawave_v1,211.29,804.4,0.0
gfx942,304,160,3584,5120,ck,18,0,24.4397,a8w8_blockscale_1x128x128_256x64x64x256_16x16_32x32_1x1_16x16x1_16x16x1_1x32x1x8_8_1x1_intrawave_v1,240.27,831.28,0.0
gfx942,304,176,3584,5120,ck,18,0,25.1458,a8w8_blockscale_1x128x128_256x64x64x256_16x16_32x32_1x1_16x16x1_16x16x1_1x32x1x8_8_1x1_intrawave_v1,256.87,815.75,0.0
gfx942,304,192,3584,5120,ck,18,0,23.5098,a8w8_blockscale_1x128x128_256x64x64x256_16x16_32x32_1x1_16x16x1_16x16x1_1x32x1x8_8_1x1_intrawave_v1,299.72,880.88,0.0
gfx942,304,208,3584,5120,ck,18,0,27.9668,a8w8_blockscale_1x128x128_256x64x64x256_16x16_32x32_1x1_16x16x1_16x16x1_1x32x1x8_8_1x1_intrawave_v1,272.95,747.53,0.0
gfx942,304,224,3584,5120,ck,18,0,28.9459,a8w8_blockscale_1x128x128_256x64x64x256_16x16_32x32_1x1_16x16x1_16x16x1_1x32x1x8_8_1x1_intrawave_v1,284.01,729.04,0.0
gfx942,304,240,3584,5120,ck,18,0,27.937,a8w8_blockscale_1x128x128_256x64x64x256_16x16_32x32_1x1_16x16x1_16x16x1_1x32x1x8_8_1x1_intrawave_v1,315.28,762.4,0.0
gfx942,304,256,3584,5120,ck,18,0,26.5523,a8w8_blockscale_1x128x128_256x64x64x256_16x16_32x32_1x1_16x16x1_16x16x1_1x32x1x8_8_1x1_intrawave_v1,353.84,809.56,0.0
gfx942,304,288,3584,5120,ck,18,0,32.1819,a8w8_blockscale_1x128x128_256x64x64x256_16x16_32x32_1x1_16x16x1_16x16x1_1x32x1x8_8_1x1_intrawave_v1,328.43,680.17,0.0
gfx942,304,320,3584,5120,ck,18,0,30.6464,a8w8_blockscale_1x128x128_256x64x64x256_16x16_32x32_1x1_16x16x1_16x16x1_1x32x1x8_8_1x1_intrawave_v1,383.21,727.08,0.0
gfx942,304,352,3584,5120,ck,3,0,41.5369,a8w8_blockscale_1x128x128_256x64x64x128_16x16_32x32_1x1_8x32x1_8x32x1_1x32x1x8_8_1x1_intrawave_v3,311.01,545.91,0.0
gfx942,304,384,3584,5120,ck,3,0,44.8266,a8w8_blockscale_1x128x128_256x64x64x128_16x16_32x32_1x1_8x32x1_8x32x1_1x32x1x8_8_1x1_intrawave_v3,314.39,514.62,0.0
gfx942,304,416,3584,5120,ck,2,0,44.8899,a8w8_blockscale_1x128x128_256x64x128x128_16x16_32x32_1x2_8x32x1_8x32x1_1x32x1x8_8_1x1_intrawave_v3,340.1,522.65,0.0
gfx942,304,448,3584,5120,ck,3,0,47.0491,a8w8_blockscale_1x128x128_256x64x64x128_16x16_32x32_1x1_8x32x1_8x32x1_1x32x1x8_8_1x1_intrawave_v3,349.46,507.03,0.0
gfx942,304,480,3584,5120,ck,2,0,45.977,a8w8_blockscale_1x128x128_256x64x128x128_16x16_32x32_1x2_8x32x1_8x32x1_1x32x1x8_8_1x1_intrawave_v3,383.15,527.4,0.0
gfx942,304,512,3584,5120,ck,3,0,48.7717,a8w8_blockscale_1x128x128_256x64x64x128_16x16_32x32_1x1_8x32x1_8x32x1_1x32x1x8_8_1x1_intrawave_v3,385.27,505.24,0.0
gfx942,304,544,3584,5120,ck,2,0,47.8443,a8w8_blockscale_1x128x128_256x64x128x128_16x16_32x32_1x2_8x32x1_8x32x1_1x32x1x8_8_1x1_intrawave_v3,417.29,523.25,0.0
gfx942,304,576,3584,5120,ck,2,0,51.3288,a8w8_blockscale_1x128x128_256x64x128x128_16x16_32x32_1x2_8x32x1_8x32x1_1x32x1x8_8_1x1_intrawave_v3,411.84,495.39,0.0
gfx942,304,608,3584,5120,ck,2,0,51.0046,a8w8_blockscale_1x128x128_256x64x128x128_16x16_32x32_1x2_8x32x1_8x32x1_1x32x1x8_8_1x1_intrawave_v3,437.48,506.25,0.0
gfx942,304,640,3584,5120,ck,2,0,54.2476,a8w8_blockscale_1x128x128_256x64x128x128_16x16_32x32_1x2_8x32x1_8x32x1_1x32x1x8_8_1x1_intrawave_v3,432.98,483.24,0.0
gfx942,304,672,3584,5120,ck,0,0,61.0794,a8w8_blockscale_1x128x128_256x128x128x128_16x16_32x32_2x2_8x32x1_8x32x1_1x32x1x8_8_1x1_intrawave_v3,403.78,435.62,0.0
gfx942,304,704,3584,5120,ck,0,0,60.7502,a8w8_blockscale_1x128x128_256x128x128x128_16x16_32x32_2x2_8x32x1_8x32x1_1x32x1x8_8_1x1_intrawave_v3,425.3,444.46,0.0
gfx942,304,736,3584,5120,ck,0,0,64.0782,a8w8_blockscale_1x128x128_256x128x128x128_16x16_32x32_2x2_8x32x1_8x32x1_1x32x1x8_8_1x1_intrawave_v3,421.54,427.51,0.0
gfx942,304,768,3584,5120,ck,3,0,66.2824,a8w8_blockscale_1x128x128_256x64x64x128_16x16_32x32_1x1_8x32x1_8x32x1_1x32x1x8_8_1x1_intrawave_v3,425.24,419.23,0.0
gfx942,304,800,3584,5120,ck,0,0,62.8573,a8w8_blockscale_1x128x128_256x128x128x128_16x16_32x32_2x2_8x32x1_8x32x1_1x32x1x8_8_1x1_intrawave_v3,467.09,448.32,0.0
gfx942,304,832,3584,5120,ck,0,0,63.4801,a8w8_blockscale_1x128x128_256x128x128x128_16x16_32x32_2x2_8x32x1_8x32x1_1x32x1x8_8_1x1_intrawave_v3,481.01,450.12,0.0
gfx942,304,864,3584,5120,ck,0,0,66.8075,a8w8_blockscale_1x128x128_256x128x128x128_16x16_32x32_2x2_8x32x1_8x32x1_1x32x1x8_8_1x1_intrawave_v3,474.63,433.59,0.0
gfx942,304,896,3584,5120,ck,0,0,73.1626,a8w8_blockscale_1x128x128_256x128x128x128_16x16_32x32_2x2_8x32x1_8x32x1_1x32x1x8_8_1x1_intrawave_v3,449.46,401.3,0.0
gfx942,304,928,3584,5120,ck,0,0,66.4062,a8w8_blockscale_1x128x128_256x128x128x128_16x16_32x32_2x2_8x32x1_8x32x1_1x32x1x8_8_1x1_intrawave_v3,512.87,448.05,0.0
gfx942,304,960,3584,5120,ck,0,0,65.9238,a8w8_blockscale_1x128x128_256x128x128x128_16x16_32x32_2x2_8x32x1_8x32x1_1x32x1x8_8_1x1_intrawave_v3,534.44,457.29,0.0
gfx942,304,992,3584,5120,ck,0,0,70.3061,a8w8_blockscale_1x128x128_256x128x128x128_16x16_32x32_2x2_8x32x1_8x32x1_1x32x1x8_8_1x1_intrawave_v3,517.83,434.38,0.0
gfx942,304,1024,3584,5120,ck,2,0,75.5307,a8w8_blockscale_1x128x128_256x64x128x128_16x16_32x32_1x2_8x32x1_8x32x1_1x32x1x8_8_1x1_intrawave_v3,497.56,409.54,0.0
gfx942,304,1088,3584,5120,ck,0,0,66.9966,a8w8_blockscale_1x128x128_256x128x128x128_16x16_32x32_2x2_8x32x1_8x32x1_1x32x1x8_8_1x1_intrawave_v3,596.0,473.45,0.0
gfx942,304,1152,3584,5120,ck,2,0,77.4337,a8w8_blockscale_1x128x128_256x64x128x128_16x16_32x32_1x2_8x32x1_8x32x1_1x32x1x8_8_1x1_intrawave_v3,546.0,419.79,0.0
gfx942,304,1216,3584,5120,ck,0,0,73.2433,a8w8_blockscale_1x128x128_256x128x128x128_16x16_32x32_2x2_8x32x1_8x32x1_1x32x1x8_8_1x1_intrawave_v3,609.3,454.54,0.0
gfx942,304,1280,3584,5120,ck,2,0,79.6954,a8w8_blockscale_1x128x128_256x64x128x128_16x16_32x32_1x2_8x32x1_8x32x1_1x32x1x8_8_1x1_intrawave_v3,589.45,427.61,0.0
gfx942,304,1344,3584,5120,ck,2,0,86.4578,a8w8_blockscale_1x128x128_256x64x128x128_16x16_32x32_1x2_8x32x1_8x32x1_1x32x1x8_8_1x1_intrawave_v3,570.51,403.26,0.0
gfx942,304,1408,3584,5120,ck,0,0,104.3366,a8w8_blockscale_1x128x128_256x128x128x128_16x16_32x32_2x2_8x32x1_8x32x1_1x32x1x8_8_1x1_intrawave_v3,495.26,341.7,0.0
gfx942,304,1472,3584,5120,ck,0,0,104.9245,a8w8_blockscale_1x128x128_256x128x128x128_16x16_32x32_2x2_8x32x1_8x32x1_1x32x1x8_8_1x1_intrawave_v3,514.87,347.28,0.0
gfx942,304,1536,3584,5120,ck,0,0,105.6626,a8w8_blockscale_1x128x128_256x128x128x128_16x16_32x32_2x2_8x32x1_8x32x1_1x32x1x8_8_1x1_intrawave_v3,533.5,352.3,0.0
gfx942,304,1600,3584,5120,ck,0,0,104.2416,a8w8_blockscale_1x128x128_256x128x128x128_16x16_32x32_2x2_8x32x1_8x32x1_1x32x1x8_8_1x1_intrawave_v3,563.31,364.64,0.0
gfx942,304,1664,3584,5120,ck,0,0,106.6762,a8w8_blockscale_1x128x128_256x128x128x128_16x16_32x32_2x2_8x32x1_8x32x1_1x32x1x8_8_1x1_intrawave_v3,572.47,363.69,0.0
gfx942,304,1728,3584,5120,ck,0,0,105.5376,a8w8_blockscale_1x128x128_256x128x128x128_16x16_32x32_2x2_8x32x1_8x32x1_1x32x1x8_8_1x1_intrawave_v3,600.9,375.07,0.0
gfx942,304,1792,3584,5120,ck,0,0,109.7702,a8w8_blockscale_1x128x128_256x128x128x128_16x16_32x32_2x2_8x32x1_8x32x1_1x32x1x8_8_1x1_intrawave_v3,599.13,367.77,0.0
gfx942,304,1856,3584,5120,ck,0,0,110.2545,a8w8_blockscale_1x128x128_256x128x128x128_16x16_32x32_2x2_8x32x1_8x32x1_1x32x1x8_8_1x1_intrawave_v3,617.8,373.29,0.0
gfx942,304,1920,3584,5120,ck,0,0,112.1295,a8w8_blockscale_1x128x128_256x128x128x128_16x16_32x32_2x2_8x32x1_8x32x1_1x32x1x8_8_1x1_intrawave_v3,628.42,374.06,0.0
gfx942,304,1984,3584,5120,ck,0,0,108.7156,a8w8_blockscale_1x128x128_256x128x128x128_16x16_32x32_2x2_8x32x1_8x32x1_1x32x1x8_8_1x1_intrawave_v3,669.76,393.04,0.0
gfx942,304,2048,3584,5120,ck,0,0,113.3269,a8w8_blockscale_1x128x128_256x128x128x128_16x16_32x32_2x2_8x32x1_8x32x1_1x32x1x8_8_1x1_intrawave_v3,663.23,383.99,0.0
gfx942,304,2112,3584,5120,ck,0,0,120.9361,a8w8_blockscale_1x128x128_256x128x128x128_16x16_32x32_2x2_8x32x1_8x32x1_1x32x1x8_8_1x1_intrawave_v3,640.92,366.33,0.0
gfx942,304,2176,3584,5120,ck,0,0,122.0404,a8w8_blockscale_1x128x128_256x128x128x128_16x16_32x32_2x2_8x32x1_8x32x1_1x32x1x8_8_1x1_intrawave_v3,654.37,369.46,0.0
gfx942,304,2240,3584,5120,ck,0,0,119.3791,a8w8_blockscale_1x128x128_256x128x128x128_16x16_32x32_2x2_8x32x1_8x32x1_1x32x1x8_8_1x1_intrawave_v3,688.63,384.28,0.0
gfx942,304,2304,3584,5120,ck,0,0,118.7561,a8w8_blockscale_1x128x128_256x128x128x128_16x16_32x32_2x2_8x32x1_8x32x1_1x32x1x8_8_1x1_intrawave_v3,712.02,392.92,0.0
gfx942,304,2368,3584,5120,ck,0,0,121.3993,a8w8_blockscale_1x128x128_256x128x128x128_16x16_32x32_2x2_8x32x1_8x32x1_1x32x1x8_8_1x1_intrawave_v3,715.87,390.84,0.0
gfx942,304,2432,3584,5120,ck,0,0,123.3493,a8w8_blockscale_1x128x128_256x128x128x128_16x16_32x32_2x2_8x32x1_8x32x1_1x32x1x8_8_1x1_intrawave_v3,723.59,391.04,0.0
gfx942,304,2496,3584,5120,ck,0,0,123.8783,a8w8_blockscale_1x128x128_256x128x128x128_16x16_32x32_2x2_8x32x1_8x32x1_1x32x1x8_8_1x1_intrawave_v3,739.46,395.72,0.0
gfx942,304,2560,3584,5120,ck,0,0,126.3725,a8w8_blockscale_1x128x128_256x128x128x128_16x16_32x32_2x2_8x32x1_8x32x1_1x32x1x8_8_1x1_intrawave_v3,743.46,394.13,0.0
gfx942,304,2624,3584,5120,ck,0,0,129.2057,a8w8_blockscale_1x128x128_256x128x128x128_16x16_32x32_2x2_8x32x1_8x32x1_1x32x1x8_8_1x1_intrawave_v3,745.33,391.58,0.0
gfx942,304,2688,3584,5120,ck,0,0,129.6039,a8w8_blockscale_1x128x128_256x128x128x128_16x16_32x32_2x2_8x32x1_8x32x1_1x32x1x8_8_1x1_intrawave_v3,761.17,396.44,0.0
gfx942,304,2752,3584,5120,ck,2,0,163.1969,a8w8_blockscale_1x128x128_256x64x128x128_16x16_32x32_1x2_8x32x1_8x32x1_1x32x1x8_8_1x1_intrawave_v3,618.88,319.65,0.0
gfx942,304,2816,3584,5120,ck,2,0,177.8619,a8w8_blockscale_1x128x128_256x64x128x128_16x16_32x32_1x2_8x32x1_8x32x1_1x32x1x8_8_1x1_intrawave_v3,581.06,297.72,0.0
gfx942,304,2880,3584,5120,ck,0,0,171.1956,a8w8_blockscale_1x128x128_256x128x128x128_16x16_32x32_2x2_8x32x1_8x32x1_1x32x1x8_8_1x1_intrawave_v3,617.4,313.91,0.0
gfx942,304,2944,3584,5120,ck,0,0,172.4215,a8w8_blockscale_1x128x128_256x128x128x128_16x16_32x32_2x2_8x32x1_8x32x1_1x32x1x8_8_1x1_intrawave_v3,626.63,316.24,0.0
gfx942,304,3008,3584,5120,ck,0,0,166.425,a8w8_blockscale_1x128x128_256x128x128x128_16x16_32x32_2x2_8x32x1_8x32x1_1x32x1x8_8_1x1_intrawave_v3,663.33,332.36,0.0
gfx942,304,3072,3584,5120,ck,0,0,170.8689,a8w8_blockscale_1x128x128_256x128x128x128_16x16_32x32_2x2_8x32x1_8x32x1_1x32x1x8_8_1x1_intrawave_v3,659.82,328.31,0.0
gfx942,304,3136,3584,5120,ck,0,0,173.4654,a8w8_blockscale_1x128x128_256x128x128x128_16x16_32x32_2x2_8x32x1_8x32x1_1x32x1x8_8_1x1_intrawave_v3,663.49,327.93,0.0
gfx942,304,3200,3584,5120,ck,0,0,173.2112,a8w8_blockscale_1x128x128_256x128x128x128_16x16_32x32_2x2_8x32x1_8x32x1_1x32x1x8_8_1x1_intrawave_v3,678.02,332.96,0.0
gfx942,304,3264,3584,5120,ck,0,0,175.7738,a8w8_blockscale_1x128x128_256x128x128x128_16x16_32x32_2x2_8x32x1_8x32x1_1x32x1x8_8_1x1_intrawave_v3,681.5,332.58,0.0
gfx942,304,3328,3584,5120,ck,0,0,178.2475,a8w8_blockscale_1x128x128_256x128x128x128_16x16_32x32_2x2_8x32x1_8x32x1_1x32x1x8_8_1x1_intrawave_v3,685.22,332.37,0.0
gfx942,304,3392,3584,5120,ck,0,0,179.2122,a8w8_blockscale_1x128x128_256x128x128x128_16x16_32x32_2x2_8x32x1_8x32x1_1x32x1x8_8_1x1_intrawave_v3,694.63,334.97,0.0
gfx942,304,3456,3584,5120,ck,0,0,178.9777,a8w8_blockscale_1x128x128_256x128x128x128_16x16_32x32_2x2_8x32x1_8x32x1_1x32x1x8_8_1x1_intrawave_v3,708.67,339.8,0.0
gfx942,304,3520,3584,5120,ck,0,0,178.8934,a8w8_blockscale_1x128x128_256x128x128x128_16x16_32x32_2x2_8x32x1_8x32x1_1x32x1x8_8_1x1_intrawave_v3,722.13,344.36,0.0
gfx942,304,3584,3584,5120,ck,0,0,179.7712,a8w8_blockscale_1x128x128_256x128x128x128_16x16_32x32_2x2_8x32x1_8x32x1_1x32x1x8_8_1x1_intrawave_v3,731.67,347.05,0.0
gfx942,304,3648,3584,5120,ck,0,0,183.6802,a8w8_blockscale_1x128x128_256x128x128x128_16x16_32x32_2x2_8x32x1_8x32x1_1x32x1x8_8_1x1_intrawave_v3,728.89,343.95,0.0
gfx942,304,3712,3584,5120,ck,0,0,188.6075,a8w8_blockscale_1x128x128_256x128x128x128_16x16_32x32_2x2_8x32x1_8x32x1_1x32x1x8_8_1x1_intrawave_v3,722.3,339.13,0.0
gfx942,304,3776,3584,5120,ck,0,0,184.8123,a8w8_blockscale_1x128x128_256x128x128x128_16x16_32x32_2x2_8x32x1_8x32x1_1x32x1x8_8_1x1_intrawave_v3,749.84,350.35,0.0
gfx942,304,3840,3584,5120,ck,0,0,189.9894,a8w8_blockscale_1x128x128_256x128x128x128_16x16_32x32_2x2_8x32x1_8x32x1_1x32x1x8_8_1x1_intrawave_v3,741.77,344.95,0.0
gfx942,304,3904,3584,5120,ck,0,0,199.6618,a8w8_blockscale_1x128x128_256x128x128x128_16x16_32x32_2x2_8x32x1_8x32x1_1x32x1x8_8_1x1_intrawave_v3,717.6,332.17,0.0
gfx942,304,3968,3584,5120,ck,0,0,184.5335,a8w8_blockscale_1x128x128_256x128x128x128_16x16_32x32_2x2_8x32x1_8x32x1_1x32x1x8_8_1x1_intrawave_v3,789.16,363.67,0.0
gfx942,304,4032,3584,5120,ck,0,0,197.7422,a8w8_blockscale_1x128x128_256x128x128x128_16x16_32x32_2x2_8x32x1_8x32x1_1x32x1x8_8_1x1_intrawave_v3,748.32,343.35,0.0
gfx942,304,4096,3584,5120,ck,0,0,192.2195,a8w8_blockscale_1x128x128_256x128x128x128_16x16_32x32_2x2_8x32x1_8x32x1_1x32x1x8_8_1x1_intrawave_v3,782.04,357.31,0.0
gfx942,304,4224,3584,5120,ck,0,0,233.4067,a8w8_blockscale_1x128x128_256x128x128x128_16x16_32x32_2x2_8x32x1_8x32x1_1x32x1x8_8_1x1_intrawave_v3,664.17,301.0,0.0
gfx942,304,4352,3584,5120,ck,0,0,227.1526,a8w8_blockscale_1x128x128_256x128x128x128_16x16_32x32_2x2_8x32x1_8x32x1_1x32x1x8_8_1x1_intrawave_v3,703.14,316.21,0.0
gfx942,304,4480,3584,5120,ck,0,0,231.6544,a8w8_blockscale_1x128x128_256x128x128x128_16x16_32x32_2x2_8x32x1_8x32x1_1x32x1x8_8_1x1_intrawave_v3,709.75,316.85,0.0
gfx942,304,4608,3584,5120,ck,0,0,234.1049,a8w8_blockscale_1x128x128_256x128x128x128_16x16_32x32_2x2_8x32x1_8x32x1_1x32x1x8_8_1x1_intrawave_v3,722.39,320.25,0.0
gfx942,304,4736,3584,5120,ck,0,0,238.4447,a8w8_blockscale_1x128x128_256x128x128x128_16x16_32x32_2x2_8x32x1_8x32x1_1x32x1x8_8_1x1_intrawave_v3,728.94,321.02,0.0
gfx942,304,4864,3584,5120,ck,0,0,239.1801,a8w8_blockscale_1x128x128_256x128x128x128_16x16_32x32_2x2_8x32x1_8x32x1_1x32x1x8_8_1x1_intrawave_v3,746.34,326.61,0.0
gfx942,304,4992,3584,5120,ck,0,0,244.6966,a8w8_blockscale_1x128x128_256x128x128x128_16x16_32x32_2x2_8x32x1_8x32x1_1x32x1x8_8_1x1_intrawave_v3,748.71,325.68,0.0
gfx942,304,5120,3584,5120,ck,0,0,245.6701,a8w8_blockscale_1x128x128_256x128x128x128_16x16_32x32_2x2_8x32x1_8x32x1_1x32x1x8_8_1x1_intrawave_v3,764.87,330.79,0.0
gfx942,304,5248,3584,5120,ck,0,0,254.3812,a8w8_blockscale_1x128x128_256x128x128x128_16x16_32x32_2x2_8x32x1_8x32x1_1x32x1x8_8_1x1_intrawave_v3,757.14,325.64,0.0
gfx942,304,5376,3584,5120,ck,0,0,262.0442,a8w8_blockscale_1x128x128_256x128x128x128_16x16_32x32_2x2_8x32x1_8x32x1_1x32x1x8_8_1x1_intrawave_v3,752.93,322.12,0.0
gfx942,304,5504,3584,5120,ck,0,0,264.981,a8w8_blockscale_1x128x128_256x128x128x128_16x16_32x32_2x2_8x32x1_8x32x1_1x32x1x8_8_1x1_intrawave_v3,762.31,324.49,0.0
gfx942,304,5632,3584,5120,ck,0,0,288.3233,a8w8_blockscale_1x128x128_256x128x128x128_16x16_32x32_2x2_8x32x1_8x32x1_1x32x1x8_8_1x1_intrawave_v3,716.89,303.67,0.0
gfx942,304,5760,3584,5120,ck,0,0,295.6225,a8w8_blockscale_1x128x128_256x128x128x128_16x16_32x32_2x2_8x32x1_8x32x1_1x32x1x8_8_1x1_intrawave_v3,715.08,301.5,0.0
gfx942,304,5888,3584,5120,ck,0,0,290.9513,a8w8_blockscale_1x128x128_256x128x128x128_16x16_32x32_2x2_8x32x1_8x32x1_1x32x1x8_8_1x1_intrawave_v3,742.7,311.74,0.0
gfx942,304,6016,3584,5120,ck,0,0,294.2257,a8w8_blockscale_1x128x128_256x128x128x128_16x16_32x32_2x2_8x32x1_8x32x1_1x32x1x8_8_1x1_intrawave_v3,750.4,313.62,0.0
gfx942,304,6144,3584,5120,ck,0,0,289.4323,a8w8_blockscale_1x128x128_256x128x128x128_16x16_32x32_2x2_8x32x1_8x32x1_1x32x1x8_8_1x1_intrawave_v3,779.06,324.25,0.0
gfx942,304,6272,3584,5120,ck,0,0,304.096,a8w8_blockscale_1x128x128_256x128x128x128_16x16_32x32_2x2_8x32x1_8x32x1_1x32x1x8_8_1x1_intrawave_v3,756.94,313.78,0.0
gfx942,304,6400,3584,5120,ck,0,0,306.856,a8w8_blockscale_1x128x128_256x128x128x128_16x16_32x32_2x2_8x32x1_8x32x1_1x32x1x8_8_1x1_intrawave_v3,765.44,316.09,0.0
gfx942,304,6528,3584,5120,ck,0,0,308.679,a8w8_blockscale_1x128x128_256x128x128x128_16x16_32x32_2x2_8x32x1_8x32x1_1x32x1x8_8_1x1_intrawave_v3,776.14,319.32,0.0
gfx942,304,6656,3584,5120,ck,0,0,311.4778,a8w8_blockscale_1x128x128_256x128x128x128_16x16_32x32_2x2_8x32x1_8x32x1_1x32x1x8_8_1x1_intrawave_v3,784.25,321.5,0.0
gfx942,304,6784,3584,5120,ck,0,0,316.2843,a8w8_blockscale_1x128x128_256x128x128x128_16x16_32x32_2x2_8x32x1_8x32x1_1x32x1x8_8_1x1_intrawave_v3,787.18,321.58,0.0
gfx942,304,6912,3584,5120,ck,0,0,324.2017,a8w8_blockscale_1x128x128_256x128x128x128_16x16_32x32_2x2_8x32x1_8x32x1_1x32x1x8_8_1x1_intrawave_v3,782.45,318.58,0.0
gfx942,304,7040,3584,5120,ck,0,0,350.2473,a8w8_blockscale_1x128x128_256x128x128x128_16x16_32x32_2x2_8x32x1_8x32x1_1x32x1x8_8_1x1_intrawave_v3,737.68,299.38,0.0
gfx942,304,7168,3584,5120,ck,0,0,343.0847,a8w8_blockscale_1x128x128_256x128x128x128_16x16_32x32_2x2_8x32x1_8x32x1_1x32x1x8_8_1x1_intrawave_v3,766.77,310.22,0.0
gfx942,304,7296,3584,5120,ck,0,0,355.3064,a8w8_blockscale_1x128x128_256x128x128x128_16x16_32x32_2x2_8x32x1_8x32x1_1x32x1x8_8_1x1_intrawave_v3,753.62,303.97,0.0
gfx942,304,7424,3584,5120,ck,0,0,348.3761,a8w8_blockscale_1x128x128_256x128x128x128_16x16_32x32_2x2_8x32x1_8x32x1_1x32x1x8_8_1x1_intrawave_v3,782.09,314.53,0.0
gfx942,304,7552,3584,5120,ck,0,0,358.6868,a8w8_blockscale_1x128x128_256x128x128x128_16x16_32x32_2x2_8x32x1_8x32x1_1x32x1x8_8_1x1_intrawave_v3,772.71,309.88,0.0
gfx942,304,7680,3584,5120,ck,0,0,358.1953,a8w8_blockscale_1x128x128_256x128x128x128_16x16_32x32_2x2_8x32x1_8x32x1_1x32x1x8_8_1x1_intrawave_v3,786.88,314.69,0.0
gfx942,304,7808,3584,5120,ck,0,0,370.7486,a8w8_blockscale_1x128x128_256x128x128x128_16x16_32x32_2x2_8x32x1_8x32x1_1x32x1x8_8_1x1_intrawave_v3,772.91,308.28,0.0
gfx942,304,7936,3584,5120,ck,0,0,371.3445,a8w8_blockscale_1x128x128_256x128x128x128_16x16_32x32_2x2_8x32x1_8x32x1_1x32x1x8_8_1x1_intrawave_v3,784.32,312.02,0.0
gfx942,304,8064,3584,5120,ck,0,0,374.5461,a8w8_blockscale_1x128x128_256x128x128x128_16x16_32x32_2x2_8x32x1_8x32x1_1x32x1x8_8_1x1_intrawave_v3,790.16,313.55,0.0
gfx942,304,8192,3584,5120,ck,0,0,370.9414,a8w8_blockscale_1x128x128_256x128x128x128_16x16_32x32_2x2_8x32x1_8x32x1_1x32x1x8_8_1x1_intrawave_v3,810.5,320.84,0.0
gfx942,304,8320,3584,5120,ck,0,0,392.1176,a8w8_blockscale_1x128x128_256x128x128x128_16x16_32x32_2x2_8x32x1_8x32x1_1x32x1x8_8_1x1_intrawave_v3,778.71,307.53,0.0
gfx942,304,8448,3584,5120,ck,0,0,408.6072,a8w8_blockscale_1x128x128_256x128x128x128_16x16_32x32_2x2_8x32x1_8x32x1_1x32x1x8_8_1x1_intrawave_v3,758.78,298.96,0.0
gfx942,304,8576,3584,5120,ck,0,0,404.1044,a8w8_blockscale_1x128x128_256x128x128x128_16x16_32x32_2x2_8x32x1_8x32x1_1x32x1x8_8_1x1_intrawave_v3,778.86,306.19,0.0
gfx942,304,8704,3584,5120,ck,0,0,411.659,a8w8_blockscale_1x128x128_256x128x128x128_16x16_32x32_2x2_8x32x1_8x32x1_1x32x1x8_8_1x1_intrawave_v3,775.98,304.39,0.0
gfx942,304,8832,3584,5120,ck,0,0,412.208,a8w8_blockscale_1x128x128_256x128x128x128_16x16_32x32_2x2_8x32x1_8x32x1_1x32x1x8_8_1x1_intrawave_v3,786.34,307.8,0.0
gfx942,304,8960,3584,5120,ck,0,0,414.8182,a8w8_blockscale_1x128x128_256x128x128x128_16x16_32x32_2x2_8x32x1_8x32x1_1x32x1x8_8_1x1_intrawave_v3,792.72,309.66,0.0
gfx942,304,9088,3584,5120,ck,0,0,422.3815,a8w8_blockscale_1x128x128_256x128x128x128_16x16_32x32_2x2_8x32x1_8x32x1_1x32x1x8_8_1x1_intrawave_v3,789.64,307.83,0.0
gfx942,304,9216,3584,5120,ck,0,0,428.2668,a8w8_blockscale_1x128x128_256x128x128x128_16x16_32x32_2x2_8x32x1_8x32x1_1x32x1x8_8_1x1_intrawave_v3,789.76,307.28,0.0
gfx942,304,9344,3584,5120,ck,0,0,438.8108,a8w8_blockscale_1x128x128_256x128x128x128_16x16_32x32_2x2_8x32x1_8x32x1_1x32x1x8_8_1x1_intrawave_v3,781.49,303.48,0.0
gfx942,304,9472,3584,5120,ck,0,0,437.1635,a8w8_blockscale_1x128x128_256x128x128x128_16x16_32x32_2x2_8x32x1_8x32x1_1x32x1x8_8_1x1_intrawave_v3,795.18,308.22,0.0
gfx942,304,9600,3584,5120,ck,0,0,455.4654,a8w8_blockscale_1x128x128_256x128x128x128_16x16_32x32_2x2_8x32x1_8x32x1_1x32x1x8_8_1x1_intrawave_v3,773.54,299.29,0.0
gfx942,304,9728,3584,5120,ck,0,0,457.0711,a8w8_blockscale_1x128x128_256x128x128x128_16x16_32x32_2x2_8x32x1_8x32x1_1x32x1x8_8_1x1_intrawave_v3,781.1,301.68,0.0
gfx942,304,9856,3584,5120,ck,0,0,465.7022,a8w8_blockscale_1x128x128_256x128x128x128_16x16_32x32_2x2_8x32x1_8x32x1_1x32x1x8_8_1x1_intrawave_v3,776.71,299.46,0.0
gfx942,304,9984,3584,5120,ck,0,0,466.3525,a8w8_blockscale_1x128x128_256x128x128x128_16x16_32x32_2x2_8x32x1_8x32x1_1x32x1x8_8_1x1_intrawave_v3,785.7,302.42,0.0
gfx942,304,10112,3584,5120,ck,0,0,470.8722,a8w8_blockscale_1x128x128_256x128x128x128_16x16_32x32_2x2_8x32x1_8x32x1_1x32x1x8_8_1x1_intrawave_v3,788.14,302.86,0.0
gfx942,304,10240,3584,5120,ck,0,0,474.2877,a8w8_blockscale_1x128x128_256x128x128x128_16x16_32x32_2x2_8x32x1_8x32x1_1x32x1x8_8_1x1_intrawave_v3,792.37,303.99,0.0
gfx942,304,10368,3584,5120,ck,0,0,488.2258,a8w8_blockscale_1x128x128_256x128x128x128_16x16_32x32_2x2_8x32x1_8x32x1_1x32x1x8_8_1x1_intrawave_v3,779.37,298.53,0.0
gfx942,304,10496,3584,5120,ck,0,0,481.8647,a8w8_blockscale_1x128x128_256x128x128x128_16x16_32x32_2x2_8x32x1_8x32x1_1x32x1x8_8_1x1_intrawave_v3,799.4,305.74,0.0
gfx942,304,10624,3584,5120,ck,0,0,483.9324,a8w8_blockscale_1x128x128_256x128x128x128_16x16_32x32_2x2_8x32x1_8x32x1_1x32x1x8_8_1x1_intrawave_v3,805.7,307.68,0.0
gfx942,304,10752,3584,5120,ck,0,0,497.8887,a8w8_blockscale_1x128x128_256x128x128x128_16x16_32x32_2x2_8x32x1_8x32x1_1x32x1x8_8_1x1_intrawave_v3,792.55,302.22,0.0
gfx942,304,10880,3584,5120,ck,0,0,492.0312,a8w8_blockscale_1x128x128_256x128x128x128_16x16_32x32_2x2_8x32x1_8x32x1_1x32x1x8_8_1x1_intrawave_v3,811.53,309.01,0.0
gfx942,304,11008,3584,5120,ck,0,0,513.1753,a8w8_blockscale_1x128x128_256x128x128x128_16x16_32x32_2x2_8x32x1_8x32x1_1x32x1x8_8_1x1_intrawave_v3,787.25,299.34,0.0
gfx942,304,11136,3584,5120,ck,0,0,522.0961,a8w8_blockscale_1x128x128_256x128x128x128_16x16_32x32_2x2_8x32x1_8x32x1_1x32x1x8_8_1x1_intrawave_v3,782.79,297.24,0.0
gfx942,304,11264,3584,5120,ck,0,0,523.0101,a8w8_blockscale_1x128x128_256x128x128x128_16x16_32x32_2x2_8x32x1_8x32x1_1x32x1x8_8_1x1_intrawave_v3,790.41,299.73,0.0
gfx942,304,11392,3584,5120,ck,0,0,525.6586,a8w8_blockscale_1x128x128_256x128x128x128_16x16_32x32_2x2_8x32x1_8x32x1_1x32x1x8_8_1x1_intrawave_v3,795.36,301.21,0.0
gfx942,304,11520,3584,5120,ck,0,0,539.367,a8w8_blockscale_1x128x128_256x128x128x128_16x16_32x32_2x2_8x32x1_8x32x1_1x32x1x8_8_1x1_intrawave_v3,783.86,296.47,0.0
gfx942,304,11648,3584,5120,ck,0,0,538.1322,a8w8_blockscale_1x128x128_256x128x128x128_16x16_32x32_2x2_8x32x1_8x32x1_1x32x1x8_8_1x1_intrawave_v3,794.38,300.08,0.0
gfx942,304,11776,3584,5120,ck,0,0,539.0921,a8w8_blockscale_1x128x128_256x128x128x128_16x16_32x32_2x2_8x32x1_8x32x1_1x32x1x8_8_1x1_intrawave_v3,801.68,302.46,0.0
gfx942,304,11904,3584,5120,ck,0,0,546.2317,a8w8_blockscale_1x128x128_256x128x128x128_16x16_32x32_2x2_8x32x1_8x32x1_1x32x1x8_8_1x1_intrawave_v3,799.8,301.39,0.0
gfx942,304,12032,3584,5120,ck,0,0,557.3714,a8w8_blockscale_1x128x128_256x128x128x128_16x16_32x32_2x2_8x32x1_8x32x1_1x32x1x8_8_1x1_intrawave_v3,792.25,298.18,0.0
gfx942,304,12160,3584,5120,ck,0,0,550.0475,a8w8_blockscale_1x128x128_256x128x128x128_16x16_32x32_2x2_8x32x1_8x32x1_1x32x1x8_8_1x1_intrawave_v3,811.34,305.01,0.0
gfx942,304,12288,3584,5120,ck,0,0,559.6823,a8w8_blockscale_1x128x128_256x128x128x128_16x16_32x32_2x2_8x32x1_8x32x1_1x32x1x8_8_1x1_intrawave_v3,805.76,302.57,0.0
gfx942,304,12416,3584,5120,ck,0,0,579.7214,a8w8_blockscale_1x128x128_256x128x128x128_16x16_32x32_2x2_8x32x1_8x32x1_1x32x1x8_8_1x1_intrawave_v3,786.01,294.83,0.0
gfx942,304,12544,3584,5120,ck,0,0,598.2409,a8w8_blockscale_1x128x128_256x128x128x128_16x16_32x32_2x2_8x32x1_8x32x1_1x32x1x8_8_1x1_intrawave_v3,769.53,288.33,0.0
gfx942,304,12672,3584,5120,ck,0,0,596.6252,a8w8_blockscale_1x128x128_256x128x128x128_16x16_32x32_2x2_8x32x1_8x32x1_1x32x1x8_8_1x1_intrawave_v3,779.49,291.75,0.0
gfx942,304,12800,3584,5120,ck,0,0,587.2216,a8w8_blockscale_1x128x128_256x128x128x128_16x16_32x32_2x2_8x32x1_8x32x1_1x32x1x8_8_1x1_intrawave_v3,799.97,299.1,0.0
gfx942,304,12928,3584,5120,ck,0,0,590.8477,a8w8_blockscale_1x128x128_256x128x128x128_16x16_32x32_2x2_8x32x1_8x32x1_1x32x1x8_8_1x1_intrawave_v3,803.02,299.92,0.0
gfx942,304,13056,3584,5120,ck,0,0,592.3499,a8w8_blockscale_1x128x128_256x128x128x128_16x16_32x32_2x2_8x32x1_8x32x1_1x32x1x8_8_1x1_intrawave_v3,808.91,301.82,0.0
gfx942,304,13184,3584,5120,ck,0,0,605.972,a8w8_blockscale_1x128x128_256x128x128x128_16x16_32x32_2x2_8x32x1_8x32x1_1x32x1x8_8_1x1_intrawave_v3,798.48,297.63,0.0
gfx942,304,13312,3584,5120,ck,0,0,603.5811,a8w8_blockscale_1x128x128_256x128x128x128_16x16_32x32_2x2_8x32x1_8x32x1_1x32x1x8_8_1x1_intrawave_v3,809.42,301.41,0.0
gfx942,304,13440,3584,5120,ck,0,0,617.2603,a8w8_blockscale_1x128x128_256x128x128x128_16x16_32x32_2x2_8x32x1_8x32x1_1x32x1x8_8_1x1_intrawave_v3,799.1,297.28,0.0
gfx942,304,13568,3584,5120,ck,0,0,620.3268,a8w8_blockscale_1x128x128_256x128x128x128_16x16_32x32_2x2_8x32x1_8x32x1_1x32x1x8_8_1x1_intrawave_v3,802.72,298.35,0.0
gfx942,304,13696,3584,5120,ck,0,0,635.5174,a8w8_blockscale_1x128x128_256x128x128x128_16x16_32x32_2x2_8x32x1_8x32x1_1x32x1x8_8_1x1_intrawave_v3,790.92,293.69,0.0
gfx942,304,13824,3584,5120,ck,0,0,638.2116,a8w8_blockscale_1x128x128_256x128x128x128_16x16_32x32_2x2_8x32x1_8x32x1_1x32x1x8_8_1x1_intrawave_v3,794.94,294.92,0.0
gfx942,304,13952,3584,5120,ck,0,0,650.2472,a8w8_blockscale_1x128x128_256x128x128x128_16x16_32x32_2x2_8x32x1_8x32x1_1x32x1x8_8_1x1_intrawave_v3,787.46,291.88,0.0
gfx942,304,14080,3584,5120,ck,0,0,653.3259,a8w8_blockscale_1x128x128_256x128x128x128_16x16_32x32_2x2_8x32x1_8x32x1_1x32x1x8_8_1x1_intrawave_v3,790.93,292.91,0.0
gfx942,304,14208,3584,5120,ck,0,0,653.0014,a8w8_blockscale_1x128x128_256x128x128x128_16x16_32x32_2x2_8x32x1_8x32x1_1x32x1x8_8_1x1_intrawave_v3,798.52,295.46,0.0
gfx942,304,14336,3584,5120,ck,0,0,657.3478,a8w8_blockscale_1x128x128_256x128x128x128_16x16_32x32_2x2_8x32x1_8x32x1_1x32x1x8_8_1x1_intrawave_v3,800.39,295.9,0.0
gfx942,304,14464,3584,5120,ck,0,0,666.9909,a8w8_blockscale_1x128x128_256x128x128x128_16x16_32x32_2x2_8x32x1_8x32x1_1x32x1x8_8_1x1_intrawave_v3,795.86,293.98,0.0
gfx942,304,14592,3584,5120,ck,0,0,671.2211,a8w8_blockscale_1x128x128_256x128x128x128_16x16_32x32_2x2_8x32x1_8x32x1_1x32x1x8_8_1x1_intrawave_v3,797.84,294.47,0.0
gfx942,304,14720,3584,5120,ck,0,0,670.3995,a8w8_blockscale_1x128x128_256x128x128x128_16x16_32x32_2x2_8x32x1_8x32x1_1x32x1x8_8_1x1_intrawave_v3,805.83,297.18,0.0
gfx942,304,14848,3584,5120,ck,0,0,677.0481,a8w8_blockscale_1x128x128_256x128x128x128_16x16_32x32_2x2_8x32x1_8x32x1_1x32x1x8_8_1x1_intrawave_v3,804.85,296.58,0.0
gfx942,304,14976,3584,5120,ck,0,0,670.7406,a8w8_blockscale_1x128x128_256x128x128x128_16x16_32x32_2x2_8x32x1_8x32x1_1x32x1x8_8_1x1_intrawave_v3,819.42,301.72,0.0
gfx942,304,15104,3584,5120,ck,0,0,698.0959,a8w8_blockscale_1x128x128_256x128x128x128_16x16_32x32_2x2_8x32x1_8x32x1_1x32x1x8_8_1x1_intrawave_v3,794.04,292.15,0.0
gfx942,304,15232,3584,5120,ck,0,0,700.8056,a8w8_blockscale_1x128x128_256x128x128x128_16x16_32x32_2x2_8x32x1_8x32x1_1x32x1x8_8_1x1_intrawave_v3,797.68,293.26,0.0
gfx942,304,15360,3584,5120,ck,0,0,709.4029,a8w8_blockscale_1x128x128_256x128x128x128_16x16_32x32_2x2_8x32x1_8x32x1_1x32x1x8_8_1x1_intrawave_v3,794.63,291.93,0.0
gfx942,304,15488,3584,5120,ck,0,0,707.5519,a8w8_blockscale_1x128x128_256x128x128x128_16x16_32x32_2x2_8x32x1_8x32x1_1x32x1x8_8_1x1_intrawave_v3,803.35,294.91,0.0
gfx942,304,15616,3584,5120,ck,0,0,709.9814,a8w8_blockscale_1x128x128_256x128x128x128_16x16_32x32_2x2_8x32x1_8x32x1_1x32x1x8_8_1x1_intrawave_v3,807.22,296.12,0.0
gfx942,304,15744,3584,5120,ck,0,0,715.7312,a8w8_blockscale_1x128x128_256x128x128x128_16x16_32x32_2x2_8x32x1_8x32x1_1x32x1x8_8_1x1_intrawave_v3,807.3,295.94,0.0
gfx942,304,15872,3584,5120,ck,0,0,726.6422,a8w8_blockscale_1x128x128_256x128x128x128_16x16_32x32_2x2_8x32x1_8x32x1_1x32x1x8_8_1x1_intrawave_v3,801.64,293.66,0.0
gfx942,304,16000,3584,5120,ck,0,0,731.2929,a8w8_blockscale_1x128x128_256x128x128x128_16x16_32x32_2x2_8x32x1_8x32x1_1x32x1x8_8_1x1_intrawave_v3,802.96,293.94,0.0
gfx942,304,16128,3584,5120,ck,0,0,732.3429,a8w8_blockscale_1x128x128_256x128x128x128_16x16_32x32_2x2_8x32x1_8x32x1_1x32x1x8_8_1x1_intrawave_v3,808.23,295.67,0.0
gfx942,304,16256,3584,5120,ck,0,0,727.8204,a8w8_blockscale_1x128x128_256x128x128x128_16x16_32x32_2x2_8x32x1_8x32x1_1x32x1x8_8_1x1_intrawave_v3,819.7,299.67,0.0
gfx942,304,16384,3584,5120,ck,0,0,732.4917,a8w8_blockscale_1x128x128_256x128x128x128_16x16_32x32_2x2_8x32x1_8x32x1_1x32x1x8_8_1x1_intrawave_v3,820.89,299.9,0.0
gfx942,304,16512,3584,5120,ck,0,0,757.703,a8w8_blockscale_1x128x128_256x128x128x128_16x16_32x32_2x2_8x32x1_8x32x1_1x32x1x8_8_1x1_intrawave_v3,799.78,292.0,0.0
gfx942,304,16640,3584,5120,ck,0,0,767.0086,a8w8_blockscale_1x128x128_256x128x128x128_16x16_32x32_2x2_8x32x1_8x32x1_1x32x1x8_8_1x1_intrawave_v3,796.2,290.51,0.0
gfx942,304,16768,3584,5120,ck,0,0,767.5834,a8w8_blockscale_1x128x128_256x128x128x128_16x16_32x32_2x2_8x32x1_8x32x1_1x32x1x8_8_1x1_intrawave_v3,801.72,292.34,0.0
gfx942,304,16896,3584,5120,ck,0,0,760.375,a8w8_blockscale_1x128x128_256x128x128x128_16x16_32x32_2x2_8x32x1_8x32x1_1x32x1x8_8_1x1_intrawave_v3,815.5,297.18,0.0
gfx942,304,17024,3584,5120,ck,0,0,770.5871,a8w8_blockscale_1x128x128_256x128x128x128_16x16_32x32_2x2_8x32x1_8x32x1_1x32x1x8_8_1x1_intrawave_v3,810.79,295.28,0.0
gfx942,304,17152,3584,5120,ck,0,0,786.102,a8w8_blockscale_1x128x128_256x128x128x128_16x16_32x32_2x2_8x32x1_8x32x1_1x32x1x8_8_1x1_intrawave_v3,800.76,291.46,0.0
gfx942,304,17280,3584,5120,ck,0,0,786.6105,a8w8_blockscale_1x128x128_256x128x128x128_16x16_32x32_2x2_8x32x1_8x32x1_1x32x1x8_8_1x1_intrawave_v3,806.22,293.27,0.0
gfx942,304,17408,3584,5120,ck,0,0,796.6373,a8w8_blockscale_1x128x128_256x128x128x128_16x16_32x32_2x2_8x32x1_8x32x1_1x32x1x8_8_1x1_intrawave_v3,801.97,291.55,0.0
gfx942,304,17536,3584,5120,ck,0,0,798.0327,a8w8_blockscale_1x128x128_256x128x128x128_16x16_32x32_2x2_8x32x1_8x32x1_1x32x1x8_8_1x1_intrawave_v3,806.45,293.01,0.0
gfx942,304,17664,3584,5120,ck,0,0,797.8682,a8w8_blockscale_1x128x128_256x128x128x128_16x16_32x32_2x2_8x32x1_8x32x1_1x32x1x8_8_1x1_intrawave_v3,812.5,295.04,0.0
gfx942,304,17792,3584,5120,ck,0,0,812.95,a8w8_blockscale_1x128x128_256x128x128x128_16x16_32x32_2x2_8x32x1_8x32x1_1x32x1x8_8_1x1_intrawave_v3,803.21,291.5,0.0
gfx942,304,17920,3584,5120,ck,0,0,817.547,a8w8_blockscale_1x128x128_256x128x128x128_16x16_32x32_2x2_8x32x1_8x32x1_1x32x1x8_8_1x1_intrawave_v3,804.44,291.79,0.0
gfx942,304,18048,3584,5120,ck,0,0,837.0389,a8w8_blockscale_1x128x128_256x128x128x128_16x16_32x32_2x2_8x32x1_8x32x1_1x32x1x8_8_1x1_intrawave_v3,791.32,286.87,0.0
gfx942,304,18176,3584,5120,ck,0,0,824.9669,a8w8_blockscale_1x128x128_256x128x128x128_16x16_32x32_2x2_8x32x1_8x32x1_1x32x1x8_8_1x1_intrawave_v3,808.59,292.98,0.0
gfx942,304,18304,3584,5120,ck,0,0,846.215,a8w8_blockscale_1x128x128_256x128x128x128_16x16_32x32_2x2_8x32x1_8x32x1_1x32x1x8_8_1x1_intrawave_v3,793.84,287.48,0.0
gfx942,304,18432,3584,5120,ck,0,0,827.8721,a8w8_blockscale_1x128x128_256x128x128x128_16x16_32x32_2x2_8x32x1_8x32x1_1x32x1x8_8_1x1_intrawave_v3,817.1,295.75,0.0
gfx942,304,18560,3584,5120,ck,0,0,848.5213,a8w8_blockscale_1x128x128_256x128x128x128_16x16_32x32_2x2_8x32x1_8x32x1_1x32x1x8_8_1x1_intrawave_v3,802.76,290.41,0.0
gfx942,304,18688,3584,5120,ck,0,0,851.7419,a8w8_blockscale_1x128x128_256x128x128x128_16x16_32x32_2x2_8x32x1_8x32x1_1x32x1x8_8_1x1_intrawave_v3,805.24,291.15,0.0
gfx942,304,18816,3584,5120,ck,0,0,852.9267,a8w8_blockscale_1x128x128_256x128x128x128_16x16_32x32_2x2_8x32x1_8x32x1_1x32x1x8_8_1x1_intrawave_v3,809.62,292.59,0.0
gfx942,304,18944,3584,5120,ck,0,0,862.207,a8w8_blockscale_1x128x128_256x128x128x128_16x16_32x32_2x2_8x32x1_8x32x1_1x32x1x8_8_1x1_intrawave_v3,806.36,291.27,0.0
gfx942,304,19072,3584,5120,ck,0,0,862.1233,a8w8_blockscale_1x128x128_256x128x128x128_16x16_32x32_2x2_8x32x1_8x32x1_1x32x1x8_8_1x1_intrawave_v3,811.89,293.12,0.0
gfx942,304,19200,3584,5120,ck,0,0,882.0689,a8w8_blockscale_1x128x128_256x128x128x128_16x16_32x32_2x2_8x32x1_8x32x1_1x32x1x8_8_1x1_intrawave_v3,798.85,288.28,0.0
gfx942,304,19328,3584,5120,ck,0,0,886.3566,a8w8_blockscale_1x128x128_256x128x128x128_16x16_32x32_2x2_8x32x1_8x32x1_1x32x1x8_8_1x1_intrawave_v3,800.29,288.66,0.0
gfx942,304,19456,3584,5120,ck,0,0,888.5889,a8w8_blockscale_1x128x128_256x128x128x128_16x16_32x32_2x2_8x32x1_8x32x1_1x32x1x8_8_1x1_intrawave_v3,803.56,289.7,0.0
gfx942,304,19584,3584,5120,ck,0,0,906.6898,a8w8_blockscale_1x128x128_256x128x128x128_16x16_32x32_2x2_8x32x1_8x32x1_1x32x1x8_8_1x1_intrawave_v3,792.7,285.65,0.0
gfx942,304,19712,3584,5120,ck,0,0,889.9194,a8w8_blockscale_1x128x128_256x128x128x128_16x16_32x32_2x2_8x32x1_8x32x1_1x32x1x8_8_1x1_intrawave_v3,812.92,292.8,0.0
gfx942,304,19840,3584,5120,ck,0,0,909.0598,a8w8_blockscale_1x128x128_256x128x128x128_16x16_32x32_2x2_8x32x1_8x32x1_1x32x1x8_8_1x1_intrawave_v3,800.97,288.37,0.0
gfx942,304,19968,3584,5120,ck,0,0,898.3613,a8w8_blockscale_1x128x128_256x128x128x128_16x16_32x32_2x2_8x32x1_8x32x1_1x32x1x8_8_1x1_intrawave_v3,815.74,293.55,0.0
gfx942,304,20096,3584,5120,ck,0,0,915.8118,a8w8_blockscale_1x128x128_256x128x128x128_16x16_32x32_2x2_8x32x1_8x32x1_1x32x1x8_8_1x1_intrawave_v3,805.33,289.68,0.0
gfx942,304,20224,3584,5120,ck,0,0,907.877,a8w8_blockscale_1x128x128_256x128x128x128_16x16_32x32_2x2_8x32x1_8x32x1_1x32x1x8_8_1x1_intrawave_v3,817.54,293.94,0.0
gfx942,304,20352,3584,5120,ck,0,0,918.4027,a8w8_blockscale_1x128x128_256x128x128x128_16x16_32x32_2x2_8x32x1_8x32x1_1x32x1x8_8_1x1_intrawave_v3,813.28,292.29,0.0
gfx942,304,20480,3584,5120,ck,0,0,912.6858,a8w8_blockscale_1x128x128_256x128x128x128_16x16_32x32_2x2_8x32x1_8x32x1_1x32x1x8_8_1x1_intrawave_v3,823.52,295.84,0.0
gfx942,304,20608,3584,5120,ck,0,0,936.0335,a8w8_blockscale_1x128x128_256x128x128x128_16x16_32x32_2x2_8x32x1_8x32x1_1x32x1x8_8_1x1_intrawave_v3,808.0,290.14,0.0
gfx942,304,20736,3584,5120,ck,0,0,949.8705,a8w8_blockscale_1x128x128_256x128x128x128_16x16_32x32_2x2_8x32x1_8x32x1_1x32x1x8_8_1x1_intrawave_v3,801.18,287.57,0.0
gfx942,304,20864,3584,5120,ck,0,0,947.2588,a8w8_blockscale_1x128x128_256x128x128x128_16x16_32x32_2x2_8x32x1_8x32x1_1x32x1x8_8_1x1_intrawave_v3,808.35,290.02,0.0
gfx942,304,20992,3584,5120,ck,0,0,960.2994,a8w8_blockscale_1x128x128_256x128x128x128_16x16_32x32_2x2_8x32x1_8x32x1_1x32x1x8_8_1x1_intrawave_v3,802.26,287.72,0.0
gfx942,304,21120,3584,5120,ck,0,0,965.4635,a8w8_blockscale_1x128x128_256x128x128x128_16x16_32x32_2x2_8x32x1_8x32x1_1x32x1x8_8_1x1_intrawave_v3,802.83,287.81,0.0
gfx942,304,21248,3584,5120,ck,0,0,971.7852,a8w8_blockscale_1x128x128_256x128x128x128_16x16_32x32_2x2_8x32x1_8x32x1_1x32x1x8_8_1x1_intrawave_v3,802.45,287.56,0.0
gfx942,304,21376,3584,5120,ck,0,0,979.7852,a8w8_blockscale_1x128x128_256x128x128x128_16x16_32x32_2x2_8x32x1_8x32x1_1x32x1x8_8_1x1_intrawave_v3,800.69,286.82,0.0
gfx942,304,21504,3584,5120,ck,0,0,969.7846,a8w8_blockscale_1x128x128_256x128x128x128_16x16_32x32_2x2_8x32x1_8x32x1_1x32x1x8_8_1x1_intrawave_v3,813.79,291.4,0.0
gfx942,304,21632,3584,5120,ck,0,0,988.6295,a8w8_blockscale_1x128x128_256x128x128x128_16x16_32x32_2x2_8x32x1_8x32x1_1x32x1x8_8_1x1_intrawave_v3,803.03,287.43,0.0
gfx942,304,21760,3584,5120,ck,0,0,986.7907,a8w8_blockscale_1x128x128_256x128x128x128_16x16_32x32_2x2_8x32x1_8x32x1_1x32x1x8_8_1x1_intrawave_v3,809.29,289.56,0.0
gfx942,304,21888,3584,5120,ck,0,0,998.913,a8w8_blockscale_1x128x128_256x128x128x128_16x16_32x32_2x2_8x32x1_8x32x1_1x32x1x8_8_1x1_intrawave_v3,804.17,287.62,0.0
gfx942,304,22016,3584,5120,ck,0,0,1015.5688,a8w8_blockscale_1x128x128_256x128x128x128_16x16_32x32_2x2_8x32x1_8x32x1_1x32x1x8_8_1x1_intrawave_v3,795.6,284.45,0.0
gfx942,304,22144,3584,5120,ck,0,0,1009.4522,a8w8_blockscale_1x128x128_256x128x128x128_16x16_32x32_2x2_8x32x1_8x32x1_1x32x1x8_8_1x1_intrawave_v3,805.08,287.74,0.0
gfx942,304,22272,3584,5120,ck,0,0,1004.0316,a8w8_blockscale_1x128x128_256x128x128x128_16x16_32x32_2x2_8x32x1_8x32x1_1x32x1x8_8_1x1_intrawave_v3,814.1,290.86,0.0
gfx942,304,22400,3584,5120,ck,0,0,1004.5749,a8w8_blockscale_1x128x128_256x128x128x128_16x16_32x32_2x2_8x32x1_8x32x1_1x32x1x8_8_1x1_intrawave_v3,818.34,292.26,0.0
gfx942,304,22528,3584,5120,ck,0,0,1022.3491,a8w8_blockscale_1x128x128_256x128x128x128_16x16_32x32_2x2_8x32x1_8x32x1_1x32x1x8_8_1x1_intrawave_v3,808.71,288.72,0.0
gfx942,304,22656,3584,5120,ck,0,0,1029.4852,a8w8_blockscale_1x128x128_256x128x128x128_16x16_32x32_2x2_8x32x1_8x32x1_1x32x1x8_8_1x1_intrawave_v3,807.66,288.25,0.0
gfx942,304,22784,3584,5120,ck,0,0,1029.524,a8w8_blockscale_1x128x128_256x128x128x128_16x16_32x32_2x2_8x32x1_8x32x1_1x32x1x8_8_1x1_intrawave_v3,812.2,289.76,0.0
gfx942,304,22912,3584,5120,ck,0,0,1046.4544,a8w8_blockscale_1x128x128_256x128x128x128_16x16_32x32_2x2_8x32x1_8x32x1_1x32x1x8_8_1x1_intrawave_v3,803.55,286.58,0.0
gfx942,304,23040,3584,5120,ck,0,0,1039.8102,a8w8_blockscale_1x128x128_256x128x128x128_16x16_32x32_2x2_8x32x1_8x32x1_1x32x1x8_8_1x1_intrawave_v3,813.2,289.92,0.0
gfx942,304,23168,3584,5120,ck,0,0,1049.964,a8w8_blockscale_1x128x128_256x128x128x128_16x16_32x32_2x2_8x32x1_8x32x1_1x32x1x8_8_1x1_intrawave_v3,809.81,288.62,0.0
gfx942,304,23296,3584,5120,ck,0,0,1053.7254,a8w8_blockscale_1x128x128_256x128x128x128_16x16_32x32_2x2_8x32x1_8x32x1_1x32x1x8_8_1x1_intrawave_v3,811.38,289.08,0.0
gfx942,304,23424,3584,5120,ck,0,0,1069.2431,a8w8_blockscale_1x128x128_256x128x128x128_16x16_32x32_2x2_8x32x1_8x32x1_1x32x1x8_8_1x1_intrawave_v3,803.99,286.36,0.0
gfx942,304,23552,3584,5120,ck,0,0,1052.2524,a8w8_blockscale_1x128x128_256x128x128x128_16x16_32x32_2x2_8x32x1_8x32x1_1x32x1x8_8_1x1_intrawave_v3,821.44,292.47,0.0
gfx942,304,23680,3584,5120,ck,0,0,1085.5741,a8w8_blockscale_1x128x128_256x128x128x128_16x16_32x32_2x2_8x32x1_8x32x1_1x32x1x8_8_1x1_intrawave_v3,800.55,284.95,0.0
gfx942,304,23808,3584,5120,ck,0,0,1089.23,a8w8_blockscale_1x128x128_256x128x128x128_16x16_32x32_2x2_8x32x1_8x32x1_1x32x1x8_8_1x1_intrawave_v3,802.18,285.43,0.0
gfx942,304,23936,3584,5120,ck,0,0,1070.2694,a8w8_blockscale_1x128x128_256x128x128x128_16x16_32x32_2x2_8x32x1_8x32x1_1x32x1x8_8_1x1_intrawave_v3,820.78,291.96,0.0
gfx942,304,24064,3584,5120,ck,0,0,1093.5438,a8w8_blockscale_1x128x128_256x128x128x128_16x16_32x32_2x2_8x32x1_8x32x1_1x32x1x8_8_1x1_intrawave_v3,807.61,287.18,0.0
gfx942,304,24192,3584,5120,ck,0,0,1098.9243,a8w8_blockscale_1x128x128_256x128x128x128_16x16_32x32_2x2_8x32x1_8x32x1_1x32x1x8_8_1x1_intrawave_v3,807.93,287.21,0.0
gfx942,304,24320,3584,5120,ck,0,0,1106.6176,a8w8_blockscale_1x128x128_256x128x128x128_16x16_32x32_2x2_8x32x1_8x32x1_1x32x1x8_8_1x1_intrawave_v3,806.55,286.63,0.0
gfx942,304,24448,3584,5120,ck,0,0,1096.2187,a8w8_blockscale_1x128x128_256x128x128x128_16x16_32x32_2x2_8x32x1_8x32x1_1x32x1x8_8_1x1_intrawave_v3,818.49,290.79,0.0
gfx942,304,24576,3584,5120,ck,0,0,1108.0139,a8w8_blockscale_1x128x128_256x128x128x128_16x16_32x32_2x2_8x32x1_8x32x1_1x32x1x8_8_1x1_intrawave_v3,814.02,289.11,0.0
gfx942,304,24704,3584,5120,ck,0,0,1114.9486,a8w8_blockscale_1x128x128_256x128x128x128_16x16_32x32_2x2_8x32x1_8x32x1_1x32x1x8_8_1x1_intrawave_v3,813.17,288.72,0.0
gfx942,304,24832,3584,5120,ck,0,0,1134.1161,a8w8_blockscale_1x128x128_256x128x128x128_16x16_32x32_2x2_8x32x1_8x32x1_1x32x1x8_8_1x1_intrawave_v3,803.57,285.23,0.0
gfx942,304,24960,3584,5120,ck,0,0,1144.645,a8w8_blockscale_1x128x128_256x128x128x128_16x16_32x32_2x2_8x32x1_8x32x1_1x32x1x8_8_1x1_intrawave_v3,800.28,283.98,0.0
gfx942,304,25088,3584,5120,ck,0,0,1128.4065,a8w8_blockscale_1x128x128_256x128x128x128_16x16_32x32_2x2_8x32x1_8x32x1_1x32x1x8_8_1x1_intrawave_v3,815.96,289.46,0.0
gfx942,304,25216,3584,5120,ck,0,0,1157.9096,a8w8_blockscale_1x128x128_256x128x128x128_16x16_32x32_2x2_8x32x1_8x32x1_1x32x1x8_8_1x1_intrawave_v3,799.23,283.45,0.0
gfx942,304,25344,3584,5120,ck,0,0,1151.4519,a8w8_blockscale_1x128x128_256x128x128x128_16x16_32x32_2x2_8x32x1_8x32x1_1x32x1x8_8_1x1_intrawave_v3,807.79,286.4,0.0
gfx942,304,25472,3584,5120,ck,0,0,1152.1356,a8w8_blockscale_1x128x128_256x128x128x128_16x16_32x32_2x2_8x32x1_8x32x1_1x32x1x8_8_1x1_intrawave_v3,811.39,287.6,0.0
gfx942,304,25600,3584,5120,ck,0,0,1183.0911,a8w8_blockscale_1x128x128_256x128x128x128_16x16_32x32_2x2_8x32x1_8x32x1_1x32x1x8_8_1x1_intrawave_v3,794.13,281.4,0.0
gfx942,304,25728,3584,5120,ck,0,0,1189.2202,a8w8_blockscale_1x128x128_256x128x128x128_16x16_32x32_2x2_8x32x1_8x32x1_1x32x1x8_8_1x1_intrawave_v3,793.98,281.27,0.0
gfx942,304,25856,3584,5120,ck,0,0,1153.6659,a8w8_blockscale_1x128x128_256x128x128x128_16x16_32x32_2x2_8x32x1_8x32x1_1x32x1x8_8_1x1_intrawave_v3,822.53,291.3,0.0
gfx942,304,25984,3584,5120,ck,0,0,1179.9717,a8w8_blockscale_1x128x128_256x128x128x128_16x16_32x32_2x2_8x32x1_8x32x1_1x32x1x8_8_1x1_intrawave_v3,808.17,286.14,0.0
gfx942,304,26112,3584,5120,ck,0,0,1193.814,a8w8_blockscale_1x128x128_256x128x128x128_16x16_32x32_2x2_8x32x1_8x32x1_1x32x1x8_8_1x1_intrawave_v3,802.73,284.14,0.0
gfx942,304,26240,3584,5120,ck,0,0,1174.9047,a8w8_blockscale_1x128x128_256x128x128x128_16x16_32x32_2x2_8x32x1_8x32x1_1x32x1x8_8_1x1_intrawave_v3,819.65,290.06,0.0
gfx942,304,26368,3584,5120,ck,0,0,1183.5593,a8w8_blockscale_1x128x128_256x128x128x128_16x16_32x32_2x2_8x32x1_8x32x1_1x32x1x8_8_1x1_intrawave_v3,817.63,289.26,0.0
gfx942,304,26496,3584,5120,ck,0,0,1202.3704,a8w8_blockscale_1x128x128_256x128x128x128_16x16_32x32_2x2_8x32x1_8x32x1_1x32x1x8_8_1x1_intrawave_v3,808.74,286.05,0.0
gfx942,304,26624,3584,5120,ck,0,0,1208.6549,a8w8_blockscale_1x128x128_256x128x128x128_16x16_32x32_2x2_8x32x1_8x32x1_1x32x1x8_8_1x1_intrawave_v3,808.42,285.86,0.0
gfx942,304,26752,3584,5120,ck,0,0,1198.1784,a8w8_blockscale_1x128x128_256x128x128x128_16x16_32x32_2x2_8x32x1_8x32x1_1x32x1x8_8_1x1_intrawave_v3,819.41,289.67,0.0
gfx942,304,26880,3584,5120,ck,0,0,1200.072,a8w8_blockscale_1x128x128_256x128x128x128_16x16_32x32_2x2_8x32x1_8x32x1_1x32x1x8_8_1x1_intrawave_v3,822.03,290.53,0.0
gfx942,304,27008,3584,5120,ck,0,0,1221.8643,a8w8_blockscale_1x128x128_256x128x128x128_16x16_32x32_2x2_8x32x1_8x32x1_1x32x1x8_8_1x1_intrawave_v3,811.22,286.63,0.0
gfx942,304,27136,3584,5120,ck,0,0,1229.0146,a8w8_blockscale_1x128x128_256x128x128x128_16x16_32x32_2x2_8x32x1_8x32x1_1x32x1x8_8_1x1_intrawave_v3,810.32,286.24,0.0
gfx942,304,27264,3584,5120,ck,0,0,1243.6214,a8w8_blockscale_1x128x128_256x128x128x128_16x16_32x32_2x2_8x32x1_8x32x1_1x32x1x8_8_1x1_intrawave_v3,804.58,284.15,0.0
gfx942,304,27392,3584,5120,ck,0,0,1234.2477,a8w8_blockscale_1x128x128_256x128x128x128_16x16_32x32_2x2_8x32x1_8x32x1_1x32x1x8_8_1x1_intrawave_v3,814.5,287.58,0.0
gfx942,304,27520,3584,5120,ck,0,0,1249.0013,a8w8_blockscale_1x128x128_256x128x128x128_16x16_32x32_2x2_8x32x1_8x32x1_1x32x1x8_8_1x1_intrawave_v3,808.64,285.44,0.0
gfx942,304,27648,3584,5120,ck,0,0,1234.622,a8w8_blockscale_1x128x128_256x128x128x128_16x16_32x32_2x2_8x32x1_8x32x1_1x32x1x8_8_1x1_intrawave_v3,821.86,290.04,0.0
gfx942,304,27776,3584,5120,ck,0,0,1267.263,a8w8_blockscale_1x128x128_256x128x128x128_16x16_32x32_2x2_8x32x1_8x32x1_1x32x1x8_8_1x1_intrawave_v3,804.4,283.81,0.0
gfx942,304,27904,3584,5120,ck,0,0,1271.7542,a8w8_blockscale_1x128x128_256x128x128x128_16x16_32x32_2x2_8x32x1_8x32x1_1x32x1x8_8_1x1_intrawave_v3,805.25,284.04,0.0
gfx942,304,28032,3584,5120,ck,0,0,1253.2546,a8w8_blockscale_1x128x128_256x128x128x128_16x16_32x32_2x2_8x32x1_8x32x1_1x32x1x8_8_1x1_intrawave_v3,820.89,289.49,0.0
gfx942,304,28160,3584,5120,ck,0,0,1286.7834,a8w8_blockscale_1x128x128_256x128x128x128_16x16_32x32_2x2_8x32x1_8x32x1_1x32x1x8_8_1x1_intrawave_v3,803.15,283.17,0.0
gfx942,304,28288,3584,5120,ck,0,0,1292.0128,a8w8_blockscale_1x128x128_256x128x128x128_16x16_32x32_2x2_8x32x1_8x32x1_1x32x1x8_8_1x1_intrawave_v3,803.53,283.24,0.0
gfx942,304,28416,3584,5120,ck,0,0,1282.873,a8w8_blockscale_1x128x128_256x128x128x128_16x16_32x32_2x2_8x32x1_8x32x1_1x32x1x8_8_1x1_intrawave_v3,812.92,286.49,0.0
gfx942,304,28544,3584,5120,ck,0,0,1277.8048,a8w8_blockscale_1x128x128_256x128x128x128_16x16_32x32_2x2_8x32x1_8x32x1_1x32x1x8_8_1x1_intrawave_v3,819.82,288.85,0.0
gfx942,304,28672,3584,5120,ck,0,0,1297.2966,a8w8_blockscale_1x128x128_256x128x128x128_16x16_32x32_2x2_8x32x1_8x32x1_1x32x1x8_8_1x1_intrawave_v3,811.12,285.73,0.0
gfx942,304,28800,3584,5120,ck,0,0,1309.5694,a8w8_blockscale_1x128x128_256x128x128x128_16x16_32x32_2x2_8x32x1_8x32x1_1x32x1x8_8_1x1_intrawave_v3,807.11,284.25,0.0
gfx942,304,28928,3584,5120,ck,0,0,1328.5735,a8w8_blockscale_1x128x128_256x128x128x128_16x16_32x32_2x2_8x32x1_8x32x1_1x32x1x8_8_1x1_intrawave_v3,799.1,281.37,0.0
gfx942,304,29056,3584,5120,ck,0,0,1318.5007,a8w8_blockscale_1x128x128_256x128x128x128_16x16_32x32_2x2_8x32x1_8x32x1_1x32x1x8_8_1x1_intrawave_v3,808.77,284.71,0.0
gfx942,304,29184,3584,5120,ck,0,0,1319.6404,a8w8_blockscale_1x128x128_256x128x128x128_16x16_32x32_2x2_8x32x1_8x32x1_1x32x1x8_8_1x1_intrawave_v3,811.63,285.66,0.0
gfx942,304,29312,3584,5120,ck,0,0,1350.1539,a8w8_blockscale_1x128x128_256x128x128x128_16x16_32x32_2x2_8x32x1_8x32x1_1x32x1x8_8_1x1_intrawave_v3,796.76,280.37,0.0
gfx942,304,29440,3584,5120,ck,0,0,1333.1015,a8w8_blockscale_1x128x128_256x128x128x128_16x16_32x32_2x2_8x32x1_8x32x1_1x32x1x8_8_1x1_intrawave_v3,810.48,285.13,0.0
gfx942,304,29568,3584,5120,ck,0,0,1349.9859,a8w8_blockscale_1x128x128_256x128x128x128_16x16_32x32_2x2_8x32x1_8x32x1_1x32x1x8_8_1x1_intrawave_v3,803.82,282.73,0.0
gfx942,304,29696,3584,5120,ck,0,0,1361.0679,a8w8_blockscale_1x128x128_256x128x128x128_16x16_32x32_2x2_8x32x1_8x32x1_1x32x1x8_8_1x1_intrawave_v3,800.73,281.58,0.0
gfx942,304,29824,3584,5120,ck,0,0,1358.2348,a8w8_blockscale_1x128x128_256x128x128x128_16x16_32x32_2x2_8x32x1_8x32x1_1x32x1x8_8_1x1_intrawave_v3,805.86,283.33,0.0
gfx942,304,29952,3584,5120,ck,0,0,1341.8973,a8w8_blockscale_1x128x128_256x128x128x128_16x16_32x32_2x2_8x32x1_8x32x1_1x32x1x8_8_1x1_intrawave_v3,819.17,287.95,0.0
gfx942,304,30080,3584,5120,ck,0,0,1381.4928,a8w8_blockscale_1x128x128_256x128x128x128_16x16_32x32_2x2_8x32x1_8x32x1_1x32x1x8_8_1x1_intrawave_v3,799.09,280.84,0.0
gfx942,304,30208,3584,5120,ck,0,0,1346.35,a8w8_blockscale_1x128x128_256x128x128x128_16x16_32x32_2x2_8x32x1_8x32x1_1x32x1x8_8_1x1_intrawave_v3,823.44,289.33,0.0
gfx942,304,30336,3584,5120,ck,0,0,1357.9069,a8w8_blockscale_1x128x128_256x128x128x128_16x16_32x32_2x2_8x32x1_8x32x1_1x32x1x8_8_1x1_intrawave_v3,819.89,288.03,0.0
gfx942,304,30464,3584,5120,ck,0,0,1405.2271,a8w8_blockscale_1x128x128_256x128x128x128_16x16_32x32_2x2_8x32x1_8x32x1_1x32x1x8_8_1x1_intrawave_v3,795.62,279.45,0.0
gfx942,304,30592,3584,5120,ck,0,0,1392.6977,a8w8_blockscale_1x128x128_256x128x128x128_16x16_32x32_2x2_8x32x1_8x32x1_1x32x1x8_8_1x1_intrawave_v3,806.16,283.09,0.0
gfx942,304,30720,3584,5120,ck,0,0,1369.8628,a8w8_blockscale_1x128x128_256x128x128x128_16x16_32x32_2x2_8x32x1_8x32x1_1x32x1x8_8_1x1_intrawave_v3,823.02,288.96,0.0
gfx942,304,30848,3584,5120,ck,0,0,1419.2014,a8w8_blockscale_1x128x128_256x128x128x128_16x16_32x32_2x2_8x32x1_8x32x1_1x32x1x8_8_1x1_intrawave_v3,797.72,280.02,0.0
gfx942,304,30976,3584,5120,ck,0,0,1408.4723,a8w8_blockscale_1x128x128_256x128x128x128_16x16_32x32_2x2_8x32x1_8x32x1_1x32x1x8_8_1x1_intrawave_v3,807.13,283.27,0.0
gfx942,304,31104,3584,5120,ck,0,0,1414.7866,a8w8_blockscale_1x128x128_256x128x128x128_16x16_32x32_2x2_8x32x1_8x32x1_1x32x1x8_8_1x1_intrawave_v3,806.85,283.12,0.0
gfx942,304,31232,3584,5120,ck,0,0,1420.9938,a8w8_blockscale_1x128x128_256x128x128x128_16x16_32x32_2x2_8x32x1_8x32x1_1x32x1x8_8_1x1_intrawave_v3,806.63,282.99,0.0
gfx942,304,31360,3584,5120,ck,0,0,1412.6707,a8w8_blockscale_1x128x128_256x128x128x128_16x16_32x32_2x2_8x32x1_8x32x1_1x32x1x8_8_1x1_intrawave_v3,814.71,285.77,0.0
gfx942,304,31488,3584,5120,ck,0,0,1439.8978,a8w8_blockscale_1x128x128_256x128x128x128_16x16_32x32_2x2_8x32x1_8x32x1_1x32x1x8_8_1x1_intrawave_v3,802.57,281.46,0.0
gfx942,304,31616,3584,5120,ck,0,0,1418.837,a8w8_blockscale_1x128x128_256x128x128x128_16x16_32x32_2x2_8x32x1_8x32x1_1x32x1x8_8_1x1_intrawave_v3,817.79,286.75,0.0
gfx942,304,31744,3584,5120,ck,0,0,1415.6556,a8w8_blockscale_1x128x128_256x128x128x128_16x16_32x32_2x2_8x32x1_8x32x1_1x32x1x8_8_1x1_intrawave_v3,822.95,288.5,0.0
gfx942,304,31872,3584,5120,ck,0,0,1468.2552,a8w8_blockscale_1x128x128_256x128x128x128_16x16_32x32_2x2_8x32x1_8x32x1_1x32x1x8_8_1x1_intrawave_v3,796.66,279.24,0.0
gfx942,304,32000,3584,5120,ck,0,0,1447.8691,a8w8_blockscale_1x128x128_256x128x128x128_16x16_32x32_2x2_8x32x1_8x32x1_1x32x1x8_8_1x1_intrawave_v3,811.13,284.26,0.0
gfx942,304,32128,3584,5120,ck,0,0,1456.3467,a8w8_blockscale_1x128x128_256x128x128x128_16x16_32x32_2x2_8x32x1_8x32x1_1x32x1x8_8_1x1_intrawave_v3,809.63,283.68,0.0
gfx942,304,32256,3584,5120,ck,0,0,1485.6065,a8w8_blockscale_1x128x128_256x128x128x128_16x16_32x32_2x2_8x32x1_8x32x1_1x32x1x8_8_1x1_intrawave_v3,796.85,279.15,0.0
gfx942,304,32384,3584,5120,ck,0,0,1472.5146,a8w8_blockscale_1x128x128_256x128x128x128_16x16_32x32_2x2_8x32x1_8x32x1_1x32x1x8_8_1x1_intrawave_v3,807.12,282.7,0.0
gfx942,304,32512,3584,5120,ck,0,0,1446.8961,a8w8_blockscale_1x128x128_256x128x128x128_16x16_32x32_2x2_8x32x1_8x32x1_1x32x1x8_8_1x1_intrawave_v3,824.66,288.8,0.0
gfx942,304,32640,3584,5120,ck,0,0,1479.8143,a8w8_blockscale_1x128x128_256x128x128x128_16x16_32x32_2x2_8x32x1_8x32x1_1x32x1x8_8_1x1_intrawave_v3,809.49,283.43,0.0
gfx942,304,32768,3584,5120,ck,0,0,1457.3978,a8w8_blockscale_1x128x128_256x128x128x128_16x16_32x32_2x2_8x32x1_8x32x1_1x32x1x8_8_1x1_intrawave_v3,825.16,288.87,0.0
gfx942,304,32896,3584,5120,ck,0,0,1523.746,a8w8_blockscale_1x128x128_256x128x128x128_16x16_32x32_2x2_8x32x1_8x32x1_1x32x1x8_8_1x1_intrawave_v3,792.32,277.33,0.0
gfx942,304,33024,3584,5120,ck,0,0,1505.0238,a8w8_blockscale_1x128x128_256x128x128x128_16x16_32x32_2x2_8x32x1_8x32x1_1x32x1x8_8_1x1_intrawave_v3,805.29,281.82,0.0
gfx942,304,33152,3584,5120,ck,0,0,1507.2216,a8w8_blockscale_1x128x128_256x128x128x128_16x16_32x32_2x2_8x32x1_8x32x1_1x32x1x8_8_1x1_intrawave_v3,807.24,282.45,0.0
gfx942,304,33280,3584,5120,ck,0,0,1514.4427,a8w8_blockscale_1x128x128_256x128x128x128_16x16_32x32_2x2_8x32x1_8x32x1_1x32x1x8_8_1x1_intrawave_v3,806.49,282.15,0.0
gfx942,304,33408,3584,5120,ck,0,0,1502.9378,a8w8_blockscale_1x128x128_256x128x128x128_16x16_32x32_2x2_8x32x1_8x32x1_1x32x1x8_8_1x1_intrawave_v3,815.79,285.35,0.0
gfx942,304,33536,3584,5120,ck,0,0,1539.4711,a8w8_blockscale_1x128x128_256x128x128x128_16x16_32x32_2x2_8x32x1_8x32x1_1x32x1x8_8_1x1_intrawave_v3,799.48,279.6,0.0
gfx942,304,33664,3584,5120,ck,0,0,1510.5006,a8w8_blockscale_1x128x128_256x128x128x128_16x16_32x32_2x2_8x32x1_8x32x1_1x32x1x8_8_1x1_intrawave_v3,817.92,286.01,0.0
gfx942,304,33792,3584,5120,ck,0,0,1536.342,a8w8_blockscale_1x128x128_256x128x128x128_16x16_32x32_2x2_8x32x1_8x32x1_1x32x1x8_8_1x1_intrawave_v3,807.22,282.22,0.0
gfx942,304,33920,3584,5120,ck,0,0,1541.9263,a8w8_blockscale_1x128x128_256x128x128x128_16x16_32x32_2x2_8x32x1_8x32x1_1x32x1x8_8_1x1_intrawave_v3,807.35,282.22,0.0
gfx942,304,34048,3584,5120,ck,0,0,1515.1245,a8w8_blockscale_1x128x128_256x128x128x128_16x16_32x32_2x2_8x32x1_8x32x1_1x32x1x8_8_1x1_intrawave_v3,824.73,288.25,0.0
gfx942,304,34176,3584,5120,ck,0,0,1545.8313,a8w8_blockscale_1x128x128_256x128x128x128_16x16_32x32_2x2_8x32x1_8x32x1_1x32x1x8_8_1x1_intrawave_v3,811.39,283.54,0.0
gfx942,304,34304,3584,5120,ck,0,0,1559.7337,a8w8_blockscale_1x128x128_256x128x128x128_16x16_32x32_2x2_8x32x1_8x32x1_1x32x1x8_8_1x1_intrawave_v3,807.16,282.02,0.0
gfx942,304,34432,3584,5120,ck,0,0,1575.7008,a8w8_blockscale_1x128x128_256x128x128x128_16x16_32x32_2x2_8x32x1_8x32x1_1x32x1x8_8_1x1_intrawave_v3,801.97,280.16,0.0
gfx942,304,34560,3584,5120,ck,0,0,1548.0926,a8w8_blockscale_1x128x128_256x128x128x128_16x16_32x32_2x2_8x32x1_8x32x1_1x32x1x8_8_1x1_intrawave_v3,819.3,286.17,0.0
gfx942,304,34688,3584,5120,ck,0,0,1577.3438,a8w8_blockscale_1x128x128_256x128x128x128_16x16_32x32_2x2_8x32x1_8x32x1_1x32x1x8_8_1x1_intrawave_v3,807.09,281.86,0.0
gfx942,304,34816,3584,5120,ck,0,0,1606.2775,a8w8_blockscale_1x128x128_256x128x128x128_16x16_32x32_2x2_8x32x1_8x32x1_1x32x1x8_8_1x1_intrawave_v3,795.47,277.77,0.0
gfx942,304,34944,3584,5120,ck,0,0,1571.4835,a8w8_blockscale_1x128x128_256x128x128x128_16x16_32x32_2x2_8x32x1_8x32x1_1x32x1x8_8_1x1_intrawave_v3,816.08,284.92,0.0
gfx942,304,35072,3584,5120,ck,0,0,1609.2619,a8w8_blockscale_1x128x128_256x128x128x128_16x16_32x32_2x2_8x32x1_8x32x1_1x32x1x8_8_1x1_intrawave_v3,799.84,279.21,0.0
gfx942,304,35200,3584,5120,ck,0,0,1594.3461,a8w8_blockscale_1x128x128_256x128x128x128_16x16_32x32_2x2_8x32x1_8x32x1_1x32x1x8_8_1x1_intrawave_v3,810.27,282.8,0.0
gfx942,304,35328,3584,5120,ck,0,0,1583.2925,a8w8_blockscale_1x128x128_256x128x128x128_16x16_32x32_2x2_8x32x1_8x32x1_1x32x1x8_8_1x1_intrawave_v3,818.89,285.77,0.0
gfx942,304,35456,3584,5120,ck,0,0,1606.4116,a8w8_blockscale_1x128x128_256x128x128x128_16x16_32x32_2x2_8x32x1_8x32x1_1x32x1x8_8_1x1_intrawave_v3,810.03,282.64,0.0
gfx942,304,35584,3584,5120,ck,0,0,1606.0711,a8w8_blockscale_1x128x128_256x128x128x128_16x16_32x32_2x2_8x32x1_8x32x1_1x32x1x8_8_1x1_intrawave_v3,813.13,283.68,0.0
gfx942,304,35712,3584,5120,ck,0,0,1646.2947,a8w8_blockscale_1x128x128_256x128x128x128_16x16_32x32_2x2_8x32x1_8x32x1_1x32x1x8_8_1x1_intrawave_v3,796.11,277.7,0.0
gfx942,304,35840,3584,5120,ck,0,0,1645.2309,a8w8_blockscale_1x128x128_256x128x128x128_16x16_32x32_2x2_8x32x1_8x32x1_1x32x1x8_8_1x1_intrawave_v3,799.48,278.84,0.0
gfx942,304,35968,3584,5120,ck,0,0,1643.7603,a8w8_blockscale_1x128x128_256x128x128x128_16x16_32x32_2x2_8x32x1_8x32x1_1x32x1x8_8_1x1_intrawave_v3,803.06,280.04,0.0
gfx942,304,36096,3584,5120,ck,0,0,1642.1671,a8w8_blockscale_1x128x128_256x128x128x128_16x16_32x32_2x2_8x32x1_8x32x1_1x32x1x8_8_1x1_intrawave_v3,806.7,281.27,0.0
gfx942,304,36224,3584,5120,ck,0,0,1646.2737,a8w8_blockscale_1x128x128_256x128x128x128_16x16_32x32_2x2_8x32x1_8x32x1_1x32x1x8_8_1x1_intrawave_v3,807.54,281.53,0.0
gfx942,304,36352,3584,5120,ck,0,0,1635.7412,a8w8_blockscale_1x128x128_256x128x128x128_16x16_32x32_2x2_8x32x1_8x32x1_1x32x1x8_8_1x1_intrawave_v3,815.61,284.3,0.0
gfx942,304,36480,3584,5120,ck,0,0,1667.9931,a8w8_blockscale_1x128x128_256x128x128x128_16x16_32x32_2x2_8x32x1_8x32x1_1x32x1x8_8_1x1_intrawave_v3,802.65,279.75,0.0
gfx942,304,36608,3584,5120,ck,0,0,1659.6905,a8w8_blockscale_1x128x128_256x128x128x128_16x16_32x32_2x2_8x32x1_8x32x1_1x32x1x8_8_1x1_intrawave_v3,809.5,282.09,0.0
gfx942,304,36736,3584,5120,ck,0,0,1685.1687,a8w8_blockscale_1x128x128_256x128x128x128_16x16_32x32_2x2_8x32x1_8x32x1_1x32x1x8_8_1x1_intrawave_v3,800.05,278.76,0.0
gfx942,304,36864,3584,5120,ck,0,0,1670.4,a8w8_blockscale_1x128x128_256x128x128x128_16x16_32x32_2x2_8x32x1_8x32x1_1x32x1x8_8_1x1_intrawave_v3,809.93,282.17,0.0
gfx942,304,36992,3584,5120,ck,0,0,1689.0589,a8w8_blockscale_1x128x128_256x128x128x128_16x16_32x32_2x2_8x32x1_8x32x1_1x32x1x8_8_1x1_intrawave_v3,803.77,279.98,0.0
gfx942,304,37120,3584,5120,ck,0,0,1666.6306,a8w8_blockscale_1x128x128_256x128x128x128_16x16_32x32_2x2_8x32x1_8x32x1_1x32x1x8_8_1x1_intrawave_v3,817.4,284.69,0.0
gfx942,304,37248,3584,5120,ck,0,0,1702.4191,a8w8_blockscale_1x128x128_256x128x128x128_16x16_32x32_2x2_8x32x1_8x32x1_1x32x1x8_8_1x1_intrawave_v3,802.98,279.63,0.0
gfx942,304,37376,3584,5120,ck,0,0,1722.3347,a8w8_blockscale_1x128x128_256x128x128x128_16x16_32x32_2x2_8x32x1_8x32x1_1x32x1x8_8_1x1_intrawave_v3,796.42,277.31,0.0
gfx942,304,37504,3584,5120,ck,0,0,1732.1575,a8w8_blockscale_1x128x128_256x128x128x128_16x16_32x32_2x2_8x32x1_8x32x1_1x32x1x8_8_1x1_intrawave_v3,794.62,276.65,0.0
gfx942,304,37632,3584,5120,ck,0,0,1682.1797,a8w8_blockscale_1x128x128_256x128x128x128_16x16_32x32_2x2_8x32x1_8x32x1_1x32x1x8_8_1x1_intrawave_v3,821.02,285.8,0.0
gfx942,304,37760,3584,5120,ck,0,0,1740.1479,a8w8_blockscale_1x128x128_256x128x128x128_16x16_32x32_2x2_8x32x1_8x32x1_1x32x1x8_8_1x1_intrawave_v3,796.37,277.19,0.0
gfx942,304,37888,3584,5120,ck,0,0,1753.8664,a8w8_blockscale_1x128x128_256x128x128x128_16x16_32x32_2x2_8x32x1_8x32x1_1x32x1x8_8_1x1_intrawave_v3,792.82,275.91,0.0
gfx942,304,38016,3584,5120,ck,0,0,1758.8235,a8w8_blockscale_1x128x128_256x128x128x128_16x16_32x32_2x2_8x32x1_8x32x1_1x32x1x8_8_1x1_intrawave_v3,793.25,276.03,0.0
gfx942,304,38144,3584,5120,ck,0,0,1751.1746,a8w8_blockscale_1x128x128_256x128x128x128_16x16_32x32_2x2_8x32x1_8x32x1_1x32x1x8_8_1x1_intrawave_v3,799.4,278.14,0.0
gfx942,304,38272,3584,5120,ck,0,0,1739.304,a8w8_blockscale_1x128x128_256x128x128x128_16x16_32x32_2x2_8x32x1_8x32x1_1x32x1x8_8_1x1_intrawave_v3,807.56,280.94,0.0
gfx942,304,38400,3584,5120,ck,0,0,1758.6637,a8w8_blockscale_1x128x128_256x128x128x128_16x16_32x32_2x2_8x32x1_8x32x1_1x32x1x8_8_1x1_intrawave_v3,801.34,278.74,0.0
gfx942,304,38528,3584,5120,ck,0,0,1751.0708,a8w8_blockscale_1x128x128_256x128x128x128_16x16_32x32_2x2_8x32x1_8x32x1_1x32x1x8_8_1x1_intrawave_v3,807.5,280.85,0.0
gfx942,304,38656,3584,5120,ck,0,0,1724.3408,a8w8_blockscale_1x128x128_256x128x128x128_16x16_32x32_2x2_8x32x1_8x32x1_1x32x1x8_8_1x1_intrawave_v3,822.74,286.11,0.0
gfx942,304,38784,3584,5120,ck,0,0,1729.2938,a8w8_blockscale_1x128x128_256x128x128x128_16x16_32x32_2x2_8x32x1_8x32x1_1x32x1x8_8_1x1_intrawave_v3,823.1,286.2,0.0
gfx942,304,38912,3584,5120,ck,0,0,1757.3671,a8w8_blockscale_1x128x128_256x128x128x128_16x16_32x32_2x2_8x32x1_8x32x1_1x32x1x8_8_1x1_intrawave_v3,812.62,282.53,0.0
gfx942,304,39040,3584,5120,ck,0,0,1740.3797,a8w8_blockscale_1x128x128_256x128x128x128_16x16_32x32_2x2_8x32x1_8x32x1_1x32x1x8_8_1x1_intrawave_v3,823.25,286.19,0.0
gfx942,304,39168,3584,5120,ck,0,0,1766.6996,a8w8_blockscale_1x128x128_256x128x128x128_16x16_32x32_2x2_8x32x1_8x32x1_1x32x1x8_8_1x1_intrawave_v3,813.65,282.81,0.0
gfx942,304,39296,3584,5120,ck,0,0,1773.9907,a8w8_blockscale_1x128x128_256x128x128x128_16x16_32x32_2x2_8x32x1_8x32x1_1x32x1x8_8_1x1_intrawave_v3,812.95,282.54,0.0
gfx942,304,39424,3584,5120,ck,0,0,1783.9695,a8w8_blockscale_1x128x128_256x128x128x128_16x16_32x32_2x2_8x32x1_8x32x1_1x32x1x8_8_1x1_intrawave_v3,811.04,281.84,0.0
gfx942,304,39552,3584,5120,ck,0,0,1778.1971,a8w8_blockscale_1x128x128_256x128x128x128_16x16_32x32_2x2_8x32x1_8x32x1_1x32x1x8_8_1x1_intrawave_v3,816.31,283.64,0.0
gfx942,304,39680,3584,5120,ck,0,0,1814.8654,a8w8_blockscale_1x128x128_256x128x128x128_16x16_32x32_2x2_8x32x1_8x32x1_1x32x1x8_8_1x1_intrawave_v3,802.41,278.77,0.0
gfx942,304,39808,3584,5120,ck,0,0,1803.3723,a8w8_blockscale_1x128x128_256x128x128x128_16x16_32x32_2x2_8x32x1_8x32x1_1x32x1x8_8_1x1_intrawave_v3,810.13,281.42,0.0
gfx942,304,39936,3584,5120,ck,0,0,1809.3014,a8w8_blockscale_1x128x128_256x128x128x128_16x16_32x32_2x2_8x32x1_8x32x1_1x32x1x8_8_1x1_intrawave_v3,810.07,281.37,0.0
gfx942,304,40064,3584,5120,ck,0,0,1813.2891,a8w8_blockscale_1x128x128_256x128x128x128_16x16_32x32_2x2_8x32x1_8x32x1_1x32x1x8_8_1x1_intrawave_v3,810.88,281.62,0.0
gfx942,304,40192,3584,5120,ck,0,0,1818.5889,a8w8_blockscale_1x128x128_256x128x128x128_16x16_32x32_2x2_8x32x1_8x32x1_1x32x1x8_8_1x1_intrawave_v3,811.1,281.66,0.0
gfx942,304,40320,3584,5120,ck,0,0,1833.7006,a8w8_blockscale_1x128x128_256x128x128x128_16x16_32x32_2x2_8x32x1_8x32x1_1x32x1x8_8_1x1_intrawave_v3,806.97,280.2,0.0
gfx942,304,40448,3584,5120,ck,0,0,1801.7344,a8w8_blockscale_1x128x128_256x128x128x128_16x16_32x32_2x2_8x32x1_8x32x1_1x32x1x8_8_1x1_intrawave_v3,823.9,286.04,0.0
gfx942,304,40576,3584,5120,ck,0,0,1865.1475,a8w8_blockscale_1x128x128_256x128x128x128_16x16_32x32_2x2_8x32x1_8x32x1_1x32x1x8_8_1x1_intrawave_v3,798.41,277.16,0.0
gfx942,304,40704,3584,5120,ck,0,0,1850.3575,a8w8_blockscale_1x128x128_256x128x128x128_16x16_32x32_2x2_8x32x1_8x32x1_1x32x1x8_8_1x1_intrawave_v3,807.33,280.23,0.0
gfx942,304,40832,3584,5120,ck,0,0,1852.4408,a8w8_blockscale_1x128x128_256x128x128x128_16x16_32x32_2x2_8x32x1_8x32x1_1x32x1x8_8_1x1_intrawave_v3,808.95,280.76,0.0
gfx942,304,40960,3584,5120,ck,0,0,1833.7779,a8w8_blockscale_1x128x128_256x128x128x128_16x16_32x32_2x2_8x32x1_8x32x1_1x32x1x8_8_1x1_intrawave_v3,819.75,284.48,0.0
gfx942,304,41088,3584,5120,ck,0,0,1871.1894,a8w8_blockscale_1x128x128_256x128x128x128_16x16_32x32_2x2_8x32x1_8x32x1_1x32x1x8_8_1x1_intrawave_v3,805.87,279.63,0.0
gfx942,304,41216,3584,5120,ck,0,0,1884.0334,a8w8_blockscale_1x128x128_256x128x128x128_16x16_32x32_2x2_8x32x1_8x32x1_1x32x1x8_8_1x1_intrawave_v3,802.87,278.56,0.0
gfx942,304,41344,3584,5120,ck,0,0,1838.4936,a8w8_blockscale_1x128x128_256x128x128x128_16x16_32x32_2x2_8x32x1_8x32x1_1x32x1x8_8_1x1_intrawave_v3,825.31,286.31,0.0
gfx942,304,41472,3584,5120,ck,0,0,1871.4179,a8w8_blockscale_1x128x128_256x128x128x128_16x16_32x32_2x2_8x32x1_8x32x1_1x32x1x8_8_1x1_intrawave_v3,813.3,282.12,0.0
gfx942,304,41600,3584,5120,ck,0,0,1864.3674,a8w8_blockscale_1x128x128_256x128x128x128_16x16_32x32_2x2_8x32x1_8x32x1_1x32x1x8_8_1x1_intrawave_v3,818.9,284.03,0.0
gfx942,304,41728,3584,5120,ck,0,0,1884.4123,a8w8_blockscale_1x128x128_256x128x128x128_16x16_32x32_2x2_8x32x1_8x32x1_1x32x1x8_8_1x1_intrawave_v3,812.68,281.84,0.0
gfx942,304,41856,3584,5120,ck,0,0,1901.2147,a8w8_blockscale_1x128x128_256x128x128x128_16x16_32x32_2x2_8x32x1_8x32x1_1x32x1x8_8_1x1_intrawave_v3,807.97,280.18,0.0
gfx942,304,41984,3584,5120,ck,0,0,1926.2671,a8w8_blockscale_1x128x128_256x128x128x128_16x16_32x32_2x2_8x32x1_8x32x1_1x32x1x8_8_1x1_intrawave_v3,799.9,277.35,0.0
gfx942,304,42112,3584,5120,ck,0,0,1939.8667,a8w8_blockscale_1x128x128_256x128x128x128_16x16_32x32_2x2_8x32x1_8x32x1_1x32x1x8_8_1x1_intrawave_v3,796.71,276.22,0.0
gfx942,304,42240,3584,5120,ck,0,0,1913.6286,a8w8_blockscale_1x128x128_256x128x128x128_16x16_32x32_2x2_8x32x1_8x32x1_1x32x1x8_8_1x1_intrawave_v3,810.09,280.83,0.0
gfx942,304,42368,3584,5120,ck,0,0,1934.3341,a8w8_blockscale_1x128x128_256x128x128x128_16x16_32x32_2x2_8x32x1_8x32x1_1x32x1x8_8_1x1_intrawave_v3,803.85,278.63,0.0
gfx942,304,42496,3584,5120,ck,0,0,1888.5868,a8w8_blockscale_1x128x128_256x128x128x128_16x16_32x32_2x2_8x32x1_8x32x1_1x32x1x8_8_1x1_intrawave_v3,825.81,286.21,0.0
gfx942,304,42624,3584,5120,ck,0,0,1933.7123,a8w8_blockscale_1x128x128_256x128x128x128_16x16_32x32_2x2_8x32x1_8x32x1_1x32x1x8_8_1x1_intrawave_v3,808.97,280.35,0.0
gfx942,304,42752,3584,5120,ck,0,0,1908.6393,a8w8_blockscale_1x128x128_256x128x128x128_16x16_32x32_2x2_8x32x1_8x32x1_1x32x1x8_8_1x1_intrawave_v3,822.05,284.86,0.0
gfx942,304,42880,3584,5120,ck,0,0,1956.7268,a8w8_blockscale_1x128x128_256x128x128x128_16x16_32x32_2x2_8x32x1_8x32x1_1x32x1x8_8_1x1_intrawave_v3,804.25,278.66,0.0
gfx942,304,43008,3584,5120,ck,0,0,1923.8544,a8w8_blockscale_1x128x128_256x128x128x128_16x16_32x32_2x2_8x32x1_8x32x1_1x32x1x8_8_1x1_intrawave_v3,820.44,284.24,0.0
gfx942,304,43136,3584,5120,ck,0,0,1922.7376,a8w8_blockscale_1x128x128_256x128x128x128_16x16_32x32_2x2_8x32x1_8x32x1_1x32x1x8_8_1x1_intrawave_v3,823.36,285.22,0.0
gfx942,304,43264,3584,5120,ck,0,0,1964.4391,a8w8_blockscale_1x128x128_256x128x128x128_16x16_32x32_2x2_8x32x1_8x32x1_1x32x1x8_8_1x1_intrawave_v3,808.27,279.97,0.0
gfx942,304,43392,3584,5120,ck,0,0,1995.4817,a8w8_blockscale_1x128x128_256x128x128x128_16x16_32x32_2x2_8x32x1_8x32x1_1x32x1x8_8_1x1_intrawave_v3,798.05,276.4,0.0
gfx942,304,43520,3584,5120,ck,0,0,1991.4532,a8w8_blockscale_1x128x128_256x128x128x128_16x16_32x32_2x2_8x32x1_8x32x1_1x32x1x8_8_1x1_intrawave_v3,802.02,277.75,0.0
gfx942,304,43648,3584,5120,ck,0,0,1962.9503,a8w8_blockscale_1x128x128_256x128x128x128_16x16_32x32_2x2_8x32x1_8x32x1_1x32x1x8_8_1x1_intrawave_v3,816.06,282.58,0.0
gfx942,304,43776,3584,5120,ck,0,0,1992.1806,a8w8_blockscale_1x128x128_256x128x128x128_16x16_32x32_2x2_8x32x1_8x32x1_1x32x1x8_8_1x1_intrawave_v3,806.45,279.23,0.0
gfx942,304,43904,3584,5120,ck,0,0,1955.4097,a8w8_blockscale_1x128x128_256x128x128x128_16x16_32x32_2x2_8x32x1_8x32x1_1x32x1x8_8_1x1_intrawave_v3,824.01,285.28,0.0
gfx942,304,44032,3584,5120,ck,0,0,1963.3075,a8w8_blockscale_1x128x128_256x128x128x128_16x16_32x32_2x2_8x32x1_8x32x1_1x32x1x8_8_1x1_intrawave_v3,823.09,284.94,0.0
gfx942,304,44160,3584,5120,ck,0,0,1976.3828,a8w8_blockscale_1x128x128_256x128x128x128_16x16_32x32_2x2_8x32x1_8x32x1_1x32x1x8_8_1x1_intrawave_v3,820.02,283.85,0.0
gfx942,304,44288,3584,5120,ck,0,0,2028.3581,a8w8_blockscale_1x128x128_256x128x128x128_16x16_32x32_2x2_8x32x1_8x32x1_1x32x1x8_8_1x1_intrawave_v3,801.33,277.35,0.0
gfx942,304,44416,3584,5120,ck,0,0,1982.5251,a8w8_blockscale_1x128x128_256x128x128x128_16x16_32x32_2x2_8x32x1_8x32x1_1x32x1x8_8_1x1_intrawave_v3,822.22,284.55,0.0
gfx942,304,44544,3584,5120,ck,0,0,2043.1482,a8w8_blockscale_1x128x128_256x128x128x128_16x16_32x32_2x2_8x32x1_8x32x1_1x32x1x8_8_1x1_intrawave_v3,800.12,276.88,0.0
gfx942,304,44672,3584,5120,ck,0,0,2022.2377,a8w8_blockscale_1x128x128_256x128x128x128_16x16_32x32_2x2_8x32x1_8x32x1_1x32x1x8_8_1x1_intrawave_v3,810.72,280.52,0.0
gfx942,304,44800,3584,5120,ck,0,0,1992.3735,a8w8_blockscale_1x128x128_256x128x128x128_16x16_32x32_2x2_8x32x1_8x32x1_1x32x1x8_8_1x1_intrawave_v3,825.23,285.51,0.0
gfx942,304,44928,3584,5120,ck,0,0,2051.4575,a8w8_blockscale_1x128x128_256x128x128x128_16x16_32x32_2x2_8x32x1_8x32x1_1x32x1x8_8_1x1_intrawave_v3,803.75,278.06,0.0
gfx942,304,45056,3584,5120,ck,0,0,2017.6085,a8w8_blockscale_1x128x128_256x128x128x128_16x16_32x32_2x2_8x32x1_8x32x1_1x32x1x8_8_1x1_intrawave_v3,819.57,283.5,0.0
gfx942,304,45184,3584,5120,ck,0,0,2051.1023,a8w8_blockscale_1x128x128_256x128x128x128_16x16_32x32_2x2_8x32x1_8x32x1_1x32x1x8_8_1x1_intrawave_v3,808.47,279.64,0.0
gfx942,304,45312,3584,5120,ck,0,0,2061.353,a8w8_blockscale_1x128x128_256x128x128x128_16x16_32x32_2x2_8x32x1_8x32x1_1x32x1x8_8_1x1_intrawave_v3,806.73,279.01,0.0
gfx942,304,45440,3584,5120,ck,0,0,2026.6233,a8w8_blockscale_1x128x128_256x128x128x128_16x16_32x32_2x2_8x32x1_8x32x1_1x32x1x8_8_1x1_intrawave_v3,822.87,284.57,0.0
gfx942,304,45568,3584,5120,ck,0,0,2061.5506,a8w8_blockscale_1x128x128_256x128x128x128_16x16_32x32_2x2_8x32x1_8x32x1_1x32x1x8_8_1x1_intrawave_v3,811.21,280.51,0.0
gfx942,304,45696,3584,5120,ck,0,0,2050.2861,a8w8_blockscale_1x128x128_256x128x128x128_16x16_32x32_2x2_8x32x1_8x32x1_1x32x1x8_8_1x1_intrawave_v3,817.96,282.82,0.0
gfx942,304,45824,3584,5120,ck,0,0,2045.7957,a8w8_blockscale_1x128x128_256x128x128x128_16x16_32x32_2x2_8x32x1_8x32x1_1x32x1x8_8_1x1_intrawave_v3,822.05,284.21,0.0
gfx942,304,45952,3584,5120,ck,0,0,2080.9265,a8w8_blockscale_1x128x128_256x128x128x128_16x16_32x32_2x2_8x32x1_8x32x1_1x32x1x8_8_1x1_intrawave_v3,810.43,280.17,0.0
gfx942,304,46080,3584,5120,ck,0,0,2122.0165,a8w8_blockscale_1x128x128_256x128x128x128_16x16_32x32_2x2_8x32x1_8x32x1_1x32x1x8_8_1x1_intrawave_v3,796.95,275.48,0.0
gfx942,304,46208,3584,5120,ck,0,0,2126.3709,a8w8_blockscale_1x128x128_256x128x128x128_16x16_32x32_2x2_8x32x1_8x32x1_1x32x1x8_8_1x1_intrawave_v3,797.53,275.66,0.0
gfx942,304,46336,3584,5120,ck,0,0,2095.2875,a8w8_blockscale_1x128x128_256x128x128x128_16x16_32x32_2x2_8x32x1_8x32x1_1x32x1x8_8_1x1_intrawave_v3,811.6,280.5,0.0
gfx942,304,46464,3584,5120,ck,0,0,2117.3257,a8w8_blockscale_1x128x128_256x128x128x128_16x16_32x32_2x2_8x32x1_8x32x1_1x32x1x8_8_1x1_intrawave_v3,805.37,278.32,0.0
gfx942,304,46592,3584,5120,ck,0,0,2154.1206,a8w8_blockscale_1x128x128_256x128x128x128_16x16_32x32_2x2_8x32x1_8x32x1_1x32x1x8_8_1x1_intrawave_v3,793.8,274.3,0.0
gfx942,304,46720,3584,5120,ck,0,0,2091.6691,a8w8_blockscale_1x128x128_256x128x128x128_16x16_32x32_2x2_8x32x1_8x32x1_1x32x1x8_8_1x1_intrawave_v3,819.74,283.24,0.0
gfx942,304,46848,3584,5120,ck,0,0,2107.9889,a8w8_blockscale_1x128x128_256x128x128x128_16x16_32x32_2x2_8x32x1_8x32x1_1x32x1x8_8_1x1_intrawave_v3,815.63,281.79,0.0
gfx942,304,46976,3584,5120,ck,0,0,2149.4436,a8w8_blockscale_1x128x128_256x128x128x128_16x16_32x32_2x2_8x32x1_8x32x1_1x32x1x8_8_1x1_intrawave_v3,802.08,277.09,0.0
gfx942,304,47104,3584,5120,ck,0,0,2097.9052,a8w8_blockscale_1x128x128_256x128x128x128_16x16_32x32_2x2_8x32x1_8x32x1_1x32x1x8_8_1x1_intrawave_v3,824.02,284.65,0.0
gfx942,304,47232,3584,5120,ck,0,0,2111.9633,a8w8_blockscale_1x128x128_256x128x128x128_16x16_32x32_2x2_8x32x1_8x32x1_1x32x1x8_8_1x1_intrawave_v3,820.76,283.5,0.0
gfx942,304,47360,3584,5120,ck,0,0,2146.4956,a8w8_blockscale_1x128x128_256x128x128x128_16x16_32x32_2x2_8x32x1_8x32x1_1x32x1x8_8_1x1_intrawave_v3,809.75,279.67,0.0
gfx942,304,47488,3584,5120,ck,0,0,2168.8795,a8w8_blockscale_1x128x128_256x128x128x128_16x16_32x32_2x2_8x32x1_8x32x1_1x32x1x8_8_1x1_intrawave_v3,803.56,277.51,0.0
gfx942,304,47616,3584,5120,ck,0,0,2155.9737,a8w8_blockscale_1x128x128_256x128x128x128_16x16_32x32_2x2_8x32x1_8x32x1_1x32x1x8_8_1x1_intrawave_v3,810.55,279.9,0.0
gfx942,304,47744,3584,5120,ck,0,0,2155.5551,a8w8_blockscale_1x128x128_256x128x128x128_16x16_32x32_2x2_8x32x1_8x32x1_1x32x1x8_8_1x1_intrawave_v3,812.88,280.68,0.0
gfx942,304,47872,3584,5120,ck,0,0,2165.2221,a8w8_blockscale_1x128x128_256x128x128x128_16x16_32x32_2x2_8x32x1_8x32x1_1x32x1x8_8_1x1_intrawave_v3,811.42,280.16,0.0
gfx942,304,48000,3584,5120,ck,0,0,2186.2133,a8w8_blockscale_1x128x128_256x128x128x128_16x16_32x32_2x2_8x32x1_8x32x1_1x32x1x8_8_1x1_intrawave_v3,805.78,278.19,0.0
gfx942,304,48128,3584,5120,ck,0,0,2137.5402,a8w8_blockscale_1x128x128_256x128x128x128_16x16_32x32_2x2_8x32x1_8x32x1_1x32x1x8_8_1x1_intrawave_v3,826.33,285.26,0.0
gfx942,304,48256,3584,5120,ck,0,0,2192.4356,a8w8_blockscale_1x128x128_256x128x128x128_16x16_32x32_2x2_8x32x1_8x32x1_1x32x1x8_8_1x1_intrawave_v3,807.78,278.83,0.0
gfx942,304,48384,3584,5120,ck,0,0,2210.5638,a8w8_blockscale_1x128x128_256x128x128x128_16x16_32x32_2x2_8x32x1_8x32x1_1x32x1x8_8_1x1_intrawave_v3,803.28,277.26,0.0
gfx942,304,48512,3584,5120,ck,0,0,2160.9012,a8w8_blockscale_1x128x128_256x128x128x128_16x16_32x32_2x2_8x32x1_8x32x1_1x32x1x8_8_1x1_intrawave_v3,823.91,284.36,0.0
gfx942,304,48640,3584,5120,ck,0,0,2227.7796,a8w8_blockscale_1x128x128_256x128x128x128_16x16_32x32_2x2_8x32x1_8x32x1_1x32x1x8_8_1x1_intrawave_v3,801.29,276.53,0.0
gfx942,304,48768,3584,5120,ck,0,0,2176.2335,a8w8_blockscale_1x128x128_256x128x128x128_16x16_32x32_2x2_8x32x1_8x32x1_1x32x1x8_8_1x1_intrawave_v3,822.43,283.8,0.0
gfx942,304,48896,3584,5120,ck,0,0,2211.9742,a8w8_blockscale_1x128x128_256x128x128x128_16x16_32x32_2x2_8x32x1_8x32x1_1x32x1x8_8_1x1_intrawave_v3,811.26,279.92,0.0
gfx942,304,49024,3584,5120,ck,0,0,2182.0736,a8w8_blockscale_1x128x128_256x128x128x128_16x16_32x32_2x2_8x32x1_8x32x1_1x32x1x8_8_1x1_intrawave_v3,824.53,284.48,0.0
gfx942,304,49152,3584,5120,ck,0,0,2232.9821,a8w8_blockscale_1x128x128_256x128x128x128_16x16_32x32_2x2_8x32x1_8x32x1_1x32x1x8_8_1x1_intrawave_v3,807.84,278.7,0.0
gfx942,304,49280,3584,5120,ck,0,0,2237.3768,a8w8_blockscale_1x128x128_256x128x128x128_16x16_32x32_2x2_8x32x1_8x32x1_1x32x1x8_8_1x1_intrawave_v3,808.35,278.85,0.0
gfx942,304,49408,3584,5120,ck,0,0,2273.4271,a8w8_blockscale_1x128x128_256x128x128x128_16x16_32x32_2x2_8x32x1_8x32x1_1x32x1x8_8_1x1_intrawave_v3,797.6,275.12,0.0
gfx942,304,49536,3584,5120,ck,0,0,2243.7395,a8w8_blockscale_1x128x128_256x128x128x128_16x16_32x32_2x2_8x32x1_8x32x1_1x32x1x8_8_1x1_intrawave_v3,810.25,279.47,0.0
gfx942,304,49664,3584,5120,ck,0,0,2243.9996,a8w8_blockscale_1x128x128_256x128x128x128_16x16_32x32_2x2_8x32x1_8x32x1_1x32x1x8_8_1x1_intrawave_v3,812.24,280.13,0.0
gfx942,304,49792,3584,5120,ck,0,0,2228.164,a8w8_blockscale_1x128x128_256x128x128x128_16x16_32x32_2x2_8x32x1_8x32x1_1x32x1x8_8_1x1_intrawave_v3,820.13,282.83,0.0
gfx942,304,49920,3584,5120,ck,0,0,2217.9375,a8w8_blockscale_1x128x128_256x128x128x128_16x16_32x32_2x2_8x32x1_8x32x1_1x32x1x8_8_1x1_intrawave_v3,826.03,284.84,0.0
gfx942,304,50048,3584,5120,ck,0,0,2230.6517,a8w8_blockscale_1x128x128_256x128x128x128_16x16_32x32_2x2_8x32x1_8x32x1_1x32x1x8_8_1x1_intrawave_v3,823.42,283.93,0.0
gfx942,304,50176,3584,5120,ck,0,0,2252.0544,a8w8_blockscale_1x128x128_256x128x128x128_16x16_32x32_2x2_8x32x1_8x32x1_1x32x1x8_8_1x1_intrawave_v3,817.68,281.93,0.0
gfx942,304,50304,3584,5120,ck,0,0,2298.8667,a8w8_blockscale_1x128x128_256x128x128x128_16x16_32x32_2x2_8x32x1_8x32x1_1x32x1x8_8_1x1_intrawave_v3,803.08,276.87,0.0
gfx942,304,50432,3584,5120,ck,0,0,2246.0649,a8w8_blockscale_1x128x128_256x128x128x128_16x16_32x32_2x2_8x32x1_8x32x1_1x32x1x8_8_1x1_intrawave_v3,824.05,284.08,0.0
gfx942,304,50560,3584,5120,ck,0,0,2319.679,a8w8_blockscale_1x128x128_256x128x128x128_16x16_32x32_2x2_8x32x1_8x32x1_1x32x1x8_8_1x1_intrawave_v3,799.92,275.74,0.0
gfx942,304,50688,3584,5120,ck,0,0,2251.9661,a8w8_blockscale_1x128x128_256x128x128x128_16x16_32x32_2x2_8x32x1_8x32x1_1x32x1x8_8_1x1_intrawave_v3,826.06,284.73,0.0
gfx942,304,50816,3584,5120,ck,0,0,2272.7321,a8w8_blockscale_1x128x128_256x128x128x128_16x16_32x32_2x2_8x32x1_8x32x1_1x32x1x8_8_1x1_intrawave_v3,820.58,282.82,0.0
gfx942,304,50944,3584,5120,ck,0,0,2338.6339,a8w8_blockscale_1x128x128_256x128x128x128_16x16_32x32_2x2_8x32x1_8x32x1_1x32x1x8_8_1x1_intrawave_v3,799.46,275.52,0.0
gfx942,304,51072,3584,5120,ck,0,0,2355.1687,a8w8_blockscale_1x128x128_256x128x128x128_16x16_32x32_2x2_8x32x1_8x32x1_1x32x1x8_8_1x1_intrawave_v3,795.85,274.26,0.0
gfx942,304,51200,3584,5120,ck,0,0,2288.7054,a8w8_blockscale_1x128x128_256x128x128x128_16x16_32x32_2x2_8x32x1_8x32x1_1x32x1x8_8_1x1_intrawave_v3,821.01,282.91,0.0
gfx942,304,51328,3584,5120,ck,0,0,2295.24,a8w8_blockscale_1x128x128_256x128x128x128_16x16_32x32_2x2_8x32x1_8x32x1_1x32x1x8_8_1x1_intrawave_v3,820.72,282.79,0.0
gfx942,304,51456,3584,5120,ck,0,0,2281.3859,a8w8_blockscale_1x128x128_256x128x128x128_16x16_32x32_2x2_8x32x1_8x32x1_1x32x1x8_8_1x1_intrawave_v3,827.76,285.2,0.0
gfx942,304,51584,3584,5120,ck,0,0,2331.0848,a8w8_blockscale_1x128x128_256x128x128x128_16x16_32x32_2x2_8x32x1_8x32x1_1x32x1x8_8_1x1_intrawave_v3,812.13,279.79,0.0
gfx942,304,51712,3584,5120,ck,0,0,2339.9939,a8w8_blockscale_1x128x128_256x128x128x128_16x16_32x32_2x2_8x32x1_8x32x1_1x32x1x8_8_1x1_intrawave_v3,811.04,279.4,0.0
gfx942,304,51840,3584,5120,ck,0,0,2328.4649,a8w8_blockscale_1x128x128_256x128x128x128_16x16_32x32_2x2_8x32x1_8x32x1_1x32x1x8_8_1x1_intrawave_v3,817.08,281.46,0.0
gfx942,304,51968,3584,5120,ck,0,0,2325.2461,a8w8_blockscale_1x128x128_256x128x128x128_16x16_32x32_2x2_8x32x1_8x32x1_1x32x1x8_8_1x1_intrawave_v3,820.23,282.52,0.0
gfx942,304,52096,3584,5120,ck,0,0,2322.7628,a8w8_blockscale_1x128x128_256x128x128x128_16x16_32x32_2x2_8x32x1_8x32x1_1x32x1x8_8_1x1_intrawave_v3,823.13,283.5,0.0
gfx942,304,52224,3584,5120,ck,0,0,2367.3733,a8w8_blockscale_1x128x128_256x128x128x128_16x16_32x32_2x2_8x32x1_8x32x1_1x32x1x8_8_1x1_intrawave_v3,809.6,278.82,0.0
gfx942,304,52352,3584,5120,ck,0,0,2334.7225,a8w8_blockscale_1x128x128_256x128x128x128_16x16_32x32_2x2_8x32x1_8x32x1_1x32x1x8_8_1x1_intrawave_v3,822.94,283.4,0.0
gfx942,304,52480,3584,5120,ck,0,0,2365.3498,a8w8_blockscale_1x128x128_256x128x128x128_16x16_32x32_2x2_8x32x1_8x32x1_1x32x1x8_8_1x1_intrawave_v3,814.27,280.39,0.0
gfx942,304,52608,3584,5120,ck,0,0,2323.4834,a8w8_blockscale_1x128x128_256x128x128x128_16x16_32x32_2x2_8x32x1_8x32x1_1x32x1x8_8_1x1_intrawave_v3,830.96,286.12,0.0
gfx942,304,52736,3584,5120,ck,0,0,2348.4347,a8w8_blockscale_1x128x128_256x128x128x128_16x16_32x32_2x2_8x32x1_8x32x1_1x32x1x8_8_1x1_intrawave_v3,824.13,283.75,0.0
gfx942,304,52864,3584,5120,ck,0,0,2411.9639,a8w8_blockscale_1x128x128_256x128x128x128_16x16_32x32_2x2_8x32x1_8x32x1_1x32x1x8_8_1x1_intrawave_v3,804.37,276.93,0.0
gfx942,304,52992,3584,5120,ck,0,0,2352.4366,a8w8_blockscale_1x128x128_256x128x128x128_16x16_32x32_2x2_8x32x1_8x32x1_1x32x1x8_8_1x1_intrawave_v3,826.72,284.61,0.0
gfx942,304,53120,3584,5120,ck,0,0,2409.343,a8w8_blockscale_1x128x128_256x128x128x128_16x16_32x32_2x2_8x32x1_8x32x1_1x32x1x8_8_1x1_intrawave_v3,809.15,278.54,0.0
gfx942,304,53248,3584,5120,ck,0,0,2379.167,a8w8_blockscale_1x128x128_256x128x128x128_16x16_32x32_2x2_8x32x1_8x32x1_1x32x1x8_8_1x1_intrawave_v3,821.38,282.73,0.0
gfx942,304,53376,3584,5120,ck,0,0,2377.3409,a8w8_blockscale_1x128x128_256x128x128x128_16x16_32x32_2x2_8x32x1_8x32x1_1x32x1x8_8_1x1_intrawave_v3,823.99,283.61,0.0
gfx942,304,53504,3584,5120,ck,0,0,2453.2892,a8w8_blockscale_1x128x128_256x128x128x128_16x16_32x32_2x2_8x32x1_8x32x1_1x32x1x8_8_1x1_intrawave_v3,800.4,275.47,0.0
gfx942,304,53632,3584,5120,ck,0,0,2447.667,a8w8_blockscale_1x128x128_256x128x128x128_16x16_32x32_2x2_8x32x1_8x32x1_1x32x1x8_8_1x1_intrawave_v3,804.15,276.75,0.0
gfx942,304,53760,3584,5120,ck,0,0,2462.0518,a8w8_blockscale_1x128x128_256x128x128x128_16x16_32x32_2x2_8x32x1_8x32x1_1x32x1x8_8_1x1_intrawave_v3,801.36,275.77,0.0
gfx942,304,53888,3584,5120,ck,0,0,2410.3207,a8w8_blockscale_1x128x128_256x128x128x128_16x16_32x32_2x2_8x32x1_8x32x1_1x32x1x8_8_1x1_intrawave_v3,820.51,282.34,0.0
gfx942,304,54016,3584,5120,ck,0,0,2438.2592,a8w8_blockscale_1x128x128_256x128x128x128_16x16_32x32_2x2_8x32x1_8x32x1_1x32x1x8_8_1x1_intrawave_v3,813.04,279.75,0.0
gfx942,304,54144,3584,5120,ck,0,0,2406.2873,a8w8_blockscale_1x128x128_256x128x128x128_16x16_32x32_2x2_8x32x1_8x32x1_1x32x1x8_8_1x1_intrawave_v3,825.79,284.12,0.0
gfx942,304,54272,3584,5120,ck,0,0,2448.4,a8w8_blockscale_1x128x128_256x128x128x128_16x16_32x32_2x2_8x32x1_8x32x1_1x32x1x8_8_1x1_intrawave_v3,813.51,279.87,0.0
gfx942,304,54400,3584,5120,ck,0,0,2429.6759,a8w8_blockscale_1x128x128_256x128x128x128_16x16_32x32_2x2_8x32x1_8x32x1_1x32x1x8_8_1x1_intrawave_v3,821.71,282.68,0.0
gfx942,304,54528,3584,5120,ck,0,0,2456.3733,a8w8_blockscale_1x128x128_256x128x128x128_16x16_32x32_2x2_8x32x1_8x32x1_1x32x1x8_8_1x1_intrawave_v3,814.69,280.25,0.0
gfx942,304,54656,3584,5120,ck,0,0,2504.5107,a8w8_blockscale_1x128x128_256x128x128x128_16x16_32x32_2x2_8x32x1_8x32x1_1x32x1x8_8_1x1_intrawave_v3,800.91,275.49,0.0
gfx942,304,54784,3584,5120,ck,0,0,2488.2297,a8w8_blockscale_1x128x128_256x128x128x128_16x16_32x32_2x2_8x32x1_8x32x1_1x32x1x8_8_1x1_intrawave_v3,808.04,277.92,0.0
gfx942,304,54912,3584,5120,ck,0,0,2449.3207,a8w8_blockscale_1x128x128_256x128x128x128_16x16_32x32_2x2_8x32x1_8x32x1_1x32x1x8_8_1x1_intrawave_v3,822.79,282.98,0.0
gfx942,304,55040,3584,5120,ck,0,0,2492.3367,a8w8_blockscale_1x128x128_256x128x128x128_16x16_32x32_2x2_8x32x1_8x32x1_1x32x1x8_8_1x1_intrawave_v3,810.48,278.73,0.0
gfx942,304,55168,3584,5120,ck,0,0,2509.3134,a8w8_blockscale_1x128x128_256x128x128x128_16x16_32x32_2x2_8x32x1_8x32x1_1x32x1x8_8_1x1_intrawave_v3,806.86,277.47,0.0
gfx942,304,55296,3584,5120,ck,0,0,2468.7366,a8w8_blockscale_1x128x128_256x128x128x128_16x16_32x32_2x2_8x32x1_8x32x1_1x32x1x8_8_1x1_intrawave_v3,822.03,282.67,0.0
gfx942,304,55424,3584,5120,ck,0,0,2503.0794,a8w8_blockscale_1x128x128_256x128x128x128_16x16_32x32_2x2_8x32x1_8x32x1_1x32x1x8_8_1x1_intrawave_v3,812.63,279.42,0.0
gfx942,304,55552,3584,5120,ck,0,0,2512.2526,a8w8_blockscale_1x128x128_256x128x128x128_16x16_32x32_2x2_8x32x1_8x32x1_1x32x1x8_8_1x1_intrawave_v3,811.53,279.02,0.0
gfx942,304,55680,3584,5120,ck,0,0,2484.3,a8w8_blockscale_1x128x128_256x128x128x128_16x16_32x32_2x2_8x32x1_8x32x1_1x32x1x8_8_1x1_intrawave_v3,822.55,282.79,0.0
gfx942,304,55808,3584,5120,ck,0,0,2561.5468,a8w8_blockscale_1x128x128_256x128x128x128_16x16_32x32_2x2_8x32x1_8x32x1_1x32x1x8_8_1x1_intrawave_v3,799.58,274.88,0.0
gfx942,304,55936,3584,5120,ck,0,0,2520.6727,a8w8_blockscale_1x128x128_256x128x128x128_16x16_32x32_2x2_8x32x1_8x32x1_1x32x1x8_8_1x1_intrawave_v3,814.41,279.96,0.0
gfx942,304,56064,3584,5120,ck,0,0,2548.3766,a8w8_blockscale_1x128x128_256x128x128x128_16x16_32x32_2x2_8x32x1_8x32x1_1x32x1x8_8_1x1_intrawave_v3,807.4,277.54,0.0
gfx942,304,56192,3584,5120,ck,0,0,2492.3099,a8w8_blockscale_1x128x128_256x128x128x128_16x16_32x32_2x2_8x32x1_8x32x1_1x32x1x8_8_1x1_intrawave_v3,827.45,284.41,0.0
gfx942,304,56320,3584,5120,ck,0,0,2562.545,a8w8_blockscale_1x128x128_256x128x128x128_16x16_32x32_2x2_8x32x1_8x32x1_1x32x1x8_8_1x1_intrawave_v3,806.6,277.23,0.0
gfx942,304,56448,3584,5120,ck,0,0,2557.2333,a8w8_blockscale_1x128x128_256x128x128x128_16x16_32x32_2x2_8x32x1_8x32x1_1x32x1x8_8_1x1_intrawave_v3,810.11,278.42,0.0
gfx942,304,56576,3584,5120,ck,0,0,2565.5976,a8w8_blockscale_1x128x128_256x128x128x128_16x16_32x32_2x2_8x32x1_8x32x1_1x32x1x8_8_1x1_intrawave_v3,809.3,278.12,0.0
gfx942,304,56704,3584,5120,ck,0,0,2562.767,a8w8_blockscale_1x128x128_256x128x128x128_16x16_32x32_2x2_8x32x1_8x32x1_1x32x1x8_8_1x1_intrawave_v3,812.03,279.05,0.0
gfx942,304,56832,3584,5120,ck,0,0,2603.374,a8w8_blockscale_1x128x128_256x128x128x128_16x16_32x32_2x2_8x32x1_8x32x1_1x32x1x8_8_1x1_intrawave_v3,801.17,275.3,0.0
gfx942,304,56960,3584,5120,ck,0,0,2538.8278,a8w8_blockscale_1x128x128_256x128x128x128_16x16_32x32_2x2_8x32x1_8x32x1_1x32x1x8_8_1x1_intrawave_v3,823.39,282.92,0.0
gfx942,304,57088,3584,5120,ck,0,0,2575.82,a8w8_blockscale_1x128x128_256x128x128x128_16x16_32x32_2x2_8x32x1_8x32x1_1x32x1x8_8_1x1_intrawave_v3,813.39,279.46,0.0
gfx942,304,57216,3584,5120,ck,0,0,2545.8273,a8w8_blockscale_1x128x128_256x128x128x128_16x16_32x32_2x2_8x32x1_8x32x1_1x32x1x8_8_1x1_intrawave_v3,824.81,283.37,0.0
gfx942,304,57344,3584,5120,ck,0,0,2565.4617,a8w8_blockscale_1x128x128_256x128x128x128_16x16_32x32_2x2_8x32x1_8x32x1_1x32x1x8_8_1x1_intrawave_v3,820.33,281.82,0.0
gfx942,304,57472,3584,5120,ck,0,0,2605.0243,a8w8_blockscale_1x128x128_256x128x128x128_16x16_32x32_2x2_8x32x1_8x32x1_1x32x1x8_8_1x1_intrawave_v3,809.68,278.14,0.0
gfx942,304,57600,3584,5120,ck,0,0,2626.4131,a8w8_blockscale_1x128x128_256x128x128x128_16x16_32x32_2x2_8x32x1_8x32x1_1x32x1x8_8_1x1_intrawave_v3,804.87,276.48,0.0
gfx942,304,57728,3584,5120,ck,0,0,2609.6949,a8w8_blockscale_1x128x128_256x128x128x128_16x16_32x32_2x2_8x32x1_8x32x1_1x32x1x8_8_1x1_intrawave_v3,811.83,278.85,0.0
gfx942,304,57856,3584,5120,ck,0,0,2613.7406,a8w8_blockscale_1x128x128_256x128x128x128_16x16_32x32_2x2_8x32x1_8x32x1_1x32x1x8_8_1x1_intrawave_v3,812.37,279.02,0.0
gfx942,304,57984,3584,5120,ck,0,0,2597.392,a8w8_blockscale_1x128x128_256x128x128x128_16x16_32x32_2x2_8x32x1_8x32x1_1x32x1x8_8_1x1_intrawave_v3,819.29,281.38,0.0
gfx942,304,58112,3584,5120,ck,0,0,2650.8956,a8w8_blockscale_1x128x128_256x128x128x128_16x16_32x32_2x2_8x32x1_8x32x1_1x32x1x8_8_1x1_intrawave_v3,804.53,276.3,0.0
gfx942,304,58240,3584,5120,ck,0,0,2680.4719,a8w8_blockscale_1x128x128_256x128x128x128_16x16_32x32_2x2_8x32x1_8x32x1_1x32x1x8_8_1x1_intrawave_v3,797.4,273.83,0.0
gfx942,304,58368,3584,5120,ck,0,0,2645.6995,a8w8_blockscale_1x128x128_256x128x128x128_16x16_32x32_2x2_8x32x1_8x32x1_1x32x1x8_8_1x1_intrawave_v3,809.66,278.03,0.0
gfx942,304,58496,3584,5120,ck,0,0,2604.3374,a8w8_blockscale_1x128x128_256x128x128x128_16x16_32x32_2x2_8x32x1_8x32x1_1x32x1x8_8_1x1_intrawave_v3,824.32,283.05,0.0
gfx942,304,58624,3584,5120,ck,0,0,2602.9337,a8w8_blockscale_1x128x128_256x128x128x128_16x16_32x32_2x2_8x32x1_8x32x1_1x32x1x8_8_1x1_intrawave_v3,826.57,283.8,0.0
gfx942,304,58752,3584,5120,ck,0,0,2647.3324,a8w8_blockscale_1x128x128_256x128x128x128_16x16_32x32_2x2_8x32x1_8x32x1_1x32x1x8_8_1x1_intrawave_v3,814.48,279.64,0.0
gfx942,304,58880,3584,5120,ck,0,0,2676.2558,a8w8_blockscale_1x128x128_256x128x128x128_16x16_32x32_2x2_8x32x1_8x32x1_1x32x1x8_8_1x1_intrawave_v3,807.44,277.2,0.0
gfx942,304,59008,3584,5120,ck,0,0,2697.7428,a8w8_blockscale_1x128x128_256x128x128x128_16x16_32x32_2x2_8x32x1_8x32x1_1x32x1x8_8_1x1_intrawave_v3,802.75,275.58,0.0
gfx942,304,59136,3584,5120,ck,0,0,2704.6795,a8w8_blockscale_1x128x128_256x128x128x128_16x16_32x32_2x2_8x32x1_8x32x1_1x32x1x8_8_1x1_intrawave_v3,802.42,275.45,0.0
gfx942,304,59264,3584,5120,ck,0,0,2690.5761,a8w8_blockscale_1x128x128_256x128x128x128_16x16_32x32_2x2_8x32x1_8x32x1_1x32x1x8_8_1x1_intrawave_v3,808.38,277.48,0.0
gfx942,304,59392,3584,5120,ck,0,0,2693.3708,a8w8_blockscale_1x128x128_256x128x128x128_16x16_32x32_2x2_8x32x1_8x32x1_1x32x1x8_8_1x1_intrawave_v3,809.28,277.78,0.0
gfx942,304,59520,3584,5120,ck,0,0,2656.8379,a8w8_blockscale_1x128x128_256x128x128x128_16x16_32x32_2x2_8x32x1_8x32x1_1x32x1x8_8_1x1_intrawave_v3,822.18,282.19,0.0
gfx942,304,59648,3584,5120,ck,0,0,2717.5021,a8w8_blockscale_1x128x128_256x128x128x128_16x16_32x32_2x2_8x32x1_8x32x1_1x32x1x8_8_1x1_intrawave_v3,805.55,276.47,0.0
gfx942,304,59776,3584,5120,ck,0,0,2714.546,a8w8_blockscale_1x128x128_256x128x128x128_16x16_32x32_2x2_8x32x1_8x32x1_1x32x1x8_8_1x1_intrawave_v3,808.16,277.35,0.0
gfx942,304,59904,3584,5120,ck,0,0,2712.0909,a8w8_blockscale_1x128x128_256x128x128x128_16x16_32x32_2x2_8x32x1_8x32x1_1x32x1x8_8_1x1_intrawave_v3,810.62,278.18,0.0
gfx942,304,60032,3584,5120,ck,0,0,2669.293,a8w8_blockscale_1x128x128_256x128x128x128_16x16_32x32_2x2_8x32x1_8x32x1_1x32x1x8_8_1x1_intrawave_v3,825.38,283.23,0.0
gfx942,304,60160,3584,5120,ck,0,0,2750.2068,a8w8_blockscale_1x128x128_256x128x128x128_16x16_32x32_2x2_8x32x1_8x32x1_1x32x1x8_8_1x1_intrawave_v3,802.81,275.47,0.0
gfx942,304,60288,3584,5120,ck,0,0,2685.1638,a8w8_blockscale_1x128x128_256x128x128x128_16x16_32x32_2x2_8x32x1_8x32x1_1x32x1x8_8_1x1_intrawave_v3,824.0,282.73,0.0
gfx942,304,60416,3584,5120,ck,0,0,2686.3221,a8w8_blockscale_1x128x128_256x128x128x128_16x16_32x32_2x2_8x32x1_8x32x1_1x32x1x8_8_1x1_intrawave_v3,825.4,283.19,0.0
gfx942,304,60544,3584,5120,ck,0,0,2766.1591,a8w8_blockscale_1x128x128_256x128x128x128_16x16_32x32_2x2_8x32x1_8x32x1_1x32x1x8_8_1x1_intrawave_v3,803.27,275.59,0.0
gfx942,304,60672,3584,5120,ck,0,0,2796.0897,a8w8_blockscale_1x128x128_256x128x128x128_16x16_32x32_2x2_8x32x1_8x32x1_1x32x1x8_8_1x1_intrawave_v3,796.35,273.2,0.0
gfx942,304,60800,3584,5120,ck,0,0,2712.8762,a8w8_blockscale_1x128x128_256x128x128x128_16x16_32x32_2x2_8x32x1_8x32x1_1x32x1x8_8_1x1_intrawave_v3,822.51,282.16,0.0
gfx942,304,60928,3584,5120,ck,0,0,2717.9712,a8w8_blockscale_1x128x128_256x128x128x128_16x16_32x32_2x2_8x32x1_8x32x1_1x32x1x8_8_1x1_intrawave_v3,822.7,282.21,0.0
gfx942,304,61056,3584,5120,ck,0,0,2762.8603,a8w8_blockscale_1x128x128_256x128x128x128_16x16_32x32_2x2_8x32x1_8x32x1_1x32x1x8_8_1x1_intrawave_v3,811.03,278.19,0.0
gfx942,304,61184,3584,5120,ck,0,0,2770.7475,a8w8_blockscale_1x128x128_256x128x128x128_16x16_32x32_2x2_8x32x1_8x32x1_1x32x1x8_8_1x1_intrawave_v3,810.42,277.97,0.0
gfx942,304,61312,3584,5120,ck,0,0,2803.3293,a8w8_blockscale_1x128x128_256x128x128x128_16x16_32x32_2x2_8x32x1_8x32x1_1x32x1x8_8_1x1_intrawave_v3,802.67,275.3,0.0
gfx942,304,61440,3584,5120,ck,0,0,2759.5854,a8w8_blockscale_1x128x128_256x128x128x128_16x16_32x32_2x2_8x32x1_8x32x1_1x32x1x8_8_1x1_intrawave_v3,817.1,280.23,0.0
gfx942,304,61568,3584,5120,ck,0,0,2792.4023,a8w8_blockscale_1x128x128_256x128x128x128_16x16_32x32_2x2_8x32x1_8x32x1_1x32x1x8_8_1x1_intrawave_v3,809.18,277.5,0.0
gfx942,304,61696,3584,5120,ck,0,0,2847.4021,a8w8_blockscale_1x128x128_256x128x128x128_16x16_32x32_2x2_8x32x1_8x32x1_1x32x1x8_8_1x1_intrawave_v3,795.2,272.69,0.0
gfx942,304,61824,3584,5120,ck,0,0,2756.5922,a8w8_blockscale_1x128x128_256x128x128x128_16x16_32x32_2x2_8x32x1_8x32x1_1x32x1x8_8_1x1_intrawave_v3,823.1,282.25,0.0
gfx942,304,61952,3584,5120,ck,0,0,2798.5136,a8w8_blockscale_1x128x128_256x128x128x128_16x16_32x32_2x2_8x32x1_8x32x1_1x32x1x8_8_1x1_intrawave_v3,812.45,278.58,0.0
gfx942,304,62080,3584,5120,ck,0,0,2851.02,a8w8_blockscale_1x128x128_256x128x128x128_16x16_32x32_2x2_8x32x1_8x32x1_1x32x1x8_8_1x1_intrawave_v3,799.13,274.0,0.0
gfx942,304,62208,3584,5120,ck,0,0,2815.3728,a8w8_blockscale_1x128x128_256x128x128x128_16x16_32x32_2x2_8x32x1_8x32x1_1x32x1x8_8_1x1_intrawave_v3,810.92,278.03,0.0
gfx942,304,62336,3584,5120,ck,0,0,2774.9564,a8w8_blockscale_1x128x128_256x128x128x128_16x16_32x32_2x2_8x32x1_8x32x1_1x32x1x8_8_1x1_intrawave_v3,824.42,282.65,0.0
gfx942,304,62464,3584,5120,ck,0,0,2858.1934,a8w8_blockscale_1x128x128_256x128x128x128_16x16_32x32_2x2_8x32x1_8x32x1_1x32x1x8_8_1x1_intrawave_v3,802.06,274.97,0.0
gfx942,304,62592,3584,5120,ck,0,0,2784.7582,a8w8_blockscale_1x128x128_256x128x128x128_16x16_32x32_2x2_8x32x1_8x32x1_1x32x1x8_8_1x1_intrawave_v3,824.9,282.78,0.0
gfx942,304,62720,3584,5120,ck,0,0,2784.3077,a8w8_blockscale_1x128x128_256x128x128x128_16x16_32x32_2x2_8x32x1_8x32x1_1x32x1x8_8_1x1_intrawave_v3,826.72,283.39,0.0
gfx942,304,62848,3584,5120,ck,0,0,2808.4121,a8w8_blockscale_1x128x128_256x128x128x128_16x16_32x32_2x2_8x32x1_8x32x1_1x32x1x8_8_1x1_intrawave_v3,821.29,281.52,0.0
gfx942,304,62976,3584,5120,ck,0,0,2847.9486,a8w8_blockscale_1x128x128_256x128x128x128_16x16_32x32_2x2_8x32x1_8x32x1_1x32x1x8_8_1x1_intrawave_v3,811.54,278.16,0.0
gfx942,304,63104,3584,5120,ck,0,0,2894.7506,a8w8_blockscale_1x128x128_256x128x128x128_16x16_32x32_2x2_8x32x1_8x32x1_1x32x1x8_8_1x1_intrawave_v3,800.04,274.21,0.0
gfx942,304,63232,3584,5120,ck,0,0,2817.3636,a8w8_blockscale_1x128x128_256x128x128x128_16x16_32x32_2x2_8x32x1_8x32x1_1x32x1x8_8_1x1_intrawave_v3,823.69,282.3,0.0
gfx942,304,63360,3584,5120,ck,0,0,2874.9149,a8w8_blockscale_1x128x128_256x128x128x128_16x16_32x32_2x2_8x32x1_8x32x1_1x32x1x8_8_1x1_intrawave_v3,808.83,277.2,0.0
gfx942,304,63488,3584,5120,ck,0,0,2876.5645,a8w8_blockscale_1x128x128_256x128x128x128_16x16_32x32_2x2_8x32x1_8x32x1_1x32x1x8_8_1x1_intrawave_v3,810.0,277.58,0.0
gfx942,304,63616,3584,5120,ck,0,0,2835.346,a8w8_blockscale_1x128x128_256x128x128x128_16x16_32x32_2x2_8x32x1_8x32x1_1x32x1x8_8_1x1_intrawave_v3,823.43,282.17,0.0
gfx942,304,63744,3584,5120,ck,0,0,2883.9034,a8w8_blockscale_1x128x128_256x128x128x128_16x16_32x32_2x2_8x32x1_8x32x1_1x32x1x8_8_1x1_intrawave_v3,811.2,277.97,0.0
gfx942,304,63872,3584,5120,ck,0,0,2895.2248,a8w8_blockscale_1x128x128_256x128x128x128_16x16_32x32_2x2_8x32x1_8x32x1_1x32x1x8_8_1x1_intrawave_v3,809.65,277.43,0.0
gfx942,304,64000,3584,5120,ck,0,0,2853.1263,a8w8_blockscale_1x128x128_256x128x128x128_16x16_32x32_2x2_8x32x1_8x32x1_1x32x1x8_8_1x1_intrawave_v3,823.24,282.07,0.0
gfx942,304,64128,3584,5120,ck,0,0,2844.8,a8w8_blockscale_1x128x128_256x128x128x128_16x16_32x32_2x2_8x32x1_8x32x1_1x32x1x8_8_1x1_intrawave_v3,827.3,283.45,0.0
gfx942,304,64256,3584,5120,ck,0,0,2894.4999,a8w8_blockscale_1x128x128_256x128x128x128_16x16_32x32_2x2_8x32x1_8x32x1_1x32x1x8_8_1x1_intrawave_v3,814.72,279.13,0.0
gfx942,304,64384,3584,5120,ck,0,0,2904.5776,a8w8_blockscale_1x128x128_256x128x128x128_16x16_32x32_2x2_8x32x1_8x32x1_1x32x1x8_8_1x1_intrawave_v3,813.51,278.7,0.0
gfx942,304,64512,3584,5120,ck,0,0,2863.0219,a8w8_blockscale_1x128x128_256x128x128x128_16x16_32x32_2x2_8x32x1_8x32x1_1x32x1x8_8_1x1_intrawave_v3,826.96,283.29,0.0
gfx942,304,64640,3584,5120,ck,0,0,2879.9498,a8w8_blockscale_1x128x128_256x128x128x128_16x16_32x32_2x2_8x32x1_8x32x1_1x32x1x8_8_1x1_intrawave_v3,823.73,282.17,0.0
gfx942,304,64768,3584,5120,ck,0,0,2940.3665,a8w8_blockscale_1x128x128_256x128x128x128_16x16_32x32_2x2_8x32x1_8x32x1_1x32x1x8_8_1x1_intrawave_v3,808.4,276.91,0.0
gfx942,304,64896,3584,5120,ck,0,0,2868.0403,a8w8_blockscale_1x128x128_256x128x128x128_16x16_32x32_2x2_8x32x1_8x32x1_1x32x1x8_8_1x1_intrawave_v3,830.43,284.44,0.0
gfx942,304,65024,3584,5120,ck,0,0,2948.5211,a8w8_blockscale_1x128x128_256x128x128x128_16x16_32x32_2x2_8x32x1_8x32x1_1x32x1x8_8_1x1_intrawave_v3,809.35,277.21,0.0
gfx942,304,65152,3584,5120,ck,0,0,2931.1018,a8w8_blockscale_1x128x128_256x128x128x128_16x16_32x32_2x2_8x32x1_8x32x1_1x32x1x8_8_1x1_intrawave_v3,815.76,279.4,0.0
gfx942,304,65280,3584,5120,ck,0,0,2942.5207,a8w8_blockscale_1x128x128_256x128x128x128_16x16_32x32_2x2_8x32x1_8x32x1_1x32x1x8_8_1x1_intrawave_v3,814.2,278.85,0.0
gfx942,304,65408,3584,5120,ck,0,0,2903.9699,a8w8_blockscale_1x128x128_256x128x128x128_16x16_32x32_2x2_8x32x1_8x32x1_1x32x1x8_8_1x1_intrawave_v3,826.62,283.09,0.0
gfx942,304,65536,3584,5120,ck,0,0,2882.5444,a8w8_blockscale_1x128x128_256x128x128x128_16x16_32x32_2x2_8x32x1_8x32x1_1x32x1x8_8_1x1_intrawave_v3,834.4,285.74,0.0
gfx942,304,65664,3584,5120,ck,0,0,2970.1302,a8w8_blockscale_1x128x128_256x128x128x128_16x16_32x32_2x2_8x32x1_8x32x1_1x32x1x8_8_1x1_intrawave_v3,811.37,277.84,0.0
gfx942,304,65792,3584,5120,ck,0,0,3004.0998,a8w8_blockscale_1x128x128_256x128x128x128_16x16_32x32_2x2_8x32x1_8x32x1_1x32x1x8_8_1x1_intrawave_v3,803.76,275.22,0.0
gfx942,304,65920,3584,5120,ck,0,0,2997.5202,a8w8_blockscale_1x128x128_256x128x128x128_16x16_32x32_2x2_8x32x1_8x32x1_1x32x1x8_8_1x1_intrawave_v3,807.09,276.35,0.0
gfx942,304,66048,3584,5120,ck,0,0,2940.5916,a8w8_blockscale_1x128x128_256x128x128x128_16x16_32x32_2x2_8x32x1_8x32x1_1x32x1x8_8_1x1_intrawave_v3,824.31,282.24,0.0
gfx942,304,66176,3584,5120,ck,0,0,2954.7124,a8w8_blockscale_1x128x128_256x128x128x128_16x16_32x32_2x2_8x32x1_8x32x1_1x32x1x8_8_1x1_intrawave_v3,821.96,281.42,0.0
gfx942,304,66304,3584,5120,ck,0,0,2991.7296,a8w8_blockscale_1x128x128_256x128x128x128_16x16_32x32_2x2_8x32x1_8x32x1_1x32x1x8_8_1x1_intrawave_v3,813.36,278.47,0.0
gfx942,304,66432,3584,5120,ck,0,0,2997.7124,a8w8_blockscale_1x128x128_256x128x128x128_16x16_32x32_2x2_8x32x1_8x32x1_1x32x1x8_8_1x1_intrawave_v3,813.31,278.43,0.0
gfx942,304,66560,3584,5120,ck,0,0,2966.8727,a8w8_blockscale_1x128x128_256x128x128x128_16x16_32x32_2x2_8x32x1_8x32x1_1x32x1x8_8_1x1_intrawave_v3,823.35,281.86,0.0
gfx942,304,66688,3584,5120,ck,0,0,3047.1577,a8w8_blockscale_1x128x128_256x128x128x128_16x16_32x32_2x2_8x32x1_8x32x1_1x32x1x8_8_1x1_intrawave_v3,803.19,274.95,0.0
gfx942,304,66816,3584,5120,ck,0,0,3010.5589,a8w8_blockscale_1x128x128_256x128x128x128_16x16_32x32_2x2_8x32x1_8x32x1_1x32x1x8_8_1x1_intrawave_v3,814.52,278.81,0.0
gfx942,304,66944,3584,5120,ck,0,0,2993.5936,a8w8_blockscale_1x128x128_256x128x128x128_16x16_32x32_2x2_8x32x1_8x32x1_1x32x1x8_8_1x1_intrawave_v3,820.7,280.92,0.0
gfx942,304,67072,3584,5120,ck,0,0,3067.8696,a8w8_blockscale_1x128x128_256x128x128x128_16x16_32x32_2x2_8x32x1_8x32x1_1x32x1x8_8_1x1_intrawave_v3,802.37,274.63,0.0
gfx942,304,67200,3584,5120,ck,0,0,3037.1116,a8w8_blockscale_1x128x128_256x128x128x128_16x16_32x32_2x2_8x32x1_8x32x1_1x32x1x8_8_1x1_intrawave_v3,812.04,277.93,0.0
gfx942,304,67328,3584,5120,ck,0,0,3004.3197,a8w8_blockscale_1x128x128_256x128x128x128_16x16_32x32_2x2_8x32x1_8x32x1_1x32x1x8_8_1x1_intrawave_v3,822.47,281.49,0.0
gfx942,304,67456,3584,5120,ck,0,0,3040.6572,a8w8_blockscale_1x128x128_256x128x128x128_16x16_32x32_2x2_8x32x1_8x32x1_1x32x1x8_8_1x1_intrawave_v3,814.18,278.64,0.0
gfx942,304,67584,3584,5120,ck,0,0,3096.6157,a8w8_blockscale_1x128x128_256x128x128x128_16x16_32x32_2x2_8x32x1_8x32x1_1x32x1x8_8_1x1_intrawave_v3,800.99,274.11,0.0
gfx942,304,67712,3584,5120,ck,0,0,3054.3444,a8w8_blockscale_1x128x128_256x128x128x128_16x16_32x32_2x2_8x32x1_8x32x1_1x32x1x8_8_1x1_intrawave_v3,813.61,278.42,0.0
gfx942,304,67840,3584,5120,ck,0,0,3081.2187,a8w8_blockscale_1x128x128_256x128x128x128_16x16_32x32_2x2_8x32x1_8x32x1_1x32x1x8_8_1x1_intrawave_v3,808.04,276.5,0.0
gfx942,304,67968,3584,5120,ck,0,0,3032.1558,a8w8_blockscale_1x128x128_256x128x128x128_16x16_32x32_2x2_8x32x1_8x32x1_1x32x1x8_8_1x1_intrawave_v3,822.66,281.5,0.0
gfx942,304,68096,3584,5120,ck,0,0,3121.4759,a8w8_blockscale_1x128x128_256x128x128x128_16x16_32x32_2x2_8x32x1_8x32x1_1x32x1x8_8_1x1_intrawave_v3,800.63,273.95,0.0
gfx942,304,68224,3584,5120,ck,0,0,3071.2177,a8w8_blockscale_1x128x128_256x128x128x128_16x16_32x32_2x2_8x32x1_8x32x1_1x32x1x8_8_1x1_intrawave_v3,815.26,278.94,0.0
gfx942,304,68352,3584,5120,ck,0,0,3115.5251,a8w8_blockscale_1x128x128_256x128x128x128_16x16_32x32_2x2_8x32x1_8x32x1_1x32x1x8_8_1x1_intrawave_v3,805.17,275.48,0.0
gfx942,304,68480,3584,5120,ck,0,0,3093.0814,a8w8_blockscale_1x128x128_256x128x128x128_16x16_32x32_2x2_8x32x1_8x32x1_1x32x1x8_8_1x1_intrawave_v3,812.53,277.99,0.0
gfx942,304,68608,3584,5120,ck,0,0,3046.3129,a8w8_blockscale_1x128x128_256x128x128x128_16x16_32x32_2x2_8x32x1_8x32x1_1x32x1x8_8_1x1_intrawave_v3,826.55,282.77,0.0
gfx942,304,68736,3584,5120,ck,0,0,3072.6962,a8w8_blockscale_1x128x128_256x128x128x128_16x16_32x32_2x2_8x32x1_8x32x1_1x32x1x8_8_1x1_intrawave_v3,820.98,280.85,0.0
gfx942,304,68864,3584,5120,ck,0,0,3134.9151,a8w8_blockscale_1x128x128_256x128x128x128_16x16_32x32_2x2_8x32x1_8x32x1_1x32x1x8_8_1x1_intrawave_v3,806.18,275.78,0.0
gfx942,304,68992,3584,5120,ck,0,0,3134.6357,a8w8_blockscale_1x128x128_256x128x128x128_16x16_32x32_2x2_8x32x1_8x32x1_1x32x1x8_8_1x1_intrawave_v3,807.75,276.31,0.0
gfx942,304,69120,3584,5120,ck,0,0,3151.9048,a8w8_blockscale_1x128x128_256x128x128x128_16x16_32x32_2x2_8x32x1_8x32x1_1x32x1x8_8_1x1_intrawave_v3,804.82,275.29,0.0
gfx942,304,69248,3584,5120,ck,0,0,3132.7912,a8w8_blockscale_1x128x128_256x128x128x128_16x16_32x32_2x2_8x32x1_8x32x1_1x32x1x8_8_1x1_intrawave_v3,811.23,277.47,0.0
gfx942,304,69376,3584,5120,ck,0,0,3130.5539,a8w8_blockscale_1x128x128_256x128x128x128_16x16_32x32_2x2_8x32x1_8x32x1_1x32x1x8_8_1x1_intrawave_v3,813.31,278.18,0.0
gfx942,304,69504,3584,5120,ck,0,0,3095.4035,a8w8_blockscale_1x128x128_256x128x128x128_16x16_32x32_2x2_8x32x1_8x32x1_1x32x1x8_8_1x1_intrawave_v3,824.06,281.84,0.0
gfx942,304,69632,3584,5120,ck,0,0,3137.483,a8w8_blockscale_1x128x128_256x128x128x128_16x16_32x32_2x2_8x32x1_8x32x1_1x32x1x8_8_1x1_intrawave_v3,814.51,278.56,0.0
gfx942,304,69760,3584,5120,ck,0,0,3166.1381,a8w8_blockscale_1x128x128_256x128x128x128_16x16_32x32_2x2_8x32x1_8x32x1_1x32x1x8_8_1x1_intrawave_v3,808.62,276.54,0.0
gfx942,304,69888,3584,5120,ck,0,0,3167.8697,a8w8_blockscale_1x128x128_256x128x128x128_16x16_32x32_2x2_8x32x1_8x32x1_1x32x1x8_8_1x1_intrawave_v3,809.66,276.88,0.0
gfx942,304,70016,3584,5120,ck,0,0,3225.7432,a8w8_blockscale_1x128x128_256x128x128x128_16x16_32x32_2x2_8x32x1_8x32x1_1x32x1x8_8_1x1_intrawave_v3,796.59,272.4,0.0
gfx942,304,70144,3584,5120,ck,0,0,3186.6859,a8w8_blockscale_1x128x128_256x128x128x128_16x16_32x32_2x2_8x32x1_8x32x1_1x32x1x8_8_1x1_intrawave_v3,807.83,276.24,0.0
gfx942,304,70272,3584,5120,ck,0,0,3195.1513,a8w8_blockscale_1x128x128_256x128x128x128_16x16_32x32_2x2_8x32x1_8x32x1_1x32x1x8_8_1x1_intrawave_v3,807.16,276.0,0.0
gfx942,304,70400,3584,5120,ck,0,0,3240.2686,a8w8_blockscale_1x128x128_256x128x128x128_16x16_32x32_2x2_8x32x1_8x32x1_1x32x1x8_8_1x1_intrawave_v3,797.37,272.64,0.0
gfx942,304,70528,3584,5120,ck,0,0,3141.4303,a8w8_blockscale_1x128x128_256x128x128x128_16x16_32x32_2x2_8x32x1_8x32x1_1x32x1x8_8_1x1_intrawave_v3,823.95,281.72,0.0
gfx942,304,70656,3584,5120,ck,0,0,3174.1365,a8w8_blockscale_1x128x128_256x128x128x128_16x16_32x32_2x2_8x32x1_8x32x1_1x32x1x8_8_1x1_intrawave_v3,816.94,279.31,0.0
gfx942,304,70784,3584,5120,ck,0,0,3206.565,a8w8_blockscale_1x128x128_256x128x128x128_16x16_32x32_2x2_8x32x1_8x32x1_1x32x1x8_8_1x1_intrawave_v3,810.15,276.98,0.0
gfx942,304,70912,3584,5120,ck,0,0,3254.2933,a8w8_blockscale_1x128x128_256x128x128x128_16x16_32x32_2x2_8x32x1_8x32x1_1x32x1x8_8_1x1_intrawave_v3,799.71,273.4,0.0
gfx942,304,71040,3584,5120,ck,0,0,3277.4616,a8w8_blockscale_1x128x128_256x128x128x128_16x16_32x32_2x2_8x32x1_8x32x1_1x32x1x8_8_1x1_intrawave_v3,795.49,271.95,0.0
gfx942,304,71168,3584,5120,ck,0,0,3223.0886,a8w8_blockscale_1x128x128_256x128x128x128_16x16_32x32_2x2_8x32x1_8x32x1_1x32x1x8_8_1x1_intrawave_v3,810.36,277.02,0.0
gfx942,304,71296,3584,5120,ck,0,0,3232.7826,a8w8_blockscale_1x128x128_256x128x128x128_16x16_32x32_2x2_8x32x1_8x32x1_1x32x1x8_8_1x1_intrawave_v3,809.39,276.68,0.0
gfx942,304,71424,3584,5120,ck,0,0,3234.0058,a8w8_blockscale_1x128x128_256x128x128x128_16x16_32x32_2x2_8x32x1_8x32x1_1x32x1x8_8_1x1_intrawave_v3,810.53,277.06,0.0
gfx942,304,71552,3584,5120,ck,0,0,3267.6676,a8w8_blockscale_1x128x128_256x128x128x128_16x16_32x32_2x2_8x32x1_8x32x1_1x32x1x8_8_1x1_intrawave_v3,803.62,274.69,0.0
gfx942,304,71680,3584,5120,ck,0,0,3252.8392,a8w8_blockscale_1x128x128_256x128x128x128_16x16_32x32_2x2_8x32x1_8x32x1_1x32x1x8_8_1x1_intrawave_v3,808.73,276.42,0.0
gfx942,304,71808,3584,5120,ck,0,0,3302.8206,a8w8_blockscale_1x128x128_256x128x128x128_16x16_32x32_2x2_8x32x1_8x32x1_1x32x1x8_8_1x1_intrawave_v3,797.91,272.71,0.0
gfx942,304,71936,3584,5120,ck,0,0,3196.2238,a8w8_blockscale_1x128x128_256x128x128x128_16x16_32x32_2x2_8x32x1_8x32x1_1x32x1x8_8_1x1_intrawave_v3,825.99,282.3,0.0
gfx942,304,72064,3584,5120,ck,0,0,3268.3234,a8w8_blockscale_1x128x128_256x128x128x128_16x16_32x32_2x2_8x32x1_8x32x1_1x32x1x8_8_1x1_intrawave_v3,809.21,276.56,0.0
gfx942,304,72192,3584,5120,ck,0,0,3222.0663,a8w8_blockscale_1x128x128_256x128x128x128_16x16_32x32_2x2_8x32x1_8x32x1_1x32x1x8_8_1x1_intrawave_v3,822.29,281.01,0.0
gfx942,304,72320,3584,5120,ck,0,0,3272.0986,a8w8_blockscale_1x128x128_256x128x128x128_16x16_32x32_2x2_8x32x1_8x32x1_1x32x1x8_8_1x1_intrawave_v3,811.15,277.2,0.0
gfx942,304,72448,3584,5120,ck,0,0,3232.6709,a8w8_blockscale_1x128x128_256x128x128x128_16x16_32x32_2x2_8x32x1_8x32x1_1x32x1x8_8_1x1_intrawave_v3,822.49,281.07,0.0
gfx942,304,72576,3584,5120,ck,0,0,3239.8723,a8w8_blockscale_1x128x128_256x128x128x128_16x16_32x32_2x2_8x32x1_8x32x1_1x32x1x8_8_1x1_intrawave_v3,822.12,280.93,0.0
gfx942,304,72704,3584,5120,ck,0,0,3232.5135,a8w8_blockscale_1x128x128_256x128x128x128_16x16_32x32_2x2_8x32x1_8x32x1_1x32x1x8_8_1x1_intrawave_v3,825.44,282.05,0.0
gfx942,304,72832,3584,5120,ck,0,0,3260.3022,a8w8_blockscale_1x128x128_256x128x128x128_16x16_32x32_2x2_8x32x1_8x32x1_1x32x1x8_8_1x1_intrawave_v3,819.85,280.13,0.0
gfx942,304,72960,3584,5120,ck,0,0,3302.501,a8w8_blockscale_1x128x128_256x128x128x128_16x16_32x32_2x2_8x32x1_8x32x1_1x32x1x8_8_1x1_intrawave_v3,810.79,277.03,0.0
gfx942,304,73088,3584,5120,ck,0,0,3321.5594,a8w8_blockscale_1x128x128_256x128x128x128_16x16_32x32_2x2_8x32x1_8x32x1_1x32x1x8_8_1x1_intrawave_v3,807.55,275.91,0.0
gfx942,304,73216,3584,5120,ck,0,0,3302.5894,a8w8_blockscale_1x128x128_256x128x128x128_16x16_32x32_2x2_8x32x1_8x32x1_1x32x1x8_8_1x1_intrawave_v3,813.62,277.97,0.0
gfx942,304,73344,3584,5120,ck,0,0,3319.9261,a8w8_blockscale_1x128x128_256x128x128x128_16x16_32x32_2x2_8x32x1_8x32x1_1x32x1x8_8_1x1_intrawave_v3,810.78,276.99,0.0
gfx942,304,73472,3584,5120,ck,0,0,3340.5586,a8w8_blockscale_1x128x128_256x128x128x128_16x16_32x32_2x2_8x32x1_8x32x1_1x32x1x8_8_1x1_intrawave_v3,807.18,275.75,0.0
gfx942,304,73600,3584,5120,ck,0,0,3278.2466,a8w8_blockscale_1x128x128_256x128x128x128_16x16_32x32_2x2_8x32x1_8x32x1_1x32x1x8_8_1x1_intrawave_v3,823.96,281.48,0.0
gfx942,304,73728,3584,5120,ck,0,0,3310.4503,a8w8_blockscale_1x128x128_256x128x128x128_16x16_32x32_2x2_8x32x1_8x32x1_1x32x1x8_8_1x1_intrawave_v3,817.36,279.21,0.0
gfx942,304,73856,3584,5120,ck,0,0,3359.0128,a8w8_blockscale_1x128x128_256x128x128x128_16x16_32x32_2x2_8x32x1_8x32x1_1x32x1x8_8_1x1_intrawave_v3,806.94,275.64,0.0
gfx942,304,73984,3584,5120,ck,0,0,3315.459,a8w8_blockscale_1x128x128_256x128x128x128_16x16_32x32_2x2_8x32x1_8x32x1_1x32x1x8_8_1x1_intrawave_v3,818.96,279.74,0.0
gfx942,304,74112,3584,5120,ck,0,0,3293.7443,a8w8_blockscale_1x128x128_256x128x128x128_16x16_32x32_2x2_8x32x1_8x32x1_1x32x1x8_8_1x1_intrawave_v3,825.78,282.06,0.0
gfx942,304,74240,3584,5120,ck,0,0,3299.5904,a8w8_blockscale_1x128x128_256x128x128x128_16x16_32x32_2x2_8x32x1_8x32x1_1x32x1x8_8_1x1_intrawave_v3,825.74,282.04,0.0
gfx942,304,74368,3584,5120,ck,0,0,3400.6586,a8w8_blockscale_1x128x128_256x128x128x128_16x16_32x32_2x2_8x32x1_8x32x1_1x32x1x8_8_1x1_intrawave_v3,802.58,274.12,0.0
gfx942,304,74496,3584,5120,ck,0,0,3377.0636,a8w8_blockscale_1x128x128_256x128x128x128_16x16_32x32_2x2_8x32x1_8x32x1_1x32x1x8_8_1x1_intrawave_v3,809.58,276.5,0.0
gfx942,304,74624,3584,5120,ck,0,0,3324.0455,a8w8_blockscale_1x128x128_256x128x128x128_16x16_32x32_2x2_8x32x1_8x32x1_1x32x1x8_8_1x1_intrawave_v3,823.91,281.38,0.0
gfx942,304,74752,3584,5120,ck,0,0,3332.84,a8w8_blockscale_1x128x128_256x128x128x128_16x16_32x32_2x2_8x32x1_8x32x1_1x32x1x8_8_1x1_intrawave_v3,823.14,281.11,0.0
gfx942,304,74880,3584,5120,ck,0,0,3330.9774,a8w8_blockscale_1x128x128_256x128x128x128_16x16_32x32_2x2_8x32x1_8x32x1_1x32x1x8_8_1x1_intrawave_v3,825.02,281.74,0.0
gfx942,304,75008,3584,5120,ck,0,0,3347.8219,a8w8_blockscale_1x128x128_256x128x128x128_16x16_32x32_2x2_8x32x1_8x32x1_1x32x1x8_8_1x1_intrawave_v3,822.27,280.79,0.0
gfx942,304,75136,3584,5120,ck,0,0,3407.188,a8w8_blockscale_1x128x128_256x128x128x128_16x16_32x32_2x2_8x32x1_8x32x1_1x32x1x8_8_1x1_intrawave_v3,809.32,276.36,0.0
gfx942,304,75264,3584,5120,ck,0,0,3413.4271,a8w8_blockscale_1x128x128_256x128x128x128_16x16_32x32_2x2_8x32x1_8x32x1_1x32x1x8_8_1x1_intrawave_v3,809.22,276.32,0.0
gfx942,304,75392,3584,5120,ck,0,0,3448.8606,a8w8_blockscale_1x128x128_256x128x128x128_16x16_32x32_2x2_8x32x1_8x32x1_1x32x1x8_8_1x1_intrawave_v3,802.26,273.94,0.0
gfx942,304,75520,3584,5120,ck,0,0,3375.3178,a8w8_blockscale_1x128x128_256x128x128x128_16x16_32x32_2x2_8x32x1_8x32x1_1x32x1x8_8_1x1_intrawave_v3,821.14,280.37,0.0
gfx942,304,75648,3584,5120,ck,0,0,3375.415,a8w8_blockscale_1x128x128_256x128x128x128_16x16_32x32_2x2_8x32x1_8x32x1_1x32x1x8_8_1x1_intrawave_v3,822.5,280.83,0.0
gfx942,304,75776,3584,5120,ck,0,0,3435.4018,a8w8_blockscale_1x128x128_256x128x128x128_16x16_32x32_2x2_8x32x1_8x32x1_1x32x1x8_8_1x1_intrawave_v3,809.51,276.38,0.0
gfx942,304,75904,3584,5120,ck,0,0,3491.227,a8w8_blockscale_1x128x128_256x128x128x128_16x16_32x32_2x2_8x32x1_8x32x1_1x32x1x8_8_1x1_intrawave_v3,797.91,272.41,0.0
gfx942,304,76032,3584,5120,ck,0,0,3441.8277,a8w8_blockscale_1x128x128_256x128x128x128_16x16_32x32_2x2_8x32x1_8x32x1_1x32x1x8_8_1x1_intrawave_v3,810.73,276.78,0.0
gfx942,304,76160,3584,5120,ck,0,0,3392.5317,a8w8_blockscale_1x128x128_256x128x128x128_16x16_32x32_2x2_8x32x1_8x32x1_1x32x1x8_8_1x1_intrawave_v3,823.89,281.27,0.0
gfx942,304,76288,3584,5120,ck,0,0,3488.2691,a8w8_blockscale_1x128x128_256x128x128x128_16x16_32x32_2x2_8x32x1_8x32x1_1x32x1x8_8_1x1_intrawave_v3,802.63,274.0,0.0
gfx942,304,76416,3584,5120,ck,0,0,3450.9267,a8w8_blockscale_1x128x128_256x128x128x128_16x16_32x32_2x2_8x32x1_8x32x1_1x32x1x8_8_1x1_intrawave_v3,812.67,277.42,0.0
gfx942,304,76544,3584,5120,ck,0,0,3511.6,a8w8_blockscale_1x128x128_256x128x128x128_16x16_32x32_2x2_8x32x1_8x32x1_1x32x1x8_8_1x1_intrawave_v3,799.97,273.07,0.0
gfx942,304,76672,3584,5120,ck,0,0,3423.9477,a8w8_blockscale_1x128x128_256x128x128x128_16x16_32x32_2x2_8x32x1_8x32x1_1x32x1x8_8_1x1_intrawave_v3,821.82,280.52,0.0
gfx942,304,76800,3584,5120,ck,0,0,3478.1104,a8w8_blockscale_1x128x128_256x128x128x128_16x16_32x32_2x2_8x32x1_8x32x1_1x32x1x8_8_1x1_intrawave_v3,810.37,276.61,0.0
gfx942,304,76928,3584,5120,ck,0,0,3440.8519,a8w8_blockscale_1x128x128_256x128x128x128_16x16_32x32_2x2_8x32x1_8x32x1_1x32x1x8_8_1x1_intrawave_v3,820.51,280.06,0.0
gfx942,304,77056,3584,5120,ck,0,0,3436.5005,a8w8_blockscale_1x128x128_256x128x128x128_16x16_32x32_2x2_8x32x1_8x32x1_1x32x1x8_8_1x1_intrawave_v3,822.92,280.87,0.0
gfx942,304,77184,3584,5120,ck,0,0,3490.2612,a8w8_blockscale_1x128x128_256x128x128x128_16x16_32x32_2x2_8x32x1_8x32x1_1x32x1x8_8_1x1_intrawave_v3,811.59,277.0,0.0
gfx942,304,77312,3584,5120,ck,0,0,3478.7468,a8w8_blockscale_1x128x128_256x128x128x128_16x16_32x32_2x2_8x32x1_8x32x1_1x32x1x8_8_1x1_intrawave_v3,815.63,278.36,0.0
gfx942,304,77440,3584,5120,ck,0,0,3431.2737,a8w8_blockscale_1x128x128_256x128x128x128_16x16_32x32_2x2_8x32x1_8x32x1_1x32x1x8_8_1x1_intrawave_v3,828.28,282.67,0.0
gfx942,304,77568,3584,5120,ck,0,0,3514.1494,a8w8_blockscale_1x128x128_256x128x128x128_16x16_32x32_2x2_8x32x1_8x32x1_1x32x1x8_8_1x1_intrawave_v3,810.08,276.46,0.0
gfx942,304,77696,3584,5120,ck,0,0,3450.9923,a8w8_blockscale_1x128x128_256x128x128x128_16x16_32x32_2x2_8x32x1_8x32x1_1x32x1x8_8_1x1_intrawave_v3,826.27,281.97,0.0
gfx942,304,77824,3584,5120,ck,0,0,3480.5613,a8w8_blockscale_1x128x128_256x128x128x128_16x16_32x32_2x2_8x32x1_8x32x1_1x32x1x8_8_1x1_intrawave_v3,820.6,280.03,0.0
gfx942,304,77952,3584,5120,ck,0,0,3523.5513,a8w8_blockscale_1x128x128_256x128x128x128_16x16_32x32_2x2_8x32x1_8x32x1_1x32x1x8_8_1x1_intrawave_v3,811.92,277.06,0.0
gfx942,304,78080,3584,5120,ck,0,0,3484.1439,a8w8_blockscale_1x128x128_256x128x128x128_16x16_32x32_2x2_8x32x1_8x32x1_1x32x1x8_8_1x1_intrawave_v3,822.45,280.64,0.0
gfx942,304,78208,3584,5120,ck,0,0,3538.1226,a8w8_blockscale_1x128x128_256x128x128x128_16x16_32x32_2x2_8x32x1_8x32x1_1x32x1x8_8_1x1_intrawave_v3,811.23,276.8,0.0
gfx942,304,78336,3584,5120,ck,0,0,3556.2122,a8w8_blockscale_1x128x128_256x128x128x128_16x16_32x32_2x2_8x32x1_8x32x1_1x32x1x8_8_1x1_intrawave_v3,808.43,275.84,0.0
gfx942,304,78464,3584,5120,ck,0,0,3587.2263,a8w8_blockscale_1x128x128_256x128x128x128_16x16_32x32_2x2_8x32x1_8x32x1_1x32x1x8_8_1x1_intrawave_v3,802.75,273.89,0.0
gfx942,304,78592,3584,5120,ck,0,0,3498.7633,a8w8_blockscale_1x128x128_256x128x128x128_16x16_32x32_2x2_8x32x1_8x32x1_1x32x1x8_8_1x1_intrawave_v3,824.39,281.27,0.0
gfx942,304,78720,3584,5120,ck,0,0,3561.573,a8w8_blockscale_1x128x128_256x128x128x128_16x16_32x32_2x2_8x32x1_8x32x1_1x32x1x8_8_1x1_intrawave_v3,811.17,276.75,0.0
gfx942,304,78848,3584,5120,ck,0,0,3515.774,a8w8_blockscale_1x128x128_256x128x128x128_16x16_32x32_2x2_8x32x1_8x32x1_1x32x1x8_8_1x1_intrawave_v3,823.07,280.8,0.0
gfx942,304,78976,3584,5120,ck,0,0,3571.4396,a8w8_blockscale_1x128x128_256x128x128x128_16x16_32x32_2x2_8x32x1_8x32x1_1x32x1x8_8_1x1_intrawave_v3,811.56,276.87,0.0
gfx942,304,79104,3584,5120,ck,0,0,3571.4451,a8w8_blockscale_1x128x128_256x128x128x128_16x16_32x32_2x2_8x32x1_8x32x1_1x32x1x8_8_1x1_intrawave_v3,812.87,277.31,0.0
gfx942,304,79232,3584,5120,ck,0,0,3621.6343,a8w8_blockscale_1x128x128_256x128x128x128_16x16_32x32_2x2_8x32x1_8x32x1_1x32x1x8_8_1x1_intrawave_v3,802.9,273.9,0.0
gfx942,304,79360,3584,5120,ck,0,0,3590.4688,a8w8_blockscale_1x128x128_256x128x128x128_16x16_32x32_2x2_8x32x1_8x32x1_1x32x1x8_8_1x1_intrawave_v3,811.18,276.71,0.0
gfx942,304,79488,3584,5120,ck,0,0,3547.6501,a8w8_blockscale_1x128x128_256x128x128x128_16x16_32x32_2x2_8x32x1_8x32x1_1x32x1x8_8_1x1_intrawave_v3,822.3,280.5,0.0
gfx942,304,79616,3584,5120,ck,0,0,3579.0063,a8w8_blockscale_1x128x128_256x128x128x128_16x16_32x32_2x2_8x32x1_8x32x1_1x32x1x8_8_1x1_intrawave_v3,816.41,278.48,0.0
gfx942,304,79744,3584,5120,ck,0,0,3616.2304,a8w8_blockscale_1x128x128_256x128x128x128_16x16_32x32_2x2_8x32x1_8x32x1_1x32x1x8_8_1x1_intrawave_v3,809.3,276.05,0.0
gfx942,304,79872,3584,5120,ck,0,0,3557.1763,a8w8_blockscale_1x128x128_256x128x128x128_16x16_32x32_2x2_8x32x1_8x32x1_1x32x1x8_8_1x1_intrawave_v3,824.06,281.07,0.0
gfx942,304,80000,3584,5120,ck,0,0,3672.3695,a8w8_blockscale_1x128x128_256x128x128x128_16x16_32x32_2x2_8x32x1_8x32x1_1x32x1x8_8_1x1_intrawave_v3,799.49,272.68,0.0
gfx942,304,16,4096,5120,ck,8,0,17.7448,a8w8_blockscale_1x128x128_256x16x64x256_16x16_16x16_1x1_16x16x1_16x16x1_1x16x1x16_4_1x1_intrawave_v1,37.82,1193.84,0.0
gfx942,304,32,4096,5120,ck,8,0,17.9575,a8w8_blockscale_1x128x128_256x16x64x256_16x16_16x16_1x1_16x16x1_16x16x1_1x16x1x16_4_1x1_intrawave_v1,74.74,1191.56,0.0
gfx942,304,48,4096,5120,ck,8,0,17.6499,a8w8_blockscale_1x128x128_256x16x64x256_16x16_16x16_1x1_16x16x1_16x16x1_1x16x1x16_4_1x1_intrawave_v1,114.07,1224.4,0.0
gfx942,304,64,4096,5120,ck,8,0,17.6103,a8w8_blockscale_1x128x128_256x16x64x256_16x16_16x16_1x1_16x16x1_16x16x1_1x16x1x16_4_1x1_intrawave_v1,152.43,1239.25,0.0
gfx942,304,80,4096,5120,ck,13,0,23.4315,a8w8_blockscale_1x128x128_256x32x64x256_16x16_16x16_2x1_16x16x1_16x16x1_1x32x1x8_8_2x1_intrawave_v1,143.2,940.46,0.0
gfx942,304,96,4096,5120,ck,13,0,23.0567,a8w8_blockscale_1x128x128_256x32x64x256_16x16_16x16_2x1_16x16x1_16x16x1_1x32x1x8_8_2x1_intrawave_v1,174.64,964.99,0.0
gfx942,304,112,4096,5120,ck,13,0,24.4544,a8w8_blockscale_1x128x128_256x32x64x256_16x16_16x16_2x1_16x16x1_16x16x1_1x32x1x8_8_2x1_intrawave_v1,192.1,918.54,0.0
gfx942,304,128,4096,5120,ck,18,0,23.0976,a8w8_blockscale_1x128x128_256x64x64x256_16x16_32x32_1x1_16x16x1_16x16x1_1x32x1x8_8_1x1_intrawave_v1,232.44,981.72,0.0
gfx942,304,144,4096,5120,ck,18,0,25.3116,a8w8_blockscale_1x128x128_256x64x64x256_16x16_32x32_1x1_16x16x1_16x16x1_1x32x1x8_8_1x1_intrawave_v1,238.62,904.27,0.0
gfx942,304,160,4096,5120,ck,18,0,26.1337,a8w8_blockscale_1x128x128_256x64x64x256_16x16_32x32_1x1_16x16x1_16x16x1_1x32x1x8_8_1x1_intrawave_v1,256.79,883.97,0.0
gfx942,304,176,4096,5120,ck,18,0,26.5712,a8w8_blockscale_1x128x128_256x64x64x256_16x16_32x32_1x1_16x16x1_16x16x1_1x32x1x8_8_1x1_intrawave_v1,277.82,877.43,0.0
gfx942,304,192,4096,5120,ck,18,0,24.0455,a8w8_blockscale_1x128x128_256x64x64x256_16x16_32x32_1x1_16x16x1_16x16x1_1x32x1x8_8_1x1_intrawave_v1,334.91,978.45,0.0
gfx942,304,208,4096,5120,ck,18,0,31.0975,a8w8_blockscale_1x128x128_256x64x64x256_16x16_32x32_1x1_16x16x1_16x16x1_1x32x1x8_8_1x1_intrawave_v1,280.54,763.42,0.0
gfx942,304,224,4096,5120,ck,18,0,30.352,a8w8_blockscale_1x128x128_256x64x64x256_16x16_32x32_1x1_16x16x1_16x16x1_1x32x1x8_8_1x1_intrawave_v1,309.54,789.19,0.0
gfx942,304,240,4096,5120,ck,18,0,30.5538,a8w8_blockscale_1x128x128_256x64x64x256_16x16_32x32_1x1_16x16x1_16x16x1_1x32x1x8_8_1x1_intrawave_v1,329.46,790.95,0.0
gfx942,304,256,4096,5120,ck,18,0,28.7075,a8w8_blockscale_1x128x128_256x64x64x256_16x16_32x32_1x1_16x16x1_16x16x1_1x32x1x8_8_1x1_intrawave_v1,374.03,849.23,0.0
gfx942,304,288,4096,5120,ck,12,0,36.7823,a8w8_blockscale_1x128x128_256x32x128x256_16x16_32x32_1x1_16x16x1_16x16x1_1x32x1x8_8_1x1_intrawave_v1,328.41,674.38,0.0
gfx942,304,320,4096,5120,ck,3,0,47.9072,a8w8_blockscale_1x128x128_256x64x64x128_16x16_32x32_1x1_8x32x1_8x32x1_1x32x1x8_8_1x1_intrawave_v3,280.16,526.67,0.0
gfx942,304,352,4096,5120,ck,2,0,44.4107,a8w8_blockscale_1x128x128_256x64x128x128_16x16_32x32_1x2_8x32x1_8x32x1_1x32x1x8_8_1x1_intrawave_v3,332.44,577.73,0.0
gfx942,304,384,4096,5120,ck,3,0,48.4007,a8w8_blockscale_1x128x128_256x64x64x128_16x16_32x32_1x1_8x32x1_8x32x1_1x32x1x8_8_1x1_intrawave_v3,332.77,538.9,0.0
gfx942,304,416,4096,5120,ck,2,0,45.9363,a8w8_blockscale_1x128x128_256x64x128x128_16x16_32x32_1x2_8x32x1_8x32x1_1x32x1x8_8_1x1_intrawave_v3,379.84,577.09,0.0
gfx942,304,448,4096,5120,ck,3,0,49.6186,a8w8_blockscale_1x128x128_256x64x64x128_16x16_32x32_1x1_8x32x1_8x32x1_1x32x1x8_8_1x1_intrawave_v3,378.7,542.85,0.0
gfx942,304,480,4096,5120,ck,2,0,47.7357,a8w8_blockscale_1x128x128_256x64x128x128_16x16_32x32_1x2_8x32x1_8x32x1_1x32x1x8_8_1x1_intrawave_v3,421.75,573.18,0.0
gfx942,304,512,4096,5120,ck,3,0,50.8883,a8w8_blockscale_1x128x128_256x64x64x128_16x16_32x32_1x1_8x32x1_8x32x1_1x32x1x8_8_1x1_intrawave_v3,422.0,546.04,0.0
gfx942,304,544,4096,5120,ck,2,0,51.0393,a8w8_blockscale_1x128x128_256x64x128x128_16x16_32x32_1x2_8x32x1_8x32x1_1x32x1x8_8_1x1_intrawave_v3,447.05,552.77,0.0
gfx942,304,576,4096,5120,ck,2,0,54.9442,a8w8_blockscale_1x128x128_256x64x128x128_16x16_32x32_1x2_8x32x1_8x32x1_1x32x1x8_8_1x1_intrawave_v3,439.7,521.24,0.0
gfx942,304,608,4096,5120,ck,0,0,63.8968,a8w8_blockscale_1x128x128_256x128x128x128_16x16_32x32_2x2_8x32x1_8x32x1_1x32x1x8_8_1x1_intrawave_v3,399.1,454.88,0.0
gfx942,304,640,4096,5120,ck,2,0,67.1997,a8w8_blockscale_1x128x128_256x64x128x128_16x16_32x32_1x2_8x32x1_8x32x1_1x32x1x8_8_1x1_intrawave_v3,399.46,438.86,0.0
gfx942,304,672,4096,5120,ck,0,0,62.4287,a8w8_blockscale_1x128x128_256x128x128x128_16x16_32x32_2x2_8x32x1_8x32x1_1x32x1x8_8_1x1_intrawave_v3,451.49,479.22,0.0
gfx942,304,704,4096,5120,ck,0,0,63.2041,a8w8_blockscale_1x128x128_256x128x128x128_16x16_32x32_2x2_8x32x1_8x32x1_1x32x1x8_8_1x1_intrawave_v3,467.18,480.08,0.0
gfx942,304,736,4096,5120,ck,0,0,65.9877,a8w8_blockscale_1x128x128_256x128x128x128_16x16_32x32_2x2_8x32x1_8x32x1_1x32x1x8_8_1x1_intrawave_v3,467.82,466.29,0.0
gfx942,304,768,4096,5120,ck,2,0,69.0032,a8w8_blockscale_1x128x128_256x64x128x128_16x16_32x32_1x2_8x32x1_8x32x1_1x32x1x8_8_1x1_intrawave_v3,466.82,452.08,0.0
gfx942,304,800,4096,5120,ck,0,0,65.8108,a8w8_blockscale_1x128x128_256x128x128x128_16x16_32x32_2x2_8x32x1_8x32x1_1x32x1x8_8_1x1_intrawave_v3,509.86,480.49,0.0
gfx942,304,832,4096,5120,ck,0,0,65.8533,a8w8_blockscale_1x128x128_256x128x128x128_16x16_32x32_2x2_8x32x1_8x32x1_1x32x1x8_8_1x1_intrawave_v3,529.91,486.64,0.0
gfx942,304,864,4096,5120,ck,0,0,67.8611,a8w8_blockscale_1x128x128_256x128x128x128_16x16_32x32_2x2_8x32x1_8x32x1_1x32x1x8_8_1x1_intrawave_v3,534.01,478.52,0.0
gfx942,304,896,4096,5120,ck,2,0,72.0381,a8w8_blockscale_1x128x128_256x64x128x128_16x16_32x32_1x2_8x32x1_8x32x1_1x32x1x8_8_1x1_intrawave_v3,521.68,456.69,0.0
gfx942,304,928,4096,5120,ck,0,0,69.9511,a8w8_blockscale_1x128x128_256x128x128x128_16x16_32x32_2x2_8x32x1_8x32x1_1x32x1x8_8_1x1_intrawave_v3,556.43,476.41,0.0
gfx942,304,960,4096,5120,ck,0,0,70.0179,a8w8_blockscale_1x128x128_256x128x128x128_16x16_32x32_2x2_8x32x1_8x32x1_1x32x1x8_8_1x1_intrawave_v3,575.07,482.03,0.0
gfx942,304,992,4096,5120,ck,0,0,76.0492,a8w8_blockscale_1x128x128_256x128x128x128_16x16_32x32_2x2_8x32x1_8x32x1_1x32x1x8_8_1x1_intrawave_v3,547.11,449.41,0.0
gfx942,304,1024,4096,5120,ck,0,0,77.1537,a8w8_blockscale_1x128x128_256x128x128x128_16x16_32x32_2x2_8x32x1_8x32x1_1x32x1x8_8_1x1_intrawave_v3,556.68,448.49,0.0
gfx942,304,1088,4096,5120,ck,0,0,72.9818,a8w8_blockscale_1x128x128_256x128x128x128_16x16_32x32_2x2_8x32x1_8x32x1_1x32x1x8_8_1x1_intrawave_v3,625.28,485.81,0.0
gfx942,304,1152,4096,5120,ck,0,0,82.1329,a8w8_blockscale_1x128x128_256x128x128x128_16x16_32x32_2x2_8x32x1_8x32x1_1x32x1x8_8_1x1_intrawave_v3,588.3,442.05,0.0
gfx942,304,1216,4096,5120,ck,2,0,86.2519,a8w8_blockscale_1x128x128_256x64x128x128_16x16_32x32_1x2_8x32x1_8x32x1_1x32x1x8_8_1x1_intrawave_v3,591.32,430.82,0.0
gfx942,304,1280,4096,5120,ck,0,0,102.3785,a8w8_blockscale_1x128x128_256x128x128x128_16x16_32x32_2x2_8x32x1_8x32x1_1x32x1x8_8_1x1_intrawave_v3,524.4,371.28,0.0
gfx942,304,1344,4096,5120,ck,0,0,106.7685,a8w8_blockscale_1x128x128_256x128x128x128_16x16_32x32_2x2_8x32x1_8x32x1_1x32x1x8_8_1x1_intrawave_v3,527.98,363.99,0.0
gfx942,304,1408,4096,5120,ck,0,0,103.5783,a8w8_blockscale_1x128x128_256x128x128x128_16x16_32x32_2x2_8x32x1_8x32x1_1x32x1x8_8_1x1_intrawave_v3,570.16,383.43,0.0
gfx942,304,1472,4096,5120,ck,0,0,104.2797,a8w8_blockscale_1x128x128_256x128x128x128_16x16_32x32_2x2_8x32x1_8x32x1_1x32x1x8_8_1x1_intrawave_v3,592.06,389.02,0.0
gfx942,304,1536,4096,5120,ck,0,0,107.7323,a8w8_blockscale_1x128x128_256x128x128x128_16x16_32x32_2x2_8x32x1_8x32x1_1x32x1x8_8_1x1_intrawave_v3,598.01,384.46,0.0
gfx942,304,1600,4096,5120,ck,0,0,108.4918,a8w8_blockscale_1x128x128_256x128x128x128_16x16_32x32_2x2_8x32x1_8x32x1_1x32x1x8_8_1x1_intrawave_v3,618.56,389.62,0.0
gfx942,304,1664,4096,5120,ck,0,0,111.8954,a8w8_blockscale_1x128x128_256x128x128x128_16x16_32x32_2x2_8x32x1_8x32x1_1x32x1x8_8_1x1_intrawave_v3,623.74,385.38,0.0
gfx942,304,1728,4096,5120,ck,0,0,109.3546,a8w8_blockscale_1x128x128_256x128x128x128_16x16_32x32_2x2_8x32x1_8x32x1_1x32x1x8_8_1x1_intrawave_v3,662.78,402.13,0.0
gfx942,304,1792,4096,5120,ck,0,0,110.016,a8w8_blockscale_1x128x128_256x128x128x128_16x16_32x32_2x2_8x32x1_8x32x1_1x32x1x8_8_1x1_intrawave_v3,683.19,407.46,0.0
gfx942,304,1856,4096,5120,ck,0,0,114.3486,a8w8_blockscale_1x128x128_256x128x128x128_16x16_32x32_2x2_8x32x1_8x32x1_1x32x1x8_8_1x1_intrawave_v3,680.78,399.47,0.0
gfx942,304,1920,4096,5120,ck,0,0,119.7303,a8w8_blockscale_1x128x128_256x128x128x128_16x16_32x32_2x2_8x32x1_8x32x1_1x32x1x8_8_1x1_intrawave_v3,672.6,388.63,0.0
gfx942,304,1984,4096,5120,ck,0,0,120.2866,a8w8_blockscale_1x128x128_256x128x128x128_16x16_32x32_2x2_8x32x1_8x32x1_1x32x1x8_8_1x1_intrawave_v3,691.81,393.91,0.0
gfx942,304,2048,4096,5120,ck,0,0,119.5978,a8w8_blockscale_1x128x128_256x128x128x128_16x16_32x32_2x2_8x32x1_8x32x1_1x32x1x8_8_1x1_intrawave_v3,718.24,403.31,0.0
gfx942,304,2112,4096,5120,ck,0,0,123.3161,a8w8_blockscale_1x128x128_256x128x128x128_16x16_32x32_2x2_8x32x1_8x32x1_1x32x1x8_8_1x1_intrawave_v3,718.35,398.05,0.0
gfx942,304,2176,4096,5120,ck,0,0,125.5579,a8w8_blockscale_1x128x128_256x128x128x128_16x16_32x32_2x2_8x32x1_8x32x1_1x32x1x8_8_1x1_intrawave_v3,726.9,397.73,0.0
gfx942,304,2240,4096,5120,ck,0,0,130.0835,a8w8_blockscale_1x128x128_256x128x128x128_16x16_32x32_2x2_8x32x1_8x32x1_1x32x1x8_8_1x1_intrawave_v3,722.25,390.44,0.0
gfx942,304,2304,4096,5120,ck,0,0,128.9544,a8w8_blockscale_1x128x128_256x128x128x128_16x16_32x32_2x2_8x32x1_8x32x1_1x32x1x8_8_1x1_intrawave_v3,749.39,400.47,0.0
gfx942,304,2368,4096,5120,ck,0,0,132.6002,a8w8_blockscale_1x128x128_256x128x128x128_16x16_32x32_2x2_8x32x1_8x32x1_1x32x1x8_8_1x1_intrawave_v3,749.03,395.88,0.0
gfx942,304,2432,4096,5120,ck,0,0,134.919,a8w8_blockscale_1x128x128_256x128x128x128_16x16_32x32_2x2_8x32x1_8x32x1_1x32x1x8_8_1x1_intrawave_v3,756.05,395.4,0.0
gfx942,304,2496,4096,5120,ck,0,0,171.2557,a8w8_blockscale_1x128x128_256x128x128x128_16x16_32x32_2x2_8x32x1_8x32x1_1x32x1x8_8_1x1_intrawave_v3,611.31,316.48,0.0
gfx942,304,2560,4096,5120,ck,0,0,173.0054,a8w8_blockscale_1x128x128_256x128x128x128_16x16_32x32_2x2_8x32x1_8x32x1_1x32x1x8_8_1x1_intrawave_v3,620.64,318.2,0.0
gfx942,304,2624,4096,5120,ck,0,0,168.3146,a8w8_blockscale_1x128x128_256x128x128x128_16x16_32x32_2x2_8x32x1_8x32x1_1x32x1x8_8_1x1_intrawave_v3,653.89,332.13,0.0
gfx942,304,2688,4096,5120,ck,0,0,171.0078,a8w8_blockscale_1x128x128_256x128x128x128_16x16_32x32_2x2_8x32x1_8x32x1_1x32x1x8_8_1x1_intrawave_v3,659.29,331.88,0.0
gfx942,304,2752,4096,5120,ck,0,0,174.0675,a8w8_blockscale_1x128x128_256x128x128x128_16x16_32x32_2x2_8x32x1_8x32x1_1x32x1x8_8_1x1_intrawave_v3,663.12,330.94,0.0
gfx942,304,2816,4096,5120,ck,0,0,174.3067,a8w8_blockscale_1x128x128_256x128x128x128_16x16_32x32_2x2_8x32x1_8x32x1_1x32x1x8_8_1x1_intrawave_v3,677.61,335.38,0.0
gfx942,304,2880,4096,5120,ck,0,0,173.2599,a8w8_blockscale_1x128x128_256x128x128x128_16x16_32x32_2x2_8x32x1_8x32x1_1x32x1x8_8_1x1_intrawave_v3,697.2,342.32,0.0
gfx942,304,2944,4096,5120,ck,0,0,179.4017,a8w8_blockscale_1x128x128_256x128x128x128_16x16_32x32_2x2_8x32x1_8x32x1_1x32x1x8_8_1x1_intrawave_v3,688.29,335.35,0.0
gfx942,304,3008,4096,5120,ck,0,0,174.488,a8w8_blockscale_1x128x128_256x128x128x128_16x16_32x32_2x2_8x32x1_8x32x1_1x32x1x8_8_1x1_intrawave_v3,723.06,349.67,0.0
gfx942,304,3072,4096,5120,ck,0,0,177.1569,a8w8_blockscale_1x128x128_256x128x128x128_16x16_32x32_2x2_8x32x1_8x32x1_1x32x1x8_8_1x1_intrawave_v3,727.32,349.22,0.0
gfx942,304,3136,4096,5120,ck,0,0,180.4544,a8w8_blockscale_1x128x128_256x128x128x128_16x16_32x32_2x2_8x32x1_8x32x1_1x32x1x8_8_1x1_intrawave_v3,728.9,347.56,0.0
gfx942,304,3200,4096,5120,ck,0,0,183.2534,a8w8_blockscale_1x128x128_256x128x128x128_16x16_32x32_2x2_8x32x1_8x32x1_1x32x1x8_8_1x1_intrawave_v3,732.42,346.9,0.0
gfx942,304,3264,4096,5120,ck,0,0,185.0155,a8w8_blockscale_1x128x128_256x128x128x128_16x16_32x32_2x2_8x32x1_8x32x1_1x32x1x8_8_1x1_intrawave_v3,739.95,348.2,0.0
gfx942,304,3328,4096,5120,ck,0,0,188.9078,a8w8_blockscale_1x128x128_256x128x128x128_16x16_32x32_2x2_8x32x1_8x32x1_1x32x1x8_8_1x1_intrawave_v3,738.91,345.53,0.0
gfx942,304,3392,4096,5120,ck,0,0,197.9197,a8w8_blockscale_1x128x128_256x128x128x128_16x16_32x32_2x2_8x32x1_8x32x1_1x32x1x8_8_1x1_intrawave_v3,718.83,334.1,0.0
gfx942,304,3456,4096,5120,ck,0,0,190.3816,a8w8_blockscale_1x128x128_256x128x128x128_16x16_32x32_2x2_8x32x1_8x32x1_1x32x1x8_8_1x1_intrawave_v3,761.39,351.81,0.0
gfx942,304,3520,4096,5120,ck,0,0,202.3545,a8w8_blockscale_1x128x128_256x128x128x128_16x16_32x32_2x2_8x32x1_8x32x1_1x32x1x8_8_1x1_intrawave_v3,729.61,335.2,0.0
gfx942,304,3584,4096,5120,ck,0,0,199.7808,a8w8_blockscale_1x128x128_256x128x128x128_16x16_32x32_2x2_8x32x1_8x32x1_1x32x1x8_8_1x1_intrawave_v3,752.44,343.79,0.0
gfx942,304,3648,4096,5120,ck,0,0,220.4537,a8w8_blockscale_1x128x128_256x128x128x128_16x16_32x32_2x2_8x32x1_8x32x1_1x32x1x8_8_1x1_intrawave_v3,694.06,315.41,0.0
gfx942,304,3712,4096,5120,ck,0,0,229.1089,a8w8_blockscale_1x128x128_256x128x128x128_16x16_32x32_2x2_8x32x1_8x32x1_1x32x1x8_8_1x1_intrawave_v3,679.56,307.21,0.0
gfx942,304,3776,4096,5120,ck,0,0,220.9619,a8w8_blockscale_1x128x128_256x128x128x128_16x16_32x32_2x2_8x32x1_8x32x1_1x32x1x8_8_1x1_intrawave_v3,716.76,322.4,0.0
gfx942,304,3840,4096,5120,ck,0,0,227.8936,a8w8_blockscale_1x128x128_256x128x128x128_16x16_32x32_2x2_8x32x1_8x32x1_1x32x1x8_8_1x1_intrawave_v3,706.74,316.33,0.0
gfx942,304,3904,4096,5120,ck,0,0,224.2201,a8w8_blockscale_1x128x128_256x128x128x128_16x16_32x32_2x2_8x32x1_8x32x1_1x32x1x8_8_1x1_intrawave_v3,730.29,325.31,0.0
gfx942,304,3968,4096,5120,ck,0,0,225.2951,a8w8_blockscale_1x128x128_256x128x128x128_16x16_32x32_2x2_8x32x1_8x32x1_1x32x1x8_8_1x1_intrawave_v3,738.72,327.54,0.0
gfx942,304,4032,4096,5120,ck,0,0,223.3146,a8w8_blockscale_1x128x128_256x128x128x128_16x16_32x32_2x2_8x32x1_8x32x1_1x32x1x8_8_1x1_intrawave_v3,757.29,334.26,0.0
gfx942,304,4096,4096,5120,ck,0,0,230.6128,a8w8_blockscale_1x128x128_256x128x128x128_16x16_32x32_2x2_8x32x1_8x32x1_1x32x1x8_8_1x1_intrawave_v3,744.97,327.38,0.0
gfx942,304,4224,4096,5120,ck,0,0,238.7862,a8w8_blockscale_1x128x128_256x128x128x128_16x16_32x32_2x2_8x32x1_8x32x1_1x32x1x8_8_1x1_intrawave_v3,741.95,323.31,0.0
gfx942,304,4352,4096,5120,ck,0,0,243.2712,a8w8_blockscale_1x128x128_256x128x128x128_16x16_32x32_2x2_8x32x1_8x32x1_1x32x1x8_8_1x1_intrawave_v3,750.34,324.35,0.0
gfx942,304,4480,4096,5120,ck,0,0,247.0767,a8w8_blockscale_1x128x128_256x128x128x128_16x16_32x32_2x2_8x32x1_8x32x1_1x32x1x8_8_1x1_intrawave_v3,760.51,326.25,0.0
gfx942,304,4608,4096,5120,ck,0,0,252.0322,a8w8_blockscale_1x128x128_256x128x128x128_16x16_32x32_2x2_8x32x1_8x32x1_1x32x1x8_8_1x1_intrawave_v3,766.86,326.6,0.0
gfx942,304,4736,4096,5120,ck,0,0,254.6296,a8w8_blockscale_1x128x128_256x128x128x128_16x16_32x32_2x2_8x32x1_8x32x1_1x32x1x8_8_1x1_intrawave_v3,780.12,329.96,0.0
gfx942,304,4864,4096,5120,ck,0,0,261.0742,a8w8_blockscale_1x128x128_256x128x128x128_16x16_32x32_2x2_8x32x1_8x32x1_1x32x1x8_8_1x1_intrawave_v3,781.43,328.34,0.0
gfx942,304,4992,4096,5120,ck,0,0,284.8566,a8w8_blockscale_1x128x128_256x128x128x128_16x16_32x32_2x2_8x32x1_8x32x1_1x32x1x8_8_1x1_intrawave_v3,735.04,306.91,0.0
gfx942,304,5120,4096,5120,ck,0,0,288.4812,a8w8_blockscale_1x128x128_256x128x128x128_16x16_32x32_2x2_8x32x1_8x32x1_1x32x1x8_8_1x1_intrawave_v3,744.41,308.96,0.0
gfx942,304,5248,4096,5120,ck,0,0,293.9224,a8w8_blockscale_1x128x128_256x128x128x128_16x16_32x32_2x2_8x32x1_8x32x1_1x32x1x8_8_1x1_intrawave_v3,748.9,309.04,0.0
gfx942,304,5376,4096,5120,ck,0,0,296.4492,a8w8_blockscale_1x128x128_256x128x128x128_16x16_32x32_2x2_8x32x1_8x32x1_1x32x1x8_8_1x1_intrawave_v3,760.62,312.15,0.0
gfx942,304,5504,4096,5120,ck,0,0,293.9753,a8w8_blockscale_1x128x128_256x128x128x128_16x16_32x32_2x2_8x32x1_8x32x1_1x32x1x8_8_1x1_intrawave_v3,785.29,320.57,0.0
gfx942,304,5632,4096,5120,ck,0,0,296.8144,a8w8_blockscale_1x128x128_256x128x128x128_16x16_32x32_2x2_8x32x1_8x32x1_1x32x1x8_8_1x1_intrawave_v3,795.86,323.25,0.0
gfx942,304,5760,4096,5120,ck,0,0,307.2248,a8w8_blockscale_1x128x128_256x128x128x128_16x16_32x32_2x2_8x32x1_8x32x1_1x32x1x8_8_1x1_intrawave_v3,786.37,317.84,0.0
gfx942,304,5888,4096,5120,ck,0,0,306.517,a8w8_blockscale_1x128x128_256x128x128x128_16x16_32x32_2x2_8x32x1_8x32x1_1x32x1x8_8_1x1_intrawave_v3,805.7,324.13,0.0
gfx942,304,6016,4096,5120,ck,0,0,313.2676,a8w8_blockscale_1x128x128_256x128x128x128_16x16_32x32_2x2_8x32x1_8x32x1_1x32x1x8_8_1x1_intrawave_v3,805.48,322.59,0.0
gfx942,304,6144,4096,5120,ck,0,0,340.2238,a8w8_blockscale_1x128x128_256x128x128x128_16x16_32x32_2x2_8x32x1_8x32x1_1x32x1x8_8_1x1_intrawave_v3,757.44,302.04,0.0
gfx942,304,6272,4096,5120,ck,0,0,347.6256,a8w8_blockscale_1x128x128_256x128x128x128_16x16_32x32_2x2_8x32x1_8x32x1_1x32x1x8_8_1x1_intrawave_v3,756.75,300.51,0.0
gfx942,304,6400,4096,5120,ck,0,0,344.9281,a8w8_blockscale_1x128x128_256x128x128x128_16x16_32x32_2x2_8x32x1_8x32x1_1x32x1x8_8_1x1_intrawave_v3,778.24,307.8,0.0
gfx942,304,6528,4096,5120,ck,0,0,347.9394,a8w8_blockscale_1x128x128_256x128x128x128_16x16_32x32_2x2_8x32x1_8x32x1_1x32x1x8_8_1x1_intrawave_v3,786.93,310.03,0.0
gfx942,304,6656,4096,5120,ck,0,0,353.0202,a8w8_blockscale_1x128x128_256x128x128x128_16x16_32x32_2x2_8x32x1_8x32x1_1x32x1x8_8_1x1_intrawave_v3,790.81,310.4,0.0
gfx942,304,6784,4096,5120,ck,0,0,359.5345,a8w8_blockscale_1x128x128_256x128x128x128_16x16_32x32_2x2_8x32x1_8x32x1_1x32x1x8_8_1x1_intrawave_v3,791.42,309.51,0.0
gfx942,304,6912,4096,5120,ck,0,0,360.7348,a8w8_blockscale_1x128x128_256x128x128x128_16x16_32x32_2x2_8x32x1_8x32x1_1x32x1x8_8_1x1_intrawave_v3,803.67,313.21,0.0
gfx942,304,7040,4096,5120,ck,0,0,368.777,a8w8_blockscale_1x128x128_256x128x128x128_16x16_32x32_2x2_8x32x1_8x32x1_1x32x1x8_8_1x1_intrawave_v3,800.7,311.0,0.0
gfx942,304,7168,4096,5120,ck,0,0,381.3759,a8w8_blockscale_1x128x128_256x128x128x128_16x16_32x32_2x2_8x32x1_8x32x1_1x32x1x8_8_1x1_intrawave_v3,788.32,305.19,0.0
gfx942,304,7296,4096,5120,ck,0,0,390.3402,a8w8_blockscale_1x128x128_256x128x128x128_16x16_32x32_2x2_8x32x1_8x32x1_1x32x1x8_8_1x1_intrawave_v3,783.97,302.55,0.0
gfx942,304,7424,4096,5120,ck,0,0,400.0519,a8w8_blockscale_1x128x128_256x128x128x128_16x16_32x32_2x2_8x32x1_8x32x1_1x32x1x8_8_1x1_intrawave_v3,778.36,299.46,0.0
gfx942,304,7552,4096,5120,ck,0,0,408.9589,a8w8_blockscale_1x128x128_256x128x128x128_16x16_32x32_2x2_8x32x1_8x32x1_1x32x1x8_8_1x1_intrawave_v3,774.54,297.11,0.0
gfx942,304,7680,4096,5120,ck,0,0,406.898,a8w8_blockscale_1x128x128_256x128x128x128_16x16_32x32_2x2_8x32x1_8x32x1_1x32x1x8_8_1x1_intrawave_v3,791.65,302.8,0.0
gfx942,304,7808,4096,5120,ck,0,0,421.2321,a8w8_blockscale_1x128x128_256x128x128x128_16x16_32x32_2x2_8x32x1_8x32x1_1x32x1x8_8_1x1_intrawave_v3,777.46,296.54,0.0
gfx942,304,7936,4096,5120,ck,0,0,422.2732,a8w8_blockscale_1x128x128_256x128x128x128_16x16_32x32_2x2_8x32x1_8x32x1_1x32x1x8_8_1x1_intrawave_v3,788.26,299.84,0.0
gfx942,304,8064,4096,5120,ck,0,0,417.6749,a8w8_blockscale_1x128x128_256x128x128x128_16x16_32x32_2x2_8x32x1_8x32x1_1x32x1x8_8_1x1_intrawave_v3,809.79,307.22,0.0
gfx942,304,8192,4096,5120,ck,0,0,423.9814,a8w8_blockscale_1x128x128_256x128x128x128_16x16_32x32_2x2_8x32x1_8x32x1_1x32x1x8_8_1x1_intrawave_v3,810.41,306.67,0.0
gfx942,304,8320,4096,5120,ck,0,0,441.7461,a8w8_blockscale_1x128x128_256x128x128x128_16x16_32x32_2x2_8x32x1_8x32x1_1x32x1x8_8_1x1_intrawave_v3,789.97,298.2,0.0
gfx942,304,8448,4096,5120,ck,0,0,447.4403,a8w8_blockscale_1x128x128_256x128x128x128_16x16_32x32_2x2_8x32x1_8x32x1_1x32x1x8_8_1x1_intrawave_v3,791.92,298.21,0.0
gfx942,304,8576,4096,5120,ck,0,0,459.8397,a8w8_blockscale_1x128x128_256x128x128x128_16x16_32x32_2x2_8x32x1_8x32x1_1x32x1x8_8_1x1_intrawave_v3,782.24,293.87,0.0
gfx942,304,8704,4096,5120,ck,0,0,463.5522,a8w8_blockscale_1x128x128_256x128x128x128_16x16_32x32_2x2_8x32x1_8x32x1_1x32x1x8_8_1x1_intrawave_v3,787.55,295.2,0.0
gfx942,304,8832,4096,5120,ck,0,0,467.5574,a8w8_blockscale_1x128x128_256x128x128x128_16x16_32x32_2x2_8x32x1_8x32x1_1x32x1x8_8_1x1_intrawave_v3,792.29,296.31,0.0
gfx942,304,8960,4096,5120,ck,0,0,474.5437,a8w8_blockscale_1x128x128_256x128x128x128_16x16_32x32_2x2_8x32x1_8x32x1_1x32x1x8_8_1x1_intrawave_v3,791.94,295.54,0.0
gfx942,304,9088,4096,5120,ck,0,0,480.8314,a8w8_blockscale_1x128x128_256x128x128x128_16x16_32x32_2x2_8x32x1_8x32x1_1x32x1x8_8_1x1_intrawave_v3,792.75,295.22,0.0
gfx942,304,9216,4096,5120,ck,0,0,483.7402,a8w8_blockscale_1x128x128_256x128x128x128_16x16_32x32_2x2_8x32x1_8x32x1_1x32x1x8_8_1x1_intrawave_v3,799.08,296.97,0.0
gfx942,304,9344,4096,5120,ck,0,0,493.6992,a8w8_blockscale_1x128x128_256x128x128x128_16x16_32x32_2x2_8x32x1_8x32x1_1x32x1x8_8_1x1_intrawave_v3,793.84,294.43,0.0
gfx942,304,9472,4096,5120,ck,0,0,498.4838,a8w8_blockscale_1x128x128_256x128x128x128_16x16_32x32_2x2_8x32x1_8x32x1_1x32x1x8_8_1x1_intrawave_v3,796.99,295.02,0.0
gfx942,304,9600,4096,5120,ck,0,0,496.0215,a8w8_blockscale_1x128x128_256x128x128x128_16x16_32x32_2x2_8x32x1_8x32x1_1x32x1x8_8_1x1_intrawave_v3,811.77,299.92,0.0
gfx942,304,9728,4096,5120,ck,0,0,516.8367,a8w8_blockscale_1x128x128_256x128x128x128_16x16_32x32_2x2_8x32x1_8x32x1_1x32x1x8_8_1x1_intrawave_v3,789.46,291.14,0.0
gfx942,304,9856,4096,5120,ck,0,0,527.8342,a8w8_blockscale_1x128x128_256x128x128x128_16x16_32x32_2x2_8x32x1_8x32x1_1x32x1x8_8_1x1_intrawave_v3,783.18,288.3,0.0
gfx942,304,9984,4096,5120,ck,0,0,529.6248,a8w8_blockscale_1x128x128_256x128x128x128_16x16_32x32_2x2_8x32x1_8x32x1_1x32x1x8_8_1x1_intrawave_v3,790.67,290.54,0.0
gfx942,304,10112,4096,5120,ck,0,0,528.2054,a8w8_blockscale_1x128x128_256x128x128x128_16x16_32x32_2x2_8x32x1_8x32x1_1x32x1x8_8_1x1_intrawave_v3,802.96,294.55,0.0
gfx942,304,10240,4096,5120,ck,0,0,538.9911,a8w8_blockscale_1x128x128_256x128x128x128_16x16_32x32_2x2_8x32x1_8x32x1_1x32x1x8_8_1x1_intrawave_v3,796.85,291.82,0.0
gfx942,304,10368,4096,5120,ck,0,0,545.3387,a8w8_blockscale_1x128x128_256x128x128x128_16x16_32x32_2x2_8x32x1_8x32x1_1x32x1x8_8_1x1_intrawave_v3,797.42,291.54,0.0
gfx942,304,10496,4096,5120,ck,0,0,549.9697,a8w8_blockscale_1x128x128_256x128x128x128_16x16_32x32_2x2_8x32x1_8x32x1_1x32x1x8_8_1x1_intrawave_v3,800.47,292.19,0.0
gfx942,304,10624,4096,5120,ck,0,0,547.4414,a8w8_blockscale_1x128x128_256x128x128x128_16x16_32x32_2x2_8x32x1_8x32x1_1x32x1x8_8_1x1_intrawave_v3,813.97,296.65,0.0
gfx942,304,10752,4096,5120,ck,0,0,554.9135,a8w8_blockscale_1x128x128_256x128x128x128_16x16_32x32_2x2_8x32x1_8x32x1_1x32x1x8_8_1x1_intrawave_v3,812.69,295.73,0.0
gfx942,304,10880,4096,5120,ck,0,0,576.4405,a8w8_blockscale_1x128x128_256x128x128x128_16x16_32x32_2x2_8x32x1_8x32x1_1x32x1x8_8_1x1_intrawave_v3,791.65,287.64,0.0
gfx942,304,11008,4096,5120,ck,0,0,584.6108,a8w8_blockscale_1x128x128_256x128x128x128_16x16_32x32_2x2_8x32x1_8x32x1_1x32x1x8_8_1x1_intrawave_v3,789.77,286.53,0.0
gfx942,304,11136,4096,5120,ck,0,0,578.6544,a8w8_blockscale_1x128x128_256x128x128x128_16x16_32x32_2x2_8x32x1_8x32x1_1x32x1x8_8_1x1_intrawave_v3,807.18,292.43,0.0
gfx942,304,11264,4096,5120,ck,0,0,596.737,a8w8_blockscale_1x128x128_256x128x128x128_16x16_32x32_2x2_8x32x1_8x32x1_1x32x1x8_8_1x1_intrawave_v3,791.72,286.42,0.0
gfx942,304,11392,4096,5120,ck,0,0,597.3735,a8w8_blockscale_1x128x128_256x128x128x128_16x16_32x32_2x2_8x32x1_8x32x1_1x32x1x8_8_1x1_intrawave_v3,799.86,288.97,0.0
gfx942,304,11520,4096,5120,ck,0,0,596.1529,a8w8_blockscale_1x128x128_256x128x128x128_16x16_32x32_2x2_8x32x1_8x32x1_1x32x1x8_8_1x1_intrawave_v3,810.5,292.42,0.0
gfx942,304,11648,4096,5120,ck,0,0,602.9427,a8w8_blockscale_1x128x128_256x128x128x128_16x16_32x32_2x2_8x32x1_8x32x1_1x32x1x8_8_1x1_intrawave_v3,810.28,291.95,0.0
gfx942,304,11776,4096,5120,ck,0,0,616.6729,a8w8_blockscale_1x128x128_256x128x128x128_16x16_32x32_2x2_8x32x1_8x32x1_1x32x1x8_8_1x1_intrawave_v3,800.95,288.21,0.0
gfx942,304,11904,4096,5120,ck,0,0,618.3171,a8w8_blockscale_1x128x128_256x128x128x128_16x16_32x32_2x2_8x32x1_8x32x1_1x32x1x8_8_1x1_intrawave_v3,807.5,290.2,0.0
gfx942,304,12032,4096,5120,ck,0,0,622.0705,a8w8_blockscale_1x128x128_256x128x128x128_16x16_32x32_2x2_8x32x1_8x32x1_1x32x1x8_8_1x1_intrawave_v3,811.26,291.19,0.0
gfx942,304,12160,4096,5120,ck,0,0,635.5965,a8w8_blockscale_1x128x128_256x128x128x128_16x16_32x32_2x2_8x32x1_8x32x1_1x32x1x8_8_1x1_intrawave_v3,802.44,287.68,0.0
gfx942,304,12288,4096,5120,ck,0,0,655.53,a8w8_blockscale_1x128x128_256x128x128x128_16x16_32x32_2x2_8x32x1_8x32x1_1x32x1x8_8_1x1_intrawave_v3,786.23,281.53,0.0
gfx942,304,12416,4096,5120,ck,0,0,651.729,a8w8_blockscale_1x128x128_256x128x128x128_16x16_32x32_2x2_8x32x1_8x32x1_1x32x1x8_8_1x1_intrawave_v3,799.05,285.78,0.0
gfx942,304,12544,4096,5120,ck,0,0,648.3513,a8w8_blockscale_1x128x128_256x128x128x128_16x16_32x32_2x2_8x32x1_8x32x1_1x32x1x8_8_1x1_intrawave_v3,811.49,289.9,0.0
gfx942,304,12672,4096,5120,ck,0,0,655.2663,a8w8_blockscale_1x128x128_256x128x128x128_16x16_32x32_2x2_8x32x1_8x32x1_1x32x1x8_8_1x1_intrawave_v3,811.12,289.44,0.0
gfx942,304,12800,4096,5120,ck,0,0,659.2406,a8w8_blockscale_1x128x128_256x128x128x128_16x16_32x32_2x2_8x32x1_8x32x1_1x32x1x8_8_1x1_intrawave_v3,814.38,290.28,0.0
gfx942,304,12928,4096,5120,ck,0,0,675.7683,a8w8_blockscale_1x128x128_256x128x128x128_16x16_32x32_2x2_8x32x1_8x32x1_1x32x1x8_8_1x1_intrawave_v3,802.4,285.7,0.0
gfx942,304,13056,4096,5120,ck,0,0,675.7248,a8w8_blockscale_1x128x128_256x128x128x128_16x16_32x32_2x2_8x32x1_8x32x1_1x32x1x8_8_1x1_intrawave_v3,810.4,288.24,0.0
gfx942,304,13184,4096,5120,ck,0,0,688.9585,a8w8_blockscale_1x128x128_256x128x128x128_16x16_32x32_2x2_8x32x1_8x32x1_1x32x1x8_8_1x1_intrawave_v3,802.63,285.18,0.0
gfx942,304,13312,4096,5120,ck,0,0,693.0482,a8w8_blockscale_1x128x128_256x128x128x128_16x16_32x32_2x2_8x32x1_8x32x1_1x32x1x8_8_1x1_intrawave_v3,805.64,285.96,0.0
gfx942,304,13440,4096,5120,ck,0,0,717.0087,a8w8_blockscale_1x128x128_256x128x128x128_16x16_32x32_2x2_8x32x1_8x32x1_1x32x1x8_8_1x1_intrawave_v3,786.2,278.78,0.0
gfx942,304,13568,4096,5120,ck,0,0,709.2918,a8w8_blockscale_1x128x128_256x128x128x128_16x16_32x32_2x2_8x32x1_8x32x1_1x32x1x8_8_1x1_intrawave_v3,802.33,284.21,0.0
gfx942,304,13696,4096,5120,ck,0,0,714.0705,a8w8_blockscale_1x128x128_256x128x128x128_16x16_32x32_2x2_8x32x1_8x32x1_1x32x1x8_8_1x1_intrawave_v3,804.48,284.7,0.0
gfx942,304,13824,4096,5120,ck,0,0,708.4583,a8w8_blockscale_1x128x128_256x128x128x128_16x16_32x32_2x2_8x32x1_8x32x1_1x32x1x8_8_1x1_intrawave_v3,818.43,289.36,0.0
gfx942,304,13952,4096,5120,ck,0,0,720.6841,a8w8_blockscale_1x128x128_256x128x128x128_16x16_32x32_2x2_8x32x1_8x32x1_1x32x1x8_8_1x1_intrawave_v3,811.99,286.81,0.0
gfx942,304,14080,4096,5120,ck,0,0,722.0869,a8w8_blockscale_1x128x128_256x128x128x128_16x16_32x32_2x2_8x32x1_8x32x1_1x32x1x8_8_1x1_intrawave_v3,817.85,288.61,0.0
gfx942,304,14208,4096,5120,ck,0,0,731.5548,a8w8_blockscale_1x128x128_256x128x128x128_16x16_32x32_2x2_8x32x1_8x32x1_1x32x1x8_8_1x1_intrawave_v3,814.6,287.21,0.0
gfx942,304,14336,4096,5120,ck,0,0,741.6521,a8w8_blockscale_1x128x128_256x128x128x128_16x16_32x32_2x2_8x32x1_8x32x1_1x32x1x8_8_1x1_intrawave_v3,810.75,285.6,0.0
gfx942,304,14464,4096,5120,ck,0,0,762.7274,a8w8_blockscale_1x128x128_256x128x128x128_16x16_32x32_2x2_8x32x1_8x32x1_1x32x1x8_8_1x1_intrawave_v3,795.39,279.94,0.0
gfx942,304,14592,4096,5120,ck,0,0,761.1603,a8w8_blockscale_1x128x128_256x128x128x128_16x16_32x32_2x2_8x32x1_8x32x1_1x32x1x8_8_1x1_intrawave_v3,804.08,282.75,0.0
gfx942,304,14720,4096,5120,ck,0,0,766.1201,a8w8_blockscale_1x128x128_256x128x128x128_16x16_32x32_2x2_8x32x1_8x32x1_1x32x1x8_8_1x1_intrawave_v3,805.88,283.15,0.0
gfx942,304,14848,4096,5120,ck,0,0,761.1623,a8w8_blockscale_1x128x128_256x128x128x128_16x16_32x32_2x2_8x32x1_8x32x1_1x32x1x8_8_1x1_intrawave_v3,818.18,287.23,0.0
gfx942,304,14976,4096,5120,ck,0,0,780.3847,a8w8_blockscale_1x128x128_256x128x128x128_16x16_32x32_2x2_8x32x1_8x32x1_1x32x1x8_8_1x1_intrawave_v3,804.91,282.34,0.0
gfx942,304,15104,4096,5120,ck,0,0,776.4833,a8w8_blockscale_1x128x128_256x128x128x128_16x16_32x32_2x2_8x32x1_8x32x1_1x32x1x8_8_1x1_intrawave_v3,815.87,285.95,0.0
gfx942,304,15232,4096,5120,ck,0,0,782.1532,a8w8_blockscale_1x128x128_256x128x128x128_16x16_32x32_2x2_8x32x1_8x32x1_1x32x1x8_8_1x1_intrawave_v3,816.82,286.06,0.0
gfx942,304,15360,4096,5120,ck,0,0,783.0667,a8w8_blockscale_1x128x128_256x128x128x128_16x16_32x32_2x2_8x32x1_8x32x1_1x32x1x8_8_1x1_intrawave_v3,822.72,287.9,0.0
gfx942,304,15488,4096,5120,ck,0,0,800.781,a8w8_blockscale_1x128x128_256x128x128x128_16x16_32x32_2x2_8x32x1_8x32x1_1x32x1x8_8_1x1_intrawave_v3,811.23,283.66,0.0
gfx942,304,15616,4096,5120,ck,0,0,817.9553,a8w8_blockscale_1x128x128_256x128x128x128_16x16_32x32_2x2_8x32x1_8x32x1_1x32x1x8_8_1x1_intrawave_v3,800.76,279.79,0.0
gfx942,304,15744,4096,5120,ck,0,0,813.9958,a8w8_blockscale_1x128x128_256x128x128x128_16x16_32x32_2x2_8x32x1_8x32x1_1x32x1x8_8_1x1_intrawave_v3,811.25,283.24,0.0
gfx942,304,15872,4096,5120,ck,0,0,815.3389,a8w8_blockscale_1x128x128_256x128x128x128_16x16_32x32_2x2_8x32x1_8x32x1_1x32x1x8_8_1x1_intrawave_v3,816.49,284.86,0.0
gfx942,304,16000,4096,5120,ck,0,0,841.6509,a8w8_blockscale_1x128x128_256x128x128x128_16x16_32x32_2x2_8x32x1_8x32x1_1x32x1x8_8_1x1_intrawave_v3,797.35,277.98,0.0
gfx942,304,16128,4096,5120,ck,0,0,833.8376,a8w8_blockscale_1x128x128_256x128x128x128_16x16_32x32_2x2_8x32x1_8x32x1_1x32x1x8_8_1x1_intrawave_v3,811.26,282.63,0.0
gfx942,304,16256,4096,5120,ck,0,0,842.1344,a8w8_blockscale_1x128x128_256x128x128x128_16x16_32x32_2x2_8x32x1_8x32x1_1x32x1x8_8_1x1_intrawave_v3,809.64,281.87,0.0
gfx942,304,16384,4096,5120,ck,0,0,841.4181,a8w8_blockscale_1x128x128_256x128x128x128_16x16_32x32_2x2_8x32x1_8x32x1_1x32x1x8_8_1x1_intrawave_v3,816.71,284.13,0.0
gfx942,304,16512,4096,5120,ck,0,0,856.2138,a8w8_blockscale_1x128x128_256x128x128x128_16x16_32x32_2x2_8x32x1_8x32x1_1x32x1x8_8_1x1_intrawave_v3,808.87,281.21,0.0
gfx942,304,16640,4096,5120,ck,0,0,862.6422,a8w8_blockscale_1x128x128_256x128x128x128_16x16_32x32_2x2_8x32x1_8x32x1_1x32x1x8_8_1x1_intrawave_v3,809.06,281.09,0.0
gfx942,304,16768,4096,5120,ck,0,0,878.4837,a8w8_blockscale_1x128x128_256x128x128x128_16x16_32x32_2x2_8x32x1_8x32x1_1x32x1x8_8_1x1_intrawave_v3,800.59,277.96,0.0
gfx942,304,16896,4096,5120,ck,0,0,891.4539,a8w8_blockscale_1x128x128_256x128x128x128_16x16_32x32_2x2_8x32x1_8x32x1_1x32x1x8_8_1x1_intrawave_v3,794.96,275.83,0.0
gfx942,304,17024,4096,5120,ck,0,0,895.4635,a8w8_blockscale_1x128x128_256x128x128x128_16x16_32x32_2x2_8x32x1_8x32x1_1x32x1x8_8_1x1_intrawave_v3,797.4,276.5,0.0
gfx942,304,17152,4096,5120,ck,0,0,879.647,a8w8_blockscale_1x128x128_256x128x128x128_16x16_32x32_2x2_8x32x1_8x32x1_1x32x1x8_8_1x1_intrawave_v3,817.84,283.41,0.0
gfx942,304,17280,4096,5120,ck,0,0,889.91,a8w8_blockscale_1x128x128_256x128x128x128_16x16_32x32_2x2_8x32x1_8x32x1_1x32x1x8_8_1x1_intrawave_v3,814.44,282.05,0.0
gfx942,304,17408,4096,5120,ck,0,0,902.0732,a8w8_blockscale_1x128x128_256x128x128x128_16x16_32x32_2x2_8x32x1_8x32x1_1x32x1x8_8_1x1_intrawave_v3,809.41,280.14,0.0
gfx942,304,17536,4096,5120,ck,0,0,902.3847,a8w8_blockscale_1x128x128_256x128x128x128_16x16_32x32_2x2_8x32x1_8x32x1_1x32x1x8_8_1x1_intrawave_v3,815.08,281.93,0.0
gfx942,304,17664,4096,5120,ck,0,0,915.0587,a8w8_blockscale_1x128x128_256x128x128x128_16x16_32x32_2x2_8x32x1_8x32x1_1x32x1x8_8_1x1_intrawave_v3,809.66,279.89,0.0
gfx942,304,17792,4096,5120,ck,0,0,905.9473,a8w8_blockscale_1x128x128_256x128x128x128_16x16_32x32_2x2_8x32x1_8x32x1_1x32x1x8_8_1x1_intrawave_v3,823.72,284.58,0.0
gfx942,304,17920,4096,5120,ck,0,0,916.3042,a8w8_blockscale_1x128x128_256x128x128x128_16x16_32x32_2x2_8x32x1_8x32x1_1x32x1x8_8_1x1_intrawave_v3,820.27,283.23,0.0
gfx942,304,18048,4096,5120,ck,0,0,939.3199,a8w8_blockscale_1x128x128_256x128x128x128_16x16_32x32_2x2_8x32x1_8x32x1_1x32x1x8_8_1x1_intrawave_v3,805.89,278.1,0.0
gfx942,304,18176,4096,5120,ck,0,0,941.2714,a8w8_blockscale_1x128x128_256x128x128x128_16x16_32x32_2x2_8x32x1_8x32x1_1x32x1x8_8_1x1_intrawave_v3,809.92,279.34,0.0
gfx942,304,18304,4096,5120,ck,0,0,953.1537,a8w8_blockscale_1x128x128_256x128x128x128_16x16_32x32_2x2_8x32x1_8x32x1_1x32x1x8_8_1x1_intrawave_v3,805.46,277.64,0.0
gfx942,304,18432,4096,5120,ck,0,0,952.0029,a8w8_blockscale_1x128x128_256x128x128x128_16x16_32x32_2x2_8x32x1_8x32x1_1x32x1x8_8_1x1_intrawave_v3,812.07,279.77,0.0
gfx942,304,18560,4096,5120,ck,0,0,962.2964,a8w8_blockscale_1x128x128_256x128x128x128_16x16_32x32_2x2_8x32x1_8x32x1_1x32x1x8_8_1x1_intrawave_v3,808.96,278.54,0.0
gfx942,304,18688,4096,5120,ck,0,0,954.1114,a8w8_blockscale_1x128x128_256x128x128x128_16x16_32x32_2x2_8x32x1_8x32x1_1x32x1x8_8_1x1_intrawave_v3,821.53,282.72,0.0
gfx942,304,18816,4096,5120,ck,0,0,978.6419,a8w8_blockscale_1x128x128_256x128x128x128_16x16_32x32_2x2_8x32x1_8x32x1_1x32x1x8_8_1x1_intrawave_v3,806.42,277.37,0.0
gfx942,304,18944,4096,5120,ck,0,0,982.1092,a8w8_blockscale_1x128x128_256x128x128x128_16x16_32x32_2x2_8x32x1_8x32x1_1x32x1x8_8_1x1_intrawave_v3,809.04,278.13,0.0
gfx942,304,19072,4096,5120,ck,0,0,997.4877,a8w8_blockscale_1x128x128_256x128x128x128_16x16_32x32_2x2_8x32x1_8x32x1_1x32x1x8_8_1x1_intrawave_v3,801.95,275.55,0.0
gfx942,304,19200,4096,5120,ck,0,0,998.3504,a8w8_blockscale_1x128x128_256x128x128x128_16x16_32x32_2x2_8x32x1_8x32x1_1x32x1x8_8_1x1_intrawave_v3,806.64,277.02,0.0
gfx942,304,19328,4096,5120,ck,0,0,1002.4868,a8w8_blockscale_1x128x128_256x128x128x128_16x16_32x32_2x2_8x32x1_8x32x1_1x32x1x8_8_1x1_intrawave_v3,808.66,277.58,0.0
gfx942,304,19456,4096,5120,ck,0,0,1008.7924,a8w8_blockscale_1x128x128_256x128x128x128_16x16_32x32_2x2_8x32x1_8x32x1_1x32x1x8_8_1x1_intrawave_v3,808.93,277.53,0.0
gfx942,304,19584,4096,5120,ck,0,0,1015.9704,a8w8_blockscale_1x128x128_256x128x128x128_16x16_32x32_2x2_8x32x1_8x32x1_1x32x1x8_8_1x1_intrawave_v3,808.5,277.25,0.0
gfx942,304,19712,4096,5120,ck,0,0,1011.7063,a8w8_blockscale_1x128x128_256x128x128x128_16x16_32x32_2x2_8x32x1_8x32x1_1x32x1x8_8_1x1_intrawave_v3,817.21,280.1,0.0
gfx942,304,19840,4096,5120,ck,0,0,1028.294,a8w8_blockscale_1x128x128_256x128x128x128_16x16_32x32_2x2_8x32x1_8x32x1_1x32x1x8_8_1x1_intrawave_v3,809.25,277.24,0.0
gfx942,304,19968,4096,5120,ck,0,0,1036.6902,a8w8_blockscale_1x128x128_256x128x128x128_16x16_32x32_2x2_8x32x1_8x32x1_1x32x1x8_8_1x1_intrawave_v3,807.88,276.64,0.0
gfx942,304,20096,4096,5120,ck,0,0,1054.7226,a8w8_blockscale_1x128x128_256x128x128x128_16x16_32x32_2x2_8x32x1_8x32x1_1x32x1x8_8_1x1_intrawave_v3,799.16,273.52,0.0
gfx942,304,20224,4096,5120,ck,0,0,1038.9905,a8w8_blockscale_1x128x128_256x128x128x128_16x16_32x32_2x2_8x32x1_8x32x1_1x32x1x8_8_1x1_intrawave_v3,816.42,279.3,0.0
gfx942,304,20352,4096,5120,ck,0,0,1048.4797,a8w8_blockscale_1x128x128_256x128x128x128_16x16_32x32_2x2_8x32x1_8x32x1_1x32x1x8_8_1x1_intrawave_v3,814.15,278.4,0.0
gfx942,304,20480,4096,5120,ck,0,0,1059.9067,a8w8_blockscale_1x128x128_256x128x128x128_16x16_32x32_2x2_8x32x1_8x32x1_1x32x1x8_8_1x1_intrawave_v3,810.44,277.01,0.0
gfx942,304,20608,4096,5120,ck,0,0,1077.4396,a8w8_blockscale_1x128x128_256x128x128x128_16x16_32x32_2x2_8x32x1_8x32x1_1x32x1x8_8_1x1_intrawave_v3,802.24,274.08,0.0
gfx942,304,20736,4096,5120,ck,0,0,1081.2941,a8w8_blockscale_1x128x128_256x128x128x128_16x16_32x32_2x2_8x32x1_8x32x1_1x32x1x8_8_1x1_intrawave_v3,804.34,274.68,0.0
gfx942,304,20864,4096,5120,ck,0,0,1084.2037,a8w8_blockscale_1x128x128_256x128x128x128_16x16_32x32_2x2_8x32x1_8x32x1_1x32x1x8_8_1x1_intrawave_v3,807.14,275.51,0.0
gfx942,304,20992,4096,5120,ck,0,0,1085.3348,a8w8_blockscale_1x128x128_256x128x128x128_16x16_32x32_2x2_8x32x1_8x32x1_1x32x1x8_8_1x1_intrawave_v3,811.24,276.8,0.0
gfx942,304,21120,4096,5120,ck,0,0,1101.8996,a8w8_blockscale_1x128x128_256x128x128x128_16x16_32x32_2x2_8x32x1_8x32x1_1x32x1x8_8_1x1_intrawave_v3,803.92,274.18,0.0
gfx942,304,21248,4096,5120,ck,0,0,1102.9386,a8w8_blockscale_1x128x128_256x128x128x128_16x16_32x32_2x2_8x32x1_8x32x1_1x32x1x8_8_1x1_intrawave_v3,808.03,275.47,0.0
gfx942,304,21376,4096,5120,ck,0,0,1091.9651,a8w8_blockscale_1x128x128_256x128x128x128_16x16_32x32_2x2_8x32x1_8x32x1_1x32x1x8_8_1x1_intrawave_v3,821.07,279.8,0.0
gfx942,304,21504,4096,5120,ck,0,0,1115.305,a8w8_blockscale_1x128x128_256x128x128x128_16x16_32x32_2x2_8x32x1_8x32x1_1x32x1x8_8_1x1_intrawave_v3,808.7,275.47,0.0
gfx942,304,21632,4096,5120,ck,0,0,1130.3558,a8w8_blockscale_1x128x128_256x128x128x128_16x16_32x32_2x2_8x32x1_8x32x1_1x32x1x8_8_1x1_intrawave_v3,802.68,273.31,0.0
gfx942,304,21760,4096,5120,ck,0,0,1132.5148,a8w8_blockscale_1x128x128_256x128x128x128_16x16_32x32_2x2_8x32x1_8x32x1_1x32x1x8_8_1x1_intrawave_v3,805.89,274.29,0.0
gfx942,304,21888,4096,5120,ck,0,0,1134.0905,a8w8_blockscale_1x128x128_256x128x128x128_16x16_32x32_2x2_8x32x1_8x32x1_1x32x1x8_8_1x1_intrawave_v3,809.5,275.41,0.0
gfx942,304,22016,4096,5120,ck,0,0,1155.879,a8w8_blockscale_1x128x128_256x128x128x128_16x16_32x32_2x2_8x32x1_8x32x1_1x32x1x8_8_1x1_intrawave_v3,798.89,271.7,0.0
gfx942,304,22144,4096,5120,ck,0,0,1160.2245,a8w8_blockscale_1x128x128_256x128x128x128_16x16_32x32_2x2_8x32x1_8x32x1_1x32x1x8_8_1x1_intrawave_v3,800.52,272.15,0.0
gfx942,304,22272,4096,5120,ck,0,0,1141.1323,a8w8_blockscale_1x128x128_256x128x128x128_16x16_32x32_2x2_8x32x1_8x32x1_1x32x1x8_8_1x1_intrawave_v3,818.62,278.19,0.0
gfx942,304,22400,4096,5120,ck,0,0,1176.0942,a8w8_blockscale_1x128x128_256x128x128x128_16x16_32x32_2x2_8x32x1_8x32x1_1x32x1x8_8_1x1_intrawave_v3,798.85,271.37,0.0
gfx942,304,22528,4096,5120,ck,0,0,1170.6243,a8w8_blockscale_1x128x128_256x128x128x128_16x16_32x32_2x2_8x32x1_8x32x1_1x32x1x8_8_1x1_intrawave_v3,807.17,274.1,0.0
gfx942,304,22656,4096,5120,ck,0,0,1165.5098,a8w8_blockscale_1x128x128_256x128x128x128_16x16_32x32_2x2_8x32x1_8x32x1_1x32x1x8_8_1x1_intrawave_v3,815.32,276.76,0.0
gfx942,304,22784,4096,5120,ck,0,0,1168.0518,a8w8_blockscale_1x128x128_256x128x128x128_16x16_32x32_2x2_8x32x1_8x32x1_1x32x1x8_8_1x1_intrawave_v3,818.14,277.62,0.0
gfx942,304,22912,4096,5120,ck,0,0,1172.5941,a8w8_blockscale_1x128x128_256x128x128x128_16x16_32x32_2x2_8x32x1_8x32x1_1x32x1x8_8_1x1_intrawave_v3,819.55,278.0,0.0
gfx942,304,23040,4096,5120,ck,0,0,1180.9526,a8w8_blockscale_1x128x128_256x128x128x128_16x16_32x32_2x2_8x32x1_8x32x1_1x32x1x8_8_1x1_intrawave_v3,818.3,277.47,0.0
gfx942,304,23168,4096,5120,ck,0,0,1227.0827,a8w8_blockscale_1x128x128_256x128x128x128_16x16_32x32_2x2_8x32x1_8x32x1_1x32x1x8_8_1x1_intrawave_v3,791.91,268.43,0.0
gfx942,304,23296,4096,5120,ck,0,0,1194.2199,a8w8_blockscale_1x128x128_256x128x128x128_16x16_32x32_2x2_8x32x1_8x32x1_1x32x1x8_8_1x1_intrawave_v3,818.2,277.24,0.0
gfx942,304,23424,4096,5120,ck,0,0,1200.3885,a8w8_blockscale_1x128x128_256x128x128x128_16x16_32x32_2x2_8x32x1_8x32x1_1x32x1x8_8_1x1_intrawave_v3,818.46,277.24,0.0
gfx942,304,23552,4096,5120,ck,0,0,1212.1636,a8w8_blockscale_1x128x128_256x128x128x128_16x16_32x32_2x2_8x32x1_8x32x1_1x32x1x8_8_1x1_intrawave_v3,814.94,275.95,0.0
gfx942,304,23680,4096,5120,ck,0,0,1210.9664,a8w8_blockscale_1x128x128_256x128x128x128_16x16_32x32_2x2_8x32x1_8x32x1_1x32x1x8_8_1x1_intrawave_v3,820.18,277.63,0.0
gfx942,304,23808,4096,5120,ck,0,0,1233.2186,a8w8_blockscale_1x128x128_256x128x128x128_16x16_32x32_2x2_8x32x1_8x32x1_1x32x1x8_8_1x1_intrawave_v3,809.73,274.0,0.0
gfx942,304,23936,4096,5120,ck,0,0,1220.1914,a8w8_blockscale_1x128x128_256x128x128x128_16x16_32x32_2x2_8x32x1_8x32x1_1x32x1x8_8_1x1_intrawave_v3,822.78,278.32,0.0
gfx942,304,24064,4096,5120,ck,0,0,1254.7595,a8w8_blockscale_1x128x128_256x128x128x128_16x16_32x32_2x2_8x32x1_8x32x1_1x32x1x8_8_1x1_intrawave_v3,804.39,272.01,0.0
gfx942,304,24192,4096,5120,ck,0,0,1252.2858,a8w8_blockscale_1x128x128_256x128x128x128_16x16_32x32_2x2_8x32x1_8x32x1_1x32x1x8_8_1x1_intrawave_v3,810.27,273.91,0.0
gfx942,304,24320,4096,5120,ck,0,0,1241.1659,a8w8_blockscale_1x128x128_256x128x128x128_16x16_32x32_2x2_8x32x1_8x32x1_1x32x1x8_8_1x1_intrawave_v3,821.85,277.74,0.0
gfx942,304,24448,4096,5120,ck,0,0,1263.5255,a8w8_blockscale_1x128x128_256x128x128x128_16x16_32x32_2x2_8x32x1_8x32x1_1x32x1x8_8_1x1_intrawave_v3,811.56,274.17,0.0
gfx942,304,24576,4096,5120,ck,0,0,1285.7222,a8w8_blockscale_1x128x128_256x128x128x128_16x16_32x32_2x2_8x32x1_8x32x1_1x32x1x8_8_1x1_intrawave_v3,801.72,270.76,0.0
gfx942,304,24704,4096,5120,ck,0,0,1282.025,a8w8_blockscale_1x128x128_256x128x128x128_16x16_32x32_2x2_8x32x1_8x32x1_1x32x1x8_8_1x1_intrawave_v3,808.22,272.87,0.0
gfx942,304,24832,4096,5120,ck,0,0,1305.9991,a8w8_blockscale_1x128x128_256x128x128x128_16x16_32x32_2x2_8x32x1_8x32x1_1x32x1x8_8_1x1_intrawave_v3,797.5,269.17,0.0
gfx942,304,24960,4096,5120,ck,0,0,1300.6344,a8w8_blockscale_1x128x128_256x128x128x128_16x16_32x32_2x2_8x32x1_8x32x1_1x32x1x8_8_1x1_intrawave_v3,804.91,271.59,0.0
gfx942,304,25088,4096,5120,ck,0,0,1281.1861,a8w8_blockscale_1x128x128_256x128x128x128_16x16_32x32_2x2_8x32x1_8x32x1_1x32x1x8_8_1x1_intrawave_v3,821.32,277.04,0.0
gfx942,304,25216,4096,5120,ck,0,0,1293.3476,a8w8_blockscale_1x128x128_256x128x128x128_16x16_32x32_2x2_8x32x1_8x32x1_1x32x1x8_8_1x1_intrawave_v3,817.75,275.75,0.0
gfx942,304,25344,4096,5120,ck,0,0,1292.6108,a8w8_blockscale_1x128x128_256x128x128x128_16x16_32x32_2x2_8x32x1_8x32x1_1x32x1x8_8_1x1_intrawave_v3,822.37,277.23,0.0
gfx942,304,25472,4096,5120,ck,0,0,1302.2166,a8w8_blockscale_1x128x128_256x128x128x128_16x16_32x32_2x2_8x32x1_8x32x1_1x32x1x8_8_1x1_intrawave_v3,820.43,276.49,0.0
gfx942,304,25600,4096,5120,ck,0,0,1328.4943,a8w8_blockscale_1x128x128_256x128x128x128_16x16_32x32_2x2_8x32x1_8x32x1_1x32x1x8_8_1x1_intrawave_v3,808.24,272.31,0.0
gfx942,304,25728,4096,5120,ck,0,0,1314.1273,a8w8_blockscale_1x128x128_256x128x128x128_16x16_32x32_2x2_8x32x1_8x32x1_1x32x1x8_8_1x1_intrawave_v3,821.16,276.58,0.0
gfx942,304,25856,4096,5120,ck,0,0,1347.4776,a8w8_blockscale_1x128x128_256x128x128x128_16x16_32x32_2x2_8x32x1_8x32x1_1x32x1x8_8_1x1_intrawave_v3,804.82,271.0,0.0
gfx942,304,25984,4096,5120,ck,0,0,1332.9347,a8w8_blockscale_1x128x128_256x128x128x128_16x16_32x32_2x2_8x32x1_8x32x1_1x32x1x8_8_1x1_intrawave_v3,817.63,275.24,0.0
gfx942,304,26112,4096,5120,ck,0,0,1355.3692,a8w8_blockscale_1x128x128_256x128x128x128_16x16_32x32_2x2_8x32x1_8x32x1_1x32x1x8_8_1x1_intrawave_v3,808.06,271.94,0.0
gfx942,304,26240,4096,5120,ck,0,0,1375.8938,a8w8_blockscale_1x128x128_256x128x128x128_16x16_32x32_2x2_8x32x1_8x32x1_1x32x1x8_8_1x1_intrawave_v3,799.91,269.12,0.0
gfx942,304,26368,4096,5120,ck,0,0,1347.144,a8w8_blockscale_1x128x128_256x128x128x128_16x16_32x32_2x2_8x32x1_8x32x1_1x32x1x8_8_1x1_intrawave_v3,820.96,276.13,0.0
gfx942,304,26496,4096,5120,ck,0,0,1395.4206,a8w8_blockscale_1x128x128_256x128x128x128_16x16_32x32_2x2_8x32x1_8x32x1_1x32x1x8_8_1x1_intrawave_v3,796.41,267.79,0.0
gfx942,304,26624,4096,5120,ck,0,0,1358.9637,a8w8_blockscale_1x128x128_256x128x128x128_16x16_32x32_2x2_8x32x1_8x32x1_1x32x1x8_8_1x1_intrawave_v3,821.72,276.23,0.0
gfx942,304,26752,4096,5120,ck,0,0,1398.3479,a8w8_blockscale_1x128x128_256x128x128x128_16x16_32x32_2x2_8x32x1_8x32x1_1x32x1x8_8_1x1_intrawave_v3,802.42,269.67,0.0
gfx942,304,26880,4096,5120,ck,0,0,1402.5004,a8w8_blockscale_1x128x128_256x128x128x128_16x16_32x32_2x2_8x32x1_8x32x1_1x32x1x8_8_1x1_intrawave_v3,803.87,270.09,0.0
gfx942,304,27008,4096,5120,ck,0,0,1424.399,a8w8_blockscale_1x128x128_256x128x128x128_16x16_32x32_2x2_8x32x1_8x32x1_1x32x1x8_8_1x1_intrawave_v3,795.28,267.13,0.0
gfx942,304,27136,4096,5120,ck,0,0,1384.9028,a8w8_blockscale_1x128x128_256x128x128x128_16x16_32x32_2x2_8x32x1_8x32x1_1x32x1x8_8_1x1_intrawave_v3,821.84,275.98,0.0
gfx942,304,27264,4096,5120,ck,0,0,1414.2985,a8w8_blockscale_1x128x128_256x128x128x128_16x16_32x32_2x2_8x32x1_8x32x1_1x32x1x8_8_1x1_intrawave_v3,808.55,271.45,0.0
gfx942,304,27392,4096,5120,ck,0,0,1424.5839,a8w8_blockscale_1x128x128_256x128x128x128_16x16_32x32_2x2_8x32x1_8x32x1_1x32x1x8_8_1x1_intrawave_v3,806.48,270.69,0.0
gfx942,304,27520,4096,5120,ck,0,0,1442.3184,a8w8_blockscale_1x128x128_256x128x128x128_16x16_32x32_2x2_8x32x1_8x32x1_1x32x1x8_8_1x1_intrawave_v3,800.29,268.54,0.0
gfx942,304,27648,4096,5120,ck,0,0,1448.3428,a8w8_blockscale_1x128x128_256x128x128x128_16x16_32x32_2x2_8x32x1_8x32x1_1x32x1x8_8_1x1_intrawave_v3,800.67,268.6,0.0
gfx942,304,27776,4096,5120,ck,0,0,1449.3004,a8w8_blockscale_1x128x128_256x128x128x128_16x16_32x32_2x2_8x32x1_8x32x1_1x32x1x8_8_1x1_intrawave_v3,803.84,269.6,0.0
gfx942,304,27904,4096,5120,ck,0,0,1435.9413,a8w8_blockscale_1x128x128_256x128x128x128_16x16_32x32_2x2_8x32x1_8x32x1_1x32x1x8_8_1x1_intrawave_v3,815.06,273.29,0.0
gfx942,304,28032,4096,5120,ck,0,0,1430.3037,a8w8_blockscale_1x128x128_256x128x128x128_16x16_32x32_2x2_8x32x1_8x32x1_1x32x1x8_8_1x1_intrawave_v3,822.03,275.56,0.0
gfx942,304,28160,4096,5120,ck,0,0,1476.8796,a8w8_blockscale_1x128x128_256x128x128x128_16x16_32x32_2x2_8x32x1_8x32x1_1x32x1x8_8_1x1_intrawave_v3,799.74,268.02,0.0
gfx942,304,28288,4096,5120,ck,0,0,1452.0105,a8w8_blockscale_1x128x128_256x128x128x128_16x16_32x32_2x2_8x32x1_8x32x1_1x32x1x8_8_1x1_intrawave_v3,817.13,273.79,0.0
gfx942,304,28416,4096,5120,ck,0,0,1486.1668,a8w8_blockscale_1x128x128_256x128x128x128_16x16_32x32_2x2_8x32x1_8x32x1_1x32x1x8_8_1x1_intrawave_v3,801.96,268.64,0.0
gfx942,304,28544,4096,5120,ck,0,0,1463.4776,a8w8_blockscale_1x128x128_256x128x128x128_16x16_32x32_2x2_8x32x1_8x32x1_1x32x1x8_8_1x1_intrawave_v3,818.07,273.97,0.0
gfx942,304,28672,4096,5120,ck,0,0,1514.8517,a8w8_blockscale_1x128x128_256x128x128x128_16x16_32x32_2x2_8x32x1_8x32x1_1x32x1x8_8_1x1_intrawave_v3,793.87,265.8,0.0
gfx942,304,28800,4096,5120,ck,0,0,1507.1615,a8w8_blockscale_1x128x128_256x128x128x128_16x16_32x32_2x2_8x32x1_8x32x1_1x32x1x8_8_1x1_intrawave_v3,801.48,268.29,0.0
gfx942,304,28928,4096,5120,ck,0,0,1505.9204,a8w8_blockscale_1x128x128_256x128x128x128_16x16_32x32_2x2_8x32x1_8x32x1_1x32x1x8_8_1x1_intrawave_v3,805.71,269.64,0.0
gfx942,304,29056,4096,5120,ck,0,0,1506.9694,a8w8_blockscale_1x128x128_256x128x128x128_16x16_32x32_2x2_8x32x1_8x32x1_1x32x1x8_8_1x1_intrawave_v3,808.71,270.59,0.0
gfx942,304,29184,4096,5120,ck,0,0,1496.3631,a8w8_blockscale_1x128x128_256x128x128x128_16x16_32x32_2x2_8x32x1_8x32x1_1x32x1x8_8_1x1_intrawave_v3,818.03,273.64,0.0
gfx942,304,29312,4096,5120,ck,0,0,1524.9305,a8w8_blockscale_1x128x128_256x128x128x128_16x16_32x32_2x2_8x32x1_8x32x1_1x32x1x8_8_1x1_intrawave_v3,806.22,269.63,0.0
gfx942,304,29440,4096,5120,ck,0,0,1512.7062,a8w8_blockscale_1x128x128_256x128x128x128_16x16_32x32_2x2_8x32x1_8x32x1_1x32x1x8_8_1x1_intrawave_v3,816.29,272.94,0.0
gfx942,304,29568,4096,5120,ck,0,0,1557.0355,a8w8_blockscale_1x128x128_256x128x128x128_16x16_32x32_2x2_8x32x1_8x32x1_1x32x1x8_8_1x1_intrawave_v3,796.5,266.26,0.0
gfx942,304,29696,4096,5120,ck,0,0,1544.6772,a8w8_blockscale_1x128x128_256x128x128x128_16x16_32x32_2x2_8x32x1_8x32x1_1x32x1x8_8_1x1_intrawave_v3,806.34,269.5,0.0
gfx942,304,29824,4096,5120,ck,0,0,1563.022,a8w8_blockscale_1x128x128_256x128x128x128_16x16_32x32_2x2_8x32x1_8x32x1_1x32x1x8_8_1x1_intrawave_v3,800.31,267.42,0.0
gfx942,304,29952,4096,5120,ck,0,0,1562.4648,a8w8_blockscale_1x128x128_256x128x128x128_16x16_32x32_2x2_8x32x1_8x32x1_1x32x1x8_8_1x1_intrawave_v3,804.04,268.61,0.0
gfx942,304,30080,4096,5120,ck,0,0,1573.3466,a8w8_blockscale_1x128x128_256x128x128x128_16x16_32x32_2x2_8x32x1_8x32x1_1x32x1x8_8_1x1_intrawave_v3,801.89,267.83,0.0
gfx942,304,30208,4096,5120,ck,0,0,1567.7311,a8w8_blockscale_1x128x128_256x128x128x128_16x16_32x32_2x2_8x32x1_8x32x1_1x32x1x8_8_1x1_intrawave_v3,808.18,269.88,0.0
gfx942,304,30336,4096,5120,ck,0,0,1576.2585,a8w8_blockscale_1x128x128_256x128x128x128_16x16_32x32_2x2_8x32x1_8x32x1_1x32x1x8_8_1x1_intrawave_v3,807.22,269.5,0.0
gfx942,304,30464,4096,5120,ck,0,0,1607.2318,a8w8_blockscale_1x128x128_256x128x128x128_16x16_32x32_2x2_8x32x1_8x32x1_1x32x1x8_8_1x1_intrawave_v3,795.0,265.37,0.0
gfx942,304,30592,4096,5120,ck,0,0,1568.3185,a8w8_blockscale_1x128x128_256x128x128x128_16x16_32x32_2x2_8x32x1_8x32x1_1x32x1x8_8_1x1_intrawave_v3,818.15,273.04,0.0
gfx942,304,30720,4096,5120,ck,0,0,1573.0149,a8w8_blockscale_1x128x128_256x128x128x128_16x16_32x32_2x2_8x32x1_8x32x1_1x32x1x8_8_1x1_intrawave_v3,819.12,273.31,0.0
gfx942,304,30848,4096,5120,ck,0,0,1630.0152,a8w8_blockscale_1x128x128_256x128x128x128_16x16_32x32_2x2_8x32x1_8x32x1_1x32x1x8_8_1x1_intrawave_v3,793.77,264.8,0.0
gfx942,304,30976,4096,5120,ck,0,0,1610.7921,a8w8_blockscale_1x128x128_256x128x128x128_16x16_32x32_2x2_8x32x1_8x32x1_1x32x1x8_8_1x1_intrawave_v3,806.58,269.01,0.0
gfx942,304,31104,4096,5120,ck,0,0,1645.6251,a8w8_blockscale_1x128x128_256x128x128x128_16x16_32x32_2x2_8x32x1_8x32x1_1x32x1x8_8_1x1_intrawave_v3,792.77,264.35,0.0
gfx942,304,31232,4096,5120,ck,0,0,1602.5239,a8w8_blockscale_1x128x128_256x128x128x128_16x16_32x32_2x2_8x32x1_8x32x1_1x32x1x8_8_1x1_intrawave_v3,817.44,272.53,0.0
gfx942,304,31360,4096,5120,ck,0,0,1633.6716,a8w8_blockscale_1x128x128_256x128x128x128_16x16_32x32_2x2_8x32x1_8x32x1_1x32x1x8_8_1x1_intrawave_v3,805.14,268.37,0.0
gfx942,304,31488,4096,5120,ck,0,0,1638.9893,a8w8_blockscale_1x128x128_256x128x128x128_16x16_32x32_2x2_8x32x1_8x32x1_1x32x1x8_8_1x1_intrawave_v3,805.8,268.54,0.0
gfx942,304,31616,4096,5120,ck,0,0,1678.0364,a8w8_blockscale_1x128x128_256x128x128x128_16x16_32x32_2x2_8x32x1_8x32x1_1x32x1x8_8_1x1_intrawave_v3,790.25,263.31,0.0
gfx942,304,31744,4096,5120,ck,0,0,1658.0496,a8w8_blockscale_1x128x128_256x128x128x128_16x16_32x32_2x2_8x32x1_8x32x1_1x32x1x8_8_1x1_intrawave_v3,803.02,267.51,0.0
gfx942,304,31872,4096,5120,ck,0,0,1646.5425,a8w8_blockscale_1x128x128_256x128x128x128_16x16_32x32_2x2_8x32x1_8x32x1_1x32x1x8_8_1x1_intrawave_v3,811.89,270.42,0.0
gfx942,304,32000,4096,5120,ck,0,0,1644.9342,a8w8_blockscale_1x128x128_256x128x128x128_16x16_32x32_2x2_8x32x1_8x32x1_1x32x1x8_8_1x1_intrawave_v3,815.95,271.72,0.0
gfx942,304,32128,4096,5120,ck,0,0,1684.9064,a8w8_blockscale_1x128x128_256x128x128x128_16x16_32x32_2x2_8x32x1_8x32x1_1x32x1x8_8_1x1_intrawave_v3,799.77,266.28,0.0
gfx942,304,32256,4096,5120,ck,0,0,1678.6358,a8w8_blockscale_1x128x128_256x128x128x128_16x16_32x32_2x2_8x32x1_8x32x1_1x32x1x8_8_1x1_intrawave_v3,805.96,268.29,0.0
gfx942,304,32384,4096,5120,ck,0,0,1698.971,a8w8_blockscale_1x128x128_256x128x128x128_16x16_32x32_2x2_8x32x1_8x32x1_1x32x1x8_8_1x1_intrawave_v3,799.47,266.08,0.0
gfx942,304,32512,4096,5120,ck,0,0,1689.7666,a8w8_blockscale_1x128x128_256x128x128x128_16x16_32x32_2x2_8x32x1_8x32x1_1x32x1x8_8_1x1_intrawave_v3,807.01,268.54,0.0
gfx942,304,32640,4096,5120,ck,0,0,1710.1421,a8w8_blockscale_1x128x128_256x128x128x128_16x16_32x32_2x2_8x32x1_8x32x1_1x32x1x8_8_1x1_intrawave_v3,800.53,266.34,0.0
gfx942,304,32768,4096,5120,ck,0,0,1705.8542,a8w8_blockscale_1x128x128_256x128x128x128_16x16_32x32_2x2_8x32x1_8x32x1_1x32x1x8_8_1x1_intrawave_v3,805.69,268.01,0.0
gfx942,304,32896,4096,5120,ck,0,0,1701.9852,a8w8_blockscale_1x128x128_256x128x128x128_16x16_32x32_2x2_8x32x1_8x32x1_1x32x1x8_8_1x1_intrawave_v3,810.68,269.62,0.0
gfx942,304,33024,4096,5120,ck,0,0,1745.4187,a8w8_blockscale_1x128x128_256x128x128x128_16x16_32x32_2x2_8x32x1_8x32x1_1x32x1x8_8_1x1_intrawave_v3,793.58,263.88,0.0
gfx942,304,33152,4096,5120,ck,0,0,1701.5191,a8w8_blockscale_1x128x128_256x128x128x128_16x16_32x32_2x2_8x32x1_8x32x1_1x32x1x8_8_1x1_intrawave_v3,817.21,271.69,0.0
gfx942,304,33280,4096,5120,ck,0,0,1713.9604,a8w8_blockscale_1x128x128_256x128x128x128_16x16_32x32_2x2_8x32x1_8x32x1_1x32x1x8_8_1x1_intrawave_v3,814.41,270.72,0.0
gfx942,304,33408,4096,5120,ck,0,0,1765.9655,a8w8_blockscale_1x128x128_256x128x128x128_16x16_32x32_2x2_8x32x1_8x32x1_1x32x1x8_8_1x1_intrawave_v3,793.47,263.71,0.0
gfx942,304,33536,4096,5120,ck,0,0,1768.9197,a8w8_blockscale_1x128x128_256x128x128x128_16x16_32x32_2x2_8x32x1_8x32x1_1x32x1x8_8_1x1_intrawave_v3,795.18,264.23,0.0
gfx942,304,33664,4096,5120,ck,0,0,1761.1611,a8w8_blockscale_1x128x128_256x128x128x128_16x16_32x32_2x2_8x32x1_8x32x1_1x32x1x8_8_1x1_intrawave_v3,801.73,266.36,0.0
gfx942,304,33792,4096,5120,ck,0,0,1721.5875,a8w8_blockscale_1x128x128_256x128x128x128_16x16_32x32_2x2_8x32x1_8x32x1_1x32x1x8_8_1x1_intrawave_v3,823.27,273.47,0.0
gfx942,304,33920,4096,5120,ck,0,0,1746.4378,a8w8_blockscale_1x128x128_256x128x128x128_16x16_32x32_2x2_8x32x1_8x32x1_1x32x1x8_8_1x1_intrawave_v3,814.63,270.56,0.0
gfx942,304,34048,4096,5120,ck,0,0,1753.8347,a8w8_blockscale_1x128x128_256x128x128x128_16x16_32x32_2x2_8x32x1_8x32x1_1x32x1x8_8_1x1_intrawave_v3,814.26,270.39,0.0
gfx942,304,34176,4096,5120,ck,0,0,1774.5009,a8w8_blockscale_1x128x128_256x128x128x128_16x16_32x32_2x2_8x32x1_8x32x1_1x32x1x8_8_1x1_intrawave_v3,807.8,268.2,0.0
gfx942,304,34304,4096,5120,ck,0,0,1801.3502,a8w8_blockscale_1x128x128_256x128x128x128_16x16_32x32_2x2_8x32x1_8x32x1_1x32x1x8_8_1x1_intrawave_v3,798.74,265.15,0.0
gfx942,304,34432,4096,5120,ck,0,0,1797.0589,a8w8_blockscale_1x128x128_256x128x128x128_16x16_32x32_2x2_8x32x1_8x32x1_1x32x1x8_8_1x1_intrawave_v3,803.64,266.73,0.0
gfx942,304,34560,4096,5120,ck,0,0,1792.9894,a8w8_blockscale_1x128x128_256x128x128x128_16x16_32x32_2x2_8x32x1_8x32x1_1x32x1x8_8_1x1_intrawave_v3,808.46,268.29,0.0
gfx942,304,34688,4096,5120,ck,0,0,1830.2226,a8w8_blockscale_1x128x128_256x128x128x128_16x16_32x32_2x2_8x32x1_8x32x1_1x32x1x8_8_1x1_intrawave_v3,794.94,263.76,0.0
gfx942,304,34816,4096,5120,ck,0,0,1820.2012,a8w8_blockscale_1x128x128_256x128x128x128_16x16_32x32_2x2_8x32x1_8x32x1_1x32x1x8_8_1x1_intrawave_v3,802.27,266.15,0.0
gfx942,304,34944,4096,5120,ck,0,0,1845.6828,a8w8_blockscale_1x128x128_256x128x128x128_16x16_32x32_2x2_8x32x1_8x32x1_1x32x1x8_8_1x1_intrawave_v3,794.1,263.4,0.0
gfx942,304,35072,4096,5120,ck,0,0,1810.1011,a8w8_blockscale_1x128x128_256x128x128x128_16x16_32x32_2x2_8x32x1_8x32x1_1x32x1x8_8_1x1_intrawave_v3,812.68,269.52,0.0
gfx942,304,35200,4096,5120,ck,0,0,1848.4698,a8w8_blockscale_1x128x128_256x128x128x128_16x16_32x32_2x2_8x32x1_8x32x1_1x32x1x8_8_1x1_intrawave_v3,798.71,264.84,0.0
gfx942,304,35328,4096,5120,ck,0,0,1840.2425,a8w8_blockscale_1x128x128_256x128x128x128_16x16_32x32_2x2_8x32x1_8x32x1_1x32x1x8_8_1x1_intrawave_v3,805.2,266.95,0.0
gfx942,304,35456,4096,5120,ck,0,0,1868.462,a8w8_blockscale_1x128x128_256x128x128x128_16x16_32x32_2x2_8x32x1_8x32x1_1x32x1x8_8_1x1_intrawave_v3,795.91,263.83,0.0
gfx942,304,35584,4096,5120,ck,0,0,1867.3762,a8w8_blockscale_1x128x128_256x128x128x128_16x16_32x32_2x2_8x32x1_8x32x1_1x32x1x8_8_1x1_intrawave_v3,799.25,264.9,0.0
gfx942,304,35712,4096,5120,ck,0,0,1863.5069,a8w8_blockscale_1x128x128_256x128x128x128_16x16_32x32_2x2_8x32x1_8x32x1_1x32x1x8_8_1x1_intrawave_v3,803.79,266.36,0.0
gfx942,304,35840,4096,5120,ck,0,0,1883.2579,a8w8_blockscale_1x128x128_256x128x128x128_16x16_32x32_2x2_8x32x1_8x32x1_1x32x1x8_8_1x1_intrawave_v3,798.21,264.47,0.0
gfx942,304,35968,4096,5120,ck,0,0,1899.7412,a8w8_blockscale_1x128x128_256x128x128x128_16x16_32x32_2x2_8x32x1_8x32x1_1x32x1x8_8_1x1_intrawave_v3,794.11,263.08,0.0
gfx942,304,36096,4096,5120,ck,0,0,1888.3909,a8w8_blockscale_1x128x128_256x128x128x128_16x16_32x32_2x2_8x32x1_8x32x1_1x32x1x8_8_1x1_intrawave_v3,801.73,265.56,0.0
gfx942,304,36224,4096,5120,ck,0,0,1850.8144,a8w8_blockscale_1x128x128_256x128x128x128_16x16_32x32_2x2_8x32x1_8x32x1_1x32x1x8_8_1x1_intrawave_v3,820.91,271.87,0.0
gfx942,304,36352,4096,5120,ck,0,0,1862.5435,a8w8_blockscale_1x128x128_256x128x128x128_16x16_32x32_2x2_8x32x1_8x32x1_1x32x1x8_8_1x1_intrawave_v3,818.62,271.08,0.0
gfx942,304,36480,4096,5120,ck,0,0,1910.2037,a8w8_blockscale_1x128x128_256x128x128x128_16x16_32x32_2x2_8x32x1_8x32x1_1x32x1x8_8_1x1_intrawave_v3,801.0,265.2,0.0
gfx942,304,36608,4096,5120,ck,0,0,1884.9021,a8w8_blockscale_1x128x128_256x128x128x128_16x16_32x32_2x2_8x32x1_8x32x1_1x32x1x8_8_1x1_intrawave_v3,814.61,269.67,0.0
gfx942,304,36736,4096,5120,ck,0,0,1911.4304,a8w8_blockscale_1x128x128_256x128x128x128_16x16_32x32_2x2_8x32x1_8x32x1_1x32x1x8_8_1x1_intrawave_v3,806.11,266.82,0.0
gfx942,304,36864,4096,5120,ck,0,0,1893.3916,a8w8_blockscale_1x128x128_256x128x128x128_16x16_32x32_2x2_8x32x1_8x32x1_1x32x1x8_8_1x1_intrawave_v3,816.62,270.26,0.0
gfx942,304,36992,4096,5120,ck,0,0,1918.4318,a8w8_blockscale_1x128x128_256x128x128x128_16x16_32x32_2x2_8x32x1_8x32x1_1x32x1x8_8_1x1_intrawave_v3,808.76,267.62,0.0
gfx942,304,37120,4096,5120,ck,0,0,1942.0033,a8w8_blockscale_1x128x128_256x128x128x128_16x16_32x32_2x2_8x32x1_8x32x1_1x32x1x8_8_1x1_intrawave_v3,801.71,265.25,0.0
gfx942,304,37248,4096,5120,ck,0,0,1903.0071,a8w8_blockscale_1x128x128_256x128x128x128_16x16_32x32_2x2_8x32x1_8x32x1_1x32x1x8_8_1x1_intrawave_v3,820.96,271.58,0.0
gfx942,304,37376,4096,5120,ck,0,0,1914.293,a8w8_blockscale_1x128x128_256x128x128x128_16x16_32x32_2x2_8x32x1_8x32x1_1x32x1x8_8_1x1_intrawave_v3,818.93,270.87,0.0
gfx942,304,37504,4096,5120,ck,0,0,1932.7403,a8w8_blockscale_1x128x128_256x128x128x128_16x16_32x32_2x2_8x32x1_8x32x1_1x32x1x8_8_1x1_intrawave_v3,813.89,269.16,0.0
gfx942,304,37632,4096,5120,ck,0,0,1971.1079,a8w8_blockscale_1x128x128_256x128x128x128_16x16_32x32_2x2_8x32x1_8x32x1_1x32x1x8_8_1x1_intrawave_v3,800.77,264.79,0.0
gfx942,304,37760,4096,5120,ck,0,0,1958.9003,a8w8_blockscale_1x128x128_256x128x128x128_16x16_32x32_2x2_8x32x1_8x32x1_1x32x1x8_8_1x1_intrawave_v3,808.5,267.31,0.0
gfx942,304,37888,4096,5120,ck,0,0,1930.4696,a8w8_blockscale_1x128x128_256x128x128x128_16x16_32x32_2x2_8x32x1_8x32x1_1x32x1x8_8_1x1_intrawave_v3,823.19,272.13,0.0
gfx942,304,38016,4096,5120,ck,0,0,1998.4769,a8w8_blockscale_1x128x128_256x128x128x128_16x16_32x32_2x2_8x32x1_8x32x1_1x32x1x8_8_1x1_intrawave_v3,797.86,263.72,0.0
gfx942,304,38144,4096,5120,ck,0,0,1976.0369,a8w8_blockscale_1x128x128_256x128x128x128_16x16_32x32_2x2_8x32x1_8x32x1_1x32x1x8_8_1x1_intrawave_v3,809.64,267.58,0.0
gfx942,304,38272,4096,5120,ck,0,0,1979.5084,a8w8_blockscale_1x128x128_256x128x128x128_16x16_32x32_2x2_8x32x1_8x32x1_1x32x1x8_8_1x1_intrawave_v3,810.93,267.97,0.0
gfx942,304,38400,4096,5120,ck,0,0,1970.4137,a8w8_blockscale_1x128x128_256x128x128x128_16x16_32x32_2x2_8x32x1_8x32x1_1x32x1x8_8_1x1_intrawave_v3,817.4,270.07,0.0
gfx942,304,38528,4096,5120,ck,0,0,2025.96,a8w8_blockscale_1x128x128_256x128x128x128_16x16_32x32_2x2_8x32x1_8x32x1_1x32x1x8_8_1x1_intrawave_v3,797.64,263.51,0.0
gfx942,304,38656,4096,5120,ck,0,0,2004.2283,a8w8_blockscale_1x128x128_256x128x128x128_16x16_32x32_2x2_8x32x1_8x32x1_1x32x1x8_8_1x1_intrawave_v3,808.96,267.22,0.0
gfx942,304,38784,4096,5120,ck,0,0,2037.8091,a8w8_blockscale_1x128x128_256x128x128x128_16x16_32x32_2x2_8x32x1_8x32x1_1x32x1x8_8_1x1_intrawave_v3,798.27,263.65,0.0
gfx942,304,38912,4096,5120,ck,0,0,2025.6772,a8w8_blockscale_1x128x128_256x128x128x128_16x16_32x32_2x2_8x32x1_8x32x1_1x32x1x8_8_1x1_intrawave_v3,805.7,266.07,0.0
gfx942,304,39040,4096,5120,ck,0,0,2053.2975,a8w8_blockscale_1x128x128_256x128x128x128_16x16_32x32_2x2_8x32x1_8x32x1_1x32x1x8_8_1x1_intrawave_v3,797.48,263.32,0.0
gfx942,304,39168,4096,5120,ck,0,0,2033.7635,a8w8_blockscale_1x128x128_256x128x128x128_16x16_32x32_2x2_8x32x1_8x32x1_1x32x1x8_8_1x1_intrawave_v3,807.78,266.69,0.0
gfx942,304,39296,4096,5120,ck,0,0,2054.2679,a8w8_blockscale_1x128x128_256x128x128x128_16x16_32x32_2x2_8x32x1_8x32x1_1x32x1x8_8_1x1_intrawave_v3,802.33,264.85,0.0
gfx942,304,39424,4096,5120,ck,0,0,2070.6082,a8w8_blockscale_1x128x128_256x128x128x128_16x16_32x32_2x2_8x32x1_8x32x1_1x32x1x8_8_1x1_intrawave_v3,798.59,263.59,0.0
gfx942,304,39552,4096,5120,ck,0,0,2053.5345,a8w8_blockscale_1x128x128_256x128x128x128_16x16_32x32_2x2_8x32x1_8x32x1_1x32x1x8_8_1x1_intrawave_v3,807.84,266.61,0.0
gfx942,304,39680,4096,5120,ck,0,0,2083.204,a8w8_blockscale_1x128x128_256x128x128x128_16x16_32x32_2x2_8x32x1_8x32x1_1x32x1x8_8_1x1_intrawave_v3,798.91,263.63,0.0
gfx942,304,39808,4096,5120,ck,0,0,2079.7177,a8w8_blockscale_1x128x128_256x128x128x128_16x16_32x32_2x2_8x32x1_8x32x1_1x32x1x8_8_1x1_intrawave_v3,802.83,264.89,0.0
gfx942,304,39936,4096,5120,ck,0,0,2064.6607,a8w8_blockscale_1x128x128_256x128x128x128_16x16_32x32_2x2_8x32x1_8x32x1_1x32x1x8_8_1x1_intrawave_v3,811.29,267.65,0.0
gfx942,304,40064,4096,5120,ck,0,0,2087.5934,a8w8_blockscale_1x128x128_256x128x128x128_16x16_32x32_2x2_8x32x1_8x32x1_1x32x1x8_8_1x1_intrawave_v3,804.95,265.52,0.0
gfx942,304,40192,4096,5120,ck,0,0,2091.135,a8w8_blockscale_1x128x128_256x128x128x128_16x16_32x32_2x2_8x32x1_8x32x1_1x32x1x8_8_1x1_intrawave_v3,806.15,265.89,0.0
gfx942,304,40320,4096,5120,ck,0,0,2120.7545,a8w8_blockscale_1x128x128_256x128x128x128_16x16_32x32_2x2_8x32x1_8x32x1_1x32x1x8_8_1x1_intrawave_v3,797.43,262.98,0.0
gfx942,304,40448,4096,5120,ck,0,0,2112.9003,a8w8_blockscale_1x128x128_256x128x128x128_16x16_32x32_2x2_8x32x1_8x32x1_1x32x1x8_8_1x1_intrawave_v3,802.93,264.76,0.0
gfx942,304,40576,4096,5120,ck,0,0,2083.1479,a8w8_blockscale_1x128x128_256x128x128x128_16x16_32x32_2x2_8x32x1_8x32x1_1x32x1x8_8_1x1_intrawave_v3,816.98,269.36,0.0
gfx942,304,40704,4096,5120,ck,0,0,2154.1945,a8w8_blockscale_1x128x128_256x128x128x128_16x16_32x32_2x2_8x32x1_8x32x1_1x32x1x8_8_1x1_intrawave_v3,792.52,261.27,0.0
gfx942,304,40832,4096,5120,ck,0,0,2148.2494,a8w8_blockscale_1x128x128_256x128x128x128_16x16_32x32_2x2_8x32x1_8x32x1_1x32x1x8_8_1x1_intrawave_v3,797.22,262.78,0.0
gfx942,304,40960,4096,5120,ck,0,0,2146.3284,a8w8_blockscale_1x128x128_256x128x128x128_16x16_32x32_2x2_8x32x1_8x32x1_1x32x1x8_8_1x1_intrawave_v3,800.43,263.81,0.0
gfx942,304,41088,4096,5120,ck,0,0,2173.4619,a8w8_blockscale_1x128x128_256x128x128x128_16x16_32x32_2x2_8x32x1_8x32x1_1x32x1x8_8_1x1_intrawave_v3,792.91,261.3,0.0
gfx942,304,41216,4096,5120,ck,0,0,2161.1756,a8w8_blockscale_1x128x128_256x128x128x128_16x16_32x32_2x2_8x32x1_8x32x1_1x32x1x8_8_1x1_intrawave_v3,799.9,263.58,0.0
gfx942,304,41344,4096,5120,ck,0,0,2180.7518,a8w8_blockscale_1x128x128_256x128x128x128_16x16_32x32_2x2_8x32x1_8x32x1_1x32x1x8_8_1x1_intrawave_v3,795.18,261.99,0.0
gfx942,304,41472,4096,5120,ck,0,0,2156.1129,a8w8_blockscale_1x128x128_256x128x128x128_16x16_32x32_2x2_8x32x1_8x32x1_1x32x1x8_8_1x1_intrawave_v3,806.76,265.78,0.0
gfx942,304,41600,4096,5120,ck,0,0,2149.131,a8w8_blockscale_1x128x128_256x128x128x128_16x16_32x32_2x2_8x32x1_8x32x1_1x32x1x8_8_1x1_intrawave_v3,811.88,267.43,0.0
gfx942,304,41728,4096,5120,ck,0,0,2171.9171,a8w8_blockscale_1x128x128_256x128x128x128_16x16_32x32_2x2_8x32x1_8x32x1_1x32x1x8_8_1x1_intrawave_v3,805.83,265.41,0.0
gfx942,304,41856,4096,5120,ck,0,0,2201.9804,a8w8_blockscale_1x128x128_256x128x128x128_16x16_32x32_2x2_8x32x1_8x32x1_1x32x1x8_8_1x1_intrawave_v3,797.27,262.56,0.0
gfx942,304,41984,4096,5120,ck,0,0,2206.8557,a8w8_blockscale_1x128x128_256x128x128x128_16x16_32x32_2x2_8x32x1_8x32x1_1x32x1x8_8_1x1_intrawave_v3,797.94,262.76,0.0
gfx942,304,42112,4096,5120,ck,0,0,2220.8083,a8w8_blockscale_1x128x128_256x128x128x128_16x16_32x32_2x2_8x32x1_8x32x1_1x32x1x8_8_1x1_intrawave_v3,795.34,261.87,0.0
gfx942,304,42240,4096,5120,ck,0,0,2237.5531,a8w8_blockscale_1x128x128_256x128x128x128_16x16_32x32_2x2_8x32x1_8x32x1_1x32x1x8_8_1x1_intrawave_v3,791.79,260.67,0.0
gfx942,304,42368,4096,5120,ck,0,0,2243.5138,a8w8_blockscale_1x128x128_256x128x128x128_16x16_32x32_2x2_8x32x1_8x32x1_1x32x1x8_8_1x1_intrawave_v3,792.08,260.74,0.0
gfx942,304,42496,4096,5120,ck,0,0,2236.3129,a8w8_blockscale_1x128x128_256x128x128x128_16x16_32x32_2x2_8x32x1_8x32x1_1x32x1x8_8_1x1_intrawave_v3,797.03,262.34,0.0
gfx942,304,42624,4096,5120,ck,0,0,2203.692,a8w8_blockscale_1x128x128_256x128x128x128_16x16_32x32_2x2_8x32x1_8x32x1_1x32x1x8_8_1x1_intrawave_v3,811.27,267.0,0.0
gfx942,304,42752,4096,5120,ck,0,0,2259.3181,a8w8_blockscale_1x128x128_256x128x128x128_16x16_32x32_2x2_8x32x1_8x32x1_1x32x1x8_8_1x1_intrawave_v3,793.67,261.18,0.0
gfx942,304,42880,4096,5120,ck,0,0,2267.1392,a8w8_blockscale_1x128x128_256x128x128x128_16x16_32x32_2x2_8x32x1_8x32x1_1x32x1x8_8_1x1_intrawave_v3,793.3,261.03,0.0
gfx942,304,43008,4096,5120,ck,0,0,2240.3075,a8w8_blockscale_1x128x128_256x128x128x128_16x16_32x32_2x2_8x32x1_8x32x1_1x32x1x8_8_1x1_intrawave_v3,805.2,264.92,0.0
gfx942,304,43136,4096,5120,ck,0,0,2225.2334,a8w8_blockscale_1x128x128_256x128x128x128_16x16_32x32_2x2_8x32x1_8x32x1_1x32x1x8_8_1x1_intrawave_v3,813.06,267.48,0.0
gfx942,304,43264,4096,5120,ck,0,0,2288.5579,a8w8_blockscale_1x128x128_256x128x128x128_16x16_32x32_2x2_8x32x1_8x32x1_1x32x1x8_8_1x1_intrawave_v3,792.91,260.82,0.0
gfx942,304,43392,4096,5120,ck,0,0,2291.7858,a8w8_blockscale_1x128x128_256x128x128x128_16x16_32x32_2x2_8x32x1_8x32x1_1x32x1x8_8_1x1_intrawave_v3,794.14,261.2,0.0
gfx942,304,43520,4096,5120,ck,0,0,2293.4809,a8w8_blockscale_1x128x128_256x128x128x128_16x16_32x32_2x2_8x32x1_8x32x1_1x32x1x8_8_1x1_intrawave_v3,795.89,261.75,0.0
gfx942,304,43648,4096,5120,ck,0,0,2268.9291,a8w8_blockscale_1x128x128_256x128x128x128_16x16_32x32_2x2_8x32x1_8x32x1_1x32x1x8_8_1x1_intrawave_v3,806.87,265.33,0.0
gfx942,304,43776,4096,5120,ck,0,0,2290.272,a8w8_blockscale_1x128x128_256x128x128x128_16x16_32x32_2x2_8x32x1_8x32x1_1x32x1x8_8_1x1_intrawave_v3,801.69,263.6,0.0
gfx942,304,43904,4096,5120,ck,0,0,2274.9204,a8w8_blockscale_1x128x128_256x128x128x128_16x16_32x32_2x2_8x32x1_8x32x1_1x32x1x8_8_1x1_intrawave_v3,809.46,266.13,0.0
gfx942,304,44032,4096,5120,ck,0,0,2309.6551,a8w8_blockscale_1x128x128_256x128x128x128_16x16_32x32_2x2_8x32x1_8x32x1_1x32x1x8_8_1x1_intrawave_v3,799.62,262.86,0.0
gfx942,304,44160,4096,5120,ck,0,0,2349.7698,a8w8_blockscale_1x128x128_256x128x128x128_16x16_32x32_2x2_8x32x1_8x32x1_1x32x1x8_8_1x1_intrawave_v3,788.25,259.1,0.0
gfx942,304,44288,4096,5120,ck,0,0,2328.9152,a8w8_blockscale_1x128x128_256x128x128x128_16x16_32x32_2x2_8x32x1_8x32x1_1x32x1x8_8_1x1_intrawave_v3,797.61,262.15,0.0
gfx942,304,44416,4096,5120,ck,0,0,2329.4182,a8w8_blockscale_1x128x128_256x128x128x128_16x16_32x32_2x2_8x32x1_8x32x1_1x32x1x8_8_1x1_intrawave_v3,799.75,262.83,0.0
gfx942,304,44544,4096,5120,ck,0,0,2336.3087,a8w8_blockscale_1x128x128_256x128x128x128_16x16_32x32_2x2_8x32x1_8x32x1_1x32x1x8_8_1x1_intrawave_v3,799.68,262.78,0.0
gfx942,304,44672,4096,5120,ck,0,0,2355.7991,a8w8_blockscale_1x128x128_256x128x128x128_16x16_32x32_2x2_8x32x1_8x32x1_1x32x1x8_8_1x1_intrawave_v3,795.35,261.33,0.0
gfx942,304,44800,4096,5120,ck,0,0,2365.6686,a8w8_blockscale_1x128x128_256x128x128x128_16x16_32x32_2x2_8x32x1_8x32x1_1x32x1x8_8_1x1_intrawave_v3,794.3,260.96,0.0
gfx942,304,44928,4096,5120,ck,0,0,2327.4611,a8w8_blockscale_1x128x128_256x128x128x128_16x16_32x32_2x2_8x32x1_8x32x1_1x32x1x8_8_1x1_intrawave_v3,809.64,265.98,0.0
gfx942,304,45056,4096,5120,ck,0,0,2340.9132,a8w8_blockscale_1x128x128_256x128x128x128_16x16_32x32_2x2_8x32x1_8x32x1_1x32x1x8_8_1x1_intrawave_v3,807.29,265.18,0.0
gfx942,304,45184,4096,5120,ck,0,0,2386.5828,a8w8_blockscale_1x128x128_256x128x128x128_16x16_32x32_2x2_8x32x1_8x32x1_1x32x1x8_8_1x1_intrawave_v3,794.09,260.82,0.0
gfx942,304,45312,4096,5120,ck,0,0,2411.2464,a8w8_blockscale_1x128x128_256x128x128x128_16x16_32x32_2x2_8x32x1_8x32x1_1x32x1x8_8_1x1_intrawave_v3,788.19,258.86,0.0
gfx942,304,45440,4096,5120,ck,0,0,2390.7461,a8w8_blockscale_1x128x128_256x128x128x128_16x16_32x32_2x2_8x32x1_8x32x1_1x32x1x8_8_1x1_intrawave_v3,797.2,261.79,0.0
gfx942,304,45568,4096,5120,ck,0,0,2372.7759,a8w8_blockscale_1x128x128_256x128x128x128_16x16_32x32_2x2_8x32x1_8x32x1_1x32x1x8_8_1x1_intrawave_v3,805.5,264.49,0.0
gfx942,304,45696,4096,5120,ck,0,0,2434.4533,a8w8_blockscale_1x128x128_256x128x128x128_16x16_32x32_2x2_8x32x1_8x32x1_1x32x1x8_8_1x1_intrawave_v3,787.29,258.49,0.0
gfx942,304,45824,4096,5120,ck,0,0,2434.9097,a8w8_blockscale_1x128x128_256x128x128x128_16x16_32x32_2x2_8x32x1_8x32x1_1x32x1x8_8_1x1_intrawave_v3,789.35,259.14,0.0
gfx942,304,45952,4096,5120,ck,0,0,2430.9224,a8w8_blockscale_1x128x128_256x128x128x128_16x16_32x32_2x2_8x32x1_8x32x1_1x32x1x8_8_1x1_intrawave_v3,792.85,260.27,0.0
gfx942,304,46080,4096,5120,ck,0,0,2419.2084,a8w8_blockscale_1x128x128_256x128x128x128_16x16_32x32_2x2_8x32x1_8x32x1_1x32x1x8_8_1x1_intrawave_v3,798.91,262.23,0.0
gfx942,304,46208,4096,5120,ck,0,0,2399.076,a8w8_blockscale_1x128x128_256x128x128x128_16x16_32x32_2x2_8x32x1_8x32x1_1x32x1x8_8_1x1_intrawave_v3,807.85,265.14,0.0
gfx942,304,46336,4096,5120,ck,0,0,2434.2764,a8w8_blockscale_1x128x128_256x128x128x128_16x16_32x32_2x2_8x32x1_8x32x1_1x32x1x8_8_1x1_intrawave_v3,798.38,262.01,0.0
gfx942,304,46464,4096,5120,ck,0,0,2418.2186,a8w8_blockscale_1x128x128_256x128x128x128_16x16_32x32_2x2_8x32x1_8x32x1_1x32x1x8_8_1x1_intrawave_v3,805.9,264.45,0.0
gfx942,304,46592,4096,5120,ck,0,0,2497.4136,a8w8_blockscale_1x128x128_256x128x128x128_16x16_32x32_2x2_8x32x1_8x32x1_1x32x1x8_8_1x1_intrawave_v3,782.49,256.75,0.0
gfx942,304,46720,4096,5120,ck,0,0,2447.2739,a8w8_blockscale_1x128x128_256x128x128x128_16x16_32x32_2x2_8x32x1_8x32x1_1x32x1x8_8_1x1_intrawave_v3,800.72,262.7,0.0
gfx942,304,46848,4096,5120,ck,0,0,2473.5249,a8w8_blockscale_1x128x128_256x128x128x128_16x16_32x32_2x2_8x32x1_8x32x1_1x32x1x8_8_1x1_intrawave_v3,794.39,260.6,0.0
gfx942,304,46976,4096,5120,ck,0,0,2465.1482,a8w8_blockscale_1x128x128_256x128x128x128_16x16_32x32_2x2_8x32x1_8x32x1_1x32x1x8_8_1x1_intrawave_v3,799.27,262.18,0.0
gfx942,304,47104,4096,5120,ck,0,0,2468.9947,a8w8_blockscale_1x128x128_256x128x128x128_16x16_32x32_2x2_8x32x1_8x32x1_1x32x1x8_8_1x1_intrawave_v3,800.2,262.46,0.0
gfx942,304,47232,4096,5120,ck,0,0,2534.5094,a8w8_blockscale_1x128x128_256x128x128x128_16x16_32x32_2x2_8x32x1_8x32x1_1x32x1x8_8_1x1_intrawave_v3,781.63,256.35,0.0
gfx942,304,47360,4096,5120,ck,0,0,2505.0776,a8w8_blockscale_1x128x128_256x128x128x128_16x16_32x32_2x2_8x32x1_8x32x1_1x32x1x8_8_1x1_intrawave_v3,792.96,260.04,0.0
gfx942,304,47488,4096,5120,ck,0,0,2512.1905,a8w8_blockscale_1x128x128_256x128x128x128_16x16_32x32_2x2_8x32x1_8x32x1_1x32x1x8_8_1x1_intrawave_v3,792.85,259.98,0.0
gfx942,304,47616,4096,5120,ck,0,0,2551.9198,a8w8_blockscale_1x128x128_256x128x128x128_16x16_32x32_2x2_8x32x1_8x32x1_1x32x1x8_8_1x1_intrawave_v3,782.61,256.61,0.0
gfx942,304,47744,4096,5120,ck,0,0,2562.1479,a8w8_blockscale_1x128x128_256x128x128x128_16x16_32x32_2x2_8x32x1_8x32x1_1x32x1x8_8_1x1_intrawave_v3,781.58,256.25,0.0
gfx942,304,47872,4096,5120,ck,0,0,2562.8374,a8w8_blockscale_1x128x128_256x128x128x128_16x16_32x32_2x2_8x32x1_8x32x1_1x32x1x8_8_1x1_intrawave_v3,783.47,256.84,0.0
gfx942,304,48000,4096,5120,ck,0,0,2550.7828,a8w8_blockscale_1x128x128_256x128x128x128_16x16_32x32_2x2_8x32x1_8x32x1_1x32x1x8_8_1x1_intrawave_v3,789.27,258.72,0.0
gfx942,304,48128,4096,5120,ck,0,0,2537.8724,a8w8_blockscale_1x128x128_256x128x128x128_16x16_32x32_2x2_8x32x1_8x32x1_1x32x1x8_8_1x1_intrawave_v3,795.4,260.71,0.0
gfx942,304,48256,4096,5120,ck,0,0,2550.4828,a8w8_blockscale_1x128x128_256x128x128x128_16x16_32x32_2x2_8x32x1_8x32x1_1x32x1x8_8_1x1_intrawave_v3,793.58,260.09,0.0
gfx942,304,48384,4096,5120,ck,0,0,2574.8576,a8w8_blockscale_1x128x128_256x128x128x128_16x16_32x32_2x2_8x32x1_8x32x1_1x32x1x8_8_1x1_intrawave_v3,788.15,258.29,0.0
gfx942,304,48512,4096,5120,ck,0,0,2563.9742,a8w8_blockscale_1x128x128_256x128x128x128_16x16_32x32_2x2_8x32x1_8x32x1_1x32x1x8_8_1x1_intrawave_v3,793.59,260.05,0.0
gfx942,304,48640,4096,5120,ck,0,0,2575.4168,a8w8_blockscale_1x128x128_256x128x128x128_16x16_32x32_2x2_8x32x1_8x32x1_1x32x1x8_8_1x1_intrawave_v3,792.15,259.56,0.0
gfx942,304,48768,4096,5120,ck,0,0,2578.6692,a8w8_blockscale_1x128x128_256x128x128x128_16x16_32x32_2x2_8x32x1_8x32x1_1x32x1x8_8_1x1_intrawave_v3,793.23,259.89,0.0
gfx942,304,48896,4096,5120,ck,0,0,2583.3174,a8w8_blockscale_1x128x128_256x128x128x128_16x16_32x32_2x2_8x32x1_8x32x1_1x32x1x8_8_1x1_intrawave_v3,793.88,260.08,0.0
gfx942,304,49024,4096,5120,ck,0,0,2518.753,a8w8_blockscale_1x128x128_256x128x128x128_16x16_32x32_2x2_8x32x1_8x32x1_1x32x1x8_8_1x1_intrawave_v3,816.36,267.43,0.0
gfx942,304,49152,4096,5120,ck,0,0,2620.0784,a8w8_blockscale_1x128x128_256x128x128x128_16x16_32x32_2x2_8x32x1_8x32x1_1x32x1x8_8_1x1_intrawave_v3,786.84,257.73,0.0
gfx942,304,49280,4096,5120,ck,0,0,2587.8573,a8w8_blockscale_1x128x128_256x128x128x128_16x16_32x32_2x2_8x32x1_8x32x1_1x32x1x8_8_1x1_intrawave_v3,798.71,261.6,0.0
gfx942,304,49408,4096,5120,ck,0,0,2547.7511,a8w8_blockscale_1x128x128_256x128x128x128_16x16_32x32_2x2_8x32x1_8x32x1_1x32x1x8_8_1x1_intrawave_v3,813.39,266.39,0.0
gfx942,304,49536,4096,5120,ck,0,0,2599.3883,a8w8_blockscale_1x128x128_256x128x128x128_16x16_32x32_2x2_8x32x1_8x32x1_1x32x1x8_8_1x1_intrawave_v3,799.3,261.75,0.0
gfx942,304,49664,4096,5120,ck,0,0,2601.9029,a8w8_blockscale_1x128x128_256x128x128x128_16x16_32x32_2x2_8x32x1_8x32x1_1x32x1x8_8_1x1_intrawave_v3,800.59,262.15,0.0
gfx942,304,49792,4096,5120,ck,0,0,2613.0889,a8w8_blockscale_1x128x128_256x128x128x128_16x16_32x32_2x2_8x32x1_8x32x1_1x32x1x8_8_1x1_intrawave_v3,799.22,261.68,0.0
gfx942,304,49920,4096,5120,ck,0,0,2635.2558,a8w8_blockscale_1x128x128_256x128x128x128_16x16_32x32_2x2_8x32x1_8x32x1_1x32x1x8_8_1x1_intrawave_v3,794.53,260.13,0.0
gfx942,304,50048,4096,5120,ck,0,0,2682.4694,a8w8_blockscale_1x128x128_256x128x128x128_16x16_32x32_2x2_8x32x1_8x32x1_1x32x1x8_8_1x1_intrawave_v3,782.55,256.19,0.0
gfx942,304,50176,4096,5120,ck,0,0,2661.7272,a8w8_blockscale_1x128x128_256x128x128x128_16x16_32x32_2x2_8x32x1_8x32x1_1x32x1x8_8_1x1_intrawave_v3,790.66,258.82,0.0
gfx942,304,50304,4096,5120,ck,0,0,2705.4302,a8w8_blockscale_1x128x128_256x128x128x128_16x16_32x32_2x2_8x32x1_8x32x1_1x32x1x8_8_1x1_intrawave_v3,779.88,255.27,0.0
gfx942,304,50432,4096,5120,ck,0,0,2718.2951,a8w8_blockscale_1x128x128_256x128x128x128_16x16_32x32_2x2_8x32x1_8x32x1_1x32x1x8_8_1x1_intrawave_v3,778.16,254.69,0.0
gfx942,304,50560,4096,5120,ck,0,0,2608.6567,a8w8_blockscale_1x128x128_256x128x128x128_16x16_32x32_2x2_8x32x1_8x32x1_1x32x1x8_8_1x1_intrawave_v3,812.92,266.05,0.0
gfx942,304,50688,4096,5120,ck,0,0,2671.4671,a8w8_blockscale_1x128x128_256x128x128x128_16x16_32x32_2x2_8x32x1_8x32x1_1x32x1x8_8_1x1_intrawave_v3,795.82,260.43,0.0
gfx942,304,50816,4096,5120,ck,0,0,2752.1481,a8w8_blockscale_1x128x128_256x128x128x128_16x16_32x32_2x2_8x32x1_8x32x1_1x32x1x8_8_1x1_intrawave_v3,774.44,253.41,0.0
gfx942,304,50944,4096,5120,ck,0,0,2695.0804,a8w8_blockscale_1x128x128_256x128x128x128_16x16_32x32_2x2_8x32x1_8x32x1_1x32x1x8_8_1x1_intrawave_v3,792.83,259.41,0.0
gfx942,304,51072,4096,5120,ck,0,0,2737.7782,a8w8_blockscale_1x128x128_256x128x128x128_16x16_32x32_2x2_8x32x1_8x32x1_1x32x1x8_8_1x1_intrawave_v3,782.43,255.99,0.0
gfx942,304,51200,4096,5120,ck,0,0,2750.9176,a8w8_blockscale_1x128x128_256x128x128x128_16x16_32x32_2x2_8x32x1_8x32x1_1x32x1x8_8_1x1_intrawave_v3,780.64,255.39,0.0
gfx942,304,51328,4096,5120,ck,0,0,2742.6801,a8w8_blockscale_1x128x128_256x128x128x128_16x16_32x32_2x2_8x32x1_8x32x1_1x32x1x8_8_1x1_intrawave_v3,784.94,256.77,0.0
gfx942,304,51456,4096,5120,ck,0,0,2711.1505,a8w8_blockscale_1x128x128_256x128x128x128_16x16_32x32_2x2_8x32x1_8x32x1_1x32x1x8_8_1x1_intrawave_v3,796.05,260.39,0.0
gfx942,304,51584,4096,5120,ck,0,0,2801.9818,a8w8_blockscale_1x128x128_256x128x128x128_16x16_32x32_2x2_8x32x1_8x32x1_1x32x1x8_8_1x1_intrawave_v3,772.16,252.56,0.0
gfx942,304,51712,4096,5120,ck,0,0,2748.5124,a8w8_blockscale_1x128x128_256x128x128x128_16x16_32x32_2x2_8x32x1_8x32x1_1x32x1x8_8_1x1_intrawave_v3,789.14,258.09,0.0
gfx942,304,51840,4096,5120,ck,0,0,2789.7492,a8w8_blockscale_1x128x128_256x128x128x128_16x16_32x32_2x2_8x32x1_8x32x1_1x32x1x8_8_1x1_intrawave_v3,779.4,254.89,0.0
gfx942,304,51968,4096,5120,ck,0,0,2678.288,a8w8_blockscale_1x128x128_256x128x128x128_16x16_32x32_2x2_8x32x1_8x32x1_1x32x1x8_8_1x1_intrawave_v3,813.84,266.13,0.0
gfx942,304,52096,4096,5120,ck,0,0,2797.0073,a8w8_blockscale_1x128x128_256x128x128x128_16x16_32x32_2x2_8x32x1_8x32x1_1x32x1x8_8_1x1_intrawave_v3,781.22,255.44,0.0
gfx942,304,52224,4096,5120,ck,0,0,2763.5415,a8w8_blockscale_1x128x128_256x128x128x128_16x16_32x32_2x2_8x32x1_8x32x1_1x32x1x8_8_1x1_intrawave_v3,792.62,259.15,0.0
gfx942,304,52352,4096,5120,ck,0,0,2714.3522,a8w8_blockscale_1x128x128_256x128x128x128_16x16_32x32_2x2_8x32x1_8x32x1_1x32x1x8_8_1x1_intrawave_v3,808.96,264.48,0.0
gfx942,304,52480,4096,5120,ck,0,0,2716.1336,a8w8_blockscale_1x128x128_256x128x128x128_16x16_32x32_2x2_8x32x1_8x32x1_1x32x1x8_8_1x1_intrawave_v3,810.41,264.93,0.0
gfx942,304,52608,4096,5120,ck,0,0,2845.4431,a8w8_blockscale_1x128x128_256x128x128x128_16x16_32x32_2x2_8x32x1_8x32x1_1x32x1x8_8_1x1_intrawave_v3,775.46,253.49,0.0
gfx942,304,52736,4096,5120,ck,0,0,2796.3008,a8w8_blockscale_1x128x128_256x128x128x128_16x16_32x32_2x2_8x32x1_8x32x1_1x32x1x8_8_1x1_intrawave_v3,791.01,258.55,0.0
gfx942,304,52864,4096,5120,ck,0,0,2732.9345,a8w8_blockscale_1x128x128_256x128x128x128_16x16_32x32_2x2_8x32x1_8x32x1_1x32x1x8_8_1x1_intrawave_v3,811.32,265.17,0.0
gfx942,304,52992,4096,5120,ck,0,0,2842.0708,a8w8_blockscale_1x128x128_256x128x128x128_16x16_32x32_2x2_8x32x1_8x32x1_1x32x1x8_8_1x1_intrawave_v3,782.05,255.59,0.0
gfx942,304,53120,4096,5120,ck,0,0,2836.4083,a8w8_blockscale_1x128x128_256x128x128x128_16x16_32x32_2x2_8x32x1_8x32x1_1x32x1x8_8_1x1_intrawave_v3,785.51,256.7,0.0
gfx942,304,53248,4096,5120,ck,0,0,2812.4407,a8w8_blockscale_1x128x128_256x128x128x128_16x16_32x32_2x2_8x32x1_8x32x1_1x32x1x8_8_1x1_intrawave_v3,794.11,259.49,0.0
gfx942,304,53376,4096,5120,ck,0,0,2766.164,a8w8_blockscale_1x128x128_256x128x128x128_16x16_32x32_2x2_8x32x1_8x32x1_1x32x1x8_8_1x1_intrawave_v3,809.33,264.45,0.0
gfx942,304,53504,4096,5120,ck,0,0,2862.5512,a8w8_blockscale_1x128x128_256x128x128x128_16x16_32x32_2x2_8x32x1_8x32x1_1x32x1x8_8_1x1_intrawave_v3,783.96,256.14,0.0
gfx942,304,53632,4096,5120,ck,0,0,2848.6952,a8w8_blockscale_1x128x128_256x128x128x128_16x16_32x32_2x2_8x32x1_8x32x1_1x32x1x8_8_1x1_intrawave_v3,789.66,257.99,0.0
gfx942,304,53760,4096,5120,ck,0,0,2878.5588,a8w8_blockscale_1x128x128_256x128x128x128_16x16_32x32_2x2_8x32x1_8x32x1_1x32x1x8_8_1x1_intrawave_v3,783.33,255.9,0.0
gfx942,304,53888,4096,5120,ck,0,0,2794.0631,a8w8_blockscale_1x128x128_256x128x128x128_16x16_32x32_2x2_8x32x1_8x32x1_1x32x1x8_8_1x1_intrawave_v3,808.94,264.25,0.0
gfx942,304,54016,4096,5120,ck,0,0,2877.1257,a8w8_blockscale_1x128x128_256x128x128x128_16x16_32x32_2x2_8x32x1_8x32x1_1x32x1x8_8_1x1_intrawave_v3,787.45,257.21,0.0
gfx942,304,54144,4096,5120,ck,0,0,2852.099,a8w8_blockscale_1x128x128_256x128x128x128_16x16_32x32_2x2_8x32x1_8x32x1_1x32x1x8_8_1x1_intrawave_v3,796.24,260.07,0.0
gfx942,304,54272,4096,5120,ck,0,0,2921.8945,a8w8_blockscale_1x128x128_256x128x128x128_16x16_32x32_2x2_8x32x1_8x32x1_1x32x1x8_8_1x1_intrawave_v3,779.06,254.44,0.0
gfx942,304,54400,4096,5120,ck,0,0,2820.4602,a8w8_blockscale_1x128x128_256x128x128x128_16x16_32x32_2x2_8x32x1_8x32x1_1x32x1x8_8_1x1_intrawave_v3,808.98,264.19,0.0
gfx942,304,54528,4096,5120,ck,0,0,2825.1695,a8w8_blockscale_1x128x128_256x128x128x128_16x16_32x32_2x2_8x32x1_8x32x1_1x32x1x8_8_1x1_intrawave_v3,809.53,264.36,0.0
gfx942,304,54656,4096,5120,ck,0,0,2953.2789,a8w8_blockscale_1x128x128_256x128x128x128_16x16_32x32_2x2_8x32x1_8x32x1_1x32x1x8_8_1x1_intrawave_v3,776.24,253.46,0.0
gfx942,304,54784,4096,5120,ck,0,0,2920.4702,a8w8_blockscale_1x128x128_256x128x128x128_16x16_32x32_2x2_8x32x1_8x32x1_1x32x1x8_8_1x1_intrawave_v3,786.79,256.9,0.0
gfx942,304,54912,4096,5120,ck,0,0,2917.4613,a8w8_blockscale_1x128x128_256x128x128x128_16x16_32x32_2x2_8x32x1_8x32x1_1x32x1x8_8_1x1_intrawave_v3,789.45,257.74,0.0
gfx942,304,55040,4096,5120,ck,0,0,2899.4143,a8w8_blockscale_1x128x128_256x128x128x128_16x16_32x32_2x2_8x32x1_8x32x1_1x32x1x8_8_1x1_intrawave_v3,796.21,259.94,0.0
gfx942,304,55168,4096,5120,ck,0,0,2855.5221,a8w8_blockscale_1x128x128_256x128x128x128_16x16_32x32_2x2_8x32x1_8x32x1_1x32x1x8_8_1x1_intrawave_v3,810.33,264.53,0.0
gfx942,304,55296,4096,5120,ck,0,0,2918.8338,a8w8_blockscale_1x128x128_256x128x128x128_16x16_32x32_2x2_8x32x1_8x32x1_1x32x1x8_8_1x1_intrawave_v3,794.59,259.37,0.0
gfx942,304,55424,4096,5120,ck,0,0,2943.4541,a8w8_blockscale_1x128x128_256x128x128x128_16x16_32x32_2x2_8x32x1_8x32x1_1x32x1x8_8_1x1_intrawave_v3,789.77,257.78,0.0
gfx942,304,55552,4096,5120,ck,0,0,2944.1291,a8w8_blockscale_1x128x128_256x128x128x128_16x16_32x32_2x2_8x32x1_8x32x1_1x32x1x8_8_1x1_intrawave_v3,791.41,258.3,0.0
gfx942,304,55680,4096,5120,ck,0,0,2963.4655,a8w8_blockscale_1x128x128_256x128x128x128_16x16_32x32_2x2_8x32x1_8x32x1_1x32x1x8_8_1x1_intrawave_v3,788.06,257.19,0.0
gfx942,304,55808,4096,5120,ck,0,0,2953.5253,a8w8_blockscale_1x128x128_256x128x128x128_16x16_32x32_2x2_8x32x1_8x32x1_1x32x1x8_8_1x1_intrawave_v3,792.53,258.64,0.0
gfx942,304,55936,4096,5120,ck,0,0,2941.5151,a8w8_blockscale_1x128x128_256x128x128x128_16x16_32x32_2x2_8x32x1_8x32x1_1x32x1x8_8_1x1_intrawave_v3,797.59,260.27,0.0
gfx942,304,56064,4096,5120,ck,0,0,2980.8828,a8w8_blockscale_1x128x128_256x128x128x128_16x16_32x32_2x2_8x32x1_8x32x1_1x32x1x8_8_1x1_intrawave_v3,788.86,257.41,0.0
gfx942,304,56192,4096,5120,ck,0,0,3011.7634,a8w8_blockscale_1x128x128_256x128x128x128_16x16_32x32_2x2_8x32x1_8x32x1_1x32x1x8_8_1x1_intrawave_v3,782.55,255.33,0.0
gfx942,304,56320,4096,5120,ck,0,0,2970.8356,a8w8_blockscale_1x128x128_256x128x128x128_16x16_32x32_2x2_8x32x1_8x32x1_1x32x1x8_8_1x1_intrawave_v3,795.14,259.42,0.0
gfx942,304,56448,4096,5120,ck,0,0,2991.4034,a8w8_blockscale_1x128x128_256x128x128x128_16x16_32x32_2x2_8x32x1_8x32x1_1x32x1x8_8_1x1_intrawave_v3,791.47,258.21,0.0
gfx942,304,56576,4096,5120,ck,0,0,2999.0383,a8w8_blockscale_1x128x128_256x128x128x128_16x16_32x32_2x2_8x32x1_8x32x1_1x32x1x8_8_1x1_intrawave_v3,791.24,258.12,0.0
gfx942,304,56704,4096,5120,ck,0,0,2989.8877,a8w8_blockscale_1x128x128_256x128x128x128_16x16_32x32_2x2_8x32x1_8x32x1_1x32x1x8_8_1x1_intrawave_v3,795.46,259.48,0.0
gfx942,304,56832,4096,5120,ck,0,0,2947.7852,a8w8_blockscale_1x128x128_256x128x128x128_16x16_32x32_2x2_8x32x1_8x32x1_1x32x1x8_8_1x1_intrawave_v3,808.64,263.76,0.0
gfx942,304,56960,4096,5120,ck,0,0,2961.8789,a8w8_blockscale_1x128x128_256x128x128x128_16x16_32x32_2x2_8x32x1_8x32x1_1x32x1x8_8_1x1_intrawave_v3,806.61,263.08,0.0
gfx942,304,57088,4096,5120,ck,0,0,3079.3172,a8w8_blockscale_1x128x128_256x128x128x128_16x16_32x32_2x2_8x32x1_8x32x1_1x32x1x8_8_1x1_intrawave_v3,777.59,253.6,0.0
gfx942,304,57216,4096,5120,ck,0,0,3024.829,a8w8_blockscale_1x128x128_256x128x128x128_16x16_32x32_2x2_8x32x1_8x32x1_1x32x1x8_8_1x1_intrawave_v3,793.37,258.74,0.0
gfx942,304,57344,4096,5120,ck,0,0,2973.6607,a8w8_blockscale_1x128x128_256x128x128x128_16x16_32x32_2x2_8x32x1_8x32x1_1x32x1x8_8_1x1_intrawave_v3,808.83,263.76,0.0
gfx942,304,57472,4096,5120,ck,0,0,2977.3813,a8w8_blockscale_1x128x128_256x128x128x128_16x16_32x32_2x2_8x32x1_8x32x1_1x32x1x8_8_1x1_intrawave_v3,809.62,264.0,0.0
gfx942,304,57600,4096,5120,ck,0,0,3092.3309,a8w8_blockscale_1x128x128_256x128x128x128_16x16_32x32_2x2_8x32x1_8x32x1_1x32x1x8_8_1x1_intrawave_v3,781.26,254.74,0.0
gfx942,304,57728,4096,5120,ck,0,0,3033.3562,a8w8_blockscale_1x128x128_256x128x128x128_16x16_32x32_2x2_8x32x1_8x32x1_1x32x1x8_8_1x1_intrawave_v3,798.22,260.26,0.0
gfx942,304,57856,4096,5120,ck,0,0,3073.7678,a8w8_blockscale_1x128x128_256x128x128x128_16x16_32x32_2x2_8x32x1_8x32x1_1x32x1x8_8_1x1_intrawave_v3,789.47,257.39,0.0
gfx942,304,57984,4096,5120,ck,0,0,3068.6495,a8w8_blockscale_1x128x128_256x128x128x128_16x16_32x32_2x2_8x32x1_8x32x1_1x32x1x8_8_1x1_intrawave_v3,792.54,258.37,0.0
gfx942,304,58112,4096,5120,ck,0,0,3073.5705,a8w8_blockscale_1x128x128_256x128x128x128_16x16_32x32_2x2_8x32x1_8x32x1_1x32x1x8_8_1x1_intrawave_v3,793.02,258.51,0.0
gfx942,304,58240,4096,5120,ck,0,0,3082.5709,a8w8_blockscale_1x128x128_256x128x128x128_16x16_32x32_2x2_8x32x1_8x32x1_1x32x1x8_8_1x1_intrawave_v3,792.44,258.31,0.0
gfx942,304,58368,4096,5120,ck,0,0,3069.9277,a8w8_blockscale_1x128x128_256x128x128x128_16x16_32x32_2x2_8x32x1_8x32x1_1x32x1x8_8_1x1_intrawave_v3,797.46,259.93,0.0
gfx942,304,58496,4096,5120,ck,0,0,3160.8563,a8w8_blockscale_1x128x128_256x128x128x128_16x16_32x32_2x2_8x32x1_8x32x1_1x32x1x8_8_1x1_intrawave_v3,776.21,252.99,0.0
gfx942,304,58624,4096,5120,ck,0,0,3123.3695,a8w8_blockscale_1x128x128_256x128x128x128_16x16_32x32_2x2_8x32x1_8x32x1_1x32x1x8_8_1x1_intrawave_v3,787.25,256.57,0.0
gfx942,304,58752,4096,5120,ck,0,0,3105.816,a8w8_blockscale_1x128x128_256x128x128x128_16x16_32x32_2x2_8x32x1_8x32x1_1x32x1x8_8_1x1_intrawave_v3,793.43,258.57,0.0
gfx942,304,58880,4096,5120,ck,0,0,3150.1713,a8w8_blockscale_1x128x128_256x128x128x128_16x16_32x32_2x2_8x32x1_8x32x1_1x32x1x8_8_1x1_intrawave_v3,783.96,255.47,0.0
gfx942,304,59008,4096,5120,ck,0,0,3157.1243,a8w8_blockscale_1x128x128_256x128x128x128_16x16_32x32_2x2_8x32x1_8x32x1_1x32x1x8_8_1x1_intrawave_v3,783.93,255.45,0.0
gfx942,304,59136,4096,5120,ck,0,0,3127.8058,a8w8_blockscale_1x128x128_256x128x128x128_16x16_32x32_2x2_8x32x1_8x32x1_1x32x1x8_8_1x1_intrawave_v3,793.0,258.39,0.0
gfx942,304,59264,4096,5120,ck,0,0,3176.205,a8w8_blockscale_1x128x128_256x128x128x128_16x16_32x32_2x2_8x32x1_8x32x1_1x32x1x8_8_1x1_intrawave_v3,782.6,254.99,0.0
gfx942,304,59392,4096,5120,ck,0,0,3238.4938,a8w8_blockscale_1x128x128_256x128x128x128_16x16_32x32_2x2_8x32x1_8x32x1_1x32x1x8_8_1x1_intrawave_v3,769.21,250.61,0.0
gfx942,304,59520,4096,5120,ck,0,0,3080.0766,a8w8_blockscale_1x128x128_256x128x128x128_16x16_32x32_2x2_8x32x1_8x32x1_1x32x1x8_8_1x1_intrawave_v3,810.52,264.05,0.0
gfx942,304,59648,4096,5120,ck,0,0,3222.9295,a8w8_blockscale_1x128x128_256x128x128x128_16x16_32x32_2x2_8x32x1_8x32x1_1x32x1x8_8_1x1_intrawave_v3,776.26,252.88,0.0
gfx942,304,59776,4096,5120,ck,0,0,3175.842,a8w8_blockscale_1x128x128_256x128x128x128_16x16_32x32_2x2_8x32x1_8x32x1_1x32x1x8_8_1x1_intrawave_v3,789.46,257.16,0.0
gfx942,304,59904,4096,5120,ck,0,0,3109.7335,a8w8_blockscale_1x128x128_256x128x128x128_16x16_32x32_2x2_8x32x1_8x32x1_1x32x1x8_8_1x1_intrawave_v3,807.97,263.18,0.0
gfx942,304,60032,4096,5120,ck,0,0,3255.535,a8w8_blockscale_1x128x128_256x128x128x128_16x16_32x32_2x2_8x32x1_8x32x1_1x32x1x8_8_1x1_intrawave_v3,773.43,251.91,0.0
gfx942,304,60160,4096,5120,ck,0,0,3223.9174,a8w8_blockscale_1x128x128_256x128x128x128_16x16_32x32_2x2_8x32x1_8x32x1_1x32x1x8_8_1x1_intrawave_v3,782.68,254.91,0.0
gfx942,304,60288,4096,5120,ck,0,0,3221.1458,a8w8_blockscale_1x128x128_256x128x128x128_16x16_32x32_2x2_8x32x1_8x32x1_1x32x1x8_8_1x1_intrawave_v3,785.02,255.66,0.0
gfx942,304,60416,4096,5120,ck,0,0,3181.8594,a8w8_blockscale_1x128x128_256x128x128x128_16x16_32x32_2x2_8x32x1_8x32x1_1x32x1x8_8_1x1_intrawave_v3,796.4,259.35,0.0
gfx942,304,60544,4096,5120,ck,0,0,3262.0752,a8w8_blockscale_1x128x128_256x128x128x128_16x16_32x32_2x2_8x32x1_8x32x1_1x32x1x8_8_1x1_intrawave_v3,778.46,253.5,0.0
gfx942,304,60672,4096,5120,ck,0,0,3248.6346,a8w8_blockscale_1x128x128_256x128x128x128_16x16_32x32_2x2_8x32x1_8x32x1_1x32x1x8_8_1x1_intrawave_v3,783.33,255.07,0.0
gfx942,304,60800,4096,5120,ck,0,0,3211.8808,a8w8_blockscale_1x128x128_256x128x128x128_16x16_32x32_2x2_8x32x1_8x32x1_1x32x1x8_8_1x1_intrawave_v3,793.97,258.52,0.0
gfx942,304,60928,4096,5120,ck,0,0,3278.6897,a8w8_blockscale_1x128x128_256x128x128x128_16x16_32x32_2x2_8x32x1_8x32x1_1x32x1x8_8_1x1_intrawave_v3,779.43,253.77,0.0
gfx942,304,61056,4096,5120,ck,0,0,3217.6373,a8w8_blockscale_1x128x128_256x128x128x128_16x16_32x32_2x2_8x32x1_8x32x1_1x32x1x8_8_1x1_intrawave_v3,795.89,259.12,0.0
gfx942,304,61184,4096,5120,ck,0,0,3251.029,a8w8_blockscale_1x128x128_256x128x128x128_16x16_32x32_2x2_8x32x1_8x32x1_1x32x1x8_8_1x1_intrawave_v3,789.36,256.98,0.0
gfx942,304,61312,4096,5120,ck,0,0,3284.5492,a8w8_blockscale_1x128x128_256x128x128x128_16x16_32x32_2x2_8x32x1_8x32x1_1x32x1x8_8_1x1_intrawave_v3,782.94,254.88,0.0
gfx942,304,61440,4096,5120,ck,0,0,3169.4474,a8w8_blockscale_1x128x128_256x128x128x128_16x16_32x32_2x2_8x32x1_8x32x1_1x32x1x8_8_1x1_intrawave_v3,813.07,264.67,0.0
gfx942,304,61568,4096,5120,ck,0,0,3262.6109,a8w8_blockscale_1x128x128_256x128x128x128_16x16_32x32_2x2_8x32x1_8x32x1_1x32x1x8_8_1x1_intrawave_v3,791.5,257.64,0.0
gfx942,304,61696,4096,5120,ck,0,0,3243.8078,a8w8_blockscale_1x128x128_256x128x128x128_16x16_32x32_2x2_8x32x1_8x32x1_1x32x1x8_8_1x1_intrawave_v3,797.74,259.65,0.0
gfx942,304,61824,4096,5120,ck,0,0,3202.9648,a8w8_blockscale_1x128x128_256x128x128x128_16x16_32x32_2x2_8x32x1_8x32x1_1x32x1x8_8_1x1_intrawave_v3,809.59,263.5,0.0
gfx942,304,61952,4096,5120,ck,0,0,3310.3753,a8w8_blockscale_1x128x128_256x128x128x128_16x16_32x32_2x2_8x32x1_8x32x1_1x32x1x8_8_1x1_intrawave_v3,784.94,255.46,0.0
gfx942,304,62080,4096,5120,ck,0,0,3296.5454,a8w8_blockscale_1x128x128_256x128x128x128_16x16_32x32_2x2_8x32x1_8x32x1_1x32x1x8_8_1x1_intrawave_v3,789.86,257.05,0.0
gfx942,304,62208,4096,5120,ck,0,0,3289.2312,a8w8_blockscale_1x128x128_256x128x128x128_16x16_32x32_2x2_8x32x1_8x32x1_1x32x1x8_8_1x1_intrawave_v3,793.25,258.14,0.0
gfx942,304,62336,4096,5120,ck,0,0,3277.9527,a8w8_blockscale_1x128x128_256x128x128x128_16x16_32x32_2x2_8x32x1_8x32x1_1x32x1x8_8_1x1_intrawave_v3,797.62,259.55,0.0
gfx942,304,62464,4096,5120,ck,0,0,3353.993,a8w8_blockscale_1x128x128_256x128x128x128_16x16_32x32_2x2_8x32x1_8x32x1_1x32x1x8_8_1x1_intrawave_v3,781.14,254.17,0.0
gfx942,304,62592,4096,5120,ck,0,0,3353.5429,a8w8_blockscale_1x128x128_256x128x128x128_16x16_32x32_2x2_8x32x1_8x32x1_1x32x1x8_8_1x1_intrawave_v3,782.84,254.71,0.0
gfx942,304,62720,4096,5120,ck,0,0,3322.139,a8w8_blockscale_1x128x128_256x128x128x128_16x16_32x32_2x2_8x32x1_8x32x1_1x32x1x8_8_1x1_intrawave_v3,791.86,257.64,0.0
gfx942,304,62848,4096,5120,ck,0,0,3304.3941,a8w8_blockscale_1x128x128_256x128x128x128_16x16_32x32_2x2_8x32x1_8x32x1_1x32x1x8_8_1x1_intrawave_v3,797.74,259.53,0.0
gfx942,304,62976,4096,5120,ck,0,0,3363.9147,a8w8_blockscale_1x128x128_256x128x128x128_16x16_32x32_2x2_8x32x1_8x32x1_1x32x1x8_8_1x1_intrawave_v3,785.22,255.45,0.0
gfx942,304,63104,4096,5120,ck,0,0,3316.373,a8w8_blockscale_1x128x128_256x128x128x128_16x16_32x32_2x2_8x32x1_8x32x1_1x32x1x8_8_1x1_intrawave_v3,798.09,259.62,0.0
gfx942,304,63232,4096,5120,ck,0,0,3323.6527,a8w8_blockscale_1x128x128_256x128x128x128_16x16_32x32_2x2_8x32x1_8x32x1_1x32x1x8_8_1x1_intrawave_v3,797.96,259.57,0.0
gfx942,304,63360,4096,5120,ck,0,0,3334.0459,a8w8_blockscale_1x128x128_256x128x128x128_16x16_32x32_2x2_8x32x1_8x32x1_1x32x1x8_8_1x1_intrawave_v3,797.08,259.27,0.0
gfx942,304,63488,4096,5120,ck,0,0,3279.448,a8w8_blockscale_1x128x128_256x128x128x128_16x16_32x32_2x2_8x32x1_8x32x1_1x32x1x8_8_1x1_intrawave_v3,811.99,264.11,0.0
gfx942,304,63616,4096,5120,ck,0,0,3373.8787,a8w8_blockscale_1x128x128_256x128x128x128_16x16_32x32_2x2_8x32x1_8x32x1_1x32x1x8_8_1x1_intrawave_v3,790.85,257.22,0.0
gfx942,304,63744,4096,5120,ck,0,0,3365.217,a8w8_blockscale_1x128x128_256x128x128x128_16x16_32x32_2x2_8x32x1_8x32x1_1x32x1x8_8_1x1_intrawave_v3,794.49,258.39,0.0
gfx942,304,63872,4096,5120,ck,0,0,3438.8663,a8w8_blockscale_1x128x128_256x128x128x128_16x16_32x32_2x2_8x32x1_8x32x1_1x32x1x8_8_1x1_intrawave_v3,779.03,253.35,0.0
gfx942,304,64000,4096,5120,ck,0,0,3395.499,a8w8_blockscale_1x128x128_256x128x128x128_16x16_32x32_2x2_8x32x1_8x32x1_1x32x1x8_8_1x1_intrawave_v3,790.56,257.09,0.0
gfx942,304,64128,4096,5120,ck,0,0,3329.7753,a8w8_blockscale_1x128x128_256x128x128x128_16x16_32x32_2x2_8x32x1_8x32x1_1x32x1x8_8_1x1_intrawave_v3,807.78,262.67,0.0
gfx942,304,64256,4096,5120,ck,0,0,3408.4567,a8w8_blockscale_1x128x128_256x128x128x128_16x16_32x32_2x2_8x32x1_8x32x1_1x32x1x8_8_1x1_intrawave_v3,790.71,257.11,0.0
gfx942,304,64384,4096,5120,ck,0,0,3507.9556,a8w8_blockscale_1x128x128_256x128x128x128_16x16_32x32_2x2_8x32x1_8x32x1_1x32x1x8_8_1x1_intrawave_v3,769.81,250.3,0.0
gfx942,304,64512,4096,5120,ck,0,0,3332.7898,a8w8_blockscale_1x128x128_256x128x128x128_16x16_32x32_2x2_8x32x1_8x32x1_1x32x1x8_8_1x1_intrawave_v3,811.88,263.97,0.0
gfx942,304,64640,4096,5120,ck,0,0,3451.9007,a8w8_blockscale_1x128x128_256x128x128x128_16x16_32x32_2x2_8x32x1_8x32x1_1x32x1x8_8_1x1_intrawave_v3,785.42,255.35,0.0
gfx942,304,64768,4096,5120,ck,0,0,3439.39,a8w8_blockscale_1x128x128_256x128x128x128_16x16_32x32_2x2_8x32x1_8x32x1_1x32x1x8_8_1x1_intrawave_v3,789.84,256.78,0.0
gfx942,304,64896,4096,5120,ck,0,0,3435.7675,a8w8_blockscale_1x128x128_256x128x128x128_16x16_32x32_2x2_8x32x1_8x32x1_1x32x1x8_8_1x1_intrawave_v3,792.24,257.55,0.0
gfx942,304,65024,4096,5120,ck,0,0,3507.0204,a8w8_blockscale_1x128x128_256x128x128x128_16x16_32x32_2x2_8x32x1_8x32x1_1x32x1x8_8_1x1_intrawave_v3,777.67,252.8,0.0
gfx942,304,65152,4096,5120,ck,0,0,3443.0753,a8w8_blockscale_1x128x128_256x128x128x128_16x16_32x32_2x2_8x32x1_8x32x1_1x32x1x8_8_1x1_intrawave_v3,793.67,257.99,0.0
gfx942,304,65280,4096,5120,ck,0,0,3373.4749,a8w8_blockscale_1x128x128_256x128x128x128_16x16_32x32_2x2_8x32x1_8x32x1_1x32x1x8_8_1x1_intrawave_v3,811.64,263.82,0.0
gfx942,304,65408,4096,5120,ck,0,0,3531.6592,a8w8_blockscale_1x128x128_256x128x128x128_16x16_32x32_2x2_8x32x1_8x32x1_1x32x1x8_8_1x1_intrawave_v3,776.8,252.48,0.0
gfx942,304,65536,4096,5120,ck,0,0,3455.6578,a8w8_blockscale_1x128x128_256x128x128x128_16x16_32x32_2x2_8x32x1_8x32x1_1x32x1x8_8_1x1_intrawave_v3,795.44,258.53,0.0
gfx942,304,65664,4096,5120,ck,0,0,3470.4739,a8w8_blockscale_1x128x128_256x128x128x128_16x16_32x32_2x2_8x32x1_8x32x1_1x32x1x8_8_1x1_intrawave_v3,793.59,257.92,0.0
gfx942,304,65792,4096,5120,ck,0,0,3520.5143,a8w8_blockscale_1x128x128_256x128x128x128_16x16_32x32_2x2_8x32x1_8x32x1_1x32x1x8_8_1x1_intrawave_v3,783.84,254.73,0.0
gfx942,304,65920,4096,5120,ck,0,0,3489.0929,a8w8_blockscale_1x128x128_256x128x128x128_16x16_32x32_2x2_8x32x1_8x32x1_1x32x1x8_8_1x1_intrawave_v3,792.44,257.52,0.0
gfx942,304,66048,4096,5120,ck,0,0,3421.6781,a8w8_blockscale_1x128x128_256x128x128x128_16x16_32x32_2x2_8x32x1_8x32x1_1x32x1x8_8_1x1_intrawave_v3,809.62,263.09,0.0
gfx942,304,66176,4096,5120,ck,0,0,3518.7211,a8w8_blockscale_1x128x128_256x128x128x128_16x16_32x32_2x2_8x32x1_8x32x1_1x32x1x8_8_1x1_intrawave_v3,788.82,256.32,0.0
gfx942,304,66304,4096,5120,ck,0,0,3506.2384,a8w8_blockscale_1x128x128_256x128x128x128_16x16_32x32_2x2_8x32x1_8x32x1_1x32x1x8_8_1x1_intrawave_v3,793.16,257.72,0.0
gfx942,304,66432,4096,5120,ck,0,0,3512.2949,a8w8_blockscale_1x128x128_256x128x128x128_16x16_32x32_2x2_8x32x1_8x32x1_1x32x1x8_8_1x1_intrawave_v3,793.32,257.76,0.0
gfx942,304,66560,4096,5120,ck,0,0,3589.2978,a8w8_blockscale_1x128x128_256x128x128x128_16x16_32x32_2x2_8x32x1_8x32x1_1x32x1x8_8_1x1_intrawave_v3,777.79,252.7,0.0
gfx942,304,66688,4096,5120,ck,0,0,3616.1752,a8w8_blockscale_1x128x128_256x128x128x128_16x16_32x32_2x2_8x32x1_8x32x1_1x32x1x8_8_1x1_intrawave_v3,773.5,251.29,0.0
gfx942,304,66816,4096,5120,ck,0,0,3574.8824,a8w8_blockscale_1x128x128_256x128x128x128_16x16_32x32_2x2_8x32x1_8x32x1_1x32x1x8_8_1x1_intrawave_v3,783.93,254.67,0.0
gfx942,304,66944,4096,5120,ck,0,0,3505.8425,a8w8_blockscale_1x128x128_256x128x128x128_16x16_32x32_2x2_8x32x1_8x32x1_1x32x1x8_8_1x1_intrawave_v3,800.9,260.17,0.0
gfx942,304,67072,4096,5120,ck,0,0,3465.8782,a8w8_blockscale_1x128x128_256x128x128x128_16x16_32x32_2x2_8x32x1_8x32x1_1x32x1x8_8_1x1_intrawave_v3,811.69,263.67,0.0
gfx942,304,67200,4096,5120,ck,0,0,3620.2304,a8w8_blockscale_1x128x128_256x128x128x128_16x16_32x32_2x2_8x32x1_8x32x1_1x32x1x8_8_1x1_intrawave_v3,778.56,252.89,0.0
gfx942,304,67328,4096,5120,ck,0,0,3562.4327,a8w8_blockscale_1x128x128_256x128x128x128_16x16_32x32_2x2_8x32x1_8x32x1_1x32x1x8_8_1x1_intrawave_v3,792.7,257.48,0.0
gfx942,304,67456,4096,5120,ck,0,0,3570.7663,a8w8_blockscale_1x128x128_256x128x128x128_16x16_32x32_2x2_8x32x1_8x32x1_1x32x1x8_8_1x1_intrawave_v3,792.35,257.35,0.0
gfx942,304,67584,4096,5120,ck,0,0,3619.0134,a8w8_blockscale_1x128x128_256x128x128x128_16x16_32x32_2x2_8x32x1_8x32x1_1x32x1x8_8_1x1_intrawave_v3,783.27,254.39,0.0
gfx942,304,67712,4096,5120,ck,0,0,3694.8802,a8w8_blockscale_1x128x128_256x128x128x128_16x16_32x32_2x2_8x32x1_8x32x1_1x32x1x8_8_1x1_intrawave_v3,768.64,249.63,0.0
gfx942,304,67840,4096,5120,ck,0,0,3710.6873,a8w8_blockscale_1x128x128_256x128x128x128_16x16_32x32_2x2_8x32x1_8x32x1_1x32x1x8_8_1x1_intrawave_v3,766.82,249.03,0.0
gfx942,304,67968,4096,5120,ck,0,0,3592.4772,a8w8_blockscale_1x128x128_256x128x128x128_16x16_32x32_2x2_8x32x1_8x32x1_1x32x1x8_8_1x1_intrawave_v3,793.54,257.69,0.0
gfx942,304,68096,4096,5120,ck,0,0,3716.3596,a8w8_blockscale_1x128x128_256x128x128x128_16x16_32x32_2x2_8x32x1_8x32x1_1x32x1x8_8_1x1_intrawave_v3,768.54,249.56,0.0
gfx942,304,68224,4096,5120,ck,0,0,3633.3944,a8w8_blockscale_1x128x128_256x128x128x128_16x16_32x32_2x2_8x32x1_8x32x1_1x32x1x8_8_1x1_intrawave_v3,787.56,255.73,0.0
gfx942,304,68352,4096,5120,ck,0,0,3615.6356,a8w8_blockscale_1x128x128_256x128x128x128_16x16_32x32_2x2_8x32x1_8x32x1_1x32x1x8_8_1x1_intrawave_v3,792.91,257.46,0.0
gfx942,304,68480,4096,5120,ck,0,0,3693.4561,a8w8_blockscale_1x128x128_256x128x128x128_16x16_32x32_2x2_8x32x1_8x32x1_1x32x1x8_8_1x1_intrawave_v3,777.66,252.49,0.0
gfx942,304,68608,4096,5120,ck,0,0,3625.1969,a8w8_blockscale_1x128x128_256x128x128x128_16x16_32x32_2x2_8x32x1_8x32x1_1x32x1x8_8_1x1_intrawave_v3,793.79,257.72,0.0
gfx942,304,68736,4096,5120,ck,0,0,3725.9233,a8w8_blockscale_1x128x128_256x128x128x128_16x16_32x32_2x2_8x32x1_8x32x1_1x32x1x8_8_1x1_intrawave_v3,773.77,251.21,0.0
gfx942,304,68864,4096,5120,ck,0,0,3665.2218,a8w8_blockscale_1x128x128_256x128x128x128_16x16_32x32_2x2_8x32x1_8x32x1_1x32x1x8_8_1x1_intrawave_v3,788.05,255.83,0.0
gfx942,304,68992,4096,5120,ck,0,0,3718.7892,a8w8_blockscale_1x128x128_256x128x128x128_16x16_32x32_2x2_8x32x1_8x32x1_1x32x1x8_8_1x1_intrawave_v3,778.14,252.61,0.0
gfx942,304,69120,4096,5120,ck,0,0,3574.6461,a8w8_blockscale_1x128x128_256x128x128x128_16x16_32x32_2x2_8x32x1_8x32x1_1x32x1x8_8_1x1_intrawave_v3,811.02,263.27,0.0
gfx942,304,69248,4096,5120,ck,0,0,3718.9454,a8w8_blockscale_1x128x128_256x128x128x128_16x16_32x32_2x2_8x32x1_8x32x1_1x32x1x8_8_1x1_intrawave_v3,780.99,253.51,0.0
gfx942,304,69376,4096,5120,ck,0,0,3642.1864,a8w8_blockscale_1x128x128_256x128x128x128_16x16_32x32_2x2_8x32x1_8x32x1_1x32x1x8_8_1x1_intrawave_v3,798.93,259.32,0.0
gfx942,304,69504,4096,5120,ck,0,0,3803.5013,a8w8_blockscale_1x128x128_256x128x128x128_16x16_32x32_2x2_8x32x1_8x32x1_1x32x1x8_8_1x1_intrawave_v3,766.45,248.77,0.0
gfx942,304,69632,4096,5120,ck,0,0,3691.2884,a8w8_blockscale_1x128x128_256x128x128x128_16x16_32x32_2x2_8x32x1_8x32x1_1x32x1x8_8_1x1_intrawave_v3,791.21,256.8,0.0
gfx942,304,69760,4096,5120,ck,0,0,3783.0303,a8w8_blockscale_1x128x128_256x128x128x128_16x16_32x32_2x2_8x32x1_8x32x1_1x32x1x8_8_1x1_intrawave_v3,773.44,251.02,0.0
gfx942,304,69888,4096,5120,ck,0,0,3709.1316,a8w8_blockscale_1x128x128_256x128x128x128_16x16_32x32_2x2_8x32x1_8x32x1_1x32x1x8_8_1x1_intrawave_v3,790.3,256.48,0.0
gfx942,304,70016,4096,5120,ck,0,0,3723.2949,a8w8_blockscale_1x128x128_256x128x128x128_16x16_32x32_2x2_8x32x1_8x32x1_1x32x1x8_8_1x1_intrawave_v3,788.73,255.96,0.0
gfx942,304,70144,4096,5120,ck,0,0,3824.2598,a8w8_blockscale_1x128x128_256x128x128x128_16x16_32x32_2x2_8x32x1_8x32x1_1x32x1x8_8_1x1_intrawave_v3,769.31,249.65,0.0
gfx942,304,70272,4096,5120,ck,0,0,3793.2976,a8w8_blockscale_1x128x128_256x128x128x128_16x16_32x32_2x2_8x32x1_8x32x1_1x32x1x8_8_1x1_intrawave_v3,777.01,252.14,0.0
gfx942,304,70400,4096,5120,ck,0,0,3793.5187,a8w8_blockscale_1x128x128_256x128x128x128_16x16_32x32_2x2_8x32x1_8x32x1_1x32x1x8_8_1x1_intrawave_v3,778.38,252.57,0.0
gfx942,304,70528,4096,5120,ck,0,0,3752.1214,a8w8_blockscale_1x128x128_256x128x128x128_16x16_32x32_2x2_8x32x1_8x32x1_1x32x1x8_8_1x1_intrawave_v3,788.4,255.81,0.0
gfx942,304,70656,4096,5120,ck,0,0,3828.3727,a8w8_blockscale_1x128x128_256x128x128x128_16x16_32x32_2x2_8x32x1_8x32x1_1x32x1x8_8_1x1_intrawave_v3,774.1,251.16,0.0
gfx942,304,70784,4096,5120,ck,0,0,3760.5707,a8w8_blockscale_1x128x128_256x128x128x128_16x16_32x32_2x2_8x32x1_8x32x1_1x32x1x8_8_1x1_intrawave_v3,789.48,256.14,0.0
gfx942,304,70912,4096,5120,ck,0,0,3769.3697,a8w8_blockscale_1x128x128_256x128x128x128_16x16_32x32_2x2_8x32x1_8x32x1_1x32x1x8_8_1x1_intrawave_v3,789.06,256.0,0.0
gfx942,304,71040,4096,5120,ck,0,0,3766.898,a8w8_blockscale_1x128x128_256x128x128x128_16x16_32x32_2x2_8x32x1_8x32x1_1x32x1x8_8_1x1_intrawave_v3,791.0,256.62,0.0
gfx942,304,71168,4096,5120,ck,0,0,3680.2618,a8w8_blockscale_1x128x128_256x128x128x128_16x16_32x32_2x2_8x32x1_8x32x1_1x32x1x8_8_1x1_intrawave_v3,811.08,263.12,0.0
gfx942,304,71296,4096,5120,ck,0,0,3770.7768,a8w8_blockscale_1x128x128_256x128x128x128_16x16_32x32_2x2_8x32x1_8x32x1_1x32x1x8_8_1x1_intrawave_v3,793.04,257.26,0.0
gfx942,304,71424,4096,5120,ck,0,0,3834.1148,a8w8_blockscale_1x128x128_256x128x128x128_16x16_32x32_2x2_8x32x1_8x32x1_1x32x1x8_8_1x1_intrawave_v3,781.34,253.45,0.0
gfx942,304,71552,4096,5120,ck,0,0,3702.67,a8w8_blockscale_1x128x128_256x128x128x128_16x16_32x32_2x2_8x32x1_8x32x1_1x32x1x8_8_1x1_intrawave_v3,810.53,262.91,0.0
gfx942,304,71680,4096,5120,ck,0,0,3880.0741,a8w8_blockscale_1x128x128_256x128x128x128_16x16_32x32_2x2_8x32x1_8x32x1_1x32x1x8_8_1x1_intrawave_v3,774.85,251.33,0.0
gfx942,304,71808,4096,5120,ck,0,0,3856.8389,a8w8_blockscale_1x128x128_256x128x128x128_16x16_32x32_2x2_8x32x1_8x32x1_1x32x1x8_8_1x1_intrawave_v3,780.91,253.29,0.0
gfx942,304,71936,4096,5120,ck,0,0,3892.9195,a8w8_blockscale_1x128x128_256x128x128x128_16x16_32x32_2x2_8x32x1_8x32x1_1x32x1x8_8_1x1_intrawave_v3,775.05,251.38,0.0
gfx942,304,72064,4096,5120,ck,0,0,3872.591,a8w8_blockscale_1x128x128_256x128x128x128_16x16_32x32_2x2_8x32x1_8x32x1_1x32x1x8_8_1x1_intrawave_v3,780.51,253.13,0.0
gfx942,304,72192,4096,5120,ck,0,0,3744.5658,a8w8_blockscale_1x128x128_256x128x128x128_16x16_32x32_2x2_8x32x1_8x32x1_1x32x1x8_8_1x1_intrawave_v3,808.63,262.24,0.0
gfx942,304,72320,4096,5120,ck,0,0,3885.6857,a8w8_blockscale_1x128x128_256x128x128x128_16x16_32x32_2x2_8x32x1_8x32x1_1x32x1x8_8_1x1_intrawave_v3,780.64,253.16,0.0
gfx942,304,72448,4096,5120,ck,0,0,3934.5662,a8w8_blockscale_1x128x128_256x128x128x128_16x16_32x32_2x2_8x32x1_8x32x1_1x32x1x8_8_1x1_intrawave_v3,772.31,250.45,0.0
gfx942,304,72576,4096,5120,ck,0,0,3845.6514,a8w8_blockscale_1x128x128_256x128x128x128_16x16_32x32_2x2_8x32x1_8x32x1_1x32x1x8_8_1x1_intrawave_v3,791.56,256.68,0.0
gfx942,304,72704,4096,5120,ck,0,0,3838.9328,a8w8_blockscale_1x128x128_256x128x128x128_16x16_32x32_2x2_8x32x1_8x32x1_1x32x1x8_8_1x1_intrawave_v3,794.34,257.57,0.0
gfx942,304,72832,4096,5120,ck,0,0,3848.1748,a8w8_blockscale_1x128x128_256x128x128x128_16x16_32x32_2x2_8x32x1_8x32x1_1x32x1x8_8_1x1_intrawave_v3,793.83,257.4,0.0
gfx942,304,72960,4096,5120,ck,0,0,3870.1818,a8w8_blockscale_1x128x128_256x128x128x128_16x16_32x32_2x2_8x32x1_8x32x1_1x32x1x8_8_1x1_intrawave_v3,790.7,256.37,0.0
gfx942,304,73088,4096,5120,ck,0,0,3798.5174,a8w8_blockscale_1x128x128_256x128x128x128_16x16_32x32_2x2_8x32x1_8x32x1_1x32x1x8_8_1x1_intrawave_v3,807.03,261.66,0.0
gfx942,304,73216,4096,5120,ck,0,0,3877.5724,a8w8_blockscale_1x128x128_256x128x128x128_16x16_32x32_2x2_8x32x1_8x32x1_1x32x1x8_8_1x1_intrawave_v3,791.96,256.76,0.0
gfx942,304,73344,4096,5120,ck,0,0,3878.1293,a8w8_blockscale_1x128x128_256x128x128x128_16x16_32x32_2x2_8x32x1_8x32x1_1x32x1x8_8_1x1_intrawave_v3,793.24,257.17,0.0
gfx942,304,73472,4096,5120,ck,0,0,3813.3644,a8w8_blockscale_1x128x128_256x128x128x128_16x16_32x32_2x2_8x32x1_8x32x1_1x32x1x8_8_1x1_intrawave_v3,808.12,261.98,0.0
gfx942,304,73600,4096,5120,ck,0,0,3990.4115,a8w8_blockscale_1x128x128_256x128x128x128_16x16_32x32_2x2_8x32x1_8x32x1_1x32x1x8_8_1x1_intrawave_v3,773.61,250.78,0.0
gfx942,304,73728,4096,5120,ck,0,0,3971.3479,a8w8_blockscale_1x128x128_256x128x128x128_16x16_32x32_2x2_8x32x1_8x32x1_1x32x1x8_8_1x1_intrawave_v3,778.67,252.42,0.0
gfx942,304,73856,4096,5120,ck,0,0,3900.0067,a8w8_blockscale_1x128x128_256x128x128x128_16x16_32x32_2x2_8x32x1_8x32x1_1x32x1x8_8_1x1_intrawave_v3,794.29,257.47,0.0
gfx942,304,73984,4096,5120,ck,0,0,3841.1248,a8w8_blockscale_1x128x128_256x128x128x128_16x16_32x32_2x2_8x32x1_8x32x1_1x32x1x8_8_1x1_intrawave_v3,807.87,261.86,0.0
gfx942,304,74112,4096,5120,ck,0,0,4010.1884,a8w8_blockscale_1x128x128_256x128x128x128_16x16_32x32_2x2_8x32x1_8x32x1_1x32x1x8_8_1x1_intrawave_v3,775.15,251.25,0.0
gfx942,304,74240,4096,5120,ck,0,0,4021.7079,a8w8_blockscale_1x128x128_256x128x128x128_16x16_32x32_2x2_8x32x1_8x32x1_1x32x1x8_8_1x1_intrawave_v3,774.26,250.95,0.0
gfx942,304,74368,4096,5120,ck,0,0,3930.496,a8w8_blockscale_1x128x128_256x128x128x128_16x16_32x32_2x2_8x32x1_8x32x1_1x32x1x8_8_1x1_intrawave_v3,793.59,257.21,0.0
gfx942,304,74496,4096,5120,ck,0,0,3947.1947,a8w8_blockscale_1x128x128_256x128x128x128_16x16_32x32_2x2_8x32x1_8x32x1_1x32x1x8_8_1x1_intrawave_v3,791.6,256.55,0.0
gfx942,304,74624,4096,5120,ck,0,0,3878.2364,a8w8_blockscale_1x128x128_256x128x128x128_16x16_32x32_2x2_8x32x1_8x32x1_1x32x1x8_8_1x1_intrawave_v3,807.06,261.55,0.0
gfx942,304,74752,4096,5120,ck,0,0,3917.3326,a8w8_blockscale_1x128x128_256x128x128x128_16x16_32x32_2x2_8x32x1_8x32x1_1x32x1x8_8_1x1_intrawave_v3,800.37,259.38,0.0
gfx942,304,74880,4096,5120,ck,0,0,3941.3434,a8w8_blockscale_1x128x128_256x128x128x128_16x16_32x32_2x2_8x32x1_8x32x1_1x32x1x8_8_1x1_intrawave_v3,796.86,258.23,0.0
gfx942,304,75008,4096,5120,ck,0,0,3987.2941,a8w8_blockscale_1x128x128_256x128x128x128_16x16_32x32_2x2_8x32x1_8x32x1_1x32x1x8_8_1x1_intrawave_v3,789.02,255.68,0.0
gfx942,304,75136,4096,5120,ck,0,0,3878.4649,a8w8_blockscale_1x128x128_256x128x128x128_16x16_32x32_2x2_8x32x1_8x32x1_1x32x1x8_8_1x1_intrawave_v3,812.55,263.3,0.0
gfx942,304,75264,4096,5120,ck,0,0,3955.6969,a8w8_blockscale_1x128x128_256x128x128x128_16x16_32x32_2x2_8x32x1_8x32x1_1x32x1x8_8_1x1_intrawave_v3,798.04,258.59,0.0
gfx942,304,75392,4096,5120,ck,0,0,3995.7975,a8w8_blockscale_1x128x128_256x128x128x128_16x16_32x32_2x2_8x32x1_8x32x1_1x32x1x8_8_1x1_intrawave_v3,791.37,256.42,0.0
gfx942,304,75520,4096,5120,ck,0,0,3956.7503,a8w8_blockscale_1x128x128_256x128x128x128_16x16_32x32_2x2_8x32x1_8x32x1_1x32x1x8_8_1x1_intrawave_v3,800.54,259.38,0.0
gfx942,304,75648,4096,5120,ck,0,0,3975.0476,a8w8_blockscale_1x128x128_256x128x128x128_16x16_32x32_2x2_8x32x1_8x32x1_1x32x1x8_8_1x1_intrawave_v3,798.21,258.61,0.0
gfx942,304,75776,4096,5120,ck,0,0,4073.5931,a8w8_blockscale_1x128x128_256x128x128x128_16x16_32x32_2x2_8x32x1_8x32x1_1x32x1x8_8_1x1_intrawave_v3,780.21,252.77,0.0
gfx942,304,75904,4096,5120,ck,0,0,4083.0135,a8w8_blockscale_1x128x128_256x128x128x128_16x16_32x32_2x2_8x32x1_8x32x1_1x32x1x8_8_1x1_intrawave_v3,779.73,252.61,0.0
gfx942,304,76032,4096,5120,ck,0,0,4066.2579,a8w8_blockscale_1x128x128_256x128x128x128_16x16_32x32_2x2_8x32x1_8x32x1_1x32x1x8_8_1x1_intrawave_v3,784.26,254.07,0.0
gfx942,304,76160,4096,5120,ck,0,0,4096.1551,a8w8_blockscale_1x128x128_256x128x128x128_16x16_32x32_2x2_8x32x1_8x32x1_1x32x1x8_8_1x1_intrawave_v3,779.85,252.63,0.0
gfx942,304,76288,4096,5120,ck,0,0,4123.596,a8w8_blockscale_1x128x128_256x128x128x128_16x16_32x32_2x2_8x32x1_8x32x1_1x32x1x8_8_1x1_intrawave_v3,775.96,251.36,0.0
gfx942,304,76416,4096,5120,ck,0,0,4032.001,a8w8_blockscale_1x128x128_256x128x128x128_16x16_32x32_2x2_8x32x1_8x32x1_1x32x1x8_8_1x1_intrawave_v3,794.92,257.5,0.0
gfx942,304,76544,4096,5120,ck,0,0,4171.4937,a8w8_blockscale_1x128x128_256x128x128x128_16x16_32x32_2x2_8x32x1_8x32x1_1x32x1x8_8_1x1_intrawave_v3,769.63,249.29,0.0
gfx942,304,76672,4096,5120,ck,0,0,4054.337,a8w8_blockscale_1x128x128_256x128x128x128_16x16_32x32_2x2_8x32x1_8x32x1_1x32x1x8_8_1x1_intrawave_v3,793.19,256.92,0.0
gfx942,304,76800,4096,5120,ck,0,0,4156.9161,a8w8_blockscale_1x128x128_256x128x128x128_16x16_32x32_2x2_8x32x1_8x32x1_1x32x1x8_8_1x1_intrawave_v3,774.91,250.99,0.0
gfx942,304,76928,4096,5120,ck,0,0,4181.2796,a8w8_blockscale_1x128x128_256x128x128x128_16x16_32x32_2x2_8x32x1_8x32x1_1x32x1x8_8_1x1_intrawave_v3,771.68,249.93,0.0
gfx942,304,77056,4096,5120,ck,0,0,4077.5346,a8w8_blockscale_1x128x128_256x128x128x128_16x16_32x32_2x2_8x32x1_8x32x1_1x32x1x8_8_1x1_intrawave_v3,792.63,256.71,0.0
gfx942,304,77184,4096,5120,ck,0,0,4078.8389,a8w8_blockscale_1x128x128_256x128x128x128_16x16_32x32_2x2_8x32x1_8x32x1_1x32x1x8_8_1x1_intrawave_v3,793.69,257.04,0.0
gfx942,304,77312,4096,5120,ck,0,0,4115.5803,a8w8_blockscale_1x128x128_256x128x128x128_16x16_32x32_2x2_8x32x1_8x32x1_1x32x1x8_8_1x1_intrawave_v3,787.91,255.16,0.0
gfx942,304,77440,4096,5120,ck,0,0,4161.0503,a8w8_blockscale_1x128x128_256x128x128x128_16x16_32x32_2x2_8x32x1_8x32x1_1x32x1x8_8_1x1_intrawave_v3,780.59,252.79,0.0
gfx942,304,77568,4096,5120,ck,0,0,4238.2787,a8w8_blockscale_1x128x128_256x128x128x128_16x16_32x32_2x2_8x32x1_8x32x1_1x32x1x8_8_1x1_intrawave_v3,767.63,248.58,0.0
gfx942,304,77696,4096,5120,ck,0,0,4135.6783,a8w8_blockscale_1x128x128_256x128x128x128_16x16_32x32_2x2_8x32x1_8x32x1_1x32x1x8_8_1x1_intrawave_v3,787.97,255.16,0.0
gfx942,304,77824,4096,5120,ck,0,0,4171.6788,a8w8_blockscale_1x128x128_256x128x128x128_16x16_32x32_2x2_8x32x1_8x32x1_1x32x1x8_8_1x1_intrawave_v3,782.46,253.37,0.0
gfx942,304,77952,4096,5120,ck,0,0,4205.5915,a8w8_blockscale_1x128x128_256x128x128x128_16x16_32x32_2x2_8x32x1_8x32x1_1x32x1x8_8_1x1_intrawave_v3,777.43,251.73,0.0
gfx942,304,78080,4096,5120,ck,0,0,4111.2739,a8w8_blockscale_1x128x128_256x128x128x128_16x16_32x32_2x2_8x32x1_8x32x1_1x32x1x8_8_1x1_intrawave_v3,796.57,257.92,0.0
gfx942,304,78208,4096,5120,ck,0,0,4278.0886,a8w8_blockscale_1x128x128_256x128x128x128_16x16_32x32_2x2_8x32x1_8x32x1_1x32x1x8_8_1x1_intrawave_v3,766.76,248.26,0.0
gfx942,304,78336,4096,5120,ck,0,0,4249.0566,a8w8_blockscale_1x128x128_256x128x128x128_16x16_32x32_2x2_8x32x1_8x32x1_1x32x1x8_8_1x1_intrawave_v3,773.27,250.36,0.0
gfx942,304,78464,4096,5120,ck,0,0,4241.2439,a8w8_blockscale_1x128x128_256x128x128x128_16x16_32x32_2x2_8x32x1_8x32x1_1x32x1x8_8_1x1_intrawave_v3,775.96,251.22,0.0
gfx942,304,78592,4096,5120,ck,0,0,4172.4288,a8w8_blockscale_1x128x128_256x128x128x128_16x16_32x32_2x2_8x32x1_8x32x1_1x32x1x8_8_1x1_intrawave_v3,790.04,255.77,0.0
gfx942,304,78720,4096,5120,ck,0,0,4188.8916,a8w8_blockscale_1x128x128_256x128x128x128_16x16_32x32_2x2_8x32x1_8x32x1_1x32x1x8_8_1x1_intrawave_v3,788.22,255.17,0.0
gfx942,304,78848,4096,5120,ck,0,0,4255.4715,a8w8_blockscale_1x128x128_256x128x128x128_16x16_32x32_2x2_8x32x1_8x32x1_1x32x1x8_8_1x1_intrawave_v3,777.15,251.58,0.0
gfx942,304,78976,4096,5120,ck,0,0,4318.5922,a8w8_blockscale_1x128x128_256x128x128x128_16x16_32x32_2x2_8x32x1_8x32x1_1x32x1x8_8_1x1_intrawave_v3,767.03,248.3,0.0
gfx942,304,79104,4096,5120,ck,0,0,4194.6449,a8w8_blockscale_1x128x128_256x128x128x128_16x16_32x32_2x2_8x32x1_8x32x1_1x32x1x8_8_1x1_intrawave_v3,790.98,256.04,0.0
gfx942,304,79232,4096,5120,ck,0,0,4082.6313,a8w8_blockscale_1x128x128_256x128x128x128_16x16_32x32_2x2_8x32x1_8x32x1_1x32x1x8_8_1x1_intrawave_v3,813.99,263.48,0.0
gfx942,304,79360,4096,5120,ck,0,0,4188.8591,a8w8_blockscale_1x128x128_256x128x128x128_16x16_32x32_2x2_8x32x1_8x32x1_1x32x1x8_8_1x1_intrawave_v3,794.63,257.21,0.0
gfx942,304,79488,4096,5120,ck,0,0,4256.5911,a8w8_blockscale_1x128x128_256x128x128x128_16x16_32x32_2x2_8x32x1_8x32x1_1x32x1x8_8_1x1_intrawave_v3,783.25,253.52,0.0
gfx942,304,79616,4096,5120,ck,0,0,4352.8768,a8w8_blockscale_1x128x128_256x128x128x128_16x16_32x32_2x2_8x32x1_8x32x1_1x32x1x8_8_1x1_intrawave_v3,767.16,248.3,0.0
gfx942,304,79744,4096,5120,ck,0,0,4323.0543,a8w8_blockscale_1x128x128_256x128x128x128_16x16_32x32_2x2_8x32x1_8x32x1_1x32x1x8_8_1x1_intrawave_v3,773.69,250.41,0.0
gfx942,304,79872,4096,5120,ck,0,0,4323.3476,a8w8_blockscale_1x128x128_256x128x128x128_16x16_32x32_2x2_8x32x1_8x32x1_1x32x1x8_8_1x1_intrawave_v3,774.88,250.78,0.0
gfx942,304,80000,4096,5120,ck,0,0,4219.3572,a8w8_blockscale_1x128x128_256x128x128x128_16x16_32x32_2x2_8x32x1_8x32x1_1x32x1x8_8_1x1_intrawave_v3,795.25,257.37,0.0
gfx942,304,16,5120,1536,ck,8,0,7.7055,a8w8_blockscale_1x128x128_256x16x64x256_16x16_16x16_1x1_16x16x1_16x16x1_1x16x1x16_4_1x1_intrawave_v1,32.66,1045.06,0.0
gfx942,304,16,5120,4352,ck,8,0,14.5601,a8w8_blockscale_1x128x128_256x16x64x256_16x16_16x16_1x1_16x16x1_16x16x1_1x16x1x16_4_1x1_intrawave_v1,48.97,1546.4,0.0
gfx942,304,32,5120,1536,ck,8,0,7.9412,a8w8_blockscale_1x128x128_256x16x64x256_16x16_16x16_1x1_16x16x1_16x16x1_1x16x1x16_4_1x1_intrawave_v1,63.38,1037.77,0.0
gfx942,304,32,5120,4352,ck,8,0,14.84,a8w8_blockscale_1x128x128_256x16x64x256_16x16_16x16_1x1_16x16x1_16x16x1_1x16x1x16_4_1x1_intrawave_v1,96.1,1532.96,0.0
gfx942,304,48,5120,1536,ck,8,0,8.1489,a8w8_blockscale_1x128x128_256x16x64x256_16x16_16x16_1x1_16x16x1_16x16x1_1x16x1x16_4_1x1_intrawave_v1,92.65,1034.44,0.0
gfx942,304,48,5120,4352,ck,8,0,15.03,a8w8_blockscale_1x128x128_256x16x64x256_16x16_16x16_1x1_16x16x1_16x16x1_1x16x1x16_4_1x1_intrawave_v1,142.32,1529.12,0.0
gfx942,304,64,5120,1536,ck,13,0,9.2622,a8w8_blockscale_1x128x128_256x32x64x256_16x16_16x16_2x1_16x16x1_16x16x1_1x32x1x8_8_2x1_intrawave_v1,108.68,930.45,0.0
gfx942,304,64,5120,4352,ck,13,0,17.9335,a8w8_blockscale_1x128x128_256x32x64x256_16x16_16x16_2x1_16x16x1_16x16x1_1x32x1x8_8_2x1_intrawave_v1,159.04,1294.57,0.0
gfx942,304,80,5120,1536,ck,13,0,8.874,a8w8_blockscale_1x128x128_256x32x64x256_16x16_16x16_2x1_16x16x1_16x16x1_1x32x1x8_8_2x1_intrawave_v1,141.8,992.38,0.0
gfx942,304,80,5120,4352,ck,13,0,19.8828,a8w8_blockscale_1x128x128_256x32x64x256_16x16_16x16_2x1_16x16x1_16x16x1_1x32x1x8_8_2x1_intrawave_v1,179.31,1179.39,0.0
gfx942,304,96,5120,1536,ck,13,0,8.9979,a8w8_blockscale_1x128x128_256x32x64x256_16x16_16x16_2x1_16x16x1_16x16x1_1x32x1x8_8_2x1_intrawave_v1,167.81,999.66,0.0
gfx942,304,96,5120,4352,ck,13,0,18.9741,a8w8_blockscale_1x128x128_256x32x64x256_16x16_16x16_2x1_16x16x1_16x16x1_1x32x1x8_8_2x1_intrawave_v1,225.48,1248.18,0.0
gfx942,304,112,5120,1536,ck,7,0,10.7289,a8w8_blockscale_1x128x128_256x16x128x256_16x16_16x16_1x2_16x16x1_16x16x1_1x16x1x16_8_1x2_intrawave_v1,164.19,855.93,0.0
gfx942,304,112,5120,4352,ck,18,0,20.8449,a8w8_blockscale_1x128x128_256x64x64x256_16x16_32x32_1x1_16x16x1_16x16x1_1x32x1x8_8_1x1_intrawave_v1,239.45,1147.36,0.0
gfx942,304,128,5120,1536,ck,18,0,10.5451,a8w8_blockscale_1x128x128_256x64x64x256_16x16_32x32_1x1_16x16x1_16x16x1_1x32x1x8_8_1x1_intrawave_v1,190.92,888.72,0.0
gfx942,304,128,5120,4352,ck,18,0,19.4969,a8w8_blockscale_1x128x128_256x64x64x256_16x16_32x32_1x1_16x16x1_16x16x1_1x32x1x8_8_1x1_intrawave_v1,292.57,1238.66,0.0
gfx942,304,144,5120,1536,ck,3,0,11.9193,a8w8_blockscale_1x128x128_256x64x64x128_16x16_32x32_1x1_8x32x1_8x32x1_1x32x1x8_8_1x1_intrawave_v3,190.02,802.07,0.0
gfx942,304,144,5120,4352,ck,3,0,25.0383,a8w8_blockscale_1x128x128_256x64x64x128_16x16_32x32_1x1_8x32x1_8x32x1_1x32x1x8_8_1x1_intrawave_v3,256.3,973.85,0.0
gfx942,304,160,5120,1536,ck,12,0,11.5233,a8w8_blockscale_1x128x128_256x32x128x256_16x16_32x32_1x1_16x16x1_16x16x1_1x32x1x8_8_1x1_intrawave_v1,218.39,845.98,0.0
gfx942,304,160,5120,4352,ck,3,0,24.9716,a8w8_blockscale_1x128x128_256x64x64x128_16x16_32x32_1x1_8x32x1_8x32x1_1x32x1x8_8_1x1_intrawave_v3,285.54,985.8,0.0
gfx942,304,176,5120,1536,ck,18,0,11.8413,a8w8_blockscale_1x128x128_256x64x64x256_16x16_32x32_1x1_16x16x1_16x16x1_1x32x1x8_8_1x1_intrawave_v1,233.78,839.17,0.0
gfx942,304,176,5120,4352,ck,3,0,25.913,a8w8_blockscale_1x128x128_256x64x64x128_16x16_32x32_1x1_8x32x1_8x32x1_1x32x1x8_8_1x1_intrawave_v3,302.68,958.99,0.0
gfx942,304,192,5120,1536,ck,18,0,11.231,a8w8_blockscale_1x128x128_256x64x64x256_16x16_32x32_1x1_16x16x1_16x16x1_1x32x1x8_8_1x1_intrawave_v1,268.89,901.55,0.0
gfx942,304,192,5120,4352,ck,18,0,24.0322,a8w8_blockscale_1x128x128_256x64x64x256_16x16_32x32_1x1_16x16x1_16x16x1_1x32x1x8_8_1x1_intrawave_v1,356.04,1043.76,0.0
gfx942,304,208,5120,1536,ck,12,0,13.6392,a8w8_blockscale_1x128x128_256x32x128x256_16x16_32x32_1x1_16x16x1_16x16x1_1x32x1x8_8_1x1_intrawave_v1,239.86,756.18,0.0
gfx942,304,208,5120,4352,ck,12,0,30.0034,a8w8_blockscale_1x128x128_256x32x128x256_16x16_32x32_1x1_16x16x1_16x16x1_1x32x1x8_8_1x1_intrawave_v1,308.95,843.82,0.0
gfx942,304,224,5120,1536,ck,12,0,13.4541,a8w8_blockscale_1x128x128_256x32x128x256_16x16_32x32_1x1_16x16x1_16x16x1_1x32x1x8_8_1x1_intrawave_v1,261.87,780.59,0.0
gfx942,304,224,5120,4352,ck,12,0,29.5466,a8w8_blockscale_1x128x128_256x32x128x256_16x16_32x32_1x1_16x16x1_16x16x1_1x32x1x8_8_1x1_intrawave_v1,337.85,864.76,0.0
gfx942,304,240,5120,1536,ck,3,0,15.2027,a8w8_blockscale_1x128x128_256x64x64x128_16x16_32x32_1x1_8x32x1_8x32x1_1x32x1x8_8_1x1_intrawave_v3,248.3,703.2,0.0
gfx942,304,240,5120,4352,ck,2,0,31.9583,a8w8_blockscale_1x128x128_256x64x128x128_16x16_32x32_1x2_8x32x1_8x32x1_1x32x1x8_8_1x1_intrawave_v3,334.67,806.81,0.0
gfx942,304,256,5120,1536,ck,3,0,15.074,a8w8_blockscale_1x128x128_256x64x64x128_16x16_32x32_1x1_8x32x1_8x32x1_1x32x1x8_8_1x1_intrawave_v3,267.12,721.7,0.0
gfx942,304,256,5120,4352,ck,2,0,30.8128,a8w8_blockscale_1x128x128_256x64x128x128_16x16_32x32_1x2_8x32x1_8x32x1_1x32x1x8_8_1x1_intrawave_v3,370.25,844.38,0.0
gfx942,304,288,5120,1536,ck,2,0,16.7371,a8w8_blockscale_1x128x128_256x64x128x128_16x16_32x32_1x2_8x32x1_8x32x1_1x32x1x8_8_1x1_intrawave_v3,270.65,672.51,0.0
gfx942,304,288,5120,4352,ck,2,0,34.8156,a8w8_blockscale_1x128x128_256x64x128x128_16x16_32x32_1x2_8x32x1_8x32x1_1x32x1x8_8_1x1_intrawave_v3,368.64,760.71,0.0
gfx942,304,320,5120,1536,ck,2,0,17.7152,a8w8_blockscale_1x128x128_256x64x128x128_16x16_32x32_1x2_8x32x1_8x32x1_1x32x1x8_8_1x1_intrawave_v3,284.12,656.65,0.0
gfx942,304,320,5120,4352,ck,2,0,35.2228,a8w8_blockscale_1x128x128_256x64x128x128_16x16_32x32_1x2_8x32x1_8x32x1_1x32x1x8_8_1x1_intrawave_v3,404.87,765.18,0.0
gfx942,304,352,5120,1536,ck,2,0,17.9708,a8w8_blockscale_1x128x128_256x64x128x128_16x16_32x32_1x2_8x32x1_8x32x1_1x32x1x8_8_1x1_intrawave_v3,308.08,668.28,0.0
gfx942,304,352,5120,4352,ck,2,0,37.3371,a8w8_blockscale_1x128x128_256x64x128x128_16x16_32x32_1x2_8x32x1_8x32x1_1x32x1x8_8_1x1_intrawave_v3,420.14,734.35,0.0
gfx942,304,384,5120,1536,ck,2,0,18.53,a8w8_blockscale_1x128x128_256x64x128x128_16x16_32x32_1x2_8x32x1_8x32x1_1x32x1x8_8_1x1_intrawave_v3,325.95,668.45,0.0
gfx942,304,384,5120,4352,ck,2,0,37.7072,a8w8_blockscale_1x128x128_256x64x128x128_16x16_32x32_1x2_8x32x1_8x32x1_1x32x1x8_8_1x1_intrawave_v3,453.83,739.53,0.0
gfx942,304,416,5120,1536,ck,2,0,19.3088,a8w8_blockscale_1x128x128_256x64x128x128_16x16_32x32_1x2_8x32x1_8x32x1_1x32x1x8_8_1x1_intrawave_v3,338.87,661.0,0.0
gfx942,304,416,5120,4352,ck,2,0,38.8746,a8w8_blockscale_1x128x128_256x64x128x128_16x16_32x32_1x2_8x32x1_8x32x1_1x32x1x8_8_1x1_intrawave_v3,476.89,729.33,0.0
gfx942,304,448,5120,1536,ck,2,0,19.6165,a8w8_blockscale_1x128x128_256x64x128x128_16x16_32x32_1x2_8x32x1_8x32x1_1x32x1x8_8_1x1_intrawave_v3,359.21,669.84,0.0
gfx942,304,448,5120,4352,ck,2,0,38.9066,a8w8_blockscale_1x128x128_256x64x128x128_16x16_32x32_1x2_8x32x1_8x32x1_1x32x1x8_8_1x1_intrawave_v3,513.15,740.73,0.0
gfx942,304,480,5120,1536,ck,0,0,23.892,a8w8_blockscale_1x128x128_256x128x128x128_16x16_32x32_2x2_8x32x1_8x32x1_1x32x1x8_8_1x1_intrawave_v3,315.99,565.75,0.0
gfx942,304,480,5120,4352,ck,0,0,46.3829,a8w8_blockscale_1x128x128_256x128x128x128_16x16_32x32_2x2_8x32x1_8x32x1_1x32x1x8_8_1x1_intrawave_v3,461.18,631.41,0.0
gfx942,304,512,5120,1536,ck,3,0,24.3711,a8w8_blockscale_1x128x128_256x64x64x128_16x16_32x32_1x1_8x32x1_8x32x1_1x32x1x8_8_1x1_intrawave_v3,330.43,570.09,0.0
gfx942,304,512,5120,4352,ck,0,0,48.1651,a8w8_blockscale_1x128x128_256x128x128x128_16x16_32x32_2x2_8x32x1_8x32x1_1x32x1x8_8_1x1_intrawave_v3,473.73,617.74,0.0
gfx942,304,544,5120,1536,ck,0,0,24.5646,a8w8_blockscale_1x128x128_256x128x128x128_16x16_32x32_2x2_8x32x1_8x32x1_1x32x1x8_8_1x1_intrawave_v3,348.32,580.94,0.0
gfx942,304,544,5120,4352,ck,0,0,49.5744,a8w8_blockscale_1x128x128_256x128x128x128_16x16_32x32_2x2_8x32x1_8x32x1_1x32x1x8_8_1x1_intrawave_v3,489.02,609.59,0.0
gfx942,304,576,5120,1536,ck,0,0,24.4672,a8w8_blockscale_1x128x128_256x128x128x128_16x16_32x32_2x2_8x32x1_8x32x1_1x32x1x8_8_1x1_intrawave_v3,370.28,598.65,0.0
gfx942,304,576,5120,4352,ck,0,0,51.3856,a8w8_blockscale_1x128x128_256x128x128x128_16x16_32x32_2x2_8x32x1_8x32x1_1x32x1x8_8_1x1_intrawave_v3,499.54,597.2,0.0
gfx942,304,608,5120,1536,ck,0,0,25.6342,a8w8_blockscale_1x128x128_256x128x128x128_16x16_32x32_2x2_8x32x1_8x32x1_1x32x1x8_8_1x1_intrawave_v3,373.06,586.1,0.0
gfx942,304,608,5120,4352,ck,0,0,50.0795,a8w8_blockscale_1x128x128_256x128x128x128_16x16_32x32_2x2_8x32x1_8x32x1_1x32x1x8_8_1x1_intrawave_v3,541.04,622.09,0.0
gfx942,304,640,5120,1536,ck,0,0,26.5721,a8w8_blockscale_1x128x128_256x128x128x128_16x16_32x32_2x2_8x32x1_8x32x1_1x32x1x8_8_1x1_intrawave_v3,378.83,579.59,0.0
gfx942,304,640,5120,4352,ck,0,0,52.3033,a8w8_blockscale_1x128x128_256x128x128x128_16x16_32x32_2x2_8x32x1_8x32x1_1x32x1x8_8_1x1_intrawave_v3,545.31,604.57,0.0
gfx942,304,672,5120,1536,ck,0,0,26.2006,a8w8_blockscale_1x128x128_256x128x128x128_16x16_32x32_2x2_8x32x1_8x32x1_1x32x1x8_8_1x1_intrawave_v3,403.41,602.19,0.0
gfx942,304,672,5120,4352,ck,0,0,53.0286,a8w8_blockscale_1x128x128_256x128x128x128_16x16_32x32_2x2_8x32x1_8x32x1_1x32x1x8_8_1x1_intrawave_v3,564.74,605.11,0.0
gfx942,304,704,5120,1536,ck,0,0,26.6877,a8w8_blockscale_1x128x128_256x128x128x128_16x16_32x32_2x2_8x32x1_8x32x1_1x32x1x8_8_1x1_intrawave_v3,414.91,605.32,0.0
gfx942,304,704,5120,4352,ck,0,0,54.4965,a8w8_blockscale_1x128x128_256x128x128x128_16x16_32x32_2x2_8x32x1_8x32x1_1x32x1x8_8_1x1_intrawave_v3,575.7,597.38,0.0
gfx942,304,736,5120,1536,ck,0,0,27.6355,a8w8_blockscale_1x128x128_256x128x128x128_16x16_32x32_2x2_8x32x1_8x32x1_1x32x1x8_8_1x1_intrawave_v3,418.89,598.2,0.0
gfx942,304,736,5120,4352,ck,0,0,53.1201,a8w8_blockscale_1x128x128_256x128x128x128_16x16_32x32_2x2_8x32x1_8x32x1_1x32x1x8_8_1x1_intrawave_v3,617.46,621.65,0.0
gfx942,304,768,5120,1536,ck,0,0,28.2004,a8w8_blockscale_1x128x128_256x128x128x128_16x16_32x32_2x2_8x32x1_8x32x1_1x32x1x8_8_1x1_intrawave_v3,428.35,599.58,0.0
gfx942,304,768,5120,4352,ck,0,0,55.1515,a8w8_blockscale_1x128x128_256x128x128x128_16x16_32x32_2x2_8x32x1_8x32x1_1x32x1x8_8_1x1_intrawave_v3,620.57,607.22,0.0
gfx942,304,800,5120,1536,ck,0,0,27.9564,a8w8_blockscale_1x128x128_256x128x128x128_16x16_32x32_2x2_8x32x1_8x32x1_1x32x1x8_8_1x1_intrawave_v3,450.09,618.29,0.0
gfx942,304,800,5120,4352,ck,0,0,57.41,a8w8_blockscale_1x128x128_256x128x128x128_16x16_32x32_2x2_8x32x1_8x32x1_1x32x1x8_8_1x1_intrawave_v3,621.0,591.46,0.0
gfx942,304,832,5120,1536,ck,0,0,28.7328,a8w8_blockscale_1x128x128_256x128x128x128_16x16_32x32_2x2_8x32x1_8x32x1_1x32x1x8_8_1x1_intrawave_v3,455.45,614.7,0.0
gfx942,304,832,5120,4352,ck,0,0,57.8843,a8w8_blockscale_1x128x128_256x128x128x128_16x16_32x32_2x2_8x32x1_8x32x1_1x32x1x8_8_1x1_intrawave_v3,640.55,594.68,0.0
gfx942,304,864,5120,1536,ck,0,0,28.9238,a8w8_blockscale_1x128x128_256x128x128x128_16x16_32x32_2x2_8x32x1_8x32x1_1x32x1x8_8_1x1_intrawave_v3,469.84,623.67,0.0
gfx942,304,864,5120,4352,ck,0,0,58.2079,a8w8_blockscale_1x128x128_256x128x128x128_16x16_32x32_2x2_8x32x1_8x32x1_1x32x1x8_8_1x1_intrawave_v3,661.49,599.4,0.0
gfx942,304,896,5120,1536,ck,0,0,29.5944,a8w8_blockscale_1x128x128_256x128x128x128_16x16_32x32_2x2_8x32x1_8x32x1_1x32x1x8_8_1x1_intrawave_v3,476.2,622.27,0.0
gfx942,304,896,5120,4352,ck,0,0,58.3918,a8w8_blockscale_1x128x128_256x128x128x128_16x16_32x32_2x2_8x32x1_8x32x1_1x32x1x8_8_1x1_intrawave_v3,683.83,605.51,0.0
gfx942,304,928,5120,1536,ck,2,0,32.3409,a8w8_blockscale_1x128x128_256x64x128x128_16x16_32x32_1x2_8x32x1_8x32x1_1x32x1x8_8_1x1_intrawave_v3,451.32,581.07,0.0
gfx942,304,928,5120,4352,ck,14,0,72.0127,a8w8_blockscale_1x128x128_256x64x256x128_16x16_32x32_2x2_8x32x1_8x32x1_1x32x1x8_8_1x1_intrawave_v1,574.29,497.46,0.0
gfx942,304,960,5120,1536,ck,2,0,32.2295,a8w8_blockscale_1x128x128_256x64x128x128_16x16_32x32_1x2_8x32x1_8x32x1_1x32x1x8_8_1x1_intrawave_v3,468.5,594.77,0.0
gfx942,304,960,5120,4352,ck,14,0,71.4022,a8w8_blockscale_1x128x128_256x64x256x128_16x16_32x32_2x2_8x32x1_8x32x1_1x32x1x8_8_1x1_intrawave_v1,599.17,508.26,0.0
gfx942,304,992,5120,1536,ck,0,0,38.726,a8w8_blockscale_1x128x128_256x128x128x128_16x16_32x32_2x2_8x32x1_8x32x1_1x32x1x8_8_1x1_intrawave_v3,402.9,504.73,0.0
gfx942,304,992,5120,4352,ck,0,0,86.1852,a8w8_blockscale_1x128x128_256x128x128x128_16x16_32x32_2x2_8x32x1_8x32x1_1x32x1x8_8_1x1_intrawave_v3,512.94,426.49,0.0
gfx942,304,1024,5120,1536,ck,0,0,39.0649,a8w8_blockscale_1x128x128_256x128x128x128_16x16_32x32_2x2_8x32x1_8x32x1_1x32x1x8_8_1x1_intrawave_v3,412.29,510.0,0.0
gfx942,304,1024,5120,4352,ck,0,0,85.4431,a8w8_blockscale_1x128x128_256x128x128x128_16x16_32x32_2x2_8x32x1_8x32x1_1x32x1x8_8_1x1_intrawave_v3,534.09,435.66,0.0
gfx942,304,1088,5120,1536,ck,0,0,39.4301,a8w8_blockscale_1x128x128_256x128x128x128_16x16_32x32_2x2_8x32x1_8x32x1_1x32x1x8_8_1x1_intrawave_v3,434.0,524.39,0.0
gfx942,304,1088,5120,4352,ck,0,0,87.6116,a8w8_blockscale_1x128x128_256x128x128x128_16x16_32x32_2x2_8x32x1_8x32x1_1x32x1x8_8_1x1_intrawave_v3,553.42,435.54,0.0
gfx942,304,1152,5120,1536,ck,0,0,40.7729,a8w8_blockscale_1x128x128_256x128x128x128_16x16_32x32_2x2_8x32x1_8x32x1_1x32x1x8_8_1x1_intrawave_v3,444.4,525.6,0.0
gfx942,304,1152,5120,4352,ck,0,0,86.9058,a8w8_blockscale_1x128x128_256x128x128x128_16x16_32x32_2x2_8x32x1_8x32x1_1x32x1x8_8_1x1_intrawave_v3,590.73,449.82,0.0
gfx942,304,1216,5120,1536,ck,0,0,41.5569,a8w8_blockscale_1x128x128_256x128x128x128_16x16_32x32_2x2_8x32x1_8x32x1_1x32x1x8_8_1x1_intrawave_v3,460.24,533.82,0.0
gfx942,304,1216,5120,4352,ck,0,0,87.3004,a8w8_blockscale_1x128x128_256x128x128x128_16x16_32x32_2x2_8x32x1_8x32x1_1x32x1x8_8_1x1_intrawave_v3,620.73,458.49,0.0
gfx942,304,1280,5120,1536,ck,0,0,41.3343,a8w8_blockscale_1x128x128_256x128x128x128_16x16_32x32_2x2_8x32x1_8x32x1_1x32x1x8_8_1x1_intrawave_v3,487.07,554.93,0.0
gfx942,304,1280,5120,4352,ck,0,0,88.6082,a8w8_blockscale_1x128x128_256x128x128x128_16x16_32x32_2x2_8x32x1_8x32x1_1x32x1x8_8_1x1_intrawave_v3,643.76,462.26,0.0
gfx942,304,1344,5120,1536,ck,0,0,42.3373,a8w8_blockscale_1x128x128_256x128x128x128_16x16_32x32_2x2_8x32x1_8x32x1_1x32x1x8_8_1x1_intrawave_v3,499.31,559.58,0.0
gfx942,304,1344,5120,4352,ck,0,0,91.9636,a8w8_blockscale_1x128x128_256x128x128x128_16x16_32x32_2x2_8x32x1_8x32x1_1x32x1x8_8_1x1_intrawave_v3,651.29,455.55,0.0
gfx942,304,1408,5120,1536,ck,0,0,42.7599,a8w8_blockscale_1x128x128_256x128x128x128_16x16_32x32_2x2_8x32x1_8x32x1_1x32x1x8_8_1x1_intrawave_v3,517.91,571.68,0.0
gfx942,304,1408,5120,4352,ck,0,0,89.8657,a8w8_blockscale_1x128x128_256x128x128x128_16x16_32x32_2x2_8x32x1_8x32x1_1x32x1x8_8_1x1_intrawave_v3,698.23,476.58,0.0
gfx942,304,1472,5120,1536,ck,0,0,43.9903,a8w8_blockscale_1x128x128_256x128x128x128_16x16_32x32_2x2_8x32x1_8x32x1_1x32x1x8_8_1x1_intrawave_v3,526.31,572.82,0.0
gfx942,304,1472,5120,4352,ck,0,0,94.1974,a8w8_blockscale_1x128x128_256x128x128x128_16x16_32x32_2x2_8x32x1_8x32x1_1x32x1x8_8_1x1_intrawave_v3,696.4,464.57,0.0
gfx942,304,1536,5120,1536,ck,0,0,44.369,a8w8_blockscale_1x128x128_256x128x128x128_16x16_32x32_2x2_8x32x1_8x32x1_1x32x1x8_8_1x1_intrawave_v3,544.51,584.92,0.0
gfx942,304,1536,5120,4352,ck,0,0,93.1607,a8w8_blockscale_1x128x128_256x128x128x128_16x16_32x32_2x2_8x32x1_8x32x1_1x32x1x8_8_1x1_intrawave_v3,734.76,479.77,0.0
gfx942,304,1600,5120,1536,ck,0,0,45.2539,a8w8_blockscale_1x128x128_256x128x128x128_16x16_32x32_2x2_8x32x1_8x32x1_1x32x1x8_8_1x1_intrawave_v3,556.1,590.14,0.0
gfx942,304,1600,5120,4352,ck,0,0,96.7179,a8w8_blockscale_1x128x128_256x128x128x128_16x16_32x32_2x2_8x32x1_8x32x1_1x32x1x8_8_1x1_intrawave_v3,737.23,471.78,0.0
gfx942,304,1664,5120,1536,ck,0,0,46.2985,a8w8_blockscale_1x128x128_256x128x128x128_16x16_32x32_2x2_8x32x1_8x32x1_1x32x1x8_8_1x1_intrawave_v3,565.3,593.1,0.0
gfx942,304,1664,5120,4352,ck,0,0,97.6751,a8w8_blockscale_1x128x128_256x128x128x128_16x16_32x32_2x2_8x32x1_8x32x1_1x32x1x8_8_1x1_intrawave_v3,759.2,476.72,0.0
gfx942,304,1728,5120,1536,ck,0,0,48.0029,a8w8_blockscale_1x128x128_256x128x128x128_16x16_32x32_2x2_8x32x1_8x32x1_1x32x1x8_8_1x1_intrawave_v3,566.2,587.74,0.0
gfx942,304,1728,5120,4352,ck,0,0,107.7225,a8w8_blockscale_1x128x128_256x128x128x128_16x16_32x32_2x2_8x32x1_8x32x1_1x32x1x8_8_1x1_intrawave_v3,714.87,440.92,0.0
gfx942,304,1792,5120,1536,ck,0,0,47.3028,a8w8_blockscale_1x128x128_256x128x128x128_16x16_32x32_2x2_8x32x1_8x32x1_1x32x1x8_8_1x1_intrawave_v3,595.86,612.37,0.0
gfx942,304,1792,5120,4352,ck,0,0,106.6428,a8w8_blockscale_1x128x128_256x128x128x128_16x16_32x32_2x2_8x32x1_8x32x1_1x32x1x8_8_1x1_intrawave_v3,748.85,454.14,0.0
gfx942,304,1856,5120,1536,ck,0,0,49.6578,a8w8_blockscale_1x128x128_256x128x128x128_16x16_32x32_2x2_8x32x1_8x32x1_1x32x1x8_8_1x1_intrawave_v3,587.87,598.51,0.0
gfx942,304,1856,5120,4352,ck,0,0,105.7307,a8w8_blockscale_1x128x128_256x128x128x128_16x16_32x32_2x2_8x32x1_8x32x1_1x32x1x8_8_1x1_intrawave_v3,782.29,466.89,0.0
gfx942,304,1920,5120,1536,ck,0,0,49.7287,a8w8_blockscale_1x128x128_256x128x128x128_16x16_32x32_2x2_8x32x1_8x32x1_1x32x1x8_8_1x1_intrawave_v3,607.27,612.81,0.0
gfx942,304,1920,5120,4352,ck,0,0,102.2992,a8w8_blockscale_1x128x128_256x128x128x128_16x16_32x32_2x2_8x32x1_8x32x1_1x32x1x8_8_1x1_intrawave_v3,836.41,491.68,0.0
gfx942,304,1984,5120,1536,ck,0,0,63.5405,a8w8_blockscale_1x128x128_256x128x128x128_16x16_32x32_2x2_8x32x1_8x32x1_1x32x1x8_8_1x1_intrawave_v3,491.11,491.46,0.0
gfx942,304,1984,5120,4352,ck,0,0,136.3959,a8w8_blockscale_1x128x128_256x128x128x128_16x16_32x32_2x2_8x32x1_8x32x1_1x32x1x8_8_1x1_intrawave_v3,648.23,375.62,0.0
gfx942,304,2048,5120,1536,ck,0,0,63.5299,a8w8_blockscale_1x128x128_256x128x128x128_16x16_32x32_2x2_8x32x1_8x32x1_1x32x1x8_8_1x1_intrawave_v3,507.04,503.41,0.0
gfx942,304,2048,5120,4352,ck,0,0,138.7838,a8w8_blockscale_1x128x128_256x128x128x128_16x16_32x32_2x2_8x32x1_8x32x1_1x32x1x8_8_1x1_intrawave_v3,657.63,375.88,0.0
gfx942,304,2112,5120,1536,ck,0,0,63.1111,a8w8_blockscale_1x128x128_256x128x128x128_16x16_32x32_2x2_8x32x1_8x32x1_1x32x1x8_8_1x1_intrawave_v3,526.36,518.69,0.0
gfx942,304,2112,5120,4352,ck,0,0,139.7142,a8w8_blockscale_1x128x128_256x128x128x128_16x16_32x32_2x2_8x32x1_8x32x1_1x32x1x8_8_1x1_intrawave_v3,673.66,380.07,0.0
gfx942,304,2176,5120,1536,ck,0,0,63.4652,a8w8_blockscale_1x128x128_256x128x128x128_16x16_32x32_2x2_8x32x1_8x32x1_1x32x1x8_8_1x1_intrawave_v3,539.28,527.67,0.0
gfx942,304,2176,5120,4352,ck,0,0,142.1537,a8w8_blockscale_1x128x128_256x128x128x128_16x16_32x32_2x2_8x32x1_8x32x1_1x32x1x8_8_1x1_intrawave_v3,682.17,380.11,0.0
gfx942,304,2240,5120,1536,ck,0,0,63.3456,a8w8_blockscale_1x128x128_256x128x128x128_16x16_32x32_2x2_8x32x1_8x32x1_1x32x1x8_8_1x1_intrawave_v3,556.19,540.57,0.0
gfx942,304,2240,5120,4352,ck,0,0,143.8392,a8w8_blockscale_1x128x128_256x128x128x128_16x16_32x32_2x2_8x32x1_8x32x1_1x32x1x8_8_1x1_intrawave_v3,694.0,382.15,0.0
gfx942,304,2304,5120,1536,ck,0,0,64.386,a8w8_blockscale_1x128x128_256x128x128x128_16x16_32x32_2x2_8x32x1_8x32x1_1x32x1x8_8_1x1_intrawave_v3,562.84,543.54,0.0
gfx942,304,2304,5120,4352,ck,0,0,139.0717,a8w8_blockscale_1x128x128_256x128x128x128_16x16_32x32_2x2_8x32x1_8x32x1_1x32x1x8_8_1x1_intrawave_v3,738.3,401.97,0.0
gfx942,304,2368,5120,1536,ck,0,0,64.8433,a8w8_blockscale_1x128x128_256x128x128x128_16x16_32x32_2x2_8x32x1_8x32x1_1x32x1x8_8_1x1_intrawave_v3,574.39,551.33,0.0
gfx942,304,2368,5120,4352,ck,0,0,144.4543,a8w8_blockscale_1x128x128_256x128x128x128_16x16_32x32_2x2_8x32x1_8x32x1_1x32x1x8_8_1x1_intrawave_v3,730.53,393.45,0.0
gfx942,304,2432,5120,1536,ck,0,0,64.7104,a8w8_blockscale_1x128x128_256x128x128x128_16x16_32x32_2x2_8x32x1_8x32x1_1x32x1x8_8_1x1_intrawave_v3,591.13,564.11,0.0
gfx942,304,2432,5120,4352,ck,0,0,148.7084,a8w8_blockscale_1x128x128_256x128x128x128_16x16_32x32_2x2_8x32x1_8x32x1_1x32x1x8_8_1x1_intrawave_v3,728.81,388.48,0.0
gfx942,304,2496,5120,1536,ck,0,0,65.7574,a8w8_blockscale_1x128x128_256x128x128x128_16x16_32x32_2x2_8x32x1_8x32x1_1x32x1x8_8_1x1_intrawave_v3,597.02,566.59,0.0
gfx942,304,2496,5120,4352,ck,0,0,154.1306,a8w8_blockscale_1x128x128_256x128x128x128_16x16_32x32_2x2_8x32x1_8x32x1_1x32x1x8_8_1x1_intrawave_v3,721.68,380.87,0.0
gfx942,304,2560,5120,1536,ck,0,0,64.5848,a8w8_blockscale_1x128x128_256x128x128x128_16x16_32x32_2x2_8x32x1_8x32x1_1x32x1x8_8_1x1_intrawave_v3,623.45,588.54,0.0
gfx942,304,2560,5120,4352,ck,0,0,146.1445,a8w8_blockscale_1x128x128_256x128x128x128_16x16_32x32_2x2_8x32x1_8x32x1_1x32x1x8_8_1x1_intrawave_v3,780.63,408.07,0.0
gfx942,304,2624,5120,1536,ck,0,0,67.9112,a8w8_blockscale_1x128x128_256x128x128x128_16x16_32x32_2x2_8x32x1_8x32x1_1x32x1x8_8_1x1_intrawave_v3,607.73,570.81,0.0
gfx942,304,2624,5120,4352,ck,0,0,156.1342,a8w8_blockscale_1x128x128_256x128x128x128_16x16_32x32_2x2_8x32x1_8x32x1_1x32x1x8_8_1x1_intrawave_v3,748.95,387.95,0.0
gfx942,304,2688,5120,1536,ck,0,0,67.9619,a8w8_blockscale_1x128x128_256x128x128x128_16x16_32x32_2x2_8x32x1_8x32x1_1x32x1x8_8_1x1_intrawave_v3,622.09,581.48,0.0
gfx942,304,2688,5120,4352,ck,0,0,154.6762,a8w8_blockscale_1x128x128_256x128x128x128_16x16_32x32_2x2_8x32x1_8x32x1_1x32x1x8_8_1x1_intrawave_v3,774.45,397.64,0.0
gfx942,304,2752,5120,1536,ck,0,0,68.8435,a8w8_blockscale_1x128x128_256x128x128x128_16x16_32x32_2x2_8x32x1_8x32x1_1x32x1x8_8_1x1_intrawave_v3,628.75,584.98,0.0
gfx942,304,2752,5120,4352,ck,0,0,155.8329,a8w8_blockscale_1x128x128_256x128x128x128_16x16_32x32_2x2_8x32x1_8x32x1_1x32x1x8_8_1x1_intrawave_v3,787.01,400.68,0.0
gfx942,304,2816,5120,1536,ck,0,0,66.5362,a8w8_blockscale_1x128x128_256x128x128x128_16x16_32x32_2x2_8x32x1_8x32x1_1x32x1x8_8_1x1_intrawave_v3,665.68,616.59,0.0
gfx942,304,2816,5120,4352,ck,0,0,152.6156,a8w8_blockscale_1x128x128_256x128x128x128_16x16_32x32_2x2_8x32x1_8x32x1_1x32x1x8_8_1x1_intrawave_v3,822.29,415.25,0.0
gfx942,304,2880,5120,1536,ck,0,0,78.9678,a8w8_blockscale_1x128x128_256x128x128x128_16x16_32x32_2x2_8x32x1_8x32x1_1x32x1x8_8_1x1_intrawave_v3,573.63,529.07,0.0
gfx942,304,2880,5120,4352,ck,0,0,183.3126,a8w8_blockscale_1x128x128_256x128x128x128_16x16_32x32_2x2_8x32x1_8x32x1_1x32x1x8_8_1x1_intrawave_v3,700.15,350.81,0.0
gfx942,304,2944,5120,1536,ck,0,0,81.2353,a8w8_blockscale_1x128x128_256x128x128x128_16x16_32x32_2x2_8x32x1_8x32x1_1x32x1x8_8_1x1_intrawave_v3,570.01,523.58,0.0
gfx942,304,2944,5120,4352,ck,0,0,180.9229,a8w8_blockscale_1x128x128_256x128x128x128_16x16_32x32_2x2_8x32x1_8x32x1_1x32x1x8_8_1x1_intrawave_v3,725.16,360.6,0.0
gfx942,304,3008,5120,1536,ck,0,0,81.5535,a8w8_blockscale_1x128x128_256x128x128x128_16x16_32x32_2x2_8x32x1_8x32x1_1x32x1x8_8_1x1_intrawave_v3,580.13,530.77,0.0
gfx942,304,3008,5120,4352,ck,0,0,185.0791,a8w8_blockscale_1x128x128_256x128x128x128_16x16_32x32_2x2_8x32x1_8x32x1_1x32x1x8_8_1x1_intrawave_v3,724.28,357.55,0.0
gfx942,304,3072,5120,1536,ck,0,0,80.7506,a8w8_blockscale_1x128x128_256x128x128x128_16x16_32x32_2x2_8x32x1_8x32x1_1x32x1x8_8_1x1_intrawave_v3,598.37,545.39,0.0
gfx942,304,3072,5120,4352,ck,0,0,182.0933,a8w8_blockscale_1x128x128_256x128x128x128_16x16_32x32_2x2_8x32x1_8x32x1_1x32x1x8_8_1x1_intrawave_v3,751.82,368.54,0.0
gfx942,304,3136,5120,1536,ck,0,0,79.1964,a8w8_blockscale_1x128x128_256x128x128x128_16x16_32x32_2x2_8x32x1_8x32x1_1x32x1x8_8_1x1_intrawave_v3,622.82,565.6,0.0
gfx942,304,3136,5120,4352,ck,0,0,184.6576,a8w8_blockscale_1x128x128_256x128x128x128_16x16_32x32_2x2_8x32x1_8x32x1_1x32x1x8_8_1x1_intrawave_v3,756.83,368.48,0.0
gfx942,304,3200,5120,1536,ck,0,0,82.8226,a8w8_blockscale_1x128x128_256x128x128x128_16x16_32x32_2x2_8x32x1_8x32x1_1x32x1x8_8_1x1_intrawave_v3,607.7,549.94,0.0
gfx942,304,3200,5120,4352,ck,0,0,182.7292,a8w8_blockscale_1x128x128_256x128x128x128_16x16_32x32_2x2_8x32x1_8x32x1_1x32x1x8_8_1x1_intrawave_v3,780.42,377.48,0.0
gfx942,304,3264,5120,1536,ck,0,0,80.3243,a8w8_blockscale_1x128x128_256x128x128x128_16x16_32x32_2x2_8x32x1_8x32x1_1x32x1x8_8_1x1_intrawave_v3,639.14,576.43,0.0
gfx942,304,3264,5120,4352,ck,0,0,189.9161,a8w8_blockscale_1x128x128_256x128x128x128_16x16_32x32_2x2_8x32x1_8x32x1_1x32x1x8_8_1x1_intrawave_v3,765.91,368.11,0.0
gfx942,304,3328,5120,1536,ck,0,0,83.5453,a8w8_blockscale_1x128x128_256x128x128x128_16x16_32x32_2x2_8x32x1_8x32x1_1x32x1x8_8_1x1_intrawave_v3,626.55,563.23,0.0
gfx942,304,3328,5120,4352,ck,0,0,183.7711,a8w8_blockscale_1x128x128_256x128x128x128_16x16_32x32_2x2_8x32x1_8x32x1_1x32x1x8_8_1x1_intrawave_v3,807.04,385.5,0.0
gfx942,304,3392,5120,1536,ck,0,0,84.9601,a8w8_blockscale_1x128x128_256x128x128x128_16x16_32x32_2x2_8x32x1_8x32x1_1x32x1x8_8_1x1_intrawave_v3,627.96,562.72,0.0
gfx942,304,3392,5120,4352,ck,0,0,195.3915,a8w8_blockscale_1x128x128_256x128x128x128_16x16_32x32_2x2_8x32x1_8x32x1_1x32x1x8_8_1x1_intrawave_v3,773.64,367.36,0.0
gfx942,304,3456,5120,1536,ck,0,0,81.3653,a8w8_blockscale_1x128x128_256x128x128x128_16x16_32x32_2x2_8x32x1_8x32x1_1x32x1x8_8_1x1_intrawave_v3,668.08,596.84,0.0
gfx942,304,3456,5120,4352,ck,0,0,197.0674,a8w8_blockscale_1x128x128_256x128x128x128_16x16_32x32_2x2_8x32x1_8x32x1_1x32x1x8_8_1x1_intrawave_v3,781.53,368.97,0.0
gfx942,304,3520,5120,1536,ck,0,0,87.0289,a8w8_blockscale_1x128x128_256x128x128x128_16x16_32x32_2x2_8x32x1_8x32x1_1x32x1x8_8_1x1_intrawave_v3,636.17,566.66,0.0
gfx942,304,3520,5120,4352,ck,0,0,195.2383,a8w8_blockscale_1x128x128_256x128x128x128_16x16_32x32_2x2_8x32x1_8x32x1_1x32x1x8_8_1x1_intrawave_v3,803.46,377.21,0.0
gfx942,304,3584,5120,1536,ck,0,0,85.475,a8w8_blockscale_1x128x128_256x128x128x128_16x16_32x32_2x2_8x32x1_8x32x1_1x32x1x8_8_1x1_intrawave_v3,659.51,585.78,0.0
gfx942,304,3584,5120,4352,ck,0,0,191.6866,a8w8_blockscale_1x128x128_256x128x128x128_16x16_32x32_2x2_8x32x1_8x32x1_1x32x1x8_8_1x1_intrawave_v3,833.23,389.07,0.0
gfx942,304,3648,5120,1536,ck,0,0,88.3251,a8w8_blockscale_1x128x128_256x128x128x128_16x16_32x32_2x2_8x32x1_8x32x1_1x32x1x8_8_1x1_intrawave_v3,649.62,575.41,0.0
gfx942,304,3648,5120,4352,ck,0,0,203.0615,a8w8_blockscale_1x128x128_256x128x128x128_16x16_32x32_2x2_8x32x1_8x32x1_1x32x1x8_8_1x1_intrawave_v3,800.6,371.88,0.0
gfx942,304,3712,5120,1536,ck,0,0,90.7602,a8w8_blockscale_1x128x128_256x128x128x128_16x16_32x32_2x2_8x32x1_8x32x1_1x32x1x8_8_1x1_intrawave_v3,643.29,568.28,0.0
gfx942,304,3712,5120,4352,ck,0,0,198.5955,a8w8_blockscale_1x128x128_256x128x128x128_16x16_32x32_2x2_8x32x1_8x32x1_1x32x1x8_8_1x1_intrawave_v3,832.97,384.94,0.0
gfx942,304,3776,5120,1536,ck,0,0,90.4454,a8w8_blockscale_1x128x128_256x128x128x128_16x16_32x32_2x2_8x32x1_8x32x1_1x32x1x8_8_1x1_intrawave_v3,656.65,578.59,0.0
gfx942,304,3776,5120,4352,ck,0,0,206.6047,a8w8_blockscale_1x128x128_256x128x128x128_16x16_32x32_2x2_8x32x1_8x32x1_1x32x1x8_8_1x1_intrawave_v3,814.48,374.54,0.0
gfx942,304,3840,5120,1536,ck,0,0,90.1761,a8w8_blockscale_1x128x128_256x128x128x128_16x16_32x32_2x2_8x32x1_8x32x1_1x32x1x8_8_1x1_intrawave_v3,669.78,588.67,0.0
gfx942,304,3840,5120,4352,ck,0,0,207.1852,a8w8_blockscale_1x128x128_256x128x128x128_16x16_32x32_2x2_8x32x1_8x32x1_1x32x1x8_8_1x1_intrawave_v3,825.96,378.0,0.0
gfx942,304,3904,5120,1536,ck,0,0,100.1625,a8w8_blockscale_1x128x128_256x128x128x128_16x16_32x32_2x2_8x32x1_8x32x1_1x32x1x8_8_1x1_intrawave_v3,613.05,537.5,0.0
gfx942,304,3904,5120,4352,ck,0,0,236.8887,a8w8_blockscale_1x128x128_256x128x128x128_16x16_32x32_2x2_8x32x1_8x32x1_1x32x1x8_8_1x1_intrawave_v3,734.44,334.54,0.0
gfx942,304,3968,5120,1536,ck,0,0,98.6325,a8w8_blockscale_1x128x128_256x128x128x128_16x16_32x32_2x2_8x32x1_8x32x1_1x32x1x8_8_1x1_intrawave_v3,632.77,553.48,0.0
gfx942,304,3968,5120,4352,ck,0,0,224.803,a8w8_blockscale_1x128x128_256x128x128x128_16x16_32x32_2x2_8x32x1_8x32x1_1x32x1x8_8_1x1_intrawave_v3,786.61,356.68,0.0
gfx942,304,4032,5120,1536,ck,0,0,101.4437,a8w8_blockscale_1x128x128_256x128x128x128_16x16_32x32_2x2_8x32x1_8x32x1_1x32x1x8_8_1x1_intrawave_v3,625.15,545.58,0.0
gfx942,304,4032,5120,4352,ck,0,0,229.2814,a8w8_blockscale_1x128x128_256x128x128x128_16x16_32x32_2x2_8x32x1_8x32x1_1x32x1x8_8_1x1_intrawave_v3,783.68,353.79,0.0
gfx942,304,4096,5120,1536,ck,0,0,101.9546,a8w8_blockscale_1x128x128_256x128x128x128_16x16_32x32_2x2_8x32x1_8x32x1_1x32x1x8_8_1x1_intrawave_v3,631.89,550.23,0.0
gfx942,304,4096,5120,4352,ck,0,0,229.9868,a8w8_blockscale_1x128x128_256x128x128x128_16x16_32x32_2x2_8x32x1_8x32x1_1x32x1x8_8_1x1_intrawave_v3,793.68,356.76,0.0
gfx942,304,4224,5120,1536,ck,0,0,101.0437,a8w8_blockscale_1x128x128_256x128x128x128_16x16_32x32_2x2_8x32x1_8x32x1_1x32x1x8_8_1x1_intrawave_v3,657.52,570.11,0.0
gfx942,304,4224,5120,4352,ck,0,0,230.6212,a8w8_blockscale_1x128x128_256x128x128x128_16x16_32x32_2x2_8x32x1_8x32x1_1x32x1x8_8_1x1_intrawave_v3,816.23,363.88,0.0
gfx942,304,4352,5120,1536,ck,0,0,101.8721,a8w8_blockscale_1x128x128_256x128x128x128_16x16_32x32_2x2_8x32x1_8x32x1_1x32x1x8_8_1x1_intrawave_v3,671.93,580.27,0.0
gfx942,304,4352,5120,4352,ck,0,0,233.7563,a8w8_blockscale_1x128x128_256x128x128x128_16x16_32x32_2x2_8x32x1_8x32x1_1x32x1x8_8_1x1_intrawave_v3,829.69,366.99,0.0
gfx942,304,4480,5120,1536,ck,0,0,105.7738,a8w8_blockscale_1x128x128_256x128x128x128_16x16_32x32_2x2_8x32x1_8x32x1_1x32x1x8_8_1x1_intrawave_v3,666.18,573.12,0.0
gfx942,304,4480,5120,4352,ck,0,0,243.5257,a8w8_blockscale_1x128x128_256x128x128x128_16x16_32x32_2x2_8x32x1_8x32x1_1x32x1x8_8_1x1_intrawave_v3,819.83,359.94,0.0
gfx942,304,4608,5120,1536,ck,0,0,105.3524,a8w8_blockscale_1x128x128_256x128x128x128_16x16_32x32_2x2_8x32x1_8x32x1_1x32x1x8_8_1x1_intrawave_v3,687.95,589.72,0.0
gfx942,304,4608,5120,4352,ck,0,0,246.0771,a8w8_blockscale_1x128x128_256x128x128x128_16x16_32x32_2x2_8x32x1_8x32x1_1x32x1x8_8_1x1_intrawave_v3,834.51,363.8,0.0
gfx942,304,4736,5120,1536,ck,0,0,106.4129,a8w8_blockscale_1x128x128_256x128x128x128_16x16_32x32_2x2_8x32x1_8x32x1_1x32x1x8_8_1x1_intrawave_v3,700.02,598.01,0.0
gfx942,304,4736,5120,4352,ck,0,0,246.3695,a8w8_blockscale_1x128x128_256x128x128x128_16x16_32x32_2x2_8x32x1_8x32x1_1x32x1x8_8_1x1_intrawave_v3,856.67,370.95,0.0
gfx942,304,4864,5120,1536,ck,0,0,113.2819,a8w8_blockscale_1x128x128_256x128x128x128_16x16_32x32_2x2_8x32x1_8x32x1_1x32x1x8_8_1x1_intrawave_v3,675.34,575.05,0.0
gfx942,304,4864,5120,4352,ck,0,0,259.4793,a8w8_blockscale_1x128x128_256x128x128x128_16x16_32x32_2x2_8x32x1_8x32x1_1x32x1x8_8_1x1_intrawave_v3,835.37,359.4,0.0
gfx942,304,4992,5120,1536,ck,0,0,114.865,a8w8_blockscale_1x128x128_256x128x128x128_16x16_32x32_2x2_8x32x1_8x32x1_1x32x1x8_8_1x1_intrawave_v3,683.56,580.25,0.0
gfx942,304,4992,5120,4352,ck,0,0,276.4336,a8w8_blockscale_1x128x128_256x128x128x128_16x16_32x32_2x2_8x32x1_8x32x1_1x32x1x8_8_1x1_intrawave_v3,804.77,344.12,0.0
gfx942,304,5120,5120,1536,ck,0,0,121.85,a8w8_blockscale_1x128x128_256x128x128x128_16x16_32x32_2x2_8x32x1_8x32x1_1x32x1x8_8_1x1_intrawave_v3,660.9,559.36,0.0
gfx942,304,5120,5120,4352,ck,0,0,276.623,a8w8_blockscale_1x128x128_256x128x128x128_16x16_32x32_2x2_8x32x1_8x32x1_1x32x1x8_8_1x1_intrawave_v3,824.84,350.63,0.0
gfx942,304,5248,5120,1536,ck,0,0,121.5548,a8w8_blockscale_1x128x128_256x128x128x128_16x16_32x32_2x2_8x32x1_8x32x1_1x32x1x8_8_1x1_intrawave_v3,679.07,573.11,0.0
gfx942,304,5248,5120,4352,ck,0,0,279.4949,a8w8_blockscale_1x128x128_256x128x128x128_16x16_32x32_2x2_8x32x1_8x32x1_1x32x1x8_8_1x1_intrawave_v3,836.78,353.71,0.0
gfx942,304,5376,5120,1536,ck,0,0,127.9583,a8w8_blockscale_1x128x128_256x128x128x128_16x16_32x32_2x2_8x32x1_8x32x1_1x32x1x8_8_1x1_intrawave_v3,660.82,556.21,0.0
gfx942,304,5376,5120,4352,ck,0,0,289.3231,a8w8_blockscale_1x128x128_256x128x128x128_16x16_32x32_2x2_8x32x1_8x32x1_1x32x1x8_8_1x1_intrawave_v3,828.07,348.15,0.0
gfx942,304,5504,5120,1536,ck,0,0,122.9925,a8w8_blockscale_1x128x128_256x128x128x128_16x16_32x32_2x2_8x32x1_8x32x1_1x32x1x8_8_1x1_intrawave_v3,703.87,590.93,0.0
gfx942,304,5504,5120,4352,ck,0,0,297.2416,a8w8_blockscale_1x128x128_256x128x128x128_16x16_32x32_2x2_8x32x1_8x32x1_1x32x1x8_8_1x1_intrawave_v3,825.2,345.16,0.0
gfx942,304,5632,5120,1536,ck,0,0,126.8312,a8w8_blockscale_1x128x128_256x128x128x128_16x16_32x32_2x2_8x32x1_8x32x1_1x32x1x8_8_1x1_intrawave_v3,698.44,584.93,0.0
gfx942,304,5632,5120,4352,ck,0,0,292.0403,a8w8_blockscale_1x128x128_256x128x128x128_16x16_32x32_2x2_8x32x1_8x32x1_1x32x1x8_8_1x1_intrawave_v3,859.43,357.71,0.0
gfx942,304,5760,5120,1536,ck,0,0,129.2038,a8w8_blockscale_1x128x128_256x128x128x128_16x16_32x32_2x2_8x32x1_8x32x1_1x32x1x8_8_1x1_intrawave_v3,701.19,585.85,0.0
gfx942,304,5760,5120,4352,ck,0,0,300.8663,a8w8_blockscale_1x128x128_256x128x128x128_16x16_32x32_2x2_8x32x1_8x32x1_1x32x1x8_8_1x1_intrawave_v3,853.17,353.42,0.0
gfx942,304,5888,5120,1536,ck,0,0,135.9895,a8w8_blockscale_1x128x128_256x128x128x128_16x16_32x32_2x2_8x32x1_8x32x1_1x32x1x8_8_1x1_intrawave_v3,681.01,567.7,0.0
gfx942,304,5888,5120,4352,ck,0,0,324.1878,a8w8_blockscale_1x128x128_256x128x128x128_16x16_32x32_2x2_8x32x1_8x32x1_1x32x1x8_8_1x1_intrawave_v3,809.39,333.76,0.0
gfx942,304,6016,5120,1536,ck,0,0,142.493,a8w8_blockscale_1x128x128_256x128x128x128_16x16_32x32_2x2_8x32x1_8x32x1_1x32x1x8_8_1x1_intrawave_v3,664.06,552.37,0.0
gfx942,304,6016,5120,4352,ck,0,0,326.2605,a8w8_blockscale_1x128x128_256x128x128x128_16x16_32x32_2x2_8x32x1_8x32x1_1x32x1x8_8_1x1_intrawave_v3,821.74,337.36,0.0
gfx942,304,6144,5120,1536,ck,0,0,144.8126,a8w8_blockscale_1x128x128_256x128x128x128_16x16_32x32_2x2_8x32x1_8x32x1_1x32x1x8_8_1x1_intrawave_v3,667.32,553.93,0.0
gfx942,304,6144,5120,4352,ck,0,0,337.891,a8w8_blockscale_1x128x128_256x128x128x128_16x16_32x32_2x2_8x32x1_8x32x1_1x32x1x8_8_1x1_intrawave_v3,810.33,331.28,0.0
gfx942,304,6272,5120,1536,ck,0,0,148.1335,a8w8_blockscale_1x128x128_256x128x128x128_16x16_32x32_2x2_8x32x1_8x32x1_1x32x1x8_8_1x1_intrawave_v3,665.95,551.69,0.0
gfx942,304,6272,5120,4352,ck,0,0,334.7296,a8w8_blockscale_1x128x128_256x128x128x128_16x16_32x32_2x2_8x32x1_8x32x1_1x32x1x8_8_1x1_intrawave_v3,835.03,339.99,0.0
gfx942,304,6400,5120,1536,ck,0,0,147.7353,a8w8_blockscale_1x128x128_256x128x128x128_16x16_32x32_2x2_8x32x1_8x32x1_1x32x1x8_8_1x1_intrawave_v3,681.38,563.38,0.0
gfx942,304,6400,5120,4352,ck,0,0,340.2423,a8w8_blockscale_1x128x128_256x128x128x128_16x16_32x32_2x2_8x32x1_8x32x1_1x32x1x8_8_1x1_intrawave_v3,838.26,339.97,0.0
gfx942,304,6528,5120,1536,ck,0,0,148.3642,a8w8_blockscale_1x128x128_256x128x128x128_16x16_32x32_2x2_8x32x1_8x32x1_1x32x1x8_8_1x1_intrawave_v3,692.06,571.15,0.0
gfx942,304,6528,5120,4352,ck,0,0,345.0784,a8w8_blockscale_1x128x128_256x128x128x128_16x16_32x32_2x2_8x32x1_8x32x1_1x32x1x8_8_1x1_intrawave_v3,843.05,340.61,0.0
gfx942,304,6656,5120,1536,ck,0,0,147.4223,a8w8_blockscale_1x128x128_256x128x128x128_16x16_32x32_2x2_8x32x1_8x32x1_1x32x1x8_8_1x1_intrawave_v3,710.14,585.02,0.0
gfx942,304,6656,5120,4352,ck,0,0,345.7096,a8w8_blockscale_1x128x128_256x128x128x128_16x16_32x32_2x2_8x32x1_8x32x1_1x32x1x8_8_1x1_intrawave_v3,858.01,345.4,0.0
gfx942,304,6784,5120,1536,ck,0,0,154.3594,a8w8_blockscale_1x128x128_256x128x128x128_16x16_32x32_2x2_8x32x1_8x32x1_1x32x1x8_8_1x1_intrawave_v3,691.26,568.5,0.0
gfx942,304,6784,5120,4352,ck,0,0,352.5138,a8w8_blockscale_1x128x128_256x128x128x128_16x16_32x32_2x2_8x32x1_8x32x1_1x32x1x8_8_1x1_intrawave_v3,857.63,344.03,0.0
gfx942,304,6912,5120,1536,ck,0,0,160.523,a8w8_blockscale_1x128x128_256x128x128x128_16x16_32x32_2x2_8x32x1_8x32x1_1x32x1x8_8_1x1_intrawave_v3,677.26,556.06,0.0
gfx942,304,6912,5120,4352,ck,0,0,365.5375,a8w8_blockscale_1x128x128_256x128x128x128_16x16_32x32_2x2_8x32x1_8x32x1_1x32x1x8_8_1x1_intrawave_v3,842.68,336.88,0.0
gfx942,304,7040,5120,1536,ck,0,0,157.4507,a8w8_blockscale_1x128x128_256x128x128x128_16x16_32x32_2x2_8x32x1_8x32x1_1x32x1x8_8_1x1_intrawave_v3,703.27,576.48,0.0
gfx942,304,7040,5120,4352,ck,0,0,380.2616,a8w8_blockscale_1x128x128_256x128x128x128_16x16_32x32_2x2_8x32x1_8x32x1_1x32x1x8_8_1x1_intrawave_v3,825.05,328.75,0.0
gfx942,304,7168,5120,1536,ck,0,0,160.9193,a8w8_blockscale_1x128x128_256x128x128x128_16x16_32x32_2x2_8x32x1_8x32x1_1x32x1x8_8_1x1_intrawave_v3,700.62,573.42,0.0
gfx942,304,7168,5120,4352,ck,0,0,377.0181,a8w8_blockscale_1x128x128_256x128x128x128_16x16_32x32_2x2_8x32x1_8x32x1_1x32x1x8_8_1x1_intrawave_v3,847.28,336.53,0.0
gfx942,304,7296,5120,1536,ck,0,0,168.5008,a8w8_blockscale_1x128x128_256x128x128x128_16x16_32x32_2x2_8x32x1_8x32x1_1x32x1x8_8_1x1_intrawave_v3,681.04,556.57,0.0
gfx942,304,7296,5120,4352,ck,0,0,383.5721,a8w8_blockscale_1x128x128_256x128x128x128_16x16_32x32_2x2_8x32x1_8x32x1_1x32x1x8_8_1x1_intrawave_v3,847.67,335.65,0.0
gfx942,304,7424,5120,1536,ck,0,0,165.5365,a8w8_blockscale_1x128x128_256x128x128x128_16x16_32x32_2x2_8x32x1_8x32x1_1x32x1x8_8_1x1_intrawave_v3,705.4,575.64,0.0
gfx942,304,7424,5120,4352,ck,0,0,388.6839,a8w8_blockscale_1x128x128_256x128x128x128_16x16_32x32_2x2_8x32x1_8x32x1_1x32x1x8_8_1x1_intrawave_v3,851.2,336.04,0.0
gfx942,304,7552,5120,1536,ck,0,0,167.3772,a8w8_blockscale_1x128x128_256x128x128x128_16x16_32x32_2x2_8x32x1_8x32x1_1x32x1x8_8_1x1_intrawave_v3,709.67,578.31,0.0
gfx942,304,7552,5120,4352,ck,0,0,388.4195,a8w8_blockscale_1x128x128_256x128x128x128_16x16_32x32_2x2_8x32x1_8x32x1_1x32x1x8_8_1x1_intrawave_v3,866.46,341.08,0.0
