aiter/configs/model_configs/a8w8_bpreshuffle_tuned_gemm_mm2.5.csv
gfx,cu_num,M,N,K,q_dtype_w,libtype,kernelId,splitK,us,kernelName,tflops,bw,errRatio
gfx950,256,1,2048,3072,torch.float8_e4m3fn,ck,10,0,7.167,a8w8_bpreshuffle_128x16x32x512_16x16_16x16_32x4x1_32x4x1_1x16x1x8_4x4x1_1x1_intrawave_v1,1.76,878.84,0.0
gfx950,256,2,2048,3072,torch.float8_e4m3fn,flydsl,2149,0,7.1797,flydsl_bpreshuflle_16x64x512_F8_F8_B16_2x0x1x3x0_default,3.51,878.28,0.0
gfx950,256,4,2048,3072,torch.float8_e4m3fn,ck,24,0,6.8221,a8w8_bpreshuffle_128x16x32x512_16x16_16x16_32x4x1_32x4x1_1x16x1x8_4x4x1_1x1_intrawave_v2,7.38,926.42,0.0
gfx950,256,8,2048,3072,torch.float8_e4m3fn,ck,24,0,6.9912,a8w8_bpreshuffle_128x16x32x512_16x16_16x16_32x4x1_32x4x1_1x16x1x8_4x4x1_1x1_intrawave_v2,14.4,908.11,0.0
gfx950,256,16,2048,3072,torch.float8_e4m3fn,ck,10,0,6.3747,a8w8_bpreshuffle_128x16x32x512_16x16_16x16_32x4x1_32x4x1_1x16x1x8_4x4x1_1x1_intrawave_v1,31.58,1004.93,0.0
gfx950,256,32,2048,3072,torch.float8_e4m3fn,ck,10,0,6.501,a8w8_bpreshuffle_128x16x32x512_16x16_16x16_32x4x1_32x4x1_1x16x1x8_4x4x1_1x1_intrawave_v1,61.94,1003.05,0.0
gfx950,256,64,2048,3072,torch.float8_e4m3fn,ck,8,0,6.0924,a8w8_bpreshuffle_128x32x16x512_16x16_16x16_32x4x1_32x4x1_1x32x1x4_4x4x1_1x1_intrawave_v1,132.18,1107.97,0.0
gfx950,256,128,2048,3072,torch.float8_e4m3fn,ck,5,0,6.4365,a8w8_bpreshuffle_256x16x64x512_16x16_16x16_32x8x1_32x8x1_1x16x1x16_4x4x1_1x1_intrawave_v1,250.23,1120.01,0.0
gfx950,256,256,2048,3072,torch.float8_e4m3fn,flydsl,446,0,7.927,flydsl_bpreshuflle_32x64x512_F8_F8_B16_2x1x0x0x4_default,406.36,1025.16,0.0
gfx950,256,512,2048,3072,torch.float8_e4m3fn,flydsl,92,0,11.0675,flydsl_bpreshuflle_32x64x512_F8_F8_B16_1x0x0x0x4_default,582.11,900.07,0.0
gfx950,256,1024,2048,3072,torch.float8_e4m3fn,flydsl,1778,0,13.7758,flydsl_bpreshuflle_64x128x256_F8_F8_B16_2x1x0x2x4_default,935.33,989.52,0.0
gfx950,256,2048,2048,3072,torch.float8_e4m3fn,flydsl,2272,0,18.9785,flydsl_bpreshuflle_128x128x256_F8_F8_B16_2x0x1x3x4_default,1357.84,1105.01,0.0
gfx950,256,4096,2048,3072,torch.float8_e4m3fn,flydsl,3063,0,31.7415,flydsl_bpreshuflle_128x128x256_F8_F8_B16_2x1x1x4x0_default,1623.73,1123.19,0.0
gfx950,256,8192,2048,3072,torch.float8_e4m3fn,flydsl,518,0,56.0623,flydsl_bpreshuflle_128x256x128_F8_F8_B16_1x1x1x0x0_default,1838.65,1159.63,0.0
gfx950,256,16384,2048,3072,torch.float8_e4m3fn,flydsl,1099,0,104.7336,flydsl_bpreshuflle_128x256x128_F8_F8_B16_1x1x0x1x4_default,1968.41,1181.4,0.0
gfx950,256,32768,2048,3072,torch.float8_e4m3fn,flydsl,269,0,194.5623,flydsl_bpreshuflle_128x256x128_F8_F8_B16_1x0x1x0x4_default,2119.2,1239.56,0.0
gfx950,256,1,3072,1536,torch.float8_e4m3fn,flydsl,1,0,4.6855,flydsl_bpreshuflle_16x64x512_F8_F8_B16_1x0x0x0x0_default,2.01,1008.7,0.0
gfx950,256,1,3072,3072,torch.float8_e4m3fn,cktile,30,0,7.2579,a8w8_bpreshuffle_cktile_0x0x8x4x1x0x0x0x0x2_16x64x512_1x4x1_16x16x128_default,2.6,1301.53,0.0
gfx950,256,2,3072,3072,torch.float8_e4m3fn,flydsl,2149,0,7.305,flydsl_bpreshuflle_16x64x512_F8_F8_B16_2x0x1x3x0_default,5.17,1294.4,0.0
gfx950,256,4,3072,3072,torch.float8_e4m3fn,ck,24,0,7.0382,a8w8_bpreshuffle_128x16x32x512_16x16_16x16_32x4x1_32x4x1_1x16x1x8_4x4x1_1x1_intrawave_v2,10.73,1346.09,0.0
gfx950,256,8,3072,1536,torch.float8_e4m3fn,flydsl,2585,0,4.7299,flydsl_bpreshuflle_16x64x512_F8_F8_B16_1x0x0x4x0_default,15.96,1010.6,0.0
gfx950,256,8,3072,3072,torch.float8_e4m3fn,ck,10,0,7.2595,a8w8_bpreshuffle_128x16x32x512_16x16_16x16_32x4x1_32x4x1_1x16x1x8_4x4x1_1x1_intrawave_v1,20.8,1310.13,0.0
gfx950,256,16,3072,3072,torch.float8_e4m3fn,ck,11,0,6.7213,a8w8_bpreshuffle_256x16x64x512_16x16_16x16_32x8x1_32x8x1_1x16x1x16_4x4x1_1x1_intrawave_v1,44.93,1426.01,0.0
gfx950,256,32,3072,3072,torch.float8_e4m3fn,ck,10,0,6.406,a8w8_bpreshuffle_128x16x32x512_16x16_16x16_32x4x1_32x4x1_1x16x1x8_4x4x1_1x1_intrawave_v1,94.28,1519.22,0.0
gfx950,256,64,3072,3072,torch.float8_e4m3fn,ck,11,0,6.5386,a8w8_bpreshuffle_256x16x64x512_16x16_16x16_32x8x1_32x8x1_1x16x1x16_4x4x1_1x1_intrawave_v1,184.74,1533.51,0.0
gfx950,256,128,3072,3072,torch.float8_e4m3fn,flydsl,1110,0,7.7261,flydsl_bpreshuflle_32x64x512_F8_F8_B16_2x1x0x1x4_default,312.7,1374.15,0.0
gfx950,256,256,3072,3072,torch.float8_e4m3fn,flydsl,2234,0,10.0304,flydsl_bpreshuflle_32x64x512_F8_F8_B16_2x0x1x3x4_default,481.72,1176.07,0.0
gfx950,256,512,3072,3072,torch.float8_e4m3fn,flydsl,2833,0,13.0589,flydsl_bpreshuflle_64x64x256_F8_F8_B16_2x0x1x4x4_default,740.01,1083.99,0.0
gfx950,256,1024,3072,3072,torch.float8_e4m3fn,flydsl,1126,0,17.2468,flydsl_bpreshuflle_64x192x256_F8_F8_B16_2x1x0x1x4_default,1120.63,1094.37,0.0
gfx950,256,2048,3072,1536,torch.float8_e4m3fn,flydsl,2856,0,15.6725,flydsl_bpreshuflle_128x128x256_F8_F8_B16_2x0x1x4x4_default,1233.2,1304.66,0.0
gfx950,256,2048,3072,3072,torch.float8_e4m3fn,flydsl,1640,0,26.3649,flydsl_bpreshuflle_128x128x256_F8_F8_B16_2x0x1x2x4_default,1466.14,1073.83,0.0
gfx950,256,4096,3072,3072,torch.float8_e4m3fn,flydsl,1560,0,43.8242,flydsl_bpreshuflle_128x192x128_F8_F8_B16_2x0x1x2x0_default,1764.08,1076.71,0.0
gfx950,256,8192,3072,1536,torch.float8_e4m3fn,flydsl,568,0,48.6042,flydsl_bpreshuflle_128x192x128_F8_F8_B16_2x1x1x0x0_default,1590.59,1391.51,0.0
gfx950,256,8192,3072,3072,torch.float8_e4m3fn,flydsl,900,0,81.0421,flydsl_bpreshuflle_128x192x128_F8_F8_B16_2x0x1x1x0_default,1907.88,1048.03,0.0
gfx950,256,16384,3072,3072,torch.float8_e4m3fn,flydsl,1265,0,146.6352,flydsl_bpreshuflle_128x256x128_F8_F8_B16_1x1x1x1x4_default,2108.89,1094.09,0.0
gfx950,256,32768,3072,1536,torch.float8_e4m3fn,flydsl,767,0,161.6156,flydsl_bpreshuflle_128x256x128_F8_F8_B16_1x0x0x1x4_default,1913.41,1586.34,0.0
gfx950,256,32768,3072,3072,torch.float8_e4m3fn,flydsl,1099,0,279.498,flydsl_bpreshuflle_128x256x128_F8_F8_B16_1x1x0x1x4_default,2212.81,1114.24,0.0
gfx950,256,1,4096,3072,torch.float8_e4m3fn,ck,24,0,7.079,a8w8_bpreshuffle_128x16x32x512_16x16_16x16_32x4x1_32x4x1_1x16x1x8_4x4x1_1x1_intrawave_v2,3.55,1779.09,0.0
gfx950,256,2,4096,3072,torch.float8_e4m3fn,ck,24,0,7.0077,a8w8_bpreshuffle_128x16x32x512_16x16_16x16_32x4x1_32x4x1_1x16x1x8_4x4x1_1x1_intrawave_v2,7.18,1798.8,0.0
gfx950,256,4,4096,3072,torch.float8_e4m3fn,flydsl,852,0,7.0983,flydsl_bpreshuflle_16x64x512_F8_F8_B16_2x0x1x1x0_default,14.18,1779.01,0.0
gfx950,256,8,4096,3072,torch.float8_e4m3fn,ck,24,0,6.6981,a8w8_bpreshuffle_128x16x32x512_16x16_16x16_32x4x1_32x4x1_1x16x1x8_4x4x1_1x1_intrawave_v2,30.06,1892.03,0.0
gfx950,256,16,4096,3072,torch.float8_e4m3fn,ck,24,0,6.7778,a8w8_bpreshuffle_128x16x32x512_16x16_16x16_32x4x1_32x4x1_1x16x1x8_4x4x1_1x1_intrawave_v2,59.41,1883.08,0.0
gfx950,256,32,4096,3072,torch.float8_e4m3fn,ck,22,0,6.355,a8w8_bpreshuffle_128x32x16x512_16x16_16x16_32x4x1_32x4x1_1x32x1x4_4x4x1_1x1_intrawave_v2,126.72,2036.72,0.0
gfx950,256,64,4096,3072,torch.float8_e4m3fn,ck,5,0,6.3431,a8w8_bpreshuffle_256x16x64x512_16x16_16x16_32x8x1_32x8x1_1x16x1x16_4x4x1_1x1_intrawave_v1,253.92,2097.37,0.0
gfx950,256,128,4096,3072,torch.float8_e4m3fn,flydsl,446,0,7.8222,flydsl_bpreshuflle_32x64x512_F8_F8_B16_2x1x0x0x4_default,411.81,1792.94,0.0
gfx950,256,256,4096,3072,torch.float8_e4m3fn,ck,114,0,10.748,a8w8_bpreshuffle_256x64x64x256_16x16_16x16_16x16x1_16x16x1_1x32x1x8_8x8x1_2x1_intrawave_v3,599.41,1439.01,0.0
gfx950,256,512,4096,3072,torch.float8_e4m3fn,flydsl,1778,0,13.7786,flydsl_bpreshuflle_64x128x256_F8_F8_B16_2x1x0x2x4_default,935.14,1331.78,0.0
gfx950,256,1024,4096,3072,torch.float8_e4m3fn,flydsl,1640,0,19.3987,flydsl_bpreshuflle_128x128x256_F8_F8_B16_2x0x1x2x4_default,1328.43,1243.24,0.0
gfx950,256,2048,4096,3072,torch.float8_e4m3fn,flydsl,899,0,32.4644,flydsl_bpreshuflle_128x128x256_F8_F8_B16_2x0x1x1x0_default,1587.57,1098.17,0.0
gfx950,256,4096,4096,3072,torch.float8_e4m3fn,flydsl,767,0,54.5294,flydsl_bpreshuflle_128x256x128_F8_F8_B16_1x0x0x1x4_default,1890.34,1076.85,0.0
gfx950,256,8192,4096,3072,torch.float8_e4m3fn,flydsl,1099,0,105.5146,flydsl_bpreshuflle_128x256x128_F8_F8_B16_1x1x0x1x4_default,1953.84,993.77,0.0
gfx950,256,16384,4096,3072,torch.float8_e4m3fn,flydsl,269,0,193.1919,flydsl_bpreshuflle_128x256x128_F8_F8_B16_1x0x1x0x4_default,2134.23,1020.4,0.0
gfx950,256,32768,4096,3072,torch.float8_e4m3fn,flydsl,767,0,368.5463,flydsl_bpreshuflle_128x256x128_F8_F8_B16_1x0x0x1x4_default,2237.53,1035.64,0.0
