aiter/configs/model_configs/a8w8_blockscale_tuned_gemm_gfx1201.csv
gfx,cu_num,M,N,K,libtype,kernelId,splitK,us,kernelName,tflops,bw,errRatio
gfx1201,64,333,2432,2432,ck,5,0,42.0445,a8w8_blockscale_1x128x128_256x16x128x128_8x16_16x16_1x2_16x16x1_8x32x1_1x16x1x16_8_1x2_intrawave_v1,93.69,198.46,0.0
gfx1201,64,333,2432,9728,ck,5,0,149.5826,a8w8_blockscale_1x128x128_256x16x128x128_8x16_16x16_1x2_16x16x1_8x32x1_1x16x1x16_8_1x2_intrawave_v1,105.34,190.65,0.0
gfx1201,64,666,2432,2432,ck,5,0,76.7224,a8w8_blockscale_1x128x128_256x16x128x128_8x16_16x16_1x2_16x16x1_8x32x1_1x16x1x16_8_1x2_intrawave_v1,102.69,140.43,0.0
gfx1201,64,666,2432,9728,ck,5,0,286.8258,a8w8_blockscale_1x128x128_256x16x128x128_8x16_16x16_1x2_16x16x1_8x32x1_1x16x1x16_8_1x2_intrawave_v1,109.87,116.37,0.0
gfx1201,64,2048,2432,2432,ck,5,0,234.7964,a8w8_blockscale_1x128x128_256x16x128x128_8x16_16x16_1x2_16x16x1_8x32x1_1x16x1x16_8_1x2_intrawave_v1,103.18,88.83,0.0
gfx1201,64,2048,2432,9728,ck,5,0,880.3262,a8w8_blockscale_1x128x128_256x16x128x128_8x16_16x16_1x2_16x16x1_8x32x1_1x16x1x16_8_1x2_intrawave_v1,110.08,60.82,0.0
gfx1201,64,4096,2432,2432,ck,5,0,470.6144,a8w8_blockscale_1x128x128_256x16x128x128_8x16_16x16_1x2_16x16x1_8x32x1_1x16x1x16_8_1x2_intrawave_v1,102.96,76.07,0.0
gfx1201,64,4096,2432,9728,ck,5,0,1749.544,a8w8_blockscale_1x128x128_256x16x128x128_8x16_16x16_1x2_16x16x1_8x32x1_1x16x1x16_8_1x2_intrawave_v1,110.78,47.69,0.0
gfx1201,64,8192,2432,2432,ck,5,0,939.6834,a8w8_blockscale_1x128x128_256x16x128x128_8x16_16x16_1x2_16x16x1_8x32x1_1x16x1x16_8_1x2_intrawave_v1,103.13,69.9,0.0
gfx1201,64,8192,2432,9728,ck,5,0,3562.3269,a8w8_blockscale_1x128x128_256x16x128x128_8x16_16x16_1x2_16x16x1_8x32x1_1x16x1x16_8_1x2_intrawave_v1,108.81,40.2,0.0
gfx1201,64,4,3072,3072,ck,7,0,20.2873,a8w8_blockscale_1x128x128_256x16x128x256_16x16_16x16_1x2_16x16x1_16x16x1_1x16x1x16_8_1x2_intrawave_v1,3.72,466.99,0.0
gfx1201,64,4,3072,12288,ck,7,0,71.1899,a8w8_blockscale_1x128x128_256x16x128x256_16x16_16x16_1x2_16x16x1_16x16x1_1x16x1x16_8_1x2_intrawave_v1,4.24,531.29,0.0
gfx1201,64,7,3072,3072,ck,7,0,20.3485,a8w8_blockscale_1x128x128_256x16x128x256_16x16_16x16_1x2_16x16x1_16x16x1_1x16x1x16_8_1x2_intrawave_v1,6.49,466.95,0.0
gfx1201,64,7,3072,12288,ck,7,0,70.7799,a8w8_blockscale_1x128x128_256x16x128x256_16x16_16x16_1x2_16x16x1_16x16x1_1x16x1x16_8_1x2_intrawave_v1,7.47,535.15,0.0
gfx1201,64,14,3072,3072,ck,7,0,20.6282,a8w8_blockscale_1x128x128_256x16x128x256_16x16_16x16_1x2_16x16x1_16x16x1_1x16x1x16_8_1x2_intrawave_v1,12.81,463.74,0.0
gfx1201,64,14,3072,12288,ck,7,0,71.5866,a8w8_blockscale_1x128x128_256x16x128x256_16x16_16x16_1x2_16x16x1_16x16x1_1x16x1x16_8_1x2_intrawave_v1,14.76,530.92,0.0
gfx1201,64,64,3072,3072,ck,7,0,24.8996,a8w8_blockscale_1x128x128_256x16x128x256_16x16_16x16_1x2_16x16x1_16x16x1_1x16x1x16_8_1x2_intrawave_v1,48.51,402.7,0.0
gfx1201,64,64,3072,12288,ck,7,0,79.1269,a8w8_blockscale_1x128x128_256x16x128x256_16x16_16x16_1x2_16x16x1_16x16x1_1x16x1x16_8_1x2_intrawave_v1,61.06,491.97,0.0
gfx1201,64,128,3072,3072,ck,7,0,28.4615,a8w8_blockscale_1x128x128_256x16x128x256_16x16_16x16_1x2_16x16x1_16x16x1_1x16x1x16_8_1x2_intrawave_v1,84.88,373.02,0.0
gfx1201,64,128,3072,9216,ck,7,0,72.8149,a8w8_blockscale_1x128x128_256x16x128x256_16x16_16x16_1x2_16x16x1_16x16x1_1x16x1x16_8_1x2_intrawave_v1,99.54,415.82,0.0
gfx1201,64,128,3072,12288,ck,7,0,99.7192,a8w8_blockscale_1x128x128_256x16x128x256_16x16_16x16_1x2_16x16x1_16x16x1_1x16x1x16_8_1x2_intrawave_v1,96.91,402.21,0.0
gfx1201,64,256,3072,3072,ck,4,0,48.0668,a8w8_blockscale_1x128x128_256x16x256x128_8x16_16x16_1x4_16x16x1_8x32x1_1x16x1x16_8_1x2_intrawave_v1,100.52,245.42,0.0
gfx1201,64,256,3072,9216,ck,4,0,124.6402,a8w8_blockscale_1x128x128_256x16x256x128_8x16_16x16_1x4_16x16x1_8x32x1_1x16x1x16_8_1x2_intrawave_v1,116.3,258.69,0.0
gfx1201,64,256,3072,12288,ck,7,0,183.4414,a8w8_blockscale_1x128x128_256x16x128x256_16x16_16x16_1x2_16x16x1_16x16x1_1x16x1x16_8_1x2_intrawave_v1,105.36,231.5,0.0
gfx1201,64,351,3072,3072,ck,7,0,74.384,a8w8_blockscale_1x128x128_256x16x128x256_16x16_16x16_1x2_16x16x1_16x16x1_1x16x1x16_8_1x2_intrawave_v1,89.06,170.36,0.0
gfx1201,64,351,3072,12288,ck,7,0,272.4512,a8w8_blockscale_1x128x128_256x16x128x256_16x16_16x16_1x2_16x16x1_16x16x1_1x16x1x16_8_1x2_intrawave_v1,97.26,162.3,0.0
gfx1201,64,353,3072,12288,ck,4,0,278.2869,a8w8_blockscale_1x128x128_256x16x256x128_8x16_16x16_1x4_16x16x1_8x32x1_1x16x1x16_8_1x2_intrawave_v1,95.77,159.03,0.0
gfx1201,64,512,3072,3072,ck,4,0,85.2181,a8w8_blockscale_1x128x128_256x16x256x128_8x16_16x16_1x4_16x16x1_8x32x1_1x16x1x16_8_1x2_intrawave_v1,113.4,166.11,0.0
gfx1201,64,512,3072,9216,ck,4,0,231.708,a8w8_blockscale_1x128x128_256x16x256x128_8x16_16x16_1x4_16x16x1_8x32x1_1x16x1x16_8_1x2_intrawave_v1,125.12,156.13,0.0
gfx1201,64,1024,3072,3072,ck,4,0,160.973,a8w8_blockscale_1x128x128_256x16x256x128_8x16_16x16_1x4_16x16x1_8x32x1_1x16x1x16_8_1x2_intrawave_v1,120.07,117.25,0.0
gfx1201,64,1024,3072,12288,ck,4,0,635.1648,a8w8_blockscale_1x128x128_256x16x256x128_8x16_16x16_1x4_16x16x1_8x32x1_1x16x1x16_8_1x2_intrawave_v1,121.72,89.15,0.0
gfx1201,64,1088,3072,15360,ck,4,0,888.2742,a8w8_blockscale_1x128x128_256x16x256x128_8x16_16x16_1x4_16x16x1_8x32x1_1x16x1x16_8_1x2_intrawave_v1,115.59,79.46,0.0
gfx1201,64,2048,3072,3072,ck,4,0,322.0895,a8w8_blockscale_1x128x128_256x16x256x128_8x16_16x16_1x4_16x16x1_8x32x1_1x16x1x16_8_1x2_intrawave_v1,120.01,87.9,0.0
gfx1201,64,2048,3072,12288,ck,4,0,1250.2296,a8w8_blockscale_1x128x128_256x16x256x128_8x16_16x16_1x4_16x16x1_8x32x1_1x16x1x16_8_1x2_intrawave_v1,123.67,60.39,0.0
gfx1201,64,2112,3072,15360,ck,7,0,1902.0049,a8w8_blockscale_1x128x128_256x16x128x256_16x16_16x16_1x2_16x16x1_16x16x1_1x16x1x16_8_1x2_intrawave_v1,104.79,48.69,0.0
gfx1201,64,2176,3072,15360,ck,4,0,1652.519,a8w8_blockscale_1x128x128_256x16x256x128_8x16_16x16_1x4_16x16x1_8x32x1_1x16x1x16_8_1x2_intrawave_v1,124.27,56.87,0.0
gfx1201,64,4096,3072,3072,ck,4,0,650.4958,a8w8_blockscale_1x128x128_256x16x256x128_8x16_16x16_1x4_16x16x1_8x32x1_1x16x1x16_8_1x2_intrawave_v1,118.85,72.54,0.0
gfx1201,64,4096,3072,9216,ck,4,0,1809.6945,a8w8_blockscale_1x128x128_256x16x256x128_8x16_16x16_1x4_16x16x1_8x32x1_1x16x1x16_8_1x2_intrawave_v1,128.16,50.41,0.0
gfx1201,64,4096,3072,12288,ck,4,0,2501.5402,a8w8_blockscale_1x128x128_256x16x256x128_8x16_16x16_1x4_16x16x1_8x32x1_1x16x1x16_8_1x2_intrawave_v1,123.62,45.27,0.0
gfx1201,64,4154,3072,12288,ck,7,0,3823.1546,a8w8_blockscale_1x128x128_256x16x128x256_16x16_16x16_1x2_16x16x1_16x16x1_1x16x1x16_8_1x2_intrawave_v1,82.03,29.9,0.0
gfx1201,64,4160,3072,15360,ck,7,0,3762.9173,a8w8_blockscale_1x128x128_256x16x128x256_16x16_16x16_1x2_16x16x1_16x16x1_1x16x1x16_8_1x2_intrawave_v1,104.33,36.31,0.0
gfx1201,64,4224,3072,12288,ck,5,0,3014.4315,a8w8_blockscale_1x128x128_256x16x128x128_8x16_16x16_1x2_16x16x1_8x32x1_1x16x1x16_8_1x2_intrawave_v1,105.79,38.35,0.0
gfx1201,64,4224,3072,15360,ck,4,0,3323.3146,a8w8_blockscale_1x128x128_256x16x256x128_8x16_16x16_1x4_16x16x1_8x32x1_1x16x1x16_8_1x2_intrawave_v1,119.95,41.53,0.0
gfx1201,64,4352,3072,15360,ck,4,0,3283.323,a8w8_blockscale_1x128x128_256x16x256x128_8x16_16x16_1x4_16x16x1_8x32x1_1x16x1x16_8_1x2_intrawave_v1,125.09,42.87,0.0
gfx1201,64,6714,3072,12288,ck,7,0,5952.0557,a8w8_blockscale_1x128x128_256x16x128x256_16x16_16x16_1x2_16x16x1_16x16x1_1x16x1x16_8_1x2_intrawave_v1,85.16,27.13,0.0
gfx1201,64,6851,3072,14336,ck,7,0,5962.1438,a8w8_blockscale_1x128x128_256x16x128x256_16x16_16x16_1x2_16x16x1_16x16x1_1x16x1x16_8_1x2_intrawave_v1,101.21,30.92,0.0
gfx1201,64,7130,3072,14336,ck,4,0,7085.2818,a8w8_blockscale_1x128x128_256x16x256x128_8x16_16x16_1x4_16x16x1_8x32x1_1x16x1x16_8_1x2_intrawave_v1,88.64,26.82,0.0
gfx1201,64,8192,3072,3072,ck,4,0,1295.8989,a8w8_blockscale_1x128x128_256x16x256x128_8x16_16x16_1x4_16x16x1_8x32x1_1x16x1x16_8_1x2_intrawave_v1,119.31,65.54,0.0
gfx1201,64,8192,3072,9216,ck,4,0,3691.1972,a8w8_blockscale_1x128x128_256x16x256x128_8x16_16x16_1x4_16x16x1_8x32x1_1x16x1x16_8_1x2_intrawave_v1,125.67,41.76,0.0
gfx1201,64,8192,3072,12288,ck,4,0,5031.6268,a8w8_blockscale_1x128x128_256x16x256x128_8x16_16x16_1x4_16x16x1_8x32x1_1x16x1x16_8_1x2_intrawave_v1,122.92,37.51,0.0
gfx1201,64,8320,3072,15360,ck,4,0,6726.0132,a8w8_blockscale_1x128x128_256x16x256x128_8x16_16x16_1x4_16x16x1_8x32x1_1x16x1x16_8_1x2_intrawave_v1,116.74,33.62,0.0
gfx1201,64,8448,3072,15360,ck,4,0,6478.5208,a8w8_blockscale_1x128x128_256x16x256x128_8x16_16x16_1x4_16x16x1_8x32x1_1x16x1x16_8_1x2_intrawave_v1,123.06,35.32,0.0
gfx1201,64,10298,3072,12288,ck,7,0,8840.6069,a8w8_blockscale_1x128x128_256x16x128x256_16x16_16x16_1x2_16x16x1_16x16x1_1x16x1x16_8_1x2_intrawave_v1,87.94,25.74,0.0
gfx1201,64,13702,3072,14336,ck,7,0,14655.9377,a8w8_blockscale_1x128x128_256x16x128x256_16x16_16x16_1x2_16x16x1_16x16x1_1x16x1x16_8_1x2_intrawave_v1,82.35,22.15,0.0
gfx1201,64,14260,3072,14336,ck,7,0,13697.4789,a8w8_blockscale_1x128x128_256x16x128x256_16x16_16x16_1x2_16x16x1_16x16x1_1x16x1x16_8_1x2_intrawave_v1,91.7,24.54,0.0
gfx1201,64,16384,3072,3072,ck,4,0,2582.6536,a8w8_blockscale_1x128x128_256x16x256x128_8x16_16x16_1x4_16x16x1_8x32x1_1x16x1x16_8_1x2_intrawave_v1,119.74,62.12,0.0
gfx1201,64,16384,3072,9216,ck,4,0,7452.8814,a8w8_blockscale_1x128x128_256x16x256x128_8x16_16x16_1x4_16x16x1_8x32x1_1x16x1x16_8_1x2_intrawave_v1,124.48,37.57,0.0
gfx1201,64,16384,3072,12288,ck,4,0,10122.149,a8w8_blockscale_1x128x128_256x16x256x128_8x16_16x16_1x4_16x16x1_8x32x1_1x16x1x16_8_1x2_intrawave_v1,122.2,33.56,0.0
gfx1201,64,16640,3072,3072,ck,4,0,2639.4666,a8w8_blockscale_1x128x128_256x16x256x128_8x16_16x16_1x4_16x16x1_8x32x1_1x16x1x16_8_1x2_intrawave_v1,118.99,61.68,0.0
gfx1201,64,16640,3072,15360,ck,4,0,12763.5246,a8w8_blockscale_1x128x128_256x16x256x128_8x16_16x16_1x4_16x16x1_8x32x1_1x16x1x16_8_1x2_intrawave_v1,123.03,31.73,0.0
gfx1201,64,16896,3072,12288,ck,4,0,10441.6235,a8w8_blockscale_1x128x128_256x16x256x128_8x16_16x16_1x4_16x16x1_8x32x1_1x16x1x16_8_1x2_intrawave_v1,122.17,33.44,0.0
gfx1201,64,20596,3072,3072,ck,4,0,3330.0571,a8w8_blockscale_1x128x128_256x16x256x128_8x16_16x16_1x4_16x16x1_8x32x1_1x16x1x16_8_1x2_intrawave_v1,116.74,59.83,0.0
gfx1201,64,20596,3072,12288,ck,5,0,14816.8421,a8w8_blockscale_1x128x128_256x16x128x128_8x16_16x16_1x2_16x16x1_8x32x1_1x16x1x16_8_1x2_intrawave_v1,104.94,28.17,0.0
gfx1201,64,27404,3072,3072,ck,4,0,4420.0424,a8w8_blockscale_1x128x128_256x16x256x128_8x16_16x16_1x4_16x16x1_8x32x1_1x16x1x16_8_1x2_intrawave_v1,117.02,59.27,0.0
gfx1201,64,27404,3072,14336,ck,4,0,27946.3898,a8w8_blockscale_1x128x128_256x16x256x128_8x16_16x16_1x4_16x16x1_8x32x1_1x16x1x16_8_1x2_intrawave_v1,86.37,21.66,0.0
gfx1201,64,28520,3072,3072,ck,4,0,4653.9455,a8w8_blockscale_1x128x128_256x16x256x128_8x16_16x16_1x4_16x16x1_8x32x1_1x16x1x16_8_1x2_intrawave_v1,115.66,58.5,0.0
gfx1201,64,28520,3072,14336,ck,7,0,29413.8052,a8w8_blockscale_1x128x128_256x16x128x256_16x16_16x16_1x2_16x16x1_16x16x1_1x16x1x16_8_1x2_intrawave_v1,85.4,21.35,0.0
gfx1201,64,16,3840,3840,ck,7,0,26.2142,a8w8_blockscale_1x128x128_256x16x128x256_16x16_16x16_1x2_16x16x1_16x16x1_1x16x1x16_8_1x2_intrawave_v1,18.0,569.54,0.0
gfx1201,64,16,3840,10240,ck,7,0,68.6131,a8w8_blockscale_1x128x128_256x16x128x256_16x16_16x16_1x2_16x16x1_16x16x1_1x16x1x16_8_1x2_intrawave_v1,18.34,577.27,0.0
gfx1201,64,32,3840,3840,ck,7,0,27.1911,a8w8_blockscale_1x128x128_256x16x128x256_16x16_16x16_1x2_16x16x1_16x16x1_1x16x1x16_8_1x2_intrawave_v1,34.71,555.85,0.0
gfx1201,64,32,3840,10240,ck,7,0,70.6391,a8w8_blockscale_1x128x128_256x16x128x256_16x16_16x16_1x2_16x16x1_16x16x1_1x16x1x16_8_1x2_intrawave_v1,35.63,564.77,0.0
gfx1201,64,64,3840,3840,ck,5,0,29.4296,a8w8_blockscale_1x128x128_256x16x128x128_8x16_16x16_1x2_16x16x1_8x32x1_1x16x1x16_8_1x2_intrawave_v1,64.13,526.1,0.0
gfx1201,64,64,3840,10240,ck,5,0,81.3267,a8w8_blockscale_1x128x128_256x16x128x128_8x16_16x16_1x2_16x16x1_8x32x1_1x16x1x16_8_1x2_intrawave_v1,61.89,497.6,0.0
gfx1201,64,160,3840,3840,ck,5,0,50.0094,a8w8_blockscale_1x128x128_256x16x128x128_8x16_16x16_1x2_16x16x1_8x32x1_1x16x1x16_8_1x2_intrawave_v1,94.35,331.71,0.0
gfx1201,64,160,3840,10240,ck,7,0,138.435,a8w8_blockscale_1x128x128_256x16x128x256_16x16_16x16_1x2_16x16x1_16x16x1_1x16x1x16_8_1x2_intrawave_v1,90.89,304.76,0.0
gfx1201,64,168,3840,3840,ck,5,0,55.0444,a8w8_blockscale_1x128x128_256x16x128x128_8x16_16x16_1x2_16x16x1_8x32x1_1x16x1x16_8_1x2_intrawave_v1,90.01,303.05,0.0
gfx1201,64,168,3840,10240,ck,5,0,147.6532,a8w8_blockscale_1x128x128_256x16x128x128_8x16_16x16_1x2_16x16x1_8x32x1_1x16x1x16_8_1x2_intrawave_v1,89.48,286.7,0.0
gfx1201,64,320,3840,3840,ck,4,0,89.9383,a8w8_blockscale_1x128x128_256x16x256x128_8x16_16x16_1x4_16x16x1_8x32x1_1x16x1x16_8_1x2_intrawave_v1,104.93,204.94,0.0
gfx1201,64,320,3840,10240,ck,4,0,265.6619,a8w8_blockscale_1x128x128_256x16x256x128_8x16_16x16_1x4_16x16x1_8x32x1_1x16x1x16_8_1x2_intrawave_v1,94.73,169.6,0.0
gfx1201,64,336,3840,3840,ck,4,0,88.0467,a8w8_blockscale_1x128x128_256x16x256x128_8x16_16x16_1x4_16x16x1_8x32x1_1x16x1x16_8_1x2_intrawave_v1,112.54,211.44,0.0
gfx1201,64,336,3840,10240,ck,7,0,252.9828,a8w8_blockscale_1x128x128_256x16x128x256_16x16_16x16_1x2_16x16x1_16x16x1_1x16x1x16_8_1x2_intrawave_v1,104.45,179.23,0.0
gfx1201,64,640,3840,3840,ck,4,0,161.4724,a8w8_blockscale_1x128x128_256x16x256x128_8x16_16x16_1x4_16x16x1_8x32x1_1x16x1x16_8_1x2_intrawave_v1,116.89,136.98,0.0
gfx1201,64,640,3840,10240,ck,4,0,458.5934,a8w8_blockscale_1x128x128_256x16x256x128_8x16_16x16_1x4_16x16x1_8x32x1_1x16x1x16_8_1x2_intrawave_v1,109.75,110.75,0.0
gfx1201,64,672,3840,3840,ck,4,0,167.8737,a8w8_blockscale_1x128x128_256x16x256x128_8x16_16x16_1x4_16x16x1_8x32x1_1x16x1x16_8_1x2_intrawave_v1,118.05,133.95,0.0
gfx1201,64,672,3840,10240,ck,4,0,471.8612,a8w8_blockscale_1x128x128_256x16x256x128_8x16_16x16_1x4_16x16x1_8x32x1_1x16x1x16_8_1x2_intrawave_v1,112.0,108.85,0.0
gfx1201,64,2048,3840,3840,ck,4,0,486.0095,a8w8_blockscale_1x128x128_256x16x256x128_8x16_16x16_1x4_16x16x1_8x32x1_1x16x1x16_8_1x2_intrawave_v1,124.27,78.88,0.0
gfx1201,64,2048,3840,10240,ck,4,0,1273.6482,a8w8_blockscale_1x128x128_256x16x256x128_8x16_16x16_1x4_16x16x1_8x32x1_1x16x1x16_8_1x2_intrawave_v1,126.46,59.69,0.0
gfx1201,64,4096,3840,3840,ck,4,0,990.9713,a8w8_blockscale_1x128x128_256x16x256x128_8x16_16x16_1x4_16x16x1_8x32x1_1x16x1x16_8_1x2_intrawave_v1,121.9,62.5,0.0
gfx1201,64,4096,3840,10240,ck,4,0,2538.5662,a8w8_blockscale_1x128x128_256x16x256x128_8x16_16x16_1x4_16x16x1_8x32x1_1x16x1x16_8_1x2_intrawave_v1,126.89,44.4,0.0
gfx1201,64,4128,3840,10240,ck,7,0,3123.9041,a8w8_blockscale_1x128x128_256x16x128x256_16x16_16x16_1x2_16x16x1_16x16x1_1x16x1x16_8_1x2_intrawave_v1,103.92,36.27,0.0
gfx1201,64,8160,3840,10240,ck,7,0,6908.9953,a8w8_blockscale_1x128x128_256x16x128x256_16x16_16x16_1x2_16x16x1_16x16x1_1x16x1x16_8_1x2_intrawave_v1,92.88,26.86,0.0
gfx1201,64,8192,3840,3840,ck,4,0,1961.5059,a8w8_blockscale_1x128x128_256x16x256x128_8x16_16x16_1x4_16x16x1_8x32x1_1x16x1x16_8_1x2_intrawave_v1,123.17,55.63,0.0
gfx1201,64,8192,3840,10240,ck,4,0,5135.9491,a8w8_blockscale_1x128x128_256x16x256x128_8x16_16x16_1x4_16x16x1_8x32x1_1x16x1x16_8_1x2_intrawave_v1,125.44,36.24,0.0
gfx1201,64,16320,3840,10240,ck,7,0,13573.5483,a8w8_blockscale_1x128x128_256x16x128x256_16x16_16x16_1x2_16x16x1_16x16x1_1x16x1x16_8_1x2_intrawave_v1,94.56,24.44,0.0
gfx1201,64,16384,3840,3840,ck,4,0,3996.7259,a8w8_blockscale_1x128x128_256x16x256x128_8x16_16x16_1x4_16x16x1_8x32x1_1x16x1x16_8_1x2_intrawave_v1,120.89,50.91,0.0
gfx1201,64,16384,3840,10240,ck,4,0,10357.8744,a8w8_blockscale_1x128x128_256x16x256x128_8x16_16x16_1x4_16x16x1_8x32x1_1x16x1x16_8_1x2_intrawave_v1,124.4,32.14,0.0
gfx1201,64,128,4096,4096,ck,7,0,51.6116,a8w8_blockscale_1x128x128_256x16x128x256_16x16_16x16_1x2_16x16x1_16x16x1_1x16x1x16_8_1x2_intrawave_v1,83.22,355.54,0.0
gfx1201,64,128,4096,12288,ck,7,0,129.7683,a8w8_blockscale_1x128x128_256x16x128x256_16x16_16x16_1x2_16x16x1_16x16x1_1x16x1x16_8_1x2_intrawave_v1,99.29,408.06,0.0
gfx1201,64,256,4096,4096,ck,7,0,89.8139,a8w8_blockscale_1x128x128_256x16x128x256_16x16_16x16_1x2_16x16x1_16x16x1_1x16x1x16_8_1x2_intrawave_v1,95.64,221.82,0.0
gfx1201,64,256,4096,12288,ck,7,0,244.0826,a8w8_blockscale_1x128x128_256x16x128x256_16x16_16x16_1x2_16x16x1_16x16x1_1x16x1x16_8_1x2_intrawave_v1,105.58,227.69,0.0
gfx1201,64,512,4096,4096,ck,4,0,157.1747,a8w8_blockscale_1x128x128_256x16x256x128_8x16_16x16_1x4_16x16x1_8x32x1_1x16x1x16_8_1x2_intrawave_v1,109.3,146.77,0.0
gfx1201,64,512,4096,12288,ck,4,0,441.8527,a8w8_blockscale_1x128x128_256x16x256x128_8x16_16x16_1x4_16x16x1_8x32x1_1x16x1x16_8_1x2_intrawave_v1,116.64,137.64,0.0
gfx1201,64,4096,4096,4096,ck,4,0,1162.9288,a8w8_blockscale_1x128x128_256x16x256x128_8x16_16x16_1x4_16x16x1_8x32x1_1x16x1x16_8_1x2_intrawave_v1,118.18,57.71,0.0
gfx1201,64,4096,4096,12288,ck,4,0,3347.7524,a8w8_blockscale_1x128x128_256x16x256x128_8x16_16x16_1x4_16x16x1_8x32x1_1x16x1x16_8_1x2_intrawave_v1,123.16,40.09,0.0
gfx1201,64,4224,4096,16384,ck,7,0,6093.408,a8w8_blockscale_1x128x128_256x16x128x256_16x16_16x16_1x2_16x16x1_16x16x1_1x16x1x16_8_1x2_intrawave_v1,93.04,28.05,0.0
gfx1201,64,8192,4096,4096,ck,4,0,2257.1668,a8w8_blockscale_1x128x128_256x16x256x128_8x16_16x16_1x4_16x16x1_8x32x1_1x16x1x16_8_1x2_intrawave_v1,121.78,52.03,0.0
gfx1201,64,8192,4096,12288,ck,4,0,6813.6348,a8w8_blockscale_1x128x128_256x16x256x128_8x16_16x16_1x4_16x16x1_8x32x1_1x16x1x16_8_1x2_intrawave_v1,121.03,32.01,0.0
gfx1201,64,8448,4096,16384,ck,4,0,11011.4501,a8w8_blockscale_1x128x128_256x16x256x128_8x16_16x16_1x4_16x16x1_8x32x1_1x16x1x16_8_1x2_intrawave_v1,102.97,24.95,0.0
gfx1201,64,16384,4096,4096,ck,4,0,4561.8145,a8w8_blockscale_1x128x128_256x16x256x128_8x16_16x16_1x4_16x16x1_8x32x1_1x16x1x16_8_1x2_intrawave_v1,120.51,47.81,0.0
gfx1201,64,16384,4096,12288,ck,4,0,13600.3267,a8w8_blockscale_1x128x128_256x16x256x128_8x16_16x16_1x4_16x16x1_8x32x1_1x16x1x16_8_1x2_intrawave_v1,121.27,28.37,0.0
gfx1201,64,16896,4096,16384,ck,4,0,20464.2199,a8w8_blockscale_1x128x128_256x16x256x128_8x16_16x16_1x4_16x16x1_8x32x1_1x16x1x16_8_1x2_intrawave_v1,110.82,23.57,0.0
gfx1201,64,512,5120,5120,ck,4,0,215.7528,a8w8_blockscale_1x128x128_256x16x256x128_8x16_16x16_1x4_16x16x1_8x32x1_1x16x1x16_8_1x2_intrawave_v1,124.42,157.95,0.0
gfx1201,64,784,5120,5120,ck,4,0,346.2177,a8w8_blockscale_1x128x128_256x16x256x128_8x16_16x16_1x4_16x16x1_8x32x1_1x16x1x16_8_1x2_intrawave_v1,118.72,110.5,0.0
gfx1201,64,784,5120,13824,ck,4,0,894.087,a8w8_blockscale_1x128x128_256x16x256x128_8x16_16x16_1x4_16x16x1_8x32x1_1x16x1x16_8_1x2_intrawave_v1,124.13,100.26,0.0
gfx1201,64,855,5120,5120,ck,4,0,393.1415,a8w8_blockscale_1x128x128_256x16x256x128_8x16_16x16_1x4_16x16x1_8x32x1_1x16x1x16_8_1x2_intrawave_v1,114.02,100.08,0.0
gfx1201,64,855,5120,13824,ck,4,0,1041.9756,a8w8_blockscale_1x128x128_256x16x256x128_8x16_16x16_1x4_16x16x1_8x32x1_1x16x1x16_8_1x2_intrawave_v1,116.16,87.67,0.0
gfx1201,64,1568,5120,5120,ck,4,0,704.9329,a8w8_blockscale_1x128x128_256x16x256x128_8x16_16x16_1x4_16x16x1_8x32x1_1x16x1x16_8_1x2_intrawave_v1,116.62,71.35,0.0
gfx1201,64,1568,5120,13824,ck,7,0,2133.5289,a8w8_blockscale_1x128x128_256x16x128x256_16x16_16x16_1x2_16x16x1_16x16x1_1x16x1x16_8_1x2_intrawave_v1,104.04,50.86,0.0
gfx1201,64,2673,5120,5120,ck,4,0,1159.8937,a8w8_blockscale_1x128x128_256x16x256x128_8x16_16x16_1x4_16x16x1_8x32x1_1x16x1x16_8_1x2_intrawave_v1,120.82,58.0,0.0
gfx1201,64,2673,5120,13824,ck,4,0,3225.8662,a8w8_blockscale_1x128x128_256x16x256x128_8x16_16x16_1x4_16x16x1_8x32x1_1x16x1x16_8_1x2_intrawave_v1,117.3,41.88,0.0
gfx1201,64,3135,5120,5120,ck,5,0,1560.4437,a8w8_blockscale_1x128x128_256x16x128x128_8x16_16x16_1x2_16x16x1_8x32x1_1x16x1x16_8_1x2_intrawave_v1,105.33,47.66,0.0
gfx1201,64,3135,5120,13824,ck,4,0,4653.2689,a8w8_blockscale_1x128x128_256x16x256x128_8x16_16x16_1x4_16x16x1_8x32x1_1x16x1x16_8_1x2_intrawave_v1,95.37,31.42,0.0
gfx1201,64,5346,5120,5120,ck,4,0,2532.2522,a8w8_blockscale_1x128x128_256x16x256x128_8x16_16x16_1x4_16x16x1_8x32x1_1x16x1x16_8_1x2_intrawave_v1,110.69,42.78,0.0
gfx1201,64,5346,5120,13824,ck,7,0,7637.1859,a8w8_blockscale_1x128x128_256x16x128x256_16x16_16x16_1x2_16x16x1_16x16x1_1x16x1x16_8_1x2_intrawave_v1,99.09,26.11,0.0
gfx1201,64,18837,5120,5120,ck,4,0,9497.2161,a8w8_blockscale_1x128x128_256x16x256x128_8x16_16x16_1x4_16x16x1_8x32x1_1x16x1x16_8_1x2_intrawave_v1,103.99,33.23,0.0
gfx1201,64,18837,5120,13824,ck,7,0,33481.8023,a8w8_blockscale_1x128x128_256x16x128x256_16x16_16x16_1x2_16x16x1_16x16x1_1x16x1x16_8_1x2_intrawave_v1,79.64,15.65,0.0
gfx1201,64,37674,5120,5120,ck,4,0,17450.2927,a8w8_blockscale_1x128x128_256x16x256x128_8x16_16x16_1x4_16x16x1_8x32x1_1x16x1x16_8_1x2_intrawave_v1,113.19,34.66,0.0
gfx1201,64,37674,5120,13824,ck,4,0,47135.1164,a8w8_blockscale_1x128x128_256x16x256x128_8x16_16x16_1x4_16x16x1_8x32x1_1x16x1x16_8_1x2_intrawave_v1,113.14,20.74,0.0
gfx1201,64,128,6144,6144,ck,7,0,96.332,a8w8_blockscale_1x128x128_256x16x128x256_16x16_16x16_1x2_16x16x1_16x16x1_1x16x1x16_8_1x2_intrawave_v1,100.32,416.35,0.0
gfx1201,64,128,6144,18432,ck,4,0,259.6863,a8w8_blockscale_1x128x128_256x16x256x128_8x16_16x16_1x4_16x16x1_8x32x1_1x16x1x16_8_1x2_intrawave_v1,111.64,451.23,0.0
gfx1201,64,256,6144,6144,ck,4,0,158.0412,a8w8_blockscale_1x128x128_256x16x256x128_8x16_16x16_1x4_16x16x1_8x32x1_1x16x1x16_8_1x2_intrawave_v1,122.29,268.71,0.0
gfx1201,64,256,6144,18432,ck,4,0,458.8693,a8w8_blockscale_1x128x128_256x16x256x128_8x16_16x16_1x4_16x16x1_8x32x1_1x16x1x16_8_1x2_intrawave_v1,126.36,263.93,0.0
gfx1201,64,512,6144,6144,ck,4,0,307.0842,a8w8_blockscale_1x128x128_256x16x256x128_8x16_16x16_1x4_16x16x1_8x32x1_1x16x1x16_8_1x2_intrawave_v1,125.88,153.66,0.0
gfx1201,64,512,6144,18432,ck,4,0,883.4632,a8w8_blockscale_1x128x128_256x16x256x128_8x16_16x16_1x4_16x16x1_8x32x1_1x16x1x16_8_1x2_intrawave_v1,131.26,145.99,0.0
gfx1201,64,1024,6144,6144,ck,4,0,610.2103,a8w8_blockscale_1x128x128_256x16x256x128_8x16_16x16_1x4_16x16x1_8x32x1_1x16x1x16_8_1x2_intrawave_v1,126.69,92.79,0.0
gfx1201,64,1024,6144,18432,ck,4,0,1755.2894,a8w8_blockscale_1x128x128_256x16x256x128_8x16_16x16_1x4_16x16x1_8x32x1_1x16x1x16_8_1x2_intrawave_v1,132.13,82.44,0.0
gfx1201,64,1152,6144,24576,ck,7,0,3518.1861,a8w8_blockscale_1x128x128_256x16x128x256_16x16_16x16_1x2_16x16x1_16x16x1_1x16x1x16_8_1x2_intrawave_v1,98.88,54.99,0.0
gfx1201,64,1280,6144,24576,ck,4,0,3440.3481,a8w8_blockscale_1x128x128_256x16x256x128_8x16_16x16_1x4_16x16x1_8x32x1_1x16x1x16_8_1x2_intrawave_v1,112.36,57.6,0.0
gfx1201,64,1728,6144,18432,ck,7,0,5055.4492,a8w8_blockscale_1x128x128_256x16x128x256_16x16_16x16_1x2_16x16x1_16x16x1_1x16x1x16_8_1x2_intrawave_v1,77.42,32.9,0.0
gfx1201,64,1856,6144,24576,ck,7,0,9238.0913,a8w8_blockscale_1x128x128_256x16x128x256_16x16_16x16_1x2_16x16x1_16x16x1_1x16x1x16_8_1x2_intrawave_v1,60.67,23.75,0.0
gfx1201,64,2048,6144,6144,ck,4,0,1223.7232,a8w8_blockscale_1x128x128_256x16x256x128_8x16_16x16_1x4_16x16x1_8x32x1_1x16x1x16_8_1x2_intrawave_v1,126.35,61.69,0.0
gfx1201,64,2048,6144,18432,ck,4,0,3689.7024,a8w8_blockscale_1x128x128_256x16x256x128_8x16_16x16_1x4_16x16x1_8x32x1_1x16x1x16_8_1x2_intrawave_v1,125.72,47.74,0.0
gfx1201,64,2176,6144,24576,ck,7,0,6822.3646,a8w8_blockscale_1x128x128_256x16x128x256_16x16_16x16_1x2_16x16x1_16x16x1_1x16x1x16_8_1x2_intrawave_v1,96.32,33.89,0.0
gfx1201,64,2432,6144,24576,ck,7,0,7626.1208,a8w8_blockscale_1x128x128_256x16x128x256_16x16_16x16_1x2_16x16x1_16x16x1_1x16x1x16_8_1x2_intrawave_v1,96.31,31.56,0.0
gfx1201,64,3584,6144,24576,ck,4,0,9261.1301,a8w8_blockscale_1x128x128_256x16x256x128_8x16_16x16_1x4_16x16x1_8x32x1_1x16x1x16_8_1x2_intrawave_v1,116.87,30.57,0.0
gfx1201,64,4096,6144,6144,ck,4,0,2470.3971,a8w8_blockscale_1x128x128_256x16x256x128_8x16_16x16_1x4_16x16x1_8x32x1_1x16x1x16_8_1x2_intrawave_v1,125.18,45.84,0.0
gfx1201,64,4096,6144,18432,ck,4,0,7520.3987,a8w8_blockscale_1x128x128_256x16x256x128_8x16_16x16_1x4_16x16x1_8x32x1_1x16x1x16_8_1x2_intrawave_v1,123.36,31.79,0.0
gfx1201,64,4224,6144,24576,ck,7,0,13213.389,a8w8_blockscale_1x128x128_256x16x128x256_16x16_16x16_1x2_16x16x1_16x16x1_1x16x1x16_8_1x2_intrawave_v1,96.54,23.21,0.0
gfx1201,64,4608,6144,24576,ck,4,0,11927.2451,a8w8_blockscale_1x128x128_256x16x256x128_8x16_16x16_1x4_16x16x1_8x32x1_1x16x1x16_8_1x2_intrawave_v1,116.67,26.9,0.0
gfx1201,64,4800,6144,6144,ck,5,0,3488.2402,a8w8_blockscale_1x128x128_256x16x128x128_8x16_16x16_1x2_16x16x1_8x32x1_1x16x1x16_8_1x2_intrawave_v1,103.89,36.19,0.0
gfx1201,64,4800,6144,18432,ck,7,0,14307.2823,a8w8_blockscale_1x128x128_256x16x128x256_16x16_16x16_1x2_16x16x1_16x16x1_1x16x1x16_8_1x2_intrawave_v1,75.99,18.22,0.0
gfx1201,64,4864,6144,24576,ck,4,0,13360.286,a8w8_blockscale_1x128x128_256x16x256x128_8x16_16x16_1x4_16x16x1_8x32x1_1x16x1x16_8_1x2_intrawave_v1,109.94,24.72,0.0
gfx1201,64,4928,6144,24576,ck,7,0,26414.8301,a8w8_blockscale_1x128x128_256x16x128x256_16x16_16x16_1x2_16x16x1_16x16x1_1x16x1x16_8_1x2_intrawave_v1,56.34,12.59,0.0
gfx1201,64,5504,6144,24576,ck,7,0,17272.6669,a8w8_blockscale_1x128x128_256x16x128x256_16x16_16x16_1x2_16x16x1_16x16x1_1x16x1x16_8_1x2_intrawave_v1,96.23,20.49,0.0
gfx1201,64,7424,6144,24576,ck,4,0,20386.1587,a8w8_blockscale_1x128x128_256x16x256x128_8x16_16x16_1x4_16x16x1_8x32x1_1x16x1x16_8_1x2_intrawave_v1,109.98,20.83,0.0
gfx1201,64,8192,6144,6144,ck,4,0,4986.4265,a8w8_blockscale_1x128x128_256x16x256x128_8x16_16x16_1x4_16x16x1_8x32x1_1x16x1x16_8_1x2_intrawave_v1,124.03,37.85,0.0
gfx1201,64,8192,6144,18432,ck,4,0,15040.2325,a8w8_blockscale_1x128x128_256x16x256x128_8x16_16x16_1x4_16x16x1_8x32x1_1x16x1x16_8_1x2_intrawave_v1,123.36,24.26,0.0
gfx1201,64,8448,6144,24576,ck,4,0,23184.1938,a8w8_blockscale_1x128x128_256x16x256x128_8x16_16x16_1x4_16x16x1_8x32x1_1x16x1x16_8_1x2_intrawave_v1,110.04,19.95,0.0
gfx1201,64,9728,6144,24576,ck,4,0,25242.5705,a8w8_blockscale_1x128x128_256x16x256x128_8x16_16x16_1x4_16x16x1_8x32x1_1x16x1x16_8_1x2_intrawave_v1,116.38,20.19,0.0
gfx1201,64,9856,6144,24576,ck,7,0,30922.5565,a8w8_blockscale_1x128x128_256x16x128x256_16x16_16x16_1x2_16x16x1_16x16x1_1x16x1x16_8_1x2_intrawave_v1,96.25,16.63,0.0
gfx1201,64,11008,6144,24576,ck,4,0,30227.9921,a8w8_blockscale_1x128x128_256x16x256x128_8x16_16x16_1x4_16x16x1_8x32x1_1x16x1x16_8_1x2_intrawave_v1,109.97,18.42,0.0
gfx1201,64,16896,6144,24576,ck,4,0,43775.8962,a8w8_blockscale_1x128x128_256x16x256x128_8x16_16x16_1x4_16x16x1_8x32x1_1x16x1x16_8_1x2_intrawave_v1,116.56,17.68,0.0
gfx1201,64,19712,6144,24576,ck,4,0,54206.9764,a8w8_blockscale_1x128x128_256x16x256x128_8x16_16x16_1x4_16x16x1_8x32x1_1x16x1x16_8_1x2_intrawave_v1,109.82,16.19,0.0
gfx1201,64,22016,6144,24576,ck,4,0,57187.6476,a8w8_blockscale_1x128x128_256x16x256x128_8x16_16x16_1x4_16x16x1_8x32x1_1x16x1x16_8_1x2_intrawave_v1,116.26,16.83,0.0
gfx1201,64,1,9216,3072,ck,7,0,56.5402,a8w8_blockscale_1x128x128_256x16x128x256_16x16_16x16_1x2_16x16x1_16x16x1_1x16x1x16_8_1x2_intrawave_v1,1.0,501.11,0.0
gfx1201,64,333,9728,2432,ck,4,0,139.8652,a8w8_blockscale_1x128x128_256x16x256x128_8x16_16x16_1x4_16x16x1_8x32x1_1x16x1x16_8_1x2_intrawave_v1,112.66,221.26,0.0
gfx1201,64,666,9728,2432,ck,4,0,277.9242,a8w8_blockscale_1x128x128_256x16x256x128_8x16_16x16_1x4_16x16x1_8x32x1_1x16x1x16_8_1x2_intrawave_v1,113.39,137.58,0.0
gfx1201,64,2048,9728,2432,ck,4,0,824.9312,a8w8_blockscale_1x128x128_256x16x256x128_8x16_16x16_1x4_16x16x1_8x32x1_1x16x1x16_8_1x2_intrawave_v1,117.47,83.02,0.0
gfx1201,64,4096,9728,2432,ck,4,0,1633.9028,a8w8_blockscale_1x128x128_256x16x256x128_8x16_16x16_1x4_16x16x1_8x32x1_1x16x1x16_8_1x2_intrawave_v1,118.62,69.35,0.0
gfx1201,64,8192,9728,2432,ck,4,0,3324.4787,a8w8_blockscale_1x128x128_256x16x256x128_8x16_16x16_1x4_16x16x1_8x32x1_1x16x1x16_8_1x2_intrawave_v1,116.6,61.05,0.0
gfx1201,64,16,10240,3840,ck,7,0,65.9802,a8w8_blockscale_1x128x128_256x16x128x256_16x16_16x16_1x2_16x16x1_16x16x1_1x16x1x16_8_1x2_intrawave_v1,19.07,601.86,0.0
gfx1201,64,32,10240,3840,ck,7,0,68.1067,a8w8_blockscale_1x128x128_256x16x128x256_16x16_16x16_1x2_16x16x1_16x16x1_1x16x1x16_8_1x2_intrawave_v1,36.95,588.78,0.0
gfx1201,64,64,10240,3840,ck,5,0,73.4868,a8w8_blockscale_1x128x128_256x16x128x128_8x16_16x16_1x2_16x16x1_8x32x1_1x16x1x16_8_1x2_intrawave_v1,68.49,556.26,0.0
gfx1201,64,160,10240,3840,ck,4,0,127.2246,a8w8_blockscale_1x128x128_256x16x256x128_8x16_16x16_1x4_16x16x1_8x32x1_1x16x1x16_8_1x2_intrawave_v1,98.9,339.66,0.0
gfx1201,64,168,10240,3840,ck,4,0,132.7239,a8w8_blockscale_1x128x128_256x16x256x128_8x16_16x16_1x4_16x16x1_8x32x1_1x16x1x16_8_1x2_intrawave_v1,99.55,327.05,0.0
gfx1201,64,320,10240,3840,ck,4,0,235.7702,a8w8_blockscale_1x128x128_256x16x256x128_8x16_16x16_1x4_16x16x1_8x32x1_1x16x1x16_8_1x2_intrawave_v1,106.74,199.79,0.0
gfx1201,64,336,10240,3840,ck,4,0,225.6788,a8w8_blockscale_1x128x128_256x16x256x128_8x16_16x16_1x4_16x16x1_8x32x1_1x16x1x16_8_1x2_intrawave_v1,117.09,210.45,0.0
gfx1201,64,640,10240,3840,ck,4,0,415.9011,a8w8_blockscale_1x128x128_256x16x256x128_8x16_16x16_1x4_16x16x1_8x32x1_1x16x1x16_8_1x2_intrawave_v1,121.02,131.97,0.0
gfx1201,64,672,10240,3840,ck,4,0,451.3114,a8w8_blockscale_1x128x128_256x16x256x128_8x16_16x16_1x4_16x16x1_8x32x1_1x16x1x16_8_1x2_intrawave_v1,117.1,123.34,0.0
gfx1201,64,2048,10240,3840,ck,4,0,1303.5843,a8w8_blockscale_1x128x128_256x16x256x128_8x16_16x16_1x4_16x16x1_8x32x1_1x16x1x16_8_1x2_intrawave_v1,123.55,68.37,0.0
gfx1201,64,4096,10240,3840,ck,4,0,2642.9538,a8w8_blockscale_1x128x128_256x16x256x128_8x16_16x16_1x4_16x16x1_8x32x1_1x16x1x16_8_1x2_intrawave_v1,121.88,52.57,0.0
gfx1201,64,8192,10240,3840,ck,4,0,5360.9455,a8w8_blockscale_1x128x128_256x16x256x128_8x16_16x16_1x4_16x16x1_8x32x1_1x16x1x16_8_1x2_intrawave_v1,120.17,44.5,0.0
gfx1201,64,4,12288,3072,ck,4,0,78.0345,a8w8_blockscale_1x128x128_256x16x256x128_8x16_16x16_1x4_16x16x1_8x32x1_1x16x1x16_8_1x2_intrawave_v1,3.87,485.16,0.0
gfx1201,64,7,12288,3072,ck,4,0,79.6485,a8w8_blockscale_1x128x128_256x16x256x128_8x16_16x16_1x4_16x16x1_8x32x1_1x16x1x16_8_1x2_intrawave_v1,6.64,476.37,0.0
gfx1201,64,14,12288,3072,ck,4,0,80.3842,a8w8_blockscale_1x128x128_256x16x256x128_8x16_16x16_1x4_16x16x1_8x32x1_1x16x1x16_8_1x2_intrawave_v1,13.15,474.42,0.0
gfx1201,64,64,12288,3072,ck,7,0,74.3092,a8w8_blockscale_1x128x128_256x16x128x256_16x16_16x16_1x2_16x16x1_16x16x1_1x16x1x16_8_1x2_intrawave_v1,65.02,531.81,0.0
gfx1201,64,128,12288,3072,ck,7,0,97.3968,a8w8_blockscale_1x128x128_256x16x128x256_16x16_16x16_1x2_16x16x1_16x16x1_1x16x1x16_8_1x2_intrawave_v1,99.22,423.91,0.0
gfx1201,64,256,12288,3072,ck,4,0,163.7036,a8w8_blockscale_1x128x128_256x16x256x128_8x16_16x16_1x4_16x16x1_8x32x1_1x16x1x16_8_1x2_intrawave_v1,118.06,273.83,0.0
gfx1201,64,351,12288,3072,ck,4,0,255.919,a8w8_blockscale_1x128x128_256x16x256x128_8x16_16x16_1x4_16x16x1_8x32x1_1x16x1x16_8_1x2_intrawave_v1,103.55,185.42,0.0
gfx1201,64,353,12288,3072,ck,4,0,278.2116,a8w8_blockscale_1x128x128_256x16x256x128_8x16_16x16_1x4_16x16x1_8x32x1_1x16x1x16_8_1x2_intrawave_v1,95.79,170.76,0.0
gfx1201,64,1024,12288,3072,ck,4,0,637.7844,a8w8_blockscale_1x128x128_256x16x256x128_8x16_16x16_1x4_16x16x1_8x32x1_1x16x1x16_8_1x2_intrawave_v1,121.22,103.58,0.0
gfx1201,64,2048,12288,3072,ck,4,0,1279.7885,a8w8_blockscale_1x128x128_256x16x256x128_8x16_16x16_1x4_16x16x1_8x32x1_1x16x1x16_8_1x2_intrawave_v1,120.82,73.74,0.0
gfx1201,64,4096,12288,3072,ck,4,0,2582.0643,a8w8_blockscale_1x128x128_256x16x256x128_8x16_16x16_1x4_16x16x1_8x32x1_1x16x1x16_8_1x2_intrawave_v1,119.76,58.48,0.0
gfx1201,64,8192,12288,3072,ck,4,0,5207.3063,a8w8_blockscale_1x128x128_256x16x256x128_8x16_16x16_1x4_16x16x1_8x32x1_1x16x1x16_8_1x2_intrawave_v1,118.77,50.74,0.0
gfx1201,64,784,13824,5120,ck,7,0,1057.9604,a8w8_blockscale_1x128x128_256x16x128x256_16x16_16x16_1x2_16x16x1_16x16x1_1x16x1x16_8_1x2_intrawave_v1,104.9,91.18,0.0
gfx1201,64,855,13824,5120,ck,4,0,1077.7171,a8w8_blockscale_1x128x128_256x16x256x128_8x16_16x16_1x4_16x16x1_8x32x1_1x16x1x16_8_1x2_intrawave_v1,112.3,91.67,0.0
gfx1201,64,1568,13824,5120,ck,5,0,2129.2977,a8w8_blockscale_1x128x128_256x16x128x128_8x16_16x16_1x2_16x16x1_8x32x1_1x16x1x16_8_1x2_intrawave_v1,104.24,57.37,0.0
gfx1201,64,2673,13824,5120,ck,4,0,3298.952,a8w8_blockscale_1x128x128_256x16x256x128_8x16_16x16_1x4_16x16x1_8x32x1_1x16x1x16_8_1x2_intrawave_v1,114.7,48.01,0.0
gfx1201,64,3135,13824,5120,ck,4,0,4592.8406,a8w8_blockscale_1x128x128_256x16x256x128_8x16_16x16_1x4_16x16x1_8x32x1_1x16x1x16_8_1x2_intrawave_v1,96.63,37.78,0.0
gfx1201,64,5346,13824,5120,ck,5,0,7621.4443,a8w8_blockscale_1x128x128_256x16x128x128_8x16_16x16_1x2_16x16x1_8x32x1_1x16x1x16_8_1x2_intrawave_v1,99.29,32.27,0.0
gfx1201,64,18837,13824,5120,ck,5,0,27115.1476,a8w8_blockscale_1x128x128_256x16x128x128_8x16_16x16_1x2_16x16x1_8x32x1_1x16x1x16_8_1x2_intrawave_v1,98.34,25.37,0.0
gfx1201,64,37674,13824,5120,ck,4,0,48015.0215,a8w8_blockscale_1x128x128_256x16x256x128_8x16_16x16_1x4_16x16x1_8x32x1_1x16x1x16_8_1x2_intrawave_v1,111.07,27.18,0.0
gfx1201,64,6851,14336,3072,ck,4,0,5347.2975,a8w8_blockscale_1x128x128_256x16x256x128_8x16_16x16_1x4_16x16x1_8x32x1_1x16x1x16_8_1x2_intrawave_v1,112.85,48.91,0.0
gfx1201,64,7130,14336,3072,ck,4,0,5556.9201,a8w8_blockscale_1x128x128_256x16x256x128_8x16_16x16_1x4_16x16x1_8x32x1_1x16x1x16_8_1x2_intrawave_v1,113.01,48.66,0.0
gfx1201,64,13702,14336,3072,ck,4,0,10688.0083,a8w8_blockscale_1x128x128_256x16x256x128_8x16_16x16_1x4_16x16x1_8x32x1_1x16x1x16_8_1x2_intrawave_v1,112.92,44.82,0.0
gfx1201,64,14260,14336,3072,ck,4,0,11130.4583,a8w8_blockscale_1x128x128_256x16x256x128_8x16_16x16_1x4_16x16x1_8x32x1_1x16x1x16_8_1x2_intrawave_v1,112.85,44.63,0.0
gfx1201,64,27404,14336,3072,ck,4,0,21270.9809,a8w8_blockscale_1x128x128_256x16x256x128_8x16_16x16_1x4_16x16x1_8x32x1_1x16x1x16_8_1x2_intrawave_v1,113.48,42.97,0.0
gfx1201,64,28520,14336,3072,ck,4,0,22165.7671,a8w8_blockscale_1x128x128_256x16x256x128_8x16_16x16_1x4_16x16x1_8x32x1_1x16x1x16_8_1x2_intrawave_v1,113.33,42.83,0.0
gfx1201,64,1,15360,256,ck,7,0,8.453,a8w8_blockscale_1x128x128_256x16x128x256_16x16_16x16_1x2_16x16x1_16x16x1_1x16x1x16_8_1x2_intrawave_v1,0.93,468.84,0.0
gfx1201,64,2,15360,256,ck,7,0,8.4914,a8w8_blockscale_1x128x128_256x16x128x256_16x16_16x16_1x2_16x16x1_16x16x1_1x16x1x16_8_1x2_intrawave_v1,1.85,470.37,0.0
gfx1201,64,1,18432,3072,ck,7,0,107.6069,a8w8_blockscale_1x128x128_256x16x128x256_16x16_16x16_1x2_16x16x1_16x16x1_1x16x1x16_8_1x2_intrawave_v1,1.05,526.57,0.0
gfx1201,64,128,18432,3072,ck,4,0,142.5174,a8w8_blockscale_1x128x128_256x16x256x128_8x16_16x16_1x4_16x16x1_8x32x1_1x16x1x16_8_1x2_intrawave_v1,101.71,433.17,0.0
gfx1201,64,256,18432,3072,ck,4,0,248.2515,a8w8_blockscale_1x128x128_256x16x256x128_8x16_16x16_1x4_16x16x1_8x32x1_1x16x1x16_8_1x2_intrawave_v1,116.78,269.27,0.0
gfx1201,64,512,18432,3072,ck,4,0,481.5084,a8w8_blockscale_1x128x128_256x16x256x128_8x16_16x16_1x4_16x16x1_8x32x1_1x16x1x16_8_1x2_intrawave_v1,120.42,160.06,0.0
gfx1201,64,4096,18432,3072,ck,4,0,3970.732,a8w8_blockscale_1x128x128_256x16x256x128_8x16_16x16_1x4_16x16x1_8x32x1_1x16x1x16_8_1x2_intrawave_v1,116.82,55.46,0.0
gfx1201,64,8192,18432,3072,ck,4,0,8024.628,a8w8_blockscale_1x128x128_256x16x256x128_8x16_16x16_1x4_16x16x1_8x32x1_1x16x1x16_8_1x2_intrawave_v1,115.61,47.83,0.0
gfx1201,64,128,24576,4096,ck,7,0,258.4631,a8w8_blockscale_1x128x128_256x16x128x256_16x16_16x16_1x2_16x16x1_16x16x1_1x16x1x16_8_1x2_intrawave_v1,99.7,415.84,0.0
gfx1201,64,256,24576,4096,ck,4,0,466.3702,a8w8_blockscale_1x128x128_256x16x256x128_8x16_16x16_1x4_16x16x1_8x32x1_1x16x1x16_8_1x2_intrawave_v1,110.51,245.07,0.0
gfx1201,64,512,24576,4096,ck,4,0,861.468,a8w8_blockscale_1x128x128_256x16x256x128_8x16_16x16_1x4_16x16x1_8x32x1_1x16x1x16_8_1x2_intrawave_v1,119.66,148.5,0.0
gfx1201,64,4096,24576,4096,ck,4,0,7076.3101,a8w8_blockscale_1x128x128_256x16x256x128_8x16_16x16_1x4_16x16x1_8x32x1_1x16x1x16_8_1x2_intrawave_v1,116.53,45.05,0.0
gfx1201,64,8192,24576,4096,ck,4,0,14096.2224,a8w8_blockscale_1x128x128_256x16x256x128_8x16_16x16_1x4_16x16x1_8x32x1_1x16x1x16_8_1x2_intrawave_v1,117.0,38.09,0.0
gfx1201,64,4224,27648,3072,ck,4,0,6952.7506,a8w8_blockscale_1x128x128_256x16x256x128_8x16_16x16_1x4_16x16x1_8x32x1_1x16x1x16_8_1x2_intrawave_v1,103.2,47.68,0.0
gfx1201,64,8448,27648,3072,ck,4,0,12855.3137,a8w8_blockscale_1x128x128_256x16x256x128_8x16_16x16_1x4_16x16x1_8x32x1_1x16x1x16_8_1x2_intrawave_v1,111.63,44.96,0.0
gfx1201,64,16896,27648,3072,ck,4,0,25093.7534,a8w8_blockscale_1x128x128_256x16x256x128_8x16_16x16_1x4_16x16x1_8x32x1_1x16x1x16_8_1x2_intrawave_v1,114.38,42.68,0.0
gfx1201,64,128,36864,6144,ck,4,0,506.9116,a8w8_blockscale_1x128x128_256x16x256x128_8x16_16x16_1x4_16x16x1_8x32x1_1x16x1x16_8_1x2_intrawave_v1,114.38,466.98,0.0
gfx1201,64,256,36864,6144,ck,4,0,921.7726,a8w8_blockscale_1x128x128_256x16x256x128_8x16_16x16_1x4_16x16x1_8x32x1_1x16x1x16_8_1x2_intrawave_v1,125.81,267.9,0.0
gfx1201,64,512,36864,6144,ck,4,0,1830.0889,a8w8_blockscale_1x128x128_256x16x256x128_8x16_16x16_1x4_16x16x1_8x32x1_1x16x1x16_8_1x2_intrawave_v1,126.73,146.11,0.0
gfx1201,64,1024,36864,6144,ck,4,0,3738.9631,a8w8_blockscale_1x128x128_256x16x256x128_8x16_16x16_1x4_16x16x1_8x32x1_1x16x1x16_8_1x2_intrawave_v1,124.06,82.45,0.0
gfx1201,64,1728,36864,6144,ck,7,0,10295.3983,a8w8_blockscale_1x128x128_256x16x128x256_16x16_16x16_1x2_16x16x1_16x16x1_1x16x1x16_8_1x2_intrawave_v1,76.03,35.41,0.0
gfx1201,64,2048,36864,6144,ck,4,0,7672.6452,a8w8_blockscale_1x128x128_256x16x256x128_8x16_16x16_1x4_16x16x1_8x32x1_1x16x1x16_8_1x2_intrawave_v1,120.91,50.84,0.0
gfx1201,64,4096,36864,6144,ck,4,0,15393.4378,a8w8_blockscale_1x128x128_256x16x256x128_8x16_16x16_1x4_16x16x1_8x32x1_1x16x1x16_8_1x2_intrawave_v1,120.53,35.97,0.0
gfx1201,64,4224,36864,4096,ck,4,0,12667.6948,a8w8_blockscale_1x128x128_256x16x256x128_8x16_16x16_1x4_16x16x1_8x32x1_1x16x1x16_8_1x2_intrawave_v1,100.7,37.87,0.0
gfx1201,64,4800,36864,6144,ck,7,0,28543.011,a8w8_blockscale_1x128x128_256x16x128x256_16x16_16x16_1x2_16x16x1_16x16x1_1x16x1x16_8_1x2_intrawave_v1,76.18,21.37,0.0
gfx1201,64,8192,36864,6144,ck,4,0,30751.1029,a8w8_blockscale_1x128x128_256x16x256x128_8x16_16x16_1x4_16x16x1_8x32x1_1x16x1x16_8_1x2_intrawave_v1,120.67,28.64,0.0
gfx1201,64,8448,36864,4096,ck,4,0,22899.9927,a8w8_blockscale_1x128x128_256x16x256x128_8x16_16x16_1x4_16x16x1_8x32x1_1x16x1x16_8_1x2_intrawave_v1,111.41,35.3,0.0
gfx1201,64,16896,36864,4096,ck,4,0,43555.5913,a8w8_blockscale_1x128x128_256x16x256x128_8x16_16x16_1x4_16x16x1_8x32x1_1x16x1x16_8_1x2_intrawave_v1,117.15,33.66,0.0
gfx1201,64,1152,55296,6144,ck,4,0,7095.3696,a8w8_blockscale_1x128x128_256x16x256x128_8x16_16x16_1x4_16x16x1_8x32x1_1x16x1x16_8_1x2_intrawave_v1,110.32,66.83,0.0
gfx1201,64,1280,55296,6144,ck,4,0,7331.4751,a8w8_blockscale_1x128x128_256x16x256x128_8x16_16x16_1x4_16x16x1_8x32x1_1x16x1x16_8_1x2_intrawave_v1,118.63,66.72,0.0
gfx1201,64,1856,55296,6144,ck,7,0,16452.2885,a8w8_blockscale_1x128x128_256x16x128x256_16x16_16x16_1x2_16x16x1_16x16x1_1x16x1x16_8_1x2_intrawave_v1,76.65,33.82,0.0
gfx1201,64,2176,55296,6144,ck,4,0,13511.4029,a8w8_blockscale_1x128x128_256x16x256x128_8x16_16x16_1x4_16x16x1_8x32x1_1x16x1x16_8_1x2_intrawave_v1,109.43,43.94,0.0
gfx1201,64,2432,55296,6144,ck,4,0,15125.5391,a8w8_blockscale_1x128x128_256x16x256x128_8x16_16x16_1x4_16x16x1_8x32x1_1x16x1x16_8_1x2_intrawave_v1,109.25,41.23,0.0
gfx1201,64,3584,55296,6144,ck,4,0,20210.72,a8w8_blockscale_1x128x128_256x16x256x128_8x16_16x16_1x4_16x16x1_8x32x1_1x16x1x16_8_1x2_intrawave_v1,120.49,37.51,0.0
gfx1201,64,4224,55296,6144,ck,4,0,26262.353,a8w8_blockscale_1x128x128_256x16x256x128_8x16_16x16_1x4_16x16x1_8x32x1_1x16x1x16_8_1x2_intrawave_v1,109.29,31.71,0.0
gfx1201,64,4608,55296,6144,ck,4,0,25949.8145,a8w8_blockscale_1x128x128_256x16x256x128_8x16_16x16_1x4_16x16x1_8x32x1_1x16x1x16_8_1x2_intrawave_v1,120.66,33.82,0.0
gfx1201,64,4864,55296,6144,ck,4,0,28174.3959,a8w8_blockscale_1x128x128_256x16x256x128_8x16_16x16_1x4_16x16x1_8x32x1_1x16x1x16_8_1x2_intrawave_v1,117.3,32.21,0.0
gfx1201,64,4928,55296,6144,ck,7,0,43632.2214,a8w8_blockscale_1x128x128_256x16x128x256_16x16_16x16_1x2_16x16x1_16x16x1_1x16x1x16_8_1x2_intrawave_v1,76.74,20.97,0.0
gfx1201,64,5504,55296,6144,ck,4,0,34284.2105,a8w8_blockscale_1x128x128_256x16x256x128_8x16_16x16_1x4_16x16x1_8x32x1_1x16x1x16_8_1x2_intrawave_v1,109.08,28.65,0.0
gfx1201,64,7424,55296,6144,ck,4,0,42999.1147,a8w8_blockscale_1x128x128_256x16x256x128_8x16_16x16_1x4_16x16x1_8x32x1_1x16x1x16_8_1x2_intrawave_v1,117.31,28.06,0.0
gfx1201,64,8448,55296,6144,ck,4,0,48947.7123,a8w8_blockscale_1x128x128_256x16x256x128_8x16_16x16_1x4_16x16x1_8x32x1_1x16x1x16_8_1x2_intrawave_v1,117.27,27.09,0.0
gfx1201,64,9728,55296,6144,ck,4,0,54844.0445,a8w8_blockscale_1x128x128_256x16x256x128_8x16_16x16_1x4_16x16x1_8x32x1_1x16x1x16_8_1x2_intrawave_v1,120.52,26.9,0.0
gfx1201,64,9856,55296,6144,ck,4,0,61461.5533,a8w8_blockscale_1x128x128_256x16x256x128_8x16_16x16_1x4_16x16x1_8x32x1_1x16x1x16_8_1x2_intrawave_v1,108.96,24.25,0.0
gfx1201,64,11008,55296,6144,ck,4,0,63751.8386,a8w8_blockscale_1x128x128_256x16x256x128_8x16_16x16_1x4_16x16x1_8x32x1_1x16x1x16_8_1x2_intrawave_v1,117.33,25.49,0.0
gfx1201,64,16896,55296,6144,ck,4,0,95145.9258,a8w8_blockscale_1x128x128_256x16x256x128_8x16_16x16_1x4_16x16x1_8x32x1_1x16x1x16_8_1x2_intrawave_v1,120.66,24.3,0.0
gfx1201,64,19712,55296,6144,ck,4,0,114309.1271,a8w8_blockscale_1x128x128_256x16x256x128_8x16_16x16_1x4_16x16x1_8x32x1_1x16x1x16_8_1x2_intrawave_v1,117.17,23.1,0.0
gfx1201,64,22016,55296,6144,ck,4,0,124147.7779,a8w8_blockscale_1x128x128_256x16x256x128_8x16_16x16_1x4_16x16x1_8x32x1_1x16x1x16_8_1x2_intrawave_v1,120.5,23.44,0.0
