aiter/configs/model_configs/bf16_tuned_gemm_qwen3next.csv
gfx,cu_num,M,N,K,bias,dtype,outdtype,scaleAB,bpreshuffle,libtype,solidx,splitK,us,kernelName,err_ratio,tflops,bw
gfx950,256,1,16,2048,False,torch.bfloat16,torch.bfloat16,False,False,skinny,2,0,2.9234,sol2,0.0,0.02,23.83
gfx950,256,2,16,2048,False,torch.bfloat16,torch.bfloat16,False,False,skinny,2,0,2.6255,sol2,0.0,0.05,28.11
gfx950,256,4,16,2048,False,torch.bfloat16,torch.bfloat16,False,False,skinny,2,0,2.9986,sol2,0.0,0.09,27.36
gfx950,256,8,16,2048,False,torch.bfloat16,torch.bfloat16,False,False,skinny,2,0,3.791,sol2,0.0,0.14,26.0
gfx950,256,16,16,2048,False,torch.bfloat16,torch.bfloat16,False,False,torch,0,0,4.8617,native,0.0,0.22,27.07
gfx950,256,24,16,2048,False,torch.bfloat16,torch.bfloat16,False,False,torch,0,0,5.0282,native,0.0,0.31,32.74
gfx950,256,32,16,2048,False,torch.bfloat16,torch.bfloat16,False,False,torch,0,0,5.2269,native,0.0,0.4,37.81
gfx950,256,40,16,2048,False,torch.bfloat16,torch.bfloat16,False,False,torch,0,0,5.1355,native,0.0,0.51,44.91
gfx950,256,48,16,2048,False,torch.bfloat16,torch.bfloat16,False,False,torch,0,0,5.2155,native,0.0,0.6,50.56
gfx950,256,56,16,2048,False,torch.bfloat16,torch.bfloat16,False,False,torch,0,0,5.2651,native,0.0,0.7,56.35
gfx950,256,64,16,2048,False,torch.bfloat16,torch.bfloat16,False,False,torch,0,0,5.5719,native,0.0,0.75,59.18
gfx950,256,72,16,2048,False,torch.bfloat16,torch.bfloat16,False,False,torch,0,0,6.0504,native,0.0,0.78,59.96
gfx950,256,80,16,2048,False,torch.bfloat16,torch.bfloat16,False,False,torch,0,0,5.6471,native,0.0,0.93,70.08
gfx950,256,88,16,2048,False,torch.bfloat16,torch.bfloat16,False,False,torch,0,0,5.5831,native,0.0,1.03,76.8
gfx950,256,96,16,2048,False,torch.bfloat16,torch.bfloat16,False,False,torch,0,0,5.8928,native,0.0,1.07,78.37
gfx950,256,104,16,2048,False,torch.bfloat16,torch.bfloat16,False,False,torch,0,0,6.3401,native,0.0,1.08,78.05
gfx950,256,112,16,2048,False,torch.bfloat16,torch.bfloat16,False,False,torch,0,0,6.3227,native,0.0,1.16,83.49
gfx950,256,120,16,2048,False,torch.bfloat16,torch.bfloat16,False,False,torch,0,0,6.3133,native,0.0,1.25,88.84
gfx950,256,128,16,2048,False,torch.bfloat16,torch.bfloat16,False,False,torch,0,0,5.7846,native,0.0,1.45,102.67
gfx950,256,136,16,2048,False,torch.bfloat16,torch.bfloat16,False,False,torch,0,0,6.3278,native,0.0,1.41,99.08
gfx950,256,144,16,2048,False,torch.bfloat16,torch.bfloat16,False,False,torch,0,0,5.7582,native,0.0,1.64,114.61
gfx950,256,152,16,2048,False,torch.bfloat16,torch.bfloat16,False,False,torch,0,0,5.7918,native,0.0,1.72,119.65
gfx950,256,160,16,2048,False,torch.bfloat16,torch.bfloat16,False,False,torch,0,0,5.7764,native,0.0,1.82,125.69
gfx950,256,168,16,2048,False,torch.bfloat16,torch.bfloat16,False,False,torch,0,0,6.4048,native,0.0,1.72,118.51
gfx950,256,176,16,2048,False,torch.bfloat16,torch.bfloat16,False,False,torch,0,0,6.4087,native,0.0,1.8,123.59
gfx950,256,184,16,2048,False,torch.bfloat16,torch.bfloat16,False,False,torch,0,0,5.8711,native,0.0,2.05,140.53
gfx950,256,192,16,2048,False,torch.bfloat16,torch.bfloat16,False,False,torch,0,0,6.3384,native,0.0,1.99,135.38
gfx950,256,200,16,2048,False,torch.bfloat16,torch.bfloat16,False,False,torch,0,0,6.4555,native,0.0,2.03,138.04
gfx950,256,208,16,2048,False,torch.bfloat16,torch.bfloat16,False,False,torch,0,0,6.4164,native,0.0,2.12,144.03
gfx950,256,216,16,2048,False,torch.bfloat16,torch.bfloat16,False,False,torch,0,0,6.3328,native,0.0,2.24,151.15
gfx950,256,224,16,2048,False,torch.bfloat16,torch.bfloat16,False,False,torch,0,0,6.3199,native,0.0,2.32,156.68
gfx950,256,232,16,2048,False,torch.bfloat16,torch.bfloat16,False,False,torch,0,0,5.8629,native,0.0,2.59,174.53
gfx950,256,240,16,2048,False,torch.bfloat16,torch.bfloat16,False,False,torch,0,0,6.4127,native,0.0,2.45,164.71
gfx950,256,248,16,2048,False,torch.bfloat16,torch.bfloat16,False,False,torch,0,0,6.3659,native,0.0,2.55,171.11
gfx950,256,256,16,2048,False,torch.bfloat16,torch.bfloat16,False,False,torch,0,0,5.8288,native,0.0,2.88,192.54
gfx950,256,272,16,2048,False,torch.bfloat16,torch.bfloat16,False,False,torch,0,0,6.2944,native,0.0,2.83,188.8
gfx950,256,288,16,2048,False,torch.bfloat16,torch.bfloat16,False,False,torch,0,0,6.3518,native,0.0,2.97,197.49
gfx950,256,304,16,2048,False,torch.bfloat16,torch.bfloat16,False,False,torch,0,0,6.3125,native,0.0,3.16,209.18
gfx950,256,320,16,2048,False,torch.bfloat16,torch.bfloat16,False,False,torch,0,0,5.8298,native,0.0,3.6,237.83
gfx950,256,336,16,2048,False,torch.bfloat16,torch.bfloat16,False,False,torch,0,0,5.8374,native,0.0,3.77,248.83
gfx950,256,352,16,2048,False,torch.bfloat16,torch.bfloat16,False,False,torch,0,0,5.7873,native,0.0,3.99,262.4
gfx950,256,368,16,2048,False,torch.bfloat16,torch.bfloat16,False,False,torch,0,0,5.7974,native,0.0,4.16,273.34
gfx950,256,384,16,2048,False,torch.bfloat16,torch.bfloat16,False,False,torch,0,0,5.7754,native,0.0,4.36,285.81
gfx950,256,400,16,2048,False,torch.bfloat16,torch.bfloat16,False,False,torch,0,0,5.7492,native,0.0,4.56,298.6
gfx950,256,416,16,2048,False,torch.bfloat16,torch.bfloat16,False,False,torch,0,0,5.7398,native,0.0,4.75,310.6
gfx950,256,432,16,2048,False,torch.bfloat16,torch.bfloat16,False,False,torch,0,0,6.2993,native,0.0,4.49,293.5
gfx950,256,448,16,2048,False,torch.bfloat16,torch.bfloat16,False,False,torch,0,0,6.2986,native,0.0,4.66,304.02
gfx950,256,464,16,2048,False,torch.bfloat16,torch.bfloat16,False,False,torch,0,0,6.3456,native,0.0,4.79,312.17
gfx950,256,480,16,2048,False,torch.bfloat16,torch.bfloat16,False,False,torch,0,0,6.3882,native,0.0,4.92,320.43
gfx950,256,496,16,2048,False,torch.bfloat16,torch.bfloat16,False,False,torch,0,0,5.7372,native,0.0,5.67,368.3
gfx950,256,512,16,2048,False,torch.bfloat16,torch.bfloat16,False,False,torch,0,0,6.3844,native,0.0,5.26,341.31
gfx950,256,1024,16,2048,False,torch.bfloat16,torch.bfloat16,False,False,torch,0,0,6.7009,native,0.0,10.01,640.6
gfx950,256,32768,16,2048,False,torch.bfloat16,torch.bfloat16,False,False,torch,0,0,28.2614,native,0.0,75.99,4788.58
gfx950,256,1,64,2048,False,torch.bfloat16,torch.bfloat16,False,False,skinny,2,0,2.3239,sol2,0.0,0.11,114.62
gfx950,256,2,64,2048,False,torch.bfloat16,torch.bfloat16,False,False,skinny,2,0,3.2514,sol2,0.0,0.16,83.22
gfx950,256,4,64,2048,False,torch.bfloat16,torch.bfloat16,False,False,flydsl,688,8,3.7543,flydsl_gemm2_abf16_wbf16_bf16_t16x64x256_split_k8_block_m_warp1_block_n_warp4_async_copyTrue_b_to_ldsTrue_b_preshuffleFalse_c_to_ldsFalse_small_m_ur8_gfx950,0.0312,0.28,74.33
gfx950,256,8,64,2048,False,torch.bfloat16,torch.bfloat16,False,False,flydsl,550,8,3.7878,flydsl_gemm2_abf16_wbf16_bf16_t16x64x128_split_k8_block_m_warp1_block_n_warp4_async_copyTrue_b_to_ldsTrue_b_preshuffleFalse_c_to_ldsFalse_small_m_wpe2_ur8_gfx950,0.0312,0.55,78.13
gfx950,256,16,64,2048,False,torch.bfloat16,torch.bfloat16,False,False,flydsl,691,8,3.5865,flydsl_gemm2_abf16_wbf16_bf16_t16x64x256_split_k8_block_m_warp1_block_n_warp4_async_copyTrue_b_to_ldsTrue_b_preshuffleFalse_c_to_ldsFalse_small_m_wpe4_ur16_gfx950,0.0205,1.17,91.94
gfx950,256,24,64,2048,False,torch.bfloat16,torch.bfloat16,False,False,asm,3,15,4.4572,_ZN5aiter39bf16gemm_fp32bf16_tn_48x64_splitk_cleanE,0.0234,1.41,81.56
gfx950,256,32,64,2048,False,torch.bfloat16,torch.bfloat16,False,False,flydsl,99,8,3.8976,flydsl_gemm2_abf16_wbf16_bf16_t32x64x256_split_k8_block_m_warp2_block_n_warp2_async_copyTrue_b_to_ldsTrue_b_preshuffleFalse_c_to_ldsFalse_gfx950,0.0186,2.15,101.94
gfx950,256,40,64,2048,False,torch.bfloat16,torch.bfloat16,False,False,flydsl,96,8,3.8644,flydsl_gemm2_abf16_wbf16_bf16_t32x64x256_split_k8_block_m_warp1_block_n_warp4_async_copyTrue_b_to_ldsTrue_b_preshuffleFalse_c_to_ldsFalse_gfx950,0.0172,2.71,111.56
gfx950,256,48,64,2048,False,torch.bfloat16,torch.bfloat16,False,False,flydsl,32,16,4.1031,flydsl_gemm2_abf16_wbf16_bf16_t32x64x128_split_k16_block_m_warp1_block_n_warp4_async_copyTrue_b_to_ldsTrue_b_preshuffleFalse_c_to_ldsFalse_gfx950,0.0267,3.07,113.3
gfx950,256,56,64,2048,False,torch.bfloat16,torch.bfloat16,False,False,flydsl,124,8,3.9722,flydsl_gemm2_abf16_wbf16_bf16_t32x64x256_split_k8_block_m_warp1_block_n_warp4_async_copyTrue_b_to_ldsTrue_b_preshuffleFalse_c_to_ldsFalse_gfx950,0.0193,3.7,125.54
gfx950,256,64,64,2048,False,torch.bfloat16,torch.bfloat16,False,False,flydsl,199,8,4.0532,flydsl_gemm2_abf16_wbf16_bf16_t32x64x128_split_k8_block_m_warp2_block_n_warp2_async_copyTrue_b_to_ldsTrue_b_preshuffleFalse_c_to_ldsFalse_gfx950,0.0156,4.14,131.37
gfx950,256,72,64,2048,False,torch.bfloat16,torch.bfloat16,False,False,flydsl,199,8,4.1314,flydsl_gemm2_abf16_wbf16_bf16_t32x64x128_split_k8_block_m_warp2_block_n_warp2_async_copyTrue_b_to_ldsTrue_b_preshuffleFalse_c_to_ldsFalse_gfx950,0.0167,4.57,137.07
gfx950,256,80,64,2048,False,torch.bfloat16,torch.bfloat16,False,False,flydsl,303,8,3.9838,flydsl_gemm2_abf16_wbf16_bf16_t32x64x128_split_k8_block_m_warp2_block_n_warp2_async_copyTrue_b_to_ldsTrue_b_preshuffleFalse_c_to_ldsFalse_gfx950,0.0164,5.26,150.63
gfx950,256,88,64,2048,False,torch.bfloat16,torch.bfloat16,False,False,flydsl,271,16,4.0818,flydsl_gemm2_abf16_wbf16_bf16_t32x64x128_split_k16_block_m_warp2_block_n_warp2_async_copyTrue_b_to_ldsTrue_b_preshuffleFalse_c_to_ldsFalse_gfx950,0.025,5.65,155.29
gfx950,256,96,64,2048,False,torch.bfloat16,torch.bfloat16,False,False,flydsl,303,8,4.0292,flydsl_gemm2_abf16_wbf16_bf16_t32x64x128_split_k8_block_m_warp2_block_n_warp2_async_copyTrue_b_to_ldsTrue_b_preshuffleFalse_c_to_ldsFalse_gfx950,0.0174,6.25,165.7
gfx950,256,104,64,2048,False,torch.bfloat16,torch.bfloat16,False,False,flydsl,303,8,4.2352,flydsl_gemm2_abf16_wbf16_bf16_t32x64x128_split_k8_block_m_warp2_block_n_warp2_async_copyTrue_b_to_ldsTrue_b_preshuffleFalse_c_to_ldsFalse_gfx950,0.0174,6.44,165.62
gfx950,256,112,64,2048,False,torch.bfloat16,torch.bfloat16,False,False,flydsl,271,16,4.3199,flydsl_gemm2_abf16_wbf16_bf16_t32x64x128_split_k16_block_m_warp2_block_n_warp2_async_copyTrue_b_to_ldsTrue_b_preshuffleFalse_c_to_ldsFalse_gfx950,0.0268,6.8,170.2
gfx950,256,120,64,2048,False,torch.bfloat16,torch.bfloat16,False,False,flydsl,303,8,4.1713,flydsl_gemm2_abf16_wbf16_bf16_t32x64x128_split_k8_block_m_warp2_block_n_warp2_async_copyTrue_b_to_ldsTrue_b_preshuffleFalse_c_to_ldsFalse_gfx950,0.0159,7.54,184.36
gfx950,256,128,64,2048,False,torch.bfloat16,torch.bfloat16,False,False,flydsl,412,8,4.217,flydsl_gemm2_abf16_wbf16_bf16_t32x64x256_split_k8_block_m_warp1_block_n_warp4_async_copyTrue_b_to_ldsTrue_b_preshuffleFalse_c_to_ldsFalse_gfx950,0.0179,7.96,190.38
gfx950,256,136,64,2048,False,torch.bfloat16,torch.bfloat16,False,False,flydsl,412,8,4.087,flydsl_gemm2_abf16_wbf16_bf16_t32x64x256_split_k8_block_m_warp1_block_n_warp4_async_copyTrue_b_to_ldsTrue_b_preshuffleFalse_c_to_ldsFalse_gfx950,0.0178,8.72,204.7
gfx950,256,144,64,2048,False,torch.bfloat16,torch.bfloat16,False,False,flydsl,415,8,4.066,flydsl_gemm2_abf16_wbf16_bf16_t32x64x256_split_k8_block_m_warp2_block_n_warp2_async_copyTrue_b_to_ldsTrue_b_preshuffleFalse_c_to_ldsFalse_gfx950,0.0167,9.28,214.07
gfx950,256,152,64,2048,False,torch.bfloat16,torch.bfloat16,False,False,flydsl,415,8,4.0584,flydsl_gemm2_abf16_wbf16_bf16_t32x64x256_split_k8_block_m_warp2_block_n_warp2_async_copyTrue_b_to_ldsTrue_b_preshuffleFalse_c_to_ldsFalse_gfx950,0.0172,9.82,222.8
gfx950,256,160,64,2048,False,torch.bfloat16,torch.bfloat16,False,False,flydsl,415,8,4.3619,flydsl_gemm2_abf16_wbf16_bf16_t32x64x256_split_k8_block_m_warp2_block_n_warp2_async_copyTrue_b_to_ldsTrue_b_preshuffleFalse_c_to_ldsFalse_gfx950,0.0174,9.62,215.04
gfx950,256,168,64,2048,False,torch.bfloat16,torch.bfloat16,False,False,flydsl,412,8,4.3456,flydsl_gemm2_abf16_wbf16_bf16_t32x64x256_split_k8_block_m_warp1_block_n_warp4_async_copyTrue_b_to_ldsTrue_b_preshuffleFalse_c_to_ldsFalse_gfx950,0.0189,10.13,223.62
gfx950,256,176,64,2048,False,torch.bfloat16,torch.bfloat16,False,False,flydsl,415,8,4.2679,flydsl_gemm2_abf16_wbf16_bf16_t32x64x256_split_k8_block_m_warp2_block_n_warp2_async_copyTrue_b_to_ldsTrue_b_preshuffleFalse_c_to_ldsFalse_gfx950,0.0186,10.81,235.61
gfx950,256,184,64,2048,False,torch.bfloat16,torch.bfloat16,False,False,flydsl,412,8,4.3319,flydsl_gemm2_abf16_wbf16_bf16_t32x64x256_split_k8_block_m_warp1_block_n_warp4_async_copyTrue_b_to_ldsTrue_b_preshuffleFalse_c_to_ldsFalse_gfx950,0.0177,11.13,239.93
gfx950,256,192,64,2048,False,torch.bfloat16,torch.bfloat16,False,False,flydsl,412,8,4.3659,flydsl_gemm2_abf16_wbf16_bf16_t32x64x256_split_k8_block_m_warp1_block_n_warp4_async_copyTrue_b_to_ldsTrue_b_preshuffleFalse_c_to_ldsFalse_gfx950,0.0174,11.53,245.8
gfx950,256,200,64,2048,False,torch.bfloat16,torch.bfloat16,False,False,flydsl,415,8,4.1758,flydsl_gemm2_abf16_wbf16_bf16_t32x64x256_split_k8_block_m_warp2_block_n_warp2_async_copyTrue_b_to_ldsTrue_b_preshuffleFalse_c_to_ldsFalse_gfx950,0.0167,12.56,265.09
gfx950,256,208,64,2048,False,torch.bfloat16,torch.bfloat16,False,False,flydsl,351,16,4.4764,flydsl_gemm2_abf16_wbf16_bf16_t32x64x128_split_k16_block_m_warp2_block_n_warp2_async_copyTrue_b_to_ldsTrue_b_preshuffleFalse_c_to_ldsFalse_gfx950,0.0261,12.18,254.83
gfx950,256,216,64,2048,False,torch.bfloat16,torch.bfloat16,False,False,flydsl,415,8,4.1732,flydsl_gemm2_abf16_wbf16_bf16_t32x64x256_split_k8_block_m_warp2_block_n_warp2_async_copyTrue_b_to_ldsTrue_b_preshuffleFalse_c_to_ldsFalse_gfx950,0.0182,13.57,281.45
gfx950,256,224,64,2048,False,torch.bfloat16,torch.bfloat16,False,False,flydsl,415,8,4.2214,flydsl_gemm2_abf16_wbf16_bf16_t32x64x256_split_k8_block_m_warp2_block_n_warp2_async_copyTrue_b_to_ldsTrue_b_preshuffleFalse_c_to_ldsFalse_gfx950,0.017,13.91,286.24
gfx950,256,232,64,2048,False,torch.bfloat16,torch.bfloat16,False,False,flydsl,412,8,4.5267,flydsl_gemm2_abf16_wbf16_bf16_t32x64x256_split_k8_block_m_warp1_block_n_warp4_async_copyTrue_b_to_ldsTrue_b_preshuffleFalse_c_to_ldsFalse_gfx950,0.0165,13.44,274.4
gfx950,256,240,64,2048,False,torch.bfloat16,torch.bfloat16,False,False,flydsl,415,8,4.5434,flydsl_gemm2_abf16_wbf16_bf16_t32x64x256_split_k8_block_m_warp2_block_n_warp2_async_copyTrue_b_to_ldsTrue_b_preshuffleFalse_c_to_ldsFalse_gfx950,0.0175,13.85,280.83
gfx950,256,248,64,2048,False,torch.bfloat16,torch.bfloat16,False,False,flydsl,415,8,4.5733,flydsl_gemm2_abf16_wbf16_bf16_t32x64x256_split_k8_block_m_warp2_block_n_warp2_async_copyTrue_b_to_ldsTrue_b_preshuffleFalse_c_to_ldsFalse_gfx950,0.0161,14.22,286.38
gfx950,256,256,64,2048,False,torch.bfloat16,torch.bfloat16,False,False,flydsl,415,8,4.6312,flydsl_gemm2_abf16_wbf16_bf16_t32x64x256_split_k8_block_m_warp2_block_n_warp2_async_copyTrue_b_to_ldsTrue_b_preshuffleFalse_c_to_ldsFalse_gfx950,0.0159,14.49,290.1
gfx950,256,272,64,2048,False,torch.bfloat16,torch.bfloat16,False,False,flydsl,383,8,4.8214,flydsl_gemm2_abf16_wbf16_bf16_t32x64x128_split_k8_block_m_warp2_block_n_warp2_async_copyTrue_b_to_ldsTrue_b_preshuffleFalse_c_to_ldsFalse_gfx950,0.0173,14.79,292.67
gfx950,256,288,64,2048,False,torch.bfloat16,torch.bfloat16,False,False,flydsl,412,8,4.7574,flydsl_gemm2_abf16_wbf16_bf16_t32x64x256_split_k8_block_m_warp1_block_n_warp4_async_copyTrue_b_to_ldsTrue_b_preshuffleFalse_c_to_ldsFalse_gfx950,0.0173,15.87,310.81
gfx950,256,304,64,2048,False,torch.bfloat16,torch.bfloat16,False,False,flydsl,412,8,4.7934,flydsl_gemm2_abf16_wbf16_bf16_t32x64x256_split_k8_block_m_warp1_block_n_warp4_async_copyTrue_b_to_ldsTrue_b_preshuffleFalse_c_to_ldsFalse_gfx950,0.017,16.63,322.58
gfx950,256,320,64,2048,False,torch.bfloat16,torch.bfloat16,False,False,flydsl,415,8,4.7824,flydsl_gemm2_abf16_wbf16_bf16_t32x64x256_split_k8_block_m_warp2_block_n_warp2_async_copyTrue_b_to_ldsTrue_b_preshuffleFalse_c_to_ldsFalse_gfx950,0.0156,17.54,337.45
gfx950,256,336,64,2048,False,torch.bfloat16,torch.bfloat16,False,False,flydsl,412,8,4.7818,flydsl_gemm2_abf16_wbf16_bf16_t32x64x256_split_k8_block_m_warp1_block_n_warp4_async_copyTrue_b_to_ldsTrue_b_preshuffleFalse_c_to_ldsFalse_gfx950,0.0157,18.42,351.63
gfx950,256,336,64,2048,True,torch.bfloat16,torch.bfloat16,False,False,flydsl,383,8,4.9672,flydsl_gemm2_abf16_wbf16_bf16_t32x64x128_split_k8_block_m_warp2_block_n_warp2_async_copyTrue_b_to_ldsTrue_b_preshuffleFalse_c_to_ldsFalse_gfx950,0.0157,17.73,338.5
gfx950,256,352,64,2048,False,torch.bfloat16,torch.bfloat16,False,False,flydsl,412,8,4.8018,flydsl_gemm2_abf16_wbf16_bf16_t32x64x256_split_k8_block_m_warp1_block_n_warp4_async_copyTrue_b_to_ldsTrue_b_preshuffleFalse_c_to_ldsFalse_gfx950,0.0156,19.22,364.24
gfx950,256,352,64,2048,True,torch.bfloat16,torch.bfloat16,False,False,flydsl,412,8,5.0675,flydsl_gemm2_abf16_wbf16_bf16_t32x64x256_split_k8_block_m_warp1_block_n_warp4_async_copyTrue_b_to_ldsTrue_b_preshuffleFalse_c_to_ldsFalse_gfx950,0.0156,18.21,345.14
gfx950,256,368,64,2048,False,torch.bfloat16,torch.bfloat16,False,False,flydsl,412,8,5.1893,flydsl_gemm2_abf16_wbf16_bf16_t32x64x256_split_k8_block_m_warp1_block_n_warp4_async_copyTrue_b_to_ldsTrue_b_preshuffleFalse_c_to_ldsFalse_gfx950,0.016,18.59,350.06
gfx950,256,368,64,2048,True,torch.bfloat16,torch.bfloat16,False,False,flydsl,380,8,5.1631,flydsl_gemm2_abf16_wbf16_bf16_t32x64x128_split_k8_block_m_warp1_block_n_warp4_async_copyTrue_b_to_ldsTrue_b_preshuffleFalse_c_to_ldsFalse_gfx950,0.0157,18.68,351.84
gfx950,256,384,64,2048,False,torch.bfloat16,torch.bfloat16,False,False,flydsl,412,8,4.9446,flydsl_gemm2_abf16_wbf16_bf16_t32x64x256_split_k8_block_m_warp1_block_n_warp4_async_copyTrue_b_to_ldsTrue_b_preshuffleFalse_c_to_ldsFalse_gfx950,0.016,20.36,381.05
gfx950,256,384,64,2048,True,torch.bfloat16,torch.bfloat16,False,False,flydsl,383,8,5.113,flydsl_gemm2_abf16_wbf16_bf16_t32x64x128_split_k8_block_m_warp2_block_n_warp2_async_copyTrue_b_to_ldsTrue_b_preshuffleFalse_c_to_ldsFalse_gfx950,0.0157,19.69,368.5
gfx950,256,400,64,2048,False,torch.bfloat16,torch.bfloat16,False,False,flydsl,412,8,4.847,flydsl_gemm2_abf16_wbf16_bf16_t32x64x256_split_k8_block_m_warp1_block_n_warp4_async_copyTrue_b_to_ldsTrue_b_preshuffleFalse_c_to_ldsFalse_gfx950,0.0167,21.63,402.67
gfx950,256,400,64,2048,True,torch.bfloat16,torch.bfloat16,False,False,flydsl,415,8,5.0334,flydsl_gemm2_abf16_wbf16_bf16_t32x64x256_split_k8_block_m_warp2_block_n_warp2_async_copyTrue_b_to_ldsTrue_b_preshuffleFalse_c_to_ldsFalse_gfx950,0.0155,20.83,387.76
gfx950,256,416,64,2048,False,torch.bfloat16,torch.bfloat16,False,False,flydsl,380,8,5.019,flydsl_gemm2_abf16_wbf16_bf16_t32x64x128_split_k8_block_m_warp1_block_n_warp4_async_copyTrue_b_to_ldsTrue_b_preshuffleFalse_c_to_ldsFalse_gfx950,0.0153,21.73,402.34
gfx950,256,416,64,2048,True,torch.bfloat16,torch.bfloat16,False,False,flydsl,415,8,5.0762,flydsl_gemm2_abf16_wbf16_bf16_t32x64x256_split_k8_block_m_warp2_block_n_warp2_async_copyTrue_b_to_ldsTrue_b_preshuffleFalse_c_to_ldsFalse_gfx950,0.0152,21.48,397.8
gfx950,256,432,64,2048,False,torch.bfloat16,torch.bfloat16,False,False,flydsl,415,8,4.8558,flydsl_gemm2_abf16_wbf16_bf16_t32x64x256_split_k8_block_m_warp2_block_n_warp2_async_copyTrue_b_to_ldsTrue_b_preshuffleFalse_c_to_ldsFalse_gfx950,0.0174,23.32,429.78
gfx950,256,432,64,2048,True,torch.bfloat16,torch.bfloat16,False,False,flydsl,412,8,5.0984,flydsl_gemm2_abf16_wbf16_bf16_t32x64x256_split_k8_block_m_warp1_block_n_warp4_async_copyTrue_b_to_ldsTrue_b_preshuffleFalse_c_to_ldsFalse_gfx950,0.0156,22.21,409.33
gfx950,256,448,64,2048,False,torch.bfloat16,torch.bfloat16,False,False,flydsl,412,8,4.9001,flydsl_gemm2_abf16_wbf16_bf16_t32x64x256_split_k8_block_m_warp1_block_n_warp4_async_copyTrue_b_to_ldsTrue_b_preshuffleFalse_c_to_ldsFalse_gfx950,0.016,23.97,439.68
gfx950,256,448,64,2048,True,torch.bfloat16,torch.bfloat16,False,False,flydsl,412,8,5.1566,flydsl_gemm2_abf16_wbf16_bf16_t32x64x256_split_k8_block_m_warp1_block_n_warp4_async_copyTrue_b_to_ldsTrue_b_preshuffleFalse_c_to_ldsFalse_gfx950,0.0166,22.77,417.81
gfx950,256,464,64,2048,False,torch.bfloat16,torch.bfloat16,False,False,flydsl,415,8,4.8664,flydsl_gemm2_abf16_wbf16_bf16_t32x64x256_split_k8_block_m_warp2_block_n_warp2_async_copyTrue_b_to_ldsTrue_b_preshuffleFalse_c_to_ldsFalse_gfx950,0.0164,24.99,456.62
gfx950,256,464,64,2048,True,torch.bfloat16,torch.bfloat16,False,False,flydsl,415,8,5.1374,flydsl_gemm2_abf16_wbf16_bf16_t32x64x256_split_k8_block_m_warp2_block_n_warp2_async_copyTrue_b_to_ldsTrue_b_preshuffleFalse_c_to_ldsFalse_gfx950,0.0158,23.68,432.53
gfx950,256,480,64,2048,False,torch.bfloat16,torch.bfloat16,False,False,flydsl,415,8,4.8749,flydsl_gemm2_abf16_wbf16_bf16_t32x64x256_split_k8_block_m_warp2_block_n_warp2_async_copyTrue_b_to_ldsTrue_b_preshuffleFalse_c_to_ldsFalse_gfx950,0.0172,25.81,469.68
gfx950,256,480,64,2048,True,torch.bfloat16,torch.bfloat16,False,False,flydsl,415,8,5.0951,flydsl_gemm2_abf16_wbf16_bf16_t32x64x256_split_k8_block_m_warp2_block_n_warp2_async_copyTrue_b_to_ldsTrue_b_preshuffleFalse_c_to_ldsFalse_gfx950,0.0168,24.7,449.39
gfx950,256,496,64,2048,False,torch.bfloat16,torch.bfloat16,False,False,flydsl,404,4,5.309,flydsl_gemm2_abf16_wbf16_bf16_t32x64x256_split_k4_block_m_warp1_block_n_warp4_async_copyTrue_b_to_ldsTrue_b_preshuffleFalse_c_to_ldsFalse_gfx950,0.0089,24.49,444.01
gfx950,256,496,64,2048,True,torch.bfloat16,torch.bfloat16,False,False,flydsl,244,8,5.4034,flydsl_gemm2_abf16_wbf16_bf16_t16x64x128_split_k8_block_m_warp1_block_n_warp2_async_copyTrue_b_to_ldsFalse_b_preshuffleFalse_c_to_ldsFalse_gfx950,0.0155,24.06,436.25
gfx950,256,512,64,2048,False,torch.bfloat16,torch.bfloat16,False,False,flydsl,404,4,5.2598,flydsl_gemm2_abf16_wbf16_bf16_t32x64x256_split_k4_block_m_warp1_block_n_warp4_async_copyTrue_b_to_ldsTrue_b_preshuffleFalse_c_to_ldsFalse_gfx950,0.0087,25.52,461.01
gfx950,256,1024,64,2048,False,torch.bfloat16,torch.bfloat16,False,False,flydsl,407,4,6.9438,flydsl_gemm2_abf16_wbf16_bf16_t32x64x256_split_k4_block_m_warp2_block_n_warp2_async_copyTrue_b_to_ldsTrue_b_preshuffleFalse_c_to_ldsFalse_gfx950,0.0086,38.66,660.66
gfx950,256,32768,64,2048,False,torch.bfloat16,torch.bfloat16,False,False,flydsl,499,1,31.1732,flydsl_gemm2_abf16_wbf16_bf16_t64x64x128_split_k1_block_m_warp2_block_n_warp2_async_copyTrue_b_to_ldsTrue_b_preshuffleFalse_c_to_ldsFalse_gfx950,0.0,275.56,4448.51
gfx950,256,1,513,2048,False,torch.bfloat16,torch.bfloat16,False,False,torch,0,0,8.0479,native,0.0,0.26,261.73
gfx950,256,2,513,2048,False,torch.bfloat16,torch.bfloat16,False,False,torch,0,0,8.2065,native,0.0,0.51,257.3
gfx950,256,4,513,2048,False,torch.bfloat16,torch.bfloat16,False,False,torch,0,0,5.7121,native,0.0,1.47,371.45
gfx950,256,8,513,2048,False,torch.bfloat16,torch.bfloat16,False,False,torch,0,0,5.7659,native,0.0,2.92,371.53
gfx950,256,16,513,2048,False,torch.bfloat16,torch.bfloat16,False,False,torch,0,0,5.8443,native,0.0,5.75,373.56
gfx950,256,16,513,2048,True,torch.bfloat16,torch.bfloat16,False,False,torch,0,0,6.1475,native,0.0,5.47,355.14
gfx950,256,24,513,2048,False,torch.bfloat16,torch.bfloat16,False,False,torch,0,0,6.1641,native,0.0,8.18,360.83
gfx950,256,32,513,2048,False,torch.bfloat16,torch.bfloat16,False,False,torch,0,0,6.2253,native,0.0,10.8,363.86
gfx950,256,40,513,2048,False,torch.bfloat16,torch.bfloat16,False,False,torch,0,0,6.1553,native,0.0,13.65,374.66
gfx950,256,48,513,2048,False,torch.bfloat16,torch.bfloat16,False,False,torch,0,0,6.6039,native,0.0,15.27,355.41
gfx950,256,48,513,2048,True,torch.bfloat16,torch.bfloat16,False,False,torch,0,0,6.3129,native,0.0,15.98,371.79
gfx950,256,56,513,2048,False,torch.bfloat16,torch.bfloat16,False,False,torch,0,0,6.2082,native,0.0,18.95,384.67
gfx950,256,64,513,2048,False,torch.bfloat16,torch.bfloat16,False,False,torch,0,0,6.2581,native,0.0,21.49,388.15
gfx950,256,64,513,2048,True,torch.bfloat16,torch.bfloat16,False,False,torch,0,0,6.4076,native,0.0,20.99,379.09
gfx950,256,72,513,2048,False,torch.bfloat16,torch.bfloat16,False,False,torch,0,0,6.817,native,0.0,22.19,362.33
gfx950,256,80,513,2048,False,torch.bfloat16,torch.bfloat16,False,False,torch,0,0,6.3812,native,0.0,26.34,393.5
gfx950,256,88,513,2048,False,torch.bfloat16,torch.bfloat16,False,False,torch,0,0,6.8484,native,0.0,27.0,372.64
gfx950,256,96,513,2048,False,torch.bfloat16,torch.bfloat16,False,False,torch,0,0,6.9505,native,0.0,29.02,373.06
gfx950,256,104,513,2048,False,torch.bfloat16,torch.bfloat16,False,False,torch,0,0,7.0383,native,0.0,31.05,374.23
gfx950,256,112,513,2048,False,torch.bfloat16,torch.bfloat16,False,False,torch,0,0,6.5416,native,0.0,35.98,408.91
gfx950,256,120,513,2048,False,torch.bfloat16,torch.bfloat16,False,False,torch,0,0,8.1991,native,0.0,30.75,331.24
gfx950,256,120,513,2048,True,torch.bfloat16,torch.bfloat16,False,False,torch,0,0,7.8456,native,0.0,32.14,346.17
gfx950,256,128,513,2048,False,torch.bfloat16,torch.bfloat16,False,False,torch,0,0,8.1922,native,0.0,32.83,336.52
gfx950,256,136,513,2048,False,torch.bfloat16,torch.bfloat16,False,False,torch,0,0,7.2861,native,0.0,39.22,384.0
gfx950,256,144,513,2048,False,torch.bfloat16,torch.bfloat16,False,False,torch,0,0,8.2494,native,0.0,36.68,344.12
gfx950,256,152,513,2048,False,torch.bfloat16,torch.bfloat16,False,False,torch,0,0,8.2739,native,0.0,38.6,348.06
gfx950,256,160,513,2048,False,torch.bfloat16,torch.bfloat16,False,False,torch,0,0,8.2493,native,0.0,40.75,354.06
gfx950,256,168,513,2048,False,torch.bfloat16,torch.bfloat16,False,False,torch,0,0,7.5882,native,0.0,46.52,390.31
gfx950,256,176,513,2048,False,torch.bfloat16,torch.bfloat16,False,False,torch,0,0,7.8464,native,0.0,47.13,382.69
gfx950,256,184,513,2048,False,torch.bfloat16,torch.bfloat16,False,False,torch,0,0,8.2526,native,0.0,46.85,368.82
gfx950,256,192,513,2048,False,torch.bfloat16,torch.bfloat16,False,False,torch,0,0,8.248,native,0.0,48.91,373.99
gfx950,256,200,513,2048,False,torch.bfloat16,torch.bfloat16,False,False,torch,0,0,7.9893,native,0.0,52.6,391.23
gfx950,256,200,513,2048,True,torch.bfloat16,torch.bfloat16,False,False,torch,0,0,8.0904,native,0.0,51.94,386.34
gfx950,256,208,513,2048,False,torch.bfloat16,torch.bfloat16,False,False,torch,0,0,8.3263,native,0.0,52.49,380.32
gfx950,256,216,513,2048,False,torch.bfloat16,torch.bfloat16,False,False,torch,0,0,8.0285,native,0.0,56.53,399.53
gfx950,256,224,513,2048,False,torch.bfloat16,torch.bfloat16,False,False,torch,0,0,7.9013,native,0.0,59.57,411.14
gfx950,256,232,513,2048,False,torch.bfloat16,torch.bfloat16,False,False,torch,0,0,7.9983,native,0.0,60.95,411.28
gfx950,256,240,513,2048,False,torch.bfloat16,torch.bfloat16,False,False,torch,0,0,8.4158,native,0.0,59.92,395.75
gfx950,256,240,513,2048,True,torch.bfloat16,torch.bfloat16,False,False,torch,0,0,8.5476,native,0.0,59.0,389.64
gfx950,256,248,513,2048,False,torch.bfloat16,torch.bfloat16,False,False,torch,0,0,8.6096,native,0.0,60.53,391.6
gfx950,256,256,513,2048,False,torch.bfloat16,torch.bfloat16,False,False,torch,0,0,8.3535,native,0.0,64.39,408.51
gfx950,256,256,513,2048,True,torch.bfloat16,torch.bfloat16,False,False,torch,0,0,8.7628,native,0.0,61.39,389.43
gfx950,256,272,513,2048,False,torch.bfloat16,torch.bfloat16,False,False,torch,0,0,8.5301,native,0.0,67.0,409.66
gfx950,256,288,513,2048,False,torch.bfloat16,torch.bfloat16,False,False,torch,0,0,8.562,native,0.0,70.68,417.7
gfx950,256,304,513,2048,False,torch.bfloat16,torch.bfloat16,False,False,torch,0,0,8.7015,native,0.0,73.41,420.43
gfx950,256,320,513,2048,False,torch.bfloat16,torch.bfloat16,False,False,torch,0,0,8.5595,native,0.0,78.56,436.98
gfx950,256,336,513,2048,False,torch.bfloat16,torch.bfloat16,False,False,torch,0,0,8.6219,native,0.0,81.89,443.32
gfx950,256,352,513,2048,False,torch.bfloat16,torch.bfloat16,False,False,torch,0,0,8.6848,native,0.0,85.16,449.54
gfx950,256,368,513,2048,False,torch.bfloat16,torch.bfloat16,False,False,torch,0,0,8.5723,native,0.0,90.2,465.0
gfx950,256,384,513,2048,False,torch.bfloat16,torch.bfloat16,False,False,torch,0,0,8.6296,native,0.0,93.5,471.41
gfx950,256,400,513,2048,False,torch.bfloat16,torch.bfloat16,False,False,torch,0,0,8.6944,native,0.0,96.67,477.32
gfx950,256,416,513,2048,False,torch.bfloat16,torch.bfloat16,False,False,torch,0,0,8.7665,native,0.0,99.71,482.75
gfx950,256,432,513,2048,False,torch.bfloat16,torch.bfloat16,False,False,torch,0,0,9.0623,native,0.0,100.17,476.03
gfx950,256,448,513,2048,False,torch.bfloat16,torch.bfloat16,False,False,torch,0,0,9.1661,native,0.0,102.7,479.58
gfx950,256,464,513,2048,False,torch.bfloat16,torch.bfloat16,False,False,torch,0,0,9.0962,native,0.0,107.19,492.28
gfx950,256,480,513,2048,False,torch.bfloat16,torch.bfloat16,False,False,torch,0,0,9.1411,native,0.0,110.34,498.82
gfx950,256,496,513,2048,False,torch.bfloat16,torch.bfloat16,False,False,torch,0,0,9.8435,native,0.0,105.88,471.56
gfx950,256,512,513,2048,False,torch.bfloat16,torch.bfloat16,False,False,torch,0,0,9.9228,native,0.0,108.42,476.05
gfx950,256,1024,513,2048,False,torch.bfloat16,torch.bfloat16,False,False,torch,0,0,11.6259,native,0.0,185.08,631.88
gfx950,256,32768,513,2048,False,torch.bfloat16,torch.bfloat16,False,False,torch,0,0,95.167,native,0.0,723.5,1785.69
gfx950,256,1024,37984,2048,False,torch.bfloat16,torch.bfloat16,False,False,torch,0,0,164.422,native,0.0,968.95,1444.87
gfx950,256,1024,151936,2048,False,torch.bfloat16,torch.bfloat16,False,False,torch,0,0,576.5353,native,0.0,1105.34,1626.42
