aiter/configs/model_configs/dsv32_bf16_tuned_gemm.csv
gfx,cu_num,M,N,K,bias,dtype,outdtype,scaleAB,bpreshuffle,libtype,solidx,splitK,us,kernelName,err_ratio,tflops,bw
gfx950,256,64,192,7168,False,torch.bfloat16,torch.bfloat16,False,False,flydsl,641,14,6.3473,flydsl_gemm2_abf16_wbf16_bf16_t32x64x256_split_k14_block_m_warp2_block_n_warp2_async_copyTrue_b_to_ldsTrue_b_preshuffleFalse_c_to_ldsFalse_gfx950,0.0272,27.75,582.07
gfx950,256,128,192,7168,False,torch.bfloat16,torch.bfloat16,False,False,flydsl,1118,14,7.75,flydsl_gemm2_abf16_wbf16_bf16_t32x64x256_split_k14_block_m_warp1_block_n_warp4_async_copyTrue_b_to_ldsTrue_b_preshuffleFalse_c_to_ldsFalse_gfx950,0.0288,45.46,598.28
gfx950,256,256,192,7168,False,torch.bfloat16,torch.bfloat16,False,False,flydsl,1153,7,9.9049,flydsl_gemm2_abf16_wbf16_bf16_t32x64x256_split_k7_block_m_warp2_block_n_warp2_async_copyTrue_b_to_ldsTrue_b_preshuffleFalse_c_to_ldsFalse_gfx950,0.0198,71.14,658.34
gfx950,256,512,192,7168,False,torch.bfloat16,torch.bfloat16,False,False,flydsl,1102,7,12.9991,flydsl_gemm2_abf16_wbf16_bf16_t32x64x128_split_k7_block_m_warp1_block_n_warp4_async_copyTrue_b_to_ldsTrue_b_preshuffleFalse_c_to_ldsFalse_gfx950,0.0191,108.41,791.53
gfx950,256,768,192,7168,False,torch.bfloat16,torch.bfloat16,False,False,asm,3,5,14.7283,_ZN5aiter39bf16gemm_fp32bf16_tn_48x64_splitk_cleanE,0.0162,143.53,954.45
gfx950,256,1024,192,7168,False,torch.bfloat16,torch.bfloat16,False,False,asm,5,5,15.8019,_ZN5aiter39bf16gemm_fp32bf16_tn_64x64_splitk_cleanE,0.0164,178.37,1128.08
gfx950,256,1536,192,7168,False,torch.bfloat16,torch.bfloat16,False,False,asm,8,4,18.1147,_ZN5aiter39bf16gemm_fp32bf16_tn_96x64_splitk_cleanE,0.0141,233.39,1400.1
gfx950,256,2048,192,7168,False,torch.bfloat16,torch.bfloat16,False,False,hipblaslt,441325,0,19.1353,Cijk_Alik_Bljk_BBS_BH_Bias_HA_S_SAV_UserArgs_MT96x128x64_MI16x16x1_SN_LDSB1_AFC0_AFEM1_AFEM1_ASEM1_CLR1_CADS0_DTLA0_DTLB0_DTVA0_DTVB0_EPS0_FDSI0_GRPM1_GRVWA8_GRVWB8_GSU0_GSUAMB_GLS0_ISA950_IU1_K1_LDSTI0_LBSPPA128_LBSPPB512_LBSPPM0_LPA16_LPB16_LPM0_LRVW8_LWPMn1_MIAV0_MIWT3_4_MO40_NTn1_NTA0_NTB0_NTC0_NTD0_NTM0_NEPBS0_NLCA1_NLCB1_ONLL1_PGR2_PLR1_PKA1_SIA3_SS1_SPO0_SRVW0_SSO0_SVW1_SK3_SKFTR0_SKXCCM0_TLDS1_ULSGRO0_USL1_UIOFGRO0_USFGRO0_VSn1_VWA1_VWB4_WSGRA0_WSGRB0_WS64_WG32_8_1,0.0,294.59,1719.29
gfx950,256,3072,192,7168,False,torch.bfloat16,torch.bfloat16,False,False,hipblaslt,439713,0,22.7136,Cijk_Alik_Bljk_BBS_BH_Bias_HA_S_SAV_UserArgs_MT96x96x128_MI16x16x1_SN_LDSB0_AFC0_AFEM1_AFEM1_ASEM1_CLR1_CADS0_DTLA0_DTLB0_DTVA0_DTVB0_EPS0_FDSI0_GRPM1_GRVWA8_GRVWB8_GSU0_GSUAMB_GLS0_ISA950_IU1_K1_LDSTI0_LBSPPA256_LBSPPB256_LBSPPM0_LPA16_LPB16_LPM0_LRVW8_LWPMn1_MIAV0_MIWT3_3_MO40_NTn1_NTA2_NTB1_NTC1_NTD1_NTM0_NEPBS0_NLCA1_NLCB1_ONLL1_PGR2_PLR1_PKA1_SIA3_SS1_SPO0_SRVW0_SSO0_SVW1_SK3_SKFTR0_SKXCCM4_TLDS1_ULSGRO0_USL1_UIOFGRO0_USFGRO0_VSn1_VWA1_VWB1_WSGRA0_WSGRB0_WS64_WG32_8_1,0.0,372.28,2112.05
gfx950,256,4096,192,7168,False,torch.bfloat16,torch.bfloat16,False,False,hipblaslt,439929,0,26.28,Cijk_Alik_Bljk_BBS_BH_Bias_HA_S_SAV_UserArgs_MT96x128x128_MI16x16x1_SN_LDSB0_AFC0_AFEM1_AFEM1_ASEM1_CLR0_CADS0_DTLA0_DTLB0_DTVA0_DTVB0_EPS0_FDSI0_GRPM1_GRVWA8_GRVWB8_GSU0_GSUAMB_GLS0_ISA950_IU1_K1_LDSTI0_LBSPPA512_LBSPPB512_LBSPPM0_LPA16_LPB16_LPM0_LRVW8_LWPMn1_MIAV0_MIWT6_2_MO40_NTn1_NTA2_NTB2_NTC1_NTD1_NTM0_NEPBS0_NLCA1_NLCB1_ONLL1_PGR2_PLR1_PKA1_SIA3_SS1_SPO0_SRVW0_SSO1_SVW2_SK3_SKFTR0_SKXCCM8_TLDS2_ULSGRO0_USL1_UIOFGRO0_USFGRO0_VSn1_VWA2_VWB2_WSGRA0_WSGRB0_WS64_WG16_16_1,0.0,429.01,2399.0
gfx950,256,6144,192,7168,False,torch.bfloat16,torch.bfloat16,False,False,hipblaslt,441300,0,32.8982,Cijk_Alik_Bljk_BBS_BH_Bias_HA_S_SAV_UserArgs_MT192x160x64_MI16x16x1_SN_LDSB1_AFC0_AFEM1_AFEM1_ASEM1_CLR1_CADS0_DTLA0_DTLB0_DTVA0_DTVB0_EPS0_FDSI0_GRPM1_GRVWA8_GRVWB8_GSU0_GSUAMB_GLS0_ISA950_IU1_K1_LDSTI0_LBSPPA256_LBSPPB128_LBSPPM0_LPA16_LPB16_LPM0_LRVW8_LWPMn1_MIAV0_MIWT6_5_MO40_NTn1_NTA0_NTB0_NTC0_NTD0_NTM0_NEPBS0_NLCA1_NLCB1_ONLL1_PGR2_PLR1_PKA1_SIA3_SS1_SPO0_SRVW0_SSO0_SVW2_SK3_SKFTR0_SKXCCM0_TLDS1_ULSGRO0_USL1_UIOFGRO0_USFGRO0_VSn1_VWA2_VWB1_WSGRA0_WSGRB0_WS64_WG32_8_1,0.0,514.05,2832.74
gfx950,256,8192,192,7168,False,torch.bfloat16,torch.bfloat16,False,False,hipblaslt,439791,0,39.1923,Cijk_Alik_Bljk_BBS_BH_Bias_HA_S_SAV_UserArgs_MT96x128x128_MI16x16x1_SN_LDSB0_AFC0_AFEM1_AFEM1_ASEM1_CLR1_CADS0_DTLA0_DTLB0_DTVA0_DTVB0_EPS0_FDSI0_GRPM1_GRVWA8_GRVWB8_GSU0_GSUAMB_GLS0_ISA950_IU1_K1_LDSTI0_LBSPPA512_LBSPPB512_LBSPPM0_LPA16_LPB16_LPM0_LRVW8_LWPMn1_MIAV1_MIWT6_2_MO40_NTn1_NTA3_NTB2_NTC1_NTD4_NTM0_NEPBS0_NLCA1_NLCB1_ONLL1_PGR2_PLR1_PKA1_SIA3_SS1_SPO0_SRVW0_SSO0_SVW2_SK3_SKFTR0_SKXCCM0_TLDS2_ULSGRO0_USL1_UIOFGRO0_USFGROn1_VSn1_VWA2_VWB2_WSGRA0_WSGRB0_WS64_WG16_16_1,0.0,575.33,3147.01
gfx950,256,10240,192,7168,False,torch.bfloat16,torch.bfloat16,False,False,hipblaslt,441043,0,45.3867,Cijk_Alik_Bljk_BBS_BH_Bias_HA_S_SAV_UserArgs_MT192x160x64_MI16x16x1_SN_LDSB1_AFC0_AFEM1_AFEM1_ASEM1_CLR1_CADS0_DTLA0_DTLB0_DTVA0_DTVB0_EPS0_FDSI0_GRPM1_GRVWA8_GRVWB8_GSU0_GSUAMB_GLS0_ISA950_IU1_K1_LDSTI0_LBSPPA256_LBSPPB128_LBSPPM0_LPA16_LPB16_LPM0_LRVW8_LWPMn1_MIAV0_MIWT6_5_MO40_NTn1_NTA0_NTB4_NTC0_NTD0_NTM0_NEPBS0_NLCA1_NLCB1_ONLL1_PGR2_PLR1_PKA1_SIA3_SS1_SPO0_SRVW0_SSO0_SVW2_SK3_SKFTR0_SKXCCM8_TLDS1_ULSGRO0_USL1_UIOFGRO0_USFGRO0_VSn1_VWA2_VWB1_WSGRA0_WSGRB0_WS64_WG32_8_1,0.0,621.01,3381.72
gfx950,256,12288,192,7168,False,torch.bfloat16,torch.bfloat16,False,False,hipblaslt,441042,0,50.6945,Cijk_Alik_Bljk_BBS_BH_Bias_HA_S_SAV_UserArgs_MT192x192x64_MI16x16x1_SN_LDSB0_AFC0_AFEM1_AFEM1_ASEM1_CLR1_CADS0_DTLA0_DTLB0_DTVA0_DTVB0_EPS0_FDSI0_GRPM1_GRVWA8_GRVWB8_GSU0_GSUAMB_GLS0_ISA950_IU1_K1_LDSTI0_LBSPPA256_LBSPPB256_LBSPPM0_LPA16_LPB16_LPM0_LRVW8_LWPMn1_MIAV0_MIWT6_6_MO40_NTn1_NTA0_NTB4_NTC0_NTD0_NTM0_NEPBS0_NLCA1_NLCB1_ONLL1_PGR2_PLR1_PKA1_SIA3_SS1_SPO0_SRVW0_SSO0_SVW2_SK3_SKFTR0_SKXCCM8_TLDS1_ULSGRO0_USL1_UIOFGRO0_USFGRO0_VSn1_VWA2_VWB2_WSGRA0_WSGRB0_WS64_WG32_8_1,0.0,667.19,3622.32
gfx950,256,16384,192,7168,False,torch.bfloat16,torch.bfloat16,False,False,hipblaslt,439860,0,64.332,Cijk_Alik_Bljk_BBS_BH_Bias_HA_S_SAV_UserArgs_MT96x128x128_MI16x16x1_SN_LDSB0_AFC0_AFEM1_AFEM1_ASEM1_CLR1_CADS0_DTLA0_DTLB0_DTVA0_DTVB0_EPS0_FDSI0_GRPM1_GRVWA8_GRVWB8_GSUAMB_GLS0_ISA950_IU1_K1_LDSTI0_LBSPPA512_LBSPPB512_LBSPPM0_LPA16_LPB16_LPM0_LRVW8_LWPMn1_MIAV0_MIWT6_2_MO40_NTn1_NTA1_NTB1_NTC1_NTD5_NTM0_NEPBS0_NLCA1_NLCB1_ONLL1_PGR2_PLR1_PKA1_SIA3_SS1_SPO0_SRVW0_SSO0_SVW2_SK0_SKFTR0_SKXCCM0_TLDS1_ULSGRO0_USL1_UIOFGRO0_USFGROn1_VSn1_VWA2_VWB2_WSGRA0_WSGRB0_WS64_WG16_16_1,0.0,701.01,3791.66
gfx950,256,512,256,7168,False,torch.bfloat16,torch.bfloat16,False,False,triton,0,0,13.4001,auto,0.0,140.23,841.2
gfx950,256,768,256,7168,False,torch.bfloat16,torch.bfloat16,False,False,asm,7,6,15.1558,_ZN5aiter39bf16gemm_fp32bf16_tn_80x64_splitk_cleanE,0.0182,185.97,994.56
gfx950,256,1024,256,7168,False,torch.bfloat16,torch.bfloat16,False,False,asm,8,5,16.7052,_ZN5aiter39bf16gemm_fp32bf16_tn_96x64_splitk_cleanE,0.0164,224.97,1129.85
gfx950,256,1536,256,7168,False,torch.bfloat16,torch.bfloat16,False,False,hipblaslt,440149,0,18.3349,Cijk_Alik_Bljk_BBS_BH_Bias_HA_S_SAV_UserArgs_MT128x96x64_MI16x16x1_SN_LDSB0_AFC0_AFEM1_AFEM1_ASEM1_CLR1_CADS0_DTLA1_DTLB1_DTVA0_DTVB0_EPS0_FDSI0_GRPM1_GRVWA2_GRVWB8_GSU0_GSUAMB_GLS0_ISA950_IU1_K1_LDSTI0_LBSPPA256_LBSPPB1024_LBSPPM0_LPA16_LPB16_LPM0_LRVW8_LWPMn1_MIAV1_MIWT4_3_MO40_NTn1_NTA0_NTB1_NTC0_NTD4_NTM0_NEPBS0_NLCA1_NLCB1_ONLL1_PGR2_PLR1_PKA1_SIA3_SS1_SPO0_SRVW0_SSO0_SVW4_SK3_SKFTR0_SKXCCM8_TLDS1_ULSGRO0_USL1_UIOFGRO0_USFGRO0_VSn1_VWA4_VWB1_WSGRA0_WSGRB0_WS64_WG32_8_1,0.0,307.45,1444.05
gfx950,256,2048,256,7168,False,torch.bfloat16,torch.bfloat16,False,False,hipblaslt,440108,0,20.6192,Cijk_Alik_Bljk_BBS_BH_Bias_HA_S_SAV_UserArgs_MT128x128x64_MI16x16x1_SN_LDSB0_AFC0_AFEM1_AFEM1_ASEM1_CLR0_CADS0_DTLA1_DTLB1_DTVA0_DTVB0_EPS0_FDSI0_GRPM1_GRVWA8_GRVWB8_GSU0_GSUAMB_GLS0_ISA950_IU1_K1_LDSTI0_LBSPPA1024_LBSPPB1024_LBSPPM0_LPA16_LPB16_LPM0_LRVW8_LWPMn1_MIAV1_MIWT4_4_MO40_NTn1_NTA2_NTB1_NTC6_NTD3_NTM0_NEPBS16_NLCA1_NLCB1_ONLL1_PGR2_PLR1_PKA1_SIA3_SS1_SPO0_SRVW0_SSO0_SVW4_SK3_SKFTR0_SKXCCM4_TLDS1_ULSGRO0_USL1_UIOFGRO0_USFGROn1_VSn1_VWA4_VWB4_WSGRA0_WSGRB0_WS64_WG32_8_1,0.0,364.52,1652.77
gfx950,256,3072,256,7168,False,torch.bfloat16,torch.bfloat16,False,False,hipblaslt,440320,0,24.803,Cijk_Alik_Bljk_BBS_BH_Bias_HA_S_SAV_UserArgs_MT128x192x64_MI16x16x1_SN_LDSB0_AFC0_AFEM1_AFEM1_ASEM1_CLR0_CADS0_DTLA0_DTLB0_DTVA0_DTVB0_EPS0_FDSI0_GRPM1_GRVWA8_GRVWB8_GSU0_GSUAMB_GLS0_ISA950_IU1_K1_LDSTI0_LBSPPA256_LBSPPB512_LBSPPM0_LPA16_LPB16_LPM0_LRVW8_LWPMn1_MIAV0_MIWT2_12_MO40_NTn1_NTA0_NTB0_NTC1_NTD2_NTM0_NEPBS14_NLCA1_NLCB1_ONLL1_PGR2_PLR1_PKA1_SIA3_SS1_SPO0_SRVW0_SSO0_SVW2_SK3_SKFTR0_SKXCCM0_TLDS1_ULSGRO0_USL1_UIOFGRO0_USFGRO1_VSn1_VWA2_VWB4_WSGRA0_WSGRB0_WS64_WG64_4_1,0.0,454.55,1986.98
gfx950,256,4096,256,7168,False,torch.bfloat16,torch.bfloat16,False,False,hipblaslt,441372,0,28.8983,Cijk_Alik_Bljk_BBS_BH_Bias_HA_S_SAV_UserArgs_MT128x128x128_MI16x16x1_SN_LDSB1_AFC0_AFEM1_AFEM1_ASEM1_CLR1_CADS0_DTLA0_DTLB0_DTVA0_DTVB0_EPS0_FDSI0_GRPM1_GRVWA8_GRVWB8_GSU0_GSUAMB_GLS0_ISA950_IU1_K1_LDSTI0_LBSPPA1024_LBSPPB1024_LBSPPM0_LPA16_LPB16_LPM0_LRVW8_LWPMn1_MIAV0_MIWT4_4_MO40_NTn1_NTA0_NTB0_NTC0_NTD0_NTM0_NEPBS0_NLCA1_NLCB1_ONLL1_PGR2_PLR1_PKA1_SIA3_SS1_SPO0_SRVW0_SSO0_SVW4_SK3_SKFTR0_SKXCCM0_TLDS1_ULSGRO0_USL1_UIOFGRO0_USFGRO0_VSn1_VWA4_VWB4_WSGRA0_WSGRB0_WS64_WG32_8_1,0.0,520.18,2231.53
gfx950,256,6144,256,7168,False,torch.bfloat16,torch.bfloat16,False,False,hipblaslt,440405,0,36.9536,Cijk_Alik_Bljk_BBS_BH_Bias_HA_S_SAV_UserArgs_MT256x160x64_MI16x16x1_SN_LDSB0_AFC1_AFEM1_AFEM1_ASEM1_CLR1_CADS0_DTLA0_DTLB0_DTVA0_DTVB0_EPS0_FDSI0_GRPM1_GRVWA8_GRVWB8_GSU0_GSUAMB_GLS0_ISA950_IU1_K1_LDSTI0_LBSPPA512_LBSPPB256_LBSPPM0_LPA16_LPB16_LPM0_LRVW8_LWPMn1_MIAV0_MIWT4_10_MO40_NTn1_NTA0_NTB3_NTC3_NTD3_NTM0_NEPBS2_NLCA1_NLCB1_ONLL1_PGR2_PLR1_PKA1_SIA3_SS1_SPO0_SRVW0_SSO0_SVW4_SK3_SKFTR0_SKXCCM0_TLDS1_ULSGRO0_USL1_UIOFGRO0_USFGRO0_VSn1_VWA4_VWB2_WSGRA0_WSGRB0_WS64_WG64_4_1,0.0,610.19,2567.98
gfx950,256,8192,256,7168,False,torch.bfloat16,torch.bfloat16,False,False,hipblaslt,439924,0,44.9781,Cijk_Alik_Bljk_BBS_BH_Bias_HA_S_SAV_UserArgs_MT128x128x128_MI16x16x1_SN_LDSB0_AFC0_AFEM1_AFEM1_ASEM1_CLR0_CADS0_DTLA0_DTLB0_DTVA0_DTVB0_EPS0_FDSI0_GRPM1_GRVWA8_GRVWB8_GSU0_GSUAMB_GLS0_ISA950_IU1_K1_LDSTI0_LBSPPA1024_LBSPPB1024_LBSPPM0_LPA16_LPB16_LPM0_LRVW8_LWPMn1_MIAV0_MIWT4_4_MO40_NTn1_NTA0_NTB3_NTC7_NTD1_NTM0_NEPBS0_NLCA1_NLCB1_ONLL1_PGR2_PLR1_PKA1_SIA3_SS1_SPO0_SRVW0_SSO0_SVW4_SK3_SKFTR0_SKXCCM5_TLDS2_ULSGRO0_USL1_UIOFGRO0_USFGRO0_VSn1_VWA4_VWB4_WSGRA0_WSGRB0_WS64_WG32_8_1,0.0,668.43,2785.91
gfx950,256,10240,256,7168,False,torch.bfloat16,torch.bfloat16,False,False,hipblaslt,440360,0,51.5417,Cijk_Alik_Bljk_BBS_BH_Bias_HA_S_SAV_UserArgs_MT256x160x64_MI16x16x1_SN_LDSB1_AFC1_AFEM1_AFEM1_ASEM1_CLR0_CADS0_DTLA0_DTLB0_DTVA0_DTVB0_EPS0_FDSI0_GRPM1_GRVWA8_GRVWB8_GSU0_GSUAMB_GLS0_ISA950_IU1_K1_LDSTI0_LBSPPA512_LBSPPB256_LBSPPM0_LPA16_LPB16_LPM0_LRVW8_LWPMn1_MIAV0_MIWT4_10_MO40_NTn1_NTA0_NTB4_NTC5_NTD3_NTM0_NEPBS16_NLCA1_NLCB1_ONLL1_PGR2_PLR1_PKA1_SIA3_SS1_SPO0_SRVW0_SSO1_SVW4_SK3_SKFTR0_SKXCCM8_TLDS2_ULSGRO0_USL1_UIOFGRO0_USFGRO0_VSn1_VWA4_VWB2_WSGRA0_WSGRB0_WS64_WG64_4_1,0.0,729.14,3021.12
gfx950,256,12288,256,7168,False,torch.bfloat16,torch.bfloat16,False,False,hipblaslt,440463,0,60.4986,Cijk_Alik_Bljk_BBS_BH_Bias_HA_S_SAV_UserArgs_MT256x192x64_MI16x16x1_SN_LDSB0_AFC1_AFEM1_AFEM1_ASEM1_CLR1_CADS0_DTLA0_DTLB0_DTVA0_DTVB0_EPS0_FDSI0_GRPM1_GRVWA8_GRVWB8_GSU0_GSUAMB_GLS0_ISA950_IU1_K1_LDSTI0_LBSPPA512_LBSPPB512_LBSPPM0_LPA16_LPB16_LPM0_LRVW8_LWPMn1_MIAV0_MIWT4_12_MO40_NTn1_NTA3_NTB1_NTC5_NTD2_NTM0_NEPBS16_NLCA1_NLCB1_ONLL1_PGR2_PLR1_PKA1_SIA3_SS1_SPO0_SRVW0_SSO0_SVW4_SK3_SKFTR0_SKXCCM4_TLDS1_ULSGRO0_USL1_UIOFGRO0_USFGRO0_VSn1_VWA4_VWB4_WSGRA0_WSGRB0_WS64_WG64_4_1,0.0,745.42,3076.47
gfx950,256,16384,256,7168,False,torch.bfloat16,torch.bfloat16,False,False,hipblaslt,440353,0,72.3257,Cijk_Alik_Bljk_BBS_BH_Bias_HA_S_SAV_UserArgs_MT256x128x64_MI16x16x1_SN_LDSB0_AFC1_AFEM1_AFEM1_ASEM1_CLR0_CADS0_DTLA1_DTLB1_DTVA0_DTVB0_EPS0_FDSI0_GRPM1_GRVWA8_GRVWB8_GSU0_GSUAMB_GLS0_ISA950_IU1_K1_LDSTI0_LBSPPA1024_LBSPPB1024_LBSPPM0_LPA16_LPB16_LPM0_LRVW8_LWPMn1_MIAV0_MIWT4_8_MO40_NTn1_NTA2_NTB7_NTC6_NTD1_NTM0_NEPBS16_NLCA1_NLCB1_ONLL1_PGR2_PLR1_PKA1_SIA3_SS1_SPO0_SRVW0_SSO1_SVW4_SK3_SKFTR0_SKXCCM4_TLDS1_ULSGRO0_USL1_UIOFGRO0_USFGRO1_VSn1_VWA4_VWB8_WSGRA0_WSGRB0_WS64_WG64_4_1,0.0,831.37,3414.27
