aiter/configs/model_configs/dsv3_fp4_tuned_fmoe.csv
cu_num,token,model_dim,inter_dim,expert,topk,act_type,dtype,q_dtype_a,q_dtype_w,q_type,use_g1u1,doweight_stage1,block_m,ksplit,us1,kernelName1,err1,us2,kernelName2,err2,us,run_1stage,tflops,bw,_tag
256,1,7168,256,257,9,ActivationType.Silu,torch.bfloat16,torch.float4_e2m1fn_x2,torch.float4_e2m1fn_x2,QuantType.per_1x32,1,0,32,0,22.4916,moe_ck2stages_gemm1_64x32x32x128_1x1_MulABScaleShuffled_v3_Nswizzle0_Quant3_MulRoutedWeight0_silu_FP4X2_FP4X2_B16,0.0%,8.1143,moe_ck2stages_gemm2_64x32x32x128_1x1_MulABScaleExpertWeightShuffled_v1_Nswizzle0_Quant3_MulRoutedWeight1_FP4X2_FP4X2_B16,1.6%,30.6059,0,3.24,46226.8,
256,2,7168,256,257,9,ActivationType.Silu,torch.bfloat16,torch.float4_e2m1fn_x2,torch.float4_e2m1fn_x2,QuantType.per_1x32,1,0,32,0,23.2197,moe_ck2stages_gemm1_64x32x32x128_1x1_MulABScaleShuffled_v3_Nswizzle0_Quant3_MulRoutedWeight0_silu_FP4X2_FP4X2_B16,0.0%,9.918,moe_ck2stages_gemm2_64x32x32x128_1x1_MulABScaleExpertWeightShuffled_v1_Nswizzle0_Quant3_MulRoutedWeight1_FP4X2_FP4X2_B16,1.1%,33.1377,0,5.98,42695.61,
256,4,7168,256,257,9,ActivationType.Silu,torch.bfloat16,torch.float4_e2m1fn_x2,torch.float4_e2m1fn_x2,QuantType.per_1x32,1,0,32,0,25.6348,moe_ck2stages_gemm1_64x32x32x128_1x1_MulABScaleShuffled_v3_Nswizzle0_Quant3_MulRoutedWeight0_silu_FP4X2_FP4X2_B16,0.0%,16.6424,moe_ck2stages_gemm2_64x32x32x128_1x1_MulABScaleExpertWeightShuffled_v1_Nswizzle0_Quant3_MulRoutedWeight1_FP4X2_FP4X2_B16,1.3%,42.2772,0,9.38,33466.67,
256,8,7168,256,257,9,ActivationType.Silu,torch.bfloat16,torch.float4_e2m1fn_x2,torch.float4_e2m1fn_x2,QuantType.per_1x32,1,0,32,0,28.9347,moe_ck2stages_gemm1_64x32x32x128_1x1_MulABScaleShuffled_v3_Nswizzle0_Quant3_MulRoutedWeight0_silu_FP4X2_FP4X2_B16,0.0%,19.9351,moe_ck2stages_gemm2_64x32x32x128_1x1_MulABScaleExpertWeightShuffled_v1_Nswizzle0_Quant3_MulRoutedWeight1_FP4X2_FP4X2_B16,1.4%,48.8698,0,16.22,28953.73,
256,16,7168,256,257,9,ActivationType.Silu,torch.bfloat16,torch.float4_e2m1fn_x2,torch.float4_e2m1fn_x2,QuantType.per_1x32,1,0,32,0,40.6375,moe_ck2stages_gemm1_64x32x32x128_1x1_MulABScaleShuffled_v3_Nswizzle0_Quant3_MulRoutedWeight0_silu_FP4X2_FP4X2_B16,0.0%,26.9507,moe_ck2stages_gemm2_64x32x32x128_1x1_MulABScaleExpertWeightShuffled_v1_Nswizzle0_Quant3_MulRoutedWeight1_FP4X2_FP4X2_B16,1.3%,67.5882,0,23.46,20937.61,
256,32,7168,256,257,9,ActivationType.Silu,torch.bfloat16,torch.float4_e2m1fn_x2,torch.float4_e2m1fn_x2,QuantType.per_1x32,1,0,32,0,62.3129,moe_ck2stages_gemm1_64x32x32x128_1x1_MulABScaleShuffled_v3_Nswizzle0_Quant3_MulRoutedWeight0_silu_FP4X2_FP4X2_B16,0.0%,37.4038,moe_ck2stages_gemm2_64x32x32x128_1x1_MulABScaleExpertWeightShuffled_v1_Nswizzle0_Quant3_MulRoutedWeight1_FP4X2_FP4X2_B16,1.4%,99.7167,0,31.8,14195.01,
256,64,7168,256,257,9,ActivationType.Silu,torch.bfloat16,torch.float4_e2m1fn_x2,torch.float4_e2m1fn_x2,QuantType.per_1x32,1,0,32,0,78.1205,moe_ck2stages_gemm1_256x32x128x128_1x4_MulABScaleShuffled_v3_Nswizzle0_Quant3_MulRoutedWeight0_silu_FP4X2_FP4X2_B16,0.0%,46.9149,moe_ck2stages_gemm2_64x32x32x128_1x1_MulABScaleExpertWeightShuffled_v1_Nswizzle0_Quant3_MulRoutedWeight1_FP4X2_FP4X2_B16,1.3%,125.0354,0,50.72,11326.13,
256,128,7168,256,257,9,ActivationType.Silu,torch.bfloat16,torch.float4_e2m1fn_x2,torch.float4_e2m1fn_x2,QuantType.per_1x32,1,0,32,0,86.587,moe_ck2stages_gemm1_64x32x32x128_1x1_MulABScaleShuffled_v3_Nswizzle0_Quant3_MulRoutedWeight0_silu_FP4X2_FP4X2_B16,0.0%,53.2054,moe_ck2stages_gemm2_64x32x32x128_1x1_MulABScaleExpertWeightShuffled_v1_Nswizzle0_Quant3_MulRoutedWeight1_FP4X2_FP4X2_B16,1.4%,139.7924,0,90.73,10140.35,
256,256,7168,256,257,9,ActivationType.Silu,torch.bfloat16,torch.float4_e2m1fn_x2,torch.float4_e2m1fn_x2,QuantType.per_1x32,1,0,32,0,95.5034,moe_ck2stages_gemm1_64x32x32x128_1x1_MulABScaleShuffled_v3_Nswizzle0_Quant3_MulRoutedWeight0_silu_FP4X2_FP4X2_B16,0.0%,58.1256,moe_ck2stages_gemm2_64x32x32x128_1x1_MulABScaleExpertWeightShuffled_v1_Nswizzle0_Quant3_MulRoutedWeight1_FP4X2_FP4X2_B16,1.3%,153.629,0,165.12,9244.97,
256,512,7168,256,257,9,ActivationType.Silu,torch.bfloat16,torch.float4_e2m1fn_x2,torch.float4_e2m1fn_x2,QuantType.per_1x32,1,0,32,0,96.3317,moe_ck2stages_gemm1_64x32x32x128_1x1_MulABScaleShuffled_v3_Nswizzle0_Quant3_MulRoutedWeight0_silu_FP4X2_FP4X2_B16,0.0%,70.4669,moe_ck2stages_gemm2_64x32x32x128_1x1_MulABScaleExpertWeightShuffled_v1_Nswizzle0_Quant3_MulRoutedWeight1_FP4X2_FP4X2_B16,1.3%,166.7986,0,304.17,8548.04,
256,1024,7168,256,257,9,ActivationType.Silu,torch.bfloat16,torch.float4_e2m1fn_x2,torch.float4_e2m1fn_x2,QuantType.per_1x32,1,0,64,0,110.2785,moe_ck2stages_gemm1_256x64x128x128_1x4_MulABScaleShuffled_v3_Nswizzle0_Quant3_MulRoutedWeight0_silu_FP4X2_FP4X2_B16,0.0%,101.3744,flydsl_moe2_afp4_wfp4_bf16_t64x256x256_reduce,0.1%,211.6529,0,479.41,6788.53,
256,2048,7168,256,257,9,ActivationType.Silu,torch.bfloat16,torch.float4_e2m1fn_x2,torch.float4_e2m1fn_x2,QuantType.per_1x32,1,0,128,0,124.5664,moe_ck2stages_gemm1_256x128x128x128_1x4_MulABScaleShuffled_v3_Nswizzle0_Quant3_MulRoutedWeight0_silu_FP4X2_FP4X2_B16,0.0%,177.7043,flydsl_moe2_afp4_wfp4_bf16_t128x256x256_reduce,0.1%,302.2707,0,671.38,4826.24,
256,4096,7168,256,257,9,ActivationType.Silu,torch.bfloat16,torch.float4_e2m1fn_x2,torch.float4_e2m1fn_x2,QuantType.per_1x32,1,0,64,0,233.0212,moe_ck2stages_gemm1_256x64x128x128_1x4_MulABScaleShuffled_v3_Nswizzle0_Quant3_MulRoutedWeight0_silu_FP4X2_FP4X2_B16,0.0%,274.8973,flydsl_moe2_afp4_wfp4_bf16_t64x256x256_reduce,0.1%,507.9185,0,799.09,2958.88,
256,8192,7168,256,257,9,ActivationType.Silu,torch.bfloat16,torch.float4_e2m1fn_x2,torch.float4_e2m1fn_x2,QuantType.per_1x32,1,0,64,0,347.9247,moe_ck2stages_gemm1_256x64x128x128_1x4_MulABScaleShuffled_v3_Nswizzle0_Quant3_MulRoutedWeight0_silu_FP4X2_FP4X2_B16,0.0%,525.2438,flydsl_moe2_afp4_wfp4_bf16_t64x256x256_reduce,0.1%,873.1685,0,929.66,1822.04,
256,16384,7168,256,257,9,ActivationType.Silu,torch.bfloat16,torch.float4_e2m1fn_x2,torch.float4_e2m1fn_x2,QuantType.per_1x32,1,0,64,0,446.7225,moe_ck2stages_gemm1_256x64x128x128_1x4_MulABScaleShuffled_v3_Nswizzle0_Quant3_MulRoutedWeight0_silu_FP4X2_FP4X2_B16,0.0%,984.4375,flydsl_moe2_afp4_wfp4_bf16_t64x256x256_reduce,0.1%,1431.16,0,1134.39,1234.74,
256,32768,7168,256,257,9,ActivationType.Silu,torch.bfloat16,torch.float4_e2m1fn_x2,torch.float4_e2m1fn_x2,QuantType.per_1x32,1,0,128,0,620.8671,moe_ck2stages_gemm1_256x128x128x128_1x4_MulABScaleShuffled_v3_Nswizzle0_Quant3_MulRoutedWeight0_silu_FP4X2_FP4X2_B16,0.0%,2040.8518,flydsl_moe2_afp4_wfp4_bf16_t128x256x256_reduce,0.1%,2661.7189,0,1219.89,796.27,
256,1024,7168,256,257,9,ActivationType.Silu,torch.bfloat16,torch.float4_e2m1fn_x2,torch.float4_e2m1fn_x2,QuantType.per_1x32,1,0,32,0,113.2794,moe_ck2stages_gemm1_64x32x32x128_1x1_MulABScaleShuffled_v3_Nswizzle0_Quant3_MulRoutedWeight0_silu_FP4X2_FP4X2_B16,0.0,120.3286,moe_ck2stages_gemm2_64x32x32x128_1x1_MulABScaleExpertWeightShuffled_v1_Nswizzle0_Quant3_MulRoutedWeight1_FP4X2_FP4X2_B16,0.0132,233.608,0,0.0,0.0,flydsl_fallback
256,2048,7168,256,257,9,ActivationType.Silu,torch.bfloat16,torch.float4_e2m1fn_x2,torch.float4_e2m1fn_x2,QuantType.per_1x32,1,0,128,0,124.5664,moe_ck2stages_gemm1_256x128x128x128_1x4_MulABScaleShuffled_v3_Nswizzle0_Quant3_MulRoutedWeight0_silu_FP4X2_FP4X2_B16,0.0,246.48,moe_ck2stages_gemm2_64x128x128x128_1x1_MulABScaleExpertWeightShuffled_v3_Nswizzle0_Quant3_MulRoutedWeight1_FP4X2_FP4X2_B16,0.0132,371.0464,0,0.0,0.0,flydsl_fallback
256,4096,7168,256,257,9,ActivationType.Silu,torch.bfloat16,torch.float4_e2m1fn_x2,torch.float4_e2m1fn_x2,QuantType.per_1x32,1,0,128,0,170.1975,moe_ck2stages_gemm1_256x128x128x128_1x4_MulABScaleShuffled_v3_Nswizzle0_Quant3_MulRoutedWeight0_silu_FP4X2_FP4X2_B16,0.0,441.8299,moe_ck2stages_gemm2_64x128x128x128_1x1_MulABScaleExpertWeightShuffled_v3_Nswizzle0_Quant3_MulRoutedWeight1_FP4X2_FP4X2_B16,0.0133,612.0274,0,0.0,0.0,flydsl_fallback
256,8192,7168,256,257,9,ActivationType.Silu,torch.bfloat16,torch.float4_e2m1fn_x2,torch.float4_e2m1fn_x2,QuantType.per_1x32,1,0,128,0,276.3603,moe_ck2stages_gemm1_256x128x128x128_1x4_MulABScaleShuffled_v3_Nswizzle0_Quant3_MulRoutedWeight0_silu_FP4X2_FP4X2_B16,0.0,837.4248,moe_ck2stages_gemm2_64x128x128x128_1x1_MulABScaleExpertWeightShuffled_v3_Nswizzle0_Quant3_MulRoutedWeight1_FP4X2_FP4X2_B16,0.0133,1113.7851,0,0.0,0.0,flydsl_fallback
256,16384,7168,256,257,9,ActivationType.Silu,torch.bfloat16,torch.float4_e2m1fn_x2,torch.float4_e2m1fn_x2,QuantType.per_1x32,1,0,128,0,430.254,moe_ck2stages_gemm1_256x128x128x128_1x4_MulABScaleShuffled_v3_Nswizzle0_Quant3_MulRoutedWeight0_silu_FP4X2_FP4X2_B16,0.0,1655.86,moe_ck2stages_gemm2_64x128x128x128_1x1_MulABScaleExpertWeightShuffled_v3_Nswizzle0_Quant3_MulRoutedWeight1_FP4X2_FP4X2_B16,0.0133,2086.114,0,0.0,0.0,flydsl_fallback
256,32768,7168,256,257,9,ActivationType.Silu,torch.bfloat16,torch.float4_e2m1fn_x2,torch.float4_e2m1fn_x2,QuantType.per_1x32,1,0,128,0,620.8671,moe_ck2stages_gemm1_256x128x128x128_1x4_MulABScaleShuffled_v3_Nswizzle0_Quant3_MulRoutedWeight0_silu_FP4X2_FP4X2_B16,0.0,3364.8075,moe_ck2stages_gemm2_64x128x128x128_1x1_MulABScaleExpertWeightShuffled_v3_Nswizzle0_Quant3_MulRoutedWeight1_FP4X2_FP4X2_B16,0.0133,3985.6746,0,0.0,0.0,flydsl_fallback
