aiter/configs/model_configs/dsv3_bf16_tuned_gemm.csv
gfx,cu_num,M,N,K,bias,dtype,outdtype,scaleAB,bpreshuffle,libtype,solidx,splitK,us,kernelName,err_ratio,tflops,bw
gfx950,256,1,256,7168,False,torch.bfloat16,torch.bfloat16,False,False,skinny,2,0,3.9942,sol2,0.0,0.92,922.55
gfx950,256,2,256,7168,False,torch.bfloat16,torch.bfloat16,False,False,skinny,2,0,5.1663,sol2,0.0,1.42,716.12
gfx950,256,4,256,7168,False,torch.bfloat16,torch.bfloat16,False,False,flydsl,9652,8,5.8504,flydsl_gemm5_abf16_wbf16_bf16_t16x64x128_split_k8_block_m_warp1_block_n_warp1_block_k_warp2_async_copyTrue_b_to_ldsTrue_b_preshuffleFalse_c_to_ldsFalse_gfx950,0.042,2.51,637.46
gfx950,256,8,256,7168,False,torch.bfloat16,torch.bfloat16,False,False,triton,0,0,5.5745,auto,0.0,5.27,679.67
gfx950,256,16,256,7168,False,torch.bfloat16,torch.bfloat16,False,False,triton,0,0,5.9189,auto,0.0,9.92,660.19
gfx950,256,32,256,7168,False,torch.bfloat16,torch.bfloat16,False,False,flydsl,6934,8,6.3869,flydsl_gemm4_abf16_wbf16_bf16_t16x64x128_split_k8_block_m_warp1_block_n_warp2_block_k_warp1_async_copyTrue_b_to_ldsTrue_b_preshuffleFalse_c_to_ldsFalse_gfx950,0.0209,18.39,649.01
gfx950,256,48,256,7168,False,torch.bfloat16,torch.bfloat16,False,False,flydsl,9654,8,6.5235,flydsl_gemm5_abf16_wbf16_bf16_t16x64x128_split_k8_block_m_warp1_block_n_warp2_block_k_warp1_async_copyTrue_b_to_ldsTrue_b_preshuffleFalse_c_to_ldsFalse_gfx950,0.0225,27.0,671.84
gfx950,256,64,256,7168,False,torch.bfloat16,torch.bfloat16,False,False,flydsl,9603,8,7.0107,flydsl_gemm4_abf16_wbf16_bf16_t16x64x128_split_k8_block_m_warp1_block_n_warp2_block_k_warp1_async_copyTrue_b_to_ldsTrue_b_preshuffleFalse_c_to_ldsFalse_gfx950,0.0214,33.5,659.03
gfx950,256,80,256,7168,False,torch.bfloat16,torch.bfloat16,False,False,flydsl,9603,8,7.0627,flydsl_gemm4_abf16_wbf16_bf16_t16x64x128_split_k8_block_m_warp1_block_n_warp2_block_k_warp1_async_copyTrue_b_to_ldsTrue_b_preshuffleFalse_c_to_ldsFalse_gfx950,0.0214,41.57,687.82
gfx950,256,96,256,7168,False,torch.bfloat16,torch.bfloat16,False,False,flydsl,9601,8,7.1991,flydsl_gemm4_abf16_wbf16_bf16_t16x64x128_split_k8_block_m_warp1_block_n_warp1_block_k_warp2_async_copyTrue_b_to_ldsTrue_b_preshuffleFalse_c_to_ldsFalse_gfx950,0.0292,48.94,707.79
gfx950,256,112,256,7168,False,torch.bfloat16,torch.bfloat16,False,False,flydsl,9603,8,7.3027,flydsl_gemm4_abf16_wbf16_bf16_t16x64x128_split_k8_block_m_warp1_block_n_warp2_block_k_warp1_async_copyTrue_b_to_ldsTrue_b_preshuffleFalse_c_to_ldsFalse_gfx950,0.0228,56.29,730.28
gfx950,256,128,256,7168,False,torch.bfloat16,torch.bfloat16,False,False,flydsl,10793,8,7.5531,flydsl_gemm4_abf16_wbf16_bf16_t16x64x128_split_k8_block_m_warp1_block_n_warp2_block_k_warp1_async_copyTrue_b_to_ldsTrue_b_preshuffleFalse_c_to_ldsFalse_gfx950,0.0224,62.19,737.52
gfx950,256,256,256,7168,False,torch.bfloat16,torch.bfloat16,False,False,torch,0,0,11.2683,native,0.0,83.38,663.02
gfx950,256,1,2112,7168,False,torch.bfloat16,torch.bfloat16,False,False,flydsl,2257,7,8.1587,flydsl_gemm4_abf16_wbf16_bf16_t16x64x64_split_k7_block_m_warp1_block_n_warp2_block_k_warp1_async_copyTrue_b_to_ldsTrue_b_preshuffleFalse_c_to_ldsFalse_gfx950,0.0147,3.71,3713.36
gfx950,256,2,2112,7168,False,torch.bfloat16,torch.bfloat16,False,False,flydsl,1171,7,8.188,flydsl_gemm3_abf16_wbf16_bf16_t16x64x128_split_k7_block_m_warp1_block_n_warp2_block_k_warp1_async_copyTrue_b_to_ldsTrue_b_preshuffleFalse_c_to_ldsFalse_gfx950,0.0133,7.4,3702.34
gfx950,256,80,2112,7168,False,torch.bfloat16,torch.bfloat16,False,False,asm,7,6,15.6805,_ZN5aiter39bf16gemm_fp32bf16_tn_80x64_splitk_cleanE,0.0179,154.47,2025.6
gfx950,256,112,2112,7168,False,torch.bfloat16,torch.bfloat16,False,False,asm,5,3,19.3478,_ZN5aiter39bf16gemm_fp32bf16_tn_64x64_splitk_cleanE,0.0106,175.27,1672.35
gfx950,256,128,2112,7168,False,torch.bfloat16,torch.bfloat16,False,False,asm,5,3,19.4606,_ZN5aiter39bf16gemm_fp32bf16_tn_64x64_splitk_cleanE,0.0106,199.15,1677.92
gfx950,256,256,2112,7168,False,torch.bfloat16,torch.bfloat16,False,False,asm,8,2,28.0311,_ZN5aiter39bf16gemm_fp32bf16_tn_96x64_splitk_cleanE,0.006,276.52,1249.65
gfx950,256,1,3072,1536,False,torch.bfloat16,torch.bfloat16,False,False,flydsl,11941,4,5.3627,flydsl_gemm5_abf16_wbf16_bf16_t16x64x64_split_k4_block_m_warp1_block_n_warp2_block_k_warp1_async_copyTrue_b_to_ldsTrue_b_preshuffleFalse_c_to_ldsFalse_gfx950,0.0072,1.76,1761.5
gfx950,256,2,3072,1536,False,torch.bfloat16,torch.bfloat16,False,False,flydsl,11941,4,5.4011,flydsl_gemm5_abf16_wbf16_bf16_t16x64x64_split_k4_block_m_warp1_block_n_warp2_block_k_warp1_async_copyTrue_b_to_ldsTrue_b_preshuffleFalse_c_to_ldsFalse_gfx950,0.0063,3.49,1750.68
gfx950,256,4,3072,1536,False,torch.bfloat16,torch.bfloat16,False,False,flydsl,8555,4,5.6483,flydsl_gemm4_abf16_wbf16_bf16_t16x64x64_split_k4_block_m_warp1_block_n_warp2_block_k_warp1_async_copyTrue_b_to_ldsTrue_b_preshuffleFalse_c_to_ldsFalse_gfx950,0.0055,6.68,1677.33
gfx950,256,8,3072,1536,False,torch.bfloat16,torch.bfloat16,False,False,flydsl,11939,4,5.7483,flydsl_gemm5_abf16_wbf16_bf16_t16x64x64_split_k4_block_m_warp1_block_n_warp1_block_k_warp2_async_copyTrue_b_to_ldsTrue_b_preshuffleFalse_c_to_ldsFalse_gfx950,0.0134,13.13,1654.56
gfx950,256,16,3072,1536,False,torch.bfloat16,torch.bfloat16,False,False,triton,0,0,6.0759,auto,0.0,24.85,1577.48
gfx950,256,32,3072,1536,False,torch.bfloat16,torch.bfloat16,False,False,triton,0,0,5.9991,auto,0.0,50.34,1622.26
gfx950,256,48,3072,1536,False,torch.bfloat16,torch.bfloat16,False,False,flydsl,8505,1,7.3951,flydsl_gemm4_abf16_wbf16_bf16_t16x64x256_split_k1_block_m_warp1_block_n_warp1_block_k_warp2_async_copyTrue_b_to_ldsTrue_b_preshuffleFalse_c_to_ldsFalse_gfx950,0.0029,61.25,1335.96
gfx950,256,64,3072,1536,False,torch.bfloat16,torch.bfloat16,False,False,flydsl,11928,1,7.1839,flydsl_gemm4_abf16_wbf16_bf16_t16x64x128_split_k1_block_m_warp1_block_n_warp2_block_k_warp1_async_copyTrue_b_to_ldsTrue_b_preshuffleFalse_c_to_ldsFalse_gfx950,0.0,84.07,1395.76
gfx950,256,80,3072,1536,False,torch.bfloat16,torch.bfloat16,False,False,flydsl,16227,1,7.4363,flydsl_gemm5_abf16_wbf16_bf16_t16x64x128_split_k1_block_m_warp1_block_n_warp2_block_k_warp1_async_copyTrue_b_to_ldsTrue_b_preshuffleFalse_c_to_ldsFalse_gfx950,0.0,101.53,1368.22
gfx950,256,96,3072,1536,False,torch.bfloat16,torch.bfloat16,False,False,flydsl,11928,1,7.5909,flydsl_gemm4_abf16_wbf16_bf16_t16x64x128_split_k1_block_m_warp1_block_n_warp2_block_k_warp1_async_copyTrue_b_to_ldsTrue_b_preshuffleFalse_c_to_ldsFalse_gfx950,0.0,119.35,1359.78
gfx950,256,112,3072,1536,False,torch.bfloat16,torch.bfloat16,False,False,flydsl,12664,1,7.6488,flydsl_gemm4_abf16_wbf16_bf16_t32x64x128_split_k1_block_m_warp1_block_n_warp4_block_k_warp1_async_copyTrue_b_to_ldsTrue_b_preshuffleFalse_c_to_ldsFalse_gfx950,0.0,138.19,1368.76
gfx950,256,128,3072,1536,False,torch.bfloat16,torch.bfloat16,False,False,flydsl,14738,1,7.9934,flydsl_gemm4_abf16_wbf16_bf16_t32x64x128_split_k1_block_m_warp1_block_n_warp4_block_k_warp1_async_copyTrue_b_to_ldsTrue_b_preshuffleFalse_c_to_ldsFalse_gfx950,0.0,151.12,1328.2
gfx950,256,256,3072,1536,False,torch.bfloat16,torch.bfloat16,False,False,torch,0,0,11.3573,native,0.0,212.72,1038.67
gfx950,256,1,7168,2048,False,torch.bfloat16,torch.bfloat16,False,False,triton,0,0,7.5365,auto,0.0,3.9,3898.17
gfx950,256,2,7168,2048,False,torch.bfloat16,torch.bfloat16,False,False,flydsl,8135,2,7.6621,flydsl_gemm5_abf16_wbf16_bf16_t16x64x128_split_k2_block_m_warp1_block_n_warp2_block_k_warp1_async_copyTrue_b_to_ldsTrue_b_preshuffleFalse_c_to_ldsFalse_gfx950,0.0026,7.66,3836.68
gfx950,256,4,7168,2048,False,torch.bfloat16,torch.bfloat16,False,False,triton,0,0,7.6525,auto,0.0,15.35,3846.31
gfx950,256,8,7168,2048,False,torch.bfloat16,torch.bfloat16,False,False,triton,0,0,7.7634,auto,0.0,30.25,3800.86
gfx950,256,16,7168,2048,False,torch.bfloat16,torch.bfloat16,False,False,triton,0,0,7.8742,auto,0.0,59.66,3766.1
gfx950,256,32,7168,2048,False,torch.bfloat16,torch.bfloat16,False,False,triton,0,0,8.0383,auto,0.0,116.88,3725.91
gfx950,256,48,7168,2048,False,torch.bfloat16,torch.bfloat16,False,False,flydsl,6355,1,9.4041,flydsl_gemm4_abf16_wbf16_bf16_t32x64x128_split_k1_block_m_warp1_block_n_warp4_block_k_warp1_async_copyTrue_b_to_ldsTrue_b_preshuffleFalse_c_to_ldsFalse_gfx950,0.0,149.86,3216.14
gfx950,256,64,7168,2048,False,torch.bfloat16,torch.bfloat16,False,False,flydsl,8531,1,10.0519,flydsl_gemm4_abf16_wbf16_bf16_t32x64x128_split_k1_block_m_warp1_block_n_warp4_block_k_warp1_async_copyTrue_b_to_ldsTrue_b_preshuffleFalse_c_to_ldsFalse_gfx950,0.0,186.93,3038.21
gfx950,256,80,7168,2048,False,torch.bfloat16,torch.bfloat16,False,False,flydsl,9481,1,10.6134,flydsl_gemm4_abf16_wbf16_bf16_t64x64x128_split_k1_block_m_warp2_block_n_warp2_block_k_warp2_async_copyTrue_b_to_ldsTrue_b_preshuffleFalse_c_to_ldsFalse_gfx950,0.0034,221.31,2905.26
gfx950,256,96,7168,2048,False,torch.bfloat16,torch.bfloat16,False,False,flydsl,9487,1,11.222,flydsl_gemm4_abf16_wbf16_bf16_t64x64x128_split_k1_block_m_warp4_block_n_warp1_block_k_warp2_async_copyTrue_b_to_ldsTrue_b_preshuffleFalse_c_to_ldsFalse_gfx950,0.0033,251.16,2773.98
gfx950,256,112,7168,2048,False,torch.bfloat16,torch.bfloat16,False,False,flydsl,9481,1,11.6954,flydsl_gemm4_abf16_wbf16_bf16_t64x64x128_split_k1_block_m_warp2_block_n_warp2_block_k_warp2_async_copyTrue_b_to_ldsTrue_b_preshuffleFalse_c_to_ldsFalse_gfx950,0.0034,281.16,2686.91
gfx950,256,128,7168,2048,False,torch.bfloat16,torch.bfloat16,False,False,flydsl,10707,1,12.2231,flydsl_gemm4_abf16_wbf16_bf16_t64x64x128_split_k1_block_m_warp2_block_n_warp4_block_k_warp1_async_copyTrue_b_to_ldsTrue_b_preshuffleFalse_c_to_ldsFalse_gfx950,0.0,307.46,2595.04
gfx950,256,256,7168,2048,False,torch.bfloat16,torch.bfloat16,False,False,flydsl,5047,1,15.8076,flydsl_gemm3_abf16_wbf16_bf16_t128x64x128_split_k1_block_m_warp2_block_n_warp4_block_k_warp1_async_copyTrue_b_to_ldsTrue_b_preshuffleFalse_c_to_ldsFalse_gfx950,0.0,475.48,2155.84
gfx950,256,1,16160,7168,False,torch.bfloat16,torch.bfloat16,False,False,triton,0,0,36.0096,auto,0.0,6.43,6434.85
gfx950,256,2,16160,7168,False,torch.bfloat16,torch.bfloat16,False,False,triton,0,0,36.6692,auto,0.0,12.64,6320.37
gfx950,256,4,16160,7168,False,torch.bfloat16,torch.bfloat16,False,False,triton,0,0,35.8706,auto,0.0,25.83,6463.69
gfx950,256,8,16160,7168,False,torch.bfloat16,torch.bfloat16,False,False,triton,0,0,36.736,auto,0.0,50.45,6316.5
gfx950,256,16,16160,7168,False,torch.bfloat16,torch.bfloat16,False,False,triton,0,0,37.9986,auto,0.0,97.55,6116.44
gfx950,256,32,16160,7168,False,torch.bfloat16,torch.bfloat16,False,False,triton,0,0,41.9799,auto,0.0,176.59,5554.15
gfx950,256,48,16160,7168,False,torch.bfloat16,torch.bfloat16,False,False,torch,0,0,40.4689,native,0.0,274.78,5779.98
gfx950,256,64,16160,7168,False,torch.bfloat16,torch.bfloat16,False,False,torch,0,0,42.6559,native,0.0,347.59,5501.13
gfx950,256,80,16160,7168,False,torch.bfloat16,torch.bfloat16,False,False,torch,0,0,46.631,native,0.0,397.45,5048.19
gfx950,256,96,16160,7168,False,torch.bfloat16,torch.bfloat16,False,False,torch,0,0,54.0897,native,0.0,411.17,4365.87
gfx950,256,112,16160,7168,False,torch.bfloat16,torch.bfloat16,False,False,torch,0,0,58.5779,native,0.0,442.95,4044.11
gfx950,256,128,16160,7168,False,torch.bfloat16,torch.bfloat16,False,False,torch,0,0,58.424,native,0.0,507.56,4067.54
gfx950,256,256,16160,7168,False,torch.bfloat16,torch.bfloat16,False,False,torch,0,0,102.2746,native,0.0,579.88,2381.96
