aiter/configs/model_configs/dsv3_fp4_tuned_fmoe.csv
cu_num,token,model_dim,inter_dim,expert,topk,act_type,dtype,q_dtype_a,q_dtype_w,q_type,use_g1u1,doweight_stage1,block_m,ksplit,us1,kernelName1,err1,us2,kernelName2,err2,us,run_1stage,gate_mode,tflops,bw,_tag
256,1,7168,256,257,9,ActivationType.Silu,torch.bfloat16,torch.float4_e2m1fn_x2,torch.float4_e2m1fn_x2,QuantType.per_1x32,1,0,32,0,11.3537,flydsl_moe1_afp4_wfp4_bf16_t32x32x256_w4_kw4_fp4,0.5%,7.5406,moe_ck2stages_gemm2_64x32x32x128_1x1_MulABScaleExpertWeightShuffled_v1_Nswizzle0_Quant3_MulRoutedWeight1_FP4X2_FP4X2_B16,1.5%,18.8943,0,separated,5.24,74880.4,
256,2,7168,256,257,9,ActivationType.Silu,torch.bfloat16,torch.float4_e2m1fn_x2,torch.float4_e2m1fn_x2,QuantType.per_1x32,1,0,32,0,15.5646,flydsl_moe1_afp4_wfp4_bf16_t32x32x256_w4_bnt0_kw4,0.0%,8.7063,moe_ck2stages_gemm2_256x32x128x128_1x4_MulABScaleExpertWeightShuffled_v3_Nswizzle0_Quant3_MulRoutedWeight1_FP4X2_FP4X2_B16,1.3%,24.2709,0,separated,8.17,58293.44,
256,4,7168,256,257,9,ActivationType.Silu,torch.bfloat16,torch.float4_e2m1fn_x2,torch.float4_e2m1fn_x2,QuantType.per_1x32,1,0,32,0,17.9903,flydsl_moe1_afp4_wfp4_bf16_t32x32x256_w4_bnt0_kw2_fp4,0.6%,12.7431,flydsl_moe2_afp4_wfp4_bf16_t32x128x256_reduce_bnt2,0.0%,30.7334,0,separated,12.9,46037.12,
256,8,7168,256,257,9,ActivationType.Silu,torch.bfloat16,torch.float4_e2m1fn_x2,torch.float4_e2m1fn_x2,QuantType.per_1x32,1,0,32,0,27.7397,flydsl_moe1_afp4_wfp4_bf16_t32x32x256_w3_xcd4_kw2_fp4,0.8%,17.7291,flydsl_moe2_afp4_wfp4_bf16_t32x128x256_reduce,0.1%,45.4688,0,separated,17.43,31119.43,
256,16,7168,256,257,9,ActivationType.Silu,torch.bfloat16,torch.float4_e2m1fn_x2,torch.float4_e2m1fn_x2,QuantType.per_1x32,1,0,32,0,40.5338,flydsl_moe1_afp4_wfp4_bf16_t32x128x256_w3,0.0%,24.9519,flydsl_moe2_afp4_wfp4_bf16_t32x128x256_reduce,0.1%,65.4857,0,separated,24.21,21609.84,
256,32,7168,256,257,9,ActivationType.Silu,torch.bfloat16,torch.float4_e2m1fn_x2,torch.float4_e2m1fn_x2,QuantType.per_1x32,1,0,32,0,58.9403,flydsl_moe1_afp4_wfp4_bf16_t32x64x256_w4,0.0%,36.7406,flydsl_moe2_afp4_wfp4_bf16_t16x256x256_atomic_bnt2_sbm32,1.4%,95.6809,0,separated,33.14,14793.75,
256,64,7168,256,257,9,ActivationType.Silu,torch.bfloat16,torch.float4_e2m1fn_x2,torch.float4_e2m1fn_x2,QuantType.per_1x32,1,0,32,0,86.9658,flydsl_moe1_afp4_wfp4_bf16_t32x32x256_w3,0.0%,50.2012,moe_ck2stages_gemm2_64x32x32x128_1x1_MulABScaleExpertWeightShuffled_v1_Nswizzle0_Quant3_MulRoutedWeight1_FP4X2_FP4X2_B16,1.2%,137.167,0,separated,46.23,10324.4,
256,128,7168,256,257,9,ActivationType.Silu,torch.bfloat16,torch.float4_e2m1fn_x2,torch.float4_e2m1fn_x2,QuantType.per_1x32,1,0,32,0,87.5346,flydsl_moe1_afp4_wfp4_bf16_t32x32x256_w3,0.0%,54.4124,moe_ck2stages_gemm2_64x32x32x128_1x1_MulABScaleExpertWeightShuffled_v1_Nswizzle0_Quant3_MulRoutedWeight1_FP4X2_FP4X2_B16,1.2%,141.947,0,separated,89.35,9986.43,
256,256,7168,256,257,9,ActivationType.Silu,torch.bfloat16,torch.float4_e2m1fn_x2,torch.float4_e2m1fn_x2,QuantType.per_1x32,1,0,32,0,87.99549999999999,flydsl_moe1_afp4_wfp4_bf16_t32x32x256_w3,0.0%,57.677,flydsl_moe2_afp4_wfp4_bf16_t16x256x256_atomic_sbm32,1.2%,145.6725,0,separated,174.14,9749.93,
256,512,7168,256,257,9,ActivationType.Silu,torch.bfloat16,torch.float4_e2m1fn_x2,torch.float4_e2m1fn_x2,QuantType.per_1x32,1,0,32,0,91.2564,flydsl_moe1_afp4_wfp4_bf16_t32x32x256_w3,0.0%,70.2575,flydsl_moe2_afp4_wfp4_bf16_t32x256x256_atomic,1.2%,161.5139,0,separated,314.12,8827.73,
256,1024,7168,256,257,9,ActivationType.Silu,torch.bfloat16,torch.float4_e2m1fn_x2,torch.float4_e2m1fn_x2,QuantType.per_1x32,1,0,64,0,106.2571,flydsl_moe1_afp4_wfp4_bf16_t64x64x256_w4,0.0%,107.529,flydsl_moe2_afp4_wfp4_bf16_t64x256x256_reduce,0.0%,213.7861,0,separated,474.63,6720.79,
256,2048,7168,256,257,9,ActivationType.Silu,torch.bfloat16,torch.float4_e2m1fn_x2,torch.float4_e2m1fn_x2,QuantType.per_1x32,1,0,128,0,129.5561,flydsl_moe1_afp4_wfp4_bf16_t128x64x256_w3,0.0%,168.9543,flydsl_moe2_afp4_wfp4_bf16_t64x256x256_reduce_sbm128,0.0%,298.5104,0,separated,679.83,4887.04,
256,4096,7168,256,257,9,ActivationType.Silu,torch.bfloat16,torch.float4_e2m1fn_x2,torch.float4_e2m1fn_x2,QuantType.per_1x32,1,0,128,0,191.9986,moe_ck2stages_gemm1_256x128x128x128_1x4_MulABScaleShuffled_v3_Nswizzle0_Quant3_MulRoutedWeight0_silu_FP4X2_FP4X2_B16,0.0%,283.9092,flydsl_moe2_afp4_wfp4_bf16_t64x256x256_reduce_persist_sbm128,0.0%,475.9078,0,separated,852.84,3157.9,
256,8192,7168,256,257,9,ActivationType.Silu,torch.bfloat16,torch.float4_e2m1fn_x2,torch.float4_e2m1fn_x2,QuantType.per_1x32,1,0,64,0,273.7589,flydsl_moe1_afp4_wfp4_bf16_t64x64x256_w4_bnt0,0.0%,515.3227,flydsl_moe2_afp4_wfp4_bf16_t64x256x256_reduce_persist,0.0%,789.0816,0,separated,1028.73,2016.21,
256,16384,7168,256,257,9,ActivationType.Silu,torch.bfloat16,torch.float4_e2m1fn_x2,torch.float4_e2m1fn_x2,QuantType.per_1x32,1,0,128,0,425.3491,moe_ck2stages_gemm1_256x128x128x128_1x4_MulABScaleShuffled_v3_Nswizzle0_Quant3_MulRoutedWeight0_silu_FP4X2_FP4X2_B16,0.0%,1027.5233,flydsl_moe2_afp4_wfp4_bf16_t64x256x256_reduce_persist_sbm128,0.0%,1452.8724,0,separated,1117.44,1216.29,
256,32768,7168,256,257,9,ActivationType.Silu,torch.bfloat16,torch.float4_e2m1fn_x2,torch.float4_e2m1fn_x2,QuantType.per_1x32,1,0,128,0,669.5871999999999,moe_ck2stages_gemm1_256x128x128x128_1x4_MulABScaleShuffled_v3_Nswizzle0_Quant3_MulRoutedWeight0_silu_FP4X2_FP4X2_B16,0.0%,2017.8465,flydsl_moe2_afp4_wfp4_bf16_t64x256x256_reduce_sbm128,0.0%,2687.4337,0,separated,1208.21,788.65,
256,1,7168,512,257,9,ActivationType.Silu,torch.bfloat16,torch.float4_e2m1fn_x2,torch.float4_e2m1fn_x2,QuantType.per_1x32,1,0,32,0,12.1428,flydsl_moe1_afp4_wfp4_bf16_t32x32x256_w2_kw4_fp4,0.7%,8.0303,moe_ck2stages_gemm2_256x32x128x128_1x4_MulABScaleExpertWeightShuffled_v3_Nswizzle0_Quant3_MulRoutedWeight1_FP4X2_FP4X2_B16,3.2%,20.1731,0,separated,9.82,140266.19,
256,2,7168,512,257,9,ActivationType.Silu,torch.bfloat16,torch.float4_e2m1fn_x2,torch.float4_e2m1fn_x2,QuantType.per_1x32,1,0,32,0,13.2791,flydsl_moe1_afp4_wfp4_bf16_t32x64x256_w3_bnt0_kw2_fp4,0.6%,12.8927,flydsl_moe2_afp4_wfp4_bf16_t32x256x256_reduce_bnt2,0.2%,26.1718,0,separated,15.14,108117.34,
256,4,7168,512,257,9,ActivationType.Silu,torch.bfloat16,torch.float4_e2m1fn_x2,torch.float4_e2m1fn_x2,QuantType.per_1x32,1,0,32,0,21.8046,flydsl_moe1_afp4_wfp4_bf16_t32x64x256_w2_bnt0_fp4,0.5%,18.3272,flydsl_moe2_afp4_wfp4_bf16_t32x256x256_reduce_xcd4,0.3%,40.1318,0,separated,19.75,70509.38,
256,8,7168,512,257,9,ActivationType.Silu,torch.bfloat16,torch.float4_e2m1fn_x2,torch.float4_e2m1fn_x2,QuantType.per_1x32,1,0,64,0,43.5152,flydsl_moe1_afp4_wfp4_bf16_t64x128x256_w3_fp4,0.8%,30.3587,flydsl_moe2_afp4_wfp4_bf16_t32x256x256_reduce_bnt2_sbm64,0.3%,73.8739,0,separated,21.46,38305.2,
256,16,7168,512,257,9,ActivationType.Silu,torch.bfloat16,torch.float4_e2m1fn_x2,torch.float4_e2m1fn_x2,QuantType.per_1x32,1,0,32,0,69.8082,flydsl_moe1_afp4_wfp4_bf16_t32x128x256_w4_fp4,0.7%,43.6106,flydsl_moe2_afp4_wfp4_bf16_t16x128x256_atomic_bnt2_persist_sbm32,3.2%,113.4188,0,separated,27.96,24951.12,
256,32,7168,512,257,9,ActivationType.Silu,torch.bfloat16,torch.float4_e2m1fn_x2,torch.float4_e2m1fn_x2,QuantType.per_1x32,1,0,32,0,110.4072,flydsl_moe1_afp4_wfp4_bf16_t32x128x256_w4,0.0%,63.8052,flydsl_moe2_afp4_wfp4_bf16_t16x128x256_atomic_sbm32,3.1%,174.2124,0,separated,36.4,16246.09,
256,64,7168,512,257,9,ActivationType.Silu,torch.bfloat16,torch.float4_e2m1fn_x2,torch.float4_e2m1fn_x2,QuantType.per_1x32,1,0,32,0,161.46699999999998,flydsl_moe1_afp4_wfp4_bf16_t32x64x256_w3,0.0%,90.7529,flydsl_moe2_afp4_wfp4_bf16_t32x256x256_atomic_persist,2.8%,252.2199,0,separated,50.29,11224.17,
256,128,7168,512,257,9,ActivationType.Silu,torch.bfloat16,torch.float4_e2m1fn_x2,torch.float4_e2m1fn_x2,QuantType.per_1x32,1,0,32,0,164.0521,flydsl_moe1_afp4_wfp4_bf16_t32x64x256_w3,0.0%,93.291,flydsl_moe2_afp4_wfp4_bf16_t32x256x256_atomic,2.8%,257.3431,0,separated,98.57,11006.06,
256,256,7168,512,257,9,ActivationType.Silu,torch.bfloat16,torch.float4_e2m1fn_x2,torch.float4_e2m1fn_x2,QuantType.per_1x32,1,0,32,0,166.8846,flydsl_moe1_afp4_wfp4_bf16_t32x64x256_w3,0.0%,97.1827,flydsl_moe2_afp4_wfp4_bf16_t32x256x256_atomic_persist,2.9%,264.0673,0,separated,192.13,10736.23,
256,512,7168,512,257,9,ActivationType.Silu,torch.bfloat16,torch.float4_e2m1fn_x2,torch.float4_e2m1fn_x2,QuantType.per_1x32,1,0,32,0,170.0333,flydsl_moe1_afp4_wfp4_bf16_t32x64x256_w3,0.0%,106.3422,flydsl_moe2_afp4_wfp4_bf16_t32x256x256_atomic,2.9%,276.3755,0,separated,367.14,10278.02,
256,1024,7168,512,257,9,ActivationType.Silu,torch.bfloat16,torch.float4_e2m1fn_x2,torch.float4_e2m1fn_x2,QuantType.per_1x32,1,0,64,0,180.1543,flydsl_moe1_afp4_wfp4_bf16_t64x64x256_w3,0.0%,137.7076,flydsl_moe2_afp4_wfp4_bf16_t64x256x256_atomic_persist,2.8%,317.8619,0,separated,638.44,8971.2,
256,2048,7168,512,257,9,ActivationType.Silu,torch.bfloat16,torch.float4_e2m1fn_x2,torch.float4_e2m1fn_x2,QuantType.per_1x32,1,0,128,0,222.5561,flydsl_moe1_afp4_wfp4_bf16_t128x128x256_w4,0.0%,240.4672,flydsl_moe2_afp4_wfp4_bf16_t64x256x256_reduce_persist_sbm128,0.2%,463.0233,0,separated,876.57,6206.22,
256,4096,7168,512,257,9,ActivationType.Silu,torch.bfloat16,torch.float4_e2m1fn_x2,torch.float4_e2m1fn_x2,QuantType.per_1x32,1,0,64,0,324.7556,flydsl_moe1_afp4_wfp4_bf16_t64x64x256_w4_bnt0,0.0%,384.1046,flydsl_moe2_afp4_wfp4_bf16_t64x128x256_reduce_persist,0.3%,708.8602,0,separated,1145.15,4115.99,
256,8192,7168,512,257,9,ActivationType.Silu,torch.bfloat16,torch.float4_e2m1fn_x2,torch.float4_e2m1fn_x2,QuantType.per_1x32,1,0,64,0,480.6866,flydsl_moe1_afp4_wfp4_bf16_t64x128x256_w3_bnt0,0.0%,689.6039,flydsl_moe2_afp4_wfp4_bf16_t64x128x256_reduce,0.2%,1170.2905,0,separated,1387.26,2568.37,
256,16384,7168,512,257,9,ActivationType.Silu,torch.bfloat16,torch.float4_e2m1fn_x2,torch.float4_e2m1fn_x2,QuantType.per_1x32,1,0,64,0,787.1499,flydsl_moe1_afp4_wfp4_bf16_t64x128x256_w3_bnt0,0.0%,1304.7952,flydsl_moe2_afp4_wfp4_bf16_t64x128x256_reduce_persist,0.2%,2091.9451,0,separated,1552.14,1521.03,
256,32768,7168,512,257,9,ActivationType.Silu,torch.bfloat16,torch.float4_e2m1fn_x2,torch.float4_e2m1fn_x2,QuantType.per_1x32,1,0,128,0,1344.8576,moe_ck2stages_gemm1_256x128x128x128_1x4_MulABScaleShuffled_v3_Nswizzle0_Quant3_MulRoutedWeight0_silu_FP4X2_FP4X2_B16,0.0%,2440.2438,flydsl_moe2_afp4_wfp4_bf16_t64x256x256_reduce_xcd4_sbm128,0.3%,3785.1014,0,separated,1715.67,933.72,
256,1,7168,512,257,9,ActivationType.Silu,torch.bfloat16,torch.float4_e2m1fn_x2,torch.float4_e2m1fn_x2,QuantType.per_1x32,1,0,32,0,26.0044,moe_ck2stages_gemm1_64x32x32x128_1x1_MulABScaleShuffled_v3_Nswizzle0_Quant3_MulRoutedWeight0_silu_FP4X2_FP4X2_B16,0.0,8.2174,moe_ck2stages_gemm2_256x32x128x128_1x4_MulABScaleExpertWeightShuffled_v3_Nswizzle0_Quant3_MulRoutedWeight1_FP4X2_FP4X2_B16,0.0259,34.2218,0,separated,0.0,0.0,flydsl_fallback
256,2,7168,512,257,9,ActivationType.Silu,torch.bfloat16,torch.float4_e2m1fn_x2,torch.float4_e2m1fn_x2,QuantType.per_1x32,1,0,32,0,28.4667,moe_ck2stages_gemm1_64x32x32x128_1x1_MulABScaleShuffled_v3_Nswizzle0_Quant3_MulRoutedWeight0_silu_FP4X2_FP4X2_B16,0.0,15.3053,moe_ck2stages_gemm2_64x32x32x128_1x1_MulABScaleExpertWeightShuffled_v1_Nswizzle0_Quant3_MulRoutedWeight1_FP4X2_FP4X2_B16,0.0294,43.772,0,separated,0.0,0.0,flydsl_fallback
256,4,7168,512,257,9,ActivationType.Silu,torch.bfloat16,torch.float4_e2m1fn_x2,torch.float4_e2m1fn_x2,QuantType.per_1x32,1,0,32,0,32.3184,moe_ck2stages_gemm1_64x32x32x128_1x1_MulABScaleShuffled_v3_Nswizzle0_Quant3_MulRoutedWeight0_silu_FP4X2_FP4X2_B16,0.0,19.654,moe_ck2stages_gemm2_64x32x32x128_1x1_MulABScaleExpertWeightShuffled_v1_Nswizzle0_Quant3_MulRoutedWeight1_FP4X2_FP4X2_B16,0.0284,51.9724,0,separated,0.0,0.0,flydsl_fallback
256,8,7168,512,257,9,ActivationType.Silu,torch.bfloat16,torch.float4_e2m1fn_x2,torch.float4_e2m1fn_x2,QuantType.per_1x32,1,0,32,0,57.1737,moe_ck2stages_gemm1_64x32x32x128_1x1_MulABScaleShuffled_v3_Nswizzle0_Quant3_MulRoutedWeight0_silu_FP4X2_FP4X2_B16,0.0,30.4539,moe_ck2stages_gemm2_64x32x32x128_1x1_MulABScaleExpertWeightShuffled_v1_Nswizzle0_Quant3_MulRoutedWeight1_FP4X2_FP4X2_B16,0.0299,87.6276,0,separated,0.0,0.0,flydsl_fallback
256,16,7168,512,257,9,ActivationType.Silu,torch.bfloat16,torch.float4_e2m1fn_x2,torch.float4_e2m1fn_x2,QuantType.per_1x32,1,0,32,0,105.7394,moe_ck2stages_gemm1_64x32x32x128_1x1_MulABScaleShuffled_v3_Nswizzle0_Quant3_MulRoutedWeight0_silu_FP4X2_FP4X2_B16,0.0,51.0459,moe_ck2stages_gemm2_64x32x32x128_1x1_MulABScaleExpertWeightShuffled_v1_Nswizzle0_Quant3_MulRoutedWeight1_FP4X2_FP4X2_B16,0.0286,156.7853,0,separated,0.0,0.0,flydsl_fallback
256,32,7168,512,257,9,ActivationType.Silu,torch.bfloat16,torch.float4_e2m1fn_x2,torch.float4_e2m1fn_x2,QuantType.per_1x32,1,0,32,0,180.2495,moe_ck2stages_gemm1_64x32x32x128_1x1_MulABScaleShuffled_v3_Nswizzle0_Quant3_MulRoutedWeight0_silu_FP4X2_FP4X2_B16,0.0,86.0457,moe_ck2stages_gemm2_64x32x32x128_1x1_MulABScaleExpertWeightShuffled_v1_Nswizzle0_Quant3_MulRoutedWeight1_FP4X2_FP4X2_B16,0.0286,266.2952,0,separated,0.0,0.0,flydsl_fallback
256,64,7168,512,257,9,ActivationType.Silu,torch.bfloat16,torch.float4_e2m1fn_x2,torch.float4_e2m1fn_x2,QuantType.per_1x32,1,0,32,0,181.6606,moe_ck2stages_gemm1_64x32x32x128_1x1_MulABScaleShuffled_v3_Nswizzle0_Quant3_MulRoutedWeight0_silu_FP4X2_FP4X2_B16,0.0,86.314,moe_ck2stages_gemm2_64x32x32x128_1x1_MulABScaleExpertWeightShuffled_v1_Nswizzle0_Quant3_MulRoutedWeight1_FP4X2_FP4X2_B16,0.0282,267.9746,0,separated,0.0,0.0,flydsl_fallback
256,128,7168,512,257,9,ActivationType.Silu,torch.bfloat16,torch.float4_e2m1fn_x2,torch.float4_e2m1fn_x2,QuantType.per_1x32,1,0,32,0,183.9412,moe_ck2stages_gemm1_64x32x32x128_1x1_MulABScaleShuffled_v3_Nswizzle0_Quant3_MulRoutedWeight0_silu_FP4X2_FP4X2_B16,0.0,91.0836,moe_ck2stages_gemm2_64x32x32x128_1x1_MulABScaleExpertWeightShuffled_v1_Nswizzle0_Quant3_MulRoutedWeight1_FP4X2_FP4X2_B16,0.0283,275.0248,0,separated,0.0,0.0,flydsl_fallback
256,256,7168,512,257,9,ActivationType.Silu,torch.bfloat16,torch.float4_e2m1fn_x2,torch.float4_e2m1fn_x2,QuantType.per_1x32,1,0,32,0,183.5793,moe_ck2stages_gemm1_64x32x32x128_1x1_MulABScaleShuffled_v3_Nswizzle0_Quant3_MulRoutedWeight0_silu_FP4X2_FP4X2_B16,0.0,99.3509,moe_ck2stages_gemm2_64x32x32x128_1x1_MulABScaleExpertWeightShuffled_v1_Nswizzle0_Quant3_MulRoutedWeight1_FP4X2_FP4X2_B16,0.0286,282.9302,0,separated,0.0,0.0,flydsl_fallback
256,512,7168,512,257,9,ActivationType.Silu,torch.bfloat16,torch.float4_e2m1fn_x2,torch.float4_e2m1fn_x2,QuantType.per_1x32,1,0,32,0,190.4982,moe_ck2stages_gemm1_64x32x32x128_1x1_MulABScaleShuffled_v3_Nswizzle0_Quant3_MulRoutedWeight0_silu_FP4X2_FP4X2_B16,0.0,114.3678,moe_ck2stages_gemm2_64x32x32x128_1x1_MulABScaleExpertWeightShuffled_v1_Nswizzle0_Quant3_MulRoutedWeight1_FP4X2_FP4X2_B16,0.0285,304.866,0,separated,0.0,0.0,flydsl_fallback
256,1024,7168,512,257,9,ActivationType.Silu,torch.bfloat16,torch.float4_e2m1fn_x2,torch.float4_e2m1fn_x2,QuantType.per_1x32,1,0,32,0,256.2395,moe_ck2stages_gemm1_64x32x32x128_1x1_MulABScaleShuffled_v3_Nswizzle0_Quant3_MulRoutedWeight0_silu_FP4X2_FP4X2_B16,0.0,174.224,moe_ck2stages_gemm2_64x32x32x128_1x1_MulABScaleExpertWeightShuffled_v1_Nswizzle0_Quant3_MulRoutedWeight1_FP4X2_FP4X2_B16,0.0284,430.4635,0,separated,0.0,0.0,flydsl_fallback
256,2048,7168,512,257,9,ActivationType.Silu,torch.bfloat16,torch.float4_e2m1fn_x2,torch.float4_e2m1fn_x2,QuantType.per_1x32,1,0,32,0,308.0572,moe_ck2stages_gemm1_64x32x32x128_1x1_MulABScaleShuffled_v3_Nswizzle0_Quant3_MulRoutedWeight0_silu_FP4X2_FP4X2_B16,0.0,286.444,moe_ck2stages_gemm2_64x32x32x128_1x1_MulABScaleExpertWeightShuffled_v1_Nswizzle0_Quant3_MulRoutedWeight1_FP4X2_FP4X2_B16,0.0284,594.5012,0,separated,0.0,0.0,flydsl_fallback
256,4096,7168,512,257,9,ActivationType.Silu,torch.bfloat16,torch.float4_e2m1fn_x2,torch.float4_e2m1fn_x2,QuantType.per_1x32,1,0,64,0,350.8693,moe_ck2stages_gemm1_256x64x128x128_1x4_MulABScaleShuffled_v3_Nswizzle0_Quant3_MulRoutedWeight0_silu_FP4X2_FP4X2_B16,0.0,593.4918,moe_ck2stages_gemm2_64x64x128x128_1x1_MulABScaleExpertWeightShuffled_v3_Nswizzle0_Quant3_MulRoutedWeight1_FP4X2_FP4X2_B16,0.0284,944.3611,0,separated,0.0,0.0,flydsl_fallback
256,8192,7168,512,257,9,ActivationType.Silu,torch.bfloat16,torch.float4_e2m1fn_x2,torch.float4_e2m1fn_x2,QuantType.per_1x32,1,0,64,0,501.4663000000001,moe_ck2stages_gemm1_256x64x128x128_1x4_MulABScaleShuffled_v3_Nswizzle0_Quant3_MulRoutedWeight0_silu_FP4X2_FP4X2_B16,0.0,1050.3505,moe_ck2stages_gemm2_64x64x128x128_1x1_MulABScaleExpertWeightShuffled_v3_Nswizzle0_Quant3_MulRoutedWeight1_FP4X2_FP4X2_B16,0.0285,1551.8168,0,separated,0.0,0.0,flydsl_fallback
256,16384,7168,512,257,9,ActivationType.Silu,torch.bfloat16,torch.float4_e2m1fn_x2,torch.float4_e2m1fn_x2,QuantType.per_1x32,1,0,32,0,1082.6229,moe_ck2stages_gemm1_256x32x128x128_1x4_MulABScaleShuffled_v3_Nswizzle0_Quant3_MulRoutedWeight0_silu_FP4X2_FP4X2_B16,0.0,1997.4238,moe_ck2stages_gemm2_64x32x32x128_1x1_MulABScaleExpertWeightShuffled_v1_Nswizzle0_Quant3_MulRoutedWeight1_FP4X2_FP4X2_B16,0.0284,3080.0467,0,separated,0.0,0.0,flydsl_fallback
256,32768,7168,512,257,9,ActivationType.Silu,torch.bfloat16,torch.float4_e2m1fn_x2,torch.float4_e2m1fn_x2,QuantType.per_1x32,1,0,64,0,1633.0245,moe_ck2stages_gemm1_256x64x128x128_1x4_MulABScaleShuffled_v3_Nswizzle0_Quant3_MulRoutedWeight0_silu_FP4X2_FP4X2_B16,0.0,4180.9635,moe_ck2stages_gemm2_64x64x128x128_1x1_MulABScaleExpertWeightShuffled_v3_Nswizzle0_Quant3_MulRoutedWeight1_FP4X2_FP4X2_B16,0.0291,5813.988,0,separated,0.0,0.0,flydsl_fallback
256,2,7168,256,257,9,ActivationType.Silu,torch.bfloat16,torch.float4_e2m1fn_x2,torch.float4_e2m1fn_x2,QuantType.per_1x32,1,0,32,0,25.0445,moe_ck2stages_gemm1_64x32x32x128_1x1_MulABScaleShuffled_v3_Nswizzle0_Quant3_MulRoutedWeight0_silu_FP4X2_FP4X2_B16,0.0,9.0041,moe_ck2stages_gemm2_64x32x32x128_1x1_MulABScaleExpertWeightShuffled_v1_Nswizzle0_Quant3_MulRoutedWeight1_FP4X2_FP4X2_B16,0.0144,34.0486,0,separated,0.0,0.0,flydsl_fallback
256,32768,7168,2048,64,8,ActivationType.Silu,torch.bfloat16,torch.float4_e2m1fn_x2,torch.float4_e2m1fn_x2,QuantType.per_1x32,1,0,128,0,4655.916200000001,moe_ck2stages_gemm1_256x128x128x128_1x4_MulABScaleShuffled_v3_Nswizzle0_Quant3_MulRoutedWeight0_silu_FP4X2_FP4X2_B16,0.0%,4252.6419,flydsl_moe2_afp4_wfp4_bf16_t128x128x256_atomic_persist,6.8%,8908.5581,0,separated,2591.86,395.49,
256,32768,7168,2048,64,8,ActivationType.Silu,torch.bfloat16,torch.float4_e2m1fn_x2,torch.float4_e2m1fn_x2,QuantType.per_1x32,1,0,128,0,4655.916200000001,moe_ck2stages_gemm1_256x128x128x128_1x4_MulABScaleShuffled_v3_Nswizzle0_Quant3_MulRoutedWeight0_silu_FP4X2_FP4X2_B16,0.0,6110.1531,moe_ck2stages_gemm2_256x128x128x128_1x4_MulABScaleExpertWeightShuffled_v3_Nswizzle0_Quant3_MulRoutedWeight1_FP4X2_FP4X2_B16,0.0681,10766.0693,0,separated,0.0,0.0,flydsl_fallback
256,1,7168,2048,32,8,ActivationType.Silu,torch.bfloat16,torch.float4_e2m1fn_x2,torch.float4_e2m1fn_x2,QuantType.per_1x32,1,0,32,0,26.8074,flydsl_moe1_afp4_wfp4_bf16_t32x64x256_fp4,0.7%,17.7858,moe_ck2stages_gemm2_256x32x128x128_1x4_MulABScaleExpertWeightShuffled_v3_Nswizzle0_Quant3_MulRoutedWeight1_FP4X2_FP4X2_B16,6.9%,44.5932,0,separated,15.8,31603.64,
256,2,7168,2048,32,8,ActivationType.Silu,torch.bfloat16,torch.float4_e2m1fn_x2,torch.float4_e2m1fn_x2,QuantType.per_1x32,1,0,32,0,33.8457,flydsl_moe1_afp4_wfp4_bf16_t32x128x256_w4_fp4,0.9%,23.9086,flydsl_moe2_afp4_wfp4_bf16_t32x128x256_reduce,2.4%,57.7543,0,separated,24.4,24402.15,
256,4,7168,2048,32,8,ActivationType.Silu,torch.bfloat16,torch.float4_e2m1fn_x2,torch.float4_e2m1fn_x2,QuantType.per_1x32,1,0,32,0,52.869600000000005,flydsl_moe1_afp4_wfp4_bf16_t32x64x256_w3,0.0%,33.2092,flydsl_moe2_afp4_wfp4_bf16_t32x128x256_reduce_bnt2,1.9%,86.0788,0,separated,32.74,16373.05,
256,8,7168,2048,32,8,ActivationType.Silu,torch.bfloat16,torch.float4_e2m1fn_x2,torch.float4_e2m1fn_x2,QuantType.per_1x32,1,0,32,0,68.02659999999999,flydsl_moe1_afp4_wfp4_bf16_t32x128x256_w4,0.0%,41.2142,flydsl_moe2_afp4_wfp4_bf16_t32x128x256_reduce_bnt2,2.0%,109.2408,0,separated,51.6,12902.31,
256,16,7168,2048,32,8,ActivationType.Silu,torch.bfloat16,torch.float4_e2m1fn_x2,torch.float4_e2m1fn_x2,QuantType.per_1x32,1,0,32,0,74.2951,flydsl_moe1_afp4_wfp4_bf16_t32x128x256_w2_fp4,0.8%,47.8225,flydsl_moe2_afp4_wfp4_bf16_t32x128x256_reduce_bnt2,2.1%,122.1176,0,separated,92.32,11543.22,
256,32,7168,2048,32,8,ActivationType.Silu,torch.bfloat16,torch.float4_e2m1fn_x2,torch.float4_e2m1fn_x2,QuantType.per_1x32,1,0,32,0,80.2395,flydsl_moe1_afp4_wfp4_bf16_t32x128x256_w4,0.0%,49.0071,flydsl_moe2_afp4_wfp4_bf16_t32x128x256_reduce_bnt2,2.1%,129.2466,0,separated,174.46,10909.18,
256,64,7168,2048,32,8,ActivationType.Silu,torch.bfloat16,torch.float4_e2m1fn_x2,torch.float4_e2m1fn_x2,QuantType.per_1x32,1,0,32,0,77.8085,flydsl_moe1_afp4_wfp4_bf16_t32x128x256_w4_fp4,0.8%,51.3074,flydsl_moe2_afp4_wfp4_bf16_t32x128x256_reduce_bnt2,2.1%,129.1159,0,separated,349.28,10925.55,
256,128,7168,2048,32,8,ActivationType.Silu,torch.bfloat16,torch.float4_e2m1fn_x2,torch.float4_e2m1fn_x2,QuantType.per_1x32,1,0,64,0,85.0064,flydsl_moe1_afp4_wfp4_bf16_t64x128x256_w4,0.0%,56.8714,flydsl_moe2_afp4_wfp4_bf16_t64x128x256_reduce_bnt2,2.1%,141.8778,0,separated,635.72,9952.5,
256,256,7168,2048,32,8,ActivationType.Silu,torch.bfloat16,torch.float4_e2m1fn_x2,torch.float4_e2m1fn_x2,QuantType.per_1x32,1,0,128,0,92.7498,flydsl_moe1_afp4_wfp4_bf16_t128x128x256_w3,0.0%,68.5403,flydsl_moe2_afp4_wfp4_bf16_t128x128x256_reduce_bnt2,2.1%,161.2901,0,separated,1118.41,8771.72,
256,512,7168,2048,32,8,ActivationType.Silu,torch.bfloat16,torch.float4_e2m1fn_x2,torch.float4_e2m1fn_x2,QuantType.per_1x32,1,0,64,0,122.358,flydsl_moe1_afp4_wfp4_bf16_t64x128x256_w2_bnt0_fp4,0.8%,98.7092,flydsl_moe2_afp4_wfp4_bf16_t64x128x256_reduce,2.1%,221.0672,0,separated,1631.98,6424.73,
256,1024,7168,2048,32,8,ActivationType.Silu,torch.bfloat16,torch.float4_e2m1fn_x2,torch.float4_e2m1fn_x2,QuantType.per_1x32,1,0,128,0,192.0355,flydsl_moe1_afp4_wfp4_bf16_t128x128x256_w3_bnt0,0.0%,149.1769,flydsl_moe2_afp4_wfp4_bf16_t64x256x256_reduce_sbm128,2.1%,341.2124,0,separated,2114.68,4194.77,
256,2048,7168,2048,32,8,ActivationType.Silu,torch.bfloat16,torch.float4_e2m1fn_x2,torch.float4_e2m1fn_x2,QuantType.per_1x32,1,0,64,0,315.76,flydsl_moe1_afp4_wfp4_bf16_t64x128x256_w3_bnt0_fp4,0.8%,274.6333,flydsl_moe2_afp4_wfp4_bf16_t64x128x256_atomic,6.7%,590.3933,0,separated,2444.32,2461.62,
256,16384,7168,2048,32,8,ActivationType.Silu,torch.bfloat16,torch.float4_e2m1fn_x2,torch.float4_e2m1fn_x2,QuantType.per_1x32,1,0,128,0,2133.3433,moe_ck2stages_gemm1_256x128x128x128_1x4_MulABScaleShuffled_v3_Nswizzle0_Quant3_MulRoutedWeight0_silu_FP4X2_FP4X2_B16,0.0%,1911.0694,flydsl_moe2_afp4_wfp4_bf16_t64x128x256_atomic_persist_sbm128,6.7%,4044.4127,0,separated,2854.52,435.57,
256,32768,7168,2048,32,8,ActivationType.Silu,torch.bfloat16,torch.float4_e2m1fn_x2,torch.float4_e2m1fn_x2,QuantType.per_1x32,1,0,128,0,4180.4737000000005,moe_ck2stages_gemm1_256x128x128x128_1x4_MulABScaleShuffled_v3_Nswizzle0_Quant3_MulRoutedWeight0_silu_FP4X2_FP4X2_B16,0.0%,3905.8948,flydsl_moe2_afp4_wfp4_bf16_t64x128x256_atomic_persist_sbm128,6.7%,8086.3685,0,separated,2855.39,261.42,
256,1,7168,2048,32,8,ActivationType.Silu,torch.bfloat16,torch.float4_e2m1fn_x2,torch.float4_e2m1fn_x2,QuantType.per_1x32,1,0,32,0,30.155500000000004,moe_ck2stages_gemm1_64x32x32x128_1x1_MulABScaleShuffled_v3_Nswizzle0_Quant3_MulRoutedWeight0_silu_FP4X2_FP4X2_B16,0.0,17.7858,moe_ck2stages_gemm2_256x32x128x128_1x4_MulABScaleExpertWeightShuffled_v3_Nswizzle0_Quant3_MulRoutedWeight1_FP4X2_FP4X2_B16,0.0691,47.9413,0,separated,0.0,0.0,flydsl_fallback
256,2,7168,2048,32,8,ActivationType.Silu,torch.bfloat16,torch.float4_e2m1fn_x2,torch.float4_e2m1fn_x2,QuantType.per_1x32,1,0,32,0,38.2169,moe_ck2stages_gemm1_64x32x32x128_1x1_MulABScaleShuffled_v3_Nswizzle0_Quant3_MulRoutedWeight0_silu_FP4X2_FP4X2_B16,0.0,24.3276,moe_ck2stages_gemm2_256x32x128x128_1x4_MulABScaleExpertWeightShuffled_v3_Nswizzle0_Quant3_MulRoutedWeight1_FP4X2_FP4X2_B16,0.0695,62.5445,0,separated,0.0,0.0,flydsl_fallback
256,4,7168,2048,32,8,ActivationType.Silu,torch.bfloat16,torch.float4_e2m1fn_x2,torch.float4_e2m1fn_x2,QuantType.per_1x32,1,0,32,0,59.0172,moe_ck2stages_gemm1_64x32x32x128_1x1_MulABScaleShuffled_v3_Nswizzle0_Quant3_MulRoutedWeight0_silu_FP4X2_FP4X2_B16,0.0,35.7385,moe_ck2stages_gemm2_256x32x128x128_1x4_MulABScaleExpertWeightShuffled_v3_Nswizzle0_Quant3_MulRoutedWeight1_FP4X2_FP4X2_B16,0.0577,94.7557,0,separated,0.0,0.0,flydsl_fallback
256,8,7168,2048,32,8,ActivationType.Silu,torch.bfloat16,torch.float4_e2m1fn_x2,torch.float4_e2m1fn_x2,QuantType.per_1x32,1,0,32,0,80.2071,moe_ck2stages_gemm1_256x32x128x128_1x4_MulABScaleShuffled_v3_Nswizzle0_Quant3_MulRoutedWeight0_silu_FP4X2_FP4X2_B16,0.0,44.3762,moe_ck2stages_gemm2_256x32x128x128_1x4_MulABScaleExpertWeightShuffled_v3_Nswizzle0_Quant3_MulRoutedWeight1_FP4X2_FP4X2_B16,0.0604,124.5833,0,separated,0.0,0.0,flydsl_fallback
256,16,7168,2048,32,8,ActivationType.Silu,torch.bfloat16,torch.float4_e2m1fn_x2,torch.float4_e2m1fn_x2,QuantType.per_1x32,1,0,32,0,91.1135,moe_ck2stages_gemm1_64x32x32x128_1x1_MulABScaleShuffled_v3_Nswizzle0_Quant3_MulRoutedWeight0_silu_FP4X2_FP4X2_B16,0.0,49.4147,moe_ck2stages_gemm2_256x32x128x128_1x4_MulABScaleExpertWeightShuffled_v3_Nswizzle0_Quant3_MulRoutedWeight1_FP4X2_FP4X2_B16,0.0653,140.5282,0,separated,0.0,0.0,flydsl_fallback
256,32,7168,2048,32,8,ActivationType.Silu,torch.bfloat16,torch.float4_e2m1fn_x2,torch.float4_e2m1fn_x2,QuantType.per_1x32,1,0,32,0,93.0056,moe_ck2stages_gemm1_256x32x128x128_1x4_MulABScaleShuffled_v3_Nswizzle0_Quant3_MulRoutedWeight0_silu_FP4X2_FP4X2_B16,0.0,51.6637,moe_ck2stages_gemm2_256x32x128x128_1x4_MulABScaleExpertWeightShuffled_v3_Nswizzle0_Quant3_MulRoutedWeight1_FP4X2_FP4X2_B16,0.067,144.6693,0,separated,0.0,0.0,flydsl_fallback
256,64,7168,2048,32,8,ActivationType.Silu,torch.bfloat16,torch.float4_e2m1fn_x2,torch.float4_e2m1fn_x2,QuantType.per_1x32,1,0,32,0,94.9037,moe_ck2stages_gemm1_256x32x128x128_1x4_MulABScaleShuffled_v3_Nswizzle0_Quant3_MulRoutedWeight0_silu_FP4X2_FP4X2_B16,0.0,53.2424,moe_ck2stages_gemm2_256x32x128x128_1x4_MulABScaleExpertWeightShuffled_v3_Nswizzle0_Quant3_MulRoutedWeight1_FP4X2_FP4X2_B16,0.0662,148.1461,0,separated,0.0,0.0,flydsl_fallback
256,128,7168,2048,32,8,ActivationType.Silu,torch.bfloat16,torch.float4_e2m1fn_x2,torch.float4_e2m1fn_x2,QuantType.per_1x32,1,0,64,0,101.7684,moe_ck2stages_gemm1_256x64x128x128_1x4_MulABScaleShuffled_v3_Nswizzle0_Quant3_MulRoutedWeight0_silu_FP4X2_FP4X2_B16,0.0,60.054,moe_ck2stages_gemm2_256x64x128x128_1x4_MulABScaleExpertWeightShuffled_v3_Nswizzle0_Quant3_MulRoutedWeight1_FP4X2_FP4X2_B16,0.0671,161.8224,0,separated,0.0,0.0,flydsl_fallback
256,256,7168,2048,32,8,ActivationType.Silu,torch.bfloat16,torch.float4_e2m1fn_x2,torch.float4_e2m1fn_x2,QuantType.per_1x32,1,0,64,0,121.3779,moe_ck2stages_gemm1_256x64x128x128_1x4_MulABScaleShuffled_v3_Nswizzle0_Quant3_MulRoutedWeight0_silu_FP4X2_FP4X2_B16,0.0,77.0112,moe_ck2stages_gemm2_256x64x128x128_1x4_MulABScaleExpertWeightShuffled_v3_Nswizzle0_Quant3_MulRoutedWeight1_FP4X2_FP4X2_B16,0.0669,198.3891,0,separated,0.0,0.0,flydsl_fallback
256,512,7168,2048,32,8,ActivationType.Silu,torch.bfloat16,torch.float4_e2m1fn_x2,torch.float4_e2m1fn_x2,QuantType.per_1x32,1,0,128,0,139.3315,moe_ck2stages_gemm1_256x128x128x128_1x4_MulABScaleShuffled_v3_Nswizzle0_Quant3_MulRoutedWeight0_silu_FP4X2_FP4X2_B16,0.0,121.8909,moe_ck2stages_gemm2_256x128x128x128_1x4_MulABScaleExpertWeightShuffled_v3_Nswizzle0_Quant3_MulRoutedWeight1_FP4X2_FP4X2_B16,0.0671,261.2224,0,separated,0.0,0.0,flydsl_fallback
256,1024,7168,2048,32,8,ActivationType.Silu,torch.bfloat16,torch.float4_e2m1fn_x2,torch.float4_e2m1fn_x2,QuantType.per_1x32,1,0,128,0,202.9012,moe_ck2stages_gemm1_256x128x128x128_1x4_MulABScaleShuffled_v3_Nswizzle0_Quant3_MulRoutedWeight0_silu_FP4X2_FP4X2_B16,0.0,211.4907,moe_ck2stages_gemm2_256x128x128x128_1x4_MulABScaleExpertWeightShuffled_v3_Nswizzle0_Quant3_MulRoutedWeight1_FP4X2_FP4X2_B16,0.0671,414.3919,0,separated,0.0,0.0,flydsl_fallback
256,2048,7168,2048,32,8,ActivationType.Silu,torch.bfloat16,torch.float4_e2m1fn_x2,torch.float4_e2m1fn_x2,QuantType.per_1x32,1,0,128,0,327.4769,moe_ck2stages_gemm1_256x128x128x128_1x4_MulABScaleShuffled_v3_Nswizzle0_Quant3_MulRoutedWeight0_silu_FP4X2_FP4X2_B16,0.0,392.501,moe_ck2stages_gemm2_256x128x128x128_1x4_MulABScaleExpertWeightShuffled_v3_Nswizzle0_Quant3_MulRoutedWeight1_FP4X2_FP4X2_B16,0.0666,719.9779,0,separated,0.0,0.0,flydsl_fallback
256,16384,7168,2048,32,8,ActivationType.Silu,torch.bfloat16,torch.float4_e2m1fn_x2,torch.float4_e2m1fn_x2,QuantType.per_1x32,1,0,128,0,2133.3433,moe_ck2stages_gemm1_256x128x128x128_1x4_MulABScaleShuffled_v3_Nswizzle0_Quant3_MulRoutedWeight0_silu_FP4X2_FP4X2_B16,0.0,3010.597,moe_ck2stages_gemm2_256x128x128x128_1x4_MulABScaleExpertWeightShuffled_v3_Nswizzle0_Quant3_MulRoutedWeight1_FP4X2_FP4X2_B16,0.0669,5143.9403,0,separated,0.0,0.0,flydsl_fallback
256,32768,7168,2048,32,8,ActivationType.Silu,torch.bfloat16,torch.float4_e2m1fn_x2,torch.float4_e2m1fn_x2,QuantType.per_1x32,1,0,128,0,4180.4737000000005,moe_ck2stages_gemm1_256x128x128x128_1x4_MulABScaleShuffled_v3_Nswizzle0_Quant3_MulRoutedWeight0_silu_FP4X2_FP4X2_B16,0.0,6045.6099,moe_ck2stages_gemm2_256x128x128x128_1x4_MulABScaleExpertWeightShuffled_v3_Nswizzle0_Quant3_MulRoutedWeight1_FP4X2_FP4X2_B16,0.0669,10226.0836,0,separated,0.0,0.0,flydsl_fallback
256,1,7168,2048,32,8,ActivationType.Silu,torch.bfloat16,torch.float4_e2m1fn_x2,torch.float4_e2m1fn_x2,QuantType.per_1x32,1,0,16,0,772.3628,mxfp4_moe_g1_a4w4_NE32_H7168_E2048_BM16_INLINEQUANT,0.0%,1029.5585,mxfp4_moe_g2_a4w4_NE32_H7168_E2048_TOPK8_BM16_ATOMIC_NT,0.0%,1801.9213,0,interleave,0.39,782.11,
256,2,7168,2048,32,8,ActivationType.Silu,torch.bfloat16,torch.float4_e2m1fn_x2,torch.float4_e2m1fn_x2,QuantType.per_1x32,1,0,16,0,778.2662,mxfp4_moe_g1_a4w4_NE32_H7168_E2048_BM16_INLINEQUANT,0.0%,1038.7716,mxfp4_moe_g2_a4w4_NE32_H7168_E2048_TOPK8_BM16_ATOMIC,0.0%,1817.0378,0,interleave,0.78,775.62,
256,4,7168,2048,32,8,ActivationType.Silu,torch.bfloat16,torch.float4_e2m1fn_x2,torch.float4_e2m1fn_x2,QuantType.per_1x32,1,0,16,0,807.7999,mxfp4_moe_g1_a4w4_NE32_H7168_E2048_BM16_INLINEQUANT,0.0%,1082.5817,mxfp4_moe_g2_a4w4_NE32_H7168_E2048_TOPK8_BM16_ATOMIC_NT,0.0%,1890.3816,0,interleave,1.49,745.55,
256,8,7168,2048,32,8,ActivationType.Silu,torch.bfloat16,torch.float4_e2m1fn_x2,torch.float4_e2m1fn_x2,QuantType.per_1x32,1,0,16,0,820.2437000000001,mxfp4_moe_g1_a4w4_NE32_H7168_E2048_BM16_INLINEQUANT,0.0%,1101.2416,mxfp4_moe_g2_a4w4_NE32_H7168_E2048_TOPK8_BM16_ATOMIC_NT,0.0%,1921.4853,0,interleave,2.93,733.53,
256,16,7168,2048,32,8,ActivationType.Silu,torch.bfloat16,torch.float4_e2m1fn_x2,torch.float4_e2m1fn_x2,QuantType.per_1x32,1,0,16,0,831.1071,mxfp4_moe_g1_a4w4_NE32_H7168_E2048_BM16_INLINEQUANT,0.0%,1123.6247,mxfp4_moe_g2_a4w4_NE32_H7168_E2048_TOPK8_BM16_ATOMIC_NT,0.0%,1954.7318,0,interleave,5.77,721.14,
256,32,7168,2048,32,8,ActivationType.Silu,torch.bfloat16,torch.float4_e2m1fn_x2,torch.float4_e2m1fn_x2,QuantType.per_1x32,1,0,16,0,835.1191,mxfp4_moe_g1_a4w4_NE32_H7168_E2048_BM16_INLINEQUANT,0.0%,1127.2384,mxfp4_moe_g2_a4w4_NE32_H7168_E2048_TOPK8_BM16_ATOMIC_NT,0.0%,1962.3575,0,interleave,11.49,718.51,
256,64,7168,2048,32,8,ActivationType.Silu,torch.bfloat16,torch.float4_e2m1fn_x2,torch.float4_e2m1fn_x2,QuantType.per_1x32,1,0,16,0,858.3564,mxfp4_moe_g1_a4w4_NE32_H7168_E2048_BM16_INLINEQUANT,0.0%,1163.7399,mxfp4_moe_g2_a4w4_NE32_H7168_E2048_TOPK8_BM16_ATOMIC_NT,0.0%,2022.0963,0,interleave,22.3,697.62,
256,128,7168,2048,32,8,ActivationType.Silu,torch.bfloat16,torch.float4_e2m1fn_x2,torch.float4_e2m1fn_x2,QuantType.per_1x32,1,0,32,0,867.449,mxfp4_moe_g1_a4w4_NE32_H7168_E2048_BM32_CACHED,0.0%,1190.079,mxfp4_moe_g2_a4w4_NE32_H7168_E2048_TOPK8_BM32_ATOMIC,0.0%,2057.528,0,interleave,43.84,686.28,
256,256,7168,2048,32,8,ActivationType.Silu,torch.bfloat16,torch.float4_e2m1fn_x2,torch.float4_e2m1fn_x2,QuantType.per_1x32,1,0,128,0,874.6981,mxfp4_moe_g1_a4w4_NE32_H7168_E2048_BM128,0.0%,1204.7222,mxfp4_moe_g2_a4w4_NE32_H7168_E2048_BM128_NONATOMIC_MXFP4OUT,0.0%,2079.4203,0,interleave,86.75,680.38,
256,512,7168,2048,32,8,ActivationType.Silu,torch.bfloat16,torch.float4_e2m1fn_x2,torch.float4_e2m1fn_x2,QuantType.per_1x32,1,0,128,0,891.9647,mxfp4_moe_g1_a4w4_NE32_H7168_E2048_BM128,0.0%,1242.6929,mxfp4_moe_g2_a4w4_NE32_H7168_E2048_BM128_NONATOMIC_CSHUFFLE,0.0%,2134.6576,0,interleave,169.01,665.35,
256,1024,7168,2048,32,8,ActivationType.Silu,torch.bfloat16,torch.float4_e2m1fn_x2,torch.float4_e2m1fn_x2,QuantType.per_1x32,1,0,128,0,938.3952,mxfp4_moe_g1_a4w4_NE32_H7168_E2048_BM128,0.0%,1350.705,mxfp4_moe_g2_a4w4_NE32_H7168_E2048_BM128_NONATOMIC_CSHUFFLE,0.0%,2289.1002,0,interleave,315.21,625.27,
256,2048,7168,2048,32,8,ActivationType.Silu,torch.bfloat16,torch.float4_e2m1fn_x2,torch.float4_e2m1fn_x2,QuantType.per_1x32,1,0,128,0,1045.4507,mxfp4_moe_g1_a4w4_NE32_H7168_E2048_BM128,0.0%,1559.0597,mxfp4_moe_g2_a4w4_NE32_H7168_E2048_BM128_NONATOMIC_CSHUFFLE,0.0%,2604.5104,0,interleave,554.08,558.0,
256,4096,7168,2048,32,8,ActivationType.Silu,torch.bfloat16,torch.float4_e2m1fn_x2,torch.float4_e2m1fn_x2,QuantType.per_1x32,1,0,128,0,1308.1298,mxfp4_moe_g1_a4w4_NE32_H7168_E2048_BM128,0.0%,2055.1964,mxfp4_moe_g2_a4w4_NE32_H7168_E2048_BM128_NONATOMIC_CSHUFFLE,0.0%,3363.3262,0,interleave,858.14,445.2,
256,8192,7168,2048,32,8,ActivationType.Silu,torch.bfloat16,torch.float4_e2m1fn_x2,torch.float4_e2m1fn_x2,QuantType.per_1x32,1,0,128,0,1843.8893,mxfp4_moe_g1_a4w4_NE32_H7168_E2048_BM128,0.0%,3042.8191,mxfp4_moe_g2_a4w4_NE32_H7168_E2048_BM128_NONATOMIC_CSHUFFLE,0.0%,4886.7084,0,interleave,1181.25,324.44,
256,16384,7168,2048,32,8,ActivationType.Silu,torch.bfloat16,torch.float4_e2m1fn_x2,torch.float4_e2m1fn_x2,QuantType.per_1x32,1,0,128,0,3116.1183,mxfp4_moe_g1_a4w4_NE32_H7168_E2048_BM128,0.0%,4974.3084,mxfp4_moe_g2_a4w4_NE32_H7168_E2048_BM128_NONATOMIC_CSHUFFLE,0.0%,8090.4267,0,interleave,1426.98,217.74,
256,32768,7168,2048,32,8,ActivationType.Silu,torch.bfloat16,torch.float4_e2m1fn_x2,torch.float4_e2m1fn_x2,QuantType.per_1x32,1,0,128,0,5291.6335,mxfp4_moe_g1_a4w4_NE32_H7168_E2048_BM128,0.0%,9299.2489,mxfp4_moe_g2_a4w4_NE32_H7168_E2048_BM128_NONATOMIC_CSHUFFLE,0.0%,14590.8824,0,interleave,1582.48,144.88,
256,1,7168,512,257,9,ActivationType.Silu,torch.bfloat16,torch.float4_e2m1fn_x2,torch.float4_e2m1fn_x2,QuantType.per_1x32,1,0,16,0,1506.2401,mxfp4_moe_g1_a4w4_NE257_H7168_E512_BM16_INLINEQUANT,0.0%,1975.0677,mxfp4_moe_g2_a4w4_NE257_H7168_E512_TOPK9_BM16_ATOMIC_NT,0.0%,3481.3078,0,interleave,0.06,812.8,
256,2,7168,512,257,9,ActivationType.Silu,torch.bfloat16,torch.float4_e2m1fn_x2,torch.float4_e2m1fn_x2,QuantType.per_1x32,1,0,16,0,1513.1739,mxfp4_moe_g1_a4w4_NE257_H7168_E512_BM16_INLINEQUANT,0.0%,1986.5641,mxfp4_moe_g2_a4w4_NE257_H7168_E512_TOPK9_BM16_ATOMIC,0.0%,3499.738,0,interleave,0.11,808.52,
256,4,7168,512,257,9,ActivationType.Silu,torch.bfloat16,torch.float4_e2m1fn_x2,torch.float4_e2m1fn_x2,QuantType.per_1x32,1,0,16,0,1518.059,mxfp4_moe_g1_a4w4_NE257_H7168_E512_BM16_INLINEQUANT,0.0%,1999.2234,mxfp4_moe_g2_a4w4_NE257_H7168_E512_TOPK9_BM16_ATOMIC,0.0%,3517.2824,0,interleave,0.23,804.5,
256,8,7168,512,257,9,ActivationType.Silu,torch.bfloat16,torch.float4_e2m1fn_x2,torch.float4_e2m1fn_x2,QuantType.per_1x32,1,0,16,0,1523.3543,mxfp4_moe_g1_a4w4_NE257_H7168_E512_BM16_INLINEQUANT,0.0%,2020.4163,mxfp4_moe_g2_a4w4_NE257_H7168_E512_TOPK9_BM16_ATOMIC,0.0%,3543.7706,0,interleave,0.45,798.52,
256,16,7168,512,257,9,ActivationType.Silu,torch.bfloat16,torch.float4_e2m1fn_x2,torch.float4_e2m1fn_x2,QuantType.per_1x32,1,0,16,0,1565.5643,mxfp4_moe_g1_a4w4_NE257_H7168_E512_BM16_INLINEQUANT,0.0%,2068.9861,mxfp4_moe_g2_a4w4_NE257_H7168_E512_TOPK9_BM16_ATOMIC_NT,0.0%,3634.5504,0,interleave,0.87,778.62,
256,32,7168,512,257,9,ActivationType.Silu,torch.bfloat16,torch.float4_e2m1fn_x2,torch.float4_e2m1fn_x2,QuantType.per_1x32,1,0,16,0,1600.7962,mxfp4_moe_g1_a4w4_NE257_H7168_E512_BM16_INLINEQUANT,0.0%,2128.8684,mxfp4_moe_g2_a4w4_NE257_H7168_E512_TOPK9_BM16_ATOMIC_NT,0.0%,3729.6646,0,interleave,1.7,758.85,
256,64,7168,512,257,9,ActivationType.Silu,torch.bfloat16,torch.float4_e2m1fn_x2,torch.float4_e2m1fn_x2,QuantType.per_1x32,1,0,16,0,1631.6799999999998,mxfp4_moe_g1_a4w4_NE257_H7168_E512_BM16_INLINEQUANT,0.0%,2173.0141,mxfp4_moe_g2_a4w4_NE257_H7168_E512_TOPK9_BM16_ATOMIC_NT,0.0%,3804.6941,0,interleave,3.33,744.07,
256,128,7168,512,257,9,ActivationType.Silu,torch.bfloat16,torch.float4_e2m1fn_x2,torch.float4_e2m1fn_x2,QuantType.per_1x32,1,0,16,0,1645.5562,mxfp4_moe_g1_a4w4_NE257_H7168_E512_BM16_INLINEQUANT,0.0%,2202.9009,mxfp4_moe_g2_a4w4_NE257_H7168_E512_TOPK9_BM16_ATOMIC_NT,0.0%,3848.4571,0,interleave,6.59,735.97,
256,256,7168,512,257,9,ActivationType.Silu,torch.bfloat16,torch.float4_e2m1fn_x2,torch.float4_e2m1fn_x2,QuantType.per_1x32,1,0,16,0,1666.8672,mxfp4_moe_g1_a4w4_NE257_H7168_E512_BM16_INLINEQUANT,0.0%,2227.2057,mxfp4_moe_g2_a4w4_NE257_H7168_E512_TOPK9_BM16_ATOMIC_NT,0.0%,3894.0729,0,interleave,13.03,728.05,
256,512,7168,512,257,9,ActivationType.Silu,torch.bfloat16,torch.float4_e2m1fn_x2,torch.float4_e2m1fn_x2,QuantType.per_1x32,1,0,32,0,1682.3733000000002,mxfp4_moe_g1_a4w4_NE257_H7168_E512_BM32_NT,0.0%,2280.4131,mxfp4_moe_g2_a4w4_NE257_H7168_E512_TOPK9_BM32_ATOMIC,0.0%,3962.7864,0,interleave,25.61,716.82,
256,1024,7168,512,257,9,ActivationType.Silu,torch.bfloat16,torch.float4_e2m1fn_x2,torch.float4_e2m1fn_x2,QuantType.per_1x32,1,0,128,0,1731.2012,mxfp4_moe_g1_a4w4_NE257_H7168_E512_BM128,0.0%,2400.2466,mxfp4_moe_g2_a4w4_NE257_H7168_E512_BM128_NONATOMIC_MXFP4OUT,0.0%,4131.4478,0,interleave,49.12,690.22,
256,2048,7168,512,257,9,ActivationType.Silu,torch.bfloat16,torch.float4_e2m1fn_x2,torch.float4_e2m1fn_x2,QuantType.per_1x32,1,0,128,0,1733.0277,mxfp4_moe_g1_a4w4_NE257_H7168_E512_BM128,0.0%,2426.8595,mxfp4_moe_g2_a4w4_NE257_H7168_E512_BM128_NONATOMIC,0.0%,4159.8872,0,interleave,97.57,690.79,
256,4096,7168,512,257,9,ActivationType.Silu,torch.bfloat16,torch.float4_e2m1fn_x2,torch.float4_e2m1fn_x2,QuantType.per_1x32,1,0,128,0,1899.2497,mxfp4_moe_g1_a4w4_NE257_H7168_E512_BM128,0.0%,2723.7063,mxfp4_moe_g2_a4w4_NE257_H7168_E512_BM128_NONATOMIC,0.0%,4622.956,0,interleave,175.59,631.12,
256,8192,7168,512,257,9,ActivationType.Silu,torch.bfloat16,torch.float4_e2m1fn_x2,torch.float4_e2m1fn_x2,QuantType.per_1x32,1,0,128,0,2023.6999,mxfp4_moe_g1_a4w4_NE257_H7168_E512_BM128,0.0%,3102.8847,mxfp4_moe_g2_a4w4_NE257_H7168_E512_BM128_NONATOMIC_MXFP4OUT,0.0%,5126.5846,0,interleave,316.68,586.31,
256,16384,7168,512,257,9,ActivationType.Silu,torch.bfloat16,torch.float4_e2m1fn_x2,torch.float4_e2m1fn_x2,QuantType.per_1x32,1,0,128,0,2365.4418,mxfp4_moe_g1_a4w4_NE257_H7168_E512_BM128,0.0%,3993.3785,mxfp4_moe_g2_a4w4_NE257_H7168_E512_BM128_NONATOMIC,0.0%,6358.8203,0,interleave,510.63,500.39,
256,32768,7168,512,257,9,ActivationType.Silu,torch.bfloat16,torch.float4_e2m1fn_x2,torch.float4_e2m1fn_x2,QuantType.per_1x32,1,0,128,0,3166.3195,mxfp4_moe_g1_a4w4_NE257_H7168_E512_BM128,0.0%,5811.297,mxfp4_moe_g2_a4w4_NE257_H7168_E512_BM128_NONATOMIC,0.0%,8977.6165,0,interleave,723.35,393.67,
256,1,7168,256,257,9,ActivationType.Silu,torch.bfloat16,torch.float4_e2m1fn_x2,torch.float4_e2m1fn_x2,QuantType.per_1x32,1,0,16,0,773.626,mxfp4_moe_g1_a4w4_NE257_H7168_E256_BM16_INLINEQUANT,0.0%,1004.7651,mxfp4_moe_g2_a4w4_NE257_H7168_E256_TOPK9_BM16_ATOMIC,0.0%,1778.3911,0,interleave,0.06,795.56,
256,2,7168,256,257,9,ActivationType.Silu,torch.bfloat16,torch.float4_e2m1fn_x2,torch.float4_e2m1fn_x2,QuantType.per_1x32,1,0,16,0,774.8628000000001,mxfp4_moe_g1_a4w4_NE257_H7168_E256_BM16_INLINEQUANT,0.0%,1005.3748,mxfp4_moe_g2_a4w4_NE257_H7168_E256_TOPK9_BM16_ATOMIC,0.0%,1780.2376,0,interleave,0.11,794.74,
256,4,7168,256,257,9,ActivationType.Silu,torch.bfloat16,torch.float4_e2m1fn_x2,torch.float4_e2m1fn_x2,QuantType.per_1x32,1,0,16,0,772.4327999999999,mxfp4_moe_g1_a4w4_NE257_H7168_E256_BM16_INLINEQUANT,0.0%,1010.8047,mxfp4_moe_g2_a4w4_NE257_H7168_E256_TOPK9_BM16_ATOMIC,0.0%,1783.2375,0,interleave,0.22,793.43,
256,8,7168,256,257,9,ActivationType.Silu,torch.bfloat16,torch.float4_e2m1fn_x2,torch.float4_e2m1fn_x2,QuantType.per_1x32,1,0,16,0,778.6698,mxfp4_moe_g1_a4w4_NE257_H7168_E256_BM16_INLINEQUANT,0.0%,1018.2614,mxfp4_moe_g2_a4w4_NE257_H7168_E256_TOPK9_BM16_ATOMIC_NT,0.0%,1796.9312,0,interleave,0.44,787.43,
256,16,7168,256,257,9,ActivationType.Silu,torch.bfloat16,torch.float4_e2m1fn_x2,torch.float4_e2m1fn_x2,QuantType.per_1x32,1,0,16,0,790.4588,mxfp4_moe_g1_a4w4_NE257_H7168_E256_BM16_INLINEQUANT,0.0%,1037.1629,mxfp4_moe_g2_a4w4_NE257_H7168_E256_TOPK9_BM16_ATOMIC_NT,0.0%,1827.6217,0,interleave,0.87,774.3,
256,32,7168,256,257,9,ActivationType.Silu,torch.bfloat16,torch.float4_e2m1fn_x2,torch.float4_e2m1fn_x2,QuantType.per_1x32,1,0,16,0,815.7066,mxfp4_moe_g1_a4w4_NE257_H7168_E256_BM16_INLINEQUANT,0.0%,1074.3963,mxfp4_moe_g2_a4w4_NE257_H7168_E256_TOPK9_BM16_ATOMIC_NT,0.0%,1890.1029,0,interleave,1.68,748.89,
256,64,7168,256,257,9,ActivationType.Silu,torch.bfloat16,torch.float4_e2m1fn_x2,torch.float4_e2m1fn_x2,QuantType.per_1x32,1,0,16,0,831.9823,mxfp4_moe_g1_a4w4_NE257_H7168_E256_BM16_INLINEQUANT,0.0%,1101.1546,mxfp4_moe_g2_a4w4_NE257_H7168_E256_TOPK9_BM16_ATOMIC_NT,0.0%,1933.1369,0,interleave,3.28,732.57,
256,128,7168,256,257,9,ActivationType.Silu,torch.bfloat16,torch.float4_e2m1fn_x2,torch.float4_e2m1fn_x2,QuantType.per_1x32,1,0,16,0,838.5371,mxfp4_moe_g1_a4w4_NE257_H7168_E256_BM16_INLINEQUANT,0.0%,1117.2365,mxfp4_moe_g2_a4w4_NE257_H7168_E256_TOPK9_BM16_ATOMIC_NT,0.0%,1955.7736,0,interleave,6.49,724.8,
256,256,7168,256,257,9,ActivationType.Silu,torch.bfloat16,torch.float4_e2m1fn_x2,torch.float4_e2m1fn_x2,QuantType.per_1x32,1,0,16,0,849.4563,mxfp4_moe_g1_a4w4_NE257_H7168_E256_BM16_INLINEQUANT,0.0%,1136.0809,mxfp4_moe_g2_a4w4_NE257_H7168_E256_TOPK9_BM16_ATOMIC_NT,0.0%,1985.5372,0,interleave,12.78,715.32,
256,512,7168,256,257,9,ActivationType.Silu,torch.bfloat16,torch.float4_e2m1fn_x2,torch.float4_e2m1fn_x2,QuantType.per_1x32,1,0,32,0,866.8526,mxfp4_moe_g1_a4w4_NE257_H7168_E256_BM32_NT,0.0%,1190.3995,mxfp4_moe_g2_a4w4_NE257_H7168_E256_TOPK9_BM32_ATOMIC,0.0%,2057.2521,0,interleave,24.66,693.06,
256,1024,7168,256,257,9,ActivationType.Silu,torch.bfloat16,torch.float4_e2m1fn_x2,torch.float4_e2m1fn_x2,QuantType.per_1x32,1,0,32,0,913.052,mxfp4_moe_g1_a4w4_NE257_H7168_E256_BM32_CACHED,0.0%,1255.3689,mxfp4_moe_g2_a4w4_NE257_H7168_E256_TOPK9_BM32_ATOMIC,0.0%,2168.4209,0,interleave,46.79,662.61,
256,2048,7168,256,257,9,ActivationType.Silu,torch.bfloat16,torch.float4_e2m1fn_x2,torch.float4_e2m1fn_x2,QuantType.per_1x32,1,0,128,0,917.3067,mxfp4_moe_g1_a4w4_NE257_H7168_E256_BM128,0.0%,1316.7013,mxfp4_moe_g2_a4w4_NE257_H7168_E256_BM128_NONATOMIC,0.0%,2234.008,0,interleave,90.84,653.01,
256,4096,7168,256,257,9,ActivationType.Silu,torch.bfloat16,torch.float4_e2m1fn_x2,torch.float4_e2m1fn_x2,QuantType.per_1x32,1,0,128,0,991.6871,mxfp4_moe_g1_a4w4_NE257_H7168_E256_BM128,0.0%,1544.0729,mxfp4_moe_g2_a4w4_NE257_H7168_E256_BM128_NONATOMIC,0.0%,2535.76,0,interleave,160.06,592.67,
256,8192,7168,256,257,9,ActivationType.Silu,torch.bfloat16,torch.float4_e2m1fn_x2,torch.float4_e2m1fn_x2,QuantType.per_1x32,1,0,128,0,1131.0286999999998,mxfp4_moe_g1_a4w4_NE257_H7168_E256_BM128,0.0%,1917.1896,mxfp4_moe_g2_a4w4_NE257_H7168_E256_BM128_NONATOMIC_CSHUFFLE,0.0%,3048.2183,0,interleave,266.3,521.93,
256,16384,7168,256,257,9,ActivationType.Silu,torch.bfloat16,torch.float4_e2m1fn_x2,torch.float4_e2m1fn_x2,QuantType.per_1x32,1,0,128,0,1360.8712,mxfp4_moe_g1_a4w4_NE257_H7168_E256_BM128,0.0%,2552.5319,mxfp4_moe_g2_a4w4_NE257_H7168_E256_BM128_NONATOMIC,0.0%,3913.4031,0,interleave,414.86,451.55,
256,32768,7168,256,257,9,ActivationType.Silu,torch.bfloat16,torch.float4_e2m1fn_x2,torch.float4_e2m1fn_x2,QuantType.per_1x32,1,0,128,0,1714.9134,mxfp4_moe_g1_a4w4_NE257_H7168_E256_BM128,0.0%,3923.68,mxfp4_moe_g2_a4w4_NE257_H7168_E256_BM128_NONATOMIC,0.0%,5638.5934,0,interleave,575.85,375.88,
