aiter/configs/model_configs/dsv32_a8w8_blockscale_tuned_fmoe.csv
cu_num,token,model_dim,inter_dim,expert,topk,act_type,dtype,q_dtype_a,q_dtype_w,q_type,use_g1u1,doweight_stage1,block_m,ksplit,us1,kernelName1,err1,us2,kernelName2,err2,us,run_1stage,xbf16,tflops,bw,_tag
256,1,7168,512,256,8,ActivationType.Silu,torch.bfloat16,torch.float8_e4m3fn,torch.float8_e4m3fn,QuantType.per_1x128,1,0,16,0,58.0067,_ZN5aiter48fmoe_bf16_blockscaleBf16_g1u1_vs_pf2_silu_16x128E,0.0%,0.0,,0.0%,58.0067,1,1,3.04,48590.83,
256,2,7168,512,256,8,ActivationType.Silu,torch.bfloat16,torch.float8_e4m3fn,torch.float8_e4m3fn,QuantType.per_1x128,1,0,16,0,64.0544,_ZN5aiter48fmoe_bf16_blockscaleBf16_g1u1_vs_pf2_silu_16x128E,0.0%,0.0,,0.0%,64.0544,1,1,5.5,44003.46,
256,4,7168,512,256,8,ActivationType.Silu,torch.bfloat16,torch.float8_e4m3fn,torch.float8_e4m3fn,QuantType.per_1x128,1,0,16,0,74.8365,_ZN5aiter48fmoe_bf16_blockscaleBf16_g1u1_vs_pf2_silu_16x128E,0.0%,0.0,,0.0%,74.8365,1,1,9.42,37664.22,
256,8,7168,512,256,8,ActivationType.Silu,torch.bfloat16,torch.float8_e4m3fn,torch.float8_e4m3fn,QuantType.per_1x128,1,0,16,0,121.0326,_ZN5aiter48fmoe_bf16_blockscaleBf16_g1u1_vs_pf2_silu_16x128E,0.0%,0.0,,0.0%,121.0326,1,1,11.64,23289.13,
256,16,7168,512,256,8,ActivationType.Silu,torch.bfloat16,torch.float8_e4m3fn,torch.float8_e4m3fn,QuantType.per_1x128,1,0,16,0,200.8332,_ZN5aiter47fmoe_bf16_blockscaleFp8_g1u1_vs_pf2_silu_16x256E,0.0%,0.0,,0.0%,200.8332,1,0,14.03,14036.11,
256,32,7168,512,256,8,ActivationType.Silu,torch.bfloat16,torch.float8_e4m3fn,torch.float8_e4m3fn,QuantType.per_1x128,1,0,16,0,209.1327,moe_ck2stages_gemm1_256x16x128x256_1x4_MulABScaleExpertWeightA8W8blkscale_v1_Nswizzle0_Quant4_MulRoutedWeight0_silu_F8_F8_B16,0.1%,100.2464,moe_ck2stages_gemm2_256x16x128x256_1x4_MulABScaleExpertWeightA8W8blkscale_v1_Nswizzle0_Quant4_MulRoutedWeight1_F8_F8_B16,15.9%,309.3791,0,0,18.22,9112.64,
256,64,7168,512,256,8,ActivationType.Silu,torch.bfloat16,torch.float8_e4m3fn,torch.float8_e4m3fn,QuantType.per_1x128,1,0,16,0,421.876,_ZN5aiter48fmoe_bf16_blockscaleBf16_g1u1_vs_pf2_silu_16x256E,0.0%,0.0,,0.0%,421.876,1,1,26.72,6684.31,
256,128,7168,512,256,8,ActivationType.Silu,torch.bfloat16,torch.float8_e4m3fn,torch.float8_e4m3fn,QuantType.per_1x128,1,0,16,0,316.1631,moe_ck2stages_gemm1_256x16x128x256_1x4_MulABScaleExpertWeightA8W8blkscale_v1_Nswizzle0_Quant4_MulRoutedWeight0_silu_F8_F8_B16,0.1%,160.0199,moe_ck2stages_gemm2_256x16x128x256_1x4_MulABScaleExpertWeightA8W8blkscale_v1_Nswizzle0_Quant4_MulRoutedWeight1_F8_F8_B16,15.8%,476.183,0,0,47.35,5924.88,
256,256,7168,512,256,8,ActivationType.Silu,torch.bfloat16,torch.float8_e4m3fn,torch.float8_e4m3fn,QuantType.per_1x128,1,0,16,0,319.5221,moe_ck2stages_gemm1_256x16x128x256_1x4_MulABScaleExpertWeightA8W8blkscale_v1_Nswizzle0_Quant4_MulRoutedWeight0_silu_F8_F8_B16,0.1%,161.6135,moe_ck2stages_gemm2_256x16x128x256_1x4_MulABScaleExpertWeightA8W8blkscale_v1_Nswizzle0_Quant4_MulRoutedWeight1_F8_F8_B16,15.7%,481.1356,0,0,93.73,5869.61,
256,512,7168,512,256,8,ActivationType.Silu,torch.bfloat16,torch.float8_e4m3fn,torch.float8_e4m3fn,QuantType.per_1x128,1,0,32,0,329.49210000000005,moe_ck2stages_gemm1_256x32x128x128_1x4_MulABScaleExpertWeightA8W8blkscale_v1_Nswizzle0_Quant4_MulRoutedWeight0_silu_F8_F8_B16,0.1%,176.7197,moe_ck2stages_gemm2_256x32x128x128_1x4_MulABScaleExpertWeightA8W8blkscale_v1_Nswizzle0_Quant4_MulRoutedWeight1_F8_F8_B16,15.8%,506.2118,0,0,178.18,5589.72,
256,1024,7168,512,256,8,ActivationType.Silu,torch.bfloat16,torch.float8_e4m3fn,torch.float8_e4m3fn,QuantType.per_1x128,1,0,64,0,559.1311,_ZN5aiter46fmoe_bf16_blockscaleFp8_g1u1_vs_ps_silu_64x256E,0.0%,0.0,,0.0%,559.1311,1,0,322.62,5080.37,
256,2048,7168,512,256,8,ActivationType.Silu,torch.bfloat16,torch.float8_e4m3fn,torch.float8_e4m3fn,QuantType.per_1x128,1,0,64,0,758.2285999999999,_ZN5aiter46fmoe_bf16_blockscaleFp8_g1u1_vs_ps_silu_64x256E,0.0%,0.0,,0.0%,758.2286,1,0,475.82,3775.4,
256,4096,7168,512,256,8,ActivationType.Silu,torch.bfloat16,torch.float8_e4m3fn,torch.float8_e4m3fn,QuantType.per_1x128,1,0,64,0,1203.6373,_ZN5aiter46fmoe_bf16_blockscaleFp8_g1u1_vs_ps_silu_64x256E,0.0%,0.0,,0.0%,1203.6373,1,0,599.48,2414.89,
256,8192,7168,512,256,8,ActivationType.Silu,torch.bfloat16,torch.float8_e4m3fn,torch.float8_e4m3fn,QuantType.per_1x128,1,0,64,0,2103.0013000000004,_ZN5aiter46fmoe_bf16_blockscaleFp8_g1u1_vs_ps_silu_64x256E,0.0%,0.0,,0.0%,2103.0013,1,0,686.21,1424.03,
256,16384,7168,512,256,8,ActivationType.Silu,torch.bfloat16,torch.float8_e4m3fn,torch.float8_e4m3fn,QuantType.per_1x128,1,0,64,0,1782.0702,moe_ck2stages_gemm1_256x64x128x128_1x4_MulABScaleExpertWeightA8W8blkscale_v1_Nswizzle0_Quant4_MulRoutedWeight0_silu_F8_F8_B16,0.1%,2061.3943,moe_ck2stages_gemm2_256x64x128x128_1x4_MulABScaleExpertWeightA8W8blkscale_v3_Nswizzle0_Quant4_MulRoutedWeight1_F8_F8_B16,15.7%,3843.4645,0,0,750.94,825.01,
256,32768,7168,512,256,8,ActivationType.Silu,torch.bfloat16,torch.float8_e4m3fn,torch.float8_e4m3fn,QuantType.per_1x128,1,0,64,0,3298.7963,moe_ck2stages_gemm1_256x64x128x128_1x4_MulABScaleExpertWeightA8W8blkscale_v1_Nswizzle0_Quant4_MulRoutedWeight0_silu_F8_F8_B16,0.1%,4062.0521,moe_ck2stages_gemm2_256x64x128x128_1x4_MulABScaleExpertWeightA8W8blkscale_v3_Nswizzle0_Quant4_MulRoutedWeight1_F8_F8_B16,15.7%,7360.8484,0,0,784.21,478.64,
256,1,7168,256,256,8,ActivationType.Silu,torch.bfloat16,torch.float8_e4m3fn,torch.float8_e4m3fn,QuantType.per_1x128,1,0,16,0,45.7658,_ZN5aiter59fmoe_stage1_bf16_pertokenFp8_blockscale_g1u1_16x128_4tg_pf3E,49.4%,8.0526,moe_ck2stages_gemm2_128x16x128x128_1x2_MulABScaleExpertWeightA8W8blkscale_v1_Nswizzle0_Quant4_MulRoutedWeight1_F8_F8_B16,15.4%,53.8184,0,0,1.64,26186.35,
256,2,7168,256,256,8,ActivationType.Silu,torch.bfloat16,torch.float8_e4m3fn,torch.float8_e4m3fn,QuantType.per_1x128,1,0,16,0,60.0105,_ZN5aiter48fmoe_bf16_blockscaleBf16_g1u1_vs_pf2_silu_16x128E,0.0%,0.0,,0.0%,60.0105,1,1,2.94,23484.71,
256,4,7168,256,256,8,ActivationType.Silu,torch.bfloat16,torch.float8_e4m3fn,torch.float8_e4m3fn,QuantType.per_1x128,1,0,16,0,64.4387,_ZN5aiter48fmoe_bf16_blockscaleBf16_g1u1_vs_pf2_silu_16x128E,0.0%,0.0,,0.0%,64.4387,1,1,5.47,21871.52,
256,8,7168,256,256,8,ActivationType.Silu,torch.bfloat16,torch.float8_e4m3fn,torch.float8_e4m3fn,QuantType.per_1x128,1,0,16,0,75.8969,_ZN5aiter48fmoe_bf16_blockscaleBf16_g1u1_vs_pf2_silu_16x128E,0.0%,0.0,,0.0%,75.8969,1,1,9.28,18570.69,
256,16,7168,256,256,8,ActivationType.Silu,torch.bfloat16,torch.float8_e4m3fn,torch.float8_e4m3fn,QuantType.per_1x128,1,0,16,0,108.2153,_ZN5aiter48fmoe_bf16_blockscaleBf16_g1u1_vs_pf2_silu_16x128E,0.0%,0.0,,0.0%,108.2153,1,1,13.02,13026.16,
256,32,7168,256,256,8,ActivationType.Silu,torch.bfloat16,torch.float8_e4m3fn,torch.float8_e4m3fn,QuantType.per_1x128,1,0,32,0,162.925,_ZN5aiter50fmoe_bf16_blockscaleFp8_g1u1_vs_silu_1tg_ps_32x256E,0.0%,0.0,,0.0%,162.925,1,0,17.3,8654.13,
256,64,7168,256,256,8,ActivationType.Silu,torch.bfloat16,torch.float8_e4m3fn,torch.float8_e4m3fn,QuantType.per_1x128,1,0,16,0,216.9991,_ZN5aiter48fmoe_bf16_blockscaleBf16_g1u1_vs_pf2_silu_16x256E,0.0%,0.0,,0.0%,216.9991,1,1,25.98,6500.78,
256,128,7168,256,256,8,ActivationType.Silu,torch.bfloat16,torch.float8_e4m3fn,torch.float8_e4m3fn,QuantType.per_1x128,1,0,16,0,242.1198,_ZN5aiter48fmoe_bf16_blockscaleBf16_g1u1_vs_pf2_silu_16x256E,0.0%,0.0,,0.0%,242.1198,1,1,46.56,5831.98,
256,256,7168,256,256,8,ActivationType.Silu,torch.bfloat16,torch.float8_e4m3fn,torch.float8_e4m3fn,QuantType.per_1x128,1,0,16,0,252.8451,_ZN5aiter48fmoe_bf16_blockscaleBf16_g1u1_vs_pf2_silu_16x256E,0.0%,0.0,,0.0%,252.8451,1,1,89.18,5595.49,
256,512,7168,256,256,8,ActivationType.Silu,torch.bfloat16,torch.float8_e4m3fn,torch.float8_e4m3fn,QuantType.per_1x128,1,0,32,0,265.0243,_ZN5aiter47fmoe_bf16_blockscaleBf16_g1u1_vs_ps_silu_32x256E,0.0%,0.0,,0.0%,265.0243,1,1,170.16,5359.12,
256,1024,7168,256,256,8,ActivationType.Silu,torch.bfloat16,torch.float8_e4m3fn,torch.float8_e4m3fn,QuantType.per_1x128,1,0,64,0,289.109,_ZN5aiter46fmoe_bf16_blockscaleFp8_g1u1_vs_ps_silu_64x256E,0.0%,0.0,,0.0%,289.109,1,0,311.97,4950.75,
256,2048,7168,256,256,8,ActivationType.Silu,torch.bfloat16,torch.float8_e4m3fn,torch.float8_e4m3fn,QuantType.per_1x128,1,0,64,0,471.43,_ZN5aiter46fmoe_bf16_blockscaleFp8_g1u1_vs_ps_silu_64x256E,0.0%,0.0,,0.0%,471.43,1,0,382.64,3082.8,
256,4096,7168,256,256,8,ActivationType.Silu,torch.bfloat16,torch.float8_e4m3fn,torch.float8_e4m3fn,QuantType.per_1x128,1,0,64,0,683.4317,_ZN5aiter46fmoe_bf16_blockscaleFp8_g1u1_vs_ps_silu_64x256E,0.0%,0.0,,0.0%,683.4317,1,0,527.89,2190.95,
256,8192,7168,256,256,8,ActivationType.Silu,torch.bfloat16,torch.float8_e4m3fn,torch.float8_e4m3fn,QuantType.per_1x128,1,0,64,0,1130.4364,_ZN5aiter46fmoe_bf16_blockscaleFp8_g1u1_vs_ps_silu_64x256E,0.0%,0.0,,0.0%,1130.4364,1,0,638.3,1402.51,
256,16384,7168,256,256,8,ActivationType.Silu,torch.bfloat16,torch.float8_e4m3fn,torch.float8_e4m3fn,QuantType.per_1x128,1,0,64,0,2109.8168,_ZN5aiter46fmoe_bf16_blockscaleFp8_g1u1_vs_ps_silu_64x256E,0.0%,0.0,,0.0%,2109.8168,1,0,684.0,834.96,
256,32768,7168,256,256,8,ActivationType.Silu,torch.bfloat16,torch.float8_e4m3fn,torch.float8_e4m3fn,QuantType.per_1x128,1,0,64,0,4139.11,_ZN5aiter46fmoe_bf16_blockscaleFp8_g1u1_vs_ps_silu_64x256E,0.0%,0.0,,0.0%,4139.11,1,0,697.3,510.72,
