aiter/configs/model_configs/dsv32_a8w8_blockscale_bpreshuffle_tuned_gemm.csv
gfx,cu_num,M,N,K,libtype,kernelId,splitK,us,kernelName,tflops,bw,errRatio
gfx950,256,1,128,7168,ck,7,0,11.5526,a8w8_blockscale_bpreshuffle_1x128x128_256x16x64x256_16x16_16x16_16x16x1_16x16x1_1x16x1x16_4_1x1_intrawave_v1,0.16,80.06,0.0
gfx950,256,2,128,7168,ck,7,0,11.6671,a8w8_blockscale_bpreshuffle_1x128x128_256x16x64x256_16x16_16x16_16x16x1_16x16x1_1x16x1x16_4_1x1_intrawave_v1,0.31,79.91,0.0
gfx950,256,4,128,7168,ck,7,0,11.8191,a8w8_blockscale_bpreshuffle_1x128x128_256x16x64x256_16x16_16x16_16x16x1_16x16x1_1x16x1x16_4_1x1_intrawave_v1,0.62,80.14,0.0
gfx950,256,8,128,7168,ck,7,0,12.2859,a8w8_blockscale_bpreshuffle_1x128x128_256x16x64x256_16x16_16x16_16x16x1_16x16x1_1x16x1x16_4_1x1_intrawave_v1,1.19,79.51,0.0
gfx950,256,1,2112,7168,ck,7,0,21.2183,a8w8_blockscale_bpreshuffle_1x128x128_256x16x64x256_16x16_16x16_16x16x1_16x16x1_1x16x1x16_4_1x1_intrawave_v1,1.43,714.02,0.0
gfx950,256,2,2112,7168,ck,7,0,19.9281,a8w8_blockscale_bpreshuffle_1x128x128_256x16x64x256_16x16_16x16_16x16x1_16x16x1_1x16x1x16_4_1x1_intrawave_v1,3.04,760.82,0.0
gfx950,256,4,2112,7168,ck,7,0,20.0698,a8w8_blockscale_bpreshuffle_1x128x128_256x16x64x256_16x16_16x16_16x16x1_16x16x1_1x16x1x16_4_1x1_intrawave_v1,6.03,756.58,0.0
gfx950,256,8,2112,7168,ck,7,0,19.86,a8w8_blockscale_bpreshuffle_1x128x128_256x16x64x256_16x16_16x16_16x16x1_16x16x1_1x16x1x16_4_1x1_intrawave_v1,12.2,766.87,0.0
gfx950,256,1,3072,1536,ck,6,0,7.5053,a8w8_blockscale_bpreshuffle_1x128x128_256x16x128x256_16x16_16x16_16x16x1_16x16x1_1x16x1x16_8_1x2_intrawave_v1,1.26,629.72,0.0
gfx950,256,2,3072,1536,ck,7,0,6.7781,a8w8_blockscale_bpreshuffle_1x128x128_256x16x64x256_16x16_16x16_16x16x1_16x16x1_1x16x1x16_4_1x1_intrawave_v1,2.78,698.42,0.0
gfx950,256,4,3072,1536,ck,7,0,7.0778,a8w8_blockscale_bpreshuffle_1x128x128_256x16x64x256_16x16_16x16_16x16x1_16x16x1_1x16x1x16_4_1x1_intrawave_v1,5.33,671.02,0.0
gfx950,256,8,3072,1536,ck,7,0,6.6909,a8w8_blockscale_bpreshuffle_1x128x128_256x16x64x256_16x16_16x16_16x16x1_16x16x1_1x16x1x16_4_1x1_intrawave_v1,11.28,714.41,0.0
gfx950,256,1,4096,512,ck,7,0,3.5603,a8w8_blockscale_bpreshuffle_1x128x128_256x16x64x256_16x16_16x16_16x16x1_16x16x1_1x16x1x16_4_1x1_intrawave_v1,1.18,591.48,0.0
gfx950,256,2,4096,512,ck,12,0,3.4431,a8w8_blockscale_bpreshuffle_1x128x128_256x32x64x256_16x16_16x16_16x16x1_16x16x1_1x32x1x8_8_2x1_intrawave_v1,2.44,614.14,0.0
gfx950,256,4,4096,512,ck,12,0,3.5128,a8w8_blockscale_bpreshuffle_1x128x128_256x32x64x256_16x16_16x16_16x16x1_16x16x1_1x32x1x8_8_2x1_intrawave_v1,4.78,606.91,0.0
gfx950,256,8,4096,512,ck,6,0,3.439,a8w8_blockscale_bpreshuffle_1x128x128_256x16x128x256_16x16_16x16_16x16x1_16x16x1_1x16x1x16_8_1x2_intrawave_v1,9.76,630.06,0.0
gfx950,256,1,4608,7168,ck,7,0,20.561,a8w8_blockscale_bpreshuffle_1x128x128_256x16x64x256_16x16_16x16_16x16x1_16x16x1_1x16x1x16_4_1x1_intrawave_v1,3.21,1607.24,0.0
gfx950,256,2,4608,7168,ck,7,0,20.6343,a8w8_blockscale_bpreshuffle_1x128x128_256x16x64x256_16x16_16x16_16x16x1_16x16x1_1x16x1x16_4_1x1_intrawave_v1,6.4,1602.33,0.0
gfx950,256,4,4608,7168,ck,7,0,20.6281,a8w8_blockscale_bpreshuffle_1x128x128_256x16x64x256_16x16_16x16_16x16x1_16x16x1_1x16x1x16_4_1x1_intrawave_v1,12.81,1604.4,0.0
gfx950,256,8,4608,7168,ck,7,0,20.3401,a8w8_blockscale_bpreshuffle_1x128x128_256x16x64x256_16x16_16x16_16x16x1_16x16x1_1x16x1x16_4_1x1_intrawave_v1,25.98,1630.34,0.0
gfx950,256,1,6144,1536,ck,7,0,7.3658,a8w8_blockscale_bpreshuffle_1x128x128_256x16x64x256_16x16_16x16_16x16x1_16x16x1_1x16x1x16_4_1x1_intrawave_v1,2.56,1283.09,0.0
gfx950,256,2,6144,1536,ck,7,0,6.7418,a8w8_blockscale_bpreshuffle_1x128x128_256x16x64x256_16x16_16x16_16x16x1_16x16x1_1x16x1x16_4_1x1_intrawave_v1,5.6,1403.9,0.0
gfx950,256,4,6144,1536,ck,7,0,6.9891,a8w8_blockscale_bpreshuffle_1x128x128_256x16x64x256_16x16_16x16_16x16x1_16x16x1_1x16x1x16_4_1x1_intrawave_v1,10.8,1358.18,0.0
gfx950,256,8,6144,1536,ck,7,0,6.4496,a8w8_blockscale_bpreshuffle_1x128x128_256x16x64x256_16x16_16x16_16x16x1_16x16x1_1x16x1x16_4_1x1_intrawave_v1,23.41,1480.37,0.0
gfx950,256,16,6144,1536,ck,7,0,6.6023,a8w8_blockscale_bpreshuffle_1x128x128_256x16x64x256_16x16_16x16_16x16x1_16x16x1_1x16x1x16_4_1x1_intrawave_v1,45.74,1462.88,0.0
gfx950,256,32,6144,1536,ck,7,0,6.7856,a8w8_blockscale_bpreshuffle_1x128x128_256x16x64x256_16x16_16x16_16x16x1_16x16x1_1x16x1x16_4_1x1_intrawave_v1,89.01,1455.96,0.0
gfx950,256,48,6144,1536,ck,7,0,7.2812,a8w8_blockscale_bpreshuffle_1x128x128_256x16x64x256_16x16_16x16_16x16x1_16x16x1_1x16x1x16_4_1x1_intrawave_v1,124.43,1387.24,0.0
gfx950,256,64,6144,1536,ck,6,0,7.2474,a8w8_blockscale_bpreshuffle_1x128x128_256x16x128x256_16x16_16x16_16x16x1_16x16x1_1x16x1x16_8_1x2_intrawave_v1,166.67,1424.22,0.0
gfx950,256,80,6144,1536,ck,7,0,6.8642,a8w8_blockscale_bpreshuffle_1x128x128_256x16x64x256_16x16_16x16_16x16x1_16x16x1_1x16x1x16_4_1x1_intrawave_v1,219.97,1535.96,0.0
gfx950,256,96,6144,1536,ck,7,0,7.7462,a8w8_blockscale_bpreshuffle_1x128x128_256x16x64x256_16x16_16x16_16x16x1_16x16x1_1x16x1x16_4_1x1_intrawave_v1,233.91,1389.62,0.0
gfx950,256,112,6144,1536,ck,12,0,8.6493,a8w8_blockscale_bpreshuffle_1x128x128_256x32x64x256_16x16_16x16_16x16x1_16x16x1_1x32x1x8_8_2x1_intrawave_v1,244.4,1270.1,0.0
gfx950,256,128,6144,1536,ck,17,0,8.5232,a8w8_blockscale_bpreshuffle_1x128x128_256x64x64x256_16x16_16x16_16x16x1_16x16x1_1x32x1x8_8_2x1_intrawave_v1,283.45,1314.84,0.0
gfx950,256,256,6144,1536,ck,12,0,10.5924,a8w8_blockscale_bpreshuffle_1x128x128_256x32x64x256_16x16_16x16_16x16x1_16x16x1_1x32x1x8_8_2x1_intrawave_v1,456.16,1225.04,0.0
gfx950,256,512,6144,1536,ck,15,0,14.9792,a8w8_blockscale_bpreshuffle_1x128x128_256x64x64x128_16x16_16x16_8x32x1_8x32x1_1x32x1x8_8_2x1_intrawave_v1,645.14,1102.53,0.0018
gfx950,256,1024,6144,1536,ck,14,0,21.2948,a8w8_blockscale_bpreshuffle_1x128x128_256x64x128x128_16x16_16x16_8x32x1_8x32x1_1x32x1x8_8_2x1_intrawave_v1,907.61,1107.92,0.0002
gfx950,256,2048,6144,1536,ck,0,0,38.651,a8w8_blockscale_bpreshuffle_1x128x128_256x128x128x128_16x16_16x16_8x32x1_8x32x1_1x32x1x8_8_2x1_intrawave_v3,1000.1,976.66,0.0
gfx950,256,4096,6144,1536,ck,13,0,64.1753,a8w8_blockscale_bpreshuffle_1x128x128_256x64x256x128_16x16_16x16_8x32x1_8x32x1_1x32x1x8_8_2x1_intrawave_v1,1204.66,1029.37,0.0
gfx950,256,8192,6144,1536,ck,13,0,117.3711,a8w8_blockscale_bpreshuffle_1x128x128_256x64x256x128_16x16_16x16_8x32x1_8x32x1_1x32x1x8_8_2x1_intrawave_v1,1317.35,1045.26,0.0
gfx950,256,16384,6144,1536,ck,13,0,215.1413,a8w8_blockscale_bpreshuffle_1x128x128_256x64x256x128_16x16_16x16_8x32x1_8x32x1_1x32x1x8_8_2x1_intrawave_v1,1437.37,1096.63,0.0
gfx950,256,1,7168,2048,ck,7,0,7.232,a8w8_blockscale_bpreshuffle_1x128x128_256x16x64x256_16x16_16x16_16x16x1_16x16x1_1x16x1x16_4_1x1_intrawave_v1,4.06,2032.14,0.0
gfx950,256,1,7168,2304,ck,7,0,8.3055,a8w8_blockscale_bpreshuffle_1x128x128_256x16x64x256_16x16_16x16_16x16x1_16x16x1_1x16x1x16_4_1x1_intrawave_v1,3.98,1990.45,0.0
gfx950,256,1,7168,4096,ck,7,0,12.6818,a8w8_blockscale_bpreshuffle_1x128x128_256x16x64x256_16x16_16x16_16x16x1_16x16x1_1x16x1x16_4_1x1_intrawave_v1,4.63,2316.59,0.0
gfx950,256,1,7168,4608,ck,7,0,14.6736,a8w8_blockscale_bpreshuffle_1x128x128_256x16x64x256_16x16_16x16_16x16x1_16x16x1_1x16x1x16_4_1x1_intrawave_v1,4.5,2252.28,0.0
gfx950,256,2,7168,2048,ck,7,0,7.3544,a8w8_blockscale_bpreshuffle_1x128x128_256x16x64x256_16x16_16x16_16x16x1_16x16x1_1x16x1x16_4_1x1_intrawave_v1,7.98,2000.55,0.0
gfx950,256,2,7168,2304,ck,7,0,9.1415,a8w8_blockscale_bpreshuffle_1x128x128_256x16x64x256_16x16_16x16_16x16x1_16x16x1_1x16x1x16_4_1x1_intrawave_v1,7.23,1810.24,0.0
gfx950,256,2,7168,4096,ck,6,0,13.5319,a8w8_blockscale_bpreshuffle_1x128x128_256x16x128x256_16x16_16x16_16x16x1_16x16x1_1x16x1x16_8_1x2_intrawave_v1,8.68,2172.42,0.0
gfx950,256,2,7168,4608,ck,7,0,14.6652,a8w8_blockscale_bpreshuffle_1x128x128_256x16x64x256_16x16_16x16_16x16x1_16x16x1_1x16x1x16_4_1x1_intrawave_v1,9.01,2254.86,0.0
gfx950,256,4,7168,2048,ck,7,0,7.8125,a8w8_blockscale_bpreshuffle_1x128x128_256x16x64x256_16x16_16x16_16x16x1_16x16x1_1x16x1x16_4_1x1_intrawave_v1,15.03,1887.44,0.0
gfx950,256,4,7168,2304,ck,12,0,9.174,a8w8_blockscale_bpreshuffle_1x128x128_256x32x64x256_16x16_16x16_16x16x1_16x16x1_1x32x1x8_8_2x1_intrawave_v1,14.4,1807.46,0.0
gfx950,256,4,7168,4096,ck,7,0,12.7196,a8w8_blockscale_bpreshuffle_1x128x128_256x16x64x256_16x16_16x16_16x16x1_16x16x1_1x16x1x16_4_1x1_intrawave_v1,18.47,2314.06,0.0
gfx950,256,4,7168,4608,ck,6,0,15.2501,a8w8_blockscale_bpreshuffle_1x128x128_256x16x128x256_16x16_16x16_16x16x1_16x16x1_1x16x1x16_8_1x2_intrawave_v1,17.33,2170.87,0.0
gfx950,256,8,7168,2048,ck,7,0,7.041,a8w8_blockscale_bpreshuffle_1x128x128_256x16x64x256_16x16_16x16_16x16x1_16x16x1_1x16x1x16_4_1x1_intrawave_v1,33.36,2103.56,0.0
gfx950,256,8,7168,2304,ck,7,0,7.9089,a8w8_blockscale_bpreshuffle_1x128x128_256x16x64x256_16x16_16x16_16x16x1_16x16x1_1x16x1x16_4_1x1_intrawave_v1,33.41,2104.99,0.0
gfx950,256,8,7168,4096,ck,7,0,12.6879,a8w8_blockscale_bpreshuffle_1x128x128_256x16x64x256_16x16_16x16_16x16x1_16x16x1_1x16x1x16_4_1x1_intrawave_v1,37.02,2325.65,0.0
gfx950,256,8,7168,4608,ck,7,0,14.6067,a8w8_blockscale_bpreshuffle_1x128x128_256x16x64x256_16x16_16x16_16x16x1_16x16x1_1x16x1x16_4_1x1_intrawave_v1,36.18,2271.68,0.0
gfx950,256,16,7168,4096,ck,7,0,11.709,a8w8_blockscale_bpreshuffle_1x128x128_256x16x64x256_16x16_16x16_16x16x1_16x16x1_1x16x1x16_4_1x1_intrawave_v1,80.24,2532.67,0.0
gfx950,256,16,7168,4608,ck,7,0,13.3839,a8w8_blockscale_bpreshuffle_1x128x128_256x16x64x256_16x16_16x16_16x16x1_16x16x1_1x16x1x16_4_1x1_intrawave_v1,78.97,2490.55,0.0
gfx950,256,32,7168,4096,ck,7,0,11.8764,a8w8_blockscale_bpreshuffle_1x128x128_256x16x64x256_16x16_16x16_16x16x1_16x16x1_1x16x1x16_4_1x1_intrawave_v1,158.22,2521.8,0.0
gfx950,256,32,7168,4608,ck,7,0,13.5574,a8w8_blockscale_bpreshuffle_1x128x128_256x16x64x256_16x16_16x16_16x16x1_16x16x1_1x16x1x16_4_1x1_intrawave_v1,155.92,2481.03,0.0
gfx950,256,48,7168,4096,ck,7,0,13.2546,a8w8_blockscale_bpreshuffle_1x128x128_256x16x64x256_16x16_16x16_16x16x1_16x16x1_1x16x1x16_4_1x1_intrawave_v1,212.65,2281.84,0.0
gfx950,256,48,7168,4608,ck,6,0,15.0532,a8w8_blockscale_bpreshuffle_1x128x128_256x16x128x256_16x16_16x16_16x16x1_16x16x1_1x16x1x16_8_1x2_intrawave_v1,210.65,2254.63,0.0
gfx950,256,64,7168,4096,ck,12,0,12.8203,a8w8_blockscale_bpreshuffle_1x128x128_256x32x64x256_16x16_16x16_16x16x1_16x16x1_1x32x1x8_8_2x1_intrawave_v1,293.14,2382.14,0.0
gfx950,256,64,7168,4608,ck,12,0,14.3561,a8w8_blockscale_bpreshuffle_1x128x128_256x32x64x256_16x16_16x16_16x16x1_16x16x1_1x32x1x8_8_2x1_intrawave_v1,294.5,2385.23,0.0
gfx950,256,80,7168,4096,ck,12,0,15.9439,a8w8_blockscale_bpreshuffle_1x128x128_256x32x64x256_16x16_16x16_16x16x1_16x16x1_1x32x1x8_8_2x1_intrawave_v1,294.63,1933.95,0.0
gfx950,256,80,7168,4608,ck,12,0,18.2067,a8w8_blockscale_bpreshuffle_1x128x128_256x32x64x256_16x16_16x16_16x16x1_16x16x1_1x32x1x8_8_2x1_intrawave_v1,290.27,1897.41,0.0
gfx950,256,96,7168,4096,ck,11,0,15.4383,a8w8_blockscale_bpreshuffle_1x128x128_256x32x128x256_16x16_16x16_16x16x1_16x16x1_1x32x1x8_8_2x1_intrawave_v1,365.14,2016.39,0.0
gfx950,256,96,7168,4608,ck,11,0,17.1618,a8w8_blockscale_bpreshuffle_1x128x128_256x32x128x256_16x16_16x16_16x16x1_16x16x1_1x32x1x8_8_2x1_intrawave_v1,369.53,2030.6,0.0
gfx950,256,112,7168,4096,ck,12,0,16.2611,a8w8_blockscale_bpreshuffle_1x128x128_256x32x64x256_16x16_16x16_16x16x1_16x16x1_1x32x1x8_8_2x1_intrawave_v1,404.44,1932.5,0.0
gfx950,256,112,7168,4608,ck,12,0,18.1478,a8w8_blockscale_bpreshuffle_1x128x128_256x32x64x256_16x16_16x16_16x16x1_16x16x1_1x32x1x8_8_2x1_intrawave_v1,407.69,1936.98,0.0
gfx950,256,128,7168,4096,ck,17,0,14.8212,a8w8_blockscale_bpreshuffle_1x128x128_256x64x64x256_16x16_16x16_16x16x1_16x16x1_1x32x1x8_8_2x1_intrawave_v1,507.12,2140.14,0.0
gfx950,256,128,7168,4608,ck,17,0,16.5014,a8w8_blockscale_bpreshuffle_1x128x128_256x64x64x256_16x16_16x16_16x16x1_16x16x1_1x32x1x8_8_2x1_intrawave_v1,512.42,2148.6,0.0
gfx950,256,256,7168,4096,asm,2,1,19.4128,_ZN5aiter42fp8gemm_bf16_blockscale_BpreShuffle_64x128E,774.35,1755.48,0.0
gfx950,256,256,7168,4608,asm,2,1,21.7232,_ZN5aiter42fp8gemm_bf16_blockscale_BpreShuffle_64x128E,778.5,1743.75,0.0
gfx950,256,512,7168,4096,asm,5,1,29.0513,_ZN5aiter43fp8gemm_bf16_blockscale_BpreShuffle_128x128E,1034.89,1335.48,0.0
gfx950,256,512,7168,4608,asm,5,1,32.2878,_ZN5aiter43fp8gemm_bf16_blockscale_BpreShuffle_128x128E,1047.54,1323.39,0.0
gfx950,256,1024,7168,4096,ck,13,0,48.2915,a8w8_blockscale_bpreshuffle_1x128x128_256x64x256x128_16x16_16x16_8x32x1_8x32x1_1x32x1x8_8_2x1_intrawave_v1,1245.14,998.82,0.0
gfx950,256,1024,7168,4608,ck,13,0,52.1414,a8w8_blockscale_bpreshuffle_1x128x128_256x64x256x128_16x16_16x16_8x32x1_8x32x1_1x32x1x8_8_2x1_intrawave_v1,1297.35,1005.51,0.0
gfx950,256,2048,7168,4096,ck,13,0,87.6747,a8w8_blockscale_bpreshuffle_1x128x128_256x64x256x128_16x16_16x16_8x32x1_8x32x1_1x32x1x8_8_2x1_intrawave_v1,1371.65,765.43,0.0
gfx950,256,2048,7168,4608,ck,13,0,98.3045,a8w8_blockscale_bpreshuffle_1x128x128_256x64x256x128_16x16_16x16_8x32x1_8x32x1_1x32x1x8_8_2x1_intrawave_v1,1376.25,730.66,0.0
gfx950,256,4096,7168,4096,ck,13,0,147.2898,a8w8_blockscale_bpreshuffle_1x128x128_256x64x256x128_16x16_16x16_8x32x1_8x32x1_1x32x1x8_8_2x1_intrawave_v1,1632.96,711.91,0.0
gfx950,256,4096,7168,4608,ck,13,0,165.2206,a8w8_blockscale_bpreshuffle_1x128x128_256x64x256x128_16x16_16x16_8x32x1_8x32x1_1x32x1x8_8_2x1_intrawave_v1,1637.71,669.56,0.0
gfx950,256,8192,7168,4096,ck,13,0,272.9976,a8w8_blockscale_bpreshuffle_1x128x128_256x64x256x128_16x16_16x16_8x32x1_8x32x1_1x32x1x8_8_2x1_intrawave_v1,1762.05,660.65,0.0
gfx950,256,8192,7168,4608,cktile,29,0,300.0007,a8w8_blockscale_cktile_192x256x128_4x2x1_16x16x128_intrawave_0x1x0_4,1803.88,627.4,0.0
gfx950,256,16384,7168,4096,cktile,11,0,499.9727,a8w8_blockscale_cktile_192x256x128_4x2x1_16x16x128_intrawave_0x1x0_1,1924.25,662.74,0.0
gfx950,256,16384,7168,4608,cktile,27,0,542.1896,a8w8_blockscale_cktile_192x256x128_4x2x1_16x16x128_intrawave_0x1x0_2,1996.22,633.37,0.0
gfx950,256,1,8192,512,ck,7,0,4.2431,a8w8_blockscale_bpreshuffle_1x128x128_256x16x64x256_16x16_16x16_16x16x1_16x16x1_1x16x1x16_4_1x1_intrawave_v1,1.98,992.48,0.0
gfx950,256,1,8192,1536,ck,6,0,7.4209,a8w8_blockscale_bpreshuffle_1x128x128_256x16x128x256_16x16_16x16_16x16x1_16x16x1_1x16x1x16_8_1x2_intrawave_v1,3.39,1698.02,0.0
gfx950,256,2,8192,512,ck,12,0,4.132,a8w8_blockscale_bpreshuffle_1x128x128_256x32x64x256_16x16_16x16_16x16x1_16x16x1_1x32x1x8_8_2x1_intrawave_v1,4.06,1023.26,0.0
gfx950,256,2,8192,1536,ck,6,0,7.1802,a8w8_blockscale_bpreshuffle_1x128x128_256x16x128x256_16x16_16x16_16x16x1_16x16x1_1x16x1x16_8_1x2_intrawave_v1,7.01,1757.44,0.0
gfx950,256,4,8192,512,ck,7,0,3.7336,a8w8_blockscale_bpreshuffle_1x128x128_256x16x64x256_16x16_16x16_16x16x1_16x16x1_1x16x1x16_4_1x1_intrawave_v1,8.99,1141.5,0.0
gfx950,256,4,8192,1536,ck,7,0,6.7681,a8w8_blockscale_bpreshuffle_1x128x128_256x16x64x256_16x16_16x16_16x16x1_16x16x1_1x16x1x16_4_1x1_intrawave_v1,14.87,1869.74,0.0
gfx950,256,8,8192,512,ck,7,0,3.717,a8w8_blockscale_bpreshuffle_1x128x128_256x16x64x256_16x16_16x16_16x16x1_16x16x1_1x16x1x16_4_1x1_intrawave_v1,18.05,1164.78,0.0
gfx950,256,8,8192,1536,ck,7,0,6.7681,a8w8_blockscale_bpreshuffle_1x128x128_256x16x64x256_16x16_16x16_16x16x1_16x16x1_1x16x1x16_4_1x1_intrawave_v1,29.75,1880.33,0.0
gfx950,256,16,8192,512,ck,12,0,4.1864,a8w8_blockscale_bpreshuffle_1x128x128_256x32x64x256_16x16_16x16_16x16x1_16x16x1_1x32x1x8_8_2x1_intrawave_v1,32.06,1066.46,0.0
gfx950,256,32,8192,512,ck,7,0,3.9616,a8w8_blockscale_bpreshuffle_1x128x128_256x16x64x256_16x16_16x16_16x16x1_16x16x1_1x16x1x16_4_1x1_intrawave_v1,67.76,1195.22,0.0
gfx950,256,48,8192,512,ck,7,0,4.3544,a8w8_blockscale_bpreshuffle_1x128x128_256x16x64x256_16x16_16x16_16x16x1_16x16x1_1x16x1x16_4_1x1_intrawave_v1,92.47,1149.48,0.0
gfx950,256,64,8192,512,ck,6,0,4.3919,a8w8_blockscale_bpreshuffle_1x128x128_256x16x128x256_16x16_16x16_16x16x1_16x16x1_1x16x1x16_8_1x2_intrawave_v1,122.24,1201.22,0.0
gfx950,256,80,8192,512,ck,7,0,4.9859,a8w8_blockscale_bpreshuffle_1x128x128_256x16x64x256_16x16_16x16_16x16x1_16x16x1_1x16x1x16_4_1x1_intrawave_v1,134.6,1112.33,0.0
gfx950,256,96,8192,512,ck,7,0,5.0231,a8w8_blockscale_bpreshuffle_1x128x128_256x16x64x256_16x16_16x16_16x16x1_16x16x1_1x16x1x16_4_1x1_intrawave_v1,160.32,1157.91,0.0
gfx950,256,112,8192,512,ck,11,0,5.2207,a8w8_blockscale_bpreshuffle_1x128x128_256x32x128x256_16x16_16x16_16x16x1_16x16x1_1x32x1x8_8_2x1_intrawave_v1,179.96,1165.87,0.0
gfx950,256,128,8192,512,ck,12,0,5.3671,a8w8_blockscale_bpreshuffle_1x128x128_256x32x64x256_16x16_16x16_16x16x1_16x16x1_1x32x1x8_8_2x1_intrawave_v1,200.06,1184.44,0.0
gfx950,256,256,8192,512,ck,10,0,6.9582,a8w8_blockscale_bpreshuffle_1x128x128_256x32x64x128_16x16_16x16_8x32x1_8x32x1_1x32x1x8_8_2x1_intrawave_v1,308.63,1224.41,0.0226
gfx950,256,512,8192,512,ck,9,0,10.1409,a8w8_blockscale_bpreshuffle_1x128x128_256x32x128x128_16x16_16x16_8x32x1_8x32x1_1x32x1x8_8_2x1_intrawave_v1,423.53,1266.66,0.0
gfx950,256,1024,8192,512,ck,16,0,15.9057,a8w8_blockscale_bpreshuffle_1x128x128_256x64x128x256_16x16_16x16_16x16x1_16x16x1_1x32x1x8_8_2x1_intrawave_v1,540.05,1351.45,0.0
gfx950,256,2048,8192,512,ck,16,0,27.4924,a8w8_blockscale_bpreshuffle_1x128x128_256x64x128x256_16x16_16x16_16x16x1_16x16x1_1x32x1x8_8_2x1_intrawave_v1,624.9,1411.2,0.0
gfx950,256,4096,8192,512,ck,16,0,48.4496,a8w8_blockscale_bpreshuffle_1x128x128_256x64x128x256_16x16_16x16_16x16x1_16x16x1_1x32x1x8_8_2x1_intrawave_v1,709.19,1514.98,0.0
gfx950,256,8192,8192,512,ck,16,0,85.9627,a8w8_blockscale_bpreshuffle_1x128x128_256x64x128x256_16x16_16x16_16x16x1_16x16x1_1x32x1x8_8_2x1_intrawave_v1,799.41,1658.93,0.0
gfx950,256,16384,8192,512,ck,16,0,157.8175,a8w8_blockscale_bpreshuffle_1x128x128_256x64x128x256_16x16_16x16_16x16x1_16x16x1_1x32x1x8_8_2x1_intrawave_v1,870.87,1780.65,0.0
gfx950,256,1,9216,7168,ck,7,0,21.761,a8w8_blockscale_bpreshuffle_1x128x128_256x16x64x256_16x16_16x16_16x16x1_16x16x1_1x16x1x16_4_1x1_intrawave_v1,6.07,3036.9,0.0
gfx950,256,2,9216,7168,ck,7,0,21.7596,a8w8_blockscale_bpreshuffle_1x128x128_256x16x64x256_16x16_16x16_16x16x1_16x16x1_1x16x1x16_4_1x1_intrawave_v1,12.14,3038.27,0.0
gfx950,256,4,9216,7168,ck,7,0,21.8233,a8w8_blockscale_bpreshuffle_1x128x128_256x16x64x256_16x16_16x16_16x16x1_16x16x1_1x16x1x16_4_1x1_intrawave_v1,24.22,3031.75,0.0
gfx950,256,8,9216,7168,ck,7,0,21.7859,a8w8_blockscale_bpreshuffle_1x128x128_256x16x64x256_16x16_16x16_16x16x1_16x16x1_1x16x1x16_4_1x1_intrawave_v1,48.52,3041.65,0.0
gfx950,256,16,9216,7168,ck,7,0,19.5635,a8w8_blockscale_bpreshuffle_1x128x128_256x16x64x256_16x16_16x16_16x16x1_16x16x1_1x16x1x16_4_1x1_intrawave_v1,108.05,3397.65,0.0
gfx950,256,32,9216,7168,ck,12,0,20.8031,a8w8_blockscale_bpreshuffle_1x128x128_256x32x64x256_16x16_16x16_16x16x1_16x16x1_1x32x1x8_8_2x1_intrawave_v1,203.23,3214.88,0.0
gfx950,256,48,9216,7168,ck,6,0,22.4289,a8w8_blockscale_bpreshuffle_1x128x128_256x16x128x256_16x16_16x16_16x16x1_16x16x1_1x16x1x16_8_1x2_intrawave_v1,282.75,3000.11,0.0
gfx950,256,64,9216,7168,ck,17,0,23.6215,a8w8_blockscale_bpreshuffle_1x128x128_256x64x64x256_16x16_16x16_16x16x1_16x16x1_1x32x1x8_8_2x1_intrawave_v1,357.97,2865.98,0.0
gfx950,256,80,9216,7168,ck,12,0,27.1624,a8w8_blockscale_bpreshuffle_1x128x128_256x32x64x256_16x16_16x16_16x16x1_16x16x1_1x32x1x8_8_2x1_intrawave_v1,389.13,2507.45,0.0
gfx950,256,96,9216,7168,ck,11,0,25.1369,a8w8_blockscale_bpreshuffle_1x128x128_256x32x128x256_16x16_16x16_16x16x1_16x16x1_1x32x1x8_8_2x1_intrawave_v1,504.58,2725.79,0.0
gfx950,256,112,9216,7168,asm,1,1,29.3099,_ZN5aiter42fp8gemm_bf16_blockscale_BpreShuffle_48x128E,504.86,2351.68,0.0
gfx950,256,128,9216,7168,asm,1,1,29.1985,_ZN5aiter42fp8gemm_bf16_blockscale_BpreShuffle_48x128E,579.19,2374.68,0.0
gfx950,256,256,9216,7168,asm,4,1,37.2241,_ZN5aiter42fp8gemm_bf16_blockscale_BpreShuffle_96x128E,908.63,1950.72,0.0
gfx950,256,512,9216,7168,asm,3,1,66.7137,_ZN5aiter42fp8gemm_bf16_blockscale_BpreShuffle_80x128E,1013.97,1186.68,0.0
gfx950,256,1024,9216,7168,cktile,11,0,88.528,a8w8_blockscale_cktile_192x256x128_4x2x1_16x16x128_intrawave_0x1x0_1,1528.23,1042.32,0.0
gfx950,256,2048,9216,7168,cktile,27,0,169.4351,a8w8_blockscale_cktile_192x256x128_4x2x1_16x16x128_intrawave_0x1x0_2,1596.97,699.32,0.0
gfx950,256,4096,9216,7168,cktile,11,0,280.1304,a8w8_blockscale_cktile_192x256x128_4x2x1_16x16x128_intrawave_0x1x0_1,1931.84,610.14,0.0
gfx950,256,8192,9216,7168,cktile,28,0,513.7161,a8w8_blockscale_cktile_192x256x128_4x2x1_16x16x128_intrawave_0x1x0_3,2106.87,536.82,0.0
gfx950,256,16384,9216,7168,cktile,11,0,995.265,a8w8_blockscale_cktile_192x256x128_4x2x1_16x16x128_intrawave_0x1x0_1,2174.96,487.8,0.0
