aiter/configs/model_configs/dsv3_fp4_tuned_fmoe.csv
cu_num,token,model_dim,inter_dim,expert,topk,act_type,dtype,q_dtype_a,q_dtype_w,q_type,use_g1u1,doweight_stage1,block_m,ksplit,us1,kernelName1,err1,us2,kernelName2,err2,us,run_1stage,tflops,bw,_tag
256,1,7168,256,257,9,ActivationType.Silu,torch.bfloat16,torch.float4_e2m1fn_x2,torch.float4_e2m1fn_x2,QuantType.per_1x32,1,0,32,0,22.4753,moe_ck2stages_gemm1_64x32x32x128_1x1_MulABScaleShuffled_v3_Nswizzle0_Quant3_MulRoutedWeight0_silu_FP4X2_FP4X2_B16,0.0%,8.2001,moe_ck2stages_gemm2_64x32x32x128_1x1_MulABScaleExpertWeightShuffled_v1_Nswizzle0_Quant3_MulRoutedWeight1_FP4X2_FP4X2_B16,1.6%,30.6754,0,3.23,46122.06,
256,2,7168,256,257,9,ActivationType.Silu,torch.bfloat16,torch.float4_e2m1fn_x2,torch.float4_e2m1fn_x2,QuantType.per_1x32,1,0,32,0,23.3681,moe_ck2stages_gemm1_64x32x32x128_1x1_MulABScaleShuffled_v3_Nswizzle0_Quant3_MulRoutedWeight0_silu_FP4X2_FP4X2_B16,0.0%,10.4842,moe_ck2stages_gemm2_64x32x32x128_1x1_MulABScaleExpertWeightShuffled_v1_Nswizzle0_Quant3_MulRoutedWeight1_FP4X2_FP4X2_B16,1.3%,33.8523,0,5.85,41794.33,
256,4,7168,256,257,9,ActivationType.Silu,torch.bfloat16,torch.float4_e2m1fn_x2,torch.float4_e2m1fn_x2,QuantType.per_1x32,1,0,32,0,26.1686,moe_ck2stages_gemm1_64x32x32x128_1x1_MulABScaleShuffled_v3_Nswizzle0_Quant3_MulRoutedWeight0_silu_FP4X2_FP4X2_B16,0.0%,13.9467,flydsl_moe2_afp4_wfp4_bf16_t32x128x256_atomic,1.3%,40.1153,0,9.88,35270.26,
256,8,7168,256,257,9,ActivationType.Silu,torch.bfloat16,torch.float4_e2m1fn_x2,torch.float4_e2m1fn_x2,QuantType.per_1x32,1,0,32,0,30.2135,moe_ck2stages_gemm1_64x32x32x128_1x1_MulABScaleShuffled_v3_Nswizzle0_Quant3_MulRoutedWeight0_silu_FP4X2_FP4X2_B16,0.0%,18.8782,flydsl_moe2_afp4_wfp4_bf16_t32x256x256_atomic,1.3%,49.0917,0,16.15,28822.86,
256,16,7168,256,257,9,ActivationType.Silu,torch.bfloat16,torch.float4_e2m1fn_x2,torch.float4_e2m1fn_x2,QuantType.per_1x32,1,0,32,0,39.5109,flydsl_moe1_afp4_wfp4_bf16_t32x128x256,0.0%,26.5057,flydsl_moe2_afp4_wfp4_bf16_t32x256x256_atomic,1.3%,66.0166,0,24.02,21436.05,
256,32,7168,256,257,9,ActivationType.Silu,torch.bfloat16,torch.float4_e2m1fn_x2,torch.float4_e2m1fn_x2,QuantType.per_1x32,1,0,32,0,63.9918,flydsl_moe1_afp4_wfp4_bf16_t32x256x256,0.0%,37.0303,moe_ck2stages_gemm2_64x32x32x128_1x1_MulABScaleExpertWeightShuffled_v1_Nswizzle0_Quant3_MulRoutedWeight1_FP4X2_FP4X2_B16,1.4%,101.0221,0,31.39,14011.58,
256,64,7168,256,257,9,ActivationType.Silu,torch.bfloat16,torch.float4_e2m1fn_x2,torch.float4_e2m1fn_x2,QuantType.per_1x32,1,0,32,0,76.7686,flydsl_moe1_afp4_wfp4_bf16_t32x128x256,0.0%,46.7703,moe_ck2stages_gemm2_64x32x32x128_1x1_MulABScaleExpertWeightShuffled_v1_Nswizzle0_Quant3_MulRoutedWeight1_FP4X2_FP4X2_B16,1.3%,123.5389,0,51.33,11463.33,
256,128,7168,256,257,9,ActivationType.Silu,torch.bfloat16,torch.float4_e2m1fn_x2,torch.float4_e2m1fn_x2,QuantType.per_1x32,1,0,32,0,86.9909,flydsl_moe1_afp4_wfp4_bf16_t32x128x256,0.0%,52.5641,flydsl_moe2_afp4_wfp4_bf16_t16x256x256_atomic_sbm32,1.4%,139.555,0,90.89,10157.6,
256,256,7168,256,257,9,ActivationType.Silu,torch.bfloat16,torch.float4_e2m1fn_x2,torch.float4_e2m1fn_x2,QuantType.per_1x32,1,0,32,0,99.6115,moe_ck2stages_gemm1_64x32x32x128_1x1_MulABScaleShuffled_v3_Nswizzle0_Quant3_MulRoutedWeight0_silu_FP4X2_FP4X2_B16,0.0%,57.436,flydsl_moe2_afp4_wfp4_bf16_t16x256x256_atomic_sbm32,1.4%,157.0475,0,161.53,9043.74,
256,512,7168,256,257,9,ActivationType.Silu,torch.bfloat16,torch.float4_e2m1fn_x2,torch.float4_e2m1fn_x2,QuantType.per_1x32,1,0,32,0,100.7381,moe_ck2stages_gemm1_64x32x32x128_1x1_MulABScaleShuffled_v3_Nswizzle0_Quant3_MulRoutedWeight0_silu_FP4X2_FP4X2_B16,0.0%,73.7173,flydsl_moe2_afp4_wfp4_bf16_t32x128x256_atomic,1.3%,174.4554,0,290.82,8172.87,
256,1024,7168,256,257,9,ActivationType.Silu,torch.bfloat16,torch.float4_e2m1fn_x2,torch.float4_e2m1fn_x2,QuantType.per_1x32,1,0,64,0,109.8157,flydsl_moe1_afp4_wfp4_bf16_t64x128x256,0.0%,111.2059,flydsl_moe2_afp4_wfp4_bf16_t32x256x256_reduce_sbm64,0.1%,221.0216,0,459.09,6500.77,
256,2048,7168,256,257,9,ActivationType.Silu,torch.bfloat16,torch.float4_e2m1fn_x2,torch.float4_e2m1fn_x2,QuantType.per_1x32,1,0,128,0,126.6034,moe_ck2stages_gemm1_256x128x128x128_1x4_MulABScaleShuffled_v3_Nswizzle0_Quant3_MulRoutedWeight0_silu_FP4X2_FP4X2_B16,0.0%,170.0373,flydsl_moe2_afp4_wfp4_bf16_t64x256x256_reduce_sbm128,0.1%,296.6407,0,684.12,4917.84,
256,4096,7168,256,257,9,ActivationType.Silu,torch.bfloat16,torch.float4_e2m1fn_x2,torch.float4_e2m1fn_x2,QuantType.per_1x32,1,0,128,0,176.0158,moe_ck2stages_gemm1_256x128x128x128_1x4_MulABScaleShuffled_v3_Nswizzle0_Quant3_MulRoutedWeight0_silu_FP4X2_FP4X2_B16,0.0%,289.0905,flydsl_moe2_afp4_wfp4_bf16_t64x256x256_reduce_sbm128,0.1%,465.1063,0,872.65,3231.24,
256,8192,7168,256,257,9,ActivationType.Silu,torch.bfloat16,torch.float4_e2m1fn_x2,torch.float4_e2m1fn_x2,QuantType.per_1x32,1,0,128,0,279.4534,moe_ck2stages_gemm1_256x128x128x128_1x4_MulABScaleShuffled_v3_Nswizzle0_Quant3_MulRoutedWeight0_silu_FP4X2_FP4X2_B16,0.0%,538.2527,flydsl_moe2_afp4_wfp4_bf16_t64x256x256_reduce_sbm128,0.1%,817.7061,0,992.71,1945.63,
256,16384,7168,256,257,9,ActivationType.Silu,torch.bfloat16,torch.float4_e2m1fn_x2,torch.float4_e2m1fn_x2,QuantType.per_1x32,1,0,128,0,431.0277,moe_ck2stages_gemm1_256x128x128x128_1x4_MulABScaleShuffled_v3_Nswizzle0_Quant3_MulRoutedWeight0_silu_FP4X2_FP4X2_B16,0.0%,1035.593,flydsl_moe2_afp4_wfp4_bf16_t64x256x256_reduce_sbm128,0.1%,1466.6207,0,1106.96,1204.89,
256,32768,7168,256,257,9,ActivationType.Silu,torch.bfloat16,torch.float4_e2m1fn_x2,torch.float4_e2m1fn_x2,QuantType.per_1x32,1,0,128,0,618.8646,moe_ck2stages_gemm1_256x128x128x128_1x4_MulABScaleShuffled_v3_Nswizzle0_Quant3_MulRoutedWeight0_silu_FP4X2_FP4X2_B16,0.0%,1948.1965,flydsl_moe2_afp4_wfp4_bf16_t64x256x256_reduce_sbm128,0.1%,2567.0611,0,1264.87,825.63,
256,1,7168,256,384,8,ActivationType.Silu,torch.bfloat16,torch.float4_e2m1fn_x2,torch.float4_e2m1fn_x2,QuantType.per_1x32,1,0,32,0,22.3295,moe_ck2stages_gemm1_64x32x32x128_1x1_MulABScaleShuffled_v3_Nswizzle0_Quant3_MulRoutedWeight0_silu_FP4X2_FP4X2_B16,0.0%,7.8748,moe_ck2stages_gemm2_64x32x32x128_1x1_MulABScaleExpertWeightShuffled_v1_Nswizzle0_Quant3_MulRoutedWeight1_FP4X2_FP4X2_B16,1.5%,30.2043,0,2.92,69988.4,
256,2,7168,256,384,8,ActivationType.Silu,torch.bfloat16,torch.float4_e2m1fn_x2,torch.float4_e2m1fn_x2,QuantType.per_1x32,1,0,32,0,23.0887,moe_ck2stages_gemm1_64x32x32x128_1x1_MulABScaleShuffled_v3_Nswizzle0_Quant3_MulRoutedWeight0_silu_FP4X2_FP4X2_B16,0.0%,9.1027,moe_ck2stages_gemm2_64x32x32x128_1x1_MulABScaleExpertWeightShuffled_v1_Nswizzle0_Quant3_MulRoutedWeight1_FP4X2_FP4X2_B16,1.4%,32.1914,0,5.47,65668.85,
256,4,7168,256,384,8,ActivationType.Silu,torch.bfloat16,torch.float4_e2m1fn_x2,torch.float4_e2m1fn_x2,QuantType.per_1x32,1,0,32,0,24.168,moe_ck2stages_gemm1_64x32x32x128_1x1_MulABScaleShuffled_v3_Nswizzle0_Quant3_MulRoutedWeight0_silu_FP4X2_FP4X2_B16,0.0%,13.195,flydsl_moe2_afp4_wfp4_bf16_t32x128x256_atomic,1.2%,37.363,0,9.43,56580.45,
256,8,7168,256,384,8,ActivationType.Silu,torch.bfloat16,torch.float4_e2m1fn_x2,torch.float4_e2m1fn_x2,QuantType.per_1x32,1,0,32,0,29.4853,moe_ck2stages_gemm1_64x32x32x128_1x1_MulABScaleShuffled_v3_Nswizzle0_Quant3_MulRoutedWeight0_silu_FP4X2_FP4X2_B16,0.0%,18.393,flydsl_moe2_afp4_wfp4_bf16_t32x256x256_atomic,1.3%,47.8783,0,14.72,44155.73,
256,16,7168,256,384,8,ActivationType.Silu,torch.bfloat16,torch.float4_e2m1fn_x2,torch.float4_e2m1fn_x2,QuantType.per_1x32,1,0,32,0,39.2684,flydsl_moe1_afp4_wfp4_bf16_t32x128x256,0.0%,25.996,flydsl_moe2_afp4_wfp4_bf16_t32x256x256_atomic,1.2%,65.2644,0,21.59,32395.51,
256,32,7168,256,384,8,ActivationType.Silu,torch.bfloat16,torch.float4_e2m1fn_x2,torch.float4_e2m1fn_x2,QuantType.per_1x32,1,0,32,0,67.7349,flydsl_moe1_afp4_wfp4_bf16_t32x256x256,0.0%,39.294,flydsl_moe2_afp4_wfp4_bf16_t32x256x256_atomic,1.3%,107.0289,0,26.33,19757.44,
256,64,7168,256,384,8,ActivationType.Silu,torch.bfloat16,torch.float4_e2m1fn_x2,torch.float4_e2m1fn_x2,QuantType.per_1x32,1,0,32,0,104.165,moe_ck2stages_gemm1_64x32x32x128_1x1_MulABScaleShuffled_v3_Nswizzle0_Quant3_MulRoutedWeight0_silu_FP4X2_FP4X2_B16,0.0%,56.9776,flydsl_moe2_afp4_wfp4_bf16_t16x256x256_atomic_sbm32,1.2%,161.1426,0,34.98,13126.92,
256,128,7168,256,384,8,ActivationType.Silu,torch.bfloat16,torch.float4_e2m1fn_x2,torch.float4_e2m1fn_x2,QuantType.per_1x32,1,0,32,0,122.0947,flydsl_moe1_afp4_wfp4_bf16_t32x128x256,0.0%,69.8922,flydsl_moe2_afp4_wfp4_bf16_t16x256x256_atomic_sbm32,1.3%,191.9869,0,58.72,11025.14,
256,256,7168,256,384,8,ActivationType.Silu,torch.bfloat16,torch.float4_e2m1fn_x2,torch.float4_e2m1fn_x2,QuantType.per_1x32,1,0,32,0,131.6451,flydsl_moe1_afp4_wfp4_bf16_t32x128x256,0.0%,77.1105,flydsl_moe2_afp4_wfp4_bf16_t16x128x256_atomic_sbm32,1.2%,208.7556,0,108.01,10152.71,
256,512,7168,256,384,8,ActivationType.Silu,torch.bfloat16,torch.float4_e2m1fn_x2,torch.float4_e2m1fn_x2,QuantType.per_1x32,1,0,32,0,133.4104,flydsl_moe1_afp4_wfp4_bf16_t32x128x256,0.0%,84.4926,flydsl_moe2_afp4_wfp4_bf16_t16x128x256_atomic_sbm32,1.2%,217.903,0,206.96,9751.77,
256,1024,7168,256,384,8,ActivationType.Silu,torch.bfloat16,torch.float4_e2m1fn_x2,torch.float4_e2m1fn_x2,QuantType.per_1x32,1,0,64,0,138.1294,moe_ck2stages_gemm1_256x64x128x128_1x4_MulABScaleShuffled_v3_Nswizzle0_Quant3_MulRoutedWeight0_silu_FP4X2_FP4X2_B16,0.0%,111.0143,flydsl_moe2_afp4_wfp4_bf16_t32x128x256_atomic_sbm64,1.3%,249.1437,0,362.02,8573.16,
256,2048,7168,256,384,8,ActivationType.Silu,torch.bfloat16,torch.float4_e2m1fn_x2,torch.float4_e2m1fn_x2,QuantType.per_1x32,1,0,128,0,147.1852,moe_ck2stages_gemm1_256x128x128x128_1x4_MulABScaleShuffled_v3_Nswizzle0_Quant3_MulRoutedWeight0_silu_FP4X2_FP4X2_B16,0.0%,165.8458,flydsl_moe2_afp4_wfp4_bf16_t64x256x256_reduce_sbm128,0.1%,313.031,0,576.26,6893.79,
256,4096,7168,256,384,8,ActivationType.Silu,torch.bfloat16,torch.float4_e2m1fn_x2,torch.float4_e2m1fn_x2,QuantType.per_1x32,1,0,128,0,157.5266,moe_ck2stages_gemm1_256x128x128x128_1x4_MulABScaleShuffled_v3_Nswizzle0_Quant3_MulRoutedWeight0_silu_FP4X2_FP4X2_B16,0.0%,267.2937,flydsl_moe2_afp4_wfp4_bf16_t64x256x256_reduce_sbm128,0.1%,424.8203,0,849.25,5183.39,
256,8192,7168,256,384,8,ActivationType.Silu,torch.bfloat16,torch.float4_e2m1fn_x2,torch.float4_e2m1fn_x2,QuantType.per_1x32,1,0,128,0,280.9742,moe_ck2stages_gemm1_256x128x128x128_1x4_MulABScaleShuffled_v3_Nswizzle0_Quant3_MulRoutedWeight0_silu_FP4X2_FP4X2_B16,0.0%,468.9663,flydsl_moe2_afp4_wfp4_bf16_t64x256x256_reduce_sbm128,0.1%,749.9405,0,962.15,3053.7,
256,16384,7168,256,384,8,ActivationType.Silu,torch.bfloat16,torch.float4_e2m1fn_x2,torch.float4_e2m1fn_x2,QuantType.per_1x32,1,0,128,0,458.5277,moe_ck2stages_gemm1_256x128x128x128_1x4_MulABScaleShuffled_v3_Nswizzle0_Quant3_MulRoutedWeight0_silu_FP4X2_FP4X2_B16,0.0%,936.2011,flydsl_moe2_afp4_wfp4_bf16_t128x256x256_reduce,0.1%,1394.7288,0,1034.69,1768.27,
256,32768,7168,256,384,8,ActivationType.Silu,torch.bfloat16,torch.float4_e2m1fn_x2,torch.float4_e2m1fn_x2,QuantType.per_1x32,1,0,128,0,690.5564,moe_ck2stages_gemm1_256x128x128x128_1x4_MulABScaleShuffled_v3_Nswizzle0_Quant3_MulRoutedWeight0_silu_FP4X2_FP4X2_B16,0.0%,1830.5114,flydsl_moe2_afp4_wfp4_bf16_t128x256x256_reduce,0.1%,2521.0678,0,1144.84,1118.01,
256,1,7168,512,384,8,ActivationType.Silu,torch.bfloat16,torch.float4_e2m1fn_x2,torch.float4_e2m1fn_x2,QuantType.per_1x32,1,0,32,0,22.4405,moe_ck2stages_gemm1_64x32x32x128_1x1_MulABScaleShuffled_v3_Nswizzle0_Quant3_MulRoutedWeight0_silu_FP4X2_FP4X2_B16,0.0%,7.4827,moe_ck2stages_gemm2_256x32x128x128_1x4_MulABScaleExpertWeightShuffled_v3_Nswizzle0_Quant3_MulRoutedWeight1_FP4X2_FP4X2_B16,2.6%,29.9232,0,5.89,141291.04,
256,2,7168,512,384,8,ActivationType.Silu,torch.bfloat16,torch.float4_e2m1fn_x2,torch.float4_e2m1fn_x2,QuantType.per_1x32,1,0,32,0,24.8483,moe_ck2stages_gemm1_64x32x32x128_1x1_MulABScaleShuffled_v3_Nswizzle0_Quant3_MulRoutedWeight0_silu_FP4X2_FP4X2_B16,0.0%,13.5317,flydsl_moe2_afp4_wfp4_bf16_t32x128x256_atomic,2.5%,38.38,0,9.18,110158.97,
256,4,7168,512,384,8,ActivationType.Silu,torch.bfloat16,torch.float4_e2m1fn_x2,torch.float4_e2m1fn_x2,QuantType.per_1x32,1,0,32,0,30.1346,moe_ck2stages_gemm1_64x32x32x128_1x1_MulABScaleShuffled_v3_Nswizzle0_Quant3_MulRoutedWeight0_silu_FP4X2_FP4X2_B16,0.0%,18.5918,flydsl_moe2_afp4_wfp4_bf16_t32x128x256_atomic,2.6%,48.7264,0,14.46,86769.07,
256,8,7168,512,384,8,ActivationType.Silu,torch.bfloat16,torch.float4_e2m1fn_x2,torch.float4_e2m1fn_x2,QuantType.per_1x32,1,0,32,0,43.715,flydsl_moe1_afp4_wfp4_bf16_t32x128x256,0.0%,28.9617,flydsl_moe2_afp4_wfp4_bf16_t32x128x256_atomic,2.7%,72.6767,0,19.39,58175.87,
256,16,7168,512,384,8,ActivationType.Silu,torch.bfloat16,torch.float4_e2m1fn_x2,torch.float4_e2m1fn_x2,QuantType.per_1x32,1,0,32,0,73.2987,flydsl_moe1_afp4_wfp4_bf16_t32x128x256,0.0%,42.972,flydsl_moe2_afp4_wfp4_bf16_t32x128x256_atomic,2.8%,116.2707,0,24.24,36365.16,
256,32,7168,512,384,8,ActivationType.Silu,torch.bfloat16,torch.float4_e2m1fn_x2,torch.float4_e2m1fn_x2,QuantType.per_1x32,1,0,32,0,138.0212,moe_ck2stages_gemm1_64x32x32x128_1x1_MulABScaleShuffled_v3_Nswizzle0_Quant3_MulRoutedWeight0_silu_FP4X2_FP4X2_B16,0.0%,69.6098,flydsl_moe2_afp4_wfp4_bf16_t32x128x256_atomic,2.8%,207.631,0,27.15,20365.68,
256,64,7168,512,384,8,ActivationType.Silu,torch.bfloat16,torch.float4_e2m1fn_x2,torch.float4_e2m1fn_x2,QuantType.per_1x32,1,0,32,0,195.8759,moe_ck2stages_gemm1_64x32x32x128_1x1_MulABScaleShuffled_v3_Nswizzle0_Quant3_MulRoutedWeight0_silu_FP4X2_FP4X2_B16,0.0%,99.5791,moe_ck2stages_gemm2_64x32x32x128_1x1_MulABScaleExpertWeightShuffled_v1_Nswizzle0_Quant3_MulRoutedWeight1_FP4X2_FP4X2_B16,2.8%,295.455,0,38.16,14314.31,
256,128,7168,512,384,8,ActivationType.Silu,torch.bfloat16,torch.float4_e2m1fn_x2,torch.float4_e2m1fn_x2,QuantType.per_1x32,1,0,32,0,238.0132,flydsl_moe1_afp4_wfp4_bf16_t32x128x256,0.0%,119.6224,moe_ck2stages_gemm2_256x32x128x128_1x4_MulABScaleExpertWeightShuffled_v3_Nswizzle0_Quant3_MulRoutedWeight1_FP4X2_FP4X2_B16,2.8%,357.6356,0,63.05,11829.39,
256,256,7168,512,384,8,ActivationType.Silu,torch.bfloat16,torch.float4_e2m1fn_x2,torch.float4_e2m1fn_x2,QuantType.per_1x32,1,0,32,0,254.3587,moe_ck2stages_gemm1_64x32x32x128_1x1_MulABScaleShuffled_v3_Nswizzle0_Quant3_MulRoutedWeight0_silu_FP4X2_FP4X2_B16,0.0%,137.713,flydsl_moe2_afp4_wfp4_bf16_t16x256x256_atomic_sbm32,2.8%,392.0717,0,115.02,10797.42,
256,512,7168,512,384,8,ActivationType.Silu,torch.bfloat16,torch.float4_e2m1fn_x2,torch.float4_e2m1fn_x2,QuantType.per_1x32,1,0,64,0,254.85,flydsl_moe1_afp4_wfp4_bf16_t64x128x256,0.0%,150.5525,flydsl_moe2_afp4_wfp4_bf16_t32x256x256_atomic_sbm64,2.8%,405.4025,0,222.48,10455.95,
256,1024,7168,512,384,8,ActivationType.Silu,torch.bfloat16,torch.float4_e2m1fn_x2,torch.float4_e2m1fn_x2,QuantType.per_1x32,1,0,64,0,261.0169,moe_ck2stages_gemm1_256x64x128x128_1x4_MulABScaleShuffled_v3_Nswizzle0_Quant3_MulRoutedWeight0_silu_FP4X2_FP4X2_B16,0.0%,162.5803,flydsl_moe2_afp4_wfp4_bf16_t32x256x256_atomic_sbm64,2.7%,423.5972,0,425.85,10032.83,
256,2048,7168,512,384,8,ActivationType.Silu,torch.bfloat16,torch.float4_e2m1fn_x2,torch.float4_e2m1fn_x2,QuantType.per_1x32,1,0,64,0,267.2081,flydsl_moe1_afp4_wfp4_bf16_t64x256x256,0.0%,224.3913,flydsl_moe2_afp4_wfp4_bf16_t64x256x256_reduce,0.4%,491.5994,0,733.88,8689.8,
256,4096,7168,512,384,8,ActivationType.Silu,torch.bfloat16,torch.float4_e2m1fn_x2,torch.float4_e2m1fn_x2,QuantType.per_1x32,1,0,128,0,306.2777,moe_ck2stages_gemm1_256x128x128x128_1x4_MulABScaleShuffled_v3_Nswizzle0_Quant3_MulRoutedWeight0_silu_FP4X2_FP4X2_B16,0.0%,377.3959,flydsl_moe2_afp4_wfp4_bf16_t64x256x256_reduce_sbm128,0.4%,683.6736,0,1055.41,6312.86,
256,8192,7168,512,384,8,ActivationType.Silu,torch.bfloat16,torch.float4_e2m1fn_x2,torch.float4_e2m1fn_x2,QuantType.per_1x32,1,0,64,0,542.2486,moe_ck2stages_gemm1_256x64x128x128_1x4_MulABScaleShuffled_v3_Nswizzle0_Quant3_MulRoutedWeight0_silu_FP4X2_FP4X2_B16,0.0%,630.9754,flydsl_moe2_afp4_wfp4_bf16_t64x128x256_reduce,0.4%,1173.224,0,1230.04,3753.78,
256,16384,7168,512,384,8,ActivationType.Silu,torch.bfloat16,torch.float4_e2m1fn_x2,torch.float4_e2m1fn_x2,QuantType.per_1x32,1,0,128,0,694.1709,moe_ck2stages_gemm1_256x128x128x128_1x4_MulABScaleShuffled_v3_Nswizzle0_Quant3_MulRoutedWeight0_silu_FP4X2_FP4X2_B16,0.0%,1234.2373,flydsl_moe2_afp4_wfp4_bf16_t64x256x256_reduce_sbm128,0.4%,1928.4082,0,1496.68,2375.11,
256,32768,7168,512,384,8,ActivationType.Silu,torch.bfloat16,torch.float4_e2m1fn_x2,torch.float4_e2m1fn_x2,QuantType.per_1x32,1,0,128,0,1122.8323,moe_ck2stages_gemm1_256x128x128x128_1x4_MulABScaleShuffled_v3_Nswizzle0_Quant3_MulRoutedWeight0_silu_FP4X2_FP4X2_B16,0.0%,2281.7885,flydsl_moe2_afp4_wfp4_bf16_t64x256x256_reduce_sbm128,0.4%,3404.6208,0,1695.47,1448.77,
256,4,7168,256,257,9,ActivationType.Silu,torch.bfloat16,torch.float4_e2m1fn_x2,torch.float4_e2m1fn_x2,QuantType.per_1x32,1,0,32,0,26.1686,moe_ck2stages_gemm1_64x32x32x128_1x1_MulABScaleShuffled_v3_Nswizzle0_Quant3_MulRoutedWeight0_silu_FP4X2_FP4X2_B16,0.0,16.2136,moe_ck2stages_gemm2_64x32x32x128_1x1_MulABScaleExpertWeightShuffled_v1_Nswizzle0_Quant3_MulRoutedWeight1_FP4X2_FP4X2_B16,0.0136,42.3822,0,0.0,0.0,flydsl_fallback
256,8,7168,256,257,9,ActivationType.Silu,torch.bfloat16,torch.float4_e2m1fn_x2,torch.float4_e2m1fn_x2,QuantType.per_1x32,1,0,32,0,30.2135,moe_ck2stages_gemm1_64x32x32x128_1x1_MulABScaleShuffled_v3_Nswizzle0_Quant3_MulRoutedWeight0_silu_FP4X2_FP4X2_B16,0.0,19.7651,moe_ck2stages_gemm2_64x32x32x128_1x1_MulABScaleExpertWeightShuffled_v1_Nswizzle0_Quant3_MulRoutedWeight1_FP4X2_FP4X2_B16,0.0128,49.9786,0,0.0,0.0,flydsl_fallback
256,16,7168,256,257,9,ActivationType.Silu,torch.bfloat16,torch.float4_e2m1fn_x2,torch.float4_e2m1fn_x2,QuantType.per_1x32,1,0,32,0,42.6426,moe_ck2stages_gemm1_64x32x32x128_1x1_MulABScaleShuffled_v3_Nswizzle0_Quant3_MulRoutedWeight0_silu_FP4X2_FP4X2_B16,0.0,27.5823,moe_ck2stages_gemm2_64x32x32x128_1x1_MulABScaleExpertWeightShuffled_v1_Nswizzle0_Quant3_MulRoutedWeight1_FP4X2_FP4X2_B16,0.0137,70.2249,0,0.0,0.0,flydsl_fallback
256,32,7168,256,257,9,ActivationType.Silu,torch.bfloat16,torch.float4_e2m1fn_x2,torch.float4_e2m1fn_x2,QuantType.per_1x32,1,0,32,0,64.855,moe_ck2stages_gemm1_64x32x32x128_1x1_MulABScaleShuffled_v3_Nswizzle0_Quant3_MulRoutedWeight0_silu_FP4X2_FP4X2_B16,0.0,37.0303,moe_ck2stages_gemm2_64x32x32x128_1x1_MulABScaleExpertWeightShuffled_v1_Nswizzle0_Quant3_MulRoutedWeight1_FP4X2_FP4X2_B16,0.0135,101.8853,0,0.0,0.0,flydsl_fallback
256,64,7168,256,257,9,ActivationType.Silu,torch.bfloat16,torch.float4_e2m1fn_x2,torch.float4_e2m1fn_x2,QuantType.per_1x32,1,0,32,0,80.8334,moe_ck2stages_gemm1_256x32x128x128_1x4_MulABScaleShuffled_v3_Nswizzle0_Quant3_MulRoutedWeight0_silu_FP4X2_FP4X2_B16,0.0,46.7703,moe_ck2stages_gemm2_64x32x32x128_1x1_MulABScaleExpertWeightShuffled_v1_Nswizzle0_Quant3_MulRoutedWeight1_FP4X2_FP4X2_B16,0.0134,127.6037,0,0.0,0.0,flydsl_fallback
256,128,7168,256,257,9,ActivationType.Silu,torch.bfloat16,torch.float4_e2m1fn_x2,torch.float4_e2m1fn_x2,QuantType.per_1x32,1,0,32,0,89.7911,moe_ck2stages_gemm1_256x32x128x128_1x4_MulABScaleShuffled_v3_Nswizzle0_Quant3_MulRoutedWeight0_silu_FP4X2_FP4X2_B16,0.0,54.6012,moe_ck2stages_gemm2_64x32x32x128_1x1_MulABScaleExpertWeightShuffled_v1_Nswizzle0_Quant3_MulRoutedWeight1_FP4X2_FP4X2_B16,0.0134,144.3923,0,0.0,0.0,flydsl_fallback
256,256,7168,256,257,9,ActivationType.Silu,torch.bfloat16,torch.float4_e2m1fn_x2,torch.float4_e2m1fn_x2,QuantType.per_1x32,1,0,32,0,99.6115,moe_ck2stages_gemm1_64x32x32x128_1x1_MulABScaleShuffled_v3_Nswizzle0_Quant3_MulRoutedWeight0_silu_FP4X2_FP4X2_B16,0.0,60.5353,moe_ck2stages_gemm2_64x32x32x128_1x1_MulABScaleExpertWeightShuffled_v1_Nswizzle0_Quant3_MulRoutedWeight1_FP4X2_FP4X2_B16,0.0135,160.1468,0,0.0,0.0,flydsl_fallback
256,512,7168,256,257,9,ActivationType.Silu,torch.bfloat16,torch.float4_e2m1fn_x2,torch.float4_e2m1fn_x2,QuantType.per_1x32,1,0,32,0,100.7381,moe_ck2stages_gemm1_64x32x32x128_1x1_MulABScaleShuffled_v3_Nswizzle0_Quant3_MulRoutedWeight0_silu_FP4X2_FP4X2_B16,0.0,74.2557,moe_ck2stages_gemm2_64x32x32x128_1x1_MulABScaleExpertWeightShuffled_v1_Nswizzle0_Quant3_MulRoutedWeight1_FP4X2_FP4X2_B16,0.0133,174.9938,0,0.0,0.0,flydsl_fallback
256,1024,7168,256,257,9,ActivationType.Silu,torch.bfloat16,torch.float4_e2m1fn_x2,torch.float4_e2m1fn_x2,QuantType.per_1x32,1,0,32,0,118.1927,moe_ck2stages_gemm1_64x32x32x128_1x1_MulABScaleShuffled_v3_Nswizzle0_Quant3_MulRoutedWeight0_silu_FP4X2_FP4X2_B16,0.0,121.5087,moe_ck2stages_gemm2_64x32x32x128_1x1_MulABScaleExpertWeightShuffled_v1_Nswizzle0_Quant3_MulRoutedWeight1_FP4X2_FP4X2_B16,0.0132,239.7014,0,0.0,0.0,flydsl_fallback
256,2048,7168,256,257,9,ActivationType.Silu,torch.bfloat16,torch.float4_e2m1fn_x2,torch.float4_e2m1fn_x2,QuantType.per_1x32,1,0,128,0,126.6034,moe_ck2stages_gemm1_256x128x128x128_1x4_MulABScaleShuffled_v3_Nswizzle0_Quant3_MulRoutedWeight0_silu_FP4X2_FP4X2_B16,0.0,246.1878,moe_ck2stages_gemm2_64x128x128x128_1x1_MulABScaleExpertWeightShuffled_v3_Nswizzle0_Quant3_MulRoutedWeight1_FP4X2_FP4X2_B16,0.0132,372.7912,0,0.0,0.0,flydsl_fallback
256,4096,7168,256,257,9,ActivationType.Silu,torch.bfloat16,torch.float4_e2m1fn_x2,torch.float4_e2m1fn_x2,QuantType.per_1x32,1,0,128,0,176.0158,moe_ck2stages_gemm1_256x128x128x128_1x4_MulABScaleShuffled_v3_Nswizzle0_Quant3_MulRoutedWeight0_silu_FP4X2_FP4X2_B16,0.0,441.0767,moe_ck2stages_gemm2_64x128x128x128_1x1_MulABScaleExpertWeightShuffled_v3_Nswizzle0_Quant3_MulRoutedWeight1_FP4X2_FP4X2_B16,0.0133,617.0925,0,0.0,0.0,flydsl_fallback
256,8192,7168,256,257,9,ActivationType.Silu,torch.bfloat16,torch.float4_e2m1fn_x2,torch.float4_e2m1fn_x2,QuantType.per_1x32,1,0,128,0,279.4534,moe_ck2stages_gemm1_256x128x128x128_1x4_MulABScaleShuffled_v3_Nswizzle0_Quant3_MulRoutedWeight0_silu_FP4X2_FP4X2_B16,0.0,835.9143,moe_ck2stages_gemm2_64x128x128x128_1x1_MulABScaleExpertWeightShuffled_v3_Nswizzle0_Quant3_MulRoutedWeight1_FP4X2_FP4X2_B16,0.0133,1115.3677,0,0.0,0.0,flydsl_fallback
256,16384,7168,256,257,9,ActivationType.Silu,torch.bfloat16,torch.float4_e2m1fn_x2,torch.float4_e2m1fn_x2,QuantType.per_1x32,1,0,128,0,431.0277,moe_ck2stages_gemm1_256x128x128x128_1x4_MulABScaleShuffled_v3_Nswizzle0_Quant3_MulRoutedWeight0_silu_FP4X2_FP4X2_B16,0.0,1650.0896,moe_ck2stages_gemm2_64x128x128x128_1x1_MulABScaleExpertWeightShuffled_v3_Nswizzle0_Quant3_MulRoutedWeight1_FP4X2_FP4X2_B16,0.0133,2081.1173,0,0.0,0.0,flydsl_fallback
256,32768,7168,256,257,9,ActivationType.Silu,torch.bfloat16,torch.float4_e2m1fn_x2,torch.float4_e2m1fn_x2,QuantType.per_1x32,1,0,128,0,618.8646,moe_ck2stages_gemm1_256x128x128x128_1x4_MulABScaleShuffled_v3_Nswizzle0_Quant3_MulRoutedWeight0_silu_FP4X2_FP4X2_B16,0.0,3346.1255,moe_ck2stages_gemm2_64x128x128x128_1x1_MulABScaleExpertWeightShuffled_v3_Nswizzle0_Quant3_MulRoutedWeight1_FP4X2_FP4X2_B16,0.0133,3964.9901,0,0.0,0.0,flydsl_fallback
256,4,7168,256,384,8,ActivationType.Silu,torch.bfloat16,torch.float4_e2m1fn_x2,torch.float4_e2m1fn_x2,QuantType.per_1x32,1,0,32,0,24.168,moe_ck2stages_gemm1_64x32x32x128_1x1_MulABScaleShuffled_v3_Nswizzle0_Quant3_MulRoutedWeight0_silu_FP4X2_FP4X2_B16,0.0,14.4245,moe_ck2stages_gemm2_64x32x32x128_1x1_MulABScaleExpertWeightShuffled_v1_Nswizzle0_Quant3_MulRoutedWeight1_FP4X2_FP4X2_B16,0.0124,38.5925,0,0.0,0.0,flydsl_fallback
256,8,7168,256,384,8,ActivationType.Silu,torch.bfloat16,torch.float4_e2m1fn_x2,torch.float4_e2m1fn_x2,QuantType.per_1x32,1,0,32,0,29.4853,moe_ck2stages_gemm1_64x32x32x128_1x1_MulABScaleShuffled_v3_Nswizzle0_Quant3_MulRoutedWeight0_silu_FP4X2_FP4X2_B16,0.0,19.4087,moe_ck2stages_gemm2_64x32x32x128_1x1_MulABScaleExpertWeightShuffled_v1_Nswizzle0_Quant3_MulRoutedWeight1_FP4X2_FP4X2_B16,0.0128,48.894,0,0.0,0.0,flydsl_fallback
256,16,7168,256,384,8,ActivationType.Silu,torch.bfloat16,torch.float4_e2m1fn_x2,torch.float4_e2m1fn_x2,QuantType.per_1x32,1,0,32,0,40.4623,moe_ck2stages_gemm1_64x32x32x128_1x1_MulABScaleShuffled_v3_Nswizzle0_Quant3_MulRoutedWeight0_silu_FP4X2_FP4X2_B16,0.0,27.2228,moe_ck2stages_gemm2_64x32x32x128_1x1_MulABScaleExpertWeightShuffled_v1_Nswizzle0_Quant3_MulRoutedWeight1_FP4X2_FP4X2_B16,0.0127,67.6851,0,0.0,0.0,flydsl_fallback
256,32,7168,256,384,8,ActivationType.Silu,torch.bfloat16,torch.float4_e2m1fn_x2,torch.float4_e2m1fn_x2,QuantType.per_1x32,1,0,32,0,68.6015,moe_ck2stages_gemm1_64x32x32x128_1x1_MulABScaleShuffled_v3_Nswizzle0_Quant3_MulRoutedWeight0_silu_FP4X2_FP4X2_B16,0.0,40.7541,moe_ck2stages_gemm2_64x32x32x128_1x1_MulABScaleExpertWeightShuffled_v1_Nswizzle0_Quant3_MulRoutedWeight1_FP4X2_FP4X2_B16,0.013,109.3556,0,0.0,0.0,flydsl_fallback
256,64,7168,256,384,8,ActivationType.Silu,torch.bfloat16,torch.float4_e2m1fn_x2,torch.float4_e2m1fn_x2,QuantType.per_1x32,1,0,32,0,104.165,moe_ck2stages_gemm1_64x32x32x128_1x1_MulABScaleShuffled_v3_Nswizzle0_Quant3_MulRoutedWeight0_silu_FP4X2_FP4X2_B16,0.0,58.5081,moe_ck2stages_gemm2_64x32x32x128_1x1_MulABScaleExpertWeightShuffled_v1_Nswizzle0_Quant3_MulRoutedWeight1_FP4X2_FP4X2_B16,0.0126,162.6731,0,0.0,0.0,flydsl_fallback
256,128,7168,256,384,8,ActivationType.Silu,torch.bfloat16,torch.float4_e2m1fn_x2,torch.float4_e2m1fn_x2,QuantType.per_1x32,1,0,32,0,123.917,moe_ck2stages_gemm1_256x32x128x128_1x4_MulABScaleShuffled_v3_Nswizzle0_Quant3_MulRoutedWeight0_silu_FP4X2_FP4X2_B16,0.0,70.3122,moe_ck2stages_gemm2_64x32x32x128_1x1_MulABScaleExpertWeightShuffled_v1_Nswizzle0_Quant3_MulRoutedWeight1_FP4X2_FP4X2_B16,0.0128,194.2292,0,0.0,0.0,flydsl_fallback
256,256,7168,256,384,8,ActivationType.Silu,torch.bfloat16,torch.float4_e2m1fn_x2,torch.float4_e2m1fn_x2,QuantType.per_1x32,1,0,32,0,132.1011,moe_ck2stages_gemm1_64x32x32x128_1x1_MulABScaleShuffled_v3_Nswizzle0_Quant3_MulRoutedWeight0_silu_FP4X2_FP4X2_B16,0.0,80.471,moe_ck2stages_gemm2_64x32x32x128_1x1_MulABScaleExpertWeightShuffled_v1_Nswizzle0_Quant3_MulRoutedWeight1_FP4X2_FP4X2_B16,0.0124,212.5721,0,0.0,0.0,flydsl_fallback
256,512,7168,256,384,8,ActivationType.Silu,torch.bfloat16,torch.float4_e2m1fn_x2,torch.float4_e2m1fn_x2,QuantType.per_1x32,1,0,32,0,134.3387,moe_ck2stages_gemm1_64x32x32x128_1x1_MulABScaleShuffled_v3_Nswizzle0_Quant3_MulRoutedWeight0_silu_FP4X2_FP4X2_B16,0.0,89.1142,moe_ck2stages_gemm2_64x32x32x128_1x1_MulABScaleExpertWeightShuffled_v1_Nswizzle0_Quant3_MulRoutedWeight1_FP4X2_FP4X2_B16,0.0126,223.4529,0,0.0,0.0,flydsl_fallback
256,1024,7168,256,384,8,ActivationType.Silu,torch.bfloat16,torch.float4_e2m1fn_x2,torch.float4_e2m1fn_x2,QuantType.per_1x32,1,0,32,0,140.0107,moe_ck2stages_gemm1_64x32x32x128_1x1_MulABScaleShuffled_v3_Nswizzle0_Quant3_MulRoutedWeight0_silu_FP4X2_FP4X2_B16,0.0,115.1979,moe_ck2stages_gemm2_64x32x32x128_1x1_MulABScaleExpertWeightShuffled_v1_Nswizzle0_Quant3_MulRoutedWeight1_FP4X2_FP4X2_B16,0.0126,255.2086,0,0.0,0.0,flydsl_fallback
256,2048,7168,256,384,8,ActivationType.Silu,torch.bfloat16,torch.float4_e2m1fn_x2,torch.float4_e2m1fn_x2,QuantType.per_1x32,1,0,64,0,154.6404,moe_ck2stages_gemm1_256x64x128x128_1x4_MulABScaleShuffled_v3_Nswizzle0_Quant3_MulRoutedWeight0_silu_FP4X2_FP4X2_B16,0.0,210.3023,moe_ck2stages_gemm2_64x64x128x128_1x1_MulABScaleExpertWeightShuffled_v3_Nswizzle0_Quant3_MulRoutedWeight1_FP4X2_FP4X2_B16,0.0125,364.9427,0,0.0,0.0,flydsl_fallback
256,4096,7168,256,384,8,ActivationType.Silu,torch.bfloat16,torch.float4_e2m1fn_x2,torch.float4_e2m1fn_x2,QuantType.per_1x32,1,0,128,0,157.5266,moe_ck2stages_gemm1_256x128x128x128_1x4_MulABScaleShuffled_v3_Nswizzle0_Quant3_MulRoutedWeight0_silu_FP4X2_FP4X2_B16,0.0,398.3326,moe_ck2stages_gemm2_64x128x128x128_1x1_MulABScaleExpertWeightShuffled_v3_Nswizzle0_Quant3_MulRoutedWeight1_FP4X2_FP4X2_B16,0.0126,555.8592,0,0.0,0.0,flydsl_fallback
256,8192,7168,256,384,8,ActivationType.Silu,torch.bfloat16,torch.float4_e2m1fn_x2,torch.float4_e2m1fn_x2,QuantType.per_1x32,1,0,128,0,280.9742,moe_ck2stages_gemm1_256x128x128x128_1x4_MulABScaleShuffled_v3_Nswizzle0_Quant3_MulRoutedWeight0_silu_FP4X2_FP4X2_B16,0.0,759.521,moe_ck2stages_gemm2_64x128x128x128_1x1_MulABScaleExpertWeightShuffled_v3_Nswizzle0_Quant3_MulRoutedWeight1_FP4X2_FP4X2_B16,0.0125,1040.4952,0,0.0,0.0,flydsl_fallback
256,16384,7168,256,384,8,ActivationType.Silu,torch.bfloat16,torch.float4_e2m1fn_x2,torch.float4_e2m1fn_x2,QuantType.per_1x32,1,0,128,0,458.5277,moe_ck2stages_gemm1_256x128x128x128_1x4_MulABScaleShuffled_v3_Nswizzle0_Quant3_MulRoutedWeight0_silu_FP4X2_FP4X2_B16,0.0,1474.9209,moe_ck2stages_gemm2_64x128x128x128_1x1_MulABScaleExpertWeightShuffled_v3_Nswizzle0_Quant3_MulRoutedWeight1_FP4X2_FP4X2_B16,0.0125,1933.4486,0,0.0,0.0,flydsl_fallback
256,32768,7168,256,384,8,ActivationType.Silu,torch.bfloat16,torch.float4_e2m1fn_x2,torch.float4_e2m1fn_x2,QuantType.per_1x32,1,0,128,0,690.5564,moe_ck2stages_gemm1_256x128x128x128_1x4_MulABScaleShuffled_v3_Nswizzle0_Quant3_MulRoutedWeight0_silu_FP4X2_FP4X2_B16,0.0,3000.6717,moe_ck2stages_gemm2_64x128x128x128_1x1_MulABScaleExpertWeightShuffled_v3_Nswizzle0_Quant3_MulRoutedWeight1_FP4X2_FP4X2_B16,0.0125,3691.2281,0,0.0,0.0,flydsl_fallback
256,2,7168,512,384,8,ActivationType.Silu,torch.bfloat16,torch.float4_e2m1fn_x2,torch.float4_e2m1fn_x2,QuantType.per_1x32,1,0,32,0,24.8483,moe_ck2stages_gemm1_64x32x32x128_1x1_MulABScaleShuffled_v3_Nswizzle0_Quant3_MulRoutedWeight0_silu_FP4X2_FP4X2_B16,0.0,13.6837,moe_ck2stages_gemm2_64x32x32x128_1x1_MulABScaleExpertWeightShuffled_v1_Nswizzle0_Quant3_MulRoutedWeight1_FP4X2_FP4X2_B16,0.0269,38.532,0,0.0,0.0,flydsl_fallback
256,4,7168,512,384,8,ActivationType.Silu,torch.bfloat16,torch.float4_e2m1fn_x2,torch.float4_e2m1fn_x2,QuantType.per_1x32,1,0,32,0,30.1346,moe_ck2stages_gemm1_64x32x32x128_1x1_MulABScaleShuffled_v3_Nswizzle0_Quant3_MulRoutedWeight0_silu_FP4X2_FP4X2_B16,0.0,19.565,moe_ck2stages_gemm2_64x32x32x128_1x1_MulABScaleExpertWeightShuffled_v1_Nswizzle0_Quant3_MulRoutedWeight1_FP4X2_FP4X2_B16,0.0263,49.6996,0,0.0,0.0,flydsl_fallback
256,8,7168,512,384,8,ActivationType.Silu,torch.bfloat16,torch.float4_e2m1fn_x2,torch.float4_e2m1fn_x2,QuantType.per_1x32,1,0,32,0,44.9695,moe_ck2stages_gemm1_64x32x32x128_1x1_MulABScaleShuffled_v3_Nswizzle0_Quant3_MulRoutedWeight0_silu_FP4X2_FP4X2_B16,0.0,29.0824,moe_ck2stages_gemm2_64x32x32x128_1x1_MulABScaleExpertWeightShuffled_v1_Nswizzle0_Quant3_MulRoutedWeight1_FP4X2_FP4X2_B16,0.0268,74.0519,0,0.0,0.0,flydsl_fallback
256,16,7168,512,384,8,ActivationType.Silu,torch.bfloat16,torch.float4_e2m1fn_x2,torch.float4_e2m1fn_x2,QuantType.per_1x32,1,0,32,0,76.8755,moe_ck2stages_gemm1_64x32x32x128_1x1_MulABScaleShuffled_v3_Nswizzle0_Quant3_MulRoutedWeight0_silu_FP4X2_FP4X2_B16,0.0,43.1778,moe_ck2stages_gemm2_256x32x128x128_1x4_MulABScaleExpertWeightShuffled_v3_Nswizzle0_Quant3_MulRoutedWeight1_FP4X2_FP4X2_B16,0.0273,120.0533,0,0.0,0.0,flydsl_fallback
256,32,7168,512,384,8,ActivationType.Silu,torch.bfloat16,torch.float4_e2m1fn_x2,torch.float4_e2m1fn_x2,QuantType.per_1x32,1,0,32,0,138.0212,moe_ck2stages_gemm1_64x32x32x128_1x1_MulABScaleShuffled_v3_Nswizzle0_Quant3_MulRoutedWeight0_silu_FP4X2_FP4X2_B16,0.0,71.5517,moe_ck2stages_gemm2_256x32x128x128_1x4_MulABScaleExpertWeightShuffled_v3_Nswizzle0_Quant3_MulRoutedWeight1_FP4X2_FP4X2_B16,0.0279,209.5729,0,0.0,0.0,flydsl_fallback
256,128,7168,512,384,8,ActivationType.Silu,torch.bfloat16,torch.float4_e2m1fn_x2,torch.float4_e2m1fn_x2,QuantType.per_1x32,1,0,32,0,240.3399,moe_ck2stages_gemm1_256x32x128x128_1x4_MulABScaleShuffled_v3_Nswizzle0_Quant3_MulRoutedWeight0_silu_FP4X2_FP4X2_B16,0.0,119.6224,moe_ck2stages_gemm2_256x32x128x128_1x4_MulABScaleExpertWeightShuffled_v3_Nswizzle0_Quant3_MulRoutedWeight1_FP4X2_FP4X2_B16,0.0278,359.9623,0,0.0,0.0,flydsl_fallback
256,256,7168,512,384,8,ActivationType.Silu,torch.bfloat16,torch.float4_e2m1fn_x2,torch.float4_e2m1fn_x2,QuantType.per_1x32,1,0,32,0,254.3587,moe_ck2stages_gemm1_64x32x32x128_1x1_MulABScaleShuffled_v3_Nswizzle0_Quant3_MulRoutedWeight0_silu_FP4X2_FP4X2_B16,0.0,139.857,moe_ck2stages_gemm2_256x32x128x128_1x4_MulABScaleExpertWeightShuffled_v3_Nswizzle0_Quant3_MulRoutedWeight1_FP4X2_FP4X2_B16,0.0276,394.2157,0,0.0,0.0,flydsl_fallback
256,512,7168,512,384,8,ActivationType.Silu,torch.bfloat16,torch.float4_e2m1fn_x2,torch.float4_e2m1fn_x2,QuantType.per_1x32,1,0,32,0,264.3898,moe_ck2stages_gemm1_256x32x128x128_1x4_MulABScaleShuffled_v3_Nswizzle0_Quant3_MulRoutedWeight0_silu_FP4X2_FP4X2_B16,0.0,150.5231,moe_ck2stages_gemm2_256x32x128x128_1x4_MulABScaleExpertWeightShuffled_v3_Nswizzle0_Quant3_MulRoutedWeight1_FP4X2_FP4X2_B16,0.0274,414.9129,0,0.0,0.0,flydsl_fallback
256,1024,7168,512,384,8,ActivationType.Silu,torch.bfloat16,torch.float4_e2m1fn_x2,torch.float4_e2m1fn_x2,QuantType.per_1x32,1,0,32,0,278.5806,moe_ck2stages_gemm1_256x32x128x128_1x4_MulABScaleShuffled_v3_Nswizzle0_Quant3_MulRoutedWeight0_silu_FP4X2_FP4X2_B16,0.0,179.1801,moe_ck2stages_gemm2_64x32x32x128_1x1_MulABScaleExpertWeightShuffled_v1_Nswizzle0_Quant3_MulRoutedWeight1_FP4X2_FP4X2_B16,0.0274,457.7607,0,0.0,0.0,flydsl_fallback
256,2048,7168,512,384,8,ActivationType.Silu,torch.bfloat16,torch.float4_e2m1fn_x2,torch.float4_e2m1fn_x2,QuantType.per_1x32,1,0,32,0,350.8427,moe_ck2stages_gemm1_64x32x32x128_1x1_MulABScaleShuffled_v3_Nswizzle0_Quant3_MulRoutedWeight0_silu_FP4X2_FP4X2_B16,0.0,275.4805,moe_ck2stages_gemm2_64x32x32x128_1x1_MulABScaleExpertWeightShuffled_v1_Nswizzle0_Quant3_MulRoutedWeight1_FP4X2_FP4X2_B16,0.0276,626.3232,0,0.0,0.0,flydsl_fallback
256,4096,7168,512,384,8,ActivationType.Silu,torch.bfloat16,torch.float4_e2m1fn_x2,torch.float4_e2m1fn_x2,QuantType.per_1x32,1,0,32,0,459.8423,moe_ck2stages_gemm1_64x32x32x128_1x1_MulABScaleShuffled_v3_Nswizzle0_Quant3_MulRoutedWeight0_silu_FP4X2_FP4X2_B16,0.0,497.0616,moe_ck2stages_gemm2_64x32x32x128_1x1_MulABScaleExpertWeightShuffled_v1_Nswizzle0_Quant3_MulRoutedWeight1_FP4X2_FP4X2_B16,0.0273,956.9039,0,0.0,0.0,flydsl_fallback
256,8192,7168,512,384,8,ActivationType.Silu,torch.bfloat16,torch.float4_e2m1fn_x2,torch.float4_e2m1fn_x2,QuantType.per_1x32,1,0,64,0,542.2486,moe_ck2stages_gemm1_256x64x128x128_1x4_MulABScaleShuffled_v3_Nswizzle0_Quant3_MulRoutedWeight0_silu_FP4X2_FP4X2_B16,0.0,959.7495,moe_ck2stages_gemm2_64x64x128x128_1x1_MulABScaleExpertWeightShuffled_v3_Nswizzle0_Quant3_MulRoutedWeight1_FP4X2_FP4X2_B16,0.0274,1501.9981,0,0.0,0.0,flydsl_fallback
256,16384,7168,512,384,8,ActivationType.Silu,torch.bfloat16,torch.float4_e2m1fn_x2,torch.float4_e2m1fn_x2,QuantType.per_1x32,1,0,64,0,791.7059,moe_ck2stages_gemm1_256x64x128x128_1x4_MulABScaleShuffled_v3_Nswizzle0_Quant3_MulRoutedWeight0_silu_FP4X2_FP4X2_B16,0.0,1892.9906,moe_ck2stages_gemm2_64x64x128x128_1x1_MulABScaleExpertWeightShuffled_v3_Nswizzle0_Quant3_MulRoutedWeight1_FP4X2_FP4X2_B16,0.0275,2684.6965,0,0.0,0.0,flydsl_fallback
256,32768,7168,512,384,8,ActivationType.Silu,torch.bfloat16,torch.float4_e2m1fn_x2,torch.float4_e2m1fn_x2,QuantType.per_1x32,1,0,64,0,1375.8502,moe_ck2stages_gemm1_256x64x128x128_1x4_MulABScaleShuffled_v3_Nswizzle0_Quant3_MulRoutedWeight0_silu_FP4X2_FP4X2_B16,0.0,3800.1023,moe_ck2stages_gemm2_64x64x128x128_1x1_MulABScaleExpertWeightShuffled_v3_Nswizzle0_Quant3_MulRoutedWeight1_FP4X2_FP4X2_B16,0.0274,5175.9525,0,0.0,0.0,flydsl_fallback
