aiter/configs/model_configs/dsv4_bf16_tuned_gemm.csv
gfx,cu_num,M,N,K,bias,dtype,outdtype,scaleAB,bpreshuffle,libtype,solidx,splitK,us,kernelName,err_ratio,tflops,bw
gfx950,256,1,64,7168,False,torch.bfloat16,torch.bfloat16,False,False,skinny,2,0,4.1786,sol2,0.0,0.22,223.03
gfx950,256,2,64,7168,False,torch.bfloat16,torch.bfloat16,False,False,skinny,2,0,4.8662,sol2,0.0,0.38,194.49
gfx950,256,4,64,7168,False,torch.bfloat16,torch.bfloat16,False,False,asm,3,16,5.0807,_ZN5aiter39bf16gemm_fp32bf16_tn_48x64_splitk_cleanE,0.0273,0.72,191.97
gfx950,256,8,64,7168,False,torch.bfloat16,torch.bfloat16,False,False,asm,1,14,5.2765,_ZN5aiter39bf16gemm_fp32bf16_tn_32x64_splitk_cleanE,0.0371,1.39,195.81
gfx950,256,16,64,4096,False,torch.bfloat16,torch.bfloat16,False,False,asm,1,16,4.3821,_ZN5aiter39bf16gemm_fp32bf16_tn_32x64_splitk_cleanE,0.0332,1.91,150.02
gfx950,256,16,64,7168,False,torch.bfloat16,torch.bfloat16,False,False,asm,1,16,4.9767,_ZN5aiter39bf16gemm_fp32bf16_tn_32x64_splitk_cleanE,0.0371,2.95,230.86
gfx950,256,32,64,4096,False,torch.bfloat16,torch.bfloat16,False,False,asm,1,16,4.4113,_ZN5aiter39bf16gemm_fp32bf16_tn_32x64_splitk_cleanE,0.0332,3.8,179.21
gfx950,256,32,64,7168,False,torch.bfloat16,torch.bfloat16,False,False,asm,1,16,5.0438,_ZN5aiter39bf16gemm_fp32bf16_tn_32x64_splitk_cleanE,0.0269,5.82,273.67
gfx950,256,48,64,4096,False,torch.bfloat16,torch.bfloat16,False,False,flydsl,94,8,4.7125,flydsl_hgemm_abf16_wbf16_bf16_t16x64x256x3_ks8_w1x1x2_bias0_ktail0_gm0_pft_gfx950,0.028,5.34,196.0
gfx950,256,48,64,7168,False,torch.bfloat16,torch.bfloat16,False,False,asm,3,16,5.21,_ZN5aiter39bf16gemm_fp32bf16_tn_48x64_splitk_cleanE,0.029,8.45,309.36
gfx950,256,64,64,4096,False,torch.bfloat16,torch.bfloat16,False,False,flydsl,46,8,4.7086,flydsl_hgemm_abf16_wbf16_bf16_t16x64x128x5_ks8_w1x1x2_bias0_ktail0_gm0_pft_gfx950,0.0298,7.13,224.43
gfx950,256,64,64,7168,False,torch.bfloat16,torch.bfloat16,False,False,asm,1,14,5.512,_ZN5aiter39bf16gemm_fp32bf16_tn_32x64_splitk_cleanE,0.0295,10.65,334.4
gfx950,256,80,64,4096,False,torch.bfloat16,torch.bfloat16,False,False,flydsl,186,8,4.6611,flydsl_hgemm_abf16_wbf16_bf16_t16x64x64x8_ks8_w1x1x2_bias0_ktail0_gm0_pft_gfx950,0.0293,9.0,255.28
gfx950,256,80,64,7168,False,torch.bfloat16,torch.bfloat16,False,False,flydsl,88,8,5.626,flydsl_hgemm_abf16_wbf16_bf16_t16x64x128x8_ks8_w1x1x2_bias0_ktail0_gm0_pft_gfx950,0.0307,13.05,368.76
gfx950,256,96,64,4096,False,torch.bfloat16,torch.bfloat16,False,False,flydsl,46,8,4.7009,flydsl_hgemm_abf16_wbf16_bf16_t16x64x128x5_ks8_w1x1x2_bias0_ktail0_gm0_pft_gfx950,0.0277,10.71,281.44
gfx950,256,96,64,7168,False,torch.bfloat16,torch.bfloat16,False,False,flydsl,43,8,5.6694,flydsl_hgemm_abf16_wbf16_bf16_t16x64x128x4_ks8_w1x1x2_bias0_ktail0_gm0_pft_gfx950,0.0282,15.54,406.75
gfx950,256,112,64,4096,False,torch.bfloat16,torch.bfloat16,False,False,flydsl,442,8,4.682,flydsl_hgemm_abf16_wbf16_bf16_t16x64x64x9_ks8_w1x1x2_bias0_ktail0_gm0_pft_gfx950,0.0261,12.54,311.01
gfx950,256,112,64,7168,False,torch.bfloat16,torch.bfloat16,False,False,flydsl,369,8,5.9083,flydsl_hgemm_abf16_wbf16_bf16_t16x64x128x5_ks8_w1x2x1_bias0_ktail0_gm0_pft_gfx950,0.0202,17.39,429.48
gfx950,256,128,64,4096,False,torch.bfloat16,torch.bfloat16,False,False,flydsl,816,8,4.8893,flydsl_hgemm_abf16_wbf16_bf16_t32x64x64x6_ks8_w1x4x1_bias0_ktail0_gm0_pft_gfx950,0.0177,13.73,325.05
gfx950,256,128,64,7168,False,torch.bfloat16,torch.bfloat16,False,False,flydsl,378,8,6.1693,flydsl_hgemm_abf16_wbf16_bf16_t16x64x128x6_ks8_w1x1x2_bias0_ktail0_gm0_pft_gfx950,0.0272,19.04,448.82
gfx950,256,144,64,4096,False,torch.bfloat16,torch.bfloat16,False,False,flydsl,47,8,4.8439,flydsl_hgemm_abf16_wbf16_bf16_t16x64x128x5_ks8_w1x2x1_bias0_ktail0_gm0_pft_gfx950,0.0205,15.59,355.57
gfx950,256,144,64,7168,False,torch.bfloat16,torch.bfloat16,False,False,flydsl,59,8,6.2152,flydsl_hgemm_abf16_wbf16_bf16_t16x64x128x5_ks8_w1x2x1_bias0_ktail0_gm0_pft_gfx950,0.0232,21.26,482.74
gfx950,256,160,64,4096,False,torch.bfloat16,torch.bfloat16,False,False,flydsl,536,8,4.7919,flydsl_hgemm_abf16_wbf16_bf16_t32x64x64x5_ks8_w1x4x1_bias0_ktail0_gm0_pft_gfx950,0.0194,17.51,387.21
gfx950,256,160,64,7168,False,torch.bfloat16,torch.bfloat16,False,False,flydsl,226,8,6.3995,flydsl_hgemm_abf16_wbf16_bf16_t16x64x64x8_ks8_w1x2x1_bias0_ktail0_gm0_pft_gfx950,0.0217,22.94,505.0
gfx950,256,176,64,4096,False,torch.bfloat16,torch.bfloat16,False,False,flydsl,194,8,5.0363,flydsl_hgemm_abf16_wbf16_bf16_t16x64x64x9_ks8_w1x1x2_bias0_ktail0_gm0_pft_gfx950,0.0255,18.32,394.85
gfx950,256,176,64,7168,False,torch.bfloat16,torch.bfloat16,False,False,flydsl,59,8,6.53,flydsl_hgemm_abf16_wbf16_bf16_t16x64x128x5_ks8_w1x2x1_bias0_ktail0_gm0_pft_gfx950,0.0196,24.73,530.35
gfx950,256,192,64,4096,False,torch.bfloat16,torch.bfloat16,False,False,flydsl,568,8,4.9296,flydsl_hgemm_abf16_wbf16_bf16_t32x64x64x6_ks8_w1x4x1_bias0_ktail0_gm0_pft_gfx950,0.0194,20.42,430.41
gfx950,256,192,64,7168,False,torch.bfloat16,torch.bfloat16,False,False,flydsl,44,8,6.615,flydsl_hgemm_abf16_wbf16_bf16_t16x64x128x4_ks8_w1x2x1_bias0_ktail0_gm0_pft_gfx950,0.0205,26.63,558.52
gfx950,256,208,64,4096,False,torch.bfloat16,torch.bfloat16,False,False,flydsl,47,8,5.3428,flydsl_hgemm_abf16_wbf16_bf16_t16x64x128x5_ks8_w1x2x1_bias0_ktail0_gm0_pft_gfx950,0.0199,20.41,422.03
gfx950,256,208,64,7168,False,torch.bfloat16,torch.bfloat16,False,False,flydsl,196,8,6.8195,flydsl_hgemm_abf16_wbf16_bf16_t16x64x64x6_ks8_w1x2x1_bias0_ktail0_gm0_pft_gfx950,0.0224,27.98,575.7
gfx950,256,224,64,4096,False,torch.bfloat16,torch.bfloat16,False,False,flydsl,536,8,5.0325,flydsl_hgemm_abf16_wbf16_bf16_t32x64x64x5_ks8_w1x4x1_bias0_ktail0_gm0_pft_gfx950,0.0198,23.34,474.51
gfx950,256,224,64,7168,False,torch.bfloat16,torch.bfloat16,False,False,flydsl,59,8,6.846,flydsl_hgemm_abf16_wbf16_bf16_t16x64x128x5_ks8_w1x2x1_bias0_ktail0_gm0_pft_gfx950,0.0211,30.02,607.28
gfx950,256,240,64,4096,False,torch.bfloat16,torch.bfloat16,False,False,flydsl,194,8,5.5484,flydsl_hgemm_abf16_wbf16_bf16_t16x64x64x9_ks8_w1x1x2_bias0_ktail0_gm0_pft_gfx950,0.0253,22.68,454.38
gfx950,256,240,64,7168,False,torch.bfloat16,torch.bfloat16,False,False,flydsl,59,8,7.0524,flydsl_hgemm_abf16_wbf16_bf16_t16x64x128x5_ks8_w1x2x1_bias0_ktail0_gm0_pft_gfx950,0.0223,31.22,622.32
gfx950,256,256,64,4096,False,torch.bfloat16,torch.bfloat16,False,False,flydsl,872,8,5.4576,flydsl_hgemm_abf16_wbf16_bf16_t32x64x64x6_ks8_w1x4x1_bias0_ktail0_gm0_pft_gfx950,0.019,24.59,486.33
gfx950,256,256,64,7168,False,torch.bfloat16,torch.bfloat16,False,False,flydsl,768,8,7.1121,flydsl_hgemm_abf16_wbf16_bf16_t32x64x128x5_ks8_w1x4x1_bias0_ktail0_gm0_pft_gfx950,0.0219,33.03,649.64
gfx950,256,288,64,4096,False,torch.bfloat16,torch.bfloat16,False,False,flydsl,1072,8,5.7469,flydsl_hgemm_abf16_wbf16_bf16_t32x64x64x5_ks8_w1x4x1_bias0_ktail0_gm0_pft_gfx950,0.0185,26.27,508.18
gfx950,256,288,64,7168,False,torch.bfloat16,torch.bfloat16,False,False,flydsl,88,8,7.1449,flydsl_hgemm_abf16_wbf16_bf16_t16x64x128x4_ks8_w1x2x1_bias0_ktail0_gm0_pft_gfx950,0.0218,36.98,711.44
gfx950,256,320,64,4096,False,torch.bfloat16,torch.bfloat16,False,False,flydsl,326,8,6.0187,flydsl_hgemm_abf16_wbf16_bf16_t16x64x64x6_ks8_w1x2x1_bias0_ktail0_gm0_pft_gfx950,0.0204,27.88,529.46
gfx950,256,320,64,7168,False,torch.bfloat16,torch.bfloat16,False,False,flydsl,392,8,7.324,flydsl_hgemm_abf16_wbf16_bf16_t16x64x64x6_ks8_w1x2x1_bias0_ktail0_gm0_pft_gfx950,0.0204,40.09,757.23
gfx950,256,352,64,4096,False,torch.bfloat16,torch.bfloat16,False,False,flydsl,374,8,6.1276,flydsl_hgemm_abf16_wbf16_bf16_t16x64x64x8_ks8_w1x2x1_bias0_ktail0_gm0_pft_gfx950,0.0183,30.12,563.5
gfx950,256,352,64,7168,False,torch.bfloat16,torch.bfloat16,False,False,flydsl,118,8,7.4135,flydsl_hgemm_abf16_wbf16_bf16_t16x64x128x5_ks8_w1x2x1_bias0_ktail0_gm0_pft_gfx950,0.0199,43.56,810.53
gfx950,256,384,64,4096,False,torch.bfloat16,torch.bfloat16,False,False,flydsl,1712,8,6.3395,flydsl_hgemm_abf16_wbf16_bf16_t32x64x64x7_ks8_w1x4x1_bias0_ktail0_gm0_pft_gfx950,0.0185,31.76,586.67
gfx950,256,384,64,7168,False,torch.bfloat16,torch.bfloat16,False,False,flydsl,776,8,7.6043,flydsl_hgemm_abf16_wbf16_bf16_t16x64x128x6_ks8_w1x1x2_bias0_ktail0_gm0_pft_gfx950,0.0263,46.33,851.06
gfx950,256,416,64,4096,False,torch.bfloat16,torch.bfloat16,False,False,flydsl,1200,8,6.3578,flydsl_hgemm_abf16_wbf16_bf16_t32x64x64x7_ks8_w1x4x1_bias0_ktail0_gm0_pft_gfx950,0.018,34.3,626.85
gfx950,256,416,64,7168,False,torch.bfloat16,torch.bfloat16,False,False,flydsl,422,8,7.666,flydsl_hgemm_abf16_wbf16_bf16_t16x64x64x7_ks8_w1x2x1_bias0_ktail0_gm0_pft_gfx950,0.0204,49.79,904.58
gfx950,256,448,64,4096,False,torch.bfloat16,torch.bfloat16,False,False,flydsl,1142,8,6.4879,flydsl_hgemm_abf16_wbf16_bf16_t32x64x64x6_ks8_w2x2x1_bias0_ktail0_gm0_pft_gfx950,0.019,36.2,655.32
gfx950,256,448,64,7168,False,torch.bfloat16,torch.bfloat16,False,False,flydsl,392,8,7.7631,flydsl_hgemm_abf16_wbf16_bf16_t16x64x64x6_ks8_w1x2x1_bias0_ktail0_gm0_pft_gfx950,0.0208,52.95,952.89
gfx950,256,480,64,4096,False,torch.bfloat16,torch.bfloat16,False,False,flydsl,1072,8,6.5661,flydsl_hgemm_abf16_wbf16_bf16_t32x64x64x5_ks8_w1x4x1_bias0_ktail0_gm0_pft_gfx950,0.0192,38.33,688.06
gfx950,256,480,64,7168,False,torch.bfloat16,torch.bfloat16,False,False,flydsl,118,8,7.8411,flydsl_hgemm_abf16_wbf16_bf16_t16x64x128x5_ks8_w1x2x1_bias0_ktail0_gm0_pft_gfx950,0.0208,56.17,1002.44
gfx950,256,512,64,4096,False,torch.bfloat16,torch.bfloat16,False,False,flydsl,582,8,6.8231,flydsl_hgemm_abf16_wbf16_bf16_t16x64x128x4_ks8_w1x2x1_bias0_ktail0_gm0_pft_gfx950,0.0199,39.34,701.17
gfx950,256,512,64,7168,False,torch.bfloat16,torch.bfloat16,False,False,flydsl,1026,7,8.0282,flydsl_hgemm_abf16_wbf16_bf16_t16x64x64x6_ks7_w1x2x1_bias0_ktail0_gm0_pft_gfx950,0.0201,58.51,1036.73
gfx950,256,544,64,4096,False,torch.bfloat16,torch.bfloat16,False,False,flydsl,1256,8,6.9791,flydsl_hgemm_abf16_wbf16_bf16_t32x64x64x8_ks8_w1x4x1_bias0_ktail0_gm0_pft_gfx950,0.0201,40.87,723.64
gfx950,256,544,64,7168,False,torch.bfloat16,torch.bfloat16,False,False,flydsl,386,7,8.2807,flydsl_hgemm_abf16_wbf16_bf16_t16x64x64x6_ks7_w1x2x1_bias0_ktail0_gm0_pft_gfx950,0.02,60.28,1061.01
gfx950,256,576,64,4096,False,torch.bfloat16,torch.bfloat16,False,False,flydsl,320,4,7.0907,flydsl_hgemm_abf16_wbf16_bf16_t16x64x64x6_ks4_w1x2x1_bias0_ktail0_gm0_pft_gfx950,0.0121,42.59,749.8
gfx950,256,576,64,7168,False,torch.bfloat16,torch.bfloat16,False,False,flydsl,112,7,8.3919,flydsl_hgemm_abf16_wbf16_bf16_t16x64x128x5_ks7_w1x2x1_bias0_ktail0_gm0_pft_gfx950,0.0193,62.98,1102.11
gfx950,256,608,64,4096,False,torch.bfloat16,torch.bfloat16,False,False,flydsl,832,4,7.1215,flydsl_hgemm_abf16_wbf16_bf16_t16x64x64x6_ks4_w1x2x1_bias0_ktail0_gm0_pft_gfx950,0.0116,44.76,783.94
gfx950,256,608,64,7168,False,torch.bfloat16,torch.bfloat16,False,False,flydsl,2094,8,8.5571,flydsl_hgemm_abf16_wbf16_bf16_t32x64x64x7_ks8_w1x4x1_bias0_ktail0_gm0_pft_gfx950,0.0209,65.19,1134.92
gfx950,256,640,64,4096,False,torch.bfloat16,torch.bfloat16,False,False,flydsl,1144,8,7.2855,flydsl_hgemm_abf16_wbf16_bf16_t32x64x128x5_ks8_w1x4x1_bias0_ktail0_gm0_pft_gfx950,0.0198,46.06,802.84
gfx950,256,640,64,7168,False,torch.bfloat16,torch.bfloat16,False,False,flydsl,1934,8,8.51,flydsl_hgemm_abf16_wbf16_bf16_t32x64x64x5_ks8_w1x4x1_bias0_ktail0_gm0_pft_gfx950,0.0214,69.0,1195.59
gfx950,256,672,64,4096,False,torch.bfloat16,torch.bfloat16,False,False,flydsl,320,4,7.1975,flydsl_hgemm_abf16_wbf16_bf16_t16x64x64x6_ks4_w1x2x1_bias0_ktail0_gm0_pft_gfx950,0.0115,48.95,849.65
gfx950,256,672,64,7168,False,torch.bfloat16,torch.bfloat16,False,False,flydsl,974,7,8.5076,flydsl_hgemm_abf16_wbf16_bf16_t32x64x256x3_ks7_w1x4x1_bias0_ktail0_gm0_pft_gfx950,0.0202,72.47,1250.33
gfx950,256,704,64,4096,False,torch.bfloat16,torch.bfloat16,False,False,flydsl,88,4,7.2916,flydsl_hgemm_abf16_wbf16_bf16_t16x64x128x5_ks4_w1x2x1_bias0_ktail0_gm0_pft_gfx950,0.0118,50.62,875.19
gfx950,256,704,64,7168,False,torch.bfloat16,torch.bfloat16,False,False,flydsl,696,7,8.5222,flydsl_hgemm_abf16_wbf16_bf16_t32x64x128x4_ks7_w2x2x1_bias0_ktail0_gm0_pft_gfx950,0.0193,75.79,1302.5
gfx950,256,736,64,4096,False,torch.bfloat16,torch.bfloat16,False,False,flydsl,832,4,7.3437,flydsl_hgemm_abf16_wbf16_bf16_t16x64x64x6_ks4_w1x2x1_bias0_ktail0_gm0_pft_gfx950,0.0117,52.55,905.24
gfx950,256,736,64,7168,False,torch.bfloat16,torch.bfloat16,False,False,flydsl,1490,7,8.5691,flydsl_hgemm_abf16_wbf16_bf16_t32x64x128x4_ks7_w1x4x1_bias0_ktail0_gm0_pft_gfx950,0.02,78.8,1349.38
gfx950,256,768,64,4096,False,torch.bfloat16,torch.bfloat16,False,False,flydsl,576,4,7.4896,flydsl_hgemm_abf16_wbf16_bf16_t16x64x128x4_ks4_w1x2x1_bias0_ktail0_gm0_pft_gfx950,0.0122,53.76,923.15
gfx950,256,768,64,7168,False,torch.bfloat16,torch.bfloat16,False,False,flydsl,1488,7,8.8951,flydsl_hgemm_abf16_wbf16_bf16_t32x64x128x4_ks7_w1x2x2_bias0_ktail0_gm0_pft_gfx950,0.027,79.22,1351.96
gfx950,256,800,64,4096,False,torch.bfloat16,torch.bfloat16,False,False,flydsl,368,4,7.5797,flydsl_hgemm_abf16_wbf16_bf16_t16x64x64x8_ks4_w1x2x1_bias0_ktail0_gm0_pft_gfx950,0.0115,55.34,947.31
gfx950,256,800,64,7168,False,torch.bfloat16,torch.bfloat16,False,False,flydsl,1284,7,9.043,flydsl_hgemm_abf16_wbf16_bf16_t32x64x64x5_ks7_w2x2x1_bias0_ktail0_gm0_pft_gfx950,0.0193,81.17,1381.04
gfx950,256,832,64,4096,False,torch.bfloat16,torch.bfloat16,False,False,flydsl,88,4,7.6511,flydsl_hgemm_abf16_wbf16_bf16_t16x64x128x5_ks4_w1x2x1_bias0_ktail0_gm0_pft_gfx950,0.0117,57.01,973.26
gfx950,256,832,64,7168,False,torch.bfloat16,torch.bfloat16,False,False,flydsl,696,7,9.129,flydsl_hgemm_abf16_wbf16_bf16_t32x64x128x4_ks7_w2x2x1_bias0_ktail0_gm0_pft_gfx950,0.0201,83.62,1418.73
gfx950,256,864,64,4096,False,torch.bfloat16,torch.bfloat16,False,False,flydsl,600,4,7.7352,flydsl_hgemm_abf16_wbf16_bf16_t16x64x128x5_ks4_w1x2x1_bias0_ktail0_gm0_pft_gfx950,0.0118,58.56,997.1
gfx950,256,864,64,7168,False,torch.bfloat16,torch.bfloat16,False,False,flydsl,1330,7,9.2103,flydsl_hgemm_abf16_wbf16_bf16_t32x64x128x4_ks7_w1x4x1_bias0_ktail0_gm0_pft_gfx950,0.0201,86.07,1456.46
gfx950,256,896,64,4096,False,torch.bfloat16,torch.bfloat16,False,False,flydsl,600,4,7.9651,flydsl_hgemm_abf16_wbf16_bf16_t16x64x128x5_ks4_w1x2x1_bias0_ktail0_gm0_pft_gfx950,0.0117,58.98,1001.75
gfx950,256,896,64,7168,False,torch.bfloat16,torch.bfloat16,False,False,flydsl,1330,7,9.2895,flydsl_hgemm_abf16_wbf16_bf16_t32x64x128x4_ks7_w1x4x1_bias0_ktail0_gm0_pft_gfx950,0.0196,88.5,1493.86
gfx950,256,928,64,4096,False,torch.bfloat16,torch.bfloat16,False,False,flydsl,64,4,7.9167,flydsl_hgemm_abf16_wbf16_bf16_t16x64x128x4_ks4_w1x2x1_bias0_ktail0_gm0_pft_gfx950,0.0113,61.46,1041.5
gfx950,256,928,64,7168,False,torch.bfloat16,torch.bfloat16,False,False,flydsl,1278,7,9.3972,flydsl_hgemm_abf16_wbf16_bf16_t32x64x64x5_ks7_w1x4x1_bias0_ktail0_gm0_pft_gfx950,0.0202,90.61,1526.0
gfx950,256,960,64,4096,False,torch.bfloat16,torch.bfloat16,False,False,flydsl,320,4,7.9648,flydsl_hgemm_abf16_wbf16_bf16_t16x64x64x6_ks4_w1x2x1_bias0_ktail0_gm0_pft_gfx950,0.012,63.19,1068.64
gfx950,256,960,64,7168,False,torch.bfloat16,torch.bfloat16,False,False,flydsl,762,7,9.5177,flydsl_hgemm_abf16_wbf16_bf16_t32x64x128x5_ks7_w1x4x1_bias0_ktail0_gm0_pft_gfx950,0.0193,92.54,1555.31
gfx950,256,992,64,4096,False,torch.bfloat16,torch.bfloat16,False,False,flydsl,616,4,8.0371,flydsl_hgemm_abf16_wbf16_bf16_t16x64x128x6_ks4_w1x1x2_bias0_ktail0_gm0_pft_gfx950,0.019,64.71,1092.15
gfx950,256,992,64,7168,False,torch.bfloat16,torch.bfloat16,False,False,flydsl,2084,7,9.6258,flydsl_hgemm_abf16_wbf16_bf16_t32x64x64x5_ks7_w2x2x1_bias0_ktail0_gm0_pft_gfx950,0.0202,94.55,1585.92
gfx950,256,1024,64,4096,False,torch.bfloat16,torch.bfloat16,False,False,flydsl,576,4,8.1487,flydsl_hgemm_abf16_wbf16_bf16_t16x64x128x4_ks4_w1x2x1_bias0_ktail0_gm0_pft_gfx950,0.0114,65.88,1109.87
gfx950,256,1024,64,7168,False,torch.bfloat16,torch.bfloat16,False,False,flydsl,1562,7,9.9872,flydsl_hgemm_abf16_wbf16_bf16_t32x64x128x5_ks7_w1x4x1_bias0_ktail0_gm0_pft_gfx950,0.02,94.07,1574.88
gfx950,256,1088,64,4096,False,torch.bfloat16,torch.bfloat16,False,False,flydsl,1120,4,8.4055,flydsl_hgemm_abf16_wbf16_bf16_t32x64x64x6_ks4_w1x4x1_bias0_ktail0_gm0_pft_gfx950,0.0114,67.86,1139.31
gfx950,256,1088,64,7168,False,torch.bfloat16,torch.bfloat16,False,False,flydsl,762,7,10.1367,flydsl_hgemm_abf16_wbf16_bf16_t32x64x128x5_ks7_w1x4x1_bias0_ktail0_gm0_pft_gfx950,0.0196,98.48,1642.97
gfx950,256,1152,64,4096,False,torch.bfloat16,torch.bfloat16,False,False,flydsl,1072,4,8.3765,flydsl_hgemm_abf16_wbf16_bf16_t32x64x128x4_ks4_w1x4x1_bias0_ktail0_gm0_pft_gfx950,0.0116,72.1,1206.82
gfx950,256,1152,64,7168,False,torch.bfloat16,torch.bfloat16,False,False,flydsl,2076,7,10.367,flydsl_hgemm_abf16_wbf16_bf16_t32x64x64x7_ks7_w1x2x2_bias0_ktail0_gm0_pft_gfx950,0.0273,101.95,1695.77
gfx950,256,1216,64,4096,False,torch.bfloat16,torch.bfloat16,False,False,flydsl,1200,4,8.2259,flydsl_hgemm_abf16_wbf16_bf16_t32x64x128x4_ks4_w1x4x1_bias0_ktail0_gm0_pft_gfx950,0.0115,77.5,1293.65
gfx950,256,1216,64,7168,False,torch.bfloat16,torch.bfloat16,False,False,flydsl,3403,7,10.4065,flydsl_hgemm_abf16_wbf16_bf16_t64x64x256x2_ks7_w2x2x1_bias0_ktail0_gm0_pht_gfx950,0.0196,107.21,1778.29
gfx950,256,1280,64,4096,False,torch.bfloat16,torch.bfloat16,False,False,flydsl,2787,8,8.5128,flydsl_hgemm_abf16_wbf16_bf16_t64x64x256x2_ks8_w2x2x1_bias0_ktail0_gm0_pht_gfx950,0.0188,78.83,1312.6
gfx950,256,1280,64,7168,False,torch.bfloat16,torch.bfloat16,False,False,flydsl,3403,7,10.743,flydsl_hgemm_abf16_wbf16_bf16_t64x64x256x2_ks7_w2x2x1_bias0_ktail0_gm0_pht_gfx950,0.0201,109.32,1808.75
gfx950,256,1344,64,4096,False,torch.bfloat16,torch.bfloat16,False,False,flydsl,1078,4,8.6513,flydsl_hgemm_abf16_wbf16_bf16_t32x64x128x4_ks4_w2x2x1_bias0_ktail0_gm0_pft_gfx950,0.0116,81.45,1353.13
gfx950,256,1344,64,7168,False,torch.bfloat16,torch.bfloat16,False,False,flydsl,3243,7,10.6628,flydsl_hgemm_abf16_wbf16_bf16_t64x64x256x2_ks7_w2x2x1_bias0_ktail0_gm0_pht_gfx950,0.0198,115.65,1909.17
gfx950,256,1408,64,4096,False,torch.bfloat16,torch.bfloat16,False,False,flydsl,1072,4,8.6725,flydsl_hgemm_abf16_wbf16_bf16_t32x64x128x4_ks4_w1x4x1_bias0_ktail0_gm0_pft_gfx950,0.0114,85.12,1411.22
gfx950,256,1408,64,7168,False,torch.bfloat16,torch.bfloat16,False,False,flydsl,3243,7,10.7851,flydsl_hgemm_abf16_wbf16_bf16_t64x64x256x2_ks7_w2x2x1_bias0_ktail0_gm0_pht_gfx950,0.0199,119.78,1973.35
gfx950,256,1472,64,4096,False,torch.bfloat16,torch.bfloat16,False,False,flydsl,1824,4,8.8528,flydsl_hgemm_abf16_wbf16_bf16_t32x64x64x7_ks4_w1x4x1_bias0_ktail0_gm0_pft_gfx950,0.0116,87.18,1442.63
gfx950,256,1472,64,7168,False,torch.bfloat16,torch.bfloat16,False,False,flydsl,3403,7,11.28,flydsl_hgemm_abf16_wbf16_bf16_t64x64x256x2_ks7_w2x2x1_bias0_ktail0_gm0_pht_gfx950,0.02,119.73,1968.84
gfx950,256,1536,64,4096,False,torch.bfloat16,torch.bfloat16,False,False,flydsl,2787,8,9.1302,flydsl_hgemm_abf16_wbf16_bf16_t64x64x256x2_ks8_w2x2x1_bias0_ktail0_gm0_pht_gfx950,0.0197,88.2,1457.12
gfx950,256,1536,64,7168,False,torch.bfloat16,torch.bfloat16,False,False,flydsl,3403,7,10.9614,flydsl_hgemm_abf16_wbf16_bf16_t64x64x256x2_ks7_w2x2x1_bias0_ktail0_gm0_pht_gfx950,0.0201,128.57,2110.52
gfx950,256,1600,64,4096,False,torch.bfloat16,torch.bfloat16,False,False,flydsl,1638,4,9.2479,flydsl_hgemm_abf16_wbf16_bf16_t32x64x64x6_ks4_w2x2x1_bias0_ktail0_gm0_pft_gfx950,0.0124,90.71,1496.15
gfx950,256,1600,64,7168,False,torch.bfloat16,torch.bfloat16,False,False,flydsl,3243,7,11.2216,flydsl_hgemm_abf16_wbf16_bf16_t64x64x256x2_ks7_w2x2x1_bias0_ktail0_gm0_pht_gfx950,0.02,130.82,2144.07
gfx950,256,1664,64,4096,False,torch.bfloat16,torch.bfloat16,False,False,flydsl,1696,4,9.3302,flydsl_hgemm_abf16_wbf16_bf16_t32x64x64x7_ks4_w1x4x1_bias0_ktail0_gm0_pft_gfx950,0.0123,93.5,1540.03
gfx950,256,1664,64,7168,False,torch.bfloat16,torch.bfloat16,False,False,flydsl,3243,7,11.574,flydsl_hgemm_abf16_wbf16_bf16_t64x64x256x2_ks7_w2x2x1_bias0_ktail0_gm0_pht_gfx950,0.0194,131.91,2158.77
gfx950,256,1728,64,4096,False,torch.bfloat16,torch.bfloat16,False,False,flydsl,2787,8,9.4538,flydsl_hgemm_abf16_wbf16_bf16_t64x64x256x2_ks8_w2x2x1_bias0_ktail0_gm0_pht_gfx950,0.0193,95.83,1576.22
gfx950,256,1728,64,7168,False,torch.bfloat16,torch.bfloat16,False,False,flydsl,3403,7,11.4594,flydsl_hgemm_abf16_wbf16_bf16_t64x64x256x2_ks7_w2x2x1_bias0_ktail0_gm0_pht_gfx950,0.0198,138.35,2261.14
gfx950,256,1792,64,4096,False,torch.bfloat16,torch.bfloat16,False,False,flydsl,2787,8,9.502,flydsl_hgemm_abf16_wbf16_bf16_t64x64x256x2_ks8_w2x2x1_bias0_ktail0_gm0_pht_gfx950,0.0199,98.88,1624.26
gfx950,256,1792,64,7168,False,torch.bfloat16,torch.bfloat16,False,False,flydsl,3403,7,11.5816,flydsl_hgemm_abf16_wbf16_bf16_t64x64x256x2_ks7_w2x2x1_bias0_ktail0_gm0_pht_gfx950,0.0197,141.96,2317.21
gfx950,256,1856,64,4096,False,torch.bfloat16,torch.bfloat16,False,False,flydsl,1568,4,9.8161,flydsl_hgemm_abf16_wbf16_bf16_t32x64x64x5_ks4_w1x4x1_bias0_ktail0_gm0_pft_gfx950,0.0124,99.13,1626.53
gfx950,256,1856,64,7168,False,torch.bfloat16,torch.bfloat16,False,False,flydsl,3245,7,11.9978,flydsl_hgemm_abf16_wbf16_bf16_t64x64x256x2_ks7_w2x2x1_bias0_ktail0_gm4_pht_gfx950,0.0192,141.93,2313.98
gfx950,256,1920,64,4096,False,torch.bfloat16,torch.bfloat16,False,False,flydsl,1072,4,9.881,flydsl_hgemm_abf16_wbf16_bf16_t32x64x128x4_ks4_w1x4x1_bias0_ktail0_gm0_pft_gfx950,0.0122,101.88,1669.74
gfx950,256,1920,64,7168,False,torch.bfloat16,torch.bfloat16,False,False,flydsl,3243,7,12.1368,flydsl_hgemm_abf16_wbf16_bf16_t64x64x256x2_ks7_w2x2x1_bias0_ktail0_gm0_pht_gfx950,0.0196,145.15,2363.75
gfx950,256,1984,64,4096,False,torch.bfloat16,torch.bfloat16,False,False,flydsl,2787,8,10.1312,flydsl_hgemm_abf16_wbf16_bf16_t64x64x256x2_ks8_w2x2x1_bias0_ktail0_gm0_pht_gfx950,0.0194,102.67,1681.06
gfx950,256,1984,64,7168,False,torch.bfloat16,torch.bfloat16,False,False,flydsl,3403,7,12.1898,flydsl_hgemm_abf16_wbf16_bf16_t64x64x256x2_ks7_w2x2x1_bias0_ktail0_gm0_pht_gfx950,0.0191,149.33,2429.41
gfx950,256,2048,64,4096,False,torch.bfloat16,torch.bfloat16,False,False,torch,0,0,10.1982,native,0.0,105.29,1722.23
gfx950,256,2048,64,7168,False,torch.bfloat16,torch.bfloat16,False,False,flydsl,3403,7,12.1266,flydsl_hgemm_abf16_wbf16_bf16_t64x64x256x2_ks7_w2x2x1_bias0_ktail0_gm0_pht_gfx950,0.0196,154.95,2518.41
gfx950,256,4096,64,4096,False,torch.bfloat16,torch.bfloat16,False,False,flydsl,2757,4,12.8531,flydsl_hgemm_abf16_wbf16_bf16_t64x64x256x2_ks4_w2x2x1_bias0_ktail0_gm0_pht_gfx950,0.0116,167.08,2692.19
gfx950,256,4096,64,7168,False,torch.bfloat16,torch.bfloat16,False,False,asm,8,5,18.6588,_ZN5aiter39bf16gemm_fp32bf16_tn_96x64_splitk_cleanE,0.0158,201.41,3224.33
gfx950,256,6144,64,4096,False,torch.bfloat16,torch.bfloat16,False,False,torch,0,0,15.5544,native,0.0,207.09,3320.11
gfx950,256,6144,64,7168,False,torch.bfloat16,torch.bfloat16,False,False,asm,8,4,22.8054,_ZN5aiter39bf16gemm_fp32bf16_tn_96x64_splitk_cleanE,0.0136,247.18,3936.98
gfx950,256,8192,64,4096,False,torch.bfloat16,torch.bfloat16,False,False,flydsl,873,1,17.1646,flydsl_hgemm_abf16_wbf16_bf16_t32x64x128x4_ks1_w1x2x2_bias0_ktail0_gm4_pft_gfx950,0.0049,250.22,4001.36
gfx950,256,8192,64,7168,False,torch.bfloat16,torch.bfloat16,False,False,flydsl,2703,2,26.9552,flydsl_hgemm_abf16_wbf16_bf16_t64x64x256x2_ks2_w2x2x1_bias0_ktail0_gm0_pht_gfx950,0.006,278.84,4429.82
gfx950,256,10240,64,4096,False,torch.bfloat16,torch.bfloat16,False,False,torch,0,0,19.9896,native,0.0,268.58,4288.28
gfx950,256,10240,64,7168,False,torch.bfloat16,torch.bfloat16,False,False,torch,0,0,32.0175,native,0.0,293.44,4654.61
gfx950,256,12288,64,4096,False,torch.bfloat16,torch.bfloat16,False,False,torch,0,0,23.0421,native,0.0,279.59,4459.68
gfx950,256,12288,64,7168,False,torch.bfloat16,torch.bfloat16,False,False,flydsl,1365,1,37.7238,flydsl_hgemm_abf16_wbf16_bf16_t48x64x64x7_ks1_w1x2x1_bias0_ktail0_gm4_pft_gfx950,0.0,298.86,4735.77
gfx950,256,14336,64,4096,False,torch.bfloat16,torch.bfloat16,False,False,flydsl,1288,1,26.2663,flydsl_hgemm_abf16_wbf16_bf16_t64x64x128x4_ks1_w2x2x2_bias0_ktail0_gm0_pft_gfx950,0.0049,286.15,4560.97
gfx950,256,14336,64,7168,False,torch.bfloat16,torch.bfloat16,False,False,flydsl,1338,1,42.8455,flydsl_hgemm_abf16_wbf16_bf16_t64x64x128x3_ks1_w2x2x2_bias0_ktail0_gm0_pft_gfx950,0.0059,306.99,4861.03
gfx950,256,16384,64,4096,False,torch.bfloat16,torch.bfloat16,False,False,flydsl,1497,1,28.8814,flydsl_hgemm_abf16_wbf16_bf16_t64x64x256x2_ks1_w2x2x1_bias0_ktail0_gm0_pht_gfx950,0.0,297.42,4737.97
gfx950,256,16384,64,7168,False,torch.bfloat16,torch.bfloat16,False,False,flydsl,1552,1,45.0395,flydsl_hgemm_abf16_wbf16_bf16_t64x64x128x5_ks1_w2x2x2_bias0_ktail0_gm0_pft_gfx950,0.006,333.76,5281.93
gfx950,256,32768,64,7168,False,torch.bfloat16,torch.bfloat16,False,False,flydsl,394,1,79.9153,flydsl_hgemm_abf16_wbf16_bf16_t128x64x64x5_ks1_w4x1x1_bias0_ktail0_gm0_pft_gfx950,0.0,376.21,5942.21
gfx950,256,16,256,4096,False,torch.bfloat16,torch.bfloat16,False,False,flydsl,266,8,4.5853,flydsl_hgemm_abf16_wbf16_bf16_t16x64x64x8_ks8_w1x1x2_bias0_ktail0_gm0_pft_gfx950,0.0244,7.32,487.74
gfx950,256,32,256,4096,False,torch.bfloat16,torch.bfloat16,False,False,flydsl,584,8,4.7915,flydsl_hgemm_abf16_wbf16_bf16_t32x64x128x3_ks8_w1x4x1_bias0_ktail0_gm0_pft_gfx950,0.0188,14.01,495.81
gfx950,256,48,256,4096,False,torch.bfloat16,torch.bfloat16,False,False,flydsl,127,8,5.0163,flydsl_hgemm_abf16_wbf16_bf16_t16x64x128x5_ks8_w1x2x1_bias0_ktail0_gm0_pft_gfx950,0.0202,20.07,501.35
gfx950,256,64,256,4096,False,torch.bfloat16,torch.bfloat16,False,False,flydsl,864,8,5.3711,flydsl_hgemm_abf16_wbf16_bf16_t32x64x64x5_ks8_w1x4x1_bias0_ktail0_gm0_pft_gfx950,0.0189,24.99,494.16
gfx950,256,80,256,4096,False,torch.bfloat16,torch.bfloat16,False,False,flydsl,243,8,5.9071,flydsl_hgemm_abf16_wbf16_bf16_t16x64x64x6_ks8_w1x2x1_bias0_ktail0_gm0_pft_gfx950,0.0202,28.4,472.9
gfx950,256,96,256,4096,False,torch.bfloat16,torch.bfloat16,False,False,flydsl,928,8,6.031,flydsl_hgemm_abf16_wbf16_bf16_t32x64x64x7_ks8_w1x4x1_bias0_ktail0_gm0_pft_gfx950,0.0202,33.38,486.28
gfx950,256,112,256,4096,False,torch.bfloat16,torch.bfloat16,False,False,flydsl,539,8,6.3127,flydsl_hgemm_abf16_wbf16_bf16_t16x64x128x5_ks8_w1x2x1_bias0_ktail0_gm0_pft_gfx950,0.019,37.21,486.64
gfx950,256,128,256,4096,False,torch.bfloat16,torch.bfloat16,False,False,flydsl,563,4,6.5999,flydsl_hgemm_abf16_wbf16_bf16_t16x64x128x5_ks4_w1x1x2_bias0_ktail0_gm0_pft_gfx950,0.019,40.67,486.56
gfx950,256,144,256,4096,False,torch.bfloat16,torch.bfloat16,False,False,flydsl,111,4,6.7797,flydsl_hgemm_abf16_wbf16_bf16_t16x64x128x4_ks4_w1x1x2_bias0_ktail0_gm0_pft_gfx950,0.02,44.54,494.2
gfx950,256,160,256,4096,False,torch.bfloat16,torch.bfloat16,False,False,flydsl,140,4,7.0453,flydsl_hgemm_abf16_wbf16_bf16_t16x64x128x7_ks4_w1x1x2_bias0_ktail0_gm0_pft_gfx950,0.0192,47.63,495.34
gfx950,256,176,256,4096,False,torch.bfloat16,torch.bfloat16,False,False,flydsl,123,4,6.9942,flydsl_hgemm_abf16_wbf16_bf16_t16x64x128x5_ks4_w1x1x2_bias0_ktail0_gm0_pft_gfx950,0.0189,52.77,518.87
gfx950,256,192,256,4096,False,torch.bfloat16,torch.bfloat16,False,False,flydsl,132,4,7.1248,flydsl_hgemm_abf16_wbf16_bf16_t16x64x128x6_ks4_w1x1x2_bias0_ktail0_gm0_pft_gfx950,0.0192,56.51,528.9
gfx950,256,208,256,4096,False,torch.bfloat16,torch.bfloat16,False,False,flydsl,123,4,7.3498,flydsl_hgemm_abf16_wbf16_bf16_t16x64x128x5_ks4_w1x1x2_bias0_ktail0_gm0_pft_gfx950,0.0189,59.35,531.66
gfx950,256,224,256,4096,False,torch.bfloat16,torch.bfloat16,False,False,flydsl,123,4,7.4974,flydsl_hgemm_abf16_wbf16_bf16_t16x64x128x5_ks4_w1x1x2_bias0_ktail0_gm0_pft_gfx950,0.0195,62.66,539.77
gfx950,256,240,256,4096,False,torch.bfloat16,torch.bfloat16,False,False,flydsl,123,4,7.6936,flydsl_hgemm_abf16_wbf16_bf16_t16x64x128x5_ks4_w1x1x2_bias0_ktail0_gm0_pft_gfx950,0.019,65.42,544.1
gfx950,256,256,256,4096,False,torch.bfloat16,torch.bfloat16,False,False,flydsl,535,4,7.7459,flydsl_hgemm_abf16_wbf16_bf16_t16x64x128x5_ks4_w1x1x2_bias0_ktail0_gm0_pft_gfx950,0.0188,69.31,558.41
gfx950,256,288,256,4096,False,torch.bfloat16,torch.bfloat16,False,False,flydsl,1776,4,8.2094,flydsl_hgemm_abf16_wbf16_bf16_t32x64x64x6_ks4_w1x4x1_bias0_ktail0_gm0_pft_gfx950,0.0115,73.57,560.81
gfx950,256,320,256,4096,False,torch.bfloat16,torch.bfloat16,False,False,flydsl,1216,4,8.3461,flydsl_hgemm_abf16_wbf16_bf16_t32x64x128x4_ks4_w1x4x1_bias0_ktail0_gm0_pft_gfx950,0.0118,80.41,585.0
gfx950,256,352,256,4096,False,torch.bfloat16,torch.bfloat16,False,False,flydsl,1718,4,8.7926,flydsl_hgemm_abf16_wbf16_bf16_t32x64x64x5_ks4_w2x2x1_bias0_ktail0_gm0_pft_gfx950,0.0117,83.96,586.97
gfx950,256,384,256,4096,False,torch.bfloat16,torch.bfloat16,False,False,flydsl,2104,4,8.8715,flydsl_hgemm_abf16_wbf16_bf16_t32x64x128x4_ks4_w1x4x1_bias0_ktail0_gm0_pft_gfx950,0.0116,90.77,613.14
gfx950,256,416,256,4096,False,torch.bfloat16,torch.bfloat16,False,False,flydsl,1840,4,9.5587,flydsl_hgemm_abf16_wbf16_bf16_t32x64x64x7_ks4_w1x4x1_bias0_ktail0_gm0_pft_gfx950,0.0114,91.27,598.2
gfx950,256,448,256,4096,False,torch.bfloat16,torch.bfloat16,False,False,flydsl,3179,8,9.4702,flydsl_hgemm_abf16_wbf16_bf16_t64x64x256x2_ks8_w2x2x1_bias0_ktail0_gm0_pht_gfx950,0.0188,99.21,633.2
gfx950,256,480,256,4096,False,torch.bfloat16,torch.bfloat16,False,False,flydsl,260,2,10.006,flydsl_hgemm_abf16_wbf16_bf16_t16x64x128x6_ks2_w1x1x2_bias0_ktail0_gm0_pft_gfx950,0.0122,100.6,627.13
gfx950,256,512,256,4096,False,torch.bfloat16,torch.bfloat16,False,False,flydsl,2880,4,10.032,flydsl_hgemm_abf16_wbf16_bf16_t32x64x64x6_ks4_w1x4x1_bias0_ktail0_gm0_pft_gfx950,0.0119,107.03,653.27
gfx950,256,544,256,4096,False,torch.bfloat16,torch.bfloat16,False,False,flydsl,1260,2,10.987,flydsl_hgemm_abf16_wbf16_bf16_t32x64x128x5_ks2_w1x4x1_bias0_ktail0_gm0_pft_gfx950,0.0048,103.84,621.84
gfx950,256,576,256,4096,False,torch.bfloat16,torch.bfloat16,False,False,flydsl,3533,4,10.4404,flydsl_hgemm_abf16_wbf16_bf16_t64x64x256x2_ks4_w2x2x1_bias0_ktail0_gm0_pht_gfx950,0.012,115.7,681.07
gfx950,256,608,256,4096,False,torch.bfloat16,torch.bfloat16,False,False,flydsl,4421,4,10.6139,flydsl_hgemm_abf16_wbf16_bf16_t64x64x256x2_ks4_w2x2x1_bias0_ktail0_gm0_pht_gfx950,0.012,120.13,696.18
gfx950,256,640,256,4096,False,torch.bfloat16,torch.bfloat16,False,False,flydsl,4421,4,10.8095,flydsl_hgemm_abf16_wbf16_bf16_t64x64x256x2_ks4_w2x2x1_bias0_ktail0_gm0_pht_gfx950,0.0118,124.17,709.35
gfx950,256,672,256,4096,False,torch.bfloat16,torch.bfloat16,False,False,flydsl,3533,4,10.875,flydsl_hgemm_abf16_wbf16_bf16_t64x64x256x2_ks4_w2x2x1_bias0_ktail0_gm0_pht_gfx950,0.0119,129.59,730.69
gfx950,256,704,256,4096,False,torch.bfloat16,torch.bfloat16,False,False,flydsl,3533,4,10.9757,flydsl_hgemm_abf16_wbf16_bf16_t64x64x256x2_ks4_w2x2x1_bias0_ktail0_gm0_pht_gfx950,0.0119,134.51,749.36
gfx950,256,736,256,4096,False,torch.bfloat16,torch.bfloat16,False,False,flydsl,4637,4,11.1603,flydsl_hgemm_abf16_wbf16_bf16_t64x64x256x2_ks4_w2x2x1_bias0_ktail0_gm0_pht_gfx950,0.0118,138.3,761.92
gfx950,256,768,256,4096,False,torch.bfloat16,torch.bfloat16,False,False,flydsl,4637,4,11.3203,flydsl_hgemm_abf16_wbf16_bf16_t64x64x256x2_ks4_w2x2x1_bias0_ktail0_gm0_pht_gfx950,0.012,142.28,775.76
gfx950,256,800,256,4096,False,torch.bfloat16,torch.bfloat16,False,False,flydsl,3533,4,11.4884,flydsl_hgemm_abf16_wbf16_bf16_t64x64x256x2_ks4_w2x2x1_bias0_ktail0_gm0_pht_gfx950,0.0119,146.04,788.65
gfx950,256,832,256,4096,False,torch.bfloat16,torch.bfloat16,False,False,flydsl,3533,4,11.5291,flydsl_hgemm_abf16_wbf16_bf16_t64x64x256x2_ks4_w2x2x1_bias0_ktail0_gm0_pht_gfx950,0.0117,151.34,810.03
gfx950,256,864,256,4096,False,torch.bfloat16,torch.bfloat16,False,False,flydsl,4421,4,11.7698,flydsl_hgemm_abf16_wbf16_bf16_t64x64x256x2_ks4_w2x2x1_bias0_ktail0_gm0_pht_gfx950,0.0117,153.95,817.13
gfx950,256,896,256,4096,False,torch.bfloat16,torch.bfloat16,False,False,flydsl,4421,4,12.0032,flydsl_hgemm_abf16_wbf16_bf16_t64x64x256x2_ks4_w2x2x1_bias0_ktail0_gm0_pht_gfx950,0.0116,156.55,824.44
gfx950,256,928,256,4096,False,torch.bfloat16,torch.bfloat16,False,False,flydsl,3533,4,11.942,flydsl_hgemm_abf16_wbf16_bf16_t64x64x256x2_ks4_w2x2x1_bias0_ktail0_gm0_pht_gfx950,0.0118,162.97,851.99
gfx950,256,960,256,4096,False,torch.bfloat16,torch.bfloat16,False,False,flydsl,3533,4,12.2848,flydsl_hgemm_abf16_wbf16_bf16_t64x64x256x2_ks4_w2x2x1_bias0_ktail0_gm0_pht_gfx950,0.0119,163.88,850.89
gfx950,256,992,256,4096,False,torch.bfloat16,torch.bfloat16,False,False,flydsl,2364,2,12.5267,flydsl_hgemm_abf16_wbf16_bf16_t32x64x128x5_ks2_w1x4x1_bias0_ktail0_gm0_pft_gfx950,0.0047,166.08,856.69
gfx950,256,1024,256,4096,False,torch.bfloat16,torch.bfloat16,False,False,asm,7,4,12.3977,_ZN5aiter39bf16gemm_fp32bf16_tn_80x64_splitk_cleanE,0.0116,173.22,888.07
gfx950,256,1088,256,4096,False,torch.bfloat16,torch.bfloat16,False,False,asm,7,4,12.5792,_ZN5aiter39bf16gemm_fp32bf16_tn_80x64_splitk_cleanE,0.012,181.39,919.54
gfx950,256,1152,256,4096,False,torch.bfloat16,torch.bfloat16,False,False,asm,7,4,12.7987,_ZN5aiter39bf16gemm_fp32bf16_tn_80x64_splitk_cleanE,0.0119,188.76,947.3
gfx950,256,1216,256,4096,False,torch.bfloat16,torch.bfloat16,False,False,asm,7,4,13.2216,_ZN5aiter39bf16gemm_fp32bf16_tn_80x64_splitk_cleanE,0.012,192.88,959.13
gfx950,256,1280,256,4096,False,torch.bfloat16,torch.bfloat16,False,False,asm,7,4,13.3527,_ZN5aiter39bf16gemm_fp32bf16_tn_80x64_splitk_cleanE,0.012,201.03,991.43
gfx950,256,1344,256,4096,False,torch.bfloat16,torch.bfloat16,False,False,asm,5,3,13.4846,_ZN5aiter39bf16gemm_fp32bf16_tn_64x64_splitk_cleanE,0.009,209.02,1023.04
gfx950,256,1408,256,4096,False,torch.bfloat16,torch.bfloat16,False,False,asm,7,3,14.0324,_ZN5aiter39bf16gemm_fp32bf16_tn_80x64_splitk_cleanE,0.0089,210.43,1022.8
gfx950,256,1472,256,4096,False,torch.bfloat16,torch.bfloat16,False,False,torch,0,0,14.1497,native,0.0,218.17,1053.69
gfx950,256,1536,256,4096,False,torch.bfloat16,torch.bfloat16,False,False,asm,7,3,14.2239,_ZN5aiter39bf16gemm_fp32bf16_tn_80x64_splitk_cleanE,0.0089,226.47,1087.36
gfx950,256,1600,256,4096,False,torch.bfloat16,torch.bfloat16,False,False,asm,7,3,14.4996,_ZN5aiter39bf16gemm_fp32bf16_tn_80x64_splitk_cleanE,0.0091,231.42,1105.1
gfx950,256,1664,256,4096,False,torch.bfloat16,torch.bfloat16,False,False,asm,7,3,14.593,_ZN5aiter39bf16gemm_fp32bf16_tn_80x64_splitk_cleanE,0.0092,239.13,1136.2
gfx950,256,1728,256,4096,False,torch.bfloat16,torch.bfloat16,False,False,asm,8,3,15.361,_ZN5aiter39bf16gemm_fp32bf16_tn_96x64_splitk_cleanE,0.0092,235.91,1115.66
gfx950,256,1792,256,4096,False,torch.bfloat16,torch.bfloat16,False,False,asm,8,3,15.658,_ZN5aiter39bf16gemm_fp32bf16_tn_96x64_splitk_cleanE,0.009,240.01,1130.08
gfx950,256,1856,256,4096,False,torch.bfloat16,torch.bfloat16,False,False,asm,8,3,15.4258,_ZN5aiter39bf16gemm_fp32bf16_tn_96x64_splitk_cleanE,0.009,252.32,1183.2
gfx950,256,1920,256,4096,False,torch.bfloat16,torch.bfloat16,False,False,asm,8,3,15.8119,_ZN5aiter39bf16gemm_fp32bf16_tn_96x64_splitk_cleanE,0.0091,254.65,1189.54
gfx950,256,1984,256,4096,False,torch.bfloat16,torch.bfloat16,False,False,torch,0,0,16.7836,native,0.0,247.91,1153.86
gfx950,256,2048,256,4096,False,torch.bfloat16,torch.bfloat16,False,False,flydsl,2057,1,14.6838,flydsl_hgemm_abf16_wbf16_bf16_t32x64x128x5_ks1_w1x4x1_bias0_ktail0_gm4_pft_gfx950,0.0,292.5,1356.8
gfx950,256,4096,256,4096,False,torch.bfloat16,torch.bfloat16,False,False,flydsl,3165,1,19.3992,flydsl_hgemm_abf16_wbf16_bf16_t64x64x128x5_ks1_w4x1x2_bias0_ktail0_gm4_pft_gfx950,0.0048,442.8,1945.89
gfx950,256,6144,256,4096,False,torch.bfloat16,torch.bfloat16,False,False,flydsl,2905,1,25.0498,flydsl_hgemm_abf16_wbf16_bf16_t96x64x128x3_ks1_w2x1x2_bias0_ktail0_gm4_pft_gfx950,0.0048,514.37,2218.56
gfx950,256,8192,256,4096,False,torch.bfloat16,torch.bfloat16,False,False,flydsl,1851,1,29.8014,flydsl_hgemm_abf16_wbf16_bf16_t64x128x128x3_ks1_w2x2x2_bias0_ktail0_gm4_pft_gfx950,0.0049,576.48,2462.98
gfx950,256,10240,256,4096,False,torch.bfloat16,torch.bfloat16,False,False,torch,0,0,38.6323,native,0.0,555.88,2361.39
gfx950,256,12288,256,4096,False,torch.bfloat16,torch.bfloat16,False,False,flydsl,1981,1,41.1383,flydsl_hgemm_abf16_wbf16_bf16_t96x128x64x4_ks1_w2x2x1_bias0_ktail0_gm4_pft_gfx950,0.0,626.42,2650.86
gfx950,256,14336,256,4096,False,torch.bfloat16,torch.bfloat16,False,False,flydsl,7,1,47.2645,flydsl_hgemm_abf16_wbf16_bf16_t128x128x128x2_ks1_w2x4x1_bias0_ktail0_gm0_pht_gfx950,0.0,636.1,2684.42
gfx950,256,16384,256,4096,False,torch.bfloat16,torch.bfloat16,False,False,flydsl,9,1,48.9932,flydsl_hgemm_abf16_wbf16_bf16_t128x128x128x2_ks1_w2x4x1_bias0_ktail0_gm4_pht_gfx950,0.0,701.32,2953.54
gfx950,256,1,384,7168,False,torch.bfloat16,torch.bfloat16,False,False,flydsl,304,8,6.1127,flydsl_hgemm_abf16_wbf16_bf16_t16x64x64x6_ks8_w1x2x1_bias0_ktail0_gm0_pft_gfx950,0.0104,0.9,903.06
gfx950,256,2,384,7168,False,torch.bfloat16,torch.bfloat16,False,False,flydsl,304,8,6.0274,flydsl_hgemm_abf16_wbf16_bf16_t16x64x64x6_ks8_w1x2x1_bias0_ktail0_gm0_pft_gfx950,0.0156,1.83,918.34
gfx950,256,4,384,7168,False,torch.bfloat16,torch.bfloat16,False,False,flydsl,169,8,6.1294,flydsl_hgemm_abf16_wbf16_bf16_t16x64x128x6_ks8_w1x2x1_bias0_ktail0_gm0_pft_gfx950,0.0228,3.59,907.99
gfx950,256,96,384,7168,False,torch.bfloat16,torch.bfloat16,False,False,flydsl,728,7,8.6538,flydsl_hgemm_abf16_wbf16_bf16_t32x64x128x4_ks7_w1x4x1_bias0_ktail0_gm0_pft_gfx950,0.02,61.07,803.69
gfx950,256,144,384,7168,False,torch.bfloat16,torch.bfloat16,False,False,flydsl,130,4,10.0163,flydsl_hgemm_abf16_wbf16_bf16_t16x64x128x4_ks4_w1x2x1_bias0_ktail0_gm0_pft_gfx950,0.0143,79.14,766.75
gfx950,256,160,384,7168,False,torch.bfloat16,torch.bfloat16,False,False,flydsl,156,4,10.2927,flydsl_hgemm_abf16_wbf16_bf16_t16x64x128x6_ks4_w1x1x2_bias0_ktail0_gm0_pft_gfx950,0.0213,85.58,769.64
gfx950,256,192,384,7168,False,torch.bfloat16,torch.bfloat16,False,False,flydsl,702,4,11.0743,flydsl_hgemm_abf16_wbf16_bf16_t32x64x128x4_ks4_w1x4x1_bias0_ktail0_gm0_pft_gfx950,0.0143,95.44,758.96
gfx950,256,208,384,7168,False,torch.bfloat16,torch.bfloat16,False,False,flydsl,115,4,12.3419,flydsl_hgemm_abf16_wbf16_bf16_t16x64x128x3_ks4_w1x2x1_bias0_ktail0_gm0_pft_gfx950,0.0145,92.78,700.59
gfx950,256,256,384,7168,False,torch.bfloat16,torch.bfloat16,False,False,flydsl,1322,4,11.9321,flydsl_hgemm_abf16_wbf16_bf16_t32x64x128x4_ks4_w1x4x1_bias0_ktail0_gm0_pft_gfx950,0.0142,118.11,785.41
gfx950,256,288,384,7168,False,torch.bfloat16,torch.bfloat16,False,False,flydsl,2072,4,12.3883,flydsl_hgemm_abf16_wbf16_bf16_t32x64x64x6_ks4_w1x4x1_bias0_ktail0_gm0_pft_gfx950,0.0139,127.98,795.51
gfx950,256,352,384,7168,False,torch.bfloat16,torch.bfloat16,False,False,asm,7,6,14.3838,_ZN5aiter39bf16gemm_fp32bf16_tn_80x64_splitk_cleanE,0.0186,134.72,752.35
gfx950,256,384,384,7168,False,torch.bfloat16,torch.bfloat16,False,False,flydsl,5331,7,13.8258,flydsl_hgemm_abf16_wbf16_bf16_t64x64x256x2_ks7_w2x2x1_bias0_ktail0_gm0_pht_gfx950,0.0201,152.9,817.67
gfx950,256,416,384,7168,False,torch.bfloat16,torch.bfloat16,False,False,asm,5,5,14.7587,_ZN5aiter39bf16gemm_fp32bf16_tn_64x64_splitk_cleanE,0.0163,155.17,798.73
gfx950,256,480,384,7168,False,torch.bfloat16,torch.bfloat16,False,False,flydsl,1916,4,15.194,flydsl_hgemm_abf16_wbf16_bf16_t32x64x64x5_ks4_w2x2x1_bias0_ktail0_gm0_pft_gfx950,0.0138,173.91,839.47
gfx950,256,544,384,7168,False,torch.bfloat16,torch.bfloat16,False,False,asm,7,5,15.83,_ZN5aiter39bf16gemm_fp32bf16_tn_80x64_splitk_cleanE,0.0162,189.18,866.81
gfx950,256,576,384,7168,False,torch.bfloat16,torch.bfloat16,False,False,flydsl,2935,7,16.2449,flydsl_hgemm_abf16_wbf16_bf16_t64x128x128x2_ks7_w2x4x1_bias0_ktail0_gm0_pht_gfx950,0.0197,195.19,874.42
gfx950,256,608,384,7168,False,torch.bfloat16,torch.bfloat16,False,False,flydsl,2482,2,16.3941,flydsl_hgemm_abf16_wbf16_bf16_t32x64x128x5_ks2_w1x4x1_bias0_ktail0_gm0_pft_gfx950,0.0059,204.16,895.95
gfx950,256,640,384,7168,False,torch.bfloat16,torch.bfloat16,False,False,flydsl,4669,4,16.6814,flydsl_hgemm_abf16_wbf16_bf16_t64x64x128x2_ks4_w2x2x1_bias0_ktail0_gm0_pht_gfx950,0.0135,211.21,909.49
gfx950,256,672,384,7168,False,torch.bfloat16,torch.bfloat16,False,False,asm,7,4,17.0835,_ZN5aiter39bf16gemm_fp32bf16_tn_80x64_splitk_cleanE,0.0136,216.55,916.38
gfx950,256,704,384,7168,False,torch.bfloat16,torch.bfloat16,False,False,asm,7,4,17.4349,_ZN5aiter39bf16gemm_fp32bf16_tn_80x64_splitk_cleanE,0.0134,222.29,925.63
gfx950,256,736,384,7168,False,torch.bfloat16,torch.bfloat16,False,False,asm,7,4,17.6916,_ZN5aiter39bf16gemm_fp32bf16_tn_80x64_splitk_cleanE,0.0137,229.02,939.52
gfx950,256,768,384,7168,False,torch.bfloat16,torch.bfloat16,False,False,asm,7,4,18.3084,_ZN5aiter39bf16gemm_fp32bf16_tn_80x64_splitk_cleanE,0.0135,230.92,934.26
gfx950,256,800,384,7168,False,torch.bfloat16,torch.bfloat16,False,False,asm,7,4,18.5277,_ZN5aiter39bf16gemm_fp32bf16_tn_80x64_splitk_cleanE,0.0135,237.7,949.29
gfx950,256,832,384,7168,False,torch.bfloat16,torch.bfloat16,False,False,asm,8,4,18.8981,_ZN5aiter39bf16gemm_fp32bf16_tn_96x64_splitk_cleanE,0.0135,242.36,956.26
gfx950,256,864,384,7168,False,torch.bfloat16,torch.bfloat16,False,False,asm,5,3,19.3497,_ZN5aiter39bf16gemm_fp32bf16_tn_64x64_splitk_cleanE,0.0105,245.81,958.92
gfx950,256,896,384,7168,False,torch.bfloat16,torch.bfloat16,False,False,asm,8,4,19.3709,_ZN5aiter39bf16gemm_fp32bf16_tn_96x64_splitk_cleanE,0.0137,254.63,982.83
gfx950,256,928,384,7168,False,torch.bfloat16,torch.bfloat16,False,False,asm,8,4,20.0927,_ZN5aiter39bf16gemm_fp32bf16_tn_96x64_splitk_cleanE,0.0137,254.25,971.57
gfx950,256,960,384,7168,False,torch.bfloat16,torch.bfloat16,False,False,asm,8,4,20.4662,_ZN5aiter39bf16gemm_fp32bf16_tn_96x64_splitk_cleanE,0.0136,258.22,977.46
gfx950,256,992,384,7168,False,torch.bfloat16,torch.bfloat16,False,False,asm,7,3,20.3578,_ZN5aiter39bf16gemm_fp32bf16_tn_80x64_splitk_cleanE,0.0104,268.25,1006.41
gfx950,256,1024,384,7168,False,torch.bfloat16,torch.bfloat16,False,False,asm,7,3,20.5687,_ZN5aiter39bf16gemm_fp32bf16_tn_80x64_splitk_cleanE,0.0104,274.06,1019.58
gfx950,256,1088,384,7168,False,torch.bfloat16,torch.bfloat16,False,False,torch,0,0,21.1462,native,0.0,283.24,1037.45
gfx950,256,1152,384,7168,False,torch.bfloat16,torch.bfloat16,False,False,torch,0,0,21.2237,native,0.0,298.81,1079.21
gfx950,256,1216,384,7168,False,torch.bfloat16,torch.bfloat16,False,False,flydsl,3635,4,22.8119,flydsl_hgemm_abf16_wbf16_bf16_t64x128x128x2_ks4_w2x4x1_bias0_ktail0_gm0_pht_gfx950,0.0133,293.45,1046.45
gfx950,256,1280,384,7168,False,torch.bfloat16,torch.bfloat16,False,False,flydsl,3635,4,23.2093,flydsl_hgemm_abf16_wbf16_bf16_t64x128x128x2_ks4_w2x4x1_bias0_ktail0_gm0_pht_gfx950,0.0132,303.6,1070.18
gfx950,256,1344,384,7168,False,torch.bfloat16,torch.bfloat16,False,False,flydsl,3395,4,23.7548,flydsl_hgemm_abf16_wbf16_bf16_t64x128x128x2_ks4_w2x4x1_bias0_ktail0_gm0_pht_gfx950,0.0134,311.46,1086.3
gfx950,256,1408,384,7168,False,torch.bfloat16,torch.bfloat16,False,False,torch,0,0,23.3694,native,0.0,331.68,1145.58
gfx950,256,1472,384,7168,False,torch.bfloat16,torch.bfloat16,False,False,torch,0,0,22.9713,native,0.0,352.76,1207.51
gfx950,256,1536,384,7168,False,torch.bfloat16,torch.bfloat16,False,False,torch,0,0,23.0827,native,0.0,366.32,1243.56
gfx950,256,1600,384,7168,False,torch.bfloat16,torch.bfloat16,False,False,torch,0,0,24.2097,native,0.0,363.82,1225.6
gfx950,256,1664,384,7168,False,torch.bfloat16,torch.bfloat16,False,False,torch,0,0,23.7434,native,0.0,385.81,1290.38
gfx950,256,1728,384,7168,False,torch.bfloat16,torch.bfloat16,False,False,flydsl,43,4,27.8789,flydsl_hgemm_abf16_wbf16_bf16_t128x128x128x2_ks4_w2x4x1_bias0_ktail0_gm0_pht_gfx950,0.0139,341.21,1133.64
gfx950,256,1792,384,7168,False,torch.bfloat16,torch.bfloat16,False,False,flydsl,43,4,29.0856,flydsl_hgemm_abf16_wbf16_bf16_t128x128x128x2_ks4_w2x4x1_bias0_ktail0_gm0_pht_gfx950,0.0135,339.17,1119.85
gfx950,256,1856,384,7168,False,torch.bfloat16,torch.bfloat16,False,False,flydsl,43,4,28.8276,flydsl_hgemm_abf16_wbf16_bf16_t128x128x128x2_ks4_w2x4x1_bias0_ktail0_gm0_pht_gfx950,0.0137,354.43,1163.4
gfx950,256,1920,384,7168,False,torch.bfloat16,torch.bfloat16,False,False,flydsl,43,4,29.9831,flydsl_hgemm_abf16_wbf16_bf16_t128x128x128x2_ks4_w2x4x1_bias0_ktail0_gm0_pht_gfx950,0.0136,352.52,1150.81
gfx950,256,1984,384,7168,False,torch.bfloat16,torch.bfloat16,False,False,flydsl,43,4,29.8476,flydsl_hgemm_abf16_wbf16_bf16_t128x128x128x2_ks4_w2x4x1_bias0_ktail0_gm0_pht_gfx950,0.0136,365.92,1188.42
gfx950,256,2048,384,7168,False,torch.bfloat16,torch.bfloat16,False,False,torch,0,0,27.8832,native,0.0,404.34,1306.81
gfx950,256,4096,384,7168,False,torch.bfloat16,torch.bfloat16,False,False,flydsl,2741,1,41.4897,flydsl_hgemm_abf16_wbf16_bf16_t64x96x128x4_ks1_w1x2x2_bias0_ktail0_gm4_pft_gfx950,0.0062,543.47,1623.8
gfx950,256,6144,384,7168,False,torch.bfloat16,torch.bfloat16,False,False,torch,0,0,53.2468,native,0.0,635.21,1846.2
gfx950,256,8192,384,7168,False,torch.bfloat16,torch.bfloat16,False,False,flydsl,481,1,66.1762,flydsl_hgemm_abf16_wbf16_bf16_t128x96x64x4_ks1_w2x2x1_bias0_ktail0_gm4_pft_gfx950,0.0,681.47,1952.92
gfx950,256,10240,384,7168,False,torch.bfloat16,torch.bfloat16,False,False,flydsl,1,1,78.0803,flydsl_hgemm_abf16_wbf16_bf16_t128x128x128x2_ks1_w2x2x1_bias0_ktail0_gm0_pht_gfx950,0.0,721.97,2051.35
gfx950,256,12288,384,7168,False,torch.bfloat16,torch.bfloat16,False,False,torch,0,0,80.0628,native,0.0,844.91,2386.91
gfx950,256,14336,384,7168,False,torch.bfloat16,torch.bfloat16,False,False,torch,0,0,89.5225,native,0.0,881.57,2480.23
gfx950,256,16384,384,7168,False,torch.bfloat16,torch.bfloat16,False,False,torch,0,0,99.3918,native,0.0,907.46,2545.17
gfx950,256,1,512,7168,False,torch.bfloat16,torch.bfloat16,False,False,flydsl,304,8,6.4058,flydsl_hgemm_abf16_wbf16_bf16_t16x64x64x6_ks8_w1x2x1_bias0_ktail0_gm0_pft_gfx950,0.0215,1.15,1148.24
gfx950,256,2,512,7168,False,torch.bfloat16,torch.bfloat16,False,False,flydsl,144,8,6.4246,flydsl_hgemm_abf16_wbf16_bf16_t16x64x128x4_ks8_w1x2x1_bias0_ktail0_gm0_pft_gfx950,0.0166,2.28,1147.27
gfx950,256,4,512,7168,False,torch.bfloat16,torch.bfloat16,False,False,flydsl,333,8,6.5183,flydsl_hgemm_abf16_wbf16_bf16_t16x64x64x8_ks8_w1x1x2_bias0_ktail0_gm0_pft_gfx950,0.0312,4.5,1135.49
gfx950,256,8,512,7168,False,torch.bfloat16,torch.bfloat16,False,False,flydsl,188,8,6.6487,flydsl_hgemm_abf16_wbf16_bf16_t16x64x128x8_ks8_w1x1x2_bias0_ktail0_gm0_pft_gfx950,0.0291,8.83,1122.46
gfx950,256,16,512,4096,False,torch.bfloat16,torch.bfloat16,False,False,flydsl,230,8,5.6959,flydsl_hgemm_abf16_wbf16_bf16_t16x64x64x5_ks8_w1x1x2_bias0_ktail0_gm0_pft_gfx950,0.0253,11.78,762.26
gfx950,256,16,512,7168,False,torch.bfloat16,torch.bfloat16,False,False,flydsl,334,8,6.8253,flydsl_hgemm_abf16_wbf16_bf16_t16x64x64x8_ks8_w1x2x1_bias0_ktail0_gm0_pft_gfx950,0.0229,17.21,1111.42
gfx950,256,32,512,4096,False,torch.bfloat16,torch.bfloat16,False,False,flydsl,896,8,5.8668,flydsl_hgemm_abf16_wbf16_bf16_t32x64x64x6_ks8_w1x4x1_bias0_ktail0_gm0_pft_gfx950,0.0184,22.88,765.19
gfx950,256,32,512,7168,False,torch.bfloat16,torch.bfloat16,False,False,flydsl,144,8,7.3328,flydsl_hgemm_abf16_wbf16_bf16_t16x64x128x4_ks8_w1x2x1_bias0_ktail0_gm0_pft_gfx950,0.0227,32.03,1068.02
gfx950,256,48,512,4096,False,torch.bfloat16,torch.bfloat16,False,False,flydsl,255,8,6.5356,flydsl_hgemm_abf16_wbf16_bf16_t16x64x64x7_ks8_w1x2x1_bias0_ktail0_gm0_pft_gfx950,0.0193,30.8,709.45
gfx950,256,48,512,7168,False,torch.bfloat16,torch.bfloat16,False,False,flydsl,144,8,7.6291,flydsl_hgemm_abf16_wbf16_bf16_t16x64x128x4_ks8_w1x2x1_bias0_ktail0_gm0_pft_gfx950,0.0209,46.18,1058.75
gfx950,256,64,512,4096,False,torch.bfloat16,torch.bfloat16,False,False,flydsl,896,8,6.8299,flydsl_hgemm_abf16_wbf16_bf16_t32x64x64x6_ks8_w1x4x1_bias0_ktail0_gm0_pft_gfx950,0.019,39.3,700.47
gfx950,256,64,512,7168,False,torch.bfloat16,torch.bfloat16,False,False,flydsl,140,7,8.0011,flydsl_hgemm_abf16_wbf16_bf16_t16x64x128x4_ks7_w1x1x2_bias0_ktail0_gm0_pft_gfx950,0.0283,58.71,1040.24
gfx950,256,80,512,4096,False,torch.bfloat16,torch.bfloat16,False,False,flydsl,240,4,7.1854,flydsl_hgemm_abf16_wbf16_bf16_t16x64x64x6_ks4_w1x2x1_bias0_ktail0_gm0_pft_gfx950,0.0124,46.7,686.33
gfx950,256,80,512,7168,False,torch.bfloat16,torch.bfloat16,False,False,flydsl,304,8,8.9459,flydsl_hgemm_abf16_wbf16_bf16_t16x64x64x6_ks8_w1x2x1_bias0_ktail0_gm0_pft_gfx950,0.021,65.64,957.85
gfx950,256,96,512,4096,False,torch.bfloat16,torch.bfloat16,False,False,flydsl,124,4,7.4302,flydsl_hgemm_abf16_wbf16_bf16_t16x64x128x5_ks4_w1x2x1_bias0_ktail0_gm0_pft_gfx950,0.0123,54.19,683.57
gfx950,256,96,512,7168,False,torch.bfloat16,torch.bfloat16,False,False,flydsl,763,7,8.8521,flydsl_hgemm_abf16_wbf16_bf16_t32x64x128x4_ks7_w1x4x1_bias0_ktail0_gm0_pft_gfx950,0.0204,79.6,995.76
gfx950,256,112,512,4096,False,torch.bfloat16,torch.bfloat16,False,False,flydsl,544,4,7.6745,flydsl_hgemm_abf16_wbf16_bf16_t16x64x128x6_ks4_w1x1x2_bias0_ktail0_gm0_pft_gfx950,0.0202,61.21,681.02
gfx950,256,112,512,7168,False,torch.bfloat16,torch.bfloat16,False,False,flydsl,1271,7,9.3347,flydsl_hgemm_abf16_wbf16_bf16_t32x64x128x4_ks7_w1x4x1_bias0_ktail0_gm0_pft_gfx950,0.0196,88.07,970.61
gfx950,256,128,512,4096,False,torch.bfloat16,torch.bfloat16,False,False,flydsl,1328,4,7.8985,flydsl_hgemm_abf16_wbf16_bf16_t32x64x64x6_ks4_w1x4x1_bias0_ktail0_gm0_pft_gfx950,0.0123,67.97,680.38
gfx950,256,128,512,7168,False,torch.bfloat16,torch.bfloat16,False,False,flydsl,1313,7,9.8187,flydsl_hgemm_abf16_wbf16_bf16_t32x64x128x4_ks7_w1x4x1_bias0_ktail0_gm0_pft_gfx950,0.0203,95.69,947.79
gfx950,256,144,512,4096,False,torch.bfloat16,torch.bfloat16,False,False,flydsl,264,4,8.709,flydsl_hgemm_abf16_wbf16_bf16_t16x64x64x8_ks4_w1x2x1_bias0_ktail0_gm0_pft_gfx950,0.0125,69.35,633.99
gfx950,256,144,512,7168,False,torch.bfloat16,torch.bfloat16,False,False,flydsl,522,7,11.0658,flydsl_hgemm_abf16_wbf16_bf16_t48x64x64x5_ks7_w1x2x1_bias0_ktail0_gm0_pft_gfx950,0.0203,95.52,863.19
gfx950,256,160,512,4096,False,torch.bfloat16,torch.bfloat16,False,False,flydsl,949,4,8.4238,flydsl_hgemm_abf16_wbf16_bf16_t32x64x64x8_ks4_w1x4x1_bias0_ktail0_gm0_pft_gfx950,0.0118,79.67,672.96
gfx950,256,160,512,7168,False,torch.bfloat16,torch.bfloat16,False,False,flydsl,737,4,11.0255,flydsl_hgemm_abf16_wbf16_bf16_t32x64x128x4_ks4_w1x4x1_bias0_ktail0_gm0_pft_gfx950,0.0144,106.52,888.63
gfx950,256,176,512,4096,False,torch.bfloat16,torch.bfloat16,False,False,flydsl,228,4,9.4331,flydsl_hgemm_abf16_wbf16_bf16_t16x64x64x5_ks4_w1x2x1_bias0_ktail0_gm0_pft_gfx950,0.0119,78.26,616.59
gfx950,256,176,512,7168,False,torch.bfloat16,torch.bfloat16,False,False,flydsl,272,4,13.1515,flydsl_hgemm_abf16_wbf16_bf16_t16x64x64x5_ks4_w1x2x1_bias0_ktail0_gm0_pft_gfx950,0.0145,98.23,763.67
gfx950,256,192,512,4096,False,torch.bfloat16,torch.bfloat16,False,False,flydsl,608,4,8.9332,flydsl_hgemm_abf16_wbf16_bf16_t32x64x128x4_ks4_w1x4x1_bias0_ktail0_gm0_pft_gfx950,0.0119,90.15,667.6
gfx950,256,192,512,7168,False,torch.bfloat16,torch.bfloat16,False,False,flydsl,774,4,11.1876,flydsl_hgemm_abf16_wbf16_bf16_t32x64x128x5_ks4_w1x4x1_bias0_ktail0_gm0_pft_gfx950,0.0144,125.97,919.69
gfx950,256,208,512,4096,False,torch.bfloat16,torch.bfloat16,False,False,flydsl,130,2,9.949,flydsl_hgemm_abf16_wbf16_bf16_t16x64x128x6_ks2_w1x1x2_bias0_ktail0_gm0_pft_gfx950,0.0122,87.69,614.26
gfx950,256,208,512,7168,False,torch.bfloat16,torch.bfloat16,False,False,flydsl,272,4,13.2716,flydsl_hgemm_abf16_wbf16_bf16_t16x64x64x5_ks4_w1x2x1_bias0_ktail0_gm0_pft_gfx950,0.0143,115.04,793.79
gfx950,256,224,512,4096,False,torch.bfloat16,torch.bfloat16,False,False,flydsl,891,4,9.4891,flydsl_hgemm_abf16_wbf16_bf16_t32x64x64x6_ks4_w2x2x1_bias0_ktail0_gm0_pft_gfx950,0.0117,99.01,659.57
gfx950,256,224,512,7168,False,torch.bfloat16,torch.bfloat16,False,False,flydsl,774,4,11.7659,flydsl_hgemm_abf16_wbf16_bf16_t32x64x128x5_ks4_w1x4x1_bias0_ktail0_gm0_pft_gfx950,0.0139,139.74,916.26
gfx950,256,240,512,4096,False,torch.bfloat16,torch.bfloat16,False,False,flydsl,130,2,10.1827,flydsl_hgemm_abf16_wbf16_bf16_t16x64x128x6_ks2_w1x1x2_bias0_ktail0_gm0_pft_gfx950,0.0124,98.86,629.12
gfx950,256,240,512,7168,False,torch.bfloat16,torch.bfloat16,False,False,flydsl,437,4,13.6367,flydsl_hgemm_abf16_wbf16_bf16_t48x64x128x4_ks4_w1x2x1_bias0_ktail0_gm0_pft_gfx950,0.0146,129.18,808.59
gfx950,256,256,512,4096,False,torch.bfloat16,torch.bfloat16,False,False,flydsl,1132,4,10.0211,flydsl_hgemm_abf16_wbf16_bf16_t32x64x128x5_ks4_w1x2x2_bias0_ktail0_gm0_pft_gfx950,0.0192,107.15,653.98
gfx950,256,256,512,7168,False,torch.bfloat16,torch.bfloat16,False,False,flydsl,1357,4,12.3697,flydsl_hgemm_abf16_wbf16_bf16_t32x64x128x4_ks4_w1x4x1_bias0_ktail0_gm0_pft_gfx950,0.0141,151.91,911.27
gfx950,256,288,512,4096,False,torch.bfloat16,torch.bfloat16,False,False,flydsl,1712,4,10.8041,flydsl_hgemm_abf16_wbf16_bf16_t32x64x64x5_ks4_w1x4x1_bias0_ktail0_gm0_pft_gfx950,0.0115,111.81,633.88
gfx950,256,288,512,7168,False,torch.bfloat16,torch.bfloat16,False,False,flydsl,2802,4,14.3451,flydsl_hgemm_abf16_wbf16_bf16_t48x64x64x6_ks4_w1x2x1_bias0_ktail0_gm0_pft_gfx950,0.0138,147.36,820.05
gfx950,256,320,512,4096,False,torch.bfloat16,torch.bfloat16,False,False,flydsl,3533,4,10.8694,flydsl_hgemm_abf16_wbf16_bf16_t64x64x256x2_ks4_w2x2x1_bias0_ktail0_gm0_pht_gfx950,0.0116,123.48,657.2
gfx950,256,320,512,7168,False,torch.bfloat16,torch.bfloat16,False,False,flydsl,2887,7,13.9081,flydsl_hgemm_abf16_wbf16_bf16_t64x128x128x2_ks7_w2x4x1_bias0_ktail0_gm0_pht_gfx950,0.0196,168.88,881.16
gfx950,256,352,512,4096,False,torch.bfloat16,torch.bfloat16,False,False,flydsl,1200,2,11.5681,flydsl_hgemm_abf16_wbf16_bf16_t32x64x128x4_ks2_w1x4x1_bias0_ktail0_gm0_pft_gfx950,0.0048,127.63,643.0
gfx950,256,352,512,7168,False,torch.bfloat16,torch.bfloat16,False,False,asm,7,6,14.7392,_ZN5aiter39bf16gemm_fp32bf16_tn_80x64_splitk_cleanE,0.0184,175.29,864.82
gfx950,256,384,512,4096,False,torch.bfloat16,torch.bfloat16,False,False,flydsl,4421,4,11.2096,flydsl_hgemm_abf16_wbf16_bf16_t64x64x256x2_ks4_w2x2x1_bias0_ktail0_gm0_pht_gfx950,0.0117,143.68,689.88
gfx950,256,384,512,7168,False,torch.bfloat16,torch.bfloat16,False,False,flydsl,3997,7,14.8416,flydsl_hgemm_abf16_wbf16_bf16_t64x128x128x2_ks7_w2x4x1_bias0_ktail0_gm0_pht_gfx950,0.0197,189.91,891.97
gfx950,256,416,512,4096,False,torch.bfloat16,torch.bfloat16,False,False,flydsl,1200,2,11.994,flydsl_hgemm_abf16_wbf16_bf16_t32x64x128x4_ks2_w1x4x1_bias0_ktail0_gm0_pft_gfx950,0.0049,145.48,669.35
gfx950,256,416,512,7168,False,torch.bfloat16,torch.bfloat16,False,False,asm,7,5,15.4965,_ZN5aiter39bf16gemm_fp32bf16_tn_80x64_splitk_cleanE,0.0161,197.04,885.99
gfx950,256,448,512,4096,False,torch.bfloat16,torch.bfloat16,False,False,flydsl,3149,4,11.8359,flydsl_hgemm_abf16_wbf16_bf16_t64x64x256x2_ks4_w2x2x1_bias0_ktail0_gm0_pht_gfx950,0.0118,158.76,703.21
gfx950,256,448,512,7168,False,torch.bfloat16,torch.bfloat16,False,False,flydsl,2413,7,15.5655,flydsl_hgemm_abf16_wbf16_bf16_t64x128x128x2_ks7_w2x4x1_bias0_ktail0_gm0_pht_gfx950,0.0198,211.26,913.64
gfx950,256,480,512,4096,False,torch.bfloat16,torch.bfloat16,False,False,asm,7,5,12.3644,_ZN5aiter39bf16gemm_fp32bf16_tn_80x64_splitk_cleanE,0.0141,162.83,697.0
gfx950,256,480,512,7168,False,torch.bfloat16,torch.bfloat16,False,False,asm,7,5,16.1918,_ZN5aiter39bf16gemm_fp32bf16_tn_80x64_splitk_cleanE,0.0162,217.59,908.66
gfx950,256,512,512,4096,False,torch.bfloat16,torch.bfloat16,False,False,flydsl,4637,4,12.4686,flydsl_hgemm_abf16_wbf16_bf16_t64x64x256x2_ks4_w2x2x1_bias0_ktail0_gm0_pht_gfx950,0.0117,172.23,714.83
gfx950,256,512,512,7168,False,torch.bfloat16,torch.bfloat16,False,False,asm,8,5,16.5417,_ZN5aiter39bf16gemm_fp32bf16_tn_96x64_splitk_cleanE,0.016,227.19,919.15
gfx950,256,544,512,4096,False,torch.bfloat16,torch.bfloat16,False,False,asm,8,5,12.7608,_ZN5aiter39bf16gemm_fp32bf16_tn_96x64_splitk_cleanE,0.0144,178.81,721.57
gfx950,256,544,512,7168,False,torch.bfloat16,torch.bfloat16,False,False,asm,8,5,16.9395,_ZN5aiter39bf16gemm_fp32bf16_tn_96x64_splitk_cleanE,0.016,235.72,926.58
gfx950,256,576,512,4096,False,torch.bfloat16,torch.bfloat16,False,False,asm,8,5,13.074,_ZN5aiter39bf16gemm_fp32bf16_tn_96x64_splitk_cleanE,0.0143,184.79,726.84
gfx950,256,576,512,7168,False,torch.bfloat16,torch.bfloat16,False,False,flydsl,2593,7,17.0753,flydsl_hgemm_abf16_wbf16_bf16_t64x128x128x2_ks7_w2x4x1_bias0_ktail0_gm0_pht_gfx950,0.0196,247.6,948.0
gfx950,256,608,512,4096,False,torch.bfloat16,torch.bfloat16,False,False,asm,7,4,13.1275,_ZN5aiter39bf16gemm_fp32bf16_tn_80x64_splitk_cleanE,0.0118,194.26,746.34
gfx950,256,608,512,7168,False,torch.bfloat16,torch.bfloat16,False,False,asm,7,4,17.787,_ZN5aiter39bf16gemm_fp32bf16_tn_80x64_splitk_cleanE,0.0134,250.9,937.7
gfx950,256,640,512,4096,False,torch.bfloat16,torch.bfloat16,False,False,asm,7,4,13.3789,_ZN5aiter39bf16gemm_fp32bf16_tn_80x64_splitk_cleanE,0.0118,200.64,754.36
gfx950,256,640,512,7168,False,torch.bfloat16,torch.bfloat16,False,False,asm,7,4,18.1216,_ZN5aiter39bf16gemm_fp32bf16_tn_80x64_splitk_cleanE,0.0135,259.23,947.51
gfx950,256,672,512,4096,False,torch.bfloat16,torch.bfloat16,False,False,asm,8,4,13.5736,_ZN5aiter39bf16gemm_fp32bf16_tn_96x64_splitk_cleanE,0.0118,207.65,765.27
gfx950,256,672,512,7168,False,torch.bfloat16,torch.bfloat16,False,False,asm,8,4,18.5795,_ZN5aiter39bf16gemm_fp32bf16_tn_96x64_splitk_cleanE,0.0134,265.48,950.62
gfx950,256,704,512,4096,False,torch.bfloat16,torch.bfloat16,False,False,asm,8,4,13.9867,_ZN5aiter39bf16gemm_fp32bf16_tn_96x64_splitk_cleanE,0.0119,211.11,763.75
gfx950,256,704,512,7168,False,torch.bfloat16,torch.bfloat16,False,False,asm,8,4,18.9602,_ZN5aiter39bf16gemm_fp32bf16_tn_96x64_splitk_cleanE,0.0135,272.54,957.45
gfx950,256,736,512,4096,False,torch.bfloat16,torch.bfloat16,False,False,asm,7,3,14.2642,_ZN5aiter39bf16gemm_fp32bf16_tn_80x64_splitk_cleanE,0.009,216.42,769.57
gfx950,256,736,512,7168,False,torch.bfloat16,torch.bfloat16,False,False,asm,8,4,19.3378,_ZN5aiter39bf16gemm_fp32bf16_tn_96x64_splitk_cleanE,0.0135,279.36,964.17
gfx950,256,768,512,4096,False,torch.bfloat16,torch.bfloat16,False,False,flydsl,1995,1,14.3551,flydsl_hgemm_abf16_wbf16_bf16_t32x64x128x4_ks1_w1x4x1_bias0_ktail0_gm4_pft_gfx950,0.0,224.4,785.24
gfx950,256,768,512,7168,False,torch.bfloat16,torch.bfloat16,False,False,asm,8,4,19.8659,_ZN5aiter39bf16gemm_fp32bf16_tn_96x64_splitk_cleanE,0.0135,283.76,963.28
gfx950,256,800,512,4096,False,torch.bfloat16,torch.bfloat16,False,False,flydsl,890,1,14.613,flydsl_hgemm_abf16_wbf16_bf16_t32x64x128x4_ks1_w1x4x1_bias0_ktail0_gm0_pft_gfx950,0.0,229.62,791.56
gfx950,256,800,512,7168,False,torch.bfloat16,torch.bfloat16,False,False,flydsl,2337,4,20.4923,flydsl_hgemm_abf16_wbf16_bf16_t64x128x128x2_ks4_w2x4x1_bias0_ktail0_gm4_pht_gfx950,0.0134,286.55,957.82
gfx950,256,832,512,4096,False,torch.bfloat16,torch.bfloat16,False,False,flydsl,952,1,14.5592,flydsl_hgemm_abf16_wbf16_bf16_t32x64x128x5_ks1_w1x4x1_bias0_ktail0_gm0_pft_gfx950,0.0,239.69,814.74
gfx950,256,832,512,7168,False,torch.bfloat16,torch.bfloat16,False,False,flydsl,2335,4,20.6084,flydsl_hgemm_abf16_wbf16_bf16_t64x128x128x2_ks4_w2x4x1_bias0_ktail0_gm0_pht_gfx950,0.0135,296.33,976.28
gfx950,256,864,512,4096,False,torch.bfloat16,torch.bfloat16,False,False,flydsl,1778,1,14.4565,flydsl_hgemm_abf16_wbf16_bf16_t32x64x128x4_ks1_w1x4x1_bias0_ktail0_gm0_pft_gfx950,0.0,250.67,840.93
gfx950,256,864,512,7168,False,torch.bfloat16,torch.bfloat16,False,False,flydsl,3447,4,20.9062,flydsl_hgemm_abf16_wbf16_bf16_t64x128x128x2_ks4_w2x4x1_bias0_ktail0_gm4_pht_gfx950,0.0134,303.34,985.88
gfx950,256,896,512,4096,False,torch.bfloat16,torch.bfloat16,False,False,flydsl,1778,1,14.6219,flydsl_hgemm_abf16_wbf16_bf16_t32x64x128x4_ks1_w1x4x1_bias0_ktail0_gm0_pft_gfx950,0.0,257.02,851.59
gfx950,256,896,512,7168,False,torch.bfloat16,torch.bfloat16,False,False,asm,8,3,21.282,_ZN5aiter39bf16gemm_fp32bf16_tn_96x64_splitk_cleanE,0.0104,309.02,991.57
gfx950,256,928,512,4096,False,torch.bfloat16,torch.bfloat16,False,False,flydsl,952,1,14.7218,flydsl_hgemm_abf16_wbf16_bf16_t32x64x128x5_ks1_w1x4x1_bias0_ktail0_gm0_pft_gfx950,0.0,264.39,865.84
gfx950,256,928,512,7168,False,torch.bfloat16,torch.bfloat16,False,False,asm,8,3,21.1997,_ZN5aiter39bf16gemm_fp32bf16_tn_96x64_splitk_cleanE,0.0104,321.3,1018.6
gfx950,256,960,512,4096,False,torch.bfloat16,torch.bfloat16,False,False,flydsl,952,1,14.9547,flydsl_hgemm_abf16_wbf16_bf16_t32x64x128x5_ks1_w1x4x1_bias0_ktail0_gm0_pft_gfx950,0.0,269.25,872.08
gfx950,256,960,512,7168,False,torch.bfloat16,torch.bfloat16,False,False,torch,0,0,21.6119,native,0.0,326.04,1021.92
gfx950,256,992,512,4096,False,torch.bfloat16,torch.bfloat16,False,False,flydsl,1994,1,14.9512,flydsl_hgemm_abf16_wbf16_bf16_t32x64x128x4_ks1_w1x4x1_bias0_ktail0_gm0_pft_gfx950,0.0,278.29,892.01
gfx950,256,992,512,7168,False,torch.bfloat16,torch.bfloat16,False,False,flydsl,3651,4,21.987,flydsl_hgemm_abf16_wbf16_bf16_t64x128x128x2_ks4_w2x4x1_bias0_ktail0_gm0_pht_gfx950,0.0139,331.16,1026.84
gfx950,256,1024,512,4096,False,torch.bfloat16,torch.bfloat16,False,False,flydsl,2117,1,14.8148,flydsl_hgemm_abf16_wbf16_bf16_t32x64x128x6_ks1_w2x1x2_bias0_ktail0_gm4_pft_gfx950,0.0049,289.91,920.13
gfx950,256,1024,512,7168,False,torch.bfloat16,torch.bfloat16,False,False,flydsl,3651,4,22.4302,flydsl_hgemm_abf16_wbf16_bf16_t64x128x128x2_ks4_w2x4x1_bias0_ktail0_gm0_pht_gfx950,0.0136,335.09,1028.46
gfx950,256,1088,512,4096,False,torch.bfloat16,torch.bfloat16,False,False,flydsl,659,1,17.0963,flydsl_hgemm_abf16_wbf16_bf16_t32x64x128x3_ks1_w1x1x2_bias0_ktail0_gm4_pft_gfx950,0.005,266.92,831.84
gfx950,256,1088,512,7168,False,torch.bfloat16,torch.bfloat16,False,False,opus,1200,2,25.9885,opus_gemm_flatmm_splitk_256x64x64x64_2x1_16x16x32_0x0x0_wgpcu2_nooob,0.0,307.29,925.48
gfx950,256,1152,512,4096,False,torch.bfloat16,torch.bfloat16,False,False,torch,0,0,17.3553,native,0.0,278.41,853.41
gfx950,256,1152,512,7168,False,torch.bfloat16,torch.bfloat16,False,False,torch,0,0,26.1983,native,0.0,322.76,955.59
gfx950,256,1216,512,4096,False,torch.bfloat16,torch.bfloat16,False,False,torch,0,0,17.4125,native,0.0,292.91,884.48
gfx950,256,1216,512,7168,False,torch.bfloat16,torch.bfloat16,False,False,torch,0,0,25.881,native,0.0,344.87,1005.29
gfx950,256,1280,512,4096,False,torch.bfloat16,torch.bfloat16,False,False,torch,0,0,17.4011,native,0.0,308.53,918.95
gfx950,256,1280,512,7168,False,torch.bfloat16,torch.bfloat16,False,False,torch,0,0,25.7487,native,0.0,364.88,1048.63
gfx950,256,1344,512,4096,False,torch.bfloat16,torch.bfloat16,False,False,torch,0,0,17.8515,native,0.0,315.78,928.81
gfx950,256,1344,512,7168,False,torch.bfloat16,torch.bfloat16,False,False,flydsl,43,4,27.3153,flydsl_hgemm_abf16_wbf16_bf16_t128x128x128x2_ks4_w2x4x1_bias0_ktail0_gm0_pht_gfx950,0.0134,361.15,1024.48
gfx950,256,1408,512,4096,False,torch.bfloat16,torch.bfloat16,False,False,torch,0,0,17.7452,native,0.0,332.8,967.61
gfx950,256,1408,512,7168,False,torch.bfloat16,torch.bfloat16,False,False,torch,0,0,27.4166,native,0.0,376.95,1056.55
gfx950,256,1472,512,4096,False,torch.bfloat16,torch.bfloat16,False,False,torch,0,0,17.7483,native,0.0,347.87,1000.67
gfx950,256,1472,512,7168,False,torch.bfloat16,torch.bfloat16,False,False,torch,0,0,27.9025,native,0.0,387.22,1073.38
gfx950,256,1536,512,4096,False,torch.bfloat16,torch.bfloat16,False,False,torch,0,0,17.8173,native,0.0,361.58,1029.9
gfx950,256,1536,512,7168,False,torch.bfloat16,torch.bfloat16,False,False,torch,0,0,28.4109,native,0.0,396.83,1088.77
gfx950,256,1600,512,4096,False,torch.bfloat16,torch.bfloat16,False,False,flydsl,2948,1,19.4841,flydsl_hgemm_abf16_wbf16_bf16_t64x64x128x5_ks1_w4x1x2_bias0_ktail0_gm0_pft_gfx950,0.0049,344.43,972.07
gfx950,256,1600,512,7168,False,torch.bfloat16,torch.bfloat16,False,False,flydsl,43,4,29.6476,flydsl_hgemm_abf16_wbf16_bf16_t128x128x128x2_ks4_w2x4x1_bias0_ktail0_gm0_pht_gfx950,0.0139,396.12,1076.51
gfx950,256,1664,512,4096,False,torch.bfloat16,torch.bfloat16,False,False,torch,0,0,19.7797,native,0.0,352.85,987.36
gfx950,256,1664,512,7168,False,torch.bfloat16,torch.bfloat16,False,False,torch,0,0,29.5278,native,0.0,413.64,1114.17
gfx950,256,1728,512,4096,False,torch.bfloat16,torch.bfloat16,False,False,torch,0,0,19.9616,native,0.0,363.08,1007.91
gfx950,256,1728,512,7168,False,torch.bfloat16,torch.bfloat16,False,False,torch,0,0,30.386,native,0.0,417.42,1115.06
gfx950,256,1792,512,4096,False,torch.bfloat16,torch.bfloat16,False,False,torch,0,0,19.9441,native,0.0,376.86,1038.37
gfx950,256,1792,512,7168,False,torch.bfloat16,torch.bfloat16,False,False,torch,0,0,29.9009,native,0.0,439.9,1166.02
gfx950,256,1856,512,4096,False,torch.bfloat16,torch.bfloat16,False,False,flydsl,2948,1,20.4934,flydsl_hgemm_abf16_wbf16_bf16_t64x64x128x5_ks1_w4x1x2_bias0_ktail0_gm0_pft_gfx950,0.0049,379.86,1039.32
gfx950,256,1856,512,7168,False,torch.bfloat16,torch.bfloat16,False,False,torch,0,0,31.6052,native,0.0,431.04,1134.25
gfx950,256,1920,512,4096,False,torch.bfloat16,torch.bfloat16,False,False,torch,0,0,20.0197,native,0.0,402.26,1093.37
gfx950,256,1920,512,7168,False,torch.bfloat16,torch.bfloat16,False,False,torch,0,0,32.5346,native,0.0,433.17,1132.06
gfx950,256,1984,512,4096,False,torch.bfloat16,torch.bfloat16,False,False,torch,0,0,20.1799,native,0.0,412.37,1113.92
gfx950,256,1984,512,7168,False,torch.bfloat16,torch.bfloat16,False,False,torch,0,0,32.7705,native,0.0,444.38,1153.91
gfx950,256,2048,512,4096,False,torch.bfloat16,torch.bfloat16,False,False,flydsl,3147,1,19.5188,flydsl_hgemm_abf16_wbf16_bf16_t64x64x128x5_ks1_w1x2x2_bias0_ktail0_gm4_pft_gfx950,0.0049,440.09,1181.87
gfx950,256,2048,512,7168,False,torch.bfloat16,torch.bfloat16,False,False,torch,0,0,29.4695,native,0.0,510.1,1316.52
gfx950,256,4096,512,4096,False,torch.bfloat16,torch.bfloat16,False,False,flydsl,1847,1,28.0056,flydsl_hgemm_abf16_wbf16_bf16_t64x128x128x3_ks1_w1x4x2_bias0_ktail0_gm4_pft_gfx950,0.0048,613.44,1497.67
gfx950,256,4096,512,7168,False,torch.bfloat16,torch.bfloat16,False,False,flydsl,1999,1,47.7277,flydsl_hgemm_abf16_wbf16_bf16_t64x128x128x3_ks1_w2x2x2_bias0_ktail0_gm4_pft_gfx950,0.0062,629.92,1471.99
gfx950,256,6144,512,4096,False,torch.bfloat16,torch.bfloat16,False,False,flydsl,1981,1,39.3595,flydsl_hgemm_abf16_wbf16_bf16_t96x128x64x4_ks1_w2x2x1_bias0_ktail0_gm4_pft_gfx950,0.0,654.73,1545.18
gfx950,256,6144,512,7168,False,torch.bfloat16,torch.bfloat16,False,False,flydsl,2019,1,65.045,flydsl_hgemm_abf16_wbf16_bf16_t96x128x64x4_ks1_w2x2x1_bias0_ktail0_gm4_pft_gfx950,0.0,693.32,1563.72
gfx950,256,8192,512,4096,False,torch.bfloat16,torch.bfloat16,False,False,flydsl,207,1,43.8084,flydsl_hgemm_abf16_wbf16_bf16_t128x128x64x4_ks1_w2x4x2_bias0_ktail0_gm4_pft_gfx950,0.0048,784.32,1819.1
gfx950,256,8192,512,7168,False,torch.bfloat16,torch.bfloat16,False,False,flydsl,3,1,70.9799,flydsl_hgemm_abf16_wbf16_bf16_t128x128x128x2_ks1_w2x2x1_bias0_ktail0_gm4_pht_gfx950,0.0,847.13,1876.15
gfx950,256,10240,512,4096,False,torch.bfloat16,torch.bfloat16,False,False,torch,0,0,52.678,native,0.0,815.32,1871.11
gfx950,256,10240,512,7168,False,torch.bfloat16,torch.bfloat16,False,False,torch,0,0,93.6153,native,0.0,802.88,1758.54
gfx950,256,12288,512,4096,False,torch.bfloat16,torch.bfloat16,False,False,opus,6402,0,59.4553,opus_gemm_mono_tile_512x192x128x64_2x4_16x16x32_0x0x0_nooob_4g_safe,0.0,866.86,1975.27
gfx950,256,12288,512,7168,False,torch.bfloat16,torch.bfloat16,False,False,opus,1402,0,96.8622,opus_gemm_mono_tile_512x192x128x64_2x4_16x16x32_0x0x0_nooob,0.0,931.16,2024.36
gfx950,256,14336,512,4096,False,torch.bfloat16,torch.bfloat16,False,False,opus,1401,0,64.1406,opus_gemm_mono_tile_512x128x256x64_2x4_16x16x32_0x0x0_nooob,0.0,937.46,2125.25
gfx950,256,14336,512,7168,False,torch.bfloat16,torch.bfloat16,False,False,opus,1401,0,105.553,opus_gemm_mono_tile_512x128x256x64_2x4_16x16x32_0x0x0_nooob,0.0,996.91,2155.7
gfx950,256,16384,512,4096,False,torch.bfloat16,torch.bfloat16,False,False,opus,1401,0,67.3722,opus_gemm_mono_tile_512x128x256x64_2x4_16x16x32_0x0x0_nooob,0.0,1020.0,2303.46
gfx950,256,16384,512,7168,False,torch.bfloat16,torch.bfloat16,False,False,opus,1401,0,112.4307,opus_gemm_mono_tile_512x128x256x64_2x4_16x16x32_0x0x0_nooob,0.0,1069.63,2303.63
gfx950,256,32768,512,7168,False,torch.bfloat16,torch.bfloat16,False,False,torch,0,0,179.8094,native,0.0,1337.63,2839.99
gfx950,256,1,1024,7168,False,torch.bfloat16,torch.bfloat16,False,False,flydsl,144,8,6.8155,flydsl_hgemm_abf16_wbf16_bf16_t16x64x128x4_ks8_w1x2x1_bias0_ktail0_gm0_pft_gfx950,0.0205,2.15,2156.33
gfx950,256,2,1024,7168,False,torch.bfloat16,torch.bfloat16,False,False,flydsl,304,8,6.8762,flydsl_hgemm_abf16_wbf16_bf16_t16x64x64x6_ks8_w1x2x1_bias0_ktail0_gm0_pft_gfx950,0.0234,4.27,2139.67
gfx950,256,4,1024,7168,False,torch.bfloat16,torch.bfloat16,False,False,flydsl,159,8,6.9605,flydsl_hgemm_abf16_wbf16_bf16_t16x64x128x5_ks8_w1x2x1_bias0_ktail0_gm0_pft_gfx950,0.0229,8.44,2118.47
gfx950,256,8,1024,7168,False,torch.bfloat16,torch.bfloat16,False,False,flydsl,168,8,7.1437,flydsl_hgemm_abf16_wbf16_bf16_t16x64x128x6_ks8_w1x1x2_bias0_ktail0_gm0_pft_gfx950,0.0287,16.44,2073.31
gfx950,256,16,1024,4096,False,torch.bfloat16,torch.bfloat16,False,False,flydsl,275,8,6.4779,flydsl_hgemm_abf16_wbf16_bf16_t16x64x64x9_ks8_w1x2x1_bias0_ktail0_gm0_pft_gfx950,0.0212,20.72,1320.25
gfx950,256,16,1024,7168,False,torch.bfloat16,torch.bfloat16,False,False,flydsl,334,8,7.4266,flydsl_hgemm_abf16_wbf16_bf16_t16x64x64x8_ks8_w1x2x1_bias0_ktail0_gm0_pft_gfx950,0.0226,31.63,2011.99
gfx950,256,24,1024,7168,False,torch.bfloat16,torch.bfloat16,False,False,flydsl,301,7,7.7435,flydsl_hgemm_abf16_wbf16_bf16_t16x64x64x6_ks7_w1x2x1_bias0_ktail0_gm0_pft_gfx950,0.0197,45.5,1946.57
gfx950,256,32,1024,4096,False,torch.bfloat16,torch.bfloat16,False,False,flydsl,124,4,7.0255,flydsl_hgemm_abf16_wbf16_bf16_t16x64x128x5_ks4_w1x2x1_bias0_ktail0_gm0_pft_gfx950,0.0116,38.21,1240.66
gfx950,256,32,1024,7168,False,torch.bfloat16,torch.bfloat16,False,False,flydsl,166,7,8.0589,flydsl_hgemm_abf16_wbf16_bf16_t16x64x128x6_ks7_w1x1x2_bias0_ktail0_gm0_pft_gfx950,0.0277,58.29,1886.65
gfx950,256,40,1024,7168,False,torch.bfloat16,torch.bfloat16,False,False,flydsl,164,4,9.03,flydsl_hgemm_abf16_wbf16_bf16_t16x64x128x6_ks4_w1x1x2_bias0_ktail0_gm0_pft_gfx950,0.0208,65.03,1698.28
gfx950,256,48,1024,4096,False,torch.bfloat16,torch.bfloat16,False,False,flydsl,111,4,7.3495,flydsl_hgemm_abf16_wbf16_bf16_t16x64x128x4_ks4_w1x1x2_bias0_ktail0_gm0_pft_gfx950,0.0197,54.79,1208.26
gfx950,256,48,1024,7168,False,torch.bfloat16,torch.bfloat16,False,False,flydsl,152,4,9.3737,flydsl_hgemm_abf16_wbf16_bf16_t16x64x128x5_ks4_w1x1x2_bias0_ktail0_gm0_pft_gfx950,0.0214,75.17,1649.99
gfx950,256,56,1024,7168,False,torch.bfloat16,torch.bfloat16,False,False,flydsl,763,7,9.315,flydsl_hgemm_abf16_wbf16_bf16_t32x64x128x4_ks7_w1x4x1_bias0_ktail0_gm0_pft_gfx950,0.0189,88.25,1674.46
gfx950,256,64,1024,4096,False,torch.bfloat16,torch.bfloat16,False,False,flydsl,123,4,8.0723,flydsl_hgemm_abf16_wbf16_bf16_t16x64x128x5_ks4_w1x1x2_bias0_ktail0_gm0_pft_gfx950,0.0197,66.51,1120.37
gfx950,256,64,1024,7168,False,torch.bfloat16,torch.bfloat16,False,False,flydsl,1113,7,9.7221,flydsl_hgemm_abf16_wbf16_bf16_t32x64x64x6_ks7_w1x4x1_bias0_ktail0_gm0_pft_gfx950,0.02,96.64,1617.82
gfx950,256,72,1024,7168,False,torch.bfloat16,torch.bfloat16,False,False,flydsl,137,4,11.6928,flydsl_hgemm_abf16_wbf16_bf16_t16x64x128x4_ks4_w1x1x2_bias0_ktail0_gm0_pft_gfx950,0.0217,90.39,1356.37
gfx950,256,80,1024,4096,False,torch.bfloat16,torch.bfloat16,False,False,flydsl,112,4,8.7043,flydsl_hgemm_abf16_wbf16_bf16_t16x64x128x4_ks4_w1x2x1_bias0_ktail0_gm0_pft_gfx950,0.0125,77.1,1057.85
gfx950,256,80,1024,7168,False,torch.bfloat16,torch.bfloat16,False,False,flydsl,138,4,11.7144,flydsl_hgemm_abf16_wbf16_bf16_t16x64x128x4_ks4_w1x2x1_bias0_ktail0_gm0_pft_gfx950,0.0143,100.25,1365.05
gfx950,256,88,1024,7168,False,torch.bfloat16,torch.bfloat16,False,False,flydsl,755,4,10.9228,flydsl_hgemm_abf16_wbf16_bf16_t32x64x128x4_ks4_w1x4x1_bias0_ktail0_gm0_pft_gfx950,0.0139,118.27,1475.98
gfx950,256,96,1024,4096,False,torch.bfloat16,torch.bfloat16,False,False,flydsl,637,4,9.0263,flydsl_hgemm_abf16_wbf16_bf16_t32x64x128x5_ks4_w1x4x1_bias0_ktail0_gm0_pft_gfx950,0.0121,89.22,1038.26
gfx950,256,96,1024,7168,False,torch.bfloat16,torch.bfloat16,False,False,flydsl,755,4,11.2064,flydsl_hgemm_abf16_wbf16_bf16_t32x64x128x4_ks4_w1x4x1_bias0_ktail0_gm0_pft_gfx950,0.014,125.76,1450.33
gfx950,256,104,1024,7168,False,torch.bfloat16,torch.bfloat16,False,False,flydsl,1262,4,11.3863,flydsl_hgemm_abf16_wbf16_bf16_t32x64x128x4_ks4_w1x2x2_bias0_ktail0_gm0_pft_gfx950,0.0213,134.08,1438.92
gfx950,256,112,1024,4096,False,torch.bfloat16,torch.bfloat16,False,False,flydsl,1300,4,9.5361,flydsl_hgemm_abf16_wbf16_bf16_t32x64x64x6_ks4_w1x4x1_bias0_ktail0_gm0_pft_gfx950,0.0121,98.52,999.94
gfx950,256,112,1024,7168,False,torch.bfloat16,torch.bfloat16,False,False,flydsl,1300,4,11.7278,flydsl_hgemm_abf16_wbf16_bf16_t32x64x128x5_ks4_w1x4x1_bias0_ktail0_gm0_pft_gfx950,0.0142,140.19,1408.2
gfx950,256,120,1024,7168,False,torch.bfloat16,torch.bfloat16,False,False,flydsl,1305,4,12.0454,flydsl_hgemm_abf16_wbf16_bf16_t32x64x128x4_ks4_w1x4x1_bias0_ktail0_gm0_pft_gfx950,0.014,146.25,1381.95
gfx950,256,128,1024,4096,False,torch.bfloat16,torch.bfloat16,False,False,flydsl,1048,4,10.0851,flydsl_hgemm_abf16_wbf16_bf16_t32x64x128x4_ks4_w1x4x1_bias0_ktail0_gm0_pft_gfx950,0.0116,106.47,961.75
gfx950,256,128,1024,7168,False,torch.bfloat16,torch.bfloat16,False,False,flydsl,1305,4,12.3544,flydsl_hgemm_abf16_wbf16_bf16_t32x64x128x4_ks4_w1x4x1_bias0_ktail0_gm0_pft_gfx950,0.0141,152.1,1358.0
gfx950,256,136,1024,7168,False,torch.bfloat16,torch.bfloat16,False,False,flydsl,421,4,14.106,flydsl_hgemm_abf16_wbf16_bf16_t48x64x128x3_ks4_w1x1x2_bias0_ktail0_gm0_pft_gfx950,0.0219,141.53,1198.66
gfx950,256,144,1024,4096,False,torch.bfloat16,torch.bfloat16,False,False,asm,3,5,11.2783,_ZN5aiter39bf16gemm_fp32bf16_tn_48x64_splitk_cleanE,0.0143,107.1,874.53
gfx950,256,144,1024,7168,False,torch.bfloat16,torch.bfloat16,False,False,flydsl,436,4,14.1973,flydsl_hgemm_abf16_wbf16_bf16_t48x64x128x4_ks4_w1x1x2_bias0_ktail0_gm0_pft_gfx950,0.0217,148.9,1200.18
gfx950,256,152,1024,7168,False,torch.bfloat16,torch.bfloat16,False,False,flydsl,1030,4,14.0592,flydsl_hgemm_abf16_wbf16_bf16_t32x64x64x6_ks4_w1x4x1_bias0_ktail0_gm0_pft_gfx950,0.0145,158.71,1221.3
gfx950,256,160,1024,4096,False,torch.bfloat16,torch.bfloat16,False,False,flydsl,856,4,11.0251,flydsl_hgemm_abf16_wbf16_bf16_t32x64x64x5_ks4_w1x4x1_bias0_ktail0_gm0_pft_gfx950,0.0116,121.74,909.47
gfx950,256,160,1024,7168,False,torch.bfloat16,torch.bfloat16,False,False,flydsl,659,4,14.1149,flydsl_hgemm_abf16_wbf16_bf16_t32x64x128x3_ks4_w2x2x1_bias0_ktail0_gm0_pft_gfx950,0.0146,166.41,1225.76
gfx950,256,168,1024,7168,False,torch.bfloat16,torch.bfloat16,False,False,asm,8,7,15.1656,_ZN5aiter39bf16gemm_fp32bf16_tn_96x64_splitk_cleanE,0.0199,162.62,1149.48
gfx950,256,176,1024,4096,False,torch.bfloat16,torch.bfloat16,False,False,asm,5,5,11.6305,_ZN5aiter39bf16gemm_fp32bf16_tn_64x64_splitk_cleanE,0.0139,126.94,876.22
gfx950,256,176,1024,7168,False,torch.bfloat16,torch.bfloat16,False,False,asm,5,5,15.1394,_ZN5aiter39bf16gemm_fp32bf16_tn_64x64_splitk_cleanE,0.0163,170.66,1160.13
gfx950,256,184,1024,7168,False,torch.bfloat16,torch.bfloat16,False,False,flydsl,656,4,15.0213,flydsl_hgemm_abf16_wbf16_bf16_t32x64x128x3_ks4_w1x4x1_bias0_ktail0_gm0_pft_gfx950,0.0144,179.82,1177.98
gfx950,256,192,1024,4096,False,torch.bfloat16,torch.bfloat16,False,False,flydsl,719,2,11.5456,flydsl_hgemm_abf16_wbf16_bf16_t32x64x256x3_ks2_w1x2x2_bias0_ktail0_gm0_pft_gfx950,0.0122,139.5,896.85
gfx950,256,192,1024,7168,False,torch.bfloat16,torch.bfloat16,False,False,flydsl,655,4,14.8815,flydsl_hgemm_abf16_wbf16_bf16_t32x64x128x3_ks4_w1x2x2_bias0_ktail0_gm0_pft_gfx950,0.0216,189.4,1197.85
gfx950,256,200,1024,7168,False,torch.bfloat16,torch.bfloat16,False,False,asm,7,5,15.7554,_ZN5aiter39bf16gemm_fp32bf16_tn_80x64_splitk_cleanE,0.0163,186.35,1139.73
gfx950,256,208,1024,4096,False,torch.bfloat16,torch.bfloat16,False,False,torch,0,0,11.5596,native,0.0,150.94,909.94
gfx950,256,208,1024,7168,False,torch.bfloat16,torch.bfloat16,False,False,asm,7,5,15.7647,_ZN5aiter39bf16gemm_fp32bf16_tn_80x64_splitk_cleanE,0.0161,193.69,1147.37
gfx950,256,216,1024,7168,False,torch.bfloat16,torch.bfloat16,False,False,flydsl,688,2,15.6787,flydsl_hgemm_abf16_wbf16_bf16_t32x64x128x4_ks2_w1x4x1_bias0_ktail0_gm0_pft_gfx950,0.0058,202.24,1162.02
gfx950,256,224,1024,4096,False,torch.bfloat16,torch.bfloat16,False,False,flydsl,600,2,11.8154,flydsl_hgemm_abf16_wbf16_bf16_t32x64x128x4_ks2_w1x4x1_bias0_ktail0_gm0_pft_gfx950,0.0049,159.03,904.11
gfx950,256,224,1024,7168,False,torch.bfloat16,torch.bfloat16,False,False,flydsl,830,2,15.9915,flydsl_hgemm_abf16_wbf16_bf16_t32x64x256x3_ks2_w1x4x1_bias0_ktail0_gm0_pft_gfx950,0.0058,205.63,1147.49
gfx950,256,232,1024,7168,False,torch.bfloat16,torch.bfloat16,False,False,asm,7,5,16.088,_ZN5aiter39bf16gemm_fp32bf16_tn_80x64_splitk_cleanE,0.0165,211.7,1148.75
gfx950,256,240,1024,4096,False,torch.bfloat16,torch.bfloat16,False,False,asm,7,5,12.2,_ZN5aiter39bf16gemm_fp32bf16_tn_80x64_splitk_cleanE,0.0143,165.02,889.03
gfx950,256,240,1024,7168,False,torch.bfloat16,torch.bfloat16,False,False,asm,7,5,16.0834,_ZN5aiter39bf16gemm_fp32bf16_tn_80x64_splitk_cleanE,0.0163,219.06,1157.23
gfx950,256,248,1024,7168,False,torch.bfloat16,torch.bfloat16,False,False,flydsl,1380,2,15.9846,flydsl_hgemm_abf16_wbf16_bf16_t32x64x128x5_ks2_w1x2x2_bias0_ktail0_gm0_pft_gfx950,0.0138,227.76,1172.58
gfx950,256,256,1024,4096,False,torch.bfloat16,torch.bfloat16,False,False,flydsl,1124,2,12.289,flydsl_hgemm_abf16_wbf16_bf16_t32x64x128x4_ks2_w1x4x1_bias0_ktail0_gm0_pft_gfx950,0.0049,174.75,895.93
gfx950,256,256,1024,7168,False,torch.bfloat16,torch.bfloat16,False,False,asm,8,5,16.3299,_ZN5aiter39bf16gemm_fp32bf16_tn_96x64_splitk_cleanE,0.0162,230.14,1155.82
gfx950,256,264,1024,7168,False,torch.bfloat16,torch.bfloat16,False,False,asm,8,5,16.6462,_ZN5aiter39bf16gemm_fp32bf16_tn_96x64_splitk_cleanE,0.0164,232.82,1141.73
gfx950,256,272,1024,7168,False,torch.bfloat16,torch.bfloat16,False,False,asm,8,5,16.4879,_ZN5aiter39bf16gemm_fp32bf16_tn_96x64_splitk_cleanE,0.0164,242.18,1160.64
gfx950,256,280,1024,7168,False,torch.bfloat16,torch.bfloat16,False,False,asm,8,5,16.6973,_ZN5aiter39bf16gemm_fp32bf16_tn_96x64_splitk_cleanE,0.0161,246.17,1153.93
gfx950,256,288,1024,4096,False,torch.bfloat16,torch.bfloat16,False,False,asm,8,5,12.8055,_ZN5aiter39bf16gemm_fp32bf16_tn_96x64_splitk_cleanE,0.0142,188.66,885.38
gfx950,256,288,1024,7168,False,torch.bfloat16,torch.bfloat16,False,False,asm,8,5,16.9001,_ZN5aiter39bf16gemm_fp32bf16_tn_96x64_splitk_cleanE,0.0165,250.17,1147.84
gfx950,256,296,1024,7168,False,torch.bfloat16,torch.bfloat16,False,False,asm,7,4,17.4585,_ZN5aiter39bf16gemm_fp32bf16_tn_80x64_splitk_cleanE,0.0138,248.89,1118.64
gfx950,256,304,1024,7168,False,torch.bfloat16,torch.bfloat16,False,False,asm,7,4,17.5997,_ZN5aiter39bf16gemm_fp32bf16_tn_80x64_splitk_cleanE,0.0137,253.57,1117.11
gfx950,256,312,1024,7168,False,torch.bfloat16,torch.bfloat16,False,False,asm,7,4,17.709,_ZN5aiter39bf16gemm_fp32bf16_tn_80x64_splitk_cleanE,0.0137,258.64,1117.62
gfx950,256,320,1024,4096,False,torch.bfloat16,torch.bfloat16,False,False,asm,7,4,13.0637,_ZN5aiter39bf16gemm_fp32bf16_tn_80x64_splitk_cleanE,0.0117,205.48,892.96
gfx950,256,320,1024,7168,False,torch.bfloat16,torch.bfloat16,False,False,asm,7,4,17.6737,_ZN5aiter39bf16gemm_fp32bf16_tn_80x64_splitk_cleanE,0.0138,265.8,1127.27
gfx950,256,328,1024,7168,False,torch.bfloat16,torch.bfloat16,False,False,asm,8,4,18.0034,_ZN5aiter39bf16gemm_fp32bf16_tn_96x64_splitk_cleanE,0.0137,267.45,1113.9
gfx950,256,336,1024,7168,False,torch.bfloat16,torch.bfloat16,False,False,asm,8,4,18.1847,_ZN5aiter39bf16gemm_fp32bf16_tn_96x64_splitk_cleanE,0.0137,271.24,1110.0
gfx950,256,344,1024,7168,False,torch.bfloat16,torch.bfloat16,False,False,asm,8,4,18.2742,_ZN5aiter39bf16gemm_fp32bf16_tn_96x64_splitk_cleanE,0.0135,276.34,1111.74
gfx950,256,352,1024,4096,False,torch.bfloat16,torch.bfloat16,False,False,asm,8,4,13.7263,_ZN5aiter39bf16gemm_fp32bf16_tn_96x64_splitk_cleanE,0.0118,215.12,873.73
gfx950,256,352,1024,7168,False,torch.bfloat16,torch.bfloat16,False,False,asm,8,4,18.4211,_ZN5aiter39bf16gemm_fp32bf16_tn_96x64_splitk_cleanE,0.0138,280.51,1109.99
gfx950,256,376,1024,7168,False,torch.bfloat16,torch.bfloat16,False,False,asm,8,4,18.9877,_ZN5aiter39bf16gemm_fp32bf16_tn_96x64_splitk_cleanE,0.0138,290.7,1097.58
gfx950,256,384,1024,4096,False,torch.bfloat16,torch.bfloat16,False,False,asm,8,4,13.9152,_ZN5aiter39bf16gemm_fp32bf16_tn_96x64_splitk_cleanE,0.0119,231.49,885.42
gfx950,256,384,1024,7168,False,torch.bfloat16,torch.bfloat16,False,False,asm,8,4,18.882,_ZN5aiter39bf16gemm_fp32bf16_tn_96x64_splitk_cleanE,0.0139,298.55,1110.66
gfx950,256,416,1024,4096,False,torch.bfloat16,torch.bfloat16,False,False,flydsl,890,1,14.0756,flydsl_hgemm_abf16_wbf16_bf16_t32x64x128x4_ks1_w1x4x1_bias0_ktail0_gm0_pft_gfx950,0.0,247.92,898.61
gfx950,256,416,1024,7168,False,torch.bfloat16,torch.bfloat16,False,False,asm,8,3,19.859,_ZN5aiter39bf16gemm_fp32bf16_tn_96x64_splitk_cleanE,0.0107,307.51,1082.42
gfx950,256,448,1024,4096,False,torch.bfloat16,torch.bfloat16,False,False,flydsl,1009,1,14.7171,flydsl_hgemm_abf16_wbf16_bf16_t32x64x128x6_ks1_w1x4x1_bias0_ktail0_gm4_pft_gfx950,0.0,255.36,881.7
gfx950,256,448,1024,7168,False,torch.bfloat16,torch.bfloat16,False,False,asm,8,3,20.1366,_ZN5aiter39bf16gemm_fp32bf16_tn_96x64_splitk_cleanE,0.0106,326.6,1093.54
gfx950,256,480,1024,4096,False,torch.bfloat16,torch.bfloat16,False,False,flydsl,890,1,14.3241,flydsl_hgemm_abf16_wbf16_bf16_t32x64x128x4_ks1_w1x4x1_bias0_ktail0_gm0_pft_gfx950,0.0,281.1,928.77
gfx950,256,480,1024,7168,False,torch.bfloat16,torch.bfloat16,False,False,asm,8,3,21.2247,_ZN5aiter39bf16gemm_fp32bf16_tn_96x64_splitk_cleanE,0.0107,331.99,1062.18
gfx950,256,512,1024,4096,False,torch.bfloat16,torch.bfloat16,False,False,flydsl,2051,1,14.3532,flydsl_hgemm_abf16_wbf16_bf16_t32x64x128x4_ks1_w1x4x1_bias0_ktail0_gm4_pft_gfx950,0.0,299.23,949.72
gfx950,256,512,1024,7168,False,torch.bfloat16,torch.bfloat16,False,False,torch,0,0,19.2478,native,0.0,390.5,1198.51
gfx950,256,544,1024,4096,False,torch.bfloat16,torch.bfloat16,False,False,torch,0,0,16.8883,native,0.0,270.21,826.56
gfx950,256,544,1024,7168,False,torch.bfloat16,torch.bfloat16,False,False,asm,7,2,26.8269,_ZN5aiter39bf16gemm_fp32bf16_tn_80x64_splitk_cleanE,0.0061,297.68,879.45
gfx950,256,576,1024,4096,False,torch.bfloat16,torch.bfloat16,False,False,torch,0,0,17.2851,native,0.0,279.54,826.54
gfx950,256,576,1024,7168,False,torch.bfloat16,torch.bfloat16,False,False,torch,0,0,21.2227,native,0.0,398.43,1136.39
gfx950,256,608,1024,4096,False,torch.bfloat16,torch.bfloat16,False,False,torch,0,0,17.4202,native,0.0,292.78,838.94
gfx950,256,608,1024,7168,False,torch.bfloat16,torch.bfloat16,False,False,flydsl,43,4,26.4084,flydsl_hgemm_abf16_wbf16_bf16_t128x128x128x2_ks4_w2x4x1_bias0_ktail0_gm0_pht_gfx950,0.0136,337.98,933.09
gfx950,256,640,1024,4096,False,torch.bfloat16,torch.bfloat16,False,False,torch,0,0,17.6589,native,0.0,304.02,846.16
gfx950,256,640,1024,7168,False,torch.bfloat16,torch.bfloat16,False,False,torch,0,0,26.7275,native,0.0,351.52,941.57
gfx950,256,672,1024,4096,False,torch.bfloat16,torch.bfloat16,False,False,torch,0,0,17.803,native,0.0,316.64,857.71
gfx950,256,672,1024,7168,False,torch.bfloat16,torch.bfloat16,False,False,opus,1221,4,27.0613,opus_gemm_flatmm_splitk_256x96x64x64_2x1_16x16x32_0x0x0_wgpcu2_nooob,0.0,364.54,949.33
gfx950,256,704,1024,4096,False,torch.bfloat16,torch.bfloat16,False,False,torch,0,0,17.5755,native,0.0,336.01,887.46
gfx950,256,704,1024,7168,False,torch.bfloat16,torch.bfloat16,False,False,torch,0,0,27.4557,native,0.0,376.42,954.79
gfx950,256,736,1024,4096,False,torch.bfloat16,torch.bfloat16,False,False,torch,0,0,17.5785,native,0.0,351.23,905.95
gfx950,256,736,1024,7168,False,torch.bfloat16,torch.bfloat16,False,False,torch,0,0,27.7463,native,0.0,389.4,963.68
gfx950,256,768,1024,4096,False,torch.bfloat16,torch.bfloat16,False,False,torch,0,0,17.8078,native,0.0,361.78,912.69
gfx950,256,768,1024,7168,False,torch.bfloat16,torch.bfloat16,False,False,torch,0,0,28.2249,native,0.0,399.44,965.92
gfx950,256,800,1024,4096,False,torch.bfloat16,torch.bfloat16,False,False,flydsl,1985,1,18.8443,flydsl_hgemm_abf16_wbf16_bf16_t64x64x128x4_ks1_w4x2x1_bias0_ktail0_gm4_pft_gfx950,0.0,356.12,879.87
gfx950,256,800,1024,7168,False,torch.bfloat16,torch.bfloat16,False,False,flydsl,2289,1,31.0499,flydsl_hgemm_abf16_wbf16_bf16_t64x64x128x5_ks1_w4x1x2_bias0_ktail0_gm4_pft_gfx950,0.006,378.23,894.92
gfx950,256,832,1024,4096,False,torch.bfloat16,torch.bfloat16,False,False,flydsl,2086,1,18.5628,flydsl_hgemm_abf16_wbf16_bf16_t64x64x128x5_ks1_w4x1x2_bias0_ktail0_gm0_pft_gfx950,0.005,375.98,910.87
gfx950,256,832,1024,7168,False,torch.bfloat16,torch.bfloat16,False,False,torch,0,0,30.2838,native,0.0,403.31,934.87
gfx950,256,864,1024,4096,False,torch.bfloat16,torch.bfloat16,False,False,flydsl,2751,1,19.1149,flydsl_hgemm_abf16_wbf16_bf16_t64x64x128x3_ks1_w2x1x2_bias0_ktail0_gm4_pft_gfx950,0.005,379.17,901.7
gfx950,256,864,1024,7168,False,torch.bfloat16,torch.bfloat16,False,False,torch,0,0,30.9035,native,0.0,410.43,933.09
gfx950,256,896,1024,4096,False,torch.bfloat16,torch.bfloat16,False,False,flydsl,3030,1,18.7343,flydsl_hgemm_abf16_wbf16_bf16_t64x64x128x5_ks1_w4x1x2_bias0_ktail0_gm0_pft_gfx950,0.005,401.2,937.51
gfx950,256,896,1024,7168,False,torch.bfloat16,torch.bfloat16,False,False,torch,0,0,30.0458,native,0.0,437.78,977.18
gfx950,256,928,1024,4096,False,torch.bfloat16,torch.bfloat16,False,False,flydsl,1868,1,19.0759,flydsl_hgemm_abf16_wbf16_bf16_t64x64x128x3_ks1_w2x4x1_bias0_ktail0_gm0_pft_gfx950,0.0,408.09,937.9
gfx950,256,928,1024,7168,False,torch.bfloat16,torch.bfloat16,False,False,torch,0,0,31.8867,native,0.0,427.23,937.21
gfx950,256,960,1024,4096,False,torch.bfloat16,torch.bfloat16,False,False,flydsl,2087,1,18.9114,flydsl_hgemm_abf16_wbf16_bf16_t64x64x128x5_ks1_w4x1x2_bias0_ktail0_gm4_pft_gfx950,0.005,425.83,963.39
gfx950,256,960,1024,7168,False,torch.bfloat16,torch.bfloat16,False,False,torch,0,0,31.7971,native,0.0,443.21,956.34
gfx950,256,992,1024,4096,False,torch.bfloat16,torch.bfloat16,False,False,flydsl,3077,1,18.8661,flydsl_hgemm_abf16_wbf16_bf16_t64x64x128x4_ks1_w2x1x2_bias0_ktail0_gm4_pft_gfx950,0.005,441.08,983.07
gfx950,256,992,1024,7168,False,torch.bfloat16,torch.bfloat16,False,False,flydsl,3627,1,31.3241,flydsl_hgemm_abf16_wbf16_bf16_t64x64x128x5_ks1_w1x2x2_bias0_ktail0_gm4_pft_gfx950,0.0061,464.9,987.51
gfx950,256,1024,1024,4096,False,torch.bfloat16,torch.bfloat16,False,False,flydsl,3145,1,19.3197,flydsl_hgemm_abf16_wbf16_bf16_t64x64x128x4_ks1_w4x2x1_bias0_ktail0_gm4_pft_gfx950,0.0,444.62,976.95
gfx950,256,1024,1024,7168,False,torch.bfloat16,torch.bfloat16,False,False,torch,0,0,27.9345,native,0.0,538.13,1126.11
gfx950,256,1088,1024,4096,False,torch.bfloat16,torch.bfloat16,False,False,torch,0,0,22.136,native,0.0,412.31,882.26
gfx950,256,1088,1024,7168,False,torch.bfloat16,torch.bfloat16,False,False,torch,0,0,34.6061,native,0.0,461.53,939.31
gfx950,256,1152,1024,4096,False,torch.bfloat16,torch.bfloat16,False,False,torch,0,0,22.197,native,0.0,435.36,909.36
gfx950,256,1152,1024,7168,False,torch.bfloat16,torch.bfloat16,False,False,torch,0,0,35.5444,native,0.0,475.78,944.01
gfx950,256,1216,1024,4096,False,torch.bfloat16,torch.bfloat16,False,False,flydsl,3195,1,23.0653,flydsl_hgemm_abf16_wbf16_bf16_t96x64x128x3_ks1_w2x1x2_bias0_ktail0_gm4_pft_gfx950,0.005,442.25,903.54
gfx950,256,1216,1024,7168,False,torch.bfloat16,torch.bfloat16,False,False,torch,0,0,35.232,native,0.0,506.67,982.15
gfx950,256,1280,1024,4096,False,torch.bfloat16,torch.bfloat16,False,False,flydsl,1865,1,22.7823,flydsl_hgemm_abf16_wbf16_bf16_t48x64x64x4_ks1_w1x2x1_bias0_ktail0_gm4_pft_gfx950,0.0,471.31,943.53
gfx950,256,1280,1024,7168,False,torch.bfloat16,torch.bfloat16,False,False,torch,0,0,35.7854,native,0.0,525.09,996.26
gfx950,256,1344,1024,4096,False,torch.bfloat16,torch.bfloat16,False,False,flydsl,1599,1,23.4694,flydsl_hgemm_abf16_wbf16_bf16_t48x64x64x5_ks1_w1x2x1_bias0_ktail0_gm4_pft_gfx950,0.0,480.38,943.83
gfx950,256,1344,1024,7168,False,torch.bfloat16,torch.bfloat16,False,False,flydsl,3122,1,40.4312,flydsl_hgemm_abf16_wbf16_bf16_t96x64x128x3_ks1_w2x1x2_bias0_ktail0_gm0_pft_gfx950,0.0059,487.99,907.72
gfx950,256,1408,1024,4096,False,torch.bfloat16,torch.bfloat16,False,False,flydsl,3035,1,24.2222,flydsl_hgemm_abf16_wbf16_bf16_t96x64x128x3_ks1_w2x1x2_bias0_ktail0_gm4_pft_gfx950,0.005,487.62,941.55
gfx950,256,1408,1024,7168,False,torch.bfloat16,torch.bfloat16,False,False,torch,0,0,40.2297,native,0.0,513.79,938.33
gfx950,256,1472,1024,4096,False,torch.bfloat16,torch.bfloat16,False,False,flydsl,3219,1,23.9332,flydsl_hgemm_abf16_wbf16_bf16_t96x64x128x4_ks1_w2x1x2_bias0_ktail0_gm4_pft_gfx950,0.005,515.94,980.31
gfx950,256,1472,1024,7168,False,torch.bfloat16,torch.bfloat16,False,False,flydsl,3417,1,38.8353,flydsl_hgemm_abf16_wbf16_bf16_t96x64x128x4_ks1_w2x1x2_bias0_ktail0_gm4_pft_gfx950,0.0062,556.43,999.02
gfx950,256,1536,1024,4096,False,torch.bfloat16,torch.bfloat16,False,False,flydsl,3055,1,24.158,flydsl_hgemm_abf16_wbf16_bf16_t96x64x128x3_ks1_w2x2x1_bias0_ktail0_gm4_pft_gfx950,0.0,533.36,998.31
gfx950,256,1536,1024,7168,False,torch.bfloat16,torch.bfloat16,False,False,torch,0,0,37.5543,native,0.0,600.43,1061.02
gfx950,256,1600,1024,4096,False,torch.bfloat16,torch.bfloat16,False,False,flydsl,1656,1,27.2476,flydsl_hgemm_abf16_wbf16_bf16_t64x128x128x3_ks1_w1x4x2_bias0_ktail0_gm0_pft_gfx950,0.0048,492.59,909.17
gfx950,256,1600,1024,7168,False,torch.bfloat16,torch.bfloat16,False,False,torch,0,0,43.8189,native,0.0,536.03,933.26
gfx950,256,1664,1024,4096,False,torch.bfloat16,torch.bfloat16,False,False,flydsl,2459,1,25.8293,flydsl_hgemm_abf16_wbf16_bf16_t64x64x64x4_ks1_w1x1x2_bias0_ktail0_gm4_pft_gfx950,0.0049,540.42,984.46
gfx950,256,1664,1024,7168,False,torch.bfloat16,torch.bfloat16,False,False,flydsl,2603,1,43.9995,flydsl_hgemm_abf16_wbf16_bf16_t64x64x64x4_ks1_w1x1x2_bias0_ktail0_gm4_pft_gfx950,0.006,555.18,953.26
gfx950,256,1728,1024,4096,False,torch.bfloat16,torch.bfloat16,False,False,flydsl,2619,1,26.8233,flydsl_hgemm_abf16_wbf16_bf16_t64x64x64x4_ks1_w1x1x2_bias0_ktail0_gm4_pft_gfx950,0.0049,540.41,972.41
gfx950,256,1728,1024,7168,False,torch.bfloat16,torch.bfloat16,False,False,torch,0,0,44.5886,native,0.0,568.92,964.18
gfx950,256,1792,1024,4096,False,torch.bfloat16,torch.bfloat16,False,False,flydsl,2675,1,26.7093,flydsl_hgemm_abf16_wbf16_bf16_t64x64x64x4_ks1_w1x1x2_bias0_ktail0_gm4_pft_gfx950,0.0049,562.81,1001.1
gfx950,256,1792,1024,7168,False,torch.bfloat16,torch.bfloat16,False,False,torch,0,0,45.465,native,0.0,578.61,968.66
gfx950,256,1856,1024,4096,False,torch.bfloat16,torch.bfloat16,False,False,flydsl,1656,1,28.0925,flydsl_hgemm_abf16_wbf16_bf16_t64x128x128x3_ks1_w1x4x2_bias0_ktail0_gm0_pft_gfx950,0.0049,554.21,975.14
gfx950,256,1856,1024,7168,False,torch.bfloat16,torch.bfloat16,False,False,flydsl,25,2,48.0889,flydsl_hgemm_abf16_wbf16_bf16_t128x128x128x2_ks2_w2x4x1_bias0_ktail0_gm0_pht_gfx950,0.006,566.58,937.61
gfx950,256,1920,1024,4096,False,torch.bfloat16,torch.bfloat16,False,False,flydsl,1712,1,28.3515,flydsl_hgemm_abf16_wbf16_bf16_t64x128x128x3_ks1_w1x4x2_bias0_ktail0_gm0_pft_gfx950,0.0049,568.09,989.34
gfx950,256,1920,1024,7168,False,torch.bfloat16,torch.bfloat16,False,False,torch,0,0,45.6058,native,0.0,618.03,1011.66
gfx950,256,1984,1024,4096,False,torch.bfloat16,torch.bfloat16,False,False,flydsl,831,1,28.1273,flydsl_hgemm_abf16_wbf16_bf16_t128x64x64x6_ks1_w2x2x2_bias0_ktail0_gm4_pft_gfx950,0.0048,591.7,1020.53
gfx950,256,1984,1024,7168,False,torch.bfloat16,torch.bfloat16,False,False,flydsl,573,1,47.7633,flydsl_hgemm_abf16_wbf16_bf16_t128x64x128x3_ks1_w2x2x2_bias0_ktail0_gm4_pft_gfx950,0.006,609.78,987.91
gfx950,256,2048,1024,4096,False,torch.bfloat16,torch.bfloat16,False,False,flydsl,487,1,27.7433,flydsl_hgemm_abf16_wbf16_bf16_t128x64x128x3_ks1_w4x1x2_bias0_ktail0_gm4_pft_gfx950,0.0049,619.24,1058.28
gfx950,256,2048,1024,7168,False,torch.bfloat16,torch.bfloat16,False,False,torch,0,0,44.8744,native,0.0,669.98,1074.88
gfx950,256,4096,1024,4096,False,torch.bfloat16,torch.bfloat16,False,False,flydsl,9,1,42.7691,flydsl_hgemm_abf16_wbf16_bf16_t128x128x128x2_ks1_w2x4x1_bias0_ktail0_gm4_pht_gfx950,0.0,803.38,1176.82
gfx950,256,4096,1024,7168,False,torch.bfloat16,torch.bfloat16,False,False,torch,0,0,69.3667,native,0.0,866.84,1179.08
gfx950,256,6144,1024,4096,False,torch.bfloat16,torch.bfloat16,False,False,opus,6402,0,56.8744,opus_gemm_mono_tile_512x192x128x64_2x4_16x16x32_0x0x0_nooob_4g_safe,0.0,906.2,1253.7
gfx950,256,6144,1024,7168,False,torch.bfloat16,torch.bfloat16,False,False,opus,6402,0,94.4298,opus_gemm_mono_tile_512x192x128x64_2x4_16x16x32_0x0x0_nooob_4g_safe,0.0,955.15,1221.47
gfx950,256,8192,1024,4096,False,torch.bfloat16,torch.bfloat16,False,False,opus,1401,0,66.0826,opus_gemm_mono_tile_512x128x256x64_2x4_16x16x32_0x0x0_nooob,0.0,1039.9,1396.35
gfx950,256,8192,1024,7168,False,torch.bfloat16,torch.bfloat16,False,False,opus,6401,0,107.6667,opus_gemm_mono_tile_512x128x256x64_2x4_16x16x32_0x0x0_nooob_4g_safe,0.0,1116.96,1382.95
gfx950,256,10240,1024,4096,False,torch.bfloat16,torch.bfloat16,False,False,torch,0,0,78.7212,native,0.0,1091.18,1438.57
gfx950,256,10240,1024,7168,False,torch.bfloat16,torch.bfloat16,False,False,torch,0,0,127.4133,native,0.0,1179.81,1431.97
gfx950,256,12288,1024,4096,False,torch.bfloat16,torch.bfloat16,False,False,opus,6400,0,83.3408,opus_gemm_mono_tile_512x192x256x64_2x4_16x16x32_0x0x0_nooob_4g_safe,0.0,1236.84,1610.47
gfx950,256,12288,1024,7168,False,torch.bfloat16,torch.bfloat16,False,False,opus,1400,0,136.8832,opus_gemm_mono_tile_512x192x256x64_2x4_16x16x32_0x0x0_nooob,0.0,1317.83,1578.04
gfx950,256,14336,1024,4096,False,torch.bfloat16,torch.bfloat16,False,False,flydsl,393,1,100.2987,flydsl_hgemm_abf16_wbf16_bf16_t256x256x64x2_ks1_w2x4x1_bias0_ktail0_gm4_pht_gfx950,0.0,1199.01,1547.27
gfx950,256,14336,1024,7168,False,torch.bfloat16,torch.bfloat16,False,False,torch,0,0,162.6696,native,0.0,1293.75,1534.16
gfx950,256,16384,1024,4096,False,torch.bfloat16,torch.bfloat16,False,False,flydsl,393,1,105.3563,flydsl_hgemm_abf16_wbf16_bf16_t256x256x64x2_ks1_w2x4x1_bias0_ktail0_gm4_pht_gfx950,0.0,1304.52,1672.05
gfx950,256,16384,1024,7168,False,torch.bfloat16,torch.bfloat16,False,False,torch,0,0,173.0024,native,0.0,1390.26,1636.48
gfx950,256,32768,1024,7168,False,torch.bfloat16,torch.bfloat16,False,False,torch,0,0,333.5662,native,0.0,1442.1,1653.5
gfx950,256,1,2048,7168,False,torch.bfloat16,torch.bfloat16,False,False,flydsl,301,7,8.3097,flydsl_hgemm_abf16_wbf16_bf16_t16x64x64x6_ks7_w1x2x1_bias0_ktail0_gm0_pft_gfx950,0.0166,3.53,3535.45
gfx950,256,2,2048,7168,False,torch.bfloat16,torch.bfloat16,False,False,flydsl,301,7,8.3005,flydsl_hgemm_abf16_wbf16_bf16_t16x64x64x6_ks7_w1x2x1_bias0_ktail0_gm0_pft_gfx950,0.0159,7.07,3541.59
gfx950,256,4,2048,7168,False,torch.bfloat16,torch.bfloat16,False,False,flydsl,156,7,8.3947,flydsl_hgemm_abf16_wbf16_bf16_t16x64x128x5_ks7_w1x2x1_bias0_ktail0_gm0_pft_gfx950,0.0165,13.99,3506.24
gfx950,256,8,2048,7168,False,torch.bfloat16,torch.bfloat16,False,False,flydsl,331,7,8.45,flydsl_hgemm_abf16_wbf16_bf16_t16x64x64x8_ks7_w1x2x1_bias0_ktail0_gm0_pft_gfx950,0.0188,27.8,3492.02
gfx950,256,16,2048,4096,False,torch.bfloat16,torch.bfloat16,False,False,flydsl,252,4,7.2877,flydsl_hgemm_abf16_wbf16_bf16_t16x64x64x7_ks4_w1x2x1_bias0_ktail0_gm0_pft_gfx950,0.0122,36.83,2329.11
gfx950,256,16,2048,7168,False,torch.bfloat16,torch.bfloat16,False,False,flydsl,286,7,8.9765,flydsl_hgemm_abf16_wbf16_bf16_t16x64x64x5_ks7_w1x2x1_bias0_ktail0_gm0_pft_gfx950,0.0201,52.33,3303.63
gfx950,256,32,2048,4096,False,torch.bfloat16,torch.bfloat16,False,False,flydsl,263,4,8.201,flydsl_hgemm_abf16_wbf16_bf16_t16x64x64x8_ks4_w1x1x2_bias0_ktail0_gm0_pft_gfx950,0.0195,65.46,2093.7
gfx950,256,32,2048,7168,False,torch.bfloat16,torch.bfloat16,False,False,flydsl,1189,7,10.4487,flydsl_hgemm_abf16_wbf16_bf16_t32x64x64x8_ks7_w1x4x1_bias0_ktail0_gm0_pft_gfx950,0.0202,89.92,2866.38
gfx950,256,48,2048,4096,False,torch.bfloat16,torch.bfloat16,False,False,flydsl,440,4,9.7894,flydsl_hgemm_abf16_wbf16_bf16_t48x64x64x6_ks4_w1x2x1_bias0_ktail0_gm0_pft_gfx950,0.0117,82.26,1774.07
gfx950,256,48,2048,7168,False,torch.bfloat16,torch.bfloat16,False,False,flydsl,521,7,12.5996,flydsl_hgemm_abf16_wbf16_bf16_t48x64x64x4_ks7_w1x2x1_bias0_ktail0_gm0_pft_gfx950,0.0198,111.85,2400.46
gfx950,256,64,2048,4096,False,torch.bfloat16,torch.bfloat16,False,False,flydsl,856,4,10.1545,flydsl_hgemm_abf16_wbf16_bf16_t32x64x64x5_ks4_w1x4x1_bias0_ktail0_gm0_pft_gfx950,0.0118,105.74,1729.64
gfx950,256,64,2048,7168,False,torch.bfloat16,torch.bfloat16,False,False,flydsl,755,4,12.9324,flydsl_hgemm_abf16_wbf16_bf16_t32x64x128x4_ks4_w1x4x1_bias0_ktail0_gm0_pft_gfx950,0.0138,145.3,2361.49
gfx950,256,80,2048,4096,False,torch.bfloat16,torch.bfloat16,False,False,asm,3,4,11.9215,_ZN5aiter39bf16gemm_fp32bf16_tn_48x64_splitk_cleanE,0.0117,112.58,1489.77
gfx950,256,80,2048,7168,False,torch.bfloat16,torch.bfloat16,False,False,asm,7,6,15.4862,_ZN5aiter39bf16gemm_fp32bf16_tn_80x64_splitk_cleanE,0.0176,151.67,1991.11
gfx950,256,96,2048,4096,False,torch.bfloat16,torch.bfloat16,False,False,flydsl,600,2,11.7244,flydsl_hgemm_abf16_wbf16_bf16_t32x64x128x4_ks2_w1x4x1_bias0_ktail0_gm0_pft_gfx950,0.0049,137.37,1531.58
gfx950,256,96,2048,7168,False,torch.bfloat16,torch.bfloat16,False,False,flydsl,665,4,15.2092,flydsl_hgemm_abf16_wbf16_bf16_t32x64x128x3_ks4_w1x2x2_bias0_ktail0_gm0_pft_gfx950,0.0213,185.32,2046.76
gfx950,256,112,2048,4096,False,torch.bfloat16,torch.bfloat16,False,False,flydsl,1012,2,11.9417,flydsl_hgemm_abf16_wbf16_bf16_t32x64x128x4_ks2_w1x4x1_bias0_ktail0_gm0_pft_gfx950,0.0049,157.35,1520.17
gfx950,256,112,2048,7168,False,torch.bfloat16,torch.bfloat16,False,False,flydsl,1206,2,15.4651,flydsl_hgemm_abf16_wbf16_bf16_t32x64x128x4_ks2_w1x4x1_bias0_ktail0_gm0_pft_gfx950,0.0058,212.63,2031.96
gfx950,256,128,2048,4096,False,torch.bfloat16,torch.bfloat16,False,False,asm,5,4,12.5345,_ZN5aiter39bf16gemm_fp32bf16_tn_64x64_splitk_cleanE,0.0116,171.33,1463.97
gfx950,256,128,2048,7168,False,torch.bfloat16,torch.bfloat16,False,False,flydsl,1251,2,16.8153,flydsl_hgemm_abf16_wbf16_bf16_t32x64x128x4_ks2_w2x2x1_bias0_ktail0_gm0_pft_gfx950,0.0059,223.49,1886.34
gfx950,256,144,2048,4096,False,torch.bfloat16,torch.bfloat16,False,False,asm,7,4,12.8576,_ZN5aiter39bf16gemm_fp32bf16_tn_80x64_splitk_cleanE,0.0116,187.9,1442.47
gfx950,256,144,2048,7168,False,torch.bfloat16,torch.bfloat16,False,False,asm,7,4,17.807,_ZN5aiter39bf16gemm_fp32bf16_tn_80x64_splitk_cleanE,0.014,237.43,1797.85
gfx950,256,160,2048,4096,False,torch.bfloat16,torch.bfloat16,False,False,asm,7,4,13.114,_ZN5aiter39bf16gemm_fp32bf16_tn_80x64_splitk_cleanE,0.0116,204.69,1429.26
gfx950,256,160,2048,7168,False,torch.bfloat16,torch.bfloat16,False,False,asm,7,4,18.0801,_ZN5aiter39bf16gemm_fp32bf16_tn_80x64_splitk_cleanE,0.0142,259.82,1787.01
gfx950,256,176,2048,4096,False,torch.bfloat16,torch.bfloat16,False,False,asm,8,4,13.8642,_ZN5aiter39bf16gemm_fp32bf16_tn_96x64_splitk_cleanE,0.0115,212.98,1366.1
gfx950,256,176,2048,7168,False,torch.bfloat16,torch.bfloat16,False,False,asm,8,4,18.7126,_ZN5aiter39bf16gemm_fp32bf16_tn_96x64_splitk_cleanE,0.0143,276.14,1742.36
gfx950,256,192,2048,4096,False,torch.bfloat16,torch.bfloat16,False,False,asm,8,4,13.9924,_ZN5aiter39bf16gemm_fp32bf16_tn_96x64_splitk_cleanE,0.0118,230.21,1367.64
gfx950,256,192,2048,7168,False,torch.bfloat16,torch.bfloat16,False,False,asm,8,4,19.0276,_ZN5aiter39bf16gemm_fp32bf16_tn_96x64_splitk_cleanE,0.014,296.26,1729.02
gfx950,256,208,2048,4096,False,torch.bfloat16,torch.bfloat16,False,False,flydsl,120,1,16.2246,flydsl_hgemm_abf16_wbf16_bf16_t16x64x64x6_ks1_w1x2x1_bias0_ktail0_gm0_pft_gfx950,0.0,215.08,1191.59
gfx950,256,208,2048,7168,False,torch.bfloat16,torch.bfloat16,False,False,torch,0,0,21.9555,native,0.0,278.15,1511.88
gfx950,256,224,2048,4096,False,torch.bfloat16,torch.bfloat16,False,False,flydsl,447,1,14.9527,flydsl_hgemm_abf16_wbf16_bf16_t32x64x128x4_ks1_w2x1x2_bias0_ktail0_gm0_pft_gfx950,0.005,251.33,1306.1
gfx950,256,224,2048,7168,False,torch.bfloat16,torch.bfloat16,False,False,flydsl,501,1,23.5922,flydsl_hgemm_abf16_wbf16_bf16_t32x64x128x4_ks1_w1x4x1_bias0_ktail0_gm0_pft_gfx950,0.0,278.76,1419.49
gfx950,256,240,2048,4096,False,torch.bfloat16,torch.bfloat16,False,False,torch,0,0,16.6924,native,0.0,241.22,1181.76
gfx950,256,240,2048,7168,False,torch.bfloat16,torch.bfloat16,False,False,torch,0,0,23.5002,native,0.0,299.85,1437.6
gfx950,256,256,2048,4096,False,torch.bfloat16,torch.bfloat16,False,False,flydsl,969,1,14.6651,flydsl_hgemm_abf16_wbf16_bf16_t32x64x128x4_ks1_w1x4x1_bias0_ktail0_gm0_pft_gfx950,0.0,292.87,1358.53
gfx950,256,256,2048,7168,False,torch.bfloat16,torch.bfloat16,False,False,torch,0,0,20.9684,native,0.0,358.45,1625.24
gfx950,256,288,2048,4096,False,torch.bfloat16,torch.bfloat16,False,False,asm,7,2,17.9153,_ZN5aiter39bf16gemm_fp32bf16_tn_80x64_splitk_cleanE,0.0048,269.7,1134.01
gfx950,256,288,2048,7168,False,torch.bfloat16,torch.bfloat16,False,False,asm,7,2,26.8006,_ZN5aiter39bf16gemm_fp32bf16_tn_80x64_splitk_cleanE,0.0061,315.5,1293.57
gfx950,256,320,2048,4096,False,torch.bfloat16,torch.bfloat16,False,False,torch,0,0,17.7754,native,0.0,302.03,1165.06
gfx950,256,320,2048,7168,False,torch.bfloat16,torch.bfloat16,False,False,torch,0,0,26.1739,native,0.0,358.95,1347.08
gfx950,256,352,2048,4096,False,torch.bfloat16,torch.bfloat16,False,False,torch,0,0,17.6956,native,0.0,333.73,1192.53
gfx950,256,352,2048,7168,False,torch.bfloat16,torch.bfloat16,False,False,torch,0,0,27.5239,native,0.0,375.48,1302.44
gfx950,256,384,2048,4096,False,torch.bfloat16,torch.bfloat16,False,False,torch,0,0,18.2783,native,0.0,352.46,1176.03
gfx950,256,384,2048,7168,False,torch.bfloat16,torch.bfloat16,False,False,torch,0,0,27.9876,native,0.0,402.83,1301.93
gfx950,256,416,2048,4096,False,torch.bfloat16,torch.bfloat16,False,False,torch,0,0,19.643,native,0.0,355.31,1114.34
gfx950,256,416,2048,7168,False,torch.bfloat16,torch.bfloat16,False,False,torch,0,0,29.6366,native,0.0,412.12,1249.4
gfx950,256,448,2048,4096,False,torch.bfloat16,torch.bfloat16,False,False,flydsl,1906,1,18.8006,flydsl_hgemm_abf16_wbf16_bf16_t64x64x128x5_ks1_w2x2x2_bias0_ktail0_gm0_pft_gfx950,0.005,399.78,1185.19
gfx950,256,448,2048,7168,False,torch.bfloat16,torch.bfloat16,False,False,torch,0,0,30.5356,native,0.0,430.75,1231.93
gfx950,256,480,2048,4096,False,torch.bfloat16,torch.bfloat16,False,False,torch,0,0,19.8541,native,0.0,405.61,1142.1
gfx950,256,480,2048,7168,False,torch.bfloat16,torch.bfloat16,False,False,torch,0,0,32.1261,native,0.0,438.67,1189.3
gfx950,256,512,2048,4096,False,torch.bfloat16,torch.bfloat16,False,False,flydsl,3242,1,19.443,flydsl_hgemm_abf16_wbf16_bf16_t64x64x128x5_ks1_w2x4x1_bias0_ktail0_gm0_pft_gfx950,0.0,441.8,1186.48
gfx950,256,512,2048,7168,False,torch.bfloat16,torch.bfloat16,False,False,torch,0,0,28.4268,native,0.0,528.81,1364.81
gfx950,256,544,2048,4096,False,torch.bfloat16,torch.bfloat16,False,False,torch,0,0,23.2097,native,0.0,393.23,1010.87
gfx950,256,544,2048,7168,False,torch.bfloat16,torch.bfloat16,False,False,torch,0,0,35.0851,native,0.0,455.23,1122.62
gfx950,256,576,2048,4096,False,torch.bfloat16,torch.bfloat16,False,False,flydsl,705,1,22.4665,flydsl_hgemm_abf16_wbf16_bf16_t48x64x64x4_ks1_w1x2x1_bias0_ktail0_gm4_pft_gfx950,0.0,430.14,1061.81
gfx950,256,576,2048,7168,False,torch.bfloat16,torch.bfloat16,False,False,torch,0,0,30.5209,native,0.0,554.09,1309.82
gfx950,256,608,2048,4096,False,torch.bfloat16,torch.bfloat16,False,False,torch,0,0,22.4031,native,0.0,455.32,1082.36
gfx950,256,608,2048,7168,False,torch.bfloat16,torch.bfloat16,False,False,torch,0,0,35.7086,native,0.0,499.91,1136.05
gfx950,256,640,2048,4096,False,torch.bfloat16,torch.bfloat16,False,False,flydsl,3035,1,22.9013,flydsl_hgemm_abf16_wbf16_bf16_t96x64x128x3_ks1_w2x1x2_bias0_ktail0_gm4_pft_gfx950,0.0049,468.86,1075.99
gfx950,256,640,2048,7168,False,torch.bfloat16,torch.bfloat16,False,False,torch,0,0,35.2365,native,0.0,533.27,1168.01
gfx950,256,672,2048,4096,False,torch.bfloat16,torch.bfloat16,False,False,flydsl,1827,1,23.1849,flydsl_hgemm_abf16_wbf16_bf16_t96x64x128x3_ks1_w2x1x2_bias0_ktail0_gm4_pft_gfx950,0.0049,486.28,1079.79
gfx950,256,672,2048,7168,False,torch.bfloat16,torch.bfloat16,False,False,torch,0,0,39.2729,native,0.0,502.38,1062.98
gfx950,256,704,2048,4096,False,torch.bfloat16,torch.bfloat16,False,False,flydsl,1771,1,24.566,flydsl_hgemm_abf16_wbf16_bf16_t64x96x128x3_ks1_w1x2x2_bias0_ktail0_gm4_pft_gfx950,0.0049,480.79,1035.09
gfx950,256,704,2048,7168,False,torch.bfloat16,torch.bfloat16,False,False,torch,0,0,40.2133,native,0.0,514.0,1052.79
gfx950,256,736,2048,4096,False,torch.bfloat16,torch.bfloat16,False,False,flydsl,2954,1,23.7397,flydsl_hgemm_abf16_wbf16_bf16_t96x64x128x4_ks1_w2x1x2_bias0_ktail0_gm0_pft_gfx950,0.0049,520.14,1087.68
gfx950,256,736,2048,7168,False,torch.bfloat16,torch.bfloat16,False,False,flydsl,3129,1,37.886,flydsl_hgemm_abf16_wbf16_bf16_t96x64x128x3_ks1_w2x1x2_bias0_ktail0_gm4_pft_gfx950,0.006,570.37,1133.03
gfx950,256,768,2048,4096,False,torch.bfloat16,torch.bfloat16,False,False,flydsl,3053,1,23.8967,flydsl_hgemm_abf16_wbf16_bf16_t96x64x128x3_ks1_w2x1x2_bias0_ktail0_gm4_pft_gfx950,0.0049,539.19,1096.99
gfx950,256,768,2048,7168,False,torch.bfloat16,torch.bfloat16,False,False,flydsl,3265,1,40.0315,flydsl_hgemm_abf16_wbf16_bf16_t96x64x128x3_ks1_w2x1x2_bias0_ktail0_gm4_pft_gfx950,0.006,563.27,1087.04
gfx950,256,800,2048,4096,False,torch.bfloat16,torch.bfloat16,False,False,flydsl,772,1,26.3914,flydsl_hgemm_abf16_wbf16_bf16_t64x128x128x3_ks1_w2x2x2_bias0_ktail0_gm0_pft_gfx950,0.0049,508.57,1008.19
gfx950,256,800,2048,7168,False,torch.bfloat16,torch.bfloat16,False,False,torch,0,0,43.6473,native,0.0,538.13,1010.5
gfx950,256,832,2048,4096,False,torch.bfloat16,torch.bfloat16,False,False,flydsl,768,1,26.4555,flydsl_hgemm_abf16_wbf16_bf16_t64x128x128x3_ks1_w1x4x2_bias0_ktail0_gm0_pft_gfx950,0.0049,527.63,1020.61
gfx950,256,832,2048,7168,False,torch.bfloat16,torch.bfloat16,False,False,torch,0,0,44.1185,native,0.0,553.68,1013.08
gfx950,256,864,2048,4096,False,torch.bfloat16,torch.bfloat16,False,False,flydsl,1656,1,26.8415,flydsl_hgemm_abf16_wbf16_bf16_t64x128x128x3_ks1_w1x4x2_bias0_ktail0_gm0_pft_gfx950,0.0049,540.04,1020.59
gfx950,256,864,2048,7168,False,torch.bfloat16,torch.bfloat16,False,False,torch,0,0,44.5957,native,0.0,568.83,1015.47
gfx950,256,896,2048,4096,False,torch.bfloat16,torch.bfloat16,False,False,flydsl,1712,1,27.2398,flydsl_hgemm_abf16_wbf16_bf16_t64x128x128x3_ks1_w1x4x2_bias0_ktail0_gm0_pft_gfx950,0.0049,551.85,1020.1
gfx950,256,896,2048,7168,False,torch.bfloat16,torch.bfloat16,False,False,torch,0,0,44.8688,native,0.0,586.3,1022.43
gfx950,256,928,2048,4096,False,torch.bfloat16,torch.bfloat16,False,False,flydsl,769,1,27.0189,flydsl_hgemm_abf16_wbf16_bf16_t64x128x128x3_ks1_w1x4x2_bias0_ktail0_gm4_pft_gfx950,0.0049,576.24,1042.99
gfx950,256,928,2048,7168,False,torch.bfloat16,torch.bfloat16,False,False,torch,0,0,45.5381,native,0.0,598.32,1020.35
gfx950,256,960,2048,4096,False,torch.bfloat16,torch.bfloat16,False,False,flydsl,768,1,27.5968,flydsl_hgemm_abf16_wbf16_bf16_t64x128x128x3_ks1_w1x4x2_bias0_ktail0_gm0_pft_gfx950,0.0049,583.62,1035.4
gfx950,256,960,2048,7168,False,torch.bfloat16,torch.bfloat16,False,False,flydsl,768,1,46.3583,flydsl_hgemm_abf16_wbf16_bf16_t64x128x128x3_ks1_w1x4x2_bias0_ktail0_gm0_pft_gfx950,0.0061,608.0,1015.03
gfx950,256,992,2048,4096,False,torch.bfloat16,torch.bfloat16,False,False,flydsl,1873,1,27.3551,flydsl_hgemm_abf16_wbf16_bf16_t64x128x128x3_ks1_w1x4x2_bias0_ktail0_gm4_pft_gfx950,0.0049,608.41,1058.92
gfx950,256,992,2048,7168,False,torch.bfloat16,torch.bfloat16,False,False,flydsl,2020,1,47.0364,flydsl_hgemm_abf16_wbf16_bf16_t64x128x128x3_ks1_w1x4x2_bias0_ktail0_gm0_pft_gfx950,0.0061,619.21,1012.93
gfx950,256,1024,2048,4096,False,torch.bfloat16,torch.bfloat16,False,False,flydsl,486,1,28.0749,flydsl_hgemm_abf16_wbf16_bf16_t128x64x128x3_ks1_w4x1x2_bias0_ktail0_gm0_pft_gfx950,0.0049,611.93,1045.78
gfx950,256,1024,2048,7168,False,torch.bfloat16,torch.bfloat16,False,False,torch,0,0,43.2949,native,0.0,694.42,1114.09
gfx950,256,1088,2048,4096,False,torch.bfloat16,torch.bfloat16,False,False,flydsl,691,1,36.3919,flydsl_hgemm_abf16_wbf16_bf16_t64x128x64x3_ks1_w1x2x2_bias0_ktail0_gm4_pft_gfx950,0.0049,501.58,828.39
gfx950,256,1088,2048,7168,False,torch.bfloat16,torch.bfloat16,False,False,torch,0,0,50.5106,native,0.0,632.42,978.29
gfx950,256,1152,2048,4096,False,torch.bfloat16,torch.bfloat16,False,False,torch,0,0,30.7346,native,0.0,628.85,1006.46
gfx950,256,1152,2048,7168,False,torch.bfloat16,torch.bfloat16,False,False,torch,0,0,51.2486,native,0.0,659.98,987.22
gfx950,256,1216,2048,4096,False,torch.bfloat16,torch.bfloat16,False,False,flydsl,2093,1,36.3034,flydsl_hgemm_abf16_wbf16_bf16_t96x64x128x2_ks1_w2x2x1_bias0_ktail0_gm4_pft_gfx950,0.0,561.96,873.73
gfx950,256,1216,2048,7168,False,torch.bfloat16,torch.bfloat16,False,False,torch,0,0,55.2367,native,0.0,646.34,937.3
gfx950,256,1280,2048,4096,False,torch.bfloat16,torch.bfloat16,False,False,flydsl,2128,1,36.0338,flydsl_hgemm_abf16_wbf16_bf16_t96x128x64x4_ks1_w2x2x1_bias0_ktail0_gm0_pft_gfx950,0.0,595.96,902.09
gfx950,256,1280,2048,7168,False,torch.bfloat16,torch.bfloat16,False,False,torch,0,0,53.4284,native,0.0,703.39,991.1
gfx950,256,1344,2048,4096,False,torch.bfloat16,torch.bfloat16,False,False,flydsl,210,1,38.1263,flydsl_hgemm_abf16_wbf16_bf16_t128x128x64x4_ks1_w4x2x2_bias0_ktail0_gm0_pft_gfx950,0.0049,591.42,873.21
gfx950,256,1344,2048,7168,False,torch.bfloat16,torch.bfloat16,False,False,torch,0,0,58.0875,native,0.0,679.32,931.92
gfx950,256,1408,2048,4096,False,torch.bfloat16,torch.bfloat16,False,False,flydsl,1904,1,36.7766,flydsl_hgemm_abf16_wbf16_bf16_t96x128x64x3_ks1_w2x2x1_bias0_ktail0_gm0_pft_gfx950,0.0,642.32,926.64
gfx950,256,1408,2048,7168,False,torch.bfloat16,torch.bfloat16,False,False,torch,0,0,58.7603,native,0.0,703.52,941.32
gfx950,256,1472,2048,4096,False,torch.bfloat16,torch.bfloat16,False,False,flydsl,206,1,38.6741,flydsl_hgemm_abf16_wbf16_bf16_t128x128x64x4_ks1_w2x4x2_bias0_ktail0_gm0_pft_gfx950,0.0049,638.57,901.51
gfx950,256,1472,2048,7168,False,torch.bfloat16,torch.bfloat16,False,False,flydsl,7,1,65.2902,flydsl_hgemm_abf16_wbf16_bf16_t128x128x128x2_ks1_w2x4x1_bias0_ktail0_gm0_pht_gfx950,0.0,661.94,865.25
gfx950,256,1536,2048,4096,False,torch.bfloat16,torch.bfloat16,False,False,flydsl,2086,1,38.0399,flydsl_hgemm_abf16_wbf16_bf16_t96x128x64x4_ks1_w2x2x1_bias0_ktail0_gm0_pft_gfx950,0.0,677.44,937.22
gfx950,256,1536,2048,7168,False,torch.bfloat16,torch.bfloat16,False,False,torch,0,0,57.2793,native,0.0,787.32,1006.85
gfx950,256,1600,2048,4096,False,torch.bfloat16,torch.bfloat16,False,False,flydsl,9,1,39.9031,flydsl_hgemm_abf16_wbf16_bf16_t128x128x128x2_ks1_w2x4x1_bias0_ktail0_gm4_pht_gfx950,0.0,672.72,913.16
gfx950,256,1600,2048,7168,False,torch.bfloat16,torch.bfloat16,False,False,flydsl,7,1,66.6663,flydsl_hgemm_abf16_wbf16_bf16_t128x128x128x2_ks1_w2x4x1_bias0_ktail0_gm0_pht_gfx950,0.0,704.65,882.77
gfx950,256,1664,2048,4096,False,torch.bfloat16,torch.bfloat16,False,False,flydsl,7,1,40.435,flydsl_hgemm_abf16_wbf16_bf16_t128x128x128x2_ks1_w2x4x1_bias0_ktail0_gm0_pht_gfx950,0.0,690.42,920.6
gfx950,256,1664,2048,7168,False,torch.bfloat16,torch.bfloat16,False,False,flydsl,7,1,67.5021,flydsl_hgemm_abf16_wbf16_bf16_t128x128x128x2_ks1_w2x4x1_bias0_ktail0_gm0_pht_gfx950,0.0,723.76,889.32
gfx950,256,1728,2048,4096,False,torch.bfloat16,torch.bfloat16,False,False,flydsl,7,1,40.8219,flydsl_hgemm_abf16_wbf16_bf16_t128x128x128x2_ks1_w2x4x1_bias0_ktail0_gm0_pht_gfx950,0.0,710.18,931.14
gfx950,256,1728,2048,7168,False,torch.bfloat16,torch.bfloat16,False,False,flydsl,7,1,67.5794,flydsl_hgemm_abf16_wbf16_bf16_t128x128x128x2_ks1_w2x4x1_bias0_ktail0_gm0_pht_gfx950,0.0,750.74,905.76
gfx950,256,1792,2048,4096,False,torch.bfloat16,torch.bfloat16,False,False,flydsl,7,1,40.9215,flydsl_hgemm_abf16_wbf16_bf16_t128x128x128x2_ks1_w2x4x1_bias0_ktail0_gm0_pht_gfx950,0.0,734.69,948.09
gfx950,256,1792,2048,7168,False,torch.bfloat16,torch.bfloat16,False,False,flydsl,7,1,69.0174,flydsl_hgemm_abf16_wbf16_bf16_t128x128x128x2_ks1_w2x4x1_bias0_ktail0_gm0_pht_gfx950,0.0,762.32,903.98
gfx950,256,1856,2048,4096,False,torch.bfloat16,torch.bfloat16,False,False,flydsl,207,1,41.2463,flydsl_hgemm_abf16_wbf16_bf16_t128x128x64x4_ks1_w2x4x2_bias0_ktail0_gm4_pft_gfx950,0.0049,754.94,959.69
gfx950,256,1856,2048,7168,False,torch.bfloat16,torch.bfloat16,False,False,flydsl,7,1,70.605,flydsl_hgemm_abf16_wbf16_bf16_t128x128x128x2_ks1_w2x4x1_bias0_ktail0_gm0_pht_gfx950,0.0,771.79,900.36
gfx950,256,1920,2048,4096,False,torch.bfloat16,torch.bfloat16,False,False,flydsl,7,1,42.5603,flydsl_hgemm_abf16_wbf16_bf16_t128x128x128x2_ks1_w2x4x1_bias0_ktail0_gm0_pht_gfx950,0.0,756.86,948.54
gfx950,256,1920,2048,7168,False,torch.bfloat16,torch.bfloat16,False,False,flydsl,7,1,71.7806,flydsl_hgemm_abf16_wbf16_bf16_t128x128x128x2_ks1_w2x4x1_bias0_ktail0_gm0_pht_gfx950,0.0,785.33,902.05
gfx950,256,1984,2048,4096,False,torch.bfloat16,torch.bfloat16,False,False,flydsl,9,1,41.3687,flydsl_hgemm_abf16_wbf16_bf16_t128x128x128x2_ks1_w2x4x1_bias0_ktail0_gm4_pht_gfx950,0.0,804.62,994.87
gfx950,256,1984,2048,7168,False,torch.bfloat16,torch.bfloat16,False,False,flydsl,9,1,71.8123,flydsl_hgemm_abf16_wbf16_bf16_t128x128x128x2_ks1_w2x4x1_bias0_ktail0_gm4_pht_gfx950,0.0,811.15,918.08
gfx950,256,2048,2048,4096,False,torch.bfloat16,torch.bfloat16,False,False,flydsl,9,1,42.6751,flydsl_hgemm_abf16_wbf16_bf16_t128x128x128x2_ks1_w2x4x1_bias0_ktail0_gm4_pht_gfx950,0.0,805.15,982.85
gfx950,256,2048,2048,7168,False,torch.bfloat16,torch.bfloat16,False,False,flydsl,9,1,71.4238,flydsl_hgemm_abf16_wbf16_bf16_t128x128x128x2_ks1_w2x4x1_bias0_ktail0_gm4_pht_gfx950,0.0,841.87,939.59
gfx950,256,4096,2048,4096,False,torch.bfloat16,torch.bfloat16,False,False,opus,6401,0,65.8278,opus_gemm_mono_tile_512x128x256x64_2x4_16x16x32_0x0x0_nooob_4g_safe,0.0,1043.93,1019.46
gfx950,256,4096,2048,7168,False,torch.bfloat16,torch.bfloat16,False,False,opus,1401,0,108.5839,opus_gemm_mono_tile_512x128x256x64_2x4_16x16x32_0x0x0_nooob,0.0,1107.52,965.68
gfx950,256,6144,2048,4096,False,torch.bfloat16,torch.bfloat16,False,False,opus,6400,0,83.842,opus_gemm_mono_tile_512x192x256x64_2x4_16x16x32_0x0x0_nooob_4g_safe,0.0,1229.45,1100.58
gfx950,256,6144,2048,7168,False,torch.bfloat16,torch.bfloat16,False,False,opus,1400,0,137.9404,opus_gemm_mono_tile_512x192x256x64_2x4_16x16x32_0x0x0_nooob,0.0,1307.73,1033.83
gfx950,256,8192,2048,4096,False,torch.bfloat16,torch.bfloat16,False,False,flydsl,393,1,105.0475,flydsl_hgemm_abf16_wbf16_bf16_t256x256x64x2_ks1_w2x4x1_bias0_ktail0_gm4_pht_gfx950,0.0,1308.35,1117.98
gfx950,256,8192,2048,7168,False,torch.bfloat16,torch.bfloat16,False,False,flydsl,393,1,172.2631,flydsl_hgemm_abf16_wbf16_bf16_t256x256x64x2_ks1_w2x4x1_bias0_ktail0_gm4_pht_gfx950,0.0,1396.23,1046.97
gfx950,256,10240,2048,4096,False,torch.bfloat16,torch.bfloat16,False,False,torch,0,0,147.7322,native,0.0,1162.91,965.3
gfx950,256,10240,2048,7168,False,torch.bfloat16,torch.bfloat16,False,False,torch,0,0,245.2832,native,0.0,1225.72,889.19
gfx950,256,12288,2048,4096,False,torch.bfloat16,torch.bfloat16,False,False,opus,1400,0,159.931,opus_gemm_mono_tile_512x192x256x64_2x4_16x16x32_0x0x0_nooob,0.0,1289.05,1049.03
gfx950,256,12288,2048,7168,False,torch.bfloat16,torch.bfloat16,False,False,opus,1400,0,263.9854,opus_gemm_mono_tile_512x192x256x64_2x4_16x16x32_0x0x0_nooob,0.0,1366.66,969.19
gfx950,256,14336,2048,4096,False,torch.bfloat16,torch.bfloat16,False,False,flydsl,393,1,185.9846,flydsl_hgemm_abf16_wbf16_bf16_t256x256x64x2_ks1_w2x4x1_bias0_ktail0_gm4_pht_gfx950,0.0,1293.22,1037.39
gfx950,256,14336,2048,7168,False,torch.bfloat16,torch.bfloat16,False,False,torch,0,0,311.0964,native,0.0,1352.98,943.76
gfx950,256,16384,2048,4096,False,torch.bfloat16,torch.bfloat16,False,False,torch,0,0,196.5802,native,0.0,1398.3,1109.49
gfx950,256,16384,2048,7168,False,torch.bfloat16,torch.bfloat16,False,False,torch,0,0,319.9169,native,0.0,1503.63,1035.74
gfx950,256,32768,2048,7168,False,torch.bfloat16,torch.bfloat16,False,False,torch,0,0,635.4559,native,0.0,1513.99,996.67
gfx950,256,16,64640,4096,False,torch.bfloat16,torch.bfloat16,False,False,triton,0,0,88.6176,auto,0.0,95.61,6000.28
gfx950,256,32,64640,4096,False,torch.bfloat16,torch.bfloat16,False,False,torch,0,0,91.6502,native,0.0,184.89,5825.74
gfx950,256,48,64640,4096,False,torch.bfloat16,torch.bfloat16,False,False,torch,0,0,93.1424,native,0.0,272.89,5756.02
gfx950,256,64,64640,4096,False,torch.bfloat16,torch.bfloat16,False,False,torch,0,0,95.7909,native,0.0,353.79,5619.84
gfx950,256,80,64640,4096,False,torch.bfloat16,torch.bfloat16,False,False,torch,0,0,94.9666,native,0.0,446.08,5691.78
gfx950,256,96,64640,4096,False,torch.bfloat16,torch.bfloat16,False,False,torch,0,0,97.7735,native,0.0,519.93,5550.87
gfx950,256,112,64640,4096,False,torch.bfloat16,torch.bfloat16,False,False,torch,0,0,107.5508,native,0.0,551.44,5066.7
gfx950,256,128,64640,4096,False,torch.bfloat16,torch.bfloat16,False,False,flydsl,48,1,110.7322,flydsl_hgemm_abf16_wbf16_bf16_t128x256x64x3_ks1_w2x4x2_bias0_ktail0_gm0_pft_gfx950,0.0049,612.11,4941.0
gfx950,256,144,64640,4096,False,torch.bfloat16,torch.bfloat16,False,False,torch,0,0,102.679,native,0.0,742.63,5349.94
gfx950,256,160,64640,4096,False,torch.bfloat16,torch.bfloat16,False,False,torch,0,0,99.0226,native,0.0,855.61,5569.7
gfx950,256,176,64640,4096,False,torch.bfloat16,torch.bfloat16,False,False,torch,0,0,112.9673,native,0.0,824.99,4901.65
gfx950,256,192,64640,4096,False,torch.bfloat16,torch.bfloat16,False,False,torch,0,0,112.0474,native,0.0,907.38,4961.52
gfx950,256,208,64640,4096,False,torch.bfloat16,torch.bfloat16,False,False,torch,0,0,122.374,native,0.0,900.05,4560.81
gfx950,256,224,64640,4096,False,torch.bfloat16,torch.bfloat16,False,False,torch,0,0,119.4653,native,0.0,992.88,4690.27
gfx950,256,240,64640,4096,False,torch.bfloat16,torch.bfloat16,False,False,torch,0,0,135.1923,native,0.0,940.05,4160.92
gfx950,256,256,64640,4096,False,torch.bfloat16,torch.bfloat16,False,False,torch,0,0,126.0101,native,0.0,1075.79,4481.57
gfx950,256,288,64640,4096,False,torch.bfloat16,torch.bfloat16,False,False,torch,0,0,169.6259,native,0.0,899.07,3355.16
gfx950,256,320,64640,4096,False,torch.bfloat16,torch.bfloat16,False,False,torch,0,0,168.8119,native,0.0,1003.78,3397.4
gfx950,256,352,64640,4096,False,torch.bfloat16,torch.bfloat16,False,False,torch,0,0,189.1352,native,0.0,985.51,3055.6
gfx950,256,384,64640,4096,False,torch.bfloat16,torch.bfloat16,False,False,torch,0,0,188.5068,native,0.0,1078.69,3089.12
gfx950,256,416,64640,4096,False,torch.bfloat16,torch.bfloat16,False,False,torch,0,0,212.8942,native,0.0,1034.72,2755.92
gfx950,256,448,64640,4096,False,torch.bfloat16,torch.bfloat16,False,False,torch,0,0,210.7649,native,0.0,1125.57,2804.63
gfx950,256,480,64640,4096,False,torch.bfloat16,torch.bfloat16,False,False,torch,0,0,265.0912,native,0.0,958.82,2246.46
gfx950,256,512,64640,4096,False,torch.bfloat16,torch.bfloat16,False,False,torch,0,0,248.769,native,0.0,1089.85,2411.54
gfx950,256,544,64640,4096,False,torch.bfloat16,torch.bfloat16,False,False,torch,0,0,260.5454,native,0.0,1105.62,2319.43
gfx950,256,576,64640,4096,False,torch.bfloat16,torch.bfloat16,False,False,torch,0,0,264.7252,native,0.0,1152.18,2299.42
gfx950,256,608,64640,4096,False,torch.bfloat16,torch.bfloat16,False,False,torch,0,0,306.1113,native,0.0,1051.76,2002.91
gfx950,256,640,64640,4096,False,torch.bfloat16,torch.bfloat16,False,False,torch,0,0,291.121,native,0.0,1164.12,2121.16
gfx950,256,672,64640,4096,False,torch.bfloat16,torch.bfloat16,False,False,torch,0,0,294.618,native,0.0,1207.82,2110.91
gfx950,256,704,64640,4096,False,torch.bfloat16,torch.bfloat16,False,False,torch,0,0,346.7276,native,0.0,1075.17,1806.35
gfx950,256,736,64640,4096,False,torch.bfloat16,torch.bfloat16,False,False,torch,0,0,304.2954,native,0.0,1280.78,2072.69
gfx950,256,768,64640,4096,False,torch.bfloat16,torch.bfloat16,False,False,torch,0,0,302.9043,native,0.0,1342.6,2096.73
gfx950,256,800,64640,4096,False,torch.bfloat16,torch.bfloat16,False,False,torch,0,0,391.863,native,0.0,1081.05,1631.97
gfx950,256,832,64640,4096,False,torch.bfloat16,torch.bfloat16,False,False,torch,0,0,396.6435,native,0.0,1110.74,1623.39
gfx950,256,864,64640,4096,False,torch.bfloat16,torch.bfloat16,False,False,torch,0,0,381.2144,native,0.0,1200.15,1700.64
gfx950,256,896,64640,4096,False,torch.bfloat16,torch.bfloat16,False,False,torch,0,0,379.7909,native,0.0,1249.27,1718.59
gfx950,256,928,64640,4096,False,torch.bfloat16,torch.bfloat16,False,False,torch,0,0,454.6009,native,0.0,1080.96,1445.45
gfx950,256,960,64640,4096,False,torch.bfloat16,torch.bfloat16,False,False,torch,0,0,451.1529,native,0.0,1126.78,1466.25
gfx950,256,992,64640,4096,False,torch.bfloat16,torch.bfloat16,False,False,torch,0,0,392.7709,native,0.0,1337.41,1695.4
gfx950,256,1024,64640,4096,False,torch.bfloat16,torch.bfloat16,False,False,torch,0,0,399.2843,native,0.0,1358.03,1678.76
gfx950,256,1088,64640,4096,False,torch.bfloat16,torch.bfloat16,False,False,torch,0,0,460.4406,native,0.0,1251.26,1474.89
gfx950,256,1152,64640,4096,False,torch.bfloat16,torch.bfloat16,False,False,torch,0,0,544.601,native,0.0,1120.12,1263.12
gfx950,256,1216,64640,4096,False,torch.bfloat16,torch.bfloat16,False,False,torch,0,0,479.9605,native,0.0,1341.59,1451.57
gfx950,256,1280,64640,4096,False,torch.bfloat16,torch.bfloat16,False,False,torch,0,0,489.1098,native,0.0,1385.78,1442.41
gfx950,256,1344,64640,4096,False,torch.bfloat16,torch.bfloat16,False,False,torch,0,0,559.1391,native,0.0,1272.83,1277.49
gfx950,256,1408,64640,4096,False,torch.bfloat16,torch.bfloat16,False,False,torch,0,0,655.8101,native,0.0,1136.88,1102.59
gfx950,256,1472,64640,4096,False,torch.bfloat16,torch.bfloat16,False,False,torch,0,0,580.5697,native,0.0,1342.59,1260.64
gfx950,256,1536,64640,4096,False,torch.bfloat16,torch.bfloat16,False,False,torch,0,0,571.0829,native,0.0,1424.24,1296.99
gfx950,256,1600,64640,4096,False,torch.bfloat16,torch.bfloat16,False,False,torch,0,0,670.4948,native,0.0,1263.62,1117.81
gfx950,256,1664,64640,4096,False,torch.bfloat16,torch.bfloat16,False,False,torch,0,0,782.5429,native,0.0,1125.99,969.0
gfx950,256,1728,64640,4096,False,torch.bfloat16,torch.bfloat16,False,False,torch,0,0,680.3445,native,0.0,1344.95,1127.49
gfx950,256,1792,64640,4096,False,torch.bfloat16,torch.bfloat16,False,False,torch,0,0,693.7625,native,0.0,1367.79,1118.37
gfx950,256,1856,64640,4096,False,torch.bfloat16,torch.bfloat16,False,False,opus,2009,0,815.5482,opus_gemm_512x256x256x64_2x4_16x16x32_0x0x0_cA1cB17,0.0,1205.09,962.15
gfx950,256,1920,64640,4096,False,torch.bfloat16,torch.bfloat16,False,False,opus,9,0,814.8151,opus_gemm_512x256x256x64_2x4_16x16x32_0x0x0,0.0,1247.77,973.81
gfx950,256,1984,64640,4096,False,torch.bfloat16,torch.bfloat16,False,False,flydsl,393,1,746.4978,flydsl_hgemm_abf16_wbf16_bf16_t256x256x64x2_ks1_w2x4x1_bias0_ktail0_gm4_pht_gfx950,0.0,1407.36,1074.72
gfx950,256,2048,64640,4096,False,torch.bfloat16,torch.bfloat16,False,False,flydsl,393,1,763.2082,flydsl_hgemm_abf16_wbf16_bf16_t256x256x64x2_ks1_w2x4x1_bias0_ktail0_gm4_pht_gfx950,0.0,1420.95,1062.72
gfx950,256,4096,64640,4096,False,torch.bfloat16,torch.bfloat16,False,False,flydsl,19,1,1475.7688,flydsl_hgemm_abf16_wbf16_bf16_t256x256x64x2_ks1_w2x4x1_bias0_ktail0_gm4_pht_gfx950,0.0,1469.71,740.37
gfx950,256,6144,64640,4096,False,torch.bfloat16,torch.bfloat16,False,False,flydsl,19,1,2278.3795,flydsl_hgemm_abf16_wbf16_bf16_t256x256x64x2_ks1_w2x4x1_bias0_ktail0_gm4_pht_gfx950,0.0,1427.96,603.13
gfx950,256,8192,64640,4096,False,torch.bfloat16,torch.bfloat16,False,False,flydsl,19,1,2894.3632,flydsl_hgemm_abf16_wbf16_bf16_t256x256x64x2_ks1_w2x4x1_bias0_ktail0_gm4_pht_gfx950,0.0,1498.75,572.04
gfx950,256,10240,64640,4096,False,torch.bfloat16,torch.bfloat16,False,False,flydsl,19,1,3763.7298,flydsl_hgemm_abf16_wbf16_bf16_t256x256x64x2_ks1_w2x4x1_bias0_ktail0_gm4_pht_gfx950,0.0,1440.7,514.71
gfx950,256,12288,64640,4096,False,torch.bfloat16,torch.bfloat16,False,False,flydsl,19,1,4460.4579,flydsl_hgemm_abf16_wbf16_bf16_t256x256x64x2_ks1_w2x4x1_bias0_ktail0_gm4_pht_gfx950,0.0,1458.79,497.43
gfx950,256,14336,64640,4096,False,torch.bfloat16,torch.bfloat16,False,False,flydsl,19,1,5262.1232,flydsl_hgemm_abf16_wbf16_bf16_t256x256x64x2_ks1_w2x4x1_bias0_ktail0_gm4_pht_gfx950,0.0,1442.64,475.16
gfx950,256,16384,64640,4096,False,torch.bfloat16,torch.bfloat16,False,False,flydsl,19,1,5905.0486,flydsl_hgemm_abf16_wbf16_bf16_t256x256x64x2_ks1_w2x4x1_bias0_ktail0_gm4_pht_gfx950,0.0,1469.22,471.1
gfx950,256,16,129280,4096,False,torch.bfloat16,torch.bfloat16,False,False,torch,0,0,163.0377,native,0.0,103.93,6521.99
gfx950,256,32,129280,4096,False,torch.bfloat16,torch.bfloat16,False,False,torch,0,0,166.5939,native,0.0,203.43,6408.38
gfx950,256,48,129280,4096,False,torch.bfloat16,torch.bfloat16,False,False,torch,0,0,169.3972,native,0.0,300.09,6327.53
gfx950,256,64,129280,4096,False,torch.bfloat16,torch.bfloat16,False,False,torch,0,0,166.2012,native,0.0,407.82,6474.89
gfx950,256,80,129280,4096,False,torch.bfloat16,torch.bfloat16,False,False,torch,0,0,174.4736,native,0.0,485.6,6192.35
gfx950,256,96,129280,4096,False,torch.bfloat16,torch.bfloat16,False,False,torch,0,0,171.0467,native,0.0,594.4,6341.37
gfx950,256,112,129280,4096,False,torch.bfloat16,torch.bfloat16,False,False,torch,0,0,183.9484,native,0.0,644.83,5919.8
gfx950,256,128,129280,4096,False,torch.bfloat16,torch.bfloat16,False,False,torch,0,0,228.099,native,0.0,594.3,4792.68
gfx950,256,144,129280,4096,False,torch.bfloat16,torch.bfloat16,False,False,torch,0,0,195.7204,native,0.0,779.2,5607.36
gfx950,256,160,129280,4096,False,torch.bfloat16,torch.bfloat16,False,False,torch,0,0,189.1528,native,0.0,895.84,5824.61
gfx950,256,176,129280,4096,False,torch.bfloat16,torch.bfloat16,False,False,torch,0,0,214.2966,native,0.0,869.8,5161.12
gfx950,256,192,129280,4096,False,torch.bfloat16,torch.bfloat16,False,False,torch,0,0,216.546,native,0.0,939.01,5127.22
gfx950,256,208,129280,4096,False,torch.bfloat16,torch.bfloat16,False,False,torch,0,0,239.1517,native,0.0,921.11,4660.42
gfx950,256,224,129280,4096,False,torch.bfloat16,torch.bfloat16,False,False,torch,0,0,236.0165,native,0.0,1005.14,4740.41
gfx950,256,240,129280,4096,False,torch.bfloat16,torch.bfloat16,False,False,torch,0,0,267.2412,native,0.0,951.11,4202.5
gfx950,256,256,129280,4096,False,torch.bfloat16,torch.bfloat16,False,False,torch,0,0,250.2887,native,0.0,1083.23,4504.2
gfx950,256,288,129280,4096,False,torch.bfloat16,torch.bfloat16,False,False,torch,0,0,332.7647,native,0.0,916.59,3413.48
gfx950,256,320,129280,4096,False,torch.bfloat16,torch.bfloat16,False,False,asm,10,1,377.5515,_ZN5aiter24bf16gemm_bf16_tn_256x256E,0.0,897.63,3031.17
gfx950,256,352,129280,4096,False,torch.bfloat16,torch.bfloat16,False,False,torch,0,0,362.9916,native,0.0,1026.99,3176.27
gfx950,256,384,129280,4096,False,torch.bfloat16,torch.bfloat16,False,False,torch,0,0,362.9911,native,0.0,1120.36,3199.79
gfx950,256,416,129280,4096,False,torch.bfloat16,torch.bfloat16,False,False,asm,10,1,395.1444,_ZN5aiter24bf16gemm_bf16_tn_256x256E,0.0,1114.96,2961.02
gfx950,256,448,129280,4096,False,torch.bfloat16,torch.bfloat16,False,False,torch,0,0,399.6089,native,0.0,1187.31,2949.3
gfx950,256,480,129280,4096,False,torch.bfloat16,torch.bfloat16,False,False,asm,10,1,415.0254,_ZN5aiter24bf16gemm_bf16_tn_256x256E,0.0,1224.86,2860.31
gfx950,256,512,129280,4096,False,torch.bfloat16,torch.bfloat16,False,False,asm,10,1,421.6726,_ZN5aiter24bf16gemm_bf16_tn_256x256E,0.0,1285.93,2835.47
gfx950,256,544,129280,4096,False,torch.bfloat16,torch.bfloat16,False,False,torch,0,0,511.9421,native,0.0,1125.38,2352.17
gfx950,256,576,129280,4096,False,torch.bfloat16,torch.bfloat16,False,False,torch,0,0,510.1715,native,0.0,1195.71,2377.07
gfx950,256,608,129280,4096,False,torch.bfloat16,torch.bfloat16,False,False,asm,10,1,571.9631,_ZN5aiter24bf16gemm_bf16_tn_256x256E,0.0,1125.79,2135.18
gfx950,256,640,129280,4096,False,torch.bfloat16,torch.bfloat16,False,False,torch,0,0,571.4029,native,0.0,1186.2,2152.22
gfx950,256,672,129280,4096,False,torch.bfloat16,torch.bfloat16,False,False,torch,0,0,578.7397,native,0.0,1229.72,2139.68
gfx950,256,704,129280,4096,False,torch.bfloat16,torch.bfloat16,False,False,asm,10,1,589.235,_ZN5aiter24bf16gemm_bf16_tn_256x256E,0.0,1265.33,2116.06
gfx950,256,736,129280,4096,False,torch.bfloat16,torch.bfloat16,False,False,torch,0,0,589.05,native,0.0,1323.27,2131.21
gfx950,256,768,129280,4096,False,torch.bfloat16,torch.bfloat16,False,False,torch,0,0,597.3668,native,0.0,1361.57,2115.83
gfx950,256,800,129280,4096,False,torch.bfloat16,torch.bfloat16,False,False,asm,10,1,720.1254,_ZN5aiter24bf16gemm_bf16_tn_256x256E,0.0,1176.53,1767.0
gfx950,256,832,129280,4096,False,torch.bfloat16,torch.bfloat16,False,False,asm,10,1,731.5331,_ZN5aiter24bf16gemm_bf16_tn_256x256E,0.0,1204.51,1751.12
gfx950,256,864,129280,4096,False,torch.bfloat16,torch.bfloat16,False,False,asm,10,1,725.9269,_ZN5aiter24bf16gemm_bf16_tn_256x256E,0.0,1260.5,1776.4
gfx950,256,896,129280,4096,False,torch.bfloat16,torch.bfloat16,False,False,asm,10,1,748.0863,_ZN5aiter24bf16gemm_bf16_tn_256x256E,0.0,1268.46,1735.19
gfx950,256,928,129280,4096,False,torch.bfloat16,torch.bfloat16,False,False,asm,10,1,753.7082,_ZN5aiter24bf16gemm_bf16_tn_256x256E,0.0,1303.97,1733.57
gfx950,256,960,129280,4096,False,torch.bfloat16,torch.bfloat16,False,False,asm,10,1,762.0156,_ZN5aiter24bf16gemm_bf16_tn_256x256E,0.0,1334.22,1725.88
gfx950,256,992,129280,4096,False,torch.bfloat16,torch.bfloat16,False,False,torch,0,0,764.1203,native,0.0,1374.9,1732.29
gfx950,256,1024,129280,4096,False,torch.bfloat16,torch.bfloat16,False,False,torch,0,0,773.5348,native,0.0,1401.98,1722.24
gfx950,256,1088,129280,4096,False,torch.bfloat16,torch.bfloat16,False,False,asm,10,1,926.2151,_ZN5aiter24bf16gemm_bf16_tn_256x256E,0.0,1244.05,1456.78
gfx950,256,1152,129280,4096,False,torch.bfloat16,torch.bfloat16,False,False,asm,10,1,937.4051,_ZN5aiter24bf16gemm_bf16_tn_256x256E,0.0,1301.51,1457.6
gfx950,256,1216,129280,4096,False,torch.bfloat16,torch.bfloat16,False,False,asm,10,1,955.6665,_ZN5aiter24bf16gemm_bf16_tn_256x256E,0.0,1347.56,1447.61
gfx950,256,1280,129280,4096,False,torch.bfloat16,torch.bfloat16,False,False,torch,0,0,954.696,native,0.0,1419.93,1466.96
gfx950,256,1344,129280,4096,False,torch.bfloat16,torch.bfloat16,False,False,asm,10,1,1098.515,_ZN5aiter24bf16gemm_bf16_tn_256x256E,0.0,1295.73,1290.45
gfx950,256,1408,129280,4096,False,torch.bfloat16,torch.bfloat16,False,False,asm,10,1,1115.8024,_ZN5aiter24bf16gemm_bf16_tn_256x256E,0.0,1336.4,1285.76
gfx950,256,1472,129280,4096,False,torch.bfloat16,torch.bfloat16,False,False,asm,10,1,1106.4793,_ZN5aiter24bf16gemm_bf16_tn_256x256E,0.0,1408.92,1312.02
gfx950,256,1536,129280,4096,False,torch.bfloat16,torch.bfloat16,False,False,torch,0,0,1138.4158,native,0.0,1428.93,1290.21
gfx950,256,1600,129280,4096,False,torch.bfloat16,torch.bfloat16,False,False,asm,10,1,1289.2002,_ZN5aiter24bf16gemm_bf16_tn_256x256E,0.0,1314.38,1152.55
gfx950,256,1664,129280,4096,False,torch.bfloat16,torch.bfloat16,False,False,asm,10,1,1298.5973,_ZN5aiter24bf16gemm_bf16_tn_256x256E,0.0,1357.06,1157.35
gfx950,256,1728,129280,4096,False,torch.bfloat16,torch.bfloat16,False,False,asm,10,1,1304.8346,_ZN5aiter24bf16gemm_bf16_tn_256x256E,0.0,1402.52,1164.91
gfx950,256,1792,129280,4096,False,torch.bfloat16,torch.bfloat16,False,False,asm,10,1,1302.7989,_ZN5aiter24bf16gemm_bf16_tn_256x256E,0.0,1456.74,1179.83
gfx950,256,1856,129280,4096,False,torch.bfloat16,torch.bfloat16,False,False,asm,10,1,1446.4078,_ZN5aiter24bf16gemm_bf16_tn_256x256E,0.0,1358.97,1074.49
gfx950,256,1920,129280,4096,False,torch.bfloat16,torch.bfloat16,False,False,asm,10,1,1469.8796,_ZN5aiter24bf16gemm_bf16_tn_256x256E,0.0,1383.38,1068.95
gfx950,256,1984,129280,4096,False,torch.bfloat16,torch.bfloat16,False,False,asm,10,1,1489.0432,_ZN5aiter24bf16gemm_bf16_tn_256x256E,0.0,1411.09,1066.66
gfx950,256,2048,129280,4096,False,torch.bfloat16,torch.bfloat16,False,False,asm,10,1,1508.3927,_ZN5aiter24bf16gemm_bf16_tn_256x256E,0.0,1437.93,1064.29
gfx950,256,4096,129280,4096,False,torch.bfloat16,torch.bfloat16,False,False,asm,10,1,2932.1955,_ZN5aiter24bf16gemm_bf16_tn_256x256E,0.0,1479.41,733.81
gfx950,256,6144,129280,4096,False,torch.bfloat16,torch.bfloat16,False,False,asm,10,1,4326.3172,_ZN5aiter24bf16gemm_bf16_tn_256x256E,0.0,1504.02,623.62
gfx950,256,8192,129280,4096,False,torch.bfloat16,torch.bfloat16,False,False,flydsl,19,1,5833.9152,flydsl_hgemm_abf16_wbf16_bf16_t256x256x64x2_ks1_w2x4x1_bias0_ktail0_gm4_pht_gfx950,0.0,1487.14,556.11
gfx950,256,10240,129280,4096,False,torch.bfloat16,torch.bfloat16,False,False,asm,10,1,7326.9272,_ZN5aiter24bf16gemm_bf16_tn_256x256E,0.0,1480.13,517.35
gfx950,256,12288,129280,4096,False,torch.bfloat16,torch.bfloat16,False,False,asm,10,1,8690.0416,_ZN5aiter24bf16gemm_bf16_tn_256x256E,0.0,1497.55,499.07
gfx950,256,14336,129280,4096,False,torch.bfloat16,torch.bfloat16,False,False,asm,10,1,9966.6137,_ZN5aiter24bf16gemm_bf16_tn_256x256E,0.0,1523.36,489.96
gfx950,256,16384,129280,4096,False,torch.bfloat16,torch.bfloat16,False,False,flydsl,19,1,11745.5745,flydsl_hgemm_abf16_wbf16_bf16_t256x256x64x2_ks1_w2x4x1_bias0_ktail0_gm4_pht_gfx950,0.0,1477.29,462.26
gfx942,80,192,384,7168,False,torch.bfloat16,torch.bfloat16,False,False,opus,10201,8,21.2254,opus_gemm_gfx942_splitk_p1_256x64x64x64_2x2_16x16x16_0x0x0,0.0,49.8,395.99
gfx942,80,352,384,7168,False,torch.bfloat16,torch.bfloat16,False,False,opus,10200,8,29.7817,opus_gemm_gfx942_splitk_legacy_512x128x128x64_2x4_16x16x16_0x0x0,0.0,65.07,363.37
gfx942,80,384,384,7168,False,torch.bfloat16,torch.bfloat16,False,False,opus,10200,8,30.5541,opus_gemm_gfx942_splitk_legacy_512x128x128x64_2x4_16x16x16_0x0x0,0.0,69.19,370.0
gfx942,80,416,384,7168,False,torch.bfloat16,torch.bfloat16,False,False,opus,10204,0,35.4087,opus_gemm_gfx942_splitk_em3en4_lds1_pgr2_256x128x96x128_2x2_16x16x16_0x0x0,0.0,64.68,332.92
gfx942,80,104,1024,7168,False,torch.bfloat16,torch.bfloat16,False,False,opus,10210,0,28.0462,opus_gemm_gfx942_splitk_legacy_bf16ws_512x128x128x64_2x4_16x16x16_0x0x0,0.0,54.44,584.18
gfx942,80,200,1024,7168,False,torch.bfloat16,torch.bfloat16,False,False,opus,10200,5,40.5018,opus_gemm_gfx942_splitk_legacy_512x128x128x64_2x4_16x16x16_0x0x0,0.0,72.49,443.36
gfx942,80,208,1024,7168,False,torch.bfloat16,torch.bfloat16,False,False,opus,10210,0,41.1359,opus_gemm_gfx942_splitk_legacy_bf16ws_512x128x128x64_2x4_16x16x16_0x0x0,0.0,74.23,439.71
gfx942,80,160,384,7168,False,torch.bfloat16,torch.bfloat16,False,False,opus,10201,8,20.2282,opus_gemm_gfx942_splitk_p1_256x64x64x64_2x2_16x16x16_0x0x0,0.0,43.54,391.61
gfx942,80,768,384,7168,False,torch.bfloat16,torch.bfloat16,False,False,opus,10200,4,51.6252,opus_gemm_gfx942_splitk_legacy_512x128x128x64_2x4_16x16x16_0x0x0,0.0,81.9,331.33
gfx942,80,128,512,7168,False,torch.bfloat16,torch.bfloat16,False,False,opus,10201,10,19.7843,opus_gemm_gfx942_splitk_p1_256x64x64x64_2x2_16x16x16_0x0x0,0.0,47.49,470.38
gfx942,80,208,512,7168,False,torch.bfloat16,torch.bfloat16,False,False,opus,10210,0,27.7763,opus_gemm_gfx942_splitk_legacy_bf16ws_512x128x128x64_2x4_16x16x16_0x0x0,0.0,54.97,379.28
gfx942,80,224,512,7168,False,torch.bfloat16,torch.bfloat16,False,False,opus,10210,0,27.8194,opus_gemm_gfx942_splitk_legacy_bf16ws_512x128x128x64_2x4_16x16x16_0x0x0,0.0,59.1,387.52
gfx942,80,240,512,7168,False,torch.bfloat16,torch.bfloat16,False,False,opus,10210,0,28.0936,opus_gemm_gfx942_splitk_legacy_bf16ws_512x128x128x64_2x4_16x16x16_0x0x0,0.0,62.7,392.49
gfx942,80,256,512,7168,False,torch.bfloat16,torch.bfloat16,False,False,opus,10210,0,28.3166,opus_gemm_gfx942_splitk_legacy_bf16ws_512x128x128x64_2x4_16x16x16_0x0x0,0.0,66.36,398.08
gfx942,80,352,512,7168,False,torch.bfloat16,torch.bfloat16,False,False,opus,10200,6,32.1674,opus_gemm_gfx942_splitk_legacy_512x128x128x64_2x4_16x16x16_0x0x0,0.0,80.32,396.26
gfx942,80,384,512,7168,False,torch.bfloat16,torch.bfloat16,False,False,opus,10200,6,32.3477,opus_gemm_gfx942_splitk_legacy_512x128x128x64_2x4_16x16x16_0x0x0,0.0,87.13,409.25
gfx942,80,448,512,7168,False,torch.bfloat16,torch.bfloat16,False,False,opus,10200,0,36.729,opus_gemm_gfx942_splitk_legacy_512x128x128x64_2x4_16x16x16_0x0x0,0.0,89.53,387.2
gfx942,80,480,512,7168,False,torch.bfloat16,torch.bfloat16,False,False,opus,10210,0,42.1268,opus_gemm_gfx942_splitk_legacy_bf16ws_512x128x128x64_2x4_16x16x16_0x0x0,0.0,83.63,349.25
gfx942,80,512,512,7168,False,torch.bfloat16,torch.bfloat16,False,False,opus,10210,0,42.8344,opus_gemm_gfx942_splitk_legacy_bf16ws_512x128x128x64_2x4_16x16x16_0x0x0,0.0,87.74,354.96
gfx942,80,608,512,7168,False,torch.bfloat16,torch.bfloat16,False,False,opus,10210,0,49.5677,opus_gemm_gfx942_splitk_legacy_bf16ws_512x128x128x64_2x4_16x16x16_0x0x0,0.0,90.03,336.49
gfx942,80,640,512,7168,False,torch.bfloat16,torch.bfloat16,False,False,opus,10200,0,50.224,opus_gemm_gfx942_splitk_legacy_512x128x128x64_2x4_16x16x16_0x0x0,0.0,93.53,341.88
gfx942,80,736,512,7168,False,torch.bfloat16,torch.bfloat16,False,False,opus,10200,3,60.7273,opus_gemm_gfx942_splitk_legacy_512x128x128x64_2x4_16x16x16_0x0x0,0.0,88.96,307.03
gfx942,80,768,512,7168,False,torch.bfloat16,torch.bfloat16,False,False,opus,10200,3,61.6035,opus_gemm_gfx942_splitk_legacy_512x128x128x64_2x4_16x16x16_0x0x0,0.0,91.51,310.64
gfx942,80,640,2048,7168,False,torch.bfloat16,torch.bfloat16,False,False,opus,10000,0,151.0107,opus_gemm_gfx942_512x128x128x64_2x4_16x16x16_0x0x0,0.0,124.43,272.54
gfx942,80,96,384,7168,False,torch.bfloat16,torch.bfloat16,False,False,opus,10302,0,15.5162,opus_gemm_gfx942_wkc_512x32x16x64_1x1_16x16x16_0x0x0,0.0,34.06,448.24
gfx942,80,1,1024,7168,False,torch.bfloat16,torch.bfloat16,False,False,opus,10300,0,11.7745,opus_gemm_gfx942_wkc_512x16x16x64_1x1_16x16x16_0x0x0,0.0,1.25,1248.16
gfx942,80,4,1024,7168,False,torch.bfloat16,torch.bfloat16,False,False,opus,10300,0,11.8598,opus_gemm_gfx942_wkc_512x16x16x64_1x1_16x16x16_0x0x0,0.0,4.95,1243.33
gfx942,80,8,1024,7168,False,torch.bfloat16,torch.bfloat16,False,False,opus,10300,0,11.9403,opus_gemm_gfx942_wkc_512x16x16x64_1x1_16x16x16_0x0x0,0.0,9.84,1240.43
gfx942,80,112,1024,7168,False,torch.bfloat16,torch.bfloat16,False,False,opus,10210,0,28.5379,opus_gemm_gfx942_splitk_legacy_bf16ws_512x128x128x64_2x4_16x16x16_0x0x0,0.0,57.61,578.71
gfx942,80,120,1024,7168,False,torch.bfloat16,torch.bfloat16,False,False,opus,10210,0,28.6248,opus_gemm_gfx942_splitk_legacy_bf16ws_512x128x128x64_2x4_16x16x16_0x0x0,0.0,61.54,581.53
gfx942,80,128,1024,7168,False,torch.bfloat16,torch.bfloat16,False,False,opus,10210,0,28.7869,opus_gemm_gfx942_splitk_legacy_bf16ws_512x128x128x64_2x4_16x16x16_0x0x0,0.0,65.27,582.81
gfx942,80,216,1024,7168,False,torch.bfloat16,torch.bfloat16,False,False,opus,10210,0,41.3267,opus_gemm_gfx942_splitk_legacy_bf16ws_512x128x128x64_2x4_16x16x16_0x0x0,0.0,76.73,440.85
gfx942,80,224,1024,7168,False,torch.bfloat16,torch.bfloat16,False,False,opus,10210,0,41.3224,opus_gemm_gfx942_splitk_legacy_bf16ws_512x128x128x64_2x4_16x16x16_0x0x0,0.0,79.58,444.07
gfx942,80,232,1024,7168,False,torch.bfloat16,torch.bfloat16,False,False,opus,10210,0,41.7262,opus_gemm_gfx942_splitk_legacy_bf16ws_512x128x128x64_2x4_16x16x16_0x0x0,0.0,81.62,442.91
gfx942,80,240,1024,7168,False,torch.bfloat16,torch.bfloat16,False,False,opus,10210,0,42.0916,opus_gemm_gfx942_splitk_legacy_bf16ws_512x128x128x64_2x4_16x16x16_0x0x0,0.0,83.7,442.18
gfx942,80,248,1024,7168,False,torch.bfloat16,torch.bfloat16,False,False,opus,10210,0,42.5615,opus_gemm_gfx942_splitk_legacy_bf16ws_512x128x128x64_2x4_16x16x16_0x0x0,0.0,85.54,440.38
gfx942,80,256,1024,7168,False,torch.bfloat16,torch.bfloat16,False,False,opus,10210,0,42.823,opus_gemm_gfx942_splitk_legacy_bf16ws_512x128x128x64_2x4_16x16x16_0x0x0,0.0,87.76,440.75
gfx942,80,4,2048,7168,False,torch.bfloat16,torch.bfloat16,False,False,opus,10301,0,20.483,opus_gemm_gfx942_wkc_512x16x32x32_1x1_16x16x16_0x0x0,0.0,5.73,1436.99
gfx942,80,8,2048,7168,False,torch.bfloat16,torch.bfloat16,False,False,opus,10301,0,20.5934,opus_gemm_gfx942_wkc_512x16x32x32_1x1_16x16x16_0x0x0,0.0,11.41,1432.87
gfx942,80,16,2048,7168,False,torch.bfloat16,torch.bfloat16,False,False,opus,10301,0,20.8499,opus_gemm_gfx942_wkc_512x16x32x32_1x1_16x16x16_0x0x0,0.0,22.53,1422.31
gfx942,80,112,2048,7168,False,torch.bfloat16,torch.bfloat16,False,False,opus,10210,0,42.9434,opus_gemm_gfx942_splitk_legacy_bf16ws_512x128x128x64_2x4_16x16x16_0x0x0,0.0,76.57,731.77
gfx942,80,128,2048,7168,False,torch.bfloat16,torch.bfloat16,False,False,opus,10210,0,44.0662,opus_gemm_gfx942_splitk_legacy_bf16ws_512x128x128x64_2x4_16x16x16_0x0x0,0.0,85.28,719.81
gfx942,80,512,2048,4096,False,torch.bfloat16,torch.bfloat16,False,False,opus,10216,5,64.5672,opus_gemm_gfx942_splitk_quad_mfma32_bf16ws_256x256x256x32_2x2_32x32x8_6x0x0,0.0094,133.04,357.28
gfx942,80,512,256,4096,False,torch.bfloat16,torch.bfloat16,False,False,torch,0,0,23.0724,native,0.0,46.54,284.05
gfx942,80,256,2048,4096,False,torch.bfloat16,torch.bfloat16,False,False,opus,10210,5,49.3661,opus_gemm_gfx942_splitk_legacy_bf16ws_512x128x128x64_2x4_16x16x16_0x0x0,0.0095,87.0,403.58
gfx942,80,512,1024,4096,False,torch.bfloat16,torch.bfloat16,False,False,torch,0,0,42.5719,native,0.0,100.89,320.2
gfx942,80,256,256,4096,False,torch.bfloat16,torch.bfloat16,False,False,asm,5,5,14.1963,_ZN5aiter39bf16gemm_fp32bf16_tn_64x64_splitk_cleanE,0.0146,37.82,304.68
gfx942,80,256,1024,4096,False,torch.bfloat16,torch.bfloat16,False,False,opus,10210,0,29.3736,opus_gemm_gfx942_splitk_legacy_bf16ws_512x128x128x64_2x4_16x16x16_0x0x0,0.0,73.11,374.83
gfx942,80,512,512,4096,False,torch.bfloat16,torch.bfloat16,False,False,opus,10210,0,29.1965,opus_gemm_gfx942_splitk_legacy_bf16ws_512x128x128x64_2x4_16x16x16_0x0x0,0.0,73.55,305.27
gfx942,80,128,2048,4096,False,torch.bfloat16,torch.bfloat16,False,False,opus,10210,0,29.7021,opus_gemm_gfx942_splitk_legacy_bf16ws_512x128x128x64_2x4_16x16x16_0x0x0,0.0,72.3,617.8
gfx942,80,128,256,4096,False,torch.bfloat16,torch.bfloat16,False,False,opus,10302,0,10.1493,opus_gemm_gfx942_wkc_512x32x16x64_1x1_16x16x16_0x0x0,0.0,26.45,316.4
gfx942,80,256,512,4096,False,torch.bfloat16,torch.bfloat16,False,False,torch,0,0,23.1381,native,0.0,46.41,283.24
gfx942,80,48,2048,4096,False,torch.bfloat16,torch.bfloat16,False,False,asm,3,2,22.906,_ZN5aiter39bf16gemm_fp32bf16_tn_48x64_splitk_cleanE,0.0049,35.16,758.19
gfx942,80,64,2048,4096,False,torch.bfloat16,torch.bfloat16,False,False,torch,0,0,23.5578,native,0.0,45.58,745.56
gfx942,80,64,256,4096,False,torch.bfloat16,torch.bfloat16,False,False,opus,10300,0,7.9398,opus_gemm_gfx942_wkc_512x16x16x64_1x1_16x16x16_0x0x0,0.0,16.9,334.29
gfx942,80,32,256,4096,False,torch.bfloat16,torch.bfloat16,False,False,opus,10313,0,6.5263,opus_gemm_gfx942_wkc_accum_256x32x32x64_1x1_16x16x16_0x0x0,0.0199,10.28,364.02
gfx942,80,8,256,4096,False,torch.bfloat16,torch.bfloat16,False,False,opus,10310,0,4.894,opus_gemm_gfx942_wkc_accum_256x16x16x64_1x1_16x16x16_0x0x0,0.0186,3.43,442.74
gfx942,80,48,256,4096,False,torch.bfloat16,torch.bfloat16,False,False,opus,10300,0,7.45,opus_gemm_gfx942_wkc_512x16x16x64_1x1_16x16x16_0x0x0,0.0,13.51,337.58
gfx942,80,2,256,4096,False,torch.bfloat16,torch.bfloat16,False,False,opus,10310,0,4.8679,opus_gemm_gfx942_wkc_accum_256x16x16x64_1x1_16x16x16_0x0x0,0.0176,0.86,434.39
gfx942,80,16,256,4096,False,torch.bfloat16,torch.bfloat16,False,False,opus,10311,0,4.9659,opus_gemm_gfx942_wkc_accum_512x16x32x32_1x1_16x16x16_0x0x0,0.0181,6.76,450.35
gfx942,80,128,1024,4096,False,torch.bfloat16,torch.bfloat16,False,False,torch,0,0,19.8904,native,0.0,53.98,487.64
gfx942,80,4,256,4096,False,torch.bfloat16,torch.bfloat16,False,False,opus,10310,0,4.8338,opus_gemm_gfx942_wkc_accum_256x16x16x64_1x1_16x16x16_0x0x0,0.0293,1.74,441.05
gfx942,80,1,256,4096,False,torch.bfloat16,torch.bfloat16,False,False,opus,10310,0,4.8174,opus_gemm_gfx942_wkc_accum_256x16x16x64_1x1_16x16x16_0x0x0,0.0273,0.44,437.14
gfx942,80,32,2048,4096,False,torch.bfloat16,torch.bfloat16,False,False,torch,0,0,17.4838,native,0.0,30.71,982.08
gfx942,80,128,512,4096,False,torch.bfloat16,torch.bfloat16,False,False,asm,5,5,14.5712,_ZN5aiter39bf16gemm_fp32bf16_tn_64x64_splitk_cleanE,0.0148,36.84,368.81
gfx942,80,64,1024,4096,False,torch.bfloat16,torch.bfloat16,False,False,asm,5,5,15.1527,_ZN5aiter39bf16gemm_fp32bf16_tn_64x64_splitk_cleanE,0.0141,35.43,596.86
gfx942,80,48,1024,4096,False,torch.bfloat16,torch.bfloat16,False,False,asm,3,5,13.8806,_ZN5aiter39bf16gemm_fp32bf16_tn_48x64_splitk_cleanE,0.0146,29.01,639.75
gfx942,80,2,2048,4096,False,torch.bfloat16,torch.bfloat16,False,False,opus,10301,0,12.9907,opus_gemm_gfx942_wkc_512x16x32x32_1x1_16x16x16_0x0x0,0.0,2.58,1293.37
gfx942,80,8,2048,4096,False,torch.bfloat16,torch.bfloat16,False,False,opus,10301,0,13.0097,opus_gemm_gfx942_wkc_512x16x32x32_1x1_16x16x16_0x0x0,0.0,10.32,1297.15
gfx942,80,48,512,4096,False,torch.bfloat16,torch.bfloat16,False,False,asm,3,10,10.4683,_ZN5aiter39bf16gemm_fp32bf16_tn_48x64_splitk_cleanE,0.0228,19.23,442.93
gfx942,80,64,512,4096,False,torch.bfloat16,torch.bfloat16,False,False,opus,10302,0,10.7679,opus_gemm_gfx942_wkc_512x32x16x64_1x1_16x16x16_0x0x0,0.0,24.93,444.3
gfx942,80,4,2048,4096,False,torch.bfloat16,torch.bfloat16,False,False,opus,10301,0,12.7075,opus_gemm_gfx942_wkc_512x16x32x32_1x1_16x16x16_0x0x0,0.0,5.28,1324.13
gfx942,80,512,64,4096,False,torch.bfloat16,torch.bfloat16,False,False,opus,10302,0,10.5756,opus_gemm_gfx942_wkc_512x32x16x64_1x1_16x16x16_0x0x0,0.0,25.38,452.37
gfx942,80,1,2048,4096,False,torch.bfloat16,torch.bfloat16,False,False,opus,10301,0,13.0372,opus_gemm_gfx942_wkc_512x16x32x32_1x1_16x16x16_0x0x0,0.0,1.29,1287.82
gfx942,80,16,2048,4096,False,torch.bfloat16,torch.bfloat16,False,False,opus,10301,0,13.3916,opus_gemm_gfx942_wkc_512x16x32x32_1x1_16x16x16_0x0x0,0.0,20.05,1267.5
gfx942,80,32,1024,4096,False,torch.bfloat16,torch.bfloat16,False,False,opus,10302,0,11.8246,opus_gemm_gfx942_wkc_512x32x16x64_1x1_16x16x16_0x0x0,0.0,22.7,737.13
gfx942,80,32,512,4096,False,torch.bfloat16,torch.bfloat16,False,False,flydsl,759,8,9.2194,flydsl_gemm4_abf16_wbf16_bf16_t32x64x64_split_k8_block_m_warp2_block_n_warp2_block_k_warp1_async_copyFalse_b_to_ldsTrue_b_preshuffleFalse_c_to_ldsFalse_gfx942,0.0198,14.56,486.93
gfx942,80,256,64,4096,False,torch.bfloat16,torch.bfloat16,False,False,asm,5,16,8.1263,_ZN5aiter39bf16gemm_fp32bf16_tn_64x64_splitk_cleanE,0.0281,16.52,326.62
gfx942,80,8,512,4096,False,torch.bfloat16,torch.bfloat16,False,False,opus,10300,0,8.1931,opus_gemm_gfx942_wkc_512x16x16x64_1x1_16x16x16_0x0x0,0.0,4.1,520.93
gfx942,80,16,512,4096,False,torch.bfloat16,torch.bfloat16,False,False,opus,10310,0,8.6225,opus_gemm_gfx942_wkc_accum_256x16x16x64_1x1_16x16x16_0x0x0,0.02,7.78,503.54
gfx942,80,4,512,4096,False,torch.bfloat16,torch.bfloat16,False,False,opus,10300,0,8.1018,opus_gemm_gfx942_wkc_512x16x16x64_1x1_16x16x16_0x0x0,0.0,2.07,522.25
gfx942,80,2,512,4096,False,torch.bfloat16,torch.bfloat16,False,False,opus,10300,0,8.3322,opus_gemm_gfx942_wkc_512x16x16x64_1x1_16x16x16_0x0x0,0.0,1.01,505.6
gfx942,80,128,64,4096,False,torch.bfloat16,torch.bfloat16,False,False,asm,1,16,6.8358,_ZN5aiter39bf16gemm_fp32bf16_tn_32x64_splitk_cleanE,0.0271,9.82,232.49
gfx942,80,1,512,4096,False,torch.bfloat16,torch.bfloat16,False,False,opus,10300,0,8.0662,opus_gemm_gfx942_wkc_512x16x16x64_1x1_16x16x16_0x0x0,0.0,0.52,521.13
gfx942,80,2,1024,4096,False,torch.bfloat16,torch.bfloat16,False,False,opus,10300,0,9.4623,opus_gemm_gfx942_wkc_512x16x16x64_1x1_16x16x16_0x0x0,0.0,1.77,888.69
gfx942,80,16,1024,4096,False,torch.bfloat16,torch.bfloat16,False,False,opus,10302,0,11.2766,opus_gemm_gfx942_wkc_512x32x16x64_1x1_16x16x16_0x0x0,0.0,11.9,758.42
gfx942,80,8,1024,4096,False,torch.bfloat16,torch.bfloat16,False,False,opus,10300,0,9.6515,opus_gemm_gfx942_wkc_512x16x16x64_1x1_16x16x16_0x0x0,0.0,6.95,877.64
gfx942,80,4,1024,4096,False,torch.bfloat16,torch.bfloat16,False,False,opus,10300,0,9.5499,opus_gemm_gfx942_wkc_512x16x16x64_1x1_16x16x16_0x0x0,0.0,3.51,882.69
gfx942,80,1,1024,4096,False,torch.bfloat16,torch.bfloat16,False,False,opus,10300,0,9.1734,opus_gemm_gfx942_wkc_512x16x16x64_1x1_16x16x16_0x0x0,0.0,0.91,915.57
gfx942,80,32,64,4096,False,torch.bfloat16,torch.bfloat16,False,False,opus,10310,0,4.5291,opus_gemm_gfx942_wkc_accum_256x16x16x64_1x1_16x16x16_0x0x0,0.0229,3.7,174.54
gfx942,80,48,64,4096,False,torch.bfloat16,torch.bfloat16,False,False,opus,10312,0,4.7978,opus_gemm_gfx942_wkc_accum_512x32x16x64_1x1_16x16x16_0x0x0,0.0186,5.25,192.51
gfx942,80,64,64,4096,False,torch.bfloat16,torch.bfloat16,False,False,opus,10312,0,4.7714,opus_gemm_gfx942_wkc_accum_512x32x16x64_1x1_16x16x16_0x0x0,0.0215,7.03,221.48
gfx942,80,16,64,4096,False,torch.bfloat16,torch.bfloat16,False,False,opus,10310,0,4.5125,opus_gemm_gfx942_wkc_accum_256x16x16x64_1x1_16x16x16_0x0x0,0.0205,1.86,145.69
gfx1250,256,1,256,4096,False,torch.bfloat16,torch.bfloat16,False,False,triton,0,0,0,auto,0.0,0.0,0.0
gfx1250,256,2,256,4096,False,torch.bfloat16,torch.bfloat16,False,False,triton,0,0,0,auto,0.0,0.0,0.0
gfx1250,256,4,256,4096,False,torch.bfloat16,torch.bfloat16,False,False,triton,0,0,0,auto,0.0,0.0,0.0
gfx1250,256,8,256,4096,False,torch.bfloat16,torch.bfloat16,False,False,triton,0,0,0,auto,0.0,0.0,0.0
gfx1250,256,16,256,4096,False,torch.bfloat16,torch.bfloat16,False,False,triton,0,0,0,auto,0.0,0.0,0.0
gfx1250,256,32,256,4096,False,torch.bfloat16,torch.bfloat16,False,False,triton,0,0,0,auto,0.0,0.0,0.0
gfx1250,256,64,256,4096,False,torch.bfloat16,torch.bfloat16,False,False,triton,0,0,0,auto,0.0,0.0,0.0
gfx1250,256,128,256,4096,False,torch.bfloat16,torch.bfloat16,False,False,triton,0,0,0,auto,0.0,0.0,0.0
gfx1250,256,256,256,4096,False,torch.bfloat16,torch.bfloat16,False,False,triton,0,0,0,auto,0.0,0.0,0.0
gfx1250,256,512,256,4096,False,torch.bfloat16,torch.bfloat16,False,False,triton,0,0,0,auto,0.0,0.0,0.0
gfx1250,256,1024,256,4096,False,torch.bfloat16,torch.bfloat16,False,False,triton,0,0,0,auto,0.0,0.0,0.0
gfx1250,256,2048,256,4096,False,torch.bfloat16,torch.bfloat16,False,False,triton,0,0,0,auto,0.0,0.0,0.0
gfx1250,256,4096,256,4096,False,torch.bfloat16,torch.bfloat16,False,False,triton,0,0,0,auto,0.0,0.0,0.0
gfx1250,256,8192,256,4096,False,torch.bfloat16,torch.bfloat16,False,False,triton,0,0,0,auto,0.0,0.0,0.0
gfx1250,256,16384,256,4096,False,torch.bfloat16,torch.bfloat16,False,False,triton,0,0,0,auto,0.0,0.0,0.0
gfx1250,256,1,512,4096,False,torch.bfloat16,torch.bfloat16,False,False,triton,0,0,0,auto,0.0,0.0,0.0
gfx1250,256,2,512,4096,False,torch.bfloat16,torch.bfloat16,False,False,triton,0,0,0,auto,0.0,0.0,0.0
gfx1250,256,4,512,4096,False,torch.bfloat16,torch.bfloat16,False,False,triton,0,0,0,auto,0.0,0.0,0.0
gfx1250,256,8,512,4096,False,torch.bfloat16,torch.bfloat16,False,False,triton,0,0,0,auto,0.0,0.0,0.0
gfx1250,256,16,512,4096,False,torch.bfloat16,torch.bfloat16,False,False,triton,0,0,0,auto,0.0,0.0,0.0
gfx1250,256,32,512,4096,False,torch.bfloat16,torch.bfloat16,False,False,triton,0,0,0,auto,0.0,0.0,0.0
gfx1250,256,64,512,4096,False,torch.bfloat16,torch.bfloat16,False,False,triton,0,0,0,auto,0.0,0.0,0.0
gfx1250,256,128,512,4096,False,torch.bfloat16,torch.bfloat16,False,False,triton,0,0,0,auto,0.0,0.0,0.0
gfx1250,256,256,512,4096,False,torch.bfloat16,torch.bfloat16,False,False,triton,0,0,0,auto,0.0,0.0,0.0
gfx1250,256,512,512,4096,False,torch.bfloat16,torch.bfloat16,False,False,triton,0,0,0,auto,0.0,0.0,0.0
gfx1250,256,1024,512,4096,False,torch.bfloat16,torch.bfloat16,False,False,triton,0,0,0,auto,0.0,0.0,0.0
gfx1250,256,2048,512,4096,False,torch.bfloat16,torch.bfloat16,False,False,triton,0,0,0,auto,0.0,0.0,0.0
gfx1250,256,4096,512,4096,False,torch.bfloat16,torch.bfloat16,False,False,triton,0,0,0,auto,0.0,0.0,0.0
gfx1250,256,8192,512,4096,False,torch.bfloat16,torch.bfloat16,False,False,triton,0,0,0,auto,0.0,0.0,0.0
gfx1250,256,16384,512,4096,False,torch.bfloat16,torch.bfloat16,False,False,triton,0,0,0,auto,0.0,0.0,0.0
gfx1250,256,1,1024,4096,False,torch.bfloat16,torch.bfloat16,False,False,triton,0,0,0,auto,0.0,0.0,0.0
gfx1250,256,2,1024,4096,False,torch.bfloat16,torch.bfloat16,False,False,triton,0,0,0,auto,0.0,0.0,0.0
gfx1250,256,4,1024,4096,False,torch.bfloat16,torch.bfloat16,False,False,triton,0,0,0,auto,0.0,0.0,0.0
gfx1250,256,8,1024,4096,False,torch.bfloat16,torch.bfloat16,False,False,triton,0,0,0,auto,0.0,0.0,0.0
gfx1250,256,16,1024,4096,False,torch.bfloat16,torch.bfloat16,False,False,triton,0,0,0,auto,0.0,0.0,0.0
gfx1250,256,32,1024,4096,False,torch.bfloat16,torch.bfloat16,False,False,triton,0,0,0,auto,0.0,0.0,0.0
gfx1250,256,64,1024,4096,False,torch.bfloat16,torch.bfloat16,False,False,triton,0,0,0,auto,0.0,0.0,0.0
gfx1250,256,128,1024,4096,False,torch.bfloat16,torch.bfloat16,False,False,triton,0,0,0,auto,0.0,0.0,0.0
gfx1250,256,256,1024,4096,False,torch.bfloat16,torch.bfloat16,False,False,triton,0,0,0,auto,0.0,0.0,0.0
gfx1250,256,512,1024,4096,False,torch.bfloat16,torch.bfloat16,False,False,triton,0,0,0,auto,0.0,0.0,0.0
gfx1250,256,1024,1024,4096,False,torch.bfloat16,torch.bfloat16,False,False,triton,0,0,0,auto,0.0,0.0,0.0
gfx1250,256,2048,1024,4096,False,torch.bfloat16,torch.bfloat16,False,False,triton,0,0,0,auto,0.0,0.0,0.0
gfx1250,256,4096,1024,4096,False,torch.bfloat16,torch.bfloat16,False,False,triton,0,0,0,auto,0.0,0.0,0.0
gfx1250,256,8192,1024,4096,False,torch.bfloat16,torch.bfloat16,False,False,triton,0,0,0,auto,0.0,0.0,0.0
gfx1250,256,16384,1024,4096,False,torch.bfloat16,torch.bfloat16,False,False,triton,0,0,0,auto,0.0,0.0,0.0
gfx1250,256,1,2048,4096,False,torch.bfloat16,torch.bfloat16,False,False,triton,0,0,0,auto,0.0,0.0,0.0
gfx1250,256,2,2048,4096,False,torch.bfloat16,torch.bfloat16,False,False,triton,0,0,0,auto,0.0,0.0,0.0
gfx1250,256,4,2048,4096,False,torch.bfloat16,torch.bfloat16,False,False,triton,0,0,0,auto,0.0,0.0,0.0
gfx1250,256,8,2048,4096,False,torch.bfloat16,torch.bfloat16,False,False,triton,0,0,0,auto,0.0,0.0,0.0
gfx1250,256,16,2048,4096,False,torch.bfloat16,torch.bfloat16,False,False,triton,0,0,0,auto,0.0,0.0,0.0
gfx1250,256,32,2048,4096,False,torch.bfloat16,torch.bfloat16,False,False,triton,0,0,0,auto,0.0,0.0,0.0
gfx1250,256,64,2048,4096,False,torch.bfloat16,torch.bfloat16,False,False,triton,0,0,0,auto,0.0,0.0,0.0
gfx1250,256,128,2048,4096,False,torch.bfloat16,torch.bfloat16,False,False,triton,0,0,0,auto,0.0,0.0,0.0
gfx1250,256,256,2048,4096,False,torch.bfloat16,torch.bfloat16,False,False,triton,0,0,0,auto,0.0,0.0,0.0
gfx1250,256,512,2048,4096,False,torch.bfloat16,torch.bfloat16,False,False,triton,0,0,0,auto,0.0,0.0,0.0
gfx1250,256,1024,2048,4096,False,torch.bfloat16,torch.bfloat16,False,False,triton,0,0,0,auto,0.0,0.0,0.0
gfx1250,256,2048,2048,4096,False,torch.bfloat16,torch.bfloat16,False,False,triton,0,0,0,auto,0.0,0.0,0.0
gfx1250,256,4096,2048,4096,False,torch.bfloat16,torch.bfloat16,False,False,triton,0,0,0,auto,0.0,0.0,0.0
gfx1250,256,8192,2048,4096,False,torch.bfloat16,torch.bfloat16,False,False,triton,0,0,0,auto,0.0,0.0,0.0
gfx1250,256,16384,2048,4096,False,torch.bfloat16,torch.bfloat16,False,False,triton,0,0,0,auto,0.0,0.0,0.0
gfx1250,256,1,64,4096,False,torch.bfloat16,torch.bfloat16,False,False,triton,0,0,0,auto,0.0,0.0,0.0
gfx1250,256,2,64,4096,False,torch.bfloat16,torch.bfloat16,False,False,triton,0,0,0,auto,0.0,0.0,0.0
gfx1250,256,4,64,4096,False,torch.bfloat16,torch.bfloat16,False,False,triton,0,0,0,auto,0.0,0.0,0.0
gfx1250,256,8,64,4096,False,torch.bfloat16,torch.bfloat16,False,False,triton,0,0,0,auto,0.0,0.0,0.0
gfx1250,256,16,64,4096,False,torch.bfloat16,torch.bfloat16,False,False,triton,0,0,0,auto,0.0,0.0,0.0
gfx1250,256,32,64,4096,False,torch.bfloat16,torch.bfloat16,False,False,triton,0,0,0,auto,0.0,0.0,0.0
gfx1250,256,64,64,4096,False,torch.bfloat16,torch.bfloat16,False,False,triton,0,0,0,auto,0.0,0.0,0.0
gfx1250,256,128,64,4096,False,torch.bfloat16,torch.bfloat16,False,False,triton,0,0,0,auto,0.0,0.0,0.0
gfx1250,256,256,64,4096,False,torch.bfloat16,torch.bfloat16,False,False,triton,0,0,0,auto,0.0,0.0,0.0
gfx1250,256,512,64,4096,False,torch.bfloat16,torch.bfloat16,False,False,triton,0,0,0,auto,0.0,0.0,0.0
gfx1250,256,1024,64,4096,False,torch.bfloat16,torch.bfloat16,False,False,triton,0,0,0,auto,0.0,0.0,0.0
gfx1250,256,2048,64,4096,False,torch.bfloat16,torch.bfloat16,False,False,triton,0,0,0,auto,0.0,0.0,0.0
gfx1250,256,4096,64,4096,False,torch.bfloat16,torch.bfloat16,False,False,triton,0,0,0,auto,0.0,0.0,0.0
gfx1250,256,8192,64,4096,False,torch.bfloat16,torch.bfloat16,False,False,triton,0,0,0,auto,0.0,0.0,0.0
gfx1250,256,16384,64,4096,False,torch.bfloat16,torch.bfloat16,False,False,triton,0,0,0,auto,0.0,0.0,0.0
gfx1250,256,1,129280,4096,False,torch.bfloat16,torch.bfloat16,False,False,triton,0,0,0,auto,0.0,0.0,0.0
gfx1250,256,2,129280,4096,False,torch.bfloat16,torch.bfloat16,False,False,triton,0,0,0,auto,0.0,0.0,0.0
gfx1250,256,4,129280,4096,False,torch.bfloat16,torch.bfloat16,False,False,triton,0,0,0,auto,0.0,0.0,0.0
gfx1250,256,8,129280,4096,False,torch.bfloat16,torch.bfloat16,False,False,triton,0,0,0,auto,0.0,0.0,0.0
gfx1250,256,16,129280,4096,False,torch.bfloat16,torch.bfloat16,False,False,triton,0,0,0,auto,0.0,0.0,0.0
gfx1250,256,32,129280,4096,False,torch.bfloat16,torch.bfloat16,False,False,triton,0,0,0,auto,0.0,0.0,0.0
gfx1250,256,64,129280,4096,False,torch.bfloat16,torch.bfloat16,False,False,triton,0,0,0,auto,0.0,0.0,0.0
gfx1250,256,128,129280,4096,False,torch.bfloat16,torch.bfloat16,False,False,triton,0,0,0,auto,0.0,0.0,0.0
gfx1250,256,256,129280,4096,False,torch.bfloat16,torch.bfloat16,False,False,triton,0,0,0,auto,0.0,0.0,0.0
gfx1250,256,512,129280,4096,False,torch.bfloat16,torch.bfloat16,False,False,triton,0,0,0,auto,0.0,0.0,0.0
gfx1250,256,1024,129280,4096,False,torch.bfloat16,torch.bfloat16,False,False,triton,0,0,0,auto,0.0,0.0,0.0
gfx1250,256,2048,129280,4096,False,torch.bfloat16,torch.bfloat16,False,False,triton,0,0,0,auto,0.0,0.0,0.0
gfx1250,256,4096,129280,4096,False,torch.bfloat16,torch.bfloat16,False,False,triton,0,0,0,auto,0.0,0.0,0.0
gfx1250,256,8192,129280,4096,False,torch.bfloat16,torch.bfloat16,False,False,triton,0,0,0,auto,0.0,0.0,0.0
gfx1250,256,16384,129280,4096,False,torch.bfloat16,torch.bfloat16,False,False,triton,0,0,0,auto,0.0,0.0,0.0
gfx942,80,1,64,4096,False,torch.bfloat16,torch.bfloat16,False,False,skinny,2,0,3.6782,sol2,0.0,0.14,144.8
gfx942,80,2,64,4096,False,torch.bfloat16,torch.bfloat16,False,False,opus,10310,0,4.1922,opus_gemm_gfx942_wkc_accum_256x16x16x64_1x1_16x16x16_0x0x0,0.0234,0.25,129.03
gfx942,80,4,64,4096,False,torch.bfloat16,torch.bfloat16,False,False,opus,10310,0,4.2146,opus_gemm_gfx942_wkc_accum_256x16x16x64_1x1_16x16x16_0x0x0,0.0234,0.5,132.29
gfx942,80,8,64,4096,False,torch.bfloat16,torch.bfloat16,False,False,opus,10310,0,4.5113,opus_gemm_gfx942_wkc_accum_256x16x16x64_1x1_16x16x16_0x0x0,0.0195,0.93,130.97
gfx942,80,7680,64,4096,False,torch.bfloat16,torch.bfloat16,False,False,torch,0,0,47.248,native,0.0,85.22,1363.48
gfx942,80,7680,256,4096,False,torch.bfloat16,torch.bfloat16,False,False,torch,0,0,124.4846,native,0.0,129.38,553.83
gfx942,80,7680,512,4096,False,torch.bfloat16,torch.bfloat16,False,False,torch,0,0,211.985,native,0.0,151.96,353.67
gfx942,80,7680,1024,4096,False,torch.bfloat16,torch.bfloat16,False,False,torch,0,0,345.2932,native,0.0,186.58,252.05
gfx942,80,7680,2048,4096,False,torch.bfloat16,torch.bfloat16,False,False,opus,10216,0,693.9949,opus_gemm_gfx942_splitk_quad_mfma32_bf16ws_256x256x256x32_2x2_32x32x8_6x0x0,0.0,185.66,160.16
gfx942,80,1,32320,4096,False,torch.bfloat16,torch.bfloat16,False,False,torch,0,0,109.2233,native,0.0,2.42,2424.74
gfx942,80,15,32320,4096,False,torch.bfloat16,torch.bfloat16,False,False,torch,0,0,112.235,native,0.0,35.39,2368.76
gfx942,80,16,32320,4096,False,torch.bfloat16,torch.bfloat16,False,False,torch,0,0,112.6187,native,0.0,37.62,2361.34
