aiter/configs/model_configs/dsv4_bf16_tuned_gemm.csv
gfx,cu_num,M,N,K,bias,dtype,outdtype,scaleAB,bpreshuffle,libtype,solidx,splitK,us,kernelName,err_ratio,tflops,bw
gfx950,256,1,64,7168,False,torch.bfloat16,torch.bfloat16,False,False,flydsl,1949,8,4.6345,flydsl_gemm6_abf16_wbf16_bf16_t16x64x128_split_k8_block_m_warp1_block_n_warp1_block_k_warp2_async_copyTrue_b_to_ldsTrue_b_preshuffleFalse_c_to_ldsFalse_gfx950,0.0156,0.2,201.09
gfx950,256,2,64,7168,False,torch.bfloat16,torch.bfloat16,False,False,flydsl,2229,8,4.9674,flydsl_gemm7_abf16_wbf16_bf16_t16x64x128_split_k8_block_m_warp1_block_n_warp1_block_k_warp2_async_copyTrue_b_to_ldsTrue_b_preshuffleFalse_c_to_ldsFalse_gfx950,0.0078,0.37,190.53
gfx950,256,4,64,7168,False,torch.bfloat16,torch.bfloat16,False,False,asm,1,14,5.2346,_ZN5aiter39bf16gemm_fp32bf16_tn_32x64_splitk_cleanE,0.0195,0.7,186.33
gfx950,256,8,64,7168,False,torch.bfloat16,torch.bfloat16,False,False,flydsl,1949,8,5.0277,flydsl_gemm6_abf16_wbf16_bf16_t16x64x128_split_k8_block_m_warp1_block_n_warp1_block_k_warp2_async_copyTrue_b_to_ldsTrue_b_preshuffleFalse_c_to_ldsFalse_gfx950,0.0254,1.46,205.5
gfx950,256,16,64,7168,False,torch.bfloat16,torch.bfloat16,False,False,flydsl,1950,8,5.1764,flydsl_gemm6_abf16_wbf16_bf16_t16x64x128_split_k8_block_m_warp1_block_n_warp2_block_k_warp1_async_copyTrue_b_to_ldsTrue_b_preshuffleFalse_c_to_ldsFalse_gfx950,0.0273,2.84,221.96
gfx950,256,32,64,7168,False,torch.bfloat16,torch.bfloat16,False,False,flydsl,2226,7,5.2257,flydsl_gemm7_abf16_wbf16_bf16_t16x64x128_split_k7_block_m_warp1_block_n_warp1_block_k_warp2_async_copyTrue_b_to_ldsTrue_b_preshuffleFalse_c_to_ldsFalse_gfx950,0.0254,5.62,264.15
gfx950,256,48,64,7168,False,torch.bfloat16,torch.bfloat16,False,False,flydsl,1949,8,5.2045,flydsl_gemm6_abf16_wbf16_bf16_t16x64x128_split_k8_block_m_warp1_block_n_warp1_block_k_warp2_async_copyTrue_b_to_ldsTrue_b_preshuffleFalse_c_to_ldsFalse_gfx950,0.0303,8.46,309.69
gfx950,256,64,64,7168,False,torch.bfloat16,torch.bfloat16,False,False,flydsl,2884,8,5.3558,flydsl_gemm7_abf16_wbf16_bf16_t16x64x128_split_k8_block_m_warp1_block_n_warp1_block_k_warp2_async_copyTrue_b_to_ldsTrue_b_preshuffleFalse_c_to_ldsFalse_gfx950,0.03,10.96,344.15
gfx950,256,80,64,7168,False,torch.bfloat16,torch.bfloat16,False,False,flydsl,2885,8,5.2201,flydsl_gemm7_abf16_wbf16_bf16_t16x64x128_split_k8_block_m_warp1_block_n_warp2_block_k_warp1_async_copyTrue_b_to_ldsTrue_b_preshuffleFalse_c_to_ldsFalse_gfx950,0.0211,14.06,397.43
gfx950,256,96,64,7168,False,torch.bfloat16,torch.bfloat16,False,False,flydsl,2605,8,5.5938,flydsl_gemm6_abf16_wbf16_bf16_t16x64x128_split_k8_block_m_warp1_block_n_warp2_block_k_warp1_async_copyTrue_b_to_ldsTrue_b_preshuffleFalse_c_to_ldsFalse_gfx950,0.02,15.75,412.25
gfx950,256,112,64,7168,False,torch.bfloat16,torch.bfloat16,False,False,flydsl,2605,8,5.6367,flydsl_gemm6_abf16_wbf16_bf16_t16x64x128_split_k8_block_m_warp1_block_n_warp2_block_k_warp1_async_copyTrue_b_to_ldsTrue_b_preshuffleFalse_c_to_ldsFalse_gfx950,0.0209,18.23,450.17
gfx950,256,128,64,7168,False,torch.bfloat16,torch.bfloat16,False,False,flydsl,2974,8,5.9966,flydsl_gemm6_abf16_wbf16_bf16_t16x64x128_split_k8_block_m_warp1_block_n_warp1_block_k_warp2_async_copyTrue_b_to_ldsTrue_b_preshuffleFalse_c_to_ldsFalse_gfx950,0.0284,19.58,461.74
gfx950,256,144,64,7168,False,torch.bfloat16,torch.bfloat16,False,False,flydsl,1888,8,6.0387,flydsl_gemm4_abf16_wbf16_bf16_t16x64x128_split_k8_block_m_warp1_block_n_warp2_block_k_warp1_async_copyTrue_b_to_ldsTrue_b_preshuffleFalse_c_to_ldsFalse_gfx950,0.0221,21.88,496.85
gfx950,256,160,64,7168,False,torch.bfloat16,torch.bfloat16,False,False,flydsl,2510,8,6.1011,flydsl_gemm5_abf16_wbf16_bf16_t16x64x128_split_k8_block_m_warp1_block_n_warp2_block_k_warp1_async_copyTrue_b_to_ldsTrue_b_preshuffleFalse_c_to_ldsFalse_gfx950,0.0204,24.06,529.7
gfx950,256,176,64,7168,False,torch.bfloat16,torch.bfloat16,False,False,flydsl,2975,8,6.2735,flydsl_gemm6_abf16_wbf16_bf16_t16x64x128_split_k8_block_m_warp1_block_n_warp2_block_k_warp1_async_copyTrue_b_to_ldsTrue_b_preshuffleFalse_c_to_ldsFalse_gfx950,0.0194,25.74,552.03
gfx950,256,192,64,7168,False,torch.bfloat16,torch.bfloat16,False,False,flydsl,1888,8,6.4134,flydsl_gemm4_abf16_wbf16_bf16_t16x64x128_split_k8_block_m_warp1_block_n_warp2_block_k_warp1_async_copyTrue_b_to_ldsTrue_b_preshuffleFalse_c_to_ldsFalse_gfx950,0.0199,27.47,576.07
gfx950,256,208,64,7168,False,torch.bfloat16,torch.bfloat16,False,False,flydsl,2974,8,6.5243,flydsl_gemm6_abf16_wbf16_bf16_t16x64x128_split_k8_block_m_warp1_block_n_warp1_block_k_warp2_async_copyTrue_b_to_ldsTrue_b_preshuffleFalse_c_to_ldsFalse_gfx950,0.0282,29.25,601.75
gfx950,256,224,64,7168,False,torch.bfloat16,torch.bfloat16,False,False,flydsl,2510,8,6.6854,flydsl_gemm5_abf16_wbf16_bf16_t16x64x128_split_k8_block_m_warp1_block_n_warp2_block_k_warp1_async_copyTrue_b_to_ldsTrue_b_preshuffleFalse_c_to_ldsFalse_gfx950,0.0203,30.74,621.87
gfx950,256,240,64,7168,False,torch.bfloat16,torch.bfloat16,False,False,flydsl,2510,8,6.8663,flydsl_gemm5_abf16_wbf16_bf16_t16x64x128_split_k8_block_m_warp1_block_n_warp2_block_k_warp1_async_copyTrue_b_to_ldsTrue_b_preshuffleFalse_c_to_ldsFalse_gfx950,0.0205,32.07,639.19
gfx950,256,256,64,7168,False,torch.bfloat16,torch.bfloat16,False,False,flydsl,2044,8,7.2399,flydsl_gemm4_abf16_wbf16_bf16_t32x64x128_split_k8_block_m_warp2_block_n_warp1_block_k_warp2_async_copyTrue_b_to_ldsTrue_b_preshuffleFalse_c_to_ldsFalse_gfx950,0.0292,32.44,638.17
gfx950,256,288,64,7168,False,torch.bfloat16,torch.bfloat16,False,False,flydsl,1888,8,7.1555,flydsl_gemm4_abf16_wbf16_bf16_t16x64x128_split_k8_block_m_warp1_block_n_warp2_block_k_warp1_async_copyTrue_b_to_ldsTrue_b_preshuffleFalse_c_to_ldsFalse_gfx950,0.0217,36.93,710.38
gfx950,256,320,64,7168,False,torch.bfloat16,torch.bfloat16,False,False,flydsl,1888,8,7.1986,flydsl_gemm4_abf16_wbf16_bf16_t16x64x128_split_k8_block_m_warp1_block_n_warp2_block_k_warp1_async_copyTrue_b_to_ldsTrue_b_preshuffleFalse_c_to_ldsFalse_gfx950,0.0209,40.79,770.43
gfx950,256,352,64,7168,False,torch.bfloat16,torch.bfloat16,False,False,flydsl,2975,8,7.2323,flydsl_gemm6_abf16_wbf16_bf16_t16x64x128_split_k8_block_m_warp1_block_n_warp2_block_k_warp1_async_copyTrue_b_to_ldsTrue_b_preshuffleFalse_c_to_ldsFalse_gfx950,0.0218,44.66,830.83
gfx950,256,384,64,7168,False,torch.bfloat16,torch.bfloat16,False,False,flydsl,1888,8,7.416,flydsl_gemm4_abf16_wbf16_bf16_t16x64x128_split_k8_block_m_warp1_block_n_warp2_block_k_warp1_async_copyTrue_b_to_ldsTrue_b_preshuffleFalse_c_to_ldsFalse_gfx950,0.0199,47.51,872.66
gfx950,256,416,64,7168,False,torch.bfloat16,torch.bfloat16,False,False,flydsl,1885,7,7.5315,flydsl_gemm4_abf16_wbf16_bf16_t16x64x128_split_k7_block_m_warp1_block_n_warp2_block_k_warp1_async_copyTrue_b_to_ldsTrue_b_preshuffleFalse_c_to_ldsFalse_gfx950,0.0191,50.68,920.74
gfx950,256,448,64,7168,False,torch.bfloat16,torch.bfloat16,False,False,flydsl,3254,8,7.6463,flydsl_gemm7_abf16_wbf16_bf16_t16x64x128_split_k8_block_m_warp1_block_n_warp1_block_k_warp2_async_copyTrue_b_to_ldsTrue_b_preshuffleFalse_c_to_ldsFalse_gfx950,0.0268,53.76,967.45
gfx950,256,480,64,7168,False,torch.bfloat16,torch.bfloat16,False,False,flydsl,3505,8,7.665,flydsl_gemm8_abf16_wbf16_bf16_t16x64x64_split_k8_block_m_warp1_block_n_warp2_block_k_warp1_async_copyTrue_b_to_ldsTrue_b_preshuffleFalse_c_to_ldsFalse_gfx950,0.0197,57.46,1025.47
gfx950,256,512,64,7168,False,torch.bfloat16,torch.bfloat16,False,False,flydsl,1885,7,7.8209,flydsl_gemm4_abf16_wbf16_bf16_t16x64x128_split_k7_block_m_warp1_block_n_warp2_block_k_warp1_async_copyTrue_b_to_ldsTrue_b_preshuffleFalse_c_to_ldsFalse_gfx950,0.0205,60.06,1064.21
gfx950,256,544,64,7168,False,torch.bfloat16,torch.bfloat16,False,False,flydsl,3502,7,8.0423,flydsl_gemm8_abf16_wbf16_bf16_t16x64x64_split_k7_block_m_warp1_block_n_warp2_block_k_warp1_async_copyTrue_b_to_ldsTrue_b_preshuffleFalse_c_to_ldsFalse_gfx950,0.0205,62.06,1092.46
gfx950,256,576,64,7168,False,torch.bfloat16,torch.bfloat16,False,False,flydsl,2987,7,8.0971,flydsl_gemm6_abf16_wbf16_bf16_t16x64x64_split_k7_block_m_warp1_block_n_warp2_block_k_warp1_async_copyTrue_b_to_ldsTrue_b_preshuffleFalse_c_to_ldsFalse_gfx950,0.019,65.27,1142.23
gfx950,256,608,64,7168,False,torch.bfloat16,torch.bfloat16,False,False,flydsl,2042,8,8.2383,flydsl_gemm4_abf16_wbf16_bf16_t32x64x128_split_k8_block_m_warp1_block_n_warp4_block_k_warp1_async_copyTrue_b_to_ldsTrue_b_preshuffleFalse_c_to_ldsFalse_gfx950,0.0215,67.71,1178.84
gfx950,256,640,64,7168,False,torch.bfloat16,torch.bfloat16,False,False,flydsl,3312,8,8.5049,flydsl_gemm7_abf16_wbf16_bf16_t32x64x64_split_k8_block_m_warp1_block_n_warp4_block_k_warp1_async_copyTrue_b_to_ldsTrue_b_preshuffleFalse_c_to_ldsFalse_gfx950,0.021,69.04,1196.31
gfx950,256,672,64,7168,False,torch.bfloat16,torch.bfloat16,False,False,flydsl,3538,7,8.503,flydsl_gemm8_abf16_wbf16_bf16_t32x64x64_split_k7_block_m_warp1_block_n_warp4_block_k_warp1_async_copyTrue_b_to_ldsTrue_b_preshuffleFalse_c_to_ldsFalse_gfx950,0.0197,72.51,1251.01
gfx950,256,704,64,7168,False,torch.bfloat16,torch.bfloat16,False,False,flydsl,2033,7,8.3665,flydsl_gemm4_abf16_wbf16_bf16_t32x64x128_split_k7_block_m_warp1_block_n_warp4_block_k_warp1_async_copyTrue_b_to_ldsTrue_b_preshuffleFalse_c_to_ldsFalse_gfx950,0.0195,77.2,1326.74
gfx950,256,736,64,7168,False,torch.bfloat16,torch.bfloat16,False,False,flydsl,2033,7,8.3686,flydsl_gemm4_abf16_wbf16_bf16_t32x64x128_split_k7_block_m_warp1_block_n_warp4_block_k_warp1_async_copyTrue_b_to_ldsTrue_b_preshuffleFalse_c_to_ldsFalse_gfx950,0.0198,80.69,1381.71
gfx950,256,768,64,7168,False,torch.bfloat16,torch.bfloat16,False,False,flydsl,2033,7,8.7819,flydsl_gemm4_abf16_wbf16_bf16_t32x64x128_split_k7_block_m_warp1_block_n_warp4_block_k_warp1_async_copyTrue_b_to_ldsTrue_b_preshuffleFalse_c_to_ldsFalse_gfx950,0.0198,80.24,1369.39
gfx950,256,800,64,7168,False,torch.bfloat16,torch.bfloat16,False,False,flydsl,2042,8,8.7626,flydsl_gemm4_abf16_wbf16_bf16_t32x64x128_split_k8_block_m_warp1_block_n_warp4_block_k_warp1_async_copyTrue_b_to_ldsTrue_b_preshuffleFalse_c_to_ldsFalse_gfx950,0.022,83.77,1425.23
gfx950,256,832,64,7168,False,torch.bfloat16,torch.bfloat16,False,False,flydsl,2560,7,9.1384,flydsl_gemm5_abf16_wbf16_bf16_t32x64x128_split_k7_block_m_warp2_block_n_warp1_block_k_warp2_async_copyTrue_b_to_ldsTrue_b_preshuffleFalse_c_to_ldsFalse_gfx950,0.0265,83.53,1417.27
gfx950,256,864,64,7168,False,torch.bfloat16,torch.bfloat16,False,False,flydsl,2036,7,9.0782,flydsl_gemm4_abf16_wbf16_bf16_t32x64x128_split_k7_block_m_warp2_block_n_warp2_block_k_warp1_async_copyTrue_b_to_ldsTrue_b_preshuffleFalse_c_to_ldsFalse_gfx950,0.0196,87.32,1477.65
gfx950,256,896,64,7168,False,torch.bfloat16,torch.bfloat16,False,False,flydsl,2036,7,9.162,flydsl_gemm4_abf16_wbf16_bf16_t32x64x128_split_k7_block_m_warp2_block_n_warp2_block_k_warp1_async_copyTrue_b_to_ldsTrue_b_preshuffleFalse_c_to_ldsFalse_gfx950,0.0194,89.73,1514.65
gfx950,256,928,64,7168,False,torch.bfloat16,torch.bfloat16,False,False,flydsl,2035,7,9.2709,flydsl_gemm4_abf16_wbf16_bf16_t32x64x128_split_k7_block_m_warp2_block_n_warp1_block_k_warp2_async_copyTrue_b_to_ldsTrue_b_preshuffleFalse_c_to_ldsFalse_gfx950,0.0266,91.84,1546.79
gfx950,256,960,64,7168,False,torch.bfloat16,torch.bfloat16,False,False,flydsl,2557,7,9.5174,flydsl_gemm5_abf16_wbf16_bf16_t32x64x128_split_k7_block_m_warp1_block_n_warp2_block_k_warp2_async_copyTrue_b_to_ldsTrue_b_preshuffleFalse_c_to_ldsFalse_gfx950,0.0266,92.55,1555.36
gfx950,256,992,64,7168,False,torch.bfloat16,torch.bfloat16,False,False,flydsl,2036,7,9.501,flydsl_gemm4_abf16_wbf16_bf16_t32x64x128_split_k7_block_m_warp2_block_n_warp2_block_k_warp1_async_copyTrue_b_to_ldsTrue_b_preshuffleFalse_c_to_ldsFalse_gfx950,0.0195,95.8,1606.76
gfx950,256,1024,64,7168,False,torch.bfloat16,torch.bfloat16,False,False,flydsl,1882,4,9.9558,flydsl_gemm4_abf16_wbf16_bf16_t16x64x128_split_k4_block_m_warp1_block_n_warp2_block_k_warp1_async_copyTrue_b_to_ldsTrue_b_preshuffleFalse_c_to_ldsFalse_gfx950,0.0137,94.37,1579.85
gfx950,256,1088,64,7168,False,torch.bfloat16,torch.bfloat16,False,False,flydsl,2036,7,9.952,flydsl_gemm4_abf16_wbf16_bf16_t32x64x128_split_k7_block_m_warp2_block_n_warp2_block_k_warp1_async_copyTrue_b_to_ldsTrue_b_preshuffleFalse_c_to_ldsFalse_gfx950,0.02,100.31,1673.47
gfx950,256,1152,64,7168,False,torch.bfloat16,torch.bfloat16,False,False,flydsl,2036,7,10.195,flydsl_gemm4_abf16_wbf16_bf16_t32x64x128_split_k7_block_m_warp2_block_n_warp2_block_k_warp1_async_copyTrue_b_to_ldsTrue_b_preshuffleFalse_c_to_ldsFalse_gfx950,0.0195,103.67,1724.38
gfx950,256,1216,64,7168,False,torch.bfloat16,torch.bfloat16,False,False,flydsl,1411,4,10.8133,flydsl_gemm3_abf16_wbf16_bf16_t32x64x256_split_k4_block_m_warp1_block_n_warp4_block_k_warp1_async_copyTrue_b_to_ldsTrue_b_preshuffleFalse_c_to_ldsFalse_gfx950,0.0136,103.18,1711.39
gfx950,256,1280,64,7168,False,torch.bfloat16,torch.bfloat16,False,False,flydsl,3562,7,11.087,flydsl_gemm8_abf16_wbf16_bf16_t48x64x64_split_k7_block_m_warp1_block_n_warp2_block_k_warp1_async_copyTrue_b_to_ldsTrue_b_preshuffleFalse_c_to_ldsFalse_gfx950,0.0197,105.93,1752.63
gfx950,256,1344,64,7168,False,torch.bfloat16,torch.bfloat16,False,False,flydsl,2551,4,11.006,flydsl_gemm5_abf16_wbf16_bf16_t32x64x128_split_k4_block_m_warp2_block_n_warp1_block_k_warp2_async_copyTrue_b_to_ldsTrue_b_preshuffleFalse_c_to_ldsFalse_gfx950,0.0212,112.04,1849.64
gfx950,256,1408,64,7168,False,torch.bfloat16,torch.bfloat16,False,False,flydsl,2551,4,11.3798,flydsl_gemm5_abf16_wbf16_bf16_t32x64x128_split_k4_block_m_warp2_block_n_warp1_block_k_warp2_async_copyTrue_b_to_ldsTrue_b_preshuffleFalse_c_to_ldsFalse_gfx950,0.022,113.52,1870.23
gfx950,256,1472,64,7168,False,torch.bfloat16,torch.bfloat16,False,False,flydsl,2027,4,11.2311,flydsl_gemm4_abf16_wbf16_bf16_t32x64x128_split_k4_block_m_warp2_block_n_warp2_block_k_warp1_async_copyTrue_b_to_ldsTrue_b_preshuffleFalse_c_to_ldsFalse_gfx950,0.0144,120.25,1977.41
gfx950,256,1536,64,7168,False,torch.bfloat16,torch.bfloat16,False,False,flydsl,2023,4,11.5785,flydsl_gemm4_abf16_wbf16_bf16_t32x64x128_split_k4_block_m_warp1_block_n_warp2_block_k_warp2_async_copyTrue_b_to_ldsTrue_b_preshuffleFalse_c_to_ldsFalse_gfx950,0.0215,121.72,1998.03
gfx950,256,1600,64,7168,False,torch.bfloat16,torch.bfloat16,False,False,flydsl,2024,4,11.6405,flydsl_gemm4_abf16_wbf16_bf16_t32x64x128_split_k4_block_m_warp1_block_n_warp4_block_k_warp1_async_copyTrue_b_to_ldsTrue_b_preshuffleFalse_c_to_ldsFalse_gfx950,0.0139,126.11,2066.91
gfx950,256,1664,64,7168,False,torch.bfloat16,torch.bfloat16,False,False,flydsl,2551,4,11.9241,flydsl_gemm5_abf16_wbf16_bf16_t32x64x128_split_k4_block_m_warp2_block_n_warp1_block_k_warp2_async_copyTrue_b_to_ldsTrue_b_preshuffleFalse_c_to_ldsFalse_gfx950,0.0218,128.04,2095.39
gfx950,256,1728,64,7168,False,torch.bfloat16,torch.bfloat16,False,False,flydsl,2548,4,11.831,flydsl_gemm5_abf16_wbf16_bf16_t32x64x128_split_k4_block_m_warp1_block_n_warp2_block_k_warp2_async_copyTrue_b_to_ldsTrue_b_preshuffleFalse_c_to_ldsFalse_gfx950,0.0217,134.01,2190.12
gfx950,256,1792,64,7168,False,torch.bfloat16,torch.bfloat16,False,False,flydsl,2548,4,12.3336,flydsl_gemm5_abf16_wbf16_bf16_t32x64x128_split_k4_block_m_warp1_block_n_warp2_block_k_warp2_async_copyTrue_b_to_ldsTrue_b_preshuffleFalse_c_to_ldsFalse_gfx950,0.0208,133.31,2175.93
gfx950,256,1856,64,7168,False,torch.bfloat16,torch.bfloat16,False,False,flydsl,2023,4,12.2171,flydsl_gemm4_abf16_wbf16_bf16_t32x64x128_split_k4_block_m_warp1_block_n_warp2_block_k_warp2_async_copyTrue_b_to_ldsTrue_b_preshuffleFalse_c_to_ldsFalse_gfx950,0.0209,139.39,2272.45
gfx950,256,1920,64,7168,False,torch.bfloat16,torch.bfloat16,False,False,flydsl,2024,4,12.5809,flydsl_gemm4_abf16_wbf16_bf16_t32x64x128_split_k4_block_m_warp1_block_n_warp4_block_k_warp1_async_copyTrue_b_to_ldsTrue_b_preshuffleFalse_c_to_ldsFalse_gfx950,0.0134,140.02,2280.31
gfx950,256,1984,64,7168,False,torch.bfloat16,torch.bfloat16,False,False,flydsl,2548,4,12.7049,flydsl_gemm5_abf16_wbf16_bf16_t32x64x128_split_k4_block_m_warp1_block_n_warp2_block_k_warp2_async_copyTrue_b_to_ldsTrue_b_preshuffleFalse_c_to_ldsFalse_gfx950,0.021,143.28,2330.92
gfx950,256,2048,64,7168,False,torch.bfloat16,torch.bfloat16,False,False,flydsl,2024,4,13.0756,flydsl_gemm4_abf16_wbf16_bf16_t32x64x128_split_k4_block_m_warp1_block_n_warp4_block_k_warp1_async_copyTrue_b_to_ldsTrue_b_preshuffleFalse_c_to_ldsFalse_gfx950,0.0133,143.71,2335.63
gfx950,256,4096,64,7168,False,torch.bfloat16,torch.bfloat16,False,False,asm,8,5,18.6483,_ZN5aiter39bf16gemm_fp32bf16_tn_96x64_splitk_cleanE,0.0161,201.52,3226.14
gfx950,256,6144,64,7168,False,torch.bfloat16,torch.bfloat16,False,False,asm,8,4,23.4754,_ZN5aiter39bf16gemm_fp32bf16_tn_96x64_splitk_cleanE,0.0136,240.13,3824.61
gfx950,256,8192,64,7168,False,torch.bfloat16,torch.bfloat16,False,False,flydsl,2533,1,28.7871,flydsl_gemm5_abf16_wbf16_bf16_t32x64x128_split_k1_block_m_warp2_block_n_warp1_block_k_warp2_async_copyTrue_b_to_ldsTrue_b_preshuffleFalse_c_to_ldsFalse_gfx950,0.0059,261.1,4147.92
gfx950,256,10240,64,7168,False,torch.bfloat16,torch.bfloat16,False,False,torch,0,0,31.9022,native,0.0,294.5,4671.43
gfx950,256,12288,64,7168,False,torch.bfloat16,torch.bfloat16,False,False,asm,8,2,37.7359,_ZN5aiter39bf16gemm_fp32bf16_tn_96x64_splitk_cleanE,0.0061,298.77,4734.25
gfx950,256,14336,64,7168,False,torch.bfloat16,torch.bfloat16,False,False,flydsl,2661,1,42.8973,flydsl_gemm5_abf16_wbf16_bf16_t64x64x128_split_k1_block_m_warp4_block_n_warp1_block_k_warp2_async_copyTrue_b_to_ldsTrue_b_preshuffleFalse_c_to_ldsFalse_gfx950,0.0059,306.62,4855.16
gfx950,256,16384,64,7168,False,torch.bfloat16,torch.bfloat16,False,False,flydsl,2137,1,45.0666,flydsl_gemm4_abf16_wbf16_bf16_t64x64x128_split_k1_block_m_warp4_block_n_warp2_block_k_warp1_async_copyTrue_b_to_ldsTrue_b_preshuffleFalse_c_to_ldsFalse_gfx950,0.0,333.56,5278.76
gfx950,256,32768,64,7168,False,torch.bfloat16,torch.bfloat16,False,False,flydsl,1803,1,80.6804,flydsl_gemm4_abf16_wbf16_bf16_t128x64x64_split_k1_block_m_warp4_block_n_warp1_block_k_warp1_async_copyTrue_b_to_ldsTrue_b_preshuffleFalse_c_to_ldsFalse_gfx950,0.0,372.64,5885.86
gfx950,256,1,384,7168,False,torch.bfloat16,torch.bfloat16,False,False,flydsl,3645,8,5.9534,flydsl_gemm6_abf16_wbf16_bf16_t16x64x128_split_k8_block_m_warp1_block_n_warp2_block_k_warp1_async_copyTrue_b_to_ldsTrue_b_preshuffleFalse_c_to_ldsFalse_gfx950,0.013,0.92,927.22
gfx950,256,2,384,7168,False,torch.bfloat16,torch.bfloat16,False,False,flydsl,2303,8,6.0359,flydsl_gemm4_abf16_wbf16_bf16_t16x64x128_split_k8_block_m_warp1_block_n_warp2_block_k_warp1_async_copyTrue_b_to_ldsTrue_b_preshuffleFalse_c_to_ldsFalse_gfx950,0.0156,1.82,917.05
gfx950,256,4,384,7168,False,torch.bfloat16,torch.bfloat16,False,False,flydsl,4099,8,6.003,flydsl_gemm7_abf16_wbf16_bf16_t16x64x128_split_k8_block_m_warp1_block_n_warp1_block_k_warp2_async_copyTrue_b_to_ldsTrue_b_preshuffleFalse_c_to_ldsFalse_gfx950,0.0326,3.67,927.11
gfx950,256,160,384,7168,False,torch.bfloat16,torch.bfloat16,False,False,flydsl,3697,4,10.0995,flydsl_gemm4_abf16_wbf16_bf16_t16x64x128_split_k4_block_m_warp1_block_n_warp2_block_k_warp1_async_copyTrue_b_to_ldsTrue_b_preshuffleFalse_c_to_ldsFalse_gfx950,0.0151,87.21,784.36
gfx950,256,352,384,7168,False,torch.bfloat16,torch.bfloat16,False,False,flydsl,3111,4,13.1158,flydsl_gemm3_abf16_wbf16_bf16_t64x64x128_split_k4_block_m_warp2_block_n_warp4_block_k_warp1_async_copyTrue_b_to_ldsTrue_b_preshuffleFalse_c_to_ldsFalse_gfx950,0.0137,147.74,825.08
gfx950,256,416,384,7168,False,torch.bfloat16,torch.bfloat16,False,False,flydsl,4201,4,14.1797,flydsl_gemm4_abf16_wbf16_bf16_t64x64x128_split_k4_block_m_warp4_block_n_warp2_block_k_warp1_async_copyTrue_b_to_ldsTrue_b_preshuffleFalse_c_to_ldsFalse_gfx950,0.0139,161.5,831.35
gfx950,256,480,384,7168,False,torch.bfloat16,torch.bfloat16,False,False,flydsl,3104,4,15.0036,flydsl_gemm3_abf16_wbf16_bf16_t64x64x128_split_k4_block_m_warp1_block_n_warp4_block_k_warp1_async_copyTrue_b_to_ldsTrue_b_preshuffleFalse_c_to_ldsFalse_gfx950,0.014,176.12,850.13
gfx950,256,544,384,7168,False,torch.bfloat16,torch.bfloat16,False,False,asm,7,5,15.7162,_ZN5aiter39bf16gemm_fp32bf16_tn_80x64_splitk_cleanE,0.0162,190.55,873.09
gfx950,256,576,384,7168,False,torch.bfloat16,torch.bfloat16,False,False,asm,7,5,16.2445,_ZN5aiter39bf16gemm_fp32bf16_tn_80x64_splitk_cleanE,0.016,195.2,874.45
gfx950,256,608,384,7168,False,torch.bfloat16,torch.bfloat16,False,False,asm,5,4,16.5819,_ZN5aiter39bf16gemm_fp32bf16_tn_64x64_splitk_cleanE,0.0134,201.85,885.8
gfx950,256,640,384,7168,False,torch.bfloat16,torch.bfloat16,False,False,asm,8,5,16.8416,_ZN5aiter39bf16gemm_fp32bf16_tn_96x64_splitk_cleanE,0.0158,209.2,900.84
gfx950,256,672,384,7168,False,torch.bfloat16,torch.bfloat16,False,False,asm,7,4,17.031,_ZN5aiter39bf16gemm_fp32bf16_tn_80x64_splitk_cleanE,0.0136,217.21,919.2
gfx950,256,704,384,7168,False,torch.bfloat16,torch.bfloat16,False,False,asm,7,4,17.4535,_ZN5aiter39bf16gemm_fp32bf16_tn_80x64_splitk_cleanE,0.0136,222.05,924.64
gfx950,256,736,384,7168,False,torch.bfloat16,torch.bfloat16,False,False,asm,7,4,17.6903,_ZN5aiter39bf16gemm_fp32bf16_tn_80x64_splitk_cleanE,0.0135,229.03,939.59
gfx950,256,768,384,7168,False,torch.bfloat16,torch.bfloat16,False,False,asm,7,4,18.2453,_ZN5aiter39bf16gemm_fp32bf16_tn_80x64_splitk_cleanE,0.0136,231.72,937.5
gfx950,256,800,384,7168,False,torch.bfloat16,torch.bfloat16,False,False,asm,8,4,18.4739,_ZN5aiter39bf16gemm_fp32bf16_tn_96x64_splitk_cleanE,0.0133,238.39,952.06
gfx950,256,832,384,7168,False,torch.bfloat16,torch.bfloat16,False,False,asm,8,4,18.7409,_ZN5aiter39bf16gemm_fp32bf16_tn_96x64_splitk_cleanE,0.0135,244.39,964.28
gfx950,256,864,384,7168,False,torch.bfloat16,torch.bfloat16,False,False,asm,8,4,19.191,_ZN5aiter39bf16gemm_fp32bf16_tn_96x64_splitk_cleanE,0.0135,247.84,966.85
gfx950,256,896,384,7168,False,torch.bfloat16,torch.bfloat16,False,False,asm,8,4,19.6485,_ZN5aiter39bf16gemm_fp32bf16_tn_96x64_splitk_cleanE,0.0138,251.04,968.94
gfx950,256,928,384,7168,False,torch.bfloat16,torch.bfloat16,False,False,asm,7,3,19.7295,_ZN5aiter39bf16gemm_fp32bf16_tn_80x64_splitk_cleanE,0.0103,258.94,989.46
gfx950,256,960,384,7168,False,torch.bfloat16,torch.bfloat16,False,False,asm,8,4,20.3116,_ZN5aiter39bf16gemm_fp32bf16_tn_96x64_splitk_cleanE,0.0135,260.19,984.9
gfx950,256,992,384,7168,False,torch.bfloat16,torch.bfloat16,False,False,asm,7,3,20.1248,_ZN5aiter39bf16gemm_fp32bf16_tn_80x64_splitk_cleanE,0.0104,271.36,1018.06
gfx950,256,1088,384,7168,False,torch.bfloat16,torch.bfloat16,False,False,torch,0,0,21.0138,native,0.0,285.03,1043.99
gfx950,256,1152,384,7168,False,torch.bfloat16,torch.bfloat16,False,False,torch,0,0,21.1881,native,0.0,299.31,1081.02
gfx950,256,1216,384,7168,False,torch.bfloat16,torch.bfloat16,False,False,asm,8,3,23.7224,_ZN5aiter39bf16gemm_fp32bf16_tn_96x64_splitk_cleanE,0.0103,282.19,1006.28
gfx950,256,1280,384,7168,False,torch.bfloat16,torch.bfloat16,False,False,asm,8,3,24.2314,_ZN5aiter39bf16gemm_fp32bf16_tn_96x64_splitk_cleanE,0.0103,290.8,1025.04
gfx950,256,1344,384,7168,False,torch.bfloat16,torch.bfloat16,False,False,opus,1215,4,24.7665,opus_gemm_flatmm_splitk_256x64x96x64_2x1_16x16x32_0x0x0_wgpcu2_nooob,0.0,298.74,1041.92
gfx950,256,1408,384,7168,False,torch.bfloat16,torch.bfloat16,False,False,torch,0,0,23.136,native,0.0,335.02,1157.13
gfx950,256,1472,384,7168,False,torch.bfloat16,torch.bfloat16,False,False,torch,0,0,22.7728,native,0.0,355.84,1218.04
gfx950,256,1536,384,7168,False,torch.bfloat16,torch.bfloat16,False,False,torch,0,0,22.9835,native,0.0,367.9,1248.93
gfx950,256,1600,384,7168,False,torch.bfloat16,torch.bfloat16,False,False,torch,0,0,24.0987,native,0.0,365.5,1231.25
gfx950,256,1664,384,7168,False,torch.bfloat16,torch.bfloat16,False,False,torch,0,0,24.5493,native,0.0,373.14,1248.02
gfx950,256,1728,384,7168,False,torch.bfloat16,torch.bfloat16,False,False,opus,1221,4,28.9455,opus_gemm_flatmm_splitk_256x96x64x64_2x1_16x16x32_0x0x0_wgpcu2_nooob,0.0,328.64,1091.87
gfx950,256,1792,384,7168,False,torch.bfloat16,torch.bfloat16,False,False,opus,1214,2,30.7184,opus_gemm_flatmm_splitk_256x64x96x64_2x1_16x16x32_0x0x0_wgpcu1_nooob,0.0,321.14,1060.32
gfx950,256,1856,384,7168,False,torch.bfloat16,torch.bfloat16,False,False,opus,222,2,30.4958,opus_gemm_flatmm_splitk_256x96x64x128_2x1_16x16x32_0x0x0_wgpcu1,0.0,335.04,1099.76
gfx950,256,1920,384,7168,False,torch.bfloat16,torch.bfloat16,False,False,opus,1220,2,30.6877,opus_gemm_flatmm_splitk_256x96x64x64_2x1_16x16x32_0x0x0_wgpcu1_nooob,0.0,344.43,1124.38
gfx950,256,1984,384,7168,False,torch.bfloat16,torch.bfloat16,False,False,opus,220,2,31.9476,opus_gemm_flatmm_splitk_256x96x64x64_2x1_16x16x32_0x0x0_wgpcu1,0.0,341.87,1110.3
gfx950,256,2048,384,7168,False,torch.bfloat16,torch.bfloat16,False,False,torch,0,0,27.9932,native,0.0,402.75,1301.67
gfx950,256,4096,384,7168,False,torch.bfloat16,torch.bfloat16,False,False,torch,0,0,46.8307,native,0.0,481.49,1438.61
gfx950,256,6144,384,7168,False,torch.bfloat16,torch.bfloat16,False,False,torch,0,0,55.0052,native,0.0,614.9,1787.18
gfx950,256,8192,384,7168,False,torch.bfloat16,torch.bfloat16,False,False,torch,0,0,73.3825,native,0.0,614.55,1761.14
gfx950,256,10240,384,7168,False,torch.bfloat16,torch.bfloat16,False,False,flydsl,3464,1,79.9404,flydsl_gemm4_abf16_wbf16_bf16_t128x128x64_split_k1_block_m_warp4_block_n_warp2_block_k_warp1_async_copyTrue_b_to_ldsTrue_b_preshuffleFalse_c_to_ldsFalse_gfx950,0.0,705.17,2003.62
gfx950,256,12288,384,7168,False,torch.bfloat16,torch.bfloat16,False,False,torch,0,0,83.1459,native,0.0,813.58,2298.41
gfx950,256,14336,384,7168,False,torch.bfloat16,torch.bfloat16,False,False,torch,0,0,92.1367,native,0.0,856.55,2409.85
gfx950,256,16384,384,7168,False,torch.bfloat16,torch.bfloat16,False,False,torch,0,0,100.5218,native,0.0,897.26,2516.56
gfx950,256,1,512,7168,False,torch.bfloat16,torch.bfloat16,False,False,flydsl,2993,8,6.3389,flydsl_gemm4_abf16_wbf16_bf16_t16x64x128_split_k8_block_m_warp1_block_n_warp2_block_k_warp1_async_copyTrue_b_to_ldsTrue_b_preshuffleFalse_c_to_ldsFalse_gfx950,0.0137,1.16,1160.36
gfx950,256,2,512,7168,False,torch.bfloat16,torch.bfloat16,False,False,flydsl,5260,8,6.2961,flydsl_gemm8_abf16_wbf16_bf16_t16x64x64_split_k8_block_m_warp1_block_n_warp2_block_k_warp1_async_copyTrue_b_to_ldsTrue_b_preshuffleFalse_c_to_ldsFalse_gfx950,0.0186,2.33,1170.69
gfx950,256,4,512,7168,False,torch.bfloat16,torch.bfloat16,False,False,flydsl,3880,8,6.2147,flydsl_gemm5_abf16_wbf16_bf16_t16x64x128_split_k8_block_m_warp1_block_n_warp2_block_k_warp1_async_copyTrue_b_to_ldsTrue_b_preshuffleFalse_c_to_ldsFalse_gfx950,0.0239,4.72,1190.96
gfx950,256,8,512,7168,False,torch.bfloat16,torch.bfloat16,False,False,flydsl,4934,8,6.4259,flydsl_gemm7_abf16_wbf16_bf16_t16x64x128_split_k8_block_m_warp1_block_n_warp1_block_k_warp2_async_copyTrue_b_to_ldsTrue_b_preshuffleFalse_c_to_ldsFalse_gfx950,0.0269,9.14,1161.38
gfx950,256,16,512,7168,False,torch.bfloat16,torch.bfloat16,False,False,flydsl,4934,8,6.7231,flydsl_gemm7_abf16_wbf16_bf16_t16x64x128_split_k8_block_m_warp1_block_n_warp1_block_k_warp2_async_copyTrue_b_to_ldsTrue_b_preshuffleFalse_c_to_ldsFalse_gfx950,0.0308,17.47,1128.32
gfx950,256,32,512,7168,False,torch.bfloat16,torch.bfloat16,False,False,flydsl,4480,8,7.0084,flydsl_gemm6_abf16_wbf16_bf16_t16x64x128_split_k8_block_m_warp1_block_n_warp2_block_k_warp1_async_copyTrue_b_to_ldsTrue_b_preshuffleFalse_c_to_ldsFalse_gfx950,0.0214,33.51,1117.45
gfx950,256,48,512,7168,False,torch.bfloat16,torch.bfloat16,False,False,flydsl,2993,8,7.4987,flydsl_gemm4_abf16_wbf16_bf16_t16x64x128_split_k8_block_m_warp1_block_n_warp2_block_k_warp1_async_copyTrue_b_to_ldsTrue_b_preshuffleFalse_c_to_ldsFalse_gfx950,0.0215,46.98,1077.16
gfx950,256,64,512,7168,False,torch.bfloat16,torch.bfloat16,False,False,flydsl,5880,8,7.7907,flydsl_gemm6_abf16_wbf16_bf16_t16x64x128_split_k8_block_m_warp1_block_n_warp2_block_k_warp1_async_copyTrue_b_to_ldsTrue_b_preshuffleFalse_c_to_ldsFalse_gfx950,0.0219,60.3,1068.33
gfx950,256,80,512,7168,False,torch.bfloat16,torch.bfloat16,False,False,flydsl,4340,8,8.2343,flydsl_gemm4_abf16_wbf16_bf16_t32x64x128_split_k8_block_m_warp2_block_n_warp2_block_k_warp1_async_copyTrue_b_to_ldsTrue_b_preshuffleFalse_c_to_ldsFalse_gfx950,0.0218,71.31,1040.63
gfx950,256,96,512,7168,False,torch.bfloat16,torch.bfloat16,False,False,flydsl,4331,7,9.206,flydsl_gemm4_abf16_wbf16_bf16_t32x64x128_split_k7_block_m_warp2_block_n_warp2_block_k_warp1_async_copyTrue_b_to_ldsTrue_b_preshuffleFalse_c_to_ldsFalse_gfx950,0.0198,76.54,957.48
gfx950,256,112,512,7168,False,torch.bfloat16,torch.bfloat16,False,False,flydsl,4328,7,8.8739,flydsl_gemm4_abf16_wbf16_bf16_t32x64x128_split_k7_block_m_warp1_block_n_warp4_block_k_warp1_async_copyTrue_b_to_ldsTrue_b_preshuffleFalse_c_to_ldsFalse_gfx950,0.0206,92.64,1021.01
gfx950,256,128,512,7168,False,torch.bfloat16,torch.bfloat16,False,False,flydsl,4871,7,9.6964,flydsl_gemm4_abf16_wbf16_bf16_t32x64x128_split_k7_block_m_warp2_block_n_warp2_block_k_warp1_async_copyTrue_b_to_ldsTrue_b_preshuffleFalse_c_to_ldsFalse_gfx950,0.0201,96.89,959.75
gfx950,256,144,512,7168,False,torch.bfloat16,torch.bfloat16,False,False,flydsl,4862,4,10.5003,flydsl_gemm4_abf16_wbf16_bf16_t32x64x128_split_k4_block_m_warp2_block_n_warp2_block_k_warp1_async_copyTrue_b_to_ldsTrue_b_preshuffleFalse_c_to_ldsFalse_gfx950,0.0142,100.66,909.68
gfx950,256,160,512,7168,False,torch.bfloat16,torch.bfloat16,False,False,flydsl,4859,4,11.0323,flydsl_gemm4_abf16_wbf16_bf16_t32x64x128_split_k4_block_m_warp1_block_n_warp4_block_k_warp1_async_copyTrue_b_to_ldsTrue_b_preshuffleFalse_c_to_ldsFalse_gfx950,0.0141,106.45,888.09
gfx950,256,176,512,7168,False,torch.bfloat16,torch.bfloat16,False,False,flydsl,4859,4,11.0278,flydsl_gemm4_abf16_wbf16_bf16_t32x64x128_split_k4_block_m_warp1_block_n_warp4_block_k_warp1_async_copyTrue_b_to_ldsTrue_b_preshuffleFalse_c_to_ldsFalse_gfx950,0.0144,117.14,910.73
gfx950,256,192,512,7168,False,torch.bfloat16,torch.bfloat16,False,False,flydsl,3420,4,11.2639,flydsl_gemm3_abf16_wbf16_bf16_t32x64x256_split_k4_block_m_warp1_block_n_warp2_block_k_warp2_async_copyTrue_b_to_ldsTrue_b_preshuffleFalse_c_to_ldsFalse_gfx950,0.0215,125.12,913.46
gfx950,256,208,512,7168,False,torch.bfloat16,torch.bfloat16,False,False,flydsl,4859,4,11.0807,flydsl_gemm4_abf16_wbf16_bf16_t32x64x128_split_k4_block_m_warp1_block_n_warp4_block_k_warp1_async_copyTrue_b_to_ldsTrue_b_preshuffleFalse_c_to_ldsFalse_gfx950,0.0142,137.78,950.74
gfx950,256,224,512,7168,False,torch.bfloat16,torch.bfloat16,False,False,flydsl,5818,4,11.6007,flydsl_gemm5_abf16_wbf16_bf16_t32x64x128_split_k4_block_m_warp1_block_n_warp2_block_k_warp2_async_copyTrue_b_to_ldsTrue_b_preshuffleFalse_c_to_ldsFalse_gfx950,0.0218,141.73,929.31
gfx950,256,240,512,7168,False,torch.bfloat16,torch.bfloat16,False,False,flydsl,4858,4,11.8587,flydsl_gemm4_abf16_wbf16_bf16_t32x64x128_split_k4_block_m_warp1_block_n_warp2_block_k_warp2_async_copyTrue_b_to_ldsTrue_b_preshuffleFalse_c_to_ldsFalse_gfx950,0.0216,148.55,929.82
gfx950,256,256,512,7168,False,torch.bfloat16,torch.bfloat16,False,False,flydsl,4859,4,12.1913,flydsl_gemm4_abf16_wbf16_bf16_t32x64x128_split_k4_block_m_warp1_block_n_warp4_block_k_warp1_async_copyTrue_b_to_ldsTrue_b_preshuffleFalse_c_to_ldsFalse_gfx950,0.0142,154.13,924.61
gfx950,256,288,512,7168,False,torch.bfloat16,torch.bfloat16,False,False,flydsl,5289,4,13.1141,flydsl_gemm4_abf16_wbf16_bf16_t64x64x64_split_k4_block_m_warp4_block_n_warp1_block_k_warp1_async_copyTrue_b_to_ldsTrue_b_preshuffleFalse_c_to_ldsFalse_gfx950,0.0143,161.2,897.03
gfx950,256,320,512,7168,False,torch.bfloat16,torch.bfloat16,False,False,flydsl,5206,4,13.8894,flydsl_gemm4_abf16_wbf16_bf16_t64x64x128_split_k4_block_m_warp4_block_n_warp2_block_k_warp1_async_copyTrue_b_to_ldsTrue_b_preshuffleFalse_c_to_ldsFalse_gfx950,0.0142,169.11,882.34
gfx950,256,352,512,7168,False,torch.bfloat16,torch.bfloat16,False,False,flydsl,5202,4,14.1962,flydsl_gemm4_abf16_wbf16_bf16_t64x64x128_split_k4_block_m_warp2_block_n_warp2_block_k_warp2_async_copyTrue_b_to_ldsTrue_b_preshuffleFalse_c_to_ldsFalse_gfx950,0.0217,182.0,897.9
gfx950,256,384,512,7168,False,torch.bfloat16,torch.bfloat16,False,False,flydsl,3375,4,14.5811,flydsl_gemm3_abf16_wbf16_bf16_t32x64x128_split_k4_block_m_warp1_block_n_warp2_block_k_warp2_async_copyTrue_b_to_ldsTrue_b_preshuffleFalse_c_to_ldsFalse_gfx950,0.0219,193.3,907.91
gfx950,256,416,512,7168,False,torch.bfloat16,torch.bfloat16,False,False,flydsl,5202,4,15.2007,flydsl_gemm4_abf16_wbf16_bf16_t64x64x128_split_k4_block_m_warp2_block_n_warp2_block_k_warp2_async_copyTrue_b_to_ldsTrue_b_preshuffleFalse_c_to_ldsFalse_gfx950,0.0215,200.88,903.23
gfx950,256,448,512,7168,False,torch.bfloat16,torch.bfloat16,False,False,asm,8,6,15.7353,_ZN5aiter39bf16gemm_fp32bf16_tn_96x64_splitk_cleanE,0.0185,208.98,903.78
gfx950,256,480,512,7168,False,torch.bfloat16,torch.bfloat16,False,False,asm,8,6,16.0338,_ZN5aiter39bf16gemm_fp32bf16_tn_96x64_splitk_cleanE,0.0184,219.74,917.61
gfx950,256,512,512,7168,False,torch.bfloat16,torch.bfloat16,False,False,asm,8,5,16.6535,_ZN5aiter39bf16gemm_fp32bf16_tn_96x64_splitk_cleanE,0.0161,225.66,912.98
gfx950,256,544,512,7168,False,torch.bfloat16,torch.bfloat16,False,False,asm,8,5,16.6876,_ZN5aiter39bf16gemm_fp32bf16_tn_96x64_splitk_cleanE,0.0161,239.28,940.57
gfx950,256,576,512,7168,False,torch.bfloat16,torch.bfloat16,False,False,asm,8,5,17.3033,_ZN5aiter39bf16gemm_fp32bf16_tn_96x64_splitk_cleanE,0.0164,244.34,935.51
gfx950,256,608,512,7168,False,torch.bfloat16,torch.bfloat16,False,False,asm,7,4,17.7661,_ZN5aiter39bf16gemm_fp32bf16_tn_80x64_splitk_cleanE,0.0135,251.19,938.81
gfx950,256,640,512,7168,False,torch.bfloat16,torch.bfloat16,False,False,asm,7,4,18.0717,_ZN5aiter39bf16gemm_fp32bf16_tn_80x64_splitk_cleanE,0.0135,259.94,950.13
gfx950,256,672,512,7168,False,torch.bfloat16,torch.bfloat16,False,False,asm,8,4,18.596,_ZN5aiter39bf16gemm_fp32bf16_tn_96x64_splitk_cleanE,0.0133,265.25,949.77
gfx950,256,704,512,7168,False,torch.bfloat16,torch.bfloat16,False,False,asm,8,4,19.0025,_ZN5aiter39bf16gemm_fp32bf16_tn_96x64_splitk_cleanE,0.0135,271.93,955.32
gfx950,256,736,512,7168,False,torch.bfloat16,torch.bfloat16,False,False,asm,8,4,19.3904,_ZN5aiter39bf16gemm_fp32bf16_tn_96x64_splitk_cleanE,0.0135,278.61,961.56
gfx950,256,768,512,7168,False,torch.bfloat16,torch.bfloat16,False,False,asm,8,4,19.7528,_ZN5aiter39bf16gemm_fp32bf16_tn_96x64_splitk_cleanE,0.0135,285.38,968.8
gfx950,256,800,512,7168,False,torch.bfloat16,torch.bfloat16,False,False,asm,7,3,20.2908,_ZN5aiter39bf16gemm_fp32bf16_tn_80x64_splitk_cleanE,0.0104,289.39,967.34
gfx950,256,832,512,7168,False,torch.bfloat16,torch.bfloat16,False,False,asm,8,3,21.7223,_ZN5aiter39bf16gemm_fp32bf16_tn_96x64_splitk_cleanE,0.0103,281.14,926.22
gfx950,256,864,512,7168,False,torch.bfloat16,torch.bfloat16,False,False,asm,8,3,21.5825,_ZN5aiter39bf16gemm_fp32bf16_tn_96x64_splitk_cleanE,0.0103,293.84,954.99
gfx950,256,896,512,7168,False,torch.bfloat16,torch.bfloat16,False,False,torch,0,0,21.7453,native,0.0,302.44,970.44
gfx950,256,928,512,7168,False,torch.bfloat16,torch.bfloat16,False,False,torch,0,0,21.2379,native,0.0,320.73,1016.77
gfx950,256,960,512,7168,False,torch.bfloat16,torch.bfloat16,False,False,torch,0,0,21.4742,native,0.0,328.13,1028.47
gfx950,256,992,512,7168,False,torch.bfloat16,torch.bfloat16,False,False,opus,200,2,24.7054,opus_gemm_flatmm_splitk_256x64x64x64_2x1_16x16x32_0x0x0_wgpcu2,0.0,294.73,913.85
gfx950,256,1024,512,7168,False,torch.bfloat16,torch.bfloat16,False,False,opus,1208,2,24.7265,opus_gemm_flatmm_splitk_256x64x64x128_2x1_16x16x32_0x0x0_wgpcu1_nooob,0.0,303.97,932.95
gfx950,256,1088,512,7168,False,torch.bfloat16,torch.bfloat16,False,False,opus,1200,2,26.0717,opus_gemm_flatmm_splitk_256x64x64x64_2x1_16x16x32_0x0x0_wgpcu2_nooob,0.0,306.31,922.52
gfx950,256,1152,512,7168,False,torch.bfloat16,torch.bfloat16,False,False,torch,0,0,26.7083,native,0.0,316.6,937.34
gfx950,256,1216,512,7168,False,torch.bfloat16,torch.bfloat16,False,False,torch,0,0,25.964,native,0.0,343.76,1002.07
gfx950,256,1280,512,7168,False,torch.bfloat16,torch.bfloat16,False,False,torch,0,0,25.9095,native,0.0,362.62,1042.12
gfx950,256,1344,512,7168,False,torch.bfloat16,torch.bfloat16,False,False,opus,1221,4,28.0523,opus_gemm_flatmm_splitk_256x96x64x64_2x1_16x16x32_0x0x0_wgpcu2_nooob,0.0,351.66,997.56
gfx950,256,1408,512,7168,False,torch.bfloat16,torch.bfloat16,False,False,torch,0,0,27.1365,native,0.0,380.84,1067.45
gfx950,256,1472,512,7168,False,torch.bfloat16,torch.bfloat16,False,False,torch,0,0,27.4256,native,0.0,393.96,1092.04
gfx950,256,1536,512,7168,False,torch.bfloat16,torch.bfloat16,False,False,torch,0,0,28.7155,native,0.0,392.62,1077.22
gfx950,256,1600,512,7168,False,torch.bfloat16,torch.bfloat16,False,False,flydsl,3866,1,32.9541,flydsl_gemm3_abf16_wbf16_bf16_t64x64x128_split_k1_block_m_warp2_block_n_warp2_block_k_warp2_async_copyTrue_b_to_ldsTrue_b_preshuffleFalse_c_to_ldsFalse_gfx950,0.0062,356.38,968.5
gfx950,256,1664,512,7168,False,torch.bfloat16,torch.bfloat16,False,False,torch,0,0,30.0061,native,0.0,407.04,1096.41
gfx950,256,1728,512,7168,False,torch.bfloat16,torch.bfloat16,False,False,torch,0,0,30.5405,native,0.0,415.3,1109.42
gfx950,256,1792,512,7168,False,torch.bfloat16,torch.bfloat16,False,False,torch,0,0,29.9245,native,0.0,439.55,1165.1
gfx950,256,1856,512,7168,False,torch.bfloat16,torch.bfloat16,False,False,torch,0,0,31.8762,native,0.0,427.38,1124.61
gfx950,256,1920,512,7168,False,torch.bfloat16,torch.bfloat16,False,False,torch,0,0,31.9929,native,0.0,440.5,1151.23
gfx950,256,1984,512,7168,False,torch.bfloat16,torch.bfloat16,False,False,torch,0,0,32.2367,native,0.0,451.74,1173.02
gfx950,256,2048,512,7168,False,torch.bfloat16,torch.bfloat16,False,False,torch,0,0,29.9664,native,0.0,501.64,1294.69
gfx950,256,4096,512,7168,False,torch.bfloat16,torch.bfloat16,False,False,torch,0,0,51.5776,native,0.0,582.9,1362.11
gfx950,256,6144,512,7168,False,torch.bfloat16,torch.bfloat16,False,False,flydsl,5376,1,67.5094,flydsl_gemm4_abf16_wbf16_bf16_t96x128x64_split_k1_block_m_warp1_block_n_warp4_block_k_warp1_async_copyTrue_b_to_ldsTrue_b_preshuffleFalse_c_to_ldsFalse_gfx950,0.0,668.01,1506.63
gfx950,256,8192,512,7168,False,torch.bfloat16,torch.bfloat16,False,False,flydsl,4309,1,80.1688,flydsl_gemm4_abf16_wbf16_bf16_t128x128x64_split_k1_block_m_warp4_block_n_warp2_block_k_warp1_async_copyTrue_b_to_ldsTrue_b_preshuffleFalse_c_to_ldsFalse_gfx950,0.0,750.04,1661.11
gfx950,256,10240,512,7168,False,torch.bfloat16,torch.bfloat16,False,False,torch,0,0,92.0272,native,0.0,816.74,1788.89
gfx950,256,12288,512,7168,False,torch.bfloat16,torch.bfloat16,False,False,flydsl,2647,1,107.1619,flydsl_gemm3_abf16_wbf16_bf16_t128x256x64_split_k1_block_m_warp2_block_n_warp4_block_k_warp2_async_copyTrue_b_to_ldsTrue_b_preshuffleFalse_c_to_ldsFalse_gfx950,0.0061,841.66,1829.79
gfx950,256,14336,512,7168,False,torch.bfloat16,torch.bfloat16,False,False,flydsl,2647,1,112.7228,flydsl_gemm3_abf16_wbf16_bf16_t128x256x64_split_k1_block_m_warp2_block_n_warp4_block_k_warp2_async_copyTrue_b_to_ldsTrue_b_preshuffleFalse_c_to_ldsFalse_gfx950,0.006,933.5,2018.59
gfx950,256,16384,512,7168,False,torch.bfloat16,torch.bfloat16,False,False,opus,1401,0,110.8881,opus_gemm_mono_tile_512x128x256x64_2x4_16x16x32_0x0x0_nooob,0.0,1084.51,2335.67
gfx950,256,32768,512,7168,False,torch.bfloat16,torch.bfloat16,False,False,torch,0,0,175.3448,native,0.0,1371.69,2912.3
gfx950,256,1,1024,7168,False,torch.bfloat16,torch.bfloat16,False,False,flydsl,5260,8,6.6039,flydsl_gemm8_abf16_wbf16_bf16_t16x64x64_split_k8_block_m_warp1_block_n_warp2_block_k_warp1_async_copyTrue_b_to_ldsTrue_b_preshuffleFalse_c_to_ldsFalse_gfx950,0.0254,2.22,2225.42
gfx950,256,2,1024,7168,False,torch.bfloat16,torch.bfloat16,False,False,flydsl,3880,8,6.6637,flydsl_gemm5_abf16_wbf16_bf16_t16x64x128_split_k8_block_m_warp1_block_n_warp2_block_k_warp1_async_copyTrue_b_to_ldsTrue_b_preshuffleFalse_c_to_ldsFalse_gfx950,0.0171,4.41,2207.91
gfx950,256,4,1024,7168,False,torch.bfloat16,torch.bfloat16,False,False,flydsl,5260,8,6.6574,flydsl_gemm8_abf16_wbf16_bf16_t16x64x64_split_k8_block_m_warp1_block_n_warp2_block_k_warp1_async_copyTrue_b_to_ldsTrue_b_preshuffleFalse_c_to_ldsFalse_gfx950,0.0247,8.82,2214.92
gfx950,256,8,1024,7168,False,torch.bfloat16,torch.bfloat16,False,False,flydsl,5260,8,6.7832,flydsl_gemm8_abf16_wbf16_bf16_t16x64x64_split_k8_block_m_warp1_block_n_warp2_block_k_warp1_async_copyTrue_b_to_ldsTrue_b_preshuffleFalse_c_to_ldsFalse_gfx950,0.0198,17.31,2183.5
gfx950,256,32,1024,7168,False,torch.bfloat16,torch.bfloat16,False,False,flydsl,2993,8,8.0729,flydsl_gemm4_abf16_wbf16_bf16_t16x64x128_split_k8_block_m_warp1_block_n_warp2_block_k_warp1_async_copyTrue_b_to_ldsTrue_b_preshuffleFalse_c_to_ldsFalse_gfx950,0.0215,58.19,1883.38
gfx950,256,48,1024,7168,False,torch.bfloat16,torch.bfloat16,False,False,flydsl,3973,7,8.708,flydsl_gemm5_abf16_wbf16_bf16_t32x64x128_split_k7_block_m_warp1_block_n_warp4_block_k_warp1_async_copyTrue_b_to_ldsTrue_b_preshuffleFalse_c_to_ldsFalse_gfx950,0.0193,80.92,1776.12
gfx950,256,64,1024,7168,False,torch.bfloat16,torch.bfloat16,False,False,flydsl,4331,7,9.5498,flydsl_gemm4_abf16_wbf16_bf16_t32x64x128_split_k7_block_m_warp2_block_n_warp2_block_k_warp1_async_copyTrue_b_to_ldsTrue_b_preshuffleFalse_c_to_ldsFalse_gfx950,0.0199,98.38,1647.01
gfx950,256,72,1024,7168,False,torch.bfloat16,torch.bfloat16,False,False,flydsl,4319,4,10.0605,flydsl_gemm4_abf16_wbf16_bf16_t32x64x128_split_k4_block_m_warp1_block_n_warp4_block_k_warp1_async_copyTrue_b_to_ldsTrue_b_preshuffleFalse_c_to_ldsFalse_gfx950,0.0142,105.06,1576.43
gfx950,256,80,1024,7168,False,torch.bfloat16,torch.bfloat16,False,False,flydsl,4319,4,10.3519,flydsl_gemm4_abf16_wbf16_bf16_t32x64x128_split_k4_block_m_warp1_block_n_warp4_block_k_warp1_async_copyTrue_b_to_ldsTrue_b_preshuffleFalse_c_to_ldsFalse_gfx950,0.014,113.45,1544.72
gfx950,256,88,1024,7168,False,torch.bfloat16,torch.bfloat16,False,False,flydsl,4322,4,10.7844,flydsl_gemm4_abf16_wbf16_bf16_t32x64x128_split_k4_block_m_warp2_block_n_warp2_block_k_warp1_async_copyTrue_b_to_ldsTrue_b_preshuffleFalse_c_to_ldsFalse_gfx950,0.0138,119.79,1494.92
gfx950,256,104,1024,7168,False,torch.bfloat16,torch.bfloat16,False,False,flydsl,4318,4,10.9568,flydsl_gemm4_abf16_wbf16_bf16_t32x64x128_split_k4_block_m_warp1_block_n_warp2_block_k_warp2_async_copyTrue_b_to_ldsTrue_b_preshuffleFalse_c_to_ldsFalse_gfx950,0.0215,139.34,1495.33
gfx950,256,112,1024,7168,False,torch.bfloat16,torch.bfloat16,False,False,flydsl,4319,4,11.3875,flydsl_gemm4_abf16_wbf16_bf16_t32x64x128_split_k4_block_m_warp1_block_n_warp4_block_k_warp1_async_copyTrue_b_to_ldsTrue_b_preshuffleFalse_c_to_ldsFalse_gfx950,0.0135,144.38,1450.28
gfx950,256,128,1024,7168,False,torch.bfloat16,torch.bfloat16,False,False,flydsl,4859,4,12.093,flydsl_gemm4_abf16_wbf16_bf16_t32x64x128_split_k4_block_m_warp1_block_n_warp4_block_k_warp1_async_copyTrue_b_to_ldsTrue_b_preshuffleFalse_c_to_ldsFalse_gfx950,0.0143,155.38,1387.35
gfx950,256,136,1024,7168,False,torch.bfloat16,torch.bfloat16,False,False,flydsl,5199,4,13.0145,flydsl_gemm4_abf16_wbf16_bf16_t64x64x128_split_k4_block_m_warp2_block_n_warp1_block_k_warp2_async_copyTrue_b_to_ldsTrue_b_preshuffleFalse_c_to_ldsFalse_gfx950,0.0219,153.4,1299.19
gfx950,256,152,1024,7168,False,torch.bfloat16,torch.bfloat16,False,False,flydsl,3899,4,13.2001,flydsl_gemm3_abf16_wbf16_bf16_t64x64x128_split_k4_block_m_warp2_block_n_warp2_block_k_warp1_async_copyTrue_b_to_ldsTrue_b_preshuffleFalse_c_to_ldsFalse_gfx950,0.0142,169.04,1300.78
gfx950,256,160,1024,7168,False,torch.bfloat16,torch.bfloat16,False,False,flydsl,5201,4,13.0061,flydsl_gemm4_abf16_wbf16_bf16_t64x64x128_split_k4_block_m_warp2_block_n_warp2_block_k_warp1_async_copyTrue_b_to_ldsTrue_b_preshuffleFalse_c_to_ldsFalse_gfx950,0.0139,180.59,1330.26
gfx950,256,168,1024,7168,False,torch.bfloat16,torch.bfloat16,False,False,flydsl,7299,4,13.2493,flydsl_gemm8_abf16_wbf16_bf16_t48x64x64_split_k4_block_m_warp1_block_n_warp2_block_k_warp1_async_copyTrue_b_to_ldsTrue_b_preshuffleFalse_c_to_ldsFalse_gfx950,0.0144,186.14,1315.74
gfx950,256,176,1024,7168,False,torch.bfloat16,torch.bfloat16,False,False,flydsl,5203,4,13.8817,flydsl_gemm4_abf16_wbf16_bf16_t64x64x128_split_k4_block_m_warp2_block_n_warp4_block_k_warp1_async_copyTrue_b_to_ldsTrue_b_preshuffleFalse_c_to_ldsFalse_gfx950,0.0143,186.12,1265.24
gfx950,256,184,1024,7168,False,torch.bfloat16,torch.bfloat16,False,False,flydsl,3376,4,13.7773,flydsl_gemm3_abf16_wbf16_bf16_t32x64x128_split_k4_block_m_warp1_block_n_warp4_block_k_warp1_async_copyTrue_b_to_ldsTrue_b_preshuffleFalse_c_to_ldsFalse_gfx950,0.0145,196.06,1284.34
gfx950,256,224,1024,7168,False,torch.bfloat16,torch.bfloat16,False,False,flydsl,6057,4,15.4442,flydsl_gemm5_abf16_wbf16_bf16_t64x64x128_split_k4_block_m_warp1_block_n_warp4_block_k_warp2_async_copyTrue_b_to_ldsTrue_b_preshuffleFalse_c_to_ldsFalse_gfx950,0.0218,212.92,1188.15
gfx950,256,232,1024,7168,False,torch.bfloat16,torch.bfloat16,False,False,flydsl,4849,2,15.2406,flydsl_gemm4_abf16_wbf16_bf16_t32x64x128_split_k2_block_m_warp1_block_n_warp2_block_k_warp2_async_copyTrue_b_to_ldsTrue_b_preshuffleFalse_c_to_ldsFalse_gfx950,0.0138,223.47,1212.63
gfx950,256,240,1024,7168,False,torch.bfloat16,torch.bfloat16,False,False,flydsl,4850,2,15.562,flydsl_gemm4_abf16_wbf16_bf16_t32x64x128_split_k2_block_m_warp1_block_n_warp4_block_k_warp1_async_copyTrue_b_to_ldsTrue_b_preshuffleFalse_c_to_ldsFalse_gfx950,0.0059,226.4,1196.0
gfx950,256,264,1024,7168,False,torch.bfloat16,torch.bfloat16,False,False,asm,8,5,16.4273,_ZN5aiter39bf16gemm_fp32bf16_tn_96x64_splitk_cleanE,0.0162,235.92,1156.94
gfx950,256,272,1024,7168,False,torch.bfloat16,torch.bfloat16,False,False,asm,8,5,16.4801,_ZN5aiter39bf16gemm_fp32bf16_tn_96x64_splitk_cleanE,0.0163,242.29,1161.19
gfx950,256,352,1024,7168,False,torch.bfloat16,torch.bfloat16,False,False,asm,8,4,18.2424,_ZN5aiter39bf16gemm_fp32bf16_tn_96x64_splitk_cleanE,0.0137,283.26,1120.86
gfx950,256,376,1024,7168,False,torch.bfloat16,torch.bfloat16,False,False,asm,8,4,18.7006,_ZN5aiter39bf16gemm_fp32bf16_tn_96x64_splitk_cleanE,0.0138,295.16,1114.43
gfx950,256,416,1024,7168,False,torch.bfloat16,torch.bfloat16,False,False,torch,0,0,20.9479,native,0.0,291.53,1026.16
gfx950,256,448,1024,7168,False,torch.bfloat16,torch.bfloat16,False,False,asm,8,3,21.4441,_ZN5aiter39bf16gemm_fp32bf16_tn_96x64_splitk_cleanE,0.0107,306.69,1026.86
gfx950,256,480,1024,7168,False,torch.bfloat16,torch.bfloat16,False,False,asm,8,3,21.6426,_ZN5aiter39bf16gemm_fp32bf16_tn_96x64_splitk_cleanE,0.0107,325.58,1041.67
gfx950,256,512,1024,7168,False,torch.bfloat16,torch.bfloat16,False,False,torch,0,0,19.268,native,0.0,390.09,1197.25
gfx950,256,544,1024,7168,False,torch.bfloat16,torch.bfloat16,False,False,asm,7,2,26.831,_ZN5aiter39bf16gemm_fp32bf16_tn_80x64_splitk_cleanE,0.0061,297.64,879.32
gfx950,256,576,1024,7168,False,torch.bfloat16,torch.bfloat16,False,False,torch,0,0,21.1005,native,0.0,400.74,1142.97
gfx950,256,608,1024,7168,False,torch.bfloat16,torch.bfloat16,False,False,torch,0,0,26.6675,native,0.0,334.69,924.03
gfx950,256,640,1024,7168,False,torch.bfloat16,torch.bfloat16,False,False,torch,0,0,26.8357,native,0.0,350.1,937.77
gfx950,256,672,1024,7168,False,torch.bfloat16,torch.bfloat16,False,False,opus,1221,4,28.4151,opus_gemm_flatmm_splitk_256x96x64x64_2x1_16x16x32_0x0x0_wgpcu2_nooob,0.0,347.17,904.1
gfx950,256,704,1024,7168,False,torch.bfloat16,torch.bfloat16,False,False,torch,0,0,27.5298,native,0.0,375.4,952.22
gfx950,256,736,1024,7168,False,torch.bfloat16,torch.bfloat16,False,False,torch,0,0,27.8659,native,0.0,387.73,959.55
gfx950,256,768,1024,7168,False,torch.bfloat16,torch.bfloat16,False,False,torch,0,0,28.5208,native,0.0,395.3,955.9
gfx950,256,800,1024,7168,False,torch.bfloat16,torch.bfloat16,False,False,flydsl,6031,1,30.9258,flydsl_gemm5_abf16_wbf16_bf16_t64x64x128_split_k1_block_m_warp4_block_n_warp1_block_k_warp2_async_copyTrue_b_to_ldsTrue_b_preshuffleFalse_c_to_ldsFalse_gfx950,0.006,379.75,898.51
gfx950,256,832,1024,7168,False,torch.bfloat16,torch.bfloat16,False,False,torch,0,0,29.921,native,0.0,408.2,946.21
gfx950,256,864,1024,7168,False,torch.bfloat16,torch.bfloat16,False,False,torch,0,0,30.642,native,0.0,413.93,941.06
gfx950,256,896,1024,7168,False,torch.bfloat16,torch.bfloat16,False,False,torch,0,0,30.3297,native,0.0,433.68,968.03
gfx950,256,928,1024,7168,False,torch.bfloat16,torch.bfloat16,False,False,flydsl,3866,1,31.292,flydsl_gemm3_abf16_wbf16_bf16_t64x64x128_split_k1_block_m_warp2_block_n_warp2_block_k_warp2_async_copyTrue_b_to_ldsTrue_b_preshuffleFalse_c_to_ldsFalse_gfx950,0.006,435.35,955.02
gfx950,256,960,1024,7168,False,torch.bfloat16,torch.bfloat16,False,False,flydsl,3866,1,31.6494,flydsl_gemm3_abf16_wbf16_bf16_t64x64x128_split_k1_block_m_warp2_block_n_warp2_block_k_warp2_async_copyTrue_b_to_ldsTrue_b_preshuffleFalse_c_to_ldsFalse_gfx950,0.0061,445.28,960.8
gfx950,256,992,1024,7168,False,torch.bfloat16,torch.bfloat16,False,False,flydsl,3866,1,31.6368,flydsl_gemm3_abf16_wbf16_bf16_t64x64x128_split_k1_block_m_warp2_block_n_warp2_block_k_warp2_async_copyTrue_b_to_ldsTrue_b_preshuffleFalse_c_to_ldsFalse_gfx950,0.0061,460.31,977.75
gfx950,256,1024,1024,7168,False,torch.bfloat16,torch.bfloat16,False,False,torch,0,0,28.1669,native,0.0,533.69,1116.82
gfx950,256,1088,1024,7168,False,torch.bfloat16,torch.bfloat16,False,False,torch,0,0,34.5866,native,0.0,461.79,939.84
gfx950,256,1152,1024,7168,False,torch.bfloat16,torch.bfloat16,False,False,torch,0,0,34.7148,native,0.0,487.15,966.57
gfx950,256,1216,1024,7168,False,torch.bfloat16,torch.bfloat16,False,False,torch,0,0,36.1446,native,0.0,493.88,957.35
gfx950,256,1280,1024,7168,False,torch.bfloat16,torch.bfloat16,False,False,torch,0,0,35.8657,native,0.0,523.91,994.03
gfx950,256,1344,1024,7168,False,torch.bfloat16,torch.bfloat16,False,False,torch,0,0,38.9633,native,0.0,506.37,941.92
gfx950,256,1408,1024,7168,False,torch.bfloat16,torch.bfloat16,False,False,torch,0,0,40.0609,native,0.0,515.95,942.28
gfx950,256,1472,1024,7168,False,torch.bfloat16,torch.bfloat16,False,False,torch,0,0,39.5428,native,0.0,546.47,981.15
gfx950,256,1536,1024,7168,False,torch.bfloat16,torch.bfloat16,False,False,torch,0,0,36.906,native,0.0,610.97,1079.66
gfx950,256,1600,1024,7168,False,torch.bfloat16,torch.bfloat16,False,False,torch,0,0,43.3333,native,0.0,542.03,943.72
gfx950,256,1664,1024,7168,False,torch.bfloat16,torch.bfloat16,False,False,flydsl,2742,1,46.6312,flydsl_gemm3_abf16_wbf16_bf16_t128x64x128_split_k1_block_m_warp4_block_n_warp2_block_k_warp2_async_copyTrue_b_to_ldsTrue_b_preshuffleFalse_c_to_ldsFalse_gfx950,0.0061,523.85,899.46
gfx950,256,1728,1024,7168,False,torch.bfloat16,torch.bfloat16,False,False,torch,0,0,44.2477,native,0.0,573.3,971.61
gfx950,256,1792,1024,7168,False,torch.bfloat16,torch.bfloat16,False,False,torch,0,0,46.3957,native,0.0,567.01,949.23
gfx950,256,1856,1024,7168,False,torch.bfloat16,torch.bfloat16,False,False,flydsl,2737,1,48.4636,flydsl_gemm3_abf16_wbf16_bf16_t128x64x128_split_k1_block_m_warp2_block_n_warp4_block_k_warp2_async_copyTrue_b_to_ldsTrue_b_preshuffleFalse_c_to_ldsFalse_gfx950,0.006,562.2,930.36
gfx950,256,1920,1024,7168,False,torch.bfloat16,torch.bfloat16,False,False,torch,0,0,46.4962,native,0.0,606.19,992.28
gfx950,256,1984,1024,7168,False,torch.bfloat16,torch.bfloat16,False,False,flydsl,2737,1,49.5636,flydsl_gemm3_abf16_wbf16_bf16_t128x64x128_split_k1_block_m_warp2_block_n_warp4_block_k_warp2_async_copyTrue_b_to_ldsTrue_b_preshuffleFalse_c_to_ldsFalse_gfx950,0.006,587.63,952.03
gfx950,256,2048,1024,7168,False,torch.bfloat16,torch.bfloat16,False,False,torch,0,0,43.7099,native,0.0,687.83,1103.51
gfx950,256,4096,1024,7168,False,torch.bfloat16,torch.bfloat16,False,False,torch,0,0,69.5626,native,0.0,864.39,1175.76
gfx950,256,6144,1024,7168,False,torch.bfloat16,torch.bfloat16,False,False,torch,0,0,103.6631,native,0.0,870.07,1112.68
gfx950,256,8192,1024,7168,False,torch.bfloat16,torch.bfloat16,False,False,opus,1401,0,106.3943,opus_gemm_mono_tile_512x128x256x64_2x4_16x16x32_0x0x0_nooob,0.0,1130.32,1399.49
gfx950,256,10240,1024,7168,False,torch.bfloat16,torch.bfloat16,False,False,torch,0,0,127.5259,native,0.0,1178.77,1430.71
gfx950,256,12288,1024,7168,False,torch.bfloat16,torch.bfloat16,False,False,opus,1400,0,137.8139,opus_gemm_mono_tile_512x192x256x64_2x4_16x16x32_0x0x0_nooob,0.0,1308.93,1567.38
gfx950,256,14336,1024,7168,False,torch.bfloat16,torch.bfloat16,False,False,torch,0,0,165.0953,native,0.0,1274.74,1511.62
gfx950,256,16384,1024,7168,False,torch.bfloat16,torch.bfloat16,False,False,torch,0,0,171.4178,native,0.0,1403.11,1651.61
gfx950,256,32768,1024,7168,False,torch.bfloat16,torch.bfloat16,False,False,torch,0,0,327.2819,native,0.0,1469.79,1685.25
gfx950,256,1,2048,7168,False,torch.bfloat16,torch.bfloat16,False,False,flydsl,3892,7,8.0321,flydsl_gemm5_abf16_wbf16_bf16_t16x64x64_split_k7_block_m_warp1_block_n_warp2_block_k_warp1_async_copyTrue_b_to_ldsTrue_b_preshuffleFalse_c_to_ldsFalse_gfx950,0.0127,3.66,3657.64
gfx950,256,2,2048,7168,False,torch.bfloat16,torch.bfloat16,False,False,flydsl,1792,7,8.1807,flydsl_gemm3_abf16_wbf16_bf16_t16x64x128_split_k7_block_m_warp1_block_n_warp2_block_k_warp1_async_copyTrue_b_to_ldsTrue_b_preshuffleFalse_c_to_ldsFalse_gfx950,0.0173,7.18,3593.46
gfx950,256,4,2048,7168,False,torch.bfloat16,torch.bfloat16,False,False,flydsl,4947,7,8.2993,flydsl_gemm7_abf16_wbf16_bf16_t16x64x64_split_k7_block_m_warp1_block_n_warp2_block_k_warp1_async_copyTrue_b_to_ldsTrue_b_preshuffleFalse_c_to_ldsFalse_gfx950,0.0178,14.15,3546.55
gfx950,256,8,2048,7168,False,torch.bfloat16,torch.bfloat16,False,False,flydsl,3892,7,8.5192,flydsl_gemm5_abf16_wbf16_bf16_t16x64x64_split_k7_block_m_warp1_block_n_warp2_block_k_warp1_async_copyTrue_b_to_ldsTrue_b_preshuffleFalse_c_to_ldsFalse_gfx950,0.019,27.57,3463.66
gfx950,256,16,2048,7168,False,torch.bfloat16,torch.bfloat16,False,False,flydsl,3892,7,8.9187,flydsl_gemm5_abf16_wbf16_bf16_t16x64x64_split_k7_block_m_warp1_block_n_warp2_block_k_warp1_async_copyTrue_b_to_ldsTrue_b_preshuffleFalse_c_to_ldsFalse_gfx950,0.0205,52.67,3325.04
gfx950,256,32,2048,7168,False,torch.bfloat16,torch.bfloat16,False,False,flydsl,4618,7,10.3766,flydsl_gemm6_abf16_wbf16_bf16_t32x64x64_split_k7_block_m_warp1_block_n_warp4_block_k_warp1_async_copyTrue_b_to_ldsTrue_b_preshuffleFalse_c_to_ldsFalse_gfx950,0.0202,90.54,2886.3
gfx950,256,48,2048,7168,False,torch.bfloat16,torch.bfloat16,False,False,flydsl,3203,4,11.6173,flydsl_gemm4_abf16_wbf16_bf16_t32x64x128_split_k4_block_m_warp1_block_n_warp2_block_k_warp2_async_copyTrue_b_to_ldsTrue_b_preshuffleFalse_c_to_ldsFalse_gfx950,0.0216,121.31,2603.43
gfx950,256,64,2048,7168,False,torch.bfloat16,torch.bfloat16,False,False,flydsl,4319,4,12.868,flydsl_gemm4_abf16_wbf16_bf16_t32x64x128_split_k4_block_m_warp1_block_n_warp4_block_k_warp1_async_copyTrue_b_to_ldsTrue_b_preshuffleFalse_c_to_ldsFalse_gfx950,0.0138,146.02,2373.31
gfx950,256,80,2048,7168,False,torch.bfloat16,torch.bfloat16,False,False,flydsl,6806,4,13.3774,flydsl_gemm8_abf16_wbf16_bf16_t64x64x64_split_k4_block_m_warp1_block_n_warp4_block_k_warp1_async_copyTrue_b_to_ldsTrue_b_preshuffleFalse_c_to_ldsFalse_gfx950,0.0142,175.58,2304.98
gfx950,256,96,2048,7168,False,torch.bfloat16,torch.bfloat16,False,False,flydsl,4659,4,14.3113,flydsl_gemm4_abf16_wbf16_bf16_t64x64x128_split_k4_block_m_warp2_block_n_warp1_block_k_warp2_async_copyTrue_b_to_ldsTrue_b_preshuffleFalse_c_to_ldsFalse_gfx950,0.0216,196.95,2175.18
gfx950,256,112,2048,7168,False,torch.bfloat16,torch.bfloat16,False,False,flydsl,4310,2,15.4236,flydsl_gemm4_abf16_wbf16_bf16_t32x64x128_split_k2_block_m_warp1_block_n_warp4_block_k_warp1_async_copyTrue_b_to_ldsTrue_b_preshuffleFalse_c_to_ldsFalse_gfx950,0.0058,213.2,2037.43
gfx950,256,128,2048,7168,False,torch.bfloat16,torch.bfloat16,False,False,asm,5,4,17.1162,_ZN5aiter39bf16gemm_fp32bf16_tn_64x64_splitk_cleanE,0.0139,219.56,1853.18
gfx950,256,144,2048,7168,False,torch.bfloat16,torch.bfloat16,False,False,asm,7,4,17.7038,_ZN5aiter39bf16gemm_fp32bf16_tn_80x64_splitk_cleanE,0.0141,238.81,1808.33
gfx950,256,160,2048,7168,False,torch.bfloat16,torch.bfloat16,False,False,asm,7,4,17.9192,_ZN5aiter39bf16gemm_fp32bf16_tn_80x64_splitk_cleanE,0.0142,262.16,1803.05
gfx950,256,176,2048,7168,False,torch.bfloat16,torch.bfloat16,False,False,asm,8,4,18.8339,_ZN5aiter39bf16gemm_fp32bf16_tn_96x64_splitk_cleanE,0.014,274.37,1731.14
gfx950,256,192,2048,7168,False,torch.bfloat16,torch.bfloat16,False,False,asm,8,4,19.0188,_ZN5aiter39bf16gemm_fp32bf16_tn_96x64_splitk_cleanE,0.014,296.4,1729.82
gfx950,256,208,2048,7168,False,torch.bfloat16,torch.bfloat16,False,False,flydsl,3878,2,22.0336,flydsl_gemm3_abf16_wbf16_bf16_t64x64x128_split_k2_block_m_warp1_block_n_warp4_block_k_warp2_async_copyTrue_b_to_ldsTrue_b_preshuffleFalse_c_to_ldsFalse_gfx950,0.0141,277.16,1506.52
gfx950,256,224,2048,7168,False,torch.bfloat16,torch.bfloat16,False,False,flydsl,6040,2,22.2215,flydsl_gemm5_abf16_wbf16_bf16_t64x64x128_split_k2_block_m_warp1_block_n_warp4_block_k_warp2_async_copyTrue_b_to_ldsTrue_b_preshuffleFalse_c_to_ldsFalse_gfx950,0.0141,295.96,1507.05
gfx950,256,240,2048,7168,False,torch.bfloat16,torch.bfloat16,False,False,flydsl,4838,1,23.4538,flydsl_gemm4_abf16_wbf16_bf16_t32x64x128_split_k1_block_m_warp1_block_n_warp1_block_k_warp4_async_copyTrue_b_to_ldsTrue_b_preshuffleFalse_c_to_ldsFalse_gfx950,0.0138,300.44,1440.44
gfx950,256,256,2048,7168,False,torch.bfloat16,torch.bfloat16,False,False,torch,0,0,21.3173,native,0.0,352.59,1598.64
gfx950,256,288,2048,7168,False,torch.bfloat16,torch.bfloat16,False,False,asm,7,2,26.7437,_ZN5aiter39bf16gemm_fp32bf16_tn_80x64_splitk_cleanE,0.0061,316.18,1296.33
gfx950,256,320,2048,7168,False,torch.bfloat16,torch.bfloat16,False,False,torch,0,0,25.9992,native,0.0,361.37,1356.13
gfx950,256,352,2048,7168,False,torch.bfloat16,torch.bfloat16,False,False,torch,0,0,27.5807,native,0.0,374.71,1299.76
gfx950,256,384,2048,7168,False,torch.bfloat16,torch.bfloat16,False,False,torch,0,0,28.0173,native,0.0,402.4,1300.55
gfx950,256,416,2048,7168,False,torch.bfloat16,torch.bfloat16,False,False,flydsl,3866,1,29.8441,flydsl_gemm3_abf16_wbf16_bf16_t64x64x128_split_k1_block_m_warp2_block_n_warp2_block_k_warp2_async_copyTrue_b_to_ldsTrue_b_preshuffleFalse_c_to_ldsFalse_gfx950,0.0058,409.25,1240.71
gfx950,256,448,2048,7168,False,torch.bfloat16,torch.bfloat16,False,False,torch,0,0,30.5558,native,0.0,430.47,1231.11
gfx950,256,480,2048,7168,False,torch.bfloat16,torch.bfloat16,False,False,flydsl,3866,1,30.7825,flydsl_gemm3_abf16_wbf16_bf16_t64x64x128_split_k1_block_m_warp2_block_n_warp2_block_k_warp2_async_copyTrue_b_to_ldsTrue_b_preshuffleFalse_c_to_ldsFalse_gfx950,0.0058,457.82,1241.21
gfx950,256,512,2048,7168,False,torch.bfloat16,torch.bfloat16,False,False,torch,0,0,28.8314,native,0.0,521.39,1345.66
gfx950,256,544,2048,7168,False,torch.bfloat16,torch.bfloat16,False,False,torch,0,0,35.4463,native,0.0,450.59,1111.18
gfx950,256,576,2048,7168,False,torch.bfloat16,torch.bfloat16,False,False,torch,0,0,29.8177,native,0.0,567.16,1340.71
gfx950,256,608,2048,7168,False,torch.bfloat16,torch.bfloat16,False,False,torch,0,0,36.0915,native,0.0,494.6,1124.0
gfx950,256,640,2048,7168,False,torch.bfloat16,torch.bfloat16,False,False,torch,0,0,36.6466,native,0.0,512.75,1123.07
gfx950,256,672,2048,7168,False,torch.bfloat16,torch.bfloat16,False,False,flydsl,5420,1,39.7793,flydsl_gemm4_abf16_wbf16_bf16_t96x64x128_split_k1_block_m_warp1_block_n_warp2_block_k_warp2_async_copyTrue_b_to_ldsTrue_b_preshuffleFalse_c_to_ldsFalse_gfx950,0.006,495.99,1049.45
gfx950,256,704,2048,7168,False,torch.bfloat16,torch.bfloat16,False,False,torch,0,0,39.4673,native,0.0,523.71,1072.69
gfx950,256,736,2048,7168,False,torch.bfloat16,torch.bfloat16,False,False,torch,0,0,40.5077,native,0.0,533.46,1059.7
gfx950,256,768,2048,7168,False,torch.bfloat16,torch.bfloat16,False,False,torch,0,0,40.4881,native,0.0,556.92,1074.78
gfx950,256,800,2048,7168,False,torch.bfloat16,torch.bfloat16,False,False,torch,0,0,42.8657,native,0.0,547.95,1028.93
gfx950,256,832,2048,7168,False,torch.bfloat16,torch.bfloat16,False,False,torch,0,0,44.9941,native,0.0,542.91,993.36
gfx950,256,864,2048,7168,False,torch.bfloat16,torch.bfloat16,False,False,flydsl,3585,1,44.8346,flydsl_gemm3_abf16_wbf16_bf16_t64x128x128_split_k1_block_m_warp2_block_n_warp4_block_k_warp2_async_copyTrue_b_to_ldsTrue_b_preshuffleFalse_c_to_ldsFalse_gfx950,0.006,565.79,1010.05
gfx950,256,896,2048,7168,False,torch.bfloat16,torch.bfloat16,False,False,torch,0,0,45.3161,native,0.0,580.51,1012.34
gfx950,256,928,2048,7168,False,torch.bfloat16,torch.bfloat16,False,False,flydsl,3585,1,46.8232,flydsl_gemm3_abf16_wbf16_bf16_t64x128x128_split_k1_block_m_warp2_block_n_warp4_block_k_warp2_async_copyTrue_b_to_ldsTrue_b_preshuffleFalse_c_to_ldsFalse_gfx950,0.006,581.9,992.35
gfx950,256,960,2048,7168,False,torch.bfloat16,torch.bfloat16,False,False,flydsl,2737,1,46.9104,flydsl_gemm3_abf16_wbf16_bf16_t128x64x128_split_k1_block_m_warp2_block_n_warp4_block_k_warp2_async_copyTrue_b_to_ldsTrue_b_preshuffleFalse_c_to_ldsFalse_gfx950,0.0061,600.84,1003.08
gfx950,256,992,2048,7168,False,torch.bfloat16,torch.bfloat16,False,False,flydsl,2742,1,48.5232,flydsl_gemm3_abf16_wbf16_bf16_t128x64x128_split_k1_block_m_warp4_block_n_warp2_block_k_warp2_async_copyTrue_b_to_ldsTrue_b_preshuffleFalse_c_to_ldsFalse_gfx950,0.0061,600.23,981.89
gfx950,256,1024,2048,7168,False,torch.bfloat16,torch.bfloat16,False,False,torch,0,0,43.3629,native,0.0,693.33,1112.34
gfx950,256,1088,2048,7168,False,torch.bfloat16,torch.bfloat16,False,False,torch,0,0,50.7802,native,0.0,629.06,973.1
gfx950,256,1152,2048,7168,False,torch.bfloat16,torch.bfloat16,False,False,torch,0,0,53.7026,native,0.0,629.82,942.11
gfx950,256,1216,2048,7168,False,torch.bfloat16,torch.bfloat16,False,False,torch,0,0,56.0263,native,0.0,637.23,924.09
gfx950,256,1280,2048,7168,False,torch.bfloat16,torch.bfloat16,False,False,torch,0,0,53.7533,native,0.0,699.14,985.11
gfx950,256,1344,2048,7168,False,torch.bfloat16,torch.bfloat16,False,False,torch,0,0,59.1407,native,0.0,667.22,915.32
gfx950,256,1408,2048,7168,False,torch.bfloat16,torch.bfloat16,False,False,torch,0,0,60.0731,native,0.0,688.15,920.75
gfx950,256,1472,2048,7168,False,torch.bfloat16,torch.bfloat16,False,False,flydsl,5376,1,63.1922,flydsl_gemm4_abf16_wbf16_bf16_t96x128x64_split_k1_block_m_warp1_block_n_warp4_block_k_warp1_async_copyTrue_b_to_ldsTrue_b_preshuffleFalse_c_to_ldsFalse_gfx950,0.0,683.92,893.97
gfx950,256,1536,2048,7168,False,torch.bfloat16,torch.bfloat16,False,False,torch,0,0,56.9249,native,0.0,792.22,1013.12
gfx950,256,1600,2048,7168,False,torch.bfloat16,torch.bfloat16,False,False,flydsl,4311,1,67.399,flydsl_gemm4_abf16_wbf16_bf16_t128x128x64_split_k1_block_m_warp4_block_n_warp4_block_k_warp1_async_copyTrue_b_to_ldsTrue_b_preshuffleFalse_c_to_ldsFalse_gfx950,0.0,696.99,873.18
gfx950,256,1664,2048,7168,False,torch.bfloat16,torch.bfloat16,False,False,flydsl,2537,1,67.959,flydsl_gemm3_abf16_wbf16_bf16_t128x128x64_split_k1_block_m_warp2_block_n_warp4_block_k_warp2_async_copyTrue_b_to_ldsTrue_b_preshuffleFalse_c_to_ldsFalse_gfx950,0.006,718.89,883.34
gfx950,256,1728,2048,7168,False,torch.bfloat16,torch.bfloat16,False,False,flydsl,4310,1,69.453,flydsl_gemm4_abf16_wbf16_bf16_t128x128x64_split_k1_block_m_warp4_block_n_warp2_block_k_warp2_async_copyTrue_b_to_ldsTrue_b_preshuffleFalse_c_to_ldsFalse_gfx950,0.006,730.48,881.32
gfx950,256,1792,2048,7168,False,torch.bfloat16,torch.bfloat16,False,False,flydsl,4304,1,70.5297,flydsl_gemm4_abf16_wbf16_bf16_t128x128x64_split_k1_block_m_warp2_block_n_warp4_block_k_warp1_async_copyTrue_b_to_ldsTrue_b_preshuffleFalse_c_to_ldsFalse_gfx950,0.0,745.97,884.6
gfx950,256,1856,2048,7168,False,torch.bfloat16,torch.bfloat16,False,False,flydsl,4302,1,69.9945,flydsl_gemm4_abf16_wbf16_bf16_t128x128x64_split_k1_block_m_warp2_block_n_warp2_block_k_warp2_async_copyTrue_b_to_ldsTrue_b_preshuffleFalse_c_to_ldsFalse_gfx950,0.006,778.52,908.21
gfx950,256,1920,2048,7168,False,torch.bfloat16,torch.bfloat16,False,False,flydsl,4310,1,72.4751,flydsl_gemm4_abf16_wbf16_bf16_t128x128x64_split_k1_block_m_warp4_block_n_warp2_block_k_warp2_async_copyTrue_b_to_ldsTrue_b_preshuffleFalse_c_to_ldsFalse_gfx950,0.006,777.8,893.4
gfx950,256,1984,2048,7168,False,torch.bfloat16,torch.bfloat16,False,False,flydsl,4302,1,72.1623,flydsl_gemm4_abf16_wbf16_bf16_t128x128x64_split_k1_block_m_warp2_block_n_warp2_block_k_warp2_async_copyTrue_b_to_ldsTrue_b_preshuffleFalse_c_to_ldsFalse_gfx950,0.006,807.22,913.62
gfx950,256,2048,2048,7168,False,torch.bfloat16,torch.bfloat16,False,False,flydsl,5522,1,72.9495,flydsl_gemm5_abf16_wbf16_bf16_t128x128x64_split_k1_block_m_warp2_block_n_warp4_block_k_warp2_async_copyTrue_b_to_ldsTrue_b_preshuffleFalse_c_to_ldsFalse_gfx950,0.006,824.26,919.94
gfx950,256,4096,2048,7168,False,torch.bfloat16,torch.bfloat16,False,False,torch,0,0,108.2119,native,0.0,1111.33,969.0
gfx950,256,6144,2048,7168,False,torch.bfloat16,torch.bfloat16,False,False,opus,1400,0,137.8671,opus_gemm_mono_tile_512x192x256x64_2x4_16x16x32_0x0x0_nooob,0.0,1308.42,1034.38
gfx950,256,8192,2048,7168,False,torch.bfloat16,torch.bfloat16,False,False,torch,0,0,173.0731,native,0.0,1389.69,1042.07
gfx950,256,10240,2048,7168,False,torch.bfloat16,torch.bfloat16,False,False,torch,0,0,238.7187,native,0.0,1259.42,913.64
gfx950,256,12288,2048,7168,False,torch.bfloat16,torch.bfloat16,False,False,opus,1400,0,264.4713,opus_gemm_mono_tile_512x192x256x64_2x4_16x16x32_0x0x0_nooob,0.0,1364.15,967.41
gfx950,256,14336,2048,7168,False,torch.bfloat16,torch.bfloat16,False,False,torch,0,0,310.4236,native,0.0,1355.91,945.81
gfx950,256,16384,2048,7168,False,torch.bfloat16,torch.bfloat16,False,False,torch,0,0,322.9938,native,0.0,1489.31,1025.87
gfx950,256,32768,2048,7168,False,torch.bfloat16,torch.bfloat16,False,False,torch,0,0,633.2713,native,0.0,1519.21,1000.11
gfx942,80,192,384,7168,False,torch.bfloat16,torch.bfloat16,False,False,opus,10201,8,21.2254,opus_gemm_gfx942_splitk_p1_256x64x64x64_2x2_16x16x16_0x0x0,0.0,49.8,395.99
gfx942,80,352,384,7168,False,torch.bfloat16,torch.bfloat16,False,False,opus,10200,8,29.7817,opus_gemm_gfx942_splitk_legacy_512x128x128x64_2x4_16x16x16_0x0x0,0.0,65.07,363.37
gfx942,80,384,384,7168,False,torch.bfloat16,torch.bfloat16,False,False,opus,10200,8,30.5541,opus_gemm_gfx942_splitk_legacy_512x128x128x64_2x4_16x16x16_0x0x0,0.0,69.19,370.0
gfx942,80,416,384,7168,False,torch.bfloat16,torch.bfloat16,False,False,opus,10204,0,35.4087,opus_gemm_gfx942_splitk_em3en4_lds1_pgr2_256x128x96x128_2x2_16x16x16_0x0x0,0.0,64.68,332.92
gfx942,80,104,1024,7168,False,torch.bfloat16,torch.bfloat16,False,False,opus,10210,0,28.0462,opus_gemm_gfx942_splitk_legacy_bf16ws_512x128x128x64_2x4_16x16x16_0x0x0,0.0,54.44,584.18
gfx942,80,200,1024,7168,False,torch.bfloat16,torch.bfloat16,False,False,opus,10200,5,40.5018,opus_gemm_gfx942_splitk_legacy_512x128x128x64_2x4_16x16x16_0x0x0,0.0,72.49,443.36
gfx942,80,208,1024,7168,False,torch.bfloat16,torch.bfloat16,False,False,opus,10210,0,41.1359,opus_gemm_gfx942_splitk_legacy_bf16ws_512x128x128x64_2x4_16x16x16_0x0x0,0.0,74.23,439.71
gfx942,80,160,384,7168,False,torch.bfloat16,torch.bfloat16,False,False,opus,10201,8,20.2282,opus_gemm_gfx942_splitk_p1_256x64x64x64_2x2_16x16x16_0x0x0,0.0,43.54,391.61
gfx942,80,768,384,7168,False,torch.bfloat16,torch.bfloat16,False,False,opus,10200,4,51.6252,opus_gemm_gfx942_splitk_legacy_512x128x128x64_2x4_16x16x16_0x0x0,0.0,81.9,331.33
gfx942,80,128,512,7168,False,torch.bfloat16,torch.bfloat16,False,False,opus,10201,10,19.7843,opus_gemm_gfx942_splitk_p1_256x64x64x64_2x2_16x16x16_0x0x0,0.0,47.49,470.38
gfx942,80,208,512,7168,False,torch.bfloat16,torch.bfloat16,False,False,opus,10210,0,27.7763,opus_gemm_gfx942_splitk_legacy_bf16ws_512x128x128x64_2x4_16x16x16_0x0x0,0.0,54.97,379.28
gfx942,80,224,512,7168,False,torch.bfloat16,torch.bfloat16,False,False,opus,10210,0,27.8194,opus_gemm_gfx942_splitk_legacy_bf16ws_512x128x128x64_2x4_16x16x16_0x0x0,0.0,59.1,387.52
gfx942,80,240,512,7168,False,torch.bfloat16,torch.bfloat16,False,False,opus,10210,0,28.0936,opus_gemm_gfx942_splitk_legacy_bf16ws_512x128x128x64_2x4_16x16x16_0x0x0,0.0,62.7,392.49
gfx942,80,256,512,7168,False,torch.bfloat16,torch.bfloat16,False,False,opus,10210,0,28.3166,opus_gemm_gfx942_splitk_legacy_bf16ws_512x128x128x64_2x4_16x16x16_0x0x0,0.0,66.36,398.08
gfx942,80,352,512,7168,False,torch.bfloat16,torch.bfloat16,False,False,opus,10200,6,32.1674,opus_gemm_gfx942_splitk_legacy_512x128x128x64_2x4_16x16x16_0x0x0,0.0,80.32,396.26
gfx942,80,384,512,7168,False,torch.bfloat16,torch.bfloat16,False,False,opus,10200,6,32.3477,opus_gemm_gfx942_splitk_legacy_512x128x128x64_2x4_16x16x16_0x0x0,0.0,87.13,409.25
gfx942,80,448,512,7168,False,torch.bfloat16,torch.bfloat16,False,False,opus,10200,0,36.729,opus_gemm_gfx942_splitk_legacy_512x128x128x64_2x4_16x16x16_0x0x0,0.0,89.53,387.2
gfx942,80,480,512,7168,False,torch.bfloat16,torch.bfloat16,False,False,opus,10210,0,42.1268,opus_gemm_gfx942_splitk_legacy_bf16ws_512x128x128x64_2x4_16x16x16_0x0x0,0.0,83.63,349.25
gfx942,80,512,512,7168,False,torch.bfloat16,torch.bfloat16,False,False,opus,10210,0,42.8344,opus_gemm_gfx942_splitk_legacy_bf16ws_512x128x128x64_2x4_16x16x16_0x0x0,0.0,87.74,354.96
gfx942,80,608,512,7168,False,torch.bfloat16,torch.bfloat16,False,False,opus,10210,0,49.5677,opus_gemm_gfx942_splitk_legacy_bf16ws_512x128x128x64_2x4_16x16x16_0x0x0,0.0,90.03,336.49
gfx942,80,640,512,7168,False,torch.bfloat16,torch.bfloat16,False,False,opus,10200,0,50.224,opus_gemm_gfx942_splitk_legacy_512x128x128x64_2x4_16x16x16_0x0x0,0.0,93.53,341.88
gfx942,80,736,512,7168,False,torch.bfloat16,torch.bfloat16,False,False,opus,10200,3,60.7273,opus_gemm_gfx942_splitk_legacy_512x128x128x64_2x4_16x16x16_0x0x0,0.0,88.96,307.03
gfx942,80,768,512,7168,False,torch.bfloat16,torch.bfloat16,False,False,opus,10200,3,61.6035,opus_gemm_gfx942_splitk_legacy_512x128x128x64_2x4_16x16x16_0x0x0,0.0,91.51,310.64
gfx942,80,640,2048,7168,False,torch.bfloat16,torch.bfloat16,False,False,opus,10000,0,151.0107,opus_gemm_gfx942_512x128x128x64_2x4_16x16x16_0x0x0,0.0,124.43,272.54
gfx942,80,96,384,7168,False,torch.bfloat16,torch.bfloat16,False,False,opus,10302,0,15.5162,opus_gemm_gfx942_wkc_512x32x16x64_1x1_16x16x16_0x0x0,0.0,34.06,448.24
gfx942,80,1,1024,7168,False,torch.bfloat16,torch.bfloat16,False,False,opus,10300,0,11.7745,opus_gemm_gfx942_wkc_512x16x16x64_1x1_16x16x16_0x0x0,0.0,1.25,1248.16
gfx942,80,4,1024,7168,False,torch.bfloat16,torch.bfloat16,False,False,opus,10300,0,11.8598,opus_gemm_gfx942_wkc_512x16x16x64_1x1_16x16x16_0x0x0,0.0,4.95,1243.33
gfx942,80,8,1024,7168,False,torch.bfloat16,torch.bfloat16,False,False,opus,10300,0,11.9403,opus_gemm_gfx942_wkc_512x16x16x64_1x1_16x16x16_0x0x0,0.0,9.84,1240.43
gfx942,80,112,1024,7168,False,torch.bfloat16,torch.bfloat16,False,False,opus,10210,0,28.5379,opus_gemm_gfx942_splitk_legacy_bf16ws_512x128x128x64_2x4_16x16x16_0x0x0,0.0,57.61,578.71
gfx942,80,120,1024,7168,False,torch.bfloat16,torch.bfloat16,False,False,opus,10210,0,28.6248,opus_gemm_gfx942_splitk_legacy_bf16ws_512x128x128x64_2x4_16x16x16_0x0x0,0.0,61.54,581.53
gfx942,80,128,1024,7168,False,torch.bfloat16,torch.bfloat16,False,False,opus,10210,0,28.7869,opus_gemm_gfx942_splitk_legacy_bf16ws_512x128x128x64_2x4_16x16x16_0x0x0,0.0,65.27,582.81
gfx942,80,216,1024,7168,False,torch.bfloat16,torch.bfloat16,False,False,opus,10210,0,41.3267,opus_gemm_gfx942_splitk_legacy_bf16ws_512x128x128x64_2x4_16x16x16_0x0x0,0.0,76.73,440.85
gfx942,80,224,1024,7168,False,torch.bfloat16,torch.bfloat16,False,False,opus,10210,0,41.3224,opus_gemm_gfx942_splitk_legacy_bf16ws_512x128x128x64_2x4_16x16x16_0x0x0,0.0,79.58,444.07
gfx942,80,232,1024,7168,False,torch.bfloat16,torch.bfloat16,False,False,opus,10210,0,41.7262,opus_gemm_gfx942_splitk_legacy_bf16ws_512x128x128x64_2x4_16x16x16_0x0x0,0.0,81.62,442.91
gfx942,80,240,1024,7168,False,torch.bfloat16,torch.bfloat16,False,False,opus,10210,0,42.0916,opus_gemm_gfx942_splitk_legacy_bf16ws_512x128x128x64_2x4_16x16x16_0x0x0,0.0,83.7,442.18
gfx942,80,248,1024,7168,False,torch.bfloat16,torch.bfloat16,False,False,opus,10210,0,42.5615,opus_gemm_gfx942_splitk_legacy_bf16ws_512x128x128x64_2x4_16x16x16_0x0x0,0.0,85.54,440.38
gfx942,80,256,1024,7168,False,torch.bfloat16,torch.bfloat16,False,False,opus,10210,0,42.823,opus_gemm_gfx942_splitk_legacy_bf16ws_512x128x128x64_2x4_16x16x16_0x0x0,0.0,87.76,440.75
gfx942,80,4,2048,7168,False,torch.bfloat16,torch.bfloat16,False,False,opus,10301,0,20.483,opus_gemm_gfx942_wkc_512x16x32x32_1x1_16x16x16_0x0x0,0.0,5.73,1436.99
gfx942,80,8,2048,7168,False,torch.bfloat16,torch.bfloat16,False,False,opus,10301,0,20.5934,opus_gemm_gfx942_wkc_512x16x32x32_1x1_16x16x16_0x0x0,0.0,11.41,1432.87
gfx942,80,16,2048,7168,False,torch.bfloat16,torch.bfloat16,False,False,opus,10301,0,20.8499,opus_gemm_gfx942_wkc_512x16x32x32_1x1_16x16x16_0x0x0,0.0,22.53,1422.31
gfx942,80,112,2048,7168,False,torch.bfloat16,torch.bfloat16,False,False,opus,10210,0,42.9434,opus_gemm_gfx942_splitk_legacy_bf16ws_512x128x128x64_2x4_16x16x16_0x0x0,0.0,76.57,731.77
gfx942,80,128,2048,7168,False,torch.bfloat16,torch.bfloat16,False,False,opus,10210,0,44.0662,opus_gemm_gfx942_splitk_legacy_bf16ws_512x128x128x64_2x4_16x16x16_0x0x0,0.0,85.28,719.81
gfx942,80,512,2048,4096,False,torch.bfloat16,torch.bfloat16,False,False,opus,10216,5,64.5672,opus_gemm_gfx942_splitk_quad_mfma32_bf16ws_256x256x256x32_2x2_32x32x8_6x0x0,0.0094,133.04,357.28
gfx942,80,512,256,4096,False,torch.bfloat16,torch.bfloat16,False,False,torch,0,0,23.0724,native,0.0,46.54,284.05
gfx942,80,256,2048,4096,False,torch.bfloat16,torch.bfloat16,False,False,opus,10210,5,49.3661,opus_gemm_gfx942_splitk_legacy_bf16ws_512x128x128x64_2x4_16x16x16_0x0x0,0.0095,87.0,403.58
gfx942,80,512,1024,4096,False,torch.bfloat16,torch.bfloat16,False,False,torch,0,0,42.5719,native,0.0,100.89,320.2
gfx942,80,256,256,4096,False,torch.bfloat16,torch.bfloat16,False,False,asm,5,5,14.1963,_ZN5aiter39bf16gemm_fp32bf16_tn_64x64_splitk_cleanE,0.0146,37.82,304.68
gfx942,80,256,1024,4096,False,torch.bfloat16,torch.bfloat16,False,False,opus,10210,0,29.3736,opus_gemm_gfx942_splitk_legacy_bf16ws_512x128x128x64_2x4_16x16x16_0x0x0,0.0,73.11,374.83
gfx942,80,512,512,4096,False,torch.bfloat16,torch.bfloat16,False,False,opus,10210,0,29.1965,opus_gemm_gfx942_splitk_legacy_bf16ws_512x128x128x64_2x4_16x16x16_0x0x0,0.0,73.55,305.27
gfx942,80,128,2048,4096,False,torch.bfloat16,torch.bfloat16,False,False,opus,10210,0,29.7021,opus_gemm_gfx942_splitk_legacy_bf16ws_512x128x128x64_2x4_16x16x16_0x0x0,0.0,72.3,617.8
gfx942,80,128,256,4096,False,torch.bfloat16,torch.bfloat16,False,False,opus,10302,0,10.1493,opus_gemm_gfx942_wkc_512x32x16x64_1x1_16x16x16_0x0x0,0.0,26.45,316.4
gfx942,80,256,512,4096,False,torch.bfloat16,torch.bfloat16,False,False,torch,0,0,23.1381,native,0.0,46.41,283.24
gfx942,80,48,2048,4096,False,torch.bfloat16,torch.bfloat16,False,False,asm,3,2,22.906,_ZN5aiter39bf16gemm_fp32bf16_tn_48x64_splitk_cleanE,0.0049,35.16,758.19
gfx942,80,64,2048,4096,False,torch.bfloat16,torch.bfloat16,False,False,torch,0,0,23.5578,native,0.0,45.58,745.56
gfx942,80,64,256,4096,False,torch.bfloat16,torch.bfloat16,False,False,opus,10300,0,7.9398,opus_gemm_gfx942_wkc_512x16x16x64_1x1_16x16x16_0x0x0,0.0,16.9,334.29
gfx942,80,32,256,4096,False,torch.bfloat16,torch.bfloat16,False,False,opus,10313,0,6.5263,opus_gemm_gfx942_wkc_accum_256x32x32x64_1x1_16x16x16_0x0x0,0.0199,10.28,364.02
gfx942,80,8,256,4096,False,torch.bfloat16,torch.bfloat16,False,False,opus,10310,0,4.894,opus_gemm_gfx942_wkc_accum_256x16x16x64_1x1_16x16x16_0x0x0,0.0186,3.43,442.74
gfx942,80,48,256,4096,False,torch.bfloat16,torch.bfloat16,False,False,opus,10300,0,7.45,opus_gemm_gfx942_wkc_512x16x16x64_1x1_16x16x16_0x0x0,0.0,13.51,337.58
gfx942,80,2,256,4096,False,torch.bfloat16,torch.bfloat16,False,False,opus,10310,0,4.8679,opus_gemm_gfx942_wkc_accum_256x16x16x64_1x1_16x16x16_0x0x0,0.0176,0.86,434.39
gfx942,80,16,256,4096,False,torch.bfloat16,torch.bfloat16,False,False,opus,10311,0,4.9659,opus_gemm_gfx942_wkc_accum_512x16x32x32_1x1_16x16x16_0x0x0,0.0181,6.76,450.35
gfx942,80,128,1024,4096,False,torch.bfloat16,torch.bfloat16,False,False,torch,0,0,19.8904,native,0.0,53.98,487.64
gfx942,80,4,256,4096,False,torch.bfloat16,torch.bfloat16,False,False,opus,10310,0,4.8338,opus_gemm_gfx942_wkc_accum_256x16x16x64_1x1_16x16x16_0x0x0,0.0293,1.74,441.05
gfx942,80,1,256,4096,False,torch.bfloat16,torch.bfloat16,False,False,opus,10310,0,4.8174,opus_gemm_gfx942_wkc_accum_256x16x16x64_1x1_16x16x16_0x0x0,0.0273,0.44,437.14
gfx942,80,32,2048,4096,False,torch.bfloat16,torch.bfloat16,False,False,torch,0,0,17.4838,native,0.0,30.71,982.08
gfx942,80,128,512,4096,False,torch.bfloat16,torch.bfloat16,False,False,asm,5,5,14.5712,_ZN5aiter39bf16gemm_fp32bf16_tn_64x64_splitk_cleanE,0.0148,36.84,368.81
gfx942,80,64,1024,4096,False,torch.bfloat16,torch.bfloat16,False,False,asm,5,5,15.1527,_ZN5aiter39bf16gemm_fp32bf16_tn_64x64_splitk_cleanE,0.0141,35.43,596.86
gfx942,80,48,1024,4096,False,torch.bfloat16,torch.bfloat16,False,False,asm,3,5,13.8806,_ZN5aiter39bf16gemm_fp32bf16_tn_48x64_splitk_cleanE,0.0146,29.01,639.75
gfx942,80,2,2048,4096,False,torch.bfloat16,torch.bfloat16,False,False,opus,10301,0,12.9907,opus_gemm_gfx942_wkc_512x16x32x32_1x1_16x16x16_0x0x0,0.0,2.58,1293.37
gfx942,80,8,2048,4096,False,torch.bfloat16,torch.bfloat16,False,False,opus,10301,0,13.0097,opus_gemm_gfx942_wkc_512x16x32x32_1x1_16x16x16_0x0x0,0.0,10.32,1297.15
gfx942,80,48,512,4096,False,torch.bfloat16,torch.bfloat16,False,False,asm,3,10,10.4683,_ZN5aiter39bf16gemm_fp32bf16_tn_48x64_splitk_cleanE,0.0228,19.23,442.93
gfx942,80,64,512,4096,False,torch.bfloat16,torch.bfloat16,False,False,opus,10302,0,10.7679,opus_gemm_gfx942_wkc_512x32x16x64_1x1_16x16x16_0x0x0,0.0,24.93,444.3
gfx942,80,4,2048,4096,False,torch.bfloat16,torch.bfloat16,False,False,opus,10301,0,12.7075,opus_gemm_gfx942_wkc_512x16x32x32_1x1_16x16x16_0x0x0,0.0,5.28,1324.13
gfx942,80,512,64,4096,False,torch.bfloat16,torch.bfloat16,False,False,opus,10302,0,10.5756,opus_gemm_gfx942_wkc_512x32x16x64_1x1_16x16x16_0x0x0,0.0,25.38,452.37
gfx942,80,1,2048,4096,False,torch.bfloat16,torch.bfloat16,False,False,opus,10301,0,13.0372,opus_gemm_gfx942_wkc_512x16x32x32_1x1_16x16x16_0x0x0,0.0,1.29,1287.82
gfx942,80,16,2048,4096,False,torch.bfloat16,torch.bfloat16,False,False,opus,10301,0,13.3916,opus_gemm_gfx942_wkc_512x16x32x32_1x1_16x16x16_0x0x0,0.0,20.05,1267.5
gfx942,80,32,1024,4096,False,torch.bfloat16,torch.bfloat16,False,False,opus,10302,0,11.8246,opus_gemm_gfx942_wkc_512x32x16x64_1x1_16x16x16_0x0x0,0.0,22.7,737.13
gfx942,80,32,512,4096,False,torch.bfloat16,torch.bfloat16,False,False,flydsl,759,8,9.2194,flydsl_gemm4_abf16_wbf16_bf16_t32x64x64_split_k8_block_m_warp2_block_n_warp2_block_k_warp1_async_copyFalse_b_to_ldsTrue_b_preshuffleFalse_c_to_ldsFalse_gfx942,0.0198,14.56,486.93
gfx942,80,256,64,4096,False,torch.bfloat16,torch.bfloat16,False,False,asm,5,16,8.1263,_ZN5aiter39bf16gemm_fp32bf16_tn_64x64_splitk_cleanE,0.0281,16.52,326.62
gfx942,80,8,512,4096,False,torch.bfloat16,torch.bfloat16,False,False,opus,10300,0,8.1931,opus_gemm_gfx942_wkc_512x16x16x64_1x1_16x16x16_0x0x0,0.0,4.1,520.93
gfx942,80,16,512,4096,False,torch.bfloat16,torch.bfloat16,False,False,opus,10310,0,8.6225,opus_gemm_gfx942_wkc_accum_256x16x16x64_1x1_16x16x16_0x0x0,0.02,7.78,503.54
gfx942,80,4,512,4096,False,torch.bfloat16,torch.bfloat16,False,False,opus,10300,0,8.1018,opus_gemm_gfx942_wkc_512x16x16x64_1x1_16x16x16_0x0x0,0.0,2.07,522.25
gfx942,80,2,512,4096,False,torch.bfloat16,torch.bfloat16,False,False,opus,10300,0,8.3322,opus_gemm_gfx942_wkc_512x16x16x64_1x1_16x16x16_0x0x0,0.0,1.01,505.6
gfx942,80,128,64,4096,False,torch.bfloat16,torch.bfloat16,False,False,asm,1,16,6.8358,_ZN5aiter39bf16gemm_fp32bf16_tn_32x64_splitk_cleanE,0.0271,9.82,232.49
gfx942,80,1,512,4096,False,torch.bfloat16,torch.bfloat16,False,False,opus,10300,0,8.0662,opus_gemm_gfx942_wkc_512x16x16x64_1x1_16x16x16_0x0x0,0.0,0.52,521.13
gfx942,80,2,1024,4096,False,torch.bfloat16,torch.bfloat16,False,False,opus,10300,0,9.4623,opus_gemm_gfx942_wkc_512x16x16x64_1x1_16x16x16_0x0x0,0.0,1.77,888.69
gfx942,80,16,1024,4096,False,torch.bfloat16,torch.bfloat16,False,False,opus,10302,0,11.2766,opus_gemm_gfx942_wkc_512x32x16x64_1x1_16x16x16_0x0x0,0.0,11.9,758.42
gfx942,80,8,1024,4096,False,torch.bfloat16,torch.bfloat16,False,False,opus,10300,0,9.6515,opus_gemm_gfx942_wkc_512x16x16x64_1x1_16x16x16_0x0x0,0.0,6.95,877.64
gfx942,80,4,1024,4096,False,torch.bfloat16,torch.bfloat16,False,False,opus,10300,0,9.5499,opus_gemm_gfx942_wkc_512x16x16x64_1x1_16x16x16_0x0x0,0.0,3.51,882.69
gfx942,80,1,1024,4096,False,torch.bfloat16,torch.bfloat16,False,False,opus,10300,0,9.1734,opus_gemm_gfx942_wkc_512x16x16x64_1x1_16x16x16_0x0x0,0.0,0.91,915.57
gfx942,80,32,64,4096,False,torch.bfloat16,torch.bfloat16,False,False,opus,10310,0,4.5291,opus_gemm_gfx942_wkc_accum_256x16x16x64_1x1_16x16x16_0x0x0,0.0229,3.7,174.54
gfx942,80,48,64,4096,False,torch.bfloat16,torch.bfloat16,False,False,opus,10312,0,4.7978,opus_gemm_gfx942_wkc_accum_512x32x16x64_1x1_16x16x16_0x0x0,0.0186,5.25,192.51
gfx942,80,64,64,4096,False,torch.bfloat16,torch.bfloat16,False,False,opus,10312,0,4.7714,opus_gemm_gfx942_wkc_accum_512x32x16x64_1x1_16x16x16_0x0x0,0.0215,7.03,221.48
gfx942,80,16,64,4096,False,torch.bfloat16,torch.bfloat16,False,False,opus,10310,0,4.5125,opus_gemm_gfx942_wkc_accum_256x16x16x64_1x1_16x16x16_0x0x0,0.0205,1.86,145.69
gfx950,256,1024,16160,7168,False,torch.bfloat16,torch.bfloat16,False,False,opus,5009,0,222.0124,opus_gemm_512x256x256x64_2x4_16x16x32_0x0x0_4g_safe,0.0,1068.54,1258.69
gfx1250,256,1,64,4096,False,torch.bfloat16,torch.bfloat16,False,False,triton,0,0,0.0,auto,0.0,0.0,0.0
gfx1250,256,1,64,7168,False,torch.bfloat16,torch.bfloat16,False,False,opus,20014,16,10.6853,opus_gemm_gfx1250_splitk_cluster_tdm_ws_128x32x32x256_2x1_16x16x32_0x0x0_p3w2,0.0,0.09,87.22
gfx1250,256,2,64,4096,False,torch.bfloat16,torch.bfloat16,False,False,triton,0,0,0.0,auto,0.0,0.0,0.0
gfx1250,256,2,64,7168,False,torch.bfloat16,torch.bfloat16,False,False,opus,20121,16,10.8613,opus_gemm_gfx1250_splitk_clusterlaunch_tdm_ws_128x16x32x256_1x2_16x16x32_0x0x0_c1x2_p3w2,0.0,0.17,87.14
gfx1250,256,4,64,4096,False,torch.bfloat16,torch.bfloat16,False,False,triton,0,0,0.0,auto,0.0,0.0,0.0
gfx1250,256,4,64,7168,False,torch.bfloat16,torch.bfloat16,False,False,opus,20001,16,10.3771,opus_gemm_gfx1250_splitk_cluster_tdm_ws_128x16x32x256_1x2_16x16x32_0x0x0_p3w2,0.0,0.35,93.99
gfx1250,256,8,64,4096,False,torch.bfloat16,torch.bfloat16,False,False,triton,0,0,0.0,auto,0.0,0.0,0.0
gfx1250,256,8,64,7168,False,torch.bfloat16,torch.bfloat16,False,False,opus,20247,16,10.5792,opus_gemm_gfx1250_splitk_clusterlaunch_tdm_ws_128x32x32x256_2x1_16x16x32_0x0x0_c1x2_p3w2,0.0,0.69,97.66
gfx1250,256,16,64,4096,False,torch.bfloat16,torch.bfloat16,False,False,triton,0,0,7.2704,auto,0.0,1.15,90.42
gfx1250,256,16,64,7168,False,torch.bfloat16,torch.bfloat16,False,False,opus,20121,16,10.2842,opus_gemm_gfx1250_splitk_clusterlaunch_tdm_ws_128x16x32x256_1x2_16x16x32_0x0x0_c1x2_p3w2,0.0,1.43,111.72
gfx1250,256,32,64,4096,False,torch.bfloat16,torch.bfloat16,False,False,triton,0,0,7.3883,auto,0.0,2.27,107.0
gfx1250,256,32,64,7168,False,torch.bfloat16,torch.bfloat16,False,False,opus,20002,14,10.5284,opus_gemm_gfx1250_splitk_cluster_tdm_ws_128x16x32x512_1x2_16x16x32_0x0x0_p3w1,0.0,2.79,131.11
gfx1250,256,48,64,4096,False,torch.bfloat16,torch.bfloat16,False,False,triton,0,0,7.2809,auto,0.0,3.46,126.86
gfx1250,256,48,64,7168,False,torch.bfloat16,torch.bfloat16,False,False,opus,20121,16,10.7388,opus_gemm_gfx1250_splitk_clusterlaunch_tdm_ws_128x16x32x256_1x2_16x16x32_0x0x0_c1x2_p3w2,0.0,4.1,150.09
gfx1250,256,64,64,4096,False,torch.bfloat16,torch.bfloat16,False,False,triton,0,0,7.3875,auto,0.0,4.54,143.05
gfx1250,256,64,64,7168,False,torch.bfloat16,torch.bfloat16,False,False,opus,20011,16,11.1827,opus_gemm_gfx1250_splitk_cluster_tdm_ws_128x16x64x256_1x2_16x16x32_0x0x0_p3w1,0.0,5.25,164.83
gfx1250,256,80,64,4096,False,torch.bfloat16,torch.bfloat16,False,False,triton,0,0,5.8985,auto,0.0,7.11,201.73
gfx1250,256,80,64,7168,False,torch.bfloat16,torch.bfloat16,False,False,opus,20002,13,8.0704,opus_gemm_gfx1250_splitk_cluster_tdm_ws_128x16x32x512_1x2_16x16x32_0x0x0_p3w1,0.0,9.1,257.07
gfx1250,256,96,64,4096,False,torch.bfloat16,torch.bfloat16,False,False,triton,0,0,6.008,auto,0.0,8.38,220.21
gfx1250,256,96,64,7168,False,torch.bfloat16,torch.bfloat16,False,False,opus,20002,12,8.1491,opus_gemm_gfx1250_splitk_cluster_tdm_ws_128x16x32x512_1x2_16x16x32_0x0x0_p3w1,0.0,10.81,282.98
gfx1250,256,112,64,4096,False,torch.bfloat16,torch.bfloat16,False,False,triton,0,0,6.013,auto,0.0,9.77,242.16
gfx1250,256,112,64,7168,False,torch.bfloat16,torch.bfloat16,False,False,opus,20002,12,8.7498,opus_gemm_gfx1250_splitk_cluster_tdm_ws_128x16x32x512_1x2_16x16x32_0x0x0_p3w1,0.0,11.74,290.0
gfx1250,256,128,64,4096,False,torch.bfloat16,torch.bfloat16,False,False,triton,0,0,5.9557,auto,0.0,11.27,266.84
gfx1250,256,128,64,7168,False,torch.bfloat16,torch.bfloat16,False,False,opus,20002,12,8.6283,opus_gemm_gfx1250_splitk_cluster_tdm_ws_128x16x32x512_1x2_16x16x32_0x0x0_p3w1,0.0,13.61,320.91
gfx1250,256,144,64,4096,False,torch.bfloat16,torch.bfloat16,False,False,triton,0,0,6.2351,auto,0.0,12.11,276.24
gfx1250,256,144,64,7168,False,torch.bfloat16,torch.bfloat16,False,False,opus,20002,9,8.8733,opus_gemm_gfx1250_splitk_cluster_tdm_ws_128x16x32x512_1x2_16x16x32_0x0x0_p3w1,0.0,14.89,338.13
gfx1250,256,160,64,4096,False,torch.bfloat16,torch.bfloat16,False,False,triton,0,0,5.887,auto,0.0,14.25,315.18
gfx1250,256,160,64,7168,False,torch.bfloat16,torch.bfloat16,False,False,opus,20002,7,8.9949,opus_gemm_gfx1250_splitk_cluster_tdm_ws_128x16x32x512_1x2_16x16x32_0x0x0_p3w1,0.0,16.32,359.29
gfx1250,256,176,64,4096,False,torch.bfloat16,torch.bfloat16,False,False,triton,0,0,5.9179,auto,0.0,15.59,336.03
gfx1250,256,176,64,7168,False,torch.bfloat16,torch.bfloat16,False,False,opus,20002,6,9.1765,opus_gemm_gfx1250_splitk_cluster_tdm_ws_128x16x32x512_1x2_16x16x32_0x0x0_p3w1,0.0,17.6,377.4
gfx1250,256,192,64,4096,False,torch.bfloat16,torch.bfloat16,False,False,triton,0,0,5.774,auto,0.0,17.43,367.46
gfx1250,256,192,64,7168,False,torch.bfloat16,torch.bfloat16,False,False,opus,20002,6,8.6837,opus_gemm_gfx1250_splitk_cluster_tdm_ws_128x16x32x512_1x2_16x16x32_0x0x0_p3w1,0.0,20.29,425.46
gfx1250,256,208,64,4096,False,torch.bfloat16,torch.bfloat16,False,False,triton,0,0,6.399,auto,0.0,17.04,352.38
gfx1250,256,208,64,7168,False,torch.bfloat16,torch.bfloat16,False,False,opus,20002,5,8.8202,opus_gemm_gfx1250_splitk_cluster_tdm_ws_128x16x32x512_1x2_16x16x32_0x0x0_p3w1,0.0,21.64,445.12
gfx1250,256,224,64,4096,False,torch.bfloat16,torch.bfloat16,False,False,triton,0,0,5.785,auto,0.0,20.3,412.79
gfx1250,256,224,64,7168,False,torch.bfloat16,torch.bfloat16,False,False,opus,20002,5,9.1129,opus_gemm_gfx1250_splitk_cluster_tdm_ws_128x16x32x512_1x2_16x16x32_0x0x0_p3w1,0.0,22.55,456.21
gfx1250,256,240,64,4096,False,torch.bfloat16,torch.bfloat16,False,False,triton,0,0,5.9089,auto,0.0,21.29,426.66
gfx1250,256,240,64,7168,False,torch.bfloat16,torch.bfloat16,False,False,opus,20002,5,9.2709,opus_gemm_gfx1250_splitk_cluster_tdm_ws_128x16x32x512_1x2_16x16x32_0x0x0_p3w1,0.0,23.75,473.4
gfx1250,256,256,64,4096,False,torch.bfloat16,torch.bfloat16,False,False,triton,0,0,5.8644,auto,0.0,22.89,452.6
gfx1250,256,256,64,7168,False,torch.bfloat16,torch.bfloat16,False,False,opus,20002,5,9.387,opus_gemm_gfx1250_splitk_cluster_tdm_ws_128x16x32x512_1x2_16x16x32_0x0x0_p3w1,0.0,25.02,492.2
gfx1250,256,288,64,4096,False,torch.bfloat16,torch.bfloat16,False,False,triton,0,0,5.9886,auto,0.0,25.21,487.67
gfx1250,256,288,64,7168,False,torch.bfloat16,torch.bfloat16,False,False,opus,20002,6,9.898,opus_gemm_gfx1250_splitk_cluster_tdm_ws_128x16x32x512_1x2_16x16x32_0x0x0_p3w1,0.0,26.7,513.55
gfx1250,256,320,64,4096,False,torch.bfloat16,torch.bfloat16,False,False,triton,0,0,5.982,auto,0.0,28.05,532.71
gfx1250,256,320,64,7168,False,torch.bfloat16,torch.bfloat16,False,False,opus,20002,6,10.6024,opus_gemm_gfx1250_splitk_cluster_tdm_ws_128x16x32x512_1x2_16x16x32_0x0x0_p3w1,0.0,27.69,523.09
gfx1250,256,352,64,4096,False,torch.bfloat16,torch.bfloat16,False,False,triton,0,0,5.9458,auto,0.0,31.04,580.73
gfx1250,256,352,64,7168,False,torch.bfloat16,torch.bfloat16,False,False,opus,20009,7,10.4181,opus_gemm_gfx1250_splitk_cluster_tdm_ws_128x64x16x128_2x1_16x16x32_0x0x0_p3w2,0.0,31.0,576.77
gfx1250,256,384,64,4096,False,torch.bfloat16,torch.bfloat16,False,False,triton,0,0,6.0324,auto,0.0,33.37,616.53
gfx1250,256,384,64,7168,False,torch.bfloat16,torch.bfloat16,False,False,opus,20009,7,10.9299,opus_gemm_gfx1250_splitk_cluster_tdm_ws_128x64x16x128_2x1_16x16x32_0x0x0_p3w2,0.0,32.23,592.11
gfx1250,256,416,64,4096,False,torch.bfloat16,torch.bfloat16,False,False,triton,0,0,5.9859,auto,0.0,36.44,665.8
gfx1250,256,416,64,7168,False,torch.bfloat16,torch.bfloat16,False,False,opus,20009,5,10.6437,opus_gemm_gfx1250_splitk_cluster_tdm_ws_128x64x16x128_2x1_16x16x32_0x0x0_p3w2,0.0,35.86,651.51
gfx1250,256,448,64,4096,False,torch.bfloat16,torch.bfloat16,False,False,triton,0,0,5.9355,auto,0.0,39.57,716.31
gfx1250,256,448,64,7168,False,torch.bfloat16,torch.bfloat16,False,False,opus,20009,6,11.0497,opus_gemm_gfx1250_splitk_cluster_tdm_ws_128x64x16x128_2x1_16x16x32_0x0x0_p3w2,0.0,37.2,669.46
gfx1250,256,480,64,4096,False,torch.bfloat16,torch.bfloat16,False,False,triton,0,0,5.9287,auto,0.0,42.45,762.04
gfx1250,256,480,64,7168,False,torch.bfloat16,torch.bfloat16,False,False,opus,20009,6,11.4088,opus_gemm_gfx1250_splitk_cluster_tdm_ws_128x64x16x128_2x1_16x16x32_0x0x0_p3w2,0.0,38.6,688.96
gfx1250,256,512,64,4096,False,torch.bfloat16,torch.bfloat16,False,False,triton,0,0,5.9772,auto,0.0,44.91,800.4
gfx1250,256,512,64,7168,False,torch.bfloat16,torch.bfloat16,False,False,opus,20009,4,11.5218,opus_gemm_gfx1250_splitk_cluster_tdm_ws_128x64x16x128_2x1_16x16x32_0x0x0_p3w2,0.0,40.77,722.38
gfx1250,256,1024,64,4096,False,torch.bfloat16,torch.bfloat16,False,False,triton,0,0,0.0,auto,0.0,0.0,0.0
gfx1250,256,2048,64,4096,False,torch.bfloat16,torch.bfloat16,False,False,triton,0,0,0.0,auto,0.0,0.0,0.0
gfx1250,256,4096,64,4096,False,torch.bfloat16,torch.bfloat16,False,False,triton,0,0,0.0,auto,0.0,0.0,0.0
gfx1250,256,8192,64,4096,False,torch.bfloat16,torch.bfloat16,False,False,triton,0,0,0.0,auto,0.0,0.0,0.0
gfx1250,256,16384,64,4096,False,torch.bfloat16,torch.bfloat16,False,False,triton,0,0,0.0,auto,0.0,0.0,0.0
gfx1250,256,1,256,4096,False,torch.bfloat16,torch.bfloat16,False,False,triton,0,0,0.0,auto,0.0,0.0,0.0
gfx1250,256,2,256,4096,False,torch.bfloat16,torch.bfloat16,False,False,triton,0,0,0.0,auto,0.0,0.0,0.0
gfx1250,256,4,256,4096,False,torch.bfloat16,torch.bfloat16,False,False,triton,0,0,0.0,auto,0.0,0.0,0.0
gfx1250,256,8,256,4096,False,torch.bfloat16,torch.bfloat16,False,False,triton,0,0,0.0,auto,0.0,0.0,0.0
gfx1250,256,16,256,4096,False,torch.bfloat16,torch.bfloat16,False,False,triton,0,0,7.4509,auto,0.0,4.5,300.15
gfx1250,256,32,256,4096,False,torch.bfloat16,torch.bfloat16,False,False,triton,0,0,7.4622,auto,0.0,8.99,318.36
gfx1250,256,48,256,4096,False,torch.bfloat16,torch.bfloat16,False,False,opus,20002,7,7.2097,opus_gemm_gfx1250_splitk_cluster_tdm_ws_128x16x32x512_1x2_16x16x32_0x0x0_p3w1,0.0,13.96,348.83
gfx1250,256,64,256,4096,False,torch.bfloat16,torch.bfloat16,False,False,opus,20002,6,7.5973,opus_gemm_gfx1250_splitk_cluster_tdm_ws_128x16x32x512_1x2_16x16x32_0x0x0_p3w1,0.0,17.67,349.36
gfx1250,256,80,256,4096,False,torch.bfloat16,torch.bfloat16,False,False,triton,0,0,5.8452,auto,0.0,28.7,477.91
gfx1250,256,96,256,4096,False,torch.bfloat16,torch.bfloat16,False,False,triton,0,0,5.9156,auto,0.0,34.03,495.76
gfx1250,256,112,256,4096,False,torch.bfloat16,torch.bfloat16,False,False,triton,0,0,5.9468,auto,0.0,39.5,516.58
gfx1250,256,128,256,4096,False,torch.bfloat16,torch.bfloat16,False,False,triton,0,0,6.0009,auto,0.0,44.73,535.13
gfx1250,256,144,256,4096,False,torch.bfloat16,torch.bfloat16,False,False,triton,0,0,5.9288,auto,0.0,50.94,565.13
gfx1250,256,160,256,4096,False,torch.bfloat16,torch.bfloat16,False,False,triton,0,0,5.8262,auto,0.0,57.59,598.98
gfx1250,256,176,256,4096,False,torch.bfloat16,torch.bfloat16,False,False,triton,0,0,6.1298,auto,0.0,60.21,592.03
gfx1250,256,192,256,4096,False,torch.bfloat16,torch.bfloat16,False,False,triton,0,0,5.9843,auto,0.0,67.28,629.7
gfx1250,256,208,256,4096,False,torch.bfloat16,torch.bfloat16,False,False,triton,0,0,5.8432,auto,0.0,74.65,668.74
gfx1250,256,224,256,4096,False,torch.bfloat16,torch.bfloat16,False,False,triton,0,0,5.81,auto,0.0,80.85,696.53
gfx1250,256,240,256,4096,False,torch.bfloat16,torch.bfloat16,False,False,triton,0,0,6.0549,auto,0.0,83.13,691.36
gfx1250,256,256,256,4096,False,torch.bfloat16,torch.bfloat16,False,False,triton,0,0,6.0348,auto,0.0,88.96,716.74
gfx1250,256,288,256,4096,False,torch.bfloat16,torch.bfloat16,False,False,triton,0,0,5.9735,auto,0.0,101.11,770.72
gfx1250,256,320,256,4096,False,torch.bfloat16,torch.bfloat16,False,False,triton,0,0,6.1094,auto,0.0,109.85,799.17
gfx1250,256,352,256,4096,False,torch.bfloat16,torch.bfloat16,False,False,triton,0,0,5.9127,auto,0.0,124.85,872.86
gfx1250,256,384,256,4096,False,torch.bfloat16,torch.bfloat16,False,False,triton,0,0,6.2434,auto,0.0,128.99,871.24
gfx1250,256,416,256,4096,False,torch.bfloat16,torch.bfloat16,False,False,triton,0,0,6.0166,auto,0.0,145.0,950.37
gfx1250,256,448,256,4096,False,torch.bfloat16,torch.bfloat16,False,False,triton,0,0,6.1707,auto,0.0,152.26,971.78
gfx1250,256,480,256,4096,False,torch.bfloat16,torch.bfloat16,False,False,triton,0,0,6.0919,auto,0.0,165.24,1030.07
gfx1250,256,512,256,4096,False,torch.bfloat16,torch.bfloat16,False,False,triton,0,0,6.2969,auto,0.0,170.52,1040.77
gfx1250,256,1024,256,4096,False,torch.bfloat16,torch.bfloat16,False,False,triton,0,0,0.0,auto,0.0,0.0,0.0
gfx1250,256,2048,256,4096,False,torch.bfloat16,torch.bfloat16,False,False,triton,0,0,0.0,auto,0.0,0.0,0.0
gfx1250,256,4096,256,4096,False,torch.bfloat16,torch.bfloat16,False,False,triton,0,0,0.0,auto,0.0,0.0,0.0
gfx1250,256,8192,256,4096,False,torch.bfloat16,torch.bfloat16,False,False,triton,0,0,0.0,auto,0.0,0.0,0.0
gfx1250,256,16384,256,4096,False,torch.bfloat16,torch.bfloat16,False,False,triton,0,0,0.0,auto,0.0,0.0,0.0
gfx1250,256,1,384,7168,False,torch.bfloat16,torch.bfloat16,False,False,opus,20002,11,8.2023,opus_gemm_gfx1250_splitk_cluster_tdm_ws_128x16x32x512_1x2_16x16x32_0x0x0_p3w1,0.0,0.67,673.0
gfx1250,256,2,384,7168,False,torch.bfloat16,torch.bfloat16,False,False,opus,20002,13,8.5556,opus_gemm_gfx1250_splitk_cluster_tdm_ws_128x16x32x512_1x2_16x16x32_0x0x0_p3w1,0.0,1.29,646.97
gfx1250,256,4,384,7168,False,torch.bfloat16,torch.bfloat16,False,False,opus,20002,11,8.6868,opus_gemm_gfx1250_splitk_cluster_tdm_ws_128x16x32x512_1x2_16x16x32_0x0x0_p3w1,0.0,2.53,640.68
gfx1250,256,96,384,7168,False,torch.bfloat16,torch.bfloat16,False,False,opus,20251,5,8.863,opus_gemm_gfx1250_splitk_clusterlaunch_tdm_ws_128x32x32x256_2x1_16x16x32_0x0x0_c1x3_p3w2,0.0,59.63,784.72
gfx1250,256,144,384,7168,False,torch.bfloat16,torch.bfloat16,False,False,opus,20255,4,9.488,opus_gemm_gfx1250_splitk_clusterlaunch_tdm_ws_128x32x32x256_2x1_16x16x32_0x0x0_c1x4_p3w2,0.0,83.55,809.44
gfx1250,256,160,384,7168,False,torch.bfloat16,torch.bfloat16,False,False,opus,20255,5,9.5225,opus_gemm_gfx1250_splitk_clusterlaunch_tdm_ws_128x32x32x256_2x1_16x16x32_0x0x0_c1x4_p3w2,0.0,92.5,831.89
gfx1250,256,192,384,7168,False,torch.bfloat16,torch.bfloat16,False,False,opus,20251,4,9.9593,opus_gemm_gfx1250_splitk_clusterlaunch_tdm_ws_128x32x32x256_2x1_16x16x32_0x0x0_c1x3_p3w2,0.0,106.13,843.93
gfx1250,256,208,384,7168,False,torch.bfloat16,torch.bfloat16,False,False,opus,20255,3,10.5427,opus_gemm_gfx1250_splitk_clusterlaunch_tdm_ws_128x32x32x256_2x1_16x16x32_0x0x0_c1x4_p3w2,0.0,108.61,820.16
gfx1250,256,256,384,7168,False,torch.bfloat16,torch.bfloat16,False,False,opus,20255,5,10.6882,opus_gemm_gfx1250_splitk_clusterlaunch_tdm_ws_128x32x32x256_2x1_16x16x32_0x0x0_c1x4_p3w2,0.0,131.85,876.82
gfx1250,256,288,384,7168,False,torch.bfloat16,torch.bfloat16,False,False,opus,20255,3,11.0884,opus_gemm_gfx1250_splitk_clusterlaunch_tdm_ws_128x32x32x256_2x1_16x16x32_0x0x0_c1x4_p3w2,0.0,142.98,888.76
gfx1250,256,352,384,7168,False,torch.bfloat16,torch.bfloat16,False,False,opus,20255,3,12.2377,opus_gemm_gfx1250_splitk_clusterlaunch_tdm_ws_128x32x32x256_2x1_16x16x32_0x0x0_c1x4_p3w2,0.0,158.34,884.29
gfx1250,256,384,384,7168,False,torch.bfloat16,torch.bfloat16,False,False,opus,20255,3,12.8556,opus_gemm_gfx1250_splitk_clusterlaunch_tdm_ws_128x32x32x256_2x1_16x16x32_0x0x0_c1x4_p3w2,0.0,164.44,879.38
gfx1250,256,416,384,7168,False,torch.bfloat16,torch.bfloat16,False,False,opus,20255,3,13.4562,opus_gemm_gfx1250_splitk_clusterlaunch_tdm_ws_128x32x32x256_2x1_16x16x32_0x0x0_c1x4_p3w2,0.0,170.19,876.05
gfx1250,256,480,384,7168,False,torch.bfloat16,torch.bfloat16,False,False,opus,20251,2,15.5986,opus_gemm_gfx1250_splitk_clusterlaunch_tdm_ws_128x32x32x256_2x1_16x16x32_0x0x0_c1x3_p3w2,0.0,169.4,817.7
gfx1250,256,1,512,4096,False,torch.bfloat16,torch.bfloat16,False,False,triton,0,0,0.0,auto,0.0,0.0,0.0
gfx1250,256,1,512,7168,False,torch.bfloat16,torch.bfloat16,False,False,opus,20129,8,7.8073,opus_gemm_gfx1250_splitk_clusterlaunch_tdm_ws_128x16x32x256_1x2_16x16x32_0x0x0_c1x4_p3w2,0.0,0.94,942.12
gfx1250,256,2,512,4096,False,torch.bfloat16,torch.bfloat16,False,False,triton,0,0,0.0,auto,0.0,0.0,0.0
gfx1250,256,2,512,7168,False,torch.bfloat16,torch.bfloat16,False,False,opus,20255,8,8.9564,opus_gemm_gfx1250_splitk_clusterlaunch_tdm_ws_128x32x32x256_2x1_16x16x32_0x0x0_c1x4_p3w2,0.0,1.64,822.96
gfx1250,256,4,512,4096,False,torch.bfloat16,torch.bfloat16,False,False,triton,0,0,0.0,auto,0.0,0.0,0.0
gfx1250,256,4,512,7168,False,torch.bfloat16,torch.bfloat16,False,False,opus,20129,8,9.1127,opus_gemm_gfx1250_splitk_clusterlaunch_tdm_ws_128x16x32x256_1x2_16x16x32_0x0x0_c1x4_p3w2,0.0,3.22,812.22
gfx1250,256,8,512,4096,False,torch.bfloat16,torch.bfloat16,False,False,triton,0,0,0.0,auto,0.0,0.0,0.0
gfx1250,256,8,512,7168,False,torch.bfloat16,torch.bfloat16,False,False,opus,20129,9,8.8432,opus_gemm_gfx1250_splitk_clusterlaunch_tdm_ws_128x16x32x256_1x2_16x16x32_0x0x0_c1x4_p3w2,0.0,6.64,843.92
gfx1250,256,16,512,4096,False,torch.bfloat16,torch.bfloat16,False,False,triton,0,0,7.6175,auto,0.0,8.81,569.97
gfx1250,256,16,512,7168,False,torch.bfloat16,torch.bfloat16,False,False,opus,20129,8,8.5821,opus_gemm_gfx1250_splitk_clusterlaunch_tdm_ws_128x16x32x256_1x2_16x16x32_0x0x0_c1x4_p3w2,0.0,13.68,883.91
gfx1250,256,32,512,4096,False,torch.bfloat16,torch.bfloat16,False,False,opus,20129,4,7.9754,opus_gemm_gfx1250_splitk_clusterlaunch_tdm_ws_128x16x32x256_1x2_16x16x32_0x0x0_c1x4_p3w2,0.0,16.83,562.88
gfx1250,256,32,512,7168,False,torch.bfloat16,torch.bfloat16,False,False,opus,20129,6,8.5171,opus_gemm_gfx1250_splitk_clusterlaunch_tdm_ws_128x16x32x256_1x2_16x16x32_0x0x0_c1x4_p3w2,0.0,27.58,919.51
gfx1250,256,48,512,4096,False,torch.bfloat16,torch.bfloat16,False,False,opus,20121,3,7.5892,opus_gemm_gfx1250_splitk_clusterlaunch_tdm_ws_128x16x32x256_1x2_16x16x32_0x0x0_c1x2_p3w2,0.0,26.53,610.96
gfx1250,256,48,512,7168,False,torch.bfloat16,torch.bfloat16,False,False,opus,20255,4,8.3751,opus_gemm_gfx1250_splitk_clusterlaunch_tdm_ws_128x32x32x256_2x1_16x16x32_0x0x0_c1x4_p3w2,0.0,42.07,964.44
gfx1250,256,64,512,4096,False,torch.bfloat16,torch.bfloat16,False,False,triton,0,0,7.7603,auto,0.0,34.59,616.49
gfx1250,256,64,512,7168,False,torch.bfloat16,torch.bfloat16,False,False,opus,20129,4,8.7539,opus_gemm_gfx1250_splitk_clusterlaunch_tdm_ws_128x16x32x256_1x2_16x16x32_0x0x0_c1x4_p3w2,0.0,53.66,950.78
gfx1250,256,80,512,4096,False,torch.bfloat16,torch.bfloat16,False,False,opus,20121,3,7.7683,opus_gemm_gfx1250_splitk_clusterlaunch_tdm_ws_128x16x32x256_1x2_16x16x32_0x0x0_c1x2_p3w2,0.0,43.19,634.83
gfx1250,256,80,512,7168,False,torch.bfloat16,torch.bfloat16,False,False,opus,20247,4,9.2903,opus_gemm_gfx1250_splitk_clusterlaunch_tdm_ws_128x32x32x256_2x1_16x16x32_0x0x0_c1x2_p3w2,0.0,63.21,922.34
gfx1250,256,96,512,4096,False,torch.bfloat16,torch.bfloat16,False,False,opus,20129,2,7.9592,opus_gemm_gfx1250_splitk_clusterlaunch_tdm_ws_128x16x32x256_1x2_16x16x32_0x0x0_c1x4_p3w2,0.0,50.59,638.13
gfx1250,256,96,512,7168,False,torch.bfloat16,torch.bfloat16,False,False,opus,20255,4,9.3544,opus_gemm_gfx1250_splitk_clusterlaunch_tdm_ws_128x32x32x256_2x1_16x16x32_0x0x0_c1x4_p3w2,0.0,75.33,942.29
gfx1250,256,112,512,4096,False,torch.bfloat16,torch.bfloat16,False,False,triton,0,0,7.9572,auto,0.0,59.04,656.83
gfx1250,256,112,512,7168,False,torch.bfloat16,torch.bfloat16,False,False,opus,20255,3,9.7729,opus_gemm_gfx1250_splitk_clusterlaunch_tdm_ws_128x32x32x256_2x1_16x16x32_0x0x0_c1x4_p3w2,0.0,84.12,927.09
gfx1250,256,128,512,4096,False,torch.bfloat16,torch.bfloat16,False,False,triton,0,0,7.9701,auto,0.0,67.36,674.26
gfx1250,256,128,512,7168,False,torch.bfloat16,torch.bfloat16,False,False,opus,20255,5,9.3922,opus_gemm_gfx1250_splitk_clusterlaunch_tdm_ws_128x32x32x256_2x1_16x16x32_0x0x0_c1x4_p3w2,0.0,100.03,990.83
gfx1250,256,144,512,4096,False,torch.bfloat16,torch.bfloat16,False,False,triton,0,0,8.1499,auto,0.0,74.11,677.48
gfx1250,256,144,512,7168,False,torch.bfloat16,torch.bfloat16,False,False,opus,20255,4,9.9154,opus_gemm_gfx1250_splitk_clusterlaunch_tdm_ws_128x32x32x256_2x1_16x16x32_0x0x0_c1x4_p3w2,0.0,106.6,963.34
gfx1250,256,160,512,4096,False,torch.bfloat16,torch.bfloat16,False,False,opus,20255,3,8.1869,opus_gemm_gfx1250_splitk_clusterlaunch_tdm_ws_128x32x32x256_2x1_16x16x32_0x0x0_c1x4_p3w2,0.0,81.97,692.43
gfx1250,256,160,512,7168,False,torch.bfloat16,torch.bfloat16,False,False,opus,20255,4,10.1423,opus_gemm_gfx1250_splitk_clusterlaunch_tdm_ws_128x32x32x256_2x1_16x16x32_0x0x0_c1x4_p3w2,0.0,115.79,966.02
gfx1250,256,176,512,4096,False,torch.bfloat16,torch.bfloat16,False,False,triton,0,0,8.1477,auto,0.0,90.6,713.86
gfx1250,256,176,512,7168,False,torch.bfloat16,torch.bfloat16,False,False,opus,20255,3,10.0649,opus_gemm_gfx1250_splitk_clusterlaunch_tdm_ws_128x32x32x256_2x1_16x16x32_0x0x0_c1x4_p3w2,0.0,128.35,997.86
gfx1250,256,192,512,4096,False,torch.bfloat16,torch.bfloat16,False,False,triton,0,0,8.1968,auto,0.0,98.25,727.57
gfx1250,256,192,512,7168,False,torch.bfloat16,torch.bfloat16,False,False,opus,20255,4,10.4139,opus_gemm_gfx1250_splitk_clusterlaunch_tdm_ws_128x32x32x256_2x1_16x16x32_0x0x0_c1x4_p3w2,0.0,135.33,988.02
gfx1250,256,208,512,4096,False,torch.bfloat16,torch.bfloat16,False,False,triton,0,0,8.2246,auto,0.0,106.07,743.04
gfx1250,256,208,512,7168,False,torch.bfloat16,torch.bfloat16,False,False,opus,20255,4,11.0535,opus_gemm_gfx1250_splitk_clusterlaunch_tdm_ws_128x32x32x256_2x1_16x16x32_0x0x0_c1x4_p3w2,0.0,138.12,953.08
gfx1250,256,224,512,4096,False,torch.bfloat16,torch.bfloat16,False,False,triton,0,0,8.2712,auto,0.0,113.59,756.68
gfx1250,256,224,512,7168,False,torch.bfloat16,torch.bfloat16,False,False,opus,20255,3,11.0269,opus_gemm_gfx1250_splitk_clusterlaunch_tdm_ws_128x32x32x256_2x1_16x16x32_0x0x0_c1x4_p3w2,0.0,149.11,977.67
gfx1250,256,240,512,4096,False,torch.bfloat16,torch.bfloat16,False,False,triton,0,0,8.2307,auto,0.0,122.3,778.32
gfx1250,256,240,512,7168,False,torch.bfloat16,torch.bfloat16,False,False,opus,20255,3,11.3441,opus_gemm_gfx1250_splitk_clusterlaunch_tdm_ws_128x32x32x256_2x1_16x16x32_0x0x0_c1x4_p3w2,0.0,155.29,972.0
gfx1250,256,256,512,4096,False,torch.bfloat16,torch.bfloat16,False,False,triton,0,0,8.1686,auto,0.0,131.45,802.29
gfx1250,256,256,512,7168,False,torch.bfloat16,torch.bfloat16,False,False,opus,20255,3,11.417,opus_gemm_gfx1250_splitk_clusterlaunch_tdm_ws_128x32x32x256_2x1_16x16x32_0x0x0_c1x4_p3w2,0.0,164.58,987.32
gfx1250,256,288,512,4096,False,torch.bfloat16,torch.bfloat16,False,False,triton,0,0,8.3227,auto,0.0,145.14,822.87
gfx1250,256,288,512,7168,False,torch.bfloat16,torch.bfloat16,False,False,opus,20255,3,11.6646,opus_gemm_gfx1250_splitk_clusterlaunch_tdm_ws_128x32x32x256_2x1_16x16x32_0x0x0_c1x4_p3w2,0.0,181.23,1008.5
gfx1250,256,320,512,4096,False,torch.bfloat16,torch.bfloat16,False,False,triton,0,0,8.2361,auto,0.0,162.96,867.33
gfx1250,256,320,512,7168,False,torch.bfloat16,torch.bfloat16,False,False,opus,20291,3,12.4357,opus_gemm_gfx1250_splitk_clusterlaunch_tdm_ws_128x32x64x256_2x1_16x16x32_0x0x0_c1x4_p3w2,0.0,188.88,985.49
gfx1250,256,352,512,4096,False,torch.bfloat16,torch.bfloat16,False,False,triton,0,0,8.3342,auto,0.0,177.15,892.51
gfx1250,256,352,512,7168,False,torch.bfloat16,torch.bfloat16,False,False,opus,20255,2,13.5326,opus_gemm_gfx1250_splitk_clusterlaunch_tdm_ws_128x32x32x256_2x1_16x16x32_0x0x0_c1x4_p3w2,0.0,190.92,941.93
gfx1250,256,384,512,4096,False,torch.bfloat16,torch.bfloat16,False,False,triton,0,0,8.3583,auto,0.0,192.7,925.22
gfx1250,256,384,512,7168,False,torch.bfloat16,torch.bfloat16,False,False,opus,20255,2,13.9395,opus_gemm_gfx1250_splitk_clusterlaunch_tdm_ws_128x32x32x256_2x1_16x16x32_0x0x0_c1x4_p3w2,0.0,202.2,949.69
gfx1250,256,416,512,4096,False,torch.bfloat16,torch.bfloat16,False,False,triton,0,0,8.5186,auto,0.0,204.83,942.43
gfx1250,256,416,512,7168,False,torch.bfloat16,torch.bfloat16,False,False,opus,20255,2,15.0449,opus_gemm_gfx1250_splitk_clusterlaunch_tdm_ws_128x32x32x256_2x1_16x16x32_0x0x0_c1x4_p3w2,0.0,202.96,912.59
gfx1250,256,448,512,4096,False,torch.bfloat16,torch.bfloat16,False,False,triton,0,0,8.573,auto,0.0,219.18,970.85
gfx1250,256,448,512,7168,False,torch.bfloat16,torch.bfloat16,False,False,opus,20255,2,17.2312,opus_gemm_gfx1250_splitk_clusterlaunch_tdm_ws_128x32x32x256_2x1_16x16x32_0x0x0_c1x4_p3w2,0.0,190.84,825.32
gfx1250,256,480,512,4096,False,torch.bfloat16,torch.bfloat16,False,False,triton,0,0,8.6065,auto,0.0,233.92,1001.33
gfx1250,256,480,512,7168,False,torch.bfloat16,torch.bfloat16,False,False,opus,20381,2,13.0174,opus_gemm_gfx1250_splitk_clusterlaunch_tdm_ws_128x64x32x256_2x1_16x16x32_0x0x0_c1x4_p3w2,0.0,270.65,1130.24
gfx1250,256,512,512,4096,False,torch.bfloat16,torch.bfloat16,False,False,triton,0,0,8.5216,auto,0.0,252.0,1045.92
gfx1250,256,512,512,7168,False,torch.bfloat16,torch.bfloat16,False,False,opus,20291,1,22.2123,opus_gemm_gfx1250_splitk_clusterlaunch_tdm_ws_128x32x64x256_2x1_16x16x32_0x0x0_c1x4_p3w2,0.0,169.19,684.5
gfx1250,256,1024,512,4096,False,torch.bfloat16,torch.bfloat16,False,False,triton,0,0,0.0,auto,0.0,0.0,0.0
gfx1250,256,2048,512,4096,False,torch.bfloat16,torch.bfloat16,False,False,triton,0,0,0.0,auto,0.0,0.0,0.0
gfx1250,256,4096,512,4096,False,torch.bfloat16,torch.bfloat16,False,False,triton,0,0,0.0,auto,0.0,0.0,0.0
gfx1250,256,8192,512,4096,False,torch.bfloat16,torch.bfloat16,False,False,triton,0,0,0.0,auto,0.0,0.0,0.0
gfx1250,256,16384,512,4096,False,torch.bfloat16,torch.bfloat16,False,False,triton,0,0,0.0,auto,0.0,0.0,0.0
gfx1250,256,1,1024,4096,False,torch.bfloat16,torch.bfloat16,False,False,triton,0,0,0.0,auto,0.0,0.0,0.0
gfx1250,256,1,1024,7168,False,torch.bfloat16,torch.bfloat16,False,False,opus,20129,5,8.6516,opus_gemm_gfx1250_splitk_clusterlaunch_tdm_ws_128x16x32x256_1x2_16x16x32_0x0x0_c1x4_p3w2,0.0,1.7,1698.7
gfx1250,256,2,1024,4096,False,torch.bfloat16,torch.bfloat16,False,False,triton,0,0,0.0,auto,0.0,0.0,0.0
gfx1250,256,2,1024,7168,False,torch.bfloat16,torch.bfloat16,False,False,opus,20129,5,9.259,opus_gemm_gfx1250_splitk_clusterlaunch_tdm_ws_128x16x32x256_1x2_16x16x32_0x0x0_c1x4_p3w2,0.0,3.17,1589.03
gfx1250,256,4,1024,4096,False,torch.bfloat16,torch.bfloat16,False,False,triton,0,0,0.0,auto,0.0,0.0,0.0
gfx1250,256,4,1024,7168,False,torch.bfloat16,torch.bfloat16,False,False,opus,20255,5,8.7777,opus_gemm_gfx1250_splitk_clusterlaunch_tdm_ws_128x32x32x256_2x1_16x16x32_0x0x0_c1x4_p3w2,0.0,6.69,1679.89
gfx1250,256,8,1024,4096,False,torch.bfloat16,torch.bfloat16,False,False,triton,0,0,0.0,auto,0.0,0.0,0.0
gfx1250,256,8,1024,7168,False,torch.bfloat16,torch.bfloat16,False,False,opus,20129,5,8.4771,opus_gemm_gfx1250_splitk_clusterlaunch_tdm_ws_128x16x32x256_1x2_16x16x32_0x0x0_c1x4_p3w2,0.0,13.85,1747.19
gfx1250,256,16,1024,4096,False,torch.bfloat16,torch.bfloat16,False,False,opus,20129,4,7.5248,opus_gemm_gfx1250_splitk_clusterlaunch_tdm_ws_128x16x32x256_1x2_16x16x32_0x0x0_c1x4_p3w2,0.0,17.84,1136.57
gfx1250,256,16,1024,7168,False,torch.bfloat16,torch.bfloat16,False,False,opus,20255,5,9.364,opus_gemm_gfx1250_splitk_clusterlaunch_tdm_ws_128x32x32x256_2x1_16x16x32_0x0x0_c1x4_p3w2,0.0,25.08,1595.71
gfx1250,256,24,1024,7168,False,torch.bfloat16,torch.bfloat16,False,False,opus,20157,5,9.3077,opus_gemm_gfx1250_splitk_clusterlaunch_tdm_ws_128x16x64x256_1x2_16x16x32_0x0x0_c1x2_p3w2,0.0,37.85,1619.44
gfx1250,256,32,1024,4096,False,torch.bfloat16,torch.bfloat16,False,False,opus,20129,3,7.7062,opus_gemm_gfx1250_splitk_clusterlaunch_tdm_ws_128x16x32x256_1x2_16x16x32_0x0x0_c1x4_p3w2,0.0,34.83,1131.07
gfx1250,256,32,1024,7168,False,torch.bfloat16,torch.bfloat16,False,False,opus,20255,4,9.446,opus_gemm_gfx1250_splitk_clusterlaunch_tdm_ws_128x32x32x256_2x1_16x16x32_0x0x0_c1x4_p3w2,0.0,49.73,1609.61
gfx1250,256,40,1024,7168,False,torch.bfloat16,torch.bfloat16,False,False,opus,20157,5,9.828,opus_gemm_gfx1250_splitk_clusterlaunch_tdm_ws_128x16x64x256_1x2_16x16x32_0x0x0_c1x2_p3w2,0.0,59.75,1560.38
gfx1250,256,48,1024,4096,False,torch.bfloat16,torch.bfloat16,False,False,triton,0,0,7.6648,auto,0.0,52.53,1158.56
gfx1250,256,48,1024,7168,False,torch.bfloat16,torch.bfloat16,False,False,opus,20255,4,9.8131,opus_gemm_gfx1250_splitk_clusterlaunch_tdm_ws_128x32x32x256_2x1_16x16x32_0x0x0_c1x4_p3w2,0.0,71.81,1576.11
gfx1250,256,56,1024,7168,False,torch.bfloat16,torch.bfloat16,False,False,opus,20255,5,10.6431,opus_gemm_gfx1250_splitk_clusterlaunch_tdm_ws_128x32x32x256_2x1_16x16x32_0x0x0_c1x4_p3w2,0.0,77.24,1465.51
gfx1250,256,64,1024,4096,False,torch.bfloat16,torch.bfloat16,False,False,opus,20255,3,8.3442,opus_gemm_gfx1250_splitk_clusterlaunch_tdm_ws_128x32x32x256_2x1_16x16x32_0x0x0_c1x4_p3w2,0.0,64.34,1083.86
gfx1250,256,64,1024,7168,False,torch.bfloat16,torch.bfloat16,False,False,opus,20255,5,10.4329,opus_gemm_gfx1250_splitk_clusterlaunch_tdm_ws_128x32x32x256_2x1_16x16x32_0x0x0_c1x4_p3w2,0.0,90.05,1507.6
gfx1250,256,72,1024,7168,False,torch.bfloat16,torch.bfloat16,False,False,opus,20255,4,11.0152,opus_gemm_gfx1250_splitk_clusterlaunch_tdm_ws_128x32x32x256_2x1_16x16x32_0x0x0_c1x4_p3w2,0.0,95.96,1439.8
gfx1250,256,80,1024,4096,False,torch.bfloat16,torch.bfloat16,False,False,opus,20255,3,8.3408,opus_gemm_gfx1250_splitk_clusterlaunch_tdm_ws_128x32x32x256_2x1_16x16x32_0x0x0_c1x4_p3w2,0.0,80.46,1103.95
gfx1250,256,80,1024,7168,False,torch.bfloat16,torch.bfloat16,False,False,opus,20255,3,10.4768,opus_gemm_gfx1250_splitk_clusterlaunch_tdm_ws_128x32x32x256_2x1_16x16x32_0x0x0_c1x4_p3w2,0.0,112.1,1526.3
gfx1250,256,88,1024,7168,False,torch.bfloat16,torch.bfloat16,False,False,opus,20255,3,10.6753,opus_gemm_gfx1250_splitk_clusterlaunch_tdm_ws_128x32x32x256_2x1_16x16x32_0x0x0_c1x4_p3w2,0.0,121.01,1510.2
gfx1250,256,96,1024,4096,False,torch.bfloat16,torch.bfloat16,False,False,opus,20255,3,8.3803,opus_gemm_gfx1250_splitk_clusterlaunch_tdm_ws_128x32x32x256_2x1_16x16x32_0x0x0_c1x4_p3w2,0.0,96.1,1118.3
gfx1250,256,96,1024,7168,False,torch.bfloat16,torch.bfloat16,False,False,opus,20255,4,10.8389,opus_gemm_gfx1250_splitk_clusterlaunch_tdm_ws_128x32x32x256_2x1_16x16x32_0x0x0_c1x4_p3w2,0.0,130.02,1499.5
gfx1250,256,104,1024,7168,False,torch.bfloat16,torch.bfloat16,False,False,opus,20255,3,11.5446,opus_gemm_gfx1250_splitk_clusterlaunch_tdm_ws_128x32x32x256_2x1_16x16x32_0x0x0_c1x4_p3w2,0.0,132.25,1419.19
gfx1250,256,112,1024,4096,False,torch.bfloat16,torch.bfloat16,False,False,opus,20255,2,9.1654,opus_gemm_gfx1250_splitk_clusterlaunch_tdm_ws_128x32x32x256_2x1_16x16x32_0x0x0_c1x4_p3w2,0.0,102.51,1040.38
gfx1250,256,112,1024,7168,False,torch.bfloat16,torch.bfloat16,False,False,opus,20255,3,11.6073,opus_gemm_gfx1250_splitk_clusterlaunch_tdm_ws_128x32x32x256_2x1_16x16x32_0x0x0_c1x4_p3w2,0.0,141.65,1422.82
gfx1250,256,120,1024,7168,False,torch.bfloat16,torch.bfloat16,False,False,opus,20255,3,11.6515,opus_gemm_gfx1250_splitk_clusterlaunch_tdm_ws_128x32x32x256_2x1_16x16x32_0x0x0_c1x4_p3w2,0.0,151.19,1428.67
gfx1250,256,128,1024,4096,False,torch.bfloat16,torch.bfloat16,False,False,opus,20255,2,9.2146,opus_gemm_gfx1250_splitk_clusterlaunch_tdm_ws_128x32x32x256_2x1_16x16x32_0x0x0_c1x4_p3w2,0.0,116.53,1052.6
gfx1250,256,128,1024,7168,False,torch.bfloat16,torch.bfloat16,False,False,opus,20255,3,11.7021,opus_gemm_gfx1250_splitk_clusterlaunch_tdm_ws_128x32x32x256_2x1_16x16x32_0x0x0_c1x4_p3w2,0.0,160.57,1433.69
gfx1250,256,136,1024,7168,False,torch.bfloat16,torch.bfloat16,False,False,opus,20255,3,12.2549,opus_gemm_gfx1250_splitk_clusterlaunch_tdm_ws_128x32x32x256_2x1_16x16x32_0x0x0_c1x4_p3w2,0.0,162.91,1379.72
gfx1250,256,144,1024,4096,False,torch.bfloat16,torch.bfloat16,False,False,opus,20255,3,9.4814,opus_gemm_gfx1250_splitk_clusterlaunch_tdm_ws_128x32x32x256_2x1_16x16x32_0x0x0_c1x4_p3w2,0.0,127.4,1040.26
gfx1250,256,144,1024,7168,False,torch.bfloat16,torch.bfloat16,False,False,opus,20255,3,12.2011,opus_gemm_gfx1250_splitk_clusterlaunch_tdm_ws_128x32x32x256_2x1_16x16x32_0x0x0_c1x4_p3w2,0.0,173.26,1396.54
gfx1250,256,152,1024,7168,False,torch.bfloat16,torch.bfloat16,False,False,opus,20255,3,11.9881,opus_gemm_gfx1250_splitk_clusterlaunch_tdm_ws_128x32x32x256_2x1_16x16x32_0x0x0_c1x4_p3w2,0.0,186.13,1432.29
gfx1250,256,160,1024,4096,False,torch.bfloat16,torch.bfloat16,False,False,opus,20255,3,9.6249,opus_gemm_gfx1250_splitk_clusterlaunch_tdm_ws_128x32x32x256_2x1_16x16x32_0x0x0_c1x4_p3w2,0.0,139.45,1041.78
gfx1250,256,160,1024,7168,False,torch.bfloat16,torch.bfloat16,False,False,opus,20255,3,12.0662,opus_gemm_gfx1250_splitk_clusterlaunch_tdm_ws_128x32x32x256_2x1_16x16x32_0x0x0_c1x4_p3w2,0.0,194.66,1433.88
gfx1250,256,168,1024,7168,False,torch.bfloat16,torch.bfloat16,False,False,opus,20291,2,12.8451,opus_gemm_gfx1250_splitk_clusterlaunch_tdm_ws_128x32x64x256_2x1_16x16x32_0x0x0_c1x4_p3w2,0.0,192.0,1357.14
gfx1250,256,176,1024,4096,False,torch.bfloat16,torch.bfloat16,False,False,opus,20291,2,9.886,opus_gemm_gfx1250_splitk_clusterlaunch_tdm_ws_128x32x64x256_2x1_16x16x32_0x0x0_c1x4_p3w2,0.0,149.34,1030.84
gfx1250,256,176,1024,7168,False,torch.bfloat16,torch.bfloat16,False,False,opus,20291,2,12.7881,opus_gemm_gfx1250_splitk_clusterlaunch_tdm_ws_128x32x64x256_2x1_16x16x32_0x0x0_c1x4_p3w2,0.0,202.04,1373.44
gfx1250,256,184,1024,7168,False,torch.bfloat16,torch.bfloat16,False,False,opus,20291,2,13.0105,opus_gemm_gfx1250_splitk_clusterlaunch_tdm_ws_128x32x64x256_2x1_16x16x32_0x0x0_c1x4_p3w2,0.0,207.61,1360.03
gfx1250,256,192,1024,4096,False,torch.bfloat16,torch.bfloat16,False,False,opus,20291,2,9.9641,opus_gemm_gfx1250_splitk_clusterlaunch_tdm_ws_128x32x64x256_2x1_16x16x32_0x0x0_c1x4_p3w2,0.0,161.64,1039.2
gfx1250,256,192,1024,7168,False,torch.bfloat16,torch.bfloat16,False,False,opus,20255,2,13.001,opus_gemm_gfx1250_splitk_clusterlaunch_tdm_ws_128x32x32x256_2x1_16x16x32_0x0x0_c1x4_p3w2,0.0,216.8,1371.11
gfx1250,256,200,1024,7168,False,torch.bfloat16,torch.bfloat16,False,False,opus,20381,3,13.3686,opus_gemm_gfx1250_splitk_clusterlaunch_tdm_ws_128x64x32x256_2x1_16x16x32_0x0x0_c1x4_p3w2,0.0,219.62,1343.21
gfx1250,256,208,1024,4096,False,torch.bfloat16,torch.bfloat16,False,False,opus,20381,2,10.9492,opus_gemm_gfx1250_splitk_clusterlaunch_tdm_ws_128x64x32x256_2x1_16x16x32_0x0x0_c1x4_p3w2,0.0,159.36,960.67
gfx1250,256,208,1024,7168,False,torch.bfloat16,torch.bfloat16,False,False,opus,20381,2,12.8668,opus_gemm_gfx1250_splitk_clusterlaunch_tdm_ws_128x64x32x256_2x1_16x16x32_0x0x0_c1x4_p3w2,0.0,237.31,1405.78
gfx1250,256,216,1024,7168,False,torch.bfloat16,torch.bfloat16,False,False,opus,20381,2,13.154,opus_gemm_gfx1250_splitk_clusterlaunch_tdm_ws_128x64x32x256_2x1_16x16x32_0x0x0_c1x4_p3w2,0.0,241.06,1385.05
gfx1250,256,224,1024,4096,False,torch.bfloat16,torch.bfloat16,False,False,opus,20381,2,10.6007,opus_gemm_gfx1250_splitk_clusterlaunch_tdm_ws_128x64x32x256_2x1_16x16x32_0x0x0_c1x4_p3w2,0.0,177.26,1007.7
gfx1250,256,224,1024,7168,False,torch.bfloat16,torch.bfloat16,False,False,opus,20381,2,13.0475,opus_gemm_gfx1250_splitk_clusterlaunch_tdm_ws_128x64x32x256_2x1_16x16x32_0x0x0_c1x4_p3w2,0.0,252.03,1406.41
gfx1250,256,232,1024,7168,False,torch.bfloat16,torch.bfloat16,False,False,opus,20291,2,14.0645,opus_gemm_gfx1250_splitk_clusterlaunch_tdm_ws_128x32x64x256_2x1_16x16x32_0x0x0_c1x4_p3w2,0.0,242.15,1314.03
gfx1250,256,240,1024,4096,False,torch.bfloat16,torch.bfloat16,False,False,opus,20291,2,10.8075,opus_gemm_gfx1250_splitk_clusterlaunch_tdm_ws_128x32x64x256_2x1_16x16x32_0x0x0_c1x4_p3w2,0.0,186.28,1003.58
gfx1250,256,240,1024,7168,False,torch.bfloat16,torch.bfloat16,False,False,opus,20363,3,14.0434,opus_gemm_gfx1250_splitk_clusterlaunch_tdm_ws_128x64x32x128_2x1_16x16x32_0x0x0_c1x4_p3w2,0.0,250.88,1325.34
gfx1250,256,248,1024,7168,False,torch.bfloat16,torch.bfloat16,False,False,opus,20291,2,14.1132,opus_gemm_gfx1250_splitk_clusterlaunch_tdm_ws_128x32x64x256_2x1_16x16x32_0x0x0_c1x4_p3w2,0.0,257.96,1328.07
gfx1250,256,256,1024,4096,False,torch.bfloat16,torch.bfloat16,False,False,triton,0,0,10.9185,auto,0.0,196.68,1008.38
gfx1250,256,256,1024,7168,False,torch.bfloat16,torch.bfloat16,False,False,opus,20291,2,13.9715,opus_gemm_gfx1250_splitk_clusterlaunch_tdm_ws_128x32x64x256_2x1_16x16x32_0x0x0_c1x4_p3w2,0.0,268.98,1350.92
gfx1250,256,264,1024,7168,False,torch.bfloat16,torch.bfloat16,False,False,opus,20381,3,13.9507,opus_gemm_gfx1250_splitk_clusterlaunch_tdm_ws_128x64x32x256_2x1_16x16x32_0x0x0_c1x4_p3w2,0.0,277.8,1362.33
gfx1250,256,272,1024,7168,False,torch.bfloat16,torch.bfloat16,False,False,opus,20381,3,13.6133,opus_gemm_gfx1250_splitk_clusterlaunch_tdm_ws_128x64x32x256_2x1_16x16x32_0x0x0_c1x4_p3w2,0.0,293.31,1405.72
gfx1250,256,280,1024,7168,False,torch.bfloat16,torch.bfloat16,False,False,opus,20381,3,13.9964,opus_gemm_gfx1250_splitk_clusterlaunch_tdm_ws_128x64x32x256_2x1_16x16x32_0x0x0_c1x4_p3w2,0.0,293.68,1376.61
gfx1250,256,288,1024,4096,False,torch.bfloat16,torch.bfloat16,False,False,triton,0,0,11.0536,auto,0.0,218.56,1025.7
gfx1250,256,288,1024,7168,False,torch.bfloat16,torch.bfloat16,False,False,opus,20381,3,13.845,opus_gemm_gfx1250_splitk_clusterlaunch_tdm_ws_128x64x32x256_2x1_16x16x32_0x0x0_c1x4_p3w2,0.0,305.37,1401.13
gfx1250,256,296,1024,7168,False,torch.bfloat16,torch.bfloat16,False,False,opus,20381,3,14.1921,opus_gemm_gfx1250_splitk_clusterlaunch_tdm_ws_128x64x32x256_2x1_16x16x32_0x0x0_c1x4_p3w2,0.0,306.18,1376.1
gfx1250,256,304,1024,7168,False,torch.bfloat16,torch.bfloat16,False,False,opus,20381,3,14.1492,opus_gemm_gfx1250_splitk_clusterlaunch_tdm_ws_128x64x32x256_2x1_16x16x32_0x0x0_c1x4_p3w2,0.0,315.41,1389.53
gfx1250,256,312,1024,7168,False,torch.bfloat16,torch.bfloat16,False,False,opus,20381,3,14.1842,opus_gemm_gfx1250_splitk_clusterlaunch_tdm_ws_128x64x32x256_2x1_16x16x32_0x0x0_c1x4_p3w2,0.0,322.91,1395.35
gfx1250,256,320,1024,4096,False,torch.bfloat16,torch.bfloat16,False,False,triton,0,0,10.9849,auto,0.0,244.37,1061.95
gfx1250,256,320,1024,7168,False,torch.bfloat16,torch.bfloat16,False,False,opus,20381,3,14.0457,opus_gemm_gfx1250_splitk_clusterlaunch_tdm_ws_128x64x32x256_2x1_16x16x32_0x0x0_c1x4_p3w2,0.0,334.45,1418.44
gfx1250,256,328,1024,7168,False,torch.bfloat16,torch.bfloat16,False,False,opus,20399,4,15.1487,opus_gemm_gfx1250_splitk_clusterlaunch_tdm_ws_128x64x64x128_2x1_16x16x32_0x0x0_c1x4_p3w2,0.0,317.85,1323.81
gfx1250,256,336,1024,7168,False,torch.bfloat16,torch.bfloat16,False,False,opus,20399,4,15.2083,opus_gemm_gfx1250_splitk_clusterlaunch_tdm_ws_128x64x64x128_2x1_16x16x32_0x0x0_c1x4_p3w2,0.0,324.33,1327.24
gfx1250,256,344,1024,7168,False,torch.bfloat16,torch.bfloat16,False,False,opus,20399,4,15.1772,opus_gemm_gfx1250_splitk_clusterlaunch_tdm_ws_128x64x64x128_2x1_16x16x32_0x0x0_c1x4_p3w2,0.0,332.73,1338.6
gfx1250,256,352,1024,4096,False,torch.bfloat16,torch.bfloat16,False,False,triton,0,0,11.2843,auto,0.0,261.67,1062.81
gfx1250,256,352,1024,7168,False,torch.bfloat16,torch.bfloat16,False,False,opus,20399,4,15.1954,opus_gemm_gfx1250_splitk_clusterlaunch_tdm_ws_128x64x64x128_2x1_16x16x32_0x0x0_c1x4_p3w2,0.0,340.06,1345.62
gfx1250,256,376,1024,7168,False,torch.bfloat16,torch.bfloat16,False,False,opus,20399,4,15.1924,opus_gemm_gfx1250_splitk_clusterlaunch_tdm_ws_128x64x64x128_2x1_16x16x32_0x0x0_c1x4_p3w2,0.0,363.32,1371.77
gfx1250,256,384,1024,4096,False,torch.bfloat16,torch.bfloat16,False,False,triton,0,0,11.1356,auto,0.0,289.27,1106.43
gfx1250,256,384,1024,7168,False,torch.bfloat16,torch.bfloat16,False,False,opus,20399,4,15.35,opus_gemm_gfx1250_splitk_clusterlaunch_tdm_ws_128x64x64x128_2x1_16x16x32_0x0x0_c1x4_p3w2,0.0,367.24,1366.22
gfx1250,256,416,1024,4096,False,torch.bfloat16,torch.bfloat16,False,False,triton,0,0,11.3369,auto,0.0,307.81,1115.69
gfx1250,256,416,1024,7168,False,torch.bfloat16,torch.bfloat16,False,False,opus,20381,2,16.6096,opus_gemm_gfx1250_splitk_clusterlaunch_tdm_ws_128x64x32x256_2x1_16x16x32_0x0x0_c1x4_p3w2,0.0,367.67,1294.18
gfx1250,256,448,1024,4096,False,torch.bfloat16,torch.bfloat16,False,False,triton,0,0,11.3939,auto,0.0,329.83,1138.87
gfx1250,256,448,1024,7168,False,torch.bfloat16,torch.bfloat16,False,False,opus,20507,2,16.7845,opus_gemm_gfx1250_splitk_clusterlaunch_tdm_ws_128x128x32x256_2x1_16x16x32_0x0x0_c1x4_p3w1,0.0,391.83,1311.93
gfx1250,256,480,1024,4096,False,torch.bfloat16,torch.bfloat16,False,False,triton,0,0,11.6977,auto,0.0,344.22,1137.3
gfx1250,256,480,1024,7168,False,torch.bfloat16,torch.bfloat16,False,False,opus,20417,2,16.0347,opus_gemm_gfx1250_splitk_clusterlaunch_tdm_ws_128x64x64x256_2x1_16x16x32_0x0x0_c1x4_p3w1,0.0,439.45,1405.97
gfx1250,256,512,1024,4096,False,torch.bfloat16,torch.bfloat16,False,False,triton,0,0,11.6015,auto,0.0,370.21,1174.98
gfx1250,256,512,1024,7168,False,torch.bfloat16,torch.bfloat16,False,False,opus,20399,3,17.7083,opus_gemm_gfx1250_splitk_clusterlaunch_tdm_ws_128x64x64x128_2x1_16x16x32_0x0x0_c1x4_p3w2,0.0,424.44,1302.7
gfx1250,256,1024,1024,4096,False,torch.bfloat16,torch.bfloat16,False,False,triton,0,0,0.0,auto,0.0,0.0,0.0
gfx1250,256,2048,1024,4096,False,torch.bfloat16,torch.bfloat16,False,False,triton,0,0,0.0,auto,0.0,0.0,0.0
gfx1250,256,4096,1024,4096,False,torch.bfloat16,torch.bfloat16,False,False,triton,0,0,0.0,auto,0.0,0.0,0.0
gfx1250,256,8192,1024,4096,False,torch.bfloat16,torch.bfloat16,False,False,triton,0,0,0.0,auto,0.0,0.0,0.0
gfx1250,256,16384,1024,4096,False,torch.bfloat16,torch.bfloat16,False,False,triton,0,0,0.0,auto,0.0,0.0,0.0
gfx1250,256,1,2048,4096,False,torch.bfloat16,torch.bfloat16,False,False,triton,0,0,0.0,auto,0.0,0.0,0.0
gfx1250,256,1,2048,7168,False,torch.bfloat16,torch.bfloat16,False,False,opus,20129,5,9.0734,opus_gemm_gfx1250_splitk_clusterlaunch_tdm_ws_128x16x32x256_1x2_16x16x32_0x0x0_c1x4_p3w2,0.0,3.24,3237.88
gfx1250,256,2,2048,4096,False,torch.bfloat16,torch.bfloat16,False,False,triton,0,0,0.0,auto,0.0,0.0,0.0
gfx1250,256,2,2048,7168,False,torch.bfloat16,torch.bfloat16,False,False,opus,20129,4,9.2967,opus_gemm_gfx1250_splitk_clusterlaunch_tdm_ws_128x16x32x256_1x2_16x16x32_0x0x0_c1x4_p3w2,0.0,6.32,3162.09
gfx1250,256,4,2048,4096,False,torch.bfloat16,torch.bfloat16,False,False,triton,0,0,0.0,auto,0.0,0.0,0.0
gfx1250,256,4,2048,7168,False,torch.bfloat16,torch.bfloat16,False,False,opus,20129,4,9.6399,opus_gemm_gfx1250_splitk_clusterlaunch_tdm_ws_128x16x32x256_1x2_16x16x32_0x0x0_c1x4_p3w2,0.0,12.18,3053.34
gfx1250,256,8,2048,4096,False,torch.bfloat16,torch.bfloat16,False,False,triton,0,0,0.0,auto,0.0,0.0,0.0
gfx1250,256,8,2048,7168,False,torch.bfloat16,torch.bfloat16,False,False,opus,20129,5,9.5464,opus_gemm_gfx1250_splitk_clusterlaunch_tdm_ws_128x16x32x256_1x2_16x16x32_0x0x0_c1x4_p3w2,0.0,24.6,3090.96
gfx1250,256,16,2048,4096,False,torch.bfloat16,torch.bfloat16,False,False,opus,20129,5,8.6932,opus_gemm_gfx1250_splitk_clusterlaunch_tdm_ws_128x16x32x256_1x2_16x16x32_0x0x0_c1x4_p3w2,0.0,30.88,1952.54
gfx1250,256,16,2048,7168,False,torch.bfloat16,torch.bfloat16,False,False,opus,20129,4,10.1599,opus_gemm_gfx1250_splitk_clusterlaunch_tdm_ws_128x16x32x256_1x2_16x16x32_0x0x0_c1x4_p3w2,0.0,46.24,2918.83
gfx1250,256,32,2048,4096,False,torch.bfloat16,torch.bfloat16,False,False,triton,0,0,8.6864,auto,0.0,61.81,1976.7
gfx1250,256,32,2048,7168,False,torch.bfloat16,torch.bfloat16,False,False,opus,20255,4,10.5828,opus_gemm_gfx1250_splitk_clusterlaunch_tdm_ws_128x32x32x256_2x1_16x16x32_0x0x0_c1x4_p3w2,0.0,88.78,2830.06
gfx1250,256,48,2048,4096,False,torch.bfloat16,torch.bfloat16,False,False,triton,0,0,8.673,auto,0.0,92.85,2002.43
gfx1250,256,48,2048,7168,False,torch.bfloat16,torch.bfloat16,False,False,opus,20273,5,11.9865,opus_gemm_gfx1250_splitk_clusterlaunch_tdm_ws_128x32x64x128_2x1_16x16x32_0x0x0_c1x4_p3w2,0.0,117.57,2523.24
gfx1250,256,64,2048,4096,False,torch.bfloat16,torch.bfloat16,False,False,triton,0,0,8.8127,auto,0.0,121.84,1992.99
gfx1250,256,64,2048,7168,False,torch.bfloat16,torch.bfloat16,False,False,opus,20255,2,13.1163,opus_gemm_gfx1250_splitk_clusterlaunch_tdm_ws_128x32x32x256_2x1_16x16x32_0x0x0_c1x4_p3w2,0.0,143.26,2328.38
gfx1250,256,80,2048,4096,False,torch.bfloat16,torch.bfloat16,False,False,opus,20147,3,11.2385,opus_gemm_gfx1250_splitk_clusterlaunch_tdm_ws_128x16x64x128_1x2_16x16x32_0x0x0_c1x4_p3w2,0.0,119.43,1580.3
gfx1250,256,80,2048,7168,False,torch.bfloat16,torch.bfloat16,False,False,opus,20255,2,14.0368,opus_gemm_gfx1250_splitk_clusterlaunch_tdm_ws_128x32x32x256_2x1_16x16x32_0x0x0_c1x4_p3w2,0.0,167.33,2196.7
gfx1250,256,96,2048,4096,False,torch.bfloat16,torch.bfloat16,False,False,opus,20255,2,11.3243,opus_gemm_gfx1250_splitk_clusterlaunch_tdm_ws_128x32x32x256_2x1_16x16x32_0x0x0_c1x4_p3w2,0.0,142.23,1585.69
gfx1250,256,96,2048,7168,False,torch.bfloat16,torch.bfloat16,False,False,opus,20381,2,14.3598,opus_gemm_gfx1250_splitk_clusterlaunch_tdm_ws_128x64x32x256_2x1_16x16x32_0x0x0_c1x4_p3w2,0.0,196.28,2167.83
gfx1250,256,112,2048,4096,False,torch.bfloat16,torch.bfloat16,False,False,opus,20291,2,11.2166,opus_gemm_gfx1250_splitk_clusterlaunch_tdm_ws_128x32x64x256_2x1_16x16x32_0x0x0_c1x4_p3w2,0.0,167.52,1618.45
gfx1250,256,112,2048,7168,False,torch.bfloat16,torch.bfloat16,False,False,opus,20291,2,14.0247,opus_gemm_gfx1250_splitk_clusterlaunch_tdm_ws_128x32x64x256_2x1_16x16x32_0x0x0_c1x4_p3w2,0.0,234.47,2240.65
gfx1250,256,128,2048,4096,False,torch.bfloat16,torch.bfloat16,False,False,opus,20291,2,11.1337,opus_gemm_gfx1250_splitk_clusterlaunch_tdm_ws_128x32x64x256_2x1_16x16x32_0x0x0_c1x4_p3w2,0.0,192.88,1648.16
gfx1250,256,128,2048,7168,False,torch.bfloat16,torch.bfloat16,False,False,opus,20291,2,14.1177,opus_gemm_gfx1250_splitk_clusterlaunch_tdm_ws_128x32x64x256_2x1_16x16x32_0x0x0_c1x4_p3w2,0.0,266.2,2246.78
gfx1250,256,144,2048,4096,False,torch.bfloat16,torch.bfloat16,False,False,opus,20273,3,11.955,opus_gemm_gfx1250_splitk_clusterlaunch_tdm_ws_128x32x64x128_2x1_16x16x32_0x0x0_c1x4_p3w2,0.0,202.08,1551.37
gfx1250,256,144,2048,7168,False,torch.bfloat16,torch.bfloat16,False,False,opus,20273,3,15.9987,opus_gemm_gfx1250_splitk_clusterlaunch_tdm_ws_128x32x64x128_2x1_16x16x32_0x0x0_c1x4_p3w2,0.0,264.26,2001.06
gfx1250,256,160,2048,4096,False,torch.bfloat16,torch.bfloat16,False,False,opus,20291,1,12.4317,opus_gemm_gfx1250_splitk_clusterlaunch_tdm_ws_128x32x64x256_2x1_16x16x32_0x0x0_c1x4_p3w2,0.0,215.93,1507.7
gfx1250,256,160,2048,7168,False,torch.bfloat16,torch.bfloat16,False,False,opus,20273,3,15.8417,opus_gemm_gfx1250_splitk_clusterlaunch_tdm_ws_128x32x64x128_2x1_16x16x32_0x0x0_c1x4_p3w2,0.0,296.54,2039.51
gfx1250,256,176,2048,4096,False,torch.bfloat16,torch.bfloat16,False,False,opus,20363,2,13.0722,opus_gemm_gfx1250_splitk_clusterlaunch_tdm_ws_128x64x32x128_2x1_16x16x32_0x0x0_c1x4_p3w2,0.0,225.88,1448.87
gfx1250,256,176,2048,7168,False,torch.bfloat16,torch.bfloat16,False,False,opus,20291,2,18.4385,opus_gemm_gfx1250_splitk_clusterlaunch_tdm_ws_128x32x64x256_2x1_16x16x32_0x0x0_c1x4_p3w2,0.0,280.25,1768.27
gfx1250,256,192,2048,4096,False,torch.bfloat16,torch.bfloat16,False,False,opus,20273,2,13.1197,opus_gemm_gfx1250_splitk_clusterlaunch_tdm_ws_128x32x64x128_2x1_16x16x32_0x0x0_c1x4_p3w2,0.0,245.53,1458.61
gfx1250,256,192,2048,7168,False,torch.bfloat16,torch.bfloat16,False,False,opus,20291,2,18.6448,opus_gemm_gfx1250_splitk_clusterlaunch_tdm_ws_128x32x64x256_2x1_16x16x32_0x0x0_c1x4_p3w2,0.0,302.34,1764.52
gfx1250,256,208,2048,4096,False,torch.bfloat16,torch.bfloat16,False,False,opus,20417,2,13.098,opus_gemm_gfx1250_splitk_clusterlaunch_tdm_ws_128x64x64x256_2x1_16x16x32_0x0x0_c1x4_p3w1,0.0,266.43,1476.04
gfx1250,256,208,2048,7168,False,torch.bfloat16,torch.bfloat16,False,False,opus,20417,2,16.1246,opus_gemm_gfx1250_splitk_clusterlaunch_tdm_ws_128x64x64x256_2x1_16x16x32_0x0x0_c1x4_p3w1,0.0,378.73,2058.59
gfx1250,256,224,2048,4096,False,torch.bfloat16,torch.bfloat16,False,False,opus,20417,2,12.4608,opus_gemm_gfx1250_splitk_clusterlaunch_tdm_ws_128x64x64x256_2x1_16x16x32_0x0x0_c1x4_p3w1,0.0,301.59,1567.29
gfx1250,256,224,2048,7168,False,torch.bfloat16,torch.bfloat16,False,False,opus,20417,2,16.1148,opus_gemm_gfx1250_splitk_clusterlaunch_tdm_ws_128x64x64x256_2x1_16x16x32_0x0x0_c1x4_p3w1,0.0,408.11,2078.15
gfx1250,256,240,2048,4096,False,torch.bfloat16,torch.bfloat16,False,False,opus,20399,2,13.5094,opus_gemm_gfx1250_splitk_clusterlaunch_tdm_ws_128x64x64x128_2x1_16x16x32_0x0x0_c1x4_p3w2,0.0,298.05,1460.19
gfx1250,256,240,2048,7168,False,torch.bfloat16,torch.bfloat16,False,False,opus,20399,3,17.4746,opus_gemm_gfx1250_splitk_clusterlaunch_tdm_ws_128x64x64x128_2x1_16x16x32_0x0x0_c1x4_p3w2,0.0,403.24,1933.31
gfx1250,256,256,2048,4096,False,torch.bfloat16,torch.bfloat16,False,False,opus,20399,2,14.2923,opus_gemm_gfx1250_splitk_clusterlaunch_tdm_ws_128x64x64x128_2x1_16x16x32_0x0x0_c1x4_p3w2,0.0,300.51,1393.96
gfx1250,256,256,2048,7168,False,torch.bfloat16,torch.bfloat16,False,False,opus,20399,3,17.5755,opus_gemm_gfx1250_splitk_clusterlaunch_tdm_ws_128x64x64x128_2x1_16x16x32_0x0x0_c1x4_p3w2,0.0,427.65,1938.99
gfx1250,256,288,2048,4096,False,torch.bfloat16,torch.bfloat16,False,False,opus,20399,2,14.7424,opus_gemm_gfx1250_splitk_clusterlaunch_tdm_ws_128x64x64x128_2x1_16x16x32_0x0x0_c1x4_p3w2,0.0,327.75,1378.08
gfx1250,256,288,2048,7168,False,torch.bfloat16,torch.bfloat16,False,False,opus,20399,3,19.3473,opus_gemm_gfx1250_splitk_clusterlaunch_tdm_ws_128x64x64x128_2x1_16x16x32_0x0x0_c1x4_p3w2,0.0,437.05,1791.91
gfx1250,256,320,2048,4096,False,torch.bfloat16,torch.bfloat16,False,False,opus,20399,3,14.7555,opus_gemm_gfx1250_splitk_clusterlaunch_tdm_ws_128x64x64x128_2x1_16x16x32_0x0x0_c1x4_p3w2,0.0,363.84,1403.5
gfx1250,256,320,2048,7168,False,torch.bfloat16,torch.bfloat16,False,False,opus,20399,3,19.7388,opus_gemm_gfx1250_splitk_clusterlaunch_tdm_ws_128x64x64x128_2x1_16x16x32_0x0x0_c1x4_p3w2,0.0,475.98,1786.25
gfx1250,256,352,2048,4096,False,torch.bfloat16,torch.bfloat16,False,False,opus,20417,1,15.6927,opus_gemm_gfx1250_splitk_clusterlaunch_tdm_ws_128x64x64x256_2x1_16x16x32_0x0x0_c1x4_p3w1,0.0,376.33,1344.74
gfx1250,256,352,2048,7168,False,torch.bfloat16,torch.bfloat16,False,False,opus,20399,2,22.2084,opus_gemm_gfx1250_splitk_clusterlaunch_tdm_ws_128x64x64x128_2x1_16x16x32_0x0x0_c1x4_p3w2,0.0,465.35,1614.17
gfx1250,256,384,2048,4096,False,torch.bfloat16,torch.bfloat16,False,False,opus,20417,1,15.1672,opus_gemm_gfx1250_splitk_clusterlaunch_tdm_ws_128x64x64x256_2x1_16x16x32_0x0x0_c1x4_p3w1,0.0,424.76,1417.26
gfx1250,256,384,2048,7168,False,torch.bfloat16,torch.bfloat16,False,False,opus,20399,2,22.4242,opus_gemm_gfx1250_splitk_clusterlaunch_tdm_ws_128x64x64x128_2x1_16x16x32_0x0x0_c1x4_p3w2,0.0,502.77,1624.94
gfx1250,256,416,2048,4096,False,torch.bfloat16,torch.bfloat16,False,False,opus,20417,1,15.7518,opus_gemm_gfx1250_splitk_clusterlaunch_tdm_ws_128x64x64x256_2x1_16x16x32_0x0x0_c1x4_p3w1,0.0,443.08,1389.62
gfx1250,256,416,2048,7168,False,torch.bfloat16,torch.bfloat16,False,False,opus,20417,1,23.7637,opus_gemm_gfx1250_splitk_clusterlaunch_tdm_ws_128x64x64x256_2x1_16x16x32_0x0x0_c1x4_p3w1,0.0,513.97,1558.17
gfx1250,256,448,2048,4096,False,torch.bfloat16,torch.bfloat16,False,False,opus,20399,2,16.1852,opus_gemm_gfx1250_splitk_clusterlaunch_tdm_ws_128x64x64x128_2x1_16x16x32_0x0x0_c1x4_p3w2,0.0,464.39,1376.7
gfx1250,256,448,2048,7168,False,torch.bfloat16,torch.bfloat16,False,False,opus,20417,1,24.0808,opus_gemm_gfx1250_splitk_clusterlaunch_tdm_ws_128x64x64x256_2x1_16x16x32_0x0x0_c1x4_p3w1,0.0,546.22,1562.14
gfx1250,256,480,2048,4096,False,torch.bfloat16,torch.bfloat16,False,False,triton,0,0,16.7093,auto,0.0,481.95,1357.06
gfx1250,256,480,2048,7168,False,torch.bfloat16,torch.bfloat16,False,False,opus,20417,3,33.6516,opus_gemm_gfx1250_splitk_clusterlaunch_tdm_ws_128x64x64x256_2x1_16x16x32_0x0x0_c1x4_p3w1,0.0,418.79,1135.38
gfx1250,256,512,2048,4096,False,torch.bfloat16,torch.bfloat16,False,False,triton,0,0,16.8041,auto,0.0,511.18,1372.8
gfx1250,256,512,2048,7168,False,torch.bfloat16,torch.bfloat16,False,False,opus,20453,2,26.9651,opus_gemm_gfx1250_splitk_clusterlaunch_tdm_ws_128x64x128x256_2x1_16x16x32_0x0x0_c1x4_p3w1,0.0,557.48,1438.8
gfx1250,256,1024,2048,4096,False,torch.bfloat16,torch.bfloat16,False,False,triton,0,0,0.0,auto,0.0,0.0,0.0
gfx1250,256,2048,2048,4096,False,torch.bfloat16,torch.bfloat16,False,False,triton,0,0,0.0,auto,0.0,0.0,0.0
gfx1250,256,4096,2048,4096,False,torch.bfloat16,torch.bfloat16,False,False,triton,0,0,0.0,auto,0.0,0.0,0.0
gfx1250,256,8192,2048,4096,False,torch.bfloat16,torch.bfloat16,False,False,triton,0,0,0.0,auto,0.0,0.0,0.0
gfx1250,256,16384,2048,4096,False,torch.bfloat16,torch.bfloat16,False,False,triton,0,0,0.0,auto,0.0,0.0,0.0
gfx1250,256,16,64640,4096,False,torch.bfloat16,torch.bfloat16,False,False,triton,0,0,46.6347,auto,0.0,181.68,11402.03
gfx1250,256,32,64640,4096,False,torch.bfloat16,torch.bfloat16,False,False,triton,0,0,45.9182,auto,0.0,369.03,11627.85
gfx1250,256,48,64640,4096,False,torch.bfloat16,torch.bfloat16,False,False,triton,0,0,75.6313,auto,0.0,336.07,7088.73
gfx1250,256,64,64640,4096,False,torch.bfloat16,torch.bfloat16,False,False,triton,0,0,71.0999,auto,0.0,476.65,7571.45
gfx1250,256,80,64640,4096,False,torch.bfloat16,torch.bfloat16,False,False,triton,0,0,88.323,auto,0.0,479.63,6119.91
gfx1250,256,96,64640,4096,False,torch.bfloat16,torch.bfloat16,False,False,triton,0,0,93.1209,auto,0.0,545.9,5828.21
gfx1250,256,112,64640,4096,False,torch.bfloat16,torch.bfloat16,False,False,opus,20565,1,115.8855,opus_gemm_gfx1250_splitk_clusterlaunch_tdm_ws_128x128x128x128_2x1_16x16x32_0x0x0_c1x5_p3w1,0.0,511.78,4702.29
gfx1250,256,128,64640,4096,False,torch.bfloat16,torch.bfloat16,False,False,triton,0,0,114.3074,auto,0.0,592.96,4786.46
gfx1250,256,144,64640,4096,False,torch.bfloat16,torch.bfloat16,False,False,triton,0,0,139.9689,auto,0.0,544.78,3924.64
gfx1250,256,160,64640,4096,False,torch.bfloat16,torch.bfloat16,False,False,triton,0,0,143.1995,auto,0.0,591.66,3851.45
gfx1250,256,176,64640,4096,False,torch.bfloat16,torch.bfloat16,False,False,opus,20457,1,164.1069,opus_gemm_gfx1250_splitk_clusterlaunch_tdm_ws_128x64x128x256_2x1_16x16x32_0x0x0_c1x5_p3w1,0.0,567.91,3374.18
gfx1250,256,192,64640,4096,False,torch.bfloat16,torch.bfloat16,False,False,opus,20457,1,167.7642,opus_gemm_gfx1250_splitk_clusterlaunch_tdm_ws_128x64x128x256_2x1_16x16x32_0x0x0_c1x5_p3w1,0.0,606.03,3313.73
gfx1250,256,208,64640,4096,False,torch.bfloat16,torch.bfloat16,False,False,opus,20565,1,179.6355,opus_gemm_gfx1250_splitk_clusterlaunch_tdm_ws_128x128x128x128_2x1_16x16x32_0x0x0_c1x5_p3w1,0.0,613.14,3106.99
gfx1250,256,224,64640,4096,False,torch.bfloat16,torch.bfloat16,False,False,opus,20565,1,182.1932,opus_gemm_gfx1250_splitk_clusterlaunch_tdm_ws_128x128x128x128_2x1_16x16x32_0x0x0_c1x5_p3w1,0.0,651.04,3075.44
gfx1250,256,240,64640,4096,False,torch.bfloat16,torch.bfloat16,False,False,opus,20565,1,180.3236,opus_gemm_gfx1250_splitk_clusterlaunch_tdm_ws_128x128x128x128_2x1_16x16x32_0x0x0_c1x5_p3w1,0.0,704.77,3119.53
gfx1250,256,256,64640,4096,False,torch.bfloat16,torch.bfloat16,False,False,opus,20565,1,182.9769,opus_gemm_gfx1250_splitk_clusterlaunch_tdm_ws_128x128x128x128_2x1_16x16x32_0x0x0_c1x5_p3w1,0.0,740.86,3086.31
gfx1250,256,288,64640,4096,False,torch.bfloat16,torch.bfloat16,False,False,triton,0,0,242.7456,auto,0.0,628.25,2344.52
gfx1250,256,320,64640,4096,False,torch.bfloat16,torch.bfloat16,False,False,opus,20565,1,249.5447,opus_gemm_gfx1250_splitk_clusterlaunch_tdm_ws_128x128x128x128_2x1_16x16x32_0x0x0_c1x5_p3w1,0.0,679.04,2298.27
gfx1250,256,352,64640,4096,False,torch.bfloat16,torch.bfloat16,False,False,opus,20565,1,251.2568,opus_gemm_gfx1250_splitk_clusterlaunch_tdm_ws_128x128x128x128_2x1_16x16x32_0x0x0_c1x5_p3w1,0.0,741.85,2300.12
gfx1250,256,384,64640,4096,False,torch.bfloat16,torch.bfloat16,False,False,opus,20565,1,254.3368,opus_gemm_gfx1250_splitk_clusterlaunch_tdm_ws_128x128x128x128_2x1_16x16x32_0x0x0_c1x5_p3w1,0.0,799.49,2289.56
gfx1250,256,416,64640,4096,False,torch.bfloat16,torch.bfloat16,False,False,opus,20565,1,321.8563,opus_gemm_gfx1250_splitk_clusterlaunch_tdm_ws_128x128x128x128_2x1_16x16x32_0x0x0_c1x5_p3w1,0.0,684.42,1822.92
gfx1250,256,448,64640,4096,False,torch.bfloat16,torch.bfloat16,False,False,opus,20565,1,323.024,opus_gemm_gfx1250_splitk_clusterlaunch_tdm_ws_128x128x128x128_2x1_16x16x32_0x0x0_c1x5_p3w1,0.0,734.4,1829.95
gfx1250,256,480,64640,4096,False,torch.bfloat16,torch.bfloat16,False,False,opus,20565,1,325.0133,opus_gemm_gfx1250_splitk_clusterlaunch_tdm_ws_128x128x128x128_2x1_16x16x32_0x0x0_c1x5_p3w1,0.0,782.04,1832.29
gfx1250,256,512,64640,4096,False,torch.bfloat16,torch.bfloat16,False,False,opus,20565,1,328.4177,opus_gemm_gfx1250_splitk_clusterlaunch_tdm_ws_128x128x128x128_2x1_16x16x32_0x0x0_c1x5_p3w1,0.0,825.53,1826.69
gfx1250,256,1,129280,4096,False,torch.bfloat16,torch.bfloat16,False,False,triton,0,0,0.0,auto,0.0,0.0,0.0
gfx1250,256,2,129280,4096,False,torch.bfloat16,torch.bfloat16,False,False,triton,0,0,0.0,auto,0.0,0.0,0.0
gfx1250,256,4,129280,4096,False,torch.bfloat16,torch.bfloat16,False,False,triton,0,0,0.0,auto,0.0,0.0,0.0
gfx1250,256,8,129280,4096,False,torch.bfloat16,torch.bfloat16,False,False,triton,0,0,0.0,auto,0.0,0.0,0.0
gfx1250,256,16,129280,4096,False,torch.bfloat16,torch.bfloat16,False,False,triton,0,0,86.7304,auto,0.0,195.38,12260.17
gfx1250,256,32,129280,4096,False,torch.bfloat16,torch.bfloat16,False,False,triton,0,0,77.3292,auto,0.0,438.26,13805.88
gfx1250,256,48,129280,4096,False,torch.bfloat16,torch.bfloat16,False,False,triton,0,0,122.8094,auto,0.0,413.93,8727.88
gfx1250,256,64,129280,4096,False,torch.bfloat16,torch.bfloat16,False,False,triton,0,0,123.1754,auto,0.0,550.27,8736.6
gfx1250,256,80,129280,4096,False,torch.bfloat16,torch.bfloat16,False,False,triton,0,0,172.2467,auto,0.0,491.88,6272.41
gfx1250,256,96,129280,4096,False,torch.bfloat16,torch.bfloat16,False,False,triton,0,0,180.2347,auto,0.0,564.1,6018.1
gfx1250,256,112,129280,4096,False,torch.bfloat16,torch.bfloat16,False,False,opus,20565,1,196.7228,opus_gemm_gfx1250_splitk_clusterlaunch_tdm_ws_128x128x128x128_2x1_16x16x32_0x0x0_c1x5_p3w1,0.0,602.95,5535.39
gfx1250,256,128,129280,4096,False,torch.bfloat16,torch.bfloat16,False,False,opus,20565,1,199.8413,opus_gemm_gfx1250_splitk_clusterlaunch_tdm_ws_128x128x128x128_2x1_16x16x32_0x0x0_c1x5_p3w1,0.0,678.34,5470.37
gfx1250,256,144,129280,4096,False,torch.bfloat16,torch.bfloat16,False,False,triton,0,0,274.1492,auto,0.0,556.28,4003.2
gfx1250,256,160,129280,4096,False,torch.bfloat16,torch.bfloat16,False,False,triton,0,0,283.0933,auto,0.0,598.57,3891.8
gfx1250,256,176,129280,4096,False,torch.bfloat16,torch.bfloat16,False,False,opus,20475,1,298.8606,opus_gemm_gfx1250_splitk_clusterlaunch_tdm_ws_128x64x256x128_2x1_16x16x32_0x0x0_c1x5_p3w1,0.0,623.68,3700.76
gfx1250,256,192,129280,4096,False,torch.bfloat16,torch.bfloat16,False,False,opus,20475,1,298.0819,opus_gemm_gfx1250_splitk_clusterlaunch_tdm_ws_128x64x256x128_2x1_16x16x32_0x0x0_c1x5_p3w1,0.0,682.16,3724.74
gfx1250,256,208,129280,4096,False,torch.bfloat16,torch.bfloat16,False,False,opus,20565,1,324.1281,opus_gemm_gfx1250_splitk_clusterlaunch_tdm_ws_128x128x128x128_2x1_16x16x32_0x0x0_c1x5_p3w1,0.0,679.62,3438.6
gfx1250,256,224,129280,4096,False,torch.bfloat16,torch.bfloat16,False,False,opus,20565,1,327.1103,opus_gemm_gfx1250_splitk_clusterlaunch_tdm_ws_128x128x128x128_2x1_16x16x32_0x0x0_c1x5_p3w1,0.0,725.23,3420.3
gfx1250,256,240,129280,4096,False,torch.bfloat16,torch.bfloat16,False,False,opus,20565,1,329.0437,opus_gemm_gfx1250_splitk_clusterlaunch_tdm_ws_128x128x128x128_2x1_16x16x32_0x0x0_c1x5_p3w1,0.0,772.47,3413.17
gfx1250,256,256,129280,4096,False,torch.bfloat16,torch.bfloat16,False,False,opus,20565,1,333.9411,opus_gemm_gfx1250_splitk_clusterlaunch_tdm_ws_128x128x128x128_2x1_16x16x32_0x0x0_c1x5_p3w1,0.0,811.88,3375.9
gfx1250,256,288,129280,4096,False,torch.bfloat16,torch.bfloat16,False,False,opus,20565,1,462.0965,opus_gemm_gfx1250_splitk_clusterlaunch_tdm_ws_128x128x128x128_2x1_16x16x32_0x0x0_c1x5_p3w1,0.0,660.06,2458.11
gfx1250,256,320,129280,4096,False,torch.bfloat16,torch.bfloat16,False,False,opus,20565,1,465.8066,opus_gemm_gfx1250_splitk_clusterlaunch_tdm_ws_128x128x128x128_2x1_16x16x32_0x0x0_c1x5_p3w1,0.0,727.55,2456.86
gfx1250,256,352,129280,4096,False,torch.bfloat16,torch.bfloat16,False,False,opus,20565,1,471.664,opus_gemm_gfx1250_splitk_clusterlaunch_tdm_ws_128x128x128x128_2x1_16x16x32_0x0x0_c1x5_p3w1,0.0,790.37,2444.45
gfx1250,256,384,129280,4096,False,torch.bfloat16,torch.bfloat16,False,False,opus,20565,1,477.4059,opus_gemm_gfx1250_splitk_clusterlaunch_tdm_ws_128x128x128x128_2x1_16x16x32_0x0x0_c1x5_p3w1,0.0,851.85,2432.93
gfx1250,256,416,129280,4096,False,torch.bfloat16,torch.bfloat16,False,False,opus,20565,1,611.022,opus_gemm_gfx1250_splitk_clusterlaunch_tdm_ws_128x128x128x128_2x1_16x16x32_0x0x0_c1x5_p3w1,0.0,721.04,1914.87
gfx1250,256,448,129280,4096,False,torch.bfloat16,torch.bfloat16,False,False,opus,20565,1,614.1941,opus_gemm_gfx1250_splitk_clusterlaunch_tdm_ws_128x128x128x128_2x1_16x16x32_0x0x0_c1x5_p3w1,0.0,772.49,1918.88
gfx1250,256,480,129280,4096,False,torch.bfloat16,torch.bfloat16,False,False,opus,20565,1,618.7928,opus_gemm_gfx1250_splitk_clusterlaunch_tdm_ws_128x128x128x128_2x1_16x16x32_0x0x0_c1x5_p3w1,0.0,821.52,1918.42
gfx1250,256,512,129280,4096,False,torch.bfloat16,torch.bfloat16,False,False,opus,20565,1,622.7167,opus_gemm_gfx1250_splitk_clusterlaunch_tdm_ws_128x128x128x128_2x1_16x16x32_0x0x0_c1x5_p3w1,0.0,870.76,1920.04
gfx1250,256,1024,129280,4096,False,torch.bfloat16,torch.bfloat16,False,False,triton,0,0,0.0,auto,0.0,0.0,0.0
gfx1250,256,2048,129280,4096,False,torch.bfloat16,torch.bfloat16,False,False,triton,0,0,0.0,auto,0.0,0.0,0.0
gfx1250,256,4096,129280,4096,False,torch.bfloat16,torch.bfloat16,False,False,triton,0,0,0.0,auto,0.0,0.0,0.0
gfx1250,256,8192,129280,4096,False,torch.bfloat16,torch.bfloat16,False,False,triton,0,0,0.0,auto,0.0,0.0,0.0
gfx1250,256,16384,129280,4096,False,torch.bfloat16,torch.bfloat16,False,False,triton,0,0,0.0,auto,0.0,0.0,0.0
gfx942,80,1,64,4096,False,torch.bfloat16,torch.bfloat16,False,False,skinny,2,0,3.6782,sol2,0.0,0.14,144.8
gfx942,80,2,64,4096,False,torch.bfloat16,torch.bfloat16,False,False,opus,10310,0,4.1922,opus_gemm_gfx942_wkc_accum_256x16x16x64_1x1_16x16x16_0x0x0,0.0234,0.25,129.03
gfx942,80,4,64,4096,False,torch.bfloat16,torch.bfloat16,False,False,opus,10310,0,4.2146,opus_gemm_gfx942_wkc_accum_256x16x16x64_1x1_16x16x16_0x0x0,0.0234,0.5,132.29
gfx942,80,8,64,4096,False,torch.bfloat16,torch.bfloat16,False,False,opus,10310,0,4.5113,opus_gemm_gfx942_wkc_accum_256x16x16x64_1x1_16x16x16_0x0x0,0.0195,0.93,130.97
gfx942,80,7680,64,4096,False,torch.bfloat16,torch.bfloat16,False,False,torch,0,0,47.248,native,0.0,85.22,1363.48
gfx942,80,7680,256,4096,False,torch.bfloat16,torch.bfloat16,False,False,torch,0,0,124.4846,native,0.0,129.38,553.83
gfx942,80,7680,512,4096,False,torch.bfloat16,torch.bfloat16,False,False,torch,0,0,211.985,native,0.0,151.96,353.67
gfx942,80,7680,1024,4096,False,torch.bfloat16,torch.bfloat16,False,False,torch,0,0,345.2932,native,0.0,186.58,252.05
gfx942,80,7680,2048,4096,False,torch.bfloat16,torch.bfloat16,False,False,opus,10216,0,693.9949,opus_gemm_gfx942_splitk_quad_mfma32_bf16ws_256x256x256x32_2x2_32x32x8_6x0x0,0.0,185.66,160.16
gfx942,80,1,32320,4096,False,torch.bfloat16,torch.bfloat16,False,False,torch,0,0,109.2233,native,0.0,2.42,2424.74
gfx942,80,15,32320,4096,False,torch.bfloat16,torch.bfloat16,False,False,torch,0,0,112.235,native,0.0,35.39,2368.76
gfx942,80,16,32320,4096,False,torch.bfloat16,torch.bfloat16,False,False,torch,0,0,112.6187,native,0.0,37.62,2361.34
gfx950,256,16,64,4096,False,torch.bfloat16,torch.bfloat16,False,False,flydsl,1619,8,4.1038,flydsl_gemm6_abf16_wbf16_bf16_t16x64x64_split_k8_block_m_warp1_block_n_warp2_block_k_warp1_async_copyTrue_b_to_ldsTrue_b_preshuffleFalse_c_to_ldsFalse_gfx950,0.0244,2.04,160.19
gfx950,256,32,64,4096,False,torch.bfloat16,torch.bfloat16,False,False,flydsl,1843,8,4.3226,flydsl_gemm7_abf16_wbf16_bf16_t16x64x64_split_k8_block_m_warp1_block_n_warp2_block_k_warp1_async_copyTrue_b_to_ldsTrue_b_preshuffleFalse_c_to_ldsFalse_gfx950,0.0205,3.88,182.88
gfx950,256,48,64,4096,False,torch.bfloat16,torch.bfloat16,False,False,flydsl,1618,8,4.2653,flydsl_gemm6_abf16_wbf16_bf16_t16x64x64_split_k8_block_m_warp1_block_n_warp1_block_k_warp2_async_copyTrue_b_to_ldsTrue_b_preshuffleFalse_c_to_ldsFalse_gfx950,0.0306,5.9,216.55
gfx950,256,64,64,4096,False,torch.bfloat16,torch.bfloat16,False,False,flydsl,1327,8,4.4524,flydsl_gemm4_abf16_wbf16_bf16_t16x64x128_split_k8_block_m_warp1_block_n_warp2_block_k_warp1_async_copyTrue_b_to_ldsTrue_b_preshuffleFalse_c_to_ldsFalse_gfx950,0.0198,7.54,237.35
gfx950,256,80,64,4096,False,torch.bfloat16,torch.bfloat16,False,False,flydsl,2367,8,4.297,flydsl_gemm7_abf16_wbf16_bf16_t16x64x64_split_k8_block_m_warp1_block_n_warp2_block_k_warp1_async_copyTrue_b_to_ldsTrue_b_preshuffleFalse_c_to_ldsFalse_gfx950,0.0199,9.76,276.91
gfx950,256,96,64,4096,False,torch.bfloat16,torch.bfloat16,False,False,flydsl,2143,8,4.419,flydsl_gemm6_abf16_wbf16_bf16_t16x64x64_split_k8_block_m_warp1_block_n_warp2_block_k_warp1_async_copyTrue_b_to_ldsTrue_b_preshuffleFalse_c_to_ldsFalse_gfx950,0.019,11.39,299.39
gfx950,256,112,64,4096,False,torch.bfloat16,torch.bfloat16,False,False,flydsl,2367,8,4.413,flydsl_gemm7_abf16_wbf16_bf16_t16x64x64_split_k8_block_m_warp1_block_n_warp2_block_k_warp1_async_copyTrue_b_to_ldsTrue_b_preshuffleFalse_c_to_ldsFalse_gfx950,0.0199,13.31,329.96
gfx950,256,128,64,4096,False,torch.bfloat16,torch.bfloat16,False,False,flydsl,2139,8,4.6882,flydsl_gemm5_abf16_wbf16_bf16_t32x64x64_split_k8_block_m_warp2_block_n_warp2_block_k_warp1_async_copyTrue_b_to_ldsTrue_b_preshuffleFalse_c_to_ldsFalse_gfx950,0.0194,14.31,338.99
gfx950,256,144,64,4096,False,torch.bfloat16,torch.bfloat16,False,False,flydsl,2663,8,4.4734,flydsl_gemm7_abf16_wbf16_bf16_t16x64x64_split_k8_block_m_warp1_block_n_warp2_block_k_warp1_async_copyTrue_b_to_ldsTrue_b_preshuffleFalse_c_to_ldsFalse_gfx950,0.0201,16.88,385.02
gfx950,256,160,64,4096,False,torch.bfloat16,torch.bfloat16,False,False,flydsl,2139,8,4.5639,flydsl_gemm5_abf16_wbf16_bf16_t32x64x64_split_k8_block_m_warp2_block_n_warp2_block_k_warp1_async_copyTrue_b_to_ldsTrue_b_preshuffleFalse_c_to_ldsFalse_gfx950,0.0195,18.38,406.56
gfx950,256,176,64,4096,False,torch.bfloat16,torch.bfloat16,False,False,flydsl,2438,8,4.7231,flydsl_gemm6_abf16_wbf16_bf16_t16x64x64_split_k8_block_m_warp1_block_n_warp1_block_k_warp2_async_copyTrue_b_to_ldsTrue_b_preshuffleFalse_c_to_ldsFalse_gfx950,0.0252,19.54,421.04
gfx950,256,192,64,4096,False,torch.bfloat16,torch.bfloat16,False,False,flydsl,2139,8,4.7019,flydsl_gemm5_abf16_wbf16_bf16_t32x64x64_split_k8_block_m_warp2_block_n_warp2_block_k_warp1_async_copyTrue_b_to_ldsTrue_b_preshuffleFalse_c_to_ldsFalse_gfx950,0.0192,21.41,451.25
gfx950,256,208,64,4096,False,torch.bfloat16,torch.bfloat16,False,False,flydsl,2508,8,4.6194,flydsl_gemm6_abf16_wbf16_bf16_t32x64x64_split_k8_block_m_warp1_block_n_warp4_block_k_warp1_async_copyTrue_b_to_ldsTrue_b_preshuffleFalse_c_to_ldsFalse_gfx950,0.0184,23.61,488.13
gfx950,256,224,64,4096,False,torch.bfloat16,torch.bfloat16,False,False,flydsl,2508,8,4.6771,flydsl_gemm6_abf16_wbf16_bf16_t32x64x64_split_k8_block_m_warp1_block_n_warp4_block_k_warp1_async_copyTrue_b_to_ldsTrue_b_preshuffleFalse_c_to_ldsFalse_gfx950,0.0181,25.11,510.57
gfx950,256,240,64,4096,False,torch.bfloat16,torch.bfloat16,False,False,flydsl,2663,8,5.1759,flydsl_gemm7_abf16_wbf16_bf16_t16x64x64_split_k8_block_m_warp1_block_n_warp2_block_k_warp1_async_copyTrue_b_to_ldsTrue_b_preshuffleFalse_c_to_ldsFalse_gfx950,0.0187,24.31,487.08
gfx950,256,256,64,4096,False,torch.bfloat16,torch.bfloat16,False,False,flydsl,2439,8,5.3468,flydsl_gemm6_abf16_wbf16_bf16_t16x64x64_split_k8_block_m_warp1_block_n_warp2_block_k_warp1_async_copyTrue_b_to_ldsTrue_b_preshuffleFalse_c_to_ldsFalse_gfx950,0.0185,25.1,496.41
gfx950,256,288,64,4096,False,torch.bfloat16,torch.bfloat16,False,False,flydsl,2851,8,5.4754,flydsl_gemm8_abf16_wbf16_bf16_t16x64x64_split_k8_block_m_warp1_block_n_warp2_block_k_warp1_async_copyTrue_b_to_ldsTrue_b_preshuffleFalse_c_to_ldsFalse_gfx950,0.0182,27.58,533.38
gfx950,256,320,64,4096,False,torch.bfloat16,torch.bfloat16,False,False,flydsl,2851,8,5.8174,flydsl_gemm8_abf16_wbf16_bf16_t16x64x64_split_k8_block_m_warp1_block_n_warp2_block_k_warp1_async_copyTrue_b_to_ldsTrue_b_preshuffleFalse_c_to_ldsFalse_gfx950,0.0182,28.84,547.79
gfx950,256,352,64,4096,False,torch.bfloat16,torch.bfloat16,False,False,flydsl,2139,8,5.9388,flydsl_gemm5_abf16_wbf16_bf16_t32x64x64_split_k8_block_m_warp2_block_n_warp2_block_k_warp1_async_copyTrue_b_to_ldsTrue_b_preshuffleFalse_c_to_ldsFalse_gfx950,0.0194,31.08,581.42
gfx950,256,384,64,4096,False,torch.bfloat16,torch.bfloat16,False,False,flydsl,2508,8,6.0403,flydsl_gemm6_abf16_wbf16_bf16_t32x64x64_split_k8_block_m_warp1_block_n_warp4_block_k_warp1_async_copyTrue_b_to_ldsTrue_b_preshuffleFalse_c_to_ldsFalse_gfx950,0.0186,33.33,615.73
gfx950,256,416,64,4096,False,torch.bfloat16,torch.bfloat16,False,False,flydsl,2511,8,6.1084,flydsl_gemm6_abf16_wbf16_bf16_t32x64x64_split_k8_block_m_warp2_block_n_warp2_block_k_warp1_async_copyTrue_b_to_ldsTrue_b_preshuffleFalse_c_to_ldsFalse_gfx950,0.0182,35.71,652.45
gfx950,256,448,64,4096,False,torch.bfloat16,torch.bfloat16,False,False,flydsl,2884,8,6.2706,flydsl_gemm8_abf16_wbf16_bf16_t32x64x64_split_k8_block_m_warp1_block_n_warp4_block_k_warp1_async_copyTrue_b_to_ldsTrue_b_preshuffleFalse_c_to_ldsFalse_gfx950,0.019,37.46,678.03
gfx950,256,480,64,4096,False,torch.bfloat16,torch.bfloat16,False,False,flydsl,2696,8,6.3498,flydsl_gemm7_abf16_wbf16_bf16_t32x64x64_split_k8_block_m_warp1_block_n_warp4_block_k_warp1_async_copyTrue_b_to_ldsTrue_b_preshuffleFalse_c_to_ldsFalse_gfx950,0.0197,39.63,711.5
gfx950,256,512,64,4096,False,torch.bfloat16,torch.bfloat16,False,False,flydsl,2439,8,6.6119,flydsl_gemm6_abf16_wbf16_bf16_t16x64x64_split_k8_block_m_warp1_block_n_warp2_block_k_warp1_async_copyTrue_b_to_ldsTrue_b_preshuffleFalse_c_to_ldsFalse_gfx950,0.0183,40.6,723.56
gfx950,256,544,64,4096,False,torch.bfloat16,torch.bfloat16,False,False,flydsl,2696,8,6.7254,flydsl_gemm7_abf16_wbf16_bf16_t32x64x64_split_k8_block_m_warp1_block_n_warp4_block_k_warp1_async_copyTrue_b_to_ldsTrue_b_preshuffleFalse_c_to_ldsFalse_gfx950,0.0194,42.41,750.94
gfx950,256,576,64,4096,False,torch.bfloat16,torch.bfloat16,False,False,flydsl,1027,4,6.9102,flydsl_gemm3_abf16_wbf16_bf16_t16x64x256_split_k4_block_m_warp1_block_n_warp1_block_k_warp2_async_copyTrue_b_to_ldsTrue_b_preshuffleFalse_c_to_ldsFalse_gfx950,0.0193,43.7,769.39
gfx950,256,608,64,4096,False,torch.bfloat16,torch.bfloat16,False,False,flydsl,2848,4,6.9328,flydsl_gemm8_abf16_wbf16_bf16_t16x64x64_split_k4_block_m_warp1_block_n_warp2_block_k_warp1_async_copyTrue_b_to_ldsTrue_b_preshuffleFalse_c_to_ldsFalse_gfx950,0.0116,45.98,805.28
gfx950,256,640,64,4096,False,torch.bfloat16,torch.bfloat16,False,False,flydsl,2136,8,7.0507,flydsl_gemm5_abf16_wbf16_bf16_t32x64x64_split_k8_block_m_warp1_block_n_warp4_block_k_warp1_async_copyTrue_b_to_ldsTrue_b_preshuffleFalse_c_to_ldsFalse_gfx950,0.0199,47.59,829.58
gfx950,256,672,64,4096,False,torch.bfloat16,torch.bfloat16,False,False,flydsl,2136,8,7.1007,flydsl_gemm5_abf16_wbf16_bf16_t32x64x64_split_k8_block_m_warp1_block_n_warp4_block_k_warp1_async_copyTrue_b_to_ldsTrue_b_preshuffleFalse_c_to_ldsFalse_gfx950,0.0198,49.62,861.23
gfx950,256,704,64,4096,False,torch.bfloat16,torch.bfloat16,False,False,flydsl,2847,4,7.1671,flydsl_gemm8_abf16_wbf16_bf16_t16x64x64_split_k4_block_m_warp1_block_n_warp1_block_k_warp2_async_copyTrue_b_to_ldsTrue_b_preshuffleFalse_c_to_ldsFalse_gfx950,0.0199,51.5,890.4
gfx950,256,736,64,4096,False,torch.bfloat16,torch.bfloat16,False,False,flydsl,2848,4,7.2154,flydsl_gemm8_abf16_wbf16_bf16_t16x64x64_split_k4_block_m_warp1_block_n_warp2_block_k_warp1_async_copyTrue_b_to_ldsTrue_b_preshuffleFalse_c_to_ldsFalse_gfx950,0.0116,53.48,921.34
gfx950,256,768,64,4096,False,torch.bfloat16,torch.bfloat16,False,False,flydsl,1563,4,7.3716,flydsl_gemm4_abf16_wbf16_bf16_t16x64x256_split_k4_block_m_warp1_block_n_warp1_block_k_warp2_async_copyTrue_b_to_ldsTrue_b_preshuffleFalse_c_to_ldsFalse_gfx950,0.0184,54.62,937.93
gfx950,256,800,64,4096,False,torch.bfloat16,torch.bfloat16,False,False,flydsl,2848,4,7.3776,flydsl_gemm8_abf16_wbf16_bf16_t16x64x64_split_k4_block_m_warp1_block_n_warp2_block_k_warp1_async_copyTrue_b_to_ldsTrue_b_preshuffleFalse_c_to_ldsFalse_gfx950,0.0117,56.85,973.26
gfx950,256,832,64,4096,False,torch.bfloat16,torch.bfloat16,False,False,flydsl,1551,4,7.5362,flydsl_gemm4_abf16_wbf16_bf16_t16x64x128_split_k4_block_m_warp1_block_n_warp1_block_k_warp2_async_copyTrue_b_to_ldsTrue_b_preshuffleFalse_c_to_ldsFalse_gfx950,0.0189,57.88,988.1
gfx950,256,864,64,4096,False,torch.bfloat16,torch.bfloat16,False,False,flydsl,1552,4,7.6575,flydsl_gemm4_abf16_wbf16_bf16_t16x64x128_split_k4_block_m_warp1_block_n_warp2_block_k_warp1_async_copyTrue_b_to_ldsTrue_b_preshuffleFalse_c_to_ldsFalse_gfx950,0.0118,59.16,1007.22
gfx950,256,896,64,4096,False,torch.bfloat16,torch.bfloat16,False,False,flydsl,2091,4,7.8185,flydsl_gemm5_abf16_wbf16_bf16_t32x64x128_split_k4_block_m_warp1_block_n_warp4_block_k_warp1_async_copyTrue_b_to_ldsTrue_b_preshuffleFalse_c_to_ldsFalse_gfx950,0.0118,60.08,1020.53
gfx950,256,928,64,4096,False,torch.bfloat16,torch.bfloat16,False,False,flydsl,2848,4,7.7091,flydsl_gemm8_abf16_wbf16_bf16_t16x64x64_split_k4_block_m_warp1_block_n_warp2_block_k_warp1_async_copyTrue_b_to_ldsTrue_b_preshuffleFalse_c_to_ldsFalse_gfx950,0.0112,63.11,1069.55
gfx950,256,960,64,4096,False,torch.bfloat16,torch.bfloat16,False,False,flydsl,1563,4,7.6155,flydsl_gemm4_abf16_wbf16_bf16_t16x64x256_split_k4_block_m_warp1_block_n_warp1_block_k_warp2_async_copyTrue_b_to_ldsTrue_b_preshuffleFalse_c_to_ldsFalse_gfx950,0.0192,66.09,1117.65
gfx950,256,992,64,4096,False,torch.bfloat16,torch.bfloat16,False,False,flydsl,2848,4,7.9301,flydsl_gemm8_abf16_wbf16_bf16_t16x64x64_split_k4_block_m_warp1_block_n_warp2_block_k_warp1_async_copyTrue_b_to_ldsTrue_b_preshuffleFalse_c_to_ldsFalse_gfx950,0.0115,65.58,1106.89
gfx950,256,1024,64,4096,False,torch.bfloat16,torch.bfloat16,False,False,flydsl,1563,4,8.0602,flydsl_gemm4_abf16_wbf16_bf16_t16x64x256_split_k4_block_m_warp1_block_n_warp1_block_k_warp2_async_copyTrue_b_to_ldsTrue_b_preshuffleFalse_c_to_ldsFalse_gfx950,0.0191,66.61,1122.05
gfx950,256,1088,64,4096,False,torch.bfloat16,torch.bfloat16,False,False,flydsl,2091,4,8.2663,flydsl_gemm5_abf16_wbf16_bf16_t32x64x128_split_k4_block_m_warp1_block_n_warp4_block_k_warp1_async_copyTrue_b_to_ldsTrue_b_preshuffleFalse_c_to_ldsFalse_gfx950,0.0117,69.01,1158.49
gfx950,256,1152,64,4096,False,torch.bfloat16,torch.bfloat16,False,False,flydsl,1170,4,8.3247,flydsl_gemm3_abf16_wbf16_bf16_t32x64x256_split_k4_block_m_warp1_block_n_warp2_block_k_warp2_async_copyTrue_b_to_ldsTrue_b_preshuffleFalse_c_to_ldsFalse_gfx950,0.0191,72.55,1214.33
gfx950,256,1216,64,4096,False,torch.bfloat16,torch.bfloat16,False,False,flydsl,2499,4,8.2066,flydsl_gemm6_abf16_wbf16_bf16_t32x64x64_split_k4_block_m_warp1_block_n_warp4_block_k_warp1_async_copyTrue_b_to_ldsTrue_b_preshuffleFalse_c_to_ldsFalse_gfx950,0.0116,77.69,1296.69
gfx950,256,1280,64,4096,False,torch.bfloat16,torch.bfloat16,False,False,flydsl,2874,4,8.6059,flydsl_gemm8_abf16_wbf16_bf16_t32x64x64_split_k4_block_m_warp1_block_n_warp2_block_k_warp2_async_copyTrue_b_to_ldsTrue_b_preshuffleFalse_c_to_ldsFalse_gfx950,0.0188,77.98,1298.4
gfx950,256,1344,64,4096,False,torch.bfloat16,torch.bfloat16,False,False,flydsl,2499,4,8.4381,flydsl_gemm6_abf16_wbf16_bf16_t32x64x64_split_k4_block_m_warp1_block_n_warp4_block_k_warp1_async_copyTrue_b_to_ldsTrue_b_preshuffleFalse_c_to_ldsFalse_gfx950,0.0116,83.51,1387.32
gfx950,256,1408,64,4096,False,torch.bfloat16,torch.bfloat16,False,False,flydsl,1670,4,8.5749,flydsl_gemm4_abf16_wbf16_bf16_t32x64x128_split_k4_block_m_warp1_block_n_warp2_block_k_warp2_async_copyTrue_b_to_ldsTrue_b_preshuffleFalse_c_to_ldsFalse_gfx950,0.019,86.09,1427.29
gfx950,256,1472,64,4096,False,torch.bfloat16,torch.bfloat16,False,False,flydsl,2878,4,8.6431,flydsl_gemm8_abf16_wbf16_bf16_t32x64x64_split_k4_block_m_warp2_block_n_warp2_block_k_warp1_async_copyTrue_b_to_ldsTrue_b_preshuffleFalse_c_to_ldsFalse_gfx950,0.012,89.29,1477.63
gfx950,256,1536,64,4096,False,torch.bfloat16,torch.bfloat16,False,False,flydsl,2875,4,9.1554,flydsl_gemm8_abf16_wbf16_bf16_t32x64x64_split_k4_block_m_warp1_block_n_warp4_block_k_warp1_async_copyTrue_b_to_ldsTrue_b_preshuffleFalse_c_to_ldsFalse_gfx950,0.0116,87.96,1453.11
gfx950,256,1600,64,4096,False,torch.bfloat16,torch.bfloat16,False,False,flydsl,2875,4,8.9698,flydsl_gemm8_abf16_wbf16_bf16_t32x64x64_split_k4_block_m_warp1_block_n_warp4_block_k_warp1_async_copyTrue_b_to_ldsTrue_b_preshuffleFalse_c_to_ldsFalse_gfx950,0.0128,93.52,1542.54
gfx950,256,1664,64,4096,False,torch.bfloat16,torch.bfloat16,False,False,flydsl,2091,4,9.1114,flydsl_gemm5_abf16_wbf16_bf16_t32x64x128_split_k4_block_m_warp1_block_n_warp4_block_k_warp1_async_copyTrue_b_to_ldsTrue_b_preshuffleFalse_c_to_ldsFalse_gfx950,0.0123,95.75,1577.01
gfx950,256,1728,64,4096,False,torch.bfloat16,torch.bfloat16,False,False,flydsl,2091,4,9.2559,flydsl_gemm5_abf16_wbf16_bf16_t32x64x128_split_k4_block_m_warp1_block_n_warp4_block_k_warp1_async_copyTrue_b_to_ldsTrue_b_preshuffleFalse_c_to_ldsFalse_gfx950,0.0125,97.88,1609.92
gfx950,256,1792,64,4096,False,torch.bfloat16,torch.bfloat16,False,False,flydsl,2832,2,9.7007,flydsl_gemm8_abf16_wbf16_bf16_t16x64x128_split_k2_block_m_warp1_block_n_warp1_block_k_warp2_async_copyTrue_b_to_ldsTrue_b_preshuffleFalse_c_to_ldsFalse_gfx950,0.0132,96.85,1590.99
gfx950,256,1856,64,4096,False,torch.bfloat16,torch.bfloat16,False,False,flydsl,2127,4,9.5633,flydsl_gemm5_abf16_wbf16_bf16_t32x64x64_split_k4_block_m_warp1_block_n_warp4_block_k_warp1_async_copyTrue_b_to_ldsTrue_b_preshuffleFalse_c_to_ldsFalse_gfx950,0.0128,101.75,1669.53
gfx950,256,1920,64,4096,False,torch.bfloat16,torch.bfloat16,False,False,flydsl,2090,4,9.6433,flydsl_gemm5_abf16_wbf16_bf16_t32x64x128_split_k4_block_m_warp1_block_n_warp2_block_k_warp2_async_copyTrue_b_to_ldsTrue_b_preshuffleFalse_c_to_ldsFalse_gfx950,0.0192,104.39,1710.9
gfx950,256,1984,64,4096,False,torch.bfloat16,torch.bfloat16,False,False,flydsl,2127,4,9.9659,flydsl_gemm5_abf16_wbf16_bf16_t32x64x64_split_k4_block_m_warp1_block_n_warp4_block_k_warp1_async_copyTrue_b_to_ldsTrue_b_preshuffleFalse_c_to_ldsFalse_gfx950,0.0126,104.37,1708.94
gfx950,256,2048,64,4096,False,torch.bfloat16,torch.bfloat16,False,False,flydsl,2844,2,10.3002,flydsl_gemm8_abf16_wbf16_bf16_t16x64x64_split_k2_block_m_warp1_block_n_warp1_block_k_warp2_async_copyTrue_b_to_ldsTrue_b_preshuffleFalse_c_to_ldsFalse_gfx950,0.0125,104.24,1705.18
gfx950,256,4096,64,4096,False,torch.bfloat16,torch.bfloat16,False,False,asm,8,5,13.7773,_ZN5aiter39bf16gemm_fp32bf16_tn_96x64_splitk_cleanE,0.0139,155.87,2511.6
gfx950,256,6144,64,4096,False,torch.bfloat16,torch.bfloat16,False,False,asm,8,4,16.1277,_ZN5aiter39bf16gemm_fp32bf16_tn_96x64_splitk_cleanE,0.0116,199.73,3202.09
gfx950,256,8192,64,4096,False,torch.bfloat16,torch.bfloat16,False,False,flydsl,2890,1,19.9899,flydsl_gemm8_abf16_wbf16_bf16_t48x64x64_split_k1_block_m_warp1_block_n_warp2_block_k_warp1_async_copyTrue_b_to_ldsTrue_b_preshuffleFalse_c_to_ldsFalse_gfx950,0.0,214.86,3435.82
gfx950,256,10240,64,4096,False,torch.bfloat16,torch.bfloat16,False,False,flydsl,2890,1,20.5426,flydsl_gemm8_abf16_wbf16_bf16_t48x64x64_split_k1_block_m_warp1_block_n_warp2_block_k_warp1_async_copyTrue_b_to_ldsTrue_b_preshuffleFalse_c_to_ldsFalse_gfx950,0.0,261.35,4172.85
gfx950,256,12288,64,4096,False,torch.bfloat16,torch.bfloat16,False,False,flydsl,2890,1,23.366,flydsl_gemm8_abf16_wbf16_bf16_t48x64x64_split_k1_block_m_warp1_block_n_warp2_block_k_warp1_async_copyTrue_b_to_ldsTrue_b_preshuffleFalse_c_to_ldsFalse_gfx950,0.0,275.72,4397.86
gfx950,256,14336,64,4096,False,torch.bfloat16,torch.bfloat16,False,False,flydsl,1760,1,25.7433,flydsl_gemm4_abf16_wbf16_bf16_t64x64x128_split_k1_block_m_warp4_block_n_warp2_block_k_warp1_async_copyTrue_b_to_ldsTrue_b_preshuffleFalse_c_to_ldsFalse_gfx950,0.0,291.97,4653.63
gfx950,256,16384,64,4096,False,torch.bfloat16,torch.bfloat16,False,False,flydsl,2171,1,29.1633,flydsl_gemm5_abf16_wbf16_bf16_t64x64x128_split_k1_block_m_warp1_block_n_warp4_block_k_warp2_async_copyTrue_b_to_ldsTrue_b_preshuffleFalse_c_to_ldsFalse_gfx950,0.0049,294.55,4692.17
gfx950,256,16,256,4096,False,torch.bfloat16,torch.bfloat16,False,False,flydsl,4270,8,4.2553,flydsl_gemm8_abf16_wbf16_bf16_t16x64x64_split_k8_block_m_warp1_block_n_warp1_block_k_warp2_async_copyTrue_b_to_ldsTrue_b_preshuffleFalse_c_to_ldsFalse_gfx950,0.0266,7.89,525.56
gfx950,256,32,256,4096,False,torch.bfloat16,torch.bfloat16,False,False,flydsl,4095,8,4.4972,flydsl_gemm7_abf16_wbf16_bf16_t32x64x64_split_k8_block_m_warp2_block_n_warp2_block_k_warp1_async_copyTrue_b_to_ldsTrue_b_preshuffleFalse_c_to_ldsFalse_gfx950,0.0201,14.92,528.26
gfx950,256,48,256,4096,False,torch.bfloat16,torch.bfloat16,False,False,flydsl,3659,8,4.9041,flydsl_gemm6_abf16_wbf16_bf16_t16x64x64_split_k8_block_m_warp1_block_n_warp2_block_k_warp1_async_copyTrue_b_to_ldsTrue_b_preshuffleFalse_c_to_ldsFalse_gfx950,0.0181,20.53,512.82
gfx950,256,64,256,4096,False,torch.bfloat16,torch.bfloat16,False,False,flydsl,3347,8,5.3049,flydsl_gemm4_abf16_wbf16_bf16_t16x64x128_split_k8_block_m_warp1_block_n_warp2_block_k_warp1_async_copyTrue_b_to_ldsTrue_b_preshuffleFalse_c_to_ldsFalse_gfx950,0.0201,25.3,500.33
gfx950,256,80,256,4096,False,torch.bfloat16,torch.bfloat16,False,False,flydsl,5212,8,5.5507,flydsl_gemm7_abf16_wbf16_bf16_t32x64x64_split_k8_block_m_warp1_block_n_warp4_block_k_warp1_async_copyTrue_b_to_ldsTrue_b_preshuffleFalse_c_to_ldsFalse_gfx950,0.0195,30.23,503.26
gfx950,256,96,256,4096,False,torch.bfloat16,torch.bfloat16,False,False,flydsl,3532,8,5.7875,flydsl_gemm4_abf16_wbf16_bf16_t32x64x128_split_k8_block_m_warp1_block_n_warp4_block_k_warp1_async_copyTrue_b_to_ldsTrue_b_preshuffleFalse_c_to_ldsFalse_gfx950,0.0193,34.79,506.74
gfx950,256,112,256,4096,False,torch.bfloat16,torch.bfloat16,False,False,flydsl,3344,4,6.1242,flydsl_gemm4_abf16_wbf16_bf16_t16x64x128_split_k4_block_m_warp1_block_n_warp2_block_k_warp1_async_copyTrue_b_to_ldsTrue_b_preshuffleFalse_c_to_ldsFalse_gfx950,0.0113,38.35,501.62
gfx950,256,128,256,4096,False,torch.bfloat16,torch.bfloat16,False,False,flydsl,5559,4,6.2443,flydsl_gemm7_abf16_wbf16_bf16_t16x64x128_split_k4_block_m_warp1_block_n_warp1_block_k_warp2_async_copyTrue_b_to_ldsTrue_b_preshuffleFalse_c_to_ldsFalse_gfx950,0.0201,42.99,514.27
gfx950,256,144,256,4096,False,torch.bfloat16,torch.bfloat16,False,False,flydsl,3707,4,6.471,flydsl_gemm4_abf16_wbf16_bf16_t16x64x128_split_k4_block_m_warp1_block_n_warp1_block_k_warp2_async_copyTrue_b_to_ldsTrue_b_preshuffleFalse_c_to_ldsFalse_gfx950,0.0199,46.67,517.78
gfx950,256,160,256,4096,False,torch.bfloat16,torch.bfloat16,False,False,flydsl,4647,4,6.6415,flydsl_gemm5_abf16_wbf16_bf16_t16x64x128_split_k4_block_m_warp1_block_n_warp1_block_k_warp2_async_copyTrue_b_to_ldsTrue_b_preshuffleFalse_c_to_ldsFalse_gfx950,0.0186,50.52,525.45
gfx950,256,176,256,4096,False,torch.bfloat16,torch.bfloat16,False,False,flydsl,3719,4,6.7046,flydsl_gemm4_abf16_wbf16_bf16_t16x64x256_split_k4_block_m_warp1_block_n_warp1_block_k_warp2_async_copyTrue_b_to_ldsTrue_b_preshuffleFalse_c_to_ldsFalse_gfx950,0.0181,55.05,541.28
gfx950,256,192,256,4096,False,torch.bfloat16,torch.bfloat16,False,False,flydsl,3719,4,6.7845,flydsl_gemm4_abf16_wbf16_bf16_t16x64x256_split_k4_block_m_warp1_block_n_warp1_block_k_warp2_async_copyTrue_b_to_ldsTrue_b_preshuffleFalse_c_to_ldsFalse_gfx950,0.0186,59.35,555.43
gfx950,256,208,256,4096,False,torch.bfloat16,torch.bfloat16,False,False,flydsl,5559,4,7.0109,flydsl_gemm7_abf16_wbf16_bf16_t16x64x128_split_k4_block_m_warp1_block_n_warp1_block_k_warp2_async_copyTrue_b_to_ldsTrue_b_preshuffleFalse_c_to_ldsFalse_gfx950,0.0194,62.22,557.36
gfx950,256,224,256,4096,False,torch.bfloat16,torch.bfloat16,False,False,flydsl,3708,4,7.2547,flydsl_gemm4_abf16_wbf16_bf16_t16x64x128_split_k4_block_m_warp1_block_n_warp2_block_k_warp1_async_copyTrue_b_to_ldsTrue_b_preshuffleFalse_c_to_ldsFalse_gfx950,0.0115,64.75,557.82
gfx950,256,240,256,4096,False,torch.bfloat16,torch.bfloat16,False,False,flydsl,5819,4,7.5295,flydsl_gemm8_abf16_wbf16_bf16_t16x64x64_split_k4_block_m_warp1_block_n_warp1_block_k_warp2_async_copyTrue_b_to_ldsTrue_b_preshuffleFalse_c_to_ldsFalse_gfx950,0.0188,66.85,555.96
gfx950,256,256,256,4096,False,torch.bfloat16,torch.bfloat16,False,False,flydsl,3707,4,7.5691,flydsl_gemm4_abf16_wbf16_bf16_t16x64x128_split_k4_block_m_warp1_block_n_warp1_block_k_warp2_async_copyTrue_b_to_ldsTrue_b_preshuffleFalse_c_to_ldsFalse_gfx950,0.0187,70.93,571.45
gfx950,256,288,256,4096,False,torch.bfloat16,torch.bfloat16,False,False,flydsl,3955,4,8.0564,flydsl_gemm4_abf16_wbf16_bf16_t32x64x128_split_k4_block_m_warp1_block_n_warp4_block_k_warp1_async_copyTrue_b_to_ldsTrue_b_preshuffleFalse_c_to_ldsFalse_gfx950,0.0113,74.97,571.46
gfx950,256,320,256,4096,False,torch.bfloat16,torch.bfloat16,False,False,flydsl,3955,4,8.0714,flydsl_gemm4_abf16_wbf16_bf16_t32x64x128_split_k4_block_m_warp1_block_n_warp4_block_k_warp1_async_copyTrue_b_to_ldsTrue_b_preshuffleFalse_c_to_ldsFalse_gfx950,0.0116,83.14,604.91
gfx950,256,352,256,4096,False,torch.bfloat16,torch.bfloat16,False,False,flydsl,5886,4,8.8003,flydsl_gemm8_abf16_wbf16_bf16_t32x64x64_split_k4_block_m_warp2_block_n_warp2_block_k_warp1_async_copyTrue_b_to_ldsTrue_b_preshuffleFalse_c_to_ldsFalse_gfx950,0.0114,83.88,586.45
gfx950,256,384,256,4096,False,torch.bfloat16,torch.bfloat16,False,False,flydsl,4723,4,8.6955,flydsl_gemm5_abf16_wbf16_bf16_t32x64x128_split_k4_block_m_warp1_block_n_warp4_block_k_warp1_async_copyTrue_b_to_ldsTrue_b_preshuffleFalse_c_to_ldsFalse_gfx950,0.0117,92.61,625.55
gfx950,256,416,256,4096,False,torch.bfloat16,torch.bfloat16,False,False,flydsl,3704,2,9.5162,flydsl_gemm4_abf16_wbf16_bf16_t16x64x128_split_k2_block_m_warp1_block_n_warp1_block_k_warp2_async_copyTrue_b_to_ldsTrue_b_preshuffleFalse_c_to_ldsFalse_gfx950,0.012,91.68,600.87
gfx950,256,448,256,4096,False,torch.bfloat16,torch.bfloat16,False,False,flydsl,4722,4,9.2939,flydsl_gemm5_abf16_wbf16_bf16_t32x64x128_split_k4_block_m_warp1_block_n_warp2_block_k_warp2_async_copyTrue_b_to_ldsTrue_b_preshuffleFalse_c_to_ldsFalse_gfx950,0.0185,101.09,645.21
gfx950,256,480,256,4096,False,torch.bfloat16,torch.bfloat16,False,False,flydsl,5192,2,9.8411,flydsl_gemm6_abf16_wbf16_bf16_t16x64x128_split_k2_block_m_warp1_block_n_warp1_block_k_warp2_async_copyTrue_b_to_ldsTrue_b_preshuffleFalse_c_to_ldsFalse_gfx950,0.0122,102.29,637.64
gfx950,256,512,256,4096,False,torch.bfloat16,torch.bfloat16,False,False,flydsl,3704,2,9.9183,flydsl_gemm4_abf16_wbf16_bf16_t16x64x128_split_k2_block_m_warp1_block_n_warp1_block_k_warp2_async_copyTrue_b_to_ldsTrue_b_preshuffleFalse_c_to_ldsFalse_gfx950,0.0124,108.26,660.76
gfx950,256,544,256,4096,False,torch.bfloat16,torch.bfloat16,False,False,flydsl,4803,4,10.1958,flydsl_gemm5_abf16_wbf16_bf16_t48x64x64_split_k4_block_m_warp1_block_n_warp1_block_k_warp2_async_copyTrue_b_to_ldsTrue_b_preshuffleFalse_c_to_ldsFalse_gfx950,0.0192,111.89,670.09
gfx950,256,576,256,4096,False,torch.bfloat16,torch.bfloat16,False,False,flydsl,2755,4,10.3304,flydsl_gemm3_abf16_wbf16_bf16_t32x64x128_split_k4_block_m_warp1_block_n_warp1_block_k_warp2_async_copyTrue_b_to_ldsTrue_b_preshuffleFalse_c_to_ldsFalse_gfx950,0.0194,116.93,688.32
gfx950,256,608,256,4096,False,torch.bfloat16,torch.bfloat16,False,False,flydsl,4804,4,10.6498,flydsl_gemm5_abf16_wbf16_bf16_t48x64x64_split_k4_block_m_warp1_block_n_warp2_block_k_warp1_async_copyTrue_b_to_ldsTrue_b_preshuffleFalse_c_to_ldsFalse_gfx950,0.0121,119.73,693.83
gfx950,256,640,256,4096,False,torch.bfloat16,torch.bfloat16,False,False,flydsl,5667,4,10.3591,flydsl_gemm7_abf16_wbf16_bf16_t48x64x64_split_k4_block_m_warp1_block_n_warp1_block_k_warp2_async_copyTrue_b_to_ldsTrue_b_preshuffleFalse_c_to_ldsFalse_gfx950,0.0196,129.57,740.19
gfx950,256,672,256,4096,False,torch.bfloat16,torch.bfloat16,False,False,flydsl,3948,2,10.9182,flydsl_gemm4_abf16_wbf16_bf16_t32x64x128_split_k2_block_m_warp2_block_n_warp1_block_k_warp2_async_copyTrue_b_to_ldsTrue_b_preshuffleFalse_c_to_ldsFalse_gfx950,0.012,129.08,727.8
gfx950,256,704,256,4096,False,torch.bfloat16,torch.bfloat16,False,False,flydsl,2759,4,11.0048,flydsl_gemm3_abf16_wbf16_bf16_t32x64x128_split_k4_block_m_warp1_block_n_warp4_block_k_warp1_async_copyTrue_b_to_ldsTrue_b_preshuffleFalse_c_to_ldsFalse_gfx950,0.0119,134.16,747.38
gfx950,256,736,256,4096,False,torch.bfloat16,torch.bfloat16,False,False,flydsl,3946,2,11.0818,flydsl_gemm4_abf16_wbf16_bf16_t32x64x128_split_k2_block_m_warp1_block_n_warp4_block_k_warp1_async_copyTrue_b_to_ldsTrue_b_preshuffleFalse_c_to_ldsFalse_gfx950,0.0046,139.28,767.32
gfx950,256,768,256,4096,False,torch.bfloat16,torch.bfloat16,False,False,flydsl,4761,4,11.1956,flydsl_gemm5_abf16_wbf16_bf16_t32x64x64_split_k4_block_m_warp2_block_n_warp1_block_k_warp2_async_copyTrue_b_to_ldsTrue_b_preshuffleFalse_c_to_ldsFalse_gfx950,0.0189,143.86,784.4
gfx950,256,800,256,4096,False,torch.bfloat16,torch.bfloat16,False,False,flydsl,2786,2,11.3999,flydsl_gemm3_abf16_wbf16_bf16_t32x64x256_split_k2_block_m_warp1_block_n_warp4_block_k_warp1_async_copyTrue_b_to_ldsTrue_b_preshuffleFalse_c_to_ldsFalse_gfx950,0.0046,147.17,794.77
gfx950,256,832,256,4096,False,torch.bfloat16,torch.bfloat16,False,False,asm,7,5,12.0303,_ZN5aiter39bf16gemm_fp32bf16_tn_80x64_splitk_cleanE,0.0142,145.04,776.28
gfx950,256,864,256,4096,False,torch.bfloat16,torch.bfloat16,False,False,flydsl,5877,2,11.6383,flydsl_gemm8_abf16_wbf16_bf16_t32x64x64_split_k2_block_m_warp2_block_n_warp2_block_k_warp1_async_copyTrue_b_to_ldsTrue_b_preshuffleFalse_c_to_ldsFalse_gfx950,0.0047,155.69,826.36
gfx950,256,896,256,4096,False,torch.bfloat16,torch.bfloat16,False,False,asm,7,5,12.1672,_ZN5aiter39bf16gemm_fp32bf16_tn_80x64_splitk_cleanE,0.0143,154.44,813.33
gfx950,256,928,256,4096,False,torch.bfloat16,torch.bfloat16,False,False,flydsl,3945,2,11.6563,flydsl_gemm4_abf16_wbf16_bf16_t32x64x128_split_k2_block_m_warp1_block_n_warp2_block_k_warp2_async_copyTrue_b_to_ldsTrue_b_preshuffleFalse_c_to_ldsFalse_gfx950,0.0118,166.96,872.87
gfx950,256,960,256,4096,False,torch.bfloat16,torch.bfloat16,False,False,asm,8,5,12.3396,_ZN5aiter39bf16gemm_fp32bf16_tn_96x64_splitk_cleanE,0.0141,163.15,847.11
gfx950,256,992,256,4096,False,torch.bfloat16,torch.bfloat16,False,False,asm,7,4,12.4278,_ZN5aiter39bf16gemm_fp32bf16_tn_80x64_splitk_cleanE,0.0117,167.4,863.51
gfx950,256,1024,256,4096,False,torch.bfloat16,torch.bfloat16,False,False,asm,8,5,12.5455,_ZN5aiter39bf16gemm_fp32bf16_tn_96x64_splitk_cleanE,0.0142,171.18,877.61
gfx950,256,1088,256,4096,False,torch.bfloat16,torch.bfloat16,False,False,asm,7,4,12.7263,_ZN5aiter39bf16gemm_fp32bf16_tn_80x64_splitk_cleanE,0.0118,179.29,908.91
gfx950,256,1152,256,4096,False,torch.bfloat16,torch.bfloat16,False,False,asm,8,5,12.7965,_ZN5aiter39bf16gemm_fp32bf16_tn_96x64_splitk_cleanE,0.014,188.8,947.46
gfx950,256,1216,256,4096,False,torch.bfloat16,torch.bfloat16,False,False,asm,7,4,13.2484,_ZN5aiter39bf16gemm_fp32bf16_tn_80x64_splitk_cleanE,0.0118,192.49,957.19
gfx950,256,1280,256,4096,False,torch.bfloat16,torch.bfloat16,False,False,asm,8,4,13.4026,_ZN5aiter39bf16gemm_fp32bf16_tn_96x64_splitk_cleanE,0.012,200.29,987.74
gfx950,256,1344,256,4096,False,torch.bfloat16,torch.bfloat16,False,False,asm,8,4,13.6055,_ZN5aiter39bf16gemm_fp32bf16_tn_96x64_splitk_cleanE,0.0119,207.16,1013.95
gfx950,256,1408,256,4096,False,torch.bfloat16,torch.bfloat16,False,False,asm,7,3,14.1991,_ZN5aiter39bf16gemm_fp32bf16_tn_80x64_splitk_cleanE,0.0089,207.96,1010.8
gfx950,256,1472,256,4096,False,torch.bfloat16,torch.bfloat16,False,False,asm,7,3,14.2348,_ZN5aiter39bf16gemm_fp32bf16_tn_80x64_splitk_cleanE,0.0088,216.86,1047.39
gfx950,256,1536,256,4096,False,torch.bfloat16,torch.bfloat16,False,False,asm,7,3,14.1786,_ZN5aiter39bf16gemm_fp32bf16_tn_80x64_splitk_cleanE,0.0089,227.19,1090.83
gfx950,256,1600,256,4096,False,torch.bfloat16,torch.bfloat16,False,False,asm,7,3,14.5521,_ZN5aiter39bf16gemm_fp32bf16_tn_80x64_splitk_cleanE,0.0092,230.58,1101.12
gfx950,256,1664,256,4096,False,torch.bfloat16,torch.bfloat16,False,False,asm,7,3,14.7319,_ZN5aiter39bf16gemm_fp32bf16_tn_80x64_splitk_cleanE,0.009,236.88,1125.49
gfx950,256,1728,256,4096,False,torch.bfloat16,torch.bfloat16,False,False,asm,8,3,15.1885,_ZN5aiter39bf16gemm_fp32bf16_tn_96x64_splitk_cleanE,0.0091,238.59,1128.33
gfx950,256,1792,256,4096,False,torch.bfloat16,torch.bfloat16,False,False,asm,8,3,15.5954,_ZN5aiter39bf16gemm_fp32bf16_tn_96x64_splitk_cleanE,0.0091,240.97,1134.61
gfx950,256,1856,256,4096,False,torch.bfloat16,torch.bfloat16,False,False,asm,8,3,15.4772,_ZN5aiter39bf16gemm_fp32bf16_tn_96x64_splitk_cleanE,0.0091,251.49,1179.27
gfx950,256,1920,256,4096,False,torch.bfloat16,torch.bfloat16,False,False,asm,8,3,15.884,_ZN5aiter39bf16gemm_fp32bf16_tn_96x64_splitk_cleanE,0.0091,253.5,1184.14
gfx950,256,1984,256,4096,False,torch.bfloat16,torch.bfloat16,False,False,asm,8,3,16.8476,_ZN5aiter39bf16gemm_fp32bf16_tn_96x64_splitk_cleanE,0.0091,246.96,1149.47
gfx950,256,2048,256,4096,False,torch.bfloat16,torch.bfloat16,False,False,asm,5,2,17.4249,_ZN5aiter39bf16gemm_fp32bf16_tn_64x64_splitk_cleanE,0.005,246.48,1143.36
gfx950,256,4096,256,4096,False,torch.bfloat16,torch.bfloat16,False,False,flydsl,3160,1,21.7734,flydsl_gemm3_abf16_wbf16_bf16_t64x64x128_split_k1_block_m_warp4_block_n_warp2_block_k_warp1_async_copyTrue_b_to_ldsTrue_b_preshuffleFalse_c_to_ldsFalse_gfx950,0.0,394.52,1733.71
gfx950,256,6144,256,4096,False,torch.bfloat16,torch.bfloat16,False,False,flydsl,2848,1,28.5069,flydsl_gemm3_abf16_wbf16_bf16_t48x128x128_split_k1_block_m_warp1_block_n_warp2_block_k_warp2_async_copyTrue_b_to_ldsTrue_b_preshuffleFalse_c_to_ldsFalse_gfx950,0.0048,451.99,1949.51
gfx950,256,8192,256,4096,False,torch.bfloat16,torch.bfloat16,False,False,flydsl,4365,1,35.5682,flydsl_gemm4_abf16_wbf16_bf16_t96x128x64_split_k1_block_m_warp1_block_n_warp4_block_k_warp1_async_copyTrue_b_to_ldsTrue_b_preshuffleFalse_c_to_ldsFalse_gfx950,0.0,483.01,2063.65
gfx950,256,10240,256,4096,False,torch.bfloat16,torch.bfloat16,False,False,flydsl,4367,1,39.1262,flydsl_gemm4_abf16_wbf16_bf16_t96x128x64_split_k1_block_m_warp2_block_n_warp1_block_k_warp2_async_copyTrue_b_to_ldsTrue_b_preshuffleFalse_c_to_ldsFalse_gfx950,0.0049,548.86,2331.59
gfx950,256,12288,256,4096,False,torch.bfloat16,torch.bfloat16,False,False,flydsl,4365,1,42.4878,flydsl_gemm4_abf16_wbf16_bf16_t96x128x64_split_k1_block_m_warp1_block_n_warp4_block_k_warp1_async_copyTrue_b_to_ldsTrue_b_preshuffleFalse_c_to_ldsFalse_gfx950,0.0,606.52,2566.66
gfx950,256,14336,256,4096,False,torch.bfloat16,torch.bfloat16,False,False,flydsl,3507,1,47.079,flydsl_gemm4_abf16_wbf16_bf16_t128x128x64_split_k1_block_m_warp2_block_n_warp4_block_k_warp1_async_copyTrue_b_to_ldsTrue_b_preshuffleFalse_c_to_ldsFalse_gfx950,0.0,638.6,2695.0
gfx950,256,16384,256,4096,False,torch.bfloat16,torch.bfloat16,False,False,torch,0,0,49.8606,native,0.0,689.12,2902.16
gfx950,256,16,512,4096,False,torch.bfloat16,torch.bfloat16,False,False,flydsl,4271,8,5.2807,flydsl_gemm8_abf16_wbf16_bf16_t16x64x64_split_k8_block_m_warp1_block_n_warp2_block_k_warp1_async_copyTrue_b_to_ldsTrue_b_preshuffleFalse_c_to_ldsFalse_gfx950,0.0206,12.71,822.19
gfx950,256,32,512,4096,False,torch.bfloat16,torch.bfloat16,False,False,flydsl,3284,8,5.6218,flydsl_gemm5_abf16_wbf16_bf16_t32x64x64_split_k8_block_m_warp1_block_n_warp4_block_k_warp1_async_copyTrue_b_to_ldsTrue_b_preshuffleFalse_c_to_ldsFalse_gfx950,0.0204,23.87,798.54
gfx950,256,48,512,4096,False,torch.bfloat16,torch.bfloat16,False,False,flydsl,2455,8,6.1235,flydsl_gemm4_abf16_wbf16_bf16_t16x64x128_split_k8_block_m_warp1_block_n_warp2_block_k_warp1_async_copyTrue_b_to_ldsTrue_b_preshuffleFalse_c_to_ldsFalse_gfx950,0.019,32.88,757.19
gfx950,256,64,512,4096,False,torch.bfloat16,torch.bfloat16,False,False,flydsl,5127,4,6.6407,flydsl_gemm7_abf16_wbf16_bf16_t16x64x128_split_k4_block_m_warp1_block_n_warp1_block_k_warp2_async_copyTrue_b_to_ldsTrue_b_preshuffleFalse_c_to_ldsFalse_gfx950,0.0204,40.42,720.43
gfx950,256,80,512,4096,False,torch.bfloat16,torch.bfloat16,False,False,flydsl,5375,4,6.894,flydsl_gemm8_abf16_wbf16_bf16_t16x64x128_split_k4_block_m_warp1_block_n_warp1_block_k_warp2_async_copyTrue_b_to_ldsTrue_b_preshuffleFalse_c_to_ldsFalse_gfx950,0.0209,48.67,715.34
gfx950,256,96,512,4096,False,torch.bfloat16,torch.bfloat16,False,False,flydsl,4215,4,7.0779,flydsl_gemm5_abf16_wbf16_bf16_t16x64x128_split_k4_block_m_warp1_block_n_warp1_block_k_warp2_async_copyTrue_b_to_ldsTrue_b_preshuffleFalse_c_to_ldsFalse_gfx950,0.0207,56.89,717.59
gfx950,256,112,512,4096,False,torch.bfloat16,torch.bfloat16,False,False,flydsl,4215,4,7.3471,flydsl_gemm5_abf16_wbf16_bf16_t16x64x128_split_k4_block_m_warp1_block_n_warp1_block_k_warp2_async_copyTrue_b_to_ldsTrue_b_preshuffleFalse_c_to_ldsFalse_gfx950,0.0199,63.94,711.37
gfx950,256,128,512,4096,False,torch.bfloat16,torch.bfloat16,False,False,flydsl,4647,4,7.7051,flydsl_gemm5_abf16_wbf16_bf16_t16x64x128_split_k4_block_m_warp1_block_n_warp1_block_k_warp2_async_copyTrue_b_to_ldsTrue_b_preshuffleFalse_c_to_ldsFalse_gfx950,0.0198,69.68,697.45
gfx950,256,144,512,4096,False,torch.bfloat16,torch.bfloat16,False,False,flydsl,3955,4,7.8946,flydsl_gemm4_abf16_wbf16_bf16_t32x64x128_split_k4_block_m_warp1_block_n_warp4_block_k_warp1_async_copyTrue_b_to_ldsTrue_b_preshuffleFalse_c_to_ldsFalse_gfx950,0.0119,76.51,699.39
gfx950,256,160,512,4096,False,torch.bfloat16,torch.bfloat16,False,False,flydsl,2794,4,8.2027,flydsl_gemm3_abf16_wbf16_bf16_t32x64x256_split_k4_block_m_warp1_block_n_warp2_block_k_warp2_async_copyTrue_b_to_ldsTrue_b_preshuffleFalse_c_to_ldsFalse_gfx950,0.0187,81.81,691.1
gfx950,256,176,512,4096,False,torch.bfloat16,torch.bfloat16,False,False,flydsl,4722,4,8.6175,flydsl_gemm5_abf16_wbf16_bf16_t32x64x128_split_k4_block_m_warp1_block_n_warp2_block_k_warp2_async_copyTrue_b_to_ldsTrue_b_preshuffleFalse_c_to_ldsFalse_gfx950,0.0196,85.66,674.94
gfx950,256,192,512,4096,False,torch.bfloat16,torch.bfloat16,False,False,flydsl,3955,4,8.7284,flydsl_gemm4_abf16_wbf16_bf16_t32x64x128_split_k4_block_m_warp1_block_n_warp4_block_k_warp1_async_copyTrue_b_to_ldsTrue_b_preshuffleFalse_c_to_ldsFalse_gfx950,0.0116,92.26,683.26
gfx950,256,208,512,4096,False,torch.bfloat16,torch.bfloat16,False,False,flydsl,5883,4,9.1315,flydsl_gemm8_abf16_wbf16_bf16_t32x64x64_split_k4_block_m_warp1_block_n_warp4_block_k_warp1_async_copyTrue_b_to_ldsTrue_b_preshuffleFalse_c_to_ldsFalse_gfx950,0.0121,95.54,669.25
gfx950,256,224,512,4096,False,torch.bfloat16,torch.bfloat16,False,False,flydsl,3954,4,9.3315,flydsl_gemm4_abf16_wbf16_bf16_t32x64x128_split_k4_block_m_warp1_block_n_warp2_block_k_warp2_async_copyTrue_b_to_ldsTrue_b_preshuffleFalse_c_to_ldsFalse_gfx950,0.0193,100.68,670.71
gfx950,256,240,512,4096,False,torch.bfloat16,torch.bfloat16,False,False,flydsl,3958,4,9.7336,flydsl_gemm4_abf16_wbf16_bf16_t32x64x128_split_k4_block_m_warp2_block_n_warp2_block_k_warp1_async_copyTrue_b_to_ldsTrue_b_preshuffleFalse_c_to_ldsFalse_gfx950,0.0119,103.42,658.15
gfx950,256,256,512,4096,False,torch.bfloat16,torch.bfloat16,False,False,flydsl,4722,4,9.7231,flydsl_gemm5_abf16_wbf16_bf16_t32x64x128_split_k4_block_m_warp1_block_n_warp2_block_k_warp2_async_copyTrue_b_to_ldsTrue_b_preshuffleFalse_c_to_ldsFalse_gfx950,0.0191,110.43,674.02
gfx950,256,288,512,4096,False,torch.bfloat16,torch.bfloat16,False,False,flydsl,4237,4,10.2164,flydsl_gemm4_abf16_wbf16_bf16_t64x64x128_split_k4_block_m_warp4_block_n_warp1_block_k_warp2_async_copyTrue_b_to_ldsTrue_b_preshuffleFalse_c_to_ldsFalse_gfx950,0.0188,118.24,670.34
gfx950,256,320,512,4096,False,torch.bfloat16,torch.bfloat16,False,False,flydsl,4036,4,10.2775,flydsl_gemm4_abf16_wbf16_bf16_t48x64x128_split_k4_block_m_warp1_block_n_warp2_block_k_warp1_async_copyTrue_b_to_ldsTrue_b_preshuffleFalse_c_to_ldsFalse_gfx950,0.0114,130.59,695.05
gfx950,256,352,512,4096,False,torch.bfloat16,torch.bfloat16,False,False,flydsl,3945,2,10.6369,flydsl_gemm4_abf16_wbf16_bf16_t32x64x128_split_k2_block_m_warp1_block_n_warp2_block_k_warp2_async_copyTrue_b_to_ldsTrue_b_preshuffleFalse_c_to_ldsFalse_gfx950,0.0122,138.8,699.3
gfx950,256,384,512,4096,False,torch.bfloat16,torch.bfloat16,False,False,flydsl,3946,2,10.917,flydsl_gemm4_abf16_wbf16_bf16_t32x64x128_split_k2_block_m_warp1_block_n_warp4_block_k_warp1_async_copyTrue_b_to_ldsTrue_b_preshuffleFalse_c_to_ldsFalse_gfx950,0.0049,147.53,708.37
gfx950,256,416,512,4096,False,torch.bfloat16,torch.bfloat16,False,False,flydsl,2786,2,11.1586,flydsl_gemm3_abf16_wbf16_bf16_t32x64x256_split_k2_block_m_warp1_block_n_warp4_block_k_warp1_async_copyTrue_b_to_ldsTrue_b_preshuffleFalse_c_to_ldsFalse_gfx950,0.0049,156.37,719.46
gfx950,256,448,512,4096,False,torch.bfloat16,torch.bfloat16,False,False,flydsl,4714,2,11.6804,flydsl_gemm5_abf16_wbf16_bf16_t32x64x128_split_k2_block_m_warp1_block_n_warp4_block_k_warp1_async_copyTrue_b_to_ldsTrue_b_preshuffleFalse_c_to_ldsFalse_gfx950,0.0049,160.87,712.57
gfx950,256,480,512,4096,False,torch.bfloat16,torch.bfloat16,False,False,asm,7,5,12.2513,_ZN5aiter39bf16gemm_fp32bf16_tn_80x64_splitk_cleanE,0.0141,164.33,703.43
gfx950,256,512,512,4096,False,torch.bfloat16,torch.bfloat16,False,False,flydsl,5625,2,12.3798,flydsl_gemm7_abf16_wbf16_bf16_t32x64x64_split_k2_block_m_warp1_block_n_warp2_block_k_warp2_async_copyTrue_b_to_ldsTrue_b_preshuffleFalse_c_to_ldsFalse_gfx950,0.012,173.47,719.95
gfx950,256,544,512,4096,False,torch.bfloat16,torch.bfloat16,False,False,asm,7,4,12.8083,_ZN5aiter39bf16gemm_fp32bf16_tn_80x64_splitk_cleanE,0.0119,178.14,718.89
gfx950,256,576,512,4096,False,torch.bfloat16,torch.bfloat16,False,False,asm,8,5,13.0114,_ZN5aiter39bf16gemm_fp32bf16_tn_96x64_splitk_cleanE,0.0143,185.68,730.34
gfx950,256,608,512,4096,False,torch.bfloat16,torch.bfloat16,False,False,asm,7,4,13.233,_ZN5aiter39bf16gemm_fp32bf16_tn_80x64_splitk_cleanE,0.012,192.71,740.39
gfx950,256,640,512,4096,False,torch.bfloat16,torch.bfloat16,False,False,asm,8,4,13.4583,_ZN5aiter39bf16gemm_fp32bf16_tn_96x64_splitk_cleanE,0.0116,199.46,749.91
gfx950,256,672,512,4096,False,torch.bfloat16,torch.bfloat16,False,False,asm,8,4,13.6966,_ZN5aiter39bf16gemm_fp32bf16_tn_96x64_splitk_cleanE,0.0118,205.79,758.4
gfx950,256,704,512,4096,False,torch.bfloat16,torch.bfloat16,False,False,asm,8,4,13.9441,_ZN5aiter39bf16gemm_fp32bf16_tn_96x64_splitk_cleanE,0.0118,211.76,766.09
gfx950,256,736,512,4096,False,torch.bfloat16,torch.bfloat16,False,False,asm,8,4,14.0382,_ZN5aiter39bf16gemm_fp32bf16_tn_96x64_splitk_cleanE,0.0118,219.9,781.96
gfx950,256,768,512,4096,False,torch.bfloat16,torch.bfloat16,False,False,asm,8,4,14.4099,_ZN5aiter39bf16gemm_fp32bf16_tn_96x64_splitk_cleanE,0.0118,223.54,782.25
gfx950,256,800,512,4096,False,torch.bfloat16,torch.bfloat16,False,False,asm,7,3,14.6178,_ZN5aiter39bf16gemm_fp32bf16_tn_80x64_splitk_cleanE,0.0088,229.55,791.3
gfx950,256,832,512,4096,False,torch.bfloat16,torch.bfloat16,False,False,flydsl,3937,1,14.9991,flydsl_gemm4_abf16_wbf16_bf16_t32x64x128_split_k1_block_m_warp1_block_n_warp4_block_k_warp1_async_copyTrue_b_to_ldsTrue_b_preshuffleFalse_c_to_ldsFalse_gfx950,0.0,232.66,790.85
gfx950,256,864,512,4096,False,torch.bfloat16,torch.bfloat16,False,False,asm,8,3,15.0822,_ZN5aiter39bf16gemm_fp32bf16_tn_96x64_splitk_cleanE,0.0087,240.28,806.04
gfx950,256,896,512,4096,False,torch.bfloat16,torch.bfloat16,False,False,flydsl,5252,1,15.1406,flydsl_gemm6_abf16_wbf16_bf16_t32x64x128_split_k1_block_m_warp1_block_n_warp2_block_k_warp2_async_copyTrue_b_to_ldsTrue_b_preshuffleFalse_c_to_ldsFalse_gfx950,0.005,248.21,822.41
gfx950,256,928,512,4096,False,torch.bfloat16,torch.bfloat16,False,False,flydsl,4704,1,15.2841,flydsl_gemm5_abf16_wbf16_bf16_t32x64x128_split_k1_block_m_warp1_block_n_warp2_block_k_warp2_async_copyTrue_b_to_ldsTrue_b_preshuffleFalse_c_to_ldsFalse_gfx950,0.005,254.66,833.99
gfx950,256,960,512,4096,False,torch.bfloat16,torch.bfloat16,False,False,flydsl,3934,1,15.3437,flydsl_gemm4_abf16_wbf16_bf16_t32x64x128_split_k1_block_m_warp1_block_n_warp1_block_k_warp4_async_copyTrue_b_to_ldsTrue_b_preshuffleFalse_c_to_ldsFalse_gfx950,0.0116,262.42,849.97
gfx950,256,992,512,4096,False,torch.bfloat16,torch.bfloat16,False,False,flydsl,5252,1,15.3444,flydsl_gemm6_abf16_wbf16_bf16_t32x64x128_split_k1_block_m_warp1_block_n_warp2_block_k_warp2_async_copyTrue_b_to_ldsTrue_b_preshuffleFalse_c_to_ldsFalse_gfx950,0.0049,271.16,869.15
gfx950,256,1024,512,4096,False,torch.bfloat16,torch.bfloat16,False,False,flydsl,4704,1,15.3621,flydsl_gemm5_abf16_wbf16_bf16_t32x64x128_split_k1_block_m_warp1_block_n_warp2_block_k_warp2_async_copyTrue_b_to_ldsTrue_b_preshuffleFalse_c_to_ldsFalse_gfx950,0.0049,279.58,887.35
gfx950,256,1088,512,4096,False,torch.bfloat16,torch.bfloat16,False,False,asm,7,2,18.0861,_ZN5aiter39bf16gemm_fp32bf16_tn_80x64_splitk_cleanE,0.005,252.32,786.31
gfx950,256,1152,512,4096,False,torch.bfloat16,torch.bfloat16,False,False,asm,7,2,18.3381,_ZN5aiter39bf16gemm_fp32bf16_tn_80x64_splitk_cleanE,0.005,263.49,807.67
gfx950,256,1216,512,4096,False,torch.bfloat16,torch.bfloat16,False,False,asm,7,2,18.5962,_ZN5aiter39bf16gemm_fp32bf16_tn_80x64_splitk_cleanE,0.005,274.26,828.18
gfx950,256,1280,512,4096,False,torch.bfloat16,torch.bfloat16,False,False,flydsl,4888,1,18.9739,flydsl_gemm5_abf16_wbf16_bf16_t64x64x128_split_k1_block_m_warp2_block_n_warp2_block_k_warp2_async_copyTrue_b_to_ldsTrue_b_preshuffleFalse_c_to_ldsFalse_gfx950,0.0051,282.95,842.78
gfx950,256,1344,512,4096,False,torch.bfloat16,torch.bfloat16,False,False,flydsl,3156,1,19.0866,flydsl_gemm3_abf16_wbf16_bf16_t64x64x128_split_k1_block_m_warp2_block_n_warp2_block_k_warp2_async_copyTrue_b_to_ldsTrue_b_preshuffleFalse_c_to_ldsFalse_gfx950,0.0051,295.35,868.7
gfx950,256,1408,512,4096,False,torch.bfloat16,torch.bfloat16,False,False,flydsl,4888,1,19.1606,flydsl_gemm5_abf16_wbf16_bf16_t64x64x128_split_k1_block_m_warp2_block_n_warp2_block_k_warp2_async_copyTrue_b_to_ldsTrue_b_preshuffleFalse_c_to_ldsFalse_gfx950,0.0051,308.21,896.13
gfx950,256,1472,512,4096,False,torch.bfloat16,torch.bfloat16,False,False,flydsl,4888,1,19.1924,flydsl_gemm5_abf16_wbf16_bf16_t64x64x128_split_k1_block_m_warp2_block_n_warp2_block_k_warp2_async_copyTrue_b_to_ldsTrue_b_preshuffleFalse_c_to_ldsFalse_gfx950,0.0051,321.69,925.38
gfx950,256,1536,512,4096,False,torch.bfloat16,torch.bfloat16,False,False,flydsl,3157,1,19.2515,flydsl_gemm3_abf16_wbf16_bf16_t64x64x128_split_k1_block_m_warp2_block_n_warp4_block_k_warp1_async_copyTrue_b_to_ldsTrue_b_preshuffleFalse_c_to_ldsFalse_gfx950,0.0,334.65,953.18
gfx950,256,1600,512,4096,False,torch.bfloat16,torch.bfloat16,False,False,flydsl,4888,1,19.3567,flydsl_gemm5_abf16_wbf16_bf16_t64x64x128_split_k1_block_m_warp2_block_n_warp2_block_k_warp2_async_copyTrue_b_to_ldsTrue_b_preshuffleFalse_c_to_ldsFalse_gfx950,0.0049,346.7,978.47
gfx950,256,1664,512,4096,False,torch.bfloat16,torch.bfloat16,False,False,flydsl,3157,1,19.7156,flydsl_gemm3_abf16_wbf16_bf16_t64x64x128_split_k1_block_m_warp2_block_n_warp4_block_k_warp1_async_copyTrue_b_to_ldsTrue_b_preshuffleFalse_c_to_ldsFalse_gfx950,0.0,354.0,990.57
gfx950,256,1728,512,4096,False,torch.bfloat16,torch.bfloat16,False,False,flydsl,3156,1,20.0324,flydsl_gemm3_abf16_wbf16_bf16_t64x64x128_split_k1_block_m_warp2_block_n_warp2_block_k_warp2_async_copyTrue_b_to_ldsTrue_b_preshuffleFalse_c_to_ldsFalse_gfx950,0.0049,361.8,1004.35
gfx950,256,1792,512,4096,False,torch.bfloat16,torch.bfloat16,False,False,flydsl,4888,1,20.0323,flydsl_gemm5_abf16_wbf16_bf16_t64x64x128_split_k1_block_m_warp2_block_n_warp2_block_k_warp2_async_copyTrue_b_to_ldsTrue_b_preshuffleFalse_c_to_ldsFalse_gfx950,0.0049,375.2,1033.8
gfx950,256,1856,512,4096,False,torch.bfloat16,torch.bfloat16,False,False,flydsl,3156,1,20.4162,flydsl_gemm3_abf16_wbf16_bf16_t64x64x128_split_k1_block_m_warp2_block_n_warp2_block_k_warp2_async_copyTrue_b_to_ldsTrue_b_preshuffleFalse_c_to_ldsFalse_gfx950,0.0049,381.3,1043.25
gfx950,256,1920,512,4096,False,torch.bfloat16,torch.bfloat16,False,False,flydsl,4204,1,21.2279,flydsl_gemm4_abf16_wbf16_bf16_t64x64x128_split_k1_block_m_warp4_block_n_warp2_block_k_warp1_async_copyTrue_b_to_ldsTrue_b_preshuffleFalse_c_to_ldsFalse_gfx950,0.0,379.36,1031.14
gfx950,256,1984,512,4096,False,torch.bfloat16,torch.bfloat16,False,False,flydsl,3157,1,21.1211,flydsl_gemm3_abf16_wbf16_bf16_t64x64x128_split_k1_block_m_warp2_block_n_warp4_block_k_warp1_async_copyTrue_b_to_ldsTrue_b_preshuffleFalse_c_to_ldsFalse_gfx950,0.0,393.99,1064.28
gfx950,256,2048,512,4096,False,torch.bfloat16,torch.bfloat16,False,False,flydsl,4888,1,21.2677,flydsl_gemm5_abf16_wbf16_bf16_t64x64x128_split_k1_block_m_warp2_block_n_warp2_block_k_warp2_async_copyTrue_b_to_ldsTrue_b_preshuffleFalse_c_to_ldsFalse_gfx950,0.0049,403.9,1084.68
gfx950,256,4096,512,4096,False,torch.bfloat16,torch.bfloat16,False,False,flydsl,4065,1,30.6676,flydsl_gemm4_abf16_wbf16_bf16_t64x128x64_split_k1_block_m_warp2_block_n_warp4_block_k_warp1_async_copyTrue_b_to_ldsTrue_b_preshuffleFalse_c_to_ldsFalse_gfx950,0.0,560.2,1367.67
gfx950,256,6144,512,4096,False,torch.bfloat16,torch.bfloat16,False,False,flydsl,4365,1,38.8247,flydsl_gemm4_abf16_wbf16_bf16_t96x128x64_split_k1_block_m_warp1_block_n_warp4_block_k_warp1_async_copyTrue_b_to_ldsTrue_b_preshuffleFalse_c_to_ldsFalse_gfx950,0.0,663.75,1566.46
gfx950,256,8192,512,4096,False,torch.bfloat16,torch.bfloat16,False,False,torch,0,0,45.7645,native,0.0,750.79,1741.34
gfx950,256,10240,512,4096,False,torch.bfloat16,torch.bfloat16,False,False,torch,0,0,54.113,native,0.0,793.7,1821.49
gfx950,256,12288,512,4096,False,torch.bfloat16,torch.bfloat16,False,False,opus,6402,0,61.1809,opus_gemm_mono_tile_512x192x128x64_2x4_16x16x32_0x0x0_nooob_4g_safe,0.0,842.41,1919.56
gfx950,256,14336,512,4096,False,torch.bfloat16,torch.bfloat16,False,False,opus,6401,0,64.5807,opus_gemm_mono_tile_512x128x256x64_2x4_16x16x32_0x0x0_nooob_4g_safe,0.0,931.08,2110.77
gfx950,256,16384,512,4096,False,torch.bfloat16,torch.bfloat16,False,False,opus,1401,0,68.3623,opus_gemm_mono_tile_512x128x256x64_2x4_16x16x32_0x0x0_nooob,0.0,1005.22,2270.1
gfx950,256,16,1024,4096,False,torch.bfloat16,torch.bfloat16,False,False,flydsl,4022,8,6.2326,flydsl_gemm7_abf16_wbf16_bf16_t16x64x64_split_k8_block_m_warp1_block_n_warp1_block_k_warp2_async_copyTrue_b_to_ldsTrue_b_preshuffleFalse_c_to_ldsFalse_gfx950,0.0258,21.53,1372.21
gfx950,256,32,1024,4096,False,torch.bfloat16,torch.bfloat16,False,False,flydsl,4007,4,6.8983,flydsl_gemm7_abf16_wbf16_bf16_t16x64x128_split_k4_block_m_warp1_block_n_warp1_block_k_warp2_async_copyTrue_b_to_ldsTrue_b_preshuffleFalse_c_to_ldsFalse_gfx950,0.019,38.91,1263.54
gfx950,256,48,1024,4096,False,torch.bfloat16,torch.bfloat16,False,False,flydsl,1495,4,7.2215,flydsl_gemm3_abf16_wbf16_bf16_t16x64x256_split_k4_block_m_warp1_block_n_warp1_block_k_warp2_async_copyTrue_b_to_ldsTrue_b_preshuffleFalse_c_to_ldsFalse_gfx950,0.0187,55.76,1229.68
gfx950,256,64,1024,4096,False,torch.bfloat16,torch.bfloat16,False,False,flydsl,4763,4,7.8339,flydsl_gemm6_abf16_wbf16_bf16_t16x64x128_split_k4_block_m_warp1_block_n_warp1_block_k_warp2_async_copyTrue_b_to_ldsTrue_b_preshuffleFalse_c_to_ldsFalse_gfx950,0.0195,68.53,1154.47
gfx950,256,80,1024,4096,False,torch.bfloat16,torch.bfloat16,False,False,flydsl,3523,4,8.5375,flydsl_gemm4_abf16_wbf16_bf16_t32x64x128_split_k4_block_m_warp1_block_n_warp4_block_k_warp1_async_copyTrue_b_to_ldsTrue_b_preshuffleFalse_c_to_ldsFalse_gfx950,0.0122,78.6,1078.51
gfx950,256,96,1024,4096,False,torch.bfloat16,torch.bfloat16,False,False,flydsl,4875,4,8.907,flydsl_gemm6_abf16_wbf16_bf16_t32x64x64_split_k4_block_m_warp1_block_n_warp4_block_k_warp1_async_copyTrue_b_to_ldsTrue_b_preshuffleFalse_c_to_ldsFalse_gfx950,0.0122,90.41,1052.17
gfx950,256,112,1024,4096,False,torch.bfloat16,torch.bfloat16,False,False,flydsl,4291,4,9.4295,flydsl_gemm5_abf16_wbf16_bf16_t32x64x128_split_k4_block_m_warp1_block_n_warp4_block_k_warp1_async_copyTrue_b_to_ldsTrue_b_preshuffleFalse_c_to_ldsFalse_gfx950,0.0119,99.64,1011.24
gfx950,256,128,1024,4096,False,torch.bfloat16,torch.bfloat16,False,False,flydsl,4723,4,9.6719,flydsl_gemm5_abf16_wbf16_bf16_t32x64x128_split_k4_block_m_warp1_block_n_warp4_block_k_warp1_async_copyTrue_b_to_ldsTrue_b_preshuffleFalse_c_to_ldsFalse_gfx950,0.0118,111.02,1002.84
gfx950,256,144,1024,4096,False,torch.bfloat16,torch.bfloat16,False,False,flydsl,5721,4,10.2177,flydsl_gemm7_abf16_wbf16_bf16_t64x64x64_split_k4_block_m_warp4_block_n_warp1_block_k_warp2_async_copyTrue_b_to_ldsTrue_b_preshuffleFalse_c_to_ldsFalse_gfx950,0.0186,118.22,965.3
gfx950,256,160,1024,4096,False,torch.bfloat16,torch.bfloat16,False,False,flydsl,5953,4,10.549,flydsl_gemm8_abf16_wbf16_bf16_t64x64x64_split_k4_block_m_warp2_block_n_warp2_block_k_warp1_async_copyTrue_b_to_ldsTrue_b_preshuffleFalse_c_to_ldsFalse_gfx950,0.0114,127.23,950.52
gfx950,256,176,1024,4096,False,torch.bfloat16,torch.bfloat16,False,False,flydsl,2786,2,10.5895,flydsl_gemm3_abf16_wbf16_bf16_t32x64x256_split_k2_block_m_warp1_block_n_warp4_block_k_warp1_async_copyTrue_b_to_ldsTrue_b_preshuffleFalse_c_to_ldsFalse_gfx950,0.005,139.42,962.35
gfx950,256,192,1024,4096,False,torch.bfloat16,torch.bfloat16,False,False,flydsl,2785,2,10.7679,flydsl_gemm3_abf16_wbf16_bf16_t32x64x256_split_k2_block_m_warp1_block_n_warp2_block_k_warp2_async_copyTrue_b_to_ldsTrue_b_preshuffleFalse_c_to_ldsFalse_gfx950,0.0122,149.58,961.63
gfx950,256,208,1024,4096,False,torch.bfloat16,torch.bfloat16,False,False,flydsl,5877,2,10.9186,flydsl_gemm8_abf16_wbf16_bf16_t32x64x64_split_k2_block_m_warp2_block_n_warp2_block_k_warp1_async_copyTrue_b_to_ldsTrue_b_preshuffleFalse_c_to_ldsFalse_gfx950,0.0049,159.8,963.36
gfx950,256,224,1024,4096,False,torch.bfloat16,torch.bfloat16,False,False,flydsl,2783,2,11.6175,flydsl_gemm3_abf16_wbf16_bf16_t32x64x256_split_k2_block_m_warp1_block_n_warp1_block_k_warp4_async_copyTrue_b_to_ldsTrue_b_preshuffleFalse_c_to_ldsFalse_gfx950,0.0199,161.74,919.51
gfx950,256,240,1024,4096,False,torch.bfloat16,torch.bfloat16,False,False,flydsl,3946,2,10.9612,flydsl_gemm4_abf16_wbf16_bf16_t32x64x128_split_k2_block_m_warp1_block_n_warp4_block_k_warp1_async_copyTrue_b_to_ldsTrue_b_preshuffleFalse_c_to_ldsFalse_gfx950,0.0049,183.67,989.51
gfx950,256,256,1024,4096,False,torch.bfloat16,torch.bfloat16,False,False,flydsl,5264,2,12.0777,flydsl_gemm6_abf16_wbf16_bf16_t32x64x128_split_k2_block_m_warp2_block_n_warp1_block_k_warp2_async_copyTrue_b_to_ldsTrue_b_preshuffleFalse_c_to_ldsFalse_gfx950,0.0123,177.81,911.6
gfx950,256,288,1024,4096,False,torch.bfloat16,torch.bfloat16,False,False,asm,7,4,12.7897,_ZN5aiter39bf16gemm_fp32bf16_tn_80x64_splitk_cleanE,0.0118,188.9,886.47
gfx950,256,320,1024,4096,False,torch.bfloat16,torch.bfloat16,False,False,asm,7,4,13.1072,_ZN5aiter39bf16gemm_fp32bf16_tn_80x64_splitk_cleanE,0.0119,204.8,890.0
gfx950,256,352,1024,4096,False,torch.bfloat16,torch.bfloat16,False,False,asm,8,4,13.5616,_ZN5aiter39bf16gemm_fp32bf16_tn_96x64_splitk_cleanE,0.0116,217.73,884.34
gfx950,256,384,1024,4096,False,torch.bfloat16,torch.bfloat16,False,False,asm,8,4,13.8164,_ZN5aiter39bf16gemm_fp32bf16_tn_96x64_splitk_cleanE,0.0117,233.15,891.75
gfx950,256,416,1024,4096,False,torch.bfloat16,torch.bfloat16,False,False,flydsl,3937,1,14.5842,flydsl_gemm4_abf16_wbf16_bf16_t32x64x128_split_k1_block_m_warp1_block_n_warp4_block_k_warp1_async_copyTrue_b_to_ldsTrue_b_preshuffleFalse_c_to_ldsFalse_gfx950,0.0,239.28,867.27
gfx950,256,448,1024,4096,False,torch.bfloat16,torch.bfloat16,False,False,flydsl,4704,1,14.6186,flydsl_gemm5_abf16_wbf16_bf16_t32x64x128_split_k1_block_m_warp1_block_n_warp2_block_k_warp2_async_copyTrue_b_to_ldsTrue_b_preshuffleFalse_c_to_ldsFalse_gfx950,0.0051,257.08,887.65
gfx950,256,480,1024,4096,False,torch.bfloat16,torch.bfloat16,False,False,flydsl,4704,1,14.7117,flydsl_gemm5_abf16_wbf16_bf16_t32x64x128_split_k1_block_m_warp1_block_n_warp2_block_k_warp2_async_copyTrue_b_to_ldsTrue_b_preshuffleFalse_c_to_ldsFalse_gfx950,0.0051,273.7,904.3
gfx950,256,512,1024,4096,False,torch.bfloat16,torch.bfloat16,False,False,flydsl,3937,1,14.8877,flydsl_gemm4_abf16_wbf16_bf16_t32x64x128_split_k1_block_m_warp1_block_n_warp4_block_k_warp1_async_copyTrue_b_to_ldsTrue_b_preshuffleFalse_c_to_ldsFalse_gfx950,0.0,288.49,915.62
gfx950,256,544,1024,4096,False,torch.bfloat16,torch.bfloat16,False,False,flydsl,4204,1,17.7773,flydsl_gemm4_abf16_wbf16_bf16_t64x64x128_split_k1_block_m_warp4_block_n_warp2_block_k_warp1_async_copyTrue_b_to_ldsTrue_b_preshuffleFalse_c_to_ldsFalse_gfx950,0.0,256.7,785.22
gfx950,256,576,1024,4096,False,torch.bfloat16,torch.bfloat16,False,False,asm,7,2,17.8483,_ZN5aiter39bf16gemm_fp32bf16_tn_80x64_splitk_cleanE,0.0049,270.72,800.46
gfx950,256,608,1024,4096,False,torch.bfloat16,torch.bfloat16,False,False,flydsl,3156,1,18.0026,flydsl_gemm3_abf16_wbf16_bf16_t64x64x128_split_k1_block_m_warp2_block_n_warp2_block_k_warp2_async_copyTrue_b_to_ldsTrue_b_preshuffleFalse_c_to_ldsFalse_gfx950,0.005,283.31,811.8
gfx950,256,640,1024,4096,False,torch.bfloat16,torch.bfloat16,False,False,flydsl,4888,1,18.1352,flydsl_gemm5_abf16_wbf16_bf16_t64x64x128_split_k1_block_m_warp2_block_n_warp2_block_k_warp2_async_copyTrue_b_to_ldsTrue_b_preshuffleFalse_c_to_ldsFalse_gfx950,0.005,296.04,823.93
gfx950,256,672,1024,4096,False,torch.bfloat16,torch.bfloat16,False,False,flydsl,4888,1,18.0182,flydsl_gemm5_abf16_wbf16_bf16_t64x64x128_split_k1_block_m_warp2_block_n_warp2_block_k_warp2_async_copyTrue_b_to_ldsTrue_b_preshuffleFalse_c_to_ldsFalse_gfx950,0.005,312.86,847.47
gfx950,256,704,1024,4096,False,torch.bfloat16,torch.bfloat16,False,False,flydsl,4888,1,18.2824,flydsl_gemm5_abf16_wbf16_bf16_t64x64x128_split_k1_block_m_warp2_block_n_warp2_block_k_warp2_async_copyTrue_b_to_ldsTrue_b_preshuffleFalse_c_to_ldsFalse_gfx950,0.005,323.02,853.15
gfx950,256,736,1024,4096,False,torch.bfloat16,torch.bfloat16,False,False,flydsl,4888,1,18.0484,flydsl_gemm5_abf16_wbf16_bf16_t64x64x128_split_k1_block_m_warp2_block_n_warp2_block_k_warp2_async_copyTrue_b_to_ldsTrue_b_preshuffleFalse_c_to_ldsFalse_gfx950,0.005,342.08,882.36
gfx950,256,768,1024,4096,False,torch.bfloat16,torch.bfloat16,False,False,flydsl,4891,1,18.3952,flydsl_gemm5_abf16_wbf16_bf16_t64x64x128_split_k1_block_m_warp4_block_n_warp1_block_k_warp2_async_copyTrue_b_to_ldsTrue_b_preshuffleFalse_c_to_ldsFalse_gfx950,0.005,350.22,883.54
gfx950,256,800,1024,4096,False,torch.bfloat16,torch.bfloat16,False,False,flydsl,4888,1,18.2017,flydsl_gemm5_abf16_wbf16_bf16_t64x64x128_split_k1_block_m_warp2_block_n_warp2_block_k_warp2_async_copyTrue_b_to_ldsTrue_b_preshuffleFalse_c_to_ldsFalse_gfx950,0.005,368.7,910.94
gfx950,256,832,1024,4096,False,torch.bfloat16,torch.bfloat16,False,False,flydsl,3157,1,18.7633,flydsl_gemm3_abf16_wbf16_bf16_t64x64x128_split_k1_block_m_warp2_block_n_warp4_block_k_warp1_async_copyTrue_b_to_ldsTrue_b_preshuffleFalse_c_to_ldsFalse_gfx950,0.0,371.97,901.14
gfx950,256,864,1024,4096,False,torch.bfloat16,torch.bfloat16,False,False,flydsl,4888,1,18.5932,flydsl_gemm5_abf16_wbf16_bf16_t64x64x128_split_k1_block_m_warp2_block_n_warp2_block_k_warp2_async_copyTrue_b_to_ldsTrue_b_preshuffleFalse_c_to_ldsFalse_gfx950,0.005,389.81,927.0
gfx950,256,896,1024,4096,False,torch.bfloat16,torch.bfloat16,False,False,flydsl,3156,1,18.6587,flydsl_gemm3_abf16_wbf16_bf16_t64x64x128_split_k1_block_m_warp2_block_n_warp2_block_k_warp2_async_copyTrue_b_to_ldsTrue_b_preshuffleFalse_c_to_ldsFalse_gfx950,0.005,402.83,941.31
gfx950,256,928,1024,4096,False,torch.bfloat16,torch.bfloat16,False,False,flydsl,4888,1,18.3806,flydsl_gemm5_abf16_wbf16_bf16_t64x64x128_split_k1_block_m_warp2_block_n_warp2_block_k_warp2_async_copyTrue_b_to_ldsTrue_b_preshuffleFalse_c_to_ldsFalse_gfx950,0.005,423.52,973.38
gfx950,256,960,1024,4096,False,torch.bfloat16,torch.bfloat16,False,False,flydsl,3156,1,18.8103,flydsl_gemm3_abf16_wbf16_bf16_t64x64x128_split_k1_block_m_warp2_block_n_warp2_block_k_warp2_async_copyTrue_b_to_ldsTrue_b_preshuffleFalse_c_to_ldsFalse_gfx950,0.005,428.12,968.57
gfx950,256,992,1024,4096,False,torch.bfloat16,torch.bfloat16,False,False,flydsl,4204,1,18.776,flydsl_gemm4_abf16_wbf16_bf16_t64x64x128_split_k1_block_m_warp4_block_n_warp2_block_k_warp1_async_copyTrue_b_to_ldsTrue_b_preshuffleFalse_c_to_ldsFalse_gfx950,0.0,443.2,987.79
gfx950,256,1024,1024,4096,False,torch.bfloat16,torch.bfloat16,False,False,flydsl,4888,1,19.3538,flydsl_gemm5_abf16_wbf16_bf16_t64x64x128_split_k1_block_m_warp2_block_n_warp2_block_k_warp2_async_copyTrue_b_to_ldsTrue_b_preshuffleFalse_c_to_ldsFalse_gfx950,0.005,443.84,975.23
gfx950,256,1088,1024,4096,False,torch.bfloat16,torch.bfloat16,False,False,flydsl,4401,1,23.1814,flydsl_gemm4_abf16_wbf16_bf16_t96x64x128_split_k1_block_m_warp1_block_n_warp4_block_k_warp1_async_copyTrue_b_to_ldsTrue_b_preshuffleFalse_c_to_ldsFalse_gfx950,0.0,393.71,842.47
gfx950,256,1152,1024,4096,False,torch.bfloat16,torch.bfloat16,False,False,flydsl,4440,1,23.8168,flydsl_gemm4_abf16_wbf16_bf16_t96x64x64_split_k1_block_m_warp2_block_n_warp2_block_k_warp1_async_copyTrue_b_to_ldsTrue_b_preshuffleFalse_c_to_ldsFalse_gfx950,0.0,405.75,847.51
gfx950,256,1216,1024,4096,False,torch.bfloat16,torch.bfloat16,False,False,flydsl,4440,1,23.6238,flydsl_gemm4_abf16_wbf16_bf16_t96x64x64_split_k1_block_m_warp2_block_n_warp2_block_k_warp1_async_copyTrue_b_to_ldsTrue_b_preshuffleFalse_c_to_ldsFalse_gfx950,0.0,431.79,882.18
gfx950,256,1280,1024,4096,False,torch.bfloat16,torch.bfloat16,False,False,flydsl,4440,1,23.6116,flydsl_gemm4_abf16_wbf16_bf16_t96x64x64_split_k1_block_m_warp2_block_n_warp2_block_k_warp1_async_copyTrue_b_to_ldsTrue_b_preshuffleFalse_c_to_ldsFalse_gfx950,0.0,454.75,910.39
gfx950,256,1344,1024,4096,False,torch.bfloat16,torch.bfloat16,False,False,flydsl,4440,1,24.5832,flydsl_gemm4_abf16_wbf16_bf16_t96x64x64_split_k1_block_m_warp2_block_n_warp2_block_k_warp1_async_copyTrue_b_to_ldsTrue_b_preshuffleFalse_c_to_ldsFalse_gfx950,0.0,458.62,901.07
gfx950,256,1408,1024,4096,False,torch.bfloat16,torch.bfloat16,False,False,flydsl,4403,1,24.3156,flydsl_gemm4_abf16_wbf16_bf16_t96x64x128_split_k1_block_m_warp2_block_n_warp1_block_k_warp2_async_copyTrue_b_to_ldsTrue_b_preshuffleFalse_c_to_ldsFalse_gfx950,0.005,485.74,937.94
gfx950,256,1472,1024,4096,False,torch.bfloat16,torch.bfloat16,False,False,flydsl,4400,1,25.1834,flydsl_gemm4_abf16_wbf16_bf16_t96x64x128_split_k1_block_m_warp1_block_n_warp2_block_k_warp2_async_copyTrue_b_to_ldsTrue_b_preshuffleFalse_c_to_ldsFalse_gfx950,0.005,490.32,931.64
gfx950,256,1536,1024,4096,False,torch.bfloat16,torch.bfloat16,False,False,flydsl,5992,1,24.9138,flydsl_gemm8_abf16_wbf16_bf16_t96x64x64_split_k1_block_m_warp1_block_n_warp2_block_k_warp2_async_copyTrue_b_to_ldsTrue_b_preshuffleFalse_c_to_ldsFalse_gfx950,0.0049,517.18,968.03
gfx950,256,1600,1024,4096,False,torch.bfloat16,torch.bfloat16,False,False,flydsl,2249,1,27.4332,flydsl_gemm3_abf16_wbf16_bf16_t128x64x128_split_k1_block_m_warp4_block_n_warp2_block_k_warp2_async_copyTrue_b_to_ldsTrue_b_preshuffleFalse_c_to_ldsFalse_gfx950,0.0048,489.25,903.02
gfx950,256,1664,1024,4096,False,torch.bfloat16,torch.bfloat16,False,False,flydsl,3597,1,27.9859,flydsl_gemm4_abf16_wbf16_bf16_t128x64x64_split_k1_block_m_warp2_block_n_warp4_block_k_warp1_async_copyTrue_b_to_ldsTrue_b_preshuffleFalse_c_to_ldsFalse_gfx950,0.0,498.77,908.6
gfx950,256,1728,1024,4096,False,torch.bfloat16,torch.bfloat16,False,False,flydsl,3597,1,28.258,flydsl_gemm4_abf16_wbf16_bf16_t128x64x64_split_k1_block_m_warp2_block_n_warp4_block_k_warp1_async_copyTrue_b_to_ldsTrue_b_preshuffleFalse_c_to_ldsFalse_gfx950,0.0,512.97,923.04
gfx950,256,1792,1024,4096,False,torch.bfloat16,torch.bfloat16,False,False,flydsl,2932,1,28.2948,flydsl_gemm3_abf16_wbf16_bf16_t64x128x128_split_k1_block_m_warp2_block_n_warp4_block_k_warp2_async_copyTrue_b_to_ldsTrue_b_preshuffleFalse_c_to_ldsFalse_gfx950,0.0048,531.28,945.0
gfx950,256,1856,1024,4096,False,torch.bfloat16,torch.bfloat16,False,False,flydsl,3597,1,28.6664,flydsl_gemm4_abf16_wbf16_bf16_t128x64x64_split_k1_block_m_warp2_block_n_warp4_block_k_warp1_async_copyTrue_b_to_ldsTrue_b_preshuffleFalse_c_to_ldsFalse_gfx950,0.0,543.12,955.62
gfx950,256,1920,1024,4096,False,torch.bfloat16,torch.bfloat16,False,False,flydsl,2249,1,29.2212,flydsl_gemm3_abf16_wbf16_bf16_t128x64x128_split_k1_block_m_warp4_block_n_warp2_block_k_warp2_async_copyTrue_b_to_ldsTrue_b_preshuffleFalse_c_to_ldsFalse_gfx950,0.0049,551.18,959.9
gfx950,256,1984,1024,4096,False,torch.bfloat16,torch.bfloat16,False,False,flydsl,3600,1,28.9124,flydsl_gemm4_abf16_wbf16_bf16_t128x64x64_split_k1_block_m_warp4_block_n_warp2_block_k_warp1_async_copyTrue_b_to_ldsTrue_b_preshuffleFalse_c_to_ldsFalse_gfx950,0.0,575.64,992.82
gfx950,256,2048,1024,4096,False,torch.bfloat16,torch.bfloat16,False,False,flydsl,2244,1,29.8124,flydsl_gemm3_abf16_wbf16_bf16_t128x64x128_split_k1_block_m_warp2_block_n_warp4_block_k_warp2_async_copyTrue_b_to_ldsTrue_b_preshuffleFalse_c_to_ldsFalse_gfx950,0.0049,576.27,984.83
gfx950,256,4096,1024,4096,False,torch.bfloat16,torch.bfloat16,False,False,torch,0,0,46.9874,native,0.0,731.25,1071.17
gfx950,256,6144,1024,4096,False,torch.bfloat16,torch.bfloat16,False,False,opus,1402,0,58.7387,opus_gemm_mono_tile_512x192x128x64_2x4_16x16x32_0x0x0_nooob,0.0,877.44,1213.9
gfx950,256,8192,1024,4096,False,torch.bfloat16,torch.bfloat16,False,False,opus,1401,0,67.782,opus_gemm_mono_tile_512x128x256x64_2x4_16x16x32_0x0x0_nooob,0.0,1013.83,1361.35
gfx950,256,10240,1024,4096,False,torch.bfloat16,torch.bfloat16,False,False,torch,0,0,86.7871,native,0.0,989.77,1304.87
gfx950,256,12288,1024,4096,False,torch.bfloat16,torch.bfloat16,False,False,opus,1400,0,85.0021,opus_gemm_mono_tile_512x192x256x64_2x4_16x16x32_0x0x0_nooob,0.0,1212.67,1578.99
gfx950,256,14336,1024,4096,False,torch.bfloat16,torch.bfloat16,False,False,asm,10,1,107.4085,_ZN5aiter24bf16gemm_bf16_tn_256x256E,0.0,1119.64,1444.85
gfx950,256,16384,1024,4096,False,torch.bfloat16,torch.bfloat16,False,False,torch,0,0,108.4875,native,0.0,1266.86,1623.79
gfx950,256,16,2048,4096,False,torch.bfloat16,torch.bfloat16,False,False,flydsl,2455,8,7.3919,flydsl_gemm4_abf16_wbf16_bf16_t16x64x128_split_k8_block_m_warp1_block_n_warp2_block_k_warp1_async_copyTrue_b_to_ldsTrue_b_preshuffleFalse_c_to_ldsFalse_gfx950,0.02,36.31,2296.27
gfx950,256,32,2048,4096,False,torch.bfloat16,torch.bfloat16,False,False,flydsl,3239,4,7.9052,flydsl_gemm5_abf16_wbf16_bf16_t32x64x128_split_k4_block_m_warp1_block_n_warp4_block_k_warp1_async_copyTrue_b_to_ldsTrue_b_preshuffleFalse_c_to_ldsFalse_gfx950,0.0115,67.91,2172.04
gfx950,256,48,2048,4096,False,torch.bfloat16,torch.bfloat16,False,False,flydsl,4334,4,9.0772,flydsl_gemm8_abf16_wbf16_bf16_t32x64x64_split_k4_block_m_warp2_block_n_warp2_block_k_warp1_async_copyTrue_b_to_ldsTrue_b_preshuffleFalse_c_to_ldsFalse_gfx950,0.0117,88.72,1913.26
gfx950,256,64,2048,4096,False,torch.bfloat16,torch.bfloat16,False,False,flydsl,4293,4,9.9551,flydsl_gemm5_abf16_wbf16_bf16_t32x64x128_split_k4_block_m_warp2_block_n_warp1_block_k_warp2_async_copyTrue_b_to_ldsTrue_b_preshuffleFalse_c_to_ldsFalse_gfx950,0.0196,107.86,1764.29
gfx950,256,80,2048,4096,False,torch.bfloat16,torch.bfloat16,False,False,flydsl,3799,4,10.4071,flydsl_gemm4_abf16_wbf16_bf16_t64x64x128_split_k4_block_m_warp2_block_n_warp1_block_k_warp2_async_copyTrue_b_to_ldsTrue_b_preshuffleFalse_c_to_ldsFalse_gfx950,0.0188,128.97,1706.55
gfx950,256,96,2048,4096,False,torch.bfloat16,torch.bfloat16,False,False,flydsl,4279,2,10.7224,flydsl_gemm5_abf16_wbf16_bf16_t32x64x128_split_k2_block_m_warp1_block_n_warp1_block_k_warp4_async_copyTrue_b_to_ldsTrue_b_preshuffleFalse_c_to_ldsFalse_gfx950,0.0201,150.21,1674.71
gfx950,256,112,2048,4096,False,torch.bfloat16,torch.bfloat16,False,False,flydsl,4827,2,10.6741,flydsl_gemm6_abf16_wbf16_bf16_t32x64x128_split_k2_block_m_warp1_block_n_warp1_block_k_warp4_async_copyTrue_b_to_ldsTrue_b_preshuffleFalse_c_to_ldsFalse_gfx950,0.0201,176.04,1700.7
gfx950,256,128,2048,4096,False,torch.bfloat16,torch.bfloat16,False,False,flydsl,2785,2,11.5715,flydsl_gemm3_abf16_wbf16_bf16_t32x64x256_split_k2_block_m_warp1_block_n_warp2_block_k_warp2_async_copyTrue_b_to_ldsTrue_b_preshuffleFalse_c_to_ldsFalse_gfx950,0.012,185.58,1585.8
gfx950,256,144,2048,4096,False,torch.bfloat16,torch.bfloat16,False,False,asm,7,4,13.0747,_ZN5aiter39bf16gemm_fp32bf16_tn_80x64_splitk_cleanE,0.0115,184.78,1418.52
gfx950,256,160,2048,4096,False,torch.bfloat16,torch.bfloat16,False,False,asm,7,4,13.1312,_ZN5aiter39bf16gemm_fp32bf16_tn_80x64_splitk_cleanE,0.0115,204.43,1427.39
gfx950,256,176,2048,4096,False,torch.bfloat16,torch.bfloat16,False,False,asm,8,4,13.7343,_ZN5aiter39bf16gemm_fp32bf16_tn_96x64_splitk_cleanE,0.0116,214.99,1379.02
gfx950,256,192,2048,4096,False,torch.bfloat16,torch.bfloat16,False,False,asm,8,4,13.9968,_ZN5aiter39bf16gemm_fp32bf16_tn_96x64_splitk_cleanE,0.0117,230.14,1367.21
gfx950,256,208,2048,4096,False,torch.bfloat16,torch.bfloat16,False,False,flydsl,3939,1,14.0771,flydsl_gemm4_abf16_wbf16_bf16_t32x64x128_split_k1_block_m_warp2_block_n_warp1_block_k_warp2_async_copyTrue_b_to_ldsTrue_b_preshuffleFalse_c_to_ldsFalse_gfx950,0.0049,247.9,1373.37
gfx950,256,224,2048,4096,False,torch.bfloat16,torch.bfloat16,False,False,flydsl,3937,1,14.7312,flydsl_gemm4_abf16_wbf16_bf16_t32x64x128_split_k1_block_m_warp1_block_n_warp4_block_k_warp1_async_copyTrue_b_to_ldsTrue_b_preshuffleFalse_c_to_ldsFalse_gfx950,0.0,255.11,1325.74
gfx950,256,240,2048,4096,False,torch.bfloat16,torch.bfloat16,False,False,flydsl,3934,1,14.1905,flydsl_gemm4_abf16_wbf16_bf16_t32x64x128_split_k1_block_m_warp1_block_n_warp1_block_k_warp4_async_copyTrue_b_to_ldsTrue_b_preshuffleFalse_c_to_ldsFalse_gfx950,0.0119,283.75,1390.11
gfx950,256,256,2048,4096,False,torch.bfloat16,torch.bfloat16,False,False,flydsl,3937,1,14.8864,flydsl_gemm4_abf16_wbf16_bf16_t32x64x128_split_k1_block_m_warp1_block_n_warp4_block_k_warp1_async_copyTrue_b_to_ldsTrue_b_preshuffleFalse_c_to_ldsFalse_gfx950,0.0,288.52,1338.33
gfx950,256,288,2048,4096,False,torch.bfloat16,torch.bfloat16,False,False,flydsl,4888,1,17.3132,flydsl_gemm5_abf16_wbf16_bf16_t64x64x128_split_k1_block_m_warp2_block_n_warp2_block_k_warp2_async_copyTrue_b_to_ldsTrue_b_preshuffleFalse_c_to_ldsFalse_gfx950,0.0049,279.08,1173.45
gfx950,256,320,2048,4096,False,torch.bfloat16,torch.bfloat16,False,False,flydsl,4888,1,18.1275,flydsl_gemm5_abf16_wbf16_bf16_t64x64x128_split_k1_block_m_warp2_block_n_warp2_block_k_warp2_async_copyTrue_b_to_ldsTrue_b_preshuffleFalse_c_to_ldsFalse_gfx950,0.0049,296.16,1142.43
gfx950,256,352,2048,4096,False,torch.bfloat16,torch.bfloat16,False,False,flydsl,3156,1,17.7114,flydsl_gemm3_abf16_wbf16_bf16_t64x64x128_split_k1_block_m_warp2_block_n_warp2_block_k_warp2_async_copyTrue_b_to_ldsTrue_b_preshuffleFalse_c_to_ldsFalse_gfx950,0.0049,333.43,1191.47
gfx950,256,384,2048,4096,False,torch.bfloat16,torch.bfloat16,False,False,flydsl,4888,1,18.3847,flydsl_gemm5_abf16_wbf16_bf16_t64x64x128_split_k1_block_m_warp2_block_n_warp2_block_k_warp2_async_copyTrue_b_to_ldsTrue_b_preshuffleFalse_c_to_ldsFalse_gfx950,0.0049,350.42,1169.22
gfx950,256,416,2048,4096,False,torch.bfloat16,torch.bfloat16,False,False,flydsl,4888,1,17.783,flydsl_gemm5_abf16_wbf16_bf16_t64x64x128_split_k1_block_m_warp2_block_n_warp2_block_k_warp2_async_copyTrue_b_to_ldsTrue_b_preshuffleFalse_c_to_ldsFalse_gfx950,0.0049,392.47,1230.9
gfx950,256,448,2048,4096,False,torch.bfloat16,torch.bfloat16,False,False,flydsl,4888,1,18.6023,flydsl_gemm5_abf16_wbf16_bf16_t64x64x128_split_k1_block_m_warp2_block_n_warp2_block_k_warp2_async_copyTrue_b_to_ldsTrue_b_preshuffleFalse_c_to_ldsFalse_gfx950,0.005,404.05,1197.82
gfx950,256,480,2048,4096,False,torch.bfloat16,torch.bfloat16,False,False,flydsl,3156,1,18.4104,flydsl_gemm3_abf16_wbf16_bf16_t64x64x128_split_k1_block_m_warp2_block_n_warp2_block_k_warp2_async_copyTrue_b_to_ldsTrue_b_preshuffleFalse_c_to_ldsFalse_gfx950,0.005,437.42,1231.67
gfx950,256,512,2048,4096,False,torch.bfloat16,torch.bfloat16,False,False,flydsl,4888,1,18.6303,flydsl_gemm5_abf16_wbf16_bf16_t64x64x128_split_k1_block_m_warp2_block_n_warp2_block_k_warp2_async_copyTrue_b_to_ldsTrue_b_preshuffleFalse_c_to_ldsFalse_gfx950,0.005,461.07,1238.23
gfx950,256,544,2048,4096,False,torch.bfloat16,torch.bfloat16,False,False,flydsl,4401,1,22.8042,flydsl_gemm4_abf16_wbf16_bf16_t96x64x128_split_k1_block_m_warp1_block_n_warp4_block_k_warp1_async_copyTrue_b_to_ldsTrue_b_preshuffleFalse_c_to_ldsFalse_gfx950,0.0,400.22,1028.84
gfx950,256,576,2048,4096,False,torch.bfloat16,torch.bfloat16,False,False,flydsl,4401,1,23.7078,flydsl_gemm4_abf16_wbf16_bf16_t96x64x128_split_k1_block_m_warp1_block_n_warp4_block_k_warp1_async_copyTrue_b_to_ldsTrue_b_preshuffleFalse_c_to_ldsFalse_gfx950,0.0,407.62,1006.21
gfx950,256,608,2048,4096,False,torch.bfloat16,torch.bfloat16,False,False,flydsl,4400,1,23.3284,flydsl_gemm4_abf16_wbf16_bf16_t96x64x128_split_k1_block_m_warp1_block_n_warp2_block_k_warp2_async_copyTrue_b_to_ldsTrue_b_preshuffleFalse_c_to_ldsFalse_gfx950,0.0049,437.26,1039.43
gfx950,256,640,2048,4096,False,torch.bfloat16,torch.bfloat16,False,False,flydsl,4400,1,23.6132,flydsl_gemm4_abf16_wbf16_bf16_t96x64x128_split_k1_block_m_warp1_block_n_warp2_block_k_warp2_async_copyTrue_b_to_ldsTrue_b_preshuffleFalse_c_to_ldsFalse_gfx950,0.0049,454.72,1043.55
gfx950,256,672,2048,4096,False,torch.bfloat16,torch.bfloat16,False,False,flydsl,4403,1,24.1974,flydsl_gemm4_abf16_wbf16_bf16_t96x64x128_split_k1_block_m_warp2_block_n_warp1_block_k_warp2_async_copyTrue_b_to_ldsTrue_b_preshuffleFalse_c_to_ldsFalse_gfx950,0.0049,465.93,1034.61
gfx950,256,704,2048,4096,False,torch.bfloat16,torch.bfloat16,False,False,flydsl,4400,1,23.688,flydsl_gemm4_abf16_wbf16_bf16_t96x64x128_split_k1_block_m_warp1_block_n_warp2_block_k_warp2_async_copyTrue_b_to_ldsTrue_b_preshuffleFalse_c_to_ldsFalse_gfx950,0.0049,498.61,1073.45
gfx950,256,736,2048,4096,False,torch.bfloat16,torch.bfloat16,False,False,flydsl,5992,1,24.215,flydsl_gemm8_abf16_wbf16_bf16_t96x64x64_split_k1_block_m_warp1_block_n_warp2_block_k_warp2_async_copyTrue_b_to_ldsTrue_b_preshuffleFalse_c_to_ldsFalse_gfx950,0.0049,509.93,1066.33
gfx950,256,768,2048,4096,False,torch.bfloat16,torch.bfloat16,False,False,flydsl,4403,1,24.9392,flydsl_gemm4_abf16_wbf16_bf16_t96x64x128_split_k1_block_m_warp2_block_n_warp1_block_k_warp2_async_copyTrue_b_to_ldsTrue_b_preshuffleFalse_c_to_ldsFalse_gfx950,0.0049,516.65,1051.13
gfx950,256,800,2048,4096,False,torch.bfloat16,torch.bfloat16,False,False,flydsl,4065,1,26.9537,flydsl_gemm4_abf16_wbf16_bf16_t64x128x64_split_k1_block_m_warp2_block_n_warp4_block_k_warp1_async_copyTrue_b_to_ldsTrue_b_preshuffleFalse_c_to_ldsFalse_gfx950,0.0,497.96,987.16
gfx950,256,832,2048,4096,False,torch.bfloat16,torch.bfloat16,False,False,flydsl,2244,1,26.642,flydsl_gemm3_abf16_wbf16_bf16_t128x64x128_split_k1_block_m_warp2_block_n_warp4_block_k_warp2_async_copyTrue_b_to_ldsTrue_b_preshuffleFalse_c_to_ldsFalse_gfx950,0.0049,523.93,1013.47
gfx950,256,864,2048,4096,False,torch.bfloat16,torch.bfloat16,False,False,flydsl,2932,1,26.5474,flydsl_gemm3_abf16_wbf16_bf16_t64x128x128_split_k1_block_m_warp2_block_n_warp4_block_k_warp2_async_copyTrue_b_to_ldsTrue_b_preshuffleFalse_c_to_ldsFalse_gfx950,0.0049,546.02,1031.89
gfx950,256,896,2048,4096,False,torch.bfloat16,torch.bfloat16,False,False,flydsl,3597,1,27.0663,flydsl_gemm4_abf16_wbf16_bf16_t128x64x64_split_k1_block_m_warp2_block_n_warp4_block_k_warp1_async_copyTrue_b_to_ldsTrue_b_preshuffleFalse_c_to_ldsFalse_gfx950,0.0,555.39,1026.64
gfx950,256,928,2048,4096,False,torch.bfloat16,torch.bfloat16,False,False,flydsl,2249,1,27.4632,flydsl_gemm3_abf16_wbf16_bf16_t128x64x128_split_k1_block_m_warp4_block_n_warp2_block_k_warp2_async_copyTrue_b_to_ldsTrue_b_preshuffleFalse_c_to_ldsFalse_gfx950,0.0049,566.91,1026.12
gfx950,256,960,2048,4096,False,torch.bfloat16,torch.bfloat16,False,False,flydsl,2249,1,28.1232,flydsl_gemm3_abf16_wbf16_bf16_t128x64x128_split_k1_block_m_warp4_block_n_warp2_block_k_warp2_async_copyTrue_b_to_ldsTrue_b_preshuffleFalse_c_to_ldsFalse_gfx950,0.0049,572.7,1016.02
gfx950,256,992,2048,4096,False,torch.bfloat16,torch.bfloat16,False,False,flydsl,4065,1,28.2952,flydsl_gemm4_abf16_wbf16_bf16_t64x128x64_split_k1_block_m_warp2_block_n_warp4_block_k_warp1_async_copyTrue_b_to_ldsTrue_b_preshuffleFalse_c_to_ldsFalse_gfx950,0.0,588.19,1023.74
gfx950,256,1024,2048,4096,False,torch.bfloat16,torch.bfloat16,False,False,flydsl,2932,1,28.6524,flydsl_gemm3_abf16_wbf16_bf16_t64x128x128_split_k1_block_m_warp2_block_n_warp4_block_k_warp2_async_copyTrue_b_to_ldsTrue_b_preshuffleFalse_c_to_ldsFalse_gfx950,0.0049,599.6,1024.7
gfx950,256,1088,2048,4096,False,torch.bfloat16,torch.bfloat16,False,False,flydsl,4368,1,34.9077,flydsl_gemm4_abf16_wbf16_bf16_t96x128x64_split_k1_block_m_warp2_block_n_warp2_block_k_warp1_async_copyTrue_b_to_ldsTrue_b_preshuffleFalse_c_to_ldsFalse_gfx950,0.0,522.91,863.61
gfx950,256,1152,2048,4096,False,torch.bfloat16,torch.bfloat16,False,False,flydsl,4365,1,35.7465,flydsl_gemm4_abf16_wbf16_bf16_t96x128x64_split_k1_block_m_warp1_block_n_warp4_block_k_warp1_async_copyTrue_b_to_ldsTrue_b_preshuffleFalse_c_to_ldsFalse_gfx950,0.0,540.68,865.34
gfx950,256,1216,2048,4096,False,torch.bfloat16,torch.bfloat16,False,False,flydsl,4365,1,35.5964,flydsl_gemm4_abf16_wbf16_bf16_t96x128x64_split_k1_block_m_warp1_block_n_warp4_block_k_warp1_async_copyTrue_b_to_ldsTrue_b_preshuffleFalse_c_to_ldsFalse_gfx950,0.0,573.12,891.09
gfx950,256,1280,2048,4096,False,torch.bfloat16,torch.bfloat16,False,False,flydsl,3514,1,37.1509,flydsl_gemm4_abf16_wbf16_bf16_t128x128x64_split_k1_block_m_warp4_block_n_warp4_block_k_warp1_async_copyTrue_b_to_ldsTrue_b_preshuffleFalse_c_to_ldsFalse_gfx950,0.0,578.04,874.97
gfx950,256,1344,2048,4096,False,torch.bfloat16,torch.bfloat16,False,False,flydsl,4365,1,37.5353,flydsl_gemm4_abf16_wbf16_bf16_t96x128x64_split_k1_block_m_warp1_block_n_warp4_block_k_warp1_async_copyTrue_b_to_ldsTrue_b_preshuffleFalse_c_to_ldsFalse_gfx950,0.0,600.73,886.96
gfx950,256,1408,2048,4096,False,torch.bfloat16,torch.bfloat16,False,False,flydsl,4364,1,38.4569,flydsl_gemm4_abf16_wbf16_bf16_t96x128x64_split_k1_block_m_warp1_block_n_warp2_block_k_warp2_async_copyTrue_b_to_ldsTrue_b_preshuffleFalse_c_to_ldsFalse_gfx950,0.0049,614.25,886.15
gfx950,256,1472,2048,4096,False,torch.bfloat16,torch.bfloat16,False,False,flydsl,3513,1,38.9621,flydsl_gemm4_abf16_wbf16_bf16_t128x128x64_split_k1_block_m_warp4_block_n_warp2_block_k_warp2_async_copyTrue_b_to_ldsTrue_b_preshuffleFalse_c_to_ldsFalse_gfx950,0.0049,633.85,894.85
gfx950,256,1536,2048,4096,False,torch.bfloat16,torch.bfloat16,False,False,flydsl,3513,1,39.7754,flydsl_gemm4_abf16_wbf16_bf16_t128x128x64_split_k1_block_m_warp4_block_n_warp2_block_k_warp2_async_copyTrue_b_to_ldsTrue_b_preshuffleFalse_c_to_ldsFalse_gfx950,0.0049,647.88,896.32
gfx950,256,1600,2048,4096,False,torch.bfloat16,torch.bfloat16,False,False,flydsl,3499,1,39.8037,flydsl_gemm4_abf16_wbf16_bf16_t128x128x64_split_k1_block_m_warp1_block_n_warp4_block_k_warp2_async_copyTrue_b_to_ldsTrue_b_preshuffleFalse_c_to_ldsFalse_gfx950,0.0049,674.4,915.44
gfx950,256,1664,2048,4096,False,torch.bfloat16,torch.bfloat16,False,False,flydsl,3513,1,40.6706,flydsl_gemm4_abf16_wbf16_bf16_t128x128x64_split_k1_block_m_warp4_block_n_warp2_block_k_warp2_async_copyTrue_b_to_ldsTrue_b_preshuffleFalse_c_to_ldsFalse_gfx950,0.0049,686.42,915.27
gfx950,256,1728,2048,4096,False,torch.bfloat16,torch.bfloat16,False,False,flydsl,3510,1,41.4633,flydsl_gemm4_abf16_wbf16_bf16_t128x128x64_split_k1_block_m_warp4_block_n_warp1_block_k_warp2_async_copyTrue_b_to_ldsTrue_b_preshuffleFalse_c_to_ldsFalse_gfx950,0.0049,699.2,916.74
gfx950,256,1792,2048,4096,False,torch.bfloat16,torch.bfloat16,False,False,flydsl,2084,1,41.8313,flydsl_gemm3_abf16_wbf16_bf16_t128x128x64_split_k1_block_m_warp2_block_n_warp4_block_k_warp2_async_copyTrue_b_to_ldsTrue_b_preshuffleFalse_c_to_ldsFalse_gfx950,0.0049,718.71,927.47
gfx950,256,1856,2048,4096,False,torch.bfloat16,torch.bfloat16,False,False,flydsl,3513,1,42.1765,flydsl_gemm4_abf16_wbf16_bf16_t128x128x64_split_k1_block_m_warp4_block_n_warp2_block_k_warp2_async_copyTrue_b_to_ldsTrue_b_preshuffleFalse_c_to_ldsFalse_gfx950,0.0049,738.29,938.53
gfx950,256,1920,2048,4096,False,torch.bfloat16,torch.bfloat16,False,False,flydsl,3514,1,41.8765,flydsl_gemm4_abf16_wbf16_bf16_t128x128x64_split_k1_block_m_warp4_block_n_warp4_block_k_warp1_async_copyTrue_b_to_ldsTrue_b_preshuffleFalse_c_to_ldsFalse_gfx950,0.0,769.22,964.03
gfx950,256,1984,2048,4096,False,torch.bfloat16,torch.bfloat16,False,False,flydsl,3508,1,41.9441,flydsl_gemm4_abf16_wbf16_bf16_t128x128x64_split_k1_block_m_warp2_block_n_warp4_block_k_warp2_async_copyTrue_b_to_ldsTrue_b_preshuffleFalse_c_to_ldsFalse_gfx950,0.0049,793.58,981.23
gfx950,256,2048,2048,4096,False,torch.bfloat16,torch.bfloat16,False,False,flydsl,3508,1,44.3005,flydsl_gemm4_abf16_wbf16_bf16_t128x128x64_split_k1_block_m_warp2_block_n_warp4_block_k_warp2_async_copyTrue_b_to_ldsTrue_b_preshuffleFalse_c_to_ldsFalse_gfx950,0.0049,775.61,946.78
gfx950,256,4096,2048,4096,False,torch.bfloat16,torch.bfloat16,False,False,triton,0,0,67.1255,auto,0.0,1023.75,999.75
gfx950,256,6144,2048,4096,False,torch.bfloat16,torch.bfloat16,False,False,opus,6400,0,84.8961,opus_gemm_mono_tile_512x192x256x64_2x4_16x16x32_0x0x0_nooob_4g_safe,0.0,1214.18,1086.91
gfx950,256,8192,2048,4096,False,torch.bfloat16,torch.bfloat16,False,False,torch,0,0,106.5835,native,0.0,1289.5,1101.86
gfx950,256,10240,2048,4096,False,torch.bfloat16,torch.bfloat16,False,False,torch,0,0,152.6787,native,0.0,1125.23,934.03
gfx950,256,12288,2048,4096,False,torch.bfloat16,torch.bfloat16,False,False,opus,1400,0,159.4931,opus_gemm_mono_tile_512x192x256x64_2x4_16x16x32_0x0x0_nooob,0.0,1292.59,1051.91
gfx950,256,14336,2048,4096,False,torch.bfloat16,torch.bfloat16,False,False,torch,0,0,186.3617,native,0.0,1290.6,1035.29
gfx950,256,16384,2048,4096,False,torch.bfloat16,torch.bfloat16,False,False,torch,0,0,200.7367,native,0.0,1369.35,1086.52
gfx950,256,16,64640,4096,False,torch.bfloat16,torch.bfloat16,False,False,triton,0,0,90.5185,auto,0.0,93.6,5874.27
gfx950,256,32,64640,4096,False,torch.bfloat16,torch.bfloat16,False,False,triton,0,0,93.3914,auto,0.0,181.44,5717.12
gfx950,256,48,64640,4096,False,torch.bfloat16,torch.bfloat16,False,False,flydsl,413,1,99.4622,flydsl_gemm2_abf16_wbf16_bf16_t48x64x64_split_k1_block_m_warp1_block_n_warp1_block_k_warp2_async_copyTrue_b_to_ldsTrue_b_preshuffleFalse_c_to_ldsFalse_gfx950,0.0049,255.55,5390.28
gfx950,256,64,64640,4096,False,torch.bfloat16,torch.bfloat16,False,False,torch,0,0,99.7469,native,0.0,339.76,5396.95
gfx950,256,80,64640,4096,False,torch.bfloat16,torch.bfloat16,False,False,flydsl,1158,1,105.6665,flydsl_gemm2_abf16_wbf16_bf16_t80x128x64_split_k1_block_m_warp1_block_n_warp2_block_k_warp1_async_copyTrue_b_to_ldsTrue_b_preshuffleFalse_c_to_ldsFalse_gfx950,0.0,400.91,5115.42
gfx950,256,96,64640,4096,False,torch.bfloat16,torch.bfloat16,False,False,flydsl,1268,1,110.0499,flydsl_gemm2_abf16_wbf16_bf16_t96x128x64_split_k1_block_m_warp2_block_n_warp2_block_k_warp1_async_copyTrue_b_to_ldsTrue_b_preshuffleFalse_c_to_ldsFalse_gfx950,0.0,461.93,4931.66
gfx950,256,112,64640,4096,False,torch.bfloat16,torch.bfloat16,False,False,torch,0,0,109.9315,native,0.0,539.49,4956.98
gfx950,256,128,64640,4096,False,torch.bfloat16,torch.bfloat16,False,False,flydsl,104,1,109.6688,flydsl_gemm2_abf16_wbf16_bf16_t128x128x64_split_k1_block_m_warp2_block_n_warp2_block_k_warp1_async_copyTrue_b_to_ldsTrue_b_preshuffleFalse_c_to_ldsFalse_gfx950,0.0,618.04,4988.91
gfx950,256,144,64640,4096,False,torch.bfloat16,torch.bfloat16,False,False,torch,0,0,118.8748,native,0.0,641.45,4621.05
gfx950,256,160,64640,4096,False,torch.bfloat16,torch.bfloat16,False,False,torch,0,0,120.2572,native,0.0,704.53,4586.22
gfx950,256,176,64640,4096,False,torch.bfloat16,torch.bfloat16,False,False,torch,0,0,125.0413,native,0.0,745.33,4428.34
gfx950,256,192,64640,4096,False,torch.bfloat16,torch.bfloat16,False,False,torch,0,0,123.6232,native,0.0,822.42,4496.94
gfx950,256,208,64640,4096,False,torch.bfloat16,torch.bfloat16,False,False,torch,0,0,127.4985,native,0.0,863.87,4377.5
gfx950,256,224,64640,4096,False,torch.bfloat16,torch.bfloat16,False,False,torch,0,0,135.096,native,0.0,878.0,4147.6
gfx950,256,240,64640,4096,False,torch.bfloat16,torch.bfloat16,False,False,torch,0,0,127.1355,native,0.0,999.62,4424.6
gfx950,256,256,64640,4096,False,torch.bfloat16,torch.bfloat16,False,False,torch,0,0,126.8864,native,0.0,1068.36,4450.62
gfx950,256,288,64640,4096,False,torch.bfloat16,torch.bfloat16,False,False,torch,0,0,176.2744,native,0.0,865.16,3228.62
gfx950,256,320,64640,4096,False,torch.bfloat16,torch.bfloat16,False,False,torch,0,0,173.4709,native,0.0,976.82,3306.16
gfx950,256,352,64640,4096,False,torch.bfloat16,torch.bfloat16,False,False,torch,0,0,193.1042,native,0.0,965.26,2992.79
gfx950,256,384,64640,4096,False,torch.bfloat16,torch.bfloat16,False,False,torch,0,0,193.3835,native,0.0,1051.49,3011.22
gfx950,256,416,64640,4096,False,torch.bfloat16,torch.bfloat16,False,False,torch,0,0,229.6621,native,0.0,959.17,2554.71
gfx950,256,448,64640,4096,False,torch.bfloat16,torch.bfloat16,False,False,torch,0,0,213.6273,native,0.0,1110.48,2767.05
gfx950,256,480,64640,4096,False,torch.bfloat16,torch.bfloat16,False,False,torch,0,0,229.2409,native,0.0,1108.77,2597.78
gfx950,256,512,64640,4096,False,torch.bfloat16,torch.bfloat16,False,False,torch,0,0,229.8193,native,0.0,1179.71,2610.38
gfx950,256,544,64640,4096,False,torch.bfloat16,torch.bfloat16,False,False,torch,0,0,261.733,native,0.0,1100.61,2308.9
gfx950,256,576,64640,4096,False,torch.bfloat16,torch.bfloat16,False,False,torch,0,0,263.6814,native,0.0,1156.74,2308.52
gfx950,256,608,64640,4096,False,torch.bfloat16,torch.bfloat16,False,False,torch,0,0,314.3355,native,0.0,1024.24,1950.51
gfx950,256,640,64640,4096,False,torch.bfloat16,torch.bfloat16,False,False,torch,0,0,317.1437,native,0.0,1068.6,1947.11
gfx950,256,672,64640,4096,False,torch.bfloat16,torch.bfloat16,False,False,torch,0,0,314.0712,native,0.0,1133.01,1980.16
gfx950,256,704,64640,4096,False,torch.bfloat16,torch.bfloat16,False,False,torch,0,0,345.0879,native,0.0,1080.27,1814.93
gfx950,256,736,64640,4096,False,torch.bfloat16,torch.bfloat16,False,False,torch,0,0,321.7275,native,0.0,1211.38,1960.39
gfx950,256,768,64640,4096,False,torch.bfloat16,torch.bfloat16,False,False,torch,0,0,326.2971,native,0.0,1246.35,1946.41
gfx950,256,800,64640,4096,False,torch.bfloat16,torch.bfloat16,False,False,torch,0,0,401.8008,native,0.0,1054.32,1591.61
gfx950,256,832,64640,4096,False,torch.bfloat16,torch.bfloat16,False,False,torch,0,0,406.2361,native,0.0,1084.52,1585.06
gfx950,256,864,64640,4096,False,torch.bfloat16,torch.bfloat16,False,False,torch,0,0,406.2708,native,0.0,1126.13,1595.75
gfx950,256,896,64640,4096,False,torch.bfloat16,torch.bfloat16,False,False,torch,0,0,425.7496,native,0.0,1114.41,1533.07
gfx950,256,928,64640,4096,False,torch.bfloat16,torch.bfloat16,False,False,torch,0,0,418.0523,native,0.0,1175.46,1571.82
gfx950,256,960,64640,4096,False,torch.bfloat16,torch.bfloat16,False,False,torch,0,0,440.4449,native,0.0,1154.17,1501.9
gfx950,256,992,64640,4096,False,torch.bfloat16,torch.bfloat16,False,False,torch,0,0,454.2072,native,0.0,1156.51,1466.08
gfx950,256,1024,64640,4096,False,torch.bfloat16,torch.bfloat16,False,False,torch,0,0,431.9268,native,0.0,1255.4,1551.89
gfx950,256,1088,64640,4096,False,torch.bfloat16,torch.bfloat16,False,False,torch,0,0,502.0404,native,0.0,1147.58,1352.68
gfx950,256,1152,64640,4096,False,torch.bfloat16,torch.bfloat16,False,False,torch,0,0,502.7144,native,0.0,1213.45,1368.37
gfx950,256,1216,64640,4096,False,torch.bfloat16,torch.bfloat16,False,False,torch,0,0,512.8323,native,0.0,1255.59,1358.53
gfx950,256,1280,64640,4096,False,torch.bfloat16,torch.bfloat16,False,False,torch,0,0,551.9209,native,0.0,1228.07,1278.25
gfx950,256,1344,64640,4096,False,torch.bfloat16,torch.bfloat16,False,False,torch,0,0,598.3448,native,0.0,1189.43,1193.78
gfx950,256,1408,64640,4096,False,torch.bfloat16,torch.bfloat16,False,False,torch,0,0,628.3114,native,0.0,1186.64,1150.85
gfx950,256,1472,64640,4096,False,torch.bfloat16,torch.bfloat16,False,False,torch,0,0,602.6149,native,0.0,1293.48,1214.52
gfx950,256,1536,64640,4096,False,torch.bfloat16,torch.bfloat16,False,False,torch,0,0,611.21,native,0.0,1330.74,1211.84
gfx950,256,1600,64640,4096,False,torch.bfloat16,torch.bfloat16,False,False,opus,5300,0,808.7171,opus_gemm_persistent_512x256x256x64_2x4_16x16x32_0x0x0_4g_safe,0.0,1047.65,926.76
gfx950,256,1664,64640,4096,False,torch.bfloat16,torch.bfloat16,False,False,torch,0,0,690.7061,native,0.0,1275.71,1097.84
gfx950,256,1728,64640,4096,False,torch.bfloat16,torch.bfloat16,False,False,torch,0,0,700.2002,native,0.0,1306.81,1095.52
gfx950,256,1792,64640,4096,False,torch.bfloat16,torch.bfloat16,False,False,torch,0,0,704.2515,native,0.0,1347.42,1101.71
gfx950,256,1856,64640,4096,False,torch.bfloat16,torch.bfloat16,False,False,torch,0,0,761.7871,native,0.0,1290.14,1030.05
gfx950,256,1920,64640,4096,False,torch.bfloat16,torch.bfloat16,False,False,torch,0,0,815.2086,native,0.0,1247.16,973.34
gfx950,256,1984,64640,4096,False,torch.bfloat16,torch.bfloat16,False,False,torch,0,0,775.9486,native,0.0,1353.94,1033.93
gfx950,256,2048,64640,4096,False,torch.bfloat16,torch.bfloat16,False,False,torch,0,0,775.9095,native,0.0,1397.69,1045.32
gfx950,256,4096,64640,4096,False,torch.bfloat16,torch.bfloat16,False,False,torch,0,0,1489.1562,native,0.0,1456.5,733.71
gfx950,256,6144,64640,4096,False,torch.bfloat16,torch.bfloat16,False,False,torch,0,0,2316.4619,native,0.0,1404.49,593.21
gfx950,256,8192,64640,4096,False,torch.bfloat16,torch.bfloat16,False,False,torch,0,0,3079.9051,native,0.0,1408.46,537.58
gfx950,256,10240,64640,4096,False,torch.bfloat16,torch.bfloat16,False,False,torch,0,0,3892.3868,native,0.0,1393.08,497.7
gfx950,256,12288,64640,4096,False,torch.bfloat16,torch.bfloat16,False,False,torch,0,0,4536.8075,native,0.0,1434.24,489.06
gfx950,256,14336,64640,4096,False,torch.bfloat16,torch.bfloat16,False,False,opus,9,0,5887.8382,opus_gemm_512x256x256x64_2x4_16x16x32_0x0x0,0.0,1289.33,424.66
gfx950,256,16384,64640,4096,False,torch.bfloat16,torch.bfloat16,False,False,torch,0,0,5963.7753,native,0.0,1454.76,466.46
gfx950,256,16,129280,4096,False,torch.bfloat16,torch.bfloat16,False,False,triton,0,0,176.4716,auto,0.0,96.02,6025.5
gfx950,256,32,129280,4096,False,torch.bfloat16,torch.bfloat16,False,False,triton,0,0,183.6417,auto,0.0,184.54,5813.48
gfx950,256,48,129280,4096,False,torch.bfloat16,torch.bfloat16,False,False,torch,0,0,190.9741,native,0.0,266.19,5612.62
gfx950,256,64,129280,4096,False,torch.bfloat16,torch.bfloat16,False,False,flydsl,1260,1,191.0744,flydsl_gemm2_abf16_wbf16_bf16_t64x256x64_split_k1_block_m_warp2_block_n_warp1_block_k_warp1_async_copyTrue_b_to_ldsTrue_b_preshuffleFalse_c_to_ldsFalse_gfx950,0.0,354.73,5632.02
gfx950,256,80,129280,4096,False,torch.bfloat16,torch.bfloat16,False,False,torch,0,0,199.167,native,0.0,425.4,5424.6
gfx950,256,96,129280,4096,False,torch.bfloat16,torch.bfloat16,False,False,torch,0,0,206.471,native,0.0,492.42,5253.38
gfx950,256,112,129280,4096,False,torch.bfloat16,torch.bfloat16,False,False,torch,0,0,208.9847,native,0.0,567.58,5210.61
gfx950,256,128,129280,4096,False,torch.bfloat16,torch.bfloat16,False,False,torch,0,0,217.7542,native,0.0,622.54,5020.37
gfx950,256,144,129280,4096,False,torch.bfloat16,torch.bfloat16,False,False,torch,0,0,220.158,native,0.0,692.71,4984.94
gfx950,256,160,129280,4096,False,torch.bfloat16,torch.bfloat16,False,False,torch,0,0,237.9218,native,0.0,712.21,4630.69
gfx950,256,176,129280,4096,False,torch.bfloat16,torch.bfloat16,False,False,torch,0,0,222.0279,native,0.0,839.51,4981.4
gfx950,256,192,129280,4096,False,torch.bfloat16,torch.bfloat16,False,False,torch,0,0,233.4282,native,0.0,871.1,4756.4
gfx950,256,208,129280,4096,False,torch.bfloat16,torch.bfloat16,False,False,torch,0,0,257.2791,native,0.0,856.21,4332.05
gfx950,256,224,129280,4096,False,torch.bfloat16,torch.bfloat16,False,False,opus,5009,0,289.4131,opus_gemm_512x256x256x64_2x4_16x16x32_0x0x0_4g_safe,0.0,819.69,3865.8
gfx950,256,240,129280,4096,False,torch.bfloat16,torch.bfloat16,False,False,asm,10,1,267.3604,_ZN5aiter24bf16gemm_bf16_tn_256x256E,0.0,950.68,4200.63
gfx950,256,256,129280,4096,False,torch.bfloat16,torch.bfloat16,False,False,torch,0,0,278.1396,native,0.0,974.76,4053.18
gfx950,256,288,129280,4096,False,torch.bfloat16,torch.bfloat16,False,False,torch,0,0,353.7867,native,0.0,862.13,3210.65
gfx950,256,320,129280,4096,False,torch.bfloat16,torch.bfloat16,False,False,torch,0,0,345.575,native,0.0,980.68,3311.65
gfx950,256,352,129280,4096,False,torch.bfloat16,torch.bfloat16,False,False,asm,10,1,386.9836,_ZN5aiter24bf16gemm_bf16_tn_256x256E,0.0,963.32,2979.35
gfx950,256,384,129280,4096,False,torch.bfloat16,torch.bfloat16,False,False,torch,0,0,363.0748,native,0.0,1120.1,3199.05
gfx950,256,416,129280,4096,False,torch.bfloat16,torch.bfloat16,False,False,asm,10,1,426.9394,_ZN5aiter24bf16gemm_bf16_tn_256x256E,0.0,1031.93,2740.51
gfx950,256,448,129280,4096,False,torch.bfloat16,torch.bfloat16,False,False,asm,10,1,400.8654,_ZN5aiter24bf16gemm_bf16_tn_256x256E,0.0,1183.59,2940.06
gfx950,256,480,129280,4096,False,torch.bfloat16,torch.bfloat16,False,False,torch,0,0,442.0745,native,0.0,1149.92,2685.3
gfx950,256,512,129280,4096,False,torch.bfloat16,torch.bfloat16,False,False,asm,10,1,447.806,_ZN5aiter24bf16gemm_bf16_tn_256x256E,0.0,1210.88,2669.99
gfx950,256,544,129280,4096,False,torch.bfloat16,torch.bfloat16,False,False,torch,0,0,517.6449,native,0.0,1112.98,2326.26
gfx950,256,576,129280,4096,False,torch.bfloat16,torch.bfloat16,False,False,opus,6400,0,530.4098,opus_gemm_mono_tile_512x192x256x64_2x4_16x16x32_0x0x0_nooob_4g_safe,0.0,1150.09,2286.37
gfx950,256,608,129280,4096,False,torch.bfloat16,torch.bfloat16,False,False,asm,10,1,568.9723,_ZN5aiter24bf16gemm_bf16_tn_256x256E,0.0,1131.71,2146.41
gfx950,256,640,129280,4096,False,torch.bfloat16,torch.bfloat16,False,False,asm,10,1,574.9372,_ZN5aiter24bf16gemm_bf16_tn_256x256E,0.0,1178.91,2138.99
gfx950,256,672,129280,4096,False,torch.bfloat16,torch.bfloat16,False,False,asm,10,1,592.947,_ZN5aiter24bf16gemm_bf16_tn_256x256E,0.0,1200.26,2088.41
gfx950,256,704,129280,4096,False,torch.bfloat16,torch.bfloat16,False,False,asm,10,1,594.0197,_ZN5aiter24bf16gemm_bf16_tn_256x256E,0.0,1255.14,2099.01
gfx950,256,736,129280,4096,False,torch.bfloat16,torch.bfloat16,False,False,asm,10,1,599.0891,_ZN5aiter24bf16gemm_bf16_tn_256x256E,0.0,1301.09,2095.5
gfx950,256,768,129280,4096,False,torch.bfloat16,torch.bfloat16,False,False,torch,0,0,633.2928,native,0.0,1284.33,1995.8
gfx950,256,800,129280,4096,False,torch.bfloat16,torch.bfloat16,False,False,asm,10,1,734.6129,_ZN5aiter24bf16gemm_bf16_tn_256x256E,0.0,1153.33,1732.15
gfx950,256,832,129280,4096,False,torch.bfloat16,torch.bfloat16,False,False,asm,10,1,774.6466,_ZN5aiter24bf16gemm_bf16_tn_256x256E,0.0,1137.47,1653.66
gfx950,256,864,129280,4096,False,torch.bfloat16,torch.bfloat16,False,False,torch,0,0,751.4277,native,0.0,1217.72,1716.11
gfx950,256,896,129280,4096,False,torch.bfloat16,torch.bfloat16,False,False,torch,0,0,753.1946,native,0.0,1259.86,1723.42
gfx950,256,928,129280,4096,False,torch.bfloat16,torch.bfloat16,False,False,asm,10,1,801.3998,_ZN5aiter24bf16gemm_bf16_tn_256x256E,0.0,1226.37,1630.41
gfx950,256,960,129280,4096,False,torch.bfloat16,torch.bfloat16,False,False,asm,10,1,755.1664,_ZN5aiter24bf16gemm_bf16_tn_256x256E,0.0,1346.32,1741.53
gfx950,256,992,129280,4096,False,torch.bfloat16,torch.bfloat16,False,False,asm,10,1,772.5839,_ZN5aiter24bf16gemm_bf16_tn_256x256E,0.0,1359.84,1713.32
gfx950,256,1024,129280,4096,False,torch.bfloat16,torch.bfloat16,False,False,asm,10,1,828.4593,_ZN5aiter24bf16gemm_bf16_tn_256x256E,0.0,1309.03,1608.06
gfx950,256,1088,129280,4096,False,torch.bfloat16,torch.bfloat16,False,False,asm,10,1,988.2041,_ZN5aiter24bf16gemm_bf16_tn_256x256E,0.0,1166.01,1365.39
gfx950,256,1152,129280,4096,False,torch.bfloat16,torch.bfloat16,False,False,asm,10,1,1006.7194,_ZN5aiter24bf16gemm_bf16_tn_256x256E,0.0,1211.9,1357.24
gfx950,256,1216,129280,4096,False,torch.bfloat16,torch.bfloat16,False,False,asm,10,1,953.8738,_ZN5aiter24bf16gemm_bf16_tn_256x256E,0.0,1350.09,1450.33
gfx950,256,1280,129280,4096,False,torch.bfloat16,torch.bfloat16,False,False,asm,10,1,970.6792,_ZN5aiter24bf16gemm_bf16_tn_256x256E,0.0,1396.55,1442.81
gfx950,256,1344,129280,4096,False,torch.bfloat16,torch.bfloat16,False,False,torch,0,0,1115.2104,native,0.0,1276.33,1271.13
gfx950,256,1408,129280,4096,False,torch.bfloat16,torch.bfloat16,False,False,asm,10,1,1143.185,_ZN5aiter24bf16gemm_bf16_tn_256x256E,0.0,1304.39,1254.96
gfx950,256,1472,129280,4096,False,torch.bfloat16,torch.bfloat16,False,False,asm,10,1,1112.6332,_ZN5aiter24bf16gemm_bf16_tn_256x256E,0.0,1401.13,1304.76
gfx950,256,1536,129280,4096,False,torch.bfloat16,torch.bfloat16,False,False,asm,10,1,1163.1884,_ZN5aiter24bf16gemm_bf16_tn_256x256E,0.0,1398.5,1262.73
gfx950,256,1600,129280,4096,False,torch.bfloat16,torch.bfloat16,False,False,asm,10,1,1312.2755,_ZN5aiter24bf16gemm_bf16_tn_256x256E,0.0,1291.27,1132.28
gfx950,256,1664,129280,4096,False,torch.bfloat16,torch.bfloat16,False,False,asm,10,1,1325.5852,_ZN5aiter24bf16gemm_bf16_tn_256x256E,0.0,1329.43,1133.79
gfx950,256,1728,129280,4096,False,torch.bfloat16,torch.bfloat16,False,False,torch,0,0,1386.6478,native,0.0,1319.77,1096.18
gfx950,256,1792,129280,4096,False,torch.bfloat16,torch.bfloat16,False,False,asm,10,1,1356.5246,_ZN5aiter24bf16gemm_bf16_tn_256x256E,0.0,1399.04,1133.1
gfx950,256,1856,129280,4096,False,torch.bfloat16,torch.bfloat16,False,False,asm,10,1,1496.1996,_ZN5aiter24bf16gemm_bf16_tn_256x256E,0.0,1313.74,1038.73
gfx950,256,1920,129280,4096,False,torch.bfloat16,torch.bfloat16,False,False,asm,10,1,1464.6758,_ZN5aiter24bf16gemm_bf16_tn_256x256E,0.0,1388.29,1072.75
gfx950,256,1984,129280,4096,False,torch.bfloat16,torch.bfloat16,False,False,asm,10,1,1490.0571,_ZN5aiter24bf16gemm_bf16_tn_256x256E,0.0,1410.13,1065.93
gfx950,256,2048,129280,4096,False,torch.bfloat16,torch.bfloat16,False,False,torch,0,0,1517.9126,native,0.0,1428.91,1057.62
gfx950,256,4096,129280,4096,False,torch.bfloat16,torch.bfloat16,False,False,asm,10,1,3033.4896,_ZN5aiter24bf16gemm_bf16_tn_256x256E,0.0,1430.01,709.31
gfx950,256,6144,129280,4096,False,torch.bfloat16,torch.bfloat16,False,False,asm,10,1,4366.2484,_ZN5aiter24bf16gemm_bf16_tn_256x256E,0.0,1490.27,617.92
gfx950,256,8192,129280,4096,False,torch.bfloat16,torch.bfloat16,False,False,asm,10,1,5776.7457,_ZN5aiter24bf16gemm_bf16_tn_256x256E,0.0,1501.85,561.61
gfx950,256,10240,129280,4096,False,torch.bfloat16,torch.bfloat16,False,False,asm,10,1,7384.5349,_ZN5aiter24bf16gemm_bf16_tn_256x256E,0.0,1468.58,513.32
gfx950,256,12288,129280,4096,False,torch.bfloat16,torch.bfloat16,False,False,asm,10,1,8690.592,_ZN5aiter24bf16gemm_bf16_tn_256x256E,0.0,1497.45,499.04
gfx950,256,14336,129280,4096,False,torch.bfloat16,torch.bfloat16,False,False,torch,0,0,10308.1547,native,0.0,1472.88,473.72
gfx950,256,16384,129280,4096,False,torch.bfloat16,torch.bfloat16,False,False,asm,10,1,12034.317,_ZN5aiter24bf16gemm_bf16_tn_256x256E,0.0,1441.85,451.17
