aiter/configs/model_configs/dsv4_fp4_tuned_fmoe.csv
gfx,cu_num,token,model_dim,inter_dim,expert,topk,act_type,dtype,q_dtype_a,q_dtype_w,q_type,use_g1u1,doweight_stage1,block_m,ksplit,us1,kernelName1,err1,us2,kernelName2,err2,us,run_1stage,xbf16,flat,tflops,bw,_tag
gfx950,256,1,7168,512,385,7,ActivationType.Silu,torch.bfloat16,torch.float4_e2m1fn_x2,torch.float4_e2m1fn_x2,QuantType.per_1x32,1,0,32,0,24.8524,flydsl_moe1_afp4_wfp4_bf16_t32x128x256_w4,0.0%,8.0706,moe_ck2stages_gemm2_256x32x128x128_1x4_MulABScaleExpertWeightShuffled_v3_Nswizzle0_Quant3_MulRoutedWeight1_FP4X2_FP4X2_B16,2.9%,32.923,0,0,0,4.68,128751.63,
gfx950,256,2,7168,512,385,7,ActivationType.Silu,torch.bfloat16,torch.float4_e2m1fn_x2,torch.float4_e2m1fn_x2,QuantType.per_1x32,1,0,32,0,26.0861,flydsl_moe1_afp4_wfp4_bf16_t32x128x256_w2,0.0%,11.6137,flydsl_moe2_afp4_wfp4_bf16_t32x256x256_reduce,0.5%,37.6998,0,0,0,8.18,112438.57,
gfx950,256,4,7168,512,385,7,ActivationType.Silu,torch.bfloat16,torch.float4_e2m1fn_x2,torch.float4_e2m1fn_x2,QuantType.per_1x32,1,0,32,0,25.624,flydsl_moe1_afp4_wfp4_bf16_t32x64x256_w2_fp4,0.9%,15.4525,flydsl_moe2_afp4_wfp4_bf16_t32x256x256_reduce_bnt2,0.5%,41.0765,0,0,0,15.01,103196.58,
gfx950,256,8,7168,512,385,7,ActivationType.Silu,torch.bfloat16,torch.float4_e2m1fn_x2,torch.float4_e2m1fn_x2,QuantType.per_1x32,1,0,64,0,35.003,flydsl_moe1_afp4_wfp4_bf16_t64x128x256_w3_fp4,1.2%,24.6706,flydsl_moe2_afp4_wfp4_bf16_t64x256x256_reduce,0.4%,59.6736,0,0,0,20.66,71037.12,
gfx950,256,16,7168,512,385,7,ActivationType.Silu,torch.bfloat16,torch.float4_e2m1fn_x2,torch.float4_e2m1fn_x2,QuantType.per_1x32,1,0,32,0,68.227,flydsl_moe1_afp4_wfp4_bf16_t32x128x256_w2_xcd4,0.0%,40.8145,flydsl_moe2_afp4_wfp4_bf16_t32x256x256_reduce,0.4%,109.0415,0,0,0,22.62,38877.06,
gfx950,256,32,7168,512,385,7,ActivationType.Silu,torch.bfloat16,torch.float4_e2m1fn_x2,torch.float4_e2m1fn_x2,QuantType.per_1x32,1,0,32,0,108.769,flydsl_moe1_afp4_wfp4_bf16_t32x128x256_w3,0.0%,63.1351,flydsl_moe2_afp4_wfp4_bf16_t32x256x256_reduce,0.4%,171.9041,0,0,0,28.69,24662.34,
gfx950,256,64,7168,512,385,7,ActivationType.Silu,torch.bfloat16,torch.float4_e2m1fn_x2,torch.float4_e2m1fn_x2,QuantType.per_1x32,1,0,32,0,167.5696,flydsl_moe1_afp4_wfp4_bf16_t32x64x256_w3_fp4,0.8%,94.8301,flydsl_moe2_afp4_wfp4_bf16_t32x128x256_reduce_bnt2_persist,0.4%,262.3997,0,0,0,37.6,16159.49,
gfx950,256,128,7168,512,385,7,ActivationType.Silu,torch.bfloat16,torch.float4_e2m1fn_x2,torch.float4_e2m1fn_x2,QuantType.per_1x32,1,0,32,0,213.7805,flydsl_moe1_afp4_wfp4_bf16_t32x128x256_w2,0.0%,120.0374,flydsl_moe2_afp4_wfp4_bf16_t16x128x256_atomic_persist_sbm32,2.6%,333.8179,0,0,0,59.1,12706.39,
gfx950,256,256,7168,512,385,7,ActivationType.Silu,torch.bfloat16,torch.float4_e2m1fn_x2,torch.float4_e2m1fn_x2,QuantType.per_1x32,1,0,32,0,224.3162,flydsl_moe1_afp4_wfp4_bf16_t32x128x256_w2_fp4,0.8%,134.2495,moe_ck2stages_gemm2_256x32x128x128_1x4_MulABScaleExpertWeightShuffled_v3_Nswizzle0_Quant3_MulRoutedWeight1_FP4X2_FP4X2_B16,2.6%,358.5657,0,0,0,110.05,11837.09,
gfx950,256,512,7168,512,385,7,ActivationType.Silu,torch.bfloat16,torch.float4_e2m1fn_x2,torch.float4_e2m1fn_x2,QuantType.per_1x32,1,0,64,0,242.9158,flydsl_moe1_afp4_wfp4_bf16_t64x128x256_w4_xcd4_fp4,0.8%,148.7981,flydsl_moe2_afp4_wfp4_bf16_t32x256x256_atomic_sbm64,2.6%,391.7139,0,0,0,201.47,10849.45,
gfx950,256,1024,7168,512,385,7,ActivationType.Silu,torch.bfloat16,torch.float4_e2m1fn_x2,torch.float4_e2m1fn_x2,QuantType.per_1x32,1,0,64,0,248.374,flydsl_moe1_afp4_wfp4_bf16_t64x128x256_w3_fp4,0.8%,159.6514,flydsl_moe2_afp4_wfp4_bf16_t32x128x256_atomic_bnt2_sbm64,2.6%,408.0254,0,0,0,386.84,10442.7,
gfx950,256,2048,7168,512,385,7,ActivationType.Silu,torch.bfloat16,torch.float4_e2m1fn_x2,torch.float4_e2m1fn_x2,QuantType.per_1x32,1,0,64,0,258.2467,flydsl_moe1_afp4_wfp4_bf16_t64x128x256_w3_fp4,0.8%,195.6916,flydsl_moe2_afp4_wfp4_bf16_t64x128x256_atomic_bnt2_persist,2.6%,453.9383,0,0,0,695.43,9435.0,
gfx950,256,4096,7168,512,385,7,ActivationType.Silu,torch.bfloat16,torch.float4_e2m1fn_x2,torch.float4_e2m1fn_x2,QuantType.per_1x32,1,0,128,0,320.36690000000004,flydsl_moe1_afp4_wfp4_bf16_t128x128x256_w3,0.0%,345.2331,flydsl_moe2_afp4_wfp4_bf16_t64x256x256_reduce_bnt2_sbm128,0.4%,665.6,0,0,0,948.56,6500.82,
gfx950,256,8192,7168,512,385,7,ActivationType.Silu,torch.bfloat16,torch.float4_e2m1fn_x2,torch.float4_e2m1fn_x2,QuantType.per_1x32,1,0,128,0,500.9433,flydsl_moe1_afp4_wfp4_bf16_t128x128x256_w2_bnt0_xcd4,0.0%,572.101,flydsl_moe2_afp4_wfp4_bf16_t64x256x256_reduce_bnt2_persist_sbm128,0.4%,1073.0443,0,0,0,1176.76,4114.49,
gfx950,256,16384,7168,512,385,7,ActivationType.Silu,torch.bfloat16,torch.float4_e2m1fn_x2,torch.float4_e2m1fn_x2,QuantType.per_1x32,1,0,128,0,721.557,flydsl_moe1_afp4_wfp4_bf16_t128x128x256_w4_bnt0_xcd4,0.0%,1025.5704,flydsl_moe2_afp4_wfp4_bf16_t64x256x256_reduce_bnt2_xcd4_sbm128,0.4%,1747.1274,0,0,0,1445.48,2627.85,
gfx950,256,32768,7168,512,385,7,ActivationType.Silu,torch.bfloat16,torch.float4_e2m1fn_x2,torch.float4_e2m1fn_x2,QuantType.per_1x32,1,0,128,0,1156.5861,moe_ck2stages_gemm1_256x128x128x128_1x4_MulABScaleShuffled_v3_Nswizzle0_Quant3_MulRoutedWeight0_silu_FP4X2_FP4X2_B16,0.0%,2017.0012,flydsl_moe2_afp4_wfp4_bf16_t64x256x256_reduce_bnt2_xcd4_persist_sbm128,0.4%,3173.5873,0,0,0,1591.54,1557.7,
gfx950,256,1,7168,768,385,7,ActivationType.Silu,torch.bfloat16,torch.float4_e2m1fn_x2,torch.float4_e2m1fn_x2,QuantType.per_1x32,1,0,64,0,18.0964,flydsl_moe1_afp4_wfp4_bf16_t64x64x256_bnt0_fp4,0.5%,10.8041,flydsl_moe2_afp4_wfp4_bf16_t64x128x256_reduce,0.6%,28.9005,0,0,0,8.0,220007.41,
gfx950,256,2,7168,768,385,7,ActivationType.Silu,torch.bfloat16,torch.float4_e2m1fn_x2,torch.float4_e2m1fn_x2,QuantType.per_1x32,1,0,32,0,26.9451,flydsl_moe1_afp4_wfp4_bf16_t32x128x256,0.0%,13.6712,flydsl_moe2_afp4_wfp4_bf16_t32x256x256_reduce_bnt2,0.8%,40.6163,0,0,0,11.39,156546.65,
gfx950,256,4,7168,768,385,7,ActivationType.Silu,torch.bfloat16,torch.float4_e2m1fn_x2,torch.float4_e2m1fn_x2,QuantType.per_1x32,1,0,32,0,30.4585,flydsl_moe1_afp4_wfp4_bf16_t32x128x256_w2,0.0%,19.6556,flydsl_moe2_afp4_wfp4_bf16_t32x256x128_reduce,0.7%,50.1141,0,0,0,18.45,126878.24,
gfx950,256,8,7168,768,385,7,ActivationType.Silu,torch.bfloat16,torch.float4_e2m1fn_x2,torch.float4_e2m1fn_x2,QuantType.per_1x32,1,0,32,0,54.2451,flydsl_moe1_afp4_wfp4_bf16_t32x64x256_w3_xcd4,0.0%,32.2624,flydsl_moe2_afp4_wfp4_bf16_t32x128x256_atomic,3.5%,86.5075,0,0,0,21.38,73502.01,
gfx950,256,16,7168,768,385,7,ActivationType.Silu,torch.bfloat16,torch.float4_e2m1fn_x2,torch.float4_e2m1fn_x2,QuantType.per_1x32,1,0,32,0,97.7444,flydsl_moe1_afp4_wfp4_bf16_t32x128x256_w4_xcd4,0.0%,53.1129,flydsl_moe2_afp4_wfp4_bf16_t32x128x256_atomic,3.5%,150.8573,0,0,0,24.52,42150.08,
gfx950,256,32,7168,768,385,7,ActivationType.Silu,torch.bfloat16,torch.float4_e2m1fn_x2,torch.float4_e2m1fn_x2,QuantType.per_1x32,1,0,32,0,162.7894,flydsl_moe1_afp4_wfp4_bf16_t32x64x256_w3,0.0%,89.0604,flydsl_moe2_afp4_wfp4_bf16_t32x128x256_reduce_persist,0.9%,251.8498,0,0,0,29.38,25249.14,
gfx950,256,64,7168,768,385,7,ActivationType.Silu,torch.bfloat16,torch.float4_e2m1fn_x2,torch.float4_e2m1fn_x2,QuantType.per_1x32,1,0,32,0,245.4018,flydsl_moe1_afp4_wfp4_bf16_t32x64x256_w4,0.0%,130.2131,flydsl_moe2_afp4_wfp4_bf16_t32x128x256_atomic_bnt2,3.6%,375.6149,0,0,0,39.4,16931.38,
gfx950,256,128,7168,768,385,7,ActivationType.Silu,torch.bfloat16,torch.float4_e2m1fn_x2,torch.float4_e2m1fn_x2,QuantType.per_1x32,1,0,64,0,312.74749999999995,flydsl_moe1_afp4_wfp4_bf16_t64x64x256_w3,0.0%,169.9485,flydsl_moe2_afp4_wfp4_bf16_t32x128x128_atomic_bnt2_persist_sbm64,3.6%,482.696,0,0,0,61.31,13178.18,
gfx950,256,256,7168,768,385,7,ActivationType.Silu,torch.bfloat16,torch.float4_e2m1fn_x2,torch.float4_e2m1fn_x2,QuantType.per_1x32,1,0,64,0,339.9504,flydsl_moe1_afp4_wfp4_bf16_t64x128x256_w2_fp4,0.8%,192.7977,flydsl_moe2_afp4_wfp4_bf16_t32x128x256_atomic_persist_sbm64,3.6%,532.7481,0,0,0,111.1,11945.25,
gfx950,256,512,7168,768,385,7,ActivationType.Silu,torch.bfloat16,torch.float4_e2m1fn_x2,torch.float4_e2m1fn_x2,QuantType.per_1x32,1,0,32,0,350.8042,flydsl_moe1_afp4_wfp4_bf16_t32x64x256_w4_fp4,0.8%,199.4821,flydsl_moe2_afp4_wfp4_bf16_t32x128x256_atomic_persist,3.6%,550.2863,0,0,0,215.12,11574.54,
gfx950,256,1024,7168,768,385,7,ActivationType.Silu,torch.bfloat16,torch.float4_e2m1fn_x2,torch.float4_e2m1fn_x2,QuantType.per_1x32,1,0,32,0,368.1417,flydsl_moe1_afp4_wfp4_bf16_t32x128x256_w2,0.0%,218.8855,flydsl_moe2_afp4_wfp4_bf16_t32x256x128_atomic,3.6%,587.0272,0,0,0,403.32,10868.87,
gfx950,256,2048,7168,768,385,7,ActivationType.Silu,torch.bfloat16,torch.float4_e2m1fn_x2,torch.float4_e2m1fn_x2,QuantType.per_1x32,1,0,64,0,390.4414,flydsl_moe1_afp4_wfp4_bf16_t64x64x256_w4,0.0%,259.2352,flydsl_moe2_afp4_wfp4_bf16_t64x256x256_atomic_bnt2_persist,3.6%,649.6766,0,0,0,728.86,9854.66,
gfx950,256,4096,7168,768,385,7,ActivationType.Silu,torch.bfloat16,torch.float4_e2m1fn_x2,torch.float4_e2m1fn_x2,QuantType.per_1x32,1,0,128,0,463.1171,flydsl_moe1_afp4_wfp4_bf16_t128x128x256_w2,0.0%,407.1336,flydsl_moe2_afp4_wfp4_bf16_t64x128x256_atomic_persist_sbm128,3.6%,870.2507,0,0,0,1088.24,7407.5,
gfx950,256,8192,7168,768,385,7,ActivationType.Silu,torch.bfloat16,torch.float4_e2m1fn_x2,torch.float4_e2m1fn_x2,QuantType.per_1x32,1,0,64,0,700.8958,flydsl_moe1_afp4_wfp4_bf16_t64x128x256_w2_bnt0_xcd4_fp4,0.8%,743.5208,flydsl_moe2_afp4_wfp4_bf16_t64x128x256_atomic_persist,3.6%,1444.4166,0,0,0,1311.31,4523.95,
gfx950,256,16384,7168,768,385,7,ActivationType.Silu,torch.bfloat16,torch.float4_e2m1fn_x2,torch.float4_e2m1fn_x2,QuantType.per_1x32,1,0,64,0,1060.0201,flydsl_moe1_afp4_wfp4_bf16_t64x128x256_w2_bnt0_xcd4_fp4,0.8%,1343.2524,flydsl_moe2_afp4_wfp4_bf16_t64x128x256_reduce_bnt2_persist,0.8%,2403.2725,0,0,0,1576.25,2792.29,
gfx950,256,32768,7168,768,385,7,ActivationType.Silu,torch.bfloat16,torch.float4_e2m1fn_x2,torch.float4_e2m1fn_x2,QuantType.per_1x32,1,0,128,0,1777.4512,flydsl_moe1_afp4_wfp4_bf16_t128x128x256_w3_bnt0_xcd4,0.0%,2438.9518,flydsl_moe2_afp4_wfp4_bf16_t128x128x128_reduce_persist,0.8%,4216.403,0,0,0,1796.87,1675.11,
gfx950,256,1,7168,1536,385,7,ActivationType.Silu,torch.bfloat16,torch.float4_e2m1fn_x2,torch.float4_e2m1fn_x2,QuantType.per_1x32,1,0,32,0,27.3105,flydsl_moe1_afp4_wfp4_bf16_t32x32x256_w4,0.0%,13.4107,flydsl_moe2_afp4_wfp4_bf16_t32x256x256_reduce,1.8%,40.7212,0,0,0,11.36,312285.17,
gfx950,256,2,7168,1536,385,7,ActivationType.Silu,torch.bfloat16,torch.float4_e2m1fn_x2,torch.float4_e2m1fn_x2,QuantType.per_1x32,1,0,32,0,31.6448,flydsl_moe1_afp4_wfp4_bf16_t32x128x256_w4,0.0%,20.1986,flydsl_moe2_afp4_wfp4_bf16_t32x256x128_reduce,1.9%,51.8434,0,0,0,17.84,245289.63,
gfx950,256,4,7168,1536,385,7,ActivationType.Silu,torch.bfloat16,torch.float4_e2m1fn_x2,torch.float4_e2m1fn_x2,QuantType.per_1x32,1,0,32,0,54.756,flydsl_moe1_afp4_wfp4_bf16_t32x64x256_w4,0.0%,35.2656,flydsl_moe2_afp4_wfp4_bf16_t32x128x256_atomic_bnt2,5.4%,90.0216,0,0,0,20.55,141262.67,
gfx950,256,8,7168,1536,385,7,ActivationType.Silu,torch.bfloat16,torch.float4_e2m1fn_x2,torch.float4_e2m1fn_x2,QuantType.per_1x32,1,0,32,0,101.5407,flydsl_moe1_afp4_wfp4_bf16_t32x128x256_w4_xcd4,0.0%,60.7025,flydsl_moe2_afp4_wfp4_bf16_t16x128x256_reduce_bnt2_sbm32,1.8%,162.2432,0,0,0,22.8,78380.96,
gfx950,256,16,7168,1536,385,7,ActivationType.Silu,torch.bfloat16,torch.float4_e2m1fn_x2,torch.float4_e2m1fn_x2,QuantType.per_1x32,1,0,32,0,175.1293,flydsl_moe1_afp4_wfp4_bf16_t32x128x256_w4,0.0%,100.3098,flydsl_moe2_afp4_wfp4_bf16_t32x128x256_reduce_bnt2_persist,1.8%,275.4391,0,0,0,26.86,46169.73,
gfx950,256,32,7168,1536,385,7,ActivationType.Silu,torch.bfloat16,torch.float4_e2m1fn_x2,torch.float4_e2m1fn_x2,QuantType.per_1x32,1,0,32,0,286.692,flydsl_moe1_afp4_wfp4_bf16_t32x128x256_w4_fp4,0.7%,167.1139,flydsl_moe2_afp4_wfp4_bf16_t16x128x256_atomic_sbm32,5.6%,453.8059,0,0,0,32.61,28023.64,
gfx950,256,64,7168,1536,385,7,ActivationType.Silu,torch.bfloat16,torch.float4_e2m1fn_x2,torch.float4_e2m1fn_x2,QuantType.per_1x32,1,0,32,0,458.1814,flydsl_moe1_afp4_wfp4_bf16_t32x64x256_w4,0.0%,254.6593,flydsl_moe2_afp4_wfp4_bf16_t16x128x128_atomic_sbm32,5.7%,712.8407,0,0,0,41.52,17841.27,
gfx950,256,128,7168,1536,385,7,ActivationType.Silu,torch.bfloat16,torch.float4_e2m1fn_x2,torch.float4_e2m1fn_x2,QuantType.per_1x32,1,0,32,0,594.6779,flydsl_moe1_afp4_wfp4_bf16_t32x128x256_w4_fp4,0.8%,335.161,flydsl_moe2_afp4_wfp4_bf16_t16x128x256_reduce_sbm32,1.8%,929.8389,0,0,0,63.66,13679.1,
gfx950,256,256,7168,1536,385,7,ActivationType.Silu,torch.bfloat16,torch.float4_e2m1fn_x2,torch.float4_e2m1fn_x2,QuantType.per_1x32,1,0,64,0,657.7311,flydsl_moe1_afp4_wfp4_bf16_t64x128x256_w2_fp4,0.8%,375.6746,flydsl_moe2_afp4_wfp4_bf16_t32x128x256_atomic_bnt2_persist_sbm64,5.7%,1033.4057,0,0,0,114.55,12310.86,
gfx950,256,512,7168,1536,385,7,ActivationType.Silu,torch.bfloat16,torch.float4_e2m1fn_x2,torch.float4_e2m1fn_x2,QuantType.per_1x32,1,0,64,0,680.6370999999999,flydsl_moe1_afp4_wfp4_bf16_t64x64x256_w4,0.0%,391.4939,flydsl_moe2_afp4_wfp4_bf16_t32x128x256_atomic_bnt2_sbm64,5.6%,1072.131,0,0,0,220.83,11871.32,
gfx950,256,1024,7168,1536,385,7,ActivationType.Silu,torch.bfloat16,torch.float4_e2m1fn_x2,torch.float4_e2m1fn_x2,QuantType.per_1x32,1,0,32,0,702.1370000000001,flydsl_moe1_afp4_wfp4_bf16_t32x64x256_w4,0.0%,408.7935,flydsl_moe2_afp4_wfp4_bf16_t32x256x256_atomic,5.7%,1110.9305,0,0,0,426.24,11466.63,
gfx950,256,2048,7168,1536,385,7,ActivationType.Silu,torch.bfloat16,torch.float4_e2m1fn_x2,torch.float4_e2m1fn_x2,QuantType.per_1x32,1,0,64,0,720.758,flydsl_moe1_afp4_wfp4_bf16_t64x128x256_w4_fp4,0.8%,449.3694,flydsl_moe2_afp4_wfp4_bf16_t64x128x256_atomic_bnt2,5.7%,1170.1274,0,0,0,809.35,10905.35,
gfx950,256,4096,7168,1536,385,7,ActivationType.Silu,torch.bfloat16,torch.float4_e2m1fn_x2,torch.float4_e2m1fn_x2,QuantType.per_1x32,1,0,128,0,863.446,flydsl_moe1_afp4_wfp4_bf16_t128x128x256,0.0%,643.6432,flydsl_moe2_afp4_wfp4_bf16_t128x128x256_atomic,5.7%,1507.0892,0,0,0,1256.78,8496.3,
gfx950,256,8192,7168,1536,385,7,ActivationType.Silu,torch.bfloat16,torch.float4_e2m1fn_x2,torch.float4_e2m1fn_x2,QuantType.per_1x32,1,0,64,0,1406.7777,flydsl_moe1_afp4_wfp4_bf16_t64x64x256_w4_bnt0,0.0%,1088.5317,flydsl_moe2_afp4_wfp4_bf16_t64x128x256_atomic_bnt2,5.7%,2495.3094,0,0,0,1518.11,5166.8,
gfx950,256,16384,7168,1536,385,7,ActivationType.Silu,torch.bfloat16,torch.float4_e2m1fn_x2,torch.float4_e2m1fn_x2,QuantType.per_1x32,1,0,128,0,2072.807,moe_ck2stages_gemm1_256x128x128x128_1x4_MulABScaleShuffled_v3_Nswizzle0_Quant3_MulRoutedWeight0_silu_FP4X2_FP4X2_B16,0.0%,1891.4245,flydsl_moe2_afp4_wfp4_bf16_t128x128x256_atomic_bnt2,5.7%,3964.2315,0,0,0,1911.17,3296.71,
gfx950,256,32768,7168,1536,385,7,ActivationType.Silu,torch.bfloat16,torch.float4_e2m1fn_x2,torch.float4_e2m1fn_x2,QuantType.per_1x32,1,0,128,0,3333.5058,moe_ck2stages_gemm1_256x128x128x128_1x4_MulABScaleShuffled_v3_Nswizzle0_Quant3_MulRoutedWeight0_silu_FP4X2_FP4X2_B16,0.0%,3355.3165,flydsl_moe2_afp4_wfp4_bf16_t128x128x256_reduce_bnt2,1.9%,6688.8223,0,0,0,2265.37,2006.52,
gfx950,256,1,7168,512,384,6,ActivationType.Silu,torch.bfloat16,torch.float4_e2m1fn_x2,torch.float4_e2m1fn_x2,QuantType.per_1x32,1,0,32,0,24.5212,flydsl_moe1_afp4_wfp4_bf16_t32x32x256_w3,0.0%,7.8113,moe_ck2stages_gemm2_256x32x128x128_1x4_MulABScaleExpertWeightShuffled_v3_Nswizzle0_Quant3_MulRoutedWeight1_FP4X2_FP4X2_B16,2.2%,32.3325,0,0,0,4.09,130762.54,
gfx950,256,2,7168,512,384,6,ActivationType.Silu,torch.bfloat16,torch.float4_e2m1fn_x2,torch.float4_e2m1fn_x2,QuantType.per_1x32,1,0,32,0,25.0632,flydsl_moe1_afp4_wfp4_bf16_t32x128x256_w4,0.0%,10.33,moe_ck2stages_gemm2_256x32x128x128_1x4_MulABScaleExpertWeightShuffled_v3_Nswizzle0_Quant3_MulRoutedWeight1_FP4X2_FP4X2_B16,2.5%,35.3932,0,0,0,7.47,119455.19,
gfx950,256,4,7168,512,384,6,ActivationType.Silu,torch.bfloat16,torch.float4_e2m1fn_x2,torch.float4_e2m1fn_x2,QuantType.per_1x32,1,0,32,0,27.2426,flydsl_moe1_afp4_wfp4_bf16_t32x64x256_w3,0.0%,14.691,flydsl_moe2_afp4_wfp4_bf16_t32x256x256_reduce_bnt2,0.6%,41.9336,0,0,0,12.6,100824.74,
gfx950,256,8,7168,512,384,6,ActivationType.Silu,torch.bfloat16,torch.float4_e2m1fn_x2,torch.float4_e2m1fn_x2,QuantType.per_1x32,1,0,32,0,31.7832,flydsl_moe1_afp4_wfp4_bf16_t32x128x256_fp4,0.5%,22.5229,flydsl_moe2_afp4_wfp4_bf16_t32x256x256_reduce_bnt2_xcd4,0.5%,54.3061,0,0,0,19.46,77855.53,
gfx950,256,16,7168,512,384,6,ActivationType.Silu,torch.bfloat16,torch.float4_e2m1fn_x2,torch.float4_e2m1fn_x2,QuantType.per_1x32,1,0,32,0,57.2114,flydsl_moe1_afp4_wfp4_bf16_t32x64x256_w4,0.0%,35.528,flydsl_moe2_afp4_wfp4_bf16_t16x128x256_atomic_sbm32,2.4%,92.7394,0,0,0,22.79,45592.3,
gfx950,256,32,7168,512,384,6,ActivationType.Silu,torch.bfloat16,torch.float4_e2m1fn_x2,torch.float4_e2m1fn_x2,QuantType.per_1x32,1,0,32,0,99.6418,flydsl_moe1_afp4_wfp4_bf16_t32x128x256_w4_fp4,0.8%,58.1037,flydsl_moe2_afp4_wfp4_bf16_t32x256x256_atomic_bnt2,2.5%,157.7455,0,0,0,26.8,26806.13,
gfx950,256,64,7168,512,384,6,ActivationType.Silu,torch.bfloat16,torch.float4_e2m1fn_x2,torch.float4_e2m1fn_x2,QuantType.per_1x32,1,0,32,0,151.5451,flydsl_moe1_afp4_wfp4_bf16_t32x128x256_w3,0.0%,86.3597,flydsl_moe2_afp4_wfp4_bf16_t16x256x256_atomic_persist_sbm32,2.5%,237.9048,0,0,0,35.54,17777.0,
gfx950,256,128,7168,512,384,6,ActivationType.Silu,torch.bfloat16,torch.float4_e2m1fn_x2,torch.float4_e2m1fn_x2,QuantType.per_1x32,1,0,32,0,203.2099,flydsl_moe1_afp4_wfp4_bf16_t32x64x256_w3,0.0%,111.9719,flydsl_moe2_afp4_wfp4_bf16_t32x128x256_atomic_persist,2.4%,315.1818,0,0,0,53.66,13422.76,
gfx950,256,256,7168,512,384,6,ActivationType.Silu,torch.bfloat16,torch.float4_e2m1fn_x2,torch.float4_e2m1fn_x2,QuantType.per_1x32,1,0,64,0,226.4304,flydsl_moe1_afp4_wfp4_bf16_t64x128x256_w2_fp4,0.7%,130.7745,flydsl_moe2_afp4_wfp4_bf16_t32x128x256_reduce_persist_sbm64,0.5%,357.2049,0,0,0,94.69,11851.36,
gfx950,256,512,7168,512,384,6,ActivationType.Silu,torch.bfloat16,torch.float4_e2m1fn_x2,torch.float4_e2m1fn_x2,QuantType.per_1x32,1,0,32,0,230.5895,flydsl_moe1_afp4_wfp4_bf16_t32x128x256_w2_fp4,0.8%,143.1571,flydsl_moe2_afp4_wfp4_bf16_t32x256x256_atomic_bnt2,2.4%,373.7466,0,0,0,180.99,11341.56,
gfx950,256,1024,7168,512,384,6,ActivationType.Silu,torch.bfloat16,torch.float4_e2m1fn_x2,torch.float4_e2m1fn_x2,QuantType.per_1x32,1,0,32,0,229.7635,flydsl_moe1_afp4_wfp4_bf16_t32x128x256_w3_fp4,0.8%,154.9642,flydsl_moe2_afp4_wfp4_bf16_t32x256x256_atomic_bnt2_persist,2.4%,384.7277,0,0,0,351.66,11046.46,
gfx950,256,2048,7168,512,384,6,ActivationType.Silu,torch.bfloat16,torch.float4_e2m1fn_x2,torch.float4_e2m1fn_x2,QuantType.per_1x32,1,0,64,0,244.3083,flydsl_moe1_afp4_wfp4_bf16_t64x128x256_w3_fp4,0.8%,187.4411,flydsl_moe2_afp4_wfp4_bf16_t64x128x256_atomic_bnt2,2.4%,431.7494,0,0,0,626.71,9894.39,
gfx950,256,4096,7168,512,384,6,ActivationType.Silu,torch.bfloat16,torch.float4_e2m1fn_x2,torch.float4_e2m1fn_x2,QuantType.per_1x32,1,0,128,0,298.2644,flydsl_moe1_afp4_wfp4_bf16_t128x128x256,0.0%,301.3052,flydsl_moe2_afp4_wfp4_bf16_t64x256x256_reduce_bnt2_persist_sbm128,0.5%,599.5696,0,0,0,902.59,7198.4,
gfx950,256,8192,7168,512,384,6,ActivationType.Silu,torch.bfloat16,torch.float4_e2m1fn_x2,torch.float4_e2m1fn_x2,QuantType.per_1x32,1,0,64,0,419.6291,flydsl_moe1_afp4_wfp4_bf16_t64x128x256_w4_bnt0_xcd4_fp4,0.8%,512.7001,flydsl_moe2_afp4_wfp4_bf16_t64x256x256_reduce_bnt2_xcd4,0.5%,932.3292,0,0,0,1160.89,4723.67,
gfx950,256,16384,7168,512,384,6,ActivationType.Silu,torch.bfloat16,torch.float4_e2m1fn_x2,torch.float4_e2m1fn_x2,QuantType.per_1x32,1,0,64,0,655.7962,flydsl_moe1_afp4_wfp4_bf16_t64x128x256_w4_bnt0_xcd4,0.0%,918.6294,flydsl_moe2_afp4_wfp4_bf16_t64x256x256_reduce_xcd4_persist,0.5%,1574.4256,0,0,0,1374.89,2909.11,
gfx950,256,32768,7168,512,384,6,ActivationType.Silu,torch.bfloat16,torch.float4_e2m1fn_x2,torch.float4_e2m1fn_x2,QuantType.per_1x32,1,0,64,0,1005.0778,flydsl_moe1_afp4_wfp4_bf16_t64x128x256_w2_bnt0_fp4,0.8%,1756.2262,flydsl_moe2_afp4_wfp4_bf16_t64x256x256_reduce_bnt2_xcd4,0.5%,2761.304,0,0,0,1567.86,1786.29,
gfx950,256,1,7168,768,384,6,ActivationType.Silu,torch.bfloat16,torch.float4_e2m1fn_x2,torch.float4_e2m1fn_x2,QuantType.per_1x32,1,0,32,0,17.8596,flydsl_moe1_afp4_wfp4_bf16_t32x64x256_w3_kb4_bnt0_go_fp4,1.4%,7.7292,moe_ck2stages_gemm2_256x32x128x128_1x4_MulABScaleExpertWeightShuffled_v3_Nswizzle0_Quant3_MulRoutedWeight1_FP4X2_FP4X2_B16,2.9%,25.5888,0,0,0,7.74,247835.35,
gfx950,256,2,7168,768,384,6,ActivationType.Silu,torch.bfloat16,torch.float4_e2m1fn_x2,torch.float4_e2m1fn_x2,QuantType.per_1x32,1,0,32,0,26.0633,flydsl_moe1_afp4_wfp4_bf16_t32x128x256_w2,0.0%,11.899,moe_ck2stages_gemm2_256x32x128x128_1x4_MulABScaleExpertWeightShuffled_v3_Nswizzle0_Quant3_MulRoutedWeight1_FP4X2_FP4X2_B16,3.2%,37.9623,0,0,0,10.44,167056.02,
gfx950,256,4,7168,768,384,6,ActivationType.Silu,torch.bfloat16,torch.float4_e2m1fn_x2,torch.float4_e2m1fn_x2,QuantType.per_1x32,1,0,32,0,26.3493,flydsl_moe1_afp4_wfp4_bf16_t32x128x256_fp4,0.9%,17.9968,flydsl_moe2_afp4_wfp4_bf16_t32x256x128_reduce_bnt2,1.0%,44.3461,0,0,0,17.88,143008.6,
gfx950,256,8,7168,768,384,6,ActivationType.Silu,torch.bfloat16,torch.float4_e2m1fn_x2,torch.float4_e2m1fn_x2,QuantType.per_1x32,1,0,32,0,51.7577,flydsl_moe1_afp4_wfp4_bf16_t32x64x256_w3_xcd4,0.0%,30.842,flydsl_moe2_afp4_wfp4_bf16_t32x128x256_atomic,3.2%,82.5997,0,0,0,19.19,76779.45,
gfx950,256,16,7168,768,384,6,ActivationType.Silu,torch.bfloat16,torch.float4_e2m1fn_x2,torch.float4_e2m1fn_x2,QuantType.per_1x32,1,0,32,0,95.5841,flydsl_moe1_afp4_wfp4_bf16_t32x32x256_w3,0.0%,49.6523,flydsl_moe2_afp4_wfp4_bf16_t16x128x256_atomic_persist_sbm32,3.3%,145.2364,0,0,0,21.83,43667.65,
gfx950,256,32,7168,768,384,6,ActivationType.Silu,torch.bfloat16,torch.float4_e2m1fn_x2,torch.float4_e2m1fn_x2,QuantType.per_1x32,1,0,32,0,141.4928,flydsl_moe1_afp4_wfp4_bf16_t32x128x256_w2,0.0%,79.8112,flydsl_moe2_afp4_wfp4_bf16_t16x128x256_reduce_persist_sbm32,1.0%,221.304,0,0,0,28.66,28659.56,
gfx950,256,64,7168,768,384,6,ActivationType.Silu,torch.bfloat16,torch.float4_e2m1fn_x2,torch.float4_e2m1fn_x2,QuantType.per_1x32,1,0,32,0,211.9691,flydsl_moe1_afp4_wfp4_bf16_t32x64x256_w3_fp4,0.8%,119.685,flydsl_moe2_afp4_wfp4_bf16_t32x128x256_reduce_bnt2,1.0%,331.6541,0,0,0,38.24,19125.84,
gfx950,256,128,7168,768,384,6,ActivationType.Silu,torch.bfloat16,torch.float4_e2m1fn_x2,torch.float4_e2m1fn_x2,QuantType.per_1x32,1,0,64,0,294.9004,flydsl_moe1_afp4_wfp4_bf16_t64x64x256_w4,0.0%,160.8898,flydsl_moe2_afp4_wfp4_bf16_t32x128x256_reduce_sbm64,1.0%,455.7902,0,0,0,55.66,13919.87,
gfx950,256,256,7168,768,384,6,ActivationType.Silu,torch.bfloat16,torch.float4_e2m1fn_x2,torch.float4_e2m1fn_x2,QuantType.per_1x32,1,0,64,0,333.9833,flydsl_moe1_afp4_wfp4_bf16_t64x128x256_w2_fp4,0.8%,188.0044,flydsl_moe2_afp4_wfp4_bf16_t32x128x256_atomic_bnt2_sbm64,3.3%,521.9877,0,0,0,97.19,12159.85,
gfx950,256,512,7168,768,384,6,ActivationType.Silu,torch.bfloat16,torch.float4_e2m1fn_x2,torch.float4_e2m1fn_x2,QuantType.per_1x32,1,0,64,0,337.0411,flydsl_moe1_afp4_wfp4_bf16_t64x128x256_w3_fp4,0.8%,198.6912,moe_ck2stages_gemm2_256x64x128x128_1x4_MulABScaleExpertWeightShuffled_v3_Nswizzle0_Quant3_MulRoutedWeight1_FP4X2_FP4X2_B16,3.4%,535.7323,0,0,0,189.4,11858.16,
gfx950,256,1024,7168,768,384,6,ActivationType.Silu,torch.bfloat16,torch.float4_e2m1fn_x2,torch.float4_e2m1fn_x2,QuantType.per_1x32,1,0,32,0,340.0299,flydsl_moe1_afp4_wfp4_bf16_t32x128x256_w3_fp4,0.8%,219.8325,flydsl_moe2_afp4_wfp4_bf16_t32x128x256_atomic_bnt2,3.4%,559.8624,0,0,0,362.48,11366.74,
gfx950,256,2048,7168,768,384,6,ActivationType.Silu,torch.bfloat16,torch.float4_e2m1fn_x2,torch.float4_e2m1fn_x2,QuantType.per_1x32,1,0,64,0,360.1198,flydsl_moe1_afp4_wfp4_bf16_t64x128x256_w3_fp4,0.8%,258.174,flydsl_moe2_afp4_wfp4_bf16_t64x128x256_atomic_bnt2,3.4%,618.2938,0,0,0,656.44,10328.14,
gfx950,256,4096,7168,768,384,6,ActivationType.Silu,torch.bfloat16,torch.float4_e2m1fn_x2,torch.float4_e2m1fn_x2,QuantType.per_1x32,1,0,128,0,434.043,flydsl_moe1_afp4_wfp4_bf16_t128x128x256_w3,0.0%,353.8172,flydsl_moe2_afp4_wfp4_bf16_t64x128x256_atomic_bnt2_persist_sbm128,3.4%,787.8602,0,0,0,1030.32,8161.18,
gfx950,256,8192,7168,768,384,6,ActivationType.Silu,torch.bfloat16,torch.float4_e2m1fn_x2,torch.float4_e2m1fn_x2,QuantType.per_1x32,1,0,128,0,652.764,flydsl_moe1_afp4_wfp4_bf16_t128x128x256_w3_bnt0,0.0%,635.7945,flydsl_moe2_afp4_wfp4_bf16_t64x128x256_atomic_persist_async_w4_cumul3_sbm128,3.4%,1288.5585,0,0,0,1259.93,5058.33,
gfx950,256,16384,7168,768,384,6,ActivationType.Silu,torch.bfloat16,torch.float4_e2m1fn_x2,torch.float4_e2m1fn_x2,QuantType.per_1x32,1,0,128,0,964.361,flydsl_moe1_afp4_wfp4_bf16_t128x128x256_w3_bnt0_xcd4,0.0%,1162.7557,flydsl_moe2_afp4_wfp4_bf16_t128x128x256_reduce,1.0%,2127.1167,0,0,0,1526.48,3147.03,
gfx950,256,32768,7168,768,384,6,ActivationType.Silu,torch.bfloat16,torch.float4_e2m1fn_x2,torch.float4_e2m1fn_x2,QuantType.per_1x32,1,0,128,0,1582.8490000000002,flydsl_moe1_afp4_wfp4_bf16_t128x128x256_bnt0_xcd4,0.0%,2163.7062,flydsl_moe2_afp4_wfp4_bf16_t128x128x128_reduce,1.0%,3746.5552,0,0,0,1733.32,1880.78,
gfx950,256,1,7168,1536,384,6,ActivationType.Silu,torch.bfloat16,torch.float4_e2m1fn_x2,torch.float4_e2m1fn_x2,QuantType.per_1x32,1,0,32,0,18.4761,flydsl_moe1_afp4_wfp4_bf16_t32x128x256_bnt0,0.0%,9.9427,moe_ck2stages_gemm2_256x32x128x128_1x4_MulABScaleExpertWeightShuffled_v3_Nswizzle0_Quant3_MulRoutedWeight1_FP4X2_FP4X2_B16,5.4%,28.4188,0,0,0,13.95,446310.08,
gfx950,256,2,7168,1536,384,6,ActivationType.Silu,torch.bfloat16,torch.float4_e2m1fn_x2,torch.float4_e2m1fn_x2,QuantType.per_1x32,1,0,32,0,29.6203,flydsl_moe1_afp4_wfp4_bf16_t32x128x256_w2,0.0%,18.4505,flydsl_moe2_afp4_wfp4_bf16_t32x128x256_reduce_bnt2,2.1%,48.0708,0,0,0,16.49,263852.87,
gfx950,256,4,7168,1536,384,6,ActivationType.Silu,torch.bfloat16,torch.float4_e2m1fn_x2,torch.float4_e2m1fn_x2,QuantType.per_1x32,1,0,32,0,51.4048,flydsl_moe1_afp4_wfp4_bf16_t32x64x256_w3_xcd4,0.0%,30.6551,flydsl_moe2_afp4_wfp4_bf16_t32x256x256_atomic,5.3%,82.0599,0,0,0,19.32,154565.89,
gfx950,256,8,7168,1536,384,6,ActivationType.Silu,torch.bfloat16,torch.float4_e2m1fn_x2,torch.float4_e2m1fn_x2,QuantType.per_1x32,1,0,32,0,88.8026,flydsl_moe1_afp4_wfp4_bf16_t32x32x256_w3,0.0%,51.8537,flydsl_moe2_afp4_wfp4_bf16_t32x128x256_reduce,2.0%,140.6563,0,0,0,22.54,90175.47,
gfx950,256,16,7168,1536,384,6,ActivationType.Silu,torch.bfloat16,torch.float4_e2m1fn_x2,torch.float4_e2m1fn_x2,QuantType.per_1x32,1,0,32,0,157.1847,flydsl_moe1_afp4_wfp4_bf16_t32x64x256_w3,0.0%,88.3089,flydsl_moe2_afp4_wfp4_bf16_t32x128x256_atomic_persist,5.2%,245.4936,0,0,0,25.83,51667.01,
gfx950,256,32,7168,1536,384,6,ActivationType.Silu,torch.bfloat16,torch.float4_e2m1fn_x2,torch.float4_e2m1fn_x2,QuantType.per_1x32,1,0,32,0,253.7394,flydsl_moe1_afp4_wfp4_bf16_t32x64x256_w2,0.0%,142.5289,flydsl_moe2_afp4_wfp4_bf16_t16x128x256_reduce_bnt2_sbm32,2.1%,396.2683,0,0,0,32.01,32009.28,
gfx950,256,64,7168,1536,384,6,ActivationType.Silu,torch.bfloat16,torch.float4_e2m1fn_x2,torch.float4_e2m1fn_x2,QuantType.per_1x32,1,0,64,0,424.5645,flydsl_moe1_afp4_wfp4_bf16_t64x128x256_w2,0.0%,235.8049,flydsl_moe2_afp4_wfp4_bf16_t64x256x256_atomic,5.2%,660.3694,0,0,0,38.41,19208.87,
gfx950,256,128,7168,1536,384,6,ActivationType.Silu,torch.bfloat16,torch.float4_e2m1fn_x2,torch.float4_e2m1fn_x2,QuantType.per_1x32,1,0,64,0,553.7619,flydsl_moe1_afp4_wfp4_bf16_t64x64x256_w4_fp4,0.7%,313.5543,flydsl_moe2_afp4_wfp4_bf16_t32x128x256_reduce_bnt2_sbm64,2.1%,867.3162,0,0,0,58.5,14627.11,
gfx950,256,1,7168,3072,48,6,ActivationType.Silu,torch.bfloat16,torch.float4_e2m1fn_x2,torch.float4_e2m1fn_x2,QuantType.per_1x32,1,0,32,0,29.924100000000003,flydsl_moe1_afp4_wfp4_bf16_t32x128x256_w4,0.0%,17.6988,flydsl_moe2_afp4_wfp4_bf16_t32x256x256_reduce_bnt2_xcd4,3.5%,47.6229,0,0,0,16.65,66583.84,
gfx950,256,2,7168,3072,48,6,ActivationType.Silu,torch.bfloat16,torch.float4_e2m1fn_x2,torch.float4_e2m1fn_x2,QuantType.per_1x32,1,0,32,0,54.1499,flydsl_moe1_afp4_wfp4_bf16_t32x64x256_w3,0.0%,30.8069,flydsl_moe2_afp4_wfp4_bf16_t32x128x256_atomic_persist,6.7%,84.9568,0,0,0,18.66,37324.11,
gfx950,256,4,7168,3072,48,6,ActivationType.Silu,torch.bfloat16,torch.float4_e2m1fn_x2,torch.float4_e2m1fn_x2,QuantType.per_1x32,1,0,32,0,80.2832,flydsl_moe1_afp4_wfp4_bf16_t32x128x256_w2,0.0%,48.3116,flydsl_moe2_afp4_wfp4_bf16_t32x128x256_atomic,6.3%,128.5948,0,0,0,24.66,24658.69,
gfx950,256,8,7168,3072,48,6,ActivationType.Silu,torch.bfloat16,torch.float4_e2m1fn_x2,torch.float4_e2m1fn_x2,QuantType.per_1x32,1,0,32,0,115.1082,flydsl_moe1_afp4_wfp4_bf16_t32x128x256_w4,0.0%,66.2366,flydsl_moe2_afp4_wfp4_bf16_t32x128x256_reduce,3.2%,181.3448,0,0,0,34.97,17486.39,
gfx950,256,16,7168,3072,48,6,ActivationType.Silu,torch.bfloat16,torch.float4_e2m1fn_x2,torch.float4_e2m1fn_x2,QuantType.per_1x32,1,0,32,0,165.6874,flydsl_moe1_afp4_wfp4_bf16_t32x64x256_w3,0.0%,91.5135,flydsl_moe2_afp4_wfp4_bf16_t32x256x256_reduce_persist,3.2%,257.2009,0,0,0,49.31,12329.81,
gfx950,256,32,7168,3072,48,6,ActivationType.Silu,torch.bfloat16,torch.float4_e2m1fn_x2,torch.float4_e2m1fn_x2,QuantType.per_1x32,1,0,32,0,177.6146,flydsl_moe1_afp4_wfp4_bf16_t32x64x256_w3,0.0%,100.6083,flydsl_moe2_afp4_wfp4_bf16_t32x128x256_reduce,3.2%,278.2229,0,0,0,91.18,11399.43,
gfx950,256,64,7168,3072,48,6,ActivationType.Silu,torch.bfloat16,torch.float4_e2m1fn_x2,torch.float4_e2m1fn_x2,QuantType.per_1x32,1,0,32,0,179.8753,flydsl_moe1_afp4_wfp4_bf16_t32x64x256_w3,0.0%,101.3422,flydsl_moe2_afp4_wfp4_bf16_t32x128x256_atomic,6.6%,281.2175,0,0,0,180.41,11280.49,
gfx950,256,128,7168,3072,48,6,ActivationType.Silu,torch.bfloat16,torch.float4_e2m1fn_x2,torch.float4_e2m1fn_x2,QuantType.per_1x32,1,0,32,0,177.3985,flydsl_moe1_afp4_wfp4_bf16_t32x64x256_w3_fp4,0.8%,103.3608,flydsl_moe2_afp4_wfp4_bf16_t32x128x256_atomic_bnt2,6.7%,280.7593,0,0,0,361.41,11303.8,
gfx950,256,256,7168,3072,48,6,ActivationType.Silu,torch.bfloat16,torch.float4_e2m1fn_x2,torch.float4_e2m1fn_x2,QuantType.per_1x32,1,0,64,0,190.0777,flydsl_moe1_afp4_wfp4_bf16_t64x64x256_w3,0.0%,108.4004,flydsl_moe2_afp4_wfp4_bf16_t64x128x256_atomic_bnt2,6.8%,298.4781,0,0,0,679.91,10641.98,
gfx950,256,512,7168,3072,48,6,ActivationType.Silu,torch.bfloat16,torch.float4_e2m1fn_x2,torch.float4_e2m1fn_x2,QuantType.per_1x32,1,0,64,0,217.2776,flydsl_moe1_afp4_wfp4_bf16_t64x128x256_w2_bnt0,0.0%,126.6438,flydsl_moe2_afp4_wfp4_bf16_t64x128x256_atomic_bnt2,6.8%,343.9214,0,0,0,1180.14,9251.83,
gfx950,256,1024,7168,3072,48,6,ActivationType.Silu,torch.bfloat16,torch.float4_e2m1fn_x2,torch.float4_e2m1fn_x2,QuantType.per_1x32,1,0,64,0,280.8196,flydsl_moe1_afp4_wfp4_bf16_t64x128x256_w4_bnt0_fp4,0.8%,182.4229,flydsl_moe2_afp4_wfp4_bf16_t64x128x256_atomic,6.8%,463.2425,0,0,0,1752.32,6892.53,
gfx950,256,2048,7168,3072,48,6,ActivationType.Silu,torch.bfloat16,torch.float4_e2m1fn_x2,torch.float4_e2m1fn_x2,QuantType.per_1x32,1,0,128,0,435.9229,moe_ck2stages_gemm1_256x128x128x128_1x4_MulABScaleShuffled_v3_Nswizzle0_Quant3_MulRoutedWeight0_silu_FP4X2_FP4X2_B16,0.0%,282.157,flydsl_moe2_afp4_wfp4_bf16_t64x256x256_atomic_persist_sbm128,6.8%,718.0799,0,0,0,2260.89,4477.13,
gfx950,256,4096,7168,3072,48,6,ActivationType.Silu,torch.bfloat16,torch.float4_e2m1fn_x2,torch.float4_e2m1fn_x2,QuantType.per_1x32,1,0,128,0,712.7946,moe_ck2stages_gemm1_256x128x128x128_1x4_MulABScaleShuffled_v3_Nswizzle0_Quant3_MulRoutedWeight0_silu_FP4X2_FP4X2_B16,0.0%,475.2101,flydsl_moe2_afp4_wfp4_bf16_t128x256x128_reduce,3.1%,1188.0047,0,0,0,2733.15,2743.23,
gfx950,256,8192,7168,3072,48,6,ActivationType.Silu,torch.bfloat16,torch.float4_e2m1fn_x2,torch.float4_e2m1fn_x2,QuantType.per_1x32,1,0,128,0,1283.1274999999998,moe_ck2stages_gemm1_256x128x128x128_1x4_MulABScaleShuffled_v3_Nswizzle0_Quant3_MulRoutedWeight0_silu_FP4X2_FP4X2_B16,0.0%,959.7318,flydsl_moe2_afp4_wfp4_bf16_t128x128x128_atomic,6.8%,2242.8593,0,0,0,2895.41,1492.32,
gfx950,256,16384,7168,3072,48,6,ActivationType.Silu,torch.bfloat16,torch.float4_e2m1fn_x2,torch.float4_e2m1fn_x2,QuantType.per_1x32,1,0,128,0,2441.7895000000003,moe_ck2stages_gemm1_256x128x128x128_1x4_MulABScaleShuffled_v3_Nswizzle0_Quant3_MulRoutedWeight0_silu_FP4X2_FP4X2_B16,0.0%,1810.8057,flydsl_moe2_afp4_wfp4_bf16_t128x128x128_atomic_persist,6.8%,4252.5952,0,0,0,3054.13,828.49,
gfx950,256,1,4096,256,256,6,ActivationType.Silu,torch.bfloat16,torch.float4_e2m1fn_x2,torch.float4_e2m1fn_x2,QuantType.per_1x32,1,0,32,0,11.6506,flydsl_moe1_afp4_wfp4_bf16_t32x64x256_w3_kb4_bnt0_go_fp4,0.7%,6.128,moe_ck2stages_gemm2_256x32x128x128_1x4_MulABScaleExpertWeightShuffled_v3_Nswizzle0_Quant3_MulRoutedWeight1_FP4X2_FP4X2_B16,0.1%,17.7786,0,0,0,2.12,45297.08,
gfx950,256,2,4096,256,256,6,ActivationType.Silu,torch.bfloat16,torch.float4_e2m1fn_x2,torch.float4_e2m1fn_x2,QuantType.per_1x32,1,0,32,0,13.4376,flydsl_moe1_afp4_wfp4_bf16_t32x32x256_w3_kb4_go_xcd4_fp4,3.2%,6.6978,moe_ck2stages_gemm2_256x32x128x128_1x4_MulABScaleExpertWeightShuffled_v3_Nswizzle0_Quant3_MulRoutedWeight1_FP4X2_FP4X2_B16,0.2%,20.1354,0,0,0,3.75,39995.78,
gfx950,256,4,4096,256,256,6,ActivationType.Silu,torch.bfloat16,torch.float4_e2m1fn_x2,torch.float4_e2m1fn_x2,QuantType.per_1x32,1,0,32,0,17.4206,flydsl_moe1_afp4_wfp4_bf16_t32x64x256_w2_bnt0,0.0%,8.1593,moe_ck2stages_gemm2_256x32x128x128_1x4_MulABScaleExpertWeightShuffled_v3_Nswizzle0_Quant3_MulRoutedWeight1_FP4X2_FP4X2_B16,0.2%,25.5799,0,0,0,5.9,31483.92,
gfx950,256,8,4096,256,256,6,ActivationType.Silu,torch.bfloat16,torch.float4_e2m1fn_x2,torch.float4_e2m1fn_x2,QuantType.per_1x32,1,0,32,0,19.3555,flydsl_moe1_afp4_wfp4_bf16_t32x64x256_w4_bnt0,0.0%,10.8898,flydsl_moe2_afp4_wfp4_bf16_t32x128x256_reduce,0.0%,30.2453,0,0,0,9.98,26629.09,
gfx950,256,16,4096,256,256,6,ActivationType.Silu,torch.bfloat16,torch.float4_e2m1fn_x2,torch.float4_e2m1fn_x2,QuantType.per_1x32,1,0,32,0,23.0838,flydsl_moe1_afp4_wfp4_bf16_t32x32x256_w4_bnt0,0.0%,13.9036,flydsl_moe2_afp4_wfp4_bf16_t32x256x256_reduce_bnt2,0.0%,36.9874,0,0,0,16.33,21777.77,
gfx950,256,32,4096,256,256,6,ActivationType.Silu,torch.bfloat16,torch.float4_e2m1fn_x2,torch.float4_e2m1fn_x2,QuantType.per_1x32,1,0,32,0,34.726,moe_ck2stages_gemm1_64x32x32x128_1x1_MulABScaleShuffled_v3_Nswizzle0_Quant3_MulRoutedWeight0_silu_FP4X2_FP4X2_B16,0.0%,19.2715,flydsl_moe2_afp4_wfp4_bf16_t32x256x256_reduce,0.0%,53.9975,0,0,0,22.37,14921.05,
gfx950,256,64,4096,256,256,6,ActivationType.Silu,torch.bfloat16,torch.float4_e2m1fn_x2,torch.float4_e2m1fn_x2,QuantType.per_1x32,1,0,32,0,41.464,flydsl_moe1_afp4_wfp4_bf16_t32x128x256_w2_fp4,0.9%,27.5963,flydsl_moe2_afp4_wfp4_bf16_t32x256x256_reduce_bnt2,0.0%,69.0603,0,0,0,34.98,11672.3,
gfx950,256,128,4096,256,256,6,ActivationType.Silu,torch.bfloat16,torch.float4_e2m1fn_x2,torch.float4_e2m1fn_x2,QuantType.per_1x32,1,0,32,0,51.5009,flydsl_moe1_afp4_wfp4_bf16_t32x64x256_w4,0.0%,30.8505,flydsl_moe2_afp4_wfp4_bf16_t16x256x256_atomic_bnt2_persist_sbm32,0.1%,82.3514,0,0,0,58.67,9798.0,
gfx950,256,256,4096,256,256,6,ActivationType.Silu,torch.bfloat16,torch.float4_e2m1fn_x2,torch.float4_e2m1fn_x2,QuantType.per_1x32,1,0,32,0,54.1043,flydsl_moe1_afp4_wfp4_bf16_t32x32x256_w4,0.0%,33.0376,flydsl_moe2_afp4_wfp4_bf16_t16x256x256_atomic_persist_sbm32,0.1%,87.1419,0,0,0,110.9,9277.42,
gfx950,256,512,4096,256,256,6,ActivationType.Silu,torch.bfloat16,torch.float4_e2m1fn_x2,torch.float4_e2m1fn_x2,QuantType.per_1x32,1,0,32,0,55.5194,flydsl_moe1_afp4_wfp4_bf16_t32x32x256_w4,0.0%,37.6245,flydsl_moe2_afp4_wfp4_bf16_t16x128x256_atomic_bnt2_sbm32,0.1%,93.1439,0,0,0,207.5,8713.38,
gfx950,256,1024,4096,256,256,6,ActivationType.Silu,torch.bfloat16,torch.float4_e2m1fn_x2,torch.float4_e2m1fn_x2,QuantType.per_1x32,1,0,64,0,61.0865,flydsl_moe1_afp4_wfp4_bf16_t64x64x256_w4,0.0%,48.0913,flydsl_moe2_afp4_wfp4_bf16_t32x128x256_reduce_persist_sbm64,0.0%,109.1778,0,0,0,354.05,7491.35,
gfx950,256,2048,4096,256,256,6,ActivationType.Silu,torch.bfloat16,torch.float4_e2m1fn_x2,torch.float4_e2m1fn_x2,QuantType.per_1x32,1,0,64,0,73.924,flydsl_moe1_afp4_wfp4_bf16_t64x64x256_w4,0.0%,68.9167,flydsl_moe2_afp4_wfp4_bf16_t64x256x256_reduce_bnt2,0.0%,142.8407,0,0,0,541.23,5813.97,
gfx950,256,4096,4096,256,256,6,ActivationType.Silu,torch.bfloat16,torch.float4_e2m1fn_x2,torch.float4_e2m1fn_x2,QuantType.per_1x32,1,0,64,0,83.4494,flydsl_moe1_afp4_wfp4_bf16_t64x128x256_w4_bnt0_xcd4,0.0%,119.064,flydsl_moe2_afp4_wfp4_bf16_t64x256x256_reduce_xcd4_persist,0.0%,202.5134,0,0,0,763.5,4225.09,
gfx950,256,8192,4096,256,256,6,ActivationType.Silu,torch.bfloat16,torch.float4_e2m1fn_x2,torch.float4_e2m1fn_x2,QuantType.per_1x32,1,0,64,0,122.5649,flydsl_moe1_afp4_wfp4_bf16_t64x128x256_w3_bnt0_xcd4,0.0%,214.2699,flydsl_moe2_afp4_wfp4_bf16_t64x256x256_reduce_bnt2,0.0%,336.8348,0,0,0,918.07,2689.66,
gfx950,256,16384,4096,256,256,6,ActivationType.Silu,torch.bfloat16,torch.float4_e2m1fn_x2,torch.float4_e2m1fn_x2,QuantType.per_1x32,1,0,128,0,199.8045,flydsl_moe1_afp4_wfp4_bf16_t128x128x256_bnt0_xcd4,0.0%,409.6242,flydsl_moe2_afp4_wfp4_bf16_t64x256x256_reduce_xcd4_persist_sbm128,0.0%,609.4287,0,0,0,1014.84,1651.76,
gfx950,256,32768,4096,256,256,6,ActivationType.Silu,torch.bfloat16,torch.float4_e2m1fn_x2,torch.float4_e2m1fn_x2,QuantType.per_1x32,1,0,64,0,340.0523,flydsl_moe1_afp4_wfp4_bf16_t64x128x256_w4_bnt0_xcd4,0.0%,797.6109,flydsl_moe2_afp4_wfp4_bf16_t64x256x256_reduce_xcd4,0.0%,1137.6632,0,0,0,1087.27,1061.79,
gfx950,256,131072,4096,256,256,6,ActivationType.Silu,torch.bfloat16,torch.float4_e2m1fn_x2,torch.float4_e2m1fn_x2,QuantType.per_1x32,1,0,128,0,1215.9592,flydsl_moe1_afp4_wfp4_bf16_t128x128x256_bnt0_xcd4,0.0%,3158.0158,flydsl_moe2_afp4_wfp4_bf16_t64x256x256_reduce_xcd4_persist_sbm128,0.0%,4373.975,0,0,0,1131.19,552.34,
gfx950,256,1,7168,512,384,6,ActivationType.Silu,torch.bfloat16,torch.float4_e2m1fn_x2,torch.float4_e2m1fn_x2,QuantType.per_1x32,1,0,32,0,24.5232,moe_ck2stages_gemm1_64x32x32x128_1x1_MulABScaleShuffled_v3_Nswizzle0_Quant3_MulRoutedWeight0_silu_FP4X2_FP4X2_B16,0.0,7.8113,moe_ck2stages_gemm2_256x32x128x128_1x4_MulABScaleExpertWeightShuffled_v3_Nswizzle0_Quant3_MulRoutedWeight1_FP4X2_FP4X2_B16,0.022,32.3345,0,0,0,0.0,0.0,flydsl_fallback
gfx950,256,2,7168,512,384,6,ActivationType.Silu,torch.bfloat16,torch.float4_e2m1fn_x2,torch.float4_e2m1fn_x2,QuantType.per_1x32,1,0,32,0,25.7206,moe_ck2stages_gemm1_64x32x32x128_1x1_MulABScaleShuffled_v3_Nswizzle0_Quant3_MulRoutedWeight0_silu_FP4X2_FP4X2_B16,0.0,10.33,moe_ck2stages_gemm2_256x32x128x128_1x4_MulABScaleExpertWeightShuffled_v3_Nswizzle0_Quant3_MulRoutedWeight1_FP4X2_FP4X2_B16,0.0249,36.0506,0,0,0,0.0,0.0,flydsl_fallback
gfx950,256,4,7168,512,384,6,ActivationType.Silu,torch.bfloat16,torch.float4_e2m1fn_x2,torch.float4_e2m1fn_x2,QuantType.per_1x32,1,0,32,0,30.3699,moe_ck2stages_gemm1_64x32x32x128_1x1_MulABScaleShuffled_v3_Nswizzle0_Quant3_MulRoutedWeight0_silu_FP4X2_FP4X2_B16,0.0,18.4629,moe_ck2stages_gemm2_256x32x128x128_1x4_MulABScaleExpertWeightShuffled_v3_Nswizzle0_Quant3_MulRoutedWeight1_FP4X2_FP4X2_B16,0.0252,48.8328,0,0,0,0.0,0.0,flydsl_fallback
gfx950,256,8,7168,512,384,6,ActivationType.Silu,torch.bfloat16,torch.float4_e2m1fn_x2,torch.float4_e2m1fn_x2,QuantType.per_1x32,1,0,32,0,38.55,moe_ck2stages_gemm1_64x32x32x128_1x1_MulABScaleShuffled_v3_Nswizzle0_Quant3_MulRoutedWeight0_silu_FP4X2_FP4X2_B16,0.0,25.9927,moe_ck2stages_gemm2_256x32x128x128_1x4_MulABScaleExpertWeightShuffled_v3_Nswizzle0_Quant3_MulRoutedWeight1_FP4X2_FP4X2_B16,0.0243,64.5427,0,0,0,0.0,0.0,flydsl_fallback
gfx950,256,16,7168,512,384,6,ActivationType.Silu,torch.bfloat16,torch.float4_e2m1fn_x2,torch.float4_e2m1fn_x2,QuantType.per_1x32,1,0,32,0,65.7599,moe_ck2stages_gemm1_64x32x32x128_1x1_MulABScaleShuffled_v3_Nswizzle0_Quant3_MulRoutedWeight0_silu_FP4X2_FP4X2_B16,0.0,38.1406,moe_ck2stages_gemm2_256x32x128x128_1x4_MulABScaleExpertWeightShuffled_v3_Nswizzle0_Quant3_MulRoutedWeight1_FP4X2_FP4X2_B16,0.0243,103.9005,0,0,0,0.0,0.0,flydsl_fallback
gfx950,256,32,7168,512,384,6,ActivationType.Silu,torch.bfloat16,torch.float4_e2m1fn_x2,torch.float4_e2m1fn_x2,QuantType.per_1x32,1,0,32,0,114.3211,moe_ck2stages_gemm1_64x32x32x128_1x1_MulABScaleShuffled_v3_Nswizzle0_Quant3_MulRoutedWeight0_silu_FP4X2_FP4X2_B16,0.0,60.7029,moe_ck2stages_gemm2_256x32x128x128_1x4_MulABScaleExpertWeightShuffled_v3_Nswizzle0_Quant3_MulRoutedWeight1_FP4X2_FP4X2_B16,0.0246,175.024,0,0,0,0.0,0.0,flydsl_fallback
gfx950,256,64,7168,512,384,6,ActivationType.Silu,torch.bfloat16,torch.float4_e2m1fn_x2,torch.float4_e2m1fn_x2,QuantType.per_1x32,1,0,32,0,165.3811,moe_ck2stages_gemm1_64x32x32x128_1x1_MulABScaleShuffled_v3_Nswizzle0_Quant3_MulRoutedWeight0_silu_FP4X2_FP4X2_B16,0.0,87.1815,moe_ck2stages_gemm2_256x32x128x128_1x4_MulABScaleExpertWeightShuffled_v3_Nswizzle0_Quant3_MulRoutedWeight1_FP4X2_FP4X2_B16,0.025,252.5626,0,0,0,0.0,0.0,flydsl_fallback
gfx950,256,128,7168,512,384,6,ActivationType.Silu,torch.bfloat16,torch.float4_e2m1fn_x2,torch.float4_e2m1fn_x2,QuantType.per_1x32,1,0,32,0,232.8184,moe_ck2stages_gemm1_64x32x32x128_1x1_MulABScaleShuffled_v3_Nswizzle0_Quant3_MulRoutedWeight0_silu_FP4X2_FP4X2_B16,0.0,115.4732,moe_ck2stages_gemm2_256x32x128x128_1x4_MulABScaleExpertWeightShuffled_v3_Nswizzle0_Quant3_MulRoutedWeight1_FP4X2_FP4X2_B16,0.0244,348.2916,0,0,0,0.0,0.0,flydsl_fallback
gfx950,256,256,7168,512,384,6,ActivationType.Silu,torch.bfloat16,torch.float4_e2m1fn_x2,torch.float4_e2m1fn_x2,QuantType.per_1x32,1,0,32,0,257.071,moe_ck2stages_gemm1_256x32x128x128_1x4_MulABScaleShuffled_v3_Nswizzle0_Quant3_MulRoutedWeight0_silu_FP4X2_FP4X2_B16,0.0,133.3462,moe_ck2stages_gemm2_256x32x128x128_1x4_MulABScaleExpertWeightShuffled_v3_Nswizzle0_Quant3_MulRoutedWeight1_FP4X2_FP4X2_B16,0.024,390.4172,0,0,0,0.0,0.0,flydsl_fallback
gfx950,256,512,7168,512,384,6,ActivationType.Silu,torch.bfloat16,torch.float4_e2m1fn_x2,torch.float4_e2m1fn_x2,QuantType.per_1x32,1,0,32,0,262.6957,moe_ck2stages_gemm1_64x32x32x128_1x1_MulABScaleShuffled_v3_Nswizzle0_Quant3_MulRoutedWeight0_silu_FP4X2_FP4X2_B16,0.0,143.725,moe_ck2stages_gemm2_256x32x128x128_1x4_MulABScaleExpertWeightShuffled_v3_Nswizzle0_Quant3_MulRoutedWeight1_FP4X2_FP4X2_B16,0.0235,406.4207,0,0,0,0.0,0.0,flydsl_fallback
gfx950,256,1024,7168,512,384,6,ActivationType.Silu,torch.bfloat16,torch.float4_e2m1fn_x2,torch.float4_e2m1fn_x2,QuantType.per_1x32,1,0,32,0,269.9016,moe_ck2stages_gemm1_256x32x128x128_1x4_MulABScaleShuffled_v3_Nswizzle0_Quant3_MulRoutedWeight0_silu_FP4X2_FP4X2_B16,0.0,171.5766,moe_ck2stages_gemm2_256x32x128x128_1x4_MulABScaleExpertWeightShuffled_v3_Nswizzle0_Quant3_MulRoutedWeight1_FP4X2_FP4X2_B16,0.0239,441.4782,0,0,0,0.0,0.0,flydsl_fallback
gfx950,256,2048,7168,512,384,6,ActivationType.Silu,torch.bfloat16,torch.float4_e2m1fn_x2,torch.float4_e2m1fn_x2,QuantType.per_1x32,1,0,64,0,281.6068,moe_ck2stages_gemm1_256x64x128x128_1x4_MulABScaleShuffled_v3_Nswizzle0_Quant3_MulRoutedWeight0_silu_FP4X2_FP4X2_B16,0.0,301.5313,moe_ck2stages_gemm2_64x64x128x128_1x1_MulABScaleExpertWeightShuffled_v3_Nswizzle0_Quant3_MulRoutedWeight1_FP4X2_FP4X2_B16,0.0239,583.1381,0,0,0,0.0,0.0,flydsl_fallback
gfx950,256,4096,7168,512,384,6,ActivationType.Silu,torch.bfloat16,torch.float4_e2m1fn_x2,torch.float4_e2m1fn_x2,QuantType.per_1x32,1,0,64,0,378.5865,moe_ck2stages_gemm1_256x64x128x128_1x4_MulABScaleShuffled_v3_Nswizzle0_Quant3_MulRoutedWeight0_silu_FP4X2_FP4X2_B16,0.0,433.6544,moe_ck2stages_gemm2_64x64x128x128_1x1_MulABScaleExpertWeightShuffled_v3_Nswizzle0_Quant3_MulRoutedWeight1_FP4X2_FP4X2_B16,0.0237,812.2409,0,0,0,0.0,0.0,flydsl_fallback
gfx950,256,8192,7168,512,384,6,ActivationType.Silu,torch.bfloat16,torch.float4_e2m1fn_x2,torch.float4_e2m1fn_x2,QuantType.per_1x32,1,0,64,0,561.9923,moe_ck2stages_gemm1_256x64x128x128_1x4_MulABScaleShuffled_v3_Nswizzle0_Quant3_MulRoutedWeight0_silu_FP4X2_FP4X2_B16,0.0,777.4596,moe_ck2stages_gemm2_64x64x128x128_1x1_MulABScaleExpertWeightShuffled_v3_Nswizzle0_Quant3_MulRoutedWeight1_FP4X2_FP4X2_B16,0.0238,1339.4519,0,0,0,0.0,0.0,flydsl_fallback
gfx950,256,16384,7168,512,384,6,ActivationType.Silu,torch.bfloat16,torch.float4_e2m1fn_x2,torch.float4_e2m1fn_x2,QuantType.per_1x32,1,0,64,0,710.2322,moe_ck2stages_gemm1_256x64x128x128_1x4_MulABScaleShuffled_v3_Nswizzle0_Quant3_MulRoutedWeight0_silu_FP4X2_FP4X2_B16,0.0,1486.4166,moe_ck2stages_gemm2_64x64x128x128_1x1_MulABScaleExpertWeightShuffled_v3_Nswizzle0_Quant3_MulRoutedWeight1_FP4X2_FP4X2_B16,0.0238,2196.6488,0,0,0,0.0,0.0,flydsl_fallback
gfx950,256,32768,7168,512,384,6,ActivationType.Silu,torch.bfloat16,torch.float4_e2m1fn_x2,torch.float4_e2m1fn_x2,QuantType.per_1x32,1,0,64,0,1190.5332,moe_ck2stages_gemm1_256x64x128x128_1x4_MulABScaleShuffled_v3_Nswizzle0_Quant3_MulRoutedWeight0_silu_FP4X2_FP4X2_B16,0.0,2902.1181,moe_ck2stages_gemm2_64x64x128x128_1x1_MulABScaleExpertWeightShuffled_v3_Nswizzle0_Quant3_MulRoutedWeight1_FP4X2_FP4X2_B16,0.0238,4092.6513,0,0,0,0.0,0.0,flydsl_fallback
gfx950,256,1,7168,768,384,6,ActivationType.Silu,torch.bfloat16,torch.float4_e2m1fn_x2,torch.float4_e2m1fn_x2,QuantType.per_1x32,1,0,32,0,24.4669,moe_ck2stages_gemm1_64x32x32x128_1x1_MulABScaleShuffled_v3_Nswizzle0_Quant3_MulRoutedWeight0_silu_FP4X2_FP4X2_B16,0.0,7.7292,moe_ck2stages_gemm2_256x32x128x128_1x4_MulABScaleExpertWeightShuffled_v3_Nswizzle0_Quant3_MulRoutedWeight1_FP4X2_FP4X2_B16,0.0286,32.1961,0,0,0,0.0,0.0,flydsl_fallback
gfx950,256,2,7168,768,384,6,ActivationType.Silu,torch.bfloat16,torch.float4_e2m1fn_x2,torch.float4_e2m1fn_x2,QuantType.per_1x32,1,0,32,0,27.4036,moe_ck2stages_gemm1_64x32x32x128_1x1_MulABScaleShuffled_v3_Nswizzle0_Quant3_MulRoutedWeight0_silu_FP4X2_FP4X2_B16,0.0,11.899,moe_ck2stages_gemm2_256x32x128x128_1x4_MulABScaleExpertWeightShuffled_v3_Nswizzle0_Quant3_MulRoutedWeight1_FP4X2_FP4X2_B16,0.0322,39.3026,0,0,0,0.0,0.0,flydsl_fallback
gfx950,256,4,7168,768,384,6,ActivationType.Silu,torch.bfloat16,torch.float4_e2m1fn_x2,torch.float4_e2m1fn_x2,QuantType.per_1x32,1,0,128,0,47.3614,moe_ck2stages_gemm1_256x128x128x128_1x4_MulABScaleShuffled_v3_Nswizzle0_Quant3_MulRoutedWeight0_silu_FP4X2_FP4X2_B16,0.0,29.8374,moe_ck2stages_gemm2_256x128x128x128_1x4_MulABScaleExpertWeightShuffled_v3_Nswizzle0_Quant3_MulRoutedWeight1_FP4X2_FP4X2_B16,0.0319,77.1988,0,0,0,0.0,0.0,flydsl_fallback
gfx950,256,8,7168,768,384,6,ActivationType.Silu,torch.bfloat16,torch.float4_e2m1fn_x2,torch.float4_e2m1fn_x2,QuantType.per_1x32,1,0,32,0,55.1006,moe_ck2stages_gemm1_64x32x32x128_1x1_MulABScaleShuffled_v3_Nswizzle0_Quant3_MulRoutedWeight0_silu_FP4X2_FP4X2_B16,0.0,31.4839,moe_ck2stages_gemm2_256x32x128x128_1x4_MulABScaleExpertWeightShuffled_v3_Nswizzle0_Quant3_MulRoutedWeight1_FP4X2_FP4X2_B16,0.032,86.5845,0,0,0,0.0,0.0,flydsl_fallback
gfx950,256,16,7168,768,384,6,ActivationType.Silu,torch.bfloat16,torch.float4_e2m1fn_x2,torch.float4_e2m1fn_x2,QuantType.per_1x32,1,0,32,0,104.3622,moe_ck2stages_gemm1_64x32x32x128_1x1_MulABScaleShuffled_v3_Nswizzle0_Quant3_MulRoutedWeight0_silu_FP4X2_FP4X2_B16,0.0,50.9194,moe_ck2stages_gemm2_256x32x128x128_1x4_MulABScaleExpertWeightShuffled_v3_Nswizzle0_Quant3_MulRoutedWeight1_FP4X2_FP4X2_B16,0.0335,155.2816,0,0,0,0.0,0.0,flydsl_fallback
gfx950,256,32,7168,768,384,6,ActivationType.Silu,torch.bfloat16,torch.float4_e2m1fn_x2,torch.float4_e2m1fn_x2,QuantType.per_1x32,1,0,32,0,163.12,moe_ck2stages_gemm1_64x32x32x128_1x1_MulABScaleShuffled_v3_Nswizzle0_Quant3_MulRoutedWeight0_silu_FP4X2_FP4X2_B16,0.0,82.1993,moe_ck2stages_gemm2_256x32x128x128_1x4_MulABScaleExpertWeightShuffled_v3_Nswizzle0_Quant3_MulRoutedWeight1_FP4X2_FP4X2_B16,0.0335,245.3193,0,0,0,0.0,0.0,flydsl_fallback
gfx950,256,64,7168,768,384,6,ActivationType.Silu,torch.bfloat16,torch.float4_e2m1fn_x2,torch.float4_e2m1fn_x2,QuantType.per_1x32,1,0,32,0,243.9243,moe_ck2stages_gemm1_64x32x32x128_1x1_MulABScaleShuffled_v3_Nswizzle0_Quant3_MulRoutedWeight0_silu_FP4X2_FP4X2_B16,0.0,121.5862,moe_ck2stages_gemm2_256x32x128x128_1x4_MulABScaleExpertWeightShuffled_v3_Nswizzle0_Quant3_MulRoutedWeight1_FP4X2_FP4X2_B16,0.0335,365.5105,0,0,0,0.0,0.0,flydsl_fallback
gfx950,256,128,7168,768,384,6,ActivationType.Silu,torch.bfloat16,torch.float4_e2m1fn_x2,torch.float4_e2m1fn_x2,QuantType.per_1x32,1,0,32,0,319.1475,moe_ck2stages_gemm1_64x32x32x128_1x1_MulABScaleShuffled_v3_Nswizzle0_Quant3_MulRoutedWeight0_silu_FP4X2_FP4X2_B16,0.0,167.7754,moe_ck2stages_gemm2_256x32x128x128_1x4_MulABScaleExpertWeightShuffled_v3_Nswizzle0_Quant3_MulRoutedWeight1_FP4X2_FP4X2_B16,0.033,486.9229,0,0,0,0.0,0.0,flydsl_fallback
gfx950,256,256,7168,768,384,6,ActivationType.Silu,torch.bfloat16,torch.float4_e2m1fn_x2,torch.float4_e2m1fn_x2,QuantType.per_1x32,1,0,32,0,377.0359,moe_ck2stages_gemm1_256x32x128x128_1x4_MulABScaleShuffled_v3_Nswizzle0_Quant3_MulRoutedWeight0_silu_FP4X2_FP4X2_B16,0.0,195.4469,moe_ck2stages_gemm2_256x32x128x128_1x4_MulABScaleExpertWeightShuffled_v3_Nswizzle0_Quant3_MulRoutedWeight1_FP4X2_FP4X2_B16,0.0334,572.4828,0,0,0,0.0,0.0,flydsl_fallback
gfx950,256,512,7168,768,384,6,ActivationType.Silu,torch.bfloat16,torch.float4_e2m1fn_x2,torch.float4_e2m1fn_x2,QuantType.per_1x32,1,0,64,0,380.7214,moe_ck2stages_gemm1_256x64x128x128_1x4_MulABScaleShuffled_v3_Nswizzle0_Quant3_MulRoutedWeight0_silu_FP4X2_FP4X2_B16,0.0,198.6912,moe_ck2stages_gemm2_256x64x128x128_1x4_MulABScaleExpertWeightShuffled_v3_Nswizzle0_Quant3_MulRoutedWeight1_FP4X2_FP4X2_B16,0.0335,579.4126,0,0,0,0.0,0.0,flydsl_fallback
gfx950,256,1024,7168,768,384,6,ActivationType.Silu,torch.bfloat16,torch.float4_e2m1fn_x2,torch.float4_e2m1fn_x2,QuantType.per_1x32,1,0,32,0,389.8625,moe_ck2stages_gemm1_256x32x128x128_1x4_MulABScaleShuffled_v3_Nswizzle0_Quant3_MulRoutedWeight0_silu_FP4X2_FP4X2_B16,0.0,228.8375,moe_ck2stages_gemm2_256x32x128x128_1x4_MulABScaleExpertWeightShuffled_v3_Nswizzle0_Quant3_MulRoutedWeight1_FP4X2_FP4X2_B16,0.0335,618.7,0,0,0,0.0,0.0,flydsl_fallback
gfx950,256,2048,7168,768,384,6,ActivationType.Silu,torch.bfloat16,torch.float4_e2m1fn_x2,torch.float4_e2m1fn_x2,QuantType.per_1x32,1,0,64,0,407.1423,moe_ck2stages_gemm1_256x64x128x128_1x4_MulABScaleShuffled_v3_Nswizzle0_Quant3_MulRoutedWeight0_silu_FP4X2_FP4X2_B16,0.0,309.9849,moe_ck2stages_gemm2_256x64x128x128_1x4_MulABScaleExpertWeightShuffled_v3_Nswizzle0_Quant3_MulRoutedWeight1_FP4X2_FP4X2_B16,0.0335,717.1272,0,0,0,0.0,0.0,flydsl_fallback
gfx950,256,4096,7168,768,384,6,ActivationType.Silu,torch.bfloat16,torch.float4_e2m1fn_x2,torch.float4_e2m1fn_x2,QuantType.per_1x32,1,0,128,0,483.6612,moe_ck2stages_gemm1_256x128x128x128_1x4_MulABScaleShuffled_v3_Nswizzle0_Quant3_MulRoutedWeight0_silu_FP4X2_FP4X2_B16,0.0,600.2471,moe_ck2stages_gemm2_256x128x128x128_1x4_MulABScaleExpertWeightShuffled_v3_Nswizzle0_Quant3_MulRoutedWeight1_FP4X2_FP4X2_B16,0.0336,1083.9083,0,0,0,0.0,0.0,flydsl_fallback
gfx950,256,8192,7168,768,384,6,ActivationType.Silu,torch.bfloat16,torch.float4_e2m1fn_x2,torch.float4_e2m1fn_x2,QuantType.per_1x32,1,0,128,0,667.9004000000001,moe_ck2stages_gemm1_256x128x128x128_1x4_MulABScaleShuffled_v3_Nswizzle0_Quant3_MulRoutedWeight0_silu_FP4X2_FP4X2_B16,0.0,1161.9814,moe_ck2stages_gemm2_256x128x128x128_1x4_MulABScaleExpertWeightShuffled_v3_Nswizzle0_Quant3_MulRoutedWeight1_FP4X2_FP4X2_B16,0.0337,1829.8818,0,0,0,0.0,0.0,flydsl_fallback
gfx950,256,16384,7168,768,384,6,ActivationType.Silu,torch.bfloat16,torch.float4_e2m1fn_x2,torch.float4_e2m1fn_x2,QuantType.per_1x32,1,0,128,0,1173.7923,moe_ck2stages_gemm1_256x128x128x128_1x4_MulABScaleShuffled_v3_Nswizzle0_Quant3_MulRoutedWeight0_silu_FP4X2_FP4X2_B16,0.0,2287.1719,moe_ck2stages_gemm2_256x128x128x128_1x4_MulABScaleExpertWeightShuffled_v3_Nswizzle0_Quant3_MulRoutedWeight1_FP4X2_FP4X2_B16,0.0336,3460.9642,0,0,0,0.0,0.0,flydsl_fallback
gfx950,256,32768,7168,768,384,6,ActivationType.Silu,torch.bfloat16,torch.float4_e2m1fn_x2,torch.float4_e2m1fn_x2,QuantType.per_1x32,1,0,128,0,2129.0972,moe_ck2stages_gemm1_256x128x128x128_1x4_MulABScaleShuffled_v3_Nswizzle0_Quant3_MulRoutedWeight0_silu_FP4X2_FP4X2_B16,0.0,4569.4198,moe_ck2stages_gemm2_256x128x128x128_1x4_MulABScaleExpertWeightShuffled_v3_Nswizzle0_Quant3_MulRoutedWeight1_FP4X2_FP4X2_B16,0.0336,6698.517,0,0,0,0.0,0.0,flydsl_fallback
gfx950,256,1,7168,1536,384,6,ActivationType.Silu,torch.bfloat16,torch.float4_e2m1fn_x2,torch.float4_e2m1fn_x2,QuantType.per_1x32,1,0,32,0,29.6849,moe_ck2stages_gemm1_256x32x128x128_1x4_MulABScaleShuffled_v3_Nswizzle0_Quant3_MulRoutedWeight0_silu_FP4X2_FP4X2_B16,0.0,9.9427,moe_ck2stages_gemm2_256x32x128x128_1x4_MulABScaleExpertWeightShuffled_v3_Nswizzle0_Quant3_MulRoutedWeight1_FP4X2_FP4X2_B16,0.0543,39.6276,0,0,0,0.0,0.0,flydsl_fallback
gfx950,256,2,7168,1536,384,6,ActivationType.Silu,torch.bfloat16,torch.float4_e2m1fn_x2,torch.float4_e2m1fn_x2,QuantType.per_1x32,1,0,32,0,31.059600000000003,moe_ck2stages_gemm1_64x32x32x128_1x1_MulABScaleShuffled_v3_Nswizzle0_Quant3_MulRoutedWeight0_silu_FP4X2_FP4X2_B16,0.0,18.9659,moe_ck2stages_gemm2_256x32x128x128_1x4_MulABScaleExpertWeightShuffled_v3_Nswizzle0_Quant3_MulRoutedWeight1_FP4X2_FP4X2_B16,0.0535,50.0255,0,0,0,0.0,0.0,flydsl_fallback
gfx950,256,4,7168,1536,384,6,ActivationType.Silu,torch.bfloat16,torch.float4_e2m1fn_x2,torch.float4_e2m1fn_x2,QuantType.per_1x32,1,0,32,0,54.2966,moe_ck2stages_gemm1_64x32x32x128_1x1_MulABScaleShuffled_v3_Nswizzle0_Quant3_MulRoutedWeight0_silu_FP4X2_FP4X2_B16,0.0,31.4201,moe_ck2stages_gemm2_256x32x128x128_1x4_MulABScaleExpertWeightShuffled_v3_Nswizzle0_Quant3_MulRoutedWeight1_FP4X2_FP4X2_B16,0.0526,85.7167,0,0,0,0.0,0.0,flydsl_fallback
gfx950,256,8,7168,1536,384,6,ActivationType.Silu,torch.bfloat16,torch.float4_e2m1fn_x2,torch.float4_e2m1fn_x2,QuantType.per_1x32,1,0,32,0,98.3606,moe_ck2stages_gemm1_64x32x32x128_1x1_MulABScaleShuffled_v3_Nswizzle0_Quant3_MulRoutedWeight0_silu_FP4X2_FP4X2_B16,0.0,53.0932,moe_ck2stages_gemm2_256x32x128x128_1x4_MulABScaleExpertWeightShuffled_v3_Nswizzle0_Quant3_MulRoutedWeight1_FP4X2_FP4X2_B16,0.0511,151.4538,0,0,0,0.0,0.0,flydsl_fallback
gfx950,256,16,7168,1536,384,6,ActivationType.Silu,torch.bfloat16,torch.float4_e2m1fn_x2,torch.float4_e2m1fn_x2,QuantType.per_1x32,1,0,32,0,179.9466,moe_ck2stages_gemm1_64x32x32x128_1x1_MulABScaleShuffled_v3_Nswizzle0_Quant3_MulRoutedWeight0_silu_FP4X2_FP4X2_B16,0.0,91.7487,moe_ck2stages_gemm2_256x32x128x128_1x4_MulABScaleExpertWeightShuffled_v3_Nswizzle0_Quant3_MulRoutedWeight1_FP4X2_FP4X2_B16,0.0521,271.6953,0,0,0,0.0,0.0,flydsl_fallback
gfx950,256,32,7168,1536,384,6,ActivationType.Silu,torch.bfloat16,torch.float4_e2m1fn_x2,torch.float4_e2m1fn_x2,QuantType.per_1x32,1,0,32,0,281.962,moe_ck2stages_gemm1_64x32x32x128_1x1_MulABScaleShuffled_v3_Nswizzle0_Quant3_MulRoutedWeight0_silu_FP4X2_FP4X2_B16,0.0,148.6305,moe_ck2stages_gemm2_256x32x128x128_1x4_MulABScaleExpertWeightShuffled_v3_Nswizzle0_Quant3_MulRoutedWeight1_FP4X2_FP4X2_B16,0.0527,430.5925,0,0,0,0.0,0.0,flydsl_fallback
gfx950,256,64,7168,1536,384,6,ActivationType.Silu,torch.bfloat16,torch.float4_e2m1fn_x2,torch.float4_e2m1fn_x2,QuantType.per_1x32,1,0,32,0,471.5868,moe_ck2stages_gemm1_64x32x32x128_1x1_MulABScaleShuffled_v3_Nswizzle0_Quant3_MulRoutedWeight0_silu_FP4X2_FP4X2_B16,0.0,240.1779,moe_ck2stages_gemm2_256x32x128x128_1x4_MulABScaleExpertWeightShuffled_v3_Nswizzle0_Quant3_MulRoutedWeight1_FP4X2_FP4X2_B16,0.0524,711.7647,0,0,0,0.0,0.0,flydsl_fallback
gfx950,256,128,7168,1536,384,6,ActivationType.Silu,torch.bfloat16,torch.float4_e2m1fn_x2,torch.float4_e2m1fn_x2,QuantType.per_1x32,1,0,32,0,630.4693,moe_ck2stages_gemm1_256x32x128x128_1x4_MulABScaleShuffled_v3_Nswizzle0_Quant3_MulRoutedWeight0_silu_FP4X2_FP4X2_B16,0.0,324.0634,moe_ck2stages_gemm2_256x32x128x128_1x4_MulABScaleExpertWeightShuffled_v3_Nswizzle0_Quant3_MulRoutedWeight1_FP4X2_FP4X2_B16,0.0523,954.5327,0,0,0,0.0,0.0,flydsl_fallback
gfx950,256,1,7168,3072,48,6,ActivationType.Silu,torch.bfloat16,torch.float4_e2m1fn_x2,torch.float4_e2m1fn_x2,QuantType.per_1x32,1,0,32,0,31.2729,moe_ck2stages_gemm1_64x32x32x128_1x1_MulABScaleShuffled_v3_Nswizzle0_Quant3_MulRoutedWeight0_silu_FP4X2_FP4X2_B16,0.0,20.4266,moe_ck2stages_gemm2_256x32x128x128_1x4_MulABScaleExpertWeightShuffled_v3_Nswizzle0_Quant3_MulRoutedWeight1_FP4X2_FP4X2_B16,0.0653,51.6995,0,0,0,0.0,0.0,flydsl_fallback
gfx950,256,2,7168,3072,48,6,ActivationType.Silu,torch.bfloat16,torch.float4_e2m1fn_x2,torch.float4_e2m1fn_x2,QuantType.per_1x32,1,0,32,0,55.6212,moe_ck2stages_gemm1_64x32x32x128_1x1_MulABScaleShuffled_v3_Nswizzle0_Quant3_MulRoutedWeight0_silu_FP4X2_FP4X2_B16,0.0,32.0715,moe_ck2stages_gemm2_256x32x128x128_1x4_MulABScaleExpertWeightShuffled_v3_Nswizzle0_Quant3_MulRoutedWeight1_FP4X2_FP4X2_B16,0.0672,87.6927,0,0,0,0.0,0.0,flydsl_fallback
gfx950,256,4,7168,3072,48,6,ActivationType.Silu,torch.bfloat16,torch.float4_e2m1fn_x2,torch.float4_e2m1fn_x2,QuantType.per_1x32,1,0,32,0,90.9812,moe_ck2stages_gemm1_64x32x32x128_1x1_MulABScaleShuffled_v3_Nswizzle0_Quant3_MulRoutedWeight0_silu_FP4X2_FP4X2_B16,0.0,52.0486,moe_ck2stages_gemm2_256x32x128x128_1x4_MulABScaleExpertWeightShuffled_v3_Nswizzle0_Quant3_MulRoutedWeight1_FP4X2_FP4X2_B16,0.0616,143.0298,0,0,0,0.0,0.0,flydsl_fallback
gfx950,256,8,7168,3072,48,6,ActivationType.Silu,torch.bfloat16,torch.float4_e2m1fn_x2,torch.float4_e2m1fn_x2,QuantType.per_1x32,1,0,32,0,128.861,moe_ck2stages_gemm1_256x32x128x128_1x4_MulABScaleShuffled_v3_Nswizzle0_Quant3_MulRoutedWeight0_silu_FP4X2_FP4X2_B16,0.0,68.8645,moe_ck2stages_gemm2_256x32x128x128_1x4_MulABScaleExpertWeightShuffled_v3_Nswizzle0_Quant3_MulRoutedWeight1_FP4X2_FP4X2_B16,0.0677,197.7255,0,0,0,0.0,0.0,flydsl_fallback
gfx950,256,16,7168,3072,48,6,ActivationType.Silu,torch.bfloat16,torch.float4_e2m1fn_x2,torch.float4_e2m1fn_x2,QuantType.per_1x32,1,0,32,0,187.5425,moe_ck2stages_gemm1_64x32x32x128_1x1_MulABScaleShuffled_v3_Nswizzle0_Quant3_MulRoutedWeight0_silu_FP4X2_FP4X2_B16,0.0,93.7119,moe_ck2stages_gemm2_256x32x128x128_1x4_MulABScaleExpertWeightShuffled_v3_Nswizzle0_Quant3_MulRoutedWeight1_FP4X2_FP4X2_B16,0.0679,281.2544,0,0,0,0.0,0.0,flydsl_fallback
gfx950,256,32,7168,3072,48,6,ActivationType.Silu,torch.bfloat16,torch.float4_e2m1fn_x2,torch.float4_e2m1fn_x2,QuantType.per_1x32,1,0,32,0,199.3423,moe_ck2stages_gemm1_256x32x128x128_1x4_MulABScaleShuffled_v3_Nswizzle0_Quant3_MulRoutedWeight0_silu_FP4X2_FP4X2_B16,0.0,102.4746,moe_ck2stages_gemm2_256x32x128x128_1x4_MulABScaleExpertWeightShuffled_v3_Nswizzle0_Quant3_MulRoutedWeight1_FP4X2_FP4X2_B16,0.0682,301.8169,0,0,0,0.0,0.0,flydsl_fallback
gfx950,256,64,7168,3072,48,6,ActivationType.Silu,torch.bfloat16,torch.float4_e2m1fn_x2,torch.float4_e2m1fn_x2,QuantType.per_1x32,1,0,32,0,203.5696,moe_ck2stages_gemm1_64x32x32x128_1x1_MulABScaleShuffled_v3_Nswizzle0_Quant3_MulRoutedWeight0_silu_FP4X2_FP4X2_B16,0.0,104.2638,moe_ck2stages_gemm2_256x32x128x128_1x4_MulABScaleExpertWeightShuffled_v3_Nswizzle0_Quant3_MulRoutedWeight1_FP4X2_FP4X2_B16,0.0664,307.8334,0,0,0,0.0,0.0,flydsl_fallback
gfx950,256,128,7168,3072,48,6,ActivationType.Silu,torch.bfloat16,torch.float4_e2m1fn_x2,torch.float4_e2m1fn_x2,QuantType.per_1x32,1,0,32,0,205.4276,moe_ck2stages_gemm1_256x32x128x128_1x4_MulABScaleShuffled_v3_Nswizzle0_Quant3_MulRoutedWeight0_silu_FP4X2_FP4X2_B16,0.0,106.2844,moe_ck2stages_gemm2_256x32x128x128_1x4_MulABScaleExpertWeightShuffled_v3_Nswizzle0_Quant3_MulRoutedWeight1_FP4X2_FP4X2_B16,0.0663,311.712,0,0,0,0.0,0.0,flydsl_fallback
gfx950,256,256,7168,3072,48,6,ActivationType.Silu,torch.bfloat16,torch.float4_e2m1fn_x2,torch.float4_e2m1fn_x2,QuantType.per_1x32,1,0,64,0,214.8488,moe_ck2stages_gemm1_256x64x128x128_1x4_MulABScaleShuffled_v3_Nswizzle0_Quant3_MulRoutedWeight0_silu_FP4X2_FP4X2_B16,0.0,113.9751,moe_ck2stages_gemm2_256x64x128x128_1x4_MulABScaleExpertWeightShuffled_v3_Nswizzle0_Quant3_MulRoutedWeight1_FP4X2_FP4X2_B16,0.0676,328.8239,0,0,0,0.0,0.0,flydsl_fallback
gfx950,256,512,7168,3072,48,6,ActivationType.Silu,torch.bfloat16,torch.float4_e2m1fn_x2,torch.float4_e2m1fn_x2,QuantType.per_1x32,1,0,64,0,229.7089,moe_ck2stages_gemm1_256x64x128x128_1x4_MulABScaleShuffled_v3_Nswizzle0_Quant3_MulRoutedWeight0_silu_FP4X2_FP4X2_B16,0.0,133.0663,moe_ck2stages_gemm2_256x64x128x128_1x4_MulABScaleExpertWeightShuffled_v3_Nswizzle0_Quant3_MulRoutedWeight1_FP4X2_FP4X2_B16,0.068,362.7752,0,0,0,0.0,0.0,flydsl_fallback
gfx950,256,1024,7168,3072,48,6,ActivationType.Silu,torch.bfloat16,torch.float4_e2m1fn_x2,torch.float4_e2m1fn_x2,QuantType.per_1x32,1,0,128,0,295.5167,moe_ck2stages_gemm1_256x128x128x128_1x4_MulABScaleShuffled_v3_Nswizzle0_Quant3_MulRoutedWeight0_silu_FP4X2_FP4X2_B16,0.0,199.8531,moe_ck2stages_gemm2_256x128x128x128_1x4_MulABScaleExpertWeightShuffled_v3_Nswizzle0_Quant3_MulRoutedWeight1_FP4X2_FP4X2_B16,0.0675,495.3698,0,0,0,0.0,0.0,flydsl_fallback
gfx950,256,2048,7168,3072,48,6,ActivationType.Silu,torch.bfloat16,torch.float4_e2m1fn_x2,torch.float4_e2m1fn_x2,QuantType.per_1x32,1,0,128,0,435.9229,moe_ck2stages_gemm1_256x128x128x128_1x4_MulABScaleShuffled_v3_Nswizzle0_Quant3_MulRoutedWeight0_silu_FP4X2_FP4X2_B16,0.0,330.161,moe_ck2stages_gemm2_256x128x128x128_1x4_MulABScaleExpertWeightShuffled_v3_Nswizzle0_Quant3_MulRoutedWeight1_FP4X2_FP4X2_B16,0.0679,766.0839,0,0,0,0.0,0.0,flydsl_fallback
gfx950,256,4096,7168,3072,48,6,ActivationType.Silu,torch.bfloat16,torch.float4_e2m1fn_x2,torch.float4_e2m1fn_x2,QuantType.per_1x32,1,0,128,0,712.7946,moe_ck2stages_gemm1_256x128x128x128_1x4_MulABScaleShuffled_v3_Nswizzle0_Quant3_MulRoutedWeight0_silu_FP4X2_FP4X2_B16,0.0,610.2296,moe_ck2stages_gemm2_256x128x128x128_1x4_MulABScaleExpertWeightShuffled_v3_Nswizzle0_Quant3_MulRoutedWeight1_FP4X2_FP4X2_B16,0.0678,1323.0242,0,0,0,0.0,0.0,flydsl_fallback
gfx950,256,8192,7168,3072,48,6,ActivationType.Silu,torch.bfloat16,torch.float4_e2m1fn_x2,torch.float4_e2m1fn_x2,QuantType.per_1x32,1,0,128,0,1283.1274999999998,moe_ck2stages_gemm1_256x128x128x128_1x4_MulABScaleShuffled_v3_Nswizzle0_Quant3_MulRoutedWeight0_silu_FP4X2_FP4X2_B16,0.0,1180.9139,moe_ck2stages_gemm2_256x128x128x128_1x4_MulABScaleExpertWeightShuffled_v3_Nswizzle0_Quant3_MulRoutedWeight1_FP4X2_FP4X2_B16,0.0679,2464.0414,0,0,0,0.0,0.0,flydsl_fallback
gfx950,256,16384,7168,3072,48,6,ActivationType.Silu,torch.bfloat16,torch.float4_e2m1fn_x2,torch.float4_e2m1fn_x2,QuantType.per_1x32,1,0,128,0,2441.7895000000003,moe_ck2stages_gemm1_256x128x128x128_1x4_MulABScaleShuffled_v3_Nswizzle0_Quant3_MulRoutedWeight0_silu_FP4X2_FP4X2_B16,0.0,2322.7875,moe_ck2stages_gemm2_256x128x128x128_1x4_MulABScaleExpertWeightShuffled_v3_Nswizzle0_Quant3_MulRoutedWeight1_FP4X2_FP4X2_B16,0.0679,4764.577,0,0,0,0.0,0.0,flydsl_fallback
gfx950,256,1,4096,256,256,6,ActivationType.Silu,torch.bfloat16,torch.float4_e2m1fn_x2,torch.float4_e2m1fn_x2,QuantType.per_1x32,1,0,32,0,17.2002,moe_ck2stages_gemm1_64x32x32x128_1x1_MulABScaleShuffled_v3_Nswizzle0_Quant3_MulRoutedWeight0_silu_FP4X2_FP4X2_B16,0.0,6.128,moe_ck2stages_gemm2_256x32x128x128_1x4_MulABScaleExpertWeightShuffled_v3_Nswizzle0_Quant3_MulRoutedWeight1_FP4X2_FP4X2_B16,0.0007,23.3282,0,0,0,0.0,0.0,flydsl_fallback
gfx950,256,2,4096,256,256,6,ActivationType.Silu,torch.bfloat16,torch.float4_e2m1fn_x2,torch.float4_e2m1fn_x2,QuantType.per_1x32,1,0,32,0,17.8597,moe_ck2stages_gemm1_64x32x32x128_1x1_MulABScaleShuffled_v3_Nswizzle0_Quant3_MulRoutedWeight0_silu_FP4X2_FP4X2_B16,0.0,6.6978,moe_ck2stages_gemm2_256x32x128x128_1x4_MulABScaleExpertWeightShuffled_v3_Nswizzle0_Quant3_MulRoutedWeight1_FP4X2_FP4X2_B16,0.0022,24.5575,0,0,0,0.0,0.0,flydsl_fallback
gfx950,256,4,4096,256,256,6,ActivationType.Silu,torch.bfloat16,torch.float4_e2m1fn_x2,torch.float4_e2m1fn_x2,QuantType.per_1x32,1,0,32,0,17.7307,moe_ck2stages_gemm1_64x32x32x128_1x1_MulABScaleShuffled_v3_Nswizzle0_Quant3_MulRoutedWeight0_silu_FP4X2_FP4X2_B16,0.0,8.1593,moe_ck2stages_gemm2_256x32x128x128_1x4_MulABScaleExpertWeightShuffled_v3_Nswizzle0_Quant3_MulRoutedWeight1_FP4X2_FP4X2_B16,0.0018,25.89,0,0,0,0.0,0.0,flydsl_fallback
gfx950,256,8,4096,256,256,6,ActivationType.Silu,torch.bfloat16,torch.float4_e2m1fn_x2,torch.float4_e2m1fn_x2,QuantType.per_1x32,1,0,32,0,19.908900000000003,moe_ck2stages_gemm1_64x32x32x128_1x1_MulABScaleShuffled_v3_Nswizzle0_Quant3_MulRoutedWeight0_silu_FP4X2_FP4X2_B16,0.0,12.5001,moe_ck2stages_gemm2_64x32x32x128_1x1_MulABScaleExpertWeightShuffled_v1_Nswizzle0_Quant3_MulRoutedWeight1_FP4X2_FP4X2_B16,0.0014,32.409,0,0,0,0.0,0.0,flydsl_fallback
gfx950,256,16,4096,256,256,6,ActivationType.Silu,torch.bfloat16,torch.float4_e2m1fn_x2,torch.float4_e2m1fn_x2,QuantType.per_1x32,1,0,32,0,23.2569,moe_ck2stages_gemm1_64x32x32x128_1x1_MulABScaleShuffled_v3_Nswizzle0_Quant3_MulRoutedWeight0_silu_FP4X2_FP4X2_B16,0.0,16.5043,moe_ck2stages_gemm2_64x32x32x128_1x1_MulABScaleExpertWeightShuffled_v1_Nswizzle0_Quant3_MulRoutedWeight1_FP4X2_FP4X2_B16,0.0014,39.7612,0,0,0,0.0,0.0,flydsl_fallback
gfx950,256,32,4096,256,256,6,ActivationType.Silu,torch.bfloat16,torch.float4_e2m1fn_x2,torch.float4_e2m1fn_x2,QuantType.per_1x32,1,0,32,0,34.726,moe_ck2stages_gemm1_64x32x32x128_1x1_MulABScaleShuffled_v3_Nswizzle0_Quant3_MulRoutedWeight0_silu_FP4X2_FP4X2_B16,0.0,22.2551,moe_ck2stages_gemm2_64x32x32x128_1x1_MulABScaleExpertWeightShuffled_v1_Nswizzle0_Quant3_MulRoutedWeight1_FP4X2_FP4X2_B16,0.0013,56.9811,0,0,0,0.0,0.0,flydsl_fallback
gfx950,256,64,4096,256,256,6,ActivationType.Silu,torch.bfloat16,torch.float4_e2m1fn_x2,torch.float4_e2m1fn_x2,QuantType.per_1x32,1,0,32,0,47.0084,moe_ck2stages_gemm1_64x32x32x128_1x1_MulABScaleShuffled_v3_Nswizzle0_Quant3_MulRoutedWeight0_silu_FP4X2_FP4X2_B16,0.0,28.6194,moe_ck2stages_gemm2_64x32x32x128_1x1_MulABScaleExpertWeightShuffled_v1_Nswizzle0_Quant3_MulRoutedWeight1_FP4X2_FP4X2_B16,0.0013,75.6278,0,0,0,0.0,0.0,flydsl_fallback
gfx950,256,128,4096,256,256,6,ActivationType.Silu,torch.bfloat16,torch.float4_e2m1fn_x2,torch.float4_e2m1fn_x2,QuantType.per_1x32,1,0,32,0,53.8184,moe_ck2stages_gemm1_64x32x32x128_1x1_MulABScaleShuffled_v3_Nswizzle0_Quant3_MulRoutedWeight0_silu_FP4X2_FP4X2_B16,0.0,32.6965,moe_ck2stages_gemm2_64x32x32x128_1x1_MulABScaleExpertWeightShuffled_v1_Nswizzle0_Quant3_MulRoutedWeight1_FP4X2_FP4X2_B16,0.0013,86.5149,0,0,0,0.0,0.0,flydsl_fallback
gfx950,256,256,4096,256,256,6,ActivationType.Silu,torch.bfloat16,torch.float4_e2m1fn_x2,torch.float4_e2m1fn_x2,QuantType.per_1x32,1,0,32,0,56.6077,moe_ck2stages_gemm1_64x32x32x128_1x1_MulABScaleShuffled_v3_Nswizzle0_Quant3_MulRoutedWeight0_silu_FP4X2_FP4X2_B16,0.0,35.8735,moe_ck2stages_gemm2_64x32x32x128_1x1_MulABScaleExpertWeightShuffled_v1_Nswizzle0_Quant3_MulRoutedWeight1_FP4X2_FP4X2_B16,0.0013,92.4812,0,0,0,0.0,0.0,flydsl_fallback
gfx950,256,512,4096,256,256,6,ActivationType.Silu,torch.bfloat16,torch.float4_e2m1fn_x2,torch.float4_e2m1fn_x2,QuantType.per_1x32,1,0,32,0,57.8083,moe_ck2stages_gemm1_64x32x32x128_1x1_MulABScaleShuffled_v3_Nswizzle0_Quant3_MulRoutedWeight0_silu_FP4X2_FP4X2_B16,0.0,39.1685,moe_ck2stages_gemm2_64x32x32x128_1x1_MulABScaleExpertWeightShuffled_v1_Nswizzle0_Quant3_MulRoutedWeight1_FP4X2_FP4X2_B16,0.0013,96.9768,0,0,0,0.0,0.0,flydsl_fallback
gfx950,256,1024,4096,256,256,6,ActivationType.Silu,torch.bfloat16,torch.float4_e2m1fn_x2,torch.float4_e2m1fn_x2,QuantType.per_1x32,1,0,32,0,64.0884,moe_ck2stages_gemm1_64x32x32x128_1x1_MulABScaleShuffled_v3_Nswizzle0_Quant3_MulRoutedWeight0_silu_FP4X2_FP4X2_B16,0.0,52.3186,moe_ck2stages_gemm2_64x32x32x128_1x1_MulABScaleExpertWeightShuffled_v1_Nswizzle0_Quant3_MulRoutedWeight1_FP4X2_FP4X2_B16,0.0012,116.407,0,0,0,0.0,0.0,flydsl_fallback
gfx950,256,2048,4096,256,256,6,ActivationType.Silu,torch.bfloat16,torch.float4_e2m1fn_x2,torch.float4_e2m1fn_x2,QuantType.per_1x32,1,0,32,0,78.86789999999999,moe_ck2stages_gemm1_64x32x32x128_1x1_MulABScaleShuffled_v3_Nswizzle0_Quant3_MulRoutedWeight0_silu_FP4X2_FP4X2_B16,0.0,93.6316,moe_ck2stages_gemm2_64x32x32x128_1x1_MulABScaleExpertWeightShuffled_v1_Nswizzle0_Quant3_MulRoutedWeight1_FP4X2_FP4X2_B16,0.0012,172.4995,0,0,0,0.0,0.0,flydsl_fallback
gfx950,256,4096,4096,256,256,6,ActivationType.Silu,torch.bfloat16,torch.float4_e2m1fn_x2,torch.float4_e2m1fn_x2,QuantType.per_1x32,1,0,128,0,87.8643,moe_ck2stages_gemm1_256x128x128x128_1x4_MulABScaleShuffled_v3_Nswizzle0_Quant3_MulRoutedWeight0_silu_FP4X2_FP4X2_B16,0.0,184.4539,moe_ck2stages_gemm2_64x128x128x128_1x1_MulABScaleExpertWeightShuffled_v3_Nswizzle0_Quant3_MulRoutedWeight1_FP4X2_FP4X2_B16,0.0012,272.3182,0,0,0,0.0,0.0,flydsl_fallback
gfx950,256,8192,4096,256,256,6,ActivationType.Silu,torch.bfloat16,torch.float4_e2m1fn_x2,torch.float4_e2m1fn_x2,QuantType.per_1x32,1,0,128,0,157.33509999999998,moe_ck2stages_gemm1_256x128x128x128_1x4_MulABScaleShuffled_v3_Nswizzle0_Quant3_MulRoutedWeight0_silu_FP4X2_FP4X2_B16,0.0,332.8406,moe_ck2stages_gemm2_64x128x128x128_1x1_MulABScaleExpertWeightShuffled_v3_Nswizzle0_Quant3_MulRoutedWeight1_FP4X2_FP4X2_B16,0.0013,490.1757,0,0,0,0.0,0.0,flydsl_fallback
gfx950,256,16384,4096,256,256,6,ActivationType.Silu,torch.bfloat16,torch.float4_e2m1fn_x2,torch.float4_e2m1fn_x2,QuantType.per_1x32,1,0,128,0,258.0468,moe_ck2stages_gemm1_256x128x128x128_1x4_MulABScaleShuffled_v3_Nswizzle0_Quant3_MulRoutedWeight0_silu_FP4X2_FP4X2_B16,0.0,642.6466,moe_ck2stages_gemm2_64x128x128x128_1x1_MulABScaleExpertWeightShuffled_v3_Nswizzle0_Quant3_MulRoutedWeight1_FP4X2_FP4X2_B16,0.0012,900.6934,0,0,0,0.0,0.0,flydsl_fallback
gfx950,256,32768,4096,256,256,6,ActivationType.Silu,torch.bfloat16,torch.float4_e2m1fn_x2,torch.float4_e2m1fn_x2,QuantType.per_1x32,1,0,128,0,381.2801,moe_ck2stages_gemm1_256x128x128x128_1x4_MulABScaleShuffled_v3_Nswizzle0_Quant3_MulRoutedWeight0_silu_FP4X2_FP4X2_B16,0.0,1278.4577,moe_ck2stages_gemm2_64x128x128x128_1x1_MulABScaleExpertWeightShuffled_v3_Nswizzle0_Quant3_MulRoutedWeight1_FP4X2_FP4X2_B16,0.0012,1659.7378,0,0,0,0.0,0.0,flydsl_fallback
gfx950,256,131072,4096,256,256,6,ActivationType.Silu,torch.bfloat16,torch.float4_e2m1fn_x2,torch.float4_e2m1fn_x2,QuantType.per_1x32,1,0,128,0,1226.8093,moe_ck2stages_gemm1_256x128x128x128_1x4_MulABScaleShuffled_v3_Nswizzle0_Quant3_MulRoutedWeight0_silu_FP4X2_FP4X2_B16,0.0,5282.4118,moe_ck2stages_gemm2_64x128x128x128_1x1_MulABScaleExpertWeightShuffled_v3_Nswizzle0_Quant3_MulRoutedWeight1_FP4X2_FP4X2_B16,0.0012,6509.2211,0,0,0,0.0,0.0,flydsl_fallback
gfx950,256,1,7168,512,385,7,ActivationType.Silu,torch.bfloat16,torch.float4_e2m1fn_x2,torch.float4_e2m1fn_x2,QuantType.per_1x32,1,0,32,0,25.1377,moe_ck2stages_gemm1_64x32x32x128_1x1_MulABScaleShuffled_v3_Nswizzle0_Quant3_MulRoutedWeight0_silu_FP4X2_FP4X2_B16,0.0,8.0706,moe_ck2stages_gemm2_256x32x128x128_1x4_MulABScaleExpertWeightShuffled_v3_Nswizzle0_Quant3_MulRoutedWeight1_FP4X2_FP4X2_B16,0.0294,33.2083,0,0,0,0.0,0.0,flydsl_fallback
gfx950,256,2,7168,512,385,7,ActivationType.Silu,torch.bfloat16,torch.float4_e2m1fn_x2,torch.float4_e2m1fn_x2,QuantType.per_1x32,1,0,32,0,26.3257,moe_ck2stages_gemm1_64x32x32x128_1x1_MulABScaleShuffled_v3_Nswizzle0_Quant3_MulRoutedWeight0_silu_FP4X2_FP4X2_B16,0.0,13.149,moe_ck2stages_gemm2_256x32x128x128_1x4_MulABScaleExpertWeightShuffled_v3_Nswizzle0_Quant3_MulRoutedWeight1_FP4X2_FP4X2_B16,0.0277,39.4747,0,0,0,0.0,0.0,flydsl_fallback
gfx950,256,4,7168,512,385,7,ActivationType.Silu,torch.bfloat16,torch.float4_e2m1fn_x2,torch.float4_e2m1fn_x2,QuantType.per_1x32,1,0,32,0,31.4932,moe_ck2stages_gemm1_64x32x32x128_1x1_MulABScaleShuffled_v3_Nswizzle0_Quant3_MulRoutedWeight0_silu_FP4X2_FP4X2_B16,0.0,18.1056,moe_ck2stages_gemm2_256x32x128x128_1x4_MulABScaleExpertWeightShuffled_v3_Nswizzle0_Quant3_MulRoutedWeight1_FP4X2_FP4X2_B16,0.0241,49.5988,0,0,0,0.0,0.0,flydsl_fallback
gfx950,256,8,7168,512,385,7,ActivationType.Silu,torch.bfloat16,torch.float4_e2m1fn_x2,torch.float4_e2m1fn_x2,QuantType.per_1x32,1,0,64,0,45.4244,moe_ck2stages_gemm1_256x64x128x128_1x4_MulABScaleShuffled_v3_Nswizzle0_Quant3_MulRoutedWeight0_silu_FP4X2_FP4X2_B16,0.0,28.0434,moe_ck2stages_gemm2_256x64x128x128_1x4_MulABScaleExpertWeightShuffled_v3_Nswizzle0_Quant3_MulRoutedWeight1_FP4X2_FP4X2_B16,0.0238,73.4678,0,0,0,0.0,0.0,flydsl_fallback
gfx950,256,16,7168,512,385,7,ActivationType.Silu,torch.bfloat16,torch.float4_e2m1fn_x2,torch.float4_e2m1fn_x2,QuantType.per_1x32,1,0,32,0,76.984,moe_ck2stages_gemm1_256x32x128x128_1x4_MulABScaleShuffled_v3_Nswizzle0_Quant3_MulRoutedWeight0_silu_FP4X2_FP4X2_B16,0.0,42.5637,moe_ck2stages_gemm2_256x32x128x128_1x4_MulABScaleExpertWeightShuffled_v3_Nswizzle0_Quant3_MulRoutedWeight1_FP4X2_FP4X2_B16,0.0244,119.5477,0,0,0,0.0,0.0,flydsl_fallback
gfx950,256,32,7168,512,385,7,ActivationType.Silu,torch.bfloat16,torch.float4_e2m1fn_x2,torch.float4_e2m1fn_x2,QuantType.per_1x32,1,0,32,0,121.8797,moe_ck2stages_gemm1_64x32x32x128_1x1_MulABScaleShuffled_v3_Nswizzle0_Quant3_MulRoutedWeight0_silu_FP4X2_FP4X2_B16,0.0,63.5823,moe_ck2stages_gemm2_256x32x128x128_1x4_MulABScaleExpertWeightShuffled_v3_Nswizzle0_Quant3_MulRoutedWeight1_FP4X2_FP4X2_B16,0.025,185.462,0,0,0,0.0,0.0,flydsl_fallback
gfx950,256,64,7168,512,385,7,ActivationType.Silu,torch.bfloat16,torch.float4_e2m1fn_x2,torch.float4_e2m1fn_x2,QuantType.per_1x32,1,0,64,0,200.2801,moe_ck2stages_gemm1_256x64x128x128_1x4_MulABScaleShuffled_v3_Nswizzle0_Quant3_MulRoutedWeight0_silu_FP4X2_FP4X2_B16,0.0,103.0944,moe_ck2stages_gemm2_256x64x128x128_1x4_MulABScaleExpertWeightShuffled_v3_Nswizzle0_Quant3_MulRoutedWeight1_FP4X2_FP4X2_B16,0.0252,303.3745,0,0,0,0.0,0.0,flydsl_fallback
gfx950,256,128,7168,512,385,7,ActivationType.Silu,torch.bfloat16,torch.float4_e2m1fn_x2,torch.float4_e2m1fn_x2,QuantType.per_1x32,1,0,64,0,242.4418,moe_ck2stages_gemm1_256x64x128x128_1x4_MulABScaleShuffled_v3_Nswizzle0_Quant3_MulRoutedWeight0_silu_FP4X2_FP4X2_B16,0.0,129.5019,moe_ck2stages_gemm2_256x64x128x128_1x4_MulABScaleExpertWeightShuffled_v3_Nswizzle0_Quant3_MulRoutedWeight1_FP4X2_FP4X2_B16,0.0258,371.9437,0,0,0,0.0,0.0,flydsl_fallback
gfx950,256,256,7168,512,385,7,ActivationType.Silu,torch.bfloat16,torch.float4_e2m1fn_x2,torch.float4_e2m1fn_x2,QuantType.per_1x32,1,0,32,0,259.0789,moe_ck2stages_gemm1_256x32x128x128_1x4_MulABScaleShuffled_v3_Nswizzle0_Quant3_MulRoutedWeight0_silu_FP4X2_FP4X2_B16,0.0,134.2495,moe_ck2stages_gemm2_256x32x128x128_1x4_MulABScaleExpertWeightShuffled_v3_Nswizzle0_Quant3_MulRoutedWeight1_FP4X2_FP4X2_B16,0.0258,393.3284,0,0,0,0.0,0.0,flydsl_fallback
gfx950,256,512,7168,512,385,7,ActivationType.Silu,torch.bfloat16,torch.float4_e2m1fn_x2,torch.float4_e2m1fn_x2,QuantType.per_1x32,1,0,32,0,267.9467,moe_ck2stages_gemm1_64x32x32x128_1x1_MulABScaleShuffled_v3_Nswizzle0_Quant3_MulRoutedWeight0_silu_FP4X2_FP4X2_B16,0.0,147.4109,moe_ck2stages_gemm2_256x32x128x128_1x4_MulABScaleExpertWeightShuffled_v3_Nswizzle0_Quant3_MulRoutedWeight1_FP4X2_FP4X2_B16,0.0259,415.3576,0,0,0,0.0,0.0,flydsl_fallback
gfx950,256,1024,7168,512,385,7,ActivationType.Silu,torch.bfloat16,torch.float4_e2m1fn_x2,torch.float4_e2m1fn_x2,QuantType.per_1x32,1,0,32,0,281.83509999999995,moe_ck2stages_gemm1_256x32x128x128_1x4_MulABScaleShuffled_v3_Nswizzle0_Quant3_MulRoutedWeight0_silu_FP4X2_FP4X2_B16,0.0,190.2928,moe_ck2stages_gemm2_256x32x128x128_1x4_MulABScaleExpertWeightShuffled_v3_Nswizzle0_Quant3_MulRoutedWeight1_FP4X2_FP4X2_B16,0.0257,472.1279,0,0,0,0.0,0.0,flydsl_fallback
gfx950,256,2048,7168,512,385,7,ActivationType.Silu,torch.bfloat16,torch.float4_e2m1fn_x2,torch.float4_e2m1fn_x2,QuantType.per_1x32,1,0,64,0,295.4407,moe_ck2stages_gemm1_256x64x128x128_1x4_MulABScaleShuffled_v3_Nswizzle0_Quant3_MulRoutedWeight0_silu_FP4X2_FP4X2_B16,0.0,317.3811,moe_ck2stages_gemm2_64x64x128x128_1x1_MulABScaleExpertWeightShuffled_v3_Nswizzle0_Quant3_MulRoutedWeight1_FP4X2_FP4X2_B16,0.0256,612.8218,0,0,0,0.0,0.0,flydsl_fallback
gfx950,256,4096,7168,512,385,7,ActivationType.Silu,torch.bfloat16,torch.float4_e2m1fn_x2,torch.float4_e2m1fn_x2,QuantType.per_1x32,1,0,64,0,471.695,moe_ck2stages_gemm1_256x64x128x128_1x4_MulABScaleShuffled_v3_Nswizzle0_Quant3_MulRoutedWeight0_silu_FP4X2_FP4X2_B16,0.0,534.2892,moe_ck2stages_gemm2_64x64x128x128_1x1_MulABScaleExpertWeightShuffled_v3_Nswizzle0_Quant3_MulRoutedWeight1_FP4X2_FP4X2_B16,0.0257,1005.9842,0,0,0,0.0,0.0,flydsl_fallback
gfx950,256,8192,7168,512,385,7,ActivationType.Silu,torch.bfloat16,torch.float4_e2m1fn_x2,torch.float4_e2m1fn_x2,QuantType.per_1x32,1,0,64,0,561.3281000000001,moe_ck2stages_gemm1_256x64x128x128_1x4_MulABScaleShuffled_v3_Nswizzle0_Quant3_MulRoutedWeight0_silu_FP4X2_FP4X2_B16,0.0,907.513,moe_ck2stages_gemm2_64x64x128x128_1x1_MulABScaleExpertWeightShuffled_v3_Nswizzle0_Quant3_MulRoutedWeight1_FP4X2_FP4X2_B16,0.0257,1468.8411,0,0,0,0.0,0.0,flydsl_fallback
gfx950,256,16384,7168,512,385,7,ActivationType.Silu,torch.bfloat16,torch.float4_e2m1fn_x2,torch.float4_e2m1fn_x2,QuantType.per_1x32,1,0,64,0,789.2424000000001,moe_ck2stages_gemm1_256x64x128x128_1x4_MulABScaleShuffled_v3_Nswizzle0_Quant3_MulRoutedWeight0_silu_FP4X2_FP4X2_B16,0.0,1694.7595,moe_ck2stages_gemm2_64x64x128x128_1x1_MulABScaleExpertWeightShuffled_v3_Nswizzle0_Quant3_MulRoutedWeight1_FP4X2_FP4X2_B16,0.0257,2484.0019,0,0,0,0.0,0.0,flydsl_fallback
gfx950,256,32768,7168,512,385,7,ActivationType.Silu,torch.bfloat16,torch.float4_e2m1fn_x2,torch.float4_e2m1fn_x2,QuantType.per_1x32,1,0,64,0,1371.7916,moe_ck2stages_gemm1_256x64x128x128_1x4_MulABScaleShuffled_v3_Nswizzle0_Quant3_MulRoutedWeight0_silu_FP4X2_FP4X2_B16,0.0,3353.1712,moe_ck2stages_gemm2_64x64x128x128_1x1_MulABScaleExpertWeightShuffled_v3_Nswizzle0_Quant3_MulRoutedWeight1_FP4X2_FP4X2_B16,0.0257,4724.9628,0,0,0,0.0,0.0,flydsl_fallback
gfx950,256,1,7168,768,385,7,ActivationType.Silu,torch.bfloat16,torch.float4_e2m1fn_x2,torch.float4_e2m1fn_x2,QuantType.per_1x32,1,0,64,0,32.8199,moe_ck2stages_gemm1_256x64x128x128_1x4_MulABScaleShuffled_v3_Nswizzle0_Quant3_MulRoutedWeight0_silu_FP4X2_FP4X2_B16,0.0,9.5182,moe_ck2stages_gemm2_256x64x128x128_1x4_MulABScaleExpertWeightShuffled_v3_Nswizzle0_Quant3_MulRoutedWeight1_FP4X2_FP4X2_B16,0.0294,42.3381,0,0,0,0.0,0.0,flydsl_fallback
gfx950,256,2,7168,768,385,7,ActivationType.Silu,torch.bfloat16,torch.float4_e2m1fn_x2,torch.float4_e2m1fn_x2,QuantType.per_1x32,1,0,32,0,33.7612,moe_ck2stages_gemm1_256x32x128x128_1x4_MulABScaleShuffled_v3_Nswizzle0_Quant3_MulRoutedWeight0_silu_FP4X2_FP4X2_B16,0.0,15.9019,moe_ck2stages_gemm2_256x32x128x128_1x4_MulABScaleExpertWeightShuffled_v3_Nswizzle0_Quant3_MulRoutedWeight1_FP4X2_FP4X2_B16,0.0334,49.6631,0,0,0,0.0,0.0,flydsl_fallback
gfx950,256,4,7168,768,385,7,ActivationType.Silu,torch.bfloat16,torch.float4_e2m1fn_x2,torch.float4_e2m1fn_x2,QuantType.per_1x32,1,0,32,0,33.0158,moe_ck2stages_gemm1_64x32x32x128_1x1_MulABScaleShuffled_v3_Nswizzle0_Quant3_MulRoutedWeight0_silu_FP4X2_FP4X2_B16,0.0,20.8663,moe_ck2stages_gemm2_256x32x128x128_1x4_MulABScaleExpertWeightShuffled_v3_Nswizzle0_Quant3_MulRoutedWeight1_FP4X2_FP4X2_B16,0.0321,53.8821,0,0,0,0.0,0.0,flydsl_fallback
gfx950,256,8,7168,768,385,7,ActivationType.Silu,torch.bfloat16,torch.float4_e2m1fn_x2,torch.float4_e2m1fn_x2,QuantType.per_1x32,1,0,32,0,68.3405,moe_ck2stages_gemm1_256x32x128x128_1x4_MulABScaleShuffled_v3_Nswizzle0_Quant3_MulRoutedWeight0_silu_FP4X2_FP4X2_B16,0.0,33.7901,moe_ck2stages_gemm2_256x32x128x128_1x4_MulABScaleExpertWeightShuffled_v3_Nswizzle0_Quant3_MulRoutedWeight1_FP4X2_FP4X2_B16,0.0349,102.1306,0,0,0,0.0,0.0,flydsl_fallback
gfx950,256,16,7168,768,385,7,ActivationType.Silu,torch.bfloat16,torch.float4_e2m1fn_x2,torch.float4_e2m1fn_x2,QuantType.per_1x32,1,0,32,0,105.9936,moe_ck2stages_gemm1_64x32x32x128_1x1_MulABScaleShuffled_v3_Nswizzle0_Quant3_MulRoutedWeight0_silu_FP4X2_FP4X2_B16,0.0,54.2599,moe_ck2stages_gemm2_256x32x128x128_1x4_MulABScaleExpertWeightShuffled_v3_Nswizzle0_Quant3_MulRoutedWeight1_FP4X2_FP4X2_B16,0.0353,160.2535,0,0,0,0.0,0.0,flydsl_fallback
gfx950,256,32,7168,768,385,7,ActivationType.Silu,torch.bfloat16,torch.float4_e2m1fn_x2,torch.float4_e2m1fn_x2,QuantType.per_1x32,1,0,64,0,195.2177,moe_ck2stages_gemm1_256x64x128x128_1x4_MulABScaleShuffled_v3_Nswizzle0_Quant3_MulRoutedWeight0_silu_FP4X2_FP4X2_B16,0.0,92.6778,moe_ck2stages_gemm2_256x64x128x128_1x4_MulABScaleExpertWeightShuffled_v3_Nswizzle0_Quant3_MulRoutedWeight1_FP4X2_FP4X2_B16,0.0354,287.8955,0,0,0,0.0,0.0,flydsl_fallback
gfx950,256,64,7168,768,385,7,ActivationType.Silu,torch.bfloat16,torch.float4_e2m1fn_x2,torch.float4_e2m1fn_x2,QuantType.per_1x32,1,0,64,0,276.7481,moe_ck2stages_gemm1_256x64x128x128_1x4_MulABScaleShuffled_v3_Nswizzle0_Quant3_MulRoutedWeight0_silu_FP4X2_FP4X2_B16,0.0,137.1149,moe_ck2stages_gemm2_256x64x128x128_1x4_MulABScaleExpertWeightShuffled_v3_Nswizzle0_Quant3_MulRoutedWeight1_FP4X2_FP4X2_B16,0.0356,413.863,0,0,0,0.0,0.0,flydsl_fallback
gfx950,256,128,7168,768,385,7,ActivationType.Silu,torch.bfloat16,torch.float4_e2m1fn_x2,torch.float4_e2m1fn_x2,QuantType.per_1x32,1,0,64,0,345.7642,moe_ck2stages_gemm1_256x64x128x128_1x4_MulABScaleShuffled_v3_Nswizzle0_Quant3_MulRoutedWeight0_silu_FP4X2_FP4X2_B16,0.0,178.6003,moe_ck2stages_gemm2_256x64x128x128_1x4_MulABScaleExpertWeightShuffled_v3_Nswizzle0_Quant3_MulRoutedWeight1_FP4X2_FP4X2_B16,0.0359,524.3645,0,0,0,0.0,0.0,flydsl_fallback
gfx950,256,256,7168,768,385,7,ActivationType.Silu,torch.bfloat16,torch.float4_e2m1fn_x2,torch.float4_e2m1fn_x2,QuantType.per_1x32,1,0,32,0,379.8903,moe_ck2stages_gemm1_64x32x32x128_1x1_MulABScaleShuffled_v3_Nswizzle0_Quant3_MulRoutedWeight0_silu_FP4X2_FP4X2_B16,0.0,202.1135,moe_ck2stages_gemm2_256x32x128x128_1x4_MulABScaleExpertWeightShuffled_v3_Nswizzle0_Quant3_MulRoutedWeight1_FP4X2_FP4X2_B16,0.0361,582.0038,0,0,0,0.0,0.0,flydsl_fallback
gfx950,256,512,7168,768,385,7,ActivationType.Silu,torch.bfloat16,torch.float4_e2m1fn_x2,torch.float4_e2m1fn_x2,QuantType.per_1x32,1,0,64,0,398.9468,moe_ck2stages_gemm1_256x64x128x128_1x4_MulABScaleShuffled_v3_Nswizzle0_Quant3_MulRoutedWeight0_silu_FP4X2_FP4X2_B16,0.0,214.3028,moe_ck2stages_gemm2_256x64x128x128_1x4_MulABScaleExpertWeightShuffled_v3_Nswizzle0_Quant3_MulRoutedWeight1_FP4X2_FP4X2_B16,0.0364,613.2496,0,0,0,0.0,0.0,flydsl_fallback
gfx950,256,1024,7168,768,385,7,ActivationType.Silu,torch.bfloat16,torch.float4_e2m1fn_x2,torch.float4_e2m1fn_x2,QuantType.per_1x32,1,0,64,0,425.1465,moe_ck2stages_gemm1_256x64x128x128_1x4_MulABScaleShuffled_v3_Nswizzle0_Quant3_MulRoutedWeight0_silu_FP4X2_FP4X2_B16,0.0,235.0246,moe_ck2stages_gemm2_256x64x128x128_1x4_MulABScaleExpertWeightShuffled_v3_Nswizzle0_Quant3_MulRoutedWeight1_FP4X2_FP4X2_B16,0.0362,660.1711,0,0,0,0.0,0.0,flydsl_fallback
gfx950,256,2048,7168,768,385,7,ActivationType.Silu,torch.bfloat16,torch.float4_e2m1fn_x2,torch.float4_e2m1fn_x2,QuantType.per_1x32,1,0,64,0,432.3068,moe_ck2stages_gemm1_256x64x128x128_1x4_MulABScaleShuffled_v3_Nswizzle0_Quant3_MulRoutedWeight0_silu_FP4X2_FP4X2_B16,0.0,360.0445,moe_ck2stages_gemm2_256x64x128x128_1x4_MulABScaleExpertWeightShuffled_v3_Nswizzle0_Quant3_MulRoutedWeight1_FP4X2_FP4X2_B16,0.0363,792.3513,0,0,0,0.0,0.0,flydsl_fallback
gfx950,256,4096,7168,768,385,7,ActivationType.Silu,torch.bfloat16,torch.float4_e2m1fn_x2,torch.float4_e2m1fn_x2,QuantType.per_1x32,1,0,128,0,489.0964,moe_ck2stages_gemm1_256x128x128x128_1x4_MulABScaleShuffled_v3_Nswizzle0_Quant3_MulRoutedWeight0_silu_FP4X2_FP4X2_B16,0.0,692.455,moe_ck2stages_gemm2_256x128x128x128_1x4_MulABScaleExpertWeightShuffled_v3_Nswizzle0_Quant3_MulRoutedWeight1_FP4X2_FP4X2_B16,0.0363,1181.5514,0,0,0,0.0,0.0,flydsl_fallback
gfx950,256,8192,7168,768,385,7,ActivationType.Silu,torch.bfloat16,torch.float4_e2m1fn_x2,torch.float4_e2m1fn_x2,QuantType.per_1x32,1,0,128,0,864.1551000000001,moe_ck2stages_gemm1_256x128x128x128_1x4_MulABScaleShuffled_v3_Nswizzle0_Quant3_MulRoutedWeight0_silu_FP4X2_FP4X2_B16,0.0,1357.177,moe_ck2stages_gemm2_256x128x128x128_1x4_MulABScaleExpertWeightShuffled_v3_Nswizzle0_Quant3_MulRoutedWeight1_FP4X2_FP4X2_B16,0.0363,2221.3321,0,0,0,0.0,0.0,flydsl_fallback
gfx950,256,16384,7168,768,385,7,ActivationType.Silu,torch.bfloat16,torch.float4_e2m1fn_x2,torch.float4_e2m1fn_x2,QuantType.per_1x32,1,0,128,0,1426.1713,moe_ck2stages_gemm1_256x128x128x128_1x4_MulABScaleShuffled_v3_Nswizzle0_Quant3_MulRoutedWeight0_silu_FP4X2_FP4X2_B16,0.0,2675.9592,moe_ck2stages_gemm2_256x128x128x128_1x4_MulABScaleExpertWeightShuffled_v3_Nswizzle0_Quant3_MulRoutedWeight1_FP4X2_FP4X2_B16,0.0364,4102.1305,0,0,0,0.0,0.0,flydsl_fallback
gfx950,256,32768,7168,768,385,7,ActivationType.Silu,torch.bfloat16,torch.float4_e2m1fn_x2,torch.float4_e2m1fn_x2,QuantType.per_1x32,1,0,128,0,2280.9489,moe_ck2stages_gemm1_256x128x128x128_1x4_MulABScaleShuffled_v3_Nswizzle0_Quant3_MulRoutedWeight0_silu_FP4X2_FP4X2_B16,0.0,5315.321,moe_ck2stages_gemm2_256x128x128x128_1x4_MulABScaleExpertWeightShuffled_v3_Nswizzle0_Quant3_MulRoutedWeight1_FP4X2_FP4X2_B16,0.0364,7596.2699,0,0,0,0.0,0.0,flydsl_fallback
gfx950,256,1,7168,1536,385,7,ActivationType.Silu,torch.bfloat16,torch.float4_e2m1fn_x2,torch.float4_e2m1fn_x2,QuantType.per_1x32,1,0,64,0,35.995,moe_ck2stages_gemm1_256x64x128x128_1x4_MulABScaleShuffled_v3_Nswizzle0_Quant3_MulRoutedWeight0_silu_FP4X2_FP4X2_B16,0.0,16.3119,moe_ck2stages_gemm2_256x64x128x128_1x4_MulABScaleExpertWeightShuffled_v3_Nswizzle0_Quant3_MulRoutedWeight1_FP4X2_FP4X2_B16,0.0544,52.3069,0,0,0,0.0,0.0,flydsl_fallback
gfx950,256,2,7168,1536,385,7,ActivationType.Silu,torch.bfloat16,torch.float4_e2m1fn_x2,torch.float4_e2m1fn_x2,QuantType.per_1x32,1,0,64,0,41.1722,moe_ck2stages_gemm1_256x64x128x128_1x4_MulABScaleShuffled_v3_Nswizzle0_Quant3_MulRoutedWeight0_silu_FP4X2_FP4X2_B16,0.0,26.3842,moe_ck2stages_gemm2_256x64x128x128_1x4_MulABScaleExpertWeightShuffled_v3_Nswizzle0_Quant3_MulRoutedWeight1_FP4X2_FP4X2_B16,0.057,67.5564,0,0,0,0.0,0.0,flydsl_fallback
gfx950,256,4,7168,1536,385,7,ActivationType.Silu,torch.bfloat16,torch.float4_e2m1fn_x2,torch.float4_e2m1fn_x2,QuantType.per_1x32,1,0,32,0,65.4475,moe_ck2stages_gemm1_64x32x32x128_1x1_MulABScaleShuffled_v3_Nswizzle0_Quant3_MulRoutedWeight0_silu_FP4X2_FP4X2_B16,0.0,36.3601,moe_ck2stages_gemm2_256x32x128x128_1x4_MulABScaleExpertWeightShuffled_v3_Nswizzle0_Quant3_MulRoutedWeight1_FP4X2_FP4X2_B16,0.0535,101.8076,0,0,0,0.0,0.0,flydsl_fallback
gfx950,256,8,7168,1536,385,7,ActivationType.Silu,torch.bfloat16,torch.float4_e2m1fn_x2,torch.float4_e2m1fn_x2,QuantType.per_1x32,1,0,32,0,116.2737,moe_ck2stages_gemm1_256x32x128x128_1x4_MulABScaleShuffled_v3_Nswizzle0_Quant3_MulRoutedWeight0_silu_FP4X2_FP4X2_B16,0.0,62.4261,moe_ck2stages_gemm2_256x32x128x128_1x4_MulABScaleExpertWeightShuffled_v3_Nswizzle0_Quant3_MulRoutedWeight1_FP4X2_FP4X2_B16,0.0545,178.6998,0,0,0,0.0,0.0,flydsl_fallback
gfx950,256,16,7168,1536,385,7,ActivationType.Silu,torch.bfloat16,torch.float4_e2m1fn_x2,torch.float4_e2m1fn_x2,QuantType.per_1x32,1,0,32,0,197.881,moe_ck2stages_gemm1_64x32x32x128_1x1_MulABScaleShuffled_v3_Nswizzle0_Quant3_MulRoutedWeight0_silu_FP4X2_FP4X2_B16,0.0,103.5376,moe_ck2stages_gemm2_256x32x128x128_1x4_MulABScaleExpertWeightShuffled_v3_Nswizzle0_Quant3_MulRoutedWeight1_FP4X2_FP4X2_B16,0.0554,301.4186,0,0,0,0.0,0.0,flydsl_fallback
gfx950,256,32,7168,1536,385,7,ActivationType.Silu,torch.bfloat16,torch.float4_e2m1fn_x2,torch.float4_e2m1fn_x2,QuantType.per_1x32,1,0,32,0,330.7973,moe_ck2stages_gemm1_256x32x128x128_1x4_MulABScaleShuffled_v3_Nswizzle0_Quant3_MulRoutedWeight0_silu_FP4X2_FP4X2_B16,0.0,171.7752,moe_ck2stages_gemm2_256x32x128x128_1x4_MulABScaleExpertWeightShuffled_v3_Nswizzle0_Quant3_MulRoutedWeight1_FP4X2_FP4X2_B16,0.056,502.5725,0,0,0,0.0,0.0,flydsl_fallback
gfx950,256,64,7168,1536,385,7,ActivationType.Silu,torch.bfloat16,torch.float4_e2m1fn_x2,torch.float4_e2m1fn_x2,QuantType.per_1x32,1,0,32,0,523.5912,moe_ck2stages_gemm1_256x32x128x128_1x4_MulABScaleShuffled_v3_Nswizzle0_Quant3_MulRoutedWeight0_silu_FP4X2_FP4X2_B16,0.0,263.5064,moe_ck2stages_gemm2_256x32x128x128_1x4_MulABScaleExpertWeightShuffled_v3_Nswizzle0_Quant3_MulRoutedWeight1_FP4X2_FP4X2_B16,0.0568,787.0976,0,0,0,0.0,0.0,flydsl_fallback
gfx950,256,128,7168,1536,385,7,ActivationType.Silu,torch.bfloat16,torch.float4_e2m1fn_x2,torch.float4_e2m1fn_x2,QuantType.per_1x32,1,0,32,0,678.6484,moe_ck2stages_gemm1_64x32x32x128_1x1_MulABScaleShuffled_v3_Nswizzle0_Quant3_MulRoutedWeight0_silu_FP4X2_FP4X2_B16,0.0,344.0291,moe_ck2stages_gemm2_256x32x128x128_1x4_MulABScaleExpertWeightShuffled_v3_Nswizzle0_Quant3_MulRoutedWeight1_FP4X2_FP4X2_B16,0.0572,1022.6775,0,0,0,0.0,0.0,flydsl_fallback
gfx950,256,256,7168,1536,385,7,ActivationType.Silu,torch.bfloat16,torch.float4_e2m1fn_x2,torch.float4_e2m1fn_x2,QuantType.per_1x32,1,0,32,0,747.0732,moe_ck2stages_gemm1_256x32x128x128_1x4_MulABScaleShuffled_v3_Nswizzle0_Quant3_MulRoutedWeight0_silu_FP4X2_FP4X2_B16,0.0,386.3447,moe_ck2stages_gemm2_256x32x128x128_1x4_MulABScaleExpertWeightShuffled_v3_Nswizzle0_Quant3_MulRoutedWeight1_FP4X2_FP4X2_B16,0.057,1133.4179,0,0,0,0.0,0.0,flydsl_fallback
gfx950,256,512,7168,1536,385,7,ActivationType.Silu,torch.bfloat16,torch.float4_e2m1fn_x2,torch.float4_e2m1fn_x2,QuantType.per_1x32,1,0,32,0,768.5891,moe_ck2stages_gemm1_64x32x32x128_1x1_MulABScaleShuffled_v3_Nswizzle0_Quant3_MulRoutedWeight0_silu_FP4X2_FP4X2_B16,0.0,432.1055,moe_ck2stages_gemm2_256x32x128x128_1x4_MulABScaleExpertWeightShuffled_v3_Nswizzle0_Quant3_MulRoutedWeight1_FP4X2_FP4X2_B16,0.0564,1200.6946,0,0,0,0.0,0.0,flydsl_fallback
gfx950,256,1024,7168,1536,385,7,ActivationType.Silu,torch.bfloat16,torch.float4_e2m1fn_x2,torch.float4_e2m1fn_x2,QuantType.per_1x32,1,0,32,0,795.8684000000001,moe_ck2stages_gemm1_64x32x32x128_1x1_MulABScaleShuffled_v3_Nswizzle0_Quant3_MulRoutedWeight0_silu_FP4X2_FP4X2_B16,0.0,461.8544,moe_ck2stages_gemm2_256x32x128x128_1x4_MulABScaleExpertWeightShuffled_v3_Nswizzle0_Quant3_MulRoutedWeight1_FP4X2_FP4X2_B16,0.0568,1257.7228,0,0,0,0.0,0.0,flydsl_fallback
gfx950,256,2048,7168,1536,385,7,ActivationType.Silu,torch.bfloat16,torch.float4_e2m1fn_x2,torch.float4_e2m1fn_x2,QuantType.per_1x32,1,0,64,0,813.8290000000001,moe_ck2stages_gemm1_256x64x128x128_1x4_MulABScaleShuffled_v3_Nswizzle0_Quant3_MulRoutedWeight0_silu_FP4X2_FP4X2_B16,0.0,471.4345,moe_ck2stages_gemm2_256x64x128x128_1x4_MulABScaleExpertWeightShuffled_v3_Nswizzle0_Quant3_MulRoutedWeight1_FP4X2_FP4X2_B16,0.0568,1285.2635,0,0,0,0.0,0.0,flydsl_fallback
gfx950,256,4096,7168,1536,385,7,ActivationType.Silu,torch.bfloat16,torch.float4_e2m1fn_x2,torch.float4_e2m1fn_x2,QuantType.per_1x32,1,0,128,0,936.9341,moe_ck2stages_gemm1_256x128x128x128_1x4_MulABScaleShuffled_v3_Nswizzle0_Quant3_MulRoutedWeight0_silu_FP4X2_FP4X2_B16,0.0,739.3818,moe_ck2stages_gemm2_256x128x128x128_1x4_MulABScaleExpertWeightShuffled_v3_Nswizzle0_Quant3_MulRoutedWeight1_FP4X2_FP4X2_B16,0.0566,1676.3159,0,0,0,0.0,0.0,flydsl_fallback
gfx950,256,8192,7168,1536,385,7,ActivationType.Silu,torch.bfloat16,torch.float4_e2m1fn_x2,torch.float4_e2m1fn_x2,QuantType.per_1x32,1,0,128,0,1613.4132,moe_ck2stages_gemm1_256x128x128x128_1x4_MulABScaleShuffled_v3_Nswizzle0_Quant3_MulRoutedWeight0_silu_FP4X2_FP4X2_B16,0.0,1399.5731,moe_ck2stages_gemm2_256x128x128x128_1x4_MulABScaleExpertWeightShuffled_v3_Nswizzle0_Quant3_MulRoutedWeight1_FP4X2_FP4X2_B16,0.0566,3012.9863,0,0,0,0.0,0.0,flydsl_fallback
gfx950,256,16384,7168,1536,385,7,ActivationType.Silu,torch.bfloat16,torch.float4_e2m1fn_x2,torch.float4_e2m1fn_x2,QuantType.per_1x32,1,0,128,0,2072.807,moe_ck2stages_gemm1_256x128x128x128_1x4_MulABScaleShuffled_v3_Nswizzle0_Quant3_MulRoutedWeight0_silu_FP4X2_FP4X2_B16,0.0,2733.7703,moe_ck2stages_gemm2_256x128x128x128_1x4_MulABScaleExpertWeightShuffled_v3_Nswizzle0_Quant3_MulRoutedWeight1_FP4X2_FP4X2_B16,0.0567,4806.5773,0,0,0,0.0,0.0,flydsl_fallback
gfx950,256,32768,7168,1536,385,7,ActivationType.Silu,torch.bfloat16,torch.float4_e2m1fn_x2,torch.float4_e2m1fn_x2,QuantType.per_1x32,1,0,128,0,3333.5058,moe_ck2stages_gemm1_256x128x128x128_1x4_MulABScaleShuffled_v3_Nswizzle0_Quant3_MulRoutedWeight0_silu_FP4X2_FP4X2_B16,0.0,5388.5935,moe_ck2stages_gemm2_256x128x128x128_1x4_MulABScaleExpertWeightShuffled_v3_Nswizzle0_Quant3_MulRoutedWeight1_FP4X2_FP4X2_B16,0.0567,8722.0993,0,0,0,0.0,0.0,flydsl_fallback
