aiter/configs/model_configs/glm47_fp8_tuned_fmoe.csv
cu_num,token,model_dim,inter_dim,expert,topk,act_type,dtype,q_dtype_a,q_dtype_w,q_type,use_g1u1,doweight_stage1,block_m,ksplit,us1,kernelName1,err1,us2,kernelName2,err2,us,run_1stage,tflops,bw,xbf16,_tag
256,1,5120,1536,40,8,ActivationType.Silu,torch.bfloat16,torch.float8_e4m3fn,torch.float8_e4m3fn,QuantType.per_Token,1,0,32,0,24.7726,flydsl_moe1_afp8_wfp8_bf16_t32x128x128,0.0%,19.6546,flydsl_moe2_afp8_wfp8_bf16_t32x128x128_atomic,3.6%,44.4272,0,8.5,21242.25,0,
256,2,5120,1536,40,8,ActivationType.Silu,torch.bfloat16,torch.float8_e4m3fn,torch.float8_e4m3fn,QuantType.per_Token,1,0,32,0,40.5573,flydsl_moe1_afp8_wfp8_bf16_t32x128x128,0.0%,27.9361,flydsl_moe2_afp8_wfp8_bf16_t32x128x128_atomic,3.9%,68.4934,0,11.02,13778.69,0,
256,4,5120,1536,40,8,ActivationType.Silu,torch.bfloat16,torch.float8_e4m3fn,torch.float8_e4m3fn,QuantType.per_Token,1,0,32,0,99.8134,flydsl_moe1_afp8_wfp8_bf16_t32x128x128,0.00%,0.0,flydsl_moe2_afp8_wfp8_bf16_t32x128x128_atomic,0.00%,99.8134,0,15.13,9455.44,0,
256,8,5120,1536,40,8,ActivationType.Silu,torch.bfloat16,torch.float8_e4m3fn,torch.float8_e4m3fn,QuantType.per_Token,1,0,32,0,134.9101,flydsl_moe1_afp8_wfp8_bf16_t32x128x128,0.00%,0.0,flydsl_moe2_afp8_wfp8_bf16_t32x128x128_atomic,0.00%,134.9101,0,22.38,6996.08,0,
256,16,5120,1536,40,8,ActivationType.Silu,torch.bfloat16,torch.float8_e4m3fn,torch.float8_e4m3fn,QuantType.per_Token,1,0,32,0,156.6731,flydsl_moe1_afp8_wfp8_bf16_t32x128x128,0.00%,0.0,flydsl_moe2_afp8_wfp8_bf16_t32x128x128_atomic,0.00%,156.6731,0,38.55,6025.06,0,
256,32,5120,1536,40,8,ActivationType.Silu,torch.bfloat16,torch.float8_e4m3fn,torch.float8_e4m3fn,QuantType.per_Token,1,0,32,0,164.2209,flydsl_moe1_afp8_wfp8_bf16_t32x128x128,0.00%,0.0,flydsl_moe2_afp8_wfp8_bf16_t32x128x128_atomic,0.00%,164.2209,0,73.56,5749.63,0,
256,64,5120,1536,40,8,ActivationType.Silu,torch.bfloat16,torch.float8_e4m3fn,torch.float8_e4m3fn,QuantType.per_Token,1,0,32,0,168.1699,flydsl_moe1_afp8_wfp8_bf16_t32x128x128,0.00%,0.0,flydsl_moe2_afp8_wfp8_bf16_t32x128x128_atomic,0.00%,168.1699,0,143.66,5617.54,0,
256,128,5120,1536,40,8,ActivationType.Silu,torch.bfloat16,torch.float8_e4m3fn,torch.float8_e4m3fn,QuantType.per_Token,1,0,32,0,177.1016,flydsl_moe1_afp8_wfp8_bf16_t32x128x128,0.00%,0.0,flydsl_moe2_afp8_wfp8_bf16_t32x128x128_atomic,0.00%,177.1016,0,272.83,5339.79,0,
256,256,5120,1536,40,8,ActivationType.Silu,torch.bfloat16,torch.float8_e4m3fn,torch.float8_e4m3fn,QuantType.per_Token,1,0,64,0,111.1445,flydsl_moe1_afp8_wfp8_bf16_t64x128x128,0.00%,94.3821,flydsl_moe2_afp8_wfp8_bf16_t64x128x128_atomic,3.80%,205.5266,0,470.19,4610.84,0,
256,512,5120,1536,40,8,ActivationType.Silu,torch.bfloat16,torch.float8_e4m3fn,torch.float8_e4m3fn,QuantType.per_Token,1,0,128,0,128.617,flydsl_moe1_afp8_wfp8_bf16_t128x128x128,0.00%,136.7373,flydsl_moe2_afp8_wfp8_bf16_t128x128x128_atomic,3.80%,265.3543,0,728.36,3586.08,0,
256,1024,5120,1536,40,8,ActivationType.Silu,torch.bfloat16,torch.float8_e4m3fn,torch.float8_e4m3fn,QuantType.per_Token,1,0,64,0,227.447,flydsl_moe1_afp8_wfp8_bf16_t64x128x128,0.00%,192.093,flydsl_moe2_afp8_wfp8_bf16_t64x128x128_atomic,3.80%,419.54,0,921.36,2286.9,0,
256,2048,5120,1536,40,8,ActivationType.Silu,torch.bfloat16,torch.float8_e4m3fn,torch.float8_e4m3fn,QuantType.per_Token,1,0,128,0,352.8768,flydsl_moe1_afp8_wfp8_bf16_t128x128x128,0.00%,345.4655,flydsl_moe2_afp8_wfp8_bf16_t128x128x128_atomic,3.70%,698.3423,0,1107.04,1396.42,0,
256,4096,5120,1536,40,8,ActivationType.Silu,torch.bfloat16,torch.float8_e4m3fn,torch.float8_e4m3fn,QuantType.per_Token,1,0,128,0,582.0723,flydsl_moe1_afp8_wfp8_bf16_t128x128x128,0.00%,641.9346,flydsl_moe2_afp8_wfp8_bf16_t128x128x128_atomic,3.80%,1224.0069,0,1263.22,822.41,0,
256,8192,5120,1536,40,8,ActivationType.Silu,torch.bfloat16,torch.float8_e4m3fn,torch.float8_e4m3fn,QuantType.per_Token,1,0,128,0,1078.8184,flydsl_moe1_afp8_wfp8_bf16_t128x128x128,0.00%,1239.192,flydsl_moe2_afp8_wfp8_bf16_t128x128x128_atomic,3.80%,2318.0104,0,1334.06,461.41,0,
256,16384,5120,1536,40,8,ActivationType.Silu,torch.bfloat16,torch.float8_e4m3fn,torch.float8_e4m3fn,QuantType.per_Token,1,0,128,0,1988.7154,flydsl_moe1_afp8_wfp8_bf16_t128x128x128,0.00%,2328.3393,flydsl_moe2_afp8_wfp8_bf16_t128x128x128_atomic,3.80%,4317.0547,0,1432.63,276.9,0,
256,32768,5120,1536,40,8,ActivationType.Silu,torch.bfloat16,torch.float8_e4m3fn,torch.float8_e4m3fn,QuantType.per_Token,1,0,128,0,3930.1981,flydsl_moe1_afp8_wfp8_bf16_t128x128x128,0.00%,4488.9205,flydsl_moe2_afp8_wfp8_bf16_t128x128x128_atomic,3.80%,8419.1186,0,1469.22,171.87,0,
256,1,5120,384,161,9,ActivationType.Silu,torch.bfloat16,torch.float8_e4m3fn,torch.float8_e4m3fn,QuantType.per_Token,1,0,128,0,30.2779,flydsl_moe1_afp8_wfp8_bf16_t128x128x128,0.0%,16.6368,flydsl_moe2_afp8_wfp8_bf16_t128x128x128_atomic,0.7%,46.9147,0,2.26,20241.67,0,
256,2,5120,384,161,9,ActivationType.Silu,torch.bfloat16,torch.float8_e4m3fn,torch.float8_e4m3fn,QuantType.per_Token,1,0,128,0,31.6468,flydsl_moe1_afp8_wfp8_bf16_t128x128x128,0.0%,25.2795,flydsl_moe2_afp8_wfp8_bf16_t128x128x128_atomic,0.9%,56.9263,0,3.73,16682.05,0,
256,4,5120,384,161,9,ActivationType.Silu,torch.bfloat16,torch.float8_e4m3fn,torch.float8_e4m3fn,QuantType.per_Token,1,0,128,0,34.4958,flydsl_moe1_afp8_wfp8_bf16_t128x128x128,0.0%,37.6835,flydsl_moe2_afp8_wfp8_bf16_t128x128x128_atomic,0.9%,72.1793,0,5.88,13157.21,0,
256,8,5120,384,161,9,ActivationType.Silu,torch.bfloat16,torch.float8_e4m3fn,torch.float8_e4m3fn,QuantType.per_Token,1,0,32,0,81.9906,flydsl_moe1_afp8_wfp8_bf16_t32x128x128,0.0%,0.0,flydsl_moe2_afp8_wfp8_bf16_t32x128x128_atomic,0.0%,81.9906,0,10.36,11583.52,0,
256,16,5120,384,161,9,ActivationType.Silu,torch.bfloat16,torch.float8_e4m3fn,torch.float8_e4m3fn,QuantType.per_Token,1,0,32,0,104.8534,flydsl_moe1_afp8_wfp8_bf16_t32x128x128,0.0%,0.0,flydsl_moe2_afp8_wfp8_bf16_t32x128x128_atomic,0.0%,104.8534,0,16.2,9058.96,0,
256,32,5120,384,161,9,ActivationType.Silu,torch.bfloat16,torch.float8_e4m3fn,torch.float8_e4m3fn,QuantType.per_Token,1,0,32,0,151.0344,flydsl_moe1_afp8_wfp8_bf16_t32x128x128,0.0%,0.0,flydsl_moe2_afp8_wfp8_bf16_t32x128x128_atomic,0.0%,151.0344,0,22.49,6290.67,0,
256,64,5120,384,161,9,ActivationType.Silu,torch.bfloat16,torch.float8_e4m3fn,torch.float8_e4m3fn,QuantType.per_Token,1,0,32,0,161.8085,flydsl_moe1_afp8_wfp8_bf16_t32x128x128,0.0%,0.0,flydsl_moe2_afp8_wfp8_bf16_t32x128x128_atomic,0.0%,161.8085,0,41.99,5874.84,0,
256,128,5120,384,161,9,ActivationType.Silu,torch.bfloat16,torch.float8_e4m3fn,torch.float8_e4m3fn,QuantType.per_Token,1,0,32,0,171.963,flydsl_moe1_afp8_wfp8_bf16_t32x128x128,0.0%,0.0,flydsl_moe2_afp8_wfp8_bf16_t32x128x128_atomic,0.0%,171.963,0,79.03,5533.65,0,
256,256,5120,384,161,9,ActivationType.Silu,torch.bfloat16,torch.float8_e4m3fn,torch.float8_e4m3fn,QuantType.per_Token,1,0,32,0,176.1579,flydsl_moe1_afp8_wfp8_bf16_t32x128x128,0.0%,0.0,flydsl_moe2_afp8_wfp8_bf16_t32x128x128_atomic,0.0%,176.1579,0,154.29,5413.03,0,
256,512,5120,384,161,9,ActivationType.Silu,torch.bfloat16,torch.float8_e4m3fn,torch.float8_e4m3fn,QuantType.per_Token,1,0,32,0,200.297,flydsl_moe1_afp8_wfp8_bf16_t32x128x128,0.0%,0.0,flydsl_moe2_afp8_wfp8_bf16_t32x128x128_atomic,0.0%,200.297,0,271.39,4780.31,0,
256,1024,5120,384,161,9,ActivationType.Silu,torch.bfloat16,torch.float8_e4m3fn,torch.float8_e4m3fn,QuantType.per_Token,1,0,32,0,339.5852,flydsl_moe1_afp8_wfp8_bf16_t32x128x128,0.0%,0.0,flydsl_moe2_afp8_wfp8_bf16_t32x128x128_atomic,0.0%,339.5852,0,320.14,2842.72,0,
256,2048,5120,384,161,9,ActivationType.Silu,torch.bfloat16,torch.float8_e4m3fn,torch.float8_e4m3fn,QuantType.per_Token,1,0,128,0,168.1037,flydsl_moe1_afp8_wfp8_bf16_t128x128x128,0.0%,340.724,flydsl_moe2_afp8_wfp8_bf16_t128x128x128_atomic,0.9%,508.8277,0,427.32,1928.11,0,
256,4096,5120,384,161,9,ActivationType.Silu,torch.bfloat16,torch.float8_e4m3fn,torch.float8_e4m3fn,QuantType.per_Token,1,0,128,0,252.1445,flydsl_moe1_afp8_wfp8_bf16_t128x128x128,0.0%,632.8001,flydsl_moe2_afp8_wfp8_bf16_t128x128x128_atomic,0.9%,884.9446,0,491.4,1144.17,0,
256,8192,5120,384,161,9,ActivationType.Silu,torch.bfloat16,torch.float8_e4m3fn,torch.float8_e4m3fn,QuantType.per_Token,1,0,32,0,1532.449,flydsl_moe1_afp8_wfp8_bf16_t32x128x128,0.0%,0.0,flydsl_moe2_afp8_wfp8_bf16_t32x128x128_atomic,0.0%,1532.449,0,567.54,701.78,0,
256,16384,5120,384,161,9,ActivationType.Silu,torch.bfloat16,torch.float8_e4m3fn,torch.float8_e4m3fn,QuantType.per_Token,1,0,32,0,2556.3688,flydsl_moe1_afp8_wfp8_bf16_t32x128x128,0.0%,0.0,flydsl_moe2_afp8_wfp8_bf16_t32x128x128_atomic,0.0%,2556.3688,0,680.44,469.91,0,
256,32768,5120,384,161,9,ActivationType.Silu,torch.bfloat16,torch.float8_e4m3fn,torch.float8_e4m3fn,QuantType.per_Token,1,0,32,0,4621.308,flydsl_moe1_afp8_wfp8_bf16_t32x128x128,0.0%,0.0,flydsl_moe2_afp8_wfp8_bf16_t32x128x128_atomic,0.0%,4621.308,0,752.8,314.4,0,
256,1,5120,192,161,9,ActivationType.Silu,torch.bfloat16,torch.float8_e4m3fn,torch.float8_e4m3fn,QuantType.per_Token,1,0,32,0,68.2571,flydsl_moe1_afp8_wfp8_bf16_t32x64x128,0.0%,0.0,flydsl_moe2_afp8_wfp8_bf16_t32x128x64_atomic,0.0%,68.2571,0,0.78,6956.4,0,
256,2,5120,192,161,9,ActivationType.Silu,torch.bfloat16,torch.float8_e4m3fn,torch.float8_e4m3fn,QuantType.per_Token,1,0,32,0,68.9526,flydsl_moe1_afp8_wfp8_bf16_t32x64x128,0.0%,0.0,flydsl_moe2_afp8_wfp8_bf16_t32x128x64_atomic,0.0%,68.9526,0,1.54,6886.46,0,
256,4,5120,192,161,9,ActivationType.Silu,torch.bfloat16,torch.float8_e4m3fn,torch.float8_e4m3fn,QuantType.per_Token,1,0,32,0,70.0571,flydsl_moe1_afp8_wfp8_bf16_t32x64x128,0.0%,0.0,flydsl_moe2_afp8_wfp8_bf16_t32x128x64_atomic,0.0%,70.0571,0,3.03,6778.32,0,
256,8,5120,192,161,9,ActivationType.Silu,torch.bfloat16,torch.float8_e4m3fn,torch.float8_e4m3fn,QuantType.per_Token,1,0,32,0,73.5062,flydsl_moe1_afp8_wfp8_bf16_t32x64x128,0.0%,0.0,flydsl_moe2_afp8_wfp8_bf16_t32x128x64_atomic,0.0%,73.5062,0,5.78,6461.1,0,
256,16,5120,192,161,9,ActivationType.Silu,torch.bfloat16,torch.float8_e4m3fn,torch.float8_e4m3fn,QuantType.per_Token,1,0,32,0,78.1401,flydsl_moe1_afp8_wfp8_bf16_t32x64x128,0.0%,0.0,flydsl_moe2_afp8_wfp8_bf16_t32x128x64_atomic,0.0%,78.1401,0,10.87,6079.52,0,
256,32,5120,192,161,9,ActivationType.Silu,torch.bfloat16,torch.float8_e4m3fn,torch.float8_e4m3fn,QuantType.per_Token,1,0,32,0,89.5595,flydsl_moe1_afp8_wfp8_bf16_t32x64x128,0.0%,0.0,flydsl_moe2_afp8_wfp8_bf16_t32x128x64_atomic,0.0%,89.5595,0,18.97,5307.08,0,
256,64,5120,192,161,9,ActivationType.Silu,torch.bfloat16,torch.float8_e4m3fn,torch.float8_e4m3fn,QuantType.per_Token,1,0,32,0,95.7356,flydsl_moe1_afp8_wfp8_bf16_t32x64x128,0.0%,0.0,flydsl_moe2_afp8_wfp8_bf16_t32x128x64_atomic,0.0%,95.7356,0,35.49,4969.85,0,
256,128,5120,192,161,9,ActivationType.Silu,torch.bfloat16,torch.float8_e4m3fn,torch.float8_e4m3fn,QuantType.per_Token,1,0,32,0,97.2076,flydsl_moe1_afp8_wfp8_bf16_t32x64x128,0.0%,0.0,flydsl_moe2_afp8_wfp8_bf16_t32x128x64_atomic,0.0%,97.2076,0,69.9,4904.7,0,
256,256,5120,192,161,9,ActivationType.Silu,torch.bfloat16,torch.float8_e4m3fn,torch.float8_e4m3fn,QuantType.per_Token,1,0,32,0,103.2961,flydsl_moe1_afp8_wfp8_bf16_t32x64x128,0.0%,0.0,flydsl_moe2_afp8_wfp8_bf16_t32x128x64_atomic,0.0%,103.2961,0,131.56,4634.64,0,
256,512,5120,192,161,9,ActivationType.Silu,torch.bfloat16,torch.float8_e4m3fn,torch.float8_e4m3fn,QuantType.per_Token,1,0,32,0,115.3773,flydsl_moe1_afp8_wfp8_bf16_t32x64x128,0.0%,0.0,flydsl_moe2_afp8_wfp8_bf16_t32x128x64_atomic,0.0%,115.3773,0,235.57,4183.43,0,
256,1024,5120,192,161,9,ActivationType.Silu,torch.bfloat16,torch.float8_e4m3fn,torch.float8_e4m3fn,QuantType.per_Token,1,0,32,0,211.4378,flydsl_moe1_afp8_wfp8_bf16_t32x64x128,0.0%,0.0,flydsl_moe2_afp8_wfp8_bf16_t32x128x64_atomic,0.0%,211.4378,0,257.09,2320.01,0,
256,2048,5120,192,161,9,ActivationType.Silu,torch.bfloat16,torch.float8_e4m3fn,torch.float8_e4m3fn,QuantType.per_Token,1,0,32,0,345.1372,flydsl_moe1_afp8_wfp8_bf16_t32x64x128,0.0%,0.0,flydsl_moe2_afp8_wfp8_bf16_t32x128x64_atomic,0.0%,345.1372,0,314.99,1466.85,0,
256,4096,5120,192,161,9,ActivationType.Silu,torch.bfloat16,torch.float8_e4m3fn,torch.float8_e4m3fn,QuantType.per_Token,1,0,32,0,608.2785,flydsl_moe1_afp8_wfp8_bf16_t32x64x128,0.0%,0.0,flydsl_moe2_afp8_wfp8_bf16_t32x128x64_atomic,0.0%,608.2785,0,357.46,884.01,0,
256,8192,5120,192,161,9,ActivationType.Silu,torch.bfloat16,torch.float8_e4m3fn,torch.float8_e4m3fn,QuantType.per_Token,1,0,32,0,1006.4097,flydsl_moe1_afp8_wfp8_bf16_t32x64x128,0.0%,0.0,flydsl_moe2_afp8_wfp8_bf16_t32x128x64_atomic,0.0%,1006.4097,0,432.1,596.81,0,
256,16384,5120,192,161,9,ActivationType.Silu,torch.bfloat16,torch.float8_e4m3fn,torch.float8_e4m3fn,QuantType.per_Token,1,0,32,0,1783.2552,flydsl_moe1_afp8_wfp8_bf16_t32x64x128,0.0%,0.0,flydsl_moe2_afp8_wfp8_bf16_t32x128x64_atomic,0.0%,1783.2552,0,487.72,407.38,0,
256,32768,5120,192,161,9,ActivationType.Silu,torch.bfloat16,torch.float8_e4m3fn,torch.float8_e4m3fn,QuantType.per_Token,1,0,32,0,3018.9246,flydsl_moe1_afp8_wfp8_bf16_t32x64x128,0.0%,0.0,flydsl_moe2_afp8_wfp8_bf16_t32x128x64_atomic,0.0%,3018.9246,0,576.19,324.0,0,
