aiter/configs/model_configs/glm5_mxfp4_tp4_tuned_fmoe.csv
gfx,cu_num,token,model_dim,inter_dim,expert,topk,act_type,dtype,q_dtype_a,q_dtype_w,q_type,use_g1u1,doweight_stage1,block_m,ksplit,us1,kernelName1,err1,us2,kernelName2,err2,us,run_1stage,xbf16,flat,tflops,bw,_tag
gfx950,256,1,6144,512,257,9,ActivationType.Silu,torch.bfloat16,torch.float4_e2m1fn_x2,torch.float4_e2m1fn_x2,QuantType.per_1x32,1,0,32,0,18.0,flydsl_moe1_afp4_wfp4_bf16_t32x64x256_w3_fp4,20.0%,9.5,flydsl_moe2_afp4_wfp4_bf16_t32x128x256_atomic,1.5%,27.5,0,0,0,0.0,0.0,
gfx950,256,2,6144,512,257,9,ActivationType.Silu,torch.bfloat16,torch.float4_e2m1fn_x2,torch.float4_e2m1fn_x2,QuantType.per_1x32,1,0,32,0,18.0,flydsl_moe1_afp4_wfp4_bf16_t32x64x256_w3_fp4,20.0%,9.5,flydsl_moe2_afp4_wfp4_bf16_t32x128x256_atomic,1.5%,27.5,0,0,0,0.0,0.0,
gfx950,256,4,6144,512,257,9,ActivationType.Silu,torch.bfloat16,torch.float4_e2m1fn_x2,torch.float4_e2m1fn_x2,QuantType.per_1x32,1,0,32,0,28.5005,flydsl_moe1_afp4_wfp4_bf16_t32x32x256_w3_fp4,20.0%,19.299,flydsl_moe2_afp4_wfp4_bf16_t32x128x256_atomic,1.5%,47.7995,0,0,0,0.0,0.0,
gfx950,256,8,6144,512,257,9,ActivationType.Silu,torch.bfloat16,torch.float4_e2m1fn_x2,torch.float4_e2m1fn_x2,QuantType.per_1x32,1,0,32,0,54.3584,flydsl_moe1_afp4_wfp4_bf16_t32x64x256_w3,20.0%,30.4539,flydsl_moe2_afp4_wfp4_bf16_t32x128x256_atomic,1.5%,84.8123,0,0,0,0.0,0.0,
gfx950,256,16,6144,512,257,9,ActivationType.Silu,torch.bfloat16,torch.float4_e2m1fn_x2,torch.float4_e2m1fn_x2,QuantType.per_1x32,1,0,32,0,96.3987,flydsl_moe1_afp4_wfp4_bf16_t32x32x256_w3,20.0%,51.0459,flydsl_moe2_afp4_wfp4_bf16_t32x128x256_atomic,1.5%,147.4446,0,0,0,0.0,0.0,
gfx950,256,32,6144,512,257,9,ActivationType.Silu,torch.bfloat16,torch.float4_e2m1fn_x2,torch.float4_e2m1fn_x2,QuantType.per_1x32,1,0,32,0,163.055,flydsl_moe1_afp4_wfp4_bf16_t32x64x256_w3,20.0%,89.1386,flydsl_moe2_afp4_wfp4_bf16_t32x256x256_atomic_persist,1.5%,252.1936,0,0,0,0.0,0.0,
gfx950,256,64,6144,512,257,9,ActivationType.Silu,torch.bfloat16,torch.float4_e2m1fn_x2,torch.float4_e2m1fn_x2,QuantType.per_1x32,1,0,32,0,161.46699999999998,flydsl_moe1_afp4_wfp4_bf16_t32x64x256_w3,20.0%,90.7529,flydsl_moe2_afp4_wfp4_bf16_t32x256x256_atomic_persist,1.5%,252.2199,0,0,0,0.0,0.0,
gfx950,256,128,6144,512,257,9,ActivationType.Silu,torch.bfloat16,torch.float4_e2m1fn_x2,torch.float4_e2m1fn_x2,QuantType.per_1x32,1,0,32,0,164.0521,flydsl_moe1_afp4_wfp4_bf16_t32x64x256_w3,20.0%,93.291,flydsl_moe2_afp4_wfp4_bf16_t32x256x256_atomic,1.5%,257.3431,0,0,0,0.0,0.0,
gfx950,256,256,6144,512,257,9,ActivationType.Silu,torch.bfloat16,torch.float4_e2m1fn_x2,torch.float4_e2m1fn_x2,QuantType.per_1x32,1,0,32,0,166.8846,flydsl_moe1_afp4_wfp4_bf16_t32x64x256_w3,20.0%,97.1827,flydsl_moe2_afp4_wfp4_bf16_t32x256x256_atomic_persist,1.5%,264.0673,0,0,0,0.0,0.0,
gfx950,256,512,6144,512,257,9,ActivationType.Silu,torch.bfloat16,torch.float4_e2m1fn_x2,torch.float4_e2m1fn_x2,QuantType.per_1x32,1,0,32,0,170.0333,flydsl_moe1_afp4_wfp4_bf16_t32x64x256_w3,20.0%,106.3422,flydsl_moe2_afp4_wfp4_bf16_t32x256x256_atomic,1.5%,276.3755,0,0,0,0.0,0.0,
gfx950,256,576,6144,512,257,9,ActivationType.Silu,torch.bfloat16,torch.float4_e2m1fn_x2,torch.float4_e2m1fn_x2,QuantType.per_1x32,1,0,32,0,191.2874625,flydsl_moe1_afp4_wfp4_bf16_t32x64x256_w3,20.0%,119.634975,flydsl_moe2_afp4_wfp4_bf16_t32x256x256_atomic,1.5%,310.9224375,0,0,0,0.0,0.0,
gfx950,256,64,6144,256,257,9,ActivationType.Silu,torch.bfloat16,torch.float4_e2m1fn_x2,torch.float4_e2m1fn_x2,QuantType.per_1x32,1,0,32,0,73.4112,flydsl_moe1_afp4_wfp4_bf16_t32x128x256_w3,0.0%,45.9898,flydsl_moe2_afp4_wfp4_bf16_t16x128x128_atomic_persist_sbm32,0.8%,119.401,0,0,0,45.53,10166.23,
gfx950,256,32,6144,256,257,9,ActivationType.Silu,torch.bfloat16,torch.float4_e2m1fn_x2,torch.float4_e2m1fn_x2,QuantType.per_1x32,1,0,32,0,54.4697,flydsl_moe1_afp4_wfp4_bf16_t32x64x256_w3,0.0%,34.9399,flydsl_moe2_afp4_wfp4_bf16_t32x256x256_reduce_persist,0.0%,89.4096,0,0,0,30.4,13569.77,
gfx950,256,16,6144,256,257,9,ActivationType.Silu,torch.bfloat16,torch.float4_e2m1fn_x2,torch.float4_e2m1fn_x2,QuantType.per_1x32,1,0,64,0,34.5642,flydsl_moe1_afp4_wfp4_bf16_t64x128x256_w4_fp4,0.9%,26.3083,flydsl_moe2_afp4_wfp4_bf16_t64x256x128_reduce,0.0%,60.8725,0,0,0,22.32,19926.45,
gfx950,256,8,6144,256,257,9,ActivationType.Silu,torch.bfloat16,torch.float4_e2m1fn_x2,torch.float4_e2m1fn_x2,QuantType.per_1x32,1,0,32,0,27.0326,flydsl_moe1_afp4_wfp4_bf16_t32x128x256_w3,0.0%,17.5345,flydsl_moe2_afp4_wfp4_bf16_t32x128x256_reduce,0.0%,44.5671,0,0,0,15.25,27213.47,
gfx950,256,4,6144,256,257,9,ActivationType.Silu,torch.bfloat16,torch.float4_e2m1fn_x2,torch.float4_e2m1fn_x2,QuantType.per_1x32,1,0,32,0,25.0767,flydsl_moe1_afp4_wfp4_bf16_t32x128x256_w3,0.0%,11.9893,moe_ck2stages_gemm2_64x32x32x128_1x1_MulABScaleExpertWeightShuffled_v1_Nswizzle0_Quant3_MulRoutedWeight1_FP4X2_FP4X2_B16,1.0%,37.066,0,0,0,9.17,32718.71,
gfx950,256,2,6144,256,257,9,ActivationType.Silu,torch.bfloat16,torch.float4_e2m1fn_x2,torch.float4_e2m1fn_x2,QuantType.per_1x32,1,0,32,0,16.7698,flydsl_moe1_afp4_wfp4_bf16_t32x128x256_w3_kb4_bnt0_xcd4_fp4,12.4%,8.5594,moe_ck2stages_gemm2_256x32x128x128_1x4_MulABScaleExpertWeightShuffled_v3_Nswizzle0_Quant3_MulRoutedWeight1_FP4X2_FP4X2_B16,1.1%,25.3292,0,0,0,6.71,47878.14,
gfx950,256,1,6144,256,257,9,ActivationType.Silu,torch.bfloat16,torch.float4_e2m1fn_x2,torch.float4_e2m1fn_x2,QuantType.per_1x32,1,0,32,0,14.5322,flydsl_moe1_afp4_wfp4_bf16_t32x64x256_w3_kb4_bnt0_xcd4_fp4,15.2%,6.4728,moe_ck2stages_gemm2_256x32x128x128_1x4_MulABScaleExpertWeightShuffled_v3_Nswizzle0_Quant3_MulRoutedWeight1_FP4X2_FP4X2_B16,1.0%,21.005,0,0,0,4.04,57733.71,
gfx950,256,8192,6144,256,257,9,ActivationType.Silu,torch.bfloat16,torch.float4_e2m1fn_x2,torch.float4_e2m1fn_x2,QuantType.per_1x32,1,0,64,0,230.1101,flydsl_moe1_afp4_wfp4_bf16_t64x128x256_w3_bnt0_xcd4,0.0%,482.3631,flydsl_moe2_afp4_wfp4_bf16_t64x256x256_reduce,0.0%,712.4732,0,0,0,976.58,1914.0,
gfx950,256,16384,6144,256,257,9,ActivationType.Silu,torch.bfloat16,torch.float4_e2m1fn_x2,torch.float4_e2m1fn_x2,QuantType.per_1x32,1,0,64,0,374.5514,flydsl_moe1_afp4_wfp4_bf16_t64x128x256_w4_bnt0_xcd4,0.0%,973.809,flydsl_moe2_afp4_wfp4_bf16_t64x256x256_reduce_bnt2_persist,0.0%,1348.3604,0,0,0,1032.05,1123.34,
gfx950,256,4096,6144,256,257,9,ActivationType.Silu,torch.bfloat16,torch.float4_e2m1fn_x2,torch.float4_e2m1fn_x2,QuantType.per_1x32,1,0,64,0,156.3893,flydsl_moe1_afp4_wfp4_bf16_t64x128x256_w3_bnt0_xcd4,0.0%,266.3533,flydsl_moe2_afp4_wfp4_bf16_t64x256x256_reduce_bnt2_persist,0.0%,422.7426,0,0,0,822.94,3047.19,
gfx950,256,2048,6144,256,257,9,ActivationType.Silu,torch.bfloat16,torch.float4_e2m1fn_x2,torch.float4_e2m1fn_x2,QuantType.per_1x32,1,0,128,0,117.0462,flydsl_moe1_afp4_wfp4_bf16_t128x128x256_w2,0.0%,156.651,flydsl_moe2_afp4_wfp4_bf16_t64x256x256_reduce_persist_sbm128,0.0%,273.6972,0,0,0,635.54,4568.65,
gfx950,256,1024,6144,256,257,9,ActivationType.Silu,torch.bfloat16,torch.float4_e2m1fn_x2,torch.float4_e2m1fn_x2,QuantType.per_1x32,1,0,64,0,94.7139,flydsl_moe1_afp4_wfp4_bf16_t64x128x256_w2,0.0%,98.5371,flydsl_moe2_afp4_wfp4_bf16_t64x256x256_reduce_persist,0.0%,193.251,0,0,0,450.05,6372.81,
gfx950,256,512,6144,256,257,9,ActivationType.Silu,torch.bfloat16,torch.float4_e2m1fn_x2,torch.float4_e2m1fn_x2,QuantType.per_1x32,1,0,64,0,89.36399999999999,flydsl_moe1_afp4_wfp4_bf16_t64x128x256_w3,0.0%,66.7314,flydsl_moe2_afp4_wfp4_bf16_t32x128x128_atomic_bnt2_sbm64,0.8%,156.0954,0,0,0,278.59,7829.28,
gfx950,256,512,6144,256,257,9,ActivationType.Silu,torch.bfloat16,torch.float4_e2m1fn_x2,torch.float4_e2m1fn_x2,QuantType.per_1x32,1,0,32,0,99.2714,moe_ck2stages_gemm1_64x32x32x128_1x1_MulABScaleShuffled_v3_Nswizzle0_Quant3_MulRoutedWeight0_silu_FP4X2_FP4X2_B16,0.0,67.0698,moe_ck2stages_gemm2_64x32x32x128_1x1_MulABScaleExpertWeightShuffled_v1_Nswizzle0_Quant3_MulRoutedWeight1_FP4X2_FP4X2_B16,0.0083,166.3412,0,0,0,0.0,0.0,flydsl_fallback
gfx950,256,1024,6144,256,257,9,ActivationType.Silu,torch.bfloat16,torch.float4_e2m1fn_x2,torch.float4_e2m1fn_x2,QuantType.per_1x32,1,0,32,0,115.1068,moe_ck2stages_gemm1_64x32x32x128_1x1_MulABScaleShuffled_v3_Nswizzle0_Quant3_MulRoutedWeight0_silu_FP4X2_FP4X2_B16,0.0,114.6177,moe_ck2stages_gemm2_64x32x32x128_1x1_MulABScaleExpertWeightShuffled_v1_Nswizzle0_Quant3_MulRoutedWeight1_FP4X2_FP4X2_B16,0.0083,229.7245,0,0,0,0.0,0.0,flydsl_fallback
gfx950,256,2048,6144,256,257,9,ActivationType.Silu,torch.bfloat16,torch.float4_e2m1fn_x2,torch.float4_e2m1fn_x2,QuantType.per_1x32,1,0,32,0,146.8057,moe_ck2stages_gemm1_64x32x32x128_1x1_MulABScaleShuffled_v3_Nswizzle0_Quant3_MulRoutedWeight0_silu_FP4X2_FP4X2_B16,0.0,221.5897,moe_ck2stages_gemm2_64x32x32x128_1x1_MulABScaleExpertWeightShuffled_v1_Nswizzle0_Quant3_MulRoutedWeight1_FP4X2_FP4X2_B16,0.0082,368.3954,0,0,0,0.0,0.0,flydsl_fallback
gfx950,256,4096,6144,256,257,9,ActivationType.Silu,torch.bfloat16,torch.float4_e2m1fn_x2,torch.float4_e2m1fn_x2,QuantType.per_1x32,1,0,128,0,197.6802,moe_ck2stages_gemm1_256x128x128x128_1x4_MulABScaleShuffled_v3_Nswizzle0_Quant3_MulRoutedWeight0_silu_FP4X2_FP4X2_B16,0.0,434.3608,moe_ck2stages_gemm2_64x128x128x128_1x1_MulABScaleExpertWeightShuffled_v3_Nswizzle0_Quant3_MulRoutedWeight1_FP4X2_FP4X2_B16,0.0082,632.041,0,0,0,0.0,0.0,flydsl_fallback
gfx950,256,16384,6144,256,257,9,ActivationType.Silu,torch.bfloat16,torch.float4_e2m1fn_x2,torch.float4_e2m1fn_x2,QuantType.per_1x32,1,0,64,0,480.9627,moe_ck2stages_gemm1_256x64x128x128_1x4_MulABScaleShuffled_v3_Nswizzle0_Quant3_MulRoutedWeight0_silu_FP4X2_FP4X2_B16,0.0,1619.698,moe_ck2stages_gemm2_64x64x128x128_1x1_MulABScaleExpertWeightShuffled_v3_Nswizzle0_Quant3_MulRoutedWeight1_FP4X2_FP4X2_B16,0.0082,2100.6607,0,0,0,0.0,0.0,flydsl_fallback
gfx950,256,8192,6144,256,257,9,ActivationType.Silu,torch.bfloat16,torch.float4_e2m1fn_x2,torch.float4_e2m1fn_x2,QuantType.per_1x32,1,0,128,0,324.85389999999995,moe_ck2stages_gemm1_256x128x128x128_1x4_MulABScaleShuffled_v3_Nswizzle0_Quant3_MulRoutedWeight0_silu_FP4X2_FP4X2_B16,0.0,816.6247,moe_ck2stages_gemm2_64x128x128x128_1x1_MulABScaleExpertWeightShuffled_v3_Nswizzle0_Quant3_MulRoutedWeight1_FP4X2_FP4X2_B16,0.0082,1141.4786,0,0,0,0.0,0.0,flydsl_fallback
gfx950,256,1,6144,256,257,9,ActivationType.Silu,torch.bfloat16,torch.float4_e2m1fn_x2,torch.float4_e2m1fn_x2,QuantType.per_1x32,1,0,32,0,21.1274,moe_ck2stages_gemm1_64x32x32x128_1x1_MulABScaleShuffled_v3_Nswizzle0_Quant3_MulRoutedWeight0_silu_FP4X2_FP4X2_B16,0.0,6.4728,moe_ck2stages_gemm2_256x32x128x128_1x4_MulABScaleExpertWeightShuffled_v3_Nswizzle0_Quant3_MulRoutedWeight1_FP4X2_FP4X2_B16,0.0099,27.6002,0,0,0,0.0,0.0,flydsl_fallback
gfx950,256,2,6144,256,257,9,ActivationType.Silu,torch.bfloat16,torch.float4_e2m1fn_x2,torch.float4_e2m1fn_x2,QuantType.per_1x32,1,0,32,0,23.4711,moe_ck2stages_gemm1_64x32x32x128_1x1_MulABScaleShuffled_v3_Nswizzle0_Quant3_MulRoutedWeight0_silu_FP4X2_FP4X2_B16,0.0,8.5594,moe_ck2stages_gemm2_256x32x128x128_1x4_MulABScaleExpertWeightShuffled_v3_Nswizzle0_Quant3_MulRoutedWeight1_FP4X2_FP4X2_B16,0.0112,32.0305,0,0,0,0.0,0.0,flydsl_fallback
gfx950,256,4,6144,256,257,9,ActivationType.Silu,torch.bfloat16,torch.float4_e2m1fn_x2,torch.float4_e2m1fn_x2,QuantType.per_1x32,1,0,32,0,26.9964,moe_ck2stages_gemm1_64x32x32x128_1x1_MulABScaleShuffled_v3_Nswizzle0_Quant3_MulRoutedWeight0_silu_FP4X2_FP4X2_B16,0.0,11.9893,moe_ck2stages_gemm2_64x32x32x128_1x1_MulABScaleExpertWeightShuffled_v1_Nswizzle0_Quant3_MulRoutedWeight1_FP4X2_FP4X2_B16,0.0101,38.9857,0,0,0,0.0,0.0,flydsl_fallback
gfx950,256,8,6144,256,257,9,ActivationType.Silu,torch.bfloat16,torch.float4_e2m1fn_x2,torch.float4_e2m1fn_x2,QuantType.per_1x32,1,0,32,0,29.0869,moe_ck2stages_gemm1_64x32x32x128_1x1_MulABScaleShuffled_v3_Nswizzle0_Quant3_MulRoutedWeight0_silu_FP4X2_FP4X2_B16,0.0,19.504,moe_ck2stages_gemm2_64x32x32x128_1x1_MulABScaleExpertWeightShuffled_v1_Nswizzle0_Quant3_MulRoutedWeight1_FP4X2_FP4X2_B16,0.0085,48.5909,0,0,0,0.0,0.0,flydsl_fallback
gfx950,256,16,6144,256,257,9,ActivationType.Silu,torch.bfloat16,torch.float4_e2m1fn_x2,torch.float4_e2m1fn_x2,QuantType.per_1x32,1,0,32,0,41.7081,moe_ck2stages_gemm1_256x32x128x128_1x4_MulABScaleShuffled_v3_Nswizzle0_Quant3_MulRoutedWeight0_silu_FP4X2_FP4X2_B16,0.0,26.1535,moe_ck2stages_gemm2_64x32x32x128_1x1_MulABScaleExpertWeightShuffled_v1_Nswizzle0_Quant3_MulRoutedWeight1_FP4X2_FP4X2_B16,0.0086,67.8616,0,0,0,0.0,0.0,flydsl_fallback
gfx950,256,32,6144,256,257,9,ActivationType.Silu,torch.bfloat16,torch.float4_e2m1fn_x2,torch.float4_e2m1fn_x2,QuantType.per_1x32,1,0,32,0,62.1238,moe_ck2stages_gemm1_64x32x32x128_1x1_MulABScaleShuffled_v3_Nswizzle0_Quant3_MulRoutedWeight0_silu_FP4X2_FP4X2_B16,0.0,34.9654,moe_ck2stages_gemm2_64x32x32x128_1x1_MulABScaleExpertWeightShuffled_v1_Nswizzle0_Quant3_MulRoutedWeight1_FP4X2_FP4X2_B16,0.0084,97.0892,0,0,0,0.0,0.0,flydsl_fallback
gfx950,256,64,6144,256,257,9,ActivationType.Silu,torch.bfloat16,torch.float4_e2m1fn_x2,torch.float4_e2m1fn_x2,QuantType.per_1x32,1,0,32,0,82.3257,moe_ck2stages_gemm1_256x32x128x128_1x4_MulABScaleShuffled_v3_Nswizzle0_Quant3_MulRoutedWeight0_silu_FP4X2_FP4X2_B16,0.0,47.6383,moe_ck2stages_gemm2_64x32x32x128_1x1_MulABScaleExpertWeightShuffled_v1_Nswizzle0_Quant3_MulRoutedWeight1_FP4X2_FP4X2_B16,0.0083,129.964,0,0,0,0.0,0.0,flydsl_fallback
