aiter/configs/model_configs/glm5_bf16_tuned_gemm.csv
gfx,cu_num,M,N,K,bias,dtype,outdtype,scaleAB,bpreshuffle,libtype,solidx,splitK,us,kernelName,err_ratio,tflops,bw
gfx950,256,1,32,6144,False,torch.bfloat16,torch.bfloat16,False,False,skinny,2,0,3.6447,sol2,0.0,0.11,111.28
gfx950,256,2,32,6144,False,torch.bfloat16,torch.bfloat16,False,False,skinny,2,0,4.1828,sol2,0.0,0.19,99.91
gfx950,256,4,32,6144,False,torch.bfloat16,torch.bfloat16,False,False,skinny,2,0,5.3618,sol2,0.0,0.29,82.55
gfx950,256,8,32,6144,False,torch.bfloat16,torch.bfloat16,False,False,torch,0,0,8.144,native,0.0,0.39,60.42
gfx950,256,16,32,6144,False,torch.bfloat16,torch.bfloat16,False,False,torch,0,0,7.4336,native,0.0,0.85,79.48
gfx950,256,32,32,6144,False,torch.bfloat16,torch.bfloat16,False,False,torch,0,0,7.6476,native,0.0,1.65,103.1
gfx950,256,48,32,6144,False,torch.bfloat16,torch.bfloat16,False,False,torch,0,0,11.9381,native,0.0,1.58,82.6
gfx950,256,64,32,6144,False,torch.bfloat16,torch.bfloat16,False,False,torch,0,0,8.6076,native,0.0,2.92,137.52
gfx950,256,128,32,6144,False,torch.bfloat16,torch.bfloat16,False,False,torch,0,0,8.8833,native,0.0,5.67,222.25
gfx950,256,256,32,6144,False,torch.bfloat16,torch.bfloat16,False,False,torch,0,0,11.4673,native,0.0,8.78,310.04
gfx950,256,16384,32,6144,False,torch.bfloat16,torch.bfloat16,False,False,torch,0,0,43.7785,native,0.0,147.16,4631.69
gfx950,256,1,128,6144,False,torch.bfloat16,torch.bfloat16,False,False,skinny,2,0,3.4998,sol2,0.0,0.45,453.0
gfx950,256,2,128,6144,False,torch.bfloat16,torch.bfloat16,False,False,skinny,2,0,4.3388,sol2,0.0,0.73,368.29
gfx950,256,4,128,6144,False,torch.bfloat16,torch.bfloat16,False,False,flydsl,6998,12,4.5676,flydsl_gemm4_abf16_wbf16_bf16_t16x64x128_split_k12_block_m_warp1_block_n_warp2_block_k_warp1_async_copyTrue_b_to_ldsTrue_b_preshuffleFalse_c_to_ldsFalse_gfx950,0.0176,1.38,355.34
gfx950,256,8,128,6144,False,torch.bfloat16,torch.bfloat16,False,False,flydsl,6998,12,4.6225,flydsl_gemm4_abf16_wbf16_bf16_t16x64x128_split_k12_block_m_warp1_block_n_warp2_block_k_warp1_async_copyTrue_b_to_ldsTrue_b_preshuffleFalse_c_to_ldsFalse_gfx950,0.0225,2.72,361.97
gfx950,256,16,128,6144,False,torch.bfloat16,torch.bfloat16,False,False,flydsl,6998,12,4.6691,flydsl_gemm4_abf16_wbf16_bf16_t16x64x128_split_k12_block_m_warp1_block_n_warp2_block_k_warp1_async_copyTrue_b_to_ldsTrue_b_preshuffleFalse_c_to_ldsFalse_gfx950,0.0278,5.39,379.85
gfx950,256,32,128,6144,False,torch.bfloat16,torch.bfloat16,False,False,flydsl,10391,12,4.7569,flydsl_gemm5_abf16_wbf16_bf16_t32x64x64_split_k12_block_m_warp2_block_n_warp2_block_k_warp1_async_copyTrue_b_to_ldsTrue_b_preshuffleFalse_c_to_ldsFalse_gfx950,0.0266,10.58,415.03
gfx950,256,48,128,6144,False,torch.bfloat16,torch.bfloat16,False,False,flydsl,6996,12,4.8277,flydsl_gemm4_abf16_wbf16_bf16_t16x64x128_split_k12_block_m_warp1_block_n_warp1_block_k_warp2_async_copyTrue_b_to_ldsTrue_b_preshuffleFalse_c_to_ldsFalse_gfx950,0.0322,15.64,450.52
gfx950,256,64,128,6144,False,torch.bfloat16,torch.bfloat16,False,False,flydsl,6381,12,5.2326,flydsl_gemm3_abf16_wbf16_bf16_t32x64x128_split_k12_block_m_warp1_block_n_warp4_block_k_warp1_async_copyTrue_b_to_ldsTrue_b_preshuffleFalse_c_to_ldsFalse_gfx950,0.0253,19.24,454.02
gfx950,256,128,128,6144,False,torch.bfloat16,torch.bfloat16,False,False,flydsl,11949,12,6.3923,flydsl_gemm4_abf16_wbf16_bf16_t32x64x128_split_k12_block_m_warp1_block_n_warp2_block_k_warp1_async_copyTrue_b_to_ldsTrue_b_preshuffleFalse_c_to_ldsFalse_gfx950,0.0245,31.5,497.24
gfx950,256,256,128,6144,False,torch.bfloat16,torch.bfloat16,False,False,flydsl,11078,8,7.2723,flydsl_gemm4_abf16_wbf16_bf16_t16x64x128_split_k8_block_m_warp1_block_n_warp1_block_k_warp2_async_copyTrue_b_to_ldsTrue_b_preshuffleFalse_c_to_ldsFalse_gfx950,0.029,55.37,657.86
gfx950,256,16384,128,6144,False,torch.bfloat16,torch.bfloat16,False,False,torch,0,0,55.1119,native,0.0,467.59,3757.7
gfx950,256,1,256,6144,False,torch.bfloat16,torch.bfloat16,False,False,skinny,2,0,4.427,sol2,0.0,0.71,713.47
gfx950,256,2,256,6144,False,torch.bfloat16,torch.bfloat16,False,False,skinny,2,0,4.8487,sol2,0.0,1.3,654.06
gfx950,256,4,256,6144,False,torch.bfloat16,torch.bfloat16,False,False,flydsl,14285,12,5.2057,flydsl_gemm5_abf16_wbf16_bf16_t16x64x64_split_k12_block_m_warp1_block_n_warp2_block_k_warp1_async_copyTrue_b_to_ldsTrue_b_preshuffleFalse_c_to_ldsFalse_gfx950,0.0205,2.42,614.12
gfx950,256,8,256,6144,False,torch.bfloat16,torch.bfloat16,False,False,flydsl,10239,12,5.2445,flydsl_gemm4_abf16_wbf16_bf16_t16x64x128_split_k12_block_m_warp1_block_n_warp2_block_k_warp1_async_copyTrue_b_to_ldsTrue_b_preshuffleFalse_c_to_ldsFalse_gfx950,0.0254,4.8,619.34
gfx950,256,16,256,6144,False,torch.bfloat16,torch.bfloat16,False,False,flydsl,10239,12,5.3242,flydsl_gemm4_abf16_wbf16_bf16_t16x64x128_split_k12_block_m_warp1_block_n_warp2_block_k_warp1_async_copyTrue_b_to_ldsTrue_b_preshuffleFalse_c_to_ldsFalse_gfx950,0.0271,9.45,629.3
gfx950,256,32,256,6144,False,torch.bfloat16,torch.bfloat16,False,False,flydsl,6525,12,5.8519,flydsl_gemm3_abf16_wbf16_bf16_t32x64x128_split_k12_block_m_warp2_block_n_warp1_block_k_warp2_async_copyTrue_b_to_ldsTrue_b_preshuffleFalse_c_to_ldsFalse_gfx950,0.0277,17.2,607.55
gfx950,256,48,256,6144,False,torch.bfloat16,torch.bfloat16,False,False,flydsl,6521,12,6.19,flydsl_gemm3_abf16_wbf16_bf16_t32x64x128_split_k12_block_m_warp1_block_n_warp4_block_k_warp1_async_copyTrue_b_to_ldsTrue_b_preshuffleFalse_c_to_ldsFalse_gfx950,0.0261,24.39,607.45
gfx950,256,64,256,6144,False,torch.bfloat16,torch.bfloat16,False,False,flydsl,14921,12,6.5063,flydsl_gemm4_abf16_wbf16_bf16_t32x64x128_split_k12_block_m_warp1_block_n_warp4_block_k_warp1_async_copyTrue_b_to_ldsTrue_b_preshuffleFalse_c_to_ldsFalse_gfx950,0.0255,30.94,609.4
gfx950,256,128,256,6144,False,torch.bfloat16,torch.bfloat16,False,False,flydsl,15749,8,7.1835,flydsl_gemm4_abf16_wbf16_bf16_t16x64x128_split_k8_block_m_warp1_block_n_warp2_block_k_warp1_async_copyTrue_b_to_ldsTrue_b_preshuffleFalse_c_to_ldsFalse_gfx950,0.0197,56.05,665.99
gfx950,256,256,256,6144,False,torch.bfloat16,torch.bfloat16,False,False,flydsl,15737,4,9.1991,flydsl_gemm4_abf16_wbf16_bf16_t16x64x128_split_k4_block_m_warp1_block_n_warp2_block_k_warp1_async_copyTrue_b_to_ldsTrue_b_preshuffleFalse_c_to_ldsFalse_gfx950,0.0136,87.54,698.17
gfx950,256,16384,256,6144,False,torch.bfloat16,torch.bfloat16,False,False,flydsl,14628,1,75.6722,flydsl_gemm4_abf16_wbf16_bf16_t128x128x64_split_k1_block_m_warp2_block_n_warp4_block_k_warp1_async_copyTrue_b_to_ldsTrue_b_preshuffleFalse_c_to_ldsFalse_gfx950,0.0,681.09,2812.93
gfx950,256,1,2624,6144,False,torch.bfloat16,torch.bfloat16,False,False,flydsl,3276,6,8.3873,flydsl_gemm4_abf16_wbf16_bf16_t16x64x128_split_k6_block_m_warp1_block_n_warp2_block_k_warp1_async_copyTrue_b_to_ldsTrue_b_preshuffleFalse_c_to_ldsFalse_gfx950,0.0145,3.84,3846.44
gfx950,256,2,2624,6144,False,torch.bfloat16,torch.bfloat16,False,False,flydsl,4728,6,8.5103,flydsl_gemm5_abf16_wbf16_bf16_t16x64x64_split_k6_block_m_warp1_block_n_warp1_block_k_warp1_async_copyTrue_b_to_ldsTrue_b_preshuffleFalse_c_to_ldsFalse_gfx950,0.0152,7.58,3792.91
gfx950,256,4,2624,6144,False,torch.bfloat16,torch.bfloat16,False,False,flydsl,1755,6,8.3934,flydsl_gemm3_abf16_wbf16_bf16_t16x64x128_split_k6_block_m_warp1_block_n_warp1_block_k_warp2_async_copyTrue_b_to_ldsTrue_b_preshuffleFalse_c_to_ldsFalse_gfx950,0.0221,15.37,3849.91
gfx950,256,8,2624,6144,False,torch.bfloat16,torch.bfloat16,False,False,flydsl,4669,6,8.8102,flydsl_gemm5_abf16_wbf16_bf16_t16x64x128_split_k6_block_m_warp1_block_n_warp2_block_k_warp1_async_copyTrue_b_to_ldsTrue_b_preshuffleFalse_c_to_ldsFalse_gfx950,0.0174,29.28,3675.74
gfx950,256,16,2624,6144,False,torch.bfloat16,torch.bfloat16,False,False,flydsl,1757,6,9.3605,flydsl_gemm3_abf16_wbf16_bf16_t16x64x128_split_k6_block_m_warp1_block_n_warp2_block_k_warp1_async_copyTrue_b_to_ldsTrue_b_preshuffleFalse_c_to_ldsFalse_gfx950,0.0173,55.11,3474.63
gfx950,256,32,2624,6144,False,torch.bfloat16,torch.bfloat16,False,False,flydsl,3452,4,11.2994,flydsl_gemm4_abf16_wbf16_bf16_t32x64x128_split_k4_block_m_warp2_block_n_warp1_block_k_warp1_async_copyTrue_b_to_ldsTrue_b_preshuffleFalse_c_to_ldsFalse_gfx950,0.0122,91.31,2903.24
gfx950,256,48,2624,6144,False,torch.bfloat16,torch.bfloat16,False,False,flydsl,5146,4,13.5678,flydsl_gemm5_abf16_wbf16_bf16_t48x64x64_split_k4_block_m_warp1_block_n_warp2_block_k_warp1_async_copyTrue_b_to_ldsTrue_b_preshuffleFalse_c_to_ldsFalse_gfx950,0.0128,114.07,2438.53
gfx950,256,64,2624,6144,False,torch.bfloat16,torch.bfloat16,False,False,flydsl,5376,4,14.1368,flydsl_gemm4_abf16_wbf16_bf16_t64x64x128_split_k4_block_m_warp2_block_n_warp2_block_k_warp2_async_copyTrue_b_to_ldsTrue_b_preshuffleFalse_c_to_ldsFalse_gfx950,0.0204,145.97,2360.22
gfx950,256,128,2624,6144,False,torch.bfloat16,torch.bfloat16,False,False,asm,5,3,18.3003,_ZN5aiter39bf16gemm_fp32bf16_tn_64x64_splitk_cleanE,0.0102,225.53,1884.58
gfx950,256,256,2624,6144,False,torch.bfloat16,torch.bfloat16,False,False,asm,8,2,25.6797,_ZN5aiter39bf16gemm_fp32bf16_tn_96x64_splitk_cleanE,0.0057,321.44,1430.43
gfx950,256,16384,2624,6144,False,torch.bfloat16,torch.bfloat16,False,False,torch,0,0,398.5366,native,0.0,1325.55,801.82
gfx950,256,1,4096,2048,False,torch.bfloat16,torch.bfloat16,False,False,flydsl,5857,2,6.1272,flydsl_gemm4_abf16_wbf16_bf16_t16x64x128_split_k2_block_m_warp1_block_n_warp1_block_k_warp2_async_copyTrue_b_to_ldsTrue_b_preshuffleFalse_c_to_ldsFalse_gfx950,0.0066,2.74,2740.16
gfx950,256,2,4096,2048,False,torch.bfloat16,torch.bfloat16,False,False,flydsl,5913,4,6.1957,flydsl_gemm4_abf16_wbf16_bf16_t16x64x64_split_k4_block_m_warp1_block_n_warp2_block_k_warp1_async_copyTrue_b_to_ldsTrue_b_preshuffleFalse_c_to_ldsFalse_gfx950,0.0078,5.42,2711.85
gfx950,256,4,4096,2048,False,torch.bfloat16,torch.bfloat16,False,False,flydsl,5913,4,6.361,flydsl_gemm4_abf16_wbf16_bf16_t16x64x64_split_k4_block_m_warp1_block_n_warp2_block_k_warp1_async_copyTrue_b_to_ldsTrue_b_preshuffleFalse_c_to_ldsFalse_gfx950,0.0089,10.55,2645.24
gfx950,256,8,4096,2048,False,torch.bfloat16,torch.bfloat16,False,False,flydsl,8177,4,6.6814,flydsl_gemm5_abf16_wbf16_bf16_t16x64x64_split_k4_block_m_warp1_block_n_warp2_block_k_warp1_async_copyTrue_b_to_ldsTrue_b_preshuffleFalse_c_to_ldsFalse_gfx950,0.0089,20.09,2525.75
gfx950,256,16,4096,2048,False,torch.bfloat16,torch.bfloat16,False,False,flydsl,5857,2,6.9893,flydsl_gemm4_abf16_wbf16_bf16_t16x64x128_split_k2_block_m_warp1_block_n_warp1_block_k_warp2_async_copyTrue_b_to_ldsTrue_b_preshuffleFalse_c_to_ldsFalse_gfx950,0.0085,38.41,2428.54
gfx950,256,32,4096,2048,False,torch.bfloat16,torch.bfloat16,False,False,triton,0,0,7.2958,auto,0.0,73.59,2353.47
gfx950,256,48,4096,2048,False,torch.bfloat16,torch.bfloat16,False,False,flydsl,5851,1,8.5024,flydsl_gemm4_abf16_wbf16_bf16_t16x64x128_split_k1_block_m_warp1_block_n_warp1_block_k_warp2_async_copyTrue_b_to_ldsTrue_b_preshuffleFalse_c_to_ldsFalse_gfx950,0.0034,94.72,2042.6
gfx950,256,64,4096,2048,False,torch.bfloat16,torch.bfloat16,False,False,flydsl,4883,1,8.9977,flydsl_gemm3_abf16_wbf16_bf16_t16x64x256_split_k1_block_m_warp1_block_n_warp1_block_k_warp2_async_copyTrue_b_to_ldsTrue_b_preshuffleFalse_c_to_ldsFalse_gfx950,0.0034,119.34,1952.02
gfx950,256,128,4096,2048,False,torch.bfloat16,torch.bfloat16,False,False,flydsl,9755,1,9.5047,flydsl_gemm4_abf16_wbf16_bf16_t32x64x128_split_k1_block_m_warp1_block_n_warp4_block_k_warp1_async_copyTrue_b_to_ldsTrue_b_preshuffleFalse_c_to_ldsFalse_gfx950,0.0,225.94,1930.63
gfx950,256,256,4096,2048,False,torch.bfloat16,torch.bfloat16,False,False,flydsl,7393,1,11.6108,flydsl_gemm3_abf16_wbf16_bf16_t64x64x128_split_k1_block_m_warp2_block_n_warp2_block_k_warp2_async_copyTrue_b_to_ldsTrue_b_preshuffleFalse_c_to_ldsFalse_gfx950,0.0034,369.91,1715.9
gfx950,256,16384,4096,2048,False,torch.bfloat16,torch.bfloat16,False,False,asm,10,1,211.1668,_ZN5aiter24bf16gemm_bf16_tn_256x256E,0.0,1301.71,1032.85
gfx950,256,1,6144,3072,False,torch.bfloat16,torch.bfloat16,False,False,flydsl,5467,2,9.1879,flydsl_gemm3_abf16_wbf16_bf16_t16x64x256_split_k2_block_m_warp1_block_n_warp2_block_k_warp1_async_copyTrue_b_to_ldsTrue_b_preshuffleFalse_c_to_ldsFalse_gfx950,0.0042,4.11,4110.53
gfx950,256,1,6144,4096,False,torch.bfloat16,torch.bfloat16,False,False,flydsl,5707,4,11.0736,flydsl_gemm4_abf16_wbf16_bf16_t16x128x128_split_k4_block_m_warp1_block_n_warp4_block_k_warp1_async_copyTrue_b_to_ldsTrue_b_preshuffleFalse_c_to_ldsFalse_gfx950,0.0132,4.55,4547.04
gfx950,256,1,6144,6144,False,torch.bfloat16,torch.bfloat16,False,False,triton,0,0,15.6004,auto,0.0,4.84,4841.03
gfx950,256,2,6144,3072,False,torch.bfloat16,torch.bfloat16,False,False,flydsl,5467,2,9.4639,flydsl_gemm3_abf16_wbf16_bf16_t16x64x256_split_k2_block_m_warp1_block_n_warp2_block_k_warp1_async_copyTrue_b_to_ldsTrue_b_preshuffleFalse_c_to_ldsFalse_gfx950,0.0042,7.98,3992.6
gfx950,256,2,6144,4096,False,torch.bfloat16,torch.bfloat16,False,False,flydsl,3083,4,11.5162,flydsl_gemm3_abf16_wbf16_bf16_t16x128x128_split_k4_block_m_warp1_block_n_warp4_block_k_warp1_async_copyTrue_b_to_ldsTrue_b_preshuffleFalse_c_to_ldsFalse_gfx950,0.0106,8.74,4374.07
gfx950,256,2,6144,6144,False,torch.bfloat16,torch.bfloat16,False,False,flydsl,5699,2,15.5117,flydsl_gemm3_abf16_wbf16_bf16_t16x64x256_split_k2_block_m_warp1_block_n_warp1_block_k_warp2_async_copyTrue_b_to_ldsTrue_b_preshuffleFalse_c_to_ldsFalse_gfx950,0.0123,9.73,4870.3
gfx950,256,4,6144,3072,False,torch.bfloat16,torch.bfloat16,False,False,triton,0,0,9.2311,auto,0.0,16.36,4097.29
gfx950,256,4,6144,4096,False,torch.bfloat16,torch.bfloat16,False,False,flydsl,3083,4,11.5861,flydsl_gemm3_abf16_wbf16_bf16_t16x128x128_split_k4_block_m_warp1_block_n_warp4_block_k_warp1_async_copyTrue_b_to_ldsTrue_b_preshuffleFalse_c_to_ldsFalse_gfx950,0.0127,17.38,4351.21
gfx950,256,4,6144,6144,False,torch.bfloat16,torch.bfloat16,False,False,flydsl,5701,2,15.2737,flydsl_gemm3_abf16_wbf16_bf16_t16x64x256_split_k2_block_m_warp1_block_n_warp2_block_k_warp1_async_copyTrue_b_to_ldsTrue_b_preshuffleFalse_c_to_ldsFalse_gfx950,0.0057,19.77,4949.41
gfx950,256,8,6144,3072,False,torch.bfloat16,torch.bfloat16,False,False,triton,0,0,9.3354,auto,0.0,32.35,4059.41
gfx950,256,8,6144,4096,False,torch.bfloat16,torch.bfloat16,False,False,triton,0,0,11.3622,auto,0.0,35.44,4444.16
gfx950,256,8,6144,6144,False,torch.bfloat16,torch.bfloat16,False,False,flydsl,14295,2,15.4153,flydsl_gemm5_abf16_wbf16_bf16_t16x64x64_split_k2_block_m_warp1_block_n_warp1_block_k_warp2_async_copyTrue_b_to_ldsTrue_b_preshuffleFalse_c_to_ldsFalse_gfx950,0.0138,39.18,4910.32
gfx950,256,16,6144,3072,False,torch.bfloat16,torch.bfloat16,False,False,triton,0,0,9.9609,auto,0.0,60.64,3819.3
gfx950,256,16,6144,4096,False,torch.bfloat16,torch.bfloat16,False,False,triton,0,0,11.9728,auto,0.0,67.26,4231.2
gfx950,256,16,6144,6144,False,torch.bfloat16,torch.bfloat16,False,False,flydsl,5699,2,15.9761,flydsl_gemm3_abf16_wbf16_bf16_t16x64x256_split_k2_block_m_warp1_block_n_warp1_block_k_warp2_async_copyTrue_b_to_ldsTrue_b_preshuffleFalse_c_to_ldsFalse_gfx950,0.0136,75.61,4750.26
gfx950,256,32,6144,3072,False,torch.bfloat16,torch.bfloat16,False,False,triton,0,0,10.2468,auto,0.0,117.89,3741.52
gfx950,256,32,6144,4096,False,torch.bfloat16,torch.bfloat16,False,False,triton,0,0,12.6345,auto,0.0,127.48,4035.54
gfx950,256,32,6144,6144,False,torch.bfloat16,torch.bfloat16,False,False,flydsl,11149,2,17.7658,flydsl_gemm4_abf16_wbf16_bf16_t32x64x128_split_k2_block_m_warp1_block_n_warp4_block_k_warp1_async_copyTrue_b_to_ldsTrue_b_preshuffleFalse_c_to_ldsFalse_gfx950,0.0056,135.99,4293.86
gfx950,256,48,6144,3072,False,torch.bfloat16,torch.bfloat16,False,False,flydsl,9838,1,11.9992,flydsl_gemm4_abf16_wbf16_bf16_t16x64x128_split_k1_block_m_warp1_block_n_warp1_block_k_warp2_async_copyTrue_b_to_ldsTrue_b_preshuffleFalse_c_to_ldsFalse_gfx950,0.0042,151.01,3219.67
gfx950,256,48,6144,4096,False,torch.bfloat16,torch.bfloat16,False,False,flydsl,6723,2,18.8036,flydsl_gemm4_abf16_wbf16_bf16_t48x64x64_split_k2_block_m_warp1_block_n_warp2_block_k_warp1_async_copyTrue_b_to_ldsTrue_b_preshuffleFalse_c_to_ldsFalse_gfx950,0.0049,128.48,2728.98
gfx950,256,48,6144,6144,False,torch.bfloat16,torch.bfloat16,False,False,flydsl,11771,4,26.1745,flydsl_gemm4_abf16_wbf16_bf16_t48x64x64_split_k4_block_m_warp1_block_n_warp1_block_k_warp1_async_copyTrue_b_to_ldsTrue_b_preshuffleFalse_c_to_ldsFalse_gfx950,0.0132,138.45,2929.46
gfx950,256,64,6144,3072,False,torch.bfloat16,torch.bfloat16,False,False,flydsl,19078,1,13.0123,flydsl_gemm5_abf16_wbf16_bf16_t32x64x128_split_k1_block_m_warp1_block_n_warp2_block_k_warp2_async_copyTrue_b_to_ldsTrue_b_preshuffleFalse_c_to_ldsFalse_gfx950,0.0041,185.66,2991.66
gfx950,256,64,6144,4096,False,torch.bfloat16,torch.bfloat16,False,False,triton,0,0,16.2413,auto,0.0,198.34,3179.69
gfx950,256,64,6144,6144,False,torch.bfloat16,torch.bfloat16,False,False,flydsl,11309,2,22.7958,flydsl_gemm3_abf16_wbf16_bf16_t64x64x128_split_k2_block_m_warp1_block_n_warp4_block_k_warp1_async_copyTrue_b_to_ldsTrue_b_preshuffleFalse_c_to_ldsFalse_gfx950,0.0056,211.96,3380.9
gfx950,256,128,6144,3072,False,torch.bfloat16,torch.bfloat16,False,False,flydsl,17191,1,15.8607,flydsl_gemm4_abf16_wbf16_bf16_t48x64x64_split_k1_block_m_warp1_block_n_warp2_block_k_warp1_async_copyTrue_b_to_ldsTrue_b_preshuffleFalse_c_to_ldsFalse_gfx950,0.0,304.64,2528.77
gfx950,256,128,6144,4096,False,torch.bfloat16,torch.bfloat16,False,False,flydsl,13545,1,20.0916,flydsl_gemm5_abf16_wbf16_bf16_t64x64x128_split_k1_block_m_warp2_block_n_warp2_block_k_warp2_async_copyTrue_b_to_ldsTrue_b_preshuffleFalse_c_to_ldsFalse_gfx950,0.0049,320.65,2635.58
gfx950,256,128,6144,6144,False,torch.bfloat16,torch.bfloat16,False,False,flydsl,12955,1,30.5626,flydsl_gemm3_abf16_wbf16_bf16_t64x64x128_split_k1_block_m_warp2_block_n_warp4_block_k_warp1_async_copyTrue_b_to_ldsTrue_b_preshuffleFalse_c_to_ldsFalse_gfx950,0.0,316.19,2573.18
gfx950,256,256,6144,3072,False,torch.bfloat16,torch.bfloat16,False,False,flydsl,19264,1,21.4473,flydsl_gemm4_abf16_wbf16_bf16_t96x64x64_split_k1_block_m_warp2_block_n_warp2_block_k_warp1_async_copyTrue_b_to_ldsTrue_b_preshuffleFalse_c_to_ldsFalse_gfx950,0.0,450.58,1980.08
gfx950,256,256,6144,4096,False,torch.bfloat16,torch.bfloat16,False,False,torch,0,0,26.7818,native,0.0,481.11,2075.09
gfx950,256,256,6144,6144,False,torch.bfloat16,torch.bfloat16,False,False,torch,0,0,39.8899,native,0.0,484.52,2050.37
gfx950,256,16384,6144,3072,False,torch.bfloat16,torch.bfloat16,False,False,torch,0,0,421.1857,native,0.0,1468.41,806.62
gfx950,256,16384,6144,6144,False,torch.bfloat16,torch.bfloat16,False,False,torch,0,0,784.651,native,0.0,1576.43,609.38
gfx950,256,1,38720,6144,False,torch.bfloat16,torch.bfloat16,False,False,triton,0,0,75.8811,auto,0.0,6.27,6271.4
