aiter/configs/model_configs/glm5.2_fp8_tuned_fmoe.csv
gfx,cu_num,token,model_dim,inter_dim,expert,topk,act_type,dtype,q_dtype_a,q_dtype_w,q_type,use_g1u1,doweight_stage1,block_m,ksplit,us1,kernelName1,err1,us2,kernelName2,err2,us,run_1stage,xbf16,flat,tflops,bw,_tag
gfx950,256,1,6144,512,257,9,ActivationType.Silu,torch.bfloat16,torch.float8_e4m3fn,torch.float8_e4m3fn,QuantType.per_Token,1,0,32,0,31.2052,_ZN5aiter47fmoe_stage1_bf16_pertokenFp8_g1u1_32x64_4tg_pf3E,0.0%,12.7526,moe_ck2stages_gemm2_256x32x128x256_1x4_TypeCast_v1_Nswizzle0_Quant2_MulRoutedWeight1_F8_F8_B16,2.1%,43.9578,0,0,0,3.86,55175.07,
gfx950,256,2,6144,512,257,9,ActivationType.Silu,torch.bfloat16,torch.float8_e4m3fn,torch.float8_e4m3fn,QuantType.per_Token,1,0,32,0,33.531,_ZN5aiter47fmoe_stage1_bf16_pertokenFp8_g1u1_32x64_4tg_pf3E,0.0%,18.3999,moe_ck2stages_gemm2_256x32x128x256_1x4_TypeCast_v1_Nswizzle0_Quant2_MulRoutedWeight1_F8_F8_B16,2.2%,51.9309,0,0,0,6.54,46704.24,
gfx950,256,4,6144,512,257,9,ActivationType.Silu,torch.bfloat16,torch.float8_e4m3fn,torch.float8_e4m3fn,QuantType.per_Token,1,0,32,0,41.0503,_ZN5aiter47fmoe_stage1_bf16_pertokenFp8_g1u1_32x64_4tg_pf3E,0.0%,28.3469,moe_ck2stages_gemm2_256x32x128x256_1x4_TypeCast_v1_Nswizzle0_Quant2_MulRoutedWeight1_F8_F8_B16,2.1%,69.3972,0,0,0,9.79,34949.97,
gfx950,256,8,6144,512,257,9,ActivationType.Silu,torch.bfloat16,torch.float8_e4m3fn,torch.float8_e4m3fn,QuantType.per_Token,1,0,32,0,114.2432,_ZN5aiter45fmoe_bf16_pertokenFp8_g1u1_vs_silu_1tg_32x256E,0.0%,0.0,,0.0%,114.2432,1,0,0,11.9,21231.06,
gfx950,256,16,6144,512,257,9,ActivationType.Silu,torch.bfloat16,torch.float8_e4m3fn,torch.float8_e4m3fn,QuantType.per_Token,1,0,32,0,185.0398,_ZN5aiter45fmoe_bf16_pertokenFp8_g1u1_vs_silu_1tg_32x256E,0.0%,0.0,,0.0%,185.0398,1,0,0,14.69,13108.81,
gfx950,256,32,6144,512,257,9,ActivationType.Silu,torch.bfloat16,torch.float8_e4m3fn,torch.float8_e4m3fn,QuantType.per_Token,1,0,32,0,265.7917,_ZN5aiter45fmoe_bf16_pertokenFp8_g1u1_vs_silu_1tg_32x512E,0.0%,0.0,,0.0%,265.7917,1,0,0,20.45,9127.25,
gfx950,256,64,6144,512,257,9,ActivationType.Silu,torch.bfloat16,torch.float8_e4m3fn,torch.float8_e4m3fn,QuantType.per_Token,1,0,32,0,239.9787,_ZN5aiter47fmoe_stage1_bf16_pertokenFp8_g1u1_32x64_4tg_pf2E,0.0%,129.2672,moe_ck2stages_gemm2_256x32x128x256_1x4_TypeCast_v1_Nswizzle0_Quant2_MulRoutedWeight1_F8_F8_B16,2.1%,369.2459,0,0,0,29.44,6571.6,
gfx950,256,128,6144,512,257,9,ActivationType.Silu,torch.bfloat16,torch.float8_e4m3fn,torch.float8_e4m3fn,QuantType.per_Token,1,0,32,0,262.1013,_ZN5aiter47fmoe_stage1_bf16_pertokenFp8_g1u1_32x64_4tg_pf2E,0.0%,143.2842,moe_ck2stages_gemm2_256x32x128x256_1x4_TypeCast_v1_Nswizzle0_Quant2_MulRoutedWeight1_F8_F8_B16,2.1%,405.3855,0,0,0,53.64,5988.66,
gfx950,256,256,6144,512,257,9,ActivationType.Silu,torch.bfloat16,torch.float8_e4m3fn,torch.float8_e4m3fn,QuantType.per_Token,1,0,32,0,279.3161,_ZN5aiter47fmoe_stage1_bf16_pertokenFp8_g1u1_32x64_4tg_pf3E,0.0%,152.9422,moe_ck2stages_gemm2_256x32x128x256_1x4_TypeCast_v1_Nswizzle0_Quant2_MulRoutedWeight1_F8_F8_B16,2.1%,432.2583,0,0,0,100.6,5621.81,
gfx950,256,512,6144,512,257,9,ActivationType.Silu,torch.bfloat16,torch.float8_e4m3fn,torch.float8_e4m3fn,QuantType.per_Token,1,0,64,0,275.6346,_ZN5aiter47fmoe_stage1_bf16_pertokenFp8_g1u1_64x64_3tg_pf2E,0.0%,198.076,moe_ck2stages_gemm2_256x64x128x256_1x4_TypeCast_v1_Nswizzle0_Quant2_MulRoutedWeight1_F8_F8_B16,2.1%,473.7106,0,0,0,183.6,5139.83,
gfx950,256,1024,6144,512,257,9,ActivationType.Silu,torch.bfloat16,torch.float8_e4m3fn,torch.float8_e4m3fn,QuantType.per_Token,1,0,64,0,281.1279,_ZN5aiter47fmoe_stage1_bf16_pertokenFp8_g1u1_64x64_3tg_pf2E,0.0%,274.2974,moe_ck2stages_gemm2_256x64x128x256_1x4_TypeCast_v1_Nswizzle0_Quant2_MulRoutedWeight1_F8_F8_B16,2.1%,555.4253,0,0,0,313.18,4400.65,
gfx950,256,2048,6144,512,257,9,ActivationType.Silu,torch.bfloat16,torch.float8_e4m3fn,torch.float8_e4m3fn,QuantType.per_Token,1,0,64,0,444.2007,_ZN5aiter44fmoe_stage1_bf16_pertokenFp8_g1u1_64x256_pf2E,0.0%,396.5656,moe_ck2stages_gemm2_256x64x128x256_1x4_TypeCast_v1_Nswizzle0_Quant2_MulRoutedWeight1_F8_F8_B16,2.1%,840.7663,0,0,0,413.78,2929.6,
gfx950,256,4096,6144,512,257,9,ActivationType.Silu,torch.bfloat16,torch.float8_e4m3fn,torch.float8_e4m3fn,QuantType.per_Token,1,0,64,0,511.7503,_ZN5aiter47fmoe_stage1_bf16_pertokenFp8_g1u1_64x64_2tg_pf3E,0.0%,753.7459,moe_ck2stages_gemm2_256x64x128x256_1x4_TypeCast_v1_Nswizzle0_Quant2_MulRoutedWeight1_F8_F8_B16,2.1%,1265.4962,0,0,0,549.81,1976.18,
gfx950,256,8192,6144,512,257,9,ActivationType.Silu,torch.bfloat16,torch.float8_e4m3fn,torch.float8_e4m3fn,QuantType.per_Token,1,0,128,0,750.5165,_ZN5aiter45fmoe_stage1_bf16_pertokenFp8_g1u1_128x128_pf3E,0.0%,1482.863,moe_ck2stages_gemm2_256x128x128x128_1x4_TypeCast_v1_Nswizzle0_Quant2_MulRoutedWeight1_F8_F8_B16,2.1%,2233.3795,0,0,0,623.08,1153.57,
gfx950,256,16384,6144,512,257,9,ActivationType.Silu,torch.bfloat16,torch.float8_e4m3fn,torch.float8_e4m3fn,QuantType.per_Token,1,0,32,0,4075.2287,_ZN5aiter45fmoe_bf16_pertokenFp8_g1u1_vs_silu_1tg_32x512E,0.0%,0.0,,0.0%,4075.2287,1,0,0,682.94,669.25,
gfx950,256,32768,6144,512,257,9,ActivationType.Silu,torch.bfloat16,torch.float8_e4m3fn,torch.float8_e4m3fn,QuantType.per_Token,1,0,32,0,7119.6436,_ZN5aiter45fmoe_bf16_pertokenFp8_g1u1_vs_silu_1tg_32x512E,0.0%,0.0,,0.0%,7119.6436,1,0,0,781.82,425.49,
