aiter/configs/model_configs/glm5_bf16_tuned_gemm.csv
gfx,cu_num,M,N,K,bias,dtype,outdtype,scaleAB,bpreshuffle,libtype,solidx,splitK,us,kernelName,err_ratio,tflops,bw
gfx950,256,1,32,6144,False,torch.bfloat16,torch.bfloat16,False,False,skinny,2,0,3.5547,sol2,0.0,0.11,114.09
gfx950,256,2,32,6144,False,torch.bfloat16,torch.bfloat16,False,False,flydsl,94,8,4.6207,flydsl_hgemm_abf16_wbf16_bf16_t16x64x128x7_ks8_w1x1x2_bias0_ktail0_gm0_pft_gfx950,0.0469,0.17,90.45
gfx950,256,4,32,6144,False,torch.bfloat16,torch.bfloat16,False,False,flydsl,70,8,5.0807,flydsl_hgemm_abf16_wbf16_bf16_t16x64x128x5_ks8_w1x1x2_bias0_ktail0_gm0_pft_gfx950,0.0469,0.31,87.12
gfx950,256,8,32,6144,False,torch.bfloat16,torch.bfloat16,False,False,flydsl,82,8,5.0403,flydsl_hgemm_abf16_wbf16_bf16_t16x64x128x6_ks8_w1x1x2_bias0_ktail0_gm0_pft_gfx950,0.043,0.62,97.62
gfx950,256,16,32,6144,False,torch.bfloat16,torch.bfloat16,False,False,flydsl,94,8,4.9354,flydsl_hgemm_abf16_wbf16_bf16_t16x64x128x7_ks8_w1x1x2_bias0_ktail0_gm0_pft_gfx950,0.0332,1.27,119.72
gfx950,256,32,32,6144,False,torch.bfloat16,torch.bfloat16,False,False,flydsl,94,8,5.1991,flydsl_hgemm_abf16_wbf16_bf16_t16x64x128x7_ks8_w1x1x2_bias0_ktail0_gm0_pft_gfx950,0.0234,2.42,151.66
gfx950,256,48,32,6144,False,torch.bfloat16,torch.bfloat16,False,False,flydsl,82,8,5.1296,flydsl_hgemm_abf16_wbf16_bf16_t16x64x128x6_ks8_w1x1x2_bias0_ktail0_gm0_pft_gfx950,0.0273,3.68,192.24
gfx950,256,64,32,6144,False,torch.bfloat16,torch.bfloat16,False,False,flydsl,280,8,5.2872,flydsl_hgemm_abf16_wbf16_bf16_t16x64x64x8_ks8_w1x1x2_bias0_ktail0_gm0_pft_gfx950,0.0303,4.76,223.89
gfx950,256,128,32,6144,False,torch.bfloat16,torch.bfloat16,False,False,flydsl,889,8,5.4332,flydsl_hgemm_abf16_wbf16_bf16_t32x64x128x6_ks8_w1x2x2_bias0_ktail0_gm0_pft_gfx950,0.0303,9.26,363.37
gfx950,256,256,32,6144,False,torch.bfloat16,torch.bfloat16,False,False,flydsl,889,8,6.1403,flydsl_hgemm_abf16_wbf16_bf16_t32x64x128x4_ks8_w1x2x2_bias0_ktail0_gm0_pft_gfx950,0.0298,16.39,579.02
gfx950,256,16384,32,6144,False,torch.bfloat16,torch.bfloat16,False,False,flydsl,29,2,38.5485,flydsl_hgemm_abf16_wbf16_bf16_t128x64x128x2_ks2_w2x2x1_bias0_ktail0_gm0_pht_gfx950,0.0058,167.13,5260.08
gfx950,256,1,128,6144,False,torch.bfloat16,torch.bfloat16,False,False,skinny,2,0,3.6655,sol2,0.0,0.43,432.52
gfx950,256,2,128,6144,False,torch.bfloat16,torch.bfloat16,False,False,skinny,2,0,4.8079,sol2,0.0,0.65,332.36
gfx950,256,4,128,6144,False,torch.bfloat16,torch.bfloat16,False,False,asm,1,13,5.2058,_ZN5aiter39bf16gemm_fp32bf16_tn_32x64_splitk_cleanE,0.0293,1.21,311.78
gfx950,256,8,128,6144,False,torch.bfloat16,torch.bfloat16,False,False,flydsl,166,8,5.0633,flydsl_hgemm_abf16_wbf16_bf16_t16x64x128x4_ks8_w1x1x2_bias0_ktail0_gm0_pft_gfx950,0.0254,2.49,330.46
gfx950,256,16,128,6144,False,torch.bfloat16,torch.bfloat16,False,False,flydsl,208,8,5.0731,flydsl_hgemm_abf16_wbf16_bf16_t16x64x128x7_ks8_w1x1x2_bias0_ktail0_gm0_pft_gfx950,0.0249,4.96,349.6
gfx950,256,32,128,6144,False,torch.bfloat16,torch.bfloat16,False,False,asm,1,16,5.1455,_ZN5aiter39bf16gemm_fp32bf16_tn_32x64_splitk_cleanE,0.0247,9.78,383.69
gfx950,256,48,128,6144,False,torch.bfloat16,torch.bfloat16,False,False,flydsl,197,8,5.4227,flydsl_hgemm_abf16_wbf16_bf16_t16x64x128x6_ks8_w1x2x1_bias0_ktail0_gm0_pft_gfx950,0.0207,13.92,401.09
gfx950,256,64,128,6144,False,torch.bfloat16,torch.bfloat16,False,False,flydsl,1064,8,5.8011,flydsl_hgemm_abf16_wbf16_bf16_t32x64x256x3_ks8_w1x4x1_bias0_ktail0_gm0_pft_gfx950,0.0203,17.35,409.52
gfx950,256,128,128,6144,False,torch.bfloat16,torch.bfloat16,False,False,flydsl,1646,8,6.4377,flydsl_hgemm_abf16_wbf16_bf16_t32x64x256x3_ks8_w1x4x1_bias0_ktail0_gm0_pft_gfx950,0.0214,31.27,493.73
gfx950,256,256,128,6144,False,torch.bfloat16,torch.bfloat16,False,False,flydsl,938,6,7.3681,flydsl_hgemm_abf16_wbf16_bf16_t16x64x64x6_ks6_w1x2x1_bias0_ktail0_gm0_pft_gfx950,0.0187,54.65,649.3
gfx950,256,16384,128,6144,False,torch.bfloat16,torch.bfloat16,False,False,flydsl,25,2,51.3461,flydsl_hgemm_abf16_wbf16_bf16_t128x128x128x2_ks2_w2x4x1_bias0_ktail0_gm0_pht_gfx950,0.0058,501.88,4033.29
gfx950,256,1,256,6144,False,torch.bfloat16,torch.bfloat16,False,False,skinny,2,0,3.9314,sol2,0.0,0.8,803.41
gfx950,256,2,256,6144,False,torch.bfloat16,torch.bfloat16,False,False,skinny,2,0,5.0741,sol2,0.0,1.24,625.0
gfx950,256,4,256,6144,False,torch.bfloat16,torch.bfloat16,False,False,flydsl,203,8,5.7507,flydsl_hgemm_abf16_wbf16_bf16_t16x64x128x6_ks8_w1x2x1_bias0_ktail0_gm0_pft_gfx950,0.0225,2.19,555.92
gfx950,256,8,256,6144,False,torch.bfloat16,torch.bfloat16,False,False,flydsl,412,8,5.7438,flydsl_hgemm_abf16_wbf16_bf16_t16x64x64x9_ks8_w1x1x2_bias0_ktail0_gm0_pft_gfx950,0.0244,4.38,565.5
gfx950,256,16,256,6144,False,torch.bfloat16,torch.bfloat16,False,False,flydsl,383,8,5.9023,flydsl_hgemm_abf16_wbf16_bf16_t16x64x64x7_ks8_w1x2x1_bias0_ktail0_gm0_pft_gfx950,0.0212,8.53,567.66
gfx950,256,32,256,6144,False,torch.bfloat16,torch.bfloat16,False,False,flydsl,172,8,6.1944,flydsl_hgemm_abf16_wbf16_bf16_t16x64x128x4_ks8_w1x1x2_bias0_ktail0_gm0_pft_gfx950,0.0288,16.25,573.96
gfx950,256,48,256,6144,False,torch.bfloat16,torch.bfloat16,False,False,flydsl,401,8,6.3227,flydsl_hgemm_abf16_wbf16_bf16_t16x64x64x8_ks8_w1x2x1_bias0_ktail0_gm0_pft_gfx950,0.0205,23.88,594.7
gfx950,256,64,256,6144,False,torch.bfloat16,torch.bfloat16,False,False,flydsl,173,8,6.6619,flydsl_hgemm_abf16_wbf16_bf16_t16x64x128x4_ks8_w1x2x1_bias0_ktail0_gm0_pft_gfx950,0.0211,30.22,595.16
gfx950,256,128,256,6144,False,torch.bfloat16,torch.bfloat16,False,False,flydsl,851,8,7.4774,flydsl_hgemm_abf16_wbf16_bf16_t16x64x128x5_ks8_w1x2x1_bias0_ktail0_gm0_pft_gfx950,0.0192,53.85,639.81
gfx950,256,256,256,6144,False,torch.bfloat16,torch.bfloat16,False,False,flydsl,2085,6,9.1267,flydsl_hgemm_abf16_wbf16_bf16_t32x64x64x6_ks6_w2x2x1_bias0_ktail0_gm0_pft_gfx950,0.0182,88.24,703.71
gfx950,256,16384,256,6144,False,torch.bfloat16,torch.bfloat16,False,False,flydsl,9,1,71.0543,flydsl_hgemm_abf16_wbf16_bf16_t128x128x128x2_ks1_w2x4x1_bias0_ktail0_gm4_pht_gfx950,0.0,725.36,2995.75
gfx950,256,1,2624,6144,False,torch.bfloat16,torch.bfloat16,False,False,flydsl,362,6,8.5045,flydsl_hgemm_abf16_wbf16_bf16_t16x64x64x6_ks6_w1x2x1_bias0_ktail0_gm0_pft_gfx950,0.0152,3.79,3793.43
gfx950,256,2,2624,6144,False,torch.bfloat16,torch.bfloat16,False,False,flydsl,398,6,8.5044,flydsl_hgemm_abf16_wbf16_bf16_t16x64x64x8_ks6_w1x2x1_bias0_ktail0_gm0_pft_gfx950,0.0133,7.58,3795.54
gfx950,256,4,2624,6144,False,torch.bfloat16,torch.bfloat16,False,False,flydsl,379,6,8.7385,flydsl_hgemm_abf16_wbf16_bf16_t16x64x64x7_ks6_w1x1x2_bias0_ktail0_gm0_pft_gfx950,0.0232,14.76,3697.87
gfx950,256,8,2624,6144,False,torch.bfloat16,torch.bfloat16,False,False,flydsl,380,6,8.8961,flydsl_hgemm_abf16_wbf16_bf16_t16x64x64x7_ks6_w1x2x1_bias0_ktail0_gm0_pft_gfx950,0.018,29.0,3640.25
gfx950,256,16,2624,6144,False,torch.bfloat16,torch.bfloat16,False,False,flydsl,398,6,9.4752,flydsl_hgemm_abf16_wbf16_bf16_t16x64x64x8_ks6_w1x2x1_bias0_ktail0_gm0_pft_gfx950,0.0175,54.45,3432.57
gfx950,256,32,2624,6144,False,torch.bfloat16,torch.bfloat16,False,False,flydsl,1341,6,11.2171,flydsl_hgemm_abf16_wbf16_bf16_t32x64x64x6_ks6_w2x2x1_bias0_ktail0_gm0_pft_gfx950,0.0174,91.98,2924.54
gfx950,256,48,2624,6144,False,torch.bfloat16,torch.bfloat16,False,False,flydsl,626,6,13.4877,flydsl_hgemm_abf16_wbf16_bf16_t48x64x64x4_ks6_w1x2x1_bias0_ktail0_gm0_pft_gfx950,0.0174,114.75,2453.01
gfx950,256,64,2624,6144,False,torch.bfloat16,torch.bfloat16,False,False,asm,5,6,14.6473,_ZN5aiter39bf16gemm_fp32bf16_tn_64x64_splitk_cleanE,0.0175,140.89,2277.96
gfx950,256,128,2624,6144,False,torch.bfloat16,torch.bfloat16,False,False,asm,5,3,18.244,_ZN5aiter39bf16gemm_fp32bf16_tn_64x64_splitk_cleanE,0.01,226.22,1890.39
gfx950,256,256,2624,6144,False,torch.bfloat16,torch.bfloat16,False,False,torch,0,0,26.3259,native,0.0,313.55,1395.32
gfx950,256,16384,2624,6144,False,torch.bfloat16,torch.bfloat16,False,False,torch,0,0,401.7537,native,0.0,1314.94,795.4
gfx950,256,1,4096,2048,False,torch.bfloat16,torch.bfloat16,False,False,flydsl,216,4,6.3242,flydsl_hgemm_abf16_wbf16_bf16_t16x64x64x4_ks4_w1x2x1_bias0_ktail0_gm0_pft_gfx950,0.0093,2.65,2654.8
gfx950,256,2,4096,2048,False,torch.bfloat16,torch.bfloat16,False,False,flydsl,216,4,6.3553,flydsl_hgemm_abf16_wbf16_bf16_t16x64x64x4_ks4_w1x2x1_bias0_ktail0_gm0_pft_gfx950,0.0074,5.28,2643.74
gfx950,256,4,4096,2048,False,torch.bfloat16,torch.bfloat16,False,False,flydsl,263,4,6.585,flydsl_hgemm_abf16_wbf16_bf16_t16x64x64x8_ks4_w1x1x2_bias0_ktail0_gm0_pft_gfx950,0.0144,10.19,2555.26
gfx950,256,8,4096,2048,False,torch.bfloat16,torch.bfloat16,False,False,flydsl,239,4,6.7587,flydsl_hgemm_abf16_wbf16_bf16_t16x64x64x6_ks4_w1x1x2_bias0_ktail0_gm0_pft_gfx950,0.0151,19.86,2496.86
gfx950,256,16,4096,2048,False,torch.bfloat16,torch.bfloat16,False,False,triton,0,0,7.0615,auto,0.0,38.01,2403.71
gfx950,256,32,4096,2048,False,torch.bfloat16,torch.bfloat16,False,False,flydsl,261,2,7.7991,flydsl_hgemm_abf16_wbf16_bf16_t16x64x64x8_ks2_w1x2x1_bias0_ktail0_gm0_pft_gfx950,0.0031,68.84,2201.59
gfx950,256,48,4096,2048,False,torch.bfloat16,torch.bfloat16,False,False,flydsl,234,1,8.6319,flydsl_hgemm_abf16_wbf16_bf16_t16x64x64x6_ks1_w1x2x1_bias0_ktail0_gm0_pft_gfx950,0.0,93.29,2011.96
gfx950,256,64,4096,2048,False,torch.bfloat16,torch.bfloat16,False,False,flydsl,234,1,8.869,flydsl_hgemm_abf16_wbf16_bf16_t16x64x64x6_ks1_w1x2x1_bias0_ktail0_gm0_pft_gfx950,0.0,121.07,1980.34
gfx950,256,128,4096,2048,False,torch.bfloat16,torch.bfloat16,False,False,flydsl,885,1,9.4377,flydsl_hgemm_abf16_wbf16_bf16_t32x64x128x4_ks1_w1x4x1_bias0_ktail0_gm0_pft_gfx950,0.0,227.54,1944.34
gfx950,256,256,4096,2048,False,torch.bfloat16,torch.bfloat16,False,False,flydsl,1785,1,11.8753,flydsl_hgemm_abf16_wbf16_bf16_t64x64x64x6_ks1_w4x2x1_bias0_ktail0_gm0_pft_gfx950,0.0,361.67,1677.68
gfx950,256,16384,4096,2048,False,torch.bfloat16,torch.bfloat16,False,False,asm,10,1,212.203,_ZN5aiter24bf16gemm_bf16_tn_256x256E,0.0,1295.35,1027.81
gfx950,256,1,6144,3072,False,torch.bfloat16,torch.bfloat16,False,False,flydsl,389,2,9.1339,flydsl_hgemm_abf16_wbf16_bf16_t16x64x64x8_ks2_w1x2x1_bias0_ktail0_gm0_pft_gfx950,0.0042,4.13,4134.83
gfx950,256,1,6144,4096,False,torch.bfloat16,torch.bfloat16,False,False,flydsl,203,4,11.32,flydsl_hgemm_abf16_wbf16_bf16_t16x64x64x3_ks4_w1x1x2_bias0_ktail0_gm0_pft_gfx950,0.0221,4.45,4448.07
gfx950,256,1,6144,6144,False,torch.bfloat16,torch.bfloat16,False,False,flydsl,195,2,14.6005,flydsl_hgemm_abf16_wbf16_bf16_t16x64x128x6_ks2_w1x2x1_bias0_ktail0_gm0_pft_gfx950,0.0042,5.17,5172.57
gfx950,256,2,6144,3072,False,torch.bfloat16,torch.bfloat16,False,False,flydsl,389,2,9.2764,flydsl_hgemm_abf16_wbf16_bf16_t16x64x64x8_ks2_w1x2x1_bias0_ktail0_gm0_pft_gfx950,0.0042,8.14,4073.3
gfx950,256,2,6144,4096,False,torch.bfloat16,torch.bfloat16,False,False,flydsl,216,4,11.4719,flydsl_hgemm_abf16_wbf16_bf16_t16x64x64x4_ks4_w1x2x1_bias0_ktail0_gm0_pft_gfx950,0.0112,8.77,4390.96
gfx950,256,2,6144,6144,False,torch.bfloat16,torch.bfloat16,False,False,flydsl,195,2,14.7234,flydsl_hgemm_abf16_wbf16_bf16_t16x64x128x6_ks2_w1x2x1_bias0_ktail0_gm0_pft_gfx950,0.0051,10.26,5131.06
gfx950,256,4,6144,3072,False,torch.bfloat16,torch.bfloat16,False,False,triton,0,0,9.3316,auto,0.0,16.18,4053.16
gfx950,256,4,6144,4096,False,torch.bfloat16,torch.bfloat16,False,False,triton,0,0,11.2106,auto,0.0,17.96,4496.96
gfx950,256,4,6144,6144,False,torch.bfloat16,torch.bfloat16,False,False,flydsl,195,2,14.8886,flydsl_hgemm_abf16_wbf16_bf16_t16x64x128x6_ks2_w1x2x1_bias0_ktail0_gm0_pft_gfx950,0.0057,20.28,5077.43
gfx950,256,8,6144,3072,False,torch.bfloat16,torch.bfloat16,False,False,flydsl,371,2,9.6314,flydsl_hgemm_abf16_wbf16_bf16_t16x64x64x7_ks2_w1x2x1_bias0_ktail0_gm0_pft_gfx950,0.0043,31.35,3934.65
gfx950,256,8,6144,4096,False,torch.bfloat16,torch.bfloat16,False,False,triton,0,0,11.305,auto,0.0,35.62,4466.65
gfx950,256,8,6144,6144,False,torch.bfloat16,torch.bfloat16,False,False,flydsl,179,2,15.5365,flydsl_hgemm_abf16_wbf16_bf16_t16x64x128x5_ks2_w1x2x1_bias0_ktail0_gm0_pft_gfx950,0.0058,38.87,4872.02
gfx950,256,16,6144,3072,False,torch.bfloat16,torch.bfloat16,False,False,triton,0,0,9.5195,auto,0.0,63.45,3996.39
gfx950,256,16,6144,4096,False,torch.bfloat16,torch.bfloat16,False,False,triton,0,0,11.4602,auto,0.0,70.27,4420.46
gfx950,256,16,6144,6144,False,torch.bfloat16,torch.bfloat16,False,False,flydsl,250,2,15.8881,flydsl_hgemm_abf16_wbf16_bf16_t16x64x256x3_ks2_w1x1x2_bias0_ktail0_gm0_pft_gfx950,0.0136,76.03,4776.57
gfx950,256,32,6144,3072,False,torch.bfloat16,torch.bfloat16,False,False,triton,0,0,10.6751,auto,0.0,113.16,3591.4
gfx950,256,32,6144,4096,False,torch.bfloat16,torch.bfloat16,False,False,triton,0,0,12.3704,auto,0.0,130.2,4121.69
gfx950,256,32,6144,6144,False,torch.bfloat16,torch.bfloat16,False,False,flydsl,894,2,17.5815,flydsl_hgemm_abf16_wbf16_bf16_t32x64x128x5_ks2_w2x2x1_bias0_ktail0_gm0_pft_gfx950,0.0056,137.41,4338.87
gfx950,256,48,6144,3072,False,torch.bfloat16,torch.bfloat16,False,False,flydsl,162,1,12.8436,flydsl_hgemm_abf16_wbf16_bf16_t16x64x64x8_ks1_w1x1x2_bias0_ktail0_gm0_pft_gfx950,0.0042,141.08,3007.99
gfx950,256,48,6144,4096,False,torch.bfloat16,torch.bfloat16,False,False,flydsl,88,1,15.3434,flydsl_hgemm_abf16_wbf16_bf16_t16x64x128x4_ks1_w1x2x1_bias0_ktail0_gm0_pft_gfx950,0.0,157.46,3344.41
gfx950,256,48,6144,6144,False,torch.bfloat16,torch.bfloat16,False,False,flydsl,390,2,20.9222,flydsl_hgemm_abf16_wbf16_bf16_t48x64x64x5_ks2_w1x2x1_bias0_ktail0_gm0_pft_gfx950,0.0056,173.21,3664.87
gfx950,256,64,6144,3072,False,torch.bfloat16,torch.bfloat16,False,False,flydsl,749,1,13.2596,flydsl_hgemm_abf16_wbf16_bf16_t32x64x256x3_ks1_w1x4x1_bias0_ktail0_gm0_pft_gfx950,0.0,182.2,2935.86
gfx950,256,64,6144,4096,False,torch.bfloat16,torch.bfloat16,False,False,triton,0,0,16.451,auto,0.0,195.81,3139.16
gfx950,256,64,6144,6144,False,torch.bfloat16,torch.bfloat16,False,False,flydsl,1824,2,23.078,flydsl_hgemm_abf16_wbf16_bf16_t64x64x128x4_ks2_w2x2x1_bias0_ktail0_gm0_pft_gfx950,0.0056,209.37,3339.56
gfx950,256,128,6144,3072,False,torch.bfloat16,torch.bfloat16,False,False,flydsl,1948,1,16.1801,flydsl_hgemm_abf16_wbf16_bf16_t64x64x128x4_ks1_w2x4x1_bias0_ktail0_gm0_pft_gfx950,0.0,298.63,2478.85
gfx950,256,128,6144,4096,False,torch.bfloat16,torch.bfloat16,False,False,flydsl,1494,1,20.3554,flydsl_hgemm_abf16_wbf16_bf16_t64x64x128x5_ks1_w4x1x2_bias0_ktail0_gm0_pft_gfx950,0.0049,316.5,2601.43
gfx950,256,128,6144,6144,False,torch.bfloat16,torch.bfloat16,False,False,flydsl,1333,1,30.8546,flydsl_hgemm_abf16_wbf16_bf16_t48x64x64x5_ks1_w1x2x1_bias0_ktail0_gm0_pft_gfx950,0.0,313.2,2548.83
gfx950,256,256,6144,3072,False,torch.bfloat16,torch.bfloat16,False,False,flydsl,1594,1,20.1151,flydsl_hgemm_abf16_wbf16_bf16_t64x96x128x3_ks1_w1x2x2_bias0_ktail0_gm0_pft_gfx950,0.0042,480.42,2111.22
gfx950,256,256,6144,4096,False,torch.bfloat16,torch.bfloat16,False,False,flydsl,1295,1,25.6226,flydsl_hgemm_abf16_wbf16_bf16_t64x96x128x3_ks1_w1x2x2_bias0_ktail0_gm0_pft_gfx950,0.0049,502.87,2168.97
gfx950,256,256,6144,6144,False,torch.bfloat16,torch.bfloat16,False,False,flydsl,1609,1,38.1803,flydsl_hgemm_abf16_wbf16_bf16_t64x96x128x4_ks1_w1x2x2_bias0_ktail0_gm0_pft_gfx950,0.0057,506.21,2142.18
gfx950,256,16384,6144,3072,False,torch.bfloat16,torch.bfloat16,False,False,torch,0,0,420.1129,native,0.0,1472.16,808.68
gfx950,256,16384,6144,6144,False,torch.bfloat16,torch.bfloat16,False,False,torch,0,0,783.7422,native,0.0,1578.26,610.09
gfx950,256,1,38720,6144,False,torch.bfloat16,torch.bfloat16,False,False,triton,0,0,75.9991,auto,0.0,6.26,6261.67
gfx942,80,16,6144,3072,False,torch.bfloat16,torch.bfloat16,False,False,opus,10301,0,27.883,opus_gemm_gfx942_wkc_512x16x32x32_1x1_16x16x16_0x0x0,0.0,21.66,1364.4
gfx942,80,8,6144,4096,False,torch.bfloat16,torch.bfloat16,False,False,opus,10301,0,34.4629,opus_gemm_gfx942_wkc_512x16x32x32_1x1_16x16x16_0x0x0,0.0,11.68,1465.21
gfx942,80,16,6144,4096,False,torch.bfloat16,torch.bfloat16,False,False,opus,10301,0,34.8629,opus_gemm_gfx942_wkc_512x16x32x32_1x1_16x16x16_0x0x0,0.0,23.1,1453.1
gfx942,80,8,32,6144,False,torch.bfloat16,torch.bfloat16,False,False,opus,10300,0,8.4056,opus_gemm_gfx942_wkc_512x16x16x64_1x1_16x16x16_0x0x0,0.0,0.37,58.54
gfx942,80,16,32,6144,False,torch.bfloat16,torch.bfloat16,False,False,opus,10300,0,8.8163,opus_gemm_gfx942_wkc_512x16x16x64_1x1_16x16x16_0x0x0,0.0,0.71,67.02
gfx942,80,48,32,6144,False,torch.bfloat16,torch.bfloat16,False,False,opus,10300,0,9.7083,opus_gemm_gfx942_wkc_512x16x16x64_1x1_16x16x16_0x0x0,0.0,1.94,101.57
gfx942,80,64,32,6144,False,torch.bfloat16,torch.bfloat16,False,False,opus,10300,0,9.5767,opus_gemm_gfx942_wkc_512x16x16x64_1x1_16x16x16_0x0x0,0.0,2.63,123.61
gfx942,80,128,32,6144,False,torch.bfloat16,torch.bfloat16,False,False,opus,10300,0,10.2587,opus_gemm_gfx942_wkc_512x16x16x64_1x1_16x16x16_0x0x0,0.0,4.91,192.45
gfx942,80,16384,32,6144,False,torch.bfloat16,torch.bfloat16,False,False,opus,10302,0,156.3505,opus_gemm_gfx942_wkc_512x32x16x64_1x1_16x16x16_0x0x0,0.0,41.21,1296.88
gfx942,80,4,6144,6144,False,torch.bfloat16,torch.bfloat16,False,False,opus,10300,0,47.3828,opus_gemm_gfx942_wkc_512x16x16x64_1x1_16x16x16_0x0x0,0.0,6.37,1595.43
gfx942,80,1,160,6144,False,torch.bfloat16,torch.bfloat16,False,False,skinny,2,0,6.0738,sol2,0.0,0.32,325.77
gfx942,80,2,160,6144,False,torch.bfloat16,torch.bfloat16,False,False,opus,10300,0,7.0128,opus_gemm_gfx942_wkc_512x16x16x64_1x1_16x16x16_0x0x0,0.0,0.56,283.95
gfx942,80,4,160,6144,False,torch.bfloat16,torch.bfloat16,False,False,opus,10300,0,7.03,opus_gemm_gfx942_wkc_512x16x16x64_1x1_16x16x16_0x0x0,0.0,1.12,286.84
gfx942,80,8,160,6144,False,torch.bfloat16,torch.bfloat16,False,False,opus,10300,0,7.0799,opus_gemm_gfx942_wkc_512x16x16x64_1x1_16x16x16_0x0x0,0.0,2.22,291.95
gfx942,80,16,160,6144,False,torch.bfloat16,torch.bfloat16,False,False,torch,0,0,9.0034,native,0.0,3.49,240.78
gfx942,80,24,160,6144,False,torch.bfloat16,torch.bfloat16,False,False,opus,10300,0,9.2424,opus_gemm_gfx942_wkc_512x16x16x64_1x1_16x16x16_0x0x0,0.0,5.11,245.46
gfx942,80,32,160,6144,False,torch.bfloat16,torch.bfloat16,False,False,opus,10300,0,9.7899,opus_gemm_gfx942_wkc_512x16x16x64_1x1_16x16x16_0x0x0,0.0,6.43,242.04
gfx942,80,48,160,6144,False,torch.bfloat16,torch.bfloat16,False,False,opus,10300,0,10.0646,opus_gemm_gfx942_wkc_512x16x16x64_1x1_16x16x16_0x0x0,0.0,9.38,255.48
gfx942,80,64,160,6144,False,torch.bfloat16,torch.bfloat16,False,False,opus,10300,0,9.1916,opus_gemm_gfx942_wkc_512x16x16x64_1x1_16x16x16_0x0x0,0.0,13.69,301.69
gfx942,80,96,160,6144,False,torch.bfloat16,torch.bfloat16,False,False,opus,10300,0,9.2498,opus_gemm_gfx942_wkc_512x16x16x64_1x1_16x16x16_0x0x0,0.0,20.41,343.41
gfx942,80,128,160,6144,False,torch.bfloat16,torch.bfloat16,False,False,opus,10305,0,11.3174,opus_gemm_gfx942_wkc_512x16x32x64_1x1_16x16x16_0x0x0,0.0,22.24,316.32
gfx942,80,192,160,6144,False,torch.bfloat16,torch.bfloat16,False,False,opus,10302,0,11.223,opus_gemm_gfx942_wkc_512x32x16x64_1x1_16x16x16_0x0x0,0.0,33.64,390.88
gfx942,80,256,160,6144,False,torch.bfloat16,torch.bfloat16,False,False,opus,10302,0,11.6386,opus_gemm_gfx942_wkc_512x32x16x64_1x1_16x16x16_0x0x0,0.0,43.25,446.25
gfx942,80,384,160,6144,False,torch.bfloat16,torch.bfloat16,False,False,opus,10302,0,21.0876,opus_gemm_gfx942_wkc_512x32x16x64_1x1_16x16x16_0x0x0,0.0,35.8,322.82
gfx942,80,512,160,6144,False,torch.bfloat16,torch.bfloat16,False,False,torch,0,0,22.271,native,0.0,45.2,378.13
gfx942,80,768,160,6144,False,torch.bfloat16,torch.bfloat16,False,False,opus,10204,6,25.9411,opus_gemm_gfx942_splitk_em3en4_lds1_pgr2_256x128x96x128_2x2_16x16x16_0x0x0,0.0,58.21,449.06
gfx942,80,1024,160,6144,False,torch.bfloat16,torch.bfloat16,False,False,opus,10204,5,29.3571,opus_gemm_gfx942_splitk_em3en4_lds1_pgr2_256x128x96x128_2x2_16x16x16_0x0x0,0.0,68.58,506.75
gfx942,80,1536,160,6144,False,torch.bfloat16,torch.bfloat16,False,False,opus,10204,3,39.0517,opus_gemm_gfx942_splitk_em3en4_lds1_pgr2_256x128x96x128_2x2_16x16x16_0x0x0,0.0,77.33,546.25
gfx942,80,2048,160,6144,False,torch.bfloat16,torch.bfloat16,False,False,opus,10204,5,52.586,opus_gemm_gfx942_splitk_em3en4_lds1_pgr2_256x128x96x128_2x2_16x16x16_0x0x0,0.0003,76.57,528.42
gfx942,80,3072,160,6144,False,torch.bfloat16,torch.bfloat16,False,False,opus,10204,3,70.6337,opus_gemm_gfx942_splitk_em3en4_lds1_pgr2_256x128x96x128_2x2_16x16x16_0x0x0,0.0,85.51,576.18
gfx942,80,4096,160,6144,False,torch.bfloat16,torch.bfloat16,False,False,opus,10204,1,93.8685,opus_gemm_gfx942_splitk_em3en4_lds1_pgr2_256x128x96x128_2x2_16x16x16_0x0x0,0.0,85.79,571.1
gfx942,80,8192,160,6144,False,torch.bfloat16,torch.bfloat16,False,False,torch,0,0,151.3114,native,0.0,106.44,695.59
gfx942,80,16384,160,6144,False,torch.bfloat16,torch.bfloat16,False,False,torch,0,0,200.1622,native,0.0,160.93,1041.83
gfx942,80,32768,160,6144,False,torch.bfloat16,torch.bfloat16,False,False,torch,0,0,420.4288,native,0.0,153.24,987.34
gfx942,80,1,256,6144,False,torch.bfloat16,torch.bfloat16,False,False,opus,10311,0,4.9398,opus_gemm_gfx942_wkc_accum_512x16x32x32_1x1_16x16x16_0x0x0,0.0234,0.64,639.4
gfx942,80,2,256,6144,False,torch.bfloat16,torch.bfloat16,False,False,opus,10311,0,4.9586,opus_gemm_gfx942_wkc_accum_512x16x32x32_1x1_16x16x16_0x0x0,0.0195,1.27,639.56
gfx942,80,4,256,6144,False,torch.bfloat16,torch.bfloat16,False,False,opus,10311,0,5.3272,opus_gemm_gfx942_wkc_accum_512x16x32x32_1x1_16x16x16_0x0x0,0.0186,2.36,600.11
gfx942,80,8,256,6144,False,torch.bfloat16,torch.bfloat16,False,False,opus,10310,0,4.9466,opus_gemm_gfx942_wkc_accum_256x16x16x64_1x1_16x16x16_0x0x0,0.0181,5.09,656.64
gfx942,80,16,256,6144,False,torch.bfloat16,torch.bfloat16,False,False,opus,10311,0,5.2814,opus_gemm_gfx942_wkc_accum_512x16x32x32_1x1_16x16x16_0x0x0,0.021,9.53,634.4
gfx942,80,24,256,6144,False,torch.bfloat16,torch.bfloat16,False,False,opus,10313,0,6.2673,opus_gemm_gfx942_wkc_accum_256x32x32x64_1x1_16x16x16_0x0x0,0.02,12.05,550.94
gfx942,80,32,256,6144,False,torch.bfloat16,torch.bfloat16,False,False,asm,1,16,7.9053,_ZN5aiter39bf16gemm_fp32bf16_tn_32x64_splitk_cleanE,0.0308,12.73,449.74
gfx942,80,48,256,6144,False,torch.bfloat16,torch.bfloat16,False,False,asm,3,16,8.3769,_ZN5aiter39bf16gemm_fp32bf16_tn_48x64_splitk_cleanE,0.0295,18.03,448.87
gfx942,80,64,256,6144,False,torch.bfloat16,torch.bfloat16,False,False,asm,5,16,9.0858,_ZN5aiter39bf16gemm_fp32bf16_tn_64x64_splitk_cleanE,0.03,22.16,436.39
gfx942,80,96,256,6144,False,torch.bfloat16,torch.bfloat16,False,False,asm,3,10,11.0574,_ZN5aiter39bf16gemm_fp32bf16_tn_48x64_splitk_cleanE,0.0231,27.31,395.62
gfx942,80,128,256,6144,False,torch.bfloat16,torch.bfloat16,False,False,opus,10302,0,11.7008,opus_gemm_gfx942_wkc_512x32x16x64_1x1_16x16x16_0x0x0,0.0,34.41,408.87
gfx942,80,192,256,6144,False,torch.bfloat16,torch.bfloat16,False,False,flydsl,769,6,14.7299,flydsl_gemm2_abf16_wbf16_bf16_t64x64x128_split_k6_block_m_warp2_block_n_warp2_block_k_warp2_async_copyFalse_b_to_ldsTrue_b_preshuffleFalse_c_to_ldsFalse_gfx942,0.0248,41.0,380.41
gfx942,80,256,256,6144,False,torch.bfloat16,torch.bfloat16,False,False,asm,5,5,16.6326,_ZN5aiter39bf16gemm_fp32bf16_tn_64x64_splitk_cleanE,0.0156,48.42,386.14
gfx942,80,384,256,6144,False,torch.bfloat16,torch.bfloat16,False,False,asm,8,5,22.1138,_ZN5aiter39bf16gemm_fp32bf16_tn_96x64_splitk_cleanE,0.0146,54.62,364.52
gfx942,80,512,256,6144,False,torch.bfloat16,torch.bfloat16,False,False,opus,10204,6,25.2282,opus_gemm_gfx942_splitk_em3en4_lds1_pgr2_256x128x96x128_2x2_16x16x16_0x0x0,0.0,63.84,384.46
gfx942,80,768,256,6144,False,torch.bfloat16,torch.bfloat16,False,False,opus,10201,3,34.5862,opus_gemm_gfx942_splitk_p1_256x64x64x64_2x2_16x16x16_0x0x0,0.0,69.85,375.18
gfx942,80,1024,256,6144,False,torch.bfloat16,torch.bfloat16,False,False,torch,0,0,35.7927,native,0.0,90.0,454.08
gfx942,80,1536,256,6144,False,torch.bfloat16,torch.bfloat16,False,False,opus,10216,11,47.8542,opus_gemm_gfx942_splitk_quad_mfma32_bf16ws_256x256x256x32_2x2_32x32x8_6x0x0,0.0123,100.97,476.58
gfx942,80,2048,256,6144,False,torch.bfloat16,torch.bfloat16,False,False,opus,10216,0,52.3827,opus_gemm_gfx942_splitk_quad_mfma32_bf16ws_256x256x256x32_2x2_32x32x8_6x0x0,0.012,122.99,560.49
gfx942,80,3072,256,6144,False,torch.bfloat16,torch.bfloat16,False,False,opus,10216,6,78.0534,opus_gemm_gfx942_splitk_quad_mfma32_bf16ws_256x256x256x32_2x2_32x32x8_6x0x0,0.0113,123.81,544.08
gfx942,80,4096,256,6144,False,torch.bfloat16,torch.bfloat16,False,False,opus,10216,10,97.7382,opus_gemm_gfx942_splitk_quad_mfma32_bf16ws_256x256x256x32_2x2_32x32x8_6x0x0,0.012,131.83,568.61
gfx942,80,8192,256,6144,False,torch.bfloat16,torch.bfloat16,False,False,opus,10216,7,178.447,opus_gemm_gfx942_splitk_quad_mfma32_bf16ws_256x256x256x32_2x2_32x32x8_6x0x0,0.0116,144.41,605.24
gfx942,80,16384,256,6144,False,torch.bfloat16,torch.bfloat16,False,False,triton,0,0,336.8619,auto,0.0,153.0,631.89
gfx942,80,32768,256,6144,False,torch.bfloat16,torch.bfloat16,False,False,triton,0,0,650.7827,auto,0.0,158.39,649.34
