aiter/configs/model_configs/glm5_fp4_tuned_fmoe.csv
cu_num,token,model_dim,inter_dim,expert,topk,act_type,dtype,q_dtype_a,q_dtype_w,q_type,use_g1u1,doweight_stage1,block_m,ksplit,us1,kernelName1,err1,us2,kernelName2,err2,us,run_1stage,tflops,bw,_tag
256,1,6144,256,257,9,ActivationType.Silu,torch.bfloat16,torch.float4_e2m1fn_x2,torch.float4_e2m1fn_x2,QuantType.per_1x32,1,0,32,0,15.0,flydsl_moe1_afp4_wfp4_bf16_t32x128x256_w3_fp4,20.0%,8.0,moe_ck2stages_gemm2_64x32x32x128_1x1_MulABScaleExpertWeightShuffled_v1_Nswizzle0_Quant3_MulRoutedWeight1_FP4X2_FP4X2_B16,1.5%,23.0,0,0.0,0.0,
256,2,6144,256,257,9,ActivationType.Silu,torch.bfloat16,torch.float4_e2m1fn_x2,torch.float4_e2m1fn_x2,QuantType.per_1x32,1,0,32,0,18.0,flydsl_moe1_afp4_wfp4_bf16_t32x64x256_w3_fp4,20.0%,9.5,moe_ck2stages_gemm2_64x32x32x128_1x1_MulABScaleExpertWeightShuffled_v1_Nswizzle0_Quant3_MulRoutedWeight1_FP4X2_FP4X2_B16,1.5%,27.5,0,0.0,0.0,
256,4,6144,256,257,9,ActivationType.Silu,torch.bfloat16,torch.float4_e2m1fn_x2,torch.float4_e2m1fn_x2,QuantType.per_1x32,1,0,32,0,22.0,flydsl_moe1_afp4_wfp4_bf16_t32x64x256_w3_fp4,20.0%,12.0,flydsl_moe2_afp4_wfp4_bf16_t32x256x256_atomic,1.5%,34.0,0,0.0,0.0,
256,8,6144,256,257,9,ActivationType.Silu,torch.bfloat16,torch.float4_e2m1fn_x2,torch.float4_e2m1fn_x2,QuantType.per_1x32,1,0,32,0,33.0,flydsl_moe1_afp4_wfp4_bf16_t32x32x256_w3,20.0%,19.5,moe_ck2stages_gemm2_64x32x32x128_1x1_MulABScaleExpertWeightShuffled_v1_Nswizzle0_Quant3_MulRoutedWeight1_FP4X2_FP4X2_B16,1.5%,52.5,0,0.0,0.0,
256,12,6144,256,257,9,ActivationType.Silu,torch.bfloat16,torch.float4_e2m1fn_x2,torch.float4_e2m1fn_x2,QuantType.per_1x32,1,0,32,0,35.0,flydsl_moe1_afp4_wfp4_bf16_t32x32x256_w3,20.0%,21.0,moe_ck2stages_gemm2_64x32x32x128_1x1_MulABScaleExpertWeightShuffled_v1_Nswizzle0_Quant3_MulRoutedWeight1_FP4X2_FP4X2_B16,1.5%,56.0,0,0.0,0.0,
256,16,6144,256,257,9,ActivationType.Silu,torch.bfloat16,torch.float4_e2m1fn_x2,torch.float4_e2m1fn_x2,QuantType.per_1x32,1,0,32,0,54.0,flydsl_moe1_afp4_wfp4_bf16_t32x64x256_w4,20.0%,32.0,flydsl_moe2_afp4_wfp4_bf16_t16x256x256_atomic_sbm32,1.5%,86.0,0,0.0,0.0,
256,24,6144,256,257,9,ActivationType.Silu,torch.bfloat16,torch.float4_e2m1fn_x2,torch.float4_e2m1fn_x2,QuantType.per_1x32,1,0,32,0,60.0,flydsl_moe1_afp4_wfp4_bf16_t32x32x256_w3,20.0%,35.0,moe_ck2stages_gemm2_64x32x32x128_1x1_MulABScaleExpertWeightShuffled_v1_Nswizzle0_Quant3_MulRoutedWeight1_FP4X2_FP4X2_B16,1.5%,95.0,0,0.0,0.0,
256,32,6144,256,257,9,ActivationType.Silu,torch.bfloat16,torch.float4_e2m1fn_x2,torch.float4_e2m1fn_x2,QuantType.per_1x32,1,0,32,0,88.0,flydsl_moe1_afp4_wfp4_bf16_t32x32x256_w3,20.0%,51.0,moe_ck2stages_gemm2_64x32x32x128_1x1_MulABScaleExpertWeightShuffled_v1_Nswizzle0_Quant3_MulRoutedWeight1_FP4X2_FP4X2_B16,1.5%,139.0,0,0.0,0.0,
256,40,6144,256,257,9,ActivationType.Silu,torch.bfloat16,torch.float4_e2m1fn_x2,torch.float4_e2m1fn_x2,QuantType.per_1x32,1,0,32,0,88.0,flydsl_moe1_afp4_wfp4_bf16_t32x32x256_w3,20.0%,51.0,moe_ck2stages_gemm2_64x32x32x128_1x1_MulABScaleExpertWeightShuffled_v1_Nswizzle0_Quant3_MulRoutedWeight1_FP4X2_FP4X2_B16,1.5%,139.0,0,0.0,0.0,
256,48,6144,256,257,9,ActivationType.Silu,torch.bfloat16,torch.float4_e2m1fn_x2,torch.float4_e2m1fn_x2,QuantType.per_1x32,1,0,32,0,88.0,flydsl_moe1_afp4_wfp4_bf16_t32x32x256_w3,20.0%,52.0,moe_ck2stages_gemm2_64x32x32x128_1x1_MulABScaleExpertWeightShuffled_v1_Nswizzle0_Quant3_MulRoutedWeight1_FP4X2_FP4X2_B16,1.5%,140.0,0,0.0,0.0,
256,64,6144,256,257,9,ActivationType.Silu,torch.bfloat16,torch.float4_e2m1fn_x2,torch.float4_e2m1fn_x2,QuantType.per_1x32,1,0,32,0,89.0,flydsl_moe1_afp4_wfp4_bf16_t32x32x256_w3,20.0%,52.0,moe_ck2stages_gemm2_64x32x32x128_1x1_MulABScaleExpertWeightShuffled_v1_Nswizzle0_Quant3_MulRoutedWeight1_FP4X2_FP4X2_B16,1.5%,141.0,0,0.0,0.0,
256,80,6144,256,257,9,ActivationType.Silu,torch.bfloat16,torch.float4_e2m1fn_x2,torch.float4_e2m1fn_x2,QuantType.per_1x32,1,0,32,0,89.0,flydsl_moe1_afp4_wfp4_bf16_t32x32x256_w3,20.0%,52.0,moe_ck2stages_gemm2_64x32x32x128_1x1_MulABScaleExpertWeightShuffled_v1_Nswizzle0_Quant3_MulRoutedWeight1_FP4X2_FP4X2_B16,1.5%,141.0,0,0.0,0.0,
256,96,6144,256,257,9,ActivationType.Silu,torch.bfloat16,torch.float4_e2m1fn_x2,torch.float4_e2m1fn_x2,QuantType.per_1x32,1,0,32,0,89.0,flydsl_moe1_afp4_wfp4_bf16_t32x32x256_w3,20.0%,53.0,moe_ck2stages_gemm2_64x32x32x128_1x1_MulABScaleExpertWeightShuffled_v1_Nswizzle0_Quant3_MulRoutedWeight1_FP4X2_FP4X2_B16,1.5%,142.0,0,0.0,0.0,
256,112,6144,256,257,9,ActivationType.Silu,torch.bfloat16,torch.float4_e2m1fn_x2,torch.float4_e2m1fn_x2,QuantType.per_1x32,1,0,32,0,89.0,flydsl_moe1_afp4_wfp4_bf16_t32x32x256_w3,20.0%,53.0,moe_ck2stages_gemm2_64x32x32x128_1x1_MulABScaleExpertWeightShuffled_v1_Nswizzle0_Quant3_MulRoutedWeight1_FP4X2_FP4X2_B16,1.5%,142.0,0,0.0,0.0,
256,128,6144,256,257,9,ActivationType.Silu,torch.bfloat16,torch.float4_e2m1fn_x2,torch.float4_e2m1fn_x2,QuantType.per_1x32,1,0,32,0,90.0,flydsl_moe1_afp4_wfp4_bf16_t32x32x256_w3,20.0%,55.0,moe_ck2stages_gemm2_64x32x32x128_1x1_MulABScaleExpertWeightShuffled_v1_Nswizzle0_Quant3_MulRoutedWeight1_FP4X2_FP4X2_B16,1.5%,145.0,0,0.0,0.0,
256,160,6144,256,257,9,ActivationType.Silu,torch.bfloat16,torch.float4_e2m1fn_x2,torch.float4_e2m1fn_x2,QuantType.per_1x32,1,0,32,0,90.0,flydsl_moe1_afp4_wfp4_bf16_t32x32x256_w3,20.0%,55.0,moe_ck2stages_gemm2_64x32x32x128_1x1_MulABScaleExpertWeightShuffled_v1_Nswizzle0_Quant3_MulRoutedWeight1_FP4X2_FP4X2_B16,1.5%,145.0,0,0.0,0.0,
256,192,6144,256,257,9,ActivationType.Silu,torch.bfloat16,torch.float4_e2m1fn_x2,torch.float4_e2m1fn_x2,QuantType.per_1x32,1,0,32,0,90.0,flydsl_moe1_afp4_wfp4_bf16_t32x32x256_w3,20.0%,55.0,moe_ck2stages_gemm2_64x32x32x128_1x1_MulABScaleExpertWeightShuffled_v1_Nswizzle0_Quant3_MulRoutedWeight1_FP4X2_FP4X2_B16,1.5%,145.0,0,0.0,0.0,
256,224,6144,256,257,9,ActivationType.Silu,torch.bfloat16,torch.float4_e2m1fn_x2,torch.float4_e2m1fn_x2,QuantType.per_1x32,1,0,32,0,90.0,flydsl_moe1_afp4_wfp4_bf16_t32x32x256_w3,20.0%,56.0,moe_ck2stages_gemm2_64x32x32x128_1x1_MulABScaleExpertWeightShuffled_v1_Nswizzle0_Quant3_MulRoutedWeight1_FP4X2_FP4X2_B16,1.5%,146.0,0,0.0,0.0,
256,256,6144,256,257,9,ActivationType.Silu,torch.bfloat16,torch.float4_e2m1fn_x2,torch.float4_e2m1fn_x2,QuantType.per_1x32,1,0,32,0,90.0,flydsl_moe1_afp4_wfp4_bf16_t32x32x256_w3,20.0%,58.0,flydsl_moe2_afp4_wfp4_bf16_t16x256x256_atomic_sbm32,1.5%,148.0,0,0.0,0.0,
