aiter/configs/model_configs/gptoss_a8w8_bpreshuffle_tuned_gemm.csv
gfx,cu_num,M,N,K,q_dtype_w,libtype,kernelId,splitK,us,kernelName,tflops,bw,errRatio
gfx950,256,1,128,2880,torch.float8_e4m3fn,ck,71,0,19.422,a8w8_bpreshuffle_256x128x128x64_16x16_16x16_4x64x1_4x64x1_1x32x1x8_8x8x1_2x1_intrawave_v3,0.04,19.14,0.0
gfx950,256,2,128,2880,torch.float8_e4m3fn,ck,71,0,19.4771,a8w8_bpreshuffle_256x128x128x64_16x16_16x16_4x64x1_4x64x1_1x32x1x8_8x8x1_2x1_intrawave_v3,0.08,19.25,0.0
gfx950,256,4,128,2880,torch.float8_e4m3fn,ck,71,0,19.5344,a8w8_bpreshuffle_256x128x128x64_16x16_16x16_4x64x1_4x64x1_1x32x1x8_8x8x1_2x1_intrawave_v3,0.15,19.51,0.0
gfx950,256,8,128,2880,torch.float8_e4m3fn,ck,71,0,19.5888,a8w8_bpreshuffle_256x128x128x64_16x16_16x16_4x64x1_4x64x1_1x32x1x8_8x8x1_2x1_intrawave_v3,0.3,20.1,0.0
gfx950,256,16,128,2880,torch.float8_e4m3fn,ck,71,0,19.9328,a8w8_bpreshuffle_256x128x128x64_16x16_16x16_4x64x1_4x64x1_1x32x1x8_8x8x1_2x1_intrawave_v3,0.59,21.01,0.0
gfx950,256,32,128,2880,torch.float8_e4m3fn,ck,71,0,19.6646,a8w8_bpreshuffle_256x128x128x64_16x16_16x16_4x64x1_4x64x1_1x32x1x8_8x8x1_2x1_intrawave_v3,1.2,23.85,0.0
gfx950,256,48,128,2880,torch.float8_e4m3fn,ck,71,0,20.3068,a8w8_bpreshuffle_256x128x128x64_16x16_16x16_4x64x1_4x64x1_1x32x1x8_8x8x1_2x1_intrawave_v3,1.74,25.57,0.0
gfx950,256,64,128,2880,torch.float8_e4m3fn,ck,71,0,19.5404,a8w8_bpreshuffle_256x128x128x64_16x16_16x16_4x64x1_4x64x1_1x32x1x8_8x8x1_2x1_intrawave_v3,2.41,29.14,0.0
gfx950,256,80,128,2880,torch.float8_e4m3fn,ck,71,0,21.0712,a8w8_bpreshuffle_256x128x128x64_16x16_16x16_4x64x1_4x64x1_1x32x1x8_8x8x1_2x1_intrawave_v3,2.8,29.4,0.0
gfx950,256,96,128,2880,torch.float8_e4m3fn,ck,71,0,19.7713,a8w8_bpreshuffle_256x128x128x64_16x16_16x16_4x64x1_4x64x1_1x32x1x8_8x8x1_2x1_intrawave_v3,3.58,33.87,0.0
gfx950,256,112,128,2880,torch.float8_e4m3fn,ck,71,0,19.997,a8w8_bpreshuffle_256x128x128x64_16x16_16x16_4x64x1_4x64x1_1x32x1x8_8x8x1_2x1_intrawave_v3,4.13,36.0,0.0
gfx950,256,128,128,2880,torch.float8_e4m3fn,ck,71,0,19.4852,a8w8_bpreshuffle_256x128x128x64_16x16_16x16_4x64x1_4x64x1_1x32x1x8_8x8x1_2x1_intrawave_v3,4.84,39.52,0.0
gfx950,256,256,128,2880,torch.float8_e4m3fn,ck,71,0,19.7844,a8w8_bpreshuffle_256x128x128x64_16x16_16x16_4x64x1_4x64x1_1x32x1x8_8x8x1_2x1_intrawave_v3,9.54,59.21,0.0
gfx950,256,512,128,2880,torch.float8_e4m3fn,ck,71,0,20.0696,a8w8_bpreshuffle_256x128x128x64_16x16_16x16_4x64x1_4x64x1_1x32x1x8_8x8x1_2x1_intrawave_v3,18.81,98.37,0.0
gfx950,256,1024,128,2880,torch.float8_e4m3fn,ck,71,0,28.2726,a8w8_bpreshuffle_256x128x128x64_16x16_16x16_4x64x1_4x64x1_1x32x1x8_8x8x1_2x1_intrawave_v3,26.7,126.62,0.0
gfx950,256,2048,128,2880,torch.float8_e4m3fn,ck,71,0,28.8976,a8w8_bpreshuffle_256x128x128x64_16x16_16x16_4x64x1_4x64x1_1x32x1x8_8x8x1_2x1_intrawave_v3,52.25,235.01,0.0
gfx950,256,4096,128,2880,torch.float8_e4m3fn,ck,71,0,28.6568,a8w8_bpreshuffle_256x128x128x64_16x16_16x16_4x64x1_4x64x1_1x32x1x8_8x8x1_2x1_intrawave_v3,105.38,461.1,0.0
gfx950,256,8192,128,2880,torch.float8_e4m3fn,ck,71,0,28.3936,a8w8_bpreshuffle_256x128x128x64_16x16_16x16_4x64x1_4x64x1_1x32x1x8_8x8x1_2x1_intrawave_v3,212.72,917.77,0.0
gfx950,256,16384,128,2880,torch.float8_e4m3fn,ck,71,0,29.8827,a8w8_bpreshuffle_256x128x128x64_16x16_16x16_4x64x1_4x64x1_1x32x1x8_8x8x1_2x1_intrawave_v3,404.23,1731.73,0.0
gfx950,256,32768,128,2880,torch.float8_e4m3fn,ck,71,0,34.5406,a8w8_bpreshuffle_256x128x128x64_16x16_16x16_4x64x1_4x64x1_1x32x1x8_8x8x1_2x1_intrawave_v3,699.44,2985.74,0.0
gfx950,256,1,640,2880,torch.float8_e4m3fn,ck,71,0,19.5723,a8w8_bpreshuffle_256x128x128x64_16x16_16x16_4x64x1_4x64x1_1x32x1x8_8x8x1_2x1_intrawave_v3,0.19,94.39,0.0
gfx950,256,2,640,2880,torch.float8_e4m3fn,ck,71,0,19.6105,a8w8_bpreshuffle_256x128x128x64_16x16_16x16_4x64x1_4x64x1_1x32x1x8_8x8x1_2x1_intrawave_v3,0.38,94.41,0.0
gfx950,256,4,640,2880,torch.float8_e4m3fn,ck,71,0,19.6349,a8w8_bpreshuffle_256x128x128x64_16x16_16x16_4x64x1_4x64x1_1x32x1x8_8x8x1_2x1_intrawave_v3,0.75,94.72,0.0
gfx950,256,8,640,2880,torch.float8_e4m3fn,ck,71,0,19.7108,a8w8_bpreshuffle_256x128x128x64_16x16_16x16_4x64x1_4x64x1_1x32x1x8_8x8x1_2x1_intrawave_v3,1.5,95.2,0.0
gfx950,256,16,640,2880,torch.float8_e4m3fn,ck,71,0,19.8844,a8w8_bpreshuffle_256x128x128x64_16x16_16x16_4x64x1_4x64x1_1x32x1x8_8x8x1_2x1_intrawave_v3,2.97,96.04,0.0
gfx950,256,32,640,2880,torch.float8_e4m3fn,ck,71,0,19.9401,a8w8_bpreshuffle_256x128x128x64_16x16_16x16_4x64x1_4x64x1_1x32x1x8_8x8x1_2x1_intrawave_v3,5.92,99.11,0.0
gfx950,256,48,640,2880,torch.float8_e4m3fn,ck,71,0,20.1303,a8w8_bpreshuffle_256x128x128x64_16x16_16x16_4x64x1_4x64x1_1x32x1x8_8x8x1_2x1_intrawave_v3,8.79,101.48,0.0
gfx950,256,64,640,2880,torch.float8_e4m3fn,ck,71,0,20.8362,a8w8_bpreshuffle_256x128x128x64_16x16_16x16_4x64x1_4x64x1_1x32x1x8_8x8x1_2x1_intrawave_v3,11.32,101.24,0.0
gfx950,256,80,640,2880,torch.float8_e4m3fn,ck,71,0,22.5496,a8w8_bpreshuffle_256x128x128x64_16x16_16x16_4x64x1_4x64x1_1x32x1x8_8x8x1_2x1_intrawave_v3,13.08,96.5,0.0
gfx950,256,96,640,2880,torch.float8_e4m3fn,ck,71,0,23.97,a8w8_bpreshuffle_256x128x128x64_16x16_16x16_4x64x1_4x64x1_1x32x1x8_8x8x1_2x1_intrawave_v3,14.76,93.56,0.0
gfx950,256,112,640,2880,torch.float8_e4m3fn,ck,71,0,24.6572,a8w8_bpreshuffle_256x128x128x64_16x16_16x16_4x64x1_4x64x1_1x32x1x8_8x8x1_2x1_intrawave_v3,16.74,93.65,0.0
gfx950,256,128,640,2880,torch.float8_e4m3fn,ck,71,0,24.564,a8w8_bpreshuffle_256x128x128x64_16x16_16x16_4x64x1_4x64x1_1x32x1x8_8x8x1_2x1_intrawave_v3,19.21,96.71,0.0
gfx950,256,256,640,2880,torch.float8_e4m3fn,ck,71,0,27.0279,a8w8_bpreshuffle_256x128x128x64_16x16_16x16_4x64x1_4x64x1_1x32x1x8_8x8x1_2x1_intrawave_v3,34.92,107.6,0.0
gfx950,256,512,640,2880,torch.float8_e4m3fn,ck,71,0,28.0189,a8w8_bpreshuffle_256x128x128x64_16x16_16x16_4x64x1_4x64x1_1x32x1x8_8x8x1_2x1_intrawave_v3,67.36,141.8,0.0
gfx950,256,1024,640,2880,torch.float8_e4m3fn,ck,71,0,28.0356,a8w8_bpreshuffle_256x128x128x64_16x16_16x16_4x64x1_4x64x1_1x32x1x8_8x8x1_2x1_intrawave_v3,134.65,217.69,0.0
gfx950,256,2048,640,2880,torch.float8_e4m3fn,ck,71,0,28.3294,a8w8_bpreshuffle_256x128x128x64_16x16_16x16_4x64x1_4x64x1_1x32x1x8_8x8x1_2x1_intrawave_v3,266.5,365.8,0.0
gfx950,256,4096,640,2880,torch.float8_e4m3fn,ck,71,0,28.7696,a8w8_bpreshuffle_256x128x128x64_16x16_16x16_4x64x1_4x64x1_1x32x1x8_8x8x1_2x1_intrawave_v3,524.84,656.34,0.0
gfx950,256,8192,640,2880,torch.float8_e4m3fn,ck,71,0,36.0852,a8w8_bpreshuffle_256x128x128x64_16x16_16x16_4x64x1_4x64x1_1x32x1x8_8x8x1_2x1_intrawave_v3,836.88,995.48,0.0
gfx950,256,16384,640,2880,torch.float8_e4m3fn,ck,71,0,56.9257,a8w8_bpreshuffle_256x128x128x64_16x16_16x16_4x64x1_4x64x1_1x32x1x8_8x8x1_2x1_intrawave_v3,1061.0,1229.68,0.0
gfx950,256,32768,640,2880,torch.float8_e4m3fn,ck,71,0,104.9576,a8w8_bpreshuffle_256x128x128x64_16x16_16x16_4x64x1_4x64x1_1x32x1x8_8x8x1_2x1_intrawave_v3,1150.9,1316.32,0.0
gfx950,256,1,2560,2880,torch.float8_e4m3fn,ck,75,0,27.0037,a8w8_bpreshuffle_128x16x256x64_16x16_16x16_4x16x1_4x32x1_1x16x1x8_8x8x1_1x2_intrawave_v1,0.55,273.33,0.0
gfx950,256,2,2560,2880,torch.float8_e4m3fn,ck,75,0,26.7813,a8w8_bpreshuffle_128x16x256x64_16x16_16x16_4x16x1_4x32x1_1x16x1x8_8x8x1_1x2_intrawave_v1,1.1,275.89,0.0
gfx950,256,4,2560,2880,torch.float8_e4m3fn,ck,75,0,27.0716,a8w8_bpreshuffle_128x16x256x64_16x16_16x16_4x16x1_4x32x1_1x16x1x8_8x8x1_1x2_intrawave_v1,2.18,273.53,0.0
gfx950,256,8,2560,2880,torch.float8_e4m3fn,ck,75,0,27.118,a8w8_bpreshuffle_128x16x256x64_16x16_16x16_4x16x1_4x32x1_1x16x1x8_8x8x1_1x2_intrawave_v1,4.35,274.24,0.0
gfx950,256,16,2560,2880,torch.float8_e4m3fn,ck,75,0,26.948,a8w8_bpreshuffle_128x16x256x64_16x16_16x16_4x16x1_4x32x1_1x16x1x8_8x8x1_1x2_intrawave_v1,8.75,278.34,0.0
gfx950,256,32,2560,2880,torch.float8_e4m3fn,ck,75,0,26.8564,a8w8_bpreshuffle_128x16x256x64_16x16_16x16_4x16x1_4x32x1_1x16x1x8_8x8x1_1x2_intrawave_v1,17.57,284.06,0.0
gfx950,256,48,2560,2880,torch.float8_e4m3fn,ck,75,0,26.655,a8w8_bpreshuffle_128x16x256x64_16x16_16x16_4x16x1_4x32x1_1x16x1x8_8x8x1_1x2_intrawave_v1,26.55,291.01,0.0
gfx950,256,64,2560,2880,torch.float8_e4m3fn,ck,75,0,26.618,a8w8_bpreshuffle_128x16x256x64_16x16_16x16_4x16x1_4x32x1_1x16x1x8_8x8x1_1x2_intrawave_v1,35.45,296.22,0.0
gfx950,256,80,2560,2880,torch.float8_e4m3fn,ck,75,0,26.3833,a8w8_bpreshuffle_128x16x256x64_16x16_16x16_4x16x1_4x32x1_1x16x1x8_8x8x1_1x2_intrawave_v1,44.71,303.71,0.0
gfx950,256,96,2560,2880,torch.float8_e4m3fn,ck,75,0,26.2588,a8w8_bpreshuffle_128x16x256x64_16x16_16x16_4x16x1_4x32x1_1x16x1x8_8x8x1_1x2_intrawave_v1,53.91,310.02,0.0
gfx950,256,112,2560,2880,torch.float8_e4m3fn,ck,75,0,26.1883,a8w8_bpreshuffle_128x16x256x64_16x16_16x16_4x16x1_4x32x1_1x16x1x8_8x8x1_1x2_intrawave_v1,63.06,315.74,0.0
gfx950,256,128,2560,2880,torch.float8_e4m3fn,ck,75,0,26.2085,a8w8_bpreshuffle_128x16x256x64_16x16_16x16_4x16x1_4x32x1_1x16x1x8_8x8x1_1x2_intrawave_v1,72.02,320.38,0.0
gfx950,256,256,2560,2880,torch.float8_e4m3fn,ck,75,0,26.304,a8w8_bpreshuffle_128x16x256x64_16x16_16x16_4x16x1_4x32x1_1x16x1x8_8x8x1_1x2_intrawave_v1,143.51,358.15,0.0
gfx950,256,512,2560,2880,torch.float8_e4m3fn,ck,71,0,28.6506,a8w8_bpreshuffle_256x128x128x64_16x16_16x16_4x64x1_4x64x1_1x32x1x8_8x8x1_2x1_intrawave_v3,263.51,400.3,0.0
gfx950,256,1024,2560,2880,torch.float8_e4m3fn,ck,71,0,28.3075,a8w8_bpreshuffle_256x128x128x64_16x16_16x16_4x64x1_4x64x1_1x32x1x8_8x8x1_2x1_intrawave_v3,533.41,549.85,0.0
gfx950,256,2048,2560,2880,torch.float8_e4m3fn,ck,71,0,37.0315,a8w8_bpreshuffle_256x128x128x64_16x16_16x16_4x64x1_4x64x1_1x32x1x8_8x8x1_2x1_intrawave_v3,815.49,641.53,0.0
gfx950,256,4096,2560,2880,torch.float8_e4m3fn,ck,72,0,56.2575,a8w8_bpreshuffle_256x64x256x64_16x16_16x16_4x64x1_4x64x1_1x16x1x16_8x8x1_1x2_intrawave_v1,1073.6,713.52,0.0
gfx950,256,8192,2560,2880,torch.float8_e4m3fn,ck,72,0,97.1641,a8w8_bpreshuffle_256x64x256x64_16x16_16x16_4x64x1_4x64x1_1x16x1x16_8x8x1_1x2_intrawave_v1,1243.22,750.37,0.0
gfx950,256,16384,2560,2880,torch.float8_e4m3fn,ck,71,0,177.4008,a8w8_bpreshuffle_256x128x128x64_16x16_16x16_4x64x1_4x64x1_1x32x1x8_8x8x1_2x1_intrawave_v3,1361.84,780.41,0.0
gfx950,256,32768,2560,2880,torch.float8_e4m3fn,ck,71,0,321.9806,a8w8_bpreshuffle_256x128x128x64_16x16_16x16_4x64x1_4x64x1_1x32x1x8_8x8x1_2x1_intrawave_v3,1500.66,837.06,0.0
gfx950,256,1,2880,512,torch.float8_e4m3fn,flydsl,2129,0,2.6823,flydsl_bpreshuflle_16x64x512_F8_F8_B16_1x0x1x3x0_default,1.1,552.08,0.0
gfx950,256,1,2880,2048,torch.float8_e4m3fn,flydsl,1,0,5.4868,flydsl_bpreshuflle_16x64x512_F8_F8_B16_1x0x0x0_default,2.15,1076.41,0.0
gfx950,256,1,2880,4096,torch.float8_e4m3fn,cktile,137,0,7.975,a8w8_bpreshuffle_cktile_0x0x8x4x1x0x0x0x0x3_16x64x512_1x4x1_16x16x128_default,2.96,1480.42,0.0
gfx950,256,2,2880,512,torch.float8_e4m3fn,flydsl,831,0,2.7323,flydsl_bpreshuflle_16x64x512_F8_F8_B16_1x0x1x1x0_default,2.16,544.27,0.0
gfx950,256,2,2880,2048,torch.float8_e4m3fn,flydsl,665,0,5.0131,flydsl_bpreshuflle_16x64x512_F8_F8_B16_1x0x0x2_default,4.71,1179.68,0.0
gfx950,256,2,2880,4096,torch.float8_e4m3fn,cktile,2,0,8.065,a8w8_bpreshuffle_cktile_0x0x8x4x1x0x0x0x0x1_16x64x512_1x4x1_16x16x128_default,5.85,1465.12,0.0
gfx950,256,4,2880,512,torch.float8_e4m3fn,flydsl,1,0,2.7654,flydsl_bpreshuflle_16x64x512_F8_F8_B16_1x0x0x0x0_default,4.27,542.29,0.0
gfx950,256,4,2880,2048,torch.float8_e4m3fn,flydsl,665,0,5.0681,flydsl_bpreshuflle_16x64x512_F8_F8_B16_1x0x0x2_default,9.31,1169.96,0.0
gfx950,256,4,2880,4096,torch.float8_e4m3fn,flydsl,848,0,7.9046,flydsl_bpreshuflle_16x64x512_F8_F8_B16_2x1x0x2_default,11.94,1497.34,0.0
gfx950,256,8,2880,512,torch.float8_e4m3fn,flydsl,665,0,2.7742,flydsl_bpreshuflle_16x64x512_F8_F8_B16_1x0x0x1x0_default,8.5,549.61,0.0
gfx950,256,8,2880,2048,torch.float8_e4m3fn,flydsl,333,0,5.6044,flydsl_bpreshuflle_16x64x512_F8_F8_B16_1x0x0x1_default,16.84,1063.58,0.0
gfx950,256,8,2880,4096,torch.float8_e4m3fn,flydsl,1161,0,7.8927,flydsl_bpreshuflle_16x64x512_F8_F8_B16_2x1x0x3_default,23.91,1504.6,0.0
gfx950,256,16,2880,512,torch.float8_e4m3fn,flydsl,1,0,2.791,flydsl_bpreshuflle_16x64x512_F8_F8_B16_1x0x0x0x0_default,16.91,564.28,0.0
gfx950,256,16,2880,2048,torch.float8_e4m3fn,flydsl,333,0,5.2156,flydsl_bpreshuflle_16x64x512_F8_F8_B16_1x0x0x1_default,36.19,1154.84,0.0
gfx950,256,16,2880,4096,torch.float8_e4m3fn,ck,24,0,7.5724,a8w8_bpreshuffle_128x16x32x512_16x16_16x16_32x4x1_32x4x1_1x16x1x8_4x4x1_1x1_intrawave_v2,49.85,1578.65,0.0
gfx950,256,32,2880,512,torch.float8_e4m3fn,flydsl,1491,0,2.8109,flydsl_bpreshuflle_16x64x512_F8_F8_B16_1x0x1x2x0_default,33.57,595.99,0.0
gfx950,256,32,2880,2048,torch.float8_e4m3fn,flydsl,989,0,5.4779,flydsl_bpreshuflle_16x64x512_F8_F8_B16_1x0x0x3_default,68.91,1122.35,0.0
gfx950,256,32,2880,4096,torch.float8_e4m3fn,ck,10,0,7.8452,a8w8_bpreshuffle_128x16x32x512_16x16_16x16_32x4x1_32x4x1_1x16x1x8_4x4x1_1x1_intrawave_v1,96.23,1543.86,0.0
gfx950,256,48,2880,512,torch.float8_e4m3fn,flydsl,167,0,2.9898,flydsl_bpreshuflle_16x64x512_F8_F8_B16_1x0x1x0x0_default,47.35,593.89,0.0
gfx950,256,48,2880,2048,torch.float8_e4m3fn,flydsl,333,0,5.3907,flydsl_bpreshuflle_16x64x512_F8_F8_B16_1x0x0x1_default,105.04,1163.68,0.0
gfx950,256,48,2880,4096,torch.float8_e4m3fn,ck,11,0,8.3113,a8w8_bpreshuffle_256x16x64x512_16x16_16x16_32x8x1_32x8x1_1x16x1x16_4x4x1_1x1_intrawave_v1,136.26,1476.25,0.0
gfx950,256,64,2880,512,torch.float8_e4m3fn,flydsl,2053,0,2.9762,flydsl_bpreshuflle_16x64x512_F8_F8_B16_1x0x0x3x4_default,63.42,630.32,0.0
gfx950,256,64,2880,2048,torch.float8_e4m3fn,flydsl,665,0,5.7893,flydsl_bpreshuflle_16x64x512_F8_F8_B16_1x0x0x2_default,130.41,1105.13,0.0
gfx950,256,64,2880,4096,torch.float8_e4m3fn,ck,5,0,7.8836,a8w8_bpreshuffle_256x16x64x512_16x16_16x16_32x8x1_32x8x1_1x16x1x16_4x4x1_1x1_intrawave_v1,191.53,1576.34,0.0
gfx950,256,80,2880,512,torch.float8_e4m3fn,flydsl,914,0,3.0993,flydsl_bpreshuflle_16x64x512_F8_F8_B16_1x0x1x1x4_default,76.12,637.67,0.0
gfx950,256,80,2880,2048,torch.float8_e4m3fn,ck,10,0,6.1873,a8w8_bpreshuffle_128x16x32x512_16x16_16x16_32x4x1_32x4x1_1x16x1x8_4x4x1_1x1_intrawave_v1,152.53,1054.24,0.0
gfx950,256,80,2880,4096,torch.float8_e4m3fn,ck,11,0,8.0847,a8w8_bpreshuffle_256x16x64x512_16x16_16x16_32x8x1_32x8x1_1x16x1x16_4x4x1_1x1_intrawave_v1,233.46,1556.64,0.0
gfx950,256,96,2880,512,torch.float8_e4m3fn,flydsl,839,0,3.1616,flydsl_bpreshuflle_32x64x512_F8_F8_B16_1x0x1x1x0_default,89.55,656.84,0.0
gfx950,256,96,2880,2048,torch.float8_e4m3fn,ck,10,0,6.3154,a8w8_bpreshuffle_128x16x32x512_16x16_16x16_32x4x1_32x4x1_1x16x1x8_4x4x1_1x1_intrawave_v1,179.32,1052.63,0.0
gfx950,256,96,2880,4096,torch.float8_e4m3fn,flydsl,529,0,9.334,flydsl_bpreshuflle_32x64x512_F8_F8_B16_2x1x0x1_default,242.65,1365.19,0.0
gfx950,256,112,2880,512,torch.float8_e4m3fn,cktile,138,0,3.3037,a8w8_bpreshuffle_cktile_0x0x8x4x1x0x0x0x0x4_16x64x512_1x4x1_16x16x128_default,99.98,658.97,0.0
gfx950,256,112,2880,2048,torch.float8_e4m3fn,cktile,152,0,6.8252,a8w8_bpreshuffle_cktile_0x0x8x4x1x0x0x0x0x4_32x64x512_1x4x1_16x16x128_default,193.58,992.31,0.0
gfx950,256,112,2880,4096,torch.float8_e4m3fn,cktile,151,0,9.7116,a8w8_bpreshuffle_cktile_0x0x8x4x1x0x0x0x0x3_32x64x512_1x4x1_16x16x128_default,272.09,1328.34,0.0
gfx950,256,128,2880,512,torch.float8_e4m3fn,flydsl,756,0,3.2532,flydsl_bpreshuflle_32x64x512_F8_F8_B16_1x0x0x1x4_default,116.04,700.04,0.0
gfx950,256,128,2880,2048,torch.float8_e4m3fn,ck,12,0,6.8695,a8w8_bpreshuffle_256x32x64x512_16x16_16x16_32x8x1_32x8x1_1x32x1x8_8x8x1_1x2_intrawave_v1,219.8,1004.1,0.0
gfx950,256,128,2880,4096,torch.float8_e4m3fn,flydsl,363,0,10.0152,flydsl_bpreshuflle_32x64x512_F8_F8_B16_2x0x0x1_default,299.7,1295.66,0.0
gfx950,256,256,2880,512,torch.float8_e4m3fn,flydsl,92,0,4.043,flydsl_bpreshuflle_32x64x512_F8_F8_B16_1x0x0x0x4_default,186.74,761.86,0.0
gfx950,256,256,2880,2048,torch.float8_e4m3fn,flydsl,869,0,8.7116,flydsl_bpreshuflle_64x64x256_F8_F8_B16_2x1x0x2_default,346.65,906.5,0.0
gfx950,256,256,2880,4096,torch.float8_e4m3fn,ck,114,0,12.6155,a8w8_bpreshuffle_256x64x64x256_16x16_16x16_16x16x1_16x16x1_1x32x1x8_8x8x1_2x1_intrawave_v3,478.76,1135.08,0.0
gfx950,256,512,2880,512,torch.float8_e4m3fn,flydsl,956,0,5.5306,flydsl_bpreshuflle_64x64x256_F8_F8_B16_2x0x1x1x4_default,273.02,847.25,0.0
gfx950,256,512,2880,2048,torch.float8_e4m3fn,cktile,216,0,10.3387,a8w8_bpreshuffle_cktile_0x0x8x4x1x0x0x0x0x3_48x64x256_1x4x1_16x16x128_default,584.19,957.17,0.0
gfx950,256,512,2880,4096,torch.float8_e4m3fn,cktile,216,0,16.1342,a8w8_bpreshuffle_cktile_0x0x8x4x1x0x0x0x0x3_48x64x256_1x4x1_16x16x128_default,748.7,1043.92,0.0
gfx950,256,1024,2880,512,torch.float8_e4m3fn,flydsl,1537,0,6.9191,flydsl_bpreshuflle_64x192x256_F8_F8_B16_2x0x1x2x0_default,436.46,1141.35,0.0
gfx950,256,1024,2880,2048,torch.float8_e4m3fn,flydsl,379,0,13.3066,flydsl_bpreshuflle_64x192x256_F8_F8_B16_2x0x0x1_default,907.79,1044.12,0.0
gfx950,256,1024,2880,4096,torch.float8_e4m3fn,flydsl,462,0,21.5307,flydsl_bpreshuflle_64x192x256_F8_F8_B16_2x0x1x1_default,1122.08,1016.64,0.0
gfx950,256,2048,2880,512,torch.float8_e4m3fn,flydsl,213,0,9.2591,flydsl_bpreshuflle_64x192x256_F8_F8_B16_2x0x1x0x0_default,652.31,1546.55,0.0
gfx950,256,2048,2880,2048,torch.float8_e4m3fn,flydsl,485,0,19.7673,flydsl_bpreshuflle_128x192x128_F8_F8_B16_2x0x1x1_default,1222.18,1107.34,0.0
gfx950,256,2048,2880,4096,torch.float8_e4m3fn,flydsl,485,0,33.2377,flydsl_bpreshuflle_128x192x128_F8_F8_B16_2x0x1x1_default,1453.72,962.21,0.0
gfx950,256,4096,2880,512,torch.float8_e4m3fn,flydsl,1315,0,12.3303,flydsl_bpreshuflle_128x192x128_F8_F8_B16_2x1x1x1x4_default,979.67,2203.08,0.0
gfx950,256,4096,2880,2048,torch.float8_e4m3fn,flydsl,236,0,29.7961,flydsl_bpreshuflle_128x192x128_F8_F8_B16_2x1x0x0_default,1621.63,1271.3,0.0
gfx950,256,4096,2880,4096,torch.float8_e4m3fn,flydsl,651,0,52.6891,flydsl_bpreshuflle_128x192x128_F8_F8_B16_2x1x1x1_default,1834.09,990.08,0.0
gfx950,256,8192,2880,512,torch.float8_e4m3fn,flydsl,319,0,24.7001,flydsl_bpreshuflle_128x192x128_F8_F8_B16_2x0x1x0x4_default,978.1,2139.86,0.0
gfx950,256,8192,2880,2048,torch.float8_e4m3fn,flydsl,319,0,56.995,flydsl_bpreshuflle_128x192x128_F8_F8_B16_2x1x1x0_default,1695.53,1225.75,0.0
gfx950,256,8192,2880,4096,torch.float8_e4m3fn,flydsl,651,0,97.1461,flydsl_bpreshuflle_128x192x128_F8_F8_B16_2x1x1x1_default,1989.51,952.55,0.0
gfx950,256,16384,2880,512,torch.float8_e4m3fn,flydsl,2554,0,45.6847,flydsl_bpreshuflle_64x192x256_F8_F8_B16_2x1x1x3x4_default,1057.65,2281.62,0.0
gfx950,256,16384,2880,2048,torch.float8_e4m3fn,flydsl,568,0,109.5166,flydsl_bpreshuflle_128x192x128_F8_F8_B16_2x1x0x1_default,1764.79,1221.96,0.0
gfx950,256,16384,2880,4096,torch.float8_e4m3fn,flydsl,153,0,185.7041,flydsl_bpreshuflle_128x192x128_F8_F8_B16_2x0x1x0_default,2080.28,932.53,0.0
gfx950,256,32768,2880,512,torch.float8_e4m3fn,flydsl,2554,0,81.781,flydsl_bpreshuflle_64x192x256_F8_F8_B16_2x1x1x3x4_default,1181.65,2531.09,0.0
gfx950,256,32768,2880,2048,torch.float8_e4m3fn,cktile,121,0,206.4582,a8w8_bpreshuffle_cktile_0x0x8x4x1x0x0x0x0x2_160x192x128_1x4x1_16x16x128_default,1872.28,1267.81,0.0
gfx950,256,32768,2880,4096,torch.float8_e4m3fn,cktile,121,0,333.9967,a8w8_bpreshuffle_cktile_0x0x8x4x1x0x0x0x0x2_160x192x128_1x4x1_16x16x128_default,2314.68,1002.28,0.0
gfx950,256,1,5120,2880,torch.float8_e4m3fn,ck,75,0,26.5027,a8w8_bpreshuffle_128x16x256x64_16x16_16x16_4x16x1_4x32x1_1x16x1x8_8x8x1_1x2_intrawave_v1,1.11,556.88,0.0
gfx950,256,2,5120,2880,torch.float8_e4m3fn,ck,75,0,26.6656,a8w8_bpreshuffle_128x16x256x64_16x16_16x16_4x16x1_4x32x1_1x16x1x8_8x8x1_1x2_intrawave_v1,2.21,553.97,0.0
gfx950,256,4,5120,2880,torch.float8_e4m3fn,ck,75,0,26.6598,a8w8_bpreshuffle_128x16x256x64_16x16_16x16_4x16x1_4x32x1_1x16x1x8_8x8x1_1x2_intrawave_v1,4.42,555.07,0.0
gfx950,256,8,5120,2880,torch.float8_e4m3fn,ck,75,0,26.9896,a8w8_bpreshuffle_128x16x256x64_16x16_16x16_4x16x1_4x32x1_1x16x1x8_8x8x1_1x2_intrawave_v1,8.74,550.23,0.0
gfx950,256,16,5120,2880,torch.float8_e4m3fn,ck,75,0,26.9376,a8w8_bpreshuffle_128x16x256x64_16x16_16x16_4x16x1_4x32x1_1x16x1x8_8x8x1_1x2_intrawave_v1,17.52,555.19,0.0
gfx950,256,32,5120,2880,torch.float8_e4m3fn,ck,75,0,26.6726,a8w8_bpreshuffle_128x16x256x64_16x16_16x16_4x16x1_4x32x1_1x16x1x8_8x8x1_1x2_intrawave_v1,35.38,568.58,0.0
gfx950,256,48,5120,2880,torch.float8_e4m3fn,ck,75,0,26.5364,a8w8_bpreshuffle_128x16x256x64_16x16_16x16_4x16x1_4x32x1_1x16x1x8_8x8x1_1x2_intrawave_v1,53.34,579.41,0.0
gfx950,256,64,5120,2880,torch.float8_e4m3fn,ck,75,0,26.4065,a8w8_bpreshuffle_128x16x256x64_16x16_16x16_4x16x1_4x32x1_1x16x1x8_8x8x1_1x2_intrawave_v1,71.48,590.21,0.0
gfx950,256,80,5120,2880,torch.float8_e4m3fn,ck,75,0,26.3563,a8w8_bpreshuffle_128x16x256x64_16x16_16x16_4x16x1_4x32x1_1x16x1x8_8x8x1_1x2_intrawave_v1,89.52,599.3,0.0
gfx950,256,96,5120,2880,torch.float8_e4m3fn,ck,75,0,26.3326,a8w8_bpreshuffle_128x16x256x64_16x16_16x16_4x16x1_4x32x1_1x16x1x8_8x8x1_1x2_intrawave_v1,107.52,607.81,0.0
gfx950,256,112,5120,2880,torch.float8_e4m3fn,ck,75,0,26.2327,a8w8_bpreshuffle_128x16x256x64_16x16_16x16_4x16x1_4x32x1_1x16x1x8_8x8x1_1x2_intrawave_v1,125.91,618.12,0.0
gfx950,256,128,5120,2880,torch.float8_e4m3fn,ck,75,0,25.8447,a8w8_bpreshuffle_128x16x256x64_16x16_16x16_4x16x1_4x32x1_1x16x1x8_8x8x1_1x2_intrawave_v1,146.06,635.53,0.0
gfx950,256,256,5120,2880,torch.float8_e4m3fn,ck,71,0,28.7212,a8w8_bpreshuffle_256x128x128x64_16x16_16x16_4x64x1_4x64x1_1x32x1x8_8x8x1_2x1_intrawave_v3,262.86,630.35,0.0
gfx950,256,512,5120,2880,torch.float8_e4m3fn,ck,72,0,29.0642,a8w8_bpreshuffle_256x64x256x64_16x16_16x16_4x64x1_4x64x1_1x16x1x16_8x8x1_1x2_intrawave_v1,519.52,738.47,0.0
gfx950,256,1024,5120,2880,torch.float8_e4m3fn,ck,71,0,37.5299,a8w8_bpreshuffle_256x128x128x64_16x16_16x16_4x64x1_4x64x1_1x32x1x8_8x8x1_2x1_intrawave_v3,804.66,750.88,0.0
gfx950,256,2048,5120,2880,torch.float8_e4m3fn,ck,71,0,58.7548,a8w8_bpreshuffle_256x128x128x64_16x16_16x16_4x64x1_4x64x1_1x32x1x8_8x8x1_2x1_intrawave_v3,1027.97,708.29,0.0
gfx950,256,4096,5120,2880,torch.float8_e4m3fn,ck,72,0,96.8795,a8w8_bpreshuffle_256x64x256x64_16x16_16x16_4x64x1_4x64x1_1x16x1x16_8x8x1_1x2_intrawave_v1,1246.87,706.91,0.0
gfx950,256,8192,5120,2880,torch.float8_e4m3fn,ck,71,0,169.2051,a8w8_bpreshuffle_256x128x128x64_16x16_16x16_4x64x1_4x64x1_1x32x1x8_8x8x1_2x1_intrawave_v3,1427.81,722.35,0.0
gfx950,256,16384,5120,2880,torch.float8_e4m3fn,ck,71,0,318.8035,a8w8_bpreshuffle_256x128x128x64_16x16_16x16_4x64x1_4x64x1_1x32x1x8_8x8x1_2x1_intrawave_v3,1515.62,720.52,0.0
gfx950,256,32768,5120,2880,torch.float8_e4m3fn,ck,71,0,625.1325,a8w8_bpreshuffle_256x128x128x64_16x16_16x16_4x64x1_4x64x1_1x32x1x8_8x8x1_2x1_intrawave_v3,1545.86,711.31,0.0
