aiter/configs/model_configs/gptoss_bf16_tuned_gemm.csv
gfx,cu_num,M,N,K,bias,dtype,outdtype,scaleAB,bpreshuffle,libtype,solidx,splitK,us,kernelName,err_ratio,tflops,bw
gfx950,256,1,128,2880,True,torch.bfloat16,torch.bfloat16,False,False,flydsl,3837,5,4.1114,flydsl_gemm8_abf16_wbf16_bf16_t16x64x64_split_k5_block_m_warp1_block_n_warp2_block_k_warp1_async_copyTrue_b_to_ldsTrue_b_preshuffleFalse_c_to_ldsFalse_gfx950,0.0312,0.18,180.79
gfx950,256,2,128,2880,True,torch.bfloat16,torch.bfloat16,False,False,flydsl,2015,9,4.0342,flydsl_gemm5_abf16_wbf16_bf16_t16x64x64_split_k9_block_m_warp1_block_n_warp2_block_k_warp1_async_copyTrue_b_to_ldsTrue_b_preshuffleFalse_c_to_ldsFalse_gfx950,0.0117,0.37,185.74
gfx950,256,4,128,2880,True,torch.bfloat16,torch.bfloat16,False,False,flydsl,2015,9,4.1748,flydsl_gemm5_abf16_wbf16_bf16_t16x64x64_split_k9_block_m_warp1_block_n_warp2_block_k_warp1_async_copyTrue_b_to_ldsTrue_b_preshuffleFalse_c_to_ldsFalse_gfx950,0.0195,0.71,182.37
gfx950,256,8,128,2880,True,torch.bfloat16,torch.bfloat16,False,False,flydsl,2013,9,4.1051,flydsl_gemm5_abf16_wbf16_bf16_t16x64x64_split_k9_block_m_warp1_block_n_warp1_block_k_warp2_async_copyTrue_b_to_ldsTrue_b_preshuffleFalse_c_to_ldsFalse_gfx950,0.0186,1.44,191.32
gfx950,256,16,128,2880,True,torch.bfloat16,torch.bfloat16,False,False,flydsl,1357,9,4.3162,flydsl_gemm4_abf16_wbf16_bf16_t16x64x64_split_k9_block_m_warp1_block_n_warp1_block_k_warp2_async_copyTrue_b_to_ldsTrue_b_preshuffleFalse_c_to_ldsFalse_gfx950,0.0229,2.73,193.12
gfx950,256,32,128,2880,True,torch.bfloat16,torch.bfloat16,False,False,flydsl,2015,9,4.1715,flydsl_gemm5_abf16_wbf16_bf16_t16x64x64_split_k9_block_m_warp1_block_n_warp2_block_k_warp1_async_copyTrue_b_to_ldsTrue_b_preshuffleFalse_c_to_ldsFalse_gfx950,0.0164,5.66,222.89
gfx950,256,48,128,2880,True,torch.bfloat16,torch.bfloat16,False,False,flydsl,2159,9,4.3526,flydsl_gemm5_abf16_wbf16_bf16_t32x64x64_split_k9_block_m_warp2_block_n_warp2_block_k_warp1_async_copyTrue_b_to_ldsTrue_b_preshuffleFalse_c_to_ldsFalse_gfx950,0.0184,8.13,235.73
gfx950,256,64,128,2880,True,torch.bfloat16,torch.bfloat16,False,False,flydsl,3433,9,4.397,flydsl_gemm5_abf16_wbf16_bf16_t32x64x64_split_k9_block_m_warp1_block_n_warp4_block_k_warp1_async_copyTrue_b_to_ldsTrue_b_preshuffleFalse_c_to_ldsFalse_gfx950,0.0164,10.73,255.24
gfx950,256,80,128,2880,True,torch.bfloat16,torch.bfloat16,False,False,flydsl,3433,9,4.3684,flydsl_gemm5_abf16_wbf16_bf16_t32x64x64_split_k9_block_m_warp1_block_n_warp4_block_k_warp1_async_copyTrue_b_to_ldsTrue_b_preshuffleFalse_c_to_ldsFalse_gfx950,0.0174,13.5,278.95
gfx950,256,96,128,2880,True,torch.bfloat16,torch.bfloat16,False,False,flydsl,3431,9,4.5682,flydsl_gemm5_abf16_wbf16_bf16_t32x64x64_split_k9_block_m_warp1_block_n_warp2_block_k_warp2_async_copyTrue_b_to_ldsTrue_b_preshuffleFalse_c_to_ldsFalse_gfx950,0.023,15.49,287.82
gfx950,256,112,128,2880,True,torch.bfloat16,torch.bfloat16,False,False,flydsl,4953,5,4.5743,flydsl_gemm7_abf16_wbf16_bf16_t16x64x64_split_k5_block_m_warp1_block_n_warp2_block_k_warp1_async_copyTrue_b_to_ldsTrue_b_preshuffleFalse_c_to_ldsFalse_gfx950,0.0115,18.05,308.48
gfx950,256,128,128,2880,True,torch.bfloat16,torch.bfloat16,False,False,flydsl,5835,5,4.7799,flydsl_gemm7_abf16_wbf16_bf16_t16x64x64_split_k5_block_m_warp1_block_n_warp1_block_k_warp2_async_copyTrue_b_to_ldsTrue_b_preshuffleFalse_c_to_ldsFalse_gfx950,0.0208,19.74,315.35
gfx950,256,256,128,2880,True,torch.bfloat16,torch.bfloat16,False,False,flydsl,6673,5,5.3465,flydsl_gemm8_abf16_wbf16_bf16_t32x64x64_split_k5_block_m_warp1_block_n_warp2_block_k_warp2_async_copyTrue_b_to_ldsTrue_b_preshuffleFalse_c_to_ldsFalse_gfx950,0.0184,35.3,425.96
gfx950,256,1,640,2880,True,torch.bfloat16,torch.bfloat16,False,False,flydsl,2015,9,4.8827,flydsl_gemm5_abf16_wbf16_bf16_t16x64x64_split_k9_block_m_warp1_block_n_warp2_block_k_warp1_async_copyTrue_b_to_ldsTrue_b_preshuffleFalse_c_to_ldsFalse_gfx950,0.0203,0.75,756.43
gfx950,256,2,640,2880,True,torch.bfloat16,torch.bfloat16,False,False,flydsl,2015,9,4.8427,flydsl_gemm5_abf16_wbf16_bf16_t16x64x64_split_k9_block_m_warp1_block_n_warp2_block_k_warp1_async_copyTrue_b_to_ldsTrue_b_preshuffleFalse_c_to_ldsFalse_gfx950,0.0164,1.52,764.14
gfx950,256,4,640,2880,True,torch.bfloat16,torch.bfloat16,False,False,flydsl,2015,9,5.0595,flydsl_gemm5_abf16_wbf16_bf16_t16x64x64_split_k9_block_m_warp1_block_n_warp2_block_k_warp1_async_copyTrue_b_to_ldsTrue_b_preshuffleFalse_c_to_ldsFalse_gfx950,0.0188,2.91,734.18
gfx950,256,8,640,2880,True,torch.bfloat16,torch.bfloat16,False,False,flydsl,1357,9,5.2253,flydsl_gemm4_abf16_wbf16_bf16_t16x64x64_split_k9_block_m_warp1_block_n_warp1_block_k_warp2_async_copyTrue_b_to_ldsTrue_b_preshuffleFalse_c_to_ldsFalse_gfx950,0.026,5.64,716.27
gfx950,256,16,640,2880,True,torch.bfloat16,torch.bfloat16,False,False,flydsl,2015,9,5.1791,flydsl_gemm5_abf16_wbf16_bf16_t16x64x64_split_k9_block_m_warp1_block_n_warp2_block_k_warp1_async_copyTrue_b_to_ldsTrue_b_preshuffleFalse_c_to_ldsFalse_gfx950,0.0183,11.39,733.53
gfx950,256,32,640,2880,True,torch.bfloat16,torch.bfloat16,False,False,flydsl,3837,5,5.8205,flydsl_gemm8_abf16_wbf16_bf16_t16x64x64_split_k5_block_m_warp1_block_n_warp2_block_k_warp1_async_copyTrue_b_to_ldsTrue_b_preshuffleFalse_c_to_ldsFalse_gfx950,0.014,20.27,672.05
gfx950,256,48,640,2880,True,torch.bfloat16,torch.bfloat16,False,False,flydsl,3837,5,5.9651,flydsl_gemm8_abf16_wbf16_bf16_t16x64x64_split_k5_block_m_warp1_block_n_warp2_block_k_warp1_async_copyTrue_b_to_ldsTrue_b_preshuffleFalse_c_to_ldsFalse_gfx950,0.0137,29.66,674.64
gfx950,256,64,640,2880,True,torch.bfloat16,torch.bfloat16,False,False,flydsl,5079,5,6.5393,flydsl_gemm7_abf16_wbf16_bf16_t32x64x64_split_k5_block_m_warp1_block_n_warp4_block_k_warp1_async_copyTrue_b_to_ldsTrue_b_preshuffleFalse_c_to_ldsFalse_gfx950,0.0135,36.08,632.63
gfx950,256,80,640,2880,True,torch.bfloat16,torch.bfloat16,False,False,flydsl,5793,5,6.7244,flydsl_gemm8_abf16_wbf16_bf16_t32x64x64_split_k5_block_m_warp2_block_n_warp1_block_k_warp1_async_copyTrue_b_to_ldsTrue_b_preshuffleFalse_c_to_ldsFalse_gfx950,0.0135,43.86,631.97
gfx950,256,96,640,2880,True,torch.bfloat16,torch.bfloat16,False,False,flydsl,5793,5,7.0863,flydsl_gemm8_abf16_wbf16_bf16_t32x64x64_split_k5_block_m_warp2_block_n_warp1_block_k_warp1_async_copyTrue_b_to_ldsTrue_b_preshuffleFalse_c_to_ldsFalse_gfx950,0.0133,49.94,615.59
gfx950,256,112,640,2880,True,torch.bfloat16,torch.bfloat16,False,False,flydsl,5657,3,7.4238,flydsl_gemm8_abf16_wbf16_bf16_t16x64x64_split_k3_block_m_warp1_block_n_warp1_block_k_warp2_async_copyTrue_b_to_ldsTrue_b_preshuffleFalse_c_to_ldsFalse_gfx950,0.0165,55.62,602.77
gfx950,256,128,640,2880,True,torch.bfloat16,torch.bfloat16,False,False,flydsl,5049,3,7.6578,flydsl_gemm6_abf16_wbf16_bf16_t16x64x64_split_k3_block_m_warp1_block_n_warp1_block_k_warp2_async_copyTrue_b_to_ldsTrue_b_preshuffleFalse_c_to_ldsFalse_gfx950,0.0162,61.62,599.07
gfx950,256,256,640,2880,True,torch.bfloat16,torch.bfloat16,False,False,flydsl,4281,3,9.6702,flydsl_gemm5_abf16_wbf16_bf16_t32x64x64_split_k3_block_m_warp1_block_n_warp4_block_k_warp1_async_copyTrue_b_to_ldsTrue_b_preshuffleFalse_c_to_ldsFalse_gfx950,0.0091,97.59,567.58
gfx950,256,1,2560,2880,True,torch.bfloat16,torch.bfloat16,False,False,flydsl,4545,5,5.8449,flydsl_gemm7_abf16_wbf16_bf16_t16x64x64_split_k5_block_m_warp1_block_n_warp2_block_k_warp1_async_copyTrue_b_to_ldsTrue_b_preshuffleFalse_c_to_ldsFalse_gfx950,0.0148,2.52,2524.68
gfx950,256,2,2560,2880,True,torch.bfloat16,torch.bfloat16,False,False,flydsl,3761,5,6.1856,flydsl_gemm6_abf16_wbf16_bf16_t16x64x64_split_k5_block_m_warp1_block_n_warp1_block_k_warp1_async_copyTrue_b_to_ldsTrue_b_preshuffleFalse_c_to_ldsFalse_gfx950,0.0129,4.77,2387.38
gfx950,256,4,2560,2880,True,torch.bfloat16,torch.bfloat16,False,False,flydsl,4545,5,6.0998,flydsl_gemm7_abf16_wbf16_bf16_t16x64x64_split_k5_block_m_warp1_block_n_warp2_block_k_warp1_async_copyTrue_b_to_ldsTrue_b_preshuffleFalse_c_to_ldsFalse_gfx950,0.0129,9.67,2424.53
gfx950,256,8,2560,2880,True,torch.bfloat16,torch.bfloat16,False,False,flydsl,2947,5,6.1546,flydsl_gemm5_abf16_wbf16_bf16_t16x64x64_split_k5_block_m_warp1_block_n_warp1_block_k_warp2_async_copyTrue_b_to_ldsTrue_b_preshuffleFalse_c_to_ldsFalse_gfx950,0.0203,19.17,2410.01
gfx950,256,16,2560,2880,True,torch.bfloat16,torch.bfloat16,False,False,flydsl,3763,5,6.8198,flydsl_gemm6_abf16_wbf16_bf16_t16x64x64_split_k5_block_m_warp1_block_n_warp1_block_k_warp2_async_copyTrue_b_to_ldsTrue_b_preshuffleFalse_c_to_ldsFalse_gfx950,0.0197,34.59,2187.7
gfx950,256,32,2560,2880,True,torch.bfloat16,torch.bfloat16,False,False,flydsl,3757,3,7.9143,flydsl_gemm6_abf16_wbf16_bf16_t16x64x64_split_k3_block_m_warp1_block_n_warp1_block_k_warp2_async_copyTrue_b_to_ldsTrue_b_preshuffleFalse_c_to_ldsFalse_gfx950,0.0157,59.62,1907.15
gfx950,256,48,2560,2880,True,torch.bfloat16,torch.bfloat16,False,False,flydsl,5401,3,8.5571,flydsl_gemm8_abf16_wbf16_bf16_t32x64x64_split_k3_block_m_warp1_block_n_warp4_block_k_warp1_async_copyTrue_b_to_ldsTrue_b_preshuffleFalse_c_to_ldsFalse_gfx950,0.0092,82.71,1784.23
gfx950,256,64,2560,2880,True,torch.bfloat16,torch.bfloat16,False,False,flydsl,6901,3,9.6049,flydsl_gemm7_abf16_wbf16_bf16_t32x64x64_split_k3_block_m_warp1_block_n_warp4_block_k_warp1_async_copyTrue_b_to_ldsTrue_b_preshuffleFalse_c_to_ldsFalse_gfx950,0.0092,98.25,1607.71
gfx950,256,80,2560,2880,True,torch.bfloat16,torch.bfloat16,False,False,flydsl,5899,3,10.8801,flydsl_gemm6_abf16_wbf16_bf16_t32x64x64_split_k3_block_m_warp2_block_n_warp2_block_k_warp1_async_copyTrue_b_to_ldsTrue_b_preshuffleFalse_c_to_ldsFalse_gfx950,0.0093,108.42,1435.28
gfx950,256,96,2560,2880,True,torch.bfloat16,torch.bfloat16,False,False,flydsl,3290,1,11.1774,flydsl_gemm8_abf16_wbf16_bf16_t16x64x64_split_k1_block_m_warp1_block_n_warp2_block_k_warp1_async_copyTrue_b_to_ldsTrue_b_preshuffleFalse_c_to_ldsFalse_gfx950,0.0,126.65,1412.68
gfx950,256,112,2560,2880,True,torch.bfloat16,torch.bfloat16,False,False,flydsl,7821,1,11.8488,flydsl_gemm8_abf16_wbf16_bf16_t32x64x64_split_k1_block_m_warp1_block_n_warp2_block_k_warp2_async_copyTrue_b_to_ldsTrue_b_preshuffleFalse_c_to_ldsFalse_gfx950,0.0041,139.38,1347.32
gfx950,256,128,2560,2880,True,torch.bfloat16,torch.bfloat16,False,False,flydsl,3129,1,12.1148,flydsl_gemm6_abf16_wbf16_bf16_t32x64x64_split_k1_block_m_warp1_block_n_warp4_block_k_warp1_async_copyTrue_b_to_ldsTrue_b_preshuffleFalse_c_to_ldsFalse_gfx950,0.0,155.8,1332.11
gfx950,256,256,2560,2880,True,torch.bfloat16,torch.bfloat16,False,False,flydsl,9121,1,15.0155,flydsl_gemm8_abf16_wbf16_bf16_t64x64x64_split_k1_block_m_warp2_block_n_warp2_block_k_warp2_async_copyTrue_b_to_ldsTrue_b_preshuffleFalse_c_to_ldsFalse_gfx950,0.0042,251.4,1167.52
gfx950,256,1,2880,512,True,torch.bfloat16,torch.bfloat16,False,False,triton,0,0,4.0943,auto,0.0,0.72,721.96
gfx950,256,1,2880,2048,True,torch.bfloat16,torch.bfloat16,False,False,flydsl,4561,4,5.5663,flydsl_gemm8_abf16_wbf16_bf16_t16x64x64_split_k4_block_m_warp1_block_n_warp1_block_k_warp1_async_copyTrue_b_to_ldsTrue_b_preshuffleFalse_c_to_ldsFalse_gfx950,0.0094,2.12,2121.04
gfx950,256,1,2880,4096,True,torch.bfloat16,torch.bfloat16,False,False,flydsl,4565,4,7.047,flydsl_gemm8_abf16_wbf16_bf16_t16x64x64_split_k4_block_m_warp1_block_n_warp2_block_k_warp1_async_copyTrue_b_to_ldsTrue_b_preshuffleFalse_c_to_ldsFalse_gfx950,0.0146,3.35,3349.92
gfx950,256,2,2880,512,True,torch.bfloat16,torch.bfloat16,False,False,flydsl,2702,1,4.1919,flydsl_gemm6_abf16_wbf16_bf16_t16x64x64_split_k1_block_m_warp1_block_n_warp2_block_k_warp1_async_copyTrue_b_to_ldsTrue_b_preshuffleFalse_c_to_ldsFalse_gfx950,0.0,1.41,706.76
gfx950,256,2,2880,2048,True,torch.bfloat16,torch.bfloat16,False,False,flydsl,4565,4,5.5641,flydsl_gemm8_abf16_wbf16_bf16_t16x64x64_split_k4_block_m_warp1_block_n_warp2_block_k_warp1_async_copyTrue_b_to_ldsTrue_b_preshuffleFalse_c_to_ldsFalse_gfx950,0.0106,4.24,2123.65
gfx950,256,2,2880,4096,True,torch.bfloat16,torch.bfloat16,False,False,flydsl,4563,4,7.2823,flydsl_gemm8_abf16_wbf16_bf16_t16x64x64_split_k4_block_m_warp1_block_n_warp1_block_k_warp2_async_copyTrue_b_to_ldsTrue_b_preshuffleFalse_c_to_ldsFalse_gfx950,0.0215,6.48,3243.6
gfx950,256,4,2880,512,True,torch.bfloat16,torch.bfloat16,False,False,triton,0,0,3.6821,auto,0.0,3.2,808.3
gfx950,256,4,2880,2048,True,torch.bfloat16,torch.bfloat16,False,False,flydsl,4565,4,5.7636,flydsl_gemm8_abf16_wbf16_bf16_t16x64x64_split_k4_block_m_warp1_block_n_warp2_block_k_warp1_async_copyTrue_b_to_ldsTrue_b_preshuffleFalse_c_to_ldsFalse_gfx950,0.0085,8.19,2053.56
gfx950,256,4,2880,4096,True,torch.bfloat16,torch.bfloat16,False,False,flydsl,3413,4,7.2101,flydsl_gemm6_abf16_wbf16_bf16_t16x64x128_split_k4_block_m_warp1_block_n_warp2_block_k_warp1_async_copyTrue_b_to_ldsTrue_b_preshuffleFalse_c_to_ldsFalse_gfx950,0.0135,13.09,3279.95
gfx950,256,8,2880,512,True,torch.bfloat16,torch.bfloat16,False,False,triton,0,0,4.147,auto,0.0,5.69,724.23
gfx950,256,8,2880,2048,True,torch.bfloat16,torch.bfloat16,False,False,flydsl,4045,4,5.8395,flydsl_gemm7_abf16_wbf16_bf16_t16x64x64_split_k4_block_m_warp1_block_n_warp1_block_k_warp1_async_copyTrue_b_to_ldsTrue_b_preshuffleFalse_c_to_ldsFalse_gfx950,0.0094,16.16,2033.62
gfx950,256,8,2880,4096,True,torch.bfloat16,torch.bfloat16,False,False,flydsl,3449,4,7.4832,flydsl_gemm6_abf16_wbf16_bf16_t16x64x64_split_k4_block_m_warp1_block_n_warp2_block_k_warp1_async_copyTrue_b_to_ldsTrue_b_preshuffleFalse_c_to_ldsFalse_gfx950,0.0128,25.22,3167.71
gfx950,256,16,2880,512,True,torch.bfloat16,torch.bfloat16,False,False,triton,0,0,2.9408,auto,0.0,16.05,1039.74
gfx950,256,16,2880,2048,True,torch.bfloat16,torch.bfloat16,False,False,flydsl,4047,4,6.3039,flydsl_gemm7_abf16_wbf16_bf16_t16x64x64_split_k4_block_m_warp1_block_n_warp1_block_k_warp2_async_copyTrue_b_to_ldsTrue_b_preshuffleFalse_c_to_ldsFalse_gfx950,0.0163,29.94,1896.31
gfx950,256,16,2880,4096,True,torch.bfloat16,torch.bfloat16,False,False,flydsl,2665,4,7.9284,flydsl_gemm5_abf16_wbf16_bf16_t16x64x128_split_k4_block_m_warp1_block_n_warp2_block_k_warp1_async_copyTrue_b_to_ldsTrue_b_preshuffleFalse_c_to_ldsFalse_gfx950,0.0135,47.61,3003.91
gfx950,256,32,2880,512,True,torch.bfloat16,torch.bfloat16,False,False,triton,0,0,3.5169,auto,0.0,26.83,900.28
gfx950,256,32,2880,2048,True,torch.bfloat16,torch.bfloat16,False,False,triton,0,0,7.3185,auto,0.0,51.58,1654.97
gfx950,256,32,2880,4096,True,torch.bfloat16,torch.bfloat16,False,False,flydsl,2869,4,9.2914,flydsl_gemm5_abf16_wbf16_bf16_t32x64x64_split_k4_block_m_warp2_block_n_warp2_block_k_warp1_async_copyTrue_b_to_ldsTrue_b_preshuffleFalse_c_to_ldsFalse_gfx950,0.0133,81.26,2587.28
gfx950,256,48,2880,512,True,torch.bfloat16,torch.bfloat16,False,False,flydsl,3676,1,4.283,flydsl_gemm8_abf16_wbf16_bf16_t16x64x64_split_k1_block_m_warp1_block_n_warp2_block_k_warp1_async_copyTrue_b_to_ldsTrue_b_preshuffleFalse_c_to_ldsFalse_gfx950,0.0,33.05,764.59
gfx950,256,48,2880,2048,True,torch.bfloat16,torch.bfloat16,False,False,flydsl,4155,2,8.129,flydsl_gemm7_abf16_wbf16_bf16_t32x64x64_split_k2_block_m_warp1_block_n_warp2_block_k_warp2_async_copyTrue_b_to_ldsTrue_b_preshuffleFalse_c_to_ldsFalse_gfx950,0.0108,69.66,1509.36
gfx950,256,48,2880,4096,True,torch.bfloat16,torch.bfloat16,False,False,flydsl,2941,4,11.2963,flydsl_gemm5_abf16_wbf16_bf16_t48x64x64_split_k4_block_m_warp1_block_n_warp2_block_k_warp1_async_copyTrue_b_to_ldsTrue_b_preshuffleFalse_c_to_ldsFalse_gfx950,0.013,100.25,2147.84
gfx950,256,64,2880,512,True,torch.bfloat16,torch.bfloat16,False,False,triton,0,0,3.7445,auto,0.0,50.41,903.54
gfx950,256,64,2880,2048,True,torch.bfloat16,torch.bfloat16,False,False,flydsl,4917,2,8.6943,flydsl_gemm6_abf16_wbf16_bf16_t32x64x64_split_k2_block_m_warp1_block_n_warp4_block_k_warp1_async_copyTrue_b_to_ldsTrue_b_preshuffleFalse_c_to_ldsFalse_gfx950,0.0051,86.84,1429.36
gfx950,256,64,2880,4096,True,torch.bfloat16,torch.bfloat16,False,False,triton,0,0,11.4906,auto,0.0,131.41,2130.95
gfx950,256,80,2880,512,True,torch.bfloat16,torch.bfloat16,False,False,flydsl,5027,1,4.4823,flydsl_gemm8_abf16_wbf16_bf16_t32x64x64_split_k1_block_m_warp1_block_n_warp4_block_k_warp1_async_copyTrue_b_to_ldsTrue_b_preshuffleFalse_c_to_ldsFalse_gfx950,0.0,52.64,779.03
gfx950,256,80,2880,2048,True,torch.bfloat16,torch.bfloat16,False,False,flydsl,6119,1,9.1371,flydsl_gemm8_abf16_wbf16_bf16_t32x64x64_split_k1_block_m_warp2_block_n_warp1_block_k_warp2_async_copyTrue_b_to_ldsTrue_b_preshuffleFalse_c_to_ldsFalse_gfx950,0.0033,103.28,1377.35
gfx950,256,80,2880,4096,True,torch.bfloat16,torch.bfloat16,False,False,flydsl,1892,2,12.9555,flydsl_gemm5_abf16_wbf16_bf16_t64x64x128_split_k2_block_m_warp1_block_n_warp4_block_k_warp2_async_copyTrue_b_to_ldsTrue_b_preshuffleFalse_c_to_ldsFalse_gfx950,0.0138,145.69,1907.23
gfx950,256,96,2880,512,True,torch.bfloat16,torch.bfloat16,False,False,flydsl,5027,1,4.5643,flydsl_gemm8_abf16_wbf16_bf16_t32x64x64_split_k1_block_m_warp1_block_n_warp4_block_k_warp1_async_copyTrue_b_to_ldsTrue_b_preshuffleFalse_c_to_ldsFalse_gfx950,0.0,62.03,788.81
gfx950,256,96,2880,2048,True,torch.bfloat16,torch.bfloat16,False,False,flydsl,2895,1,9.404,flydsl_gemm4_abf16_wbf16_bf16_t32x64x128_split_k1_block_m_warp1_block_n_warp4_block_k_warp1_async_copyTrue_b_to_ldsTrue_b_preshuffleFalse_c_to_ldsFalse_gfx950,0.0,120.42,1355.03
gfx950,256,96,2880,4096,True,torch.bfloat16,torch.bfloat16,False,False,flydsl,1481,2,13.5796,flydsl_gemm4_abf16_wbf16_bf16_t64x64x128_split_k2_block_m_warp4_block_n_warp2_block_k_warp1_async_copyTrue_b_to_ldsTrue_b_preshuffleFalse_c_to_ldsFalse_gfx950,0.0066,166.79,1836.02
gfx950,256,112,2880,512,True,torch.bfloat16,torch.bfloat16,False,False,flydsl,4508,1,4.6583,flydsl_gemm7_abf16_wbf16_bf16_t32x64x64_split_k1_block_m_warp2_block_n_warp2_block_k_warp1_async_copyTrue_b_to_ldsTrue_b_preshuffleFalse_c_to_ldsFalse_gfx950,0.0,70.91,796.2
gfx950,256,112,2880,2048,True,torch.bfloat16,torch.bfloat16,False,False,flydsl,2895,1,9.665,flydsl_gemm4_abf16_wbf16_bf16_t32x64x128_split_k1_block_m_warp1_block_n_warp4_block_k_warp1_async_copyTrue_b_to_ldsTrue_b_preshuffleFalse_c_to_ldsFalse_gfx950,0.0,136.7,1334.75
gfx950,256,112,2880,4096,True,torch.bfloat16,torch.bfloat16,False,False,flydsl,3185,2,14.5345,flydsl_gemm4_abf16_wbf16_bf16_t64x64x128_split_k2_block_m_warp2_block_n_warp4_block_k_warp1_async_copyTrue_b_to_ldsTrue_b_preshuffleFalse_c_to_ldsFalse_gfx950,0.0067,181.8,1730.75
gfx950,256,128,2880,512,True,torch.bfloat16,torch.bfloat16,False,False,triton,0,0,4.5758,auto,0.0,82.5,834.27
gfx950,256,128,2880,2048,True,torch.bfloat16,torch.bfloat16,False,False,flydsl,5455,1,10.0113,flydsl_gemm6_abf16_wbf16_bf16_t32x64x128_split_k1_block_m_warp2_block_n_warp1_block_k_warp2_async_copyTrue_b_to_ldsTrue_b_preshuffleFalse_c_to_ldsFalse_gfx950,0.0034,150.82,1304.33
gfx950,256,128,2880,4096,True,torch.bfloat16,torch.bfloat16,False,False,torch,0,0,15.05,native,0.0,200.66,1686.3
gfx950,256,256,2880,512,True,torch.bfloat16,torch.bfloat16,False,False,flydsl,4089,1,5.2854,flydsl_gemm5_abf16_wbf16_bf16_t64x64x64_split_k1_block_m_warp4_block_n_warp2_block_k_warp1_async_copyTrue_b_to_ldsTrue_b_preshuffleFalse_c_to_ldsFalse_gfx950,0.0,142.84,886.56
gfx950,256,256,2880,2048,True,torch.bfloat16,torch.bfloat16,False,False,flydsl,3749,1,11.7801,flydsl_gemm4_abf16_wbf16_bf16_t64x64x128_split_k1_block_m_warp4_block_n_warp2_block_k_warp1_async_copyTrue_b_to_ldsTrue_b_preshuffleFalse_c_to_ldsFalse_gfx950,0.0,256.36,1215.58
gfx950,256,1,5120,2880,True,torch.bfloat16,torch.bfloat16,False,False,flydsl,4539,3,7.8993,flydsl_gemm7_abf16_wbf16_bf16_t16x64x64_split_k3_block_m_warp1_block_n_warp2_block_k_warp1_async_copyTrue_b_to_ldsTrue_b_preshuffleFalse_c_to_ldsFalse_gfx950,0.0102,3.73,3735.42
gfx950,256,2,5120,2880,True,torch.bfloat16,torch.bfloat16,False,False,flydsl,2011,3,7.9632,flydsl_gemm4_abf16_wbf16_bf16_t16x64x64_split_k3_block_m_warp1_block_n_warp2_block_k_warp1_async_copyTrue_b_to_ldsTrue_b_preshuffleFalse_c_to_ldsFalse_gfx950,0.0081,7.41,3707.45
gfx950,256,4,5120,2880,True,torch.bfloat16,torch.bfloat16,False,False,flydsl,5251,3,7.9943,flydsl_gemm8_abf16_wbf16_bf16_t16x64x64_split_k3_block_m_warp1_block_n_warp2_block_k_warp1_async_copyTrue_b_to_ldsTrue_b_preshuffleFalse_c_to_ldsFalse_gfx950,0.0096,14.76,3697.03
gfx950,256,8,5120,2880,True,torch.bfloat16,torch.bfloat16,False,False,flydsl,5251,3,8.1986,flydsl_gemm8_abf16_wbf16_bf16_t16x64x64_split_k3_block_m_warp1_block_n_warp2_block_k_warp1_async_copyTrue_b_to_ldsTrue_b_preshuffleFalse_c_to_ldsFalse_gfx950,0.0088,28.78,3612.71
gfx950,256,16,5120,2880,True,torch.bfloat16,torch.bfloat16,False,False,flydsl,5251,3,8.6447,flydsl_gemm8_abf16_wbf16_bf16_t16x64x64_split_k3_block_m_warp1_block_n_warp2_block_k_warp1_async_copyTrue_b_to_ldsTrue_b_preshuffleFalse_c_to_ldsFalse_gfx950,0.0095,54.58,3441.09
gfx950,256,32,5120,2880,True,torch.bfloat16,torch.bfloat16,False,False,triton,0,0,10.473,auto,0.0,90.11,2864.81
gfx950,256,48,5120,2880,True,torch.bfloat16,torch.bfloat16,False,False,flydsl,3183,3,12.281,flydsl_gemm5_abf16_wbf16_bf16_t48x64x64_split_k3_block_m_warp1_block_n_warp2_block_k_warp1_async_copyTrue_b_to_ldsTrue_b_preshuffleFalse_c_to_ldsFalse_gfx950,0.0091,115.27,2463.9
gfx950,256,64,5120,2880,True,torch.bfloat16,torch.bfloat16,False,False,flydsl,7683,1,12.5569,flydsl_gemm8_abf16_wbf16_bf16_t16x64x64_split_k1_block_m_warp1_block_n_warp1_block_k_warp2_async_copyTrue_b_to_ldsTrue_b_preshuffleFalse_c_to_ldsFalse_gfx950,0.0042,150.31,2430.15
gfx950,256,80,5120,2880,True,torch.bfloat16,torch.bfloat16,False,False,flydsl,7823,1,12.386,flydsl_gemm8_abf16_wbf16_bf16_t32x64x64_split_k1_block_m_warp1_block_n_warp4_block_k_warp1_async_copyTrue_b_to_ldsTrue_b_preshuffleFalse_c_to_ldsFalse_gfx950,0.0,190.48,2484.35
gfx950,256,96,5120,2880,True,torch.bfloat16,torch.bfloat16,False,False,flydsl,7829,1,13.1754,flydsl_gemm8_abf16_wbf16_bf16_t32x64x64_split_k1_block_m_warp2_block_n_warp2_block_k_warp1_async_copyTrue_b_to_ldsTrue_b_preshuffleFalse_c_to_ldsFalse_gfx950,0.0,214.88,2354.93
gfx950,256,112,5120,2880,True,torch.bfloat16,torch.bfloat16,False,False,flydsl,3475,1,14.6942,flydsl_gemm4_abf16_wbf16_bf16_t32x64x64_split_k1_block_m_warp1_block_n_warp2_block_k_warp1_async_copyTrue_b_to_ldsTrue_b_preshuffleFalse_c_to_ldsFalse_gfx950,0.0,224.78,2128.95
gfx950,256,128,5120,2880,True,torch.bfloat16,torch.bfloat16,False,False,flydsl,4331,1,14.4701,flydsl_gemm4_abf16_wbf16_bf16_t32x64x64_split_k1_block_m_warp1_block_n_warp2_block_k_warp1_async_copyTrue_b_to_ldsTrue_b_preshuffleFalse_c_to_ldsFalse_gfx950,0.0,260.87,2179.61
gfx1250,256,1,128,2880,True,torch.bfloat16,torch.bfloat16,False,False,opus,20373,12,9.3144,opus_gemm_gfx1250_splitk_clusterlaunch_tdm_ws_128x64x32x256_2x1_16x16x32_0x0x0_c1x2_p3w2,0.0,0.08,79.8
gfx1250,256,2,128,2880,True,torch.bfloat16,torch.bfloat16,False,False,opus,20111,16,9.5329,opus_gemm_gfx1250_splitk_clusterlaunch_tdm_ws_128x16x32x128_1x2_16x16x32_0x0x0_c1x4_p3w2,0.0,0.15,78.6
gfx1250,256,4,128,2880,True,torch.bfloat16,torch.bfloat16,False,False,opus,20121,12,9.2473,opus_gemm_gfx1250_splitk_clusterlaunch_tdm_ws_128x16x32x256_1x2_16x16x32_0x0x0_c1x2_p3w2,0.0,0.32,82.33
gfx1250,256,8,128,2880,True,torch.bfloat16,torch.bfloat16,False,False,opus,20121,12,9.3401,opus_gemm_gfx1250_splitk_clusterlaunch_tdm_ws_128x16x32x256_1x2_16x16x32_0x0x0_c1x2_p3w2,0.0,0.63,84.09
gfx1250,256,16,128,2880,True,torch.bfloat16,torch.bfloat16,False,False,opus,20129,12,9.2636,opus_gemm_gfx1250_splitk_clusterlaunch_tdm_ws_128x16x32x256_1x2_16x16x32_0x0x0_c1x4_p3w2,0.0,1.27,89.98
gfx1250,256,32,128,2880,True,torch.bfloat16,torch.bfloat16,False,False,opus,20002,6,7.174,opus_gemm_gfx1250_splitk_cluster_tdm_ws_128x16x32x512_1x2_16x16x32_0x0x0_p3w1,0.0,3.29,129.61
gfx1250,256,48,128,2880,True,torch.bfloat16,torch.bfloat16,False,False,opus,20129,11,7.5198,opus_gemm_gfx1250_splitk_clusterlaunch_tdm_ws_128x16x32x256_1x2_16x16x32_0x0x0_c1x4_p3w2,0.0,4.71,136.45
gfx1250,256,64,128,2880,True,torch.bfloat16,torch.bfloat16,False,False,triton,0,0,6.7739,auto,0.0,6.97,165.68
gfx1250,256,80,128,2880,True,torch.bfloat16,torch.bfloat16,False,False,triton,0,0,6.5694,auto,0.0,8.98,185.49
gfx1250,256,96,128,2880,True,torch.bfloat16,torch.bfloat16,False,False,triton,0,0,6.5532,auto,0.0,10.8,200.64
gfx1250,256,112,128,2880,True,torch.bfloat16,torch.bfloat16,False,False,triton,0,0,6.5381,auto,0.0,12.63,215.82
gfx1250,256,128,128,2880,True,torch.bfloat16,torch.bfloat16,False,False,opus,20002,4,6.6654,opus_gemm_gfx1250_splitk_cluster_tdm_ws_128x16x32x512_1x2_16x16x32_0x0x0_p3w1,0.0,14.16,226.14
gfx1250,256,256,128,2880,True,torch.bfloat16,torch.bfloat16,False,False,triton,0,0,6.8758,auto,0.0,27.45,331.22
gfx1250,256,512,128,2880,True,torch.bfloat16,torch.bfloat16,False,False,triton,0,0,0.0,auto,0.0,0.0,0.0
gfx1250,256,1024,128,2880,True,torch.bfloat16,torch.bfloat16,False,False,triton,0,0,0.0,auto,0.0,0.0,0.0
gfx1250,256,2048,128,2880,True,torch.bfloat16,torch.bfloat16,False,False,triton,0,0,0.0,auto,0.0,0.0,0.0
gfx1250,256,4096,128,2880,True,torch.bfloat16,torch.bfloat16,False,False,triton,0,0,0.0,auto,0.0,0.0,0.0
gfx1250,256,8192,128,2880,True,torch.bfloat16,torch.bfloat16,False,False,triton,0,0,0.0,auto,0.0,0.0,0.0
gfx1250,256,16384,128,2880,True,torch.bfloat16,torch.bfloat16,False,False,triton,0,0,0.0,auto,0.0,0.0,0.0
gfx1250,256,1,640,2880,True,torch.bfloat16,torch.bfloat16,False,False,opus,20129,7,7.1634,opus_gemm_gfx1250_splitk_clusterlaunch_tdm_ws_128x16x32x256_1x2_16x16x32_0x0x0_c1x4_p3w2,0.0,0.51,515.6
gfx1250,256,2,640,2880,True,torch.bfloat16,torch.bfloat16,False,False,opus,20133,10,7.2892,opus_gemm_gfx1250_splitk_clusterlaunch_tdm_ws_128x16x32x256_1x2_16x16x32_0x0x0_c1x5_p3w2,0.0,1.01,507.67
gfx1250,256,4,640,2880,True,torch.bfloat16,torch.bfloat16,False,False,opus,20133,7,7.2878,opus_gemm_gfx1250_splitk_clusterlaunch_tdm_ws_128x16x32x256_1x2_16x16x32_0x0x0_c1x5_p3w2,0.0,2.02,509.7
gfx1250,256,8,640,2880,True,torch.bfloat16,torch.bfloat16,False,False,opus,20133,10,7.4375,opus_gemm_gfx1250_splitk_clusterlaunch_tdm_ws_128x16x32x256_1x2_16x16x32_0x0x0_c1x5_p3w2,0.0,3.97,503.22
gfx1250,256,16,640,2880,True,torch.bfloat16,torch.bfloat16,False,False,opus,20259,8,7.7176,opus_gemm_gfx1250_splitk_clusterlaunch_tdm_ws_128x32x32x256_2x1_16x16x32_0x0x0_c1x5_p3w2,0.0,7.64,492.26
gfx1250,256,32,640,2880,True,torch.bfloat16,torch.bfloat16,False,False,opus,20111,4,7.6102,opus_gemm_gfx1250_splitk_clusterlaunch_tdm_ws_128x16x32x128_1x2_16x16x32_0x0x0_c1x4_p3w2,0.0,15.5,514.0
gfx1250,256,48,640,2880,True,torch.bfloat16,torch.bfloat16,False,False,opus,20259,5,6.9682,opus_gemm_gfx1250_splitk_clusterlaunch_tdm_ws_128x32x32x256_2x1_16x16x32_0x0x0_c1x5_p3w2,0.0,25.39,577.53
gfx1250,256,64,640,2880,True,torch.bfloat16,torch.bfloat16,False,False,opus,20157,5,7.369,opus_gemm_gfx1250_splitk_clusterlaunch_tdm_ws_128x16x64x256_1x2_16x16x32_0x0x0_c1x2_p3w2,0.0,32.02,561.4
gfx1250,256,80,640,2880,True,torch.bfloat16,torch.bfloat16,False,False,opus,20133,3,7.604,opus_gemm_gfx1250_splitk_clusterlaunch_tdm_ws_128x16x32x256_1x2_16x16x32_0x0x0_c1x5_p3w2,0.0,38.78,558.86
gfx1250,256,96,640,2880,True,torch.bfloat16,torch.bfloat16,False,False,opus,20255,3,7.5761,opus_gemm_gfx1250_splitk_clusterlaunch_tdm_ws_128x32x32x256_2x1_16x16x32_0x0x0_c1x4_p3w2,0.0,46.71,575.79
gfx1250,256,112,640,2880,True,torch.bfloat16,torch.bfloat16,False,False,opus,20255,2,7.3725,opus_gemm_gfx1250_splitk_clusterlaunch_tdm_ws_128x32x32x256_2x1_16x16x32_0x0x0_c1x4_p3w2,0.0,56.0,606.97
gfx1250,256,128,640,2880,True,torch.bfloat16,torch.bfloat16,False,False,opus,20169,2,8.312,opus_gemm_gfx1250_splitk_clusterlaunch_tdm_ws_128x16x64x256_1x2_16x16x32_0x0x0_c1x5_p3w2,0.0,56.77,551.92
gfx1250,256,256,640,2880,True,torch.bfloat16,torch.bfloat16,False,False,opus,20259,2,8.704,opus_gemm_gfx1250_splitk_clusterlaunch_tdm_ws_128x32x32x256_2x1_16x16x32_0x0x0_c1x5_p3w2,0.0,108.42,630.59
gfx1250,256,1,2560,2880,True,torch.bfloat16,torch.bfloat16,False,False,opus,20259,2,8.0033,opus_gemm_gfx1250_splitk_clusterlaunch_tdm_ws_128x32x32x256_2x1_16x16x32_0x0x0_c1x5_p3w2,0.0,1.84,1843.8
gfx1250,256,2,2560,2880,True,torch.bfloat16,torch.bfloat16,False,False,opus,20133,4,7.9336,opus_gemm_gfx1250_splitk_clusterlaunch_tdm_ws_128x16x32x256_1x2_16x16x32_0x0x0_c1x5_p3w2,0.0,3.72,1861.37
gfx1250,256,4,2560,2880,True,torch.bfloat16,torch.bfloat16,False,False,opus,20133,4,7.8739,opus_gemm_gfx1250_splitk_clusterlaunch_tdm_ws_128x16x32x256_1x2_16x16x32_0x0x0_c1x5_p3w2,0.0,7.49,1878.25
gfx1250,256,8,2560,2880,True,torch.bfloat16,torch.bfloat16,False,False,opus,20133,2,8.1296,opus_gemm_gfx1250_splitk_clusterlaunch_tdm_ws_128x16x32x256_1x2_16x16x32_0x0x0_c1x5_p3w2,0.0,14.51,1824.52
gfx1250,256,16,2560,2880,True,torch.bfloat16,torch.bfloat16,False,False,opus,20133,2,8.5472,opus_gemm_gfx1250_splitk_clusterlaunch_tdm_ws_128x16x32x256_1x2_16x16x32_0x0x0_c1x5_p3w2,0.0,27.6,1745.56
gfx1250,256,32,2560,2880,True,torch.bfloat16,torch.bfloat16,False,False,opus,20259,2,8.8027,opus_gemm_gfx1250_splitk_clusterlaunch_tdm_ws_128x32x32x256_2x1_16x16x32_0x0x0_c1x5_p3w2,0.0,53.6,1714.67
gfx1250,256,48,2560,2880,True,torch.bfloat16,torch.bfloat16,False,False,opus,20151,4,9.5807,opus_gemm_gfx1250_splitk_clusterlaunch_tdm_ws_128x16x64x128_1x2_16x16x32_0x0x0_c1x5_p3w2,0.0,73.88,1593.6
gfx1250,256,64,2560,2880,True,torch.bfloat16,torch.bfloat16,False,False,opus,20291,2,9.2689,opus_gemm_gfx1250_splitk_clusterlaunch_tdm_ws_128x32x64x256_2x1_16x16x32_0x0x0_c1x4_p3w2,0.0,101.82,1665.99
gfx1250,256,80,2560,2880,True,torch.bfloat16,torch.bfloat16,False,False,opus,20273,4,10.6448,opus_gemm_gfx1250_splitk_clusterlaunch_tdm_ws_128x32x64x128_2x1_16x16x32_0x0x0_c1x4_p3w2,0.0,110.82,1467.01
gfx1250,256,96,2560,2880,True,torch.bfloat16,torch.bfloat16,False,False,opus,20259,2,10.9503,opus_gemm_gfx1250_splitk_clusterlaunch_tdm_ws_128x32x32x256_2x1_16x16x32_0x0x0_c1x5_p3w2,0.0,129.27,1441.98
gfx1250,256,112,2560,2880,True,torch.bfloat16,torch.bfloat16,False,False,opus,20291,2,11.2719,opus_gemm_gfx1250_splitk_clusterlaunch_tdm_ws_128x32x64x256_2x1_16x16x32_0x0x0_c1x4_p3w2,0.0,146.52,1416.28
gfx1250,256,128,2560,2880,True,torch.bfloat16,torch.bfloat16,False,False,opus,20403,3,10.9781,opus_gemm_gfx1250_splitk_clusterlaunch_tdm_ws_128x64x64x128_2x1_16x16x32_0x0x0_c1x5_p3w2,0.0,171.93,1470.04
gfx1250,256,256,2560,2880,True,torch.bfloat16,torch.bfloat16,False,False,opus,20417,1,14.3712,opus_gemm_gfx1250_splitk_clusterlaunch_tdm_ws_128x64x64x256_2x1_16x16x32_0x0x0_c1x4_p3w1,0.0,262.67,1219.86
gfx1250,256,1,2880,512,True,torch.bfloat16,torch.bfloat16,False,False,triton,0,0,4.3091,auto,0.0,0.68,685.97
gfx1250,256,1,2880,2048,True,torch.bfloat16,torch.bfloat16,False,False,opus,20133,2,7.7551,opus_gemm_gfx1250_splitk_clusterlaunch_tdm_ws_128x16x32x256_1x2_16x16x32_0x0x0_c1x5_p3w2,0.0,1.52,1522.4
gfx1250,256,1,2880,4096,True,torch.bfloat16,torch.bfloat16,False,False,opus,20133,3,8.7749,opus_gemm_gfx1250_splitk_clusterlaunch_tdm_ws_128x16x32x256_1x2_16x16x32_0x0x0_c1x5_p3w2,0.0,2.69,2690.28
gfx1250,256,2,2880,512,True,torch.bfloat16,torch.bfloat16,False,False,triton,0,0,4.6893,auto,0.0,1.26,631.8
gfx1250,256,2,2880,2048,True,torch.bfloat16,torch.bfloat16,False,False,opus,20133,4,8.0245,opus_gemm_gfx1250_splitk_clusterlaunch_tdm_ws_128x16x32x256_1x2_16x16x32_0x0x0_c1x5_p3w2,0.0,2.94,1472.51
gfx1250,256,2,2880,4096,True,torch.bfloat16,torch.bfloat16,False,False,opus,20133,3,8.9491,opus_gemm_gfx1250_splitk_clusterlaunch_tdm_ws_128x16x32x256_1x2_16x16x32_0x0x0_c1x5_p3w2,0.0,5.27,2639.47
gfx1250,256,4,2880,512,True,torch.bfloat16,torch.bfloat16,False,False,triton,0,0,4.6738,auto,0.0,2.52,636.8
gfx1250,256,4,2880,2048,True,torch.bfloat16,torch.bfloat16,False,False,opus,20133,2,8.0733,opus_gemm_gfx1250_splitk_clusterlaunch_tdm_ws_128x16x32x256_1x2_16x16x32_0x0x0_c1x5_p3w2,0.0,5.84,1466.06
gfx1250,256,4,2880,4096,True,torch.bfloat16,torch.bfloat16,False,False,opus,20133,3,9.1316,opus_gemm_gfx1250_splitk_clusterlaunch_tdm_ws_128x16x32x256_1x2_16x16x32_0x0x0_c1x5_p3w2,0.0,10.33,2589.77
gfx1250,256,8,2880,512,True,torch.bfloat16,torch.bfloat16,False,False,triton,0,0,4.6373,auto,0.0,5.09,647.66
gfx1250,256,8,2880,2048,True,torch.bfloat16,torch.bfloat16,False,False,opus,20133,3,8.2164,opus_gemm_gfx1250_splitk_clusterlaunch_tdm_ws_128x16x32x256_1x2_16x16x32_0x0x0_c1x5_p3w2,0.0,11.49,1445.32
gfx1250,256,8,2880,4096,True,torch.bfloat16,torch.bfloat16,False,False,opus,20133,3,9.29,opus_gemm_gfx1250_splitk_clusterlaunch_tdm_ws_128x16x32x256_1x2_16x16x32_0x0x0_c1x5_p3w2,0.0,20.32,2551.62
gfx1250,256,16,2880,512,True,torch.bfloat16,torch.bfloat16,False,False,triton,0,0,4.8733,auto,0.0,9.68,627.43
gfx1250,256,16,2880,2048,True,torch.bfloat16,torch.bfloat16,False,False,opus,20133,3,8.0839,opus_gemm_gfx1250_splitk_clusterlaunch_tdm_ws_128x16x32x256_1x2_16x16x32_0x0x0_c1x5_p3w2,0.0,23.35,1478.76
gfx1250,256,16,2880,4096,True,torch.bfloat16,torch.bfloat16,False,False,opus,20133,3,9.4702,opus_gemm_gfx1250_splitk_clusterlaunch_tdm_ws_128x16x32x256_1x2_16x16x32_0x0x0_c1x5_p3w2,0.0,39.86,2514.86
gfx1250,256,32,2880,512,True,torch.bfloat16,torch.bfloat16,False,False,triton,0,0,5.0158,auto,0.0,18.81,631.25
gfx1250,256,32,2880,2048,True,torch.bfloat16,torch.bfloat16,False,False,opus,20169,2,7.947,opus_gemm_gfx1250_splitk_clusterlaunch_tdm_ws_128x16x64x256_1x2_16x16x32_0x0x0_c1x5_p3w2,0.0,47.5,1524.08
gfx1250,256,32,2880,4096,True,torch.bfloat16,torch.bfloat16,False,False,opus,20169,2,9.1236,opus_gemm_gfx1250_splitk_clusterlaunch_tdm_ws_128x16x64x256_1x2_16x16x32_0x0x0_c1x5_p3w2,0.0,82.75,2634.86
gfx1250,256,48,2880,512,True,torch.bfloat16,torch.bfloat16,False,False,triton,0,0,4.8472,auto,0.0,29.2,675.6
gfx1250,256,48,2880,2048,True,torch.bfloat16,torch.bfloat16,False,False,opus,20151,3,8.7284,opus_gemm_gfx1250_splitk_clusterlaunch_tdm_ws_128x16x64x128_1x2_16x16x32_0x0x0_c1x5_p3w2,0.0,64.87,1405.71
gfx1250,256,48,2880,4096,True,torch.bfloat16,torch.bfloat16,False,False,opus,20295,2,10.0656,opus_gemm_gfx1250_splitk_clusterlaunch_tdm_ws_128x32x64x256_2x1_16x16x32_0x0x0_c1x5_p3w2,0.0,112.51,2410.45
gfx1250,256,64,2880,512,True,torch.bfloat16,torch.bfloat16,False,False,triton,0,0,4.9742,auto,0.0,37.94,680.17
gfx1250,256,64,2880,2048,True,torch.bfloat16,torch.bfloat16,False,False,opus,20295,2,8.6105,opus_gemm_gfx1250_splitk_clusterlaunch_tdm_ws_128x32x64x256_2x1_16x16x32_0x0x0_c1x5_p3w2,0.0,87.68,1443.27
gfx1250,256,64,2880,4096,True,torch.bfloat16,torch.bfloat16,False,False,opus,20295,2,10.2273,opus_gemm_gfx1250_splitk_clusterlaunch_tdm_ws_128x32x64x256_2x1_16x16x32_0x0x0_c1x5_p3w2,0.0,147.64,2394.17
gfx1250,256,80,2880,512,True,torch.bfloat16,torch.bfloat16,False,False,triton,0,0,4.6562,auto,0.0,50.67,749.93
gfx1250,256,80,2880,2048,True,torch.bfloat16,torch.bfloat16,False,False,opus,20295,3,9.4359,opus_gemm_gfx1250_splitk_clusterlaunch_tdm_ws_128x32x64x256_2x1_16x16x32_0x0x0_c1x5_p3w2,0.0,100.01,1333.73
gfx1250,256,80,2880,4096,True,torch.bfloat16,torch.bfloat16,False,False,opus,20277,3,12.0399,opus_gemm_gfx1250_splitk_clusterlaunch_tdm_ws_128x32x64x128_2x1_16x16x32_0x0x0_c1x5_p3w2,0.0,156.77,2052.27
gfx1250,256,96,2880,512,True,torch.bfloat16,torch.bfloat16,False,False,triton,0,0,4.6794,auto,0.0,60.5,769.41
gfx1250,256,96,2880,2048,True,torch.bfloat16,torch.bfloat16,False,False,opus,20295,1,9.8028,opus_gemm_gfx1250_splitk_clusterlaunch_tdm_ws_128x32x64x256_2x1_16x16x32_0x0x0_c1x5_p3w2,0.0,115.52,1299.9
gfx1250,256,96,2880,4096,True,torch.bfloat16,torch.bfloat16,False,False,opus,20277,3,11.9138,opus_gemm_gfx1250_splitk_clusterlaunch_tdm_ws_128x32x64x128_2x1_16x16x32_0x0x0_c1x5_p3w2,0.0,190.11,2092.73
gfx1250,256,112,2880,512,True,torch.bfloat16,torch.bfloat16,False,False,triton,0,0,4.7455,auto,0.0,69.6,781.57
gfx1250,256,112,2880,2048,True,torch.bfloat16,torch.bfloat16,False,False,opus,20295,1,10.3879,opus_gemm_gfx1250_splitk_clusterlaunch_tdm_ws_128x32x64x256_2x1_16x16x32_0x0x0_c1x5_p3w2,0.0,127.19,1241.86
gfx1250,256,112,2880,4096,True,torch.bfloat16,torch.bfloat16,False,False,opus,20403,3,13.0767,opus_gemm_gfx1250_splitk_clusterlaunch_tdm_ws_128x64x64x128_2x1_16x16x32_0x0x0_c1x5_p3w2,0.0,202.07,1923.7
gfx1250,256,128,2880,512,True,torch.bfloat16,torch.bfloat16,False,False,triton,0,0,4.7001,auto,0.0,80.31,812.21
gfx1250,256,128,2880,2048,True,torch.bfloat16,torch.bfloat16,False,False,opus,20295,1,10.4512,opus_gemm_gfx1250_splitk_clusterlaunch_tdm_ws_128x32x64x256_2x1_16x16x32_0x0x0_c1x5_p3w2,0.0,144.48,1249.43
gfx1250,256,128,2880,4096,True,torch.bfloat16,torch.bfloat16,False,False,opus,20403,4,12.6142,opus_gemm_gfx1250_splitk_clusterlaunch_tdm_ws_128x64x64x128_2x1_16x16x32_0x0x0_c1x5_p3w2,0.0,239.4,2011.92
gfx1250,256,256,2880,512,True,torch.bfloat16,torch.bfloat16,False,False,triton,0,0,5.3481,auto,0.0,141.17,876.17
gfx1250,256,256,2880,2048,True,torch.bfloat16,torch.bfloat16,False,False,opus,20421,1,12.0605,opus_gemm_gfx1250_splitk_clusterlaunch_tdm_ws_128x64x64x256_2x1_16x16x32_0x0x0_c1x5_p3w1,0.0,250.4,1187.32
gfx1250,256,256,2880,4096,True,torch.bfloat16,torch.bfloat16,False,False,opus,20403,2,16.5508,opus_gemm_gfx1250_splitk_clusterlaunch_tdm_ws_128x64x64x128_2x1_16x16x32_0x0x0_c1x5_p3w2,0.0,364.92,1641.29
gfx1250,256,512,2880,4096,True,torch.bfloat16,torch.bfloat16,False,False,triton,0,0,0.0,auto,0.0,0.0,0.0
gfx1250,256,1024,2880,4096,True,torch.bfloat16,torch.bfloat16,False,False,triton,0,0,0.0,auto,0.0,0.0,0.0
gfx1250,256,2048,2880,4096,True,torch.bfloat16,torch.bfloat16,False,False,triton,0,0,0.0,auto,0.0,0.0,0.0
gfx1250,256,4096,2880,4096,True,torch.bfloat16,torch.bfloat16,False,False,triton,0,0,0.0,auto,0.0,0.0,0.0
gfx1250,256,8192,2880,4096,True,torch.bfloat16,torch.bfloat16,False,False,triton,0,0,0.0,auto,0.0,0.0,0.0
gfx1250,256,16384,2880,4096,True,torch.bfloat16,torch.bfloat16,False,False,triton,0,0,0.0,auto,0.0,0.0,0.0
gfx1250,256,1,5120,2880,True,torch.bfloat16,torch.bfloat16,False,False,opus,20133,2,10.9152,opus_gemm_gfx1250_splitk_clusterlaunch_tdm_ws_128x16x32x256_1x2_16x16x32_0x0x0_c1x5_p3w2,0.0,2.7,2703.31
gfx1250,256,2,5120,2880,True,torch.bfloat16,torch.bfloat16,False,False,opus,20133,2,11.6842,opus_gemm_gfx1250_splitk_clusterlaunch_tdm_ws_128x16x32x256_1x2_16x16x32_0x0x0_c1x5_p3w2,0.0,5.05,2526.76
gfx1250,256,4,5120,2880,True,torch.bfloat16,torch.bfloat16,False,False,opus,20133,2,12.6077,opus_gemm_gfx1250_splitk_clusterlaunch_tdm_ws_128x16x32x256_1x2_16x16x32_0x0x0_c1x5_p3w2,0.0,9.36,2344.22
gfx1250,256,8,5120,2880,True,torch.bfloat16,torch.bfloat16,False,False,opus,20133,2,13.2643,opus_gemm_gfx1250_splitk_clusterlaunch_tdm_ws_128x16x32x256_1x2_16x16x32_0x0x0_c1x5_p3w2,0.0,17.79,2233.0
gfx1250,256,16,5120,2880,True,torch.bfloat16,torch.bfloat16,False,False,opus,20133,2,13.9033,opus_gemm_gfx1250_splitk_clusterlaunch_tdm_ws_128x16x32x256_1x2_16x16x32_0x0x0_c1x5_p3w2,0.0,33.94,2139.58
gfx1250,256,32,5120,2880,True,torch.bfloat16,torch.bfloat16,False,False,opus,20169,2,11.5713,opus_gemm_gfx1250_splitk_clusterlaunch_tdm_ws_128x16x64x256_1x2_16x16x32_0x0x0_c1x5_p3w2,0.0,81.56,2592.9
gfx1250,256,48,5120,2880,True,torch.bfloat16,torch.bfloat16,False,False,opus,20169,1,12.298,opus_gemm_gfx1250_splitk_clusterlaunch_tdm_ws_128x16x64x256_1x2_16x16x32_0x0x0_c1x5_p3w2,0.0,115.11,2460.5
gfx1250,256,64,5120,2880,True,torch.bfloat16,torch.bfloat16,False,False,opus,20295,3,13.4343,opus_gemm_gfx1250_splitk_clusterlaunch_tdm_ws_128x32x64x256_2x1_16x16x32_0x0x0_c1x5_p3w2,0.0,140.49,2271.44
gfx1250,256,80,5120,2880,True,torch.bfloat16,torch.bfloat16,False,False,opus,20295,1,13.1354,opus_gemm_gfx1250_splitk_clusterlaunch_tdm_ws_128x32x64x256_2x1_16x16x32_0x0x0_c1x5_p3w2,0.0,179.61,2342.62
gfx1250,256,96,5120,2880,True,torch.bfloat16,torch.bfloat16,False,False,opus,20295,1,13.1589,opus_gemm_gfx1250_splitk_clusterlaunch_tdm_ws_128x32x64x256_2x1_16x16x32_0x0x0_c1x5_p3w2,0.0,215.15,2357.89
gfx1250,256,112,5120,2880,True,torch.bfloat16,torch.bfloat16,False,False,opus,20421,1,15.7958,opus_gemm_gfx1250_splitk_clusterlaunch_tdm_ws_128x64x64x256_2x1_16x16x32_0x0x0_c1x5_p3w1,0.0,209.11,1980.48
gfx1250,256,128,5120,2880,True,torch.bfloat16,torch.bfloat16,False,False,opus,20421,1,15.3528,opus_gemm_gfx1250_splitk_clusterlaunch_tdm_ws_128x64x64x256_2x1_16x16x32_0x0x0_c1x5_p3w1,0.0,245.88,2054.3
gfx1250,256,256,5120,2880,True,torch.bfloat16,torch.bfloat16,False,False,opus,20565,3,19.9266,opus_gemm_gfx1250_splitk_clusterlaunch_tdm_ws_128x128x128x128_2x1_16x16x32_0x0x0_c1x5_p3w1,0.0,378.88,1685.55
gfx1250,256,512,5120,2880,True,torch.bfloat16,torch.bfloat16,False,False,triton,0,0,0.0,auto,0.0,0.0,0.0
gfx1250,256,1024,5120,2880,True,torch.bfloat16,torch.bfloat16,False,False,triton,0,0,0.0,auto,0.0,0.0,0.0
gfx1250,256,2048,5120,2880,True,torch.bfloat16,torch.bfloat16,False,False,triton,0,0,0.0,auto,0.0,0.0,0.0
gfx1250,256,4096,5120,2880,True,torch.bfloat16,torch.bfloat16,False,False,triton,0,0,0.0,auto,0.0,0.0,0.0
gfx1250,256,8192,5120,2880,True,torch.bfloat16,torch.bfloat16,False,False,triton,0,0,0.0,auto,0.0,0.0,0.0
gfx1250,256,16384,5120,2880,True,torch.bfloat16,torch.bfloat16,False,False,triton,0,0,0.0,auto,0.0,0.0,0.0
gfx1250,256,1,201088,2880,False,torch.bfloat16,torch.bfloat16,False,False,triton,0,0,0.0,auto,0.0,0.0,0.0
gfx1250,256,2,201088,2880,False,torch.bfloat16,torch.bfloat16,False,False,triton,0,0,0.0,auto,0.0,0.0,0.0
gfx1250,256,4,201088,2880,False,torch.bfloat16,torch.bfloat16,False,False,triton,0,0,0.0,auto,0.0,0.0,0.0
gfx1250,256,8,201088,2880,False,torch.bfloat16,torch.bfloat16,False,False,triton,0,0,0.0,auto,0.0,0.0,0.0
gfx1250,256,16,201088,2880,False,torch.bfloat16,torch.bfloat16,False,False,triton,0,0,0.0,auto,0.0,0.0,0.0
gfx1250,256,32,201088,2880,False,torch.bfloat16,torch.bfloat16,False,False,triton,0,0,0.0,auto,0.0,0.0,0.0
gfx1250,256,48,201088,2880,False,torch.bfloat16,torch.bfloat16,False,False,triton,0,0,0.0,auto,0.0,0.0,0.0
gfx1250,256,64,201088,2880,False,torch.bfloat16,torch.bfloat16,False,False,triton,0,0,0.0,auto,0.0,0.0,0.0
gfx1250,256,128,201088,2880,False,torch.bfloat16,torch.bfloat16,False,False,triton,0,0,0.0,auto,0.0,0.0,0.0
gfx1250,256,256,201088,2880,False,torch.bfloat16,torch.bfloat16,False,False,triton,0,0,0.0,auto,0.0,0.0,0.0
gfx1250,256,512,201088,2880,False,torch.bfloat16,torch.bfloat16,False,False,triton,0,0,0.0,auto,0.0,0.0,0.0
gfx1250,256,1024,201088,2880,False,torch.bfloat16,torch.bfloat16,False,False,triton,0,0,0.0,auto,0.0,0.0,0.0
gfx1250,256,2048,201088,2880,False,torch.bfloat16,torch.bfloat16,False,False,triton,0,0,0.0,auto,0.0,0.0,0.0
gfx1250,256,4096,201088,2880,False,torch.bfloat16,torch.bfloat16,False,False,triton,0,0,0.0,auto,0.0,0.0,0.0
gfx1250,256,8192,201088,2880,False,torch.bfloat16,torch.bfloat16,False,False,triton,0,0,0.0,auto,0.0,0.0,0.0
gfx1250,256,16384,201088,2880,False,torch.bfloat16,torch.bfloat16,False,False,triton,0,0,0.0,auto,0.0,0.0,0.0
