aiter/configs/model_configs/gptoss_bf16_tuned_gemm.csv
gfx,cu_num,M,N,K,bias,dtype,outdtype,scaleAB,bpreshuffle,libtype,solidx,splitK,us,kernelName,err_ratio,tflops,bw
gfx950,256,1,128,2880,True,torch.bfloat16,torch.bfloat16,False,False,asm,1,13,4.5843,_ZN5aiter39bf16gemm_fp32bf16_tn_32x64_splitk_cleanE,0.0234,0.16,162.14
gfx950,256,2,128,2880,True,torch.bfloat16,torch.bfloat16,False,False,asm,1,9,4.6253,_ZN5aiter39bf16gemm_fp32bf16_tn_32x64_splitk_cleanE,0.0117,0.32,162.0
gfx950,256,4,128,2880,True,torch.bfloat16,torch.bfloat16,False,False,asm,1,13,4.595,_ZN5aiter39bf16gemm_fp32bf16_tn_32x64_splitk_cleanE,0.0156,0.64,165.69
gfx950,256,8,128,2880,True,torch.bfloat16,torch.bfloat16,False,False,asm,1,11,4.6803,_ZN5aiter39bf16gemm_fp32bf16_tn_32x64_splitk_cleanE,0.0205,1.26,167.81
gfx950,256,16,128,2880,True,torch.bfloat16,torch.bfloat16,False,False,asm,3,13,4.9158,_ZN5aiter39bf16gemm_fp32bf16_tn_48x64_splitk_cleanE,0.0176,2.4,169.56
gfx950,256,32,128,2880,True,torch.bfloat16,torch.bfloat16,False,False,asm,1,14,5.0084,_ZN5aiter39bf16gemm_fp32bf16_tn_32x64_splitk_cleanE,0.0215,4.71,185.65
gfx950,256,48,128,2880,True,torch.bfloat16,torch.bfloat16,False,False,asm,3,15,4.9394,_ZN5aiter39bf16gemm_fp32bf16_tn_48x64_splitk_cleanE,0.0221,7.16,207.73
gfx950,256,64,128,2880,True,torch.bfloat16,torch.bfloat16,False,False,asm,5,14,5.1163,_ZN5aiter39bf16gemm_fp32bf16_tn_64x64_splitk_cleanE,0.0234,9.22,219.36
gfx950,256,80,128,2880,True,torch.bfloat16,torch.bfloat16,False,False,asm,7,14,5.3157,_ZN5aiter39bf16gemm_fp32bf16_tn_80x64_splitk_cleanE,0.0224,11.1,229.24
gfx950,256,96,128,2880,True,torch.bfloat16,torch.bfloat16,False,False,asm,3,9,5.3826,_ZN5aiter39bf16gemm_fp32bf16_tn_48x64_splitk_cleanE,0.0169,13.15,244.27
gfx950,256,112,128,2880,True,torch.bfloat16,torch.bfloat16,False,False,asm,5,7,5.9525,_ZN5aiter39bf16gemm_fp32bf16_tn_64x64_splitk_cleanE,0.0142,13.87,237.06
gfx950,256,128,128,2880,True,torch.bfloat16,torch.bfloat16,False,False,asm,5,11,5.8457,_ZN5aiter39bf16gemm_fp32bf16_tn_64x64_splitk_cleanE,0.019,16.14,257.85
gfx950,256,256,128,2880,True,torch.bfloat16,torch.bfloat16,False,False,asm,5,5,7.2561,_ZN5aiter39bf16gemm_fp32bf16_tn_64x64_splitk_cleanE,0.0121,26.01,313.86
gfx950,256,1,640,2880,True,torch.bfloat16,torch.bfloat16,False,False,flydsl,30,9,6.5955,flydsl_gemm2_abf16_wbf16_bf16_t16x64x64_split_k9_block_m_warp1_block_n_warp2_block_k_warp1_async_copyTrue_b_to_ldsFalse_b_preshuffleFalse_c_to_ldsFalse_gfx950,0.0141,0.56,559.99
gfx950,256,2,640,2880,True,torch.bfloat16,torch.bfloat16,False,False,flydsl,30,9,6.684,flydsl_gemm2_abf16_wbf16_bf16_t16x64x64_split_k9_block_m_warp1_block_n_warp2_block_k_warp1_async_copyTrue_b_to_ldsFalse_b_preshuffleFalse_c_to_ldsFalse_gfx950,0.0172,1.1,553.63
gfx950,256,4,640,2880,True,torch.bfloat16,torch.bfloat16,False,False,flydsl,28,9,6.7639,flydsl_gemm2_abf16_wbf16_bf16_t16x64x64_split_k9_block_m_warp1_block_n_warp1_block_k_warp2_async_copyTrue_b_to_ldsFalse_b_preshuffleFalse_c_to_ldsFalse_gfx950,0.0258,2.18,549.17
gfx950,256,8,640,2880,True,torch.bfloat16,torch.bfloat16,False,False,flydsl,30,9,6.7638,flydsl_gemm2_abf16_wbf16_bf16_t16x64x64_split_k9_block_m_warp1_block_n_warp2_block_k_warp1_async_copyTrue_b_to_ldsFalse_b_preshuffleFalse_c_to_ldsFalse_gfx950,0.0166,4.36,553.35
gfx950,256,16,640,2880,True,torch.bfloat16,torch.bfloat16,False,False,flydsl,31,9,6.7723,flydsl_gemm2_abf16_wbf16_bf16_t16x64x64_split_k9_block_m_warp1_block_n_warp2_block_k_warp1_async_copyTrue_b_to_ldsTrue_b_preshuffleFalse_c_to_ldsFalse_gfx950,0.0185,8.71,560.97
gfx950,256,32,640,2880,True,torch.bfloat16,torch.bfloat16,False,False,flydsl,124,9,7.6195,flydsl_gemm2_abf16_wbf16_bf16_t32x64x64_split_k9_block_m_warp1_block_n_warp4_block_k_warp1_async_copyTrue_b_to_ldsFalse_b_preshuffleFalse_c_to_ldsFalse_gfx950,0.0192,15.48,513.38
gfx950,256,48,640,2880,True,torch.bfloat16,torch.bfloat16,False,False,triton,0,0,7.4843,auto,0.0,23.64,537.7
gfx950,256,64,640,2880,True,torch.bfloat16,torch.bfloat16,False,False,triton,0,0,7.7195,auto,0.0,30.56,535.91
gfx950,256,80,640,2880,True,torch.bfloat16,torch.bfloat16,False,False,asm,7,6,9.0804,_ZN5aiter39bf16gemm_fp32bf16_tn_80x64_splitk_cleanE,0.014,32.48,468.0
gfx950,256,96,640,2880,True,torch.bfloat16,torch.bfloat16,False,False,asm,8,6,9.2387,_ZN5aiter39bf16gemm_fp32bf16_tn_96x64_splitk_cleanE,0.0146,38.31,472.17
gfx950,256,112,640,2880,True,torch.bfloat16,torch.bfloat16,False,False,asm,1,5,9.3411,_ZN5aiter39bf16gemm_fp32bf16_tn_32x64_splitk_cleanE,0.0125,44.2,479.05
gfx950,256,128,640,2880,True,torch.bfloat16,torch.bfloat16,False,False,asm,3,5,9.4524,_ZN5aiter39bf16gemm_fp32bf16_tn_48x64_splitk_cleanE,0.0119,49.92,485.33
gfx950,256,256,640,2880,True,torch.bfloat16,torch.bfloat16,False,False,asm,3,4,10.1493,_ZN5aiter39bf16gemm_fp32bf16_tn_48x64_splitk_cleanE,0.0104,92.98,540.79
gfx950,256,1,2560,2880,True,torch.bfloat16,torch.bfloat16,False,False,flydsl,14,9,7.911,flydsl_gemm2_abf16_wbf16_bf16_t16x128x64_split_k9_block_m_warp1_block_n_warp2_block_k_warp1_async_copyTrue_b_to_ldsFalse_b_preshuffleFalse_c_to_ldsFalse_gfx950,0.0215,1.86,1865.31
gfx950,256,2,2560,2880,True,torch.bfloat16,torch.bfloat16,False,False,flydsl,12,9,7.8603,flydsl_gemm2_abf16_wbf16_bf16_t16x128x64_split_k9_block_m_warp1_block_n_warp1_block_k_warp2_async_copyTrue_b_to_ldsFalse_b_preshuffleFalse_c_to_ldsFalse_gfx950,0.0264,3.75,1878.73
gfx950,256,4,2560,2880,True,torch.bfloat16,torch.bfloat16,False,False,flydsl,12,9,8.0269,flydsl_gemm2_abf16_wbf16_bf16_t16x128x64_split_k9_block_m_warp1_block_n_warp1_block_k_warp2_async_copyTrue_b_to_ldsFalse_b_preshuffleFalse_c_to_ldsFalse_gfx950,0.0257,7.35,1842.44
gfx950,256,8,2560,2880,True,torch.bfloat16,torch.bfloat16,False,False,flydsl,14,9,8.3447,flydsl_gemm2_abf16_wbf16_bf16_t16x128x64_split_k9_block_m_warp1_block_n_warp2_block_k_warp1_async_copyTrue_b_to_ldsFalse_b_preshuffleFalse_c_to_ldsFalse_gfx950,0.0197,14.14,1777.49
gfx950,256,16,2560,2880,True,torch.bfloat16,torch.bfloat16,False,False,flydsl,15,9,9.3196,flydsl_gemm2_abf16_wbf16_bf16_t16x128x64_split_k9_block_m_warp1_block_n_warp2_block_k_warp1_async_copyTrue_b_to_ldsTrue_b_preshuffleFalse_c_to_ldsFalse_gfx950,0.0185,25.32,1600.89
gfx950,256,32,2560,2880,True,torch.bfloat16,torch.bfloat16,False,False,asm,1,4,10.0189,_ZN5aiter39bf16gemm_fp32bf16_tn_32x64_splitk_cleanE,0.01,47.1,1506.53
gfx950,256,48,2560,2880,True,torch.bfloat16,torch.bfloat16,False,False,asm,3,4,10.5559,_ZN5aiter39bf16gemm_fp32bf16_tn_48x64_splitk_cleanE,0.0101,67.05,1446.38
gfx950,256,64,2560,2880,True,torch.bfloat16,torch.bfloat16,False,False,asm,1,3,10.5541,_ZN5aiter39bf16gemm_fp32bf16_tn_32x64_splitk_cleanE,0.0074,89.42,1463.12
gfx950,256,80,2560,2880,True,torch.bfloat16,torch.bfloat16,False,False,asm,7,4,11.1957,_ZN5aiter39bf16gemm_fp32bf16_tn_80x64_splitk_cleanE,0.0101,105.37,1394.82
gfx950,256,96,2560,2880,True,torch.bfloat16,torch.bfloat16,False,False,asm,3,3,11.1972,_ZN5aiter39bf16gemm_fp32bf16_tn_48x64_splitk_cleanE,0.0074,126.42,1410.18
gfx950,256,112,2560,2880,True,torch.bfloat16,torch.bfloat16,False,False,asm,5,3,11.7696,_ZN5aiter39bf16gemm_fp32bf16_tn_64x64_splitk_cleanE,0.0075,140.32,1356.39
gfx950,256,128,2560,2880,True,torch.bfloat16,torch.bfloat16,False,False,asm,5,3,11.8387,_ZN5aiter39bf16gemm_fp32bf16_tn_64x64_splitk_cleanE,0.0074,159.43,1363.18
gfx950,256,256,2560,2880,True,torch.bfloat16,torch.bfloat16,False,False,asm,8,2,15.4769,_ZN5aiter39bf16gemm_fp32bf16_tn_96x64_splitk_cleanE,0.0041,243.9,1132.71
gfx950,256,1,2880,512,True,torch.bfloat16,torch.bfloat16,False,False,triton,0,0,4.2019,auto,0.0,0.7,703.47
gfx950,256,1,2880,2048,True,torch.bfloat16,torch.bfloat16,False,False,flydsl,15,8,6.4037,flydsl_gemm2_abf16_wbf16_bf16_t16x64x128_split_k8_block_m_warp1_block_n_warp2_block_k_warp1_async_copyTrue_b_to_ldsTrue_b_preshuffleFalse_c_to_ldsFalse_gfx950,0.0184,1.84,1843.67
gfx950,256,1,2880,4096,True,torch.bfloat16,torch.bfloat16,False,False,flydsl,31,8,8.1091,flydsl_gemm2_abf16_wbf16_bf16_t16x64x256_split_k8_block_m_warp1_block_n_warp2_block_k_warp1_async_copyTrue_b_to_ldsTrue_b_preshuffleFalse_c_to_ldsFalse_gfx950,0.0205,2.91,2911.16
gfx950,256,2,2880,512,True,torch.bfloat16,torch.bfloat16,False,False,triton,0,0,4.2701,auto,0.0,1.38,693.82
gfx950,256,2,2880,2048,True,torch.bfloat16,torch.bfloat16,False,False,flydsl,27,4,6.0866,flydsl_gemm2_abf16_wbf16_bf16_t16x64x256_split_k4_block_m_warp1_block_n_warp2_block_k_warp1_async_copyTrue_b_to_ldsTrue_b_preshuffleFalse_c_to_ldsFalse_gfx950,0.0106,3.88,1941.35
gfx950,256,2,2880,4096,True,torch.bfloat16,torch.bfloat16,False,False,flydsl,15,8,8.1483,flydsl_gemm2_abf16_wbf16_bf16_t16x64x128_split_k8_block_m_warp1_block_n_warp2_block_k_warp1_async_copyTrue_b_to_ldsTrue_b_preshuffleFalse_c_to_ldsFalse_gfx950,0.0191,5.79,2898.87
gfx950,256,4,2880,512,True,torch.bfloat16,torch.bfloat16,False,False,triton,0,0,3.7501,auto,0.0,3.15,793.65
gfx950,256,4,2880,2048,True,torch.bfloat16,torch.bfloat16,False,False,flydsl,25,4,6.3307,flydsl_gemm2_abf16_wbf16_bf16_t16x64x256_split_k4_block_m_warp1_block_n_warp1_block_k_warp2_async_copyTrue_b_to_ldsTrue_b_preshuffleFalse_c_to_ldsFalse_gfx950,0.0153,7.45,1869.6
gfx950,256,4,2880,4096,True,torch.bfloat16,torch.bfloat16,False,False,flydsl,29,8,8.2158,flydsl_gemm2_abf16_wbf16_bf16_t16x64x256_split_k8_block_m_warp1_block_n_warp1_block_k_warp2_async_copyTrue_b_to_ldsTrue_b_preshuffleFalse_c_to_ldsFalse_gfx950,0.0266,11.49,2878.45
gfx950,256,8,2880,512,True,torch.bfloat16,torch.bfloat16,False,False,triton,0,0,4.3623,auto,0.0,5.41,688.49
gfx950,256,8,2880,2048,True,torch.bfloat16,torch.bfloat16,False,False,flydsl,25,4,6.7349,flydsl_gemm2_abf16_wbf16_bf16_t16x64x256_split_k4_block_m_warp1_block_n_warp1_block_k_warp2_async_copyTrue_b_to_ldsTrue_b_preshuffleFalse_c_to_ldsFalse_gfx950,0.0164,14.01,1763.25
gfx950,256,8,2880,4096,True,torch.bfloat16,torch.bfloat16,False,False,flydsl,29,8,8.564,flydsl_gemm2_abf16_wbf16_bf16_t16x64x256_split_k8_block_m_warp1_block_n_warp1_block_k_warp2_async_copyTrue_b_to_ldsTrue_b_preshuffleFalse_c_to_ldsFalse_gfx950,0.025,22.04,2767.93
gfx950,256,16,2880,512,True,torch.bfloat16,torch.bfloat16,False,False,triton,0,0,3.8086,auto,0.0,12.39,802.83
gfx950,256,16,2880,2048,True,torch.bfloat16,torch.bfloat16,False,False,flydsl,25,4,6.68,flydsl_gemm2_abf16_wbf16_bf16_t16x64x256_split_k4_block_m_warp1_block_n_warp1_block_k_warp2_async_copyTrue_b_to_ldsTrue_b_preshuffleFalse_c_to_ldsFalse_gfx950,0.0165,28.26,1789.55
gfx950,256,16,2880,4096,True,torch.bfloat16,torch.bfloat16,False,False,flydsl,31,8,9.2185,flydsl_gemm2_abf16_wbf16_bf16_t16x64x256_split_k8_block_m_warp1_block_n_warp2_block_k_warp1_async_copyTrue_b_to_ldsTrue_b_preshuffleFalse_c_to_ldsFalse_gfx950,0.0199,40.95,2583.52
gfx950,256,32,2880,512,True,torch.bfloat16,torch.bfloat16,False,False,triton,0,0,4.1894,auto,0.0,22.53,755.77
gfx950,256,32,2880,2048,True,torch.bfloat16,torch.bfloat16,False,False,flydsl,131,4,7.9063,flydsl_gemm2_abf16_wbf16_bf16_t32x64x256_split_k4_block_m_warp2_block_n_warp2_block_k_warp1_async_copyTrue_b_to_ldsTrue_b_preshuffleFalse_c_to_ldsFalse_gfx950,0.0103,47.75,1531.93
gfx950,256,32,2880,4096,True,torch.bfloat16,torch.bfloat16,False,False,torch,0,0,10.3914,native,0.0,72.65,2313.4
gfx950,256,48,2880,512,True,torch.bfloat16,torch.bfloat16,False,False,flydsl,13,1,4.6947,flydsl_gemm2_abf16_wbf16_bf16_t16x64x256_split_k1_block_m_warp1_block_n_warp1_block_k_warp2_async_copyTrue_b_to_ldsTrue_b_preshuffleFalse_c_to_ldsFalse_gfx950,0.0012,30.15,697.54
gfx950,256,48,2880,2048,True,torch.bfloat16,torch.bfloat16,False,False,flydsl,111,2,9.4771,flydsl_gemm2_abf16_wbf16_bf16_t32x64x256_split_k2_block_m_warp1_block_n_warp1_block_k_warp4_async_copyTrue_b_to_ldsTrue_b_preshuffleFalse_c_to_ldsFalse_gfx950,0.0176,59.75,1294.65
gfx950,256,48,2880,4096,True,torch.bfloat16,torch.bfloat16,False,False,torch,0,0,11.3537,native,0.0,99.74,2136.98
gfx950,256,64,2880,512,True,torch.bfloat16,torch.bfloat16,False,False,triton,0,0,4.695,auto,0.0,40.2,720.62
gfx950,256,64,2880,2048,True,torch.bfloat16,torch.bfloat16,False,False,torch,0,0,9.7516,native,0.0,77.42,1274.38
gfx950,256,64,2880,4096,True,torch.bfloat16,torch.bfloat16,False,False,asm,5,5,12.7785,_ZN5aiter39bf16gemm_fp32bf16_tn_64x64_splitk_cleanE,0.0136,118.16,1916.18
gfx950,256,80,2880,512,True,torch.bfloat16,torch.bfloat16,False,False,flydsl,207,1,5.0255,flydsl_gemm2_abf16_wbf16_bf16_t32x64x256_split_k1_block_m_warp1_block_n_warp2_block_k_warp2_async_copyTrue_b_to_ldsTrue_b_preshuffleFalse_c_to_ldsFalse_gfx950,0.0012,46.95,694.82
gfx950,256,80,2880,2048,True,torch.bfloat16,torch.bfloat16,False,False,torch,0,0,10.3053,native,0.0,91.58,1221.21
gfx950,256,80,2880,4096,True,torch.bfloat16,torch.bfloat16,False,False,asm,7,5,12.9477,_ZN5aiter39bf16gemm_fp32bf16_tn_80x64_splitk_cleanE,0.0137,145.77,1908.38
gfx950,256,96,2880,512,True,torch.bfloat16,torch.bfloat16,False,False,flydsl,209,1,5.1603,flydsl_gemm2_abf16_wbf16_bf16_t32x64x256_split_k1_block_m_warp1_block_n_warp4_block_k_warp1_async_copyTrue_b_to_ldsTrue_b_preshuffleFalse_c_to_ldsFalse_gfx950,0.0,54.86,697.71
gfx950,256,96,2880,2048,True,torch.bfloat16,torch.bfloat16,False,False,asm,8,4,10.593,_ZN5aiter39bf16gemm_fp32bf16_tn_96x64_splitk_cleanE,0.0089,106.91,1202.93
gfx950,256,96,2880,4096,True,torch.bfloat16,torch.bfloat16,False,False,asm,8,5,13.5555,_ZN5aiter39bf16gemm_fp32bf16_tn_96x64_splitk_cleanE,0.0137,167.09,1839.28
gfx950,256,112,2880,512,True,torch.bfloat16,torch.bfloat16,False,False,flydsl,207,1,5.3048,flydsl_gemm2_abf16_wbf16_bf16_t32x64x256_split_k1_block_m_warp1_block_n_warp2_block_k_warp2_async_copyTrue_b_to_ldsTrue_b_preshuffleFalse_c_to_ldsFalse_gfx950,0.0011,62.26,699.16
gfx950,256,112,2880,2048,True,torch.bfloat16,torch.bfloat16,False,False,torch,0,0,11.1349,native,0.0,118.65,1158.55
gfx950,256,112,2880,4096,True,torch.bfloat16,torch.bfloat16,False,False,torch,0,0,14.8063,native,0.0,178.47,1698.98
gfx950,256,128,2880,512,True,torch.bfloat16,torch.bfloat16,False,False,triton,0,0,4.708,auto,0.0,80.18,810.85
gfx950,256,128,2880,2048,True,torch.bfloat16,torch.bfloat16,False,False,torch,0,0,10.6741,native,0.0,141.46,1223.34
gfx950,256,128,2880,4096,True,torch.bfloat16,torch.bfloat16,False,False,torch,0,0,15.2092,native,0.0,198.56,1668.65
gfx950,256,256,2880,512,True,torch.bfloat16,torch.bfloat16,False,False,triton,0,0,6.174,auto,0.0,122.28,758.96
gfx950,256,256,2880,2048,True,torch.bfloat16,torch.bfloat16,False,False,torch,0,0,12.663,native,0.0,238.48,1130.82
gfx950,256,1,5120,2880,True,torch.bfloat16,torch.bfloat16,False,False,flydsl,15,9,9.2409,flydsl_gemm2_abf16_wbf16_bf16_t16x128x64_split_k9_block_m_warp1_block_n_warp2_block_k_warp1_async_copyTrue_b_to_ldsTrue_b_preshuffleFalse_c_to_ldsFalse_gfx950,0.0213,3.19,3193.11
gfx950,256,2,5120,2880,True,torch.bfloat16,torch.bfloat16,False,False,flydsl,13,9,9.5265,flydsl_gemm2_abf16_wbf16_bf16_t16x128x64_split_k9_block_m_warp1_block_n_warp1_block_k_warp2_async_copyTrue_b_to_ldsTrue_b_preshuffleFalse_c_to_ldsFalse_gfx950,0.0271,6.19,3099.06
gfx950,256,4,5120,2880,True,torch.bfloat16,torch.bfloat16,False,False,flydsl,13,9,9.6387,flydsl_gemm2_abf16_wbf16_bf16_t16x128x64_split_k9_block_m_warp1_block_n_warp1_block_k_warp2_async_copyTrue_b_to_ldsTrue_b_preshuffleFalse_c_to_ldsFalse_gfx950,0.0259,12.24,3066.31
gfx950,256,8,5120,2880,True,torch.bfloat16,torch.bfloat16,False,False,flydsl,15,9,10.7742,flydsl_gemm2_abf16_wbf16_bf16_t16x128x64_split_k9_block_m_warp1_block_n_warp2_block_k_warp1_async_copyTrue_b_to_ldsTrue_b_preshuffleFalse_c_to_ldsFalse_gfx950,0.0183,21.9,2749.09
gfx950,256,16,5120,2880,True,torch.bfloat16,torch.bfloat16,False,False,flydsl,42,5,11.8692,flydsl_gemm2_abf16_wbf16_bf16_t16x64x64_split_k5_block_m_warp1_block_n_warp2_block_k_warp1_async_copyTrue_b_to_ldsFalse_b_preshuffleFalse_c_to_ldsFalse_gfx950,0.0141,39.75,2506.25
gfx950,256,32,5120,2880,True,torch.bfloat16,torch.bfloat16,False,False,triton,0,0,12.3507,auto,0.0,76.41,2429.27
gfx950,256,48,5120,2880,True,torch.bfloat16,torch.bfloat16,False,False,torch,0,0,13.1923,native,0.0,107.3,2293.7
gfx950,256,64,5120,2880,True,torch.bfloat16,torch.bfloat16,False,False,asm,5,3,13.8524,_ZN5aiter39bf16gemm_fp32bf16_tn_64x64_splitk_cleanE,0.0077,136.25,2202.88
gfx950,256,80,5120,2880,True,torch.bfloat16,torch.bfloat16,False,False,asm,7,3,14.0634,_ZN5aiter39bf16gemm_fp32bf16_tn_80x64_splitk_cleanE,0.0076,167.76,2188.03
gfx950,256,96,5120,2880,True,torch.bfloat16,torch.bfloat16,False,False,asm,8,3,14.4094,_ZN5aiter39bf16gemm_fp32bf16_tn_96x64_splitk_cleanE,0.0076,196.48,2153.26
gfx950,256,112,5120,2880,True,torch.bfloat16,torch.bfloat16,False,False,torch,0,0,17.0735,native,0.0,193.46,1832.27
gfx950,256,128,5120,2880,True,torch.bfloat16,torch.bfloat16,False,False,torch,0,0,17.1502,native,0.0,220.11,1839.0
