aiter/configs/model_configs/gptoss_bf16_tuned_gemm.csv
cu_num,M,N,K,bias,dtype,outdtype,scaleAB,bpreshuffle,libtype,solidx,splitK,us,kernelName,err_ratio,tflops,bw
304,1,5120,2880,True,torch.bfloat16,torch.bfloat16,False,False,triton,618599,0,17.0412,auto,0.0,1.73,1731.52
304,1,2880,4096,True,torch.bfloat16,torch.bfloat16,False,False,triton,618608,0,10.1359,auto,0.0,2.33,2329.04
304,1,128,2880,True,torch.bfloat16,torch.bfloat16,False,False,triton,618603,0,10.3001,auto,0.0,0.07,72.16
304,2,5120,2880,True,torch.bfloat16,torch.bfloat16,False,False,triton,618591,0,17.2327,auto,0.0,3.42,1713.21
304,2,2880,4096,True,torch.bfloat16,torch.bfloat16,False,False,triton,618603,0,10.1022,auto,0.0,4.67,2338.19
304,2,128,2880,True,torch.bfloat16,torch.bfloat16,False,False,triton,618601,0,10.4159,auto,0.0,0.14,71.94
304,4,5120,2880,True,torch.bfloat16,torch.bfloat16,False,False,triton,618599,0,17.3212,auto,0.0,6.81,1706.3
304,4,2880,4096,True,torch.bfloat16,torch.bfloat16,False,False,triton,618603,0,10.3169,auto,0.0,9.15,2292.24
304,4,128,2880,True,torch.bfloat16,torch.bfloat16,False,False,triton,618601,0,10.3779,auto,0.0,0.28,73.36
304,8,5120,2880,True,torch.bfloat16,torch.bfloat16,False,False,triton,618599,0,17.2979,auto,0.0,13.64,1712.3
304,8,2880,4096,True,torch.bfloat16,torch.bfloat16,False,False,triton,618603,0,10.1527,auto,0.0,18.59,2334.81
304,8,128,2880,True,torch.bfloat16,torch.bfloat16,False,False,triton,618603,0,10.8012,auto,0.0,0.55,72.71
304,16,5120,2880,True,torch.bfloat16,torch.bfloat16,False,False,triton,618599,0,17.3674,auto,0.0,27.17,1712.82
304,16,2880,4096,True,torch.bfloat16,torch.bfloat16,False,False,triton,618603,0,10.3801,auto,0.0,36.37,2294.41
304,16,128,2880,True,torch.bfloat16,torch.bfloat16,False,False,triton,618601,0,11.1528,auto,0.0,1.06,74.74
304,32,5120,2880,True,torch.bfloat16,torch.bfloat16,False,False,triton,618591,0,18.8286,auto,0.0,50.12,1593.49
304,32,2880,4096,True,torch.bfloat16,torch.bfloat16,False,False,triton,618604,0,12.1128,auto,0.0,62.33,1984.63
304,32,128,2880,True,torch.bfloat16,torch.bfloat16,False,False,triton,618603,0,11.4643,auto,0.0,2.06,81.1
304,48,5120,2880,True,torch.bfloat16,torch.bfloat16,False,False,triton,618578,0,21.9233,auto,0.0,64.57,1380.23
304,48,2880,4096,True,torch.bfloat16,torch.bfloat16,False,False,triton,618592,0,13.6643,auto,0.0,82.88,1775.62
304,48,128,2880,True,torch.bfloat16,torch.bfloat16,False,False,triton,618603,0,11.7001,auto,0.0,3.02,87.7
304,64,5120,2880,True,torch.bfloat16,torch.bfloat16,False,False,triton,618571,0,22.6181,auto,0.0,83.45,1349.15
304,64,2880,4096,True,torch.bfloat16,torch.bfloat16,False,False,triton,618592,0,14.0454,auto,0.0,107.5,1743.34
304,64,128,2880,True,torch.bfloat16,torch.bfloat16,False,False,triton,618593,0,11.8327,auto,0.0,3.99,94.85
304,80,5120,2880,True,torch.bfloat16,torch.bfloat16,False,False,triton,618571,0,22.5254,auto,0.0,104.74,1366.07
304,80,2880,4096,True,torch.bfloat16,torch.bfloat16,False,False,triton,618590,0,15.9991,auto,0.0,117.97,1544.41
304,80,128,2880,True,torch.bfloat16,torch.bfloat16,False,False,triton,618593,0,11.6769,auto,0.0,5.05,104.36
304,96,5120,2880,True,torch.bfloat16,torch.bfloat16,False,False,triton,618571,0,22.5065,auto,0.0,125.79,1378.59
304,96,2880,4096,True,torch.bfloat16,torch.bfloat16,False,False,triton,618590,0,16.6728,auto,0.0,135.85,1495.39
304,96,128,2880,True,torch.bfloat16,torch.bfloat16,False,False,triton,618593,0,11.8916,auto,0.0,5.95,110.57
304,112,5120,2880,True,torch.bfloat16,torch.bfloat16,False,False,triton,618570,0,24.6222,auto,0.0,134.15,1270.53
304,112,2880,4096,True,torch.bfloat16,torch.bfloat16,False,False,triton,618590,0,17.3106,auto,0.0,152.65,1453.19
304,112,128,2880,True,torch.bfloat16,torch.bfloat16,False,False,triton,618593,0,11.9001,auto,0.0,6.94,118.58
304,128,5120,2880,True,torch.bfloat16,torch.bfloat16,False,False,triton,618570,0,24.8097,auto,0.0,152.15,1271.24
304,128,2880,4096,True,torch.bfloat16,torch.bfloat16,False,False,triton,618590,0,17.9002,auto,0.0,168.71,1417.8
304,128,128,2880,True,torch.bfloat16,torch.bfloat16,False,False,triton,618593,0,11.5906,auto,0.0,8.14,130.05
80,1,5120,2880,True,torch.bfloat16,torch.bfloat16,False,False,triton,618599,0,17.0412,auto,0.0,1.73,1731.52
80,1,2880,4096,True,torch.bfloat16,torch.bfloat16,False,False,triton,618608,0,10.1359,auto,0.0,2.33,2329.04
80,1,128,2880,True,torch.bfloat16,torch.bfloat16,False,False,triton,618603,0,10.3001,auto,0.0,0.07,72.16
80,2,5120,2880,True,torch.bfloat16,torch.bfloat16,False,False,triton,618591,0,17.2327,auto,0.0,3.42,1713.21
80,2,2880,4096,True,torch.bfloat16,torch.bfloat16,False,False,triton,618603,0,10.1022,auto,0.0,4.67,2338.19
80,2,128,2880,True,torch.bfloat16,torch.bfloat16,False,False,triton,618601,0,10.4159,auto,0.0,0.14,71.94
80,4,5120,2880,True,torch.bfloat16,torch.bfloat16,False,False,triton,618599,0,17.3212,auto,0.0,6.81,1706.3
80,4,2880,4096,True,torch.bfloat16,torch.bfloat16,False,False,triton,618603,0,10.3169,auto,0.0,9.15,2292.24
80,4,128,2880,True,torch.bfloat16,torch.bfloat16,False,False,triton,618601,0,10.3779,auto,0.0,0.28,73.36
80,8,5120,2880,True,torch.bfloat16,torch.bfloat16,False,False,triton,618599,0,17.2979,auto,0.0,13.64,1712.3
80,8,2880,4096,True,torch.bfloat16,torch.bfloat16,False,False,triton,618603,0,10.1527,auto,0.0,18.59,2334.81
80,8,128,2880,True,torch.bfloat16,torch.bfloat16,False,False,triton,618603,0,10.8012,auto,0.0,0.55,72.71
80,16,5120,2880,True,torch.bfloat16,torch.bfloat16,False,False,triton,618599,0,17.3674,auto,0.0,27.17,1712.82
80,16,2880,4096,True,torch.bfloat16,torch.bfloat16,False,False,triton,618603,0,10.3801,auto,0.0,36.37,2294.41
80,16,128,2880,True,torch.bfloat16,torch.bfloat16,False,False,triton,618601,0,11.1528,auto,0.0,1.06,74.74
80,32,5120,2880,True,torch.bfloat16,torch.bfloat16,False,False,triton,618591,0,18.8286,auto,0.0,50.12,1593.49
80,32,2880,4096,True,torch.bfloat16,torch.bfloat16,False,False,triton,618604,0,12.1128,auto,0.0,62.33,1984.63
80,32,128,2880,True,torch.bfloat16,torch.bfloat16,False,False,triton,618603,0,11.4643,auto,0.0,2.06,81.1
80,48,5120,2880,True,torch.bfloat16,torch.bfloat16,False,False,triton,618578,0,21.9233,auto,0.0,64.57,1380.23
80,48,2880,4096,True,torch.bfloat16,torch.bfloat16,False,False,triton,618592,0,13.6643,auto,0.0,82.88,1775.62
80,48,128,2880,True,torch.bfloat16,torch.bfloat16,False,False,triton,618603,0,11.7001,auto,0.0,3.02,87.7
80,64,5120,2880,True,torch.bfloat16,torch.bfloat16,False,False,triton,618571,0,22.6181,auto,0.0,83.45,1349.15
80,64,2880,4096,True,torch.bfloat16,torch.bfloat16,False,False,triton,618592,0,14.0454,auto,0.0,107.5,1743.34
80,64,128,2880,True,torch.bfloat16,torch.bfloat16,False,False,triton,618593,0,11.8327,auto,0.0,3.99,94.85
80,80,5120,2880,True,torch.bfloat16,torch.bfloat16,False,False,triton,618571,0,22.5254,auto,0.0,104.74,1366.07
80,80,2880,4096,True,torch.bfloat16,torch.bfloat16,False,False,triton,618590,0,15.9991,auto,0.0,117.97,1544.41
80,80,128,2880,True,torch.bfloat16,torch.bfloat16,False,False,triton,618593,0,11.6769,auto,0.0,5.05,104.36
80,96,5120,2880,True,torch.bfloat16,torch.bfloat16,False,False,triton,618571,0,22.5065,auto,0.0,125.79,1378.59
80,96,2880,4096,True,torch.bfloat16,torch.bfloat16,False,False,triton,618590,0,16.6728,auto,0.0,135.85,1495.39
80,96,128,2880,True,torch.bfloat16,torch.bfloat16,False,False,triton,618593,0,11.8916,auto,0.0,5.95,110.57
80,112,5120,2880,True,torch.bfloat16,torch.bfloat16,False,False,triton,618570,0,24.6222,auto,0.0,134.15,1270.53
80,112,2880,4096,True,torch.bfloat16,torch.bfloat16,False,False,triton,618590,0,17.3106,auto,0.0,152.65,1453.19
80,112,128,2880,True,torch.bfloat16,torch.bfloat16,False,False,triton,618593,0,11.9001,auto,0.0,6.94,118.58
80,128,5120,2880,True,torch.bfloat16,torch.bfloat16,False,False,triton,618570,0,24.8097,auto,0.0,152.15,1271.24
80,128,2880,4096,True,torch.bfloat16,torch.bfloat16,False,False,triton,618590,0,17.9002,auto,0.0,168.71,1417.8
80,128,128,2880,True,torch.bfloat16,torch.bfloat16,False,False,triton,618593,0,11.5906,auto,0.0,8.14,130.05
256,1,128,2880,True,torch.bfloat16,torch.bfloat16,False,False,asm,1,9,4.6446,_ZN5aiter39bf16gemm_fp32bf16_tn_32x64_splitk_cleanE,0.0156,0.16,160.03
256,2,128,2880,True,torch.bfloat16,torch.bfloat16,False,False,asm,1,13,4.7296,_ZN5aiter39bf16gemm_fp32bf16_tn_32x64_splitk_cleanE,0.0195,0.31,158.43
256,4,128,2880,True,torch.bfloat16,torch.bfloat16,False,False,asm,1,13,4.6283,_ZN5aiter39bf16gemm_fp32bf16_tn_32x64_splitk_cleanE,0.0117,0.64,164.5
256,8,128,2880,True,torch.bfloat16,torch.bfloat16,False,False,asm,3,9,4.8299,_ZN5aiter39bf16gemm_fp32bf16_tn_48x64_splitk_cleanE,0.0098,1.22,162.61
256,16,128,2880,True,torch.bfloat16,torch.bfloat16,False,False,asm,1,15,4.8068,_ZN5aiter39bf16gemm_fp32bf16_tn_32x64_splitk_cleanE,0.0239,2.45,173.41
256,24,128,2880,True,torch.bfloat16,torch.bfloat16,False,False,asm,1,13,4.7813,_ZN5aiter39bf16gemm_fp32bf16_tn_32x64_splitk_cleanE,0.0202,3.7,184.4
256,32,128,2880,True,torch.bfloat16,torch.bfloat16,False,False,asm,1,13,4.6747,_ZN5aiter39bf16gemm_fp32bf16_tn_32x64_splitk_cleanE,0.0193,5.05,198.9
256,40,128,2880,True,torch.bfloat16,torch.bfloat16,False,False,asm,3,14,5.0322,_ZN5aiter39bf16gemm_fp32bf16_tn_48x64_splitk_cleanE,0.0209,5.86,194.33
256,48,128,2880,True,torch.bfloat16,torch.bfloat16,False,False,asm,3,13,4.8924,_ZN5aiter39bf16gemm_fp32bf16_tn_48x64_splitk_cleanE,0.0207,7.23,209.72
256,56,128,2880,True,torch.bfloat16,torch.bfloat16,False,False,asm,1,9,5.2387,_ZN5aiter39bf16gemm_fp32bf16_tn_32x64_splitk_cleanE,0.0186,7.88,205.05
256,64,128,2880,True,torch.bfloat16,torch.bfloat16,False,False,asm,5,11,5.119,_ZN5aiter39bf16gemm_fp32bf16_tn_64x64_splitk_cleanE,0.0211,9.22,219.24
256,72,128,2880,True,torch.bfloat16,torch.bfloat16,False,False,asm,7,15,5.5007,_ZN5aiter39bf16gemm_fp32bf16_tn_80x64_splitk_cleanE,0.0234,9.65,212.78
256,80,128,2880,True,torch.bfloat16,torch.bfloat16,False,False,asm,7,14,5.404,_ZN5aiter39bf16gemm_fp32bf16_tn_80x64_splitk_cleanE,0.0228,10.91,225.49
256,88,128,2880,True,torch.bfloat16,torch.bfloat16,False,False,asm,3,7,5.5526,_ZN5aiter39bf16gemm_fp32bf16_tn_48x64_splitk_cleanE,0.015,11.68,228.13
256,96,128,2880,True,torch.bfloat16,torch.bfloat16,False,False,asm,3,9,5.7758,_ZN5aiter39bf16gemm_fp32bf16_tn_48x64_splitk_cleanE,0.017,12.25,227.64
256,104,128,2880,True,torch.bfloat16,torch.bfloat16,False,False,asm,5,7,5.7433,_ZN5aiter39bf16gemm_fp32bf16_tn_64x64_splitk_cleanE,0.0144,13.35,237.31
256,112,128,2880,True,torch.bfloat16,torch.bfloat16,False,False,asm,5,9,5.6866,_ZN5aiter39bf16gemm_fp32bf16_tn_64x64_splitk_cleanE,0.0176,14.52,248.14
256,120,128,2880,True,torch.bfloat16,torch.bfloat16,False,False,asm,5,9,5.6954,_ZN5aiter39bf16gemm_fp32bf16_tn_64x64_splitk_cleanE,0.018,15.53,256.21
256,128,128,2880,True,torch.bfloat16,torch.bfloat16,False,False,asm,5,9,5.6391,_ZN5aiter39bf16gemm_fp32bf16_tn_64x64_splitk_cleanE,0.0161,16.74,267.3
256,136,128,2880,True,torch.bfloat16,torch.bfloat16,False,False,asm,7,11,5.9798,_ZN5aiter39bf16gemm_fp32bf16_tn_80x64_splitk_cleanE,0.019,16.77,260.12
256,144,128,2880,True,torch.bfloat16,torch.bfloat16,False,False,asm,7,9,6.2301,_ZN5aiter39bf16gemm_fp32bf16_tn_80x64_splitk_cleanE,0.0182,17.04,257.39
256,152,128,2880,True,torch.bfloat16,torch.bfloat16,False,False,asm,7,9,6.0455,_ZN5aiter39bf16gemm_fp32bf16_tn_80x64_splitk_cleanE,0.0186,18.54,273.21
256,160,128,2880,True,torch.bfloat16,torch.bfloat16,False,False,asm,7,9,5.9087,_ZN5aiter39bf16gemm_fp32bf16_tn_80x64_splitk_cleanE,0.0183,19.96,287.68
256,168,128,2880,True,torch.bfloat16,torch.bfloat16,False,False,asm,8,9,6.2623,_ZN5aiter39bf16gemm_fp32bf16_tn_96x64_splitk_cleanE,0.0171,19.78,279.13
256,176,128,2880,True,torch.bfloat16,torch.bfloat16,False,False,asm,8,9,6.4378,_ZN5aiter39bf16gemm_fp32bf16_tn_96x64_splitk_cleanE,0.0176,20.16,278.99
256,184,128,2880,True,torch.bfloat16,torch.bfloat16,False,False,asm,5,8,6.5143,_ZN5aiter39bf16gemm_fp32bf16_tn_64x64_splitk_cleanE,0.0175,20.82,283.1
256,192,128,2880,True,torch.bfloat16,torch.bfloat16,False,False,asm,8,7,6.2823,_ZN5aiter39bf16gemm_fp32bf16_tn_96x64_splitk_cleanE,0.0147,22.53,301.22
256,200,128,2880,True,torch.bfloat16,torch.bfloat16,False,False,asm,7,9,6.7351,_ZN5aiter39bf16gemm_fp32bf16_tn_80x64_splitk_cleanE,0.0171,21.89,288.11
256,208,128,2880,True,torch.bfloat16,torch.bfloat16,False,False,asm,7,10,6.8446,_ZN5aiter39bf16gemm_fp32bf16_tn_80x64_splitk_cleanE,0.0189,22.41,290.54
256,216,128,2880,True,torch.bfloat16,torch.bfloat16,False,False,asm,7,8,6.8078,_ZN5aiter39bf16gemm_fp32bf16_tn_80x64_splitk_cleanE,0.017,23.39,299.18
256,224,128,2880,True,torch.bfloat16,torch.bfloat16,False,False,asm,5,6,6.8495,_ZN5aiter39bf16gemm_fp32bf16_tn_64x64_splitk_cleanE,0.014,24.11,304.38
256,232,128,2880,True,torch.bfloat16,torch.bfloat16,False,False,asm,7,6,6.9044,_ZN5aiter39bf16gemm_fp32bf16_tn_80x64_splitk_cleanE,0.0132,24.77,308.93
256,240,128,2880,True,torch.bfloat16,torch.bfloat16,False,False,asm,7,8,7.0068,_ZN5aiter39bf16gemm_fp32bf16_tn_80x64_splitk_cleanE,0.0167,25.25,311.29
256,248,128,2880,True,torch.bfloat16,torch.bfloat16,False,False,asm,5,9,7.2431,_ZN5aiter39bf16gemm_fp32bf16_tn_64x64_splitk_cleanE,0.0173,25.24,307.78
256,256,128,2880,True,torch.bfloat16,torch.bfloat16,False,False,asm,8,7,7.0831,_ZN5aiter39bf16gemm_fp32bf16_tn_96x64_splitk_cleanE,0.0152,26.65,321.52
256,272,128,2880,True,torch.bfloat16,torch.bfloat16,False,False,asm,8,11,7.5143,_ZN5aiter39bf16gemm_fp32bf16_tn_96x64_splitk_cleanE,0.0208,26.69,315.88
256,288,128,2880,True,torch.bfloat16,torch.bfloat16,False,False,asm,8,7,7.4051,_ZN5aiter39bf16gemm_fp32bf16_tn_96x64_splitk_cleanE,0.0151,28.67,333.54
256,304,128,2880,True,torch.bfloat16,torch.bfloat16,False,False,asm,7,8,7.785,_ZN5aiter39bf16gemm_fp32bf16_tn_80x64_splitk_cleanE,0.017,28.79,329.63
256,320,128,2880,True,torch.bfloat16,torch.bfloat16,False,False,asm,7,7,7.7887,_ZN5aiter39bf16gemm_fp32bf16_tn_80x64_splitk_cleanE,0.0153,30.29,341.83
256,336,128,2880,True,torch.bfloat16,torch.bfloat16,False,False,asm,8,7,8.3362,_ZN5aiter39bf16gemm_fp32bf16_tn_96x64_splitk_cleanE,0.0147,29.72,330.92
256,352,128,2880,True,torch.bfloat16,torch.bfloat16,False,False,asm,8,6,8.4092,_ZN5aiter39bf16gemm_fp32bf16_tn_96x64_splitk_cleanE,0.0134,30.86,339.5
256,368,128,2880,True,torch.bfloat16,torch.bfloat16,False,False,asm,8,8,8.4289,_ZN5aiter39bf16gemm_fp32bf16_tn_96x64_splitk_cleanE,0.0161,32.19,350.12
256,384,128,2880,True,torch.bfloat16,torch.bfloat16,False,False,asm,8,7,8.3764,_ZN5aiter39bf16gemm_fp32bf16_tn_96x64_splitk_cleanE,0.0148,33.8,363.81
256,400,128,2880,True,torch.bfloat16,torch.bfloat16,False,False,triton,0,0,8.6099,auto,0.0,34.25,365.12
256,416,128,2880,True,torch.bfloat16,torch.bfloat16,False,False,triton,0,0,9.0795,auto,0.0,33.78,356.84
256,432,128,2880,True,torch.bfloat16,torch.bfloat16,False,False,asm,8,6,9.098,_ZN5aiter39bf16gemm_fp32bf16_tn_96x64_splitk_cleanE,0.0135,35.01,366.7
256,448,128,2880,True,torch.bfloat16,torch.bfloat16,False,False,asm,8,7,9.1607,_ZN5aiter39bf16gemm_fp32bf16_tn_96x64_splitk_cleanE,0.0156,36.06,374.69
256,464,128,2880,True,torch.bfloat16,torch.bfloat16,False,False,asm,8,9,9.1363,_ZN5aiter39bf16gemm_fp32bf16_tn_96x64_splitk_cleanE,0.0185,37.44,386.23
256,480,128,2880,True,torch.bfloat16,torch.bfloat16,False,False,triton,0,0,8.8059,auto,0.0,40.19,411.65
256,496,128,2880,True,torch.bfloat16,torch.bfloat16,False,False,triton,0,0,9.2863,auto,0.0,39.38,400.72
256,512,128,2880,True,torch.bfloat16,torch.bfloat16,False,False,triton,0,0,8.9267,auto,0.0,42.29,427.65
256,1,640,2880,True,torch.bfloat16,torch.bfloat16,False,False,asm,1,6,7.9686,_ZN5aiter39bf16gemm_fp32bf16_tn_32x64_splitk_cleanE,0.0125,0.46,463.5
256,2,640,2880,True,torch.bfloat16,torch.bfloat16,False,False,asm,1,6,7.9709,_ZN5aiter39bf16gemm_fp32bf16_tn_32x64_splitk_cleanE,0.0141,0.92,464.25
256,4,640,2880,True,torch.bfloat16,torch.bfloat16,False,False,asm,1,6,8.0507,_ZN5aiter39bf16gemm_fp32bf16_tn_32x64_splitk_cleanE,0.0109,1.83,461.4
256,8,640,2880,True,torch.bfloat16,torch.bfloat16,False,False,asm,1,6,8.0815,_ZN5aiter39bf16gemm_fp32bf16_tn_32x64_splitk_cleanE,0.0117,3.65,463.12
256,16,640,2880,True,torch.bfloat16,torch.bfloat16,False,False,asm,1,6,8.1203,_ZN5aiter39bf16gemm_fp32bf16_tn_32x64_splitk_cleanE,0.0128,7.26,467.84
256,24,640,2880,True,torch.bfloat16,torch.bfloat16,False,False,asm,1,6,8.1442,_ZN5aiter39bf16gemm_fp32bf16_tn_32x64_splitk_cleanE,0.0132,10.86,473.39
256,32,640,2880,True,torch.bfloat16,torch.bfloat16,False,False,asm,1,6,8.0556,_ZN5aiter39bf16gemm_fp32bf16_tn_32x64_splitk_cleanE,0.0148,14.64,485.59
256,40,640,2880,True,torch.bfloat16,torch.bfloat16,False,False,asm,3,6,8.2664,_ZN5aiter39bf16gemm_fp32bf16_tn_48x64_splitk_cleanE,0.0139,17.84,480.02
256,48,640,2880,True,torch.bfloat16,torch.bfloat16,False,False,asm,3,6,8.4696,_ZN5aiter39bf16gemm_fp32bf16_tn_48x64_splitk_cleanE,0.0137,20.89,475.15
256,56,640,2880,True,torch.bfloat16,torch.bfloat16,False,False,asm,7,6,8.8098,_ZN5aiter39bf16gemm_fp32bf16_tn_80x64_splitk_cleanE,0.0149,23.43,463.19
256,64,640,2880,True,torch.bfloat16,torch.bfloat16,False,False,asm,5,6,8.7676,_ZN5aiter39bf16gemm_fp32bf16_tn_64x64_splitk_cleanE,0.0136,26.91,471.85
256,72,640,2880,True,torch.bfloat16,torch.bfloat16,False,False,asm,7,9,9.0144,_ZN5aiter39bf16gemm_fp32bf16_tn_80x64_splitk_cleanE,0.02,29.44,465.18
256,80,640,2880,True,torch.bfloat16,torch.bfloat16,False,False,asm,7,6,8.877,_ZN5aiter39bf16gemm_fp32bf16_tn_80x64_splitk_cleanE,0.0141,33.22,478.72
256,88,640,2880,True,torch.bfloat16,torch.bfloat16,False,False,asm,1,5,9.2787,_ZN5aiter39bf16gemm_fp32bf16_tn_32x64_splitk_cleanE,0.0124,34.96,464.07
256,96,640,2880,True,torch.bfloat16,torch.bfloat16,False,False,asm,1,5,9.2811,_ZN5aiter39bf16gemm_fp32bf16_tn_32x64_splitk_cleanE,0.0128,38.13,470.01
256,104,640,2880,True,torch.bfloat16,torch.bfloat16,False,False,asm,1,4,9.4521,_ZN5aiter39bf16gemm_fp32bf16_tn_32x64_splitk_cleanE,0.0105,40.56,467.47
256,112,640,2880,True,torch.bfloat16,torch.bfloat16,False,False,asm,1,5,9.3679,_ZN5aiter39bf16gemm_fp32bf16_tn_32x64_splitk_cleanE,0.0124,44.07,477.68
256,120,640,2880,True,torch.bfloat16,torch.bfloat16,False,False,asm,1,5,9.3963,_ZN5aiter39bf16gemm_fp32bf16_tn_32x64_splitk_cleanE,0.0123,47.08,482.23
256,128,640,2880,True,torch.bfloat16,torch.bfloat16,False,False,asm,1,5,9.4581,_ZN5aiter39bf16gemm_fp32bf16_tn_32x64_splitk_cleanE,0.0124,49.89,485.04
256,136,640,2880,True,torch.bfloat16,torch.bfloat16,False,False,asm,3,5,9.5477,_ZN5aiter39bf16gemm_fp32bf16_tn_48x64_splitk_cleanE,0.0125,52.51,486.38
256,144,640,2880,True,torch.bfloat16,torch.bfloat16,False,False,asm,3,5,9.4734,_ZN5aiter39bf16gemm_fp32bf16_tn_48x64_splitk_cleanE,0.0122,56.03,496.14
256,152,640,2880,True,torch.bfloat16,torch.bfloat16,False,False,asm,1,4,9.6707,_ZN5aiter39bf16gemm_fp32bf16_tn_32x64_splitk_cleanE,0.0103,57.94,491.84
256,160,640,2880,True,torch.bfloat16,torch.bfloat16,False,False,asm,1,4,9.6587,_ZN5aiter39bf16gemm_fp32bf16_tn_32x64_splitk_cleanE,0.0104,61.07,498.29
256,168,640,2880,True,torch.bfloat16,torch.bfloat16,False,False,asm,1,4,9.7021,_ZN5aiter39bf16gemm_fp32bf16_tn_32x64_splitk_cleanE,0.0104,63.83,501.86
256,176,640,2880,True,torch.bfloat16,torch.bfloat16,False,False,asm,1,4,9.7078,_ZN5aiter39bf16gemm_fp32bf16_tn_32x64_splitk_cleanE,0.0104,66.83,507.37
256,184,640,2880,True,torch.bfloat16,torch.bfloat16,False,False,asm,1,4,9.6978,_ZN5aiter39bf16gemm_fp32bf16_tn_32x64_splitk_cleanE,0.0105,69.94,513.7
256,192,640,2880,True,torch.bfloat16,torch.bfloat16,False,False,asm,1,4,9.6601,_ZN5aiter39bf16gemm_fp32bf16_tn_32x64_splitk_cleanE,0.0104,73.27,521.53
256,200,640,2880,True,torch.bfloat16,torch.bfloat16,False,False,asm,3,4,9.9146,_ZN5aiter39bf16gemm_fp32bf16_tn_48x64_splitk_cleanE,0.0105,74.36,513.83
256,208,640,2880,True,torch.bfloat16,torch.bfloat16,False,False,asm,3,4,9.8952,_ZN5aiter39bf16gemm_fp32bf16_tn_48x64_splitk_cleanE,0.0105,77.49,520.53
256,216,640,2880,True,torch.bfloat16,torch.bfloat16,False,False,asm,3,4,10.0145,_ZN5aiter39bf16gemm_fp32bf16_tn_48x64_splitk_cleanE,0.0105,79.51,519.95
256,224,640,2880,True,torch.bfloat16,torch.bfloat16,False,False,asm,3,4,10.0587,_ZN5aiter39bf16gemm_fp32bf16_tn_48x64_splitk_cleanE,0.0104,82.09,523.26
256,232,640,2880,True,torch.bfloat16,torch.bfloat16,False,False,asm,3,4,10.0485,_ZN5aiter39bf16gemm_fp32bf16_tn_48x64_splitk_cleanE,0.0104,85.11,529.4
256,240,640,2880,True,torch.bfloat16,torch.bfloat16,False,False,asm,3,4,9.991,_ZN5aiter39bf16gemm_fp32bf16_tn_48x64_splitk_cleanE,0.0104,88.55,538.08
256,248,640,2880,True,torch.bfloat16,torch.bfloat16,False,False,asm,3,4,10.1207,_ZN5aiter39bf16gemm_fp32bf16_tn_48x64_splitk_cleanE,0.0103,90.33,536.75
256,256,640,2880,True,torch.bfloat16,torch.bfloat16,False,False,asm,1,3,10.1391,_ZN5aiter39bf16gemm_fp32bf16_tn_32x64_splitk_cleanE,0.0075,93.08,541.33
256,272,640,2880,True,torch.bfloat16,torch.bfloat16,False,False,asm,3,4,10.1451,_ZN5aiter39bf16gemm_fp32bf16_tn_48x64_splitk_cleanE,0.0103,98.84,552.12
256,288,640,2880,True,torch.bfloat16,torch.bfloat16,False,False,asm,3,4,10.2279,_ZN5aiter39bf16gemm_fp32bf16_tn_48x64_splitk_cleanE,0.0104,103.8,558.66
256,304,640,2880,True,torch.bfloat16,torch.bfloat16,False,False,asm,5,4,10.4961,_ZN5aiter39bf16gemm_fp32bf16_tn_64x64_splitk_cleanE,0.0103,106.77,555.12
256,320,640,2880,True,torch.bfloat16,torch.bfloat16,False,False,asm,5,4,10.5042,_ZN5aiter39bf16gemm_fp32bf16_tn_64x64_splitk_cleanE,0.0103,112.3,565.41
256,336,640,2880,True,torch.bfloat16,torch.bfloat16,False,False,asm,5,4,10.5175,_ZN5aiter39bf16gemm_fp32bf16_tn_64x64_splitk_cleanE,0.0103,117.77,575.41
256,352,640,2880,True,torch.bfloat16,torch.bfloat16,False,False,asm,3,3,10.6366,_ZN5aiter39bf16gemm_fp32bf16_tn_48x64_splitk_cleanE,0.0075,122.0,579.55
256,368,640,2880,True,torch.bfloat16,torch.bfloat16,False,False,asm,3,3,10.7454,_ZN5aiter39bf16gemm_fp32bf16_tn_48x64_splitk_cleanE,0.0075,126.25,584.17
256,384,640,2880,True,torch.bfloat16,torch.bfloat16,False,False,asm,3,3,10.7852,_ZN5aiter39bf16gemm_fp32bf16_tn_48x64_splitk_cleanE,0.0076,131.25,592.46
256,400,640,2880,True,torch.bfloat16,torch.bfloat16,False,False,asm,5,3,11.1151,_ZN5aiter39bf16gemm_fp32bf16_tn_64x64_splitk_cleanE,0.0075,132.66,585.01
256,416,640,2880,True,torch.bfloat16,torch.bfloat16,False,False,asm,7,4,11.0456,_ZN5aiter39bf16gemm_fp32bf16_tn_80x64_splitk_cleanE,0.0103,138.84,598.88
256,432,640,2880,True,torch.bfloat16,torch.bfloat16,False,False,asm,7,4,11.2452,_ZN5aiter39bf16gemm_fp32bf16_tn_80x64_splitk_cleanE,0.0104,141.62,598.27
256,448,640,2880,True,torch.bfloat16,torch.bfloat16,False,False,asm,7,4,11.1926,_ZN5aiter39bf16gemm_fp32bf16_tn_80x64_splitk_cleanE,0.0104,147.55,611.15
256,464,640,2880,True,torch.bfloat16,torch.bfloat16,False,False,asm,5,3,11.3335,_ZN5aiter39bf16gemm_fp32bf16_tn_64x64_splitk_cleanE,0.0075,150.92,613.49
256,480,640,2880,True,torch.bfloat16,torch.bfloat16,False,False,asm,5,3,11.4084,_ZN5aiter39bf16gemm_fp32bf16_tn_64x64_splitk_cleanE,0.0076,155.1,619.33
256,496,640,2880,True,torch.bfloat16,torch.bfloat16,False,False,asm,5,3,11.5742,_ZN5aiter39bf16gemm_fp32bf16_tn_64x64_splitk_cleanE,0.0076,157.98,620.19
256,512,640,2880,True,torch.bfloat16,torch.bfloat16,False,False,asm,5,3,11.5842,_ZN5aiter39bf16gemm_fp32bf16_tn_64x64_splitk_cleanE,0.0076,162.93,629.38
256,1,2560,2880,True,torch.bfloat16,torch.bfloat16,False,False,asm,1,5,9.684,_ZN5aiter39bf16gemm_fp32bf16_tn_32x64_splitk_cleanE,0.0133,1.52,1523.8
256,2,2560,2880,True,torch.bfloat16,torch.bfloat16,False,False,asm,1,4,9.7859,_ZN5aiter39bf16gemm_fp32bf16_tn_32x64_splitk_cleanE,0.0111,3.01,1509.04
256,4,2560,2880,True,torch.bfloat16,torch.bfloat16,False,False,asm,1,4,9.6953,_ZN5aiter39bf16gemm_fp32bf16_tn_32x64_splitk_cleanE,0.0111,6.08,1525.39
256,8,2560,2880,True,torch.bfloat16,torch.bfloat16,False,False,asm,1,5,9.8819,_ZN5aiter39bf16gemm_fp32bf16_tn_32x64_splitk_cleanE,0.0119,11.94,1500.99
256,16,2560,2880,True,torch.bfloat16,torch.bfloat16,False,False,asm,1,4,9.8791,_ZN5aiter39bf16gemm_fp32bf16_tn_32x64_splitk_cleanE,0.0101,23.88,1510.23
256,32,2560,2880,True,torch.bfloat16,torch.bfloat16,False,False,asm,1,4,10.2178,_ZN5aiter39bf16gemm_fp32bf16_tn_32x64_splitk_cleanE,0.0098,46.18,1477.2
256,48,2560,2880,True,torch.bfloat16,torch.bfloat16,False,False,asm,1,3,10.6415,_ZN5aiter39bf16gemm_fp32bf16_tn_32x64_splitk_cleanE,0.0073,66.51,1434.75
256,64,2560,2880,True,torch.bfloat16,torch.bfloat16,False,False,asm,1,3,10.7231,_ZN5aiter39bf16gemm_fp32bf16_tn_32x64_splitk_cleanE,0.0074,88.01,1440.06
256,128,2560,2880,True,torch.bfloat16,torch.bfloat16,False,False,asm,5,3,11.6542,_ZN5aiter39bf16gemm_fp32bf16_tn_64x64_splitk_cleanE,0.0074,161.95,1384.76
256,256,2560,2880,True,torch.bfloat16,torch.bfloat16,False,False,asm,8,2,15.5117,_ZN5aiter39bf16gemm_fp32bf16_tn_96x64_splitk_cleanE,0.0041,243.36,1130.17
256,1,2880,512,True,torch.bfloat16,torch.bfloat16,False,False,triton,0,0,4.2178,auto,0.0,0.7,700.82
256,1,2880,2048,True,torch.bfloat16,torch.bfloat16,False,False,flydsl,217,8,8.1166,flydsl_gemm2_abf16_wbf16_bf16_t32x64x128_split_k8_block_m_warp2_block_n_warp2_async_copyTrue_b_to_ldsTrue_b_preshuffleFalse_c_to_ldsFalse_gfx950,0.0,1.45,1454.59
256,1,2880,4096,True,torch.bfloat16,torch.bfloat16,False,False,triton,0,0,9.5587,auto,0.0,2.47,2469.68
256,2,2880,512,True,torch.bfloat16,torch.bfloat16,False,False,triton,0,0,3.6726,auto,0.0,1.61,806.7
256,2,2880,2048,True,torch.bfloat16,torch.bfloat16,False,False,flydsl,37,8,7.9664,flydsl_gemm2_abf16_wbf16_bf16_t32x64x64_split_k8_block_m_warp2_block_n_warp2_async_copyTrue_b_to_ldsTrue_b_preshuffleFalse_c_to_ldsFalse_gfx950,0.0,2.96,1483.24
256,2,2880,4096,True,torch.bfloat16,torch.bfloat16,False,False,triton,0,0,9.7376,auto,0.0,4.85,2425.74
256,4,2880,512,True,torch.bfloat16,torch.bfloat16,False,False,triton,0,0,3.7417,auto,0.0,3.15,795.43
256,4,2880,2048,True,torch.bfloat16,torch.bfloat16,False,False,flydsl,39,16,8.4358,flydsl_gemm2_abf16_wbf16_bf16_t32x64x64_split_k16_block_m_warp2_block_n_warp2_async_copyTrue_b_to_ldsTrue_b_preshuffleFalse_c_to_ldsFalse_gfx950,0.0,5.59,1403.05
256,4,2880,4096,True,torch.bfloat16,torch.bfloat16,False,False,triton,0,0,9.6925,auto,0.0,9.74,2439.9
256,8,2880,512,True,torch.bfloat16,torch.bfloat16,False,False,triton,0,0,4.0454,auto,0.0,5.83,742.42
256,8,2880,2048,True,torch.bfloat16,torch.bfloat16,False,False,flydsl,217,8,8.8,flydsl_gemm2_abf16_wbf16_bf16_t32x64x128_split_k8_block_m_warp2_block_n_warp2_async_copyTrue_b_to_ldsTrue_b_preshuffleFalse_c_to_ldsFalse_gfx950,0.0,10.72,1349.47
256,8,2880,4096,True,torch.bfloat16,torch.bfloat16,False,False,flydsl,217,8,10.5,flydsl_gemm2_abf16_wbf16_bf16_t32x64x128_split_k8_block_m_warp2_block_n_warp2_async_copyTrue_b_to_ldsTrue_b_preshuffleFalse_c_to_ldsFalse_gfx950,0.0,17.98,2257.57
256,16,2880,512,True,torch.bfloat16,torch.bfloat16,False,False,triton,0,0,4.3719,auto,0.0,10.79,699.39
256,16,2880,2048,True,torch.bfloat16,torch.bfloat16,False,False,flydsl,215,4,8.4529,flydsl_gemm2_abf16_wbf16_bf16_t32x64x128_split_k4_block_m_warp2_block_n_warp2_async_copyTrue_b_to_ldsTrue_b_preshuffleFalse_c_to_ldsFalse_gfx950,0.0,22.33,1414.2
256,16,2880,4096,True,torch.bfloat16,torch.bfloat16,False,False,flydsl,217,8,10.3479,flydsl_gemm2_abf16_wbf16_bf16_t32x64x128_split_k8_block_m_warp2_block_n_warp2_async_copyTrue_b_to_ldsTrue_b_preshuffleFalse_c_to_ldsFalse_gfx950,0.0,36.48,2301.55
256,24,2880,512,True,torch.bfloat16,torch.bfloat16,False,False,triton,0,0,4.2175,auto,0.0,16.78,737.86
256,24,2880,4096,True,torch.bfloat16,torch.bfloat16,False,False,asm,1,5,11.746,_ZN5aiter39bf16gemm_fp32bf16_tn_32x64_splitk_cleanE,0.0139,48.21,2037.1
256,32,2880,512,True,torch.bfloat16,torch.bfloat16,False,False,triton,0,0,3.922,auto,0.0,24.06,807.29
256,32,2880,2048,True,torch.bfloat16,torch.bfloat16,False,False,flydsl,215,4,8.7385,flydsl_gemm2_abf16_wbf16_bf16_t32x64x128_split_k4_block_m_warp2_block_n_warp2_async_copyTrue_b_to_ldsTrue_b_preshuffleFalse_c_to_ldsFalse_gfx950,0.0,43.2,1386.04
256,32,2880,4096,True,torch.bfloat16,torch.bfloat16,False,False,asm,1,5,11.8449,_ZN5aiter39bf16gemm_fp32bf16_tn_32x64_splitk_cleanE,0.0136,63.74,2029.52
256,40,2880,512,True,torch.bfloat16,torch.bfloat16,False,False,triton,0,0,5.6174,auto,0.0,21.0,573.3
256,40,2880,4096,True,torch.bfloat16,torch.bfloat16,False,False,asm,5,5,12.1741,_ZN5aiter39bf16gemm_fp32bf16_tn_64x64_splitk_cleanE,0.0136,77.52,1983.8
256,48,2880,512,True,torch.bfloat16,torch.bfloat16,False,False,triton,0,0,5.6509,auto,0.0,25.05,579.51
256,48,2880,2048,True,torch.bfloat16,torch.bfloat16,False,False,asm,3,3,9.8321,_ZN5aiter39bf16gemm_fp32bf16_tn_48x64_splitk_cleanE,0.0066,57.59,1247.91
256,48,2880,4096,True,torch.bfloat16,torch.bfloat16,False,False,asm,3,5,12.0364,_ZN5aiter39bf16gemm_fp32bf16_tn_48x64_splitk_cleanE,0.0135,94.09,2015.77
256,56,2880,512,True,torch.bfloat16,torch.bfloat16,False,False,triton,0,0,5.899,auto,0.0,28.0,564.34
256,56,2880,4096,True,torch.bfloat16,torch.bfloat16,False,False,asm,5,5,12.5072,_ZN5aiter39bf16gemm_fp32bf16_tn_64x64_splitk_cleanE,0.0139,105.64,1948.82
256,64,2880,512,True,torch.bfloat16,torch.bfloat16,False,False,triton,0,0,5.297,auto,0.0,35.63,638.72
256,64,2880,2048,True,torch.bfloat16,torch.bfloat16,False,False,asm,5,3,10.122,_ZN5aiter39bf16gemm_fp32bf16_tn_64x64_splitk_cleanE,0.0066,74.59,1227.75
256,64,2880,4096,True,torch.bfloat16,torch.bfloat16,False,False,asm,5,5,12.5794,_ZN5aiter39bf16gemm_fp32bf16_tn_64x64_splitk_cleanE,0.0137,120.03,1946.51
256,72,2880,512,True,torch.bfloat16,torch.bfloat16,False,False,triton,0,0,5.8055,auto,0.0,36.58,592.12
256,72,2880,4096,True,torch.bfloat16,torch.bfloat16,False,False,asm,7,5,13.2578,_ZN5aiter39bf16gemm_fp32bf16_tn_80x64_splitk_cleanE,0.0134,128.13,1855.32
256,80,2880,512,True,torch.bfloat16,torch.bfloat16,False,False,triton,0,0,5.8263,auto,0.0,40.49,599.32
256,80,2880,4096,True,torch.bfloat16,torch.bfloat16,False,False,asm,7,5,12.7889,_ZN5aiter39bf16gemm_fp32bf16_tn_80x64_splitk_cleanE,0.0137,147.58,1932.08
256,88,2880,512,True,torch.bfloat16,torch.bfloat16,False,False,triton,0,0,6.0088,auto,0.0,43.19,590.15
256,88,2880,4096,True,torch.bfloat16,torch.bfloat16,False,False,asm,8,5,13.5246,_ZN5aiter39bf16gemm_fp32bf16_tn_96x64_splitk_cleanE,0.0138,153.51,1835.23
256,96,2880,512,True,torch.bfloat16,torch.bfloat16,False,False,triton,0,0,5.8256,auto,0.0,48.6,618.03
256,96,2880,4096,True,torch.bfloat16,torch.bfloat16,False,False,asm,8,5,13.3291,_ZN5aiter39bf16gemm_fp32bf16_tn_96x64_splitk_cleanE,0.0138,169.92,1870.52
256,104,2880,512,True,torch.bfloat16,torch.bfloat16,False,False,triton,0,0,6.0358,auto,0.0,50.81,605.5
256,104,2880,4096,True,torch.bfloat16,torch.bfloat16,False,False,asm,5,2,17.4048,_ZN5aiter39bf16gemm_fp32bf16_tn_64x64_splitk_cleanE,0.0048,140.98,1438.91
256,112,2880,512,True,torch.bfloat16,torch.bfloat16,False,False,triton,0,0,5.8195,auto,0.0,56.76,637.33
256,112,2880,4096,True,torch.bfloat16,torch.bfloat16,False,False,asm,5,2,17.5557,_ZN5aiter39bf16gemm_fp32bf16_tn_64x64_splitk_cleanE,0.0048,150.52,1432.9
256,120,2880,512,True,torch.bfloat16,torch.bfloat16,False,False,triton,0,0,5.8645,auto,0.0,60.35,641.69
256,120,2880,4096,True,torch.bfloat16,torch.bfloat16,False,False,asm,5,2,17.6274,_ZN5aiter39bf16gemm_fp32bf16_tn_64x64_splitk_cleanE,0.0048,160.61,1433.4
256,128,2880,512,True,torch.bfloat16,torch.bfloat16,False,False,triton,0,0,4.9271,auto,0.0,76.61,774.79
256,128,2880,2048,True,torch.bfloat16,torch.bfloat16,False,False,asm,5,2,11.4906,_ZN5aiter39bf16gemm_fp32bf16_tn_64x64_splitk_cleanE,0.0035,131.41,1136.41
256,128,2880,4096,True,torch.bfloat16,torch.bfloat16,False,False,triton,0,0,17.4852,auto,0.0,172.71,1451.45
256,136,2880,512,True,torch.bfloat16,torch.bfloat16,False,False,flydsl,211,1,6.187,flydsl_gemm2_abf16_wbf16_bf16_t32x64x128_split_k1_block_m_warp2_block_n_warp2_async_copyTrue_b_to_ldsTrue_b_preshuffleFalse_c_to_ldsFalse_gfx950,0.0,64.83,625.79
256,136,2880,4096,True,torch.bfloat16,torch.bfloat16,False,False,asm,7,2,18.1068,_ZN5aiter39bf16gemm_fp32bf16_tn_80x64_splitk_cleanE,0.0048,177.21,1407.78
256,144,2880,512,True,torch.bfloat16,torch.bfloat16,False,False,flydsl,211,1,6.3393,flydsl_gemm2_abf16_wbf16_bf16_t32x64x128_split_k1_block_m_warp2_block_n_warp2_async_copyTrue_b_to_ldsTrue_b_preshuffleFalse_c_to_ldsFalse_gfx950,0.0,66.99,619.32
256,144,2880,4096,True,torch.bfloat16,torch.bfloat16,False,False,asm,7,2,18.2346,_ZN5aiter39bf16gemm_fp32bf16_tn_80x64_splitk_cleanE,0.0048,186.32,1404.04
256,152,2880,512,True,torch.bfloat16,torch.bfloat16,False,False,flydsl,211,1,6.3293,flydsl_gemm2_abf16_wbf16_bf16_t32x64x128_split_k1_block_m_warp2_block_n_warp2_async_copyTrue_b_to_ldsTrue_b_preshuffleFalse_c_to_ldsFalse_gfx950,0.0,70.82,628.87
256,152,2880,4096,True,torch.bfloat16,torch.bfloat16,False,False,asm,7,2,18.4896,_ZN5aiter39bf16gemm_fp32bf16_tn_80x64_splitk_cleanE,0.0048,193.95,1390.71
256,160,2880,512,True,torch.bfloat16,torch.bfloat16,False,False,flydsl,211,1,6.3631,flydsl_gemm2_abf16_wbf16_bf16_t32x64x128_split_k1_block_m_warp2_block_n_warp2_async_copyTrue_b_to_ldsTrue_b_preshuffleFalse_c_to_ldsFalse_gfx950,0.0,74.16,634.06
256,160,2880,4096,True,torch.bfloat16,torch.bfloat16,False,False,asm,7,2,18.1969,_ZN5aiter39bf16gemm_fp32bf16_tn_80x64_splitk_cleanE,0.0048,207.45,1419.21
256,168,2880,512,True,torch.bfloat16,torch.bfloat16,False,False,asm,4,1,6.5635,_ZN5aiter37bf16gemm_fp32bf16_tn_48x64_pf3_splitkE,0.0,75.49,622.97
256,168,2880,4096,True,torch.bfloat16,torch.bfloat16,False,False,asm,8,2,18.8545,_ZN5aiter39bf16gemm_fp32bf16_tn_96x64_splitk_cleanE,0.0048,210.22,1375.63
256,176,2880,512,True,torch.bfloat16,torch.bfloat16,False,False,asm,4,1,6.5706,_ZN5aiter37bf16gemm_fp32bf16_tn_48x64_pf3_splitkE,0.0,79.0,630.55
256,176,2880,4096,True,torch.bfloat16,torch.bfloat16,False,False,asm,8,2,19.2623,_ZN5aiter39bf16gemm_fp32bf16_tn_96x64_splitk_cleanE,0.0048,215.57,1352.31
256,184,2880,512,True,torch.bfloat16,torch.bfloat16,False,False,asm,4,1,6.5921,_ZN5aiter37bf16gemm_fp32bf16_tn_48x64_pf3_splitkE,0.0,82.32,636.73
256,184,2880,4096,True,torch.bfloat16,torch.bfloat16,False,False,asm,8,2,19.326,_ZN5aiter39bf16gemm_fp32bf16_tn_96x64_splitk_cleanE,0.0048,224.63,1353.62
256,192,2880,512,True,torch.bfloat16,torch.bfloat16,False,False,triton,0,0,6.298,auto,0.0,89.91,675.08
256,192,2880,4096,True,torch.bfloat16,torch.bfloat16,False,False,asm,8,2,19.3504,_ZN5aiter39bf16gemm_fp32bf16_tn_96x64_splitk_cleanE,0.0048,234.1,1357.68
256,200,2880,512,True,torch.bfloat16,torch.bfloat16,False,False,asm,4,1,6.7631,_ZN5aiter37bf16gemm_fp32bf16_tn_48x64_pf3_splitkE,0.0,87.21,636.68
256,200,2880,4096,True,torch.bfloat16,torch.bfloat16,False,False,asm,4,1,25.9337,_ZN5aiter37bf16gemm_fp32bf16_tn_48x64_pf3_splitkE,0.0,181.95,1017.34
256,208,2880,512,True,torch.bfloat16,torch.bfloat16,False,False,asm,4,1,6.7732,_ZN5aiter37bf16gemm_fp32bf16_tn_48x64_pf3_splitkE,0.0,90.57,643.74
256,208,2880,4096,True,torch.bfloat16,torch.bfloat16,False,False,asm,4,1,25.9511,_ZN5aiter37bf16gemm_fp32bf16_tn_48x64_pf3_splitkE,0.0,189.1,1020.96
256,216,2880,512,True,torch.bfloat16,torch.bfloat16,False,False,asm,4,1,6.7978,_ZN5aiter37bf16gemm_fp32bf16_tn_48x64_pf3_splitkE,0.0,93.71,649.4
256,216,2880,4096,True,torch.bfloat16,torch.bfloat16,False,False,asm,4,1,25.9507,_ZN5aiter37bf16gemm_fp32bf16_tn_48x64_pf3_splitkE,0.0,196.38,1025.27
256,224,2880,512,True,torch.bfloat16,torch.bfloat16,False,False,asm,4,1,6.7739,_ZN5aiter37bf16gemm_fp32bf16_tn_48x64_pf3_splitkE,0.0,97.52,659.7
256,224,2880,4096,True,torch.bfloat16,torch.bfloat16,False,False,asm,4,1,26.1467,_ZN5aiter37bf16gemm_fp32bf16_tn_48x64_pf3_splitkE,0.0,202.12,1021.86
256,232,2880,512,True,torch.bfloat16,torch.bfloat16,False,False,asm,4,1,6.7999,_ZN5aiter37bf16gemm_fp32bf16_tn_48x64_pf3_splitkE,0.0,100.62,665.16
256,232,2880,4096,True,torch.bfloat16,torch.bfloat16,False,False,asm,4,1,26.1228,_ZN5aiter37bf16gemm_fp32bf16_tn_48x64_pf3_splitkE,0.0,209.53,1027.07
256,240,2880,512,True,torch.bfloat16,torch.bfloat16,False,False,asm,4,1,6.8181,_ZN5aiter37bf16gemm_fp32bf16_tn_48x64_pf3_splitkE,0.0,103.81,671.34
256,240,2880,4096,True,torch.bfloat16,torch.bfloat16,False,False,asm,4,1,26.4111,_ZN5aiter37bf16gemm_fp32bf16_tn_48x64_pf3_splitkE,0.0,214.39,1020.08
256,248,2880,512,True,torch.bfloat16,torch.bfloat16,False,False,asm,6,1,7.0023,_ZN5aiter37bf16gemm_fp32bf16_tn_64x64_pf3_splitkE,0.0,104.45,661.43
256,248,2880,4096,True,torch.bfloat16,torch.bfloat16,False,False,asm,6,1,26.6734,_ZN5aiter37bf16gemm_fp32bf16_tn_64x64_pf3_splitkE,0.0,219.36,1014.23
256,256,2880,512,True,torch.bfloat16,torch.bfloat16,False,False,triton,0,0,6.5879,auto,0.0,114.6,711.28
256,256,2880,2048,True,torch.bfloat16,torch.bfloat16,False,False,asm,6,1,15.5912,_ZN5aiter37bf16gemm_fp32bf16_tn_64x64_pf3_splitkE,0.0,193.69,918.44
256,256,2880,4096,True,torch.bfloat16,torch.bfloat16,False,False,triton,0,0,26.7415,auto,0.0,225.86,1015.82
256,272,2880,512,True,torch.bfloat16,torch.bfloat16,False,False,asm,6,1,7.071,_ZN5aiter37bf16gemm_fp32bf16_tn_64x64_pf3_splitkE,0.0,113.44,678.03
256,272,2880,4096,True,torch.bfloat16,torch.bfloat16,False,False,asm,6,1,26.9644,_ZN5aiter37bf16gemm_fp32bf16_tn_64x64_pf3_splitkE,0.0,237.99,1015.71
256,288,2880,512,True,torch.bfloat16,torch.bfloat16,False,False,asm,6,1,7.058,_ZN5aiter37bf16gemm_fp32bf16_tn_64x64_pf3_splitkE,0.0,120.34,694.66
256,288,2880,4096,True,torch.bfloat16,torch.bfloat16,False,False,asm,6,1,27.0783,_ZN5aiter37bf16gemm_fp32bf16_tn_64x64_pf3_splitkE,0.0,250.93,1019.68
256,304,2880,512,True,torch.bfloat16,torch.bfloat16,False,False,asm,6,1,7.1355,_ZN5aiter37bf16gemm_fp32bf16_tn_64x64_pf3_splitkE,0.0,125.64,702.33
256,304,2880,4096,True,torch.bfloat16,torch.bfloat16,False,False,asm,6,1,27.2461,_ZN5aiter37bf16gemm_fp32bf16_tn_64x64_pf3_splitkE,0.0,263.24,1021.59
256,320,2880,512,True,torch.bfloat16,torch.bfloat16,False,False,asm,6,1,7.2661,_ZN5aiter37bf16gemm_fp32bf16_tn_64x64_pf3_splitkE,0.0,129.88,704.64
256,320,2880,4096,True,torch.bfloat16,torch.bfloat16,False,False,asm,6,1,27.3501,_ZN5aiter37bf16gemm_fp32bf16_tn_64x64_pf3_splitkE,0.0,276.04,1025.87
256,336,2880,512,True,torch.bfloat16,torch.bfloat16,False,False,flydsl,211,1,7.2521,flydsl_gemm2_abf16_wbf16_bf16_t32x64x128_split_k1_block_m_warp2_block_n_warp2_async_copyTrue_b_to_ldsTrue_b_preshuffleFalse_c_to_ldsFalse_gfx950,0.0,136.64,720.97
256,336,2880,4096,True,torch.bfloat16,torch.bfloat16,False,False,asm,9,1,29.226,_ZN5aiter37bf16gemm_fp32bf16_tn_96x64_pf3_splitkE,0.0,271.24,967.66
256,352,2880,512,True,torch.bfloat16,torch.bfloat16,False,False,asm,9,1,7.8004,_ZN5aiter37bf16gemm_fp32bf16_tn_96x64_pf3_splitkE,0.0,133.08,684.21
256,352,2880,4096,True,torch.bfloat16,torch.bfloat16,False,False,asm,9,1,29.0264,_ZN5aiter37bf16gemm_fp32bf16_tn_96x64_pf3_splitkE,0.0,286.11,982.0
256,368,2880,512,True,torch.bfloat16,torch.bfloat16,False,False,asm,9,1,7.8305,_ZN5aiter37bf16gemm_fp32bf16_tn_96x64_pf3_splitkE,0.0,138.6,695.44
256,368,2880,4096,True,torch.bfloat16,torch.bfloat16,False,False,asm,9,1,29.493,_ZN5aiter37bf16gemm_fp32bf16_tn_96x64_pf3_splitkE,0.0,294.38,974.04
256,384,2880,512,True,torch.bfloat16,torch.bfloat16,False,False,asm,9,1,7.8721,_ZN5aiter37bf16gemm_fp32bf16_tn_96x64_pf3_splitkE,0.0,143.86,705.55
256,384,2880,4096,True,torch.bfloat16,torch.bfloat16,False,False,asm,9,1,29.8057,_ZN5aiter37bf16gemm_fp32bf16_tn_96x64_pf3_splitkE,0.0,303.96,971.31
256,400,2880,512,True,torch.bfloat16,torch.bfloat16,False,False,asm,9,1,7.886,_ZN5aiter37bf16gemm_fp32bf16_tn_96x64_pf3_splitkE,0.0,149.59,718.07
256,400,2880,4096,True,torch.bfloat16,torch.bfloat16,False,False,asm,9,1,29.3047,_ZN5aiter37bf16gemm_fp32bf16_tn_96x64_pf3_splitkE,0.0,322.04,995.53
256,416,2880,512,True,torch.bfloat16,torch.bfloat16,False,False,asm,9,1,7.8672,_ZN5aiter37bf16gemm_fp32bf16_tn_96x64_pf3_splitkE,0.0,155.94,733.59
256,416,2880,4096,True,torch.bfloat16,torch.bfloat16,False,False,asm,9,1,29.5668,_ZN5aiter37bf16gemm_fp32bf16_tn_96x64_pf3_splitkE,0.0,331.95,994.26
256,432,2880,512,True,torch.bfloat16,torch.bfloat16,False,False,asm,9,1,7.9128,_ZN5aiter37bf16gemm_fp32bf16_tn_96x64_pf3_splitkE,0.0,161.01,743.08
256,432,2880,4096,True,torch.bfloat16,torch.bfloat16,False,False,asm,9,1,29.5761,_ZN5aiter37bf16gemm_fp32bf16_tn_96x64_pf3_splitkE,0.0,344.61,1001.49
256,448,2880,512,True,torch.bfloat16,torch.bfloat16,False,False,asm,9,1,8.0048,_ZN5aiter37bf16gemm_fp32bf16_tn_96x64_pf3_splitkE,0.0,165.05,748.1
256,448,2880,4096,True,torch.bfloat16,torch.bfloat16,False,False,asm,9,1,29.6372,_ZN5aiter37bf16gemm_fp32bf16_tn_96x64_pf3_splitkE,0.0,356.63,1006.96
256,464,2880,512,True,torch.bfloat16,torch.bfloat16,False,False,asm,9,1,8.0311,_ZN5aiter37bf16gemm_fp32bf16_tn_96x64_pf3_splitkE,0.0,170.39,759.16
256,464,2880,4096,True,torch.bfloat16,torch.bfloat16,False,False,asm,9,1,30.1268,_ZN5aiter37bf16gemm_fp32bf16_tn_96x64_pf3_splitkE,0.0,363.37,998.0
256,480,2880,512,True,torch.bfloat16,torch.bfloat16,False,False,asm,9,1,8.0993,_ZN5aiter37bf16gemm_fp32bf16_tn_96x64_pf3_splitkE,0.0,174.78,766.17
256,480,2880,4096,True,torch.bfloat16,torch.bfloat16,False,False,asm,9,1,30.7548,_ZN5aiter37bf16gemm_fp32bf16_tn_96x64_pf3_splitkE,0.0,368.22,984.88
256,496,2880,512,True,torch.bfloat16,torch.bfloat16,False,False,flydsl,31,1,8.8715,flydsl_gemm2_abf16_wbf16_bf16_t32x64x64_split_k1_block_m_warp2_block_n_warp2_async_copyTrue_b_to_ldsTrue_b_preshuffleFalse_c_to_ldsFalse_gfx950,0.0,164.88,711.71
256,496,2880,4096,True,torch.bfloat16,torch.bfloat16,False,False,flydsl,271,1,36.9844,flydsl_gemm2_abf16_wbf16_bf16_t64x64x128_split_k1_block_m_warp2_block_n_warp2_async_copyTrue_b_to_ldsTrue_b_preshuffleFalse_c_to_ldsFalse_gfx950,0.0,316.41,825.03
256,512,2880,512,True,torch.bfloat16,torch.bfloat16,False,False,flydsl,31,1,8.9341,flydsl_gemm2_abf16_wbf16_bf16_t32x64x64_split_k1_block_m_warp2_block_n_warp2_async_copyTrue_b_to_ldsTrue_b_preshuffleFalse_c_to_ldsFalse_gfx950,0.0,169.01,718.88
256,512,2880,4096,True,torch.bfloat16,torch.bfloat16,False,False,flydsl,271,1,38.3458,flydsl_gemm2_abf16_wbf16_bf16_t64x64x128_split_k1_block_m_warp2_block_n_warp2_async_copyTrue_b_to_ldsTrue_b_preshuffleFalse_c_to_ldsFalse_gfx950,0.0,315.02,801.56
256,1,5120,2880,True,torch.bfloat16,torch.bfloat16,False,False,asm,1,3,11.2939,_ZN5aiter39bf16gemm_fp32bf16_tn_32x64_splitk_cleanE,0.008,2.61,2612.67
256,2,5120,2880,True,torch.bfloat16,torch.bfloat16,False,False,asm,3,3,11.6444,_ZN5aiter39bf16gemm_fp32bf16_tn_48x64_splitk_cleanE,0.0074,5.07,2535.4
256,4,5120,2880,True,torch.bfloat16,torch.bfloat16,False,False,asm,1,3,11.7534,_ZN5aiter39bf16gemm_fp32bf16_tn_32x64_splitk_cleanE,0.0075,10.04,2514.61
256,8,5120,2880,True,torch.bfloat16,torch.bfloat16,False,False,asm,3,3,11.966,_ZN5aiter39bf16gemm_fp32bf16_tn_48x64_splitk_cleanE,0.0078,19.72,2475.28
256,16,5120,2880,True,torch.bfloat16,torch.bfloat16,False,False,asm,1,3,12.3499,_ZN5aiter39bf16gemm_fp32bf16_tn_32x64_splitk_cleanE,0.0077,38.21,2408.7
256,24,5120,2880,True,torch.bfloat16,torch.bfloat16,False,False,asm,1,3,12.3791,_ZN5aiter39bf16gemm_fp32bf16_tn_32x64_splitk_cleanE,0.0077,57.18,2413.36
256,32,5120,2880,True,torch.bfloat16,torch.bfloat16,False,False,asm,1,3,12.223,_ZN5aiter39bf16gemm_fp32bf16_tn_32x64_splitk_cleanE,0.0076,77.21,2454.65
256,40,5120,2880,True,torch.bfloat16,torch.bfloat16,False,False,asm,3,3,13.0085,_ZN5aiter39bf16gemm_fp32bf16_tn_48x64_splitk_cleanE,0.0077,90.68,2316.27
256,48,5120,2880,True,torch.bfloat16,torch.bfloat16,False,False,asm,3,3,13.3107,_ZN5aiter39bf16gemm_fp32bf16_tn_48x64_splitk_cleanE,0.0076,106.35,2273.3
256,56,5120,2880,True,torch.bfloat16,torch.bfloat16,False,False,asm,5,3,13.6483,_ZN5aiter39bf16gemm_fp32bf16_tn_64x64_splitk_cleanE,0.0077,121.0,2226.45
256,64,5120,2880,True,torch.bfloat16,torch.bfloat16,False,False,asm,5,3,13.5348,_ZN5aiter39bf16gemm_fp32bf16_tn_64x64_splitk_cleanE,0.0077,139.45,2254.57
256,72,5120,2880,True,torch.bfloat16,torch.bfloat16,False,False,asm,7,3,14.1883,_ZN5aiter39bf16gemm_fp32bf16_tn_80x64_splitk_cleanE,0.0077,149.66,2159.75
256,80,5120,2880,True,torch.bfloat16,torch.bfloat16,False,False,asm,7,3,13.9712,_ZN5aiter39bf16gemm_fp32bf16_tn_80x64_splitk_cleanE,0.0076,168.87,2202.47
256,88,5120,2880,True,torch.bfloat16,torch.bfloat16,False,False,asm,8,3,14.8426,_ZN5aiter39bf16gemm_fp32bf16_tn_96x64_splitk_cleanE,0.0076,174.85,2081.79
256,96,5120,2880,True,torch.bfloat16,torch.bfloat16,False,False,asm,8,3,14.5245,_ZN5aiter39bf16gemm_fp32bf16_tn_96x64_splitk_cleanE,0.0075,194.92,2136.2
256,104,5120,2880,True,torch.bfloat16,torch.bfloat16,False,False,asm,4,1,19.3588,_ZN5aiter37bf16gemm_fp32bf16_tn_48x64_pf3_splitkE,0.0,158.43,1609.36
256,112,5120,2880,True,torch.bfloat16,torch.bfloat16,False,False,asm,4,1,19.2796,_ZN5aiter37bf16gemm_fp32bf16_tn_48x64_pf3_splitkE,0.0,171.32,1622.61
256,120,5120,2880,True,torch.bfloat16,torch.bfloat16,False,False,asm,4,1,19.4792,_ZN5aiter37bf16gemm_fp32bf16_tn_48x64_pf3_splitkE,0.0,181.68,1612.55
256,128,5120,2880,True,torch.bfloat16,torch.bfloat16,False,False,asm,6,1,20.0298,_ZN5aiter37bf16gemm_fp32bf16_tn_64x64_pf3_splitkE,0.0,188.46,1574.61
256,136,5120,2880,True,torch.bfloat16,torch.bfloat16,False,False,asm,4,1,19.7188,_ZN5aiter37bf16gemm_fp32bf16_tn_48x64_pf3_splitkE,0.0,203.4,1605.94
256,144,5120,2880,True,torch.bfloat16,torch.bfloat16,False,False,asm,4,1,19.6699,_ZN5aiter37bf16gemm_fp32bf16_tn_48x64_pf3_splitkE,0.0,215.9,1616.44
256,152,5120,2880,True,torch.bfloat16,torch.bfloat16,False,False,asm,6,1,20.7931,_ZN5aiter37bf16gemm_fp32bf16_tn_64x64_pf3_splitkE,0.0,215.58,1535.28
256,160,5120,2880,True,torch.bfloat16,torch.bfloat16,False,False,asm,6,1,20.305,_ZN5aiter37bf16gemm_fp32bf16_tn_64x64_pf3_splitkE,0.0,232.39,1578.49
256,168,5120,2880,True,torch.bfloat16,torch.bfloat16,False,False,asm,6,1,20.6199,_ZN5aiter37bf16gemm_fp32bf16_tn_64x64_pf3_splitkE,0.0,240.28,1560.59
256,176,5120,2880,True,torch.bfloat16,torch.bfloat16,False,False,asm,6,1,20.3106,_ZN5aiter37bf16gemm_fp32bf16_tn_64x64_pf3_splitkE,0.0,255.55,1590.66
256,184,5120,2880,True,torch.bfloat16,torch.bfloat16,False,False,asm,6,1,20.2951,_ZN5aiter37bf16gemm_fp32bf16_tn_64x64_pf3_splitkE,0.0,267.37,1598.18
256,192,5120,2880,True,torch.bfloat16,torch.bfloat16,False,False,asm,6,1,20.3984,_ZN5aiter37bf16gemm_fp32bf16_tn_64x64_pf3_splitkE,0.0,277.59,1596.36
256,200,5120,2880,True,torch.bfloat16,torch.bfloat16,False,False,asm,9,1,21.713,_ZN5aiter37bf16gemm_fp32bf16_tn_96x64_pf3_splitkE,0.0,271.65,1505.6
256,208,5120,2880,True,torch.bfloat16,torch.bfloat16,False,False,asm,9,1,22.3091,_ZN5aiter37bf16gemm_fp32bf16_tn_96x64_pf3_splitkE,0.0,274.96,1471.11
256,216,5120,2880,True,torch.bfloat16,torch.bfloat16,False,False,asm,9,1,22.0015,_ZN5aiter37bf16gemm_fp32bf16_tn_96x64_pf3_splitkE,0.0,289.53,1497.5
256,224,5120,2880,True,torch.bfloat16,torch.bfloat16,False,False,asm,9,1,22.3922,_ZN5aiter37bf16gemm_fp32bf16_tn_96x64_pf3_splitkE,0.0,295.01,1477.09
256,232,5120,2880,True,torch.bfloat16,torch.bfloat16,False,False,asm,9,1,21.794,_ZN5aiter37bf16gemm_fp32bf16_tn_96x64_pf3_splitkE,0.0,313.94,1523.5
256,240,5120,2880,True,torch.bfloat16,torch.bfloat16,False,False,asm,9,1,21.977,_ZN5aiter37bf16gemm_fp32bf16_tn_96x64_pf3_splitkE,0.0,322.06,1516.64
256,248,5120,2880,True,torch.bfloat16,torch.bfloat16,False,False,asm,9,1,22.2715,_ZN5aiter37bf16gemm_fp32bf16_tn_96x64_pf3_splitkE,0.0,328.39,1502.33
256,256,5120,2880,True,torch.bfloat16,torch.bfloat16,False,False,asm,9,1,21.8932,_ZN5aiter37bf16gemm_fp32bf16_tn_96x64_pf3_splitkE,0.0,344.84,1534.14
256,272,5120,2880,True,torch.bfloat16,torch.bfloat16,False,False,asm,9,1,21.9283,_ZN5aiter37bf16gemm_fp32bf16_tn_96x64_pf3_splitkE,0.0,365.81,1543.36
256,288,5120,2880,True,torch.bfloat16,torch.bfloat16,False,False,asm,9,1,22.0258,_ZN5aiter37bf16gemm_fp32bf16_tn_96x64_pf3_splitkE,0.0,385.61,1548.15
256,304,5120,2880,True,torch.bfloat16,torch.bfloat16,False,False,asm,7,2,33.3907,_ZN5aiter39bf16gemm_fp32bf16_tn_80x64_splitk_cleanE,0.0041,268.5,1028.89
256,320,5120,2880,True,torch.bfloat16,torch.bfloat16,False,False,triton,0,0,32.0073,auto,0.0,294.84,1081.35
256,336,5120,2880,True,torch.bfloat16,torch.bfloat16,False,False,asm,9,1,34.2278,_ZN5aiter37bf16gemm_fp32bf16_tn_96x64_pf3_splitkE,0.0,289.5,1018.68
256,352,5120,2880,True,torch.bfloat16,torch.bfloat16,False,False,asm,9,1,34.066,_ZN5aiter37bf16gemm_fp32bf16_tn_96x64_pf3_splitkE,0.0,304.73,1031.03
256,368,5120,2880,True,torch.bfloat16,torch.bfloat16,False,False,triton,0,0,34.0696,auto,0.0,318.55,1038.44
256,384,5120,2880,True,torch.bfloat16,torch.bfloat16,False,False,triton,0,0,33.2055,auto,0.0,341.05,1073.17
256,400,5120,2880,True,torch.bfloat16,torch.bfloat16,False,False,asm,4,1,37.0037,_ZN5aiter37bf16gemm_fp32bf16_tn_96x64_pf3_splitkE,0.0,318.79,969.94
256,416,5120,2880,True,torch.bfloat16,torch.bfloat16,False,False,asm,4,1,37.6857,_ZN5aiter37bf16gemm_fp32bf16_tn_96x64_pf3_splitkE,0.0,325.54,959.18
256,432,5120,2880,True,torch.bfloat16,torch.bfloat16,False,False,asm,4,1,38.4078,_ZN5aiter37bf16gemm_fp32bf16_tn_96x64_pf3_splitkE,0.0,331.71,947.81
256,448,5120,2880,True,torch.bfloat16,torch.bfloat16,False,False,triton,0,0,38.6337,auto,0.0,341.98,948.89
256,464,5120,2880,True,torch.bfloat16,torch.bfloat16,False,False,asm,4,1,39.1984,_ZN5aiter37bf16gemm_fp32bf16_tn_96x64_pf3_splitkE,0.0,349.09,941.75
256,480,5120,2880,True,torch.bfloat16,torch.bfloat16,False,False,asm,4,1,40.2816,_ZN5aiter37bf16gemm_fp32bf16_tn_96x64_pf3_splitkE,0.0,351.42,922.78
256,496,5120,2880,True,torch.bfloat16,torch.bfloat16,False,False,asm,4,1,40.6452,_ZN5aiter37bf16gemm_fp32bf16_tn_96x64_pf3_splitkE,0.0,359.89,920.83
256,512,5120,2880,True,torch.bfloat16,torch.bfloat16,False,False,triton,0,0,40.7008,auto,0.0,370.99,925.86
