aiter/configs/model_configs/gptoss_bf16_tuned_gemm.csv
gfx,cu_num,M,N,K,bias,dtype,outdtype,scaleAB,bpreshuffle,libtype,solidx,splitK,us,kernelName,err_ratio,tflops,bw
gfx950,256,1,128,2880,True,torch.bfloat16,torch.bfloat16,False,False,asm,1,14,4.9558,_ZN5aiter39bf16gemm_fp32bf16_tn_32x64_splitk_cleanE,0.0234,0.15,149.99
gfx950,256,2,128,2880,True,torch.bfloat16,torch.bfloat16,False,False,asm,1,13,4.9466,_ZN5aiter39bf16gemm_fp32bf16_tn_32x64_splitk_cleanE,0.0195,0.3,151.48
gfx950,256,4,128,2880,True,torch.bfloat16,torch.bfloat16,False,False,asm,1,14,4.9687,_ZN5aiter39bf16gemm_fp32bf16_tn_32x64_splitk_cleanE,0.0156,0.59,153.23
gfx950,256,8,128,2880,True,torch.bfloat16,torch.bfloat16,False,False,asm,1,14,4.9927,_ZN5aiter39bf16gemm_fp32bf16_tn_32x64_splitk_cleanE,0.0176,1.18,157.31
gfx950,256,16,128,2880,True,torch.bfloat16,torch.bfloat16,False,False,asm,1,13,5.031,_ZN5aiter39bf16gemm_fp32bf16_tn_32x64_splitk_cleanE,0.0171,2.34,165.68
gfx950,256,32,128,2880,True,torch.bfloat16,torch.bfloat16,False,False,asm,1,13,4.6354,_ZN5aiter39bf16gemm_fp32bf16_tn_32x64_splitk_cleanE,0.0203,5.09,200.59
gfx950,256,48,128,2880,True,torch.bfloat16,torch.bfloat16,False,False,asm,3,14,5.2547,_ZN5aiter39bf16gemm_fp32bf16_tn_48x64_splitk_cleanE,0.0212,6.73,195.26
gfx950,256,64,128,2880,True,torch.bfloat16,torch.bfloat16,False,False,asm,5,13,5.3561,_ZN5aiter39bf16gemm_fp32bf16_tn_64x64_splitk_cleanE,0.021,8.81,209.54
gfx950,256,80,128,2880,True,torch.bfloat16,torch.bfloat16,False,False,asm,7,13,5.6419,_ZN5aiter39bf16gemm_fp32bf16_tn_80x64_splitk_cleanE,0.0218,10.45,215.98
gfx950,256,96,128,2880,True,torch.bfloat16,torch.bfloat16,False,False,asm,3,9,5.7166,_ZN5aiter39bf16gemm_fp32bf16_tn_48x64_splitk_cleanE,0.0163,12.38,230.0
gfx950,256,112,128,2880,True,torch.bfloat16,torch.bfloat16,False,False,asm,5,9,5.9183,_ZN5aiter39bf16gemm_fp32bf16_tn_64x64_splitk_cleanE,0.0165,13.95,238.43
gfx950,256,128,128,2880,True,torch.bfloat16,torch.bfloat16,False,False,asm,5,9,5.97,_ZN5aiter39bf16gemm_fp32bf16_tn_64x64_splitk_cleanE,0.0172,15.81,252.48
gfx950,256,256,128,2880,True,torch.bfloat16,torch.bfloat16,False,False,asm,5,6,7.0187,_ZN5aiter39bf16gemm_fp32bf16_tn_64x64_splitk_cleanE,0.0126,26.89,324.47
gfx950,256,1,2560,2880,True,torch.bfloat16,torch.bfloat16,False,False,asm,1,4,9.6772,_ZN5aiter39bf16gemm_fp32bf16_tn_32x64_splitk_cleanE,0.0105,1.52,1524.87
gfx950,256,2,2560,2880,True,torch.bfloat16,torch.bfloat16,False,False,asm,1,4,9.8371,_ZN5aiter39bf16gemm_fp32bf16_tn_32x64_splitk_cleanE,0.0107,3.0,1501.19
gfx950,256,4,2560,2880,True,torch.bfloat16,torch.bfloat16,False,False,asm,1,4,9.8551,_ZN5aiter39bf16gemm_fp32bf16_tn_32x64_splitk_cleanE,0.0118,5.98,1500.66
gfx950,256,8,2560,2880,True,torch.bfloat16,torch.bfloat16,False,False,asm,1,4,9.9035,_ZN5aiter39bf16gemm_fp32bf16_tn_32x64_splitk_cleanE,0.0101,11.91,1497.72
gfx950,256,16,2560,2880,True,torch.bfloat16,torch.bfloat16,False,False,asm,1,4,10.0897,_ZN5aiter39bf16gemm_fp32bf16_tn_32x64_splitk_cleanE,0.01,23.38,1478.7
gfx950,256,32,2560,2880,True,torch.bfloat16,torch.bfloat16,False,False,asm,1,4,10.2307,_ZN5aiter39bf16gemm_fp32bf16_tn_32x64_splitk_cleanE,0.01,46.12,1475.34
gfx950,256,48,2560,2880,True,torch.bfloat16,torch.bfloat16,False,False,asm,1,3,10.7334,_ZN5aiter39bf16gemm_fp32bf16_tn_32x64_splitk_cleanE,0.0073,65.94,1422.46
gfx950,256,64,2560,2880,True,torch.bfloat16,torch.bfloat16,False,False,asm,1,3,10.6753,_ZN5aiter39bf16gemm_fp32bf16_tn_32x64_splitk_cleanE,0.0074,88.4,1446.51
gfx950,256,128,2560,2880,True,torch.bfloat16,torch.bfloat16,False,False,asm,5,3,11.6504,_ZN5aiter39bf16gemm_fp32bf16_tn_64x64_splitk_cleanE,0.0074,162.01,1385.21
gfx950,256,256,2560,2880,True,torch.bfloat16,torch.bfloat16,False,False,asm,8,2,15.3742,_ZN5aiter39bf16gemm_fp32bf16_tn_96x64_splitk_cleanE,0.0041,245.53,1140.28
gfx950,256,1,2880,2048,True,torch.bfloat16,torch.bfloat16,False,False,asm,1,4,9.0917,_ZN5aiter39bf16gemm_fp32bf16_tn_32x64_splitk_cleanE,0.0083,1.3,1298.58
gfx950,256,1,2880,4096,True,torch.bfloat16,torch.bfloat16,False,False,triton,0,0,10.0871,auto,0.0,2.34,2340.31
gfx950,256,2,2880,2048,True,torch.bfloat16,torch.bfloat16,False,False,asm,1,3,9.2607,_ZN5aiter39bf16gemm_fp32bf16_tn_32x64_splitk_cleanE,0.0056,2.55,1275.95
gfx950,256,2,2880,4096,True,torch.bfloat16,torch.bfloat16,False,False,triton,0,0,9.6663,auto,0.0,4.88,2443.63
gfx950,256,4,2880,2048,True,torch.bfloat16,torch.bfloat16,False,False,asm,1,4,9.1797,_ZN5aiter39bf16gemm_fp32bf16_tn_32x64_splitk_cleanE,0.0091,5.14,1289.36
gfx950,256,4,2880,4096,True,torch.bfloat16,torch.bfloat16,False,False,triton,0,0,10.1637,auto,0.0,9.29,2326.79
gfx950,256,8,2880,2048,True,torch.bfloat16,torch.bfloat16,False,False,asm,1,4,9.2315,_ZN5aiter39bf16gemm_fp32bf16_tn_32x64_splitk_cleanE,0.0092,10.22,1286.39
gfx950,256,8,2880,4096,True,torch.bfloat16,torch.bfloat16,False,False,asm,1,5,11.4653,_ZN5aiter39bf16gemm_fp32bf16_tn_32x64_splitk_cleanE,0.0132,16.46,2067.51
gfx950,256,16,2880,2048,True,torch.bfloat16,torch.bfloat16,False,False,asm,1,3,9.3253,_ZN5aiter39bf16gemm_fp32bf16_tn_32x64_splitk_cleanE,0.0062,20.24,1281.91
gfx950,256,16,2880,4096,True,torch.bfloat16,torch.bfloat16,False,False,asm,1,5,11.591,_ZN5aiter39bf16gemm_fp32bf16_tn_32x64_splitk_cleanE,0.0136,32.57,2054.71
gfx950,256,32,2880,2048,True,torch.bfloat16,torch.bfloat16,False,False,asm,1,3,9.2671,_ZN5aiter39bf16gemm_fp32bf16_tn_32x64_splitk_cleanE,0.0065,40.73,1306.98
gfx950,256,32,2880,4096,True,torch.bfloat16,torch.bfloat16,False,False,asm,1,5,11.7821,_ZN5aiter39bf16gemm_fp32bf16_tn_32x64_splitk_cleanE,0.0137,64.08,2040.33
gfx950,256,48,2880,2048,True,torch.bfloat16,torch.bfloat16,False,False,asm,3,4,9.8145,_ZN5aiter39bf16gemm_fp32bf16_tn_48x64_splitk_cleanE,0.009,57.69,1250.15
gfx950,256,48,2880,4096,True,torch.bfloat16,torch.bfloat16,False,False,asm,3,5,12.1519,_ZN5aiter39bf16gemm_fp32bf16_tn_48x64_splitk_cleanE,0.0136,93.19,1996.61
gfx950,256,64,2880,2048,True,torch.bfloat16,torch.bfloat16,False,False,asm,5,4,10.1075,_ZN5aiter39bf16gemm_fp32bf16_tn_64x64_splitk_cleanE,0.009,74.69,1229.51
gfx950,256,64,2880,4096,True,torch.bfloat16,torch.bfloat16,False,False,asm,5,5,12.6689,_ZN5aiter39bf16gemm_fp32bf16_tn_64x64_splitk_cleanE,0.0137,119.19,1932.76
gfx950,256,80,2880,4096,True,torch.bfloat16,torch.bfloat16,False,False,asm,7,5,13.1447,_ZN5aiter39bf16gemm_fp32bf16_tn_80x64_splitk_cleanE,0.0137,143.59,1879.78
gfx950,256,96,2880,4096,True,torch.bfloat16,torch.bfloat16,False,False,asm,8,5,13.5787,_ZN5aiter39bf16gemm_fp32bf16_tn_96x64_splitk_cleanE,0.0136,166.8,1836.14
gfx950,256,112,2880,4096,True,torch.bfloat16,torch.bfloat16,False,False,asm,5,2,17.4374,_ZN5aiter39bf16gemm_fp32bf16_tn_64x64_splitk_cleanE,0.0048,151.54,1442.62
gfx950,256,128,2880,2048,True,torch.bfloat16,torch.bfloat16,False,False,asm,5,2,11.3635,_ZN5aiter39bf16gemm_fp32bf16_tn_64x64_splitk_cleanE,0.0035,132.88,1149.12
gfx950,256,128,2880,4096,True,torch.bfloat16,torch.bfloat16,False,False,asm,5,2,17.3233,_ZN5aiter39bf16gemm_fp32bf16_tn_64x64_splitk_cleanE,0.0048,174.33,1465.01
gfx950,256,256,2880,2048,True,torch.bfloat16,torch.bfloat16,False,False,asm,6,1,15.5453,_ZN5aiter37bf16gemm_fp32bf16_tn_64x64_pf3_splitkE,0.0,194.26,921.15
gfx950,256,1,5120,2880,True,torch.bfloat16,torch.bfloat16,False,False,asm,1,3,11.5513,_ZN5aiter39bf16gemm_fp32bf16_tn_32x64_splitk_cleanE,0.0078,2.55,2554.45
gfx950,256,2,5120,2880,True,torch.bfloat16,torch.bfloat16,False,False,asm,1,3,11.4061,_ZN5aiter39bf16gemm_fp32bf16_tn_32x64_splitk_cleanE,0.0075,5.17,2588.37
gfx950,256,4,5120,2880,True,torch.bfloat16,torch.bfloat16,False,False,asm,1,3,12.0536,_ZN5aiter39bf16gemm_fp32bf16_tn_32x64_splitk_cleanE,0.0075,9.79,2451.98
gfx950,256,8,5120,2880,True,torch.bfloat16,torch.bfloat16,False,False,asm,1,3,11.96,_ZN5aiter39bf16gemm_fp32bf16_tn_32x64_splitk_cleanE,0.0077,19.73,2476.52
gfx950,256,16,5120,2880,True,torch.bfloat16,torch.bfloat16,False,False,asm,1,3,12.2044,_ZN5aiter39bf16gemm_fp32bf16_tn_32x64_splitk_cleanE,0.0077,38.66,2437.42
gfx950,256,32,5120,2880,True,torch.bfloat16,torch.bfloat16,False,False,asm,1,3,12.3457,_ZN5aiter39bf16gemm_fp32bf16_tn_32x64_splitk_cleanE,0.0078,76.44,2430.26
gfx950,256,48,5120,2880,True,torch.bfloat16,torch.bfloat16,False,False,asm,3,3,13.0203,_ZN5aiter39bf16gemm_fp32bf16_tn_48x64_splitk_cleanE,0.0076,108.72,2324.0
gfx950,256,64,5120,2880,True,torch.bfloat16,torch.bfloat16,False,False,asm,5,3,13.4435,_ZN5aiter39bf16gemm_fp32bf16_tn_64x64_splitk_cleanE,0.0077,140.4,2269.89
gfx950,256,80,5120,2880,True,torch.bfloat16,torch.bfloat16,False,False,asm,7,3,14.2374,_ZN5aiter39bf16gemm_fp32bf16_tn_80x64_splitk_cleanE,0.0076,165.71,2161.29
gfx950,256,96,5120,2880,True,torch.bfloat16,torch.bfloat16,False,False,asm,8,3,14.4747,_ZN5aiter39bf16gemm_fp32bf16_tn_96x64_splitk_cleanE,0.0076,195.59,2143.55
gfx950,256,112,5120,2880,True,torch.bfloat16,torch.bfloat16,False,False,asm,4,1,19.1801,_ZN5aiter37bf16gemm_fp32bf16_tn_48x64_pf3_splitkE,0.0,172.21,1631.02
gfx950,256,128,5120,2880,True,torch.bfloat16,torch.bfloat16,False,False,asm,4,1,19.3026,_ZN5aiter37bf16gemm_fp32bf16_tn_48x64_pf3_splitkE,0.0,195.56,1633.94
gfx950,256,1,640,2880,True,torch.bfloat16,torch.bfloat16,False,False,asm,1,6,7.8743,_ZN5aiter39bf16gemm_fp32bf16_tn_32x64_splitk_cleanE,0.0141,0.47,469.05
gfx950,256,2,640,2880,True,torch.bfloat16,torch.bfloat16,False,False,asm,1,6,7.8652,_ZN5aiter39bf16gemm_fp32bf16_tn_32x64_splitk_cleanE,0.0148,0.94,470.49
gfx950,256,4,640,2880,True,torch.bfloat16,torch.bfloat16,False,False,asm,1,6,7.7813,_ZN5aiter39bf16gemm_fp32bf16_tn_32x64_splitk_cleanE,0.0141,1.9,477.37
gfx950,256,8,640,2880,True,torch.bfloat16,torch.bfloat16,False,False,asm,1,7,7.9497,_ZN5aiter39bf16gemm_fp32bf16_tn_32x64_splitk_cleanE,0.0166,3.71,470.8
gfx950,256,16,640,2880,True,torch.bfloat16,torch.bfloat16,False,False,asm,1,6,7.9534,_ZN5aiter39bf16gemm_fp32bf16_tn_32x64_splitk_cleanE,0.0144,7.42,477.66
gfx950,256,32,640,2880,True,torch.bfloat16,torch.bfloat16,False,False,asm,1,6,8.0289,_ZN5aiter39bf16gemm_fp32bf16_tn_32x64_splitk_cleanE,0.0145,14.69,487.2
gfx950,256,48,640,2880,True,torch.bfloat16,torch.bfloat16,False,False,asm,3,6,8.2966,_ZN5aiter39bf16gemm_fp32bf16_tn_48x64_splitk_cleanE,0.0147,21.33,485.06
gfx950,256,64,640,2880,True,torch.bfloat16,torch.bfloat16,False,False,triton,0,0,8.6344,auto,0.0,27.32,479.13
gfx950,256,80,640,2880,True,torch.bfloat16,torch.bfloat16,False,False,asm,7,8,9.0799,_ZN5aiter39bf16gemm_fp32bf16_tn_80x64_splitk_cleanE,0.0177,32.48,468.02
gfx950,256,96,640,2880,True,torch.bfloat16,torch.bfloat16,False,False,asm,1,5,9.1847,_ZN5aiter39bf16gemm_fp32bf16_tn_32x64_splitk_cleanE,0.0126,38.53,474.95
gfx950,256,112,640,2880,True,torch.bfloat16,torch.bfloat16,False,False,asm,1,4,9.4523,_ZN5aiter39bf16gemm_fp32bf16_tn_32x64_splitk_cleanE,0.0107,43.68,473.42
gfx950,256,128,640,2880,True,torch.bfloat16,torch.bfloat16,False,False,asm,1,4,9.4726,_ZN5aiter39bf16gemm_fp32bf16_tn_32x64_splitk_cleanE,0.0105,49.81,484.29
gfx950,256,256,640,2880,True,torch.bfloat16,torch.bfloat16,False,False,asm,1,3,10.1055,_ZN5aiter39bf16gemm_fp32bf16_tn_32x64_splitk_cleanE,0.0075,93.39,543.13
gfx950,256,80,2560,2880,True,torch.bfloat16,torch.bfloat16,False,False,asm,3,3,11.2541,_ZN5aiter39bf16gemm_fp32bf16_tn_48x64_splitk_cleanE,0.0073,104.82,1387.58
gfx950,256,96,2560,2880,True,torch.bfloat16,torch.bfloat16,False,False,asm,3,3,11.2805,_ZN5aiter39bf16gemm_fp32bf16_tn_48x64_splitk_cleanE,0.0074,125.49,1399.77
gfx950,256,112,2560,2880,True,torch.bfloat16,torch.bfloat16,False,False,asm,7,3,11.8435,_ZN5aiter39bf16gemm_fp32bf16_tn_80x64_splitk_cleanE,0.0075,139.44,1347.93
gfx950,256,1,2880,512,True,torch.bfloat16,torch.bfloat16,False,False,triton,0,0,3.6698,auto,0.0,0.8,805.47
gfx950,256,2,2880,512,True,torch.bfloat16,torch.bfloat16,False,False,triton,0,0,4.2591,auto,0.0,1.38,695.61
gfx950,256,4,2880,512,True,torch.bfloat16,torch.bfloat16,False,False,triton,0,0,4.3198,auto,0.0,2.73,688.98
gfx950,256,8,2880,512,True,torch.bfloat16,torch.bfloat16,False,False,triton,0,0,4.1251,auto,0.0,5.72,728.08
gfx950,256,16,2880,512,True,torch.bfloat16,torch.bfloat16,False,False,triton,0,0,4.0261,auto,0.0,11.72,759.46
gfx950,256,32,2880,512,True,torch.bfloat16,torch.bfloat16,False,False,triton,0,0,4.1461,auto,0.0,22.76,763.66
gfx950,256,48,2880,512,True,torch.bfloat16,torch.bfloat16,False,False,flydsl,26,1,5.0181,flydsl_gemm2_abf16_wbf16_bf16_t32x64x256_split_k1_block_m_warp1_block_n_warp4_async_copyTrue_b_to_ldsTrue_b_preshuffleFalse_c_to_ldsFalse_gfx950,0.0,28.21,652.59
gfx950,256,64,2880,512,True,torch.bfloat16,torch.bfloat16,False,False,triton,0,0,4.9656,auto,0.0,38.01,681.35
gfx950,256,80,2880,512,True,torch.bfloat16,torch.bfloat16,False,False,flydsl,67,1,5.0507,flydsl_gemm2_abf16_wbf16_bf16_t32x64x256_split_k1_block_m_warp1_block_n_warp4_async_copyTrue_b_to_ldsTrue_b_preshuffleFalse_c_to_ldsFalse_gfx950,0.0,46.71,691.36
gfx950,256,80,2880,2048,True,torch.bfloat16,torch.bfloat16,False,False,asm,7,4,10.2424,_ZN5aiter39bf16gemm_fp32bf16_tn_80x64_splitk_cleanE,0.0088,92.14,1228.71
gfx950,256,96,2880,512,True,torch.bfloat16,torch.bfloat16,False,False,flydsl,67,1,5.1203,flydsl_gemm2_abf16_wbf16_bf16_t32x64x256_split_k1_block_m_warp1_block_n_warp4_async_copyTrue_b_to_ldsTrue_b_preshuffleFalse_c_to_ldsFalse_gfx950,0.0,55.29,703.16
gfx950,256,96,2880,2048,True,torch.bfloat16,torch.bfloat16,False,False,asm,8,4,10.752,_ZN5aiter39bf16gemm_fp32bf16_tn_96x64_splitk_cleanE,0.009,105.33,1185.14
gfx950,256,112,2880,512,True,torch.bfloat16,torch.bfloat16,False,False,flydsl,67,1,5.3155,flydsl_gemm2_abf16_wbf16_bf16_t32x64x256_split_k1_block_m_warp1_block_n_warp4_async_copyTrue_b_to_ldsTrue_b_preshuffleFalse_c_to_ldsFalse_gfx950,0.0,62.14,697.76
gfx950,256,112,2880,2048,True,torch.bfloat16,torch.bfloat16,False,False,torch,0,0,10.7172,native,0.0,123.28,1203.71
gfx950,256,128,2880,512,True,torch.bfloat16,torch.bfloat16,False,False,triton,0,0,4.7044,auto,0.0,80.24,811.47
gfx950,256,256,2880,512,True,torch.bfloat16,torch.bfloat16,False,False,triton,0,0,6.291,auto,0.0,120.01,744.85
gfx950,256,256,2880,4096,True,torch.bfloat16,torch.bfloat16,False,False,hipblaslt,439639,0,18.7067,Cijk_Alik_Bljk_BBS_BH_Bias_HA_S_SAV_UserArgs_MT48x64x256_MI16x16x1_SN_LDSB0_AFC0_AFEM1_AFEM1_ASEM1_CLR1_CADS0_DTLA0_DTLB0_DTVA0_DTVB0_EPS0_FDSI0_GRPM1_GRVWA8_GRVWB8_GSU0_GSUAMB_GLS0_ISA950_IU1_K1_LDSTI0_LBSPPA512_LBSPPB512_LBSPPM0_LPA16_LPB16_LPM0_LRVW8_LWPMn1_MIAV0_MIWT3_1_MO40_NTn1_NTA7_NTB2_NTC1_NTD0_NTM0_NEPBS16_NLCA1_NLCB1_ONLL1_PGR2_PLR1_PKA1_SIA3_SS1_SPO1_SRVW0_SSO0_SVW1_SK3_SKFTR0_SKXCCM4_TLDS1_ULSGRO0_USL1_UIOFGRO0_USFGRO0_VSn1_VWA1_VWB1_WSGRA0_WSGRB0_WS64_WG16_16_1,0.0,322.87,1452.14
gfx950,256,256,5120,2880,True,torch.bfloat16,torch.bfloat16,False,False,hipblaslt,439868,0,20.051,Cijk_Alik_Bljk_BBS_BH_Bias_HA_S_SAV_UserArgs_MT128x128x64_MI16x16x1_SN_LDSB0_AFC0_AFEM1_AFEM1_ASEM1_CLR1_CADS0_DTLA1_DTLB1_DTVA0_DTVB0_EPS0_FDSI0_GRPM1_GRVWA8_GRVWB8_GSU0_GSUAMB_GLS0_ISA950_IU1_K1_LDSTI0_LBSPPA1024_LBSPPB1024_LBSPPM0_LPA16_LPB16_LPM0_LRVW8_LWPMn1_MIAV1_MIWT4_4_MO40_NTn1_NTA4_NTB2_NTC0_NTD3_NTM0_NEPBS0_NLCA1_NLCB1_ONLL1_PGR2_PLR1_PKA1_SIA3_SS1_SPO0_SRVW0_SSO0_SVW4_SK3_SKFTR0_SKXCCM5_TLDS1_ULSGRO0_USL1_UIOFGRO0_USFGRO1_VSn1_VWA4_VWB4_WSGRA0_WSGRB0_WS64_WG32_8_1,0.0,376.53,1675.09
gfx950,256,512,128,2880,True,torch.bfloat16,torch.bfloat16,False,False,triton,0,0,8.1297,auto,0.0,46.43,469.57
gfx950,256,512,640,2880,True,torch.bfloat16,torch.bfloat16,False,False,asm,5,3,11.5478,_ZN5aiter39bf16gemm_fp32bf16_tn_64x64_splitk_cleanE,0.0076,163.45,631.37
gfx950,256,512,2560,2880,True,torch.bfloat16,torch.bfloat16,False,False,hipblaslt,440108,0,20.3823,Cijk_Alik_Bljk_BBS_BH_Bias_HA_S_SAV_UserArgs_MT128x128x64_MI16x16x1_SN_LDSB0_AFC0_AFEM1_AFEM1_ASEM1_CLR0_CADS0_DTLA1_DTLB1_DTVA0_DTVB0_EPS0_FDSI0_GRPM1_GRVWA8_GRVWB8_GSU0_GSUAMB_GLS0_ISA950_IU1_K1_LDSTI0_LBSPPA1024_LBSPPB1024_LBSPPM0_LPA16_LPB16_LPM0_LRVW8_LWPMn1_MIAV1_MIWT4_4_MO40_NTn1_NTA2_NTB1_NTC6_NTD3_NTM0_NEPBS16_NLCA1_NLCB1_ONLL1_PGR2_PLR1_PKA1_SIA3_SS1_SPO0_SRVW0_SSO0_SVW4_SK3_SKFTR0_SKXCCM4_TLDS1_ULSGRO0_USL1_UIOFGRO0_USFGROn1_VSn1_VWA4_VWB4_WSGRA0_WSGRB0_WS64_WG32_8_1,0.0,370.41,996.76
gfx950,256,512,2880,512,True,torch.bfloat16,torch.bfloat16,False,False,hipblaslt,440054,0,7.2129,Cijk_Alik_Bljk_BBS_BH_Bias_HA_S_SAV_UserArgs_MT64x128x128_MI16x16x1_SN_LDSB0_AFC0_AFEM1_AFEM1_ASEM1_CLR1_CADS0_DTLA0_DTLB0_DTVA0_DTVB0_EPS0_FDSI0_GRPM1_GRVWA8_GRVWB8_GSUAMB_GLS0_ISA950_IU1_K1_LDSTI0_LBSPPA1024_LBSPPB512_LBSPPM0_LPA16_LPB16_LPM0_LRVW8_LWPMn1_MIAV1_MIWT4_2_MO40_NTn1_NTA2_NTB2_NTC4_NTD5_NTM0_NEPBS12_NLCA1_NLCB1_ONLL1_PGR2_PLR1_PKA1_SIA3_SS1_SPO0_SRVW0_SSO0_SVW4_SK0_SKFTR0_SKXCCM0_TLDS2_ULSGRO0_USL1_UIOFGRO0_USFGROn1_VSn1_VWA4_VWB2_WSGRA0_WSGRB0_WS64_WG16_16_1,0.0,209.34,890.42
gfx950,256,512,2880,2048,True,torch.bfloat16,torch.bfloat16,False,False,hipblaslt,440120,0,15.5864,Cijk_Alik_Bljk_BBS_BH_Bias_HA_S_SAV_UserArgs_MT96x64x128_MI16x16x1_SN_LDSB0_AFC0_AFEM1_AFEM1_ASEM1_CLR1_CADS0_DTLA0_DTLB0_DTVA0_DTVB0_EPS0_FDSI0_GRPM1_GRVWA8_GRVWB8_GSU0_GSUAMB_GLS0_ISA950_IU1_K1_LDSTI0_LBSPPA512_LBSPPB256_LBSPPM0_LPA16_LPB16_LPM0_LRVW8_LWPMn1_MIAV1_MIWT6_1_MO40_NTn1_NTA0_NTB3_NTC1_NTD4_NTM0_NEPBS0_NLCA1_NLCB1_ONLL1_PGR2_PLR1_PKA1_SIA3_SS1_SPO0_SRVW0_SSO0_SVW2_SK3_SKFTR0_SKXCCM0_TLDS1_ULSGRO0_USL1_UIOFGRO0_USFGROn1_VSn1_VWA2_VWB1_WSGRA0_WSGRB0_WS64_WG16_16_1,0.0,387.5,1080.61
gfx950,256,512,2880,4096,True,torch.bfloat16,torch.bfloat16,False,False,hipblaslt,440060,0,24.1116,Cijk_Alik_Bljk_BBS_BH_Bias_HA_S_SAV_UserArgs_MT96x128x128_MI16x16x1_SN_LDSB0_AFC0_AFEM1_AFEM1_ASEM1_CLR1_CADS0_DTLA0_DTLB0_DTVA0_DTVB0_EPS0_FDSI0_GRPM1_GRVWA8_GRVWB8_GSU0_GSUAMB_GLS0_ISA950_IU1_K1_LDSTI0_LBSPPA512_LBSPPB512_LBSPPM0_LPA16_LPB16_LPM0_LRVW8_LWPMn1_MIAV1_MIWT6_2_MO40_NTn1_NTA3_NTB3_NTC5_NTD0_NTM0_NEPBS0_NLCA1_NLCB1_ONLL1_PGR2_PLR1_PKA1_SIA3_SS1_SPO0_SRVW0_SSO0_SVW2_SK3_SKFTR0_SKXCCM8_TLDS2_ULSGRO0_USL1_UIOFGRO0_USFGRO1_VSn1_VWA2_VWB2_WSGRA0_WSGRB0_WS64_WG16_16_1,0.0,500.99,1274.76
gfx950,256,512,5120,2880,True,torch.bfloat16,torch.bfloat16,False,False,hipblaslt,440051,0,25.8223,Cijk_Alik_Bljk_BBS_BH_Bias_HA_S_SAV_UserArgs_MT128x96x128_MI16x16x1_SN_LDSB0_AFC0_AFEM1_AFEM1_ASEM1_CLR0_CADS0_DTLA0_DTLB0_DTVA0_DTVB0_EPS0_FDSI0_GRPM1_GRVWA8_GRVWB8_GSU0_GSUAMB_GLS0_ISA950_IU1_K1_LDSTI0_LBSPPA1024_LBSPPB256_LBSPPM0_LPA16_LPB16_LPM0_LRVW8_LWPMn1_MIAV0_MIWT4_3_MO40_NTn1_NTA3_NTB1_NTC6_NTD3_NTM0_NEPBS0_NLCA1_NLCB1_ONLL1_PGR2_PLR1_PKA1_SIA3_SS1_SPO0_SRVW0_SSO0_SVW4_SK3_SKFTR0_SKXCCM0_TLDS1_ULSGRO0_USL1_UIOFGRO0_USFGRO0_VSn1_VWA4_VWB1_WSGRA0_WSGRB0_WS64_WG32_8_1,0.0,584.75,1459.33
gfx950,256,1024,128,2880,True,torch.bfloat16,torch.bfloat16,False,False,asm,1,4,9.907,_ZN5aiter39bf16gemm_fp32bf16_tn_32x64_splitk_cleanE,0.0105,76.21,696.24
gfx950,256,1024,640,2880,True,torch.bfloat16,torch.bfloat16,False,False,hipblaslt,440599,0,15.1873,Cijk_Alik_Bljk_BBS_BH_Bias_HA_S_SAV_UserArgs_MT64x48x256_MI16x16x1_SN_LDSB0_AFC0_AFEM1_AFEM1_ASEM1_CLR1_CADS0_DTLA0_DTLB0_DTVA0_DTVB0_EPS0_FDSI0_GRPM1_GRVWA8_GRVWB8_GSU0_GSUAMB_GLS0_ISA950_IU1_K1_LDSTI0_LBSPPA512_LBSPPB512_LBSPPM0_LPA16_LPB16_LPM0_LRVW8_LWPMn1_MIAV0_MIWT1_3_MO40_NTn1_NTA1_NTB1_NTC1_NTD1_NTM0_NEPBS16_NLCA1_NLCB1_ONLL1_PGR2_PLR1_PKA1_SIA3_SS1_SPO0_SRVW0_SSO1_SVW1_SK3_SKFTR0_SKXCCM0_TLDS2_ULSGRO0_USL1_UIOFGRO0_USFGROn1_VSn1_VWA1_VWB1_WSGRA0_WSGRB0_WS64_WG64_4_1,0.0,248.55,717.4
gfx950,256,1024,2560,2880,True,torch.bfloat16,torch.bfloat16,False,False,hipblaslt,440129,0,26.1269,Cijk_Alik_Bljk_BBS_BH_Bias_HA_S_SAV_UserArgs_MT128x96x128_MI16x16x1_SN_LDSB0_AFC0_AFEM1_AFEM1_ASEM1_CLR1_CADS0_DTLA0_DTLB0_DTVA0_DTVB0_EPS0_FDSI0_GRPM1_GRVWA8_GRVWB8_GSU0_GSUAMB_GLS0_ISA950_IU1_K1_LDSTI0_LBSPPA512_LBSPPB512_LBSPPM0_LPA16_LPB16_LPM0_LRVW8_LWPMn1_MIAV0_MIWT2_6_MO40_NTn1_NTA3_NTB1_NTC1_NTD3_NTM0_NEPBS0_NLCA1_NLCB1_ONLL1_PGR2_PLR1_PKA1_SIA3_SS1_SPO0_SRVW0_SSO1_SVW2_SK3_SKFTR0_SKXCCM4_TLDS1_ULSGRO0_USL1_UIOFGRO0_USFGRO0_VSn1_VWA2_VWB2_WSGRA0_WSGRB0_WS64_WG64_4_1,0.0,577.93,990.81
gfx950,256,1024,2880,512,True,torch.bfloat16,torch.bfloat16,False,False,hipblaslt,439860,0,8.2616,Cijk_Alik_Bljk_BBS_BH_Bias_HA_S_SAV_UserArgs_MT96x128x128_MI16x16x1_SN_LDSB0_AFC0_AFEM1_AFEM1_ASEM1_CLR1_CADS0_DTLA0_DTLB0_DTVA0_DTVB0_EPS0_FDSI0_GRPM1_GRVWA8_GRVWB8_GSUAMB_GLS0_ISA950_IU1_K1_LDSTI0_LBSPPA512_LBSPPB512_LBSPPM0_LPA16_LPB16_LPM0_LRVW8_LWPMn1_MIAV0_MIWT6_2_MO40_NTn1_NTA1_NTB1_NTC1_NTD5_NTM0_NEPBS0_NLCA1_NLCB1_ONLL1_PGR2_PLR1_PKA1_SIA3_SS1_SPO0_SRVW0_SSO0_SVW2_SK0_SKFTR0_SKXCCM0_TLDS1_ULSGRO0_USL1_UIOFGRO0_USFGROn1_VSn1_VWA2_VWB2_WSGRA0_WSGRB0_WS64_WG16_16_1,0.0,365.53,1197.82
gfx950,256,1024,2880,2048,True,torch.bfloat16,torch.bfloat16,False,False,hipblaslt,439860,0,19.5021,Cijk_Alik_Bljk_BBS_BH_Bias_HA_S_SAV_UserArgs_MT96x128x128_MI16x16x1_SN_LDSB0_AFC0_AFEM1_AFEM1_ASEM1_CLR1_CADS0_DTLA0_DTLB0_DTVA0_DTVB0_EPS0_FDSI0_GRPM1_GRVWA8_GRVWB8_GSUAMB_GLS0_ISA950_IU1_K1_LDSTI0_LBSPPA512_LBSPPB512_LBSPPM0_LPA16_LPB16_LPM0_LRVW8_LWPMn1_MIAV0_MIWT6_2_MO40_NTn1_NTA1_NTB1_NTC1_NTD5_NTM0_NEPBS0_NLCA1_NLCB1_ONLL1_PGR2_PLR1_PKA1_SIA3_SS1_SPO0_SRVW0_SSO0_SVW2_SK0_SKFTR0_SKXCCM0_TLDS1_ULSGRO0_USL1_UIOFGRO0_USFGROn1_VSn1_VWA2_VWB2_WSGRA0_WSGRB0_WS64_WG16_16_1,0.0,619.4,1122.39
gfx950,256,1024,2880,4096,True,torch.bfloat16,torch.bfloat16,False,False,hipblaslt,439996,0,33.1555,Cijk_Alik_Bljk_BBS_BH_Bias_HA_S_SAV_UserArgs_MT96x128x128_MI16x16x1_SN_LDSB0_AFC0_AFEM1_AFEM1_ASEM1_CLR0_CADS0_DTLA0_DTLB0_DTVA0_DTVB0_EPS0_FDSI0_GRPM1_GRVWA8_GRVWB8_GSU0_GSUAMB_GLS0_ISA950_IU1_K1_LDSTI0_LBSPPA512_LBSPPB512_LBSPPM0_LPA16_LPB16_LPM0_LRVW8_LWPMn1_MIAV0_MIWT6_2_MO40_NTn1_NTA0_NTB0_NTC1_NTD1_NTM0_NEPBS0_NLCA1_NLCB1_ONLL1_PGR2_PLR1_PKA1_SIA3_SS1_SPO0_SRVW0_SSO0_SVW2_SK3_SKFTR0_SKXCCM4_TLDS1_ULSGRO0_USL1_UIOFGRO0_USFGRO0_VSn1_VWA2_VWB2_WSGRA0_WSGRB0_WS64_WG16_16_1,0.0,728.66,1142.49
gfx950,256,1024,5120,2880,True,torch.bfloat16,torch.bfloat16,False,False,hipblaslt,439443,0,36.0589,Cijk_Alik_Bljk_BBS_BH_Bias_HA_S_SAV_UserArgs_MT128x192x64_MI16x16x1_SN_LDSB0_AFC0_AFEM1_AFEM1_ASEM1_CLR1_CADS0_DTLA0_DTLB0_DTVA0_DTVB0_EPS0_FDSI0_GRPM1_GRVWA8_GRVWB8_GSU0_GSUAMB_GLS0_ISA950_IU1_K1_LDSTI0_LBSPPA1024_LBSPPB128_LBSPPM0_LPA16_LPB16_LPM0_LRVW8_LWPMn1_MIAV0_MIWT8_3_MO40_NTn1_NTA0_NTB0_NTC6_NTD4_NTM0_NEPBS14_NLCA1_NLCB1_ONLL1_PGR2_PLR1_PKA1_SIA3_SS1_SPO0_SRVW0_SSO1_SVW8_SK3_SKFTR0_SKXCCM4_TLDS1_ULSGRO0_USL1_UIOFGRO0_USFGRO0_VSn1_VWA8_VWB1_WSGRA0_WSGRB0_WS64_WG16_16_1,0.0,837.49,1272.23
gfx950,256,2048,128,2880,True,torch.bfloat16,torch.bfloat16,False,False,asm,5,4,10.9615,_ZN5aiter39bf16gemm_fp32bf16_tn_64x64_splitk_cleanE,0.0103,137.75,1191.26
gfx950,256,2048,640,2880,True,torch.bfloat16,torch.bfloat16,False,False,hipblaslt,440176,0,19.9102,Cijk_Alik_Bljk_BBS_BH_Bias_HA_S_SAV_UserArgs_MT80x64x256_MI16x16x1_SN_LDSB0_AFC0_AFEM1_AFEM1_ASEM1_CLR0_CADS0_DTLA0_DTLB0_DTVA0_DTVB0_EPS0_FDSI0_GRPM1_GRVWA8_GRVWB8_GSU0_GSUAMB_GLS0_ISA950_IU1_K1_LDSTI0_LBSPPA512_LBSPPB512_LBSPPM0_LPA16_LPB16_LPM0_LRVW8_LWPMn1_MIAV0_MIWT5_1_MO40_NTn1_NTA3_NTB0_NTC1_NTD1_NTM0_NEPBS0_NLCA1_NLCB1_ONLL1_PGR2_PLR1_PKA1_SIA3_SS1_SPO0_SRVW0_SSO0_SVW1_SK3_SKFTR0_SKXCCM4_TLDS1_ULSGRO0_USL1_UIOFGRO0_USFGRO0_VSn1_VWA1_VWB1_WSGRA0_WSGRB0_WS64_WG16_16_1,0.0,379.19,909.3
gfx950,256,2048,2560,2880,True,torch.bfloat16,torch.bfloat16,False,False,hipblaslt,440213,0,35.4227,Cijk_Alik_Bljk_BBS_BH_Bias_HA_S_SAV_UserArgs_MT160x128x64_MI16x16x1_SN_LDSB1_AFC0_AFEM1_AFEM1_ASEM1_CLR0_CADS0_DTLA0_DTLB0_DTVA0_DTVB0_EPS0_FDSI0_GRPM1_GRVWA8_GRVWB8_GSU0_GSUAMB_GLS0_ISA950_IU1_K1_LDSTI0_LBSPPA256_LBSPPB256_LBSPPM0_LPA16_LPB16_LPM0_LRVW8_LWPMn1_MIAV1_MIWT10_2_MO40_NTn1_NTA0_NTB0_NTC6_NTD5_NTM0_NEPBS0_NLCA1_NLCB1_ONLL1_PGR2_PLR1_PKA1_SIA3_SS1_SPO0_SRVW0_SSO0_SVW2_SK3_SKFTR0_SKXCCM0_TLDS1_ULSGRO0_USL1_UIOFGRO0_USFGRO1_VSn1_VWA2_VWB2_WSGRA0_WSGRB0_WS64_WG16_16_1,0.0,852.53,1045.31
gfx950,256,2048,2880,512,True,torch.bfloat16,torch.bfloat16,False,False,hipblaslt,439931,0,11.2207,Cijk_Alik_Bljk_BBS_BH_Bias_HA_S_SAV_UserArgs_MT192x128x64_MI16x16x1_SN_LDSB0_AFC0_AFEM1_AFEM1_ASEM1_CLR0_CADS0_DTLA0_DTLB0_DTVA0_DTVB0_EPS0_FDSI0_GRPM1_GRVWA8_GRVWB8_GSUAMB_GLS0_ISA950_IU1_K1_LDSTI0_LBSPPA512_LBSPPB256_LBSPPM0_LPA16_LPB16_LPM0_LRVW8_LWPMn1_MIAV0_MIWT12_2_MO40_NTn1_NTA3_NTB3_NTC6_NTD4_NTM0_NEPBS0_NLCA1_NLCB1_ONLL1_PGR2_PLR1_PKA1_SIA3_SS1_SPO0_SRVW0_SSO0_SVW4_SK0_SKFTR0_SKXCCM0_TLDS2_ULSGRO0_USL1_UIOFGRO0_USFGROn1_VSn1_VWA4_VWB2_WSGRA0_WSGRB0_WS64_WG16_16_1,0.0,538.27,1501.04
gfx950,256,2048,2880,2048,True,torch.bfloat16,torch.bfloat16,False,False,hipblaslt,439792,0,29.1498,Cijk_Alik_Bljk_BBS_BH_Bias_HA_S_SAV_UserArgs_MT192x128x64_MI16x16x1_SN_LDSB0_AFC0_AFEM1_AFEM1_ASEM1_CLR0_CADS0_DTLA0_DTLB0_DTVA0_DTVB0_EPS0_FDSI0_GRPM1_GRVWA8_GRVWB8_GSU0_GSUAMB_GLS0_ISA950_IU1_K1_LDSTI0_LBSPPA512_LBSPPB256_LBSPPM0_LPA16_LPB16_LPM0_LRVW8_LWPMn1_MIAV0_MIWT12_2_MO40_NTn1_NTA3_NTB1_NTC5_NTD5_NTM0_NEPBS0_NLCA1_NLCB1_ONLL1_PGR2_PLR1_PKA1_SIA3_SS1_SPO0_SRVW0_SSO0_SVW4_SK3_SKFTR0_SKXCCM0_TLDS2_ULSGRO0_USL1_UIOFGRO0_USFGRO1_VSn1_VWA4_VWB2_WSGRA0_WSGRB0_WS64_WG16_16_1,0.0,828.79,1097.15
gfx950,256,2048,2880,4096,True,torch.bfloat16,torch.bfloat16,False,False,hipblaslt,440130,0,53.2069,Cijk_Alik_Bljk_BBS_BH_Bias_HA_S_SAV_UserArgs_MT192x128x64_MI16x16x1_SN_LDSB0_AFC0_AFEM1_AFEM1_ASEM1_CLR0_CADS0_DTLA0_DTLB0_DTVA0_DTVB0_EPS0_FDSI0_GRPM1_GRVWA8_GRVWB8_GSU0_GSUAMB_GLS0_ISA950_IU1_K1_LDSTI0_LBSPPA256_LBSPPB512_LBSPPM0_LPA16_LPB16_LPM0_LRVW8_LWPMn1_MIAV0_MIWT6_4_MO40_NTn1_NTA3_NTB3_NTC1_NTD4_NTM0_NEPBS0_NLCA1_NLCB1_ONLL1_PGR2_PLR1_PKA1_SIA3_SS1_SPO0_SRVW0_SSO0_SVW2_SK3_SKFTR0_SKXCCM4_TLDS1_ULSGRO0_USL1_UIOFGRO0_USFGRO0_VSn1_VWA2_VWB4_WSGRA0_WSGRB0_WS64_WG32_8_1,0.0,908.12,980.45
gfx950,256,2048,5120,2880,True,torch.bfloat16,torch.bfloat16,False,False,hipblaslt,439562,0,54.9596,Cijk_Alik_Bljk_BBS_BH_Bias_HA_S_SAV_UserArgs_MT160x256x64_MI16x16x1_SN_LDSB0_AFC0_AFEM1_AFEM1_ASEM1_CLR1_CADS0_DTLA0_DTLB0_DTVA0_DTVB0_EPS0_FDSI0_GRPM1_GRVWA8_GRVWB8_GSU0_GSUAMB_GLS0_ISA950_IU1_K1_LDSTI0_LBSPPA256_LBSPPB512_LBSPPM0_LPA16_LPB16_LPM0_LRVW8_LWPMn1_MIAV0_MIWT10_4_MO40_NTn1_NTA0_NTB3_NTC0_NTD4_NTM0_NEPBS0_NLCA1_NLCB1_ONLL1_PGR2_PLR1_PKA1_SIA3_SS1_SPO0_SRVW0_SSO4_SVW2_SK3_SKFTR0_SKXCCM4_TLDS1_ULSGRO0_USL1_UIOFGRO0_USFGROn1_VSn1_VWA2_VWB4_WSGRA0_WSGRB0_WS64_WG16_16_1,0.0,1098.95,1132.82
gfx950,256,4096,128,2880,True,torch.bfloat16,torch.bfloat16,False,False,asm,5,2,14.2987,_ZN5aiter39bf16gemm_fp32bf16_tn_64x64_splitk_cleanE,0.0043,211.2,1774.9
gfx950,256,4096,640,2880,True,torch.bfloat16,torch.bfloat16,False,False,hipblaslt,440177,0,25.5971,Cijk_Alik_Bljk_BBS_BH_Bias_HA_S_SAV_UserArgs_MT80x128x128_MI16x16x1_SN_LDSB0_AFC0_AFEM1_AFEM1_ASEM1_CLR0_CADS0_DTLA0_DTLB0_DTVA0_DTVB0_EPS0_FDSI0_GRPM1_GRVWA8_GRVWB8_GSU0_GSUAMB_GLS0_ISA950_IU1_K1_LDSTI0_LBSPPA256_LBSPPB512_LBSPPM0_LPA16_LPB16_LPM0_LRVW8_LWPMn1_MIAV1_MIWT5_2_MO40_NTn1_NTA0_NTB0_NTC0_NTD0_NTM0_NEPBS0_NLCA1_NLCB1_ONLL1_PGR2_PLR1_PKA1_SIA3_SS1_SPO0_SRVW0_SSO0_SVW1_SK3_SKFTR0_SKXCCM0_TLDS1_ULSGRO0_USL1_UIOFGRO0_USFGROn1_VSn1_VWA1_VWB2_WSGRA0_WSGRB0_WS64_WG16_16_1,0.0,589.89,1270.54
gfx950,256,4096,2560,2880,True,torch.bfloat16,torch.bfloat16,False,False,hipblaslt,440571,0,58.4682,Cijk_Alik_Bljk_BBS_BH_Bias_HA_S_SAV_UserArgs_MT256x192x64_MI16x16x1_SN_LDSB0_AFC0_AFEM1_AFEM1_ASEM1_CLR1_CADS0_DTLA1_DTLB1_DTVA0_DTVB0_EPS0_FDSI0_GRPM1_GRVWA8_GRVWB8_GSU0_GSUAMB_GLS0_ISA950_IU1_K1_LDSTI0_LBSPPA1024_LBSPPB1024_LBSPPM0_LPA16_LPB16_LPM0_LRVW8_LWPMn1_MIAV0_MIWT16_3_MO40_NTn1_NTA0_NTB1_NTC6_NTD5_NTM0_NEPBS16_NLCA1_NLCB1_ONLL1_PGR2_PLR1_PKA1_SIA3_SS1_SPO0_SRVW0_SSO1_SVW8_SK3_SKFTR0_SKXCCM0_TLDS1_ULSGRO0_USL1_UIOFGRO0_USFGRO0_VSn1_VWA8_VWB1_WSGRA0_WSGRB0_WS64_WG16_16_1,0.0,1033.01,1014.4
gfx950,256,4096,2880,512,True,torch.bfloat16,torch.bfloat16,False,False,hipblaslt,439726,0,17.4286,Cijk_Alik_Bljk_BBS_BH_Bias_HA_S_SAV_UserArgs_MT192x256x64_MI16x16x1_SN_LDSB1_AFC0_AFEM1_AFEM1_ASEM1_CLR1_CADS0_DTLA0_DTLB0_DTVA0_DTVB0_EPS0_FDSI0_GRPM1_GRVWA8_GRVWB8_GSU0_GSUAMB_GLS0_ISA950_IU1_K1_LDSTI0_LBSPPA512_LBSPPB512_LBSPPM0_LPA16_LPB16_LPM0_LRVW8_LWPMn1_MIAV0_MIWT12_4_MO40_NTn1_NTA1_NTB1_NTC4_NTD2_NTM0_NEPBS0_NLCA1_NLCB1_ONLL1_PGR2_PLR1_PKA1_SIA3_SS1_SPO0_SRVW0_SSO1_SVW4_SK3_SKFTR0_SKXCCM0_TLDS1_ULSGRO0_USL1_UIOFGRO0_USFGRO0_VSn1_VWA4_VWB4_WSGRA0_WSGRB0_WS64_WG16_16_1,0.0,693.09,1763.56
gfx950,256,4096,2880,2048,True,torch.bfloat16,torch.bfloat16,False,False,hipblaslt,439409,0,44.474,Cijk_Alik_Bljk_BBS_BH_Bias_HA_S_SAV_UserArgs_MT192x256x64_MI16x16x1_SN_LDSB0_AFC0_AFEM1_AFEM1_ASEM1_CLR0_CADS0_DTLA0_DTLB0_DTVA0_DTVB0_EPS0_FDSI0_GRPM1_GRVWA8_GRVWB8_GSU0_GSUAMB_GLS0_ISA950_IU1_K1_LDSTI0_LBSPPA512_LBSPPB512_LBSPPM0_LPA16_LPB16_LPM0_LRVW8_LWPMn1_MIAV0_MIWT12_4_MO40_NTn1_NTA2_NTB2_NTC7_NTD4_NTM0_NEPBS16_NLCA1_NLCB1_ONLL1_PGR2_PLR1_PKA1_SIA3_SS1_SPO0_SRVW0_SSO1_SVW4_SK3_SKFTR0_SKXCCM4_TLDS2_ULSGRO0_USL1_UIOFGRO0_USFGRO0_VSn1_VWA4_VWB4_WSGRA0_WSGRB0_WS64_WG16_16_1,0.0,1086.44,1172.97
gfx950,256,4096,2880,4096,True,torch.bfloat16,torch.bfloat16,False,False,hipblaslt,440294,0,88.5249,Cijk_Alik_Bljk_BBS_BH_Bias_HA_S_SAV_UserArgs_MT192x256x64_MI16x16x1_SN_LDSB0_AFC0_AFEM1_AFEM1_ASEM1_CLR0_CADS0_DTLA0_DTLB0_DTVA0_DTVB0_EPS0_FDSI0_GRPM1_GRVWA8_GRVWB8_GSU0_GSUAMB_GLS0_ISA950_IU1_K1_LDSTI0_LBSPPA256_LBSPPB1024_LBSPPM0_LPA16_LPB16_LPM0_LRVW8_LWPMn1_MIAV0_MIWT6_8_MO40_NTn1_NTA3_NTB3_NTC0_NTD0_NTM0_NEPBS0_NLCA1_NLCB1_ONLL1_PGR2_PLR1_PKA1_SIA3_SS1_SPO0_SRVW0_SSO1_SVW2_SK3_SKFTR0_SKXCCM4_TLDS2_ULSGRO0_USL1_UIOFGRO0_USFGRO0_VSn1_VWA2_VWB8_WSGRA0_WSGRB0_WS64_WG32_8_1,0.0,1091.63,912.06
gfx950,256,4096,5120,2880,True,torch.bfloat16,torch.bfloat16,False,False,hipblaslt,439562,0,118.2012,Cijk_Alik_Bljk_BBS_BH_Bias_HA_S_SAV_UserArgs_MT160x256x64_MI16x16x1_SN_LDSB0_AFC0_AFEM1_AFEM1_ASEM1_CLR1_CADS0_DTLA0_DTLB0_DTVA0_DTVB0_EPS0_FDSI0_GRPM1_GRVWA8_GRVWB8_GSU0_GSUAMB_GLS0_ISA950_IU1_K1_LDSTI0_LBSPPA256_LBSPPB512_LBSPPM0_LPA16_LPB16_LPM0_LRVW8_LWPMn1_MIAV0_MIWT10_4_MO40_NTn1_NTA0_NTB3_NTC0_NTD4_NTM0_NEPBS0_NLCA1_NLCB1_ONLL1_PGR2_PLR1_PKA1_SIA3_SS1_SPO0_SRVW0_SSO4_SVW2_SK3_SKFTR0_SKXCCM4_TLDS1_ULSGRO0_USL1_UIOFGRO0_USFGROn1_VSn1_VWA2_VWB4_WSGRA0_WSGRB0_WS64_WG16_16_1,0.0,1021.95,803.94
gfx950,256,8192,128,2880,True,torch.bfloat16,torch.bfloat16,False,False,hipblaslt,441404,0,19.4039,Cijk_Alik_Bljk_BBS_BH_Bias_HA_S_SAV_UserArgs_MT64x64x256_MI16x16x1_SN_LDSB0_AFC0_AFEM1_AFEM1_ASEM1_CLR0_CADS0_DTLA0_DTLB0_DTVA0_DTVB0_EPS0_FDSI0_GRPM1_GRVWA8_GRVWB8_GSU0_GSUAMB_GLS0_ISA950_IU1_K1_LDSTI0_LBSPPA1024_LBSPPB1024_LBSPPM0_LPA16_LPB16_LPM0_LRVW8_LWPMn1_MIAV1_MIWT2_2_MO40_NTn1_NTA0_NTB0_NTC3_NTD3_NTM0_NEPBS16_NLCA1_NLCB1_ONLL1_PGR2_PLR1_PKA1_SIA3_SS1_SPO0_SRVW0_SSO0_SVW2_SK3_SKFTR0_SKXCCM0_TLDS1_ULSGRO0_USL1_UIOFGRO0_USFGRO0_VSn1_VWA2_VWB2_WSGRA0_WSGRB0_WS64_WG32_8_1,0.0,311.27,2577.85
gfx950,256,8192,640,2880,True,torch.bfloat16,torch.bfloat16,False,False,hipblaslt,440109,0,35.0194,Cijk_Alik_Bljk_BBS_BH_Bias_HA_S_SAV_UserArgs_MT160x128x64_MI16x16x1_SN_LDSB0_AFC0_AFEM1_AFEM1_ASEM1_CLR1_CADS0_DTLA0_DTLB0_DTVA0_DTVB0_EPS0_FDSI0_GRPM1_GRVWA8_GRVWB8_GSU0_GSUAMB_GLS0_ISA950_IU1_K1_LDSTI0_LBSPPA256_LBSPPB256_LBSPPM0_LPA16_LPB16_LPM0_LRVW8_LWPMn1_MIAV0_MIWT10_2_MO40_NTn1_NTA2_NTB4_NTC2_NTD7_NTM0_NEPBS0_NLCA1_NLCB1_ONLL1_PGR2_PLR1_PKA1_SIA3_SS1_SPO1_SRVW0_SSO1_SVW2_SK3_SKFTR0_SKXCCM0_TLDS2_ULSGRO0_USL1_UIOFGRO0_USFGRO0_VSn1_VWA2_VWB2_WSGRA0_WSGRB0_WS64_WG16_16_1,0.0,862.35,1752.12
gfx950,256,8192,2560,2880,True,torch.bfloat16,torch.bfloat16,False,False,hipblaslt,439562,0,115.4077,Cijk_Alik_Bljk_BBS_BH_Bias_HA_S_SAV_UserArgs_MT160x256x64_MI16x16x1_SN_LDSB0_AFC0_AFEM1_AFEM1_ASEM1_CLR1_CADS0_DTLA0_DTLB0_DTVA0_DTVB0_EPS0_FDSI0_GRPM1_GRVWA8_GRVWB8_GSU0_GSUAMB_GLS0_ISA950_IU1_K1_LDSTI0_LBSPPA256_LBSPPB512_LBSPPM0_LPA16_LPB16_LPM0_LRVW8_LWPMn1_MIAV0_MIWT10_4_MO40_NTn1_NTA0_NTB3_NTC0_NTD4_NTM0_NEPBS0_NLCA1_NLCB1_ONLL1_PGR2_PLR1_PKA1_SIA3_SS1_SPO0_SRVW0_SSO4_SVW2_SK3_SKFTR0_SKXCCM4_TLDS1_ULSGRO0_USL1_UIOFGRO0_USFGROn1_VSn1_VWA2_VWB4_WSGRA0_WSGRB0_WS64_WG16_16_1,0.0,1046.69,900.07
gfx950,256,8192,2880,512,True,torch.bfloat16,torch.bfloat16,False,False,hipblaslt,439726,0,32.4053,Cijk_Alik_Bljk_BBS_BH_Bias_HA_S_SAV_UserArgs_MT192x256x64_MI16x16x1_SN_LDSB1_AFC0_AFEM1_AFEM1_ASEM1_CLR1_CADS0_DTLA0_DTLB0_DTVA0_DTVB0_EPS0_FDSI0_GRPM1_GRVWA8_GRVWB8_GSU0_GSUAMB_GLS0_ISA950_IU1_K1_LDSTI0_LBSPPA512_LBSPPB512_LBSPPM0_LPA16_LPB16_LPM0_LRVW8_LWPMn1_MIAV0_MIWT12_4_MO40_NTn1_NTA1_NTB1_NTC4_NTD2_NTM0_NEPBS0_NLCA1_NLCB1_ONLL1_PGR2_PLR1_PKA1_SIA3_SS1_SPO0_SRVW0_SSO1_SVW4_SK3_SKFTR0_SKXCCM0_TLDS1_ULSGRO0_USL1_UIOFGRO0_USFGRO0_VSn1_VWA4_VWB4_WSGRA0_WSGRB0_WS64_WG16_16_1,0.0,745.53,1805.99
gfx950,256,8192,2880,2048,True,torch.bfloat16,torch.bfloat16,False,False,hipblaslt,439794,0,94.9381,Cijk_Alik_Bljk_BBS_BH_Bias_HA_S_SAV_UserArgs_MT192x256x64_MI16x16x1_SN_LDSB0_AFC0_AFEM1_AFEM1_ASEM1_CLR0_CADS0_DTLA0_DTLB0_DTVA0_DTVB0_EPS0_FDSI0_GRPM1_GRVWA8_GRVWB8_GSU0_GSUAMB_GLS0_ISA950_IU1_K1_LDSTI0_LBSPPA256_LBSPPB1024_LBSPPM0_LPA16_LPB16_LPM0_LRVW8_LWPMn1_MIAV0_MIWT6_8_MO40_NTn1_NTA3_NTB3_NTC0_NTD4_NTM0_NEPBS0_NLCA1_NLCB1_ONLL1_PGR2_PLR1_PKA1_SIA3_SS1_SPO0_SRVW0_SSO1_SVW2_SK3_SKFTR0_SKXCCM0_TLDS1_ULSGRO0_USL1_UIOFGRO0_USFGROn1_VSn1_VWA2_VWB8_WSGRA0_WSGRB0_WS64_WG32_8_1,0.0,1017.89,974.71
gfx950,256,8192,2880,4096,True,torch.bfloat16,torch.bfloat16,False,False,hipblaslt,440620,0,172.4533,Cijk_Alik_Bljk_BBS_BH_Bias_HA_S_SAV_UserArgs_MT256x256x64_MI16x16x1_CMS_SN_LDSB0_AFC0_AFEM1_AFEM1_ASEM1_CLR1_CADS0_DTLA1_DTLB1_DTVA0_DTVB0_EPS0_FDSI0_GRPM1_GRVWA8_GRVWB8_GSU0_GSUAMB_GLS0_ISA950_IU1_K1_LDSTI0_LBSPPA1024_LBSPPB1024_LBSPPM0_LPA16_LPB16_LPM0_LRVW8_LWPMn1_MIAV0_MIWT8_8_MO40_NTn1_NTA2_NTB1_NTC1_NTD2_NTM0_NEPBS16_NLCA1_NLCB1_ONLL1_PGR2_PLR1_PKA1_SIA3_SS1_SPO1_SRVW0_SSO0_SVW8_SK3_SKFTR0_SKXCCM0_TLDS1_ULSGRO0_USL1_UIOFGRO0_USFGRO0_VSn1_VWA8_VWB8_WSGRA0_WSGRB0_WS64_WG32_8_1,0.0,1120.73,799.57
gfx950,256,8192,5120,2880,True,torch.bfloat16,torch.bfloat16,False,False,torch,0,0,190.1996,native,0.0,1270.2,844.18
gfx950,256,16384,128,2880,True,torch.bfloat16,torch.bfloat16,False,False,hipblaslt,440266,0,26.066,Cijk_Alik_Bljk_BBS_BH_Bias_HA_S_SAV_UserArgs_MT128x64x128_MI16x16x1_SN_LDSB0_AFC0_AFEM1_AFEM1_ASEM1_CLR1_CADS0_DTLA0_DTLB0_DTVA0_DTVB0_EPS0_FDSI0_GRPM1_GRVWA8_GRVWB8_GSUAMB_GLS0_ISA950_IU1_K1_LDSTI0_LBSPPA512_LBSPPB1024_LBSPPM0_LPA16_LPB16_LPM0_LRVW8_LWPMn1_MIAV0_MIWT2_4_MO40_NTn1_NTA0_NTB1_NTC1_NTD5_NTM0_NEPBS16_NLCA1_NLCB1_ONLL1_PGR2_PLR1_PKA1_SIA3_SS1_SPO1_SRVW0_SSO0_SVW2_SK0_SKFTR0_SKXCCM0_TLDS1_ULSGRO0_USL1_UIOFGRO0_USFGROn1_VSn1_VWA2_VWB4_WSGRA0_WSGRB0_WS64_WG64_4_1,0.0,463.42,3809.69
gfx950,256,16384,640,2880,True,torch.bfloat16,torch.bfloat16,False,False,hipblaslt,439562,0,56.8361,Cijk_Alik_Bljk_BBS_BH_Bias_HA_S_SAV_UserArgs_MT160x256x64_MI16x16x1_SN_LDSB0_AFC0_AFEM1_AFEM1_ASEM1_CLR1_CADS0_DTLA0_DTLB0_DTVA0_DTVB0_EPS0_FDSI0_GRPM1_GRVWA8_GRVWB8_GSU0_GSUAMB_GLS0_ISA950_IU1_K1_LDSTI0_LBSPPA256_LBSPPB512_LBSPPM0_LPA16_LPB16_LPM0_LRVW8_LWPMn1_MIAV0_MIWT10_4_MO40_NTn1_NTA0_NTB3_NTC0_NTD4_NTM0_NEPBS0_NLCA1_NLCB1_ONLL1_PGR2_PLR1_PKA1_SIA3_SS1_SPO0_SRVW0_SSO4_SVW2_SK3_SKFTR0_SKXCCM4_TLDS1_ULSGRO0_USL1_UIOFGRO0_USFGROn1_VSn1_VWA2_VWB4_WSGRA0_WSGRB0_WS64_WG16_16_1,0.0,1062.67,2094.26
gfx950,256,16384,2560,2880,True,torch.bfloat16,torch.bfloat16,False,False,hipblaslt,440623,0,198.5006,Cijk_Alik_Bljk_BBS_BH_Bias_HA_S_SAV_UserArgs_MT256x224x64_MI16x16x1_SN_LDSB0_AFC0_AFEM1_AFEM1_ASEM1_CLR0_CADS0_DTLA1_DTLB1_DTVA0_DTVB0_EPS0_FDSI0_GRPM1_GRVWA8_GRVWB8_GSU0_GSUAMB_GLS0_ISA950_IU1_K1_LDSTI0_LBSPPA1024_LBSPPB1024_LBSPPM0_LPA16_LPB16_LPM0_LRVW8_LWPMn1_MIAV0_MIWT8_7_MO40_NTn1_NTA3_NTB0_NTC6_NTD4_NTM0_NEPBS14_NLCA1_NLCB1_ONLL1_PGR2_PLR1_PKA1_SIA3_SS1_SPO0_SRVW0_SSO1_SVW8_SK3_SKFTR0_SKXCCM0_TLDS1_ULSGRO0_USL1_UIOFGRO0_USFGRO0_VSn1_VWA8_VWB1_WSGRA0_WSGRB0_WS64_WG32_8_1,0.0,1217.08,972.31
gfx950,256,16384,2880,512,True,torch.bfloat16,torch.bfloat16,False,False,hipblaslt,440282,0,64.2144,Cijk_Alik_Bljk_BBS_BH_Bias_HA_S_SAV_UserArgs_MT256x256x64_MI16x16x1_CMS_SN_LDSB0_AFC0_AFEM1_AFEM1_ASEM1_CLR0_CADS0_DTLA1_DTLB1_DTVA0_DTVB0_EPS0_FDSI0_GRPM1_GRVWA8_GRVWB8_GSU0_GSUAMB_GLS0_ISA950_IU1_K1_LDSTI0_LBSPPA1024_LBSPPB1024_LBSPPM0_LPA16_LPB16_LPM0_LRVW8_LWPMn1_MIAV0_MIWT8_8_MO40_NTn1_NTA3_NTB3_NTC5_NTD5_NTM0_NEPBS16_NLCA1_NLCB1_ONLL1_PGR2_PLR1_PKA1_SIA3_SS1_SPO0_SRVW0_SSO1_SVW8_SK3_SKFTR0_SKXCCM0_TLDS1_ULSGRO0_USL1_UIOFGRO0_USFGRO0_VSn1_VWA8_VWB8_WSGRA0_WSGRB0_WS64_WG32_8_1,0.0,752.45,1776.83
gfx950,256,16384,2880,2048,True,torch.bfloat16,torch.bfloat16,False,False,hipblaslt,441281,0,171.1839,Cijk_Alik_Bljk_BBS_BH_Bias_HA_S_SAV_UserArgs_MT256x256x64_MI16x16x1_CMS_SN_LDSB0_AFC0_AFEM1_AFEM1_ASEM1_CLR1_CADS0_DTLA1_DTLB1_DTVA0_DTVB0_EPS0_FDSI0_GRPM1_GRVWA8_GRVWB8_GSU0_GSUAMB_GLS0_ISA950_IU1_K1_LDSTI0_LBSPPA1024_LBSPPB1024_LBSPPM0_LPA16_LPB16_LPM0_LRVW8_LWPMn1_MIAV0_MIWT8_8_MO40_NTn1_NTA0_NTB0_NTC0_NTD4_NTM0_NEPBS0_NLCA1_NLCB1_ONLL1_PGR2_PLR1_PKA1_SIA3_SS1_SPO0_SRVW0_SSO0_SVW8_SK3_SKFTR0_SKXCCM0_TLDS1_ULSGRO0_USL1_UIOFGRO0_USFGRO0_VSn1_VWA8_VWB8_WSGRA0_WSGRB0_WS64_WG32_8_1,0.0,1129.04,1012.23
gfx950,256,16384,2880,4096,True,torch.bfloat16,torch.bfloat16,False,False,hipblaslt,440621,0,295.7822,Cijk_Alik_Bljk_BBS_BH_Bias_HA_S_SAV_UserArgs_MT256x256x64_MI16x16x1_SN_LDSB0_AFC0_AFEM1_AFEM1_ASEM1_CLR0_CADS0_DTLA1_DTLB1_DTVA0_DTVB0_EPS0_FDSI0_GRPM1_GRVWA8_GRVWB8_GSU0_GSUAMB_GLS0_ISA950_IU1_K1_LDSTI0_LBSPPA1024_LBSPPB1024_LBSPPM0_LPA16_LPB16_LPM0_LRVW8_LWPMn1_MIAV0_MIWT8_8_MO40_NTn1_NTA2_NTB2_NTC7_NTD5_NTM0_NEPBS0_NLCA1_NLCB1_ONLL1_PGR2_PLR1_PKA1_SIA3_SS1_SPO0_SRVW0_SSO1_SVW8_SK3_SKFTR0_SKXCCM0_TLDS2_ULSGRO0_USL1_UIOFGRO0_USFGRO0_VSn1_VWA8_VWB8_WSGRA0_WSGRB0_WS64_WG32_8_1,0.0,1306.86,852.6
gfx950,256,16384,5120,2880,True,torch.bfloat16,torch.bfloat16,False,False,torch,0,0,333.7082,native,0.0,1447.92,873.92
gfx950,256,32768,128,2880,True,torch.bfloat16,torch.bfloat16,False,False,hipblaslt,439632,0,37.0474,Cijk_Alik_Bljk_BBS_BH_Bias_HA_S_SAV_UserArgs_MT128x128x64_MI16x16x1_SN_LDSB0_AFC0_AFEM1_AFEM1_ASEM1_CLR1_CADS0_DTLA1_DTLB1_DTVA0_DTVB0_EPS0_FDSI0_GRPM1_GRVWA8_GRVWB8_GSU0_GSUAMB_GLS0_ISA950_IU1_K1_LDSTI0_LBSPPA1024_LBSPPB1024_LBSPPM0_LPA16_LPB16_LPM0_LRVW8_LWPMn1_MIAV1_MIWT8_2_MO40_NTn1_NTA3_NTB6_NTC0_NTD7_NTM0_NEPBS0_NLCA1_NLCB1_ONLL1_PGR2_PLR1_PKA1_SIA3_SS1_SPO0_SRVW0_SSO0_SVW8_SK3_SKFTR0_SKXCCM0_TLDS2_ULSGRO0_USL1_UIOFGRO0_USFGRO0_VSn1_VWA8_VWB2_WSGRA0_WSGRB0_WS64_WG16_16_1,0.0,652.12,5340.98
gfx950,256,32768,640,2880,True,torch.bfloat16,torch.bfloat16,False,False,hipblaslt,439562,0,116.4681,Cijk_Alik_Bljk_BBS_BH_Bias_HA_S_SAV_UserArgs_MT160x256x64_MI16x16x1_SN_LDSB0_AFC0_AFEM1_AFEM1_ASEM1_CLR1_CADS0_DTLA0_DTLB0_DTVA0_DTVB0_EPS0_FDSI0_GRPM1_GRVWA8_GRVWB8_GSU0_GSUAMB_GLS0_ISA950_IU1_K1_LDSTI0_LBSPPA256_LBSPPB512_LBSPPM0_LPA16_LPB16_LPM0_LRVW8_LWPMn1_MIAV0_MIWT10_4_MO40_NTn1_NTA0_NTB3_NTC0_NTD4_NTM0_NEPBS0_NLCA1_NLCB1_ONLL1_PGR2_PLR1_PKA1_SIA3_SS1_SPO0_SRVW0_SSO4_SVW2_SK3_SKFTR0_SKXCCM4_TLDS1_ULSGRO0_USL1_UIOFGRO0_USFGROn1_VSn1_VWA2_VWB4_WSGRA0_WSGRB0_WS64_WG16_16_1,0.0,1037.16,2012.34
gfx950,256,32768,2560,2880,True,torch.bfloat16,torch.bfloat16,False,False,torch,0,0,334.418,native,0.0,1444.85,1110.17
gfx950,256,32768,2880,512,True,torch.bfloat16,torch.bfloat16,False,False,hipblaslt,440614,0,120.9945,Cijk_Alik_Bljk_BBS_BH_Bias_HA_S_SAV_UserArgs_MT256x256x64_MI16x16x1_CMS_SN_LDSB0_AFC0_AFEM1_AFEM1_ASEM1_CLR0_CADS0_DTLA1_DTLB1_DTVA0_DTVB0_EPS0_FDSI0_GRPM1_GRVWA8_GRVWB8_GSU0_GSUAMB_GLS0_ISA950_IU1_K1_LDSTI0_LBSPPA1024_LBSPPB1024_LBSPPM0_LPA16_LPB16_LPM0_LRVW8_LWPMn1_MIAV0_MIWT8_8_MO40_NTn1_NTA1_NTB2_NTC5_NTD5_NTM0_NEPBS0_NLCA1_NLCB1_ONLL1_PGR2_PLR1_PKA1_SIA3_SS1_SPO1_SRVW0_SSO0_SVW8_SK3_SKFTR0_SKXCCM0_TLDS1_ULSGRO0_USL1_UIOFGRO0_USFGRO0_VSn1_VWA8_VWB8_WSGRA0_WSGRB0_WS64_WG32_8_1,0.0,798.69,1861.63
gfx950,256,32768,2880,2048,True,torch.bfloat16,torch.bfloat16,False,False,hipblaslt,441281,0,315.9056,Cijk_Alik_Bljk_BBS_BH_Bias_HA_S_SAV_UserArgs_MT256x256x64_MI16x16x1_CMS_SN_LDSB0_AFC0_AFEM1_AFEM1_ASEM1_CLR1_CADS0_DTLA1_DTLB1_DTVA0_DTVB0_EPS0_FDSI0_GRPM1_GRVWA8_GRVWB8_GSU0_GSUAMB_GLS0_ISA950_IU1_K1_LDSTI0_LBSPPA1024_LBSPPB1024_LBSPPM0_LPA16_LPB16_LPM0_LRVW8_LWPMn1_MIAV0_MIWT8_8_MO40_NTn1_NTA0_NTB0_NTC0_NTD4_NTM0_NEPBS0_NLCA1_NLCB1_ONLL1_PGR2_PLR1_PKA1_SIA3_SS1_SPO0_SRVW0_SSO0_SVW8_SK3_SKFTR0_SKXCCM0_TLDS1_ULSGRO0_USL1_UIOFGRO0_USFGRO0_VSn1_VWA8_VWB8_WSGRA0_WSGRB0_WS64_WG32_8_1,0.0,1223.62,1059.68
gfx950,256,32768,2880,4096,True,torch.bfloat16,torch.bfloat16,False,False,hipblaslt,441281,0,558.7287,Cijk_Alik_Bljk_BBS_BH_Bias_HA_S_SAV_UserArgs_MT256x256x64_MI16x16x1_CMS_SN_LDSB0_AFC0_AFEM1_AFEM1_ASEM1_CLR1_CADS0_DTLA1_DTLB1_DTVA0_DTVB0_EPS0_FDSI0_GRPM1_GRVWA8_GRVWB8_GSU0_GSUAMB_GLS0_ISA950_IU1_K1_LDSTI0_LBSPPA1024_LBSPPB1024_LBSPPM0_LPA16_LPB16_LPM0_LRVW8_LWPMn1_MIAV0_MIWT8_8_MO40_NTn1_NTA0_NTB0_NTC0_NTD4_NTM0_NEPBS0_NLCA1_NLCB1_ONLL1_PGR2_PLR1_PKA1_SIA3_SS1_SPO0_SRVW0_SSO0_SVW8_SK3_SKFTR0_SKXCCM0_TLDS1_ULSGRO0_USL1_UIOFGRO0_USFGRO0_VSn1_VWA8_VWB8_WSGRA0_WSGRB0_WS64_WG32_8_1,0.0,1383.67,860.48
gfx950,256,32768,5120,2880,True,torch.bfloat16,torch.bfloat16,False,False,torch,0,0,646.6555,native,0.0,1494.41,856.37
